artifacts/figure11/tvm/autotvm_kernels/relay_deepspeech2_tuned.1000.log
{"i": ["cuda -model=unknown", "topi_nn_conv2d", [["TENSOR", [1, 1, 340, 181], "float32"], ["TENSOR", [32, 1, 41, 11], "float32"], [2, 2], [0, 0, 0, 0], [1, 1], "NCHW", "float32"], {}, ["conv2d", [1, 1, 340, 181, "float32"], [32, 1, 41, 11, "float32"], [2, 2], [0, 0, 0, 0], [1, 1], "NCHW", "float32"], {"i": 2652396, "t": "direct", "c": "null", "e": [["tile_f", "sp", [-1, 2, 4, 1]], ["tile_y", "sp", [-1, 6, 1, 1]], ["tile_x", "sp", [-1, 1, 86, 1]], ["tile_rc", "sp", [-1, 1]], ["tile_ry", "sp", [-1, 1]], ["tile_rx", "sp", [-1, 11]], ["auto_unroll_max_step", "ot", 512], ["unroll_explicit", "ot", 1]]}], "r": [[9.786298143053646e-05], 0, 1.8381166458129883, 1582736933.2316306], "v": 0.1}
{"i": ["cuda -model=unknown", "topi_nn_conv2d", [["TENSOR", [1, 1, 340, 181], "float32"], ["TENSOR", [32, 1, 41, 11], "float32"], [2, 2], [0, 0, 0, 0], [1, 1], "NCHW", "float32"], {}, ["conv2d", [1, 1, 340, 181, "float32"], [32, 1, 41, 11, "float32"], [2, 2], [0, 0, 0, 0], [1, 1], "NCHW", "float32"], {"i": 1999452, "t": "direct", "c": "null", "e": [["tile_f", "sp", [-1, 4, 2, 2]], ["tile_y", "sp", [-1, 1, 5, 1]], ["tile_x", "sp", [-1, 1, 1, 86]], ["tile_rc", "sp", [-1, 1]], ["tile_ry", "sp", [-1, 41]], ["tile_rx", "sp", [-1, 1]], ["auto_unroll_max_step", "ot", 0], ["unroll_explicit", "ot", 1]]}], "r": [[0.0108748894], 0, 2.4178318977355957, 1582736935.462005], "v": 0.1}
{"i": ["cuda -model=unknown", "topi_nn_conv2d", [["TENSOR", [1, 1, 340, 181], "float32"], ["TENSOR", [32, 1, 41, 11], "float32"], [2, 2], [0, 0, 0, 0], [1, 1], "NCHW", "float32"], {}, ["conv2d", [1, 1, 340, 181, "float32"], [32, 1, 41, 11, "float32"], [2, 2], [0, 0, 0, 0], [1, 1], "NCHW", "float32"], {"i": 3017128, "t": "direct", "c": "null", "e": [["tile_f", "sp", [-1, 2, 8, 1]], ["tile_y", "sp", [-1, 1, 1, 6]], ["tile_x", "sp", [-1, 1, 1, 1]], ["tile_rc", "sp", [-1, 1]], ["tile_ry", "sp", [-1, 41]], ["tile_rx", "sp", [-1, 1]], ["auto_unroll_max_step", "ot", 1500], ["unroll_explicit", "ot", 1]]}], "r": [[0.0004447098281938326], 0, 2.044010877609253, 1582736937.0782623], "v": 0.1}
{"i": ["cuda -model=unknown", "topi_nn_conv2d", [["TENSOR", [1, 1, 340, 181], "float32"], ["TENSOR", [32, 1, 41, 11], "float32"], [2, 2], [0, 0, 0, 0], [1, 1], "NCHW", "float32"], {}, ["conv2d", [1, 1, 340, 181, "float32"], [32, 1, 41, 11, "float32"], [2, 2], [0, 0, 0, 0], [1, 1], "NCHW", "float32"], {"i": 3314931, "t": "direct", "c": "null", "e": [["tile_f", "sp", [-1, 1, 4, 1]], ["tile_y", "sp", [-1, 1, 3, 50]], ["tile_x", "sp", [-1, 2, 1, 1]], ["tile_rc", "sp", [-1, 1]], ["tile_ry", "sp", [-1, 41]], ["tile_rx", "sp", [-1, 11]], ["auto_unroll_max_step", "ot", 1500], ["unroll_explicit", "ot", 1]]}], "r": [[0.0003443168051948052], 0, 5.801304578781128, 1582736939.4603512], "v": 0.1}
{"i": ["cuda -model=unknown", "topi_nn_conv2d", [["TENSOR", [1, 1, 340, 181], "float32"], ["TENSOR", [32, 1, 41, 11], "float32"], [2, 2], [0, 0, 0, 0], [1, 1], "NCHW", "float32"], {}, ["conv2d", [1, 1, 340, 181, "float32"], [32, 1, 41, 11, "float32"], [2, 2], [0, 0, 0, 0], [1, 1], "NCHW", "float32"], {"i": 229672, "t": "direct", "c": "null", "e": [["tile_f", "sp", [-1, 2, 8, 1]], ["tile_y", "sp", [-1, 15, 2, 5]], ["tile_x", "sp", [-1, 1, 1, 2]], ["tile_rc", "sp", [-1, 1]], ["tile_ry", "sp", [-1, 41]], ["tile_rx", "sp", [-1, 1]], ["auto_unroll_max_step", "ot", 0], ["unroll_explicit", "ot", 0]]}], "r": [[0.0012996760086206897], 0, 1.9013991355895996, 1582736940.93229], "v": 0.1}
{"i": ["cuda -model=unknown", "topi_nn_conv2d", [["TENSOR", [1, 1, 340, 181], "float32"], ["TENSOR", [32, 1, 41, 11], "float32"], [2, 2], [0, 0, 0, 0], [1, 1], "NCHW", "float32"], {}, ["conv2d", [1, 1, 340, 181, "float32"], [32, 1, 41, 11, "float32"], [2, 2], [0, 0, 0, 0], [1, 1], "NCHW", "float32"], {"i": 3050030, "t": "direct", "c": "null", "e": [["tile_f", "sp", [-1, 1, 1, 8]], ["tile_y", "sp", [-1, 3, 5, 2]], ["tile_x", "sp", [-1, 1, 2, 1]], ["tile_rc", "sp", [-1, 1]], ["tile_ry", "sp", [-1, 41]], ["tile_rx", "sp", [-1, 1]], ["auto_unroll_max_step", "ot", 1500], ["unroll_explicit", "ot", 1]]}], "r": [[0.00012253084336419755], 0, 1.5551884174346924, 1582736942.1756196], "v": 0.1}
{"i": ["cuda -model=unknown", "topi_nn_conv2d", [["TENSOR", [1, 1, 340, 181], "float32"], ["TENSOR", [32, 1, 41, 11], "float32"], [2, 2], [0, 0, 0, 0], [1, 1], "NCHW", "float32"], {}, ["conv2d", [1, 1, 340, 181, "float32"], [32, 1, 41, 11, "float32"], [2, 2], [0, 0, 0, 0], [1, 1], "NCHW", "float32"], {"i": 1475558, "t": "direct", "c": "null", "e": [["tile_f", "sp", [-1, 8, 4, 1]], ["tile_y", "sp", [-1, 6, 5, 5]], ["tile_x", "sp", [-1, 1, 2, 1]], ["tile_rc", "sp", [-1, 1]], ["tile_ry", "sp", [-1, 1]], ["tile_rx", "sp", [-1, 11]], ["auto_unroll_max_step", "ot", 1500], ["unroll_explicit", "ot", 0]]}], "r": [[0.000780656458937198], 0, 2.4794161319732666, 1582736943.8305218], "v": 0.1}
{"i": ["cuda -model=unknown", "topi_nn_conv2d", [["TENSOR", [1, 1, 340, 181], "float32"], ["TENSOR", [32, 1, 41, 11], "float32"], [2, 2], [0, 0, 0, 0], [1, 1], "NCHW", "float32"], {}, ["conv2d", [1, 1, 340, 181, "float32"], [32, 1, 41, 11, "float32"], [2, 2], [0, 0, 0, 0], [1, 1], "NCHW", "float32"], {"i": 437524, "t": "direct", "c": "null", "e": [["tile_f", "sp", [-1, 1, 1, 16]], ["tile_y", "sp", [-1, 1, 1, 15]], ["tile_x", "sp", [-1, 1, 1, 1]], ["tile_rc", "sp", [-1, 1]], ["tile_ry", "sp", [-1, 41]], ["tile_rx", "sp", [-1, 11]], ["auto_unroll_max_step", "ot", 0], ["unroll_explicit", "ot", 0]]}], "r": [[0.0504463165], 0, 1.8986139297485352, 1582736949.8112879], "v": 0.1}
{"i": ["cuda -model=unknown", "topi_nn_conv2d", [["TENSOR", [1, 1, 340, 181], "float32"], ["TENSOR", [32, 1, 41, 11], "float32"], [2, 2], [0, 0, 0, 0], [1, 1], "NCHW", "float32"], {}, ["conv2d", [1, 1, 340, 181, "float32"], [32, 1, 41, 11, "float32"], [2, 2], [0, 0, 0, 0], [1, 1], "NCHW", "float32"], {"i": 2663460, "t": "direct", "c": "null", "e": [["tile_f", "sp", [-1, 2, 4, 4]], ["tile_y", "sp", [-1, 5, 15, 1]], ["tile_x", "sp", [-1, 1, 1, 2]], ["tile_rc", "sp", [-1, 1]], ["tile_ry", "sp", [-1, 1]], ["tile_rx", "sp", [-1, 11]], ["auto_unroll_max_step", "ot", 512], ["unroll_explicit", "ot", 1]]}], "r": [[0.00017051576154672395], 0, 1.8265154361724854, 1582736951.0711536], "v": 0.1}
{"i": ["cuda -model=unknown", "topi_nn_conv2d", [["TENSOR", [1, 1, 340, 181], "float32"], ["TENSOR", [32, 1, 41, 11], "float32"], [2, 2], [0, 0, 0, 0], [1, 1], "NCHW", "float32"], {}, ["conv2d", [1, 1, 340, 181, "float32"], [32, 1, 41, 11, "float32"], [2, 2], [0, 0, 0, 0], [1, 1], "NCHW", "float32"], {"i": 2378767, "t": "direct", "c": "null", "e": [["tile_f", "sp", [-1, 1, 1, 32]], ["tile_y", "sp", [-1, 50, 1, 3]], ["tile_x", "sp", [-1, 1, 1, 2]], ["tile_rc", "sp", [-1, 1]], ["tile_ry", "sp", [-1, 1]], ["tile_rx", "sp", [-1, 1]], ["auto_unroll_max_step", "ot", 512], ["unroll_explicit", "ot", 1]]}], "r": [[0.17420659775], 0, 5.425202131271362, 1582736954.1662579], "v": 0.1}
{"i": ["cuda -model=unknown", "topi_nn_conv2d", [["TENSOR", [1, 1, 340, 181], "float32"], ["TENSOR", [32, 1, 41, 11], "float32"], [2, 2], [0, 0, 0, 0], [1, 1], "NCHW", "float32"], {}, ["conv2d", [1, 1, 340, 181, "float32"], [32, 1, 41, 11, "float32"], [2, 2], [0, 0, 0, 0], [1, 1], "NCHW", "float32"], {"i": 2620115, "t": "direct", "c": "null", "e": [["tile_f", "sp", [-1, 1, 4, 4]], ["tile_y", "sp", [-1, 1, 15, 2]], ["tile_x", "sp", [-1, 1, 2, 1]], ["tile_rc", "sp", [-1, 1]], ["tile_ry", "sp", [-1, 1]], ["tile_rx", "sp", [-1, 11]], ["auto_unroll_max_step", "ot", 512], ["unroll_explicit", "ot", 1]]}], "r": [[0.00013806889501312335], 0, 2.048156499862671, 1582736955.4107254], "v": 0.1}
{"i": ["cuda -model=unknown", "topi_nn_conv2d", [["TENSOR", [1, 1, 340, 181], "float32"], ["TENSOR", [32, 1, 41, 11], "float32"], [2, 2], [0, 0, 0, 0], [1, 1], "NCHW", "float32"], {}, ["conv2d", [1, 1, 340, 181, "float32"], [32, 1, 41, 11, "float32"], [2, 2], [0, 0, 0, 0], [1, 1], "NCHW", "float32"], {"i": 1836840, "t": "direct", "c": "null", "e": [["tile_f", "sp", [-1, 1, 2, 4]], ["tile_y", "sp", [-1, 1, 1, 1]], ["tile_x", "sp", [-1, 2, 1, 43]], ["tile_rc", "sp", [-1, 1]], ["tile_ry", "sp", [-1, 1]], ["tile_rx", "sp", [-1, 1]], ["auto_unroll_max_step", "ot", 0], ["unroll_explicit", "ot", 1]]}], "r": [[0.0309377545], 0, 2.005758047103882, 1582736956.6253092], "v": 0.1}
{"i": ["cuda -model=unknown", "topi_nn_conv2d", [["TENSOR", [1, 1, 340, 181], "float32"], ["TENSOR", [32, 1, 41, 11], "float32"], [2, 2], [0, 0, 0, 0], [1, 1], "NCHW", "float32"], {}, ["conv2d", [1, 1, 340, 181, "float32"], [32, 1, 41, 11, "float32"], [2, 2], [0, 0, 0, 0], [1, 1], "NCHW", "float32"], {"i": 1111300, "t": "direct", "c": "null", "e": [["tile_f", "sp", [-1, 1, 1, 4]], ["tile_y", "sp", [-1, 6, 1, 1]], ["tile_x", "sp", [-1, 1, 1, 43]], ["tile_rc", "sp", [-1, 1]], ["tile_ry", "sp", [-1, 41]], ["tile_rx", "sp", [-1, 11]], ["auto_unroll_max_step", "ot", 512], ["unroll_explicit", "ot", 0]]}], "r": [[0.07006782325], 0, 2.9883952140808105, 1582736960.806352], "v": 0.1}
{"i": ["cuda -model=unknown", "topi_nn_conv2d", [["TENSOR", [1, 1, 340, 181], "float32"], ["TENSOR", [32, 1, 41, 11], "float32"], [2, 2], [0, 0, 0, 0], [1, 1], "NCHW", "float32"], {}, ["conv2d", [1, 1, 340, 181, "float32"], [32, 1, 41, 11, "float32"], [2, 2], [0, 0, 0, 0], [1, 1], "NCHW", "float32"], {"i": 83857, "t": "direct", "c": "null", "e": [["tile_f", "sp", [-1, 16, 1, 2]], ["tile_y", "sp", [-1, 15, 1, 2]], ["tile_x", "sp", [-1, 1, 1, 2]], ["tile_rc", "sp", [-1, 1]], ["tile_ry", "sp", [-1, 1]], ["tile_rx", "sp", [-1, 1]], ["auto_unroll_max_step", "ot", 0], ["unroll_explicit", "ot", 0]]}], "r": [[0.09835018575], 0, 3.1640946865081787, 1582736963.8231041], "v": 0.1}
{"i": ["cuda -model=unknown", "topi_nn_conv2d", [["TENSOR", [1, 1, 340, 181], "float32"], ["TENSOR", [32, 1, 41, 11], "float32"], [2, 2], [0, 0, 0, 0], [1, 1], "NCHW", "float32"], {}, ["conv2d", [1, 1, 340, 181, "float32"], [32, 1, 41, 11, "float32"], [2, 2], [0, 0, 0, 0], [1, 1], "NCHW", "float32"], {"i": 589729, "t": "direct", "c": "null", "e": [["tile_f", "sp", [-1, 1, 2, 8]], ["tile_y", "sp", [-1, 3, 5, 10]], ["tile_x", "sp", [-1, 2, 1, 1]], ["tile_rc", "sp", [-1, 1]], ["tile_ry", "sp", [-1, 1]], ["tile_rx", "sp", [-1, 1]], ["auto_unroll_max_step", "ot", 512], ["unroll_explicit", "ot", 0]]}], "r": [[0.024433470666666665], 0, 2.5319790840148926, 1582736965.6936872], "v": 0.1}
{"i": ["cuda -model=unknown", "topi_nn_conv2d", [["TENSOR", [1, 1, 340, 181], "float32"], ["TENSOR", [32, 1, 41, 11], "float32"], [2, 2], [0, 0, 0, 0], [1, 1], "NCHW", "float32"], {}, ["conv2d", [1, 1, 340, 181, "float32"], [32, 1, 41, 11, "float32"], [2, 2], [0, 0, 0, 0], [1, 1], "NCHW", "float32"], {"i": 4185, "t": "direct", "c": "null", "e": [["tile_f", "sp", [-1, 2, 2, 4]], ["tile_y", "sp", [-1, 5, 1, 3]], ["tile_x", "sp", [-1, 1, 1, 1]], ["tile_rc", "sp", [-1, 1]], ["tile_ry", "sp", [-1, 1]], ["tile_rx", "sp", [-1, 1]], ["auto_unroll_max_step", "ot", 0], ["unroll_explicit", "ot", 0]]}], "r": [[0.000945092679245283], 0, 1.3737382888793945, 1582736967.1174304], "v": 0.1}
{"i": ["cuda -model=unknown", "topi_nn_conv2d", [["TENSOR", [1, 1, 340, 181], "float32"], ["TENSOR", [32, 1, 41, 11], "float32"], [2, 2], [0, 0, 0, 0], [1, 1], "NCHW", "float32"], {}, ["conv2d", [1, 1, 340, 181, "float32"], [32, 1, 41, 11, "float32"], [2, 2], [0, 0, 0, 0], [1, 1], "NCHW", "float32"], {"i": 182093, "t": "direct", "c": "null", "e": [["tile_f", "sp", [-1, 2, 1, 4]], ["tile_y", "sp", [-1, 1, 75, 1]], ["tile_x", "sp", [-1, 1, 2, 1]], ["tile_rc", "sp", [-1, 1]], ["tile_ry", "sp", [-1, 41]], ["tile_rx", "sp", [-1, 1]], ["auto_unroll_max_step", "ot", 0], ["unroll_explicit", "ot", 0]]}], "r": [[8.181904142326076e-05], 0, 1.69883131980896, 1582736968.666274], "v": 0.1}
{"i": ["cuda -model=unknown", "topi_nn_conv2d", [["TENSOR", [1, 1, 340, 181], "float32"], ["TENSOR", [32, 1, 41, 11], "float32"], [2, 2], [0, 0, 0, 0], [1, 1], "NCHW", "float32"], {}, ["conv2d", [1, 1, 340, 181, "float32"], [32, 1, 41, 11, "float32"], [2, 2], [0, 0, 0, 0], [1, 1], "NCHW", "float32"], {"i": 2366550, "t": "direct", "c": "null", "e": [["tile_f", "sp", [-1, 1, 1, 8]], ["tile_y", "sp", [-1, 2, 3, 1]], ["tile_x", "sp", [-1, 1, 86, 1]], ["tile_rc", "sp", [-1, 1]], ["tile_ry", "sp", [-1, 1]], ["tile_rx", "sp", [-1, 1]], ["auto_unroll_max_step", "ot", 512], ["unroll_explicit", "ot", 1]]}], "r": [[0.0006628667218543046], 0, 1.386000156402588, 1582736969.6176548], "v": 0.1}
{"i": ["cuda -model=unknown", "topi_nn_conv2d", [["TENSOR", [1, 1, 340, 181], "float32"], ["TENSOR", [32, 1, 41, 11], "float32"], [2, 2], [0, 0, 0, 0], [1, 1], "NCHW", "float32"], {}, ["conv2d", [1, 1, 340, 181, "float32"], [32, 1, 41, 11, "float32"], [2, 2], [0, 0, 0, 0], [1, 1], "NCHW", "float32"], {"i": 1041888, "t": "direct", "c": "null", "e": [["tile_f", "sp", [-1, 4, 2, 1]], ["tile_y", "sp", [-1, 3, 25, 1]], ["tile_x", "sp", [-1, 1, 2, 1]], ["tile_rc", "sp", [-1, 1]], ["tile_ry", "sp", [-1, 41]], ["tile_rx", "sp", [-1, 11]], ["auto_unroll_max_step", "ot", 512], ["unroll_explicit", "ot", 0]]}], "r": [[0.00011282132465654375], 0, 1.483412504196167, 1582736971.0994186], "v": 0.1}
{"i": ["cuda -model=unknown", "topi_nn_conv2d", [["TENSOR", [1, 1, 340, 181], "float32"], ["TENSOR", [32, 1, 41, 11], "float32"], [2, 2], [0, 0, 0, 0], [1, 1], "NCHW", "float32"], {}, ["conv2d", [1, 1, 340, 181, "float32"], [32, 1, 41, 11, "float32"], [2, 2], [0, 0, 0, 0], [1, 1], "NCHW", "float32"], {"i": 368958, "t": "direct", "c": "null", "e": [["tile_f", "sp", [-1, 1, 4, 2]], ["tile_y", "sp", [-1, 6, 5, 1]], ["tile_x", "sp", [-1, 1, 1, 2]], ["tile_rc", "sp", [-1, 1]], ["tile_ry", "sp", [-1, 1]], ["tile_rx", "sp", [-1, 11]], ["auto_unroll_max_step", "ot", 0], ["unroll_explicit", "ot", 0]]}], "r": [[0.000451062447887324], 0, 1.3934495449066162, 1582736972.541559], "v": 0.1}
{"i": ["cuda -model=unknown", "topi_nn_conv2d", [["TENSOR", [1, 1, 340, 181], "float32"], ["TENSOR", [32, 1, 41, 11], "float32"], [2, 2], [0, 0, 0, 0], [1, 1], "NCHW", "float32"], {}, ["conv2d", [1, 1, 340, 181, "float32"], [32, 1, 41, 11, "float32"], [2, 2], [0, 0, 0, 0], [1, 1], "NCHW", "float32"], {"i": 2909069, "t": "direct", "c": "null", "e": [["tile_f", "sp", [-1, 2, 1, 4]], ["tile_y", "sp", [-1, 2, 5, 5]], ["tile_x", "sp", [-1, 1, 2, 1]], ["tile_rc", "sp", [-1, 1]], ["tile_ry", "sp", [-1, 1]], ["tile_rx", "sp", [-1, 1]], ["auto_unroll_max_step", "ot", 1500], ["unroll_explicit", "ot", 1]]}], "r": [[0.00034771382429501087], 0, 2.634770631790161, 1582736973.890107], "v": 0.1}
{"i": ["cuda -model=unknown", "topi_nn_conv2d", [["TENSOR", [1, 1, 340, 181], "float32"], ["TENSOR", [32, 1, 41, 11], "float32"], [2, 2], [0, 0, 0, 0], [1, 1], "NCHW", "float32"], {}, ["conv2d", [1, 1, 340, 181, "float32"], [32, 1, 41, 11, "float32"], [2, 2], [0, 0, 0, 0], [1, 1], "NCHW", "float32"], {"i": 2730470, "t": "direct", "c": "null", "e": [["tile_f", "sp", [-1, 2, 1, 2]], ["tile_y", "sp", [-1, 5, 1, 6]], ["tile_x", "sp", [-1, 1, 1, 1]], ["tile_rc", "sp", [-1, 1]], ["tile_ry", "sp", [-1, 41]], ["tile_rx", "sp", [-1, 11]], ["auto_unroll_max_step", "ot", 512], ["unroll_explicit", "ot", 1]]}], "r": [[0.001288064282051282], 0, 1.3638818264007568, 1582736975.0775876], "v": 0.1}
{"i": ["cuda -model=unknown", "topi_nn_conv2d", [["TENSOR", [1, 1, 340, 181], "float32"], ["TENSOR", [32, 1, 41, 11], "float32"], [2, 2], [0, 0, 0, 0], [1, 1], "NCHW", "float32"], {}, ["conv2d", [1, 1, 340, 181, "float32"], [32, 1, 41, 11, "float32"], [2, 2], [0, 0, 0, 0], [1, 1], "NCHW", "float32"], {"i": 659883, "t": "direct", "c": "null", "e": [["tile_f", "sp", [-1, 1, 16, 2]], ["tile_y", "sp", [-1, 2, 3, 5]], ["tile_x", "sp", [-1, 1, 1, 2]], ["tile_rc", "sp", [-1, 1]], ["tile_ry", "sp", [-1, 1]], ["tile_rx", "sp", [-1, 1]], ["auto_unroll_max_step", "ot", 512], ["unroll_explicit", "ot", 0]]}], "r": [[0.0002514470052539404], 0, 1.6144676208496094, 1582736980.0437753], "v": 0.1}
{"i": ["cuda -model=unknown", "topi_nn_conv2d", [["TENSOR", [1, 1, 340, 181], "float32"], ["TENSOR", [32, 1, 41, 11], "float32"], [2, 2], [0, 0, 0, 0], [1, 1], "NCHW", "float32"], {}, ["conv2d", [1, 1, 340, 181, "float32"], [32, 1, 41, 11, "float32"], [2, 2], [0, 0, 0, 0], [1, 1], "NCHW", "float32"], {"i": 1734934, "t": "direct", "c": "null", "e": [["tile_f", "sp", [-1, 1, 2, 16]], ["tile_y", "sp", [-1, 5, 2, 5]], ["tile_x", "sp", [-1, 2, 1, 1]], ["tile_rc", "sp", [-1, 1]], ["tile_ry", "sp", [-1, 1]], ["tile_rx", "sp", [-1, 1]], ["auto_unroll_max_step", "ot", 0], ["unroll_explicit", "ot", 1]]}], "r": [[0.042133912], 0, 1.6514160633087158, 1582736981.6606312], "v": 0.1}
{"i": ["cuda -model=unknown", "topi_nn_conv2d", [["TENSOR", [1, 1, 340, 181], "float32"], ["TENSOR", [32, 1, 41, 11], "float32"], [2, 2], [0, 0, 0, 0], [1, 1], "NCHW", "float32"], {}, ["conv2d", [1, 1, 340, 181, "float32"], [32, 1, 41, 11, "float32"], [2, 2], [0, 0, 0, 0], [1, 1], "NCHW", "float32"], {"i": 1781066, "t": "direct", "c": "null", "e": [["tile_f", "sp", [-1, 4, 2, 4]], ["tile_y", "sp", [-1, 3, 1, 10]], ["tile_x", "sp", [-1, 1, 43, 1]], ["tile_rc", "sp", [-1, 1]], ["tile_ry", "sp", [-1, 1]], ["tile_rx", "sp", [-1, 1]], ["auto_unroll_max_step", "ot", 0], ["unroll_explicit", "ot", 1]]}], "r": [[0.0108336266], 0, 1.5030460357666016, 1582736983.0950494], "v": 0.1}
{"i": ["cuda -model=unknown", "topi_nn_conv2d", [["TENSOR", [1, 1, 340, 181], "float32"], ["TENSOR", [32, 1, 41, 11], "float32"], [2, 2], [0, 0, 0, 0], [1, 1], "NCHW", "float32"], {}, ["conv2d", [1, 1, 340, 181, "float32"], [32, 1, 41, 11, "float32"], [2, 2], [0, 0, 0, 0], [1, 1], "NCHW", "float32"], {"i": 3213208, "t": "direct", "c": "null", "e": [["tile_f", "sp", [-1, 1, 2, 4]], ["tile_y", "sp", [-1, 1, 2, 5]], ["tile_x", "sp", [-1, 1, 43, 1]], ["tile_rc", "sp", [-1, 1]], ["tile_ry", "sp", [-1, 1]], ["tile_rx", "sp", [-1, 11]], ["auto_unroll_max_step", "ot", 1500], ["unroll_explicit", "ot", 1]]}], "r": [[7.555207848837209e-05], 0, 1.5321447849273682, 1582736984.314073], "v": 0.1}
{"i": ["cuda -model=unknown", "topi_nn_conv2d", [["TENSOR", [1, 1, 340, 181], "float32"], ["TENSOR", [32, 1, 41, 11], "float32"], [2, 2], [0, 0, 0, 0], [1, 1], "NCHW", "float32"], {}, ["conv2d", [1, 1, 340, 181, "float32"], [32, 1, 41, 11, "float32"], [2, 2], [0, 0, 0, 0], [1, 1], "NCHW", "float32"], {"i": 1250750, "t": "direct", "c": "null", "e": [["tile_f", "sp", [-1, 1, 1, 8]], ["tile_y", "sp", [-1, 6, 1, 5]], ["tile_x", "sp", [-1, 1, 43, 2]], ["tile_rc", "sp", [-1, 1]], ["tile_ry", "sp", [-1, 1]], ["tile_rx", "sp", [-1, 1]], ["auto_unroll_max_step", "ot", 1500], ["unroll_explicit", "ot", 0]]}], "r": [[0.0855177315], 0, 5.712807893753052, 1582736987.8124218], "v": 0.1}
{"i": ["cuda -model=unknown", "topi_nn_conv2d", [["TENSOR", [1, 1, 340, 181], "float32"], ["TENSOR", [32, 1, 41, 11], "float32"], [2, 2], [0, 0, 0, 0], [1, 1], "NCHW", "float32"], {}, ["conv2d", [1, 1, 340, 181, "float32"], [32, 1, 41, 11, "float32"], [2, 2], [0, 0, 0, 0], [1, 1], "NCHW", "float32"], {"i": 2028577, "t": "direct", "c": "null", "e": [["tile_f", "sp", [-1, 1, 8, 2]], ["tile_y", "sp", [-1, 3, 5, 2]], ["tile_x", "sp", [-1, 43, 1, 1]], ["tile_rc", "sp", [-1, 1]], ["tile_ry", "sp", [-1, 1]], ["tile_rx", "sp", [-1, 11]], ["auto_unroll_max_step", "ot", 0], ["unroll_explicit", "ot", 1]]}], "r": [[0.004063975184210526], 0, 2.03261661529541, 1582736989.4464717], "v": 0.1}
{"i": ["cuda -model=unknown", "topi_nn_conv2d", [["TENSOR", [1, 1, 340, 181], "float32"], ["TENSOR", [32, 1, 41, 11], "float32"], [2, 2], [0, 0, 0, 0], [1, 1], "NCHW", "float32"], {}, ["conv2d", [1, 1, 340, 181, "float32"], [32, 1, 41, 11, "float32"], [2, 2], [0, 0, 0, 0], [1, 1], "NCHW", "float32"], {"i": 1044825, "t": "direct", "c": "null", "e": [["tile_f", "sp", [-1, 1, 8, 2]], ["tile_y", "sp", [-1, 30, 1, 5]], ["tile_x", "sp", [-1, 1, 2, 1]], ["tile_rc", "sp", [-1, 1]], ["tile_ry", "sp", [-1, 41]], ["tile_rx", "sp", [-1, 11]], ["auto_unroll_max_step", "ot", 512], ["unroll_explicit", "ot", 0]]}], "r": [[0.0011741256423357664], 0, 4.004080295562744, 1582736997.0463088], "v": 0.1}
{"i": ["cuda -model=unknown", "topi_nn_conv2d", [["TENSOR", [1, 1, 340, 181], "float32"], ["TENSOR", [32, 1, 41, 11], "float32"], [2, 2], [0, 0, 0, 0], [1, 1], "NCHW", "float32"], {}, ["conv2d", [1, 1, 340, 181, "float32"], [32, 1, 41, 11, "float32"], [2, 2], [0, 0, 0, 0], [1, 1], "NCHW", "float32"], {"i": 225188, "t": "direct", "c": "null", "e": [["tile_f", "sp", [-1, 2, 4, 1]], ["tile_y", "sp", [-1, 10, 3, 1]], ["tile_x", "sp", [-1, 1, 1, 2]], ["tile_rc", "sp", [-1, 1]], ["tile_ry", "sp", [-1, 41]], ["tile_rx", "sp", [-1, 1]], ["auto_unroll_max_step", "ot", 0], ["unroll_explicit", "ot", 0]]}], "r": [[0.00014908758834586465], 0, 1.448117733001709, 1582736998.2777488], "v": 0.1}
{"i": ["cuda -model=unknown", "topi_nn_conv2d", [["TENSOR", [1, 1, 340, 181], "float32"], ["TENSOR", [32, 1, 41, 11], "float32"], [2, 2], [0, 0, 0, 0], [1, 1], "NCHW", "float32"], {}, ["conv2d", [1, 1, 340, 181, "float32"], [32, 1, 41, 11, "float32"], [2, 2], [0, 0, 0, 0], [1, 1], "NCHW", "float32"], {"i": 3048387, "t": "direct", "c": "null", "e": [["tile_f", "sp", [-1, 2, 2, 2]], ["tile_y", "sp", [-1, 1, 10, 1]], ["tile_x", "sp", [-1, 1, 2, 1]], ["tile_rc", "sp", [-1, 1]], ["tile_ry", "sp", [-1, 41]], ["tile_rx", "sp", [-1, 1]], ["auto_unroll_max_step", "ot", 1500], ["unroll_explicit", "ot", 1]]}], "r": [[0.0002269902354788069], 0, 1.9657275676727295, 1582737058.3655696], "v": 0.1}
{"i": ["cuda -model=unknown", "topi_nn_conv2d", [["TENSOR", [1, 1, 340, 181], "float32"], ["TENSOR", [32, 1, 41, 11], "float32"], [2, 2], [0, 0, 0, 0], [1, 1], "NCHW", "float32"], {}, ["conv2d", [1, 1, 340, 181, "float32"], [32, 1, 41, 11, "float32"], [2, 2], [0, 0, 0, 0], [1, 1], "NCHW", "float32"], {"i": 2474947, "t": "direct", "c": "null", "e": [["tile_f", "sp", [-1, 2, 2, 2]], ["tile_y", "sp", [-1, 1, 10, 1]], ["tile_x", "sp", [-1, 1, 2, 1]], ["tile_rc", "sp", [-1, 1]], ["tile_ry", "sp", [-1, 41]], ["tile_rx", "sp", [-1, 1]], ["auto_unroll_max_step", "ot", 512], ["unroll_explicit", "ot", 1]]}], "r": [[0.00022490228190743337], 0, 3.1791770458221436, 1582737059.7868018], "v": 0.1}
{"i": ["cuda -model=unknown", "topi_nn_conv2d", [["TENSOR", [1, 1, 340, 181], "float32"], ["TENSOR", [32, 1, 41, 11], "float32"], [2, 2], [0, 0, 0, 0], [1, 1], "NCHW", "float32"], {}, ["conv2d", [1, 1, 340, 181, "float32"], [32, 1, 41, 11, "float32"], [2, 2], [0, 0, 0, 0], [1, 1], "NCHW", "float32"], {"i": 1901507, "t": "direct", "c": "null", "e": [["tile_f", "sp", [-1, 2, 2, 2]], ["tile_y", "sp", [-1, 1, 10, 1]], ["tile_x", "sp", [-1, 1, 2, 1]], ["tile_rc", "sp", [-1, 1]], ["tile_ry", "sp", [-1, 41]], ["tile_rx", "sp", [-1, 1]], ["auto_unroll_max_step", "ot", 0], ["unroll_explicit", "ot", 1]]}], "r": [[0.0002185494868603043], 0, 1.8003959655761719, 1582737060.986219], "v": 0.1}
{"i": ["cuda -model=unknown", "topi_nn_conv2d", [["TENSOR", [1, 1, 340, 181], "float32"], ["TENSOR", [32, 1, 41, 11], "float32"], [2, 2], [0, 0, 0, 0], [1, 1], "NCHW", "float32"], {}, ["conv2d", [1, 1, 340, 181, "float32"], [32, 1, 41, 11, "float32"], [2, 2], [0, 0, 0, 0], [1, 1], "NCHW", "float32"], {"i": 2474764, "t": "direct", "c": "null", "e": [["tile_f", "sp", [-1, 2, 4, 1]], ["tile_y", "sp", [-1, 1, 6, 1]], ["tile_x", "sp", [-1, 1, 2, 1]], ["tile_rc", "sp", [-1, 1]], ["tile_ry", "sp", [-1, 41]], ["tile_rx", "sp", [-1, 1]], ["auto_unroll_max_step", "ot", 512], ["unroll_explicit", "ot", 1]]}], "r": [[0.00028561512164579605], 0, 1.8883681297302246, 1582737062.2160664], "v": 0.1}
{"i": ["cuda -model=unknown", "topi_nn_conv2d", [["TENSOR", [1, 1, 340, 181], "float32"], ["TENSOR", [32, 1, 41, 11], "float32"], [2, 2], [0, 0, 0, 0], [1, 1], "NCHW", "float32"], {}, ["conv2d", [1, 1, 340, 181, "float32"], [32, 1, 41, 11, "float32"], [2, 2], [0, 0, 0, 0], [1, 1], "NCHW", "float32"], {"i": 3048204, "t": "direct", "c": "null", "e": [["tile_f", "sp", [-1, 2, 4, 1]], ["tile_y", "sp", [-1, 1, 6, 1]], ["tile_x", "sp", [-1, 1, 2, 1]], ["tile_rc", "sp", [-1, 1]], ["tile_ry", "sp", [-1, 41]], ["tile_rx", "sp", [-1, 1]], ["auto_unroll_max_step", "ot", 1500], ["unroll_explicit", "ot", 1]]}], "r": [[0.00030725903937007875], 0, 2.6361377239227295, 1582737063.3978071], "v": 0.1}
{"i": ["cuda -model=unknown", "topi_nn_conv2d", [["TENSOR", [1, 1, 340, 181], "float32"], ["TENSOR", [32, 1, 41, 11], "float32"], [2, 2], [0, 0, 0, 0], [1, 1], "NCHW", "float32"], {}, ["conv2d", [1, 1, 340, 181, "float32"], [32, 1, 41, 11, "float32"], [2, 2], [0, 0, 0, 0], [1, 1], "NCHW", "float32"], {"i": 3048611, "t": "direct", "c": "null", "e": [["tile_f", "sp", [-1, 2, 2, 2]], ["tile_y", "sp", [-1, 1, 15, 1]], ["tile_x", "sp", [-1, 1, 2, 1]], ["tile_rc", "sp", [-1, 1]], ["tile_ry", "sp", [-1, 41]], ["tile_rx", "sp", [-1, 1]], ["auto_unroll_max_step", "ot", 1500], ["unroll_explicit", "ot", 1]]}], "r": [[0.00017741924354657687], 0, 2.7933008670806885, 1582737064.894001], "v": 0.1}
{"i": ["cuda -model=unknown", "topi_nn_conv2d", [["TENSOR", [1, 1, 340, 181], "float32"], ["TENSOR", [32, 1, 41, 11], "float32"], [2, 2], [0, 0, 0, 0], [1, 1], "NCHW", "float32"], {}, ["conv2d", [1, 1, 340, 181, "float32"], [32, 1, 41, 11, "float32"], [2, 2], [0, 0, 0, 0], [1, 1], "NCHW", "float32"], {"i": 2475171, "t": "direct", "c": "null", "e": [["tile_f", "sp", [-1, 2, 2, 2]], ["tile_y", "sp", [-1, 1, 15, 1]], ["tile_x", "sp", [-1, 1, 2, 1]], ["tile_rc", "sp", [-1, 1]], ["tile_ry", "sp", [-1, 41]], ["tile_rx", "sp", [-1, 1]], ["auto_unroll_max_step", "ot", 512], ["unroll_explicit", "ot", 1]]}], "r": [[0.00017745815050167226], 0, 2.752361297607422, 1582737066.3674312], "v": 0.1}
{"i": ["cuda -model=unknown", "topi_nn_conv2d", [["TENSOR", [1, 1, 340, 181], "float32"], ["TENSOR", [32, 1, 41, 11], "float32"], [2, 2], [0, 0, 0, 0], [1, 1], "NCHW", "float32"], {}, ["conv2d", [1, 1, 340, 181, "float32"], [32, 1, 41, 11, "float32"], [2, 2], [0, 0, 0, 0], [1, 1], "NCHW", "float32"], {"i": 3048367, "t": "direct", "c": "null", "e": [["tile_f", "sp", [-1, 2, 2, 1]], ["tile_y", "sp", [-1, 1, 10, 1]], ["tile_x", "sp", [-1, 1, 2, 1]], ["tile_rc", "sp", [-1, 1]], ["tile_ry", "sp", [-1, 41]], ["tile_rx", "sp", [-1, 1]], ["auto_unroll_max_step", "ot", 1500], ["unroll_explicit", "ot", 1]]}], "r": [[0.00029848649343339586], 0, 2.9046077728271484, 1582737067.7608993], "v": 0.1}
{"i": ["cuda -model=unknown", "topi_nn_conv2d", [["TENSOR", [1, 1, 340, 181], "float32"], ["TENSOR", [32, 1, 41, 11], "float32"], [2, 2], [0, 0, 0, 0], [1, 1], "NCHW", "float32"], {}, ["conv2d", [1, 1, 340, 181, "float32"], [32, 1, 41, 11, "float32"], [2, 2], [0, 0, 0, 0], [1, 1], "NCHW", "float32"], {"i": 2474927, "t": "direct", "c": "null", "e": [["tile_f", "sp", [-1, 2, 2, 1]], ["tile_y", "sp", [-1, 1, 10, 1]], ["tile_x", "sp", [-1, 1, 2, 1]], ["tile_rc", "sp", [-1, 1]], ["tile_ry", "sp", [-1, 41]], ["tile_rx", "sp", [-1, 1]], ["auto_unroll_max_step", "ot", 512], ["unroll_explicit", "ot", 1]]}], "r": [[0.00028100920390070923], 0, 3.1903011798858643, 1582737069.116271], "v": 0.1}
{"i": ["cuda -model=unknown", "topi_nn_conv2d", [["TENSOR", [1, 1, 340, 181], "float32"], ["TENSOR", [32, 1, 41, 11], "float32"], [2, 2], [0, 0, 0, 0], [1, 1], "NCHW", "float32"], {}, ["conv2d", [1, 1, 340, 181, "float32"], [32, 1, 41, 11, "float32"], [2, 2], [0, 0, 0, 0], [1, 1], "NCHW", "float32"], {"i": 2519971, "t": "direct", "c": "null", "e": [["tile_f", "sp", [-1, 2, 2, 2]], ["tile_y", "sp", [-1, 1, 15, 1]], ["tile_x", "sp", [-1, 1, 1, 2]], ["tile_rc", "sp", [-1, 1]], ["tile_ry", "sp", [-1, 41]], ["tile_rx", "sp", [-1, 1]], ["auto_unroll_max_step", "ot", 512], ["unroll_explicit", "ot", 1]]}], "r": [[0.0001627217561728395], 0, 2.3690972328186035, 1582737070.6859722], "v": 0.1}
{"i": ["cuda -model=unknown", "topi_nn_conv2d", [["TENSOR", [1, 1, 340, 181], "float32"], ["TENSOR", [32, 1, 41, 11], "float32"], [2, 2], [0, 0, 0, 0], [1, 1], "NCHW", "float32"], {}, ["conv2d", [1, 1, 340, 181, "float32"], [32, 1, 41, 11, "float32"], [2, 2], [0, 0, 0, 0], [1, 1], "NCHW", "float32"], {"i": 3093411, "t": "direct", "c": "null", "e": [["tile_f", "sp", [-1, 2, 2, 2]], ["tile_y", "sp", [-1, 1, 15, 1]], ["tile_x", "sp", [-1, 1, 1, 2]], ["tile_rc", "sp", [-1, 1]], ["tile_ry", "sp", [-1, 41]], ["tile_rx", "sp", [-1, 1]], ["auto_unroll_max_step", "ot", 1500], ["unroll_explicit", "ot", 1]]}], "r": [[0.0001627999229979466], 0, 2.3558120727539062, 1582737072.2053795], "v": 0.1}
{"i": ["cuda -model=unknown", "topi_nn_conv2d", [["TENSOR", [1, 1, 340, 181], "float32"], ["TENSOR", [32, 1, 41, 11], "float32"], [2, 2], [0, 0, 0, 0], [1, 1], "NCHW", "float32"], {}, ["conv2d", [1, 1, 340, 181, "float32"], [32, 1, 41, 11, "float32"], [2, 2], [0, 0, 0, 0], [1, 1], "NCHW", "float32"], {"i": 1901324, "t": "direct", "c": "null", "e": [["tile_f", "sp", [-1, 2, 4, 1]], ["tile_y", "sp", [-1, 1, 6, 1]], ["tile_x", "sp", [-1, 1, 2, 1]], ["tile_rc", "sp", [-1, 1]], ["tile_ry", "sp", [-1, 41]], ["tile_rx", "sp", [-1, 1]], ["auto_unroll_max_step", "ot", 0], ["unroll_explicit", "ot", 1]]}], "r": [[0.0002874658754512635], 0, 2.2757346630096436, 1582737073.893972], "v": 0.1}
{"i": ["cuda -model=unknown", "topi_nn_conv2d", [["TENSOR", [1, 1, 340, 181], "float32"], ["TENSOR", [32, 1, 41, 11], "float32"], [2, 2], [0, 0, 0, 0], [1, 1], "NCHW", "float32"], {}, ["conv2d", [1, 1, 340, 181, "float32"], [32, 1, 41, 11, "float32"], [2, 2], [0, 0, 0, 0], [1, 1], "NCHW", "float32"], {"i": 1901731, "t": "direct", "c": "null", "e": [["tile_f", "sp", [-1, 2, 2, 2]], ["tile_y", "sp", [-1, 1, 15, 1]], ["tile_x", "sp", [-1, 1, 2, 1]], ["tile_rc", "sp", [-1, 1]], ["tile_ry", "sp", [-1, 41]], ["tile_rx", "sp", [-1, 1]], ["auto_unroll_max_step", "ot", 0], ["unroll_explicit", "ot", 1]]}], "r": [[0.00015886645145145146], 0, 2.8747198581695557, 1582737075.4981704], "v": 0.1}
{"i": ["cuda -model=unknown", "topi_nn_conv2d", [["TENSOR", [1, 1, 340, 181], "float32"], ["TENSOR", [32, 1, 41, 11], "float32"], [2, 2], [0, 0, 0, 0], [1, 1], "NCHW", "float32"], {}, ["conv2d", [1, 1, 340, 181, "float32"], [32, 1, 41, 11, "float32"], [2, 2], [0, 0, 0, 0], [1, 1], "NCHW", "float32"], {"i": 1901487, "t": "direct", "c": "null", "e": [["tile_f", "sp", [-1, 2, 2, 1]], ["tile_y", "sp", [-1, 1, 10, 1]], ["tile_x", "sp", [-1, 1, 2, 1]], ["tile_rc", "sp", [-1, 1]], ["tile_ry", "sp", [-1, 41]], ["tile_rx", "sp", [-1, 1]], ["auto_unroll_max_step", "ot", 0], ["unroll_explicit", "ot", 1]]}], "r": [[0.000285699821942446], 0, 2.2313618659973145, 1582737077.1189437], "v": 0.1}
{"i": ["cuda -model=unknown", "topi_nn_conv2d", [["TENSOR", [1, 1, 340, 181], "float32"], ["TENSOR", [32, 1, 41, 11], "float32"], [2, 2], [0, 0, 0, 0], [1, 1], "NCHW", "float32"], {}, ["conv2d", [1, 1, 340, 181, "float32"], [32, 1, 41, 11, "float32"], [2, 2], [0, 0, 0, 0], [1, 1], "NCHW", "float32"], {"i": 2519728, "t": "direct", "c": "null", "e": [["tile_f", "sp", [-1, 4, 2, 1]], ["tile_y", "sp", [-1, 1, 10, 1]], ["tile_x", "sp", [-1, 1, 1, 2]], ["tile_rc", "sp", [-1, 1]], ["tile_ry", "sp", [-1, 41]], ["tile_rx", "sp", [-1, 1]], ["auto_unroll_max_step", "ot", 512], ["unroll_explicit", "ot", 1]]}], "r": [[0.00018619], 0, 2.7211720943450928, 1582737078.6578765], "v": 0.1}
{"i": ["cuda -model=unknown", "topi_nn_conv2d", [["TENSOR", [1, 1, 340, 181], "float32"], ["TENSOR", [32, 1, 41, 11], "float32"], [2, 2], [0, 0, 0, 0], [1, 1], "NCHW", "float32"], {}, ["conv2d", [1, 1, 340, 181, "float32"], [32, 1, 41, 11, "float32"], [2, 2], [0, 0, 0, 0], [1, 1], "NCHW", "float32"], {"i": 3093168, "t": "direct", "c": "null", "e": [["tile_f", "sp", [-1, 4, 2, 1]], ["tile_y", "sp", [-1, 1, 10, 1]], ["tile_x", "sp", [-1, 1, 1, 2]], ["tile_rc", "sp", [-1, 1]], ["tile_ry", "sp", [-1, 41]], ["tile_rx", "sp", [-1, 1]], ["auto_unroll_max_step", "ot", 1500], ["unroll_explicit", "ot", 1]]}], "r": [[0.00018606540636042403], 0, 3.394098997116089, 1582737080.1782851], "v": 0.1}
{"i": ["cuda -model=unknown", "topi_nn_conv2d", [["TENSOR", [1, 1, 340, 181], "float32"], ["TENSOR", [32, 1, 41, 11], "float32"], [2, 2], [0, 0, 0, 0], [1, 1], "NCHW", "float32"], {}, ["conv2d", [1, 1, 340, 181, "float32"], [32, 1, 41, 11, "float32"], [2, 2], [0, 0, 0, 0], [1, 1], "NCHW", "float32"], {"i": 1946531, "t": "direct", "c": "null", "e": [["tile_f", "sp", [-1, 2, 2, 2]], ["tile_y", "sp", [-1, 1, 15, 1]], ["tile_x", "sp", [-1, 1, 1, 2]], ["tile_rc", "sp", [-1, 1]], ["tile_ry", "sp", [-1, 41]], ["tile_rx", "sp", [-1, 1]], ["auto_unroll_max_step", "ot", 0], ["unroll_explicit", "ot", 1]]}], "r": [[0.00014583067906976744], 0, 2.933415412902832, 1582737081.3794487], "v": 0.1}
{"i": ["cuda -model=unknown", "topi_nn_conv2d", [["TENSOR", [1, 1, 340, 181], "float32"], ["TENSOR", [32, 1, 41, 11], "float32"], [2, 2], [0, 0, 0, 0], [1, 1], "NCHW", "float32"], {}, ["conv2d", [1, 1, 340, 181, "float32"], [32, 1, 41, 11, "float32"], [2, 2], [0, 0, 0, 0], [1, 1], "NCHW", "float32"], {"i": 3021507, "t": "direct", "c": "null", "e": [["tile_f", "sp", [-1, 2, 2, 2]], ["tile_y", "sp", [-1, 1, 10, 1]], ["tile_x", "sp", [-1, 2, 1, 1]], ["tile_rc", "sp", [-1, 1]], ["tile_ry", "sp", [-1, 41]], ["tile_rx", "sp", [-1, 1]], ["auto_unroll_max_step", "ot", 1500], ["unroll_explicit", "ot", 1]]}], "r": [[0.00018670636288416076], 0, 1.6432197093963623, 1582737082.5858939], "v": 0.1}
{"i": ["cuda -model=unknown", "topi_nn_conv2d", [["TENSOR", [1, 1, 340, 181], "float32"], ["TENSOR", [32, 1, 41, 11], "float32"], [2, 2], [0, 0, 0, 0], [1, 1], "NCHW", "float32"], {}, ["conv2d", [1, 1, 340, 181, "float32"], [32, 1, 41, 11, "float32"], [2, 2], [0, 0, 0, 0], [1, 1], "NCHW", "float32"], {"i": 2448067, "t": "direct", "c": "null", "e": [["tile_f", "sp", [-1, 2, 2, 2]], ["tile_y", "sp", [-1, 1, 10, 1]], ["tile_x", "sp", [-1, 2, 1, 1]], ["tile_rc", "sp", [-1, 1]], ["tile_ry", "sp", [-1, 41]], ["tile_rx", "sp", [-1, 1]], ["auto_unroll_max_step", "ot", 512], ["unroll_explicit", "ot", 1]]}], "r": [[0.00018675076931949248], 0, 2.436483383178711, 1582737083.6796389], "v": 0.1}
{"i": ["cuda -model=unknown", "topi_nn_conv2d", [["TENSOR", [1, 1, 340, 181], "float32"], ["TENSOR", [32, 1, 41, 11], "float32"], [2, 2], [0, 0, 0, 0], [1, 1], "NCHW", "float32"], {}, ["conv2d", [1, 1, 340, 181, "float32"], [32, 1, 41, 11, "float32"], [2, 2], [0, 0, 0, 0], [1, 1], "NCHW", "float32"], {"i": 1328067, "t": "direct", "c": "null", "e": [["tile_f", "sp", [-1, 2, 2, 2]], ["tile_y", "sp", [-1, 1, 10, 1]], ["tile_x", "sp", [-1, 1, 2, 1]], ["tile_rc", "sp", [-1, 1]], ["tile_ry", "sp", [-1, 41]], ["tile_rx", "sp", [-1, 1]], ["auto_unroll_max_step", "ot", 1500], ["unroll_explicit", "ot", 0]]}], "r": [[0.00021880734297520662], 0, 2.8236939907073975, 1582737084.9159608], "v": 0.1}
{"i": ["cuda -model=unknown", "topi_nn_conv2d", [["TENSOR", [1, 1, 340, 181], "float32"], ["TENSOR", [32, 1, 41, 11], "float32"], [2, 2], [0, 0, 0, 0], [1, 1], "NCHW", "float32"], {}, ["conv2d", [1, 1, 340, 181, "float32"], [32, 1, 41, 11, "float32"], [2, 2], [0, 0, 0, 0], [1, 1], "NCHW", "float32"], {"i": 754627, "t": "direct", "c": "null", "e": [["tile_f", "sp", [-1, 2, 2, 2]], ["tile_y", "sp", [-1, 1, 10, 1]], ["tile_x", "sp", [-1, 1, 2, 1]], ["tile_rc", "sp", [-1, 1]], ["tile_ry", "sp", [-1, 41]], ["tile_rx", "sp", [-1, 1]], ["auto_unroll_max_step", "ot", 512], ["unroll_explicit", "ot", 0]]}], "r": [[0.00021862907557354923], 0, 2.9144177436828613, 1582737086.1541357], "v": 0.1}
{"i": ["cuda -model=unknown", "topi_nn_conv2d", [["TENSOR", [1, 1, 340, 181], "float32"], ["TENSOR", [32, 1, 41, 11], "float32"], [2, 2], [0, 0, 0, 0], [1, 1], "NCHW", "float32"], {}, ["conv2d", [1, 1, 340, 181, "float32"], [32, 1, 41, 11, "float32"], [2, 2], [0, 0, 0, 0], [1, 1], "NCHW", "float32"], {"i": 3052575, "t": "direct", "c": "null", "e": [["tile_f", "sp", [-1, 1, 8, 1]], ["tile_y", "sp", [-1, 1, 6, 5]], ["tile_x", "sp", [-1, 1, 2, 1]], ["tile_rc", "sp", [-1, 1]], ["tile_ry", "sp", [-1, 41]], ["tile_rx", "sp", [-1, 1]], ["auto_unroll_max_step", "ot", 1500], ["unroll_explicit", "ot", 1]]}], "r": [[8.600170833333335e-05], 0, 2.9108290672302246, 1582737087.3955727], "v": 0.1}
{"i": ["cuda -model=unknown", "topi_nn_conv2d", [["TENSOR", [1, 1, 340, 181], "float32"], ["TENSOR", [32, 1, 41, 11], "float32"], [2, 2], [0, 0, 0, 0], [1, 1], "NCHW", "float32"], {}, ["conv2d", [1, 1, 340, 181, "float32"], [32, 1, 41, 11, "float32"], [2, 2], [0, 0, 0, 0], [1, 1], "NCHW", "float32"], {"i": 2479135, "t": "direct", "c": "null", "e": [["tile_f", "sp", [-1, 1, 8, 1]], ["tile_y", "sp", [-1, 1, 6, 5]], ["tile_x", "sp", [-1, 1, 2, 1]], ["tile_rc", "sp", [-1, 1]], ["tile_ry", "sp", [-1, 41]], ["tile_rx", "sp", [-1, 1]], ["auto_unroll_max_step", "ot", 512], ["unroll_explicit", "ot", 1]]}], "r": [[8.59875453047776e-05], 0, 2.4861600399017334, 1582737088.5630138], "v": 0.1}
{"i": ["cuda -model=unknown", "topi_nn_conv2d", [["TENSOR", [1, 1, 340, 181], "float32"], ["TENSOR", [32, 1, 41, 11], "float32"], [2, 2], [0, 0, 0, 0], [1, 1], "NCHW", "float32"], {}, ["conv2d", [1, 1, 340, 181, "float32"], [32, 1, 41, 11, "float32"], [2, 2], [0, 0, 0, 0], [1, 1], "NCHW", "float32"], {"i": 2475184, "t": "direct", "c": "null", "e": [["tile_f", "sp", [-1, 1, 2, 4]], ["tile_y", "sp", [-1, 1, 15, 1]], ["tile_x", "sp", [-1, 1, 2, 1]], ["tile_rc", "sp", [-1, 1]], ["tile_ry", "sp", [-1, 41]], ["tile_rx", "sp", [-1, 1]], ["auto_unroll_max_step", "ot", 512], ["unroll_explicit", "ot", 1]]}], "r": [[0.00017752050902934536], 0, 2.523322343826294, 1582737089.7627838], "v": 0.1}
{"i": ["cuda -model=unknown", "topi_nn_conv2d", [["TENSOR", [1, 1, 340, 181], "float32"], ["TENSOR", [32, 1, 41, 11], "float32"], [2, 2], [0, 0, 0, 0], [1, 1], "NCHW", "float32"], {}, ["conv2d", [1, 1, 340, 181, "float32"], [32, 1, 41, 11, "float32"], [2, 2], [0, 0, 0, 0], [1, 1], "NCHW", "float32"], {"i": 3048624, "t": "direct", "c": "null", "e": [["tile_f", "sp", [-1, 1, 2, 4]], ["tile_y", "sp", [-1, 1, 15, 1]], ["tile_x", "sp", [-1, 1, 2, 1]], ["tile_rc", "sp", [-1, 1]], ["tile_ry", "sp", [-1, 41]], ["tile_rx", "sp", [-1, 1]], ["auto_unroll_max_step", "ot", 1500], ["unroll_explicit", "ot", 1]]}], "r": [[0.0001790819788029925], 0, 1.8340153694152832, 1582737093.4806447], "v": 0.1}
{"i": ["cuda -model=unknown", "topi_nn_conv2d", [["TENSOR", [1, 1, 340, 181], "float32"], ["TENSOR", [32, 1, 41, 11], "float32"], [2, 2], [0, 0, 0, 0], [1, 1], "NCHW", "float32"], {}, ["conv2d", [1, 1, 340, 181, "float32"], [32, 1, 41, 11, "float32"], [2, 2], [0, 0, 0, 0], [1, 1], "NCHW", "float32"], {"i": 2474371, "t": "direct", "c": "null", "e": [["tile_f", "sp", [-1, 1, 4, 1]], ["tile_y", "sp", [-1, 2, 5, 1]], ["tile_x", "sp", [-1, 1, 2, 1]], ["tile_rc", "sp", [-1, 1]], ["tile_ry", "sp", [-1, 41]], ["tile_rx", "sp", [-1, 1]], ["auto_unroll_max_step", "ot", 512], ["unroll_explicit", "ot", 1]]}], "r": [[0.0002200628098495212], 0, 1.8991751670837402, 1582737094.7066648], "v": 0.1}
{"i": ["cuda -model=unknown", "topi_nn_conv2d", [["TENSOR", [1, 1, 340, 181], "float32"], ["TENSOR", [32, 1, 41, 11], "float32"], [2, 2], [0, 0, 0, 0], [1, 1], "NCHW", "float32"], {}, ["conv2d", [1, 1, 340, 181, "float32"], [32, 1, 41, 11, "float32"], [2, 2], [0, 0, 0, 0], [1, 1], "NCHW", "float32"], {"i": 3047811, "t": "direct", "c": "null", "e": [["tile_f", "sp", [-1, 1, 4, 1]], ["tile_y", "sp", [-1, 2, 5, 1]], ["tile_x", "sp", [-1, 1, 2, 1]], ["tile_rc", "sp", [-1, 1]], ["tile_ry", "sp", [-1, 41]], ["tile_rx", "sp", [-1, 1]], ["auto_unroll_max_step", "ot", 1500], ["unroll_explicit", "ot", 1]]}], "r": [[0.0002351670765832106], 0, 2.952829599380493, 1582737096.262356], "v": 0.1}
{"i": ["cuda -model=unknown", "topi_nn_conv2d", [["TENSOR", [1, 1, 340, 181], "float32"], ["TENSOR", [32, 1, 41, 11], "float32"], [2, 2], [0, 0, 0, 0], [1, 1], "NCHW", "float32"], {}, ["conv2d", [1, 1, 340, 181, "float32"], [32, 1, 41, 11, "float32"], [2, 2], [0, 0, 0, 0], [1, 1], "NCHW", "float32"], {"i": 1946288, "t": "direct", "c": "null", "e": [["tile_f", "sp", [-1, 4, 2, 1]], ["tile_y", "sp", [-1, 1, 10, 1]], ["tile_x", "sp", [-1, 1, 1, 2]], ["tile_rc", "sp", [-1, 1]], ["tile_ry", "sp", [-1, 41]], ["tile_rx", "sp", [-1, 1]], ["auto_unroll_max_step", "ot", 0], ["unroll_explicit", "ot", 1]]}], "r": [[0.00019149668674698796], 0, 1.7399542331695557, 1582737097.4589963], "v": 0.1}
{"i": ["cuda -model=unknown", "topi_nn_conv2d", [["TENSOR", [1, 1, 340, 181], "float32"], ["TENSOR", [32, 1, 41, 11], "float32"], [2, 2], [0, 0, 0, 0], [1, 1], "NCHW", "float32"], {}, ["conv2d", [1, 1, 340, 181, "float32"], [32, 1, 41, 11, "float32"], [2, 2], [0, 0, 0, 0], [1, 1], "NCHW", "float32"], {"i": 1874627, "t": "direct", "c": "null", "e": [["tile_f", "sp", [-1, 2, 2, 2]], ["tile_y", "sp", [-1, 1, 10, 1]], ["tile_x", "sp", [-1, 2, 1, 1]], ["tile_rc", "sp", [-1, 1]], ["tile_ry", "sp", [-1, 41]], ["tile_rx", "sp", [-1, 1]], ["auto_unroll_max_step", "ot", 0], ["unroll_explicit", "ot", 1]]}], "r": [[0.00019119234892086328], 0, 2.0655579566955566, 1582737098.670368], "v": 0.1}
{"i": ["cuda -model=unknown", "topi_nn_conv2d", [["TENSOR", [1, 1, 340, 181], "float32"], ["TENSOR", [32, 1, 41, 11], "float32"], [2, 2], [0, 0, 0, 0], [1, 1], "NCHW", "float32"], {}, ["conv2d", [1, 1, 340, 181, "float32"], [32, 1, 41, 11, "float32"], [2, 2], [0, 0, 0, 0], [1, 1], "NCHW", "float32"], {"i": 3048390, "t": "direct", "c": "null", "e": [["tile_f", "sp", [-1, 1, 4, 2]], ["tile_y", "sp", [-1, 1, 10, 1]], ["tile_x", "sp", [-1, 1, 2, 1]], ["tile_rc", "sp", [-1, 1]], ["tile_ry", "sp", [-1, 41]], ["tile_rx", "sp", [-1, 1]], ["auto_unroll_max_step", "ot", 1500], ["unroll_explicit", "ot", 1]]}], "r": [[0.0002509772408874802], 0, 2.786438465118408, 1582737100.0034835], "v": 0.1}
{"i": ["cuda -model=unknown", "topi_nn_conv2d", [["TENSOR", [1, 1, 340, 181], "float32"], ["TENSOR", [32, 1, 41, 11], "float32"], [2, 2], [0, 0, 0, 0], [1, 1], "NCHW", "float32"], {}, ["conv2d", [1, 1, 340, 181, "float32"], [32, 1, 41, 11, "float32"], [2, 2], [0, 0, 0, 0], [1, 1], "NCHW", "float32"], {"i": 2474950, "t": "direct", "c": "null", "e": [["tile_f", "sp", [-1, 1, 4, 2]], ["tile_y", "sp", [-1, 1, 10, 1]], ["tile_x", "sp", [-1, 1, 2, 1]], ["tile_rc", "sp", [-1, 1]], ["tile_ry", "sp", [-1, 41]], ["tile_rx", "sp", [-1, 1]], ["auto_unroll_max_step", "ot", 512], ["unroll_explicit", "ot", 1]]}], "r": [[0.00022680122772277228], 0, 2.090879201889038, 1582737101.2505918], "v": 0.1}
{"i": ["cuda -model=unknown", "topi_nn_conv2d", [["TENSOR", [1, 1, 340, 181], "float32"], ["TENSOR", [32, 1, 41, 11], "float32"], [2, 2], [0, 0, 0, 0], [1, 1], "NCHW", "float32"], {}, ["conv2d", [1, 1, 340, 181, "float32"], [32, 1, 41, 11, "float32"], [2, 2], [0, 0, 0, 0], [1, 1], "NCHW", "float32"], {"i": 2474946, "t": "direct", "c": "null", "e": [["tile_f", "sp", [-1, 1, 2, 2]], ["tile_y", "sp", [-1, 1, 10, 1]], ["tile_x", "sp", [-1, 1, 2, 1]], ["tile_rc", "sp", [-1, 1]], ["tile_ry", "sp", [-1, 41]], ["tile_rx", "sp", [-1, 1]], ["auto_unroll_max_step", "ot", 512], ["unroll_explicit", "ot", 1]]}], "r": [[0.0002810927134831461], 0, 1.9849791526794434, 1582737102.4363976], "v": 0.1}
{"i": ["cuda -model=unknown", "topi_nn_conv2d", [["TENSOR", [1, 1, 340, 181], "float32"], ["TENSOR", [32, 1, 41, 11], "float32"], [2, 2], [0, 0, 0, 0], [1, 1], "NCHW", "float32"], {}, ["conv2d", [1, 1, 340, 181, "float32"], [32, 1, 41, 11, "float32"], [2, 2], [0, 0, 0, 0], [1, 1], "NCHW", "float32"], {"i": 3048386, "t": "direct", "c": "null", "e": [["tile_f", "sp", [-1, 1, 2, 2]], ["tile_y", "sp", [-1, 1, 10, 1]], ["tile_x", "sp", [-1, 1, 2, 1]], ["tile_rc", "sp", [-1, 1]], ["tile_ry", "sp", [-1, 41]], ["tile_rx", "sp", [-1, 1]], ["auto_unroll_max_step", "ot", 1500], ["unroll_explicit", "ot", 1]]}], "r": [[0.00029857192336448597], 0, 3.2426345348358154, 1582737103.836188], "v": 0.1}
{"i": ["cuda -model=unknown", "topi_nn_conv2d", [["TENSOR", [1, 1, 340, 181], "float32"], ["TENSOR", [32, 1, 41, 11], "float32"], [2, 2], [0, 0, 0, 0], [1, 1], "NCHW", "float32"], {}, ["conv2d", [1, 1, 340, 181, "float32"], [32, 1, 41, 11, "float32"], [2, 2], [0, 0, 0, 0], [1, 1], "NCHW", "float32"], {"i": 181187, "t": "direct", "c": "null", "e": [["tile_f", "sp", [-1, 2, 2, 2]], ["tile_y", "sp", [-1, 1, 10, 1]], ["tile_x", "sp", [-1, 1, 2, 1]], ["tile_rc", "sp", [-1, 1]], ["tile_ry", "sp", [-1, 41]], ["tile_rx", "sp", [-1, 1]], ["auto_unroll_max_step", "ot", 0], ["unroll_explicit", "ot", 0]]}], "r": [[0.00021860938016528926], 0, 2.5014877319335938, 1582737105.6171029], "v": 0.1}
{"i": ["cuda -model=unknown", "topi_nn_conv2d", [["TENSOR", [1, 1, 340, 181], "float32"], ["TENSOR", [32, 1, 41, 11], "float32"], [2, 2], [0, 0, 0, 0], [1, 1], "NCHW", "float32"], {}, ["conv2d", [1, 1, 340, 181, "float32"], [32, 1, 41, 11, "float32"], [2, 2], [0, 0, 0, 0], [1, 1], "NCHW", "float32"], {"i": 2475170, "t": "direct", "c": "null", "e": [["tile_f", "sp", [-1, 1, 2, 2]], ["tile_y", "sp", [-1, 1, 15, 1]], ["tile_x", "sp", [-1, 1, 2, 1]], ["tile_rc", "sp", [-1, 1]], ["tile_ry", "sp", [-1, 41]], ["tile_rx", "sp", [-1, 1]], ["auto_unroll_max_step", "ot", 512], ["unroll_explicit", "ot", 1]]}], "r": [[0.00020082740050377836], 0, 1.9715173244476318, 1582737106.8472805], "v": 0.1}
{"i": ["cuda -model=unknown", "topi_nn_conv2d", [["TENSOR", [1, 1, 340, 181], "float32"], ["TENSOR", [32, 1, 41, 11], "float32"], [2, 2], [0, 0, 0, 0], [1, 1], "NCHW", "float32"], {}, ["conv2d", [1, 1, 340, 181, "float32"], [32, 1, 41, 11, "float32"], [2, 2], [0, 0, 0, 0], [1, 1], "NCHW", "float32"], {"i": 3048610, "t": "direct", "c": "null", "e": [["tile_f", "sp", [-1, 1, 2, 2]], ["tile_y", "sp", [-1, 1, 15, 1]], ["tile_x", "sp", [-1, 1, 2, 1]], ["tile_rc", "sp", [-1, 1]], ["tile_ry", "sp", [-1, 41]], ["tile_rx", "sp", [-1, 1]], ["auto_unroll_max_step", "ot", 1500], ["unroll_explicit", "ot", 1]]}], "r": [[0.0002123981832884097], 0, 3.103550910949707, 1582737108.19844], "v": 0.1}
{"i": ["cuda -model=unknown", "topi_nn_conv2d", [["TENSOR", [1, 1, 340, 181], "float32"], ["TENSOR", [32, 1, 41, 11], "float32"], [2, 2], [0, 0, 0, 0], [1, 1], "NCHW", "float32"], {}, ["conv2d", [1, 1, 340, 181, "float32"], [32, 1, 41, 11, "float32"], [2, 2], [0, 0, 0, 0], [1, 1], "NCHW", "float32"], {"i": 2474316, "t": "direct", "c": "null", "e": [["tile_f", "sp", [-1, 2, 4, 1]], ["tile_y", "sp", [-1, 1, 5, 1]], ["tile_x", "sp", [-1, 1, 2, 1]], ["tile_rc", "sp", [-1, 1]], ["tile_ry", "sp", [-1, 41]], ["tile_rx", "sp", [-1, 1]], ["auto_unroll_max_step", "ot", 512], ["unroll_explicit", "ot", 1]]}], "r": [[0.000289964388384755], 0, 2.5353407859802246, 1582737109.6165643], "v": 0.1}
{"i": ["cuda -model=unknown", "topi_nn_conv2d", [["TENSOR", [1, 1, 340, 181], "float32"], ["TENSOR", [32, 1, 41, 11], "float32"], [2, 2], [0, 0, 0, 0], [1, 1], "NCHW", "float32"], {}, ["conv2d", [1, 1, 340, 181, "float32"], [32, 1, 41, 11, "float32"], [2, 2], [0, 0, 0, 0], [1, 1], "NCHW", "float32"], {"i": 3047756, "t": "direct", "c": "null", "e": [["tile_f", "sp", [-1, 2, 4, 1]], ["tile_y", "sp", [-1, 1, 5, 1]], ["tile_x", "sp", [-1, 1, 2, 1]], ["tile_rc", "sp", [-1, 1]], ["tile_ry", "sp", [-1, 41]], ["tile_rx", "sp", [-1, 1]], ["auto_unroll_max_step", "ot", 1500], ["unroll_explicit", "ot", 1]]}], "r": [[0.00032814912909836066], 0, 3.4972410202026367, 1582737111.1488361], "v": 0.1}
{"i": ["cuda -model=unknown", "topi_nn_conv2d", [["TENSOR", [1, 1, 340, 181], "float32"], ["TENSOR", [32, 1, 41, 11], "float32"], [2, 2], [0, 0, 0, 0], [1, 1], "NCHW", "float32"], {}, ["conv2d", [1, 1, 340, 181, "float32"], [32, 1, 41, 11, "float32"], [2, 2], [0, 0, 0, 0], [1, 1], "NCHW", "float32"], {"i": 754444, "t": "direct", "c": "null", "e": [["tile_f", "sp", [-1, 2, 4, 1]], ["tile_y", "sp", [-1, 1, 6, 1]], ["tile_x", "sp", [-1, 1, 2, 1]], ["tile_rc", "sp", [-1, 1]], ["tile_ry", "sp", [-1, 41]], ["tile_rx", "sp", [-1, 1]], ["auto_unroll_max_step", "ot", 512], ["unroll_explicit", "ot", 0]]}], "r": [[0.00028830132310469315], 0, 1.7545890808105469, 1582737112.3498824], "v": 0.1}
{"i": ["cuda -model=unknown", "topi_nn_conv2d", [["TENSOR", [1, 1, 340, 181], "float32"], ["TENSOR", [32, 1, 41, 11], "float32"], [2, 2], [0, 0, 0, 0], [1, 1], "NCHW", "float32"], {}, ["conv2d", [1, 1, 340, 181, "float32"], [32, 1, 41, 11, "float32"], [2, 2], [0, 0, 0, 0], [1, 1], "NCHW", "float32"], {"i": 1327884, "t": "direct", "c": "null", "e": [["tile_f", "sp", [-1, 2, 4, 1]], ["tile_y", "sp", [-1, 1, 6, 1]], ["tile_x", "sp", [-1, 1, 2, 1]], ["tile_rc", "sp", [-1, 1]], ["tile_ry", "sp", [-1, 41]], ["tile_rx", "sp", [-1, 1]], ["auto_unroll_max_step", "ot", 1500], ["unroll_explicit", "ot", 0]]}], "r": [[0.00030348999810246677], 0, 2.5334956645965576, 1582737113.68583], "v": 0.1}
{"i": ["cuda -model=unknown", "topi_nn_conv2d", [["TENSOR", [1, 1, 340, 181], "float32"], ["TENSOR", [32, 1, 41, 11], "float32"], [2, 2], [0, 0, 0, 0], [1, 1], "NCHW", "float32"], {}, ["conv2d", [1, 1, 340, 181, "float32"], [32, 1, 41, 11, "float32"], [2, 2], [0, 0, 0, 0], [1, 1], "NCHW", "float32"], {"i": 1905695, "t": "direct", "c": "null", "e": [["tile_f", "sp", [-1, 1, 8, 1]], ["tile_y", "sp", [-1, 1, 6, 5]], ["tile_x", "sp", [-1, 1, 2, 1]], ["tile_rc", "sp", [-1, 1]], ["tile_ry", "sp", [-1, 41]], ["tile_rx", "sp", [-1, 1]], ["auto_unroll_max_step", "ot", 0], ["unroll_explicit", "ot", 1]]}], "r": [[7.818602006018054e-05], 0, 2.6794333457946777, 1582737114.8780093], "v": 0.1}
{"i": ["cuda -model=unknown", "topi_nn_conv2d", [["TENSOR", [1, 1, 340, 181], "float32"], ["TENSOR", [32, 1, 41, 11], "float32"], [2, 2], [0, 0, 0, 0], [1, 1], "NCHW", "float32"], {}, ["conv2d", [1, 1, 340, 181, "float32"], [32, 1, 41, 11, "float32"], [2, 2], [0, 0, 0, 0], [1, 1], "NCHW", "float32"], {"i": 1901744, "t": "direct", "c": "null", "e": [["tile_f", "sp", [-1, 1, 2, 4]], ["tile_y", "sp", [-1, 1, 15, 1]], ["tile_x", "sp", [-1, 1, 2, 1]], ["tile_rc", "sp", [-1, 1]], ["tile_ry", "sp", [-1, 41]], ["tile_rx", "sp", [-1, 1]], ["auto_unroll_max_step", "ot", 0], ["unroll_explicit", "ot", 1]]}], "r": [[0.00015871851686507935], 0, 2.3660905361175537, 1582737116.0782895], "v": 0.1}
{"i": ["cuda -model=unknown", "topi_nn_conv2d", [["TENSOR", [1, 1, 340, 181], "float32"], ["TENSOR", [32, 1, 41, 11], "float32"], [2, 2], [0, 0, 0, 0], [1, 1], "NCHW", "float32"], {}, ["conv2d", [1, 1, 340, 181, "float32"], [32, 1, 41, 11, "float32"], [2, 2], [0, 0, 0, 0], [1, 1], "NCHW", "float32"], {"i": 1900931, "t": "direct", "c": "null", "e": [["tile_f", "sp", [-1, 1, 4, 1]], ["tile_y", "sp", [-1, 2, 5, 1]], ["tile_x", "sp", [-1, 1, 2, 1]], ["tile_rc", "sp", [-1, 1]], ["tile_ry", "sp", [-1, 41]], ["tile_rx", "sp", [-1, 1]], ["auto_unroll_max_step", "ot", 0], ["unroll_explicit", "ot", 1]]}], "r": [[0.00021652405698778832], 0, 2.3343071937561035, 1582737117.2750325], "v": 0.1}
{"i": ["cuda -model=unknown", "topi_nn_conv2d", [["TENSOR", [1, 1, 340, 181], "float32"], ["TENSOR", [32, 1, 41, 11], "float32"], [2, 2], [0, 0, 0, 0], [1, 1], "NCHW", "float32"], {}, ["conv2d", [1, 1, 340, 181, "float32"], [32, 1, 41, 11, "float32"], [2, 2], [0, 0, 0, 0], [1, 1], "NCHW", "float32"], {"i": 3012771, "t": "direct", "c": "null", "e": [["tile_f", "sp", [-1, 2, 2, 2]], ["tile_y", "sp", [-1, 1, 15, 1]], ["tile_x", "sp", [-1, 1, 1, 1]], ["tile_rc", "sp", [-1, 1]], ["tile_ry", "sp", [-1, 41]], ["tile_rx", "sp", [-1, 1]], ["auto_unroll_max_step", "ot", 1500], ["unroll_explicit", "ot", 1]]}], "r": [[0.000171832977248104], 0, 2.6123015880584717, 1582737118.4902582], "v": 0.1}
{"i": ["cuda -model=unknown", "topi_nn_conv2d", [["TENSOR", [1, 1, 340, 181], "float32"], ["TENSOR", [32, 1, 41, 11], "float32"], [2, 2], [0, 0, 0, 0], [1, 1], "NCHW", "float32"], {}, ["conv2d", [1, 1, 340, 181, "float32"], [32, 1, 41, 11, "float32"], [2, 2], [0, 0, 0, 0], [1, 1], "NCHW", "float32"], {"i": 2439331, "t": "direct", "c": "null", "e": [["tile_f", "sp", [-1, 2, 2, 2]], ["tile_y", "sp", [-1, 1, 15, 1]], ["tile_x", "sp", [-1, 1, 1, 1]], ["tile_rc", "sp", [-1, 1]], ["tile_ry", "sp", [-1, 41]], ["tile_rx", "sp", [-1, 1]], ["auto_unroll_max_step", "ot", 512], ["unroll_explicit", "ot", 1]]}], "r": [[0.00017200487711864406], 0, 2.553086519241333, 1582737119.6777298], "v": 0.1}
{"i": ["cuda -model=unknown", "topi_nn_conv2d", [["TENSOR", [1, 1, 340, 181], "float32"], ["TENSOR", [32, 1, 41, 11], "float32"], [2, 2], [0, 0, 0, 0], [1, 1], "NCHW", "float32"], {}, ["conv2d", [1, 1, 340, 181, "float32"], [32, 1, 41, 11, "float32"], [2, 2], [0, 0, 0, 0], [1, 1], "NCHW", "float32"], {"i": 2519747, "t": "direct", "c": "null", "e": [["tile_f", "sp", [-1, 2, 2, 2]], ["tile_y", "sp", [-1, 1, 10, 1]], ["tile_x", "sp", [-1, 1, 1, 2]], ["tile_rc", "sp", [-1, 1]], ["tile_ry", "sp", [-1, 41]], ["tile_rx", "sp", [-1, 1]], ["auto_unroll_max_step", "ot", 512], ["unroll_explicit", "ot", 1]]}], "r": [[0.0001866696662763466], 0, 1.6038036346435547, 1582737120.8961208], "v": 0.1}
{"i": ["cuda -model=unknown", "topi_nn_conv2d", [["TENSOR", [1, 1, 340, 181], "float32"], ["TENSOR", [32, 1, 41, 11], "float32"], [2, 2], [0, 0, 0, 0], [1, 1], "NCHW", "float32"], {}, ["conv2d", [1, 1, 340, 181, "float32"], [32, 1, 41, 11, "float32"], [2, 2], [0, 0, 0, 0], [1, 1], "NCHW", "float32"], {"i": 3093187, "t": "direct", "c": "null", "e": [["tile_f", "sp", [-1, 2, 2, 2]], ["tile_y", "sp", [-1, 1, 10, 1]], ["tile_x", "sp", [-1, 1, 1, 2]], ["tile_rc", "sp", [-1, 1]], ["tile_ry", "sp", [-1, 41]], ["tile_rx", "sp", [-1, 1]], ["auto_unroll_max_step", "ot", 1500], ["unroll_explicit", "ot", 1]]}], "r": [[0.0001866163757361602], 0, 2.398991823196411, 1582737122.065367], "v": 0.1}
{"i": ["cuda -model=unknown", "topi_nn_conv2d", [["TENSOR", [1, 1, 340, 181], "float32"], ["TENSOR", [32, 1, 41, 11], "float32"], [2, 2], [0, 0, 0, 0], [1, 1], "NCHW", "float32"], {}, ["conv2d", [1, 1, 340, 181, "float32"], [32, 1, 41, 11, "float32"], [2, 2], [0, 0, 0, 0], [1, 1], "NCHW", "float32"], {"i": 2440899, "t": "direct", "c": "null", "e": [["tile_f", "sp", [-1, 2, 2, 2]], ["tile_y", "sp", [-1, 1, 15, 2]], ["tile_x", "sp", [-1, 1, 1, 1]], ["tile_rc", "sp", [-1, 1]], ["tile_ry", "sp", [-1, 41]], ["tile_rx", "sp", [-1, 1]], ["auto_unroll_max_step", "ot", 512], ["unroll_explicit", "ot", 1]]}], "r": [[0.00011600516124260354], 0, 2.3514938354492188, 1582737123.2643127], "v": 0.1}
{"i": ["cuda -model=unknown", "topi_nn_conv2d", [["TENSOR", [1, 1, 340, 181], "float32"], ["TENSOR", [32, 1, 41, 11], "float32"], [2, 2], [0, 0, 0, 0], [1, 1], "NCHW", "float32"], {}, ["conv2d", [1, 1, 340, 181, "float32"], [32, 1, 41, 11, "float32"], [2, 2], [0, 0, 0, 0], [1, 1], "NCHW", "float32"], {"i": 3014339, "t": "direct", "c": "null", "e": [["tile_f", "sp", [-1, 2, 2, 2]], ["tile_y", "sp", [-1, 1, 15, 2]], ["tile_x", "sp", [-1, 1, 1, 1]], ["tile_rc", "sp", [-1, 1]], ["tile_ry", "sp", [-1, 41]], ["tile_rx", "sp", [-1, 1]], ["auto_unroll_max_step", "ot", 1500], ["unroll_explicit", "ot", 1]]}], "r": [[0.00011598566642282371], 0, 1.95686936378479, 1582737128.5412111], "v": 0.1}
{"i": ["cuda -model=unknown", "topi_nn_conv2d", [["TENSOR", [1, 1, 340, 181], "float32"], ["TENSOR", [32, 1, 41, 11], "float32"], [2, 2], [0, 0, 0, 0], [1, 1], "NCHW", "float32"], {}, ["conv2d", [1, 1, 340, 181, "float32"], [32, 1, 41, 11, "float32"], [2, 2], [0, 0, 0, 0], [1, 1], "NCHW", "float32"], {"i": 2520419, "t": "direct", "c": "null", "e": [["tile_f", "sp", [-1, 2, 2, 2]], ["tile_y", "sp", [-1, 1, 30, 1]], ["tile_x", "sp", [-1, 1, 1, 2]], ["tile_rc", "sp", [-1, 1]], ["tile_ry", "sp", [-1, 41]], ["tile_rx", "sp", [-1, 1]], ["auto_unroll_max_step", "ot", 512], ["unroll_explicit", "ot", 1]]}], "r": [[0.00010843265202470831], 0, 1.9895713329315186, 1582737129.766746], "v": 0.1}
{"i": ["cuda -model=unknown", "topi_nn_conv2d", [["TENSOR", [1, 1, 340, 181], "float32"], ["TENSOR", [32, 1, 41, 11], "float32"], [2, 2], [0, 0, 0, 0], [1, 1], "NCHW", "float32"], {}, ["conv2d", [1, 1, 340, 181, "float32"], [32, 1, 41, 11, "float32"], [2, 2], [0, 0, 0, 0], [1, 1], "NCHW", "float32"], {"i": 3093859, "t": "direct", "c": "null", "e": [["tile_f", "sp", [-1, 2, 2, 2]], ["tile_y", "sp", [-1, 1, 30, 1]], ["tile_x", "sp", [-1, 1, 1, 2]], ["tile_rc", "sp", [-1, 1]], ["tile_ry", "sp", [-1, 41]], ["tile_rx", "sp", [-1, 1]], ["auto_unroll_max_step", "ot", 1500], ["unroll_explicit", "ot", 1]]}], "r": [[0.00010834074793956045], 0, 2.314784526824951, 1582737131.3425767], "v": 0.1}
{"i": ["cuda -model=unknown", "topi_nn_conv2d", [["TENSOR", [1, 1, 340, 181], "float32"], ["TENSOR", [32, 1, 41, 11], "float32"], [2, 2], [0, 0, 0, 0], [1, 1], "NCHW", "float32"], {}, ["conv2d", [1, 1, 340, 181, "float32"], [32, 1, 41, 11, "float32"], [2, 2], [0, 0, 0, 0], [1, 1], "NCHW", "float32"], {"i": 1328291, "t": "direct", "c": "null", "e": [["tile_f", "sp", [-1, 2, 2, 2]], ["tile_y", "sp", [-1, 1, 15, 1]], ["tile_x", "sp", [-1, 1, 2, 1]], ["tile_rc", "sp", [-1, 1]], ["tile_ry", "sp", [-1, 41]], ["tile_rx", "sp", [-1, 1]], ["auto_unroll_max_step", "ot", 1500], ["unroll_explicit", "ot", 0]]}], "r": [[0.00015907149599198397], 0, 1.4800527095794678, 1582737132.5475962], "v": 0.1}
{"i": ["cuda -model=unknown", "topi_nn_conv2d", [["TENSOR", [1, 1, 340, 181], "float32"], ["TENSOR", [32, 1, 41, 11], "float32"], [2, 2], [0, 0, 0, 0], [1, 1], "NCHW", "float32"], {}, ["conv2d", [1, 1, 340, 181, "float32"], [32, 1, 41, 11, "float32"], [2, 2], [0, 0, 0, 0], [1, 1], "NCHW", "float32"], {"i": 754851, "t": "direct", "c": "null", "e": [["tile_f", "sp", [-1, 2, 2, 2]], ["tile_y", "sp", [-1, 1, 15, 1]], ["tile_x", "sp", [-1, 1, 2, 1]], ["tile_rc", "sp", [-1, 1]], ["tile_ry", "sp", [-1, 41]], ["tile_rx", "sp", [-1, 1]], ["auto_unroll_max_step", "ot", 512], ["unroll_explicit", "ot", 0]]}], "r": [[0.00015906682182182183], 0, 1.5452401638031006, 1582737133.720975], "v": 0.1}
{"i": ["cuda -model=unknown", "topi_nn_conv2d", [["TENSOR", [1, 1, 340, 181], "float32"], ["TENSOR", [32, 1, 41, 11], "float32"], [2, 2], [0, 0, 0, 0], [1, 1], "NCHW", "float32"], {}, ["conv2d", [1, 1, 340, 181, "float32"], [32, 1, 41, 11, "float32"], [2, 2], [0, 0, 0, 0], [1, 1], "NCHW", "float32"], {"i": 754607, "t": "direct", "c": "null", "e": [["tile_f", "sp", [-1, 2, 2, 1]], ["tile_y", "sp", [-1, 1, 10, 1]], ["tile_x", "sp", [-1, 1, 2, 1]], ["tile_rc", "sp", [-1, 1]], ["tile_ry", "sp", [-1, 41]], ["tile_rx", "sp", [-1, 1]], ["auto_unroll_max_step", "ot", 512], ["unroll_explicit", "ot", 0]]}], "r": [[0.000286940371024735], 0, 1.6167774200439453, 1582737134.9945781], "v": 0.1}
{"i": ["cuda -model=unknown", "topi_nn_conv2d", [["TENSOR", [1, 1, 340, 181], "float32"], ["TENSOR", [32, 1, 41, 11], "float32"], [2, 2], [0, 0, 0, 0], [1, 1], "NCHW", "float32"], {}, ["conv2d", [1, 1, 340, 181, "float32"], [32, 1, 41, 11, "float32"], [2, 2], [0, 0, 0, 0], [1, 1], "NCHW", "float32"], {"i": 1328047, "t": "direct", "c": "null", "e": [["tile_f", "sp", [-1, 2, 2, 1]], ["tile_y", "sp", [-1, 1, 10, 1]], ["tile_x", "sp", [-1, 1, 2, 1]], ["tile_rc", "sp", [-1, 1]], ["tile_ry", "sp", [-1, 41]], ["tile_rx", "sp", [-1, 1]], ["auto_unroll_max_step", "ot", 1500], ["unroll_explicit", "ot", 0]]}], "r": [[0.0002973209285714286], 0, 2.3492186069488525, 1582737136.631818], "v": 0.1}
{"i": ["cuda -model=unknown", "topi_nn_conv2d", [["TENSOR", [1, 1, 340, 181], "float32"], ["TENSOR", [32, 1, 41, 11], "float32"], [2, 2], [0, 0, 0, 0], [1, 1], "NCHW", "float32"], {}, ["conv2d", [1, 1, 340, 181, "float32"], [32, 1, 41, 11, "float32"], [2, 2], [0, 0, 0, 0], [1, 1], "NCHW", "float32"], {"i": 2474315, "t": "direct", "c": "null", "e": [["tile_f", "sp", [-1, 1, 4, 1]], ["tile_y", "sp", [-1, 1, 5, 1]], ["tile_x", "sp", [-1, 1, 2, 1]], ["tile_rc", "sp", [-1, 1]], ["tile_ry", "sp", [-1, 41]], ["tile_rx", "sp", [-1, 1]], ["auto_unroll_max_step", "ot", 512], ["unroll_explicit", "ot", 1]]}], "r": [[0.00037808729314420806], 0, 1.7751424312591553, 1582737137.8221939], "v": 0.1}
{"i": ["cuda -model=unknown", "topi_nn_conv2d", [["TENSOR", [1, 1, 340, 181], "float32"], ["TENSOR", [32, 1, 41, 11], "float32"], [2, 2], [0, 0, 0, 0], [1, 1], "NCHW", "float32"], {}, ["conv2d", [1, 1, 340, 181, "float32"], [32, 1, 41, 11, "float32"], [2, 2], [0, 0, 0, 0], [1, 1], "NCHW", "float32"], {"i": 3047755, "t": "direct", "c": "null", "e": [["tile_f", "sp", [-1, 1, 4, 1]], ["tile_y", "sp", [-1, 1, 5, 1]], ["tile_x", "sp", [-1, 1, 2, 1]], ["tile_rc", "sp", [-1, 1]], ["tile_ry", "sp", [-1, 41]], ["tile_rx", "sp", [-1, 1]], ["auto_unroll_max_step", "ot", 1500], ["unroll_explicit", "ot", 1]]}], "r": [[0.00044848662464985994], 0, 2.4526357650756836, 1582737139.1220095], "v": 0.1}
{"i": ["cuda -model=unknown", "topi_nn_conv2d", [["TENSOR", [1, 1, 340, 181], "float32"], ["TENSOR", [32, 1, 41, 11], "float32"], [2, 2], [0, 0, 0, 0], [1, 1], "NCHW", "float32"], {}, ["conv2d", [1, 1, 340, 181, "float32"], [32, 1, 41, 11, "float32"], [2, 2], [0, 0, 0, 0], [1, 1], "NCHW", "float32"], {"i": 3051171, "t": "direct", "c": "null", "e": [["tile_f", "sp", [-1, 1, 4, 1]], ["tile_y", "sp", [-1, 1, 10, 3]], ["tile_x", "sp", [-1, 1, 2, 1]], ["tile_rc", "sp", [-1, 1]], ["tile_ry", "sp", [-1, 41]], ["tile_rx", "sp", [-1, 1]], ["auto_unroll_max_step", "ot", 1500], ["unroll_explicit", "ot", 1]]}], "r": [[0.0001649892988505747], 0, 3.0646989345550537, 1582737140.433997], "v": 0.1}
{"i": ["cuda -model=unknown", "topi_nn_conv2d", [["TENSOR", [1, 1, 340, 181], "float32"], ["TENSOR", [32, 1, 41, 11], "float32"], [2, 2], [0, 0, 0, 0], [1, 1], "NCHW", "float32"], {}, ["conv2d", [1, 1, 340, 181, "float32"], [32, 1, 41, 11, "float32"], [2, 2], [0, 0, 0, 0], [1, 1], "NCHW", "float32"], {"i": 2477731, "t": "direct", "c": "null", "e": [["tile_f", "sp", [-1, 1, 4, 1]], ["tile_y", "sp", [-1, 1, 10, 3]], ["tile_x", "sp", [-1, 1, 2, 1]], ["tile_rc", "sp", [-1, 1]], ["tile_ry", "sp", [-1, 41]], ["tile_rx", "sp", [-1, 1]], ["auto_unroll_max_step", "ot", 512], ["unroll_explicit", "ot", 1]]}], "r": [[0.00012698367559055117], 0, 1.7984774112701416, 1582737141.6390002], "v": 0.1}
{"i": ["cuda -model=unknown", "topi_nn_conv2d", [["TENSOR", [1, 1, 340, 181], "float32"], ["TENSOR", [32, 1, 41, 11], "float32"], [2, 2], [0, 0, 0, 0], [1, 1], "NCHW", "float32"], {}, ["conv2d", [1, 1, 340, 181, "float32"], [32, 1, 41, 11, "float32"], [2, 2], [0, 0, 0, 0], [1, 1], "NCHW", "float32"], {"i": 3015347, "t": "direct", "c": "null", "e": [["tile_f", "sp", [-1, 2, 2, 2]], ["tile_y", "sp", [-1, 1, 10, 3]], ["tile_x", "sp", [-1, 1, 1, 1]], ["tile_rc", "sp", [-1, 1]], ["tile_ry", "sp", [-1, 41]], ["tile_rx", "sp", [-1, 1]], ["auto_unroll_max_step", "ot", 1500], ["unroll_explicit", "ot", 1]]}], "r": [[0.0001169870463235294], 0, 2.0001120567321777, 1582737143.0145223], "v": 0.1}
{"i": ["cuda -model=unknown", "topi_nn_conv2d", [["TENSOR", [1, 1, 340, 181], "float32"], ["TENSOR", [32, 1, 41, 11], "float32"], [2, 2], [0, 0, 0, 0], [1, 1], "NCHW", "float32"], {}, ["conv2d", [1, 1, 340, 181, "float32"], [32, 1, 41, 11, "float32"], [2, 2], [0, 0, 0, 0], [1, 1], "NCHW", "float32"], {"i": 2441907, "t": "direct", "c": "null", "e": [["tile_f", "sp", [-1, 2, 2, 2]], ["tile_y", "sp", [-1, 1, 10, 3]], ["tile_x", "sp", [-1, 1, 1, 1]], ["tile_rc", "sp", [-1, 1]], ["tile_ry", "sp", [-1, 41]], ["tile_rx", "sp", [-1, 1]], ["auto_unroll_max_step", "ot", 512], ["unroll_explicit", "ot", 1]]}], "r": [[0.00011689349704142013], 0, 2.6293396949768066, 1582737144.67166], "v": 0.1}
{"i": ["cuda -model=unknown", "topi_nn_conv2d", [["TENSOR", [1, 1, 340, 181], "float32"], ["TENSOR", [32, 1, 41, 11], "float32"], [2, 2], [0, 0, 0, 0], [1, 1], "NCHW", "float32"], {}, ["conv2d", [1, 1, 340, 181, "float32"], [32, 1, 41, 11, "float32"], [2, 2], [0, 0, 0, 0], [1, 1], "NCHW", "float32"], {"i": 2459663, "t": "direct", "c": "null", "e": [["tile_f", "sp", [-1, 2, 4, 2]], ["tile_y", "sp", [-1, 2, 5, 3]], ["tile_x", "sp", [-1, 43, 1, 1]], ["tile_rc", "sp", [-1, 1]], ["tile_ry", "sp", [-1, 41]], ["tile_rx", "sp", [-1, 1]], ["auto_unroll_max_step", "ot", 512], ["unroll_explicit", "ot", 1]]}], "r": [[0.0051855776], 0, 6.063519239425659, 1582737147.3033972], "v": 0.1}
