artifacts/Table4/tvm/autotvm/depthwise/depthwise_128_84_42_42_7_7_1_SAME.log
{"input": ["rocm -keys=rocm,gpu -max_num_threads=256 -mcpu=gfx906 -mtriple=amdgcn-amd-amdhsa-hcc -thread_warp_size=64", "depthwise_conv2d_nchw.cuda", [["TENSOR", [128, 84, 42, 42], "float32"], ["TENSOR", [84, 1, 7, 7], "float32"], 1, "SAME", 1, "float32"], {}], "config": {"index": 983312, "code_hash": null, "entity": [["tile_f", "sp", [-1, 1, 2, 6]], ["tile_y", "sp", [-1, 2, 1, 1]], ["tile_x", "sp", [-1, 7, 3, 2]], ["auto_unroll_max_step", "ot", 256], ["unroll_explicit", "ot", 1]]}, "result": [[0.24734484850000002], 0, 4.507990121841431, 1638633996.2174766], "version": 0.2, "tvm_version": "0.9.dev0"}
{"input": ["rocm -keys=rocm,gpu -max_num_threads=256 -mcpu=gfx906 -mtriple=amdgcn-amd-amdhsa-hcc -thread_warp_size=64", "depthwise_conv2d_nchw.cuda", [["TENSOR", [128, 84, 42, 42], "float32"], ["TENSOR", [84, 1, 7, 7], "float32"], 1, "SAME", 1, "float32"], {}], "config": {"index": 168778, "code_hash": null, "entity": [["tile_f", "sp", [-1, 1, 1, 14]], ["tile_y", "sp", [-1, 21, 1, 2]], ["tile_x", "sp", [-1, 1, 6, 1]], ["auto_unroll_max_step", "ot", 0], ["unroll_explicit", "ot", 1]]}, "result": [[0.6594254150000001], 0, 8.065869808197021, 1638634001.2529638], "version": 0.2, "tvm_version": "0.9.dev0"}
{"input": ["rocm -keys=rocm,gpu -max_num_threads=256 -mcpu=gfx906 -mtriple=amdgcn-amd-amdhsa-hcc -thread_warp_size=64", "depthwise_conv2d_nchw.cuda", [["TENSOR", [128, 84, 42, 42], "float32"], ["TENSOR", [84, 1, 7, 7], "float32"], 1, "SAME", 1, "float32"], {}], "config": {"index": 791094, "code_hash": null, "entity": [["tile_f", "sp", [-1, 1, 1, 2]], ["tile_y", "sp", [-1, 1, 6, 1]], ["tile_x", "sp", [-1, 2, 3, 1]], ["auto_unroll_max_step", "ot", 256], ["unroll_explicit", "ot", 1]]}, "result": [[0.0016244302268041237], 0, 2.6948652267456055, 1638634003.1542182], "version": 0.2, "tvm_version": "0.9.dev0"}
{"input": ["rocm -keys=rocm,gpu -max_num_threads=256 -mcpu=gfx906 -mtriple=amdgcn-amd-amdhsa-hcc -thread_warp_size=64", "depthwise_conv2d_nchw.cuda", [["TENSOR", [128, 84, 42, 42], "float32"], ["TENSOR", [84, 1, 7, 7], "float32"], 1, "SAME", 1, "float32"], {}], "config": {"index": 689605, "code_hash": null, "entity": [["tile_f", "sp", [-1, 7, 1, 1]], ["tile_y", "sp", [-1, 1, 14, 1]], ["tile_x", "sp", [-1, 6, 1, 1]], ["auto_unroll_max_step", "ot", 256], ["unroll_explicit", "ot", 1]]}, "result": [[0.0329748915], 0, 3.2947394847869873, 1638634004.905308], "version": 0.2, "tvm_version": "0.9.dev0"}
{"input": ["rocm -keys=rocm,gpu -max_num_threads=256 -mcpu=gfx906 -mtriple=amdgcn-amd-amdhsa-hcc -thread_warp_size=64", "depthwise_conv2d_nchw.cuda", [["TENSOR", [128, 84, 42, 42], "float32"], ["TENSOR", [84, 1, 7, 7], "float32"], 1, "SAME", 1, "float32"], {}], "config": {"index": 1081030, "code_hash": null, "entity": [["tile_f", "sp", [-1, 1, 6, 2]], ["tile_y", "sp", [-1, 1, 1, 3]], ["tile_x", "sp", [-1, 7, 2, 3]], ["auto_unroll_max_step", "ot", 256], ["unroll_explicit", "ot", 1]]}, "result": [[0.08909984575], 0, 3.8252453804016113, 1638634006.9406872], "version": 0.2, "tvm_version": "0.9.dev0"}
{"input": ["rocm -keys=rocm,gpu -max_num_threads=256 -mcpu=gfx906 -mtriple=amdgcn-amd-amdhsa-hcc -thread_warp_size=64", "depthwise_conv2d_nchw.cuda", [["TENSOR", [128, 84, 42, 42], "float32"], ["TENSOR", [84, 1, 7, 7], "float32"], 1, "SAME", 1, "float32"], {}], "config": {"index": 1392870, "code_hash": null, "entity": [["tile_f", "sp", [-1, 1, 6, 2]], ["tile_y", "sp", [-1, 2, 1, 1]], ["tile_x", "sp", [-1, 1, 2, 1]], ["auto_unroll_max_step", "ot", 1500], ["unroll_explicit", "ot", 1]]}, "result": [[0.015635065], 0, 3.1574947834014893, 1638634008.614709], "version": 0.2, "tvm_version": "0.9.dev0"}
{"input": ["rocm -keys=rocm,gpu -max_num_threads=256 -mcpu=gfx906 -mtriple=amdgcn-amd-amdhsa-hcc -thread_warp_size=64", "depthwise_conv2d_nchw.cuda", [["TENSOR", [128, 84, 42, 42], "float32"], ["TENSOR", [84, 1, 7, 7], "float32"], 1, "SAME", 1, "float32"], {}], "config": {"index": 784002, "code_hash": null, "entity": [["tile_f", "sp", [-1, 3, 1, 1]], ["tile_y", "sp", [-1, 1, 1, 3]], ["tile_x", "sp", [-1, 1, 3, 1]], ["auto_unroll_max_step", "ot", 256], ["unroll_explicit", "ot", 1]]}, "result": [[0.02086456416666667], 0, 2.744884490966797, 1638634010.3623102], "version": 0.2, "tvm_version": "0.9.dev0"}
{"input": ["rocm -keys=rocm,gpu -max_num_threads=256 -mcpu=gfx906 -mtriple=amdgcn-amd-amdhsa-hcc -thread_warp_size=64", "depthwise_conv2d_nchw.cuda", [["TENSOR", [128, 84, 42, 42], "float32"], ["TENSOR", [84, 1, 7, 7], "float32"], 1, "SAME", 1, "float32"], {}], "config": {"index": 95967, "code_hash": null, "entity": [["tile_f", "sp", [-1, 1, 3, 7]], ["tile_y", "sp", [-1, 3, 14, 1]], ["tile_x", "sp", [-1, 3, 2, 1]], ["auto_unroll_max_step", "ot", 0], ["unroll_explicit", "ot", 1]]}, "result": [[0.07542950424999999], 0, 3.4105916023254395, 1638634012.303625], "version": 0.2, "tvm_version": "0.9.dev0"}
{"input": ["rocm -keys=rocm,gpu -max_num_threads=256 -mcpu=gfx906 -mtriple=amdgcn-amd-amdhsa-hcc -thread_warp_size=64", "depthwise_conv2d_nchw.cuda", [["TENSOR", [128, 84, 42, 42], "float32"], ["TENSOR", [84, 1, 7, 7], "float32"], 1, "SAME", 1, "float32"], {}], "config": {"index": 71131, "code_hash": null, "entity": [["tile_f", "sp", [-1, 1, 4, 3]], ["tile_y", "sp", [-1, 1, 1, 21]], ["tile_x", "sp", [-1, 21, 1, 1]], ["auto_unroll_max_step", "ot", 0], ["unroll_explicit", "ot", 1]]}, "result": [[0.9097971189999999], 0, 7.89305305480957, 1638634018.424726], "version": 0.2, "tvm_version": "0.9.dev0"}
{"input": ["rocm -keys=rocm,gpu -max_num_threads=256 -mcpu=gfx906 -mtriple=amdgcn-amd-amdhsa-hcc -thread_warp_size=64", "depthwise_conv2d_nchw.cuda", [["TENSOR", [128, 84, 42, 42], "float32"], ["TENSOR", [84, 1, 7, 7], "float32"], 1, "SAME", 1, "float32"], {}], "config": {"index": 335844, "code_hash": null, "entity": [["tile_f", "sp", [-1, 6, 1, 1]], ["tile_y", "sp", [-1, 6, 1, 7]], ["tile_x", "sp", [-1, 7, 3, 2]], ["auto_unroll_max_step", "ot", 0], ["unroll_explicit", "ot", 1]]}, "result": [[1.9750561522499999], 0, 14.620927572250366, 1638634029.8916323], "version": 0.2, "tvm_version": "0.9.dev0"}
{"input": ["rocm -keys=rocm,gpu -max_num_threads=256 -mcpu=gfx906 -mtriple=amdgcn-amd-amdhsa-hcc -thread_warp_size=64", "depthwise_conv2d_nchw.cuda", [["TENSOR", [128, 84, 42, 42], "float32"], ["TENSOR", [84, 1, 7, 7], "float32"], 1, "SAME", 1, "float32"], {}], "config": {"index": 1049775, "code_hash": null, "entity": [["tile_f", "sp", [-1, 6, 2, 1]], ["tile_y", "sp", [-1, 1, 7, 2]], ["tile_x", "sp", [-1, 7, 1, 3]], ["auto_unroll_max_step", "ot", 256], ["unroll_explicit", "ot", 1]]}, "result": [[0.18760824575], 0, 3.8919358253479004, 1638634032.4213445], "version": 0.2, "tvm_version": "0.9.dev0"}
{"input": ["rocm -keys=rocm,gpu -max_num_threads=256 -mcpu=gfx906 -mtriple=amdgcn-amd-amdhsa-hcc -thread_warp_size=64", "depthwise_conv2d_nchw.cuda", [["TENSOR", [128, 84, 42, 42], "float32"], ["TENSOR", [84, 1, 7, 7], "float32"], 1, "SAME", 1, "float32"], {}], "config": {"index": 23662, "code_hash": null, "entity": [["tile_f", "sp", [-1, 1, 2, 14]], ["tile_y", "sp", [-1, 2, 7, 1]], ["tile_x", "sp", [-1, 3, 1, 1]], ["auto_unroll_max_step", "ot", 0], ["unroll_explicit", "ot", 1]]}, "result": [[0.06490206125], 0, 3.9772374629974365, 1638634034.4749153], "version": 0.2, "tvm_version": "0.9.dev0"}
{"input": ["rocm -keys=rocm,gpu -max_num_threads=256 -mcpu=gfx906 -mtriple=amdgcn-amd-amdhsa-hcc -thread_warp_size=64", "depthwise_conv2d_nchw.cuda", [["TENSOR", [128, 84, 42, 42], "float32"], ["TENSOR", [84, 1, 7, 7], "float32"], 1, "SAME", 1, "float32"], {}], "config": {"index": 1673489, "code_hash": null, "entity": [["tile_f", "sp", [-1, 1, 28, 1]], ["tile_y", "sp", [-1, 1, 1, 2]], ["tile_x", "sp", [-1, 1, 21, 2]], ["auto_unroll_max_step", "ot", 1500], ["unroll_explicit", "ot", 1]]}, "result": [[0.00145889831], 0, 2.617583751678467, 1638634036.720536], "version": 0.2, "tvm_version": "0.9.dev0"}
{"input": ["rocm -keys=rocm,gpu -max_num_threads=256 -mcpu=gfx906 -mtriple=amdgcn-amd-amdhsa-hcc -thread_warp_size=64", "depthwise_conv2d_nchw.cuda", [["TENSOR", [128, 84, 42, 42], "float32"], ["TENSOR", [84, 1, 7, 7], "float32"], 1, "SAME", 1, "float32"], {}], "config": {"index": 195900, "code_hash": null, "entity": [["tile_f", "sp", [-1, 21, 1, 2]], ["tile_y", "sp", [-1, 1, 2, 1]], ["tile_x", "sp", [-1, 2, 7, 1]], ["auto_unroll_max_step", "ot", 0], ["unroll_explicit", "ot", 1]]}, "result": [[0.09893154124999999], 0, 4.078684568405151, 1638634039.2381287], "version": 0.2, "tvm_version": "0.9.dev0"}
{"input": ["rocm -keys=rocm,gpu -max_num_threads=256 -mcpu=gfx906 -mtriple=amdgcn-amd-amdhsa-hcc -thread_warp_size=64", "depthwise_conv2d_nchw.cuda", [["TENSOR", [128, 84, 42, 42], "float32"], ["TENSOR", [84, 1, 7, 7], "float32"], 1, "SAME", 1, "float32"], {}], "config": {"index": 924654, "code_hash": null, "entity": [["tile_f", "sp", [-1, 3, 2, 1]], ["tile_y", "sp", [-1, 2, 7, 1]], ["tile_x", "sp", [-1, 1, 42, 1]], ["auto_unroll_max_step", "ot", 256], ["unroll_explicit", "ot", 1]]}, "result": [[0.011188118777777777], 0, 3.1073524951934814, 1638634041.4593074], "version": 0.2, "tvm_version": "0.9.dev0"}
{"input": ["rocm -keys=rocm,gpu -max_num_threads=256 -mcpu=gfx906 -mtriple=amdgcn-amd-amdhsa-hcc -thread_warp_size=64", "depthwise_conv2d_nchw.cuda", [["TENSOR", [128, 84, 42, 42], "float32"], ["TENSOR", [84, 1, 7, 7], "float32"], 1, "SAME", 1, "float32"], {}], "config": {"index": 843300, "code_hash": null, "entity": [["tile_f", "sp", [-1, 3, 1, 4]], ["tile_y", "sp", [-1, 1, 14, 1]], ["tile_x", "sp", [-1, 1, 7, 1]], ["auto_unroll_max_step", "ot", 256], ["unroll_explicit", "ot", 1]]}, "result": [[0.02737531275], 0, 3.230435848236084, 1638634043.6231644], "version": 0.2, "tvm_version": "0.9.dev0"}
{"input": ["rocm -keys=rocm,gpu -max_num_threads=256 -mcpu=gfx906 -mtriple=amdgcn-amd-amdhsa-hcc -thread_warp_size=64", "depthwise_conv2d_nchw.cuda", [["TENSOR", [128, 84, 42, 42], "float32"], ["TENSOR", [84, 1, 7, 7], "float32"], 1, "SAME", 1, "float32"], {}], "config": {"index": 437334, "code_hash": null, "entity": [["tile_f", "sp", [-1, 1, 1, 2]], ["tile_y", "sp", [-1, 1, 1, 6]], ["tile_x", "sp", [-1, 1, 7, 3]], ["auto_unroll_max_step", "ot", 0], ["unroll_explicit", "ot", 1]]}, "result": [[0.016934668166666667], 0, 2.9272966384887695, 1638634045.8024771], "version": 0.2, "tvm_version": "0.9.dev0"}
{"input": ["rocm -keys=rocm,gpu -max_num_threads=256 -mcpu=gfx906 -mtriple=amdgcn-amd-amdhsa-hcc -thread_warp_size=64", "depthwise_conv2d_nchw.cuda", [["TENSOR", [128, 84, 42, 42], "float32"], ["TENSOR", [84, 1, 7, 7], "float32"], 1, "SAME", 1, "float32"], {}], "config": {"index": 998651, "code_hash": null, "entity": [["tile_f", "sp", [-1, 1, 4, 3]], ["tile_y", "sp", [-1, 1, 7, 2]], ["tile_x", "sp", [-1, 1, 7, 2]], ["auto_unroll_max_step", "ot", 256], ["unroll_explicit", "ot", 1]]}, "result": [[0.001091325696969697], 0, 3.047767162322998, 1638634048.0825312], "version": 0.2, "tvm_version": "0.9.dev0"}
{"input": ["rocm -keys=rocm,gpu -max_num_threads=256 -mcpu=gfx906 -mtriple=amdgcn-amd-amdhsa-hcc -thread_warp_size=64", "depthwise_conv2d_nchw.cuda", [["TENSOR", [128, 84, 42, 42], "float32"], ["TENSOR", [84, 1, 7, 7], "float32"], 1, "SAME", 1, "float32"], {}], "config": {"index": 1321176, "code_hash": null, "entity": [["tile_f", "sp", [-1, 3, 1, 2]], ["tile_y", "sp", [-1, 2, 1, 1]], ["tile_x", "sp", [-1, 2, 1, 1]], ["auto_unroll_max_step", "ot", 1500], ["unroll_explicit", "ot", 1]]}, "result": [[0.040486087750000004], 0, 5.047809362411499, 1638634050.3867393], "version": 0.2, "tvm_version": "0.9.dev0"}
{"input": ["rocm -keys=rocm,gpu -max_num_threads=256 -mcpu=gfx906 -mtriple=amdgcn-amd-amdhsa-hcc -thread_warp_size=64", "depthwise_conv2d_nchw.cuda", [["TENSOR", [128, 84, 42, 42], "float32"], ["TENSOR", [84, 1, 7, 7], "float32"], 1, "SAME", 1, "float32"], {}], "config": {"index": 398881, "code_hash": null, "entity": [["tile_f", "sp", [-1, 2, 1, 1]], ["tile_y", "sp", [-1, 2, 1, 21]], ["tile_x", "sp", [-1, 7, 1, 3]], ["auto_unroll_max_step", "ot", 0], ["unroll_explicit", "ot", 1]]}, "result": [[0.9502947387499999], 0, 8.619977712631226, 1638634066.9384136], "version": 0.2, "tvm_version": "0.9.dev0"}
{"input": ["rocm -keys=rocm,gpu -max_num_threads=256 -mcpu=gfx906 -mtriple=amdgcn-amd-amdhsa-hcc -thread_warp_size=64", "depthwise_conv2d_nchw.cuda", [["TENSOR", [128, 84, 42, 42], "float32"], ["TENSOR", [84, 1, 7, 7], "float32"], 1, "SAME", 1, "float32"], {}], "config": {"index": 1265920, "code_hash": null, "entity": [["tile_f", "sp", [-1, 1, 1, 1]], ["tile_y", "sp", [-1, 1, 2, 3]], ["tile_x", "sp", [-1, 1, 3, 14]], ["auto_unroll_max_step", "ot", 256], ["unroll_explicit", "ot", 1]]}, "result": [[0.016220947222222223], 0, 3.6249146461486816, 1638634068.828902], "version": 0.2, "tvm_version": "0.9.dev0"}
{"input": ["rocm -keys=rocm,gpu -max_num_threads=256 -mcpu=gfx906 -mtriple=amdgcn-amd-amdhsa-hcc -thread_warp_size=64", "depthwise_conv2d_nchw.cuda", [["TENSOR", [128, 84, 42, 42], "float32"], ["TENSOR", [84, 1, 7, 7], "float32"], 1, "SAME", 1, "float32"], {}], "config": {"index": 476821, "code_hash": null, "entity": [["tile_f", "sp", [-1, 2, 3, 1]], ["tile_y", "sp", [-1, 1, 1, 3]], ["tile_x", "sp", [-1, 7, 1, 6]], ["auto_unroll_max_step", "ot", 0], ["unroll_explicit", "ot", 1]]}, "result": [[0.18810290524999998], 0, 4.588559865951538, 1638634272.3148117], "version": 0.2, "tvm_version": "0.9.dev0"}
{"input": ["rocm -keys=rocm,gpu -max_num_threads=256 -mcpu=gfx906 -mtriple=amdgcn-amd-amdhsa-hcc -thread_warp_size=64", "depthwise_conv2d_nchw.cuda", [["TENSOR", [128, 84, 42, 42], "float32"], ["TENSOR", [84, 1, 7, 7], "float32"], 1, "SAME", 1, "float32"], {}], "config": {"index": 1085900, "code_hash": null, "entity": [["tile_f", "sp", [-1, 3, 1, 14]], ["tile_y", "sp", [-1, 3, 1, 1]], ["tile_x", "sp", [-1, 1, 7, 3]], ["auto_unroll_max_step", "ot", 256], ["unroll_explicit", "ot", 1]]}, "result": [[0.146170761], 0, 5.390207529067993, 1638634275.0814369], "version": 0.2, "tvm_version": "0.9.dev0"}
{"input": ["rocm -keys=rocm,gpu -max_num_threads=256 -mcpu=gfx906 -mtriple=amdgcn-amd-amdhsa-hcc -thread_warp_size=64", "depthwise_conv2d_nchw.cuda", [["TENSOR", [128, 84, 42, 42], "float32"], ["TENSOR", [84, 1, 7, 7], "float32"], 1, "SAME", 1, "float32"], {}], "config": {"index": 827145, "code_hash": null, "entity": [["tile_f", "sp", [-1, 1, 7, 4]], ["tile_y", "sp", [-1, 2, 1, 7]], ["tile_x", "sp", [-1, 1, 6, 1]], ["auto_unroll_max_step", "ot", 256], ["unroll_explicit", "ot", 1]]}, "result": [[0.020458784666666667], 0, 6.591183185577393, 1638634277.2200575], "version": 0.2, "tvm_version": "0.9.dev0"}
{"input": ["rocm -keys=rocm,gpu -max_num_threads=256 -mcpu=gfx906 -mtriple=amdgcn-amd-amdhsa-hcc -thread_warp_size=64", "depthwise_conv2d_nchw.cuda", [["TENSOR", [128, 84, 42, 42], "float32"], ["TENSOR", [84, 1, 7, 7], "float32"], 1, "SAME", 1, "float32"], {}], "config": {"index": 621072, "code_hash": null, "entity": [["tile_f", "sp", [-1, 1, 2, 6]], ["tile_y", "sp", [-1, 7, 2, 3]], ["tile_x", "sp", [-1, 1, 1, 21]], ["auto_unroll_max_step", "ot", 0], ["unroll_explicit", "ot", 1]]}, "result": [[0.11153357674999999], 0, 5.10567569732666, 1638634279.7529085], "version": 0.2, "tvm_version": "0.9.dev0"}
{"input": ["rocm -keys=rocm,gpu -max_num_threads=256 -mcpu=gfx906 -mtriple=amdgcn-amd-amdhsa-hcc -thread_warp_size=64", "depthwise_conv2d_nchw.cuda", [["TENSOR", [128, 84, 42, 42], "float32"], ["TENSOR", [84, 1, 7, 7], "float32"], 1, "SAME", 1, "float32"], {}], "config": {"index": 884918, "code_hash": null, "entity": [["tile_f", "sp", [-1, 2, 1, 7]], ["tile_y", "sp", [-1, 1, 42, 1]], ["tile_x", "sp", [-1, 1, 14, 1]], ["auto_unroll_max_step", "ot", 256], ["unroll_explicit", "ot", 1]]}, "result": [[0.0253864765], 0, 5.395697593688965, 1638634282.2261162], "version": 0.2, "tvm_version": "0.9.dev0"}
{"input": ["rocm -keys=rocm,gpu -max_num_threads=256 -mcpu=gfx906 -mtriple=amdgcn-amd-amdhsa-hcc -thread_warp_size=64", "depthwise_conv2d_nchw.cuda", [["TENSOR", [128, 84, 42, 42], "float32"], ["TENSOR", [84, 1, 7, 7], "float32"], 1, "SAME", 1, "float32"], {}], "config": {"index": 688641, "code_hash": null, "entity": [["tile_f", "sp", [-1, 2, 1, 1]], ["tile_y", "sp", [-1, 1, 6, 1]], ["tile_x", "sp", [-1, 6, 1, 1]], ["auto_unroll_max_step", "ot", 256], ["unroll_explicit", "ot", 1]]}, "result": [[0.055611984249999996], 0, 4.862465143203735, 1638634284.6269393], "version": 0.2, "tvm_version": "0.9.dev0"}
{"input": ["rocm -keys=rocm,gpu -max_num_threads=256 -mcpu=gfx906 -mtriple=amdgcn-amd-amdhsa-hcc -thread_warp_size=64", "depthwise_conv2d_nchw.cuda", [["TENSOR", [128, 84, 42, 42], "float32"], ["TENSOR", [84, 1, 7, 7], "float32"], 1, "SAME", 1, "float32"], {}], "config": {"index": 1192823, "code_hash": null, "entity": [["tile_f", "sp", [-1, 7, 3, 1]], ["tile_y", "sp", [-1, 1, 3, 2]], ["tile_x", "sp", [-1, 1, 2, 7]], ["auto_unroll_max_step", "ot", 256], ["unroll_explicit", "ot", 1]]}, "result": [[0.038467876250000005], 0, 4.384326457977295, 1638634286.3671918], "version": 0.2, "tvm_version": "0.9.dev0"}
{"input": ["rocm -keys=rocm,gpu -max_num_threads=256 -mcpu=gfx906 -mtriple=amdgcn-amd-amdhsa-hcc -thread_warp_size=64", "depthwise_conv2d_nchw.cuda", [["TENSOR", [128, 84, 42, 42], "float32"], ["TENSOR", [84, 1, 7, 7], "float32"], 1, "SAME", 1, "float32"], {}], "config": {"index": 1490934, "code_hash": null, "entity": [["tile_f", "sp", [-1, 1, 1, 2]], ["tile_y", "sp", [-1, 7, 1, 3]], ["tile_x", "sp", [-1, 7, 6, 1]], ["auto_unroll_max_step", "ot", 1500], ["unroll_explicit", "ot", 1]]}, "result": [[0.10885015099999999], 0, 9.304291486740112, 1638634288.4556713], "version": 0.2, "tvm_version": "0.9.dev0"}
{"input": ["rocm -keys=rocm,gpu -max_num_threads=256 -mcpu=gfx906 -mtriple=amdgcn-amd-amdhsa-hcc -thread_warp_size=64", "depthwise_conv2d_nchw.cuda", [["TENSOR", [128, 84, 42, 42], "float32"], ["TENSOR", [84, 1, 7, 7], "float32"], 1, "SAME", 1, "float32"], {}], "config": {"index": 158021, "code_hash": null, "entity": [["tile_f", "sp", [-1, 7, 1, 4]], ["tile_y", "sp", [-1, 1, 1, 2]], ["tile_x", "sp", [-1, 14, 3, 1]], ["auto_unroll_max_step", "ot", 0], ["unroll_explicit", "ot", 1]]}, "result": [[1.7541221922499999], 0, 15.439921140670776, 1638634298.7404459], "version": 0.2, "tvm_version": "0.9.dev0"}
{"input": ["rocm -keys=rocm,gpu -max_num_threads=256 -mcpu=gfx906 -mtriple=amdgcn-amd-amdhsa-hcc -thread_warp_size=64", "depthwise_conv2d_nchw.cuda", [["TENSOR", [128, 84, 42, 42], "float32"], ["TENSOR", [84, 1, 7, 7], "float32"], 1, "SAME", 1, "float32"], {}], "config": {"index": 282977, "code_hash": null, "entity": [["tile_f", "sp", [-1, 2, 14, 3]], ["tile_y", "sp", [-1, 1, 2, 3]], ["tile_x", "sp", [-1, 1, 1, 2]], ["auto_unroll_max_step", "ot", 0], ["unroll_explicit", "ot", 1]]}, "result": [[0.0687417295], 0, 5.070595026016235, 1638634300.6672018], "version": 0.2, "tvm_version": "0.9.dev0"}
{"input": ["rocm -keys=rocm,gpu -max_num_threads=256 -mcpu=gfx906 -mtriple=amdgcn-amd-amdhsa-hcc -thread_warp_size=64", "depthwise_conv2d_nchw.cuda", [["TENSOR", [128, 84, 42, 42], "float32"], ["TENSOR", [84, 1, 7, 7], "float32"], 1, "SAME", 1, "float32"], {}], "config": {"index": 77466, "code_hash": null, "entity": [["tile_f", "sp", [-1, 1, 4, 1]], ["tile_y", "sp", [-1, 1, 1, 3]], ["tile_x", "sp", [-1, 42, 1, 1]], ["auto_unroll_max_step", "ot", 0], ["unroll_explicit", "ot", 1]]}, "result": [[0.19624551375], 0, 6.687631368637085, 1638634303.1782238], "version": 0.2, "tvm_version": "0.9.dev0"}
{"input": ["rocm -keys=rocm,gpu -max_num_threads=256 -mcpu=gfx906 -mtriple=amdgcn-amd-amdhsa-hcc -thread_warp_size=64", "depthwise_conv2d_nchw.cuda", [["TENSOR", [128, 84, 42, 42], "float32"], ["TENSOR", [84, 1, 7, 7], "float32"], 1, "SAME", 1, "float32"], {}], "config": {"index": 608909, "code_hash": null, "entity": [["tile_f", "sp", [-1, 2, 1, 6]], ["tile_y", "sp", [-1, 7, 1, 2]], ["tile_x", "sp", [-1, 1, 3, 14]], ["auto_unroll_max_step", "ot", 0], ["unroll_explicit", "ot", 1]]}, "result": [[0.21266587825], 0, 4.1207451820373535, 1638634305.8246012], "version": 0.2, "tvm_version": "0.9.dev0"}
{"input": ["rocm -keys=rocm,gpu -max_num_threads=256 -mcpu=gfx906 -mtriple=amdgcn-amd-amdhsa-hcc -thread_warp_size=64", "depthwise_conv2d_nchw.cuda", [["TENSOR", [128, 84, 42, 42], "float32"], ["TENSOR", [84, 1, 7, 7], "float32"], 1, "SAME", 1, "float32"], {}], "config": {"index": 1544321, "code_hash": null, "entity": [["tile_f", "sp", [-1, 2, 1, 1]], ["tile_y", "sp", [-1, 1, 2, 7]], ["tile_x", "sp", [-1, 1, 14, 1]], ["auto_unroll_max_step", "ot", 1500], ["unroll_explicit", "ot", 1]]}, "result": [[0.003500557724137931], 0, 4.280570030212402, 1638634415.1874871], "version": 0.2, "tvm_version": "0.9.dev0"}
{"input": ["rocm -keys=rocm,gpu -max_num_threads=256 -mcpu=gfx906 -mtriple=amdgcn-amd-amdhsa-hcc -thread_warp_size=64", "depthwise_conv2d_nchw.cuda", [["TENSOR", [128, 84, 42, 42], "float32"], ["TENSOR", [84, 1, 7, 7], "float32"], 1, "SAME", 1, "float32"], {}], "config": {"index": 888961, "code_hash": null, "entity": [["tile_f", "sp", [-1, 2, 1, 1]], ["tile_y", "sp", [-1, 1, 2, 7]], ["tile_x", "sp", [-1, 1, 14, 1]], ["auto_unroll_max_step", "ot", 256], ["unroll_explicit", "ot", 1]]}, "result": [[0.00348847275862069], 0, 4.3399975299835205, 1638634417.2489703], "version": 0.2, "tvm_version": "0.9.dev0"}
{"input": ["rocm -keys=rocm,gpu -max_num_threads=256 -mcpu=gfx906 -mtriple=amdgcn-amd-amdhsa-hcc -thread_warp_size=64", "depthwise_conv2d_nchw.cuda", [["TENSOR", [128, 84, 42, 42], "float32"], ["TENSOR", [84, 1, 7, 7], "float32"], 1, "SAME", 1, "float32"], {}], "config": {"index": 1544332, "code_hash": null, "entity": [["tile_f", "sp", [-1, 1, 2, 1]], ["tile_y", "sp", [-1, 1, 2, 7]], ["tile_x", "sp", [-1, 1, 14, 1]], ["auto_unroll_max_step", "ot", 1500], ["unroll_explicit", "ot", 1]]}, "result": [[0.0005661764351145038], 0, 3.4406003952026367, 1638634419.4080148], "version": 0.2, "tvm_version": "0.9.dev0"}
{"input": ["rocm -keys=rocm,gpu -max_num_threads=256 -mcpu=gfx906 -mtriple=amdgcn-amd-amdhsa-hcc -thread_warp_size=64", "depthwise_conv2d_nchw.cuda", [["TENSOR", [128, 84, 42, 42], "float32"], ["TENSOR", [84, 1, 7, 7], "float32"], 1, "SAME", 1, "float32"], {}], "config": {"index": 888972, "code_hash": null, "entity": [["tile_f", "sp", [-1, 1, 2, 1]], ["tile_y", "sp", [-1, 1, 2, 7]], ["tile_x", "sp", [-1, 1, 14, 1]], ["auto_unroll_max_step", "ot", 256], ["unroll_explicit", "ot", 1]]}, "result": [[0.0005657972319391634], 0, 3.349733829498291, 1638634421.4133363], "version": 0.2, "tvm_version": "0.9.dev0"}
{"input": ["rocm -keys=rocm,gpu -max_num_threads=256 -mcpu=gfx906 -mtriple=amdgcn-amd-amdhsa-hcc -thread_warp_size=64", "depthwise_conv2d_nchw.cuda", [["TENSOR", [128, 84, 42, 42], "float32"], ["TENSOR", [84, 1, 7, 7], "float32"], 1, "SAME", 1, "float32"], {}], "config": {"index": 1190892, "code_hash": null, "entity": [["tile_f", "sp", [-1, 1, 2, 1]], ["tile_y", "sp", [-1, 2, 7, 1]], ["tile_x", "sp", [-1, 1, 2, 7]], ["auto_unroll_max_step", "ot", 256], ["unroll_explicit", "ot", 1]]}, "result": [[0.0009187992193548389], 0, 4.112100839614868, 1638634423.4023309], "version": 0.2, "tvm_version": "0.9.dev0"}
{"input": ["rocm -keys=rocm,gpu -max_num_threads=256 -mcpu=gfx906 -mtriple=amdgcn-amd-amdhsa-hcc -thread_warp_size=64", "depthwise_conv2d_nchw.cuda", [["TENSOR", [128, 84, 42, 42], "float32"], ["TENSOR", [84, 1, 7, 7], "float32"], 1, "SAME", 1, "float32"], {}], "config": {"index": 1846252, "code_hash": null, "entity": [["tile_f", "sp", [-1, 1, 2, 1]], ["tile_y", "sp", [-1, 2, 7, 1]], ["tile_x", "sp", [-1, 1, 2, 7]], ["auto_unroll_max_step", "ot", 1500], ["unroll_explicit", "ot", 1]]}, "result": [[0.000918029391025641], 0, 4.362354516983032, 1638634425.5604694], "version": 0.2, "tvm_version": "0.9.dev0"}
{"input": ["rocm -keys=rocm,gpu -max_num_threads=256 -mcpu=gfx906 -mtriple=amdgcn-amd-amdhsa-hcc -thread_warp_size=64", "depthwise_conv2d_nchw.cuda", [["TENSOR", [128, 84, 42, 42], "float32"], ["TENSOR", [84, 1, 7, 7], "float32"], 1, "SAME", 1, "float32"], {}], "config": {"index": 233601, "code_hash": null, "entity": [["tile_f", "sp", [-1, 2, 1, 1]], ["tile_y", "sp", [-1, 1, 2, 7]], ["tile_x", "sp", [-1, 1, 14, 1]], ["auto_unroll_max_step", "ot", 0], ["unroll_explicit", "ot", 1]]}, "result": [[0.0033873283333333334], 0, 3.496490240097046, 1638634427.6256466], "version": 0.2, "tvm_version": "0.9.dev0"}
{"input": ["rocm -keys=rocm,gpu -max_num_threads=256 -mcpu=gfx906 -mtriple=amdgcn-amd-amdhsa-hcc -thread_warp_size=64", "depthwise_conv2d_nchw.cuda", [["TENSOR", [128, 84, 42, 42], "float32"], ["TENSOR", [84, 1, 7, 7], "float32"], 1, "SAME", 1, "float32"], {}], "config": {"index": 233612, "code_hash": null, "entity": [["tile_f", "sp", [-1, 1, 2, 1]], ["tile_y", "sp", [-1, 1, 2, 7]], ["tile_x", "sp", [-1, 1, 14, 1]], ["auto_unroll_max_step", "ot", 0], ["unroll_explicit", "ot", 1]]}, "result": [[0.0006578071590909091], 0, 3.530215263366699, 1638634429.8477511], "version": 0.2, "tvm_version": "0.9.dev0"}
{"input": ["rocm -keys=rocm,gpu -max_num_threads=256 -mcpu=gfx906 -mtriple=amdgcn-amd-amdhsa-hcc -thread_warp_size=64", "depthwise_conv2d_nchw.cuda", [["TENSOR", [128, 84, 42, 42], "float32"], ["TENSOR", [84, 1, 7, 7], "float32"], 1, "SAME", 1, "float32"], {}], "config": {"index": 888962, "code_hash": null, "entity": [["tile_f", "sp", [-1, 3, 1, 1]], ["tile_y", "sp", [-1, 1, 2, 7]], ["tile_x", "sp", [-1, 1, 14, 1]], ["auto_unroll_max_step", "ot", 256], ["unroll_explicit", "ot", 1]]}, "result": [[0.029044422], 0, 3.8848519325256348, 1638634431.7959735], "version": 0.2, "tvm_version": "0.9.dev0"}
{"input": ["rocm -keys=rocm,gpu -max_num_threads=256 -mcpu=gfx906 -mtriple=amdgcn-amd-amdhsa-hcc -thread_warp_size=64", "depthwise_conv2d_nchw.cuda", [["TENSOR", [128, 84, 42, 42], "float32"], ["TENSOR", [84, 1, 7, 7], "float32"], 1, "SAME", 1, "float32"], {}], "config": {"index": 1544322, "code_hash": null, "entity": [["tile_f", "sp", [-1, 3, 1, 1]], ["tile_y", "sp", [-1, 1, 2, 7]], ["tile_x", "sp", [-1, 1, 14, 1]], ["auto_unroll_max_step", "ot", 1500], ["unroll_explicit", "ot", 1]]}, "result": [[0.0045281372], 0, 4.9187304973602295, 1638634434.0359612], "version": 0.2, "tvm_version": "0.9.dev0"}
{"input": ["rocm -keys=rocm,gpu -max_num_threads=256 -mcpu=gfx906 -mtriple=amdgcn-amd-amdhsa-hcc -thread_warp_size=64", "depthwise_conv2d_nchw.cuda", [["TENSOR", [128, 84, 42, 42], "float32"], ["TENSOR", [84, 1, 7, 7], "float32"], 1, "SAME", 1, "float32"], {}], "config": {"index": 535532, "code_hash": null, "entity": [["tile_f", "sp", [-1, 1, 2, 1]], ["tile_y", "sp", [-1, 2, 7, 1]], ["tile_x", "sp", [-1, 1, 2, 7]], ["auto_unroll_max_step", "ot", 0], ["unroll_explicit", "ot", 1]]}, "result": [[0.001224302879310345], 0, 3.8910603523254395, 1638634436.1560438], "version": 0.2, "tvm_version": "0.9.dev0"}
{"input": ["rocm -keys=rocm,gpu -max_num_threads=256 -mcpu=gfx906 -mtriple=amdgcn-amd-amdhsa-hcc -thread_warp_size=64", "depthwise_conv2d_nchw.cuda", [["TENSOR", [128, 84, 42, 42], "float32"], ["TENSOR", [84, 1, 7, 7], "float32"], 1, "SAME", 1, "float32"], {}], "config": {"index": 1543852, "code_hash": null, "entity": [["tile_f", "sp", [-1, 1, 2, 1]], ["tile_y", "sp", [-1, 2, 1, 7]], ["tile_x", "sp", [-1, 1, 14, 1]], ["auto_unroll_max_step", "ot", 1500], ["unroll_explicit", "ot", 1]]}, "result": [[0.005613493166666667], 0, 4.322230577468872, 1638634438.2364345], "version": 0.2, "tvm_version": "0.9.dev0"}
{"input": ["rocm -keys=rocm,gpu -max_num_threads=256 -mcpu=gfx906 -mtriple=amdgcn-amd-amdhsa-hcc -thread_warp_size=64", "depthwise_conv2d_nchw.cuda", [["TENSOR", [128, 84, 42, 42], "float32"], ["TENSOR", [84, 1, 7, 7], "float32"], 1, "SAME", 1, "float32"], {}], "config": {"index": 888492, "code_hash": null, "entity": [["tile_f", "sp", [-1, 1, 2, 1]], ["tile_y", "sp", [-1, 2, 1, 7]], ["tile_x", "sp", [-1, 1, 14, 1]], ["auto_unroll_max_step", "ot", 256], ["unroll_explicit", "ot", 1]]}, "result": [[0.005613954277777777], 0, 4.211368083953857, 1638634440.396172], "version": 0.2, "tvm_version": "0.9.dev0"}
{"input": ["rocm -keys=rocm,gpu -max_num_threads=256 -mcpu=gfx906 -mtriple=amdgcn-amd-amdhsa-hcc -thread_warp_size=64", "depthwise_conv2d_nchw.cuda", [["TENSOR", [128, 84, 42, 42], "float32"], ["TENSOR", [84, 1, 7, 7], "float32"], 1, "SAME", 1, "float32"], {}], "config": {"index": 889016, "code_hash": null, "entity": [["tile_f", "sp", [-1, 3, 1, 2]], ["tile_y", "sp", [-1, 1, 2, 7]], ["tile_x", "sp", [-1, 1, 14, 1]], ["auto_unroll_max_step", "ot", 256], ["unroll_explicit", "ot", 1]]}, "result": [[0.0484979475], 0, 5.475798845291138, 1638634442.5967917], "version": 0.2, "tvm_version": "0.9.dev0"}
{"input": ["rocm -keys=rocm,gpu -max_num_threads=256 -mcpu=gfx906 -mtriple=amdgcn-amd-amdhsa-hcc -thread_warp_size=64", "depthwise_conv2d_nchw.cuda", [["TENSOR", [128, 84, 42, 42], "float32"], ["TENSOR", [84, 1, 7, 7], "float32"], 1, "SAME", 1, "float32"], {}], "config": {"index": 1544376, "code_hash": null, "entity": [["tile_f", "sp", [-1, 3, 1, 2]], ["tile_y", "sp", [-1, 1, 2, 7]], ["tile_x", "sp", [-1, 1, 14, 1]], ["auto_unroll_max_step", "ot", 1500], ["unroll_explicit", "ot", 1]]}, "result": [[0.043062804999999996], 0, 8.955572843551636, 1638634444.498097], "version": 0.2, "tvm_version": "0.9.dev0"}
{"input": ["rocm -keys=rocm,gpu -max_num_threads=256 -mcpu=gfx906 -mtriple=amdgcn-amd-amdhsa-hcc -thread_warp_size=64", "depthwise_conv2d_nchw.cuda", [["TENSOR", [128, 84, 42, 42], "float32"], ["TENSOR", [84, 1, 7, 7], "float32"], 1, "SAME", 1, "float32"], {}], "config": {"index": 1544375, "code_hash": null, "entity": [["tile_f", "sp", [-1, 2, 1, 2]], ["tile_y", "sp", [-1, 1, 2, 7]], ["tile_x", "sp", [-1, 1, 14, 1]], ["auto_unroll_max_step", "ot", 1500], ["unroll_explicit", "ot", 1]]}, "result": [[0.008809445666666667], 0, 5.529857158660889, 1638634446.376996], "version": 0.2, "tvm_version": "0.9.dev0"}
{"input": ["rocm -keys=rocm,gpu -max_num_threads=256 -mcpu=gfx906 -mtriple=amdgcn-amd-amdhsa-hcc -thread_warp_size=64", "depthwise_conv2d_nchw.cuda", [["TENSOR", [128, 84, 42, 42], "float32"], ["TENSOR", [84, 1, 7, 7], "float32"], 1, "SAME", 1, "float32"], {}], "config": {"index": 889015, "code_hash": null, "entity": [["tile_f", "sp", [-1, 2, 1, 2]], ["tile_y", "sp", [-1, 1, 2, 7]], ["tile_x", "sp", [-1, 1, 14, 1]], ["auto_unroll_max_step", "ot", 256], ["unroll_explicit", "ot", 1]]}, "result": [[0.008697573916666666], 0, 5.86452317237854, 1638634448.5866034], "version": 0.2, "tvm_version": "0.9.dev0"}
{"input": ["rocm -keys=rocm,gpu -max_num_threads=256 -mcpu=gfx906 -mtriple=amdgcn-amd-amdhsa-hcc -thread_warp_size=64", "depthwise_conv2d_nchw.cuda", [["TENSOR", [128, 84, 42, 42], "float32"], ["TENSOR", [84, 1, 7, 7], "float32"], 1, "SAME", 1, "float32"], {}], "config": {"index": 979532, "code_hash": null, "entity": [["tile_f", "sp", [-1, 1, 2, 1]], ["tile_y", "sp", [-1, 1, 7, 3]], ["tile_x", "sp", [-1, 1, 3, 2]], ["auto_unroll_max_step", "ot", 256], ["unroll_explicit", "ot", 1]]}, "result": [[0.0007344532864321609], 0, 3.336277961730957, 1638634450.6262584], "version": 0.2, "tvm_version": "0.9.dev0"}
{"input": ["rocm -keys=rocm,gpu -max_num_threads=256 -mcpu=gfx906 -mtriple=amdgcn-amd-amdhsa-hcc -thread_warp_size=64", "depthwise_conv2d_nchw.cuda", [["TENSOR", [128, 84, 42, 42], "float32"], ["TENSOR", [84, 1, 7, 7], "float32"], 1, "SAME", 1, "float32"], {}], "config": {"index": 1634892, "code_hash": null, "entity": [["tile_f", "sp", [-1, 1, 2, 1]], ["tile_y", "sp", [-1, 1, 7, 3]], ["tile_x", "sp", [-1, 1, 3, 2]], ["auto_unroll_max_step", "ot", 1500], ["unroll_explicit", "ot", 1]]}, "result": [[0.0007346017336683418], 0, 3.840376377105713, 1638634452.8573115], "version": 0.2, "tvm_version": "0.9.dev0"}
{"input": ["rocm -keys=rocm,gpu -max_num_threads=256 -mcpu=gfx906 -mtriple=amdgcn-amd-amdhsa-hcc -thread_warp_size=64", "depthwise_conv2d_nchw.cuda", [["TENSOR", [128, 84, 42, 42], "float32"], ["TENSOR", [84, 1, 7, 7], "float32"], 1, "SAME", 1, "float32"], {}], "config": {"index": 886007, "code_hash": null, "entity": [["tile_f", "sp", [-1, 1, 2, 3]], ["tile_y", "sp", [-1, 1, 7, 2]], ["tile_x", "sp", [-1, 1, 14, 1]], ["auto_unroll_max_step", "ot", 256], ["unroll_explicit", "ot", 1]]}, "result": [[0.000718221802955665], 0, 4.190607070922852, 1638634455.0131216], "version": 0.2, "tvm_version": "0.9.dev0"}
{"input": ["rocm -keys=rocm,gpu -max_num_threads=256 -mcpu=gfx906 -mtriple=amdgcn-amd-amdhsa-hcc -thread_warp_size=64", "depthwise_conv2d_nchw.cuda", [["TENSOR", [128, 84, 42, 42], "float32"], ["TENSOR", [84, 1, 7, 7], "float32"], 1, "SAME", 1, "float32"], {}], "config": {"index": 1541367, "code_hash": null, "entity": [["tile_f", "sp", [-1, 1, 2, 3]], ["tile_y", "sp", [-1, 1, 7, 2]], ["tile_x", "sp", [-1, 1, 14, 1]], ["auto_unroll_max_step", "ot", 1500], ["unroll_explicit", "ot", 1]]}, "result": [[0.0007202699108910891], 0, 3.7451894283294678, 1638634457.546164], "version": 0.2, "tvm_version": "0.9.dev0"}
{"input": ["rocm -keys=rocm,gpu -max_num_threads=256 -mcpu=gfx906 -mtriple=amdgcn-amd-amdhsa-hcc -thread_warp_size=64", "depthwise_conv2d_nchw.cuda", [["TENSOR", [128, 84, 42, 42], "float32"], ["TENSOR", [84, 1, 7, 7], "float32"], 1, "SAME", 1, "float32"], {}], "config": {"index": 233602, "code_hash": null, "entity": [["tile_f", "sp", [-1, 3, 1, 1]], ["tile_y", "sp", [-1, 1, 2, 7]], ["tile_x", "sp", [-1, 1, 14, 1]], ["auto_unroll_max_step", "ot", 0], ["unroll_explicit", "ot", 1]]}, "result": [[0.029484760250000002], 0, 4.496442794799805, 1638634459.9066584], "version": 0.2, "tvm_version": "0.9.dev0"}
{"input": ["rocm -keys=rocm,gpu -max_num_threads=256 -mcpu=gfx906 -mtriple=amdgcn-amd-amdhsa-hcc -thread_warp_size=64", "depthwise_conv2d_nchw.cuda", [["TENSOR", [128, 84, 42, 42], "float32"], ["TENSOR", [84, 1, 7, 7], "float32"], 1, "SAME", 1, "float32"], {}], "config": {"index": 1722901, "code_hash": null, "entity": [["tile_f", "sp", [-1, 2, 3, 1]], ["tile_y", "sp", [-1, 1, 6, 1]], ["tile_x", "sp", [-1, 1, 2, 3]], ["auto_unroll_max_step", "ot", 1500], ["unroll_explicit", "ot", 1]]}, "result": [[0.0013310601944444445], 0, 3.868401288986206, 1638634462.031882], "version": 0.2, "tvm_version": "0.9.dev0"}
{"input": ["rocm -keys=rocm,gpu -max_num_threads=256 -mcpu=gfx906 -mtriple=amdgcn-amd-amdhsa-hcc -thread_warp_size=64", "depthwise_conv2d_nchw.cuda", [["TENSOR", [128, 84, 42, 42], "float32"], ["TENSOR", [84, 1, 7, 7], "float32"], 1, "SAME", 1, "float32"], {}], "config": {"index": 1067541, "code_hash": null, "entity": [["tile_f", "sp", [-1, 2, 3, 1]], ["tile_y", "sp", [-1, 1, 6, 1]], ["tile_x", "sp", [-1, 1, 2, 3]], ["auto_unroll_max_step", "ot", 256], ["unroll_explicit", "ot", 1]]}, "result": [[0.001330663601851852], 0, 3.956435441970825, 1638634464.2598448], "version": 0.2, "tvm_version": "0.9.dev0"}
{"input": ["rocm -keys=rocm,gpu -max_num_threads=256 -mcpu=gfx906 -mtriple=amdgcn-amd-amdhsa-hcc -thread_warp_size=64", "depthwise_conv2d_nchw.cuda", [["TENSOR", [128, 84, 42, 42], "float32"], ["TENSOR", [84, 1, 7, 7], "float32"], 1, "SAME", 1, "float32"], {}], "config": {"index": 1088383, "code_hash": null, "entity": [["tile_f", "sp", [-1, 3, 2, 2]], ["tile_y", "sp", [-1, 1, 7, 1]], ["tile_x", "sp", [-1, 1, 7, 3]], ["auto_unroll_max_step", "ot", 256], ["unroll_explicit", "ot", 1]]}, "result": [[0.015763199857142855], 0, 6.361617088317871, 1638634466.4878159], "version": 0.2, "tvm_version": "0.9.dev0"}
{"input": ["rocm -keys=rocm,gpu -max_num_threads=256 -mcpu=gfx906 -mtriple=amdgcn-amd-amdhsa-hcc -thread_warp_size=64", "depthwise_conv2d_nchw.cuda", [["TENSOR", [128, 84, 42, 42], "float32"], ["TENSOR", [84, 1, 7, 7], "float32"], 1, "SAME", 1, "float32"], {}], "config": {"index": 1743743, "code_hash": null, "entity": [["tile_f", "sp", [-1, 3, 2, 2]], ["tile_y", "sp", [-1, 1, 7, 1]], ["tile_x", "sp", [-1, 1, 7, 3]], ["auto_unroll_max_step", "ot", 1500], ["unroll_explicit", "ot", 1]]}, "result": [[0.0025980392711864404], 0, 5.67415452003479, 1638634468.7581716], "version": 0.2, "tvm_version": "0.9.dev0"}
{"input": ["rocm -keys=rocm,gpu -max_num_threads=256 -mcpu=gfx906 -mtriple=amdgcn-amd-amdhsa-hcc -thread_warp_size=64", "depthwise_conv2d_nchw.cuda", [["TENSOR", [128, 84, 42, 42], "float32"], ["TENSOR", [84, 1, 7, 7], "float32"], 1, "SAME", 1, "float32"], {}], "config": {"index": 1722910, "code_hash": null, "entity": [["tile_f", "sp", [-1, 1, 6, 1]], ["tile_y", "sp", [-1, 1, 6, 1]], ["tile_x", "sp", [-1, 1, 2, 3]], ["auto_unroll_max_step", "ot", 1500], ["unroll_explicit", "ot", 1]]}, "result": [[0.0010083775071428572], 0, 3.1788506507873535, 1638634470.97429], "version": 0.2, "tvm_version": "0.9.dev0"}
{"input": ["rocm -keys=rocm,gpu -max_num_threads=256 -mcpu=gfx906 -mtriple=amdgcn-amd-amdhsa-hcc -thread_warp_size=64", "depthwise_conv2d_nchw.cuda", [["TENSOR", [128, 84, 42, 42], "float32"], ["TENSOR", [84, 1, 7, 7], "float32"], 1, "SAME", 1, "float32"], {}], "config": {"index": 1067550, "code_hash": null, "entity": [["tile_f", "sp", [-1, 1, 6, 1]], ["tile_y", "sp", [-1, 1, 6, 1]], ["tile_x", "sp", [-1, 1, 2, 3]], ["auto_unroll_max_step", "ot", 256], ["unroll_explicit", "ot", 1]]}, "result": [[0.0010080406142857143], 0, 3.5346133708953857, 1638634473.206122], "version": 0.2, "tvm_version": "0.9.dev0"}
{"input": ["rocm -keys=rocm,gpu -max_num_threads=256 -mcpu=gfx906 -mtriple=amdgcn-amd-amdhsa-hcc -thread_warp_size=64", "depthwise_conv2d_nchw.cuda", [["TENSOR", [128, 84, 42, 42], "float32"], ["TENSOR", [84, 1, 7, 7], "float32"], 1, "SAME", 1, "float32"], {}], "config": {"index": 1846732, "code_hash": null, "entity": [["tile_f", "sp", [-1, 1, 2, 1]], ["tile_y", "sp", [-1, 1, 14, 1]], ["tile_x", "sp", [-1, 1, 2, 7]], ["auto_unroll_max_step", "ot", 1500], ["unroll_explicit", "ot", 1]]}, "result": [[0.000591466987854251], 0, 3.4391064643859863, 1638634475.3777292], "version": 0.2, "tvm_version": "0.9.dev0"}
{"input": ["rocm -keys=rocm,gpu -max_num_threads=256 -mcpu=gfx906 -mtriple=amdgcn-amd-amdhsa-hcc -thread_warp_size=64", "depthwise_conv2d_nchw.cuda", [["TENSOR", [128, 84, 42, 42], "float32"], ["TENSOR", [84, 1, 7, 7], "float32"], 1, "SAME", 1, "float32"], {}], "config": {"index": 996333, "code_hash": null, "entity": [["tile_f", "sp", [-1, 2, 2, 1]], ["tile_y", "sp", [-1, 2, 7, 1]], ["tile_x", "sp", [-1, 1, 7, 2]], ["auto_unroll_max_step", "ot", 256], ["unroll_explicit", "ot", 1]]}, "result": [[0.0007057528916256157], 0, 3.8402700424194336, 1638634477.5373335], "version": 0.2, "tvm_version": "0.9.dev0"}
{"input": ["rocm -keys=rocm,gpu -max_num_threads=256 -mcpu=gfx906 -mtriple=amdgcn-amd-amdhsa-hcc -thread_warp_size=64", "depthwise_conv2d_nchw.cuda", [["TENSOR", [128, 84, 42, 42], "float32"], ["TENSOR", [84, 1, 7, 7], "float32"], 1, "SAME", 1, "float32"], {}], "config": {"index": 1651693, "code_hash": null, "entity": [["tile_f", "sp", [-1, 2, 2, 1]], ["tile_y", "sp", [-1, 2, 7, 1]], ["tile_x", "sp", [-1, 1, 7, 2]], ["auto_unroll_max_step", "ot", 1500], ["unroll_explicit", "ot", 1]]}, "result": [[0.0007062582385786801], 0, 4.038219928741455, 1638634479.7627301], "version": 0.2, "tvm_version": "0.9.dev0"}
{"input": ["rocm -keys=rocm,gpu -max_num_threads=256 -mcpu=gfx906 -mtriple=amdgcn-amd-amdhsa-hcc -thread_warp_size=64", "depthwise_conv2d_nchw.cuda", [["TENSOR", [128, 84, 42, 42], "float32"], ["TENSOR", [84, 1, 7, 7], "float32"], 1, "SAME", 1, "float32"], {}], "config": {"index": 1846093, "code_hash": null, "entity": [["tile_f", "sp", [-1, 2, 2, 1]], ["tile_y", "sp", [-1, 1, 7, 1]], ["tile_x", "sp", [-1, 1, 2, 7]], ["auto_unroll_max_step", "ot", 1500], ["unroll_explicit", "ot", 1]]}, "result": [[0.0013943870970873787], 0, 4.405514717102051, 1638634481.8828037], "version": 0.2, "tvm_version": "0.9.dev0"}
{"input": ["rocm -keys=rocm,gpu -max_num_threads=256 -mcpu=gfx906 -mtriple=amdgcn-amd-amdhsa-hcc -thread_warp_size=64", "depthwise_conv2d_nchw.cuda", [["TENSOR", [128, 84, 42, 42], "float32"], ["TENSOR", [84, 1, 7, 7], "float32"], 1, "SAME", 1, "float32"], {}], "config": {"index": 1190733, "code_hash": null, "entity": [["tile_f", "sp", [-1, 2, 2, 1]], ["tile_y", "sp", [-1, 1, 7, 1]], ["tile_x", "sp", [-1, 1, 2, 7]], ["auto_unroll_max_step", "ot", 256], ["unroll_explicit", "ot", 1]]}, "result": [[0.0013946841262135923], 0, 4.600726127624512, 1638634484.175536], "version": 0.2, "tvm_version": "0.9.dev0"}
{"input": ["rocm -keys=rocm,gpu -max_num_threads=256 -mcpu=gfx906 -mtriple=amdgcn-amd-amdhsa-hcc -thread_warp_size=64", "depthwise_conv2d_nchw.cuda", [["TENSOR", [128, 84, 42, 42], "float32"], ["TENSOR", [84, 1, 7, 7], "float32"], 1, "SAME", 1, "float32"], {}], "config": {"index": 233132, "code_hash": null, "entity": [["tile_f", "sp", [-1, 1, 2, 1]], ["tile_y", "sp", [-1, 2, 1, 7]], ["tile_x", "sp", [-1, 1, 14, 1]], ["auto_unroll_max_step", "ot", 0], ["unroll_explicit", "ot", 1]]}, "result": [[0.0051387142], 0, 4.076355695724487, 1638634486.3885005], "version": 0.2, "tvm_version": "0.9.dev0"}
{"input": ["rocm -keys=rocm,gpu -max_num_threads=256 -mcpu=gfx906 -mtriple=amdgcn-amd-amdhsa-hcc -thread_warp_size=64", "depthwise_conv2d_nchw.cuda", [["TENSOR", [128, 84, 42, 42], "float32"], ["TENSOR", [84, 1, 7, 7], "float32"], 1, "SAME", 1, "float32"], {}], "config": {"index": 889282, "code_hash": null, "entity": [["tile_f", "sp", [-1, 3, 1, 1]], ["tile_y", "sp", [-1, 1, 3, 7]], ["tile_x", "sp", [-1, 1, 14, 1]], ["auto_unroll_max_step", "ot", 256], ["unroll_explicit", "ot", 1]]}, "result": [[0.023826502333333333], 0, 4.846476793289185, 1638634488.8180232], "version": 0.2, "tvm_version": "0.9.dev0"}
{"input": ["rocm -keys=rocm,gpu -max_num_threads=256 -mcpu=gfx906 -mtriple=amdgcn-amd-amdhsa-hcc -thread_warp_size=64", "depthwise_conv2d_nchw.cuda", [["TENSOR", [128, 84, 42, 42], "float32"], ["TENSOR", [84, 1, 7, 7], "float32"], 1, "SAME", 1, "float32"], {}], "config": {"index": 1544642, "code_hash": null, "entity": [["tile_f", "sp", [-1, 3, 1, 1]], ["tile_y", "sp", [-1, 1, 3, 7]], ["tile_x", "sp", [-1, 1, 14, 1]], ["auto_unroll_max_step", "ot", 1500], ["unroll_explicit", "ot", 1]]}, "result": [[0.003861411153846154], 0, 4.7894606590271, 1638634491.0718243], "version": 0.2, "tvm_version": "0.9.dev0"}
{"input": ["rocm -keys=rocm,gpu -max_num_threads=256 -mcpu=gfx906 -mtriple=amdgcn-amd-amdhsa-hcc -thread_warp_size=64", "depthwise_conv2d_nchw.cuda", [["TENSOR", [128, 84, 42, 42], "float32"], ["TENSOR", [84, 1, 7, 7], "float32"], 1, "SAME", 1, "float32"], {}], "config": {"index": 233656, "code_hash": null, "entity": [["tile_f", "sp", [-1, 3, 1, 2]], ["tile_y", "sp", [-1, 1, 2, 7]], ["tile_x", "sp", [-1, 1, 14, 1]], ["auto_unroll_max_step", "ot", 0], ["unroll_explicit", "ot", 1]]}, "result": [[0.026807874500000002], 0, 4.8281731605529785, 1638634493.3561444], "version": 0.2, "tvm_version": "0.9.dev0"}
{"input": ["rocm -keys=rocm,gpu -max_num_threads=256 -mcpu=gfx906 -mtriple=amdgcn-amd-amdhsa-hcc -thread_warp_size=64", "depthwise_conv2d_nchw.cuda", [["TENSOR", [128, 84, 42, 42], "float32"], ["TENSOR", [84, 1, 7, 7], "float32"], 1, "SAME", 1, "float32"], {}], "config": {"index": 233655, "code_hash": null, "entity": [["tile_f", "sp", [-1, 2, 1, 2]], ["tile_y", "sp", [-1, 1, 2, 7]], ["tile_x", "sp", [-1, 1, 14, 1]], ["auto_unroll_max_step", "ot", 0], ["unroll_explicit", "ot", 1]]}, "result": [[0.038605472499999995], 0, 4.502152681350708, 1638634495.6924338], "version": 0.2, "tvm_version": "0.9.dev0"}
{"input": ["rocm -keys=rocm,gpu -max_num_threads=256 -mcpu=gfx906 -mtriple=amdgcn-amd-amdhsa-hcc -thread_warp_size=64", "depthwise_conv2d_nchw.cuda", [["TENSOR", [128, 84, 42, 42], "float32"], ["TENSOR", [84, 1, 7, 7], "float32"], 1, "SAME", 1, "float32"], {}], "config": {"index": 1544374, "code_hash": null, "entity": [["tile_f", "sp", [-1, 1, 1, 2]], ["tile_y", "sp", [-1, 1, 2, 7]], ["tile_x", "sp", [-1, 1, 14, 1]], ["auto_unroll_max_step", "ot", 1500], ["unroll_explicit", "ot", 1]]}, "result": [[0.0010501223741007193], 0, 4.084935903549194, 1638634498.0258653], "version": 0.2, "tvm_version": "0.9.dev0"}
{"input": ["rocm -keys=rocm,gpu -max_num_threads=256 -mcpu=gfx906 -mtriple=amdgcn-amd-amdhsa-hcc -thread_warp_size=64", "depthwise_conv2d_nchw.cuda", [["TENSOR", [128, 84, 42, 42], "float32"], ["TENSOR", [84, 1, 7, 7], "float32"], 1, "SAME", 1, "float32"], {}], "config": {"index": 889281, "code_hash": null, "entity": [["tile_f", "sp", [-1, 2, 1, 1]], ["tile_y", "sp", [-1, 1, 3, 7]], ["tile_x", "sp", [-1, 1, 14, 1]], ["auto_unroll_max_step", "ot", 256], ["unroll_explicit", "ot", 1]]}, "result": [[0.0032236914374999997], 0, 4.485251188278198, 1638634500.2261198], "version": 0.2, "tvm_version": "0.9.dev0"}
{"input": ["rocm -keys=rocm,gpu -max_num_threads=256 -mcpu=gfx906 -mtriple=amdgcn-amd-amdhsa-hcc -thread_warp_size=64", "depthwise_conv2d_nchw.cuda", [["TENSOR", [128, 84, 42, 42], "float32"], ["TENSOR", [84, 1, 7, 7], "float32"], 1, "SAME", 1, "float32"], {}], "config": {"index": 1544641, "code_hash": null, "entity": [["tile_f", "sp", [-1, 2, 1, 1]], ["tile_y", "sp", [-1, 1, 3, 7]], ["tile_x", "sp", [-1, 1, 14, 1]], ["auto_unroll_max_step", "ot", 1500], ["unroll_explicit", "ot", 1]]}, "result": [[0.00317398975], 0, 4.540818691253662, 1638634502.626293], "version": 0.2, "tvm_version": "0.9.dev0"}
{"input": ["rocm -keys=rocm,gpu -max_num_threads=256 -mcpu=gfx906 -mtriple=amdgcn-amd-amdhsa-hcc -thread_warp_size=64", "depthwise_conv2d_nchw.cuda", [["TENSOR", [128, 84, 42, 42], "float32"], ["TENSOR", [84, 1, 7, 7], "float32"], 1, "SAME", 1, "float32"], {}], "config": {"index": 324172, "code_hash": null, "entity": [["tile_f", "sp", [-1, 1, 2, 1]], ["tile_y", "sp", [-1, 1, 7, 3]], ["tile_x", "sp", [-1, 1, 3, 2]], ["auto_unroll_max_step", "ot", 0], ["unroll_explicit", "ot", 1]]}, "result": [[0.0009551090544217686], 0, 4.245936393737793, 1638634505.2919815], "version": 0.2, "tvm_version": "0.9.dev0"}
{"input": ["rocm -keys=rocm,gpu -max_num_threads=256 -mcpu=gfx906 -mtriple=amdgcn-amd-amdhsa-hcc -thread_warp_size=64", "depthwise_conv2d_nchw.cuda", [["TENSOR", [128, 84, 42, 42], "float32"], ["TENSOR", [84, 1, 7, 7], "float32"], 1, "SAME", 1, "float32"], {}], "config": {"index": 1027586, "code_hash": null, "entity": [["tile_f", "sp", [-1, 1, 3, 2]], ["tile_y", "sp", [-1, 1, 14, 1]], ["tile_x", "sp", [-1, 1, 1, 3]], ["auto_unroll_max_step", "ot", 256], ["unroll_explicit", "ot", 1]]}, "result": [[0.0016434587954545455], 0, 4.276749849319458, 1638634507.527219], "version": 0.2, "tvm_version": "0.9.dev0"}
{"input": ["rocm -keys=rocm,gpu -max_num_threads=256 -mcpu=gfx906 -mtriple=amdgcn-amd-amdhsa-hcc -thread_warp_size=64", "depthwise_conv2d_nchw.cuda", [["TENSOR", [128, 84, 42, 42], "float32"], ["TENSOR", [84, 1, 7, 7], "float32"], 1, "SAME", 1, "float32"], {}], "config": {"index": 1682946, "code_hash": null, "entity": [["tile_f", "sp", [-1, 1, 3, 2]], ["tile_y", "sp", [-1, 1, 14, 1]], ["tile_x", "sp", [-1, 1, 1, 3]], ["auto_unroll_max_step", "ot", 1500], ["unroll_explicit", "ot", 1]]}, "result": [[0.0016440493749999999], 0, 3.8836514949798584, 1638634509.7026641], "version": 0.2, "tvm_version": "0.9.dev0"}
{"input": ["rocm -keys=rocm,gpu -max_num_threads=256 -mcpu=gfx906 -mtriple=amdgcn-amd-amdhsa-hcc -thread_warp_size=64", "depthwise_conv2d_nchw.cuda", [["TENSOR", [128, 84, 42, 42], "float32"], ["TENSOR", [84, 1, 7, 7], "float32"], 1, "SAME", 1, "float32"], {}], "config": {"index": 1088063, "code_hash": null, "entity": [["tile_f", "sp", [-1, 3, 2, 2]], ["tile_y", "sp", [-1, 1, 6, 1]], ["tile_x", "sp", [-1, 1, 7, 3]], ["auto_unroll_max_step", "ot", 256], ["unroll_explicit", "ot", 1]]}, "result": [[0.016247579285714287], 0, 5.880672454833984, 1638634511.8089259], "version": 0.2, "tvm_version": "0.9.dev0"}
{"input": ["rocm -keys=rocm,gpu -max_num_threads=256 -mcpu=gfx906 -mtriple=amdgcn-amd-amdhsa-hcc -thread_warp_size=64", "depthwise_conv2d_nchw.cuda", [["TENSOR", [128, 84, 42, 42], "float32"], ["TENSOR", [84, 1, 7, 7], "float32"], 1, "SAME", 1, "float32"], {}], "config": {"index": 1743423, "code_hash": null, "entity": [["tile_f", "sp", [-1, 3, 2, 2]], ["tile_y", "sp", [-1, 1, 6, 1]], ["tile_x", "sp", [-1, 1, 7, 3]], ["auto_unroll_max_step", "ot", 1500], ["unroll_explicit", "ot", 1]]}, "result": [[0.002934672509433962], 0, 5.679206132888794, 1638634514.024107], "version": 0.2, "tvm_version": "0.9.dev0"}
{"input": ["rocm -keys=rocm,gpu -max_num_threads=256 -mcpu=gfx906 -mtriple=amdgcn-amd-amdhsa-hcc -thread_warp_size=64", "depthwise_conv2d_nchw.cuda", [["TENSOR", [128, 84, 42, 42], "float32"], ["TENSOR", [84, 1, 7, 7], "float32"], 1, "SAME", 1, "float32"], {}], "config": {"index": 888973, "code_hash": null, "entity": [["tile_f", "sp", [-1, 2, 2, 1]], ["tile_y", "sp", [-1, 1, 2, 7]], ["tile_x", "sp", [-1, 1, 14, 1]], ["auto_unroll_max_step", "ot", 256], ["unroll_explicit", "ot", 1]]}, "result": [[0.0025298498095238093], 0, 3.204437494277954, 1638634516.2547128], "version": 0.2, "tvm_version": "0.9.dev0"}
{"input": ["rocm -keys=rocm,gpu -max_num_threads=256 -mcpu=gfx906 -mtriple=amdgcn-amd-amdhsa-hcc -thread_warp_size=64", "depthwise_conv2d_nchw.cuda", [["TENSOR", [128, 84, 42, 42], "float32"], ["TENSOR", [84, 1, 7, 7], "float32"], 1, "SAME", 1, "float32"], {}], "config": {"index": 1544333, "code_hash": null, "entity": [["tile_f", "sp", [-1, 2, 2, 1]], ["tile_y", "sp", [-1, 1, 2, 7]], ["tile_x", "sp", [-1, 1, 14, 1]], ["auto_unroll_max_step", "ot", 1500], ["unroll_explicit", "ot", 1]]}, "result": [[0.0025301542698412697], 0, 3.200775146484375, 1638634518.4620934], "version": 0.2, "tvm_version": "0.9.dev0"}
{"input": ["rocm -keys=rocm,gpu -max_num_threads=256 -mcpu=gfx906 -mtriple=amdgcn-amd-amdhsa-hcc -thread_warp_size=64", "depthwise_conv2d_nchw.cuda", [["TENSOR", [128, 84, 42, 42], "float32"], ["TENSOR", [84, 1, 7, 7], "float32"], 1, "SAME", 1, "float32"], {}], "config": {"index": 1633460, "code_hash": null, "entity": [["tile_f", "sp", [-1, 1, 3, 1]], ["tile_y", "sp", [-1, 1, 7, 2]], ["tile_x", "sp", [-1, 1, 3, 2]], ["auto_unroll_max_step", "ot", 1500], ["unroll_explicit", "ot", 1]]}, "result": [[0.0006927184319248826], 0, 2.889676094055176, 1638634597.8088896], "version": 0.2, "tvm_version": "0.9.dev0"}
{"input": ["rocm -keys=rocm,gpu -max_num_threads=256 -mcpu=gfx906 -mtriple=amdgcn-amd-amdhsa-hcc -thread_warp_size=64", "depthwise_conv2d_nchw.cuda", [["TENSOR", [128, 84, 42, 42], "float32"], ["TENSOR", [84, 1, 7, 7], "float32"], 1, "SAME", 1, "float32"], {}], "config": {"index": 996382, "code_hash": null, "entity": [["tile_f", "sp", [-1, 1, 2, 2]], ["tile_y", "sp", [-1, 2, 7, 1]], ["tile_x", "sp", [-1, 1, 7, 2]], ["auto_unroll_max_step", "ot", 256], ["unroll_explicit", "ot", 1]]}, "result": [[0.0007020541034482759], 0, 3.3432605266571045, 1638634600.0846996], "version": 0.2, "tvm_version": "0.9.dev0"}
{"input": ["rocm -keys=rocm,gpu -max_num_threads=256 -mcpu=gfx906 -mtriple=amdgcn-amd-amdhsa-hcc -thread_warp_size=64", "depthwise_conv2d_nchw.cuda", [["TENSOR", [128, 84, 42, 42], "float32"], ["TENSOR", [84, 1, 7, 7], "float32"], 1, "SAME", 1, "float32"], {}], "config": {"index": 1651742, "code_hash": null, "entity": [["tile_f", "sp", [-1, 1, 2, 2]], ["tile_y", "sp", [-1, 2, 7, 1]], ["tile_x", "sp", [-1, 1, 7, 2]], ["auto_unroll_max_step", "ot", 1500], ["unroll_explicit", "ot", 1]]}, "result": [[0.0007020599317073171], 0, 3.2021584510803223, 1638634602.0916038], "version": 0.2, "tvm_version": "0.9.dev0"}
{"input": ["rocm -keys=rocm,gpu -max_num_threads=256 -mcpu=gfx906 -mtriple=amdgcn-amd-amdhsa-hcc -thread_warp_size=64", "depthwise_conv2d_nchw.cuda", [["TENSOR", [128, 84, 42, 42], "float32"], ["TENSOR", [84, 1, 7, 7], "float32"], 1, "SAME", 1, "float32"], {}], "config": {"index": 1653982, "code_hash": null, "entity": [["tile_f", "sp", [-1, 1, 2, 2]], ["tile_y", "sp", [-1, 1, 7, 2]], ["tile_x", "sp", [-1, 1, 7, 2]], ["auto_unroll_max_step", "ot", 1500], ["unroll_explicit", "ot", 1]]}, "result": [[0.0006528875366972477], 0, 3.2137839794158936, 1638634604.3094385], "version": 0.2, "tvm_version": "0.9.dev0"}
{"input": ["rocm -keys=rocm,gpu -max_num_threads=256 -mcpu=gfx906 -mtriple=amdgcn-amd-amdhsa-hcc -thread_warp_size=64", "depthwise_conv2d_nchw.cuda", [["TENSOR", [128, 84, 42, 42], "float32"], ["TENSOR", [84, 1, 7, 7], "float32"], 1, "SAME", 1, "float32"], {}], "config": {"index": 998622, "code_hash": null, "entity": [["tile_f", "sp", [-1, 1, 2, 2]], ["tile_y", "sp", [-1, 1, 7, 2]], ["tile_x", "sp", [-1, 1, 7, 2]], ["auto_unroll_max_step", "ot", 256], ["unroll_explicit", "ot", 1]]}, "result": [[0.000653161759090909], 0, 3.216042995452881, 1638634606.5943778], "version": 0.2, "tvm_version": "0.9.dev0"}
{"input": ["rocm -keys=rocm,gpu -max_num_threads=256 -mcpu=gfx906 -mtriple=amdgcn-amd-amdhsa-hcc -thread_warp_size=64", "depthwise_conv2d_nchw.cuda", [["TENSOR", [128, 84, 42, 42], "float32"], ["TENSOR", [84, 1, 7, 7], "float32"], 1, "SAME", 1, "float32"], {}], "config": {"index": 1510622, "code_hash": null, "entity": [["tile_f", "sp", [-1, 1, 2, 2]], ["tile_y", "sp", [-1, 1, 7, 2]], ["tile_x", "sp", [-1, 2, 7, 1]], ["auto_unroll_max_step", "ot", 1500], ["unroll_explicit", "ot", 1]]}, "result": [[0.0007152931674876846], 0, 3.1056182384490967, 1638634608.740252], "version": 0.2, "tvm_version": "0.9.dev0"}
{"input": ["rocm -keys=rocm,gpu -max_num_threads=256 -mcpu=gfx906 -mtriple=amdgcn-amd-amdhsa-hcc -thread_warp_size=64", "depthwise_conv2d_nchw.cuda", [["TENSOR", [128, 84, 42, 42], "float32"], ["TENSOR", [84, 1, 7, 7], "float32"], 1, "SAME", 1, "float32"], {}], "config": {"index": 855262, "code_hash": null, "entity": [["tile_f", "sp", [-1, 1, 2, 2]], ["tile_y", "sp", [-1, 1, 7, 2]], ["tile_x", "sp", [-1, 2, 7, 1]], ["auto_unroll_max_step", "ot", 256], ["unroll_explicit", "ot", 1]]}, "result": [[0.00071419197], 0, 3.252527952194214, 1638634611.008324], "version": 0.2, "tvm_version": "0.9.dev0"}
{"input": ["rocm -keys=rocm,gpu -max_num_threads=256 -mcpu=gfx906 -mtriple=amdgcn-amd-amdhsa-hcc -thread_warp_size=64", "depthwise_conv2d_nchw.cuda", [["TENSOR", [128, 84, 42, 42], "float32"], ["TENSOR", [84, 1, 7, 7], "float32"], 1, "SAME", 1, "float32"], {}], "config": {"index": 978100, "code_hash": null, "entity": [["tile_f", "sp", [-1, 1, 3, 1]], ["tile_y", "sp", [-1, 1, 7, 2]], ["tile_x", "sp", [-1, 1, 3, 2]], ["auto_unroll_max_step", "ot", 256], ["unroll_explicit", "ot", 1]]}, "result": [[0.0006926472238095238], 0, 3.488424301147461, 1638634613.584339], "version": 0.2, "tvm_version": "0.9.dev0"}
{"input": ["rocm -keys=rocm,gpu -max_num_threads=256 -mcpu=gfx906 -mtriple=amdgcn-amd-amdhsa-hcc -thread_warp_size=64", "depthwise_conv2d_nchw.cuda", [["TENSOR", [128, 84, 42, 42], "float32"], ["TENSOR", [84, 1, 7, 7], "float32"], 1, "SAME", 1, "float32"], {}], "config": {"index": 996226, "code_hash": null, "entity": [["tile_f", "sp", [-1, 1, 3, 2]], ["tile_y", "sp", [-1, 1, 7, 1]], ["tile_x", "sp", [-1, 1, 7, 2]], ["auto_unroll_max_step", "ot", 256], ["unroll_explicit", "ot", 1]]}, "result": [[0.0007798701396648045], 0, 3.3694801330566406, 1638634616.0912974], "version": 0.2, "tvm_version": "0.9.dev0"}
{"input": ["rocm -keys=rocm,gpu -max_num_threads=256 -mcpu=gfx906 -mtriple=amdgcn-amd-amdhsa-hcc -thread_warp_size=64", "depthwise_conv2d_nchw.cuda", [["TENSOR", [128, 84, 42, 42], "float32"], ["TENSOR", [84, 1, 7, 7], "float32"], 1, "SAME", 1, "float32"], {}], "config": {"index": 1651586, "code_hash": null, "entity": [["tile_f", "sp", [-1, 1, 3, 2]], ["tile_y", "sp", [-1, 1, 7, 1]], ["tile_x", "sp", [-1, 1, 7, 2]], ["auto_unroll_max_step", "ot", 1500], ["unroll_explicit", "ot", 1]]}, "result": [[0.0007765081236559139], 0, 2.5016119480133057, 1638634617.8463087], "version": 0.2, "tvm_version": "0.9.dev0"}
{"input": ["rocm -keys=rocm,gpu -max_num_threads=256 -mcpu=gfx906 -mtriple=amdgcn-amd-amdhsa-hcc -thread_warp_size=64", "depthwise_conv2d_nchw.cuda", [["TENSOR", [128, 84, 42, 42], "float32"], ["TENSOR", [84, 1, 7, 7], "float32"], 1, "SAME", 1, "float32"], {}], "config": {"index": 1631700, "code_hash": null, "entity": [["tile_f", "sp", [-1, 1, 3, 1]], ["tile_y", "sp", [-1, 1, 14, 1]], ["tile_x", "sp", [-1, 1, 3, 2]], ["auto_unroll_max_step", "ot", 1500], ["unroll_explicit", "ot", 1]]}, "result": [[0.0007144127737556561], 0, 2.2943594455718994, 1638634619.5386982], "version": 0.2, "tvm_version": "0.9.dev0"}
{"input": ["rocm -keys=rocm,gpu -max_num_threads=256 -mcpu=gfx906 -mtriple=amdgcn-amd-amdhsa-hcc -thread_warp_size=64", "depthwise_conv2d_nchw.cuda", [["TENSOR", [128, 84, 42, 42], "float32"], ["TENSOR", [84, 1, 7, 7], "float32"], 1, "SAME", 1, "float32"], {}], "config": {"index": 1191372, "code_hash": null, "entity": [["tile_f", "sp", [-1, 1, 2, 1]], ["tile_y", "sp", [-1, 1, 14, 1]], ["tile_x", "sp", [-1, 1, 2, 7]], ["auto_unroll_max_step", "ot", 256], ["unroll_explicit", "ot", 1]]}, "result": [[0.0005886903223140495], 0, 2.52042293548584, 1638634621.2537057], "version": 0.2, "tvm_version": "0.9.dev0"}
{"input": ["rocm -keys=rocm,gpu -max_num_threads=256 -mcpu=gfx906 -mtriple=amdgcn-amd-amdhsa-hcc -thread_warp_size=64", "depthwise_conv2d_nchw.cuda", [["TENSOR", [128, 84, 42, 42], "float32"], ["TENSOR", [84, 1, 7, 7], "float32"], 1, "SAME", 1, "float32"], {}], "config": {"index": 998573, "code_hash": null, "entity": [["tile_f", "sp", [-1, 2, 2, 1]], ["tile_y", "sp", [-1, 1, 7, 2]], ["tile_x", "sp", [-1, 1, 7, 2]], ["auto_unroll_max_step", "ot", 256], ["unroll_explicit", "ot", 1]]}, "result": [[0.0006397926428571428], 0, 2.911123752593994, 1638634623.0893102], "version": 0.2, "tvm_version": "0.9.dev0"}
{"input": ["rocm -keys=rocm,gpu -max_num_threads=256 -mcpu=gfx906 -mtriple=amdgcn-amd-amdhsa-hcc -thread_warp_size=64", "depthwise_conv2d_nchw.cuda", [["TENSOR", [128, 84, 42, 42], "float32"], ["TENSOR", [84, 1, 7, 7], "float32"], 1, "SAME", 1, "float32"], {}], "config": {"index": 1653933, "code_hash": null, "entity": [["tile_f", "sp", [-1, 2, 2, 1]], ["tile_y", "sp", [-1, 1, 7, 2]], ["tile_x", "sp", [-1, 1, 7, 2]], ["auto_unroll_max_step", "ot", 1500], ["unroll_explicit", "ot", 1]]}, "result": [[0.0006387940135746606], 0, 2.9973363876342773, 1638634624.842182], "version": 0.2, "tvm_version": "0.9.dev0"}
{"input": ["rocm -keys=rocm,gpu -max_num_threads=256 -mcpu=gfx906 -mtriple=amdgcn-amd-amdhsa-hcc -thread_warp_size=64", "depthwise_conv2d_nchw.cuda", [["TENSOR", [128, 84, 42, 42], "float32"], ["TENSOR", [84, 1, 7, 7], "float32"], 1, "SAME", 1, "float32"], {}], "config": {"index": 1633466, "code_hash": null, "entity": [["tile_f", "sp", [-1, 1, 4, 1]], ["tile_y", "sp", [-1, 1, 7, 2]], ["tile_x", "sp", [-1, 1, 3, 2]], ["auto_unroll_max_step", "ot", 1500], ["unroll_explicit", "ot", 1]]}, "result": [[0.0008311413674698796], 0, 2.62978458404541, 1638634626.6415718], "version": 0.2, "tvm_version": "0.9.dev0"}
{"input": ["rocm -keys=rocm,gpu -max_num_threads=256 -mcpu=gfx906 -mtriple=amdgcn-amd-amdhsa-hcc -thread_warp_size=64", "depthwise_conv2d_nchw.cuda", [["TENSOR", [128, 84, 42, 42], "float32"], ["TENSOR", [84, 1, 7, 7], "float32"], 1, "SAME", 1, "float32"], {}], "config": {"index": 341022, "code_hash": null, "entity": [["tile_f", "sp", [-1, 1, 2, 2]], ["tile_y", "sp", [-1, 2, 7, 1]], ["tile_x", "sp", [-1, 1, 7, 2]], ["auto_unroll_max_step", "ot", 0], ["unroll_explicit", "ot", 1]]}, "result": [[0.0008179963795180723], 0, 3.1176865100860596, 1638634628.4453921], "version": 0.2, "tvm_version": "0.9.dev0"}
{"input": ["rocm -keys=rocm,gpu -max_num_threads=256 -mcpu=gfx906 -mtriple=amdgcn-amd-amdhsa-hcc -thread_warp_size=64", "depthwise_conv2d_nchw.cuda", [["TENSOR", [128, 84, 42, 42], "float32"], ["TENSOR", [84, 1, 7, 7], "float32"], 1, "SAME", 1, "float32"], {}], "config": {"index": 343262, "code_hash": null, "entity": [["tile_f", "sp", [-1, 1, 2, 2]], ["tile_y", "sp", [-1, 1, 7, 2]], ["tile_x", "sp", [-1, 1, 7, 2]], ["auto_unroll_max_step", "ot", 0], ["unroll_explicit", "ot", 1]]}, "result": [[0.0007660583977272727], 0, 2.7960329055786133, 1638634630.2530267], "version": 0.2, "tvm_version": "0.9.dev0"}
{"input": ["rocm -keys=rocm,gpu -max_num_threads=256 -mcpu=gfx906 -mtriple=amdgcn-amd-amdhsa-hcc -thread_warp_size=64", "depthwise_conv2d_nchw.cuda", [["TENSOR", [128, 84, 42, 42], "float32"], ["TENSOR", [84, 1, 7, 7], "float32"], 1, "SAME", 1, "float32"], {}], "config": {"index": 976340, "code_hash": null, "entity": [["tile_f", "sp", [-1, 1, 3, 1]], ["tile_y", "sp", [-1, 1, 14, 1]], ["tile_x", "sp", [-1, 1, 3, 2]], ["auto_unroll_max_step", "ot", 256], ["unroll_explicit", "ot", 1]]}, "result": [[0.0007549690671641791], 0, 2.2671151161193848, 1638634631.9363315], "version": 0.2, "tvm_version": "0.9.dev0"}
{"input": ["rocm -keys=rocm,gpu -max_num_threads=256 -mcpu=gfx906 -mtriple=amdgcn-amd-amdhsa-hcc -thread_warp_size=64", "depthwise_conv2d_nchw.cuda", [["TENSOR", [128, 84, 42, 42], "float32"], ["TENSOR", [84, 1, 7, 7], "float32"], 1, "SAME", 1, "float32"], {}], "config": {"index": 1631220, "code_hash": null, "entity": [["tile_f", "sp", [-1, 1, 3, 1]], ["tile_y", "sp", [-1, 2, 7, 1]], ["tile_x", "sp", [-1, 1, 3, 2]], ["auto_unroll_max_step", "ot", 1500], ["unroll_explicit", "ot", 1]]}, "result": [[0.0007966935000000001], 0, 2.4159293174743652, 1638634633.6082256], "version": 0.2, "tvm_version": "0.9.dev0"}
{"input": ["rocm -keys=rocm,gpu -max_num_threads=256 -mcpu=gfx906 -mtriple=amdgcn-amd-amdhsa-hcc -thread_warp_size=64", "depthwise_conv2d_nchw.cuda", [["TENSOR", [128, 84, 42, 42], "float32"], ["TENSOR", [84, 1, 7, 7], "float32"], 1, "SAME", 1, "float32"], {}], "config": {"index": 1653626, "code_hash": null, "entity": [["tile_f", "sp", [-1, 1, 4, 1]], ["tile_y", "sp", [-1, 1, 3, 2]], ["tile_x", "sp", [-1, 1, 7, 2]], ["auto_unroll_max_step", "ot", 1500], ["unroll_explicit", "ot", 1]]}, "result": [[0.0007840274431818182], 0, 2.647355079650879, 1638634635.3986425], "version": 0.2, "tvm_version": "0.9.dev0"}
{"input": ["rocm -keys=rocm,gpu -max_num_threads=256 -mcpu=gfx906 -mtriple=amdgcn-amd-amdhsa-hcc -thread_warp_size=64", "depthwise_conv2d_nchw.cuda", [["TENSOR", [128, 84, 42, 42], "float32"], ["TENSOR", [84, 1, 7, 7], "float32"], 1, "SAME", 1, "float32"], {}], "config": {"index": 998266, "code_hash": null, "entity": [["tile_f", "sp", [-1, 1, 4, 1]], ["tile_y", "sp", [-1, 1, 3, 2]], ["tile_x", "sp", [-1, 1, 7, 2]], ["auto_unroll_max_step", "ot", 256], ["unroll_explicit", "ot", 1]]}, "result": [[0.0007839534469273742], 0, 2.625279664993286, 1638634637.1582754], "version": 0.2, "tvm_version": "0.9.dev0"}
{"input": ["rocm -keys=rocm,gpu -max_num_threads=256 -mcpu=gfx906 -mtriple=amdgcn-amd-amdhsa-hcc -thread_warp_size=64", "depthwise_conv2d_nchw.cuda", [["TENSOR", [128, 84, 42, 42], "float32"], ["TENSOR", [84, 1, 7, 7], "float32"], 1, "SAME", 1, "float32"], {}], "config": {"index": 1449140, "code_hash": null, "entity": [["tile_f", "sp", [-1, 1, 3, 1]], ["tile_y", "sp", [-1, 1, 7, 2]], ["tile_x", "sp", [-1, 2, 3, 1]], ["auto_unroll_max_step", "ot", 1500], ["unroll_explicit", "ot", 1]]}, "result": [[0.0007470795806451614], 0, 2.593275785446167, 1638634639.0033753], "version": 0.2, "tvm_version": "0.9.dev0"}
{"input": ["rocm -keys=rocm,gpu -max_num_threads=256 -mcpu=gfx906 -mtriple=amdgcn-amd-amdhsa-hcc -thread_warp_size=64", "depthwise_conv2d_nchw.cuda", [["TENSOR", [128, 84, 42, 42], "float32"], ["TENSOR", [84, 1, 7, 7], "float32"], 1, "SAME", 1, "float32"], {}], "config": {"index": 1653620, "code_hash": null, "entity": [["tile_f", "sp", [-1, 1, 3, 1]], ["tile_y", "sp", [-1, 1, 3, 2]], ["tile_x", "sp", [-1, 1, 7, 2]], ["auto_unroll_max_step", "ot", 1500], ["unroll_explicit", "ot", 1]]}, "result": [[0.0006715920947867297], 0, 2.545344114303589, 1638634640.7677958], "version": 0.2, "tvm_version": "0.9.dev0"}
{"input": ["rocm -keys=rocm,gpu -max_num_threads=256 -mcpu=gfx906 -mtriple=amdgcn-amd-amdhsa-hcc -thread_warp_size=64", "depthwise_conv2d_nchw.cuda", [["TENSOR", [128, 84, 42, 42], "float32"], ["TENSOR", [84, 1, 7, 7], "float32"], 1, "SAME", 1, "float32"], {}], "config": {"index": 998260, "code_hash": null, "entity": [["tile_f", "sp", [-1, 1, 3, 1]], ["tile_y", "sp", [-1, 1, 3, 2]], ["tile_x", "sp", [-1, 1, 7, 2]], ["auto_unroll_max_step", "ot", 256], ["unroll_explicit", "ot", 1]]}, "result": [[0.0006690114558139536], 0, 2.4242022037506104, 1638634642.5146341], "version": 0.2, "tvm_version": "0.9.dev0"}
