artifacts/Table4/tvm/autotvm/depthwise/depthwise_128_336_21_21_5_5_1_SAME.log
{"input": ["rocm -keys=rocm,gpu -max_num_threads=256 -mcpu=gfx906 -mtriple=amdgcn-amd-amdhsa-hcc -thread_warp_size=64", "depthwise_conv2d_nchw.cuda", [["TENSOR", [128, 336, 21, 21], "float32"], ["TENSOR", [336, 1, 5, 5], "float32"], 1, "SAME", 1, "float32"], {}], "config": {"index": 62873, "code_hash": null, "entity": [["tile_f", "sp", [-1, 3, 2, 2]], ["tile_y", "sp", [-1, 1, 1, 1]], ["tile_x", "sp", [-1, 3, 7, 1]], ["auto_unroll_max_step", "ot", 0], ["unroll_explicit", "ot", 1]]}, "result": [[0.019149248666666667], 0, 3.924227476119995, 1638603620.685466], "version": 0.2, "tvm_version": "0.9.dev0"}
{"input": ["rocm -keys=rocm,gpu -max_num_threads=256 -mcpu=gfx906 -mtriple=amdgcn-amd-amdhsa-hcc -thread_warp_size=64", "depthwise_conv2d_nchw.cuda", [["TENSOR", [128, 336, 21, 21], "float32"], ["TENSOR", [336, 1, 5, 5], "float32"], 1, "SAME", 1, "float32"], {}], "config": {"index": 354092, "code_hash": null, "entity": [["tile_f", "sp", [-1, 2, 4, 2]], ["tile_y", "sp", [-1, 1, 21, 1]], ["tile_x", "sp", [-1, 3, 7, 1]], ["auto_unroll_max_step", "ot", 1500], ["unroll_explicit", "ot", 1]]}, "result": [[0.0008227929768786128], 0, 3.4224212169647217, 1638603622.6934748], "version": 0.2, "tvm_version": "0.9.dev0"}
{"input": ["rocm -keys=rocm,gpu -max_num_threads=256 -mcpu=gfx906 -mtriple=amdgcn-amd-amdhsa-hcc -thread_warp_size=64", "depthwise_conv2d_nchw.cuda", [["TENSOR", [128, 336, 21, 21], "float32"], ["TENSOR", [336, 1, 5, 5], "float32"], 1, "SAME", 1, "float32"], {}], "config": {"index": 41185, "code_hash": null, "entity": [["tile_f", "sp", [-1, 2, 7, 4]], ["tile_y", "sp", [-1, 1, 1, 3]], ["tile_x", "sp", [-1, 1, 3, 1]], ["auto_unroll_max_step", "ot", 0], ["unroll_explicit", "ot", 1]]}, "result": [[0.023784754333333335], 0, 3.7962050437927246, 1638603624.8611317], "version": 0.2, "tvm_version": "0.9.dev0"}
{"input": ["rocm -keys=rocm,gpu -max_num_threads=256 -mcpu=gfx906 -mtriple=amdgcn-amd-amdhsa-hcc -thread_warp_size=64", "depthwise_conv2d_nchw.cuda", [["TENSOR", [128, 336, 21, 21], "float32"], ["TENSOR", [336, 1, 5, 5], "float32"], 1, "SAME", 1, "float32"], {}], "config": {"index": 99990, "code_hash": null, "entity": [["tile_f", "sp", [-1, 1, 12, 4]], ["tile_y", "sp", [-1, 7, 1, 1]], ["tile_x", "sp", [-1, 1, 7, 3]], ["auto_unroll_max_step", "ot", 0], ["unroll_explicit", "ot", 1]]}, "result": [[0.012614635375], 0, 3.9253528118133545, 1638603626.7464], "version": 0.2, "tvm_version": "0.9.dev0"}
{"input": ["rocm -keys=rocm,gpu -max_num_threads=256 -mcpu=gfx906 -mtriple=amdgcn-amd-amdhsa-hcc -thread_warp_size=64", "depthwise_conv2d_nchw.cuda", [["TENSOR", [128, 336, 21, 21], "float32"], ["TENSOR", [336, 1, 5, 5], "float32"], 1, "SAME", 1, "float32"], {}], "config": {"index": 414671, "code_hash": null, "entity": [["tile_f", "sp", [-1, 2, 1, 4]], ["tile_y", "sp", [-1, 1, 3, 1]], ["tile_x", "sp", [-1, 1, 3, 7]], ["auto_unroll_max_step", "ot", 1500], ["unroll_explicit", "ot", 1]]}, "result": [[0.004240726458333333], 0, 5.334601402282715, 1638603628.901544], "version": 0.2, "tvm_version": "0.9.dev0"}
{"input": ["rocm -keys=rocm,gpu -max_num_threads=256 -mcpu=gfx906 -mtriple=amdgcn-amd-amdhsa-hcc -thread_warp_size=64", "depthwise_conv2d_nchw.cuda", [["TENSOR", [128, 336, 21, 21], "float32"], ["TENSOR", [336, 1, 5, 5], "float32"], 1, "SAME", 1, "float32"], {}], "config": {"index": 39688, "code_hash": null, "entity": [["tile_f", "sp", [-1, 1, 2, 21]], ["tile_y", "sp", [-1, 1, 7, 1]], ["tile_x", "sp", [-1, 1, 3, 1]], ["auto_unroll_max_step", "ot", 0], ["unroll_explicit", "ot", 1]]}, "result": [[0.021597668833333333], 0, 4.026279449462891, 1638603631.2307758], "version": 0.2, "tvm_version": "0.9.dev0"}
{"input": ["rocm -keys=rocm,gpu -max_num_threads=256 -mcpu=gfx906 -mtriple=amdgcn-amd-amdhsa-hcc -thread_warp_size=64", "depthwise_conv2d_nchw.cuda", [["TENSOR", [128, 336, 21, 21], "float32"], ["TENSOR", [336, 1, 5, 5], "float32"], 1, "SAME", 1, "float32"], {}], "config": {"index": 373404, "code_hash": null, "entity": [["tile_f", "sp", [-1, 1, 1, 14]], ["tile_y", "sp", [-1, 7, 1, 3]], ["tile_x", "sp", [-1, 1, 1, 3]], ["auto_unroll_max_step", "ot", 1500], ["unroll_explicit", "ot", 1]]}, "result": [[0.23637013225], 0, 8.252270936965942, 1638603634.352409], "version": 0.2, "tvm_version": "0.9.dev0"}
{"input": ["rocm -keys=rocm,gpu -max_num_threads=256 -mcpu=gfx906 -mtriple=amdgcn-amd-amdhsa-hcc -thread_warp_size=64", "depthwise_conv2d_nchw.cuda", [["TENSOR", [128, 336, 21, 21], "float32"], ["TENSOR", [336, 1, 5, 5], "float32"], 1, "SAME", 1, "float32"], {}], "config": {"index": 11821, "code_hash": null, "entity": [["tile_f", "sp", [-1, 7, 6, 1]], ["tile_y", "sp", [-1, 7, 3, 1]], ["tile_x", "sp", [-1, 3, 1, 1]], ["auto_unroll_max_step", "ot", 0], ["unroll_explicit", "ot", 1]]}, "result": [[0.26879040525], 0, 6.55907678604126, 1638603637.6559913], "version": 0.2, "tvm_version": "0.9.dev0"}
{"input": ["rocm -keys=rocm,gpu -max_num_threads=256 -mcpu=gfx906 -mtriple=amdgcn-amd-amdhsa-hcc -thread_warp_size=64", "depthwise_conv2d_nchw.cuda", [["TENSOR", [128, 336, 21, 21], "float32"], ["TENSOR", [336, 1, 5, 5], "float32"], 1, "SAME", 1, "float32"], {}], "config": {"index": 270065, "code_hash": null, "entity": [["tile_f", "sp", [-1, 24, 1, 2]], ["tile_y", "sp", [-1, 7, 1, 1]], ["tile_x", "sp", [-1, 1, 3, 7]], ["auto_unroll_max_step", "ot", 256], ["unroll_explicit", "ot", 1]]}, "result": [[1.01313958725], 0, 11.345513105392456, 1638603644.6974204], "version": 0.2, "tvm_version": "0.9.dev0"}
{"input": ["rocm -keys=rocm,gpu -max_num_threads=256 -mcpu=gfx906 -mtriple=amdgcn-amd-amdhsa-hcc -thread_warp_size=64", "depthwise_conv2d_nchw.cuda", [["TENSOR", [128, 336, 21, 21], "float32"], ["TENSOR", [336, 1, 5, 5], "float32"], 1, "SAME", 1, "float32"], {}], "config": {"index": 17090, "code_hash": null, "entity": [["tile_f", "sp", [-1, 1, 3, 4]], ["tile_y", "sp", [-1, 1, 3, 7]], ["tile_x", "sp", [-1, 3, 1, 1]], ["auto_unroll_max_step", "ot", 0], ["unroll_explicit", "ot", 1]]}, "result": [[0.05135867675], 0, 4.984232664108276, 1638603648.9280035], "version": 0.2, "tvm_version": "0.9.dev0"}
{"input": ["rocm -keys=rocm,gpu -max_num_threads=256 -mcpu=gfx906 -mtriple=amdgcn-amd-amdhsa-hcc -thread_warp_size=64", "depthwise_conv2d_nchw.cuda", [["TENSOR", [128, 336, 21, 21], "float32"], ["TENSOR", [336, 1, 5, 5], "float32"], 1, "SAME", 1, "float32"], {}], "config": {"index": 54009, "code_hash": null, "entity": [["tile_f", "sp", [-1, 1, 7, 3]], ["tile_y", "sp", [-1, 1, 1, 1]], ["tile_x", "sp", [-1, 1, 7, 1]], ["auto_unroll_max_step", "ot", 0], ["unroll_explicit", "ot", 1]]}, "result": [[0.003830232142857143], 0, 3.192906379699707, 1638603651.227727], "version": 0.2, "tvm_version": "0.9.dev0"}
{"input": ["rocm -keys=rocm,gpu -max_num_threads=256 -mcpu=gfx906 -mtriple=amdgcn-amd-amdhsa-hcc -thread_warp_size=64", "depthwise_conv2d_nchw.cuda", [["TENSOR", [128, 336, 21, 21], "float32"], ["TENSOR", [336, 1, 5, 5], "float32"], 1, "SAME", 1, "float32"], {}], "config": {"index": 14174, "code_hash": null, "entity": [["tile_f", "sp", [-1, 6, 4, 2]], ["tile_y", "sp", [-1, 1, 1, 3]], ["tile_x", "sp", [-1, 3, 1, 1]], ["auto_unroll_max_step", "ot", 0], ["unroll_explicit", "ot", 1]]}, "result": [[0.10189294425], 0, 5.028450965881348, 1638603653.6489038], "version": 0.2, "tvm_version": "0.9.dev0"}
{"input": ["rocm -keys=rocm,gpu -max_num_threads=256 -mcpu=gfx906 -mtriple=amdgcn-amd-amdhsa-hcc -thread_warp_size=64", "depthwise_conv2d_nchw.cuda", [["TENSOR", [128, 336, 21, 21], "float32"], ["TENSOR", [336, 1, 5, 5], "float32"], 1, "SAME", 1, "float32"], {}], "config": {"index": 185717, "code_hash": null, "entity": [["tile_f", "sp", [-1, 4, 1, 7]], ["tile_y", "sp", [-1, 1, 7, 3]], ["tile_x", "sp", [-1, 1, 3, 1]], ["auto_unroll_max_step", "ot", 256], ["unroll_explicit", "ot", 1]]}, "result": [[0.015275382857142857], 0, 7.179367303848267, 1638603655.836096], "version": 0.2, "tvm_version": "0.9.dev0"}
{"input": ["rocm -keys=rocm,gpu -max_num_threads=256 -mcpu=gfx906 -mtriple=amdgcn-amd-amdhsa-hcc -thread_warp_size=64", "depthwise_conv2d_nchw.cuda", [["TENSOR", [128, 336, 21, 21], "float32"], ["TENSOR", [336, 1, 5, 5], "float32"], 1, "SAME", 1, "float32"], {}], "config": {"index": 190083, "code_hash": null, "entity": [["tile_f", "sp", [-1, 1, 4, 3]], ["tile_y", "sp", [-1, 21, 1, 1]], ["tile_x", "sp", [-1, 7, 3, 1]], ["auto_unroll_max_step", "ot", 256], ["unroll_explicit", "ot", 1]]}, "result": [[0.12303713225], 0, 5.946123838424683, 1638603658.3213892], "version": 0.2, "tvm_version": "0.9.dev0"}
{"input": ["rocm -keys=rocm,gpu -max_num_threads=256 -mcpu=gfx906 -mtriple=amdgcn-amd-amdhsa-hcc -thread_warp_size=64", "depthwise_conv2d_nchw.cuda", [["TENSOR", [128, 336, 21, 21], "float32"], ["TENSOR", [336, 1, 5, 5], "float32"], 1, "SAME", 1, "float32"], {}], "config": {"index": 304743, "code_hash": null, "entity": [["tile_f", "sp", [-1, 2, 21, 1]], ["tile_y", "sp", [-1, 1, 1, 1]], ["tile_x", "sp", [-1, 7, 1, 1]], ["auto_unroll_max_step", "ot", 1500], ["unroll_explicit", "ot", 1]]}, "result": [[0.01192249288888889], 0, 4.385197162628174, 1638603660.5718477], "version": 0.2, "tvm_version": "0.9.dev0"}
{"input": ["rocm -keys=rocm,gpu -max_num_threads=256 -mcpu=gfx906 -mtriple=amdgcn-amd-amdhsa-hcc -thread_warp_size=64", "depthwise_conv2d_nchw.cuda", [["TENSOR", [128, 336, 21, 21], "float32"], ["TENSOR", [336, 1, 5, 5], "float32"], 1, "SAME", 1, "float32"], {}], "config": {"index": 188614, "code_hash": null, "entity": [["tile_f", "sp", [-1, 3, 2, 14]], ["tile_y", "sp", [-1, 1, 1, 1]], ["tile_x", "sp", [-1, 7, 3, 1]], ["auto_unroll_max_step", "ot", 256], ["unroll_explicit", "ot", 1]]}, "result": [[0.12971183775], 0, 5.626091957092285, 1638603663.3872945], "version": 0.2, "tvm_version": "0.9.dev0"}
{"input": ["rocm -keys=rocm,gpu -max_num_threads=256 -mcpu=gfx906 -mtriple=amdgcn-amd-amdhsa-hcc -thread_warp_size=64", "depthwise_conv2d_nchw.cuda", [["TENSOR", [128, 336, 21, 21], "float32"], ["TENSOR", [336, 1, 5, 5], "float32"], 1, "SAME", 1, "float32"], {}], "config": {"index": 626, "code_hash": null, "entity": [["tile_f", "sp", [-1, 1, 7, 1]], ["tile_y", "sp", [-1, 3, 1, 1]], ["tile_x", "sp", [-1, 1, 1, 1]], ["auto_unroll_max_step", "ot", 0], ["unroll_explicit", "ot", 1]]}, "result": [[0.013788369125], 0, 2.9919371604919434, 1638603665.7387981], "version": 0.2, "tvm_version": "0.9.dev0"}
{"input": ["rocm -keys=rocm,gpu -max_num_threads=256 -mcpu=gfx906 -mtriple=amdgcn-amd-amdhsa-hcc -thread_warp_size=64", "depthwise_conv2d_nchw.cuda", [["TENSOR", [128, 336, 21, 21], "float32"], ["TENSOR", [336, 1, 5, 5], "float32"], 1, "SAME", 1, "float32"], {}], "config": {"index": 109269, "code_hash": null, "entity": [["tile_f", "sp", [-1, 4, 7, 1]], ["tile_y", "sp", [-1, 21, 1, 1]], ["tile_x", "sp", [-1, 1, 1, 7]], ["auto_unroll_max_step", "ot", 0], ["unroll_explicit", "ot", 1]]}, "result": [[0.27745935050000003], 0, 9.955419063568115, 1638603669.2797205], "version": 0.2, "tvm_version": "0.9.dev0"}
{"input": ["rocm -keys=rocm,gpu -max_num_threads=256 -mcpu=gfx906 -mtriple=amdgcn-amd-amdhsa-hcc -thread_warp_size=64", "depthwise_conv2d_nchw.cuda", [["TENSOR", [128, 336, 21, 21], "float32"], ["TENSOR", [336, 1, 5, 5], "float32"], 1, "SAME", 1, "float32"], {}], "config": {"index": 283325, "code_hash": null, "entity": [["tile_f", "sp", [-1, 1, 1, 42]], ["tile_y", "sp", [-1, 1, 1, 3]], ["tile_x", "sp", [-1, 1, 1, 21]], ["auto_unroll_max_step", "ot", 256], ["unroll_explicit", "ot", 1]]}, "result": [[1.162663574], 0, 9.493521928787231, 1638603684.1010315], "version": 0.2, "tvm_version": "0.9.dev0"}
{"input": ["rocm -keys=rocm,gpu -max_num_threads=256 -mcpu=gfx906 -mtriple=amdgcn-amd-amdhsa-hcc -thread_warp_size=64", "depthwise_conv2d_nchw.cuda", [["TENSOR", [128, 336, 21, 21], "float32"], ["TENSOR", [336, 1, 5, 5], "float32"], 1, "SAME", 1, "float32"], {}], "config": {"index": 62771, "code_hash": null, "entity": [["tile_f", "sp", [-1, 7, 4, 1]], ["tile_y", "sp", [-1, 1, 1, 1]], ["tile_x", "sp", [-1, 3, 7, 1]], ["auto_unroll_max_step", "ot", 0], ["unroll_explicit", "ot", 1]]}, "result": [[0.03938043575], 0, 4.684430122375488, 1638603686.2395291], "version": 0.2, "tvm_version": "0.9.dev0"}
{"input": ["rocm -keys=rocm,gpu -max_num_threads=256 -mcpu=gfx906 -mtriple=amdgcn-amd-amdhsa-hcc -thread_warp_size=64", "depthwise_conv2d_nchw.cuda", [["TENSOR", [128, 336, 21, 21], "float32"], ["TENSOR", [336, 1, 5, 5], "float32"], 1, "SAME", 1, "float32"], {}], "config": {"index": 14650, "code_hash": null, "entity": [["tile_f", "sp", [-1, 1, 14, 1]], ["tile_y", "sp", [-1, 7, 1, 3]], ["tile_x", "sp", [-1, 3, 1, 1]], ["auto_unroll_max_step", "ot", 0], ["unroll_explicit", "ot", 1]]}, "result": [[0.013129916125], 0, 4.621401309967041, 1638603688.3578258], "version": 0.2, "tvm_version": "0.9.dev0"}
{"input": ["rocm -keys=rocm,gpu -max_num_threads=256 -mcpu=gfx906 -mtriple=amdgcn-amd-amdhsa-hcc -thread_warp_size=64", "depthwise_conv2d_nchw.cuda", [["TENSOR", [128, 336, 21, 21], "float32"], ["TENSOR", [336, 1, 5, 5], "float32"], 1, "SAME", 1, "float32"], {}], "config": {"index": 100138, "code_hash": null, "entity": [["tile_f", "sp", [-1, 1, 3, 14]], ["tile_y", "sp", [-1, 7, 1, 1]], ["tile_x", "sp", [-1, 1, 7, 3]], ["auto_unroll_max_step", "ot", 0], ["unroll_explicit", "ot", 1]]}, "result": [[0.024059440499999998], 0, 3.8958933353424072, 1638603690.5583882], "version": 0.2, "tvm_version": "0.9.dev0"}
{"input": ["rocm -keys=rocm,gpu -max_num_threads=256 -mcpu=gfx906 -mtriple=amdgcn-amd-amdhsa-hcc -thread_warp_size=64", "depthwise_conv2d_nchw.cuda", [["TENSOR", [128, 336, 21, 21], "float32"], ["TENSOR", [336, 1, 5, 5], "float32"], 1, "SAME", 1, "float32"], {}], "config": {"index": 201181, "code_hash": null, "entity": [["tile_f", "sp", [-1, 8, 1, 2]], ["tile_y", "sp", [-1, 3, 7, 1]], ["tile_x", "sp", [-1, 1, 7, 1]], ["auto_unroll_max_step", "ot", 256], ["unroll_explicit", "ot", 1]]}, "result": [[0.0237213795], 0, 5.808168411254883, 1638603692.6801322], "version": 0.2, "tvm_version": "0.9.dev0"}
{"input": ["rocm -keys=rocm,gpu -max_num_threads=256 -mcpu=gfx906 -mtriple=amdgcn-amd-amdhsa-hcc -thread_warp_size=64", "depthwise_conv2d_nchw.cuda", [["TENSOR", [128, 336, 21, 21], "float32"], ["TENSOR", [336, 1, 5, 5], "float32"], 1, "SAME", 1, "float32"], {}], "config": {"index": 244638, "code_hash": null, "entity": [["tile_f", "sp", [-1, 1, 3, 16]], ["tile_y", "sp", [-1, 1, 3, 1]], ["tile_x", "sp", [-1, 1, 7, 3]], ["auto_unroll_max_step", "ot", 256], ["unroll_explicit", "ot", 1]]}, "result": [[0.011491461], 0, 4.32962703704834, 1638603694.680223], "version": 0.2, "tvm_version": "0.9.dev0"}
{"input": ["rocm -keys=rocm,gpu -max_num_threads=256 -mcpu=gfx906 -mtriple=amdgcn-amd-amdhsa-hcc -thread_warp_size=64", "depthwise_conv2d_nchw.cuda", [["TENSOR", [128, 336, 21, 21], "float32"], ["TENSOR", [336, 1, 5, 5], "float32"], 1, "SAME", 1, "float32"], {}], "config": {"index": 152510, "code_hash": null, "entity": [["tile_f", "sp", [-1, 8, 7, 2]], ["tile_y", "sp", [-1, 1, 1, 1]], ["tile_x", "sp", [-1, 3, 1, 1]], ["auto_unroll_max_step", "ot", 256], ["unroll_explicit", "ot", 1]]}, "result": [[0.239432434], 0, 5.857746839523315, 1638603697.8569894], "version": 0.2, "tvm_version": "0.9.dev0"}
{"input": ["rocm -keys=rocm,gpu -max_num_threads=256 -mcpu=gfx906 -mtriple=amdgcn-amd-amdhsa-hcc -thread_warp_size=64", "depthwise_conv2d_nchw.cuda", [["TENSOR", [128, 336, 21, 21], "float32"], ["TENSOR", [336, 1, 5, 5], "float32"], 1, "SAME", 1, "float32"], {}], "config": {"index": 7352, "code_hash": null, "entity": [["tile_f", "sp", [-1, 12, 7, 1]], ["tile_y", "sp", [-1, 3, 1, 7]], ["tile_x", "sp", [-1, 1, 1, 1]], ["auto_unroll_max_step", "ot", 0], ["unroll_explicit", "ot", 1]]}, "result": [[0.2985446165], 0, 5.120770215988159, 1638603701.273032], "version": 0.2, "tvm_version": "0.9.dev0"}
{"input": ["rocm -keys=rocm,gpu -max_num_threads=256 -mcpu=gfx906 -mtriple=amdgcn-amd-amdhsa-hcc -thread_warp_size=64", "depthwise_conv2d_nchw.cuda", [["TENSOR", [128, 336, 21, 21], "float32"], ["TENSOR", [336, 1, 5, 5], "float32"], 1, "SAME", 1, "float32"], {}], "config": {"index": 365627, "code_hash": null, "entity": [["tile_f", "sp", [-1, 1, 1, 28]], ["tile_y", "sp", [-1, 1, 1, 7]], ["tile_x", "sp", [-1, 1, 21, 1]], ["auto_unroll_max_step", "ot", 1500], ["unroll_explicit", "ot", 1]]}, "result": [[0.020283590833333334], 0, 8.509861469268799, 1638603703.3663418], "version": 0.2, "tvm_version": "0.9.dev0"}
{"input": ["rocm -keys=rocm,gpu -max_num_threads=256 -mcpu=gfx906 -mtriple=amdgcn-amd-amdhsa-hcc -thread_warp_size=64", "depthwise_conv2d_nchw.cuda", [["TENSOR", [128, 336, 21, 21], "float32"], ["TENSOR", [336, 1, 5, 5], "float32"], 1, "SAME", 1, "float32"], {}], "config": {"index": 116543, "code_hash": null, "entity": [["tile_f", "sp", [-1, 14, 6, 1]], ["tile_y", "sp", [-1, 1, 1, 1]], ["tile_x", "sp", [-1, 3, 1, 7]], ["auto_unroll_max_step", "ot", 0], ["unroll_explicit", "ot", 1]]}, "result": [[0.49429327375000004], 0, 6.284222841262817, 1638603707.7305665], "version": 0.2, "tvm_version": "0.9.dev0"}
{"input": ["rocm -keys=rocm,gpu -max_num_threads=256 -mcpu=gfx906 -mtriple=amdgcn-amd-amdhsa-hcc -thread_warp_size=64", "depthwise_conv2d_nchw.cuda", [["TENSOR", [128, 336, 21, 21], "float32"], ["TENSOR", [336, 1, 5, 5], "float32"], 1, "SAME", 1, "float32"], {}], "config": {"index": 42250, "code_hash": null, "entity": [["tile_f", "sp", [-1, 2, 7, 3]], ["tile_y", "sp", [-1, 1, 7, 3]], ["tile_x", "sp", [-1, 1, 3, 1]], ["auto_unroll_max_step", "ot", 0], ["unroll_explicit", "ot", 1]]}, "result": [[0.0033042579130434786], 0, 3.321415424346924, 1638603709.8202767], "version": 0.2, "tvm_version": "0.9.dev0"}
{"input": ["rocm -keys=rocm,gpu -max_num_threads=256 -mcpu=gfx906 -mtriple=amdgcn-amd-amdhsa-hcc -thread_warp_size=64", "depthwise_conv2d_nchw.cuda", [["TENSOR", [128, 336, 21, 21], "float32"], ["TENSOR", [336, 1, 5, 5], "float32"], 1, "SAME", 1, "float32"], {}], "config": {"index": 251234, "code_hash": null, "entity": [["tile_f", "sp", [-1, 1, 1, 7]], ["tile_y", "sp", [-1, 1, 1, 1]], ["tile_x", "sp", [-1, 1, 1, 7]], ["auto_unroll_max_step", "ot", 256], ["unroll_explicit", "ot", 1]]}, "result": [[0.08262030025], 0, 3.812530755996704, 1638603712.1127925], "version": 0.2, "tvm_version": "0.9.dev0"}
{"input": ["rocm -keys=rocm,gpu -max_num_threads=256 -mcpu=gfx906 -mtriple=amdgcn-amd-amdhsa-hcc -thread_warp_size=64", "depthwise_conv2d_nchw.cuda", [["TENSOR", [128, 336, 21, 21], "float32"], ["TENSOR", [336, 1, 5, 5], "float32"], 1, "SAME", 1, "float32"], {}], "config": {"index": 50026, "code_hash": null, "entity": [["tile_f", "sp", [-1, 2, 7, 2]], ["tile_y", "sp", [-1, 1, 1, 3]], ["tile_x", "sp", [-1, 7, 3, 1]], ["auto_unroll_max_step", "ot", 0], ["unroll_explicit", "ot", 1]]}, "result": [[0.07050102975], 0, 4.6197474002838135, 1638603714.0592885], "version": 0.2, "tvm_version": "0.9.dev0"}
{"input": ["rocm -keys=rocm,gpu -max_num_threads=256 -mcpu=gfx906 -mtriple=amdgcn-amd-amdhsa-hcc -thread_warp_size=64", "depthwise_conv2d_nchw.cuda", [["TENSOR", [128, 336, 21, 21], "float32"], ["TENSOR", [336, 1, 5, 5], "float32"], 1, "SAME", 1, "float32"], {}], "config": {"index": 19797, "code_hash": null, "entity": [["tile_f", "sp", [-1, 1, 12, 2]], ["tile_y", "sp", [-1, 21, 1, 1]], ["tile_x", "sp", [-1, 7, 1, 1]], ["auto_unroll_max_step", "ot", 0], ["unroll_explicit", "ot", 1]]}, "result": [[0.10165647124999999], 0, 5.643678903579712, 1638603716.1540425], "version": 0.2, "tvm_version": "0.9.dev0"}
{"input": ["rocm -keys=rocm,gpu -max_num_threads=256 -mcpu=gfx906 -mtriple=amdgcn-amd-amdhsa-hcc -thread_warp_size=64", "depthwise_conv2d_nchw.cuda", [["TENSOR", [128, 336, 21, 21], "float32"], ["TENSOR", [336, 1, 5, 5], "float32"], 1, "SAME", 1, "float32"], {}], "config": {"index": 61041, "code_hash": null, "entity": [["tile_f", "sp", [-1, 2, 1, 1]], ["tile_y", "sp", [-1, 3, 1, 7]], ["tile_x", "sp", [-1, 1, 7, 1]], ["auto_unroll_max_step", "ot", 0], ["unroll_explicit", "ot", 1]]}, "result": [[0.019291777166666666], 0, 3.0649023056030273, 1638603718.006869], "version": 0.2, "tvm_version": "0.9.dev0"}
{"input": ["rocm -keys=rocm,gpu -max_num_threads=256 -mcpu=gfx906 -mtriple=amdgcn-amd-amdhsa-hcc -thread_warp_size=64", "depthwise_conv2d_nchw.cuda", [["TENSOR", [128, 336, 21, 21], "float32"], ["TENSOR", [336, 1, 5, 5], "float32"], 1, "SAME", 1, "float32"], {}], "config": {"index": 55778, "code_hash": null, "entity": [["tile_f", "sp", [-1, 1, 4, 6]], ["tile_y", "sp", [-1, 21, 1, 1]], ["tile_x", "sp", [-1, 1, 7, 1]], ["auto_unroll_max_step", "ot", 0], ["unroll_explicit", "ot", 1]]}, "result": [[0.05548647675], 0, 3.837906837463379, 1638603719.8573358], "version": 0.2, "tvm_version": "0.9.dev0"}
{"input": ["rocm -keys=rocm,gpu -max_num_threads=256 -mcpu=gfx906 -mtriple=amdgcn-amd-amdhsa-hcc -thread_warp_size=64", "depthwise_conv2d_nchw.cuda", [["TENSOR", [128, 336, 21, 21], "float32"], ["TENSOR", [336, 1, 5, 5], "float32"], 1, "SAME", 1, "float32"], {}], "config": {"index": 39572, "code_hash": null, "entity": [["tile_f", "sp", [-1, 1, 3, 7]], ["tile_y", "sp", [-1, 1, 7, 1]], ["tile_x", "sp", [-1, 1, 3, 1]], ["auto_unroll_max_step", "ot", 0], ["unroll_explicit", "ot", 1]]}, "result": [[0.0022469232463768114], 0, 2.672218084335327, 1638603793.608723], "version": 0.2, "tvm_version": "0.9.dev0"}
{"input": ["rocm -keys=rocm,gpu -max_num_threads=256 -mcpu=gfx906 -mtriple=amdgcn-amd-amdhsa-hcc -thread_warp_size=64", "depthwise_conv2d_nchw.cuda", [["TENSOR", [128, 336, 21, 21], "float32"], ["TENSOR", [336, 1, 5, 5], "float32"], 1, "SAME", 1, "float32"], {}], "config": {"index": 182932, "code_hash": null, "entity": [["tile_f", "sp", [-1, 1, 3, 7]], ["tile_y", "sp", [-1, 1, 7, 1]], ["tile_x", "sp", [-1, 1, 3, 1]], ["auto_unroll_max_step", "ot", 256], ["unroll_explicit", "ot", 1]]}, "result": [[0.0015706032391304347], 0, 2.9489338397979736, 1638603795.486863], "version": 0.2, "tvm_version": "0.9.dev0"}
{"input": ["rocm -keys=rocm,gpu -max_num_threads=256 -mcpu=gfx906 -mtriple=amdgcn-amd-amdhsa-hcc -thread_warp_size=64", "depthwise_conv2d_nchw.cuda", [["TENSOR", [128, 336, 21, 21], "float32"], ["TENSOR", [336, 1, 5, 5], "float32"], 1, "SAME", 1, "float32"], {}], "config": {"index": 326292, "code_hash": null, "entity": [["tile_f", "sp", [-1, 1, 3, 7]], ["tile_y", "sp", [-1, 1, 7, 1]], ["tile_x", "sp", [-1, 1, 3, 1]], ["auto_unroll_max_step", "ot", 1500], ["unroll_explicit", "ot", 1]]}, "result": [[0.001792071157894737], 0, 2.559906005859375, 1638603797.0776362], "version": 0.2, "tvm_version": "0.9.dev0"}
{"input": ["rocm -keys=rocm,gpu -max_num_threads=256 -mcpu=gfx906 -mtriple=amdgcn-amd-amdhsa-hcc -thread_warp_size=64", "depthwise_conv2d_nchw.cuda", [["TENSOR", [128, 336, 21, 21], "float32"], ["TENSOR", [336, 1, 5, 5], "float32"], 1, "SAME", 1, "float32"], {}], "config": {"index": 39449, "code_hash": null, "entity": [["tile_f", "sp", [-1, 1, 7, 3]], ["tile_y", "sp", [-1, 1, 7, 1]], ["tile_x", "sp", [-1, 1, 3, 1]], ["auto_unroll_max_step", "ot", 0], ["unroll_explicit", "ot", 1]]}, "result": [[0.0009896261690140846], 0, 2.4032673835754395, 1638603798.9000084], "version": 0.2, "tvm_version": "0.9.dev0"}
{"input": ["rocm -keys=rocm,gpu -max_num_threads=256 -mcpu=gfx906 -mtriple=amdgcn-amd-amdhsa-hcc -thread_warp_size=64", "depthwise_conv2d_nchw.cuda", [["TENSOR", [128, 336, 21, 21], "float32"], ["TENSOR", [336, 1, 5, 5], "float32"], 1, "SAME", 1, "float32"], {}], "config": {"index": 182809, "code_hash": null, "entity": [["tile_f", "sp", [-1, 1, 7, 3]], ["tile_y", "sp", [-1, 1, 7, 1]], ["tile_x", "sp", [-1, 1, 3, 1]], ["auto_unroll_max_step", "ot", 256], ["unroll_explicit", "ot", 1]]}, "result": [[0.0009443221], 0, 2.2811317443847656, 1638603800.617498], "version": 0.2, "tvm_version": "0.9.dev0"}
{"input": ["rocm -keys=rocm,gpu -max_num_threads=256 -mcpu=gfx906 -mtriple=amdgcn-amd-amdhsa-hcc -thread_warp_size=64", "depthwise_conv2d_nchw.cuda", [["TENSOR", [128, 336, 21, 21], "float32"], ["TENSOR", [336, 1, 5, 5], "float32"], 1, "SAME", 1, "float32"], {}], "config": {"index": 326169, "code_hash": null, "entity": [["tile_f", "sp", [-1, 1, 7, 3]], ["tile_y", "sp", [-1, 1, 7, 1]], ["tile_x", "sp", [-1, 1, 3, 1]], ["auto_unroll_max_step", "ot", 1500], ["unroll_explicit", "ot", 1]]}, "result": [[0.0009485256081081081], 0, 2.4092421531677246, 1638603802.4106197], "version": 0.2, "tvm_version": "0.9.dev0"}
{"input": ["rocm -keys=rocm,gpu -max_num_threads=256 -mcpu=gfx906 -mtriple=amdgcn-amd-amdhsa-hcc -thread_warp_size=64", "depthwise_conv2d_nchw.cuda", [["TENSOR", [128, 336, 21, 21], "float32"], ["TENSOR", [336, 1, 5, 5], "float32"], 1, "SAME", 1, "float32"], {}], "config": {"index": 327394, "code_hash": null, "entity": [["tile_f", "sp", [-1, 1, 1, 7]], ["tile_y", "sp", [-1, 1, 21, 1]], ["tile_x", "sp", [-1, 1, 3, 1]], ["auto_unroll_max_step", "ot", 1500], ["unroll_explicit", "ot", 1]]}, "result": [[0.0009685855416666666], 0, 2.550701856613159, 1638603804.179066], "version": 0.2, "tvm_version": "0.9.dev0"}
{"input": ["rocm -keys=rocm,gpu -max_num_threads=256 -mcpu=gfx906 -mtriple=amdgcn-amd-amdhsa-hcc -thread_warp_size=64", "depthwise_conv2d_nchw.cuda", [["TENSOR", [128, 336, 21, 21], "float32"], ["TENSOR", [336, 1, 5, 5], "float32"], 1, "SAME", 1, "float32"], {}], "config": {"index": 184034, "code_hash": null, "entity": [["tile_f", "sp", [-1, 1, 1, 7]], ["tile_y", "sp", [-1, 1, 21, 1]], ["tile_x", "sp", [-1, 1, 3, 1]], ["auto_unroll_max_step", "ot", 256], ["unroll_explicit", "ot", 1]]}, "result": [[0.0009685674236111111], 0, 2.5669915676116943, 1638603805.9587088], "version": 0.2, "tvm_version": "0.9.dev0"}
{"input": ["rocm -keys=rocm,gpu -max_num_threads=256 -mcpu=gfx906 -mtriple=amdgcn-amd-amdhsa-hcc -thread_warp_size=64", "depthwise_conv2d_nchw.cuda", [["TENSOR", [128, 336, 21, 21], "float32"], ["TENSOR", [336, 1, 5, 5], "float32"], 1, "SAME", 1, "float32"], {}], "config": {"index": 40674, "code_hash": null, "entity": [["tile_f", "sp", [-1, 1, 1, 7]], ["tile_y", "sp", [-1, 1, 21, 1]], ["tile_x", "sp", [-1, 1, 3, 1]], ["auto_unroll_max_step", "ot", 0], ["unroll_explicit", "ot", 1]]}, "result": [[0.0012210048536585366], 0, 2.1223716735839844, 1638603807.6485946], "version": 0.2, "tvm_version": "0.9.dev0"}
{"input": ["rocm -keys=rocm,gpu -max_num_threads=256 -mcpu=gfx906 -mtriple=amdgcn-amd-amdhsa-hcc -thread_warp_size=64", "depthwise_conv2d_nchw.cuda", [["TENSOR", [128, 336, 21, 21], "float32"], ["TENSOR", [336, 1, 5, 5], "float32"], 1, "SAME", 1, "float32"], {}], "config": {"index": 56372, "code_hash": null, "entity": [["tile_f", "sp", [-1, 1, 3, 7]], ["tile_y", "sp", [-1, 1, 3, 1]], ["tile_x", "sp", [-1, 1, 7, 1]], ["auto_unroll_max_step", "ot", 0], ["unroll_explicit", "ot", 1]]}, "result": [[0.0023078275], 0, 2.171358823776245, 1638603809.3407733], "version": 0.2, "tvm_version": "0.9.dev0"}
{"input": ["rocm -keys=rocm,gpu -max_num_threads=256 -mcpu=gfx906 -mtriple=amdgcn-amd-amdhsa-hcc -thread_warp_size=64", "depthwise_conv2d_nchw.cuda", [["TENSOR", [128, 336, 21, 21], "float32"], ["TENSOR", [336, 1, 5, 5], "float32"], 1, "SAME", 1, "float32"], {}], "config": {"index": 343092, "code_hash": null, "entity": [["tile_f", "sp", [-1, 1, 3, 7]], ["tile_y", "sp", [-1, 1, 3, 1]], ["tile_x", "sp", [-1, 1, 7, 1]], ["auto_unroll_max_step", "ot", 1500], ["unroll_explicit", "ot", 1]]}, "result": [[0.00153763588172043], 0, 3.026519775390625, 1638603811.1873214], "version": 0.2, "tvm_version": "0.9.dev0"}
{"input": ["rocm -keys=rocm,gpu -max_num_threads=256 -mcpu=gfx906 -mtriple=amdgcn-amd-amdhsa-hcc -thread_warp_size=64", "depthwise_conv2d_nchw.cuda", [["TENSOR", [128, 336, 21, 21], "float32"], ["TENSOR", [336, 1, 5, 5], "float32"], 1, "SAME", 1, "float32"], {}], "config": {"index": 199732, "code_hash": null, "entity": [["tile_f", "sp", [-1, 1, 3, 7]], ["tile_y", "sp", [-1, 1, 3, 1]], ["tile_x", "sp", [-1, 1, 7, 1]], ["auto_unroll_max_step", "ot", 256], ["unroll_explicit", "ot", 1]]}, "result": [[0.0015449315483870968], 0, 2.731929063796997, 1638603812.8843555], "version": 0.2, "tvm_version": "0.9.dev0"}
{"input": ["rocm -keys=rocm,gpu -max_num_threads=256 -mcpu=gfx906 -mtriple=amdgcn-amd-amdhsa-hcc -thread_warp_size=64", "depthwise_conv2d_nchw.cuda", [["TENSOR", [128, 336, 21, 21], "float32"], ["TENSOR", [336, 1, 5, 5], "float32"], 1, "SAME", 1, "float32"], {}], "config": {"index": 42354, "code_hash": null, "entity": [["tile_f", "sp", [-1, 1, 1, 7]], ["tile_y", "sp", [-1, 1, 7, 3]], ["tile_x", "sp", [-1, 1, 3, 1]], ["auto_unroll_max_step", "ot", 0], ["unroll_explicit", "ot", 1]]}, "result": [[0.002643967225], 0, 2.7499172687530518, 1638603814.5222766], "version": 0.2, "tvm_version": "0.9.dev0"}
{"input": ["rocm -keys=rocm,gpu -max_num_threads=256 -mcpu=gfx906 -mtriple=amdgcn-amd-amdhsa-hcc -thread_warp_size=64", "depthwise_conv2d_nchw.cuda", [["TENSOR", [128, 336, 21, 21], "float32"], ["TENSOR", [336, 1, 5, 5], "float32"], 1, "SAME", 1, "float32"], {}], "config": {"index": 185714, "code_hash": null, "entity": [["tile_f", "sp", [-1, 1, 1, 7]], ["tile_y", "sp", [-1, 1, 7, 3]], ["tile_x", "sp", [-1, 1, 3, 1]], ["auto_unroll_max_step", "ot", 256], ["unroll_explicit", "ot", 1]]}, "result": [[0.0016269342903225809], 0, 3.253772497177124, 1638603816.2039173], "version": 0.2, "tvm_version": "0.9.dev0"}
{"input": ["rocm -keys=rocm,gpu -max_num_threads=256 -mcpu=gfx906 -mtriple=amdgcn-amd-amdhsa-hcc -thread_warp_size=64", "depthwise_conv2d_nchw.cuda", [["TENSOR", [128, 336, 21, 21], "float32"], ["TENSOR", [336, 1, 5, 5], "float32"], 1, "SAME", 1, "float32"], {}], "config": {"index": 329074, "code_hash": null, "entity": [["tile_f", "sp", [-1, 1, 1, 7]], ["tile_y", "sp", [-1, 1, 7, 3]], ["tile_x", "sp", [-1, 1, 3, 1]], ["auto_unroll_max_step", "ot", 1500], ["unroll_explicit", "ot", 1]]}, "result": [[0.00142092422], 0, 3.3984053134918213, 1638603818.117394], "version": 0.2, "tvm_version": "0.9.dev0"}
{"input": ["rocm -keys=rocm,gpu -max_num_threads=256 -mcpu=gfx906 -mtriple=amdgcn-amd-amdhsa-hcc -thread_warp_size=64", "depthwise_conv2d_nchw.cuda", [["TENSOR", [128, 336, 21, 21], "float32"], ["TENSOR", [336, 1, 5, 5], "float32"], 1, "SAME", 1, "float32"], {}], "config": {"index": 228834, "code_hash": null, "entity": [["tile_f", "sp", [-1, 1, 1, 7]], ["tile_y", "sp", [-1, 1, 21, 1]], ["tile_x", "sp", [-1, 1, 1, 3]], ["auto_unroll_max_step", "ot", 256], ["unroll_explicit", "ot", 1]]}, "result": [[0.0010612759160305342], 0, 3.1325929164886475, 1638603819.92187], "version": 0.2, "tvm_version": "0.9.dev0"}
{"input": ["rocm -keys=rocm,gpu -max_num_threads=256 -mcpu=gfx906 -mtriple=amdgcn-amd-amdhsa-hcc -thread_warp_size=64", "depthwise_conv2d_nchw.cuda", [["TENSOR", [128, 336, 21, 21], "float32"], ["TENSOR", [336, 1, 5, 5], "float32"], 1, "SAME", 1, "float32"], {}], "config": {"index": 85474, "code_hash": null, "entity": [["tile_f", "sp", [-1, 1, 1, 7]], ["tile_y", "sp", [-1, 1, 21, 1]], ["tile_x", "sp", [-1, 1, 1, 3]], ["auto_unroll_max_step", "ot", 0], ["unroll_explicit", "ot", 1]]}, "result": [[0.0024881869024390244], 0, 2.9055957794189453, 1638603821.5852413], "version": 0.2, "tvm_version": "0.9.dev0"}
{"input": ["rocm -keys=rocm,gpu -max_num_threads=256 -mcpu=gfx906 -mtriple=amdgcn-amd-amdhsa-hcc -thread_warp_size=64", "depthwise_conv2d_nchw.cuda", [["TENSOR", [128, 336, 21, 21], "float32"], ["TENSOR", [336, 1, 5, 5], "float32"], 1, "SAME", 1, "float32"], {}], "config": {"index": 372194, "code_hash": null, "entity": [["tile_f", "sp", [-1, 1, 1, 7]], ["tile_y", "sp", [-1, 1, 21, 1]], ["tile_x", "sp", [-1, 1, 1, 3]], ["auto_unroll_max_step", "ot", 1500], ["unroll_explicit", "ot", 1]]}, "result": [[0.001062675356060606], 0, 3.139256238937378, 1638603823.346242], "version": 0.2, "tvm_version": "0.9.dev0"}
{"input": ["rocm -keys=rocm,gpu -max_num_threads=256 -mcpu=gfx906 -mtriple=amdgcn-amd-amdhsa-hcc -thread_warp_size=64", "depthwise_conv2d_nchw.cuda", [["TENSOR", [128, 336, 21, 21], "float32"], ["TENSOR", [336, 1, 5, 5], "float32"], 1, "SAME", 1, "float32"], {}], "config": {"index": 59049, "code_hash": null, "entity": [["tile_f", "sp", [-1, 1, 7, 3]], ["tile_y", "sp", [-1, 1, 1, 3]], ["tile_x", "sp", [-1, 1, 7, 1]], ["auto_unroll_max_step", "ot", 0], ["unroll_explicit", "ot", 1]]}, "result": [[0.0019599796891891894], 0, 2.7767841815948486, 1638603825.1767085], "version": 0.2, "tvm_version": "0.9.dev0"}
{"input": ["rocm -keys=rocm,gpu -max_num_threads=256 -mcpu=gfx906 -mtriple=amdgcn-amd-amdhsa-hcc -thread_warp_size=64", "depthwise_conv2d_nchw.cuda", [["TENSOR", [128, 336, 21, 21], "float32"], ["TENSOR", [336, 1, 5, 5], "float32"], 1, "SAME", 1, "float32"], {}], "config": {"index": 202409, "code_hash": null, "entity": [["tile_f", "sp", [-1, 1, 7, 3]], ["tile_y", "sp", [-1, 1, 1, 3]], ["tile_x", "sp", [-1, 1, 7, 1]], ["auto_unroll_max_step", "ot", 256], ["unroll_explicit", "ot", 1]]}, "result": [[0.0016631374942528733], 0, 2.809455394744873, 1638603827.0941365], "version": 0.2, "tvm_version": "0.9.dev0"}
{"input": ["rocm -keys=rocm,gpu -max_num_threads=256 -mcpu=gfx906 -mtriple=amdgcn-amd-amdhsa-hcc -thread_warp_size=64", "depthwise_conv2d_nchw.cuda", [["TENSOR", [128, 336, 21, 21], "float32"], ["TENSOR", [336, 1, 5, 5], "float32"], 1, "SAME", 1, "float32"], {}], "config": {"index": 345769, "code_hash": null, "entity": [["tile_f", "sp", [-1, 1, 7, 3]], ["tile_y", "sp", [-1, 1, 1, 3]], ["tile_x", "sp", [-1, 1, 7, 1]], ["auto_unroll_max_step", "ot", 1500], ["unroll_explicit", "ot", 1]]}, "result": [[0.0016643397816091953], 0, 2.8170220851898193, 1638603828.926329], "version": 0.2, "tvm_version": "0.9.dev0"}
{"input": ["rocm -keys=rocm,gpu -max_num_threads=256 -mcpu=gfx906 -mtriple=amdgcn-amd-amdhsa-hcc -thread_warp_size=64", "depthwise_conv2d_nchw.cuda", [["TENSOR", [128, 336, 21, 21], "float32"], ["TENSOR", [336, 1, 5, 5], "float32"], 1, "SAME", 1, "float32"], {}], "config": {"index": 76964, "code_hash": null, "entity": [["tile_f", "sp", [-1, 2, 4, 3]], ["tile_y", "sp", [-1, 1, 1, 3]], ["tile_x", "sp", [-1, 1, 21, 1]], ["auto_unroll_max_step", "ot", 0], ["unroll_explicit", "ot", 1]]}, "result": [[0.0018949440259740256], 0, 2.8453235626220703, 1638603830.7668324], "version": 0.2, "tvm_version": "0.9.dev0"}
{"input": ["rocm -keys=rocm,gpu -max_num_threads=256 -mcpu=gfx906 -mtriple=amdgcn-amd-amdhsa-hcc -thread_warp_size=64", "depthwise_conv2d_nchw.cuda", [["TENSOR", [128, 336, 21, 21], "float32"], ["TENSOR", [336, 1, 5, 5], "float32"], 1, "SAME", 1, "float32"], {}], "config": {"index": 220324, "code_hash": null, "entity": [["tile_f", "sp", [-1, 2, 4, 3]], ["tile_y", "sp", [-1, 1, 1, 3]], ["tile_x", "sp", [-1, 1, 21, 1]], ["auto_unroll_max_step", "ot", 256], ["unroll_explicit", "ot", 1]]}, "result": [[0.0019413940000000001], 0, 2.985677480697632, 1638603832.3626332], "version": 0.2, "tvm_version": "0.9.dev0"}
{"input": ["rocm -keys=rocm,gpu -max_num_threads=256 -mcpu=gfx906 -mtriple=amdgcn-amd-amdhsa-hcc -thread_warp_size=64", "depthwise_conv2d_nchw.cuda", [["TENSOR", [128, 336, 21, 21], "float32"], ["TENSOR", [336, 1, 5, 5], "float32"], 1, "SAME", 1, "float32"], {}], "config": {"index": 363684, "code_hash": null, "entity": [["tile_f", "sp", [-1, 2, 4, 3]], ["tile_y", "sp", [-1, 1, 1, 3]], ["tile_x", "sp", [-1, 1, 21, 1]], ["auto_unroll_max_step", "ot", 1500], ["unroll_explicit", "ot", 1]]}, "result": [[0.0016920097764705883], 0, 3.3201677799224854, 1638603834.2816896], "version": 0.2, "tvm_version": "0.9.dev0"}
{"input": ["rocm -keys=rocm,gpu -max_num_threads=256 -mcpu=gfx906 -mtriple=amdgcn-amd-amdhsa-hcc -thread_warp_size=64", "depthwise_conv2d_nchw.cuda", [["TENSOR", [128, 336, 21, 21], "float32"], ["TENSOR", [336, 1, 5, 5], "float32"], 1, "SAME", 1, "float32"], {}], "config": {"index": 59054, "code_hash": null, "entity": [["tile_f", "sp", [-1, 1, 8, 3]], ["tile_y", "sp", [-1, 1, 1, 3]], ["tile_x", "sp", [-1, 1, 7, 1]], ["auto_unroll_max_step", "ot", 0], ["unroll_explicit", "ot", 1]]}, "result": [[0.0022713322826086956], 0, 2.5914571285247803, 1638603835.9099135], "version": 0.2, "tvm_version": "0.9.dev0"}
{"input": ["rocm -keys=rocm,gpu -max_num_threads=256 -mcpu=gfx906 -mtriple=amdgcn-amd-amdhsa-hcc -thread_warp_size=64", "depthwise_conv2d_nchw.cuda", [["TENSOR", [128, 336, 21, 21], "float32"], ["TENSOR", [336, 1, 5, 5], "float32"], 1, "SAME", 1, "float32"], {}], "config": {"index": 202414, "code_hash": null, "entity": [["tile_f", "sp", [-1, 1, 8, 3]], ["tile_y", "sp", [-1, 1, 1, 3]], ["tile_x", "sp", [-1, 1, 7, 1]], ["auto_unroll_max_step", "ot", 256], ["unroll_explicit", "ot", 1]]}, "result": [[0.0017091369529411767], 0, 2.810384750366211, 1638603837.8316379], "version": 0.2, "tvm_version": "0.9.dev0"}
{"input": ["rocm -keys=rocm,gpu -max_num_threads=256 -mcpu=gfx906 -mtriple=amdgcn-amd-amdhsa-hcc -thread_warp_size=64", "depthwise_conv2d_nchw.cuda", [["TENSOR", [128, 336, 21, 21], "float32"], ["TENSOR", [336, 1, 5, 5], "float32"], 1, "SAME", 1, "float32"], {}], "config": {"index": 345774, "code_hash": null, "entity": [["tile_f", "sp", [-1, 1, 8, 3]], ["tile_y", "sp", [-1, 1, 1, 3]], ["tile_x", "sp", [-1, 1, 7, 1]], ["auto_unroll_max_step", "ot", 1500], ["unroll_explicit", "ot", 1]]}, "result": [[0.0017120837142857144], 0, 2.7867205142974854, 1638603839.6018388], "version": 0.2, "tvm_version": "0.9.dev0"}
{"input": ["rocm -keys=rocm,gpu -max_num_threads=256 -mcpu=gfx906 -mtriple=amdgcn-amd-amdhsa-hcc -thread_warp_size=64", "depthwise_conv2d_nchw.cuda", [["TENSOR", [128, 336, 21, 21], "float32"], ["TENSOR", [336, 1, 5, 5], "float32"], 1, "SAME", 1, "float32"], {}], "config": {"index": 345713, "code_hash": null, "entity": [["tile_f", "sp", [-1, 1, 8, 2]], ["tile_y", "sp", [-1, 1, 1, 3]], ["tile_x", "sp", [-1, 1, 7, 1]], ["auto_unroll_max_step", "ot", 1500], ["unroll_explicit", "ot", 1]]}, "result": [[0.00123892974137931], 0, 2.3686413764953613, 1638603841.2951334], "version": 0.2, "tvm_version": "0.9.dev0"}
{"input": ["rocm -keys=rocm,gpu -max_num_threads=256 -mcpu=gfx906 -mtriple=amdgcn-amd-amdhsa-hcc -thread_warp_size=64", "depthwise_conv2d_nchw.cuda", [["TENSOR", [128, 336, 21, 21], "float32"], ["TENSOR", [336, 1, 5, 5], "float32"], 1, "SAME", 1, "float32"], {}], "config": {"index": 202353, "code_hash": null, "entity": [["tile_f", "sp", [-1, 1, 8, 2]], ["tile_y", "sp", [-1, 1, 1, 3]], ["tile_x", "sp", [-1, 1, 7, 1]], ["auto_unroll_max_step", "ot", 256], ["unroll_explicit", "ot", 1]]}, "result": [[0.001420300971830986], 0, 2.358755111694336, 1638603842.9146862], "version": 0.2, "tvm_version": "0.9.dev0"}
{"input": ["rocm -keys=rocm,gpu -max_num_threads=256 -mcpu=gfx906 -mtriple=amdgcn-amd-amdhsa-hcc -thread_warp_size=64", "depthwise_conv2d_nchw.cuda", [["TENSOR", [128, 336, 21, 21], "float32"], ["TENSOR", [336, 1, 5, 5], "float32"], 1, "SAME", 1, "float32"], {}], "config": {"index": 58993, "code_hash": null, "entity": [["tile_f", "sp", [-1, 1, 8, 2]], ["tile_y", "sp", [-1, 1, 1, 3]], ["tile_x", "sp", [-1, 1, 7, 1]], ["auto_unroll_max_step", "ot", 0], ["unroll_explicit", "ot", 1]]}, "result": [[0.00142527499009901], 0, 2.4738383293151855, 1638603844.7484124], "version": 0.2, "tvm_version": "0.9.dev0"}
{"input": ["rocm -keys=rocm,gpu -max_num_threads=256 -mcpu=gfx906 -mtriple=amdgcn-amd-amdhsa-hcc -thread_warp_size=64", "depthwise_conv2d_nchw.cuda", [["TENSOR", [128, 336, 21, 21], "float32"], ["TENSOR", [336, 1, 5, 5], "float32"], 1, "SAME", 1, "float32"], {}], "config": {"index": 56249, "code_hash": null, "entity": [["tile_f", "sp", [-1, 1, 7, 3]], ["tile_y", "sp", [-1, 1, 3, 1]], ["tile_x", "sp", [-1, 1, 7, 1]], ["auto_unroll_max_step", "ot", 0], ["unroll_explicit", "ot", 1]]}, "result": [[0.000960603462585034], 0, 2.411681652069092, 1638603846.5894656], "version": 0.2, "tvm_version": "0.9.dev0"}
{"input": ["rocm -keys=rocm,gpu -max_num_threads=256 -mcpu=gfx906 -mtriple=amdgcn-amd-amdhsa-hcc -thread_warp_size=64", "depthwise_conv2d_nchw.cuda", [["TENSOR", [128, 336, 21, 21], "float32"], ["TENSOR", [336, 1, 5, 5], "float32"], 1, "SAME", 1, "float32"], {}], "config": {"index": 199609, "code_hash": null, "entity": [["tile_f", "sp", [-1, 1, 7, 3]], ["tile_y", "sp", [-1, 1, 3, 1]], ["tile_x", "sp", [-1, 1, 7, 1]], ["auto_unroll_max_step", "ot", 256], ["unroll_explicit", "ot", 1]]}, "result": [[0.0009347054000000001], 0, 2.345517158508301, 1638603848.378573], "version": 0.2, "tvm_version": "0.9.dev0"}
{"input": ["rocm -keys=rocm,gpu -max_num_threads=256 -mcpu=gfx906 -mtriple=amdgcn-amd-amdhsa-hcc -thread_warp_size=64", "depthwise_conv2d_nchw.cuda", [["TENSOR", [128, 336, 21, 21], "float32"], ["TENSOR", [336, 1, 5, 5], "float32"], 1, "SAME", 1, "float32"], {}], "config": {"index": 342969, "code_hash": null, "entity": [["tile_f", "sp", [-1, 1, 7, 3]], ["tile_y", "sp", [-1, 1, 3, 1]], ["tile_x", "sp", [-1, 1, 7, 1]], ["auto_unroll_max_step", "ot", 1500], ["unroll_explicit", "ot", 1]]}, "result": [[0.0009355305933333334], 0, 2.6273090839385986, 1638603850.354145], "version": 0.2, "tvm_version": "0.9.dev0"}
{"input": ["rocm -keys=rocm,gpu -max_num_threads=256 -mcpu=gfx906 -mtriple=amdgcn-amd-amdhsa-hcc -thread_warp_size=64", "depthwise_conv2d_nchw.cuda", [["TENSOR", [128, 336, 21, 21], "float32"], ["TENSOR", [336, 1, 5, 5], "float32"], 1, "SAME", 1, "float32"], {}], "config": {"index": 300514, "code_hash": null, "entity": [["tile_f", "sp", [-1, 1, 1, 7]], ["tile_y", "sp", [-1, 1, 21, 1]], ["tile_x", "sp", [-1, 3, 1, 1]], ["auto_unroll_max_step", "ot", 1500], ["unroll_explicit", "ot", 1]]}, "result": [[0.0010756171162790698], 0, 2.9150097370147705, 1638603852.091626], "version": 0.2, "tvm_version": "0.9.dev0"}
{"input": ["rocm -keys=rocm,gpu -max_num_threads=256 -mcpu=gfx906 -mtriple=amdgcn-amd-amdhsa-hcc -thread_warp_size=64", "depthwise_conv2d_nchw.cuda", [["TENSOR", [128, 336, 21, 21], "float32"], ["TENSOR", [336, 1, 5, 5], "float32"], 1, "SAME", 1, "float32"], {}], "config": {"index": 157154, "code_hash": null, "entity": [["tile_f", "sp", [-1, 1, 1, 7]], ["tile_y", "sp", [-1, 1, 21, 1]], ["tile_x", "sp", [-1, 3, 1, 1]], ["auto_unroll_max_step", "ot", 256], ["unroll_explicit", "ot", 1]]}, "result": [[0.014395178888888891], 0, 3.334343433380127, 1638603853.9426093], "version": 0.2, "tvm_version": "0.9.dev0"}
{"input": ["rocm -keys=rocm,gpu -max_num_threads=256 -mcpu=gfx906 -mtriple=amdgcn-amd-amdhsa-hcc -thread_warp_size=64", "depthwise_conv2d_nchw.cuda", [["TENSOR", [128, 336, 21, 21], "float32"], ["TENSOR", [336, 1, 5, 5], "float32"], 1, "SAME", 1, "float32"], {}], "config": {"index": 13794, "code_hash": null, "entity": [["tile_f", "sp", [-1, 1, 1, 7]], ["tile_y", "sp", [-1, 1, 21, 1]], ["tile_x", "sp", [-1, 3, 1, 1]], ["auto_unroll_max_step", "ot", 0], ["unroll_explicit", "ot", 1]]}, "result": [[0.014273364555555557], 0, 2.944462299346924, 1638603855.7619717], "version": 0.2, "tvm_version": "0.9.dev0"}
{"input": ["rocm -keys=rocm,gpu -max_num_threads=256 -mcpu=gfx906 -mtriple=amdgcn-amd-amdhsa-hcc -thread_warp_size=64", "depthwise_conv2d_nchw.cuda", [["TENSOR", [128, 336, 21, 21], "float32"], ["TENSOR", [336, 1, 5, 5], "float32"], 1, "SAME", 1, "float32"], {}], "config": {"index": 363689, "code_hash": null, "entity": [["tile_f", "sp", [-1, 1, 7, 3]], ["tile_y", "sp", [-1, 1, 1, 3]], ["tile_x", "sp", [-1, 1, 21, 1]], ["auto_unroll_max_step", "ot", 1500], ["unroll_explicit", "ot", 1]]}, "result": [[0.0011292370952380954], 0, 2.7886927127838135, 1638603857.6188462], "version": 0.2, "tvm_version": "0.9.dev0"}
{"input": ["rocm -keys=rocm,gpu -max_num_threads=256 -mcpu=gfx906 -mtriple=amdgcn-amd-amdhsa-hcc -thread_warp_size=64", "depthwise_conv2d_nchw.cuda", [["TENSOR", [128, 336, 21, 21], "float32"], ["TENSOR", [336, 1, 5, 5], "float32"], 1, "SAME", 1, "float32"], {}], "config": {"index": 76974, "code_hash": null, "entity": [["tile_f", "sp", [-1, 1, 8, 3]], ["tile_y", "sp", [-1, 1, 1, 3]], ["tile_x", "sp", [-1, 1, 21, 1]], ["auto_unroll_max_step", "ot", 0], ["unroll_explicit", "ot", 1]]}, "result": [[0.0010279048686131387], 0, 2.6633057594299316, 1638603859.444693], "version": 0.2, "tvm_version": "0.9.dev0"}
{"input": ["rocm -keys=rocm,gpu -max_num_threads=256 -mcpu=gfx906 -mtriple=amdgcn-amd-amdhsa-hcc -thread_warp_size=64", "depthwise_conv2d_nchw.cuda", [["TENSOR", [128, 336, 21, 21], "float32"], ["TENSOR", [336, 1, 5, 5], "float32"], 1, "SAME", 1, "float32"], {}], "config": {"index": 220329, "code_hash": null, "entity": [["tile_f", "sp", [-1, 1, 7, 3]], ["tile_y", "sp", [-1, 1, 1, 3]], ["tile_x", "sp", [-1, 1, 21, 1]], ["auto_unroll_max_step", "ot", 256], ["unroll_explicit", "ot", 1]]}, "result": [[0.0011303196190476192], 0, 2.98250675201416, 1638603861.4487252], "version": 0.2, "tvm_version": "0.9.dev0"}
{"input": ["rocm -keys=rocm,gpu -max_num_threads=256 -mcpu=gfx906 -mtriple=amdgcn-amd-amdhsa-hcc -thread_warp_size=64", "depthwise_conv2d_nchw.cuda", [["TENSOR", [128, 336, 21, 21], "float32"], ["TENSOR", [336, 1, 5, 5], "float32"], 1, "SAME", 1, "float32"], {}], "config": {"index": 363694, "code_hash": null, "entity": [["tile_f", "sp", [-1, 1, 8, 3]], ["tile_y", "sp", [-1, 1, 1, 3]], ["tile_x", "sp", [-1, 1, 21, 1]], ["auto_unroll_max_step", "ot", 1500], ["unroll_explicit", "ot", 1]]}, "result": [[0.0010154107253521128], 0, 2.928638458251953, 1638603863.6057475], "version": 0.2, "tvm_version": "0.9.dev0"}
{"input": ["rocm -keys=rocm,gpu -max_num_threads=256 -mcpu=gfx906 -mtriple=amdgcn-amd-amdhsa-hcc -thread_warp_size=64", "depthwise_conv2d_nchw.cuda", [["TENSOR", [128, 336, 21, 21], "float32"], ["TENSOR", [336, 1, 5, 5], "float32"], 1, "SAME", 1, "float32"], {}], "config": {"index": 76969, "code_hash": null, "entity": [["tile_f", "sp", [-1, 1, 7, 3]], ["tile_y", "sp", [-1, 1, 1, 3]], ["tile_x", "sp", [-1, 1, 21, 1]], ["auto_unroll_max_step", "ot", 0], ["unroll_explicit", "ot", 1]]}, "result": [[0.0011484663174603177], 0, 3.12465763092041, 1638603865.9274855], "version": 0.2, "tvm_version": "0.9.dev0"}
{"input": ["rocm -keys=rocm,gpu -max_num_threads=256 -mcpu=gfx906 -mtriple=amdgcn-amd-amdhsa-hcc -thread_warp_size=64", "depthwise_conv2d_nchw.cuda", [["TENSOR", [128, 336, 21, 21], "float32"], ["TENSOR", [336, 1, 5, 5], "float32"], 1, "SAME", 1, "float32"], {}], "config": {"index": 220334, "code_hash": null, "entity": [["tile_f", "sp", [-1, 1, 8, 3]], ["tile_y", "sp", [-1, 1, 1, 3]], ["tile_x", "sp", [-1, 1, 21, 1]], ["auto_unroll_max_step", "ot", 256], ["unroll_explicit", "ot", 1]]}, "result": [[0.0010156683028169013], 0, 2.9191091060638428, 1638603868.062577], "version": 0.2, "tvm_version": "0.9.dev0"}
{"input": ["rocm -keys=rocm,gpu -max_num_threads=256 -mcpu=gfx906 -mtriple=amdgcn-amd-amdhsa-hcc -thread_warp_size=64", "depthwise_conv2d_nchw.cuda", [["TENSOR", [128, 336, 21, 21], "float32"], ["TENSOR", [336, 1, 5, 5], "float32"], 1, "SAME", 1, "float32"], {}], "config": {"index": 39496, "code_hash": null, "entity": [["tile_f", "sp", [-1, 1, 4, 4]], ["tile_y", "sp", [-1, 1, 7, 1]], ["tile_x", "sp", [-1, 1, 3, 1]], ["auto_unroll_max_step", "ot", 0], ["unroll_explicit", "ot", 1]]}, "result": [[0.0013158710555555553], 0, 2.8854453563690186, 1638603870.2325869], "version": 0.2, "tvm_version": "0.9.dev0"}
{"input": ["rocm -keys=rocm,gpu -max_num_threads=256 -mcpu=gfx906 -mtriple=amdgcn-amd-amdhsa-hcc -thread_warp_size=64", "depthwise_conv2d_nchw.cuda", [["TENSOR", [128, 336, 21, 21], "float32"], ["TENSOR", [336, 1, 5, 5], "float32"], 1, "SAME", 1, "float32"], {}], "config": {"index": 182856, "code_hash": null, "entity": [["tile_f", "sp", [-1, 1, 4, 4]], ["tile_y", "sp", [-1, 1, 7, 1]], ["tile_x", "sp", [-1, 1, 3, 1]], ["auto_unroll_max_step", "ot", 256], ["unroll_explicit", "ot", 1]]}, "result": [[0.0010802517500000002], 0, 3.0199270248413086, 1638603872.5652506], "version": 0.2, "tvm_version": "0.9.dev0"}
{"input": ["rocm -keys=rocm,gpu -max_num_threads=256 -mcpu=gfx906 -mtriple=amdgcn-amd-amdhsa-hcc -thread_warp_size=64", "depthwise_conv2d_nchw.cuda", [["TENSOR", [128, 336, 21, 21], "float32"], ["TENSOR", [336, 1, 5, 5], "float32"], 1, "SAME", 1, "float32"], {}], "config": {"index": 326216, "code_hash": null, "entity": [["tile_f", "sp", [-1, 1, 4, 4]], ["tile_y", "sp", [-1, 1, 7, 1]], ["tile_x", "sp", [-1, 1, 3, 1]], ["auto_unroll_max_step", "ot", 1500], ["unroll_explicit", "ot", 1]]}, "result": [[0.0010785168712121214], 0, 3.0799951553344727, 1638603874.9366019], "version": 0.2, "tvm_version": "0.9.dev0"}
{"input": ["rocm -keys=rocm,gpu -max_num_threads=256 -mcpu=gfx906 -mtriple=amdgcn-amd-amdhsa-hcc -thread_warp_size=64", "depthwise_conv2d_nchw.cuda", [["TENSOR", [128, 336, 21, 21], "float32"], ["TENSOR", [336, 1, 5, 5], "float32"], 1, "SAME", 1, "float32"], {}], "config": {"index": 59104, "code_hash": null, "entity": [["tile_f", "sp", [-1, 1, 7, 4]], ["tile_y", "sp", [-1, 1, 1, 3]], ["tile_x", "sp", [-1, 1, 7, 1]], ["auto_unroll_max_step", "ot", 0], ["unroll_explicit", "ot", 1]]}, "result": [[0.00272905675], 0, 3.115459680557251, 1638603877.1984859], "version": 0.2, "tvm_version": "0.9.dev0"}
{"input": ["rocm -keys=rocm,gpu -max_num_threads=256 -mcpu=gfx906 -mtriple=amdgcn-amd-amdhsa-hcc -thread_warp_size=64", "depthwise_conv2d_nchw.cuda", [["TENSOR", [128, 336, 21, 21], "float32"], ["TENSOR", [336, 1, 5, 5], "float32"], 1, "SAME", 1, "float32"], {}], "config": {"index": 345824, "code_hash": null, "entity": [["tile_f", "sp", [-1, 1, 7, 4]], ["tile_y", "sp", [-1, 1, 1, 3]], ["tile_x", "sp", [-1, 1, 7, 1]], ["auto_unroll_max_step", "ot", 1500], ["unroll_explicit", "ot", 1]]}, "result": [[0.0022936223333333335], 0, 3.735624313354492, 1638603879.9652088], "version": 0.2, "tvm_version": "0.9.dev0"}
{"input": ["rocm -keys=rocm,gpu -max_num_threads=256 -mcpu=gfx906 -mtriple=amdgcn-amd-amdhsa-hcc -thread_warp_size=64", "depthwise_conv2d_nchw.cuda", [["TENSOR", [128, 336, 21, 21], "float32"], ["TENSOR", [336, 1, 5, 5], "float32"], 1, "SAME", 1, "float32"], {}], "config": {"index": 202464, "code_hash": null, "entity": [["tile_f", "sp", [-1, 1, 7, 4]], ["tile_y", "sp", [-1, 1, 1, 3]], ["tile_x", "sp", [-1, 1, 7, 1]], ["auto_unroll_max_step", "ot", 256], ["unroll_explicit", "ot", 1]]}, "result": [[0.0022706469848484847], 0, 3.0891036987304688, 1638603882.0115628], "version": 0.2, "tvm_version": "0.9.dev0"}
{"input": ["rocm -keys=rocm,gpu -max_num_threads=256 -mcpu=gfx906 -mtriple=amdgcn-amd-amdhsa-hcc -thread_warp_size=64", "depthwise_conv2d_nchw.cuda", [["TENSOR", [128, 336, 21, 21], "float32"], ["TENSOR", [336, 1, 5, 5], "float32"], 1, "SAME", 1, "float32"], {}], "config": {"index": 344083, "code_hash": null, "entity": [["tile_f", "sp", [-1, 1, 4, 3]], ["tile_y", "sp", [-1, 1, 7, 1]], ["tile_x", "sp", [-1, 1, 7, 1]], ["auto_unroll_max_step", "ot", 1500], ["unroll_explicit", "ot", 1]]}, "result": [[0.0006802946811594203], 0, 2.146735668182373, 1638603939.798794], "version": 0.2, "tvm_version": "0.9.dev0"}
{"input": ["rocm -keys=rocm,gpu -max_num_threads=256 -mcpu=gfx906 -mtriple=amdgcn-amd-amdhsa-hcc -thread_warp_size=64", "depthwise_conv2d_nchw.cuda", [["TENSOR", [128, 336, 21, 21], "float32"], ["TENSOR", [336, 1, 5, 5], "float32"], 1, "SAME", 1, "float32"], {}], "config": {"index": 200723, "code_hash": null, "entity": [["tile_f", "sp", [-1, 1, 4, 3]], ["tile_y", "sp", [-1, 1, 7, 1]], ["tile_x", "sp", [-1, 1, 7, 1]], ["auto_unroll_max_step", "ot", 256], ["unroll_explicit", "ot", 1]]}, "result": [[0.0006856364423076923], 0, 2.172046422958374, 1638603941.5356994], "version": 0.2, "tvm_version": "0.9.dev0"}
{"input": ["rocm -keys=rocm,gpu -max_num_threads=256 -mcpu=gfx906 -mtriple=amdgcn-amd-amdhsa-hcc -thread_warp_size=64", "depthwise_conv2d_nchw.cuda", [["TENSOR", [128, 336, 21, 21], "float32"], ["TENSOR", [336, 1, 5, 5], "float32"], 1, "SAME", 1, "float32"], {}], "config": {"index": 199614, "code_hash": null, "entity": [["tile_f", "sp", [-1, 1, 8, 3]], ["tile_y", "sp", [-1, 1, 3, 1]], ["tile_x", "sp", [-1, 1, 7, 1]], ["auto_unroll_max_step", "ot", 256], ["unroll_explicit", "ot", 1]]}, "result": [[0.0009153882156862744], 0, 2.339674234390259, 1638603943.3592012], "version": 0.2, "tvm_version": "0.9.dev0"}
{"input": ["rocm -keys=rocm,gpu -max_num_threads=256 -mcpu=gfx906 -mtriple=amdgcn-amd-amdhsa-hcc -thread_warp_size=64", "depthwise_conv2d_nchw.cuda", [["TENSOR", [128, 336, 21, 21], "float32"], ["TENSOR", [336, 1, 5, 5], "float32"], 1, "SAME", 1, "float32"], {}], "config": {"index": 353043, "code_hash": null, "entity": [["tile_f", "sp", [-1, 1, 4, 3]], ["tile_y", "sp", [-1, 1, 7, 1]], ["tile_x", "sp", [-1, 3, 7, 1]], ["auto_unroll_max_step", "ot", 1500], ["unroll_explicit", "ot", 1]]}, "result": [[0.0006314404678899082], 0, 2.50717830657959, 1638603945.12692], "version": 0.2, "tvm_version": "0.9.dev0"}
{"input": ["rocm -keys=rocm,gpu -max_num_threads=256 -mcpu=gfx906 -mtriple=amdgcn-amd-amdhsa-hcc -thread_warp_size=64", "depthwise_conv2d_nchw.cuda", [["TENSOR", [128, 336, 21, 21], "float32"], ["TENSOR", [336, 1, 5, 5], "float32"], 1, "SAME", 1, "float32"], {}], "config": {"index": 351865, "code_hash": null, "entity": [["tile_f", "sp", [-1, 1, 7, 2]], ["tile_y", "sp", [-1, 1, 3, 1]], ["tile_x", "sp", [-1, 3, 7, 1]], ["auto_unroll_max_step", "ot", 1500], ["unroll_explicit", "ot", 1]]}, "result": [[0.0008354638242424243], 0, 2.4752089977264404, 1638603946.9750593], "version": 0.2, "tvm_version": "0.9.dev0"}
{"input": ["rocm -keys=rocm,gpu -max_num_threads=256 -mcpu=gfx906 -mtriple=amdgcn-amd-amdhsa-hcc -thread_warp_size=64", "depthwise_conv2d_nchw.cuda", [["TENSOR", [128, 336, 21, 21], "float32"], ["TENSOR", [336, 1, 5, 5], "float32"], 1, "SAME", 1, "float32"], {}], "config": {"index": 351859, "code_hash": null, "entity": [["tile_f", "sp", [-1, 1, 6, 2]], ["tile_y", "sp", [-1, 1, 3, 1]], ["tile_x", "sp", [-1, 3, 7, 1]], ["auto_unroll_max_step", "ot", 1500], ["unroll_explicit", "ot", 1]]}, "result": [[0.0008137765917159763], 0, 2.4753615856170654, 1638603948.7790864], "version": 0.2, "tvm_version": "0.9.dev0"}
{"input": ["rocm -keys=rocm,gpu -max_num_threads=256 -mcpu=gfx906 -mtriple=amdgcn-amd-amdhsa-hcc -thread_warp_size=64", "depthwise_conv2d_nchw.cuda", [["TENSOR", [128, 336, 21, 21], "float32"], ["TENSOR", [336, 1, 5, 5], "float32"], 1, "SAME", 1, "float32"], {}], "config": {"index": 342974, "code_hash": null, "entity": [["tile_f", "sp", [-1, 1, 8, 3]], ["tile_y", "sp", [-1, 1, 3, 1]], ["tile_x", "sp", [-1, 1, 7, 1]], ["auto_unroll_max_step", "ot", 1500], ["unroll_explicit", "ot", 1]]}, "result": [[0.0009147973653846155], 0, 2.3502750396728516, 1638603950.630533], "version": 0.2, "tvm_version": "0.9.dev0"}
{"input": ["rocm -keys=rocm,gpu -max_num_threads=256 -mcpu=gfx906 -mtriple=amdgcn-amd-amdhsa-hcc -thread_warp_size=64", "depthwise_conv2d_nchw.cuda", [["TENSOR", [128, 336, 21, 21], "float32"], ["TENSOR", [336, 1, 5, 5], "float32"], 1, "SAME", 1, "float32"], {}], "config": {"index": 388706, "code_hash": null, "entity": [["tile_f", "sp", [-1, 1, 7, 1]], ["tile_y", "sp", [-1, 1, 7, 1]], ["tile_x", "sp", [-1, 1, 7, 3]], ["auto_unroll_max_step", "ot", 1500], ["unroll_explicit", "ot", 1]]}, "result": [[0.00046060922972972966], 0, 2.1898300647735596, 1638603952.4486048], "version": 0.2, "tvm_version": "0.9.dev0"}
{"input": ["rocm -keys=rocm,gpu -max_num_threads=256 -mcpu=gfx906 -mtriple=amdgcn-amd-amdhsa-hcc -thread_warp_size=64", "depthwise_conv2d_nchw.cuda", [["TENSOR", [128, 336, 21, 21], "float32"], ["TENSOR", [336, 1, 5, 5], "float32"], 1, "SAME", 1, "float32"], {}], "config": {"index": 388716, "code_hash": null, "entity": [["tile_f", "sp", [-1, 1, 8, 1]], ["tile_y", "sp", [-1, 1, 7, 1]], ["tile_x", "sp", [-1, 1, 7, 3]], ["auto_unroll_max_step", "ot", 1500], ["unroll_explicit", "ot", 1]]}, "result": [[0.00045802979605263157], 0, 2.166304588317871, 1638603954.2343936], "version": 0.2, "tvm_version": "0.9.dev0"}
{"input": ["rocm -keys=rocm,gpu -max_num_threads=256 -mcpu=gfx906 -mtriple=amdgcn-amd-amdhsa-hcc -thread_warp_size=64", "depthwise_conv2d_nchw.cuda", [["TENSOR", [128, 336, 21, 21], "float32"], ["TENSOR", [336, 1, 5, 5], "float32"], 1, "SAME", 1, "float32"], {}], "config": {"index": 388811, "code_hash": null, "entity": [["tile_f", "sp", [-1, 1, 4, 2]], ["tile_y", "sp", [-1, 1, 7, 1]], ["tile_x", "sp", [-1, 1, 7, 3]], ["auto_unroll_max_step", "ot", 1500], ["unroll_explicit", "ot", 1]]}, "result": [[0.00048438077430555557], 0, 2.330291509628296, 1638603956.0222573], "version": 0.2, "tvm_version": "0.9.dev0"}
{"input": ["rocm -keys=rocm,gpu -max_num_threads=256 -mcpu=gfx906 -mtriple=amdgcn-amd-amdhsa-hcc -thread_warp_size=64", "depthwise_conv2d_nchw.cuda", [["TENSOR", [128, 336, 21, 21], "float32"], ["TENSOR", [336, 1, 5, 5], "float32"], 1, "SAME", 1, "float32"], {}], "config": {"index": 387586, "code_hash": null, "entity": [["tile_f", "sp", [-1, 1, 7, 1]], ["tile_y", "sp", [-1, 1, 3, 1]], ["tile_x", "sp", [-1, 1, 7, 3]], ["auto_unroll_max_step", "ot", 1500], ["unroll_explicit", "ot", 1]]}, "result": [[0.000601238], 0, 2.2411274909973145, 1638603957.8323483], "version": 0.2, "tvm_version": "0.9.dev0"}
{"input": ["rocm -keys=rocm,gpu -max_num_threads=256 -mcpu=gfx906 -mtriple=amdgcn-amd-amdhsa-hcc -thread_warp_size=64", "depthwise_conv2d_nchw.cuda", [["TENSOR", [128, 336, 21, 21], "float32"], ["TENSOR", [336, 1, 5, 5], "float32"], 1, "SAME", 1, "float32"], {}], "config": {"index": 387596, "code_hash": null, "entity": [["tile_f", "sp", [-1, 1, 8, 1]], ["tile_y", "sp", [-1, 1, 3, 1]], ["tile_x", "sp", [-1, 1, 7, 3]], ["auto_unroll_max_step", "ot", 1500], ["unroll_explicit", "ot", 1]]}, "result": [[0.0005807626455696203], 0, 2.1677465438842773, 1638603959.63213], "version": 0.2, "tvm_version": "0.9.dev0"}
{"input": ["rocm -keys=rocm,gpu -max_num_threads=256 -mcpu=gfx906 -mtriple=amdgcn-amd-amdhsa-hcc -thread_warp_size=64", "depthwise_conv2d_nchw.cuda", [["TENSOR", [128, 336, 21, 21], "float32"], ["TENSOR", [336, 1, 5, 5], "float32"], 1, "SAME", 1, "float32"], {}], "config": {"index": 344130, "code_hash": null, "entity": [["tile_f", "sp", [-1, 1, 3, 4]], ["tile_y", "sp", [-1, 1, 7, 1]], ["tile_x", "sp", [-1, 1, 7, 1]], ["auto_unroll_max_step", "ot", 1500], ["unroll_explicit", "ot", 1]]}, "result": [[0.000721534456852792], 0, 2.4818613529205322, 1638603961.5295098], "version": 0.2, "tvm_version": "0.9.dev0"}
{"input": ["rocm -keys=rocm,gpu -max_num_threads=256 -mcpu=gfx906 -mtriple=amdgcn-amd-amdhsa-hcc -thread_warp_size=64", "depthwise_conv2d_nchw.cuda", [["TENSOR", [128, 336, 21, 21], "float32"], ["TENSOR", [336, 1, 5, 5], "float32"], 1, "SAME", 1, "float32"], {}], "config": {"index": 344019, "code_hash": null, "entity": [["tile_f", "sp", [-1, 1, 6, 2]], ["tile_y", "sp", [-1, 1, 7, 1]], ["tile_x", "sp", [-1, 1, 7, 1]], ["auto_unroll_max_step", "ot", 1500], ["unroll_explicit", "ot", 1]]}, "result": [[0.0006402461538461539], 0, 2.2233123779296875, 1638603963.37506], "version": 0.2, "tvm_version": "0.9.dev0"}
{"input": ["rocm -keys=rocm,gpu -max_num_threads=256 -mcpu=gfx906 -mtriple=amdgcn-amd-amdhsa-hcc -thread_warp_size=64", "depthwise_conv2d_nchw.cuda", [["TENSOR", [128, 336, 21, 21], "float32"], ["TENSOR", [336, 1, 5, 5], "float32"], 1, "SAME", 1, "float32"], {}], "config": {"index": 388698, "code_hash": null, "entity": [["tile_f", "sp", [-1, 1, 6, 1]], ["tile_y", "sp", [-1, 1, 7, 1]], ["tile_x", "sp", [-1, 1, 7, 3]], ["auto_unroll_max_step", "ot", 1500], ["unroll_explicit", "ot", 1]]}, "result": [[0.00044554086068111456], 0, 2.4363279342651367, 1638603965.4294271], "version": 0.2, "tvm_version": "0.9.dev0"}
{"input": ["rocm -keys=rocm,gpu -max_num_threads=256 -mcpu=gfx906 -mtriple=amdgcn-amd-amdhsa-hcc -thread_warp_size=64", "depthwise_conv2d_nchw.cuda", [["TENSOR", [128, 336, 21, 21], "float32"], ["TENSOR", [336, 1, 5, 5], "float32"], 1, "SAME", 1, "float32"], {}], "config": {"index": 352971, "code_hash": null, "entity": [["tile_f", "sp", [-1, 1, 4, 2]], ["tile_y", "sp", [-1, 1, 7, 1]], ["tile_x", "sp", [-1, 3, 7, 1]], ["auto_unroll_max_step", "ot", 1500], ["unroll_explicit", "ot", 1]]}, "result": [[0.0005359459597069596], 0, 2.94998836517334, 1638603967.765346], "version": 0.2, "tvm_version": "0.9.dev0"}
{"input": ["rocm -keys=rocm,gpu -max_num_threads=256 -mcpu=gfx906 -mtriple=amdgcn-amd-amdhsa-hcc -thread_warp_size=64", "depthwise_conv2d_nchw.cuda", [["TENSOR", [128, 336, 21, 21], "float32"], ["TENSOR", [336, 1, 5, 5], "float32"], 1, "SAME", 1, "float32"], {}], "config": {"index": 360819, "code_hash": null, "entity": [["tile_f", "sp", [-1, 1, 6, 2]], ["tile_y", "sp", [-1, 1, 3, 1]], ["tile_x", "sp", [-1, 1, 21, 1]], ["auto_unroll_max_step", "ot", 1500], ["unroll_explicit", "ot", 1]]}, "result": [[0.0005891546506024097], 0, 2.557279586791992, 1638603969.9415333], "version": 0.2, "tvm_version": "0.9.dev0"}
{"input": ["rocm -keys=rocm,gpu -max_num_threads=256 -mcpu=gfx906 -mtriple=amdgcn-amd-amdhsa-hcc -thread_warp_size=64", "depthwise_conv2d_nchw.cuda", [["TENSOR", [128, 336, 21, 21], "float32"], ["TENSOR", [336, 1, 5, 5], "float32"], 1, "SAME", 1, "float32"], {}], "config": {"index": 360825, "code_hash": null, "entity": [["tile_f", "sp", [-1, 1, 7, 2]], ["tile_y", "sp", [-1, 1, 3, 1]], ["tile_x", "sp", [-1, 1, 21, 1]], ["auto_unroll_max_step", "ot", 1500], ["unroll_explicit", "ot", 1]]}, "result": [[0.0005911043714285714], 0, 2.5628974437713623, 1638603972.1630666], "version": 0.2, "tvm_version": "0.9.dev0"}
{"input": ["rocm -keys=rocm,gpu -max_num_threads=256 -mcpu=gfx906 -mtriple=amdgcn-amd-amdhsa-hcc -thread_warp_size=64", "depthwise_conv2d_nchw.cuda", [["TENSOR", [128, 336, 21, 21], "float32"], ["TENSOR", [336, 1, 5, 5], "float32"], 1, "SAME", 1, "float32"], {}], "config": {"index": 351929, "code_hash": null, "entity": [["tile_f", "sp", [-1, 1, 7, 3]], ["tile_y", "sp", [-1, 1, 3, 1]], ["tile_x", "sp", [-1, 3, 7, 1]], ["auto_unroll_max_step", "ot", 1500], ["unroll_explicit", "ot", 1]]}, "result": [[0.001201523974789916], 0, 3.171816110610962, 1638603974.5050747], "version": 0.2, "tvm_version": "0.9.dev0"}
{"input": ["rocm -keys=rocm,gpu -max_num_threads=256 -mcpu=gfx906 -mtriple=amdgcn-amd-amdhsa-hcc -thread_warp_size=64", "depthwise_conv2d_nchw.cuda", [["TENSOR", [128, 336, 21, 21], "float32"], ["TENSOR", [336, 1, 5, 5], "float32"], 1, "SAME", 1, "float32"], {}], "config": {"index": 209683, "code_hash": null, "entity": [["tile_f", "sp", [-1, 1, 4, 3]], ["tile_y", "sp", [-1, 1, 7, 1]], ["tile_x", "sp", [-1, 3, 7, 1]], ["auto_unroll_max_step", "ot", 256], ["unroll_explicit", "ot", 1]]}, "result": [[0.0006336737433628319], 0, 3.025404691696167, 1638603976.7665844], "version": 0.2, "tvm_version": "0.9.dev0"}
{"input": ["rocm -keys=rocm,gpu -max_num_threads=256 -mcpu=gfx906 -mtriple=amdgcn-amd-amdhsa-hcc -thread_warp_size=64", "depthwise_conv2d_nchw.cuda", [["TENSOR", [128, 336, 21, 21], "float32"], ["TENSOR", [336, 1, 5, 5], "float32"], 1, "SAME", 1, "float32"], {}], "config": {"index": 388803, "code_hash": null, "entity": [["tile_f", "sp", [-1, 1, 3, 2]], ["tile_y", "sp", [-1, 1, 7, 1]], ["tile_x", "sp", [-1, 1, 7, 3]], ["auto_unroll_max_step", "ot", 1500], ["unroll_explicit", "ot", 1]]}, "result": [[0.0005087257067137809], 0, 2.710190773010254, 1638603978.9942594], "version": 0.2, "tvm_version": "0.9.dev0"}
{"input": ["rocm -keys=rocm,gpu -max_num_threads=256 -mcpu=gfx906 -mtriple=amdgcn-amd-amdhsa-hcc -thread_warp_size=64", "depthwise_conv2d_nchw.cuda", [["TENSOR", [128, 336, 21, 21], "float32"], ["TENSOR", [336, 1, 5, 5], "float32"], 1, "SAME", 1, "float32"], {}], "config": {"index": 56254, "code_hash": null, "entity": [["tile_f", "sp", [-1, 1, 8, 3]], ["tile_y", "sp", [-1, 1, 3, 1]], ["tile_x", "sp", [-1, 1, 7, 1]], ["auto_unroll_max_step", "ot", 0], ["unroll_explicit", "ot", 1]]}, "result": [[0.0009502954761904762], 0, 3.1879873275756836, 1638603981.6482124], "version": 0.2, "tvm_version": "0.9.dev0"}
