artifacts/Table4/tvm/autotvm/depthwise/depthwise_128_42_165_165_5_5_2_SAME.log
{"input": ["rocm -keys=rocm,gpu -max_num_threads=256 -mcpu=gfx906 -mtriple=amdgcn-amd-amdhsa-hcc -thread_warp_size=64", "depthwise_conv2d_nchw.cuda", [["TENSOR", [128, 42, 165, 165], "float32"], ["TENSOR", [42, 1, 5, 5], "float32"], 2, "SAME", 1, "float32"], {}], "config": {"index": 1567, "code_hash": null, "entity": [["tile_f", "sp", [-1, 1, 3, 2]], ["tile_y", "sp", [-1, 1, 1, 1]], ["tile_x", "sp", [-1, 1, 83, 1]], ["auto_unroll_max_step", "ot", 256], ["unroll_explicit", "ot", 1]]}, "result": [[0.004460532028571428], 0, 6.341490745544434, 1638606594.960868], "version": 0.2, "tvm_version": "0.9.dev0"}
{"input": ["rocm -keys=rocm,gpu -max_num_threads=256 -mcpu=gfx906 -mtriple=amdgcn-amd-amdhsa-hcc -thread_warp_size=64", "depthwise_conv2d_nchw.cuda", [["TENSOR", [128, 42, 165, 165], "float32"], ["TENSOR", [42, 1, 5, 5], "float32"], 2, "SAME", 1, "float32"], {}], "config": {"index": 520, "code_hash": null, "entity": [["tile_f", "sp", [-1, 1, 2, 1]], ["tile_y", "sp", [-1, 1, 1, 1]], ["tile_x", "sp", [-1, 1, 83, 1]], ["auto_unroll_max_step", "ot", 0], ["unroll_explicit", "ot", 1]]}, "result": [[0.0038662780000000003], 0, 5.957209825515747, 1638606600.395472], "version": 0.2, "tvm_version": "0.9.dev0"}
{"input": ["rocm -keys=rocm,gpu -max_num_threads=256 -mcpu=gfx906 -mtriple=amdgcn-amd-amdhsa-hcc -thread_warp_size=64", "depthwise_conv2d_nchw.cuda", [["TENSOR", [128, 42, 165, 165], "float32"], ["TENSOR", [42, 1, 5, 5], "float32"], 2, "SAME", 1, "float32"], {}], "config": {"index": 2317, "code_hash": null, "entity": [["tile_f", "sp", [-1, 2, 3, 1]], ["tile_y", "sp", [-1, 1, 1, 1]], ["tile_x", "sp", [-1, 83, 1, 1]], ["auto_unroll_max_step", "ot", 1500], ["unroll_explicit", "ot", 1]]}, "result": [[1.64731823725], 0, 21.807923316955566, 1638606613.559956], "version": 0.2, "tvm_version": "0.9.dev0"}
{"input": ["rocm -keys=rocm,gpu -max_num_threads=256 -mcpu=gfx906 -mtriple=amdgcn-amd-amdhsa-hcc -thread_warp_size=64", "depthwise_conv2d_nchw.cuda", [["TENSOR", [128, 42, 165, 165], "float32"], ["TENSOR", [42, 1, 5, 5], "float32"], 2, "SAME", 1, "float32"], {}], "config": {"index": 1549, "code_hash": null, "entity": [["tile_f", "sp", [-1, 2, 3, 1]], ["tile_y", "sp", [-1, 1, 1, 1]], ["tile_x", "sp", [-1, 1, 83, 1]], ["auto_unroll_max_step", "ot", 256], ["unroll_explicit", "ot", 1]]}, "result": [[0.0044992218], 0, 5.7449867725372314, 1638606618.7024732], "version": 0.2, "tvm_version": "0.9.dev0"}
{"input": ["rocm -keys=rocm,gpu -max_num_threads=256 -mcpu=gfx906 -mtriple=amdgcn-amd-amdhsa-hcc -thread_warp_size=64", "depthwise_conv2d_nchw.cuda", [["TENSOR", [128, 42, 165, 165], "float32"], ["TENSOR", [42, 1, 5, 5], "float32"], 2, "SAME", 1, "float32"], {}], "config": {"index": 2180, "code_hash": null, "entity": [["tile_f", "sp", [-1, 7, 1, 1]], ["tile_y", "sp", [-1, 1, 83, 1]], ["tile_x", "sp", [-1, 1, 1, 1]], ["auto_unroll_max_step", "ot", 1500], ["unroll_explicit", "ot", 1]]}, "result": [[0.018093199333333334], 0, 6.591700792312622, 1638606623.6789398], "version": 0.2, "tvm_version": "0.9.dev0"}
{"input": ["rocm -keys=rocm,gpu -max_num_threads=256 -mcpu=gfx906 -mtriple=amdgcn-amd-amdhsa-hcc -thread_warp_size=64", "depthwise_conv2d_nchw.cuda", [["TENSOR", [128, 42, 165, 165], "float32"], ["TENSOR", [42, 1, 5, 5], "float32"], 2, "SAME", 1, "float32"], {}], "config": {"index": 1052, "code_hash": null, "entity": [["tile_f", "sp", [-1, 3, 1, 2]], ["tile_y", "sp", [-1, 1, 1, 1]], ["tile_x", "sp", [-1, 1, 1, 1]], ["auto_unroll_max_step", "ot", 256], ["unroll_explicit", "ot", 1]]}, "result": [[0.09897346475], 0, 6.631762981414795, 1638606628.9784355], "version": 0.2, "tvm_version": "0.9.dev0"}
{"input": ["rocm -keys=rocm,gpu -max_num_threads=256 -mcpu=gfx906 -mtriple=amdgcn-amd-amdhsa-hcc -thread_warp_size=64", "depthwise_conv2d_nchw.cuda", [["TENSOR", [128, 42, 165, 165], "float32"], ["TENSOR", [42, 1, 5, 5], "float32"], 2, "SAME", 1, "float32"], {}], "config": {"index": 43, "code_hash": null, "entity": [["tile_f", "sp", [-1, 2, 7, 3]], ["tile_y", "sp", [-1, 1, 1, 1]], ["tile_x", "sp", [-1, 1, 1, 1]], ["auto_unroll_max_step", "ot", 0], ["unroll_explicit", "ot", 1]]}, "result": [[0.12294981375], 0, 6.379462003707886, 1638606634.3599474], "version": 0.2, "tvm_version": "0.9.dev0"}
{"input": ["rocm -keys=rocm,gpu -max_num_threads=256 -mcpu=gfx906 -mtriple=amdgcn-amd-amdhsa-hcc -thread_warp_size=64", "depthwise_conv2d_nchw.cuda", [["TENSOR", [128, 42, 165, 165], "float32"], ["TENSOR", [42, 1, 5, 5], "float32"], 2, "SAME", 1, "float32"], {}], "config": {"index": 2588, "code_hash": null, "entity": [["tile_f", "sp", [-1, 3, 1, 2]], ["tile_y", "sp", [-1, 1, 1, 1]], ["tile_x", "sp", [-1, 1, 83, 1]], ["auto_unroll_max_step", "ot", 1500], ["unroll_explicit", "ot", 1]]}, "result": [[0.0102235343], 0, 6.2838029861450195, 1638606639.5174563], "version": 0.2, "tvm_version": "0.9.dev0"}
{"input": ["rocm -keys=rocm,gpu -max_num_threads=256 -mcpu=gfx906 -mtriple=amdgcn-amd-amdhsa-hcc -thread_warp_size=64", "depthwise_conv2d_nchw.cuda", [["TENSOR", [128, 42, 165, 165], "float32"], ["TENSOR", [42, 1, 5, 5], "float32"], 2, "SAME", 1, "float32"], {}], "config": {"index": 1538, "code_hash": null, "entity": [["tile_f", "sp", [-1, 3, 1, 1]], ["tile_y", "sp", [-1, 1, 1, 1]], ["tile_x", "sp", [-1, 1, 83, 1]], ["auto_unroll_max_step", "ot", 256], ["unroll_explicit", "ot", 1]]}, "result": [[0.005719190333333333], 0, 5.738427639007568, 1638606644.3922658], "version": 0.2, "tvm_version": "0.9.dev0"}
{"input": ["rocm -keys=rocm,gpu -max_num_threads=256 -mcpu=gfx906 -mtriple=amdgcn-amd-amdhsa-hcc -thread_warp_size=64", "depthwise_conv2d_nchw.cuda", [["TENSOR", [128, 42, 165, 165], "float32"], ["TENSOR", [42, 1, 5, 5], "float32"], 2, "SAME", 1, "float32"], {}], "config": {"index": 2051, "code_hash": null, "entity": [["tile_f", "sp", [-1, 6, 1, 1]], ["tile_y", "sp", [-1, 1, 1, 1]], ["tile_x", "sp", [-1, 1, 1, 1]], ["auto_unroll_max_step", "ot", 1500], ["unroll_explicit", "ot", 1]]}, "result": [[0.11795721425000001], 0, 6.152974605560303, 1638606652.1020432], "version": 0.2, "tvm_version": "0.9.dev0"}
{"input": ["rocm -keys=rocm,gpu -max_num_threads=256 -mcpu=gfx906 -mtriple=amdgcn-amd-amdhsa-hcc -thread_warp_size=64", "depthwise_conv2d_nchw.cuda", [["TENSOR", [128, 42, 165, 165], "float32"], ["TENSOR", [42, 1, 5, 5], "float32"], 2, "SAME", 1, "float32"], {}], "config": {"index": 797, "code_hash": null, "entity": [["tile_f", "sp", [-1, 7, 1, 2]], ["tile_y", "sp", [-1, 1, 1, 1]], ["tile_x", "sp", [-1, 1, 1, 83]], ["auto_unroll_max_step", "ot", 0], ["unroll_explicit", "ot", 1]]}, "result": [[1.56391723625], 0, 14.217070817947388, 1638606664.9176922], "version": 0.2, "tvm_version": "0.9.dev0"}
{"input": ["rocm -keys=rocm,gpu -max_num_threads=256 -mcpu=gfx906 -mtriple=amdgcn-amd-amdhsa-hcc -thread_warp_size=64", "depthwise_conv2d_nchw.cuda", [["TENSOR", [128, 42, 165, 165], "float32"], ["TENSOR", [42, 1, 5, 5], "float32"], 2, "SAME", 1, "float32"], {}], "config": {"index": 790, "code_hash": null, "entity": [["tile_f", "sp", [-1, 1, 14, 1]], ["tile_y", "sp", [-1, 1, 1, 1]], ["tile_x", "sp", [-1, 1, 1, 83]], ["auto_unroll_max_step", "ot", 0], ["unroll_explicit", "ot", 1]]}, "result": [[0.193383621], 0, 6.411019325256348, 1638606670.6829708], "version": 0.2, "tvm_version": "0.9.dev0"}
{"input": ["rocm -keys=rocm,gpu -max_num_threads=256 -mcpu=gfx906 -mtriple=amdgcn-amd-amdhsa-hcc -thread_warp_size=64", "depthwise_conv2d_nchw.cuda", [["TENSOR", [128, 42, 165, 165], "float32"], ["TENSOR", [42, 1, 5, 5], "float32"], 2, "SAME", 1, "float32"], {}], "config": {"index": 18, "code_hash": null, "entity": [["tile_f", "sp", [-1, 1, 7, 1]], ["tile_y", "sp", [-1, 1, 1, 1]], ["tile_x", "sp", [-1, 1, 1, 1]], ["auto_unroll_max_step", "ot", 0], ["unroll_explicit", "ot", 1]]}, "result": [[0.0600459745], 0, 5.870309114456177, 1638606676.2119536], "version": 0.2, "tvm_version": "0.9.dev0"}
{"input": ["rocm -keys=rocm,gpu -max_num_threads=256 -mcpu=gfx906 -mtriple=amdgcn-amd-amdhsa-hcc -thread_warp_size=64", "depthwise_conv2d_nchw.cuda", [["TENSOR", [128, 42, 165, 165], "float32"], ["TENSOR", [42, 1, 5, 5], "float32"], 2, "SAME", 1, "float32"], {}], "config": {"index": 1057, "code_hash": null, "entity": [["tile_f", "sp", [-1, 1, 7, 2]], ["tile_y", "sp", [-1, 1, 1, 1]], ["tile_x", "sp", [-1, 1, 1, 1]], ["auto_unroll_max_step", "ot", 256], ["unroll_explicit", "ot", 1]]}, "result": [[0.042573635000000006], 0, 7.106334686279297, 1638606682.79712], "version": 0.2, "tvm_version": "0.9.dev0"}
{"input": ["rocm -keys=rocm,gpu -max_num_threads=256 -mcpu=gfx906 -mtriple=amdgcn-amd-amdhsa-hcc -thread_warp_size=64", "depthwise_conv2d_nchw.cuda", [["TENSOR", [128, 42, 165, 165], "float32"], ["TENSOR", [42, 1, 5, 5], "float32"], 2, "SAME", 1, "float32"], {}], "config": {"index": 1317, "code_hash": null, "entity": [["tile_f", "sp", [-1, 2, 1, 3]], ["tile_y", "sp", [-1, 1, 1, 1]], ["tile_x", "sp", [-1, 83, 1, 1]], ["auto_unroll_max_step", "ot", 256], ["unroll_explicit", "ot", 1]]}, "result": [[2.2741186522500003], 0, 20.1026349067688, 1638606700.7632275], "version": 0.2, "tvm_version": "0.9.dev0"}
{"input": ["rocm -keys=rocm,gpu -max_num_threads=256 -mcpu=gfx906 -mtriple=amdgcn-amd-amdhsa-hcc -thread_warp_size=64", "depthwise_conv2d_nchw.cuda", [["TENSOR", [128, 42, 165, 165], "float32"], ["TENSOR", [42, 1, 5, 5], "float32"], 2, "SAME", 1, "float32"], {}], "config": {"index": 1059, "code_hash": null, "entity": [["tile_f", "sp", [-1, 1, 21, 2]], ["tile_y", "sp", [-1, 1, 1, 1]], ["tile_x", "sp", [-1, 1, 1, 1]], ["auto_unroll_max_step", "ot", 256], ["unroll_explicit", "ot", 1]]}, "result": [[0.04587125775], 0, 5.905583620071411, 1638606706.1052063], "version": 0.2, "tvm_version": "0.9.dev0"}
{"input": ["rocm -keys=rocm,gpu -max_num_threads=256 -mcpu=gfx906 -mtriple=amdgcn-amd-amdhsa-hcc -thread_warp_size=64", "depthwise_conv2d_nchw.cuda", [["TENSOR", [128, 42, 165, 165], "float32"], ["TENSOR", [42, 1, 5, 5], "float32"], 2, "SAME", 1, "float32"], {}], "config": {"index": 2233, "code_hash": null, "entity": [["tile_f", "sp", [-1, 1, 1, 14]], ["tile_y", "sp", [-1, 1, 83, 1]], ["tile_x", "sp", [-1, 1, 1, 1]], ["auto_unroll_max_step", "ot", 1500], ["unroll_explicit", "ot", 1]]}, "result": [[0.034852165], 0, 6.349841356277466, 1638606711.1298451], "version": 0.2, "tvm_version": "0.9.dev0"}
{"input": ["rocm -keys=rocm,gpu -max_num_threads=256 -mcpu=gfx906 -mtriple=amdgcn-amd-amdhsa-hcc -thread_warp_size=64", "depthwise_conv2d_nchw.cuda", [["TENSOR", [128, 42, 165, 165], "float32"], ["TENSOR", [42, 1, 5, 5], "float32"], 2, "SAME", 1, "float32"], {}], "config": {"index": 543, "code_hash": null, "entity": [["tile_f", "sp", [-1, 1, 3, 2]], ["tile_y", "sp", [-1, 1, 1, 1]], ["tile_x", "sp", [-1, 1, 83, 1]], ["auto_unroll_max_step", "ot", 0], ["unroll_explicit", "ot", 1]]}, "result": [[0.0049242124375], 0, 6.240281820297241, 1638606757.0288074], "version": 0.2, "tvm_version": "0.9.dev0"}
{"input": ["rocm -keys=rocm,gpu -max_num_threads=256 -mcpu=gfx906 -mtriple=amdgcn-amd-amdhsa-hcc -thread_warp_size=64", "depthwise_conv2d_nchw.cuda", [["TENSOR", [128, 42, 165, 165], "float32"], ["TENSOR", [42, 1, 5, 5], "float32"], 2, "SAME", 1, "float32"], {}], "config": {"index": 539, "code_hash": null, "entity": [["tile_f", "sp", [-1, 1, 1, 2]], ["tile_y", "sp", [-1, 1, 1, 1]], ["tile_x", "sp", [-1, 1, 83, 1]], ["auto_unroll_max_step", "ot", 0], ["unroll_explicit", "ot", 1]]}, "result": [[0.0051296791], 0, 5.485790729522705, 1638606761.9040253], "version": 0.2, "tvm_version": "0.9.dev0"}
{"input": ["rocm -keys=rocm,gpu -max_num_threads=256 -mcpu=gfx906 -mtriple=amdgcn-amd-amdhsa-hcc -thread_warp_size=64", "depthwise_conv2d_nchw.cuda", [["TENSOR", [128, 42, 165, 165], "float32"], ["TENSOR", [42, 1, 5, 5], "float32"], 2, "SAME", 1, "float32"], {}], "config": {"index": 2591, "code_hash": null, "entity": [["tile_f", "sp", [-1, 1, 3, 2]], ["tile_y", "sp", [-1, 1, 1, 1]], ["tile_x", "sp", [-1, 1, 83, 1]], ["auto_unroll_max_step", "ot", 1500], ["unroll_explicit", "ot", 1]]}, "result": [[0.004716588914285715], 0, 5.9521706104278564, 1638606767.261561], "version": 0.2, "tvm_version": "0.9.dev0"}
{"input": ["rocm -keys=rocm,gpu -max_num_threads=256 -mcpu=gfx906 -mtriple=amdgcn-amd-amdhsa-hcc -thread_warp_size=64", "depthwise_conv2d_nchw.cuda", [["TENSOR", [128, 42, 165, 165], "float32"], ["TENSOR", [42, 1, 5, 5], "float32"], 2, "SAME", 1, "float32"], {}], "config": {"index": 1544, "code_hash": null, "entity": [["tile_f", "sp", [-1, 1, 2, 1]], ["tile_y", "sp", [-1, 1, 1, 1]], ["tile_x", "sp", [-1, 1, 83, 1]], ["auto_unroll_max_step", "ot", 256], ["unroll_explicit", "ot", 1]]}, "result": [[0.0029297551509433967], 0, 5.752698659896851, 1638606772.2896757], "version": 0.2, "tvm_version": "0.9.dev0"}
{"input": ["rocm -keys=rocm,gpu -max_num_threads=256 -mcpu=gfx906 -mtriple=amdgcn-amd-amdhsa-hcc -thread_warp_size=64", "depthwise_conv2d_nchw.cuda", [["TENSOR", [128, 42, 165, 165], "float32"], ["TENSOR", [42, 1, 5, 5], "float32"], 2, "SAME", 1, "float32"], {}], "config": {"index": 1563, "code_hash": null, "entity": [["tile_f", "sp", [-1, 1, 1, 2]], ["tile_y", "sp", [-1, 1, 1, 1]], ["tile_x", "sp", [-1, 1, 83, 1]], ["auto_unroll_max_step", "ot", 256], ["unroll_explicit", "ot", 1]]}, "result": [[0.004152386710526316], 0, 5.708171606063843, 1638606777.46574], "version": 0.2, "tvm_version": "0.9.dev0"}
{"input": ["rocm -keys=rocm,gpu -max_num_threads=256 -mcpu=gfx906 -mtriple=amdgcn-amd-amdhsa-hcc -thread_warp_size=64", "depthwise_conv2d_nchw.cuda", [["TENSOR", [128, 42, 165, 165], "float32"], ["TENSOR", [42, 1, 5, 5], "float32"], 2, "SAME", 1, "float32"], {}], "config": {"index": 2568, "code_hash": null, "entity": [["tile_f", "sp", [-1, 1, 2, 1]], ["tile_y", "sp", [-1, 1, 1, 1]], ["tile_x", "sp", [-1, 1, 83, 1]], ["auto_unroll_max_step", "ot", 1500], ["unroll_explicit", "ot", 1]]}, "result": [[0.0031993460625], 0, 5.541811943054199, 1638606782.693138], "version": 0.2, "tvm_version": "0.9.dev0"}
{"input": ["rocm -keys=rocm,gpu -max_num_threads=256 -mcpu=gfx906 -mtriple=amdgcn-amd-amdhsa-hcc -thread_warp_size=64", "depthwise_conv2d_nchw.cuda", [["TENSOR", [128, 42, 165, 165], "float32"], ["TENSOR", [42, 1, 5, 5], "float32"], 2, "SAME", 1, "float32"], {}], "config": {"index": 2587, "code_hash": null, "entity": [["tile_f", "sp", [-1, 1, 1, 2]], ["tile_y", "sp", [-1, 1, 1, 1]], ["tile_x", "sp", [-1, 1, 83, 1]], ["auto_unroll_max_step", "ot", 1500], ["unroll_explicit", "ot", 1]]}, "result": [[0.004150773684210526], 0, 7.612971782684326, 1638606789.7986114], "version": 0.2, "tvm_version": "0.9.dev0"}
{"input": ["rocm -keys=rocm,gpu -max_num_threads=256 -mcpu=gfx906 -mtriple=amdgcn-amd-amdhsa-hcc -thread_warp_size=64", "depthwise_conv2d_nchw.cuda", [["TENSOR", [128, 42, 165, 165], "float32"], ["TENSOR", [42, 1, 5, 5], "float32"], 2, "SAME", 1, "float32"], {}], "config": {"index": 524, "code_hash": null, "entity": [["tile_f", "sp", [-1, 1, 3, 1]], ["tile_y", "sp", [-1, 1, 1, 1]], ["tile_x", "sp", [-1, 1, 83, 1]], ["auto_unroll_max_step", "ot", 0], ["unroll_explicit", "ot", 1]]}, "result": [[0.0035386098], 0, 7.23860239982605, 1638606796.6377916], "version": 0.2, "tvm_version": "0.9.dev0"}
{"input": ["rocm -keys=rocm,gpu -max_num_threads=256 -mcpu=gfx906 -mtriple=amdgcn-amd-amdhsa-hcc -thread_warp_size=64", "depthwise_conv2d_nchw.cuda", [["TENSOR", [128, 42, 165, 165], "float32"], ["TENSOR", [42, 1, 5, 5], "float32"], 2, "SAME", 1, "float32"], {}], "config": {"index": 512, "code_hash": null, "entity": [["tile_f", "sp", [-1, 1, 1, 1]], ["tile_y", "sp", [-1, 1, 1, 1]], ["tile_x", "sp", [-1, 1, 83, 1]], ["auto_unroll_max_step", "ot", 0], ["unroll_explicit", "ot", 1]]}, "result": [[0.0034119326249999996], 0, 8.004056453704834, 1638606804.2419307], "version": 0.2, "tvm_version": "0.9.dev0"}
{"input": ["rocm -keys=rocm,gpu -max_num_threads=256 -mcpu=gfx906 -mtriple=amdgcn-amd-amdhsa-hcc -thread_warp_size=64", "depthwise_conv2d_nchw.cuda", [["TENSOR", [128, 42, 165, 165], "float32"], ["TENSOR", [42, 1, 5, 5], "float32"], 2, "SAME", 1, "float32"], {}], "config": {"index": 1548, "code_hash": null, "entity": [["tile_f", "sp", [-1, 1, 3, 1]], ["tile_y", "sp", [-1, 1, 1, 1]], ["tile_x", "sp", [-1, 1, 83, 1]], ["auto_unroll_max_step", "ot", 256], ["unroll_explicit", "ot", 1]]}, "result": [[0.0028680392], 0, 5.310596227645874, 1638606809.1605976], "version": 0.2, "tvm_version": "0.9.dev0"}
{"input": ["rocm -keys=rocm,gpu -max_num_threads=256 -mcpu=gfx906 -mtriple=amdgcn-amd-amdhsa-hcc -thread_warp_size=64", "depthwise_conv2d_nchw.cuda", [["TENSOR", [128, 42, 165, 165], "float32"], ["TENSOR", [42, 1, 5, 5], "float32"], 2, "SAME", 1, "float32"], {}], "config": {"index": 513, "code_hash": null, "entity": [["tile_f", "sp", [-1, 2, 1, 1]], ["tile_y", "sp", [-1, 1, 1, 1]], ["tile_x", "sp", [-1, 1, 83, 1]], ["auto_unroll_max_step", "ot", 0], ["unroll_explicit", "ot", 1]]}, "result": [[0.005167271400000001], 0, 5.58313512802124, 1638606814.234706], "version": 0.2, "tvm_version": "0.9.dev0"}
{"input": ["rocm -keys=rocm,gpu -max_num_threads=256 -mcpu=gfx906 -mtriple=amdgcn-amd-amdhsa-hcc -thread_warp_size=64", "depthwise_conv2d_nchw.cuda", [["TENSOR", [128, 42, 165, 165], "float32"], ["TENSOR", [42, 1, 5, 5], "float32"], 2, "SAME", 1, "float32"], {}], "config": {"index": 2572, "code_hash": null, "entity": [["tile_f", "sp", [-1, 1, 3, 1]], ["tile_y", "sp", [-1, 1, 1, 1]], ["tile_x", "sp", [-1, 1, 83, 1]], ["auto_unroll_max_step", "ot", 1500], ["unroll_explicit", "ot", 1]]}, "result": [[0.002865844709090909], 0, 5.242053985595703, 1638606819.2960408], "version": 0.2, "tvm_version": "0.9.dev0"}
{"input": ["rocm -keys=rocm,gpu -max_num_threads=256 -mcpu=gfx906 -mtriple=amdgcn-amd-amdhsa-hcc -thread_warp_size=64", "depthwise_conv2d_nchw.cuda", [["TENSOR", [128, 42, 165, 165], "float32"], ["TENSOR", [42, 1, 5, 5], "float32"], 2, "SAME", 1, "float32"], {}], "config": {"index": 1536, "code_hash": null, "entity": [["tile_f", "sp", [-1, 1, 1, 1]], ["tile_y", "sp", [-1, 1, 1, 1]], ["tile_x", "sp", [-1, 1, 83, 1]], ["auto_unroll_max_step", "ot", 256], ["unroll_explicit", "ot", 1]]}, "result": [[0.002854800226415095], 0, 7.5492634773254395, 1638606826.1182034], "version": 0.2, "tvm_version": "0.9.dev0"}
{"input": ["rocm -keys=rocm,gpu -max_num_threads=256 -mcpu=gfx906 -mtriple=amdgcn-amd-amdhsa-hcc -thread_warp_size=64", "depthwise_conv2d_nchw.cuda", [["TENSOR", [128, 42, 165, 165], "float32"], ["TENSOR", [42, 1, 5, 5], "float32"], 2, "SAME", 1, "float32"], {}], "config": {"index": 1537, "code_hash": null, "entity": [["tile_f", "sp", [-1, 2, 1, 1]], ["tile_y", "sp", [-1, 1, 1, 1]], ["tile_x", "sp", [-1, 1, 83, 1]], ["auto_unroll_max_step", "ot", 256], ["unroll_explicit", "ot", 1]]}, "result": [[0.00421586925], 0, 7.0301854610443115, 1638606832.305327], "version": 0.2, "tvm_version": "0.9.dev0"}
{"input": ["rocm -keys=rocm,gpu -max_num_threads=256 -mcpu=gfx906 -mtriple=amdgcn-amd-amdhsa-hcc -thread_warp_size=64", "depthwise_conv2d_nchw.cuda", [["TENSOR", [128, 42, 165, 165], "float32"], ["TENSOR", [42, 1, 5, 5], "float32"], 2, "SAME", 1, "float32"], {}], "config": {"index": 552, "code_hash": null, "entity": [["tile_f", "sp", [-1, 1, 2, 3]], ["tile_y", "sp", [-1, 1, 1, 1]], ["tile_x", "sp", [-1, 1, 83, 1]], ["auto_unroll_max_step", "ot", 0], ["unroll_explicit", "ot", 1]]}, "result": [[0.006871705066666667], 0, 7.978237152099609, 1638606839.3902032], "version": 0.2, "tvm_version": "0.9.dev0"}
{"input": ["rocm -keys=rocm,gpu -max_num_threads=256 -mcpu=gfx906 -mtriple=amdgcn-amd-amdhsa-hcc -thread_warp_size=64", "depthwise_conv2d_nchw.cuda", [["TENSOR", [128, 42, 165, 165], "float32"], ["TENSOR", [42, 1, 5, 5], "float32"], 2, "SAME", 1, "float32"], {}], "config": {"index": 560, "code_hash": null, "entity": [["tile_f", "sp", [-1, 1, 1, 7]], ["tile_y", "sp", [-1, 1, 1, 1]], ["tile_x", "sp", [-1, 1, 83, 1]], ["auto_unroll_max_step", "ot", 0], ["unroll_explicit", "ot", 1]]}, "result": [[0.018225093833333334], 0, 6.933618783950806, 1638606845.3645148], "version": 0.2, "tvm_version": "0.9.dev0"}
{"input": ["rocm -keys=rocm,gpu -max_num_threads=256 -mcpu=gfx906 -mtriple=amdgcn-amd-amdhsa-hcc -thread_warp_size=64", "depthwise_conv2d_nchw.cuda", [["TENSOR", [128, 42, 165, 165], "float32"], ["TENSOR", [42, 1, 5, 5], "float32"], 2, "SAME", 1, "float32"], {}], "config": {"index": 2560, "code_hash": null, "entity": [["tile_f", "sp", [-1, 1, 1, 1]], ["tile_y", "sp", [-1, 1, 1, 1]], ["tile_x", "sp", [-1, 1, 83, 1]], ["auto_unroll_max_step", "ot", 1500], ["unroll_explicit", "ot", 1]]}, "result": [[0.0028564098], 0, 7.648594379425049, 1638606852.307375], "version": 0.2, "tvm_version": "0.9.dev0"}
{"input": ["rocm -keys=rocm,gpu -max_num_threads=256 -mcpu=gfx906 -mtriple=amdgcn-amd-amdhsa-hcc -thread_warp_size=64", "depthwise_conv2d_nchw.cuda", [["TENSOR", [128, 42, 165, 165], "float32"], ["TENSOR", [42, 1, 5, 5], "float32"], 2, "SAME", 1, "float32"], {}], "config": {"index": 2561, "code_hash": null, "entity": [["tile_f", "sp", [-1, 2, 1, 1]], ["tile_y", "sp", [-1, 1, 1, 1]], ["tile_x", "sp", [-1, 1, 83, 1]], ["auto_unroll_max_step", "ot", 1500], ["unroll_explicit", "ot", 1]]}, "result": [[0.004220758083333333], 0, 6.352019309997559, 1638606857.8492265], "version": 0.2, "tvm_version": "0.9.dev0"}
{"input": ["rocm -keys=rocm,gpu -max_num_threads=256 -mcpu=gfx906 -mtriple=amdgcn-amd-amdhsa-hcc -thread_warp_size=64", "depthwise_conv2d_nchw.cuda", [["TENSOR", [128, 42, 165, 165], "float32"], ["TENSOR", [42, 1, 5, 5], "float32"], 2, "SAME", 1, "float32"], {}], "config": {"index": 1576, "code_hash": null, "entity": [["tile_f", "sp", [-1, 1, 2, 3]], ["tile_y", "sp", [-1, 1, 1, 1]], ["tile_x", "sp", [-1, 1, 83, 1]], ["auto_unroll_max_step", "ot", 256], ["unroll_explicit", "ot", 1]]}, "result": [[0.0062739629375000005], 0, 6.820377588272095, 1638606863.5988708], "version": 0.2, "tvm_version": "0.9.dev0"}
{"input": ["rocm -keys=rocm,gpu -max_num_threads=256 -mcpu=gfx906 -mtriple=amdgcn-amd-amdhsa-hcc -thread_warp_size=64", "depthwise_conv2d_nchw.cuda", [["TENSOR", [128, 42, 165, 165], "float32"], ["TENSOR", [42, 1, 5, 5], "float32"], 2, "SAME", 1, "float32"], {}], "config": {"index": 1584, "code_hash": null, "entity": [["tile_f", "sp", [-1, 1, 1, 7]], ["tile_y", "sp", [-1, 1, 1, 1]], ["tile_x", "sp", [-1, 1, 83, 1]], ["auto_unroll_max_step", "ot", 256], ["unroll_explicit", "ot", 1]]}, "result": [[0.014554372428571428], 0, 7.1827192306518555, 1638606869.5024383], "version": 0.2, "tvm_version": "0.9.dev0"}
{"input": ["rocm -keys=rocm,gpu -max_num_threads=256 -mcpu=gfx906 -mtriple=amdgcn-amd-amdhsa-hcc -thread_warp_size=64", "depthwise_conv2d_nchw.cuda", [["TENSOR", [128, 42, 165, 165], "float32"], ["TENSOR", [42, 1, 5, 5], "float32"], 2, "SAME", 1, "float32"], {}], "config": {"index": 540, "code_hash": null, "entity": [["tile_f", "sp", [-1, 3, 1, 2]], ["tile_y", "sp", [-1, 1, 1, 1]], ["tile_x", "sp", [-1, 1, 83, 1]], ["auto_unroll_max_step", "ot", 0], ["unroll_explicit", "ot", 1]]}, "result": [[0.012757890625], 0, 6.592336416244507, 1638606875.1535826], "version": 0.2, "tvm_version": "0.9.dev0"}
{"input": ["rocm -keys=rocm,gpu -max_num_threads=256 -mcpu=gfx906 -mtriple=amdgcn-amd-amdhsa-hcc -thread_warp_size=64", "depthwise_conv2d_nchw.cuda", [["TENSOR", [128, 42, 165, 165], "float32"], ["TENSOR", [42, 1, 5, 5], "float32"], 2, "SAME", 1, "float32"], {}], "config": {"index": 2600, "code_hash": null, "entity": [["tile_f", "sp", [-1, 1, 2, 3]], ["tile_y", "sp", [-1, 1, 1, 1]], ["tile_x", "sp", [-1, 1, 83, 1]], ["auto_unroll_max_step", "ot", 1500], ["unroll_explicit", "ot", 1]]}, "result": [[0.0062861018125], 0, 6.980078220367432, 1638606881.143434], "version": 0.2, "tvm_version": "0.9.dev0"}
{"input": ["rocm -keys=rocm,gpu -max_num_threads=256 -mcpu=gfx906 -mtriple=amdgcn-amd-amdhsa-hcc -thread_warp_size=64", "depthwise_conv2d_nchw.cuda", [["TENSOR", [128, 42, 165, 165], "float32"], ["TENSOR", [42, 1, 5, 5], "float32"], 2, "SAME", 1, "float32"], {}], "config": {"index": 2608, "code_hash": null, "entity": [["tile_f", "sp", [-1, 1, 1, 7]], ["tile_y", "sp", [-1, 1, 1, 1]], ["tile_x", "sp", [-1, 1, 83, 1]], ["auto_unroll_max_step", "ot", 1500], ["unroll_explicit", "ot", 1]]}, "result": [[0.014559720714285716], 0, 7.697622299194336, 1638606887.4947877], "version": 0.2, "tvm_version": "0.9.dev0"}
{"input": ["rocm -keys=rocm,gpu -max_num_threads=256 -mcpu=gfx906 -mtriple=amdgcn-amd-amdhsa-hcc -thread_warp_size=64", "depthwise_conv2d_nchw.cuda", [["TENSOR", [128, 42, 165, 165], "float32"], ["TENSOR", [42, 1, 5, 5], "float32"], 2, "SAME", 1, "float32"], {}], "config": {"index": 528, "code_hash": null, "entity": [["tile_f", "sp", [-1, 1, 6, 1]], ["tile_y", "sp", [-1, 1, 1, 1]], ["tile_x", "sp", [-1, 1, 83, 1]], ["auto_unroll_max_step", "ot", 0], ["unroll_explicit", "ot", 1]]}, "result": [[0.003326767630434782], 0, 7.604249715805054, 1638606894.4058409], "version": 0.2, "tvm_version": "0.9.dev0"}
{"input": ["rocm -keys=rocm,gpu -max_num_threads=256 -mcpu=gfx906 -mtriple=amdgcn-amd-amdhsa-hcc -thread_warp_size=64", "depthwise_conv2d_nchw.cuda", [["TENSOR", [128, 42, 165, 165], "float32"], ["TENSOR", [42, 1, 5, 5], "float32"], 2, "SAME", 1, "float32"], {}], "config": {"index": 525, "code_hash": null, "entity": [["tile_f", "sp", [-1, 2, 3, 1]], ["tile_y", "sp", [-1, 1, 1, 1]], ["tile_x", "sp", [-1, 1, 83, 1]], ["auto_unroll_max_step", "ot", 0], ["unroll_explicit", "ot", 1]]}, "result": [[0.0049444541875], 0, 7.951344013214111, 1638606901.6622205], "version": 0.2, "tvm_version": "0.9.dev0"}
{"input": ["rocm -keys=rocm,gpu -max_num_threads=256 -mcpu=gfx906 -mtriple=amdgcn-amd-amdhsa-hcc -thread_warp_size=64", "depthwise_conv2d_nchw.cuda", [["TENSOR", [128, 42, 165, 165], "float32"], ["TENSOR", [42, 1, 5, 5], "float32"], 2, "SAME", 1, "float32"], {}], "config": {"index": 1564, "code_hash": null, "entity": [["tile_f", "sp", [-1, 3, 1, 2]], ["tile_y", "sp", [-1, 1, 1, 1]], ["tile_x", "sp", [-1, 1, 83, 1]], ["auto_unroll_max_step", "ot", 256], ["unroll_explicit", "ot", 1]]}, "result": [[0.0102346183], 0, 8.531010627746582, 1638606908.873504], "version": 0.2, "tvm_version": "0.9.dev0"}
{"input": ["rocm -keys=rocm,gpu -max_num_threads=256 -mcpu=gfx906 -mtriple=amdgcn-amd-amdhsa-hcc -thread_warp_size=64", "depthwise_conv2d_nchw.cuda", [["TENSOR", [128, 42, 165, 165], "float32"], ["TENSOR", [42, 1, 5, 5], "float32"], 2, "SAME", 1, "float32"], {}], "config": {"index": 548, "code_hash": null, "entity": [["tile_f", "sp", [-1, 1, 1, 3]], ["tile_y", "sp", [-1, 1, 1, 1]], ["tile_x", "sp", [-1, 1, 83, 1]], ["auto_unroll_max_step", "ot", 0], ["unroll_explicit", "ot", 1]]}, "result": [[0.00660855925], 0, 6.772455215454102, 1638606914.7784953], "version": 0.2, "tvm_version": "0.9.dev0"}
{"input": ["rocm -keys=rocm,gpu -max_num_threads=256 -mcpu=gfx906 -mtriple=amdgcn-amd-amdhsa-hcc -thread_warp_size=64", "depthwise_conv2d_nchw.cuda", [["TENSOR", [128, 42, 165, 165], "float32"], ["TENSOR", [42, 1, 5, 5], "float32"], 2, "SAME", 1, "float32"], {}], "config": {"index": 1552, "code_hash": null, "entity": [["tile_f", "sp", [-1, 1, 6, 1]], ["tile_y", "sp", [-1, 1, 1, 1]], ["tile_x", "sp", [-1, 1, 83, 1]], ["auto_unroll_max_step", "ot", 256], ["unroll_explicit", "ot", 1]]}, "result": [[0.0030645822000000002], 0, 5.906432390213013, 1638606919.9394999], "version": 0.2, "tvm_version": "0.9.dev0"}
{"input": ["rocm -keys=rocm,gpu -max_num_threads=256 -mcpu=gfx906 -mtriple=amdgcn-amd-amdhsa-hcc -thread_warp_size=64", "depthwise_conv2d_nchw.cuda", [["TENSOR", [128, 42, 165, 165], "float32"], ["TENSOR", [42, 1, 5, 5], "float32"], 2, "SAME", 1, "float32"], {}], "config": {"index": 521, "code_hash": null, "entity": [["tile_f", "sp", [-1, 3, 2, 1]], ["tile_y", "sp", [-1, 1, 1, 1]], ["tile_x", "sp", [-1, 1, 83, 1]], ["auto_unroll_max_step", "ot", 0], ["unroll_explicit", "ot", 1]]}, "result": [[0.006951803066666666], 0, 6.188597202301025, 1638606925.1590223], "version": 0.2, "tvm_version": "0.9.dev0"}
{"input": ["rocm -keys=rocm,gpu -max_num_threads=256 -mcpu=gfx906 -mtriple=amdgcn-amd-amdhsa-hcc -thread_warp_size=64", "depthwise_conv2d_nchw.cuda", [["TENSOR", [128, 42, 165, 165], "float32"], ["TENSOR", [42, 1, 5, 5], "float32"], 2, "SAME", 1, "float32"], {}], "config": {"index": 557, "code_hash": null, "entity": [["tile_f", "sp", [-1, 1, 1, 6]], ["tile_y", "sp", [-1, 1, 1, 1]], ["tile_x", "sp", [-1, 1, 83, 1]], ["auto_unroll_max_step", "ot", 0], ["unroll_explicit", "ot", 1]]}, "result": [[0.012699250125], 0, 5.864088296890259, 1638606930.2128572], "version": 0.2, "tvm_version": "0.9.dev0"}
{"input": ["rocm -keys=rocm,gpu -max_num_threads=256 -mcpu=gfx906 -mtriple=amdgcn-amd-amdhsa-hcc -thread_warp_size=64", "depthwise_conv2d_nchw.cuda", [["TENSOR", [128, 42, 165, 165], "float32"], ["TENSOR", [42, 1, 5, 5], "float32"], 2, "SAME", 1, "float32"], {}], "config": {"index": 1572, "code_hash": null, "entity": [["tile_f", "sp", [-1, 1, 1, 3]], ["tile_y", "sp", [-1, 1, 1, 1]], ["tile_x", "sp", [-1, 1, 83, 1]], ["auto_unroll_max_step", "ot", 256], ["unroll_explicit", "ot", 1]]}, "result": [[0.005621422611111111], 0, 6.16093111038208, 1638606935.3529937], "version": 0.2, "tvm_version": "0.9.dev0"}
{"input": ["rocm -keys=rocm,gpu -max_num_threads=256 -mcpu=gfx906 -mtriple=amdgcn-amd-amdhsa-hcc -thread_warp_size=64", "depthwise_conv2d_nchw.cuda", [["TENSOR", [128, 42, 165, 165], "float32"], ["TENSOR", [42, 1, 5, 5], "float32"], 2, "SAME", 1, "float32"], {}], "config": {"index": 2576, "code_hash": null, "entity": [["tile_f", "sp", [-1, 1, 6, 1]], ["tile_y", "sp", [-1, 1, 1, 1]], ["tile_x", "sp", [-1, 1, 83, 1]], ["auto_unroll_max_step", "ot", 1500], ["unroll_explicit", "ot", 1]]}, "result": [[0.00306387206], 0, 5.9617838859558105, 1638606940.5431268], "version": 0.2, "tvm_version": "0.9.dev0"}
{"input": ["rocm -keys=rocm,gpu -max_num_threads=256 -mcpu=gfx906 -mtriple=amdgcn-amd-amdhsa-hcc -thread_warp_size=64", "depthwise_conv2d_nchw.cuda", [["TENSOR", [128, 42, 165, 165], "float32"], ["TENSOR", [42, 1, 5, 5], "float32"], 2, "SAME", 1, "float32"], {}], "config": {"index": 2573, "code_hash": null, "entity": [["tile_f", "sp", [-1, 2, 3, 1]], ["tile_y", "sp", [-1, 1, 1, 1]], ["tile_x", "sp", [-1, 1, 83, 1]], ["auto_unroll_max_step", "ot", 1500], ["unroll_explicit", "ot", 1]]}, "result": [[0.004496168285714286], 0, 5.933848857879639, 1638606945.6671183], "version": 0.2, "tvm_version": "0.9.dev0"}
{"input": ["rocm -keys=rocm,gpu -max_num_threads=256 -mcpu=gfx906 -mtriple=amdgcn-amd-amdhsa-hcc -thread_warp_size=64", "depthwise_conv2d_nchw.cuda", [["TENSOR", [128, 42, 165, 165], "float32"], ["TENSOR", [42, 1, 5, 5], "float32"], 2, "SAME", 1, "float32"], {}], "config": {"index": 530, "code_hash": null, "entity": [["tile_f", "sp", [-1, 1, 7, 1]], ["tile_y", "sp", [-1, 1, 1, 1]], ["tile_x", "sp", [-1, 1, 83, 1]], ["auto_unroll_max_step", "ot", 0], ["unroll_explicit", "ot", 1]]}, "result": [[0.004332762837837838], 0, 5.781463861465454, 1638606950.7411795], "version": 0.2, "tvm_version": "0.9.dev0"}
{"input": ["rocm -keys=rocm,gpu -max_num_threads=256 -mcpu=gfx906 -mtriple=amdgcn-amd-amdhsa-hcc -thread_warp_size=64", "depthwise_conv2d_nchw.cuda", [["TENSOR", [128, 42, 165, 165], "float32"], ["TENSOR", [42, 1, 5, 5], "float32"], 2, "SAME", 1, "float32"], {}], "config": {"index": 514, "code_hash": null, "entity": [["tile_f", "sp", [-1, 3, 1, 1]], ["tile_y", "sp", [-1, 1, 1, 1]], ["tile_x", "sp", [-1, 1, 83, 1]], ["auto_unroll_max_step", "ot", 0], ["unroll_explicit", "ot", 1]]}, "result": [[0.006683491], 0, 6.110500812530518, 1638606956.0092697], "version": 0.2, "tvm_version": "0.9.dev0"}
{"input": ["rocm -keys=rocm,gpu -max_num_threads=256 -mcpu=gfx906 -mtriple=amdgcn-amd-amdhsa-hcc -thread_warp_size=64", "depthwise_conv2d_nchw.cuda", [["TENSOR", [128, 42, 165, 165], "float32"], ["TENSOR", [42, 1, 5, 5], "float32"], 2, "SAME", 1, "float32"], {}], "config": {"index": 2596, "code_hash": null, "entity": [["tile_f", "sp", [-1, 1, 1, 3]], ["tile_y", "sp", [-1, 1, 1, 1]], ["tile_x", "sp", [-1, 1, 83, 1]], ["auto_unroll_max_step", "ot", 1500], ["unroll_explicit", "ot", 1]]}, "result": [[0.005625270388888889], 0, 5.959951639175415, 1638606960.9780526], "version": 0.2, "tvm_version": "0.9.dev0"}
{"input": ["rocm -keys=rocm,gpu -max_num_threads=256 -mcpu=gfx906 -mtriple=amdgcn-amd-amdhsa-hcc -thread_warp_size=64", "depthwise_conv2d_nchw.cuda", [["TENSOR", [128, 42, 165, 165], "float32"], ["TENSOR", [42, 1, 5, 5], "float32"], 2, "SAME", 1, "float32"], {}], "config": {"index": 1581, "code_hash": null, "entity": [["tile_f", "sp", [-1, 1, 1, 6]], ["tile_y", "sp", [-1, 1, 1, 1]], ["tile_x", "sp", [-1, 1, 83, 1]], ["auto_unroll_max_step", "ot", 256], ["unroll_explicit", "ot", 1]]}, "result": [[0.010186811799999999], 0, 6.0904622077941895, 1638606965.8729987], "version": 0.2, "tvm_version": "0.9.dev0"}
{"input": ["rocm -keys=rocm,gpu -max_num_threads=256 -mcpu=gfx906 -mtriple=amdgcn-amd-amdhsa-hcc -thread_warp_size=64", "depthwise_conv2d_nchw.cuda", [["TENSOR", [128, 42, 165, 165], "float32"], ["TENSOR", [42, 1, 5, 5], "float32"], 2, "SAME", 1, "float32"], {}], "config": {"index": 1545, "code_hash": null, "entity": [["tile_f", "sp", [-1, 3, 2, 1]], ["tile_y", "sp", [-1, 1, 1, 1]], ["tile_x", "sp", [-1, 1, 83, 1]], ["auto_unroll_max_step", "ot", 256], ["unroll_explicit", "ot", 1]]}, "result": [[0.0063566989375], 0, 5.651036262512207, 1638606970.8888984], "version": 0.2, "tvm_version": "0.9.dev0"}
{"input": ["rocm -keys=rocm,gpu -max_num_threads=256 -mcpu=gfx906 -mtriple=amdgcn-amd-amdhsa-hcc -thread_warp_size=64", "depthwise_conv2d_nchw.cuda", [["TENSOR", [128, 42, 165, 165], "float32"], ["TENSOR", [42, 1, 5, 5], "float32"], 2, "SAME", 1, "float32"], {}], "config": {"index": 2605, "code_hash": null, "entity": [["tile_f", "sp", [-1, 1, 1, 6]], ["tile_y", "sp", [-1, 1, 1, 1]], ["tile_x", "sp", [-1, 1, 83, 1]], ["auto_unroll_max_step", "ot", 1500], ["unroll_explicit", "ot", 1]]}, "result": [[0.0101884956], 0, 5.989191770553589, 1638606975.8602455], "version": 0.2, "tvm_version": "0.9.dev0"}
{"input": ["rocm -keys=rocm,gpu -max_num_threads=256 -mcpu=gfx906 -mtriple=amdgcn-amd-amdhsa-hcc -thread_warp_size=64", "depthwise_conv2d_nchw.cuda", [["TENSOR", [128, 42, 165, 165], "float32"], ["TENSOR", [42, 1, 5, 5], "float32"], 2, "SAME", 1, "float32"], {}], "config": {"index": 516, "code_hash": null, "entity": [["tile_f", "sp", [-1, 7, 1, 1]], ["tile_y", "sp", [-1, 1, 1, 1]], ["tile_x", "sp", [-1, 1, 83, 1]], ["auto_unroll_max_step", "ot", 0], ["unroll_explicit", "ot", 1]]}, "result": [[0.018227532666666667], 0, 5.84512996673584, 1638606980.9604633], "version": 0.2, "tvm_version": "0.9.dev0"}
{"input": ["rocm -keys=rocm,gpu -max_num_threads=256 -mcpu=gfx906 -mtriple=amdgcn-amd-amdhsa-hcc -thread_warp_size=64", "depthwise_conv2d_nchw.cuda", [["TENSOR", [128, 42, 165, 165], "float32"], ["TENSOR", [42, 1, 5, 5], "float32"], 2, "SAME", 1, "float32"], {}], "config": {"index": 1554, "code_hash": null, "entity": [["tile_f", "sp", [-1, 1, 7, 1]], ["tile_y", "sp", [-1, 1, 1, 1]], ["tile_x", "sp", [-1, 1, 83, 1]], ["auto_unroll_max_step", "ot", 256], ["unroll_explicit", "ot", 1]]}, "result": [[0.0039358219], 0, 5.606383562088013, 1638606986.2071438], "version": 0.2, "tvm_version": "0.9.dev0"}
{"input": ["rocm -keys=rocm,gpu -max_num_threads=256 -mcpu=gfx906 -mtriple=amdgcn-amd-amdhsa-hcc -thread_warp_size=64", "depthwise_conv2d_nchw.cuda", [["TENSOR", [128, 42, 165, 165], "float32"], ["TENSOR", [42, 1, 5, 5], "float32"], 2, "SAME", 1, "float32"], {}], "config": {"index": 2569, "code_hash": null, "entity": [["tile_f", "sp", [-1, 3, 2, 1]], ["tile_y", "sp", [-1, 1, 1, 1]], ["tile_x", "sp", [-1, 1, 83, 1]], ["auto_unroll_max_step", "ot", 1500], ["unroll_explicit", "ot", 1]]}, "result": [[0.006360004874999999], 0, 5.942861080169678, 1638606991.3772352], "version": 0.2, "tvm_version": "0.9.dev0"}
{"input": ["rocm -keys=rocm,gpu -max_num_threads=256 -mcpu=gfx906 -mtriple=amdgcn-amd-amdhsa-hcc -thread_warp_size=64", "depthwise_conv2d_nchw.cuda", [["TENSOR", [128, 42, 165, 165], "float32"], ["TENSOR", [42, 1, 5, 5], "float32"], 2, "SAME", 1, "float32"], {}], "config": {"index": 549, "code_hash": null, "entity": [["tile_f", "sp", [-1, 2, 1, 3]], ["tile_y", "sp", [-1, 1, 1, 1]], ["tile_x", "sp", [-1, 1, 83, 1]], ["auto_unroll_max_step", "ot", 0], ["unroll_explicit", "ot", 1]]}, "result": [[0.012861594125], 0, 5.654844045639038, 1638606996.3665404], "version": 0.2, "tvm_version": "0.9.dev0"}
{"input": ["rocm -keys=rocm,gpu -max_num_threads=256 -mcpu=gfx906 -mtriple=amdgcn-amd-amdhsa-hcc -thread_warp_size=64", "depthwise_conv2d_nchw.cuda", [["TENSOR", [128, 42, 165, 165], "float32"], ["TENSOR", [42, 1, 5, 5], "float32"], 2, "SAME", 1, "float32"], {}], "config": {"index": 2578, "code_hash": null, "entity": [["tile_f", "sp", [-1, 1, 7, 1]], ["tile_y", "sp", [-1, 1, 1, 1]], ["tile_x", "sp", [-1, 1, 83, 1]], ["auto_unroll_max_step", "ot", 1500], ["unroll_explicit", "ot", 1]]}, "result": [[0.003928245150000001], 0, 6.777726888656616, 1638607002.7910342], "version": 0.2, "tvm_version": "0.9.dev0"}
{"input": ["rocm -keys=rocm,gpu -max_num_threads=256 -mcpu=gfx906 -mtriple=amdgcn-amd-amdhsa-hcc -thread_warp_size=64", "depthwise_conv2d_nchw.cuda", [["TENSOR", [128, 42, 165, 165], "float32"], ["TENSOR", [42, 1, 5, 5], "float32"], 2, "SAME", 1, "float32"], {}], "config": {"index": 159, "code_hash": null, "entity": [["tile_f", "sp", [-1, 1, 3, 2]], ["tile_y", "sp", [-1, 1, 83, 1]], ["tile_x", "sp", [-1, 1, 1, 1]], ["auto_unroll_max_step", "ot", 0], ["unroll_explicit", "ot", 1]]}, "result": [[0.006108424882352941], 0, 7.707749605178833, 1638607009.8860228], "version": 0.2, "tvm_version": "0.9.dev0"}
{"input": ["rocm -keys=rocm,gpu -max_num_threads=256 -mcpu=gfx906 -mtriple=amdgcn-amd-amdhsa-hcc -thread_warp_size=64", "depthwise_conv2d_nchw.cuda", [["TENSOR", [128, 42, 165, 165], "float32"], ["TENSOR", [42, 1, 5, 5], "float32"], 2, "SAME", 1, "float32"], {}], "config": {"index": 2562, "code_hash": null, "entity": [["tile_f", "sp", [-1, 3, 1, 1]], ["tile_y", "sp", [-1, 1, 1, 1]], ["tile_x", "sp", [-1, 1, 83, 1]], ["auto_unroll_max_step", "ot", 1500], ["unroll_explicit", "ot", 1]]}, "result": [[0.0057963511111111116], 0, 8.912270545959473, 1638607018.1645584], "version": 0.2, "tvm_version": "0.9.dev0"}
{"input": ["rocm -keys=rocm,gpu -max_num_threads=256 -mcpu=gfx906 -mtriple=amdgcn-amd-amdhsa-hcc -thread_warp_size=64", "depthwise_conv2d_nchw.cuda", [["TENSOR", [128, 42, 165, 165], "float32"], ["TENSOR", [42, 1, 5, 5], "float32"], 2, "SAME", 1, "float32"], {}], "config": {"index": 1540, "code_hash": null, "entity": [["tile_f", "sp", [-1, 7, 1, 1]], ["tile_y", "sp", [-1, 1, 1, 1]], ["tile_x", "sp", [-1, 1, 83, 1]], ["auto_unroll_max_step", "ot", 256], ["unroll_explicit", "ot", 1]]}, "result": [[0.014592034428571429], 0, 5.947777509689331, 1638607023.118105], "version": 0.2, "tvm_version": "0.9.dev0"}
{"input": ["rocm -keys=rocm,gpu -max_num_threads=256 -mcpu=gfx906 -mtriple=amdgcn-amd-amdhsa-hcc -thread_warp_size=64", "depthwise_conv2d_nchw.cuda", [["TENSOR", [128, 42, 165, 165], "float32"], ["TENSOR", [42, 1, 5, 5], "float32"], 2, "SAME", 1, "float32"], {}], "config": {"index": 515, "code_hash": null, "entity": [["tile_f", "sp", [-1, 6, 1, 1]], ["tile_y", "sp", [-1, 1, 1, 1]], ["tile_x", "sp", [-1, 1, 83, 1]], ["auto_unroll_max_step", "ot", 0], ["unroll_explicit", "ot", 1]]}, "result": [[0.013819064125], 0, 5.695713996887207, 1638607028.125525], "version": 0.2, "tvm_version": "0.9.dev0"}
{"input": ["rocm -keys=rocm,gpu -max_num_threads=256 -mcpu=gfx906 -mtriple=amdgcn-amd-amdhsa-hcc -thread_warp_size=64", "depthwise_conv2d_nchw.cuda", [["TENSOR", [128, 42, 165, 165], "float32"], ["TENSOR", [42, 1, 5, 5], "float32"], 2, "SAME", 1, "float32"], {}], "config": {"index": 1024, "code_hash": null, "entity": [["tile_f", "sp", [-1, 1, 1, 1]], ["tile_y", "sp", [-1, 1, 1, 1]], ["tile_x", "sp", [-1, 1, 1, 1]], ["auto_unroll_max_step", "ot", 256], ["unroll_explicit", "ot", 1]]}, "result": [[0.10109044625], 0, 5.580420017242432, 1638607081.6174803], "version": 0.2, "tvm_version": "0.9.dev0"}
{"input": ["rocm -keys=rocm,gpu -max_num_threads=256 -mcpu=gfx906 -mtriple=amdgcn-amd-amdhsa-hcc -thread_warp_size=64", "depthwise_conv2d_nchw.cuda", [["TENSOR", [128, 42, 165, 165], "float32"], ["TENSOR", [42, 1, 5, 5], "float32"], 2, "SAME", 1, "float32"], {}], "config": {"index": 1051, "code_hash": null, "entity": [["tile_f", "sp", [-1, 1, 1, 2]], ["tile_y", "sp", [-1, 1, 1, 1]], ["tile_x", "sp", [-1, 1, 1, 1]], ["auto_unroll_max_step", "ot", 256], ["unroll_explicit", "ot", 1]]}, "result": [[0.1004578855], 0, 5.732429027557373, 1638607086.8960948], "version": 0.2, "tvm_version": "0.9.dev0"}
{"input": ["rocm -keys=rocm,gpu -max_num_threads=256 -mcpu=gfx906 -mtriple=amdgcn-amd-amdhsa-hcc -thread_warp_size=64", "depthwise_conv2d_nchw.cuda", [["TENSOR", [128, 42, 165, 165], "float32"], ["TENSOR", [42, 1, 5, 5], "float32"], 2, "SAME", 1, "float32"], {}], "config": {"index": 2075, "code_hash": null, "entity": [["tile_f", "sp", [-1, 1, 1, 2]], ["tile_y", "sp", [-1, 1, 1, 1]], ["tile_x", "sp", [-1, 1, 1, 1]], ["auto_unroll_max_step", "ot", 1500], ["unroll_explicit", "ot", 1]]}, "result": [[0.10041355875], 0, 5.769608020782471, 1638607092.2556806], "version": 0.2, "tvm_version": "0.9.dev0"}
{"input": ["rocm -keys=rocm,gpu -max_num_threads=256 -mcpu=gfx906 -mtriple=amdgcn-amd-amdhsa-hcc -thread_warp_size=64", "depthwise_conv2d_nchw.cuda", [["TENSOR", [128, 42, 165, 165], "float32"], ["TENSOR", [42, 1, 5, 5], "float32"], 2, "SAME", 1, "float32"], {}], "config": {"index": 2048, "code_hash": null, "entity": [["tile_f", "sp", [-1, 1, 1, 1]], ["tile_y", "sp", [-1, 1, 1, 1]], ["tile_x", "sp", [-1, 1, 1, 1]], ["auto_unroll_max_step", "ot", 1500], ["unroll_explicit", "ot", 1]]}, "result": [[0.100092163], 0, 5.635054349899292, 1638607097.6219783], "version": 0.2, "tvm_version": "0.9.dev0"}
{"input": ["rocm -keys=rocm,gpu -max_num_threads=256 -mcpu=gfx906 -mtriple=amdgcn-amd-amdhsa-hcc -thread_warp_size=64", "depthwise_conv2d_nchw.cuda", [["TENSOR", [128, 42, 165, 165], "float32"], ["TENSOR", [42, 1, 5, 5], "float32"], 2, "SAME", 1, "float32"], {}], "config": {"index": 1032, "code_hash": null, "entity": [["tile_f", "sp", [-1, 1, 2, 1]], ["tile_y", "sp", [-1, 1, 1, 1]], ["tile_x", "sp", [-1, 1, 1, 1]], ["auto_unroll_max_step", "ot", 256], ["unroll_explicit", "ot", 1]]}, "result": [[0.09890509025], 0, 6.066132545471191, 1638607103.2351465], "version": 0.2, "tvm_version": "0.9.dev0"}
{"input": ["rocm -keys=rocm,gpu -max_num_threads=256 -mcpu=gfx906 -mtriple=amdgcn-amd-amdhsa-hcc -thread_warp_size=64", "depthwise_conv2d_nchw.cuda", [["TENSOR", [128, 42, 165, 165], "float32"], ["TENSOR", [42, 1, 5, 5], "float32"], 2, "SAME", 1, "float32"], {}], "config": {"index": 2056, "code_hash": null, "entity": [["tile_f", "sp", [-1, 1, 2, 1]], ["tile_y", "sp", [-1, 1, 1, 1]], ["tile_x", "sp", [-1, 1, 1, 1]], ["auto_unroll_max_step", "ot", 1500], ["unroll_explicit", "ot", 1]]}, "result": [[0.101146141], 0, 5.936740159988403, 1638607108.7789898], "version": 0.2, "tvm_version": "0.9.dev0"}
{"input": ["rocm -keys=rocm,gpu -max_num_threads=256 -mcpu=gfx906 -mtriple=amdgcn-amd-amdhsa-hcc -thread_warp_size=64", "depthwise_conv2d_nchw.cuda", [["TENSOR", [128, 42, 165, 165], "float32"], ["TENSOR", [42, 1, 5, 5], "float32"], 2, "SAME", 1, "float32"], {}], "config": {"index": 1164, "code_hash": null, "entity": [["tile_f", "sp", [-1, 1, 3, 1]], ["tile_y", "sp", [-1, 1, 83, 1]], ["tile_x", "sp", [-1, 1, 1, 1]], ["auto_unroll_max_step", "ot", 256], ["unroll_explicit", "ot", 1]]}, "result": [[0.00513428], 0, 7.549002408981323, 1638607115.9719832], "version": 0.2, "tvm_version": "0.9.dev0"}
{"input": ["rocm -keys=rocm,gpu -max_num_threads=256 -mcpu=gfx906 -mtriple=amdgcn-amd-amdhsa-hcc -thread_warp_size=64", "depthwise_conv2d_nchw.cuda", [["TENSOR", [128, 42, 165, 165], "float32"], ["TENSOR", [42, 1, 5, 5], "float32"], 2, "SAME", 1, "float32"], {}], "config": {"index": 1025, "code_hash": null, "entity": [["tile_f", "sp", [-1, 2, 1, 1]], ["tile_y", "sp", [-1, 1, 1, 1]], ["tile_x", "sp", [-1, 1, 1, 1]], ["auto_unroll_max_step", "ot", 256], ["unroll_explicit", "ot", 1]]}, "result": [[0.09804953000000001], 0, 7.5285303592681885, 1638607123.0573747], "version": 0.2, "tvm_version": "0.9.dev0"}
{"input": ["rocm -keys=rocm,gpu -max_num_threads=256 -mcpu=gfx906 -mtriple=amdgcn-amd-amdhsa-hcc -thread_warp_size=64", "depthwise_conv2d_nchw.cuda", [["TENSOR", [128, 42, 165, 165], "float32"], ["TENSOR", [42, 1, 5, 5], "float32"], 2, "SAME", 1, "float32"], {}], "config": {"index": 2188, "code_hash": null, "entity": [["tile_f", "sp", [-1, 1, 3, 1]], ["tile_y", "sp", [-1, 1, 83, 1]], ["tile_x", "sp", [-1, 1, 1, 1]], ["auto_unroll_max_step", "ot", 1500], ["unroll_explicit", "ot", 1]]}, "result": [[0.0051423595], 0, 7.098142862319946, 1638607129.846019], "version": 0.2, "tvm_version": "0.9.dev0"}
{"input": ["rocm -keys=rocm,gpu -max_num_threads=256 -mcpu=gfx906 -mtriple=amdgcn-amd-amdhsa-hcc -thread_warp_size=64", "depthwise_conv2d_nchw.cuda", [["TENSOR", [128, 42, 165, 165], "float32"], ["TENSOR", [42, 1, 5, 5], "float32"], 2, "SAME", 1, "float32"], {}], "config": {"index": 1160, "code_hash": null, "entity": [["tile_f", "sp", [-1, 1, 2, 1]], ["tile_y", "sp", [-1, 1, 83, 1]], ["tile_x", "sp", [-1, 1, 1, 1]], ["auto_unroll_max_step", "ot", 256], ["unroll_explicit", "ot", 1]]}, "result": [[0.005459136433333333], 0, 5.700497627258301, 1638607135.2320168], "version": 0.2, "tvm_version": "0.9.dev0"}
{"input": ["rocm -keys=rocm,gpu -max_num_threads=256 -mcpu=gfx906 -mtriple=amdgcn-amd-amdhsa-hcc -thread_warp_size=64", "depthwise_conv2d_nchw.cuda", [["TENSOR", [128, 42, 165, 165], "float32"], ["TENSOR", [42, 1, 5, 5], "float32"], 2, "SAME", 1, "float32"], {}], "config": {"index": 2049, "code_hash": null, "entity": [["tile_f", "sp", [-1, 2, 1, 1]], ["tile_y", "sp", [-1, 1, 1, 1]], ["tile_x", "sp", [-1, 1, 1, 1]], ["auto_unroll_max_step", "ot", 1500], ["unroll_explicit", "ot", 1]]}, "result": [[0.10044208525000001], 0, 5.819519519805908, 1638607140.5676951], "version": 0.2, "tvm_version": "0.9.dev0"}
{"input": ["rocm -keys=rocm,gpu -max_num_threads=256 -mcpu=gfx906 -mtriple=amdgcn-amd-amdhsa-hcc -thread_warp_size=64", "depthwise_conv2d_nchw.cuda", [["TENSOR", [128, 42, 165, 165], "float32"], ["TENSOR", [42, 1, 5, 5], "float32"], 2, "SAME", 1, "float32"], {}], "config": {"index": 140, "code_hash": null, "entity": [["tile_f", "sp", [-1, 1, 3, 1]], ["tile_y", "sp", [-1, 1, 83, 1]], ["tile_x", "sp", [-1, 1, 1, 1]], ["auto_unroll_max_step", "ot", 0], ["unroll_explicit", "ot", 1]]}, "result": [[0.0051967987000000005], 0, 5.401196002960205, 1638607145.648847], "version": 0.2, "tvm_version": "0.9.dev0"}
{"input": ["rocm -keys=rocm,gpu -max_num_threads=256 -mcpu=gfx906 -mtriple=amdgcn-amd-amdhsa-hcc -thread_warp_size=64", "depthwise_conv2d_nchw.cuda", [["TENSOR", [128, 42, 165, 165], "float32"], ["TENSOR", [42, 1, 5, 5], "float32"], 2, "SAME", 1, "float32"], {}], "config": {"index": 0, "code_hash": null, "entity": [["tile_f", "sp", [-1, 1, 1, 1]], ["tile_y", "sp", [-1, 1, 1, 1]], ["tile_x", "sp", [-1, 1, 1, 1]], ["auto_unroll_max_step", "ot", 0], ["unroll_explicit", "ot", 1]]}, "result": [[0.09853324875], 0, 5.712697744369507, 1638607151.053261], "version": 0.2, "tvm_version": "0.9.dev0"}
{"input": ["rocm -keys=rocm,gpu -max_num_threads=256 -mcpu=gfx906 -mtriple=amdgcn-amd-amdhsa-hcc -thread_warp_size=64", "depthwise_conv2d_nchw.cuda", [["TENSOR", [128, 42, 165, 165], "float32"], ["TENSOR", [42, 1, 5, 5], "float32"], 2, "SAME", 1, "float32"], {}], "config": {"index": 2184, "code_hash": null, "entity": [["tile_f", "sp", [-1, 1, 2, 1]], ["tile_y", "sp", [-1, 1, 83, 1]], ["tile_x", "sp", [-1, 1, 1, 1]], ["auto_unroll_max_step", "ot", 1500], ["unroll_explicit", "ot", 1]]}, "result": [[0.0051630085999999995], 0, 5.4711997509002686, 1638607156.154926], "version": 0.2, "tvm_version": "0.9.dev0"}
{"input": ["rocm -keys=rocm,gpu -max_num_threads=256 -mcpu=gfx906 -mtriple=amdgcn-amd-amdhsa-hcc -thread_warp_size=64", "depthwise_conv2d_nchw.cuda", [["TENSOR", [128, 42, 165, 165], "float32"], ["TENSOR", [42, 1, 5, 5], "float32"], 2, "SAME", 1, "float32"], {}], "config": {"index": 1168, "code_hash": null, "entity": [["tile_f", "sp", [-1, 1, 6, 1]], ["tile_y", "sp", [-1, 1, 83, 1]], ["tile_x", "sp", [-1, 1, 1, 1]], ["auto_unroll_max_step", "ot", 256], ["unroll_explicit", "ot", 1]]}, "result": [[0.005444260133333333], 0, 5.8168604373931885, 1638607161.5781646], "version": 0.2, "tvm_version": "0.9.dev0"}
{"input": ["rocm -keys=rocm,gpu -max_num_threads=256 -mcpu=gfx906 -mtriple=amdgcn-amd-amdhsa-hcc -thread_warp_size=64", "depthwise_conv2d_nchw.cuda", [["TENSOR", [128, 42, 165, 165], "float32"], ["TENSOR", [42, 1, 5, 5], "float32"], 2, "SAME", 1, "float32"], {}], "config": {"index": 2192, "code_hash": null, "entity": [["tile_f", "sp", [-1, 1, 6, 1]], ["tile_y", "sp", [-1, 1, 83, 1]], ["tile_x", "sp", [-1, 1, 1, 1]], ["auto_unroll_max_step", "ot", 1500], ["unroll_explicit", "ot", 1]]}, "result": [[0.0051357986], 0, 5.539938449859619, 1638607166.7482064], "version": 0.2, "tvm_version": "0.9.dev0"}
{"input": ["rocm -keys=rocm,gpu -max_num_threads=256 -mcpu=gfx906 -mtriple=amdgcn-amd-amdhsa-hcc -thread_warp_size=64", "depthwise_conv2d_nchw.cuda", [["TENSOR", [128, 42, 165, 165], "float32"], ["TENSOR", [42, 1, 5, 5], "float32"], 2, "SAME", 1, "float32"], {}], "config": {"index": 1819, "code_hash": null, "entity": [["tile_f", "sp", [-1, 1, 1, 2]], ["tile_y", "sp", [-1, 1, 1, 1]], ["tile_x", "sp", [-1, 1, 1, 83]], ["auto_unroll_max_step", "ot", 256], ["unroll_explicit", "ot", 1]]}, "result": [[0.4043854675], 0, 7.888720512390137, 1638607173.585797], "version": 0.2, "tvm_version": "0.9.dev0"}
{"input": ["rocm -keys=rocm,gpu -max_num_threads=256 -mcpu=gfx906 -mtriple=amdgcn-amd-amdhsa-hcc -thread_warp_size=64", "depthwise_conv2d_nchw.cuda", [["TENSOR", [128, 42, 165, 165], "float32"], ["TENSOR", [42, 1, 5, 5], "float32"], 2, "SAME", 1, "float32"], {}], "config": {"index": 27, "code_hash": null, "entity": [["tile_f", "sp", [-1, 1, 1, 2]], ["tile_y", "sp", [-1, 1, 1, 1]], ["tile_x", "sp", [-1, 1, 1, 1]], ["auto_unroll_max_step", "ot", 0], ["unroll_explicit", "ot", 1]]}, "result": [[0.353738098], 0, 7.045043230056763, 1638607180.2578747], "version": 0.2, "tvm_version": "0.9.dev0"}
{"input": ["rocm -keys=rocm,gpu -max_num_threads=256 -mcpu=gfx906 -mtriple=amdgcn-amd-amdhsa-hcc -thread_warp_size=64", "depthwise_conv2d_nchw.cuda", [["TENSOR", [128, 42, 165, 165], "float32"], ["TENSOR", [42, 1, 5, 5], "float32"], 2, "SAME", 1, "float32"], {}], "config": {"index": 2084, "code_hash": null, "entity": [["tile_f", "sp", [-1, 1, 1, 3]], ["tile_y", "sp", [-1, 1, 1, 1]], ["tile_x", "sp", [-1, 1, 1, 1]], ["auto_unroll_max_step", "ot", 1500], ["unroll_explicit", "ot", 1]]}, "result": [[0.10036644724999999], 0, 6.103713035583496, 1638607185.7632132], "version": 0.2, "tvm_version": "0.9.dev0"}
{"input": ["rocm -keys=rocm,gpu -max_num_threads=256 -mcpu=gfx906 -mtriple=amdgcn-amd-amdhsa-hcc -thread_warp_size=64", "depthwise_conv2d_nchw.cuda", [["TENSOR", [128, 42, 165, 165], "float32"], ["TENSOR", [42, 1, 5, 5], "float32"], 2, "SAME", 1, "float32"], {}], "config": {"index": 144, "code_hash": null, "entity": [["tile_f", "sp", [-1, 1, 6, 1]], ["tile_y", "sp", [-1, 1, 83, 1]], ["tile_x", "sp", [-1, 1, 1, 1]], ["auto_unroll_max_step", "ot", 0], ["unroll_explicit", "ot", 1]]}, "result": [[0.0051818934], 0, 5.482067346572876, 1638607190.9317276], "version": 0.2, "tvm_version": "0.9.dev0"}
{"input": ["rocm -keys=rocm,gpu -max_num_threads=256 -mcpu=gfx906 -mtriple=amdgcn-amd-amdhsa-hcc -thread_warp_size=64", "depthwise_conv2d_nchw.cuda", [["TENSOR", [128, 42, 165, 165], "float32"], ["TENSOR", [42, 1, 5, 5], "float32"], 2, "SAME", 1, "float32"], {}], "config": {"index": 1288, "code_hash": null, "entity": [["tile_f", "sp", [-1, 1, 2, 1]], ["tile_y", "sp", [-1, 1, 1, 1]], ["tile_x", "sp", [-1, 83, 1, 1]], ["auto_unroll_max_step", "ot", 256], ["unroll_explicit", "ot", 1]]}, "result": [[1.17082861325], 0, 14.05630087852478, 1638607201.949916], "version": 0.2, "tvm_version": "0.9.dev0"}
{"input": ["rocm -keys=rocm,gpu -max_num_threads=256 -mcpu=gfx906 -mtriple=amdgcn-amd-amdhsa-hcc -thread_warp_size=64", "depthwise_conv2d_nchw.cuda", [["TENSOR", [128, 42, 165, 165], "float32"], ["TENSOR", [42, 1, 5, 5], "float32"], 2, "SAME", 1, "float32"], {}], "config": {"index": 1800, "code_hash": null, "entity": [["tile_f", "sp", [-1, 1, 2, 1]], ["tile_y", "sp", [-1, 1, 1, 1]], ["tile_x", "sp", [-1, 1, 1, 83]], ["auto_unroll_max_step", "ot", 256], ["unroll_explicit", "ot", 1]]}, "result": [[0.3665114135], 0, 7.45282506942749, 1638607208.5897226], "version": 0.2, "tvm_version": "0.9.dev0"}
{"input": ["rocm -keys=rocm,gpu -max_num_threads=256 -mcpu=gfx906 -mtriple=amdgcn-amd-amdhsa-hcc -thread_warp_size=64", "depthwise_conv2d_nchw.cuda", [["TENSOR", [128, 42, 165, 165], "float32"], ["TENSOR", [42, 1, 5, 5], "float32"], 2, "SAME", 1, "float32"], {}], "config": {"index": 8, "code_hash": null, "entity": [["tile_f", "sp", [-1, 1, 2, 1]], ["tile_y", "sp", [-1, 1, 1, 1]], ["tile_x", "sp", [-1, 1, 1, 1]], ["auto_unroll_max_step", "ot", 0], ["unroll_explicit", "ot", 1]]}, "result": [[0.2009248045], 0, 7.245113849639893, 1638607215.3692446], "version": 0.2, "tvm_version": "0.9.dev0"}
{"input": ["rocm -keys=rocm,gpu -max_num_threads=256 -mcpu=gfx906 -mtriple=amdgcn-amd-amdhsa-hcc -thread_warp_size=64", "depthwise_conv2d_nchw.cuda", [["TENSOR", [128, 42, 165, 165], "float32"], ["TENSOR", [42, 1, 5, 5], "float32"], 2, "SAME", 1, "float32"], {}], "config": {"index": 1307, "code_hash": null, "entity": [["tile_f", "sp", [-1, 1, 1, 2]], ["tile_y", "sp", [-1, 1, 1, 1]], ["tile_x", "sp", [-1, 83, 1, 1]], ["auto_unroll_max_step", "ot", 256], ["unroll_explicit", "ot", 1]]}, "result": [[0.8961557615000001], 0, 12.618988513946533, 1638607226.2025187], "version": 0.2, "tvm_version": "0.9.dev0"}
{"input": ["rocm -keys=rocm,gpu -max_num_threads=256 -mcpu=gfx906 -mtriple=amdgcn-amd-amdhsa-hcc -thread_warp_size=64", "depthwise_conv2d_nchw.cuda", [["TENSOR", [128, 42, 165, 165], "float32"], ["TENSOR", [42, 1, 5, 5], "float32"], 2, "SAME", 1, "float32"], {}], "config": {"index": 2050, "code_hash": null, "entity": [["tile_f", "sp", [-1, 3, 1, 1]], ["tile_y", "sp", [-1, 1, 1, 1]], ["tile_x", "sp", [-1, 1, 1, 1]], ["auto_unroll_max_step", "ot", 1500], ["unroll_explicit", "ot", 1]]}, "result": [[0.09802044675], 0, 8.13099479675293, 1638607233.6863732], "version": 0.2, "tvm_version": "0.9.dev0"}
{"input": ["rocm -keys=rocm,gpu -max_num_threads=256 -mcpu=gfx906 -mtriple=amdgcn-amd-amdhsa-hcc -thread_warp_size=64", "depthwise_conv2d_nchw.cuda", [["TENSOR", [128, 42, 165, 165], "float32"], ["TENSOR", [42, 1, 5, 5], "float32"], 2, "SAME", 1, "float32"], {}], "config": {"index": 136, "code_hash": null, "entity": [["tile_f", "sp", [-1, 1, 2, 1]], ["tile_y", "sp", [-1, 1, 83, 1]], ["tile_x", "sp", [-1, 1, 1, 1]], ["auto_unroll_max_step", "ot", 0], ["unroll_explicit", "ot", 1]]}, "result": [[0.005225482666666666], 0, 7.502880573272705, 1638607240.8584092], "version": 0.2, "tvm_version": "0.9.dev0"}
{"input": ["rocm -keys=rocm,gpu -max_num_threads=256 -mcpu=gfx906 -mtriple=amdgcn-amd-amdhsa-hcc -thread_warp_size=64", "depthwise_conv2d_nchw.cuda", [["TENSOR", [128, 42, 165, 165], "float32"], ["TENSOR", [42, 1, 5, 5], "float32"], 2, "SAME", 1, "float32"], {}], "config": {"index": 2060, "code_hash": null, "entity": [["tile_f", "sp", [-1, 1, 3, 1]], ["tile_y", "sp", [-1, 1, 1, 1]], ["tile_x", "sp", [-1, 1, 1, 1]], ["auto_unroll_max_step", "ot", 1500], ["unroll_explicit", "ot", 1]]}, "result": [[0.070863182], 0, 7.76477313041687, 1638607248.2013488], "version": 0.2, "tvm_version": "0.9.dev0"}
{"input": ["rocm -keys=rocm,gpu -max_num_threads=256 -mcpu=gfx906 -mtriple=amdgcn-amd-amdhsa-hcc -thread_warp_size=64", "depthwise_conv2d_nchw.cuda", [["TENSOR", [128, 42, 165, 165], "float32"], ["TENSOR", [42, 1, 5, 5], "float32"], 2, "SAME", 1, "float32"], {}], "config": {"index": 1183, "code_hash": null, "entity": [["tile_f", "sp", [-1, 1, 3, 2]], ["tile_y", "sp", [-1, 1, 83, 1]], ["tile_x", "sp", [-1, 1, 1, 1]], ["auto_unroll_max_step", "ot", 256], ["unroll_explicit", "ot", 1]]}, "result": [[0.005629189333333333], 0, 7.398835897445679, 1638607255.117238], "version": 0.2, "tvm_version": "0.9.dev0"}
{"input": ["rocm -keys=rocm,gpu -max_num_threads=256 -mcpu=gfx906 -mtriple=amdgcn-amd-amdhsa-hcc -thread_warp_size=64", "depthwise_conv2d_nchw.cuda", [["TENSOR", [128, 42, 165, 165], "float32"], ["TENSOR", [42, 1, 5, 5], "float32"], 2, "SAME", 1, "float32"], {}], "config": {"index": 1792, "code_hash": null, "entity": [["tile_f", "sp", [-1, 1, 1, 1]], ["tile_y", "sp", [-1, 1, 1, 1]], ["tile_x", "sp", [-1, 1, 1, 83]], ["auto_unroll_max_step", "ot", 256], ["unroll_explicit", "ot", 1]]}, "result": [[0.34638345325000003], 0, 7.932286262512207, 1638607262.3322027], "version": 0.2, "tvm_version": "0.9.dev0"}
{"input": ["rocm -keys=rocm,gpu -max_num_threads=256 -mcpu=gfx906 -mtriple=amdgcn-amd-amdhsa-hcc -thread_warp_size=64", "depthwise_conv2d_nchw.cuda", [["TENSOR", [128, 42, 165, 165], "float32"], ["TENSOR", [42, 1, 5, 5], "float32"], 2, "SAME", 1, "float32"], {}], "config": {"index": 1280, "code_hash": null, "entity": [["tile_f", "sp", [-1, 1, 1, 1]], ["tile_y", "sp", [-1, 1, 1, 1]], ["tile_x", "sp", [-1, 83, 1, 1]], ["auto_unroll_max_step", "ot", 256], ["unroll_explicit", "ot", 1]]}, "result": [[1.569182495], 0, 16.807923793792725, 1638607276.195268], "version": 0.2, "tvm_version": "0.9.dev0"}
{"input": ["rocm -keys=rocm,gpu -max_num_threads=256 -mcpu=gfx906 -mtriple=amdgcn-amd-amdhsa-hcc -thread_warp_size=64", "depthwise_conv2d_nchw.cuda", [["TENSOR", [128, 42, 165, 165], "float32"], ["TENSOR", [42, 1, 5, 5], "float32"], 2, "SAME", 1, "float32"], {}], "config": {"index": 1060, "code_hash": null, "entity": [["tile_f", "sp", [-1, 1, 1, 3]], ["tile_y", "sp", [-1, 1, 1, 1]], ["tile_x", "sp", [-1, 1, 1, 1]], ["auto_unroll_max_step", "ot", 256], ["unroll_explicit", "ot", 1]]}, "result": [[0.09800246425], 0, 6.512740612030029, 1638607282.1064217], "version": 0.2, "tvm_version": "0.9.dev0"}
{"input": ["rocm -keys=rocm,gpu -max_num_threads=256 -mcpu=gfx906 -mtriple=amdgcn-amd-amdhsa-hcc -thread_warp_size=64", "depthwise_conv2d_nchw.cuda", [["TENSOR", [128, 42, 165, 165], "float32"], ["TENSOR", [42, 1, 5, 5], "float32"], 2, "SAME", 1, "float32"], {}], "config": {"index": 1152, "code_hash": null, "entity": [["tile_f", "sp", [-1, 1, 1, 1]], ["tile_y", "sp", [-1, 1, 83, 1]], ["tile_x", "sp", [-1, 1, 1, 1]], ["auto_unroll_max_step", "ot", 256], ["unroll_explicit", "ot", 1]]}, "result": [[0.005329703052631579], 0, 5.755586385726929, 1638607287.5633633], "version": 0.2, "tvm_version": "0.9.dev0"}
{"input": ["rocm -keys=rocm,gpu -max_num_threads=256 -mcpu=gfx906 -mtriple=amdgcn-amd-amdhsa-hcc -thread_warp_size=64", "depthwise_conv2d_nchw.cuda", [["TENSOR", [128, 42, 165, 165], "float32"], ["TENSOR", [42, 1, 5, 5], "float32"], 2, "SAME", 1, "float32"], {}], "config": {"index": 2824, "code_hash": null, "entity": [["tile_f", "sp", [-1, 1, 2, 1]], ["tile_y", "sp", [-1, 1, 1, 1]], ["tile_x", "sp", [-1, 1, 1, 83]], ["auto_unroll_max_step", "ot", 1500], ["unroll_explicit", "ot", 1]]}, "result": [[0.1899334715], 0, 13.102617025375366, 1638607294.4003828], "version": 0.2, "tvm_version": "0.9.dev0"}
{"input": ["rocm -keys=rocm,gpu -max_num_threads=256 -mcpu=gfx906 -mtriple=amdgcn-amd-amdhsa-hcc -thread_warp_size=64", "depthwise_conv2d_nchw.cuda", [["TENSOR", [128, 42, 165, 165], "float32"], ["TENSOR", [42, 1, 5, 5], "float32"], 2, "SAME", 1, "float32"], {}], "config": {"index": 1036, "code_hash": null, "entity": [["tile_f", "sp", [-1, 1, 3, 1]], ["tile_y", "sp", [-1, 1, 1, 1]], ["tile_x", "sp", [-1, 1, 1, 1]], ["auto_unroll_max_step", "ot", 256], ["unroll_explicit", "ot", 1]]}, "result": [[0.07092583449999999], 0, 7.218266725540161, 1638607301.2182517], "version": 0.2, "tvm_version": "0.9.dev0"}
{"input": ["rocm -keys=rocm,gpu -max_num_threads=256 -mcpu=gfx906 -mtriple=amdgcn-amd-amdhsa-hcc -thread_warp_size=64", "depthwise_conv2d_nchw.cuda", [["TENSOR", [128, 42, 165, 165], "float32"], ["TENSOR", [42, 1, 5, 5], "float32"], 2, "SAME", 1, "float32"], {}], "config": {"index": 2843, "code_hash": null, "entity": [["tile_f", "sp", [-1, 1, 1, 2]], ["tile_y", "sp", [-1, 1, 1, 1]], ["tile_x", "sp", [-1, 1, 1, 83]], ["auto_unroll_max_step", "ot", 1500], ["unroll_explicit", "ot", 1]]}, "result": [[0.40430023175], 0, 11.020571231842041, 1638607308.047602], "version": 0.2, "tvm_version": "0.9.dev0"}
{"input": ["rocm -keys=rocm,gpu -max_num_threads=256 -mcpu=gfx906 -mtriple=amdgcn-amd-amdhsa-hcc -thread_warp_size=64", "depthwise_conv2d_nchw.cuda", [["TENSOR", [128, 42, 165, 165], "float32"], ["TENSOR", [42, 1, 5, 5], "float32"], 2, "SAME", 1, "float32"], {}], "config": {"index": 2207, "code_hash": null, "entity": [["tile_f", "sp", [-1, 1, 3, 2]], ["tile_y", "sp", [-1, 1, 83, 1]], ["tile_x", "sp", [-1, 1, 1, 1]], ["auto_unroll_max_step", "ot", 1500], ["unroll_explicit", "ot", 1]]}, "result": [[0.005648164944444444], 0, 5.4599127769470215, 1638607313.0184352], "version": 0.2, "tvm_version": "0.9.dev0"}
{"input": ["rocm -keys=rocm,gpu -max_num_threads=256 -mcpu=gfx906 -mtriple=amdgcn-amd-amdhsa-hcc -thread_warp_size=64", "depthwise_conv2d_nchw.cuda", [["TENSOR", [128, 42, 165, 165], "float32"], ["TENSOR", [42, 1, 5, 5], "float32"], 2, "SAME", 1, "float32"], {}], "config": {"index": 2331, "code_hash": null, "entity": [["tile_f", "sp", [-1, 1, 1, 2]], ["tile_y", "sp", [-1, 1, 1, 1]], ["tile_x", "sp", [-1, 83, 1, 1]], ["auto_unroll_max_step", "ot", 1500], ["unroll_explicit", "ot", 1]]}, "result": [[1.10475341775], 0, 14.3307204246521, 1638607323.7668135], "version": 0.2, "tvm_version": "0.9.dev0"}
{"input": ["rocm -keys=rocm,gpu -max_num_threads=256 -mcpu=gfx906 -mtriple=amdgcn-amd-amdhsa-hcc -thread_warp_size=64", "depthwise_conv2d_nchw.cuda", [["TENSOR", [128, 42, 165, 165], "float32"], ["TENSOR", [42, 1, 5, 5], "float32"], 2, "SAME", 1, "float32"], {}], "config": {"index": 2312, "code_hash": null, "entity": [["tile_f", "sp", [-1, 1, 2, 1]], ["tile_y", "sp", [-1, 1, 1, 1]], ["tile_x", "sp", [-1, 83, 1, 1]], ["auto_unroll_max_step", "ot", 1500], ["unroll_explicit", "ot", 1]]}, "result": [[1.3438725585], 0, 19.82249641418457, 1638607335.6883545], "version": 0.2, "tvm_version": "0.9.dev0"}
{"input": ["rocm -keys=rocm,gpu -max_num_threads=256 -mcpu=gfx906 -mtriple=amdgcn-amd-amdhsa-hcc -thread_warp_size=64", "depthwise_conv2d_nchw.cuda", [["TENSOR", [128, 42, 165, 165], "float32"], ["TENSOR", [42, 1, 5, 5], "float32"], 2, "SAME", 1, "float32"], {}], "config": {"index": 2816, "code_hash": null, "entity": [["tile_f", "sp", [-1, 1, 1, 1]], ["tile_y", "sp", [-1, 1, 1, 1]], ["tile_x", "sp", [-1, 1, 1, 83]], ["auto_unroll_max_step", "ot", 1500], ["unroll_explicit", "ot", 1]]}, "result": [[0.31762463375], 0, 9.38924527168274, 1638607342.3433359], "version": 0.2, "tvm_version": "0.9.dev0"}
{"input": ["rocm -keys=rocm,gpu -max_num_threads=256 -mcpu=gfx906 -mtriple=amdgcn-amd-amdhsa-hcc -thread_warp_size=64", "depthwise_conv2d_nchw.cuda", [["TENSOR", [128, 42, 165, 165], "float32"], ["TENSOR", [42, 1, 5, 5], "float32"], 2, "SAME", 1, "float32"], {}], "config": {"index": 2176, "code_hash": null, "entity": [["tile_f", "sp", [-1, 1, 1, 1]], ["tile_y", "sp", [-1, 1, 83, 1]], ["tile_x", "sp", [-1, 1, 1, 1]], ["auto_unroll_max_step", "ot", 1500], ["unroll_explicit", "ot", 1]]}, "result": [[0.0053084668421052635], 0, 6.744808912277222, 1638607348.7834432], "version": 0.2, "tvm_version": "0.9.dev0"}
