artifacts/Table4/tvm/autotvm/depthwise/depthwise_128_336_42_42_5_5_2_SAME.log
{"input": ["rocm -keys=rocm,gpu -max_num_threads=256 -mcpu=gfx906 -mtriple=amdgcn-amd-amdhsa-hcc -thread_warp_size=64", "depthwise_conv2d_nchw.cuda", [["TENSOR", [128, 336, 42, 42], "float32"], ["TENSOR", [336, 1, 5, 5], "float32"], 2, "SAME", 1, "float32"], {}], "config": {"index": 396055, "code_hash": null, "entity": [["tile_f", "sp", [-1, 1, 1, 2]], ["tile_y", "sp", [-1, 21, 1, 1]], ["tile_x", "sp", [-1, 1, 1, 7]], ["auto_unroll_max_step", "ot", 1500], ["unroll_explicit", "ot", 1]]}, "result": [[0.33041143775], 0, 11.263314247131348, 1638645465.493294], "version": 0.2, "tvm_version": "0.9.dev0"}
{"input": ["rocm -keys=rocm,gpu -max_num_threads=256 -mcpu=gfx906 -mtriple=amdgcn-amd-amdhsa-hcc -thread_warp_size=64", "depthwise_conv2d_nchw.cuda", [["TENSOR", [128, 336, 42, 42], "float32"], ["TENSOR", [336, 1, 5, 5], "float32"], 2, "SAME", 1, "float32"], {}], "config": {"index": 429874, "code_hash": null, "entity": [["tile_f", "sp", [-1, 1, 1, 7]], ["tile_y", "sp", [-1, 1, 1, 21]], ["tile_x", "sp", [-1, 1, 1, 21]], ["auto_unroll_max_step", "ot", 1500], ["unroll_explicit", "ot", 1]]}, "result": [[0.27614746075], 0, 6.99332857131958, 1638645469.6695], "version": 0.2, "tvm_version": "0.9.dev0"}
{"input": ["rocm -keys=rocm,gpu -max_num_threads=256 -mcpu=gfx906 -mtriple=amdgcn-amd-amdhsa-hcc -thread_warp_size=64", "depthwise_conv2d_nchw.cuda", [["TENSOR", [128, 336, 42, 42], "float32"], ["TENSOR", [336, 1, 5, 5], "float32"], 2, "SAME", 1, "float32"], {}], "config": {"index": 61609, "code_hash": null, "entity": [["tile_f", "sp", [-1, 16, 1, 1]], ["tile_y", "sp", [-1, 1, 3, 7]], ["tile_x", "sp", [-1, 1, 7, 1]], ["auto_unroll_max_step", "ot", 0], ["unroll_explicit", "ot", 1]]}, "result": [[0.09129200725], 0, 5.281008958816528, 1638645473.147139], "version": 0.2, "tvm_version": "0.9.dev0"}
{"input": ["rocm -keys=rocm,gpu -max_num_threads=256 -mcpu=gfx906 -mtriple=amdgcn-amd-amdhsa-hcc -thread_warp_size=64", "depthwise_conv2d_nchw.cuda", [["TENSOR", [128, 336, 42, 42], "float32"], ["TENSOR", [336, 1, 5, 5], "float32"], 2, "SAME", 1, "float32"], {}], "config": {"index": 78402, "code_hash": null, "entity": [["tile_f", "sp", [-1, 3, 1, 1]], ["tile_y", "sp", [-1, 1, 1, 7]], ["tile_x", "sp", [-1, 1, 21, 1]], ["auto_unroll_max_step", "ot", 0], ["unroll_explicit", "ot", 1]]}, "result": [[0.02358188883333333], 0, 4.312716245651245, 1638645476.2940886], "version": 0.2, "tvm_version": "0.9.dev0"}
{"input": ["rocm -keys=rocm,gpu -max_num_threads=256 -mcpu=gfx906 -mtriple=amdgcn-amd-amdhsa-hcc -thread_warp_size=64", "depthwise_conv2d_nchw.cuda", [["TENSOR", [128, 336, 42, 42], "float32"], ["TENSOR", [336, 1, 5, 5], "float32"], 2, "SAME", 1, "float32"], {}], "config": {"index": 4668, "code_hash": null, "entity": [["tile_f", "sp", [-1, 4, 7, 2]], ["tile_y", "sp", [-1, 1, 21, 1]], ["tile_x", "sp", [-1, 1, 1, 1]], ["auto_unroll_max_step", "ot", 0], ["unroll_explicit", "ot", 1]]}, "result": [[0.0137213105], 0, 3.8482611179351807, 1638645479.3610048], "version": 0.2, "tvm_version": "0.9.dev0"}
{"input": ["rocm -keys=rocm,gpu -max_num_threads=256 -mcpu=gfx906 -mtriple=amdgcn-amd-amdhsa-hcc -thread_warp_size=64", "depthwise_conv2d_nchw.cuda", [["TENSOR", [128, 336, 42, 42], "float32"], ["TENSOR", [336, 1, 5, 5], "float32"], 2, "SAME", 1, "float32"], {}], "config": {"index": 147639, "code_hash": null, "entity": [["tile_f", "sp", [-1, 8, 1, 7]], ["tile_y", "sp", [-1, 3, 7, 1]], ["tile_x", "sp", [-1, 1, 1, 1]], ["auto_unroll_max_step", "ot", 256], ["unroll_explicit", "ot", 1]]}, "result": [[0.37164404274999996], 0, 7.84899115562439, 1638645484.1170766], "version": 0.2, "tvm_version": "0.9.dev0"}
{"input": ["rocm -keys=rocm,gpu -max_num_threads=256 -mcpu=gfx906 -mtriple=amdgcn-amd-amdhsa-hcc -thread_warp_size=64", "depthwise_conv2d_nchw.cuda", [["TENSOR", [128, 336, 42, 42], "float32"], ["TENSOR", [336, 1, 5, 5], "float32"], 2, "SAME", 1, "float32"], {}], "config": {"index": 359298, "code_hash": null, "entity": [["tile_f", "sp", [-1, 1, 4, 6]], ["tile_y", "sp", [-1, 3, 1, 1]], ["tile_x", "sp", [-1, 1, 21, 1]], ["auto_unroll_max_step", "ot", 1500], ["unroll_explicit", "ot", 1]]}, "result": [[0.0106467788], 0, 5.01348876953125, 1638645487.2515872], "version": 0.2, "tvm_version": "0.9.dev0"}
{"input": ["rocm -keys=rocm,gpu -max_num_threads=256 -mcpu=gfx906 -mtriple=amdgcn-amd-amdhsa-hcc -thread_warp_size=64", "depthwise_conv2d_nchw.cuda", [["TENSOR", [128, 336, 42, 42], "float32"], ["TENSOR", [336, 1, 5, 5], "float32"], 2, "SAME", 1, "float32"], {}], "config": {"index": 108646, "code_hash": null, "entity": [["tile_f", "sp", [-1, 8, 1, 1]], ["tile_y", "sp", [-1, 7, 1, 1]], ["tile_x", "sp", [-1, 1, 1, 7]], ["auto_unroll_max_step", "ot", 0], ["unroll_explicit", "ot", 1]]}, "result": [[0.50874884025], 0, 7.6207499504089355, 1638645492.717388], "version": 0.2, "tvm_version": "0.9.dev0"}
{"input": ["rocm -keys=rocm,gpu -max_num_threads=256 -mcpu=gfx906 -mtriple=amdgcn-amd-amdhsa-hcc -thread_warp_size=64", "depthwise_conv2d_nchw.cuda", [["TENSOR", [128, 336, 42, 42], "float32"], ["TENSOR", [336, 1, 5, 5], "float32"], 2, "SAME", 1, "float32"], {}], "config": {"index": 84402, "code_hash": null, "entity": [["tile_f", "sp", [-1, 6, 1, 8]], ["tile_y", "sp", [-1, 1, 7, 1]], ["tile_x", "sp", [-1, 1, 1, 3]], ["auto_unroll_max_step", "ot", 0], ["unroll_explicit", "ot", 1]]}, "result": [[0.3517633665], 0, 6.058497905731201, 1638645507.5386932], "version": 0.2, "tvm_version": "0.9.dev0"}
{"input": ["rocm -keys=rocm,gpu -max_num_threads=256 -mcpu=gfx906 -mtriple=amdgcn-amd-amdhsa-hcc -thread_warp_size=64", "depthwise_conv2d_nchw.cuda", [["TENSOR", [128, 336, 42, 42], "float32"], ["TENSOR", [336, 1, 5, 5], "float32"], 2, "SAME", 1, "float32"], {}], "config": {"index": 299142, "code_hash": null, "entity": [["tile_f", "sp", [-1, 1, 21, 1]], ["tile_y", "sp", [-1, 1, 7, 1]], ["tile_x", "sp", [-1, 3, 1, 1]], ["auto_unroll_max_step", "ot", 1500], ["unroll_explicit", "ot", 1]]}, "result": [[0.0022539242388059703], 0, 3.401979684829712, 1638645510.6094077], "version": 0.2, "tvm_version": "0.9.dev0"}
{"input": ["rocm -keys=rocm,gpu -max_num_threads=256 -mcpu=gfx906 -mtriple=amdgcn-amd-amdhsa-hcc -thread_warp_size=64", "depthwise_conv2d_nchw.cuda", [["TENSOR", [128, 336, 42, 42], "float32"], ["TENSOR", [336, 1, 5, 5], "float32"], 2, "SAME", 1, "float32"], {}], "config": {"index": 116203, "code_hash": null, "entity": [["tile_f", "sp", [-1, 2, 2, 4]], ["tile_y", "sp", [-1, 1, 1, 21]], ["tile_x", "sp", [-1, 1, 1, 7]], ["auto_unroll_max_step", "ot", 0], ["unroll_explicit", "ot", 1]]}, "result": [[0.8237880857500001], 0, 7.707784652709961, 1638645517.5626986], "version": 0.2, "tvm_version": "0.9.dev0"}
{"input": ["rocm -keys=rocm,gpu -max_num_threads=256 -mcpu=gfx906 -mtriple=amdgcn-amd-amdhsa-hcc -thread_warp_size=64", "depthwise_conv2d_nchw.cuda", [["TENSOR", [128, 336, 42, 42], "float32"], ["TENSOR", [336, 1, 5, 5], "float32"], 2, "SAME", 1, "float32"], {}], "config": {"index": 232217, "code_hash": null, "entity": [["tile_f", "sp", [-1, 1, 4, 7]], ["tile_y", "sp", [-1, 1, 3, 7]], ["tile_x", "sp", [-1, 1, 1, 3]], ["auto_unroll_max_step", "ot", 256], ["unroll_explicit", "ot", 1]]}, "result": [[0.08070511625], 0, 4.207430839538574, 1638645520.7104383], "version": 0.2, "tvm_version": "0.9.dev0"}
{"input": ["rocm -keys=rocm,gpu -max_num_threads=256 -mcpu=gfx906 -mtriple=amdgcn-amd-amdhsa-hcc -thread_warp_size=64", "depthwise_conv2d_nchw.cuda", [["TENSOR", [128, 336, 42, 42], "float32"], ["TENSOR", [336, 1, 5, 5], "float32"], 2, "SAME", 1, "float32"], {}], "config": {"index": 182011, "code_hash": null, "entity": [["tile_f", "sp", [-1, 24, 1, 1]], ["tile_y", "sp", [-1, 7, 3, 1]], ["tile_x", "sp", [-1, 1, 3, 1]], ["auto_unroll_max_step", "ot", 256], ["unroll_explicit", "ot", 1]]}, "result": [[0.58415771475], 0, 8.083723068237305, 1638645526.5834038], "version": 0.2, "tvm_version": "0.9.dev0"}
{"input": ["rocm -keys=rocm,gpu -max_num_threads=256 -mcpu=gfx906 -mtriple=amdgcn-amd-amdhsa-hcc -thread_warp_size=64", "depthwise_conv2d_nchw.cuda", [["TENSOR", [128, 336, 42, 42], "float32"], ["TENSOR", [336, 1, 5, 5], "float32"], 2, "SAME", 1, "float32"], {}], "config": {"index": 76891, "code_hash": null, "entity": [["tile_f", "sp", [-1, 1, 4, 2]], ["tile_y", "sp", [-1, 1, 1, 3]], ["tile_x", "sp", [-1, 1, 21, 1]], ["auto_unroll_max_step", "ot", 0], ["unroll_explicit", "ot", 1]]}, "result": [[0.003514486], 0, 3.8360095024108887, 1638645592.362102], "version": 0.2, "tvm_version": "0.9.dev0"}
{"input": ["rocm -keys=rocm,gpu -max_num_threads=256 -mcpu=gfx906 -mtriple=amdgcn-amd-amdhsa-hcc -thread_warp_size=64", "depthwise_conv2d_nchw.cuda", [["TENSOR", [128, 336, 42, 42], "float32"], ["TENSOR", [336, 1, 5, 5], "float32"], 2, "SAME", 1, "float32"], {}], "config": {"index": 220251, "code_hash": null, "entity": [["tile_f", "sp", [-1, 1, 4, 2]], ["tile_y", "sp", [-1, 1, 1, 3]], ["tile_x", "sp", [-1, 1, 21, 1]], ["auto_unroll_max_step", "ot", 256], ["unroll_explicit", "ot", 1]]}, "result": [[0.0029401915849056603], 0, 3.982447624206543, 1638645595.4632487], "version": 0.2, "tvm_version": "0.9.dev0"}
{"input": ["rocm -keys=rocm,gpu -max_num_threads=256 -mcpu=gfx906 -mtriple=amdgcn-amd-amdhsa-hcc -thread_warp_size=64", "depthwise_conv2d_nchw.cuda", [["TENSOR", [128, 336, 42, 42], "float32"], ["TENSOR", [336, 1, 5, 5], "float32"], 2, "SAME", 1, "float32"], {}], "config": {"index": 363611, "code_hash": null, "entity": [["tile_f", "sp", [-1, 1, 4, 2]], ["tile_y", "sp", [-1, 1, 1, 3]], ["tile_x", "sp", [-1, 1, 21, 1]], ["auto_unroll_max_step", "ot", 1500], ["unroll_explicit", "ot", 1]]}, "result": [[0.00294412], 0, 4.741626977920532, 1638645599.2478275], "version": 0.2, "tvm_version": "0.9.dev0"}
{"input": ["rocm -keys=rocm,gpu -max_num_threads=256 -mcpu=gfx906 -mtriple=amdgcn-amd-amdhsa-hcc -thread_warp_size=64", "depthwise_conv2d_nchw.cuda", [["TENSOR", [128, 336, 42, 42], "float32"], ["TENSOR", [336, 1, 5, 5], "float32"], 2, "SAME", 1, "float32"], {}], "config": {"index": 291500, "code_hash": null, "entity": [["tile_f", "sp", [-1, 1, 6, 4]], ["tile_y", "sp", [-1, 1, 21, 1]], ["tile_x", "sp", [-1, 1, 1, 1]], ["auto_unroll_max_step", "ot", 1500], ["unroll_explicit", "ot", 1]]}, "result": [[0.0068648666], 0, 4.4782044887542725, 1638645602.8120308], "version": 0.2, "tvm_version": "0.9.dev0"}
{"input": ["rocm -keys=rocm,gpu -max_num_threads=256 -mcpu=gfx906 -mtriple=amdgcn-amd-amdhsa-hcc -thread_warp_size=64", "depthwise_conv2d_nchw.cuda", [["TENSOR", [128, 336, 42, 42], "float32"], ["TENSOR", [336, 1, 5, 5], "float32"], 2, "SAME", 1, "float32"], {}], "config": {"index": 291538, "code_hash": null, "entity": [["tile_f", "sp", [-1, 1, 4, 6]], ["tile_y", "sp", [-1, 1, 21, 1]], ["tile_x", "sp", [-1, 1, 1, 1]], ["auto_unroll_max_step", "ot", 1500], ["unroll_explicit", "ot", 1]]}, "result": [[0.009844119636363636], 0, 5.530256986618042, 1638645606.9642391], "version": 0.2, "tvm_version": "0.9.dev0"}
{"input": ["rocm -keys=rocm,gpu -max_num_threads=256 -mcpu=gfx906 -mtriple=amdgcn-amd-amdhsa-hcc -thread_warp_size=64", "depthwise_conv2d_nchw.cuda", [["TENSOR", [128, 336, 42, 42], "float32"], ["TENSOR", [336, 1, 5, 5], "float32"], 2, "SAME", 1, "float32"], {}], "config": {"index": 148178, "code_hash": null, "entity": [["tile_f", "sp", [-1, 1, 4, 6]], ["tile_y", "sp", [-1, 1, 21, 1]], ["tile_x", "sp", [-1, 1, 1, 1]], ["auto_unroll_max_step", "ot", 256], ["unroll_explicit", "ot", 1]]}, "result": [[0.010621538272727273], 0, 5.111257314682007, 1638645610.974398], "version": 0.2, "tvm_version": "0.9.dev0"}
{"input": ["rocm -keys=rocm,gpu -max_num_threads=256 -mcpu=gfx906 -mtriple=amdgcn-amd-amdhsa-hcc -thread_warp_size=64", "depthwise_conv2d_nchw.cuda", [["TENSOR", [128, 336, 42, 42], "float32"], ["TENSOR", [336, 1, 5, 5], "float32"], 2, "SAME", 1, "float32"], {}], "config": {"index": 4780, "code_hash": null, "entity": [["tile_f", "sp", [-1, 1, 6, 4]], ["tile_y", "sp", [-1, 1, 21, 1]], ["tile_x", "sp", [-1, 1, 1, 1]], ["auto_unroll_max_step", "ot", 0], ["unroll_explicit", "ot", 1]]}, "result": [[0.007880811769230769], 0, 5.017694473266602, 1638645615.097565], "version": 0.2, "tvm_version": "0.9.dev0"}
{"input": ["rocm -keys=rocm,gpu -max_num_threads=256 -mcpu=gfx906 -mtriple=amdgcn-amd-amdhsa-hcc -thread_warp_size=64", "depthwise_conv2d_nchw.cuda", [["TENSOR", [128, 336, 42, 42], "float32"], ["TENSOR", [336, 1, 5, 5], "float32"], 2, "SAME", 1, "float32"], {}], "config": {"index": 4818, "code_hash": null, "entity": [["tile_f", "sp", [-1, 1, 4, 6]], ["tile_y", "sp", [-1, 1, 21, 1]], ["tile_x", "sp", [-1, 1, 1, 1]], ["auto_unroll_max_step", "ot", 0], ["unroll_explicit", "ot", 1]]}, "result": [[0.01203529011111111], 0, 4.774064779281616, 1638645619.0567968], "version": 0.2, "tvm_version": "0.9.dev0"}
{"input": ["rocm -keys=rocm,gpu -max_num_threads=256 -mcpu=gfx906 -mtriple=amdgcn-amd-amdhsa-hcc -thread_warp_size=64", "depthwise_conv2d_nchw.cuda", [["TENSOR", [128, 336, 42, 42], "float32"], ["TENSOR", [336, 1, 5, 5], "float32"], 2, "SAME", 1, "float32"], {}], "config": {"index": 148140, "code_hash": null, "entity": [["tile_f", "sp", [-1, 1, 6, 4]], ["tile_y", "sp", [-1, 1, 21, 1]], ["tile_x", "sp", [-1, 1, 1, 1]], ["auto_unroll_max_step", "ot", 256], ["unroll_explicit", "ot", 1]]}, "result": [[0.006874782266666667], 0, 4.987959146499634, 1638645622.981881], "version": 0.2, "tvm_version": "0.9.dev0"}
{"input": ["rocm -keys=rocm,gpu -max_num_threads=256 -mcpu=gfx906 -mtriple=amdgcn-amd-amdhsa-hcc -thread_warp_size=64", "depthwise_conv2d_nchw.cuda", [["TENSOR", [128, 336, 42, 42], "float32"], ["TENSOR", [336, 1, 5, 5], "float32"], 2, "SAME", 1, "float32"], {}], "config": {"index": 148212, "code_hash": null, "entity": [["tile_f", "sp", [-1, 1, 3, 7]], ["tile_y", "sp", [-1, 1, 21, 1]], ["tile_x", "sp", [-1, 1, 1, 1]], ["auto_unroll_max_step", "ot", 256], ["unroll_explicit", "ot", 1]]}, "result": [[0.008541582083333334], 0, 6.367241144180298, 1638645627.989085], "version": 0.2, "tvm_version": "0.9.dev0"}
{"input": ["rocm -keys=rocm,gpu -max_num_threads=256 -mcpu=gfx906 -mtriple=amdgcn-amd-amdhsa-hcc -thread_warp_size=64", "depthwise_conv2d_nchw.cuda", [["TENSOR", [128, 336, 42, 42], "float32"], ["TENSOR", [336, 1, 5, 5], "float32"], 2, "SAME", 1, "float32"], {}], "config": {"index": 4852, "code_hash": null, "entity": [["tile_f", "sp", [-1, 1, 3, 7]], ["tile_y", "sp", [-1, 1, 21, 1]], ["tile_x", "sp", [-1, 1, 1, 1]], ["auto_unroll_max_step", "ot", 0], ["unroll_explicit", "ot", 1]]}, "result": [[0.010409971], 0, 4.9745774269104, 1638645632.0790596], "version": 0.2, "tvm_version": "0.9.dev0"}
{"input": ["rocm -keys=rocm,gpu -max_num_threads=256 -mcpu=gfx906 -mtriple=amdgcn-amd-amdhsa-hcc -thread_warp_size=64", "depthwise_conv2d_nchw.cuda", [["TENSOR", [128, 336, 42, 42], "float32"], ["TENSOR", [336, 1, 5, 5], "float32"], 2, "SAME", 1, "float32"], {}], "config": {"index": 291572, "code_hash": null, "entity": [["tile_f", "sp", [-1, 1, 3, 7]], ["tile_y", "sp", [-1, 1, 21, 1]], ["tile_x", "sp", [-1, 1, 1, 1]], ["auto_unroll_max_step", "ot", 1500], ["unroll_explicit", "ot", 1]]}, "result": [[0.008530692999999999], 0, 5.240091800689697, 1638645635.9647696], "version": 0.2, "tvm_version": "0.9.dev0"}
{"input": ["rocm -keys=rocm,gpu -max_num_threads=256 -mcpu=gfx906 -mtriple=amdgcn-amd-amdhsa-hcc -thread_warp_size=64", "depthwise_conv2d_nchw.cuda", [["TENSOR", [128, 336, 42, 42], "float32"], ["TENSOR", [336, 1, 5, 5], "float32"], 2, "SAME", 1, "float32"], {}], "config": {"index": 76883, "code_hash": null, "entity": [["tile_f", "sp", [-1, 1, 3, 2]], ["tile_y", "sp", [-1, 1, 1, 3]], ["tile_x", "sp", [-1, 1, 21, 1]], ["auto_unroll_max_step", "ot", 0], ["unroll_explicit", "ot", 1]]}, "result": [[0.0032914120400000003], 0, 5.165281057357788, 1638645640.4481344], "version": 0.2, "tvm_version": "0.9.dev0"}
{"input": ["rocm -keys=rocm,gpu -max_num_threads=256 -mcpu=gfx906 -mtriple=amdgcn-amd-amdhsa-hcc -thread_warp_size=64", "depthwise_conv2d_nchw.cuda", [["TENSOR", [128, 336, 42, 42], "float32"], ["TENSOR", [336, 1, 5, 5], "float32"], 2, "SAME", 1, "float32"], {}], "config": {"index": 363603, "code_hash": null, "entity": [["tile_f", "sp", [-1, 1, 3, 2]], ["tile_y", "sp", [-1, 1, 1, 3]], ["tile_x", "sp", [-1, 1, 21, 1]], ["auto_unroll_max_step", "ot", 1500], ["unroll_explicit", "ot", 1]]}, "result": [[0.0027157703898305087], 0, 4.854884147644043, 1638645644.5205047], "version": 0.2, "tvm_version": "0.9.dev0"}
{"input": ["rocm -keys=rocm,gpu -max_num_threads=256 -mcpu=gfx906 -mtriple=amdgcn-amd-amdhsa-hcc -thread_warp_size=64", "depthwise_conv2d_nchw.cuda", [["TENSOR", [128, 336, 42, 42], "float32"], ["TENSOR", [336, 1, 5, 5], "float32"], 2, "SAME", 1, "float32"], {}], "config": {"index": 60538, "code_hash": null, "entity": [["tile_f", "sp", [-1, 1, 6, 1]], ["tile_y", "sp", [-1, 1, 1, 7]], ["tile_x", "sp", [-1, 1, 7, 1]], ["auto_unroll_max_step", "ot", 0], ["unroll_explicit", "ot", 1]]}, "result": [[0.0032851174347826085], 0, 4.73116660118103, 1638645648.5670772], "version": 0.2, "tvm_version": "0.9.dev0"}
{"input": ["rocm -keys=rocm,gpu -max_num_threads=256 -mcpu=gfx906 -mtriple=amdgcn-amd-amdhsa-hcc -thread_warp_size=64", "depthwise_conv2d_nchw.cuda", [["TENSOR", [128, 336, 42, 42], "float32"], ["TENSOR", [336, 1, 5, 5], "float32"], 2, "SAME", 1, "float32"], {}], "config": {"index": 347258, "code_hash": null, "entity": [["tile_f", "sp", [-1, 1, 6, 1]], ["tile_y", "sp", [-1, 1, 1, 7]], ["tile_x", "sp", [-1, 1, 7, 1]], ["auto_unroll_max_step", "ot", 1500], ["unroll_explicit", "ot", 1]]}, "result": [[0.002710069310344828], 0, 5.764455795288086, 1638645653.3712258], "version": 0.2, "tvm_version": "0.9.dev0"}
{"input": ["rocm -keys=rocm,gpu -max_num_threads=256 -mcpu=gfx906 -mtriple=amdgcn-amd-amdhsa-hcc -thread_warp_size=64", "depthwise_conv2d_nchw.cuda", [["TENSOR", [128, 336, 42, 42], "float32"], ["TENSOR", [336, 1, 5, 5], "float32"], 2, "SAME", 1, "float32"], {}], "config": {"index": 203898, "code_hash": null, "entity": [["tile_f", "sp", [-1, 1, 6, 1]], ["tile_y", "sp", [-1, 1, 1, 7]], ["tile_x", "sp", [-1, 1, 7, 1]], ["auto_unroll_max_step", "ot", 256], ["unroll_explicit", "ot", 1]]}, "result": [[0.002709981706896552], 0, 4.94163966178894, 1638645657.300044], "version": 0.2, "tvm_version": "0.9.dev0"}
{"input": ["rocm -keys=rocm,gpu -max_num_threads=256 -mcpu=gfx906 -mtriple=amdgcn-amd-amdhsa-hcc -thread_warp_size=64", "depthwise_conv2d_nchw.cuda", [["TENSOR", [128, 336, 42, 42], "float32"], ["TENSOR", [336, 1, 5, 5], "float32"], 2, "SAME", 1, "float32"], {}], "config": {"index": 220243, "code_hash": null, "entity": [["tile_f", "sp", [-1, 1, 3, 2]], ["tile_y", "sp", [-1, 1, 1, 3]], ["tile_x", "sp", [-1, 1, 21, 1]], ["auto_unroll_max_step", "ot", 256], ["unroll_explicit", "ot", 1]]}, "result": [[0.0025735553728813555], 0, 5.122589826583862, 1638645662.0074399], "version": 0.2, "tvm_version": "0.9.dev0"}
{"input": ["rocm -keys=rocm,gpu -max_num_threads=256 -mcpu=gfx906 -mtriple=amdgcn-amd-amdhsa-hcc -thread_warp_size=64", "depthwise_conv2d_nchw.cuda", [["TENSOR", [128, 336, 42, 42], "float32"], ["TENSOR", [336, 1, 5, 5], "float32"], 2, "SAME", 1, "float32"], {}], "config": {"index": 291449, "code_hash": null, "entity": [["tile_f", "sp", [-1, 1, 7, 3]], ["tile_y", "sp", [-1, 1, 21, 1]], ["tile_x", "sp", [-1, 1, 1, 1]], ["auto_unroll_max_step", "ot", 1500], ["unroll_explicit", "ot", 1]]}, "result": [[0.004215170208333333], 0, 3.1753246784210205, 1638645664.7978268], "version": 0.2, "tvm_version": "0.9.dev0"}
{"input": ["rocm -keys=rocm,gpu -max_num_threads=256 -mcpu=gfx906 -mtriple=amdgcn-amd-amdhsa-hcc -thread_warp_size=64", "depthwise_conv2d_nchw.cuda", [["TENSOR", [128, 336, 42, 42], "float32"], ["TENSOR", [336, 1, 5, 5], "float32"], 2, "SAME", 1, "float32"], {}], "config": {"index": 4734, "code_hash": null, "entity": [["tile_f", "sp", [-1, 1, 8, 3]], ["tile_y", "sp", [-1, 1, 21, 1]], ["tile_x", "sp", [-1, 1, 1, 1]], ["auto_unroll_max_step", "ot", 0], ["unroll_explicit", "ot", 1]]}, "result": [[0.006333253375], 0, 3.5544216632843018, 1638645667.7125287], "version": 0.2, "tvm_version": "0.9.dev0"}
{"input": ["rocm -keys=rocm,gpu -max_num_threads=256 -mcpu=gfx906 -mtriple=amdgcn-amd-amdhsa-hcc -thread_warp_size=64", "depthwise_conv2d_nchw.cuda", [["TENSOR", [128, 336, 42, 42], "float32"], ["TENSOR", [336, 1, 5, 5], "float32"], 2, "SAME", 1, "float32"], {}], "config": {"index": 148094, "code_hash": null, "entity": [["tile_f", "sp", [-1, 1, 8, 3]], ["tile_y", "sp", [-1, 1, 21, 1]], ["tile_x", "sp", [-1, 1, 1, 1]], ["auto_unroll_max_step", "ot", 256], ["unroll_explicit", "ot", 1]]}, "result": [[0.005436878789473684], 0, 3.8755228519439697, 1638645670.7779667], "version": 0.2, "tvm_version": "0.9.dev0"}
{"input": ["rocm -keys=rocm,gpu -max_num_threads=256 -mcpu=gfx906 -mtriple=amdgcn-amd-amdhsa-hcc -thread_warp_size=64", "depthwise_conv2d_nchw.cuda", [["TENSOR", [128, 336, 42, 42], "float32"], ["TENSOR", [336, 1, 5, 5], "float32"], 2, "SAME", 1, "float32"], {}], "config": {"index": 291454, "code_hash": null, "entity": [["tile_f", "sp", [-1, 1, 8, 3]], ["tile_y", "sp", [-1, 1, 21, 1]], ["tile_x", "sp", [-1, 1, 1, 1]], ["auto_unroll_max_step", "ot", 1500], ["unroll_explicit", "ot", 1]]}, "result": [[0.005428688842105263], 0, 3.7580671310424805, 1638645673.7576587], "version": 0.2, "tvm_version": "0.9.dev0"}
{"input": ["rocm -keys=rocm,gpu -max_num_threads=256 -mcpu=gfx906 -mtriple=amdgcn-amd-amdhsa-hcc -thread_warp_size=64", "depthwise_conv2d_nchw.cuda", [["TENSOR", [128, 336, 42, 42], "float32"], ["TENSOR", [336, 1, 5, 5], "float32"], 2, "SAME", 1, "float32"], {}], "config": {"index": 4729, "code_hash": null, "entity": [["tile_f", "sp", [-1, 1, 7, 3]], ["tile_y", "sp", [-1, 1, 21, 1]], ["tile_x", "sp", [-1, 1, 1, 1]], ["auto_unroll_max_step", "ot", 0], ["unroll_explicit", "ot", 1]]}, "result": [[0.004960955125], 0, 3.994025230407715, 1638645677.011328], "version": 0.2, "tvm_version": "0.9.dev0"}
{"input": ["rocm -keys=rocm,gpu -max_num_threads=256 -mcpu=gfx906 -mtriple=amdgcn-amd-amdhsa-hcc -thread_warp_size=64", "depthwise_conv2d_nchw.cuda", [["TENSOR", [128, 336, 42, 42], "float32"], ["TENSOR", [336, 1, 5, 5], "float32"], 2, "SAME", 1, "float32"], {}], "config": {"index": 148089, "code_hash": null, "entity": [["tile_f", "sp", [-1, 1, 7, 3]], ["tile_y", "sp", [-1, 1, 21, 1]], ["tile_x", "sp", [-1, 1, 1, 1]], ["auto_unroll_max_step", "ot", 256], ["unroll_explicit", "ot", 1]]}, "result": [[0.00421771527027027], 0, 4.0111119747161865, 1638645680.25778], "version": 0.2, "tvm_version": "0.9.dev0"}
{"input": ["rocm -keys=rocm,gpu -max_num_threads=256 -mcpu=gfx906 -mtriple=amdgcn-amd-amdhsa-hcc -thread_warp_size=64", "depthwise_conv2d_nchw.cuda", [["TENSOR", [128, 336, 42, 42], "float32"], ["TENSOR", [336, 1, 5, 5], "float32"], 2, "SAME", 1, "float32"], {}], "config": {"index": 358772, "code_hash": null, "entity": [["tile_f", "sp", [-1, 1, 3, 7]], ["tile_y", "sp", [-1, 1, 1, 1]], ["tile_x", "sp", [-1, 1, 21, 1]], ["auto_unroll_max_step", "ot", 1500], ["unroll_explicit", "ot", 1]]}, "result": [[0.0075271290000000005], 0, 4.567540645599365, 1638645683.4068875], "version": 0.2, "tvm_version": "0.9.dev0"}
{"input": ["rocm -keys=rocm,gpu -max_num_threads=256 -mcpu=gfx906 -mtriple=amdgcn-amd-amdhsa-hcc -thread_warp_size=64", "depthwise_conv2d_nchw.cuda", [["TENSOR", [128, 336, 42, 42], "float32"], ["TENSOR", [336, 1, 5, 5], "float32"], 2, "SAME", 1, "float32"], {}], "config": {"index": 215412, "code_hash": null, "entity": [["tile_f", "sp", [-1, 1, 3, 7]], ["tile_y", "sp", [-1, 1, 1, 1]], ["tile_x", "sp", [-1, 1, 21, 1]], ["auto_unroll_max_step", "ot", 256], ["unroll_explicit", "ot", 1]]}, "result": [[0.007543025928571428], 0, 4.219818115234375, 1638645686.4075103], "version": 0.2, "tvm_version": "0.9.dev0"}
{"input": ["rocm -keys=rocm,gpu -max_num_threads=256 -mcpu=gfx906 -mtriple=amdgcn-amd-amdhsa-hcc -thread_warp_size=64", "depthwise_conv2d_nchw.cuda", [["TENSOR", [128, 336, 42, 42], "float32"], ["TENSOR", [336, 1, 5, 5], "float32"], 2, "SAME", 1, "float32"], {}], "config": {"index": 358700, "code_hash": null, "entity": [["tile_f", "sp", [-1, 1, 6, 4]], ["tile_y", "sp", [-1, 1, 1, 1]], ["tile_x", "sp", [-1, 1, 21, 1]], ["auto_unroll_max_step", "ot", 1500], ["unroll_explicit", "ot", 1]]}, "result": [[0.006154061235294117], 0, 4.061100244522095, 1638645689.5107417], "version": 0.2, "tvm_version": "0.9.dev0"}
{"input": ["rocm -keys=rocm,gpu -max_num_threads=256 -mcpu=gfx906 -mtriple=amdgcn-amd-amdhsa-hcc -thread_warp_size=64", "depthwise_conv2d_nchw.cuda", [["TENSOR", [128, 336, 42, 42], "float32"], ["TENSOR", [336, 1, 5, 5], "float32"], 2, "SAME", 1, "float32"], {}], "config": {"index": 215340, "code_hash": null, "entity": [["tile_f", "sp", [-1, 1, 6, 4]], ["tile_y", "sp", [-1, 1, 1, 1]], ["tile_x", "sp", [-1, 1, 21, 1]], ["auto_unroll_max_step", "ot", 256], ["unroll_explicit", "ot", 1]]}, "result": [[0.006139195117647059], 0, 3.859360456466675, 1638645692.4586263], "version": 0.2, "tvm_version": "0.9.dev0"}
{"input": ["rocm -keys=rocm,gpu -max_num_threads=256 -mcpu=gfx906 -mtriple=amdgcn-amd-amdhsa-hcc -thread_warp_size=64", "depthwise_conv2d_nchw.cuda", [["TENSOR", [128, 336, 42, 42], "float32"], ["TENSOR", [336, 1, 5, 5], "float32"], 2, "SAME", 1, "float32"], {}], "config": {"index": 71980, "code_hash": null, "entity": [["tile_f", "sp", [-1, 1, 6, 4]], ["tile_y", "sp", [-1, 1, 1, 1]], ["tile_x", "sp", [-1, 1, 21, 1]], ["auto_unroll_max_step", "ot", 0], ["unroll_explicit", "ot", 1]]}, "result": [[0.007341915642857142], 0, 3.7904062271118164, 1638645695.435249], "version": 0.2, "tvm_version": "0.9.dev0"}
{"input": ["rocm -keys=rocm,gpu -max_num_threads=256 -mcpu=gfx906 -mtriple=amdgcn-amd-amdhsa-hcc -thread_warp_size=64", "depthwise_conv2d_nchw.cuda", [["TENSOR", [128, 336, 42, 42], "float32"], ["TENSOR", [336, 1, 5, 5], "float32"], 2, "SAME", 1, "float32"], {}], "config": {"index": 72052, "code_hash": null, "entity": [["tile_f", "sp", [-1, 1, 3, 7]], ["tile_y", "sp", [-1, 1, 1, 1]], ["tile_x", "sp", [-1, 1, 21, 1]], ["auto_unroll_max_step", "ot", 0], ["unroll_explicit", "ot", 1]]}, "result": [[0.00887939], 0, 4.212839841842651, 1638645698.5390432], "version": 0.2, "tvm_version": "0.9.dev0"}
{"input": ["rocm -keys=rocm,gpu -max_num_threads=256 -mcpu=gfx906 -mtriple=amdgcn-amd-amdhsa-hcc -thread_warp_size=64", "depthwise_conv2d_nchw.cuda", [["TENSOR", [128, 336, 42, 42], "float32"], ["TENSOR", [336, 1, 5, 5], "float32"], 2, "SAME", 1, "float32"], {}], "config": {"index": 72018, "code_hash": null, "entity": [["tile_f", "sp", [-1, 1, 4, 6]], ["tile_y", "sp", [-1, 1, 1, 1]], ["tile_x", "sp", [-1, 1, 21, 1]], ["auto_unroll_max_step", "ot", 0], ["unroll_explicit", "ot", 1]]}, "result": [[0.011366107444444445], 0, 3.8448903560638428, 1638645701.470709], "version": 0.2, "tvm_version": "0.9.dev0"}
{"input": ["rocm -keys=rocm,gpu -max_num_threads=256 -mcpu=gfx906 -mtriple=amdgcn-amd-amdhsa-hcc -thread_warp_size=64", "depthwise_conv2d_nchw.cuda", [["TENSOR", [128, 336, 42, 42], "float32"], ["TENSOR", [336, 1, 5, 5], "float32"], 2, "SAME", 1, "float32"], {}], "config": {"index": 215378, "code_hash": null, "entity": [["tile_f", "sp", [-1, 1, 4, 6]], ["tile_y", "sp", [-1, 1, 1, 1]], ["tile_x", "sp", [-1, 1, 21, 1]], ["auto_unroll_max_step", "ot", 256], ["unroll_explicit", "ot", 1]]}, "result": [[0.009081871470588237], 0, 4.319520950317383, 1638645704.5952773], "version": 0.2, "tvm_version": "0.9.dev0"}
{"input": ["rocm -keys=rocm,gpu -max_num_threads=256 -mcpu=gfx906 -mtriple=amdgcn-amd-amdhsa-hcc -thread_warp_size=64", "depthwise_conv2d_nchw.cuda", [["TENSOR", [128, 336, 42, 42], "float32"], ["TENSOR", [336, 1, 5, 5], "float32"], 2, "SAME", 1, "float32"], {}], "config": {"index": 358738, "code_hash": null, "entity": [["tile_f", "sp", [-1, 1, 4, 6]], ["tile_y", "sp", [-1, 1, 1, 1]], ["tile_x", "sp", [-1, 1, 21, 1]], ["auto_unroll_max_step", "ot", 1500], ["unroll_explicit", "ot", 1]]}, "result": [[0.009081949529411765], 0, 4.24838662147522, 1638645707.6715443], "version": 0.2, "tvm_version": "0.9.dev0"}
{"input": ["rocm -keys=rocm,gpu -max_num_threads=256 -mcpu=gfx906 -mtriple=amdgcn-amd-amdhsa-hcc -thread_warp_size=64", "depthwise_conv2d_nchw.cuda", [["TENSOR", [128, 336, 42, 42], "float32"], ["TENSOR", [336, 1, 5, 5], "float32"], 2, "SAME", 1, "float32"], {}], "config": {"index": 76899, "code_hash": null, "entity": [["tile_f", "sp", [-1, 1, 6, 2]], ["tile_y", "sp", [-1, 1, 1, 3]], ["tile_x", "sp", [-1, 1, 21, 1]], ["auto_unroll_max_step", "ot", 0], ["unroll_explicit", "ot", 1]]}, "result": [[0.00312798888], 0, 3.8517534732818604, 1638645710.7405646], "version": 0.2, "tvm_version": "0.9.dev0"}
{"input": ["rocm -keys=rocm,gpu -max_num_threads=256 -mcpu=gfx906 -mtriple=amdgcn-amd-amdhsa-hcc -thread_warp_size=64", "depthwise_conv2d_nchw.cuda", [["TENSOR", [128, 336, 42, 42], "float32"], ["TENSOR", [336, 1, 5, 5], "float32"], 2, "SAME", 1, "float32"], {}], "config": {"index": 220259, "code_hash": null, "entity": [["tile_f", "sp", [-1, 1, 6, 2]], ["tile_y", "sp", [-1, 1, 1, 3]], ["tile_x", "sp", [-1, 1, 21, 1]], ["auto_unroll_max_step", "ot", 256], ["unroll_explicit", "ot", 1]]}, "result": [[0.0025996030517241374], 0, 3.9917287826538086, 1638645713.8049333], "version": 0.2, "tvm_version": "0.9.dev0"}
{"input": ["rocm -keys=rocm,gpu -max_num_threads=256 -mcpu=gfx906 -mtriple=amdgcn-amd-amdhsa-hcc -thread_warp_size=64", "depthwise_conv2d_nchw.cuda", [["TENSOR", [128, 336, 42, 42], "float32"], ["TENSOR", [336, 1, 5, 5], "float32"], 2, "SAME", 1, "float32"], {}], "config": {"index": 363619, "code_hash": null, "entity": [["tile_f", "sp", [-1, 1, 6, 2]], ["tile_y", "sp", [-1, 1, 1, 3]], ["tile_x", "sp", [-1, 1, 21, 1]], ["auto_unroll_max_step", "ot", 1500], ["unroll_explicit", "ot", 1]]}, "result": [[0.002598911084745763], 0, 3.902301549911499, 1638645716.8579652], "version": 0.2, "tvm_version": "0.9.dev0"}
{"input": ["rocm -keys=rocm,gpu -max_num_threads=256 -mcpu=gfx906 -mtriple=amdgcn-amd-amdhsa-hcc -thread_warp_size=64", "depthwise_conv2d_nchw.cuda", [["TENSOR", [128, 336, 42, 42], "float32"], ["TENSOR", [336, 1, 5, 5], "float32"], 2, "SAME", 1, "float32"], {}], "config": {"index": 60484, "code_hash": null, "entity": [["tile_f", "sp", [-1, 6, 1, 1]], ["tile_y", "sp", [-1, 1, 1, 7]], ["tile_x", "sp", [-1, 1, 7, 1]], ["auto_unroll_max_step", "ot", 0], ["unroll_explicit", "ot", 1]]}, "result": [[0.08017109675], 0, 4.5535290241241455, 1638645720.1038806], "version": 0.2, "tvm_version": "0.9.dev0"}
{"input": ["rocm -keys=rocm,gpu -max_num_threads=256 -mcpu=gfx906 -mtriple=amdgcn-amd-amdhsa-hcc -thread_warp_size=64", "depthwise_conv2d_nchw.cuda", [["TENSOR", [128, 336, 42, 42], "float32"], ["TENSOR", [336, 1, 5, 5], "float32"], 2, "SAME", 1, "float32"], {}], "config": {"index": 203844, "code_hash": null, "entity": [["tile_f", "sp", [-1, 6, 1, 1]], ["tile_y", "sp", [-1, 1, 1, 7]], ["tile_x", "sp", [-1, 1, 7, 1]], ["auto_unroll_max_step", "ot", 256], ["unroll_explicit", "ot", 1]]}, "result": [[0.07320989224999999], 0, 5.402465343475342, 1638645723.413293], "version": 0.2, "tvm_version": "0.9.dev0"}
{"input": ["rocm -keys=rocm,gpu -max_num_threads=256 -mcpu=gfx906 -mtriple=amdgcn-amd-amdhsa-hcc -thread_warp_size=64", "depthwise_conv2d_nchw.cuda", [["TENSOR", [128, 336, 42, 42], "float32"], ["TENSOR", [336, 1, 5, 5], "float32"], 2, "SAME", 1, "float32"], {}], "config": {"index": 347204, "code_hash": null, "entity": [["tile_f", "sp", [-1, 6, 1, 1]], ["tile_y", "sp", [-1, 1, 1, 7]], ["tile_x", "sp", [-1, 1, 7, 1]], ["auto_unroll_max_step", "ot", 1500], ["unroll_explicit", "ot", 1]]}, "result": [[0.021486068666666667], 0, 5.705158233642578, 1638645726.600177], "version": 0.2, "tvm_version": "0.9.dev0"}
{"input": ["rocm -keys=rocm,gpu -max_num_threads=256 -mcpu=gfx906 -mtriple=amdgcn-amd-amdhsa-hcc -thread_warp_size=64", "depthwise_conv2d_nchw.cuda", [["TENSOR", [128, 336, 42, 42], "float32"], ["TENSOR", [336, 1, 5, 5], "float32"], 2, "SAME", 1, "float32"], {}], "config": {"index": 76778, "code_hash": null, "entity": [["tile_f", "sp", [-1, 1, 6, 1]], ["tile_y", "sp", [-1, 1, 1, 3]], ["tile_x", "sp", [-1, 1, 21, 1]], ["auto_unroll_max_step", "ot", 0], ["unroll_explicit", "ot", 1]]}, "result": [[0.0017428531097560974], 0, 3.9522931575775146, 1638645729.8482687], "version": 0.2, "tvm_version": "0.9.dev0"}
{"input": ["rocm -keys=rocm,gpu -max_num_threads=256 -mcpu=gfx906 -mtriple=amdgcn-amd-amdhsa-hcc -thread_warp_size=64", "depthwise_conv2d_nchw.cuda", [["TENSOR", [128, 336, 42, 42], "float32"], ["TENSOR", [336, 1, 5, 5], "float32"], 2, "SAME", 1, "float32"], {}], "config": {"index": 220138, "code_hash": null, "entity": [["tile_f", "sp", [-1, 1, 6, 1]], ["tile_y", "sp", [-1, 1, 1, 3]], ["tile_x", "sp", [-1, 1, 21, 1]], ["auto_unroll_max_step", "ot", 256], ["unroll_explicit", "ot", 1]]}, "result": [[0.0015119556526315787], 0, 3.830897331237793, 1638645733.056085], "version": 0.2, "tvm_version": "0.9.dev0"}
{"input": ["rocm -keys=rocm,gpu -max_num_threads=256 -mcpu=gfx906 -mtriple=amdgcn-amd-amdhsa-hcc -thread_warp_size=64", "depthwise_conv2d_nchw.cuda", [["TENSOR", [128, 336, 42, 42], "float32"], ["TENSOR", [336, 1, 5, 5], "float32"], 2, "SAME", 1, "float32"], {}], "config": {"index": 363498, "code_hash": null, "entity": [["tile_f", "sp", [-1, 1, 6, 1]], ["tile_y", "sp", [-1, 1, 1, 3]], ["tile_x", "sp", [-1, 1, 21, 1]], ["auto_unroll_max_step", "ot", 1500], ["unroll_explicit", "ot", 1]]}, "result": [[0.0015119066736842106], 0, 3.604135036468506, 1638645736.0676548], "version": 0.2, "tvm_version": "0.9.dev0"}
{"input": ["rocm -keys=rocm,gpu -max_num_threads=256 -mcpu=gfx906 -mtriple=amdgcn-amd-amdhsa-hcc -thread_warp_size=64", "depthwise_conv2d_nchw.cuda", [["TENSOR", [128, 336, 42, 42], "float32"], ["TENSOR", [336, 1, 5, 5], "float32"], 2, "SAME", 1, "float32"], {}], "config": {"index": 290182, "code_hash": null, "entity": [["tile_f", "sp", [-1, 1, 21, 1]], ["tile_y", "sp", [-1, 1, 7, 1]], ["tile_x", "sp", [-1, 1, 1, 1]], ["auto_unroll_max_step", "ot", 1500], ["unroll_explicit", "ot", 1]]}, "result": [[0.0033081611956521733], 0, 3.5243704319000244, 1638645739.1161966], "version": 0.2, "tvm_version": "0.9.dev0"}
{"input": ["rocm -keys=rocm,gpu -max_num_threads=256 -mcpu=gfx906 -mtriple=amdgcn-amd-amdhsa-hcc -thread_warp_size=64", "depthwise_conv2d_nchw.cuda", [["TENSOR", [128, 336, 42, 42], "float32"], ["TENSOR", [336, 1, 5, 5], "float32"], 2, "SAME", 1, "float32"], {}], "config": {"index": 3462, "code_hash": null, "entity": [["tile_f", "sp", [-1, 1, 21, 1]], ["tile_y", "sp", [-1, 1, 7, 1]], ["tile_x", "sp", [-1, 1, 1, 1]], ["auto_unroll_max_step", "ot", 0], ["unroll_explicit", "ot", 1]]}, "result": [[0.003633315674418605], 0, 3.5811538696289062, 1638645742.2088072], "version": 0.2, "tvm_version": "0.9.dev0"}
{"input": ["rocm -keys=rocm,gpu -max_num_threads=256 -mcpu=gfx906 -mtriple=amdgcn-amd-amdhsa-hcc -thread_warp_size=64", "depthwise_conv2d_nchw.cuda", [["TENSOR", [128, 336, 42, 42], "float32"], ["TENSOR", [336, 1, 5, 5], "float32"], 2, "SAME", 1, "float32"], {}], "config": {"index": 146822, "code_hash": null, "entity": [["tile_f", "sp", [-1, 1, 21, 1]], ["tile_y", "sp", [-1, 1, 7, 1]], ["tile_x", "sp", [-1, 1, 1, 1]], ["auto_unroll_max_step", "ot", 256], ["unroll_explicit", "ot", 1]]}, "result": [[0.0033141097826086957], 0, 3.7147791385650635, 1638645745.445083], "version": 0.2, "tvm_version": "0.9.dev0"}
{"input": ["rocm -keys=rocm,gpu -max_num_threads=256 -mcpu=gfx906 -mtriple=amdgcn-amd-amdhsa-hcc -thread_warp_size=64", "depthwise_conv2d_nchw.cuda", [["TENSOR", [128, 336, 42, 42], "float32"], ["TENSOR", [336, 1, 5, 5], "float32"], 2, "SAME", 1, "float32"], {}], "config": {"index": 363516, "code_hash": null, "entity": [["tile_f", "sp", [-1, 1, 8, 1]], ["tile_y", "sp", [-1, 1, 1, 3]], ["tile_x", "sp", [-1, 1, 21, 1]], ["auto_unroll_max_step", "ot", 1500], ["unroll_explicit", "ot", 1]]}, "result": [[0.001719737505882353], 0, 3.620291233062744, 1638645748.4852984], "version": 0.2, "tvm_version": "0.9.dev0"}
{"input": ["rocm -keys=rocm,gpu -max_num_threads=256 -mcpu=gfx906 -mtriple=amdgcn-amd-amdhsa-hcc -thread_warp_size=64", "depthwise_conv2d_nchw.cuda", [["TENSOR", [128, 336, 42, 42], "float32"], ["TENSOR", [336, 1, 5, 5], "float32"], 2, "SAME", 1, "float32"], {}], "config": {"index": 76796, "code_hash": null, "entity": [["tile_f", "sp", [-1, 1, 8, 1]], ["tile_y", "sp", [-1, 1, 1, 3]], ["tile_x", "sp", [-1, 1, 21, 1]], ["auto_unroll_max_step", "ot", 0], ["unroll_explicit", "ot", 1]]}, "result": [[0.0019387473947368422], 0, 3.561136245727539, 1638645751.5713046], "version": 0.2, "tvm_version": "0.9.dev0"}
{"input": ["rocm -keys=rocm,gpu -max_num_threads=256 -mcpu=gfx906 -mtriple=amdgcn-amd-amdhsa-hcc -thread_warp_size=64", "depthwise_conv2d_nchw.cuda", [["TENSOR", [128, 336, 42, 42], "float32"], ["TENSOR", [336, 1, 5, 5], "float32"], 2, "SAME", 1, "float32"], {}], "config": {"index": 220156, "code_hash": null, "entity": [["tile_f", "sp", [-1, 1, 8, 1]], ["tile_y", "sp", [-1, 1, 1, 3]], ["tile_x", "sp", [-1, 1, 21, 1]], ["auto_unroll_max_step", "ot", 256], ["unroll_explicit", "ot", 1]]}, "result": [[0.0017184135714285714], 0, 3.5017123222351074, 1638645754.8024342], "version": 0.2, "tvm_version": "0.9.dev0"}
{"input": ["rocm -keys=rocm,gpu -max_num_threads=256 -mcpu=gfx906 -mtriple=amdgcn-amd-amdhsa-hcc -thread_warp_size=64", "depthwise_conv2d_nchw.cuda", [["TENSOR", [128, 336, 42, 42], "float32"], ["TENSOR", [336, 1, 5, 5], "float32"], 2, "SAME", 1, "float32"], {}], "config": {"index": 220146, "code_hash": null, "entity": [["tile_f", "sp", [-1, 1, 7, 1]], ["tile_y", "sp", [-1, 1, 1, 3]], ["tile_x", "sp", [-1, 1, 21, 1]], ["auto_unroll_max_step", "ot", 256], ["unroll_explicit", "ot", 1]]}, "result": [[0.0016322737011494255], 0, 4.431983709335327, 1638645806.1501238], "version": 0.2, "tvm_version": "0.9.dev0"}
{"input": ["rocm -keys=rocm,gpu -max_num_threads=256 -mcpu=gfx906 -mtriple=amdgcn-amd-amdhsa-hcc -thread_warp_size=64", "depthwise_conv2d_nchw.cuda", [["TENSOR", [128, 336, 42, 42], "float32"], ["TENSOR", [336, 1, 5, 5], "float32"], 2, "SAME", 1, "float32"], {}], "config": {"index": 363506, "code_hash": null, "entity": [["tile_f", "sp", [-1, 1, 7, 1]], ["tile_y", "sp", [-1, 1, 1, 3]], ["tile_x", "sp", [-1, 1, 21, 1]], ["auto_unroll_max_step", "ot", 1500], ["unroll_explicit", "ot", 1]]}, "result": [[0.001632253125], 0, 4.61252760887146, 1638645810.0616248], "version": 0.2, "tvm_version": "0.9.dev0"}
{"input": ["rocm -keys=rocm,gpu -max_num_threads=256 -mcpu=gfx906 -mtriple=amdgcn-amd-amdhsa-hcc -thread_warp_size=64", "depthwise_conv2d_nchw.cuda", [["TENSOR", [128, 336, 42, 42], "float32"], ["TENSOR", [336, 1, 5, 5], "float32"], 2, "SAME", 1, "float32"], {}], "config": {"index": 244226, "code_hash": null, "entity": [["tile_f", "sp", [-1, 1, 7, 1]], ["tile_y", "sp", [-1, 1, 3, 1]], ["tile_x", "sp", [-1, 1, 7, 3]], ["auto_unroll_max_step", "ot", 256], ["unroll_explicit", "ot", 1]]}, "result": [[0.0016346246477272725], 0, 4.7311506271362305, 1638645814.1011274], "version": 0.2, "tvm_version": "0.9.dev0"}
{"input": ["rocm -keys=rocm,gpu -max_num_threads=256 -mcpu=gfx906 -mtriple=amdgcn-amd-amdhsa-hcc -thread_warp_size=64", "depthwise_conv2d_nchw.cuda", [["TENSOR", [128, 336, 42, 42], "float32"], ["TENSOR", [336, 1, 5, 5], "float32"], 2, "SAME", 1, "float32"], {}], "config": {"index": 387586, "code_hash": null, "entity": [["tile_f", "sp", [-1, 1, 7, 1]], ["tile_y", "sp", [-1, 1, 3, 1]], ["tile_x", "sp", [-1, 1, 7, 3]], ["auto_unroll_max_step", "ot", 1500], ["unroll_explicit", "ot", 1]]}, "result": [[0.001634936238636364], 0, 5.075107097625732, 1638645818.47001], "version": 0.2, "tvm_version": "0.9.dev0"}
{"input": ["rocm -keys=rocm,gpu -max_num_threads=256 -mcpu=gfx906 -mtriple=amdgcn-amd-amdhsa-hcc -thread_warp_size=64", "depthwise_conv2d_nchw.cuda", [["TENSOR", [128, 336, 42, 42], "float32"], ["TENSOR", [336, 1, 5, 5], "float32"], 2, "SAME", 1, "float32"], {}], "config": {"index": 76786, "code_hash": null, "entity": [["tile_f", "sp", [-1, 1, 7, 1]], ["tile_y", "sp", [-1, 1, 1, 3]], ["tile_x", "sp", [-1, 1, 21, 1]], ["auto_unroll_max_step", "ot", 0], ["unroll_explicit", "ot", 1]]}, "result": [[0.0018474068860759494], 0, 4.790576934814453, 1638645822.7292974], "version": 0.2, "tvm_version": "0.9.dev0"}
{"input": ["rocm -keys=rocm,gpu -max_num_threads=256 -mcpu=gfx906 -mtriple=amdgcn-amd-amdhsa-hcc -thread_warp_size=64", "depthwise_conv2d_nchw.cuda", [["TENSOR", [128, 336, 42, 42], "float32"], ["TENSOR", [336, 1, 5, 5], "float32"], 2, "SAME", 1, "float32"], {}], "config": {"index": 244218, "code_hash": null, "entity": [["tile_f", "sp", [-1, 1, 6, 1]], ["tile_y", "sp", [-1, 1, 3, 1]], ["tile_x", "sp", [-1, 1, 7, 3]], ["auto_unroll_max_step", "ot", 256], ["unroll_explicit", "ot", 1]]}, "result": [[0.0015231636421052634], 0, 5.410164833068848, 1638645827.53347], "version": 0.2, "tvm_version": "0.9.dev0"}
{"input": ["rocm -keys=rocm,gpu -max_num_threads=256 -mcpu=gfx906 -mtriple=amdgcn-amd-amdhsa-hcc -thread_warp_size=64", "depthwise_conv2d_nchw.cuda", [["TENSOR", [128, 336, 42, 42], "float32"], ["TENSOR", [336, 1, 5, 5], "float32"], 2, "SAME", 1, "float32"], {}], "config": {"index": 387578, "code_hash": null, "entity": [["tile_f", "sp", [-1, 1, 6, 1]], ["tile_y", "sp", [-1, 1, 3, 1]], ["tile_x", "sp", [-1, 1, 7, 3]], ["auto_unroll_max_step", "ot", 1500], ["unroll_explicit", "ot", 1]]}, "result": [[0.0015206205578947368], 0, 4.949087619781494, 1638645831.7055907], "version": 0.2, "tvm_version": "0.9.dev0"}
{"input": ["rocm -keys=rocm,gpu -max_num_threads=256 -mcpu=gfx906 -mtriple=amdgcn-amd-amdhsa-hcc -thread_warp_size=64", "depthwise_conv2d_nchw.cuda", [["TENSOR", [128, 336, 42, 42], "float32"], ["TENSOR", [336, 1, 5, 5], "float32"], 2, "SAME", 1, "float32"], {}], "config": {"index": 100866, "code_hash": null, "entity": [["tile_f", "sp", [-1, 1, 7, 1]], ["tile_y", "sp", [-1, 1, 3, 1]], ["tile_x", "sp", [-1, 1, 7, 3]], ["auto_unroll_max_step", "ot", 0], ["unroll_explicit", "ot", 1]]}, "result": [[0.0018960725696202533], 0, 4.786479234695435, 1638645835.7554853], "version": 0.2, "tvm_version": "0.9.dev0"}
{"input": ["rocm -keys=rocm,gpu -max_num_threads=256 -mcpu=gfx906 -mtriple=amdgcn-amd-amdhsa-hcc -thread_warp_size=64", "depthwise_conv2d_nchw.cuda", [["TENSOR", [128, 336, 42, 42], "float32"], ["TENSOR", [336, 1, 5, 5], "float32"], 2, "SAME", 1, "float32"], {}], "config": {"index": 244236, "code_hash": null, "entity": [["tile_f", "sp", [-1, 1, 8, 1]], ["tile_y", "sp", [-1, 1, 3, 1]], ["tile_x", "sp", [-1, 1, 7, 3]], ["auto_unroll_max_step", "ot", 256], ["unroll_explicit", "ot", 1]]}, "result": [[0.0017243395529411764], 0, 4.9957945346832275, 1638645839.9187603], "version": 0.2, "tvm_version": "0.9.dev0"}
{"input": ["rocm -keys=rocm,gpu -max_num_threads=256 -mcpu=gfx906 -mtriple=amdgcn-amd-amdhsa-hcc -thread_warp_size=64", "depthwise_conv2d_nchw.cuda", [["TENSOR", [128, 336, 42, 42], "float32"], ["TENSOR", [336, 1, 5, 5], "float32"], 2, "SAME", 1, "float32"], {}], "config": {"index": 100858, "code_hash": null, "entity": [["tile_f", "sp", [-1, 1, 6, 1]], ["tile_y", "sp", [-1, 1, 3, 1]], ["tile_x", "sp", [-1, 1, 7, 3]], ["auto_unroll_max_step", "ot", 0], ["unroll_explicit", "ot", 1]]}, "result": [[0.001912492512195122], 0, 4.740118503570557, 1638645843.9652658], "version": 0.2, "tvm_version": "0.9.dev0"}
{"input": ["rocm -keys=rocm,gpu -max_num_threads=256 -mcpu=gfx906 -mtriple=amdgcn-amd-amdhsa-hcc -thread_warp_size=64", "depthwise_conv2d_nchw.cuda", [["TENSOR", [128, 336, 42, 42], "float32"], ["TENSOR", [336, 1, 5, 5], "float32"], 2, "SAME", 1, "float32"], {}], "config": {"index": 387596, "code_hash": null, "entity": [["tile_f", "sp", [-1, 1, 8, 1]], ["tile_y", "sp", [-1, 1, 3, 1]], ["tile_x", "sp", [-1, 1, 7, 3]], ["auto_unroll_max_step", "ot", 1500], ["unroll_explicit", "ot", 1]]}, "result": [[0.0017241950470588234], 0, 4.545295238494873, 1638645847.9465375], "version": 0.2, "tvm_version": "0.9.dev0"}
{"input": ["rocm -keys=rocm,gpu -max_num_threads=256 -mcpu=gfx906 -mtriple=amdgcn-amd-amdhsa-hcc -thread_warp_size=64", "depthwise_conv2d_nchw.cuda", [["TENSOR", [128, 336, 42, 42], "float32"], ["TENSOR", [336, 1, 5, 5], "float32"], 2, "SAME", 1, "float32"], {}], "config": {"index": 228546, "code_hash": null, "entity": [["tile_f", "sp", [-1, 1, 7, 1]], ["tile_y", "sp", [-1, 1, 21, 1]], ["tile_x", "sp", [-1, 1, 1, 3]], ["auto_unroll_max_step", "ot", 256], ["unroll_explicit", "ot", 1]]}, "result": [[0.0016419122840909091], 0, 4.523789644241333, 1638645851.862559], "version": 0.2, "tvm_version": "0.9.dev0"}
{"input": ["rocm -keys=rocm,gpu -max_num_threads=256 -mcpu=gfx906 -mtriple=amdgcn-amd-amdhsa-hcc -thread_warp_size=64", "depthwise_conv2d_nchw.cuda", [["TENSOR", [128, 336, 42, 42], "float32"], ["TENSOR", [336, 1, 5, 5], "float32"], 2, "SAME", 1, "float32"], {}], "config": {"index": 371906, "code_hash": null, "entity": [["tile_f", "sp", [-1, 1, 7, 1]], ["tile_y", "sp", [-1, 1, 21, 1]], ["tile_x", "sp", [-1, 1, 1, 3]], ["auto_unroll_max_step", "ot", 1500], ["unroll_explicit", "ot", 1]]}, "result": [[0.0016413506590909092], 0, 4.830728054046631, 1638645856.114778], "version": 0.2, "tvm_version": "0.9.dev0"}
{"input": ["rocm -keys=rocm,gpu -max_num_threads=256 -mcpu=gfx906 -mtriple=amdgcn-amd-amdhsa-hcc -thread_warp_size=64", "depthwise_conv2d_nchw.cuda", [["TENSOR", [128, 336, 42, 42], "float32"], ["TENSOR", [336, 1, 5, 5], "float32"], 2, "SAME", 1, "float32"], {}], "config": {"index": 228538, "code_hash": null, "entity": [["tile_f", "sp", [-1, 1, 6, 1]], ["tile_y", "sp", [-1, 1, 21, 1]], ["tile_x", "sp", [-1, 1, 1, 3]], ["auto_unroll_max_step", "ot", 256], ["unroll_explicit", "ot", 1]]}, "result": [[0.001502853547368421], 0, 3.710106611251831, 1638645859.1144047], "version": 0.2, "tvm_version": "0.9.dev0"}
{"input": ["rocm -keys=rocm,gpu -max_num_threads=256 -mcpu=gfx906 -mtriple=amdgcn-amd-amdhsa-hcc -thread_warp_size=64", "depthwise_conv2d_nchw.cuda", [["TENSOR", [128, 336, 42, 42], "float32"], ["TENSOR", [336, 1, 5, 5], "float32"], 2, "SAME", 1, "float32"], {}], "config": {"index": 100876, "code_hash": null, "entity": [["tile_f", "sp", [-1, 1, 8, 1]], ["tile_y", "sp", [-1, 1, 3, 1]], ["tile_x", "sp", [-1, 1, 7, 3]], ["auto_unroll_max_step", "ot", 0], ["unroll_explicit", "ot", 1]]}, "result": [[0.0020091141527777776], 0, 3.880664825439453, 1638645862.180557], "version": 0.2, "tvm_version": "0.9.dev0"}
{"input": ["rocm -keys=rocm,gpu -max_num_threads=256 -mcpu=gfx906 -mtriple=amdgcn-amd-amdhsa-hcc -thread_warp_size=64", "depthwise_conv2d_nchw.cuda", [["TENSOR", [128, 336, 42, 42], "float32"], ["TENSOR", [336, 1, 5, 5], "float32"], 2, "SAME", 1, "float32"], {}], "config": {"index": 371898, "code_hash": null, "entity": [["tile_f", "sp", [-1, 1, 6, 1]], ["tile_y", "sp", [-1, 1, 21, 1]], ["tile_x", "sp", [-1, 1, 1, 3]], ["auto_unroll_max_step", "ot", 1500], ["unroll_explicit", "ot", 1]]}, "result": [[0.0015061271263157895], 0, 3.729153871536255, 1638645865.3667724], "version": 0.2, "tvm_version": "0.9.dev0"}
{"input": ["rocm -keys=rocm,gpu -max_num_threads=256 -mcpu=gfx906 -mtriple=amdgcn-amd-amdhsa-hcc -thread_warp_size=64", "depthwise_conv2d_nchw.cuda", [["TENSOR", [128, 336, 42, 42], "float32"], ["TENSOR", [336, 1, 5, 5], "float32"], 2, "SAME", 1, "float32"], {}], "config": {"index": 208378, "code_hash": null, "entity": [["tile_f", "sp", [-1, 1, 6, 1]], ["tile_y", "sp", [-1, 1, 3, 1]], ["tile_x", "sp", [-1, 3, 7, 1]], ["auto_unroll_max_step", "ot", 256], ["unroll_explicit", "ot", 1]]}, "result": [[0.0015584833225806452], 0, 3.8420395851135254, 1638645868.5385807], "version": 0.2, "tvm_version": "0.9.dev0"}
{"input": ["rocm -keys=rocm,gpu -max_num_threads=256 -mcpu=gfx906 -mtriple=amdgcn-amd-amdhsa-hcc -thread_warp_size=64", "depthwise_conv2d_nchw.cuda", [["TENSOR", [128, 336, 42, 42], "float32"], ["TENSOR", [336, 1, 5, 5], "float32"], 2, "SAME", 1, "float32"], {}], "config": {"index": 208386, "code_hash": null, "entity": [["tile_f", "sp", [-1, 1, 7, 1]], ["tile_y", "sp", [-1, 1, 3, 1]], ["tile_x", "sp", [-1, 3, 7, 1]], ["auto_unroll_max_step", "ot", 256], ["unroll_explicit", "ot", 1]]}, "result": [[0.0016672201839080462], 0, 4.018521547317505, 1638645871.7357085], "version": 0.2, "tvm_version": "0.9.dev0"}
{"input": ["rocm -keys=rocm,gpu -max_num_threads=256 -mcpu=gfx906 -mtriple=amdgcn-amd-amdhsa-hcc -thread_warp_size=64", "depthwise_conv2d_nchw.cuda", [["TENSOR", [128, 336, 42, 42], "float32"], ["TENSOR", [336, 1, 5, 5], "float32"], 2, "SAME", 1, "float32"], {}], "config": {"index": 185426, "code_hash": null, "entity": [["tile_f", "sp", [-1, 1, 7, 1]], ["tile_y", "sp", [-1, 1, 7, 3]], ["tile_x", "sp", [-1, 1, 3, 1]], ["auto_unroll_max_step", "ot", 256], ["unroll_explicit", "ot", 1]]}, "result": [[0.0016966780705882354], 0, 3.615999937057495, 1638645874.762568], "version": 0.2, "tvm_version": "0.9.dev0"}
{"input": ["rocm -keys=rocm,gpu -max_num_threads=256 -mcpu=gfx906 -mtriple=amdgcn-amd-amdhsa-hcc -thread_warp_size=64", "depthwise_conv2d_nchw.cuda", [["TENSOR", [128, 336, 42, 42], "float32"], ["TENSOR", [336, 1, 5, 5], "float32"], 2, "SAME", 1, "float32"], {}], "config": {"index": 351746, "code_hash": null, "entity": [["tile_f", "sp", [-1, 1, 7, 1]], ["tile_y", "sp", [-1, 1, 3, 1]], ["tile_x", "sp", [-1, 3, 7, 1]], ["auto_unroll_max_step", "ot", 1500], ["unroll_explicit", "ot", 1]]}, "result": [[0.0016682518160919541], 0, 3.717355728149414, 1638645877.7565427], "version": 0.2, "tvm_version": "0.9.dev0"}
{"input": ["rocm -keys=rocm,gpu -max_num_threads=256 -mcpu=gfx906 -mtriple=amdgcn-amd-amdhsa-hcc -thread_warp_size=64", "depthwise_conv2d_nchw.cuda", [["TENSOR", [128, 336, 42, 42], "float32"], ["TENSOR", [336, 1, 5, 5], "float32"], 2, "SAME", 1, "float32"], {}], "config": {"index": 351738, "code_hash": null, "entity": [["tile_f", "sp", [-1, 1, 6, 1]], ["tile_y", "sp", [-1, 1, 3, 1]], ["tile_x", "sp", [-1, 3, 7, 1]], ["auto_unroll_max_step", "ot", 1500], ["unroll_explicit", "ot", 1]]}, "result": [[0.0015582097826086956], 0, 3.8513877391815186, 1638645880.8275607], "version": 0.2, "tvm_version": "0.9.dev0"}
{"input": ["rocm -keys=rocm,gpu -max_num_threads=256 -mcpu=gfx906 -mtriple=amdgcn-amd-amdhsa-hcc -thread_warp_size=64", "depthwise_conv2d_nchw.cuda", [["TENSOR", [128, 336, 42, 42], "float32"], ["TENSOR", [336, 1, 5, 5], "float32"], 2, "SAME", 1, "float32"], {}], "config": {"index": 328786, "code_hash": null, "entity": [["tile_f", "sp", [-1, 1, 7, 1]], ["tile_y", "sp", [-1, 1, 7, 3]], ["tile_x", "sp", [-1, 1, 3, 1]], ["auto_unroll_max_step", "ot", 1500], ["unroll_explicit", "ot", 1]]}, "result": [[0.0016958373999999999], 0, 3.7004315853118896, 1638645883.817867], "version": 0.2, "tvm_version": "0.9.dev0"}
{"input": ["rocm -keys=rocm,gpu -max_num_threads=256 -mcpu=gfx906 -mtriple=amdgcn-amd-amdhsa-hcc -thread_warp_size=64", "depthwise_conv2d_nchw.cuda", [["TENSOR", [128, 336, 42, 42], "float32"], ["TENSOR", [336, 1, 5, 5], "float32"], 2, "SAME", 1, "float32"], {}], "config": {"index": 185418, "code_hash": null, "entity": [["tile_f", "sp", [-1, 1, 6, 1]], ["tile_y", "sp", [-1, 1, 7, 3]], ["tile_x", "sp", [-1, 1, 3, 1]], ["auto_unroll_max_step", "ot", 256], ["unroll_explicit", "ot", 1]]}, "result": [[0.0015507104239130434], 0, 3.716671943664551, 1638645886.834847], "version": 0.2, "tvm_version": "0.9.dev0"}
{"input": ["rocm -keys=rocm,gpu -max_num_threads=256 -mcpu=gfx906 -mtriple=amdgcn-amd-amdhsa-hcc -thread_warp_size=64", "depthwise_conv2d_nchw.cuda", [["TENSOR", [128, 336, 42, 42], "float32"], ["TENSOR", [336, 1, 5, 5], "float32"], 2, "SAME", 1, "float32"], {}], "config": {"index": 85186, "code_hash": null, "entity": [["tile_f", "sp", [-1, 1, 7, 1]], ["tile_y", "sp", [-1, 1, 21, 1]], ["tile_x", "sp", [-1, 1, 1, 3]], ["auto_unroll_max_step", "ot", 0], ["unroll_explicit", "ot", 1]]}, "result": [[0.0018509675949367086], 0, 3.6371049880981445, 1638645889.8018928], "version": 0.2, "tvm_version": "0.9.dev0"}
{"input": ["rocm -keys=rocm,gpu -max_num_threads=256 -mcpu=gfx906 -mtriple=amdgcn-amd-amdhsa-hcc -thread_warp_size=64", "depthwise_conv2d_nchw.cuda", [["TENSOR", [128, 336, 42, 42], "float32"], ["TENSOR", [336, 1, 5, 5], "float32"], 2, "SAME", 1, "float32"], {}], "config": {"index": 328778, "code_hash": null, "entity": [["tile_f", "sp", [-1, 1, 6, 1]], ["tile_y", "sp", [-1, 1, 7, 3]], ["tile_x", "sp", [-1, 1, 3, 1]], ["auto_unroll_max_step", "ot", 1500], ["unroll_explicit", "ot", 1]]}, "result": [[0.0015506721397849463], 0, 3.892523765563965, 1638645892.9815564], "version": 0.2, "tvm_version": "0.9.dev0"}
{"input": ["rocm -keys=rocm,gpu -max_num_threads=256 -mcpu=gfx906 -mtriple=amdgcn-amd-amdhsa-hcc -thread_warp_size=64", "depthwise_conv2d_nchw.cuda", [["TENSOR", [128, 336, 42, 42], "float32"], ["TENSOR", [336, 1, 5, 5], "float32"], 2, "SAME", 1, "float32"], {}], "config": {"index": 215658, "code_hash": null, "entity": [["tile_f", "sp", [-1, 1, 6, 1]], ["tile_y", "sp", [-1, 3, 1, 1]], ["tile_x", "sp", [-1, 1, 21, 1]], ["auto_unroll_max_step", "ot", 256], ["unroll_explicit", "ot", 1]]}, "result": [[0.0015072539892473117], 0, 3.9367997646331787, 1638645896.2597148], "version": 0.2, "tvm_version": "0.9.dev0"}
{"input": ["rocm -keys=rocm,gpu -max_num_threads=256 -mcpu=gfx906 -mtriple=amdgcn-amd-amdhsa-hcc -thread_warp_size=64", "depthwise_conv2d_nchw.cuda", [["TENSOR", [128, 336, 42, 42], "float32"], ["TENSOR", [336, 1, 5, 5], "float32"], 2, "SAME", 1, "float32"], {}], "config": {"index": 215666, "code_hash": null, "entity": [["tile_f", "sp", [-1, 1, 7, 1]], ["tile_y", "sp", [-1, 3, 1, 1]], ["tile_x", "sp", [-1, 1, 21, 1]], ["auto_unroll_max_step", "ot", 256], ["unroll_explicit", "ot", 1]]}, "result": [[0.001627966613636364], 0, 3.896406650543213, 1638645899.45304], "version": 0.2, "tvm_version": "0.9.dev0"}
{"input": ["rocm -keys=rocm,gpu -max_num_threads=256 -mcpu=gfx906 -mtriple=amdgcn-amd-amdhsa-hcc -thread_warp_size=64", "depthwise_conv2d_nchw.cuda", [["TENSOR", [128, 336, 42, 42], "float32"], ["TENSOR", [336, 1, 5, 5], "float32"], 2, "SAME", 1, "float32"], {}], "config": {"index": 85178, "code_hash": null, "entity": [["tile_f", "sp", [-1, 1, 6, 1]], ["tile_y", "sp", [-1, 1, 21, 1]], ["tile_x", "sp", [-1, 1, 1, 3]], ["auto_unroll_max_step", "ot", 0], ["unroll_explicit", "ot", 1]]}, "result": [[0.0017247152738095236], 0, 3.5757875442504883, 1638645902.494539], "version": 0.2, "tvm_version": "0.9.dev0"}
{"input": ["rocm -keys=rocm,gpu -max_num_threads=256 -mcpu=gfx906 -mtriple=amdgcn-amd-amdhsa-hcc -thread_warp_size=64", "depthwise_conv2d_nchw.cuda", [["TENSOR", [128, 336, 42, 42], "float32"], ["TENSOR", [336, 1, 5, 5], "float32"], 2, "SAME", 1, "float32"], {}], "config": {"index": 359018, "code_hash": null, "entity": [["tile_f", "sp", [-1, 1, 6, 1]], ["tile_y", "sp", [-1, 3, 1, 1]], ["tile_x", "sp", [-1, 1, 21, 1]], ["auto_unroll_max_step", "ot", 1500], ["unroll_explicit", "ot", 1]]}, "result": [[0.0015073854105263158], 0, 3.8923888206481934, 1638645905.6549888], "version": 0.2, "tvm_version": "0.9.dev0"}
{"input": ["rocm -keys=rocm,gpu -max_num_threads=256 -mcpu=gfx906 -mtriple=amdgcn-amd-amdhsa-hcc -thread_warp_size=64", "depthwise_conv2d_nchw.cuda", [["TENSOR", [128, 336, 42, 42], "float32"], ["TENSOR", [336, 1, 5, 5], "float32"], 2, "SAME", 1, "float32"], {}], "config": {"index": 359026, "code_hash": null, "entity": [["tile_f", "sp", [-1, 1, 7, 1]], ["tile_y", "sp", [-1, 3, 1, 1]], ["tile_x", "sp", [-1, 1, 21, 1]], ["auto_unroll_max_step", "ot", 1500], ["unroll_explicit", "ot", 1]]}, "result": [[0.001629327], 0, 3.7330162525177, 1638645908.7053936], "version": 0.2, "tvm_version": "0.9.dev0"}
{"input": ["rocm -keys=rocm,gpu -max_num_threads=256 -mcpu=gfx906 -mtriple=amdgcn-amd-amdhsa-hcc -thread_warp_size=64", "depthwise_conv2d_nchw.cuda", [["TENSOR", [128, 336, 42, 42], "float32"], ["TENSOR", [336, 1, 5, 5], "float32"], 2, "SAME", 1, "float32"], {}], "config": {"index": 215138, "code_hash": null, "entity": [["tile_f", "sp", [-1, 1, 16, 1]], ["tile_y", "sp", [-1, 1, 1, 1]], ["tile_x", "sp", [-1, 1, 21, 1]], ["auto_unroll_max_step", "ot", 256], ["unroll_explicit", "ot", 1]]}, "result": [[0.002006972194444444], 0, 3.639270782470703, 1638645911.7207813], "version": 0.2, "tvm_version": "0.9.dev0"}
{"input": ["rocm -keys=rocm,gpu -max_num_threads=256 -mcpu=gfx906 -mtriple=amdgcn-amd-amdhsa-hcc -thread_warp_size=64", "depthwise_conv2d_nchw.cuda", [["TENSOR", [128, 336, 42, 42], "float32"], ["TENSOR", [336, 1, 5, 5], "float32"], 2, "SAME", 1, "float32"], {}], "config": {"index": 242018, "code_hash": null, "entity": [["tile_f", "sp", [-1, 1, 16, 1]], ["tile_y", "sp", [-1, 1, 1, 1]], ["tile_x", "sp", [-1, 1, 7, 3]], ["auto_unroll_max_step", "ot", 256], ["unroll_explicit", "ot", 1]]}, "result": [[0.0036736904186046512], 0, 3.9065206050872803, 1638645914.8078282], "version": 0.2, "tvm_version": "0.9.dev0"}
{"input": ["rocm -keys=rocm,gpu -max_num_threads=256 -mcpu=gfx906 -mtriple=amdgcn-amd-amdhsa-hcc -thread_warp_size=64", "depthwise_conv2d_nchw.cuda", [["TENSOR", [128, 336, 42, 42], "float32"], ["TENSOR", [336, 1, 5, 5], "float32"], 2, "SAME", 1, "float32"], {}], "config": {"index": 217338, "code_hash": null, "entity": [["tile_f", "sp", [-1, 1, 6, 1]], ["tile_y", "sp", [-1, 1, 3, 1]], ["tile_x", "sp", [-1, 1, 21, 1]], ["auto_unroll_max_step", "ot", 256], ["unroll_explicit", "ot", 1]]}, "result": [[0.0010686005522388062], 0, 3.565671682357788, 1638645917.92255], "version": 0.2, "tvm_version": "0.9.dev0"}
{"input": ["rocm -keys=rocm,gpu -max_num_threads=256 -mcpu=gfx906 -mtriple=amdgcn-amd-amdhsa-hcc -thread_warp_size=64", "depthwise_conv2d_nchw.cuda", [["TENSOR", [128, 336, 42, 42], "float32"], ["TENSOR", [336, 1, 5, 5], "float32"], 2, "SAME", 1, "float32"], {}], "config": {"index": 217346, "code_hash": null, "entity": [["tile_f", "sp", [-1, 1, 7, 1]], ["tile_y", "sp", [-1, 1, 3, 1]], ["tile_x", "sp", [-1, 1, 21, 1]], ["auto_unroll_max_step", "ot", 256], ["unroll_explicit", "ot", 1]]}, "result": [[0.001085275356060606], 0, 3.4056015014648438, 1638645920.9342122], "version": 0.2, "tvm_version": "0.9.dev0"}
{"input": ["rocm -keys=rocm,gpu -max_num_threads=256 -mcpu=gfx906 -mtriple=amdgcn-amd-amdhsa-hcc -thread_warp_size=64", "depthwise_conv2d_nchw.cuda", [["TENSOR", [128, 336, 42, 42], "float32"], ["TENSOR", [336, 1, 5, 5], "float32"], 2, "SAME", 1, "float32"], {}], "config": {"index": 244207, "code_hash": null, "entity": [["tile_f", "sp", [-1, 2, 4, 1]], ["tile_y", "sp", [-1, 1, 3, 1]], ["tile_x", "sp", [-1, 1, 7, 3]], ["auto_unroll_max_step", "ot", 256], ["unroll_explicit", "ot", 1]]}, "result": [[0.0029456170943396227], 0, 4.067482948303223, 1638645924.0435367], "version": 0.2, "tvm_version": "0.9.dev0"}
{"input": ["rocm -keys=rocm,gpu -max_num_threads=256 -mcpu=gfx906 -mtriple=amdgcn-amd-amdhsa-hcc -thread_warp_size=64", "depthwise_conv2d_nchw.cuda", [["TENSOR", [128, 336, 42, 42], "float32"], ["TENSOR", [336, 1, 5, 5], "float32"], 2, "SAME", 1, "float32"], {}], "config": {"index": 342804, "code_hash": null, "entity": [["tile_f", "sp", [-1, 1, 12, 1]], ["tile_y", "sp", [-1, 1, 3, 1]], ["tile_x", "sp", [-1, 1, 7, 1]], ["auto_unroll_max_step", "ot", 1500], ["unroll_explicit", "ot", 1]]}, "result": [[0.0012895077477477477], 0, 3.737515687942505, 1638645927.2203522], "version": 0.2, "tvm_version": "0.9.dev0"}
{"input": ["rocm -keys=rocm,gpu -max_num_threads=256 -mcpu=gfx906 -mtriple=amdgcn-amd-amdhsa-hcc -thread_warp_size=64", "depthwise_conv2d_nchw.cuda", [["TENSOR", [128, 336, 42, 42], "float32"], ["TENSOR", [336, 1, 5, 5], "float32"], 2, "SAME", 1, "float32"], {}], "config": {"index": 220127, "code_hash": null, "entity": [["tile_f", "sp", [-1, 2, 4, 1]], ["tile_y", "sp", [-1, 1, 1, 3]], ["tile_x", "sp", [-1, 1, 21, 1]], ["auto_unroll_max_step", "ot", 256], ["unroll_explicit", "ot", 1]]}, "result": [[0.0029781700392156863], 0, 3.9684572219848633, 1638645930.2783313], "version": 0.2, "tvm_version": "0.9.dev0"}
{"input": ["rocm -keys=rocm,gpu -max_num_threads=256 -mcpu=gfx906 -mtriple=amdgcn-amd-amdhsa-hcc -thread_warp_size=64", "depthwise_conv2d_nchw.cuda", [["TENSOR", [128, 336, 42, 42], "float32"], ["TENSOR", [336, 1, 5, 5], "float32"], 2, "SAME", 1, "float32"], {}], "config": {"index": 387566, "code_hash": null, "entity": [["tile_f", "sp", [-1, 1, 4, 1]], ["tile_y", "sp", [-1, 1, 3, 1]], ["tile_x", "sp", [-1, 1, 7, 3]], ["auto_unroll_max_step", "ot", 1500], ["unroll_explicit", "ot", 1]]}, "result": [[0.0016419694999999998], 0, 3.7120912075042725, 1638645933.334482], "version": 0.2, "tvm_version": "0.9.dev0"}
{"input": ["rocm -keys=rocm,gpu -max_num_threads=256 -mcpu=gfx906 -mtriple=amdgcn-amd-amdhsa-hcc -thread_warp_size=64", "depthwise_conv2d_nchw.cuda", [["TENSOR", [128, 336, 42, 42], "float32"], ["TENSOR", [336, 1, 5, 5], "float32"], 2, "SAME", 1, "float32"], {}], "config": {"index": 351756, "code_hash": null, "entity": [["tile_f", "sp", [-1, 1, 8, 1]], ["tile_y", "sp", [-1, 1, 3, 1]], ["tile_x", "sp", [-1, 3, 7, 1]], ["auto_unroll_max_step", "ot", 1500], ["unroll_explicit", "ot", 1]]}, "result": [[0.0017661610476190474], 0, 3.8804008960723877, 1638645936.5447385], "version": 0.2, "tvm_version": "0.9.dev0"}
{"input": ["rocm -keys=rocm,gpu -max_num_threads=256 -mcpu=gfx906 -mtriple=amdgcn-amd-amdhsa-hcc -thread_warp_size=64", "depthwise_conv2d_nchw.cuda", [["TENSOR", [128, 336, 42, 42], "float32"], ["TENSOR", [336, 1, 5, 5], "float32"], 2, "SAME", 1, "float32"], {}], "config": {"index": 342810, "code_hash": null, "entity": [["tile_f", "sp", [-1, 1, 14, 1]], ["tile_y", "sp", [-1, 1, 3, 1]], ["tile_x", "sp", [-1, 1, 7, 1]], ["auto_unroll_max_step", "ot", 1500], ["unroll_explicit", "ot", 1]]}, "result": [[0.0013680460571428572], 0, 3.634181261062622, 1638645939.6136487], "version": 0.2, "tvm_version": "0.9.dev0"}
{"input": ["rocm -keys=rocm,gpu -max_num_threads=256 -mcpu=gfx906 -mtriple=amdgcn-amd-amdhsa-hcc -thread_warp_size=64", "depthwise_conv2d_nchw.cuda", [["TENSOR", [128, 336, 42, 42], "float32"], ["TENSOR", [336, 1, 5, 5], "float32"], 2, "SAME", 1, "float32"], {}], "config": {"index": 228556, "code_hash": null, "entity": [["tile_f", "sp", [-1, 1, 8, 1]], ["tile_y", "sp", [-1, 1, 21, 1]], ["tile_x", "sp", [-1, 1, 1, 3]], ["auto_unroll_max_step", "ot", 256], ["unroll_explicit", "ot", 1]]}, "result": [[0.0017599422073170732], 0, 3.775325298309326, 1638645942.755528], "version": 0.2, "tvm_version": "0.9.dev0"}
{"input": ["rocm -keys=rocm,gpu -max_num_threads=256 -mcpu=gfx906 -mtriple=amdgcn-amd-amdhsa-hcc -thread_warp_size=64", "depthwise_conv2d_nchw.cuda", [["TENSOR", [128, 336, 42, 42], "float32"], ["TENSOR", [336, 1, 5, 5], "float32"], 2, "SAME", 1, "float32"], {}], "config": {"index": 65018, "code_hash": null, "entity": [["tile_f", "sp", [-1, 1, 6, 1]], ["tile_y", "sp", [-1, 1, 3, 1]], ["tile_x", "sp", [-1, 3, 7, 1]], ["auto_unroll_max_step", "ot", 0], ["unroll_explicit", "ot", 1]]}, "result": [[0.0018389174050632909], 0, 3.749434232711792, 1638645945.7879534], "version": 0.2, "tvm_version": "0.9.dev0"}
{"input": ["rocm -keys=rocm,gpu -max_num_threads=256 -mcpu=gfx906 -mtriple=amdgcn-amd-amdhsa-hcc -thread_warp_size=64", "depthwise_conv2d_nchw.cuda", [["TENSOR", [128, 336, 42, 42], "float32"], ["TENSOR", [336, 1, 5, 5], "float32"], 2, "SAME", 1, "float32"], {}], "config": {"index": 65026, "code_hash": null, "entity": [["tile_f", "sp", [-1, 1, 7, 1]], ["tile_y", "sp", [-1, 1, 3, 1]], ["tile_x", "sp", [-1, 3, 7, 1]], ["auto_unroll_max_step", "ot", 0], ["unroll_explicit", "ot", 1]]}, "result": [[0.0019235418157894737], 0, 3.7226128578186035, 1638645948.8057363], "version": 0.2, "tvm_version": "0.9.dev0"}
