artifacts/Table4/tvm/autotvm/depthwise/depthwise_128_96_165_165_5_5_2_SAME.log
{"input": ["rocm -keys=rocm,gpu -max_num_threads=256 -mcpu=gfx906 -mtriple=amdgcn-amd-amdhsa-hcc -thread_warp_size=64", "depthwise_conv2d_nchw.cuda", [["TENSOR", [128, 96, 165, 165], "float32"], ["TENSOR", [96, 1, 5, 5], "float32"], 2, "SAME", 1, "float32"], {}], "config": {"index": 7274, "code_hash": null, "entity": [["tile_f", "sp", [-1, 2, 24, 2]], ["tile_y", "sp", [-1, 1, 1, 1]], ["tile_x", "sp", [-1, 1, 1, 1]], ["auto_unroll_max_step", "ot", 1500], ["unroll_explicit", "ot", 1]]}, "result": [[0.18501078775], 0, 12.860399007797241, 1638648637.7250938], "version": 0.2, "tvm_version": "0.9.dev0"}
{"input": ["rocm -keys=rocm,gpu -max_num_threads=256 -mcpu=gfx906 -mtriple=amdgcn-amd-amdhsa-hcc -thread_warp_size=64", "depthwise_conv2d_nchw.cuda", [["TENSOR", [128, 96, 165, 165], "float32"], ["TENSOR", [96, 1, 5, 5], "float32"], 2, "SAME", 1, "float32"], {}], "config": {"index": 2755, "code_hash": null, "entity": [["tile_f", "sp", [-1, 6, 1, 2]], ["tile_y", "sp", [-1, 1, 1, 1]], ["tile_x", "sp", [-1, 1, 1, 83]], ["auto_unroll_max_step", "ot", 0], ["unroll_explicit", "ot", 1]]}, "result": [[4.08909521475], 0, 31.810319662094116, 1638648668.060213], "version": 0.2, "tvm_version": "0.9.dev0"}
{"input": ["rocm -keys=rocm,gpu -max_num_threads=256 -mcpu=gfx906 -mtriple=amdgcn-amd-amdhsa-hcc -thread_warp_size=64", "depthwise_conv2d_nchw.cuda", [["TENSOR", [128, 96, 165, 165], "float32"], ["TENSOR", [96, 1, 5, 5], "float32"], 2, "SAME", 1, "float32"], {}], "config": {"index": 1984, "code_hash": null, "entity": [["tile_f", "sp", [-1, 1, 1, 12]], ["tile_y", "sp", [-1, 1, 1, 1]], ["tile_x", "sp", [-1, 1, 83, 1]], ["auto_unroll_max_step", "ot", 0], ["unroll_explicit", "ot", 1]]}, "result": [[0.076839035], 0, 16.308777809143066, 1638648683.7311327], "version": 0.2, "tvm_version": "0.9.dev0"}
{"input": ["rocm -keys=rocm,gpu -max_num_threads=256 -mcpu=gfx906 -mtriple=amdgcn-amd-amdhsa-hcc -thread_warp_size=64", "depthwise_conv2d_nchw.cuda", [["TENSOR", [128, 96, 165, 165], "float32"], ["TENSOR", [96, 1, 5, 5], "float32"], 2, "SAME", 1, "float32"], {}], "config": {"index": 687, "code_hash": null, "entity": [["tile_f", "sp", [-1, 4, 2, 1]], ["tile_y", "sp", [-1, 1, 1, 83]], ["tile_x", "sp", [-1, 1, 1, 1]], ["auto_unroll_max_step", "ot", 0], ["unroll_explicit", "ot", 1]]}, "result": [[3.386303955], 0, 31.566303730010986, 1638648714.7422082], "version": 0.2, "tvm_version": "0.9.dev0"}
{"input": ["rocm -keys=rocm,gpu -max_num_threads=256 -mcpu=gfx906 -mtriple=amdgcn-amd-amdhsa-hcc -thread_warp_size=64", "depthwise_conv2d_nchw.cuda", [["TENSOR", [128, 96, 165, 165], "float32"], ["TENSOR", [96, 1, 5, 5], "float32"], 2, "SAME", 1, "float32"], {}], "config": {"index": 2752, "code_hash": null, "entity": [["tile_f", "sp", [-1, 2, 1, 2]], ["tile_y", "sp", [-1, 1, 1, 1]], ["tile_x", "sp", [-1, 1, 1, 83]], ["auto_unroll_max_step", "ot", 0], ["unroll_explicit", "ot", 1]]}, "result": [[2.53543383775], 0, 28.259965896606445, 1638648742.1906216], "version": 0.2, "tvm_version": "0.9.dev0"}
{"input": ["rocm -keys=rocm,gpu -max_num_threads=256 -mcpu=gfx906 -mtriple=amdgcn-amd-amdhsa-hcc -thread_warp_size=64", "depthwise_conv2d_nchw.cuda", [["TENSOR", [128, 96, 165, 165], "float32"], ["TENSOR", [96, 1, 5, 5], "float32"], 2, "SAME", 1, "float32"], {}], "config": {"index": 3669, "code_hash": null, "entity": [["tile_f", "sp", [-1, 16, 3, 2]], ["tile_y", "sp", [-1, 1, 1, 1]], ["tile_x", "sp", [-1, 1, 1, 1]], ["auto_unroll_max_step", "ot", 256], ["unroll_explicit", "ot", 1]]}, "result": [[2.4327233885], 0, 24.908385515213013, 1638648765.6672733], "version": 0.2, "tvm_version": "0.9.dev0"}
{"input": ["rocm -keys=rocm,gpu -max_num_threads=256 -mcpu=gfx906 -mtriple=amdgcn-amd-amdhsa-hcc -thread_warp_size=64", "depthwise_conv2d_nchw.cuda", [["TENSOR", [128, 96, 165, 165], "float32"], ["TENSOR", [96, 1, 5, 5], "float32"], 2, "SAME", 1, "float32"], {}], "config": {"index": 3642, "code_hash": null, "entity": [["tile_f", "sp", [-1, 1, 32, 1]], ["tile_y", "sp", [-1, 1, 1, 1]], ["tile_x", "sp", [-1, 1, 1, 1]], ["auto_unroll_max_step", "ot", 256], ["unroll_explicit", "ot", 1]]}, "result": [[0.061172199], 0, 10.515020608901978, 1638648775.838511], "version": 0.2, "tvm_version": "0.9.dev0"}
{"input": ["rocm -keys=rocm,gpu -max_num_threads=256 -mcpu=gfx906 -mtriple=amdgcn-amd-amdhsa-hcc -thread_warp_size=64", "depthwise_conv2d_nchw.cuda", [["TENSOR", [128, 96, 165, 165], "float32"], ["TENSOR", [96, 1, 5, 5], "float32"], 2, "SAME", 1, "float32"], {}], "config": {"index": 7420, "code_hash": null, "entity": [["tile_f", "sp", [-1, 1, 4, 1]], ["tile_y", "sp", [-1, 83, 1, 1]], ["tile_x", "sp", [-1, 1, 1, 1]], ["auto_unroll_max_step", "ot", 1500], ["unroll_explicit", "ot", 1]]}, "result": [[2.7254582517499997], 0, 30.19391632080078, 1638648799.1799417], "version": 0.2, "tvm_version": "0.9.dev0"}
{"input": ["rocm -keys=rocm,gpu -max_num_threads=256 -mcpu=gfx906 -mtriple=amdgcn-amd-amdhsa-hcc -thread_warp_size=64", "depthwise_conv2d_nchw.cuda", [["TENSOR", [128, 96, 165, 165], "float32"], ["TENSOR", [96, 1, 5, 5], "float32"], 2, "SAME", 1, "float32"], {}], "config": {"index": 9965, "code_hash": null, "entity": [["tile_f", "sp", [-1, 2, 1, 3]], ["tile_y", "sp", [-1, 1, 1, 1]], ["tile_x", "sp", [-1, 1, 1, 83]], ["auto_unroll_max_step", "ot", 1500], ["unroll_explicit", "ot", 1]]}, "result": [[1.44569763175], 0, 18.769416332244873, 1638648818.2749896], "version": 0.2, "tvm_version": "0.9.dev0"}
{"input": ["rocm -keys=rocm,gpu -max_num_threads=256 -mcpu=gfx906 -mtriple=amdgcn-amd-amdhsa-hcc -thread_warp_size=64", "depthwise_conv2d_nchw.cuda", [["TENSOR", [128, 96, 165, 165], "float32"], ["TENSOR", [96, 1, 5, 5], "float32"], 2, "SAME", 1, "float32"], {}], "config": {"index": 1820, "code_hash": null, "entity": [["tile_f", "sp", [-1, 1, 4, 1]], ["tile_y", "sp", [-1, 1, 1, 1]], ["tile_x", "sp", [-1, 1, 83, 1]], ["auto_unroll_max_step", "ot", 0], ["unroll_explicit", "ot", 1]]}, "result": [[0.008629934916666667], 0, 10.208751916885376, 1638648828.2393591], "version": 0.2, "tvm_version": "0.9.dev0"}
{"input": ["rocm -keys=rocm,gpu -max_num_threads=256 -mcpu=gfx906 -mtriple=amdgcn-amd-amdhsa-hcc -thread_warp_size=64", "depthwise_conv2d_nchw.cuda", [["TENSOR", [128, 96, 165, 165], "float32"], ["TENSOR", [96, 1, 5, 5], "float32"], 2, "SAME", 1, "float32"], {}], "config": {"index": 1799, "code_hash": null, "entity": [["tile_f", "sp", [-1, 16, 1, 1]], ["tile_y", "sp", [-1, 1, 1, 1]], ["tile_x", "sp", [-1, 1, 83, 1]], ["auto_unroll_max_step", "ot", 0], ["unroll_explicit", "ot", 1]]}, "result": [[0.12427260575], 0, 11.19806456565857, 1638648838.7738066], "version": 0.2, "tvm_version": "0.9.dev0"}
{"input": ["rocm -keys=rocm,gpu -max_num_threads=256 -mcpu=gfx906 -mtriple=amdgcn-amd-amdhsa-hcc -thread_warp_size=64", "depthwise_conv2d_nchw.cuda", [["TENSOR", [128, 96, 165, 165], "float32"], ["TENSOR", [96, 1, 5, 5], "float32"], 2, "SAME", 1, "float32"], {}], "config": {"index": 3758, "code_hash": null, "entity": [["tile_f", "sp", [-1, 1, 1, 8]], ["tile_y", "sp", [-1, 1, 1, 1]], ["tile_x", "sp", [-1, 1, 1, 1]], ["auto_unroll_max_step", "ot", 256], ["unroll_explicit", "ot", 1]]}, "result": [[0.21521923825], 0, 12.231078147888184, 1638648850.0689871], "version": 0.2, "tvm_version": "0.9.dev0"}
{"input": ["rocm -keys=rocm,gpu -max_num_threads=256 -mcpu=gfx906 -mtriple=amdgcn-amd-amdhsa-hcc -thread_warp_size=64", "depthwise_conv2d_nchw.cuda", [["TENSOR", [128, 96, 165, 165], "float32"], ["TENSOR", [96, 1, 5, 5], "float32"], 2, "SAME", 1, "float32"], {}], "config": {"index": 4553, "code_hash": null, "entity": [["tile_f", "sp", [-1, 1, 2, 2]], ["tile_y", "sp", [-1, 1, 1, 1]], ["tile_x", "sp", [-1, 83, 1, 1]], ["auto_unroll_max_step", "ot", 256], ["unroll_explicit", "ot", 1]]}, "result": [[2.42400415025], 0, 23.965738534927368, 1638648872.58699], "version": 0.2, "tvm_version": "0.9.dev0"}
{"input": ["rocm -keys=rocm,gpu -max_num_threads=256 -mcpu=gfx906 -mtriple=amdgcn-amd-amdhsa-hcc -thread_warp_size=64", "depthwise_conv2d_nchw.cuda", [["TENSOR", [128, 96, 165, 165], "float32"], ["TENSOR", [96, 1, 5, 5], "float32"], 2, "SAME", 1, "float32"], {}], "config": {"index": 3620, "code_hash": null, "entity": [["tile_f", "sp", [-1, 1, 6, 1]], ["tile_y", "sp", [-1, 1, 1, 1]], ["tile_x", "sp", [-1, 1, 1, 1]], ["auto_unroll_max_step", "ot", 256], ["unroll_explicit", "ot", 1]]}, "result": [[0.09051517475], 0, 10.583783149719238, 1638648914.6923115], "version": 0.2, "tvm_version": "0.9.dev0"}
{"input": ["rocm -keys=rocm,gpu -max_num_threads=256 -mcpu=gfx906 -mtriple=amdgcn-amd-amdhsa-hcc -thread_warp_size=64", "depthwise_conv2d_nchw.cuda", [["TENSOR", [128, 96, 165, 165], "float32"], ["TENSOR", [96, 1, 5, 5], "float32"], 2, "SAME", 1, "float32"], {}], "config": {"index": 7204, "code_hash": null, "entity": [["tile_f", "sp", [-1, 1, 6, 1]], ["tile_y", "sp", [-1, 1, 1, 1]], ["tile_x", "sp", [-1, 1, 1, 1]], ["auto_unroll_max_step", "ot", 1500], ["unroll_explicit", "ot", 1]]}, "result": [[0.09279888900000001], 0, 11.96716594696045, 1638648925.7870502], "version": 0.2, "tvm_version": "0.9.dev0"}
{"input": ["rocm -keys=rocm,gpu -max_num_threads=256 -mcpu=gfx906 -mtriple=amdgcn-amd-amdhsa-hcc -thread_warp_size=64", "depthwise_conv2d_nchw.cuda", [["TENSOR", [128, 96, 165, 165], "float32"], ["TENSOR", [96, 1, 5, 5], "float32"], 2, "SAME", 1, "float32"], {}], "config": {"index": 7209, "code_hash": null, "entity": [["tile_f", "sp", [-1, 1, 8, 1]], ["tile_y", "sp", [-1, 1, 1, 1]], ["tile_x", "sp", [-1, 1, 1, 1]], ["auto_unroll_max_step", "ot", 1500], ["unroll_explicit", "ot", 1]]}, "result": [[0.07453980249999999], 0, 10.89385461807251, 1638648935.8298106], "version": 0.2, "tvm_version": "0.9.dev0"}
{"input": ["rocm -keys=rocm,gpu -max_num_threads=256 -mcpu=gfx906 -mtriple=amdgcn-amd-amdhsa-hcc -thread_warp_size=64", "depthwise_conv2d_nchw.cuda", [["TENSOR", [128, 96, 165, 165], "float32"], ["TENSOR", [96, 1, 5, 5], "float32"], 2, "SAME", 1, "float32"], {}], "config": {"index": 3625, "code_hash": null, "entity": [["tile_f", "sp", [-1, 1, 8, 1]], ["tile_y", "sp", [-1, 1, 1, 1]], ["tile_x", "sp", [-1, 1, 1, 1]], ["auto_unroll_max_step", "ot", 256], ["unroll_explicit", "ot", 1]]}, "result": [[0.07448162075], 0, 10.899057626724243, 1638648945.913446], "version": 0.2, "tvm_version": "0.9.dev0"}
{"input": ["rocm -keys=rocm,gpu -max_num_threads=256 -mcpu=gfx906 -mtriple=amdgcn-amd-amdhsa-hcc -thread_warp_size=64", "depthwise_conv2d_nchw.cuda", [["TENSOR", [128, 96, 165, 165], "float32"], ["TENSOR", [96, 1, 5, 5], "float32"], 2, "SAME", 1, "float32"], {}], "config": {"index": 7196, "code_hash": null, "entity": [["tile_f", "sp", [-1, 1, 4, 1]], ["tile_y", "sp", [-1, 1, 1, 1]], ["tile_x", "sp", [-1, 1, 1, 1]], ["auto_unroll_max_step", "ot", 1500], ["unroll_explicit", "ot", 1]]}, "result": [[0.1289943695], 0, 11.120473146438599, 1638648956.2111576], "version": 0.2, "tvm_version": "0.9.dev0"}
{"input": ["rocm -keys=rocm,gpu -max_num_threads=256 -mcpu=gfx906 -mtriple=amdgcn-amd-amdhsa-hcc -thread_warp_size=64", "depthwise_conv2d_nchw.cuda", [["TENSOR", [128, 96, 165, 165], "float32"], ["TENSOR", [96, 1, 5, 5], "float32"], 2, "SAME", 1, "float32"], {}], "config": {"index": 3612, "code_hash": null, "entity": [["tile_f", "sp", [-1, 1, 4, 1]], ["tile_y", "sp", [-1, 1, 1, 1]], ["tile_x", "sp", [-1, 1, 1, 1]], ["auto_unroll_max_step", "ot", 256], ["unroll_explicit", "ot", 1]]}, "result": [[0.12999928275], 0, 11.11488127708435, 1638648966.5664988], "version": 0.2, "tvm_version": "0.9.dev0"}
{"input": ["rocm -keys=rocm,gpu -max_num_threads=256 -mcpu=gfx906 -mtriple=amdgcn-amd-amdhsa-hcc -thread_warp_size=64", "depthwise_conv2d_nchw.cuda", [["TENSOR", [128, 96, 165, 165], "float32"], ["TENSOR", [96, 1, 5, 5], "float32"], 2, "SAME", 1, "float32"], {}], "config": {"index": 3631, "code_hash": null, "entity": [["tile_f", "sp", [-1, 1, 12, 1]], ["tile_y", "sp", [-1, 1, 1, 1]], ["tile_x", "sp", [-1, 1, 1, 1]], ["auto_unroll_max_step", "ot", 256], ["unroll_explicit", "ot", 1]]}, "result": [[0.061312427499999995], 0, 10.92022705078125, 1638648976.6182997], "version": 0.2, "tvm_version": "0.9.dev0"}
{"input": ["rocm -keys=rocm,gpu -max_num_threads=256 -mcpu=gfx906 -mtriple=amdgcn-amd-amdhsa-hcc -thread_warp_size=64", "depthwise_conv2d_nchw.cuda", [["TENSOR", [128, 96, 165, 165], "float32"], ["TENSOR", [96, 1, 5, 5], "float32"], 2, "SAME", 1, "float32"], {}], "config": {"index": 7215, "code_hash": null, "entity": [["tile_f", "sp", [-1, 1, 12, 1]], ["tile_y", "sp", [-1, 1, 1, 1]], ["tile_x", "sp", [-1, 1, 1, 1]], ["auto_unroll_max_step", "ot", 1500], ["unroll_explicit", "ot", 1]]}, "result": [[0.061358219], 0, 10.840918064117432, 1638648986.6395688], "version": 0.2, "tvm_version": "0.9.dev0"}
{"input": ["rocm -keys=rocm,gpu -max_num_threads=256 -mcpu=gfx906 -mtriple=amdgcn-amd-amdhsa-hcc -thread_warp_size=64", "depthwise_conv2d_nchw.cuda", [["TENSOR", [128, 96, 165, 165], "float32"], ["TENSOR", [96, 1, 5, 5], "float32"], 2, "SAME", 1, "float32"], {}], "config": {"index": 7219, "code_hash": null, "entity": [["tile_f", "sp", [-1, 1, 16, 1]], ["tile_y", "sp", [-1, 1, 1, 1]], ["tile_x", "sp", [-1, 1, 1, 1]], ["auto_unroll_max_step", "ot", 1500], ["unroll_explicit", "ot", 1]]}, "result": [[0.06087162], 0, 10.451158046722412, 1638648996.6731298], "version": 0.2, "tvm_version": "0.9.dev0"}
{"input": ["rocm -keys=rocm,gpu -max_num_threads=256 -mcpu=gfx906 -mtriple=amdgcn-amd-amdhsa-hcc -thread_warp_size=64", "depthwise_conv2d_nchw.cuda", [["TENSOR", [128, 96, 165, 165], "float32"], ["TENSOR", [96, 1, 5, 5], "float32"], 2, "SAME", 1, "float32"], {}], "config": {"index": 3635, "code_hash": null, "entity": [["tile_f", "sp", [-1, 1, 16, 1]], ["tile_y", "sp", [-1, 1, 1, 1]], ["tile_x", "sp", [-1, 1, 1, 1]], ["auto_unroll_max_step", "ot", 256], ["unroll_explicit", "ot", 1]]}, "result": [[0.06086839275], 0, 10.926812648773193, 1638649006.735901], "version": 0.2, "tvm_version": "0.9.dev0"}
{"input": ["rocm -keys=rocm,gpu -max_num_threads=256 -mcpu=gfx906 -mtriple=amdgcn-amd-amdhsa-hcc -thread_warp_size=64", "depthwise_conv2d_nchw.cuda", [["TENSOR", [128, 96, 165, 165], "float32"], ["TENSOR", [96, 1, 5, 5], "float32"], 2, "SAME", 1, "float32"], {}], "config": {"index": 7264, "code_hash": null, "entity": [["tile_f", "sp", [-1, 1, 8, 2]], ["tile_y", "sp", [-1, 1, 1, 1]], ["tile_x", "sp", [-1, 1, 1, 1]], ["auto_unroll_max_step", "ot", 1500], ["unroll_explicit", "ot", 1]]}, "result": [[0.0998515625], 0, 11.005736589431763, 1638649016.945835], "version": 0.2, "tvm_version": "0.9.dev0"}
{"input": ["rocm -keys=rocm,gpu -max_num_threads=256 -mcpu=gfx906 -mtriple=amdgcn-amd-amdhsa-hcc -thread_warp_size=64", "depthwise_conv2d_nchw.cuda", [["TENSOR", [128, 96, 165, 165], "float32"], ["TENSOR", [96, 1, 5, 5], "float32"], 2, "SAME", 1, "float32"], {}], "config": {"index": 3676, "code_hash": null, "entity": [["tile_f", "sp", [-1, 1, 6, 2]], ["tile_y", "sp", [-1, 1, 1, 1]], ["tile_x", "sp", [-1, 1, 1, 1]], ["auto_unroll_max_step", "ot", 256], ["unroll_explicit", "ot", 1]]}, "result": [[0.10085057825], 0, 10.968650817871094, 1638649027.1986809], "version": 0.2, "tvm_version": "0.9.dev0"}
{"input": ["rocm -keys=rocm,gpu -max_num_threads=256 -mcpu=gfx906 -mtriple=amdgcn-amd-amdhsa-hcc -thread_warp_size=64", "depthwise_conv2d_nchw.cuda", [["TENSOR", [128, 96, 165, 165], "float32"], ["TENSOR", [96, 1, 5, 5], "float32"], 2, "SAME", 1, "float32"], {}], "config": {"index": 3680, "code_hash": null, "entity": [["tile_f", "sp", [-1, 1, 8, 2]], ["tile_y", "sp", [-1, 1, 1, 1]], ["tile_x", "sp", [-1, 1, 1, 1]], ["auto_unroll_max_step", "ot", 256], ["unroll_explicit", "ot", 1]]}, "result": [[0.10078406499999999], 0, 11.066415309906006, 1638649037.5086558], "version": 0.2, "tvm_version": "0.9.dev0"}
{"input": ["rocm -keys=rocm,gpu -max_num_threads=256 -mcpu=gfx906 -mtriple=amdgcn-amd-amdhsa-hcc -thread_warp_size=64", "depthwise_conv2d_nchw.cuda", [["TENSOR", [128, 96, 165, 165], "float32"], ["TENSOR", [96, 1, 5, 5], "float32"], 2, "SAME", 1, "float32"], {}], "config": {"index": 7260, "code_hash": null, "entity": [["tile_f", "sp", [-1, 1, 6, 2]], ["tile_y", "sp", [-1, 1, 1, 1]], ["tile_x", "sp", [-1, 1, 1, 1]], ["auto_unroll_max_step", "ot", 1500], ["unroll_explicit", "ot", 1]]}, "result": [[0.100889328], 0, 11.057661294937134, 1638649047.7902362], "version": 0.2, "tvm_version": "0.9.dev0"}
{"input": ["rocm -keys=rocm,gpu -max_num_threads=256 -mcpu=gfx906 -mtriple=amdgcn-amd-amdhsa-hcc -thread_warp_size=64", "depthwise_conv2d_nchw.cuda", [["TENSOR", [128, 96, 165, 165], "float32"], ["TENSOR", [96, 1, 5, 5], "float32"], 2, "SAME", 1, "float32"], {}], "config": {"index": 36, "code_hash": null, "entity": [["tile_f", "sp", [-1, 1, 6, 1]], ["tile_y", "sp", [-1, 1, 1, 1]], ["tile_x", "sp", [-1, 1, 1, 1]], ["auto_unroll_max_step", "ot", 0], ["unroll_explicit", "ot", 1]]}, "result": [[0.139087387], 0, 10.950149059295654, 1638649058.238193], "version": 0.2, "tvm_version": "0.9.dev0"}
{"input": ["rocm -keys=rocm,gpu -max_num_threads=256 -mcpu=gfx906 -mtriple=amdgcn-amd-amdhsa-hcc -thread_warp_size=64", "depthwise_conv2d_nchw.cuda", [["TENSOR", [128, 96, 165, 165], "float32"], ["TENSOR", [96, 1, 5, 5], "float32"], 2, "SAME", 1, "float32"], {}], "config": {"index": 3613, "code_hash": null, "entity": [["tile_f", "sp", [-1, 2, 4, 1]], ["tile_y", "sp", [-1, 1, 1, 1]], ["tile_x", "sp", [-1, 1, 1, 1]], ["auto_unroll_max_step", "ot", 256], ["unroll_explicit", "ot", 1]]}, "result": [[0.1217176895], 0, 13.26693606376648, 1638649070.4674754], "version": 0.2, "tvm_version": "0.9.dev0"}
{"input": ["rocm -keys=rocm,gpu -max_num_threads=256 -mcpu=gfx906 -mtriple=amdgcn-amd-amdhsa-hcc -thread_warp_size=64", "depthwise_conv2d_nchw.cuda", [["TENSOR", [128, 96, 165, 165], "float32"], ["TENSOR", [96, 1, 5, 5], "float32"], 2, "SAME", 1, "float32"], {}], "config": {"index": 7197, "code_hash": null, "entity": [["tile_f", "sp", [-1, 2, 4, 1]], ["tile_y", "sp", [-1, 1, 1, 1]], ["tile_x", "sp", [-1, 1, 1, 1]], ["auto_unroll_max_step", "ot", 1500], ["unroll_explicit", "ot", 1]]}, "result": [[0.121735626], 0, 16.615415573120117, 1638649085.9712374], "version": 0.2, "tvm_version": "0.9.dev0"}
{"input": ["rocm -keys=rocm,gpu -max_num_threads=256 -mcpu=gfx906 -mtriple=amdgcn-amd-amdhsa-hcc -thread_warp_size=64", "depthwise_conv2d_nchw.cuda", [["TENSOR", [128, 96, 165, 165], "float32"], ["TENSOR", [96, 1, 5, 5], "float32"], 2, "SAME", 1, "float32"], {}], "config": {"index": 7205, "code_hash": null, "entity": [["tile_f", "sp", [-1, 2, 6, 1]], ["tile_y", "sp", [-1, 1, 1, 1]], ["tile_x", "sp", [-1, 1, 1, 1]], ["auto_unroll_max_step", "ot", 1500], ["unroll_explicit", "ot", 1]]}, "result": [[0.0990401915], 0, 14.293086528778076, 1638649099.1670914], "version": 0.2, "tvm_version": "0.9.dev0"}
{"input": ["rocm -keys=rocm,gpu -max_num_threads=256 -mcpu=gfx906 -mtriple=amdgcn-amd-amdhsa-hcc -thread_warp_size=64", "depthwise_conv2d_nchw.cuda", [["TENSOR", [128, 96, 165, 165], "float32"], ["TENSOR", [96, 1, 5, 5], "float32"], 2, "SAME", 1, "float32"], {}], "config": {"index": 3621, "code_hash": null, "entity": [["tile_f", "sp", [-1, 2, 6, 1]], ["tile_y", "sp", [-1, 1, 1, 1]], ["tile_x", "sp", [-1, 1, 1, 1]], ["auto_unroll_max_step", "ot", 256], ["unroll_explicit", "ot", 1]]}, "result": [[0.10126193225], 0, 12.654465675354004, 1638649110.768347], "version": 0.2, "tvm_version": "0.9.dev0"}
{"input": ["rocm -keys=rocm,gpu -max_num_threads=256 -mcpu=gfx906 -mtriple=amdgcn-amd-amdhsa-hcc -thread_warp_size=64", "depthwise_conv2d_nchw.cuda", [["TENSOR", [128, 96, 165, 165], "float32"], ["TENSOR", [96, 1, 5, 5], "float32"], 2, "SAME", 1, "float32"], {}], "config": {"index": 3670, "code_hash": null, "entity": [["tile_f", "sp", [-1, 1, 4, 2]], ["tile_y", "sp", [-1, 1, 1, 1]], ["tile_x", "sp", [-1, 1, 1, 1]], ["auto_unroll_max_step", "ot", 256], ["unroll_explicit", "ot", 1]]}, "result": [[0.12537268825], 0, 11.389862060546875, 1638649121.1135254], "version": 0.2, "tvm_version": "0.9.dev0"}
{"input": ["rocm -keys=rocm,gpu -max_num_threads=256 -mcpu=gfx906 -mtriple=amdgcn-amd-amdhsa-hcc -thread_warp_size=64", "depthwise_conv2d_nchw.cuda", [["TENSOR", [128, 96, 165, 165], "float32"], ["TENSOR", [96, 1, 5, 5], "float32"], 2, "SAME", 1, "float32"], {}], "config": {"index": 7254, "code_hash": null, "entity": [["tile_f", "sp", [-1, 1, 4, 2]], ["tile_y", "sp", [-1, 1, 1, 1]], ["tile_x", "sp", [-1, 1, 1, 1]], ["auto_unroll_max_step", "ot", 1500], ["unroll_explicit", "ot", 1]]}, "result": [[0.12532672875], 0, 11.325063228607178, 1638649131.4839466], "version": 0.2, "tvm_version": "0.9.dev0"}
{"input": ["rocm -keys=rocm,gpu -max_num_threads=256 -mcpu=gfx906 -mtriple=amdgcn-amd-amdhsa-hcc -thread_warp_size=64", "depthwise_conv2d_nchw.cuda", [["TENSOR", [128, 96, 165, 165], "float32"], ["TENSOR", [96, 1, 5, 5], "float32"], 2, "SAME", 1, "float32"], {}], "config": {"index": 41, "code_hash": null, "entity": [["tile_f", "sp", [-1, 1, 8, 1]], ["tile_y", "sp", [-1, 1, 1, 1]], ["tile_x", "sp", [-1, 1, 1, 1]], ["auto_unroll_max_step", "ot", 0], ["unroll_explicit", "ot", 1]]}, "result": [[0.11478698725], 0, 11.927868366241455, 1638649142.8584688], "version": 0.2, "tvm_version": "0.9.dev0"}
{"input": ["rocm -keys=rocm,gpu -max_num_threads=256 -mcpu=gfx906 -mtriple=amdgcn-amd-amdhsa-hcc -thread_warp_size=64", "depthwise_conv2d_nchw.cuda", [["TENSOR", [128, 96, 165, 165], "float32"], ["TENSOR", [96, 1, 5, 5], "float32"], 2, "SAME", 1, "float32"], {}], "config": {"index": 5376, "code_hash": null, "entity": [["tile_f", "sp", [-1, 1, 1, 1]], ["tile_y", "sp", [-1, 1, 1, 1]], ["tile_x", "sp", [-1, 1, 83, 1]], ["auto_unroll_max_step", "ot", 256], ["unroll_explicit", "ot", 1]]}, "result": [[0.0065025153125], 0, 10.335229396820068, 1638649152.6968284], "version": 0.2, "tvm_version": "0.9.dev0"}
{"input": ["rocm -keys=rocm,gpu -max_num_threads=256 -mcpu=gfx906 -mtriple=amdgcn-amd-amdhsa-hcc -thread_warp_size=64", "depthwise_conv2d_nchw.cuda", [["TENSOR", [128, 96, 165, 165], "float32"], ["TENSOR", [96, 1, 5, 5], "float32"], 2, "SAME", 1, "float32"], {}], "config": {"index": 8960, "code_hash": null, "entity": [["tile_f", "sp", [-1, 1, 1, 1]], ["tile_y", "sp", [-1, 1, 1, 1]], ["tile_x", "sp", [-1, 1, 83, 1]], ["auto_unroll_max_step", "ot", 1500], ["unroll_explicit", "ot", 1]]}, "result": [[0.00650310275], 0, 10.392367362976074, 1638649162.5368204], "version": 0.2, "tvm_version": "0.9.dev0"}
{"input": ["rocm -keys=rocm,gpu -max_num_threads=256 -mcpu=gfx906 -mtriple=amdgcn-amd-amdhsa-hcc -thread_warp_size=64", "depthwise_conv2d_nchw.cuda", [["TENSOR", [128, 96, 165, 165], "float32"], ["TENSOR", [96, 1, 5, 5], "float32"], 2, "SAME", 1, "float32"], {}], "config": {"index": 28, "code_hash": null, "entity": [["tile_f", "sp", [-1, 1, 4, 1]], ["tile_y", "sp", [-1, 1, 1, 1]], ["tile_x", "sp", [-1, 1, 1, 1]], ["auto_unroll_max_step", "ot", 0], ["unroll_explicit", "ot", 1]]}, "result": [[0.23867803950000002], 0, 11.581033945083618, 1638649173.4186742], "version": 0.2, "tvm_version": "0.9.dev0"}
{"input": ["rocm -keys=rocm,gpu -max_num_threads=256 -mcpu=gfx906 -mtriple=amdgcn-amd-amdhsa-hcc -thread_warp_size=64", "depthwise_conv2d_nchw.cuda", [["TENSOR", [128, 96, 165, 165], "float32"], ["TENSOR", [96, 1, 5, 5], "float32"], 2, "SAME", 1, "float32"], {}], "config": {"index": 7199, "code_hash": null, "entity": [["tile_f", "sp", [-1, 4, 4, 1]], ["tile_y", "sp", [-1, 1, 1, 1]], ["tile_x", "sp", [-1, 1, 1, 1]], ["auto_unroll_max_step", "ot", 1500], ["unroll_explicit", "ot", 1]]}, "result": [[0.17841577125], 0, 11.977855205535889, 1638649184.0441453], "version": 0.2, "tvm_version": "0.9.dev0"}
{"input": ["rocm -keys=rocm,gpu -max_num_threads=256 -mcpu=gfx906 -mtriple=amdgcn-amd-amdhsa-hcc -thread_warp_size=64", "depthwise_conv2d_nchw.cuda", [["TENSOR", [128, 96, 165, 165], "float32"], ["TENSOR", [96, 1, 5, 5], "float32"], 2, "SAME", 1, "float32"], {}], "config": {"index": 3615, "code_hash": null, "entity": [["tile_f", "sp", [-1, 4, 4, 1]], ["tile_y", "sp", [-1, 1, 1, 1]], ["tile_x", "sp", [-1, 1, 1, 1]], ["auto_unroll_max_step", "ot", 256], ["unroll_explicit", "ot", 1]]}, "result": [[0.17833230574999998], 0, 11.984964609146118, 1638649194.6508503], "version": 0.2, "tvm_version": "0.9.dev0"}
{"input": ["rocm -keys=rocm,gpu -max_num_threads=256 -mcpu=gfx906 -mtriple=amdgcn-amd-amdhsa-hcc -thread_warp_size=64", "depthwise_conv2d_nchw.cuda", [["TENSOR", [128, 96, 165, 165], "float32"], ["TENSOR", [96, 1, 5, 5], "float32"], 2, "SAME", 1, "float32"], {}], "config": {"index": 7198, "code_hash": null, "entity": [["tile_f", "sp", [-1, 3, 4, 1]], ["tile_y", "sp", [-1, 1, 1, 1]], ["tile_x", "sp", [-1, 1, 1, 1]], ["auto_unroll_max_step", "ot", 1500], ["unroll_explicit", "ot", 1]]}, "result": [[0.14380290199999998], 0, 11.635456085205078, 1638649205.144652], "version": 0.2, "tvm_version": "0.9.dev0"}
{"input": ["rocm -keys=rocm,gpu -max_num_threads=256 -mcpu=gfx906 -mtriple=amdgcn-amd-amdhsa-hcc -thread_warp_size=64", "depthwise_conv2d_nchw.cuda", [["TENSOR", [128, 96, 165, 165], "float32"], ["TENSOR", [96, 1, 5, 5], "float32"], 2, "SAME", 1, "float32"], {}], "config": {"index": 3614, "code_hash": null, "entity": [["tile_f", "sp", [-1, 3, 4, 1]], ["tile_y", "sp", [-1, 1, 1, 1]], ["tile_x", "sp", [-1, 1, 1, 1]], ["auto_unroll_max_step", "ot", 256], ["unroll_explicit", "ot", 1]]}, "result": [[0.14055639625], 0, 13.313271045684814, 1638649217.2578745], "version": 0.2, "tvm_version": "0.9.dev0"}
{"input": ["rocm -keys=rocm,gpu -max_num_threads=256 -mcpu=gfx906 -mtriple=amdgcn-amd-amdhsa-hcc -thread_warp_size=64", "depthwise_conv2d_nchw.cuda", [["TENSOR", [128, 96, 165, 165], "float32"], ["TENSOR", [96, 1, 5, 5], "float32"], 2, "SAME", 1, "float32"], {}], "config": {"index": 3626, "code_hash": null, "entity": [["tile_f", "sp", [-1, 2, 8, 1]], ["tile_y", "sp", [-1, 1, 1, 1]], ["tile_x", "sp", [-1, 1, 1, 1]], ["auto_unroll_max_step", "ot", 256], ["unroll_explicit", "ot", 1]]}, "result": [[0.0977027815], 0, 16.485767364501953, 1638649232.7406309], "version": 0.2, "tvm_version": "0.9.dev0"}
{"input": ["rocm -keys=rocm,gpu -max_num_threads=256 -mcpu=gfx906 -mtriple=amdgcn-amd-amdhsa-hcc -thread_warp_size=64", "depthwise_conv2d_nchw.cuda", [["TENSOR", [128, 96, 165, 165], "float32"], ["TENSOR", [96, 1, 5, 5], "float32"], 2, "SAME", 1, "float32"], {}], "config": {"index": 7210, "code_hash": null, "entity": [["tile_f", "sp", [-1, 2, 8, 1]], ["tile_y", "sp", [-1, 1, 1, 1]], ["tile_x", "sp", [-1, 1, 1, 1]], ["auto_unroll_max_step", "ot", 1500], ["unroll_explicit", "ot", 1]]}, "result": [[0.0999335325], 0, 17.55066204071045, 1638649249.216883], "version": 0.2, "tvm_version": "0.9.dev0"}
{"input": ["rocm -keys=rocm,gpu -max_num_threads=256 -mcpu=gfx906 -mtriple=amdgcn-amd-amdhsa-hcc -thread_warp_size=64", "depthwise_conv2d_nchw.cuda", [["TENSOR", [128, 96, 165, 165], "float32"], ["TENSOR", [96, 1, 5, 5], "float32"], 2, "SAME", 1, "float32"], {}], "config": {"index": 47, "code_hash": null, "entity": [["tile_f", "sp", [-1, 1, 12, 1]], ["tile_y", "sp", [-1, 1, 1, 1]], ["tile_x", "sp", [-1, 1, 1, 1]], ["auto_unroll_max_step", "ot", 0], ["unroll_explicit", "ot", 1]]}, "result": [[0.07317420175], 0, 15.51848030090332, 1638649263.9726937], "version": 0.2, "tvm_version": "0.9.dev0"}
{"input": ["rocm -keys=rocm,gpu -max_num_threads=256 -mcpu=gfx906 -mtriple=amdgcn-amd-amdhsa-hcc -thread_warp_size=64", "depthwise_conv2d_nchw.cuda", [["TENSOR", [128, 96, 165, 165], "float32"], ["TENSOR", [96, 1, 5, 5], "float32"], 2, "SAME", 1, "float32"], {}], "config": {"index": 51, "code_hash": null, "entity": [["tile_f", "sp", [-1, 1, 16, 1]], ["tile_y", "sp", [-1, 1, 1, 1]], ["tile_x", "sp", [-1, 1, 1, 1]], ["auto_unroll_max_step", "ot", 0], ["unroll_explicit", "ot", 1]]}, "result": [[0.06914344775], 0, 14.998414993286133, 1638649278.241009], "version": 0.2, "tvm_version": "0.9.dev0"}
{"input": ["rocm -keys=rocm,gpu -max_num_threads=256 -mcpu=gfx906 -mtriple=amdgcn-amd-amdhsa-hcc -thread_warp_size=64", "depthwise_conv2d_nchw.cuda", [["TENSOR", [128, 96, 165, 165], "float32"], ["TENSOR", [96, 1, 5, 5], "float32"], 2, "SAME", 1, "float32"], {}], "config": {"index": 92, "code_hash": null, "entity": [["tile_f", "sp", [-1, 1, 6, 2]], ["tile_y", "sp", [-1, 1, 1, 1]], ["tile_x", "sp", [-1, 1, 1, 1]], ["auto_unroll_max_step", "ot", 0], ["unroll_explicit", "ot", 1]]}, "result": [[0.15710585], 0, 12.926803827285767, 1638649290.4892526], "version": 0.2, "tvm_version": "0.9.dev0"}
{"input": ["rocm -keys=rocm,gpu -max_num_threads=256 -mcpu=gfx906 -mtriple=amdgcn-amd-amdhsa-hcc -thread_warp_size=64", "depthwise_conv2d_nchw.cuda", [["TENSOR", [128, 96, 165, 165], "float32"], ["TENSOR", [96, 1, 5, 5], "float32"], 2, "SAME", 1, "float32"], {}], "config": {"index": 96, "code_hash": null, "entity": [["tile_f", "sp", [-1, 1, 8, 2]], ["tile_y", "sp", [-1, 1, 1, 1]], ["tile_x", "sp", [-1, 1, 1, 1]], ["auto_unroll_max_step", "ot", 0], ["unroll_explicit", "ot", 1]]}, "result": [[0.1372387695], 0, 11.436504364013672, 1638649301.2333653], "version": 0.2, "tvm_version": "0.9.dev0"}
{"input": ["rocm -keys=rocm,gpu -max_num_threads=256 -mcpu=gfx906 -mtriple=amdgcn-amd-amdhsa-hcc -thread_warp_size=64", "depthwise_conv2d_nchw.cuda", [["TENSOR", [128, 96, 165, 165], "float32"], ["TENSOR", [96, 1, 5, 5], "float32"], 2, "SAME", 1, "float32"], {}], "config": {"index": 5377, "code_hash": null, "entity": [["tile_f", "sp", [-1, 2, 1, 1]], ["tile_y", "sp", [-1, 1, 1, 1]], ["tile_x", "sp", [-1, 1, 83, 1]], ["auto_unroll_max_step", "ot", 256], ["unroll_explicit", "ot", 1]]}, "result": [[0.009645850363636363], 0, 10.666326761245728, 1638649311.1421766], "version": 0.2, "tvm_version": "0.9.dev0"}
{"input": ["rocm -keys=rocm,gpu -max_num_threads=256 -mcpu=gfx906 -mtriple=amdgcn-amd-amdhsa-hcc -thread_warp_size=64", "depthwise_conv2d_nchw.cuda", [["TENSOR", [128, 96, 165, 165], "float32"], ["TENSOR", [96, 1, 5, 5], "float32"], 2, "SAME", 1, "float32"], {}], "config": {"index": 8961, "code_hash": null, "entity": [["tile_f", "sp", [-1, 2, 1, 1]], ["tile_y", "sp", [-1, 1, 1, 1]], ["tile_x", "sp", [-1, 1, 83, 1]], ["auto_unroll_max_step", "ot", 1500], ["unroll_explicit", "ot", 1]]}, "result": [[0.009644779545454545], 0, 10.669434070587158, 1638649321.0322096], "version": 0.2, "tvm_version": "0.9.dev0"}
{"input": ["rocm -keys=rocm,gpu -max_num_threads=256 -mcpu=gfx906 -mtriple=amdgcn-amd-amdhsa-hcc -thread_warp_size=64", "depthwise_conv2d_nchw.cuda", [["TENSOR", [128, 96, 165, 165], "float32"], ["TENSOR", [96, 1, 5, 5], "float32"], 2, "SAME", 1, "float32"], {}], "config": {"index": 7255, "code_hash": null, "entity": [["tile_f", "sp", [-1, 2, 4, 2]], ["tile_y", "sp", [-1, 1, 1, 1]], ["tile_x", "sp", [-1, 1, 1, 1]], ["auto_unroll_max_step", "ot", 1500], ["unroll_explicit", "ot", 1]]}, "result": [[0.17725064075], 0, 11.79343032836914, 1638649331.6300485], "version": 0.2, "tvm_version": "0.9.dev0"}
{"input": ["rocm -keys=rocm,gpu -max_num_threads=256 -mcpu=gfx906 -mtriple=amdgcn-amd-amdhsa-hcc -thread_warp_size=64", "depthwise_conv2d_nchw.cuda", [["TENSOR", [128, 96, 165, 165], "float32"], ["TENSOR", [96, 1, 5, 5], "float32"], 2, "SAME", 1, "float32"], {}], "config": {"index": 3671, "code_hash": null, "entity": [["tile_f", "sp", [-1, 2, 4, 2]], ["tile_y", "sp", [-1, 1, 1, 1]], ["tile_x", "sp", [-1, 1, 1, 1]], ["auto_unroll_max_step", "ot", 256], ["unroll_explicit", "ot", 1]]}, "result": [[0.177129776], 0, 11.949140787124634, 1638649342.3245673], "version": 0.2, "tvm_version": "0.9.dev0"}
{"input": ["rocm -keys=rocm,gpu -max_num_threads=256 -mcpu=gfx906 -mtriple=amdgcn-amd-amdhsa-hcc -thread_warp_size=64", "depthwise_conv2d_nchw.cuda", [["TENSOR", [128, 96, 165, 165], "float32"], ["TENSOR", [96, 1, 5, 5], "float32"], 2, "SAME", 1, "float32"], {}], "config": {"index": 29, "code_hash": null, "entity": [["tile_f", "sp", [-1, 2, 4, 1]], ["tile_y", "sp", [-1, 1, 1, 1]], ["tile_x", "sp", [-1, 1, 1, 1]], ["auto_unroll_max_step", "ot", 0], ["unroll_explicit", "ot", 1]]}, "result": [[0.22565524275], 0, 11.695708513259888, 1638649353.273622], "version": 0.2, "tvm_version": "0.9.dev0"}
{"input": ["rocm -keys=rocm,gpu -max_num_threads=256 -mcpu=gfx906 -mtriple=amdgcn-amd-amdhsa-hcc -thread_warp_size=64", "depthwise_conv2d_nchw.cuda", [["TENSOR", [128, 96, 165, 165], "float32"], ["TENSOR", [96, 1, 5, 5], "float32"], 2, "SAME", 1, "float32"], {}], "config": {"index": 5379, "code_hash": null, "entity": [["tile_f", "sp", [-1, 4, 1, 1]], ["tile_y", "sp", [-1, 1, 1, 1]], ["tile_x", "sp", [-1, 1, 83, 1]], ["auto_unroll_max_step", "ot", 256], ["unroll_explicit", "ot", 1]]}, "result": [[0.018209709166666668], 0, 11.067572593688965, 1638649363.4019928], "version": 0.2, "tvm_version": "0.9.dev0"}
{"input": ["rocm -keys=rocm,gpu -max_num_threads=256 -mcpu=gfx906 -mtriple=amdgcn-amd-amdhsa-hcc -thread_warp_size=64", "depthwise_conv2d_nchw.cuda", [["TENSOR", [128, 96, 165, 165], "float32"], ["TENSOR", [96, 1, 5, 5], "float32"], 2, "SAME", 1, "float32"], {}], "config": {"index": 5380, "code_hash": null, "entity": [["tile_f", "sp", [-1, 6, 1, 1]], ["tile_y", "sp", [-1, 1, 1, 1]], ["tile_x", "sp", [-1, 1, 83, 1]], ["auto_unroll_max_step", "ot", 256], ["unroll_explicit", "ot", 1]]}, "result": [[0.023305025666666663], 0, 12.638813734054565, 1638649375.1401432], "version": 0.2, "tvm_version": "0.9.dev0"}
{"input": ["rocm -keys=rocm,gpu -max_num_threads=256 -mcpu=gfx906 -mtriple=amdgcn-amd-amdhsa-hcc -thread_warp_size=64", "depthwise_conv2d_nchw.cuda", [["TENSOR", [128, 96, 165, 165], "float32"], ["TENSOR", [96, 1, 5, 5], "float32"], 2, "SAME", 1, "float32"], {}], "config": {"index": 5381, "code_hash": null, "entity": [["tile_f", "sp", [-1, 8, 1, 1]], ["tile_y", "sp", [-1, 1, 1, 1]], ["tile_x", "sp", [-1, 1, 83, 1]], ["auto_unroll_max_step", "ot", 256], ["unroll_explicit", "ot", 1]]}, "result": [[0.03327182], 0, 12.71597671508789, 1638649386.8376791], "version": 0.2, "tvm_version": "0.9.dev0"}
{"input": ["rocm -keys=rocm,gpu -max_num_threads=256 -mcpu=gfx906 -mtriple=amdgcn-amd-amdhsa-hcc -thread_warp_size=64", "depthwise_conv2d_nchw.cuda", [["TENSOR", [128, 96, 165, 165], "float32"], ["TENSOR", [96, 1, 5, 5], "float32"], 2, "SAME", 1, "float32"], {}], "config": {"index": 8965, "code_hash": null, "entity": [["tile_f", "sp", [-1, 8, 1, 1]], ["tile_y", "sp", [-1, 1, 1, 1]], ["tile_x", "sp", [-1, 1, 83, 1]], ["auto_unroll_max_step", "ot", 1500], ["unroll_explicit", "ot", 1]]}, "result": [[0.033183296], 0, 13.244565963745117, 1638649398.9967256], "version": 0.2, "tvm_version": "0.9.dev0"}
{"input": ["rocm -keys=rocm,gpu -max_num_threads=256 -mcpu=gfx906 -mtriple=amdgcn-amd-amdhsa-hcc -thread_warp_size=64", "depthwise_conv2d_nchw.cuda", [["TENSOR", [128, 96, 165, 165], "float32"], ["TENSOR", [96, 1, 5, 5], "float32"], 2, "SAME", 1, "float32"], {}], "config": {"index": 8963, "code_hash": null, "entity": [["tile_f", "sp", [-1, 4, 1, 1]], ["tile_y", "sp", [-1, 1, 1, 1]], ["tile_x", "sp", [-1, 1, 83, 1]], ["auto_unroll_max_step", "ot", 1500], ["unroll_explicit", "ot", 1]]}, "result": [[0.018182793833333332], 0, 14.609029531478882, 1638649412.9447043], "version": 0.2, "tvm_version": "0.9.dev0"}
{"input": ["rocm -keys=rocm,gpu -max_num_threads=256 -mcpu=gfx906 -mtriple=amdgcn-amd-amdhsa-hcc -thread_warp_size=64", "depthwise_conv2d_nchw.cuda", [["TENSOR", [128, 96, 165, 165], "float32"], ["TENSOR", [96, 1, 5, 5], "float32"], 2, "SAME", 1, "float32"], {}], "config": {"index": 8964, "code_hash": null, "entity": [["tile_f", "sp", [-1, 6, 1, 1]], ["tile_y", "sp", [-1, 1, 1, 1]], ["tile_x", "sp", [-1, 1, 83, 1]], ["auto_unroll_max_step", "ot", 1500], ["unroll_explicit", "ot", 1]]}, "result": [[0.023287142333333333], 0, 15.005633115768433, 1638649427.0596797], "version": 0.2, "tvm_version": "0.9.dev0"}
{"input": ["rocm -keys=rocm,gpu -max_num_threads=256 -mcpu=gfx906 -mtriple=amdgcn-amd-amdhsa-hcc -thread_warp_size=64", "depthwise_conv2d_nchw.cuda", [["TENSOR", [128, 96, 165, 165], "float32"], ["TENSOR", [96, 1, 5, 5], "float32"], 2, "SAME", 1, "float32"], {}], "config": {"index": 37, "code_hash": null, "entity": [["tile_f", "sp", [-1, 2, 6, 1]], ["tile_y", "sp", [-1, 1, 1, 1]], ["tile_x", "sp", [-1, 1, 1, 1]], ["auto_unroll_max_step", "ot", 0], ["unroll_explicit", "ot", 1]]}, "result": [[0.1589372405], 0, 15.152491807937622, 1638649441.8307571], "version": 0.2, "tvm_version": "0.9.dev0"}
{"input": ["rocm -keys=rocm,gpu -max_num_threads=256 -mcpu=gfx906 -mtriple=amdgcn-amd-amdhsa-hcc -thread_warp_size=64", "depthwise_conv2d_nchw.cuda", [["TENSOR", [128, 96, 165, 165], "float32"], ["TENSOR", [96, 1, 5, 5], "float32"], 2, "SAME", 1, "float32"], {}], "config": {"index": 86, "code_hash": null, "entity": [["tile_f", "sp", [-1, 1, 4, 2]], ["tile_y", "sp", [-1, 1, 1, 1]], ["tile_x", "sp", [-1, 1, 1, 1]], ["auto_unroll_max_step", "ot", 0], ["unroll_explicit", "ot", 1]]}, "result": [[0.22259129325000002], 0, 15.27100658416748, 1638649456.725072], "version": 0.2, "tvm_version": "0.9.dev0"}
{"input": ["rocm -keys=rocm,gpu -max_num_threads=256 -mcpu=gfx906 -mtriple=amdgcn-amd-amdhsa-hcc -thread_warp_size=64", "depthwise_conv2d_nchw.cuda", [["TENSOR", [128, 96, 165, 165], "float32"], ["TENSOR", [96, 1, 5, 5], "float32"], 2, "SAME", 1, "float32"], {}], "config": {"index": 1792, "code_hash": null, "entity": [["tile_f", "sp", [-1, 1, 1, 1]], ["tile_y", "sp", [-1, 1, 1, 1]], ["tile_x", "sp", [-1, 1, 83, 1]], ["auto_unroll_max_step", "ot", 0], ["unroll_explicit", "ot", 1]]}, "result": [[0.007155543714285714], 0, 10.134397745132446, 1638649480.5196378], "version": 0.2, "tvm_version": "0.9.dev0"}
{"input": ["rocm -keys=rocm,gpu -max_num_threads=256 -mcpu=gfx906 -mtriple=amdgcn-amd-amdhsa-hcc -thread_warp_size=64", "depthwise_conv2d_nchw.cuda", [["TENSOR", [128, 96, 165, 165], "float32"], ["TENSOR", [96, 1, 5, 5], "float32"], 2, "SAME", 1, "float32"], {}], "config": {"index": 8982, "code_hash": null, "entity": [["tile_f", "sp", [-1, 1, 3, 1]], ["tile_y", "sp", [-1, 1, 1, 1]], ["tile_x", "sp", [-1, 1, 83, 1]], ["auto_unroll_max_step", "ot", 1500], ["unroll_explicit", "ot", 1]]}, "result": [[0.006452555624999999], 0, 10.355520963668823, 1638649490.4952953], "version": 0.2, "tvm_version": "0.9.dev0"}
{"input": ["rocm -keys=rocm,gpu -max_num_threads=256 -mcpu=gfx906 -mtriple=amdgcn-amd-amdhsa-hcc -thread_warp_size=64", "depthwise_conv2d_nchw.cuda", [["TENSOR", [128, 96, 165, 165], "float32"], ["TENSOR", [96, 1, 5, 5], "float32"], 2, "SAME", 1, "float32"], {}], "config": {"index": 8972, "code_hash": null, "entity": [["tile_f", "sp", [-1, 1, 2, 1]], ["tile_y", "sp", [-1, 1, 1, 1]], ["tile_x", "sp", [-1, 1, 83, 1]], ["auto_unroll_max_step", "ot", 1500], ["unroll_explicit", "ot", 1]]}, "result": [[0.006653543458333334], 0, 10.390018224716187, 1638649500.5976295], "version": 0.2, "tvm_version": "0.9.dev0"}
{"input": ["rocm -keys=rocm,gpu -max_num_threads=256 -mcpu=gfx906 -mtriple=amdgcn-amd-amdhsa-hcc -thread_warp_size=64", "depthwise_conv2d_nchw.cuda", [["TENSOR", [128, 96, 165, 165], "float32"], ["TENSOR", [96, 1, 5, 5], "float32"], 2, "SAME", 1, "float32"], {}], "config": {"index": 8988, "code_hash": null, "entity": [["tile_f", "sp", [-1, 1, 4, 1]], ["tile_y", "sp", [-1, 1, 1, 1]], ["tile_x", "sp", [-1, 1, 83, 1]], ["auto_unroll_max_step", "ot", 1500], ["unroll_explicit", "ot", 1]]}, "result": [[0.007624154214285714], 0, 10.215762615203857, 1638649510.4846463], "version": 0.2, "tvm_version": "0.9.dev0"}
{"input": ["rocm -keys=rocm,gpu -max_num_threads=256 -mcpu=gfx906 -mtriple=amdgcn-amd-amdhsa-hcc -thread_warp_size=64", "depthwise_conv2d_nchw.cuda", [["TENSOR", [128, 96, 165, 165], "float32"], ["TENSOR", [96, 1, 5, 5], "float32"], 2, "SAME", 1, "float32"], {}], "config": {"index": 8962, "code_hash": null, "entity": [["tile_f", "sp", [-1, 3, 1, 1]], ["tile_y", "sp", [-1, 1, 1, 1]], ["tile_x", "sp", [-1, 1, 83, 1]], ["auto_unroll_max_step", "ot", 1500], ["unroll_explicit", "ot", 1]]}, "result": [[0.012993304249999999], 0, 10.348166704177856, 1638649520.456501], "version": 0.2, "tvm_version": "0.9.dev0"}
{"input": ["rocm -keys=rocm,gpu -max_num_threads=256 -mcpu=gfx906 -mtriple=amdgcn-amd-amdhsa-hcc -thread_warp_size=64", "depthwise_conv2d_nchw.cuda", [["TENSOR", [128, 96, 165, 165], "float32"], ["TENSOR", [96, 1, 5, 5], "float32"], 2, "SAME", 1, "float32"], {}], "config": {"index": 5398, "code_hash": null, "entity": [["tile_f", "sp", [-1, 1, 3, 1]], ["tile_y", "sp", [-1, 1, 1, 1]], ["tile_x", "sp", [-1, 1, 83, 1]], ["auto_unroll_max_step", "ot", 256], ["unroll_explicit", "ot", 1]]}, "result": [[0.0064547753125], 0, 10.18018651008606, 1638649530.338279], "version": 0.2, "tvm_version": "0.9.dev0"}
{"input": ["rocm -keys=rocm,gpu -max_num_threads=256 -mcpu=gfx906 -mtriple=amdgcn-amd-amdhsa-hcc -thread_warp_size=64", "depthwise_conv2d_nchw.cuda", [["TENSOR", [128, 96, 165, 165], "float32"], ["TENSOR", [96, 1, 5, 5], "float32"], 2, "SAME", 1, "float32"], {}], "config": {"index": 5388, "code_hash": null, "entity": [["tile_f", "sp", [-1, 1, 2, 1]], ["tile_y", "sp", [-1, 1, 1, 1]], ["tile_x", "sp", [-1, 1, 83, 1]], ["auto_unroll_max_step", "ot", 256], ["unroll_explicit", "ot", 1]]}, "result": [[0.007027234375], 0, 10.672244310379028, 1638649540.562689], "version": 0.2, "tvm_version": "0.9.dev0"}
{"input": ["rocm -keys=rocm,gpu -max_num_threads=256 -mcpu=gfx906 -mtriple=amdgcn-amd-amdhsa-hcc -thread_warp_size=64", "depthwise_conv2d_nchw.cuda", [["TENSOR", [128, 96, 165, 165], "float32"], ["TENSOR", [96, 1, 5, 5], "float32"], 2, "SAME", 1, "float32"], {}], "config": {"index": 5404, "code_hash": null, "entity": [["tile_f", "sp", [-1, 1, 4, 1]], ["tile_y", "sp", [-1, 1, 1, 1]], ["tile_x", "sp", [-1, 1, 83, 1]], ["auto_unroll_max_step", "ot", 256], ["unroll_explicit", "ot", 1]]}, "result": [[0.0076286125], 0, 10.217246532440186, 1638649550.4729073], "version": 0.2, "tvm_version": "0.9.dev0"}
{"input": ["rocm -keys=rocm,gpu -max_num_threads=256 -mcpu=gfx906 -mtriple=amdgcn-amd-amdhsa-hcc -thread_warp_size=64", "depthwise_conv2d_nchw.cuda", [["TENSOR", [128, 96, 165, 165], "float32"], ["TENSOR", [96, 1, 5, 5], "float32"], 2, "SAME", 1, "float32"], {}], "config": {"index": 9023, "code_hash": null, "entity": [["tile_f", "sp", [-1, 1, 1, 2]], ["tile_y", "sp", [-1, 1, 1, 1]], ["tile_x", "sp", [-1, 1, 83, 1]], ["auto_unroll_max_step", "ot", 1500], ["unroll_explicit", "ot", 1]]}, "result": [[0.009485343909090909], 0, 10.363540649414062, 1638649560.4637265], "version": 0.2, "tvm_version": "0.9.dev0"}
{"input": ["rocm -keys=rocm,gpu -max_num_threads=256 -mcpu=gfx906 -mtriple=amdgcn-amd-amdhsa-hcc -thread_warp_size=64", "depthwise_conv2d_nchw.cuda", [["TENSOR", [128, 96, 165, 165], "float32"], ["TENSOR", [96, 1, 5, 5], "float32"], 2, "SAME", 1, "float32"], {}], "config": {"index": 5378, "code_hash": null, "entity": [["tile_f", "sp", [-1, 3, 1, 1]], ["tile_y", "sp", [-1, 1, 1, 1]], ["tile_x", "sp", [-1, 1, 83, 1]], ["auto_unroll_max_step", "ot", 256], ["unroll_explicit", "ot", 1]]}, "result": [[0.01299771975], 0, 10.660277843475342, 1638649570.4698162], "version": 0.2, "tvm_version": "0.9.dev0"}
{"input": ["rocm -keys=rocm,gpu -max_num_threads=256 -mcpu=gfx906 -mtriple=amdgcn-amd-amdhsa-hcc -thread_warp_size=64", "depthwise_conv2d_nchw.cuda", [["TENSOR", [128, 96, 165, 165], "float32"], ["TENSOR", [96, 1, 5, 5], "float32"], 2, "SAME", 1, "float32"], {}], "config": {"index": 5505, "code_hash": null, "entity": [["tile_f", "sp", [-1, 1, 1, 4]], ["tile_y", "sp", [-1, 1, 1, 1]], ["tile_x", "sp", [-1, 1, 83, 1]], ["auto_unroll_max_step", "ot", 256], ["unroll_explicit", "ot", 1]]}, "result": [[0.018122306666666668], 0, 11.32695722579956, 1638649581.0911703], "version": 0.2, "tvm_version": "0.9.dev0"}
{"input": ["rocm -keys=rocm,gpu -max_num_threads=256 -mcpu=gfx906 -mtriple=amdgcn-amd-amdhsa-hcc -thread_warp_size=64", "depthwise_conv2d_nchw.cuda", [["TENSOR", [128, 96, 165, 165], "float32"], ["TENSOR", [96, 1, 5, 5], "float32"], 2, "SAME", 1, "float32"], {}], "config": {"index": 5439, "code_hash": null, "entity": [["tile_f", "sp", [-1, 1, 1, 2]], ["tile_y", "sp", [-1, 1, 1, 1]], ["tile_x", "sp", [-1, 1, 83, 1]], ["auto_unroll_max_step", "ot", 256], ["unroll_explicit", "ot", 1]]}, "result": [[0.009475044181818182], 0, 10.469481945037842, 1638649591.1641462], "version": 0.2, "tvm_version": "0.9.dev0"}
{"input": ["rocm -keys=rocm,gpu -max_num_threads=256 -mcpu=gfx906 -mtriple=amdgcn-amd-amdhsa-hcc -thread_warp_size=64", "depthwise_conv2d_nchw.cuda", [["TENSOR", [128, 96, 165, 165], "float32"], ["TENSOR", [96, 1, 5, 5], "float32"], 2, "SAME", 1, "float32"], {}], "config": {"index": 1795, "code_hash": null, "entity": [["tile_f", "sp", [-1, 4, 1, 1]], ["tile_y", "sp", [-1, 1, 1, 1]], ["tile_x", "sp", [-1, 1, 83, 1]], ["auto_unroll_max_step", "ot", 0], ["unroll_explicit", "ot", 1]]}, "result": [[0.022436335166666665], 0, 10.391187191009521, 1638649601.1476722], "version": 0.2, "tvm_version": "0.9.dev0"}
{"input": ["rocm -keys=rocm,gpu -max_num_threads=256 -mcpu=gfx906 -mtriple=amdgcn-amd-amdhsa-hcc -thread_warp_size=64", "depthwise_conv2d_nchw.cuda", [["TENSOR", [128, 96, 165, 165], "float32"], ["TENSOR", [96, 1, 5, 5], "float32"], 2, "SAME", 1, "float32"], {}], "config": {"index": 8996, "code_hash": null, "entity": [["tile_f", "sp", [-1, 1, 6, 1]], ["tile_y", "sp", [-1, 1, 1, 1]], ["tile_x", "sp", [-1, 1, 83, 1]], ["auto_unroll_max_step", "ot", 1500], ["unroll_explicit", "ot", 1]]}, "result": [[0.006947197466666667], 0, 11.424185276031494, 1638649612.2070868], "version": 0.2, "tvm_version": "0.9.dev0"}
{"input": ["rocm -keys=rocm,gpu -max_num_threads=256 -mcpu=gfx906 -mtriple=amdgcn-amd-amdhsa-hcc -thread_warp_size=64", "depthwise_conv2d_nchw.cuda", [["TENSOR", [128, 96, 165, 165], "float32"], ["TENSOR", [96, 1, 5, 5], "float32"], 2, "SAME", 1, "float32"], {}], "config": {"index": 9089, "code_hash": null, "entity": [["tile_f", "sp", [-1, 1, 1, 4]], ["tile_y", "sp", [-1, 1, 1, 1]], ["tile_x", "sp", [-1, 1, 83, 1]], ["auto_unroll_max_step", "ot", 1500], ["unroll_explicit", "ot", 1]]}, "result": [[0.018124099666666667], 0, 10.874598503112793, 1638649622.4276652], "version": 0.2, "tvm_version": "0.9.dev0"}
{"input": ["rocm -keys=rocm,gpu -max_num_threads=256 -mcpu=gfx906 -mtriple=amdgcn-amd-amdhsa-hcc -thread_warp_size=64", "depthwise_conv2d_nchw.cuda", [["TENSOR", [128, 96, 165, 165], "float32"], ["TENSOR", [96, 1, 5, 5], "float32"], 2, "SAME", 1, "float32"], {}], "config": {"index": 9024, "code_hash": null, "entity": [["tile_f", "sp", [-1, 2, 1, 2]], ["tile_y", "sp", [-1, 1, 1, 1]], ["tile_x", "sp", [-1, 1, 83, 1]], ["auto_unroll_max_step", "ot", 1500], ["unroll_explicit", "ot", 1]]}, "result": [[0.018279427833333334], 0, 10.662481307983398, 1638649632.389621], "version": 0.2, "tvm_version": "0.9.dev0"}
{"input": ["rocm -keys=rocm,gpu -max_num_threads=256 -mcpu=gfx906 -mtriple=amdgcn-amd-amdhsa-hcc -thread_warp_size=64", "depthwise_conv2d_nchw.cuda", [["TENSOR", [128, 96, 165, 165], "float32"], ["TENSOR", [96, 1, 5, 5], "float32"], 2, "SAME", 1, "float32"], {}], "config": {"index": 1793, "code_hash": null, "entity": [["tile_f", "sp", [-1, 2, 1, 1]], ["tile_y", "sp", [-1, 1, 1, 1]], ["tile_x", "sp", [-1, 1, 83, 1]], ["auto_unroll_max_step", "ot", 0], ["unroll_explicit", "ot", 1]]}, "result": [[0.011817827777777777], 0, 10.313133478164673, 1638649642.4011474], "version": 0.2, "tvm_version": "0.9.dev0"}
{"input": ["rocm -keys=rocm,gpu -max_num_threads=256 -mcpu=gfx906 -mtriple=amdgcn-amd-amdhsa-hcc -thread_warp_size=64", "depthwise_conv2d_nchw.cuda", [["TENSOR", [128, 96, 165, 165], "float32"], ["TENSOR", [96, 1, 5, 5], "float32"], 2, "SAME", 1, "float32"], {}], "config": {"index": 5440, "code_hash": null, "entity": [["tile_f", "sp", [-1, 2, 1, 2]], ["tile_y", "sp", [-1, 1, 1, 1]], ["tile_x", "sp", [-1, 1, 83, 1]], ["auto_unroll_max_step", "ot", 256], ["unroll_explicit", "ot", 1]]}, "result": [[0.018281247333333334], 0, 10.761446714401245, 1638649652.378599], "version": 0.2, "tvm_version": "0.9.dev0"}
{"input": ["rocm -keys=rocm,gpu -max_num_threads=256 -mcpu=gfx906 -mtriple=amdgcn-amd-amdhsa-hcc -thread_warp_size=64", "depthwise_conv2d_nchw.cuda", [["TENSOR", [128, 96, 165, 165], "float32"], ["TENSOR", [96, 1, 5, 5], "float32"], 2, "SAME", 1, "float32"], {}], "config": {"index": 5412, "code_hash": null, "entity": [["tile_f", "sp", [-1, 1, 6, 1]], ["tile_y", "sp", [-1, 1, 1, 1]], ["tile_x", "sp", [-1, 1, 83, 1]], ["auto_unroll_max_step", "ot", 256], ["unroll_explicit", "ot", 1]]}, "result": [[0.006945887733333334], 0, 10.519636869430542, 1638649662.4986403], "version": 0.2, "tvm_version": "0.9.dev0"}
{"input": ["rocm -keys=rocm,gpu -max_num_threads=256 -mcpu=gfx906 -mtriple=amdgcn-amd-amdhsa-hcc -thread_warp_size=64", "depthwise_conv2d_nchw.cuda", [["TENSOR", [128, 96, 165, 165], "float32"], ["TENSOR", [96, 1, 5, 5], "float32"], 2, "SAME", 1, "float32"], {}], "config": {"index": 1814, "code_hash": null, "entity": [["tile_f", "sp", [-1, 1, 3, 1]], ["tile_y", "sp", [-1, 1, 1, 1]], ["tile_x", "sp", [-1, 1, 83, 1]], ["auto_unroll_max_step", "ot", 0], ["unroll_explicit", "ot", 1]]}, "result": [[0.007360778214285714], 0, 10.328482627868652, 1638649672.4875693], "version": 0.2, "tvm_version": "0.9.dev0"}
{"input": ["rocm -keys=rocm,gpu -max_num_threads=256 -mcpu=gfx906 -mtriple=amdgcn-amd-amdhsa-hcc -thread_warp_size=64", "depthwise_conv2d_nchw.cuda", [["TENSOR", [128, 96, 165, 165], "float32"], ["TENSOR", [96, 1, 5, 5], "float32"], 2, "SAME", 1, "float32"], {}], "config": {"index": 9025, "code_hash": null, "entity": [["tile_f", "sp", [-1, 3, 1, 2]], ["tile_y", "sp", [-1, 1, 1, 1]], ["tile_x", "sp", [-1, 1, 83, 1]], ["auto_unroll_max_step", "ot", 1500], ["unroll_explicit", "ot", 1]]}, "result": [[0.02329096216666667], 0, 10.915416717529297, 1638649682.5516233], "version": 0.2, "tvm_version": "0.9.dev0"}
{"input": ["rocm -keys=rocm,gpu -max_num_threads=256 -mcpu=gfx906 -mtriple=amdgcn-amd-amdhsa-hcc -thread_warp_size=64", "depthwise_conv2d_nchw.cuda", [["TENSOR", [128, 96, 165, 165], "float32"], ["TENSOR", [96, 1, 5, 5], "float32"], 2, "SAME", 1, "float32"], {}], "config": {"index": 1804, "code_hash": null, "entity": [["tile_f", "sp", [-1, 1, 2, 1]], ["tile_y", "sp", [-1, 1, 1, 1]], ["tile_x", "sp", [-1, 1, 83, 1]], ["auto_unroll_max_step", "ot", 0], ["unroll_explicit", "ot", 1]]}, "result": [[0.008114281846153846], 0, 10.215847492218018, 1638649692.495187], "version": 0.2, "tvm_version": "0.9.dev0"}
{"input": ["rocm -keys=rocm,gpu -max_num_threads=256 -mcpu=gfx906 -mtriple=amdgcn-amd-amdhsa-hcc -thread_warp_size=64", "depthwise_conv2d_nchw.cuda", [["TENSOR", [128, 96, 165, 165], "float32"], ["TENSOR", [96, 1, 5, 5], "float32"], 2, "SAME", 1, "float32"], {}], "config": {"index": 5535, "code_hash": null, "entity": [["tile_f", "sp", [-1, 1, 1, 6]], ["tile_y", "sp", [-1, 1, 1, 1]], ["tile_x", "sp", [-1, 1, 83, 1]], ["auto_unroll_max_step", "ot", 256], ["unroll_explicit", "ot", 1]]}, "result": [[0.023194269666666666], 0, 10.982792139053345, 1638649702.5558465], "version": 0.2, "tvm_version": "0.9.dev0"}
{"input": ["rocm -keys=rocm,gpu -max_num_threads=256 -mcpu=gfx906 -mtriple=amdgcn-amd-amdhsa-hcc -thread_warp_size=64", "depthwise_conv2d_nchw.cuda", [["TENSOR", [128, 96, 165, 165], "float32"], ["TENSOR", [96, 1, 5, 5], "float32"], 2, "SAME", 1, "float32"], {}], "config": {"index": 1796, "code_hash": null, "entity": [["tile_f", "sp", [-1, 6, 1, 1]], ["tile_y", "sp", [-1, 1, 1, 1]], ["tile_x", "sp", [-1, 1, 83, 1]], ["auto_unroll_max_step", "ot", 0], ["unroll_explicit", "ot", 1]]}, "result": [[0.028972934500000002], 0, 10.914861917495728, 1638649712.7694192], "version": 0.2, "tvm_version": "0.9.dev0"}
{"input": ["rocm -keys=rocm,gpu -max_num_threads=256 -mcpu=gfx906 -mtriple=amdgcn-amd-amdhsa-hcc -thread_warp_size=64", "depthwise_conv2d_nchw.cuda", [["TENSOR", [128, 96, 165, 165], "float32"], ["TENSOR", [96, 1, 5, 5], "float32"], 2, "SAME", 1, "float32"], {}], "config": {"index": 9119, "code_hash": null, "entity": [["tile_f", "sp", [-1, 1, 1, 6]], ["tile_y", "sp", [-1, 1, 1, 1]], ["tile_x", "sp", [-1, 1, 83, 1]], ["auto_unroll_max_step", "ot", 1500], ["unroll_explicit", "ot", 1]]}, "result": [[0.023194750333333333], 0, 10.963774919509888, 1638649722.8796303], "version": 0.2, "tvm_version": "0.9.dev0"}
{"input": ["rocm -keys=rocm,gpu -max_num_threads=256 -mcpu=gfx906 -mtriple=amdgcn-amd-amdhsa-hcc -thread_warp_size=64", "depthwise_conv2d_nchw.cuda", [["TENSOR", [128, 96, 165, 165], "float32"], ["TENSOR", [96, 1, 5, 5], "float32"], 2, "SAME", 1, "float32"], {}], "config": {"index": 5550, "code_hash": null, "entity": [["tile_f", "sp", [-1, 1, 1, 8]], ["tile_y", "sp", [-1, 1, 1, 1]], ["tile_x", "sp", [-1, 1, 83, 1]], ["auto_unroll_max_step", "ot", 256], ["unroll_explicit", "ot", 1]]}, "result": [[0.03328636925], 0, 11.032931804656982, 1638649732.8902442], "version": 0.2, "tvm_version": "0.9.dev0"}
{"input": ["rocm -keys=rocm,gpu -max_num_threads=256 -mcpu=gfx906 -mtriple=amdgcn-amd-amdhsa-hcc -thread_warp_size=64", "depthwise_conv2d_nchw.cuda", [["TENSOR", [128, 96, 165, 165], "float32"], ["TENSOR", [96, 1, 5, 5], "float32"], 2, "SAME", 1, "float32"], {}], "config": {"index": 5441, "code_hash": null, "entity": [["tile_f", "sp", [-1, 3, 1, 2]], ["tile_y", "sp", [-1, 1, 1, 1]], ["tile_x", "sp", [-1, 1, 83, 1]], ["auto_unroll_max_step", "ot", 256], ["unroll_explicit", "ot", 1]]}, "result": [[0.023282908], 0, 10.94953203201294, 1638649742.8757033], "version": 0.2, "tvm_version": "0.9.dev0"}
{"input": ["rocm -keys=rocm,gpu -max_num_threads=256 -mcpu=gfx906 -mtriple=amdgcn-amd-amdhsa-hcc -thread_warp_size=64", "depthwise_conv2d_nchw.cuda", [["TENSOR", [128, 96, 165, 165], "float32"], ["TENSOR", [96, 1, 5, 5], "float32"], 2, "SAME", 1, "float32"], {}], "config": {"index": 8973, "code_hash": null, "entity": [["tile_f", "sp", [-1, 2, 2, 1]], ["tile_y", "sp", [-1, 1, 1, 1]], ["tile_x", "sp", [-1, 1, 83, 1]], ["auto_unroll_max_step", "ot", 1500], ["unroll_explicit", "ot", 1]]}, "result": [[0.011503561222222222], 0, 11.633220195770264, 1638649754.0088713], "version": 0.2, "tvm_version": "0.9.dev0"}
{"input": ["rocm -keys=rocm,gpu -max_num_threads=256 -mcpu=gfx906 -mtriple=amdgcn-amd-amdhsa-hcc -thread_warp_size=64", "depthwise_conv2d_nchw.cuda", [["TENSOR", [128, 96, 165, 165], "float32"], ["TENSOR", [96, 1, 5, 5], "float32"], 2, "SAME", 1, "float32"], {}], "config": {"index": 9001, "code_hash": null, "entity": [["tile_f", "sp", [-1, 1, 8, 1]], ["tile_y", "sp", [-1, 1, 1, 1]], ["tile_x", "sp", [-1, 1, 83, 1]], ["auto_unroll_max_step", "ot", 1500], ["unroll_explicit", "ot", 1]]}, "result": [[0.008507966333333334], 0, 10.341556072235107, 1638649763.9880755], "version": 0.2, "tvm_version": "0.9.dev0"}
{"input": ["rocm -keys=rocm,gpu -max_num_threads=256 -mcpu=gfx906 -mtriple=amdgcn-amd-amdhsa-hcc -thread_warp_size=64", "depthwise_conv2d_nchw.cuda", [["TENSOR", [128, 96, 165, 165], "float32"], ["TENSOR", [96, 1, 5, 5], "float32"], 2, "SAME", 1, "float32"], {}], "config": {"index": 9068, "code_hash": null, "entity": [["tile_f", "sp", [-1, 1, 1, 3]], ["tile_y", "sp", [-1, 1, 1, 1]], ["tile_x", "sp", [-1, 1, 83, 1]], ["auto_unroll_max_step", "ot", 1500], ["unroll_explicit", "ot", 1]]}, "result": [[0.012776028625], 0, 10.552793979644775, 1638649773.9743755], "version": 0.2, "tvm_version": "0.9.dev0"}
{"input": ["rocm -keys=rocm,gpu -max_num_threads=256 -mcpu=gfx906 -mtriple=amdgcn-amd-amdhsa-hcc -thread_warp_size=64", "depthwise_conv2d_nchw.cuda", [["TENSOR", [128, 96, 165, 165], "float32"], ["TENSOR", [96, 1, 5, 5], "float32"], 2, "SAME", 1, "float32"], {}], "config": {"index": 1794, "code_hash": null, "entity": [["tile_f", "sp", [-1, 3, 1, 1]], ["tile_y", "sp", [-1, 1, 1, 1]], ["tile_x", "sp", [-1, 1, 83, 1]], ["auto_unroll_max_step", "ot", 0], ["unroll_explicit", "ot", 1]]}, "result": [[0.015206856857142858], 0, 10.630120515823364, 1638649784.06317], "version": 0.2, "tvm_version": "0.9.dev0"}
{"input": ["rocm -keys=rocm,gpu -max_num_threads=256 -mcpu=gfx906 -mtriple=amdgcn-amd-amdhsa-hcc -thread_warp_size=64", "depthwise_conv2d_nchw.cuda", [["TENSOR", [128, 96, 165, 165], "float32"], ["TENSOR", [96, 1, 5, 5], "float32"], 2, "SAME", 1, "float32"], {}], "config": {"index": 5389, "code_hash": null, "entity": [["tile_f", "sp", [-1, 2, 2, 1]], ["tile_y", "sp", [-1, 1, 1, 1]], ["tile_x", "sp", [-1, 1, 83, 1]], ["auto_unroll_max_step", "ot", 256], ["unroll_explicit", "ot", 1]]}, "result": [[0.011520722222222222], 0, 10.518828630447388, 1638649794.0866413], "version": 0.2, "tvm_version": "0.9.dev0"}
{"input": ["rocm -keys=rocm,gpu -max_num_threads=256 -mcpu=gfx906 -mtriple=amdgcn-amd-amdhsa-hcc -thread_warp_size=64", "depthwise_conv2d_nchw.cuda", [["TENSOR", [128, 96, 165, 165], "float32"], ["TENSOR", [96, 1, 5, 5], "float32"], 2, "SAME", 1, "float32"], {}], "config": {"index": 1855, "code_hash": null, "entity": [["tile_f", "sp", [-1, 1, 1, 2]], ["tile_y", "sp", [-1, 1, 1, 1]], ["tile_x", "sp", [-1, 1, 83, 1]], ["auto_unroll_max_step", "ot", 0], ["unroll_explicit", "ot", 1]]}, "result": [[0.01169293888888889], 0, 15.23871397972107, 1638649808.806551], "version": 0.2, "tvm_version": "0.9.dev0"}
{"input": ["rocm -keys=rocm,gpu -max_num_threads=256 -mcpu=gfx906 -mtriple=amdgcn-amd-amdhsa-hcc -thread_warp_size=64", "depthwise_conv2d_nchw.cuda", [["TENSOR", [128, 96, 165, 165], "float32"], ["TENSOR", [96, 1, 5, 5], "float32"], 2, "SAME", 1, "float32"], {}], "config": {"index": 5417, "code_hash": null, "entity": [["tile_f", "sp", [-1, 1, 8, 1]], ["tile_y", "sp", [-1, 1, 1, 1]], ["tile_x", "sp", [-1, 1, 83, 1]], ["auto_unroll_max_step", "ot", 256], ["unroll_explicit", "ot", 1]]}, "result": [[0.008503192833333334], 0, 13.776915788650513, 1638649822.168735], "version": 0.2, "tvm_version": "0.9.dev0"}
{"input": ["rocm -keys=rocm,gpu -max_num_threads=256 -mcpu=gfx906 -mtriple=amdgcn-amd-amdhsa-hcc -thread_warp_size=64", "depthwise_conv2d_nchw.cuda", [["TENSOR", [128, 96, 165, 165], "float32"], ["TENSOR", [96, 1, 5, 5], "float32"], 2, "SAME", 1, "float32"], {}], "config": {"index": 5484, "code_hash": null, "entity": [["tile_f", "sp", [-1, 1, 1, 3]], ["tile_y", "sp", [-1, 1, 1, 1]], ["tile_x", "sp", [-1, 1, 83, 1]], ["auto_unroll_max_step", "ot", 256], ["unroll_explicit", "ot", 1]]}, "result": [[0.012772918625], 0, 15.196704387664795, 1638649836.7134795], "version": 0.2, "tvm_version": "0.9.dev0"}
{"input": ["rocm -keys=rocm,gpu -max_num_threads=256 -mcpu=gfx906 -mtriple=amdgcn-amd-amdhsa-hcc -thread_warp_size=64", "depthwise_conv2d_nchw.cuda", [["TENSOR", [128, 96, 165, 165], "float32"], ["TENSOR", [96, 1, 5, 5], "float32"], 2, "SAME", 1, "float32"], {}], "config": {"index": 7616, "code_hash": null, "entity": [["tile_f", "sp", [-1, 1, 1, 1]], ["tile_y", "sp", [-1, 1, 83, 1]], ["tile_x", "sp", [-1, 1, 1, 1]], ["auto_unroll_max_step", "ot", 1500], ["unroll_explicit", "ot", 1]]}, "result": [[0.012123503777777779], 0, 15.648152112960815, 1638649852.0261714], "version": 0.2, "tvm_version": "0.9.dev0"}
{"input": ["rocm -keys=rocm,gpu -max_num_threads=256 -mcpu=gfx906 -mtriple=amdgcn-amd-amdhsa-hcc -thread_warp_size=64", "depthwise_conv2d_nchw.cuda", [["TENSOR", [128, 96, 165, 165], "float32"], ["TENSOR", [96, 1, 5, 5], "float32"], 2, "SAME", 1, "float32"], {}], "config": {"index": 9069, "code_hash": null, "entity": [["tile_f", "sp", [-1, 2, 1, 3]], ["tile_y", "sp", [-1, 1, 1, 1]], ["tile_x", "sp", [-1, 1, 83, 1]], ["auto_unroll_max_step", "ot", 1500], ["unroll_explicit", "ot", 1]]}, "result": [[0.0235158945], 0, 15.261535167694092, 1638649866.3553562], "version": 0.2, "tvm_version": "0.9.dev0"}
{"input": ["rocm -keys=rocm,gpu -max_num_threads=256 -mcpu=gfx906 -mtriple=amdgcn-amd-amdhsa-hcc -thread_warp_size=64", "depthwise_conv2d_nchw.cuda", [["TENSOR", [128, 96, 165, 165], "float32"], ["TENSOR", [96, 1, 5, 5], "float32"], 2, "SAME", 1, "float32"], {}], "config": {"index": 1921, "code_hash": null, "entity": [["tile_f", "sp", [-1, 1, 1, 4]], ["tile_y", "sp", [-1, 1, 1, 1]], ["tile_x", "sp", [-1, 1, 83, 1]], ["auto_unroll_max_step", "ot", 0], ["unroll_explicit", "ot", 1]]}, "result": [[0.024066655333333336], 0, 14.119280815124512, 1638649879.973441], "version": 0.2, "tvm_version": "0.9.dev0"}
{"input": ["rocm -keys=rocm,gpu -max_num_threads=256 -mcpu=gfx906 -mtriple=amdgcn-amd-amdhsa-hcc -thread_warp_size=64", "depthwise_conv2d_nchw.cuda", [["TENSOR", [128, 96, 165, 165], "float32"], ["TENSOR", [96, 1, 5, 5], "float32"], 2, "SAME", 1, "float32"], {}], "config": {"index": 9134, "code_hash": null, "entity": [["tile_f", "sp", [-1, 1, 1, 8]], ["tile_y", "sp", [-1, 1, 1, 1]], ["tile_x", "sp", [-1, 1, 83, 1]], ["auto_unroll_max_step", "ot", 1500], ["unroll_explicit", "ot", 1]]}, "result": [[0.03328588475], 0, 10.97534966468811, 1638649889.9701264], "version": 0.2, "tvm_version": "0.9.dev0"}
{"input": ["rocm -keys=rocm,gpu -max_num_threads=256 -mcpu=gfx906 -mtriple=amdgcn-amd-amdhsa-hcc -thread_warp_size=64", "depthwise_conv2d_nchw.cuda", [["TENSOR", [128, 96, 165, 165], "float32"], ["TENSOR", [96, 1, 5, 5], "float32"], 2, "SAME", 1, "float32"], {}], "config": {"index": 4032, "code_hash": null, "entity": [["tile_f", "sp", [-1, 1, 1, 1]], ["tile_y", "sp", [-1, 1, 83, 1]], ["tile_x", "sp", [-1, 1, 1, 1]], ["auto_unroll_max_step", "ot", 256], ["unroll_explicit", "ot", 1]]}, "result": [[0.012136690666666667], 0, 10.722844123840332, 1638649900.3095367], "version": 0.2, "tvm_version": "0.9.dev0"}
{"input": ["rocm -keys=rocm,gpu -max_num_threads=256 -mcpu=gfx906 -mtriple=amdgcn-amd-amdhsa-hcc -thread_warp_size=64", "depthwise_conv2d_nchw.cuda", [["TENSOR", [128, 96, 165, 165], "float32"], ["TENSOR", [96, 1, 5, 5], "float32"], 2, "SAME", 1, "float32"], {}], "config": {"index": 8983, "code_hash": null, "entity": [["tile_f", "sp", [-1, 2, 3, 1]], ["tile_y", "sp", [-1, 1, 1, 1]], ["tile_x", "sp", [-1, 1, 83, 1]], ["auto_unroll_max_step", "ot", 1500], ["unroll_explicit", "ot", 1]]}, "result": [[0.0101937156], 0, 10.342541933059692, 1638649910.180816], "version": 0.2, "tvm_version": "0.9.dev0"}
{"input": ["rocm -keys=rocm,gpu -max_num_threads=256 -mcpu=gfx906 -mtriple=amdgcn-amd-amdhsa-hcc -thread_warp_size=64", "depthwise_conv2d_nchw.cuda", [["TENSOR", [128, 96, 165, 165], "float32"], ["TENSOR", [96, 1, 5, 5], "float32"], 2, "SAME", 1, "float32"], {}], "config": {"index": 3639, "code_hash": null, "entity": [["tile_f", "sp", [-1, 1, 24, 1]], ["tile_y", "sp", [-1, 1, 1, 1]], ["tile_x", "sp", [-1, 1, 1, 1]], ["auto_unroll_max_step", "ot", 256], ["unroll_explicit", "ot", 1]]}, "result": [[0.06313104625], 0, 12.013140439987183, 1638649921.7054725], "version": 0.2, "tvm_version": "0.9.dev0"}
{"input": ["rocm -keys=rocm,gpu -max_num_threads=256 -mcpu=gfx906 -mtriple=amdgcn-amd-amdhsa-hcc -thread_warp_size=64", "depthwise_conv2d_nchw.cuda", [["TENSOR", [128, 96, 165, 165], "float32"], ["TENSOR", [96, 1, 5, 5], "float32"], 2, "SAME", 1, "float32"], {}], "config": {"index": 1797, "code_hash": null, "entity": [["tile_f", "sp", [-1, 8, 1, 1]], ["tile_y", "sp", [-1, 1, 1, 1]], ["tile_x", "sp", [-1, 1, 83, 1]], ["auto_unroll_max_step", "ot", 0], ["unroll_explicit", "ot", 1]]}, "result": [[0.0416414755], 0, 10.747374296188354, 1638649931.733504], "version": 0.2, "tvm_version": "0.9.dev0"}
{"input": ["rocm -keys=rocm,gpu -max_num_threads=256 -mcpu=gfx906 -mtriple=amdgcn-amd-amdhsa-hcc -thread_warp_size=64", "depthwise_conv2d_nchw.cuda", [["TENSOR", [128, 96, 165, 165], "float32"], ["TENSOR", [96, 1, 5, 5], "float32"], 2, "SAME", 1, "float32"], {}], "config": {"index": 1828, "code_hash": null, "entity": [["tile_f", "sp", [-1, 1, 6, 1]], ["tile_y", "sp", [-1, 1, 1, 1]], ["tile_x", "sp", [-1, 1, 83, 1]], ["auto_unroll_max_step", "ot", 0], ["unroll_explicit", "ot", 1]]}, "result": [[0.007564702142857142], 0, 10.343093156814575, 1638649941.7439017], "version": 0.2, "tvm_version": "0.9.dev0"}
