artifacts/microbenchmark/tvm/e2e/ansor_log/ansor_avg_pooling_128_672_21_21_3_3_2_SAME.log
{"i": [["[\"pool_layer\", \"avg\", 128, 672, 21, 21, 3, 3, 2, \"SAME\"]", "cuda -keys=cuda,gpu -max_num_threads=1024 -thread_warp_size=32", [-1, 16, 64, 49152, 2147483647, 1024, 8, 32], "", 0, []], [[], [["CI", 1], ["FU", 3, [0, 1, 2, 3]], ["SP", 3, 0, 10407936, [2], 1], ["AN", 3, 0, 5], ["AN", 3, 1, 6], ["FU", 2, [0, 1, 2, 3]], ["SP", 2, 0, 10407936, [32], 1], ["AN", 2, 0, 5], ["AN", 2, 1, 6], ["PR", 2, 0, "auto_unroll_max_step$64"]]]], "r": [[0.00862931], 0, 2.04529, 1637918752], "v": "v0.6"}
{"i": [["[\"pool_layer\", \"avg\", 128, 672, 21, 21, 3, 3, 2, \"SAME\"]", "cuda -keys=cuda,gpu -max_num_threads=1024 -thread_warp_size=32", [-1, 16, 64, 49152, 2147483647, 1024, 8, 32], "", 0, []], [[], [["CI", 1], ["FU", 3, [0, 1, 2, 3]], ["SP", 3, 0, 10407936, [32], 1], ["AN", 3, 0, 5], ["AN", 3, 1, 6], ["FU", 2, [0, 1, 2, 3]], ["SP", 2, 0, 10407936, [2], 1], ["AN", 2, 0, 5], ["AN", 2, 1, 6], ["PR", 2, 0, "auto_unroll_max_step$16"]]]], "r": [[0.00862814], 0, 1.64509, 1637918753], "v": "v0.6"}
{"i": [["[\"pool_layer\", \"avg\", 128, 672, 21, 21, 3, 3, 2, \"SAME\"]", "cuda -keys=cuda,gpu -max_num_threads=1024 -thread_warp_size=32", [-1, 16, 64, 49152, 2147483647, 1024, 8, 32], "", 0, []], [[], [["CI", 1], ["FU", 3, [0, 1, 2, 3]], ["SP", 3, 0, 10407936, [64], 1], ["AN", 3, 0, 5], ["AN", 3, 1, 6], ["FU", 2, [0, 1, 2, 3]], ["SP", 2, 0, 10407936, [64], 1], ["AN", 2, 0, 5], ["AN", 2, 1, 6], ["PR", 2, 0, "auto_unroll_max_step$16"]]]], "r": [[0.000514317], 0, 2.07956, 1637918755], "v": "v0.6"}
{"i": [["[\"pool_layer\", \"avg\", 128, 672, 21, 21, 3, 3, 2, \"SAME\"]", "cuda -keys=cuda,gpu -max_num_threads=1024 -thread_warp_size=32", [-1, 16, 64, 49152, 2147483647, 1024, 8, 32], "", 0, []], [[], [["CI", 1], ["FU", 3, [0, 1, 2, 3]], ["SP", 3, 0, 10407936, [8], 1], ["AN", 3, 0, 5], ["AN", 3, 1, 6], ["FU", 2, [0, 1, 2, 3]], ["SP", 2, 0, 10407936, [64], 1], ["AN", 2, 0, 5], ["AN", 2, 1, 6], ["PR", 2, 0, "auto_unroll_max_step$64"]]]], "r": [[0.00228959], 0, 2.12786, 1637918757], "v": "v0.6"}
{"i": [["[\"pool_layer\", \"avg\", 128, 672, 21, 21, 3, 3, 2, \"SAME\"]", "cuda -keys=cuda,gpu -max_num_threads=1024 -thread_warp_size=32", [-1, 16, 64, 49152, 2147483647, 1024, 8, 32], "", 0, []], [[], [["CI", 1], ["FU", 3, [0, 1, 2, 3]], ["SP", 3, 0, 10407936, [12], 1], ["AN", 3, 0, 5], ["AN", 3, 1, 6], ["FU", 2, [0, 1, 2, 3]], ["SP", 2, 0, 10407936, [32], 1], ["AN", 2, 0, 5], ["AN", 2, 1, 6], ["PR", 2, 0, "auto_unroll_max_step$64"]]]], "r": [[0.00186592], 0, 1.59422, 1637918758], "v": "v0.6"}
{"i": [["[\"pool_layer\", \"avg\", 128, 672, 21, 21, 3, 3, 2, \"SAME\"]", "cuda -keys=cuda,gpu -max_num_threads=1024 -thread_warp_size=32", [-1, 16, 64, 49152, 2147483647, 1024, 8, 32], "", 0, []], [[], [["CI", 1], ["FU", 3, [0, 1, 2, 3]], ["SP", 3, 0, 10407936, [16], 1], ["AN", 3, 0, 5], ["AN", 3, 1, 6], ["FU", 2, [0, 1, 2, 3]], ["SP", 2, 0, 10407936, [32], 1], ["AN", 2, 0, 5], ["AN", 2, 1, 6], ["PR", 2, 0, "auto_unroll_max_step$16"]]]], "r": [[0.00152787], 0, 2.09592, 1637918760], "v": "v0.6"}
{"i": [["[\"pool_layer\", \"avg\", 128, 672, 21, 21, 3, 3, 2, \"SAME\"]", "cuda -keys=cuda,gpu -max_num_threads=1024 -thread_warp_size=32", [-1, 16, 64, 49152, 2147483647, 1024, 8, 32], "", 0, []], [[], [["CI", 1], ["FU", 3, [0, 1, 2, 3]], ["SP", 3, 0, 10407936, [32], 1], ["AN", 3, 0, 5], ["AN", 3, 1, 6], ["FU", 2, [0, 1, 2, 3]], ["SP", 2, 0, 10407936, [1], 1], ["AN", 2, 0, 5], ["AN", 2, 1, 6], ["PR", 2, 0, "auto_unroll_max_step$512"]]]], "r": [[0.016744], 0, 1.68403, 1637918762], "v": "v0.6"}
{"i": [["[\"pool_layer\", \"avg\", 128, 672, 21, 21, 3, 3, 2, \"SAME\"]", "cuda -keys=cuda,gpu -max_num_threads=1024 -thread_warp_size=32", [-1, 16, 64, 49152, 2147483647, 1024, 8, 32], "", 0, []], [[], [["CI", 1], ["FU", 3, [0, 1, 2, 3]], ["SP", 3, 0, 10407936, [32], 1], ["AN", 3, 0, 5], ["AN", 3, 1, 6], ["FU", 2, [0, 1, 2, 3]], ["SP", 2, 0, 10407936, [64], 1], ["AN", 2, 0, 5], ["AN", 2, 1, 6], ["PR", 2, 0, "auto_unroll_max_step$16"]]]], "r": [[0.000767868], 0, 2.08582, 1637918764], "v": "v0.6"}
{"i": [["[\"pool_layer\", \"avg\", 128, 672, 21, 21, 3, 3, 2, \"SAME\"]", "cuda -keys=cuda,gpu -max_num_threads=1024 -thread_warp_size=32", [-1, 16, 64, 49152, 2147483647, 1024, 8, 32], "", 0, []], [[], [["CI", 1], ["FU", 3, [0, 1, 2, 3]], ["SP", 3, 0, 10407936, [4], 1], ["AN", 3, 0, 5], ["AN", 3, 1, 6], ["FU", 2, [0, 1, 2, 3]], ["SP", 2, 0, 10407936, [16], 1], ["AN", 2, 0, 5], ["AN", 2, 1, 6], ["PR", 2, 0, "auto_unroll_max_step$16"]]]], "r": [[0.00507784], 0, 1.66913, 1637918765], "v": "v0.6"}
{"i": [["[\"pool_layer\", \"avg\", 128, 672, 21, 21, 3, 3, 2, \"SAME\"]", "cuda -keys=cuda,gpu -max_num_threads=1024 -thread_warp_size=32", [-1, 16, 64, 49152, 2147483647, 1024, 8, 32], "", 0, []], [[], [["CI", 1], ["FU", 3, [0, 1, 2, 3]], ["SP", 3, 0, 10407936, [32], 1], ["AN", 3, 0, 5], ["AN", 3, 1, 6], ["FU", 2, [0, 1, 2, 3]], ["SP", 2, 0, 10407936, [56], 1], ["AN", 2, 0, 5], ["AN", 2, 1, 6], ["PR", 2, 0, "auto_unroll_max_step$512"]]]], "r": [[0.000803854], 0, 2.11696, 1637918767], "v": "v0.6"}
{"i": [["[\"pool_layer\", \"avg\", 128, 672, 21, 21, 3, 3, 2, \"SAME\"]", "cuda -keys=cuda,gpu -max_num_threads=1024 -thread_warp_size=32", [-1, 16, 64, 49152, 2147483647, 1024, 8, 32], "", 0, []], [[], [["CI", 1], ["FU", 3, [0, 1, 2, 3]], ["SP", 3, 0, 10407936, [32], 1], ["AN", 3, 0, 5], ["AN", 3, 1, 6], ["FU", 2, [0, 1, 2, 3]], ["SP", 2, 0, 10407936, [7], 1], ["AN", 2, 0, 5], ["AN", 2, 1, 6], ["PR", 2, 0, "auto_unroll_max_step$512"]]]], "r": [[0.00283099], 0, 1.66934, 1637918768], "v": "v0.6"}
{"i": [["[\"pool_layer\", \"avg\", 128, 672, 21, 21, 3, 3, 2, \"SAME\"]", "cuda -keys=cuda,gpu -max_num_threads=1024 -thread_warp_size=32", [-1, 16, 64, 49152, 2147483647, 1024, 8, 32], "", 0, []], [[], [["CI", 1], ["FU", 3, [0, 1, 2, 3]], ["SP", 3, 0, 10407936, [16], 1], ["AN", 3, 0, 5], ["AN", 3, 1, 6], ["FU", 2, [0, 1, 2, 3]], ["SP", 2, 0, 10407936, [32], 1], ["AN", 2, 0, 5], ["AN", 2, 1, 6], ["PR", 2, 0, "auto_unroll_max_step$512"]]]], "r": [[0.00152759], 0, 2.00612, 1637918770], "v": "v0.6"}
{"i": [["[\"pool_layer\", \"avg\", 128, 672, 21, 21, 3, 3, 2, \"SAME\"]", "cuda -keys=cuda,gpu -max_num_threads=1024 -thread_warp_size=32", [-1, 16, 64, 49152, 2147483647, 1024, 8, 32], "", 0, []], [[], [["CI", 1], ["FU", 3, [0, 1, 2, 3]], ["SP", 3, 0, 10407936, [64], 1], ["AN", 3, 0, 5], ["AN", 3, 1, 6], ["FU", 2, [0, 1, 2, 3]], ["SP", 2, 0, 10407936, [16], 1], ["AN", 2, 0, 5], ["AN", 2, 1, 6], ["PR", 2, 0, "auto_unroll_max_step$1024"]]]], "r": [[0.00127334], 0, 2.09153, 1637918772], "v": "v0.6"}
{"i": [["[\"pool_layer\", \"avg\", 128, 672, 21, 21, 3, 3, 2, \"SAME\"]", "cuda -keys=cuda,gpu -max_num_threads=1024 -thread_warp_size=32", [-1, 16, 64, 49152, 2147483647, 1024, 8, 32], "", 0, []], [[], [["CI", 1], ["FU", 3, [0, 1, 2, 3]], ["SP", 3, 0, 10407936, [28], 1], ["AN", 3, 0, 5], ["AN", 3, 1, 6], ["FU", 2, [0, 1, 2, 3]], ["SP", 2, 0, 10407936, [64], 1], ["AN", 2, 0, 5], ["AN", 2, 1, 6], ["PR", 2, 0, "auto_unroll_max_step$16"]]]], "r": [[0.000840286], 0, 2.08985, 1637918774], "v": "v0.6"}
{"i": [["[\"pool_layer\", \"avg\", 128, 672, 21, 21, 3, 3, 2, \"SAME\"]", "cuda -keys=cuda,gpu -max_num_threads=1024 -thread_warp_size=32", [-1, 16, 64, 49152, 2147483647, 1024, 8, 32], "", 0, []], [[], [["CI", 1], ["FU", 3, [0, 1, 2, 3]], ["SP", 3, 0, 10407936, [32], 1], ["AN", 3, 0, 5], ["AN", 3, 1, 6], ["FU", 2, [0, 1, 2, 3]], ["SP", 2, 0, 10407936, [8], 1], ["AN", 2, 0, 5], ["AN", 2, 1, 6], ["PR", 2, 0, "auto_unroll_max_step$1024"]]]], "r": [[0.00254136], 0, 2.13037, 1637918775], "v": "v0.6"}
{"i": [["[\"pool_layer\", \"avg\", 128, 672, 21, 21, 3, 3, 2, \"SAME\"]", "cuda -keys=cuda,gpu -max_num_threads=1024 -thread_warp_size=32", [-1, 16, 64, 49152, 2147483647, 1024, 8, 32], "", 0, []], [[], [["CI", 1], ["FU", 3, [0, 1, 2, 3]], ["SP", 3, 0, 10407936, [1], 1], ["AN", 3, 0, 5], ["AN", 3, 1, 6], ["FU", 2, [0, 1, 2, 3]], ["SP", 2, 0, 10407936, [32], 1], ["AN", 2, 0, 5], ["AN", 2, 1, 6], ["PR", 2, 0, "auto_unroll_max_step$64"]]]], "r": [[0.0167453], 0, 1.66879, 1637918777], "v": "v0.6"}
{"i": [["[\"pool_layer\", \"avg\", 128, 672, 21, 21, 3, 3, 2, \"SAME\"]", "cuda -keys=cuda,gpu -max_num_threads=1024 -thread_warp_size=32", [-1, 16, 64, 49152, 2147483647, 1024, 8, 32], "", 0, []], [[], [["CI", 1], ["FU", 3, [0, 1, 2, 3]], ["SP", 3, 0, 10407936, [32], 1], ["AN", 3, 0, 5], ["AN", 3, 1, 6], ["FU", 2, [0, 1, 2, 3]], ["SP", 2, 0, 10407936, [4], 1], ["AN", 2, 0, 5], ["AN", 2, 1, 6], ["PR", 2, 0, "auto_unroll_max_step$0"]]]], "r": [[0.00457046], 0, 1.59345, 1637918778], "v": "v0.6"}
{"i": [["[\"pool_layer\", \"avg\", 128, 672, 21, 21, 3, 3, 2, \"SAME\"]", "cuda -keys=cuda,gpu -max_num_threads=1024 -thread_warp_size=32", [-1, 16, 64, 49152, 2147483647, 1024, 8, 32], "", 0, []], [[], [["CI", 1], ["FU", 3, [0, 1, 2, 3]], ["SP", 3, 0, 10407936, [4], 1], ["AN", 3, 0, 5], ["AN", 3, 1, 6], ["FU", 2, [0, 1, 2, 3]], ["SP", 2, 0, 10407936, [8], 1], ["AN", 2, 0, 5], ["AN", 2, 1, 6], ["PR", 2, 0, "auto_unroll_max_step$16"]]]], "r": [[0.00609192], 0, 1.61783, 1637918780], "v": "v0.6"}
{"i": [["[\"pool_layer\", \"avg\", 128, 672, 21, 21, 3, 3, 2, \"SAME\"]", "cuda -keys=cuda,gpu -max_num_threads=1024 -thread_warp_size=32", [-1, 16, 64, 49152, 2147483647, 1024, 8, 32], "", 0, []], [[], [["CI", 1], ["FU", 3, [0, 1, 2, 3]], ["SP", 3, 0, 10407936, [4], 1], ["AN", 3, 0, 5], ["AN", 3, 1, 6], ["FU", 2, [0, 1, 2, 3]], ["SP", 2, 0, 10407936, [2], 1], ["AN", 2, 0, 5], ["AN", 2, 1, 6], ["PR", 2, 0, "auto_unroll_max_step$512"]]]], "r": [[0.0121785], 0, 1.71796, 1637918781], "v": "v0.6"}
{"i": [["[\"pool_layer\", \"avg\", 128, 672, 21, 21, 3, 3, 2, \"SAME\"]", "cuda -keys=cuda,gpu -max_num_threads=1024 -thread_warp_size=32", [-1, 16, 64, 49152, 2147483647, 1024, 8, 32], "", 0, []], [[], [["CI", 1], ["FU", 3, [0, 1, 2, 3]], ["SP", 3, 0, 10407936, [32], 1], ["AN", 3, 0, 5], ["AN", 3, 1, 6], ["FU", 2, [0, 1, 2, 3]], ["SP", 2, 0, 10407936, [2], 1], ["AN", 2, 0, 5], ["AN", 2, 1, 6], ["PR", 2, 0, "auto_unroll_max_step$0"]]]], "r": [[0.00862795], 0, 1.60667, 1637918782], "v": "v0.6"}
{"i": [["[\"pool_layer\", \"avg\", 128, 672, 21, 21, 3, 3, 2, \"SAME\"]", "cuda -keys=cuda,gpu -max_num_threads=1024 -thread_warp_size=32", [-1, 16, 64, 49152, 2147483647, 1024, 8, 32], "", 0, []], [[], [["CI", 1], ["FU", 3, [0, 1, 2, 3]], ["SP", 3, 0, 10407936, [44], 1], ["AN", 3, 0, 5], ["AN", 3, 1, 6], ["FU", 2, [0, 1, 2, 3]], ["SP", 2, 0, 10407936, [64], 1], ["AN", 2, 0, 5], ["AN", 2, 1, 6], ["PR", 2, 0, "auto_unroll_max_step$512"]]]], "r": [[0.000629697], 0, 2.11681, 1637918784], "v": "v0.6"}
{"i": [["[\"pool_layer\", \"avg\", 128, 672, 21, 21, 3, 3, 2, \"SAME\"]", "cuda -keys=cuda,gpu -max_num_threads=1024 -thread_warp_size=32", [-1, 16, 64, 49152, 2147483647, 1024, 8, 32], "", 0, []], [[], [["CI", 1], ["FU", 3, [0, 1, 2, 3]], ["SP", 3, 0, 10407936, [1], 1], ["AN", 3, 0, 5], ["AN", 3, 1, 6], ["FU", 2, [0, 1, 2, 3]], ["SP", 2, 0, 10407936, [64], 1], ["AN", 2, 0, 5], ["AN", 2, 1, 6], ["PR", 2, 0, "auto_unroll_max_step$16"]]]], "r": [[0.0164933], 0, 1.69844, 1637918786], "v": "v0.6"}
{"i": [["[\"pool_layer\", \"avg\", 128, 672, 21, 21, 3, 3, 2, \"SAME\"]", "cuda -keys=cuda,gpu -max_num_threads=1024 -thread_warp_size=32", [-1, 16, 64, 49152, 2147483647, 1024, 8, 32], "", 0, []], [[], [["CI", 1], ["FU", 3, [0, 1, 2, 3]], ["SP", 3, 0, 10407936, [64], 1], ["AN", 3, 0, 5], ["AN", 3, 1, 6], ["FU", 2, [0, 1, 2, 3]], ["SP", 2, 0, 10407936, [3], 1], ["AN", 2, 0, 5], ["AN", 2, 1, 6], ["PR", 2, 0, "auto_unroll_max_step$512"]]]], "r": [[0.00566909], 0, 1.63638, 1637918787], "v": "v0.6"}
{"i": [["[\"pool_layer\", \"avg\", 128, 672, 21, 21, 3, 3, 2, \"SAME\"]", "cuda -keys=cuda,gpu -max_num_threads=1024 -thread_warp_size=32", [-1, 16, 64, 49152, 2147483647, 1024, 8, 32], "", 0, []], [[], [["CI", 1], ["FU", 3, [0, 1, 2, 3]], ["SP", 3, 0, 10407936, [32], 1], ["AN", 3, 0, 5], ["AN", 3, 1, 6], ["FU", 2, [0, 1, 2, 3]], ["SP", 2, 0, 10407936, [44], 1], ["AN", 2, 0, 5], ["AN", 2, 1, 6], ["PR", 2, 0, "auto_unroll_max_step$512"]]]], "r": [[0.000882416], 0, 2.08078, 1637918789], "v": "v0.6"}
{"i": [["[\"pool_layer\", \"avg\", 128, 672, 21, 21, 3, 3, 2, \"SAME\"]", "cuda -keys=cuda,gpu -max_num_threads=1024 -thread_warp_size=32", [-1, 16, 64, 49152, 2147483647, 1024, 8, 32], "", 0, []], [[], [["CI", 1], ["FU", 3, [0, 1, 2, 3]], ["SP", 3, 0, 10407936, [4], 1], ["AN", 3, 0, 5], ["AN", 3, 1, 6], ["FU", 2, [0, 1, 2, 3]], ["SP", 2, 0, 10407936, [2], 1], ["AN", 2, 0, 5], ["AN", 2, 1, 6], ["PR", 2, 0, "auto_unroll_max_step$1024"]]]], "r": [[0.0121796], 0, 4.02159, 1637918790], "v": "v0.6"}
{"i": [["[\"pool_layer\", \"avg\", 128, 672, 21, 21, 3, 3, 2, \"SAME\"]", "cuda -keys=cuda,gpu -max_num_threads=1024 -thread_warp_size=32", [-1, 16, 64, 49152, 2147483647, 1024, 8, 32], "", 0, []], [[], [["CI", 1], ["FU", 3, [0, 1, 2, 3]], ["SP", 3, 0, 10407936, [32], 1], ["AN", 3, 0, 5], ["AN", 3, 1, 6], ["FU", 2, [0, 1, 2, 3]], ["SP", 2, 0, 10407936, [1], 1], ["AN", 2, 0, 5], ["AN", 2, 1, 6], ["PR", 2, 0, "auto_unroll_max_step$0"]]]], "r": [[0.0167456], 0, 4.36372, 1637918792], "v": "v0.6"}
{"i": [["[\"pool_layer\", \"avg\", 128, 672, 21, 21, 3, 3, 2, \"SAME\"]", "cuda -keys=cuda,gpu -max_num_threads=1024 -thread_warp_size=32", [-1, 16, 64, 49152, 2147483647, 1024, 8, 32], "", 0, []], [[], [["CI", 1], ["FU", 3, [0, 1, 2, 3]], ["SP", 3, 0, 10407936, [8], 1], ["AN", 3, 0, 5], ["AN", 3, 1, 6], ["FU", 2, [0, 1, 2, 3]], ["SP", 2, 0, 10407936, [4], 1], ["AN", 2, 0, 5], ["AN", 2, 1, 6], ["PR", 2, 0, "auto_unroll_max_step$512"]]]], "r": [[0.00609232], 0, 4.08437, 1637918793], "v": "v0.6"}
{"i": [["[\"pool_layer\", \"avg\", 128, 672, 21, 21, 3, 3, 2, \"SAME\"]", "cuda -keys=cuda,gpu -max_num_threads=1024 -thread_warp_size=32", [-1, 16, 64, 49152, 2147483647, 1024, 8, 32], "", 0, []], [[], [["CI", 1], ["FU", 3, [0, 1, 2, 3]], ["SP", 3, 0, 10407936, [32], 1], ["AN", 3, 0, 5], ["AN", 3, 1, 6], ["FU", 2, [0, 1, 2, 3]], ["SP", 2, 0, 10407936, [1], 1], ["AN", 2, 0, 5], ["AN", 2, 1, 6], ["PR", 2, 0, "auto_unroll_max_step$16"]]]], "r": [[0.0167459], 0, 4.07384, 1637918794], "v": "v0.6"}
{"i": [["[\"pool_layer\", \"avg\", 128, 672, 21, 21, 3, 3, 2, \"SAME\"]", "cuda -keys=cuda,gpu -max_num_threads=1024 -thread_warp_size=32", [-1, 16, 64, 49152, 2147483647, 1024, 8, 32], "", 0, []], [[], [["CI", 1], ["FU", 3, [0, 1, 2, 3]], ["SP", 3, 0, 10407936, [32], 1], ["AN", 3, 0, 5], ["AN", 3, 1, 6], ["FU", 2, [0, 1, 2, 3]], ["SP", 2, 0, 10407936, [32], 1], ["AN", 2, 0, 5], ["AN", 2, 1, 6], ["PR", 2, 0, "auto_unroll_max_step$0"]]]], "r": [[0.00102042], 0, 2.08412, 1637918796], "v": "v0.6"}
{"i": [["[\"pool_layer\", \"avg\", 128, 672, 21, 21, 3, 3, 2, \"SAME\"]", "cuda -keys=cuda,gpu -max_num_threads=1024 -thread_warp_size=32", [-1, 16, 64, 49152, 2147483647, 1024, 8, 32], "", 0, []], [[], [["CI", 1], ["FU", 3, [0, 1, 2, 3]], ["SP", 3, 0, 10407936, [32], 1], ["AN", 3, 0, 5], ["AN", 3, 1, 6], ["FU", 2, [0, 1, 2, 3]], ["SP", 2, 0, 10407936, [32], 1], ["AN", 2, 0, 5], ["AN", 2, 1, 6], ["PR", 2, 0, "auto_unroll_max_step$512"]]]], "r": [[0.0010204], 0, 2.04787, 1637918798], "v": "v0.6"}
{"i": [["[\"pool_layer\", \"avg\", 128, 672, 21, 21, 3, 3, 2, \"SAME\"]", "cuda -keys=cuda,gpu -max_num_threads=1024 -thread_warp_size=32", [-1, 16, 64, 49152, 2147483647, 1024, 8, 32], "", 0, []], [[], [["CI", 1], ["FU", 3, [0, 1, 2, 3]], ["SP", 3, 0, 10407936, [4], 1], ["AN", 3, 0, 5], ["AN", 3, 1, 6], ["FU", 2, [0, 1, 2, 3]], ["SP", 2, 0, 10407936, [2], 1], ["AN", 2, 0, 5], ["AN", 2, 1, 6], ["PR", 2, 0, "auto_unroll_max_step$16"]]]], "r": [[0.0121801], 0, 4.0521, 1637918799], "v": "v0.6"}
{"i": [["[\"pool_layer\", \"avg\", 128, 672, 21, 21, 3, 3, 2, \"SAME\"]", "cuda -keys=cuda,gpu -max_num_threads=1024 -thread_warp_size=32", [-1, 16, 64, 49152, 2147483647, 1024, 8, 32], "", 0, []], [[], [["CI", 1], ["FU", 3, [0, 1, 2, 3]], ["SP", 3, 0, 10407936, [44], 1], ["AN", 3, 0, 5], ["AN", 3, 1, 6], ["FU", 2, [0, 1, 2, 3]], ["SP", 2, 0, 10407936, [32], 1], ["AN", 2, 0, 5], ["AN", 2, 1, 6], ["PR", 2, 0, "auto_unroll_max_step$512"]]]], "r": [[0.000881898], 0, 2.05959, 1637918801], "v": "v0.6"}
{"i": [["[\"pool_layer\", \"avg\", 128, 672, 21, 21, 3, 3, 2, \"SAME\"]", "cuda -keys=cuda,gpu -max_num_threads=1024 -thread_warp_size=32", [-1, 16, 64, 49152, 2147483647, 1024, 8, 32], "", 0, []], [[], [["CI", 1], ["FU", 3, [0, 1, 2, 3]], ["SP", 3, 0, 10407936, [4], 1], ["AN", 3, 0, 5], ["AN", 3, 1, 6], ["FU", 2, [0, 1, 2, 3]], ["SP", 2, 0, 10407936, [64], 1], ["AN", 2, 0, 5], ["AN", 2, 1, 6], ["PR", 2, 0, "auto_unroll_max_step$512"]]]], "r": [[0.00431937], 0, 4.29832, 1637918802], "v": "v0.6"}
{"i": [["[\"pool_layer\", \"avg\", 128, 672, 21, 21, 3, 3, 2, \"SAME\"]", "cuda -keys=cuda,gpu -max_num_threads=1024 -thread_warp_size=32", [-1, 16, 64, 49152, 2147483647, 1024, 8, 32], "", 0, []], [[], [["CI", 1], ["FU", 3, [0, 1, 2, 3]], ["SP", 3, 0, 10407936, [2], 1], ["AN", 3, 0, 5], ["AN", 3, 1, 6], ["FU", 2, [0, 1, 2, 3]], ["SP", 2, 0, 10407936, [4], 1], ["AN", 2, 0, 5], ["AN", 2, 1, 6], ["PR", 2, 0, "auto_unroll_max_step$16"]]]], "r": [[0.0121914], 0, 4.3686, 1637918804], "v": "v0.6"}
{"i": [["[\"pool_layer\", \"avg\", 128, 672, 21, 21, 3, 3, 2, \"SAME\"]", "cuda -keys=cuda,gpu -max_num_threads=1024 -thread_warp_size=32", [-1, 16, 64, 49152, 2147483647, 1024, 8, 32], "", 0, []], [[], [["CI", 1], ["FU", 3, [0, 1, 2, 3]], ["SP", 3, 0, 10407936, [32], 1], ["AN", 3, 0, 5], ["AN", 3, 1, 6], ["FU", 2, [0, 1, 2, 3]], ["SP", 2, 0, 10407936, [64], 1], ["AN", 2, 0, 5], ["AN", 2, 1, 6], ["PR", 2, 0, "auto_unroll_max_step$1024"]]]], "r": [[0.000767859], 0, 2.00956, 1637918806], "v": "v0.6"}
{"i": [["[\"pool_layer\", \"avg\", 128, 672, 21, 21, 3, 3, 2, \"SAME\"]", "cuda -keys=cuda,gpu -max_num_threads=1024 -thread_warp_size=32", [-1, 16, 64, 49152, 2147483647, 1024, 8, 32], "", 0, []], [[], [["CI", 1], ["FU", 3, [0, 1, 2, 3]], ["SP", 3, 0, 10407936, [64], 1], ["AN", 3, 0, 5], ["AN", 3, 1, 6], ["FU", 2, [0, 1, 2, 3]], ["SP", 2, 0, 10407936, [32], 1], ["AN", 2, 0, 5], ["AN", 2, 1, 6], ["PR", 2, 0, "auto_unroll_max_step$1024"]]]], "r": [[0.000767154], 0, 4.80437, 1637918807], "v": "v0.6"}
{"i": [["[\"pool_layer\", \"avg\", 128, 672, 21, 21, 3, 3, 2, \"SAME\"]", "cuda -keys=cuda,gpu -max_num_threads=1024 -thread_warp_size=32", [-1, 16, 64, 49152, 2147483647, 1024, 8, 32], "", 0, []], [[], [["CI", 1], ["FU", 3, [0, 1, 2, 3]], ["SP", 3, 0, 10407936, [4], 1], ["AN", 3, 0, 5], ["AN", 3, 1, 6], ["FU", 2, [0, 1, 2, 3]], ["SP", 2, 0, 10407936, [1], 1], ["AN", 2, 0, 5], ["AN", 2, 1, 6], ["PR", 2, 0, "auto_unroll_max_step$512"]]]], "r": [[0.0202989], 0, 4.42071, 1637918809], "v": "v0.6"}
{"i": [["[\"pool_layer\", \"avg\", 128, 672, 21, 21, 3, 3, 2, \"SAME\"]", "cuda -keys=cuda,gpu -max_num_threads=1024 -thread_warp_size=32", [-1, 16, 64, 49152, 2147483647, 1024, 8, 32], "", 0, []], [[], [["CI", 1], ["FU", 3, [0, 1, 2, 3]], ["SP", 3, 0, 10407936, [4], 1], ["AN", 3, 0, 5], ["AN", 3, 1, 6], ["FU", 2, [0, 1, 2, 3]], ["SP", 2, 0, 10407936, [4], 1], ["AN", 2, 0, 5], ["AN", 2, 1, 6], ["PR", 2, 0, "auto_unroll_max_step$512"]]]], "r": [[0.00812169], 0, 4.4904, 1637918810], "v": "v0.6"}
{"i": [["[\"pool_layer\", \"avg\", 128, 672, 21, 21, 3, 3, 2, \"SAME\"]", "cuda -keys=cuda,gpu -max_num_threads=1024 -thread_warp_size=32", [-1, 16, 64, 49152, 2147483647, 1024, 8, 32], "", 0, []], [[], [["CI", 1], ["FU", 3, [0, 1, 2, 3]], ["SP", 3, 0, 10407936, [8], 1], ["AN", 3, 0, 5], ["AN", 3, 1, 6], ["FU", 2, [0, 1, 2, 3]], ["SP", 2, 0, 10407936, [32], 1], ["AN", 2, 0, 5], ["AN", 2, 1, 6], ["PR", 2, 0, "auto_unroll_max_step$512"]]]], "r": [[0.00254214], 0, 4.84361, 1637918812], "v": "v0.6"}
{"i": [["[\"pool_layer\", \"avg\", 128, 672, 21, 21, 3, 3, 2, \"SAME\"]", "cuda -keys=cuda,gpu -max_num_threads=1024 -thread_warp_size=32", [-1, 16, 64, 49152, 2147483647, 1024, 8, 32], "", 0, []], [[], [["CI", 1], ["FU", 3, [0, 1, 2, 3]], ["SP", 3, 0, 10407936, [64], 1], ["AN", 3, 0, 5], ["AN", 3, 1, 6], ["FU", 2, [0, 1, 2, 3]], ["SP", 2, 0, 10407936, [16], 1], ["AN", 2, 0, 5], ["AN", 2, 1, 6], ["PR", 2, 0, "auto_unroll_max_step$512"]]]], "r": [[0.00127347], 0, 4.65598, 1637918814], "v": "v0.6"}
{"i": [["[\"pool_layer\", \"avg\", 128, 672, 21, 21, 3, 3, 2, \"SAME\"]", "cuda -keys=cuda,gpu -max_num_threads=1024 -thread_warp_size=32", [-1, 16, 64, 49152, 2147483647, 1024, 8, 32], "", 0, []], [[], [["CI", 1], ["FU", 3, [0, 1, 2, 3]], ["SP", 3, 0, 10407936, [32], 1], ["AN", 3, 0, 5], ["AN", 3, 1, 6], ["FU", 2, [0, 1, 2, 3]], ["SP", 2, 0, 10407936, [24], 1], ["AN", 2, 0, 5], ["AN", 2, 1, 6], ["PR", 2, 0, "auto_unroll_max_step$512"]]]], "r": [[0.00118918], 0, 4.8891, 1637918816], "v": "v0.6"}
{"i": [["[\"pool_layer\", \"avg\", 128, 672, 21, 21, 3, 3, 2, \"SAME\"]", "cuda -keys=cuda,gpu -max_num_threads=1024 -thread_warp_size=32", [-1, 16, 64, 49152, 2147483647, 1024, 8, 32], "", 0, []], [[], [["CI", 1], ["FU", 3, [0, 1, 2, 3]], ["SP", 3, 0, 10407936, [32], 1], ["AN", 3, 0, 5], ["AN", 3, 1, 6], ["FU", 2, [0, 1, 2, 3]], ["SP", 2, 0, 10407936, [2], 1], ["AN", 2, 0, 5], ["AN", 2, 1, 6], ["PR", 2, 0, "auto_unroll_max_step$512"]]]], "r": [[0.00862961], 0, 4.39827, 1637918817], "v": "v0.6"}
{"i": [["[\"pool_layer\", \"avg\", 128, 672, 21, 21, 3, 3, 2, \"SAME\"]", "cuda -keys=cuda,gpu -max_num_threads=1024 -thread_warp_size=32", [-1, 16, 64, 49152, 2147483647, 1024, 8, 32], "", 0, []], [[], [["CI", 1], ["FU", 3, [0, 1, 2, 3]], ["SP", 3, 0, 10407936, [64], 1], ["AN", 3, 0, 5], ["AN", 3, 1, 6], ["FU", 2, [0, 1, 2, 3]], ["SP", 2, 0, 10407936, [2], 1], ["AN", 2, 0, 5], ["AN", 2, 1, 6], ["PR", 2, 0, "auto_unroll_max_step$16"]]]], "r": [[0.00837576], 0, 4.01436, 1637918818], "v": "v0.6"}
{"i": [["[\"pool_layer\", \"avg\", 128, 672, 21, 21, 3, 3, 2, \"SAME\"]", "cuda -keys=cuda,gpu -max_num_threads=1024 -thread_warp_size=32", [-1, 16, 64, 49152, 2147483647, 1024, 8, 32], "", 0, []], [[], [["CI", 1], ["FU", 3, [0, 1, 2, 3]], ["SP", 3, 0, 10407936, [1], 1], ["AN", 3, 0, 5], ["AN", 3, 1, 6], ["FU", 2, [0, 1, 2, 3]], ["SP", 2, 0, 10407936, [32], 1], ["AN", 2, 0, 5], ["AN", 2, 1, 6], ["PR", 2, 0, "auto_unroll_max_step$1024"]]]], "r": [[0.0167473], 0, 4.01142, 1637918820], "v": "v0.6"}
{"i": [["[\"pool_layer\", \"avg\", 128, 672, 21, 21, 3, 3, 2, \"SAME\"]", "cuda -keys=cuda,gpu -max_num_threads=1024 -thread_warp_size=32", [-1, 16, 64, 49152, 2147483647, 1024, 8, 32], "", 0, []], [[], [["CI", 1], ["FU", 3, [0, 1, 2, 3]], ["SP", 3, 0, 10407936, [44], 1], ["AN", 3, 0, 5], ["AN", 3, 1, 6], ["FU", 2, [0, 1, 2, 3]], ["SP", 2, 0, 10407936, [32], 1], ["AN", 2, 0, 5], ["AN", 2, 1, 6], ["PR", 2, 0, "auto_unroll_max_step$0"]]]], "r": [[0.000888753], 0, 4.45976, 1637918822], "v": "v0.6"}
{"i": [["[\"pool_layer\", \"avg\", 128, 672, 21, 21, 3, 3, 2, \"SAME\"]", "cuda -keys=cuda,gpu -max_num_threads=1024 -thread_warp_size=32", [-1, 16, 64, 49152, 2147483647, 1024, 8, 32], "", 0, []], [[], [["CI", 1], ["FU", 3, [0, 1, 2, 3]], ["SP", 3, 0, 10407936, [1], 1], ["AN", 3, 0, 5], ["AN", 3, 1, 6], ["FU", 2, [0, 1, 2, 3]], ["SP", 2, 0, 10407936, [1], 1], ["AN", 2, 0, 5], ["AN", 2, 1, 6], ["PR", 2, 0, "auto_unroll_max_step$1024"]]]], "r": [[0.0324749], 0, 4.20697, 1637918823], "v": "v0.6"}
{"i": [["[\"pool_layer\", \"avg\", 128, 672, 21, 21, 3, 3, 2, \"SAME\"]", "cuda -keys=cuda,gpu -max_num_threads=1024 -thread_warp_size=32", [-1, 16, 64, 49152, 2147483647, 1024, 8, 32], "", 0, []], [[], [["CI", 1], ["FU", 3, [0, 1, 2, 3]], ["SP", 3, 0, 10407936, [1], 1], ["AN", 3, 0, 5], ["AN", 3, 1, 6], ["FU", 2, [0, 1, 2, 3]], ["SP", 2, 0, 10407936, [2], 1], ["AN", 2, 0, 5], ["AN", 2, 1, 6], ["PR", 2, 0, "auto_unroll_max_step$16"]]]], "r": [[0.0243579], 0, 4.08421, 1637918825], "v": "v0.6"}
{"i": [["[\"pool_layer\", \"avg\", 128, 672, 21, 21, 3, 3, 2, \"SAME\"]", "cuda -keys=cuda,gpu -max_num_threads=1024 -thread_warp_size=32", [-1, 16, 64, 49152, 2147483647, 1024, 8, 32], "", 0, []], [[], [["CI", 1], ["FU", 3, [0, 1, 2, 3]], ["SP", 3, 0, 10407936, [32], 1], ["AN", 3, 0, 5], ["AN", 3, 1, 6], ["FU", 2, [0, 1, 2, 3]], ["SP", 2, 0, 10407936, [48], 1], ["AN", 2, 0, 5], ["AN", 2, 1, 6], ["PR", 2, 0, "auto_unroll_max_step$16"]]]], "r": [[0.000852008], 0, 4.46101, 1637918826], "v": "v0.6"}
{"i": [["[\"pool_layer\", \"avg\", 128, 672, 21, 21, 3, 3, 2, \"SAME\"]", "cuda -keys=cuda,gpu -max_num_threads=1024 -thread_warp_size=32", [-1, 16, 64, 49152, 2147483647, 1024, 8, 32], "", 0, []], [[], [["CI", 1], ["FU", 3, [0, 1, 2, 3]], ["SP", 3, 0, 10407936, [2], 1], ["AN", 3, 0, 5], ["AN", 3, 1, 6], ["FU", 2, [0, 1, 2, 3]], ["SP", 2, 0, 10407936, [64], 1], ["AN", 2, 0, 5], ["AN", 2, 1, 6], ["PR", 2, 0, "auto_unroll_max_step$0"]]]], "r": [[0.00839035], 0, 2.0018, 1637918831], "v": "v0.6"}
{"i": [["[\"pool_layer\", \"avg\", 128, 672, 21, 21, 3, 3, 2, \"SAME\"]", "cuda -keys=cuda,gpu -max_num_threads=1024 -thread_warp_size=32", [-1, 16, 64, 49152, 2147483647, 1024, 8, 32], "", 0, []], [[], [["CI", 1], ["FU", 3, [0, 1, 2, 3]], ["SP", 3, 0, 10407936, [24], 1], ["AN", 3, 0, 5], ["AN", 3, 1, 6], ["FU", 2, [0, 1, 2, 3]], ["SP", 2, 0, 10407936, [64], 1], ["AN", 2, 0, 5], ["AN", 2, 1, 6], ["PR", 2, 0, "auto_unroll_max_step$0"]]]], "r": [[0.000936747], 0, 2.03949, 1637918832], "v": "v0.6"}
{"i": [["[\"pool_layer\", \"avg\", 128, 672, 21, 21, 3, 3, 2, \"SAME\"]", "cuda -keys=cuda,gpu -max_num_threads=1024 -thread_warp_size=32", [-1, 16, 64, 49152, 2147483647, 1024, 8, 32], "", 0, []], [[], [["CI", 1], ["FU", 3, [0, 1, 2, 3]], ["SP", 3, 0, 10407936, [32], 1], ["AN", 3, 0, 5], ["AN", 3, 1, 6], ["FU", 2, [0, 1, 2, 3]], ["SP", 2, 0, 10407936, [1], 1], ["AN", 2, 0, 5], ["AN", 2, 1, 6], ["PR", 2, 0, "auto_unroll_max_step$1024"]]]], "r": [[0.0167477], 0, 1.60184, 1637918834], "v": "v0.6"}
{"i": [["[\"pool_layer\", \"avg\", 128, 672, 21, 21, 3, 3, 2, \"SAME\"]", "cuda -keys=cuda,gpu -max_num_threads=1024 -thread_warp_size=32", [-1, 16, 64, 49152, 2147483647, 1024, 8, 32], "", 0, []], [[], [["CI", 1], ["FU", 3, [0, 1, 2, 3]], ["SP", 3, 0, 10407936, [32], 1], ["AN", 3, 0, 5], ["AN", 3, 1, 6], ["FU", 2, [0, 1, 2, 3]], ["SP", 2, 0, 10407936, [48], 1], ["AN", 2, 0, 5], ["AN", 2, 1, 6], ["PR", 2, 0, "auto_unroll_max_step$0"]]]], "r": [[0.000851944], 0, 1.99646, 1637918836], "v": "v0.6"}
{"i": [["[\"pool_layer\", \"avg\", 128, 672, 21, 21, 3, 3, 2, \"SAME\"]", "cuda -keys=cuda,gpu -max_num_threads=1024 -thread_warp_size=32", [-1, 16, 64, 49152, 2147483647, 1024, 8, 32], "", 0, []], [[], [["CI", 1], ["FU", 3, [0, 1, 2, 3]], ["SP", 3, 0, 10407936, [4], 1], ["AN", 3, 0, 5], ["AN", 3, 1, 6], ["FU", 2, [0, 1, 2, 3]], ["SP", 2, 0, 10407936, [1], 1], ["AN", 2, 0, 5], ["AN", 2, 1, 6], ["PR", 2, 0, "auto_unroll_max_step$16"]]]], "r": [[0.0202995], 0, 1.62832, 1637918837], "v": "v0.6"}
{"i": [["[\"pool_layer\", \"avg\", 128, 672, 21, 21, 3, 3, 2, \"SAME\"]", "cuda -keys=cuda,gpu -max_num_threads=1024 -thread_warp_size=32", [-1, 16, 64, 49152, 2147483647, 1024, 8, 32], "", 0, []], [[], [["CI", 1], ["FU", 3, [0, 1, 2, 3]], ["SP", 3, 0, 10407936, [4], 1], ["AN", 3, 0, 5], ["AN", 3, 1, 6], ["FU", 2, [0, 1, 2, 3]], ["SP", 2, 0, 10407936, [64], 1], ["AN", 2, 0, 5], ["AN", 2, 1, 6], ["PR", 2, 0, "auto_unroll_max_step$16"]]]], "r": [[0.00431968], 0, 1.53195, 1637918838], "v": "v0.6"}
{"i": [["[\"pool_layer\", \"avg\", 128, 672, 21, 21, 3, 3, 2, \"SAME\"]", "cuda -keys=cuda,gpu -max_num_threads=1024 -thread_warp_size=32", [-1, 16, 64, 49152, 2147483647, 1024, 8, 32], "", 0, []], [[], [["CI", 1], ["FU", 3, [0, 1, 2, 3]], ["SP", 3, 0, 10407936, [32], 1], ["AN", 3, 0, 5], ["AN", 3, 1, 6], ["FU", 2, [0, 1, 2, 3]], ["SP", 2, 0, 10407936, [64], 1], ["AN", 2, 0, 5], ["AN", 2, 1, 6], ["PR", 2, 0, "auto_unroll_max_step$512"]]]], "r": [[0.000768015], 0, 2.00303, 1637918840], "v": "v0.6"}
{"i": [["[\"pool_layer\", \"avg\", 128, 672, 21, 21, 3, 3, 2, \"SAME\"]", "cuda -keys=cuda,gpu -max_num_threads=1024 -thread_warp_size=32", [-1, 16, 64, 49152, 2147483647, 1024, 8, 32], "", 0, []], [[], [["CI", 1], ["FU", 3, [0, 1, 2, 3]], ["SP", 3, 0, 10407936, [4], 1], ["AN", 3, 0, 5], ["AN", 3, 1, 6], ["FU", 2, [0, 1, 2, 3]], ["SP", 2, 0, 10407936, [32], 1], ["AN", 2, 0, 5], ["AN", 2, 1, 6], ["PR", 2, 0, "auto_unroll_max_step$64"]]]], "r": [[0.00457193], 0, 1.57371, 1637918841], "v": "v0.6"}
{"i": [["[\"pool_layer\", \"avg\", 128, 672, 21, 21, 3, 3, 2, \"SAME\"]", "cuda -keys=cuda,gpu -max_num_threads=1024 -thread_warp_size=32", [-1, 16, 64, 49152, 2147483647, 1024, 8, 32], "", 0, []], [[], [["CI", 1], ["FU", 3, [0, 1, 2, 3]], ["SP", 3, 0, 10407936, [7], 1], ["AN", 3, 0, 5], ["AN", 3, 1, 6], ["FU", 2, [0, 1, 2, 3]], ["SP", 2, 0, 10407936, [64], 1], ["AN", 2, 0, 5], ["AN", 2, 1, 6], ["PR", 2, 0, "auto_unroll_max_step$0"]]]], "r": [[0.00258026], 0, 1.58882, 1637918843], "v": "v0.6"}
{"i": [["[\"pool_layer\", \"avg\", 128, 672, 21, 21, 3, 3, 2, \"SAME\"]", "cuda -keys=cuda,gpu -max_num_threads=1024 -thread_warp_size=32", [-1, 16, 64, 49152, 2147483647, 1024, 8, 32], "", 0, []], [[], [["CI", 1], ["FU", 3, [0, 1, 2, 3]], ["SP", 3, 0, 10407936, [32], 1], ["AN", 3, 0, 5], ["AN", 3, 1, 6], ["FU", 2, [0, 1, 2, 3]], ["SP", 2, 0, 10407936, [24], 1], ["AN", 2, 0, 5], ["AN", 2, 1, 6], ["PR", 2, 0, "auto_unroll_max_step$1024"]]]], "r": [[0.00118911], 0, 2.01307, 1637918844], "v": "v0.6"}
{"i": [["[\"pool_layer\", \"avg\", 128, 672, 21, 21, 3, 3, 2, \"SAME\"]", "cuda -keys=cuda,gpu -max_num_threads=1024 -thread_warp_size=32", [-1, 16, 64, 49152, 2147483647, 1024, 8, 32], "", 0, []], [[], [["CI", 1], ["FU", 3, [0, 1, 2, 3]], ["SP", 3, 0, 10407936, [2], 1], ["AN", 3, 0, 5], ["AN", 3, 1, 6], ["FU", 2, [0, 1, 2, 3]], ["SP", 2, 0, 10407936, [32], 1], ["AN", 2, 0, 5], ["AN", 2, 1, 6], ["PR", 2, 0, "auto_unroll_max_step$16"]]]], "r": [[0.00863046], 0, 1.56318, 1637918846], "v": "v0.6"}
{"i": [["[\"pool_layer\", \"avg\", 128, 672, 21, 21, 3, 3, 2, \"SAME\"]", "cuda -keys=cuda,gpu -max_num_threads=1024 -thread_warp_size=32", [-1, 16, 64, 49152, 2147483647, 1024, 8, 32], "", 0, []], [[], [["CI", 1], ["FU", 3, [0, 1, 2, 3]], ["SP", 3, 0, 10407936, [48], 1], ["AN", 3, 0, 5], ["AN", 3, 1, 6], ["FU", 2, [0, 1, 2, 3]], ["SP", 2, 0, 10407936, [64], 1], ["AN", 2, 0, 5], ["AN", 2, 1, 6], ["PR", 2, 0, "auto_unroll_max_step$1024"]]]], "r": [[0.000598807], 0, 2.04014, 1637918848], "v": "v0.6"}
{"i": [["[\"pool_layer\", \"avg\", 128, 672, 21, 21, 3, 3, 2, \"SAME\"]", "cuda -keys=cuda,gpu -max_num_threads=1024 -thread_warp_size=32", [-1, 16, 64, 49152, 2147483647, 1024, 8, 32], "", 0, []], [[], [["CI", 1], ["FU", 3, [0, 1, 2, 3]], ["SP", 3, 0, 10407936, [28], 1], ["AN", 3, 0, 5], ["AN", 3, 1, 6], ["FU", 2, [0, 1, 2, 3]], ["SP", 2, 0, 10407936, [32], 1], ["AN", 2, 0, 5], ["AN", 2, 1, 6], ["PR", 2, 0, "auto_unroll_max_step$512"]]]], "r": [[0.00109275], 0, 2.04324, 1637918849], "v": "v0.6"}
{"i": [["[\"pool_layer\", \"avg\", 128, 672, 21, 21, 3, 3, 2, \"SAME\"]", "cuda -keys=cuda,gpu -max_num_threads=1024 -thread_warp_size=32", [-1, 16, 64, 49152, 2147483647, 1024, 8, 32], "", 0, []], [[], [["CI", 1], ["FU", 3, [0, 1, 2, 3]], ["SP", 3, 0, 10407936, [32], 1], ["AN", 3, 0, 5], ["AN", 3, 1, 6], ["FU", 2, [0, 1, 2, 3]], ["SP", 2, 0, 10407936, [32], 1], ["AN", 2, 0, 5], ["AN", 2, 1, 6], ["PR", 2, 0, "auto_unroll_max_step$16"]]]], "r": [[0.00102038], 0, 2.01613, 1637918851], "v": "v0.6"}
{"i": [["[\"pool_layer\", \"avg\", 128, 672, 21, 21, 3, 3, 2, \"SAME\"]", "cuda -keys=cuda,gpu -max_num_threads=1024 -thread_warp_size=32", [-1, 16, 64, 49152, 2147483647, 1024, 8, 32], "", 0, []], [[], [["CI", 1], ["FU", 3, [0, 1, 2, 3]], ["SP", 3, 0, 10407936, [32], 1], ["AN", 3, 0, 5], ["AN", 3, 1, 6], ["FU", 2, [0, 1, 2, 3]], ["SP", 2, 0, 10407936, [32], 1], ["AN", 2, 0, 5], ["AN", 2, 1, 6], ["PR", 2, 0, "auto_unroll_max_step$64"]]]], "r": [[0.00102047], 0, 1.60828, 1637918853], "v": "v0.6"}
{"i": [["[\"pool_layer\", \"avg\", 128, 672, 21, 21, 3, 3, 2, \"SAME\"]", "cuda -keys=cuda,gpu -max_num_threads=1024 -thread_warp_size=32", [-1, 16, 64, 49152, 2147483647, 1024, 8, 32], "", 0, []], [[], [["CI", 1], ["FU", 3, [0, 1, 2, 3]], ["SP", 3, 0, 10407936, [32], 1], ["AN", 3, 0, 5], ["AN", 3, 1, 6], ["FU", 2, [0, 1, 2, 3]], ["SP", 2, 0, 10407936, [32], 1], ["AN", 2, 0, 5], ["AN", 2, 1, 6], ["PR", 2, 0, "auto_unroll_max_step$1024"]]]], "r": [[0.00102057], 0, 1.51598, 1637918854], "v": "v0.6"}
{"i": [["[\"pool_layer\", \"avg\", 128, 672, 21, 21, 3, 3, 2, \"SAME\"]", "cuda -keys=cuda,gpu -max_num_threads=1024 -thread_warp_size=32", [-1, 16, 64, 49152, 2147483647, 1024, 8, 32], "", 0, []], [[], [["CI", 1], ["FU", 3, [0, 1, 2, 3]], ["SP", 3, 0, 10407936, [56], 1], ["AN", 3, 0, 5], ["AN", 3, 1, 6], ["FU", 2, [0, 1, 2, 3]], ["SP", 2, 0, 10407936, [8], 1], ["AN", 2, 0, 5], ["AN", 2, 1, 6], ["PR", 2, 0, "auto_unroll_max_step$1024"]]]], "r": [[0.00232404], 0, 2.04637, 1637918868], "v": "v0.6"}
{"i": [["[\"pool_layer\", \"avg\", 128, 672, 21, 21, 3, 3, 2, \"SAME\"]", "cuda -keys=cuda,gpu -max_num_threads=1024 -thread_warp_size=32", [-1, 16, 64, 49152, 2147483647, 1024, 8, 32], "", 0, []], [[], [["CI", 1], ["FU", 3, [0, 1, 2, 3]], ["SP", 3, 0, 10407936, [64], 1], ["AN", 3, 0, 5], ["AN", 3, 1, 6], ["FU", 2, [0, 1, 2, 3]], ["SP", 2, 0, 10407936, [2], 1], ["AN", 2, 0, 5], ["AN", 2, 1, 6], ["PR", 2, 0, "auto_unroll_max_step$1024"]]]], "r": [[0.00837577], 0, 1.61808, 1637918869], "v": "v0.6"}
{"i": [["[\"pool_layer\", \"avg\", 128, 672, 21, 21, 3, 3, 2, \"SAME\"]", "cuda -keys=cuda,gpu -max_num_threads=1024 -thread_warp_size=32", [-1, 16, 64, 49152, 2147483647, 1024, 8, 32], "", 0, []], [[], [["CI", 1], ["FU", 3, [0, 1, 2, 3]], ["SP", 3, 0, 10407936, [64], 1], ["AN", 3, 0, 5], ["AN", 3, 1, 6], ["FU", 2, [0, 1, 2, 3]], ["SP", 2, 0, 10407936, [8], 1], ["AN", 2, 0, 5], ["AN", 2, 1, 6], ["PR", 2, 0, "auto_unroll_max_step$16"]]]], "r": [[0.00228803], 0, 2.09106, 1637918871], "v": "v0.6"}
{"i": [["[\"pool_layer\", \"avg\", 128, 672, 21, 21, 3, 3, 2, \"SAME\"]", "cuda -keys=cuda,gpu -max_num_threads=1024 -thread_warp_size=32", [-1, 16, 64, 49152, 2147483647, 1024, 8, 32], "", 0, []], [[], [["CI", 1], ["FU", 3, [0, 1, 2, 3]], ["SP", 3, 0, 10407936, [48], 1], ["AN", 3, 0, 5], ["AN", 3, 1, 6], ["FU", 2, [0, 1, 2, 3]], ["SP", 2, 0, 10407936, [16], 1], ["AN", 2, 0, 5], ["AN", 2, 1, 6], ["PR", 2, 0, "auto_unroll_max_step$1024"]]]], "r": [[0.00135792], 0, 1.70755, 1637918872], "v": "v0.6"}
{"i": [["[\"pool_layer\", \"avg\", 128, 672, 21, 21, 3, 3, 2, \"SAME\"]", "cuda -keys=cuda,gpu -max_num_threads=1024 -thread_warp_size=32", [-1, 16, 64, 49152, 2147483647, 1024, 8, 32], "", 0, []], [[], [["CI", 1], ["FU", 3, [0, 1, 2, 3]], ["SP", 3, 0, 10407936, [28], 1], ["AN", 3, 0, 5], ["AN", 3, 1, 6], ["FU", 2, [0, 1, 2, 3]], ["SP", 2, 0, 10407936, [32], 1], ["AN", 2, 0, 5], ["AN", 2, 1, 6], ["PR", 2, 0, "auto_unroll_max_step$16"]]]], "r": [[0.00109273], 0, 2.03403, 1637918874], "v": "v0.6"}
{"i": [["[\"pool_layer\", \"avg\", 128, 672, 21, 21, 3, 3, 2, \"SAME\"]", "cuda -keys=cuda,gpu -max_num_threads=1024 -thread_warp_size=32", [-1, 16, 64, 49152, 2147483647, 1024, 8, 32], "", 0, []], [[], [["CI", 1], ["FU", 3, [0, 1, 2, 3]], ["SP", 3, 0, 10407936, [1], 1], ["AN", 3, 0, 5], ["AN", 3, 1, 6], ["FU", 2, [0, 1, 2, 3]], ["SP", 2, 0, 10407936, [4], 1], ["AN", 2, 0, 5], ["AN", 2, 1, 6], ["PR", 2, 0, "auto_unroll_max_step$1024"]]]], "r": [[0.020299], 0, 1.69701, 1637918875], "v": "v0.6"}
{"i": [["[\"pool_layer\", \"avg\", 128, 672, 21, 21, 3, 3, 2, \"SAME\"]", "cuda -keys=cuda,gpu -max_num_threads=1024 -thread_warp_size=32", [-1, 16, 64, 49152, 2147483647, 1024, 8, 32], "", 0, []], [[], [["CI", 1], ["FU", 3, [0, 1, 2, 3]], ["SP", 3, 0, 10407936, [22], 1], ["AN", 3, 0, 5], ["AN", 3, 1, 6], ["FU", 2, [0, 1, 2, 3]], ["SP", 2, 0, 10407936, [64], 1], ["AN", 2, 0, 5], ["AN", 2, 1, 6], ["PR", 2, 0, "auto_unroll_max_step$512"]]]], "r": [[0.000998687], 0, 2.10175, 1637918877], "v": "v0.6"}
{"i": [["[\"pool_layer\", \"avg\", 128, 672, 21, 21, 3, 3, 2, \"SAME\"]", "cuda -keys=cuda,gpu -max_num_threads=1024 -thread_warp_size=32", [-1, 16, 64, 49152, 2147483647, 1024, 8, 32], "", 0, []], [[], [["CI", 1], ["FU", 3, [0, 1, 2, 3]], ["SP", 3, 0, 10407936, [32], 1], ["AN", 3, 0, 5], ["AN", 3, 1, 6], ["FU", 2, [0, 1, 2, 3]], ["SP", 2, 0, 10407936, [1], 1], ["AN", 2, 0, 5], ["AN", 2, 1, 6], ["PR", 2, 0, "auto_unroll_max_step$64"]]]], "r": [[0.0167475], 0, 1.66671, 1637918879], "v": "v0.6"}
{"i": [["[\"pool_layer\", \"avg\", 128, 672, 21, 21, 3, 3, 2, \"SAME\"]", "cuda -keys=cuda,gpu -max_num_threads=1024 -thread_warp_size=32", [-1, 16, 64, 49152, 2147483647, 1024, 8, 32], "", 0, []], [[], [["CI", 1], ["FU", 3, [0, 1, 2, 3]], ["SP", 3, 0, 10407936, [3], 1], ["AN", 3, 0, 5], ["AN", 3, 1, 6], ["FU", 2, [0, 1, 2, 3]], ["SP", 2, 0, 10407936, [28], 1], ["AN", 2, 0, 5], ["AN", 2, 1, 6], ["PR", 2, 0, "auto_unroll_max_step$1024"]]]], "r": [[0.00599715], 0, 2.08662, 1637918880], "v": "v0.6"}
{"i": [["[\"pool_layer\", \"avg\", 128, 672, 21, 21, 3, 3, 2, \"SAME\"]", "cuda -keys=cuda,gpu -max_num_threads=1024 -thread_warp_size=32", [-1, 16, 64, 49152, 2147483647, 1024, 8, 32], "", 0, []], [[], [["CI", 1], ["FU", 3, [0, 1, 2, 3]], ["SP", 3, 0, 10407936, [24], 1], ["AN", 3, 0, 5], ["AN", 3, 1, 6], ["FU", 2, [0, 1, 2, 3]], ["SP", 2, 0, 10407936, [28], 1], ["AN", 2, 0, 5], ["AN", 2, 1, 6], ["PR", 2, 0, "auto_unroll_max_step$0"]]]], "r": [[0.00126156], 0, 1.61352, 1637918882], "v": "v0.6"}
{"i": [["[\"pool_layer\", \"avg\", 128, 672, 21, 21, 3, 3, 2, \"SAME\"]", "cuda -keys=cuda,gpu -max_num_threads=1024 -thread_warp_size=32", [-1, 16, 64, 49152, 2147483647, 1024, 8, 32], "", 0, []], [[], [["CI", 1], ["FU", 3, [0, 1, 2, 3]], ["SP", 3, 0, 10407936, [7], 1], ["AN", 3, 0, 5], ["AN", 3, 1, 6], ["FU", 2, [0, 1, 2, 3]], ["SP", 2, 0, 10407936, [8], 1], ["AN", 2, 0, 5], ["AN", 2, 1, 6], ["PR", 2, 0, "auto_unroll_max_step$0"]]]], "r": [[0.00435314], 0, 1.61578, 1637918883], "v": "v0.6"}
{"i": [["[\"pool_layer\", \"avg\", 128, 672, 21, 21, 3, 3, 2, \"SAME\"]", "cuda -keys=cuda,gpu -max_num_threads=1024 -thread_warp_size=32", [-1, 16, 64, 49152, 2147483647, 1024, 8, 32], "", 0, []], [[], [["CI", 1], ["FU", 3, [0, 1, 2, 3]], ["SP", 3, 0, 10407936, [11], 1], ["AN", 3, 0, 5], ["AN", 3, 1, 6], ["FU", 2, [0, 1, 2, 3]], ["SP", 2, 0, 10407936, [14], 1], ["AN", 2, 0, 5], ["AN", 2, 1, 6], ["PR", 2, 0, "auto_unroll_max_step$512"]]]], "r": [[0.00264061], 0, 1.80971, 1637918885], "v": "v0.6"}
{"i": [["[\"pool_layer\", \"avg\", 128, 672, 21, 21, 3, 3, 2, \"SAME\"]", "cuda -keys=cuda,gpu -max_num_threads=1024 -thread_warp_size=32", [-1, 16, 64, 49152, 2147483647, 1024, 8, 32], "", 0, []], [[], [["CI", 1], ["FU", 3, [0, 1, 2, 3]], ["SP", 3, 0, 10407936, [1], 1], ["AN", 3, 0, 5], ["AN", 3, 1, 6], ["FU", 2, [0, 1, 2, 3]], ["SP", 2, 0, 10407936, [4], 1], ["AN", 2, 0, 5], ["AN", 2, 1, 6], ["PR", 2, 0, "auto_unroll_max_step$512"]]]], "r": [[0.0202974], 0, 1.63253, 1637918886], "v": "v0.6"}
{"i": [["[\"pool_layer\", \"avg\", 128, 672, 21, 21, 3, 3, 2, \"SAME\"]", "cuda -keys=cuda,gpu -max_num_threads=1024 -thread_warp_size=32", [-1, 16, 64, 49152, 2147483647, 1024, 8, 32], "", 0, []], [[], [["CI", 1], ["FU", 3, [0, 1, 2, 3]], ["SP", 3, 0, 10407936, [56], 1], ["AN", 3, 0, 5], ["AN", 3, 1, 6], ["FU", 2, [0, 1, 2, 3]], ["SP", 2, 0, 10407936, [64], 1], ["AN", 2, 0, 5], ["AN", 2, 1, 6], ["PR", 2, 0, "auto_unroll_max_step$16"]]]], "r": [[0.000550276], 0, 2.07592, 1637918888], "v": "v0.6"}
{"i": [["[\"pool_layer\", \"avg\", 128, 672, 21, 21, 3, 3, 2, \"SAME\"]", "cuda -keys=cuda,gpu -max_num_threads=1024 -thread_warp_size=32", [-1, 16, 64, 49152, 2147483647, 1024, 8, 32], "", 0, []], [[], [["CI", 1], ["FU", 3, [0, 1, 2, 3]], ["SP", 3, 0, 10407936, [8], 1], ["AN", 3, 0, 5], ["AN", 3, 1, 6], ["FU", 2, [0, 1, 2, 3]], ["SP", 2, 0, 10407936, [1], 1], ["AN", 2, 0, 5], ["AN", 2, 1, 6], ["PR", 2, 0, "auto_unroll_max_step$64"]]]], "r": [[0.0182694], 0, 1.69871, 1637918889], "v": "v0.6"}
{"i": [["[\"pool_layer\", \"avg\", 128, 672, 21, 21, 3, 3, 2, \"SAME\"]", "cuda -keys=cuda,gpu -max_num_threads=1024 -thread_warp_size=32", [-1, 16, 64, 49152, 2147483647, 1024, 8, 32], "", 0, []], [[], [["CI", 1], ["FU", 3, [0, 1, 2, 3]], ["SP", 3, 0, 10407936, [2], 1], ["AN", 3, 0, 5], ["AN", 3, 1, 6], ["FU", 2, [0, 1, 2, 3]], ["SP", 2, 0, 10407936, [16], 1], ["AN", 2, 0, 5], ["AN", 2, 1, 6], ["PR", 2, 0, "auto_unroll_max_step$512"]]]], "r": [[0.00913772], 0, 1.81137, 1637918891], "v": "v0.6"}
{"i": [["[\"pool_layer\", \"avg\", 128, 672, 21, 21, 3, 3, 2, \"SAME\"]", "cuda -keys=cuda,gpu -max_num_threads=1024 -thread_warp_size=32", [-1, 16, 64, 49152, 2147483647, 1024, 8, 32], "", 0, []], [[], [["CI", 1], ["FU", 3, [0, 1, 2, 3]], ["SP", 3, 0, 10407936, [8], 1], ["AN", 3, 0, 5], ["AN", 3, 1, 6], ["FU", 2, [0, 1, 2, 3]], ["SP", 2, 0, 10407936, [2], 1], ["AN", 2, 0, 5], ["AN", 2, 1, 6], ["PR", 2, 0, "auto_unroll_max_step$0"]]]], "r": [[0.0101513], 0, 1.68515, 1637918892], "v": "v0.6"}
{"i": [["[\"pool_layer\", \"avg\", 128, 672, 21, 21, 3, 3, 2, \"SAME\"]", "cuda -keys=cuda,gpu -max_num_threads=1024 -thread_warp_size=32", [-1, 16, 64, 49152, 2147483647, 1024, 8, 32], "", 0, []], [[], [["CI", 1], ["FU", 3, [0, 1, 2, 3]], ["SP", 3, 0, 10407936, [44], 1], ["AN", 3, 0, 5], ["AN", 3, 1, 6], ["FU", 2, [0, 1, 2, 3]], ["SP", 2, 0, 10407936, [8], 1], ["AN", 2, 0, 5], ["AN", 2, 1, 6], ["PR", 2, 0, "auto_unroll_max_step$16"]]]], "r": [[0.00240331], 0, 1.63207, 1637918894], "v": "v0.6"}
{"i": [["[\"pool_layer\", \"avg\", 128, 672, 21, 21, 3, 3, 2, \"SAME\"]", "cuda -keys=cuda,gpu -max_num_threads=1024 -thread_warp_size=32", [-1, 16, 64, 49152, 2147483647, 1024, 8, 32], "", 0, []], [[], [["CI", 1], ["FU", 3, [0, 1, 2, 3]], ["SP", 3, 0, 10407936, [1], 1], ["AN", 3, 0, 5], ["AN", 3, 1, 6], ["FU", 2, [0, 1, 2, 3]], ["SP", 2, 0, 10407936, [48], 1], ["AN", 2, 0, 5], ["AN", 2, 1, 6], ["PR", 2, 0, "auto_unroll_max_step$0"]]]], "r": [[0.0165788], 0, 1.715, 1637918895], "v": "v0.6"}
{"i": [["[\"pool_layer\", \"avg\", 128, 672, 21, 21, 3, 3, 2, \"SAME\"]", "cuda -keys=cuda,gpu -max_num_threads=1024 -thread_warp_size=32", [-1, 16, 64, 49152, 2147483647, 1024, 8, 32], "", 0, []], [[], [["CI", 1], ["FU", 3, [0, 1, 2, 3]], ["SP", 3, 0, 10407936, [16], 1], ["AN", 3, 0, 5], ["AN", 3, 1, 6], ["FU", 2, [0, 1, 2, 3]], ["SP", 2, 0, 10407936, [2], 1], ["AN", 2, 0, 5], ["AN", 2, 1, 6], ["PR", 2, 0, "auto_unroll_max_step$16"]]]], "r": [[0.00913642], 0, 1.65309, 1637918896], "v": "v0.6"}
{"i": [["[\"pool_layer\", \"avg\", 128, 672, 21, 21, 3, 3, 2, \"SAME\"]", "cuda -keys=cuda,gpu -max_num_threads=1024 -thread_warp_size=32", [-1, 16, 64, 49152, 2147483647, 1024, 8, 32], "", 0, []], [[], [["CI", 1], ["FU", 3, [0, 1, 2, 3]], ["SP", 3, 0, 10407936, [56], 1], ["AN", 3, 0, 5], ["AN", 3, 1, 6], ["FU", 2, [0, 1, 2, 3]], ["SP", 2, 0, 10407936, [64], 1], ["AN", 2, 0, 5], ["AN", 2, 1, 6], ["PR", 2, 0, "auto_unroll_max_step$512"]]]], "r": [[0.000550326], 0, 2.03339, 1637918898], "v": "v0.6"}
{"i": [["[\"pool_layer\", \"avg\", 128, 672, 21, 21, 3, 3, 2, \"SAME\"]", "cuda -keys=cuda,gpu -max_num_threads=1024 -thread_warp_size=32", [-1, 16, 64, 49152, 2147483647, 1024, 8, 32], "", 0, []], [[], [["CI", 1], ["FU", 3, [0, 1, 2, 3]], ["SP", 3, 0, 10407936, [8], 1], ["AN", 3, 0, 5], ["AN", 3, 1, 6], ["FU", 2, [0, 1, 2, 3]], ["SP", 2, 0, 10407936, [4], 1], ["AN", 2, 0, 5], ["AN", 2, 1, 6], ["PR", 2, 0, "auto_unroll_max_step$1024"]]]], "r": [[0.00609315], 0, 3.78702, 1637918899], "v": "v0.6"}
{"i": [["[\"pool_layer\", \"avg\", 128, 672, 21, 21, 3, 3, 2, \"SAME\"]", "cuda -keys=cuda,gpu -max_num_threads=1024 -thread_warp_size=32", [-1, 16, 64, 49152, 2147483647, 1024, 8, 32], "", 0, []], [[], [["CI", 1], ["FU", 3, [0, 1, 2, 3]], ["SP", 3, 0, 10407936, [24], 1], ["AN", 3, 0, 5], ["AN", 3, 1, 6], ["FU", 2, [0, 1, 2, 3]], ["SP", 2, 0, 10407936, [32], 1], ["AN", 2, 0, 5], ["AN", 2, 1, 6], ["PR", 2, 0, "auto_unroll_max_step$0"]]]], "r": [[0.00118931], 0, 2.12941, 1637918901], "v": "v0.6"}
{"i": [["[\"pool_layer\", \"avg\", 128, 672, 21, 21, 3, 3, 2, \"SAME\"]", "cuda -keys=cuda,gpu -max_num_threads=1024 -thread_warp_size=32", [-1, 16, 64, 49152, 2147483647, 1024, 8, 32], "", 0, []], [[], [["CI", 1], ["FU", 3, [0, 1, 2, 3]], ["SP", 3, 0, 10407936, [1], 1], ["AN", 3, 0, 5], ["AN", 3, 1, 6], ["FU", 2, [0, 1, 2, 3]], ["SP", 2, 0, 10407936, [32], 1], ["AN", 2, 0, 5], ["AN", 2, 1, 6], ["PR", 2, 0, "auto_unroll_max_step$16"]]]], "r": [[0.016752], 0, 1.85687, 1637918903], "v": "v0.6"}
{"i": [["[\"pool_layer\", \"avg\", 128, 672, 21, 21, 3, 3, 2, \"SAME\"]", "cuda -keys=cuda,gpu -max_num_threads=1024 -thread_warp_size=32", [-1, 16, 64, 49152, 2147483647, 1024, 8, 32], "", 0, []], [[], [["CI", 1], ["FU", 3, [0, 1, 2, 3]], ["SP", 3, 0, 10407936, [1], 1], ["AN", 3, 0, 5], ["AN", 3, 1, 6], ["FU", 2, [0, 1, 2, 3]], ["SP", 2, 0, 10407936, [48], 1], ["AN", 2, 0, 5], ["AN", 2, 1, 6], ["PR", 2, 0, "auto_unroll_max_step$16"]]]], "r": [[0.0165785], 0, 1.63641, 1637918904], "v": "v0.6"}
{"i": [["[\"pool_layer\", \"avg\", 128, 672, 21, 21, 3, 3, 2, \"SAME\"]", "cuda -keys=cuda,gpu -max_num_threads=1024 -thread_warp_size=32", [-1, 16, 64, 49152, 2147483647, 1024, 8, 32], "", 0, []], [[], [["CI", 1], ["FU", 3, [0, 1, 2, 3]], ["SP", 3, 0, 10407936, [48], 1], ["AN", 3, 0, 5], ["AN", 3, 1, 6], ["FU", 2, [0, 1, 2, 3]], ["SP", 2, 0, 10407936, [56], 1], ["AN", 2, 0, 5], ["AN", 2, 1, 6], ["PR", 2, 0, "auto_unroll_max_step$1024"]]]], "r": [[0.000634473], 0, 4.13912, 1637918906], "v": "v0.6"}
{"i": [["[\"pool_layer\", \"avg\", 128, 672, 21, 21, 3, 3, 2, \"SAME\"]", "cuda -keys=cuda,gpu -max_num_threads=1024 -thread_warp_size=32", [-1, 16, 64, 49152, 2147483647, 1024, 8, 32], "", 0, []], [[], [["CI", 1], ["FU", 3, [0, 1, 2, 3]], ["SP", 3, 0, 10407936, [1], 1], ["AN", 3, 0, 5], ["AN", 3, 1, 6], ["FU", 2, [0, 1, 2, 3]], ["SP", 2, 0, 10407936, [48], 1], ["AN", 2, 0, 5], ["AN", 2, 1, 6], ["PR", 2, 0, "auto_unroll_max_step$1024"]]]], "r": [[0.0165797], 0, 1.61069, 1637918907], "v": "v0.6"}
{"i": [["[\"pool_layer\", \"avg\", 128, 672, 21, 21, 3, 3, 2, \"SAME\"]", "cuda -keys=cuda,gpu -max_num_threads=1024 -thread_warp_size=32", [-1, 16, 64, 49152, 2147483647, 1024, 8, 32], "", 0, []], [[], [["CI", 1], ["FU", 3, [0, 1, 2, 3]], ["SP", 3, 0, 10407936, [6], 1], ["AN", 3, 0, 5], ["AN", 3, 1, 6], ["FU", 2, [0, 1, 2, 3]], ["SP", 2, 0, 10407936, [7], 1], ["AN", 2, 0, 5], ["AN", 2, 1, 6], ["PR", 2, 0, "auto_unroll_max_step$512"]]]], "r": [[0.00503073], 0, 3.87462, 1637918909], "v": "v0.6"}
{"i": [["[\"pool_layer\", \"avg\", 128, 672, 21, 21, 3, 3, 2, \"SAME\"]", "cuda -keys=cuda,gpu -max_num_threads=1024 -thread_warp_size=32", [-1, 16, 64, 49152, 2147483647, 1024, 8, 32], "", 0, []], [[], [["CI", 1], ["FU", 3, [0, 1, 2, 3]], ["SP", 3, 0, 10407936, [48], 1], ["AN", 3, 0, 5], ["AN", 3, 1, 6], ["FU", 2, [0, 1, 2, 3]], ["SP", 2, 0, 10407936, [2], 1], ["AN", 2, 0, 5], ["AN", 2, 1, 6], ["PR", 2, 0, "auto_unroll_max_step$1024"]]]], "r": [[0.00846046], 0, 3.68974, 1637918910], "v": "v0.6"}
{"i": [["[\"pool_layer\", \"avg\", 128, 672, 21, 21, 3, 3, 2, \"SAME\"]", "cuda -keys=cuda,gpu -max_num_threads=1024 -thread_warp_size=32", [-1, 16, 64, 49152, 2147483647, 1024, 8, 32], "", 0, []], [[], [["CI", 1], ["FU", 3, [0, 1, 2, 3]], ["SP", 3, 0, 10407936, [64], 1], ["AN", 3, 0, 5], ["AN", 3, 1, 6], ["FU", 2, [0, 1, 2, 3]], ["SP", 2, 0, 10407936, [12], 1], ["AN", 2, 0, 5], ["AN", 2, 1, 6], ["PR", 2, 0, "auto_unroll_max_step$0"]]]], "r": [[0.00161162], 0, 2.07241, 1637918912], "v": "v0.6"}
{"i": [["[\"pool_layer\", \"avg\", 128, 672, 21, 21, 3, 3, 2, \"SAME\"]", "cuda -keys=cuda,gpu -max_num_threads=1024 -thread_warp_size=32", [-1, 16, 64, 49152, 2147483647, 1024, 8, 32], "", 0, []], [[], [["CI", 1], ["FU", 3, [0, 1, 2, 3]], ["SP", 3, 0, 10407936, [1], 1], ["AN", 3, 0, 5], ["AN", 3, 1, 6], ["FU", 2, [0, 1, 2, 3]], ["SP", 2, 0, 10407936, [24], 1], ["AN", 2, 0, 5], ["AN", 2, 1, 6], ["PR", 2, 0, "auto_unroll_max_step$16"]]]], "r": [[0.0169161], 0, 3.83018, 1637918914], "v": "v0.6"}
{"i": [["[\"pool_layer\", \"avg\", 128, 672, 21, 21, 3, 3, 2, \"SAME\"]", "cuda -keys=cuda,gpu -max_num_threads=1024 -thread_warp_size=32", [-1, 16, 64, 49152, 2147483647, 1024, 8, 32], "", 0, []], [[], [["CI", 1], ["FU", 3, [0, 1, 2, 3]], ["SP", 3, 0, 10407936, [48], 1], ["AN", 3, 0, 5], ["AN", 3, 1, 6], ["FU", 2, [0, 1, 2, 3]], ["SP", 2, 0, 10407936, [48], 1], ["AN", 2, 0, 5], ["AN", 2, 1, 6], ["PR", 2, 0, "auto_unroll_max_step$1024"]]]], "r": [[0.000682735], 0, 4.04778, 1637918915], "v": "v0.6"}
{"i": [["[\"pool_layer\", \"avg\", 128, 672, 21, 21, 3, 3, 2, \"SAME\"]", "cuda -keys=cuda,gpu -max_num_threads=1024 -thread_warp_size=32", [-1, 16, 64, 49152, 2147483647, 1024, 8, 32], "", 0, []], [[], [["CI", 1], ["FU", 3, [0, 1, 2, 3]], ["SP", 3, 0, 10407936, [1], 1], ["AN", 3, 0, 5], ["AN", 3, 1, 6], ["FU", 2, [0, 1, 2, 3]], ["SP", 2, 0, 10407936, [2], 1], ["AN", 2, 0, 5], ["AN", 2, 1, 6], ["PR", 2, 0, "auto_unroll_max_step$0"]]]], "r": [[0.024358], 0, 3.77302, 1637918917], "v": "v0.6"}
{"i": [["[\"pool_layer\", \"avg\", 128, 672, 21, 21, 3, 3, 2, \"SAME\"]", "cuda -keys=cuda,gpu -max_num_threads=1024 -thread_warp_size=32", [-1, 16, 64, 49152, 2147483647, 1024, 8, 32], "", 0, []], [[], [["CI", 1], ["FU", 3, [0, 1, 2, 3]], ["SP", 3, 0, 10407936, [4], 1], ["AN", 3, 0, 5], ["AN", 3, 1, 6], ["FU", 2, [0, 1, 2, 3]], ["SP", 2, 0, 10407936, [64], 1], ["AN", 2, 0, 5], ["AN", 2, 1, 6], ["PR", 2, 0, "auto_unroll_max_step$64"]]]], "r": [[0.00431964], 0, 3.77798, 1637918918], "v": "v0.6"}
{"i": [["[\"pool_layer\", \"avg\", 128, 672, 21, 21, 3, 3, 2, \"SAME\"]", "cuda -keys=cuda,gpu -max_num_threads=1024 -thread_warp_size=32", [-1, 16, 64, 49152, 2147483647, 1024, 8, 32], "", 0, []], [[], [["CI", 1], ["FU", 3, [0, 1, 2, 3]], ["SP", 3, 0, 10407936, [2], 1], ["AN", 3, 0, 5], ["AN", 3, 1, 6], ["FU", 2, [0, 1, 2, 3]], ["SP", 2, 0, 10407936, [32], 1], ["AN", 2, 0, 5], ["AN", 2, 1, 6], ["PR", 2, 0, "auto_unroll_max_step$512"]]]], "r": [[0.00863002], 0, 3.70925, 1637918920], "v": "v0.6"}
{"i": [["[\"pool_layer\", \"avg\", 128, 672, 21, 21, 3, 3, 2, \"SAME\"]", "cuda -keys=cuda,gpu -max_num_threads=1024 -thread_warp_size=32", [-1, 16, 64, 49152, 2147483647, 1024, 8, 32], "", 0, []], [[], [["CI", 1], ["FU", 3, [0, 1, 2, 3]], ["SP", 3, 0, 10407936, [32], 1], ["AN", 3, 0, 5], ["AN", 3, 1, 6], ["FU", 2, [0, 1, 2, 3]], ["SP", 2, 0, 10407936, [7], 1], ["AN", 2, 0, 5], ["AN", 2, 1, 6], ["PR", 2, 0, "auto_unroll_max_step$1024"]]]], "r": [[0.00283147], 0, 3.81076, 1637918921], "v": "v0.6"}
{"i": [["[\"pool_layer\", \"avg\", 128, 672, 21, 21, 3, 3, 2, \"SAME\"]", "cuda -keys=cuda,gpu -max_num_threads=1024 -thread_warp_size=32", [-1, 16, 64, 49152, 2147483647, 1024, 8, 32], "", 0, []], [[], [["CI", 1], ["FU", 3, [0, 1, 2, 3]], ["SP", 3, 0, 10407936, [8], 1], ["AN", 3, 0, 5], ["AN", 3, 1, 6], ["FU", 2, [0, 1, 2, 3]], ["SP", 2, 0, 10407936, [2], 1], ["AN", 2, 0, 5], ["AN", 2, 1, 6], ["PR", 2, 0, "auto_unroll_max_step$16"]]]], "r": [[0.0101516], 0, 3.97141, 1637918922], "v": "v0.6"}
{"i": [["[\"pool_layer\", \"avg\", 128, 672, 21, 21, 3, 3, 2, \"SAME\"]", "cuda -keys=cuda,gpu -max_num_threads=1024 -thread_warp_size=32", [-1, 16, 64, 49152, 2147483647, 1024, 8, 32], "", 0, []], [[], [["CI", 1], ["FU", 3, [0, 1, 2, 3]], ["SP", 3, 0, 10407936, [48], 1], ["AN", 3, 0, 5], ["AN", 3, 1, 6], ["FU", 2, [0, 1, 2, 3]], ["SP", 2, 0, 10407936, [4], 1], ["AN", 2, 0, 5], ["AN", 2, 1, 6], ["PR", 2, 0, "auto_unroll_max_step$512"]]]], "r": [[0.00440212], 0, 4.3473, 1637918924], "v": "v0.6"}
{"i": [["[\"pool_layer\", \"avg\", 128, 672, 21, 21, 3, 3, 2, \"SAME\"]", "cuda -keys=cuda,gpu -max_num_threads=1024 -thread_warp_size=32", [-1, 16, 64, 49152, 2147483647, 1024, 8, 32], "", 0, []], [[], [["CI", 1], ["FU", 3, [0, 1, 2, 3]], ["SP", 3, 0, 10407936, [64], 1], ["AN", 3, 0, 5], ["AN", 3, 1, 6], ["FU", 2, [0, 1, 2, 3]], ["SP", 2, 0, 10407936, [4], 1], ["AN", 2, 0, 5], ["AN", 2, 1, 6], ["PR", 2, 0, "auto_unroll_max_step$512"]]]], "r": [[0.00431714], 0, 4.02225, 1637918925], "v": "v0.6"}
{"i": [["[\"pool_layer\", \"avg\", 128, 672, 21, 21, 3, 3, 2, \"SAME\"]", "cuda -keys=cuda,gpu -max_num_threads=1024 -thread_warp_size=32", [-1, 16, 64, 49152, 2147483647, 1024, 8, 32], "", 0, []], [[], [["CI", 1], ["FU", 3, [0, 1, 2, 3]], ["SP", 3, 0, 10407936, [24], 1], ["AN", 3, 0, 5], ["AN", 3, 1, 6], ["FU", 2, [0, 1, 2, 3]], ["SP", 2, 0, 10407936, [1], 1], ["AN", 2, 0, 5], ["AN", 2, 1, 6], ["PR", 2, 0, "auto_unroll_max_step$16"]]]], "r": [[0.0169142], 0, 3.98584, 1637918927], "v": "v0.6"}
{"i": [["[\"pool_layer\", \"avg\", 128, 672, 21, 21, 3, 3, 2, \"SAME\"]", "cuda -keys=cuda,gpu -max_num_threads=1024 -thread_warp_size=32", [-1, 16, 64, 49152, 2147483647, 1024, 8, 32], "", 0, []], [[], [["CI", 1], ["FU", 3, [0, 1, 2, 3]], ["SP", 3, 0, 10407936, [32], 1], ["AN", 3, 0, 5], ["AN", 3, 1, 6], ["FU", 2, [0, 1, 2, 3]], ["SP", 2, 0, 10407936, [64], 1], ["AN", 2, 0, 5], ["AN", 2, 1, 6], ["PR", 2, 0, "auto_unroll_max_step$0"]]]], "r": [[0.000767927], 0, 4.43116, 1637918929], "v": "v0.6"}
{"i": [["[\"pool_layer\", \"avg\", 128, 672, 21, 21, 3, 3, 2, \"SAME\"]", "cuda -keys=cuda,gpu -max_num_threads=1024 -thread_warp_size=32", [-1, 16, 64, 49152, 2147483647, 1024, 8, 32], "", 0, []], [[], [["CI", 1], ["FU", 3, [0, 1, 2, 3]], ["SP", 3, 0, 10407936, [1], 1], ["AN", 3, 0, 5], ["AN", 3, 1, 6], ["FU", 2, [0, 1, 2, 3]], ["SP", 2, 0, 10407936, [2], 1], ["AN", 2, 0, 5], ["AN", 2, 1, 6], ["PR", 2, 0, "auto_unroll_max_step$512"]]]], "r": [[0.0243562], 0, 4.23194, 1637918930], "v": "v0.6"}
{"i": [["[\"pool_layer\", \"avg\", 128, 672, 21, 21, 3, 3, 2, \"SAME\"]", "cuda -keys=cuda,gpu -max_num_threads=1024 -thread_warp_size=32", [-1, 16, 64, 49152, 2147483647, 1024, 8, 32], "", 0, []], [[], [["CI", 1], ["FU", 3, [0, 1, 2, 3]], ["SP", 3, 0, 10407936, [32], 1], ["AN", 3, 0, 5], ["AN", 3, 1, 6], ["FU", 2, [0, 1, 2, 3]], ["SP", 2, 0, 10407936, [48], 1], ["AN", 2, 0, 5], ["AN", 2, 1, 6], ["PR", 2, 0, "auto_unroll_max_step$512"]]]], "r": [[0.000851902], 0, 4.4035, 1637918932], "v": "v0.6"}
{"i": [["[\"pool_layer\", \"avg\", 128, 672, 21, 21, 3, 3, 2, \"SAME\"]", "cuda -keys=cuda,gpu -max_num_threads=1024 -thread_warp_size=32", [-1, 16, 64, 49152, 2147483647, 1024, 8, 32], "", 0, []], [[], [["CI", 1], ["FU", 3, [0, 1, 2, 3]], ["SP", 3, 0, 10407936, [56], 1], ["AN", 3, 0, 5], ["AN", 3, 1, 6], ["FU", 2, [0, 1, 2, 3]], ["SP", 2, 0, 10407936, [24], 1], ["AN", 2, 0, 5], ["AN", 2, 1, 6], ["PR", 2, 0, "auto_unroll_max_step$0"]]]], "r": [[0.000971752], 0, 4.56754, 1637918934], "v": "v0.6"}
{"i": [["[\"pool_layer\", \"avg\", 128, 672, 21, 21, 3, 3, 2, \"SAME\"]", "cuda -keys=cuda,gpu -max_num_threads=1024 -thread_warp_size=32", [-1, 16, 64, 49152, 2147483647, 1024, 8, 32], "", 0, []], [[], [["CI", 1], ["FU", 3, [0, 1, 2, 3]], ["SP", 3, 0, 10407936, [4], 1], ["AN", 3, 0, 5], ["AN", 3, 1, 6], ["FU", 2, [0, 1, 2, 3]], ["SP", 2, 0, 10407936, [4], 1], ["AN", 2, 0, 5], ["AN", 2, 1, 6], ["PR", 2, 0, "auto_unroll_max_step$1024"]]]], "r": [[0.00812333], 0, 4.24127, 1637918935], "v": "v0.6"}
{"i": [["[\"pool_layer\", \"avg\", 128, 672, 21, 21, 3, 3, 2, \"SAME\"]", "cuda -keys=cuda,gpu -max_num_threads=1024 -thread_warp_size=32", [-1, 16, 64, 49152, 2147483647, 1024, 8, 32], "", 0, []], [[], [["CI", 1], ["FU", 3, [0, 1, 2, 3]], ["SP", 3, 0, 10407936, [8], 1], ["AN", 3, 0, 5], ["AN", 3, 1, 6], ["FU", 2, [0, 1, 2, 3]], ["SP", 2, 0, 10407936, [2], 1], ["AN", 2, 0, 5], ["AN", 2, 1, 6], ["PR", 2, 0, "auto_unroll_max_step$1024"]]]], "r": [[0.0101513], 0, 4.15255, 1637918936], "v": "v0.6"}
{"i": [["[\"pool_layer\", \"avg\", 128, 672, 21, 21, 3, 3, 2, \"SAME\"]", "cuda -keys=cuda,gpu -max_num_threads=1024 -thread_warp_size=32", [-1, 16, 64, 49152, 2147483647, 1024, 8, 32], "", 0, []], [[], [["CI", 1], ["FU", 3, [0, 1, 2, 3]], ["SP", 3, 0, 10407936, [1], 1], ["AN", 3, 0, 5], ["AN", 3, 1, 6], ["FU", 2, [0, 1, 2, 3]], ["SP", 2, 0, 10407936, [64], 1], ["AN", 2, 0, 5], ["AN", 2, 1, 6], ["PR", 2, 0, "auto_unroll_max_step$0"]]]], "r": [[0.0164951], 0, 3.86008, 1637918938], "v": "v0.6"}
{"i": [["[\"pool_layer\", \"avg\", 128, 672, 21, 21, 3, 3, 2, \"SAME\"]", "cuda -keys=cuda,gpu -max_num_threads=1024 -thread_warp_size=32", [-1, 16, 64, 49152, 2147483647, 1024, 8, 32], "", 0, []], [[], [["CI", 1], ["FU", 3, [0, 1, 2, 3]], ["SP", 3, 0, 10407936, [12], 1], ["AN", 3, 0, 5], ["AN", 3, 1, 6], ["FU", 2, [0, 1, 2, 3]], ["SP", 2, 0, 10407936, [4], 1], ["AN", 2, 0, 5], ["AN", 2, 1, 6], ["PR", 2, 0, "auto_unroll_max_step$16"]]]], "r": [[0.00541644], 0, 3.59947, 1637918939], "v": "v0.6"}
{"i": [["[\"pool_layer\", \"avg\", 128, 672, 21, 21, 3, 3, 2, \"SAME\"]", "cuda -keys=cuda,gpu -max_num_threads=1024 -thread_warp_size=32", [-1, 16, 64, 49152, 2147483647, 1024, 8, 32], "", 0, []], [[], [["CI", 1], ["FU", 3, [0, 1, 2, 3]], ["SP", 3, 0, 10407936, [2], 1], ["AN", 3, 0, 5], ["AN", 3, 1, 6], ["FU", 2, [0, 1, 2, 3]], ["SP", 2, 0, 10407936, [1], 1], ["AN", 2, 0, 5], ["AN", 2, 1, 6], ["PR", 2, 0, "auto_unroll_max_step$0"]]]], "r": [[0.0243556], 0, 2.10583, 1637918943], "v": "v0.6"}
{"i": [["[\"pool_layer\", \"avg\", 128, 672, 21, 21, 3, 3, 2, \"SAME\"]", "cuda -keys=cuda,gpu -max_num_threads=1024 -thread_warp_size=32", [-1, 16, 64, 49152, 2147483647, 1024, 8, 32], "", 0, []], [[], [["CI", 1], ["FU", 3, [0, 1, 2, 3]], ["SP", 3, 0, 10407936, [8], 1], ["AN", 3, 0, 5], ["AN", 3, 1, 6], ["FU", 2, [0, 1, 2, 3]], ["SP", 2, 0, 10407936, [44], 1], ["AN", 2, 0, 5], ["AN", 2, 1, 6], ["PR", 2, 0, "auto_unroll_max_step$512"]]]], "r": [[0.00240435], 0, 1.58434, 1637918945], "v": "v0.6"}
{"i": [["[\"pool_layer\", \"avg\", 128, 672, 21, 21, 3, 3, 2, \"SAME\"]", "cuda -keys=cuda,gpu -max_num_threads=1024 -thread_warp_size=32", [-1, 16, 64, 49152, 2147483647, 1024, 8, 32], "", 0, []], [[], [["CI", 1], ["FU", 3, [0, 1, 2, 3]], ["SP", 3, 0, 10407936, [64], 1], ["AN", 3, 0, 5], ["AN", 3, 1, 6], ["FU", 2, [0, 1, 2, 3]], ["SP", 2, 0, 10407936, [4], 1], ["AN", 2, 0, 5], ["AN", 2, 1, 6], ["PR", 2, 0, "auto_unroll_max_step$64"]]]], "r": [[0.00431675], 0, 1.55422, 1637918946], "v": "v0.6"}
{"i": [["[\"pool_layer\", \"avg\", 128, 672, 21, 21, 3, 3, 2, \"SAME\"]", "cuda -keys=cuda,gpu -max_num_threads=1024 -thread_warp_size=32", [-1, 16, 64, 49152, 2147483647, 1024, 8, 32], "", 0, []], [[], [["CI", 1], ["FU", 3, [0, 1, 2, 3]], ["SP", 3, 0, 10407936, [2], 1], ["AN", 3, 0, 5], ["AN", 3, 1, 6], ["FU", 2, [0, 1, 2, 3]], ["SP", 2, 0, 10407936, [64], 1], ["AN", 2, 0, 5], ["AN", 2, 1, 6], ["PR", 2, 0, "auto_unroll_max_step$64"]]]], "r": [[0.0083776], 0, 1.56164, 1637918947], "v": "v0.6"}
{"i": [["[\"pool_layer\", \"avg\", 128, 672, 21, 21, 3, 3, 2, \"SAME\"]", "cuda -keys=cuda,gpu -max_num_threads=1024 -thread_warp_size=32", [-1, 16, 64, 49152, 2147483647, 1024, 8, 32], "", 0, []], [[], [["CI", 1], ["FU", 3, [0, 1, 2, 3]], ["SP", 3, 0, 10407936, [1], 1], ["AN", 3, 0, 5], ["AN", 3, 1, 6], ["FU", 2, [0, 1, 2, 3]], ["SP", 2, 0, 10407936, [12], 1], ["AN", 2, 0, 5], ["AN", 2, 1, 6], ["PR", 2, 0, "auto_unroll_max_step$0"]]]], "r": [[0.0175903], 0, 1.69981, 1637918949], "v": "v0.6"}
{"i": [["[\"pool_layer\", \"avg\", 128, 672, 21, 21, 3, 3, 2, \"SAME\"]", "cuda -keys=cuda,gpu -max_num_threads=1024 -thread_warp_size=32", [-1, 16, 64, 49152, 2147483647, 1024, 8, 32], "", 0, []], [[], [["CI", 1], ["FU", 3, [0, 1, 2, 3]], ["SP", 3, 0, 10407936, [4], 1], ["AN", 3, 0, 5], ["AN", 3, 1, 6], ["FU", 2, [0, 1, 2, 3]], ["SP", 2, 0, 10407936, [16], 1], ["AN", 2, 0, 5], ["AN", 2, 1, 6], ["PR", 2, 0, "auto_unroll_max_step$1024"]]]], "r": [[0.00507822], 0, 1.55465, 1637918950], "v": "v0.6"}
{"i": [["[\"pool_layer\", \"avg\", 128, 672, 21, 21, 3, 3, 2, \"SAME\"]", "cuda -keys=cuda,gpu -max_num_threads=1024 -thread_warp_size=32", [-1, 16, 64, 49152, 2147483647, 1024, 8, 32], "", 0, []], [[], [["CI", 1], ["FU", 3, [0, 1, 2, 3]], ["SP", 3, 0, 10407936, [28], 1], ["AN", 3, 0, 5], ["AN", 3, 1, 6], ["FU", 2, [0, 1, 2, 3]], ["SP", 2, 0, 10407936, [24], 1], ["AN", 2, 0, 5], ["AN", 2, 1, 6], ["PR", 2, 0, "auto_unroll_max_step$512"]]]], "r": [[0.0012617], 0, 1.60338, 1637918952], "v": "v0.6"}
{"i": [["[\"pool_layer\", \"avg\", 128, 672, 21, 21, 3, 3, 2, \"SAME\"]", "cuda -keys=cuda,gpu -max_num_threads=1024 -thread_warp_size=32", [-1, 16, 64, 49152, 2147483647, 1024, 8, 32], "", 0, []], [[], [["CI", 1], ["FU", 3, [0, 1, 2, 3]], ["SP", 3, 0, 10407936, [2], 1], ["AN", 3, 0, 5], ["AN", 3, 1, 6], ["FU", 2, [0, 1, 2, 3]], ["SP", 2, 0, 10407936, [1], 1], ["AN", 2, 0, 5], ["AN", 2, 1, 6], ["PR", 2, 0, "auto_unroll_max_step$16"]]]], "r": [[0.024359], 0, 1.80481, 1637918953], "v": "v0.6"}
{"i": [["[\"pool_layer\", \"avg\", 128, 672, 21, 21, 3, 3, 2, \"SAME\"]", "cuda -keys=cuda,gpu -max_num_threads=1024 -thread_warp_size=32", [-1, 16, 64, 49152, 2147483647, 1024, 8, 32], "", 0, []], [[], [["CI", 1], ["FU", 3, [0, 1, 2, 3]], ["SP", 3, 0, 10407936, [24], 1], ["AN", 3, 0, 5], ["AN", 3, 1, 6], ["FU", 2, [0, 1, 2, 3]], ["SP", 2, 0, 10407936, [64], 1], ["AN", 2, 0, 5], ["AN", 2, 1, 6], ["PR", 2, 0, "auto_unroll_max_step$1024"]]]], "r": [[0.000936668], 0, 2.0013, 1637918955], "v": "v0.6"}
{"i": [["[\"pool_layer\", \"avg\", 128, 672, 21, 21, 3, 3, 2, \"SAME\"]", "cuda -keys=cuda,gpu -max_num_threads=1024 -thread_warp_size=32", [-1, 16, 64, 49152, 2147483647, 1024, 8, 32], "", 0, []], [[], [["CI", 1], ["FU", 3, [0, 1, 2, 3]], ["SP", 3, 0, 10407936, [16], 1], ["AN", 3, 0, 5], ["AN", 3, 1, 6], ["FU", 2, [0, 1, 2, 3]], ["SP", 2, 0, 10407936, [44], 1], ["AN", 2, 0, 5], ["AN", 2, 1, 6], ["PR", 2, 0, "auto_unroll_max_step$512"]]]], "r": [[0.00138971], 0, 1.56105, 1637918956], "v": "v0.6"}
{"i": [["[\"pool_layer\", \"avg\", 128, 672, 21, 21, 3, 3, 2, \"SAME\"]", "cuda -keys=cuda,gpu -max_num_threads=1024 -thread_warp_size=32", [-1, 16, 64, 49152, 2147483647, 1024, 8, 32], "", 0, []], [[], [["CI", 1], ["FU", 3, [0, 1, 2, 3]], ["SP", 3, 0, 10407936, [3], 1], ["AN", 3, 0, 5], ["AN", 3, 1, 6], ["FU", 2, [0, 1, 2, 3]], ["SP", 2, 0, 10407936, [4], 1], ["AN", 2, 0, 5], ["AN", 2, 1, 6], ["PR", 2, 0, "auto_unroll_max_step$0"]]]], "r": [[0.00947417], 0, 1.63338, 1637918958], "v": "v0.6"}
{"i": [["[\"pool_layer\", \"avg\", 128, 672, 21, 21, 3, 3, 2, \"SAME\"]", "cuda -keys=cuda,gpu -max_num_threads=1024 -thread_warp_size=32", [-1, 16, 64, 49152, 2147483647, 1024, 8, 32], "", 0, []], [[], [["CI", 1], ["FU", 3, [0, 1, 2, 3]], ["SP", 3, 0, 10407936, [1], 1], ["AN", 3, 0, 5], ["AN", 3, 1, 6], ["FU", 2, [0, 1, 2, 3]], ["SP", 2, 0, 10407936, [24], 1], ["AN", 2, 0, 5], ["AN", 2, 1, 6], ["PR", 2, 0, "auto_unroll_max_step$0"]]]], "r": [[0.0169166], 0, 1.73728, 1637918959], "v": "v0.6"}
{"i": [["[\"pool_layer\", \"avg\", 128, 672, 21, 21, 3, 3, 2, \"SAME\"]", "cuda -keys=cuda,gpu -max_num_threads=1024 -thread_warp_size=32", [-1, 16, 64, 49152, 2147483647, 1024, 8, 32], "", 0, []], [[], [["CI", 1], ["FU", 3, [0, 1, 2, 3]], ["SP", 3, 0, 10407936, [48], 1], ["AN", 3, 0, 5], ["AN", 3, 1, 6], ["FU", 2, [0, 1, 2, 3]], ["SP", 2, 0, 10407936, [32], 1], ["AN", 2, 0, 5], ["AN", 2, 1, 6], ["PR", 2, 0, "auto_unroll_max_step$16"]]]], "r": [[0.000851111], 0, 2.04823, 1637918961], "v": "v0.6"}
{"i": [["[\"pool_layer\", \"avg\", 128, 672, 21, 21, 3, 3, 2, \"SAME\"]", "cuda -keys=cuda,gpu -max_num_threads=1024 -thread_warp_size=32", [-1, 16, 64, 49152, 2147483647, 1024, 8, 32], "", 0, []], [[], [["CI", 1], ["FU", 3, [0, 1, 2, 3]], ["SP", 3, 0, 10407936, [64], 1], ["AN", 3, 0, 5], ["AN", 3, 1, 6], ["FU", 2, [0, 1, 2, 3]], ["SP", 2, 0, 10407936, [48], 1], ["AN", 2, 0, 5], ["AN", 2, 1, 6], ["PR", 2, 0, "auto_unroll_max_step$0"]]]], "r": [[0.00059816], 0, 2.06363, 1637918963], "v": "v0.6"}
{"i": [["[\"pool_layer\", \"avg\", 128, 672, 21, 21, 3, 3, 2, \"SAME\"]", "cuda -keys=cuda,gpu -max_num_threads=1024 -thread_warp_size=32", [-1, 16, 64, 49152, 2147483647, 1024, 8, 32], "", 0, []], [[], [["CI", 1], ["FU", 3, [0, 1, 2, 3]], ["SP", 3, 0, 10407936, [64], 1], ["AN", 3, 0, 5], ["AN", 3, 1, 6], ["FU", 2, [0, 1, 2, 3]], ["SP", 2, 0, 10407936, [1], 1], ["AN", 2, 0, 5], ["AN", 2, 1, 6], ["PR", 2, 0, "auto_unroll_max_step$1024"]]]], "r": [[0.0164958], 0, 1.66197, 1637918964], "v": "v0.6"}
