artifacts/microbenchmark/tvm/e2e/ansor_log/ansor_avg_pooling_128_2016_21_21_1_1_2_VALID.log
{"i": [["[\"pool_layer\", \"avg\", 128, 2016, 21, 21, 1, 1, 2, \"VALID\"]", "cuda -keys=cuda,gpu -max_num_threads=1024 -thread_warp_size=32", [-1, 16, 64, 49152, 2147483647, 1024, 8, 32], "", 0, []], [[], [["FU", 2, [0, 1, 2, 3]], ["SP", 2, 0, 31223808, [32], 1], ["AN", 2, 0, 5], ["AN", 2, 1, 6], ["FU", 1, [0, 1, 2, 3]], ["SP", 1, 0, 31223808, [32], 1], ["AN", 1, 0, 5], ["AN", 1, 1, 6], ["PR", 1, 0, "auto_unroll_max_step$16"]]]], "r": [[0.00305114], 0, 3.18478, 1637921647], "v": "v0.6"}
{"i": [["[\"pool_layer\", \"avg\", 128, 2016, 21, 21, 1, 1, 2, \"VALID\"]", "cuda -keys=cuda,gpu -max_num_threads=1024 -thread_warp_size=32", [-1, 16, 64, 49152, 2147483647, 1024, 8, 32], "", 0, []], [[], [["FU", 2, [0, 1, 2, 3]], ["SP", 2, 0, 31223808, [64], 1], ["AN", 2, 0, 5], ["AN", 2, 1, 6], ["FU", 1, [0, 1, 2, 3]], ["SP", 1, 0, 31223808, [32], 1], ["AN", 1, 0, 5], ["AN", 1, 1, 6], ["PR", 1, 0, "auto_unroll_max_step$16"]]]], "r": [[0.00228759], 0, 3.29654, 1637921650], "v": "v0.6"}
{"i": [["[\"pool_layer\", \"avg\", 128, 2016, 21, 21, 1, 1, 2, \"VALID\"]", "cuda -keys=cuda,gpu -max_num_threads=1024 -thread_warp_size=32", [-1, 16, 64, 49152, 2147483647, 1024, 8, 32], "", 0, []], [[], [["FU", 2, [0, 1, 2, 3]], ["SP", 2, 0, 31223808, [32], 1], ["AN", 2, 0, 5], ["AN", 2, 1, 6], ["FU", 1, [0, 1, 2, 3]], ["SP", 1, 0, 31223808, [64], 1], ["AN", 1, 0, 5], ["AN", 1, 1, 6], ["PR", 1, 0, "auto_unroll_max_step$1024"]]]], "r": [[0.00228804], 0, 3.3405, 1637921653], "v": "v0.6"}
{"i": [["[\"pool_layer\", \"avg\", 128, 2016, 21, 21, 1, 1, 2, \"VALID\"]", "cuda -keys=cuda,gpu -max_num_threads=1024 -thread_warp_size=32", [-1, 16, 64, 49152, 2147483647, 1024, 8, 32], "", 0, []], [[], [["FU", 2, [0, 1, 2, 3]], ["SP", 2, 0, 31223808, [32], 1], ["AN", 2, 0, 5], ["AN", 2, 1, 6], ["FU", 1, [0, 1, 2, 3]], ["SP", 1, 0, 31223808, [12], 1], ["AN", 1, 0, 5], ["AN", 1, 1, 6], ["PR", 1, 0, "auto_unroll_max_step$512"]]]], "r": [[0.00558439], 0, 2.86493, 1637921655], "v": "v0.6"}
{"i": [["[\"pool_layer\", \"avg\", 128, 2016, 21, 21, 1, 1, 2, \"VALID\"]", "cuda -keys=cuda,gpu -max_num_threads=1024 -thread_warp_size=32", [-1, 16, 64, 49152, 2147483647, 1024, 8, 32], "", 0, []], [[], [["FU", 2, [0, 1, 2, 3]], ["SP", 2, 0, 31223808, [32], 1], ["AN", 2, 0, 5], ["AN", 2, 1, 6], ["FU", 1, [0, 1, 2, 3]], ["SP", 1, 0, 31223808, [1], 1], ["AN", 1, 0, 5], ["AN", 1, 1, 6], ["PR", 1, 0, "auto_unroll_max_step$1024"]]]], "r": [[0.0502185], 0, 3.05546, 1637921658], "v": "v0.6"}
{"i": [["[\"pool_layer\", \"avg\", 128, 2016, 21, 21, 1, 1, 2, \"VALID\"]", "cuda -keys=cuda,gpu -max_num_threads=1024 -thread_warp_size=32", [-1, 16, 64, 49152, 2147483647, 1024, 8, 32], "", 0, []], [[], [["FU", 2, [0, 1, 2, 3]], ["SP", 2, 0, 31223808, [32], 1], ["AN", 2, 0, 5], ["AN", 2, 1, 6], ["FU", 1, [0, 1, 2, 3]], ["SP", 1, 0, 31223808, [48], 1], ["AN", 1, 0, 5], ["AN", 1, 1, 6], ["PR", 1, 0, "auto_unroll_max_step$0"]]]], "r": [[0.00254155], 0, 3.34715, 1637921661], "v": "v0.6"}
{"i": [["[\"pool_layer\", \"avg\", 128, 2016, 21, 21, 1, 1, 2, \"VALID\"]", "cuda -keys=cuda,gpu -max_num_threads=1024 -thread_warp_size=32", [-1, 16, 64, 49152, 2147483647, 1024, 8, 32], "", 0, []], [[], [["FU", 2, [0, 1, 2, 3]], ["SP", 2, 0, 31223808, [64], 1], ["AN", 2, 0, 5], ["AN", 2, 1, 6], ["FU", 1, [0, 1, 2, 3]], ["SP", 1, 0, 31223808, [2], 1], ["AN", 1, 0, 5], ["AN", 1, 1, 6], ["PR", 1, 0, "auto_unroll_max_step$1024"]]]], "r": [[0.0251127], 0, 2.87589, 1637921664], "v": "v0.6"}
{"i": [["[\"pool_layer\", \"avg\", 128, 2016, 21, 21, 1, 1, 2, \"VALID\"]", "cuda -keys=cuda,gpu -max_num_threads=1024 -thread_warp_size=32", [-1, 16, 64, 49152, 2147483647, 1024, 8, 32], "", 0, []], [[], [["FU", 2, [0, 1, 2, 3]], ["SP", 2, 0, 31223808, [1], 1], ["AN", 2, 0, 5], ["AN", 2, 1, 6], ["FU", 1, [0, 1, 2, 3]], ["SP", 1, 0, 31223808, [1], 1], ["AN", 1, 0, 5], ["AN", 1, 1, 6], ["PR", 1, 0, "auto_unroll_max_step$1024"]]]], "r": [[0.106037], 0, 3.38453, 1637921667], "v": "v0.6"}
{"i": [["[\"pool_layer\", \"avg\", 128, 2016, 21, 21, 1, 1, 2, \"VALID\"]", "cuda -keys=cuda,gpu -max_num_threads=1024 -thread_warp_size=32", [-1, 16, 64, 49152, 2147483647, 1024, 8, 32], "", 0, []], [[], [["FU", 2, [0, 1, 2, 3]], ["SP", 2, 0, 31223808, [32], 1], ["AN", 2, 0, 5], ["AN", 2, 1, 6], ["FU", 1, [0, 1, 2, 3]], ["SP", 1, 0, 31223808, [32], 1], ["AN", 1, 0, 5], ["AN", 1, 1, 6], ["PR", 1, 0, "auto_unroll_max_step$0"]]]], "r": [[0.00304849], 0, 3.29297, 1637921670], "v": "v0.6"}
{"i": [["[\"pool_layer\", \"avg\", 128, 2016, 21, 21, 1, 1, 2, \"VALID\"]", "cuda -keys=cuda,gpu -max_num_threads=1024 -thread_warp_size=32", [-1, 16, 64, 49152, 2147483647, 1024, 8, 32], "", 0, []], [[], [["FU", 2, [0, 1, 2, 3]], ["SP", 2, 0, 31223808, [63], 1], ["AN", 2, 0, 5], ["AN", 2, 1, 6], ["FU", 1, [0, 1, 2, 3]], ["SP", 1, 0, 31223808, [32], 1], ["AN", 1, 0, 5], ["AN", 1, 1, 6], ["PR", 1, 0, "auto_unroll_max_step$0"]]]], "r": [[0.00230018], 0, 2.73518, 1637921672], "v": "v0.6"}
{"i": [["[\"pool_layer\", \"avg\", 128, 2016, 21, 21, 1, 1, 2, \"VALID\"]", "cuda -keys=cuda,gpu -max_num_threads=1024 -thread_warp_size=32", [-1, 16, 64, 49152, 2147483647, 1024, 8, 32], "", 0, []], [[], [["FU", 2, [0, 1, 2, 3]], ["SP", 2, 0, 31223808, [16], 1], ["AN", 2, 0, 5], ["AN", 2, 1, 6], ["FU", 1, [0, 1, 2, 3]], ["SP", 1, 0, 31223808, [64], 1], ["AN", 1, 0, 5], ["AN", 1, 1, 6], ["PR", 1, 0, "auto_unroll_max_step$16"]]]], "r": [[0.00380974], 0, 2.78935, 1637921675], "v": "v0.6"}
{"i": [["[\"pool_layer\", \"avg\", 128, 2016, 21, 21, 1, 1, 2, \"VALID\"]", "cuda -keys=cuda,gpu -max_num_threads=1024 -thread_warp_size=32", [-1, 16, 64, 49152, 2147483647, 1024, 8, 32], "", 0, []], [[], [["FU", 2, [0, 1, 2, 3]], ["SP", 2, 0, 31223808, [1], 1], ["AN", 2, 0, 5], ["AN", 2, 1, 6], ["FU", 1, [0, 1, 2, 3]], ["SP", 1, 0, 31223808, [64], 1], ["AN", 1, 0, 5], ["AN", 1, 1, 6], ["PR", 1, 0, "auto_unroll_max_step$1024"]]]], "r": [[0.04946], 0, 3.04484, 1637921678], "v": "v0.6"}
{"i": [["[\"pool_layer\", \"avg\", 128, 2016, 21, 21, 1, 1, 2, \"VALID\"]", "cuda -keys=cuda,gpu -max_num_threads=1024 -thread_warp_size=32", [-1, 16, 64, 49152, 2147483647, 1024, 8, 32], "", 0, []], [[], [["FU", 2, [0, 1, 2, 3]], ["SP", 2, 0, 31223808, [4], 1], ["AN", 2, 0, 5], ["AN", 2, 1, 6], ["FU", 1, [0, 1, 2, 3]], ["SP", 1, 0, 31223808, [1], 1], ["AN", 1, 0, 5], ["AN", 1, 1, 6], ["PR", 1, 0, "auto_unroll_max_step$16"]]]], "r": [[0.0608724], 0, 3.07503, 1637921681], "v": "v0.6"}
{"i": [["[\"pool_layer\", \"avg\", 128, 2016, 21, 21, 1, 1, 2, \"VALID\"]", "cuda -keys=cuda,gpu -max_num_threads=1024 -thread_warp_size=32", [-1, 16, 64, 49152, 2147483647, 1024, 8, 32], "", 0, []], [[], [["FU", 2, [0, 1, 2, 3]], ["SP", 2, 0, 31223808, [8], 1], ["AN", 2, 0, 5], ["AN", 2, 1, 6], ["FU", 1, [0, 1, 2, 3]], ["SP", 1, 0, 31223808, [64], 1], ["AN", 1, 0, 5], ["AN", 1, 1, 6], ["PR", 1, 0, "auto_unroll_max_step$1024"]]]], "r": [[0.006853], 0, 2.80366, 1637921683], "v": "v0.6"}
{"i": [["[\"pool_layer\", \"avg\", 128, 2016, 21, 21, 1, 1, 2, \"VALID\"]", "cuda -keys=cuda,gpu -max_num_threads=1024 -thread_warp_size=32", [-1, 16, 64, 49152, 2147483647, 1024, 8, 32], "", 0, []], [[], [["FU", 2, [0, 1, 2, 3]], ["SP", 2, 0, 31223808, [2], 1], ["AN", 2, 0, 5], ["AN", 2, 1, 6], ["FU", 1, [0, 1, 2, 3]], ["SP", 1, 0, 31223808, [4], 1], ["AN", 1, 0, 5], ["AN", 1, 1, 6], ["PR", 1, 0, "auto_unroll_max_step$512"]]]], "r": [[0.0365266], 0, 2.97616, 1637921686], "v": "v0.6"}
{"i": [["[\"pool_layer\", \"avg\", 128, 2016, 21, 21, 1, 1, 2, \"VALID\"]", "cuda -keys=cuda,gpu -max_num_threads=1024 -thread_warp_size=32", [-1, 16, 64, 49152, 2147483647, 1024, 8, 32], "", 0, []], [[], [["FU", 2, [0, 1, 2, 3]], ["SP", 2, 0, 31223808, [32], 1], ["AN", 2, 0, 5], ["AN", 2, 1, 6], ["FU", 1, [0, 1, 2, 3]], ["SP", 1, 0, 31223808, [4], 1], ["AN", 1, 0, 5], ["AN", 1, 1, 6], ["PR", 1, 0, "auto_unroll_max_step$512"]]]], "r": [[0.0137001], 0, 2.90068, 1637921688], "v": "v0.6"}
{"i": [["[\"pool_layer\", \"avg\", 128, 2016, 21, 21, 1, 1, 2, \"VALID\"]", "cuda -keys=cuda,gpu -max_num_threads=1024 -thread_warp_size=32", [-1, 16, 64, 49152, 2147483647, 1024, 8, 32], "", 0, []], [[], [["FU", 2, [0, 1, 2, 3]], ["SP", 2, 0, 31223808, [2], 1], ["AN", 2, 0, 5], ["AN", 2, 1, 6], ["FU", 1, [0, 1, 2, 3]], ["SP", 1, 0, 31223808, [64], 1], ["AN", 1, 0, 5], ["AN", 1, 1, 6], ["PR", 1, 0, "auto_unroll_max_step$64"]]]], "r": [[0.0251133], 0, 3.10983, 1637921691], "v": "v0.6"}
{"i": [["[\"pool_layer\", \"avg\", 128, 2016, 21, 21, 1, 1, 2, \"VALID\"]", "cuda -keys=cuda,gpu -max_num_threads=1024 -thread_warp_size=32", [-1, 16, 64, 49152, 2147483647, 1024, 8, 32], "", 0, []], [[], [["FU", 2, [0, 1, 2, 3]], ["SP", 2, 0, 31223808, [64], 1], ["AN", 2, 0, 5], ["AN", 2, 1, 6], ["FU", 1, [0, 1, 2, 3]], ["SP", 1, 0, 31223808, [8], 1], ["AN", 1, 0, 5], ["AN", 1, 1, 6], ["PR", 1, 0, "auto_unroll_max_step$1024"]]]], "r": [[0.0068526], 0, 2.80513, 1637921694], "v": "v0.6"}
{"i": [["[\"pool_layer\", \"avg\", 128, 2016, 21, 21, 1, 1, 2, \"VALID\"]", "cuda -keys=cuda,gpu -max_num_threads=1024 -thread_warp_size=32", [-1, 16, 64, 49152, 2147483647, 1024, 8, 32], "", 0, []], [[], [["FU", 2, [0, 1, 2, 3]], ["SP", 2, 0, 31223808, [1], 1], ["AN", 2, 0, 5], ["AN", 2, 1, 6], ["FU", 1, [0, 1, 2, 3]], ["SP", 1, 0, 31223808, [32], 1], ["AN", 1, 0, 5], ["AN", 1, 1, 6], ["PR", 1, 0, "auto_unroll_max_step$512"]]]], "r": [[0.0502196], 0, 3.12539, 1637921697], "v": "v0.6"}
{"i": [["[\"pool_layer\", \"avg\", 128, 2016, 21, 21, 1, 1, 2, \"VALID\"]", "cuda -keys=cuda,gpu -max_num_threads=1024 -thread_warp_size=32", [-1, 16, 64, 49152, 2147483647, 1024, 8, 32], "", 0, []], [[], [["FU", 2, [0, 1, 2, 3]], ["SP", 2, 0, 31223808, [32], 1], ["AN", 2, 0, 5], ["AN", 2, 1, 6], ["FU", 1, [0, 1, 2, 3]], ["SP", 1, 0, 31223808, [1], 1], ["AN", 1, 0, 5], ["AN", 1, 1, 6], ["PR", 1, 0, "auto_unroll_max_step$16"]]]], "r": [[0.0502201], 0, 2.98879, 1637921699], "v": "v0.6"}
{"i": [["[\"pool_layer\", \"avg\", 128, 2016, 21, 21, 1, 1, 2, \"VALID\"]", "cuda -keys=cuda,gpu -max_num_threads=1024 -thread_warp_size=32", [-1, 16, 64, 49152, 2147483647, 1024, 8, 32], "", 0, []], [[], [["FU", 2, [0, 1, 2, 3]], ["SP", 2, 0, 31223808, [32], 1], ["AN", 2, 0, 5], ["AN", 2, 1, 6], ["FU", 1, [0, 1, 2, 3]], ["SP", 1, 0, 31223808, [4], 1], ["AN", 1, 0, 5], ["AN", 1, 1, 6], ["PR", 1, 0, "auto_unroll_max_step$0"]]]], "r": [[0.0141123], 0, 3.34026, 1637921703], "v": "v0.6"}
{"i": [["[\"pool_layer\", \"avg\", 128, 2016, 21, 21, 1, 1, 2, \"VALID\"]", "cuda -keys=cuda,gpu -max_num_threads=1024 -thread_warp_size=32", [-1, 16, 64, 49152, 2147483647, 1024, 8, 32], "", 0, []], [[], [["FU", 2, [0, 1, 2, 3]], ["SP", 2, 0, 31223808, [64], 1], ["AN", 2, 0, 5], ["AN", 2, 1, 6], ["FU", 1, [0, 1, 2, 3]], ["SP", 1, 0, 31223808, [1], 1], ["AN", 1, 0, 5], ["AN", 1, 1, 6], ["PR", 1, 0, "auto_unroll_max_step$1024"]]]], "r": [[0.0494958], 0, 3.97692, 1637921706], "v": "v0.6"}
{"i": [["[\"pool_layer\", \"avg\", 128, 2016, 21, 21, 1, 1, 2, \"VALID\"]", "cuda -keys=cuda,gpu -max_num_threads=1024 -thread_warp_size=32", [-1, 16, 64, 49152, 2147483647, 1024, 8, 32], "", 0, []], [[], [["FU", 2, [0, 1, 2, 3]], ["SP", 2, 0, 31223808, [32], 1], ["AN", 2, 0, 5], ["AN", 2, 1, 6], ["FU", 1, [0, 1, 2, 3]], ["SP", 1, 0, 31223808, [8], 1], ["AN", 1, 0, 5], ["AN", 1, 1, 6], ["PR", 1, 0, "auto_unroll_max_step$1024"]]]], "r": [[0.00761307], 0, 2.822, 1637921709], "v": "v0.6"}
{"i": [["[\"pool_layer\", \"avg\", 128, 2016, 21, 21, 1, 1, 2, \"VALID\"]", "cuda -keys=cuda,gpu -max_num_threads=1024 -thread_warp_size=32", [-1, 16, 64, 49152, 2147483647, 1024, 8, 32], "", 0, []], [[], [["FU", 2, [0, 1, 2, 3]], ["SP", 2, 0, 31223808, [48], 1], ["AN", 2, 0, 5], ["AN", 2, 1, 6], ["FU", 1, [0, 1, 2, 3]], ["SP", 1, 0, 31223808, [32], 1], ["AN", 1, 0, 5], ["AN", 1, 1, 6], ["PR", 1, 0, "auto_unroll_max_step$512"]]]], "r": [[0.00254164], 0, 3.43911, 1637921712], "v": "v0.6"}
{"i": [["[\"pool_layer\", \"avg\", 128, 2016, 21, 21, 1, 1, 2, \"VALID\"]", "cuda -keys=cuda,gpu -max_num_threads=1024 -thread_warp_size=32", [-1, 16, 64, 49152, 2147483647, 1024, 8, 32], "", 0, []], [[], [["FU", 2, [0, 1, 2, 3]], ["SP", 2, 0, 31223808, [9], 1], ["AN", 2, 0, 5], ["AN", 2, 1, 6], ["FU", 1, [0, 1, 2, 3]], ["SP", 1, 0, 31223808, [2], 1], ["AN", 1, 0, 5], ["AN", 1, 1, 6], ["PR", 1, 0, "auto_unroll_max_step$512"]]]], "r": [[0.0297623], 0, 2.97542, 1637921715], "v": "v0.6"}
{"i": [["[\"pool_layer\", \"avg\", 128, 2016, 21, 21, 1, 1, 2, \"VALID\"]", "cuda -keys=cuda,gpu -max_num_threads=1024 -thread_warp_size=32", [-1, 16, 64, 49152, 2147483647, 1024, 8, 32], "", 0, []], [[], [["FU", 2, [0, 1, 2, 3]], ["SP", 2, 0, 31223808, [48], 1], ["AN", 2, 0, 5], ["AN", 2, 1, 6], ["FU", 1, [0, 1, 2, 3]], ["SP", 1, 0, 31223808, [32], 1], ["AN", 1, 0, 5], ["AN", 1, 1, 6], ["PR", 1, 0, "auto_unroll_max_step$0"]]]], "r": [[0.00254181], 0, 3.20444, 1637921718], "v": "v0.6"}
{"i": [["[\"pool_layer\", \"avg\", 128, 2016, 21, 21, 1, 1, 2, \"VALID\"]", "cuda -keys=cuda,gpu -max_num_threads=1024 -thread_warp_size=32", [-1, 16, 64, 49152, 2147483647, 1024, 8, 32], "", 0, []], [[], [["FU", 2, [0, 1, 2, 3]], ["SP", 2, 0, 31223808, [4], 1], ["AN", 2, 0, 5], ["AN", 2, 1, 6], ["FU", 1, [0, 1, 2, 3]], ["SP", 1, 0, 31223808, [1], 1], ["AN", 1, 0, 5], ["AN", 1, 1, 6], ["PR", 1, 0, "auto_unroll_max_step$512"]]]], "r": [[0.0608773], 0, 3.03592, 1637921721], "v": "v0.6"}
{"i": [["[\"pool_layer\", \"avg\", 128, 2016, 21, 21, 1, 1, 2, \"VALID\"]", "cuda -keys=cuda,gpu -max_num_threads=1024 -thread_warp_size=32", [-1, 16, 64, 49152, 2147483647, 1024, 8, 32], "", 0, []], [[], [["FU", 2, [0, 1, 2, 3]], ["SP", 2, 0, 31223808, [8], 1], ["AN", 2, 0, 5], ["AN", 2, 1, 6], ["FU", 1, [0, 1, 2, 3]], ["SP", 1, 0, 31223808, [4], 1], ["AN", 1, 0, 5], ["AN", 1, 1, 6], ["PR", 1, 0, "auto_unroll_max_step$512"]]]], "r": [[0.0182641], 0, 6.54935, 1637921723], "v": "v0.6"}
{"i": [["[\"pool_layer\", \"avg\", 128, 2016, 21, 21, 1, 1, 2, \"VALID\"]", "cuda -keys=cuda,gpu -max_num_threads=1024 -thread_warp_size=32", [-1, 16, 64, 49152, 2147483647, 1024, 8, 32], "", 0, []], [[], [["FU", 2, [0, 1, 2, 3]], ["SP", 2, 0, 31223808, [2], 1], ["AN", 2, 0, 5], ["AN", 2, 1, 6], ["FU", 1, [0, 1, 2, 3]], ["SP", 1, 0, 31223808, [64], 1], ["AN", 1, 0, 5], ["AN", 1, 1, 6], ["PR", 1, 0, "auto_unroll_max_step$0"]]]], "r": [[0.0251123], 0, 6.81772, 1637921726], "v": "v0.6"}
{"i": [["[\"pool_layer\", \"avg\", 128, 2016, 21, 21, 1, 1, 2, \"VALID\"]", "cuda -keys=cuda,gpu -max_num_threads=1024 -thread_warp_size=32", [-1, 16, 64, 49152, 2147483647, 1024, 8, 32], "", 0, []], [[], [["FU", 2, [0, 1, 2, 3]], ["SP", 2, 0, 31223808, [32], 1], ["AN", 2, 0, 5], ["AN", 2, 1, 6], ["FU", 1, [0, 1, 2, 3]], ["SP", 1, 0, 31223808, [4], 1], ["AN", 1, 0, 5], ["AN", 1, 1, 6], ["PR", 1, 0, "auto_unroll_max_step$64"]]]], "r": [[0.0137022], 0, 6.52361, 1637921729], "v": "v0.6"}
{"i": [["[\"pool_layer\", \"avg\", 128, 2016, 21, 21, 1, 1, 2, \"VALID\"]", "cuda -keys=cuda,gpu -max_num_threads=1024 -thread_warp_size=32", [-1, 16, 64, 49152, 2147483647, 1024, 8, 32], "", 0, []], [[], [["FU", 2, [0, 1, 2, 3]], ["SP", 2, 0, 31223808, [32], 1], ["AN", 2, 0, 5], ["AN", 2, 1, 6], ["FU", 1, [0, 1, 2, 3]], ["SP", 1, 0, 31223808, [16], 1], ["AN", 1, 0, 5], ["AN", 1, 1, 6], ["PR", 1, 0, "auto_unroll_max_step$1024"]]]], "r": [[0.00456996], 0, 6.90896, 1637921731], "v": "v0.6"}
{"i": [["[\"pool_layer\", \"avg\", 128, 2016, 21, 21, 1, 1, 2, \"VALID\"]", "cuda -keys=cuda,gpu -max_num_threads=1024 -thread_warp_size=32", [-1, 16, 64, 49152, 2147483647, 1024, 8, 32], "", 0, []], [[], [["FU", 2, [0, 1, 2, 3]], ["SP", 2, 0, 31223808, [64], 1], ["AN", 2, 0, 5], ["AN", 2, 1, 6], ["FU", 1, [0, 1, 2, 3]], ["SP", 1, 0, 31223808, [32], 1], ["AN", 1, 0, 5], ["AN", 1, 1, 6], ["PR", 1, 0, "auto_unroll_max_step$0"]]]], "r": [[0.0022878], 0, 7.41296, 1637921734], "v": "v0.6"}
{"i": [["[\"pool_layer\", \"avg\", 128, 2016, 21, 21, 1, 1, 2, \"VALID\"]", "cuda -keys=cuda,gpu -max_num_threads=1024 -thread_warp_size=32", [-1, 16, 64, 49152, 2147483647, 1024, 8, 32], "", 0, []], [[], [["FU", 2, [0, 1, 2, 3]], ["SP", 2, 0, 31223808, [32], 1], ["AN", 2, 0, 5], ["AN", 2, 1, 6], ["FU", 1, [0, 1, 2, 3]], ["SP", 1, 0, 31223808, [6], 1], ["AN", 1, 0, 5], ["AN", 1, 1, 6], ["PR", 1, 0, "auto_unroll_max_step$0"]]]], "r": [[0.00964201], 0, 6.60489, 1637921737], "v": "v0.6"}
{"i": [["[\"pool_layer\", \"avg\", 128, 2016, 21, 21, 1, 1, 2, \"VALID\"]", "cuda -keys=cuda,gpu -max_num_threads=1024 -thread_warp_size=32", [-1, 16, 64, 49152, 2147483647, 1024, 8, 32], "", 0, []], [[], [["FU", 2, [0, 1, 2, 3]], ["SP", 2, 0, 31223808, [32], 1], ["AN", 2, 0, 5], ["AN", 2, 1, 6], ["FU", 1, [0, 1, 2, 3]], ["SP", 1, 0, 31223808, [16], 1], ["AN", 1, 0, 5], ["AN", 1, 1, 6], ["PR", 1, 0, "auto_unroll_max_step$0"]]]], "r": [[0.00457041], 0, 6.84397, 1637921739], "v": "v0.6"}
{"i": [["[\"pool_layer\", \"avg\", 128, 2016, 21, 21, 1, 1, 2, \"VALID\"]", "cuda -keys=cuda,gpu -max_num_threads=1024 -thread_warp_size=32", [-1, 16, 64, 49152, 2147483647, 1024, 8, 32], "", 0, []], [[], [["FU", 2, [0, 1, 2, 3]], ["SP", 2, 0, 31223808, [48], 1], ["AN", 2, 0, 5], ["AN", 2, 1, 6], ["FU", 1, [0, 1, 2, 3]], ["SP", 1, 0, 31223808, [32], 1], ["AN", 1, 0, 5], ["AN", 1, 1, 6], ["PR", 1, 0, "auto_unroll_max_step$16"]]]], "r": [[0.00254172], 0, 7.37202, 1637921742], "v": "v0.6"}
{"i": [["[\"pool_layer\", \"avg\", 128, 2016, 21, 21, 1, 1, 2, \"VALID\"]", "cuda -keys=cuda,gpu -max_num_threads=1024 -thread_warp_size=32", [-1, 16, 64, 49152, 2147483647, 1024, 8, 32], "", 0, []], [[], [["FU", 2, [0, 1, 2, 3]], ["SP", 2, 0, 31223808, [32], 1], ["AN", 2, 0, 5], ["AN", 2, 1, 6], ["FU", 1, [0, 1, 2, 3]], ["SP", 1, 0, 31223808, [4], 1], ["AN", 1, 0, 5], ["AN", 1, 1, 6], ["PR", 1, 0, "auto_unroll_max_step$16"]]]], "r": [[0.0137014], 0, 6.9835, 1637921745], "v": "v0.6"}
{"i": [["[\"pool_layer\", \"avg\", 128, 2016, 21, 21, 1, 1, 2, \"VALID\"]", "cuda -keys=cuda,gpu -max_num_threads=1024 -thread_warp_size=32", [-1, 16, 64, 49152, 2147483647, 1024, 8, 32], "", 0, []], [[], [["FU", 2, [0, 1, 2, 3]], ["SP", 2, 0, 31223808, [1], 1], ["AN", 2, 0, 5], ["AN", 2, 1, 6], ["FU", 1, [0, 1, 2, 3]], ["SP", 1, 0, 31223808, [2], 1], ["AN", 1, 0, 5], ["AN", 1, 1, 6], ["PR", 1, 0, "auto_unroll_max_step$64"]]]], "r": [[0.0730483], 0, 7.5675, 1637921748], "v": "v0.6"}
{"i": [["[\"pool_layer\", \"avg\", 128, 2016, 21, 21, 1, 1, 2, \"VALID\"]", "cuda -keys=cuda,gpu -max_num_threads=1024 -thread_warp_size=32", [-1, 16, 64, 49152, 2147483647, 1024, 8, 32], "", 0, []], [[], [["FU", 2, [0, 1, 2, 3]], ["SP", 2, 0, 31223808, [16], 1], ["AN", 2, 0, 5], ["AN", 2, 1, 6], ["FU", 1, [0, 1, 2, 3]], ["SP", 1, 0, 31223808, [32], 1], ["AN", 1, 0, 5], ["AN", 1, 1, 6], ["PR", 1, 0, "auto_unroll_max_step$1024"]]]], "r": [[0.00457015], 0, 7.0079, 1637921750], "v": "v0.6"}
{"i": [["[\"pool_layer\", \"avg\", 128, 2016, 21, 21, 1, 1, 2, \"VALID\"]", "cuda -keys=cuda,gpu -max_num_threads=1024 -thread_warp_size=32", [-1, 16, 64, 49152, 2147483647, 1024, 8, 32], "", 0, []], [[], [["FU", 2, [0, 1, 2, 3]], ["SP", 2, 0, 31223808, [4], 1], ["AN", 2, 0, 5], ["AN", 2, 1, 6], ["FU", 1, [0, 1, 2, 3]], ["SP", 1, 0, 31223808, [1], 1], ["AN", 1, 0, 5], ["AN", 1, 1, 6], ["PR", 1, 0, "auto_unroll_max_step$1024"]]]], "r": [[0.0608739], 0, 7.27501, 1637921753], "v": "v0.6"}
{"i": [["[\"pool_layer\", \"avg\", 128, 2016, 21, 21, 1, 1, 2, \"VALID\"]", "cuda -keys=cuda,gpu -max_num_threads=1024 -thread_warp_size=32", [-1, 16, 64, 49152, 2147483647, 1024, 8, 32], "", 0, []], [[], [["FU", 2, [0, 1, 2, 3]], ["SP", 2, 0, 31223808, [64], 1], ["AN", 2, 0, 5], ["AN", 2, 1, 6], ["FU", 1, [0, 1, 2, 3]], ["SP", 1, 0, 31223808, [64], 1], ["AN", 1, 0, 5], ["AN", 1, 1, 6], ["PR", 1, 0, "auto_unroll_max_step$64"]]]], "r": [[0.00152736], 0, 7.58133, 1637921756], "v": "v0.6"}
{"i": [["[\"pool_layer\", \"avg\", 128, 2016, 21, 21, 1, 1, 2, \"VALID\"]", "cuda -keys=cuda,gpu -max_num_threads=1024 -thread_warp_size=32", [-1, 16, 64, 49152, 2147483647, 1024, 8, 32], "", 0, []], [[], [["FU", 2, [0, 1, 2, 3]], ["SP", 2, 0, 31223808, [64], 1], ["AN", 2, 0, 5], ["AN", 2, 1, 6], ["FU", 1, [0, 1, 2, 3]], ["SP", 1, 0, 31223808, [16], 1], ["AN", 1, 0, 5], ["AN", 1, 1, 6], ["PR", 1, 0, "auto_unroll_max_step$16"]]]], "r": [[0.00380934], 0, 7.15794, 1637921759], "v": "v0.6"}
{"i": [["[\"pool_layer\", \"avg\", 128, 2016, 21, 21, 1, 1, 2, \"VALID\"]", "cuda -keys=cuda,gpu -max_num_threads=1024 -thread_warp_size=32", [-1, 16, 64, 49152, 2147483647, 1024, 8, 32], "", 0, []], [[], [["FU", 2, [0, 1, 2, 3]], ["SP", 2, 0, 31223808, [1], 1], ["AN", 2, 0, 5], ["AN", 2, 1, 6], ["FU", 1, [0, 1, 2, 3]], ["SP", 1, 0, 31223808, [32], 1], ["AN", 1, 0, 5], ["AN", 1, 1, 6], ["PR", 1, 0, "auto_unroll_max_step$0"]]]], "r": [[0.0502195], 0, 7.19623, 1637921762], "v": "v0.6"}
{"i": [["[\"pool_layer\", \"avg\", 128, 2016, 21, 21, 1, 1, 2, \"VALID\"]", "cuda -keys=cuda,gpu -max_num_threads=1024 -thread_warp_size=32", [-1, 16, 64, 49152, 2147483647, 1024, 8, 32], "", 0, []], [[], [["FU", 2, [0, 1, 2, 3]], ["SP", 2, 0, 31223808, [4], 1], ["AN", 2, 0, 5], ["AN", 2, 1, 6], ["FU", 1, [0, 1, 2, 3]], ["SP", 1, 0, 31223808, [64], 1], ["AN", 1, 0, 5], ["AN", 1, 1, 6], ["PR", 1, 0, "auto_unroll_max_step$1024"]]]], "r": [[0.0129392], 0, 7.10996, 1637921764], "v": "v0.6"}
{"i": [["[\"pool_layer\", \"avg\", 128, 2016, 21, 21, 1, 1, 2, \"VALID\"]", "cuda -keys=cuda,gpu -max_num_threads=1024 -thread_warp_size=32", [-1, 16, 64, 49152, 2147483647, 1024, 8, 32], "", 0, []], [[], [["FU", 2, [0, 1, 2, 3]], ["SP", 2, 0, 31223808, [16], 1], ["AN", 2, 0, 5], ["AN", 2, 1, 6], ["FU", 1, [0, 1, 2, 3]], ["SP", 1, 0, 31223808, [1], 1], ["AN", 1, 0, 5], ["AN", 1, 1, 6], ["PR", 1, 0, "auto_unroll_max_step$1024"]]]], "r": [[0.05175], 0, 7.55149, 1637921767], "v": "v0.6"}
{"i": [["[\"pool_layer\", \"avg\", 128, 2016, 21, 21, 1, 1, 2, \"VALID\"]", "cuda -keys=cuda,gpu -max_num_threads=1024 -thread_warp_size=32", [-1, 16, 64, 49152, 2147483647, 1024, 8, 32], "", 0, []], [[], [["FU", 2, [0, 1, 2, 3]], ["SP", 2, 0, 31223808, [28], 1], ["AN", 2, 0, 5], ["AN", 2, 1, 6], ["FU", 1, [0, 1, 2, 3]], ["SP", 1, 0, 31223808, [64], 1], ["AN", 1, 0, 5], ["AN", 1, 1, 6], ["PR", 1, 0, "auto_unroll_max_step$512"]]]], "r": [[0.00250547], 0, 6.5203, 1637921770], "v": "v0.6"}
{"i": [["[\"pool_layer\", \"avg\", 128, 2016, 21, 21, 1, 1, 2, \"VALID\"]", "cuda -keys=cuda,gpu -max_num_threads=1024 -thread_warp_size=32", [-1, 16, 64, 49152, 2147483647, 1024, 8, 32], "", 0, []], [[], [["FU", 2, [0, 1, 2, 3]], ["SP", 2, 0, 31223808, [8], 1], ["AN", 2, 0, 5], ["AN", 2, 1, 6], ["FU", 1, [0, 1, 2, 3]], ["SP", 1, 0, 31223808, [64], 1], ["AN", 1, 0, 5], ["AN", 1, 1, 6], ["PR", 1, 0, "auto_unroll_max_step$64"]]]], "r": [[0.00685339], 0, 6.62634, 1637921772], "v": "v0.6"}
{"i": [["[\"pool_layer\", \"avg\", 128, 2016, 21, 21, 1, 1, 2, \"VALID\"]", "cuda -keys=cuda,gpu -max_num_threads=1024 -thread_warp_size=32", [-1, 16, 64, 49152, 2147483647, 1024, 8, 32], "", 0, []], [[], [["FU", 2, [0, 1, 2, 3]], ["SP", 2, 0, 31223808, [32], 1], ["AN", 2, 0, 5], ["AN", 2, 1, 6], ["FU", 1, [0, 1, 2, 3]], ["SP", 1, 0, 31223808, [8], 1], ["AN", 1, 0, 5], ["AN", 1, 1, 6], ["PR", 1, 0, "auto_unroll_max_step$16"]]]], "r": [[0.00761423], 0, 6.48918, 1637921775], "v": "v0.6"}
{"i": [["[\"pool_layer\", \"avg\", 128, 2016, 21, 21, 1, 1, 2, \"VALID\"]", "cuda -keys=cuda,gpu -max_num_threads=1024 -thread_warp_size=32", [-1, 16, 64, 49152, 2147483647, 1024, 8, 32], "", 0, []], [[], [["FU", 2, [0, 1, 2, 3]], ["SP", 2, 0, 31223808, [2], 1], ["AN", 2, 0, 5], ["AN", 2, 1, 6], ["FU", 1, [0, 1, 2, 3]], ["SP", 1, 0, 31223808, [32], 1], ["AN", 1, 0, 5], ["AN", 1, 1, 6], ["PR", 1, 0, "auto_unroll_max_step$16"]]]], "r": [[0.0258729], 0, 6.73048, 1637921777], "v": "v0.6"}
{"i": [["[\"pool_layer\", \"avg\", 128, 2016, 21, 21, 1, 1, 2, \"VALID\"]", "cuda -keys=cuda,gpu -max_num_threads=1024 -thread_warp_size=32", [-1, 16, 64, 49152, 2147483647, 1024, 8, 32], "", 0, []], [[], [["FU", 2, [0, 1, 2, 3]], ["SP", 2, 0, 31223808, [4], 1], ["AN", 2, 0, 5], ["AN", 2, 1, 6], ["FU", 1, [0, 1, 2, 3]], ["SP", 1, 0, 31223808, [2], 1], ["AN", 1, 0, 5], ["AN", 1, 1, 6], ["PR", 1, 0, "auto_unroll_max_step$16"]]]], "r": [[0.0365256], 0, 3.34758, 1637921783], "v": "v0.6"}
{"i": [["[\"pool_layer\", \"avg\", 128, 2016, 21, 21, 1, 1, 2, \"VALID\"]", "cuda -keys=cuda,gpu -max_num_threads=1024 -thread_warp_size=32", [-1, 16, 64, 49152, 2147483647, 1024, 8, 32], "", 0, []], [[], [["FU", 2, [0, 1, 2, 3]], ["SP", 2, 0, 31223808, [8], 1], ["AN", 2, 0, 5], ["AN", 2, 1, 6], ["FU", 1, [0, 1, 2, 3]], ["SP", 1, 0, 31223808, [16], 1], ["AN", 1, 0, 5], ["AN", 1, 1, 6], ["PR", 1, 0, "auto_unroll_max_step$16"]]]], "r": [[0.00913473], 0, 2.83074, 1637921785], "v": "v0.6"}
{"i": [["[\"pool_layer\", \"avg\", 128, 2016, 21, 21, 1, 1, 2, \"VALID\"]", "cuda -keys=cuda,gpu -max_num_threads=1024 -thread_warp_size=32", [-1, 16, 64, 49152, 2147483647, 1024, 8, 32], "", 0, []], [[], [["FU", 2, [0, 1, 2, 3]], ["SP", 2, 0, 31223808, [32], 1], ["AN", 2, 0, 5], ["AN", 2, 1, 6], ["FU", 1, [0, 1, 2, 3]], ["SP", 1, 0, 31223808, [64], 1], ["AN", 1, 0, 5], ["AN", 1, 1, 6], ["PR", 1, 0, "auto_unroll_max_step$16"]]]], "r": [[0.00228842], 0, 3.19385, 1637921788], "v": "v0.6"}
{"i": [["[\"pool_layer\", \"avg\", 128, 2016, 21, 21, 1, 1, 2, \"VALID\"]", "cuda -keys=cuda,gpu -max_num_threads=1024 -thread_warp_size=32", [-1, 16, 64, 49152, 2147483647, 1024, 8, 32], "", 0, []], [[], [["FU", 2, [0, 1, 2, 3]], ["SP", 2, 0, 31223808, [32], 1], ["AN", 2, 0, 5], ["AN", 2, 1, 6], ["FU", 1, [0, 1, 2, 3]], ["SP", 1, 0, 31223808, [16], 1], ["AN", 1, 0, 5], ["AN", 1, 1, 6], ["PR", 1, 0, "auto_unroll_max_step$16"]]]], "r": [[0.00457022], 0, 3.12344, 1637921791], "v": "v0.6"}
{"i": [["[\"pool_layer\", \"avg\", 128, 2016, 21, 21, 1, 1, 2, \"VALID\"]", "cuda -keys=cuda,gpu -max_num_threads=1024 -thread_warp_size=32", [-1, 16, 64, 49152, 2147483647, 1024, 8, 32], "", 0, []], [[], [["FU", 2, [0, 1, 2, 3]], ["SP", 2, 0, 31223808, [12], 1], ["AN", 2, 0, 5], ["AN", 2, 1, 6], ["FU", 1, [0, 1, 2, 3]], ["SP", 1, 0, 31223808, [64], 1], ["AN", 1, 0, 5], ["AN", 1, 1, 6], ["PR", 1, 0, "auto_unroll_max_step$512"]]]], "r": [[0.00482412], 0, 2.75652, 1637921794], "v": "v0.6"}
{"i": [["[\"pool_layer\", \"avg\", 128, 2016, 21, 21, 1, 1, 2, \"VALID\"]", "cuda -keys=cuda,gpu -max_num_threads=1024 -thread_warp_size=32", [-1, 16, 64, 49152, 2147483647, 1024, 8, 32], "", 0, []], [[], [["FU", 2, [0, 1, 2, 3]], ["SP", 2, 0, 31223808, [64], 1], ["AN", 2, 0, 5], ["AN", 2, 1, 6], ["FU", 1, [0, 1, 2, 3]], ["SP", 1, 0, 31223808, [1], 1], ["AN", 1, 0, 5], ["AN", 1, 1, 6], ["PR", 1, 0, "auto_unroll_max_step$64"]]]], "r": [[0.0494585], 0, 2.97638, 1637921796], "v": "v0.6"}
{"i": [["[\"pool_layer\", \"avg\", 128, 2016, 21, 21, 1, 1, 2, \"VALID\"]", "cuda -keys=cuda,gpu -max_num_threads=1024 -thread_warp_size=32", [-1, 16, 64, 49152, 2147483647, 1024, 8, 32], "", 0, []], [[], [["FU", 2, [0, 1, 2, 3]], ["SP", 2, 0, 31223808, [16], 1], ["AN", 2, 0, 5], ["AN", 2, 1, 6], ["FU", 1, [0, 1, 2, 3]], ["SP", 1, 0, 31223808, [64], 1], ["AN", 1, 0, 5], ["AN", 1, 1, 6], ["PR", 1, 0, "auto_unroll_max_step$0"]]]], "r": [[0.00380997], 0, 2.69396, 1637921799], "v": "v0.6"}
{"i": [["[\"pool_layer\", \"avg\", 128, 2016, 21, 21, 1, 1, 2, \"VALID\"]", "cuda -keys=cuda,gpu -max_num_threads=1024 -thread_warp_size=32", [-1, 16, 64, 49152, 2147483647, 1024, 8, 32], "", 0, []], [[], [["FU", 2, [0, 1, 2, 3]], ["SP", 2, 0, 31223808, [56], 1], ["AN", 2, 0, 5], ["AN", 2, 1, 6], ["FU", 1, [0, 1, 2, 3]], ["SP", 1, 0, 31223808, [32], 1], ["AN", 1, 0, 5], ["AN", 1, 1, 6], ["PR", 1, 0, "auto_unroll_max_step$16"]]]], "r": [[0.00239646], 0, 2.85829, 1637921802], "v": "v0.6"}
{"i": [["[\"pool_layer\", \"avg\", 128, 2016, 21, 21, 1, 1, 2, \"VALID\"]", "cuda -keys=cuda,gpu -max_num_threads=1024 -thread_warp_size=32", [-1, 16, 64, 49152, 2147483647, 1024, 8, 32], "", 0, []], [[], [["FU", 2, [0, 1, 2, 3]], ["SP", 2, 0, 31223808, [32], 1], ["AN", 2, 0, 5], ["AN", 2, 1, 6], ["FU", 1, [0, 1, 2, 3]], ["SP", 1, 0, 31223808, [14], 1], ["AN", 1, 0, 5], ["AN", 1, 1, 6], ["PR", 1, 0, "auto_unroll_max_step$1024"]]]], "r": [[0.00500474], 0, 2.77425, 1637921804], "v": "v0.6"}
{"i": [["[\"pool_layer\", \"avg\", 128, 2016, 21, 21, 1, 1, 2, \"VALID\"]", "cuda -keys=cuda,gpu -max_num_threads=1024 -thread_warp_size=32", [-1, 16, 64, 49152, 2147483647, 1024, 8, 32], "", 0, []], [[], [["FU", 2, [0, 1, 2, 3]], ["SP", 2, 0, 31223808, [8], 1], ["AN", 2, 0, 5], ["AN", 2, 1, 6], ["FU", 1, [0, 1, 2, 3]], ["SP", 1, 0, 31223808, [16], 1], ["AN", 1, 0, 5], ["AN", 1, 1, 6], ["PR", 1, 0, "auto_unroll_max_step$0"]]]], "r": [[0.00913743], 0, 2.84056, 1637921807], "v": "v0.6"}
{"i": [["[\"pool_layer\", \"avg\", 128, 2016, 21, 21, 1, 1, 2, \"VALID\"]", "cuda -keys=cuda,gpu -max_num_threads=1024 -thread_warp_size=32", [-1, 16, 64, 49152, 2147483647, 1024, 8, 32], "", 0, []], [[], [["FU", 2, [0, 1, 2, 3]], ["SP", 2, 0, 31223808, [48], 1], ["AN", 2, 0, 5], ["AN", 2, 1, 6], ["FU", 1, [0, 1, 2, 3]], ["SP", 1, 0, 31223808, [4], 1], ["AN", 1, 0, 5], ["AN", 1, 1, 6], ["PR", 1, 0, "auto_unroll_max_step$0"]]]], "r": [[0.0131927], 0, 2.8069, 1637921809], "v": "v0.6"}
{"i": [["[\"pool_layer\", \"avg\", 128, 2016, 21, 21, 1, 1, 2, \"VALID\"]", "cuda -keys=cuda,gpu -max_num_threads=1024 -thread_warp_size=32", [-1, 16, 64, 49152, 2147483647, 1024, 8, 32], "", 0, []], [[], [["FU", 2, [0, 1, 2, 3]], ["SP", 2, 0, 31223808, [64], 1], ["AN", 2, 0, 5], ["AN", 2, 1, 6], ["FU", 1, [0, 1, 2, 3]], ["SP", 1, 0, 31223808, [8], 1], ["AN", 1, 0, 5], ["AN", 1, 1, 6], ["PR", 1, 0, "auto_unroll_max_step$512"]]]], "r": [[0.0068546], 0, 2.78966, 1637921812], "v": "v0.6"}
{"i": [["[\"pool_layer\", \"avg\", 128, 2016, 21, 21, 1, 1, 2, \"VALID\"]", "cuda -keys=cuda,gpu -max_num_threads=1024 -thread_warp_size=32", [-1, 16, 64, 49152, 2147483647, 1024, 8, 32], "", 0, []], [[], [["FU", 2, [0, 1, 2, 3]], ["SP", 2, 0, 31223808, [2], 1], ["AN", 2, 0, 5], ["AN", 2, 1, 6], ["FU", 1, [0, 1, 2, 3]], ["SP", 1, 0, 31223808, [1], 1], ["AN", 1, 0, 5], ["AN", 1, 1, 6], ["PR", 1, 0, "auto_unroll_max_step$16"]]]], "r": [[0.0730454], 0, 3.15294, 1637921815], "v": "v0.6"}
{"i": [["[\"pool_layer\", \"avg\", 128, 2016, 21, 21, 1, 1, 2, \"VALID\"]", "cuda -keys=cuda,gpu -max_num_threads=1024 -thread_warp_size=32", [-1, 16, 64, 49152, 2147483647, 1024, 8, 32], "", 0, []], [[], [["FU", 2, [0, 1, 2, 3]], ["SP", 2, 0, 31223808, [32], 1], ["AN", 2, 0, 5], ["AN", 2, 1, 6], ["FU", 1, [0, 1, 2, 3]], ["SP", 1, 0, 31223808, [32], 1], ["AN", 1, 0, 5], ["AN", 1, 1, 6], ["PR", 1, 0, "auto_unroll_max_step$1024"]]]], "r": [[0.00304893], 0, 2.68733, 1637921817], "v": "v0.6"}
{"i": [["[\"pool_layer\", \"avg\", 128, 2016, 21, 21, 1, 1, 2, \"VALID\"]", "cuda -keys=cuda,gpu -max_num_threads=1024 -thread_warp_size=32", [-1, 16, 64, 49152, 2147483647, 1024, 8, 32], "", 0, []], [[], [["FU", 2, [0, 1, 2, 3]], ["SP", 2, 0, 31223808, [32], 1], ["AN", 2, 0, 5], ["AN", 2, 1, 6], ["FU", 1, [0, 1, 2, 3]], ["SP", 1, 0, 31223808, [32], 1], ["AN", 1, 0, 5], ["AN", 1, 1, 6], ["PR", 1, 0, "auto_unroll_max_step$64"]]]], "r": [[0.00304846], 0, 2.83609, 1637921820], "v": "v0.6"}
{"i": [["[\"pool_layer\", \"avg\", 128, 2016, 21, 21, 1, 1, 2, \"VALID\"]", "cuda -keys=cuda,gpu -max_num_threads=1024 -thread_warp_size=32", [-1, 16, 64, 49152, 2147483647, 1024, 8, 32], "", 0, []], [[], [["FU", 2, [0, 1, 2, 3]], ["SP", 2, 0, 31223808, [32], 1], ["AN", 2, 0, 5], ["AN", 2, 1, 6], ["FU", 1, [0, 1, 2, 3]], ["SP", 1, 0, 31223808, [32], 1], ["AN", 1, 0, 5], ["AN", 1, 1, 6], ["PR", 1, 0, "auto_unroll_max_step$512"]]]], "r": [[0.00304865], 0, 2.83253, 1637921823], "v": "v0.6"}
{"i": [["[\"pool_layer\", \"avg\", 128, 2016, 21, 21, 1, 1, 2, \"VALID\"]", "cuda -keys=cuda,gpu -max_num_threads=1024 -thread_warp_size=32", [-1, 16, 64, 49152, 2147483647, 1024, 8, 32], "", 0, []], [[], [["FU", 2, [0, 1, 2, 3]], ["SP", 2, 0, 31223808, [64], 1], ["AN", 2, 0, 5], ["AN", 2, 1, 6], ["FU", 1, [0, 1, 2, 3]], ["SP", 1, 0, 31223808, [6], 1], ["AN", 1, 0, 5], ["AN", 1, 1, 6], ["PR", 1, 0, "auto_unroll_max_step$0"]]]], "r": [[0.00888624], 0, 8.88945, 1637921840], "v": "v0.6"}
{"i": [["[\"pool_layer\", \"avg\", 128, 2016, 21, 21, 1, 1, 2, \"VALID\"]", "cuda -keys=cuda,gpu -max_num_threads=1024 -thread_warp_size=32", [-1, 16, 64, 49152, 2147483647, 1024, 8, 32], "", 0, []], [[], [["FU", 2, [0, 1, 2, 3]], ["SP", 2, 0, 31223808, [48], 1], ["AN", 2, 0, 5], ["AN", 2, 1, 6], ["FU", 1, [0, 1, 2, 3]], ["SP", 1, 0, 31223808, [6], 1], ["AN", 1, 0, 5], ["AN", 1, 1, 6], ["PR", 1, 0, "auto_unroll_max_step$1024"]]]], "r": [[0.00913523], 0, 7.6726, 1637921843], "v": "v0.6"}
{"i": [["[\"pool_layer\", \"avg\", 128, 2016, 21, 21, 1, 1, 2, \"VALID\"]", "cuda -keys=cuda,gpu -max_num_threads=1024 -thread_warp_size=32", [-1, 16, 64, 49152, 2147483647, 1024, 8, 32], "", 0, []], [[], [["FU", 2, [0, 1, 2, 3]], ["SP", 2, 0, 31223808, [1], 1], ["AN", 2, 0, 5], ["AN", 2, 1, 6], ["FU", 1, [0, 1, 2, 3]], ["SP", 1, 0, 31223808, [1], 1], ["AN", 1, 0, 5], ["AN", 1, 1, 6], ["PR", 1, 0, "auto_unroll_max_step$16"]]]], "r": [[0.0974014], 0, 9.16379, 1637921846], "v": "v0.6"}
{"i": [["[\"pool_layer\", \"avg\", 128, 2016, 21, 21, 1, 1, 2, \"VALID\"]", "cuda -keys=cuda,gpu -max_num_threads=1024 -thread_warp_size=32", [-1, 16, 64, 49152, 2147483647, 1024, 8, 32], "", 0, []], [[], [["FU", 2, [0, 1, 2, 3]], ["SP", 2, 0, 31223808, [16], 1], ["AN", 2, 0, 5], ["AN", 2, 1, 6], ["FU", 1, [0, 1, 2, 3]], ["SP", 1, 0, 31223808, [32], 1], ["AN", 1, 0, 5], ["AN", 1, 1, 6], ["PR", 1, 0, "auto_unroll_max_step$64"]]]], "r": [[0.00457012], 0, 8.88103, 1637921849], "v": "v0.6"}
{"i": [["[\"pool_layer\", \"avg\", 128, 2016, 21, 21, 1, 1, 2, \"VALID\"]", "cuda -keys=cuda,gpu -max_num_threads=1024 -thread_warp_size=32", [-1, 16, 64, 49152, 2147483647, 1024, 8, 32], "", 0, []], [[], [["FU", 2, [0, 1, 2, 3]], ["SP", 2, 0, 31223808, [16], 1], ["AN", 2, 0, 5], ["AN", 2, 1, 6], ["FU", 1, [0, 1, 2, 3]], ["SP", 1, 0, 31223808, [8], 1], ["AN", 1, 0, 5], ["AN", 1, 1, 6], ["PR", 1, 0, "auto_unroll_max_step$16"]]]], "r": [[0.00913487], 0, 7.77068, 1637921851], "v": "v0.6"}
{"i": [["[\"pool_layer\", \"avg\", 128, 2016, 21, 21, 1, 1, 2, \"VALID\"]", "cuda -keys=cuda,gpu -max_num_threads=1024 -thread_warp_size=32", [-1, 16, 64, 49152, 2147483647, 1024, 8, 32], "", 0, []], [[], [["FU", 2, [0, 1, 2, 3]], ["SP", 2, 0, 31223808, [4], 1], ["AN", 2, 0, 5], ["AN", 2, 1, 6], ["FU", 1, [0, 1, 2, 3]], ["SP", 1, 0, 31223808, [64], 1], ["AN", 1, 0, 5], ["AN", 1, 1, 6], ["PR", 1, 0, "auto_unroll_max_step$16"]]]], "r": [[0.0129396], 0, 5.04684, 1637921854], "v": "v0.6"}
{"i": [["[\"pool_layer\", \"avg\", 128, 2016, 21, 21, 1, 1, 2, \"VALID\"]", "cuda -keys=cuda,gpu -max_num_threads=1024 -thread_warp_size=32", [-1, 16, 64, 49152, 2147483647, 1024, 8, 32], "", 0, []], [[], [["FU", 2, [0, 1, 2, 3]], ["SP", 2, 0, 31223808, [16], 1], ["AN", 2, 0, 5], ["AN", 2, 1, 6], ["FU", 1, [0, 1, 2, 3]], ["SP", 1, 0, 31223808, [1], 1], ["AN", 1, 0, 5], ["AN", 1, 1, 6], ["PR", 1, 0, "auto_unroll_max_step$16"]]]], "r": [[0.0517416], 0, 9.40749, 1637921856], "v": "v0.6"}
{"i": [["[\"pool_layer\", \"avg\", 128, 2016, 21, 21, 1, 1, 2, \"VALID\"]", "cuda -keys=cuda,gpu -max_num_threads=1024 -thread_warp_size=32", [-1, 16, 64, 49152, 2147483647, 1024, 8, 32], "", 0, []], [[], [["FU", 2, [0, 1, 2, 3]], ["SP", 2, 0, 31223808, [2], 1], ["AN", 2, 0, 5], ["AN", 2, 1, 6], ["FU", 1, [0, 1, 2, 3]], ["SP", 1, 0, 31223808, [64], 1], ["AN", 1, 0, 5], ["AN", 1, 1, 6], ["PR", 1, 0, "auto_unroll_max_step$16"]]]], "r": [[0.0251126], 0, 7.82135, 1637921859], "v": "v0.6"}
{"i": [["[\"pool_layer\", \"avg\", 128, 2016, 21, 21, 1, 1, 2, \"VALID\"]", "cuda -keys=cuda,gpu -max_num_threads=1024 -thread_warp_size=32", [-1, 16, 64, 49152, 2147483647, 1024, 8, 32], "", 0, []], [[], [["FU", 2, [0, 1, 2, 3]], ["SP", 2, 0, 31223808, [2], 1], ["AN", 2, 0, 5], ["AN", 2, 1, 6], ["FU", 1, [0, 1, 2, 3]], ["SP", 1, 0, 31223808, [48], 1], ["AN", 1, 0, 5], ["AN", 1, 1, 6], ["PR", 1, 0, "auto_unroll_max_step$512"]]]], "r": [[0.0253667], 0, 7.84233, 1637921862], "v": "v0.6"}
{"i": [["[\"pool_layer\", \"avg\", 128, 2016, 21, 21, 1, 1, 2, \"VALID\"]", "cuda -keys=cuda,gpu -max_num_threads=1024 -thread_warp_size=32", [-1, 16, 64, 49152, 2147483647, 1024, 8, 32], "", 0, []], [[], [["FU", 2, [0, 1, 2, 3]], ["SP", 2, 0, 31223808, [48], 1], ["AN", 2, 0, 5], ["AN", 2, 1, 6], ["FU", 1, [0, 1, 2, 3]], ["SP", 1, 0, 31223808, [32], 1], ["AN", 1, 0, 5], ["AN", 1, 1, 6], ["PR", 1, 0, "auto_unroll_max_step$64"]]]], "r": [[0.00254159], 0, 6.83798, 1637921865], "v": "v0.6"}
{"i": [["[\"pool_layer\", \"avg\", 128, 2016, 21, 21, 1, 1, 2, \"VALID\"]", "cuda -keys=cuda,gpu -max_num_threads=1024 -thread_warp_size=32", [-1, 16, 64, 49152, 2147483647, 1024, 8, 32], "", 0, []], [[], [["FU", 2, [0, 1, 2, 3]], ["SP", 2, 0, 31223808, [4], 1], ["AN", 2, 0, 5], ["AN", 2, 1, 6], ["FU", 1, [0, 1, 2, 3]], ["SP", 1, 0, 31223808, [48], 1], ["AN", 1, 0, 5], ["AN", 1, 1, 6], ["PR", 1, 0, "auto_unroll_max_step$0"]]]], "r": [[0.0131927], 0, 7.63482, 1637921867], "v": "v0.6"}
{"i": [["[\"pool_layer\", \"avg\", 128, 2016, 21, 21, 1, 1, 2, \"VALID\"]", "cuda -keys=cuda,gpu -max_num_threads=1024 -thread_warp_size=32", [-1, 16, 64, 49152, 2147483647, 1024, 8, 32], "", 0, []], [[], [["FU", 2, [0, 1, 2, 3]], ["SP", 2, 0, 31223808, [11], 1], ["AN", 2, 0, 5], ["AN", 2, 1, 6], ["FU", 1, [0, 1, 2, 3]], ["SP", 1, 0, 31223808, [2], 1], ["AN", 1, 0, 5], ["AN", 1, 1, 6], ["PR", 1, 0, "auto_unroll_max_step$64"]]]], "r": [[0.0287774], 0, 8.49309, 1637921870], "v": "v0.6"}
{"i": [["[\"pool_layer\", \"avg\", 128, 2016, 21, 21, 1, 1, 2, \"VALID\"]", "cuda -keys=cuda,gpu -max_num_threads=1024 -thread_warp_size=32", [-1, 16, 64, 49152, 2147483647, 1024, 8, 32], "", 0, []], [[], [["FU", 2, [0, 1, 2, 3]], ["SP", 2, 0, 31223808, [2], 1], ["AN", 2, 0, 5], ["AN", 2, 1, 6], ["FU", 1, [0, 1, 2, 3]], ["SP", 1, 0, 31223808, [44], 1], ["AN", 1, 0, 5], ["AN", 1, 1, 6], ["PR", 1, 0, "auto_unroll_max_step$1024"]]]], "r": [[0.0254582], 0, 9.17383, 1637921873], "v": "v0.6"}
{"i": [["[\"pool_layer\", \"avg\", 128, 2016, 21, 21, 1, 1, 2, \"VALID\"]", "cuda -keys=cuda,gpu -max_num_threads=1024 -thread_warp_size=32", [-1, 16, 64, 49152, 2147483647, 1024, 8, 32], "", 0, []], [[], [["FU", 2, [0, 1, 2, 3]], ["SP", 2, 0, 31223808, [2], 1], ["AN", 2, 0, 5], ["AN", 2, 1, 6], ["FU", 1, [0, 1, 2, 3]], ["SP", 1, 0, 31223808, [32], 1], ["AN", 1, 0, 5], ["AN", 1, 1, 6], ["PR", 1, 0, "auto_unroll_max_step$0"]]]], "r": [[0.0258728], 0, 9.46211, 1637921875], "v": "v0.6"}
{"i": [["[\"pool_layer\", \"avg\", 128, 2016, 21, 21, 1, 1, 2, \"VALID\"]", "cuda -keys=cuda,gpu -max_num_threads=1024 -thread_warp_size=32", [-1, 16, 64, 49152, 2147483647, 1024, 8, 32], "", 0, []], [[], [["FU", 2, [0, 1, 2, 3]], ["SP", 2, 0, 31223808, [64], 1], ["AN", 2, 0, 5], ["AN", 2, 1, 6], ["FU", 1, [0, 1, 2, 3]], ["SP", 1, 0, 31223808, [16], 1], ["AN", 1, 0, 5], ["AN", 1, 1, 6], ["PR", 1, 0, "auto_unroll_max_step$1024"]]]], "r": [[0.00380957], 0, 8.43624, 1637921878], "v": "v0.6"}
{"i": [["[\"pool_layer\", \"avg\", 128, 2016, 21, 21, 1, 1, 2, \"VALID\"]", "cuda -keys=cuda,gpu -max_num_threads=1024 -thread_warp_size=32", [-1, 16, 64, 49152, 2147483647, 1024, 8, 32], "", 0, []], [[], [["FU", 2, [0, 1, 2, 3]], ["SP", 2, 0, 31223808, [4], 1], ["AN", 2, 0, 5], ["AN", 2, 1, 6], ["FU", 1, [0, 1, 2, 3]], ["SP", 1, 0, 31223808, [8], 1], ["AN", 1, 0, 5], ["AN", 1, 1, 6], ["PR", 1, 0, "auto_unroll_max_step$1024"]]]], "r": [[0.0182644], 0, 4.9783, 1637921881], "v": "v0.6"}
{"i": [["[\"pool_layer\", \"avg\", 128, 2016, 21, 21, 1, 1, 2, \"VALID\"]", "cuda -keys=cuda,gpu -max_num_threads=1024 -thread_warp_size=32", [-1, 16, 64, 49152, 2147483647, 1024, 8, 32], "", 0, []], [[], [["FU", 2, [0, 1, 2, 3]], ["SP", 2, 0, 31223808, [1], 1], ["AN", 2, 0, 5], ["AN", 2, 1, 6], ["FU", 1, [0, 1, 2, 3]], ["SP", 1, 0, 31223808, [16], 1], ["AN", 1, 0, 5], ["AN", 1, 1, 6], ["PR", 1, 0, "auto_unroll_max_step$64"]]]], "r": [[0.0517412], 0, 9.3004, 1637921883], "v": "v0.6"}
{"i": [["[\"pool_layer\", \"avg\", 128, 2016, 21, 21, 1, 1, 2, \"VALID\"]", "cuda -keys=cuda,gpu -max_num_threads=1024 -thread_warp_size=32", [-1, 16, 64, 49152, 2147483647, 1024, 8, 32], "", 0, []], [[], [["FU", 2, [0, 1, 2, 3]], ["SP", 2, 0, 31223808, [1], 1], ["AN", 2, 0, 5], ["AN", 2, 1, 6], ["FU", 1, [0, 1, 2, 3]], ["SP", 1, 0, 31223808, [4], 1], ["AN", 1, 0, 5], ["AN", 1, 1, 6], ["PR", 1, 0, "auto_unroll_max_step$1024"]]]], "r": [[0.0608784], 0, 8.30543, 1637921886], "v": "v0.6"}
{"i": [["[\"pool_layer\", \"avg\", 128, 2016, 21, 21, 1, 1, 2, \"VALID\"]", "cuda -keys=cuda,gpu -max_num_threads=1024 -thread_warp_size=32", [-1, 16, 64, 49152, 2147483647, 1024, 8, 32], "", 0, []], [[], [["FU", 2, [0, 1, 2, 3]], ["SP", 2, 0, 31223808, [16], 1], ["AN", 2, 0, 5], ["AN", 2, 1, 6], ["FU", 1, [0, 1, 2, 3]], ["SP", 1, 0, 31223808, [1], 1], ["AN", 1, 0, 5], ["AN", 1, 1, 6], ["PR", 1, 0, "auto_unroll_max_step$0"]]]], "r": [[0.0517404], 0, 8.64726, 1637921889], "v": "v0.6"}
{"i": [["[\"pool_layer\", \"avg\", 128, 2016, 21, 21, 1, 1, 2, \"VALID\"]", "cuda -keys=cuda,gpu -max_num_threads=1024 -thread_warp_size=32", [-1, 16, 64, 49152, 2147483647, 1024, 8, 32], "", 0, []], [[], [["FU", 2, [0, 1, 2, 3]], ["SP", 2, 0, 31223808, [16], 1], ["AN", 2, 0, 5], ["AN", 2, 1, 6], ["FU", 1, [0, 1, 2, 3]], ["SP", 1, 0, 31223808, [48], 1], ["AN", 1, 0, 5], ["AN", 1, 1, 6], ["PR", 1, 0, "auto_unroll_max_step$1024"]]]], "r": [[0.00406306], 0, 9.05296, 1637921892], "v": "v0.6"}
{"i": [["[\"pool_layer\", \"avg\", 128, 2016, 21, 21, 1, 1, 2, \"VALID\"]", "cuda -keys=cuda,gpu -max_num_threads=1024 -thread_warp_size=32", [-1, 16, 64, 49152, 2147483647, 1024, 8, 32], "", 0, []], [[], [["FU", 2, [0, 1, 2, 3]], ["SP", 2, 0, 31223808, [1], 1], ["AN", 2, 0, 5], ["AN", 2, 1, 6], ["FU", 1, [0, 1, 2, 3]], ["SP", 1, 0, 31223808, [32], 1], ["AN", 1, 0, 5], ["AN", 1, 1, 6], ["PR", 1, 0, "auto_unroll_max_step$1024"]]]], "r": [[0.0502293], 0, 8.50148, 1637921894], "v": "v0.6"}
{"i": [["[\"pool_layer\", \"avg\", 128, 2016, 21, 21, 1, 1, 2, \"VALID\"]", "cuda -keys=cuda,gpu -max_num_threads=1024 -thread_warp_size=32", [-1, 16, 64, 49152, 2147483647, 1024, 8, 32], "", 0, []], [[], [["FU", 2, [0, 1, 2, 3]], ["SP", 2, 0, 31223808, [4], 1], ["AN", 2, 0, 5], ["AN", 2, 1, 6], ["FU", 1, [0, 1, 2, 3]], ["SP", 1, 0, 31223808, [2], 1], ["AN", 1, 0, 5], ["AN", 1, 1, 6], ["PR", 1, 0, "auto_unroll_max_step$512"]]]], "r": [[0.0365245], 0, 7.83013, 1637921897], "v": "v0.6"}
{"i": [["[\"pool_layer\", \"avg\", 128, 2016, 21, 21, 1, 1, 2, \"VALID\"]", "cuda -keys=cuda,gpu -max_num_threads=1024 -thread_warp_size=32", [-1, 16, 64, 49152, 2147483647, 1024, 8, 32], "", 0, []], [[], [["FU", 2, [0, 1, 2, 3]], ["SP", 2, 0, 31223808, [64], 1], ["AN", 2, 0, 5], ["AN", 2, 1, 6], ["FU", 1, [0, 1, 2, 3]], ["SP", 1, 0, 31223808, [4], 1], ["AN", 1, 0, 5], ["AN", 1, 1, 6], ["PR", 1, 0, "auto_unroll_max_step$0"]]]], "r": [[0.0129388], 0, 8.95744, 1637921900], "v": "v0.6"}
{"i": [["[\"pool_layer\", \"avg\", 128, 2016, 21, 21, 1, 1, 2, \"VALID\"]", "cuda -keys=cuda,gpu -max_num_threads=1024 -thread_warp_size=32", [-1, 16, 64, 49152, 2147483647, 1024, 8, 32], "", 0, []], [[], [["FU", 2, [0, 1, 2, 3]], ["SP", 2, 0, 31223808, [1], 1], ["AN", 2, 0, 5], ["AN", 2, 1, 6], ["FU", 1, [0, 1, 2, 3]], ["SP", 1, 0, 31223808, [4], 1], ["AN", 1, 0, 5], ["AN", 1, 1, 6], ["PR", 1, 0, "auto_unroll_max_step$512"]]]], "r": [[0.0608701], 0, 8.57226, 1637921903], "v": "v0.6"}
{"i": [["[\"pool_layer\", \"avg\", 128, 2016, 21, 21, 1, 1, 2, \"VALID\"]", "cuda -keys=cuda,gpu -max_num_threads=1024 -thread_warp_size=32", [-1, 16, 64, 49152, 2147483647, 1024, 8, 32], "", 0, []], [[], [["FU", 2, [0, 1, 2, 3]], ["SP", 2, 0, 31223808, [16], 1], ["AN", 2, 0, 5], ["AN", 2, 1, 6], ["FU", 1, [0, 1, 2, 3]], ["SP", 1, 0, 31223808, [4], 1], ["AN", 1, 0, 5], ["AN", 1, 1, 6], ["PR", 1, 0, "auto_unroll_max_step$16"]]]], "r": [[0.0152213], 0, 2.78739, 1637921905], "v": "v0.6"}
{"i": [["[\"pool_layer\", \"avg\", 128, 2016, 21, 21, 1, 1, 2, \"VALID\"]", "cuda -keys=cuda,gpu -max_num_threads=1024 -thread_warp_size=32", [-1, 16, 64, 49152, 2147483647, 1024, 8, 32], "", 0, []], [[], [["FU", 2, [0, 1, 2, 3]], ["SP", 2, 0, 31223808, [1], 1], ["AN", 2, 0, 5], ["AN", 2, 1, 6], ["FU", 1, [0, 1, 2, 3]], ["SP", 1, 0, 31223808, [16], 1], ["AN", 1, 0, 5], ["AN", 1, 1, 6], ["PR", 1, 0, "auto_unroll_max_step$16"]]]], "r": [[0.0517416], 0, 3.04316, 1637921908], "v": "v0.6"}
{"i": [["[\"pool_layer\", \"avg\", 128, 2016, 21, 21, 1, 1, 2, \"VALID\"]", "cuda -keys=cuda,gpu -max_num_threads=1024 -thread_warp_size=32", [-1, 16, 64, 49152, 2147483647, 1024, 8, 32], "", 0, []], [[], [["FU", 2, [0, 1, 2, 3]], ["SP", 2, 0, 31223808, [48], 1], ["AN", 2, 0, 5], ["AN", 2, 1, 6], ["FU", 1, [0, 1, 2, 3]], ["SP", 1, 0, 31223808, [2], 1], ["AN", 1, 0, 5], ["AN", 1, 1, 6], ["PR", 1, 0, "auto_unroll_max_step$0"]]]], "r": [[0.0253679], 0, 2.89649, 1637921911], "v": "v0.6"}
{"i": [["[\"pool_layer\", \"avg\", 128, 2016, 21, 21, 1, 1, 2, \"VALID\"]", "cuda -keys=cuda,gpu -max_num_threads=1024 -thread_warp_size=32", [-1, 16, 64, 49152, 2147483647, 1024, 8, 32], "", 0, []], [[], [["FU", 2, [0, 1, 2, 3]], ["SP", 2, 0, 31223808, [7], 1], ["AN", 2, 0, 5], ["AN", 2, 1, 6], ["FU", 1, [0, 1, 2, 3]], ["SP", 1, 0, 31223808, [64], 1], ["AN", 1, 0, 5], ["AN", 1, 1, 6], ["PR", 1, 0, "auto_unroll_max_step$1024"]]]], "r": [[0.0077225], 0, 2.7628, 1637921913], "v": "v0.6"}
{"i": [["[\"pool_layer\", \"avg\", 128, 2016, 21, 21, 1, 1, 2, \"VALID\"]", "cuda -keys=cuda,gpu -max_num_threads=1024 -thread_warp_size=32", [-1, 16, 64, 49152, 2147483647, 1024, 8, 32], "", 0, []], [[], [["FU", 2, [0, 1, 2, 3]], ["SP", 2, 0, 31223808, [1], 1], ["AN", 2, 0, 5], ["AN", 2, 1, 6], ["FU", 1, [0, 1, 2, 3]], ["SP", 1, 0, 31223808, [2], 1], ["AN", 1, 0, 5], ["AN", 1, 1, 6], ["PR", 1, 0, "auto_unroll_max_step$16"]]]], "r": [[0.0730485], 0, 3.15413, 1637921916], "v": "v0.6"}
{"i": [["[\"pool_layer\", \"avg\", 128, 2016, 21, 21, 1, 1, 2, \"VALID\"]", "cuda -keys=cuda,gpu -max_num_threads=1024 -thread_warp_size=32", [-1, 16, 64, 49152, 2147483647, 1024, 8, 32], "", 0, []], [[], [["FU", 2, [0, 1, 2, 3]], ["SP", 2, 0, 31223808, [16], 1], ["AN", 2, 0, 5], ["AN", 2, 1, 6], ["FU", 1, [0, 1, 2, 3]], ["SP", 1, 0, 31223808, [64], 1], ["AN", 1, 0, 5], ["AN", 1, 1, 6], ["PR", 1, 0, "auto_unroll_max_step$64"]]]], "r": [[0.00381011], 0, 2.70731, 1637921919], "v": "v0.6"}
{"i": [["[\"pool_layer\", \"avg\", 128, 2016, 21, 21, 1, 1, 2, \"VALID\"]", "cuda -keys=cuda,gpu -max_num_threads=1024 -thread_warp_size=32", [-1, 16, 64, 49152, 2147483647, 1024, 8, 32], "", 0, []], [[], [["FU", 2, [0, 1, 2, 3]], ["SP", 2, 0, 31223808, [24], 1], ["AN", 2, 0, 5], ["AN", 2, 1, 6], ["FU", 1, [0, 1, 2, 3]], ["SP", 1, 0, 31223808, [16], 1], ["AN", 1, 0, 5], ["AN", 1, 1, 6], ["PR", 1, 0, "auto_unroll_max_step$64"]]]], "r": [[0.00507717], 0, 2.89782, 1637921921], "v": "v0.6"}
{"i": [["[\"pool_layer\", \"avg\", 128, 2016, 21, 21, 1, 1, 2, \"VALID\"]", "cuda -keys=cuda,gpu -max_num_threads=1024 -thread_warp_size=32", [-1, 16, 64, 49152, 2147483647, 1024, 8, 32], "", 0, []], [[], [["FU", 2, [0, 1, 2, 3]], ["SP", 2, 0, 31223808, [7], 1], ["AN", 2, 0, 5], ["AN", 2, 1, 6], ["FU", 1, [0, 1, 2, 3]], ["SP", 1, 0, 31223808, [64], 1], ["AN", 1, 0, 5], ["AN", 1, 1, 6], ["PR", 1, 0, "auto_unroll_max_step$0"]]]], "r": [[0.00772257], 0, 2.74431, 1637921924], "v": "v0.6"}
{"i": [["[\"pool_layer\", \"avg\", 128, 2016, 21, 21, 1, 1, 2, \"VALID\"]", "cuda -keys=cuda,gpu -max_num_threads=1024 -thread_warp_size=32", [-1, 16, 64, 49152, 2147483647, 1024, 8, 32], "", 0, []], [[], [["FU", 2, [0, 1, 2, 3]], ["SP", 2, 0, 31223808, [8], 1], ["AN", 2, 0, 5], ["AN", 2, 1, 6], ["FU", 1, [0, 1, 2, 3]], ["SP", 1, 0, 31223808, [4], 1], ["AN", 1, 0, 5], ["AN", 1, 1, 6], ["PR", 1, 0, "auto_unroll_max_step$64"]]]], "r": [[0.0182663], 0, 2.77051, 1637921926], "v": "v0.6"}
{"i": [["[\"pool_layer\", \"avg\", 128, 2016, 21, 21, 1, 1, 2, \"VALID\"]", "cuda -keys=cuda,gpu -max_num_threads=1024 -thread_warp_size=32", [-1, 16, 64, 49152, 2147483647, 1024, 8, 32], "", 0, []], [[], [["FU", 2, [0, 1, 2, 3]], ["SP", 2, 0, 31223808, [64], 1], ["AN", 2, 0, 5], ["AN", 2, 1, 6], ["FU", 1, [0, 1, 2, 3]], ["SP", 1, 0, 31223808, [64], 1], ["AN", 1, 0, 5], ["AN", 1, 1, 6], ["PR", 1, 0, "auto_unroll_max_step$0"]]]], "r": [[0.00152746], 0, 3.19651, 1637921929], "v": "v0.6"}
{"i": [["[\"pool_layer\", \"avg\", 128, 2016, 21, 21, 1, 1, 2, \"VALID\"]", "cuda -keys=cuda,gpu -max_num_threads=1024 -thread_warp_size=32", [-1, 16, 64, 49152, 2147483647, 1024, 8, 32], "", 0, []], [[], [["FU", 2, [0, 1, 2, 3]], ["SP", 2, 0, 31223808, [48], 1], ["AN", 2, 0, 5], ["AN", 2, 1, 6], ["FU", 1, [0, 1, 2, 3]], ["SP", 1, 0, 31223808, [64], 1], ["AN", 1, 0, 5], ["AN", 1, 1, 6], ["PR", 1, 0, "auto_unroll_max_step$1024"]]]], "r": [[0.00178094], 0, 2.75914, 1637921932], "v": "v0.6"}
{"i": [["[\"pool_layer\", \"avg\", 128, 2016, 21, 21, 1, 1, 2, \"VALID\"]", "cuda -keys=cuda,gpu -max_num_threads=1024 -thread_warp_size=32", [-1, 16, 64, 49152, 2147483647, 1024, 8, 32], "", 0, []], [[], [["FU", 2, [0, 1, 2, 3]], ["SP", 2, 0, 31223808, [4], 1], ["AN", 2, 0, 5], ["AN", 2, 1, 6], ["FU", 1, [0, 1, 2, 3]], ["SP", 1, 0, 31223808, [1], 1], ["AN", 1, 0, 5], ["AN", 1, 1, 6], ["PR", 1, 0, "auto_unroll_max_step$64"]]]], "r": [[0.0608744], 0, 3.09942, 1637921935], "v": "v0.6"}
{"i": [["[\"pool_layer\", \"avg\", 128, 2016, 21, 21, 1, 1, 2, \"VALID\"]", "cuda -keys=cuda,gpu -max_num_threads=1024 -thread_warp_size=32", [-1, 16, 64, 49152, 2147483647, 1024, 8, 32], "", 0, []], [[], [["FU", 2, [0, 1, 2, 3]], ["SP", 2, 0, 31223808, [4], 1], ["AN", 2, 0, 5], ["AN", 2, 1, 6], ["FU", 1, [0, 1, 2, 3]], ["SP", 1, 0, 31223808, [32], 1], ["AN", 1, 0, 5], ["AN", 1, 1, 6], ["PR", 1, 0, "auto_unroll_max_step$64"]]]], "r": [[0.0136997], 0, 2.80041, 1637921937], "v": "v0.6"}
{"i": [["[\"pool_layer\", \"avg\", 128, 2016, 21, 21, 1, 1, 2, \"VALID\"]", "cuda -keys=cuda,gpu -max_num_threads=1024 -thread_warp_size=32", [-1, 16, 64, 49152, 2147483647, 1024, 8, 32], "", 0, []], [[], [["FU", 2, [0, 1, 2, 3]], ["SP", 2, 0, 31223808, [64], 1], ["AN", 2, 0, 5], ["AN", 2, 1, 6], ["FU", 1, [0, 1, 2, 3]], ["SP", 1, 0, 31223808, [4], 1], ["AN", 1, 0, 5], ["AN", 1, 1, 6], ["PR", 1, 0, "auto_unroll_max_step$1024"]]]], "r": [[0.0129402], 0, 2.73887, 1637921940], "v": "v0.6"}
{"i": [["[\"pool_layer\", \"avg\", 128, 2016, 21, 21, 1, 1, 2, \"VALID\"]", "cuda -keys=cuda,gpu -max_num_threads=1024 -thread_warp_size=32", [-1, 16, 64, 49152, 2147483647, 1024, 8, 32], "", 0, []], [[], [["FU", 2, [0, 1, 2, 3]], ["SP", 2, 0, 31223808, [7], 1], ["AN", 2, 0, 5], ["AN", 2, 1, 6], ["FU", 1, [0, 1, 2, 3]], ["SP", 1, 0, 31223808, [2], 1], ["AN", 1, 0, 5], ["AN", 1, 1, 6], ["PR", 1, 0, "auto_unroll_max_step$64"]]]], "r": [[0.0313078], 0, 2.91173, 1637921943], "v": "v0.6"}
{"i": [["[\"pool_layer\", \"avg\", 128, 2016, 21, 21, 1, 1, 2, \"VALID\"]", "cuda -keys=cuda,gpu -max_num_threads=1024 -thread_warp_size=32", [-1, 16, 64, 49152, 2147483647, 1024, 8, 32], "", 0, []], [[], [["FU", 2, [0, 1, 2, 3]], ["SP", 2, 0, 31223808, [4], 1], ["AN", 2, 0, 5], ["AN", 2, 1, 6], ["FU", 1, [0, 1, 2, 3]], ["SP", 1, 0, 31223808, [2], 1], ["AN", 1, 0, 5], ["AN", 1, 1, 6], ["PR", 1, 0, "auto_unroll_max_step$0"]]]], "r": [[0.0365244], 0, 2.88025, 1637921945], "v": "v0.6"}
{"i": [["[\"pool_layer\", \"avg\", 128, 2016, 21, 21, 1, 1, 2, \"VALID\"]", "cuda -keys=cuda,gpu -max_num_threads=1024 -thread_warp_size=32", [-1, 16, 64, 49152, 2147483647, 1024, 8, 32], "", 0, []], [[], [["FU", 2, [0, 1, 2, 3]], ["SP", 2, 0, 31223808, [8], 1], ["AN", 2, 0, 5], ["AN", 2, 1, 6], ["FU", 1, [0, 1, 2, 3]], ["SP", 1, 0, 31223808, [7], 1], ["AN", 1, 0, 5], ["AN", 1, 1, 6], ["PR", 1, 0, "auto_unroll_max_step$1024"]]]], "r": [[0.0130475], 0, 2.96855, 1637921948], "v": "v0.6"}
{"i": [["[\"pool_layer\", \"avg\", 128, 2016, 21, 21, 1, 1, 2, \"VALID\"]", "cuda -keys=cuda,gpu -max_num_threads=1024 -thread_warp_size=32", [-1, 16, 64, 49152, 2147483647, 1024, 8, 32], "", 0, []], [[], [["FU", 2, [0, 1, 2, 3]], ["SP", 2, 0, 31223808, [36], 1], ["AN", 2, 0, 5], ["AN", 2, 1, 6], ["FU", 1, [0, 1, 2, 3]], ["SP", 1, 0, 31223808, [64], 1], ["AN", 1, 0, 5], ["AN", 1, 1, 6], ["PR", 1, 0, "auto_unroll_max_step$16"]]]], "r": [[0.0021191], 0, 2.76318, 1637921951], "v": "v0.6"}
{"i": [["[\"pool_layer\", \"avg\", 128, 2016, 21, 21, 1, 1, 2, \"VALID\"]", "cuda -keys=cuda,gpu -max_num_threads=1024 -thread_warp_size=32", [-1, 16, 64, 49152, 2147483647, 1024, 8, 32], "", 0, []], [[], [["FU", 2, [0, 1, 2, 3]], ["SP", 2, 0, 31223808, [8], 1], ["AN", 2, 0, 5], ["AN", 2, 1, 6], ["FU", 1, [0, 1, 2, 3]], ["SP", 1, 0, 31223808, [4], 1], ["AN", 1, 0, 5], ["AN", 1, 1, 6], ["PR", 1, 0, "auto_unroll_max_step$1024"]]]], "r": [[0.0182656], 0, 3.0806, 1637921953], "v": "v0.6"}
{"i": [["[\"pool_layer\", \"avg\", 128, 2016, 21, 21, 1, 1, 2, \"VALID\"]", "cuda -keys=cuda,gpu -max_num_threads=1024 -thread_warp_size=32", [-1, 16, 64, 49152, 2147483647, 1024, 8, 32], "", 0, []], [[], [["FU", 2, [0, 1, 2, 3]], ["SP", 2, 0, 31223808, [48], 1], ["AN", 2, 0, 5], ["AN", 2, 1, 6], ["FU", 1, [0, 1, 2, 3]], ["SP", 1, 0, 31223808, [4], 1], ["AN", 1, 0, 5], ["AN", 1, 1, 6], ["PR", 1, 0, "auto_unroll_max_step$512"]]]], "r": [[0.0131984], 0, 3.80278, 1637921957], "v": "v0.6"}
{"i": [["[\"pool_layer\", \"avg\", 128, 2016, 21, 21, 1, 1, 2, \"VALID\"]", "cuda -keys=cuda,gpu -max_num_threads=1024 -thread_warp_size=32", [-1, 16, 64, 49152, 2147483647, 1024, 8, 32], "", 0, []], [[], [["FU", 2, [0, 1, 2, 3]], ["SP", 2, 0, 31223808, [48], 1], ["AN", 2, 0, 5], ["AN", 2, 1, 6], ["FU", 1, [0, 1, 2, 3]], ["SP", 1, 0, 31223808, [64], 1], ["AN", 1, 0, 5], ["AN", 1, 1, 6], ["PR", 1, 0, "auto_unroll_max_step$512"]]]], "r": [[0.00178108], 0, 4.88991, 1637921962], "v": "v0.6"}
{"i": [["[\"pool_layer\", \"avg\", 128, 2016, 21, 21, 1, 1, 2, \"VALID\"]", "cuda -keys=cuda,gpu -max_num_threads=1024 -thread_warp_size=32", [-1, 16, 64, 49152, 2147483647, 1024, 8, 32], "", 0, []], [[], [["FU", 2, [0, 1, 2, 3]], ["SP", 2, 0, 31223808, [1], 1], ["AN", 2, 0, 5], ["AN", 2, 1, 6], ["FU", 1, [0, 1, 2, 3]], ["SP", 1, 0, 31223808, [1], 1], ["AN", 1, 0, 5], ["AN", 1, 1, 6], ["PR", 1, 0, "auto_unroll_max_step$512"]]]], "r": [[0.0973892], 0, 3.21626, 1637921965], "v": "v0.6"}
{"i": [["[\"pool_layer\", \"avg\", 128, 2016, 21, 21, 1, 1, 2, \"VALID\"]", "cuda -keys=cuda,gpu -max_num_threads=1024 -thread_warp_size=32", [-1, 16, 64, 49152, 2147483647, 1024, 8, 32], "", 0, []], [[], [["FU", 2, [0, 1, 2, 3]], ["SP", 2, 0, 31223808, [64], 1], ["AN", 2, 0, 5], ["AN", 2, 1, 6], ["FU", 1, [0, 1, 2, 3]], ["SP", 1, 0, 31223808, [36], 1], ["AN", 1, 0, 5], ["AN", 1, 1, 6], ["PR", 1, 0, "auto_unroll_max_step$1024"]]]], "r": [[0.00211877], 0, 2.78228, 1637921967], "v": "v0.6"}
{"i": [["[\"pool_layer\", \"avg\", 128, 2016, 21, 21, 1, 1, 2, \"VALID\"]", "cuda -keys=cuda,gpu -max_num_threads=1024 -thread_warp_size=32", [-1, 16, 64, 49152, 2147483647, 1024, 8, 32], "", 0, []], [[], [["FU", 2, [0, 1, 2, 3]], ["SP", 2, 0, 31223808, [32], 1], ["AN", 2, 0, 5], ["AN", 2, 1, 6], ["FU", 1, [0, 1, 2, 3]], ["SP", 1, 0, 31223808, [2], 1], ["AN", 1, 0, 5], ["AN", 1, 1, 6], ["PR", 1, 0, "auto_unroll_max_step$512"]]]], "r": [[0.0258738], 0, 2.8637, 1637921970], "v": "v0.6"}
{"i": [["[\"pool_layer\", \"avg\", 128, 2016, 21, 21, 1, 1, 2, \"VALID\"]", "cuda -keys=cuda,gpu -max_num_threads=1024 -thread_warp_size=32", [-1, 16, 64, 49152, 2147483647, 1024, 8, 32], "", 0, []], [[], [["FU", 2, [0, 1, 2, 3]], ["SP", 2, 0, 31223808, [32], 1], ["AN", 2, 0, 5], ["AN", 2, 1, 6], ["FU", 1, [0, 1, 2, 3]], ["SP", 1, 0, 31223808, [8], 1], ["AN", 1, 0, 5], ["AN", 1, 1, 6], ["PR", 1, 0, "auto_unroll_max_step$0"]]]], "r": [[0.0076144], 0, 2.6632, 1637921975], "v": "v0.6"}
{"i": [["[\"pool_layer\", \"avg\", 128, 2016, 21, 21, 1, 1, 2, \"VALID\"]", "cuda -keys=cuda,gpu -max_num_threads=1024 -thread_warp_size=32", [-1, 16, 64, 49152, 2147483647, 1024, 8, 32], "", 0, []], [[], [["FU", 2, [0, 1, 2, 3]], ["SP", 2, 0, 31223808, [32], 1], ["AN", 2, 0, 5], ["AN", 2, 1, 6], ["FU", 1, [0, 1, 2, 3]], ["SP", 1, 0, 31223808, [12], 1], ["AN", 1, 0, 5], ["AN", 1, 1, 6], ["PR", 1, 0, "auto_unroll_max_step$16"]]]], "r": [[0.00558432], 0, 2.84888, 1637921977], "v": "v0.6"}
{"i": [["[\"pool_layer\", \"avg\", 128, 2016, 21, 21, 1, 1, 2, \"VALID\"]", "cuda -keys=cuda,gpu -max_num_threads=1024 -thread_warp_size=32", [-1, 16, 64, 49152, 2147483647, 1024, 8, 32], "", 0, []], [[], [["FU", 2, [0, 1, 2, 3]], ["SP", 2, 0, 31223808, [16], 1], ["AN", 2, 0, 5], ["AN", 2, 1, 6], ["FU", 1, [0, 1, 2, 3]], ["SP", 1, 0, 31223808, [12], 1], ["AN", 1, 0, 5], ["AN", 1, 1, 6], ["PR", 1, 0, "auto_unroll_max_step$512"]]]], "r": [[0.0071058], 0, 2.77757, 1637921980], "v": "v0.6"}
{"i": [["[\"pool_layer\", \"avg\", 128, 2016, 21, 21, 1, 1, 2, \"VALID\"]", "cuda -keys=cuda,gpu -max_num_threads=1024 -thread_warp_size=32", [-1, 16, 64, 49152, 2147483647, 1024, 8, 32], "", 0, []], [[], [["FU", 2, [0, 1, 2, 3]], ["SP", 2, 0, 31223808, [4], 1], ["AN", 2, 0, 5], ["AN", 2, 1, 6], ["FU", 1, [0, 1, 2, 3]], ["SP", 1, 0, 31223808, [48], 1], ["AN", 1, 0, 5], ["AN", 1, 1, 6], ["PR", 1, 0, "auto_unroll_max_step$16"]]]], "r": [[0.0131941], 0, 2.87725, 1637921983], "v": "v0.6"}
{"i": [["[\"pool_layer\", \"avg\", 128, 2016, 21, 21, 1, 1, 2, \"VALID\"]", "cuda -keys=cuda,gpu -max_num_threads=1024 -thread_warp_size=32", [-1, 16, 64, 49152, 2147483647, 1024, 8, 32], "", 0, []], [[], [["FU", 2, [0, 1, 2, 3]], ["SP", 2, 0, 31223808, [6], 1], ["AN", 2, 0, 5], ["AN", 2, 1, 6], ["FU", 1, [0, 1, 2, 3]], ["SP", 1, 0, 31223808, [64], 1], ["AN", 1, 0, 5], ["AN", 1, 1, 6], ["PR", 1, 0, "auto_unroll_max_step$512"]]]], "r": [[0.00888196], 0, 2.75276, 1637921985], "v": "v0.6"}
{"i": [["[\"pool_layer\", \"avg\", 128, 2016, 21, 21, 1, 1, 2, \"VALID\"]", "cuda -keys=cuda,gpu -max_num_threads=1024 -thread_warp_size=32", [-1, 16, 64, 49152, 2147483647, 1024, 8, 32], "", 0, []], [[], [["FU", 2, [0, 1, 2, 3]], ["SP", 2, 0, 31223808, [44], 1], ["AN", 2, 0, 5], ["AN", 2, 1, 6], ["FU", 1, [0, 1, 2, 3]], ["SP", 1, 0, 31223808, [1], 1], ["AN", 1, 0, 5], ["AN", 1, 1, 6], ["PR", 1, 0, "auto_unroll_max_step$1024"]]]], "r": [[0.0498037], 0, 3.08767, 1637921988], "v": "v0.6"}
{"i": [["[\"pool_layer\", \"avg\", 128, 2016, 21, 21, 1, 1, 2, \"VALID\"]", "cuda -keys=cuda,gpu -max_num_threads=1024 -thread_warp_size=32", [-1, 16, 64, 49152, 2147483647, 1024, 8, 32], "", 0, []], [[], [["FU", 2, [0, 1, 2, 3]], ["SP", 2, 0, 31223808, [2], 1], ["AN", 2, 0, 5], ["AN", 2, 1, 6], ["FU", 1, [0, 1, 2, 3]], ["SP", 1, 0, 31223808, [28], 1], ["AN", 1, 0, 5], ["AN", 1, 1, 6], ["PR", 1, 0, "auto_unroll_max_step$64"]]]], "r": [[0.0260901], 0, 2.9442, 1637921991], "v": "v0.6"}
{"i": [["[\"pool_layer\", \"avg\", 128, 2016, 21, 21, 1, 1, 2, \"VALID\"]", "cuda -keys=cuda,gpu -max_num_threads=1024 -thread_warp_size=32", [-1, 16, 64, 49152, 2147483647, 1024, 8, 32], "", 0, []], [[], [["FU", 2, [0, 1, 2, 3]], ["SP", 2, 0, 31223808, [8], 1], ["AN", 2, 0, 5], ["AN", 2, 1, 6], ["FU", 1, [0, 1, 2, 3]], ["SP", 1, 0, 31223808, [8], 1], ["AN", 1, 0, 5], ["AN", 1, 1, 6], ["PR", 1, 0, "auto_unroll_max_step$0"]]]], "r": [[0.0121778], 0, 2.83924, 1637921993], "v": "v0.6"}
{"i": [["[\"pool_layer\", \"avg\", 128, 2016, 21, 21, 1, 1, 2, \"VALID\"]", "cuda -keys=cuda,gpu -max_num_threads=1024 -thread_warp_size=32", [-1, 16, 64, 49152, 2147483647, 1024, 8, 32], "", 0, []], [[], [["FU", 2, [0, 1, 2, 3]], ["SP", 2, 0, 31223808, [1], 1], ["AN", 2, 0, 5], ["AN", 2, 1, 6], ["FU", 1, [0, 1, 2, 3]], ["SP", 1, 0, 31223808, [48], 1], ["AN", 1, 0, 5], ["AN", 1, 1, 6], ["PR", 1, 0, "auto_unroll_max_step$0"]]]], "r": [[0.0497188], 0, 3.1596, 1637921996], "v": "v0.6"}
{"i": [["[\"pool_layer\", \"avg\", 128, 2016, 21, 21, 1, 1, 2, \"VALID\"]", "cuda -keys=cuda,gpu -max_num_threads=1024 -thread_warp_size=32", [-1, 16, 64, 49152, 2147483647, 1024, 8, 32], "", 0, []], [[], [["FU", 2, [0, 1, 2, 3]], ["SP", 2, 0, 31223808, [4], 1], ["AN", 2, 0, 5], ["AN", 2, 1, 6], ["FU", 1, [0, 1, 2, 3]], ["SP", 1, 0, 31223808, [4], 1], ["AN", 1, 0, 5], ["AN", 1, 1, 6], ["PR", 1, 0, "auto_unroll_max_step$512"]]]], "r": [[0.0243518], 0, 2.88466, 1637921999], "v": "v0.6"}
{"i": [["[\"pool_layer\", \"avg\", 128, 2016, 21, 21, 1, 1, 2, \"VALID\"]", "cuda -keys=cuda,gpu -max_num_threads=1024 -thread_warp_size=32", [-1, 16, 64, 49152, 2147483647, 1024, 8, 32], "", 0, []], [[], [["FU", 2, [0, 1, 2, 3]], ["SP", 2, 0, 31223808, [8], 1], ["AN", 2, 0, 5], ["AN", 2, 1, 6], ["FU", 1, [0, 1, 2, 3]], ["SP", 1, 0, 31223808, [64], 1], ["AN", 1, 0, 5], ["AN", 1, 1, 6], ["PR", 1, 0, "auto_unroll_max_step$0"]]]], "r": [[0.00685514], 0, 2.73132, 1637922001], "v": "v0.6"}
{"i": [["[\"pool_layer\", \"avg\", 128, 2016, 21, 21, 1, 1, 2, \"VALID\"]", "cuda -keys=cuda,gpu -max_num_threads=1024 -thread_warp_size=32", [-1, 16, 64, 49152, 2147483647, 1024, 8, 32], "", 0, []], [[], [["FU", 2, [0, 1, 2, 3]], ["SP", 2, 0, 31223808, [7], 1], ["AN", 2, 0, 5], ["AN", 2, 1, 6], ["FU", 1, [0, 1, 2, 3]], ["SP", 1, 0, 31223808, [1], 1], ["AN", 1, 0, 5], ["AN", 1, 1, 6], ["PR", 1, 0, "auto_unroll_max_step$1024"]]]], "r": [[0.055654], 0, 3.14922, 1637922004], "v": "v0.6"}
{"i": [["[\"pool_layer\", \"avg\", 128, 2016, 21, 21, 1, 1, 2, \"VALID\"]", "cuda -keys=cuda,gpu -max_num_threads=1024 -thread_warp_size=32", [-1, 16, 64, 49152, 2147483647, 1024, 8, 32], "", 0, []], [[], [["FU", 2, [0, 1, 2, 3]], ["SP", 2, 0, 31223808, [1], 1], ["AN", 2, 0, 5], ["AN", 2, 1, 6], ["FU", 1, [0, 1, 2, 3]], ["SP", 1, 0, 31223808, [9], 1], ["AN", 1, 0, 5], ["AN", 1, 1, 6], ["PR", 1, 0, "auto_unroll_max_step$16"]]]], "r": [[0.0541097], 0, 3.00491, 1637922007], "v": "v0.6"}
{"i": [["[\"pool_layer\", \"avg\", 128, 2016, 21, 21, 1, 1, 2, \"VALID\"]", "cuda -keys=cuda,gpu -max_num_threads=1024 -thread_warp_size=32", [-1, 16, 64, 49152, 2147483647, 1024, 8, 32], "", 0, []], [[], [["FU", 2, [0, 1, 2, 3]], ["SP", 2, 0, 31223808, [6], 1], ["AN", 2, 0, 5], ["AN", 2, 1, 6], ["FU", 1, [0, 1, 2, 3]], ["SP", 1, 0, 31223808, [64], 1], ["AN", 1, 0, 5], ["AN", 1, 1, 6], ["PR", 1, 0, "auto_unroll_max_step$16"]]]], "r": [[0.0088843], 0, 2.71321, 1637922010], "v": "v0.6"}
{"i": [["[\"pool_layer\", \"avg\", 128, 2016, 21, 21, 1, 1, 2, \"VALID\"]", "cuda -keys=cuda,gpu -max_num_threads=1024 -thread_warp_size=32", [-1, 16, 64, 49152, 2147483647, 1024, 8, 32], "", 0, []], [[], [["FU", 2, [0, 1, 2, 3]], ["SP", 2, 0, 31223808, [28], 1], ["AN", 2, 0, 5], ["AN", 2, 1, 6], ["FU", 1, [0, 1, 2, 3]], ["SP", 1, 0, 31223808, [1], 1], ["AN", 1, 0, 5], ["AN", 1, 1, 6], ["PR", 1, 0, "auto_unroll_max_step$0"]]]], "r": [[0.0504359], 0, 3.02304, 1637922012], "v": "v0.6"}
{"i": [["[\"pool_layer\", \"avg\", 128, 2016, 21, 21, 1, 1, 2, \"VALID\"]", "cuda -keys=cuda,gpu -max_num_threads=1024 -thread_warp_size=32", [-1, 16, 64, 49152, 2147483647, 1024, 8, 32], "", 0, []], [[], [["FU", 2, [0, 1, 2, 3]], ["SP", 2, 0, 31223808, [1], 1], ["AN", 2, 0, 5], ["AN", 2, 1, 6], ["FU", 1, [0, 1, 2, 3]], ["SP", 1, 0, 31223808, [56], 1], ["AN", 1, 0, 5], ["AN", 1, 1, 6], ["PR", 1, 0, "auto_unroll_max_step$64"]]]], "r": [[0.0495673], 0, 3.04107, 1637922015], "v": "v0.6"}
{"i": [["[\"pool_layer\", \"avg\", 128, 2016, 21, 21, 1, 1, 2, \"VALID\"]", "cuda -keys=cuda,gpu -max_num_threads=1024 -thread_warp_size=32", [-1, 16, 64, 49152, 2147483647, 1024, 8, 32], "", 0, []], [[], [["FU", 2, [0, 1, 2, 3]], ["SP", 2, 0, 31223808, [63], 1], ["AN", 2, 0, 5], ["AN", 2, 1, 6], ["FU", 1, [0, 1, 2, 3]], ["SP", 1, 0, 31223808, [64], 1], ["AN", 1, 0, 5], ["AN", 1, 1, 6], ["PR", 1, 0, "auto_unroll_max_step$0"]]]], "r": [[0.00154057], 0, 3.18792, 1637922028], "v": "v0.6"}
{"i": [["[\"pool_layer\", \"avg\", 128, 2016, 21, 21, 1, 1, 2, \"VALID\"]", "cuda -keys=cuda,gpu -max_num_threads=1024 -thread_warp_size=32", [-1, 16, 64, 49152, 2147483647, 1024, 8, 32], "", 0, []], [[], [["FU", 2, [0, 1, 2, 3]], ["SP", 2, 0, 31223808, [64], 1], ["AN", 2, 0, 5], ["AN", 2, 1, 6], ["FU", 1, [0, 1, 2, 3]], ["SP", 1, 0, 31223808, [64], 1], ["AN", 1, 0, 5], ["AN", 1, 1, 6], ["PR", 1, 0, "auto_unroll_max_step$512"]]]], "r": [[0.00152754], 0, 3.20616, 1637922031], "v": "v0.6"}
