artifacts/Table4/tvm/autotvm/conv/conv2d_128_128_28_28_128_3_3_1_1.log
{"input": ["rocm -keys=rocm,gpu -max_num_threads=256 -mcpu=gfx906 -mtriple=amdgcn-amd-amdhsa-hcc -thread_warp_size=64", "conv2d_nchw.cuda", [["TENSOR", [128, 128, 28, 28], "float32"], ["TENSOR", [128, 128, 3, 3], "float32"], 1, 1, 1, "float32"], {}], "config": {"index": 3425653, "code_hash": null, "entity": [["tile_f", "sp", [-1, 32, 2, 1]], ["tile_y", "sp", [-1, 1, 1, 4]], ["tile_x", "sp", [-1, 1, 2, 7]], ["tile_rc", "sp", [-1, 2]], ["tile_ry", "sp", [-1, 1]], ["tile_rx", "sp", [-1, 3]], ["auto_unroll_max_step", "ot", 0], ["unroll_explicit", "ot", 1]]}, "result": [[1.4469952392499998], 0, 10.371386289596558, 1638512615.0211215], "version": 0.2, "tvm_version": "0.9.dev0"}
{"input": ["rocm -keys=rocm,gpu -max_num_threads=256 -mcpu=gfx906 -mtriple=amdgcn-amd-amdhsa-hcc -thread_warp_size=64", "conv2d_nchw.cuda", [["TENSOR", [128, 128, 28, 28], "float32"], ["TENSOR", [128, 128, 3, 3], "float32"], 1, 1, 1, "float32"], {}], "config": {"index": 226870, "code_hash": null, "entity": [["tile_f", "sp", [-1, 1, 2, 4]], ["tile_y", "sp", [-1, 1, 4, 1]], ["tile_x", "sp", [-1, 2, 2, 1]], ["tile_rc", "sp", [-1, 2]], ["tile_ry", "sp", [-1, 1]], ["tile_rx", "sp", [-1, 1]], ["auto_unroll_max_step", "ot", 0], ["unroll_explicit", "ot", 1]]}, "result": [[0.16987463374999998], 0, 2.6325817108154297, 1638512617.1782951], "version": 0.2, "tvm_version": "0.9.dev0"}
{"input": ["rocm -keys=rocm,gpu -max_num_threads=256 -mcpu=gfx906 -mtriple=amdgcn-amd-amdhsa-hcc -thread_warp_size=64", "conv2d_nchw.cuda", [["TENSOR", [128, 128, 28, 28], "float32"], ["TENSOR", [128, 128, 3, 3], "float32"], 1, 1, 1, "float32"], {}], "config": {"index": 1309244, "code_hash": null, "entity": [["tile_f", "sp", [-1, 2, 2, 2]], ["tile_y", "sp", [-1, 1, 1, 7]], ["tile_x", "sp", [-1, 4, 1, 7]], ["tile_rc", "sp", [-1, 64]], ["tile_ry", "sp", [-1, 1]], ["tile_rx", "sp", [-1, 1]], ["auto_unroll_max_step", "ot", 0], ["unroll_explicit", "ot", 1]]}, "result": [[24.07484179675], 0, 122.57122611999512, 1638512738.727388], "version": 0.2, "tvm_version": "0.9.dev0"}
{"input": ["rocm -keys=rocm,gpu -max_num_threads=256 -mcpu=gfx906 -mtriple=amdgcn-amd-amdhsa-hcc -thread_warp_size=64", "conv2d_nchw.cuda", [["TENSOR", [128, 128, 28, 28], "float32"], ["TENSOR", [128, 128, 3, 3], "float32"], 1, 1, 1, "float32"], {}], "config": {"index": 13912246, "code_hash": null, "entity": [["tile_f", "sp", [-1, 8, 2, 2]], ["tile_y", "sp", [-1, 1, 14, 1]], ["tile_x", "sp", [-1, 1, 1, 2]], ["tile_rc", "sp", [-1, 1]], ["tile_ry", "sp", [-1, 3]], ["tile_rx", "sp", [-1, 1]], ["auto_unroll_max_step", "ot", 1500], ["unroll_explicit", "ot", 1]]}, "result": [[2.389705078], 0, 15.873548746109009, 1638512952.4226356], "version": 0.2, "tvm_version": "0.9.dev0"}
{"input": ["rocm -keys=rocm,gpu -max_num_threads=256 -mcpu=gfx906 -mtriple=amdgcn-amd-amdhsa-hcc -thread_warp_size=64", "conv2d_nchw.cuda", [["TENSOR", [128, 128, 28, 28], "float32"], ["TENSOR", [128, 128, 3, 3], "float32"], 1, 1, 1, "float32"], {}], "config": {"index": 11720436, "code_hash": null, "entity": [["tile_f", "sp", [-1, 1, 1, 2]], ["tile_y", "sp", [-1, 1, 1, 7]], ["tile_x", "sp", [-1, 2, 1, 1]], ["tile_rc", "sp", [-1, 32]], ["tile_ry", "sp", [-1, 3]], ["tile_rx", "sp", [-1, 3]], ["auto_unroll_max_step", "ot", 512], ["unroll_explicit", "ot", 1]]}, "result": [[1.19070983875], 0, 7.834935665130615, 1638512959.6478305], "version": 0.2, "tvm_version": "0.9.dev0"}
{"input": ["rocm -keys=rocm,gpu -max_num_threads=256 -mcpu=gfx906 -mtriple=amdgcn-amd-amdhsa-hcc -thread_warp_size=64", "conv2d_nchw.cuda", [["TENSOR", [128, 128, 28, 28], "float32"], ["TENSOR", [128, 128, 3, 3], "float32"], 1, 1, 1, "float32"], {}], "config": {"index": 16543803, "code_hash": null, "entity": [["tile_f", "sp", [-1, 8, 1, 1]], ["tile_y", "sp", [-1, 2, 7, 2]], ["tile_x", "sp", [-1, 1, 2, 1]], ["tile_rc", "sp", [-1, 64]], ["tile_ry", "sp", [-1, 1]], ["tile_rx", "sp", [-1, 3]], ["auto_unroll_max_step", "ot", 1500], ["unroll_explicit", "ot", 1]]}, "result": [[0.86677844225], 0, 13.810892581939697, 1638512965.3484964], "version": 0.2, "tvm_version": "0.9.dev0"}
{"input": ["rocm -keys=rocm,gpu -max_num_threads=256 -mcpu=gfx906 -mtriple=amdgcn-amd-amdhsa-hcc -thread_warp_size=64", "conv2d_nchw.cuda", [["TENSOR", [128, 128, 28, 28], "float32"], ["TENSOR", [128, 128, 3, 3], "float32"], 1, 1, 1, "float32"], {}], "config": {"index": 11593051, "code_hash": null, "entity": [["tile_f", "sp", [-1, 2, 2, 8]], ["tile_y", "sp", [-1, 7, 2, 1]], ["tile_x", "sp", [-1, 1, 14, 1]], ["tile_rc", "sp", [-1, 16]], ["tile_ry", "sp", [-1, 3]], ["tile_rx", "sp", [-1, 3]], ["auto_unroll_max_step", "ot", 512], ["unroll_explicit", "ot", 1]]}, "result": [[2.39750073225], 0, 17.850104570388794, 1638512978.7030377], "version": 0.2, "tvm_version": "0.9.dev0"}
{"input": ["rocm -keys=rocm,gpu -max_num_threads=256 -mcpu=gfx906 -mtriple=amdgcn-amd-amdhsa-hcc -thread_warp_size=64", "conv2d_nchw.cuda", [["TENSOR", [128, 128, 28, 28], "float32"], ["TENSOR", [128, 128, 3, 3], "float32"], 1, 1, 1, "float32"], {}], "config": {"index": 5261877, "code_hash": null, "entity": [["tile_f", "sp", [-1, 2, 1, 64]], ["tile_y", "sp", [-1, 7, 2, 1]], ["tile_x", "sp", [-1, 2, 14, 1]], ["tile_rc", "sp", [-1, 8]], ["tile_ry", "sp", [-1, 3]], ["tile_rx", "sp", [-1, 3]], ["auto_unroll_max_step", "ot", 0], ["unroll_explicit", "ot", 1]]}, "result": [[3.44817602525], 0, 19.295172929763794, 1638513197.5520098], "version": 0.2, "tvm_version": "0.9.dev0"}
{"input": ["rocm -keys=rocm,gpu -max_num_threads=256 -mcpu=gfx906 -mtriple=amdgcn-amd-amdhsa-hcc -thread_warp_size=64", "conv2d_nchw.cuda", [["TENSOR", [128, 128, 28, 28], "float32"], ["TENSOR", [128, 128, 3, 3], "float32"], 1, 1, 1, "float32"], {}], "config": {"index": 1183556, "code_hash": null, "entity": [["tile_f", "sp", [-1, 1, 1, 64]], ["tile_y", "sp", [-1, 1, 2, 2]], ["tile_x", "sp", [-1, 1, 2, 1]], ["tile_rc", "sp", [-1, 64]], ["tile_ry", "sp", [-1, 1]], ["tile_rx", "sp", [-1, 1]], ["auto_unroll_max_step", "ot", 0], ["unroll_explicit", "ot", 1]]}, "result": [[2.516668701], 0, 14.945345878601074, 1638513211.3594565], "version": 0.2, "tvm_version": "0.9.dev0"}
{"input": ["rocm -keys=rocm,gpu -max_num_threads=256 -mcpu=gfx906 -mtriple=amdgcn-amd-amdhsa-hcc -thread_warp_size=64", "conv2d_nchw.cuda", [["TENSOR", [128, 128, 28, 28], "float32"], ["TENSOR", [128, 128, 3, 3], "float32"], 1, 1, 1, "float32"], {}], "config": {"index": 8252531, "code_hash": null, "entity": [["tile_f", "sp", [-1, 8, 2, 1]], ["tile_y", "sp", [-1, 7, 4, 1]], ["tile_x", "sp", [-1, 1, 1, 28]], ["tile_rc", "sp", [-1, 4]], ["tile_ry", "sp", [-1, 3]], ["tile_rx", "sp", [-1, 1]], ["auto_unroll_max_step", "ot", 512], ["unroll_explicit", "ot", 1]]}, "result": [[1.99581579575], 0, 14.511592626571655, 1638513222.6432574], "version": 0.2, "tvm_version": "0.9.dev0"}
{"input": ["rocm -keys=rocm,gpu -max_num_threads=256 -mcpu=gfx906 -mtriple=amdgcn-amd-amdhsa-hcc -thread_warp_size=64", "conv2d_nchw.cuda", [["TENSOR", [128, 128, 28, 28], "float32"], ["TENSOR", [128, 128, 3, 3], "float32"], 1, 1, 1, "float32"], {}], "config": {"index": 9958215, "code_hash": null, "entity": [["tile_f", "sp", [-1, 1, 4, 1]], ["tile_y", "sp", [-1, 2, 7, 2]], ["tile_x", "sp", [-1, 2, 2, 7]], ["tile_rc", "sp", [-1, 8]], ["tile_ry", "sp", [-1, 1]], ["tile_rx", "sp", [-1, 3]], ["auto_unroll_max_step", "ot", 512], ["unroll_explicit", "ot", 1]]}, "result": [[0.43408242775], 0, 5.412345886230469, 1638513226.133368], "version": 0.2, "tvm_version": "0.9.dev0"}
{"input": ["rocm -keys=rocm,gpu -max_num_threads=256 -mcpu=gfx906 -mtriple=amdgcn-amd-amdhsa-hcc -thread_warp_size=64", "conv2d_nchw.cuda", [["TENSOR", [128, 128, 28, 28], "float32"], ["TENSOR", [128, 128, 3, 3], "float32"], 1, 1, 1, "float32"], {}], "config": {"index": 5064346, "code_hash": null, "entity": [["tile_f", "sp", [-1, 4, 2, 16]], ["tile_y", "sp", [-1, 4, 1, 1]], ["tile_x", "sp", [-1, 1, 14, 1]], ["tile_rc", "sp", [-1, 4]], ["tile_ry", "sp", [-1, 3]], ["tile_rx", "sp", [-1, 3]], ["auto_unroll_max_step", "ot", 0], ["unroll_explicit", "ot", 1]]}, "result": [[1.06143737775], 0, 7.420645475387573, 1638513232.7534251], "version": 0.2, "tvm_version": "0.9.dev0"}
{"input": ["rocm -keys=rocm,gpu -max_num_threads=256 -mcpu=gfx906 -mtriple=amdgcn-amd-amdhsa-hcc -thread_warp_size=64", "conv2d_nchw.cuda", [["TENSOR", [128, 128, 28, 28], "float32"], ["TENSOR", [128, 128, 3, 3], "float32"], 1, 1, 1, "float32"], {}], "config": {"index": 17117957, "code_hash": null, "entity": [["tile_f", "sp", [-1, 4, 4, 4]], ["tile_y", "sp", [-1, 14, 2, 1]], ["tile_x", "sp", [-1, 1, 2, 1]], ["tile_rc", "sp", [-1, 2]], ["tile_ry", "sp", [-1, 3]], ["tile_rx", "sp", [-1, 3]], ["auto_unroll_max_step", "ot", 1500], ["unroll_explicit", "ot", 1]]}, "result": [[1.66413085925], 0, 14.531923055648804, 1638513242.390985], "version": 0.2, "tvm_version": "0.9.dev0"}
{"input": ["rocm -keys=rocm,gpu -max_num_threads=256 -mcpu=gfx906 -mtriple=amdgcn-amd-amdhsa-hcc -thread_warp_size=64", "conv2d_nchw.cuda", [["TENSOR", [128, 128, 28, 28], "float32"], ["TENSOR", [128, 128, 3, 3], "float32"], 1, 1, 1, "float32"], {}], "config": {"index": 9640518, "code_hash": null, "entity": [["tile_f", "sp", [-1, 8, 4, 4]], ["tile_y", "sp", [-1, 1, 28, 1]], ["tile_x", "sp", [-1, 7, 2, 1]], ["tile_rc", "sp", [-1, 4]], ["tile_ry", "sp", [-1, 1]], ["tile_rx", "sp", [-1, 3]], ["auto_unroll_max_step", "ot", 512], ["unroll_explicit", "ot", 1]]}, "result": [[0.77155346675], 0, 7.155863046646118, 1638513247.5018744], "version": 0.2, "tvm_version": "0.9.dev0"}
{"input": ["rocm -keys=rocm,gpu -max_num_threads=256 -mcpu=gfx906 -mtriple=amdgcn-amd-amdhsa-hcc -thread_warp_size=64", "conv2d_nchw.cuda", [["TENSOR", [128, 128, 28, 28], "float32"], ["TENSOR", [128, 128, 3, 3], "float32"], 1, 1, 1, "float32"], {}], "config": {"index": 2014761, "code_hash": null, "entity": [["tile_f", "sp", [-1, 4, 8, 4]], ["tile_y", "sp", [-1, 1, 7, 4]], ["tile_x", "sp", [-1, 2, 1, 2]], ["tile_rc", "sp", [-1, 4]], ["tile_ry", "sp", [-1, 3]], ["tile_rx", "sp", [-1, 1]], ["auto_unroll_max_step", "ot", 0], ["unroll_explicit", "ot", 1]]}, "result": [[0.29923260475], 0, 4.570096254348755, 1638513250.2741113], "version": 0.2, "tvm_version": "0.9.dev0"}
{"input": ["rocm -keys=rocm,gpu -max_num_threads=256 -mcpu=gfx906 -mtriple=amdgcn-amd-amdhsa-hcc -thread_warp_size=64", "conv2d_nchw.cuda", [["TENSOR", [128, 128, 28, 28], "float32"], ["TENSOR", [128, 128, 3, 3], "float32"], 1, 1, 1, "float32"], {}], "config": {"index": 10286777, "code_hash": null, "entity": [["tile_f", "sp", [-1, 4, 4, 1]], ["tile_y", "sp", [-1, 7, 1, 1]], ["tile_x", "sp", [-1, 7, 2, 2]], ["tile_rc", "sp", [-1, 32]], ["tile_ry", "sp", [-1, 1]], ["tile_rx", "sp", [-1, 3]], ["auto_unroll_max_step", "ot", 512], ["unroll_explicit", "ot", 1]]}, "result": [[8.665140625], 0, 49.19337821006775, 1638513294.9917963], "version": 0.2, "tvm_version": "0.9.dev0"}
{"input": ["rocm -keys=rocm,gpu -max_num_threads=256 -mcpu=gfx906 -mtriple=amdgcn-amd-amdhsa-hcc -thread_warp_size=64", "conv2d_nchw.cuda", [["TENSOR", [128, 128, 28, 28], "float32"], ["TENSOR", [128, 128, 3, 3], "float32"], 1, 1, 1, "float32"], {}], "config": {"index": 17541435, "code_hash": null, "entity": [["tile_f", "sp", [-1, 1, 4, 4]], ["tile_y", "sp", [-1, 1, 1, 2]], ["tile_x", "sp", [-1, 4, 7, 1]], ["tile_rc", "sp", [-1, 8]], ["tile_ry", "sp", [-1, 3]], ["tile_rx", "sp", [-1, 3]], ["auto_unroll_max_step", "ot", 1500], ["unroll_explicit", "ot", 1]]}, "result": [[0.033064331], 0, 2.7643680572509766, 1638513296.4724216], "version": 0.2, "tvm_version": "0.9.dev0"}
{"input": ["rocm -keys=rocm,gpu -max_num_threads=256 -mcpu=gfx906 -mtriple=amdgcn-amd-amdhsa-hcc -thread_warp_size=64", "conv2d_nchw.cuda", [["TENSOR", [128, 128, 28, 28], "float32"], ["TENSOR", [128, 128, 3, 3], "float32"], 1, 1, 1, "float32"], {}], "config": {"index": 17070013, "code_hash": null, "entity": [["tile_f", "sp", [-1, 32, 2, 1]], ["tile_y", "sp", [-1, 1, 4, 1]], ["tile_x", "sp", [-1, 1, 1, 14]], ["tile_rc", "sp", [-1, 1]], ["tile_ry", "sp", [-1, 3]], ["tile_rx", "sp", [-1, 3]], ["auto_unroll_max_step", "ot", 1500], ["unroll_explicit", "ot", 1]]}, "result": [[1.017565979], 0, 14.536523580551147, 1638513302.7873926], "version": 0.2, "tvm_version": "0.9.dev0"}
{"input": ["rocm -keys=rocm,gpu -max_num_threads=256 -mcpu=gfx906 -mtriple=amdgcn-amd-amdhsa-hcc -thread_warp_size=64", "conv2d_nchw.cuda", [["TENSOR", [128, 128, 28, 28], "float32"], ["TENSOR", [128, 128, 3, 3], "float32"], 1, 1, 1, "float32"], {}], "config": {"index": 11199517, "code_hash": null, "entity": [["tile_f", "sp", [-1, 2, 1, 2]], ["tile_y", "sp", [-1, 14, 2, 1]], ["tile_x", "sp", [-1, 2, 7, 1]], ["tile_rc", "sp", [-1, 4]], ["tile_ry", "sp", [-1, 3]], ["tile_rx", "sp", [-1, 3]], ["auto_unroll_max_step", "ot", 512], ["unroll_explicit", "ot", 1]]}, "result": [[1.69533923325], 0, 14.090940952301025, 1638513312.7106817], "version": 0.2, "tvm_version": "0.9.dev0"}
{"input": ["rocm -keys=rocm,gpu -max_num_threads=256 -mcpu=gfx906 -mtriple=amdgcn-amd-amdhsa-hcc -thread_warp_size=64", "conv2d_nchw.cuda", [["TENSOR", [128, 128, 28, 28], "float32"], ["TENSOR", [128, 128, 3, 3], "float32"], 1, 1, 1, "float32"], {}], "config": {"index": 10783758, "code_hash": null, "entity": [["tile_f", "sp", [-1, 8, 4, 4]], ["tile_y", "sp", [-1, 1, 7, 2]], ["tile_x", "sp", [-1, 1, 2, 1]], ["tile_rc", "sp", [-1, 1]], ["tile_ry", "sp", [-1, 3]], ["tile_rx", "sp", [-1, 3]], ["auto_unroll_max_step", "ot", 512], ["unroll_explicit", "ot", 1]]}, "result": [[1.51967333975], 0, 11.607336521148682, 1638513321.973109], "version": 0.2, "tvm_version": "0.9.dev0"}
{"input": ["rocm -keys=rocm,gpu -max_num_threads=256 -mcpu=gfx906 -mtriple=amdgcn-amd-amdhsa-hcc -thread_warp_size=64", "conv2d_nchw.cuda", [["TENSOR", [128, 128, 28, 28], "float32"], ["TENSOR", [128, 128, 3, 3], "float32"], 1, 1, 1, "float32"], {}], "config": {"index": 7120136, "code_hash": null, "entity": [["tile_f", "sp", [-1, 4, 8, 2]], ["tile_y", "sp", [-1, 4, 7, 1]], ["tile_x", "sp", [-1, 7, 1, 1]], ["tile_rc", "sp", [-1, 32]], ["tile_ry", "sp", [-1, 1]], ["tile_rx", "sp", [-1, 1]], ["auto_unroll_max_step", "ot", 512], ["unroll_explicit", "ot", 1]]}, "result": [[2.995750244], 0, 18.383728504180908, 1638513357.4966714], "version": 0.2, "tvm_version": "0.9.dev0"}
{"input": ["rocm -keys=rocm,gpu -max_num_threads=256 -mcpu=gfx906 -mtriple=amdgcn-amd-amdhsa-hcc -thread_warp_size=64", "conv2d_nchw.cuda", [["TENSOR", [128, 128, 28, 28], "float32"], ["TENSOR", [128, 128, 3, 3], "float32"], 1, 1, 1, "float32"], {}], "config": {"index": 65644, "code_hash": null, "entity": [["tile_f", "sp", [-1, 16, 1, 1]], ["tile_y", "sp", [-1, 1, 1, 4]], ["tile_x", "sp", [-1, 2, 7, 1]], ["tile_rc", "sp", [-1, 1]], ["tile_ry", "sp", [-1, 1]], ["tile_rx", "sp", [-1, 1]], ["auto_unroll_max_step", "ot", 0], ["unroll_explicit", "ot", 1]]}, "result": [[0.8301750487499999], 0, 6.442041873931885, 1638513362.9082947], "version": 0.2, "tvm_version": "0.9.dev0"}
{"input": ["rocm -keys=rocm,gpu -max_num_threads=256 -mcpu=gfx906 -mtriple=amdgcn-amd-amdhsa-hcc -thread_warp_size=64", "conv2d_nchw.cuda", [["TENSOR", [128, 128, 28, 28], "float32"], ["TENSOR", [128, 128, 3, 3], "float32"], 1, 1, 1, "float32"], {}], "config": {"index": 11217559, "code_hash": null, "entity": [["tile_f", "sp", [-1, 1, 8, 4]], ["tile_y", "sp", [-1, 1, 1, 28]], ["tile_x", "sp", [-1, 2, 14, 1]], ["tile_rc", "sp", [-1, 4]], ["tile_ry", "sp", [-1, 3]], ["tile_rx", "sp", [-1, 3]], ["auto_unroll_max_step", "ot", 512], ["unroll_explicit", "ot", 1]]}, "result": [[2.5689641112499997], 0, 16.790090560913086, 1638513377.1454856], "version": 0.2, "tvm_version": "0.9.dev0"}
{"input": ["rocm -keys=rocm,gpu -max_num_threads=256 -mcpu=gfx906 -mtriple=amdgcn-amd-amdhsa-hcc -thread_warp_size=64", "conv2d_nchw.cuda", [["TENSOR", [128, 128, 28, 28], "float32"], ["TENSOR", [128, 128, 3, 3], "float32"], 1, 1, 1, "float32"], {}], "config": {"index": 1938190, "code_hash": null, "entity": [["tile_f", "sp", [-1, 1, 2, 4]], ["tile_y", "sp", [-1, 2, 1, 7]], ["tile_x", "sp", [-1, 7, 1, 1]], ["tile_rc", "sp", [-1, 4]], ["tile_ry", "sp", [-1, 3]], ["tile_rx", "sp", [-1, 1]], ["auto_unroll_max_step", "ot", 0], ["unroll_explicit", "ot", 1]]}, "result": [[2.9246416015], 0, 16.470120668411255, 1638513393.0839932], "version": 0.2, "tvm_version": "0.9.dev0"}
{"input": ["rocm -keys=rocm,gpu -max_num_threads=256 -mcpu=gfx906 -mtriple=amdgcn-amd-amdhsa-hcc -thread_warp_size=64", "conv2d_nchw.cuda", [["TENSOR", [128, 128, 28, 28], "float32"], ["TENSOR", [128, 128, 3, 3], "float32"], 1, 1, 1, "float32"], {}], "config": {"index": 2647442, "code_hash": null, "entity": [["tile_f", "sp", [-1, 4, 1, 1]], ["tile_y", "sp", [-1, 1, 2, 2]], ["tile_x", "sp", [-1, 2, 1, 7]], ["tile_rc", "sp", [-1, 32]], ["tile_ry", "sp", [-1, 3]], ["tile_rx", "sp", [-1, 1]], ["auto_unroll_max_step", "ot", 0], ["unroll_explicit", "ot", 1]]}, "result": [[5.03894433575], 0, 27.393107652664185, 1638513419.7712305], "version": 0.2, "tvm_version": "0.9.dev0"}
{"input": ["rocm -keys=rocm,gpu -max_num_threads=256 -mcpu=gfx906 -mtriple=amdgcn-amd-amdhsa-hcc -thread_warp_size=64", "conv2d_nchw.cuda", [["TENSOR", [128, 128, 28, 28], "float32"], ["TENSOR", [128, 128, 3, 3], "float32"], 1, 1, 1, "float32"], {}], "config": {"index": 3619946, "code_hash": null, "entity": [["tile_f", "sp", [-1, 1, 16, 1]], ["tile_y", "sp", [-1, 1, 2, 1]], ["tile_x", "sp", [-1, 2, 2, 7]], ["tile_rc", "sp", [-1, 4]], ["tile_ry", "sp", [-1, 1]], ["tile_rx", "sp", [-1, 3]], ["auto_unroll_max_step", "ot", 0], ["unroll_explicit", "ot", 1]]}, "result": [[0.0052400238], 0, 1.8356635570526123, 1638513421.2789245], "version": 0.2, "tvm_version": "0.9.dev0"}
{"input": ["rocm -keys=rocm,gpu -max_num_threads=256 -mcpu=gfx906 -mtriple=amdgcn-amd-amdhsa-hcc -thread_warp_size=64", "conv2d_nchw.cuda", [["TENSOR", [128, 128, 28, 28], "float32"], ["TENSOR", [128, 128, 3, 3], "float32"], 1, 1, 1, "float32"], {}], "config": {"index": 15368639, "code_hash": null, "entity": [["tile_f", "sp", [-1, 1, 1, 128]], ["tile_y", "sp", [-1, 2, 1, 7]], ["tile_x", "sp", [-1, 2, 1, 1]], ["tile_rc", "sp", [-1, 1]], ["tile_ry", "sp", [-1, 1]], ["tile_rx", "sp", [-1, 3]], ["auto_unroll_max_step", "ot", 1500], ["unroll_explicit", "ot", 1]]}, "result": [[6.5006035155], 0, 34.75881624221802, 1638513454.9393253], "version": 0.2, "tvm_version": "0.9.dev0"}
{"input": ["rocm -keys=rocm,gpu -max_num_threads=256 -mcpu=gfx906 -mtriple=amdgcn-amd-amdhsa-hcc -thread_warp_size=64", "conv2d_nchw.cuda", [["TENSOR", [128, 128, 28, 28], "float32"], ["TENSOR", [128, 128, 3, 3], "float32"], 1, 1, 1, "float32"], {}], "config": {"index": 7315212, "code_hash": null, "entity": [["tile_f", "sp", [-1, 16, 2, 1]], ["tile_y", "sp", [-1, 1, 1, 1]], ["tile_x", "sp", [-1, 14, 1, 1]], ["tile_rc", "sp", [-1, 64]], ["tile_ry", "sp", [-1, 1]], ["tile_rx", "sp", [-1, 1]], ["auto_unroll_max_step", "ot", 512], ["unroll_explicit", "ot", 1]]}, "result": [[32.18927929675], 0, 166.9240598678589, 1638513617.2890728], "version": 0.2, "tvm_version": "0.9.dev0"}
{"input": ["rocm -keys=rocm,gpu -max_num_threads=256 -mcpu=gfx906 -mtriple=amdgcn-amd-amdhsa-hcc -thread_warp_size=64", "conv2d_nchw.cuda", [["TENSOR", [128, 128, 28, 28], "float32"], ["TENSOR", [128, 128, 3, 3], "float32"], 1, 1, 1, "float32"], {}], "config": {"index": 5182902, "code_hash": null, "entity": [["tile_f", "sp", [-1, 4, 1, 16]], ["tile_y", "sp", [-1, 1, 1, 7]], ["tile_x", "sp", [-1, 1, 1, 28]], ["tile_rc", "sp", [-1, 4]], ["tile_ry", "sp", [-1, 3]], ["tile_rx", "sp", [-1, 3]], ["auto_unroll_max_step", "ot", 0], ["unroll_explicit", "ot", 1]]}, "result": [[22.76024609375], 0, 116.23486995697021, 1638513732.2125964], "version": 0.2, "tvm_version": "0.9.dev0"}
{"input": ["rocm -keys=rocm,gpu -max_num_threads=256 -mcpu=gfx906 -mtriple=amdgcn-amd-amdhsa-hcc -thread_warp_size=64", "conv2d_nchw.cuda", [["TENSOR", [128, 128, 28, 28], "float32"], ["TENSOR", [128, 128, 3, 3], "float32"], 1, 1, 1, "float32"], {}], "config": {"index": 2075807, "code_hash": null, "entity": [["tile_f", "sp", [-1, 16, 2, 2]], ["tile_y", "sp", [-1, 1, 1, 2]], ["tile_x", "sp", [-1, 4, 1, 7]], ["tile_rc", "sp", [-1, 4]], ["tile_ry", "sp", [-1, 3]], ["tile_rx", "sp", [-1, 1]], ["auto_unroll_max_step", "ot", 0], ["unroll_explicit", "ot", 1]]}, "result": [[4.34307421875], 0, 24.840996503829956, 1638513765.303813], "version": 0.2, "tvm_version": "0.9.dev0"}
{"input": ["rocm -keys=rocm,gpu -max_num_threads=256 -mcpu=gfx906 -mtriple=amdgcn-amd-amdhsa-hcc -thread_warp_size=64", "conv2d_nchw.cuda", [["TENSOR", [128, 128, 28, 28], "float32"], ["TENSOR", [128, 128, 3, 3], "float32"], 1, 1, 1, "float32"], {}], "config": {"index": 14950974, "code_hash": null, "entity": [["tile_f", "sp", [-1, 1, 8, 2]], ["tile_y", "sp", [-1, 2, 1, 7]], ["tile_x", "sp", [-1, 2, 2, 7]], ["tile_rc", "sp", [-1, 32]], ["tile_ry", "sp", [-1, 3]], ["tile_rx", "sp", [-1, 1]], ["auto_unroll_max_step", "ot", 1500], ["unroll_explicit", "ot", 1]]}, "result": [[6.58632177725], 0, 42.004284381866455, 1638513799.520468], "version": 0.2, "tvm_version": "0.9.dev0"}
{"input": ["rocm -keys=rocm,gpu -max_num_threads=256 -mcpu=gfx906 -mtriple=amdgcn-amd-amdhsa-hcc -thread_warp_size=64", "conv2d_nchw.cuda", [["TENSOR", [128, 128, 28, 28], "float32"], ["TENSOR", [128, 128, 3, 3], "float32"], 1, 1, 1, "float32"], {}], "config": {"index": 2457858, "code_hash": null, "entity": [["tile_f", "sp", [-1, 8, 4, 1]], ["tile_y", "sp", [-1, 4, 1, 1]], ["tile_x", "sp", [-1, 4, 1, 7]], ["tile_rc", "sp", [-1, 16]], ["tile_ry", "sp", [-1, 3]], ["tile_rx", "sp", [-1, 1]], ["auto_unroll_max_step", "ot", 0], ["unroll_explicit", "ot", 1]]}, "result": [[4.16222265625], 0, 23.99858784675598, 1638513821.6113741], "version": 0.2, "tvm_version": "0.9.dev0"}
{"input": ["rocm -keys=rocm,gpu -max_num_threads=256 -mcpu=gfx906 -mtriple=amdgcn-amd-amdhsa-hcc -thread_warp_size=64", "conv2d_nchw.cuda", [["TENSOR", [128, 128, 28, 28], "float32"], ["TENSOR", [128, 128, 3, 3], "float32"], 1, 1, 1, "float32"], {}], "config": {"index": 4618079, "code_hash": null, "entity": [["tile_f", "sp", [-1, 1, 1, 128]], ["tile_y", "sp", [-1, 7, 1, 1]], ["tile_x", "sp", [-1, 4, 1, 1]], ["tile_rc", "sp", [-1, 1]], ["tile_ry", "sp", [-1, 3]], ["tile_rx", "sp", [-1, 3]], ["auto_unroll_max_step", "ot", 0], ["unroll_explicit", "ot", 1]]}, "result": [[8.70455371075], 0, 45.521753787994385, 1638513866.4467435], "version": 0.2, "tvm_version": "0.9.dev0"}
{"input": ["rocm -keys=rocm,gpu -max_num_threads=256 -mcpu=gfx906 -mtriple=amdgcn-amd-amdhsa-hcc -thread_warp_size=64", "conv2d_nchw.cuda", [["TENSOR", [128, 128, 28, 28], "float32"], ["TENSOR", [128, 128, 3, 3], "float32"], 1, 1, 1, "float32"], {}], "config": {"index": 9444389, "code_hash": null, "entity": [["tile_f", "sp", [-1, 8, 16, 1]], ["tile_y", "sp", [-1, 7, 2, 2]], ["tile_x", "sp", [-1, 2, 2, 1]], ["tile_rc", "sp", [-1, 2]], ["tile_ry", "sp", [-1, 1]], ["tile_rx", "sp", [-1, 3]], ["auto_unroll_max_step", "ot", 512], ["unroll_explicit", "ot", 1]]}, "result": [[0.43761282325], 0, 6.179471015930176, 1638513870.1582053], "version": 0.2, "tvm_version": "0.9.dev0"}
{"input": ["rocm -keys=rocm,gpu -max_num_threads=256 -mcpu=gfx906 -mtriple=amdgcn-amd-amdhsa-hcc -thread_warp_size=64", "conv2d_nchw.cuda", [["TENSOR", [128, 128, 28, 28], "float32"], ["TENSOR", [128, 128, 3, 3], "float32"], 1, 1, 1, "float32"], {}], "config": {"index": 12918289, "code_hash": null, "entity": [["tile_f", "sp", [-1, 1, 4, 2]], ["tile_y", "sp", [-1, 1, 7, 1]], ["tile_x", "sp", [-1, 7, 4, 1]], ["tile_rc", "sp", [-1, 8]], ["tile_ry", "sp", [-1, 1]], ["tile_rx", "sp", [-1, 1]], ["auto_unroll_max_step", "ot", 1500], ["unroll_explicit", "ot", 1]]}, "result": [[0.15970544425], 0, 6.115060567855835, 1638513872.563914], "version": 0.2, "tvm_version": "0.9.dev0"}
{"input": ["rocm -keys=rocm,gpu -max_num_threads=256 -mcpu=gfx906 -mtriple=amdgcn-amd-amdhsa-hcc -thread_warp_size=64", "conv2d_nchw.cuda", [["TENSOR", [128, 128, 28, 28], "float32"], ["TENSOR", [128, 128, 3, 3], "float32"], 1, 1, 1, "float32"], {}], "config": {"index": 1609457, "code_hash": null, "entity": [["tile_f", "sp", [-1, 4, 4, 1]], ["tile_y", "sp", [-1, 1, 7, 1]], ["tile_x", "sp", [-1, 1, 14, 1]], ["tile_rc", "sp", [-1, 1]], ["tile_ry", "sp", [-1, 3]], ["tile_rx", "sp", [-1, 1]], ["auto_unroll_max_step", "ot", 0], ["unroll_explicit", "ot", 1]]}, "result": [[0.013794528], 0, 1.9584364891052246, 1638513874.2055404], "version": 0.2, "tvm_version": "0.9.dev0"}
{"input": ["rocm -keys=rocm,gpu -max_num_threads=256 -mcpu=gfx906 -mtriple=amdgcn-amd-amdhsa-hcc -thread_warp_size=64", "conv2d_nchw.cuda", [["TENSOR", [128, 128, 28, 28], "float32"], ["TENSOR", [128, 128, 3, 3], "float32"], 1, 1, 1, "float32"], {}], "config": {"index": 3357230, "code_hash": null, "entity": [["tile_f", "sp", [-1, 1, 1, 32]], ["tile_y", "sp", [-1, 2, 14, 1]], ["tile_x", "sp", [-1, 2, 1, 2]], ["tile_rc", "sp", [-1, 2]], ["tile_ry", "sp", [-1, 1]], ["tile_rx", "sp", [-1, 3]], ["auto_unroll_max_step", "ot", 0], ["unroll_explicit", "ot", 1]]}, "result": [[0.43092089825], 0, 4.544975519180298, 1638513877.9655943], "version": 0.2, "tvm_version": "0.9.dev0"}
{"input": ["rocm -keys=rocm,gpu -max_num_threads=256 -mcpu=gfx906 -mtriple=amdgcn-amd-amdhsa-hcc -thread_warp_size=64", "conv2d_nchw.cuda", [["TENSOR", [128, 128, 28, 28], "float32"], ["TENSOR", [128, 128, 3, 3], "float32"], 1, 1, 1, "float32"], {}], "config": {"index": 6734855, "code_hash": null, "entity": [["tile_f", "sp", [-1, 2, 4, 8]], ["tile_y", "sp", [-1, 7, 1, 1]], ["tile_x", "sp", [-1, 7, 1, 1]], ["tile_rc", "sp", [-1, 8]], ["tile_ry", "sp", [-1, 1]], ["tile_rx", "sp", [-1, 1]], ["auto_unroll_max_step", "ot", 512], ["unroll_explicit", "ot", 1]]}, "result": [[1.996102661], 0, 14.971778631210327, 1638513890.6768863], "version": 0.2, "tvm_version": "0.9.dev0"}
{"input": ["rocm -keys=rocm,gpu -max_num_threads=256 -mcpu=gfx906 -mtriple=amdgcn-amd-amdhsa-hcc -thread_warp_size=64", "conv2d_nchw.cuda", [["TENSOR", [128, 128, 28, 28], "float32"], ["TENSOR", [128, 128, 3, 3], "float32"], 1, 1, 1, "float32"], {}], "config": {"index": 6178159, "code_hash": null, "entity": [["tile_f", "sp", [-1, 1, 8, 4]], ["tile_y", "sp", [-1, 14, 1, 1]], ["tile_x", "sp", [-1, 2, 2, 1]], ["tile_rc", "sp", [-1, 1]], ["tile_ry", "sp", [-1, 1]], ["tile_rx", "sp", [-1, 1]], ["auto_unroll_max_step", "ot", 512], ["unroll_explicit", "ot", 1]]}, "result": [[0.43196154775], 0, 4.314842462539673, 1638513894.0645213], "version": 0.2, "tvm_version": "0.9.dev0"}
{"input": ["rocm -keys=rocm,gpu -max_num_threads=256 -mcpu=gfx906 -mtriple=amdgcn-amd-amdhsa-hcc -thread_warp_size=64", "conv2d_nchw.cuda", [["TENSOR", [128, 128, 28, 28], "float32"], ["TENSOR", [128, 128, 3, 3], "float32"], 1, 1, 1, "float32"], {}], "config": {"index": 1568838, "code_hash": null, "entity": [["tile_f", "sp", [-1, 8, 4, 4]], ["tile_y", "sp", [-1, 1, 2, 7]], ["tile_x", "sp", [-1, 1, 2, 1]], ["tile_rc", "sp", [-1, 1]], ["tile_ry", "sp", [-1, 3]], ["tile_rx", "sp", [-1, 1]], ["auto_unroll_max_step", "ot", 0], ["unroll_explicit", "ot", 1]]}, "result": [[0.34957702625000003], 0, 4.68976616859436, 1638513897.0490346], "version": 0.2, "tvm_version": "0.9.dev0"}
{"input": ["rocm -keys=rocm,gpu -max_num_threads=256 -mcpu=gfx906 -mtriple=amdgcn-amd-amdhsa-hcc -thread_warp_size=64", "conv2d_nchw.cuda", [["TENSOR", [128, 128, 28, 28], "float32"], ["TENSOR", [128, 128, 3, 3], "float32"], 1, 1, 1, "float32"], {}], "config": {"index": 3842646, "code_hash": null, "entity": [["tile_f", "sp", [-1, 64, 1, 1]], ["tile_y", "sp", [-1, 1, 2, 2]], ["tile_x", "sp", [-1, 1, 1, 1]], ["tile_rc", "sp", [-1, 16]], ["tile_ry", "sp", [-1, 1]], ["tile_rx", "sp", [-1, 3]], ["auto_unroll_max_step", "ot", 0], ["unroll_explicit", "ot", 1]]}, "result": [[6.425508789], 0, 34.692548513412476, 1638513930.4974353], "version": 0.2, "tvm_version": "0.9.dev0"}
{"input": ["rocm -keys=rocm,gpu -max_num_threads=256 -mcpu=gfx906 -mtriple=amdgcn-amd-amdhsa-hcc -thread_warp_size=64", "conv2d_nchw.cuda", [["TENSOR", [128, 128, 28, 28], "float32"], ["TENSOR", [128, 128, 3, 3], "float32"], 1, 1, 1, "float32"], {}], "config": {"index": 7846523, "code_hash": null, "entity": [["tile_f", "sp", [-1, 2, 16, 4]], ["tile_y", "sp", [-1, 1, 1, 4]], ["tile_x", "sp", [-1, 2, 2, 7]], ["tile_rc", "sp", [-1, 1]], ["tile_ry", "sp", [-1, 3]], ["tile_rx", "sp", [-1, 1]], ["auto_unroll_max_step", "ot", 512], ["unroll_explicit", "ot", 1]]}, "result": [[1.31103271475], 0, 11.553115129470825, 1638513938.372041], "version": 0.2, "tvm_version": "0.9.dev0"}
{"input": ["rocm -keys=rocm,gpu -max_num_threads=256 -mcpu=gfx906 -mtriple=amdgcn-amd-amdhsa-hcc -thread_warp_size=64", "conv2d_nchw.cuda", [["TENSOR", [128, 128, 28, 28], "float32"], ["TENSOR", [128, 128, 3, 3], "float32"], 1, 1, 1, "float32"], {}], "config": {"index": 6560768, "code_hash": null, "entity": [["tile_f", "sp", [-1, 1, 2, 1]], ["tile_y", "sp", [-1, 1, 2, 7]], ["tile_x", "sp", [-1, 1, 2, 1]], ["tile_rc", "sp", [-1, 4]], ["tile_ry", "sp", [-1, 1]], ["tile_rx", "sp", [-1, 1]], ["auto_unroll_max_step", "ot", 512], ["unroll_explicit", "ot", 1]]}, "result": [[0.8017654417500001], 0, 5.9829535484313965, 1638513943.588915], "version": 0.2, "tvm_version": "0.9.dev0"}
{"input": ["rocm -keys=rocm,gpu -max_num_threads=256 -mcpu=gfx906 -mtriple=amdgcn-amd-amdhsa-hcc -thread_warp_size=64", "conv2d_nchw.cuda", [["TENSOR", [128, 128, 28, 28], "float32"], ["TENSOR", [128, 128, 3, 3], "float32"], 1, 1, 1, "float32"], {}], "config": {"index": 2560833, "code_hash": null, "entity": [["tile_f", "sp", [-1, 1, 64, 1]], ["tile_y", "sp", [-1, 7, 1, 2]], ["tile_x", "sp", [-1, 2, 7, 1]], ["tile_rc", "sp", [-1, 32]], ["tile_ry", "sp", [-1, 3]], ["tile_rx", "sp", [-1, 1]], ["auto_unroll_max_step", "ot", 0], ["unroll_explicit", "ot", 1]]}, "result": [[0.0105742958], 0, 1.7843616008758545, 1638513944.969911], "version": 0.2, "tvm_version": "0.9.dev0"}
{"input": ["rocm -keys=rocm,gpu -max_num_threads=256 -mcpu=gfx906 -mtriple=amdgcn-amd-amdhsa-hcc -thread_warp_size=64", "conv2d_nchw.cuda", [["TENSOR", [128, 128, 28, 28], "float32"], ["TENSOR", [128, 128, 3, 3], "float32"], 1, 1, 1, "float32"], {}], "config": {"index": 17564379, "code_hash": null, "entity": [["tile_f", "sp", [-1, 1, 16, 8]], ["tile_y", "sp", [-1, 14, 2, 1]], ["tile_x", "sp", [-1, 2, 1, 2]], ["tile_rc", "sp", [-1, 8]], ["tile_ry", "sp", [-1, 3]], ["tile_rx", "sp", [-1, 3]], ["auto_unroll_max_step", "ot", 1500], ["unroll_explicit", "ot", 1]]}, "result": [[0.9260016477499999], 0, 11.447362422943115, 1638513950.826878], "version": 0.2, "tvm_version": "0.9.dev0"}
{"input": ["rocm -keys=rocm,gpu -max_num_threads=256 -mcpu=gfx906 -mtriple=amdgcn-amd-amdhsa-hcc -thread_warp_size=64", "conv2d_nchw.cuda", [["TENSOR", [128, 128, 28, 28], "float32"], ["TENSOR", [128, 128, 3, 3], "float32"], 1, 1, 1, "float32"], {}], "config": {"index": 11466601, "code_hash": null, "entity": [["tile_f", "sp", [-1, 2, 1, 1]], ["tile_y", "sp", [-1, 1, 4, 7]], ["tile_x", "sp", [-1, 7, 1, 4]], ["tile_rc", "sp", [-1, 8]], ["tile_ry", "sp", [-1, 3]], ["tile_rx", "sp", [-1, 3]], ["auto_unroll_max_step", "ot", 512], ["unroll_explicit", "ot", 1]]}, "result": [[8.63070800775], 0, 47.623053550720215, 1638513995.249108], "version": 0.2, "tvm_version": "0.9.dev0"}
{"input": ["rocm -keys=rocm,gpu -max_num_threads=256 -mcpu=gfx906 -mtriple=amdgcn-amd-amdhsa-hcc -thread_warp_size=64", "conv2d_nchw.cuda", [["TENSOR", [128, 128, 28, 28], "float32"], ["TENSOR", [128, 128, 3, 3], "float32"], 1, 1, 1, "float32"], {}], "config": {"index": 12572132, "code_hash": null, "entity": [["tile_f", "sp", [-1, 4, 2, 8]], ["tile_y", "sp", [-1, 2, 2, 1]], ["tile_x", "sp", [-1, 2, 1, 2]], ["tile_rc", "sp", [-1, 2]], ["tile_ry", "sp", [-1, 1]], ["tile_rx", "sp", [-1, 1]], ["auto_unroll_max_step", "ot", 1500], ["unroll_explicit", "ot", 1]]}, "result": [[1.92928210425], 0, 12.865122556686401, 1638514006.2439396], "version": 0.2, "tvm_version": "0.9.dev0"}
{"input": ["rocm -keys=rocm,gpu -max_num_threads=256 -mcpu=gfx906 -mtriple=amdgcn-amd-amdhsa-hcc -thread_warp_size=64", "conv2d_nchw.cuda", [["TENSOR", [128, 128, 28, 28], "float32"], ["TENSOR", [128, 128, 3, 3], "float32"], 1, 1, 1, "float32"], {}], "config": {"index": 14823252, "code_hash": null, "entity": [["tile_f", "sp", [-1, 16, 2, 1]], ["tile_y", "sp", [-1, 2, 2, 1]], ["tile_x", "sp", [-1, 7, 2, 1]], ["tile_rc", "sp", [-1, 32]], ["tile_ry", "sp", [-1, 3]], ["tile_rx", "sp", [-1, 1]], ["auto_unroll_max_step", "ot", 1500], ["unroll_explicit", "ot", 1]]}, "result": [[7.50558398425], 0, 45.5658757686615, 1638514045.0198376], "version": 0.2, "tvm_version": "0.9.dev0"}
{"input": ["rocm -keys=rocm,gpu -max_num_threads=256 -mcpu=gfx906 -mtriple=amdgcn-amd-amdhsa-hcc -thread_warp_size=64", "conv2d_nchw.cuda", [["TENSOR", [128, 128, 28, 28], "float32"], ["TENSOR", [128, 128, 3, 3], "float32"], 1, 1, 1, "float32"], {}], "config": {"index": 17044817, "code_hash": null, "entity": [["tile_f", "sp", [-1, 4, 4, 1]], ["tile_y", "sp", [-1, 1, 1, 1]], ["tile_x", "sp", [-1, 2, 1, 7]], ["tile_rc", "sp", [-1, 1]], ["tile_ry", "sp", [-1, 3]], ["tile_rx", "sp", [-1, 3]], ["auto_unroll_max_step", "ot", 1500], ["unroll_explicit", "ot", 1]]}, "result": [[4.536596679500001], 0, 27.45731472969055, 1638514069.0122612], "version": 0.2, "tvm_version": "0.9.dev0"}
{"input": ["rocm -keys=rocm,gpu -max_num_threads=256 -mcpu=gfx906 -mtriple=amdgcn-amd-amdhsa-hcc -thread_warp_size=64", "conv2d_nchw.cuda", [["TENSOR", [128, 128, 28, 28], "float32"], ["TENSOR", [128, 128, 3, 3], "float32"], 1, 1, 1, "float32"], {}], "config": {"index": 8639402, "code_hash": null, "entity": [["tile_f", "sp", [-1, 4, 1, 1]], ["tile_y", "sp", [-1, 1, 4, 7]], ["tile_x", "sp", [-1, 1, 1, 28]], ["tile_rc", "sp", [-1, 16]], ["tile_ry", "sp", [-1, 3]], ["tile_rx", "sp", [-1, 1]], ["auto_unroll_max_step", "ot", 512], ["unroll_explicit", "ot", 1]]}, "result": [[14.85631835925], 0, 77.33906888961792, 1638514144.7554207], "version": 0.2, "tvm_version": "0.9.dev0"}
{"input": ["rocm -keys=rocm,gpu -max_num_threads=256 -mcpu=gfx906 -mtriple=amdgcn-amd-amdhsa-hcc -thread_warp_size=64", "conv2d_nchw.cuda", [["TENSOR", [128, 128, 28, 28], "float32"], ["TENSOR", [128, 128, 3, 3], "float32"], 1, 1, 1, "float32"], {}], "config": {"index": 3506764, "code_hash": null, "entity": [["tile_f", "sp", [-1, 16, 1, 1]], ["tile_y", "sp", [-1, 7, 2, 2]], ["tile_x", "sp", [-1, 1, 4, 1]], ["tile_rc", "sp", [-1, 4]], ["tile_ry", "sp", [-1, 1]], ["tile_rx", "sp", [-1, 3]], ["auto_unroll_max_step", "ot", 0], ["unroll_explicit", "ot", 1]]}, "result": [[0.7228759155], 0, 6.6128153800964355, 1638514149.6083632], "version": 0.2, "tvm_version": "0.9.dev0"}
{"input": ["rocm -keys=rocm,gpu -max_num_threads=256 -mcpu=gfx906 -mtriple=amdgcn-amd-amdhsa-hcc -thread_warp_size=64", "conv2d_nchw.cuda", [["TENSOR", [128, 128, 28, 28], "float32"], ["TENSOR", [128, 128, 3, 3], "float32"], 1, 1, 1, "float32"], {}], "config": {"index": 6864024, "code_hash": null, "entity": [["tile_f", "sp", [-1, 8, 8, 1]], ["tile_y", "sp", [-1, 1, 1, 1]], ["tile_x", "sp", [-1, 1, 1, 7]], ["tile_rc", "sp", [-1, 8]], ["tile_ry", "sp", [-1, 1]], ["tile_rx", "sp", [-1, 1]], ["auto_unroll_max_step", "ot", 512], ["unroll_explicit", "ot", 1]]}, "result": [[1.07390588375], 0, 8.356992959976196, 1638514156.3373303], "version": 0.2, "tvm_version": "0.9.dev0"}
{"input": ["rocm -keys=rocm,gpu -max_num_threads=256 -mcpu=gfx906 -mtriple=amdgcn-amd-amdhsa-hcc -thread_warp_size=64", "conv2d_nchw.cuda", [["TENSOR", [128, 128, 28, 28], "float32"], ["TENSOR", [128, 128, 3, 3], "float32"], 1, 1, 1, "float32"], {}], "config": {"index": 11362803, "code_hash": null, "entity": [["tile_f", "sp", [-1, 8, 1, 1]], ["tile_y", "sp", [-1, 1, 4, 1]], ["tile_x", "sp", [-1, 2, 2, 1]], ["tile_rc", "sp", [-1, 8]], ["tile_ry", "sp", [-1, 3]], ["tile_rx", "sp", [-1, 3]], ["auto_unroll_max_step", "ot", 512], ["unroll_explicit", "ot", 1]]}, "result": [[0.0292614535], 0, 2.2198643684387207, 1638514157.7303874], "version": 0.2, "tvm_version": "0.9.dev0"}
{"input": ["rocm -keys=rocm,gpu -max_num_threads=256 -mcpu=gfx906 -mtriple=amdgcn-amd-amdhsa-hcc -thread_warp_size=64", "conv2d_nchw.cuda", [["TENSOR", [128, 128, 28, 28], "float32"], ["TENSOR", [128, 128, 3, 3], "float32"], 1, 1, 1, "float32"], {}], "config": {"index": 13298601, "code_hash": null, "entity": [["tile_f", "sp", [-1, 4, 8, 4]], ["tile_y", "sp", [-1, 14, 1, 2]], ["tile_x", "sp", [-1, 1, 4, 1]], ["tile_rc", "sp", [-1, 32]], ["tile_ry", "sp", [-1, 1]], ["tile_rx", "sp", [-1, 1]], ["auto_unroll_max_step", "ot", 1500], ["unroll_explicit", "ot", 1]]}, "result": [[4.1826328125], 0, 28.84096670150757, 1638514380.2753627], "version": 0.2, "tvm_version": "0.9.dev0"}
{"input": ["rocm -keys=rocm,gpu -max_num_threads=256 -mcpu=gfx906 -mtriple=amdgcn-amd-amdhsa-hcc -thread_warp_size=64", "conv2d_nchw.cuda", [["TENSOR", [128, 128, 28, 28], "float32"], ["TENSOR", [128, 128, 3, 3], "float32"], 1, 1, 1, "float32"], {}], "config": {"index": 17475658, "code_hash": null, "entity": [["tile_f", "sp", [-1, 1, 16, 2]], ["tile_y", "sp", [-1, 1, 1, 7]], ["tile_x", "sp", [-1, 1, 1, 1]], ["tile_rc", "sp", [-1, 8]], ["tile_ry", "sp", [-1, 3]], ["tile_rx", "sp", [-1, 3]], ["auto_unroll_max_step", "ot", 1500], ["unroll_explicit", "ot", 1]]}, "result": [[0.04387115075], 0, 3.2433769702911377, 1638514381.7978287], "version": 0.2, "tvm_version": "0.9.dev0"}
{"input": ["rocm -keys=rocm,gpu -max_num_threads=256 -mcpu=gfx906 -mtriple=amdgcn-amd-amdhsa-hcc -thread_warp_size=64", "conv2d_nchw.cuda", [["TENSOR", [128, 128, 28, 28], "float32"], ["TENSOR", [128, 128, 3, 3], "float32"], 1, 1, 1, "float32"], {}], "config": {"index": 9532140, "code_hash": null, "entity": [["tile_f", "sp", [-1, 4, 16, 2]], ["tile_y", "sp", [-1, 2, 2, 7]], ["tile_x", "sp", [-1, 2, 7, 2]], ["tile_rc", "sp", [-1, 2]], ["tile_ry", "sp", [-1, 1]], ["tile_rx", "sp", [-1, 3]], ["auto_unroll_max_step", "ot", 512], ["unroll_explicit", "ot", 1]]}, "result": [[0.981031555], 0, 10.025806903839111, 1638514388.0444057], "version": 0.2, "tvm_version": "0.9.dev0"}
{"input": ["rocm -keys=rocm,gpu -max_num_threads=256 -mcpu=gfx906 -mtriple=amdgcn-amd-amdhsa-hcc -thread_warp_size=64", "conv2d_nchw.cuda", [["TENSOR", [128, 128, 28, 28], "float32"], ["TENSOR", [128, 128, 3, 3], "float32"], 1, 1, 1, "float32"], {}], "config": {"index": 6565347, "code_hash": null, "entity": [["tile_f", "sp", [-1, 2, 16, 1]], ["tile_y", "sp", [-1, 2, 1, 7]], ["tile_x", "sp", [-1, 2, 2, 1]], ["tile_rc", "sp", [-1, 4]], ["tile_ry", "sp", [-1, 1]], ["tile_rx", "sp", [-1, 1]], ["auto_unroll_max_step", "ot", 512], ["unroll_explicit", "ot", 1]]}, "result": [[0.435897125], 0, 4.5766823291778564, 1638514391.5676277], "version": 0.2, "tvm_version": "0.9.dev0"}
{"input": ["rocm -keys=rocm,gpu -max_num_threads=256 -mcpu=gfx906 -mtriple=amdgcn-amd-amdhsa-hcc -thread_warp_size=64", "conv2d_nchw.cuda", [["TENSOR", [128, 128, 28, 28], "float32"], ["TENSOR", [128, 128, 3, 3], "float32"], 1, 1, 1, "float32"], {}], "config": {"index": 10022777, "code_hash": null, "entity": [["tile_f", "sp", [-1, 4, 4, 1]], ["tile_y", "sp", [-1, 7, 1, 1]], ["tile_x", "sp", [-1, 7, 2, 1]], ["tile_rc", "sp", [-1, 16]], ["tile_ry", "sp", [-1, 1]], ["tile_rx", "sp", [-1, 3]], ["auto_unroll_max_step", "ot", 512], ["unroll_explicit", "ot", 1]]}, "result": [[4.972114746], 0, 29.032198429107666, 1638514417.7059171], "version": 0.2, "tvm_version": "0.9.dev0"}
{"input": ["rocm -keys=rocm,gpu -max_num_threads=256 -mcpu=gfx906 -mtriple=amdgcn-amd-amdhsa-hcc -thread_warp_size=64", "conv2d_nchw.cuda", [["TENSOR", [128, 128, 28, 28], "float32"], ["TENSOR", [128, 128, 3, 3], "float32"], 1, 1, 1, "float32"], {}], "config": {"index": 6483764, "code_hash": null, "entity": [["tile_f", "sp", [-1, 2, 2, 2]], ["tile_y", "sp", [-1, 2, 1, 7]], ["tile_x", "sp", [-1, 1, 1, 7]], ["tile_rc", "sp", [-1, 2]], ["tile_ry", "sp", [-1, 1]], ["tile_rx", "sp", [-1, 1]], ["auto_unroll_max_step", "ot", 512], ["unroll_explicit", "ot", 1]]}, "result": [[16.313390625], 0, 86.35251665115356, 1638514500.5250294], "version": 0.2, "tvm_version": "0.9.dev0"}
{"input": ["rocm -keys=rocm,gpu -max_num_threads=256 -mcpu=gfx906 -mtriple=amdgcn-amd-amdhsa-hcc -thread_warp_size=64", "conv2d_nchw.cuda", [["TENSOR", [128, 128, 28, 28], "float32"], ["TENSOR", [128, 128, 3, 3], "float32"], 1, 1, 1, "float32"], {}], "config": {"index": 409268, "code_hash": null, "entity": [["tile_f", "sp", [-1, 16, 1, 4]], ["tile_y", "sp", [-1, 1, 4, 1]], ["tile_x", "sp", [-1, 28, 1, 1]], ["tile_rc", "sp", [-1, 4]], ["tile_ry", "sp", [-1, 1]], ["tile_rx", "sp", [-1, 1]], ["auto_unroll_max_step", "ot", 0], ["unroll_explicit", "ot", 1]]}, "result": [[1.9304505615], 0, 11.893455028533936, 1638514511.5275419], "version": 0.2, "tvm_version": "0.9.dev0"}
{"input": ["rocm -keys=rocm,gpu -max_num_threads=256 -mcpu=gfx906 -mtriple=amdgcn-amd-amdhsa-hcc -thread_warp_size=64", "conv2d_nchw.cuda", [["TENSOR", [128, 128, 28, 28], "float32"], ["TENSOR", [128, 128, 3, 3], "float32"], 1, 1, 1, "float32"], {}], "config": {"index": 14551141, "code_hash": null, "entity": [["tile_f", "sp", [-1, 1, 32, 2]], ["tile_y", "sp", [-1, 2, 1, 2]], ["tile_x", "sp", [-1, 2, 1, 7]], ["tile_rc", "sp", [-1, 8]], ["tile_ry", "sp", [-1, 3]], ["tile_rx", "sp", [-1, 1]], ["auto_unroll_max_step", "ot", 1500], ["unroll_explicit", "ot", 1]]}, "result": [[1.362647705], 0, 10.193753957748413, 1638514519.5672398], "version": 0.2, "tvm_version": "0.9.dev0"}
{"input": ["rocm -keys=rocm,gpu -max_num_threads=256 -mcpu=gfx906 -mtriple=amdgcn-amd-amdhsa-hcc -thread_warp_size=64", "conv2d_nchw.cuda", [["TENSOR", [128, 128, 28, 28], "float32"], ["TENSOR", [128, 128, 3, 3], "float32"], 1, 1, 1, "float32"], {}], "config": {"index": 13210725, "code_hash": null, "entity": [["tile_f", "sp", [-1, 4, 2, 2]], ["tile_y", "sp", [-1, 14, 2, 1]], ["tile_x", "sp", [-1, 4, 1, 7]], ["tile_rc", "sp", [-1, 16]], ["tile_ry", "sp", [-1, 1]], ["tile_rx", "sp", [-1, 1]], ["auto_unroll_max_step", "ot", 1500], ["unroll_explicit", "ot", 1]]}, "result": [[14.1561015625], 0, 75.65329575538635, 1638514591.674757], "version": 0.2, "tvm_version": "0.9.dev0"}
{"input": ["rocm -keys=rocm,gpu -max_num_threads=256 -mcpu=gfx906 -mtriple=amdgcn-amd-amdhsa-hcc -thread_warp_size=64", "conv2d_nchw.cuda", [["TENSOR", [128, 128, 28, 28], "float32"], ["TENSOR", [128, 128, 3, 3], "float32"], 1, 1, 1, "float32"], {}], "config": {"index": 4963950, "code_hash": null, "entity": [["tile_f", "sp", [-1, 1, 32, 1]], ["tile_y", "sp", [-1, 1, 2, 1]], ["tile_x", "sp", [-1, 2, 2, 7]], ["tile_rc", "sp", [-1, 2]], ["tile_ry", "sp", [-1, 3]], ["tile_rx", "sp", [-1, 3]], ["auto_unroll_max_step", "ot", 0], ["unroll_explicit", "ot", 1]]}, "result": [[0.005494629684210526], 0, 1.6569907665252686, 1638514697.0902026], "version": 0.2, "tvm_version": "0.9.dev0"}
{"input": ["rocm -keys=rocm,gpu -max_num_threads=256 -mcpu=gfx906 -mtriple=amdgcn-amd-amdhsa-hcc -thread_warp_size=64", "conv2d_nchw.cuda", [["TENSOR", [128, 128, 28, 28], "float32"], ["TENSOR", [128, 128, 3, 3], "float32"], 1, 1, 1, "float32"], {}], "config": {"index": 1928374, "code_hash": null, "entity": [["tile_f", "sp", [-1, 1, 4, 8]], ["tile_y", "sp", [-1, 1, 7, 4]], ["tile_x", "sp", [-1, 2, 1, 1]], ["tile_rc", "sp", [-1, 4]], ["tile_ry", "sp", [-1, 3]], ["tile_rx", "sp", [-1, 1]], ["auto_unroll_max_step", "ot", 0], ["unroll_explicit", "ot", 1]]}, "result": [[0.31168899525], 0, 4.1147074699401855, 1638514700.0162961], "version": 0.2, "tvm_version": "0.9.dev0"}
{"input": ["rocm -keys=rocm,gpu -max_num_threads=256 -mcpu=gfx906 -mtriple=amdgcn-amd-amdhsa-hcc -thread_warp_size=64", "conv2d_nchw.cuda", [["TENSOR", [128, 128, 28, 28], "float32"], ["TENSOR", [128, 128, 3, 3], "float32"], 1, 1, 1, "float32"], {}], "config": {"index": 4911934, "code_hash": null, "entity": [["tile_f", "sp", [-1, 1, 4, 8]], ["tile_y", "sp", [-1, 1, 7, 1]], ["tile_x", "sp", [-1, 7, 2, 2]], ["tile_rc", "sp", [-1, 2]], ["tile_ry", "sp", [-1, 3]], ["tile_rx", "sp", [-1, 3]], ["auto_unroll_max_step", "ot", 0], ["unroll_explicit", "ot", 1]]}, "result": [[0.15854644774999999], 0, 3.628216028213501, 1638514702.0682082], "version": 0.2, "tvm_version": "0.9.dev0"}
{"input": ["rocm -keys=rocm,gpu -max_num_threads=256 -mcpu=gfx906 -mtriple=amdgcn-amd-amdhsa-hcc -thread_warp_size=64", "conv2d_nchw.cuda", [["TENSOR", [128, 128, 28, 28], "float32"], ["TENSOR", [128, 128, 3, 3], "float32"], 1, 1, 1, "float32"], {}], "config": {"index": 4897534, "code_hash": null, "entity": [["tile_f", "sp", [-1, 1, 4, 8]], ["tile_y", "sp", [-1, 1, 7, 1]], ["tile_x", "sp", [-1, 7, 1, 2]], ["tile_rc", "sp", [-1, 2]], ["tile_ry", "sp", [-1, 3]], ["tile_rx", "sp", [-1, 3]], ["auto_unroll_max_step", "ot", 0], ["unroll_explicit", "ot", 1]]}, "result": [[0.36840451025], 0, 4.420093059539795, 1638514705.2082849], "version": 0.2, "tvm_version": "0.9.dev0"}
{"input": ["rocm -keys=rocm,gpu -max_num_threads=256 -mcpu=gfx906 -mtriple=amdgcn-amd-amdhsa-hcc -thread_warp_size=64", "conv2d_nchw.cuda", [["TENSOR", [128, 128, 28, 28], "float32"], ["TENSOR", [128, 128, 3, 3], "float32"], 1, 1, 1, "float32"], {}], "config": {"index": 4878075, "code_hash": null, "entity": [["tile_f", "sp", [-1, 1, 4, 4]], ["tile_y", "sp", [-1, 1, 4, 1]], ["tile_x", "sp", [-1, 2, 14, 1]], ["tile_rc", "sp", [-1, 2]], ["tile_ry", "sp", [-1, 3]], ["tile_rx", "sp", [-1, 3]], ["auto_unroll_max_step", "ot", 0], ["unroll_explicit", "ot", 1]]}, "result": [[0.0065748724375], 0, 1.9428606033325195, 1638514706.5772483], "version": 0.2, "tvm_version": "0.9.dev0"}
{"input": ["rocm -keys=rocm,gpu -max_num_threads=256 -mcpu=gfx906 -mtriple=amdgcn-amd-amdhsa-hcc -thread_warp_size=64", "conv2d_nchw.cuda", [["TENSOR", [128, 128, 28, 28], "float32"], ["TENSOR", [128, 128, 3, 3], "float32"], 1, 1, 1, "float32"], {}], "config": {"index": 1810849, "code_hash": null, "entity": [["tile_f", "sp", [-1, 1, 4, 2]], ["tile_y", "sp", [-1, 1, 4, 1]], ["tile_x", "sp", [-1, 1, 28, 1]], ["tile_rc", "sp", [-1, 2]], ["tile_ry", "sp", [-1, 3]], ["tile_rx", "sp", [-1, 1]], ["auto_unroll_max_step", "ot", 0], ["unroll_explicit", "ot", 1]]}, "result": [[0.012880951875], 0, 1.8934917449951172, 1638514707.9811656], "version": 0.2, "tvm_version": "0.9.dev0"}
{"input": ["rocm -keys=rocm,gpu -max_num_threads=256 -mcpu=gfx906 -mtriple=amdgcn-amd-amdhsa-hcc -thread_warp_size=64", "conv2d_nchw.cuda", [["TENSOR", [128, 128, 28, 28], "float32"], ["TENSOR", [128, 128, 3, 3], "float32"], 1, 1, 1, "float32"], {}], "config": {"index": 4854094, "code_hash": null, "entity": [["tile_f", "sp", [-1, 1, 4, 8]], ["tile_y", "sp", [-1, 1, 4, 1]], ["tile_x", "sp", [-1, 7, 4, 1]], ["tile_rc", "sp", [-1, 2]], ["tile_ry", "sp", [-1, 3]], ["tile_rx", "sp", [-1, 3]], ["auto_unroll_max_step", "ot", 0], ["unroll_explicit", "ot", 1]]}, "result": [[0.10673383325000001], 0, 2.9009830951690674, 1638514709.810641], "version": 0.2, "tvm_version": "0.9.dev0"}
{"input": ["rocm -keys=rocm,gpu -max_num_threads=256 -mcpu=gfx906 -mtriple=amdgcn-amd-amdhsa-hcc -thread_warp_size=64", "conv2d_nchw.cuda", [["TENSOR", [128, 128, 28, 28], "float32"], ["TENSOR", [128, 128, 3, 3], "float32"], 1, 1, 1, "float32"], {}], "config": {"index": 2045541, "code_hash": null, "entity": [["tile_f", "sp", [-1, 1, 8, 1]], ["tile_y", "sp", [-1, 1, 2, 1]], ["tile_x", "sp", [-1, 1, 14, 2]], ["tile_rc", "sp", [-1, 4]], ["tile_ry", "sp", [-1, 3]], ["tile_rx", "sp", [-1, 1]], ["auto_unroll_max_step", "ot", 0], ["unroll_explicit", "ot", 1]]}, "result": [[0.06754816425], 0, 2.198767900466919, 1638514711.5024168], "version": 0.2, "tvm_version": "0.9.dev0"}
{"input": ["rocm -keys=rocm,gpu -max_num_threads=256 -mcpu=gfx906 -mtriple=amdgcn-amd-amdhsa-hcc -thread_warp_size=64", "conv2d_nchw.cuda", [["TENSOR", [128, 128, 28, 28], "float32"], ["TENSOR", [128, 128, 3, 3], "float32"], 1, 1, 1, "float32"], {}], "config": {"index": 4902334, "code_hash": null, "entity": [["tile_f", "sp", [-1, 1, 4, 8]], ["tile_y", "sp", [-1, 1, 7, 1]], ["tile_x", "sp", [-1, 14, 1, 2]], ["tile_rc", "sp", [-1, 2]], ["tile_ry", "sp", [-1, 3]], ["tile_rx", "sp", [-1, 3]], ["auto_unroll_max_step", "ot", 0], ["unroll_explicit", "ot", 1]]}, "result": [[0.448322479], 0, 5.777481555938721, 1638514714.977778], "version": 0.2, "tvm_version": "0.9.dev0"}
{"input": ["rocm -keys=rocm,gpu -max_num_threads=256 -mcpu=gfx906 -mtriple=amdgcn-amd-amdhsa-hcc -thread_warp_size=64", "conv2d_nchw.cuda", [["TENSOR", [128, 128, 28, 28], "float32"], ["TENSOR", [128, 128, 3, 3], "float32"], 1, 1, 1, "float32"], {}], "config": {"index": 1983704, "code_hash": null, "entity": [["tile_f", "sp", [-1, 1, 2, 16]], ["tile_y", "sp", [-1, 1, 4, 1]], ["tile_x", "sp", [-1, 2, 7, 1]], ["tile_rc", "sp", [-1, 4]], ["tile_ry", "sp", [-1, 3]], ["tile_rx", "sp", [-1, 1]], ["auto_unroll_max_step", "ot", 0], ["unroll_explicit", "ot", 1]]}, "result": [[0.018091418777777778], 0, 2.3548853397369385, 1638514716.5935798], "version": 0.2, "tvm_version": "0.9.dev0"}
{"input": ["rocm -keys=rocm,gpu -max_num_threads=256 -mcpu=gfx906 -mtriple=amdgcn-amd-amdhsa-hcc -thread_warp_size=64", "conv2d_nchw.cuda", [["TENSOR", [128, 128, 28, 28], "float32"], ["TENSOR", [128, 128, 3, 3], "float32"], 1, 1, 1, "float32"], {}], "config": {"index": 3511466, "code_hash": null, "entity": [["tile_f", "sp", [-1, 1, 16, 1]], ["tile_y", "sp", [-1, 1, 2, 2]], ["tile_x", "sp", [-1, 7, 4, 1]], ["tile_rc", "sp", [-1, 4]], ["tile_ry", "sp", [-1, 1]], ["tile_rx", "sp", [-1, 3]], ["auto_unroll_max_step", "ot", 0], ["unroll_explicit", "ot", 1]]}, "result": [[0.009986534090909091], 0, 2.226515054702759, 1638514718.1420975], "version": 0.2, "tvm_version": "0.9.dev0"}
{"input": ["rocm -keys=rocm,gpu -max_num_threads=256 -mcpu=gfx906 -mtriple=amdgcn-amd-amdhsa-hcc -thread_warp_size=64", "conv2d_nchw.cuda", [["TENSOR", [128, 128, 28, 28], "float32"], ["TENSOR", [128, 128, 3, 3], "float32"], 1, 1, 1, "float32"], {}], "config": {"index": 2083950, "code_hash": null, "entity": [["tile_f", "sp", [-1, 1, 32, 1]], ["tile_y", "sp", [-1, 1, 2, 1]], ["tile_x", "sp", [-1, 2, 2, 7]], ["tile_rc", "sp", [-1, 4]], ["tile_ry", "sp", [-1, 3]], ["tile_rx", "sp", [-1, 1]], ["auto_unroll_max_step", "ot", 0], ["unroll_explicit", "ot", 1]]}, "result": [[0.17283708175], 0, 3.798079490661621, 1638514720.3091326], "version": 0.2, "tvm_version": "0.9.dev0"}
{"input": ["rocm -keys=rocm,gpu -max_num_threads=256 -mcpu=gfx906 -mtriple=amdgcn-amd-amdhsa-hcc -thread_warp_size=64", "conv2d_nchw.cuda", [["TENSOR", [128, 128, 28, 28], "float32"], ["TENSOR", [128, 128, 3, 3], "float32"], 1, 1, 1, "float32"], {}], "config": {"index": 1997541, "code_hash": null, "entity": [["tile_f", "sp", [-1, 1, 8, 1]], ["tile_y", "sp", [-1, 1, 2, 1]], ["tile_x", "sp", [-1, 2, 14, 1]], ["tile_rc", "sp", [-1, 4]], ["tile_ry", "sp", [-1, 3]], ["tile_rx", "sp", [-1, 1]], ["auto_unroll_max_step", "ot", 0], ["unroll_explicit", "ot", 1]]}, "result": [[0.07728555275], 0, 2.415947675704956, 1638514721.984437], "version": 0.2, "tvm_version": "0.9.dev0"}
{"input": ["rocm -keys=rocm,gpu -max_num_threads=256 -mcpu=gfx906 -mtriple=amdgcn-amd-amdhsa-hcc -thread_warp_size=64", "conv2d_nchw.cuda", [["TENSOR", [128, 128, 28, 28], "float32"], ["TENSOR", [128, 128, 3, 3], "float32"], 1, 1, 1, "float32"], {}], "config": {"index": 3534090, "code_hash": null, "entity": [["tile_f", "sp", [-1, 1, 2, 8]], ["tile_y", "sp", [-1, 1, 4, 1]], ["tile_x", "sp", [-1, 2, 14, 1]], ["tile_rc", "sp", [-1, 4]], ["tile_ry", "sp", [-1, 1]], ["tile_rx", "sp", [-1, 3]], ["auto_unroll_max_step", "ot", 0], ["unroll_explicit", "ot", 1]]}, "result": [[0.009130766363636363], 0, 2.253340244293213, 1638514723.3572462], "version": 0.2, "tvm_version": "0.9.dev0"}
{"input": ["rocm -keys=rocm,gpu -max_num_threads=256 -mcpu=gfx906 -mtriple=amdgcn-amd-amdhsa-hcc -thread_warp_size=64", "conv2d_nchw.cuda", [["TENSOR", [128, 128, 28, 28], "float32"], ["TENSOR", [128, 128, 3, 3], "float32"], 1, 1, 1, "float32"], {}], "config": {"index": 4687466, "code_hash": null, "entity": [["tile_f", "sp", [-1, 1, 16, 1]], ["tile_y", "sp", [-1, 1, 2, 2]], ["tile_x", "sp", [-1, 2, 14, 1]], ["tile_rc", "sp", [-1, 1]], ["tile_ry", "sp", [-1, 3]], ["tile_rx", "sp", [-1, 3]], ["auto_unroll_max_step", "ot", 0], ["unroll_explicit", "ot", 1]]}, "result": [[0.008091533307692307], 0, 2.0576791763305664, 1638514724.8370807], "version": 0.2, "tvm_version": "0.9.dev0"}
{"input": ["rocm -keys=rocm,gpu -max_num_threads=256 -mcpu=gfx906 -mtriple=amdgcn-amd-amdhsa-hcc -thread_warp_size=64", "conv2d_nchw.cuda", [["TENSOR", [128, 128, 28, 28], "float32"], ["TENSOR", [128, 128, 3, 3], "float32"], 1, 1, 1, "float32"], {}], "config": {"index": 11023039, "code_hash": null, "entity": [["tile_f", "sp", [-1, 1, 8, 4]], ["tile_y", "sp", [-1, 1, 1, 2]], ["tile_x", "sp", [-1, 2, 14, 1]], ["tile_rc", "sp", [-1, 2]], ["tile_ry", "sp", [-1, 3]], ["tile_rx", "sp", [-1, 3]], ["auto_unroll_max_step", "ot", 512], ["unroll_explicit", "ot", 1]]}, "result": [[0.0053223559999999994], 0, 2.127016067504883, 1638514726.338885], "version": 0.2, "tvm_version": "0.9.dev0"}
{"input": ["rocm -keys=rocm,gpu -max_num_threads=256 -mcpu=gfx906 -mtriple=amdgcn-amd-amdhsa-hcc -thread_warp_size=64", "conv2d_nchw.cuda", [["TENSOR", [128, 128, 28, 28], "float32"], ["TENSOR", [128, 128, 3, 3], "float32"], 1, 1, 1, "float32"], {}], "config": {"index": 17167039, "code_hash": null, "entity": [["tile_f", "sp", [-1, 1, 8, 4]], ["tile_y", "sp", [-1, 1, 1, 2]], ["tile_x", "sp", [-1, 2, 14, 1]], ["tile_rc", "sp", [-1, 2]], ["tile_ry", "sp", [-1, 3]], ["tile_rx", "sp", [-1, 3]], ["auto_unroll_max_step", "ot", 1500], ["unroll_explicit", "ot", 1]]}, "result": [[0.0057239395], 0, 2.5658562183380127, 1638514728.0854065], "version": 0.2, "tvm_version": "0.9.dev0"}
{"input": ["rocm -keys=rocm,gpu -max_num_threads=256 -mcpu=gfx906 -mtriple=amdgcn-amd-amdhsa-hcc -thread_warp_size=64", "conv2d_nchw.cuda", [["TENSOR", [128, 128, 28, 28], "float32"], ["TENSOR", [128, 128, 3, 3], "float32"], 1, 1, 1, "float32"], {}], "config": {"index": 4893334, "code_hash": null, "entity": [["tile_f", "sp", [-1, 1, 4, 8]], ["tile_y", "sp", [-1, 1, 28, 1]], ["tile_x", "sp", [-1, 2, 1, 2]], ["tile_rc", "sp", [-1, 2]], ["tile_ry", "sp", [-1, 3]], ["tile_rx", "sp", [-1, 3]], ["auto_unroll_max_step", "ot", 0], ["unroll_explicit", "ot", 1]]}, "result": [[0.007786133266666667], 0, 2.3791682720184326, 1638514729.839656], "version": 0.2, "tvm_version": "0.9.dev0"}
{"input": ["rocm -keys=rocm,gpu -max_num_threads=256 -mcpu=gfx906 -mtriple=amdgcn-amd-amdhsa-hcc -thread_warp_size=64", "conv2d_nchw.cuda", [["TENSOR", [128, 128, 28, 28], "float32"], ["TENSOR", [128, 128, 3, 3], "float32"], 1, 1, 1, "float32"], {}], "config": {"index": 4931119, "code_hash": null, "entity": [["tile_f", "sp", [-1, 1, 8, 4]], ["tile_y", "sp", [-1, 1, 7, 1]], ["tile_x", "sp", [-1, 1, 1, 4]], ["tile_rc", "sp", [-1, 2]], ["tile_ry", "sp", [-1, 3]], ["tile_rx", "sp", [-1, 3]], ["auto_unroll_max_step", "ot", 0], ["unroll_explicit", "ot", 1]]}, "result": [[0.022486971499999998], 0, 2.3604252338409424, 1638514731.64924], "version": 0.2, "tvm_version": "0.9.dev0"}
{"input": ["rocm -keys=rocm,gpu -max_num_threads=256 -mcpu=gfx906 -mtriple=amdgcn-amd-amdhsa-hcc -thread_warp_size=64", "conv2d_nchw.cuda", [["TENSOR", [128, 128, 28, 28], "float32"], ["TENSOR", [128, 128, 3, 3], "float32"], 1, 1, 1, "float32"], {}], "config": {"index": 4920778, "code_hash": null, "entity": [["tile_f", "sp", [-1, 1, 16, 2]], ["tile_y", "sp", [-1, 1, 2, 1]], ["tile_x", "sp", [-1, 2, 7, 2]], ["tile_rc", "sp", [-1, 2]], ["tile_ry", "sp", [-1, 3]], ["tile_rx", "sp", [-1, 3]], ["auto_unroll_max_step", "ot", 0], ["unroll_explicit", "ot", 1]]}, "result": [[0.00636454188235294], 0, 2.388810634613037, 1638514733.3250651], "version": 0.2, "tvm_version": "0.9.dev0"}
{"input": ["rocm -keys=rocm,gpu -max_num_threads=256 -mcpu=gfx906 -mtriple=amdgcn-amd-amdhsa-hcc -thread_warp_size=64", "conv2d_nchw.cuda", [["TENSOR", [128, 128, 28, 28], "float32"], ["TENSOR", [128, 128, 3, 3], "float32"], 1, 1, 1, "float32"], {}], "config": {"index": 11022075, "code_hash": null, "entity": [["tile_f", "sp", [-1, 1, 4, 4]], ["tile_y", "sp", [-1, 1, 4, 1]], ["tile_x", "sp", [-1, 2, 14, 1]], ["tile_rc", "sp", [-1, 2]], ["tile_ry", "sp", [-1, 3]], ["tile_rx", "sp", [-1, 3]], ["auto_unroll_max_step", "ot", 512], ["unroll_explicit", "ot", 1]]}, "result": [[0.0060701962352941174], 0, 2.1560592651367188, 1638514734.9132612], "version": 0.2, "tvm_version": "0.9.dev0"}
{"input": ["rocm -keys=rocm,gpu -max_num_threads=256 -mcpu=gfx906 -mtriple=amdgcn-amd-amdhsa-hcc -thread_warp_size=64", "conv2d_nchw.cuda", [["TENSOR", [128, 128, 28, 28], "float32"], ["TENSOR", [128, 128, 3, 3], "float32"], 1, 1, 1, "float32"], {}], "config": {"index": 4921294, "code_hash": null, "entity": [["tile_f", "sp", [-1, 1, 4, 8]], ["tile_y", "sp", [-1, 1, 4, 1]], ["tile_x", "sp", [-1, 2, 7, 2]], ["tile_rc", "sp", [-1, 2]], ["tile_ry", "sp", [-1, 3]], ["tile_rx", "sp", [-1, 3]], ["auto_unroll_max_step", "ot", 0], ["unroll_explicit", "ot", 1]]}, "result": [[0.005431795850000001], 0, 2.632718086242676, 1638514736.6486912], "version": 0.2, "tvm_version": "0.9.dev0"}
{"input": ["rocm -keys=rocm,gpu -max_num_threads=256 -mcpu=gfx906 -mtriple=amdgcn-amd-amdhsa-hcc -thread_warp_size=64", "conv2d_nchw.cuda", [["TENSOR", [128, 128, 28, 28], "float32"], ["TENSOR", [128, 128, 3, 3], "float32"], 1, 1, 1, "float32"], {}], "config": {"index": 1998981, "code_hash": null, "entity": [["tile_f", "sp", [-1, 1, 8, 1]], ["tile_y", "sp", [-1, 1, 1, 2]], ["tile_x", "sp", [-1, 2, 14, 1]], ["tile_rc", "sp", [-1, 4]], ["tile_ry", "sp", [-1, 3]], ["tile_rx", "sp", [-1, 1]], ["auto_unroll_max_step", "ot", 0], ["unroll_explicit", "ot", 1]]}, "result": [[0.07622679125000001], 0, 2.691012382507324, 1638514738.625918], "version": 0.2, "tvm_version": "0.9.dev0"}
{"input": ["rocm -keys=rocm,gpu -max_num_threads=256 -mcpu=gfx906 -mtriple=amdgcn-amd-amdhsa-hcc -thread_warp_size=64", "conv2d_nchw.cuda", [["TENSOR", [128, 128, 28, 28], "float32"], ["TENSOR", [128, 128, 3, 3], "float32"], 1, 1, 1, "float32"], {}], "config": {"index": 3525866, "code_hash": null, "entity": [["tile_f", "sp", [-1, 1, 16, 1]], ["tile_y", "sp", [-1, 1, 2, 2]], ["tile_x", "sp", [-1, 4, 7, 1]], ["tile_rc", "sp", [-1, 4]], ["tile_ry", "sp", [-1, 1]], ["tile_rx", "sp", [-1, 3]], ["auto_unroll_max_step", "ot", 0], ["unroll_explicit", "ot", 1]]}, "result": [[0.134152954], 0, 3.321800708770752, 1638514740.902979], "version": 0.2, "tvm_version": "0.9.dev0"}
{"input": ["rocm -keys=rocm,gpu -max_num_threads=256 -mcpu=gfx906 -mtriple=amdgcn-amd-amdhsa-hcc -thread_warp_size=64", "conv2d_nchw.cuda", [["TENSOR", [128, 128, 28, 28], "float32"], ["TENSOR", [128, 128, 3, 3], "float32"], 1, 1, 1, "float32"], {}], "config": {"index": 1928024, "code_hash": null, "entity": [["tile_f", "sp", [-1, 1, 2, 16]], ["tile_y", "sp", [-1, 1, 14, 2]], ["tile_x", "sp", [-1, 2, 1, 1]], ["tile_rc", "sp", [-1, 4]], ["tile_ry", "sp", [-1, 3]], ["tile_rx", "sp", [-1, 1]], ["auto_unroll_max_step", "ot", 0], ["unroll_explicit", "ot", 1]]}, "result": [[0.2540328215], 0, 4.163720369338989, 1638514743.77113], "version": 0.2, "tvm_version": "0.9.dev0"}
{"input": ["rocm -keys=rocm,gpu -max_num_threads=256 -mcpu=gfx906 -mtriple=amdgcn-amd-amdhsa-hcc -thread_warp_size=64", "conv2d_nchw.cuda", [["TENSOR", [128, 128, 28, 28], "float32"], ["TENSOR", [128, 128, 3, 3], "float32"], 1, 1, 1, "float32"], {}], "config": {"index": 17142094, "code_hash": null, "entity": [["tile_f", "sp", [-1, 1, 4, 8]], ["tile_y", "sp", [-1, 1, 4, 1]], ["tile_x", "sp", [-1, 7, 4, 1]], ["tile_rc", "sp", [-1, 2]], ["tile_ry", "sp", [-1, 3]], ["tile_rx", "sp", [-1, 3]], ["auto_unroll_max_step", "ot", 1500], ["unroll_explicit", "ot", 1]]}, "result": [[0.64288616925], 0, 9.468576908111572, 1638514748.5753634], "version": 0.2, "tvm_version": "0.9.dev0"}
{"input": ["rocm -keys=rocm,gpu -max_num_threads=256 -mcpu=gfx906 -mtriple=amdgcn-amd-amdhsa-hcc -thread_warp_size=64", "conv2d_nchw.cuda", [["TENSOR", [128, 128, 28, 28], "float32"], ["TENSOR", [128, 128, 3, 3], "float32"], 1, 1, 1, "float32"], {}], "config": {"index": 10998094, "code_hash": null, "entity": [["tile_f", "sp", [-1, 1, 4, 8]], ["tile_y", "sp", [-1, 1, 4, 1]], ["tile_x", "sp", [-1, 7, 4, 1]], ["tile_rc", "sp", [-1, 2]], ["tile_ry", "sp", [-1, 3]], ["tile_rx", "sp", [-1, 3]], ["auto_unroll_max_step", "ot", 512], ["unroll_explicit", "ot", 1]]}, "result": [[0.18625212075], 0, 3.7438912391662598, 1638514751.1472058], "version": 0.2, "tvm_version": "0.9.dev0"}
{"input": ["rocm -keys=rocm,gpu -max_num_threads=256 -mcpu=gfx906 -mtriple=amdgcn-amd-amdhsa-hcc -thread_warp_size=64", "conv2d_nchw.cuda", [["TENSOR", [128, 128, 28, 28], "float32"], ["TENSOR", [128, 128, 3, 3], "float32"], 1, 1, 1, "float32"], {}], "config": {"index": 4836814, "code_hash": null, "entity": [["tile_f", "sp", [-1, 1, 4, 8]], ["tile_y", "sp", [-1, 1, 14, 2]], ["tile_x", "sp", [-1, 2, 2, 1]], ["tile_rc", "sp", [-1, 2]], ["tile_ry", "sp", [-1, 3]], ["tile_rx", "sp", [-1, 3]], ["auto_unroll_max_step", "ot", 0], ["unroll_explicit", "ot", 1]]}, "result": [[0.00709219], 0, 2.4577982425689697, 1638514752.948672], "version": 0.2, "tvm_version": "0.9.dev0"}
{"input": ["rocm -keys=rocm,gpu -max_num_threads=256 -mcpu=gfx906 -mtriple=amdgcn-amd-amdhsa-hcc -thread_warp_size=64", "conv2d_nchw.cuda", [["TENSOR", [128, 128, 28, 28], "float32"], ["TENSOR", [128, 128, 3, 3], "float32"], 1, 1, 1, "float32"], {}], "config": {"index": 2040750, "code_hash": null, "entity": [["tile_f", "sp", [-1, 1, 32, 1]], ["tile_y", "sp", [-1, 1, 2, 1]], ["tile_x", "sp", [-1, 2, 7, 2]], ["tile_rc", "sp", [-1, 4]], ["tile_ry", "sp", [-1, 3]], ["tile_rx", "sp", [-1, 1]], ["auto_unroll_max_step", "ot", 0], ["unroll_explicit", "ot", 1]]}, "result": [[0.11367685675], 0, 2.780686616897583, 1638514755.1528249], "version": 0.2, "tvm_version": "0.9.dev0"}
{"input": ["rocm -keys=rocm,gpu -max_num_threads=256 -mcpu=gfx906 -mtriple=amdgcn-amd-amdhsa-hcc -thread_warp_size=64", "conv2d_nchw.cuda", [["TENSOR", [128, 128, 28, 28], "float32"], ["TENSOR", [128, 128, 3, 3], "float32"], 1, 1, 1, "float32"], {}], "config": {"index": 2014174, "code_hash": null, "entity": [["tile_f", "sp", [-1, 1, 4, 8]], ["tile_y", "sp", [-1, 1, 7, 2]], ["tile_x", "sp", [-1, 2, 1, 2]], ["tile_rc", "sp", [-1, 4]], ["tile_ry", "sp", [-1, 3]], ["tile_rx", "sp", [-1, 1]], ["auto_unroll_max_step", "ot", 0], ["unroll_explicit", "ot", 1]]}, "result": [[0.35956237775], 0, 4.973194599151611, 1638514758.5719807], "version": 0.2, "tvm_version": "0.9.dev0"}
{"input": ["rocm -keys=rocm,gpu -max_num_threads=256 -mcpu=gfx906 -mtriple=amdgcn-amd-amdhsa-hcc -thread_warp_size=64", "conv2d_nchw.cuda", [["TENSOR", [128, 128, 28, 28], "float32"], ["TENSOR", [128, 128, 3, 3], "float32"], 1, 1, 1, "float32"], {}], "config": {"index": 1806075, "code_hash": null, "entity": [["tile_f", "sp", [-1, 1, 4, 4]], ["tile_y", "sp", [-1, 1, 4, 1]], ["tile_x", "sp", [-1, 2, 14, 1]], ["tile_rc", "sp", [-1, 2]], ["tile_ry", "sp", [-1, 3]], ["tile_rx", "sp", [-1, 1]], ["auto_unroll_max_step", "ot", 0], ["unroll_explicit", "ot", 1]]}, "result": [[0.008534675538461538], 0, 2.346789598464966, 1638514760.361893], "version": 0.2, "tvm_version": "0.9.dev0"}
{"input": ["rocm -keys=rocm,gpu -max_num_threads=256 -mcpu=gfx906 -mtriple=amdgcn-amd-amdhsa-hcc -thread_warp_size=64", "conv2d_nchw.cuda", [["TENSOR", [128, 128, 28, 28], "float32"], ["TENSOR", [128, 128, 3, 3], "float32"], 1, 1, 1, "float32"], {}], "config": {"index": 4817377, "code_hash": null, "entity": [["tile_f", "sp", [-1, 1, 8, 8]], ["tile_y", "sp", [-1, 1, 7, 2]], ["tile_x", "sp", [-1, 7, 1, 1]], ["tile_rc", "sp", [-1, 2]], ["tile_ry", "sp", [-1, 3]], ["tile_rx", "sp", [-1, 3]], ["auto_unroll_max_step", "ot", 0], ["unroll_explicit", "ot", 1]]}, "result": [[0.2184560545], 0, 3.8475725650787354, 1638514763.1208377], "version": 0.2, "tvm_version": "0.9.dev0"}
