artifacts/Table4/tvm/autotvm/conv/conv2d_128_336_21_21_336_1_1_1_0.log
{"input": ["rocm -keys=rocm,gpu -max_num_threads=256 -mcpu=gfx906 -mtriple=amdgcn-amd-amdhsa-hcc -thread_warp_size=64", "conv2d_nchw.cuda", [["TENSOR", [128, 336, 21, 21], "float32"], ["TENSOR", [336, 336, 1, 1], "float32"], 1, 0, 1, "float32"], {}], "config": {"index": 7829126, "code_hash": null, "entity": [["tile_f", "sp", [-1, 4, 1, 6]], ["tile_y", "sp", [-1, 1, 1, 7]], ["tile_x", "sp", [-1, 1, 1, 3]], ["tile_rc", "sp", [-1, 48]], ["tile_ry", "sp", [-1, 1]], ["tile_rx", "sp", [-1, 1]], ["auto_unroll_max_step", "ot", 1500], ["unroll_explicit", "ot", 1]]}, "result": [[13.44098828125], 0, 76.14817571640015, 1638614278.4541357], "version": 0.2, "tvm_version": "0.9.dev0"}
{"input": ["rocm -keys=rocm,gpu -max_num_threads=256 -mcpu=gfx906 -mtriple=amdgcn-amd-amdhsa-hcc -thread_warp_size=64", "conv2d_nchw.cuda", [["TENSOR", [128, 336, 21, 21], "float32"], ["TENSOR", [336, 336, 1, 1], "float32"], 1, 0, 1, "float32"], {}], "config": {"index": 5871965, "code_hash": null, "entity": [["tile_f", "sp", [-1, 2, 2, 7]], ["tile_y", "sp", [-1, 7, 3, 1]], ["tile_x", "sp", [-1, 1, 1, 21]], ["tile_rc", "sp", [-1, 1]], ["tile_ry", "sp", [-1, 1]], ["tile_rx", "sp", [-1, 1]], ["auto_unroll_max_step", "ot", 1500], ["unroll_explicit", "ot", 1]]}, "result": [[0.6227460324999999], 0, 8.223325967788696, 1638614283.5759058], "version": 0.2, "tvm_version": "0.9.dev0"}
{"input": ["rocm -keys=rocm,gpu -max_num_threads=256 -mcpu=gfx906 -mtriple=amdgcn-amd-amdhsa-hcc -thread_warp_size=64", "conv2d_nchw.cuda", [["TENSOR", [128, 336, 21, 21], "float32"], ["TENSOR", [336, 336, 1, 1], "float32"], 1, 0, 1, "float32"], {}], "config": {"index": 6358940, "code_hash": null, "entity": [["tile_f", "sp", [-1, 7, 1, 2]], ["tile_y", "sp", [-1, 1, 7, 3]], ["tile_x", "sp", [-1, 7, 3, 1]], ["tile_rc", "sp", [-1, 6]], ["tile_ry", "sp", [-1, 1]], ["tile_rx", "sp", [-1, 1]], ["auto_unroll_max_step", "ot", 1500], ["unroll_explicit", "ot", 1]]}, "result": [[1.06637585425], 0, 11.095088243484497, 1638614290.8905306], "version": 0.2, "tvm_version": "0.9.dev0"}
{"input": ["rocm -keys=rocm,gpu -max_num_threads=256 -mcpu=gfx906 -mtriple=amdgcn-amd-amdhsa-hcc -thread_warp_size=64", "conv2d_nchw.cuda", [["TENSOR", [128, 336, 21, 21], "float32"], ["TENSOR", [336, 336, 1, 1], "float32"], 1, 0, 1, "float32"], {}], "config": {"index": 7706551, "code_hash": null, "entity": [["tile_f", "sp", [-1, 1, 12, 7]], ["tile_y", "sp", [-1, 3, 1, 1]], ["tile_x", "sp", [-1, 1, 1, 7]], ["tile_rc", "sp", [-1, 42]], ["tile_ry", "sp", [-1, 1]], ["tile_rx", "sp", [-1, 1]], ["auto_unroll_max_step", "ot", 1500], ["unroll_explicit", "ot", 1]]}, "result": [[1.05044836425], 0, 9.598551988601685, 1638614298.2190902], "version": 0.2, "tvm_version": "0.9.dev0"}
{"input": ["rocm -keys=rocm,gpu -max_num_threads=256 -mcpu=gfx906 -mtriple=amdgcn-amd-amdhsa-hcc -thread_warp_size=64", "conv2d_nchw.cuda", [["TENSOR", [128, 336, 21, 21], "float32"], ["TENSOR", [336, 336, 1, 1], "float32"], 1, 0, 1, "float32"], {}], "config": {"index": 2493299, "code_hash": null, "entity": [["tile_f", "sp", [-1, 1, 6, 2]], ["tile_y", "sp", [-1, 1, 3, 1]], ["tile_x", "sp", [-1, 1, 7, 1]], ["tile_rc", "sp", [-1, 112]], ["tile_ry", "sp", [-1, 1]], ["tile_rx", "sp", [-1, 1]], ["auto_unroll_max_step", "ot", 0], ["unroll_explicit", "ot", 1]]}, "result": [[0.021114721833333336], 0, 2.494534730911255, 1638614299.9174254], "version": 0.2, "tvm_version": "0.9.dev0"}
{"input": ["rocm -keys=rocm,gpu -max_num_threads=256 -mcpu=gfx906 -mtriple=amdgcn-amd-amdhsa-hcc -thread_warp_size=64", "conv2d_nchw.cuda", [["TENSOR", [128, 336, 21, 21], "float32"], ["TENSOR", [336, 336, 1, 1], "float32"], 1, 0, 1, "float32"], {}], "config": {"index": 5537304, "code_hash": null, "entity": [["tile_f", "sp", [-1, 6, 2, 1]], ["tile_y", "sp", [-1, 1, 1, 1]], ["tile_x", "sp", [-1, 7, 1, 3]], ["tile_rc", "sp", [-1, 168]], ["tile_ry", "sp", [-1, 1]], ["tile_rx", "sp", [-1, 1]], ["auto_unroll_max_step", "ot", 512], ["unroll_explicit", "ot", 1]]}, "result": [[20.97087304675], 0, 107.5369758605957, 1638614406.2725785], "version": 0.2, "tvm_version": "0.9.dev0"}
{"input": ["rocm -keys=rocm,gpu -max_num_threads=256 -mcpu=gfx906 -mtriple=amdgcn-amd-amdhsa-hcc -thread_warp_size=64", "conv2d_nchw.cuda", [["TENSOR", [128, 336, 21, 21], "float32"], ["TENSOR", [336, 336, 1, 1], "float32"], 1, 0, 1, "float32"], {}], "config": {"index": 8279694, "code_hash": null, "entity": [["tile_f", "sp", [-1, 6, 14, 1]], ["tile_y", "sp", [-1, 3, 1, 1]], ["tile_x", "sp", [-1, 1, 1, 7]], ["tile_rc", "sp", [-1, 112]], ["tile_ry", "sp", [-1, 1]], ["tile_rx", "sp", [-1, 1]], ["auto_unroll_max_step", "ot", 1500], ["unroll_explicit", "ot", 1]]}, "result": [[5.19135546875], 0, 29.90218186378479, 1638614433.7181802], "version": 0.2, "tvm_version": "0.9.dev0"}
{"input": ["rocm -keys=rocm,gpu -max_num_threads=256 -mcpu=gfx906 -mtriple=amdgcn-amd-amdhsa-hcc -thread_warp_size=64", "conv2d_nchw.cuda", [["TENSOR", [128, 336, 21, 21], "float32"], ["TENSOR", [336, 336, 1, 1], "float32"], 1, 0, 1, "float32"], {}], "config": {"index": 1237554, "code_hash": null, "entity": [["tile_f", "sp", [-1, 2, 2, 28]], ["tile_y", "sp", [-1, 3, 1, 1]], ["tile_x", "sp", [-1, 7, 1, 3]], ["tile_rc", "sp", [-1, 14]], ["tile_ry", "sp", [-1, 1]], ["tile_rx", "sp", [-1, 1]], ["auto_unroll_max_step", "ot", 0], ["unroll_explicit", "ot", 1]]}, "result": [[2.62824633775], 0, 16.021526098251343, 1638614448.479458], "version": 0.2, "tvm_version": "0.9.dev0"}
{"input": ["rocm -keys=rocm,gpu -max_num_threads=256 -mcpu=gfx906 -mtriple=amdgcn-amd-amdhsa-hcc -thread_warp_size=64", "conv2d_nchw.cuda", [["TENSOR", [128, 336, 21, 21], "float32"], ["TENSOR", [336, 336, 1, 1], "float32"], 1, 0, 1, "float32"], {}], "config": {"index": 3466176, "code_hash": null, "entity": [["tile_f", "sp", [-1, 14, 2, 6]], ["tile_y", "sp", [-1, 3, 1, 7]], ["tile_x", "sp", [-1, 7, 1, 1]], ["tile_rc", "sp", [-1, 6]], ["tile_ry", "sp", [-1, 1]], ["tile_rx", "sp", [-1, 1]], ["auto_unroll_max_step", "ot", 512], ["unroll_explicit", "ot", 1]]}, "result": [[2.98455346675], 0, 21.41409397125244, 1638614464.9278893], "version": 0.2, "tvm_version": "0.9.dev0"}
{"input": ["rocm -keys=rocm,gpu -max_num_threads=256 -mcpu=gfx906 -mtriple=amdgcn-amd-amdhsa-hcc -thread_warp_size=64", "conv2d_nchw.cuda", [["TENSOR", [128, 336, 21, 21], "float32"], ["TENSOR", [336, 336, 1, 1], "float32"], 1, 0, 1, "float32"], {}], "config": {"index": 1321511, "code_hash": null, "entity": [["tile_f", "sp", [-1, 1, 12, 14]], ["tile_y", "sp", [-1, 3, 7, 1]], ["tile_x", "sp", [-1, 21, 1, 1]], ["tile_rc", "sp", [-1, 16]], ["tile_ry", "sp", [-1, 1]], ["tile_rx", "sp", [-1, 1]], ["auto_unroll_max_step", "ot", 0], ["unroll_explicit", "ot", 1]]}, "result": [[0.460632324], 0, 4.405745983123779, 1638614468.793636], "version": 0.2, "tvm_version": "0.9.dev0"}
{"input": ["rocm -keys=rocm,gpu -max_num_threads=256 -mcpu=gfx906 -mtriple=amdgcn-amd-amdhsa-hcc -thread_warp_size=64", "conv2d_nchw.cuda", [["TENSOR", [128, 336, 21, 21], "float32"], ["TENSOR", [336, 336, 1, 1], "float32"], 1, 0, 1, "float32"], {}], "config": {"index": 1746703, "code_hash": null, "entity": [["tile_f", "sp", [-1, 14, 6, 1]], ["tile_y", "sp", [-1, 1, 1, 21]], ["tile_x", "sp", [-1, 7, 1, 1]], ["tile_rc", "sp", [-1, 28]], ["tile_ry", "sp", [-1, 1]], ["tile_rx", "sp", [-1, 1]], ["auto_unroll_max_step", "ot", 0], ["unroll_explicit", "ot", 1]]}, "result": [[2.94949023425], 0, 18.0103120803833, 1638614485.0848665], "version": 0.2, "tvm_version": "0.9.dev0"}
{"input": ["rocm -keys=rocm,gpu -max_num_threads=256 -mcpu=gfx906 -mtriple=amdgcn-amd-amdhsa-hcc -thread_warp_size=64", "conv2d_nchw.cuda", [["TENSOR", [128, 336, 21, 21], "float32"], ["TENSOR", [336, 336, 1, 1], "float32"], 1, 0, 1, "float32"], {}], "config": {"index": 1853626, "code_hash": null, "entity": [["tile_f", "sp", [-1, 8, 2, 1]], ["tile_y", "sp", [-1, 1, 3, 7]], ["tile_x", "sp", [-1, 1, 3, 7]], ["tile_rc", "sp", [-1, 28]], ["tile_ry", "sp", [-1, 1]], ["tile_rx", "sp", [-1, 1]], ["auto_unroll_max_step", "ot", 0], ["unroll_explicit", "ot", 1]]}, "result": [[1.27018713375], 0, 9.619450807571411, 1638614493.0139914], "version": 0.2, "tvm_version": "0.9.dev0"}
{"input": ["rocm -keys=rocm,gpu -max_num_threads=256 -mcpu=gfx906 -mtriple=amdgcn-amd-amdhsa-hcc -thread_warp_size=64", "conv2d_nchw.cuda", [["TENSOR", [128, 336, 21, 21], "float32"], ["TENSOR", [336, 336, 1, 1], "float32"], 1, 0, 1, "float32"], {}], "config": {"index": 621171, "code_hash": null, "entity": [["tile_f", "sp", [-1, 3, 112, 1]], ["tile_y", "sp", [-1, 7, 3, 1]], ["tile_x", "sp", [-1, 7, 3, 1]], ["tile_rc", "sp", [-1, 6]], ["tile_ry", "sp", [-1, 1]], ["tile_rx", "sp", [-1, 1]], ["auto_unroll_max_step", "ot", 0], ["unroll_explicit", "ot", 1]]}, "result": [[0.4531382445], 0, 5.75455641746521, 1638614497.1394074], "version": 0.2, "tvm_version": "0.9.dev0"}
{"input": ["rocm -keys=rocm,gpu -max_num_threads=256 -mcpu=gfx906 -mtriple=amdgcn-amd-amdhsa-hcc -thread_warp_size=64", "conv2d_nchw.cuda", [["TENSOR", [128, 336, 21, 21], "float32"], ["TENSOR", [336, 336, 1, 1], "float32"], 1, 0, 1, "float32"], {}], "config": {"index": 1883178, "code_hash": null, "entity": [["tile_f", "sp", [-1, 1, 3, 14]], ["tile_y", "sp", [-1, 7, 1, 1]], ["tile_x", "sp", [-1, 7, 1, 1]], ["tile_rc", "sp", [-1, 42]], ["tile_ry", "sp", [-1, 1]], ["tile_rx", "sp", [-1, 1]], ["auto_unroll_max_step", "ot", 0], ["unroll_explicit", "ot", 1]]}, "result": [[3.0671086425], 0, 18.25570845603943, 1638614514.297726], "version": 0.2, "tvm_version": "0.9.dev0"}
{"input": ["rocm -keys=rocm,gpu -max_num_threads=256 -mcpu=gfx906 -mtriple=amdgcn-amd-amdhsa-hcc -thread_warp_size=64", "conv2d_nchw.cuda", [["TENSOR", [128, 336, 21, 21], "float32"], ["TENSOR", [336, 336, 1, 1], "float32"], 1, 0, 1, "float32"], {}], "config": {"index": 1098617, "code_hash": null, "entity": [["tile_f", "sp", [-1, 12, 2, 14]], ["tile_y", "sp", [-1, 1, 1, 3]], ["tile_x", "sp", [-1, 7, 1, 3]], ["tile_rc", "sp", [-1, 12]], ["tile_ry", "sp", [-1, 1]], ["tile_rx", "sp", [-1, 1]], ["auto_unroll_max_step", "ot", 0], ["unroll_explicit", "ot", 1]]}, "result": [[3.8579877927500004], 0, 23.815290451049805, 1638614535.1899714], "version": 0.2, "tvm_version": "0.9.dev0"}
{"input": ["rocm -keys=rocm,gpu -max_num_threads=256 -mcpu=gfx906 -mtriple=amdgcn-amd-amdhsa-hcc -thread_warp_size=64", "conv2d_nchw.cuda", [["TENSOR", [128, 336, 21, 21], "float32"], ["TENSOR", [336, 336, 1, 1], "float32"], 1, 0, 1, "float32"], {}], "config": {"index": 1919137, "code_hash": null, "entity": [["tile_f", "sp", [-1, 112, 1, 1]], ["tile_y", "sp", [-1, 21, 1, 1]], ["tile_x", "sp", [-1, 1, 7, 1]], ["tile_rc", "sp", [-1, 42]], ["tile_ry", "sp", [-1, 1]], ["tile_rx", "sp", [-1, 1]], ["auto_unroll_max_step", "ot", 0], ["unroll_explicit", "ot", 1]]}, "result": [[5.23570703125], 0, 28.569811820983887, 1638614563.1461246], "version": 0.2, "tvm_version": "0.9.dev0"}
{"input": ["rocm -keys=rocm,gpu -max_num_threads=256 -mcpu=gfx906 -mtriple=amdgcn-amd-amdhsa-hcc -thread_warp_size=64", "conv2d_nchw.cuda", [["TENSOR", [128, 336, 21, 21], "float32"], ["TENSOR", [336, 336, 1, 1], "float32"], 1, 0, 1, "float32"], {}], "config": {"index": 4134672, "code_hash": null, "entity": [["tile_f", "sp", [-1, 24, 7, 2]], ["tile_y", "sp", [-1, 3, 7, 1]], ["tile_x", "sp", [-1, 3, 1, 7]], ["tile_rc", "sp", [-1, 14]], ["tile_ry", "sp", [-1, 1]], ["tile_rx", "sp", [-1, 1]], ["auto_unroll_max_step", "ot", 512], ["unroll_explicit", "ot", 1]]}, "result": [[0.1237972335], 0, 6.831464767456055, 1638614567.9874446], "version": 0.2, "tvm_version": "0.9.dev0"}
{"input": ["rocm -keys=rocm,gpu -max_num_threads=256 -mcpu=gfx906 -mtriple=amdgcn-amd-amdhsa-hcc -thread_warp_size=64", "conv2d_nchw.cuda", [["TENSOR", [128, 336, 21, 21], "float32"], ["TENSOR", [336, 336, 1, 1], "float32"], 1, 0, 1, "float32"], {}], "config": {"index": 2919888, "code_hash": null, "entity": [["tile_f", "sp", [-1, 3, 4, 1]], ["tile_y", "sp", [-1, 1, 3, 7]], ["tile_x", "sp", [-1, 7, 3, 1]], ["tile_rc", "sp", [-1, 1]], ["tile_ry", "sp", [-1, 1]], ["tile_rx", "sp", [-1, 1]], ["auto_unroll_max_step", "ot", 512], ["unroll_explicit", "ot", 1]]}, "result": [[0.40333197000000004], 0, 4.799776077270508, 1638614571.860143], "version": 0.2, "tvm_version": "0.9.dev0"}
{"input": ["rocm -keys=rocm,gpu -max_num_threads=256 -mcpu=gfx906 -mtriple=amdgcn-amd-amdhsa-hcc -thread_warp_size=64", "conv2d_nchw.cuda", [["TENSOR", [128, 336, 21, 21], "float32"], ["TENSOR", [336, 336, 1, 1], "float32"], 1, 0, 1, "float32"], {}], "config": {"index": 7531449, "code_hash": null, "entity": [["tile_f", "sp", [-1, 16, 1, 1]], ["tile_y", "sp", [-1, 1, 1, 3]], ["tile_x", "sp", [-1, 1, 21, 1]], ["tile_rc", "sp", [-1, 28]], ["tile_ry", "sp", [-1, 1]], ["tile_rx", "sp", [-1, 1]], ["auto_unroll_max_step", "ot", 1500], ["unroll_explicit", "ot", 1]]}, "result": [[0.111053375], 0, 3.8193323612213135, 1638614573.9939737], "version": 0.2, "tvm_version": "0.9.dev0"}
{"input": ["rocm -keys=rocm,gpu -max_num_threads=256 -mcpu=gfx906 -mtriple=amdgcn-amd-amdhsa-hcc -thread_warp_size=64", "conv2d_nchw.cuda", [["TENSOR", [128, 336, 21, 21], "float32"], ["TENSOR", [336, 336, 1, 1], "float32"], 1, 0, 1, "float32"], {}], "config": {"index": 4157608, "code_hash": null, "entity": [["tile_f", "sp", [-1, 14, 3, 2]], ["tile_y", "sp", [-1, 1, 1, 1]], ["tile_x", "sp", [-1, 1, 1, 1]], ["tile_rc", "sp", [-1, 16]], ["tile_ry", "sp", [-1, 1]], ["tile_rx", "sp", [-1, 1]], ["auto_unroll_max_step", "ot", 512], ["unroll_explicit", "ot", 1]]}, "result": [[0.23729020675], 0, 5.044912576675415, 1638614576.895462], "version": 0.2, "tvm_version": "0.9.dev0"}
{"input": ["rocm -keys=rocm,gpu -max_num_threads=256 -mcpu=gfx906 -mtriple=amdgcn-amd-amdhsa-hcc -thread_warp_size=64", "conv2d_nchw.cuda", [["TENSOR", [128, 336, 21, 21], "float32"], ["TENSOR", [336, 336, 1, 1], "float32"], 1, 0, 1, "float32"], {}], "config": {"index": 562816, "code_hash": null, "entity": [["tile_f", "sp", [-1, 84, 1, 1]], ["tile_y", "sp", [-1, 3, 1, 7]], ["tile_x", "sp", [-1, 1, 3, 7]], ["tile_rc", "sp", [-1, 4]], ["tile_ry", "sp", [-1, 1]], ["tile_rx", "sp", [-1, 1]], ["auto_unroll_max_step", "ot", 0], ["unroll_explicit", "ot", 1]]}, "result": [[2.8266079100000003], 0, 18.114917993545532, 1638614592.6443946], "version": 0.2, "tvm_version": "0.9.dev0"}
{"input": ["rocm -keys=rocm,gpu -max_num_threads=256 -mcpu=gfx906 -mtriple=amdgcn-amd-amdhsa-hcc -thread_warp_size=64", "conv2d_nchw.cuda", [["TENSOR", [128, 336, 21, 21], "float32"], ["TENSOR", [336, 336, 1, 1], "float32"], 1, 0, 1, "float32"], {}], "config": {"index": 5885101, "code_hash": null, "entity": [["tile_f", "sp", [-1, 7, 6, 1]], ["tile_y", "sp", [-1, 3, 1, 7]], ["tile_x", "sp", [-1, 1, 1, 1]], ["tile_rc", "sp", [-1, 2]], ["tile_ry", "sp", [-1, 1]], ["tile_rx", "sp", [-1, 1]], ["auto_unroll_max_step", "ot", 1500], ["unroll_explicit", "ot", 1]]}, "result": [[1.02219671625], 0, 8.49890398979187, 1638614599.436728], "version": 0.2, "tvm_version": "0.9.dev0"}
{"input": ["rocm -keys=rocm,gpu -max_num_threads=256 -mcpu=gfx906 -mtriple=amdgcn-amd-amdhsa-hcc -thread_warp_size=64", "conv2d_nchw.cuda", [["TENSOR", [128, 336, 21, 21], "float32"], ["TENSOR", [336, 336, 1, 1], "float32"], 1, 0, 1, "float32"], {}], "config": {"index": 3815650, "code_hash": null, "entity": [["tile_f", "sp", [-1, 12, 2, 7]], ["tile_y", "sp", [-1, 3, 1, 7]], ["tile_x", "sp", [-1, 1, 1, 3]], ["tile_rc", "sp", [-1, 8]], ["tile_ry", "sp", [-1, 1]], ["tile_rx", "sp", [-1, 1]], ["auto_unroll_max_step", "ot", 512], ["unroll_explicit", "ot", 1]]}, "result": [[2.5977902829999997], 0, 18.20326328277588, 1638614614.4802628], "version": 0.2, "tvm_version": "0.9.dev0"}
{"input": ["rocm -keys=rocm,gpu -max_num_threads=256 -mcpu=gfx906 -mtriple=amdgcn-amd-amdhsa-hcc -thread_warp_size=64", "conv2d_nchw.cuda", [["TENSOR", [128, 336, 21, 21], "float32"], ["TENSOR", [336, 336, 1, 1], "float32"], 1, 0, 1, "float32"], {}], "config": {"index": 1597584, "code_hash": null, "entity": [["tile_f", "sp", [-1, 3, 4, 14]], ["tile_y", "sp", [-1, 1, 3, 1]], ["tile_x", "sp", [-1, 7, 1, 1]], ["tile_rc", "sp", [-1, 24]], ["tile_ry", "sp", [-1, 1]], ["tile_rx", "sp", [-1, 1]], ["auto_unroll_max_step", "ot", 0], ["unroll_explicit", "ot", 1]]}, "result": [[0.73378881825], 0, 6.263258457183838, 1638614620.162823], "version": 0.2, "tvm_version": "0.9.dev0"}
{"input": ["rocm -keys=rocm,gpu -max_num_threads=256 -mcpu=gfx906 -mtriple=amdgcn-amd-amdhsa-hcc -thread_warp_size=64", "conv2d_nchw.cuda", [["TENSOR", [128, 336, 21, 21], "float32"], ["TENSOR", [336, 336, 1, 1], "float32"], 1, 0, 1, "float32"], {}], "config": {"index": 968773, "code_hash": null, "entity": [["tile_f", "sp", [-1, 2, 4, 42]], ["tile_y", "sp", [-1, 3, 1, 1]], ["tile_x", "sp", [-1, 1, 1, 7]], ["tile_rc", "sp", [-1, 8]], ["tile_ry", "sp", [-1, 1]], ["tile_rx", "sp", [-1, 1]], ["auto_unroll_max_step", "ot", 0], ["unroll_explicit", "ot", 1]]}, "result": [[1.7839265135], 0, 11.661945104598999, 1638614631.1394482], "version": 0.2, "tvm_version": "0.9.dev0"}
{"input": ["rocm -keys=rocm,gpu -max_num_threads=256 -mcpu=gfx906 -mtriple=amdgcn-amd-amdhsa-hcc -thread_warp_size=64", "conv2d_nchw.cuda", [["TENSOR", [128, 336, 21, 21], "float32"], ["TENSOR", [336, 336, 1, 1], "float32"], 1, 0, 1, "float32"], {}], "config": {"index": 5081055, "code_hash": null, "entity": [["tile_f", "sp", [-1, 7, 4, 2]], ["tile_y", "sp", [-1, 3, 1, 1]], ["tile_x", "sp", [-1, 3, 7, 1]], ["tile_rc", "sp", [-1, 56]], ["tile_ry", "sp", [-1, 1]], ["tile_rx", "sp", [-1, 1]], ["auto_unroll_max_step", "ot", 512], ["unroll_explicit", "ot", 1]]}, "result": [[0.6454482420000001], 0, 5.802088022232056, 1638614635.9177475], "version": 0.2, "tvm_version": "0.9.dev0"}
{"input": ["rocm -keys=rocm,gpu -max_num_threads=256 -mcpu=gfx906 -mtriple=amdgcn-amd-amdhsa-hcc -thread_warp_size=64", "conv2d_nchw.cuda", [["TENSOR", [128, 336, 21, 21], "float32"], ["TENSOR", [336, 336, 1, 1], "float32"], 1, 0, 1, "float32"], {}], "config": {"index": 3263587, "code_hash": null, "entity": [["tile_f", "sp", [-1, 2, 6, 14]], ["tile_y", "sp", [-1, 21, 1, 1]], ["tile_x", "sp", [-1, 1, 1, 7]], ["tile_rc", "sp", [-1, 3]], ["tile_ry", "sp", [-1, 1]], ["tile_rx", "sp", [-1, 1]], ["auto_unroll_max_step", "ot", 512], ["unroll_explicit", "ot", 1]]}, "result": [[0.61988879375], 0, 7.811954736709595, 1638614640.5993187], "version": 0.2, "tvm_version": "0.9.dev0"}
{"input": ["rocm -keys=rocm,gpu -max_num_threads=256 -mcpu=gfx906 -mtriple=amdgcn-amd-amdhsa-hcc -thread_warp_size=64", "conv2d_nchw.cuda", [["TENSOR", [128, 336, 21, 21], "float32"], ["TENSOR", [336, 336, 1, 1], "float32"], 1, 0, 1, "float32"], {}], "config": {"index": 343925, "code_hash": null, "entity": [["tile_f", "sp", [-1, 2, 12, 1]], ["tile_y", "sp", [-1, 1, 7, 1]], ["tile_x", "sp", [-1, 1, 7, 1]], ["tile_rc", "sp", [-1, 3]], ["tile_ry", "sp", [-1, 1]], ["tile_rx", "sp", [-1, 1]], ["auto_unroll_max_step", "ot", 0], ["unroll_explicit", "ot", 1]]}, "result": [[0.00949723625], 0, 2.034691333770752, 1638614642.313248], "version": 0.2, "tvm_version": "0.9.dev0"}
{"input": ["rocm -keys=rocm,gpu -max_num_threads=256 -mcpu=gfx906 -mtriple=amdgcn-amd-amdhsa-hcc -thread_warp_size=64", "conv2d_nchw.cuda", [["TENSOR", [128, 336, 21, 21], "float32"], ["TENSOR", [336, 336, 1, 1], "float32"], 1, 0, 1, "float32"], {}], "config": {"index": 6251376, "code_hash": null, "entity": [["tile_f", "sp", [-1, 12, 14, 1]], ["tile_y", "sp", [-1, 1, 7, 3]], ["tile_x", "sp", [-1, 1, 1, 3]], ["tile_rc", "sp", [-1, 4]], ["tile_ry", "sp", [-1, 1]], ["tile_rx", "sp", [-1, 1]], ["auto_unroll_max_step", "ot", 1500], ["unroll_explicit", "ot", 1]]}, "result": [[0.07274309525], 0, 2.6810426712036133, 1638614644.2500632], "version": 0.2, "tvm_version": "0.9.dev0"}
{"input": ["rocm -keys=rocm,gpu -max_num_threads=256 -mcpu=gfx906 -mtriple=amdgcn-amd-amdhsa-hcc -thread_warp_size=64", "conv2d_nchw.cuda", [["TENSOR", [128, 336, 21, 21], "float32"], ["TENSOR", [336, 336, 1, 1], "float32"], 1, 0, 1, "float32"], {}], "config": {"index": 1808095, "code_hash": null, "entity": [["tile_f", "sp", [-1, 1, 6, 8]], ["tile_y", "sp", [-1, 1, 1, 7]], ["tile_x", "sp", [-1, 1, 1, 3]], ["tile_rc", "sp", [-1, 28]], ["tile_ry", "sp", [-1, 1]], ["tile_rx", "sp", [-1, 1]], ["auto_unroll_max_step", "ot", 0], ["unroll_explicit", "ot", 1]]}, "result": [[0.6164542845], 0, 5.597073554992676, 1638614648.8864517], "version": 0.2, "tvm_version": "0.9.dev0"}
{"input": ["rocm -keys=rocm,gpu -max_num_threads=256 -mcpu=gfx906 -mtriple=amdgcn-amd-amdhsa-hcc -thread_warp_size=64", "conv2d_nchw.cuda", [["TENSOR", [128, 336, 21, 21], "float32"], ["TENSOR", [336, 336, 1, 1], "float32"], 1, 0, 1, "float32"], {}], "config": {"index": 4169355, "code_hash": null, "entity": [["tile_f", "sp", [-1, 6, 2, 2]], ["tile_y", "sp", [-1, 7, 3, 1]], ["tile_x", "sp", [-1, 3, 1, 1]], ["tile_rc", "sp", [-1, 16]], ["tile_ry", "sp", [-1, 1]], ["tile_rx", "sp", [-1, 1]], ["auto_unroll_max_step", "ot", 512], ["unroll_explicit", "ot", 1]]}, "result": [[1.9023378905], 0, 12.97989535331726, 1638614659.9347908], "version": 0.2, "tvm_version": "0.9.dev0"}
{"input": ["rocm -keys=rocm,gpu -max_num_threads=256 -mcpu=gfx906 -mtriple=amdgcn-amd-amdhsa-hcc -thread_warp_size=64", "conv2d_nchw.cuda", [["TENSOR", [128, 336, 21, 21], "float32"], ["TENSOR", [336, 336, 1, 1], "float32"], 1, 0, 1, "float32"], {}], "config": {"index": 5246718, "code_hash": null, "entity": [["tile_f", "sp", [-1, 3, 8, 1]], ["tile_y", "sp", [-1, 1, 1, 3]], ["tile_x", "sp", [-1, 1, 1, 3]], ["tile_rc", "sp", [-1, 84]], ["tile_ry", "sp", [-1, 1]], ["tile_rx", "sp", [-1, 1]], ["auto_unroll_max_step", "ot", 512], ["unroll_explicit", "ot", 1]]}, "result": [[0.072453018], 0, 3.5264639854431152, 1638614661.932821], "version": 0.2, "tvm_version": "0.9.dev0"}
{"input": ["rocm -keys=rocm,gpu -max_num_threads=256 -mcpu=gfx906 -mtriple=amdgcn-amd-amdhsa-hcc -thread_warp_size=64", "conv2d_nchw.cuda", [["TENSOR", [128, 336, 21, 21], "float32"], ["TENSOR", [336, 336, 1, 1], "float32"], 1, 0, 1, "float32"], {}], "config": {"index": 4771337, "code_hash": null, "entity": [["tile_f", "sp", [-1, 3, 1, 2]], ["tile_y", "sp", [-1, 1, 21, 1]], ["tile_x", "sp", [-1, 1, 3, 1]], ["tile_rc", "sp", [-1, 42]], ["tile_ry", "sp", [-1, 1]], ["tile_rx", "sp", [-1, 1]], ["auto_unroll_max_step", "ot", 512], ["unroll_explicit", "ot", 1]]}, "result": [[0.015162218285714285], 0, 2.453935146331787, 1638614673.8736649], "version": 0.2, "tvm_version": "0.9.dev0"}
{"input": ["rocm -keys=rocm,gpu -max_num_threads=256 -mcpu=gfx906 -mtriple=amdgcn-amd-amdhsa-hcc -thread_warp_size=64", "conv2d_nchw.cuda", [["TENSOR", [128, 336, 21, 21], "float32"], ["TENSOR", [336, 336, 1, 1], "float32"], 1, 0, 1, "float32"], {}], "config": {"index": 2895442, "code_hash": null, "entity": [["tile_f", "sp", [-1, 56, 2, 3]], ["tile_y", "sp", [-1, 7, 1, 1]], ["tile_x", "sp", [-1, 21, 1, 1]], ["tile_rc", "sp", [-1, 1]], ["tile_ry", "sp", [-1, 1]], ["tile_rx", "sp", [-1, 1]], ["auto_unroll_max_step", "ot", 512], ["unroll_explicit", "ot", 1]]}, "result": [[3.3249541015], 0, 24.85778546333313, 1638614692.4610393], "version": 0.2, "tvm_version": "0.9.dev0"}
{"input": ["rocm -keys=rocm,gpu -max_num_threads=256 -mcpu=gfx906 -mtriple=amdgcn-amd-amdhsa-hcc -thread_warp_size=64", "conv2d_nchw.cuda", [["TENSOR", [128, 336, 21, 21], "float32"], ["TENSOR", [336, 336, 1, 1], "float32"], 1, 0, 1, "float32"], {}], "config": {"index": 3624609, "code_hash": null, "entity": [["tile_f", "sp", [-1, 42, 2, 4]], ["tile_y", "sp", [-1, 1, 21, 1]], ["tile_x", "sp", [-1, 1, 3, 1]], ["tile_rc", "sp", [-1, 7]], ["tile_ry", "sp", [-1, 1]], ["tile_rx", "sp", [-1, 1]], ["auto_unroll_max_step", "ot", 512], ["unroll_explicit", "ot", 1]]}, "result": [[0.112078926], 0, 4.15506911277771, 1638614694.8103514], "version": 0.2, "tvm_version": "0.9.dev0"}
{"input": ["rocm -keys=rocm,gpu -max_num_threads=256 -mcpu=gfx906 -mtriple=amdgcn-amd-amdhsa-hcc -thread_warp_size=64", "conv2d_nchw.cuda", [["TENSOR", [128, 336, 21, 21], "float32"], ["TENSOR", [336, 336, 1, 1], "float32"], 1, 0, 1, "float32"], {}], "config": {"index": 163406, "code_hash": null, "entity": [["tile_f", "sp", [-1, 3, 1, 14]], ["tile_y", "sp", [-1, 21, 1, 1]], ["tile_x", "sp", [-1, 7, 1, 1]], ["tile_rc", "sp", [-1, 2]], ["tile_ry", "sp", [-1, 1]], ["tile_rx", "sp", [-1, 1]], ["auto_unroll_max_step", "ot", 0], ["unroll_explicit", "ot", 1]]}, "result": [[2.41878710925], 0, 16.145516395568848, 1638614708.5072522], "version": 0.2, "tvm_version": "0.9.dev0"}
{"input": ["rocm -keys=rocm,gpu -max_num_threads=256 -mcpu=gfx906 -mtriple=amdgcn-amd-amdhsa-hcc -thread_warp_size=64", "conv2d_nchw.cuda", [["TENSOR", [128, 336, 21, 21], "float32"], ["TENSOR", [336, 336, 1, 1], "float32"], 1, 0, 1, "float32"], {}], "config": {"index": 1312643, "code_hash": null, "entity": [["tile_f", "sp", [-1, 4, 1, 1]], ["tile_y", "sp", [-1, 1, 21, 1]], ["tile_x", "sp", [-1, 7, 1, 1]], ["tile_rc", "sp", [-1, 16]], ["tile_ry", "sp", [-1, 1]], ["tile_rx", "sp", [-1, 1]], ["auto_unroll_max_step", "ot", 0], ["unroll_explicit", "ot", 1]]}, "result": [[0.032093238749999996], 0, 2.1193885803222656, 1638614710.2474725], "version": 0.2, "tvm_version": "0.9.dev0"}
{"input": ["rocm -keys=rocm,gpu -max_num_threads=256 -mcpu=gfx906 -mtriple=amdgcn-amd-amdhsa-hcc -thread_warp_size=64", "conv2d_nchw.cuda", [["TENSOR", [128, 336, 21, 21], "float32"], ["TENSOR", [336, 336, 1, 1], "float32"], 1, 0, 1, "float32"], {}], "config": {"index": 5533411, "code_hash": null, "entity": [["tile_f", "sp", [-1, 7, 4, 1]], ["tile_y", "sp", [-1, 1, 1, 3]], ["tile_x", "sp", [-1, 1, 1, 3]], ["tile_rc", "sp", [-1, 168]], ["tile_ry", "sp", [-1, 1]], ["tile_rx", "sp", [-1, 1]], ["auto_unroll_max_step", "ot", 512], ["unroll_explicit", "ot", 1]]}, "result": [[2.770953369], 0, 16.91157555580139, 1638614725.672874], "version": 0.2, "tvm_version": "0.9.dev0"}
{"input": ["rocm -keys=rocm,gpu -max_num_threads=256 -mcpu=gfx906 -mtriple=amdgcn-amd-amdhsa-hcc -thread_warp_size=64", "conv2d_nchw.cuda", [["TENSOR", [128, 336, 21, 21], "float32"], ["TENSOR", [336, 336, 1, 1], "float32"], 1, 0, 1, "float32"], {}], "config": {"index": 5314617, "code_hash": null, "entity": [["tile_f", "sp", [-1, 1, 42, 2]], ["tile_y", "sp", [-1, 7, 1, 1]], ["tile_x", "sp", [-1, 3, 1, 1]], ["tile_rc", "sp", [-1, 112]], ["tile_ry", "sp", [-1, 1]], ["tile_rx", "sp", [-1, 1]], ["auto_unroll_max_step", "ot", 512], ["unroll_explicit", "ot", 1]]}, "result": [[0.12075885], 0, 3.229769706726074, 1638614729.4820342], "version": 0.2, "tvm_version": "0.9.dev0"}
{"input": ["rocm -keys=rocm,gpu -max_num_threads=256 -mcpu=gfx906 -mtriple=amdgcn-amd-amdhsa-hcc -thread_warp_size=64", "conv2d_nchw.cuda", [["TENSOR", [128, 336, 21, 21], "float32"], ["TENSOR", [336, 336, 1, 1], "float32"], 1, 0, 1, "float32"], {}], "config": {"index": 732146, "code_hash": null, "entity": [["tile_f", "sp", [-1, 2, 1, 3]], ["tile_y", "sp", [-1, 1, 7, 3]], ["tile_x", "sp", [-1, 3, 1, 1]], ["tile_rc", "sp", [-1, 7]], ["tile_ry", "sp", [-1, 1]], ["tile_rx", "sp", [-1, 1]], ["auto_unroll_max_step", "ot", 0], ["unroll_explicit", "ot", 1]]}, "result": [[0.13070892325], 0, 3.0946900844573975, 1638614731.6760793], "version": 0.2, "tvm_version": "0.9.dev0"}
{"input": ["rocm -keys=rocm,gpu -max_num_threads=256 -mcpu=gfx906 -mtriple=amdgcn-amd-amdhsa-hcc -thread_warp_size=64", "conv2d_nchw.cuda", [["TENSOR", [128, 336, 21, 21], "float32"], ["TENSOR", [336, 336, 1, 1], "float32"], 1, 0, 1, "float32"], {}], "config": {"index": 6808028, "code_hash": null, "entity": [["tile_f", "sp", [-1, 2, 24, 1]], ["tile_y", "sp", [-1, 3, 1, 7]], ["tile_x", "sp", [-1, 3, 7, 1]], ["tile_rc", "sp", [-1, 12]], ["tile_ry", "sp", [-1, 1]], ["tile_rx", "sp", [-1, 1]], ["auto_unroll_max_step", "ot", 1500], ["unroll_explicit", "ot", 1]]}, "result": [[0.70943395975], 0, 6.182604074478149, 1638614736.8046117], "version": 0.2, "tvm_version": "0.9.dev0"}
{"input": ["rocm -keys=rocm,gpu -max_num_threads=256 -mcpu=gfx906 -mtriple=amdgcn-amd-amdhsa-hcc -thread_warp_size=64", "conv2d_nchw.cuda", [["TENSOR", [128, 336, 21, 21], "float32"], ["TENSOR", [336, 336, 1, 1], "float32"], 1, 0, 1, "float32"], {}], "config": {"index": 500185, "code_hash": null, "entity": [["tile_f", "sp", [-1, 8, 21, 1]], ["tile_y", "sp", [-1, 3, 1, 7]], ["tile_x", "sp", [-1, 3, 7, 1]], ["tile_rc", "sp", [-1, 4]], ["tile_ry", "sp", [-1, 1]], ["tile_rx", "sp", [-1, 1]], ["auto_unroll_max_step", "ot", 0], ["unroll_explicit", "ot", 1]]}, "result": [[0.09908822625000001], 0, 3.225104808807373, 1638614738.8864434], "version": 0.2, "tvm_version": "0.9.dev0"}
{"input": ["rocm -keys=rocm,gpu -max_num_threads=256 -mcpu=gfx906 -mtriple=amdgcn-amd-amdhsa-hcc -thread_warp_size=64", "conv2d_nchw.cuda", [["TENSOR", [128, 336, 21, 21], "float32"], ["TENSOR", [336, 336, 1, 1], "float32"], 1, 0, 1, "float32"], {}], "config": {"index": 6169398, "code_hash": null, "entity": [["tile_f", "sp", [-1, 1, 7, 12]], ["tile_y", "sp", [-1, 1, 21, 1]], ["tile_x", "sp", [-1, 1, 1, 1]], ["tile_rc", "sp", [-1, 4]], ["tile_ry", "sp", [-1, 1]], ["tile_rx", "sp", [-1, 1]], ["auto_unroll_max_step", "ot", 1500], ["unroll_explicit", "ot", 1]]}, "result": [[0.012673669555555555], 0, 2.0277786254882812, 1638614740.5726843], "version": 0.2, "tvm_version": "0.9.dev0"}
{"input": ["rocm -keys=rocm,gpu -max_num_threads=256 -mcpu=gfx906 -mtriple=amdgcn-amd-amdhsa-hcc -thread_warp_size=64", "conv2d_nchw.cuda", [["TENSOR", [128, 336, 21, 21], "float32"], ["TENSOR", [336, 336, 1, 1], "float32"], 1, 0, 1, "float32"], {}], "config": {"index": 3165463, "code_hash": null, "entity": [["tile_f", "sp", [-1, 2, 7, 6]], ["tile_y", "sp", [-1, 1, 3, 1]], ["tile_x", "sp", [-1, 3, 1, 1]], ["tile_rc", "sp", [-1, 3]], ["tile_ry", "sp", [-1, 1]], ["tile_rx", "sp", [-1, 1]], ["auto_unroll_max_step", "ot", 512], ["unroll_explicit", "ot", 1]]}, "result": [[0.013418598555555557], 0, 2.0623698234558105, 1638614742.2435079], "version": 0.2, "tvm_version": "0.9.dev0"}
{"input": ["rocm -keys=rocm,gpu -max_num_threads=256 -mcpu=gfx906 -mtriple=amdgcn-amd-amdhsa-hcc -thread_warp_size=64", "conv2d_nchw.cuda", [["TENSOR", [128, 336, 21, 21], "float32"], ["TENSOR", [336, 336, 1, 1], "float32"], 1, 0, 1, "float32"], {}], "config": {"index": 2311549, "code_hash": null, "entity": [["tile_f", "sp", [-1, 7, 1, 12]], ["tile_y", "sp", [-1, 1, 1, 21]], ["tile_x", "sp", [-1, 3, 1, 1]], ["tile_rc", "sp", [-1, 84]], ["tile_ry", "sp", [-1, 1]], ["tile_rx", "sp", [-1, 1]], ["auto_unroll_max_step", "ot", 0], ["unroll_explicit", "ot", 1]]}, "result": [[36.295421875], 0, 183.6910343170166, 1638614925.3380268], "version": 0.2, "tvm_version": "0.9.dev0"}
{"input": ["rocm -keys=rocm,gpu -max_num_threads=256 -mcpu=gfx906 -mtriple=amdgcn-amd-amdhsa-hcc -thread_warp_size=64", "conv2d_nchw.cuda", [["TENSOR", [128, 336, 21, 21], "float32"], ["TENSOR", [336, 336, 1, 1], "float32"], 1, 0, 1, "float32"], {}], "config": {"index": 1481299, "code_hash": null, "entity": [["tile_f", "sp", [-1, 3, 16, 1]], ["tile_y", "sp", [-1, 7, 3, 1]], ["tile_x", "sp", [-1, 7, 3, 1]], ["tile_rc", "sp", [-1, 21]], ["tile_ry", "sp", [-1, 1]], ["tile_rx", "sp", [-1, 1]], ["auto_unroll_max_step", "ot", 0], ["unroll_explicit", "ot", 1]]}, "result": [[0.8610127562500001], 0, 8.204391717910767, 1638614932.230812], "version": 0.2, "tvm_version": "0.9.dev0"}
{"input": ["rocm -keys=rocm,gpu -max_num_threads=256 -mcpu=gfx906 -mtriple=amdgcn-amd-amdhsa-hcc -thread_warp_size=64", "conv2d_nchw.cuda", [["TENSOR", [128, 336, 21, 21], "float32"], ["TENSOR", [336, 336, 1, 1], "float32"], 1, 0, 1, "float32"], {}], "config": {"index": 4817127, "code_hash": null, "entity": [["tile_f", "sp", [-1, 12, 1, 1]], ["tile_y", "sp", [-1, 7, 1, 3]], ["tile_x", "sp", [-1, 1, 1, 3]], ["tile_rc", "sp", [-1, 42]], ["tile_ry", "sp", [-1, 1]], ["tile_rx", "sp", [-1, 1]], ["auto_unroll_max_step", "ot", 512], ["unroll_explicit", "ot", 1]]}, "result": [[7.26767871075], 0, 41.05073618888855, 1638614970.1485713], "version": 0.2, "tvm_version": "0.9.dev0"}
{"input": ["rocm -keys=rocm,gpu -max_num_threads=256 -mcpu=gfx906 -mtriple=amdgcn-amd-amdhsa-hcc -thread_warp_size=64", "conv2d_nchw.cuda", [["TENSOR", [128, 336, 21, 21], "float32"], ["TENSOR", [336, 336, 1, 1], "float32"], 1, 0, 1, "float32"], {}], "config": {"index": 695516, "code_hash": null, "entity": [["tile_f", "sp", [-1, 1, 1, 168]], ["tile_y", "sp", [-1, 1, 1, 3]], ["tile_x", "sp", [-1, 3, 1, 7]], ["tile_rc", "sp", [-1, 6]], ["tile_ry", "sp", [-1, 1]], ["tile_rx", "sp", [-1, 1]], ["auto_unroll_max_step", "ot", 0], ["unroll_explicit", "ot", 1]]}, "result": [[4.0405390625], 0, 22.772737741470337, 1638614992.006024], "version": 0.2, "tvm_version": "0.9.dev0"}
{"input": ["rocm -keys=rocm,gpu -max_num_threads=256 -mcpu=gfx906 -mtriple=amdgcn-amd-amdhsa-hcc -thread_warp_size=64", "conv2d_nchw.cuda", [["TENSOR", [128, 336, 21, 21], "float32"], ["TENSOR", [336, 336, 1, 1], "float32"], 1, 0, 1, "float32"], {}], "config": {"index": 3611916, "code_hash": null, "entity": [["tile_f", "sp", [-1, 7, 1, 16]], ["tile_y", "sp", [-1, 3, 1, 1]], ["tile_x", "sp", [-1, 21, 1, 1]], ["tile_rc", "sp", [-1, 7]], ["tile_ry", "sp", [-1, 1]], ["tile_rx", "sp", [-1, 1]], ["auto_unroll_max_step", "ot", 512], ["unroll_explicit", "ot", 1]]}, "result": [[3.8223608397500004], 0, 26.658779859542847, 1638615012.7091856], "version": 0.2, "tvm_version": "0.9.dev0"}
{"input": ["rocm -keys=rocm,gpu -max_num_threads=256 -mcpu=gfx906 -mtriple=amdgcn-amd-amdhsa-hcc -thread_warp_size=64", "conv2d_nchw.cuda", [["TENSOR", [128, 336, 21, 21], "float32"], ["TENSOR", [336, 336, 1, 1], "float32"], 1, 0, 1, "float32"], {}], "config": {"index": 1306960, "code_hash": null, "entity": [["tile_f", "sp", [-1, 1, 7, 16]], ["tile_y", "sp", [-1, 3, 1, 7]], ["tile_x", "sp", [-1, 3, 1, 1]], ["tile_rc", "sp", [-1, 16]], ["tile_ry", "sp", [-1, 1]], ["tile_rx", "sp", [-1, 1]], ["auto_unroll_max_step", "ot", 0], ["unroll_explicit", "ot", 1]]}, "result": [[1.05278552225], 0, 7.852658033370972, 1638615020.038438], "version": 0.2, "tvm_version": "0.9.dev0"}
{"input": ["rocm -keys=rocm,gpu -max_num_threads=256 -mcpu=gfx906 -mtriple=amdgcn-amd-amdhsa-hcc -thread_warp_size=64", "conv2d_nchw.cuda", [["TENSOR", [128, 336, 21, 21], "float32"], ["TENSOR", [336, 336, 1, 1], "float32"], 1, 0, 1, "float32"], {}], "config": {"index": 4705328, "code_hash": null, "entity": [["tile_f", "sp", [-1, 2, 21, 2]], ["tile_y", "sp", [-1, 7, 1, 1]], ["tile_x", "sp", [-1, 3, 1, 7]], ["tile_rc", "sp", [-1, 28]], ["tile_ry", "sp", [-1, 1]], ["tile_rx", "sp", [-1, 1]], ["auto_unroll_max_step", "ot", 512], ["unroll_explicit", "ot", 1]]}, "result": [[0.94580871575], 0, 10.764689445495605, 1638615026.6920295], "version": 0.2, "tvm_version": "0.9.dev0"}
{"input": ["rocm -keys=rocm,gpu -max_num_threads=256 -mcpu=gfx906 -mtriple=amdgcn-amd-amdhsa-hcc -thread_warp_size=64", "conv2d_nchw.cuda", [["TENSOR", [128, 336, 21, 21], "float32"], ["TENSOR", [336, 336, 1, 1], "float32"], 1, 0, 1, "float32"], {}], "config": {"index": 4553823, "code_hash": null, "entity": [["tile_f", "sp", [-1, 2, 4, 14]], ["tile_y", "sp", [-1, 21, 1, 1]], ["tile_x", "sp", [-1, 1, 1, 7]], ["tile_rc", "sp", [-1, 24]], ["tile_ry", "sp", [-1, 1]], ["tile_rx", "sp", [-1, 1]], ["auto_unroll_max_step", "ot", 512], ["unroll_explicit", "ot", 1]]}, "result": [[4.5063881835], 0, 27.040507793426514, 1638615050.6756277], "version": 0.2, "tvm_version": "0.9.dev0"}
{"input": ["rocm -keys=rocm,gpu -max_num_threads=256 -mcpu=gfx906 -mtriple=amdgcn-amd-amdhsa-hcc -thread_warp_size=64", "conv2d_nchw.cuda", [["TENSOR", [128, 336, 21, 21], "float32"], ["TENSOR", [336, 336, 1, 1], "float32"], 1, 0, 1, "float32"], {}], "config": {"index": 929708, "code_hash": null, "entity": [["tile_f", "sp", [-1, 2, 24, 1]], ["tile_y", "sp", [-1, 1, 1, 7]], ["tile_x", "sp", [-1, 3, 7, 1]], ["tile_rc", "sp", [-1, 8]], ["tile_ry", "sp", [-1, 1]], ["tile_rx", "sp", [-1, 1]], ["auto_unroll_max_step", "ot", 0], ["unroll_explicit", "ot", 1]]}, "result": [[0.004072195518518519], 0, 2.0649847984313965, 1638615052.3202322], "version": 0.2, "tvm_version": "0.9.dev0"}
{"input": ["rocm -keys=rocm,gpu -max_num_threads=256 -mcpu=gfx906 -mtriple=amdgcn-amd-amdhsa-hcc -thread_warp_size=64", "conv2d_nchw.cuda", [["TENSOR", [128, 336, 21, 21], "float32"], ["TENSOR", [336, 336, 1, 1], "float32"], 1, 0, 1, "float32"], {}], "config": {"index": 3456419, "code_hash": null, "entity": [["tile_f", "sp", [-1, 3, 16, 1]], ["tile_y", "sp", [-1, 1, 1, 7]], ["tile_x", "sp", [-1, 3, 1, 1]], ["tile_rc", "sp", [-1, 6]], ["tile_ry", "sp", [-1, 1]], ["tile_rx", "sp", [-1, 1]], ["auto_unroll_max_step", "ot", 512], ["unroll_explicit", "ot", 1]]}, "result": [[0.18165237425], 0, 3.388657569885254, 1638615054.755959], "version": 0.2, "tvm_version": "0.9.dev0"}
{"input": ["rocm -keys=rocm,gpu -max_num_threads=256 -mcpu=gfx906 -mtriple=amdgcn-amd-amdhsa-hcc -thread_warp_size=64", "conv2d_nchw.cuda", [["TENSOR", [128, 336, 21, 21], "float32"], ["TENSOR", [336, 336, 1, 1], "float32"], 1, 0, 1, "float32"], {}], "config": {"index": 3112637, "code_hash": null, "entity": [["tile_f", "sp", [-1, 12, 2, 2]], ["tile_y", "sp", [-1, 1, 7, 1]], ["tile_x", "sp", [-1, 1, 7, 3]], ["tile_rc", "sp", [-1, 2]], ["tile_ry", "sp", [-1, 1]], ["tile_rx", "sp", [-1, 1]], ["auto_unroll_max_step", "ot", 512], ["unroll_explicit", "ot", 1]]}, "result": [[0.11523260475], 0, 2.711503028869629, 1638615056.9017305], "version": 0.2, "tvm_version": "0.9.dev0"}
{"input": ["rocm -keys=rocm,gpu -max_num_threads=256 -mcpu=gfx906 -mtriple=amdgcn-amd-amdhsa-hcc -thread_warp_size=64", "conv2d_nchw.cuda", [["TENSOR", [128, 336, 21, 21], "float32"], ["TENSOR", [336, 336, 1, 1], "float32"], 1, 0, 1, "float32"], {}], "config": {"index": 161853, "code_hash": null, "entity": [["tile_f", "sp", [-1, 42, 1, 1]], ["tile_y", "sp", [-1, 3, 1, 1]], ["tile_x", "sp", [-1, 7, 1, 1]], ["tile_rc", "sp", [-1, 2]], ["tile_ry", "sp", [-1, 1]], ["tile_rx", "sp", [-1, 1]], ["auto_unroll_max_step", "ot", 0], ["unroll_explicit", "ot", 1]]}, "result": [[2.7471628417500003], 0, 23.497750282287598, 1638615072.1907065], "version": 0.2, "tvm_version": "0.9.dev0"}
{"input": ["rocm -keys=rocm,gpu -max_num_threads=256 -mcpu=gfx906 -mtriple=amdgcn-amd-amdhsa-hcc -thread_warp_size=64", "conv2d_nchw.cuda", [["TENSOR", [128, 336, 21, 21], "float32"], ["TENSOR", [336, 336, 1, 1], "float32"], 1, 0, 1, "float32"], {}], "config": {"index": 1280790, "code_hash": null, "entity": [["tile_f", "sp", [-1, 6, 7, 1]], ["tile_y", "sp", [-1, 1, 1, 21]], ["tile_x", "sp", [-1, 1, 3, 7]], ["tile_rc", "sp", [-1, 14]], ["tile_ry", "sp", [-1, 1]], ["tile_rx", "sp", [-1, 1]], ["auto_unroll_max_step", "ot", 0], ["unroll_explicit", "ot", 1]]}, "result": [[0.88561090075], 0, 6.654021501541138, 1638615078.2055643], "version": 0.2, "tvm_version": "0.9.dev0"}
{"input": ["rocm -keys=rocm,gpu -max_num_threads=256 -mcpu=gfx906 -mtriple=amdgcn-amd-amdhsa-hcc -thread_warp_size=64", "conv2d_nchw.cuda", [["TENSOR", [128, 336, 21, 21], "float32"], ["TENSOR", [336, 336, 1, 1], "float32"], 1, 0, 1, "float32"], {}], "config": {"index": 1483195, "code_hash": null, "entity": [["tile_f", "sp", [-1, 6, 14, 4]], ["tile_y", "sp", [-1, 1, 21, 1]], ["tile_x", "sp", [-1, 7, 3, 1]], ["tile_rc", "sp", [-1, 21]], ["tile_ry", "sp", [-1, 1]], ["tile_rx", "sp", [-1, 1]], ["auto_unroll_max_step", "ot", 0], ["unroll_explicit", "ot", 1]]}, "result": [[0.07332546975], 0, 2.999154567718506, 1638615080.1406322], "version": 0.2, "tvm_version": "0.9.dev0"}
{"input": ["rocm -keys=rocm,gpu -max_num_threads=256 -mcpu=gfx906 -mtriple=amdgcn-amd-amdhsa-hcc -thread_warp_size=64", "conv2d_nchw.cuda", [["TENSOR", [128, 336, 21, 21], "float32"], ["TENSOR", [336, 336, 1, 1], "float32"], 1, 0, 1, "float32"], {}], "config": {"index": 4368552, "code_hash": null, "entity": [["tile_f", "sp", [-1, 1, 4, 84]], ["tile_y", "sp", [-1, 1, 21, 1]], ["tile_x", "sp", [-1, 3, 7, 1]], ["tile_rc", "sp", [-1, 21]], ["tile_ry", "sp", [-1, 1]], ["tile_rx", "sp", [-1, 1]], ["auto_unroll_max_step", "ot", 512], ["unroll_explicit", "ot", 1]]}, "result": [[0.38804666125], 0, 5.488103866577148, 1638615083.673593], "version": 0.2, "tvm_version": "0.9.dev0"}
{"input": ["rocm -keys=rocm,gpu -max_num_threads=256 -mcpu=gfx906 -mtriple=amdgcn-amd-amdhsa-hcc -thread_warp_size=64", "conv2d_nchw.cuda", [["TENSOR", [128, 336, 21, 21], "float32"], ["TENSOR", [336, 336, 1, 1], "float32"], 1, 0, 1, "float32"], {}], "config": {"index": 1140659, "code_hash": null, "entity": [["tile_f", "sp", [-1, 2, 1, 24]], ["tile_y", "sp", [-1, 1, 3, 1]], ["tile_x", "sp", [-1, 1, 1, 21]], ["tile_rc", "sp", [-1, 12]], ["tile_ry", "sp", [-1, 1]], ["tile_rx", "sp", [-1, 1]], ["auto_unroll_max_step", "ot", 0], ["unroll_explicit", "ot", 1]]}, "result": [[1.1413272705], 0, 7.773720026016235, 1638615091.0071027], "version": 0.2, "tvm_version": "0.9.dev0"}
{"input": ["rocm -keys=rocm,gpu -max_num_threads=256 -mcpu=gfx906 -mtriple=amdgcn-amd-amdhsa-hcc -thread_warp_size=64", "conv2d_nchw.cuda", [["TENSOR", [128, 336, 21, 21], "float32"], ["TENSOR", [336, 336, 1, 1], "float32"], 1, 0, 1, "float32"], {}], "config": {"index": 3646173, "code_hash": null, "entity": [["tile_f", "sp", [-1, 42, 1, 1]], ["tile_y", "sp", [-1, 1, 1, 21]], ["tile_x", "sp", [-1, 1, 7, 1]], ["tile_rc", "sp", [-1, 7]], ["tile_ry", "sp", [-1, 1]], ["tile_rx", "sp", [-1, 1]], ["auto_unroll_max_step", "ot", 512], ["unroll_explicit", "ot", 1]]}, "result": [[0.5782700805], 0, 5.479708909988403, 1638615095.4570599], "version": 0.2, "tvm_version": "0.9.dev0"}
{"input": ["rocm -keys=rocm,gpu -max_num_threads=256 -mcpu=gfx906 -mtriple=amdgcn-amd-amdhsa-hcc -thread_warp_size=64", "conv2d_nchw.cuda", [["TENSOR", [128, 336, 21, 21], "float32"], ["TENSOR", [336, 336, 1, 1], "float32"], 1, 0, 1, "float32"], {}], "config": {"index": 7286846, "code_hash": null, "entity": [["tile_f", "sp", [-1, 6, 56, 1]], ["tile_y", "sp", [-1, 1, 3, 1]], ["tile_x", "sp", [-1, 3, 1, 7]], ["tile_rc", "sp", [-1, 21]], ["tile_ry", "sp", [-1, 1]], ["tile_rx", "sp", [-1, 1]], ["auto_unroll_max_step", "ot", 1500], ["unroll_explicit", "ot", 1]]}, "result": [[1.23989892575], 0, 8.993033170700073, 1638615103.2544045], "version": 0.2, "tvm_version": "0.9.dev0"}
{"input": ["rocm -keys=rocm,gpu -max_num_threads=256 -mcpu=gfx906 -mtriple=amdgcn-amd-amdhsa-hcc -thread_warp_size=64", "conv2d_nchw.cuda", [["TENSOR", [128, 336, 21, 21], "float32"], ["TENSOR", [336, 336, 1, 1], "float32"], 1, 0, 1, "float32"], {}], "config": {"index": 366391, "code_hash": null, "entity": [["tile_f", "sp", [-1, 1, 2, 2]], ["tile_y", "sp", [-1, 1, 3, 7]], ["tile_x", "sp", [-1, 1, 21, 1]], ["tile_rc", "sp", [-1, 3]], ["tile_ry", "sp", [-1, 1]], ["tile_rx", "sp", [-1, 1]], ["auto_unroll_max_step", "ot", 0], ["unroll_explicit", "ot", 1]]}, "result": [[0.037200641500000006], 0, 2.1091036796569824, 1638615105.0110953], "version": 0.2, "tvm_version": "0.9.dev0"}
{"input": ["rocm -keys=rocm,gpu -max_num_threads=256 -mcpu=gfx906 -mtriple=amdgcn-amd-amdhsa-hcc -thread_warp_size=64", "conv2d_nchw.cuda", [["TENSOR", [128, 336, 21, 21], "float32"], ["TENSOR", [336, 336, 1, 1], "float32"], 1, 0, 1, "float32"], {}], "config": {"index": 193102, "code_hash": null, "entity": [["tile_f", "sp", [-1, 1, 4, 14]], ["tile_y", "sp", [-1, 1, 21, 1]], ["tile_x", "sp", [-1, 7, 3, 1]], ["tile_rc", "sp", [-1, 2]], ["tile_ry", "sp", [-1, 1]], ["tile_rx", "sp", [-1, 1]], ["auto_unroll_max_step", "ot", 0], ["unroll_explicit", "ot", 1]]}, "result": [[0.036351215250000006], 0, 2.5327088832855225, 1638615106.7581553], "version": 0.2, "tvm_version": "0.9.dev0"}
{"input": ["rocm -keys=rocm,gpu -max_num_threads=256 -mcpu=gfx906 -mtriple=amdgcn-amd-amdhsa-hcc -thread_warp_size=64", "conv2d_nchw.cuda", [["TENSOR", [128, 336, 21, 21], "float32"], ["TENSOR", [336, 336, 1, 1], "float32"], 1, 0, 1, "float32"], {}], "config": {"index": 4308945, "code_hash": null, "entity": [["tile_f", "sp", [-1, 2, 7, 4]], ["tile_y", "sp", [-1, 1, 3, 7]], ["tile_x", "sp", [-1, 1, 1, 1]], ["tile_rc", "sp", [-1, 21]], ["tile_ry", "sp", [-1, 1]], ["tile_rx", "sp", [-1, 1]], ["auto_unroll_max_step", "ot", 512], ["unroll_explicit", "ot", 1]]}, "result": [[0.15381602475], 0, 3.246920347213745, 1638615109.10822], "version": 0.2, "tvm_version": "0.9.dev0"}
{"input": ["rocm -keys=rocm,gpu -max_num_threads=256 -mcpu=gfx906 -mtriple=amdgcn-amd-amdhsa-hcc -thread_warp_size=64", "conv2d_nchw.cuda", [["TENSOR", [128, 336, 21, 21], "float32"], ["TENSOR", [336, 336, 1, 1], "float32"], 1, 0, 1, "float32"], {}], "config": {"index": 2520975, "code_hash": null, "entity": [["tile_f", "sp", [-1, 1, 6, 8]], ["tile_y", "sp", [-1, 7, 3, 1]], ["tile_x", "sp", [-1, 1, 1, 3]], ["tile_rc", "sp", [-1, 112]], ["tile_ry", "sp", [-1, 1]], ["tile_rx", "sp", [-1, 1]], ["auto_unroll_max_step", "ot", 0], ["unroll_explicit", "ot", 1]]}, "result": [[1.0279584959999999], 0, 8.495314121246338, 1638615116.315], "version": 0.2, "tvm_version": "0.9.dev0"}
{"input": ["rocm -keys=rocm,gpu -max_num_threads=256 -mcpu=gfx906 -mtriple=amdgcn-amd-amdhsa-hcc -thread_warp_size=64", "conv2d_nchw.cuda", [["TENSOR", [128, 336, 21, 21], "float32"], ["TENSOR", [336, 336, 1, 1], "float32"], 1, 0, 1, "float32"], {}], "config": {"index": 5923323, "code_hash": null, "entity": [["tile_f", "sp", [-1, 3, 14, 2]], ["tile_y", "sp", [-1, 3, 1, 1]], ["tile_x", "sp", [-1, 7, 3, 1]], ["tile_rc", "sp", [-1, 2]], ["tile_ry", "sp", [-1, 1]], ["tile_rx", "sp", [-1, 1]], ["auto_unroll_max_step", "ot", 1500], ["unroll_explicit", "ot", 1]]}, "result": [[0.11611743149999999], 0, 3.2094526290893555, 1638615118.8928542], "version": 0.2, "tvm_version": "0.9.dev0"}
{"input": ["rocm -keys=rocm,gpu -max_num_threads=256 -mcpu=gfx906 -mtriple=amdgcn-amd-amdhsa-hcc -thread_warp_size=64", "conv2d_nchw.cuda", [["TENSOR", [128, 336, 21, 21], "float32"], ["TENSOR", [336, 336, 1, 1], "float32"], 1, 0, 1, "float32"], {}], "config": {"index": 972357, "code_hash": null, "entity": [["tile_f", "sp", [-1, 1, 12, 2]], ["tile_y", "sp", [-1, 1, 21, 1]], ["tile_x", "sp", [-1, 1, 1, 7]], ["tile_rc", "sp", [-1, 8]], ["tile_ry", "sp", [-1, 1]], ["tile_rx", "sp", [-1, 1]], ["auto_unroll_max_step", "ot", 0], ["unroll_explicit", "ot", 1]]}, "result": [[0.00807624346153846], 0, 2.2628333568573, 1638615223.9049942], "version": 0.2, "tvm_version": "0.9.dev0"}
{"input": ["rocm -keys=rocm,gpu -max_num_threads=256 -mcpu=gfx906 -mtriple=amdgcn-amd-amdhsa-hcc -thread_warp_size=64", "conv2d_nchw.cuda", [["TENSOR", [128, 336, 21, 21], "float32"], ["TENSOR", [336, 336, 1, 1], "float32"], 1, 0, 1, "float32"], {}], "config": {"index": 398917, "code_hash": null, "entity": [["tile_f", "sp", [-1, 1, 12, 2]], ["tile_y", "sp", [-1, 1, 21, 1]], ["tile_x", "sp", [-1, 1, 1, 7]], ["tile_rc", "sp", [-1, 3]], ["tile_ry", "sp", [-1, 1]], ["tile_rx", "sp", [-1, 1]], ["auto_unroll_max_step", "ot", 0], ["unroll_explicit", "ot", 1]]}, "result": [[0.004285034157894737], 0, 2.418593406677246, 1638615226.1796646], "version": 0.2, "tvm_version": "0.9.dev0"}
{"input": ["rocm -keys=rocm,gpu -max_num_threads=256 -mcpu=gfx906 -mtriple=amdgcn-amd-amdhsa-hcc -thread_warp_size=64", "conv2d_nchw.cuda", [["TENSOR", [128, 336, 21, 21], "float32"], ["TENSOR", [336, 336, 1, 1], "float32"], 1, 0, 1, "float32"], {}], "config": {"index": 945477, "code_hash": null, "entity": [["tile_f", "sp", [-1, 1, 12, 2]], ["tile_y", "sp", [-1, 1, 21, 1]], ["tile_x", "sp", [-1, 1, 1, 3]], ["tile_rc", "sp", [-1, 8]], ["tile_ry", "sp", [-1, 1]], ["tile_rx", "sp", [-1, 1]], ["auto_unroll_max_step", "ot", 0], ["unroll_explicit", "ot", 1]]}, "result": [[0.0046202416818181815], 0, 2.577890157699585, 1638615228.3159947], "version": 0.2, "tvm_version": "0.9.dev0"}
{"input": ["rocm -keys=rocm,gpu -max_num_threads=256 -mcpu=gfx906 -mtriple=amdgcn-amd-amdhsa-hcc -thread_warp_size=64", "conv2d_nchw.cuda", [["TENSOR", [128, 336, 21, 21], "float32"], ["TENSOR", [336, 336, 1, 1], "float32"], 1, 0, 1, "float32"], {}], "config": {"index": 828997, "code_hash": null, "entity": [["tile_f", "sp", [-1, 1, 12, 2]], ["tile_y", "sp", [-1, 1, 21, 1]], ["tile_x", "sp", [-1, 1, 1, 7]], ["tile_rc", "sp", [-1, 7]], ["tile_ry", "sp", [-1, 1]], ["tile_rx", "sp", [-1, 1]], ["auto_unroll_max_step", "ot", 0], ["unroll_explicit", "ot", 1]]}, "result": [[0.008503420846153846], 0, 2.766963005065918, 1638615230.5027883], "version": 0.2, "tvm_version": "0.9.dev0"}
{"input": ["rocm -keys=rocm,gpu -max_num_threads=256 -mcpu=gfx906 -mtriple=amdgcn-amd-amdhsa-hcc -thread_warp_size=64", "conv2d_nchw.cuda", [["TENSOR", [128, 336, 21, 21], "float32"], ["TENSOR", [336, 336, 1, 1], "float32"], 1, 0, 1, "float32"], {}], "config": {"index": 972361, "code_hash": null, "entity": [["tile_f", "sp", [-1, 1, 14, 2]], ["tile_y", "sp", [-1, 1, 21, 1]], ["tile_x", "sp", [-1, 1, 1, 7]], ["tile_rc", "sp", [-1, 8]], ["tile_ry", "sp", [-1, 1]], ["tile_rx", "sp", [-1, 1]], ["auto_unroll_max_step", "ot", 0], ["unroll_explicit", "ot", 1]]}, "result": [[0.0037072623095238096], 0, 2.775951623916626, 1638615232.7503395], "version": 0.2, "tvm_version": "0.9.dev0"}
{"input": ["rocm -keys=rocm,gpu -max_num_threads=256 -mcpu=gfx906 -mtriple=amdgcn-amd-amdhsa-hcc -thread_warp_size=64", "conv2d_nchw.cuda", [["TENSOR", [128, 336, 21, 21], "float32"], ["TENSOR", [336, 336, 1, 1], "float32"], 1, 0, 1, "float32"], {}], "config": {"index": 542329, "code_hash": null, "entity": [["tile_f", "sp", [-1, 1, 7, 3]], ["tile_y", "sp", [-1, 1, 21, 1]], ["tile_x", "sp", [-1, 1, 1, 7]], ["tile_rc", "sp", [-1, 4]], ["tile_ry", "sp", [-1, 1]], ["tile_rx", "sp", [-1, 1]], ["auto_unroll_max_step", "ot", 0], ["unroll_explicit", "ot", 1]]}, "result": [[0.0035027741086956525], 0, 2.77453351020813, 1638615234.9465656], "version": 0.2, "tvm_version": "0.9.dev0"}
{"input": ["rocm -keys=rocm,gpu -max_num_threads=256 -mcpu=gfx906 -mtriple=amdgcn-amd-amdhsa-hcc -thread_warp_size=64", "conv2d_nchw.cuda", [["TENSOR", [128, 336, 21, 21], "float32"], ["TENSOR", [336, 336, 1, 1], "float32"], 1, 0, 1, "float32"], {}], "config": {"index": 398969, "code_hash": null, "entity": [["tile_f", "sp", [-1, 1, 7, 3]], ["tile_y", "sp", [-1, 1, 21, 1]], ["tile_x", "sp", [-1, 1, 1, 7]], ["tile_rc", "sp", [-1, 3]], ["tile_ry", "sp", [-1, 1]], ["tile_rx", "sp", [-1, 1]], ["auto_unroll_max_step", "ot", 0], ["unroll_explicit", "ot", 1]]}, "result": [[0.003723527357142857], 0, 2.614353656768799, 1638615237.1498678], "version": 0.2, "tvm_version": "0.9.dev0"}
{"input": ["rocm -keys=rocm,gpu -max_num_threads=256 -mcpu=gfx906 -mtriple=amdgcn-amd-amdhsa-hcc -thread_warp_size=64", "conv2d_nchw.cuda", [["TENSOR", [128, 336, 21, 21], "float32"], ["TENSOR", [336, 336, 1, 1], "float32"], 1, 0, 1, "float32"], {}], "config": {"index": 398921, "code_hash": null, "entity": [["tile_f", "sp", [-1, 1, 14, 2]], ["tile_y", "sp", [-1, 1, 21, 1]], ["tile_x", "sp", [-1, 1, 1, 7]], ["tile_rc", "sp", [-1, 3]], ["tile_ry", "sp", [-1, 1]], ["tile_rx", "sp", [-1, 1]], ["auto_unroll_max_step", "ot", 0], ["unroll_explicit", "ot", 1]]}, "result": [[0.0043562452608695654], 0, 2.920952081680298, 1638615239.6834788], "version": 0.2, "tvm_version": "0.9.dev0"}
{"input": ["rocm -keys=rocm,gpu -max_num_threads=256 -mcpu=gfx906 -mtriple=amdgcn-amd-amdhsa-hcc -thread_warp_size=64", "conv2d_nchw.cuda", [["TENSOR", [128, 336, 21, 21], "float32"], ["TENSOR", [336, 336, 1, 1], "float32"], 1, 0, 1, "float32"], {}], "config": {"index": 685637, "code_hash": null, "entity": [["tile_f", "sp", [-1, 1, 12, 2]], ["tile_y", "sp", [-1, 1, 21, 1]], ["tile_x", "sp", [-1, 1, 1, 7]], ["tile_rc", "sp", [-1, 6]], ["tile_ry", "sp", [-1, 1]], ["tile_rx", "sp", [-1, 1]], ["auto_unroll_max_step", "ot", 0], ["unroll_explicit", "ot", 1]]}, "result": [[0.007487358066666667], 0, 3.18855357170105, 1638615242.3210883], "version": 0.2, "tvm_version": "0.9.dev0"}
{"input": ["rocm -keys=rocm,gpu -max_num_threads=256 -mcpu=gfx906 -mtriple=amdgcn-amd-amdhsa-hcc -thread_warp_size=64", "conv2d_nchw.cuda", [["TENSOR", [128, 336, 21, 21], "float32"], ["TENSOR", [336, 336, 1, 1], "float32"], 1, 0, 1, "float32"], {}], "config": {"index": 3839557, "code_hash": null, "entity": [["tile_f", "sp", [-1, 1, 12, 2]], ["tile_y", "sp", [-1, 1, 21, 1]], ["tile_x", "sp", [-1, 1, 1, 7]], ["tile_rc", "sp", [-1, 8]], ["tile_ry", "sp", [-1, 1]], ["tile_rx", "sp", [-1, 1]], ["auto_unroll_max_step", "ot", 512], ["unroll_explicit", "ot", 1]]}, "result": [[0.008365091692307692], 0, 2.3191354274749756, 1638615244.0737274], "version": 0.2, "tvm_version": "0.9.dev0"}
{"input": ["rocm -keys=rocm,gpu -max_num_threads=256 -mcpu=gfx906 -mtriple=amdgcn-amd-amdhsa-hcc -thread_warp_size=64", "conv2d_nchw.cuda", [["TENSOR", [128, 336, 21, 21], "float32"], ["TENSOR", [336, 336, 1, 1], "float32"], 1, 0, 1, "float32"], {}], "config": {"index": 397912, "code_hash": null, "entity": [["tile_f", "sp", [-1, 1, 14, 4]], ["tile_y", "sp", [-1, 1, 7, 1]], ["tile_x", "sp", [-1, 1, 1, 7]], ["tile_rc", "sp", [-1, 3]], ["tile_ry", "sp", [-1, 1]], ["tile_rx", "sp", [-1, 1]], ["auto_unroll_max_step", "ot", 0], ["unroll_explicit", "ot", 1]]}, "result": [[0.0054355412105263155], 0, 2.1897714138031006, 1638615245.6855893], "version": 0.2, "tvm_version": "0.9.dev0"}
{"input": ["rocm -keys=rocm,gpu -max_num_threads=256 -mcpu=gfx906 -mtriple=amdgcn-amd-amdhsa-hcc -thread_warp_size=64", "conv2d_nchw.cuda", [["TENSOR", [128, 336, 21, 21], "float32"], ["TENSOR", [336, 336, 1, 1], "float32"], 1, 0, 1, "float32"], {}], "config": {"index": 945481, "code_hash": null, "entity": [["tile_f", "sp", [-1, 1, 14, 2]], ["tile_y", "sp", [-1, 1, 21, 1]], ["tile_x", "sp", [-1, 1, 1, 3]], ["tile_rc", "sp", [-1, 8]], ["tile_ry", "sp", [-1, 1]], ["tile_rx", "sp", [-1, 1]], ["auto_unroll_max_step", "ot", 0], ["unroll_explicit", "ot", 1]]}, "result": [[0.00631516975], 0, 2.178370952606201, 1638615247.415847], "version": 0.2, "tvm_version": "0.9.dev0"}
{"input": ["rocm -keys=rocm,gpu -max_num_threads=256 -mcpu=gfx906 -mtriple=amdgcn-amd-amdhsa-hcc -thread_warp_size=64", "conv2d_nchw.cuda", [["TENSOR", [128, 336, 21, 21], "float32"], ["TENSOR", [336, 336, 1, 1], "float32"], 1, 0, 1, "float32"], {}], "config": {"index": 3266117, "code_hash": null, "entity": [["tile_f", "sp", [-1, 1, 12, 2]], ["tile_y", "sp", [-1, 1, 21, 1]], ["tile_x", "sp", [-1, 1, 1, 7]], ["tile_rc", "sp", [-1, 3]], ["tile_ry", "sp", [-1, 1]], ["tile_rx", "sp", [-1, 1]], ["auto_unroll_max_step", "ot", 512], ["unroll_explicit", "ot", 1]]}, "result": [[0.004554566375], 0, 2.189945936203003, 1638615249.0936458], "version": 0.2, "tvm_version": "0.9.dev0"}
{"input": ["rocm -keys=rocm,gpu -max_num_threads=256 -mcpu=gfx906 -mtriple=amdgcn-amd-amdhsa-hcc -thread_warp_size=64", "conv2d_nchw.cuda", [["TENSOR", [128, 336, 21, 21], "float32"], ["TENSOR", [336, 336, 1, 1], "float32"], 1, 0, 1, "float32"], {}], "config": {"index": 945534, "code_hash": null, "entity": [["tile_f", "sp", [-1, 1, 8, 3]], ["tile_y", "sp", [-1, 1, 21, 1]], ["tile_x", "sp", [-1, 1, 1, 3]], ["tile_rc", "sp", [-1, 8]], ["tile_ry", "sp", [-1, 1]], ["tile_rx", "sp", [-1, 1]], ["auto_unroll_max_step", "ot", 0], ["unroll_explicit", "ot", 1]]}, "result": [[0.00503612365], 0, 2.1317248344421387, 1638615250.8018973], "version": 0.2, "tvm_version": "0.9.dev0"}
{"input": ["rocm -keys=rocm,gpu -max_num_threads=256 -mcpu=gfx906 -mtriple=amdgcn-amd-amdhsa-hcc -thread_warp_size=64", "conv2d_nchw.cuda", [["TENSOR", [128, 336, 21, 21], "float32"], ["TENSOR", [336, 336, 1, 1], "float32"], 1, 0, 1, "float32"], {}], "config": {"index": 945538, "code_hash": null, "entity": [["tile_f", "sp", [-1, 1, 14, 3]], ["tile_y", "sp", [-1, 1, 21, 1]], ["tile_x", "sp", [-1, 1, 1, 3]], ["tile_rc", "sp", [-1, 8]], ["tile_ry", "sp", [-1, 1]], ["tile_rx", "sp", [-1, 1]], ["auto_unroll_max_step", "ot", 0], ["unroll_explicit", "ot", 1]]}, "result": [[0.005866106894736842], 0, 2.1847736835479736, 1638615252.4902008], "version": 0.2, "tvm_version": "0.9.dev0"}
{"input": ["rocm -keys=rocm,gpu -max_num_threads=256 -mcpu=gfx906 -mtriple=amdgcn-amd-amdhsa-hcc -thread_warp_size=64", "conv2d_nchw.cuda", [["TENSOR", [128, 336, 21, 21], "float32"], ["TENSOR", [336, 336, 1, 1], "float32"], 1, 0, 1, "float32"], {}], "config": {"index": 542265, "code_hash": null, "entity": [["tile_f", "sp", [-1, 1, 7, 2]], ["tile_y", "sp", [-1, 1, 21, 1]], ["tile_x", "sp", [-1, 1, 1, 7]], ["tile_rc", "sp", [-1, 4]], ["tile_ry", "sp", [-1, 1]], ["tile_rx", "sp", [-1, 1]], ["auto_unroll_max_step", "ot", 0], ["unroll_explicit", "ot", 1]]}, "result": [[0.005060101695652174], 0, 2.0609867572784424, 1638615254.1346717], "version": 0.2, "tvm_version": "0.9.dev0"}
{"input": ["rocm -keys=rocm,gpu -max_num_threads=256 -mcpu=gfx906 -mtriple=amdgcn-amd-amdhsa-hcc -thread_warp_size=64", "conv2d_nchw.cuda", [["TENSOR", [128, 336, 21, 21], "float32"], ["TENSOR", [336, 336, 1, 1], "float32"], 1, 0, 1, "float32"], {}], "config": {"index": 972418, "code_hash": null, "entity": [["tile_f", "sp", [-1, 1, 14, 3]], ["tile_y", "sp", [-1, 1, 21, 1]], ["tile_x", "sp", [-1, 1, 1, 7]], ["tile_rc", "sp", [-1, 8]], ["tile_ry", "sp", [-1, 1]], ["tile_rx", "sp", [-1, 1]], ["auto_unroll_max_step", "ot", 0], ["unroll_explicit", "ot", 1]]}, "result": [[0.003853894724137931], 0, 2.138500452041626, 1638615255.7286758], "version": 0.2, "tvm_version": "0.9.dev0"}
{"input": ["rocm -keys=rocm,gpu -max_num_threads=256 -mcpu=gfx906 -mtriple=amdgcn-amd-amdhsa-hcc -thread_warp_size=64", "conv2d_nchw.cuda", [["TENSOR", [128, 336, 21, 21], "float32"], ["TENSOR", [336, 336, 1, 1], "float32"], 1, 0, 1, "float32"], {}], "config": {"index": 945592, "code_hash": null, "entity": [["tile_f", "sp", [-1, 1, 14, 4]], ["tile_y", "sp", [-1, 1, 21, 1]], ["tile_x", "sp", [-1, 1, 1, 3]], ["tile_rc", "sp", [-1, 8]], ["tile_ry", "sp", [-1, 1]], ["tile_rx", "sp", [-1, 1]], ["auto_unroll_max_step", "ot", 0], ["unroll_explicit", "ot", 1]]}, "result": [[0.004584555863636364], 0, 2.276331663131714, 1638615257.4836276], "version": 0.2, "tvm_version": "0.9.dev0"}
{"input": ["rocm -keys=rocm,gpu -max_num_threads=256 -mcpu=gfx906 -mtriple=amdgcn-amd-amdhsa-hcc -thread_warp_size=64", "conv2d_nchw.cuda", [["TENSOR", [128, 336, 21, 21], "float32"], ["TENSOR", [336, 336, 1, 1], "float32"], 1, 0, 1, "float32"], {}], "config": {"index": 829001, "code_hash": null, "entity": [["tile_f", "sp", [-1, 1, 14, 2]], ["tile_y", "sp", [-1, 1, 21, 1]], ["tile_x", "sp", [-1, 1, 1, 7]], ["tile_rc", "sp", [-1, 7]], ["tile_ry", "sp", [-1, 1]], ["tile_rx", "sp", [-1, 1]], ["auto_unroll_max_step", "ot", 0], ["unroll_explicit", "ot", 1]]}, "result": [[0.00526487385], 0, 2.2928504943847656, 1638615259.2598429], "version": 0.2, "tvm_version": "0.9.dev0"}
{"input": ["rocm -keys=rocm,gpu -max_num_threads=256 -mcpu=gfx906 -mtriple=amdgcn-amd-amdhsa-hcc -thread_warp_size=64", "conv2d_nchw.cuda", [["TENSOR", [128, 336, 21, 21], "float32"], ["TENSOR", [336, 336, 1, 1], "float32"], 1, 0, 1, "float32"], {}], "config": {"index": 630872, "code_hash": null, "entity": [["tile_f", "sp", [-1, 1, 14, 4]], ["tile_y", "sp", [-1, 1, 7, 1]], ["tile_x", "sp", [-1, 1, 7, 1]], ["tile_rc", "sp", [-1, 6]], ["tile_ry", "sp", [-1, 1]], ["tile_rx", "sp", [-1, 1]], ["auto_unroll_max_step", "ot", 0], ["unroll_explicit", "ot", 1]]}, "result": [[0.004482540260869566], 0, 2.1857638359069824, 1638615261.0415225], "version": 0.2, "tvm_version": "0.9.dev0"}
{"input": ["rocm -keys=rocm,gpu -max_num_threads=256 -mcpu=gfx906 -mtriple=amdgcn-amd-amdhsa-hcc -thread_warp_size=64", "conv2d_nchw.cuda", [["TENSOR", [128, 336, 21, 21], "float32"], ["TENSOR", [336, 336, 1, 1], "float32"], 1, 0, 1, "float32"], {}], "config": {"index": 685698, "code_hash": null, "entity": [["tile_f", "sp", [-1, 1, 14, 3]], ["tile_y", "sp", [-1, 1, 21, 1]], ["tile_x", "sp", [-1, 1, 1, 7]], ["tile_rc", "sp", [-1, 6]], ["tile_ry", "sp", [-1, 1]], ["tile_rx", "sp", [-1, 1]], ["auto_unroll_max_step", "ot", 0], ["unroll_explicit", "ot", 1]]}, "result": [[0.0032469477419354836], 0, 2.2463011741638184, 1638615262.800147], "version": 0.2, "tvm_version": "0.9.dev0"}
{"input": ["rocm -keys=rocm,gpu -max_num_threads=256 -mcpu=gfx906 -mtriple=amdgcn-amd-amdhsa-hcc -thread_warp_size=64", "conv2d_nchw.cuda", [["TENSOR", [128, 336, 21, 21], "float32"], ["TENSOR", [336, 336, 1, 1], "float32"], 1, 0, 1, "float32"], {}], "config": {"index": 758997, "code_hash": null, "entity": [["tile_f", "sp", [-1, 1, 12, 2]], ["tile_y", "sp", [-1, 1, 7, 3]], ["tile_x", "sp", [-1, 1, 3, 1]], ["tile_rc", "sp", [-1, 7]], ["tile_ry", "sp", [-1, 1]], ["tile_rx", "sp", [-1, 1]], ["auto_unroll_max_step", "ot", 0], ["unroll_explicit", "ot", 1]]}, "result": [[0.007954298692307692], 0, 2.289799213409424, 1638615264.6354928], "version": 0.2, "tvm_version": "0.9.dev0"}
{"input": ["rocm -keys=rocm,gpu -max_num_threads=256 -mcpu=gfx906 -mtriple=amdgcn-amd-amdhsa-hcc -thread_warp_size=64", "conv2d_nchw.cuda", [["TENSOR", [128, 336, 21, 21], "float32"], ["TENSOR", [336, 336, 1, 1], "float32"], 1, 0, 1, "float32"], {}], "config": {"index": 415717, "code_hash": null, "entity": [["tile_f", "sp", [-1, 1, 12, 2]], ["tile_y", "sp", [-1, 1, 7, 1]], ["tile_x", "sp", [-1, 1, 3, 7]], ["tile_rc", "sp", [-1, 3]], ["tile_ry", "sp", [-1, 1]], ["tile_rx", "sp", [-1, 1]], ["auto_unroll_max_step", "ot", 0], ["unroll_explicit", "ot", 1]]}, "result": [[0.0032939814117647057], 0, 2.0862064361572266, 1638615266.2739217], "version": 0.2, "tvm_version": "0.9.dev0"}
{"input": ["rocm -keys=rocm,gpu -max_num_threads=256 -mcpu=gfx906 -mtriple=amdgcn-amd-amdhsa-hcc -thread_warp_size=64", "conv2d_nchw.cuda", [["TENSOR", [128, 336, 21, 21], "float32"], ["TENSOR", [336, 336, 1, 1], "float32"], 1, 0, 1, "float32"], {}], "config": {"index": 971253, "code_hash": null, "entity": [["tile_f", "sp", [-1, 1, 28, 2]], ["tile_y", "sp", [-1, 1, 7, 1]], ["tile_x", "sp", [-1, 1, 1, 7]], ["tile_rc", "sp", [-1, 8]], ["tile_ry", "sp", [-1, 1]], ["tile_rx", "sp", [-1, 1]], ["auto_unroll_max_step", "ot", 0], ["unroll_explicit", "ot", 1]]}, "result": [[0.00331542490625], 0, 2.263310670852661, 1638615268.0368795], "version": 0.2, "tvm_version": "0.9.dev0"}
{"input": ["rocm -keys=rocm,gpu -max_num_threads=256 -mcpu=gfx906 -mtriple=amdgcn-amd-amdhsa-hcc -thread_warp_size=64", "conv2d_nchw.cuda", [["TENSOR", [128, 336, 21, 21], "float32"], ["TENSOR", [336, 336, 1, 1], "float32"], 1, 0, 1, "float32"], {}], "config": {"index": 1087717, "code_hash": null, "entity": [["tile_f", "sp", [-1, 1, 12, 2]], ["tile_y", "sp", [-1, 1, 7, 1]], ["tile_x", "sp", [-1, 1, 1, 3]], ["tile_rc", "sp", [-1, 12]], ["tile_ry", "sp", [-1, 1]], ["tile_rx", "sp", [-1, 1]], ["auto_unroll_max_step", "ot", 0], ["unroll_explicit", "ot", 1]]}, "result": [[0.009618218818181819], 0, 2.1840970516204834, 1638615269.7616172], "version": 0.2, "tvm_version": "0.9.dev0"}
{"input": ["rocm -keys=rocm,gpu -max_num_threads=256 -mcpu=gfx906 -mtriple=amdgcn-amd-amdhsa-hcc -thread_warp_size=64", "conv2d_nchw.cuda", [["TENSOR", [128, 336, 21, 21], "float32"], ["TENSOR", [336, 336, 1, 1], "float32"], 1, 0, 1, "float32"], {}], "config": {"index": 685641, "code_hash": null, "entity": [["tile_f", "sp", [-1, 1, 14, 2]], ["tile_y", "sp", [-1, 1, 21, 1]], ["tile_x", "sp", [-1, 1, 1, 7]], ["tile_rc", "sp", [-1, 6]], ["tile_ry", "sp", [-1, 1]], ["tile_rx", "sp", [-1, 1]], ["auto_unroll_max_step", "ot", 0], ["unroll_explicit", "ot", 1]]}, "result": [[0.0042122888], 0, 2.0518665313720703, 1638615271.4048865], "version": 0.2, "tvm_version": "0.9.dev0"}
{"input": ["rocm -keys=rocm,gpu -max_num_threads=256 -mcpu=gfx906 -mtriple=amdgcn-amd-amdhsa-hcc -thread_warp_size=64", "conv2d_nchw.cuda", [["TENSOR", [128, 336, 21, 21], "float32"], ["TENSOR", [336, 336, 1, 1], "float32"], 1, 0, 1, "float32"], {}], "config": {"index": 542334, "code_hash": null, "entity": [["tile_f", "sp", [-1, 1, 8, 3]], ["tile_y", "sp", [-1, 1, 21, 1]], ["tile_x", "sp", [-1, 1, 1, 7]], ["tile_rc", "sp", [-1, 4]], ["tile_ry", "sp", [-1, 1]], ["tile_rx", "sp", [-1, 1]], ["auto_unroll_max_step", "ot", 0], ["unroll_explicit", "ot", 1]]}, "result": [[0.006689947], 0, 2.2770190238952637, 1638615273.2179744], "version": 0.2, "tvm_version": "0.9.dev0"}
