artifacts/Table4/tvm/autotvm/conv/conv2d_128_1008_42_42_168_1_1_1_0.log
{"input": ["rocm -keys=rocm,gpu -max_num_threads=256 -mcpu=gfx906 -mtriple=amdgcn-amd-amdhsa-hcc -thread_warp_size=64", "conv2d_nchw.cuda", [["TENSOR", [128, 1008, 42, 42], "float32"], ["TENSOR", [168, 1008, 1, 1], "float32"], 1, 0, 1, "float32"], {}], "config": {"index": 48255174, "code_hash": null, "entity": [["tile_f", "sp", [-1, 3, 14, 2]], ["tile_y", "sp", [-1, 2, 3, 1]], ["tile_x", "sp", [-1, 1, 2, 7]], ["tile_rc", "sp", [-1, 8]], ["tile_ry", "sp", [-1, 1]], ["tile_rx", "sp", [-1, 1]], ["auto_unroll_max_step", "ot", 512], ["unroll_explicit", "ot", 1]]}, "result": [[2.23736523425], 0, 19.303035020828247, 1638780815.0235164], "version": 0.2, "tvm_version": "0.9.dev0"}
{"input": ["rocm -keys=rocm,gpu -max_num_threads=256 -mcpu=gfx906 -mtriple=amdgcn-amd-amdhsa-hcc -thread_warp_size=64", "conv2d_nchw.cuda", [["TENSOR", [128, 1008, 42, 42], "float32"], ["TENSOR", [168, 1008, 1, 1], "float32"], 1, 0, 1, "float32"], {}], "config": {"index": 23941730, "code_hash": null, "entity": [["tile_f", "sp", [-1, 2, 2, 21]], ["tile_y", "sp", [-1, 2, 1, 1]], ["tile_x", "sp", [-1, 7, 6, 1]], ["tile_rc", "sp", [-1, 56]], ["tile_ry", "sp", [-1, 1]], ["tile_rx", "sp", [-1, 1]], ["auto_unroll_max_step", "ot", 0], ["unroll_explicit", "ot", 1]]}, "result": [[11.471211914], 0, 64.48858284950256, 1638780878.918656], "version": 0.2, "tvm_version": "0.9.dev0"}
{"input": ["rocm -keys=rocm,gpu -max_num_threads=256 -mcpu=gfx906 -mtriple=amdgcn-amd-amdhsa-hcc -thread_warp_size=64", "conv2d_nchw.cuda", [["TENSOR", [128, 1008, 42, 42], "float32"], ["TENSOR", [168, 1008, 1, 1], "float32"], 1, 0, 1, "float32"], {}], "config": {"index": 45235145, "code_hash": null, "entity": [["tile_f", "sp", [-1, 2, 7, 12]], ["tile_y", "sp", [-1, 1, 7, 6]], ["tile_x", "sp", [-1, 7, 3, 2]], ["tile_rc", "sp", [-1, 6]], ["tile_ry", "sp", [-1, 1]], ["tile_rx", "sp", [-1, 1]], ["auto_unroll_max_step", "ot", 512], ["unroll_explicit", "ot", 1]]}, "result": [[1.92804394525], 0, 17.87553906440735, 1638780895.0573335], "version": 0.2, "tvm_version": "0.9.dev0"}
{"input": ["rocm -keys=rocm,gpu -max_num_threads=256 -mcpu=gfx906 -mtriple=amdgcn-amd-amdhsa-hcc -thread_warp_size=64", "conv2d_nchw.cuda", [["TENSOR", [128, 1008, 42, 42], "float32"], ["TENSOR", [168, 1008, 1, 1], "float32"], 1, 0, 1, "float32"], {}], "config": {"index": 84334623, "code_hash": null, "entity": [["tile_f", "sp", [-1, 6, 1, 7]], ["tile_y", "sp", [-1, 1, 1, 14]], ["tile_x", "sp", [-1, 6, 7, 1]], ["tile_rc", "sp", [-1, 6]], ["tile_ry", "sp", [-1, 1]], ["tile_rx", "sp", [-1, 1]], ["auto_unroll_max_step", "ot", 1500], ["unroll_explicit", "ot", 1]]}, "result": [[5.2441040037499995], 0, 39.047497272491455, 1638780934.7057831], "version": 0.2, "tvm_version": "0.9.dev0"}
{"input": ["rocm -keys=rocm,gpu -max_num_threads=256 -mcpu=gfx906 -mtriple=amdgcn-amd-amdhsa-hcc -thread_warp_size=64", "conv2d_nchw.cuda", [["TENSOR", [128, 1008, 42, 42], "float32"], ["TENSOR", [168, 1008, 1, 1], "float32"], 1, 0, 1, "float32"], {}], "config": {"index": 53476350, "code_hash": null, "entity": [["tile_f", "sp", [-1, 1, 6, 4]], ["tile_y", "sp", [-1, 3, 2, 1]], ["tile_x", "sp", [-1, 6, 1, 7]], ["tile_rc", "sp", [-1, 16]], ["tile_ry", "sp", [-1, 1]], ["tile_rx", "sp", [-1, 1]], ["auto_unroll_max_step", "ot", 512], ["unroll_explicit", "ot", 1]]}, "result": [[11.47444433575], 0, 68.15406537055969, 1638780999.7595005], "version": 0.2, "tvm_version": "0.9.dev0"}
{"input": ["rocm -keys=rocm,gpu -max_num_threads=256 -mcpu=gfx906 -mtriple=amdgcn-amd-amdhsa-hcc -thread_warp_size=64", "conv2d_nchw.cuda", [["TENSOR", [128, 1008, 42, 42], "float32"], ["TENSOR", [168, 1008, 1, 1], "float32"], 1, 0, 1, "float32"], {}], "config": {"index": 71235293, "code_hash": null, "entity": [["tile_f", "sp", [-1, 4, 1, 2]], ["tile_y", "sp", [-1, 1, 7, 1]], ["tile_x", "sp", [-1, 1, 14, 1]], ["tile_rc", "sp", [-1, 144]], ["tile_ry", "sp", [-1, 1]], ["tile_rx", "sp", [-1, 1]], ["auto_unroll_max_step", "ot", 512], ["unroll_explicit", "ot", 1]]}, "result": [[0.33696176125], 0, 9.63400650024414, 1638781019.4573164], "version": 0.2, "tvm_version": "0.9.dev0"}
{"input": ["rocm -keys=rocm,gpu -max_num_threads=256 -mcpu=gfx906 -mtriple=amdgcn-amd-amdhsa-hcc -thread_warp_size=64", "conv2d_nchw.cuda", [["TENSOR", [128, 1008, 42, 42], "float32"], ["TENSOR", [168, 1008, 1, 1], "float32"], 1, 0, 1, "float32"], {}], "config": {"index": 45208401, "code_hash": null, "entity": [["tile_f", "sp", [-1, 6, 28, 1]], ["tile_y", "sp", [-1, 3, 1, 2]], ["tile_x", "sp", [-1, 1, 3, 2]], ["tile_rc", "sp", [-1, 6]], ["tile_ry", "sp", [-1, 1]], ["tile_rx", "sp", [-1, 1]], ["auto_unroll_max_step", "ot", 512], ["unroll_explicit", "ot", 1]]}, "result": [[2.93203784175], 0, 24.42702579498291, 1638781040.6702118], "version": 0.2, "tvm_version": "0.9.dev0"}
{"input": ["rocm -keys=rocm,gpu -max_num_threads=256 -mcpu=gfx906 -mtriple=amdgcn-amd-amdhsa-hcc -thread_warp_size=64", "conv2d_nchw.cuda", [["TENSOR", [128, 1008, 42, 42], "float32"], ["TENSOR", [168, 1008, 1, 1], "float32"], 1, 0, 1, "float32"], {}], "config": {"index": 21528958, "code_hash": null, "entity": [["tile_f", "sp", [-1, 1, 2, 84]], ["tile_y", "sp", [-1, 2, 3, 1]], ["tile_x", "sp", [-1, 1, 1, 2]], ["tile_rc", "sp", [-1, 42]], ["tile_ry", "sp", [-1, 1]], ["tile_rx", "sp", [-1, 1]], ["auto_unroll_max_step", "ot", 0], ["unroll_explicit", "ot", 1]]}, "result": [[6.538008789], 0, 39.4848198890686, 1638781079.8311408], "version": 0.2, "tvm_version": "0.9.dev0"}
{"input": ["rocm -keys=rocm,gpu -max_num_threads=256 -mcpu=gfx906 -mtriple=amdgcn-amd-amdhsa-hcc -thread_warp_size=64", "conv2d_nchw.cuda", [["TENSOR", [128, 1008, 42, 42], "float32"], ["TENSOR", [168, 1008, 1, 1], "float32"], 1, 0, 1, "float32"], {}], "config": {"index": 89573656, "code_hash": null, "entity": [["tile_f", "sp", [-1, 1, 14, 6]], ["tile_y", "sp", [-1, 1, 1, 6]], ["tile_x", "sp", [-1, 6, 7, 1]], ["tile_rc", "sp", [-1, 12]], ["tile_ry", "sp", [-1, 1]], ["tile_rx", "sp", [-1, 1]], ["auto_unroll_max_step", "ot", 1500], ["unroll_explicit", "ot", 1]]}, "result": [[3.5115224607499997], 0, 25.702263355255127, 1638781103.9512756], "version": 0.2, "tvm_version": "0.9.dev0"}
{"input": ["rocm -keys=rocm,gpu -max_num_threads=256 -mcpu=gfx906 -mtriple=amdgcn-amd-amdhsa-hcc -thread_warp_size=64", "conv2d_nchw.cuda", [["TENSOR", [128, 1008, 42, 42], "float32"], ["TENSOR", [168, 1008, 1, 1], "float32"], 1, 0, 1, "float32"], {}], "config": {"index": 11521667, "code_hash": null, "entity": [["tile_f", "sp", [-1, 2, 14, 1]], ["tile_y", "sp", [-1, 2, 1, 3]], ["tile_x", "sp", [-1, 3, 1, 7]], ["tile_rc", "sp", [-1, 12]], ["tile_ry", "sp", [-1, 1]], ["tile_rx", "sp", [-1, 1]], ["auto_unroll_max_step", "ot", 0], ["unroll_explicit", "ot", 1]]}, "result": [[1.76292871075], 0, 15.668991565704346, 1638781119.2614024], "version": 0.2, "tvm_version": "0.9.dev0"}
{"input": ["rocm -keys=rocm,gpu -max_num_threads=256 -mcpu=gfx906 -mtriple=amdgcn-amd-amdhsa-hcc -thread_warp_size=64", "conv2d_nchw.cuda", [["TENSOR", [128, 1008, 42, 42], "float32"], ["TENSOR", [168, 1008, 1, 1], "float32"], 1, 0, 1, "float32"], {}], "config": {"index": 9619568, "code_hash": null, "entity": [["tile_f", "sp", [-1, 14, 6, 1]], ["tile_y", "sp", [-1, 1, 1, 6]], ["tile_x", "sp", [-1, 6, 7, 1]], ["tile_rc", "sp", [-1, 9]], ["tile_ry", "sp", [-1, 1]], ["tile_rx", "sp", [-1, 1]], ["auto_unroll_max_step", "ot", 0], ["unroll_explicit", "ot", 1]]}, "result": [[0.932906555], 0, 12.149954319000244, 1638781130.4456584], "version": 0.2, "tvm_version": "0.9.dev0"}
{"input": ["rocm -keys=rocm,gpu -max_num_threads=256 -mcpu=gfx906 -mtriple=amdgcn-amd-amdhsa-hcc -thread_warp_size=64", "conv2d_nchw.cuda", [["TENSOR", [128, 1008, 42, 42], "float32"], ["TENSOR", [168, 1008, 1, 1], "float32"], 1, 0, 1, "float32"], {}], "config": {"index": 59693169, "code_hash": null, "entity": [["tile_f", "sp", [-1, 28, 6, 1]], ["tile_y", "sp", [-1, 1, 1, 6]], ["tile_x", "sp", [-1, 3, 7, 2]], ["tile_rc", "sp", [-1, 36]], ["tile_ry", "sp", [-1, 1]], ["tile_rx", "sp", [-1, 1]], ["auto_unroll_max_step", "ot", 512], ["unroll_explicit", "ot", 1]]}, "result": [[5.05143310525], 0, 35.40699005126953, 1638781362.7328508], "version": 0.2, "tvm_version": "0.9.dev0"}
{"input": ["rocm -keys=rocm,gpu -max_num_threads=256 -mcpu=gfx906 -mtriple=amdgcn-amd-amdhsa-hcc -thread_warp_size=64", "conv2d_nchw.cuda", [["TENSOR", [128, 1008, 42, 42], "float32"], ["TENSOR", [168, 1008, 1, 1], "float32"], 1, 0, 1, "float32"], {}], "config": {"index": 12522611, "code_hash": null, "entity": [["tile_f", "sp", [-1, 2, 7, 1]], ["tile_y", "sp", [-1, 7, 1, 2]], ["tile_x", "sp", [-1, 1, 21, 2]], ["tile_rc", "sp", [-1, 14]], ["tile_ry", "sp", [-1, 1]], ["tile_rx", "sp", [-1, 1]], ["auto_unroll_max_step", "ot", 0], ["unroll_explicit", "ot", 1]]}, "result": [[11.05029589825], 0, 63.373231410980225, 1638781424.6301556], "version": 0.2, "tvm_version": "0.9.dev0"}
{"input": ["rocm -keys=rocm,gpu -max_num_threads=256 -mcpu=gfx906 -mtriple=amdgcn-amd-amdhsa-hcc -thread_warp_size=64", "conv2d_nchw.cuda", [["TENSOR", [128, 1008, 42, 42], "float32"], ["TENSOR", [168, 1008, 1, 1], "float32"], 1, 0, 1, "float32"], {}], "config": {"index": 46140778, "code_hash": null, "entity": [["tile_f", "sp", [-1, 1, 1, 28]], ["tile_y", "sp", [-1, 2, 1, 21]], ["tile_x", "sp", [-1, 1, 3, 1]], ["tile_rc", "sp", [-1, 7]], ["tile_ry", "sp", [-1, 1]], ["tile_rx", "sp", [-1, 1]], ["auto_unroll_max_step", "ot", 512], ["unroll_explicit", "ot", 1]]}, "result": [[6.43147998025], 0, 39.81152009963989, 1638781663.7406275], "version": 0.2, "tvm_version": "0.9.dev0"}
{"input": ["rocm -keys=rocm,gpu -max_num_threads=256 -mcpu=gfx906 -mtriple=amdgcn-amd-amdhsa-hcc -thread_warp_size=64", "conv2d_nchw.cuda", [["TENSOR", [128, 1008, 42, 42], "float32"], ["TENSOR", [168, 1008, 1, 1], "float32"], 1, 0, 1, "float32"], {}], "config": {"index": 98310497, "code_hash": null, "entity": [["tile_f", "sp", [-1, 14, 1, 2]], ["tile_y", "sp", [-1, 3, 7, 1]], ["tile_x", "sp", [-1, 1, 1, 1]], ["tile_rc", "sp", [-1, 36]], ["tile_ry", "sp", [-1, 1]], ["tile_rx", "sp", [-1, 1]], ["auto_unroll_max_step", "ot", 1500], ["unroll_explicit", "ot", 1]]}, "result": [[1.8686068115], 0, 17.786144256591797, 1638781890.6743295], "version": 0.2, "tvm_version": "0.9.dev0"}
{"input": ["rocm -keys=rocm,gpu -max_num_threads=256 -mcpu=gfx906 -mtriple=amdgcn-amd-amdhsa-hcc -thread_warp_size=64", "conv2d_nchw.cuda", [["TENSOR", [128, 1008, 42, 42], "float32"], ["TENSOR", [168, 1008, 1, 1], "float32"], 1, 0, 1, "float32"], {}], "config": {"index": 94928024, "code_hash": null, "entity": [["tile_f", "sp", [-1, 21, 2, 1]], ["tile_y", "sp", [-1, 7, 2, 1]], ["tile_x", "sp", [-1, 1, 1, 2]], ["tile_rc", "sp", [-1, 21]], ["tile_ry", "sp", [-1, 1]], ["tile_rx", "sp", [-1, 1]], ["auto_unroll_max_step", "ot", 1500], ["unroll_explicit", "ot", 1]]}, "result": [[26.20395703125], 0, 143.46172451972961, 1638782028.1965175], "version": 0.2, "tvm_version": "0.9.dev0"}
{"input": ["rocm -keys=rocm,gpu -max_num_threads=256 -mcpu=gfx906 -mtriple=amdgcn-amd-amdhsa-hcc -thread_warp_size=64", "conv2d_nchw.cuda", [["TENSOR", [128, 1008, 42, 42], "float32"], ["TENSOR", [168, 1008, 1, 1], "float32"], 1, 0, 1, "float32"], {}], "config": {"index": 86729786, "code_hash": null, "entity": [["tile_f", "sp", [-1, 1, 3, 4]], ["tile_y", "sp", [-1, 1, 3, 7]], ["tile_x", "sp", [-1, 7, 2, 1]], ["tile_rc", "sp", [-1, 8]], ["tile_ry", "sp", [-1, 1]], ["tile_rx", "sp", [-1, 1]], ["auto_unroll_max_step", "ot", 1500], ["unroll_explicit", "ot", 1]]}, "result": [[10.25417871075], 0, 60.14488101005554, 1638782085.9967818], "version": 0.2, "tvm_version": "0.9.dev0"}
{"input": ["rocm -keys=rocm,gpu -max_num_threads=256 -mcpu=gfx906 -mtriple=amdgcn-amd-amdhsa-hcc -thread_warp_size=64", "conv2d_nchw.cuda", [["TENSOR", [128, 1008, 42, 42], "float32"], ["TENSOR", [168, 1008, 1, 1], "float32"], 1, 0, 1, "float32"], {}], "config": {"index": 50638566, "code_hash": null, "entity": [["tile_f", "sp", [-1, 1, 8, 3]], ["tile_y", "sp", [-1, 2, 1, 3]], ["tile_x", "sp", [-1, 1, 2, 3]], ["tile_rc", "sp", [-1, 12]], ["tile_ry", "sp", [-1, 1]], ["tile_rx", "sp", [-1, 1]], ["auto_unroll_max_step", "ot", 512], ["unroll_explicit", "ot", 1]]}, "result": [[0.2172725065], 0, 8.4394052028656, 1638782093.64153], "version": 0.2, "tvm_version": "0.9.dev0"}
{"input": ["rocm -keys=rocm,gpu -max_num_threads=256 -mcpu=gfx906 -mtriple=amdgcn-amd-amdhsa-hcc -thread_warp_size=64", "conv2d_nchw.cuda", [["TENSOR", [128, 1008, 42, 42], "float32"], ["TENSOR", [168, 1008, 1, 1], "float32"], 1, 0, 1, "float32"], {}], "config": {"index": 94769116, "code_hash": null, "entity": [["tile_f", "sp", [-1, 14, 2, 3]], ["tile_y", "sp", [-1, 2, 21, 1]], ["tile_x", "sp", [-1, 2, 7, 1]], ["tile_rc", "sp", [-1, 21]], ["tile_ry", "sp", [-1, 1]], ["tile_rx", "sp", [-1, 1]], ["auto_unroll_max_step", "ot", 1500], ["unroll_explicit", "ot", 1]]}, "result": [[0.8416652830000001], 0, 11.654526710510254, 1638782104.2918909], "version": 0.2, "tvm_version": "0.9.dev0"}
{"input": ["rocm -keys=rocm,gpu -max_num_threads=256 -mcpu=gfx906 -mtriple=amdgcn-amd-amdhsa-hcc -thread_warp_size=64", "conv2d_nchw.cuda", [["TENSOR", [128, 1008, 42, 42], "float32"], ["TENSOR", [168, 1008, 1, 1], "float32"], 1, 0, 1, "float32"], {}], "config": {"index": 5416085, "code_hash": null, "entity": [["tile_f", "sp", [-1, 1, 56, 1]], ["tile_y", "sp", [-1, 7, 1, 2]], ["tile_x", "sp", [-1, 1, 2, 1]], ["tile_rc", "sp", [-1, 6]], ["tile_ry", "sp", [-1, 1]], ["tile_rx", "sp", [-1, 1]], ["auto_unroll_max_step", "ot", 0], ["unroll_explicit", "ot", 1]]}, "result": [[0.03460277925], 0, 7.219440937042236, 1638782111.1843455], "version": 0.2, "tvm_version": "0.9.dev0"}
{"input": ["rocm -keys=rocm,gpu -max_num_threads=256 -mcpu=gfx906 -mtriple=amdgcn-amd-amdhsa-hcc -thread_warp_size=64", "conv2d_nchw.cuda", [["TENSOR", [128, 1008, 42, 42], "float32"], ["TENSOR", [168, 1008, 1, 1], "float32"], 1, 0, 1, "float32"], {}], "config": {"index": 72261183, "code_hash": null, "entity": [["tile_f", "sp", [-1, 2, 12, 1]], ["tile_y", "sp", [-1, 1, 21, 1]], ["tile_x", "sp", [-1, 1, 2, 1]], ["tile_rc", "sp", [-1, 168]], ["tile_ry", "sp", [-1, 1]], ["tile_rx", "sp", [-1, 1]], ["auto_unroll_max_step", "ot", 512], ["unroll_explicit", "ot", 1]]}, "result": [[0.047462841], 0, 7.594122409820557, 1638782117.9894207], "version": 0.2, "tvm_version": "0.9.dev0"}
{"input": ["rocm -keys=rocm,gpu -max_num_threads=256 -mcpu=gfx906 -mtriple=amdgcn-amd-amdhsa-hcc -thread_warp_size=64", "conv2d_nchw.cuda", [["TENSOR", [128, 1008, 42, 42], "float32"], ["TENSOR", [168, 1008, 1, 1], "float32"], 1, 0, 1, "float32"], {}], "config": {"index": 39410175, "code_hash": null, "entity": [["tile_f", "sp", [-1, 1, 7, 8]], ["tile_y", "sp", [-1, 3, 7, 1]], ["tile_x", "sp", [-1, 7, 1, 1]], ["tile_rc", "sp", [-1, 1]], ["tile_ry", "sp", [-1, 1]], ["tile_rx", "sp", [-1, 1]], ["auto_unroll_max_step", "ot", 512], ["unroll_explicit", "ot", 1]]}, "result": [[2.1930925292500003], 0, 18.323020458221436, 1638782135.4625773], "version": 0.2, "tvm_version": "0.9.dev0"}
{"input": ["rocm -keys=rocm,gpu -max_num_threads=256 -mcpu=gfx906 -mtriple=amdgcn-amd-amdhsa-hcc -thread_warp_size=64", "conv2d_nchw.cuda", [["TENSOR", [128, 1008, 42, 42], "float32"], ["TENSOR", [168, 1008, 1, 1], "float32"], 1, 0, 1, "float32"], {}], "config": {"index": 15631412, "code_hash": null, "entity": [["tile_f", "sp", [-1, 3, 7, 1]], ["tile_y", "sp", [-1, 1, 6, 1]], ["tile_x", "sp", [-1, 1, 3, 14]], ["tile_rc", "sp", [-1, 18]], ["tile_ry", "sp", [-1, 1]], ["tile_rx", "sp", [-1, 1]], ["auto_unroll_max_step", "ot", 0], ["unroll_explicit", "ot", 1]]}, "result": [[0.053868095250000005], 0, 7.313143491744995, 1638782142.2455785], "version": 0.2, "tvm_version": "0.9.dev0"}
{"input": ["rocm -keys=rocm,gpu -max_num_threads=256 -mcpu=gfx906 -mtriple=amdgcn-amd-amdhsa-hcc -thread_warp_size=64", "conv2d_nchw.cuda", [["TENSOR", [128, 1008, 42, 42], "float32"], ["TENSOR", [168, 1008, 1, 1], "float32"], 1, 0, 1, "float32"], {}], "config": {"index": 44043282, "code_hash": null, "entity": [["tile_f", "sp", [-1, 1, 42, 1]], ["tile_y", "sp", [-1, 1, 21, 2]], ["tile_x", "sp", [-1, 7, 1, 3]], ["tile_rc", "sp", [-1, 4]], ["tile_ry", "sp", [-1, 1]], ["tile_rx", "sp", [-1, 1]], ["auto_unroll_max_step", "ot", 512], ["unroll_explicit", "ot", 1]]}, "result": [[0.047717994500000006], 0, 7.236664056777954, 1638782349.375302], "version": 0.2, "tvm_version": "0.9.dev0"}
{"input": ["rocm -keys=rocm,gpu -max_num_threads=256 -mcpu=gfx906 -mtriple=amdgcn-amd-amdhsa-hcc -thread_warp_size=64", "conv2d_nchw.cuda", [["TENSOR", [128, 1008, 42, 42], "float32"], ["TENSOR", [168, 1008, 1, 1], "float32"], 1, 0, 1, "float32"], {}], "config": {"index": 46499725, "code_hash": null, "entity": [["tile_f", "sp", [-1, 14, 1, 6]], ["tile_y", "sp", [-1, 1, 3, 2]], ["tile_x", "sp", [-1, 21, 1, 2]], ["tile_rc", "sp", [-1, 7]], ["tile_ry", "sp", [-1, 1]], ["tile_rx", "sp", [-1, 1]], ["auto_unroll_max_step", "ot", 512], ["unroll_explicit", "ot", 1]]}, "result": [[8.26681933575], 0, 50.50597620010376, 1638782397.2205946], "version": 0.2, "tvm_version": "0.9.dev0"}
{"input": ["rocm -keys=rocm,gpu -max_num_threads=256 -mcpu=gfx906 -mtriple=amdgcn-amd-amdhsa-hcc -thread_warp_size=64", "conv2d_nchw.cuda", [["TENSOR", [128, 1008, 42, 42], "float32"], ["TENSOR", [168, 1008, 1, 1], "float32"], 1, 0, 1, "float32"], {}], "config": {"index": 3788931, "code_hash": null, "entity": [["tile_f", "sp", [-1, 7, 12, 2]], ["tile_y", "sp", [-1, 1, 1, 1]], ["tile_x", "sp", [-1, 1, 1, 14]], ["tile_rc", "sp", [-1, 3]], ["tile_ry", "sp", [-1, 1]], ["tile_rx", "sp", [-1, 1]], ["auto_unroll_max_step", "ot", 0], ["unroll_explicit", "ot", 1]]}, "result": [[1.33365246575], 0, 14.319678544998169, 1638782410.4268363], "version": 0.2, "tvm_version": "0.9.dev0"}
{"input": ["rocm -keys=rocm,gpu -max_num_threads=256 -mcpu=gfx906 -mtriple=amdgcn-amd-amdhsa-hcc -thread_warp_size=64", "conv2d_nchw.cuda", [["TENSOR", [128, 1008, 42, 42], "float32"], ["TENSOR", [168, 1008, 1, 1], "float32"], 1, 0, 1, "float32"], {}], "config": {"index": 59248801, "code_hash": null, "entity": [["tile_f", "sp", [-1, 14, 4, 3]], ["tile_y", "sp", [-1, 1, 1, 1]], ["tile_x", "sp", [-1, 2, 3, 1]], ["tile_rc", "sp", [-1, 36]], ["tile_ry", "sp", [-1, 1]], ["tile_rx", "sp", [-1, 1]], ["auto_unroll_max_step", "ot", 512], ["unroll_explicit", "ot", 1]]}, "result": [[17.381814453], 0, 95.07395482063293, 1638782503.9012697], "version": 0.2, "tvm_version": "0.9.dev0"}
{"input": ["rocm -keys=rocm,gpu -max_num_threads=256 -mcpu=gfx906 -mtriple=amdgcn-amd-amdhsa-hcc -thread_warp_size=64", "conv2d_nchw.cuda", [["TENSOR", [128, 1008, 42, 42], "float32"], ["TENSOR", [168, 1008, 1, 1], "float32"], 1, 0, 1, "float32"], {}], "config": {"index": 42330602, "code_hash": null, "entity": [["tile_f", "sp", [-1, 21, 4, 1]], ["tile_y", "sp", [-1, 1, 3, 14]], ["tile_x", "sp", [-1, 1, 7, 1]], ["tile_rc", "sp", [-1, 3]], ["tile_ry", "sp", [-1, 1]], ["tile_rx", "sp", [-1, 1]], ["auto_unroll_max_step", "ot", 512], ["unroll_explicit", "ot", 1]]}, "result": [[0.77247637925], 0, 14.799947500228882, 1638782714.688728], "version": 0.2, "tvm_version": "0.9.dev0"}
{"input": ["rocm -keys=rocm,gpu -max_num_threads=256 -mcpu=gfx906 -mtriple=amdgcn-amd-amdhsa-hcc -thread_warp_size=64", "conv2d_nchw.cuda", [["TENSOR", [128, 1008, 42, 42], "float32"], ["TENSOR", [168, 1008, 1, 1], "float32"], 1, 0, 1, "float32"], {}], "config": {"index": 45033833, "code_hash": null, "entity": [["tile_f", "sp", [-1, 1, 3, 7]], ["tile_y", "sp", [-1, 3, 1, 14]], ["tile_x", "sp", [-1, 1, 14, 1]], ["tile_rc", "sp", [-1, 6]], ["tile_ry", "sp", [-1, 1]], ["tile_rx", "sp", [-1, 1]], ["auto_unroll_max_step", "ot", 512], ["unroll_explicit", "ot", 1]]}, "result": [[9.22304492175], 0, 56.34519124031067, 1638782767.333969], "version": 0.2, "tvm_version": "0.9.dev0"}
{"input": ["rocm -keys=rocm,gpu -max_num_threads=256 -mcpu=gfx906 -mtriple=amdgcn-amd-amdhsa-hcc -thread_warp_size=64", "conv2d_nchw.cuda", [["TENSOR", [128, 1008, 42, 42], "float32"], ["TENSOR", [168, 1008, 1, 1], "float32"], 1, 0, 1, "float32"], {}], "config": {"index": 44488024, "code_hash": null, "entity": [["tile_f", "sp", [-1, 21, 2, 1]], ["tile_y", "sp", [-1, 7, 6, 1]], ["tile_x", "sp", [-1, 1, 1, 21]], ["tile_rc", "sp", [-1, 4]], ["tile_ry", "sp", [-1, 1]], ["tile_rx", "sp", [-1, 1]], ["auto_unroll_max_step", "ot", 512], ["unroll_explicit", "ot", 1]]}, "result": [[3.61611425775], 0, 26.244858503341675, 1638782791.9294112], "version": 0.2, "tvm_version": "0.9.dev0"}
{"input": ["rocm -keys=rocm,gpu -max_num_threads=256 -mcpu=gfx906 -mtriple=amdgcn-amd-amdhsa-hcc -thread_warp_size=64", "conv2d_nchw.cuda", [["TENSOR", [128, 1008, 42, 42], "float32"], ["TENSOR", [168, 1008, 1, 1], "float32"], 1, 0, 1, "float32"], {}], "config": {"index": 25564263, "code_hash": null, "entity": [["tile_f", "sp", [-1, 2, 2, 2]], ["tile_y", "sp", [-1, 1, 6, 1]], ["tile_x", "sp", [-1, 7, 3, 2]], ["tile_rc", "sp", [-1, 63]], ["tile_ry", "sp", [-1, 1]], ["tile_rx", "sp", [-1, 1]], ["auto_unroll_max_step", "ot", 0], ["unroll_explicit", "ot", 1]]}, "result": [[2.594922119], 0, 20.119179010391235, 1638782811.3954024], "version": 0.2, "tvm_version": "0.9.dev0"}
{"input": ["rocm -keys=rocm,gpu -max_num_threads=256 -mcpu=gfx906 -mtriple=amdgcn-amd-amdhsa-hcc -thread_warp_size=64", "conv2d_nchw.cuda", [["TENSOR", [128, 1008, 42, 42], "float32"], ["TENSOR", [168, 1008, 1, 1], "float32"], 1, 0, 1, "float32"], {}], "config": {"index": 12640114, "code_hash": null, "entity": [["tile_f", "sp", [-1, 14, 3, 2]], ["tile_y", "sp", [-1, 1, 3, 1]], ["tile_x", "sp", [-1, 7, 2, 3]], ["tile_rc", "sp", [-1, 14]], ["tile_ry", "sp", [-1, 1]], ["tile_rx", "sp", [-1, 1]], ["auto_unroll_max_step", "ot", 0], ["unroll_explicit", "ot", 1]]}, "result": [[2.0532260740000003], 0, 18.612356185913086, 1638782828.1990728], "version": 0.2, "tvm_version": "0.9.dev0"}
{"input": ["rocm -keys=rocm,gpu -max_num_threads=256 -mcpu=gfx906 -mtriple=amdgcn-amd-amdhsa-hcc -thread_warp_size=64", "conv2d_nchw.cuda", [["TENSOR", [128, 1008, 42, 42], "float32"], ["TENSOR", [168, 1008, 1, 1], "float32"], 1, 0, 1, "float32"], {}], "config": {"index": 9995940, "code_hash": null, "entity": [["tile_f", "sp", [-1, 42, 1, 2]], ["tile_y", "sp", [-1, 14, 1, 1]], ["tile_x", "sp", [-1, 1, 2, 3]], ["tile_rc", "sp", [-1, 9]], ["tile_ry", "sp", [-1, 1]], ["tile_rx", "sp", [-1, 1]], ["auto_unroll_max_step", "ot", 0], ["unroll_explicit", "ot", 1]]}, "result": [[12.382716796750001], 0, 72.25944232940674, 1638782896.7913802], "version": 0.2, "tvm_version": "0.9.dev0"}
{"input": ["rocm -keys=rocm,gpu -max_num_threads=256 -mcpu=gfx906 -mtriple=amdgcn-amd-amdhsa-hcc -thread_warp_size=64", "conv2d_nchw.cuda", [["TENSOR", [128, 1008, 42, 42], "float32"], ["TENSOR", [168, 1008, 1, 1], "float32"], 1, 0, 1, "float32"], {}], "config": {"index": 24003410, "code_hash": null, "entity": [["tile_f", "sp", [-1, 14, 2, 6]], ["tile_y", "sp", [-1, 3, 1, 1]], ["tile_x", "sp", [-1, 3, 7, 1]], ["tile_rc", "sp", [-1, 56]], ["tile_ry", "sp", [-1, 1]], ["tile_rx", "sp", [-1, 1]], ["auto_unroll_max_step", "ot", 0], ["unroll_explicit", "ot", 1]]}, "result": [[6.36024023425], 0, 39.720152139663696, 1638782935.1105645], "version": 0.2, "tvm_version": "0.9.dev0"}
{"input": ["rocm -keys=rocm,gpu -max_num_threads=256 -mcpu=gfx906 -mtriple=amdgcn-amd-amdhsa-hcc -thread_warp_size=64", "conv2d_nchw.cuda", [["TENSOR", [128, 1008, 42, 42], "float32"], ["TENSOR", [168, 1008, 1, 1], "float32"], 1, 0, 1, "float32"], {}], "config": {"index": 51365634, "code_hash": null, "entity": [["tile_f", "sp", [-1, 3, 7, 4]], ["tile_y", "sp", [-1, 14, 1, 1]], ["tile_x", "sp", [-1, 1, 3, 1]], ["tile_rc", "sp", [-1, 14]], ["tile_ry", "sp", [-1, 1]], ["tile_rx", "sp", [-1, 1]], ["auto_unroll_max_step", "ot", 512], ["unroll_explicit", "ot", 1]]}, "result": [[3.3415373534999997], 0, 24.50905156135559, 1638782958.5109742], "version": 0.2, "tvm_version": "0.9.dev0"}
{"input": ["rocm -keys=rocm,gpu -max_num_threads=256 -mcpu=gfx906 -mtriple=amdgcn-amd-amdhsa-hcc -thread_warp_size=64", "conv2d_nchw.cuda", [["TENSOR", [128, 1008, 42, 42], "float32"], ["TENSOR", [168, 1008, 1, 1], "float32"], 1, 0, 1, "float32"], {}], "config": {"index": 22937983, "code_hash": null, "entity": [["tile_f", "sp", [-1, 2, 12, 1]], ["tile_y", "sp", [-1, 2, 1, 1]], ["tile_x", "sp", [-1, 7, 3, 2]], ["tile_rc", "sp", [-1, 48]], ["tile_ry", "sp", [-1, 1]], ["tile_rx", "sp", [-1, 1]], ["auto_unroll_max_step", "ot", 0], ["unroll_explicit", "ot", 1]]}, "result": [[0.15044715875], 0, 7.744125843048096, 1638782965.7283382], "version": 0.2, "tvm_version": "0.9.dev0"}
{"input": ["rocm -keys=rocm,gpu -max_num_threads=256 -mcpu=gfx906 -mtriple=amdgcn-amd-amdhsa-hcc -thread_warp_size=64", "conv2d_nchw.cuda", [["TENSOR", [128, 1008, 42, 42], "float32"], ["TENSOR", [168, 1008, 1, 1], "float32"], 1, 0, 1, "float32"], {}], "config": {"index": 3118191, "code_hash": null, "entity": [["tile_f", "sp", [-1, 2, 3, 2]], ["tile_y", "sp", [-1, 1, 6, 1]], ["tile_x", "sp", [-1, 1, 21, 1]], ["tile_rc", "sp", [-1, 3]], ["tile_ry", "sp", [-1, 1]], ["tile_rx", "sp", [-1, 1]], ["auto_unroll_max_step", "ot", 0], ["unroll_explicit", "ot", 1]]}, "result": [[0.04066641975], 0, 6.891677618026733, 1638783235.888604], "version": 0.2, "tvm_version": "0.9.dev0"}
{"input": ["rocm -keys=rocm,gpu -max_num_threads=256 -mcpu=gfx906 -mtriple=amdgcn-amd-amdhsa-hcc -thread_warp_size=64", "conv2d_nchw.cuda", [["TENSOR", [128, 1008, 42, 42], "float32"], ["TENSOR", [168, 1008, 1, 1], "float32"], 1, 0, 1, "float32"], {}], "config": {"index": 2176045, "code_hash": null, "entity": [["tile_f", "sp", [-1, 2, 6, 1]], ["tile_y", "sp", [-1, 1, 6, 1]], ["tile_x", "sp", [-1, 1, 7, 3]], ["tile_rc", "sp", [-1, 2]], ["tile_ry", "sp", [-1, 1]], ["tile_rx", "sp", [-1, 1]], ["auto_unroll_max_step", "ot", 0], ["unroll_explicit", "ot", 1]]}, "result": [[0.02915350525], 0, 6.885430097579956, 1638783242.5100217], "version": 0.2, "tvm_version": "0.9.dev0"}
{"input": ["rocm -keys=rocm,gpu -max_num_threads=256 -mcpu=gfx906 -mtriple=amdgcn-amd-amdhsa-hcc -thread_warp_size=64", "conv2d_nchw.cuda", [["TENSOR", [128, 1008, 42, 42], "float32"], ["TENSOR", [168, 1008, 1, 1], "float32"], 1, 0, 1, "float32"], {}], "config": {"index": 414928, "code_hash": null, "entity": [["tile_f", "sp", [-1, 2, 2, 6]], ["tile_y", "sp", [-1, 1, 6, 1]], ["tile_x", "sp", [-1, 3, 7, 1]], ["tile_rc", "sp", [-1, 1]], ["tile_ry", "sp", [-1, 1]], ["tile_rx", "sp", [-1, 1]], ["auto_unroll_max_step", "ot", 0], ["unroll_explicit", "ot", 1]]}, "result": [[0.034660755], 0, 7.182124853134155, 1638783249.163425], "version": 0.2, "tvm_version": "0.9.dev0"}
{"input": ["rocm -keys=rocm,gpu -max_num_threads=256 -mcpu=gfx906 -mtriple=amdgcn-amd-amdhsa-hcc -thread_warp_size=64", "conv2d_nchw.cuda", [["TENSOR", [128, 1008, 42, 42], "float32"], ["TENSOR", [168, 1008, 1, 1], "float32"], 1, 0, 1, "float32"], {}], "config": {"index": 5657834, "code_hash": null, "entity": [["tile_f", "sp", [-1, 2, 3, 7]], ["tile_y", "sp", [-1, 1, 6, 1]], ["tile_x", "sp", [-1, 3, 7, 1]], ["tile_rc", "sp", [-1, 6]], ["tile_ry", "sp", [-1, 1]], ["tile_rx", "sp", [-1, 1]], ["auto_unroll_max_step", "ot", 0], ["unroll_explicit", "ot", 1]]}, "result": [[0.08210108925], 0, 7.652210235595703, 1638783256.066571], "version": 0.2, "tvm_version": "0.9.dev0"}
{"input": ["rocm -keys=rocm,gpu -max_num_threads=256 -mcpu=gfx906 -mtriple=amdgcn-amd-amdhsa-hcc -thread_warp_size=64", "conv2d_nchw.cuda", [["TENSOR", [128, 1008, 42, 42], "float32"], ["TENSOR", [168, 1008, 1, 1], "float32"], 1, 0, 1, "float32"], {}], "config": {"index": 6108232, "code_hash": null, "entity": [["tile_f", "sp", [-1, 1, 21, 1]], ["tile_y", "sp", [-1, 1, 6, 1]], ["tile_x", "sp", [-1, 1, 7, 3]], ["tile_rc", "sp", [-1, 6]], ["tile_ry", "sp", [-1, 1]], ["tile_rx", "sp", [-1, 1]], ["auto_unroll_max_step", "ot", 0], ["unroll_explicit", "ot", 1]]}, "result": [[0.041244335], 0, 6.95418119430542, 1638783262.7643883], "version": 0.2, "tvm_version": "0.9.dev0"}
{"input": ["rocm -keys=rocm,gpu -max_num_threads=256 -mcpu=gfx906 -mtriple=amdgcn-amd-amdhsa-hcc -thread_warp_size=64", "conv2d_nchw.cuda", [["TENSOR", [128, 1008, 42, 42], "float32"], ["TENSOR", [168, 1008, 1, 1], "float32"], 1, 0, 1, "float32"], {}], "config": {"index": 39736528, "code_hash": null, "entity": [["tile_f", "sp", [-1, 2, 2, 6]], ["tile_y", "sp", [-1, 1, 6, 1]], ["tile_x", "sp", [-1, 3, 7, 1]], ["tile_rc", "sp", [-1, 1]], ["tile_ry", "sp", [-1, 1]], ["tile_rx", "sp", [-1, 1]], ["auto_unroll_max_step", "ot", 512], ["unroll_explicit", "ot", 1]]}, "result": [[0.03522754275], 0, 7.055355072021484, 1638783269.370114], "version": 0.2, "tvm_version": "0.9.dev0"}
{"input": ["rocm -keys=rocm,gpu -max_num_threads=256 -mcpu=gfx906 -mtriple=amdgcn-amd-amdhsa-hcc -thread_warp_size=64", "conv2d_nchw.cuda", [["TENSOR", [128, 1008, 42, 42], "float32"], ["TENSOR", [168, 1008, 1, 1], "float32"], 1, 0, 1, "float32"], {}], "config": {"index": 3446536, "code_hash": null, "entity": [["tile_f", "sp", [-1, 1, 21, 2]], ["tile_y", "sp", [-1, 1, 7, 1]], ["tile_x", "sp", [-1, 1, 2, 3]], ["tile_rc", "sp", [-1, 3]], ["tile_ry", "sp", [-1, 1]], ["tile_rx", "sp", [-1, 1]], ["auto_unroll_max_step", "ot", 0], ["unroll_explicit", "ot", 1]]}, "result": [[0.034434017], 0, 6.8831870555877686, 1638783275.990109], "version": 0.2, "tvm_version": "0.9.dev0"}
{"input": ["rocm -keys=rocm,gpu -max_num_threads=256 -mcpu=gfx906 -mtriple=amdgcn-amd-amdhsa-hcc -thread_warp_size=64", "conv2d_nchw.cuda", [["TENSOR", [128, 1008, 42, 42], "float32"], ["TENSOR", [168, 1008, 1, 1], "float32"], 1, 0, 1, "float32"], {}], "config": {"index": 44979434, "code_hash": null, "entity": [["tile_f", "sp", [-1, 2, 3, 7]], ["tile_y", "sp", [-1, 1, 6, 1]], ["tile_x", "sp", [-1, 3, 7, 1]], ["tile_rc", "sp", [-1, 6]], ["tile_ry", "sp", [-1, 1]], ["tile_rx", "sp", [-1, 1]], ["auto_unroll_max_step", "ot", 512], ["unroll_explicit", "ot", 1]]}, "result": [[0.04266483675], 0, 7.475566148757935, 1638783282.665182], "version": 0.2, "tvm_version": "0.9.dev0"}
{"input": ["rocm -keys=rocm,gpu -max_num_threads=256 -mcpu=gfx906 -mtriple=amdgcn-amd-amdhsa-hcc -thread_warp_size=64", "conv2d_nchw.cuda", [["TENSOR", [128, 1008, 42, 42], "float32"], ["TENSOR", [168, 1008, 1, 1], "float32"], 1, 0, 1, "float32"], {}], "config": {"index": 84751432, "code_hash": null, "entity": [["tile_f", "sp", [-1, 1, 21, 1]], ["tile_y", "sp", [-1, 1, 6, 1]], ["tile_x", "sp", [-1, 1, 7, 3]], ["tile_rc", "sp", [-1, 6]], ["tile_ry", "sp", [-1, 1]], ["tile_rx", "sp", [-1, 1]], ["auto_unroll_max_step", "ot", 1500], ["unroll_explicit", "ot", 1]]}, "result": [[0.041956905249999996], 0, 7.052937984466553, 1638783289.3351536], "version": 0.2, "tvm_version": "0.9.dev0"}
{"input": ["rocm -keys=rocm,gpu -max_num_threads=256 -mcpu=gfx906 -mtriple=amdgcn-amd-amdhsa-hcc -thread_warp_size=64", "conv2d_nchw.cuda", [["TENSOR", [128, 1008, 42, 42], "float32"], ["TENSOR", [168, 1008, 1, 1], "float32"], 1, 0, 1, "float32"], {}], "config": {"index": 45429832, "code_hash": null, "entity": [["tile_f", "sp", [-1, 1, 21, 1]], ["tile_y", "sp", [-1, 1, 6, 1]], ["tile_x", "sp", [-1, 1, 7, 3]], ["tile_rc", "sp", [-1, 6]], ["tile_ry", "sp", [-1, 1]], ["tile_rx", "sp", [-1, 1]], ["auto_unroll_max_step", "ot", 512], ["unroll_explicit", "ot", 1]]}, "result": [[0.041952052999999996], 0, 6.757953882217407, 1638783295.9790714], "version": 0.2, "tvm_version": "0.9.dev0"}
{"input": ["rocm -keys=rocm,gpu -max_num_threads=256 -mcpu=gfx906 -mtriple=amdgcn-amd-amdhsa-hcc -thread_warp_size=64", "conv2d_nchw.cuda", [["TENSOR", [128, 1008, 42, 42], "float32"], ["TENSOR", [168, 1008, 1, 1], "float32"], 1, 0, 1, "float32"], {}], "config": {"index": 2422468, "code_hash": null, "entity": [["tile_f", "sp", [-1, 3, 14, 1]], ["tile_y", "sp", [-1, 1, 7, 1]], ["tile_x", "sp", [-1, 1, 3, 7]], ["tile_rc", "sp", [-1, 2]], ["tile_ry", "sp", [-1, 1]], ["tile_rx", "sp", [-1, 1]], ["auto_unroll_max_step", "ot", 0], ["unroll_explicit", "ot", 1]]}, "result": [[0.030184180999999997], 0, 6.726320505142212, 1638783302.572077], "version": 0.2, "tvm_version": "0.9.dev0"}
{"input": ["rocm -keys=rocm,gpu -max_num_threads=256 -mcpu=gfx906 -mtriple=amdgcn-amd-amdhsa-hcc -thread_warp_size=64", "conv2d_nchw.cuda", [["TENSOR", [128, 1008, 42, 42], "float32"], ["TENSOR", [168, 1008, 1, 1], "float32"], 1, 0, 1, "float32"], {}], "config": {"index": 2176052, "code_hash": null, "entity": [["tile_f", "sp", [-1, 3, 7, 1]], ["tile_y", "sp", [-1, 1, 6, 1]], ["tile_x", "sp", [-1, 1, 7, 3]], ["tile_rc", "sp", [-1, 2]], ["tile_ry", "sp", [-1, 1]], ["tile_rx", "sp", [-1, 1]], ["auto_unroll_max_step", "ot", 0], ["unroll_explicit", "ot", 1]]}, "result": [[0.033942245249999996], 0, 7.12356424331665, 1638783309.2357721], "version": 0.2, "tvm_version": "0.9.dev0"}
{"input": ["rocm -keys=rocm,gpu -max_num_threads=256 -mcpu=gfx906 -mtriple=amdgcn-amd-amdhsa-hcc -thread_warp_size=64", "conv2d_nchw.cuda", [["TENSOR", [128, 1008, 42, 42], "float32"], ["TENSOR", [168, 1008, 1, 1], "float32"], 1, 0, 1, "float32"], {}], "config": {"index": 1807378, "code_hash": null, "entity": [["tile_f", "sp", [-1, 3, 2, 1]], ["tile_y", "sp", [-1, 1, 6, 1]], ["tile_x", "sp", [-1, 1, 21, 1]], ["tile_rc", "sp", [-1, 2]], ["tile_ry", "sp", [-1, 1]], ["tile_rx", "sp", [-1, 1]], ["auto_unroll_max_step", "ot", 0], ["unroll_explicit", "ot", 1]]}, "result": [[0.0453672065], 0, 7.222223520278931, 1638783316.0126734], "version": 0.2, "tvm_version": "0.9.dev0"}
{"input": ["rocm -keys=rocm,gpu -max_num_threads=256 -mcpu=gfx906 -mtriple=amdgcn-amd-amdhsa-hcc -thread_warp_size=64", "conv2d_nchw.cuda", [["TENSOR", [128, 1008, 42, 42], "float32"], ["TENSOR", [168, 1008, 1, 1], "float32"], 1, 0, 1, "float32"], {}], "config": {"index": 80819245, "code_hash": null, "entity": [["tile_f", "sp", [-1, 2, 6, 1]], ["tile_y", "sp", [-1, 1, 6, 1]], ["tile_x", "sp", [-1, 1, 7, 3]], ["tile_rc", "sp", [-1, 2]], ["tile_ry", "sp", [-1, 1]], ["tile_rx", "sp", [-1, 1]], ["auto_unroll_max_step", "ot", 1500], ["unroll_explicit", "ot", 1]]}, "result": [[0.02712401175], 0, 7.276565313339233, 1638783322.8382967], "version": 0.2, "tvm_version": "0.9.dev0"}
{"input": ["rocm -keys=rocm,gpu -max_num_threads=256 -mcpu=gfx906 -mtriple=amdgcn-amd-amdhsa-hcc -thread_warp_size=64", "conv2d_nchw.cuda", [["TENSOR", [128, 1008, 42, 42], "float32"], ["TENSOR", [168, 1008, 1, 1], "float32"], 1, 0, 1, "float32"], {}], "config": {"index": 3446537, "code_hash": null, "entity": [["tile_f", "sp", [-1, 2, 21, 2]], ["tile_y", "sp", [-1, 1, 7, 1]], ["tile_x", "sp", [-1, 1, 2, 3]], ["tile_rc", "sp", [-1, 3]], ["tile_ry", "sp", [-1, 1]], ["tile_rx", "sp", [-1, 1]], ["auto_unroll_max_step", "ot", 0], ["unroll_explicit", "ot", 1]]}, "result": [[0.0252695235], 0, 7.078877687454224, 1638783329.4394274], "version": 0.2, "tvm_version": "0.9.dev0"}
{"input": ["rocm -keys=rocm,gpu -max_num_threads=256 -mcpu=gfx906 -mtriple=amdgcn-amd-amdhsa-hcc -thread_warp_size=64", "conv2d_nchw.cuda", [["TENSOR", [128, 1008, 42, 42], "float32"], ["TENSOR", [168, 1008, 1, 1], "float32"], 1, 0, 1, "float32"], {}], "config": {"index": 43052882, "code_hash": null, "entity": [["tile_f", "sp", [-1, 1, 42, 1]], ["tile_y", "sp", [-1, 1, 3, 1]], ["tile_x", "sp", [-1, 1, 3, 7]], ["tile_rc", "sp", [-1, 3]], ["tile_ry", "sp", [-1, 1]], ["tile_rx", "sp", [-1, 1]], ["auto_unroll_max_step", "ot", 512], ["unroll_explicit", "ot", 1]]}, "result": [[0.02617703625], 0, 6.992066144943237, 1638783336.0195656], "version": 0.2, "tvm_version": "0.9.dev0"}
{"input": ["rocm -keys=rocm,gpu -max_num_threads=256 -mcpu=gfx906 -mtriple=amdgcn-amd-amdhsa-hcc -thread_warp_size=64", "conv2d_nchw.cuda", [["TENSOR", [128, 1008, 42, 42], "float32"], ["TENSOR", [168, 1008, 1, 1], "float32"], 1, 0, 1, "float32"], {}], "config": {"index": 79058128, "code_hash": null, "entity": [["tile_f", "sp", [-1, 2, 2, 6]], ["tile_y", "sp", [-1, 1, 6, 1]], ["tile_x", "sp", [-1, 3, 7, 1]], ["tile_rc", "sp", [-1, 1]], ["tile_ry", "sp", [-1, 1]], ["tile_rx", "sp", [-1, 1]], ["auto_unroll_max_step", "ot", 1500], ["unroll_explicit", "ot", 1]]}, "result": [[0.0328689345], 0, 7.23587703704834, 1638783342.7369463], "version": 0.2, "tvm_version": "0.9.dev0"}
{"input": ["rocm -keys=rocm,gpu -max_num_threads=256 -mcpu=gfx906 -mtriple=amdgcn-amd-amdhsa-hcc -thread_warp_size=64", "conv2d_nchw.cuda", [["TENSOR", [128, 1008, 42, 42], "float32"], ["TENSOR", [168, 1008, 1, 1], "float32"], 1, 0, 1, "float32"], {}], "config": {"index": 41744068, "code_hash": null, "entity": [["tile_f", "sp", [-1, 3, 14, 1]], ["tile_y", "sp", [-1, 1, 7, 1]], ["tile_x", "sp", [-1, 1, 3, 7]], ["tile_rc", "sp", [-1, 2]], ["tile_ry", "sp", [-1, 1]], ["tile_rx", "sp", [-1, 1]], ["auto_unroll_max_step", "ot", 512], ["unroll_explicit", "ot", 1]]}, "result": [[0.02949138825], 0, 7.108030319213867, 1638783349.3848245], "version": 0.2, "tvm_version": "0.9.dev0"}
{"input": ["rocm -keys=rocm,gpu -max_num_threads=256 -mcpu=gfx906 -mtriple=amdgcn-amd-amdhsa-hcc -thread_warp_size=64", "conv2d_nchw.cuda", [["TENSOR", [128, 1008, 42, 42], "float32"], ["TENSOR", [168, 1008, 1, 1], "float32"], 1, 0, 1, "float32"], {}], "config": {"index": 3118831, "code_hash": null, "entity": [["tile_f", "sp", [-1, 2, 3, 2]], ["tile_y", "sp", [-1, 1, 7, 1]], ["tile_x", "sp", [-1, 1, 21, 1]], ["tile_rc", "sp", [-1, 3]], ["tile_ry", "sp", [-1, 1]], ["tile_rx", "sp", [-1, 1]], ["auto_unroll_max_step", "ot", 0], ["unroll_explicit", "ot", 1]]}, "result": [[0.0397028045], 0, 7.03955078125, 1638783356.000565], "version": 0.2, "tvm_version": "0.9.dev0"}
{"input": ["rocm -keys=rocm,gpu -max_num_threads=256 -mcpu=gfx906 -mtriple=amdgcn-amd-amdhsa-hcc -thread_warp_size=64", "conv2d_nchw.cuda", [["TENSOR", [128, 1008, 42, 42], "float32"], ["TENSOR", [168, 1008, 1, 1], "float32"], 1, 0, 1, "float32"], {}], "config": {"index": 80819252, "code_hash": null, "entity": [["tile_f", "sp", [-1, 3, 7, 1]], ["tile_y", "sp", [-1, 1, 6, 1]], ["tile_x", "sp", [-1, 1, 7, 3]], ["tile_rc", "sp", [-1, 2]], ["tile_ry", "sp", [-1, 1]], ["tile_rx", "sp", [-1, 1]], ["auto_unroll_max_step", "ot", 1500], ["unroll_explicit", "ot", 1]]}, "result": [[0.033747303], 0, 7.054124355316162, 1638783362.6422675], "version": 0.2, "tvm_version": "0.9.dev0"}
{"input": ["rocm -keys=rocm,gpu -max_num_threads=256 -mcpu=gfx906 -mtriple=amdgcn-amd-amdhsa-hcc -thread_warp_size=64", "conv2d_nchw.cuda", [["TENSOR", [128, 1008, 42, 42], "float32"], ["TENSOR", [168, 1008, 1, 1], "float32"], 1, 0, 1, "float32"], {}], "config": {"index": 41497652, "code_hash": null, "entity": [["tile_f", "sp", [-1, 3, 7, 1]], ["tile_y", "sp", [-1, 1, 6, 1]], ["tile_x", "sp", [-1, 1, 7, 3]], ["tile_rc", "sp", [-1, 2]], ["tile_ry", "sp", [-1, 1]], ["tile_rx", "sp", [-1, 1]], ["auto_unroll_max_step", "ot", 512], ["unroll_explicit", "ot", 1]]}, "result": [[0.03377522275], 0, 7.064143657684326, 1638783369.286767], "version": 0.2, "tvm_version": "0.9.dev0"}
{"input": ["rocm -keys=rocm,gpu -max_num_threads=256 -mcpu=gfx906 -mtriple=amdgcn-amd-amdhsa-hcc -thread_warp_size=64", "conv2d_nchw.cuda", [["TENSOR", [128, 1008, 42, 42], "float32"], ["TENSOR", [168, 1008, 1, 1], "float32"], 1, 0, 1, "float32"], {}], "config": {"index": 84301034, "code_hash": null, "entity": [["tile_f", "sp", [-1, 2, 3, 7]], ["tile_y", "sp", [-1, 1, 6, 1]], ["tile_x", "sp", [-1, 3, 7, 1]], ["tile_rc", "sp", [-1, 6]], ["tile_ry", "sp", [-1, 1]], ["tile_rx", "sp", [-1, 1]], ["auto_unroll_max_step", "ot", 1500], ["unroll_explicit", "ot", 1]]}, "result": [[0.04257075875], 0, 7.4034905433654785, 1638783375.9761987], "version": 0.2, "tvm_version": "0.9.dev0"}
{"input": ["rocm -keys=rocm,gpu -max_num_threads=256 -mcpu=gfx906 -mtriple=amdgcn-amd-amdhsa-hcc -thread_warp_size=64", "conv2d_nchw.cuda", [["TENSOR", [128, 1008, 42, 42], "float32"], ["TENSOR", [168, 1008, 1, 1], "float32"], 1, 0, 1, "float32"], {}], "config": {"index": 3267016, "code_hash": null, "entity": [["tile_f", "sp", [-1, 1, 21, 2]], ["tile_y", "sp", [-1, 1, 7, 2]], ["tile_x", "sp", [-1, 1, 3, 2]], ["tile_rc", "sp", [-1, 3]], ["tile_ry", "sp", [-1, 1]], ["tile_rx", "sp", [-1, 1]], ["auto_unroll_max_step", "ot", 0], ["unroll_explicit", "ot", 1]]}, "result": [[0.024559226833333333], 0, 7.1094841957092285, 1638783382.673213], "version": 0.2, "tvm_version": "0.9.dev0"}
{"input": ["rocm -keys=rocm,gpu -max_num_threads=256 -mcpu=gfx906 -mtriple=amdgcn-amd-amdhsa-hcc -thread_warp_size=64", "conv2d_nchw.cuda", [["TENSOR", [128, 1008, 42, 42], "float32"], ["TENSOR", [168, 1008, 1, 1], "float32"], 1, 0, 1, "float32"], {}], "config": {"index": 80450578, "code_hash": null, "entity": [["tile_f", "sp", [-1, 3, 2, 1]], ["tile_y", "sp", [-1, 1, 6, 1]], ["tile_x", "sp", [-1, 1, 21, 1]], ["tile_rc", "sp", [-1, 2]], ["tile_ry", "sp", [-1, 1]], ["tile_rx", "sp", [-1, 1]], ["auto_unroll_max_step", "ot", 1500], ["unroll_explicit", "ot", 1]]}, "result": [[0.045300804], 0, 7.181615829467773, 1638783389.4281373], "version": 0.2, "tvm_version": "0.9.dev0"}
{"input": ["rocm -keys=rocm,gpu -max_num_threads=256 -mcpu=gfx906 -mtriple=amdgcn-amd-amdhsa-hcc -thread_warp_size=64", "conv2d_nchw.cuda", [["TENSOR", [128, 1008, 42, 42], "float32"], ["TENSOR", [168, 1008, 1, 1], "float32"], 1, 0, 1, "float32"], {}], "config": {"index": 41128978, "code_hash": null, "entity": [["tile_f", "sp", [-1, 3, 2, 1]], ["tile_y", "sp", [-1, 1, 6, 1]], ["tile_x", "sp", [-1, 1, 21, 1]], ["tile_rc", "sp", [-1, 2]], ["tile_ry", "sp", [-1, 1]], ["tile_rx", "sp", [-1, 1]], ["auto_unroll_max_step", "ot", 512], ["unroll_explicit", "ot", 1]]}, "result": [[0.04785100925], 0, 7.0729615688323975, 1638783396.0997725], "version": 0.2, "tvm_version": "0.9.dev0"}
{"input": ["rocm -keys=rocm,gpu -max_num_threads=256 -mcpu=gfx906 -mtriple=amdgcn-amd-amdhsa-hcc -thread_warp_size=64", "conv2d_nchw.cuda", [["TENSOR", [128, 1008, 42, 42], "float32"], ["TENSOR", [168, 1008, 1, 1], "float32"], 1, 0, 1, "float32"], {}], "config": {"index": 4428837, "code_hash": null, "entity": [["tile_f", "sp", [-1, 2, 4, 1]], ["tile_y", "sp", [-1, 1, 6, 1]], ["tile_x", "sp", [-1, 1, 21, 1]], ["tile_rc", "sp", [-1, 4]], ["tile_ry", "sp", [-1, 1]], ["tile_rx", "sp", [-1, 1]], ["auto_unroll_max_step", "ot", 0], ["unroll_explicit", "ot", 1]]}, "result": [[0.0478351095], 0, 7.098592281341553, 1638783402.8210106], "version": 0.2, "tvm_version": "0.9.dev0"}
{"input": ["rocm -keys=rocm,gpu -max_num_threads=256 -mcpu=gfx906 -mtriple=amdgcn-amd-amdhsa-hcc -thread_warp_size=64", "conv2d_nchw.cuda", [["TENSOR", [128, 1008, 42, 42], "float32"], ["TENSOR", [168, 1008, 1, 1], "float32"], 1, 0, 1, "float32"], {}], "config": {"index": 3487485, "code_hash": null, "entity": [["tile_f", "sp", [-1, 2, 7, 2]], ["tile_y", "sp", [-1, 1, 7, 1]], ["tile_x", "sp", [-1, 1, 7, 3]], ["tile_rc", "sp", [-1, 3]], ["tile_ry", "sp", [-1, 1]], ["tile_rx", "sp", [-1, 1]], ["auto_unroll_max_step", "ot", 0], ["unroll_explicit", "ot", 1]]}, "result": [[0.03098208025], 0, 7.06076455116272, 1638783409.4448996], "version": 0.2, "tvm_version": "0.9.dev0"}
{"input": ["rocm -keys=rocm,gpu -max_num_threads=256 -mcpu=gfx906 -mtriple=amdgcn-amd-amdhsa-hcc -thread_warp_size=64", "conv2d_nchw.cuda", [["TENSOR", [128, 1008, 42, 42], "float32"], ["TENSOR", [168, 1008, 1, 1], "float32"], 1, 0, 1, "float32"], {}], "config": {"index": 5739754, "code_hash": null, "entity": [["tile_f", "sp", [-1, 2, 3, 7]], ["tile_y", "sp", [-1, 1, 6, 1]], ["tile_x", "sp", [-1, 1, 21, 1]], ["tile_rc", "sp", [-1, 6]], ["tile_ry", "sp", [-1, 1]], ["tile_rx", "sp", [-1, 1]], ["auto_unroll_max_step", "ot", 0], ["unroll_explicit", "ot", 1]]}, "result": [[0.021913225666666664], 0, 7.155742168426514, 1638783416.1507494], "version": 0.2, "tvm_version": "0.9.dev0"}
{"input": ["rocm -keys=rocm,gpu -max_num_threads=256 -mcpu=gfx906 -mtriple=amdgcn-amd-amdhsa-hcc -thread_warp_size=64", "conv2d_nchw.cuda", [["TENSOR", [128, 1008, 42, 42], "float32"], ["TENSOR", [168, 1008, 1, 1], "float32"], 1, 0, 1, "float32"], {}], "config": {"index": 42768137, "code_hash": null, "entity": [["tile_f", "sp", [-1, 2, 21, 2]], ["tile_y", "sp", [-1, 1, 7, 1]], ["tile_x", "sp", [-1, 1, 2, 3]], ["tile_rc", "sp", [-1, 3]], ["tile_ry", "sp", [-1, 1]], ["tile_rx", "sp", [-1, 1]], ["auto_unroll_max_step", "ot", 512], ["unroll_explicit", "ot", 1]]}, "result": [[0.02315432216666666], 0, 7.305098295211792, 1638783423.0766275], "version": 0.2, "tvm_version": "0.9.dev0"}
{"input": ["rocm -keys=rocm,gpu -max_num_threads=256 -mcpu=gfx906 -mtriple=amdgcn-amd-amdhsa-hcc -thread_warp_size=64", "conv2d_nchw.cuda", [["TENSOR", [128, 1008, 42, 42], "float32"], ["TENSOR", [168, 1008, 1, 1], "float32"], 1, 0, 1, "float32"], {}], "config": {"index": 1132205, "code_hash": null, "entity": [["tile_f", "sp", [-1, 2, 6, 1]], ["tile_y", "sp", [-1, 1, 7, 1]], ["tile_x", "sp", [-1, 2, 3, 7]], ["tile_rc", "sp", [-1, 1]], ["tile_ry", "sp", [-1, 1]], ["tile_rx", "sp", [-1, 1]], ["auto_unroll_max_step", "ot", 0], ["unroll_explicit", "ot", 1]]}, "result": [[0.0322197455], 0, 7.039820194244385, 1638783429.6972687], "version": 0.2, "tvm_version": "0.9.dev0"}
{"input": ["rocm -keys=rocm,gpu -max_num_threads=256 -mcpu=gfx906 -mtriple=amdgcn-amd-amdhsa-hcc -thread_warp_size=64", "conv2d_nchw.cuda", [["TENSOR", [128, 1008, 42, 42], "float32"], ["TENSOR", [168, 1008, 1, 1], "float32"], 1, 0, 1, "float32"], {}], "config": {"index": 82089736, "code_hash": null, "entity": [["tile_f", "sp", [-1, 1, 21, 2]], ["tile_y", "sp", [-1, 1, 7, 1]], ["tile_x", "sp", [-1, 1, 2, 3]], ["tile_rc", "sp", [-1, 3]], ["tile_ry", "sp", [-1, 1]], ["tile_rx", "sp", [-1, 1]], ["auto_unroll_max_step", "ot", 1500], ["unroll_explicit", "ot", 1]]}, "result": [[0.034147228], 0, 7.019255638122559, 1638783436.2849088], "version": 0.2, "tvm_version": "0.9.dev0"}
{"input": ["rocm -keys=rocm,gpu -max_num_threads=256 -mcpu=gfx906 -mtriple=amdgcn-amd-amdhsa-hcc -thread_warp_size=64", "conv2d_nchw.cuda", [["TENSOR", [128, 1008, 42, 42], "float32"], ["TENSOR", [168, 1008, 1, 1], "float32"], 1, 0, 1, "float32"], {}], "config": {"index": 1570052, "code_hash": null, "entity": [["tile_f", "sp", [-1, 1, 14, 2]], ["tile_y", "sp", [-1, 1, 7, 3]], ["tile_x", "sp", [-1, 1, 3, 1]], ["tile_rc", "sp", [-1, 2]], ["tile_ry", "sp", [-1, 1]], ["tile_rx", "sp", [-1, 1]], ["auto_unroll_max_step", "ot", 0], ["unroll_explicit", "ot", 1]]}, "result": [[0.041520442750000004], 0, 7.035773038864136, 1638783442.9168594], "version": 0.2, "tvm_version": "0.9.dev0"}
{"input": ["rocm -keys=rocm,gpu -max_num_threads=256 -mcpu=gfx906 -mtriple=amdgcn-amd-amdhsa-hcc -thread_warp_size=64", "conv2d_nchw.cuda", [["TENSOR", [128, 1008, 42, 42], "float32"], ["TENSOR", [168, 1008, 1, 1], "float32"], 1, 0, 1, "float32"], {}], "config": {"index": 42440431, "code_hash": null, "entity": [["tile_f", "sp", [-1, 2, 3, 2]], ["tile_y", "sp", [-1, 1, 7, 1]], ["tile_x", "sp", [-1, 1, 21, 1]], ["tile_rc", "sp", [-1, 3]], ["tile_ry", "sp", [-1, 1]], ["tile_rx", "sp", [-1, 1]], ["auto_unroll_max_step", "ot", 512], ["unroll_explicit", "ot", 1]]}, "result": [[0.03698216625], 0, 7.11724066734314, 1638783449.6335037], "version": 0.2, "tvm_version": "0.9.dev0"}
{"input": ["rocm -keys=rocm,gpu -max_num_threads=256 -mcpu=gfx906 -mtriple=amdgcn-amd-amdhsa-hcc -thread_warp_size=64", "conv2d_nchw.cuda", [["TENSOR", [128, 1008, 42, 42], "float32"], ["TENSOR", [168, 1008, 1, 1], "float32"], 1, 0, 1, "float32"], {}], "config": {"index": 81762031, "code_hash": null, "entity": [["tile_f", "sp", [-1, 2, 3, 2]], ["tile_y", "sp", [-1, 1, 7, 1]], ["tile_x", "sp", [-1, 1, 21, 1]], ["tile_rc", "sp", [-1, 3]], ["tile_ry", "sp", [-1, 1]], ["tile_rx", "sp", [-1, 1]], ["auto_unroll_max_step", "ot", 1500], ["unroll_explicit", "ot", 1]]}, "result": [[0.0391921575], 0, 6.977543592453003, 1638783456.2173626], "version": 0.2, "tvm_version": "0.9.dev0"}
{"input": ["rocm -keys=rocm,gpu -max_num_threads=256 -mcpu=gfx906 -mtriple=amdgcn-amd-amdhsa-hcc -thread_warp_size=64", "conv2d_nchw.cuda", [["TENSOR", [128, 1008, 42, 42], "float32"], ["TENSOR", [168, 1008, 1, 1], "float32"], 1, 0, 1, "float32"], {}], "config": {"index": 1725598, "code_hash": null, "entity": [["tile_f", "sp", [-1, 1, 4, 3]], ["tile_y", "sp", [-1, 1, 6, 1]], ["tile_x", "sp", [-1, 3, 7, 1]], ["tile_rc", "sp", [-1, 2]], ["tile_ry", "sp", [-1, 1]], ["tile_rx", "sp", [-1, 1]], ["auto_unroll_max_step", "ot", 0], ["unroll_explicit", "ot", 1]]}, "result": [[0.03189218325], 0, 8.087056636810303, 1638783463.9546754], "version": 0.2, "tvm_version": "0.9.dev0"}
{"input": ["rocm -keys=rocm,gpu -max_num_threads=256 -mcpu=gfx906 -mtriple=amdgcn-amd-amdhsa-hcc -thread_warp_size=64", "conv2d_nchw.cuda", [["TENSOR", [128, 1008, 42, 42], "float32"], ["TENSOR", [168, 1008, 1, 1], "float32"], 1, 0, 1, "float32"], {}], "config": {"index": 83072037, "code_hash": null, "entity": [["tile_f", "sp", [-1, 2, 4, 1]], ["tile_y", "sp", [-1, 1, 6, 1]], ["tile_x", "sp", [-1, 1, 21, 1]], ["tile_rc", "sp", [-1, 4]], ["tile_ry", "sp", [-1, 1]], ["tile_rx", "sp", [-1, 1]], ["auto_unroll_max_step", "ot", 1500], ["unroll_explicit", "ot", 1]]}, "result": [[0.04559848775], 0, 7.205157518386841, 1638783470.767782], "version": 0.2, "tvm_version": "0.9.dev0"}
{"input": ["rocm -keys=rocm,gpu -max_num_threads=256 -mcpu=gfx906 -mtriple=amdgcn-amd-amdhsa-hcc -thread_warp_size=64", "conv2d_nchw.cuda", [["TENSOR", [128, 1008, 42, 42], "float32"], ["TENSOR", [168, 1008, 1, 1], "float32"], 1, 0, 1, "float32"], {}], "config": {"index": 43750437, "code_hash": null, "entity": [["tile_f", "sp", [-1, 2, 4, 1]], ["tile_y", "sp", [-1, 1, 6, 1]], ["tile_x", "sp", [-1, 1, 21, 1]], ["tile_rc", "sp", [-1, 4]], ["tile_ry", "sp", [-1, 1]], ["tile_rx", "sp", [-1, 1]], ["auto_unroll_max_step", "ot", 512], ["unroll_explicit", "ot", 1]]}, "result": [[0.047845886], 0, 7.048106670379639, 1638783477.457495], "version": 0.2, "tvm_version": "0.9.dev0"}
{"input": ["rocm -keys=rocm,gpu -max_num_threads=256 -mcpu=gfx906 -mtriple=amdgcn-amd-amdhsa-hcc -thread_warp_size=64", "conv2d_nchw.cuda", [["TENSOR", [128, 1008, 42, 42], "float32"], ["TENSOR", [168, 1008, 1, 1], "float32"], 1, 0, 1, "float32"], {}], "config": {"index": 3486856, "code_hash": null, "entity": [["tile_f", "sp", [-1, 1, 21, 2]], ["tile_y", "sp", [-1, 1, 6, 1]], ["tile_x", "sp", [-1, 1, 7, 3]], ["tile_rc", "sp", [-1, 3]], ["tile_ry", "sp", [-1, 1]], ["tile_rx", "sp", [-1, 1]], ["auto_unroll_max_step", "ot", 0], ["unroll_explicit", "ot", 1]]}, "result": [[0.04770459725], 0, 7.063167572021484, 1638783484.1359675], "version": 0.2, "tvm_version": "0.9.dev0"}
{"input": ["rocm -keys=rocm,gpu -max_num_threads=256 -mcpu=gfx906 -mtriple=amdgcn-amd-amdhsa-hcc -thread_warp_size=64", "conv2d_nchw.cuda", [["TENSOR", [128, 1008, 42, 42], "float32"], ["TENSOR", [168, 1008, 1, 1], "float32"], 1, 0, 1, "float32"], {}], "config": {"index": 42809085, "code_hash": null, "entity": [["tile_f", "sp", [-1, 2, 7, 2]], ["tile_y", "sp", [-1, 1, 7, 1]], ["tile_x", "sp", [-1, 1, 7, 3]], ["tile_rc", "sp", [-1, 3]], ["tile_ry", "sp", [-1, 1]], ["tile_rx", "sp", [-1, 1]], ["auto_unroll_max_step", "ot", 512], ["unroll_explicit", "ot", 1]]}, "result": [[0.02791637025], 0, 7.227494239807129, 1638783490.940672], "version": 0.2, "tvm_version": "0.9.dev0"}
{"input": ["rocm -keys=rocm,gpu -max_num_threads=256 -mcpu=gfx906 -mtriple=amdgcn-amd-amdhsa-hcc -thread_warp_size=64", "conv2d_nchw.cuda", [["TENSOR", [128, 1008, 42, 42], "float32"], ["TENSOR", [168, 1008, 1, 1], "float32"], 1, 0, 1, "float32"], {}], "config": {"index": 4798142, "code_hash": null, "entity": [["tile_f", "sp", [-1, 1, 12, 1]], ["tile_y", "sp", [-1, 1, 7, 1]], ["tile_x", "sp", [-1, 1, 7, 3]], ["tile_rc", "sp", [-1, 4]], ["tile_ry", "sp", [-1, 1]], ["tile_rx", "sp", [-1, 1]], ["auto_unroll_max_step", "ot", 0], ["unroll_explicit", "ot", 1]]}, "result": [[0.05251730725], 0, 7.107205152511597, 1638783497.683728], "version": 0.2, "tvm_version": "0.9.dev0"}
{"input": ["rocm -keys=rocm,gpu -max_num_threads=256 -mcpu=gfx906 -mtriple=amdgcn-amd-amdhsa-hcc -thread_warp_size=64", "conv2d_nchw.cuda", [["TENSOR", [128, 1008, 42, 42], "float32"], ["TENSOR", [168, 1008, 1, 1], "float32"], 1, 0, 1, "float32"], {}], "config": {"index": 45061354, "code_hash": null, "entity": [["tile_f", "sp", [-1, 2, 3, 7]], ["tile_y", "sp", [-1, 1, 6, 1]], ["tile_x", "sp", [-1, 1, 21, 1]], ["tile_rc", "sp", [-1, 6]], ["tile_ry", "sp", [-1, 1]], ["tile_rx", "sp", [-1, 1]], ["auto_unroll_max_step", "ot", 512], ["unroll_explicit", "ot", 1]]}, "result": [[0.022352752666666666], 0, 7.223300457000732, 1638783504.4736805], "version": 0.2, "tvm_version": "0.9.dev0"}
{"input": ["rocm -keys=rocm,gpu -max_num_threads=256 -mcpu=gfx906 -mtriple=amdgcn-amd-amdhsa-hcc -thread_warp_size=64", "conv2d_nchw.cuda", [["TENSOR", [128, 1008, 42, 42], "float32"], ["TENSOR", [168, 1008, 1, 1], "float32"], 1, 0, 1, "float32"], {}], "config": {"index": 3369362, "code_hash": null, "entity": [["tile_f", "sp", [-1, 1, 42, 1]], ["tile_y", "sp", [-1, 1, 7, 2]], ["tile_x", "sp", [-1, 1, 1, 3]], ["tile_rc", "sp", [-1, 3]], ["tile_ry", "sp", [-1, 1]], ["tile_rx", "sp", [-1, 1]], ["auto_unroll_max_step", "ot", 0], ["unroll_explicit", "ot", 1]]}, "result": [[0.033158985], 0, 7.737213134765625, 1638783511.8415577], "version": 0.2, "tvm_version": "0.9.dev0"}
{"input": ["rocm -keys=rocm,gpu -max_num_threads=256 -mcpu=gfx906 -mtriple=amdgcn-amd-amdhsa-hcc -thread_warp_size=64", "conv2d_nchw.cuda", [["TENSOR", [128, 1008, 42, 42], "float32"], ["TENSOR", [168, 1008, 1, 1], "float32"], 1, 0, 1, "float32"], {}], "config": {"index": 3123005, "code_hash": null, "entity": [["tile_f", "sp", [-1, 2, 7, 2]], ["tile_y", "sp", [-1, 1, 3, 2]], ["tile_x", "sp", [-1, 1, 21, 1]], ["tile_rc", "sp", [-1, 3]], ["tile_ry", "sp", [-1, 1]], ["tile_rx", "sp", [-1, 1]], ["auto_unroll_max_step", "ot", 0], ["unroll_explicit", "ot", 1]]}, "result": [[0.024899487666666668], 0, 7.059770584106445, 1638783518.51667], "version": 0.2, "tvm_version": "0.9.dev0"}
{"input": ["rocm -keys=rocm,gpu -max_num_threads=256 -mcpu=gfx906 -mtriple=amdgcn-amd-amdhsa-hcc -thread_warp_size=64", "conv2d_nchw.cuda", [["TENSOR", [128, 1008, 42, 42], "float32"], ["TENSOR", [168, 1008, 1, 1], "float32"], 1, 0, 1, "float32"], {}], "config": {"index": 865392, "code_hash": null, "entity": [["tile_f", "sp", [-1, 4, 3, 2]], ["tile_y", "sp", [-1, 1, 6, 1]], ["tile_x", "sp", [-1, 1, 7, 3]], ["tile_rc", "sp", [-1, 1]], ["tile_ry", "sp", [-1, 1]], ["tile_rx", "sp", [-1, 1]], ["auto_unroll_max_step", "ot", 0], ["unroll_explicit", "ot", 1]]}, "result": [[0.023349983166666668], 0, 7.0392539501190186, 1638783525.1387079], "version": 0.2, "tvm_version": "0.9.dev0"}
{"input": ["rocm -keys=rocm,gpu -max_num_threads=256 -mcpu=gfx906 -mtriple=amdgcn-amd-amdhsa-hcc -thread_warp_size=64", "conv2d_nchw.cuda", [["TENSOR", [128, 1008, 42, 42], "float32"], ["TENSOR", [168, 1008, 1, 1], "float32"], 1, 0, 1, "float32"], {}], "config": {"index": 3118108, "code_hash": null, "entity": [["tile_f", "sp", [-1, 1, 3, 1]], ["tile_y", "sp", [-1, 1, 6, 1]], ["tile_x", "sp", [-1, 1, 21, 1]], ["tile_rc", "sp", [-1, 3]], ["tile_ry", "sp", [-1, 1]], ["tile_rx", "sp", [-1, 1]], ["auto_unroll_max_step", "ot", 0], ["unroll_explicit", "ot", 1]]}, "result": [[0.1314258575], 0, 7.489729881286621, 1638783532.257628], "version": 0.2, "tvm_version": "0.9.dev0"}
{"input": ["rocm -keys=rocm,gpu -max_num_threads=256 -mcpu=gfx906 -mtriple=amdgcn-amd-amdhsa-hcc -thread_warp_size=64", "conv2d_nchw.cuda", [["TENSOR", [128, 1008, 42, 42], "float32"], ["TENSOR", [168, 1008, 1, 1], "float32"], 1, 0, 1, "float32"], {}], "config": {"index": 3485573, "code_hash": null, "entity": [["tile_f", "sp", [-1, 2, 14, 2]], ["tile_y", "sp", [-1, 1, 3, 1]], ["tile_x", "sp", [-1, 1, 7, 3]], ["tile_rc", "sp", [-1, 3]], ["tile_ry", "sp", [-1, 1]], ["tile_rx", "sp", [-1, 1]], ["auto_unroll_max_step", "ot", 0], ["unroll_explicit", "ot", 1]]}, "result": [[0.0221692885], 0, 7.142264366149902, 1638783539.0085282], "version": 0.2, "tvm_version": "0.9.dev0"}
{"input": ["rocm -keys=rocm,gpu -max_num_threads=256 -mcpu=gfx906 -mtriple=amdgcn-amd-amdhsa-hcc -thread_warp_size=64", "conv2d_nchw.cuda", [["TENSOR", [128, 1008, 42, 42], "float32"], ["TENSOR", [168, 1008, 1, 1], "float32"], 1, 0, 1, "float32"], {}], "config": {"index": 526451, "code_hash": null, "entity": [["tile_f", "sp", [-1, 2, 7, 1]], ["tile_y", "sp", [-1, 1, 1, 6]], ["tile_x", "sp", [-1, 2, 21, 1]], ["tile_rc", "sp", [-1, 1]], ["tile_ry", "sp", [-1, 1]], ["tile_rx", "sp", [-1, 1]], ["auto_unroll_max_step", "ot", 0], ["unroll_explicit", "ot", 1]]}, "result": [[0.033975547749999994], 0, 6.782874822616577, 1638783545.6515365], "version": 0.2, "tvm_version": "0.9.dev0"}
{"input": ["rocm -keys=rocm,gpu -max_num_threads=256 -mcpu=gfx906 -mtriple=amdgcn-amd-amdhsa-hcc -thread_warp_size=64", "conv2d_nchw.cuda", [["TENSOR", [128, 1008, 42, 42], "float32"], ["TENSOR", [168, 1008, 1, 1], "float32"], 1, 0, 1, "float32"], {}], "config": {"index": 968365, "code_hash": null, "entity": [["tile_f", "sp", [-1, 2, 6, 1]], ["tile_y", "sp", [-1, 1, 7, 1]], ["tile_x", "sp", [-1, 1, 7, 6]], ["tile_rc", "sp", [-1, 1]], ["tile_ry", "sp", [-1, 1]], ["tile_rx", "sp", [-1, 1]], ["auto_unroll_max_step", "ot", 0], ["unroll_explicit", "ot", 1]]}, "result": [[0.038987911], 0, 6.751814842224121, 1638783552.2849774], "version": 0.2, "tvm_version": "0.9.dev0"}
{"input": ["rocm -keys=rocm,gpu -max_num_threads=256 -mcpu=gfx906 -mtriple=amdgcn-amd-amdhsa-hcc -thread_warp_size=64", "conv2d_nchw.cuda", [["TENSOR", [128, 1008, 42, 42], "float32"], ["TENSOR", [168, 1008, 1, 1], "float32"], 1, 0, 1, "float32"], {}], "config": {"index": 42805897, "code_hash": null, "entity": [["tile_f", "sp", [-1, 2, 21, 2]], ["tile_y", "sp", [-1, 1, 2, 1]], ["tile_x", "sp", [-1, 1, 7, 3]], ["tile_rc", "sp", [-1, 3]], ["tile_ry", "sp", [-1, 1]], ["tile_rx", "sp", [-1, 1]], ["auto_unroll_max_step", "ot", 512], ["unroll_explicit", "ot", 1]]}, "result": [[0.025079320750000002], 0, 6.653945684432983, 1638783621.5076213], "version": 0.2, "tvm_version": "0.9.dev0"}
{"input": ["rocm -keys=rocm,gpu -max_num_threads=256 -mcpu=gfx906 -mtriple=amdgcn-amd-amdhsa-hcc -thread_warp_size=64", "conv2d_nchw.cuda", [["TENSOR", [128, 1008, 42, 42], "float32"], ["TENSOR", [168, 1008, 1, 1], "float32"], 1, 0, 1, "float32"], {}], "config": {"index": 82127497, "code_hash": null, "entity": [["tile_f", "sp", [-1, 2, 21, 2]], ["tile_y", "sp", [-1, 1, 2, 1]], ["tile_x", "sp", [-1, 1, 7, 3]], ["tile_rc", "sp", [-1, 3]], ["tile_ry", "sp", [-1, 1]], ["tile_rx", "sp", [-1, 1]], ["auto_unroll_max_step", "ot", 1500], ["unroll_explicit", "ot", 1]]}, "result": [[0.025118333750000003], 0, 6.785402774810791, 1638783628.0866482], "version": 0.2, "tvm_version": "0.9.dev0"}
{"input": ["rocm -keys=rocm,gpu -max_num_threads=256 -mcpu=gfx906 -mtriple=amdgcn-amd-amdhsa-hcc -thread_warp_size=64", "conv2d_nchw.cuda", [["TENSOR", [128, 1008, 42, 42], "float32"], ["TENSOR", [168, 1008, 1, 1], "float32"], 1, 0, 1, "float32"], {}], "config": {"index": 44116617, "code_hash": null, "entity": [["tile_f", "sp", [-1, 2, 21, 2]], ["tile_y", "sp", [-1, 1, 2, 1]], ["tile_x", "sp", [-1, 1, 7, 3]], ["tile_rc", "sp", [-1, 4]], ["tile_ry", "sp", [-1, 1]], ["tile_rx", "sp", [-1, 1]], ["auto_unroll_max_step", "ot", 512], ["unroll_explicit", "ot", 1]]}, "result": [[0.02694808575], 0, 6.770740509033203, 1638783634.6317918], "version": 0.2, "tvm_version": "0.9.dev0"}
{"input": ["rocm -keys=rocm,gpu -max_num_threads=256 -mcpu=gfx906 -mtriple=amdgcn-amd-amdhsa-hcc -thread_warp_size=64", "conv2d_nchw.cuda", [["TENSOR", [128, 1008, 42, 42], "float32"], ["TENSOR", [168, 1008, 1, 1], "float32"], 1, 0, 1, "float32"], {}], "config": {"index": 4795017, "code_hash": null, "entity": [["tile_f", "sp", [-1, 2, 21, 2]], ["tile_y", "sp", [-1, 1, 2, 1]], ["tile_x", "sp", [-1, 1, 7, 3]], ["tile_rc", "sp", [-1, 4]], ["tile_ry", "sp", [-1, 1]], ["tile_rx", "sp", [-1, 1]], ["auto_unroll_max_step", "ot", 0], ["unroll_explicit", "ot", 1]]}, "result": [[0.02750604625], 0, 6.898362636566162, 1638783641.2875962], "version": 0.2, "tvm_version": "0.9.dev0"}
{"input": ["rocm -keys=rocm,gpu -max_num_threads=256 -mcpu=gfx906 -mtriple=amdgcn-amd-amdhsa-hcc -thread_warp_size=64", "conv2d_nchw.cuda", [["TENSOR", [128, 1008, 42, 42], "float32"], ["TENSOR", [168, 1008, 1, 1], "float32"], 1, 0, 1, "float32"], {}], "config": {"index": 83438217, "code_hash": null, "entity": [["tile_f", "sp", [-1, 2, 21, 2]], ["tile_y", "sp", [-1, 1, 2, 1]], ["tile_x", "sp", [-1, 1, 7, 3]], ["tile_rc", "sp", [-1, 4]], ["tile_ry", "sp", [-1, 1]], ["tile_rx", "sp", [-1, 1]], ["auto_unroll_max_step", "ot", 1500], ["unroll_explicit", "ot", 1]]}, "result": [[0.02473017616666667], 0, 7.061530113220215, 1638783648.0936365], "version": 0.2, "tvm_version": "0.9.dev0"}
{"input": ["rocm -keys=rocm,gpu -max_num_threads=256 -mcpu=gfx906 -mtriple=amdgcn-amd-amdhsa-hcc -thread_warp_size=64", "conv2d_nchw.cuda", [["TENSOR", [128, 1008, 42, 42], "float32"], ["TENSOR", [168, 1008, 1, 1], "float32"], 1, 0, 1, "float32"], {}], "config": {"index": 42908228, "code_hash": null, "entity": [["tile_f", "sp", [-1, 3, 14, 1]], ["tile_y", "sp", [-1, 1, 2, 1]], ["tile_x", "sp", [-1, 1, 7, 6]], ["tile_rc", "sp", [-1, 3]], ["tile_ry", "sp", [-1, 1]], ["tile_rx", "sp", [-1, 1]], ["auto_unroll_max_step", "ot", 512], ["unroll_explicit", "ot", 1]]}, "result": [[0.019940729666666667], 0, 7.041388988494873, 1638783654.9049797], "version": 0.2, "tvm_version": "0.9.dev0"}
{"input": ["rocm -keys=rocm,gpu -max_num_threads=256 -mcpu=gfx906 -mtriple=amdgcn-amd-amdhsa-hcc -thread_warp_size=64", "conv2d_nchw.cuda", [["TENSOR", [128, 1008, 42, 42], "float32"], ["TENSOR", [168, 1008, 1, 1], "float32"], 1, 0, 1, "float32"], {}], "config": {"index": 3490323, "code_hash": null, "entity": [["tile_f", "sp", [-1, 2, 42, 1]], ["tile_y", "sp", [-1, 1, 1, 2]], ["tile_x", "sp", [-1, 1, 7, 3]], ["tile_rc", "sp", [-1, 3]], ["tile_ry", "sp", [-1, 1]], ["tile_rx", "sp", [-1, 1]], ["auto_unroll_max_step", "ot", 0], ["unroll_explicit", "ot", 1]]}, "result": [[0.0198075955], 0, 6.903225421905518, 1638783661.5877087], "version": 0.2, "tvm_version": "0.9.dev0"}
{"input": ["rocm -keys=rocm,gpu -max_num_threads=256 -mcpu=gfx906 -mtriple=amdgcn-amd-amdhsa-hcc -thread_warp_size=64", "conv2d_nchw.cuda", [["TENSOR", [128, 1008, 42, 42], "float32"], ["TENSOR", [168, 1008, 1, 1], "float32"], 1, 0, 1, "float32"], {}], "config": {"index": 3586628, "code_hash": null, "entity": [["tile_f", "sp", [-1, 3, 14, 1]], ["tile_y", "sp", [-1, 1, 2, 1]], ["tile_x", "sp", [-1, 1, 7, 6]], ["tile_rc", "sp", [-1, 3]], ["tile_ry", "sp", [-1, 1]], ["tile_rx", "sp", [-1, 1]], ["auto_unroll_max_step", "ot", 0], ["unroll_explicit", "ot", 1]]}, "result": [[0.018605058], 0, 6.99535059928894, 1638783668.3538065], "version": 0.2, "tvm_version": "0.9.dev0"}
{"input": ["rocm -keys=rocm,gpu -max_num_threads=256 -mcpu=gfx906 -mtriple=amdgcn-amd-amdhsa-hcc -thread_warp_size=64", "conv2d_nchw.cuda", [["TENSOR", [128, 1008, 42, 42], "float32"], ["TENSOR", [168, 1008, 1, 1], "float32"], 1, 0, 1, "float32"], {}], "config": {"index": 2180863, "code_hash": null, "entity": [["tile_f", "sp", [-1, 2, 12, 1]], ["tile_y", "sp", [-1, 1, 3, 2]], ["tile_x", "sp", [-1, 1, 7, 3]], ["tile_rc", "sp", [-1, 2]], ["tile_ry", "sp", [-1, 1]], ["tile_rx", "sp", [-1, 1]], ["auto_unroll_max_step", "ot", 0], ["unroll_explicit", "ot", 1]]}, "result": [[0.021294656], 0, 6.879401445388794, 1638783675.0091481], "version": 0.2, "tvm_version": "0.9.dev0"}
{"input": ["rocm -keys=rocm,gpu -max_num_threads=256 -mcpu=gfx906 -mtriple=amdgcn-amd-amdhsa-hcc -thread_warp_size=64", "conv2d_nchw.cuda", [["TENSOR", [128, 1008, 42, 42], "float32"], ["TENSOR", [168, 1008, 1, 1], "float32"], 1, 0, 1, "float32"], {}], "config": {"index": 42807167, "code_hash": null, "entity": [["tile_f", "sp", [-1, 4, 7, 2]], ["tile_y", "sp", [-1, 1, 3, 1]], ["tile_x", "sp", [-1, 1, 7, 3]], ["tile_rc", "sp", [-1, 3]], ["tile_ry", "sp", [-1, 1]], ["tile_rx", "sp", [-1, 1]], ["auto_unroll_max_step", "ot", 512], ["unroll_explicit", "ot", 1]]}, "result": [[0.02313022866666667], 0, 7.084754943847656, 1638783681.8036673], "version": 0.2, "tvm_version": "0.9.dev0"}
