artifacts/Table4/tvm/autotvm/conv/conv2d_128_1344_21_21_336_1_1_1_0.log
{"input": ["rocm -keys=rocm,gpu -max_num_threads=256 -mcpu=gfx906 -mtriple=amdgcn-amd-amdhsa-hcc -thread_warp_size=64", "conv2d_nchw.cuda", [["TENSOR", [128, 1344, 21, 21], "float32"], ["TENSOR", [336, 1344, 1, 1], "float32"], 1, 0, 1, "float32"], {}], "config": {"index": 4189486, "code_hash": null, "entity": [["tile_f", "sp", [-1, 6, 56, 1]], ["tile_y", "sp", [-1, 1, 1, 3]], ["tile_x", "sp", [-1, 21, 1, 1]], ["tile_rc", "sp", [-1, 2]], ["tile_ry", "sp", [-1, 1]], ["tile_rx", "sp", [-1, 1]], ["auto_unroll_max_step", "ot", 512], ["unroll_explicit", "ot", 1]]}, "result": [[0.53607531725], 0, 8.210656642913818, 1638803204.0254111], "version": 0.2, "tvm_version": "0.9.dev0"}
{"input": ["rocm -keys=rocm,gpu -max_num_threads=256 -mcpu=gfx906 -mtriple=amdgcn-amd-amdhsa-hcc -thread_warp_size=64", "conv2d_nchw.cuda", [["TENSOR", [128, 1344, 21, 21], "float32"], ["TENSOR", [336, 1344, 1, 1], "float32"], 1, 0, 1, "float32"], {}], "config": {"index": 8131725, "code_hash": null, "entity": [["tile_f", "sp", [-1, 1, 1, 42]], ["tile_y", "sp", [-1, 1, 21, 1]], ["tile_x", "sp", [-1, 1, 7, 3]], ["tile_rc", "sp", [-1, 1]], ["tile_ry", "sp", [-1, 1]], ["tile_rx", "sp", [-1, 1]], ["auto_unroll_max_step", "ot", 1500], ["unroll_explicit", "ot", 1]]}, "result": [[0.395599945], 0, 5.583446502685547, 1638803209.009858], "version": 0.2, "tvm_version": "0.9.dev0"}
{"input": ["rocm -keys=rocm,gpu -max_num_threads=256 -mcpu=gfx906 -mtriple=amdgcn-amd-amdhsa-hcc -thread_warp_size=64", "conv2d_nchw.cuda", [["TENSOR", [128, 1344, 21, 21], "float32"], ["TENSOR", [336, 1344, 1, 1], "float32"], 1, 0, 1, "float32"], {}], "config": {"index": 9046882, "code_hash": null, "entity": [["tile_f", "sp", [-1, 21, 8, 1]], ["tile_y", "sp", [-1, 1, 7, 3]], ["tile_x", "sp", [-1, 3, 1, 1]], ["tile_rc", "sp", [-1, 12]], ["tile_ry", "sp", [-1, 1]], ["tile_rx", "sp", [-1, 1]], ["auto_unroll_max_step", "ot", 1500], ["unroll_explicit", "ot", 1]]}, "result": [[0.60481591775], 0, 7.442943572998047, 1638803215.1740353], "version": 0.2, "tvm_version": "0.9.dev0"}
{"input": ["rocm -keys=rocm,gpu -max_num_threads=256 -mcpu=gfx906 -mtriple=amdgcn-amd-amdhsa-hcc -thread_warp_size=64", "conv2d_nchw.cuda", [["TENSOR", [128, 1344, 21, 21], "float32"], ["TENSOR", [336, 1344, 1, 1], "float32"], 1, 0, 1, "float32"], {}], "config": {"index": 240454, "code_hash": null, "entity": [["tile_f", "sp", [-1, 2, 28, 2]], ["tile_y", "sp", [-1, 3, 1, 7]], ["tile_x", "sp", [-1, 7, 1, 3]], ["tile_rc", "sp", [-1, 2]], ["tile_ry", "sp", [-1, 1]], ["tile_rx", "sp", [-1, 1]], ["auto_unroll_max_step", "ot", 0], ["unroll_explicit", "ot", 1]]}, "result": [[0.76918548575], 0, 8.153000116348267, 1638803221.985249], "version": 0.2, "tvm_version": "0.9.dev0"}
{"input": ["rocm -keys=rocm,gpu -max_num_threads=256 -mcpu=gfx906 -mtriple=amdgcn-amd-amdhsa-hcc -thread_warp_size=64", "conv2d_nchw.cuda", [["TENSOR", [128, 1344, 21, 21], "float32"], ["TENSOR", [336, 1344, 1, 1], "float32"], 1, 0, 1, "float32"], {}], "config": {"index": 8896341, "code_hash": null, "entity": [["tile_f", "sp", [-1, 4, 6, 2]], ["tile_y", "sp", [-1, 1, 3, 7]], ["tile_x", "sp", [-1, 1, 1, 1]], ["tile_rc", "sp", [-1, 8]], ["tile_ry", "sp", [-1, 1]], ["tile_rx", "sp", [-1, 1]], ["auto_unroll_max_step", "ot", 1500], ["unroll_explicit", "ot", 1]]}, "result": [[1.0732009275], 0, 9.427072286605835, 1638803230.3534176], "version": 0.2, "tvm_version": "0.9.dev0"}
{"input": ["rocm -keys=rocm,gpu -max_num_threads=256 -mcpu=gfx906 -mtriple=amdgcn-amd-amdhsa-hcc -thread_warp_size=64", "conv2d_nchw.cuda", [["TENSOR", [128, 1344, 21, 21], "float32"], ["TENSOR", [336, 1344, 1, 1], "float32"], 1, 0, 1, "float32"], {}], "config": {"index": 4448925, "code_hash": null, "entity": [["tile_f", "sp", [-1, 6, 2, 4]], ["tile_y", "sp", [-1, 1, 21, 1]], ["tile_x", "sp", [-1, 1, 1, 1]], ["tile_rc", "sp", [-1, 4]], ["tile_ry", "sp", [-1, 1]], ["tile_rx", "sp", [-1, 1]], ["auto_unroll_max_step", "ot", 512], ["unroll_explicit", "ot", 1]]}, "result": [[0.06332639300000001], 0, 3.643054723739624, 1638803233.6686606], "version": 0.2, "tvm_version": "0.9.dev0"}
{"input": ["rocm -keys=rocm,gpu -max_num_threads=256 -mcpu=gfx906 -mtriple=amdgcn-amd-amdhsa-hcc -thread_warp_size=64", "conv2d_nchw.cuda", [["TENSOR", [128, 1344, 21, 21], "float32"], ["TENSOR", [336, 1344, 1, 1], "float32"], 1, 0, 1, "float32"], {}], "config": {"index": 9532554, "code_hash": null, "entity": [["tile_f", "sp", [-1, 112, 1, 3]], ["tile_y", "sp", [-1, 1, 3, 7]], ["tile_x", "sp", [-1, 3, 7, 1]], ["tile_rc", "sp", [-1, 21]], ["tile_ry", "sp", [-1, 1]], ["tile_rx", "sp", [-1, 1]], ["auto_unroll_max_step", "ot", 1500], ["unroll_explicit", "ot", 1]]}, "result": [[1.40699792475], 0, 16.9248526096344, 1638803243.6046433], "version": 0.2, "tvm_version": "0.9.dev0"}
{"input": ["rocm -keys=rocm,gpu -max_num_threads=256 -mcpu=gfx906 -mtriple=amdgcn-amd-amdhsa-hcc -thread_warp_size=64", "conv2d_nchw.cuda", [["TENSOR", [128, 1344, 21, 21], "float32"], ["TENSOR", [336, 1344, 1, 1], "float32"], 1, 0, 1, "float32"], {}], "config": {"index": 9188987, "code_hash": null, "entity": [["tile_f", "sp", [-1, 1, 1, 28]], ["tile_y", "sp", [-1, 1, 21, 1]], ["tile_x", "sp", [-1, 3, 1, 1]], ["tile_rc", "sp", [-1, 14]], ["tile_ry", "sp", [-1, 1]], ["tile_rx", "sp", [-1, 1]], ["auto_unroll_max_step", "ot", 1500], ["unroll_explicit", "ot", 1]]}, "result": [[2.5812424314999998], 0, 23.426203966140747, 1638803259.4706798], "version": 0.2, "tvm_version": "0.9.dev0"}
{"input": ["rocm -keys=rocm,gpu -max_num_threads=256 -mcpu=gfx906 -mtriple=amdgcn-amd-amdhsa-hcc -thread_warp_size=64", "conv2d_nchw.cuda", [["TENSOR", [128, 1344, 21, 21], "float32"], ["TENSOR", [336, 1344, 1, 1], "float32"], 1, 0, 1, "float32"], {}], "config": {"index": 4644912, "code_hash": null, "entity": [["tile_f", "sp", [-1, 3, 1, 4]], ["tile_y", "sp", [-1, 1, 7, 1]], ["tile_x", "sp", [-1, 1, 7, 1]], ["tile_rc", "sp", [-1, 6]], ["tile_ry", "sp", [-1, 1]], ["tile_rx", "sp", [-1, 1]], ["auto_unroll_max_step", "ot", 512], ["unroll_explicit", "ot", 1]]}, "result": [[0.02564476775], 0, 3.3851194381713867, 1638803262.3958879], "version": 0.2, "tvm_version": "0.9.dev0"}
{"input": ["rocm -keys=rocm,gpu -max_num_threads=256 -mcpu=gfx906 -mtriple=amdgcn-amd-amdhsa-hcc -thread_warp_size=64", "conv2d_nchw.cuda", [["TENSOR", [128, 1344, 21, 21], "float32"], ["TENSOR", [336, 1344, 1, 1], "float32"], 1, 0, 1, "float32"], {}], "config": {"index": 5765417, "code_hash": null, "entity": [["tile_f", "sp", [-1, 1, 42, 2]], ["tile_y", "sp", [-1, 3, 7, 1]], ["tile_x", "sp", [-1, 21, 1, 1]], ["tile_rc", "sp", [-1, 28]], ["tile_ry", "sp", [-1, 1]], ["tile_rx", "sp", [-1, 1]], ["auto_unroll_max_step", "ot", 512], ["unroll_explicit", "ot", 1]]}, "result": [[0.56428698725], 0, 6.357668161392212, 1638803268.0788877], "version": 0.2, "tvm_version": "0.9.dev0"}
{"input": ["rocm -keys=rocm,gpu -max_num_threads=256 -mcpu=gfx906 -mtriple=amdgcn-amd-amdhsa-hcc -thread_warp_size=64", "conv2d_nchw.cuda", [["TENSOR", [128, 1344, 21, 21], "float32"], ["TENSOR", [336, 1344, 1, 1], "float32"], 1, 0, 1, "float32"], {}], "config": {"index": 719608, "code_hash": null, "entity": [["tile_f", "sp", [-1, 14, 1, 1]], ["tile_y", "sp", [-1, 7, 3, 1]], ["tile_x", "sp", [-1, 1, 1, 1]], ["tile_rc", "sp", [-1, 7]], ["tile_ry", "sp", [-1, 1]], ["tile_rx", "sp", [-1, 1]], ["auto_unroll_max_step", "ot", 0], ["unroll_explicit", "ot", 1]]}, "result": [[4.400437988249999], 0, 25.68778347969055, 1638803293.0509892], "version": 0.2, "tvm_version": "0.9.dev0"}
{"input": ["rocm -keys=rocm,gpu -max_num_threads=256 -mcpu=gfx906 -mtriple=amdgcn-amd-amdhsa-hcc -thread_warp_size=64", "conv2d_nchw.cuda", [["TENSOR", [128, 1344, 21, 21], "float32"], ["TENSOR", [336, 1344, 1, 1], "float32"], 1, 0, 1, "float32"], {}], "config": {"index": 125784, "code_hash": null, "entity": [["tile_f", "sp", [-1, 4, 7, 6]], ["tile_y", "sp", [-1, 1, 1, 1]], ["tile_x", "sp", [-1, 1, 3, 7]], ["tile_rc", "sp", [-1, 1]], ["tile_ry", "sp", [-1, 1]], ["tile_rx", "sp", [-1, 1]], ["auto_unroll_max_step", "ot", 0], ["unroll_explicit", "ot", 1]]}, "result": [[0.6060747679999999], 0, 6.756278991699219, 1638803299.0446448], "version": 0.2, "tvm_version": "0.9.dev0"}
{"input": ["rocm -keys=rocm,gpu -max_num_threads=256 -mcpu=gfx906 -mtriple=amdgcn-amd-amdhsa-hcc -thread_warp_size=64", "conv2d_nchw.cuda", [["TENSOR", [128, 1344, 21, 21], "float32"], ["TENSOR", [336, 1344, 1, 1], "float32"], 1, 0, 1, "float32"], {}], "config": {"index": 5118596, "code_hash": null, "entity": [["tile_f", "sp", [-1, 21, 8, 2]], ["tile_y", "sp", [-1, 1, 3, 1]], ["tile_x", "sp", [-1, 1, 7, 3]], ["tile_rc", "sp", [-1, 12]], ["tile_ry", "sp", [-1, 1]], ["tile_rx", "sp", [-1, 1]], ["auto_unroll_max_step", "ot", 512], ["unroll_explicit", "ot", 1]]}, "result": [[1.161217163], 0, 9.670791149139404, 1638803307.8098478], "version": 0.2, "tvm_version": "0.9.dev0"}
{"input": ["rocm -keys=rocm,gpu -max_num_threads=256 -mcpu=gfx906 -mtriple=amdgcn-amd-amdhsa-hcc -thread_warp_size=64", "conv2d_nchw.cuda", [["TENSOR", [128, 1344, 21, 21], "float32"], ["TENSOR", [336, 1344, 1, 1], "float32"], 1, 0, 1, "float32"], {}], "config": {"index": 400685, "code_hash": null, "entity": [["tile_f", "sp", [-1, 6, 2, 4]], ["tile_y", "sp", [-1, 1, 7, 3]], ["tile_x", "sp", [-1, 1, 1, 7]], ["tile_rc", "sp", [-1, 3]], ["tile_ry", "sp", [-1, 1]], ["tile_rx", "sp", [-1, 1]], ["auto_unroll_max_step", "ot", 0], ["unroll_explicit", "ot", 1]]}, "result": [[0.95492242425], 0, 8.780463218688965, 1638803315.6053727], "version": 0.2, "tvm_version": "0.9.dev0"}
{"input": ["rocm -keys=rocm,gpu -max_num_threads=256 -mcpu=gfx906 -mtriple=amdgcn-amd-amdhsa-hcc -thread_warp_size=64", "conv2d_nchw.cuda", [["TENSOR", [128, 1344, 21, 21], "float32"], ["TENSOR", [336, 1344, 1, 1], "float32"], 1, 0, 1, "float32"], {}], "config": {"index": 5538781, "code_hash": null, "entity": [["tile_f", "sp", [-1, 6, 4, 7]], ["tile_y", "sp", [-1, 7, 1, 1]], ["tile_x", "sp", [-1, 7, 1, 3]], ["tile_rc", "sp", [-1, 21]], ["tile_ry", "sp", [-1, 1]], ["tile_rx", "sp", [-1, 1]], ["auto_unroll_max_step", "ot", 512], ["unroll_explicit", "ot", 1]]}, "result": [[11.63878808575], 0, 64.73558592796326, 1638803376.802715], "version": 0.2, "tvm_version": "0.9.dev0"}
{"input": ["rocm -keys=rocm,gpu -max_num_threads=256 -mcpu=gfx906 -mtriple=amdgcn-amd-amdhsa-hcc -thread_warp_size=64", "conv2d_nchw.cuda", [["TENSOR", [128, 1344, 21, 21], "float32"], ["TENSOR", [336, 1344, 1, 1], "float32"], 1, 0, 1, "float32"], {}], "config": {"index": 9785863, "code_hash": null, "entity": [["tile_f", "sp", [-1, 1, 21, 8]], ["tile_y", "sp", [-1, 7, 1, 1]], ["tile_x", "sp", [-1, 1, 3, 1]], ["tile_rc", "sp", [-1, 28]], ["tile_ry", "sp", [-1, 1]], ["tile_rx", "sp", [-1, 1]], ["auto_unroll_max_step", "ot", 1500], ["unroll_explicit", "ot", 1]]}, "result": [[0.31058569325], 0, 5.2083656787872314, 1638803381.3018732], "version": 0.2, "tvm_version": "0.9.dev0"}
{"input": ["rocm -keys=rocm,gpu -max_num_threads=256 -mcpu=gfx906 -mtriple=amdgcn-amd-amdhsa-hcc -thread_warp_size=64", "conv2d_nchw.cuda", [["TENSOR", [128, 1344, 21, 21], "float32"], ["TENSOR", [336, 1344, 1, 1], "float32"], 1, 0, 1, "float32"], {}], "config": {"index": 1224637, "code_hash": null, "entity": [["tile_f", "sp", [-1, 21, 1, 16]], ["tile_y", "sp", [-1, 7, 1, 3]], ["tile_x", "sp", [-1, 1, 21, 1]], ["tile_rc", "sp", [-1, 14]], ["tile_ry", "sp", [-1, 1]], ["tile_rx", "sp", [-1, 1]], ["auto_unroll_max_step", "ot", 0], ["unroll_explicit", "ot", 1]]}, "result": [[9.85395800775], 0, 54.110143184661865, 1638803433.5349936], "version": 0.2, "tvm_version": "0.9.dev0"}
{"input": ["rocm -keys=rocm,gpu -max_num_threads=256 -mcpu=gfx906 -mtriple=amdgcn-amd-amdhsa-hcc -thread_warp_size=64", "conv2d_nchw.cuda", [["TENSOR", [128, 1344, 21, 21], "float32"], ["TENSOR", [336, 1344, 1, 1], "float32"], 1, 0, 1, "float32"], {}], "config": {"index": 5591360, "code_hash": null, "entity": [["tile_f", "sp", [-1, 3, 28, 4]], ["tile_y", "sp", [-1, 1, 1, 1]], ["tile_x", "sp", [-1, 1, 1, 1]], ["tile_rc", "sp", [-1, 24]], ["tile_ry", "sp", [-1, 1]], ["tile_rx", "sp", [-1, 1]], ["auto_unroll_max_step", "ot", 512], ["unroll_explicit", "ot", 1]]}, "result": [[0.4176219175], 0, 5.906316041946411, 1638803441.528508], "version": 0.2, "tvm_version": "0.9.dev0"}
{"input": ["rocm -keys=rocm,gpu -max_num_threads=256 -mcpu=gfx906 -mtriple=amdgcn-amd-amdhsa-hcc -thread_warp_size=64", "conv2d_nchw.cuda", [["TENSOR", [128, 1344, 21, 21], "float32"], ["TENSOR", [336, 1344, 1, 1], "float32"], 1, 0, 1, "float32"], {}], "config": {"index": 1351044, "code_hash": null, "entity": [["tile_f", "sp", [-1, 1, 1, 6]], ["tile_y", "sp", [-1, 1, 1, 7]], ["tile_x", "sp", [-1, 1, 7, 1]], ["tile_rc", "sp", [-1, 16]], ["tile_ry", "sp", [-1, 1]], ["tile_rx", "sp", [-1, 1]], ["auto_unroll_max_step", "ot", 0], ["unroll_explicit", "ot", 1]]}, "result": [[0.2353275145], 0, 4.476984024047852, 1638803445.6447241], "version": 0.2, "tvm_version": "0.9.dev0"}
{"input": ["rocm -keys=rocm,gpu -max_num_threads=256 -mcpu=gfx906 -mtriple=amdgcn-amd-amdhsa-hcc -thread_warp_size=64", "conv2d_nchw.cuda", [["TENSOR", [128, 1344, 21, 21], "float32"], ["TENSOR", [336, 1344, 1, 1], "float32"], 1, 0, 1, "float32"], {}], "config": {"index": 4084668, "code_hash": null, "entity": [["tile_f", "sp", [-1, 14, 2, 1]], ["tile_y", "sp", [-1, 1, 3, 7]], ["tile_x", "sp", [-1, 3, 7, 1]], ["tile_rc", "sp", [-1, 1]], ["tile_ry", "sp", [-1, 1]], ["tile_rx", "sp", [-1, 1]], ["auto_unroll_max_step", "ot", 512], ["unroll_explicit", "ot", 1]]}, "result": [[0.5701381225], 0, 7.771679162979126, 1638803454.4036255], "version": 0.2, "tvm_version": "0.9.dev0"}
{"input": ["rocm -keys=rocm,gpu -max_num_threads=256 -mcpu=gfx906 -mtriple=amdgcn-amd-amdhsa-hcc -thread_warp_size=64", "conv2d_nchw.cuda", [["TENSOR", [128, 1344, 21, 21], "float32"], ["TENSOR", [336, 1344, 1, 1], "float32"], 1, 0, 1, "float32"], {}], "config": {"index": 8295708, "code_hash": null, "entity": [["tile_f", "sp", [-1, 4, 1, 12]], ["tile_y", "sp", [-1, 3, 1, 7]], ["tile_x", "sp", [-1, 3, 1, 7]], ["tile_rc", "sp", [-1, 2]], ["tile_ry", "sp", [-1, 1]], ["tile_rx", "sp", [-1, 1]], ["auto_unroll_max_step", "ot", 1500], ["unroll_explicit", "ot", 1]]}, "result": [[21.847439453], 0, 116.38632798194885, 1638803566.6603906], "version": 0.2, "tvm_version": "0.9.dev0"}
{"input": ["rocm -keys=rocm,gpu -max_num_threads=256 -mcpu=gfx906 -mtriple=amdgcn-amd-amdhsa-hcc -thread_warp_size=64", "conv2d_nchw.cuda", [["TENSOR", [128, 1344, 21, 21], "float32"], ["TENSOR", [336, 1344, 1, 1], "float32"], 1, 0, 1, "float32"], {}], "config": {"index": 1057141, "code_hash": null, "entity": [["tile_f", "sp", [-1, 1, 14, 8]], ["tile_y", "sp", [-1, 1, 1, 21]], ["tile_x", "sp", [-1, 7, 3, 1]], ["tile_rc", "sp", [-1, 12]], ["tile_ry", "sp", [-1, 1]], ["tile_rx", "sp", [-1, 1]], ["auto_unroll_max_step", "ot", 0], ["unroll_explicit", "ot", 1]]}, "result": [[2.1977189939999997], 0, 14.483811616897583, 1638803580.611965], "version": 0.2, "tvm_version": "0.9.dev0"}
{"input": ["rocm -keys=rocm,gpu -max_num_threads=256 -mcpu=gfx906 -mtriple=amdgcn-amd-amdhsa-hcc -thread_warp_size=64", "conv2d_nchw.cuda", [["TENSOR", [128, 1344, 21, 21], "float32"], ["TENSOR", [336, 1344, 1, 1], "float32"], 1, 0, 1, "float32"], {}], "config": {"index": 4696849, "code_hash": null, "entity": [["tile_f", "sp", [-1, 4, 84, 1]], ["tile_y", "sp", [-1, 21, 1, 1]], ["tile_x", "sp", [-1, 1, 1, 7]], ["tile_rc", "sp", [-1, 6]], ["tile_ry", "sp", [-1, 1]], ["tile_rx", "sp", [-1, 1]], ["auto_unroll_max_step", "ot", 512], ["unroll_explicit", "ot", 1]]}, "result": [[0.57414483625], 0, 6.513427257537842, 1638803586.2298539], "version": 0.2, "tvm_version": "0.9.dev0"}
{"input": ["rocm -keys=rocm,gpu -max_num_threads=256 -mcpu=gfx906 -mtriple=amdgcn-amd-amdhsa-hcc -thread_warp_size=64", "conv2d_nchw.cuda", [["TENSOR", [128, 1344, 21, 21], "float32"], ["TENSOR", [336, 1344, 1, 1], "float32"], 1, 0, 1, "float32"], {}], "config": {"index": 9950127, "code_hash": null, "entity": [["tile_f", "sp", [-1, 2, 4, 1]], ["tile_y", "sp", [-1, 1, 21, 1]], ["tile_x", "sp", [-1, 1, 7, 1]], ["tile_rc", "sp", [-1, 32]], ["tile_ry", "sp", [-1, 1]], ["tile_rx", "sp", [-1, 1]], ["auto_unroll_max_step", "ot", 1500], ["unroll_explicit", "ot", 1]]}, "result": [[0.029394733250000003], 0, 3.536308526992798, 1638803589.311563], "version": 0.2, "tvm_version": "0.9.dev0"}
{"input": ["rocm -keys=rocm,gpu -max_num_threads=256 -mcpu=gfx906 -mtriple=amdgcn-amd-amdhsa-hcc -thread_warp_size=64", "conv2d_nchw.cuda", [["TENSOR", [128, 1344, 21, 21], "float32"], ["TENSOR", [336, 1344, 1, 1], "float32"], 1, 0, 1, "float32"], {}], "config": {"index": 6257623, "code_hash": null, "entity": [["tile_f", "sp", [-1, 14, 6, 2]], ["tile_y", "sp", [-1, 1, 7, 1]], ["tile_x", "sp", [-1, 7, 1, 3]], ["tile_rc", "sp", [-1, 48]], ["tile_ry", "sp", [-1, 1]], ["tile_rx", "sp", [-1, 1]], ["auto_unroll_max_step", "ot", 512], ["unroll_explicit", "ot", 1]]}, "result": [[3.533158203], 0, 23.849941968917847, 1638803609.9370759], "version": 0.2, "tvm_version": "0.9.dev0"}
{"input": ["rocm -keys=rocm,gpu -max_num_threads=256 -mcpu=gfx906 -mtriple=amdgcn-amd-amdhsa-hcc -thread_warp_size=64", "conv2d_nchw.cuda", [["TENSOR", [128, 1344, 21, 21], "float32"], ["TENSOR", [336, 1344, 1, 1], "float32"], 1, 0, 1, "float32"], {}], "config": {"index": 15845, "code_hash": null, "entity": [["tile_f", "sp", [-1, 4, 3, 2]], ["tile_y", "sp", [-1, 1, 1, 7]], ["tile_x", "sp", [-1, 3, 1, 1]], ["tile_rc", "sp", [-1, 1]], ["tile_ry", "sp", [-1, 1]], ["tile_rx", "sp", [-1, 1]], ["auto_unroll_max_step", "ot", 0], ["unroll_explicit", "ot", 1]]}, "result": [[3.8048203125], 0, 22.766950368881226, 1638803642.1193373], "version": 0.2, "tvm_version": "0.9.dev0"}
{"input": ["rocm -keys=rocm,gpu -max_num_threads=256 -mcpu=gfx906 -mtriple=amdgcn-amd-amdhsa-hcc -thread_warp_size=64", "conv2d_nchw.cuda", [["TENSOR", [128, 1344, 21, 21], "float32"], ["TENSOR", [336, 1344, 1, 1], "float32"], 1, 0, 1, "float32"], {}], "config": {"index": 9933479, "code_hash": null, "entity": [["tile_f", "sp", [-1, 7, 12, 2]], ["tile_y", "sp", [-1, 7, 1, 3]], ["tile_x", "sp", [-1, 1, 3, 1]], ["tile_rc", "sp", [-1, 32]], ["tile_ry", "sp", [-1, 1]], ["tile_rx", "sp", [-1, 1]], ["auto_unroll_max_step", "ot", 1500], ["unroll_explicit", "ot", 1]]}, "result": [[5.256658203], 0, 32.86335062980652, 1638803671.3838158], "version": 0.2, "tvm_version": "0.9.dev0"}
{"input": ["rocm -keys=rocm,gpu -max_num_threads=256 -mcpu=gfx906 -mtriple=amdgcn-amd-amdhsa-hcc -thread_warp_size=64", "conv2d_nchw.cuda", [["TENSOR", [128, 1344, 21, 21], "float32"], ["TENSOR", [336, 1344, 1, 1], "float32"], 1, 0, 1, "float32"], {}], "config": {"index": 2588201, "code_hash": null, "entity": [["tile_f", "sp", [-1, 1, 14, 12]], ["tile_y", "sp", [-1, 3, 1, 7]], ["tile_x", "sp", [-1, 1, 1, 1]], ["tile_rc", "sp", [-1, 84]], ["tile_ry", "sp", [-1, 1]], ["tile_rx", "sp", [-1, 1]], ["auto_unroll_max_step", "ot", 0], ["unroll_explicit", "ot", 1]]}, "result": [[6.0686762695], 0, 33.85882544517517, 1638803704.6696086], "version": 0.2, "tvm_version": "0.9.dev0"}
{"input": ["rocm -keys=rocm,gpu -max_num_threads=256 -mcpu=gfx906 -mtriple=amdgcn-amd-amdhsa-hcc -thread_warp_size=64", "conv2d_nchw.cuda", [["TENSOR", [128, 1344, 21, 21], "float32"], ["TENSOR", [336, 1344, 1, 1], "float32"], 1, 0, 1, "float32"], {}], "config": {"index": 9531254, "code_hash": null, "entity": [["tile_f", "sp", [-1, 21, 4, 1]], ["tile_y", "sp", [-1, 1, 1, 7]], ["tile_x", "sp", [-1, 3, 7, 1]], ["tile_rc", "sp", [-1, 21]], ["tile_ry", "sp", [-1, 1]], ["tile_rx", "sp", [-1, 1]], ["auto_unroll_max_step", "ot", 1500], ["unroll_explicit", "ot", 1]]}, "result": [[2.85001000975], 0, 22.728004932403564, 1638803922.3967435], "version": 0.2, "tvm_version": "0.9.dev0"}
{"input": ["rocm -keys=rocm,gpu -max_num_threads=256 -mcpu=gfx906 -mtriple=amdgcn-amd-amdhsa-hcc -thread_warp_size=64", "conv2d_nchw.cuda", [["TENSOR", [128, 1344, 21, 21], "float32"], ["TENSOR", [336, 1344, 1, 1], "float32"], 1, 0, 1, "float32"], {}], "config": {"index": 8064522, "code_hash": null, "entity": [["tile_f", "sp", [-1, 1, 6, 28]], ["tile_y", "sp", [-1, 1, 1, 1]], ["tile_x", "sp", [-1, 1, 3, 1]], ["tile_rc", "sp", [-1, 1]], ["tile_ry", "sp", [-1, 1]], ["tile_rx", "sp", [-1, 1]], ["auto_unroll_max_step", "ot", 1500], ["unroll_explicit", "ot", 1]]}, "result": [[0.31516296375], 0, 4.77677845954895, 1638803926.975898], "version": 0.2, "tvm_version": "0.9.dev0"}
{"input": ["rocm -keys=rocm,gpu -max_num_threads=256 -mcpu=gfx906 -mtriple=amdgcn-amd-amdhsa-hcc -thread_warp_size=64", "conv2d_nchw.cuda", [["TENSOR", [128, 1344, 21, 21], "float32"], ["TENSOR", [336, 1344, 1, 1], "float32"], 1, 0, 1, "float32"], {}], "config": {"index": 4894596, "code_hash": null, "entity": [["tile_f", "sp", [-1, 21, 8, 2]], ["tile_y", "sp", [-1, 1, 3, 1]], ["tile_x", "sp", [-1, 7, 1, 1]], ["tile_rc", "sp", [-1, 8]], ["tile_ry", "sp", [-1, 1]], ["tile_rx", "sp", [-1, 1]], ["auto_unroll_max_step", "ot", 512], ["unroll_explicit", "ot", 1]]}, "result": [[2.3565012204999998], 0, 16.745577335357666, 1638803941.6900883], "version": 0.2, "tvm_version": "0.9.dev0"}
{"input": ["rocm -keys=rocm,gpu -max_num_threads=256 -mcpu=gfx906 -mtriple=amdgcn-amd-amdhsa-hcc -thread_warp_size=64", "conv2d_nchw.cuda", [["TENSOR", [128, 1344, 21, 21], "float32"], ["TENSOR", [336, 1344, 1, 1], "float32"], 1, 0, 1, "float32"], {}], "config": {"index": 8898996, "code_hash": null, "entity": [["tile_f", "sp", [-1, 1, 3, 1]], ["tile_y", "sp", [-1, 21, 1, 1]], ["tile_x", "sp", [-1, 3, 1, 1]], ["tile_rc", "sp", [-1, 8]], ["tile_ry", "sp", [-1, 1]], ["tile_rx", "sp", [-1, 1]], ["auto_unroll_max_step", "ot", 1500], ["unroll_explicit", "ot", 1]]}, "result": [[2.3353134765], 0, 15.557515144348145, 1638803959.448856], "version": 0.2, "tvm_version": "0.9.dev0"}
{"input": ["rocm -keys=rocm,gpu -max_num_threads=256 -mcpu=gfx906 -mtriple=amdgcn-amd-amdhsa-hcc -thread_warp_size=64", "conv2d_nchw.cuda", [["TENSOR", [128, 1344, 21, 21], "float32"], ["TENSOR", [336, 1344, 1, 1], "float32"], 1, 0, 1, "float32"], {}], "config": {"index": 1783623, "code_hash": null, "entity": [["tile_f", "sp", [-1, 4, 2, 1]], ["tile_y", "sp", [-1, 3, 1, 1]], ["tile_x", "sp", [-1, 3, 7, 1]], ["tile_rc", "sp", [-1, 28]], ["tile_ry", "sp", [-1, 1]], ["tile_rx", "sp", [-1, 1]], ["auto_unroll_max_step", "ot", 0], ["unroll_explicit", "ot", 1]]}, "result": [[0.10569569375], 0, 3.660586357116699, 1638803962.780539], "version": 0.2, "tvm_version": "0.9.dev0"}
{"input": ["rocm -keys=rocm,gpu -max_num_threads=256 -mcpu=gfx906 -mtriple=amdgcn-amd-amdhsa-hcc -thread_warp_size=64", "conv2d_nchw.cuda", [["TENSOR", [128, 1344, 21, 21], "float32"], ["TENSOR", [336, 1344, 1, 1], "float32"], 1, 0, 1, "float32"], {}], "config": {"index": 867424, "code_hash": null, "entity": [["tile_f", "sp", [-1, 1, 3, 56]], ["tile_y", "sp", [-1, 1, 1, 7]], ["tile_x", "sp", [-1, 1, 1, 1]], ["tile_rc", "sp", [-1, 8]], ["tile_ry", "sp", [-1, 1]], ["tile_rx", "sp", [-1, 1]], ["auto_unroll_max_step", "ot", 0], ["unroll_explicit", "ot", 1]]}, "result": [[3.5362277829999997], 0, 21.28164839744568, 1638803983.4220335], "version": 0.2, "tvm_version": "0.9.dev0"}
{"input": ["rocm -keys=rocm,gpu -max_num_threads=256 -mcpu=gfx906 -mtriple=amdgcn-amd-amdhsa-hcc -thread_warp_size=64", "conv2d_nchw.cuda", [["TENSOR", [128, 1344, 21, 21], "float32"], ["TENSOR", [336, 1344, 1, 1], "float32"], 1, 0, 1, "float32"], {}], "config": {"index": 9110407, "code_hash": null, "entity": [["tile_f", "sp", [-1, 7, 1, 6]], ["tile_y", "sp", [-1, 1, 1, 7]], ["tile_x", "sp", [-1, 1, 21, 1]], ["tile_rc", "sp", [-1, 12]], ["tile_ry", "sp", [-1, 1]], ["tile_rx", "sp", [-1, 1]], ["auto_unroll_max_step", "ot", 1500], ["unroll_explicit", "ot", 1]]}, "result": [[2.75784765625], 0, 19.94467043876648, 1638804000.3305898], "version": 0.2, "tvm_version": "0.9.dev0"}
{"input": ["rocm -keys=rocm,gpu -max_num_threads=256 -mcpu=gfx906 -mtriple=amdgcn-amd-amdhsa-hcc -thread_warp_size=64", "conv2d_nchw.cuda", [["TENSOR", [128, 1344, 21, 21], "float32"], ["TENSOR", [336, 1344, 1, 1], "float32"], 1, 0, 1, "float32"], {}], "config": {"index": 5495895, "code_hash": null, "entity": [["tile_f", "sp", [-1, 28, 4, 1]], ["tile_y", "sp", [-1, 1, 7, 1]], ["tile_x", "sp", [-1, 7, 3, 1]], ["tile_rc", "sp", [-1, 21]], ["tile_ry", "sp", [-1, 1]], ["tile_rx", "sp", [-1, 1]], ["auto_unroll_max_step", "ot", 512], ["unroll_explicit", "ot", 1]]}, "result": [[0.950404907], 0, 9.26009726524353, 1638804008.0181797], "version": 0.2, "tvm_version": "0.9.dev0"}
{"input": ["rocm -keys=rocm,gpu -max_num_threads=256 -mcpu=gfx906 -mtriple=amdgcn-amd-amdhsa-hcc -thread_warp_size=64", "conv2d_nchw.cuda", [["TENSOR", [128, 1344, 21, 21], "float32"], ["TENSOR", [336, 1344, 1, 1], "float32"], 1, 0, 1, "float32"], {}], "config": {"index": 6168735, "code_hash": null, "entity": [["tile_f", "sp", [-1, 7, 2, 6]], ["tile_y", "sp", [-1, 3, 7, 1]], ["tile_x", "sp", [-1, 1, 1, 1]], ["tile_rc", "sp", [-1, 48]], ["tile_ry", "sp", [-1, 1]], ["tile_rx", "sp", [-1, 1]], ["auto_unroll_max_step", "ot", 512], ["unroll_explicit", "ot", 1]]}, "result": [[7.72661328125], 0, 43.445528745651245, 1638804049.588642], "version": 0.2, "tvm_version": "0.9.dev0"}
{"input": ["rocm -keys=rocm,gpu -max_num_threads=256 -mcpu=gfx906 -mtriple=amdgcn-amd-amdhsa-hcc -thread_warp_size=64", "conv2d_nchw.cuda", [["TENSOR", [128, 1344, 21, 21], "float32"], ["TENSOR", [336, 1344, 1, 1], "float32"], 1, 0, 1, "float32"], {}], "config": {"index": 62453, "code_hash": null, "entity": [["tile_f", "sp", [-1, 7, 3, 4]], ["tile_y", "sp", [-1, 1, 1, 21]], ["tile_x", "sp", [-1, 1, 7, 1]], ["tile_rc", "sp", [-1, 1]], ["tile_ry", "sp", [-1, 1]], ["tile_rx", "sp", [-1, 1]], ["auto_unroll_max_step", "ot", 0], ["unroll_explicit", "ot", 1]]}, "result": [[0.7156885375], 0, 6.889945030212402, 1638804055.9995458], "version": 0.2, "tvm_version": "0.9.dev0"}
{"input": ["rocm -keys=rocm,gpu -max_num_threads=256 -mcpu=gfx906 -mtriple=amdgcn-amd-amdhsa-hcc -thread_warp_size=64", "conv2d_nchw.cuda", [["TENSOR", [128, 1344, 21, 21], "float32"], ["TENSOR", [336, 1344, 1, 1], "float32"], 1, 0, 1, "float32"], {}], "config": {"index": 865172, "code_hash": null, "entity": [["tile_f", "sp", [-1, 1, 4, 42]], ["tile_y", "sp", [-1, 1, 21, 1]], ["tile_x", "sp", [-1, 1, 1, 1]], ["tile_rc", "sp", [-1, 8]], ["tile_ry", "sp", [-1, 1]], ["tile_rx", "sp", [-1, 1]], ["auto_unroll_max_step", "ot", 0], ["unroll_explicit", "ot", 1]]}, "result": [[0.02141653433333333], 0, 3.7143874168395996, 1638804263.5076604], "version": 0.2, "tvm_version": "0.9.dev0"}
{"input": ["rocm -keys=rocm,gpu -max_num_threads=256 -mcpu=gfx906 -mtriple=amdgcn-amd-amdhsa-hcc -thread_warp_size=64", "conv2d_nchw.cuda", [["TENSOR", [128, 1344, 21, 21], "float32"], ["TENSOR", [336, 1344, 1, 1], "float32"], 1, 0, 1, "float32"], {}], "config": {"index": 4911747, "code_hash": null, "entity": [["tile_f", "sp", [-1, 1, 1, 84]], ["tile_y", "sp", [-1, 7, 1, 1]], ["tile_x", "sp", [-1, 1, 3, 1]], ["tile_rc", "sp", [-1, 8]], ["tile_ry", "sp", [-1, 1]], ["tile_rx", "sp", [-1, 1]], ["auto_unroll_max_step", "ot", 512], ["unroll_explicit", "ot", 1]]}, "result": [[3.38944335925], 0, 20.752228260040283, 1638804283.3708296], "version": 0.2, "tvm_version": "0.9.dev0"}
{"input": ["rocm -keys=rocm,gpu -max_num_threads=256 -mcpu=gfx906 -mtriple=amdgcn-amd-amdhsa-hcc -thread_warp_size=64", "conv2d_nchw.cuda", [["TENSOR", [128, 1344, 21, 21], "float32"], ["TENSOR", [336, 1344, 1, 1], "float32"], 1, 0, 1, "float32"], {}], "config": {"index": 1424389, "code_hash": null, "entity": [["tile_f", "sp", [-1, 12, 7, 4]], ["tile_y", "sp", [-1, 1, 1, 21]], ["tile_x", "sp", [-1, 1, 3, 7]], ["tile_rc", "sp", [-1, 16]], ["tile_ry", "sp", [-1, 1]], ["tile_rx", "sp", [-1, 1]], ["auto_unroll_max_step", "ot", 0], ["unroll_explicit", "ot", 1]]}, "result": [[9.6885654295], 0, 52.39000177383423, 1638804334.7816668], "version": 0.2, "tvm_version": "0.9.dev0"}
{"input": ["rocm -keys=rocm,gpu -max_num_threads=256 -mcpu=gfx906 -mtriple=amdgcn-amd-amdhsa-hcc -thread_warp_size=64", "conv2d_nchw.cuda", [["TENSOR", [128, 1344, 21, 21], "float32"], ["TENSOR", [336, 1344, 1, 1], "float32"], 1, 0, 1, "float32"], {}], "config": {"index": 4555822, "code_hash": null, "entity": [["tile_f", "sp", [-1, 1, 84, 2]], ["tile_y", "sp", [-1, 3, 7, 1]], ["tile_x", "sp", [-1, 1, 1, 7]], ["tile_rc", "sp", [-1, 4]], ["tile_ry", "sp", [-1, 1]], ["tile_rx", "sp", [-1, 1]], ["auto_unroll_max_step", "ot", 512], ["unroll_explicit", "ot", 1]]}, "result": [[0.01522399242857143], 0, 3.392686605453491, 1638804337.923716], "version": 0.2, "tvm_version": "0.9.dev0"}
{"input": ["rocm -keys=rocm,gpu -max_num_threads=256 -mcpu=gfx906 -mtriple=amdgcn-amd-amdhsa-hcc -thread_warp_size=64", "conv2d_nchw.cuda", [["TENSOR", [128, 1344, 21, 21], "float32"], ["TENSOR", [336, 1344, 1, 1], "float32"], 1, 0, 1, "float32"], {}], "config": {"index": 986014, "code_hash": null, "entity": [["tile_f", "sp", [-1, 14, 3, 8]], ["tile_y", "sp", [-1, 1, 1, 1]], ["tile_x", "sp", [-1, 1, 3, 7]], ["tile_rc", "sp", [-1, 8]], ["tile_ry", "sp", [-1, 1]], ["tile_rx", "sp", [-1, 1]], ["auto_unroll_max_step", "ot", 0], ["unroll_explicit", "ot", 1]]}, "result": [[3.3564660642499997], 0, 20.126461029052734, 1638804357.7060447], "version": 0.2, "tvm_version": "0.9.dev0"}
{"input": ["rocm -keys=rocm,gpu -max_num_threads=256 -mcpu=gfx906 -mtriple=amdgcn-amd-amdhsa-hcc -thread_warp_size=64", "conv2d_nchw.cuda", [["TENSOR", [128, 1344, 21, 21], "float32"], ["TENSOR", [336, 1344, 1, 1], "float32"], 1, 0, 1, "float32"], {}], "config": {"index": 1780440, "code_hash": null, "entity": [["tile_f", "sp", [-1, 14, 12, 2]], ["tile_y", "sp", [-1, 1, 7, 3]], ["tile_x", "sp", [-1, 1, 7, 1]], ["tile_rc", "sp", [-1, 28]], ["tile_ry", "sp", [-1, 1]], ["tile_rx", "sp", [-1, 1]], ["auto_unroll_max_step", "ot", 0], ["unroll_explicit", "ot", 1]]}, "result": [[4.91334277325], 0, 29.468440294265747, 1638804385.2530353], "version": 0.2, "tvm_version": "0.9.dev0"}
{"input": ["rocm -keys=rocm,gpu -max_num_threads=256 -mcpu=gfx906 -mtriple=amdgcn-amd-amdhsa-hcc -thread_warp_size=64", "conv2d_nchw.cuda", [["TENSOR", [128, 1344, 21, 21], "float32"], ["TENSOR", [336, 1344, 1, 1], "float32"], 1, 0, 1, "float32"], {}], "config": {"index": 8070453, "code_hash": null, "entity": [["tile_f", "sp", [-1, 7, 3, 4]], ["tile_y", "sp", [-1, 1, 7, 3]], ["tile_x", "sp", [-1, 1, 3, 1]], ["tile_rc", "sp", [-1, 1]], ["tile_ry", "sp", [-1, 1]], ["tile_rx", "sp", [-1, 1]], ["auto_unroll_max_step", "ot", 1500], ["unroll_explicit", "ot", 1]]}, "result": [[0.2916236265], 0, 4.598984479904175, 1638804389.520059], "version": 0.2, "tvm_version": "0.9.dev0"}
{"input": ["rocm -keys=rocm,gpu -max_num_threads=256 -mcpu=gfx906 -mtriple=amdgcn-amd-amdhsa-hcc -thread_warp_size=64", "conv2d_nchw.cuda", [["TENSOR", [128, 1344, 21, 21], "float32"], ["TENSOR", [336, 1344, 1, 1], "float32"], 1, 0, 1, "float32"], {}], "config": {"index": 10306552, "code_hash": null, "entity": [["tile_f", "sp", [-1, 1, 14, 4]], ["tile_y", "sp", [-1, 1, 3, 1]], ["tile_x", "sp", [-1, 1, 3, 7]], ["tile_rc", "sp", [-1, 48]], ["tile_ry", "sp", [-1, 1]], ["tile_rx", "sp", [-1, 1]], ["auto_unroll_max_step", "ot", 1500], ["unroll_explicit", "ot", 1]]}, "result": [[0.02883662975], 0, 4.851428270339966, 1638804392.6563125], "version": 0.2, "tvm_version": "0.9.dev0"}
{"input": ["rocm -keys=rocm,gpu -max_num_threads=256 -mcpu=gfx906 -mtriple=amdgcn-amd-amdhsa-hcc -thread_warp_size=64", "conv2d_nchw.cuda", [["TENSOR", [128, 1344, 21, 21], "float32"], ["TENSOR", [336, 1344, 1, 1], "float32"], 1, 0, 1, "float32"], {}], "config": {"index": 2266662, "code_hash": null, "entity": [["tile_f", "sp", [-1, 1, 7, 6]], ["tile_y", "sp", [-1, 1, 1, 21]], ["tile_x", "sp", [-1, 1, 1, 7]], ["tile_rc", "sp", [-1, 48]], ["tile_ry", "sp", [-1, 1]], ["tile_rx", "sp", [-1, 1]], ["auto_unroll_max_step", "ot", 0], ["unroll_explicit", "ot", 1]]}, "result": [[3.45126269525], 0, 20.593233108520508, 1638804412.8918016], "version": 0.2, "tvm_version": "0.9.dev0"}
{"input": ["rocm -keys=rocm,gpu -max_num_threads=256 -mcpu=gfx906 -mtriple=amdgcn-amd-amdhsa-hcc -thread_warp_size=64", "conv2d_nchw.cuda", [["TENSOR", [128, 1344, 21, 21], "float32"], ["TENSOR", [336, 1344, 1, 1], "float32"], 1, 0, 1, "float32"], {}], "config": {"index": 2202014, "code_hash": null, "entity": [["tile_f", "sp", [-1, 6, 14, 1]], ["tile_y", "sp", [-1, 1, 1, 7]], ["tile_x", "sp", [-1, 7, 3, 1]], ["tile_rc", "sp", [-1, 48]], ["tile_ry", "sp", [-1, 1]], ["tile_rx", "sp", [-1, 1]], ["auto_unroll_max_step", "ot", 0], ["unroll_explicit", "ot", 1]]}, "result": [[1.80909692375], 0, 12.649330854415894, 1638804424.9038327], "version": 0.2, "tvm_version": "0.9.dev0"}
{"input": ["rocm -keys=rocm,gpu -max_num_threads=256 -mcpu=gfx906 -mtriple=amdgcn-amd-amdhsa-hcc -thread_warp_size=64", "conv2d_nchw.cuda", [["TENSOR", [128, 1344, 21, 21], "float32"], ["TENSOR", [336, 1344, 1, 1], "float32"], 1, 0, 1, "float32"], {}], "config": {"index": 3026655, "code_hash": null, "entity": [["tile_f", "sp", [-1, 1, 6, 8]], ["tile_y", "sp", [-1, 1, 1, 7]], ["tile_x", "sp", [-1, 3, 1, 1]], ["tile_rc", "sp", [-1, 168]], ["tile_ry", "sp", [-1, 1]], ["tile_rx", "sp", [-1, 1]], ["auto_unroll_max_step", "ot", 0], ["unroll_explicit", "ot", 1]]}, "result": [[12.595213867], 0, 66.77621388435364, 1638804490.6922038], "version": 0.2, "tvm_version": "0.9.dev0"}
{"input": ["rocm -keys=rocm,gpu -max_num_threads=256 -mcpu=gfx906 -mtriple=amdgcn-amd-amdhsa-hcc -thread_warp_size=64", "conv2d_nchw.cuda", [["TENSOR", [128, 1344, 21, 21], "float32"], ["TENSOR", [336, 1344, 1, 1], "float32"], 1, 0, 1, "float32"], {}], "config": {"index": 4410683, "code_hash": null, "entity": [["tile_f", "sp", [-1, 1, 56, 1]], ["tile_y", "sp", [-1, 1, 3, 1]], ["tile_x", "sp", [-1, 1, 1, 7]], ["tile_rc", "sp", [-1, 3]], ["tile_ry", "sp", [-1, 1]], ["tile_rx", "sp", [-1, 1]], ["auto_unroll_max_step", "ot", 512], ["unroll_explicit", "ot", 1]]}, "result": [[0.022625877333333336], 0, 3.4652419090270996, 1638804547.7025607], "version": 0.2, "tvm_version": "0.9.dev0"}
{"input": ["rocm -keys=rocm,gpu -max_num_threads=256 -mcpu=gfx906 -mtriple=amdgcn-amd-amdhsa-hcc -thread_warp_size=64", "conv2d_nchw.cuda", [["TENSOR", [128, 1344, 21, 21], "float32"], ["TENSOR", [336, 1344, 1, 1], "float32"], 1, 0, 1, "float32"], {}], "config": {"index": 396603, "code_hash": null, "entity": [["tile_f", "sp", [-1, 1, 56, 1]], ["tile_y", "sp", [-1, 1, 3, 1]], ["tile_x", "sp", [-1, 1, 1, 7]], ["tile_rc", "sp", [-1, 3]], ["tile_ry", "sp", [-1, 1]], ["tile_rx", "sp", [-1, 1]], ["auto_unroll_max_step", "ot", 0], ["unroll_explicit", "ot", 1]]}, "result": [[0.02259795366666667], 0, 3.479628562927246, 1638804550.9270208], "version": 0.2, "tvm_version": "0.9.dev0"}
{"input": ["rocm -keys=rocm,gpu -max_num_threads=256 -mcpu=gfx906 -mtriple=amdgcn-amd-amdhsa-hcc -thread_warp_size=64", "conv2d_nchw.cuda", [["TENSOR", [128, 1344, 21, 21], "float32"], ["TENSOR", [336, 1344, 1, 1], "float32"], 1, 0, 1, "float32"], {}], "config": {"index": 396693, "code_hash": null, "entity": [["tile_f", "sp", [-1, 1, 28, 2]], ["tile_y", "sp", [-1, 1, 3, 1]], ["tile_x", "sp", [-1, 1, 1, 7]], ["tile_rc", "sp", [-1, 3]], ["tile_ry", "sp", [-1, 1]], ["tile_rx", "sp", [-1, 1]], ["auto_unroll_max_step", "ot", 0], ["unroll_explicit", "ot", 1]]}, "result": [[0.021868433500000003], 0, 3.5618293285369873, 1638804554.1188068], "version": 0.2, "tvm_version": "0.9.dev0"}
{"input": ["rocm -keys=rocm,gpu -max_num_threads=256 -mcpu=gfx906 -mtriple=amdgcn-amd-amdhsa-hcc -thread_warp_size=64", "conv2d_nchw.cuda", [["TENSOR", [128, 1344, 21, 21], "float32"], ["TENSOR", [336, 1344, 1, 1], "float32"], 1, 0, 1, "float32"], {}], "config": {"index": 4410773, "code_hash": null, "entity": [["tile_f", "sp", [-1, 1, 28, 2]], ["tile_y", "sp", [-1, 1, 3, 1]], ["tile_x", "sp", [-1, 1, 1, 7]], ["tile_rc", "sp", [-1, 3]], ["tile_ry", "sp", [-1, 1]], ["tile_rx", "sp", [-1, 1]], ["auto_unroll_max_step", "ot", 512], ["unroll_explicit", "ot", 1]]}, "result": [[0.021669748833333335], 0, 3.378962278366089, 1638804557.1365454], "version": 0.2, "tvm_version": "0.9.dev0"}
{"input": ["rocm -keys=rocm,gpu -max_num_threads=256 -mcpu=gfx906 -mtriple=amdgcn-amd-amdhsa-hcc -thread_warp_size=64", "conv2d_nchw.cuda", [["TENSOR", [128, 1344, 21, 21], "float32"], ["TENSOR", [336, 1344, 1, 1], "float32"], 1, 0, 1, "float32"], {}], "config": {"index": 4411893, "code_hash": null, "entity": [["tile_f", "sp", [-1, 1, 28, 2]], ["tile_y", "sp", [-1, 1, 7, 1]], ["tile_x", "sp", [-1, 1, 1, 7]], ["tile_rc", "sp", [-1, 3]], ["tile_ry", "sp", [-1, 1]], ["tile_rx", "sp", [-1, 1]], ["auto_unroll_max_step", "ot", 512], ["unroll_explicit", "ot", 1]]}, "result": [[0.013258086125], 0, 3.4649581909179688, 1638804560.2584372], "version": 0.2, "tvm_version": "0.9.dev0"}
{"input": ["rocm -keys=rocm,gpu -max_num_threads=256 -mcpu=gfx906 -mtriple=amdgcn-amd-amdhsa-hcc -thread_warp_size=64", "conv2d_nchw.cuda", [["TENSOR", [128, 1344, 21, 21], "float32"], ["TENSOR", [336, 1344, 1, 1], "float32"], 1, 0, 1, "float32"], {}], "config": {"index": 397813, "code_hash": null, "entity": [["tile_f", "sp", [-1, 1, 28, 2]], ["tile_y", "sp", [-1, 1, 7, 1]], ["tile_x", "sp", [-1, 1, 1, 7]], ["tile_rc", "sp", [-1, 3]], ["tile_ry", "sp", [-1, 1]], ["tile_rx", "sp", [-1, 1]], ["auto_unroll_max_step", "ot", 0], ["unroll_explicit", "ot", 1]]}, "result": [[0.013417282], 0, 3.493642807006836, 1638804563.4040492], "version": 0.2, "tvm_version": "0.9.dev0"}
{"input": ["rocm -keys=rocm,gpu -max_num_threads=256 -mcpu=gfx906 -mtriple=amdgcn-amd-amdhsa-hcc -thread_warp_size=64", "conv2d_nchw.cuda", [["TENSOR", [128, 1344, 21, 21], "float32"], ["TENSOR", [336, 1344, 1, 1], "float32"], 1, 0, 1, "float32"], {}], "config": {"index": 396700, "code_hash": null, "entity": [["tile_f", "sp", [-1, 1, 56, 2]], ["tile_y", "sp", [-1, 1, 3, 1]], ["tile_x", "sp", [-1, 1, 1, 7]], ["tile_rc", "sp", [-1, 3]], ["tile_ry", "sp", [-1, 1]], ["tile_rx", "sp", [-1, 1]], ["auto_unroll_max_step", "ot", 0], ["unroll_explicit", "ot", 1]]}, "result": [[0.021278531333333333], 0, 3.5042636394500732, 1638804566.5936363], "version": 0.2, "tvm_version": "0.9.dev0"}
{"input": ["rocm -keys=rocm,gpu -max_num_threads=256 -mcpu=gfx906 -mtriple=amdgcn-amd-amdhsa-hcc -thread_warp_size=64", "conv2d_nchw.cuda", [["TENSOR", [128, 1344, 21, 21], "float32"], ["TENSOR", [336, 1344, 1, 1], "float32"], 1, 0, 1, "float32"], {}], "config": {"index": 4410780, "code_hash": null, "entity": [["tile_f", "sp", [-1, 1, 56, 2]], ["tile_y", "sp", [-1, 1, 3, 1]], ["tile_x", "sp", [-1, 1, 1, 7]], ["tile_rc", "sp", [-1, 3]], ["tile_ry", "sp", [-1, 1]], ["tile_rx", "sp", [-1, 1]], ["auto_unroll_max_step", "ot", 512], ["unroll_explicit", "ot", 1]]}, "result": [[0.020957710166666668], 0, 3.3215105533599854, 1638804569.7820745], "version": 0.2, "tvm_version": "0.9.dev0"}
{"input": ["rocm -keys=rocm,gpu -max_num_threads=256 -mcpu=gfx906 -mtriple=amdgcn-amd-amdhsa-hcc -thread_warp_size=64", "conv2d_nchw.cuda", [["TENSOR", [128, 1344, 21, 21], "float32"], ["TENSOR", [336, 1344, 1, 1], "float32"], 1, 0, 1, "float32"], {}], "config": {"index": 4410777, "code_hash": null, "entity": [["tile_f", "sp", [-1, 1, 42, 2]], ["tile_y", "sp", [-1, 1, 3, 1]], ["tile_x", "sp", [-1, 1, 1, 7]], ["tile_rc", "sp", [-1, 3]], ["tile_ry", "sp", [-1, 1]], ["tile_rx", "sp", [-1, 1]], ["auto_unroll_max_step", "ot", 512], ["unroll_explicit", "ot", 1]]}, "result": [[0.023315569499999998], 0, 3.3156213760375977, 1638804572.977268], "version": 0.2, "tvm_version": "0.9.dev0"}
{"input": ["rocm -keys=rocm,gpu -max_num_threads=256 -mcpu=gfx906 -mtriple=amdgcn-amd-amdhsa-hcc -thread_warp_size=64", "conv2d_nchw.cuda", [["TENSOR", [128, 1344, 21, 21], "float32"], ["TENSOR", [336, 1344, 1, 1], "float32"], 1, 0, 1, "float32"], {}], "config": {"index": 396697, "code_hash": null, "entity": [["tile_f", "sp", [-1, 1, 42, 2]], ["tile_y", "sp", [-1, 1, 3, 1]], ["tile_x", "sp", [-1, 1, 1, 7]], ["tile_rc", "sp", [-1, 3]], ["tile_ry", "sp", [-1, 1]], ["tile_rx", "sp", [-1, 1]], ["auto_unroll_max_step", "ot", 0], ["unroll_explicit", "ot", 1]]}, "result": [[0.0239724705], 0, 3.7120473384857178, 1638804576.2078507], "version": 0.2, "tvm_version": "0.9.dev0"}
{"input": ["rocm -keys=rocm,gpu -max_num_threads=256 -mcpu=gfx906 -mtriple=amdgcn-amd-amdhsa-hcc -thread_warp_size=64", "conv2d_nchw.cuda", [["TENSOR", [128, 1344, 21, 21], "float32"], ["TENSOR", [336, 1344, 1, 1], "float32"], 1, 0, 1, "float32"], {}], "config": {"index": 4411897, "code_hash": null, "entity": [["tile_f", "sp", [-1, 1, 42, 2]], ["tile_y", "sp", [-1, 1, 7, 1]], ["tile_x", "sp", [-1, 1, 1, 7]], ["tile_rc", "sp", [-1, 3]], ["tile_ry", "sp", [-1, 1]], ["tile_rx", "sp", [-1, 1]], ["auto_unroll_max_step", "ot", 512], ["unroll_explicit", "ot", 1]]}, "result": [[0.016282938142857143], 0, 3.4931387901306152, 1638804579.1992981], "version": 0.2, "tvm_version": "0.9.dev0"}
{"input": ["rocm -keys=rocm,gpu -max_num_threads=256 -mcpu=gfx906 -mtriple=amdgcn-amd-amdhsa-hcc -thread_warp_size=64", "conv2d_nchw.cuda", [["TENSOR", [128, 1344, 21, 21], "float32"], ["TENSOR", [336, 1344, 1, 1], "float32"], 1, 0, 1, "float32"], {}], "config": {"index": 397817, "code_hash": null, "entity": [["tile_f", "sp", [-1, 1, 42, 2]], ["tile_y", "sp", [-1, 1, 7, 1]], ["tile_x", "sp", [-1, 1, 1, 7]], ["tile_rc", "sp", [-1, 3]], ["tile_ry", "sp", [-1, 1]], ["tile_rx", "sp", [-1, 1]], ["auto_unroll_max_step", "ot", 0], ["unroll_explicit", "ot", 1]]}, "result": [[0.016532235142857142], 0, 3.6202147006988525, 1638804582.3542666], "version": 0.2, "tvm_version": "0.9.dev0"}
{"input": ["rocm -keys=rocm,gpu -max_num_threads=256 -mcpu=gfx906 -mtriple=amdgcn-amd-amdhsa-hcc -thread_warp_size=64", "conv2d_nchw.cuda", [["TENSOR", [128, 1344, 21, 21], "float32"], ["TENSOR", [336, 1344, 1, 1], "float32"], 1, 0, 1, "float32"], {}], "config": {"index": 397916, "code_hash": null, "entity": [["tile_f", "sp", [-1, 1, 21, 4]], ["tile_y", "sp", [-1, 1, 7, 1]], ["tile_x", "sp", [-1, 1, 1, 7]], ["tile_rc", "sp", [-1, 3]], ["tile_ry", "sp", [-1, 1]], ["tile_rx", "sp", [-1, 1]], ["auto_unroll_max_step", "ot", 0], ["unroll_explicit", "ot", 1]]}, "result": [[0.01689325066666667], 0, 3.6012067794799805, 1638804585.4581249], "version": 0.2, "tvm_version": "0.9.dev0"}
{"input": ["rocm -keys=rocm,gpu -max_num_threads=256 -mcpu=gfx906 -mtriple=amdgcn-amd-amdhsa-hcc -thread_warp_size=64", "conv2d_nchw.cuda", [["TENSOR", [128, 1344, 21, 21], "float32"], ["TENSOR", [336, 1344, 1, 1], "float32"], 1, 0, 1, "float32"], {}], "config": {"index": 4411996, "code_hash": null, "entity": [["tile_f", "sp", [-1, 1, 21, 4]], ["tile_y", "sp", [-1, 1, 7, 1]], ["tile_x", "sp", [-1, 1, 1, 7]], ["tile_rc", "sp", [-1, 3]], ["tile_ry", "sp", [-1, 1]], ["tile_rx", "sp", [-1, 1]], ["auto_unroll_max_step", "ot", 512], ["unroll_explicit", "ot", 1]]}, "result": [[0.016744426666666666], 0, 3.629443883895874, 1638804588.6038675], "version": 0.2, "tvm_version": "0.9.dev0"}
{"input": ["rocm -keys=rocm,gpu -max_num_threads=256 -mcpu=gfx906 -mtriple=amdgcn-amd-amdhsa-hcc -thread_warp_size=64", "conv2d_nchw.cuda", [["TENSOR", [128, 1344, 21, 21], "float32"], ["TENSOR", [336, 1344, 1, 1], "float32"], 1, 0, 1, "float32"], {}], "config": {"index": 397912, "code_hash": null, "entity": [["tile_f", "sp", [-1, 1, 14, 4]], ["tile_y", "sp", [-1, 1, 7, 1]], ["tile_x", "sp", [-1, 1, 1, 7]], ["tile_rc", "sp", [-1, 3]], ["tile_ry", "sp", [-1, 1]], ["tile_rx", "sp", [-1, 1]], ["auto_unroll_max_step", "ot", 0], ["unroll_explicit", "ot", 1]]}, "result": [[0.019415941833333332], 0, 3.7422664165496826, 1638804591.7850418], "version": 0.2, "tvm_version": "0.9.dev0"}
{"input": ["rocm -keys=rocm,gpu -max_num_threads=256 -mcpu=gfx906 -mtriple=amdgcn-amd-amdhsa-hcc -thread_warp_size=64", "conv2d_nchw.cuda", [["TENSOR", [128, 1344, 21, 21], "float32"], ["TENSOR", [336, 1344, 1, 1], "float32"], 1, 0, 1, "float32"], {}], "config": {"index": 4411992, "code_hash": null, "entity": [["tile_f", "sp", [-1, 1, 14, 4]], ["tile_y", "sp", [-1, 1, 7, 1]], ["tile_x", "sp", [-1, 1, 1, 7]], ["tile_rc", "sp", [-1, 3]], ["tile_ry", "sp", [-1, 1]], ["tile_rx", "sp", [-1, 1]], ["auto_unroll_max_step", "ot", 512], ["unroll_explicit", "ot", 1]]}, "result": [[0.0192370185], 0, 3.6760647296905518, 1638804594.9566655], "version": 0.2, "tvm_version": "0.9.dev0"}
{"input": ["rocm -keys=rocm,gpu -max_num_threads=256 -mcpu=gfx906 -mtriple=amdgcn-amd-amdhsa-hcc -thread_warp_size=64", "conv2d_nchw.cuda", [["TENSOR", [128, 1344, 21, 21], "float32"], ["TENSOR", [336, 1344, 1, 1], "float32"], 1, 0, 1, "float32"], {}], "config": {"index": 541177, "code_hash": null, "entity": [["tile_f", "sp", [-1, 1, 42, 2]], ["tile_y", "sp", [-1, 1, 7, 1]], ["tile_x", "sp", [-1, 1, 1, 7]], ["tile_rc", "sp", [-1, 4]], ["tile_ry", "sp", [-1, 1]], ["tile_rx", "sp", [-1, 1]], ["auto_unroll_max_step", "ot", 0], ["unroll_explicit", "ot", 1]]}, "result": [[0.0223797555], 0, 3.489776372909546, 1638804597.998999], "version": 0.2, "tvm_version": "0.9.dev0"}
{"input": ["rocm -keys=rocm,gpu -max_num_threads=256 -mcpu=gfx906 -mtriple=amdgcn-amd-amdhsa-hcc -thread_warp_size=64", "conv2d_nchw.cuda", [["TENSOR", [128, 1344, 21, 21], "float32"], ["TENSOR", [336, 1344, 1, 1], "float32"], 1, 0, 1, "float32"], {}], "config": {"index": 4555257, "code_hash": null, "entity": [["tile_f", "sp", [-1, 1, 42, 2]], ["tile_y", "sp", [-1, 1, 7, 1]], ["tile_x", "sp", [-1, 1, 1, 7]], ["tile_rc", "sp", [-1, 4]], ["tile_ry", "sp", [-1, 1]], ["tile_rx", "sp", [-1, 1]], ["auto_unroll_max_step", "ot", 512], ["unroll_explicit", "ot", 1]]}, "result": [[0.022376863999999996], 0, 3.578672170639038, 1638804601.1661947], "version": 0.2, "tvm_version": "0.9.dev0"}
{"input": ["rocm -keys=rocm,gpu -max_num_threads=256 -mcpu=gfx906 -mtriple=amdgcn-amd-amdhsa-hcc -thread_warp_size=64", "conv2d_nchw.cuda", [["TENSOR", [128, 1344, 21, 21], "float32"], ["TENSOR", [336, 1344, 1, 1], "float32"], 1, 0, 1, "float32"], {}], "config": {"index": 396799, "code_hash": null, "entity": [["tile_f", "sp", [-1, 1, 28, 4]], ["tile_y", "sp", [-1, 1, 3, 1]], ["tile_x", "sp", [-1, 1, 1, 7]], ["tile_rc", "sp", [-1, 3]], ["tile_ry", "sp", [-1, 1]], ["tile_rx", "sp", [-1, 1]], ["auto_unroll_max_step", "ot", 0], ["unroll_explicit", "ot", 1]]}, "result": [[0.033240692], 0, 3.6981492042541504, 1638804604.3186545], "version": 0.2, "tvm_version": "0.9.dev0"}
{"input": ["rocm -keys=rocm,gpu -max_num_threads=256 -mcpu=gfx906 -mtriple=amdgcn-amd-amdhsa-hcc -thread_warp_size=64", "conv2d_nchw.cuda", [["TENSOR", [128, 1344, 21, 21], "float32"], ["TENSOR", [336, 1344, 1, 1], "float32"], 1, 0, 1, "float32"], {}], "config": {"index": 4410879, "code_hash": null, "entity": [["tile_f", "sp", [-1, 1, 28, 4]], ["tile_y", "sp", [-1, 1, 3, 1]], ["tile_x", "sp", [-1, 1, 1, 7]], ["tile_rc", "sp", [-1, 3]], ["tile_ry", "sp", [-1, 1]], ["tile_rx", "sp", [-1, 1]], ["auto_unroll_max_step", "ot", 512], ["unroll_explicit", "ot", 1]]}, "result": [[0.033699352249999995], 0, 3.6544673442840576, 1638804607.449772], "version": 0.2, "tvm_version": "0.9.dev0"}
{"input": ["rocm -keys=rocm,gpu -max_num_threads=256 -mcpu=gfx906 -mtriple=amdgcn-amd-amdhsa-hcc -thread_warp_size=64", "conv2d_nchw.cuda", [["TENSOR", [128, 1344, 21, 21], "float32"], ["TENSOR", [336, 1344, 1, 1], "float32"], 1, 0, 1, "float32"], {}], "config": {"index": 8424763, "code_hash": null, "entity": [["tile_f", "sp", [-1, 1, 56, 1]], ["tile_y", "sp", [-1, 1, 3, 1]], ["tile_x", "sp", [-1, 1, 1, 7]], ["tile_rc", "sp", [-1, 3]], ["tile_ry", "sp", [-1, 1]], ["tile_rx", "sp", [-1, 1]], ["auto_unroll_max_step", "ot", 1500], ["unroll_explicit", "ot", 1]]}, "result": [[0.02259725183333333], 0, 3.6223044395446777, 1638804610.6946766], "version": 0.2, "tvm_version": "0.9.dev0"}
{"input": ["rocm -keys=rocm,gpu -max_num_threads=256 -mcpu=gfx906 -mtriple=amdgcn-amd-amdhsa-hcc -thread_warp_size=64", "conv2d_nchw.cuda", [["TENSOR", [128, 1344, 21, 21], "float32"], ["TENSOR", [336, 1344, 1, 1], "float32"], 1, 0, 1, "float32"], {}], "config": {"index": 8424853, "code_hash": null, "entity": [["tile_f", "sp", [-1, 1, 28, 2]], ["tile_y", "sp", [-1, 1, 3, 1]], ["tile_x", "sp", [-1, 1, 1, 7]], ["tile_rc", "sp", [-1, 3]], ["tile_ry", "sp", [-1, 1]], ["tile_rx", "sp", [-1, 1]], ["auto_unroll_max_step", "ot", 1500], ["unroll_explicit", "ot", 1]]}, "result": [[0.021654258666666665], 0, 3.6575264930725098, 1638804613.905043], "version": 0.2, "tvm_version": "0.9.dev0"}
{"input": ["rocm -keys=rocm,gpu -max_num_threads=256 -mcpu=gfx906 -mtriple=amdgcn-amd-amdhsa-hcc -thread_warp_size=64", "conv2d_nchw.cuda", [["TENSOR", [128, 1344, 21, 21], "float32"], ["TENSOR", [336, 1344, 1, 1], "float32"], 1, 0, 1, "float32"], {}], "config": {"index": 541222, "code_hash": null, "entity": [["tile_f", "sp", [-1, 1, 16, 3]], ["tile_y", "sp", [-1, 1, 7, 1]], ["tile_x", "sp", [-1, 1, 1, 7]], ["tile_rc", "sp", [-1, 4]], ["tile_ry", "sp", [-1, 1]], ["tile_rx", "sp", [-1, 1]], ["auto_unroll_max_step", "ot", 0], ["unroll_explicit", "ot", 1]]}, "result": [[0.016171115285714285], 0, 3.6497387886047363, 1638804617.096035], "version": 0.2, "tvm_version": "0.9.dev0"}
{"input": ["rocm -keys=rocm,gpu -max_num_threads=256 -mcpu=gfx906 -mtriple=amdgcn-amd-amdhsa-hcc -thread_warp_size=64", "conv2d_nchw.cuda", [["TENSOR", [128, 1344, 21, 21], "float32"], ["TENSOR", [336, 1344, 1, 1], "float32"], 1, 0, 1, "float32"], {}], "config": {"index": 4555302, "code_hash": null, "entity": [["tile_f", "sp", [-1, 1, 16, 3]], ["tile_y", "sp", [-1, 1, 7, 1]], ["tile_x", "sp", [-1, 1, 1, 7]], ["tile_rc", "sp", [-1, 4]], ["tile_ry", "sp", [-1, 1]], ["tile_rx", "sp", [-1, 1]], ["auto_unroll_max_step", "ot", 512], ["unroll_explicit", "ot", 1]]}, "result": [[0.015991826714285715], 0, 3.653930902481079, 1638804620.2696393], "version": 0.2, "tvm_version": "0.9.dev0"}
{"input": ["rocm -keys=rocm,gpu -max_num_threads=256 -mcpu=gfx906 -mtriple=amdgcn-amd-amdhsa-hcc -thread_warp_size=64", "conv2d_nchw.cuda", [["TENSOR", [128, 1344, 21, 21], "float32"], ["TENSOR", [336, 1344, 1, 1], "float32"], 1, 0, 1, "float32"], {}], "config": {"index": 8425973, "code_hash": null, "entity": [["tile_f", "sp", [-1, 1, 28, 2]], ["tile_y", "sp", [-1, 1, 7, 1]], ["tile_x", "sp", [-1, 1, 1, 7]], ["tile_rc", "sp", [-1, 3]], ["tile_ry", "sp", [-1, 1]], ["tile_rx", "sp", [-1, 1]], ["auto_unroll_max_step", "ot", 1500], ["unroll_explicit", "ot", 1]]}, "result": [[0.013268305749999999], 0, 3.5647244453430176, 1638804623.4426982], "version": 0.2, "tvm_version": "0.9.dev0"}
{"input": ["rocm -keys=rocm,gpu -max_num_threads=256 -mcpu=gfx906 -mtriple=amdgcn-amd-amdhsa-hcc -thread_warp_size=64", "conv2d_nchw.cuda", [["TENSOR", [128, 1344, 21, 21], "float32"], ["TENSOR", [336, 1344, 1, 1], "float32"], 1, 0, 1, "float32"], {}], "config": {"index": 4383999, "code_hash": null, "entity": [["tile_f", "sp", [-1, 1, 28, 4]], ["tile_y", "sp", [-1, 1, 3, 1]], ["tile_x", "sp", [-1, 1, 1, 3]], ["tile_rc", "sp", [-1, 3]], ["tile_ry", "sp", [-1, 1]], ["tile_rx", "sp", [-1, 1]], ["auto_unroll_max_step", "ot", 512], ["unroll_explicit", "ot", 1]]}, "result": [[0.07518753049999999], 0, 3.8035717010498047, 1638804626.851713], "version": 0.2, "tvm_version": "0.9.dev0"}
{"input": ["rocm -keys=rocm,gpu -max_num_threads=256 -mcpu=gfx906 -mtriple=amdgcn-amd-amdhsa-hcc -thread_warp_size=64", "conv2d_nchw.cuda", [["TENSOR", [128, 1344, 21, 21], "float32"], ["TENSOR", [336, 1344, 1, 1], "float32"], 1, 0, 1, "float32"], {}], "config": {"index": 369919, "code_hash": null, "entity": [["tile_f", "sp", [-1, 1, 28, 4]], ["tile_y", "sp", [-1, 1, 3, 1]], ["tile_x", "sp", [-1, 1, 1, 3]], ["tile_rc", "sp", [-1, 3]], ["tile_ry", "sp", [-1, 1]], ["tile_rx", "sp", [-1, 1]], ["auto_unroll_max_step", "ot", 0], ["unroll_explicit", "ot", 1]]}, "result": [[0.083127838], 0, 3.7150537967681885, 1638804630.0928876], "version": 0.2, "tvm_version": "0.9.dev0"}
{"input": ["rocm -keys=rocm,gpu -max_num_threads=256 -mcpu=gfx906 -mtriple=amdgcn-amd-amdhsa-hcc -thread_warp_size=64", "conv2d_nchw.cuda", [["TENSOR", [128, 1344, 21, 21], "float32"], ["TENSOR", [336, 1344, 1, 1], "float32"], 1, 0, 1, "float32"], {}], "config": {"index": 8424860, "code_hash": null, "entity": [["tile_f", "sp", [-1, 1, 56, 2]], ["tile_y", "sp", [-1, 1, 3, 1]], ["tile_x", "sp", [-1, 1, 1, 7]], ["tile_rc", "sp", [-1, 3]], ["tile_ry", "sp", [-1, 1]], ["tile_rx", "sp", [-1, 1]], ["auto_unroll_max_step", "ot", 1500], ["unroll_explicit", "ot", 1]]}, "result": [[0.020960192333333336], 0, 3.498032331466675, 1638804633.246124], "version": 0.2, "tvm_version": "0.9.dev0"}
{"input": ["rocm -keys=rocm,gpu -max_num_threads=256 -mcpu=gfx906 -mtriple=amdgcn-amd-amdhsa-hcc -thread_warp_size=64", "conv2d_nchw.cuda", [["TENSOR", [128, 1344, 21, 21], "float32"], ["TENSOR", [336, 1344, 1, 1], "float32"], 1, 0, 1, "float32"], {}], "config": {"index": 4555247, "code_hash": null, "entity": [["tile_f", "sp", [-1, 1, 21, 2]], ["tile_y", "sp", [-1, 1, 7, 1]], ["tile_x", "sp", [-1, 1, 1, 7]], ["tile_rc", "sp", [-1, 4]], ["tile_ry", "sp", [-1, 1]], ["tile_rx", "sp", [-1, 1]], ["auto_unroll_max_step", "ot", 512], ["unroll_explicit", "ot", 1]]}, "result": [[0.017117991000000003], 0, 3.583245277404785, 1638804636.3915837], "version": 0.2, "tvm_version": "0.9.dev0"}
{"input": ["rocm -keys=rocm,gpu -max_num_threads=256 -mcpu=gfx906 -mtriple=amdgcn-amd-amdhsa-hcc -thread_warp_size=64", "conv2d_nchw.cuda", [["TENSOR", [128, 1344, 21, 21], "float32"], ["TENSOR", [336, 1344, 1, 1], "float32"], 1, 0, 1, "float32"], {}], "config": {"index": 541167, "code_hash": null, "entity": [["tile_f", "sp", [-1, 1, 21, 2]], ["tile_y", "sp", [-1, 1, 7, 1]], ["tile_x", "sp", [-1, 1, 1, 7]], ["tile_rc", "sp", [-1, 4]], ["tile_ry", "sp", [-1, 1]], ["tile_rx", "sp", [-1, 1]], ["auto_unroll_max_step", "ot", 0], ["unroll_explicit", "ot", 1]]}, "result": [[0.01764250683333333], 0, 3.5247323513031006, 1638804639.5127861], "version": 0.2, "tvm_version": "0.9.dev0"}
{"input": ["rocm -keys=rocm,gpu -max_num_threads=256 -mcpu=gfx906 -mtriple=amdgcn-amd-amdhsa-hcc -thread_warp_size=64", "conv2d_nchw.cuda", [["TENSOR", [128, 1344, 21, 21], "float32"], ["TENSOR", [336, 1344, 1, 1], "float32"], 1, 0, 1, "float32"], {}], "config": {"index": 371137, "code_hash": null, "entity": [["tile_f", "sp", [-1, 1, 7, 8]], ["tile_y", "sp", [-1, 1, 7, 1]], ["tile_x", "sp", [-1, 1, 1, 3]], ["tile_rc", "sp", [-1, 3]], ["tile_ry", "sp", [-1, 1]], ["tile_rx", "sp", [-1, 1]], ["auto_unroll_max_step", "ot", 0], ["unroll_explicit", "ot", 1]]}, "result": [[0.05586996825], 0, 3.748049020767212, 1638804642.7160559], "version": 0.2, "tvm_version": "0.9.dev0"}
{"input": ["rocm -keys=rocm,gpu -max_num_threads=256 -mcpu=gfx906 -mtriple=amdgcn-amd-amdhsa-hcc -thread_warp_size=64", "conv2d_nchw.cuda", [["TENSOR", [128, 1344, 21, 21], "float32"], ["TENSOR", [336, 1344, 1, 1], "float32"], 1, 0, 1, "float32"], {}], "config": {"index": 4385217, "code_hash": null, "entity": [["tile_f", "sp", [-1, 1, 7, 8]], ["tile_y", "sp", [-1, 1, 7, 1]], ["tile_x", "sp", [-1, 1, 1, 3]], ["tile_rc", "sp", [-1, 3]], ["tile_ry", "sp", [-1, 1]], ["tile_rx", "sp", [-1, 1]], ["auto_unroll_max_step", "ot", 512], ["unroll_explicit", "ot", 1]]}, "result": [[0.05555101775], 0, 3.5309715270996094, 1638804645.773785], "version": 0.2, "tvm_version": "0.9.dev0"}
{"input": ["rocm -keys=rocm,gpu -max_num_threads=256 -mcpu=gfx906 -mtriple=amdgcn-amd-amdhsa-hcc -thread_warp_size=64", "conv2d_nchw.cuda", [["TENSOR", [128, 1344, 21, 21], "float32"], ["TENSOR", [336, 1344, 1, 1], "float32"], 1, 0, 1, "float32"], {}], "config": {"index": 8424857, "code_hash": null, "entity": [["tile_f", "sp", [-1, 1, 42, 2]], ["tile_y", "sp", [-1, 1, 3, 1]], ["tile_x", "sp", [-1, 1, 1, 7]], ["tile_rc", "sp", [-1, 3]], ["tile_ry", "sp", [-1, 1]], ["tile_rx", "sp", [-1, 1]], ["auto_unroll_max_step", "ot", 1500], ["unroll_explicit", "ot", 1]]}, "result": [[0.023710894166666666], 0, 3.6848554611206055, 1638804649.083901], "version": 0.2, "tvm_version": "0.9.dev0"}
{"input": ["rocm -keys=rocm,gpu -max_num_threads=256 -mcpu=gfx906 -mtriple=amdgcn-amd-amdhsa-hcc -thread_warp_size=64", "conv2d_nchw.cuda", [["TENSOR", [128, 1344, 21, 21], "float32"], ["TENSOR", [336, 1344, 1, 1], "float32"], 1, 0, 1, "float32"], {}], "config": {"index": 4410881, "code_hash": null, "entity": [["tile_f", "sp", [-1, 1, 42, 4]], ["tile_y", "sp", [-1, 1, 3, 1]], ["tile_x", "sp", [-1, 1, 1, 7]], ["tile_rc", "sp", [-1, 3]], ["tile_ry", "sp", [-1, 1]], ["tile_rx", "sp", [-1, 1]], ["auto_unroll_max_step", "ot", 512], ["unroll_explicit", "ot", 1]]}, "result": [[0.03607043825], 0, 3.3964014053344727, 1638804652.0561597], "version": 0.2, "tvm_version": "0.9.dev0"}
{"input": ["rocm -keys=rocm,gpu -max_num_threads=256 -mcpu=gfx906 -mtriple=amdgcn-amd-amdhsa-hcc -thread_warp_size=64", "conv2d_nchw.cuda", [["TENSOR", [128, 1344, 21, 21], "float32"], ["TENSOR", [336, 1344, 1, 1], "float32"], 1, 0, 1, "float32"], {}], "config": {"index": 396801, "code_hash": null, "entity": [["tile_f", "sp", [-1, 1, 42, 4]], ["tile_y", "sp", [-1, 1, 3, 1]], ["tile_x", "sp", [-1, 1, 1, 7]], ["tile_rc", "sp", [-1, 3]], ["tile_ry", "sp", [-1, 1]], ["tile_rx", "sp", [-1, 1]], ["auto_unroll_max_step", "ot", 0], ["unroll_explicit", "ot", 1]]}, "result": [[0.0379404945], 0, 3.5953729152679443, 1638804655.1980639], "version": 0.2, "tvm_version": "0.9.dev0"}
{"input": ["rocm -keys=rocm,gpu -max_num_threads=256 -mcpu=gfx906 -mtriple=amdgcn-amd-amdhsa-hcc -thread_warp_size=64", "conv2d_nchw.cuda", [["TENSOR", [128, 1344, 21, 21], "float32"], ["TENSOR", [336, 1344, 1, 1], "float32"], 1, 0, 1, "float32"], {}], "config": {"index": 4555356, "code_hash": null, "entity": [["tile_f", "sp", [-1, 1, 21, 4]], ["tile_y", "sp", [-1, 1, 7, 1]], ["tile_x", "sp", [-1, 1, 1, 7]], ["tile_rc", "sp", [-1, 4]], ["tile_ry", "sp", [-1, 1]], ["tile_rx", "sp", [-1, 1]], ["auto_unroll_max_step", "ot", 512], ["unroll_explicit", "ot", 1]]}, "result": [[0.022449269499999997], 0, 3.6836965084075928, 1638804658.4114335], "version": 0.2, "tvm_version": "0.9.dev0"}
{"input": ["rocm -keys=rocm,gpu -max_num_threads=256 -mcpu=gfx906 -mtriple=amdgcn-amd-amdhsa-hcc -thread_warp_size=64", "conv2d_nchw.cuda", [["TENSOR", [128, 1344, 21, 21], "float32"], ["TENSOR", [336, 1344, 1, 1], "float32"], 1, 0, 1, "float32"], {}], "config": {"index": 541276, "code_hash": null, "entity": [["tile_f", "sp", [-1, 1, 21, 4]], ["tile_y", "sp", [-1, 1, 7, 1]], ["tile_x", "sp", [-1, 1, 1, 7]], ["tile_rc", "sp", [-1, 4]], ["tile_ry", "sp", [-1, 1]], ["tile_rx", "sp", [-1, 1]], ["auto_unroll_max_step", "ot", 0], ["unroll_explicit", "ot", 1]]}, "result": [[0.05585046], 0, 3.782883644104004, 1638804661.7187068], "version": 0.2, "tvm_version": "0.9.dev0"}
{"input": ["rocm -keys=rocm,gpu -max_num_threads=256 -mcpu=gfx906 -mtriple=amdgcn-amd-amdhsa-hcc -thread_warp_size=64", "conv2d_nchw.cuda", [["TENSOR", [128, 1344, 21, 21], "float32"], ["TENSOR", [336, 1344, 1, 1], "float32"], 1, 0, 1, "float32"], {}], "config": {"index": 8425977, "code_hash": null, "entity": [["tile_f", "sp", [-1, 1, 42, 2]], ["tile_y", "sp", [-1, 1, 7, 1]], ["tile_x", "sp", [-1, 1, 1, 7]], ["tile_rc", "sp", [-1, 3]], ["tile_ry", "sp", [-1, 1]], ["tile_rx", "sp", [-1, 1]], ["auto_unroll_max_step", "ot", 1500], ["unroll_explicit", "ot", 1]]}, "result": [[0.016260741], 0, 3.521766185760498, 1638804664.8714316], "version": 0.2, "tvm_version": "0.9.dev0"}
{"input": ["rocm -keys=rocm,gpu -max_num_threads=256 -mcpu=gfx906 -mtriple=amdgcn-amd-amdhsa-hcc -thread_warp_size=64", "conv2d_nchw.cuda", [["TENSOR", [128, 1344, 21, 21], "float32"], ["TENSOR", [336, 1344, 1, 1], "float32"], 1, 0, 1, "float32"], {}], "config": {"index": 541224, "code_hash": null, "entity": [["tile_f", "sp", [-1, 1, 28, 3]], ["tile_y", "sp", [-1, 1, 7, 1]], ["tile_x", "sp", [-1, 1, 1, 7]], ["tile_rc", "sp", [-1, 4]], ["tile_ry", "sp", [-1, 1]], ["tile_rx", "sp", [-1, 1]], ["auto_unroll_max_step", "ot", 0], ["unroll_explicit", "ot", 1]]}, "result": [[0.01368875025], 0, 3.5127151012420654, 1638804668.0004315], "version": 0.2, "tvm_version": "0.9.dev0"}
{"input": ["rocm -keys=rocm,gpu -max_num_threads=256 -mcpu=gfx906 -mtriple=amdgcn-amd-amdhsa-hcc -thread_warp_size=64", "conv2d_nchw.cuda", [["TENSOR", [128, 1344, 21, 21], "float32"], ["TENSOR", [336, 1344, 1, 1], "float32"], 1, 0, 1, "float32"], {}], "config": {"index": 4555304, "code_hash": null, "entity": [["tile_f", "sp", [-1, 1, 28, 3]], ["tile_y", "sp", [-1, 1, 7, 1]], ["tile_x", "sp", [-1, 1, 1, 7]], ["tile_rc", "sp", [-1, 4]], ["tile_ry", "sp", [-1, 1]], ["tile_rx", "sp", [-1, 1]], ["auto_unroll_max_step", "ot", 512], ["unroll_explicit", "ot", 1]]}, "result": [[0.01334426775], 0, 3.563418388366699, 1638804671.1487763], "version": 0.2, "tvm_version": "0.9.dev0"}
{"input": ["rocm -keys=rocm,gpu -max_num_threads=256 -mcpu=gfx906 -mtriple=amdgcn-amd-amdhsa-hcc -thread_warp_size=64", "conv2d_nchw.cuda", [["TENSOR", [128, 1344, 21, 21], "float32"], ["TENSOR", [336, 1344, 1, 1], "float32"], 1, 0, 1, "float32"], {}], "config": {"index": 4672825, "code_hash": null, "entity": [["tile_f", "sp", [-1, 1, 7, 2]], ["tile_y", "sp", [-1, 1, 21, 1]], ["tile_x", "sp", [-1, 1, 1, 3]], ["tile_rc", "sp", [-1, 6]], ["tile_ry", "sp", [-1, 1]], ["tile_rx", "sp", [-1, 1]], ["auto_unroll_max_step", "ot", 512], ["unroll_explicit", "ot", 1]]}, "result": [[0.06953669725], 0, 3.6293113231658936, 1638804674.4831376], "version": 0.2, "tvm_version": "0.9.dev0"}
{"input": ["rocm -keys=rocm,gpu -max_num_threads=256 -mcpu=gfx906 -mtriple=amdgcn-amd-amdhsa-hcc -thread_warp_size=64", "conv2d_nchw.cuda", [["TENSOR", [128, 1344, 21, 21], "float32"], ["TENSOR", [336, 1344, 1, 1], "float32"], 1, 0, 1, "float32"], {}], "config": {"index": 658745, "code_hash": null, "entity": [["tile_f", "sp", [-1, 1, 7, 2]], ["tile_y", "sp", [-1, 1, 21, 1]], ["tile_x", "sp", [-1, 1, 1, 3]], ["tile_rc", "sp", [-1, 6]], ["tile_ry", "sp", [-1, 1]], ["tile_rx", "sp", [-1, 1]], ["auto_unroll_max_step", "ot", 0], ["unroll_explicit", "ot", 1]]}, "result": [[0.0693812025], 0, 3.6551856994628906, 1638804677.7706647], "version": 0.2, "tvm_version": "0.9.dev0"}
{"input": ["rocm -keys=rocm,gpu -max_num_threads=256 -mcpu=gfx906 -mtriple=amdgcn-amd-amdhsa-hcc -thread_warp_size=64", "conv2d_nchw.cuda", [["TENSOR", [128, 1344, 21, 21], "float32"], ["TENSOR", [336, 1344, 1, 1], "float32"], 1, 0, 1, "float32"], {}], "config": {"index": 8426076, "code_hash": null, "entity": [["tile_f", "sp", [-1, 1, 21, 4]], ["tile_y", "sp", [-1, 1, 7, 1]], ["tile_x", "sp", [-1, 1, 1, 7]], ["tile_rc", "sp", [-1, 3]], ["tile_ry", "sp", [-1, 1]], ["tile_rx", "sp", [-1, 1]], ["auto_unroll_max_step", "ot", 1500], ["unroll_explicit", "ot", 1]]}, "result": [[0.016791896666666667], 0, 3.566453695297241, 1638804680.9155495], "version": 0.2, "tvm_version": "0.9.dev0"}
{"input": ["rocm -keys=rocm,gpu -max_num_threads=256 -mcpu=gfx906 -mtriple=amdgcn-amd-amdhsa-hcc -thread_warp_size=64", "conv2d_nchw.cuda", [["TENSOR", [128, 1344, 21, 21], "float32"], ["TENSOR", [336, 1344, 1, 1], "float32"], 1, 0, 1, "float32"], {}], "config": {"index": 539957, "code_hash": null, "entity": [["tile_f", "sp", [-1, 1, 42, 1]], ["tile_y", "sp", [-1, 1, 3, 1]], ["tile_x", "sp", [-1, 1, 1, 7]], ["tile_rc", "sp", [-1, 4]], ["tile_ry", "sp", [-1, 1]], ["tile_rx", "sp", [-1, 1]], ["auto_unroll_max_step", "ot", 0], ["unroll_explicit", "ot", 1]]}, "result": [[0.0266860465], 0, 3.4418840408325195, 1638804684.005755], "version": 0.2, "tvm_version": "0.9.dev0"}
{"input": ["rocm -keys=rocm,gpu -max_num_threads=256 -mcpu=gfx906 -mtriple=amdgcn-amd-amdhsa-hcc -thread_warp_size=64", "conv2d_nchw.cuda", [["TENSOR", [128, 1344, 21, 21], "float32"], ["TENSOR", [336, 1344, 1, 1], "float32"], 1, 0, 1, "float32"], {}], "config": {"index": 4554037, "code_hash": null, "entity": [["tile_f", "sp", [-1, 1, 42, 1]], ["tile_y", "sp", [-1, 1, 3, 1]], ["tile_x", "sp", [-1, 1, 1, 7]], ["tile_rc", "sp", [-1, 4]], ["tile_ry", "sp", [-1, 1]], ["tile_rx", "sp", [-1, 1]], ["auto_unroll_max_step", "ot", 512], ["unroll_explicit", "ot", 1]]}, "result": [[0.026482336], 0, 3.268376111984253, 1638804686.9200644], "version": 0.2, "tvm_version": "0.9.dev0"}
