artifacts/Table4/tvm/autotvm/conv/conv2d_128_672_11_11_672_1_1_1_0.log
{"input": ["rocm -keys=rocm,gpu -max_num_threads=256 -mcpu=gfx906 -mtriple=amdgcn-amd-amdhsa-hcc -thread_warp_size=64", "conv2d_nchw.cuda", [["TENSOR", [128, 672, 11, 11], "float32"], ["TENSOR", [672, 672, 1, 1], "float32"], 1, 0, 1, "float32"], {}], "config": {"index": 911710, "code_hash": null, "entity": [["tile_f", "sp", [-1, 2, 1, 6]], ["tile_y", "sp", [-1, 11, 1, 1]], ["tile_x", "sp", [-1, 1, 11, 1]], ["tile_rc", "sp", [-1, 48]], ["tile_ry", "sp", [-1, 1]], ["tile_rx", "sp", [-1, 1]], ["auto_unroll_max_step", "ot", 1500], ["unroll_explicit", "ot", 1]]}, "result": [[1.97236975075], 0, 14.567304849624634, 1638696328.458845], "version": 0.2, "tvm_version": "0.9.dev0"}
{"input": ["rocm -keys=rocm,gpu -max_num_threads=256 -mcpu=gfx906 -mtriple=amdgcn-amd-amdhsa-hcc -thread_warp_size=64", "conv2d_nchw.cuda", [["TENSOR", [128, 672, 11, 11], "float32"], ["TENSOR", [672, 672, 1, 1], "float32"], 1, 0, 1, "float32"], {}], "config": {"index": 816311, "code_hash": null, "entity": [["tile_f", "sp", [-1, 224, 3, 1]], ["tile_y", "sp", [-1, 1, 1, 11]], ["tile_x", "sp", [-1, 1, 1, 11]], ["tile_rc", "sp", [-1, 14]], ["tile_ry", "sp", [-1, 1]], ["tile_rx", "sp", [-1, 1]], ["auto_unroll_max_step", "ot", 1500], ["unroll_explicit", "ot", 1]]}, "result": [[18.40266210925], 0, 99.74062776565552, 1638696421.9873476], "version": 0.2, "tvm_version": "0.9.dev0"}
{"input": ["rocm -keys=rocm,gpu -max_num_threads=256 -mcpu=gfx906 -mtriple=amdgcn-amd-amdhsa-hcc -thread_warp_size=64", "conv2d_nchw.cuda", [["TENSOR", [128, 672, 11, 11], "float32"], ["TENSOR", [672, 672, 1, 1], "float32"], 1, 0, 1, "float32"], {}], "config": {"index": 916393, "code_hash": null, "entity": [["tile_f", "sp", [-1, 3, 2, 14]], ["tile_y", "sp", [-1, 1, 11, 1]], ["tile_x", "sp", [-1, 1, 1, 11]], ["tile_rc", "sp", [-1, 48]], ["tile_ry", "sp", [-1, 1]], ["tile_rx", "sp", [-1, 1]], ["auto_unroll_max_step", "ot", 1500], ["unroll_explicit", "ot", 1]]}, "result": [[1.62590869125], 0, 16.06891965866089, 1638696431.8051739], "version": 0.2, "tvm_version": "0.9.dev0"}
{"input": ["rocm -keys=rocm,gpu -max_num_threads=256 -mcpu=gfx906 -mtriple=amdgcn-amd-amdhsa-hcc -thread_warp_size=64", "conv2d_nchw.cuda", [["TENSOR", [128, 672, 11, 11], "float32"], ["TENSOR", [672, 672, 1, 1], "float32"], 1, 0, 1, "float32"], {}], "config": {"index": 519818, "code_hash": null, "entity": [["tile_f", "sp", [-1, 1, 24, 1]], ["tile_y", "sp", [-1, 1, 1, 1]], ["tile_x", "sp", [-1, 11, 1, 1]], ["tile_rc", "sp", [-1, 28]], ["tile_ry", "sp", [-1, 1]], ["tile_rx", "sp", [-1, 1]], ["auto_unroll_max_step", "ot", 512], ["unroll_explicit", "ot", 1]]}, "result": [[0.007602859428571429], 0, 2.2252633571624756, 1638696433.2399266], "version": 0.2, "tvm_version": "0.9.dev0"}
{"input": ["rocm -keys=rocm,gpu -max_num_threads=256 -mcpu=gfx906 -mtriple=amdgcn-amd-amdhsa-hcc -thread_warp_size=64", "conv2d_nchw.cuda", [["TENSOR", [128, 672, 11, 11], "float32"], ["TENSOR", [672, 672, 1, 1], "float32"], 1, 0, 1, "float32"], {}], "config": {"index": 246775, "code_hash": null, "entity": [["tile_f", "sp", [-1, 1, 28, 3]], ["tile_y", "sp", [-1, 1, 1, 11]], ["tile_x", "sp", [-1, 1, 1, 1]], ["tile_rc", "sp", [-1, 84]], ["tile_ry", "sp", [-1, 1]], ["tile_rx", "sp", [-1, 1]], ["auto_unroll_max_step", "ot", 0], ["unroll_explicit", "ot", 1]]}, "result": [[0.03252777475], 0, 1.9745559692382812, 1638696434.681195], "version": 0.2, "tvm_version": "0.9.dev0"}
{"input": ["rocm -keys=rocm,gpu -max_num_threads=256 -mcpu=gfx906 -mtriple=amdgcn-amd-amdhsa-hcc -thread_warp_size=64", "conv2d_nchw.cuda", [["TENSOR", [128, 672, 11, 11], "float32"], ["TENSOR", [672, 672, 1, 1], "float32"], 1, 0, 1, "float32"], {}], "config": {"index": 595693, "code_hash": null, "entity": [["tile_f", "sp", [-1, 4, 2, 21]], ["tile_y", "sp", [-1, 1, 1, 1]], ["tile_x", "sp", [-1, 1, 11, 1]], ["tile_rc", "sp", [-1, 84]], ["tile_ry", "sp", [-1, 1]], ["tile_rx", "sp", [-1, 1]], ["auto_unroll_max_step", "ot", 512], ["unroll_explicit", "ot", 1]]}, "result": [[3.1690729980000003], 0, 18.8374125957489, 1638696451.881663], "version": 0.2, "tvm_version": "0.9.dev0"}
{"input": ["rocm -keys=rocm,gpu -max_num_threads=256 -mcpu=gfx906 -mtriple=amdgcn-amd-amdhsa-hcc -thread_warp_size=64", "conv2d_nchw.cuda", [["TENSOR", [128, 672, 11, 11], "float32"], ["TENSOR", [672, 672, 1, 1], "float32"], 1, 0, 1, "float32"], {}], "config": {"index": 376636, "code_hash": null, "entity": [["tile_f", "sp", [-1, 1, 84, 2]], ["tile_y", "sp", [-1, 1, 1, 1]], ["tile_x", "sp", [-1, 11, 1, 1]], ["tile_rc", "sp", [-1, 3]], ["tile_ry", "sp", [-1, 1]], ["tile_rx", "sp", [-1, 1]], ["auto_unroll_max_step", "ot", 512], ["unroll_explicit", "ot", 1]]}, "result": [[0.009119815454545455], 0, 2.0089805126190186, 1638696453.276901], "version": 0.2, "tvm_version": "0.9.dev0"}
{"input": ["rocm -keys=rocm,gpu -max_num_threads=256 -mcpu=gfx906 -mtriple=amdgcn-amd-amdhsa-hcc -thread_warp_size=64", "conv2d_nchw.cuda", [["TENSOR", [128, 672, 11, 11], "float32"], ["TENSOR", [672, 672, 1, 1], "float32"], 1, 0, 1, "float32"], {}], "config": {"index": 156512, "code_hash": null, "entity": [["tile_f", "sp", [-1, 7, 3, 8]], ["tile_y", "sp", [-1, 1, 11, 1]], ["tile_x", "sp", [-1, 1, 1, 11]], ["tile_rc", "sp", [-1, 21]], ["tile_ry", "sp", [-1, 1]], ["tile_rx", "sp", [-1, 1]], ["auto_unroll_max_step", "ot", 0], ["unroll_explicit", "ot", 1]]}, "result": [[0.698448242], 0, 5.394057035446167, 1638696457.9520519], "version": 0.2, "tvm_version": "0.9.dev0"}
{"input": ["rocm -keys=rocm,gpu -max_num_threads=256 -mcpu=gfx906 -mtriple=amdgcn-amd-amdhsa-hcc -thread_warp_size=64", "conv2d_nchw.cuda", [["TENSOR", [128, 672, 11, 11], "float32"], ["TENSOR", [672, 672, 1, 1], "float32"], 1, 0, 1, "float32"], {}], "config": {"index": 504251, "code_hash": null, "entity": [["tile_f", "sp", [-1, 2, 6, 14]], ["tile_y", "sp", [-1, 1, 11, 1]], ["tile_x", "sp", [-1, 1, 1, 1]], ["tile_rc", "sp", [-1, 24]], ["tile_ry", "sp", [-1, 1]], ["tile_rx", "sp", [-1, 1]], ["auto_unroll_max_step", "ot", 512], ["unroll_explicit", "ot", 1]]}, "result": [[0.03555098325], 0, 2.464355230331421, 1638696459.404602], "version": 0.2, "tvm_version": "0.9.dev0"}
{"input": ["rocm -keys=rocm,gpu -max_num_threads=256 -mcpu=gfx906 -mtriple=amdgcn-amd-amdhsa-hcc -thread_warp_size=64", "conv2d_nchw.cuda", [["TENSOR", [128, 672, 11, 11], "float32"], ["TENSOR", [672, 672, 1, 1], "float32"], 1, 0, 1, "float32"], {}], "config": {"index": 733844, "code_hash": null, "entity": [["tile_f", "sp", [-1, 168, 1, 1]], ["tile_y", "sp", [-1, 1, 1, 11]], ["tile_x", "sp", [-1, 1, 1, 1]], ["tile_rc", "sp", [-1, 4]], ["tile_ry", "sp", [-1, 1]], ["tile_rx", "sp", [-1, 1]], ["auto_unroll_max_step", "ot", 1500], ["unroll_explicit", "ot", 1]]}, "result": [[3.48492675775], 0, 21.71160864830017, 1638696478.0527024], "version": 0.2, "tvm_version": "0.9.dev0"}
{"input": ["rocm -keys=rocm,gpu -max_num_threads=256 -mcpu=gfx906 -mtriple=amdgcn-amd-amdhsa-hcc -thread_warp_size=64", "conv2d_nchw.cuda", [["TENSOR", [128, 672, 11, 11], "float32"], ["TENSOR", [672, 672, 1, 1], "float32"], 1, 0, 1, "float32"], {}], "config": {"index": 357461, "code_hash": null, "entity": [["tile_f", "sp", [-1, 1, 3, 56]], ["tile_y", "sp", [-1, 1, 11, 1]], ["tile_x", "sp", [-1, 1, 1, 11]], ["tile_rc", "sp", [-1, 1]], ["tile_ry", "sp", [-1, 1]], ["tile_rx", "sp", [-1, 1]], ["auto_unroll_max_step", "ot", 512], ["unroll_explicit", "ot", 1]]}, "result": [[0.18297564675], 0, 2.5017030239105225, 1638696480.0828042], "version": 0.2, "tvm_version": "0.9.dev0"}
{"input": ["rocm -keys=rocm,gpu -max_num_threads=256 -mcpu=gfx906 -mtriple=amdgcn-amd-amdhsa-hcc -thread_warp_size=64", "conv2d_nchw.cuda", [["TENSOR", [128, 672, 11, 11], "float32"], ["TENSOR", [672, 672, 1, 1], "float32"], 1, 0, 1, "float32"], {}], "config": {"index": 859375, "code_hash": null, "entity": [["tile_f", "sp", [-1, 14, 12, 1]], ["tile_y", "sp", [-1, 1, 1, 11]], ["tile_x", "sp", [-1, 1, 1, 11]], ["tile_rc", "sp", [-1, 24]], ["tile_ry", "sp", [-1, 1]], ["tile_rx", "sp", [-1, 1]], ["auto_unroll_max_step", "ot", 1500], ["unroll_explicit", "ot", 1]]}, "result": [[1.5413046875], 0, 11.80568242073059, 1638696488.9589965], "version": 0.2, "tvm_version": "0.9.dev0"}
{"input": ["rocm -keys=rocm,gpu -max_num_threads=256 -mcpu=gfx906 -mtriple=amdgcn-amd-amdhsa-hcc -thread_warp_size=64", "conv2d_nchw.cuda", [["TENSOR", [128, 672, 11, 11], "float32"], ["TENSOR", [672, 672, 1, 1], "float32"], 1, 0, 1, "float32"], {}], "config": {"index": 562065, "code_hash": null, "entity": [["tile_f", "sp", [-1, 1, 12, 2]], ["tile_y", "sp", [-1, 1, 1, 11]], ["tile_x", "sp", [-1, 1, 1, 1]], ["tile_rc", "sp", [-1, 48]], ["tile_ry", "sp", [-1, 1]], ["tile_rx", "sp", [-1, 1]], ["auto_unroll_max_step", "ot", 512], ["unroll_explicit", "ot", 1]]}, "result": [[0.015103859999999998], 0, 2.1103367805480957, 1638696490.3004444], "version": 0.2, "tvm_version": "0.9.dev0"}
{"input": ["rocm -keys=rocm,gpu -max_num_threads=256 -mcpu=gfx906 -mtriple=amdgcn-amd-amdhsa-hcc -thread_warp_size=64", "conv2d_nchw.cuda", [["TENSOR", [128, 672, 11, 11], "float32"], ["TENSOR", [672, 672, 1, 1], "float32"], 1, 0, 1, "float32"], {}], "config": {"index": 214030, "code_hash": null, "entity": [["tile_f", "sp", [-1, 3, 1, 28]], ["tile_y", "sp", [-1, 1, 11, 1]], ["tile_x", "sp", [-1, 1, 1, 11]], ["tile_rc", "sp", [-1, 42]], ["tile_ry", "sp", [-1, 1]], ["tile_rx", "sp", [-1, 1]], ["auto_unroll_max_step", "ot", 0], ["unroll_explicit", "ot", 1]]}, "result": [[2.543974121], 0, 14.717875242233276, 1638696504.2915206], "version": 0.2, "tvm_version": "0.9.dev0"}
{"input": ["rocm -keys=rocm,gpu -max_num_threads=256 -mcpu=gfx906 -mtriple=amdgcn-amd-amdhsa-hcc -thread_warp_size=64", "conv2d_nchw.cuda", [["TENSOR", [128, 672, 11, 11], "float32"], ["TENSOR", [672, 672, 1, 1], "float32"], 1, 0, 1, "float32"], {}], "config": {"index": 389899, "code_hash": null, "entity": [["tile_f", "sp", [-1, 2, 24, 1]], ["tile_y", "sp", [-1, 1, 1, 11]], ["tile_x", "sp", [-1, 1, 1, 1]], ["tile_rc", "sp", [-1, 4]], ["tile_ry", "sp", [-1, 1]], ["tile_rx", "sp", [-1, 1]], ["auto_unroll_max_step", "ot", 512], ["unroll_explicit", "ot", 1]]}, "result": [[0.0109113876], 0, 2.152550458908081, 1638696505.9146552], "version": 0.2, "tvm_version": "0.9.dev0"}
{"input": ["rocm -keys=rocm,gpu -max_num_threads=256 -mcpu=gfx906 -mtriple=amdgcn-amd-amdhsa-hcc -thread_warp_size=64", "conv2d_nchw.cuda", [["TENSOR", [128, 672, 11, 11], "float32"], ["TENSOR", [672, 672, 1, 1], "float32"], 1, 0, 1, "float32"], {}], "config": {"index": 373739, "code_hash": null, "entity": [["tile_f", "sp", [-1, 2, 12, 1]], ["tile_y", "sp", [-1, 11, 1, 1]], ["tile_x", "sp", [-1, 1, 1, 1]], ["tile_rc", "sp", [-1, 3]], ["tile_ry", "sp", [-1, 1]], ["tile_rx", "sp", [-1, 1]], ["auto_unroll_max_step", "ot", 512], ["unroll_explicit", "ot", 1]]}, "result": [[0.017003591142857145], 0, 1.9076027870178223, 1638696507.4249961], "version": 0.2, "tvm_version": "0.9.dev0"}
{"input": ["rocm -keys=rocm,gpu -max_num_threads=256 -mcpu=gfx906 -mtriple=amdgcn-amd-amdhsa-hcc -thread_warp_size=64", "conv2d_nchw.cuda", [["TENSOR", [128, 672, 11, 11], "float32"], ["TENSOR", [672, 672, 1, 1], "float32"], 1, 0, 1, "float32"], {}], "config": {"index": 112590, "code_hash": null, "entity": [["tile_f", "sp", [-1, 7, 1, 8]], ["tile_y", "sp", [-1, 11, 1, 1]], ["tile_x", "sp", [-1, 1, 1, 11]], ["tile_rc", "sp", [-1, 12]], ["tile_ry", "sp", [-1, 1]], ["tile_rx", "sp", [-1, 1]], ["auto_unroll_max_step", "ot", 0], ["unroll_explicit", "ot", 1]]}, "result": [[4.461230957], 0, 25.693408250808716, 1638696530.799338], "version": 0.2, "tvm_version": "0.9.dev0"}
{"input": ["rocm -keys=rocm,gpu -max_num_threads=256 -mcpu=gfx906 -mtriple=amdgcn-amd-amdhsa-hcc -thread_warp_size=64", "conv2d_nchw.cuda", [["TENSOR", [128, 672, 11, 11], "float32"], ["TENSOR", [672, 672, 1, 1], "float32"], 1, 0, 1, "float32"], {}], "config": {"index": 924937, "code_hash": null, "entity": [["tile_f", "sp", [-1, 1, 8, 2]], ["tile_y", "sp", [-1, 1, 1, 1]], ["tile_x", "sp", [-1, 1, 11, 1]], ["tile_rc", "sp", [-1, 56]], ["tile_ry", "sp", [-1, 1]], ["tile_rx", "sp", [-1, 1]], ["auto_unroll_max_step", "ot", 1500], ["unroll_explicit", "ot", 1]]}, "result": [[0.018463189333333335], 0, 2.2497191429138184, 1638696532.3057683], "version": 0.2, "tvm_version": "0.9.dev0"}
{"input": ["rocm -keys=rocm,gpu -max_num_threads=256 -mcpu=gfx906 -mtriple=amdgcn-amd-amdhsa-hcc -thread_warp_size=64", "conv2d_nchw.cuda", [["TENSOR", [128, 672, 11, 11], "float32"], ["TENSOR", [672, 672, 1, 1], "float32"], 1, 0, 1, "float32"], {}], "config": {"index": 73850, "code_hash": null, "entity": [["tile_f", "sp", [-1, 8, 28, 3]], ["tile_y", "sp", [-1, 1, 11, 1]], ["tile_x", "sp", [-1, 1, 1, 1]], ["tile_rc", "sp", [-1, 7]], ["tile_ry", "sp", [-1, 1]], ["tile_rx", "sp", [-1, 1]], ["auto_unroll_max_step", "ot", 0], ["unroll_explicit", "ot", 1]]}, "result": [[0.029622396250000002], 0, 2.506511926651001, 1638696533.8188658], "version": 0.2, "tvm_version": "0.9.dev0"}
{"input": ["rocm -keys=rocm,gpu -max_num_threads=256 -mcpu=gfx906 -mtriple=amdgcn-amd-amdhsa-hcc -thread_warp_size=64", "conv2d_nchw.cuda", [["TENSOR", [128, 672, 11, 11], "float32"], ["TENSOR", [672, 672, 1, 1], "float32"], 1, 0, 1, "float32"], {}], "config": {"index": 781977, "code_hash": null, "entity": [["tile_f", "sp", [-1, 4, 14, 12]], ["tile_y", "sp", [-1, 1, 1, 1]], ["tile_x", "sp", [-1, 1, 11, 1]], ["tile_rc", "sp", [-1, 8]], ["tile_ry", "sp", [-1, 1]], ["tile_rx", "sp", [-1, 1]], ["auto_unroll_max_step", "ot", 1500], ["unroll_explicit", "ot", 1]]}, "result": [[0.06439209725], 0, 2.995849609375, 1638696535.432413], "version": 0.2, "tvm_version": "0.9.dev0"}
{"input": ["rocm -keys=rocm,gpu -max_num_threads=256 -mcpu=gfx906 -mtriple=amdgcn-amd-amdhsa-hcc -thread_warp_size=64", "conv2d_nchw.cuda", [["TENSOR", [128, 672, 11, 11], "float32"], ["TENSOR", [672, 672, 1, 1], "float32"], 1, 0, 1, "float32"], {}], "config": {"index": 108914, "code_hash": null, "entity": [["tile_f", "sp", [-1, 7, 4, 6]], ["tile_y", "sp", [-1, 11, 1, 1]], ["tile_x", "sp", [-1, 1, 11, 1]], ["tile_rc", "sp", [-1, 12]], ["tile_ry", "sp", [-1, 1]], ["tile_rx", "sp", [-1, 1]], ["auto_unroll_max_step", "ot", 0], ["unroll_explicit", "ot", 1]]}, "result": [[0.31061514275], 0, 5.577749013900757, 1638696538.2040408], "version": 0.2, "tvm_version": "0.9.dev0"}
{"input": ["rocm -keys=rocm,gpu -max_num_threads=256 -mcpu=gfx906 -mtriple=amdgcn-amd-amdhsa-hcc -thread_warp_size=64", "conv2d_nchw.cuda", [["TENSOR", [128, 672, 11, 11], "float32"], ["TENSOR", [672, 672, 1, 1], "float32"], 1, 0, 1, "float32"], {}], "config": {"index": 440448, "code_hash": null, "entity": [["tile_f", "sp", [-1, 4, 14, 6]], ["tile_y", "sp", [-1, 1, 1, 11]], ["tile_x", "sp", [-1, 1, 11, 1]], ["tile_rc", "sp", [-1, 8]], ["tile_ry", "sp", [-1, 1]], ["tile_rx", "sp", [-1, 1]], ["auto_unroll_max_step", "ot", 512], ["unroll_explicit", "ot", 1]]}, "result": [[0.30631491075], 0, 7.104507207870483, 1638696540.8419359], "version": 0.2, "tvm_version": "0.9.dev0"}
{"input": ["rocm -keys=rocm,gpu -max_num_threads=256 -mcpu=gfx906 -mtriple=amdgcn-amd-amdhsa-hcc -thread_warp_size=64", "conv2d_nchw.cuda", [["TENSOR", [128, 672, 11, 11], "float32"], ["TENSOR", [672, 672, 1, 1], "float32"], 1, 0, 1, "float32"], {}], "config": {"index": 552197, "code_hash": null, "entity": [["tile_f", "sp", [-1, 12, 7, 2]], ["tile_y", "sp", [-1, 1, 1, 1]], ["tile_x", "sp", [-1, 1, 11, 1]], ["tile_rc", "sp", [-1, 42]], ["tile_ry", "sp", [-1, 1]], ["tile_rx", "sp", [-1, 1]], ["auto_unroll_max_step", "ot", 512], ["unroll_explicit", "ot", 1]]}, "result": [[0.043725944499999995], 0, 3.1542623043060303, 1638696542.253705], "version": 0.2, "tvm_version": "0.9.dev0"}
{"input": ["rocm -keys=rocm,gpu -max_num_threads=256 -mcpu=gfx906 -mtriple=amdgcn-amd-amdhsa-hcc -thread_warp_size=64", "conv2d_nchw.cuda", [["TENSOR", [128, 672, 11, 11], "float32"], ["TENSOR", [672, 672, 1, 1], "float32"], 1, 0, 1, "float32"], {}], "config": {"index": 502598, "code_hash": null, "entity": [["tile_f", "sp", [-1, 1, 2, 48]], ["tile_y", "sp", [-1, 1, 1, 1]], ["tile_x", "sp", [-1, 1, 1, 1]], ["tile_rc", "sp", [-1, 24]], ["tile_ry", "sp", [-1, 1]], ["tile_rx", "sp", [-1, 1]], ["auto_unroll_max_step", "ot", 512], ["unroll_explicit", "ot", 1]]}, "result": [[1.1457763669999999], 0, 7.604758977890015, 1638696549.2697897], "version": 0.2, "tvm_version": "0.9.dev0"}
{"input": ["rocm -keys=rocm,gpu -max_num_threads=256 -mcpu=gfx906 -mtriple=amdgcn-amd-amdhsa-hcc -thread_warp_size=64", "conv2d_nchw.cuda", [["TENSOR", [128, 672, 11, 11], "float32"], ["TENSOR", [672, 672, 1, 1], "float32"], 1, 0, 1, "float32"], {}], "config": {"index": 587359, "code_hash": null, "entity": [["tile_f", "sp", [-1, 4, 1, 6]], ["tile_y", "sp", [-1, 1, 1, 11]], ["tile_x", "sp", [-1, 1, 1, 11]], ["tile_rc", "sp", [-1, 56]], ["tile_ry", "sp", [-1, 1]], ["tile_rx", "sp", [-1, 1]], ["auto_unroll_max_step", "ot", 512], ["unroll_explicit", "ot", 1]]}, "result": [[19.02554492175], 0, 105.55165266990662, 1638696647.0701888], "version": 0.2, "tvm_version": "0.9.dev0"}
{"input": ["rocm -keys=rocm,gpu -max_num_threads=256 -mcpu=gfx906 -mtriple=amdgcn-amd-amdhsa-hcc -thread_warp_size=64", "conv2d_nchw.cuda", [["TENSOR", [128, 672, 11, 11], "float32"], ["TENSOR", [672, 672, 1, 1], "float32"], 1, 0, 1, "float32"], {}], "config": {"index": 5541, "code_hash": null, "entity": [["tile_f", "sp", [-1, 1, 56, 1]], ["tile_y", "sp", [-1, 1, 11, 1]], ["tile_x", "sp", [-1, 11, 1, 1]], ["tile_rc", "sp", [-1, 1]], ["tile_ry", "sp", [-1, 1]], ["tile_rx", "sp", [-1, 1]], ["auto_unroll_max_step", "ot", 0], ["unroll_explicit", "ot", 1]]}, "result": [[0.01366658875], 0, 1.8037419319152832, 1638696658.5765576], "version": 0.2, "tvm_version": "0.9.dev0"}
{"input": ["rocm -keys=rocm,gpu -max_num_threads=256 -mcpu=gfx906 -mtriple=amdgcn-amd-amdhsa-hcc -thread_warp_size=64", "conv2d_nchw.cuda", [["TENSOR", [128, 672, 11, 11], "float32"], ["TENSOR", [672, 672, 1, 1], "float32"], 1, 0, 1, "float32"], {}], "config": {"index": 736999, "code_hash": null, "entity": [["tile_f", "sp", [-1, 1, 2, 6]], ["tile_y", "sp", [-1, 1, 11, 1]], ["tile_x", "sp", [-1, 11, 1, 1]], ["tile_rc", "sp", [-1, 4]], ["tile_ry", "sp", [-1, 1]], ["tile_rx", "sp", [-1, 1]], ["auto_unroll_max_step", "ot", 1500], ["unroll_explicit", "ot", 1]]}, "result": [[0.96852917475], 0, 9.450924634933472, 1638696677.8942206], "version": 0.2, "tvm_version": "0.9.dev0"}
{"input": ["rocm -keys=rocm,gpu -max_num_threads=256 -mcpu=gfx906 -mtriple=amdgcn-amd-amdhsa-hcc -thread_warp_size=64", "conv2d_nchw.cuda", [["TENSOR", [128, 672, 11, 11], "float32"], ["TENSOR", [672, 672, 1, 1], "float32"], 1, 0, 1, "float32"], {}], "config": {"index": 753301, "code_hash": null, "entity": [["tile_f", "sp", [-1, 1, 8, 12]], ["tile_y", "sp", [-1, 1, 1, 1]], ["tile_x", "sp", [-1, 1, 11, 1]], ["tile_rc", "sp", [-1, 6]], ["tile_ry", "sp", [-1, 1]], ["tile_rx", "sp", [-1, 1]], ["auto_unroll_max_step", "ot", 1500], ["unroll_explicit", "ot", 1]]}, "result": [[0.020204760166666665], 0, 2.040400743484497, 1638696679.3021493], "version": 0.2, "tvm_version": "0.9.dev0"}
{"input": ["rocm -keys=rocm,gpu -max_num_threads=256 -mcpu=gfx906 -mtriple=amdgcn-amd-amdhsa-hcc -thread_warp_size=64", "conv2d_nchw.cuda", [["TENSOR", [128, 672, 11, 11], "float32"], ["TENSOR", [672, 672, 1, 1], "float32"], 1, 0, 1, "float32"], {}], "config": {"index": 590336, "code_hash": null, "entity": [["tile_f", "sp", [-1, 1, 2, 24]], ["tile_y", "sp", [-1, 1, 11, 1]], ["tile_x", "sp", [-1, 1, 1, 1]], ["tile_rc", "sp", [-1, 84]], ["tile_ry", "sp", [-1, 1]], ["tile_rx", "sp", [-1, 1]], ["auto_unroll_max_step", "ot", 512], ["unroll_explicit", "ot", 1]]}, "result": [[0.12315301499999999], 0, 3.9066367149353027, 1638696881.3528411], "version": 0.2, "tvm_version": "0.9.dev0"}
{"input": ["rocm -keys=rocm,gpu -max_num_threads=256 -mcpu=gfx906 -mtriple=amdgcn-amd-amdhsa-hcc -thread_warp_size=64", "conv2d_nchw.cuda", [["TENSOR", [128, 672, 11, 11], "float32"], ["TENSOR", [672, 672, 1, 1], "float32"], 1, 0, 1, "float32"], {}], "config": {"index": 39376, "code_hash": null, "entity": [["tile_f", "sp", [-1, 12, 1, 56]], ["tile_y", "sp", [-1, 1, 1, 11]], ["tile_x", "sp", [-1, 1, 11, 1]], ["tile_rc", "sp", [-1, 3]], ["tile_ry", "sp", [-1, 1]], ["tile_rx", "sp", [-1, 1]], ["auto_unroll_max_step", "ot", 0], ["unroll_explicit", "ot", 1]]}, "result": [[1.65813610825], 0, 10.198962926864624, 1638696890.7430885], "version": 0.2, "tvm_version": "0.9.dev0"}
{"input": ["rocm -keys=rocm,gpu -max_num_threads=256 -mcpu=gfx906 -mtriple=amdgcn-amd-amdhsa-hcc -thread_warp_size=64", "conv2d_nchw.cuda", [["TENSOR", [128, 672, 11, 11], "float32"], ["TENSOR", [672, 672, 1, 1], "float32"], 1, 0, 1, "float32"], {}], "config": {"index": 920718, "code_hash": null, "entity": [["tile_f", "sp", [-1, 6, 1, 7]], ["tile_y", "sp", [-1, 1, 1, 11]], ["tile_x", "sp", [-1, 1, 1, 1]], ["tile_rc", "sp", [-1, 56]], ["tile_ry", "sp", [-1, 1]], ["tile_rx", "sp", [-1, 1]], ["auto_unroll_max_step", "ot", 1500], ["unroll_explicit", "ot", 1]]}, "result": [[14.33985058575], 0, 81.55315256118774, 1638696963.5496426], "version": 0.2, "tvm_version": "0.9.dev0"}
{"input": ["rocm -keys=rocm,gpu -max_num_threads=256 -mcpu=gfx906 -mtriple=amdgcn-amd-amdhsa-hcc -thread_warp_size=64", "conv2d_nchw.cuda", [["TENSOR", [128, 672, 11, 11], "float32"], ["TENSOR", [672, 672, 1, 1], "float32"], 1, 0, 1, "float32"], {}], "config": {"index": 497038, "code_hash": null, "entity": [["tile_f", "sp", [-1, 2, 4, 12]], ["tile_y", "sp", [-1, 1, 11, 1]], ["tile_x", "sp", [-1, 1, 11, 1]], ["tile_rc", "sp", [-1, 21]], ["tile_ry", "sp", [-1, 1]], ["tile_rx", "sp", [-1, 1]], ["auto_unroll_max_step", "ot", 512], ["unroll_explicit", "ot", 1]]}, "result": [[0.00897080925], 0, 3.0816712379455566, 1638696964.9313946], "version": 0.2, "tvm_version": "0.9.dev0"}
{"input": ["rocm -keys=rocm,gpu -max_num_threads=256 -mcpu=gfx906 -mtriple=amdgcn-amd-amdhsa-hcc -thread_warp_size=64", "conv2d_nchw.cuda", [["TENSOR", [128, 672, 11, 11], "float32"], ["TENSOR", [672, 672, 1, 1], "float32"], 1, 0, 1, "float32"], {}], "config": {"index": 986015, "code_hash": null, "entity": [["tile_f", "sp", [-1, 1, 3, 4]], ["tile_y", "sp", [-1, 1, 1, 1]], ["tile_x", "sp", [-1, 1, 1, 11]], ["tile_rc", "sp", [-1, 168]], ["tile_ry", "sp", [-1, 1]], ["tile_rx", "sp", [-1, 1]], ["auto_unroll_max_step", "ot", 1500], ["unroll_explicit", "ot", 1]]}, "result": [[0.16040322875000002], 0, 5.882576942443848, 1638696967.0190403], "version": 0.2, "tvm_version": "0.9.dev0"}
{"input": ["rocm -keys=rocm,gpu -max_num_threads=256 -mcpu=gfx906 -mtriple=amdgcn-amd-amdhsa-hcc -thread_warp_size=64", "conv2d_nchw.cuda", [["TENSOR", [128, 672, 11, 11], "float32"], ["TENSOR", [672, 672, 1, 1], "float32"], 1, 0, 1, "float32"], {}], "config": {"index": 20547, "code_hash": null, "entity": [["tile_f", "sp", [-1, 2, 1, 48]], ["tile_y", "sp", [-1, 1, 11, 1]], ["tile_x", "sp", [-1, 11, 1, 1]], ["tile_rc", "sp", [-1, 2]], ["tile_ry", "sp", [-1, 1]], ["tile_rx", "sp", [-1, 1]], ["auto_unroll_max_step", "ot", 0], ["unroll_explicit", "ot", 1]]}, "result": [[0.3401936035], 0, 3.660494565963745, 1638696969.8738809], "version": 0.2, "tvm_version": "0.9.dev0"}
{"input": ["rocm -keys=rocm,gpu -max_num_threads=256 -mcpu=gfx906 -mtriple=amdgcn-amd-amdhsa-hcc -thread_warp_size=64", "conv2d_nchw.cuda", [["TENSOR", [128, 672, 11, 11], "float32"], ["TENSOR", [672, 672, 1, 1], "float32"], 1, 0, 1, "float32"], {}], "config": {"index": 146138, "code_hash": null, "entity": [["tile_f", "sp", [-1, 24, 7, 1]], ["tile_y", "sp", [-1, 1, 1, 11]], ["tile_x", "sp", [-1, 1, 1, 1]], ["tile_rc", "sp", [-1, 21]], ["tile_ry", "sp", [-1, 1]], ["tile_rx", "sp", [-1, 1]], ["auto_unroll_max_step", "ot", 0], ["unroll_explicit", "ot", 1]]}, "result": [[1.1527612302499999], 0, 8.145325183868408, 1638697177.1973217], "version": 0.2, "tvm_version": "0.9.dev0"}
{"input": ["rocm -keys=rocm,gpu -max_num_threads=256 -mcpu=gfx906 -mtriple=amdgcn-amd-amdhsa-hcc -thread_warp_size=64", "conv2d_nchw.cuda", [["TENSOR", [128, 672, 11, 11], "float32"], ["TENSOR", [672, 672, 1, 1], "float32"], 1, 0, 1, "float32"], {}], "config": {"index": 546235, "code_hash": null, "entity": [["tile_f", "sp", [-1, 4, 12, 7]], ["tile_y", "sp", [-1, 11, 1, 1]], ["tile_x", "sp", [-1, 1, 1, 1]], ["tile_rc", "sp", [-1, 42]], ["tile_ry", "sp", [-1, 1]], ["tile_rx", "sp", [-1, 1]], ["auto_unroll_max_step", "ot", 512], ["unroll_explicit", "ot", 1]]}, "result": [[6.370047851500001], 0, 37.25896120071411, 1638697210.16343], "version": 0.2, "tvm_version": "0.9.dev0"}
{"input": ["rocm -keys=rocm,gpu -max_num_threads=256 -mcpu=gfx906 -mtriple=amdgcn-amd-amdhsa-hcc -thread_warp_size=64", "conv2d_nchw.cuda", [["TENSOR", [128, 672, 11, 11], "float32"], ["TENSOR", [672, 672, 1, 1], "float32"], 1, 0, 1, "float32"], {}], "config": {"index": 526249, "code_hash": null, "entity": [["tile_f", "sp", [-1, 2, 24, 2]], ["tile_y", "sp", [-1, 1, 1, 11]], ["tile_x", "sp", [-1, 1, 11, 1]], ["tile_rc", "sp", [-1, 28]], ["tile_ry", "sp", [-1, 1]], ["tile_rx", "sp", [-1, 1]], ["auto_unroll_max_step", "ot", 512], ["unroll_explicit", "ot", 1]]}, "result": [[0.005176762866666667], 0, 2.294346809387207, 1638697211.734595], "version": 0.2, "tvm_version": "0.9.dev0"}
{"input": ["rocm -keys=rocm,gpu -max_num_threads=256 -mcpu=gfx906 -mtriple=amdgcn-amd-amdhsa-hcc -thread_warp_size=64", "conv2d_nchw.cuda", [["TENSOR", [128, 672, 11, 11], "float32"], ["TENSOR", [672, 672, 1, 1], "float32"], 1, 0, 1, "float32"], {}], "config": {"index": 125979, "code_hash": null, "entity": [["tile_f", "sp", [-1, 8, 2, 7]], ["tile_y", "sp", [-1, 1, 1, 1]], ["tile_x", "sp", [-1, 1, 1, 11]], ["tile_rc", "sp", [-1, 14]], ["tile_ry", "sp", [-1, 1]], ["tile_rx", "sp", [-1, 1]], ["auto_unroll_max_step", "ot", 0], ["unroll_explicit", "ot", 1]]}, "result": [[2.4963779295], 0, 14.343588590621948, 1638697225.408482], "version": 0.2, "tvm_version": "0.9.dev0"}
{"input": ["rocm -keys=rocm,gpu -max_num_threads=256 -mcpu=gfx906 -mtriple=amdgcn-amd-amdhsa-hcc -thread_warp_size=64", "conv2d_nchw.cuda", [["TENSOR", [128, 672, 11, 11], "float32"], ["TENSOR", [672, 672, 1, 1], "float32"], 1, 0, 1, "float32"], {}], "config": {"index": 493082, "code_hash": null, "entity": [["tile_f", "sp", [-1, 4, 14, 2]], ["tile_y", "sp", [-1, 1, 11, 1]], ["tile_x", "sp", [-1, 11, 1, 1]], ["tile_rc", "sp", [-1, 21]], ["tile_ry", "sp", [-1, 1]], ["tile_rx", "sp", [-1, 1]], ["auto_unroll_max_step", "ot", 512], ["unroll_explicit", "ot", 1]]}, "result": [[0.1274623335], 0, 2.556774377822876, 1638697227.1575456], "version": 0.2, "tvm_version": "0.9.dev0"}
{"input": ["rocm -keys=rocm,gpu -max_num_threads=256 -mcpu=gfx906 -mtriple=amdgcn-amd-amdhsa-hcc -thread_warp_size=64", "conv2d_nchw.cuda", [["TENSOR", [128, 672, 11, 11], "float32"], ["TENSOR", [672, 672, 1, 1], "float32"], 1, 0, 1, "float32"], {}], "config": {"index": 784097, "code_hash": null, "entity": [["tile_f", "sp", [-1, 4, 8, 1]], ["tile_y", "sp", [-1, 1, 1, 11]], ["tile_x", "sp", [-1, 1, 11, 1]], ["tile_rc", "sp", [-1, 8]], ["tile_ry", "sp", [-1, 1]], ["tile_rx", "sp", [-1, 1]], ["auto_unroll_max_step", "ot", 1500], ["unroll_explicit", "ot", 1]]}, "result": [[0.06406930525], 0, 2.434035301208496, 1638697228.7841258], "version": 0.2, "tvm_version": "0.9.dev0"}
{"input": ["rocm -keys=rocm,gpu -max_num_threads=256 -mcpu=gfx906 -mtriple=amdgcn-amd-amdhsa-hcc -thread_warp_size=64", "conv2d_nchw.cuda", [["TENSOR", [128, 672, 11, 11], "float32"], ["TENSOR", [672, 672, 1, 1], "float32"], 1, 0, 1, "float32"], {}], "config": {"index": 250710, "code_hash": null, "entity": [["tile_f", "sp", [-1, 1, 3, 16]], ["tile_y", "sp", [-1, 1, 1, 11]], ["tile_x", "sp", [-1, 11, 1, 1]], ["tile_rc", "sp", [-1, 84]], ["tile_ry", "sp", [-1, 1]], ["tile_rx", "sp", [-1, 1]], ["auto_unroll_max_step", "ot", 0], ["unroll_explicit", "ot", 1]]}, "result": [[13.08101269525], 0, 67.21960186958313, 1638697295.3716865], "version": 0.2, "tvm_version": "0.9.dev0"}
{"input": ["rocm -keys=rocm,gpu -max_num_threads=256 -mcpu=gfx906 -mtriple=amdgcn-amd-amdhsa-hcc -thread_warp_size=64", "conv2d_nchw.cuda", [["TENSOR", [128, 672, 11, 11], "float32"], ["TENSOR", [672, 672, 1, 1], "float32"], 1, 0, 1, "float32"], {}], "config": {"index": 837709, "code_hash": null, "entity": [["tile_f", "sp", [-1, 3, 1, 56]], ["tile_y", "sp", [-1, 1, 11, 1]], ["tile_x", "sp", [-1, 11, 1, 1]], ["tile_rc", "sp", [-1, 21]], ["tile_ry", "sp", [-1, 1]], ["tile_rx", "sp", [-1, 1]], ["auto_unroll_max_step", "ot", 1500], ["unroll_explicit", "ot", 1]]}, "result": [[1.9734354247500001], 0, 17.408090114593506, 1638697306.4435115], "version": 0.2, "tvm_version": "0.9.dev0"}
{"input": ["rocm -keys=rocm,gpu -max_num_threads=256 -mcpu=gfx906 -mtriple=amdgcn-amd-amdhsa-hcc -thread_warp_size=64", "conv2d_nchw.cuda", [["TENSOR", [128, 672, 11, 11], "float32"], ["TENSOR", [672, 672, 1, 1], "float32"], 1, 0, 1, "float32"], {}], "config": {"index": 943263, "code_hash": null, "entity": [["tile_f", "sp", [-1, 3, 1, 14]], ["tile_y", "sp", [-1, 1, 1, 1]], ["tile_x", "sp", [-1, 1, 1, 11]], ["tile_rc", "sp", [-1, 84]], ["tile_ry", "sp", [-1, 1]], ["tile_rx", "sp", [-1, 1]], ["auto_unroll_max_step", "ot", 1500], ["unroll_explicit", "ot", 1]]}, "result": [[12.69868359375], 0, 69.6347553730011, 1638697371.443717], "version": 0.2, "tvm_version": "0.9.dev0"}
{"input": ["rocm -keys=rocm,gpu -max_num_threads=256 -mcpu=gfx906 -mtriple=amdgcn-amd-amdhsa-hcc -thread_warp_size=64", "conv2d_nchw.cuda", [["TENSOR", [128, 672, 11, 11], "float32"], ["TENSOR", [672, 672, 1, 1], "float32"], 1, 0, 1, "float32"], {}], "config": {"index": 361429, "code_hash": null, "entity": [["tile_f", "sp", [-1, 14, 2, 3]], ["tile_y", "sp", [-1, 1, 1, 11]], ["tile_x", "sp", [-1, 1, 1, 1]], ["tile_rc", "sp", [-1, 2]], ["tile_ry", "sp", [-1, 1]], ["tile_rx", "sp", [-1, 1]], ["auto_unroll_max_step", "ot", 512], ["unroll_explicit", "ot", 1]]}, "result": [[2.363890625], 0, 18.257137537002563, 1638697384.4632154], "version": 0.2, "tvm_version": "0.9.dev0"}
{"input": ["rocm -keys=rocm,gpu -max_num_threads=256 -mcpu=gfx906 -mtriple=amdgcn-amd-amdhsa-hcc -thread_warp_size=64", "conv2d_nchw.cuda", [["TENSOR", [128, 672, 11, 11], "float32"], ["TENSOR", [672, 672, 1, 1], "float32"], 1, 0, 1, "float32"], {}], "config": {"index": 540816, "code_hash": null, "entity": [["tile_f", "sp", [-1, 12, 1, 7]], ["tile_y", "sp", [-1, 1, 1, 11]], ["tile_x", "sp", [-1, 1, 11, 1]], ["tile_rc", "sp", [-1, 32]], ["tile_ry", "sp", [-1, 1]], ["tile_rx", "sp", [-1, 1]], ["auto_unroll_max_step", "ot", 512], ["unroll_explicit", "ot", 1]]}, "result": [[1.09064111325], 0, 10.736997127532959, 1638697391.3503141], "version": 0.2, "tvm_version": "0.9.dev0"}
{"input": ["rocm -keys=rocm,gpu -max_num_threads=256 -mcpu=gfx906 -mtriple=amdgcn-amd-amdhsa-hcc -thread_warp_size=64", "conv2d_nchw.cuda", [["TENSOR", [128, 672, 11, 11], "float32"], ["TENSOR", [672, 672, 1, 1], "float32"], 1, 0, 1, "float32"], {}], "config": {"index": 44917, "code_hash": null, "entity": [["tile_f", "sp", [-1, 4, 14, 1]], ["tile_y", "sp", [-1, 1, 11, 1]], ["tile_x", "sp", [-1, 1, 1, 1]], ["tile_rc", "sp", [-1, 4]], ["tile_ry", "sp", [-1, 1]], ["tile_rx", "sp", [-1, 1]], ["auto_unroll_max_step", "ot", 0], ["unroll_explicit", "ot", 1]]}, "result": [[0.015142038571428571], 0, 1.9689464569091797, 1638697392.8731165], "version": 0.2, "tvm_version": "0.9.dev0"}
{"input": ["rocm -keys=rocm,gpu -max_num_threads=256 -mcpu=gfx906 -mtriple=amdgcn-amd-amdhsa-hcc -thread_warp_size=64", "conv2d_nchw.cuda", [["TENSOR", [128, 672, 11, 11], "float32"], ["TENSOR", [672, 672, 1, 1], "float32"], 1, 0, 1, "float32"], {}], "config": {"index": 390045, "code_hash": null, "entity": [["tile_f", "sp", [-1, 12, 14, 2]], ["tile_y", "sp", [-1, 1, 1, 11]], ["tile_x", "sp", [-1, 1, 1, 1]], ["tile_rc", "sp", [-1, 4]], ["tile_ry", "sp", [-1, 1]], ["tile_rx", "sp", [-1, 1]], ["auto_unroll_max_step", "ot", 512], ["unroll_explicit", "ot", 1]]}, "result": [[0.48213256825], 0, 7.020094871520996, 1638697396.731081], "version": 0.2, "tvm_version": "0.9.dev0"}
{"input": ["rocm -keys=rocm,gpu -max_num_threads=256 -mcpu=gfx906 -mtriple=amdgcn-amd-amdhsa-hcc -thread_warp_size=64", "conv2d_nchw.cuda", [["TENSOR", [128, 672, 11, 11], "float32"], ["TENSOR", [672, 672, 1, 1], "float32"], 1, 0, 1, "float32"], {}], "config": {"index": 816867, "code_hash": null, "entity": [["tile_f", "sp", [-1, 1, 4, 8]], ["tile_y", "sp", [-1, 1, 1, 11]], ["tile_x", "sp", [-1, 1, 1, 11]], ["tile_rc", "sp", [-1, 14]], ["tile_ry", "sp", [-1, 1]], ["tile_rx", "sp", [-1, 1]], ["auto_unroll_max_step", "ot", 1500], ["unroll_explicit", "ot", 1]]}, "result": [[2.3652016600000003], 0, 20.98931336402893, 1638697410.0187647], "version": 0.2, "tvm_version": "0.9.dev0"}
{"input": ["rocm -keys=rocm,gpu -max_num_threads=256 -mcpu=gfx906 -mtriple=amdgcn-amd-amdhsa-hcc -thread_warp_size=64", "conv2d_nchw.cuda", [["TENSOR", [128, 672, 11, 11], "float32"], ["TENSOR", [672, 672, 1, 1], "float32"], 1, 0, 1, "float32"], {}], "config": {"index": 229324, "code_hash": null, "entity": [["tile_f", "sp", [-1, 2, 1, 56]], ["tile_y", "sp", [-1, 1, 1, 11]], ["tile_x", "sp", [-1, 1, 1, 11]], ["tile_rc", "sp", [-1, 48]], ["tile_ry", "sp", [-1, 1]], ["tile_rx", "sp", [-1, 1]], ["auto_unroll_max_step", "ot", 0], ["unroll_explicit", "ot", 1]]}, "result": [[33.5665859375], 0, 170.01657938957214, 1638697579.3765984], "version": 0.2, "tvm_version": "0.9.dev0"}
{"input": ["rocm -keys=rocm,gpu -max_num_threads=256 -mcpu=gfx906 -mtriple=amdgcn-amd-amdhsa-hcc -thread_warp_size=64", "conv2d_nchw.cuda", [["TENSOR", [128, 672, 11, 11], "float32"], ["TENSOR", [672, 672, 1, 1], "float32"], 1, 0, 1, "float32"], {}], "config": {"index": 456429, "code_hash": null, "entity": [["tile_f", "sp", [-1, 28, 8, 3]], ["tile_y", "sp", [-1, 11, 1, 1]], ["tile_x", "sp", [-1, 1, 1, 11]], ["tile_rc", "sp", [-1, 12]], ["tile_ry", "sp", [-1, 1]], ["tile_rx", "sp", [-1, 1]], ["auto_unroll_max_step", "ot", 512], ["unroll_explicit", "ot", 1]]}, "result": [[0.3568464965], 0, 7.674768686294556, 1638697582.2984967], "version": 0.2, "tvm_version": "0.9.dev0"}
{"input": ["rocm -keys=rocm,gpu -max_num_threads=256 -mcpu=gfx906 -mtriple=amdgcn-amd-amdhsa-hcc -thread_warp_size=64", "conv2d_nchw.cuda", [["TENSOR", [128, 672, 11, 11], "float32"], ["TENSOR", [672, 672, 1, 1], "float32"], 1, 0, 1, "float32"], {}], "config": {"index": 64002, "code_hash": null, "entity": [["tile_f", "sp", [-1, 1, 224, 3]], ["tile_y", "sp", [-1, 1, 1, 11]], ["tile_x", "sp", [-1, 11, 1, 1]], ["tile_rc", "sp", [-1, 6]], ["tile_ry", "sp", [-1, 1]], ["tile_rx", "sp", [-1, 1]], ["auto_unroll_max_step", "ot", 0], ["unroll_explicit", "ot", 1]]}, "result": [[0.13230877675], 0, 2.5535850524902344, 1638697584.166791], "version": 0.2, "tvm_version": "0.9.dev0"}
{"input": ["rocm -keys=rocm,gpu -max_num_threads=256 -mcpu=gfx906 -mtriple=amdgcn-amd-amdhsa-hcc -thread_warp_size=64", "conv2d_nchw.cuda", [["TENSOR", [128, 672, 11, 11], "float32"], ["TENSOR", [672, 672, 1, 1], "float32"], 1, 0, 1, "float32"], {}], "config": {"index": 180945, "code_hash": null, "entity": [["tile_f", "sp", [-1, 1, 2, 56]], ["tile_y", "sp", [-1, 11, 1, 1]], ["tile_x", "sp", [-1, 1, 11, 1]], ["tile_rc", "sp", [-1, 28]], ["tile_ry", "sp", [-1, 1]], ["tile_rx", "sp", [-1, 1]], ["auto_unroll_max_step", "ot", 0], ["unroll_explicit", "ot", 1]]}, "result": [[0.5601938474999999], 0, 4.3730103969573975, 1638697588.173906], "version": 0.2, "tvm_version": "0.9.dev0"}
{"input": ["rocm -keys=rocm,gpu -max_num_threads=256 -mcpu=gfx906 -mtriple=amdgcn-amd-amdhsa-hcc -thread_warp_size=64", "conv2d_nchw.cuda", [["TENSOR", [128, 672, 11, 11], "float32"], ["TENSOR", [672, 672, 1, 1], "float32"], 1, 0, 1, "float32"], {}], "config": {"index": 697782, "code_hash": null, "entity": [["tile_f", "sp", [-1, 3, 4, 14]], ["tile_y", "sp", [-1, 1, 11, 1]], ["tile_x", "sp", [-1, 1, 11, 1]], ["tile_rc", "sp", [-1, 1]], ["tile_ry", "sp", [-1, 1]], ["tile_rx", "sp", [-1, 1]], ["auto_unroll_max_step", "ot", 1500], ["unroll_explicit", "ot", 1]]}, "result": [[0.004645812272727273], 0, 1.7135334014892578, 1638697589.4285998], "version": 0.2, "tvm_version": "0.9.dev0"}
{"input": ["rocm -keys=rocm,gpu -max_num_threads=256 -mcpu=gfx906 -mtriple=amdgcn-amd-amdhsa-hcc -thread_warp_size=64", "conv2d_nchw.cuda", [["TENSOR", [128, 672, 11, 11], "float32"], ["TENSOR", [672, 672, 1, 1], "float32"], 1, 0, 1, "float32"], {}], "config": {"index": 147520, "code_hash": null, "entity": [["tile_f", "sp", [-1, 6, 16, 7]], ["tile_y", "sp", [-1, 1, 1, 1]], ["tile_x", "sp", [-1, 11, 1, 1]], ["tile_rc", "sp", [-1, 21]], ["tile_ry", "sp", [-1, 1]], ["tile_rx", "sp", [-1, 1]], ["auto_unroll_max_step", "ot", 0], ["unroll_explicit", "ot", 1]]}, "result": [[1.6300489500000002], 0, 10.345208406448364, 1638697598.7733989], "version": 0.2, "tvm_version": "0.9.dev0"}
{"input": ["rocm -keys=rocm,gpu -max_num_threads=256 -mcpu=gfx906 -mtriple=amdgcn-amd-amdhsa-hcc -thread_warp_size=64", "conv2d_nchw.cuda", [["TENSOR", [128, 672, 11, 11], "float32"], ["TENSOR", [672, 672, 1, 1], "float32"], 1, 0, 1, "float32"], {}], "config": {"index": 517382, "code_hash": null, "entity": [["tile_f", "sp", [-1, 4, 1, 4]], ["tile_y", "sp", [-1, 11, 1, 1]], ["tile_x", "sp", [-1, 1, 1, 1]], ["tile_rc", "sp", [-1, 28]], ["tile_ry", "sp", [-1, 1]], ["tile_rx", "sp", [-1, 1]], ["auto_unroll_max_step", "ot", 512], ["unroll_explicit", "ot", 1]]}, "result": [[9.2920410155], 0, 50.01413154602051, 1638697646.4278004], "version": 0.2, "tvm_version": "0.9.dev0"}
{"input": ["rocm -keys=rocm,gpu -max_num_threads=256 -mcpu=gfx906 -mtriple=amdgcn-amd-amdhsa-hcc -thread_warp_size=64", "conv2d_nchw.cuda", [["TENSOR", [128, 672, 11, 11], "float32"], ["TENSOR", [672, 672, 1, 1], "float32"], 1, 0, 1, "float32"], {}], "config": {"index": 173678, "code_hash": null, "entity": [["tile_f", "sp", [-1, 8, 2, 21]], ["tile_y", "sp", [-1, 11, 1, 1]], ["tile_x", "sp", [-1, 1, 1, 1]], ["tile_rc", "sp", [-1, 28]], ["tile_ry", "sp", [-1, 1]], ["tile_rx", "sp", [-1, 1]], ["auto_unroll_max_step", "ot", 0], ["unroll_explicit", "ot", 1]]}, "result": [[19.3813046875], 0, 99.48559212684631, 1638697744.4998846], "version": 0.2, "tvm_version": "0.9.dev0"}
{"input": ["rocm -keys=rocm,gpu -max_num_threads=256 -mcpu=gfx906 -mtriple=amdgcn-amd-amdhsa-hcc -thread_warp_size=64", "conv2d_nchw.cuda", [["TENSOR", [128, 672, 11, 11], "float32"], ["TENSOR", [672, 672, 1, 1], "float32"], 1, 0, 1, "float32"], {}], "config": {"index": 489495, "code_hash": null, "entity": [["tile_f", "sp", [-1, 1, 14, 2]], ["tile_y", "sp", [-1, 1, 11, 1]], ["tile_x", "sp", [-1, 1, 1, 1]], ["tile_rc", "sp", [-1, 21]], ["tile_ry", "sp", [-1, 1]], ["tile_rx", "sp", [-1, 1]], ["auto_unroll_max_step", "ot", 512], ["unroll_explicit", "ot", 1]]}, "result": [[0.016194499285714287], 0, 1.5088820457458496, 1638697838.7134948], "version": 0.2, "tvm_version": "0.9.dev0"}
{"input": ["rocm -keys=rocm,gpu -max_num_threads=256 -mcpu=gfx906 -mtriple=amdgcn-amd-amdhsa-hcc -thread_warp_size=64", "conv2d_nchw.cuda", [["TENSOR", [128, 672, 11, 11], "float32"], ["TENSOR", [672, 672, 1, 1], "float32"], 1, 0, 1, "float32"], {}], "config": {"index": 145431, "code_hash": null, "entity": [["tile_f", "sp", [-1, 1, 14, 2]], ["tile_y", "sp", [-1, 1, 11, 1]], ["tile_x", "sp", [-1, 1, 1, 1]], ["tile_rc", "sp", [-1, 21]], ["tile_ry", "sp", [-1, 1]], ["tile_rx", "sp", [-1, 1]], ["auto_unroll_max_step", "ot", 0], ["unroll_explicit", "ot", 1]]}, "result": [[0.018372056166666668], 0, 1.7329661846160889, 1638697840.1037302], "version": 0.2, "tvm_version": "0.9.dev0"}
{"input": ["rocm -keys=rocm,gpu -max_num_threads=256 -mcpu=gfx906 -mtriple=amdgcn-amd-amdhsa-hcc -thread_warp_size=64", "conv2d_nchw.cuda", [["TENSOR", [128, 672, 11, 11], "float32"], ["TENSOR", [672, 672, 1, 1], "float32"], 1, 0, 1, "float32"], {}], "config": {"index": 489503, "code_hash": null, "entity": [["tile_f", "sp", [-1, 1, 16, 2]], ["tile_y", "sp", [-1, 1, 11, 1]], ["tile_x", "sp", [-1, 1, 1, 1]], ["tile_rc", "sp", [-1, 21]], ["tile_ry", "sp", [-1, 1]], ["tile_rx", "sp", [-1, 1]], ["auto_unroll_max_step", "ot", 512], ["unroll_explicit", "ot", 1]]}, "result": [[0.015023865714285715], 0, 1.8236289024353027, 1638697841.55141], "version": 0.2, "tvm_version": "0.9.dev0"}
{"input": ["rocm -keys=rocm,gpu -max_num_threads=256 -mcpu=gfx906 -mtriple=amdgcn-amd-amdhsa-hcc -thread_warp_size=64", "conv2d_nchw.cuda", [["TENSOR", [128, 672, 11, 11], "float32"], ["TENSOR", [672, 672, 1, 1], "float32"], 1, 0, 1, "float32"], {}], "config": {"index": 145439, "code_hash": null, "entity": [["tile_f", "sp", [-1, 1, 16, 2]], ["tile_y", "sp", [-1, 1, 11, 1]], ["tile_x", "sp", [-1, 1, 1, 1]], ["tile_rc", "sp", [-1, 21]], ["tile_ry", "sp", [-1, 1]], ["tile_rx", "sp", [-1, 1]], ["auto_unroll_max_step", "ot", 0], ["unroll_explicit", "ot", 1]]}, "result": [[0.017178178], 0, 1.710141897201538, 1638697842.9410982], "version": 0.2, "tvm_version": "0.9.dev0"}
{"input": ["rocm -keys=rocm,gpu -max_num_threads=256 -mcpu=gfx906 -mtriple=amdgcn-amd-amdhsa-hcc -thread_warp_size=64", "conv2d_nchw.cuda", [["TENSOR", [128, 672, 11, 11], "float32"], ["TENSOR", [672, 672, 1, 1], "float32"], 1, 0, 1, "float32"], {}], "config": {"index": 102423, "code_hash": null, "entity": [["tile_f", "sp", [-1, 1, 14, 2]], ["tile_y", "sp", [-1, 1, 11, 1]], ["tile_x", "sp", [-1, 1, 1, 1]], ["tile_rc", "sp", [-1, 12]], ["tile_ry", "sp", [-1, 1]], ["tile_rx", "sp", [-1, 1]], ["auto_unroll_max_step", "ot", 0], ["unroll_explicit", "ot", 1]]}, "result": [[0.015460883999999998], 0, 1.6432104110717773, 1638697844.3873637], "version": 0.2, "tvm_version": "0.9.dev0"}
{"input": ["rocm -keys=rocm,gpu -max_num_threads=256 -mcpu=gfx906 -mtriple=amdgcn-amd-amdhsa-hcc -thread_warp_size=64", "conv2d_nchw.cuda", [["TENSOR", [128, 672, 11, 11], "float32"], ["TENSOR", [672, 672, 1, 1], "float32"], 1, 0, 1, "float32"], {}], "config": {"index": 446487, "code_hash": null, "entity": [["tile_f", "sp", [-1, 1, 14, 2]], ["tile_y", "sp", [-1, 1, 11, 1]], ["tile_x", "sp", [-1, 1, 1, 1]], ["tile_rc", "sp", [-1, 12]], ["tile_ry", "sp", [-1, 1]], ["tile_rx", "sp", [-1, 1]], ["auto_unroll_max_step", "ot", 512], ["unroll_explicit", "ot", 1]]}, "result": [[0.01517626942857143], 0, 1.6206285953521729, 1638697845.7656336], "version": 0.2, "tvm_version": "0.9.dev0"}
{"input": ["rocm -keys=rocm,gpu -max_num_threads=256 -mcpu=gfx906 -mtriple=amdgcn-amd-amdhsa-hcc -thread_warp_size=64", "conv2d_nchw.cuda", [["TENSOR", [128, 672, 11, 11], "float32"], ["TENSOR", [672, 672, 1, 1], "float32"], 1, 0, 1, "float32"], {}], "config": {"index": 131089, "code_hash": null, "entity": [["tile_f", "sp", [-1, 1, 12, 2]], ["tile_y", "sp", [-1, 1, 11, 1]], ["tile_x", "sp", [-1, 1, 1, 1]], ["tile_rc", "sp", [-1, 16]], ["tile_ry", "sp", [-1, 1]], ["tile_rx", "sp", [-1, 1]], ["auto_unroll_max_step", "ot", 0], ["unroll_explicit", "ot", 1]]}, "result": [[0.0141065215], 0, 1.6667883396148682, 1638697847.1305006], "version": 0.2, "tvm_version": "0.9.dev0"}
{"input": ["rocm -keys=rocm,gpu -max_num_threads=256 -mcpu=gfx906 -mtriple=amdgcn-amd-amdhsa-hcc -thread_warp_size=64", "conv2d_nchw.cuda", [["TENSOR", [128, 672, 11, 11], "float32"], ["TENSOR", [672, 672, 1, 1], "float32"], 1, 0, 1, "float32"], {}], "config": {"index": 475153, "code_hash": null, "entity": [["tile_f", "sp", [-1, 1, 12, 2]], ["tile_y", "sp", [-1, 1, 11, 1]], ["tile_x", "sp", [-1, 1, 1, 1]], ["tile_rc", "sp", [-1, 16]], ["tile_ry", "sp", [-1, 1]], ["tile_rx", "sp", [-1, 1]], ["auto_unroll_max_step", "ot", 512], ["unroll_explicit", "ot", 1]]}, "result": [[0.013183409625], 0, 1.7941739559173584, 1638697848.5751815], "version": 0.2, "tvm_version": "0.9.dev0"}
{"input": ["rocm -keys=rocm,gpu -max_num_threads=256 -mcpu=gfx906 -mtriple=amdgcn-amd-amdhsa-hcc -thread_warp_size=64", "conv2d_nchw.cuda", [["TENSOR", [128, 672, 11, 11], "float32"], ["TENSOR", [672, 672, 1, 1], "float32"], 1, 0, 1, "float32"], {}], "config": {"index": 489489, "code_hash": null, "entity": [["tile_f", "sp", [-1, 1, 12, 2]], ["tile_y", "sp", [-1, 1, 11, 1]], ["tile_x", "sp", [-1, 1, 1, 1]], ["tile_rc", "sp", [-1, 21]], ["tile_ry", "sp", [-1, 1]], ["tile_rx", "sp", [-1, 1]], ["auto_unroll_max_step", "ot", 512], ["unroll_explicit", "ot", 1]]}, "result": [[0.0180261], 0, 1.654998779296875, 1638697849.8774748], "version": 0.2, "tvm_version": "0.9.dev0"}
{"input": ["rocm -keys=rocm,gpu -max_num_threads=256 -mcpu=gfx906 -mtriple=amdgcn-amd-amdhsa-hcc -thread_warp_size=64", "conv2d_nchw.cuda", [["TENSOR", [128, 672, 11, 11], "float32"], ["TENSOR", [672, 672, 1, 1], "float32"], 1, 0, 1, "float32"], {}], "config": {"index": 145425, "code_hash": null, "entity": [["tile_f", "sp", [-1, 1, 12, 2]], ["tile_y", "sp", [-1, 1, 11, 1]], ["tile_x", "sp", [-1, 1, 1, 1]], ["tile_rc", "sp", [-1, 21]], ["tile_ry", "sp", [-1, 1]], ["tile_rx", "sp", [-1, 1]], ["auto_unroll_max_step", "ot", 0], ["unroll_explicit", "ot", 1]]}, "result": [[0.020247184666666668], 0, 1.6924092769622803, 1638697851.2096026], "version": 0.2, "tvm_version": "0.9.dev0"}
{"input": ["rocm -keys=rocm,gpu -max_num_threads=256 -mcpu=gfx906 -mtriple=amdgcn-amd-amdhsa-hcc -thread_warp_size=64", "conv2d_nchw.cuda", [["TENSOR", [128, 672, 11, 11], "float32"], ["TENSOR", [672, 672, 1, 1], "float32"], 1, 0, 1, "float32"], {}], "config": {"index": 116753, "code_hash": null, "entity": [["tile_f", "sp", [-1, 1, 12, 2]], ["tile_y", "sp", [-1, 1, 11, 1]], ["tile_x", "sp", [-1, 1, 1, 1]], ["tile_rc", "sp", [-1, 14]], ["tile_ry", "sp", [-1, 1]], ["tile_rx", "sp", [-1, 1]], ["auto_unroll_max_step", "ot", 0], ["unroll_explicit", "ot", 1]]}, "result": [[0.019036694833333333], 0, 1.69818115234375, 1638697852.6524913], "version": 0.2, "tvm_version": "0.9.dev0"}
{"input": ["rocm -keys=rocm,gpu -max_num_threads=256 -mcpu=gfx906 -mtriple=amdgcn-amd-amdhsa-hcc -thread_warp_size=64", "conv2d_nchw.cuda", [["TENSOR", [128, 672, 11, 11], "float32"], ["TENSOR", [672, 672, 1, 1], "float32"], 1, 0, 1, "float32"], {}], "config": {"index": 460817, "code_hash": null, "entity": [["tile_f", "sp", [-1, 1, 12, 2]], ["tile_y", "sp", [-1, 1, 11, 1]], ["tile_x", "sp", [-1, 1, 1, 1]], ["tile_rc", "sp", [-1, 14]], ["tile_ry", "sp", [-1, 1]], ["tile_rx", "sp", [-1, 1]], ["auto_unroll_max_step", "ot", 512], ["unroll_explicit", "ot", 1]]}, "result": [[0.01903880683333333], 0, 1.7836699485778809, 1638697854.1007936], "version": 0.2, "tvm_version": "0.9.dev0"}
{"input": ["rocm -keys=rocm,gpu -max_num_threads=256 -mcpu=gfx906 -mtriple=amdgcn-amd-amdhsa-hcc -thread_warp_size=64", "conv2d_nchw.cuda", [["TENSOR", [128, 672, 11, 11], "float32"], ["TENSOR", [672, 672, 1, 1], "float32"], 1, 0, 1, "float32"], {}], "config": {"index": 503839, "code_hash": null, "entity": [["tile_f", "sp", [-1, 1, 16, 2]], ["tile_y", "sp", [-1, 1, 11, 1]], ["tile_x", "sp", [-1, 1, 1, 1]], ["tile_rc", "sp", [-1, 24]], ["tile_ry", "sp", [-1, 1]], ["tile_rx", "sp", [-1, 1]], ["auto_unroll_max_step", "ot", 512], ["unroll_explicit", "ot", 1]]}, "result": [[0.0177429415], 0, 1.8838956356048584, 1638697855.5445285], "version": 0.2, "tvm_version": "0.9.dev0"}
{"input": ["rocm -keys=rocm,gpu -max_num_threads=256 -mcpu=gfx906 -mtriple=amdgcn-amd-amdhsa-hcc -thread_warp_size=64", "conv2d_nchw.cuda", [["TENSOR", [128, 672, 11, 11], "float32"], ["TENSOR", [672, 672, 1, 1], "float32"], 1, 0, 1, "float32"], {}], "config": {"index": 159775, "code_hash": null, "entity": [["tile_f", "sp", [-1, 1, 16, 2]], ["tile_y", "sp", [-1, 1, 11, 1]], ["tile_x", "sp", [-1, 1, 1, 1]], ["tile_rc", "sp", [-1, 24]], ["tile_ry", "sp", [-1, 1]], ["tile_rx", "sp", [-1, 1]], ["auto_unroll_max_step", "ot", 0], ["unroll_explicit", "ot", 1]]}, "result": [[0.017723068166666665], 0, 1.865614891052246, 1638697856.9142976], "version": 0.2, "tvm_version": "0.9.dev0"}
{"input": ["rocm -keys=rocm,gpu -max_num_threads=256 -mcpu=gfx906 -mtriple=amdgcn-amd-amdhsa-hcc -thread_warp_size=64", "conv2d_nchw.cuda", [["TENSOR", [128, 672, 11, 11], "float32"], ["TENSOR", [672, 672, 1, 1], "float32"], 1, 0, 1, "float32"], {}], "config": {"index": 102597, "code_hash": null, "entity": [["tile_f", "sp", [-1, 1, 14, 4]], ["tile_y", "sp", [-1, 1, 11, 1]], ["tile_x", "sp", [-1, 1, 1, 1]], ["tile_rc", "sp", [-1, 12]], ["tile_ry", "sp", [-1, 1]], ["tile_rx", "sp", [-1, 1]], ["auto_unroll_max_step", "ot", 0], ["unroll_explicit", "ot", 1]]}, "result": [[0.016295756714285715], 0, 1.754002332687378, 1638697858.1966987], "version": 0.2, "tvm_version": "0.9.dev0"}
{"input": ["rocm -keys=rocm,gpu -max_num_threads=256 -mcpu=gfx906 -mtriple=amdgcn-amd-amdhsa-hcc -thread_warp_size=64", "conv2d_nchw.cuda", [["TENSOR", [128, 672, 11, 11], "float32"], ["TENSOR", [672, 672, 1, 1], "float32"], 1, 0, 1, "float32"], {}], "config": {"index": 446661, "code_hash": null, "entity": [["tile_f", "sp", [-1, 1, 14, 4]], ["tile_y", "sp", [-1, 1, 11, 1]], ["tile_x", "sp", [-1, 1, 1, 1]], ["tile_rc", "sp", [-1, 12]], ["tile_ry", "sp", [-1, 1]], ["tile_rx", "sp", [-1, 1]], ["auto_unroll_max_step", "ot", 512], ["unroll_explicit", "ot", 1]]}, "result": [[0.016286026000000002], 0, 1.9695096015930176, 1638697859.5826693], "version": 0.2, "tvm_version": "0.9.dev0"}
{"input": ["rocm -keys=rocm,gpu -max_num_threads=256 -mcpu=gfx906 -mtriple=amdgcn-amd-amdhsa-hcc -thread_warp_size=64", "conv2d_nchw.cuda", [["TENSOR", [128, 672, 11, 11], "float32"], ["TENSOR", [672, 672, 1, 1], "float32"], 1, 0, 1, "float32"], {}], "config": {"index": 494871, "code_hash": null, "entity": [["tile_f", "sp", [-1, 1, 14, 2]], ["tile_y", "sp", [-1, 1, 1, 1]], ["tile_x", "sp", [-1, 1, 11, 1]], ["tile_rc", "sp", [-1, 21]], ["tile_ry", "sp", [-1, 1]], ["tile_rx", "sp", [-1, 1]], ["auto_unroll_max_step", "ot", 512], ["unroll_explicit", "ot", 1]]}, "result": [[0.008110420153846155], 0, 1.7604022026062012, 1638697860.9281518], "version": 0.2, "tvm_version": "0.9.dev0"}
{"input": ["rocm -keys=rocm,gpu -max_num_threads=256 -mcpu=gfx906 -mtriple=amdgcn-amd-amdhsa-hcc -thread_warp_size=64", "conv2d_nchw.cuda", [["TENSOR", [128, 672, 11, 11], "float32"], ["TENSOR", [672, 672, 1, 1], "float32"], 1, 0, 1, "float32"], {}], "config": {"index": 150807, "code_hash": null, "entity": [["tile_f", "sp", [-1, 1, 14, 2]], ["tile_y", "sp", [-1, 1, 1, 1]], ["tile_x", "sp", [-1, 1, 11, 1]], ["tile_rc", "sp", [-1, 21]], ["tile_ry", "sp", [-1, 1]], ["tile_rx", "sp", [-1, 1]], ["auto_unroll_max_step", "ot", 0], ["unroll_explicit", "ot", 1]]}, "result": [[0.009570567727272728], 0, 1.918367862701416, 1638697862.3156219], "version": 0.2, "tvm_version": "0.9.dev0"}
{"input": ["rocm -keys=rocm,gpu -max_num_threads=256 -mcpu=gfx906 -mtriple=amdgcn-amd-amdhsa-hcc -thread_warp_size=64", "conv2d_nchw.cuda", [["TENSOR", [128, 672, 11, 11], "float32"], ["TENSOR", [672, 672, 1, 1], "float32"], 1, 0, 1, "float32"], {}], "config": {"index": 475159, "code_hash": null, "entity": [["tile_f", "sp", [-1, 1, 14, 2]], ["tile_y", "sp", [-1, 1, 11, 1]], ["tile_x", "sp", [-1, 1, 1, 1]], ["tile_rc", "sp", [-1, 16]], ["tile_ry", "sp", [-1, 1]], ["tile_rx", "sp", [-1, 1]], ["auto_unroll_max_step", "ot", 512], ["unroll_explicit", "ot", 1]]}, "result": [[0.011564365777777776], 0, 2.0435643196105957, 1638697863.888942], "version": 0.2, "tvm_version": "0.9.dev0"}
{"input": ["rocm -keys=rocm,gpu -max_num_threads=256 -mcpu=gfx906 -mtriple=amdgcn-amd-amdhsa-hcc -thread_warp_size=64", "conv2d_nchw.cuda", [["TENSOR", [128, 672, 11, 11], "float32"], ["TENSOR", [672, 672, 1, 1], "float32"], 1, 0, 1, "float32"], {}], "config": {"index": 131095, "code_hash": null, "entity": [["tile_f", "sp", [-1, 1, 14, 2]], ["tile_y", "sp", [-1, 1, 11, 1]], ["tile_x", "sp", [-1, 1, 1, 1]], ["tile_rc", "sp", [-1, 16]], ["tile_ry", "sp", [-1, 1]], ["tile_rx", "sp", [-1, 1]], ["auto_unroll_max_step", "ot", 0], ["unroll_explicit", "ot", 1]]}, "result": [[0.012499284444444446], 0, 1.866668462753296, 1638697865.441722], "version": 0.2, "tvm_version": "0.9.dev0"}
{"input": ["rocm -keys=rocm,gpu -max_num_threads=256 -mcpu=gfx906 -mtriple=amdgcn-amd-amdhsa-hcc -thread_warp_size=64", "conv2d_nchw.cuda", [["TENSOR", [128, 672, 11, 11], "float32"], ["TENSOR", [672, 672, 1, 1], "float32"], 1, 0, 1, "float32"], {}], "config": {"index": 475246, "code_hash": null, "entity": [["tile_f", "sp", [-1, 1, 14, 3]], ["tile_y", "sp", [-1, 1, 11, 1]], ["tile_x", "sp", [-1, 1, 1, 1]], ["tile_rc", "sp", [-1, 16]], ["tile_ry", "sp", [-1, 1]], ["tile_rx", "sp", [-1, 1]], ["auto_unroll_max_step", "ot", 512], ["unroll_explicit", "ot", 1]]}, "result": [[0.011869780555555555], 0, 2.062248945236206, 1638697867.008566], "version": 0.2, "tvm_version": "0.9.dev0"}
{"input": ["rocm -keys=rocm,gpu -max_num_threads=256 -mcpu=gfx906 -mtriple=amdgcn-amd-amdhsa-hcc -thread_warp_size=64", "conv2d_nchw.cuda", [["TENSOR", [128, 672, 11, 11], "float32"], ["TENSOR", [672, 672, 1, 1], "float32"], 1, 0, 1, "float32"], {}], "config": {"index": 131182, "code_hash": null, "entity": [["tile_f", "sp", [-1, 1, 14, 3]], ["tile_y", "sp", [-1, 1, 11, 1]], ["tile_x", "sp", [-1, 1, 1, 1]], ["tile_rc", "sp", [-1, 16]], ["tile_ry", "sp", [-1, 1]], ["tile_rx", "sp", [-1, 1]], ["auto_unroll_max_step", "ot", 0], ["unroll_explicit", "ot", 1]]}, "result": [[0.011772239666666667], 0, 1.8540351390838623, 1638697868.3395455], "version": 0.2, "tvm_version": "0.9.dev0"}
{"input": ["rocm -keys=rocm,gpu -max_num_threads=256 -mcpu=gfx906 -mtriple=amdgcn-amd-amdhsa-hcc -thread_warp_size=64", "conv2d_nchw.cuda", [["TENSOR", [128, 672, 11, 11], "float32"], ["TENSOR", [672, 672, 1, 1], "float32"], 1, 0, 1, "float32"], {}], "config": {"index": 446495, "code_hash": null, "entity": [["tile_f", "sp", [-1, 1, 16, 2]], ["tile_y", "sp", [-1, 1, 11, 1]], ["tile_x", "sp", [-1, 1, 1, 1]], ["tile_rc", "sp", [-1, 12]], ["tile_ry", "sp", [-1, 1]], ["tile_rx", "sp", [-1, 1]], ["auto_unroll_max_step", "ot", 512], ["unroll_explicit", "ot", 1]]}, "result": [[0.014363770571428573], 0, 1.6567051410675049, 1638697869.711276], "version": 0.2, "tvm_version": "0.9.dev0"}
{"input": ["rocm -keys=rocm,gpu -max_num_threads=256 -mcpu=gfx906 -mtriple=amdgcn-amd-amdhsa-hcc -thread_warp_size=64", "conv2d_nchw.cuda", [["TENSOR", [128, 672, 11, 11], "float32"], ["TENSOR", [672, 672, 1, 1], "float32"], 1, 0, 1, "float32"], {}], "config": {"index": 102431, "code_hash": null, "entity": [["tile_f", "sp", [-1, 1, 16, 2]], ["tile_y", "sp", [-1, 1, 11, 1]], ["tile_x", "sp", [-1, 1, 1, 1]], ["tile_rc", "sp", [-1, 12]], ["tile_ry", "sp", [-1, 1]], ["tile_rx", "sp", [-1, 1]], ["auto_unroll_max_step", "ot", 0], ["unroll_explicit", "ot", 1]]}, "result": [[0.014375821714285714], 0, 1.7369647026062012, 1638697871.0475924], "version": 0.2, "tvm_version": "0.9.dev0"}
{"input": ["rocm -keys=rocm,gpu -max_num_threads=256 -mcpu=gfx906 -mtriple=amdgcn-amd-amdhsa-hcc -thread_warp_size=64", "conv2d_nchw.cuda", [["TENSOR", [128, 672, 11, 11], "float32"], ["TENSOR", [672, 672, 1, 1], "float32"], 1, 0, 1, "float32"], {}], "config": {"index": 102654, "code_hash": null, "entity": [["tile_f", "sp", [-1, 1, 14, 6]], ["tile_y", "sp", [-1, 1, 11, 1]], ["tile_x", "sp", [-1, 1, 1, 1]], ["tile_rc", "sp", [-1, 12]], ["tile_ry", "sp", [-1, 1]], ["tile_rx", "sp", [-1, 1]], ["auto_unroll_max_step", "ot", 0], ["unroll_explicit", "ot", 1]]}, "result": [[0.019521787000000002], 0, 2.021000623703003, 1638697872.5416424], "version": 0.2, "tvm_version": "0.9.dev0"}
{"input": ["rocm -keys=rocm,gpu -max_num_threads=256 -mcpu=gfx906 -mtriple=amdgcn-amd-amdhsa-hcc -thread_warp_size=64", "conv2d_nchw.cuda", [["TENSOR", [128, 672, 11, 11], "float32"], ["TENSOR", [672, 672, 1, 1], "float32"], 1, 0, 1, "float32"], {}], "config": {"index": 446718, "code_hash": null, "entity": [["tile_f", "sp", [-1, 1, 14, 6]], ["tile_y", "sp", [-1, 1, 11, 1]], ["tile_x", "sp", [-1, 1, 1, 1]], ["tile_rc", "sp", [-1, 12]], ["tile_ry", "sp", [-1, 1]], ["tile_rx", "sp", [-1, 1]], ["auto_unroll_max_step", "ot", 512], ["unroll_explicit", "ot", 1]]}, "result": [[0.01716783], 0, 1.9592480659484863, 1638697873.9717543], "version": 0.2, "tvm_version": "0.9.dev0"}
{"input": ["rocm -keys=rocm,gpu -max_num_threads=256 -mcpu=gfx906 -mtriple=amdgcn-amd-amdhsa-hcc -thread_warp_size=64", "conv2d_nchw.cuda", [["TENSOR", [128, 672, 11, 11], "float32"], ["TENSOR", [672, 672, 1, 1], "float32"], 1, 0, 1, "float32"], {}], "config": {"index": 116767, "code_hash": null, "entity": [["tile_f", "sp", [-1, 1, 16, 2]], ["tile_y", "sp", [-1, 1, 11, 1]], ["tile_x", "sp", [-1, 1, 1, 1]], ["tile_rc", "sp", [-1, 14]], ["tile_ry", "sp", [-1, 1]], ["tile_rx", "sp", [-1, 1]], ["auto_unroll_max_step", "ot", 0], ["unroll_explicit", "ot", 1]]}, "result": [[0.013936204875], 0, 1.7155885696411133, 1638697875.3080559], "version": 0.2, "tvm_version": "0.9.dev0"}
{"input": ["rocm -keys=rocm,gpu -max_num_threads=256 -mcpu=gfx906 -mtriple=amdgcn-amd-amdhsa-hcc -thread_warp_size=64", "conv2d_nchw.cuda", [["TENSOR", [128, 672, 11, 11], "float32"], ["TENSOR", [672, 672, 1, 1], "float32"], 1, 0, 1, "float32"], {}], "config": {"index": 460831, "code_hash": null, "entity": [["tile_f", "sp", [-1, 1, 16, 2]], ["tile_y", "sp", [-1, 1, 11, 1]], ["tile_x", "sp", [-1, 1, 1, 1]], ["tile_rc", "sp", [-1, 14]], ["tile_ry", "sp", [-1, 1]], ["tile_rx", "sp", [-1, 1]], ["auto_unroll_max_step", "ot", 512], ["unroll_explicit", "ot", 1]]}, "result": [[0.014028554875], 0, 1.6207702159881592, 1638697876.5853739], "version": 0.2, "tvm_version": "0.9.dev0"}
{"input": ["rocm -keys=rocm,gpu -max_num_threads=256 -mcpu=gfx906 -mtriple=amdgcn-amd-amdhsa-hcc -thread_warp_size=64", "conv2d_nchw.cuda", [["TENSOR", [128, 672, 11, 11], "float32"], ["TENSOR", [672, 672, 1, 1], "float32"], 1, 0, 1, "float32"], {}], "config": {"index": 790551, "code_hash": null, "entity": [["tile_f", "sp", [-1, 1, 14, 2]], ["tile_y", "sp", [-1, 1, 11, 1]], ["tile_x", "sp", [-1, 1, 1, 1]], ["tile_rc", "sp", [-1, 12]], ["tile_ry", "sp", [-1, 1]], ["tile_rx", "sp", [-1, 1]], ["auto_unroll_max_step", "ot", 1500], ["unroll_explicit", "ot", 1]]}, "result": [[0.01517832942857143], 0, 1.7545559406280518, 1638697877.9011605], "version": 0.2, "tvm_version": "0.9.dev0"}
{"input": ["rocm -keys=rocm,gpu -max_num_threads=256 -mcpu=gfx906 -mtriple=amdgcn-amd-amdhsa-hcc -thread_warp_size=64", "conv2d_nchw.cuda", [["TENSOR", [128, 672, 11, 11], "float32"], ["TENSOR", [672, 672, 1, 1], "float32"], 1, 0, 1, "float32"], {}], "config": {"index": 102515, "code_hash": null, "entity": [["tile_f", "sp", [-1, 1, 16, 3]], ["tile_y", "sp", [-1, 1, 11, 1]], ["tile_x", "sp", [-1, 1, 1, 1]], ["tile_rc", "sp", [-1, 12]], ["tile_ry", "sp", [-1, 1]], ["tile_rx", "sp", [-1, 1]], ["auto_unroll_max_step", "ot", 0], ["unroll_explicit", "ot", 1]]}, "result": [[0.015704471], 0, 1.7665717601776123, 1638697879.322922], "version": 0.2, "tvm_version": "0.9.dev0"}
{"input": ["rocm -keys=rocm,gpu -max_num_threads=256 -mcpu=gfx906 -mtriple=amdgcn-amd-amdhsa-hcc -thread_warp_size=64", "conv2d_nchw.cuda", [["TENSOR", [128, 672, 11, 11], "float32"], ["TENSOR", [672, 672, 1, 1], "float32"], 1, 0, 1, "float32"], {}], "config": {"index": 446579, "code_hash": null, "entity": [["tile_f", "sp", [-1, 1, 16, 3]], ["tile_y", "sp", [-1, 1, 11, 1]], ["tile_x", "sp", [-1, 1, 1, 1]], ["tile_rc", "sp", [-1, 12]], ["tile_ry", "sp", [-1, 1]], ["tile_rx", "sp", [-1, 1]], ["auto_unroll_max_step", "ot", 512], ["unroll_explicit", "ot", 1]]}, "result": [[0.015659931714285712], 0, 1.5864577293395996, 1638697880.5706356], "version": 0.2, "tvm_version": "0.9.dev0"}
{"input": ["rocm -keys=rocm,gpu -max_num_threads=256 -mcpu=gfx906 -mtriple=amdgcn-amd-amdhsa-hcc -thread_warp_size=64", "conv2d_nchw.cuda", [["TENSOR", [128, 672, 11, 11], "float32"], ["TENSOR", [672, 672, 1, 1], "float32"], 1, 0, 1, "float32"], {}], "config": {"index": 150801, "code_hash": null, "entity": [["tile_f", "sp", [-1, 1, 12, 2]], ["tile_y", "sp", [-1, 1, 1, 1]], ["tile_x", "sp", [-1, 1, 11, 1]], ["tile_rc", "sp", [-1, 21]], ["tile_ry", "sp", [-1, 1]], ["tile_rx", "sp", [-1, 1]], ["auto_unroll_max_step", "ot", 0], ["unroll_explicit", "ot", 1]]}, "result": [[0.009298485454545454], 0, 1.7871577739715576, 1638697881.8956714], "version": 0.2, "tvm_version": "0.9.dev0"}
{"input": ["rocm -keys=rocm,gpu -max_num_threads=256 -mcpu=gfx906 -mtriple=amdgcn-amd-amdhsa-hcc -thread_warp_size=64", "conv2d_nchw.cuda", [["TENSOR", [128, 672, 11, 11], "float32"], ["TENSOR", [672, 672, 1, 1], "float32"], 1, 0, 1, "float32"], {}], "config": {"index": 494865, "code_hash": null, "entity": [["tile_f", "sp", [-1, 1, 12, 2]], ["tile_y", "sp", [-1, 1, 1, 1]], ["tile_x", "sp", [-1, 1, 11, 1]], ["tile_rc", "sp", [-1, 21]], ["tile_ry", "sp", [-1, 1]], ["tile_rx", "sp", [-1, 1]], ["auto_unroll_max_step", "ot", 512], ["unroll_explicit", "ot", 1]]}, "result": [[0.007581311857142858], 0, 1.7375879287719727, 1638697883.1776702], "version": 0.2, "tvm_version": "0.9.dev0"}
{"input": ["rocm -keys=rocm,gpu -max_num_threads=256 -mcpu=gfx906 -mtriple=amdgcn-amd-amdhsa-hcc -thread_warp_size=64", "conv2d_nchw.cuda", [["TENSOR", [128, 672, 11, 11], "float32"], ["TENSOR", [672, 672, 1, 1], "float32"], 1, 0, 1, "float32"], {}], "config": {"index": 446574, "code_hash": null, "entity": [["tile_f", "sp", [-1, 1, 14, 3]], ["tile_y", "sp", [-1, 1, 11, 1]], ["tile_x", "sp", [-1, 1, 1, 1]], ["tile_rc", "sp", [-1, 12]], ["tile_ry", "sp", [-1, 1]], ["tile_rx", "sp", [-1, 1]], ["auto_unroll_max_step", "ot", 512], ["unroll_explicit", "ot", 1]]}, "result": [[0.015907757285714287], 0, 1.912886142730713, 1638697884.597438], "version": 0.2, "tvm_version": "0.9.dev0"}
{"input": ["rocm -keys=rocm,gpu -max_num_threads=256 -mcpu=gfx906 -mtriple=amdgcn-amd-amdhsa-hcc -thread_warp_size=64", "conv2d_nchw.cuda", [["TENSOR", [128, 672, 11, 11], "float32"], ["TENSOR", [672, 672, 1, 1], "float32"], 1, 0, 1, "float32"], {}], "config": {"index": 102510, "code_hash": null, "entity": [["tile_f", "sp", [-1, 1, 14, 3]], ["tile_y", "sp", [-1, 1, 11, 1]], ["tile_x", "sp", [-1, 1, 1, 1]], ["tile_rc", "sp", [-1, 12]], ["tile_ry", "sp", [-1, 1]], ["tile_rx", "sp", [-1, 1]], ["auto_unroll_max_step", "ot", 0], ["unroll_explicit", "ot", 1]]}, "result": [[0.015862701285714285], 0, 1.8284103870391846, 1638697886.013194], "version": 0.2, "tvm_version": "0.9.dev0"}
{"input": ["rocm -keys=rocm,gpu -max_num_threads=256 -mcpu=gfx906 -mtriple=amdgcn-amd-amdhsa-hcc -thread_warp_size=64", "conv2d_nchw.cuda", [["TENSOR", [128, 672, 11, 11], "float32"], ["TENSOR", [672, 672, 1, 1], "float32"], 1, 0, 1, "float32"], {}], "config": {"index": 88257, "code_hash": null, "entity": [["tile_f", "sp", [-1, 1, 12, 4]], ["tile_y", "sp", [-1, 1, 11, 1]], ["tile_x", "sp", [-1, 1, 1, 1]], ["tile_rc", "sp", [-1, 8]], ["tile_ry", "sp", [-1, 1]], ["tile_rx", "sp", [-1, 1]], ["auto_unroll_max_step", "ot", 0], ["unroll_explicit", "ot", 1]]}, "result": [[0.0106875175], 0, 1.7176635265350342, 1638697887.411195], "version": 0.2, "tvm_version": "0.9.dev0"}
{"input": ["rocm -keys=rocm,gpu -max_num_threads=256 -mcpu=gfx906 -mtriple=amdgcn-amd-amdhsa-hcc -thread_warp_size=64", "conv2d_nchw.cuda", [["TENSOR", [128, 672, 11, 11], "float32"], ["TENSOR", [672, 672, 1, 1], "float32"], 1, 0, 1, "float32"], {}], "config": {"index": 432321, "code_hash": null, "entity": [["tile_f", "sp", [-1, 1, 12, 4]], ["tile_y", "sp", [-1, 1, 11, 1]], ["tile_x", "sp", [-1, 1, 1, 1]], ["tile_rc", "sp", [-1, 8]], ["tile_ry", "sp", [-1, 1]], ["tile_rx", "sp", [-1, 1]], ["auto_unroll_max_step", "ot", 512], ["unroll_explicit", "ot", 1]]}, "result": [[0.009410287272727273], 0, 1.84381103515625, 1638697888.7891219], "version": 0.2, "tvm_version": "0.9.dev0"}
{"input": ["rocm -keys=rocm,gpu -max_num_threads=256 -mcpu=gfx906 -mtriple=amdgcn-amd-amdhsa-hcc -thread_warp_size=64", "conv2d_nchw.cuda", [["TENSOR", [128, 672, 11, 11], "float32"], ["TENSOR", [672, 672, 1, 1], "float32"], 1, 0, 1, "float32"], {}], "config": {"index": 107793, "code_hash": null, "entity": [["tile_f", "sp", [-1, 1, 12, 2]], ["tile_y", "sp", [-1, 1, 1, 1]], ["tile_x", "sp", [-1, 1, 11, 1]], ["tile_rc", "sp", [-1, 12]], ["tile_ry", "sp", [-1, 1]], ["tile_rx", "sp", [-1, 1]], ["auto_unroll_max_step", "ot", 0], ["unroll_explicit", "ot", 1]]}, "result": [[0.007904294142857144], 0, 1.8545947074890137, 1638697890.1952033], "version": 0.2, "tvm_version": "0.9.dev0"}
