artifacts/Table4/tvm/autotvm/conv/conv2d_128_1024_14_14_2048_1_1_2_0.log
{"input": ["rocm -keys=rocm,gpu -max_num_threads=256 -mcpu=gfx906 -mtriple=amdgcn-amd-amdhsa-hcc -thread_warp_size=64", "conv2d_nchw.cuda", [["TENSOR", [128, 1024, 14, 14], "float32"], ["TENSOR", [2048, 1024, 1, 1], "float32"], 2, 0, 1, "float32"], {}], "config": {"index": 138793, "code_hash": null, "entity": [["tile_f", "sp", [-1, 2, 8, 2]], ["tile_y", "sp", [-1, 7, 1, 1]], ["tile_x", "sp", [-1, 1, 1, 7]], ["tile_rc", "sp", [-1, 2]], ["tile_ry", "sp", [-1, 1]], ["tile_rx", "sp", [-1, 1]], ["auto_unroll_max_step", "ot", 1500], ["unroll_explicit", "ot", 1]]}, "result": [[0.92262890625], 0, 8.985074996948242, 1638701014.2919855], "version": 0.2, "tvm_version": "0.9.dev0"}
{"input": ["rocm -keys=rocm,gpu -max_num_threads=256 -mcpu=gfx906 -mtriple=amdgcn-amd-amdhsa-hcc -thread_warp_size=64", "conv2d_nchw.cuda", [["TENSOR", [128, 1024, 14, 14], "float32"], ["TENSOR", [2048, 1024, 1, 1], "float32"], 2, 0, 1, "float32"], {}], "config": {"index": 130952, "code_hash": null, "entity": [["tile_f", "sp", [-1, 4, 32, 16]], ["tile_y", "sp", [-1, 1, 1, 7]], ["tile_x", "sp", [-1, 7, 1, 1]], ["tile_rc", "sp", [-1, 1]], ["tile_ry", "sp", [-1, 1]], ["tile_rx", "sp", [-1, 1]], ["auto_unroll_max_step", "ot", 1500], ["unroll_explicit", "ot", 1]]}, "result": [[0.8231556395], 0, 9.693647384643555, 1638701020.1997278], "version": 0.2, "tvm_version": "0.9.dev0"}
{"input": ["rocm -keys=rocm,gpu -max_num_threads=256 -mcpu=gfx906 -mtriple=amdgcn-amd-amdhsa-hcc -thread_warp_size=64", "conv2d_nchw.cuda", [["TENSOR", [128, 1024, 14, 14], "float32"], ["TENSOR", [2048, 1024, 1, 1], "float32"], 2, 0, 1, "float32"], {}], "config": {"index": 36791, "code_hash": null, "entity": [["tile_f", "sp", [-1, 16, 4, 1]], ["tile_y", "sp", [-1, 7, 1, 1]], ["tile_x", "sp", [-1, 7, 1, 1]], ["tile_rc", "sp", [-1, 64]], ["tile_ry", "sp", [-1, 1]], ["tile_rx", "sp", [-1, 1]], ["auto_unroll_max_step", "ot", 0], ["unroll_explicit", "ot", 1]]}, "result": [[6.8990253905], 0, 43.877787828445435, 1638701056.4452722], "version": 0.2, "tvm_version": "0.9.dev0"}
{"input": ["rocm -keys=rocm,gpu -max_num_threads=256 -mcpu=gfx906 -mtriple=amdgcn-amd-amdhsa-hcc -thread_warp_size=64", "conv2d_nchw.cuda", [["TENSOR", [128, 1024, 14, 14], "float32"], ["TENSOR", [2048, 1024, 1, 1], "float32"], 2, 0, 1, "float32"], {}], "config": {"index": 14799, "code_hash": null, "entity": [["tile_f", "sp", [-1, 2, 64, 8]], ["tile_y", "sp", [-1, 1, 1, 1]], ["tile_x", "sp", [-1, 1, 7, 1]], ["tile_rc", "sp", [-1, 4]], ["tile_ry", "sp", [-1, 1]], ["tile_rx", "sp", [-1, 1]], ["auto_unroll_max_step", "ot", 0], ["unroll_explicit", "ot", 1]]}, "result": [[0.22178587325000002], 0, 3.4663727283477783, 1638701059.296392], "version": 0.2, "tvm_version": "0.9.dev0"}
{"input": ["rocm -keys=rocm,gpu -max_num_threads=256 -mcpu=gfx906 -mtriple=amdgcn-amd-amdhsa-hcc -thread_warp_size=64", "conv2d_nchw.cuda", [["TENSOR", [128, 1024, 14, 14], "float32"], ["TENSOR", [2048, 1024, 1, 1], "float32"], 2, 0, 1, "float32"], {}], "config": {"index": 28865, "code_hash": null, "entity": [["tile_f", "sp", [-1, 2, 8, 2]], ["tile_y", "sp", [-1, 1, 1, 7]], ["tile_x", "sp", [-1, 1, 1, 7]], ["tile_rc", "sp", [-1, 16]], ["tile_ry", "sp", [-1, 1]], ["tile_rx", "sp", [-1, 1]], ["auto_unroll_max_step", "ot", 0], ["unroll_explicit", "ot", 1]]}, "result": [[3.003661621], 0, 18.291409015655518, 1638701075.9094253], "version": 0.2, "tvm_version": "0.9.dev0"}
{"input": ["rocm -keys=rocm,gpu -max_num_threads=256 -mcpu=gfx906 -mtriple=amdgcn-amd-amdhsa-hcc -thread_warp_size=64", "conv2d_nchw.cuda", [["TENSOR", [128, 1024, 14, 14], "float32"], ["TENSOR", [2048, 1024, 1, 1], "float32"], 2, 0, 1, "float32"], {}], "config": {"index": 104313, "code_hash": null, "entity": [["tile_f", "sp", [-1, 2, 2, 8]], ["tile_y", "sp", [-1, 1, 7, 1]], ["tile_x", "sp", [-1, 1, 1, 7]], ["tile_rc", "sp", [-1, 64]], ["tile_ry", "sp", [-1, 1]], ["tile_rx", "sp", [-1, 1]], ["auto_unroll_max_step", "ot", 512], ["unroll_explicit", "ot", 1]]}, "result": [[8.703765625], 0, 47.237316846847534, 1638701121.10003], "version": 0.2, "tvm_version": "0.9.dev0"}
{"input": ["rocm -keys=rocm,gpu -max_num_threads=256 -mcpu=gfx906 -mtriple=amdgcn-amd-amdhsa-hcc -thread_warp_size=64", "conv2d_nchw.cuda", [["TENSOR", [128, 1024, 14, 14], "float32"], ["TENSOR", [2048, 1024, 1, 1], "float32"], 2, 0, 1, "float32"], {}], "config": {"index": 2272, "code_hash": null, "entity": [["tile_f", "sp", [-1, 1024, 1, 2]], ["tile_y", "sp", [-1, 1, 7, 1]], ["tile_x", "sp", [-1, 7, 1, 1]], ["tile_rc", "sp", [-1, 1]], ["tile_ry", "sp", [-1, 1]], ["tile_rx", "sp", [-1, 1]], ["auto_unroll_max_step", "ot", 0], ["unroll_explicit", "ot", 1]]}, "result": [[4.38745654275], 0, 25.816923141479492, 1638701145.0772734], "version": 0.2, "tvm_version": "0.9.dev0"}
{"input": ["rocm -keys=rocm,gpu -max_num_threads=256 -mcpu=gfx906 -mtriple=amdgcn-amd-amdhsa-hcc -thread_warp_size=64", "conv2d_nchw.cuda", [["TENSOR", [128, 1024, 14, 14], "float32"], ["TENSOR", [2048, 1024, 1, 1], "float32"], 2, 0, 1, "float32"], {}], "config": {"index": 22986, "code_hash": null, "entity": [["tile_f", "sp", [-1, 16, 32, 1]], ["tile_y", "sp", [-1, 1, 1, 7]], ["tile_x", "sp", [-1, 1, 1, 7]], ["tile_rc", "sp", [-1, 8]], ["tile_ry", "sp", [-1, 1]], ["tile_rx", "sp", [-1, 1]], ["auto_unroll_max_step", "ot", 0], ["unroll_explicit", "ot", 1]]}, "result": [[1.3008092039999999], 0, 9.864084959030151, 1638701153.2165642], "version": 0.2, "tvm_version": "0.9.dev0"}
{"input": ["rocm -keys=rocm,gpu -max_num_threads=256 -mcpu=gfx906 -mtriple=amdgcn-amd-amdhsa-hcc -thread_warp_size=64", "conv2d_nchw.cuda", [["TENSOR", [128, 1024, 14, 14], "float32"], ["TENSOR", [2048, 1024, 1, 1], "float32"], 2, 0, 1, "float32"], {}], "config": {"index": 712, "code_hash": null, "entity": [["tile_f", "sp", [-1, 1, 2, 256]], ["tile_y", "sp", [-1, 7, 1, 1]], ["tile_x", "sp", [-1, 1, 1, 1]], ["tile_rc", "sp", [-1, 1]], ["tile_ry", "sp", [-1, 1]], ["tile_rx", "sp", [-1, 1]], ["auto_unroll_max_step", "ot", 0], ["unroll_explicit", "ot", 1]]}, "result": [[3.3415187987499997], 0, 18.84471893310547, 1638701171.5425758], "version": 0.2, "tvm_version": "0.9.dev0"}
{"input": ["rocm -keys=rocm,gpu -max_num_threads=256 -mcpu=gfx906 -mtriple=amdgcn-amd-amdhsa-hcc -thread_warp_size=64", "conv2d_nchw.cuda", [["TENSOR", [128, 1024, 14, 14], "float32"], ["TENSOR", [2048, 1024, 1, 1], "float32"], 2, 0, 1, "float32"], {}], "config": {"index": 69376, "code_hash": null, "entity": [["tile_f", "sp", [-1, 1, 4, 8]], ["tile_y", "sp", [-1, 1, 7, 1]], ["tile_x", "sp", [-1, 1, 1, 7]], ["tile_rc", "sp", [-1, 1]], ["tile_ry", "sp", [-1, 1]], ["tile_rx", "sp", [-1, 1]], ["auto_unroll_max_step", "ot", 512], ["unroll_explicit", "ot", 1]]}, "result": [[0.25305403125000003], 0, 3.7754058837890625, 1638701174.908122], "version": 0.2, "tvm_version": "0.9.dev0"}
{"input": ["rocm -keys=rocm,gpu -max_num_threads=256 -mcpu=gfx906 -mtriple=amdgcn-amd-amdhsa-hcc -thread_warp_size=64", "conv2d_nchw.cuda", [["TENSOR", [128, 1024, 14, 14], "float32"], ["TENSOR", [2048, 1024, 1, 1], "float32"], 2, 0, 1, "float32"], {}], "config": {"index": 11891, "code_hash": null, "entity": [["tile_f", "sp", [-1, 1, 256, 8]], ["tile_y", "sp", [-1, 1, 1, 1]], ["tile_x", "sp", [-1, 1, 1, 1]], ["tile_rc", "sp", [-1, 4]], ["tile_ry", "sp", [-1, 1]], ["tile_rx", "sp", [-1, 1]], ["auto_unroll_max_step", "ot", 0], ["unroll_explicit", "ot", 1]]}, "result": [[0.46856301875], 0, 4.6849164962768555, 1638701179.2439458], "version": 0.2, "tvm_version": "0.9.dev0"}
{"input": ["rocm -keys=rocm,gpu -max_num_threads=256 -mcpu=gfx906 -mtriple=amdgcn-amd-amdhsa-hcc -thread_warp_size=64", "conv2d_nchw.cuda", [["TENSOR", [128, 1024, 14, 14], "float32"], ["TENSOR", [2048, 1024, 1, 1], "float32"], 2, 0, 1, "float32"], {}], "config": {"index": 80755, "code_hash": null, "entity": [["tile_f", "sp", [-1, 8, 1, 64]], ["tile_y", "sp", [-1, 7, 1, 1]], ["tile_x", "sp", [-1, 1, 1, 7]], ["tile_rc", "sp", [-1, 4]], ["tile_ry", "sp", [-1, 1]], ["tile_rx", "sp", [-1, 1]], ["auto_unroll_max_step", "ot", 512], ["unroll_explicit", "ot", 1]]}, "result": [[11.1306904295], 0, 63.649683475494385, 1638701237.0374575], "version": 0.2, "tvm_version": "0.9.dev0"}
{"input": ["rocm -keys=rocm,gpu -max_num_threads=256 -mcpu=gfx906 -mtriple=amdgcn-amd-amdhsa-hcc -thread_warp_size=64", "conv2d_nchw.cuda", [["TENSOR", [128, 1024, 14, 14], "float32"], ["TENSOR", [2048, 1024, 1, 1], "float32"], 2, 0, 1, "float32"], {}], "config": {"index": 88387, "code_hash": null, "entity": [["tile_f", "sp", [-1, 2, 8, 32]], ["tile_y", "sp", [-1, 1, 7, 1]], ["tile_x", "sp", [-1, 1, 1, 1]], ["tile_rc", "sp", [-1, 16]], ["tile_ry", "sp", [-1, 1]], ["tile_rx", "sp", [-1, 1]], ["auto_unroll_max_step", "ot", 512], ["unroll_explicit", "ot", 1]]}, "result": [[2.835024658], 0, 18.092161417007446, 1638701253.3310652], "version": 0.2, "tvm_version": "0.9.dev0"}
{"input": ["rocm -keys=rocm,gpu -max_num_threads=256 -mcpu=gfx906 -mtriple=amdgcn-amd-amdhsa-hcc -thread_warp_size=64", "conv2d_nchw.cuda", [["TENSOR", [128, 1024, 14, 14], "float32"], ["TENSOR", [2048, 1024, 1, 1], "float32"], 2, 0, 1, "float32"], {}], "config": {"index": 142632, "code_hash": null, "entity": [["tile_f", "sp", [-1, 1, 1, 64]], ["tile_y", "sp", [-1, 1, 1, 7]], ["tile_x", "sp", [-1, 7, 1, 1]], ["tile_rc", "sp", [-1, 4]], ["tile_ry", "sp", [-1, 1]], ["tile_rx", "sp", [-1, 1]], ["auto_unroll_max_step", "ot", 1500], ["unroll_explicit", "ot", 1]]}, "result": [[6.987499023250001], 0, 39.413190841674805, 1638701290.2691252], "version": 0.2, "tvm_version": "0.9.dev0"}
{"input": ["rocm -keys=rocm,gpu -max_num_threads=256 -mcpu=gfx906 -mtriple=amdgcn-amd-amdhsa-hcc -thread_warp_size=64", "conv2d_nchw.cuda", [["TENSOR", [128, 1024, 14, 14], "float32"], ["TENSOR", [2048, 1024, 1, 1], "float32"], 2, 0, 1, "float32"], {}], "config": {"index": 7769, "code_hash": null, "entity": [["tile_f", "sp", [-1, 4, 32, 2]], ["tile_y", "sp", [-1, 7, 1, 1]], ["tile_x", "sp", [-1, 7, 1, 1]], ["tile_rc", "sp", [-1, 2]], ["tile_ry", "sp", [-1, 1]], ["tile_rx", "sp", [-1, 1]], ["auto_unroll_max_step", "ot", 0], ["unroll_explicit", "ot", 1]]}, "result": [[0.3192971495], 0, 5.686996221542358, 1638701293.468552], "version": 0.2, "tvm_version": "0.9.dev0"}
{"input": ["rocm -keys=rocm,gpu -max_num_threads=256 -mcpu=gfx906 -mtriple=amdgcn-amd-amdhsa-hcc -thread_warp_size=64", "conv2d_nchw.cuda", [["TENSOR", [128, 1024, 14, 14], "float32"], ["TENSOR", [2048, 1024, 1, 1], "float32"], 2, 0, 1, "float32"], {}], "config": {"index": 130986, "code_hash": null, "entity": [["tile_f", "sp", [-1, 4, 1, 64]], ["tile_y", "sp", [-1, 1, 1, 7]], ["tile_x", "sp", [-1, 7, 1, 1]], ["tile_rc", "sp", [-1, 1]], ["tile_ry", "sp", [-1, 1]], ["tile_rx", "sp", [-1, 1]], ["auto_unroll_max_step", "ot", 1500], ["unroll_explicit", "ot", 1]]}, "result": [[7.76321484375], 0, 44.383914947509766, 1638701333.8971798], "version": 0.2, "tvm_version": "0.9.dev0"}
{"input": ["rocm -keys=rocm,gpu -max_num_threads=256 -mcpu=gfx906 -mtriple=amdgcn-amd-amdhsa-hcc -thread_warp_size=64", "conv2d_nchw.cuda", [["TENSOR", [128, 1024, 14, 14], "float32"], ["TENSOR", [2048, 1024, 1, 1], "float32"], 2, 0, 1, "float32"], {}], "config": {"index": 21071, "code_hash": null, "entity": [["tile_f", "sp", [-1, 1, 8, 64]], ["tile_y", "sp", [-1, 7, 1, 1]], ["tile_x", "sp", [-1, 1, 7, 1]], ["tile_rc", "sp", [-1, 8]], ["tile_ry", "sp", [-1, 1]], ["tile_rx", "sp", [-1, 1]], ["auto_unroll_max_step", "ot", 0], ["unroll_explicit", "ot", 1]]}, "result": [[0.46219320675], 0, 4.412166595458984, 1638701548.3947396], "version": 0.2, "tvm_version": "0.9.dev0"}
{"input": ["rocm -keys=rocm,gpu -max_num_threads=256 -mcpu=gfx906 -mtriple=amdgcn-amd-amdhsa-hcc -thread_warp_size=64", "conv2d_nchw.cuda", [["TENSOR", [128, 1024, 14, 14], "float32"], ["TENSOR", [2048, 1024, 1, 1], "float32"], 2, 0, 1, "float32"], {}], "config": {"index": 157821, "code_hash": null, "entity": [["tile_f", "sp", [-1, 2, 2, 8]], ["tile_y", "sp", [-1, 7, 1, 1]], ["tile_x", "sp", [-1, 1, 1, 1]], ["tile_rc", "sp", [-1, 32]], ["tile_ry", "sp", [-1, 1]], ["tile_rx", "sp", [-1, 1]], ["auto_unroll_max_step", "ot", 1500], ["unroll_explicit", "ot", 1]]}, "result": [[14.562756835750001], 0, 76.2190580368042, 1638701623.0265853], "version": 0.2, "tvm_version": "0.9.dev0"}
{"input": ["rocm -keys=rocm,gpu -max_num_threads=256 -mcpu=gfx906 -mtriple=amdgcn-amd-amdhsa-hcc -thread_warp_size=64", "conv2d_nchw.cuda", [["TENSOR", [128, 1024, 14, 14], "float32"], ["TENSOR", [2048, 1024, 1, 1], "float32"], 2, 0, 1, "float32"], {}], "config": {"index": 1535, "code_hash": null, "entity": [["tile_f", "sp", [-1, 2, 1, 2]], ["tile_y", "sp", [-1, 1, 1, 1]], ["tile_x", "sp", [-1, 7, 1, 1]], ["tile_rc", "sp", [-1, 1]], ["tile_ry", "sp", [-1, 1]], ["tile_rx", "sp", [-1, 1]], ["auto_unroll_max_step", "ot", 0], ["unroll_explicit", "ot", 1]]}, "result": [[0.3338282775], 0, 3.8547885417938232, 1638701626.7482173], "version": 0.2, "tvm_version": "0.9.dev0"}
{"input": ["rocm -keys=rocm,gpu -max_num_threads=256 -mcpu=gfx906 -mtriple=amdgcn-amd-amdhsa-hcc -thread_warp_size=64", "conv2d_nchw.cuda", [["TENSOR", [128, 1024, 14, 14], "float32"], ["TENSOR", [2048, 1024, 1, 1], "float32"], 2, 0, 1, "float32"], {}], "config": {"index": 150523, "code_hash": null, "entity": [["tile_f", "sp", [-1, 4, 64, 4]], ["tile_y", "sp", [-1, 7, 1, 1]], ["tile_x", "sp", [-1, 1, 1, 7]], ["tile_rc", "sp", [-1, 8]], ["tile_ry", "sp", [-1, 1]], ["tile_rx", "sp", [-1, 1]], ["auto_unroll_max_step", "ot", 1500], ["unroll_explicit", "ot", 1]]}, "result": [[3.598095703], 0, 29.24050259590149, 1638701646.888141], "version": 0.2, "tvm_version": "0.9.dev0"}
{"input": ["rocm -keys=rocm,gpu -max_num_threads=256 -mcpu=gfx906 -mtriple=amdgcn-amd-amdhsa-hcc -thread_warp_size=64", "conv2d_nchw.cuda", [["TENSOR", [128, 1024, 14, 14], "float32"], ["TENSOR", [2048, 1024, 1, 1], "float32"], 2, 0, 1, "float32"], {}], "config": {"index": 102393, "code_hash": null, "entity": [["tile_f", "sp", [-1, 2, 8, 2]], ["tile_y", "sp", [-1, 7, 1, 1]], ["tile_x", "sp", [-1, 1, 7, 1]], ["tile_rc", "sp", [-1, 64]], ["tile_ry", "sp", [-1, 1]], ["tile_rx", "sp", [-1, 1]], ["auto_unroll_max_step", "ot", 512], ["unroll_explicit", "ot", 1]]}, "result": [[0.2900816955], 0, 5.286411762237549, 1638701649.9822924], "version": 0.2, "tvm_version": "0.9.dev0"}
{"input": ["rocm -keys=rocm,gpu -max_num_threads=256 -mcpu=gfx906 -mtriple=amdgcn-amd-amdhsa-hcc -thread_warp_size=64", "conv2d_nchw.cuda", [["TENSOR", [128, 1024, 14, 14], "float32"], ["TENSOR", [2048, 1024, 1, 1], "float32"], 2, 0, 1, "float32"], {}], "config": {"index": 10473, "code_hash": null, "entity": [["tile_f", "sp", [-1, 2, 1, 32]], ["tile_y", "sp", [-1, 1, 1, 1]], ["tile_x", "sp", [-1, 1, 1, 7]], ["tile_rc", "sp", [-1, 2]], ["tile_ry", "sp", [-1, 1]], ["tile_rx", "sp", [-1, 1]], ["auto_unroll_max_step", "ot", 0], ["unroll_explicit", "ot", 1]]}, "result": [[4.776895996], 0, 25.995953798294067, 1638701675.631319], "version": 0.2, "tvm_version": "0.9.dev0"}
{"input": ["rocm -keys=rocm,gpu -max_num_threads=256 -mcpu=gfx906 -mtriple=amdgcn-amd-amdhsa-hcc -thread_warp_size=64", "conv2d_nchw.cuda", [["TENSOR", [128, 1024, 14, 14], "float32"], ["TENSOR", [2048, 1024, 1, 1], "float32"], 2, 0, 1, "float32"], {}], "config": {"index": 73790, "code_hash": null, "entity": [["tile_f", "sp", [-1, 8, 4, 16]], ["tile_y", "sp", [-1, 1, 7, 1]], ["tile_x", "sp", [-1, 1, 7, 1]], ["tile_rc", "sp", [-1, 2]], ["tile_ry", "sp", [-1, 1]], ["tile_rx", "sp", [-1, 1]], ["auto_unroll_max_step", "ot", 512], ["unroll_explicit", "ot", 1]]}, "result": [[0.760667053], 0, 6.839152812957764, 1638701681.164534], "version": 0.2, "tvm_version": "0.9.dev0"}
{"input": ["rocm -keys=rocm,gpu -max_num_threads=256 -mcpu=gfx906 -mtriple=amdgcn-amd-amdhsa-hcc -thread_warp_size=64", "conv2d_nchw.cuda", [["TENSOR", [128, 1024, 14, 14], "float32"], ["TENSOR", [2048, 1024, 1, 1], "float32"], 2, 0, 1, "float32"], {}], "config": {"index": 73949, "code_hash": null, "entity": [["tile_f", "sp", [-1, 1, 64, 1]], ["tile_y", "sp", [-1, 1, 1, 7]], ["tile_x", "sp", [-1, 1, 7, 1]], ["tile_rc", "sp", [-1, 2]], ["tile_ry", "sp", [-1, 1]], ["tile_rx", "sp", [-1, 1]], ["auto_unroll_max_step", "ot", 512], ["unroll_explicit", "ot", 1]]}, "result": [[0.015914659714285715], 0, 2.1321308612823486, 1638701683.0621748], "version": 0.2, "tvm_version": "0.9.dev0"}
{"input": ["rocm -keys=rocm,gpu -max_num_threads=256 -mcpu=gfx906 -mtriple=amdgcn-amd-amdhsa-hcc -thread_warp_size=64", "conv2d_nchw.cuda", [["TENSOR", [128, 1024, 14, 14], "float32"], ["TENSOR", [2048, 1024, 1, 1], "float32"], 2, 0, 1, "float32"], {}], "config": {"index": 15326, "code_hash": null, "entity": [["tile_f", "sp", [-1, 32, 8, 1]], ["tile_y", "sp", [-1, 1, 7, 1]], ["tile_x", "sp", [-1, 1, 7, 1]], ["tile_rc", "sp", [-1, 4]], ["tile_ry", "sp", [-1, 1]], ["tile_rx", "sp", [-1, 1]], ["auto_unroll_max_step", "ot", 0], ["unroll_explicit", "ot", 1]]}, "result": [[0.032818405], 0, 2.3573052883148193, 1638701685.0151258], "version": 0.2, "tvm_version": "0.9.dev0"}
{"input": ["rocm -keys=rocm,gpu -max_num_threads=256 -mcpu=gfx906 -mtriple=amdgcn-amd-amdhsa-hcc -thread_warp_size=64", "conv2d_nchw.cuda", [["TENSOR", [128, 1024, 14, 14], "float32"], ["TENSOR", [2048, 1024, 1, 1], "float32"], 2, 0, 1, "float32"], {}], "config": {"index": 138741, "code_hash": null, "entity": [["tile_f", "sp", [-1, 1, 64, 1]], ["tile_y", "sp", [-1, 7, 1, 1]], ["tile_x", "sp", [-1, 1, 1, 7]], ["tile_rc", "sp", [-1, 2]], ["tile_ry", "sp", [-1, 1]], ["tile_rx", "sp", [-1, 1]], ["auto_unroll_max_step", "ot", 1500], ["unroll_explicit", "ot", 1]]}, "result": [[0.04214253975], 0, 2.22875714302063, 1638701686.780448], "version": 0.2, "tvm_version": "0.9.dev0"}
{"input": ["rocm -keys=rocm,gpu -max_num_threads=256 -mcpu=gfx906 -mtriple=amdgcn-amd-amdhsa-hcc -thread_warp_size=64", "conv2d_nchw.cuda", [["TENSOR", [128, 1024, 14, 14], "float32"], ["TENSOR", [2048, 1024, 1, 1], "float32"], 2, 0, 1, "float32"], {}], "config": {"index": 66172, "code_hash": null, "entity": [["tile_f", "sp", [-1, 2, 2, 32]], ["tile_y", "sp", [-1, 7, 1, 1]], ["tile_x", "sp", [-1, 7, 1, 1]], ["tile_rc", "sp", [-1, 1]], ["tile_ry", "sp", [-1, 1]], ["tile_rx", "sp", [-1, 1]], ["auto_unroll_max_step", "ot", 512], ["unroll_explicit", "ot", 1]]}, "result": [[3.5508618162500003], 0, 20.98404335975647, 1638701706.1580322], "version": 0.2, "tvm_version": "0.9.dev0"}
{"input": ["rocm -keys=rocm,gpu -max_num_threads=256 -mcpu=gfx906 -mtriple=amdgcn-amd-amdhsa-hcc -thread_warp_size=64", "conv2d_nchw.cuda", [["TENSOR", [128, 1024, 14, 14], "float32"], ["TENSOR", [2048, 1024, 1, 1], "float32"], 2, 0, 1, "float32"], {}], "config": {"index": 144108, "code_hash": null, "entity": [["tile_f", "sp", [-1, 1, 32, 64]], ["tile_y", "sp", [-1, 1, 1, 7]], ["tile_x", "sp", [-1, 1, 7, 1]], ["tile_rc", "sp", [-1, 4]], ["tile_ry", "sp", [-1, 1]], ["tile_rx", "sp", [-1, 1]], ["auto_unroll_max_step", "ot", 1500], ["unroll_explicit", "ot", 1]]}, "result": [[0.48528640725000005], 0, 8.005154371261597, 1638701710.2199812], "version": 0.2, "tvm_version": "0.9.dev0"}
{"input": ["rocm -keys=rocm,gpu -max_num_threads=256 -mcpu=gfx906 -mtriple=amdgcn-amd-amdhsa-hcc -thread_warp_size=64", "conv2d_nchw.cuda", [["TENSOR", [128, 1024, 14, 14], "float32"], ["TENSOR", [2048, 1024, 1, 1], "float32"], 2, 0, 1, "float32"], {}], "config": {"index": 148195, "code_hash": null, "entity": [["tile_f", "sp", [-1, 32, 16, 1]], ["tile_y", "sp", [-1, 1, 1, 7]], ["tile_x", "sp", [-1, 7, 1, 1]], ["tile_rc", "sp", [-1, 8]], ["tile_ry", "sp", [-1, 1]], ["tile_rx", "sp", [-1, 1]], ["auto_unroll_max_step", "ot", 1500], ["unroll_explicit", "ot", 1]]}, "result": [[1.9727907712500001], 0, 15.051622867584229, 1638701721.8149683], "version": 0.2, "tvm_version": "0.9.dev0"}
{"input": ["rocm -keys=rocm,gpu -max_num_threads=256 -mcpu=gfx906 -mtriple=amdgcn-amd-amdhsa-hcc -thread_warp_size=64", "conv2d_nchw.cuda", [["TENSOR", [128, 1024, 14, 14], "float32"], ["TENSOR", [2048, 1024, 1, 1], "float32"], 2, 0, 1, "float32"], {}], "config": {"index": 27304, "code_hash": null, "entity": [["tile_f", "sp", [-1, 16, 1, 1]], ["tile_y", "sp", [-1, 1, 1, 7]], ["tile_x", "sp", [-1, 1, 7, 1]], ["tile_rc", "sp", [-1, 16]], ["tile_ry", "sp", [-1, 1]], ["tile_rx", "sp", [-1, 1]], ["auto_unroll_max_step", "ot", 0], ["unroll_explicit", "ot", 1]]}, "result": [[1.26869323725], 0, 8.761847257614136, 1638701729.9183512], "version": 0.2, "tvm_version": "0.9.dev0"}
{"input": ["rocm -keys=rocm,gpu -max_num_threads=256 -mcpu=gfx906 -mtriple=amdgcn-amd-amdhsa-hcc -thread_warp_size=64", "conv2d_nchw.cuda", [["TENSOR", [128, 1024, 14, 14], "float32"], ["TENSOR", [2048, 1024, 1, 1], "float32"], 2, 0, 1, "float32"], {}], "config": {"index": 95890, "code_hash": null, "entity": [["tile_f", "sp", [-1, 16, 2, 4]], ["tile_y", "sp", [-1, 1, 1, 7]], ["tile_x", "sp", [-1, 7, 1, 1]], ["tile_rc", "sp", [-1, 32]], ["tile_ry", "sp", [-1, 1]], ["tile_rx", "sp", [-1, 1]], ["auto_unroll_max_step", "ot", 512], ["unroll_explicit", "ot", 1]]}, "result": [[23.042130859249998], 0, 119.52730989456177, 1638701847.3675427], "version": 0.2, "tvm_version": "0.9.dev0"}
{"input": ["rocm -keys=rocm,gpu -max_num_threads=256 -mcpu=gfx906 -mtriple=amdgcn-amd-amdhsa-hcc -thread_warp_size=64", "conv2d_nchw.cuda", [["TENSOR", [128, 1024, 14, 14], "float32"], ["TENSOR", [2048, 1024, 1, 1], "float32"], 2, 0, 1, "float32"], {}], "config": {"index": 75484, "code_hash": null, "entity": [["tile_f", "sp", [-1, 4, 128, 2]], ["tile_y", "sp", [-1, 1, 1, 7]], ["tile_x", "sp", [-1, 1, 1, 7]], ["tile_rc", "sp", [-1, 2]], ["tile_ry", "sp", [-1, 1]], ["tile_rx", "sp", [-1, 1]], ["auto_unroll_max_step", "ot", 512], ["unroll_explicit", "ot", 1]]}, "result": [[0.5452532347500001], 0, 7.202482461929321, 1638701851.7544582], "version": 0.2, "tvm_version": "0.9.dev0"}
{"input": ["rocm -keys=rocm,gpu -max_num_threads=256 -mcpu=gfx906 -mtriple=amdgcn-amd-amdhsa-hcc -thread_warp_size=64", "conv2d_nchw.cuda", [["TENSOR", [128, 1024, 14, 14], "float32"], ["TENSOR", [2048, 1024, 1, 1], "float32"], 2, 0, 1, "float32"], {}], "config": {"index": 71258, "code_hash": null, "entity": [["tile_f", "sp", [-1, 2, 64, 16]], ["tile_y", "sp", [-1, 1, 1, 7]], ["tile_x", "sp", [-1, 1, 1, 1]], ["tile_rc", "sp", [-1, 2]], ["tile_ry", "sp", [-1, 1]], ["tile_rx", "sp", [-1, 1]], ["auto_unroll_max_step", "ot", 512], ["unroll_explicit", "ot", 1]]}, "result": [[0.44967117300000004], 0, 4.833446741104126, 1638701855.532266], "version": 0.2, "tvm_version": "0.9.dev0"}
{"input": ["rocm -keys=rocm,gpu -max_num_threads=256 -mcpu=gfx906 -mtriple=amdgcn-amd-amdhsa-hcc -thread_warp_size=64", "conv2d_nchw.cuda", [["TENSOR", [128, 1024, 14, 14], "float32"], ["TENSOR", [2048, 1024, 1, 1], "float32"], 2, 0, 1, "float32"], {}], "config": {"index": 12439, "code_hash": null, "entity": [["tile_f", "sp", [-1, 1, 128, 1]], ["tile_y", "sp", [-1, 1, 7, 1]], ["tile_x", "sp", [-1, 1, 1, 1]], ["tile_rc", "sp", [-1, 4]], ["tile_ry", "sp", [-1, 1]], ["tile_rx", "sp", [-1, 1]], ["auto_unroll_max_step", "ot", 0], ["unroll_explicit", "ot", 1]]}, "result": [[0.07349907675], 0, 2.791370391845703, 1638701910.700218], "version": 0.2, "tvm_version": "0.9.dev0"}
{"input": ["rocm -keys=rocm,gpu -max_num_threads=256 -mcpu=gfx906 -mtriple=amdgcn-amd-amdhsa-hcc -thread_warp_size=64", "conv2d_nchw.cuda", [["TENSOR", [128, 1024, 14, 14], "float32"], ["TENSOR", [2048, 1024, 1, 1], "float32"], 2, 0, 1, "float32"], {}], "config": {"index": 76503, "code_hash": null, "entity": [["tile_f", "sp", [-1, 1, 128, 1]], ["tile_y", "sp", [-1, 1, 7, 1]], ["tile_x", "sp", [-1, 1, 1, 1]], ["tile_rc", "sp", [-1, 4]], ["tile_ry", "sp", [-1, 1]], ["tile_rx", "sp", [-1, 1]], ["auto_unroll_max_step", "ot", 512], ["unroll_explicit", "ot", 1]]}, "result": [[0.07019940175], 0, 2.5426759719848633, 1638701912.5831838], "version": 0.2, "tvm_version": "0.9.dev0"}
{"input": ["rocm -keys=rocm,gpu -max_num_threads=256 -mcpu=gfx906 -mtriple=amdgcn-amd-amdhsa-hcc -thread_warp_size=64", "conv2d_nchw.cuda", [["TENSOR", [128, 1024, 14, 14], "float32"], ["TENSOR", [2048, 1024, 1, 1], "float32"], 2, 0, 1, "float32"], {}], "config": {"index": 14987, "code_hash": null, "entity": [["tile_f", "sp", [-1, 1, 128, 1]], ["tile_y", "sp", [-1, 7, 1, 1]], ["tile_x", "sp", [-1, 1, 7, 1]], ["tile_rc", "sp", [-1, 4]], ["tile_ry", "sp", [-1, 1]], ["tile_rx", "sp", [-1, 1]], ["auto_unroll_max_step", "ot", 0], ["unroll_explicit", "ot", 1]]}, "result": [[0.011597678222222222], 0, 2.4307703971862793, 1638701914.4585793], "version": 0.2, "tvm_version": "0.9.dev0"}
{"input": ["rocm -keys=rocm,gpu -max_num_threads=256 -mcpu=gfx906 -mtriple=amdgcn-amd-amdhsa-hcc -thread_warp_size=64", "conv2d_nchw.cuda", [["TENSOR", [128, 1024, 14, 14], "float32"], ["TENSOR", [2048, 1024, 1, 1], "float32"], 2, 0, 1, "float32"], {}], "config": {"index": 79051, "code_hash": null, "entity": [["tile_f", "sp", [-1, 1, 128, 1]], ["tile_y", "sp", [-1, 7, 1, 1]], ["tile_x", "sp", [-1, 1, 7, 1]], ["tile_rc", "sp", [-1, 4]], ["tile_ry", "sp", [-1, 1]], ["tile_rx", "sp", [-1, 1]], ["auto_unroll_max_step", "ot", 512], ["unroll_explicit", "ot", 1]]}, "result": [[0.011470766666666667], 0, 2.474336624145508, 1638701916.3260043], "version": 0.2, "tvm_version": "0.9.dev0"}
{"input": ["rocm -keys=rocm,gpu -max_num_threads=256 -mcpu=gfx906 -mtriple=amdgcn-amd-amdhsa-hcc -thread_warp_size=64", "conv2d_nchw.cuda", [["TENSOR", [128, 1024, 14, 14], "float32"], ["TENSOR", [2048, 1024, 1, 1], "float32"], 2, 0, 1, "float32"], {}], "config": {"index": 14623, "code_hash": null, "entity": [["tile_f", "sp", [-1, 1, 128, 1]], ["tile_y", "sp", [-1, 1, 1, 1]], ["tile_x", "sp", [-1, 1, 7, 1]], ["tile_rc", "sp", [-1, 4]], ["tile_ry", "sp", [-1, 1]], ["tile_rx", "sp", [-1, 1]], ["auto_unroll_max_step", "ot", 0], ["unroll_explicit", "ot", 1]]}, "result": [[0.06665065749999999], 0, 2.239152431488037, 1638701918.2403753], "version": 0.2, "tvm_version": "0.9.dev0"}
{"input": ["rocm -keys=rocm,gpu -max_num_threads=256 -mcpu=gfx906 -mtriple=amdgcn-amd-amdhsa-hcc -thread_warp_size=64", "conv2d_nchw.cuda", [["TENSOR", [128, 1024, 14, 14], "float32"], ["TENSOR", [2048, 1024, 1, 1], "float32"], 2, 0, 1, "float32"], {}], "config": {"index": 78687, "code_hash": null, "entity": [["tile_f", "sp", [-1, 1, 128, 1]], ["tile_y", "sp", [-1, 1, 1, 1]], ["tile_x", "sp", [-1, 1, 7, 1]], ["tile_rc", "sp", [-1, 4]], ["tile_ry", "sp", [-1, 1]], ["tile_rx", "sp", [-1, 1]], ["auto_unroll_max_step", "ot", 512], ["unroll_explicit", "ot", 1]]}, "result": [[0.06613596325], 0, 2.7383294105529785, 1638701920.251546], "version": 0.2, "tvm_version": "0.9.dev0"}
{"input": ["rocm -keys=rocm,gpu -max_num_threads=256 -mcpu=gfx906 -mtriple=amdgcn-amd-amdhsa-hcc -thread_warp_size=64", "conv2d_nchw.cuda", [["TENSOR", [128, 1024, 14, 14], "float32"], ["TENSOR", [2048, 1024, 1, 1], "float32"], 2, 0, 1, "float32"], {}], "config": {"index": 74683, "code_hash": null, "entity": [["tile_f", "sp", [-1, 1, 128, 1]], ["tile_y", "sp", [-1, 7, 1, 1]], ["tile_x", "sp", [-1, 1, 1, 7]], ["tile_rc", "sp", [-1, 2]], ["tile_ry", "sp", [-1, 1]], ["tile_rx", "sp", [-1, 1]], ["auto_unroll_max_step", "ot", 512], ["unroll_explicit", "ot", 1]]}, "result": [[0.026549942], 0, 2.694638967514038, 1638701922.1436648], "version": 0.2, "tvm_version": "0.9.dev0"}
{"input": ["rocm -keys=rocm,gpu -max_num_threads=256 -mcpu=gfx906 -mtriple=amdgcn-amd-amdhsa-hcc -thread_warp_size=64", "conv2d_nchw.cuda", [["TENSOR", [128, 1024, 14, 14], "float32"], ["TENSOR", [2048, 1024, 1, 1], "float32"], 2, 0, 1, "float32"], {}], "config": {"index": 10619, "code_hash": null, "entity": [["tile_f", "sp", [-1, 1, 128, 1]], ["tile_y", "sp", [-1, 7, 1, 1]], ["tile_x", "sp", [-1, 1, 1, 7]], ["tile_rc", "sp", [-1, 2]], ["tile_ry", "sp", [-1, 1]], ["tile_rx", "sp", [-1, 1]], ["auto_unroll_max_step", "ot", 0], ["unroll_explicit", "ot", 1]]}, "result": [[0.042157768], 0, 2.0793070793151855, 1638701923.9304051], "version": 0.2, "tvm_version": "0.9.dev0"}
{"input": ["rocm -keys=rocm,gpu -max_num_threads=256 -mcpu=gfx906 -mtriple=amdgcn-amd-amdhsa-hcc -thread_warp_size=64", "conv2d_nchw.cuda", [["TENSOR", [128, 1024, 14, 14], "float32"], ["TENSOR", [2048, 1024, 1, 1], "float32"], 2, 0, 1, "float32"], {}], "config": {"index": 16448, "code_hash": null, "entity": [["tile_f", "sp", [-1, 1, 256, 1]], ["tile_y", "sp", [-1, 7, 1, 1]], ["tile_x", "sp", [-1, 1, 1, 7]], ["tile_rc", "sp", [-1, 4]], ["tile_ry", "sp", [-1, 1]], ["tile_rx", "sp", [-1, 1]], ["auto_unroll_max_step", "ot", 0], ["unroll_explicit", "ot", 1]]}, "result": [[0.036792846500000004], 0, 2.11263108253479, 1638701925.6165292], "version": 0.2, "tvm_version": "0.9.dev0"}
{"input": ["rocm -keys=rocm,gpu -max_num_threads=256 -mcpu=gfx906 -mtriple=amdgcn-amd-amdhsa-hcc -thread_warp_size=64", "conv2d_nchw.cuda", [["TENSOR", [128, 1024, 14, 14], "float32"], ["TENSOR", [2048, 1024, 1, 1], "float32"], 2, 0, 1, "float32"], {}], "config": {"index": 80512, "code_hash": null, "entity": [["tile_f", "sp", [-1, 1, 256, 1]], ["tile_y", "sp", [-1, 7, 1, 1]], ["tile_x", "sp", [-1, 1, 1, 7]], ["tile_rc", "sp", [-1, 4]], ["tile_ry", "sp", [-1, 1]], ["tile_rx", "sp", [-1, 1]], ["auto_unroll_max_step", "ot", 512], ["unroll_explicit", "ot", 1]]}, "result": [[0.020781223166666665], 0, 2.2689707279205322, 1638701927.437362], "version": 0.2, "tvm_version": "0.9.dev0"}
{"input": ["rocm -keys=rocm,gpu -max_num_threads=256 -mcpu=gfx906 -mtriple=amdgcn-amd-amdhsa-hcc -thread_warp_size=64", "conv2d_nchw.cuda", [["TENSOR", [128, 1024, 14, 14], "float32"], ["TENSOR", [2048, 1024, 1, 1], "float32"], 2, 0, 1, "float32"], {}], "config": {"index": 70805, "code_hash": null, "entity": [["tile_f", "sp", [-1, 1, 64, 4]], ["tile_y", "sp", [-1, 1, 7, 1]], ["tile_x", "sp", [-1, 1, 1, 1]], ["tile_rc", "sp", [-1, 2]], ["tile_ry", "sp", [-1, 1]], ["tile_rx", "sp", [-1, 1]], ["auto_unroll_max_step", "ot", 512], ["unroll_explicit", "ot", 1]]}, "result": [[0.17911611924999998], 0, 2.9772932529449463, 1638701929.8957188], "version": 0.2, "tvm_version": "0.9.dev0"}
{"input": ["rocm -keys=rocm,gpu -max_num_threads=256 -mcpu=gfx906 -mtriple=amdgcn-amd-amdhsa-hcc -thread_warp_size=64", "conv2d_nchw.cuda", [["TENSOR", [128, 1024, 14, 14], "float32"], ["TENSOR", [2048, 1024, 1, 1], "float32"], 2, 0, 1, "float32"], {}], "config": {"index": 6741, "code_hash": null, "entity": [["tile_f", "sp", [-1, 1, 64, 4]], ["tile_y", "sp", [-1, 1, 7, 1]], ["tile_x", "sp", [-1, 1, 1, 1]], ["tile_rc", "sp", [-1, 2]], ["tile_ry", "sp", [-1, 1]], ["tile_rx", "sp", [-1, 1]], ["auto_unroll_max_step", "ot", 0], ["unroll_explicit", "ot", 1]]}, "result": [[0.183813446], 0, 3.076500177383423, 1638701932.3982704], "version": 0.2, "tvm_version": "0.9.dev0"}
{"input": ["rocm -keys=rocm,gpu -max_num_threads=256 -mcpu=gfx906 -mtriple=amdgcn-amd-amdhsa-hcc -thread_warp_size=64", "conv2d_nchw.cuda", [["TENSOR", [128, 1024, 14, 14], "float32"], ["TENSOR", [2048, 1024, 1, 1], "float32"], 2, 0, 1, "float32"], {}], "config": {"index": 6609, "code_hash": null, "entity": [["tile_f", "sp", [-1, 1, 64, 1]], ["tile_y", "sp", [-1, 1, 7, 1]], ["tile_x", "sp", [-1, 1, 1, 1]], ["tile_rc", "sp", [-1, 2]], ["tile_ry", "sp", [-1, 1]], ["tile_rx", "sp", [-1, 1]], ["auto_unroll_max_step", "ot", 0], ["unroll_explicit", "ot", 1]]}, "result": [[0.07870497125], 0, 2.6697428226470947, 1638701934.3873715], "version": 0.2, "tvm_version": "0.9.dev0"}
{"input": ["rocm -keys=rocm,gpu -max_num_threads=256 -mcpu=gfx906 -mtriple=amdgcn-amd-amdhsa-hcc -thread_warp_size=64", "conv2d_nchw.cuda", [["TENSOR", [128, 1024, 14, 14], "float32"], ["TENSOR", [2048, 1024, 1, 1], "float32"], 2, 0, 1, "float32"], {}], "config": {"index": 70673, "code_hash": null, "entity": [["tile_f", "sp", [-1, 1, 64, 1]], ["tile_y", "sp", [-1, 1, 7, 1]], ["tile_x", "sp", [-1, 1, 1, 1]], ["tile_rc", "sp", [-1, 2]], ["tile_ry", "sp", [-1, 1]], ["tile_rx", "sp", [-1, 1]], ["auto_unroll_max_step", "ot", 512], ["unroll_explicit", "ot", 1]]}, "result": [[0.07807363125000001], 0, 2.5386404991149902, 1638701936.3020508], "version": 0.2, "tvm_version": "0.9.dev0"}
{"input": ["rocm -keys=rocm,gpu -max_num_threads=256 -mcpu=gfx906 -mtriple=amdgcn-amd-amdhsa-hcc -thread_warp_size=64", "conv2d_nchw.cuda", [["TENSOR", [128, 1024, 14, 14], "float32"], ["TENSOR", [2048, 1024, 1, 1], "float32"], 2, 0, 1, "float32"], {}], "config": {"index": 15153, "code_hash": null, "entity": [["tile_f", "sp", [-1, 1, 16, 8]], ["tile_y", "sp", [-1, 7, 1, 1]], ["tile_x", "sp", [-1, 1, 7, 1]], ["tile_rc", "sp", [-1, 4]], ["tile_ry", "sp", [-1, 1]], ["tile_rx", "sp", [-1, 1]], ["auto_unroll_max_step", "ot", 0], ["unroll_explicit", "ot", 1]]}, "result": [[0.09401415249999999], 0, 2.927013874053955, 1638701938.369946], "version": 0.2, "tvm_version": "0.9.dev0"}
{"input": ["rocm -keys=rocm,gpu -max_num_threads=256 -mcpu=gfx906 -mtriple=amdgcn-amd-amdhsa-hcc -thread_warp_size=64", "conv2d_nchw.cuda", [["TENSOR", [128, 1024, 14, 14], "float32"], ["TENSOR", [2048, 1024, 1, 1], "float32"], 2, 0, 1, "float32"], {}], "config": {"index": 79117, "code_hash": null, "entity": [["tile_f", "sp", [-1, 1, 64, 2]], ["tile_y", "sp", [-1, 7, 1, 1]], ["tile_x", "sp", [-1, 1, 7, 1]], ["tile_rc", "sp", [-1, 4]], ["tile_ry", "sp", [-1, 1]], ["tile_rx", "sp", [-1, 1]], ["auto_unroll_max_step", "ot", 512], ["unroll_explicit", "ot", 1]]}, "result": [[0.01772325], 0, 2.30763578414917, 1638701940.1729753], "version": 0.2, "tvm_version": "0.9.dev0"}
{"input": ["rocm -keys=rocm,gpu -max_num_threads=256 -mcpu=gfx906 -mtriple=amdgcn-amd-amdhsa-hcc -thread_warp_size=64", "conv2d_nchw.cuda", [["TENSOR", [128, 1024, 14, 14], "float32"], ["TENSOR", [2048, 1024, 1, 1], "float32"], 2, 0, 1, "float32"], {}], "config": {"index": 15053, "code_hash": null, "entity": [["tile_f", "sp", [-1, 1, 64, 2]], ["tile_y", "sp", [-1, 7, 1, 1]], ["tile_x", "sp", [-1, 1, 7, 1]], ["tile_rc", "sp", [-1, 4]], ["tile_ry", "sp", [-1, 1]], ["tile_rx", "sp", [-1, 1]], ["auto_unroll_max_step", "ot", 0], ["unroll_explicit", "ot", 1]]}, "result": [[0.017378040166666667], 0, 2.385524272918701, 1638701941.9976838], "version": 0.2, "tvm_version": "0.9.dev0"}
{"input": ["rocm -keys=rocm,gpu -max_num_threads=256 -mcpu=gfx906 -mtriple=amdgcn-amd-amdhsa-hcc -thread_warp_size=64", "conv2d_nchw.cuda", [["TENSOR", [128, 1024, 14, 14], "float32"], ["TENSOR", [2048, 1024, 1, 1], "float32"], 2, 0, 1, "float32"], {}], "config": {"index": 70745, "code_hash": null, "entity": [["tile_f", "sp", [-1, 1, 64, 2]], ["tile_y", "sp", [-1, 1, 7, 1]], ["tile_x", "sp", [-1, 1, 1, 1]], ["tile_rc", "sp", [-1, 2]], ["tile_ry", "sp", [-1, 1]], ["tile_rx", "sp", [-1, 1]], ["auto_unroll_max_step", "ot", 512], ["unroll_explicit", "ot", 1]]}, "result": [[0.083440422], 0, 2.5193114280700684, 1638701943.9656942], "version": 0.2, "tvm_version": "0.9.dev0"}
{"input": ["rocm -keys=rocm,gpu -max_num_threads=256 -mcpu=gfx906 -mtriple=amdgcn-amd-amdhsa-hcc -thread_warp_size=64", "conv2d_nchw.cuda", [["TENSOR", [128, 1024, 14, 14], "float32"], ["TENSOR", [2048, 1024, 1, 1], "float32"], 2, 0, 1, "float32"], {}], "config": {"index": 6681, "code_hash": null, "entity": [["tile_f", "sp", [-1, 1, 64, 2]], ["tile_y", "sp", [-1, 1, 7, 1]], ["tile_x", "sp", [-1, 1, 1, 1]], ["tile_rc", "sp", [-1, 2]], ["tile_ry", "sp", [-1, 1]], ["tile_rx", "sp", [-1, 1]], ["auto_unroll_max_step", "ot", 0], ["unroll_explicit", "ot", 1]]}, "result": [[0.083435791], 0, 2.5229060649871826, 1638701946.01727], "version": 0.2, "tvm_version": "0.9.dev0"}
{"input": ["rocm -keys=rocm,gpu -max_num_threads=256 -mcpu=gfx906 -mtriple=amdgcn-amd-amdhsa-hcc -thread_warp_size=64", "conv2d_nchw.cuda", [["TENSOR", [128, 1024, 14, 14], "float32"], ["TENSOR", [2048, 1024, 1, 1], "float32"], 2, 0, 1, "float32"], {}], "config": {"index": 9223, "code_hash": null, "entity": [["tile_f", "sp", [-1, 1, 32, 2]], ["tile_y", "sp", [-1, 7, 1, 1]], ["tile_x", "sp", [-1, 1, 7, 1]], ["tile_rc", "sp", [-1, 2]], ["tile_ry", "sp", [-1, 1]], ["tile_rx", "sp", [-1, 1]], ["auto_unroll_max_step", "ot", 0], ["unroll_explicit", "ot", 1]]}, "result": [[0.02064222716666667], 0, 2.32769775390625, 1638701947.8664756], "version": 0.2, "tvm_version": "0.9.dev0"}
{"input": ["rocm -keys=rocm,gpu -max_num_threads=256 -mcpu=gfx906 -mtriple=amdgcn-amd-amdhsa-hcc -thread_warp_size=64", "conv2d_nchw.cuda", [["TENSOR", [128, 1024, 14, 14], "float32"], ["TENSOR", [2048, 1024, 1, 1], "float32"], 2, 0, 1, "float32"], {}], "config": {"index": 73287, "code_hash": null, "entity": [["tile_f", "sp", [-1, 1, 32, 2]], ["tile_y", "sp", [-1, 7, 1, 1]], ["tile_x", "sp", [-1, 1, 7, 1]], ["tile_rc", "sp", [-1, 2]], ["tile_ry", "sp", [-1, 1]], ["tile_rx", "sp", [-1, 1]], ["auto_unroll_max_step", "ot", 512], ["unroll_explicit", "ot", 1]]}, "result": [[0.021353093333333333], 0, 2.33091402053833, 1638701949.6666715], "version": 0.2, "tvm_version": "0.9.dev0"}
{"input": ["rocm -keys=rocm,gpu -max_num_threads=256 -mcpu=gfx906 -mtriple=amdgcn-amd-amdhsa-hcc -thread_warp_size=64", "conv2d_nchw.cuda", [["TENSOR", [128, 1024, 14, 14], "float32"], ["TENSOR", [2048, 1024, 1, 1], "float32"], 2, 0, 1, "float32"], {}], "config": {"index": 15108, "code_hash": null, "entity": [["tile_f", "sp", [-1, 1, 32, 4]], ["tile_y", "sp", [-1, 7, 1, 1]], ["tile_x", "sp", [-1, 1, 7, 1]], ["tile_rc", "sp", [-1, 4]], ["tile_ry", "sp", [-1, 1]], ["tile_rx", "sp", [-1, 1]], ["auto_unroll_max_step", "ot", 0], ["unroll_explicit", "ot", 1]]}, "result": [[0.054381240750000004], 0, 2.5973405838012695, 1638701951.5532446], "version": 0.2, "tvm_version": "0.9.dev0"}
{"input": ["rocm -keys=rocm,gpu -max_num_threads=256 -mcpu=gfx906 -mtriple=amdgcn-amd-amdhsa-hcc -thread_warp_size=64", "conv2d_nchw.cuda", [["TENSOR", [128, 1024, 14, 14], "float32"], ["TENSOR", [2048, 1024, 1, 1], "float32"], 2, 0, 1, "float32"], {}], "config": {"index": 79172, "code_hash": null, "entity": [["tile_f", "sp", [-1, 1, 32, 4]], ["tile_y", "sp", [-1, 7, 1, 1]], ["tile_x", "sp", [-1, 1, 7, 1]], ["tile_rc", "sp", [-1, 4]], ["tile_ry", "sp", [-1, 1]], ["tile_rx", "sp", [-1, 1]], ["auto_unroll_max_step", "ot", 512], ["unroll_explicit", "ot", 1]]}, "result": [[0.04960508725], 0, 2.6596665382385254, 1638701953.5681086], "version": 0.2, "tvm_version": "0.9.dev0"}
{"input": ["rocm -keys=rocm,gpu -max_num_threads=256 -mcpu=gfx906 -mtriple=amdgcn-amd-amdhsa-hcc -thread_warp_size=64", "conv2d_nchw.cuda", [["TENSOR", [128, 1024, 14, 14], "float32"], ["TENSOR", [2048, 1024, 1, 1], "float32"], 2, 0, 1, "float32"], {}], "config": {"index": 15158, "code_hash": null, "entity": [["tile_f", "sp", [-1, 1, 32, 8]], ["tile_y", "sp", [-1, 7, 1, 1]], ["tile_x", "sp", [-1, 1, 7, 1]], ["tile_rc", "sp", [-1, 4]], ["tile_ry", "sp", [-1, 1]], ["tile_rx", "sp", [-1, 1]], ["auto_unroll_max_step", "ot", 0], ["unroll_explicit", "ot", 1]]}, "result": [[0.09215737900000001], 0, 2.8171565532684326, 1638701955.6503656], "version": 0.2, "tvm_version": "0.9.dev0"}
{"input": ["rocm -keys=rocm,gpu -max_num_threads=256 -mcpu=gfx906 -mtriple=amdgcn-amd-amdhsa-hcc -thread_warp_size=64", "conv2d_nchw.cuda", [["TENSOR", [128, 1024, 14, 14], "float32"], ["TENSOR", [2048, 1024, 1, 1], "float32"], 2, 0, 1, "float32"], {}], "config": {"index": 79222, "code_hash": null, "entity": [["tile_f", "sp", [-1, 1, 32, 8]], ["tile_y", "sp", [-1, 7, 1, 1]], ["tile_x", "sp", [-1, 1, 7, 1]], ["tile_rc", "sp", [-1, 4]], ["tile_ry", "sp", [-1, 1]], ["tile_rx", "sp", [-1, 1]], ["auto_unroll_max_step", "ot", 512], ["unroll_explicit", "ot", 1]]}, "result": [[1.78776611325], 0, 13.406903266906738, 1638701966.363348], "version": 0.2, "tvm_version": "0.9.dev0"}
{"input": ["rocm -keys=rocm,gpu -max_num_threads=256 -mcpu=gfx906 -mtriple=amdgcn-amd-amdhsa-hcc -thread_warp_size=64", "conv2d_nchw.cuda", [["TENSOR", [128, 1024, 14, 14], "float32"], ["TENSOR", [2048, 1024, 1, 1], "float32"], 2, 0, 1, "float32"], {}], "config": {"index": 15222, "code_hash": null, "entity": [["tile_f", "sp", [-1, 1, 8, 32]], ["tile_y", "sp", [-1, 7, 1, 1]], ["tile_x", "sp", [-1, 1, 7, 1]], ["tile_rc", "sp", [-1, 4]], ["tile_ry", "sp", [-1, 1]], ["tile_rx", "sp", [-1, 1]], ["auto_unroll_max_step", "ot", 0], ["unroll_explicit", "ot", 1]]}, "result": [[0.25929263300000005], 0, 4.807229042053223, 1638701969.4867024], "version": 0.2, "tvm_version": "0.9.dev0"}
{"input": ["rocm -keys=rocm,gpu -max_num_threads=256 -mcpu=gfx906 -mtriple=amdgcn-amd-amdhsa-hcc -thread_warp_size=64", "conv2d_nchw.cuda", [["TENSOR", [128, 1024, 14, 14], "float32"], ["TENSOR", [2048, 1024, 1, 1], "float32"], 2, 0, 1, "float32"], {}], "config": {"index": 79286, "code_hash": null, "entity": [["tile_f", "sp", [-1, 1, 8, 32]], ["tile_y", "sp", [-1, 7, 1, 1]], ["tile_x", "sp", [-1, 1, 7, 1]], ["tile_rc", "sp", [-1, 4]], ["tile_ry", "sp", [-1, 1]], ["tile_rx", "sp", [-1, 1]], ["auto_unroll_max_step", "ot", 512], ["unroll_explicit", "ot", 1]]}, "result": [[0.3450711975], 0, 4.968536138534546, 1638701972.8959782], "version": 0.2, "tvm_version": "0.9.dev0"}
{"input": ["rocm -keys=rocm,gpu -max_num_threads=256 -mcpu=gfx906 -mtriple=amdgcn-amd-amdhsa-hcc -thread_warp_size=64", "conv2d_nchw.cuda", [["TENSOR", [128, 1024, 14, 14], "float32"], ["TENSOR", [2048, 1024, 1, 1], "float32"], 2, 0, 1, "float32"], {}], "config": {"index": 9891, "code_hash": null, "entity": [["tile_f", "sp", [-1, 1, 128, 1]], ["tile_y", "sp", [-1, 1, 1, 7]], ["tile_x", "sp", [-1, 1, 7, 1]], ["tile_rc", "sp", [-1, 2]], ["tile_ry", "sp", [-1, 1]], ["tile_rx", "sp", [-1, 1]], ["auto_unroll_max_step", "ot", 0], ["unroll_explicit", "ot", 1]]}, "result": [[0.03490738274999999], 0, 2.3100152015686035, 1638701974.6982224], "version": 0.2, "tvm_version": "0.9.dev0"}
{"input": ["rocm -keys=rocm,gpu -max_num_threads=256 -mcpu=gfx906 -mtriple=amdgcn-amd-amdhsa-hcc -thread_warp_size=64", "conv2d_nchw.cuda", [["TENSOR", [128, 1024, 14, 14], "float32"], ["TENSOR", [2048, 1024, 1, 1], "float32"], 2, 0, 1, "float32"], {}], "config": {"index": 73955, "code_hash": null, "entity": [["tile_f", "sp", [-1, 1, 128, 1]], ["tile_y", "sp", [-1, 1, 1, 7]], ["tile_x", "sp", [-1, 1, 7, 1]], ["tile_rc", "sp", [-1, 2]], ["tile_ry", "sp", [-1, 1]], ["tile_rx", "sp", [-1, 1]], ["auto_unroll_max_step", "ot", 512], ["unroll_explicit", "ot", 1]]}, "result": [[0.03401796325], 0, 2.172403335571289, 1638701976.4583607], "version": 0.2, "tvm_version": "0.9.dev0"}
{"input": ["rocm -keys=rocm,gpu -max_num_threads=256 -mcpu=gfx906 -mtriple=amdgcn-amd-amdhsa-hcc -thread_warp_size=64", "conv2d_nchw.cuda", [["TENSOR", [128, 1024, 14, 14], "float32"], ["TENSOR", [2048, 1024, 1, 1], "float32"], 2, 0, 1, "float32"], {}], "config": {"index": 9157, "code_hash": null, "entity": [["tile_f", "sp", [-1, 1, 64, 1]], ["tile_y", "sp", [-1, 7, 1, 1]], ["tile_x", "sp", [-1, 1, 7, 1]], ["tile_rc", "sp", [-1, 2]], ["tile_ry", "sp", [-1, 1]], ["tile_rx", "sp", [-1, 1]], ["auto_unroll_max_step", "ot", 0], ["unroll_explicit", "ot", 1]]}, "result": [[0.015835340142857143], 0, 2.3791697025299072, 1638701978.309733], "version": 0.2, "tvm_version": "0.9.dev0"}
{"input": ["rocm -keys=rocm,gpu -max_num_threads=256 -mcpu=gfx906 -mtriple=amdgcn-amd-amdhsa-hcc -thread_warp_size=64", "conv2d_nchw.cuda", [["TENSOR", [128, 1024, 14, 14], "float32"], ["TENSOR", [2048, 1024, 1, 1], "float32"], 2, 0, 1, "float32"], {}], "config": {"index": 73221, "code_hash": null, "entity": [["tile_f", "sp", [-1, 1, 64, 1]], ["tile_y", "sp", [-1, 7, 1, 1]], ["tile_x", "sp", [-1, 1, 7, 1]], ["tile_rc", "sp", [-1, 2]], ["tile_ry", "sp", [-1, 1]], ["tile_rx", "sp", [-1, 1]], ["auto_unroll_max_step", "ot", 512], ["unroll_explicit", "ot", 1]]}, "result": [[0.015863541714285716], 0, 2.4401915073394775, 1638701980.21035], "version": 0.2, "tvm_version": "0.9.dev0"}
{"input": ["rocm -keys=rocm,gpu -max_num_threads=256 -mcpu=gfx906 -mtriple=amdgcn-amd-amdhsa-hcc -thread_warp_size=64", "conv2d_nchw.cuda", [["TENSOR", [128, 1024, 14, 14], "float32"], ["TENSOR", [2048, 1024, 1, 1], "float32"], 2, 0, 1, "float32"], {}], "config": {"index": 73293, "code_hash": null, "entity": [["tile_f", "sp", [-1, 1, 64, 2]], ["tile_y", "sp", [-1, 7, 1, 1]], ["tile_x", "sp", [-1, 1, 7, 1]], ["tile_rc", "sp", [-1, 2]], ["tile_ry", "sp", [-1, 1]], ["tile_rx", "sp", [-1, 1]], ["auto_unroll_max_step", "ot", 512], ["unroll_explicit", "ot", 1]]}, "result": [[0.0163061], 0, 2.4534659385681152, 1638701982.1003647], "version": 0.2, "tvm_version": "0.9.dev0"}
{"input": ["rocm -keys=rocm,gpu -max_num_threads=256 -mcpu=gfx906 -mtriple=amdgcn-amd-amdhsa-hcc -thread_warp_size=64", "conv2d_nchw.cuda", [["TENSOR", [128, 1024, 14, 14], "float32"], ["TENSOR", [2048, 1024, 1, 1], "float32"], 2, 0, 1, "float32"], {}], "config": {"index": 9229, "code_hash": null, "entity": [["tile_f", "sp", [-1, 1, 64, 2]], ["tile_y", "sp", [-1, 7, 1, 1]], ["tile_x", "sp", [-1, 1, 7, 1]], ["tile_rc", "sp", [-1, 2]], ["tile_ry", "sp", [-1, 1]], ["tile_rx", "sp", [-1, 1]], ["auto_unroll_max_step", "ot", 0], ["unroll_explicit", "ot", 1]]}, "result": [[0.01622622885714286], 0, 2.138241767883301, 1638702024.1710002], "version": 0.2, "tvm_version": "0.9.dev0"}
{"input": ["rocm -keys=rocm,gpu -max_num_threads=256 -mcpu=gfx906 -mtriple=amdgcn-amd-amdhsa-hcc -thread_warp_size=64", "conv2d_nchw.cuda", [["TENSOR", [128, 1024, 14, 14], "float32"], ["TENSOR", [2048, 1024, 1, 1], "float32"], 2, 0, 1, "float32"], {}], "config": {"index": 143115, "code_hash": null, "entity": [["tile_f", "sp", [-1, 1, 128, 1]], ["tile_y", "sp", [-1, 7, 1, 1]], ["tile_x", "sp", [-1, 1, 7, 1]], ["tile_rc", "sp", [-1, 4]], ["tile_ry", "sp", [-1, 1]], ["tile_rx", "sp", [-1, 1]], ["auto_unroll_max_step", "ot", 1500], ["unroll_explicit", "ot", 1]]}, "result": [[0.011365540333333334], 0, 2.1976423263549805, 1638702026.0675867], "version": 0.2, "tvm_version": "0.9.dev0"}
{"input": ["rocm -keys=rocm,gpu -max_num_threads=256 -mcpu=gfx906 -mtriple=amdgcn-amd-amdhsa-hcc -thread_warp_size=64", "conv2d_nchw.cuda", [["TENSOR", [128, 1024, 14, 14], "float32"], ["TENSOR", [2048, 1024, 1, 1], "float32"], 2, 0, 1, "float32"], {}], "config": {"index": 137357, "code_hash": null, "entity": [["tile_f", "sp", [-1, 1, 64, 2]], ["tile_y", "sp", [-1, 7, 1, 1]], ["tile_x", "sp", [-1, 1, 7, 1]], ["tile_rc", "sp", [-1, 2]], ["tile_ry", "sp", [-1, 1]], ["tile_rx", "sp", [-1, 1]], ["auto_unroll_max_step", "ot", 1500], ["unroll_explicit", "ot", 1]]}, "result": [[0.01634503057142857], 0, 2.2844700813293457, 1638702027.9035172], "version": 0.2, "tvm_version": "0.9.dev0"}
{"input": ["rocm -keys=rocm,gpu -max_num_threads=256 -mcpu=gfx906 -mtriple=amdgcn-amd-amdhsa-hcc -thread_warp_size=64", "conv2d_nchw.cuda", [["TENSOR", [128, 1024, 14, 14], "float32"], ["TENSOR", [2048, 1024, 1, 1], "float32"], 2, 0, 1, "float32"], {}], "config": {"index": 9886, "code_hash": null, "entity": [["tile_f", "sp", [-1, 2, 64, 1]], ["tile_y", "sp", [-1, 1, 1, 7]], ["tile_x", "sp", [-1, 1, 7, 1]], ["tile_rc", "sp", [-1, 2]], ["tile_ry", "sp", [-1, 1]], ["tile_rx", "sp", [-1, 1]], ["auto_unroll_max_step", "ot", 0], ["unroll_explicit", "ot", 1]]}, "result": [[0.017593074666666667], 0, 2.17516827583313, 1638702029.9608233], "version": 0.2, "tvm_version": "0.9.dev0"}
{"input": ["rocm -keys=rocm,gpu -max_num_threads=256 -mcpu=gfx906 -mtriple=amdgcn-amd-amdhsa-hcc -thread_warp_size=64", "conv2d_nchw.cuda", [["TENSOR", [128, 1024, 14, 14], "float32"], ["TENSOR", [2048, 1024, 1, 1], "float32"], 2, 0, 1, "float32"], {}], "config": {"index": 137285, "code_hash": null, "entity": [["tile_f", "sp", [-1, 1, 64, 1]], ["tile_y", "sp", [-1, 7, 1, 1]], ["tile_x", "sp", [-1, 1, 7, 1]], ["tile_rc", "sp", [-1, 2]], ["tile_ry", "sp", [-1, 1]], ["tile_rx", "sp", [-1, 1]], ["auto_unroll_max_step", "ot", 1500], ["unroll_explicit", "ot", 1]]}, "result": [[0.015962831714285714], 0, 2.100383996963501, 1638702031.9427404], "version": 0.2, "tvm_version": "0.9.dev0"}
{"input": ["rocm -keys=rocm,gpu -max_num_threads=256 -mcpu=gfx906 -mtriple=amdgcn-amd-amdhsa-hcc -thread_warp_size=64", "conv2d_nchw.cuda", [["TENSOR", [128, 1024, 14, 14], "float32"], ["TENSOR", [2048, 1024, 1, 1], "float32"], 2, 0, 1, "float32"], {}], "config": {"index": 9879, "code_hash": null, "entity": [["tile_f", "sp", [-1, 2, 32, 1]], ["tile_y", "sp", [-1, 1, 1, 7]], ["tile_x", "sp", [-1, 1, 7, 1]], ["tile_rc", "sp", [-1, 2]], ["tile_ry", "sp", [-1, 1]], ["tile_rx", "sp", [-1, 1]], ["auto_unroll_max_step", "ot", 0], ["unroll_explicit", "ot", 1]]}, "result": [[0.018629739000000003], 0, 2.306713342666626, 1638702033.9420557], "version": 0.2, "tvm_version": "0.9.dev0"}
{"input": ["rocm -keys=rocm,gpu -max_num_threads=256 -mcpu=gfx906 -mtriple=amdgcn-amd-amdhsa-hcc -thread_warp_size=64", "conv2d_nchw.cuda", [["TENSOR", [128, 1024, 14, 14], "float32"], ["TENSOR", [2048, 1024, 1, 1], "float32"], 2, 0, 1, "float32"], {}], "config": {"index": 9878, "code_hash": null, "entity": [["tile_f", "sp", [-1, 1, 32, 1]], ["tile_y", "sp", [-1, 1, 1, 7]], ["tile_x", "sp", [-1, 1, 7, 1]], ["tile_rc", "sp", [-1, 2]], ["tile_ry", "sp", [-1, 1]], ["tile_rx", "sp", [-1, 1]], ["auto_unroll_max_step", "ot", 0], ["unroll_explicit", "ot", 1]]}, "result": [[0.017780324166666667], 0, 2.2893025875091553, 1638702035.8990839], "version": 0.2, "tvm_version": "0.9.dev0"}
{"input": ["rocm -keys=rocm,gpu -max_num_threads=256 -mcpu=gfx906 -mtriple=amdgcn-amd-amdhsa-hcc -thread_warp_size=64", "conv2d_nchw.cuda", [["TENSOR", [128, 1024, 14, 14], "float32"], ["TENSOR", [2048, 1024, 1, 1], "float32"], 2, 0, 1, "float32"], {}], "config": {"index": 4055, "code_hash": null, "entity": [["tile_f", "sp", [-1, 2, 32, 1]], ["tile_y", "sp", [-1, 1, 1, 7]], ["tile_x", "sp", [-1, 1, 7, 1]], ["tile_rc", "sp", [-1, 1]], ["tile_ry", "sp", [-1, 1]], ["tile_rx", "sp", [-1, 1]], ["auto_unroll_max_step", "ot", 0], ["unroll_explicit", "ot", 1]]}, "result": [[0.032242522999999995], 0, 2.112917900085449, 1638702037.6649425], "version": 0.2, "tvm_version": "0.9.dev0"}
{"input": ["rocm -keys=rocm,gpu -max_num_threads=256 -mcpu=gfx906 -mtriple=amdgcn-amd-amdhsa-hcc -thread_warp_size=64", "conv2d_nchw.cuda", [["TENSOR", [128, 1024, 14, 14], "float32"], ["TENSOR", [2048, 1024, 1, 1], "float32"], 2, 0, 1, "float32"], {}], "config": {"index": 9158, "code_hash": null, "entity": [["tile_f", "sp", [-1, 2, 64, 1]], ["tile_y", "sp", [-1, 7, 1, 1]], ["tile_x", "sp", [-1, 1, 7, 1]], ["tile_rc", "sp", [-1, 2]], ["tile_ry", "sp", [-1, 1]], ["tile_rx", "sp", [-1, 1]], ["auto_unroll_max_step", "ot", 0], ["unroll_explicit", "ot", 1]]}, "result": [[0.01658973688888889], 0, 2.4111099243164062, 1638702039.5997136], "version": 0.2, "tvm_version": "0.9.dev0"}
{"input": ["rocm -keys=rocm,gpu -max_num_threads=256 -mcpu=gfx906 -mtriple=amdgcn-amd-amdhsa-hcc -thread_warp_size=64", "conv2d_nchw.cuda", [["TENSOR", [128, 1024, 14, 14], "float32"], ["TENSOR", [2048, 1024, 1, 1], "float32"], 2, 0, 1, "float32"], {}], "config": {"index": 9951, "code_hash": null, "entity": [["tile_f", "sp", [-1, 1, 32, 2]], ["tile_y", "sp", [-1, 1, 1, 7]], ["tile_x", "sp", [-1, 1, 7, 1]], ["tile_rc", "sp", [-1, 2]], ["tile_ry", "sp", [-1, 1]], ["tile_rx", "sp", [-1, 1]], ["auto_unroll_max_step", "ot", 0], ["unroll_explicit", "ot", 1]]}, "result": [[0.020761847166666667], 0, 3.0493972301483154, 1638702042.3522234], "version": 0.2, "tvm_version": "0.9.dev0"}
{"input": ["rocm -keys=rocm,gpu -max_num_threads=256 -mcpu=gfx906 -mtriple=amdgcn-amd-amdhsa-hcc -thread_warp_size=64", "conv2d_nchw.cuda", [["TENSOR", [128, 1024, 14, 14], "float32"], ["TENSOR", [2048, 1024, 1, 1], "float32"], 2, 0, 1, "float32"], {}], "config": {"index": 143109, "code_hash": null, "entity": [["tile_f", "sp", [-1, 1, 64, 1]], ["tile_y", "sp", [-1, 7, 1, 1]], ["tile_x", "sp", [-1, 1, 7, 1]], ["tile_rc", "sp", [-1, 4]], ["tile_ry", "sp", [-1, 1]], ["tile_rx", "sp", [-1, 1]], ["auto_unroll_max_step", "ot", 1500], ["unroll_explicit", "ot", 1]]}, "result": [[0.0106920211], 0, 2.6524767875671387, 1638702044.5574973], "version": 0.2, "tvm_version": "0.9.dev0"}
{"input": ["rocm -keys=rocm,gpu -max_num_threads=256 -mcpu=gfx906 -mtriple=amdgcn-amd-amdhsa-hcc -thread_warp_size=64", "conv2d_nchw.cuda", [["TENSOR", [128, 1024, 14, 14], "float32"], ["TENSOR", [2048, 1024, 1, 1], "float32"], 2, 0, 1, "float32"], {}], "config": {"index": 9885, "code_hash": null, "entity": [["tile_f", "sp", [-1, 1, 64, 1]], ["tile_y", "sp", [-1, 1, 1, 7]], ["tile_x", "sp", [-1, 1, 7, 1]], ["tile_rc", "sp", [-1, 2]], ["tile_ry", "sp", [-1, 1]], ["tile_rx", "sp", [-1, 1]], ["auto_unroll_max_step", "ot", 0], ["unroll_explicit", "ot", 1]]}, "result": [[0.015921973], 0, 2.748640537261963, 1638702046.9917917], "version": 0.2, "tvm_version": "0.9.dev0"}
{"input": ["rocm -keys=rocm,gpu -max_num_threads=256 -mcpu=gfx906 -mtriple=amdgcn-amd-amdhsa-hcc -thread_warp_size=64", "conv2d_nchw.cuda", [["TENSOR", [128, 1024, 14, 14], "float32"], ["TENSOR", [2048, 1024, 1, 1], "float32"], 2, 0, 1, "float32"], {}], "config": {"index": 79045, "code_hash": null, "entity": [["tile_f", "sp", [-1, 1, 64, 1]], ["tile_y", "sp", [-1, 7, 1, 1]], ["tile_x", "sp", [-1, 1, 7, 1]], ["tile_rc", "sp", [-1, 4]], ["tile_ry", "sp", [-1, 1]], ["tile_rx", "sp", [-1, 1]], ["auto_unroll_max_step", "ot", 512], ["unroll_explicit", "ot", 1]]}, "result": [[0.0107146034], 0, 2.7682502269744873, 1638702049.3069034], "version": 0.2, "tvm_version": "0.9.dev0"}
{"input": ["rocm -keys=rocm,gpu -max_num_threads=256 -mcpu=gfx906 -mtriple=amdgcn-amd-amdhsa-hcc -thread_warp_size=64", "conv2d_nchw.cuda", [["TENSOR", [128, 1024, 14, 14], "float32"], ["TENSOR", [2048, 1024, 1, 1], "float32"], 2, 0, 1, "float32"], {}], "config": {"index": 4127, "code_hash": null, "entity": [["tile_f", "sp", [-1, 1, 32, 2]], ["tile_y", "sp", [-1, 1, 1, 7]], ["tile_x", "sp", [-1, 1, 7, 1]], ["tile_rc", "sp", [-1, 1]], ["tile_ry", "sp", [-1, 1]], ["tile_rx", "sp", [-1, 1]], ["auto_unroll_max_step", "ot", 0], ["unroll_explicit", "ot", 1]]}, "result": [[0.033175495], 0, 2.742805004119873, 1638702051.737369], "version": 0.2, "tvm_version": "0.9.dev0"}
{"input": ["rocm -keys=rocm,gpu -max_num_threads=256 -mcpu=gfx906 -mtriple=amdgcn-amd-amdhsa-hcc -thread_warp_size=64", "conv2d_nchw.cuda", [["TENSOR", [128, 1024, 14, 14], "float32"], ["TENSOR", [2048, 1024, 1, 1], "float32"], 2, 0, 1, "float32"], {}], "config": {"index": 137286, "code_hash": null, "entity": [["tile_f", "sp", [-1, 2, 64, 1]], ["tile_y", "sp", [-1, 7, 1, 1]], ["tile_x", "sp", [-1, 1, 7, 1]], ["tile_rc", "sp", [-1, 2]], ["tile_ry", "sp", [-1, 1]], ["tile_rx", "sp", [-1, 1]], ["auto_unroll_max_step", "ot", 1500], ["unroll_explicit", "ot", 1]]}, "result": [[0.016708594142857143], 0, 2.6855807304382324, 1638702054.0323243], "version": 0.2, "tvm_version": "0.9.dev0"}
{"input": ["rocm -keys=rocm,gpu -max_num_threads=256 -mcpu=gfx906 -mtriple=amdgcn-amd-amdhsa-hcc -thread_warp_size=64", "conv2d_nchw.cuda", [["TENSOR", [128, 1024, 14, 14], "float32"], ["TENSOR", [2048, 1024, 1, 1], "float32"], 2, 0, 1, "float32"], {}], "config": {"index": 73222, "code_hash": null, "entity": [["tile_f", "sp", [-1, 2, 64, 1]], ["tile_y", "sp", [-1, 7, 1, 1]], ["tile_x", "sp", [-1, 1, 7, 1]], ["tile_rc", "sp", [-1, 2]], ["tile_ry", "sp", [-1, 1]], ["tile_rx", "sp", [-1, 1]], ["auto_unroll_max_step", "ot", 512], ["unroll_explicit", "ot", 1]]}, "result": [[0.016623021714285716], 0, 2.811746120452881, 1638702056.4316585], "version": 0.2, "tvm_version": "0.9.dev0"}
{"input": ["rocm -keys=rocm,gpu -max_num_threads=256 -mcpu=gfx906 -mtriple=amdgcn-amd-amdhsa-hcc -thread_warp_size=64", "conv2d_nchw.cuda", [["TENSOR", [128, 1024, 14, 14], "float32"], ["TENSOR", [2048, 1024, 1, 1], "float32"], 2, 0, 1, "float32"], {}], "config": {"index": 9957, "code_hash": null, "entity": [["tile_f", "sp", [-1, 1, 64, 2]], ["tile_y", "sp", [-1, 1, 1, 7]], ["tile_x", "sp", [-1, 1, 7, 1]], ["tile_rc", "sp", [-1, 2]], ["tile_ry", "sp", [-1, 1]], ["tile_rx", "sp", [-1, 1]], ["auto_unroll_max_step", "ot", 0], ["unroll_explicit", "ot", 1]]}, "result": [[0.016365937285714286], 0, 2.6532464027404785, 1638702058.8080072], "version": 0.2, "tvm_version": "0.9.dev0"}
{"input": ["rocm -keys=rocm,gpu -max_num_threads=256 -mcpu=gfx906 -mtriple=amdgcn-amd-amdhsa-hcc -thread_warp_size=64", "conv2d_nchw.cuda", [["TENSOR", [128, 1024, 14, 14], "float32"], ["TENSOR", [2048, 1024, 1, 1], "float32"], 2, 0, 1, "float32"], {}], "config": {"index": 14981, "code_hash": null, "entity": [["tile_f", "sp", [-1, 1, 64, 1]], ["tile_y", "sp", [-1, 7, 1, 1]], ["tile_x", "sp", [-1, 1, 7, 1]], ["tile_rc", "sp", [-1, 4]], ["tile_ry", "sp", [-1, 1]], ["tile_rx", "sp", [-1, 1]], ["auto_unroll_max_step", "ot", 0], ["unroll_explicit", "ot", 1]]}, "result": [[0.010698120799999999], 0, 2.6166975498199463, 1638702061.1151798], "version": 0.2, "tvm_version": "0.9.dev0"}
{"input": ["rocm -keys=rocm,gpu -max_num_threads=256 -mcpu=gfx906 -mtriple=amdgcn-amd-amdhsa-hcc -thread_warp_size=64", "conv2d_nchw.cuda", [["TENSOR", [128, 1024, 14, 14], "float32"], ["TENSOR", [2048, 1024, 1, 1], "float32"], 2, 0, 1, "float32"], {}], "config": {"index": 143181, "code_hash": null, "entity": [["tile_f", "sp", [-1, 1, 64, 2]], ["tile_y", "sp", [-1, 7, 1, 1]], ["tile_x", "sp", [-1, 1, 7, 1]], ["tile_rc", "sp", [-1, 4]], ["tile_ry", "sp", [-1, 1]], ["tile_rx", "sp", [-1, 1]], ["auto_unroll_max_step", "ot", 1500], ["unroll_explicit", "ot", 1]]}, "result": [[0.017590434999999998], 0, 2.841991424560547, 1638702063.4780593], "version": 0.2, "tvm_version": "0.9.dev0"}
{"input": ["rocm -keys=rocm,gpu -max_num_threads=256 -mcpu=gfx906 -mtriple=amdgcn-amd-amdhsa-hcc -thread_warp_size=64", "conv2d_nchw.cuda", [["TENSOR", [128, 1024, 14, 14], "float32"], ["TENSOR", [2048, 1024, 1, 1], "float32"], 2, 0, 1, "float32"], {}], "config": {"index": 4054, "code_hash": null, "entity": [["tile_f", "sp", [-1, 1, 32, 1]], ["tile_y", "sp", [-1, 1, 1, 7]], ["tile_x", "sp", [-1, 1, 7, 1]], ["tile_rc", "sp", [-1, 1]], ["tile_ry", "sp", [-1, 1]], ["tile_rx", "sp", [-1, 1]], ["auto_unroll_max_step", "ot", 0], ["unroll_explicit", "ot", 1]]}, "result": [[0.025325427999999997], 0, 2.541989803314209, 1638702065.685999], "version": 0.2, "tvm_version": "0.9.dev0"}
{"input": ["rocm -keys=rocm,gpu -max_num_threads=256 -mcpu=gfx906 -mtriple=amdgcn-amd-amdhsa-hcc -thread_warp_size=64", "conv2d_nchw.cuda", [["TENSOR", [128, 1024, 14, 14], "float32"], ["TENSOR", [2048, 1024, 1, 1], "float32"], 2, 0, 1, "float32"], {}], "config": {"index": 138014, "code_hash": null, "entity": [["tile_f", "sp", [-1, 2, 64, 1]], ["tile_y", "sp", [-1, 1, 1, 7]], ["tile_x", "sp", [-1, 1, 7, 1]], ["tile_rc", "sp", [-1, 2]], ["tile_ry", "sp", [-1, 1]], ["tile_rx", "sp", [-1, 1]], ["auto_unroll_max_step", "ot", 1500], ["unroll_explicit", "ot", 1]]}, "result": [[0.016565986571428572], 0, 2.6956255435943604, 1638702067.9986503], "version": 0.2, "tvm_version": "0.9.dev0"}
{"input": ["rocm -keys=rocm,gpu -max_num_threads=256 -mcpu=gfx906 -mtriple=amdgcn-amd-amdhsa-hcc -thread_warp_size=64", "conv2d_nchw.cuda", [["TENSOR", [128, 1024, 14, 14], "float32"], ["TENSOR", [2048, 1024, 1, 1], "float32"], 2, 0, 1, "float32"], {}], "config": {"index": 73950, "code_hash": null, "entity": [["tile_f", "sp", [-1, 2, 64, 1]], ["tile_y", "sp", [-1, 1, 1, 7]], ["tile_x", "sp", [-1, 1, 7, 1]], ["tile_rc", "sp", [-1, 2]], ["tile_ry", "sp", [-1, 1]], ["tile_rx", "sp", [-1, 1]], ["auto_unroll_max_step", "ot", 512], ["unroll_explicit", "ot", 1]]}, "result": [[0.01656769657142857], 0, 2.7186713218688965, 1638702070.3662064], "version": 0.2, "tvm_version": "0.9.dev0"}
{"input": ["rocm -keys=rocm,gpu -max_num_threads=256 -mcpu=gfx906 -mtriple=amdgcn-amd-amdhsa-hcc -thread_warp_size=64", "conv2d_nchw.cuda", [["TENSOR", [128, 1024, 14, 14], "float32"], ["TENSOR", [2048, 1024, 1, 1], "float32"], 2, 0, 1, "float32"], {}], "config": {"index": 138007, "code_hash": null, "entity": [["tile_f", "sp", [-1, 2, 32, 1]], ["tile_y", "sp", [-1, 1, 1, 7]], ["tile_x", "sp", [-1, 1, 7, 1]], ["tile_rc", "sp", [-1, 2]], ["tile_ry", "sp", [-1, 1]], ["tile_rx", "sp", [-1, 1]], ["auto_unroll_max_step", "ot", 1500], ["unroll_explicit", "ot", 1]]}, "result": [[0.020573451833333332], 0, 2.737379550933838, 1638702072.688089], "version": 0.2, "tvm_version": "0.9.dev0"}
{"input": ["rocm -keys=rocm,gpu -max_num_threads=256 -mcpu=gfx906 -mtriple=amdgcn-amd-amdhsa-hcc -thread_warp_size=64", "conv2d_nchw.cuda", [["TENSOR", [128, 1024, 14, 14], "float32"], ["TENSOR", [2048, 1024, 1, 1], "float32"], 2, 0, 1, "float32"], {}], "config": {"index": 73943, "code_hash": null, "entity": [["tile_f", "sp", [-1, 2, 32, 1]], ["tile_y", "sp", [-1, 1, 1, 7]], ["tile_x", "sp", [-1, 1, 7, 1]], ["tile_rc", "sp", [-1, 2]], ["tile_ry", "sp", [-1, 1]], ["tile_rx", "sp", [-1, 1]], ["auto_unroll_max_step", "ot", 512], ["unroll_explicit", "ot", 1]]}, "result": [[0.020293923666666668], 0, 2.652249813079834, 1638702074.9729347], "version": 0.2, "tvm_version": "0.9.dev0"}
{"input": ["rocm -keys=rocm,gpu -max_num_threads=256 -mcpu=gfx906 -mtriple=amdgcn-amd-amdhsa-hcc -thread_warp_size=64", "conv2d_nchw.cuda", [["TENSOR", [128, 1024, 14, 14], "float32"], ["TENSOR", [2048, 1024, 1, 1], "float32"], 2, 0, 1, "float32"], {}], "config": {"index": 73942, "code_hash": null, "entity": [["tile_f", "sp", [-1, 1, 32, 1]], ["tile_y", "sp", [-1, 1, 1, 7]], ["tile_x", "sp", [-1, 1, 7, 1]], ["tile_rc", "sp", [-1, 2]], ["tile_ry", "sp", [-1, 1]], ["tile_rx", "sp", [-1, 1]], ["auto_unroll_max_step", "ot", 512], ["unroll_explicit", "ot", 1]]}, "result": [[0.016594301428571427], 0, 2.7934839725494385, 1638702077.3733099], "version": 0.2, "tvm_version": "0.9.dev0"}
{"input": ["rocm -keys=rocm,gpu -max_num_threads=256 -mcpu=gfx906 -mtriple=amdgcn-amd-amdhsa-hcc -thread_warp_size=64", "conv2d_nchw.cuda", [["TENSOR", [128, 1024, 14, 14], "float32"], ["TENSOR", [2048, 1024, 1, 1], "float32"], 2, 0, 1, "float32"], {}], "config": {"index": 138006, "code_hash": null, "entity": [["tile_f", "sp", [-1, 1, 32, 1]], ["tile_y", "sp", [-1, 1, 1, 7]], ["tile_x", "sp", [-1, 1, 7, 1]], ["tile_rc", "sp", [-1, 2]], ["tile_ry", "sp", [-1, 1]], ["tile_rx", "sp", [-1, 1]], ["auto_unroll_max_step", "ot", 1500], ["unroll_explicit", "ot", 1]]}, "result": [[0.016630293571428572], 0, 2.665513277053833, 1638702079.6620834], "version": 0.2, "tvm_version": "0.9.dev0"}
{"input": ["rocm -keys=rocm,gpu -max_num_threads=256 -mcpu=gfx906 -mtriple=amdgcn-amd-amdhsa-hcc -thread_warp_size=64", "conv2d_nchw.cuda", [["TENSOR", [128, 1024, 14, 14], "float32"], ["TENSOR", [2048, 1024, 1, 1], "float32"], 2, 0, 1, "float32"], {}], "config": {"index": 5147, "code_hash": null, "entity": [["tile_f", "sp", [-1, 2, 32, 1]], ["tile_y", "sp", [-1, 1, 7, 1]], ["tile_x", "sp", [-1, 1, 1, 7]], ["tile_rc", "sp", [-1, 1]], ["tile_ry", "sp", [-1, 1]], ["tile_rx", "sp", [-1, 1]], ["auto_unroll_max_step", "ot", 0], ["unroll_explicit", "ot", 1]]}, "result": [[0.0327021635], 0, 2.754084825515747, 1638702082.0343068], "version": 0.2, "tvm_version": "0.9.dev0"}
{"input": ["rocm -keys=rocm,gpu -max_num_threads=256 -mcpu=gfx906 -mtriple=amdgcn-amd-amdhsa-hcc -thread_warp_size=64", "conv2d_nchw.cuda", [["TENSOR", [128, 1024, 14, 14], "float32"], ["TENSOR", [2048, 1024, 1, 1], "float32"], 2, 0, 1, "float32"], {}], "config": {"index": 10978, "code_hash": null, "entity": [["tile_f", "sp", [-1, 2, 64, 1]], ["tile_y", "sp", [-1, 1, 7, 1]], ["tile_x", "sp", [-1, 1, 1, 7]], ["tile_rc", "sp", [-1, 2]], ["tile_ry", "sp", [-1, 1]], ["tile_rx", "sp", [-1, 1]], ["auto_unroll_max_step", "ot", 0], ["unroll_explicit", "ot", 1]]}, "result": [[0.017956282166666667], 0, 2.595541477203369, 1638702084.3064384], "version": 0.2, "tvm_version": "0.9.dev0"}
{"input": ["rocm -keys=rocm,gpu -max_num_threads=256 -mcpu=gfx906 -mtriple=amdgcn-amd-amdhsa-hcc -thread_warp_size=64", "conv2d_nchw.cuda", [["TENSOR", [128, 1024, 14, 14], "float32"], ["TENSOR", [2048, 1024, 1, 1], "float32"], 2, 0, 1, "float32"], {}], "config": {"index": 137279, "code_hash": null, "entity": [["tile_f", "sp", [-1, 2, 32, 1]], ["tile_y", "sp", [-1, 7, 1, 1]], ["tile_x", "sp", [-1, 1, 7, 1]], ["tile_rc", "sp", [-1, 2]], ["tile_ry", "sp", [-1, 1]], ["tile_rx", "sp", [-1, 1]], ["auto_unroll_max_step", "ot", 1500], ["unroll_explicit", "ot", 1]]}, "result": [[0.020292268], 0, 2.7691617012023926, 1638702086.6995447], "version": 0.2, "tvm_version": "0.9.dev0"}
