artifacts/Table4/tvm/autotvm/conv/conv2d_128_42_83_83_42_1_1_1_0.log
{"input": ["rocm -keys=rocm,gpu -max_num_threads=256 -mcpu=gfx906 -mtriple=amdgcn-amd-amdhsa-hcc -thread_warp_size=64", "conv2d_nchw.cuda", [["TENSOR", [128, 42, 83, 83], "float32"], ["TENSOR", [42, 42, 1, 1], "float32"], 1, 0, 1, "float32"], {}], "config": {"index": 4924, "code_hash": null, "entity": [["tile_f", "sp", [-1, 1, 1, 21]], ["tile_y", "sp", [-1, 1, 1, 1]], ["tile_x", "sp", [-1, 1, 1, 83]], ["tile_rc", "sp", [-1, 7]], ["tile_ry", "sp", [-1, 1]], ["tile_rx", "sp", [-1, 1]], ["auto_unroll_max_step", "ot", 0], ["unroll_explicit", "ot", 1]]}, "result": [[0.57125421125], 0, 7.29796290397644, 1638567303.0026798], "version": 0.2, "tvm_version": "0.9.dev0"}
{"input": ["rocm -keys=rocm,gpu -max_num_threads=256 -mcpu=gfx906 -mtriple=amdgcn-amd-amdhsa-hcc -thread_warp_size=64", "conv2d_nchw.cuda", [["TENSOR", [128, 42, 83, 83], "float32"], ["TENSOR", [42, 42, 1, 1], "float32"], 1, 0, 1, "float32"], {}], "config": {"index": 7181, "code_hash": null, "entity": [["tile_f", "sp", [-1, 2, 3, 1]], ["tile_y", "sp", [-1, 1, 1, 1]], ["tile_x", "sp", [-1, 1, 1, 1]], ["tile_rc", "sp", [-1, 42]], ["tile_ry", "sp", [-1, 1]], ["tile_rx", "sp", [-1, 1]], ["auto_unroll_max_step", "ot", 0], ["unroll_explicit", "ot", 1]]}, "result": [[0.04975887675], 0, 3.7345592975616455, 1638567305.7899184], "version": 0.2, "tvm_version": "0.9.dev0"}
{"input": ["rocm -keys=rocm,gpu -max_num_threads=256 -mcpu=gfx906 -mtriple=amdgcn-amd-amdhsa-hcc -thread_warp_size=64", "conv2d_nchw.cuda", [["TENSOR", [128, 42, 83, 83], "float32"], ["TENSOR", [42, 42, 1, 1], "float32"], 1, 0, 1, "float32"], {}], "config": {"index": 18454, "code_hash": null, "entity": [["tile_f", "sp", [-1, 1, 14, 1]], ["tile_y", "sp", [-1, 1, 1, 1]], ["tile_x", "sp", [-1, 1, 1, 1]], ["tile_rc", "sp", [-1, 3]], ["tile_ry", "sp", [-1, 1]], ["tile_rx", "sp", [-1, 1]], ["auto_unroll_max_step", "ot", 1500], ["unroll_explicit", "ot", 1]]}, "result": [[0.039881111], 0, 3.3917646408081055, 1638567308.452257], "version": 0.2, "tvm_version": "0.9.dev0"}
{"input": ["rocm -keys=rocm,gpu -max_num_threads=256 -mcpu=gfx906 -mtriple=amdgcn-amd-amdhsa-hcc -thread_warp_size=64", "conv2d_nchw.cuda", [["TENSOR", [128, 42, 83, 83], "float32"], ["TENSOR", [42, 42, 1, 1], "float32"], 1, 0, 1, "float32"], {}], "config": {"index": 5284, "code_hash": null, "entity": [["tile_f", "sp", [-1, 1, 1, 3]], ["tile_y", "sp", [-1, 1, 83, 1]], ["tile_x", "sp", [-1, 1, 1, 1]], ["tile_rc", "sp", [-1, 14]], ["tile_ry", "sp", [-1, 1]], ["tile_rx", "sp", [-1, 1]], ["auto_unroll_max_step", "ot", 0], ["unroll_explicit", "ot", 1]]}, "result": [[0.021619056666666664], 0, 3.1864662170410156, 1638567311.0902796], "version": 0.2, "tvm_version": "0.9.dev0"}
{"input": ["rocm -keys=rocm,gpu -max_num_threads=256 -mcpu=gfx906 -mtriple=amdgcn-amd-amdhsa-hcc -thread_warp_size=64", "conv2d_nchw.cuda", [["TENSOR", [128, 42, 83, 83], "float32"], ["TENSOR", [42, 42, 1, 1], "float32"], 1, 0, 1, "float32"], {}], "config": {"index": 14619, "code_hash": null, "entity": [["tile_f", "sp", [-1, 1, 1, 2]], ["tile_y", "sp", [-1, 1, 1, 1]], ["tile_x", "sp", [-1, 83, 1, 1]], ["tile_rc", "sp", [-1, 21]], ["tile_ry", "sp", [-1, 1]], ["tile_rx", "sp", [-1, 1]], ["auto_unroll_max_step", "ot", 512], ["unroll_explicit", "ot", 1]]}, "result": [[1.0149508055], 0, 8.431063175201416, 1638567318.5546987], "version": 0.2, "tvm_version": "0.9.dev0"}
{"input": ["rocm -keys=rocm,gpu -max_num_threads=256 -mcpu=gfx906 -mtriple=amdgcn-amd-amdhsa-hcc -thread_warp_size=64", "conv2d_nchw.cuda", [["TENSOR", [128, 42, 83, 83], "float32"], ["TENSOR", [42, 42, 1, 1], "float32"], 1, 0, 1, "float32"], {}], "config": {"index": 1925, "code_hash": null, "entity": [["tile_f", "sp", [-1, 14, 1, 1]], ["tile_y", "sp", [-1, 1, 83, 1]], ["tile_x", "sp", [-1, 1, 1, 83]], ["tile_rc", "sp", [-1, 2]], ["tile_ry", "sp", [-1, 1]], ["tile_rx", "sp", [-1, 1]], ["auto_unroll_max_step", "ot", 0], ["unroll_explicit", "ot", 1]]}, "result": [[0.1288592985], 0, 3.5834906101226807, 1638567321.5743873], "version": 0.2, "tvm_version": "0.9.dev0"}
{"input": ["rocm -keys=rocm,gpu -max_num_threads=256 -mcpu=gfx906 -mtriple=amdgcn-amd-amdhsa-hcc -thread_warp_size=64", "conv2d_nchw.cuda", [["TENSOR", [128, 42, 83, 83], "float32"], ["TENSOR", [42, 42, 1, 1], "float32"], 1, 0, 1, "float32"], {}], "config": {"index": 4275, "code_hash": null, "entity": [["tile_f", "sp", [-1, 6, 1, 7]], ["tile_y", "sp", [-1, 1, 83, 1]], ["tile_x", "sp", [-1, 1, 1, 1]], ["tile_rc", "sp", [-1, 7]], ["tile_ry", "sp", [-1, 1]], ["tile_rx", "sp", [-1, 1]], ["auto_unroll_max_step", "ot", 0], ["unroll_explicit", "ot", 1]]}, "result": [[0.0255378245], 0, 3.592034339904785, 1638567324.0951493], "version": 0.2, "tvm_version": "0.9.dev0"}
{"input": ["rocm -keys=rocm,gpu -max_num_threads=256 -mcpu=gfx906 -mtriple=amdgcn-amd-amdhsa-hcc -thread_warp_size=64", "conv2d_nchw.cuda", [["TENSOR", [128, 42, 83, 83], "float32"], ["TENSOR", [42, 42, 1, 1], "float32"], 1, 0, 1, "float32"], {}], "config": {"index": 3228, "code_hash": null, "entity": [["tile_f", "sp", [-1, 3, 1, 2]], ["tile_y", "sp", [-1, 1, 83, 1]], ["tile_x", "sp", [-1, 1, 1, 1]], ["tile_rc", "sp", [-1, 6]], ["tile_ry", "sp", [-1, 1]], ["tile_rx", "sp", [-1, 1]], ["auto_unroll_max_step", "ot", 0], ["unroll_explicit", "ot", 1]]}, "result": [[0.0114006], 0, 2.9988207817077637, 1638567326.5719543], "version": 0.2, "tvm_version": "0.9.dev0"}
{"input": ["rocm -keys=rocm,gpu -max_num_threads=256 -mcpu=gfx906 -mtriple=amdgcn-amd-amdhsa-hcc -thread_warp_size=64", "conv2d_nchw.cuda", [["TENSOR", [128, 42, 83, 83], "float32"], ["TENSOR", [42, 42, 1, 1], "float32"], 1, 0, 1, "float32"], {}], "config": {"index": 16143, "code_hash": null, "entity": [["tile_f", "sp", [-1, 14, 3, 1]], ["tile_y", "sp", [-1, 1, 1, 1]], ["tile_x", "sp", [-1, 1, 1, 83]], ["tile_rc", "sp", [-1, 42]], ["tile_ry", "sp", [-1, 1]], ["tile_rx", "sp", [-1, 1]], ["auto_unroll_max_step", "ot", 512], ["unroll_explicit", "ot", 1]]}, "result": [[0.974505615], 0, 8.166022300720215, 1638567333.8410068], "version": 0.2, "tvm_version": "0.9.dev0"}
{"input": ["rocm -keys=rocm,gpu -max_num_threads=256 -mcpu=gfx906 -mtriple=amdgcn-amd-amdhsa-hcc -thread_warp_size=64", "conv2d_nchw.cuda", [["TENSOR", [128, 42, 83, 83], "float32"], ["TENSOR", [42, 42, 1, 1], "float32"], 1, 0, 1, "float32"], {}], "config": {"index": 4157, "code_hash": null, "entity": [["tile_f", "sp", [-1, 2, 1, 21]], ["tile_y", "sp", [-1, 1, 1, 1]], ["tile_x", "sp", [-1, 1, 1, 1]], ["tile_rc", "sp", [-1, 7]], ["tile_ry", "sp", [-1, 1]], ["tile_rx", "sp", [-1, 1]], ["auto_unroll_max_step", "ot", 0], ["unroll_explicit", "ot", 1]]}, "result": [[0.53632623275], 0, 5.798027992248535, 1638567338.7768118], "version": 0.2, "tvm_version": "0.9.dev0"}
{"input": ["rocm -keys=rocm,gpu -max_num_threads=256 -mcpu=gfx906 -mtriple=amdgcn-amd-amdhsa-hcc -thread_warp_size=64", "conv2d_nchw.cuda", [["TENSOR", [128, 42, 83, 83], "float32"], ["TENSOR", [42, 42, 1, 1], "float32"], 1, 0, 1, "float32"], {}], "config": {"index": 6144, "code_hash": null, "entity": [["tile_f", "sp", [-1, 1, 1, 1]], ["tile_y", "sp", [-1, 1, 1, 1]], ["tile_x", "sp", [-1, 1, 1, 1]], ["tile_rc", "sp", [-1, 21]], ["tile_ry", "sp", [-1, 1]], ["tile_rx", "sp", [-1, 1]], ["auto_unroll_max_step", "ot", 0], ["unroll_explicit", "ot", 1]]}, "result": [[0.15432330300000002], 0, 3.728422164916992, 1638567341.9196908], "version": 0.2, "tvm_version": "0.9.dev0"}
{"input": ["rocm -keys=rocm,gpu -max_num_threads=256 -mcpu=gfx906 -mtriple=amdgcn-amd-amdhsa-hcc -thread_warp_size=64", "conv2d_nchw.cuda", [["TENSOR", [128, 42, 83, 83], "float32"], ["TENSOR", [42, 42, 1, 1], "float32"], 1, 0, 1, "float32"], {}], "config": {"index": 6399, "code_hash": null, "entity": [["tile_f", "sp", [-1, 1, 1, 42]], ["tile_y", "sp", [-1, 1, 1, 83]], ["tile_x", "sp", [-1, 1, 1, 1]], ["tile_rc", "sp", [-1, 21]], ["tile_ry", "sp", [-1, 1]], ["tile_rx", "sp", [-1, 1]], ["auto_unroll_max_step", "ot", 0], ["unroll_explicit", "ot", 1]]}, "result": [[0.68152325425], 0, 6.122639179229736, 1638567347.646279], "version": 0.2, "tvm_version": "0.9.dev0"}
{"input": ["rocm -keys=rocm,gpu -max_num_threads=256 -mcpu=gfx906 -mtriple=amdgcn-amd-amdhsa-hcc -thread_warp_size=64", "conv2d_nchw.cuda", [["TENSOR", [128, 42, 83, 83], "float32"], ["TENSOR", [42, 42, 1, 1], "float32"], 1, 0, 1, "float32"], {}], "config": {"index": 17685, "code_hash": null, "entity": [["tile_f", "sp", [-1, 6, 7, 1]], ["tile_y", "sp", [-1, 1, 1, 1]], ["tile_x", "sp", [-1, 83, 1, 1]], ["tile_rc", "sp", [-1, 2]], ["tile_ry", "sp", [-1, 1]], ["tile_rx", "sp", [-1, 1]], ["auto_unroll_max_step", "ot", 1500], ["unroll_explicit", "ot", 1]]}, "result": [[0.17491767875], 0, 6.976699590682983, 1638567351.0867975], "version": 0.2, "tvm_version": "0.9.dev0"}
{"input": ["rocm -keys=rocm,gpu -max_num_threads=256 -mcpu=gfx906 -mtriple=amdgcn-amd-amdhsa-hcc -thread_warp_size=64", "conv2d_nchw.cuda", [["TENSOR", [128, 42, 83, 83], "float32"], ["TENSOR", [42, 42, 1, 1], "float32"], 1, 0, 1, "float32"], {}], "config": {"index": 566, "code_hash": null, "entity": [["tile_f", "sp", [-1, 1, 3, 7]], ["tile_y", "sp", [-1, 1, 1, 1]], ["tile_x", "sp", [-1, 1, 83, 1]], ["tile_rc", "sp", [-1, 1]], ["tile_ry", "sp", [-1, 1]], ["tile_rx", "sp", [-1, 1]], ["auto_unroll_max_step", "ot", 0], ["unroll_explicit", "ot", 1]]}, "result": [[0.0017541500238095237], 0, 3.8497164249420166, 1638567354.5825286], "version": 0.2, "tvm_version": "0.9.dev0"}
{"input": ["rocm -keys=rocm,gpu -max_num_threads=256 -mcpu=gfx906 -mtriple=amdgcn-amd-amdhsa-hcc -thread_warp_size=64", "conv2d_nchw.cuda", [["TENSOR", [128, 42, 83, 83], "float32"], ["TENSOR", [42, 42, 1, 1], "float32"], 1, 0, 1, "float32"], {}], "config": {"index": 10428, "code_hash": null, "entity": [["tile_f", "sp", [-1, 1, 1, 21]], ["tile_y", "sp", [-1, 1, 83, 1]], ["tile_x", "sp", [-1, 1, 1, 1]], ["tile_rc", "sp", [-1, 3]], ["tile_ry", "sp", [-1, 1]], ["tile_rx", "sp", [-1, 1]], ["auto_unroll_max_step", "ot", 512], ["unroll_explicit", "ot", 1]]}, "result": [[0.004526595171428572], 0, 3.8200597763061523, 1638567358.0601845], "version": 0.2, "tvm_version": "0.9.dev0"}
{"input": ["rocm -keys=rocm,gpu -max_num_threads=256 -mcpu=gfx906 -mtriple=amdgcn-amd-amdhsa-hcc -thread_warp_size=64", "conv2d_nchw.cuda", [["TENSOR", [128, 42, 83, 83], "float32"], ["TENSOR", [42, 42, 1, 1], "float32"], 1, 0, 1, "float32"], {}], "config": {"index": 9580, "code_hash": null, "entity": [["tile_f", "sp", [-1, 1, 14, 3]], ["tile_y", "sp", [-1, 83, 1, 1]], ["tile_x", "sp", [-1, 83, 1, 1]], ["tile_rc", "sp", [-1, 2]], ["tile_ry", "sp", [-1, 1]], ["tile_rx", "sp", [-1, 1]], ["auto_unroll_max_step", "ot", 512], ["unroll_explicit", "ot", 1]]}, "result": [[0.89547296125], 0, 9.487222671508789, 1638567365.5703855], "version": 0.2, "tvm_version": "0.9.dev0"}
{"input": ["rocm -keys=rocm,gpu -max_num_threads=256 -mcpu=gfx906 -mtriple=amdgcn-amd-amdhsa-hcc -thread_warp_size=64", "conv2d_nchw.cuda", [["TENSOR", [128, 42, 83, 83], "float32"], ["TENSOR", [42, 42, 1, 1], "float32"], 1, 0, 1, "float32"], {}], "config": {"index": 10050, "code_hash": null, "entity": [["tile_f", "sp", [-1, 3, 1, 1]], ["tile_y", "sp", [-1, 83, 1, 1]], ["tile_x", "sp", [-1, 1, 1, 83]], ["tile_rc", "sp", [-1, 2]], ["tile_ry", "sp", [-1, 1]], ["tile_rx", "sp", [-1, 1]], ["auto_unroll_max_step", "ot", 512], ["unroll_explicit", "ot", 1]]}, "result": [[6.75308154275], 0, 39.947181940078735, 1638567402.5175765], "version": 0.2, "tvm_version": "0.9.dev0"}
{"input": ["rocm -keys=rocm,gpu -max_num_threads=256 -mcpu=gfx906 -mtriple=amdgcn-amd-amdhsa-hcc -thread_warp_size=64", "conv2d_nchw.cuda", [["TENSOR", [128, 42, 83, 83], "float32"], ["TENSOR", [42, 42, 1, 1], "float32"], 1, 0, 1, "float32"], {}], "config": {"index": 16696, "code_hash": null, "entity": [["tile_f", "sp", [-1, 1, 6, 7]], ["tile_y", "sp", [-1, 1, 1, 1]], ["tile_x", "sp", [-1, 83, 1, 1]], ["tile_rc", "sp", [-1, 1]], ["tile_ry", "sp", [-1, 1]], ["tile_rx", "sp", [-1, 1]], ["auto_unroll_max_step", "ot", 1500], ["unroll_explicit", "ot", 1]]}, "result": [[0.18207952875], 0, 8.77055311203003, 1638567406.4822648], "version": 0.2, "tvm_version": "0.9.dev0"}
{"input": ["rocm -keys=rocm,gpu -max_num_threads=256 -mcpu=gfx906 -mtriple=amdgcn-amd-amdhsa-hcc -thread_warp_size=64", "conv2d_nchw.cuda", [["TENSOR", [128, 42, 83, 83], "float32"], ["TENSOR", [42, 42, 1, 1], "float32"], 1, 0, 1, "float32"], {}], "config": {"index": 12407, "code_hash": null, "entity": [["tile_f", "sp", [-1, 2, 3, 7]], ["tile_y", "sp", [-1, 83, 1, 1]], ["tile_x", "sp", [-1, 1, 1, 1]], ["tile_rc", "sp", [-1, 7]], ["tile_ry", "sp", [-1, 1]], ["tile_rx", "sp", [-1, 1]], ["auto_unroll_max_step", "ot", 512], ["unroll_explicit", "ot", 1]]}, "result": [[0.24391447425], 0, 5.832264184951782, 1638567410.0391574], "version": 0.2, "tvm_version": "0.9.dev0"}
{"input": ["rocm -keys=rocm,gpu -max_num_threads=256 -mcpu=gfx906 -mtriple=amdgcn-amd-amdhsa-hcc -thread_warp_size=64", "conv2d_nchw.cuda", [["TENSOR", [128, 42, 83, 83], "float32"], ["TENSOR", [42, 42, 1, 1], "float32"], 1, 0, 1, "float32"], {}], "config": {"index": 22335, "code_hash": null, "entity": [["tile_f", "sp", [-1, 1, 1, 42]], ["tile_y", "sp", [-1, 1, 1, 1]], ["tile_x", "sp", [-1, 1, 1, 83]], ["tile_rc", "sp", [-1, 14]], ["tile_ry", "sp", [-1, 1]], ["tile_rx", "sp", [-1, 1]], ["auto_unroll_max_step", "ot", 1500], ["unroll_explicit", "ot", 1]]}, "result": [[1.0414378659999999], 0, 13.250584840774536, 1638567417.5890667], "version": 0.2, "tvm_version": "0.9.dev0"}
{"input": ["rocm -keys=rocm,gpu -max_num_threads=256 -mcpu=gfx906 -mtriple=amdgcn-amd-amdhsa-hcc -thread_warp_size=64", "conv2d_nchw.cuda", [["TENSOR", [128, 42, 83, 83], "float32"], ["TENSOR", [42, 42, 1, 1], "float32"], 1, 0, 1, "float32"], {}], "config": {"index": 12345, "code_hash": null, "entity": [["tile_f", "sp", [-1, 1, 1, 14]], ["tile_y", "sp", [-1, 1, 1, 1]], ["tile_x", "sp", [-1, 1, 1, 1]], ["tile_rc", "sp", [-1, 7]], ["tile_ry", "sp", [-1, 1]], ["tile_rx", "sp", [-1, 1]], ["auto_unroll_max_step", "ot", 512], ["unroll_explicit", "ot", 1]]}, "result": [[0.0976400985], 0, 3.3561558723449707, 1638567420.4605496], "version": 0.2, "tvm_version": "0.9.dev0"}
{"input": ["rocm -keys=rocm,gpu -max_num_threads=256 -mcpu=gfx906 -mtriple=amdgcn-amd-amdhsa-hcc -thread_warp_size=64", "conv2d_nchw.cuda", [["TENSOR", [128, 42, 83, 83], "float32"], ["TENSOR", [42, 42, 1, 1], "float32"], 1, 0, 1, "float32"], {}], "config": {"index": 8712, "code_hash": null, "entity": [["tile_f", "sp", [-1, 1, 2, 1]], ["tile_y", "sp", [-1, 1, 1, 1]], ["tile_x", "sp", [-1, 1, 83, 1]], ["tile_rc", "sp", [-1, 1]], ["tile_ry", "sp", [-1, 1]], ["tile_rx", "sp", [-1, 1]], ["auto_unroll_max_step", "ot", 512], ["unroll_explicit", "ot", 1]]}, "result": [[0.034674217], 0, 3.1087560653686523, 1638567422.928959], "version": 0.2, "tvm_version": "0.9.dev0"}
{"input": ["rocm -keys=rocm,gpu -max_num_threads=256 -mcpu=gfx906 -mtriple=amdgcn-amd-amdhsa-hcc -thread_warp_size=64", "conv2d_nchw.cuda", [["TENSOR", [128, 42, 83, 83], "float32"], ["TENSOR", [42, 42, 1, 1], "float32"], 1, 0, 1, "float32"], {}], "config": {"index": 16137, "code_hash": null, "entity": [["tile_f", "sp", [-1, 3, 2, 1]], ["tile_y", "sp", [-1, 1, 1, 1]], ["tile_x", "sp", [-1, 1, 1, 83]], ["tile_rc", "sp", [-1, 42]], ["tile_ry", "sp", [-1, 1]], ["tile_rx", "sp", [-1, 1]], ["auto_unroll_max_step", "ot", 512], ["unroll_explicit", "ot", 1]]}, "result": [[2.1822575682500003], 0, 14.65248441696167, 1638567436.264208], "version": 0.2, "tvm_version": "0.9.dev0"}
{"input": ["rocm -keys=rocm,gpu -max_num_threads=256 -mcpu=gfx906 -mtriple=amdgcn-amd-amdhsa-hcc -thread_warp_size=64", "conv2d_nchw.cuda", [["TENSOR", [128, 42, 83, 83], "float32"], ["TENSOR", [42, 42, 1, 1], "float32"], 1, 0, 1, "float32"], {}], "config": {"index": 10556, "code_hash": null, "entity": [["tile_f", "sp", [-1, 1, 1, 21]], ["tile_y", "sp", [-1, 1, 1, 1]], ["tile_x", "sp", [-1, 83, 1, 1]], ["tile_rc", "sp", [-1, 3]], ["tile_ry", "sp", [-1, 1]], ["tile_rx", "sp", [-1, 1]], ["auto_unroll_max_step", "ot", 512], ["unroll_explicit", "ot", 1]]}, "result": [[0.7833816527499999], 0, 7.6638031005859375, 1638567442.528079], "version": 0.2, "tvm_version": "0.9.dev0"}
{"input": ["rocm -keys=rocm,gpu -max_num_threads=256 -mcpu=gfx906 -mtriple=amdgcn-amd-amdhsa-hcc -thread_warp_size=64", "conv2d_nchw.cuda", [["TENSOR", [128, 42, 83, 83], "float32"], ["TENSOR", [42, 42, 1, 1], "float32"], 1, 0, 1, "float32"], {}], "config": {"index": 1785, "code_hash": null, "entity": [["tile_f", "sp", [-1, 1, 1, 14]], ["tile_y", "sp", [-1, 1, 1, 83]], ["tile_x", "sp", [-1, 1, 83, 1]], ["tile_rc", "sp", [-1, 2]], ["tile_ry", "sp", [-1, 1]], ["tile_rx", "sp", [-1, 1]], ["auto_unroll_max_step", "ot", 0], ["unroll_explicit", "ot", 1]]}, "result": [[0.05588027550000001], 0, 3.8529345989227295, 1638567455.1403415], "version": 0.2, "tvm_version": "0.9.dev0"}
{"input": ["rocm -keys=rocm,gpu -max_num_threads=256 -mcpu=gfx906 -mtriple=amdgcn-amd-amdhsa-hcc -thread_warp_size=64", "conv2d_nchw.cuda", [["TENSOR", [128, 42, 83, 83], "float32"], ["TENSOR", [42, 42, 1, 1], "float32"], 1, 0, 1, "float32"], {}], "config": {"index": 12071, "code_hash": null, "entity": [["tile_f", "sp", [-1, 14, 1, 3]], ["tile_y", "sp", [-1, 1, 1, 1]], ["tile_x", "sp", [-1, 1, 1, 83]], ["tile_rc", "sp", [-1, 6]], ["tile_ry", "sp", [-1, 1]], ["tile_rx", "sp", [-1, 1]], ["auto_unroll_max_step", "ot", 512], ["unroll_explicit", "ot", 1]]}, "result": [[0.8042896727500001], 0, 7.975882530212402, 1638567461.519593], "version": 0.2, "tvm_version": "0.9.dev0"}
{"input": ["rocm -keys=rocm,gpu -max_num_threads=256 -mcpu=gfx906 -mtriple=amdgcn-amd-amdhsa-hcc -thread_warp_size=64", "conv2d_nchw.cuda", [["TENSOR", [128, 42, 83, 83], "float32"], ["TENSOR", [42, 42, 1, 1], "float32"], 1, 0, 1, "float32"], {}], "config": {"index": 17683, "code_hash": null, "entity": [["tile_f", "sp", [-1, 2, 7, 1]], ["tile_y", "sp", [-1, 1, 1, 1]], ["tile_x", "sp", [-1, 83, 1, 1]], ["tile_rc", "sp", [-1, 2]], ["tile_ry", "sp", [-1, 1]], ["tile_rx", "sp", [-1, 1]], ["auto_unroll_max_step", "ot", 1500], ["unroll_explicit", "ot", 1]]}, "result": [[0.23106135549999998], 0, 4.920514822006226, 1638567465.0117915], "version": 0.2, "tvm_version": "0.9.dev0"}
{"input": ["rocm -keys=rocm,gpu -max_num_threads=256 -mcpu=gfx906 -mtriple=amdgcn-amd-amdhsa-hcc -thread_warp_size=64", "conv2d_nchw.cuda", [["TENSOR", [128, 42, 83, 83], "float32"], ["TENSOR", [42, 42, 1, 1], "float32"], 1, 0, 1, "float32"], {}], "config": {"index": 15639, "code_hash": null, "entity": [["tile_f", "sp", [-1, 3, 14, 1]], ["tile_y", "sp", [-1, 1, 1, 1]], ["tile_x", "sp", [-1, 83, 1, 1]], ["tile_rc", "sp", [-1, 42]], ["tile_ry", "sp", [-1, 1]], ["tile_rx", "sp", [-1, 1]], ["auto_unroll_max_step", "ot", 512], ["unroll_explicit", "ot", 1]]}, "result": [[0.270588043], 0, 5.075308799743652, 1638567468.65341], "version": 0.2, "tvm_version": "0.9.dev0"}
{"input": ["rocm -keys=rocm,gpu -max_num_threads=256 -mcpu=gfx906 -mtriple=amdgcn-amd-amdhsa-hcc -thread_warp_size=64", "conv2d_nchw.cuda", [["TENSOR", [128, 42, 83, 83], "float32"], ["TENSOR", [42, 42, 1, 1], "float32"], 1, 0, 1, "float32"], {}], "config": {"index": 13474, "code_hash": null, "entity": [["tile_f", "sp", [-1, 3, 7, 2]], ["tile_y", "sp", [-1, 1, 83, 1]], ["tile_x", "sp", [-1, 1, 1, 1]], ["tile_rc", "sp", [-1, 14]], ["tile_ry", "sp", [-1, 1]], ["tile_rx", "sp", [-1, 1]], ["auto_unroll_max_step", "ot", 512], ["unroll_explicit", "ot", 1]]}, "result": [[0.019022687166666667], 0, 3.182683229446411, 1638567471.208268], "version": 0.2, "tvm_version": "0.9.dev0"}
{"input": ["rocm -keys=rocm,gpu -max_num_threads=256 -mcpu=gfx906 -mtriple=amdgcn-amd-amdhsa-hcc -thread_warp_size=64", "conv2d_nchw.cuda", [["TENSOR", [128, 42, 83, 83], "float32"], ["TENSOR", [42, 42, 1, 1], "float32"], 1, 0, 1, "float32"], {}], "config": {"index": 4272, "code_hash": null, "entity": [["tile_f", "sp", [-1, 1, 1, 7]], ["tile_y", "sp", [-1, 1, 83, 1]], ["tile_x", "sp", [-1, 1, 1, 1]], ["tile_rc", "sp", [-1, 7]], ["tile_ry", "sp", [-1, 1]], ["tile_rx", "sp", [-1, 1]], ["auto_unroll_max_step", "ot", 0], ["unroll_explicit", "ot", 1]]}, "result": [[0.010020256], 0, 2.952406406402588, 1638567476.473898], "version": 0.2, "tvm_version": "0.9.dev0"}
{"input": ["rocm -keys=rocm,gpu -max_num_threads=256 -mcpu=gfx906 -mtriple=amdgcn-amd-amdhsa-hcc -thread_warp_size=64", "conv2d_nchw.cuda", [["TENSOR", [128, 42, 83, 83], "float32"], ["TENSOR", [42, 42, 1, 1], "float32"], 1, 0, 1, "float32"], {}], "config": {"index": 9303, "code_hash": null, "entity": [["tile_f", "sp", [-1, 3, 14, 1]], ["tile_y", "sp", [-1, 83, 1, 1]], ["tile_x", "sp", [-1, 1, 1, 1]], ["tile_rc", "sp", [-1, 2]], ["tile_ry", "sp", [-1, 1]], ["tile_rx", "sp", [-1, 1]], ["auto_unroll_max_step", "ot", 512], ["unroll_explicit", "ot", 1]]}, "result": [[0.0981861265], 0, 4.124891042709351, 1638567479.3252037], "version": 0.2, "tvm_version": "0.9.dev0"}
{"input": ["rocm -keys=rocm,gpu -max_num_threads=256 -mcpu=gfx906 -mtriple=amdgcn-amd-amdhsa-hcc -thread_warp_size=64", "conv2d_nchw.cuda", [["TENSOR", [128, 42, 83, 83], "float32"], ["TENSOR", [42, 42, 1, 1], "float32"], 1, 0, 1, "float32"], {}], "config": {"index": 2874, "code_hash": null, "entity": [["tile_f", "sp", [-1, 3, 1, 14]], ["tile_y", "sp", [-1, 1, 1, 1]], ["tile_x", "sp", [-1, 1, 1, 83]], ["tile_rc", "sp", [-1, 3]], ["tile_ry", "sp", [-1, 1]], ["tile_rx", "sp", [-1, 1]], ["auto_unroll_max_step", "ot", 0], ["unroll_explicit", "ot", 1]]}, "result": [[0.58387396225], 0, 5.876899719238281, 1638567484.574689], "version": 0.2, "tvm_version": "0.9.dev0"}
{"input": ["rocm -keys=rocm,gpu -max_num_threads=256 -mcpu=gfx906 -mtriple=amdgcn-amd-amdhsa-hcc -thread_warp_size=64", "conv2d_nchw.cuda", [["TENSOR", [128, 42, 83, 83], "float32"], ["TENSOR", [42, 42, 1, 1], "float32"], 1, 0, 1, "float32"], {}], "config": {"index": 22307, "code_hash": null, "entity": [["tile_f", "sp", [-1, 1, 21, 2]], ["tile_y", "sp", [-1, 1, 1, 1]], ["tile_x", "sp", [-1, 1, 1, 83]], ["tile_rc", "sp", [-1, 14]], ["tile_ry", "sp", [-1, 1]], ["tile_rx", "sp", [-1, 1]], ["auto_unroll_max_step", "ot", 1500], ["unroll_explicit", "ot", 1]]}, "result": [[0.1444427795], 0, 4.386396408081055, 1638567487.9766152], "version": 0.2, "tvm_version": "0.9.dev0"}
{"input": ["rocm -keys=rocm,gpu -max_num_threads=256 -mcpu=gfx906 -mtriple=amdgcn-amd-amdhsa-hcc -thread_warp_size=64", "conv2d_nchw.cuda", [["TENSOR", [128, 42, 83, 83], "float32"], ["TENSOR", [42, 42, 1, 1], "float32"], 1, 0, 1, "float32"], {}], "config": {"index": 3236, "code_hash": null, "entity": [["tile_f", "sp", [-1, 1, 1, 3]], ["tile_y", "sp", [-1, 1, 83, 1]], ["tile_x", "sp", [-1, 1, 1, 1]], ["tile_rc", "sp", [-1, 6]], ["tile_ry", "sp", [-1, 1]], ["tile_rx", "sp", [-1, 1]], ["auto_unroll_max_step", "ot", 0], ["unroll_explicit", "ot", 1]]}, "result": [[0.03175050925], 0, 3.5982747077941895, 1638567491.2418764], "version": 0.2, "tvm_version": "0.9.dev0"}
{"input": ["rocm -keys=rocm,gpu -max_num_threads=256 -mcpu=gfx906 -mtriple=amdgcn-amd-amdhsa-hcc -thread_warp_size=64", "conv2d_nchw.cuda", [["TENSOR", [128, 42, 83, 83], "float32"], ["TENSOR", [42, 42, 1, 1], "float32"], 1, 0, 1, "float32"], {}], "config": {"index": 8237, "code_hash": null, "entity": [["tile_f", "sp", [-1, 1, 1, 6]], ["tile_y", "sp", [-1, 1, 1, 1]], ["tile_x", "sp", [-1, 1, 1, 1]], ["tile_rc", "sp", [-1, 1]], ["tile_ry", "sp", [-1, 1]], ["tile_rx", "sp", [-1, 1]], ["auto_unroll_max_step", "ot", 512], ["unroll_explicit", "ot", 1]]}, "result": [[0.0905421675], 0, 3.729238986968994, 1638567494.7999074], "version": 0.2, "tvm_version": "0.9.dev0"}
{"input": ["rocm -keys=rocm,gpu -max_num_threads=256 -mcpu=gfx906 -mtriple=amdgcn-amd-amdhsa-hcc -thread_warp_size=64", "conv2d_nchw.cuda", [["TENSOR", [128, 42, 83, 83], "float32"], ["TENSOR", [42, 42, 1, 1], "float32"], 1, 0, 1, "float32"], {}], "config": {"index": 4896, "code_hash": null, "entity": [["tile_f", "sp", [-1, 7, 3, 2]], ["tile_y", "sp", [-1, 1, 1, 1]], ["tile_x", "sp", [-1, 1, 1, 83]], ["tile_rc", "sp", [-1, 7]], ["tile_ry", "sp", [-1, 1]], ["tile_rx", "sp", [-1, 1]], ["auto_unroll_max_step", "ot", 0], ["unroll_explicit", "ot", 1]]}, "result": [[0.24671095275], 0, 5.019608736038208, 1638567499.1414216], "version": 0.2, "tvm_version": "0.9.dev0"}
{"input": ["rocm -keys=rocm,gpu -max_num_threads=256 -mcpu=gfx906 -mtriple=amdgcn-amd-amdhsa-hcc -thread_warp_size=64", "conv2d_nchw.cuda", [["TENSOR", [128, 42, 83, 83], "float32"], ["TENSOR", [42, 42, 1, 1], "float32"], 1, 0, 1, "float32"], {}], "config": {"index": 16727, "code_hash": null, "entity": [["tile_f", "sp", [-1, 3, 14, 1]], ["tile_y", "sp", [-1, 83, 1, 1]], ["tile_x", "sp", [-1, 83, 1, 1]], ["tile_rc", "sp", [-1, 1]], ["tile_ry", "sp", [-1, 1]], ["tile_rx", "sp", [-1, 1]], ["auto_unroll_max_step", "ot", 1500], ["unroll_explicit", "ot", 1]]}, "result": [[0.0284693775], 0, 7.035622835159302, 1638567503.1128826], "version": 0.2, "tvm_version": "0.9.dev0"}
{"input": ["rocm -keys=rocm,gpu -max_num_threads=256 -mcpu=gfx906 -mtriple=amdgcn-amd-amdhsa-hcc -thread_warp_size=64", "conv2d_nchw.cuda", [["TENSOR", [128, 42, 83, 83], "float32"], ["TENSOR", [42, 42, 1, 1], "float32"], 1, 0, 1, "float32"], {}], "config": {"index": 20617, "code_hash": null, "entity": [["tile_f", "sp", [-1, 3, 2, 1]], ["tile_y", "sp", [-1, 1, 83, 1]], ["tile_x", "sp", [-1, 1, 1, 1]], ["tile_rc", "sp", [-1, 7]], ["tile_ry", "sp", [-1, 1]], ["tile_rx", "sp", [-1, 1]], ["auto_unroll_max_step", "ot", 1500], ["unroll_explicit", "ot", 1]]}, "result": [[0.02122418333333333], 0, 3.1555979251861572, 1638567505.7975461], "version": 0.2, "tvm_version": "0.9.dev0"}
{"input": ["rocm -keys=rocm,gpu -max_num_threads=256 -mcpu=gfx906 -mtriple=amdgcn-amd-amdhsa-hcc -thread_warp_size=64", "conv2d_nchw.cuda", [["TENSOR", [128, 42, 83, 83], "float32"], ["TENSOR", [42, 42, 1, 1], "float32"], 1, 0, 1, "float32"], {}], "config": {"index": 21601, "code_hash": null, "entity": [["tile_f", "sp", [-1, 1, 7, 2]], ["tile_y", "sp", [-1, 83, 1, 1]], ["tile_x", "sp", [-1, 1, 1, 1]], ["tile_rc", "sp", [-1, 14]], ["tile_ry", "sp", [-1, 1]], ["tile_rx", "sp", [-1, 1]], ["auto_unroll_max_step", "ot", 1500], ["unroll_explicit", "ot", 1]]}, "result": [[0.113212013], 0, 3.793778419494629, 1638567508.7096748], "version": 0.2, "tvm_version": "0.9.dev0"}
{"input": ["rocm -keys=rocm,gpu -max_num_threads=256 -mcpu=gfx906 -mtriple=amdgcn-amd-amdhsa-hcc -thread_warp_size=64", "conv2d_nchw.cuda", [["TENSOR", [128, 42, 83, 83], "float32"], ["TENSOR", [42, 42, 1, 1], "float32"], 1, 0, 1, "float32"], {}], "config": {"index": 4373, "code_hash": null, "entity": [["tile_f", "sp", [-1, 6, 7, 1]], ["tile_y", "sp", [-1, 1, 1, 1]], ["tile_x", "sp", [-1, 83, 1, 1]], ["tile_rc", "sp", [-1, 7]], ["tile_ry", "sp", [-1, 1]], ["tile_rx", "sp", [-1, 1]], ["auto_unroll_max_step", "ot", 0], ["unroll_explicit", "ot", 1]]}, "result": [[0.10419607525], 0, 3.5995893478393555, 1638567511.635287], "version": 0.2, "tvm_version": "0.9.dev0"}
{"input": ["rocm -keys=rocm,gpu -max_num_threads=256 -mcpu=gfx906 -mtriple=amdgcn-amd-amdhsa-hcc -thread_warp_size=64", "conv2d_nchw.cuda", [["TENSOR", [128, 42, 83, 83], "float32"], ["TENSOR", [42, 42, 1, 1], "float32"], 1, 0, 1, "float32"], {}], "config": {"index": 17102, "code_hash": null, "entity": [["tile_f", "sp", [-1, 7, 3, 1]], ["tile_y", "sp", [-1, 1, 1, 83]], ["tile_x", "sp", [-1, 1, 83, 1]], ["tile_rc", "sp", [-1, 1]], ["tile_ry", "sp", [-1, 1]], ["tile_rx", "sp", [-1, 1]], ["auto_unroll_max_step", "ot", 1500], ["unroll_explicit", "ot", 1]]}, "result": [[0.08787528224999999], 0, 10.093717336654663, 1638567514.4141772], "version": 0.2, "tvm_version": "0.9.dev0"}
{"input": ["rocm -keys=rocm,gpu -max_num_threads=256 -mcpu=gfx906 -mtriple=amdgcn-amd-amdhsa-hcc -thread_warp_size=64", "conv2d_nchw.cuda", [["TENSOR", [128, 42, 83, 83], "float32"], ["TENSOR", [42, 42, 1, 1], "float32"], 1, 0, 1, "float32"], {}], "config": {"index": 58, "code_hash": null, "entity": [["tile_f", "sp", [-1, 3, 1, 14]], ["tile_y", "sp", [-1, 1, 1, 1]], ["tile_x", "sp", [-1, 1, 1, 1]], ["tile_rc", "sp", [-1, 1]], ["tile_ry", "sp", [-1, 1]], ["tile_rx", "sp", [-1, 1]], ["auto_unroll_max_step", "ot", 0], ["unroll_explicit", "ot", 1]]}, "result": [[0.086626007], 0, 3.3338522911071777, 1638567517.2218218], "version": 0.2, "tvm_version": "0.9.dev0"}
{"input": ["rocm -keys=rocm,gpu -max_num_threads=256 -mcpu=gfx906 -mtriple=amdgcn-amd-amdhsa-hcc -thread_warp_size=64", "conv2d_nchw.cuda", [["TENSOR", [128, 42, 83, 83], "float32"], ["TENSOR", [42, 42, 1, 1], "float32"], 1, 0, 1, "float32"], {}], "config": {"index": 11554, "code_hash": null, "entity": [["tile_f", "sp", [-1, 3, 7, 2]], ["tile_y", "sp", [-1, 1, 1, 1]], ["tile_x", "sp", [-1, 83, 1, 1]], ["tile_rc", "sp", [-1, 6]], ["tile_ry", "sp", [-1, 1]], ["tile_rx", "sp", [-1, 1]], ["auto_unroll_max_step", "ot", 512], ["unroll_explicit", "ot", 1]]}, "result": [[0.32224130225], 0, 6.8336286544799805, 1638567521.17393], "version": 0.2, "tvm_version": "0.9.dev0"}
{"input": ["rocm -keys=rocm,gpu -max_num_threads=256 -mcpu=gfx906 -mtriple=amdgcn-amd-amdhsa-hcc -thread_warp_size=64", "conv2d_nchw.cuda", [["TENSOR", [128, 42, 83, 83], "float32"], ["TENSOR", [42, 42, 1, 1], "float32"], 1, 0, 1, "float32"], {}], "config": {"index": 15110, "code_hash": null, "entity": [["tile_f", "sp", [-1, 21, 1, 1]], ["tile_y", "sp", [-1, 1, 1, 1]], ["tile_x", "sp", [-1, 1, 1, 83]], ["tile_rc", "sp", [-1, 21]], ["tile_ry", "sp", [-1, 1]], ["tile_rx", "sp", [-1, 1]], ["auto_unroll_max_step", "ot", 512], ["unroll_explicit", "ot", 1]]}, "result": [[1.3612078855], 0, 9.937101125717163, 1638567530.3456686], "version": 0.2, "tvm_version": "0.9.dev0"}
{"input": ["rocm -keys=rocm,gpu -max_num_threads=256 -mcpu=gfx906 -mtriple=amdgcn-amd-amdhsa-hcc -thread_warp_size=64", "conv2d_nchw.cuda", [["TENSOR", [128, 42, 83, 83], "float32"], ["TENSOR", [42, 42, 1, 1], "float32"], 1, 0, 1, "float32"], {}], "config": {"index": 21611, "code_hash": null, "entity": [["tile_f", "sp", [-1, 2, 7, 3]], ["tile_y", "sp", [-1, 83, 1, 1]], ["tile_x", "sp", [-1, 1, 1, 1]], ["tile_rc", "sp", [-1, 14]], ["tile_ry", "sp", [-1, 1]], ["tile_rx", "sp", [-1, 1]], ["auto_unroll_max_step", "ot", 1500], ["unroll_explicit", "ot", 1]]}, "result": [[0.41950399775], 0, 8.058979034423828, 1638567534.863209], "version": 0.2, "tvm_version": "0.9.dev0"}
{"input": ["rocm -keys=rocm,gpu -max_num_threads=256 -mcpu=gfx906 -mtriple=amdgcn-amd-amdhsa-hcc -thread_warp_size=64", "conv2d_nchw.cuda", [["TENSOR", [128, 42, 83, 83], "float32"], ["TENSOR", [42, 42, 1, 1], "float32"], 1, 0, 1, "float32"], {}], "config": {"index": 22067, "code_hash": null, "entity": [["tile_f", "sp", [-1, 6, 1, 7]], ["tile_y", "sp", [-1, 1, 1, 1]], ["tile_x", "sp", [-1, 1, 83, 1]], ["tile_rc", "sp", [-1, 14]], ["tile_ry", "sp", [-1, 1]], ["tile_rx", "sp", [-1, 1]], ["auto_unroll_max_step", "ot", 1500], ["unroll_explicit", "ot", 1]]}, "result": [[0.008619950583333333], 0, 4.136117458343506, 1638567537.9945507], "version": 0.2, "tvm_version": "0.9.dev0"}
{"input": ["rocm -keys=rocm,gpu -max_num_threads=256 -mcpu=gfx906 -mtriple=amdgcn-amd-amdhsa-hcc -thread_warp_size=64", "conv2d_nchw.cuda", [["TENSOR", [128, 42, 83, 83], "float32"], ["TENSOR", [42, 42, 1, 1], "float32"], 1, 0, 1, "float32"], {}], "config": {"index": 18444, "code_hash": null, "entity": [["tile_f", "sp", [-1, 1, 3, 1]], ["tile_y", "sp", [-1, 1, 1, 1]], ["tile_x", "sp", [-1, 1, 1, 1]], ["tile_rc", "sp", [-1, 3]], ["tile_ry", "sp", [-1, 1]], ["tile_rx", "sp", [-1, 1]], ["auto_unroll_max_step", "ot", 1500], ["unroll_explicit", "ot", 1]]}, "result": [[0.0439711685], 0, 3.718125343322754, 1638567541.5311813], "version": 0.2, "tvm_version": "0.9.dev0"}
{"input": ["rocm -keys=rocm,gpu -max_num_threads=256 -mcpu=gfx906 -mtriple=amdgcn-amd-amdhsa-hcc -thread_warp_size=64", "conv2d_nchw.cuda", [["TENSOR", [128, 42, 83, 83], "float32"], ["TENSOR", [42, 42, 1, 1], "float32"], 1, 0, 1, "float32"], {}], "config": {"index": 8751, "code_hash": null, "entity": [["tile_f", "sp", [-1, 1, 7, 6]], ["tile_y", "sp", [-1, 1, 1, 1]], ["tile_x", "sp", [-1, 1, 83, 1]], ["tile_rc", "sp", [-1, 1]], ["tile_ry", "sp", [-1, 1]], ["tile_rx", "sp", [-1, 1]], ["auto_unroll_max_step", "ot", 512], ["unroll_explicit", "ot", 1]]}, "result": [[0.027770174], 0, 3.9607067108154297, 1638567544.9342437], "version": 0.2, "tvm_version": "0.9.dev0"}
{"input": ["rocm -keys=rocm,gpu -max_num_threads=256 -mcpu=gfx906 -mtriple=amdgcn-amd-amdhsa-hcc -thread_warp_size=64", "conv2d_nchw.cuda", [["TENSOR", [128, 42, 83, 83], "float32"], ["TENSOR", [42, 42, 1, 1], "float32"], 1, 0, 1, "float32"], {}], "config": {"index": 2319, "code_hash": null, "entity": [["tile_f", "sp", [-1, 14, 3, 1]], ["tile_y", "sp", [-1, 1, 1, 1]], ["tile_x", "sp", [-1, 83, 1, 1]], ["tile_rc", "sp", [-1, 3]], ["tile_ry", "sp", [-1, 1]], ["tile_rx", "sp", [-1, 1]], ["auto_unroll_max_step", "ot", 0], ["unroll_explicit", "ot", 1]]}, "result": [[0.203092514], 0, 4.6288673877716064, 1638567549.1593869], "version": 0.2, "tvm_version": "0.9.dev0"}
{"input": ["rocm -keys=rocm,gpu -max_num_threads=256 -mcpu=gfx906 -mtriple=amdgcn-amd-amdhsa-hcc -thread_warp_size=64", "conv2d_nchw.cuda", [["TENSOR", [128, 42, 83, 83], "float32"], ["TENSOR", [42, 42, 1, 1], "float32"], 1, 0, 1, "float32"], {}], "config": {"index": 2226, "code_hash": null, "entity": [["tile_f", "sp", [-1, 3, 1, 7]], ["tile_y", "sp", [-1, 1, 83, 1]], ["tile_x", "sp", [-1, 1, 1, 1]], ["tile_rc", "sp", [-1, 3]], ["tile_ry", "sp", [-1, 1]], ["tile_rx", "sp", [-1, 1]], ["auto_unroll_max_step", "ot", 0], ["unroll_explicit", "ot", 1]]}, "result": [[0.004765531121212122], 0, 3.4425973892211914, 1638567609.7207222], "version": 0.2, "tvm_version": "0.9.dev0"}
{"input": ["rocm -keys=rocm,gpu -max_num_threads=256 -mcpu=gfx906 -mtriple=amdgcn-amd-amdhsa-hcc -thread_warp_size=64", "conv2d_nchw.cuda", [["TENSOR", [128, 42, 83, 83], "float32"], ["TENSOR", [42, 42, 1, 1], "float32"], 1, 0, 1, "float32"], {}], "config": {"index": 10418, "code_hash": null, "entity": [["tile_f", "sp", [-1, 3, 1, 7]], ["tile_y", "sp", [-1, 1, 83, 1]], ["tile_x", "sp", [-1, 1, 1, 1]], ["tile_rc", "sp", [-1, 3]], ["tile_ry", "sp", [-1, 1]], ["tile_rx", "sp", [-1, 1]], ["auto_unroll_max_step", "ot", 512], ["unroll_explicit", "ot", 1]]}, "result": [[0.0048082845714285715], 0, 2.9565482139587402, 1638567612.1608126], "version": 0.2, "tvm_version": "0.9.dev0"}
{"input": ["rocm -keys=rocm,gpu -max_num_threads=256 -mcpu=gfx906 -mtriple=amdgcn-amd-amdhsa-hcc -thread_warp_size=64", "conv2d_nchw.cuda", [["TENSOR", [128, 42, 83, 83], "float32"], ["TENSOR", [42, 42, 1, 1], "float32"], 1, 0, 1, "float32"], {}], "config": {"index": 18610, "code_hash": null, "entity": [["tile_f", "sp", [-1, 3, 1, 7]], ["tile_y", "sp", [-1, 1, 83, 1]], ["tile_x", "sp", [-1, 1, 1, 1]], ["tile_rc", "sp", [-1, 3]], ["tile_ry", "sp", [-1, 1]], ["tile_rx", "sp", [-1, 1]], ["auto_unroll_max_step", "ot", 1500], ["unroll_explicit", "ot", 1]]}, "result": [[0.0316245135], 0, 5.269781112670898, 1638567614.6697142], "version": 0.2, "tvm_version": "0.9.dev0"}
{"input": ["rocm -keys=rocm,gpu -max_num_threads=256 -mcpu=gfx906 -mtriple=amdgcn-amd-amdhsa-hcc -thread_warp_size=64", "conv2d_nchw.cuda", [["TENSOR", [128, 42, 83, 83], "float32"], ["TENSOR", [42, 42, 1, 1], "float32"], 1, 0, 1, "float32"], {}], "config": {"index": 2225, "code_hash": null, "entity": [["tile_f", "sp", [-1, 2, 1, 7]], ["tile_y", "sp", [-1, 1, 83, 1]], ["tile_x", "sp", [-1, 1, 1, 1]], ["tile_rc", "sp", [-1, 3]], ["tile_ry", "sp", [-1, 1]], ["tile_rx", "sp", [-1, 1]], ["auto_unroll_max_step", "ot", 0], ["unroll_explicit", "ot", 1]]}, "result": [[0.0060299583529411765], 0, 3.0166876316070557, 1638567617.191638], "version": 0.2, "tvm_version": "0.9.dev0"}
{"input": ["rocm -keys=rocm,gpu -max_num_threads=256 -mcpu=gfx906 -mtriple=amdgcn-amd-amdhsa-hcc -thread_warp_size=64", "conv2d_nchw.cuda", [["TENSOR", [128, 42, 83, 83], "float32"], ["TENSOR", [42, 42, 1, 1], "float32"], 1, 0, 1, "float32"], {}], "config": {"index": 10417, "code_hash": null, "entity": [["tile_f", "sp", [-1, 2, 1, 7]], ["tile_y", "sp", [-1, 1, 83, 1]], ["tile_x", "sp", [-1, 1, 1, 1]], ["tile_rc", "sp", [-1, 3]], ["tile_ry", "sp", [-1, 1]], ["tile_rx", "sp", [-1, 1]], ["auto_unroll_max_step", "ot", 512], ["unroll_explicit", "ot", 1]]}, "result": [[0.0059208441176470585], 0, 3.292868137359619, 1638567619.6538632], "version": 0.2, "tvm_version": "0.9.dev0"}
{"input": ["rocm -keys=rocm,gpu -max_num_threads=256 -mcpu=gfx906 -mtriple=amdgcn-amd-amdhsa-hcc -thread_warp_size=64", "conv2d_nchw.cuda", [["TENSOR", [128, 42, 83, 83], "float32"], ["TENSOR", [42, 42, 1, 1], "float32"], 1, 0, 1, "float32"], {}], "config": {"index": 2204, "code_hash": null, "entity": [["tile_f", "sp", [-1, 3, 1, 2]], ["tile_y", "sp", [-1, 1, 83, 1]], ["tile_x", "sp", [-1, 1, 1, 1]], ["tile_rc", "sp", [-1, 3]], ["tile_ry", "sp", [-1, 1]], ["tile_rx", "sp", [-1, 1]], ["auto_unroll_max_step", "ot", 0], ["unroll_explicit", "ot", 1]]}, "result": [[0.011511913666666667], 0, 3.2545125484466553, 1638567622.2159169], "version": 0.2, "tvm_version": "0.9.dev0"}
{"input": ["rocm -keys=rocm,gpu -max_num_threads=256 -mcpu=gfx906 -mtriple=amdgcn-amd-amdhsa-hcc -thread_warp_size=64", "conv2d_nchw.cuda", [["TENSOR", [128, 42, 83, 83], "float32"], ["TENSOR", [42, 42, 1, 1], "float32"], 1, 0, 1, "float32"], {}], "config": {"index": 18609, "code_hash": null, "entity": [["tile_f", "sp", [-1, 2, 1, 7]], ["tile_y", "sp", [-1, 1, 83, 1]], ["tile_x", "sp", [-1, 1, 1, 1]], ["tile_rc", "sp", [-1, 3]], ["tile_ry", "sp", [-1, 1]], ["tile_rx", "sp", [-1, 1]], ["auto_unroll_max_step", "ot", 1500], ["unroll_explicit", "ot", 1]]}, "result": [[0.02864690375], 0, 4.328235387802124, 1638567624.7339537], "version": 0.2, "tvm_version": "0.9.dev0"}
{"input": ["rocm -keys=rocm,gpu -max_num_threads=256 -mcpu=gfx906 -mtriple=amdgcn-amd-amdhsa-hcc -thread_warp_size=64", "conv2d_nchw.cuda", [["TENSOR", [128, 42, 83, 83], "float32"], ["TENSOR", [42, 42, 1, 1], "float32"], 1, 0, 1, "float32"], {}], "config": {"index": 2224, "code_hash": null, "entity": [["tile_f", "sp", [-1, 1, 1, 7]], ["tile_y", "sp", [-1, 1, 83, 1]], ["tile_x", "sp", [-1, 1, 1, 1]], ["tile_rc", "sp", [-1, 3]], ["tile_ry", "sp", [-1, 1]], ["tile_rx", "sp", [-1, 1]], ["auto_unroll_max_step", "ot", 0], ["unroll_explicit", "ot", 1]]}, "result": [[0.0101369918], 0, 3.221740961074829, 1638567627.2295363], "version": 0.2, "tvm_version": "0.9.dev0"}
{"input": ["rocm -keys=rocm,gpu -max_num_threads=256 -mcpu=gfx906 -mtriple=amdgcn-amd-amdhsa-hcc -thread_warp_size=64", "conv2d_nchw.cuda", [["TENSOR", [128, 42, 83, 83], "float32"], ["TENSOR", [42, 42, 1, 1], "float32"], 1, 0, 1, "float32"], {}], "config": {"index": 10416, "code_hash": null, "entity": [["tile_f", "sp", [-1, 1, 1, 7]], ["tile_y", "sp", [-1, 1, 83, 1]], ["tile_x", "sp", [-1, 1, 1, 1]], ["tile_rc", "sp", [-1, 3]], ["tile_ry", "sp", [-1, 1]], ["tile_rx", "sp", [-1, 1]], ["auto_unroll_max_step", "ot", 512], ["unroll_explicit", "ot", 1]]}, "result": [[0.026928173], 0, 3.6753194332122803, 1638567629.6659226], "version": 0.2, "tvm_version": "0.9.dev0"}
{"input": ["rocm -keys=rocm,gpu -max_num_threads=256 -mcpu=gfx906 -mtriple=amdgcn-amd-amdhsa-hcc -thread_warp_size=64", "conv2d_nchw.cuda", [["TENSOR", [128, 42, 83, 83], "float32"], ["TENSOR", [42, 42, 1, 1], "float32"], 1, 0, 1, "float32"], {}], "config": {"index": 18608, "code_hash": null, "entity": [["tile_f", "sp", [-1, 1, 1, 7]], ["tile_y", "sp", [-1, 1, 83, 1]], ["tile_x", "sp", [-1, 1, 1, 1]], ["tile_rc", "sp", [-1, 3]], ["tile_ry", "sp", [-1, 1]], ["tile_rx", "sp", [-1, 1]], ["auto_unroll_max_step", "ot", 1500], ["unroll_explicit", "ot", 1]]}, "result": [[0.02694893625], 0, 3.806169271469116, 1638567632.2020977], "version": 0.2, "tvm_version": "0.9.dev0"}
{"input": ["rocm -keys=rocm,gpu -max_num_threads=256 -mcpu=gfx906 -mtriple=amdgcn-amd-amdhsa-hcc -thread_warp_size=64", "conv2d_nchw.cuda", [["TENSOR", [128, 42, 83, 83], "float32"], ["TENSOR", [42, 42, 1, 1], "float32"], 1, 0, 1, "float32"], {}], "config": {"index": 2205, "code_hash": null, "entity": [["tile_f", "sp", [-1, 7, 1, 2]], ["tile_y", "sp", [-1, 1, 83, 1]], ["tile_x", "sp", [-1, 1, 1, 1]], ["tile_rc", "sp", [-1, 3]], ["tile_ry", "sp", [-1, 1]], ["tile_rx", "sp", [-1, 1]], ["auto_unroll_max_step", "ot", 0], ["unroll_explicit", "ot", 1]]}, "result": [[0.005923562411764706], 0, 3.2179346084594727, 1638567634.7161448], "version": 0.2, "tvm_version": "0.9.dev0"}
{"input": ["rocm -keys=rocm,gpu -max_num_threads=256 -mcpu=gfx906 -mtriple=amdgcn-amd-amdhsa-hcc -thread_warp_size=64", "conv2d_nchw.cuda", [["TENSOR", [128, 42, 83, 83], "float32"], ["TENSOR", [42, 42, 1, 1], "float32"], 1, 0, 1, "float32"], {}], "config": {"index": 10396, "code_hash": null, "entity": [["tile_f", "sp", [-1, 3, 1, 2]], ["tile_y", "sp", [-1, 1, 83, 1]], ["tile_x", "sp", [-1, 1, 1, 1]], ["tile_rc", "sp", [-1, 3]], ["tile_ry", "sp", [-1, 1]], ["tile_rx", "sp", [-1, 1]], ["auto_unroll_max_step", "ot", 512], ["unroll_explicit", "ot", 1]]}, "result": [[0.026962331750000002], 0, 4.065575838088989, 1638567637.2380273], "version": 0.2, "tvm_version": "0.9.dev0"}
{"input": ["rocm -keys=rocm,gpu -max_num_threads=256 -mcpu=gfx906 -mtriple=amdgcn-amd-amdhsa-hcc -thread_warp_size=64", "conv2d_nchw.cuda", [["TENSOR", [128, 42, 83, 83], "float32"], ["TENSOR", [42, 42, 1, 1], "float32"], 1, 0, 1, "float32"], {}], "config": {"index": 3249, "code_hash": null, "entity": [["tile_f", "sp", [-1, 2, 1, 7]], ["tile_y", "sp", [-1, 1, 83, 1]], ["tile_x", "sp", [-1, 1, 1, 1]], ["tile_rc", "sp", [-1, 6]], ["tile_ry", "sp", [-1, 1]], ["tile_rx", "sp", [-1, 1]], ["auto_unroll_max_step", "ot", 0], ["unroll_explicit", "ot", 1]]}, "result": [[0.005932464117647059], 0, 3.253582000732422, 1638567639.751008], "version": 0.2, "tvm_version": "0.9.dev0"}
{"input": ["rocm -keys=rocm,gpu -max_num_threads=256 -mcpu=gfx906 -mtriple=amdgcn-amd-amdhsa-hcc -thread_warp_size=64", "conv2d_nchw.cuda", [["TENSOR", [128, 42, 83, 83], "float32"], ["TENSOR", [42, 42, 1, 1], "float32"], 1, 0, 1, "float32"], {}], "config": {"index": 178, "code_hash": null, "entity": [["tile_f", "sp", [-1, 3, 1, 7]], ["tile_y", "sp", [-1, 1, 83, 1]], ["tile_x", "sp", [-1, 1, 1, 1]], ["tile_rc", "sp", [-1, 1]], ["tile_ry", "sp", [-1, 1]], ["tile_rx", "sp", [-1, 1]], ["auto_unroll_max_step", "ot", 0], ["unroll_explicit", "ot", 1]]}, "result": [[0.004855898727272727], 0, 3.121551036834717, 1638567642.2119296], "version": 0.2, "tvm_version": "0.9.dev0"}
{"input": ["rocm -keys=rocm,gpu -max_num_threads=256 -mcpu=gfx906 -mtriple=amdgcn-amd-amdhsa-hcc -thread_warp_size=64", "conv2d_nchw.cuda", [["TENSOR", [128, 42, 83, 83], "float32"], ["TENSOR", [42, 42, 1, 1], "float32"], 1, 0, 1, "float32"], {}], "config": {"index": 8370, "code_hash": null, "entity": [["tile_f", "sp", [-1, 3, 1, 7]], ["tile_y", "sp", [-1, 1, 83, 1]], ["tile_x", "sp", [-1, 1, 1, 1]], ["tile_rc", "sp", [-1, 1]], ["tile_ry", "sp", [-1, 1]], ["tile_rx", "sp", [-1, 1]], ["auto_unroll_max_step", "ot", 512], ["unroll_explicit", "ot", 1]]}, "result": [[0.004634497878787879], 0, 3.33197283744812, 1638567644.8102758], "version": 0.2, "tvm_version": "0.9.dev0"}
{"input": ["rocm -keys=rocm,gpu -max_num_threads=256 -mcpu=gfx906 -mtriple=amdgcn-amd-amdhsa-hcc -thread_warp_size=64", "conv2d_nchw.cuda", [["TENSOR", [128, 42, 83, 83], "float32"], ["TENSOR", [42, 42, 1, 1], "float32"], 1, 0, 1, "float32"], {}], "config": {"index": 16562, "code_hash": null, "entity": [["tile_f", "sp", [-1, 3, 1, 7]], ["tile_y", "sp", [-1, 1, 83, 1]], ["tile_x", "sp", [-1, 1, 1, 1]], ["tile_rc", "sp", [-1, 1]], ["tile_ry", "sp", [-1, 1]], ["tile_rx", "sp", [-1, 1]], ["auto_unroll_max_step", "ot", 1500], ["unroll_explicit", "ot", 1]]}, "result": [[0.03102094825], 0, 5.410512685775757, 1638567647.329713], "version": 0.2, "tvm_version": "0.9.dev0"}
{"input": ["rocm -keys=rocm,gpu -max_num_threads=256 -mcpu=gfx906 -mtriple=amdgcn-amd-amdhsa-hcc -thread_warp_size=64", "conv2d_nchw.cuda", [["TENSOR", [128, 42, 83, 83], "float32"], ["TENSOR", [42, 42, 1, 1], "float32"], 1, 0, 1, "float32"], {}], "config": {"index": 1201, "code_hash": null, "entity": [["tile_f", "sp", [-1, 2, 1, 7]], ["tile_y", "sp", [-1, 1, 83, 1]], ["tile_x", "sp", [-1, 1, 1, 1]], ["tile_rc", "sp", [-1, 2]], ["tile_ry", "sp", [-1, 1]], ["tile_rx", "sp", [-1, 1]], ["auto_unroll_max_step", "ot", 0], ["unroll_explicit", "ot", 1]]}, "result": [[0.005989313411764706], 0, 3.3708817958831787, 1638567649.8078485], "version": 0.2, "tvm_version": "0.9.dev0"}
{"input": ["rocm -keys=rocm,gpu -max_num_threads=256 -mcpu=gfx906 -mtriple=amdgcn-amd-amdhsa-hcc -thread_warp_size=64", "conv2d_nchw.cuda", [["TENSOR", [128, 42, 83, 83], "float32"], ["TENSOR", [42, 42, 1, 1], "float32"], 1, 0, 1, "float32"], {}], "config": {"index": 1202, "code_hash": null, "entity": [["tile_f", "sp", [-1, 3, 1, 7]], ["tile_y", "sp", [-1, 1, 83, 1]], ["tile_x", "sp", [-1, 1, 1, 1]], ["tile_rc", "sp", [-1, 2]], ["tile_ry", "sp", [-1, 1]], ["tile_rx", "sp", [-1, 1]], ["auto_unroll_max_step", "ot", 0], ["unroll_explicit", "ot", 1]]}, "result": [[0.004507867428571429], 0, 3.445629358291626, 1638567652.4404135], "version": 0.2, "tvm_version": "0.9.dev0"}
{"input": ["rocm -keys=rocm,gpu -max_num_threads=256 -mcpu=gfx906 -mtriple=amdgcn-amd-amdhsa-hcc -thread_warp_size=64", "conv2d_nchw.cuda", [["TENSOR", [128, 42, 83, 83], "float32"], ["TENSOR", [42, 42, 1, 1], "float32"], 1, 0, 1, "float32"], {}], "config": {"index": 3250, "code_hash": null, "entity": [["tile_f", "sp", [-1, 3, 1, 7]], ["tile_y", "sp", [-1, 1, 83, 1]], ["tile_x", "sp", [-1, 1, 1, 1]], ["tile_rc", "sp", [-1, 6]], ["tile_ry", "sp", [-1, 1]], ["tile_rx", "sp", [-1, 1]], ["auto_unroll_max_step", "ot", 0], ["unroll_explicit", "ot", 1]]}, "result": [[0.0052065887], 0, 3.742464303970337, 1638567655.0500188], "version": 0.2, "tvm_version": "0.9.dev0"}
{"input": ["rocm -keys=rocm,gpu -max_num_threads=256 -mcpu=gfx906 -mtriple=amdgcn-amd-amdhsa-hcc -thread_warp_size=64", "conv2d_nchw.cuda", [["TENSOR", [128, 42, 83, 83], "float32"], ["TENSOR", [42, 42, 1, 1], "float32"], 1, 0, 1, "float32"], {}], "config": {"index": 2233, "code_hash": null, "entity": [["tile_f", "sp", [-1, 1, 1, 14]], ["tile_y", "sp", [-1, 1, 83, 1]], ["tile_x", "sp", [-1, 1, 1, 1]], ["tile_rc", "sp", [-1, 3]], ["tile_ry", "sp", [-1, 1]], ["tile_rx", "sp", [-1, 1]], ["auto_unroll_max_step", "ot", 0], ["unroll_explicit", "ot", 1]]}, "result": [[0.006020246117647059], 0, 3.2747814655303955, 1638567657.4486024], "version": 0.2, "tvm_version": "0.9.dev0"}
{"input": ["rocm -keys=rocm,gpu -max_num_threads=256 -mcpu=gfx906 -mtriple=amdgcn-amd-amdhsa-hcc -thread_warp_size=64", "conv2d_nchw.cuda", [["TENSOR", [128, 42, 83, 83], "float32"], ["TENSOR", [42, 42, 1, 1], "float32"], 1, 0, 1, "float32"], {}], "config": {"index": 18588, "code_hash": null, "entity": [["tile_f", "sp", [-1, 3, 1, 2]], ["tile_y", "sp", [-1, 1, 83, 1]], ["tile_x", "sp", [-1, 1, 1, 1]], ["tile_rc", "sp", [-1, 3]], ["tile_ry", "sp", [-1, 1]], ["tile_rx", "sp", [-1, 1]], ["auto_unroll_max_step", "ot", 1500], ["unroll_explicit", "ot", 1]]}, "result": [[0.02732932275], 0, 4.053950071334839, 1638567659.9727378], "version": 0.2, "tvm_version": "0.9.dev0"}
{"input": ["rocm -keys=rocm,gpu -max_num_threads=256 -mcpu=gfx906 -mtriple=amdgcn-amd-amdhsa-hcc -thread_warp_size=64", "conv2d_nchw.cuda", [["TENSOR", [128, 42, 83, 83], "float32"], ["TENSOR", [42, 42, 1, 1], "float32"], 1, 0, 1, "float32"], {}], "config": {"index": 11441, "code_hash": null, "entity": [["tile_f", "sp", [-1, 2, 1, 7]], ["tile_y", "sp", [-1, 1, 83, 1]], ["tile_x", "sp", [-1, 1, 1, 1]], ["tile_rc", "sp", [-1, 6]], ["tile_ry", "sp", [-1, 1]], ["tile_rx", "sp", [-1, 1]], ["auto_unroll_max_step", "ot", 512], ["unroll_explicit", "ot", 1]]}, "result": [[0.005815715777777778], 0, 3.1999869346618652, 1638567662.4830787], "version": 0.2, "tvm_version": "0.9.dev0"}
{"input": ["rocm -keys=rocm,gpu -max_num_threads=256 -mcpu=gfx906 -mtriple=amdgcn-amd-amdhsa-hcc -thread_warp_size=64", "conv2d_nchw.cuda", [["TENSOR", [128, 42, 83, 83], "float32"], ["TENSOR", [42, 42, 1, 1], "float32"], 1, 0, 1, "float32"], {}], "config": {"index": 9392, "code_hash": null, "entity": [["tile_f", "sp", [-1, 1, 1, 7]], ["tile_y", "sp", [-1, 1, 83, 1]], ["tile_x", "sp", [-1, 1, 1, 1]], ["tile_rc", "sp", [-1, 2]], ["tile_ry", "sp", [-1, 1]], ["tile_rx", "sp", [-1, 1]], ["auto_unroll_max_step", "ot", 512], ["unroll_explicit", "ot", 1]]}, "result": [[0.0273878345], 0, 3.743539571762085, 1638567664.969163], "version": 0.2, "tvm_version": "0.9.dev0"}
{"input": ["rocm -keys=rocm,gpu -max_num_threads=256 -mcpu=gfx906 -mtriple=amdgcn-amd-amdhsa-hcc -thread_warp_size=64", "conv2d_nchw.cuda", [["TENSOR", [128, 42, 83, 83], "float32"], ["TENSOR", [42, 42, 1, 1], "float32"], 1, 0, 1, "float32"], {}], "config": {"index": 1200, "code_hash": null, "entity": [["tile_f", "sp", [-1, 1, 1, 7]], ["tile_y", "sp", [-1, 1, 83, 1]], ["tile_x", "sp", [-1, 1, 1, 1]], ["tile_rc", "sp", [-1, 2]], ["tile_ry", "sp", [-1, 1]], ["tile_rx", "sp", [-1, 1]], ["auto_unroll_max_step", "ot", 0], ["unroll_explicit", "ot", 1]]}, "result": [[0.010350109100000001], 0, 3.3037307262420654, 1638567667.4842038], "version": 0.2, "tvm_version": "0.9.dev0"}
{"input": ["rocm -keys=rocm,gpu -max_num_threads=256 -mcpu=gfx906 -mtriple=amdgcn-amd-amdhsa-hcc -thread_warp_size=64", "conv2d_nchw.cuda", [["TENSOR", [128, 42, 83, 83], "float32"], ["TENSOR", [42, 42, 1, 1], "float32"], 1, 0, 1, "float32"], {}], "config": {"index": 176, "code_hash": null, "entity": [["tile_f", "sp", [-1, 1, 1, 7]], ["tile_y", "sp", [-1, 1, 83, 1]], ["tile_x", "sp", [-1, 1, 1, 1]], ["tile_rc", "sp", [-1, 1]], ["tile_ry", "sp", [-1, 1]], ["tile_rx", "sp", [-1, 1]], ["auto_unroll_max_step", "ot", 0], ["unroll_explicit", "ot", 1]]}, "result": [[0.0109857887], 0, 3.350973606109619, 1638567669.9944196], "version": 0.2, "tvm_version": "0.9.dev0"}
{"input": ["rocm -keys=rocm,gpu -max_num_threads=256 -mcpu=gfx906 -mtriple=amdgcn-amd-amdhsa-hcc -thread_warp_size=64", "conv2d_nchw.cuda", [["TENSOR", [128, 42, 83, 83], "float32"], ["TENSOR", [42, 42, 1, 1], "float32"], 1, 0, 1, "float32"], {}], "config": {"index": 8368, "code_hash": null, "entity": [["tile_f", "sp", [-1, 1, 1, 7]], ["tile_y", "sp", [-1, 1, 83, 1]], ["tile_x", "sp", [-1, 1, 1, 1]], ["tile_rc", "sp", [-1, 1]], ["tile_ry", "sp", [-1, 1]], ["tile_rx", "sp", [-1, 1]], ["auto_unroll_max_step", "ot", 512], ["unroll_explicit", "ot", 1]]}, "result": [[0.029859642000000002], 0, 3.9940288066864014, 1638567672.5250182], "version": 0.2, "tvm_version": "0.9.dev0"}
{"input": ["rocm -keys=rocm,gpu -max_num_threads=256 -mcpu=gfx906 -mtriple=amdgcn-amd-amdhsa-hcc -thread_warp_size=64", "conv2d_nchw.cuda", [["TENSOR", [128, 42, 83, 83], "float32"], ["TENSOR", [42, 42, 1, 1], "float32"], 1, 0, 1, "float32"], {}], "config": {"index": 17584, "code_hash": null, "entity": [["tile_f", "sp", [-1, 1, 1, 7]], ["tile_y", "sp", [-1, 1, 83, 1]], ["tile_x", "sp", [-1, 1, 1, 1]], ["tile_rc", "sp", [-1, 2]], ["tile_ry", "sp", [-1, 1]], ["tile_rx", "sp", [-1, 1]], ["auto_unroll_max_step", "ot", 1500], ["unroll_explicit", "ot", 1]]}, "result": [[0.027386182749999998], 0, 4.3055970668792725, 1638567675.108304], "version": 0.2, "tvm_version": "0.9.dev0"}
{"input": ["rocm -keys=rocm,gpu -max_num_threads=256 -mcpu=gfx906 -mtriple=amdgcn-amd-amdhsa-hcc -thread_warp_size=64", "conv2d_nchw.cuda", [["TENSOR", [128, 42, 83, 83], "float32"], ["TENSOR", [42, 42, 1, 1], "float32"], 1, 0, 1, "float32"], {}], "config": {"index": 16560, "code_hash": null, "entity": [["tile_f", "sp", [-1, 1, 1, 7]], ["tile_y", "sp", [-1, 1, 83, 1]], ["tile_x", "sp", [-1, 1, 1, 1]], ["tile_rc", "sp", [-1, 1]], ["tile_ry", "sp", [-1, 1]], ["tile_rx", "sp", [-1, 1]], ["auto_unroll_max_step", "ot", 1500], ["unroll_explicit", "ot", 1]]}, "result": [[0.0298561515], 0, 3.875188112258911, 1638567677.6340296], "version": 0.2, "tvm_version": "0.9.dev0"}
{"input": ["rocm -keys=rocm,gpu -max_num_threads=256 -mcpu=gfx906 -mtriple=amdgcn-amd-amdhsa-hcc -thread_warp_size=64", "conv2d_nchw.cuda", [["TENSOR", [128, 42, 83, 83], "float32"], ["TENSOR", [42, 42, 1, 1], "float32"], 1, 0, 1, "float32"], {}], "config": {"index": 9393, "code_hash": null, "entity": [["tile_f", "sp", [-1, 2, 1, 7]], ["tile_y", "sp", [-1, 1, 83, 1]], ["tile_x", "sp", [-1, 1, 1, 1]], ["tile_rc", "sp", [-1, 2]], ["tile_ry", "sp", [-1, 1]], ["tile_rx", "sp", [-1, 1]], ["auto_unroll_max_step", "ot", 512], ["unroll_explicit", "ot", 1]]}, "result": [[0.006214806470588235], 0, 3.2309677600860596, 1638567680.0962317], "version": 0.2, "tvm_version": "0.9.dev0"}
{"input": ["rocm -keys=rocm,gpu -max_num_threads=256 -mcpu=gfx906 -mtriple=amdgcn-amd-amdhsa-hcc -thread_warp_size=64", "conv2d_nchw.cuda", [["TENSOR", [128, 42, 83, 83], "float32"], ["TENSOR", [42, 42, 1, 1], "float32"], 1, 0, 1, "float32"], {}], "config": {"index": 9394, "code_hash": null, "entity": [["tile_f", "sp", [-1, 3, 1, 7]], ["tile_y", "sp", [-1, 1, 83, 1]], ["tile_x", "sp", [-1, 1, 1, 1]], ["tile_rc", "sp", [-1, 2]], ["tile_ry", "sp", [-1, 1]], ["tile_rx", "sp", [-1, 1]], ["auto_unroll_max_step", "ot", 512], ["unroll_explicit", "ot", 1]]}, "result": [[0.0046303471142857145], 0, 3.587993860244751, 1638567682.7450936], "version": 0.2, "tvm_version": "0.9.dev0"}
{"input": ["rocm -keys=rocm,gpu -max_num_threads=256 -mcpu=gfx906 -mtriple=amdgcn-amd-amdhsa-hcc -thread_warp_size=64", "conv2d_nchw.cuda", [["TENSOR", [128, 42, 83, 83], "float32"], ["TENSOR", [42, 42, 1, 1], "float32"], 1, 0, 1, "float32"], {}], "config": {"index": 11442, "code_hash": null, "entity": [["tile_f", "sp", [-1, 3, 1, 7]], ["tile_y", "sp", [-1, 1, 83, 1]], ["tile_x", "sp", [-1, 1, 1, 1]], ["tile_rc", "sp", [-1, 6]], ["tile_ry", "sp", [-1, 1]], ["tile_rx", "sp", [-1, 1]], ["auto_unroll_max_step", "ot", 512], ["unroll_explicit", "ot", 1]]}, "result": [[0.004714469666666666], 0, 3.6902265548706055, 1638567685.3585663], "version": 0.2, "tvm_version": "0.9.dev0"}
{"input": ["rocm -keys=rocm,gpu -max_num_threads=256 -mcpu=gfx906 -mtriple=amdgcn-amd-amdhsa-hcc -thread_warp_size=64", "conv2d_nchw.cuda", [["TENSOR", [128, 42, 83, 83], "float32"], ["TENSOR", [42, 42, 1, 1], "float32"], 1, 0, 1, "float32"], {}], "config": {"index": 10397, "code_hash": null, "entity": [["tile_f", "sp", [-1, 7, 1, 2]], ["tile_y", "sp", [-1, 1, 83, 1]], ["tile_x", "sp", [-1, 1, 1, 1]], ["tile_rc", "sp", [-1, 3]], ["tile_ry", "sp", [-1, 1]], ["tile_rx", "sp", [-1, 1]], ["auto_unroll_max_step", "ot", 512], ["unroll_explicit", "ot", 1]]}, "result": [[0.00591488105882353], 0, 3.7191426753997803, 1638567688.2077863], "version": 0.2, "tvm_version": "0.9.dev0"}
{"input": ["rocm -keys=rocm,gpu -max_num_threads=256 -mcpu=gfx906 -mtriple=amdgcn-amd-amdhsa-hcc -thread_warp_size=64", "conv2d_nchw.cuda", [["TENSOR", [128, 42, 83, 83], "float32"], ["TENSOR", [42, 42, 1, 1], "float32"], 1, 0, 1, "float32"], {}], "config": {"index": 17585, "code_hash": null, "entity": [["tile_f", "sp", [-1, 2, 1, 7]], ["tile_y", "sp", [-1, 1, 83, 1]], ["tile_x", "sp", [-1, 1, 1, 1]], ["tile_rc", "sp", [-1, 2]], ["tile_ry", "sp", [-1, 1]], ["tile_rx", "sp", [-1, 1]], ["auto_unroll_max_step", "ot", 1500], ["unroll_explicit", "ot", 1]]}, "result": [[0.028132017000000002], 0, 5.50638222694397, 1638567691.4388096], "version": 0.2, "tvm_version": "0.9.dev0"}
{"input": ["rocm -keys=rocm,gpu -max_num_threads=256 -mcpu=gfx906 -mtriple=amdgcn-amd-amdhsa-hcc -thread_warp_size=64", "conv2d_nchw.cuda", [["TENSOR", [128, 42, 83, 83], "float32"], ["TENSOR", [42, 42, 1, 1], "float32"], 1, 0, 1, "float32"], {}], "config": {"index": 17586, "code_hash": null, "entity": [["tile_f", "sp", [-1, 3, 1, 7]], ["tile_y", "sp", [-1, 1, 83, 1]], ["tile_x", "sp", [-1, 1, 1, 1]], ["tile_rc", "sp", [-1, 2]], ["tile_ry", "sp", [-1, 1]], ["tile_rx", "sp", [-1, 1]], ["auto_unroll_max_step", "ot", 1500], ["unroll_explicit", "ot", 1]]}, "result": [[0.02966291025], 0, 5.922874927520752, 1638567694.6739247], "version": 0.2, "tvm_version": "0.9.dev0"}
{"input": ["rocm -keys=rocm,gpu -max_num_threads=256 -mcpu=gfx906 -mtriple=amdgcn-amd-amdhsa-hcc -thread_warp_size=64", "conv2d_nchw.cuda", [["TENSOR", [128, 42, 83, 83], "float32"], ["TENSOR", [42, 42, 1, 1], "float32"], 1, 0, 1, "float32"], {}], "config": {"index": 2227, "code_hash": null, "entity": [["tile_f", "sp", [-1, 6, 1, 7]], ["tile_y", "sp", [-1, 1, 83, 1]], ["tile_x", "sp", [-1, 1, 1, 1]], ["tile_rc", "sp", [-1, 3]], ["tile_ry", "sp", [-1, 1]], ["tile_rx", "sp", [-1, 1]], ["auto_unroll_max_step", "ot", 0], ["unroll_explicit", "ot", 1]]}, "result": [[0.0101259135625], 0, 4.733266115188599, 1638567698.0833478], "version": 0.2, "tvm_version": "0.9.dev0"}
{"input": ["rocm -keys=rocm,gpu -max_num_threads=256 -mcpu=gfx906 -mtriple=amdgcn-amd-amdhsa-hcc -thread_warp_size=64", "conv2d_nchw.cuda", [["TENSOR", [128, 42, 83, 83], "float32"], ["TENSOR", [42, 42, 1, 1], "float32"], 1, 0, 1, "float32"], {}], "config": {"index": 10425, "code_hash": null, "entity": [["tile_f", "sp", [-1, 1, 1, 14]], ["tile_y", "sp", [-1, 1, 83, 1]], ["tile_x", "sp", [-1, 1, 1, 1]], ["tile_rc", "sp", [-1, 3]], ["tile_ry", "sp", [-1, 1]], ["tile_rx", "sp", [-1, 1]], ["auto_unroll_max_step", "ot", 512], ["unroll_explicit", "ot", 1]]}, "result": [[0.005989065705882353], 0, 3.968278408050537, 1638567701.5117245], "version": 0.2, "tvm_version": "0.9.dev0"}
{"input": ["rocm -keys=rocm,gpu -max_num_threads=256 -mcpu=gfx906 -mtriple=amdgcn-amd-amdhsa-hcc -thread_warp_size=64", "conv2d_nchw.cuda", [["TENSOR", [128, 42, 83, 83], "float32"], ["TENSOR", [42, 42, 1, 1], "float32"], 1, 0, 1, "float32"], {}], "config": {"index": 2180, "code_hash": null, "entity": [["tile_f", "sp", [-1, 7, 1, 1]], ["tile_y", "sp", [-1, 1, 83, 1]], ["tile_x", "sp", [-1, 1, 1, 1]], ["tile_rc", "sp", [-1, 3]], ["tile_ry", "sp", [-1, 1]], ["tile_rx", "sp", [-1, 1]], ["auto_unroll_max_step", "ot", 0], ["unroll_explicit", "ot", 1]]}, "result": [[0.010597348], 0, 4.341194152832031, 1638567705.2505825], "version": 0.2, "tvm_version": "0.9.dev0"}
{"input": ["rocm -keys=rocm,gpu -max_num_threads=256 -mcpu=gfx906 -mtriple=amdgcn-amd-amdhsa-hcc -thread_warp_size=64", "conv2d_nchw.cuda", [["TENSOR", [128, 42, 83, 83], "float32"], ["TENSOR", [42, 42, 1, 1], "float32"], 1, 0, 1, "float32"], {}], "config": {"index": 2179, "code_hash": null, "entity": [["tile_f", "sp", [-1, 6, 1, 1]], ["tile_y", "sp", [-1, 1, 83, 1]], ["tile_x", "sp", [-1, 1, 1, 1]], ["tile_rc", "sp", [-1, 3]], ["tile_ry", "sp", [-1, 1]], ["tile_rx", "sp", [-1, 1]], ["auto_unroll_max_step", "ot", 0], ["unroll_explicit", "ot", 1]]}, "result": [[0.011507055444444443], 0, 2.9574153423309326, 1638567707.666563], "version": 0.2, "tvm_version": "0.9.dev0"}
{"input": ["rocm -keys=rocm,gpu -max_num_threads=256 -mcpu=gfx906 -mtriple=amdgcn-amd-amdhsa-hcc -thread_warp_size=64", "conv2d_nchw.cuda", [["TENSOR", [128, 42, 83, 83], "float32"], ["TENSOR", [42, 42, 1, 1], "float32"], 1, 0, 1, "float32"], {}], "config": {"index": 2181, "code_hash": null, "entity": [["tile_f", "sp", [-1, 14, 1, 1]], ["tile_y", "sp", [-1, 1, 83, 1]], ["tile_x", "sp", [-1, 1, 1, 1]], ["tile_rc", "sp", [-1, 3]], ["tile_ry", "sp", [-1, 1]], ["tile_rx", "sp", [-1, 1]], ["auto_unroll_max_step", "ot", 0], ["unroll_explicit", "ot", 1]]}, "result": [[0.005951313235294118], 0, 3.3452000617980957, 1638567710.1707816], "version": 0.2, "tvm_version": "0.9.dev0"}
{"input": ["rocm -keys=rocm,gpu -max_num_threads=256 -mcpu=gfx906 -mtriple=amdgcn-amd-amdhsa-hcc -thread_warp_size=64", "conv2d_nchw.cuda", [["TENSOR", [128, 42, 83, 83], "float32"], ["TENSOR", [42, 42, 1, 1], "float32"], 1, 0, 1, "float32"], {}], "config": {"index": 2214, "code_hash": null, "entity": [["tile_f", "sp", [-1, 7, 1, 3]], ["tile_y", "sp", [-1, 1, 83, 1]], ["tile_x", "sp", [-1, 1, 1, 1]], ["tile_rc", "sp", [-1, 3]], ["tile_ry", "sp", [-1, 1]], ["tile_rx", "sp", [-1, 1]], ["auto_unroll_max_step", "ot", 0], ["unroll_explicit", "ot", 1]]}, "result": [[0.0049667744375], 0, 3.46394419670105, 1638567712.7277153], "version": 0.2, "tvm_version": "0.9.dev0"}
{"input": ["rocm -keys=rocm,gpu -max_num_threads=256 -mcpu=gfx906 -mtriple=amdgcn-amd-amdhsa-hcc -thread_warp_size=64", "conv2d_nchw.cuda", [["TENSOR", [128, 42, 83, 83], "float32"], ["TENSOR", [42, 42, 1, 1], "float32"], 1, 0, 1, "float32"], {}], "config": {"index": 18617, "code_hash": null, "entity": [["tile_f", "sp", [-1, 1, 1, 14]], ["tile_y", "sp", [-1, 1, 83, 1]], ["tile_x", "sp", [-1, 1, 1, 1]], ["tile_rc", "sp", [-1, 3]], ["tile_ry", "sp", [-1, 1]], ["tile_rx", "sp", [-1, 1]], ["auto_unroll_max_step", "ot", 1500], ["unroll_explicit", "ot", 1]]}, "result": [[0.0281064985], 0, 4.226243019104004, 1638567715.1913161], "version": 0.2, "tvm_version": "0.9.dev0"}
{"input": ["rocm -keys=rocm,gpu -max_num_threads=256 -mcpu=gfx906 -mtriple=amdgcn-amd-amdhsa-hcc -thread_warp_size=64", "conv2d_nchw.cuda", [["TENSOR", [128, 42, 83, 83], "float32"], ["TENSOR", [42, 42, 1, 1], "float32"], 1, 0, 1, "float32"], {}], "config": {"index": 19633, "code_hash": null, "entity": [["tile_f", "sp", [-1, 2, 1, 7]], ["tile_y", "sp", [-1, 1, 83, 1]], ["tile_x", "sp", [-1, 1, 1, 1]], ["tile_rc", "sp", [-1, 6]], ["tile_ry", "sp", [-1, 1]], ["tile_rx", "sp", [-1, 1]], ["auto_unroll_max_step", "ot", 1500], ["unroll_explicit", "ot", 1]]}, "result": [[0.03486165225], 0, 4.608079433441162, 1638567717.7488105], "version": 0.2, "tvm_version": "0.9.dev0"}
{"input": ["rocm -keys=rocm,gpu -max_num_threads=256 -mcpu=gfx906 -mtriple=amdgcn-amd-amdhsa-hcc -thread_warp_size=64", "conv2d_nchw.cuda", [["TENSOR", [128, 42, 83, 83], "float32"], ["TENSOR", [42, 42, 1, 1], "float32"], 1, 0, 1, "float32"], {}], "config": {"index": 1209, "code_hash": null, "entity": [["tile_f", "sp", [-1, 1, 1, 14]], ["tile_y", "sp", [-1, 1, 83, 1]], ["tile_x", "sp", [-1, 1, 1, 1]], ["tile_rc", "sp", [-1, 2]], ["tile_ry", "sp", [-1, 1]], ["tile_rx", "sp", [-1, 1]], ["auto_unroll_max_step", "ot", 0], ["unroll_explicit", "ot", 1]]}, "result": [[0.006001366529411765], 0, 3.1244077682495117, 1638567720.276689], "version": 0.2, "tvm_version": "0.9.dev0"}
{"input": ["rocm -keys=rocm,gpu -max_num_threads=256 -mcpu=gfx906 -mtriple=amdgcn-amd-amdhsa-hcc -thread_warp_size=64", "conv2d_nchw.cuda", [["TENSOR", [128, 42, 83, 83], "float32"], ["TENSOR", [42, 42, 1, 1], "float32"], 1, 0, 1, "float32"], {}], "config": {"index": 2234, "code_hash": null, "entity": [["tile_f", "sp", [-1, 3, 1, 14]], ["tile_y", "sp", [-1, 1, 83, 1]], ["tile_x", "sp", [-1, 1, 1, 1]], ["tile_rc", "sp", [-1, 3]], ["tile_ry", "sp", [-1, 1]], ["tile_rx", "sp", [-1, 1]], ["auto_unroll_max_step", "ot", 0], ["unroll_explicit", "ot", 1]]}, "result": [[0.008750449416666667], 0, 3.9402518272399902, 1638567722.7923145], "version": 0.2, "tvm_version": "0.9.dev0"}
{"input": ["rocm -keys=rocm,gpu -max_num_threads=256 -mcpu=gfx906 -mtriple=amdgcn-amd-amdhsa-hcc -thread_warp_size=64", "conv2d_nchw.cuda", [["TENSOR", [128, 42, 83, 83], "float32"], ["TENSOR", [42, 42, 1, 1], "float32"], 1, 0, 1, "float32"], {}], "config": {"index": 1180, "code_hash": null, "entity": [["tile_f", "sp", [-1, 3, 1, 2]], ["tile_y", "sp", [-1, 1, 83, 1]], ["tile_x", "sp", [-1, 1, 1, 1]], ["tile_rc", "sp", [-1, 2]], ["tile_ry", "sp", [-1, 1]], ["tile_rx", "sp", [-1, 1]], ["auto_unroll_max_step", "ot", 0], ["unroll_explicit", "ot", 1]]}, "result": [[0.011573098], 0, 2.95784592628479, 1638567725.3587096], "version": 0.2, "tvm_version": "0.9.dev0"}
