artifacts/microbenchmark/tvm/autotvm/matmul_nn/matmul_128_4032_1000.log
{"input": ["cuda -keys=cuda,gpu -max_num_threads=1024 -thread_warp_size=32", "dense_large_batch.gpu", [["TENSOR", [128, 4032], "float32"], ["TENSOR", [4032, 1000], "float32"]], {}], "config": {"index": 2231489, "code_hash": null, "entity": [["tile_x", "sp", [-1, 16, 1, 8]], ["tile_y", "sp", [-1, 10, 1, 5]], ["tile_k", "sp", [-1, 6, 2]]]}, "result": [[0.8919040334999999], 0, 22.320632219314575, 1638074793.1541717], "version": 0.2, "tvm_version": "0.8.dev0"}
{"input": ["cuda -keys=cuda,gpu -max_num_threads=1024 -thread_warp_size=32", "dense_large_batch.gpu", [["TENSOR", [128, 4032], "float32"], ["TENSOR", [4032, 1000], "float32"]], {}], "config": {"index": 290513, "code_hash": null, "entity": [["tile_x", "sp", [-1, 1, 2, 32]], ["tile_y", "sp", [-1, 10, 2, 1]], ["tile_k", "sp", [-1, 8, 1]]]}, "result": [[0.03580391425], 0, 2.334728717803955, 1638074810.3922768], "version": 0.2, "tvm_version": "0.8.dev0"}
{"input": ["cuda -keys=cuda,gpu -max_num_threads=1024 -thread_warp_size=32", "dense_large_batch.gpu", [["TENSOR", [128, 4032], "float32"], ["TENSOR", [4032, 1000], "float32"]], {}], "config": {"index": 23751, "code_hash": null, "entity": [["tile_x", "sp", [-1, 2, 1, 32]], ["tile_y", "sp", [-1, 25, 1, 5]], ["tile_k", "sp", [-1, 1, 1]]]}, "result": [[4.09937791725], 0, 54.6247193813324, 1638074886.672652], "version": 0.2, "tvm_version": "0.8.dev0"}
{"input": ["cuda -keys=cuda,gpu -max_num_threads=1024 -thread_warp_size=32", "dense_large_batch.gpu", [["TENSOR", [128, 4032], "float32"], ["TENSOR", [4032, 1000], "float32"]], {}], "config": {"index": 192246, "code_hash": null, "entity": [["tile_x", "sp", [-1, 64, 1, 1]], ["tile_y", "sp", [-1, 4, 1, 1]], ["tile_k", "sp", [-1, 6, 1]]]}, "result": [[0.04122646375], 0, 4.078603267669678, 1638074888.9516165], "version": 0.2, "tvm_version": "0.8.dev0"}
{"input": ["cuda -keys=cuda,gpu -max_num_threads=1024 -thread_warp_size=32", "dense_large_batch.gpu", [["TENSOR", [128, 4032], "float32"], ["TENSOR", [4032, 1000], "float32"]], {}], "config": {"index": 2556278, "code_hash": null, "entity": [["tile_x", "sp", [-1, 4, 1, 2]], ["tile_y", "sp", [-1, 4, 1, 2]], ["tile_k", "sp", [-1, 18, 2]]]}, "result": [[0.004993952428571429], 0, 3.204704761505127, 1638074890.693998], "version": 0.2, "tvm_version": "0.8.dev0"}
{"input": ["cuda -keys=cuda,gpu -max_num_threads=1024 -thread_warp_size=32", "dense_large_batch.gpu", [["TENSOR", [128, 4032], "float32"], ["TENSOR", [4032, 1000], "float32"]], {}], "config": {"index": 4044122, "code_hash": null, "entity": [["tile_x", "sp", [-1, 4, 1, 1]], ["tile_y", "sp", [-1, 2, 1, 2]], ["tile_k", "sp", [-1, 8, 3]]]}, "result": [[0.005995288], 0, 1.4973769187927246, 1638074891.914937], "version": 0.2, "tvm_version": "0.8.dev0"}
{"input": ["cuda -keys=cuda,gpu -max_num_threads=1024 -thread_warp_size=32", "dense_large_batch.gpu", [["TENSOR", [128, 4032], "float32"], ["TENSOR", [4032, 1000], "float32"]], {}], "config": {"index": 2279078, "code_hash": null, "entity": [["tile_x", "sp", [-1, 4, 1, 2]], ["tile_y", "sp", [-1, 4, 1, 5]], ["tile_k", "sp", [-1, 7, 2]]]}, "result": [[0.008082114923076924], 0, 2.640754222869873, 1638074893.5652127], "version": 0.2, "tvm_version": "0.8.dev0"}
{"input": ["cuda -keys=cuda,gpu -max_num_threads=1024 -thread_warp_size=32", "dense_large_batch.gpu", [["TENSOR", [128, 4032], "float32"], ["TENSOR", [4032, 1000], "float32"]], {}], "config": {"index": 2412122, "code_hash": null, "entity": [["tile_x", "sp", [-1, 4, 1, 1]], ["tile_y", "sp", [-1, 2, 1, 2]], ["tile_k", "sp", [-1, 12, 2]]]}, "result": [[0.0060004774799999995], 0, 1.775585651397705, 1638074898.008894], "version": 0.2, "tvm_version": "0.8.dev0"}
{"input": ["cuda -keys=cuda,gpu -max_num_threads=1024 -thread_warp_size=32", "dense_large_batch.gpu", [["TENSOR", [128, 4032], "float32"], ["TENSOR", [4032, 1000], "float32"]], {}], "config": {"index": 2279077, "code_hash": null, "entity": [["tile_x", "sp", [-1, 2, 1, 2]], ["tile_y", "sp", [-1, 4, 1, 5]], ["tile_k", "sp", [-1, 7, 2]]]}, "result": [[0.006640478500000001], 0, 1.8387761116027832, 1638074899.2945452], "version": 0.2, "tvm_version": "0.8.dev0"}
{"input": ["cuda -keys=cuda,gpu -max_num_threads=1024 -thread_warp_size=32", "dense_large_batch.gpu", [["TENSOR", [128, 4032], "float32"], ["TENSOR", [4032, 1000], "float32"]], {}], "config": {"index": 2556359, "code_hash": null, "entity": [["tile_x", "sp", [-1, 1, 1, 128]], ["tile_y", "sp", [-1, 4, 1, 2]], ["tile_k", "sp", [-1, 18, 2]]]}, "result": [[0.19297497000000002], 0, 7.159099102020264, 1638074904.3768325], "version": 0.2, "tvm_version": "0.8.dev0"}
{"input": ["cuda -keys=cuda,gpu -max_num_threads=1024 -thread_warp_size=32", "dense_large_batch.gpu", [["TENSOR", [128, 4032], "float32"], ["TENSOR", [4032, 1000], "float32"]], {}], "config": {"index": 4032247, "code_hash": null, "entity": [["tile_x", "sp", [-1, 128, 1, 1]], ["tile_y", "sp", [-1, 4, 1, 1]], ["tile_k", "sp", [-1, 8, 3]]]}, "result": [[0.23566053625], 0, 6.535598516464233, 1638074909.5003543], "version": 0.2, "tvm_version": "0.8.dev0"}
{"input": ["cuda -keys=cuda,gpu -max_num_threads=1024 -thread_warp_size=32", "dense_large_batch.gpu", [["TENSOR", [128, 4032], "float32"], ["TENSOR", [4032, 1000], "float32"]], {}], "config": {"index": 4044187, "code_hash": null, "entity": [["tile_x", "sp", [-1, 8, 1, 4]], ["tile_y", "sp", [-1, 2, 1, 2]], ["tile_k", "sp", [-1, 8, 3]]]}, "result": [[0.03389575125], 0, 5.253625392913818, 1638074912.8063617], "version": 0.2, "tvm_version": "0.8.dev0"}
{"input": ["cuda -keys=cuda,gpu -max_num_threads=1024 -thread_warp_size=32", "dense_large_batch.gpu", [["TENSOR", [128, 4032], "float32"], ["TENSOR", [4032, 1000], "float32"]], {}], "config": {"index": 4044232, "code_hash": null, "entity": [["tile_x", "sp", [-1, 4, 1, 32]], ["tile_y", "sp", [-1, 2, 1, 2]], ["tile_k", "sp", [-1, 8, 3]]]}, "result": [[0.2749075895], 0, 6.261045455932617, 1638074917.572428], "version": 0.2, "tvm_version": "0.8.dev0"}
{"input": ["cuda -keys=cuda,gpu -max_num_threads=1024 -thread_warp_size=32", "dense_large_batch.gpu", [["TENSOR", [128, 4032], "float32"], ["TENSOR", [4032, 1000], "float32"]], {}], "config": {"index": 9840277, "code_hash": null, "entity": [["tile_x", "sp", [-1, 2, 1, 2]], ["tile_y", "sp", [-1, 4, 1, 1]], ["tile_k", "sp", [-1, 1, 9]]]}, "result": [[0.00628549], 0, 1.2377703189849854, 1638074918.6474383], "version": 0.2, "tvm_version": "0.8.dev0"}
{"input": ["cuda -keys=cuda,gpu -max_num_threads=1024 -thread_warp_size=32", "dense_large_batch.gpu", [["TENSOR", [128, 4032], "float32"], ["TENSOR", [4032, 1000], "float32"]], {}], "config": {"index": 4044207, "code_hash": null, "entity": [["tile_x", "sp", [-1, 4, 1, 8]], ["tile_y", "sp", [-1, 2, 1, 2]], ["tile_k", "sp", [-1, 8, 3]]]}, "result": [[0.03390677575], 0, 4.950366258621216, 1638074921.544109], "version": 0.2, "tvm_version": "0.8.dev0"}
{"input": ["cuda -keys=cuda,gpu -max_num_threads=1024 -thread_warp_size=32", "dense_large_batch.gpu", [["TENSOR", [128, 4032], "float32"], ["TENSOR", [4032, 1000], "float32"]], {}], "config": {"index": 6564310, "code_hash": null, "entity": [["tile_x", "sp", [-1, 1, 2, 4]], ["tile_y", "sp", [-1, 1, 2, 20]], ["tile_k", "sp", [-1, 1, 6]]]}, "result": [[0.006801972866666667], 0, 1.3412907123565674, 1638074926.2144635], "version": 0.2, "tvm_version": "0.8.dev0"}
{"input": ["cuda -keys=cuda,gpu -max_num_threads=1024 -thread_warp_size=32", "dense_large_batch.gpu", [["TENSOR", [128, 4032], "float32"], ["TENSOR", [4032, 1000], "float32"]], {}], "config": {"index": 5214041, "code_hash": null, "entity": [["tile_x", "sp", [-1, 32, 1, 2]], ["tile_y", "sp", [-1, 1, 1, 8]], ["tile_k", "sp", [-1, 3, 4]]]}, "result": [[0.32373010725], 0, 7.3990888595581055, 1638074931.6775408], "version": 0.2, "tvm_version": "0.8.dev0"}
{"input": ["cuda -keys=cuda,gpu -max_num_threads=1024 -thread_warp_size=32", "dense_large_batch.gpu", [["TENSOR", [128, 4032], "float32"], ["TENSOR", [4032, 1000], "float32"]], {}], "config": {"index": 6646869, "code_hash": null, "entity": [["tile_x", "sp", [-1, 32, 1, 4]], ["tile_y", "sp", [-1, 1, 1, 5]], ["tile_k", "sp", [-1, 3, 6]]]}, "result": [[0.3941873735], 0, 9.475716590881348, 1638074938.1441145], "version": 0.2, "tvm_version": "0.8.dev0"}
{"input": ["cuda -keys=cuda,gpu -max_num_threads=1024 -thread_warp_size=32", "dense_large_batch.gpu", [["TENSOR", [128, 4032], "float32"], ["TENSOR", [4032, 1000], "float32"]], {}], "config": {"index": 2220037, "code_hash": null, "entity": [["tile_x", "sp", [-1, 2, 1, 2]], ["tile_y", "sp", [-1, 1, 1, 2]], ["tile_k", "sp", [-1, 6, 2]]]}, "result": [[0.009133604], 0, 1.6339316368103027, 1638075011.876585], "version": 0.2, "tvm_version": "0.8.dev0"}
{"input": ["cuda -keys=cuda,gpu -max_num_threads=1024 -thread_warp_size=32", "dense_large_batch.gpu", [["TENSOR", [128, 4032], "float32"], ["TENSOR", [4032, 1000], "float32"]], {}], "config": {"index": 2304036, "code_hash": null, "entity": [["tile_x", "sp", [-1, 1, 1, 2]], ["tile_y", "sp", [-1, 1, 1, 1]], ["tile_k", "sp", [-1, 8, 2]]]}, "result": [[0.016648446285714286], 0, 1.540414810180664, 1638075012.9607048], "version": 0.2, "tvm_version": "0.8.dev0"}
{"input": ["cuda -keys=cuda,gpu -max_num_threads=1024 -thread_warp_size=32", "dense_large_batch.gpu", [["TENSOR", [128, 4032], "float32"], ["TENSOR", [4032, 1000], "float32"]], {}], "config": {"index": 2208037, "code_hash": null, "entity": [["tile_x", "sp", [-1, 2, 1, 2]], ["tile_y", "sp", [-1, 1, 1, 1]], ["tile_k", "sp", [-1, 6, 2]]]}, "result": [[0.013851801125], 0, 1.5666561126708984, 1638075014.0630965], "version": 0.2, "tvm_version": "0.8.dev0"}
{"input": ["cuda -keys=cuda,gpu -max_num_threads=1024 -thread_warp_size=32", "dense_large_batch.gpu", [["TENSOR", [128, 4032], "float32"], ["TENSOR", [4032, 1000], "float32"]], {}], "config": {"index": 2227237, "code_hash": null, "entity": [["tile_x", "sp", [-1, 2, 1, 2]], ["tile_y", "sp", [-1, 1, 1, 4]], ["tile_k", "sp", [-1, 6, 2]]]}, "result": [[0.006021604823529412], 0, 1.466630458831787, 1638075015.0689013], "version": 0.2, "tvm_version": "0.8.dev0"}
{"input": ["cuda -keys=cuda,gpu -max_num_threads=1024 -thread_warp_size=32", "dense_large_batch.gpu", [["TENSOR", [128, 4032], "float32"], ["TENSOR", [4032, 1000], "float32"]], {}], "config": {"index": 2230837, "code_hash": null, "entity": [["tile_x", "sp", [-1, 2, 1, 2]], ["tile_y", "sp", [-1, 1, 1, 5]], ["tile_k", "sp", [-1, 6, 2]]]}, "result": [[0.0058711875000000005], 0, 1.5097885131835938, 1638075016.1183066], "version": 0.2, "tvm_version": "0.8.dev0"}
{"input": ["cuda -keys=cuda,gpu -max_num_threads=1024 -thread_warp_size=32", "dense_large_batch.gpu", [["TENSOR", [128, 4032], "float32"], ["TENSOR", [4032, 1000], "float32"]], {}], "config": {"index": 2220036, "code_hash": null, "entity": [["tile_x", "sp", [-1, 1, 1, 2]], ["tile_y", "sp", [-1, 1, 1, 2]], ["tile_k", "sp", [-1, 6, 2]]]}, "result": [[0.011014923], 0, 1.4224960803985596, 1638075017.1682744], "version": 0.2, "tvm_version": "0.8.dev0"}
{"input": ["cuda -keys=cuda,gpu -max_num_threads=1024 -thread_warp_size=32", "dense_large_batch.gpu", [["TENSOR", [128, 4032], "float32"], ["TENSOR", [4032, 1000], "float32"]], {}], "config": {"index": 2400036, "code_hash": null, "entity": [["tile_x", "sp", [-1, 1, 1, 2]], ["tile_y", "sp", [-1, 1, 1, 1]], ["tile_k", "sp", [-1, 12, 2]]]}, "result": [[0.016256473142857143], 0, 1.4991729259490967, 1638075018.2747848], "version": 0.2, "tvm_version": "0.8.dev0"}
{"input": ["cuda -keys=cuda,gpu -max_num_threads=1024 -thread_warp_size=32", "dense_large_batch.gpu", [["TENSOR", [128, 4032], "float32"], ["TENSOR", [4032, 1000], "float32"]], {}], "config": {"index": 2230836, "code_hash": null, "entity": [["tile_x", "sp", [-1, 1, 1, 2]], ["tile_y", "sp", [-1, 1, 1, 5]], ["tile_k", "sp", [-1, 6, 2]]]}, "result": [[0.008436676583333334], 0, 1.6327028274536133, 1638075019.3384018], "version": 0.2, "tvm_version": "0.8.dev0"}
{"input": ["cuda -keys=cuda,gpu -max_num_threads=1024 -thread_warp_size=32", "dense_large_batch.gpu", [["TENSOR", [128, 4032], "float32"], ["TENSOR", [4032, 1000], "float32"]], {}], "config": {"index": 2208038, "code_hash": null, "entity": [["tile_x", "sp", [-1, 4, 1, 2]], ["tile_y", "sp", [-1, 1, 1, 1]], ["tile_k", "sp", [-1, 6, 2]]]}, "result": [[0.012671176875], 0, 1.554934024810791, 1638075020.3490858], "version": 0.2, "tvm_version": "0.8.dev0"}
{"input": ["cuda -keys=cuda,gpu -max_num_threads=1024 -thread_warp_size=32", "dense_large_batch.gpu", [["TENSOR", [128, 4032], "float32"], ["TENSOR", [4032, 1000], "float32"]], {}], "config": {"index": 2208036, "code_hash": null, "entity": [["tile_x", "sp", [-1, 1, 1, 2]], ["tile_y", "sp", [-1, 1, 1, 1]], ["tile_k", "sp", [-1, 6, 2]]]}, "result": [[0.016429239], 0, 1.5088717937469482, 1638075021.410796], "version": 0.2, "tvm_version": "0.8.dev0"}
{"input": ["cuda -keys=cuda,gpu -max_num_threads=1024 -thread_warp_size=32", "dense_large_batch.gpu", [["TENSOR", [128, 4032], "float32"], ["TENSOR", [4032, 1000], "float32"]], {}], "config": {"index": 2220038, "code_hash": null, "entity": [["tile_x", "sp", [-1, 4, 1, 2]], ["tile_y", "sp", [-1, 1, 1, 2]], ["tile_k", "sp", [-1, 6, 2]]]}, "result": [[0.007557769357142857], 0, 1.4886806011199951, 1638075022.4611647], "version": 0.2, "tvm_version": "0.8.dev0"}
{"input": ["cuda -keys=cuda,gpu -max_num_threads=1024 -thread_warp_size=32", "dense_large_batch.gpu", [["TENSOR", [128, 4032], "float32"], ["TENSOR", [4032, 1000], "float32"]], {}], "config": {"index": 2230801, "code_hash": null, "entity": [["tile_x", "sp", [-1, 2, 1, 1]], ["tile_y", "sp", [-1, 1, 1, 5]], ["tile_k", "sp", [-1, 6, 2]]]}, "result": [[0.008453084416666666], 0, 1.331974744796753, 1638075023.4611654], "version": 0.2, "tvm_version": "0.8.dev0"}
{"input": ["cuda -keys=cuda,gpu -max_num_threads=1024 -thread_warp_size=32", "dense_large_batch.gpu", [["TENSOR", [128, 4032], "float32"], ["TENSOR", [4032, 1000], "float32"]], {}], "config": {"index": 4032122, "code_hash": null, "entity": [["tile_x", "sp", [-1, 4, 1, 1]], ["tile_y", "sp", [-1, 2, 1, 1]], ["tile_k", "sp", [-1, 8, 3]]]}, "result": [[0.008450651166666667], 0, 1.7086970806121826, 1638075024.4827385], "version": 0.2, "tvm_version": "0.8.dev0"}
{"input": ["cuda -keys=cuda,gpu -max_num_threads=1024 -thread_warp_size=32", "dense_large_batch.gpu", [["TENSOR", [128, 4032], "float32"], ["TENSOR", [4032, 1000], "float32"]], {}], "config": {"index": 2316000, "code_hash": null, "entity": [["tile_x", "sp", [-1, 1, 1, 1]], ["tile_y", "sp", [-1, 1, 1, 2]], ["tile_k", "sp", [-1, 8, 2]]]}, "result": [[0.017564730666666667], 0, 1.4281325340270996, 1638075025.5481079], "version": 0.2, "tvm_version": "0.8.dev0"}
{"input": ["cuda -keys=cuda,gpu -max_num_threads=1024 -thread_warp_size=32", "dense_large_batch.gpu", [["TENSOR", [128, 4032], "float32"], ["TENSOR", [4032, 1000], "float32"]], {}], "config": {"index": 2400001, "code_hash": null, "entity": [["tile_x", "sp", [-1, 2, 1, 1]], ["tile_y", "sp", [-1, 1, 1, 1]], ["tile_k", "sp", [-1, 12, 2]]]}, "result": [[0.016251901857142856], 0, 1.6177773475646973, 1638075026.6186175], "version": 0.2, "tvm_version": "0.8.dev0"}
{"input": ["cuda -keys=cuda,gpu -max_num_threads=1024 -thread_warp_size=32", "dense_large_batch.gpu", [["TENSOR", [128, 4032], "float32"], ["TENSOR", [4032, 1000], "float32"]], {}], "config": {"index": 2208002, "code_hash": null, "entity": [["tile_x", "sp", [-1, 4, 1, 1]], ["tile_y", "sp", [-1, 1, 1, 1]], ["tile_k", "sp", [-1, 6, 2]]]}, "result": [[0.013854526], 0, 1.5690219402313232, 1638075027.6876373], "version": 0.2, "tvm_version": "0.8.dev0"}
{"input": ["cuda -keys=cuda,gpu -max_num_threads=1024 -thread_warp_size=32", "dense_large_batch.gpu", [["TENSOR", [128, 4032], "float32"], ["TENSOR", [4032, 1000], "float32"]], {}], "config": {"index": 2227200, "code_hash": null, "entity": [["tile_x", "sp", [-1, 1, 1, 1]], ["tile_y", "sp", [-1, 1, 1, 4]], ["tile_k", "sp", [-1, 6, 2]]]}, "result": [[0.013566572875], 0, 1.4900498390197754, 1638075028.7344615], "version": 0.2, "tvm_version": "0.8.dev0"}
{"input": ["cuda -keys=cuda,gpu -max_num_threads=1024 -thread_warp_size=32", "dense_large_batch.gpu", [["TENSOR", [128, 4032], "float32"], ["TENSOR", [4032, 1000], "float32"]], {}], "config": {"index": 2230800, "code_hash": null, "entity": [["tile_x", "sp", [-1, 1, 1, 1]], ["tile_y", "sp", [-1, 1, 1, 5]], ["tile_k", "sp", [-1, 6, 2]]]}, "result": [[0.014386148142857142], 0, 1.4373149871826172, 1638075029.783989], "version": 0.2, "tvm_version": "0.8.dev0"}
{"input": ["cuda -keys=cuda,gpu -max_num_threads=1024 -thread_warp_size=32", "dense_large_batch.gpu", [["TENSOR", [128, 4032], "float32"], ["TENSOR", [4032, 1000], "float32"]], {}], "config": {"index": 2304000, "code_hash": null, "entity": [["tile_x", "sp", [-1, 1, 1, 1]], ["tile_y", "sp", [-1, 1, 1, 1]], ["tile_k", "sp", [-1, 8, 2]]]}, "result": [[0.022899191166666666], 0, 1.4865050315856934, 1638075030.9567623], "version": 0.2, "tvm_version": "0.8.dev0"}
{"input": ["cuda -keys=cuda,gpu -max_num_threads=1024 -thread_warp_size=32", "dense_large_batch.gpu", [["TENSOR", [128, 4032], "float32"], ["TENSOR", [4032, 1000], "float32"]], {}], "config": {"index": 2304001, "code_hash": null, "entity": [["tile_x", "sp", [-1, 2, 1, 1]], ["tile_y", "sp", [-1, 1, 1, 1]], ["tile_k", "sp", [-1, 8, 2]]]}, "result": [[0.01665176042857143], 0, 1.4304988384246826, 1638075031.9915454], "version": 0.2, "tvm_version": "0.8.dev0"}
{"input": ["cuda -keys=cuda,gpu -max_num_threads=1024 -thread_warp_size=32", "dense_large_batch.gpu", [["TENSOR", [128, 4032], "float32"], ["TENSOR", [4032, 1000], "float32"]], {}], "config": {"index": 2412000, "code_hash": null, "entity": [["tile_x", "sp", [-1, 1, 1, 1]], ["tile_y", "sp", [-1, 1, 1, 2]], ["tile_k", "sp", [-1, 12, 2]]]}, "result": [[0.016215403], 0, 1.5886669158935547, 1638075033.062381], "version": 0.2, "tvm_version": "0.8.dev0"}
{"input": ["cuda -keys=cuda,gpu -max_num_threads=1024 -thread_warp_size=32", "dense_large_batch.gpu", [["TENSOR", [128, 4032], "float32"], ["TENSOR", [4032, 1000], "float32"]], {}], "config": {"index": 2304002, "code_hash": null, "entity": [["tile_x", "sp", [-1, 4, 1, 1]], ["tile_y", "sp", [-1, 1, 1, 1]], ["tile_k", "sp", [-1, 8, 2]]]}, "result": [[0.013737404875], 0, 1.5812323093414307, 1638075034.1260722], "version": 0.2, "tvm_version": "0.8.dev0"}
{"input": ["cuda -keys=cuda,gpu -max_num_threads=1024 -thread_warp_size=32", "dense_large_batch.gpu", [["TENSOR", [128, 4032], "float32"], ["TENSOR", [4032, 1000], "float32"]], {}], "config": {"index": 5280120, "code_hash": null, "entity": [["tile_x", "sp", [-1, 1, 1, 1]], ["tile_y", "sp", [-1, 2, 1, 1]], ["tile_k", "sp", [-1, 6, 4]]]}, "result": [[0.016199975000000002], 0, 1.4683401584625244, 1638075035.2317176], "version": 0.2, "tvm_version": "0.8.dev0"}
{"input": ["cuda -keys=cuda,gpu -max_num_threads=1024 -thread_warp_size=32", "dense_large_batch.gpu", [["TENSOR", [128, 4032], "float32"], ["TENSOR", [4032, 1000], "float32"]], {}], "config": {"index": 4044121, "code_hash": null, "entity": [["tile_x", "sp", [-1, 2, 1, 1]], ["tile_y", "sp", [-1, 2, 1, 2]], ["tile_k", "sp", [-1, 8, 3]]]}, "result": [[0.008295015846153846], 0, 1.6248185634613037, 1638075036.3439746], "version": 0.2, "tvm_version": "0.8.dev0"}
{"input": ["cuda -keys=cuda,gpu -max_num_threads=1024 -thread_warp_size=32", "dense_large_batch.gpu", [["TENSOR", [128, 4032], "float32"], ["TENSOR", [4032, 1000], "float32"]], {}], "config": {"index": 5280002, "code_hash": null, "entity": [["tile_x", "sp", [-1, 4, 1, 1]], ["tile_y", "sp", [-1, 1, 1, 1]], ["tile_k", "sp", [-1, 6, 4]]]}, "result": [[0.013647395250000001], 0, 1.2827460765838623, 1638075038.7374256], "version": 0.2, "tvm_version": "0.8.dev0"}
{"input": ["cuda -keys=cuda,gpu -max_num_threads=1024 -thread_warp_size=32", "dense_large_batch.gpu", [["TENSOR", [128, 4032], "float32"], ["TENSOR", [4032, 1000], "float32"]], {}], "config": {"index": 2400002, "code_hash": null, "entity": [["tile_x", "sp", [-1, 4, 1, 1]], ["tile_y", "sp", [-1, 1, 1, 1]], ["tile_k", "sp", [-1, 12, 2]]]}, "result": [[0.013663182250000001], 0, 1.2704167366027832, 1638075039.6788392], "version": 0.2, "tvm_version": "0.8.dev0"}
{"input": ["cuda -keys=cuda,gpu -max_num_threads=1024 -thread_warp_size=32", "dense_large_batch.gpu", [["TENSOR", [128, 4032], "float32"], ["TENSOR", [4032, 1000], "float32"]], {}], "config": {"index": 5292001, "code_hash": null, "entity": [["tile_x", "sp", [-1, 2, 1, 1]], ["tile_y", "sp", [-1, 1, 1, 2]], ["tile_k", "sp", [-1, 6, 4]]]}, "result": [[0.0109372856], 0, 1.2237176895141602, 1638075040.6838048], "version": 0.2, "tvm_version": "0.8.dev0"}
{"input": ["cuda -keys=cuda,gpu -max_num_threads=1024 -thread_warp_size=32", "dense_large_batch.gpu", [["TENSOR", [128, 4032], "float32"], ["TENSOR", [4032, 1000], "float32"]], {}], "config": {"index": 2208000, "code_hash": null, "entity": [["tile_x", "sp", [-1, 1, 1, 1]], ["tile_y", "sp", [-1, 1, 1, 1]], ["tile_k", "sp", [-1, 6, 2]]]}, "result": [[0.022076367833333332], 0, 1.3029215335845947, 1638075041.8319705], "version": 0.2, "tvm_version": "0.8.dev0"}
{"input": ["cuda -keys=cuda,gpu -max_num_threads=1024 -thread_warp_size=32", "dense_large_batch.gpu", [["TENSOR", [128, 4032], "float32"], ["TENSOR", [4032, 1000], "float32"]], {}], "config": {"index": 5292121, "code_hash": null, "entity": [["tile_x", "sp", [-1, 2, 1, 1]], ["tile_y", "sp", [-1, 2, 1, 2]], ["tile_k", "sp", [-1, 6, 4]]]}, "result": [[0.008267555153846154], 0, 1.2389452457427979, 1638075042.7458541], "version": 0.2, "tvm_version": "0.8.dev0"}
{"input": ["cuda -keys=cuda,gpu -max_num_threads=1024 -thread_warp_size=32", "dense_large_batch.gpu", [["TENSOR", [128, 4032], "float32"], ["TENSOR", [4032, 1000], "float32"]], {}], "config": {"index": 2208001, "code_hash": null, "entity": [["tile_x", "sp", [-1, 2, 1, 1]], ["tile_y", "sp", [-1, 1, 1, 1]], ["tile_k", "sp", [-1, 6, 2]]]}, "result": [[0.016417896428571426], 0, 1.1760344505310059, 1638075043.719479], "version": 0.2, "tvm_version": "0.8.dev0"}
{"input": ["cuda -keys=cuda,gpu -max_num_threads=1024 -thread_warp_size=32", "dense_large_batch.gpu", [["TENSOR", [128, 4032], "float32"], ["TENSOR", [4032, 1000], "float32"]], {}], "config": {"index": 2412001, "code_hash": null, "entity": [["tile_x", "sp", [-1, 2, 1, 1]], ["tile_y", "sp", [-1, 1, 1, 2]], ["tile_k", "sp", [-1, 12, 2]]]}, "result": [[0.0109402155], 0, 1.298790693283081, 1638075044.653794], "version": 0.2, "tvm_version": "0.8.dev0"}
{"input": ["cuda -keys=cuda,gpu -max_num_threads=1024 -thread_warp_size=32", "dense_large_batch.gpu", [["TENSOR", [128, 4032], "float32"], ["TENSOR", [4032, 1000], "float32"]], {}], "config": {"index": 4044002, "code_hash": null, "entity": [["tile_x", "sp", [-1, 4, 1, 1]], ["tile_y", "sp", [-1, 1, 1, 2]], ["tile_k", "sp", [-1, 8, 3]]]}, "result": [[0.00844697625], 0, 1.3764772415161133, 1638075045.6431656], "version": 0.2, "tvm_version": "0.8.dev0"}
{"input": ["cuda -keys=cuda,gpu -max_num_threads=1024 -thread_warp_size=32", "dense_large_batch.gpu", [["TENSOR", [128, 4032], "float32"], ["TENSOR", [4032, 1000], "float32"]], {}], "config": {"index": 2412002, "code_hash": null, "entity": [["tile_x", "sp", [-1, 4, 1, 1]], ["tile_y", "sp", [-1, 1, 1, 2]], ["tile_k", "sp", [-1, 12, 2]]]}, "result": [[0.008448101166666666], 0, 1.3354783058166504, 1638075046.5998151], "version": 0.2, "tvm_version": "0.8.dev0"}
{"input": ["cuda -keys=cuda,gpu -max_num_threads=1024 -thread_warp_size=32", "dense_large_batch.gpu", [["TENSOR", [128, 4032], "float32"], ["TENSOR", [4032, 1000], "float32"]], {}], "config": {"index": 2316001, "code_hash": null, "entity": [["tile_x", "sp", [-1, 2, 1, 1]], ["tile_y", "sp", [-1, 1, 1, 2]], ["tile_k", "sp", [-1, 8, 2]]]}, "result": [[0.011424396444444445], 0, 1.362694263458252, 1638075047.6346757], "version": 0.2, "tvm_version": "0.8.dev0"}
{"input": ["cuda -keys=cuda,gpu -max_num_threads=1024 -thread_warp_size=32", "dense_large_batch.gpu", [["TENSOR", [128, 4032], "float32"], ["TENSOR", [4032, 1000], "float32"]], {}], "config": {"index": 2400000, "code_hash": null, "entity": [["tile_x", "sp", [-1, 1, 1, 1]], ["tile_y", "sp", [-1, 1, 1, 1]], ["tile_k", "sp", [-1, 12, 2]]]}, "result": [[0.021909589999999996], 0, 1.4186463356018066, 1638075048.8195486], "version": 0.2, "tvm_version": "0.8.dev0"}
{"input": ["cuda -keys=cuda,gpu -max_num_threads=1024 -thread_warp_size=32", "dense_large_batch.gpu", [["TENSOR", [128, 4032], "float32"], ["TENSOR", [4032, 1000], "float32"]], {}], "config": {"index": 5292120, "code_hash": null, "entity": [["tile_x", "sp", [-1, 1, 1, 1]], ["tile_y", "sp", [-1, 2, 1, 2]], ["tile_k", "sp", [-1, 6, 4]]]}, "result": [[0.013448139125000001], 0, 1.3918752670288086, 1638075049.9274127], "version": 0.2, "tvm_version": "0.8.dev0"}
{"input": ["cuda -keys=cuda,gpu -max_num_threads=1024 -thread_warp_size=32", "dense_large_batch.gpu", [["TENSOR", [128, 4032], "float32"], ["TENSOR", [4032, 1000], "float32"]], {}], "config": {"index": 5280001, "code_hash": null, "entity": [["tile_x", "sp", [-1, 2, 1, 1]], ["tile_y", "sp", [-1, 1, 1, 1]], ["tile_k", "sp", [-1, 6, 4]]]}, "result": [[0.016257158857142857], 0, 1.479182243347168, 1638075051.1321096], "version": 0.2, "tvm_version": "0.8.dev0"}
{"input": ["cuda -keys=cuda,gpu -max_num_threads=1024 -thread_warp_size=32", "dense_large_batch.gpu", [["TENSOR", [128, 4032], "float32"], ["TENSOR", [4032, 1000], "float32"]], {}], "config": {"index": 5280000, "code_hash": null, "entity": [["tile_x", "sp", [-1, 1, 1, 1]], ["tile_y", "sp", [-1, 1, 1, 1]], ["tile_k", "sp", [-1, 6, 4]]]}, "result": [[0.021906406833333336], 0, 1.4861016273498535, 1638075052.3450148], "version": 0.2, "tvm_version": "0.8.dev0"}
{"input": ["cuda -keys=cuda,gpu -max_num_threads=1024 -thread_warp_size=32", "dense_large_batch.gpu", [["TENSOR", [128, 4032], "float32"], ["TENSOR", [4032, 1000], "float32"]], {}], "config": {"index": 5292184, "code_hash": null, "entity": [["tile_x", "sp", [-1, 1, 1, 4]], ["tile_y", "sp", [-1, 2, 1, 2]], ["tile_k", "sp", [-1, 6, 4]]]}, "result": [[0.006004005470588235], 0, 1.6342661380767822, 1638075053.583293], "version": 0.2, "tvm_version": "0.8.dev0"}
{"input": ["cuda -keys=cuda,gpu -max_num_threads=1024 -thread_warp_size=32", "dense_large_batch.gpu", [["TENSOR", [128, 4032], "float32"], ["TENSOR", [4032, 1000], "float32"]], {}], "config": {"index": 2230864, "code_hash": null, "entity": [["tile_x", "sp", [-1, 1, 1, 4]], ["tile_y", "sp", [-1, 1, 1, 5]], ["tile_k", "sp", [-1, 6, 2]]]}, "result": [[0.005945224941176471], 0, 1.4714581966400146, 1638075054.701061], "version": 0.2, "tvm_version": "0.8.dev0"}
{"input": ["cuda -keys=cuda,gpu -max_num_threads=1024 -thread_warp_size=32", "dense_large_batch.gpu", [["TENSOR", [128, 4032], "float32"], ["TENSOR", [4032, 1000], "float32"]], {}], "config": {"index": 2230838, "code_hash": null, "entity": [["tile_x", "sp", [-1, 4, 1, 2]], ["tile_y", "sp", [-1, 1, 1, 5]], ["tile_k", "sp", [-1, 6, 2]]]}, "result": [[0.00413996184], 0, 1.517949104309082, 1638075055.8659906], "version": 0.2, "tvm_version": "0.8.dev0"}
{"input": ["cuda -keys=cuda,gpu -max_num_threads=1024 -thread_warp_size=32", "dense_large_batch.gpu", [["TENSOR", [128, 4032], "float32"], ["TENSOR", [4032, 1000], "float32"]], {}], "config": {"index": 2230802, "code_hash": null, "entity": [["tile_x", "sp", [-1, 4, 1, 1]], ["tile_y", "sp", [-1, 1, 1, 5]], ["tile_k", "sp", [-1, 6, 2]]]}, "result": [[0.005910255529411765], 0, 1.541431188583374, 1638075057.087906], "version": 0.2, "tvm_version": "0.8.dev0"}
{"input": ["cuda -keys=cuda,gpu -max_num_threads=1024 -thread_warp_size=32", "dense_large_batch.gpu", [["TENSOR", [128, 4032], "float32"], ["TENSOR", [4032, 1000], "float32"]], {}], "config": {"index": 2460002, "code_hash": null, "entity": [["tile_x", "sp", [-1, 4, 1, 1]], ["tile_y", "sp", [-1, 1, 1, 2]], ["tile_k", "sp", [-1, 14, 2]]]}, "result": [[0.008362745666666666], 0, 1.618478775024414, 1638075058.1974185], "version": 0.2, "tvm_version": "0.8.dev0"}
{"input": ["cuda -keys=cuda,gpu -max_num_threads=1024 -thread_warp_size=32", "dense_large_batch.gpu", [["TENSOR", [128, 4032], "float32"], ["TENSOR", [4032, 1000], "float32"]], {}], "config": {"index": 4080000, "code_hash": null, "entity": [["tile_x", "sp", [-1, 1, 1, 1]], ["tile_y", "sp", [-1, 1, 1, 1]], ["tile_k", "sp", [-1, 12, 3]]]}, "result": [[0.021772261], 0, 1.5902726650238037, 1638075059.527134], "version": 0.2, "tvm_version": "0.8.dev0"}
{"input": ["cuda -keys=cuda,gpu -max_num_threads=1024 -thread_warp_size=32", "dense_large_batch.gpu", [["TENSOR", [128, 4032], "float32"], ["TENSOR", [4032, 1000], "float32"]], {}], "config": {"index": 2496000, "code_hash": null, "entity": [["tile_x", "sp", [-1, 1, 1, 1]], ["tile_y", "sp", [-1, 1, 1, 1]], ["tile_k", "sp", [-1, 16, 2]]]}, "result": [[0.022688698000000004], 0, 1.4790480136871338, 1638075060.7029607], "version": 0.2, "tvm_version": "0.8.dev0"}
{"input": ["cuda -keys=cuda,gpu -max_num_threads=1024 -thread_warp_size=32", "dense_large_batch.gpu", [["TENSOR", [128, 4032], "float32"], ["TENSOR", [4032, 1000], "float32"]], {}], "config": {"index": 4080120, "code_hash": null, "entity": [["tile_x", "sp", [-1, 1, 1, 1]], ["tile_y", "sp", [-1, 2, 1, 1]], ["tile_k", "sp", [-1, 12, 3]]]}, "result": [[0.016142619714285714], 0, 1.3956577777862549, 1638075061.7782032], "version": 0.2, "tvm_version": "0.8.dev0"}
{"input": ["cuda -keys=cuda,gpu -max_num_threads=1024 -thread_warp_size=32", "dense_large_batch.gpu", [["TENSOR", [128, 4032], "float32"], ["TENSOR", [4032, 1000], "float32"]], {}], "config": {"index": 5328121, "code_hash": null, "entity": [["tile_x", "sp", [-1, 2, 1, 1]], ["tile_y", "sp", [-1, 2, 1, 1]], ["tile_k", "sp", [-1, 7, 4]]]}, "result": [[0.0109535851], 0, 1.270784616470337, 1638075062.7809687], "version": 0.2, "tvm_version": "0.8.dev0"}
{"input": ["cuda -keys=cuda,gpu -max_num_threads=1024 -thread_warp_size=32", "dense_large_batch.gpu", [["TENSOR", [128, 4032], "float32"], ["TENSOR", [4032, 1000], "float32"]], {}], "config": {"index": 5328001, "code_hash": null, "entity": [["tile_x", "sp", [-1, 2, 1, 1]], ["tile_y", "sp", [-1, 1, 1, 1]], ["tile_k", "sp", [-1, 7, 4]]]}, "result": [[0.016296643285714285], 0, 1.3352560997009277, 1638075063.831928], "version": 0.2, "tvm_version": "0.8.dev0"}
{"input": ["cuda -keys=cuda,gpu -max_num_threads=1024 -thread_warp_size=32", "dense_large_batch.gpu", [["TENSOR", [128, 4032], "float32"], ["TENSOR", [4032, 1000], "float32"]], {}], "config": {"index": 6559238, "code_hash": null, "entity": [["tile_x", "sp", [-1, 4, 1, 2]], ["tile_y", "sp", [-1, 1, 1, 10]], ["tile_k", "sp", [-1, 1, 6]]]}, "result": [[0.028868789750000002], 0, 1.9345073699951172, 1638075144.5364575], "version": 0.2, "tvm_version": "0.8.dev0"}
{"input": ["cuda -keys=cuda,gpu -max_num_threads=1024 -thread_warp_size=32", "dense_large_batch.gpu", [["TENSOR", [128, 4032], "float32"], ["TENSOR", [4032, 1000], "float32"]], {}], "config": {"index": 2278837, "code_hash": null, "entity": [["tile_x", "sp", [-1, 2, 1, 2]], ["tile_y", "sp", [-1, 1, 1, 5]], ["tile_k", "sp", [-1, 7, 2]]]}, "result": [[0.006698856333333334], 0, 1.5581555366516113, 1638075145.5818493], "version": 0.2, "tvm_version": "0.8.dev0"}
{"input": ["cuda -keys=cuda,gpu -max_num_threads=1024 -thread_warp_size=32", "dense_large_batch.gpu", [["TENSOR", [128, 4032], "float32"], ["TENSOR", [4032, 1000], "float32"]], {}], "config": {"index": 2275357, "code_hash": null, "entity": [["tile_x", "sp", [-1, 2, 1, 2]], ["tile_y", "sp", [-1, 2, 1, 4]], ["tile_k", "sp", [-1, 7, 2]]]}, "result": [[0.00508843515], 0, 1.8104753494262695, 1638075146.6566482], "version": 0.2, "tvm_version": "0.8.dev0"}
{"input": ["cuda -keys=cuda,gpu -max_num_threads=1024 -thread_warp_size=32", "dense_large_batch.gpu", [["TENSOR", [128, 4032], "float32"], ["TENSOR", [4032, 1000], "float32"]], {}], "config": {"index": 2323357, "code_hash": null, "entity": [["tile_x", "sp", [-1, 2, 1, 2]], ["tile_y", "sp", [-1, 2, 1, 4]], ["tile_k", "sp", [-1, 8, 2]]]}, "result": [[0.005237335300000001], 0, 1.862732172012329, 1638075147.7330637], "version": 0.2, "tvm_version": "0.8.dev0"}
{"input": ["cuda -keys=cuda,gpu -max_num_threads=1024 -thread_warp_size=32", "dense_large_batch.gpu", [["TENSOR", [128, 4032], "float32"], ["TENSOR", [4032, 1000], "float32"]], {}], "config": {"index": 2134985, "code_hash": null, "entity": [["tile_x", "sp", [-1, 2, 1, 4]], ["tile_y", "sp", [-1, 2, 1, 5]], ["tile_k", "sp", [-1, 3, 2]]]}, "result": [[0.0063136641875], 0, 1.7716939449310303, 1638075148.8308296], "version": 0.2, "tvm_version": "0.8.dev0"}
{"input": ["cuda -keys=cuda,gpu -max_num_threads=1024 -thread_warp_size=32", "dense_large_batch.gpu", [["TENSOR", [128, 4032], "float32"], ["TENSOR", [4032, 1000], "float32"]], {}], "config": {"index": 5203357, "code_hash": null, "entity": [["tile_x", "sp", [-1, 2, 1, 2]], ["tile_y", "sp", [-1, 2, 1, 4]], ["tile_k", "sp", [-1, 3, 4]]]}, "result": [[0.004887536857142857], 0, 1.6214144229888916, 1638075149.8436089], "version": 0.2, "tvm_version": "0.8.dev0"}
{"input": ["cuda -keys=cuda,gpu -max_num_threads=1024 -thread_warp_size=32", "dense_large_batch.gpu", [["TENSOR", [128, 4032], "float32"], ["TENSOR", [4032, 1000], "float32"]], {}], "config": {"index": 2374837, "code_hash": null, "entity": [["tile_x", "sp", [-1, 2, 1, 2]], ["tile_y", "sp", [-1, 1, 1, 5]], ["tile_k", "sp", [-1, 9, 2]]]}, "result": [[0.0067871600666666665], 0, 1.8551793098449707, 1638075150.913678], "version": 0.2, "tvm_version": "0.8.dev0"}
{"input": ["cuda -keys=cuda,gpu -max_num_threads=1024 -thread_warp_size=32", "dense_large_batch.gpu", [["TENSOR", [128, 4032], "float32"], ["TENSOR", [4032, 1000], "float32"]], {}], "config": {"index": 2371357, "code_hash": null, "entity": [["tile_x", "sp", [-1, 2, 1, 2]], ["tile_y", "sp", [-1, 2, 1, 4]], ["tile_k", "sp", [-1, 9, 2]]]}, "result": [[0.0050856052], 0, 1.9401459693908691, 1638075152.2125545], "version": 0.2, "tvm_version": "0.8.dev0"}
{"input": ["cuda -keys=cuda,gpu -max_num_threads=1024 -thread_warp_size=32", "dense_large_batch.gpu", [["TENSOR", [128, 4032], "float32"], ["TENSOR", [4032, 1000], "float32"]], {}], "config": {"index": 3823238, "code_hash": null, "entity": [["tile_x", "sp", [-1, 4, 1, 2]], ["tile_y", "sp", [-1, 1, 1, 10]], ["tile_k", "sp", [-1, 2, 3]]]}, "result": [[0.0063056644375], 0, 1.5976333618164062, 1638075153.3668618], "version": 0.2, "tvm_version": "0.8.dev0"}
{"input": ["cuda -keys=cuda,gpu -max_num_threads=1024 -thread_warp_size=32", "dense_large_batch.gpu", [["TENSOR", [128, 4032], "float32"], ["TENSOR", [4032, 1000], "float32"]], {}], "config": {"index": 5206802, "code_hash": null, "entity": [["tile_x", "sp", [-1, 4, 1, 1]], ["tile_y", "sp", [-1, 1, 1, 5]], ["tile_k", "sp", [-1, 3, 4]]]}, "result": [[0.005914243647058824], 0, 1.4841840267181396, 1638075154.288579], "version": 0.2, "tvm_version": "0.8.dev0"}
{"input": ["cuda -keys=cuda,gpu -max_num_threads=1024 -thread_warp_size=32", "dense_large_batch.gpu", [["TENSOR", [128, 4032], "float32"], ["TENSOR", [4032, 1000], "float32"]], {}], "config": {"index": 5214002, "code_hash": null, "entity": [["tile_x", "sp", [-1, 4, 1, 1]], ["tile_y", "sp", [-1, 1, 1, 8]], ["tile_k", "sp", [-1, 3, 4]]]}, "result": [[0.004878760952380952], 0, 1.6298942565917969, 1638075155.3452027], "version": 0.2, "tvm_version": "0.8.dev0"}
{"input": ["cuda -keys=cuda,gpu -max_num_threads=1024 -thread_warp_size=32", "dense_large_batch.gpu", [["TENSOR", [128, 4032], "float32"], ["TENSOR", [4032, 1000], "float32"]], {}], "config": {"index": 2143238, "code_hash": null, "entity": [["tile_x", "sp", [-1, 4, 1, 2]], ["tile_y", "sp", [-1, 1, 1, 10]], ["tile_k", "sp", [-1, 3, 2]]]}, "result": [[0.006307083125], 0, 1.7210266590118408, 1638075156.4411871], "version": 0.2, "tvm_version": "0.8.dev0"}
{"input": ["cuda -keys=cuda,gpu -max_num_threads=1024 -thread_warp_size=32", "dense_large_batch.gpu", [["TENSOR", [128, 4032], "float32"], ["TENSOR", [4032, 1000], "float32"]], {}], "config": {"index": 3859237, "code_hash": null, "entity": [["tile_x", "sp", [-1, 2, 1, 2]], ["tile_y", "sp", [-1, 1, 1, 4]], ["tile_k", "sp", [-1, 3, 3]]]}, "result": [[0.006308926875], 0, 1.619398593902588, 1638075157.4496982], "version": 0.2, "tvm_version": "0.8.dev0"}
{"input": ["cuda -keys=cuda,gpu -max_num_threads=1024 -thread_warp_size=32", "dense_large_batch.gpu", [["TENSOR", [128, 4032], "float32"], ["TENSOR", [4032, 1000], "float32"]], {}], "config": {"index": 2371237, "code_hash": null, "entity": [["tile_x", "sp", [-1, 2, 1, 2]], ["tile_y", "sp", [-1, 1, 1, 4]], ["tile_k", "sp", [-1, 9, 2]]]}, "result": [[0.00648973975], 0, 1.7589449882507324, 1638075158.475249], "version": 0.2, "tvm_version": "0.8.dev0"}
{"input": ["cuda -keys=cuda,gpu -max_num_threads=1024 -thread_warp_size=32", "dense_large_batch.gpu", [["TENSOR", [128, 4032], "float32"], ["TENSOR", [4032, 1000], "float32"]], {}], "config": {"index": 3910802, "code_hash": null, "entity": [["tile_x", "sp", [-1, 4, 1, 1]], ["tile_y", "sp", [-1, 1, 1, 5]], ["tile_k", "sp", [-1, 4, 3]]]}, "result": [[0.005930449], 0, 1.5842852592468262, 1638075159.430439], "version": 0.2, "tvm_version": "0.8.dev0"}
{"input": ["cuda -keys=cuda,gpu -max_num_threads=1024 -thread_warp_size=32", "dense_large_batch.gpu", [["TENSOR", [128, 4032], "float32"], ["TENSOR", [4032, 1000], "float32"]], {}], "config": {"index": 5206957, "code_hash": null, "entity": [["tile_x", "sp", [-1, 2, 1, 2]], ["tile_y", "sp", [-1, 2, 1, 5]], ["tile_k", "sp", [-1, 3, 4]]]}, "result": [[0.005811206166666667], 0, 1.7991721630096436, 1638075160.5349438], "version": 0.2, "tvm_version": "0.8.dev0"}
{"input": ["cuda -keys=cuda,gpu -max_num_threads=1024 -thread_warp_size=32", "dense_large_batch.gpu", [["TENSOR", [128, 4032], "float32"], ["TENSOR", [4032, 1000], "float32"]], {}], "config": {"index": 5244157, "code_hash": null, "entity": [["tile_x", "sp", [-1, 2, 1, 2]], ["tile_y", "sp", [-1, 2, 1, 2]], ["tile_k", "sp", [-1, 4, 4]]]}, "result": [[0.0062862525625], 0, 1.7220196723937988, 1638075161.5938041], "version": 0.2, "tvm_version": "0.8.dev0"}
{"input": ["cuda -keys=cuda,gpu -max_num_threads=1024 -thread_warp_size=32", "dense_large_batch.gpu", [["TENSOR", [128, 4032], "float32"], ["TENSOR", [4032, 1000], "float32"]], {}], "config": {"index": 2238037, "code_hash": null, "entity": [["tile_x", "sp", [-1, 2, 1, 2]], ["tile_y", "sp", [-1, 1, 1, 8]], ["tile_k", "sp", [-1, 6, 2]]]}, "result": [[0.004854585571428572], 0, 1.73582124710083, 1638075162.6082644], "version": 0.2, "tvm_version": "0.8.dev0"}
{"input": ["cuda -keys=cuda,gpu -max_num_threads=1024 -thread_warp_size=32", "dense_large_batch.gpu", [["TENSOR", [128, 4032], "float32"], ["TENSOR", [4032, 1000], "float32"]], {}], "config": {"index": 2316157, "code_hash": null, "entity": [["tile_x", "sp", [-1, 2, 1, 2]], ["tile_y", "sp", [-1, 2, 1, 2]], ["tile_k", "sp", [-1, 8, 2]]]}, "result": [[0.0062672469375], 0, 1.7349653244018555, 1638075163.8149831], "version": 0.2, "tvm_version": "0.8.dev0"}
{"input": ["cuda -keys=cuda,gpu -max_num_threads=1024 -thread_warp_size=32", "dense_large_batch.gpu", [["TENSOR", [128, 4032], "float32"], ["TENSOR", [4032, 1000], "float32"]], {}], "config": {"index": 2275237, "code_hash": null, "entity": [["tile_x", "sp", [-1, 2, 1, 2]], ["tile_y", "sp", [-1, 1, 1, 4]], ["tile_k", "sp", [-1, 7, 2]]]}, "result": [[0.0065172763125], 0, 1.6482667922973633, 1638075164.8587062], "version": 0.2, "tvm_version": "0.8.dev0"}
{"input": ["cuda -keys=cuda,gpu -max_num_threads=1024 -thread_warp_size=32", "dense_large_batch.gpu", [["TENSOR", [128, 4032], "float32"], ["TENSOR", [4032, 1000], "float32"]], {}], "config": {"index": 9871202, "code_hash": null, "entity": [["tile_x", "sp", [-1, 4, 1, 1]], ["tile_y", "sp", [-1, 1, 1, 10]], ["tile_k", "sp", [-1, 1, 9]]]}, "result": [[0.006034833882352941], 0, 1.686769962310791, 1638075165.9204276], "version": 0.2, "tvm_version": "0.8.dev0"}
{"input": ["cuda -keys=cuda,gpu -max_num_threads=1024 -thread_warp_size=32", "dense_large_batch.gpu", [["TENSOR", [128, 4032], "float32"], ["TENSOR", [4032, 1000], "float32"]], {}], "config": {"index": 2227357, "code_hash": null, "entity": [["tile_x", "sp", [-1, 2, 1, 2]], ["tile_y", "sp", [-1, 2, 1, 4]], ["tile_k", "sp", [-1, 6, 2]]]}, "result": [[0.004887960666666667], 0, 1.4260101318359375, 1638075166.8763337], "version": 0.2, "tvm_version": "0.8.dev0"}
{"input": ["cuda -keys=cuda,gpu -max_num_threads=1024 -thread_warp_size=32", "dense_large_batch.gpu", [["TENSOR", [128, 4032], "float32"], ["TENSOR", [4032, 1000], "float32"]], {}], "config": {"index": 2323237, "code_hash": null, "entity": [["tile_x", "sp", [-1, 2, 1, 2]], ["tile_y", "sp", [-1, 1, 1, 4]], ["tile_k", "sp", [-1, 8, 2]]]}, "result": [[0.006204454960000001], 0, 1.9610967636108398, 1638075168.162376], "version": 0.2, "tvm_version": "0.8.dev0"}
{"input": ["cuda -keys=cuda,gpu -max_num_threads=1024 -thread_warp_size=32", "dense_large_batch.gpu", [["TENSOR", [128, 4032], "float32"], ["TENSOR", [4032, 1000], "float32"]], {}], "config": {"index": 262985, "code_hash": null, "entity": [["tile_x", "sp", [-1, 2, 1, 4]], ["tile_y", "sp", [-1, 2, 1, 5]], ["tile_k", "sp", [-1, 7, 1]]]}, "result": [[0.0063035895], 0, 1.773348093032837, 1638075169.2467127], "version": 0.2, "tvm_version": "0.8.dev0"}
{"input": ["cuda -keys=cuda,gpu -max_num_threads=1024 -thread_warp_size=32", "dense_large_batch.gpu", [["TENSOR", [128, 4032], "float32"], ["TENSOR", [4032, 1000], "float32"]], {}], "config": {"index": 2182985, "code_hash": null, "entity": [["tile_x", "sp", [-1, 2, 1, 4]], ["tile_y", "sp", [-1, 2, 1, 5]], ["tile_k", "sp", [-1, 4, 2]]]}, "result": [[0.005883726], 0, 1.6471900939941406, 1638075171.9686456], "version": 0.2, "tvm_version": "0.8.dev0"}
{"input": ["cuda -keys=cuda,gpu -max_num_threads=1024 -thread_warp_size=32", "dense_large_batch.gpu", [["TENSOR", [128, 4032], "float32"], ["TENSOR", [4032, 1000], "float32"]], {}], "config": {"index": 7711238, "code_hash": null, "entity": [["tile_x", "sp", [-1, 4, 1, 2]], ["tile_y", "sp", [-1, 1, 1, 10]], ["tile_k", "sp", [-1, 1, 7]]]}, "result": [[0.03185856775], 0, 1.5500028133392334, 1638075173.187331], "version": 0.2, "tvm_version": "0.8.dev0"}
{"input": ["cuda -keys=cuda,gpu -max_num_threads=1024 -thread_warp_size=32", "dense_large_batch.gpu", [["TENSOR", [128, 4032], "float32"], ["TENSOR", [4032, 1000], "float32"]], {}], "config": {"index": 2179385, "code_hash": null, "entity": [["tile_x", "sp", [-1, 2, 1, 4]], ["tile_y", "sp", [-1, 2, 1, 4]], ["tile_k", "sp", [-1, 4, 2]]]}, "result": [[0.0042502122500000005], 0, 1.5087671279907227, 1638075174.2827237], "version": 0.2, "tvm_version": "0.8.dev0"}
{"input": ["cuda -keys=cuda,gpu -max_num_threads=1024 -thread_warp_size=32", "dense_large_batch.gpu", [["TENSOR", [128, 4032], "float32"], ["TENSOR", [4032, 1000], "float32"]], {}], "config": {"index": 3958802, "code_hash": null, "entity": [["tile_x", "sp", [-1, 4, 1, 1]], ["tile_y", "sp", [-1, 1, 1, 5]], ["tile_k", "sp", [-1, 6, 3]]]}, "result": [[0.006844998199999999], 0, 1.4402339458465576, 1638075175.3508036], "version": 0.2, "tvm_version": "0.8.dev0"}
{"input": ["cuda -keys=cuda,gpu -max_num_threads=1024 -thread_warp_size=32", "dense_large_batch.gpu", [["TENSOR", [128, 4032], "float32"], ["TENSOR", [4032, 1000], "float32"]], {}], "config": {"index": 2131265, "code_hash": null, "entity": [["tile_x", "sp", [-1, 2, 1, 4]], ["tile_y", "sp", [-1, 1, 1, 4]], ["tile_k", "sp", [-1, 3, 2]]]}, "result": [[0.005559208777777778], 0, 1.287093162536621, 1638075176.3807034], "version": 0.2, "tvm_version": "0.8.dev0"}
{"input": ["cuda -keys=cuda,gpu -max_num_threads=1024 -thread_warp_size=32", "dense_large_batch.gpu", [["TENSOR", [128, 4032], "float32"], ["TENSOR", [4032, 1000], "float32"]], {}], "config": {"index": 6559237, "code_hash": null, "entity": [["tile_x", "sp", [-1, 2, 1, 2]], ["tile_y", "sp", [-1, 1, 1, 10]], ["tile_k", "sp", [-1, 1, 6]]]}, "result": [[0.005283834052631579], 0, 1.3601984977722168, 1638075177.4163382], "version": 0.2, "tvm_version": "0.8.dev0"}
{"input": ["cuda -keys=cuda,gpu -max_num_threads=1024 -thread_warp_size=32", "dense_large_batch.gpu", [["TENSOR", [128, 4032], "float32"], ["TENSOR", [4032, 1000], "float32"]], {}], "config": {"index": 7750802, "code_hash": null, "entity": [["tile_x", "sp", [-1, 4, 1, 1]], ["tile_y", "sp", [-1, 1, 1, 5]], ["tile_k", "sp", [-1, 2, 7]]]}, "result": [[0.0066921298], 0, 1.350090742111206, 1638075178.4877927], "version": 0.2, "tvm_version": "0.8.dev0"}
{"input": ["cuda -keys=cuda,gpu -max_num_threads=1024 -thread_warp_size=32", "dense_large_batch.gpu", [["TENSOR", [128, 4032], "float32"], ["TENSOR", [4032, 1000], "float32"]], {}], "config": {"index": 3907202, "code_hash": null, "entity": [["tile_x", "sp", [-1, 4, 1, 1]], ["tile_y", "sp", [-1, 1, 1, 4]], ["tile_k", "sp", [-1, 4, 3]]]}, "result": [[0.006146630235294118], 0, 1.3608465194702148, 1638075179.5967567], "version": 0.2, "tvm_version": "0.8.dev0"}
{"input": ["cuda -keys=cuda,gpu -max_num_threads=1024 -thread_warp_size=32", "dense_large_batch.gpu", [["TENSOR", [128, 4032], "float32"], ["TENSOR", [4032, 1000], "float32"]], {}], "config": {"index": 2278838, "code_hash": null, "entity": [["tile_x", "sp", [-1, 4, 1, 2]], ["tile_y", "sp", [-1, 1, 1, 5]], ["tile_k", "sp", [-1, 7, 2]]]}, "result": [[0.0064658467499999995], 0, 1.7365732192993164, 1638075180.7793336], "version": 0.2, "tvm_version": "0.8.dev0"}
{"input": ["cuda -keys=cuda,gpu -max_num_threads=1024 -thread_warp_size=32", "dense_large_batch.gpu", [["TENSOR", [128, 4032], "float32"], ["TENSOR", [4032, 1000], "float32"]], {}], "config": {"index": 2326837, "code_hash": null, "entity": [["tile_x", "sp", [-1, 2, 1, 2]], ["tile_y", "sp", [-1, 1, 1, 5]], ["tile_k", "sp", [-1, 8, 2]]]}, "result": [[0.0060256929999999995], 0, 1.5137622356414795, 1638075181.8048267], "version": 0.2, "tvm_version": "0.8.dev0"}
{"input": ["cuda -keys=cuda,gpu -max_num_threads=1024 -thread_warp_size=32", "dense_large_batch.gpu", [["TENSOR", [128, 4032], "float32"], ["TENSOR", [4032, 1000], "float32"]], {}], "config": {"index": 6598802, "code_hash": null, "entity": [["tile_x", "sp", [-1, 4, 1, 1]], ["tile_y", "sp", [-1, 1, 1, 5]], ["tile_k", "sp", [-1, 2, 6]]]}, "result": [[0.005920637588235294], 0, 1.2539699077606201, 1638075182.7657244], "version": 0.2, "tvm_version": "0.8.dev0"}
{"input": ["cuda -keys=cuda,gpu -max_num_threads=1024 -thread_warp_size=32", "dense_large_batch.gpu", [["TENSOR", [128, 4032], "float32"], ["TENSOR", [4032, 1000], "float32"]], {}], "config": {"index": 2230866, "code_hash": null, "entity": [["tile_x", "sp", [-1, 4, 1, 4]], ["tile_y", "sp", [-1, 1, 1, 5]], ["tile_k", "sp", [-1, 6, 2]]]}, "result": [[0.004687620818181818], 0, 1.7896068096160889, 1638075184.0358667], "version": 0.2, "tvm_version": "0.8.dev0"}
{"input": ["cuda -keys=cuda,gpu -max_num_threads=1024 -thread_warp_size=32", "dense_large_batch.gpu", [["TENSOR", [128, 4032], "float32"], ["TENSOR", [4032, 1000], "float32"]], {}], "config": {"index": 2227385, "code_hash": null, "entity": [["tile_x", "sp", [-1, 2, 1, 4]], ["tile_y", "sp", [-1, 2, 1, 4]], ["tile_k", "sp", [-1, 6, 2]]]}, "result": [[0.004283007041666667], 0, 1.6640796661376953, 1638075185.1958904], "version": 0.2, "tvm_version": "0.8.dev0"}
{"input": ["cuda -keys=cuda,gpu -max_num_threads=1024 -thread_warp_size=32", "dense_large_batch.gpu", [["TENSOR", [128, 4032], "float32"], ["TENSOR", [4032, 1000], "float32"]], {}], "config": {"index": 3948157, "code_hash": null, "entity": [["tile_x", "sp", [-1, 2, 1, 2]], ["tile_y", "sp", [-1, 2, 1, 2]], ["tile_k", "sp", [-1, 6, 3]]]}, "result": [[0.0065296321874999995], 0, 1.460860252380371, 1638075186.253962], "version": 0.2, "tvm_version": "0.8.dev0"}
{"input": ["cuda -keys=cuda,gpu -max_num_threads=1024 -thread_warp_size=32", "dense_large_batch.gpu", [["TENSOR", [128, 4032], "float32"], ["TENSOR", [4032, 1000], "float32"]], {}], "config": {"index": 2238038, "code_hash": null, "entity": [["tile_x", "sp", [-1, 4, 1, 2]], ["tile_y", "sp", [-1, 1, 1, 8]], ["tile_k", "sp", [-1, 6, 2]]]}, "result": [[0.004296585791666667], 0, 1.6958975791931152, 1638075187.4284358], "version": 0.2, "tvm_version": "0.8.dev0"}
{"input": ["cuda -keys=cuda,gpu -max_num_threads=1024 -thread_warp_size=32", "dense_large_batch.gpu", [["TENSOR", [128, 4032], "float32"], ["TENSOR", [4032, 1000], "float32"]], {}], "config": {"index": 2323358, "code_hash": null, "entity": [["tile_x", "sp", [-1, 4, 1, 2]], ["tile_y", "sp", [-1, 2, 1, 4]], ["tile_k", "sp", [-1, 8, 2]]]}, "result": [[0.004677157545454545], 0, 1.7826757431030273, 1638075188.6098835], "version": 0.2, "tvm_version": "0.8.dev0"}
{"input": ["cuda -keys=cuda,gpu -max_num_threads=1024 -thread_warp_size=32", "dense_large_batch.gpu", [["TENSOR", [128, 4032], "float32"], ["TENSOR", [4032, 1000], "float32"]], {}], "config": {"index": 214985, "code_hash": null, "entity": [["tile_x", "sp", [-1, 2, 1, 4]], ["tile_y", "sp", [-1, 2, 1, 5]], ["tile_k", "sp", [-1, 6, 1]]]}, "result": [[0.0063051769374999995], 0, 1.4728777408599854, 1638075189.6991293], "version": 0.2, "tvm_version": "0.8.dev0"}
{"input": ["cuda -keys=cuda,gpu -max_num_threads=1024 -thread_warp_size=32", "dense_large_batch.gpu", [["TENSOR", [128, 4032], "float32"], ["TENSOR", [4032, 1000], "float32"]], {}], "config": {"index": 3955237, "code_hash": null, "entity": [["tile_x", "sp", [-1, 2, 1, 2]], ["tile_y", "sp", [-1, 1, 1, 4]], ["tile_k", "sp", [-1, 6, 3]]]}, "result": [[0.00649592075], 0, 1.3093352317810059, 1638075190.650804], "version": 0.2, "tvm_version": "0.8.dev0"}
{"input": ["cuda -keys=cuda,gpu -max_num_threads=1024 -thread_warp_size=32", "dense_large_batch.gpu", [["TENSOR", [128, 4032], "float32"], ["TENSOR", [4032, 1000], "float32"]], {}], "config": {"index": 5206958, "code_hash": null, "entity": [["tile_x", "sp", [-1, 4, 1, 2]], ["tile_y", "sp", [-1, 2, 1, 5]], ["tile_k", "sp", [-1, 3, 4]]]}, "result": [[0.006149971294117647], 0, 1.6545555591583252, 1638075191.8437681], "version": 0.2, "tvm_version": "0.8.dev0"}
{"input": ["cuda -keys=cuda,gpu -max_num_threads=1024 -thread_warp_size=32", "dense_large_batch.gpu", [["TENSOR", [128, 4032], "float32"], ["TENSOR", [4032, 1000], "float32"]], {}], "config": {"index": 6606002, "code_hash": null, "entity": [["tile_x", "sp", [-1, 4, 1, 1]], ["tile_y", "sp", [-1, 1, 1, 8]], ["tile_k", "sp", [-1, 2, 6]]]}, "result": [[0.004875032523809523], 0, 1.2451233863830566, 1638075192.7600062], "version": 0.2, "tvm_version": "0.8.dev0"}
{"input": ["cuda -keys=cuda,gpu -max_num_threads=1024 -thread_warp_size=32", "dense_large_batch.gpu", [["TENSOR", [128, 4032], "float32"], ["TENSOR", [4032, 1000], "float32"]], {}], "config": {"index": 3814985, "code_hash": null, "entity": [["tile_x", "sp", [-1, 2, 1, 4]], ["tile_y", "sp", [-1, 2, 1, 5]], ["tile_k", "sp", [-1, 2, 3]]]}, "result": [[0.006338888375], 0, 1.5385708808898926, 1638075193.8519678], "version": 0.2, "tvm_version": "0.8.dev0"}
{"input": ["cuda -keys=cuda,gpu -max_num_threads=1024 -thread_warp_size=32", "dense_large_batch.gpu", [["TENSOR", [128, 4032], "float32"], ["TENSOR", [4032, 1000], "float32"]], {}], "config": {"index": 6595202, "code_hash": null, "entity": [["tile_x", "sp", [-1, 4, 1, 1]], ["tile_y", "sp", [-1, 1, 1, 4]], ["tile_k", "sp", [-1, 2, 6]]]}, "result": [[0.006127654411764706], 0, 1.1855599880218506, 1638075194.7745779], "version": 0.2, "tvm_version": "0.8.dev0"}
{"input": ["cuda -keys=cuda,gpu -max_num_threads=1024 -thread_warp_size=32", "dense_large_batch.gpu", [["TENSOR", [128, 4032], "float32"], ["TENSOR", [4032, 1000], "float32"]], {}], "config": {"index": 6607202, "code_hash": null, "entity": [["tile_x", "sp", [-1, 4, 1, 1]], ["tile_y", "sp", [-1, 1, 1, 10]], ["tile_k", "sp", [-1, 2, 6]]]}, "result": [[0.005815483833333333], 0, 1.4910950660705566, 1638075195.834503], "version": 0.2, "tvm_version": "0.8.dev0"}
{"input": ["cuda -keys=cuda,gpu -max_num_threads=1024 -thread_warp_size=32", "dense_large_batch.gpu", [["TENSOR", [128, 4032], "float32"], ["TENSOR", [4032, 1000], "float32"]], {}], "config": {"index": 2371202, "code_hash": null, "entity": [["tile_x", "sp", [-1, 4, 1, 1]], ["tile_y", "sp", [-1, 1, 1, 4]], ["tile_k", "sp", [-1, 9, 2]]]}, "result": [[0.006381662000000001], 0, 1.4644017219543457, 1638075196.9360259], "version": 0.2, "tvm_version": "0.8.dev0"}
{"input": ["cuda -keys=cuda,gpu -max_num_threads=1024 -thread_warp_size=32", "dense_large_batch.gpu", [["TENSOR", [128, 4032], "float32"], ["TENSOR", [4032, 1000], "float32"]], {}], "config": {"index": 2278958, "code_hash": null, "entity": [["tile_x", "sp", [-1, 4, 1, 2]], ["tile_y", "sp", [-1, 2, 1, 5]], ["tile_k", "sp", [-1, 7, 2]]]}, "result": [[0.007297634928571428], 0, 1.7430486679077148, 1638075199.5845246], "version": 0.2, "tvm_version": "0.8.dev0"}
{"input": ["cuda -keys=cuda,gpu -max_num_threads=1024 -thread_warp_size=32", "dense_large_batch.gpu", [["TENSOR", [128, 4032], "float32"], ["TENSOR", [4032, 1000], "float32"]], {}], "config": {"index": 6558037, "code_hash": null, "entity": [["tile_x", "sp", [-1, 2, 1, 2]], ["tile_y", "sp", [-1, 1, 1, 8]], ["tile_k", "sp", [-1, 1, 6]]]}, "result": [[0.0050792904], 0, 1.2197279930114746, 1638075200.590865], "version": 0.2, "tvm_version": "0.8.dev0"}
{"input": ["cuda -keys=cuda,gpu -max_num_threads=1024 -thread_warp_size=32", "dense_large_batch.gpu", [["TENSOR", [128, 4032], "float32"], ["TENSOR", [4032, 1000], "float32"]], {}], "config": {"index": 5254957, "code_hash": null, "entity": [["tile_x", "sp", [-1, 2, 1, 2]], ["tile_y", "sp", [-1, 2, 1, 5]], ["tile_k", "sp", [-1, 4, 4]]]}, "result": [[0.005840658888888889], 0, 1.823087215423584, 1638075202.0628104], "version": 0.2, "tvm_version": "0.8.dev0"}
{"input": ["cuda -keys=cuda,gpu -max_num_threads=1024 -thread_warp_size=32", "dense_large_batch.gpu", [["TENSOR", [128, 4032], "float32"], ["TENSOR", [4032, 1000], "float32"]], {}], "config": {"index": 2326957, "code_hash": null, "entity": [["tile_x", "sp", [-1, 2, 1, 2]], ["tile_y", "sp", [-1, 2, 1, 5]], ["tile_k", "sp", [-1, 8, 2]]]}, "result": [[0.005842471833333333], 0, 1.3383994102478027, 1638075202.952769], "version": 0.2, "tvm_version": "0.8.dev0"}
{"input": ["cuda -keys=cuda,gpu -max_num_threads=1024 -thread_warp_size=32", "dense_large_batch.gpu", [["TENSOR", [128, 4032], "float32"], ["TENSOR", [4032, 1000], "float32"]], {}], "config": {"index": 8718002, "code_hash": null, "entity": [["tile_x", "sp", [-1, 4, 1, 1]], ["tile_y", "sp", [-1, 1, 1, 8]], ["tile_k", "sp", [-1, 1, 8]]]}, "result": [[0.005279981526315789], 0, 1.189239740371704, 1638075203.9690773], "version": 0.2, "tvm_version": "0.8.dev0"}
{"input": ["cuda -keys=cuda,gpu -max_num_threads=1024 -thread_warp_size=32", "dense_large_batch.gpu", [["TENSOR", [128, 4032], "float32"], ["TENSOR", [4032, 1000], "float32"]], {}], "config": {"index": 9870002, "code_hash": null, "entity": [["tile_x", "sp", [-1, 4, 1, 1]], ["tile_y", "sp", [-1, 1, 1, 8]], ["tile_k", "sp", [-1, 1, 9]]]}, "result": [[0.0052691926], 0, 1.529115915298462, 1638075205.278721], "version": 0.2, "tvm_version": "0.8.dev0"}
{"input": ["cuda -keys=cuda,gpu -max_num_threads=1024 -thread_warp_size=32", "dense_large_batch.gpu", [["TENSOR", [128, 4032], "float32"], ["TENSOR", [4032, 1000], "float32"]], {}], "config": {"index": 2142037, "code_hash": null, "entity": [["tile_x", "sp", [-1, 2, 1, 2]], ["tile_y", "sp", [-1, 1, 1, 8]], ["tile_k", "sp", [-1, 3, 2]]]}, "result": [[0.0050900401], 0, 1.1051452159881592, 1638075206.159349], "version": 0.2, "tvm_version": "0.8.dev0"}
{"input": ["cuda -keys=cuda,gpu -max_num_threads=1024 -thread_warp_size=32", "dense_large_batch.gpu", [["TENSOR", [128, 4032], "float32"], ["TENSOR", [4032, 1000], "float32"]], {}], "config": {"index": 2374865, "code_hash": null, "entity": [["tile_x", "sp", [-1, 2, 1, 4]], ["tile_y", "sp", [-1, 1, 1, 5]], ["tile_k", "sp", [-1, 9, 2]]]}, "result": [[0.0056850825], 0, 1.5326237678527832, 1638075207.2233534], "version": 0.2, "tvm_version": "0.8.dev0"}
{"input": ["cuda -keys=cuda,gpu -max_num_threads=1024 -thread_warp_size=32", "dense_large_batch.gpu", [["TENSOR", [128, 4032], "float32"], ["TENSOR", [4032, 1000], "float32"]], {}], "config": {"index": 2374838, "code_hash": null, "entity": [["tile_x", "sp", [-1, 4, 1, 2]], ["tile_y", "sp", [-1, 1, 1, 5]], ["tile_k", "sp", [-1, 9, 2]]]}, "result": [[0.0056723995], 0, 1.573011875152588, 1638075208.2865582], "version": 0.2, "tvm_version": "0.8.dev0"}
{"input": ["cuda -keys=cuda,gpu -max_num_threads=1024 -thread_warp_size=32", "dense_large_batch.gpu", [["TENSOR", [128, 4032], "float32"], ["TENSOR", [4032, 1000], "float32"]], {}], "config": {"index": 5215202, "code_hash": null, "entity": [["tile_x", "sp", [-1, 4, 1, 1]], ["tile_y", "sp", [-1, 1, 1, 10]], ["tile_k", "sp", [-1, 3, 4]]]}, "result": [[0.005811211722222222], 0, 1.1594276428222656, 1638075209.1664145], "version": 0.2, "tvm_version": "0.8.dev0"}
{"input": ["cuda -keys=cuda,gpu -max_num_threads=1024 -thread_warp_size=32", "dense_large_batch.gpu", [["TENSOR", [128, 4032], "float32"], ["TENSOR", [4032, 1000], "float32"]], {}], "config": {"index": 2412157, "code_hash": null, "entity": [["tile_x", "sp", [-1, 2, 1, 2]], ["tile_y", "sp", [-1, 2, 1, 2]], ["tile_k", "sp", [-1, 12, 2]]]}, "result": [[0.006011381705882353], 0, 1.5277626514434814, 1638075210.2250538], "version": 0.2, "tvm_version": "0.8.dev0"}
{"input": ["cuda -keys=cuda,gpu -max_num_threads=1024 -thread_warp_size=32", "dense_large_batch.gpu", [["TENSOR", [128, 4032], "float32"], ["TENSOR", [4032, 1000], "float32"]], {}], "config": {"index": 2230957, "code_hash": null, "entity": [["tile_x", "sp", [-1, 2, 1, 2]], ["tile_y", "sp", [-1, 2, 1, 5]], ["tile_k", "sp", [-1, 6, 2]]]}, "result": [[0.005806550777777778], 0, 1.3102221488952637, 1638075211.200703], "version": 0.2, "tvm_version": "0.8.dev0"}
{"input": ["cuda -keys=cuda,gpu -max_num_threads=1024 -thread_warp_size=32", "dense_large_batch.gpu", [["TENSOR", [128, 4032], "float32"], ["TENSOR", [4032, 1000], "float32"]], {}], "config": {"index": 2227358, "code_hash": null, "entity": [["tile_x", "sp", [-1, 4, 1, 2]], ["tile_y", "sp", [-1, 2, 1, 4]], ["tile_k", "sp", [-1, 6, 2]]]}, "result": [[0.004319141878787879], 0, 2.073584794998169, 1638075284.2532873], "version": 0.2, "tvm_version": "0.8.dev0"}
{"input": ["cuda -keys=cuda,gpu -max_num_threads=1024 -thread_warp_size=32", "dense_large_batch.gpu", [["TENSOR", [128, 4032], "float32"], ["TENSOR", [4032, 1000], "float32"]], {}], "config": {"index": 5166002, "code_hash": null, "entity": [["tile_x", "sp", [-1, 4, 1, 1]], ["tile_y", "sp", [-1, 1, 1, 8]], ["tile_k", "sp", [-1, 2, 4]]]}, "result": [[0.005298928315789474], 0, 1.445751428604126, 1638075285.193622], "version": 0.2, "tvm_version": "0.8.dev0"}
{"input": ["cuda -keys=cuda,gpu -max_num_threads=1024 -thread_warp_size=32", "dense_large_batch.gpu", [["TENSOR", [128, 4032], "float32"], ["TENSOR", [4032, 1000], "float32"]], {}], "config": {"index": 403385, "code_hash": null, "entity": [["tile_x", "sp", [-1, 2, 1, 4]], ["tile_y", "sp", [-1, 2, 1, 4]], ["tile_k", "sp", [-1, 12, 1]]]}, "result": [[0.004281394625], 0, 1.970107078552246, 1638075286.323463], "version": 0.2, "tvm_version": "0.8.dev0"}
{"input": ["cuda -keys=cuda,gpu -max_num_threads=1024 -thread_warp_size=32", "dense_large_batch.gpu", [["TENSOR", [128, 4032], "float32"], ["TENSOR", [4032, 1000], "float32"]], {}], "config": {"index": 2179357, "code_hash": null, "entity": [["tile_x", "sp", [-1, 2, 1, 2]], ["tile_y", "sp", [-1, 2, 1, 4]], ["tile_k", "sp", [-1, 4, 2]]]}, "result": [[0.005247513333333333], 0, 1.8236322402954102, 1638075287.6421075], "version": 0.2, "tvm_version": "0.8.dev0"}
{"input": ["cuda -keys=cuda,gpu -max_num_threads=1024 -thread_warp_size=32", "dense_large_batch.gpu", [["TENSOR", [128, 4032], "float32"], ["TENSOR", [4032, 1000], "float32"]], {}], "config": {"index": 2190037, "code_hash": null, "entity": [["tile_x", "sp", [-1, 2, 1, 2]], ["tile_y", "sp", [-1, 1, 1, 8]], ["tile_k", "sp", [-1, 4, 2]]]}, "result": [[0.005340816421052631], 0, 1.3897981643676758, 1638075288.6590304], "version": 0.2, "tvm_version": "0.8.dev0"}
{"input": ["cuda -keys=cuda,gpu -max_num_threads=1024 -thread_warp_size=32", "dense_large_batch.gpu", [["TENSOR", [128, 4032], "float32"], ["TENSOR", [4032, 1000], "float32"]], {}], "config": {"index": 2182838, "code_hash": null, "entity": [["tile_x", "sp", [-1, 4, 1, 2]], ["tile_y", "sp", [-1, 1, 1, 5]], ["tile_k", "sp", [-1, 4, 2]]]}, "result": [[0.004499199942857143], 0, 1.8413875102996826, 1638075289.9658723], "version": 0.2, "tvm_version": "0.8.dev0"}
{"input": ["cuda -keys=cuda,gpu -max_num_threads=1024 -thread_warp_size=32", "dense_large_batch.gpu", [["TENSOR", [128, 4032], "float32"], ["TENSOR", [4032, 1000], "float32"]], {}], "config": {"index": 3918002, "code_hash": null, "entity": [["tile_x", "sp", [-1, 4, 1, 1]], ["tile_y", "sp", [-1, 1, 1, 8]], ["tile_k", "sp", [-1, 4, 3]]]}, "result": [[0.0048800466190476195], 0, 1.5118069648742676, 1638075290.886552], "version": 0.2, "tvm_version": "0.8.dev0"}
{"input": ["cuda -keys=cuda,gpu -max_num_threads=1024 -thread_warp_size=32", "dense_large_batch.gpu", [["TENSOR", [128, 4032], "float32"], ["TENSOR", [4032, 1000], "float32"]], {}], "config": {"index": 3822037, "code_hash": null, "entity": [["tile_x", "sp", [-1, 2, 1, 2]], ["tile_y", "sp", [-1, 1, 1, 8]], ["tile_k", "sp", [-1, 2, 3]]]}, "result": [[0.00508158535], 0, 1.51017165184021, 1638075291.8133554], "version": 0.2, "tvm_version": "0.8.dev0"}
{"input": ["cuda -keys=cuda,gpu -max_num_threads=1024 -thread_warp_size=32", "dense_large_batch.gpu", [["TENSOR", [128, 4032], "float32"], ["TENSOR", [4032, 1000], "float32"]], {}], "config": {"index": 3907357, "code_hash": null, "entity": [["tile_x", "sp", [-1, 2, 1, 2]], ["tile_y", "sp", [-1, 2, 1, 4]], ["tile_k", "sp", [-1, 4, 3]]]}, "result": [[0.0048897368095238095], 0, 1.4245262145996094, 1638075292.755207], "version": 0.2, "tvm_version": "0.8.dev0"}
{"input": ["cuda -keys=cuda,gpu -max_num_threads=1024 -thread_warp_size=32", "dense_large_batch.gpu", [["TENSOR", [128, 4032], "float32"], ["TENSOR", [4032, 1000], "float32"]], {}], "config": {"index": 2094065, "code_hash": null, "entity": [["tile_x", "sp", [-1, 2, 1, 4]], ["tile_y", "sp", [-1, 1, 1, 8]], ["tile_k", "sp", [-1, 2, 2]]]}, "result": [[0.00400398137037037], 0, 1.6683573722839355, 1638075293.9548388], "version": 0.2, "tvm_version": "0.8.dev0"}
{"input": ["cuda -keys=cuda,gpu -max_num_threads=1024 -thread_warp_size=32", "dense_large_batch.gpu", [["TENSOR", [128, 4032], "float32"], ["TENSOR", [4032, 1000], "float32"]], {}], "config": {"index": 259385, "code_hash": null, "entity": [["tile_x", "sp", [-1, 2, 1, 4]], ["tile_y", "sp", [-1, 2, 1, 4]], ["tile_k", "sp", [-1, 7, 1]]]}, "result": [[0.004849509523809524], 0, 1.7564139366149902, 1638075295.039741], "version": 0.2, "tvm_version": "0.8.dev0"}
{"input": ["cuda -keys=cuda,gpu -max_num_threads=1024 -thread_warp_size=32", "dense_large_batch.gpu", [["TENSOR", [128, 4032], "float32"], ["TENSOR", [4032, 1000], "float32"]], {}], "config": {"index": 2182957, "code_hash": null, "entity": [["tile_x", "sp", [-1, 2, 1, 2]], ["tile_y", "sp", [-1, 2, 1, 5]], ["tile_k", "sp", [-1, 4, 2]]]}, "result": [[0.004506127913043478], 0, 1.7707340717315674, 1638075296.160234], "version": 0.2, "tvm_version": "0.8.dev0"}
{"input": ["cuda -keys=cuda,gpu -max_num_threads=1024 -thread_warp_size=32", "dense_large_batch.gpu", [["TENSOR", [128, 4032], "float32"], ["TENSOR", [4032, 1000], "float32"]], {}], "config": {"index": 222037, "code_hash": null, "entity": [["tile_x", "sp", [-1, 2, 1, 2]], ["tile_y", "sp", [-1, 1, 1, 8]], ["tile_k", "sp", [-1, 6, 1]]]}, "result": [[0.005303843947368421], 0, 1.615485668182373, 1638075297.2313788], "version": 0.2, "tvm_version": "0.8.dev0"}
