artifacts/microbenchmark/tvm/autotvm/matmul_nn/matmul_65536_4096_1024.log
{"input": ["cuda -keys=cuda,gpu -max_num_threads=1024 -thread_warp_size=32", "dense_large_batch.gpu", [["TENSOR", [65536, 4096], "float32"], ["TENSOR", [4096, 1024], "float32"]], {}], "config": {"index": 10257018, "code_hash": null, "entity": [["tile_x", "sp", [-1, 1, 1, 2]], ["tile_y", "sp", [-1, 8, 1, 1]], ["tile_k", "sp", [-1, 2, 8]]]}, "result": [[3.9335643987499997], 0, 56.455132484436035, 1638118662.87354], "version": 0.2, "tvm_version": "0.8.dev0"}
{"input": ["cuda -keys=cuda,gpu -max_num_threads=1024 -thread_warp_size=32", "dense_large_batch.gpu", [["TENSOR", [65536, 4096], "float32"], ["TENSOR", [4096, 1024], "float32"]], {}], "config": {"index": 681225, "code_hash": null, "entity": [["tile_x", "sp", [-1, 2, 2, 1]], ["tile_y", "sp", [-1, 2, 2, 4]], ["tile_k", "sp", [-1, 4, 1]]]}, "result": [[0.78657850225], 0, 15.256974697113037, 1638119096.4144695], "version": 0.2, "tvm_version": "0.8.dev0"}
{"input": ["cuda -keys=cuda,gpu -max_num_threads=1024 -thread_warp_size=32", "dense_large_batch.gpu", [["TENSOR", [65536, 4096], "float32"], ["TENSOR", [4096, 1024], "float32"]], {}], "config": {"index": 835280, "code_hash": null, "entity": [["tile_x", "sp", [-1, 4, 1, 1]], ["tile_y", "sp", [-1, 16, 1, 1]], ["tile_k", "sp", [-1, 8, 1]]]}, "result": [[2.2504553527500004], 0, 35.008373498916626, 1638119532.2084317], "version": 0.2, "tvm_version": "0.8.dev0"}
{"input": ["cuda -keys=cuda,gpu -max_num_threads=1024 -thread_warp_size=32", "dense_large_batch.gpu", [["TENSOR", [65536, 4096], "float32"], ["TENSOR", [4096, 1024], "float32"]], {}], "config": {"index": 757776, "code_hash": null, "entity": [["tile_x", "sp", [-1, 2, 2, 1]], ["tile_y", "sp", [-1, 2, 2, 16]], ["tile_k", "sp", [-1, 4, 1]]]}, "result": [[0.77941540425], 0, 15.173082113265991, 1638119547.3849416], "version": 0.2, "tvm_version": "0.8.dev0"}
{"input": ["cuda -keys=cuda,gpu -max_num_threads=1024 -thread_warp_size=32", "dense_large_batch.gpu", [["TENSOR", [65536, 4096], "float32"], ["TENSOR", [4096, 1024], "float32"]], {}], "config": {"index": 3669758, "code_hash": null, "entity": [["tile_x", "sp", [-1, 4, 1, 2]], ["tile_y", "sp", [-1, 8, 1, 2]], ["tile_k", "sp", [-1, 1, 2]]]}, "result": [[1.56263559325], 0, 25.711727380752563, 1638119839.8764215], "version": 0.2, "tvm_version": "0.8.dev0"}
{"input": ["cuda -keys=cuda,gpu -max_num_threads=1024 -thread_warp_size=32", "dense_large_batch.gpu", [["TENSOR", [65536, 4096], "float32"], ["TENSOR", [4096, 1024], "float32"]], {}], "config": {"index": 344150, "code_hash": null, "entity": [["tile_x", "sp", [-1, 4, 1, 2]], ["tile_y", "sp", [-1, 8, 1, 2]], ["tile_k", "sp", [-1, 2, 1]]]}, "result": [[1.58658548225], 0, 26.12358784675598, 1638119865.560874], "version": 0.2, "tvm_version": "0.8.dev0"}
{"input": ["cuda -keys=cuda,gpu -max_num_threads=1024 -thread_warp_size=32", "dense_large_batch.gpu", [["TENSOR", [65536, 4096], "float32"], ["TENSOR", [4096, 1024], "float32"]], {}], "config": {"index": 345254, "code_hash": null, "entity": [["tile_x", "sp", [-1, 2, 1, 4]], ["tile_y", "sp", [-1, 16, 1, 2]], ["tile_k", "sp", [-1, 2, 1]]]}, "result": [[7.0406903089999995], 0, 97.71772193908691, 1638119962.3591397], "version": 0.2, "tvm_version": "0.8.dev0"}
{"input": ["cuda -keys=cuda,gpu -max_num_threads=1024 -thread_warp_size=32", "dense_large_batch.gpu", [["TENSOR", [65536, 4096], "float32"], ["TENSOR", [4096, 1024], "float32"]], {}], "config": {"index": 281300, "code_hash": null, "entity": [["tile_x", "sp", [-1, 2, 1, 4]], ["tile_y", "sp", [-1, 16, 1, 1]], ["tile_k", "sp", [-1, 2, 1]]]}, "result": [[1.5537947650000001], 0, 25.57881450653076, 1638119987.5107849], "version": 0.2, "tvm_version": "0.8.dev0"}
{"input": ["cuda -keys=cuda,gpu -max_num_threads=1024 -thread_warp_size=32", "dense_large_batch.gpu", [["TENSOR", [65536, 4096], "float32"], ["TENSOR", [4096, 1024], "float32"]], {}], "config": {"index": 3669893, "code_hash": null, "entity": [["tile_x", "sp", [-1, 2, 1, 4]], ["tile_y", "sp", [-1, 8, 1, 2]], ["tile_k", "sp", [-1, 1, 2]]]}, "result": [[1.5634041205], 0, 25.58581566810608, 1638120012.8087604], "version": 0.2, "tvm_version": "0.8.dev0"}
{"input": ["cuda -keys=cuda,gpu -max_num_threads=1024 -thread_warp_size=32", "dense_large_batch.gpu", [["TENSOR", [65536, 4096], "float32"], ["TENSOR", [4096, 1024], "float32"]], {}], "config": {"index": 342212, "code_hash": null, "entity": [["tile_x", "sp", [-1, 4, 1, 2]], ["tile_y", "sp", [-1, 2, 1, 2]], ["tile_k", "sp", [-1, 2, 1]]]}, "result": [[2.7032549865], 0, 40.014198541641235, 1638120329.9697132], "version": 0.2, "tvm_version": "0.8.dev0"}
{"input": ["cuda -keys=cuda,gpu -max_num_threads=1024 -thread_warp_size=32", "dense_large_batch.gpu", [["TENSOR", [65536, 4096], "float32"], ["TENSOR", [4096, 1024], "float32"]], {}], "config": {"index": 343181, "code_hash": null, "entity": [["tile_x", "sp", [-1, 4, 1, 2]], ["tile_y", "sp", [-1, 4, 1, 2]], ["tile_k", "sp", [-1, 2, 1]]]}, "result": [[1.9607231155], 0, 30.51760482788086, 1638120360.2392907], "version": 0.2, "tvm_version": "0.8.dev0"}
{"input": ["cuda -keys=cuda,gpu -max_num_threads=1024 -thread_warp_size=32", "dense_large_batch.gpu", [["TENSOR", [65536, 4096], "float32"], ["TENSOR", [4096, 1024], "float32"]], {}], "config": {"index": 3668789, "code_hash": null, "entity": [["tile_x", "sp", [-1, 4, 1, 2]], ["tile_y", "sp", [-1, 4, 1, 2]], ["tile_k", "sp", [-1, 1, 2]]]}, "result": [[1.96962111525], 0, 30.566014766693115, 1638120390.580982], "version": 0.2, "tvm_version": "0.8.dev0"}
{"input": ["cuda -keys=cuda,gpu -max_num_threads=1024 -thread_warp_size=32", "dense_large_batch.gpu", [["TENSOR", [65536, 4096], "float32"], ["TENSOR", [4096, 1024], "float32"]], {}], "config": {"index": 3604970, "code_hash": null, "entity": [["tile_x", "sp", [-1, 2, 1, 4]], ["tile_y", "sp", [-1, 4, 1, 1]], ["tile_k", "sp", [-1, 1, 2]]]}, "result": [[2.705351415], 0, 40.24272179603577, 1638120430.647091], "version": 0.2, "tvm_version": "0.8.dev0"}
{"input": ["cuda -keys=cuda,gpu -max_num_threads=1024 -thread_warp_size=32", "dense_large_batch.gpu", [["TENSOR", [65536, 4096], "float32"], ["TENSOR", [4096, 1024], "float32"]], {}], "config": {"index": 3605939, "code_hash": null, "entity": [["tile_x", "sp", [-1, 2, 1, 4]], ["tile_y", "sp", [-1, 8, 1, 1]], ["tile_k", "sp", [-1, 1, 2]]]}, "result": [[1.9530045514999999], 0, 30.718140840530396, 1638120461.1509738], "version": 0.2, "tvm_version": "0.8.dev0"}
{"input": ["cuda -keys=cuda,gpu -max_num_threads=1024 -thread_warp_size=32", "dense_large_batch.gpu", [["TENSOR", [65536, 4096], "float32"], ["TENSOR", [4096, 1024], "float32"]], {}], "config": {"index": 279362, "code_hash": null, "entity": [["tile_x", "sp", [-1, 2, 1, 4]], ["tile_y", "sp", [-1, 4, 1, 1]], ["tile_k", "sp", [-1, 2, 1]]]}, "result": [[2.69840088125], 0, 40.62897801399231, 1638120501.664138], "version": 0.2, "tvm_version": "0.8.dev0"}
{"input": ["cuda -keys=cuda,gpu -max_num_threads=1024 -thread_warp_size=32", "dense_large_batch.gpu", [["TENSOR", [65536, 4096], "float32"], ["TENSOR", [4096, 1024], "float32"]], {}], "config": {"index": 3606908, "code_hash": null, "entity": [["tile_x", "sp", [-1, 2, 1, 4]], ["tile_y", "sp", [-1, 16, 1, 1]], ["tile_k", "sp", [-1, 1, 2]]]}, "result": [[1.5478522655], 0, 25.382249355316162, 1638120526.7488413], "version": 0.2, "tvm_version": "0.8.dev0"}
{"input": ["cuda -keys=cuda,gpu -max_num_threads=1024 -thread_warp_size=32", "dense_large_batch.gpu", [["TENSOR", [65536, 4096], "float32"], ["TENSOR", [4096, 1024], "float32"]], {}], "config": {"index": 280331, "code_hash": null, "entity": [["tile_x", "sp", [-1, 2, 1, 4]], ["tile_y", "sp", [-1, 8, 1, 1]], ["tile_k", "sp", [-1, 2, 1]]]}, "result": [[1.9416840095], 0, 30.98096013069153, 1638120557.5123897], "version": 0.2, "tvm_version": "0.8.dev0"}
{"input": ["cuda -keys=cuda,gpu -max_num_threads=1024 -thread_warp_size=32", "dense_large_batch.gpu", [["TENSOR", [65536, 4096], "float32"], ["TENSOR", [4096, 1024], "float32"]], {}], "config": {"index": 3944801, "code_hash": null, "entity": [["tile_x", "sp", [-1, 4, 1, 1]], ["tile_y", "sp", [-1, 2, 1, 2]], ["tile_k", "sp", [-1, 2, 2]]]}, "result": [[3.4868107095], 0, 50.760716676712036, 1638120608.1556053], "version": 0.2, "tvm_version": "0.8.dev0"}
{"input": ["cuda -keys=cuda,gpu -max_num_threads=1024 -thread_warp_size=32", "dense_large_batch.gpu", [["TENSOR", [65536, 4096], "float32"], ["TENSOR", [4096, 1024], "float32"]], {}], "config": {"index": 6993275, "code_hash": null, "entity": [["tile_x", "sp", [-1, 4, 1, 1]], ["tile_y", "sp", [-1, 2, 1, 2]], ["tile_k", "sp", [-1, 1, 4]]]}, "result": [[3.5017573585], 0, 50.43612837791443, 1638120658.4144828], "version": 0.2, "tvm_version": "0.8.dev0"}
{"input": ["cuda -keys=cuda,gpu -max_num_threads=1024 -thread_warp_size=32", "dense_large_batch.gpu", [["TENSOR", [65536, 4096], "float32"], ["TENSOR", [4096, 1024], "float32"]], {}], "config": {"index": 3881969, "code_hash": null, "entity": [["tile_x", "sp", [-1, 4, 1, 2]], ["tile_y", "sp", [-1, 4, 1, 1]], ["tile_k", "sp", [-1, 2, 2]]]}, "result": [[2.66274213625], 0, 40.22336173057556, 1638120698.4215128], "version": 0.2, "tvm_version": "0.8.dev0"}
{"input": ["cuda -keys=cuda,gpu -max_num_threads=1024 -thread_warp_size=32", "dense_large_batch.gpu", [["TENSOR", [65536, 4096], "float32"], ["TENSOR", [4096, 1024], "float32"]], {}], "config": {"index": 556361, "code_hash": null, "entity": [["tile_x", "sp", [-1, 4, 1, 2]], ["tile_y", "sp", [-1, 4, 1, 1]], ["tile_k", "sp", [-1, 4, 1]]]}, "result": [[2.65290454125], 0, 39.5882887840271, 1638120737.7442455], "version": 0.2, "tvm_version": "0.8.dev0"}
{"input": ["cuda -keys=cuda,gpu -max_num_threads=1024 -thread_warp_size=32", "dense_large_batch.gpu", [["TENSOR", [65536, 4096], "float32"], ["TENSOR", [4096, 1024], "float32"]], {}], "config": {"index": 557330, "code_hash": null, "entity": [["tile_x", "sp", [-1, 4, 1, 2]], ["tile_y", "sp", [-1, 8, 1, 1]], ["tile_k", "sp", [-1, 4, 1]]]}, "result": [[1.7566828605], 0, 28.151575326919556, 1638120765.5036843], "version": 0.2, "tvm_version": "0.8.dev0"}
{"input": ["cuda -keys=cuda,gpu -max_num_threads=1024 -thread_warp_size=32", "dense_large_batch.gpu", [["TENSOR", [65536, 4096], "float32"], ["TENSOR", [4096, 1024], "float32"]], {}], "config": {"index": 3666851, "code_hash": null, "entity": [["tile_x", "sp", [-1, 4, 1, 2]], ["tile_y", "sp", [-1, 1, 1, 2]], ["tile_k", "sp", [-1, 1, 2]]]}, "result": [[4.3366614435], 0, 61.219951152801514, 1638120826.5804994], "version": 0.2, "tvm_version": "0.8.dev0"}
{"input": ["cuda -keys=cuda,gpu -max_num_threads=1024 -thread_warp_size=32", "dense_large_batch.gpu", [["TENSOR", [65536, 4096], "float32"], ["TENSOR", [4096, 1024], "float32"]], {}], "config": {"index": 341243, "code_hash": null, "entity": [["tile_x", "sp", [-1, 4, 1, 2]], ["tile_y", "sp", [-1, 1, 1, 2]], ["tile_k", "sp", [-1, 2, 1]]]}, "result": [[4.33765652125], 0, 61.57088375091553, 1638120887.9901497], "version": 0.2, "tvm_version": "0.8.dev0"}
{"input": ["cuda -keys=cuda,gpu -max_num_threads=1024 -thread_warp_size=32", "dense_large_batch.gpu", [["TENSOR", [65536, 4096], "float32"], ["TENSOR", [4096, 1024], "float32"]], {}], "config": {"index": 344285, "code_hash": null, "entity": [["tile_x", "sp", [-1, 2, 1, 4]], ["tile_y", "sp", [-1, 8, 1, 2]], ["tile_k", "sp", [-1, 2, 1]]]}, "result": [[1.574414602], 0, 25.87280774116516, 1638120913.5476139], "version": 0.2, "tvm_version": "0.8.dev0"}
{"input": ["cuda -keys=cuda,gpu -max_num_threads=1024 -thread_warp_size=32", "dense_large_batch.gpu", [["TENSOR", [65536, 4096], "float32"], ["TENSOR", [4096, 1024], "float32"]], {}], "config": {"index": 3668924, "code_hash": null, "entity": [["tile_x", "sp", [-1, 2, 1, 4]], ["tile_y", "sp", [-1, 4, 1, 2]], ["tile_k", "sp", [-1, 1, 2]]]}, "result": [[1.959578813], 0, 30.661614179611206, 1638120943.9900248], "version": 0.2, "tvm_version": "0.8.dev0"}
{"input": ["cuda -keys=cuda,gpu -max_num_threads=1024 -thread_warp_size=32", "dense_large_batch.gpu", [["TENSOR", [65536, 4096], "float32"], ["TENSOR", [4096, 1024], "float32"]], {}], "config": {"index": 4158949, "code_hash": null, "entity": [["tile_x", "sp", [-1, 2, 1, 1]], ["tile_y", "sp", [-1, 4, 1, 1]], ["tile_k", "sp", [-1, 4, 2]]]}, "result": [[5.016501373500001], 0, 72.27166509628296, 1638121016.0556], "version": 0.2, "tvm_version": "0.8.dev0"}
{"input": ["cuda -keys=cuda,gpu -max_num_threads=1024 -thread_warp_size=32", "dense_large_batch.gpu", [["TENSOR", [65536, 4096], "float32"], ["TENSOR", [4096, 1024], "float32"]], {}], "config": {"index": 3881968, "code_hash": null, "entity": [["tile_x", "sp", [-1, 2, 1, 2]], ["tile_y", "sp", [-1, 4, 1, 1]], ["tile_k", "sp", [-1, 2, 2]]]}, "result": [[3.49582546825], 0, 50.81448769569397, 1638121066.648437], "version": 0.2, "tvm_version": "0.8.dev0"}
{"input": ["cuda -keys=cuda,gpu -max_num_threads=1024 -thread_warp_size=32", "dense_large_batch.gpu", [["TENSOR", [65536, 4096], "float32"], ["TENSOR", [4096, 1024], "float32"]], {}], "config": {"index": 6930290, "code_hash": null, "entity": [["tile_x", "sp", [-1, 4, 1, 1]], ["tile_y", "sp", [-1, 4, 1, 1]], ["tile_k", "sp", [-1, 1, 4]]]}, "result": [[3.49551796675], 0, 50.44206786155701, 1638121116.8937652], "version": 0.2, "tvm_version": "0.8.dev0"}
{"input": ["cuda -keys=cuda,gpu -max_num_threads=1024 -thread_warp_size=32", "dense_large_batch.gpu", [["TENSOR", [65536, 4096], "float32"], ["TENSOR", [4096, 1024], "float32"]], {}], "config": {"index": 3882937, "code_hash": null, "entity": [["tile_x", "sp", [-1, 2, 1, 2]], ["tile_y", "sp", [-1, 8, 1, 1]], ["tile_k", "sp", [-1, 2, 2]]]}, "result": [[2.6308071985000003], 0, 39.74099564552307, 1638121156.3763876], "version": 0.2, "tvm_version": "0.8.dev0"}
{"input": ["cuda -keys=cuda,gpu -max_num_threads=1024 -thread_warp_size=32", "dense_large_batch.gpu", [["TENSOR", [65536, 4096], "float32"], ["TENSOR", [4096, 1024], "float32"]], {}], "config": {"index": 9978763, "code_hash": null, "entity": [["tile_x", "sp", [-1, 2, 1, 1]], ["tile_y", "sp", [-1, 4, 1, 1]], ["tile_k", "sp", [-1, 1, 8]]]}, "result": [[5.01790565275], 0, 70.0628650188446, 1638121226.2283332], "version": 0.2, "tvm_version": "0.8.dev0"}
{"input": ["cuda -keys=cuda,gpu -max_num_threads=1024 -thread_warp_size=32", "dense_large_batch.gpu", [["TENSOR", [65536, 4096], "float32"], ["TENSOR", [4096, 1024], "float32"]], {}], "config": {"index": 557329, "code_hash": null, "entity": [["tile_x", "sp", [-1, 2, 1, 2]], ["tile_y", "sp", [-1, 8, 1, 1]], ["tile_k", "sp", [-1, 4, 1]]]}, "result": [[2.6256690789999997], 0, 39.55046033859253, 1638121265.5392222], "version": 0.2, "tvm_version": "0.8.dev0"}
{"input": ["cuda -keys=cuda,gpu -max_num_threads=1024 -thread_warp_size=32", "dense_large_batch.gpu", [["TENSOR", [65536, 4096], "float32"], ["TENSOR", [4096, 1024], "float32"]], {}], "config": {"index": 7207423, "code_hash": null, "entity": [["tile_x", "sp", [-1, 2, 1, 1]], ["tile_y", "sp", [-1, 4, 1, 1]], ["tile_k", "sp", [-1, 2, 4]]]}, "result": [[5.01802567125], 0, 70.4182755947113, 1638121335.7481625], "version": 0.2, "tvm_version": "0.8.dev0"}
{"input": ["cuda -keys=cuda,gpu -max_num_threads=1024 -thread_warp_size=32", "dense_large_batch.gpu", [["TENSOR", [65536, 4096], "float32"], ["TENSOR", [4096, 1024], "float32"]], {}], "config": {"index": 3668634, "code_hash": null, "entity": [["tile_x", "sp", [-1, 1, 1, 1]], ["tile_y", "sp", [-1, 4, 1, 2]], ["tile_k", "sp", [-1, 1, 2]]]}, "result": [[7.971913223], 0, 108.80922484397888, 1638121511.5840402], "version": 0.2, "tvm_version": "0.8.dev0"}
{"input": ["cuda -keys=cuda,gpu -max_num_threads=1024 -thread_warp_size=32", "dense_large_batch.gpu", [["TENSOR", [65536, 4096], "float32"], ["TENSOR", [4096, 1024], "float32"]], {}], "config": {"index": 3605803, "code_hash": null, "entity": [["tile_x", "sp", [-1, 2, 1, 2]], ["tile_y", "sp", [-1, 8, 1, 1]], ["tile_k", "sp", [-1, 1, 2]]]}, "result": [[2.63440163475], 0, 39.26740479469299, 1638121550.6411457], "version": 0.2, "tvm_version": "0.8.dev0"}
{"input": ["cuda -keys=cuda,gpu -max_num_threads=1024 -thread_warp_size=32", "dense_large_batch.gpu", [["TENSOR", [65536, 4096], "float32"], ["TENSOR", [4096, 1024], "float32"]], {}], "config": {"index": 3605802, "code_hash": null, "entity": [["tile_x", "sp", [-1, 1, 1, 2]], ["tile_y", "sp", [-1, 8, 1, 1]], ["tile_k", "sp", [-1, 1, 2]]]}, "result": [[4.344442761], 0, 61.35450196266174, 1638121611.8118627], "version": 0.2, "tvm_version": "0.8.dev0"}
{"input": ["cuda -keys=cuda,gpu -max_num_threads=1024 -thread_warp_size=32", "dense_large_batch.gpu", [["TENSOR", [65536, 4096], "float32"], ["TENSOR", [4096, 1024], "float32"]], {}], "config": {"index": 3605938, "code_hash": null, "entity": [["tile_x", "sp", [-1, 1, 1, 4]], ["tile_y", "sp", [-1, 8, 1, 1]], ["tile_k", "sp", [-1, 1, 2]]]}, "result": [[2.64315079575], 0, 39.67322659492493, 1638121651.2915637], "version": 0.2, "tvm_version": "0.8.dev0"}
{"input": ["cuda -keys=cuda,gpu -max_num_threads=1024 -thread_warp_size=32", "dense_large_batch.gpu", [["TENSOR", [65536, 4096], "float32"], ["TENSOR", [4096, 1024], "float32"]], {}], "config": {"index": 3668636, "code_hash": null, "entity": [["tile_x", "sp", [-1, 4, 1, 1]], ["tile_y", "sp", [-1, 4, 1, 2]], ["tile_k", "sp", [-1, 1, 2]]]}, "result": [[2.65119523175], 0, 39.31886839866638, 1638121690.400733], "version": 0.2, "tvm_version": "0.8.dev0"}
{"input": ["cuda -keys=cuda,gpu -max_num_threads=1024 -thread_warp_size=32", "dense_large_batch.gpu", [["TENSOR", [65536, 4096], "float32"], ["TENSOR", [4096, 1024], "float32"]], {}], "config": {"index": 3606907, "code_hash": null, "entity": [["tile_x", "sp", [-1, 1, 1, 4]], ["tile_y", "sp", [-1, 16, 1, 1]], ["tile_k", "sp", [-1, 1, 2]]]}, "result": [[2.2545601137499998], 0, 34.31676435470581, 1638121724.4929712], "version": 0.2, "tvm_version": "0.8.dev0"}
{"input": ["cuda -keys=cuda,gpu -max_num_threads=1024 -thread_warp_size=32", "dense_large_batch.gpu", [["TENSOR", [65536, 4096], "float32"], ["TENSOR", [4096, 1024], "float32"]], {}], "config": {"index": 3667666, "code_hash": null, "entity": [["tile_x", "sp", [-1, 2, 1, 1]], ["tile_y", "sp", [-1, 2, 1, 2]], ["tile_k", "sp", [-1, 1, 2]]]}, "result": [[5.41895221775], 0, 75.91944241523743, 1638121800.2828102], "version": 0.2, "tvm_version": "0.8.dev0"}
{"input": ["cuda -keys=cuda,gpu -max_num_threads=1024 -thread_warp_size=32", "dense_large_batch.gpu", [["TENSOR", [65536, 4096], "float32"], ["TENSOR", [4096, 1024], "float32"]], {}], "config": {"index": 3668787, "code_hash": null, "entity": [["tile_x", "sp", [-1, 1, 1, 2]], ["tile_y", "sp", [-1, 4, 1, 2]], ["tile_k", "sp", [-1, 1, 2]]]}, "result": [[4.331509777749999], 0, 61.67316007614136, 1638121861.8066921], "version": 0.2, "tvm_version": "0.8.dev0"}
{"input": ["cuda -keys=cuda,gpu -max_num_threads=1024 -thread_warp_size=32", "dense_large_batch.gpu", [["TENSOR", [65536, 4096], "float32"], ["TENSOR", [4096, 1024], "float32"]], {}], "config": {"index": 3669756, "code_hash": null, "entity": [["tile_x", "sp", [-1, 1, 1, 2]], ["tile_y", "sp", [-1, 8, 1, 2]], ["tile_k", "sp", [-1, 1, 2]]]}, "result": [[3.7920826155], 0, 54.516074419021606, 1638121916.1046321], "version": 0.2, "tvm_version": "0.8.dev0"}
{"input": ["cuda -keys=cuda,gpu -max_num_threads=1024 -thread_warp_size=32", "dense_large_batch.gpu", [["TENSOR", [65536, 4096], "float32"], ["TENSOR", [4096, 1024], "float32"]], {}], "config": {"index": 3196, "code_hash": null, "entity": [["tile_x", "sp", [-1, 1, 1, 4]], ["tile_y", "sp", [-1, 8, 1, 1]], ["tile_k", "sp", [-1, 1, 1]]]}, "result": [[2.7584478239999997], 0, 40.66075396537781, 1638121956.647617], "version": 0.2, "tvm_version": "0.8.dev0"}
{"input": ["cuda -keys=cuda,gpu -max_num_threads=1024 -thread_warp_size=32", "dense_large_batch.gpu", [["TENSOR", [65536, 4096], "float32"], ["TENSOR", [4096, 1024], "float32"]], {}], "config": {"index": 3668788, "code_hash": null, "entity": [["tile_x", "sp", [-1, 2, 1, 2]], ["tile_y", "sp", [-1, 4, 1, 2]], ["tile_k", "sp", [-1, 1, 2]]]}, "result": [[2.6463010865000003], 0, 39.379435777664185, 1638121995.8555257], "version": 0.2, "tvm_version": "0.8.dev0"}
{"input": ["cuda -keys=cuda,gpu -max_num_threads=1024 -thread_warp_size=32", "dense_large_batch.gpu", [["TENSOR", [65536, 4096], "float32"], ["TENSOR", [4096, 1024], "float32"]], {}], "config": {"index": 3667667, "code_hash": null, "entity": [["tile_x", "sp", [-1, 4, 1, 1]], ["tile_y", "sp", [-1, 2, 1, 2]], ["tile_k", "sp", [-1, 1, 2]]]}, "result": [[3.5108907465000003], 0, 51.15351366996765, 1638122046.8711903], "version": 0.2, "tvm_version": "0.8.dev0"}
{"input": ["cuda -keys=cuda,gpu -max_num_threads=1024 -thread_warp_size=32", "dense_large_batch.gpu", [["TENSOR", [65536, 4096], "float32"], ["TENSOR", [4096, 1024], "float32"]], {}], "config": {"index": 6994243, "code_hash": null, "entity": [["tile_x", "sp", [-1, 2, 1, 1]], ["tile_y", "sp", [-1, 4, 1, 2]], ["tile_k", "sp", [-1, 1, 4]]]}, "result": [[4.229000560749999], 0, 60.78954887390137, 1638122107.4770527], "version": 0.2, "tvm_version": "0.8.dev0"}
{"input": ["cuda -keys=cuda,gpu -max_num_threads=1024 -thread_warp_size=32", "dense_large_batch.gpu", [["TENSOR", [65536, 4096], "float32"], ["TENSOR", [4096, 1024], "float32"]], {}], "config": {"index": 65892, "code_hash": null, "entity": [["tile_x", "sp", [-1, 1, 1, 1]], ["tile_y", "sp", [-1, 4, 1, 2]], ["tile_k", "sp", [-1, 1, 1]]]}, "result": [[9.0182633755], 0, 156.23630952835083, 1638122263.536104], "version": 0.2, "tvm_version": "0.8.dev0"}
{"input": ["cuda -keys=cuda,gpu -max_num_threads=1024 -thread_warp_size=32", "dense_large_batch.gpu", [["TENSOR", [65536, 4096], "float32"], ["TENSOR", [4096, 1024], "float32"]], {}], "config": {"index": 3606058, "code_hash": null, "entity": [["tile_x", "sp", [-1, 1, 1, 8]], ["tile_y", "sp", [-1, 8, 1, 1]], ["tile_k", "sp", [-1, 1, 2]]]}, "result": [[1.95644431675], 0, 30.507523775100708, 1638122293.7925599], "version": 0.2, "tvm_version": "0.8.dev0"}
{"input": ["cuda -keys=cuda,gpu -max_num_threads=1024 -thread_warp_size=32", "dense_large_batch.gpu", [["TENSOR", [65536, 4096], "float32"], ["TENSOR", [4096, 1024], "float32"]], {}], "config": {"index": 3607027, "code_hash": null, "entity": [["tile_x", "sp", [-1, 1, 1, 8]], ["tile_y", "sp", [-1, 16, 1, 1]], ["tile_k", "sp", [-1, 1, 2]]]}, "result": [[2.0974055254999997], 0, 32.588109254837036, 1638122326.1451616], "version": 0.2, "tvm_version": "0.8.dev0"}
{"input": ["cuda -keys=cuda,gpu -max_num_threads=1024 -thread_warp_size=32", "dense_large_batch.gpu", [["TENSOR", [65536, 4096], "float32"], ["TENSOR", [4096, 1024], "float32"]], {}], "config": {"index": 67015, "code_hash": null, "entity": [["tile_x", "sp", [-1, 2, 1, 2]], ["tile_y", "sp", [-1, 8, 1, 2]], ["tile_k", "sp", [-1, 1, 1]]]}, "result": [[2.286939545], 0, 35.73774790763855, 1638122361.6621358], "version": 0.2, "tvm_version": "0.8.dev0"}
{"input": ["cuda -keys=cuda,gpu -max_num_threads=1024 -thread_warp_size=32", "dense_large_batch.gpu", [["TENSOR", [65536, 4096], "float32"], ["TENSOR", [4096, 1024], "float32"]], {}], "config": {"index": 343027, "code_hash": null, "entity": [["tile_x", "sp", [-1, 2, 1, 1]], ["tile_y", "sp", [-1, 4, 1, 2]], ["tile_k", "sp", [-1, 2, 1]]]}, "result": [[4.3377445115], 0, 61.38526678085327, 1638122422.8832881], "version": 0.2, "tvm_version": "0.8.dev0"}
{"input": ["cuda -keys=cuda,gpu -max_num_threads=1024 -thread_warp_size=32", "dense_large_batch.gpu", [["TENSOR", [65536, 4096], "float32"], ["TENSOR", [4096, 1024], "float32"]], {}], "config": {"index": 66046, "code_hash": null, "entity": [["tile_x", "sp", [-1, 2, 1, 2]], ["tile_y", "sp", [-1, 4, 1, 2]], ["tile_k", "sp", [-1, 1, 1]]]}, "result": [[2.7640939482499998], 0, 40.90520524978638, 1638122463.6460989], "version": 0.2, "tvm_version": "0.8.dev0"}
{"input": ["cuda -keys=cuda,gpu -max_num_threads=1024 -thread_warp_size=32", "dense_large_batch.gpu", [["TENSOR", [65536, 4096], "float32"], ["TENSOR", [4096, 1024], "float32"]], {}], "config": {"index": 3882936, "code_hash": null, "entity": [["tile_x", "sp", [-1, 1, 1, 2]], ["tile_y", "sp", [-1, 8, 1, 1]], ["tile_k", "sp", [-1, 2, 2]]]}, "result": [[4.2042947095], 0, 59.92717790603638, 1638122523.324011], "version": 0.2, "tvm_version": "0.8.dev0"}
{"input": ["cuda -keys=cuda,gpu -max_num_threads=1024 -thread_warp_size=32", "dense_large_batch.gpu", [["TENSOR", [65536, 4096], "float32"], ["TENSOR", [4096, 1024], "float32"]], {}], "config": {"index": 3604681, "code_hash": null, "entity": [["tile_x", "sp", [-1, 2, 1, 1]], ["tile_y", "sp", [-1, 4, 1, 1]], ["tile_k", "sp", [-1, 1, 2]]]}, "result": [[5.40370118825], 0, 75.82380604743958, 1638122598.9662297], "version": 0.2, "tvm_version": "0.8.dev0"}
{"input": ["cuda -keys=cuda,gpu -max_num_threads=1024 -thread_warp_size=32", "dense_large_batch.gpu", [["TENSOR", [65536, 4096], "float32"], ["TENSOR", [4096, 1024], "float32"]], {}], "config": {"index": 343026, "code_hash": null, "entity": [["tile_x", "sp", [-1, 1, 1, 1]], ["tile_y", "sp", [-1, 4, 1, 2]], ["tile_k", "sp", [-1, 2, 1]]]}, "result": [[7.9697267275], 0, 108.64451217651367, 1638122707.3986702], "version": 0.2, "tvm_version": "0.8.dev0"}
{"input": ["cuda -keys=cuda,gpu -max_num_threads=1024 -thread_warp_size=32", "dense_large_batch.gpu", [["TENSOR", [65536, 4096], "float32"], ["TENSOR", [4096, 1024], "float32"]], {}], "config": {"index": 65077, "code_hash": null, "entity": [["tile_x", "sp", [-1, 2, 1, 2]], ["tile_y", "sp", [-1, 2, 1, 2]], ["tile_k", "sp", [-1, 1, 1]]]}, "result": [[3.91707424275], 0, 56.15140676498413, 1638122763.4060721], "version": 0.2, "tvm_version": "0.8.dev0"}
{"input": ["cuda -keys=cuda,gpu -max_num_threads=1024 -thread_warp_size=32", "dense_large_batch.gpu", [["TENSOR", [65536, 4096], "float32"], ["TENSOR", [4096, 1024], "float32"]], {}], "config": {"index": 66181, "code_hash": null, "entity": [["tile_x", "sp", [-1, 1, 1, 4]], ["tile_y", "sp", [-1, 4, 1, 2]], ["tile_k", "sp", [-1, 1, 1]]]}, "result": [[2.75618145875], 0, 40.94058537483215, 1638122804.1950884], "version": 0.2, "tvm_version": "0.8.dev0"}
{"input": ["cuda -keys=cuda,gpu -max_num_threads=1024 -thread_warp_size=32", "dense_large_batch.gpu", [["TENSOR", [65536, 4096], "float32"], ["TENSOR", [4096, 1024], "float32"]], {}], "config": {"index": 65893, "code_hash": null, "entity": [["tile_x", "sp", [-1, 2, 1, 1]], ["tile_y", "sp", [-1, 4, 1, 2]], ["tile_k", "sp", [-1, 1, 1]]]}, "result": [[4.716808207750001], 0, 66.32038760185242, 1638122871.83222], "version": 0.2, "tvm_version": "0.8.dev0"}
{"input": ["cuda -keys=cuda,gpu -max_num_threads=1024 -thread_warp_size=32", "dense_large_batch.gpu", [["TENSOR", [65536, 4096], "float32"], ["TENSOR", [4096, 1024], "float32"]], {}], "config": {"index": 3667665, "code_hash": null, "entity": [["tile_x", "sp", [-1, 1, 1, 1]], ["tile_y", "sp", [-1, 2, 1, 2]], ["tile_k", "sp", [-1, 1, 2]]]}, "result": [[9.38165487575], 0, 126.9267795085907, 1638122998.642153], "version": 0.2, "tvm_version": "0.8.dev0"}
{"input": ["cuda -keys=cuda,gpu -max_num_threads=1024 -thread_warp_size=32", "dense_large_batch.gpu", [["TENSOR", [65536, 4096], "float32"], ["TENSOR", [4096, 1024], "float32"]], {}], "config": {"index": 280330, "code_hash": null, "entity": [["tile_x", "sp", [-1, 1, 1, 4]], ["tile_y", "sp", [-1, 8, 1, 1]], ["tile_k", "sp", [-1, 2, 1]]]}, "result": [[2.64404143225], 0, 39.245484590530396, 1638123037.7301033], "version": 0.2, "tvm_version": "0.8.dev0"}
{"input": ["cuda -keys=cuda,gpu -max_num_threads=1024 -thread_warp_size=32", "dense_large_batch.gpu", [["TENSOR", [65536, 4096], "float32"], ["TENSOR", [4096, 1024], "float32"]], {}], "config": {"index": 3604680, "code_hash": null, "entity": [["tile_x", "sp", [-1, 1, 1, 1]], ["tile_y", "sp", [-1, 4, 1, 1]], ["tile_k", "sp", [-1, 1, 2]]]}, "result": [[9.381864676], 0, 126.77000737190247, 1638123164.3742557], "version": 0.2, "tvm_version": "0.8.dev0"}
{"input": ["cuda -keys=cuda,gpu -max_num_threads=1024 -thread_warp_size=32", "dense_large_batch.gpu", [["TENSOR", [65536, 4096], "float32"], ["TENSOR", [4096, 1024], "float32"]], {}], "config": {"index": 279226, "code_hash": null, "entity": [["tile_x", "sp", [-1, 2, 1, 2]], ["tile_y", "sp", [-1, 4, 1, 1]], ["tile_k", "sp", [-1, 2, 1]]]}, "result": [[3.54269895925], 0, 50.9989800453186, 1638123215.2239804], "version": 0.2, "tvm_version": "0.8.dev0"}
{"input": ["cuda -keys=cuda,gpu -max_num_threads=1024 -thread_warp_size=32", "dense_large_batch.gpu", [["TENSOR", [65536, 4096], "float32"], ["TENSOR", [4096, 1024], "float32"]], {}], "config": {"index": 3669757, "code_hash": null, "entity": [["tile_x", "sp", [-1, 2, 1, 2]], ["tile_y", "sp", [-1, 8, 1, 2]], ["tile_k", "sp", [-1, 1, 2]]]}, "result": [[2.2488671454999998], 0, 34.37590551376343, 1638123249.3472505], "version": 0.2, "tvm_version": "0.8.dev0"}
{"input": ["cuda -keys=cuda,gpu -max_num_threads=1024 -thread_warp_size=32", "dense_large_batch.gpu", [["TENSOR", [65536, 4096], "float32"], ["TENSOR", [4096, 1024], "float32"]], {}], "config": {"index": 67014, "code_hash": null, "entity": [["tile_x", "sp", [-1, 1, 1, 2]], ["tile_y", "sp", [-1, 8, 1, 2]], ["tile_k", "sp", [-1, 1, 1]]]}, "result": [[3.94071768975], 0, 56.551384925842285, 1638123305.739776], "version": 0.2, "tvm_version": "0.8.dev0"}
{"input": ["cuda -keys=cuda,gpu -max_num_threads=1024 -thread_warp_size=32", "dense_large_batch.gpu", [["TENSOR", [65536, 4096], "float32"], ["TENSOR", [4096, 1024], "float32"]], {}], "config": {"index": 6994242, "code_hash": null, "entity": [["tile_x", "sp", [-1, 1, 1, 1]], ["tile_y", "sp", [-1, 4, 1, 2]], ["tile_k", "sp", [-1, 1, 4]]]}, "result": [[7.55881462575], 0, 103.6169843673706, 1638123409.184553], "version": 0.2, "tvm_version": "0.8.dev0"}
{"input": ["cuda -keys=cuda,gpu -max_num_threads=1024 -thread_warp_size=32", "dense_large_batch.gpu", [["TENSOR", [65536, 4096], "float32"], ["TENSOR", [4096, 1024], "float32"]], {}], "config": {"index": 344148, "code_hash": null, "entity": [["tile_x", "sp", [-1, 1, 1, 2]], ["tile_y", "sp", [-1, 8, 1, 2]], ["tile_k", "sp", [-1, 2, 1]]]}, "result": [[3.77674935125], 0, 54.454416275024414, 1638123463.450823], "version": 0.2, "tvm_version": "0.8.dev0"}
{"input": ["cuda -keys=cuda,gpu -max_num_threads=1024 -thread_warp_size=32", "dense_large_batch.gpu", [["TENSOR", [65536, 4096], "float32"], ["TENSOR", [4096, 1024], "float32"]], {}], "config": {"index": 280194, "code_hash": null, "entity": [["tile_x", "sp", [-1, 1, 1, 2]], ["tile_y", "sp", [-1, 8, 1, 1]], ["tile_k", "sp", [-1, 2, 1]]]}, "result": [[4.321119915000001], 0, 61.0861177444458, 1638123524.3963711], "version": 0.2, "tvm_version": "0.8.dev0"}
{"input": ["cuda -keys=cuda,gpu -max_num_threads=1024 -thread_warp_size=32", "dense_large_batch.gpu", [["TENSOR", [65536, 4096], "float32"], ["TENSOR", [4096, 1024], "float32"]], {}], "config": {"index": 2227, "code_hash": null, "entity": [["tile_x", "sp", [-1, 1, 1, 4]], ["tile_y", "sp", [-1, 4, 1, 1]], ["tile_k", "sp", [-1, 1, 1]]]}, "result": [[3.89221655925], 0, 55.55811548233032, 1638123579.809569], "version": 0.2, "tvm_version": "0.8.dev0"}
{"input": ["cuda -keys=cuda,gpu -max_num_threads=1024 -thread_warp_size=32", "dense_large_batch.gpu", [["TENSOR", [65536, 4096], "float32"], ["TENSOR", [4096, 1024], "float32"]], {}], "config": {"index": 280195, "code_hash": null, "entity": [["tile_x", "sp", [-1, 2, 1, 2]], ["tile_y", "sp", [-1, 8, 1, 1]], ["tile_k", "sp", [-1, 2, 1]]]}, "result": [[2.6312565825000003], 0, 39.41976833343506, 1638123619.052856], "version": 0.2, "tvm_version": "0.8.dev0"}
{"input": ["cuda -keys=cuda,gpu -max_num_threads=1024 -thread_warp_size=32", "dense_large_batch.gpu", [["TENSOR", [65536, 4096], "float32"], ["TENSOR", [4096, 1024], "float32"]], {}], "config": {"index": 3604833, "code_hash": null, "entity": [["tile_x", "sp", [-1, 1, 1, 2]], ["tile_y", "sp", [-1, 4, 1, 1]], ["tile_k", "sp", [-1, 1, 2]]]}, "result": [[5.404216975500001], 0, 75.13538408279419, 1638123694.0465589], "version": 0.2, "tvm_version": "0.8.dev0"}
{"input": ["cuda -keys=cuda,gpu -max_num_threads=1024 -thread_warp_size=32", "dense_large_batch.gpu", [["TENSOR", [65536, 4096], "float32"], ["TENSOR", [4096, 1024], "float32"]], {}], "config": {"index": 3669603, "code_hash": null, "entity": [["tile_x", "sp", [-1, 1, 1, 1]], ["tile_y", "sp", [-1, 8, 1, 2]], ["tile_k", "sp", [-1, 1, 2]]]}, "result": [[7.12088395075], 0, 97.68385553359985, 1638123791.5553882], "version": 0.2, "tvm_version": "0.8.dev0"}
{"input": ["cuda -keys=cuda,gpu -max_num_threads=1024 -thread_warp_size=32", "dense_large_batch.gpu", [["TENSOR", [65536, 4096], "float32"], ["TENSOR", [4096, 1024], "float32"]], {}], "config": {"index": 6931410, "code_hash": null, "entity": [["tile_x", "sp", [-1, 1, 1, 2]], ["tile_y", "sp", [-1, 8, 1, 1]], ["tile_k", "sp", [-1, 1, 4]]]}, "result": [[4.204448129499999], 0, 60.28301429748535, 1638123851.6460788], "version": 0.2, "tvm_version": "0.8.dev0"}
{"input": ["cuda -keys=cuda,gpu -max_num_threads=1024 -thread_warp_size=32", "dense_large_batch.gpu", [["TENSOR", [65536, 4096], "float32"], ["TENSOR", [4096, 1024], "float32"]], {}], "config": {"index": 344149, "code_hash": null, "entity": [["tile_x", "sp", [-1, 2, 1, 2]], ["tile_y", "sp", [-1, 8, 1, 2]], ["tile_k", "sp", [-1, 2, 1]]]}, "result": [[2.24839004375], 0, 34.17014408111572, 1638123885.5734649], "version": 0.2, "tvm_version": "0.8.dev0"}
{"input": ["cuda -keys=cuda,gpu -max_num_threads=1024 -thread_warp_size=32", "dense_large_batch.gpu", [["TENSOR", [65536, 4096], "float32"], ["TENSOR", [4096, 1024], "float32"]], {}], "config": {"index": 343180, "code_hash": null, "entity": [["tile_x", "sp", [-1, 2, 1, 2]], ["tile_y", "sp", [-1, 4, 1, 2]], ["tile_k", "sp", [-1, 2, 1]]]}, "result": [[2.6360133567500004], 0, 39.34520745277405, 1638123924.7465], "version": 0.2, "tvm_version": "0.8.dev0"}
{"input": ["cuda -keys=cuda,gpu -max_num_threads=1024 -thread_warp_size=32", "dense_large_batch.gpu", [["TENSOR", [65536, 4096], "float32"], ["TENSOR", [4096, 1024], "float32"]], {}], "config": {"index": 343179, "code_hash": null, "entity": [["tile_x", "sp", [-1, 1, 1, 2]], ["tile_y", "sp", [-1, 4, 1, 2]], ["tile_k", "sp", [-1, 2, 1]]]}, "result": [[4.3319409485], 0, 61.252822399139404, 1638123985.7938304], "version": 0.2, "tvm_version": "0.8.dev0"}
{"input": ["cuda -keys=cuda,gpu -max_num_threads=1024 -thread_warp_size=32", "dense_large_batch.gpu", [["TENSOR", [65536, 4096], "float32"], ["TENSOR", [4096, 1024], "float32"]], {}], "config": {"index": 3606772, "code_hash": null, "entity": [["tile_x", "sp", [-1, 2, 1, 2]], ["tile_y", "sp", [-1, 16, 1, 1]], ["tile_k", "sp", [-1, 1, 2]]]}, "result": [[2.2428260234999997], 0, 34.76934003829956, 1638124020.3396893], "version": 0.2, "tvm_version": "0.8.dev0"}
{"input": ["cuda -keys=cuda,gpu -max_num_threads=1024 -thread_warp_size=32", "dense_large_batch.gpu", [["TENSOR", [65536, 4096], "float32"], ["TENSOR", [4096, 1024], "float32"]], {}], "config": {"index": 3605650, "code_hash": null, "entity": [["tile_x", "sp", [-1, 2, 1, 1]], ["tile_y", "sp", [-1, 8, 1, 1]], ["tile_k", "sp", [-1, 1, 2]]]}, "result": [[4.331428266], 0, 61.34419059753418, 1638124081.5769796], "version": 0.2, "tvm_version": "0.8.dev0"}
{"input": ["cuda -keys=cuda,gpu -max_num_threads=1024 -thread_warp_size=32", "dense_large_batch.gpu", [["TENSOR", [65536, 4096], "float32"], ["TENSOR", [4096, 1024], "float32"]], {}], "config": {"index": 3605652, "code_hash": null, "entity": [["tile_x", "sp", [-1, 8, 1, 1]], ["tile_y", "sp", [-1, 8, 1, 1]], ["tile_k", "sp", [-1, 1, 2]]]}, "result": [[1.948242614], 0, 30.816434144973755, 1638124112.1422074], "version": 0.2, "tvm_version": "0.8.dev0"}
{"input": ["cuda -keys=cuda,gpu -max_num_threads=1024 -thread_warp_size=32", "dense_large_batch.gpu", [["TENSOR", [65536, 4096], "float32"], ["TENSOR", [4096, 1024], "float32"]], {}], "config": {"index": 65076, "code_hash": null, "entity": [["tile_x", "sp", [-1, 1, 1, 2]], ["tile_y", "sp", [-1, 2, 1, 2]], ["tile_k", "sp", [-1, 1, 1]]]}, "result": [[6.07533971325], 0, 84.91642260551453, 1638124196.9074838], "version": 0.2, "tvm_version": "0.8.dev0"}
{"input": ["cuda -keys=cuda,gpu -max_num_threads=1024 -thread_warp_size=32", "dense_large_batch.gpu", [["TENSOR", [65536, 4096], "float32"], ["TENSOR", [4096, 1024], "float32"]], {}], "config": {"index": 6931411, "code_hash": null, "entity": [["tile_x", "sp", [-1, 2, 1, 2]], ["tile_y", "sp", [-1, 8, 1, 1]], ["tile_k", "sp", [-1, 1, 4]]]}, "result": [[2.6201141705], 0, 38.99998950958252, 1638124235.6868572], "version": 0.2, "tvm_version": "0.8.dev0"}
{"input": ["cuda -keys=cuda,gpu -max_num_threads=1024 -thread_warp_size=32", "dense_large_batch.gpu", [["TENSOR", [65536, 4096], "float32"], ["TENSOR", [4096, 1024], "float32"]], {}], "config": {"index": 2091, "code_hash": null, "entity": [["tile_x", "sp", [-1, 1, 1, 2]], ["tile_y", "sp", [-1, 4, 1, 1]], ["tile_k", "sp", [-1, 1, 1]]]}, "result": [[6.07059219225], 0, 83.88813424110413, 1638124319.4416702], "version": 0.2, "tvm_version": "0.8.dev0"}
{"input": ["cuda -keys=cuda,gpu -max_num_threads=1024 -thread_warp_size=32", "dense_large_batch.gpu", [["TENSOR", [65536, 4096], "float32"], ["TENSOR", [4096, 1024], "float32"]], {}], "config": {"index": 3605649, "code_hash": null, "entity": [["tile_x", "sp", [-1, 1, 1, 1]], ["tile_y", "sp", [-1, 8, 1, 1]], ["tile_k", "sp", [-1, 1, 2]]]}, "result": [[7.938574543], 0, 108.15930151939392, 1638124428.8736923], "version": 0.2, "tvm_version": "0.8.dev0"}
{"input": ["cuda -keys=cuda,gpu -max_num_threads=1024 -thread_warp_size=32", "dense_large_batch.gpu", [["TENSOR", [65536, 4096], "float32"], ["TENSOR", [4096, 1024], "float32"]], {}], "config": {"index": 3720961, "code_hash": null, "entity": [["tile_x", "sp", [-1, 2, 1, 1]], ["tile_y", "sp", [-1, 2, 1, 4]], ["tile_k", "sp", [-1, 1, 2]]]}, "result": [[4.3356758315], 0, 61.392557859420776, 1638124490.1184204], "version": 0.2, "tvm_version": "0.8.dev0"}
{"input": ["cuda -keys=cuda,gpu -max_num_threads=1024 -thread_warp_size=32", "dense_large_batch.gpu", [["TENSOR", [65536, 4096], "float32"], ["TENSOR", [4096, 1024], "float32"]], {}], "config": {"index": 281419, "code_hash": null, "entity": [["tile_x", "sp", [-1, 1, 1, 8]], ["tile_y", "sp", [-1, 16, 1, 1]], ["tile_k", "sp", [-1, 2, 1]]]}, "result": [[2.10612360375], 0, 33.03796696662903, 1638124522.908273], "version": 0.2, "tvm_version": "0.8.dev0"}
{"input": ["cuda -keys=cuda,gpu -max_num_threads=1024 -thread_warp_size=32", "dense_large_batch.gpu", [["TENSOR", [65536, 4096], "float32"], ["TENSOR", [4096, 1024], "float32"]], {}], "config": {"index": 3605651, "code_hash": null, "entity": [["tile_x", "sp", [-1, 4, 1, 1]], ["tile_y", "sp", [-1, 8, 1, 1]], ["tile_k", "sp", [-1, 1, 2]]]}, "result": [[2.6321744077499996], 0, 39.32942843437195, 1638124562.0685503], "version": 0.2, "tvm_version": "0.8.dev0"}
{"input": ["cuda -keys=cuda,gpu -max_num_threads=1024 -thread_warp_size=32", "dense_large_batch.gpu", [["TENSOR", [65536, 4096], "float32"], ["TENSOR", [4096, 1024], "float32"]], {}], "config": {"index": 3604001, "code_hash": null, "entity": [["tile_x", "sp", [-1, 2, 1, 4]], ["tile_y", "sp", [-1, 2, 1, 1]], ["tile_k", "sp", [-1, 1, 2]]]}, "result": [[4.3287587297500005], 0, 61.176023960113525, 1638124623.1094978], "version": 0.2, "tvm_version": "0.8.dev0"}
{"input": ["cuda -keys=cuda,gpu -max_num_threads=1024 -thread_warp_size=32", "dense_large_batch.gpu", [["TENSOR", [65536, 4096], "float32"], ["TENSOR", [4096, 1024], "float32"]], {}], "config": {"index": 67150, "code_hash": null, "entity": [["tile_x", "sp", [-1, 1, 1, 4]], ["tile_y", "sp", [-1, 8, 1, 2]], ["tile_k", "sp", [-1, 1, 1]]]}, "result": [[2.279093832], 0, 35.23666524887085, 1638124658.1931305], "version": 0.2, "tvm_version": "0.8.dev0"}
{"input": ["cuda -keys=cuda,gpu -max_num_threads=1024 -thread_warp_size=32", "dense_large_batch.gpu", [["TENSOR", [65536, 4096], "float32"], ["TENSOR", [4096, 1024], "float32"]], {}], "config": {"index": 281299, "code_hash": null, "entity": [["tile_x", "sp", [-1, 1, 1, 4]], ["tile_y", "sp", [-1, 16, 1, 1]], ["tile_k", "sp", [-1, 2, 1]]]}, "result": [[2.2451453257500003], 0, 34.5260591506958, 1638124692.5221317], "version": 0.2, "tvm_version": "0.8.dev0"}
{"input": ["cuda -keys=cuda,gpu -max_num_threads=1024 -thread_warp_size=32", "dense_large_batch.gpu", [["TENSOR", [65536, 4096], "float32"], ["TENSOR", [4096, 1024], "float32"]], {}], "config": {"index": 280450, "code_hash": null, "entity": [["tile_x", "sp", [-1, 1, 1, 8]], ["tile_y", "sp", [-1, 8, 1, 1]], ["tile_k", "sp", [-1, 2, 1]]]}, "result": [[1.94497509525], 0, 30.529483795166016, 1638124722.8569744], "version": 0.2, "tvm_version": "0.8.dev0"}
{"input": ["cuda -keys=cuda,gpu -max_num_threads=1024 -thread_warp_size=32", "dense_large_batch.gpu", [["TENSOR", [65536, 4096], "float32"], ["TENSOR", [4096, 1024], "float32"]], {}], "config": {"index": 3604835, "code_hash": null, "entity": [["tile_x", "sp", [-1, 4, 1, 2]], ["tile_y", "sp", [-1, 4, 1, 1]], ["tile_k", "sp", [-1, 1, 2]]]}, "result": [[2.7041446647500003], 0, 40.11220622062683, 1638124762.8009474], "version": 0.2, "tvm_version": "0.8.dev0"}
{"input": ["cuda -keys=cuda,gpu -max_num_threads=1024 -thread_warp_size=32", "dense_large_batch.gpu", [["TENSOR", [65536, 4096], "float32"], ["TENSOR", [4096, 1024], "float32"]], {}], "config": {"index": 557328, "code_hash": null, "entity": [["tile_x", "sp", [-1, 1, 1, 2]], ["tile_y", "sp", [-1, 8, 1, 1]], ["tile_k", "sp", [-1, 4, 1]]]}, "result": [[4.214864549], 0, 59.84713268280029, 1638124822.459428], "version": 0.2, "tvm_version": "0.8.dev0"}
{"input": ["cuda -keys=cuda,gpu -max_num_threads=1024 -thread_warp_size=32", "dense_large_batch.gpu", [["TENSOR", [65536, 4096], "float32"], ["TENSOR", [4096, 1024], "float32"]], {}], "config": {"index": 3604969, "code_hash": null, "entity": [["tile_x", "sp", [-1, 1, 1, 4]], ["tile_y", "sp", [-1, 4, 1, 1]], ["tile_k", "sp", [-1, 1, 2]]]}, "result": [[3.5426615032499997], 0, 51.49432420730591, 1638124873.815671], "version": 0.2, "tvm_version": "0.8.dev0"}
{"input": ["cuda -keys=cuda,gpu -max_num_threads=1024 -thread_warp_size=32", "dense_large_batch.gpu", [["TENSOR", [65536, 4096], "float32"], ["TENSOR", [4096, 1024], "float32"]], {}], "config": {"index": 3883072, "code_hash": null, "entity": [["tile_x", "sp", [-1, 1, 1, 4]], ["tile_y", "sp", [-1, 8, 1, 1]], ["tile_k", "sp", [-1, 2, 2]]]}, "result": [[2.61983983075], 0, 39.12257266044617, 1638124912.7352161], "version": 0.2, "tvm_version": "0.8.dev0"}
{"input": ["cuda -keys=cuda,gpu -max_num_threads=1024 -thread_warp_size=32", "dense_large_batch.gpu", [["TENSOR", [65536, 4096], "float32"], ["TENSOR", [4096, 1024], "float32"]], {}], "config": {"index": 64924, "code_hash": null, "entity": [["tile_x", "sp", [-1, 2, 1, 1]], ["tile_y", "sp", [-1, 2, 1, 2]], ["tile_k", "sp", [-1, 1, 1]]]}, "result": [[6.07772844], 0, 84.24700212478638, 1638124996.8718355], "version": 0.2, "tvm_version": "0.8.dev0"}
{"input": ["cuda -keys=cuda,gpu -max_num_threads=1024 -thread_warp_size=32", "dense_large_batch.gpu", [["TENSOR", [65536, 4096], "float32"], ["TENSOR", [4096, 1024], "float32"]], {}], "config": {"index": 3882938, "code_hash": null, "entity": [["tile_x", "sp", [-1, 4, 1, 2]], ["tile_y", "sp", [-1, 8, 1, 1]], ["tile_k", "sp", [-1, 2, 2]]]}, "result": [[1.74789269425], 0, 28.038323163986206, 1638125104.1248782], "version": 0.2, "tvm_version": "0.8.dev0"}
{"input": ["cuda -keys=cuda,gpu -max_num_threads=1024 -thread_warp_size=32", "dense_large_batch.gpu", [["TENSOR", [65536, 4096], "float32"], ["TENSOR", [4096, 1024], "float32"]], {}], "config": {"index": 3883073, "code_hash": null, "entity": [["tile_x", "sp", [-1, 2, 1, 4]], ["tile_y", "sp", [-1, 8, 1, 1]], ["tile_k", "sp", [-1, 2, 2]]]}, "result": [[1.7498816802500001], 0, 28.050929307937622, 1638125131.8997366], "version": 0.2, "tvm_version": "0.8.dev0"}
{"input": ["cuda -keys=cuda,gpu -max_num_threads=1024 -thread_warp_size=32", "dense_large_batch.gpu", [["TENSOR", [65536, 4096], "float32"], ["TENSOR", [4096, 1024], "float32"]], {}], "config": {"index": 6932381, "code_hash": null, "entity": [["tile_x", "sp", [-1, 4, 1, 2]], ["tile_y", "sp", [-1, 16, 1, 1]], ["tile_k", "sp", [-1, 1, 4]]]}, "result": [[11.4524571765], 0, 154.5085849761963, 1638125286.0687785], "version": 0.2, "tvm_version": "0.8.dev0"}
{"input": ["cuda -keys=cuda,gpu -max_num_threads=1024 -thread_warp_size=32", "dense_large_batch.gpu", [["TENSOR", [65536, 4096], "float32"], ["TENSOR", [4096, 1024], "float32"]], {}], "config": {"index": 6932516, "code_hash": null, "entity": [["tile_x", "sp", [-1, 2, 1, 4]], ["tile_y", "sp", [-1, 16, 1, 1]], ["tile_k", "sp", [-1, 1, 4]]]}, "result": [[11.32475654375], 0, 152.62571716308594, 1638125638.8257596], "version": 0.2, "tvm_version": "0.8.dev0"}
{"input": ["cuda -keys=cuda,gpu -max_num_threads=1024 -thread_warp_size=32", "dense_large_batch.gpu", [["TENSOR", [65536, 4096], "float32"], ["TENSOR", [4096, 1024], "float32"]], {}], "config": {"index": 6931547, "code_hash": null, "entity": [["tile_x", "sp", [-1, 2, 1, 4]], ["tile_y", "sp", [-1, 8, 1, 1]], ["tile_k", "sp", [-1, 1, 4]]]}, "result": [[1.74973300475], 0, 28.04785990715027, 1638125666.5950024], "version": 0.2, "tvm_version": "0.8.dev0"}
{"input": ["cuda -keys=cuda,gpu -max_num_threads=1024 -thread_warp_size=32", "dense_large_batch.gpu", [["TENSOR", [65536, 4096], "float32"], ["TENSOR", [4096, 1024], "float32"]], {}], "config": {"index": 279227, "code_hash": null, "entity": [["tile_x", "sp", [-1, 4, 1, 2]], ["tile_y", "sp", [-1, 4, 1, 1]], ["tile_k", "sp", [-1, 2, 1]]]}, "result": [[2.6868891265], 0, 40.079925298690796, 1638125706.512961], "version": 0.2, "tvm_version": "0.8.dev0"}
{"input": ["cuda -keys=cuda,gpu -max_num_threads=1024 -thread_warp_size=32", "dense_large_batch.gpu", [["TENSOR", [65536, 4096], "float32"], ["TENSOR", [4096, 1024], "float32"]], {}], "config": {"index": 6932380, "code_hash": null, "entity": [["tile_x", "sp", [-1, 2, 1, 2]], ["tile_y", "sp", [-1, 16, 1, 1]], ["tile_k", "sp", [-1, 1, 4]]]}, "result": [[2.2038492715], 0, 34.008278131484985, 1638125740.2895386], "version": 0.2, "tvm_version": "0.8.dev0"}
{"input": ["cuda -keys=cuda,gpu -max_num_threads=1024 -thread_warp_size=32", "dense_large_batch.gpu", [["TENSOR", [65536, 4096], "float32"], ["TENSOR", [4096, 1024], "float32"]], {}], "config": {"index": 280196, "code_hash": null, "entity": [["tile_x", "sp", [-1, 4, 1, 2]], ["tile_y", "sp", [-1, 8, 1, 1]], ["tile_k", "sp", [-1, 2, 1]]]}, "result": [[1.9511744839999998], 0, 30.672641038894653, 1638125770.6803656], "version": 0.2, "tvm_version": "0.8.dev0"}
{"input": ["cuda -keys=cuda,gpu -max_num_threads=1024 -thread_warp_size=32", "dense_large_batch.gpu", [["TENSOR", [65536, 4096], "float32"], ["TENSOR", [4096, 1024], "float32"]], {}], "config": {"index": 3605804, "code_hash": null, "entity": [["tile_x", "sp", [-1, 4, 1, 2]], ["tile_y", "sp", [-1, 8, 1, 1]], ["tile_k", "sp", [-1, 1, 2]]]}, "result": [[1.978234445], 0, 31.883419513702393, 1638125802.3008397], "version": 0.2, "tvm_version": "0.8.dev0"}
{"input": ["cuda -keys=cuda,gpu -max_num_threads=1024 -thread_warp_size=32", "dense_large_batch.gpu", [["TENSOR", [65536, 4096], "float32"], ["TENSOR", [4096, 1024], "float32"]], {}], "config": {"index": 557465, "code_hash": null, "entity": [["tile_x", "sp", [-1, 2, 1, 4]], ["tile_y", "sp", [-1, 8, 1, 1]], ["tile_k", "sp", [-1, 4, 1]]]}, "result": [[1.75491529275], 0, 28.27267360687256, 1638125830.2426193], "version": 0.2, "tvm_version": "0.8.dev0"}
{"input": ["cuda -keys=cuda,gpu -max_num_threads=1024 -thread_warp_size=32", "dense_large_batch.gpu", [["TENSOR", [65536, 4096], "float32"], ["TENSOR", [4096, 1024], "float32"]], {}], "config": {"index": 343316, "code_hash": null, "entity": [["tile_x", "sp", [-1, 2, 1, 4]], ["tile_y", "sp", [-1, 4, 1, 2]], ["tile_k", "sp", [-1, 2, 1]]]}, "result": [[1.963953769], 0, 30.582262754440308, 1638125860.669742], "version": 0.2, "tvm_version": "0.8.dev0"}
{"input": ["cuda -keys=cuda,gpu -max_num_threads=1024 -thread_warp_size=32", "dense_large_batch.gpu", [["TENSOR", [65536, 4096], "float32"], ["TENSOR", [4096, 1024], "float32"]], {}], "config": {"index": 6931548, "code_hash": null, "entity": [["tile_x", "sp", [-1, 4, 1, 4]], ["tile_y", "sp", [-1, 8, 1, 1]], ["tile_k", "sp", [-1, 1, 4]]]}, "result": [[12.334248222], 0, 165.5835475921631, 1638126226.2652555], "version": 0.2, "tvm_version": "0.8.dev0"}
{"input": ["cuda -keys=cuda,gpu -max_num_threads=1024 -thread_warp_size=32", "dense_large_batch.gpu", [["TENSOR", [65536, 4096], "float32"], ["TENSOR", [4096, 1024], "float32"]], {}], "config": {"index": 6995366, "code_hash": null, "entity": [["tile_x", "sp", [-1, 4, 1, 2]], ["tile_y", "sp", [-1, 8, 1, 2]], ["tile_k", "sp", [-1, 1, 4]]]}, "result": [[11.91020462725], 0, 160.30092573165894, 1638126386.1936471], "version": 0.2, "tvm_version": "0.8.dev0"}
{"input": ["cuda -keys=cuda,gpu -max_num_threads=1024 -thread_warp_size=32", "dense_large_batch.gpu", [["TENSOR", [65536, 4096], "float32"], ["TENSOR", [4096, 1024], "float32"]], {}], "config": {"index": 6931412, "code_hash": null, "entity": [["tile_x", "sp", [-1, 4, 1, 2]], ["tile_y", "sp", [-1, 8, 1, 1]], ["tile_k", "sp", [-1, 1, 4]]]}, "result": [[1.7479560952500002], 0, 27.65839982032776, 1638126614.2059724], "version": 0.2, "tvm_version": "0.8.dev0"}
{"input": ["cuda -keys=cuda,gpu -max_num_threads=1024 -thread_warp_size=32", "dense_large_batch.gpu", [["TENSOR", [65536, 4096], "float32"], ["TENSOR", [4096, 1024], "float32"]], {}], "config": {"index": 558298, "code_hash": null, "entity": [["tile_x", "sp", [-1, 2, 1, 2]], ["tile_y", "sp", [-1, 16, 1, 1]], ["tile_k", "sp", [-1, 4, 1]]]}, "result": [[2.2039551035], 0, 33.75756335258484, 1638126647.7278483], "version": 0.2, "tvm_version": "0.8.dev0"}
{"input": ["cuda -keys=cuda,gpu -max_num_threads=1024 -thread_warp_size=32", "dense_large_batch.gpu", [["TENSOR", [65536, 4096], "float32"], ["TENSOR", [4096, 1024], "float32"]], {}], "config": {"index": 6931260, "code_hash": null, "entity": [["tile_x", "sp", [-1, 8, 1, 1]], ["tile_y", "sp", [-1, 8, 1, 1]], ["tile_k", "sp", [-1, 1, 4]]]}, "result": [[1.7530235115000001], 0, 27.87793755531311, 1638126675.2345111], "version": 0.2, "tvm_version": "0.8.dev0"}
{"input": ["cuda -keys=cuda,gpu -max_num_threads=1024 -thread_warp_size=32", "dense_large_batch.gpu", [["TENSOR", [65536, 4096], "float32"], ["TENSOR", [4096, 1024], "float32"]], {}], "config": {"index": 280044, "code_hash": null, "entity": [["tile_x", "sp", [-1, 8, 1, 1]], ["tile_y", "sp", [-1, 8, 1, 1]], ["tile_k", "sp", [-1, 2, 1]]]}, "result": [[1.9455013757500002], 0, 30.327567100524902, 1638126705.240898], "version": 0.2, "tvm_version": "0.8.dev0"}
{"input": ["cuda -keys=cuda,gpu -max_num_threads=1024 -thread_warp_size=32", "dense_large_batch.gpu", [["TENSOR", [65536, 4096], "float32"], ["TENSOR", [4096, 1024], "float32"]], {}], "config": {"index": 281165, "code_hash": null, "entity": [["tile_x", "sp", [-1, 4, 1, 2]], ["tile_y", "sp", [-1, 16, 1, 1]], ["tile_k", "sp", [-1, 2, 1]]]}, "result": [[1.5507682947499999], 0, 25.350913524627686, 1638126730.290822], "version": 0.2, "tvm_version": "0.8.dev0"}
{"input": ["cuda -keys=cuda,gpu -max_num_threads=1024 -thread_warp_size=32", "dense_large_batch.gpu", [["TENSOR", [65536, 4096], "float32"], ["TENSOR", [4096, 1024], "float32"]], {}], "config": {"index": 6995213, "code_hash": null, "entity": [["tile_x", "sp", [-1, 4, 1, 1]], ["tile_y", "sp", [-1, 8, 1, 2]], ["tile_k", "sp", [-1, 1, 4]]]}, "result": [[2.2116602907500003], 0, 35.528618812561035, 1638126767.4245722], "version": 0.2, "tvm_version": "0.8.dev0"}
{"input": ["cuda -keys=cuda,gpu -max_num_threads=1024 -thread_warp_size=32", "dense_large_batch.gpu", [["TENSOR", [65536, 4096], "float32"], ["TENSOR", [4096, 1024], "float32"]], {}], "config": {"index": 3946892, "code_hash": null, "entity": [["tile_x", "sp", [-1, 4, 1, 2]], ["tile_y", "sp", [-1, 8, 1, 2]], ["tile_k", "sp", [-1, 2, 2]]]}, "result": [[1.6050950705], 0, 26.56087064743042, 1638126793.4069543], "version": 0.2, "tvm_version": "0.8.dev0"}
{"input": ["cuda -keys=cuda,gpu -max_num_threads=1024 -thread_warp_size=32", "dense_large_batch.gpu", [["TENSOR", [65536, 4096], "float32"], ["TENSOR", [4096, 1024], "float32"]], {}], "config": {"index": 6932228, "code_hash": null, "entity": [["tile_x", "sp", [-1, 4, 1, 1]], ["tile_y", "sp", [-1, 16, 1, 1]], ["tile_k", "sp", [-1, 1, 4]]]}, "result": [[2.204263047], 0, 34.26322293281555, 1638127027.6224484], "version": 0.2, "tvm_version": "0.8.dev0"}
{"input": ["cuda -keys=cuda,gpu -max_num_threads=1024 -thread_warp_size=32", "dense_large_batch.gpu", [["TENSOR", [65536, 4096], "float32"], ["TENSOR", [4096, 1024], "float32"]], {}], "config": {"index": 4160888, "code_hash": null, "entity": [["tile_x", "sp", [-1, 4, 1, 1]], ["tile_y", "sp", [-1, 16, 1, 1]], ["tile_k", "sp", [-1, 4, 2]]]}, "result": [[2.25016089325], 0, 35.33684206008911, 1638127062.4134443], "version": 0.2, "tvm_version": "0.8.dev0"}
{"input": ["cuda -keys=cuda,gpu -max_num_threads=1024 -thread_warp_size=32", "dense_large_batch.gpu", [["TENSOR", [65536, 4096], "float32"], ["TENSOR", [4096, 1024], "float32"]], {}], "config": {"index": 3883193, "code_hash": null, "entity": [["tile_x", "sp", [-1, 2, 1, 8]], ["tile_y", "sp", [-1, 8, 1, 1]], ["tile_k", "sp", [-1, 2, 2]]]}, "result": [[1.59614602275], 0, 26.320456981658936, 1638127088.0161312], "version": 0.2, "tvm_version": "0.8.dev0"}
{"input": ["cuda -keys=cuda,gpu -max_num_threads=1024 -thread_warp_size=32", "dense_large_batch.gpu", [["TENSOR", [65536, 4096], "float32"], ["TENSOR", [4096, 1024], "float32"]], {}], "config": {"index": 3946739, "code_hash": null, "entity": [["tile_x", "sp", [-1, 4, 1, 1]], ["tile_y", "sp", [-1, 8, 1, 2]], ["tile_k", "sp", [-1, 2, 2]]]}, "result": [[2.2104285530000003], 0, 34.20727324485779, 1638127121.5873752], "version": 0.2, "tvm_version": "0.8.dev0"}
{"input": ["cuda -keys=cuda,gpu -max_num_threads=1024 -thread_warp_size=32", "dense_large_batch.gpu", [["TENSOR", [65536, 4096], "float32"], ["TENSOR", [4096, 1024], "float32"]], {}], "config": {"index": 396324, "code_hash": null, "entity": [["tile_x", "sp", [-1, 8, 1, 1]], ["tile_y", "sp", [-1, 4, 1, 4]], ["tile_k", "sp", [-1, 2, 1]]]}, "result": [[1.81528350375], 0, 29.33486843109131, 1638127150.2712064], "version": 0.2, "tvm_version": "0.8.dev0"}
{"input": ["cuda -keys=cuda,gpu -max_num_threads=1024 -thread_warp_size=32", "dense_large_batch.gpu", [["TENSOR", [65536, 4096], "float32"], ["TENSOR", [4096, 1024], "float32"]], {}], "config": {"index": 620162, "code_hash": null, "entity": [["tile_x", "sp", [-1, 4, 1, 1]], ["tile_y", "sp", [-1, 4, 1, 2]], ["tile_k", "sp", [-1, 4, 1]]]}, "result": [[2.6267302235], 0, 39.88321328163147, 1638127189.7826128], "version": 0.2, "tvm_version": "0.8.dev0"}
{"input": ["cuda -keys=cuda,gpu -max_num_threads=1024 -thread_warp_size=32", "dense_large_batch.gpu", [["TENSOR", [65536, 4096], "float32"], ["TENSOR", [4096, 1024], "float32"]], {}], "config": {"index": 6931667, "code_hash": null, "entity": [["tile_x", "sp", [-1, 2, 1, 8]], ["tile_y", "sp", [-1, 8, 1, 1]], ["tile_k", "sp", [-1, 1, 4]]]}, "result": [[12.2741109985], 0, 165.07132053375244, 1638127354.2774932], "version": 0.2, "tvm_version": "0.8.dev0"}
{"input": ["cuda -keys=cuda,gpu -max_num_threads=1024 -thread_warp_size=32", "dense_large_batch.gpu", [["TENSOR", [65536, 4096], "float32"], ["TENSOR", [4096, 1024], "float32"]], {}], "config": {"index": 3669606, "code_hash": null, "entity": [["tile_x", "sp", [-1, 8, 1, 1]], ["tile_y", "sp", [-1, 8, 1, 2]], ["tile_k", "sp", [-1, 1, 2]]]}, "result": [[1.85928591575], 0, 29.50732183456421, 1638127383.2640626], "version": 0.2, "tvm_version": "0.8.dev0"}
{"input": ["cuda -keys=cuda,gpu -max_num_threads=1024 -thread_warp_size=32", "dense_large_batch.gpu", [["TENSOR", [65536, 4096], "float32"], ["TENSOR", [4096, 1024], "float32"]], {}], "config": {"index": 6995214, "code_hash": null, "entity": [["tile_x", "sp", [-1, 8, 1, 1]], ["tile_y", "sp", [-1, 8, 1, 2]], ["tile_k", "sp", [-1, 1, 4]]]}, "result": [[12.1313933745], 0, 163.30937957763672, 1638127545.7383606], "version": 0.2, "tvm_version": "0.8.dev0"}
{"input": ["cuda -keys=cuda,gpu -max_num_threads=1024 -thread_warp_size=32", "dense_large_batch.gpu", [["TENSOR", [65536, 4096], "float32"], ["TENSOR", [4096, 1024], "float32"]], {}], "config": {"index": 3670012, "code_hash": null, "entity": [["tile_x", "sp", [-1, 1, 1, 8]], ["tile_y", "sp", [-1, 8, 1, 2]], ["tile_k", "sp", [-1, 1, 2]]]}, "result": [[1.58380321075], 0, 26.08091926574707, 1638127571.5155654], "version": 0.2, "tvm_version": "0.8.dev0"}
{"input": ["cuda -keys=cuda,gpu -max_num_threads=1024 -thread_warp_size=32", "dense_large_batch.gpu", [["TENSOR", [65536, 4096], "float32"], ["TENSOR", [4096, 1024], "float32"]], {}], "config": {"index": 621131, "code_hash": null, "entity": [["tile_x", "sp", [-1, 4, 1, 1]], ["tile_y", "sp", [-1, 8, 1, 2]], ["tile_k", "sp", [-1, 4, 1]]]}, "result": [[2.2195664242500004], 0, 34.429832220077515, 1638127605.239876], "version": 0.2, "tvm_version": "0.8.dev0"}
{"input": ["cuda -keys=cuda,gpu -max_num_threads=1024 -thread_warp_size=32", "dense_large_batch.gpu", [["TENSOR", [65536, 4096], "float32"], ["TENSOR", [4096, 1024], "float32"]], {}], "config": {"index": 558434, "code_hash": null, "entity": [["tile_x", "sp", [-1, 2, 1, 4]], ["tile_y", "sp", [-1, 16, 1, 1]], ["tile_k", "sp", [-1, 4, 1]]]}, "result": [[1.58698867275], 0, 25.972264289855957, 1638127630.735077], "version": 0.2, "tvm_version": "0.8.dev0"}
{"input": ["cuda -keys=cuda,gpu -max_num_threads=1024 -thread_warp_size=32", "dense_large_batch.gpu", [["TENSOR", [65536, 4096], "float32"], ["TENSOR", [4096, 1024], "float32"]], {}], "config": {"index": 3882786, "code_hash": null, "entity": [["tile_x", "sp", [-1, 8, 1, 1]], ["tile_y", "sp", [-1, 8, 1, 1]], ["tile_k", "sp", [-1, 2, 2]]]}, "result": [[1.75297143575], 0, 28.682790517807007, 1638127659.0696406], "version": 0.2, "tvm_version": "0.8.dev0"}
{"input": ["cuda -keys=cuda,gpu -max_num_threads=1024 -thread_warp_size=32", "dense_large_batch.gpu", [["TENSOR", [65536, 4096], "float32"], ["TENSOR", [4096, 1024], "float32"]], {}], "config": {"index": 344404, "code_hash": null, "entity": [["tile_x", "sp", [-1, 1, 1, 8]], ["tile_y", "sp", [-1, 8, 1, 2]], ["tile_k", "sp", [-1, 2, 1]]]}, "result": [[1.5625100385000001], 0, 25.54329252243042, 1638127740.2420113], "version": 0.2, "tvm_version": "0.8.dev0"}
{"input": ["cuda -keys=cuda,gpu -max_num_threads=1024 -thread_warp_size=32", "dense_large_batch.gpu", [["TENSOR", [65536, 4096], "float32"], ["TENSOR", [4096, 1024], "float32"]], {}], "config": {"index": 396476, "code_hash": null, "entity": [["tile_x", "sp", [-1, 4, 1, 2]], ["tile_y", "sp", [-1, 4, 1, 4]], ["tile_k", "sp", [-1, 2, 1]]]}, "result": [[2.1114830849999997], 0, 32.635831117630005, 1638127772.5681164], "version": 0.2, "tvm_version": "0.8.dev0"}
{"input": ["cuda -keys=cuda,gpu -max_num_threads=1024 -thread_warp_size=32", "dense_large_batch.gpu", [["TENSOR", [65536, 4096], "float32"], ["TENSOR", [4096, 1024], "float32"]], {}], "config": {"index": 343998, "code_hash": null, "entity": [["tile_x", "sp", [-1, 8, 1, 1]], ["tile_y", "sp", [-1, 8, 1, 2]], ["tile_k", "sp", [-1, 2, 1]]]}, "result": [[1.8851915165], 0, 29.84142565727234, 1638127801.895123], "version": 0.2, "tvm_version": "0.8.dev0"}
{"input": ["cuda -keys=cuda,gpu -max_num_threads=1024 -thread_warp_size=32", "dense_large_batch.gpu", [["TENSOR", [65536, 4096], "float32"], ["TENSOR", [4096, 1024], "float32"]], {}], "config": {"index": 557178, "code_hash": null, "entity": [["tile_x", "sp", [-1, 8, 1, 1]], ["tile_y", "sp", [-1, 8, 1, 1]], ["tile_k", "sp", [-1, 4, 1]]]}, "result": [[1.73659920625], 0, 27.940486907958984, 1638127829.2413414], "version": 0.2, "tvm_version": "0.8.dev0"}
{"input": ["cuda -keys=cuda,gpu -max_num_threads=1024 -thread_warp_size=32", "dense_large_batch.gpu", [["TENSOR", [65536, 4096], "float32"], ["TENSOR", [4096, 1024], "float32"]], {}], "config": {"index": 396611, "code_hash": null, "entity": [["tile_x", "sp", [-1, 2, 1, 4]], ["tile_y", "sp", [-1, 4, 1, 4]], ["tile_k", "sp", [-1, 2, 1]]]}, "result": [[2.10247915925], 0, 33.118008852005005, 1638127862.153807], "version": 0.2, "tvm_version": "0.8.dev0"}
{"input": ["cuda -keys=cuda,gpu -max_num_threads=1024 -thread_warp_size=32", "dense_large_batch.gpu", [["TENSOR", [65536, 4096], "float32"], ["TENSOR", [4096, 1024], "float32"]], {}], "config": {"index": 3668637, "code_hash": null, "entity": [["tile_x", "sp", [-1, 8, 1, 1]], ["tile_y", "sp", [-1, 4, 1, 2]], ["tile_k", "sp", [-1, 1, 2]]]}, "result": [[1.97759735475], 0, 31.625245571136475, 1638127893.5418415], "version": 0.2, "tvm_version": "0.8.dev0"}
{"input": ["cuda -keys=cuda,gpu -max_num_threads=1024 -thread_warp_size=32", "dense_large_batch.gpu", [["TENSOR", [65536, 4096], "float32"], ["TENSOR", [4096, 1024], "float32"]], {}], "config": {"index": 3883192, "code_hash": null, "entity": [["tile_x", "sp", [-1, 1, 1, 8]], ["tile_y", "sp", [-1, 8, 1, 1]], ["tile_k", "sp", [-1, 2, 2]]]}, "result": [[1.75308841225], 0, 27.96203589439392, 1638127921.216448], "version": 0.2, "tvm_version": "0.8.dev0"}
{"input": ["cuda -keys=cuda,gpu -max_num_threads=1024 -thread_warp_size=32", "dense_large_batch.gpu", [["TENSOR", [65536, 4096], "float32"], ["TENSOR", [4096, 1024], "float32"]], {}], "config": {"index": 343435, "code_hash": null, "entity": [["tile_x", "sp", [-1, 1, 1, 8]], ["tile_y", "sp", [-1, 4, 1, 2]], ["tile_k", "sp", [-1, 2, 1]]]}, "result": [[1.9573684942499998], 0, 30.35144352912903, 1638127951.3504717], "version": 0.2, "tvm_version": "0.8.dev0"}
{"input": ["cuda -keys=cuda,gpu -max_num_threads=1024 -thread_warp_size=32", "dense_large_batch.gpu", [["TENSOR", [65536, 4096], "float32"], ["TENSOR", [4096, 1024], "float32"]], {}], "config": {"index": 6931259, "code_hash": null, "entity": [["tile_x", "sp", [-1, 4, 1, 1]], ["tile_y", "sp", [-1, 8, 1, 1]], ["tile_k", "sp", [-1, 1, 4]]]}, "result": [[2.62341304725], 0, 39.11782169342041, 1638127990.242093], "version": 0.2, "tvm_version": "0.8.dev0"}
{"input": ["cuda -keys=cuda,gpu -max_num_threads=1024 -thread_warp_size=32", "dense_large_batch.gpu", [["TENSOR", [65536, 4096], "float32"], ["TENSOR", [4096, 1024], "float32"]], {}], "config": {"index": 3882785, "code_hash": null, "entity": [["tile_x", "sp", [-1, 4, 1, 1]], ["tile_y", "sp", [-1, 8, 1, 1]], ["tile_k", "sp", [-1, 2, 2]]]}, "result": [[2.619924203], 0, 39.465550661087036, 1638128029.4179919], "version": 0.2, "tvm_version": "0.8.dev0"}
{"input": ["cuda -keys=cuda,gpu -max_num_threads=1024 -thread_warp_size=32", "dense_large_batch.gpu", [["TENSOR", [65536, 4096], "float32"], ["TENSOR", [4096, 1024], "float32"]], {}], "config": {"index": 4030, "code_hash": null, "entity": [["tile_x", "sp", [-1, 2, 1, 2]], ["tile_y", "sp", [-1, 16, 1, 1]], ["tile_k", "sp", [-1, 1, 1]]]}, "result": [[2.2810337599999997], 0, 35.10809016227722, 1638128064.5000088], "version": 0.2, "tvm_version": "0.8.dev0"}
{"input": ["cuda -keys=cuda,gpu -max_num_threads=1024 -thread_warp_size=32", "dense_large_batch.gpu", [["TENSOR", [65536, 4096], "float32"], ["TENSOR", [4096, 1024], "float32"]], {}], "config": {"index": 343029, "code_hash": null, "entity": [["tile_x", "sp", [-1, 8, 1, 1]], ["tile_y", "sp", [-1, 4, 1, 2]], ["tile_k", "sp", [-1, 2, 1]]]}, "result": [[1.97026417375], 0, 31.042524337768555, 1638128095.2136414], "version": 0.2, "tvm_version": "0.8.dev0"}
{"input": ["cuda -keys=cuda,gpu -max_num_threads=1024 -thread_warp_size=32", "dense_large_batch.gpu", [["TENSOR", [65536, 4096], "float32"], ["TENSOR", [4096, 1024], "float32"]], {}], "config": {"index": 3606773, "code_hash": null, "entity": [["tile_x", "sp", [-1, 4, 1, 2]], ["tile_y", "sp", [-1, 16, 1, 1]], ["tile_k", "sp", [-1, 1, 2]]]}, "result": [[2.0993827240000003], 0, 32.603917360305786, 1638128127.463806], "version": 0.2, "tvm_version": "0.8.dev0"}
