artifacts/microbenchmark/tvm/autotvm/matmul_nn/matmul_65536_30522_1024.log
{"input": ["cuda -keys=cuda,gpu -max_num_threads=1024 -thread_warp_size=32", "dense_large_batch.gpu", [["TENSOR", [65536, 30522], "float32"], ["TENSOR", [30522, 1024], "float32"]], {}], "config": {"index": 2260051, "code_hash": null, "entity": [["tile_x", "sp", [-1, 1, 16, 4]], ["tile_y", "sp", [-1, 64, 16, 1]], ["tile_k", "sp", [-1, 1, 2]]]}, "result": [[9.63632586475], 0, 153.00130772590637, 1638142000.7785115], "version": 0.2, "tvm_version": "0.8.dev0"}
{"input": ["cuda -keys=cuda,gpu -max_num_threads=1024 -thread_warp_size=32", "dense_large_batch.gpu", [["TENSOR", [65536, 30522], "float32"], ["TENSOR", [30522, 1024], "float32"]], {}], "config": {"index": 293776, "code_hash": null, "entity": [["tile_x", "sp", [-1, 1, 2, 2]], ["tile_y", "sp", [-1, 64, 2, 1]], ["tile_k", "sp", [-1, 2, 1]]]}, "result": [[7.72150361025], 0, 126.96384000778198, 1638142368.4273682], "version": 0.2, "tvm_version": "0.8.dev0"}
{"input": ["cuda -keys=cuda,gpu -max_num_threads=1024 -thread_warp_size=32", "dense_large_batch.gpu", [["TENSOR", [65536, 30522], "float32"], ["TENSOR", [30522, 1024], "float32"]], {}], "config": {"index": 2319028, "code_hash": null, "entity": [["tile_x", "sp", [-1, 1, 16, 2]], ["tile_y", "sp", [-1, 32, 16, 2]], ["tile_k", "sp", [-1, 1, 2]]]}, "result": [[1.0997699357500001], 0, 40.81842756271362, 1638143069.1003046], "version": 0.2, "tvm_version": "0.8.dev0"}
{"input": ["cuda -keys=cuda,gpu -max_num_threads=1024 -thread_warp_size=32", "dense_large_batch.gpu", [["TENSOR", [65536, 30522], "float32"], ["TENSOR", [30522, 1024], "float32"]], {}], "config": {"index": 3368455, "code_hash": null, "entity": [["tile_x", "sp", [-1, 1, 16, 2]], ["tile_y", "sp", [-1, 64, 16, 1]], ["tile_k", "sp", [-1, 1, 3]]]}, "result": [[10.77779732025], 0, 166.90860891342163, 1638143236.0732741], "version": 0.2, "tvm_version": "0.8.dev0"}
{"input": ["cuda -keys=cuda,gpu -max_num_threads=1024 -thread_warp_size=32", "dense_large_batch.gpu", [["TENSOR", [65536, 30522], "float32"], ["TENSOR", [30522, 1024], "float32"]], {}], "config": {"index": 2232745, "code_hash": null, "entity": [["tile_x", "sp", [-1, 1, 2, 2]], ["tile_y", "sp", [-1, 32, 2, 1]], ["tile_k", "sp", [-1, 1, 2]]]}, "result": [[8.023668165], 0, 130.58104157447815, 1638143368.6644096], "version": 0.2, "tvm_version": "0.8.dev0"}
{"input": ["cuda -keys=cuda,gpu -max_num_threads=1024 -thread_warp_size=32", "dense_large_batch.gpu", [["TENSOR", [65536, 30522], "float32"], ["TENSOR", [30522, 1024], "float32"]], {}], "config": {"index": 2233714, "code_hash": null, "entity": [["tile_x", "sp", [-1, 1, 2, 2]], ["tile_y", "sp", [-1, 64, 2, 1]], ["tile_k", "sp", [-1, 1, 2]]]}, "result": [[7.72383591425], 0, 126.85969495773315, 1638143495.1560915], "version": 0.2, "tvm_version": "0.8.dev0"}
{"input": ["cuda -keys=cuda,gpu -max_num_threads=1024 -thread_warp_size=32", "dense_large_batch.gpu", [["TENSOR", [65536, 30522], "float32"], ["TENSOR", [30522, 1024], "float32"]], {}], "config": {"index": 2233849, "code_hash": null, "entity": [["tile_x", "sp", [-1, 1, 2, 4]], ["tile_y", "sp", [-1, 64, 2, 1]], ["tile_k", "sp", [-1, 1, 2]]]}, "result": [[7.68976559475], 0, 127.11244869232178, 1638144080.9250743], "version": 0.2, "tvm_version": "0.8.dev0"}
{"input": ["cuda -keys=cuda,gpu -max_num_threads=1024 -thread_warp_size=32", "dense_large_batch.gpu", [["TENSOR", [65536, 30522], "float32"], ["TENSOR", [30522, 1024], "float32"]], {}], "config": {"index": 2295730, "code_hash": null, "entity": [["tile_x", "sp", [-1, 1, 2, 2]], ["tile_y", "sp", [-1, 32, 2, 2]], ["tile_k", "sp", [-1, 1, 2]]]}, "result": [[7.66171283075], 0, 126.19409012794495, 1638144407.2342894], "version": 0.2, "tvm_version": "0.8.dev0"}
{"input": ["cuda -keys=cuda,gpu -max_num_threads=1024 -thread_warp_size=32", "dense_large_batch.gpu", [["TENSOR", [65536, 30522], "float32"], ["TENSOR", [30522, 1024], "float32"]], {}], "config": {"index": 292807, "code_hash": null, "entity": [["tile_x", "sp", [-1, 1, 2, 2]], ["tile_y", "sp", [-1, 32, 2, 1]], ["tile_k", "sp", [-1, 2, 1]]]}, "result": [[8.01853931925], 0, 130.52166962623596, 1638144537.5255365], "version": 0.2, "tvm_version": "0.8.dev0"}
{"input": ["cuda -keys=cuda,gpu -max_num_threads=1024 -thread_warp_size=32", "dense_large_batch.gpu", [["TENSOR", [65536, 30522], "float32"], ["TENSOR", [30522, 1024], "float32"]], {}], "config": {"index": 355792, "code_hash": null, "entity": [["tile_x", "sp", [-1, 1, 2, 2]], ["tile_y", "sp", [-1, 32, 2, 2]], ["tile_k", "sp", [-1, 2, 1]]]}, "result": [[7.66629162325], 0, 125.9607515335083, 1638144663.2611642], "version": 0.2, "tvm_version": "0.8.dev0"}
{"input": ["cuda -keys=cuda,gpu -max_num_threads=1024 -thread_warp_size=32", "dense_large_batch.gpu", [["TENSOR", [65536, 30522], "float32"], ["TENSOR", [30522, 1024], "float32"]], {}], "config": {"index": 293911, "code_hash": null, "entity": [["tile_x", "sp", [-1, 1, 2, 4]], ["tile_y", "sp", [-1, 64, 2, 1]], ["tile_k", "sp", [-1, 2, 1]]]}, "result": [[7.692997473], 0, 127.11309742927551, 1638144789.7225485], "version": 0.2, "tvm_version": "0.8.dev0"}
{"input": ["cuda -keys=cuda,gpu -max_num_threads=1024 -thread_warp_size=32", "dense_large_batch.gpu", [["TENSOR", [65536, 30522], "float32"], ["TENSOR", [30522, 1024], "float32"]], {}], "config": {"index": 2232880, "code_hash": null, "entity": [["tile_x", "sp", [-1, 1, 2, 4]], ["tile_y", "sp", [-1, 32, 2, 1]], ["tile_k", "sp", [-1, 1, 2]]]}, "result": [[4.67588889575], 0, 87.05507445335388, 1638144876.5966554], "version": 0.2, "tvm_version": "0.8.dev0"}
{"input": ["cuda -keys=cuda,gpu -max_num_threads=1024 -thread_warp_size=32", "dense_large_batch.gpu", [["TENSOR", [65536, 30522], "float32"], ["TENSOR", [30522, 1024], "float32"]], {}], "config": {"index": 2252154, "code_hash": null, "entity": [["tile_x", "sp", [-1, 1, 8, 2]], ["tile_y", "sp", [-1, 64, 8, 1]], ["tile_k", "sp", [-1, 1, 2]]]}, "result": [[8.47544025175], 0, 136.83921718597412, 1638145215.1411276], "version": 0.2, "tvm_version": "0.8.dev0"}
{"input": ["cuda -keys=cuda,gpu -max_num_threads=1024 -thread_warp_size=32", "dense_large_batch.gpu", [["TENSOR", [65536, 30522], "float32"], ["TENSOR", [30522, 1024], "float32"]], {}], "config": {"index": 2259082, "code_hash": null, "entity": [["tile_x", "sp", [-1, 1, 16, 4]], ["tile_y", "sp", [-1, 32, 16, 1]], ["tile_k", "sp", [-1, 1, 2]]]}, "result": [[0.7509690155], 0, 36.23736643791199, 1638145452.136081], "version": 0.2, "tvm_version": "0.8.dev0"}
{"input": ["cuda -keys=cuda,gpu -max_num_threads=1024 -thread_warp_size=32", "dense_large_batch.gpu", [["TENSOR", [65536, 30522], "float32"], ["TENSOR", [30522, 1024], "float32"]], {}], "config": {"index": 2251185, "code_hash": null, "entity": [["tile_x", "sp", [-1, 1, 8, 2]], ["tile_y", "sp", [-1, 32, 8, 1]], ["tile_k", "sp", [-1, 1, 2]]]}, "result": [[0.9471360704999999], 0, 38.67391109466553, 1638145695.1676006], "version": 0.2, "tvm_version": "0.8.dev0"}
{"input": ["cuda -keys=cuda,gpu -max_num_threads=1024 -thread_warp_size=32", "dense_large_batch.gpu", [["TENSOR", [65536, 30522], "float32"], ["TENSOR", [30522, 1024], "float32"]], {}], "config": {"index": 2510696, "code_hash": null, "entity": [["tile_x", "sp", [-1, 1, 2, 1]], ["tile_y", "sp", [-1, 64, 2, 1]], ["tile_k", "sp", [-1, 3, 2]]]}, "result": [[12.9040090285], 0, 194.82980489730835, 1638146146.9787006], "version": 0.2, "tvm_version": "0.8.dev0"}
{"input": ["cuda -keys=cuda,gpu -max_num_threads=1024 -thread_warp_size=32", "dense_large_batch.gpu", [["TENSOR", [65536, 30522], "float32"], ["TENSOR", [30522, 1024], "float32"]], {}], "config": {"index": 34246, "code_hash": null, "entity": [["tile_x", "sp", [-1, 1, 8, 4]], ["tile_y", "sp", [-1, 32, 8, 1]], ["tile_k", "sp", [-1, 1, 1]]]}, "result": [[0.7918163060000001], 0, 36.71895790100098, 1638146383.9256365], "version": 0.2, "tvm_version": "0.8.dev0"}
{"input": ["cuda -keys=cuda,gpu -max_num_threads=1024 -thread_warp_size=32", "dense_large_batch.gpu", [["TENSOR", [65536, 30522], "float32"], ["TENSOR", [30522, 1024], "float32"]], {}], "config": {"index": 3404114, "code_hash": null, "entity": [["tile_x", "sp", [-1, 1, 2, 1]], ["tile_y", "sp", [-1, 32, 2, 2]], ["tile_k", "sp", [-1, 1, 3]]]}, "result": [[10.66042751425], 0, 165.1119740009308, 1638146949.6335595], "version": 0.2, "tvm_version": "0.8.dev0"}
{"input": ["cuda -keys=cuda,gpu -max_num_threads=1024 -thread_warp_size=32", "dense_large_batch.gpu", [["TENSOR", [65536, 30522], "float32"], ["TENSOR", [30522, 1024], "float32"]], {}], "config": {"index": 570910, "code_hash": null, "entity": [["tile_x", "sp", [-1, 1, 2, 2]], ["tile_y", "sp", [-1, 64, 2, 1]], ["tile_k", "sp", [-1, 3, 1]]]}, "result": [[7.87093880525], 0, 129.25260663032532, 1638147078.3350527], "version": 0.2, "tvm_version": "0.8.dev0"}
{"input": ["cuda -keys=cuda,gpu -max_num_threads=1024 -thread_warp_size=32", "dense_large_batch.gpu", [["TENSOR", [65536, 30522], "float32"], ["TENSOR", [30522, 1024], "float32"]], {}], "config": {"index": 312216, "code_hash": null, "entity": [["tile_x", "sp", [-1, 1, 8, 2]], ["tile_y", "sp", [-1, 64, 8, 1]], ["tile_k", "sp", [-1, 2, 1]]]}, "result": [[0.9258734515], 0, 38.59165692329407, 1638147317.0081794], "version": 0.2, "tvm_version": "0.8.dev0"}
{"input": ["cuda -keys=cuda,gpu -max_num_threads=1024 -thread_warp_size=32", "dense_large_batch.gpu", [["TENSOR", [65536, 30522], "float32"], ["TENSOR", [30522, 1024], "float32"]], {}], "config": {"index": 35215, "code_hash": null, "entity": [["tile_x", "sp", [-1, 1, 8, 4]], ["tile_y", "sp", [-1, 64, 8, 1]], ["tile_k", "sp", [-1, 1, 1]]]}, "result": [[6.0462734775], 0, 105.65572094917297, 1638147422.112725], "version": 0.2, "tvm_version": "0.8.dev0"}
{"input": ["cuda -keys=cuda,gpu -max_num_threads=1024 -thread_warp_size=32", "dense_large_batch.gpu", [["TENSOR", [65536, 30522], "float32"], ["TENSOR", [30522, 1024], "float32"]], {}], "config": {"index": 15808, "code_hash": null, "entity": [["tile_x", "sp", [-1, 1, 2, 4]], ["tile_y", "sp", [-1, 32, 2, 1]], ["tile_k", "sp", [-1, 1, 1]]]}, "result": [[6.171311746000001], 0, 106.55329394340515, 1638147728.8953533], "version": 0.2, "tvm_version": "0.8.dev0"}
{"input": ["cuda -keys=cuda,gpu -max_num_threads=1024 -thread_warp_size=32", "dense_large_batch.gpu", [["TENSOR", [65536, 30522], "float32"], ["TENSOR", [30522, 1024], "float32"]], {}], "config": {"index": 292942, "code_hash": null, "entity": [["tile_x", "sp", [-1, 1, 2, 4]], ["tile_y", "sp", [-1, 32, 2, 1]], ["tile_k", "sp", [-1, 2, 1]]]}, "result": [[4.65695447625], 0, 87.00727605819702, 1638148016.0951707], "version": 0.2, "tvm_version": "0.8.dev0"}
{"input": ["cuda -keys=cuda,gpu -max_num_threads=1024 -thread_warp_size=32", "dense_large_batch.gpu", [["TENSOR", [65536, 30522], "float32"], ["TENSOR", [30522, 1024], "float32"]], {}], "config": {"index": 310278, "code_hash": null, "entity": [["tile_x", "sp", [-1, 1, 8, 2]], ["tile_y", "sp", [-1, 16, 8, 1]], ["tile_k", "sp", [-1, 2, 1]]]}, "result": [[0.853520696], 0, 37.353612661361694, 1638148253.6941068], "version": 0.2, "tvm_version": "0.8.dev0"}
{"input": ["cuda -keys=cuda,gpu -max_num_threads=1024 -thread_warp_size=32", "dense_large_batch.gpu", [["TENSOR", [65536, 30522], "float32"], ["TENSOR", [30522, 1024], "float32"]], {}], "config": {"index": 2250216, "code_hash": null, "entity": [["tile_x", "sp", [-1, 1, 8, 2]], ["tile_y", "sp", [-1, 16, 8, 1]], ["tile_k", "sp", [-1, 1, 2]]]}, "result": [[0.856043692], 0, 37.39489531517029, 1638148290.904398], "version": 0.2, "tvm_version": "0.8.dev0"}
{"input": ["cuda -keys=cuda,gpu -max_num_threads=1024 -thread_warp_size=32", "dense_large_batch.gpu", [["TENSOR", [65536, 30522], "float32"], ["TENSOR", [30522, 1024], "float32"]], {}], "config": {"index": 2295578, "code_hash": null, "entity": [["tile_x", "sp", [-1, 1, 2, 1]], ["tile_y", "sp", [-1, 32, 2, 2]], ["tile_k", "sp", [-1, 1, 2]]]}, "result": [[12.44325048875], 0, 188.12236952781677, 1638148478.8456059], "version": 0.2, "tvm_version": "0.8.dev0"}
{"input": ["cuda -keys=cuda,gpu -max_num_threads=1024 -thread_warp_size=32", "dense_large_batch.gpu", [["TENSOR", [65536, 30522], "float32"], ["TENSOR", [30522, 1024], "float32"]], {}], "config": {"index": 372145, "code_hash": null, "entity": [["tile_x", "sp", [-1, 2, 8, 1]], ["tile_y", "sp", [-1, 32, 8, 2]], ["tile_k", "sp", [-1, 2, 1]]]}, "result": [[0.8640560365], 0, 37.531041383743286, 1638149119.5620162], "version": 0.2, "tvm_version": "0.8.dev0"}
{"input": ["cuda -keys=cuda,gpu -max_num_threads=1024 -thread_warp_size=32", "dense_large_batch.gpu", [["TENSOR", [65536, 30522], "float32"], ["TENSOR", [30522, 1024], "float32"]], {}], "config": {"index": 311247, "code_hash": null, "entity": [["tile_x", "sp", [-1, 1, 8, 2]], ["tile_y", "sp", [-1, 32, 8, 1]], ["tile_k", "sp", [-1, 2, 1]]]}, "result": [[0.947239371], 0, 38.57674598693848, 1638149427.2718053], "version": 0.2, "tvm_version": "0.8.dev0"}
{"input": ["cuda -keys=cuda,gpu -max_num_threads=1024 -thread_warp_size=32", "dense_large_batch.gpu", [["TENSOR", [65536, 30522], "float32"], ["TENSOR", [30522, 1024], "float32"]], {}], "config": {"index": 372144, "code_hash": null, "entity": [["tile_x", "sp", [-1, 1, 8, 1]], ["tile_y", "sp", [-1, 32, 8, 2]], ["tile_k", "sp", [-1, 2, 1]]]}, "result": [[1.3642645935], 0, 43.978105306625366, 1638149471.0126708], "version": 0.2, "tvm_version": "0.8.dev0"}
{"input": ["cuda -keys=cuda,gpu -max_num_threads=1024 -thread_warp_size=32", "dense_large_batch.gpu", [["TENSOR", [65536, 30522], "float32"], ["TENSOR", [30522, 1024], "float32"]], {}], "config": {"index": 94191, "code_hash": null, "entity": [["tile_x", "sp", [-1, 1, 8, 2]], ["tile_y", "sp", [-1, 16, 8, 2]], ["tile_k", "sp", [-1, 1, 1]]]}, "result": [[1.06423621], 0, 39.95849394798279, 1638149510.7833228], "version": 0.2, "tvm_version": "0.8.dev0"}
{"input": ["cuda -keys=cuda,gpu -max_num_threads=1024 -thread_warp_size=32", "dense_large_batch.gpu", [["TENSOR", [65536, 30522], "float32"], ["TENSOR", [30522, 1024], "float32"]], {}], "config": {"index": 95160, "code_hash": null, "entity": [["tile_x", "sp", [-1, 1, 8, 2]], ["tile_y", "sp", [-1, 32, 8, 2]], ["tile_k", "sp", [-1, 1, 1]]]}, "result": [[1.015005023], 0, 39.42287755012512, 1638149549.9603431], "version": 0.2, "tvm_version": "0.8.dev0"}
{"input": ["cuda -keys=cuda,gpu -max_num_threads=1024 -thread_warp_size=32", "dense_large_batch.gpu", [["TENSOR", [65536, 30522], "float32"], ["TENSOR", [30522, 1024], "float32"]], {}], "config": {"index": 33277, "code_hash": null, "entity": [["tile_x", "sp", [-1, 1, 8, 4]], ["tile_y", "sp", [-1, 16, 8, 1]], ["tile_k", "sp", [-1, 1, 1]]]}, "result": [[0.79127887625], 0, 36.50548577308655, 1638149586.2698882], "version": 0.2, "tvm_version": "0.8.dev0"}
{"input": ["cuda -keys=cuda,gpu -max_num_threads=1024 -thread_warp_size=32", "dense_large_batch.gpu", [["TENSOR", [65536, 30522], "float32"], ["TENSOR", [30522, 1024], "float32"]], {}], "config": {"index": 632774, "code_hash": null, "entity": [["tile_x", "sp", [-1, 1, 2, 1]], ["tile_y", "sp", [-1, 32, 2, 2]], ["tile_k", "sp", [-1, 3, 1]]]}, "result": [[10.659731377750001], 0, 165.07978510856628, 1638149751.0357223], "version": 0.2, "tvm_version": "0.8.dev0"}
{"input": ["cuda -keys=cuda,gpu -max_num_threads=1024 -thread_warp_size=32", "dense_large_batch.gpu", [["TENSOR", [65536, 30522], "float32"], ["TENSOR", [30522, 1024], "float32"]], {}], "config": {"index": 371176, "code_hash": null, "entity": [["tile_x", "sp", [-1, 2, 8, 1]], ["tile_y", "sp", [-1, 16, 8, 2]], ["tile_k", "sp", [-1, 2, 1]]]}, "result": [[0.864214536], 0, 38.00132203102112, 1638149788.9273455], "version": 0.2, "tvm_version": "0.8.dev0"}
{"input": ["cuda -keys=cuda,gpu -max_num_threads=1024 -thread_warp_size=32", "dense_large_batch.gpu", [["TENSOR", [65536, 30522], "float32"], ["TENSOR", [30522, 1024], "float32"]], {}], "config": {"index": 847892, "code_hash": null, "entity": [["tile_x", "sp", [-1, 1, 2, 1]], ["tile_y", "sp", [-1, 64, 2, 1]], ["tile_k", "sp", [-1, 6, 1]]]}, "result": [[12.900679131], 0, 194.93533873558044, 1638149983.4243453], "version": 0.2, "tvm_version": "0.8.dev0"}
{"input": ["cuda -keys=cuda,gpu -max_num_threads=1024 -thread_warp_size=32", "dense_large_batch.gpu", [["TENSOR", [65536, 30522], "float32"], ["TENSOR", [30522, 1024], "float32"]], {}], "config": {"index": 144429, "code_hash": null, "entity": [["tile_x", "sp", [-1, 1, 8, 1]], ["tile_y", "sp", [-1, 16, 8, 4]], ["tile_k", "sp", [-1, 1, 1]]]}, "result": [[1.807426234], 0, 49.676634311676025, 1638150032.9078398], "version": 0.2, "tvm_version": "0.8.dev0"}
{"input": ["cuda -keys=cuda,gpu -max_num_threads=1024 -thread_warp_size=32", "dense_large_batch.gpu", [["TENSOR", [65536, 30522], "float32"], ["TENSOR", [30522, 1024], "float32"]], {}], "config": {"index": 93222, "code_hash": null, "entity": [["tile_x", "sp", [-1, 1, 8, 2]], ["tile_y", "sp", [-1, 8, 8, 2]], ["tile_k", "sp", [-1, 1, 1]]]}, "result": [[1.0214299005], 0, 39.36125636100769, 1638150072.1453054], "version": 0.2, "tvm_version": "0.8.dev0"}
{"input": ["cuda -keys=cuda,gpu -max_num_threads=1024 -thread_warp_size=32", "dense_large_batch.gpu", [["TENSOR", [65536, 30522], "float32"], ["TENSOR", [30522, 1024], "float32"]], {}], "config": {"index": 406997, "code_hash": null, "entity": [["tile_x", "sp", [-1, 1, 2, 1]], ["tile_y", "sp", [-1, 16, 2, 4]], ["tile_k", "sp", [-1, 2, 1]]]}, "result": [[11.29879788625], 0, 173.34739565849304, 1638150245.3359146], "version": 0.2, "tvm_version": "0.8.dev0"}
{"input": ["cuda -keys=cuda,gpu -max_num_threads=1024 -thread_warp_size=32", "dense_large_batch.gpu", [["TENSOR", [65536, 30522], "float32"], ["TENSOR", [30522, 1024], "float32"]], {}], "config": {"index": 2346935, "code_hash": null, "entity": [["tile_x", "sp", [-1, 1, 2, 1]], ["tile_y", "sp", [-1, 16, 2, 4]], ["tile_k", "sp", [-1, 1, 2]]]}, "result": [[11.29806937775], 0, 173.44552302360535, 1638150618.9526403], "version": 0.2, "tvm_version": "0.8.dev0"}
{"input": ["cuda -keys=cuda,gpu -max_num_threads=1024 -thread_warp_size=32", "dense_large_batch.gpu", [["TENSOR", [65536, 30522], "float32"], ["TENSOR", [30522, 1024], "float32"]], {}], "config": {"index": 319144, "code_hash": null, "entity": [["tile_x", "sp", [-1, 1, 16, 4]], ["tile_y", "sp", [-1, 32, 16, 1]], ["tile_k", "sp", [-1, 2, 1]]]}, "result": [[0.75123643175], 0, 36.05567383766174, 1638150654.757053], "version": 0.2, "tvm_version": "0.8.dev0"}
{"input": ["cuda -keys=cuda,gpu -max_num_threads=1024 -thread_warp_size=32", "dense_large_batch.gpu", [["TENSOR", [65536, 30522], "float32"], ["TENSOR", [30522, 1024], "float32"]], {}], "config": {"index": 379090, "code_hash": null, "entity": [["tile_x", "sp", [-1, 1, 16, 2]], ["tile_y", "sp", [-1, 32, 16, 2]], ["tile_k", "sp", [-1, 2, 1]]]}, "result": [[1.09784615925], 0, 40.38259959220886, 1638150696.6923513], "version": 0.2, "tvm_version": "0.8.dev0"}
{"input": ["cuda -keys=cuda,gpu -max_num_threads=1024 -thread_warp_size=32", "dense_large_batch.gpu", [["TENSOR", [65536, 30522], "float32"], ["TENSOR", [30522, 1024], "float32"]], {}], "config": {"index": 311248, "code_hash": null, "entity": [["tile_x", "sp", [-1, 2, 8, 2]], ["tile_y", "sp", [-1, 32, 8, 1]], ["tile_k", "sp", [-1, 2, 1]]]}, "result": [[0.7485638444999999], 0, 36.080355644226074, 1638150732.6550024], "version": 0.2, "tvm_version": "0.8.dev0"}
{"input": ["cuda -keys=cuda,gpu -max_num_threads=1024 -thread_warp_size=32", "dense_large_batch.gpu", [["TENSOR", [65536, 30522], "float32"], ["TENSOR", [30522, 1024], "float32"]], {}], "config": {"index": 95161, "code_hash": null, "entity": [["tile_x", "sp", [-1, 2, 8, 2]], ["tile_y", "sp", [-1, 32, 8, 2]], ["tile_k", "sp", [-1, 1, 1]]]}, "result": [[6.20639726175], 0, 109.1765239238739, 1638150841.1670907], "version": 0.2, "tvm_version": "0.8.dev0"}
{"input": ["cuda -keys=cuda,gpu -max_num_threads=1024 -thread_warp_size=32", "dense_large_batch.gpu", [["TENSOR", [65536, 30522], "float32"], ["TENSOR", [30522, 1024], "float32"]], {}], "config": {"index": 355640, "code_hash": null, "entity": [["tile_x", "sp", [-1, 1, 2, 1]], ["tile_y", "sp", [-1, 32, 2, 2]], ["tile_k", "sp", [-1, 2, 1]]]}, "result": [[12.454189034999999], 0, 188.988840341568, 1638151030.4432275], "version": 0.2, "tvm_version": "0.8.dev0"}
{"input": ["cuda -keys=cuda,gpu -max_num_threads=1024 -thread_warp_size=32", "dense_large_batch.gpu", [["TENSOR", [65536, 30522], "float32"], ["TENSOR", [30522, 1024], "float32"]], {}], "config": {"index": 2258113, "code_hash": null, "entity": [["tile_x", "sp", [-1, 1, 16, 4]], ["tile_y", "sp", [-1, 16, 16, 1]], ["tile_k", "sp", [-1, 1, 2]]]}, "result": [[0.58829720725], 0, 34.02071261405945, 1638151064.2663455], "version": 0.2, "tvm_version": "0.8.dev0"}
{"input": ["cuda -keys=cuda,gpu -max_num_threads=1024 -thread_warp_size=32", "dense_large_batch.gpu", [["TENSOR", [65536, 30522], "float32"], ["TENSOR", [30522, 1024], "float32"]], {}], "config": {"index": 2367329, "code_hash": null, "entity": [["tile_x", "sp", [-1, 1, 16, 1]], ["tile_y", "sp", [-1, 16, 16, 4]], ["tile_k", "sp", [-1, 1, 2]]]}, "result": [[1.52367671525], 0, 46.43564701080322, 1638151110.5449624], "version": 0.2, "tvm_version": "0.8.dev0"}
{"input": ["cuda -keys=cuda,gpu -max_num_threads=1024 -thread_warp_size=32", "dense_large_batch.gpu", [["TENSOR", [65536, 30522], "float32"], ["TENSOR", [30522, 1024], "float32"]], {}], "config": {"index": 2257144, "code_hash": null, "entity": [["tile_x", "sp", [-1, 1, 16, 4]], ["tile_y", "sp", [-1, 8, 16, 1]], ["tile_k", "sp", [-1, 1, 2]]]}, "result": [[0.8137006474999999], 0, 36.712252616882324, 1638151147.1254334], "version": 0.2, "tvm_version": "0.8.dev0"}
{"input": ["cuda -keys=cuda,gpu -max_num_threads=1024 -thread_warp_size=32", "dense_large_batch.gpu", [["TENSOR", [65536, 30522], "float32"], ["TENSOR", [30522, 1024], "float32"]], {}], "config": {"index": 2318059, "code_hash": null, "entity": [["tile_x", "sp", [-1, 1, 16, 2]], ["tile_y", "sp", [-1, 16, 16, 2]], ["tile_k", "sp", [-1, 1, 2]]]}, "result": [[0.926795754], 0, 38.38493013381958, 1638151185.334169], "version": 0.2, "tvm_version": "0.8.dev0"}
{"input": ["cuda -keys=cuda,gpu -max_num_threads=1024 -thread_warp_size=32", "dense_large_batch.gpu", [["TENSOR", [65536, 30522], "float32"], ["TENSOR", [30522, 1024], "float32"]], {}], "config": {"index": 2366360, "code_hash": null, "entity": [["tile_x", "sp", [-1, 1, 16, 1]], ["tile_y", "sp", [-1, 8, 16, 4]], ["tile_k", "sp", [-1, 1, 2]]]}, "result": [[1.3763512297499998], 0, 44.43788456916809, 1638151229.5068388], "version": 0.2, "tvm_version": "0.8.dev0"}
{"input": ["cuda -keys=cuda,gpu -max_num_threads=1024 -thread_warp_size=32", "dense_large_batch.gpu", [["TENSOR", [65536, 30522], "float32"], ["TENSOR", [30522, 1024], "float32"]], {}], "config": {"index": 378121, "code_hash": null, "entity": [["tile_x", "sp", [-1, 1, 16, 2]], ["tile_y", "sp", [-1, 16, 16, 2]], ["tile_k", "sp", [-1, 2, 1]]]}, "result": [[0.92675554475], 0, 38.27851915359497, 1638151267.5707965], "version": 0.2, "tvm_version": "0.8.dev0"}
{"input": ["cuda -keys=cuda,gpu -max_num_threads=1024 -thread_warp_size=32", "dense_large_batch.gpu", [["TENSOR", [65536, 30522], "float32"], ["TENSOR", [30522, 1024], "float32"]], {}], "config": {"index": 93223, "code_hash": null, "entity": [["tile_x", "sp", [-1, 2, 8, 2]], ["tile_y", "sp", [-1, 8, 8, 2]], ["tile_k", "sp", [-1, 1, 1]]]}, "result": [[0.7351881025], 0, 36.053502321243286, 1638151356.8565836], "version": 0.2, "tvm_version": "0.8.dev0"}
{"input": ["cuda -keys=cuda,gpu -max_num_threads=1024 -thread_warp_size=32", "dense_large_batch.gpu", [["TENSOR", [65536, 30522], "float32"], ["TENSOR", [30522, 1024], "float32"]], {}], "config": {"index": 370207, "code_hash": null, "entity": [["tile_x", "sp", [-1, 2, 8, 1]], ["tile_y", "sp", [-1, 8, 8, 2]], ["tile_k", "sp", [-1, 2, 1]]]}, "result": [[0.77214957175], 0, 36.149171590805054, 1638151593.2040844], "version": 0.2, "tvm_version": "0.8.dev0"}
{"input": ["cuda -keys=cuda,gpu -max_num_threads=1024 -thread_warp_size=32", "dense_large_batch.gpu", [["TENSOR", [65536, 30522], "float32"], ["TENSOR", [30522, 1024], "float32"]], {}], "config": {"index": 370208, "code_hash": null, "entity": [["tile_x", "sp", [-1, 4, 8, 1]], ["tile_y", "sp", [-1, 8, 8, 2]], ["tile_k", "sp", [-1, 2, 1]]]}, "result": [[0.56590574075], 0, 33.67480826377869, 1638151626.6014957], "version": 0.2, "tvm_version": "0.8.dev0"}
{"input": ["cuda -keys=cuda,gpu -max_num_threads=1024 -thread_warp_size=32", "dense_large_batch.gpu", [["TENSOR", [65536, 30522], "float32"], ["TENSOR", [30522, 1024], "float32"]], {}], "config": {"index": 92253, "code_hash": null, "entity": [["tile_x", "sp", [-1, 1, 8, 2]], ["tile_y", "sp", [-1, 4, 8, 2]], ["tile_k", "sp", [-1, 1, 1]]]}, "result": [[1.506658774], 0, 45.9518096446991, 1638151672.4322634], "version": 0.2, "tvm_version": "0.8.dev0"}
{"input": ["cuda -keys=cuda,gpu -max_num_threads=1024 -thread_warp_size=32", "dense_large_batch.gpu", [["TENSOR", [65536, 30522], "float32"], ["TENSOR", [30522, 1024], "float32"]], {}], "config": {"index": 92254, "code_hash": null, "entity": [["tile_x", "sp", [-1, 2, 8, 2]], ["tile_y", "sp", [-1, 4, 8, 2]], ["tile_k", "sp", [-1, 1, 1]]]}, "result": [[1.2024469745], 0, 42.21938681602478, 1638151714.4743798], "version": 0.2, "tvm_version": "0.8.dev0"}
{"input": ["cuda -keys=cuda,gpu -max_num_threads=1024 -thread_warp_size=32", "dense_large_batch.gpu", [["TENSOR", [65536, 30522], "float32"], ["TENSOR", [30522, 1024], "float32"]], {}], "config": {"index": 143461, "code_hash": null, "entity": [["tile_x", "sp", [-1, 2, 8, 1]], ["tile_y", "sp", [-1, 8, 8, 4]], ["tile_k", "sp", [-1, 1, 1]]]}, "result": [[1.0426873705], 0, 39.77446007728577, 1638151754.050627], "version": 0.2, "tvm_version": "0.8.dev0"}
{"input": ["cuda -keys=cuda,gpu -max_num_threads=1024 -thread_warp_size=32", "dense_large_batch.gpu", [["TENSOR", [65536, 30522], "float32"], ["TENSOR", [30522, 1024], "float32"]], {}], "config": {"index": 369239, "code_hash": null, "entity": [["tile_x", "sp", [-1, 4, 8, 1]], ["tile_y", "sp", [-1, 4, 8, 2]], ["tile_k", "sp", [-1, 2, 1]]]}, "result": [[0.870269301], 0, 38.16284251213074, 1638151792.0279648], "version": 0.2, "tvm_version": "0.8.dev0"}
{"input": ["cuda -keys=cuda,gpu -max_num_threads=1024 -thread_warp_size=32", "dense_large_batch.gpu", [["TENSOR", [65536, 30522], "float32"], ["TENSOR", [30522, 1024], "float32"]], {}], "config": {"index": 144430, "code_hash": null, "entity": [["tile_x", "sp", [-1, 2, 8, 1]], ["tile_y", "sp", [-1, 16, 8, 4]], ["tile_k", "sp", [-1, 1, 1]]]}, "result": [[1.0082672265], 0, 39.378342390060425, 1638151831.1429036], "version": 0.2, "tvm_version": "0.8.dev0"}
{"input": ["cuda -keys=cuda,gpu -max_num_threads=1024 -thread_warp_size=32", "dense_large_batch.gpu", [["TENSOR", [65536, 30522], "float32"], ["TENSOR", [30522, 1024], "float32"]], {}], "config": {"index": 143460, "code_hash": null, "entity": [["tile_x", "sp", [-1, 1, 8, 1]], ["tile_y", "sp", [-1, 8, 8, 4]], ["tile_k", "sp", [-1, 1, 1]]]}, "result": [[1.92222401425], 0, 51.20830011367798, 1638151882.1906805], "version": 0.2, "tvm_version": "0.8.dev0"}
{"input": ["cuda -keys=cuda,gpu -max_num_threads=1024 -thread_warp_size=32", "dense_large_batch.gpu", [["TENSOR", [65536, 30522], "float32"], ["TENSOR", [30522, 1024], "float32"]], {}], "config": {"index": 309309, "code_hash": null, "entity": [["tile_x", "sp", [-1, 1, 8, 2]], ["tile_y", "sp", [-1, 8, 8, 1]], ["tile_k", "sp", [-1, 2, 1]]]}, "result": [[1.1621975359999999], 0, 41.24893546104431, 1638151923.2857552], "version": 0.2, "tvm_version": "0.8.dev0"}
{"input": ["cuda -keys=cuda,gpu -max_num_threads=1024 -thread_warp_size=32", "dense_large_batch.gpu", [["TENSOR", [65536, 30522], "float32"], ["TENSOR", [30522, 1024], "float32"]], {}], "config": {"index": 2317090, "code_hash": null, "entity": [["tile_x", "sp", [-1, 1, 16, 2]], ["tile_y", "sp", [-1, 8, 16, 2]], ["tile_k", "sp", [-1, 1, 2]]]}, "result": [[0.66172286825], 0, 34.85479784011841, 1638151957.9621634], "version": 0.2, "tvm_version": "0.8.dev0"}
{"input": ["cuda -keys=cuda,gpu -max_num_threads=1024 -thread_warp_size=32", "dense_large_batch.gpu", [["TENSOR", [65536, 30522], "float32"], ["TENSOR", [30522, 1024], "float32"]], {}], "config": {"index": 2364422, "code_hash": null, "entity": [["tile_x", "sp", [-1, 1, 16, 1]], ["tile_y", "sp", [-1, 2, 16, 4]], ["tile_k", "sp", [-1, 1, 2]]]}, "result": [[1.2573954387500001], 0, 42.67064833641052, 1638152000.4893966], "version": 0.2, "tvm_version": "0.8.dev0"}
{"input": ["cuda -keys=cuda,gpu -max_num_threads=1024 -thread_warp_size=32", "dense_large_batch.gpu", [["TENSOR", [65536, 30522], "float32"], ["TENSOR", [30522, 1024], "float32"]], {}], "config": {"index": 2365391, "code_hash": null, "entity": [["tile_x", "sp", [-1, 1, 16, 1]], ["tile_y", "sp", [-1, 4, 16, 4]], ["tile_k", "sp", [-1, 1, 2]]]}, "result": [[0.8373751287500001], 0, 37.27946496009827, 1638152037.5998037], "version": 0.2, "tvm_version": "0.8.dev0"}
{"input": ["cuda -keys=cuda,gpu -max_num_threads=1024 -thread_warp_size=32", "dense_large_batch.gpu", [["TENSOR", [65536, 30522], "float32"], ["TENSOR", [30522, 1024], "float32"]], {}], "config": {"index": 77689, "code_hash": null, "entity": [["tile_x", "sp", [-1, 1, 2, 2]], ["tile_y", "sp", [-1, 16, 2, 2]], ["tile_k", "sp", [-1, 1, 1]]]}, "result": [[8.82210453175], 0, 140.92594838142395, 1638152178.3760836], "version": 0.2, "tvm_version": "0.8.dev0"}
{"input": ["cuda -keys=cuda,gpu -max_num_threads=1024 -thread_warp_size=32", "dense_large_batch.gpu", [["TENSOR", [65536, 30522], "float32"], ["TENSOR", [30522, 1024], "float32"]], {}], "config": {"index": 424484, "code_hash": null, "entity": [["tile_x", "sp", [-1, 1, 16, 1]], ["tile_y", "sp", [-1, 2, 16, 4]], ["tile_k", "sp", [-1, 2, 1]]]}, "result": [[1.2570457497499998], 0, 42.64748215675354, 1638152220.9928427], "version": 0.2, "tvm_version": "0.8.dev0"}
{"input": ["cuda -keys=cuda,gpu -max_num_threads=1024 -thread_warp_size=32", "dense_large_batch.gpu", [["TENSOR", [65536, 30522], "float32"], ["TENSOR", [30522, 1024], "float32"]], {}], "config": {"index": 425453, "code_hash": null, "entity": [["tile_x", "sp", [-1, 1, 16, 1]], ["tile_y", "sp", [-1, 4, 16, 4]], ["tile_k", "sp", [-1, 2, 1]]]}, "result": [[0.8372527897500001], 0, 36.9962420463562, 1638152257.8269947], "version": 0.2, "tvm_version": "0.8.dev0"}
{"input": ["cuda -keys=cuda,gpu -max_num_threads=1024 -thread_warp_size=32", "dense_large_batch.gpu", [["TENSOR", [65536, 30522], "float32"], ["TENSOR", [30522, 1024], "float32"]], {}], "config": {"index": 426422, "code_hash": null, "entity": [["tile_x", "sp", [-1, 1, 16, 1]], ["tile_y", "sp", [-1, 8, 16, 4]], ["tile_k", "sp", [-1, 2, 1]]]}, "result": [[1.37384523175], 0, 44.042192459106445, 1638152301.6810653], "version": 0.2, "tvm_version": "0.8.dev0"}
{"input": ["cuda -keys=cuda,gpu -max_num_threads=1024 -thread_warp_size=32", "dense_large_batch.gpu", [["TENSOR", [65536, 30522], "float32"], ["TENSOR", [30522, 1024], "float32"]], {}], "config": {"index": 427391, "code_hash": null, "entity": [["tile_x", "sp", [-1, 1, 16, 1]], ["tile_y", "sp", [-1, 16, 16, 4]], ["tile_k", "sp", [-1, 2, 1]]]}, "result": [[1.523666467], 0, 46.1040358543396, 1638152347.6213727], "version": 0.2, "tvm_version": "0.8.dev0"}
{"input": ["cuda -keys=cuda,gpu -max_num_threads=1024 -thread_warp_size=32", "dense_large_batch.gpu", [["TENSOR", [65536, 30522], "float32"], ["TENSOR", [30522, 1024], "float32"]], {}], "config": {"index": 2534966, "code_hash": null, "entity": [["tile_x", "sp", [-1, 1, 16, 1]], ["tile_y", "sp", [-1, 16, 16, 1]], ["tile_k", "sp", [-1, 3, 2]]]}, "result": [[0.9186521555], 0, 38.12129473686218, 1638152387.4091733], "version": 0.2, "tvm_version": "0.8.dev0"}
{"input": ["cuda -keys=cuda,gpu -max_num_threads=1024 -thread_warp_size=32", "dense_large_batch.gpu", [["TENSOR", [65536, 30522], "float32"], ["TENSOR", [30522, 1024], "float32"]], {}], "config": {"index": 312217, "code_hash": null, "entity": [["tile_x", "sp", [-1, 2, 8, 2]], ["tile_y", "sp", [-1, 64, 8, 1]], ["tile_k", "sp", [-1, 2, 1]]]}, "result": [[4.284417923], 0, 82.82901954650879, 1638152469.4955401], "version": 0.2, "tvm_version": "0.8.dev0"}
{"input": ["cuda -keys=cuda,gpu -max_num_threads=1024 -thread_warp_size=32", "dense_large_batch.gpu", [["TENSOR", [65536, 30522], "float32"], ["TENSOR", [30522, 1024], "float32"]], {}], "config": {"index": 653169, "code_hash": null, "entity": [["tile_x", "sp", [-1, 2, 16, 1]], ["tile_y", "sp", [-1, 4, 16, 2]], ["tile_k", "sp", [-1, 3, 1]]]}, "result": [[0.7250820615], 0, 35.5423641204834, 1638152505.3022838], "version": 0.2, "tvm_version": "0.8.dev0"}
{"input": ["cuda -keys=cuda,gpu -max_num_threads=1024 -thread_warp_size=32", "dense_large_batch.gpu", [["TENSOR", [65536, 30522], "float32"], ["TENSOR", [30522, 1024], "float32"]], {}], "config": {"index": 594208, "code_hash": null, "entity": [["tile_x", "sp", [-1, 1, 16, 2]], ["tile_y", "sp", [-1, 8, 16, 1]], ["tile_k", "sp", [-1, 3, 1]]]}, "result": [[0.830288393], 0, 36.995408058166504, 1638152542.131872], "version": 0.2, "tvm_version": "0.8.dev0"}
{"input": ["cuda -keys=cuda,gpu -max_num_threads=1024 -thread_warp_size=32", "dense_large_batch.gpu", [["TENSOR", [65536, 30522], "float32"], ["TENSOR", [30522, 1024], "float32"]], {}], "config": {"index": 653168, "code_hash": null, "entity": [["tile_x", "sp", [-1, 1, 16, 1]], ["tile_y", "sp", [-1, 4, 16, 2]], ["tile_k", "sp", [-1, 3, 1]]]}, "result": [[0.92039943825], 0, 38.08431434631348, 1638152780.6482582], "version": 0.2, "tvm_version": "0.8.dev0"}
{"input": ["cuda -keys=cuda,gpu -max_num_threads=1024 -thread_warp_size=32", "dense_large_batch.gpu", [["TENSOR", [65536, 30522], "float32"], ["TENSOR", [30522, 1024], "float32"]], {}], "config": {"index": 871193, "code_hash": null, "entity": [["tile_x", "sp", [-1, 1, 16, 1]], ["tile_y", "sp", [-1, 8, 16, 1]], ["tile_k", "sp", [-1, 6, 1]]]}, "result": [[1.019475827], 0, 39.575413942337036, 1638152820.0693476], "version": 0.2, "tvm_version": "0.8.dev0"}
{"input": ["cuda -keys=cuda,gpu -max_num_threads=1024 -thread_warp_size=32", "dense_large_batch.gpu", [["TENSOR", [65536, 30522], "float32"], ["TENSOR", [30522, 1024], "float32"]], {}], "config": {"index": 595177, "code_hash": null, "entity": [["tile_x", "sp", [-1, 1, 16, 2]], ["tile_y", "sp", [-1, 16, 16, 1]], ["tile_k", "sp", [-1, 3, 1]]]}, "result": [[0.649421116], 0, 34.69013833999634, 1638152856.3848298], "version": 0.2, "tvm_version": "0.8.dev0"}
{"input": ["cuda -keys=cuda,gpu -max_num_threads=1024 -thread_warp_size=32", "dense_large_batch.gpu", [["TENSOR", [65536, 30522], "float32"], ["TENSOR", [30522, 1024], "float32"]], {}], "config": {"index": 354823, "code_hash": null, "entity": [["tile_x", "sp", [-1, 1, 2, 2]], ["tile_y", "sp", [-1, 16, 2, 2]], ["tile_k", "sp", [-1, 2, 1]]]}, "result": [[6.95479008875], 0, 117.00933814048767, 1638152973.1635234], "version": 0.2, "tvm_version": "0.8.dev0"}
{"input": ["cuda -keys=cuda,gpu -max_num_threads=1024 -thread_warp_size=32", "dense_large_batch.gpu", [["TENSOR", [65536, 30522], "float32"], ["TENSOR", [30522, 1024], "float32"]], {}], "config": {"index": 2535935, "code_hash": null, "entity": [["tile_x", "sp", [-1, 1, 16, 1]], ["tile_y", "sp", [-1, 32, 16, 1]], ["tile_k", "sp", [-1, 3, 2]]]}, "result": [[0.94019734625], 0, 38.756407737731934, 1638153011.659754], "version": 0.2, "tvm_version": "0.8.dev0"}
{"input": ["cuda -keys=cuda,gpu -max_num_threads=1024 -thread_warp_size=32", "dense_large_batch.gpu", [["TENSOR", [65536, 30522], "float32"], ["TENSOR", [30522, 1024], "float32"]], {}], "config": {"index": 3643502, "code_hash": null, "entity": [["tile_x", "sp", [-1, 1, 16, 1]], ["tile_y", "sp", [-1, 16, 16, 1]], ["tile_k", "sp", [-1, 2, 3]]]}, "result": [[0.92034119825], 0, 38.142890214920044, 1638153049.61705], "version": 0.2, "tvm_version": "0.8.dev0"}
{"input": ["cuda -keys=cuda,gpu -max_num_threads=1024 -thread_warp_size=32", "dense_large_batch.gpu", [["TENSOR", [65536, 30522], "float32"], ["TENSOR", [30522, 1024], "float32"]], {}], "config": {"index": 3642533, "code_hash": null, "entity": [["tile_x", "sp", [-1, 1, 16, 1]], ["tile_y", "sp", [-1, 8, 16, 1]], ["tile_k", "sp", [-1, 2, 3]]]}, "result": [[1.0198562745], 0, 39.47466325759888, 1638153088.9309502], "version": 0.2, "tvm_version": "0.8.dev0"}
{"input": ["cuda -keys=cuda,gpu -max_num_threads=1024 -thread_warp_size=32", "dense_large_batch.gpu", [["TENSOR", [65536, 30522], "float32"], ["TENSOR", [30522, 1024], "float32"]], {}], "config": {"index": 569941, "code_hash": null, "entity": [["tile_x", "sp", [-1, 1, 2, 2]], ["tile_y", "sp", [-1, 32, 2, 1]], ["tile_k", "sp", [-1, 3, 1]]]}, "result": [[7.2249477015000005], 0, 120.26577377319336, 1638153208.9538362], "version": 0.2, "tvm_version": "0.8.dev0"}
{"input": ["cuda -keys=cuda,gpu -max_num_threads=1024 -thread_warp_size=32", "dense_large_batch.gpu", [["TENSOR", [65536, 30522], "float32"], ["TENSOR", [30522, 1024], "float32"]], {}], "config": {"index": 2312083, "code_hash": null, "entity": [["tile_x", "sp", [-1, 2, 8, 1]], ["tile_y", "sp", [-1, 32, 8, 2]], ["tile_k", "sp", [-1, 1, 2]]]}, "result": [[0.86207479025], 0, 37.69562649726868, 1638153246.3455195], "version": 0.2, "tvm_version": "0.8.dev0"}
{"input": ["cuda -keys=cuda,gpu -max_num_threads=1024 -thread_warp_size=32", "dense_large_batch.gpu", [["TENSOR", [65536, 30522], "float32"], ["TENSOR", [30522, 1024], "float32"]], {}], "config": {"index": 2311114, "code_hash": null, "entity": [["tile_x", "sp", [-1, 2, 8, 1]], ["tile_y", "sp", [-1, 16, 8, 2]], ["tile_k", "sp", [-1, 1, 2]]]}, "result": [[0.8626139425], 0, 37.6242995262146, 1638153484.1960204], "version": 0.2, "tvm_version": "0.8.dev0"}
{"input": ["cuda -keys=cuda,gpu -max_num_threads=1024 -thread_warp_size=32", "dense_large_batch.gpu", [["TENSOR", [65536, 30522], "float32"], ["TENSOR", [30522, 1024], "float32"]], {}], "config": {"index": 3424509, "code_hash": null, "entity": [["tile_x", "sp", [-1, 2, 16, 1]], ["tile_y", "sp", [-1, 4, 16, 2]], ["tile_k", "sp", [-1, 1, 3]]]}, "result": [[0.7242848275], 0, 35.55994749069214, 1638153519.6465328], "version": 0.2, "tvm_version": "0.8.dev0"}
{"input": ["cuda -keys=cuda,gpu -max_num_threads=1024 -thread_warp_size=32", "dense_large_batch.gpu", [["TENSOR", [65536, 30522], "float32"], ["TENSOR", [30522, 1024], "float32"]], {}], "config": {"index": 376183, "code_hash": null, "entity": [["tile_x", "sp", [-1, 1, 16, 2]], ["tile_y", "sp", [-1, 4, 16, 2]], ["tile_k", "sp", [-1, 2, 1]]]}, "result": [[0.95519549975], 0, 38.57915997505188, 1638153613.1437643], "version": 0.2, "tvm_version": "0.8.dev0"}
{"input": ["cuda -keys=cuda,gpu -max_num_threads=1024 -thread_warp_size=32", "dense_large_batch.gpu", [["TENSOR", [65536, 30522], "float32"], ["TENSOR", [30522, 1024], "float32"]], {}], "config": {"index": 3366517, "code_hash": null, "entity": [["tile_x", "sp", [-1, 1, 16, 2]], ["tile_y", "sp", [-1, 16, 16, 1]], ["tile_k", "sp", [-1, 1, 3]]]}, "result": [[0.64765569125], 0, 35.109164237976074, 1638153648.0770645], "version": 0.2, "tvm_version": "0.8.dev0"}
{"input": ["cuda -keys=cuda,gpu -max_num_threads=1024 -thread_warp_size=32", "dense_large_batch.gpu", [["TENSOR", [65536, 30522], "float32"], ["TENSOR", [30522, 1024], "float32"]], {}], "config": {"index": 595178, "code_hash": null, "entity": [["tile_x", "sp", [-1, 2, 16, 2]], ["tile_y", "sp", [-1, 16, 16, 1]], ["tile_k", "sp", [-1, 3, 1]]]}, "result": [[0.5093335987500001], 0, 33.03020524978638, 1638153680.8674195], "version": 0.2, "tvm_version": "0.8.dev0"}
{"input": ["cuda -keys=cuda,gpu -max_num_threads=1024 -thread_warp_size=32", "dense_large_batch.gpu", [["TENSOR", [65536, 30522], "float32"], ["TENSOR", [30522, 1024], "float32"]], {}], "config": {"index": 377152, "code_hash": null, "entity": [["tile_x", "sp", [-1, 1, 16, 2]], ["tile_y", "sp", [-1, 8, 16, 2]], ["tile_k", "sp", [-1, 2, 1]]]}, "result": [[0.66165993975], 0, 34.76261854171753, 1638153715.4295068], "version": 0.2, "tvm_version": "0.8.dev0"}
{"input": ["cuda -keys=cuda,gpu -max_num_threads=1024 -thread_warp_size=32", "dense_large_batch.gpu", [["TENSOR", [65536, 30522], "float32"], ["TENSOR", [30522, 1024], "float32"]], {}], "config": {"index": 310279, "code_hash": null, "entity": [["tile_x", "sp", [-1, 2, 8, 2]], ["tile_y", "sp", [-1, 16, 8, 1]], ["tile_k", "sp", [-1, 2, 1]]]}, "result": [[0.5956412795], 0, 33.985164642333984, 1638153749.1862886], "version": 0.2, "tvm_version": "0.8.dev0"}
{"input": ["cuda -keys=cuda,gpu -max_num_threads=1024 -thread_warp_size=32", "dense_large_batch.gpu", [["TENSOR", [65536, 30522], "float32"], ["TENSOR", [30522, 1024], "float32"]], {}], "config": {"index": 2316121, "code_hash": null, "entity": [["tile_x", "sp", [-1, 1, 16, 2]], ["tile_y", "sp", [-1, 4, 16, 2]], ["tile_k", "sp", [-1, 1, 2]]]}, "result": [[0.9549375415], 0, 38.43084669113159, 1638153787.4479415], "version": 0.2, "tvm_version": "0.8.dev0"}
{"input": ["cuda -keys=cuda,gpu -max_num_threads=1024 -thread_warp_size=32", "dense_large_batch.gpu", [["TENSOR", [65536, 30522], "float32"], ["TENSOR", [30522, 1024], "float32"]], {}], "config": {"index": 593239, "code_hash": null, "entity": [["tile_x", "sp", [-1, 1, 16, 2]], ["tile_y", "sp", [-1, 4, 16, 1]], ["tile_k", "sp", [-1, 3, 1]]]}, "result": [[1.13179576475], 0, 40.90277361869812, 1638153828.1871943], "version": 0.2, "tvm_version": "0.8.dev0"}
{"input": ["cuda -keys=cuda,gpu -max_num_threads=1024 -thread_warp_size=32", "dense_large_batch.gpu", [["TENSOR", [65536, 30522], "float32"], ["TENSOR", [30522, 1024], "float32"]], {}], "config": {"index": 2534967, "code_hash": null, "entity": [["tile_x", "sp", [-1, 2, 16, 1]], ["tile_y", "sp", [-1, 16, 16, 1]], ["tile_k", "sp", [-1, 3, 2]]]}, "result": [[0.56456228875], 0, 33.65830421447754, 1638153861.5930128], "version": 0.2, "tvm_version": "0.8.dev0"}
{"input": ["cuda -keys=cuda,gpu -max_num_threads=1024 -thread_warp_size=32", "dense_large_batch.gpu", [["TENSOR", [65536, 30522], "float32"], ["TENSOR", [30522, 1024], "float32"]], {}], "config": {"index": 2533998, "code_hash": null, "entity": [["tile_x", "sp", [-1, 2, 16, 1]], ["tile_y", "sp", [-1, 8, 16, 1]], ["tile_k", "sp", [-1, 3, 2]]]}, "result": [[0.6877158505], 0, 35.486698627471924, 1638153896.8414319], "version": 0.2, "tvm_version": "0.8.dev0"}
{"input": ["cuda -keys=cuda,gpu -max_num_threads=1024 -thread_warp_size=32", "dense_large_batch.gpu", [["TENSOR", [65536, 30522], "float32"], ["TENSOR", [30522, 1024], "float32"]], {}], "config": {"index": 594209, "code_hash": null, "entity": [["tile_x", "sp", [-1, 2, 16, 2]], ["tile_y", "sp", [-1, 8, 16, 1]], ["tile_k", "sp", [-1, 3, 1]]]}, "result": [[0.6322043495], 0, 34.746408462524414, 1638153931.3411195], "version": 0.2, "tvm_version": "0.8.dev0"}
{"input": ["cuda -keys=cuda,gpu -max_num_threads=1024 -thread_warp_size=32", "dense_large_batch.gpu", [["TENSOR", [65536, 30522], "float32"], ["TENSOR", [30522, 1024], "float32"]], {}], "config": {"index": 2365392, "code_hash": null, "entity": [["tile_x", "sp", [-1, 2, 16, 1]], ["tile_y", "sp", [-1, 4, 16, 4]], ["tile_k", "sp", [-1, 1, 2]]]}, "result": [[0.6532815675000001], 0, 34.64823293685913, 1638153965.8099663], "version": 0.2, "tvm_version": "0.8.dev0"}
{"input": ["cuda -keys=cuda,gpu -max_num_threads=1024 -thread_warp_size=32", "dense_large_batch.gpu", [["TENSOR", [65536, 30522], "float32"], ["TENSOR", [30522, 1024], "float32"]], {}], "config": {"index": 654138, "code_hash": null, "entity": [["tile_x", "sp", [-1, 2, 16, 1]], ["tile_y", "sp", [-1, 8, 16, 2]], ["tile_k", "sp", [-1, 3, 1]]]}, "result": [[0.580595097], 0, 34.029024600982666, 1638153999.5879667], "version": 0.2, "tvm_version": "0.8.dev0"}
{"input": ["cuda -keys=cuda,gpu -max_num_threads=1024 -thread_warp_size=32", "dense_large_batch.gpu", [["TENSOR", [65536, 30522], "float32"], ["TENSOR", [30522, 1024], "float32"]], {}], "config": {"index": 3366518, "code_hash": null, "entity": [["tile_x", "sp", [-1, 2, 16, 2]], ["tile_y", "sp", [-1, 16, 16, 1]], ["tile_k", "sp", [-1, 1, 3]]]}, "result": [[0.506506622], 0, 33.041754484176636, 1638154032.3599155], "version": 0.2, "tvm_version": "0.8.dev0"}
{"input": ["cuda -keys=cuda,gpu -max_num_threads=1024 -thread_warp_size=32", "dense_large_batch.gpu", [["TENSOR", [65536, 30522], "float32"], ["TENSOR", [30522, 1024], "float32"]], {}], "config": {"index": 3365548, "code_hash": null, "entity": [["tile_x", "sp", [-1, 1, 16, 2]], ["tile_y", "sp", [-1, 8, 16, 1]], ["tile_k", "sp", [-1, 1, 3]]]}, "result": [[0.83082196975], 0, 37.15379285812378, 1638154069.3388293], "version": 0.2, "tvm_version": "0.8.dev0"}
{"input": ["cuda -keys=cuda,gpu -max_num_threads=1024 -thread_warp_size=32", "dense_large_batch.gpu", [["TENSOR", [65536, 30522], "float32"], ["TENSOR", [30522, 1024], "float32"]], {}], "config": {"index": 871194, "code_hash": null, "entity": [["tile_x", "sp", [-1, 2, 16, 1]], ["tile_y", "sp", [-1, 8, 16, 1]], ["tile_k", "sp", [-1, 6, 1]]]}, "result": [[0.6870428265], 0, 35.24065899848938, 1638154104.3361716], "version": 0.2, "tvm_version": "0.8.dev0"}
{"input": ["cuda -keys=cuda,gpu -max_num_threads=1024 -thread_warp_size=32", "dense_large_batch.gpu", [["TENSOR", [65536, 30522], "float32"], ["TENSOR", [30522, 1024], "float32"]], {}], "config": {"index": 872163, "code_hash": null, "entity": [["tile_x", "sp", [-1, 2, 16, 1]], ["tile_y", "sp", [-1, 16, 16, 1]], ["tile_k", "sp", [-1, 6, 1]]]}, "result": [[0.56453792975], 0, 33.735990047454834, 1638154137.8013089], "version": 0.2, "tvm_version": "0.8.dev0"}
{"input": ["cuda -keys=cuda,gpu -max_num_threads=1024 -thread_warp_size=32", "dense_large_batch.gpu", [["TENSOR", [65536, 30522], "float32"], ["TENSOR", [30522, 1024], "float32"]], {}], "config": {"index": 587263, "code_hash": null, "entity": [["tile_x", "sp", [-1, 2, 8, 1]], ["tile_y", "sp", [-1, 16, 8, 1]], ["tile_k", "sp", [-1, 3, 1]]]}, "result": [[0.80181686025], 0, 36.752949476242065, 1638154174.2510154], "version": 0.2, "tvm_version": "0.8.dev0"}
{"input": ["cuda -keys=cuda,gpu -max_num_threads=1024 -thread_warp_size=32", "dense_large_batch.gpu", [["TENSOR", [65536, 30522], "float32"], ["TENSOR", [30522, 1024], "float32"]], {}], "config": {"index": 2310145, "code_hash": null, "entity": [["tile_x", "sp", [-1, 2, 8, 1]], ["tile_y", "sp", [-1, 8, 8, 2]], ["tile_k", "sp", [-1, 1, 2]]]}, "result": [[0.771638138], 0, 36.447710037231445, 1638154210.4894881], "version": 0.2, "tvm_version": "0.8.dev0"}
{"input": ["cuda -keys=cuda,gpu -max_num_threads=1024 -thread_warp_size=32", "dense_large_batch.gpu", [["TENSOR", [65536, 30522], "float32"], ["TENSOR", [30522, 1024], "float32"]], {}], "config": {"index": 3425478, "code_hash": null, "entity": [["tile_x", "sp", [-1, 2, 16, 1]], ["tile_y", "sp", [-1, 8, 16, 2]], ["tile_k", "sp", [-1, 1, 3]]]}, "result": [[0.5818141960000001], 0, 33.770102739334106, 1638154244.0342853], "version": 0.2, "tvm_version": "0.8.dev0"}
{"input": ["cuda -keys=cuda,gpu -max_num_threads=1024 -thread_warp_size=32", "dense_large_batch.gpu", [["TENSOR", [65536, 30522], "float32"], ["TENSOR", [30522, 1024], "float32"]], {}], "config": {"index": 653317, "code_hash": null, "entity": [["tile_x", "sp", [-1, 1, 16, 2]], ["tile_y", "sp", [-1, 4, 16, 2]], ["tile_k", "sp", [-1, 3, 1]]]}, "result": [[0.6973780997500001], 0, 35.417515993118286, 1638154279.2228677], "version": 0.2, "tvm_version": "0.8.dev0"}
{"input": ["cuda -keys=cuda,gpu -max_num_threads=1024 -thread_warp_size=32", "dense_large_batch.gpu", [["TENSOR", [65536, 30522], "float32"], ["TENSOR", [30522, 1024], "float32"]], {}], "config": {"index": 376184, "code_hash": null, "entity": [["tile_x", "sp", [-1, 2, 16, 2]], ["tile_y", "sp", [-1, 4, 16, 2]], ["tile_k", "sp", [-1, 2, 1]]]}, "result": [[0.6840906182500001], 0, 35.533655405044556, 1638154314.529204], "version": 0.2, "tvm_version": "0.8.dev0"}
{"input": ["cuda -keys=cuda,gpu -max_num_threads=1024 -thread_warp_size=32", "dense_large_batch.gpu", [["TENSOR", [65536, 30522], "float32"], ["TENSOR", [30522, 1024], "float32"]], {}], "config": {"index": 3424508, "code_hash": null, "entity": [["tile_x", "sp", [-1, 1, 16, 1]], ["tile_y", "sp", [-1, 4, 16, 2]], ["tile_k", "sp", [-1, 1, 3]]]}, "result": [[0.9190812785000001], 0, 38.13504123687744, 1638154352.5064125], "version": 0.2, "tvm_version": "0.8.dev0"}
{"input": ["cuda -keys=cuda,gpu -max_num_threads=1024 -thread_warp_size=32", "dense_large_batch.gpu", [["TENSOR", [65536, 30522], "float32"], ["TENSOR", [30522, 1024], "float32"]], {}], "config": {"index": 3643503, "code_hash": null, "entity": [["tile_x", "sp", [-1, 2, 16, 1]], ["tile_y", "sp", [-1, 16, 16, 1]], ["tile_k", "sp", [-1, 2, 3]]]}, "result": [[0.5650420279999999], 0, 33.49306273460388, 1638154385.753459], "version": 0.2, "tvm_version": "0.8.dev0"}
{"input": ["cuda -keys=cuda,gpu -max_num_threads=1024 -thread_warp_size=32", "dense_large_batch.gpu", [["TENSOR", [65536, 30522], "float32"], ["TENSOR", [30522, 1024], "float32"]], {}], "config": {"index": 2310146, "code_hash": null, "entity": [["tile_x", "sp", [-1, 4, 8, 1]], ["tile_y", "sp", [-1, 8, 8, 2]], ["tile_k", "sp", [-1, 1, 2]]]}, "result": [[0.56859135725], 0, 33.84928274154663, 1638154419.3280566], "version": 0.2, "tvm_version": "0.8.dev0"}
{"input": ["cuda -keys=cuda,gpu -max_num_threads=1024 -thread_warp_size=32", "dense_large_batch.gpu", [["TENSOR", [65536, 30522], "float32"], ["TENSOR", [30522, 1024], "float32"]], {}], "config": {"index": 425454, "code_hash": null, "entity": [["tile_x", "sp", [-1, 2, 16, 1]], ["tile_y", "sp", [-1, 4, 16, 4]], ["tile_k", "sp", [-1, 2, 1]]]}, "result": [[0.65364443975], 0, 34.76386094093323, 1638154455.2716677], "version": 0.2, "tvm_version": "0.8.dev0"}
{"input": ["cuda -keys=cuda,gpu -max_num_threads=1024 -thread_warp_size=32", "dense_large_batch.gpu", [["TENSOR", [65536, 30522], "float32"], ["TENSOR", [30522, 1024], "float32"]], {}], "config": {"index": 872162, "code_hash": null, "entity": [["tile_x", "sp", [-1, 1, 16, 1]], ["tile_y", "sp", [-1, 16, 16, 1]], ["tile_k", "sp", [-1, 6, 1]]]}, "result": [[0.9190101645], 0, 38.32334518432617, 1638154493.3983567], "version": 0.2, "tvm_version": "0.8.dev0"}
{"input": ["cuda -keys=cuda,gpu -max_num_threads=1024 -thread_warp_size=32", "dense_large_batch.gpu", [["TENSOR", [65536, 30522], "float32"], ["TENSOR", [30522, 1024], "float32"]], {}], "config": {"index": 647342, "code_hash": null, "entity": [["tile_x", "sp", [-1, 4, 8, 1]], ["tile_y", "sp", [-1, 8, 8, 2]], ["tile_k", "sp", [-1, 3, 1]]]}, "result": [[0.5307075845000001], 0, 35.05960559844971, 1638154528.1370494], "version": 0.2, "tvm_version": "0.8.dev0"}
{"input": ["cuda -keys=cuda,gpu -max_num_threads=1024 -thread_warp_size=32", "dense_large_batch.gpu", [["TENSOR", [65536, 30522], "float32"], ["TENSOR", [30522, 1024], "float32"]], {}], "config": {"index": 94192, "code_hash": null, "entity": [["tile_x", "sp", [-1, 2, 8, 2]], ["tile_y", "sp", [-1, 16, 8, 2]], ["tile_k", "sp", [-1, 1, 1]]]}, "result": [[0.79804236825], 0, 37.19391894340515, 1638154565.0797875], "version": 0.2, "tvm_version": "0.8.dev0"}
{"input": ["cuda -keys=cuda,gpu -max_num_threads=1024 -thread_warp_size=32", "dense_large_batch.gpu", [["TENSOR", [65536, 30522], "float32"], ["TENSOR", [30522, 1024], "float32"]], {}], "config": {"index": 870225, "code_hash": null, "entity": [["tile_x", "sp", [-1, 2, 16, 1]], ["tile_y", "sp", [-1, 4, 16, 1]], ["tile_k", "sp", [-1, 6, 1]]]}, "result": [[0.8695343835], 0, 37.35352396965027, 1638154602.2637744], "version": 0.2, "tvm_version": "0.8.dev0"}
{"input": ["cuda -keys=cuda,gpu -max_num_threads=1024 -thread_warp_size=32", "dense_large_batch.gpu", [["TENSOR", [65536, 30522], "float32"], ["TENSOR", [30522, 1024], "float32"]], {}], "config": {"index": 864547, "code_hash": null, "entity": [["tile_x", "sp", [-1, 2, 8, 2]], ["tile_y", "sp", [-1, 16, 8, 1]], ["tile_k", "sp", [-1, 6, 1]]]}, "result": [[0.5012554705], 0, 33.01466989517212, 1638154634.9981139], "version": 0.2, "tvm_version": "0.8.dev0"}
{"input": ["cuda -keys=cuda,gpu -max_num_threads=1024 -thread_warp_size=32", "dense_large_batch.gpu", [["TENSOR", [65536, 30522], "float32"], ["TENSOR", [30522, 1024], "float32"]], {}], "config": {"index": 654286, "code_hash": null, "entity": [["tile_x", "sp", [-1, 1, 16, 2]], ["tile_y", "sp", [-1, 8, 16, 2]], ["tile_k", "sp", [-1, 3, 1]]]}, "result": [[0.585796667], 0, 33.887003898620605, 1638154668.6521463], "version": 0.2, "tvm_version": "0.8.dev0"}
{"input": ["cuda -keys=cuda,gpu -max_num_threads=1024 -thread_warp_size=32", "dense_large_batch.gpu", [["TENSOR", [65536, 30522], "float32"], ["TENSOR", [30522, 1024], "float32"]], {}], "config": {"index": 371177, "code_hash": null, "entity": [["tile_x", "sp", [-1, 4, 8, 1]], ["tile_y", "sp", [-1, 16, 8, 2]], ["tile_k", "sp", [-1, 2, 1]]]}, "result": [[0.734442496], 0, 35.93251943588257, 1638154704.2876203], "version": 0.2, "tvm_version": "0.8.dev0"}
{"input": ["cuda -keys=cuda,gpu -max_num_threads=1024 -thread_warp_size=32", "dense_large_batch.gpu", [["TENSOR", [65536, 30522], "float32"], ["TENSOR", [30522, 1024], "float32"]], {}], "config": {"index": 587413, "code_hash": null, "entity": [["tile_x", "sp", [-1, 2, 8, 2]], ["tile_y", "sp", [-1, 16, 8, 1]], ["tile_k", "sp", [-1, 3, 1]]]}, "result": [[0.58361608], 0, 35.70950102806091, 1638154739.759206], "version": 0.2, "tvm_version": "0.8.dev0"}
{"input": ["cuda -keys=cuda,gpu -max_num_threads=1024 -thread_warp_size=32", "dense_large_batch.gpu", [["TENSOR", [65536, 30522], "float32"], ["TENSOR", [30522, 1024], "float32"]], {}], "config": {"index": 3425477, "code_hash": null, "entity": [["tile_x", "sp", [-1, 1, 16, 1]], ["tile_y", "sp", [-1, 8, 16, 2]], ["tile_k", "sp", [-1, 1, 3]]]}, "result": [[0.8688014037499999], 0, 37.46885323524475, 1638154777.057785], "version": 0.2, "tvm_version": "0.8.dev0"}
{"input": ["cuda -keys=cuda,gpu -max_num_threads=1024 -thread_warp_size=32", "dense_large_batch.gpu", [["TENSOR", [65536, 30522], "float32"], ["TENSOR", [30522, 1024], "float32"]], {}], "config": {"index": 586295, "code_hash": null, "entity": [["tile_x", "sp", [-1, 4, 8, 1]], ["tile_y", "sp", [-1, 8, 8, 1]], ["tile_k", "sp", [-1, 3, 1]]]}, "result": [[1.31863068725], 0, 43.44114065170288, 1638154820.2624557], "version": 0.2, "tvm_version": "0.8.dev0"}
{"input": ["cuda -keys=cuda,gpu -max_num_threads=1024 -thread_warp_size=32", "dense_large_batch.gpu", [["TENSOR", [65536, 30522], "float32"], ["TENSOR", [30522, 1024], "float32"]], {}], "config": {"index": 2533997, "code_hash": null, "entity": [["tile_x", "sp", [-1, 1, 16, 1]], ["tile_y", "sp", [-1, 8, 16, 1]], ["tile_k", "sp", [-1, 3, 2]]]}, "result": [[1.020122586], 0, 39.45910930633545, 1638154859.5421243], "version": 0.2, "tvm_version": "0.8.dev0"}
{"input": ["cuda -keys=cuda,gpu -max_num_threads=1024 -thread_warp_size=32", "dense_large_batch.gpu", [["TENSOR", [65536, 30522], "float32"], ["TENSOR", [30522, 1024], "float32"]], {}], "config": {"index": 654137, "code_hash": null, "entity": [["tile_x", "sp", [-1, 1, 16, 1]], ["tile_y", "sp", [-1, 8, 16, 2]], ["tile_k", "sp", [-1, 3, 1]]]}, "result": [[0.8709696189999999], 0, 37.50403141975403, 1638154896.8673155], "version": 0.2, "tvm_version": "0.8.dev0"}
{"input": ["cuda -keys=cuda,gpu -max_num_threads=1024 -thread_warp_size=32", "dense_large_batch.gpu", [["TENSOR", [65536, 30522], "float32"], ["TENSOR", [30522, 1024], "float32"]], {}], "config": {"index": 377153, "code_hash": null, "entity": [["tile_x", "sp", [-1, 2, 16, 2]], ["tile_y", "sp", [-1, 8, 16, 2]], ["tile_k", "sp", [-1, 2, 1]]]}, "result": [[0.53256588725], 0, 33.14767360687256, 1638154929.755533], "version": 0.2, "tvm_version": "0.8.dev0"}
{"input": ["cuda -keys=cuda,gpu -max_num_threads=1024 -thread_warp_size=32", "dense_large_batch.gpu", [["TENSOR", [65536, 30522], "float32"], ["TENSOR", [30522, 1024], "float32"]], {}], "config": {"index": 3642534, "code_hash": null, "entity": [["tile_x", "sp", [-1, 2, 16, 1]], ["tile_y", "sp", [-1, 8, 16, 1]], ["tile_k", "sp", [-1, 2, 3]]]}, "result": [[0.68895701175], 0, 35.034881830215454, 1638154964.593576], "version": 0.2, "tvm_version": "0.8.dev0"}
{"input": ["cuda -keys=cuda,gpu -max_num_threads=1024 -thread_warp_size=32", "dense_large_batch.gpu", [["TENSOR", [65536, 30522], "float32"], ["TENSOR", [30522, 1024], "float32"]], {}], "config": {"index": 3358603, "code_hash": null, "entity": [["tile_x", "sp", [-1, 2, 8, 1]], ["tile_y", "sp", [-1, 16, 8, 1]], ["tile_k", "sp", [-1, 1, 3]]]}, "result": [[0.8022075280000001], 0, 36.72068119049072, 1638155001.140059], "version": 0.2, "tvm_version": "0.8.dev0"}
{"input": ["cuda -keys=cuda,gpu -max_num_threads=1024 -thread_warp_size=32", "dense_large_batch.gpu", [["TENSOR", [65536, 30522], "float32"], ["TENSOR", [30522, 1024], "float32"]], {}], "config": {"index": 2250217, "code_hash": null, "entity": [["tile_x", "sp", [-1, 2, 8, 2]], ["tile_y", "sp", [-1, 16, 8, 1]], ["tile_k", "sp", [-1, 1, 2]]]}, "result": [[0.5956622939999999], 0, 34.020451068878174, 1638155034.9470398], "version": 0.2, "tvm_version": "0.8.dev0"}
{"input": ["cuda -keys=cuda,gpu -max_num_threads=1024 -thread_warp_size=32", "dense_large_batch.gpu", [["TENSOR", [65536, 30522], "float32"], ["TENSOR", [30522, 1024], "float32"]], {}], "config": {"index": 2316122, "code_hash": null, "entity": [["tile_x", "sp", [-1, 2, 16, 2]], ["tile_y", "sp", [-1, 4, 16, 2]], ["tile_k", "sp", [-1, 1, 2]]]}, "result": [[0.69143509975], 0, 35.34073042869568, 1638155070.1233366], "version": 0.2, "tvm_version": "0.8.dev0"}
{"input": ["cuda -keys=cuda,gpu -max_num_threads=1024 -thread_warp_size=32", "dense_large_batch.gpu", [["TENSOR", [65536, 30522], "float32"], ["TENSOR", [30522, 1024], "float32"]], {}], "config": {"index": 2527201, "code_hash": null, "entity": [["tile_x", "sp", [-1, 2, 8, 1]], ["tile_y", "sp", [-1, 16, 8, 1]], ["tile_k", "sp", [-1, 3, 2]]]}, "result": [[0.733786055], 0, 35.80623960494995, 1638155105.6922386], "version": 0.2, "tvm_version": "0.8.dev0"}
{"input": ["cuda -keys=cuda,gpu -max_num_threads=1024 -thread_warp_size=32", "dense_large_batch.gpu", [["TENSOR", [65536, 30522], "float32"], ["TENSOR", [30522, 1024], "float32"]], {}], "config": {"index": 2533029, "code_hash": null, "entity": [["tile_x", "sp", [-1, 2, 16, 1]], ["tile_y", "sp", [-1, 4, 16, 1]], ["tile_k", "sp", [-1, 3, 2]]]}, "result": [[0.87030446925], 0, 37.55635166168213, 1638155143.075281], "version": 0.2, "tvm_version": "0.8.dev0"}
{"input": ["cuda -keys=cuda,gpu -max_num_threads=1024 -thread_warp_size=32", "dense_large_batch.gpu", [["TENSOR", [65536, 30522], "float32"], ["TENSOR", [30522, 1024], "float32"]], {}], "config": {"index": 309310, "code_hash": null, "entity": [["tile_x", "sp", [-1, 2, 8, 2]], ["tile_y", "sp", [-1, 8, 8, 1]], ["tile_k", "sp", [-1, 2, 1]]]}, "result": [[0.88027989425], 0, 37.687779664993286, 1638155182.147784], "version": 0.2, "tvm_version": "0.8.dev0"}
{"input": ["cuda -keys=cuda,gpu -max_num_threads=1024 -thread_warp_size=32", "dense_large_batch.gpu", [["TENSOR", [65536, 30522], "float32"], ["TENSOR", [30522, 1024], "float32"]], {}], "config": {"index": 648311, "code_hash": null, "entity": [["tile_x", "sp", [-1, 4, 8, 1]], ["tile_y", "sp", [-1, 16, 8, 2]], ["tile_k", "sp", [-1, 3, 1]]]}, "result": [[0.51101814425], 0, 33.21538734436035, 1638155215.0176637], "version": 0.2, "tvm_version": "0.8.dev0"}
{"input": ["cuda -keys=cuda,gpu -max_num_threads=1024 -thread_warp_size=32", "dense_large_batch.gpu", [["TENSOR", [65536, 30522], "float32"], ["TENSOR", [30522, 1024], "float32"]], {}], "config": {"index": 648460, "code_hash": null, "entity": [["tile_x", "sp", [-1, 2, 8, 2]], ["tile_y", "sp", [-1, 16, 8, 2]], ["tile_k", "sp", [-1, 3, 1]]]}, "result": [[0.5042011882499999], 0, 33.29513931274414, 1638155247.9827802], "version": 0.2, "tvm_version": "0.8.dev0"}
{"input": ["cuda -keys=cuda,gpu -max_num_threads=1024 -thread_warp_size=32", "dense_large_batch.gpu", [["TENSOR", [65536, 30522], "float32"], ["TENSOR", [30522, 1024], "float32"]], {}], "config": {"index": 2258114, "code_hash": null, "entity": [["tile_x", "sp", [-1, 2, 16, 4]], ["tile_y", "sp", [-1, 16, 16, 1]], ["tile_k", "sp", [-1, 1, 2]]]}, "result": [[0.7825506455], 0, 36.57527995109558, 1638155284.31095], "version": 0.2, "tvm_version": "0.8.dev0"}
{"input": ["cuda -keys=cuda,gpu -max_num_threads=1024 -thread_warp_size=32", "dense_large_batch.gpu", [["TENSOR", [65536, 30522], "float32"], ["TENSOR", [30522, 1024], "float32"]], {}], "config": {"index": 2365393, "code_hash": null, "entity": [["tile_x", "sp", [-1, 4, 16, 1]], ["tile_y", "sp", [-1, 4, 16, 4]], ["tile_k", "sp", [-1, 1, 2]]]}, "result": [[0.529403672], 0, 33.046048641204834, 1638155317.1884758], "version": 0.2, "tvm_version": "0.8.dev0"}
{"input": ["cuda -keys=cuda,gpu -max_num_threads=1024 -thread_warp_size=32", "dense_large_batch.gpu", [["TENSOR", [65536, 30522], "float32"], ["TENSOR", [30522, 1024], "float32"]], {}], "config": {"index": 588232, "code_hash": null, "entity": [["tile_x", "sp", [-1, 2, 8, 1]], ["tile_y", "sp", [-1, 32, 8, 1]], ["tile_k", "sp", [-1, 3, 1]]]}, "result": [[0.751770162], 0, 36.21777677536011, 1638155353.1867537], "version": 0.2, "tvm_version": "0.8.dev0"}
{"input": ["cuda -keys=cuda,gpu -max_num_threads=1024 -thread_warp_size=32", "dense_large_batch.gpu", [["TENSOR", [65536, 30522], "float32"], ["TENSOR", [30522, 1024], "float32"]], {}], "config": {"index": 3426446, "code_hash": null, "entity": [["tile_x", "sp", [-1, 1, 16, 1]], ["tile_y", "sp", [-1, 16, 16, 2]], ["tile_k", "sp", [-1, 1, 3]]]}, "result": [[0.8213242884999999], 0, 36.90016031265259, 1638155389.9386582], "version": 0.2, "tvm_version": "0.8.dev0"}
{"input": ["cuda -keys=cuda,gpu -max_num_threads=1024 -thread_warp_size=32", "dense_large_batch.gpu", [["TENSOR", [65536, 30522], "float32"], ["TENSOR", [30522, 1024], "float32"]], {}], "config": {"index": 653318, "code_hash": null, "entity": [["tile_x", "sp", [-1, 2, 16, 2]], ["tile_y", "sp", [-1, 4, 16, 2]], ["tile_k", "sp", [-1, 3, 1]]]}, "result": [[0.620714369], 0, 34.210516691207886, 1638155423.9516745], "version": 0.2, "tvm_version": "0.8.dev0"}
{"input": ["cuda -keys=cuda,gpu -max_num_threads=1024 -thread_warp_size=32", "dense_large_batch.gpu", [["TENSOR", [65536, 30522], "float32"], ["TENSOR", [30522, 1024], "float32"]], {}], "config": {"index": 655255, "code_hash": null, "entity": [["tile_x", "sp", [-1, 1, 16, 2]], ["tile_y", "sp", [-1, 16, 16, 2]], ["tile_k", "sp", [-1, 3, 1]]]}, "result": [[0.62585675175], 0, 34.31880736351013, 1638155458.0240617], "version": 0.2, "tvm_version": "0.8.dev0"}
{"input": ["cuda -keys=cuda,gpu -max_num_threads=1024 -thread_warp_size=32", "dense_large_batch.gpu", [["TENSOR", [65536, 30522], "float32"], ["TENSOR", [30522, 1024], "float32"]], {}], "config": {"index": 655106, "code_hash": null, "entity": [["tile_x", "sp", [-1, 1, 16, 1]], ["tile_y", "sp", [-1, 16, 16, 2]], ["tile_k", "sp", [-1, 3, 1]]]}, "result": [[0.82141485675], 0, 37.78509020805359, 1638155495.6461818], "version": 0.2, "tvm_version": "0.8.dev0"}
{"input": ["cuda -keys=cuda,gpu -max_num_threads=1024 -thread_warp_size=32", "dense_large_batch.gpu", [["TENSOR", [65536, 30522], "float32"], ["TENSOR", [30522, 1024], "float32"]], {}], "config": {"index": 369238, "code_hash": null, "entity": [["tile_x", "sp", [-1, 2, 8, 1]], ["tile_y", "sp", [-1, 4, 8, 2]], ["tile_k", "sp", [-1, 2, 1]]]}, "result": [[1.053426283], 0, 39.793166399002075, 1638155535.2880666], "version": 0.2, "tvm_version": "0.8.dev0"}
{"input": ["cuda -keys=cuda,gpu -max_num_threads=1024 -thread_warp_size=32", "dense_large_batch.gpu", [["TENSOR", [65536, 30522], "float32"], ["TENSOR", [30522, 1024], "float32"]], {}], "config": {"index": 654287, "code_hash": null, "entity": [["tile_x", "sp", [-1, 2, 16, 2]], ["tile_y", "sp", [-1, 8, 16, 2]], ["tile_k", "sp", [-1, 3, 1]]]}, "result": [[0.48947813100000004], 0, 32.5832576751709, 1638155611.2543793], "version": 0.2, "tvm_version": "0.8.dev0"}
