artifacts/microbenchmark/tvm/autotvm/conv/conv2d_128_1008_42_42_168_1_1_1_SAME.log
{"input": ["cuda -keys=cuda,gpu -max_num_threads=1024 -thread_warp_size=32", "conv2d_nchw.cuda", [["TENSOR", [128, 1008, 42, 42], "float32"], ["TENSOR", [168, 1008, 1, 1], "float32"], 1, "SAME", 1, "float32"], {}], "config": {"index": 134226803, "code_hash": null, "entity": [["tile_f", "sp", [-1, 4, 6, 7]], ["tile_y", "sp", [-1, 3, 1, 1]], ["tile_x", "sp", [-1, 1, 42, 1]], ["tile_rc", "sp", [-1, 21]], ["tile_ry", "sp", [-1, 1]], ["tile_rx", "sp", [-1, 1]], ["auto_unroll_max_step", "ot", 0], ["unroll_explicit", "ot", 1]]}, "result": [[0.009795264], 0, 4.493237495422363, 1637714429.5056543], "version": 0.2, "tvm_version": "0.8.dev0"}
{"input": ["cuda -keys=cuda,gpu -max_num_threads=1024 -thread_warp_size=32", "conv2d_nchw.cuda", [["TENSOR", [128, 1008, 42, 42], "float32"], ["TENSOR", [168, 1008, 1, 1], "float32"], 1, "SAME", 1, "float32"], {}], "config": {"index": 83301129, "code_hash": null, "entity": [["tile_f", "sp", [-1, 21, 1, 1]], ["tile_y", "sp", [-1, 3, 1, 2]], ["tile_x", "sp", [-1, 1, 21, 2]], ["tile_rc", "sp", [-1, 4]], ["tile_ry", "sp", [-1, 1]], ["tile_rx", "sp", [-1, 1]], ["auto_unroll_max_step", "ot", 1500], ["unroll_explicit", "ot", 0]]}, "result": [[0.345502058], 0, 6.490460157394409, 1637714436.8716645], "version": 0.2, "tvm_version": "0.8.dev0"}
{"input": ["cuda -keys=cuda,gpu -max_num_threads=1024 -thread_warp_size=32", "conv2d_nchw.cuda", [["TENSOR", [128, 1008, 42, 42], "float32"], ["TENSOR", [168, 1008, 1, 1], "float32"], 1, "SAME", 1, "float32"], {}], "config": {"index": 138207695, "code_hash": null, "entity": [["tile_f", "sp", [-1, 168, 1, 1]], ["tile_y", "sp", [-1, 1, 1, 2]], ["tile_x", "sp", [-1, 3, 1, 2]], ["tile_rc", "sp", [-1, 36]], ["tile_ry", "sp", [-1, 1]], ["tile_rx", "sp", [-1, 1]], ["auto_unroll_max_step", "ot", 0], ["unroll_explicit", "ot", 1]]}, "result": [[20.52460509575], 0, 107.45308589935303, 1637714544.4661775], "version": 0.2, "tvm_version": "0.8.dev0"}
{"input": ["cuda -keys=cuda,gpu -max_num_threads=1024 -thread_warp_size=32", "conv2d_nchw.cuda", [["TENSOR", [128, 1008, 42, 42], "float32"], ["TENSOR", [168, 1008, 1, 1], "float32"], 1, "SAME", 1, "float32"], {}], "config": {"index": 83022376, "code_hash": null, "entity": [["tile_f", "sp", [-1, 7, 1, 24]], ["tile_y", "sp", [-1, 1, 2, 7]], ["tile_x", "sp", [-1, 6, 7, 1]], ["tile_rc", "sp", [-1, 4]], ["tile_ry", "sp", [-1, 1]], ["tile_rx", "sp", [-1, 1]], ["auto_unroll_max_step", "ot", 1500], ["unroll_explicit", "ot", 0]]}, "result": [[2.2338903447500003], 0, 16.83104944229126, 1637714560.5346425], "version": 0.2, "tvm_version": "0.8.dev0"}
{"input": ["cuda -keys=cuda,gpu -max_num_threads=1024 -thread_warp_size=32", "conv2d_nchw.cuda", [["TENSOR", [128, 1008, 42, 42], "float32"], ["TENSOR", [168, 1008, 1, 1], "float32"], 1, "SAME", 1, "float32"], {}], "config": {"index": 8661502, "code_hash": null, "entity": [["tile_f", "sp", [-1, 1, 12, 1]], ["tile_y", "sp", [-1, 1, 3, 14]], ["tile_x", "sp", [-1, 7, 1, 3]], ["tile_rc", "sp", [-1, 8]], ["tile_ry", "sp", [-1, 1]], ["tile_rx", "sp", [-1, 1]], ["auto_unroll_max_step", "ot", 0], ["unroll_explicit", "ot", 0]]}, "result": [[0.633147807], 0, 7.81540322303772, 1637714570.1084301], "version": 0.2, "tvm_version": "0.8.dev0"}
{"input": ["cuda -keys=cuda,gpu -max_num_threads=1024 -thread_warp_size=32", "conv2d_nchw.cuda", [["TENSOR", [128, 1008, 42, 42], "float32"], ["TENSOR", [168, 1008, 1, 1], "float32"], 1, "SAME", 1, "float32"], {}], "config": {"index": 136446454, "code_hash": null, "entity": [["tile_f", "sp", [-1, 6, 7, 1]], ["tile_y", "sp", [-1, 1, 1, 2]], ["tile_x", "sp", [-1, 21, 1, 1]], ["tile_rc", "sp", [-1, 28]], ["tile_ry", "sp", [-1, 1]], ["tile_rx", "sp", [-1, 1]], ["auto_unroll_max_step", "ot", 0], ["unroll_explicit", "ot", 1]]}, "result": [[0.0509790665], 0, 5.250324010848999, 1637714574.6790385], "version": 0.2, "tvm_version": "0.8.dev0"}
{"input": ["cuda -keys=cuda,gpu -max_num_threads=1024 -thread_warp_size=32", "conv2d_nchw.cuda", [["TENSOR", [128, 1008, 42, 42], "float32"], ["TENSOR", [168, 1008, 1, 1], "float32"], 1, "SAME", 1, "float32"], {}], "config": {"index": 123724493, "code_hash": null, "entity": [["tile_f", "sp", [-1, 56, 1, 1]], ["tile_y", "sp", [-1, 14, 3, 1]], ["tile_x", "sp", [-1, 2, 21, 1]], ["tile_rc", "sp", [-1, 6]], ["tile_ry", "sp", [-1, 1]], ["tile_rx", "sp", [-1, 1]], ["auto_unroll_max_step", "ot", 0], ["unroll_explicit", "ot", 1]]}, "result": [[0.49362657125], 0, 17.886701583862305, 1637714585.185579], "version": 0.2, "tvm_version": "0.8.dev0"}
{"input": ["cuda -keys=cuda,gpu -max_num_threads=1024 -thread_warp_size=32", "conv2d_nchw.cuda", [["TENSOR", [128, 1008, 42, 42], "float32"], ["TENSOR", [168, 1008, 1, 1], "float32"], 1, "SAME", 1, "float32"], {}], "config": {"index": 122086849, "code_hash": null, "entity": [["tile_f", "sp", [-1, 12, 7, 2]], ["tile_y", "sp", [-1, 7, 6, 1]], ["tile_x", "sp", [-1, 3, 2, 1]], ["tile_rc", "sp", [-1, 4]], ["tile_ry", "sp", [-1, 1]], ["tile_rx", "sp", [-1, 1]], ["auto_unroll_max_step", "ot", 0], ["unroll_explicit", "ot", 1]]}, "result": [[0.7744869637499999], 0, 9.666769027709961, 1637714595.4662666], "version": 0.2, "tvm_version": "0.8.dev0"}
{"input": ["cuda -keys=cuda,gpu -max_num_threads=1024 -thread_warp_size=32", "conv2d_nchw.cuda", [["TENSOR", [128, 1008, 42, 42], "float32"], ["TENSOR", [168, 1008, 1, 1], "float32"], 1, "SAME", 1, "float32"], {}], "config": {"index": 180347313, "code_hash": null, "entity": [["tile_f", "sp", [-1, 7, 3, 2]], ["tile_y", "sp", [-1, 2, 1, 1]], ["tile_x", "sp", [-1, 7, 1, 3]], ["tile_rc", "sp", [-1, 48]], ["tile_ry", "sp", [-1, 1]], ["tile_rx", "sp", [-1, 1]], ["auto_unroll_max_step", "ot", 512], ["unroll_explicit", "ot", 1]]}, "result": [[7.30122729325], 0, 42.78427863121033, 1637714639.5620522], "version": 0.2, "tvm_version": "0.8.dev0"}
{"input": ["cuda -keys=cuda,gpu -max_num_threads=1024 -thread_warp_size=32", "conv2d_nchw.cuda", [["TENSOR", [128, 1008, 42, 42], "float32"], ["TENSOR", [168, 1008, 1, 1], "float32"], 1, "SAME", 1, "float32"], {}], "config": {"index": 161985168, "code_hash": null, "entity": [["tile_f", "sp", [-1, 2, 2, 6]], ["tile_y", "sp", [-1, 1, 1, 2]], ["tile_x", "sp", [-1, 2, 1, 3]], ["tile_rc", "sp", [-1, 4]], ["tile_ry", "sp", [-1, 1]], ["tile_rx", "sp", [-1, 1]], ["auto_unroll_max_step", "ot", 512], ["unroll_explicit", "ot", 1]]}, "result": [[0.09757793225], 0, 5.044073581695557, 1637714645.5651236], "version": 0.2, "tvm_version": "0.8.dev0"}
{"input": ["cuda -keys=cuda,gpu -max_num_threads=1024 -thread_warp_size=32", "conv2d_nchw.cuda", [["TENSOR", [128, 1008, 42, 42], "float32"], ["TENSOR", [168, 1008, 1, 1], "float32"], 1, "SAME", 1, "float32"], {}], "config": {"index": 18731118, "code_hash": null, "entity": [["tile_f", "sp", [-1, 2, 4, 7]], ["tile_y", "sp", [-1, 7, 1, 3]], ["tile_x", "sp", [-1, 1, 7, 1]], ["tile_rc", "sp", [-1, 28]], ["tile_ry", "sp", [-1, 1]], ["tile_rx", "sp", [-1, 1]], ["auto_unroll_max_step", "ot", 0], ["unroll_explicit", "ot", 0]]}, "result": [[0.5567151895], 0, 7.28009557723999, 1637714653.1912105], "version": 0.2, "tvm_version": "0.8.dev0"}
{"input": ["cuda -keys=cuda,gpu -max_num_threads=1024 -thread_warp_size=32", "conv2d_nchw.cuda", [["TENSOR", [128, 1008, 42, 42], "float32"], ["TENSOR", [168, 1008, 1, 1], "float32"], 1, "SAME", 1, "float32"], {}], "config": {"index": 6818551, "code_hash": null, "entity": [["tile_f", "sp", [-1, 2, 2, 42]], ["tile_y", "sp", [-1, 1, 3, 14]], ["tile_x", "sp", [-1, 1, 3, 1]], ["tile_rc", "sp", [-1, 7]], ["tile_ry", "sp", [-1, 1]], ["tile_rx", "sp", [-1, 1]], ["auto_unroll_max_step", "ot", 0], ["unroll_explicit", "ot", 0]]}, "result": [[0.9523635385], 0, 9.144041538238525, 1637714663.4164286], "version": 0.2, "tvm_version": "0.8.dev0"}
{"input": ["cuda -keys=cuda,gpu -max_num_threads=1024 -thread_warp_size=32", "conv2d_nchw.cuda", [["TENSOR", [128, 1008, 42, 42], "float32"], ["TENSOR", [168, 1008, 1, 1], "float32"], 1, "SAME", 1, "float32"], {}], "config": {"index": 14481271, "code_hash": null, "entity": [["tile_f", "sp", [-1, 2, 2, 42]], ["tile_y", "sp", [-1, 14, 1, 1]], ["tile_x", "sp", [-1, 6, 1, 1]], ["tile_rc", "sp", [-1, 18]], ["tile_ry", "sp", [-1, 1]], ["tile_rx", "sp", [-1, 1]], ["auto_unroll_max_step", "ot", 0], ["unroll_explicit", "ot", 0]]}, "result": [[12.404955927249999], 0, 67.07786440849304, 1637714730.1662493], "version": 0.2, "tvm_version": "0.8.dev0"}
{"input": ["cuda -keys=cuda,gpu -max_num_threads=1024 -thread_warp_size=32", "conv2d_nchw.cuda", [["TENSOR", [128, 1008, 42, 42], "float32"], ["TENSOR", [168, 1008, 1, 1], "float32"], 1, "SAME", 1, "float32"], {}], "config": {"index": 177688004, "code_hash": null, "entity": [["tile_f", "sp", [-1, 6, 1, 1]], ["tile_y", "sp", [-1, 21, 2, 1]], ["tile_x", "sp", [-1, 1, 1, 3]], ["tile_rc", "sp", [-1, 36]], ["tile_ry", "sp", [-1, 1]], ["tile_rx", "sp", [-1, 1]], ["auto_unroll_max_step", "ot", 512], ["unroll_explicit", "ot", 1]]}, "result": [[3.2410227127500004], 0, 21.677863597869873, 1637714750.4843714], "version": 0.2, "tvm_version": "0.8.dev0"}
{"input": ["cuda -keys=cuda,gpu -max_num_threads=1024 -thread_warp_size=32", "conv2d_nchw.cuda", [["TENSOR", [128, 1008, 42, 42], "float32"], ["TENSOR", [168, 1008, 1, 1], "float32"], 1, "SAME", 1, "float32"], {}], "config": {"index": 144379679, "code_hash": null, "entity": [["tile_f", "sp", [-1, 2, 4, 3]], ["tile_y", "sp", [-1, 3, 1, 7]], ["tile_x", "sp", [-1, 3, 2, 1]], ["tile_rc", "sp", [-1, 72]], ["tile_ry", "sp", [-1, 1]], ["tile_rx", "sp", [-1, 1]], ["auto_unroll_max_step", "ot", 0], ["unroll_explicit", "ot", 1]]}, "result": [[1.03844349975], 0, 10.007071256637573, 1637714759.8670828], "version": 0.2, "tvm_version": "0.8.dev0"}
{"input": ["cuda -keys=cuda,gpu -max_num_threads=1024 -thread_warp_size=32", "conv2d_nchw.cuda", [["TENSOR", [128, 1008, 42, 42], "float32"], ["TENSOR", [168, 1008, 1, 1], "float32"], 1, "SAME", 1, "float32"], {}], "config": {"index": 142552490, "code_hash": null, "entity": [["tile_f", "sp", [-1, 4, 14, 3]], ["tile_y", "sp", [-1, 1, 1, 3]], ["tile_x", "sp", [-1, 1, 1, 7]], ["tile_rc", "sp", [-1, 56]], ["tile_ry", "sp", [-1, 1]], ["tile_rx", "sp", [-1, 1]], ["auto_unroll_max_step", "ot", 0], ["unroll_explicit", "ot", 1]]}, "result": [[0.1023095715], 0, 5.059870958328247, 1637714765.2101715], "version": 0.2, "tvm_version": "0.8.dev0"}
{"input": ["cuda -keys=cuda,gpu -max_num_threads=1024 -thread_warp_size=32", "conv2d_nchw.cuda", [["TENSOR", [128, 1008, 42, 42], "float32"], ["TENSOR", [168, 1008, 1, 1], "float32"], 1, "SAME", 1, "float32"], {}], "config": {"index": 14283630, "code_hash": null, "entity": [["tile_f", "sp", [-1, 1, 3, 2]], ["tile_y", "sp", [-1, 3, 1, 2]], ["tile_x", "sp", [-1, 1, 1, 14]], ["tile_rc", "sp", [-1, 16]], ["tile_ry", "sp", [-1, 1]], ["tile_rx", "sp", [-1, 1]], ["auto_unroll_max_step", "ot", 0], ["unroll_explicit", "ot", 0]]}, "result": [[0.2981992985], 0, 6.4130775928497314, 1637714771.860995], "version": 0.2, "tvm_version": "0.8.dev0"}
{"input": ["cuda -keys=cuda,gpu -max_num_threads=1024 -thread_warp_size=32", "conv2d_nchw.cuda", [["TENSOR", [128, 1008, 42, 42], "float32"], ["TENSOR", [168, 1008, 1, 1], "float32"], 1, "SAME", 1, "float32"], {}], "config": {"index": 19709585, "code_hash": null, "entity": [["tile_f", "sp", [-1, 2, 1, 3]], ["tile_y", "sp", [-1, 1, 21, 1]], ["tile_x", "sp", [-1, 3, 1, 1]], ["tile_rc", "sp", [-1, 36]], ["tile_ry", "sp", [-1, 1]], ["tile_rx", "sp", [-1, 1]], ["auto_unroll_max_step", "ot", 0], ["unroll_explicit", "ot", 0]]}, "result": [[0.07745819525], 0, 4.5177459716796875, 1637714786.6646447], "version": 0.2, "tvm_version": "0.8.dev0"}
{"input": ["cuda -keys=cuda,gpu -max_num_threads=1024 -thread_warp_size=32", "conv2d_nchw.cuda", [["TENSOR", [128, 1008, 42, 42], "float32"], ["TENSOR", [168, 1008, 1, 1], "float32"], 1, "SAME", 1, "float32"], {}], "config": {"index": 12727848, "code_hash": null, "entity": [["tile_f", "sp", [-1, 1, 14, 3]], ["tile_y", "sp", [-1, 21, 1, 2]], ["tile_x", "sp", [-1, 1, 1, 6]], ["tile_rc", "sp", [-1, 14]], ["tile_ry", "sp", [-1, 1]], ["tile_rx", "sp", [-1, 1]], ["auto_unroll_max_step", "ot", 0], ["unroll_explicit", "ot", 0]]}, "result": [[1.8596308577499998], 0, 14.260775566101074, 1637714800.3067105], "version": 0.2, "tvm_version": "0.8.dev0"}
{"input": ["cuda -keys=cuda,gpu -max_num_threads=1024 -thread_warp_size=32", "conv2d_nchw.cuda", [["TENSOR", [128, 1008, 42, 42], "float32"], ["TENSOR", [168, 1008, 1, 1], "float32"], 1, "SAME", 1, "float32"], {}], "config": {"index": 165358923, "code_hash": null, "entity": [["tile_f", "sp", [-1, 4, 1, 6]], ["tile_y", "sp", [-1, 7, 2, 1]], ["tile_x", "sp", [-1, 7, 2, 1]], ["tile_rc", "sp", [-1, 8]], ["tile_ry", "sp", [-1, 1]], ["tile_rx", "sp", [-1, 1]], ["auto_unroll_max_step", "ot", 512], ["unroll_explicit", "ot", 1]]}, "result": [[6.071083779249999], 0, 36.457026720047, 1637714834.7920325], "version": 0.2, "tvm_version": "0.8.dev0"}
{"input": ["cuda -keys=cuda,gpu -max_num_threads=1024 -thread_warp_size=32", "conv2d_nchw.cuda", [["TENSOR", [128, 1008, 42, 42], "float32"], ["TENSOR", [168, 1008, 1, 1], "float32"], 1, "SAME", 1, "float32"], {}], "config": {"index": 157657133, "code_hash": null, "entity": [["tile_f", "sp", [-1, 1, 56, 3]], ["tile_y", "sp", [-1, 21, 1, 1]], ["tile_x", "sp", [-1, 1, 7, 1]], ["tile_rc", "sp", [-1, 1]], ["tile_ry", "sp", [-1, 1]], ["tile_rx", "sp", [-1, 1]], ["auto_unroll_max_step", "ot", 512], ["unroll_explicit", "ot", 1]]}, "result": [[0.02473097783333333], 0, 4.452178955078125, 1637714839.0858414], "version": 0.2, "tvm_version": "0.8.dev0"}
{"input": ["cuda -keys=cuda,gpu -max_num_threads=1024 -thread_warp_size=32", "conv2d_nchw.cuda", [["TENSOR", [128, 1008, 42, 42], "float32"], ["TENSOR", [168, 1008, 1, 1], "float32"], 1, "SAME", 1, "float32"], {}], "config": {"index": 91126390, "code_hash": null, "entity": [["tile_f", "sp", [-1, 1, 2, 42]], ["tile_y", "sp", [-1, 1, 7, 2]], ["tile_x", "sp", [-1, 1, 7, 2]], ["tile_rc", "sp", [-1, 14]], ["tile_ry", "sp", [-1, 1]], ["tile_rx", "sp", [-1, 1]], ["auto_unroll_max_step", "ot", 1500], ["unroll_explicit", "ot", 0]]}, "result": [[0.032316937250000004], 0, 5.0134055614471436, 1637714843.8514876], "version": 0.2, "tvm_version": "0.8.dev0"}
{"input": ["cuda -keys=cuda,gpu -max_num_threads=1024 -thread_warp_size=32", "conv2d_nchw.cuda", [["TENSOR", [128, 1008, 42, 42], "float32"], ["TENSOR", [168, 1008, 1, 1], "float32"], 1, "SAME", 1, "float32"], {}], "config": {"index": 87503869, "code_hash": null, "entity": [["tile_f", "sp", [-1, 14, 3, 4]], ["tile_y", "sp", [-1, 7, 2, 3]], ["tile_x", "sp", [-1, 1, 1, 7]], ["tile_rc", "sp", [-1, 8]], ["tile_ry", "sp", [-1, 1]], ["tile_rx", "sp", [-1, 1]], ["auto_unroll_max_step", "ot", 1500], ["unroll_explicit", "ot", 0]]}, "result": [[4.1698718135], 0, 31.855599403381348, 1637714869.39109], "version": 0.2, "tvm_version": "0.8.dev0"}
{"input": ["cuda -keys=cuda,gpu -max_num_threads=1024 -thread_warp_size=32", "conv2d_nchw.cuda", [["TENSOR", [128, 1008, 42, 42], "float32"], ["TENSOR", [168, 1008, 1, 1], "float32"], 1, "SAME", 1, "float32"], {}], "config": {"index": 10359226, "code_hash": null, "entity": [["tile_f", "sp", [-1, 1, 3, 4]], ["tile_y", "sp", [-1, 1, 2, 7]], ["tile_x", "sp", [-1, 1, 1, 14]], ["tile_rc", "sp", [-1, 9]], ["tile_ry", "sp", [-1, 1]], ["tile_rx", "sp", [-1, 1]], ["auto_unroll_max_step", "ot", 0], ["unroll_explicit", "ot", 0]]}, "result": [[1.74997646725], 0, 13.500916719436646, 1637714882.369359], "version": 0.2, "tvm_version": "0.8.dev0"}
{"input": ["cuda -keys=cuda,gpu -max_num_threads=1024 -thread_warp_size=32", "conv2d_nchw.cuda", [["TENSOR", [128, 1008, 42, 42], "float32"], ["TENSOR", [168, 1008, 1, 1], "float32"], 1, "SAME", 1, "float32"], {}], "config": {"index": 204810799, "code_hash": null, "entity": [["tile_f", "sp", [-1, 3, 4, 7]], ["tile_y", "sp", [-1, 1, 7, 2]], ["tile_x", "sp", [-1, 1, 6, 1]], ["tile_rc", "sp", [-1, 8]], ["tile_ry", "sp", [-1, 1]], ["tile_rx", "sp", [-1, 1]], ["auto_unroll_max_step", "ot", 1500], ["unroll_explicit", "ot", 1]]}, "result": [[0.010364311999999999], 0, 4.553056955337524, 1637714886.5497346], "version": 0.2, "tvm_version": "0.8.dev0"}
{"input": ["cuda -keys=cuda,gpu -max_num_threads=1024 -thread_warp_size=32", "conv2d_nchw.cuda", [["TENSOR", [128, 1008, 42, 42], "float32"], ["TENSOR", [168, 1008, 1, 1], "float32"], 1, "SAME", 1, "float32"], {}], "config": {"index": 82411806, "code_hash": null, "entity": [["tile_f", "sp", [-1, 2, 1, 21]], ["tile_y", "sp", [-1, 1, 1, 1]], ["tile_x", "sp", [-1, 1, 6, 7]], ["tile_rc", "sp", [-1, 3]], ["tile_ry", "sp", [-1, 1]], ["tile_rx", "sp", [-1, 1]], ["auto_unroll_max_step", "ot", 1500], ["unroll_explicit", "ot", 0]]}, "result": [[0.213105884], 0, 5.731659173965454, 1637714891.8209183], "version": 0.2, "tvm_version": "0.8.dev0"}
{"input": ["cuda -keys=cuda,gpu -max_num_threads=1024 -thread_warp_size=32", "conv2d_nchw.cuda", [["TENSOR", [128, 1008, 42, 42], "float32"], ["TENSOR", [168, 1008, 1, 1], "float32"], 1, "SAME", 1, "float32"], {}], "config": {"index": 169094877, "code_hash": null, "entity": [["tile_f", "sp", [-1, 28, 2, 3]], ["tile_y", "sp", [-1, 2, 1, 3]], ["tile_x", "sp", [-1, 1, 1, 1]], ["tile_rc", "sp", [-1, 14]], ["tile_ry", "sp", [-1, 1]], ["tile_rx", "sp", [-1, 1]], ["auto_unroll_max_step", "ot", 512], ["unroll_explicit", "ot", 1]]}, "result": [[5.482027325], 0, 33.29413390159607, 1637714923.530955], "version": 0.2, "tvm_version": "0.8.dev0"}
{"input": ["cuda -keys=cuda,gpu -max_num_threads=1024 -thread_warp_size=32", "conv2d_nchw.cuda", [["TENSOR", [128, 1008, 42, 42], "float32"], ["TENSOR", [168, 1008, 1, 1], "float32"], 1, "SAME", 1, "float32"], {}], "config": {"index": 122286961, "code_hash": null, "entity": [["tile_f", "sp", [-1, 1, 6, 7]], ["tile_y", "sp", [-1, 3, 1, 1]], ["tile_x", "sp", [-1, 2, 7, 1]], ["tile_rc", "sp", [-1, 4]], ["tile_ry", "sp", [-1, 1]], ["tile_rx", "sp", [-1, 1]], ["auto_unroll_max_step", "ot", 0], ["unroll_explicit", "ot", 1]]}, "result": [[0.014094127363636366], 0, 4.360702753067017, 1637715006.3253877], "version": 0.2, "tvm_version": "0.8.dev0"}
{"input": ["cuda -keys=cuda,gpu -max_num_threads=1024 -thread_warp_size=32", "conv2d_nchw.cuda", [["TENSOR", [128, 1008, 42, 42], "float32"], ["TENSOR", [168, 1008, 1, 1], "float32"], 1, "SAME", 1, "float32"], {}], "config": {"index": 5274838, "code_hash": null, "entity": [["tile_f", "sp", [-1, 2, 3, 14]], ["tile_y", "sp", [-1, 1, 21, 2]], ["tile_x", "sp", [-1, 2, 1, 1]], ["tile_rc", "sp", [-1, 6]], ["tile_ry", "sp", [-1, 1]], ["tile_rx", "sp", [-1, 1]], ["auto_unroll_max_step", "ot", 0], ["unroll_explicit", "ot", 0]]}, "result": [[0.01281459075], 0, 4.377237558364868, 1637715010.3857582], "version": 0.2, "tvm_version": "0.8.dev0"}
{"input": ["cuda -keys=cuda,gpu -max_num_threads=1024 -thread_warp_size=32", "conv2d_nchw.cuda", [["TENSOR", [128, 1008, 42, 42], "float32"], ["TENSOR", [168, 1008, 1, 1], "float32"], 1, "SAME", 1, "float32"], {}], "config": {"index": 123239638, "code_hash": null, "entity": [["tile_f", "sp", [-1, 2, 3, 14]], ["tile_y", "sp", [-1, 1, 21, 2]], ["tile_x", "sp", [-1, 2, 1, 1]], ["tile_rc", "sp", [-1, 6]], ["tile_ry", "sp", [-1, 1]], ["tile_rx", "sp", [-1, 1]], ["auto_unroll_max_step", "ot", 0], ["unroll_explicit", "ot", 1]]}, "result": [[0.012438970333333334], 0, 4.254382848739624, 1637715014.2949991], "version": 0.2, "tvm_version": "0.8.dev0"}
{"input": ["cuda -keys=cuda,gpu -max_num_threads=1024 -thread_warp_size=32", "conv2d_nchw.cuda", [["TENSOR", [128, 1008, 42, 42], "float32"], ["TENSOR", [168, 1008, 1, 1], "float32"], 1, "SAME", 1, "float32"], {}], "config": {"index": 123239664, "code_hash": null, "entity": [["tile_f", "sp", [-1, 1, 3, 28]], ["tile_y", "sp", [-1, 1, 21, 2]], ["tile_x", "sp", [-1, 2, 1, 1]], ["tile_rc", "sp", [-1, 6]], ["tile_ry", "sp", [-1, 1]], ["tile_rx", "sp", [-1, 1]], ["auto_unroll_max_step", "ot", 0], ["unroll_explicit", "ot", 1]]}, "result": [[0.012109391555555555], 0, 4.361265182495117, 1637715018.344851], "version": 0.2, "tvm_version": "0.8.dev0"}
{"input": ["cuda -keys=cuda,gpu -max_num_threads=1024 -thread_warp_size=32", "conv2d_nchw.cuda", [["TENSOR", [128, 1008, 42, 42], "float32"], ["TENSOR", [168, 1008, 1, 1], "float32"], 1, "SAME", 1, "float32"], {}], "config": {"index": 5274864, "code_hash": null, "entity": [["tile_f", "sp", [-1, 1, 3, 28]], ["tile_y", "sp", [-1, 1, 21, 2]], ["tile_x", "sp", [-1, 2, 1, 1]], ["tile_rc", "sp", [-1, 6]], ["tile_ry", "sp", [-1, 1]], ["tile_rx", "sp", [-1, 1]], ["auto_unroll_max_step", "ot", 0], ["unroll_explicit", "ot", 0]]}, "result": [[0.012227954444444446], 0, 4.562492609024048, 1637715022.5728395], "version": 0.2, "tvm_version": "0.8.dev0"}
{"input": ["cuda -keys=cuda,gpu -max_num_threads=1024 -thread_warp_size=32", "conv2d_nchw.cuda", [["TENSOR", [128, 1008, 42, 42], "float32"], ["TENSOR", [168, 1008, 1, 1], "float32"], 1, "SAME", 1, "float32"], {}], "config": {"index": 3260422, "code_hash": null, "entity": [["tile_f", "sp", [-1, 1, 2, 12]], ["tile_y", "sp", [-1, 1, 3, 1]], ["tile_x", "sp", [-1, 1, 3, 2]], ["tile_rc", "sp", [-1, 3]], ["tile_ry", "sp", [-1, 1]], ["tile_rx", "sp", [-1, 1]], ["auto_unroll_max_step", "ot", 0], ["unroll_explicit", "ot", 0]]}, "result": [[0.0309878645], 0, 4.34958553314209, 1637715026.6195898], "version": 0.2, "tvm_version": "0.8.dev0"}
{"input": ["cuda -keys=cuda,gpu -max_num_threads=1024 -thread_warp_size=32", "conv2d_nchw.cuda", [["TENSOR", [128, 1008, 42, 42], "float32"], ["TENSOR", [168, 1008, 1, 1], "float32"], 1, "SAME", 1, "float32"], {}], "config": {"index": 121225222, "code_hash": null, "entity": [["tile_f", "sp", [-1, 1, 2, 12]], ["tile_y", "sp", [-1, 1, 3, 1]], ["tile_x", "sp", [-1, 1, 3, 2]], ["tile_rc", "sp", [-1, 3]], ["tile_ry", "sp", [-1, 1]], ["tile_rx", "sp", [-1, 1]], ["auto_unroll_max_step", "ot", 0], ["unroll_explicit", "ot", 1]]}, "result": [[0.032880480749999996], 0, 4.677289962768555, 1637715031.0347297], "version": 0.2, "tvm_version": "0.8.dev0"}
{"input": ["cuda -keys=cuda,gpu -max_num_threads=1024 -thread_warp_size=32", "conv2d_nchw.cuda", [["TENSOR", [128, 1008, 42, 42], "float32"], ["TENSOR", [168, 1008, 1, 1], "float32"], 1, "SAME", 1, "float32"], {}], "config": {"index": 2891793, "code_hash": null, "entity": [["tile_f", "sp", [-1, 1, 2, 14]], ["tile_y", "sp", [-1, 1, 3, 1]], ["tile_x", "sp", [-1, 2, 3, 1]], ["tile_rc", "sp", [-1, 3]], ["tile_ry", "sp", [-1, 1]], ["tile_rx", "sp", [-1, 1]], ["auto_unroll_max_step", "ot", 0], ["unroll_explicit", "ot", 0]]}, "result": [[0.0303901825], 0, 4.370903730392456, 1637715035.1797564], "version": 0.2, "tvm_version": "0.8.dev0"}
{"input": ["cuda -keys=cuda,gpu -max_num_threads=1024 -thread_warp_size=32", "conv2d_nchw.cuda", [["TENSOR", [128, 1008, 42, 42], "float32"], ["TENSOR", [168, 1008, 1, 1], "float32"], 1, "SAME", 1, "float32"], {}], "config": {"index": 120856593, "code_hash": null, "entity": [["tile_f", "sp", [-1, 1, 2, 14]], ["tile_y", "sp", [-1, 1, 3, 1]], ["tile_x", "sp", [-1, 2, 3, 1]], ["tile_rc", "sp", [-1, 3]], ["tile_ry", "sp", [-1, 1]], ["tile_rx", "sp", [-1, 1]], ["auto_unroll_max_step", "ot", 0], ["unroll_explicit", "ot", 1]]}, "result": [[0.0303853075], 0, 4.296702861785889, 1637715039.1701431], "version": 0.2, "tvm_version": "0.8.dev0"}
{"input": ["cuda -keys=cuda,gpu -max_num_threads=1024 -thread_warp_size=32", "conv2d_nchw.cuda", [["TENSOR", [128, 1008, 42, 42], "float32"], ["TENSOR", [168, 1008, 1, 1], "float32"], 1, "SAME", 1, "float32"], {}], "config": {"index": 121225233, "code_hash": null, "entity": [["tile_f", "sp", [-1, 1, 2, 14]], ["tile_y", "sp", [-1, 1, 3, 1]], ["tile_x", "sp", [-1, 1, 3, 2]], ["tile_rc", "sp", [-1, 3]], ["tile_ry", "sp", [-1, 1]], ["tile_rx", "sp", [-1, 1]], ["auto_unroll_max_step", "ot", 0], ["unroll_explicit", "ot", 1]]}, "result": [[0.030685797999999997], 0, 4.25289249420166, 1637715043.147905], "version": 0.2, "tvm_version": "0.8.dev0"}
{"input": ["cuda -keys=cuda,gpu -max_num_threads=1024 -thread_warp_size=32", "conv2d_nchw.cuda", [["TENSOR", [128, 1008, 42, 42], "float32"], ["TENSOR", [168, 1008, 1, 1], "float32"], 1, "SAME", 1, "float32"], {}], "config": {"index": 3260433, "code_hash": null, "entity": [["tile_f", "sp", [-1, 1, 2, 14]], ["tile_y", "sp", [-1, 1, 3, 1]], ["tile_x", "sp", [-1, 1, 3, 2]], ["tile_rc", "sp", [-1, 3]], ["tile_ry", "sp", [-1, 1]], ["tile_rx", "sp", [-1, 1]], ["auto_unroll_max_step", "ot", 0], ["unroll_explicit", "ot", 0]]}, "result": [[0.0307235965], 0, 4.165498971939087, 1637715047.0755193], "version": 0.2, "tvm_version": "0.8.dev0"}
{"input": ["cuda -keys=cuda,gpu -max_num_threads=1024 -thread_warp_size=32", "conv2d_nchw.cuda", [["TENSOR", [128, 1008, 42, 42], "float32"], ["TENSOR", [168, 1008, 1, 1], "float32"], 1, "SAME", 1, "float32"], {}], "config": {"index": 1600239, "code_hash": null, "entity": [["tile_f", "sp", [-1, 3, 4, 7]], ["tile_y", "sp", [-1, 1, 2, 1]], ["tile_x", "sp", [-1, 7, 3, 1]], ["tile_rc", "sp", [-1, 2]], ["tile_ry", "sp", [-1, 1]], ["tile_rx", "sp", [-1, 1]], ["auto_unroll_max_step", "ot", 0], ["unroll_explicit", "ot", 0]]}, "result": [[0.0140969125], 0, 4.401811122894287, 1637715051.1708927], "version": 0.2, "tvm_version": "0.8.dev0"}
{"input": ["cuda -keys=cuda,gpu -max_num_threads=1024 -thread_warp_size=32", "conv2d_nchw.cuda", [["TENSOR", [128, 1008, 42, 42], "float32"], ["TENSOR", [168, 1008, 1, 1], "float32"], 1, "SAME", 1, "float32"], {}], "config": {"index": 119565039, "code_hash": null, "entity": [["tile_f", "sp", [-1, 3, 4, 7]], ["tile_y", "sp", [-1, 1, 2, 1]], ["tile_x", "sp", [-1, 7, 3, 1]], ["tile_rc", "sp", [-1, 2]], ["tile_ry", "sp", [-1, 1]], ["tile_rx", "sp", [-1, 1]], ["auto_unroll_max_step", "ot", 0], ["unroll_explicit", "ot", 1]]}, "result": [[0.01422694575], 0, 4.351144075393677, 1637715055.1813693], "version": 0.2, "tvm_version": "0.8.dev0"}
{"input": ["cuda -keys=cuda,gpu -max_num_threads=1024 -thread_warp_size=32", "conv2d_nchw.cuda", [["TENSOR", [128, 1008, 42, 42], "float32"], ["TENSOR", [168, 1008, 1, 1], "float32"], 1, "SAME", 1, "float32"], {}], "config": {"index": 123256624, "code_hash": null, "entity": [["tile_f", "sp", [-1, 1, 3, 28]], ["tile_y", "sp", [-1, 1, 21, 1]], ["tile_x", "sp", [-1, 3, 1, 1]], ["tile_rc", "sp", [-1, 6]], ["tile_ry", "sp", [-1, 1]], ["tile_rx", "sp", [-1, 1]], ["auto_unroll_max_step", "ot", 0], ["unroll_explicit", "ot", 1]]}, "result": [[0.012245608666666666], 0, 4.350301265716553, 1637715059.2351196], "version": 0.2, "tvm_version": "0.8.dev0"}
{"input": ["cuda -keys=cuda,gpu -max_num_threads=1024 -thread_warp_size=32", "conv2d_nchw.cuda", [["TENSOR", [128, 1008, 42, 42], "float32"], ["TENSOR", [168, 1008, 1, 1], "float32"], 1, "SAME", 1, "float32"], {}], "config": {"index": 5291824, "code_hash": null, "entity": [["tile_f", "sp", [-1, 1, 3, 28]], ["tile_y", "sp", [-1, 1, 21, 1]], ["tile_x", "sp", [-1, 3, 1, 1]], ["tile_rc", "sp", [-1, 6]], ["tile_ry", "sp", [-1, 1]], ["tile_rx", "sp", [-1, 1]], ["auto_unroll_max_step", "ot", 0], ["unroll_explicit", "ot", 0]]}, "result": [[0.012267207888888888], 0, 4.2697343826293945, 1637715063.1890628], "version": 0.2, "tvm_version": "0.8.dev0"}
{"input": ["cuda -keys=cuda,gpu -max_num_threads=1024 -thread_warp_size=32", "conv2d_nchw.cuda", [["TENSOR", [128, 1008, 42, 42], "float32"], ["TENSOR", [168, 1008, 1, 1], "float32"], 1, "SAME", 1, "float32"], {}], "config": {"index": 119676328, "code_hash": null, "entity": [["tile_f", "sp", [-1, 1, 14, 3]], ["tile_y", "sp", [-1, 1, 1, 3]], ["tile_x", "sp", [-1, 2, 7, 1]], ["tile_rc", "sp", [-1, 2]], ["tile_ry", "sp", [-1, 1]], ["tile_rx", "sp", [-1, 1]], ["auto_unroll_max_step", "ot", 0], ["unroll_explicit", "ot", 1]]}, "result": [[0.014116311500000001], 0, 4.323540687561035, 1637715067.2479193], "version": 0.2, "tvm_version": "0.8.dev0"}
{"input": ["cuda -keys=cuda,gpu -max_num_threads=1024 -thread_warp_size=32", "conv2d_nchw.cuda", [["TENSOR", [128, 1008, 42, 42], "float32"], ["TENSOR", [168, 1008, 1, 1], "float32"], 1, "SAME", 1, "float32"], {}], "config": {"index": 1711528, "code_hash": null, "entity": [["tile_f", "sp", [-1, 1, 14, 3]], ["tile_y", "sp", [-1, 1, 1, 3]], ["tile_x", "sp", [-1, 2, 7, 1]], ["tile_rc", "sp", [-1, 2]], ["tile_ry", "sp", [-1, 1]], ["tile_rx", "sp", [-1, 1]], ["auto_unroll_max_step", "ot", 0], ["unroll_explicit", "ot", 0]]}, "result": [[0.0140495135], 0, 4.347874641418457, 1637715071.3434694], "version": 0.2, "tvm_version": "0.8.dev0"}
{"input": ["cuda -keys=cuda,gpu -max_num_threads=1024 -thread_warp_size=32", "conv2d_nchw.cuda", [["TENSOR", [128, 1008, 42, 42], "float32"], ["TENSOR", [168, 1008, 1, 1], "float32"], 1, "SAME", 1, "float32"], {}], "config": {"index": 2891812, "code_hash": null, "entity": [["tile_f", "sp", [-1, 1, 4, 21]], ["tile_y", "sp", [-1, 1, 3, 1]], ["tile_x", "sp", [-1, 2, 3, 1]], ["tile_rc", "sp", [-1, 3]], ["tile_ry", "sp", [-1, 1]], ["tile_rx", "sp", [-1, 1]], ["auto_unroll_max_step", "ot", 0], ["unroll_explicit", "ot", 0]]}, "result": [[0.02653887525], 0, 4.3508336544036865, 1637715075.4428399], "version": 0.2, "tvm_version": "0.8.dev0"}
{"input": ["cuda -keys=cuda,gpu -max_num_threads=1024 -thread_warp_size=32", "conv2d_nchw.cuda", [["TENSOR", [128, 1008, 42, 42], "float32"], ["TENSOR", [168, 1008, 1, 1], "float32"], 1, "SAME", 1, "float32"], {}], "config": {"index": 120856612, "code_hash": null, "entity": [["tile_f", "sp", [-1, 1, 4, 21]], ["tile_y", "sp", [-1, 1, 3, 1]], ["tile_x", "sp", [-1, 2, 3, 1]], ["tile_rc", "sp", [-1, 3]], ["tile_ry", "sp", [-1, 1]], ["tile_rx", "sp", [-1, 1]], ["auto_unroll_max_step", "ot", 0], ["unroll_explicit", "ot", 1]]}, "result": [[0.02646272725], 0, 4.272918224334717, 1637715079.435507], "version": 0.2, "tvm_version": "0.8.dev0"}
{"input": ["cuda -keys=cuda,gpu -max_num_threads=1024 -thread_warp_size=32", "conv2d_nchw.cuda", [["TENSOR", [128, 1008, 42, 42], "float32"], ["TENSOR", [168, 1008, 1, 1], "float32"], 1, "SAME", 1, "float32"], {}], "config": {"index": 199868422, "code_hash": null, "entity": [["tile_f", "sp", [-1, 1, 2, 12]], ["tile_y", "sp", [-1, 1, 3, 1]], ["tile_x", "sp", [-1, 1, 3, 2]], ["tile_rc", "sp", [-1, 3]], ["tile_ry", "sp", [-1, 1]], ["tile_rx", "sp", [-1, 1]], ["auto_unroll_max_step", "ot", 1500], ["unroll_explicit", "ot", 1]]}, "result": [[0.032946825500000006], 0, 4.370865345001221, 1637715083.5039277], "version": 0.2, "tvm_version": "0.8.dev0"}
{"input": ["cuda -keys=cuda,gpu -max_num_threads=1024 -thread_warp_size=32", "conv2d_nchw.cuda", [["TENSOR", [128, 1008, 42, 42], "float32"], ["TENSOR", [168, 1008, 1, 1], "float32"], 1, "SAME", 1, "float32"], {}], "config": {"index": 42582033, "code_hash": null, "entity": [["tile_f", "sp", [-1, 1, 2, 14]], ["tile_y", "sp", [-1, 1, 3, 1]], ["tile_x", "sp", [-1, 1, 3, 2]], ["tile_rc", "sp", [-1, 3]], ["tile_ry", "sp", [-1, 1]], ["tile_rx", "sp", [-1, 1]], ["auto_unroll_max_step", "ot", 512], ["unroll_explicit", "ot", 0]]}, "result": [[0.030579399], 0, 4.363428831100464, 1637715087.5670328], "version": 0.2, "tvm_version": "0.8.dev0"}
{"input": ["cuda -keys=cuda,gpu -max_num_threads=1024 -thread_warp_size=32", "conv2d_nchw.cuda", [["TENSOR", [128, 1008, 42, 42], "float32"], ["TENSOR", [168, 1008, 1, 1], "float32"], 1, "SAME", 1, "float32"], {}], "config": {"index": 199868433, "code_hash": null, "entity": [["tile_f", "sp", [-1, 1, 2, 14]], ["tile_y", "sp", [-1, 1, 3, 1]], ["tile_x", "sp", [-1, 1, 3, 2]], ["tile_rc", "sp", [-1, 3]], ["tile_ry", "sp", [-1, 1]], ["tile_rx", "sp", [-1, 1]], ["auto_unroll_max_step", "ot", 1500], ["unroll_explicit", "ot", 1]]}, "result": [[0.030763793], 0, 4.249585151672363, 1637715091.5928497], "version": 0.2, "tvm_version": "0.8.dev0"}
{"input": ["cuda -keys=cuda,gpu -max_num_threads=1024 -thread_warp_size=32", "conv2d_nchw.cuda", [["TENSOR", [128, 1008, 42, 42], "float32"], ["TENSOR", [168, 1008, 1, 1], "float32"], 1, "SAME", 1, "float32"], {}], "config": {"index": 81903633, "code_hash": null, "entity": [["tile_f", "sp", [-1, 1, 2, 14]], ["tile_y", "sp", [-1, 1, 3, 1]], ["tile_x", "sp", [-1, 1, 3, 2]], ["tile_rc", "sp", [-1, 3]], ["tile_ry", "sp", [-1, 1]], ["tile_rx", "sp", [-1, 1]], ["auto_unroll_max_step", "ot", 1500], ["unroll_explicit", "ot", 0]]}, "result": [[0.03058679825], 0, 4.269048690795898, 1637715095.5242946], "version": 0.2, "tvm_version": "0.8.dev0"}
{"input": ["cuda -keys=cuda,gpu -max_num_threads=1024 -thread_warp_size=32", "conv2d_nchw.cuda", [["TENSOR", [128, 1008, 42, 42], "float32"], ["TENSOR", [168, 1008, 1, 1], "float32"], 1, "SAME", 1, "float32"], {}], "config": {"index": 160546833, "code_hash": null, "entity": [["tile_f", "sp", [-1, 1, 2, 14]], ["tile_y", "sp", [-1, 1, 3, 1]], ["tile_x", "sp", [-1, 1, 3, 2]], ["tile_rc", "sp", [-1, 3]], ["tile_ry", "sp", [-1, 1]], ["tile_rx", "sp", [-1, 1]], ["auto_unroll_max_step", "ot", 512], ["unroll_explicit", "ot", 1]]}, "result": [[0.030793066499999997], 0, 4.326600551605225, 1637715099.5194066], "version": 0.2, "tvm_version": "0.8.dev0"}
{"input": ["cuda -keys=cuda,gpu -max_num_threads=1024 -thread_warp_size=32", "conv2d_nchw.cuda", [["TENSOR", [128, 1008, 42, 42], "float32"], ["TENSOR", [168, 1008, 1, 1], "float32"], 1, "SAME", 1, "float32"], {}], "config": {"index": 126393572, "code_hash": null, "entity": [["tile_f", "sp", [-1, 1, 4, 21]], ["tile_y", "sp", [-1, 1, 21, 2]], ["tile_x", "sp", [-1, 1, 1, 2]], ["tile_rc", "sp", [-1, 8]], ["tile_ry", "sp", [-1, 1]], ["tile_rx", "sp", [-1, 1]], ["auto_unroll_max_step", "ot", 0], ["unroll_explicit", "ot", 1]]}, "result": [[0.014170108875], 0, 4.267895698547363, 1637715104.5524678], "version": 0.2, "tvm_version": "0.8.dev0"}
{"input": ["cuda -keys=cuda,gpu -max_num_threads=1024 -thread_warp_size=32", "conv2d_nchw.cuda", [["TENSOR", [128, 1008, 42, 42], "float32"], ["TENSOR", [168, 1008, 1, 1], "float32"], 1, "SAME", 1, "float32"], {}], "config": {"index": 8428772, "code_hash": null, "entity": [["tile_f", "sp", [-1, 1, 4, 21]], ["tile_y", "sp", [-1, 1, 21, 2]], ["tile_x", "sp", [-1, 1, 1, 2]], ["tile_rc", "sp", [-1, 8]], ["tile_ry", "sp", [-1, 1]], ["tile_rx", "sp", [-1, 1]], ["auto_unroll_max_step", "ot", 0], ["unroll_explicit", "ot", 0]]}, "result": [[0.01413737225], 0, 4.200188875198364, 1637715108.4746296], "version": 0.2, "tvm_version": "0.8.dev0"}
{"input": ["cuda -keys=cuda,gpu -max_num_threads=1024 -thread_warp_size=32", "conv2d_nchw.cuda", [["TENSOR", [128, 1008, 42, 42], "float32"], ["TENSOR", [168, 1008, 1, 1], "float32"], 1, "SAME", 1, "float32"], {}], "config": {"index": 2419439, "code_hash": null, "entity": [["tile_f", "sp", [-1, 3, 4, 7]], ["tile_y", "sp", [-1, 1, 2, 1]], ["tile_x", "sp", [-1, 1, 3, 7]], ["tile_rc", "sp", [-1, 2]], ["tile_ry", "sp", [-1, 1]], ["tile_rx", "sp", [-1, 1]], ["auto_unroll_max_step", "ot", 0], ["unroll_explicit", "ot", 0]]}, "result": [[0.01447612057142857], 0, 4.418327569961548, 1637715112.5860043], "version": 0.2, "tvm_version": "0.8.dev0"}
{"input": ["cuda -keys=cuda,gpu -max_num_threads=1024 -thread_warp_size=32", "conv2d_nchw.cuda", [["TENSOR", [128, 1008, 42, 42], "float32"], ["TENSOR", [168, 1008, 1, 1], "float32"], 1, "SAME", 1, "float32"], {}], "config": {"index": 120384239, "code_hash": null, "entity": [["tile_f", "sp", [-1, 3, 4, 7]], ["tile_y", "sp", [-1, 1, 2, 1]], ["tile_x", "sp", [-1, 1, 3, 7]], ["tile_rc", "sp", [-1, 2]], ["tile_ry", "sp", [-1, 1]], ["tile_rx", "sp", [-1, 1]], ["auto_unroll_max_step", "ot", 0], ["unroll_explicit", "ot", 1]]}, "result": [[0.01446204942857143], 0, 4.306283235549927, 1637715116.559259], "version": 0.2, "tvm_version": "0.8.dev0"}
{"input": ["cuda -keys=cuda,gpu -max_num_threads=1024 -thread_warp_size=32", "conv2d_nchw.cuda", [["TENSOR", [128, 1008, 42, 42], "float32"], ["TENSOR", [168, 1008, 1, 1], "float32"], 1, "SAME", 1, "float32"], {}], "config": {"index": 198208239, "code_hash": null, "entity": [["tile_f", "sp", [-1, 3, 4, 7]], ["tile_y", "sp", [-1, 1, 2, 1]], ["tile_x", "sp", [-1, 7, 3, 1]], ["tile_rc", "sp", [-1, 2]], ["tile_ry", "sp", [-1, 1]], ["tile_rx", "sp", [-1, 1]], ["auto_unroll_max_step", "ot", 1500], ["unroll_explicit", "ot", 1]]}, "result": [[0.011006167], 0, 4.567669868469238, 1637715120.5723228], "version": 0.2, "tvm_version": "0.8.dev0"}
{"input": ["cuda -keys=cuda,gpu -max_num_threads=1024 -thread_warp_size=32", "conv2d_nchw.cuda", [["TENSOR", [128, 1008, 42, 42], "float32"], ["TENSOR", [168, 1008, 1, 1], "float32"], 1, "SAME", 1, "float32"], {}], "config": {"index": 40921839, "code_hash": null, "entity": [["tile_f", "sp", [-1, 3, 4, 7]], ["tile_y", "sp", [-1, 1, 2, 1]], ["tile_x", "sp", [-1, 7, 3, 1]], ["tile_rc", "sp", [-1, 2]], ["tile_ry", "sp", [-1, 1]], ["tile_rx", "sp", [-1, 1]], ["auto_unroll_max_step", "ot", 512], ["unroll_explicit", "ot", 0]]}, "result": [[0.0109119099], 0, 4.4187912940979, 1637715124.6351578], "version": 0.2, "tvm_version": "0.8.dev0"}
{"input": ["cuda -keys=cuda,gpu -max_num_threads=1024 -thread_warp_size=32", "conv2d_nchw.cuda", [["TENSOR", [128, 1008, 42, 42], "float32"], ["TENSOR", [168, 1008, 1, 1], "float32"], 1, "SAME", 1, "float32"], {}], "config": {"index": 158886639, "code_hash": null, "entity": [["tile_f", "sp", [-1, 3, 4, 7]], ["tile_y", "sp", [-1, 1, 2, 1]], ["tile_x", "sp", [-1, 7, 3, 1]], ["tile_rc", "sp", [-1, 2]], ["tile_ry", "sp", [-1, 1]], ["tile_rx", "sp", [-1, 1]], ["auto_unroll_max_step", "ot", 512], ["unroll_explicit", "ot", 1]]}, "result": [[0.0110118668], 0, 4.518694877624512, 1637715128.580974], "version": 0.2, "tvm_version": "0.8.dev0"}
{"input": ["cuda -keys=cuda,gpu -max_num_threads=1024 -thread_warp_size=32", "conv2d_nchw.cuda", [["TENSOR", [128, 1008, 42, 42], "float32"], ["TENSOR", [168, 1008, 1, 1], "float32"], 1, "SAME", 1, "float32"], {}], "config": {"index": 80243439, "code_hash": null, "entity": [["tile_f", "sp", [-1, 3, 4, 7]], ["tile_y", "sp", [-1, 1, 2, 1]], ["tile_x", "sp", [-1, 7, 3, 1]], ["tile_rc", "sp", [-1, 2]], ["tile_ry", "sp", [-1, 1]], ["tile_rx", "sp", [-1, 1]], ["auto_unroll_max_step", "ot", 1500], ["unroll_explicit", "ot", 0]]}, "result": [[0.0109095099], 0, 4.292342662811279, 1637715132.5312445], "version": 0.2, "tvm_version": "0.8.dev0"}
{"input": ["cuda -keys=cuda,gpu -max_num_threads=1024 -thread_warp_size=32", "conv2d_nchw.cuda", [["TENSOR", [128, 1008, 42, 42], "float32"], ["TENSOR", [168, 1008, 1, 1], "float32"], 1, "SAME", 1, "float32"], {}], "config": {"index": 4571113, "code_hash": null, "entity": [["tile_f", "sp", [-1, 1, 3, 7]], ["tile_y", "sp", [-1, 1, 3, 1]], ["tile_x", "sp", [-1, 1, 3, 2]], ["tile_rc", "sp", [-1, 4]], ["tile_ry", "sp", [-1, 1]], ["tile_rx", "sp", [-1, 1]], ["auto_unroll_max_step", "ot", 0], ["unroll_explicit", "ot", 0]]}, "result": [[0.031491193], 0, 4.360635042190552, 1637715136.6370685], "version": 0.2, "tvm_version": "0.8.dev0"}
{"input": ["cuda -keys=cuda,gpu -max_num_threads=1024 -thread_warp_size=32", "conv2d_nchw.cuda", [["TENSOR", [128, 1008, 42, 42], "float32"], ["TENSOR", [168, 1008, 1, 1], "float32"], 1, "SAME", 1, "float32"], {}], "config": {"index": 122535913, "code_hash": null, "entity": [["tile_f", "sp", [-1, 1, 3, 7]], ["tile_y", "sp", [-1, 1, 3, 1]], ["tile_x", "sp", [-1, 1, 3, 2]], ["tile_rc", "sp", [-1, 4]], ["tile_ry", "sp", [-1, 1]], ["tile_rx", "sp", [-1, 1]], ["auto_unroll_max_step", "ot", 0], ["unroll_explicit", "ot", 1]]}, "result": [[0.03149394275], 0, 4.208234548568726, 1637715140.5879579], "version": 0.2, "tvm_version": "0.8.dev0"}
{"input": ["cuda -keys=cuda,gpu -max_num_threads=1024 -thread_warp_size=32", "conv2d_nchw.cuda", [["TENSOR", [128, 1008, 42, 42], "float32"], ["TENSOR", [168, 1008, 1, 1], "float32"], 1, "SAME", 1, "float32"], {}], "config": {"index": 124550358, "code_hash": null, "entity": [["tile_f", "sp", [-1, 2, 3, 14]], ["tile_y", "sp", [-1, 1, 21, 2]], ["tile_x", "sp", [-1, 2, 1, 1]], ["tile_rc", "sp", [-1, 7]], ["tile_ry", "sp", [-1, 1]], ["tile_rx", "sp", [-1, 1]], ["auto_unroll_max_step", "ot", 0], ["unroll_explicit", "ot", 1]]}, "result": [[0.016412745142857142], 0, 4.396337032318115, 1637715144.6236055], "version": 0.2, "tvm_version": "0.8.dev0"}
{"input": ["cuda -keys=cuda,gpu -max_num_threads=1024 -thread_warp_size=32", "conv2d_nchw.cuda", [["TENSOR", [128, 1008, 42, 42], "float32"], ["TENSOR", [168, 1008, 1, 1], "float32"], 1, "SAME", 1, "float32"], {}], "config": {"index": 7118052, "code_hash": null, "entity": [["tile_f", "sp", [-1, 1, 4, 21]], ["tile_y", "sp", [-1, 1, 21, 2]], ["tile_x", "sp", [-1, 1, 1, 2]], ["tile_rc", "sp", [-1, 7]], ["tile_ry", "sp", [-1, 1]], ["tile_rx", "sp", [-1, 1]], ["auto_unroll_max_step", "ot", 0], ["unroll_explicit", "ot", 0]]}, "result": [[0.016310935555555555], 0, 4.472087860107422, 1637715148.821223], "version": 0.2, "tvm_version": "0.8.dev0"}
{"input": ["cuda -keys=cuda,gpu -max_num_threads=1024 -thread_warp_size=32", "conv2d_nchw.cuda", [["TENSOR", [128, 1008, 42, 42], "float32"], ["TENSOR", [168, 1008, 1, 1], "float32"], 1, "SAME", 1, "float32"], {}], "config": {"index": 125082852, "code_hash": null, "entity": [["tile_f", "sp", [-1, 1, 4, 21]], ["tile_y", "sp", [-1, 1, 21, 2]], ["tile_x", "sp", [-1, 1, 1, 2]], ["tile_rc", "sp", [-1, 7]], ["tile_ry", "sp", [-1, 1]], ["tile_rx", "sp", [-1, 1]], ["auto_unroll_max_step", "ot", 0], ["unroll_explicit", "ot", 1]]}, "result": [[0.01633377585714286], 0, 4.209493637084961, 1637715152.7513437], "version": 0.2, "tvm_version": "0.8.dev0"}
{"input": ["cuda -keys=cuda,gpu -max_num_threads=1024 -thread_warp_size=32", "conv2d_nchw.cuda", [["TENSOR", [128, 1008, 42, 42], "float32"], ["TENSOR", [168, 1008, 1, 1], "float32"], 1, "SAME", 1, "float32"], {}], "config": {"index": 3260393, "code_hash": null, "entity": [["tile_f", "sp", [-1, 1, 3, 7]], ["tile_y", "sp", [-1, 1, 3, 1]], ["tile_x", "sp", [-1, 1, 3, 2]], ["tile_rc", "sp", [-1, 3]], ["tile_ry", "sp", [-1, 1]], ["tile_rx", "sp", [-1, 1]], ["auto_unroll_max_step", "ot", 0], ["unroll_explicit", "ot", 0]]}, "result": [[0.028193695], 0, 4.327562093734741, 1637715156.8173673], "version": 0.2, "tvm_version": "0.8.dev0"}
{"input": ["cuda -keys=cuda,gpu -max_num_threads=1024 -thread_warp_size=32", "conv2d_nchw.cuda", [["TENSOR", [128, 1008, 42, 42], "float32"], ["TENSOR", [168, 1008, 1, 1], "float32"], 1, "SAME", 1, "float32"], {}], "config": {"index": 121225193, "code_hash": null, "entity": [["tile_f", "sp", [-1, 1, 3, 7]], ["tile_y", "sp", [-1, 1, 3, 1]], ["tile_x", "sp", [-1, 1, 3, 2]], ["tile_rc", "sp", [-1, 3]], ["tile_ry", "sp", [-1, 1]], ["tile_rx", "sp", [-1, 1]], ["auto_unroll_max_step", "ot", 0], ["unroll_explicit", "ot", 1]]}, "result": [[0.028222743749999998], 0, 4.100549936294556, 1637715160.697121], "version": 0.2, "tvm_version": "0.8.dev0"}
{"input": ["cuda -keys=cuda,gpu -max_num_threads=1024 -thread_warp_size=32", "conv2d_nchw.cuda", [["TENSOR", [128, 1008, 42, 42], "float32"], ["TENSOR", [168, 1008, 1, 1], "float32"], 1, "SAME", 1, "float32"], {}], "config": {"index": 80354728, "code_hash": null, "entity": [["tile_f", "sp", [-1, 1, 14, 3]], ["tile_y", "sp", [-1, 1, 1, 3]], ["tile_x", "sp", [-1, 2, 7, 1]], ["tile_rc", "sp", [-1, 2]], ["tile_ry", "sp", [-1, 1]], ["tile_rx", "sp", [-1, 1]], ["auto_unroll_max_step", "ot", 1500], ["unroll_explicit", "ot", 0]]}, "result": [[0.014125383875000001], 0, 4.802219390869141, 1637715165.2660892], "version": 0.2, "tvm_version": "0.8.dev0"}
{"input": ["cuda -keys=cuda,gpu -max_num_threads=1024 -thread_warp_size=32", "conv2d_nchw.cuda", [["TENSOR", [128, 1008, 42, 42], "float32"], ["TENSOR", [168, 1008, 1, 1], "float32"], 1, "SAME", 1, "float32"], {}], "config": {"index": 41033128, "code_hash": null, "entity": [["tile_f", "sp", [-1, 1, 14, 3]], ["tile_y", "sp", [-1, 1, 1, 3]], ["tile_x", "sp", [-1, 2, 7, 1]], ["tile_rc", "sp", [-1, 2]], ["tile_ry", "sp", [-1, 1]], ["tile_rx", "sp", [-1, 1]], ["auto_unroll_max_step", "ot", 512], ["unroll_explicit", "ot", 0]]}, "result": [[0.014044448875], 0, 4.204755067825317, 1637715169.2076604], "version": 0.2, "tvm_version": "0.8.dev0"}
{"input": ["cuda -keys=cuda,gpu -max_num_threads=1024 -thread_warp_size=32", "conv2d_nchw.cuda", [["TENSOR", [128, 1008, 42, 42], "float32"], ["TENSOR", [168, 1008, 1, 1], "float32"], 1, "SAME", 1, "float32"], {}], "config": {"index": 2960851, "code_hash": null, "entity": [["tile_f", "sp", [-1, 1, 4, 6]], ["tile_y", "sp", [-1, 1, 1, 3]], ["tile_x", "sp", [-1, 1, 6, 1]], ["tile_rc", "sp", [-1, 3]], ["tile_ry", "sp", [-1, 1]], ["tile_rx", "sp", [-1, 1]], ["auto_unroll_max_step", "ot", 0], ["unroll_explicit", "ot", 0]]}, "result": [[0.02939518175], 0, 4.217071533203125, 1637715173.2033665], "version": 0.2, "tvm_version": "0.8.dev0"}
{"input": ["cuda -keys=cuda,gpu -max_num_threads=1024 -thread_warp_size=32", "conv2d_nchw.cuda", [["TENSOR", [128, 1008, 42, 42], "float32"], ["TENSOR", [168, 1008, 1, 1], "float32"], 1, "SAME", 1, "float32"], {}], "config": {"index": 4312483, "code_hash": null, "entity": [["tile_f", "sp", [-1, 2, 7, 3]], ["tile_y", "sp", [-1, 1, 1, 3]], ["tile_x", "sp", [-1, 1, 7, 1]], ["tile_rc", "sp", [-1, 4]], ["tile_ry", "sp", [-1, 1]], ["tile_rx", "sp", [-1, 1]], ["auto_unroll_max_step", "ot", 0], ["unroll_explicit", "ot", 0]]}, "result": [[0.0242516755], 0, 4.340521574020386, 1637715177.304323], "version": 0.2, "tvm_version": "0.8.dev0"}
{"input": ["cuda -keys=cuda,gpu -max_num_threads=1024 -thread_warp_size=32", "conv2d_nchw.cuda", [["TENSOR", [128, 1008, 42, 42], "float32"], ["TENSOR", [168, 1008, 1, 1], "float32"], 1, "SAME", 1, "float32"], {}], "config": {"index": 120925651, "code_hash": null, "entity": [["tile_f", "sp", [-1, 1, 4, 6]], ["tile_y", "sp", [-1, 1, 1, 3]], ["tile_x", "sp", [-1, 1, 6, 1]], ["tile_rc", "sp", [-1, 3]], ["tile_ry", "sp", [-1, 1]], ["tile_rx", "sp", [-1, 1]], ["auto_unroll_max_step", "ot", 0], ["unroll_explicit", "ot", 1]]}, "result": [[0.02932385875], 0, 4.226526975631714, 1637715181.2775068], "version": 0.2, "tvm_version": "0.8.dev0"}
{"input": ["cuda -keys=cuda,gpu -max_num_threads=1024 -thread_warp_size=32", "conv2d_nchw.cuda", [["TENSOR", [128, 1008, 42, 42], "float32"], ["TENSOR", [168, 1008, 1, 1], "float32"], 1, "SAME", 1, "float32"], {}], "config": {"index": 2960882, "code_hash": null, "entity": [["tile_f", "sp", [-1, 2, 6, 7]], ["tile_y", "sp", [-1, 1, 1, 3]], ["tile_x", "sp", [-1, 1, 6, 1]], ["tile_rc", "sp", [-1, 3]], ["tile_ry", "sp", [-1, 1]], ["tile_rx", "sp", [-1, 1]], ["auto_unroll_max_step", "ot", 0], ["unroll_explicit", "ot", 0]]}, "result": [[0.023530147833333334], 0, 4.395703315734863, 1637715185.426183], "version": 0.2, "tvm_version": "0.8.dev0"}
{"input": ["cuda -keys=cuda,gpu -max_num_threads=1024 -thread_warp_size=32", "conv2d_nchw.cuda", [["TENSOR", [128, 1008, 42, 42], "float32"], ["TENSOR", [168, 1008, 1, 1], "float32"], 1, "SAME", 1, "float32"], {}], "config": {"index": 120925682, "code_hash": null, "entity": [["tile_f", "sp", [-1, 2, 6, 7]], ["tile_y", "sp", [-1, 1, 1, 3]], ["tile_x", "sp", [-1, 1, 6, 1]], ["tile_rc", "sp", [-1, 3]], ["tile_ry", "sp", [-1, 1]], ["tile_rx", "sp", [-1, 1]], ["auto_unroll_max_step", "ot", 0], ["unroll_explicit", "ot", 1]]}, "result": [[0.023471149666666666], 0, 4.328608751296997, 1637715189.4811792], "version": 0.2, "tvm_version": "0.8.dev0"}
{"input": ["cuda -keys=cuda,gpu -max_num_threads=1024 -thread_warp_size=32", "conv2d_nchw.cuda", [["TENSOR", [128, 1008, 42, 42], "float32"], ["TENSOR", [168, 1008, 1, 1], "float32"], 1, "SAME", 1, "float32"], {}], "config": {"index": 4312533, "code_hash": null, "entity": [["tile_f", "sp", [-1, 1, 7, 6]], ["tile_y", "sp", [-1, 1, 1, 3]], ["tile_x", "sp", [-1, 1, 7, 1]], ["tile_rc", "sp", [-1, 4]], ["tile_ry", "sp", [-1, 1]], ["tile_rx", "sp", [-1, 1]], ["auto_unroll_max_step", "ot", 0], ["unroll_explicit", "ot", 0]]}, "result": [[0.024349272], 0, 4.322254419326782, 1637715193.5853603], "version": 0.2, "tvm_version": "0.8.dev0"}
{"input": ["cuda -keys=cuda,gpu -max_num_threads=1024 -thread_warp_size=32", "conv2d_nchw.cuda", [["TENSOR", [128, 1008, 42, 42], "float32"], ["TENSOR", [168, 1008, 1, 1], "float32"], 1, "SAME", 1, "float32"], {}], "config": {"index": 118077412, "code_hash": null, "entity": [["tile_f", "sp", [-1, 1, 4, 21]], ["tile_y", "sp", [-1, 1, 3, 2]], ["tile_x", "sp", [-1, 14, 1, 1]], ["tile_rc", "sp", [-1, 1]], ["tile_ry", "sp", [-1, 1]], ["tile_rx", "sp", [-1, 1]], ["auto_unroll_max_step", "ot", 0], ["unroll_explicit", "ot", 1]]}, "result": [[1.4347905209999998], 0, 11.411770343780518, 1637715204.714747], "version": 0.2, "tvm_version": "0.8.dev0"}
{"input": ["cuda -keys=cuda,gpu -max_num_threads=1024 -thread_warp_size=32", "conv2d_nchw.cuda", [["TENSOR", [128, 1008, 42, 42], "float32"], ["TENSOR", [168, 1008, 1, 1], "float32"], 1, "SAME", 1, "float32"], {}], "config": {"index": 112612, "code_hash": null, "entity": [["tile_f", "sp", [-1, 1, 4, 21]], ["tile_y", "sp", [-1, 1, 3, 2]], ["tile_x", "sp", [-1, 14, 1, 1]], ["tile_rc", "sp", [-1, 1]], ["tile_ry", "sp", [-1, 1]], ["tile_rx", "sp", [-1, 1]], ["auto_unroll_max_step", "ot", 0], ["unroll_explicit", "ot", 0]]}, "result": [[1.4322272775], 0, 11.405333280563354, 1637715216.9367015], "version": 0.2, "tvm_version": "0.8.dev0"}
{"input": ["cuda -keys=cuda,gpu -max_num_threads=1024 -thread_warp_size=32", "conv2d_nchw.cuda", [["TENSOR", [128, 1008, 42, 42], "float32"], ["TENSOR", [168, 1008, 1, 1], "float32"], 1, "SAME", 1, "float32"], {}], "config": {"index": 112600, "code_hash": null, "entity": [["tile_f", "sp", [-1, 1, 4, 14]], ["tile_y", "sp", [-1, 1, 3, 2]], ["tile_x", "sp", [-1, 14, 1, 1]], ["tile_rc", "sp", [-1, 1]], ["tile_ry", "sp", [-1, 1]], ["tile_rx", "sp", [-1, 1]], ["auto_unroll_max_step", "ot", 0], ["unroll_explicit", "ot", 0]]}, "result": [[1.4271173915], 0, 11.554307222366333, 1637715227.978827], "version": 0.2, "tvm_version": "0.8.dev0"}
{"input": ["cuda -keys=cuda,gpu -max_num_threads=1024 -thread_warp_size=32", "conv2d_nchw.cuda", [["TENSOR", [128, 1008, 42, 42], "float32"], ["TENSOR", [168, 1008, 1, 1], "float32"], 1, "SAME", 1, "float32"], {}], "config": {"index": 160178212, "code_hash": null, "entity": [["tile_f", "sp", [-1, 1, 4, 21]], ["tile_y", "sp", [-1, 1, 3, 1]], ["tile_x", "sp", [-1, 2, 3, 1]], ["tile_rc", "sp", [-1, 3]], ["tile_ry", "sp", [-1, 1]], ["tile_rx", "sp", [-1, 1]], ["auto_unroll_max_step", "ot", 512], ["unroll_explicit", "ot", 1]]}, "result": [[0.026432997], 0, 4.345797061920166, 1637715231.9146507], "version": 0.2, "tvm_version": "0.8.dev0"}
{"input": ["cuda -keys=cuda,gpu -max_num_threads=1024 -thread_warp_size=32", "conv2d_nchw.cuda", [["TENSOR", [128, 1008, 42, 42], "float32"], ["TENSOR", [168, 1008, 1, 1], "float32"], 1, "SAME", 1, "float32"], {}], "config": {"index": 199499812, "code_hash": null, "entity": [["tile_f", "sp", [-1, 1, 4, 21]], ["tile_y", "sp", [-1, 1, 3, 1]], ["tile_x", "sp", [-1, 2, 3, 1]], ["tile_rc", "sp", [-1, 3]], ["tile_ry", "sp", [-1, 1]], ["tile_rx", "sp", [-1, 1]], ["auto_unroll_max_step", "ot", 1500], ["unroll_explicit", "ot", 1]]}, "result": [[0.02647662075], 0, 4.388235807418823, 1637715235.8410058], "version": 0.2, "tvm_version": "0.8.dev0"}
{"input": ["cuda -keys=cuda,gpu -max_num_threads=1024 -thread_warp_size=32", "conv2d_nchw.cuda", [["TENSOR", [128, 1008, 42, 42], "float32"], ["TENSOR", [168, 1008, 1, 1], "float32"], 1, "SAME", 1, "float32"], {}], "config": {"index": 3482166, "code_hash": null, "entity": [["tile_f", "sp", [-1, 1, 12, 7]], ["tile_y", "sp", [-1, 2, 1, 1]], ["tile_x", "sp", [-1, 1, 7, 3]], ["tile_rc", "sp", [-1, 3]], ["tile_ry", "sp", [-1, 1]], ["tile_rx", "sp", [-1, 1]], ["auto_unroll_max_step", "ot", 0], ["unroll_explicit", "ot", 0]]}, "result": [[0.012531169875], 0, 4.4682958126068115, 1637715239.8775666], "version": 0.2, "tvm_version": "0.8.dev0"}
{"input": ["cuda -keys=cuda,gpu -max_num_threads=1024 -thread_warp_size=32", "conv2d_nchw.cuda", [["TENSOR", [128, 1008, 42, 42], "float32"], ["TENSOR", [168, 1008, 1, 1], "float32"], 1, "SAME", 1, "float32"], {}], "config": {"index": 6602518, "code_hash": null, "entity": [["tile_f", "sp", [-1, 2, 3, 14]], ["tile_y", "sp", [-1, 1, 21, 1]], ["tile_x", "sp", [-1, 3, 1, 1]], ["tile_rc", "sp", [-1, 7]], ["tile_ry", "sp", [-1, 1]], ["tile_rx", "sp", [-1, 1]], ["auto_unroll_max_step", "ot", 0], ["unroll_explicit", "ot", 0]]}, "result": [[0.013226960625], 0, 4.402715444564819, 1637715243.8470922], "version": 0.2, "tvm_version": "0.8.dev0"}
{"input": ["cuda -keys=cuda,gpu -max_num_threads=1024 -thread_warp_size=32", "conv2d_nchw.cuda", [["TENSOR", [128, 1008, 42, 42], "float32"], ["TENSOR", [168, 1008, 1, 1], "float32"], 1, "SAME", 1, "float32"], {}], "config": {"index": 5503958, "code_hash": null, "entity": [["tile_f", "sp", [-1, 2, 3, 14]], ["tile_y", "sp", [-1, 1, 7, 6]], ["tile_x", "sp", [-1, 1, 3, 1]], ["tile_rc", "sp", [-1, 6]], ["tile_ry", "sp", [-1, 1]], ["tile_rx", "sp", [-1, 1]], ["auto_unroll_max_step", "ot", 0], ["unroll_explicit", "ot", 0]]}, "result": [[0.0104955911], 0, 4.55193829536438, 1637715247.9702487], "version": 0.2, "tvm_version": "0.8.dev0"}
{"input": ["cuda -keys=cuda,gpu -max_num_threads=1024 -thread_warp_size=32", "conv2d_nchw.cuda", [["TENSOR", [128, 1008, 42, 42], "float32"], ["TENSOR", [168, 1008, 1, 1], "float32"], 1, "SAME", 1, "float32"], {}], "config": {"index": 5503984, "code_hash": null, "entity": [["tile_f", "sp", [-1, 1, 3, 28]], ["tile_y", "sp", [-1, 1, 7, 6]], ["tile_x", "sp", [-1, 1, 3, 1]], ["tile_rc", "sp", [-1, 6]], ["tile_ry", "sp", [-1, 1]], ["tile_rx", "sp", [-1, 1]], ["auto_unroll_max_step", "ot", 0], ["unroll_explicit", "ot", 0]]}, "result": [[0.0103804247], 0, 4.738408803939819, 1637715252.178623], "version": 0.2, "tvm_version": "0.8.dev0"}
{"input": ["cuda -keys=cuda,gpu -max_num_threads=1024 -thread_warp_size=32", "conv2d_nchw.cuda", [["TENSOR", [128, 1008, 42, 42], "float32"], ["TENSOR", [168, 1008, 1, 1], "float32"], 1, "SAME", 1, "float32"], {}], "config": {"index": 123468757, "code_hash": null, "entity": [["tile_f", "sp", [-1, 1, 3, 14]], ["tile_y", "sp", [-1, 1, 7, 6]], ["tile_x", "sp", [-1, 1, 3, 1]], ["tile_rc", "sp", [-1, 6]], ["tile_ry", "sp", [-1, 1]], ["tile_rx", "sp", [-1, 1]], ["auto_unroll_max_step", "ot", 0], ["unroll_explicit", "ot", 1]]}, "result": [[0.016708059666666667], 0, 4.405391693115234, 1637715256.2821965], "version": 0.2, "tvm_version": "0.8.dev0"}
{"input": ["cuda -keys=cuda,gpu -max_num_threads=1024 -thread_warp_size=32", "conv2d_nchw.cuda", [["TENSOR", [128, 1008, 42, 42], "float32"], ["TENSOR", [168, 1008, 1, 1], "float32"], 1, "SAME", 1, "float32"], {}], "config": {"index": 123468784, "code_hash": null, "entity": [["tile_f", "sp", [-1, 1, 3, 28]], ["tile_y", "sp", [-1, 1, 7, 6]], ["tile_x", "sp", [-1, 1, 3, 1]], ["tile_rc", "sp", [-1, 6]], ["tile_ry", "sp", [-1, 1]], ["tile_rx", "sp", [-1, 1]], ["auto_unroll_max_step", "ot", 0], ["unroll_explicit", "ot", 1]]}, "result": [[0.010394603999999998], 0, 4.486722230911255, 1637715260.2430453], "version": 0.2, "tvm_version": "0.8.dev0"}
{"input": ["cuda -keys=cuda,gpu -max_num_threads=1024 -thread_warp_size=32", "conv2d_nchw.cuda", [["TENSOR", [128, 1008, 42, 42], "float32"], ["TENSOR", [168, 1008, 1, 1], "float32"], 1, "SAME", 1, "float32"], {}], "config": {"index": 123468758, "code_hash": null, "entity": [["tile_f", "sp", [-1, 2, 3, 14]], ["tile_y", "sp", [-1, 1, 7, 6]], ["tile_x", "sp", [-1, 1, 3, 1]], ["tile_rc", "sp", [-1, 6]], ["tile_ry", "sp", [-1, 1]], ["tile_rx", "sp", [-1, 1]], ["auto_unroll_max_step", "ot", 0], ["unroll_explicit", "ot", 1]]}, "result": [[0.010449892300000001], 0, 4.472065448760986, 1637715264.2221003], "version": 0.2, "tvm_version": "0.8.dev0"}
{"input": ["cuda -keys=cuda,gpu -max_num_threads=1024 -thread_warp_size=32", "conv2d_nchw.cuda", [["TENSOR", [128, 1008, 42, 42], "float32"], ["TENSOR", [168, 1008, 1, 1], "float32"], 1, "SAME", 1, "float32"], {}], "config": {"index": 5503957, "code_hash": null, "entity": [["tile_f", "sp", [-1, 1, 3, 14]], ["tile_y", "sp", [-1, 1, 7, 6]], ["tile_x", "sp", [-1, 1, 3, 1]], ["tile_rc", "sp", [-1, 6]], ["tile_ry", "sp", [-1, 1]], ["tile_rx", "sp", [-1, 1]], ["auto_unroll_max_step", "ot", 0], ["unroll_explicit", "ot", 0]]}, "result": [[0.016675360333333333], 0, 4.38486647605896, 1637715268.2205904], "version": 0.2, "tvm_version": "0.8.dev0"}
{"input": ["cuda -keys=cuda,gpu -max_num_threads=1024 -thread_warp_size=32", "conv2d_nchw.cuda", [["TENSOR", [128, 1008, 42, 42], "float32"], ["TENSOR", [168, 1008, 1, 1], "float32"], 1, "SAME", 1, "float32"], {}], "config": {"index": 5271344, "code_hash": null, "entity": [["tile_f", "sp", [-1, 1, 3, 28]], ["tile_y", "sp", [-1, 1, 21, 1]], ["tile_x", "sp", [-1, 2, 1, 1]], ["tile_rc", "sp", [-1, 6]], ["tile_ry", "sp", [-1, 1]], ["tile_rx", "sp", [-1, 1]], ["auto_unroll_max_step", "ot", 0], ["unroll_explicit", "ot", 0]]}, "result": [[0.015883130428571427], 0, 4.351102113723755, 1637715272.2369525], "version": 0.2, "tvm_version": "0.8.dev0"}
{"input": ["cuda -keys=cuda,gpu -max_num_threads=1024 -thread_warp_size=32", "conv2d_nchw.cuda", [["TENSOR", [128, 1008, 42, 42], "float32"], ["TENSOR", [168, 1008, 1, 1], "float32"], 1, "SAME", 1, "float32"], {}], "config": {"index": 4674740, "code_hash": null, "entity": [["tile_f", "sp", [-1, 21, 1, 4]], ["tile_y", "sp", [-1, 1, 6, 1]], ["tile_x", "sp", [-1, 1, 1, 3]], ["tile_rc", "sp", [-1, 4]], ["tile_ry", "sp", [-1, 1]], ["tile_rx", "sp", [-1, 1]], ["auto_unroll_max_step", "ot", 0], ["unroll_explicit", "ot", 0]]}, "result": [[4.196376706], 0, 25.42193841934204, 1637715297.285825], "version": 0.2, "tvm_version": "0.8.dev0"}
{"input": ["cuda -keys=cuda,gpu -max_num_threads=1024 -thread_warp_size=32", "conv2d_nchw.cuda", [["TENSOR", [128, 1008, 42, 42], "float32"], ["TENSOR", [168, 1008, 1, 1], "float32"], 1, "SAME", 1, "float32"], {}], "config": {"index": 142126661, "code_hash": null, "entity": [["tile_f", "sp", [-1, 14, 1, 12]], ["tile_y", "sp", [-1, 2, 1, 7]], ["tile_x", "sp", [-1, 1, 1, 2]], ["tile_rc", "sp", [-1, 56]], ["tile_ry", "sp", [-1, 1]], ["tile_rx", "sp", [-1, 1]], ["auto_unroll_max_step", "ot", 0], ["unroll_explicit", "ot", 1]]}, "result": [[16.784991553250002], 0, 88.52058005332947, 1637715385.0397072], "version": 0.2, "tvm_version": "0.8.dev0"}
{"input": ["cuda -keys=cuda,gpu -max_num_threads=1024 -thread_warp_size=32", "conv2d_nchw.cuda", [["TENSOR", [128, 1008, 42, 42], "float32"], ["TENSOR", [168, 1008, 1, 1], "float32"], 1, "SAME", 1, "float32"], {}], "config": {"index": 204810802, "code_hash": null, "entity": [["tile_f", "sp", [-1, 2, 6, 7]], ["tile_y", "sp", [-1, 1, 7, 2]], ["tile_x", "sp", [-1, 1, 6, 1]], ["tile_rc", "sp", [-1, 8]], ["tile_ry", "sp", [-1, 1]], ["tile_rx", "sp", [-1, 1]], ["auto_unroll_max_step", "ot", 1500], ["unroll_explicit", "ot", 1]]}, "result": [[0.0097094873125], 0, 4.432230472564697, 1637715467.4954872], "version": 0.2, "tvm_version": "0.8.dev0"}
{"input": ["cuda -keys=cuda,gpu -max_num_threads=1024 -thread_warp_size=32", "conv2d_nchw.cuda", [["TENSOR", [128, 1008, 42, 42], "float32"], ["TENSOR", [168, 1008, 1, 1], "float32"], 1, "SAME", 1, "float32"], {}], "config": {"index": 203500082, "code_hash": null, "entity": [["tile_f", "sp", [-1, 2, 6, 7]], ["tile_y", "sp", [-1, 1, 7, 2]], ["tile_x", "sp", [-1, 1, 6, 1]], ["tile_rc", "sp", [-1, 7]], ["tile_ry", "sp", [-1, 1]], ["tile_rx", "sp", [-1, 1]], ["auto_unroll_max_step", "ot", 1500], ["unroll_explicit", "ot", 1]]}, "result": [[0.012700324125], 0, 4.4540321826934814, 1637715471.5936425], "version": 0.2, "tvm_version": "0.8.dev0"}
{"input": ["cuda -keys=cuda,gpu -max_num_threads=1024 -thread_warp_size=32", "conv2d_nchw.cuda", [["TENSOR", [128, 1008, 42, 42], "float32"], ["TENSOR", [168, 1008, 1, 1], "float32"], 1, "SAME", 1, "float32"], {}], "config": {"index": 203803758, "code_hash": null, "entity": [["tile_f", "sp", [-1, 2, 4, 7]], ["tile_y", "sp", [-1, 1, 14, 1]], ["tile_x", "sp", [-1, 1, 3, 2]], ["tile_rc", "sp", [-1, 7]], ["tile_ry", "sp", [-1, 1]], ["tile_rx", "sp", [-1, 1]], ["auto_unroll_max_step", "ot", 1500], ["unroll_explicit", "ot", 1]]}, "result": [[0.013636044500000001], 0, 4.350317001342773, 1637715475.5931473], "version": 0.2, "tvm_version": "0.8.dev0"}
{"input": ["cuda -keys=cuda,gpu -max_num_threads=1024 -thread_warp_size=32", "conv2d_nchw.cuda", [["TENSOR", [128, 1008, 42, 42], "float32"], ["TENSOR", [168, 1008, 1, 1], "float32"], 1, "SAME", 1, "float32"], {}], "config": {"index": 121042200, "code_hash": null, "entity": [["tile_f", "sp", [-1, 1, 4, 14]], ["tile_y", "sp", [-1, 1, 6, 1]], ["tile_x", "sp", [-1, 1, 14, 1]], ["tile_rc", "sp", [-1, 3]], ["tile_ry", "sp", [-1, 1]], ["tile_rx", "sp", [-1, 1]], ["auto_unroll_max_step", "ot", 0], ["unroll_explicit", "ot", 1]]}, "result": [[0.0109840232], 0, 4.709341526031494, 1637715480.0653636], "version": 0.2, "tvm_version": "0.8.dev0"}
{"input": ["cuda -keys=cuda,gpu -max_num_threads=1024 -thread_warp_size=32", "conv2d_nchw.cuda", [["TENSOR", [128, 1008, 42, 42], "float32"], ["TENSOR", [168, 1008, 1, 1], "float32"], 1, "SAME", 1, "float32"], {}], "config": {"index": 199685400, "code_hash": null, "entity": [["tile_f", "sp", [-1, 1, 4, 14]], ["tile_y", "sp", [-1, 1, 6, 1]], ["tile_x", "sp", [-1, 1, 14, 1]], ["tile_rc", "sp", [-1, 3]], ["tile_ry", "sp", [-1, 1]], ["tile_rx", "sp", [-1, 1]], ["auto_unroll_max_step", "ot", 1500], ["unroll_explicit", "ot", 1]]}, "result": [[0.011053801], 0, 4.311572074890137, 1637715484.1523492], "version": 0.2, "tvm_version": "0.8.dev0"}
{"input": ["cuda -keys=cuda,gpu -max_num_threads=1024 -thread_warp_size=32", "conv2d_nchw.cuda", [["TENSOR", [128, 1008, 42, 42], "float32"], ["TENSOR", [168, 1008, 1, 1], "float32"], 1, "SAME", 1, "float32"], {}], "config": {"index": 160363800, "code_hash": null, "entity": [["tile_f", "sp", [-1, 1, 4, 14]], ["tile_y", "sp", [-1, 1, 6, 1]], ["tile_x", "sp", [-1, 1, 14, 1]], ["tile_rc", "sp", [-1, 3]], ["tile_ry", "sp", [-1, 1]], ["tile_rx", "sp", [-1, 1]], ["auto_unroll_max_step", "ot", 512], ["unroll_explicit", "ot", 1]]}, "result": [[0.0110593007], 0, 4.311765432357788, 1637715488.180789], "version": 0.2, "tvm_version": "0.8.dev0"}
{"input": ["cuda -keys=cuda,gpu -max_num_threads=1024 -thread_warp_size=32", "conv2d_nchw.cuda", [["TENSOR", [128, 1008, 42, 42], "float32"], ["TENSOR", [168, 1008, 1, 1], "float32"], 1, "SAME", 1, "float32"], {}], "config": {"index": 202189359, "code_hash": null, "entity": [["tile_f", "sp", [-1, 3, 4, 7]], ["tile_y", "sp", [-1, 1, 7, 2]], ["tile_x", "sp", [-1, 1, 6, 1]], ["tile_rc", "sp", [-1, 6]], ["tile_ry", "sp", [-1, 1]], ["tile_rx", "sp", [-1, 1]], ["auto_unroll_max_step", "ot", 1500], ["unroll_explicit", "ot", 1]]}, "result": [[0.0104034714], 0, 4.547250509262085, 1637715492.3232582], "version": 0.2, "tvm_version": "0.8.dev0"}
{"input": ["cuda -keys=cuda,gpu -max_num_threads=1024 -thread_warp_size=32", "conv2d_nchw.cuda", [["TENSOR", [128, 1008, 42, 42], "float32"], ["TENSOR", [168, 1008, 1, 1], "float32"], 1, "SAME", 1, "float32"], {}], "config": {"index": 86846002, "code_hash": null, "entity": [["tile_f", "sp", [-1, 2, 6, 7]], ["tile_y", "sp", [-1, 1, 7, 2]], ["tile_x", "sp", [-1, 1, 6, 1]], ["tile_rc", "sp", [-1, 8]], ["tile_ry", "sp", [-1, 1]], ["tile_rx", "sp", [-1, 1]], ["auto_unroll_max_step", "ot", 1500], ["unroll_explicit", "ot", 0]]}, "result": [[0.0104985683], 0, 4.374303579330444, 1637715496.4341292], "version": 0.2, "tvm_version": "0.8.dev0"}
{"input": ["cuda -keys=cuda,gpu -max_num_threads=1024 -thread_warp_size=32", "conv2d_nchw.cuda", [["TENSOR", [128, 1008, 42, 42], "float32"], ["TENSOR", [168, 1008, 1, 1], "float32"], 1, "SAME", 1, "float32"], {}], "config": {"index": 85535282, "code_hash": null, "entity": [["tile_f", "sp", [-1, 2, 6, 7]], ["tile_y", "sp", [-1, 1, 7, 2]], ["tile_x", "sp", [-1, 1, 6, 1]], ["tile_rc", "sp", [-1, 7]], ["tile_ry", "sp", [-1, 1]], ["tile_rx", "sp", [-1, 1]], ["auto_unroll_max_step", "ot", 1500], ["unroll_explicit", "ot", 0]]}, "result": [[0.011424950222222223], 0, 4.254910707473755, 1637715500.4678802], "version": 0.2, "tvm_version": "0.8.dev0"}
