artifacts/microbenchmark/tvm/autotvm/conv/conv2d_128_128_58_58_128_3_3_2_VALID.log
{"input": ["cuda -keys=cuda,gpu -max_num_threads=1024 -thread_warp_size=32", "conv2d_nchw.cuda", [["TENSOR", [128, 128, 58, 58], "float32"], ["TENSOR", [128, 128, 3, 3], "float32"], 2, "VALID", 1, "float32"], {}], "config": {"index": 24599501, "code_hash": null, "entity": [["tile_f", "sp", [-1, 2, 1, 16]], ["tile_y", "sp", [-1, 1, 4, 7]], ["tile_x", "sp", [-1, 14, 1, 1]], ["tile_rc", "sp", [-1, 1]], ["tile_ry", "sp", [-1, 1]], ["tile_rx", "sp", [-1, 1]], ["auto_unroll_max_step", "ot", 512], ["unroll_explicit", "ot", 1]]}, "result": [[2.1474074059999997], 0, 15.845207929611206, 1637626629.3835137], "version": 0.2, "tvm_version": "0.8.dev0"}
{"input": ["cuda -keys=cuda,gpu -max_num_threads=1024 -thread_warp_size=32", "conv2d_nchw.cuda", [["TENSOR", [128, 128, 58, 58], "float32"], ["TENSOR", [128, 128, 3, 3], "float32"], 2, "VALID", 1, "float32"], {}], "config": {"index": 30884609, "code_hash": null, "entity": [["tile_f", "sp", [-1, 16, 1, 8]], ["tile_y", "sp", [-1, 7, 4, 1]], ["tile_x", "sp", [-1, 2, 2, 7]], ["tile_rc", "sp", [-1, 1]], ["tile_ry", "sp", [-1, 1]], ["tile_rx", "sp", [-1, 1]], ["auto_unroll_max_step", "ot", 1500], ["unroll_explicit", "ot", 1]]}, "result": [[1.2144144125], 0, 11.614381313323975, 1637626637.628351], "version": 0.2, "tvm_version": "0.8.dev0"}
{"input": ["cuda -keys=cuda,gpu -max_num_threads=1024 -thread_warp_size=32", "conv2d_nchw.cuda", [["TENSOR", [128, 128, 58, 58], "float32"], ["TENSOR", [128, 128, 3, 3], "float32"], 2, "VALID", 1, "float32"], {}], "config": {"index": 35668411, "code_hash": null, "entity": [["tile_f", "sp", [-1, 2, 2, 8]], ["tile_y", "sp", [-1, 1, 1, 14]], ["tile_x", "sp", [-1, 1, 1, 7]], ["tile_rc", "sp", [-1, 2]], ["tile_ry", "sp", [-1, 3]], ["tile_rx", "sp", [-1, 3]], ["auto_unroll_max_step", "ot", 1500], ["unroll_explicit", "ot", 1]]}, "result": [[2.468200945], 0, 17.322139978408813, 1637626652.4956534], "version": 0.2, "tvm_version": "0.8.dev0"}
{"input": ["cuda -keys=cuda,gpu -max_num_threads=1024 -thread_warp_size=32", "conv2d_nchw.cuda", [["TENSOR", [128, 128, 58, 58], "float32"], ["TENSOR", [128, 128, 3, 3], "float32"], 2, "VALID", 1, "float32"], {}], "config": {"index": 10814611, "code_hash": null, "entity": [["tile_f", "sp", [-1, 2, 2, 8]], ["tile_y", "sp", [-1, 2, 1, 1]], ["tile_x", "sp", [-1, 2, 7, 1]], ["tile_rc", "sp", [-1, 1]], ["tile_ry", "sp", [-1, 3]], ["tile_rx", "sp", [-1, 3]], ["auto_unroll_max_step", "ot", 512], ["unroll_explicit", "ot", 0]]}, "result": [[0.009693740272727272], 0, 2.6715009212493896, 1637626655.7385173], "version": 0.2, "tvm_version": "0.8.dev0"}
{"input": ["cuda -keys=cuda,gpu -max_num_threads=1024 -thread_warp_size=32", "conv2d_nchw.cuda", [["TENSOR", [128, 128, 58, 58], "float32"], ["TENSOR", [128, 128, 3, 3], "float32"], 2, "VALID", 1, "float32"], {}], "config": {"index": 25489276, "code_hash": null, "entity": [["tile_f", "sp", [-1, 2, 4, 4]], ["tile_y", "sp", [-1, 1, 4, 1]], ["tile_x", "sp", [-1, 1, 1, 7]], ["tile_rc", "sp", [-1, 16]], ["tile_ry", "sp", [-1, 1]], ["tile_rx", "sp", [-1, 1]], ["auto_unroll_max_step", "ot", 512], ["unroll_explicit", "ot", 1]]}, "result": [[0.019876987], 0, 2.3640859127044678, 1637626660.6929188], "version": 0.2, "tvm_version": "0.8.dev0"}
{"input": ["cuda -keys=cuda,gpu -max_num_threads=1024 -thread_warp_size=32", "conv2d_nchw.cuda", [["TENSOR", [128, 128, 58, 58], "float32"], ["TENSOR", [128, 128, 3, 3], "float32"], 2, "VALID", 1, "float32"], {}], "config": {"index": 28372384, "code_hash": null, "entity": [["tile_f", "sp", [-1, 1, 1, 4]], ["tile_y", "sp", [-1, 1, 1, 14]], ["tile_x", "sp", [-1, 1, 1, 7]], ["tile_rc", "sp", [-1, 8]], ["tile_ry", "sp", [-1, 1]], ["tile_rx", "sp", [-1, 3]], ["auto_unroll_max_step", "ot", 512], ["unroll_explicit", "ot", 1]]}, "result": [[2.12090555025], 0, 13.792564392089844, 1637626673.862666], "version": 0.2, "tvm_version": "0.8.dev0"}
{"input": ["cuda -keys=cuda,gpu -max_num_threads=1024 -thread_warp_size=32", "conv2d_nchw.cuda", [["TENSOR", [128, 128, 58, 58], "float32"], ["TENSOR", [128, 128, 3, 3], "float32"], 2, "VALID", 1, "float32"], {}], "config": {"index": 19731664, "code_hash": null, "entity": [["tile_f", "sp", [-1, 1, 1, 4]], ["tile_y", "sp", [-1, 1, 1, 7]], ["tile_x", "sp", [-1, 1, 1, 7]], ["tile_rc", "sp", [-1, 64]], ["tile_ry", "sp", [-1, 1]], ["tile_rx", "sp", [-1, 1]], ["auto_unroll_max_step", "ot", 0], ["unroll_explicit", "ot", 1]]}, "result": [[4.108348043], 0, 22.703426837921143, 1637626696.927885], "version": 0.2, "tvm_version": "0.8.dev0"}
{"input": ["cuda -keys=cuda,gpu -max_num_threads=1024 -thread_warp_size=32", "conv2d_nchw.cuda", [["TENSOR", [128, 128, 58, 58], "float32"], ["TENSOR", [128, 128, 3, 3], "float32"], 2, "VALID", 1, "float32"], {}], "config": {"index": 432796, "code_hash": null, "entity": [["tile_f", "sp", [-1, 2, 4, 4]], ["tile_y", "sp", [-1, 1, 2, 1]], ["tile_x", "sp", [-1, 1, 4, 1]], ["tile_rc", "sp", [-1, 4]], ["tile_ry", "sp", [-1, 1]], ["tile_rx", "sp", [-1, 1]], ["auto_unroll_max_step", "ot", 0], ["unroll_explicit", "ot", 0]]}, "result": [[0.0258558645], 0, 1.8549330234527588, 1637626699.3068368], "version": 0.2, "tvm_version": "0.8.dev0"}
{"input": ["cuda -keys=cuda,gpu -max_num_threads=1024 -thread_warp_size=32", "conv2d_nchw.cuda", [["TENSOR", [128, 128, 58, 58], "float32"], ["TENSOR", [128, 128, 3, 3], "float32"], 2, "VALID", 1, "float32"], {}], "config": {"index": 16245470, "code_hash": null, "entity": [["tile_f", "sp", [-1, 1, 1, 32]], ["tile_y", "sp", [-1, 1, 1, 2]], ["tile_x", "sp", [-1, 1, 7, 2]], ["tile_rc", "sp", [-1, 16]], ["tile_ry", "sp", [-1, 1]], ["tile_rx", "sp", [-1, 3]], ["auto_unroll_max_step", "ot", 1500], ["unroll_explicit", "ot", 0]]}, "result": [[0.207794614], 0, 21.958736896514893, 1637626712.432789], "version": 0.2, "tvm_version": "0.8.dev0"}
{"input": ["cuda -keys=cuda,gpu -max_num_threads=1024 -thread_warp_size=32", "conv2d_nchw.cuda", [["TENSOR", [128, 128, 58, 58], "float32"], ["TENSOR", [128, 128, 3, 3], "float32"], 2, "VALID", 1, "float32"], {}], "config": {"index": 29681116, "code_hash": null, "entity": [["tile_f", "sp", [-1, 2, 4, 4]], ["tile_y", "sp", [-1, 1, 2, 2]], ["tile_x", "sp", [-1, 7, 2, 2]], ["tile_rc", "sp", [-1, 4]], ["tile_ry", "sp", [-1, 3]], ["tile_rx", "sp", [-1, 3]], ["auto_unroll_max_step", "ot", 512], ["unroll_explicit", "ot", 1]]}, "result": [[0.02842170475], 0, 3.447396755218506, 1637626714.718754], "version": 0.2, "tvm_version": "0.8.dev0"}
{"input": ["cuda -keys=cuda,gpu -max_num_threads=1024 -thread_warp_size=32", "conv2d_nchw.cuda", [["TENSOR", [128, 128, 58, 58], "float32"], ["TENSOR", [128, 128, 3, 3], "float32"], 2, "VALID", 1, "float32"], {}], "config": {"index": 5385927, "code_hash": null, "entity": [["tile_f", "sp", [-1, 4, 1, 8]], ["tile_y", "sp", [-1, 4, 1, 1]], ["tile_x", "sp", [-1, 4, 1, 1]], ["tile_rc", "sp", [-1, 16]], ["tile_ry", "sp", [-1, 3]], ["tile_rx", "sp", [-1, 3]], ["auto_unroll_max_step", "ot", 0], ["unroll_explicit", "ot", 0]]}, "result": [[7.43804981825], 0, 39.57833981513977, 1637626755.1419055], "version": 0.2, "tvm_version": "0.8.dev0"}
{"input": ["cuda -keys=cuda,gpu -max_num_threads=1024 -thread_warp_size=32", "conv2d_nchw.cuda", [["TENSOR", [128, 128, 58, 58], "float32"], ["TENSOR", [128, 128, 3, 3], "float32"], 2, "VALID", 1, "float32"], {}], "config": {"index": 15577198, "code_hash": null, "entity": [["tile_f", "sp", [-1, 1, 2, 64]], ["tile_y", "sp", [-1, 14, 2, 1]], ["tile_x", "sp", [-1, 28, 1, 1]], ["tile_rc", "sp", [-1, 2]], ["tile_ry", "sp", [-1, 1]], ["tile_rx", "sp", [-1, 3]], ["auto_unroll_max_step", "ot", 1500], ["unroll_explicit", "ot", 0]]}, "result": [[1.8751650662500001], 0, 13.783795356750488, 1637626767.1587448], "version": 0.2, "tvm_version": "0.8.dev0"}
{"input": ["cuda -keys=cuda,gpu -max_num_threads=1024 -thread_warp_size=32", "conv2d_nchw.cuda", [["TENSOR", [128, 128, 58, 58], "float32"], ["TENSOR", [128, 128, 3, 3], "float32"], 2, "VALID", 1, "float32"], {}], "config": {"index": 6158126, "code_hash": null, "entity": [["tile_f", "sp", [-1, 2, 1, 8]], ["tile_y", "sp", [-1, 2, 1, 14]], ["tile_x", "sp", [-1, 4, 1, 1]], ["tile_rc", "sp", [-1, 1]], ["tile_ry", "sp", [-1, 1]], ["tile_rx", "sp", [-1, 1]], ["auto_unroll_max_step", "ot", 512], ["unroll_explicit", "ot", 0]]}, "result": [[5.524387217499999], 0, 30.73180627822876, 1637626797.1287816], "version": 0.2, "tvm_version": "0.8.dev0"}
{"input": ["cuda -keys=cuda,gpu -max_num_threads=1024 -thread_warp_size=32", "conv2d_nchw.cuda", [["TENSOR", [128, 128, 58, 58], "float32"], ["TENSOR", [128, 128, 3, 3], "float32"], 2, "VALID", 1, "float32"], {}], "config": {"index": 33307153, "code_hash": null, "entity": [["tile_f", "sp", [-1, 8, 2, 4]], ["tile_y", "sp", [-1, 1, 1, 28]], ["tile_x", "sp", [-1, 1, 1, 2]], ["tile_rc", "sp", [-1, 32]], ["tile_ry", "sp", [-1, 3]], ["tile_rx", "sp", [-1, 1]], ["auto_unroll_max_step", "ot", 1500], ["unroll_explicit", "ot", 1]]}, "result": [[2.1341566172500004], 0, 16.528022527694702, 1637626821.211058], "version": 0.2, "tvm_version": "0.8.dev0"}
{"input": ["cuda -keys=cuda,gpu -max_num_threads=1024 -thread_warp_size=32", "conv2d_nchw.cuda", [["TENSOR", [128, 128, 58, 58], "float32"], ["TENSOR", [128, 128, 3, 3], "float32"], 2, "VALID", 1, "float32"], {}], "config": {"index": 33843198, "code_hash": null, "entity": [["tile_f", "sp", [-1, 8, 4, 4]], ["tile_y", "sp", [-1, 1, 14, 2]], ["tile_x", "sp", [-1, 1, 4, 1]], ["tile_rc", "sp", [-1, 1]], ["tile_ry", "sp", [-1, 1]], ["tile_rx", "sp", [-1, 3]], ["auto_unroll_max_step", "ot", 1500], ["unroll_explicit", "ot", 1]]}, "result": [[0.005993360529411765], 0, 2.553208827972412, 1637626822.968727], "version": 0.2, "tvm_version": "0.8.dev0"}
{"input": ["cuda -keys=cuda,gpu -max_num_threads=1024 -thread_warp_size=32", "conv2d_nchw.cuda", [["TENSOR", [128, 128, 58, 58], "float32"], ["TENSOR", [128, 128, 3, 3], "float32"], 2, "VALID", 1, "float32"], {}], "config": {"index": 9825420, "code_hash": null, "entity": [["tile_f", "sp", [-1, 4, 16, 2]], ["tile_y", "sp", [-1, 1, 2, 14]], ["tile_x", "sp", [-1, 1, 2, 1]], ["tile_rc", "sp", [-1, 8]], ["tile_ry", "sp", [-1, 1]], ["tile_rx", "sp", [-1, 3]], ["auto_unroll_max_step", "ot", 512], ["unroll_explicit", "ot", 0]]}, "result": [[0.00808602476923077], 0, 2.2963380813598633, 1637626826.9335], "version": 0.2, "tvm_version": "0.8.dev0"}
{"input": ["cuda -keys=cuda,gpu -max_num_threads=1024 -thread_warp_size=32", "conv2d_nchw.cuda", [["TENSOR", [128, 128, 58, 58], "float32"], ["TENSOR", [128, 128, 3, 3], "float32"], 2, "VALID", 1, "float32"], {}], "config": {"index": 14079630, "code_hash": null, "entity": [["tile_f", "sp", [-1, 1, 32, 1]], ["tile_y", "sp", [-1, 1, 4, 1]], ["tile_x", "sp", [-1, 2, 7, 1]], ["tile_rc", "sp", [-1, 2]], ["tile_ry", "sp", [-1, 3]], ["tile_rx", "sp", [-1, 1]], ["auto_unroll_max_step", "ot", 1500], ["unroll_explicit", "ot", 0]]}, "result": [[0.01631173185714286], 0, 1.8762319087982178, 1637626829.31852], "version": 0.2, "tvm_version": "0.8.dev0"}
{"input": ["cuda -keys=cuda,gpu -max_num_threads=1024 -thread_warp_size=32", "conv2d_nchw.cuda", [["TENSOR", [128, 128, 58, 58], "float32"], ["TENSOR", [128, 128, 3, 3], "float32"], 2, "VALID", 1, "float32"], {}], "config": {"index": 7722645, "code_hash": null, "entity": [["tile_f", "sp", [-1, 4, 2, 2]], ["tile_y", "sp", [-1, 1, 4, 7]], ["tile_x", "sp", [-1, 7, 2, 1]], ["tile_rc", "sp", [-1, 1]], ["tile_ry", "sp", [-1, 3]], ["tile_rx", "sp", [-1, 1]], ["auto_unroll_max_step", "ot", 512], ["unroll_explicit", "ot", 0]]}, "result": [[0.20151808475000002], 0, 4.546558141708374, 1637626832.655312], "version": 0.2, "tvm_version": "0.8.dev0"}
{"input": ["cuda -keys=cuda,gpu -max_num_threads=1024 -thread_warp_size=32", "conv2d_nchw.cuda", [["TENSOR", [128, 128, 58, 58], "float32"], ["TENSOR", [128, 128, 3, 3], "float32"], 2, "VALID", 1, "float32"], {}], "config": {"index": 34019853, "code_hash": null, "entity": [["tile_f", "sp", [-1, 8, 2, 8]], ["tile_y", "sp", [-1, 1, 1, 2]], ["tile_x", "sp", [-1, 2, 2, 1]], ["tile_rc", "sp", [-1, 2]], ["tile_ry", "sp", [-1, 1]], ["tile_rx", "sp", [-1, 3]], ["auto_unroll_max_step", "ot", 1500], ["unroll_explicit", "ot", 1]]}, "result": [[0.1401714895], 0, 4.881396532058716, 1637626836.4183488], "version": 0.2, "tvm_version": "0.8.dev0"}
{"input": ["cuda -keys=cuda,gpu -max_num_threads=1024 -thread_warp_size=32", "conv2d_nchw.cuda", [["TENSOR", [128, 128, 58, 58], "float32"], ["TENSOR", [128, 128, 3, 3], "float32"], 2, "VALID", 1, "float32"], {}], "config": {"index": 5470882, "code_hash": null, "entity": [["tile_f", "sp", [-1, 1, 16, 4]], ["tile_y", "sp", [-1, 1, 1, 7]], ["tile_x", "sp", [-1, 2, 1, 2]], ["tile_rc", "sp", [-1, 16]], ["tile_ry", "sp", [-1, 3]], ["tile_rx", "sp", [-1, 3]], ["auto_unroll_max_step", "ot", 0], ["unroll_explicit", "ot", 0]]}, "result": [[0.0250495715], 0, 2.3905797004699707, 1637626839.6066635], "version": 0.2, "tvm_version": "0.8.dev0"}
{"input": ["cuda -keys=cuda,gpu -max_num_threads=1024 -thread_warp_size=32", "conv2d_nchw.cuda", [["TENSOR", [128, 128, 58, 58], "float32"], ["TENSOR", [128, 128, 3, 3], "float32"], 2, "VALID", 1, "float32"], {}], "config": {"index": 20320762, "code_hash": null, "entity": [["tile_f", "sp", [-1, 1, 16, 4]], ["tile_y", "sp", [-1, 2, 1, 2]], ["tile_x", "sp", [-1, 1, 2, 7]], ["tile_rc", "sp", [-1, 2]], ["tile_ry", "sp", [-1, 3]], ["tile_rx", "sp", [-1, 1]], ["auto_unroll_max_step", "ot", 0], ["unroll_explicit", "ot", 1]]}, "result": [[0.006115274235294117], 0, 2.5617575645446777, 1637626841.8545303], "version": 0.2, "tvm_version": "0.8.dev0"}
{"input": ["cuda -keys=cuda,gpu -max_num_threads=1024 -thread_warp_size=32", "conv2d_nchw.cuda", [["TENSOR", [128, 128, 58, 58], "float32"], ["TENSOR", [128, 128, 3, 3], "float32"], 2, "VALID", 1, "float32"], {}], "config": {"index": 26452708, "code_hash": null, "entity": [["tile_f", "sp", [-1, 4, 16, 1]], ["tile_y", "sp", [-1, 1, 1, 28]], ["tile_x", "sp", [-1, 1, 1, 7]], ["tile_rc", "sp", [-1, 2]], ["tile_ry", "sp", [-1, 3]], ["tile_rx", "sp", [-1, 1]], ["auto_unroll_max_step", "ot", 512], ["unroll_explicit", "ot", 1]]}, "result": [[0.26316080075000003], 0, 4.64712119102478, 1637626847.1896179], "version": 0.2, "tvm_version": "0.8.dev0"}
{"input": ["cuda -keys=cuda,gpu -max_num_threads=1024 -thread_warp_size=32", "conv2d_nchw.cuda", [["TENSOR", [128, 128, 58, 58], "float32"], ["TENSOR", [128, 128, 3, 3], "float32"], 2, "VALID", 1, "float32"], {}], "config": {"index": 12354820, "code_hash": null, "entity": [["tile_f", "sp", [-1, 1, 1, 16]], ["tile_y", "sp", [-1, 1, 1, 14]], ["tile_x", "sp", [-1, 2, 7, 1]], ["tile_rc", "sp", [-1, 1]], ["tile_ry", "sp", [-1, 1]], ["tile_rx", "sp", [-1, 1]], ["auto_unroll_max_step", "ot", 1500], ["unroll_explicit", "ot", 0]]}, "result": [[1.6559031545], 0, 11.946787357330322, 1637626857.837563], "version": 0.2, "tvm_version": "0.8.dev0"}
{"input": ["cuda -keys=cuda,gpu -max_num_threads=1024 -thread_warp_size=32", "conv2d_nchw.cuda", [["TENSOR", [128, 128, 58, 58], "float32"], ["TENSOR", [128, 128, 3, 3], "float32"], 2, "VALID", 1, "float32"], {}], "config": {"index": 27917035, "code_hash": null, "entity": [["tile_f", "sp", [-1, 1, 4, 32]], ["tile_y", "sp", [-1, 2, 1, 1]], ["tile_x", "sp", [-1, 2, 14, 1]], ["tile_rc", "sp", [-1, 2]], ["tile_ry", "sp", [-1, 1]], ["tile_rx", "sp", [-1, 3]], ["auto_unroll_max_step", "ot", 512], ["unroll_explicit", "ot", 1]]}, "result": [[0.0066468866875], 0, 2.466428756713867, 1637626862.977102], "version": 0.2, "tvm_version": "0.8.dev0"}
{"input": ["cuda -keys=cuda,gpu -max_num_threads=1024 -thread_warp_size=32", "conv2d_nchw.cuda", [["TENSOR", [128, 128, 58, 58], "float32"], ["TENSOR", [128, 128, 3, 3], "float32"], 2, "VALID", 1, "float32"], {}], "config": {"index": 15987733, "code_hash": null, "entity": [["tile_f", "sp", [-1, 32, 2, 1]], ["tile_y", "sp", [-1, 2, 1, 7]], ["tile_x", "sp", [-1, 1, 4, 1]], ["tile_rc", "sp", [-1, 8]], ["tile_ry", "sp", [-1, 1]], ["tile_rx", "sp", [-1, 3]], ["auto_unroll_max_step", "ot", 1500], ["unroll_explicit", "ot", 0]]}, "result": [[0.45083828375], 0, 6.292637586593628, 1637626867.4364774], "version": 0.2, "tvm_version": "0.8.dev0"}
{"input": ["cuda -keys=cuda,gpu -max_num_threads=1024 -thread_warp_size=32", "conv2d_nchw.cuda", [["TENSOR", [128, 128, 58, 58], "float32"], ["TENSOR", [128, 128, 3, 3], "float32"], 2, "VALID", 1, "float32"], {}], "config": {"index": 22762456, "code_hash": null, "entity": [["tile_f", "sp", [-1, 2, 4, 1]], ["tile_y", "sp", [-1, 2, 2, 1]], ["tile_x", "sp", [-1, 1, 2, 2]], ["tile_rc", "sp", [-1, 64]], ["tile_ry", "sp", [-1, 1]], ["tile_rx", "sp", [-1, 3]], ["auto_unroll_max_step", "ot", 0], ["unroll_explicit", "ot", 1]]}, "result": [[0.03161918075], 0, 2.1527464389801025, 1637626869.2892256], "version": 0.2, "tvm_version": "0.8.dev0"}
{"input": ["cuda -keys=cuda,gpu -max_num_threads=1024 -thread_warp_size=32", "conv2d_nchw.cuda", [["TENSOR", [128, 128, 58, 58], "float32"], ["TENSOR", [128, 128, 3, 3], "float32"], 2, "VALID", 1, "float32"], {}], "config": {"index": 21891407, "code_hash": null, "entity": [["tile_f", "sp", [-1, 16, 2, 2]], ["tile_y", "sp", [-1, 7, 1, 4]], ["tile_x", "sp", [-1, 1, 1, 1]], ["tile_rc", "sp", [-1, 4]], ["tile_ry", "sp", [-1, 1]], ["tile_rx", "sp", [-1, 3]], ["auto_unroll_max_step", "ot", 0], ["unroll_explicit", "ot", 1]]}, "result": [[5.009812921], 0, 27.6729576587677, 1637626896.1888514], "version": 0.2, "tvm_version": "0.8.dev0"}
{"input": ["cuda -keys=cuda,gpu -max_num_threads=1024 -thread_warp_size=32", "conv2d_nchw.cuda", [["TENSOR", [128, 128, 58, 58], "float32"], ["TENSOR", [128, 128, 3, 3], "float32"], 2, "VALID", 1, "float32"], {}], "config": {"index": 26526595, "code_hash": null, "entity": [["tile_f", "sp", [-1, 1, 4, 32]], ["tile_y", "sp", [-1, 4, 7, 1]], ["tile_x", "sp", [-1, 1, 2, 1]], ["tile_rc", "sp", [-1, 4]], ["tile_ry", "sp", [-1, 3]], ["tile_rx", "sp", [-1, 1]], ["auto_unroll_max_step", "ot", 512], ["unroll_explicit", "ot", 1]]}, "result": [[0.00644185625], 0, 2.7103428840637207, 1637626898.1081395], "version": 0.2, "tvm_version": "0.8.dev0"}
{"input": ["cuda -keys=cuda,gpu -max_num_threads=1024 -thread_warp_size=32", "conv2d_nchw.cuda", [["TENSOR", [128, 128, 58, 58], "float32"], ["TENSOR", [128, 128, 3, 3], "float32"], 2, "VALID", 1, "float32"], {}], "config": {"index": 13397553, "code_hash": null, "entity": [["tile_f", "sp", [-1, 1, 64, 1]], ["tile_y", "sp", [-1, 1, 2, 1]], ["tile_x", "sp", [-1, 2, 1, 7]], ["tile_rc", "sp", [-1, 32]], ["tile_ry", "sp", [-1, 1]], ["tile_rx", "sp", [-1, 1]], ["auto_unroll_max_step", "ot", 1500], ["unroll_explicit", "ot", 0]]}, "result": [[0.0173235285], 0, 2.922823429107666, 1637626900.1374676], "version": 0.2, "tvm_version": "0.8.dev0"}
{"input": ["cuda -keys=cuda,gpu -max_num_threads=1024 -thread_warp_size=32", "conv2d_nchw.cuda", [["TENSOR", [128, 128, 58, 58], "float32"], ["TENSOR", [128, 128, 3, 3], "float32"], 2, "VALID", 1, "float32"], {}], "config": {"index": 21555355, "code_hash": null, "entity": [["tile_f", "sp", [-1, 1, 4, 32]], ["tile_y", "sp", [-1, 1, 1, 4]], ["tile_x", "sp", [-1, 1, 4, 1]], ["tile_rc", "sp", [-1, 1]], ["tile_ry", "sp", [-1, 1]], ["tile_rx", "sp", [-1, 3]], ["auto_unroll_max_step", "ot", 0], ["unroll_explicit", "ot", 1]]}, "result": [[0.019594003666666665], 0, 2.1840853691101074, 1637626901.97151], "version": 0.2, "tvm_version": "0.8.dev0"}
{"input": ["cuda -keys=cuda,gpu -max_num_threads=1024 -thread_warp_size=32", "conv2d_nchw.cuda", [["TENSOR", [128, 128, 58, 58], "float32"], ["TENSOR", [128, 128, 3, 3], "float32"], 2, "VALID", 1, "float32"], {}], "config": {"index": 20517651, "code_hash": null, "entity": [["tile_f", "sp", [-1, 4, 4, 2]], ["tile_y", "sp", [-1, 7, 1, 2]], ["tile_x", "sp", [-1, 2, 2, 7]], ["tile_rc", "sp", [-1, 4]], ["tile_ry", "sp", [-1, 3]], ["tile_rx", "sp", [-1, 1]], ["auto_unroll_max_step", "ot", 0], ["unroll_explicit", "ot", 1]]}, "result": [[0.88635206675], 0, 7.301321506500244, 1637626908.2324808], "version": 0.2, "tvm_version": "0.8.dev0"}
{"input": ["cuda -keys=cuda,gpu -max_num_threads=1024 -thread_warp_size=32", "conv2d_nchw.cuda", [["TENSOR", [128, 128, 58, 58], "float32"], ["TENSOR", [128, 128, 3, 3], "float32"], 2, "VALID", 1, "float32"], {}], "config": {"index": 7134806, "code_hash": null, "entity": [["tile_f", "sp", [-1, 2, 1, 8]], ["tile_y", "sp", [-1, 2, 14, 1]], ["tile_x", "sp", [-1, 1, 2, 1]], ["tile_rc", "sp", [-1, 32]], ["tile_ry", "sp", [-1, 1]], ["tile_rx", "sp", [-1, 1]], ["auto_unroll_max_step", "ot", 512], ["unroll_explicit", "ot", 0]]}, "result": [[0.069990692], 0, 3.802929401397705, 1637626910.6223881], "version": 0.2, "tvm_version": "0.8.dev0"}
{"input": ["cuda -keys=cuda,gpu -max_num_threads=1024 -thread_warp_size=32", "conv2d_nchw.cuda", [["TENSOR", [128, 128, 58, 58], "float32"], ["TENSOR", [128, 128, 3, 3], "float32"], 2, "VALID", 1, "float32"], {}], "config": {"index": 19426073, "code_hash": null, "entity": [["tile_f", "sp", [-1, 1, 2, 32]], ["tile_y", "sp", [-1, 7, 1, 1]], ["tile_x", "sp", [-1, 2, 2, 1]], ["tile_rc", "sp", [-1, 32]], ["tile_ry", "sp", [-1, 1]], ["tile_rx", "sp", [-1, 1]], ["auto_unroll_max_step", "ot", 0], ["unroll_explicit", "ot", 1]]}, "result": [[1.37971296075], 0, 9.029782056808472, 1637626919.1988955], "version": 0.2, "tvm_version": "0.8.dev0"}
{"input": ["cuda -keys=cuda,gpu -max_num_threads=1024 -thread_warp_size=32", "conv2d_nchw.cuda", [["TENSOR", [128, 128, 58, 58], "float32"], ["TENSOR", [128, 128, 3, 3], "float32"], 2, "VALID", 1, "float32"], {}], "config": {"index": 29853400, "code_hash": null, "entity": [["tile_f", "sp", [-1, 16, 1, 2]], ["tile_y", "sp", [-1, 1, 1, 2]], ["tile_x", "sp", [-1, 2, 1, 2]], ["tile_rc", "sp", [-1, 8]], ["tile_ry", "sp", [-1, 3]], ["tile_rx", "sp", [-1, 3]], ["auto_unroll_max_step", "ot", 512], ["unroll_explicit", "ot", 1]]}, "result": [[0.8875405952500001], 0, 8.257701873779297, 1637626926.1095908], "version": 0.2, "tvm_version": "0.8.dev0"}
{"input": ["cuda -keys=cuda,gpu -max_num_threads=1024 -thread_warp_size=32", "conv2d_nchw.cuda", [["TENSOR", [128, 128, 58, 58], "float32"], ["TENSOR", [128, 128, 3, 3], "float32"], 2, "VALID", 1, "float32"], {}], "config": {"index": 32757617, "code_hash": null, "entity": [["tile_f", "sp", [-1, 4, 4, 1]], ["tile_y", "sp", [-1, 7, 1, 2]], ["tile_x", "sp", [-1, 1, 7, 2]], ["tile_rc", "sp", [-1, 4]], ["tile_ry", "sp", [-1, 3]], ["tile_rx", "sp", [-1, 1]], ["auto_unroll_max_step", "ot", 1500], ["unroll_explicit", "ot", 1]]}, "result": [[0.013607414125], 0, 4.3377907276153564, 1637626928.1651924], "version": 0.2, "tvm_version": "0.8.dev0"}
{"input": ["cuda -keys=cuda,gpu -max_num_threads=1024 -thread_warp_size=32", "conv2d_nchw.cuda", [["TENSOR", [128, 128, 58, 58], "float32"], ["TENSOR", [128, 128, 3, 3], "float32"], 2, "VALID", 1, "float32"], {}], "config": {"index": 18778000, "code_hash": null, "entity": [["tile_f", "sp", [-1, 16, 1, 2]], ["tile_y", "sp", [-1, 7, 1, 1]], ["tile_x", "sp", [-1, 4, 1, 7]], ["tile_rc", "sp", [-1, 2]], ["tile_ry", "sp", [-1, 1]], ["tile_rx", "sp", [-1, 1]], ["auto_unroll_max_step", "ot", 0], ["unroll_explicit", "ot", 1]]}, "result": [[8.06163531825], 0, 44.23494601249695, 1637626970.3122852], "version": 0.2, "tvm_version": "0.8.dev0"}
{"input": ["cuda -keys=cuda,gpu -max_num_threads=1024 -thread_warp_size=32", "conv2d_nchw.cuda", [["TENSOR", [128, 128, 58, 58], "float32"], ["TENSOR", [128, 128, 3, 3], "float32"], 2, "VALID", 1, "float32"], {}], "config": {"index": 21211560, "code_hash": null, "entity": [["tile_f", "sp", [-1, 1, 1, 1]], ["tile_y", "sp", [-1, 7, 1, 1]], ["tile_x", "sp", [-1, 2, 1, 2]], ["tile_rc", "sp", [-1, 64]], ["tile_ry", "sp", [-1, 3]], ["tile_rx", "sp", [-1, 1]], ["auto_unroll_max_step", "ot", 0], ["unroll_explicit", "ot", 1]]}, "result": [[7.127562987999999], 0, 37.645485162734985, 1637627007.6305978], "version": 0.2, "tvm_version": "0.8.dev0"}
{"input": ["cuda -keys=cuda,gpu -max_num_threads=1024 -thread_warp_size=32", "conv2d_nchw.cuda", [["TENSOR", [128, 128, 58, 58], "float32"], ["TENSOR", [128, 128, 3, 3], "float32"], 2, "VALID", 1, "float32"], {}], "config": {"index": 16968469, "code_hash": null, "entity": [["tile_f", "sp", [-1, 1, 8, 16]], ["tile_y", "sp", [-1, 7, 1, 1]], ["tile_x", "sp", [-1, 1, 14, 1]], ["tile_rc", "sp", [-1, 1]], ["tile_ry", "sp", [-1, 3]], ["tile_rx", "sp", [-1, 3]], ["auto_unroll_max_step", "ot", 1500], ["unroll_explicit", "ot", 0]]}, "result": [[0.00509798285], 0, 2.0759761333465576, 1637627100.7284846], "version": 0.2, "tvm_version": "0.8.dev0"}
{"input": ["cuda -keys=cuda,gpu -max_num_threads=1024 -thread_warp_size=32", "conv2d_nchw.cuda", [["TENSOR", [128, 128, 58, 58], "float32"], ["TENSOR", [128, 128, 3, 3], "float32"], 2, "VALID", 1, "float32"], {}], "config": {"index": 10812109, "code_hash": null, "entity": [["tile_f", "sp", [-1, 1, 8, 16]], ["tile_y", "sp", [-1, 7, 1, 2]], ["tile_x", "sp", [-1, 1, 7, 1]], ["tile_rc", "sp", [-1, 1]], ["tile_ry", "sp", [-1, 3]], ["tile_rx", "sp", [-1, 3]], ["auto_unroll_max_step", "ot", 512], ["unroll_explicit", "ot", 0]]}, "result": [[0.0059077062941176465], 0, 2.1845192909240723, 1637627102.4219837], "version": 0.2, "tvm_version": "0.8.dev0"}
{"input": ["cuda -keys=cuda,gpu -max_num_threads=1024 -thread_warp_size=32", "conv2d_nchw.cuda", [["TENSOR", [128, 128, 58, 58], "float32"], ["TENSOR", [128, 128, 3, 3], "float32"], 2, "VALID", 1, "float32"], {}], "config": {"index": 35400469, "code_hash": null, "entity": [["tile_f", "sp", [-1, 1, 8, 16]], ["tile_y", "sp", [-1, 7, 1, 1]], ["tile_x", "sp", [-1, 1, 14, 1]], ["tile_rc", "sp", [-1, 1]], ["tile_ry", "sp", [-1, 3]], ["tile_rx", "sp", [-1, 3]], ["auto_unroll_max_step", "ot", 1500], ["unroll_explicit", "ot", 1]]}, "result": [[0.004612144227272728], 0, 3.1056711673736572, 1637627104.1356044], "version": 0.2, "tvm_version": "0.8.dev0"}
{"input": ["cuda -keys=cuda,gpu -max_num_threads=1024 -thread_warp_size=32", "conv2d_nchw.cuda", [["TENSOR", [128, 128, 58, 58], "float32"], ["TENSOR", [128, 128, 3, 3], "float32"], 2, "VALID", 1, "float32"], {}], "config": {"index": 35388109, "code_hash": null, "entity": [["tile_f", "sp", [-1, 1, 8, 16]], ["tile_y", "sp", [-1, 7, 1, 2]], ["tile_x", "sp", [-1, 1, 7, 1]], ["tile_rc", "sp", [-1, 1]], ["tile_ry", "sp", [-1, 3]], ["tile_rx", "sp", [-1, 3]], ["auto_unroll_max_step", "ot", 1500], ["unroll_explicit", "ot", 1]]}, "result": [[0.0057296399444444444], 0, 3.185387372970581, 1637627106.1328523], "version": 0.2, "tvm_version": "0.8.dev0"}
{"input": ["cuda -keys=cuda,gpu -max_num_threads=1024 -thread_warp_size=32", "conv2d_nchw.cuda", [["TENSOR", [128, 128, 58, 58], "float32"], ["TENSOR", [128, 128, 3, 3], "float32"], 2, "VALID", 1, "float32"], {}], "config": {"index": 23100109, "code_hash": null, "entity": [["tile_f", "sp", [-1, 1, 8, 16]], ["tile_y", "sp", [-1, 7, 1, 2]], ["tile_x", "sp", [-1, 1, 7, 1]], ["tile_rc", "sp", [-1, 1]], ["tile_ry", "sp", [-1, 3]], ["tile_rx", "sp", [-1, 3]], ["auto_unroll_max_step", "ot", 0], ["unroll_explicit", "ot", 1]]}, "result": [[0.007072168133333333], 0, 2.5419270992279053, 1637627108.2237887], "version": 0.2, "tvm_version": "0.8.dev0"}
{"input": ["cuda -keys=cuda,gpu -max_num_threads=1024 -thread_warp_size=32", "conv2d_nchw.cuda", [["TENSOR", [128, 128, 58, 58], "float32"], ["TENSOR", [128, 128, 3, 3], "float32"], 2, "VALID", 1, "float32"], {}], "config": {"index": 29256469, "code_hash": null, "entity": [["tile_f", "sp", [-1, 1, 8, 16]], ["tile_y", "sp", [-1, 7, 1, 1]], ["tile_x", "sp", [-1, 1, 14, 1]], ["tile_rc", "sp", [-1, 1]], ["tile_ry", "sp", [-1, 3]], ["tile_rx", "sp", [-1, 3]], ["auto_unroll_max_step", "ot", 512], ["unroll_explicit", "ot", 1]]}, "result": [[0.004329833041666667], 0, 2.3763768672943115, 1637627109.960061], "version": 0.2, "tvm_version": "0.8.dev0"}
{"input": ["cuda -keys=cuda,gpu -max_num_threads=1024 -thread_warp_size=32", "conv2d_nchw.cuda", [["TENSOR", [128, 128, 58, 58], "float32"], ["TENSOR", [128, 128, 3, 3], "float32"], 2, "VALID", 1, "float32"], {}], "config": {"index": 16956109, "code_hash": null, "entity": [["tile_f", "sp", [-1, 1, 8, 16]], ["tile_y", "sp", [-1, 7, 1, 2]], ["tile_x", "sp", [-1, 1, 7, 1]], ["tile_rc", "sp", [-1, 1]], ["tile_ry", "sp", [-1, 3]], ["tile_rx", "sp", [-1, 3]], ["auto_unroll_max_step", "ot", 1500], ["unroll_explicit", "ot", 0]]}, "result": [[0.005820703611111111], 0, 2.186936378479004, 1637627111.6277354], "version": 0.2, "tvm_version": "0.8.dev0"}
{"input": ["cuda -keys=cuda,gpu -max_num_threads=1024 -thread_warp_size=32", "conv2d_nchw.cuda", [["TENSOR", [128, 128, 58, 58], "float32"], ["TENSOR", [128, 128, 3, 3], "float32"], 2, "VALID", 1, "float32"], {}], "config": {"index": 29244109, "code_hash": null, "entity": [["tile_f", "sp", [-1, 1, 8, 16]], ["tile_y", "sp", [-1, 7, 1, 2]], ["tile_x", "sp", [-1, 1, 7, 1]], ["tile_rc", "sp", [-1, 1]], ["tile_ry", "sp", [-1, 3]], ["tile_rx", "sp", [-1, 3]], ["auto_unroll_max_step", "ot", 512], ["unroll_explicit", "ot", 1]]}, "result": [[0.0049612468571428574], 0, 2.450587511062622, 1637627113.3155727], "version": 0.2, "tvm_version": "0.8.dev0"}
{"input": ["cuda -keys=cuda,gpu -max_num_threads=1024 -thread_warp_size=32", "conv2d_nchw.cuda", [["TENSOR", [128, 128, 58, 58], "float32"], ["TENSOR", [128, 128, 3, 3], "float32"], 2, "VALID", 1, "float32"], {}], "config": {"index": 4668109, "code_hash": null, "entity": [["tile_f", "sp", [-1, 1, 8, 16]], ["tile_y", "sp", [-1, 7, 1, 2]], ["tile_x", "sp", [-1, 1, 7, 1]], ["tile_rc", "sp", [-1, 1]], ["tile_ry", "sp", [-1, 3]], ["tile_rx", "sp", [-1, 3]], ["auto_unroll_max_step", "ot", 0], ["unroll_explicit", "ot", 0]]}, "result": [[0.007057508666666667], 0, 1.9062020778656006, 1637627114.767525], "version": 0.2, "tvm_version": "0.8.dev0"}
{"input": ["cuda -keys=cuda,gpu -max_num_threads=1024 -thread_warp_size=32", "conv2d_nchw.cuda", [["TENSOR", [128, 128, 58, 58], "float32"], ["TENSOR", [128, 128, 3, 3], "float32"], 2, "VALID", 1, "float32"], {}], "config": {"index": 23112469, "code_hash": null, "entity": [["tile_f", "sp", [-1, 1, 8, 16]], ["tile_y", "sp", [-1, 7, 1, 1]], ["tile_x", "sp", [-1, 1, 14, 1]], ["tile_rc", "sp", [-1, 1]], ["tile_ry", "sp", [-1, 3]], ["tile_rx", "sp", [-1, 3]], ["auto_unroll_max_step", "ot", 0], ["unroll_explicit", "ot", 1]]}, "result": [[0.0050085458], 0, 2.0609629154205322, 1637627116.4405465], "version": 0.2, "tvm_version": "0.8.dev0"}
{"input": ["cuda -keys=cuda,gpu -max_num_threads=1024 -thread_warp_size=32", "conv2d_nchw.cuda", [["TENSOR", [128, 128, 58, 58], "float32"], ["TENSOR", [128, 128, 3, 3], "float32"], 2, "VALID", 1, "float32"], {}], "config": {"index": 10824469, "code_hash": null, "entity": [["tile_f", "sp", [-1, 1, 8, 16]], ["tile_y", "sp", [-1, 7, 1, 1]], ["tile_x", "sp", [-1, 1, 14, 1]], ["tile_rc", "sp", [-1, 1]], ["tile_ry", "sp", [-1, 3]], ["tile_rx", "sp", [-1, 3]], ["auto_unroll_max_step", "ot", 512], ["unroll_explicit", "ot", 0]]}, "result": [[0.004992193523809523], 0, 2.0252346992492676, 1637627118.0019135], "version": 0.2, "tvm_version": "0.8.dev0"}
{"input": ["cuda -keys=cuda,gpu -max_num_threads=1024 -thread_warp_size=32", "conv2d_nchw.cuda", [["TENSOR", [128, 128, 58, 58], "float32"], ["TENSOR", [128, 128, 3, 3], "float32"], 2, "VALID", 1, "float32"], {}], "config": {"index": 27898910, "code_hash": null, "entity": [["tile_f", "sp", [-1, 1, 1, 32]], ["tile_y", "sp", [-1, 1, 4, 1]], ["tile_x", "sp", [-1, 1, 7, 1]], ["tile_rc", "sp", [-1, 2]], ["tile_ry", "sp", [-1, 1]], ["tile_rx", "sp", [-1, 3]], ["auto_unroll_max_step", "ot", 512], ["unroll_explicit", "ot", 1]]}, "result": [[0.008508037750000001], 0, 2.1131508350372314, 1637627119.6496816], "version": 0.2, "tvm_version": "0.8.dev0"}
{"input": ["cuda -keys=cuda,gpu -max_num_threads=1024 -thread_warp_size=32", "conv2d_nchw.cuda", [["TENSOR", [128, 128, 58, 58], "float32"], ["TENSOR", [128, 128, 3, 3], "float32"], 2, "VALID", 1, "float32"], {}], "config": {"index": 34042910, "code_hash": null, "entity": [["tile_f", "sp", [-1, 1, 1, 32]], ["tile_y", "sp", [-1, 1, 4, 1]], ["tile_x", "sp", [-1, 1, 7, 1]], ["tile_rc", "sp", [-1, 2]], ["tile_ry", "sp", [-1, 1]], ["tile_rx", "sp", [-1, 3]], ["auto_unroll_max_step", "ot", 1500], ["unroll_explicit", "ot", 1]]}, "result": [[0.008243860615384615], 0, 2.6271779537200928, 1637627121.3564906], "version": 0.2, "tvm_version": "0.8.dev0"}
{"input": ["cuda -keys=cuda,gpu -max_num_threads=1024 -thread_warp_size=32", "conv2d_nchw.cuda", [["TENSOR", [128, 128, 58, 58], "float32"], ["TENSOR", [128, 128, 3, 3], "float32"], 2, "VALID", 1, "float32"], {}], "config": {"index": 15610910, "code_hash": null, "entity": [["tile_f", "sp", [-1, 1, 1, 32]], ["tile_y", "sp", [-1, 1, 4, 1]], ["tile_x", "sp", [-1, 1, 7, 1]], ["tile_rc", "sp", [-1, 2]], ["tile_ry", "sp", [-1, 1]], ["tile_rx", "sp", [-1, 3]], ["auto_unroll_max_step", "ot", 1500], ["unroll_explicit", "ot", 0]]}, "result": [[0.00850502125], 0, 2.3648629188537598, 1637627123.0522907], "version": 0.2, "tvm_version": "0.8.dev0"}
{"input": ["cuda -keys=cuda,gpu -max_num_threads=1024 -thread_warp_size=32", "conv2d_nchw.cuda", [["TENSOR", [128, 128, 58, 58], "float32"], ["TENSOR", [128, 128, 3, 3], "float32"], 2, "VALID", 1, "float32"], {}], "config": {"index": 9466910, "code_hash": null, "entity": [["tile_f", "sp", [-1, 1, 1, 32]], ["tile_y", "sp", [-1, 1, 4, 1]], ["tile_x", "sp", [-1, 1, 7, 1]], ["tile_rc", "sp", [-1, 2]], ["tile_ry", "sp", [-1, 1]], ["tile_rx", "sp", [-1, 3]], ["auto_unroll_max_step", "ot", 512], ["unroll_explicit", "ot", 0]]}, "result": [[0.008232437923076923], 0, 2.1287147998809814, 1637627124.762555], "version": 0.2, "tvm_version": "0.8.dev0"}
{"input": ["cuda -keys=cuda,gpu -max_num_threads=1024 -thread_warp_size=32", "conv2d_nchw.cuda", [["TENSOR", [128, 128, 58, 58], "float32"], ["TENSOR", [128, 128, 3, 3], "float32"], 2, "VALID", 1, "float32"], {}], "config": {"index": 21754910, "code_hash": null, "entity": [["tile_f", "sp", [-1, 1, 1, 32]], ["tile_y", "sp", [-1, 1, 4, 1]], ["tile_x", "sp", [-1, 1, 7, 1]], ["tile_rc", "sp", [-1, 2]], ["tile_ry", "sp", [-1, 1]], ["tile_rx", "sp", [-1, 3]], ["auto_unroll_max_step", "ot", 0], ["unroll_explicit", "ot", 1]]}, "result": [[0.013846371250000001], 0, 1.9394192695617676, 1637627126.4475574], "version": 0.2, "tvm_version": "0.8.dev0"}
{"input": ["cuda -keys=cuda,gpu -max_num_threads=1024 -thread_warp_size=32", "conv2d_nchw.cuda", [["TENSOR", [128, 128, 58, 58], "float32"], ["TENSOR", [128, 128, 3, 3], "float32"], 2, "VALID", 1, "float32"], {}], "config": {"index": 15612344, "code_hash": null, "entity": [["tile_f", "sp", [-1, 1, 2, 16]], ["tile_y", "sp", [-1, 1, 2, 2]], ["tile_x", "sp", [-1, 1, 7, 1]], ["tile_rc", "sp", [-1, 2]], ["tile_ry", "sp", [-1, 1]], ["tile_rx", "sp", [-1, 3]], ["auto_unroll_max_step", "ot", 1500], ["unroll_explicit", "ot", 0]]}, "result": [[0.008356717833333334], 0, 2.2917869091033936, 1637627128.0939596], "version": 0.2, "tvm_version": "0.8.dev0"}
{"input": ["cuda -keys=cuda,gpu -max_num_threads=1024 -thread_warp_size=32", "conv2d_nchw.cuda", [["TENSOR", [128, 128, 58, 58], "float32"], ["TENSOR", [128, 128, 3, 3], "float32"], 2, "VALID", 1, "float32"], {}], "config": {"index": 9468344, "code_hash": null, "entity": [["tile_f", "sp", [-1, 1, 2, 16]], ["tile_y", "sp", [-1, 1, 2, 2]], ["tile_x", "sp", [-1, 1, 7, 1]], ["tile_rc", "sp", [-1, 2]], ["tile_ry", "sp", [-1, 1]], ["tile_rx", "sp", [-1, 3]], ["auto_unroll_max_step", "ot", 512], ["unroll_explicit", "ot", 0]]}, "result": [[0.008432223666666667], 0, 2.2050962448120117, 1637627129.8539934], "version": 0.2, "tvm_version": "0.8.dev0"}
{"input": ["cuda -keys=cuda,gpu -max_num_threads=1024 -thread_warp_size=32", "conv2d_nchw.cuda", [["TENSOR", [128, 128, 58, 58], "float32"], ["TENSOR", [128, 128, 3, 3], "float32"], 2, "VALID", 1, "float32"], {}], "config": {"index": 23112224, "code_hash": null, "entity": [["tile_f", "sp", [-1, 1, 2, 16]], ["tile_y", "sp", [-1, 2, 1, 1]], ["tile_x", "sp", [-1, 1, 14, 1]], ["tile_rc", "sp", [-1, 1]], ["tile_ry", "sp", [-1, 3]], ["tile_rx", "sp", [-1, 3]], ["auto_unroll_max_step", "ot", 0], ["unroll_explicit", "ot", 1]]}, "result": [[0.006443213874999999], 0, 1.9830069541931152, 1637627131.414941], "version": 0.2, "tvm_version": "0.8.dev0"}
{"input": ["cuda -keys=cuda,gpu -max_num_threads=1024 -thread_warp_size=32", "conv2d_nchw.cuda", [["TENSOR", [128, 128, 58, 58], "float32"], ["TENSOR", [128, 128, 3, 3], "float32"], 2, "VALID", 1, "float32"], {}], "config": {"index": 4680224, "code_hash": null, "entity": [["tile_f", "sp", [-1, 1, 2, 16]], ["tile_y", "sp", [-1, 2, 1, 1]], ["tile_x", "sp", [-1, 1, 14, 1]], ["tile_rc", "sp", [-1, 1]], ["tile_ry", "sp", [-1, 3]], ["tile_rx", "sp", [-1, 3]], ["auto_unroll_max_step", "ot", 0], ["unroll_explicit", "ot", 0]]}, "result": [[0.00644311159090909], 0, 2.121349573135376, 1637627133.159706], "version": 0.2, "tvm_version": "0.8.dev0"}
{"input": ["cuda -keys=cuda,gpu -max_num_threads=1024 -thread_warp_size=32", "conv2d_nchw.cuda", [["TENSOR", [128, 128, 58, 58], "float32"], ["TENSOR", [128, 128, 3, 3], "float32"], 2, "VALID", 1, "float32"], {}], "config": {"index": 35400224, "code_hash": null, "entity": [["tile_f", "sp", [-1, 1, 2, 16]], ["tile_y", "sp", [-1, 2, 1, 1]], ["tile_x", "sp", [-1, 1, 14, 1]], ["tile_rc", "sp", [-1, 1]], ["tile_ry", "sp", [-1, 3]], ["tile_rx", "sp", [-1, 3]], ["auto_unroll_max_step", "ot", 1500], ["unroll_explicit", "ot", 1]]}, "result": [[0.004901906047619048], 0, 2.2139804363250732, 1637627134.7789292], "version": 0.2, "tvm_version": "0.8.dev0"}
{"input": ["cuda -keys=cuda,gpu -max_num_threads=1024 -thread_warp_size=32", "conv2d_nchw.cuda", [["TENSOR", [128, 128, 58, 58], "float32"], ["TENSOR", [128, 128, 3, 3], "float32"], 2, "VALID", 1, "float32"], {}], "config": {"index": 16968229, "code_hash": null, "entity": [["tile_f", "sp", [-1, 1, 8, 16]], ["tile_y", "sp", [-1, 2, 1, 1]], ["tile_x", "sp", [-1, 1, 14, 1]], ["tile_rc", "sp", [-1, 1]], ["tile_ry", "sp", [-1, 3]], ["tile_rx", "sp", [-1, 3]], ["auto_unroll_max_step", "ot", 1500], ["unroll_explicit", "ot", 0]]}, "result": [[0.004814847000000001], 0, 2.0577008724212646, 1637627136.4318063], "version": 0.2, "tvm_version": "0.8.dev0"}
{"input": ["cuda -keys=cuda,gpu -max_num_threads=1024 -thread_warp_size=32", "conv2d_nchw.cuda", [["TENSOR", [128, 128, 58, 58], "float32"], ["TENSOR", [128, 128, 3, 3], "float32"], 2, "VALID", 1, "float32"], {}], "config": {"index": 32328230, "code_hash": null, "entity": [["tile_f", "sp", [-1, 1, 1, 32]], ["tile_y", "sp", [-1, 2, 1, 1]], ["tile_x", "sp", [-1, 1, 14, 1]], ["tile_rc", "sp", [-1, 1]], ["tile_ry", "sp", [-1, 3]], ["tile_rx", "sp", [-1, 1]], ["auto_unroll_max_step", "ot", 1500], ["unroll_explicit", "ot", 1]]}, "result": [[0.008371034083333334], 0, 2.602552890777588, 1637627138.2038624], "version": 0.2, "tvm_version": "0.8.dev0"}
{"input": ["cuda -keys=cuda,gpu -max_num_threads=1024 -thread_warp_size=32", "conv2d_nchw.cuda", [["TENSOR", [128, 128, 58, 58], "float32"], ["TENSOR", [128, 128, 3, 3], "float32"], 2, "VALID", 1, "float32"], {}], "config": {"index": 20040230, "code_hash": null, "entity": [["tile_f", "sp", [-1, 1, 1, 32]], ["tile_y", "sp", [-1, 2, 1, 1]], ["tile_x", "sp", [-1, 1, 14, 1]], ["tile_rc", "sp", [-1, 1]], ["tile_ry", "sp", [-1, 3]], ["tile_rx", "sp", [-1, 1]], ["auto_unroll_max_step", "ot", 0], ["unroll_explicit", "ot", 1]]}, "result": [[0.01559706677777778], 0, 2.491055965423584, 1637627140.3492162], "version": 0.2, "tvm_version": "0.8.dev0"}
{"input": ["cuda -keys=cuda,gpu -max_num_threads=1024 -thread_warp_size=32", "conv2d_nchw.cuda", [["TENSOR", [128, 128, 58, 58], "float32"], ["TENSOR", [128, 128, 3, 3], "float32"], 2, "VALID", 1, "float32"], {}], "config": {"index": 26184230, "code_hash": null, "entity": [["tile_f", "sp", [-1, 1, 1, 32]], ["tile_y", "sp", [-1, 2, 1, 1]], ["tile_x", "sp", [-1, 1, 14, 1]], ["tile_rc", "sp", [-1, 1]], ["tile_ry", "sp", [-1, 3]], ["tile_rx", "sp", [-1, 1]], ["auto_unroll_max_step", "ot", 512], ["unroll_explicit", "ot", 1]]}, "result": [[0.00887051775], 0, 2.6858370304107666, 1637627144.7555494], "version": 0.2, "tvm_version": "0.8.dev0"}
{"input": ["cuda -keys=cuda,gpu -max_num_threads=1024 -thread_warp_size=32", "conv2d_nchw.cuda", [["TENSOR", [128, 128, 58, 58], "float32"], ["TENSOR", [128, 128, 3, 3], "float32"], 2, "VALID", 1, "float32"], {}], "config": {"index": 29243127, "code_hash": null, "entity": [["tile_f", "sp", [-1, 4, 1, 8]], ["tile_y", "sp", [-1, 1, 7, 1]], ["tile_x", "sp", [-1, 1, 7, 1]], ["tile_rc", "sp", [-1, 1]], ["tile_ry", "sp", [-1, 3]], ["tile_rx", "sp", [-1, 3]], ["auto_unroll_max_step", "ot", 512], ["unroll_explicit", "ot", 1]]}, "result": [[0.00607824794117647], 0, 2.7578516006469727, 1637627146.360022], "version": 0.2, "tvm_version": "0.8.dev0"}
{"input": ["cuda -keys=cuda,gpu -max_num_threads=1024 -thread_warp_size=32", "conv2d_nchw.cuda", [["TENSOR", [128, 128, 58, 58], "float32"], ["TENSOR", [128, 128, 3, 3], "float32"], 2, "VALID", 1, "float32"], {}], "config": {"index": 35388104, "code_hash": null, "entity": [["tile_f", "sp", [-1, 1, 2, 16]], ["tile_y", "sp", [-1, 7, 1, 2]], ["tile_x", "sp", [-1, 1, 7, 1]], ["tile_rc", "sp", [-1, 1]], ["tile_ry", "sp", [-1, 3]], ["tile_rx", "sp", [-1, 3]], ["auto_unroll_max_step", "ot", 1500], ["unroll_explicit", "ot", 1]]}, "result": [[0.011723504888888889], 0, 3.748553991317749, 1637627148.0976977], "version": 0.2, "tvm_version": "0.8.dev0"}
{"input": ["cuda -keys=cuda,gpu -max_num_threads=1024 -thread_warp_size=32", "conv2d_nchw.cuda", [["TENSOR", [128, 128, 58, 58], "float32"], ["TENSOR", [128, 128, 3, 3], "float32"], 2, "VALID", 1, "float32"], {}], "config": {"index": 16956104, "code_hash": null, "entity": [["tile_f", "sp", [-1, 1, 2, 16]], ["tile_y", "sp", [-1, 7, 1, 2]], ["tile_x", "sp", [-1, 1, 7, 1]], ["tile_rc", "sp", [-1, 1]], ["tile_ry", "sp", [-1, 3]], ["tile_rx", "sp", [-1, 3]], ["auto_unroll_max_step", "ot", 1500], ["unroll_explicit", "ot", 0]]}, "result": [[0.0378734095], 0, 3.2358648777008057, 1637627149.952275], "version": 0.2, "tvm_version": "0.8.dev0"}
{"input": ["cuda -keys=cuda,gpu -max_num_threads=1024 -thread_warp_size=32", "conv2d_nchw.cuda", [["TENSOR", [128, 128, 58, 58], "float32"], ["TENSOR", [128, 128, 3, 3], "float32"], 2, "VALID", 1, "float32"], {}], "config": {"index": 4668104, "code_hash": null, "entity": [["tile_f", "sp", [-1, 1, 2, 16]], ["tile_y", "sp", [-1, 7, 1, 2]], ["tile_x", "sp", [-1, 1, 7, 1]], ["tile_rc", "sp", [-1, 1]], ["tile_ry", "sp", [-1, 3]], ["tile_rx", "sp", [-1, 3]], ["auto_unroll_max_step", "ot", 0], ["unroll_explicit", "ot", 0]]}, "result": [[0.015202387714285713], 0, 3.1140620708465576, 1637627151.7460852], "version": 0.2, "tvm_version": "0.8.dev0"}
{"input": ["cuda -keys=cuda,gpu -max_num_threads=1024 -thread_warp_size=32", "conv2d_nchw.cuda", [["TENSOR", [128, 128, 58, 58], "float32"], ["TENSOR", [128, 128, 3, 3], "float32"], 2, "VALID", 1, "float32"], {}], "config": {"index": 10812104, "code_hash": null, "entity": [["tile_f", "sp", [-1, 1, 2, 16]], ["tile_y", "sp", [-1, 7, 1, 2]], ["tile_x", "sp", [-1, 1, 7, 1]], ["tile_rc", "sp", [-1, 1]], ["tile_ry", "sp", [-1, 3]], ["tile_rx", "sp", [-1, 3]], ["auto_unroll_max_step", "ot", 512], ["unroll_explicit", "ot", 0]]}, "result": [[0.0380594535], 0, 3.12562894821167, 1637627153.5587761], "version": 0.2, "tvm_version": "0.8.dev0"}
{"input": ["cuda -keys=cuda,gpu -max_num_threads=1024 -thread_warp_size=32", "conv2d_nchw.cuda", [["TENSOR", [128, 128, 58, 58], "float32"], ["TENSOR", [128, 128, 3, 3], "float32"], 2, "VALID", 1, "float32"], {}], "config": {"index": 29244104, "code_hash": null, "entity": [["tile_f", "sp", [-1, 1, 2, 16]], ["tile_y", "sp", [-1, 7, 1, 2]], ["tile_x", "sp", [-1, 1, 7, 1]], ["tile_rc", "sp", [-1, 1]], ["tile_ry", "sp", [-1, 3]], ["tile_rx", "sp", [-1, 3]], ["auto_unroll_max_step", "ot", 512], ["unroll_explicit", "ot", 1]]}, "result": [[0.009393792363636364], 0, 3.451385736465454, 1637627155.2774878], "version": 0.2, "tvm_version": "0.8.dev0"}
{"input": ["cuda -keys=cuda,gpu -max_num_threads=1024 -thread_warp_size=32", "conv2d_nchw.cuda", [["TENSOR", [128, 128, 58, 58], "float32"], ["TENSOR", [128, 128, 3, 3], "float32"], 2, "VALID", 1, "float32"], {}], "config": {"index": 23100104, "code_hash": null, "entity": [["tile_f", "sp", [-1, 1, 2, 16]], ["tile_y", "sp", [-1, 7, 1, 2]], ["tile_x", "sp", [-1, 1, 7, 1]], ["tile_rc", "sp", [-1, 1]], ["tile_ry", "sp", [-1, 3]], ["tile_rx", "sp", [-1, 3]], ["auto_unroll_max_step", "ot", 0], ["unroll_explicit", "ot", 1]]}, "result": [[0.015285227857142857], 0, 2.653172016143799, 1637627156.801371], "version": 0.2, "tvm_version": "0.8.dev0"}
{"input": ["cuda -keys=cuda,gpu -max_num_threads=1024 -thread_warp_size=32", "conv2d_nchw.cuda", [["TENSOR", [128, 128, 58, 58], "float32"], ["TENSOR", [128, 128, 3, 3], "float32"], 2, "VALID", 1, "float32"], {}], "config": {"index": 34044350, "code_hash": null, "entity": [["tile_f", "sp", [-1, 1, 1, 32]], ["tile_y", "sp", [-1, 1, 2, 2]], ["tile_x", "sp", [-1, 1, 7, 1]], ["tile_rc", "sp", [-1, 2]], ["tile_ry", "sp", [-1, 1]], ["tile_rx", "sp", [-1, 3]], ["auto_unroll_max_step", "ot", 1500], ["unroll_explicit", "ot", 1]]}, "result": [[0.009462508272727273], 0, 4.343572378158569, 1637627158.621674], "version": 0.2, "tvm_version": "0.8.dev0"}
{"input": ["cuda -keys=cuda,gpu -max_num_threads=1024 -thread_warp_size=32", "conv2d_nchw.cuda", [["TENSOR", [128, 128, 58, 58], "float32"], ["TENSOR", [128, 128, 3, 3], "float32"], 2, "VALID", 1, "float32"], {}], "config": {"index": 9482384, "code_hash": null, "entity": [["tile_f", "sp", [-1, 1, 2, 16]], ["tile_y", "sp", [-1, 2, 1, 2]], ["tile_x", "sp", [-1, 1, 14, 1]], ["tile_rc", "sp", [-1, 2]], ["tile_ry", "sp", [-1, 1]], ["tile_rx", "sp", [-1, 3]], ["auto_unroll_max_step", "ot", 512], ["unroll_explicit", "ot", 0]]}, "result": [[0.007708947538461538], 0, 3.0882391929626465, 1637627160.339991], "version": 0.2, "tvm_version": "0.8.dev0"}
{"input": ["cuda -keys=cuda,gpu -max_num_threads=1024 -thread_warp_size=32", "conv2d_nchw.cuda", [["TENSOR", [128, 128, 58, 58], "float32"], ["TENSOR", [128, 128, 3, 3], "float32"], 2, "VALID", 1, "float32"], {}], "config": {"index": 27914384, "code_hash": null, "entity": [["tile_f", "sp", [-1, 1, 2, 16]], ["tile_y", "sp", [-1, 2, 1, 2]], ["tile_x", "sp", [-1, 1, 14, 1]], ["tile_rc", "sp", [-1, 2]], ["tile_ry", "sp", [-1, 1]], ["tile_rx", "sp", [-1, 3]], ["auto_unroll_max_step", "ot", 512], ["unroll_explicit", "ot", 1]]}, "result": [[0.005887360117647059], 0, 3.430903911590576, 1637627162.132364], "version": 0.2, "tvm_version": "0.8.dev0"}
{"input": ["cuda -keys=cuda,gpu -max_num_threads=1024 -thread_warp_size=32", "conv2d_nchw.cuda", [["TENSOR", [128, 128, 58, 58], "float32"], ["TENSOR", [128, 128, 3, 3], "float32"], 2, "VALID", 1, "float32"], {}], "config": {"index": 15626384, "code_hash": null, "entity": [["tile_f", "sp", [-1, 1, 2, 16]], ["tile_y", "sp", [-1, 2, 1, 2]], ["tile_x", "sp", [-1, 1, 14, 1]], ["tile_rc", "sp", [-1, 2]], ["tile_ry", "sp", [-1, 1]], ["tile_rx", "sp", [-1, 3]], ["auto_unroll_max_step", "ot", 1500], ["unroll_explicit", "ot", 0]]}, "result": [[0.0107998864], 0, 3.624783515930176, 1637627163.8746243], "version": 0.2, "tvm_version": "0.8.dev0"}
{"input": ["cuda -keys=cuda,gpu -max_num_threads=1024 -thread_warp_size=32", "conv2d_nchw.cuda", [["TENSOR", [128, 128, 58, 58], "float32"], ["TENSOR", [128, 128, 3, 3], "float32"], 2, "VALID", 1, "float32"], {}], "config": {"index": 3338384, "code_hash": null, "entity": [["tile_f", "sp", [-1, 1, 2, 16]], ["tile_y", "sp", [-1, 2, 1, 2]], ["tile_x", "sp", [-1, 1, 14, 1]], ["tile_rc", "sp", [-1, 2]], ["tile_ry", "sp", [-1, 1]], ["tile_rx", "sp", [-1, 3]], ["auto_unroll_max_step", "ot", 0], ["unroll_explicit", "ot", 0]]}, "result": [[0.009533124181818182], 0, 3.266915798187256, 1637627166.2796555], "version": 0.2, "tvm_version": "0.8.dev0"}
{"input": ["cuda -keys=cuda,gpu -max_num_threads=1024 -thread_warp_size=32", "conv2d_nchw.cuda", [["TENSOR", [128, 128, 58, 58], "float32"], ["TENSOR", [128, 128, 3, 3], "float32"], 2, "VALID", 1, "float32"], {}], "config": {"index": 34058384, "code_hash": null, "entity": [["tile_f", "sp", [-1, 1, 2, 16]], ["tile_y", "sp", [-1, 2, 1, 2]], ["tile_x", "sp", [-1, 1, 14, 1]], ["tile_rc", "sp", [-1, 2]], ["tile_ry", "sp", [-1, 1]], ["tile_rx", "sp", [-1, 3]], ["auto_unroll_max_step", "ot", 1500], ["unroll_explicit", "ot", 1]]}, "result": [[0.006057213411764705], 0, 4.284907579421997, 1637627168.0329726], "version": 0.2, "tvm_version": "0.8.dev0"}
{"input": ["cuda -keys=cuda,gpu -max_num_threads=1024 -thread_warp_size=32", "conv2d_nchw.cuda", [["TENSOR", [128, 128, 58, 58], "float32"], ["TENSOR", [128, 128, 3, 3], "float32"], 2, "VALID", 1, "float32"], {}], "config": {"index": 21770384, "code_hash": null, "entity": [["tile_f", "sp", [-1, 1, 2, 16]], ["tile_y", "sp", [-1, 2, 1, 2]], ["tile_x", "sp", [-1, 1, 14, 1]], ["tile_rc", "sp", [-1, 2]], ["tile_ry", "sp", [-1, 1]], ["tile_rx", "sp", [-1, 3]], ["auto_unroll_max_step", "ot", 0], ["unroll_explicit", "ot", 1]]}, "result": [[0.00952527], 0, 2.5004634857177734, 1637627169.509111], "version": 0.2, "tvm_version": "0.8.dev0"}
{"input": ["cuda -keys=cuda,gpu -max_num_threads=1024 -thread_warp_size=32", "conv2d_nchw.cuda", [["TENSOR", [128, 128, 58, 58], "float32"], ["TENSOR", [128, 128, 3, 3], "float32"], 2, "VALID", 1, "float32"], {}], "config": {"index": 34044341, "code_hash": null, "entity": [["tile_f", "sp", [-1, 2, 1, 16]], ["tile_y", "sp", [-1, 1, 2, 2]], ["tile_x", "sp", [-1, 1, 7, 1]], ["tile_rc", "sp", [-1, 2]], ["tile_ry", "sp", [-1, 1]], ["tile_rx", "sp", [-1, 3]], ["auto_unroll_max_step", "ot", 1500], ["unroll_explicit", "ot", 1]]}, "result": [[0.009372247636363636], 0, 4.287217855453491, 1637627171.3452933], "version": 0.2, "tvm_version": "0.8.dev0"}
{"input": ["cuda -keys=cuda,gpu -max_num_threads=1024 -thread_warp_size=32", "conv2d_nchw.cuda", [["TENSOR", [128, 128, 58, 58], "float32"], ["TENSOR", [128, 128, 3, 3], "float32"], 2, "VALID", 1, "float32"], {}], "config": {"index": 4723644, "code_hash": null, "entity": [["tile_f", "sp", [-1, 1, 32, 4]], ["tile_y", "sp", [-1, 7, 1, 1]], ["tile_x", "sp", [-1, 1, 7, 2]], ["tile_rc", "sp", [-1, 1]], ["tile_ry", "sp", [-1, 3]], ["tile_rx", "sp", [-1, 3]], ["auto_unroll_max_step", "ot", 0], ["unroll_explicit", "ot", 0]]}, "result": [[0.0038155565925925925], 0, 2.624770164489746, 1637627172.8585253], "version": 0.2, "tvm_version": "0.8.dev0"}
{"input": ["cuda -keys=cuda,gpu -max_num_threads=1024 -thread_warp_size=32", "conv2d_nchw.cuda", [["TENSOR", [128, 128, 58, 58], "float32"], ["TENSOR", [128, 128, 3, 3], "float32"], 2, "VALID", 1, "float32"], {}], "config": {"index": 29299644, "code_hash": null, "entity": [["tile_f", "sp", [-1, 1, 32, 4]], ["tile_y", "sp", [-1, 7, 1, 1]], ["tile_x", "sp", [-1, 1, 7, 2]], ["tile_rc", "sp", [-1, 1]], ["tile_ry", "sp", [-1, 3]], ["tile_rx", "sp", [-1, 3]], ["auto_unroll_max_step", "ot", 512], ["unroll_explicit", "ot", 1]]}, "result": [[0.0051662709000000005], 0, 3.306136131286621, 1637627174.4747345], "version": 0.2, "tvm_version": "0.8.dev0"}
{"input": ["cuda -keys=cuda,gpu -max_num_threads=1024 -thread_warp_size=32", "conv2d_nchw.cuda", [["TENSOR", [128, 128, 58, 58], "float32"], ["TENSOR", [128, 128, 3, 3], "float32"], 2, "VALID", 1, "float32"], {}], "config": {"index": 23155644, "code_hash": null, "entity": [["tile_f", "sp", [-1, 1, 32, 4]], ["tile_y", "sp", [-1, 7, 1, 1]], ["tile_x", "sp", [-1, 1, 7, 2]], ["tile_rc", "sp", [-1, 1]], ["tile_ry", "sp", [-1, 3]], ["tile_rx", "sp", [-1, 3]], ["auto_unroll_max_step", "ot", 0], ["unroll_explicit", "ot", 1]]}, "result": [[0.0038180935555555554], 0, 2.422161340713501, 1637627176.096884], "version": 0.2, "tvm_version": "0.8.dev0"}
{"input": ["cuda -keys=cuda,gpu -max_num_threads=1024 -thread_warp_size=32", "conv2d_nchw.cuda", [["TENSOR", [128, 128, 58, 58], "float32"], ["TENSOR", [128, 128, 3, 3], "float32"], 2, "VALID", 1, "float32"], {}], "config": {"index": 23098789, "code_hash": null, "entity": [["tile_f", "sp", [-1, 1, 8, 16]], ["tile_y", "sp", [-1, 14, 2, 1]], ["tile_x", "sp", [-1, 1, 7, 1]], ["tile_rc", "sp", [-1, 1]], ["tile_ry", "sp", [-1, 3]], ["tile_rx", "sp", [-1, 3]], ["auto_unroll_max_step", "ot", 0], ["unroll_explicit", "ot", 1]]}, "result": [[0.00629272525], 0, 3.054473876953125, 1637627177.841036], "version": 0.2, "tvm_version": "0.8.dev0"}
{"input": ["cuda -keys=cuda,gpu -max_num_threads=1024 -thread_warp_size=32", "conv2d_nchw.cuda", [["TENSOR", [128, 128, 58, 58], "float32"], ["TENSOR", [128, 128, 3, 3], "float32"], 2, "VALID", 1, "float32"], {}], "config": {"index": 29242675, "code_hash": null, "entity": [["tile_f", "sp", [-1, 1, 4, 32]], ["tile_y", "sp", [-1, 7, 2, 1]], ["tile_x", "sp", [-1, 1, 7, 1]], ["tile_rc", "sp", [-1, 1]], ["tile_ry", "sp", [-1, 3]], ["tile_rx", "sp", [-1, 3]], ["auto_unroll_max_step", "ot", 512], ["unroll_explicit", "ot", 1]]}, "result": [[0.005514445789473684], 0, 3.762075662612915, 1637627179.9069974], "version": 0.2, "tvm_version": "0.8.dev0"}
{"input": ["cuda -keys=cuda,gpu -max_num_threads=1024 -thread_warp_size=32", "conv2d_nchw.cuda", [["TENSOR", [128, 128, 58, 58], "float32"], ["TENSOR", [128, 128, 3, 3], "float32"], 2, "VALID", 1, "float32"], {}], "config": {"index": 29242669, "code_hash": null, "entity": [["tile_f", "sp", [-1, 1, 8, 16]], ["tile_y", "sp", [-1, 7, 2, 1]], ["tile_x", "sp", [-1, 1, 7, 1]], ["tile_rc", "sp", [-1, 1]], ["tile_ry", "sp", [-1, 3]], ["tile_rx", "sp", [-1, 3]], ["auto_unroll_max_step", "ot", 512], ["unroll_explicit", "ot", 1]]}, "result": [[0.004475227434782609], 0, 2.8747406005859375, 1637627181.4632196], "version": 0.2, "tvm_version": "0.8.dev0"}
{"input": ["cuda -keys=cuda,gpu -max_num_threads=1024 -thread_warp_size=32", "conv2d_nchw.cuda", [["TENSOR", [128, 128, 58, 58], "float32"], ["TENSOR", [128, 128, 3, 3], "float32"], 2, "VALID", 1, "float32"], {}], "config": {"index": 4666789, "code_hash": null, "entity": [["tile_f", "sp", [-1, 1, 8, 16]], ["tile_y", "sp", [-1, 14, 2, 1]], ["tile_x", "sp", [-1, 1, 7, 1]], ["tile_rc", "sp", [-1, 1]], ["tile_ry", "sp", [-1, 3]], ["tile_rx", "sp", [-1, 3]], ["auto_unroll_max_step", "ot", 0], ["unroll_explicit", "ot", 0]]}, "result": [[0.006294694], 0, 2.866069793701172, 1637627183.1022184], "version": 0.2, "tvm_version": "0.8.dev0"}
{"input": ["cuda -keys=cuda,gpu -max_num_threads=1024 -thread_warp_size=32", "conv2d_nchw.cuda", [["TENSOR", [128, 128, 58, 58], "float32"], ["TENSOR", [128, 128, 3, 3], "float32"], 2, "VALID", 1, "float32"], {}], "config": {"index": 35386669, "code_hash": null, "entity": [["tile_f", "sp", [-1, 1, 8, 16]], ["tile_y", "sp", [-1, 7, 2, 1]], ["tile_x", "sp", [-1, 1, 7, 1]], ["tile_rc", "sp", [-1, 1]], ["tile_ry", "sp", [-1, 3]], ["tile_rx", "sp", [-1, 3]], ["auto_unroll_max_step", "ot", 1500], ["unroll_explicit", "ot", 1]]}, "result": [[0.004821566], 0, 3.9087114334106445, 1637627184.7420726], "version": 0.2, "tvm_version": "0.8.dev0"}
{"input": ["cuda -keys=cuda,gpu -max_num_threads=1024 -thread_warp_size=32", "conv2d_nchw.cuda", [["TENSOR", [128, 128, 58, 58], "float32"], ["TENSOR", [128, 128, 3, 3], "float32"], 2, "VALID", 1, "float32"], {}], "config": {"index": 35386789, "code_hash": null, "entity": [["tile_f", "sp", [-1, 1, 8, 16]], ["tile_y", "sp", [-1, 14, 2, 1]], ["tile_x", "sp", [-1, 1, 7, 1]], ["tile_rc", "sp", [-1, 1]], ["tile_ry", "sp", [-1, 3]], ["tile_rx", "sp", [-1, 3]], ["auto_unroll_max_step", "ot", 1500], ["unroll_explicit", "ot", 1]]}, "result": [[0.005854830611111111], 0, 2.835075616836548, 1637627193.6782272], "version": 0.2, "tvm_version": "0.8.dev0"}
{"input": ["cuda -keys=cuda,gpu -max_num_threads=1024 -thread_warp_size=32", "conv2d_nchw.cuda", [["TENSOR", [128, 128, 58, 58], "float32"], ["TENSOR", [128, 128, 3, 3], "float32"], 2, "VALID", 1, "float32"], {}], "config": {"index": 29242789, "code_hash": null, "entity": [["tile_f", "sp", [-1, 1, 8, 16]], ["tile_y", "sp", [-1, 14, 2, 1]], ["tile_x", "sp", [-1, 1, 7, 1]], ["tile_rc", "sp", [-1, 1]], ["tile_ry", "sp", [-1, 3]], ["tile_rx", "sp", [-1, 3]], ["auto_unroll_max_step", "ot", 512], ["unroll_explicit", "ot", 1]]}, "result": [[0.005385502736842105], 0, 2.4367284774780273, 1637627195.4209082], "version": 0.2, "tvm_version": "0.8.dev0"}
{"input": ["cuda -keys=cuda,gpu -max_num_threads=1024 -thread_warp_size=32", "conv2d_nchw.cuda", [["TENSOR", [128, 128, 58, 58], "float32"], ["TENSOR", [128, 128, 3, 3], "float32"], 2, "VALID", 1, "float32"], {}], "config": {"index": 4670859, "code_hash": null, "entity": [["tile_f", "sp", [-1, 1, 16, 8]], ["tile_y", "sp", [-1, 7, 1, 1]], ["tile_x", "sp", [-1, 2, 7, 1]], ["tile_rc", "sp", [-1, 1]], ["tile_ry", "sp", [-1, 3]], ["tile_rx", "sp", [-1, 3]], ["auto_unroll_max_step", "ot", 0], ["unroll_explicit", "ot", 0]]}, "result": [[0.004456480260869566], 0, 2.335500478744507, 1637627197.4639986], "version": 0.2, "tvm_version": "0.8.dev0"}
{"input": ["cuda -keys=cuda,gpu -max_num_threads=1024 -thread_warp_size=32", "conv2d_nchw.cuda", [["TENSOR", [128, 128, 58, 58], "float32"], ["TENSOR", [128, 128, 3, 3], "float32"], 2, "VALID", 1, "float32"], {}], "config": {"index": 4723659, "code_hash": null, "entity": [["tile_f", "sp", [-1, 1, 16, 8]], ["tile_y", "sp", [-1, 7, 1, 1]], ["tile_x", "sp", [-1, 1, 7, 2]], ["tile_rc", "sp", [-1, 1]], ["tile_ry", "sp", [-1, 3]], ["tile_rx", "sp", [-1, 3]], ["auto_unroll_max_step", "ot", 0], ["unroll_explicit", "ot", 0]]}, "result": [[0.004467588608695652], 0, 2.0224616527557373, 1637627199.1408377], "version": 0.2, "tvm_version": "0.8.dev0"}
{"input": ["cuda -keys=cuda,gpu -max_num_threads=1024 -thread_warp_size=32", "conv2d_nchw.cuda", [["TENSOR", [128, 128, 58, 58], "float32"], ["TENSOR", [128, 128, 3, 3], "float32"], 2, "VALID", 1, "float32"], {}], "config": {"index": 4680459, "code_hash": null, "entity": [["tile_f", "sp", [-1, 1, 16, 8]], ["tile_y", "sp", [-1, 7, 1, 1]], ["tile_x", "sp", [-1, 1, 14, 1]], ["tile_rc", "sp", [-1, 1]], ["tile_ry", "sp", [-1, 3]], ["tile_rx", "sp", [-1, 3]], ["auto_unroll_max_step", "ot", 0], ["unroll_explicit", "ot", 0]]}, "result": [[0.003620695821428571], 0, 2.209395170211792, 1637627201.0661755], "version": 0.2, "tvm_version": "0.8.dev0"}
{"input": ["cuda -keys=cuda,gpu -max_num_threads=1024 -thread_warp_size=32", "conv2d_nchw.cuda", [["TENSOR", [128, 128, 58, 58], "float32"], ["TENSOR", [128, 128, 3, 3], "float32"], 2, "VALID", 1, "float32"], {}], "config": {"index": 16958859, "code_hash": null, "entity": [["tile_f", "sp", [-1, 1, 16, 8]], ["tile_y", "sp", [-1, 7, 1, 1]], ["tile_x", "sp", [-1, 2, 7, 1]], ["tile_rc", "sp", [-1, 1]], ["tile_ry", "sp", [-1, 3]], ["tile_rx", "sp", [-1, 3]], ["auto_unroll_max_step", "ot", 1500], ["unroll_explicit", "ot", 0]]}, "result": [[0.004610071909090909], 0, 2.117161273956299, 1637627202.7506707], "version": 0.2, "tvm_version": "0.8.dev0"}
{"input": ["cuda -keys=cuda,gpu -max_num_threads=1024 -thread_warp_size=32", "conv2d_nchw.cuda", [["TENSOR", [128, 128, 58, 58], "float32"], ["TENSOR", [128, 128, 3, 3], "float32"], 2, "VALID", 1, "float32"], {}], "config": {"index": 10867659, "code_hash": null, "entity": [["tile_f", "sp", [-1, 1, 16, 8]], ["tile_y", "sp", [-1, 7, 1, 1]], ["tile_x", "sp", [-1, 1, 7, 2]], ["tile_rc", "sp", [-1, 1]], ["tile_ry", "sp", [-1, 3]], ["tile_rx", "sp", [-1, 3]], ["auto_unroll_max_step", "ot", 512], ["unroll_explicit", "ot", 0]]}, "result": [[0.004475210086956521], 0, 1.9876220226287842, 1637627204.3540924], "version": 0.2, "tvm_version": "0.8.dev0"}
{"input": ["cuda -keys=cuda,gpu -max_num_threads=1024 -thread_warp_size=32", "conv2d_nchw.cuda", [["TENSOR", [128, 128, 58, 58], "float32"], ["TENSOR", [128, 128, 3, 3], "float32"], 2, "VALID", 1, "float32"], {}], "config": {"index": 10814859, "code_hash": null, "entity": [["tile_f", "sp", [-1, 1, 16, 8]], ["tile_y", "sp", [-1, 7, 1, 1]], ["tile_x", "sp", [-1, 2, 7, 1]], ["tile_rc", "sp", [-1, 1]], ["tile_ry", "sp", [-1, 3]], ["tile_rx", "sp", [-1, 3]], ["auto_unroll_max_step", "ot", 512], ["unroll_explicit", "ot", 0]]}, "result": [[0.00438414352173913], 0, 1.9550604820251465, 1637627205.9774091], "version": 0.2, "tvm_version": "0.8.dev0"}
{"input": ["cuda -keys=cuda,gpu -max_num_threads=1024 -thread_warp_size=32", "conv2d_nchw.cuda", [["TENSOR", [128, 128, 58, 58], "float32"], ["TENSOR", [128, 128, 3, 3], "float32"], 2, "VALID", 1, "float32"], {}], "config": {"index": 17011659, "code_hash": null, "entity": [["tile_f", "sp", [-1, 1, 16, 8]], ["tile_y", "sp", [-1, 7, 1, 1]], ["tile_x", "sp", [-1, 1, 7, 2]], ["tile_rc", "sp", [-1, 1]], ["tile_ry", "sp", [-1, 3]], ["tile_rx", "sp", [-1, 3]], ["auto_unroll_max_step", "ot", 1500], ["unroll_explicit", "ot", 0]]}, "result": [[0.004630807590909091], 0, 2.122528553009033, 1637627207.6857529], "version": 0.2, "tvm_version": "0.8.dev0"}
{"input": ["cuda -keys=cuda,gpu -max_num_threads=1024 -thread_warp_size=32", "conv2d_nchw.cuda", [["TENSOR", [128, 128, 58, 58], "float32"], ["TENSOR", [128, 128, 3, 3], "float32"], 2, "VALID", 1, "float32"], {}], "config": {"index": 16968459, "code_hash": null, "entity": [["tile_f", "sp", [-1, 1, 16, 8]], ["tile_y", "sp", [-1, 7, 1, 1]], ["tile_x", "sp", [-1, 1, 14, 1]], ["tile_rc", "sp", [-1, 1]], ["tile_ry", "sp", [-1, 3]], ["tile_rx", "sp", [-1, 3]], ["auto_unroll_max_step", "ot", 1500], ["unroll_explicit", "ot", 0]]}, "result": [[0.0051256073], 0, 1.8951961994171143, 1637627209.2793913], "version": 0.2, "tvm_version": "0.8.dev0"}
{"input": ["cuda -keys=cuda,gpu -max_num_threads=1024 -thread_warp_size=32", "conv2d_nchw.cuda", [["TENSOR", [128, 128, 58, 58], "float32"], ["TENSOR", [128, 128, 3, 3], "float32"], 2, "VALID", 1, "float32"], {}], "config": {"index": 23112459, "code_hash": null, "entity": [["tile_f", "sp", [-1, 1, 16, 8]], ["tile_y", "sp", [-1, 7, 1, 1]], ["tile_x", "sp", [-1, 1, 14, 1]], ["tile_rc", "sp", [-1, 1]], ["tile_ry", "sp", [-1, 3]], ["tile_rx", "sp", [-1, 3]], ["auto_unroll_max_step", "ot", 0], ["unroll_explicit", "ot", 1]]}, "result": [[0.003625345678571429], 0, 1.7396743297576904, 1637627210.781403], "version": 0.2, "tvm_version": "0.8.dev0"}
{"input": ["cuda -keys=cuda,gpu -max_num_threads=1024 -thread_warp_size=32", "conv2d_nchw.cuda", [["TENSOR", [128, 128, 58, 58], "float32"], ["TENSOR", [128, 128, 3, 3], "float32"], 2, "VALID", 1, "float32"], {}], "config": {"index": 35390859, "code_hash": null, "entity": [["tile_f", "sp", [-1, 1, 16, 8]], ["tile_y", "sp", [-1, 7, 1, 1]], ["tile_x", "sp", [-1, 2, 7, 1]], ["tile_rc", "sp", [-1, 1]], ["tile_ry", "sp", [-1, 3]], ["tile_rx", "sp", [-1, 3]], ["auto_unroll_max_step", "ot", 1500], ["unroll_explicit", "ot", 1]]}, "result": [[0.004606476590909091], 0, 3.077120542526245, 1637627212.4920938], "version": 0.2, "tvm_version": "0.8.dev0"}
{"input": ["cuda -keys=cuda,gpu -max_num_threads=1024 -thread_warp_size=32", "conv2d_nchw.cuda", [["TENSOR", [128, 128, 58, 58], "float32"], ["TENSOR", [128, 128, 3, 3], "float32"], 2, "VALID", 1, "float32"], {}], "config": {"index": 23102859, "code_hash": null, "entity": [["tile_f", "sp", [-1, 1, 16, 8]], ["tile_y", "sp", [-1, 7, 1, 1]], ["tile_x", "sp", [-1, 2, 7, 1]], ["tile_rc", "sp", [-1, 1]], ["tile_ry", "sp", [-1, 3]], ["tile_rx", "sp", [-1, 3]], ["auto_unroll_max_step", "ot", 0], ["unroll_explicit", "ot", 1]]}, "result": [[0.004460045434782609], 0, 1.784956693649292, 1637627213.9870274], "version": 0.2, "tvm_version": "0.8.dev0"}
{"input": ["cuda -keys=cuda,gpu -max_num_threads=1024 -thread_warp_size=32", "conv2d_nchw.cuda", [["TENSOR", [128, 128, 58, 58], "float32"], ["TENSOR", [128, 128, 3, 3], "float32"], 2, "VALID", 1, "float32"], {}], "config": {"index": 33028549, "code_hash": null, "entity": [["tile_f", "sp", [-1, 1, 8, 16]], ["tile_y", "sp", [-1, 2, 1, 14]], ["tile_x", "sp", [-1, 1, 1, 1]], ["tile_rc", "sp", [-1, 16]], ["tile_ry", "sp", [-1, 3]], ["tile_rx", "sp", [-1, 1]], ["auto_unroll_max_step", "ot", 1500], ["unroll_explicit", "ot", 1]]}, "result": [[0.33546250225], 0, 10.781485080718994, 1637627217.7913344], "version": 0.2, "tvm_version": "0.8.dev0"}
