artifacts/microbenchmark/tvm/autotvm/conv/conv2d_128_4032_11_11_672_1_1_1_SAME.log
{"input": ["cuda -keys=cuda,gpu -max_num_threads=1024 -thread_warp_size=32", "conv2d_nchw.cuda", [["TENSOR", [128, 4032, 11, 11], "float32"], ["TENSOR", [672, 4032, 1, 1], "float32"], 1, "SAME", 1, "float32"], {}], "config": {"index": 1354771, "code_hash": null, "entity": [["tile_f", "sp", [-1, 112, 1, 1]], ["tile_y", "sp", [-1, 1, 1, 1]], ["tile_x", "sp", [-1, 1, 11, 1]], ["tile_rc", "sp", [-1, 16]], ["tile_ry", "sp", [-1, 1]], ["tile_rx", "sp", [-1, 1]], ["auto_unroll_max_step", "ot", 1500], ["unroll_explicit", "ot", 0]]}, "result": [[0.8341765077500001], 0, 7.717879056930542, 1637660408.1129236], "version": 0.2, "tvm_version": "0.8.dev0"}
{"input": ["cuda -keys=cuda,gpu -max_num_threads=1024 -thread_warp_size=32", "conv2d_nchw.cuda", [["TENSOR", [128, 4032, 11, 11], "float32"], ["TENSOR", [672, 4032, 1, 1], "float32"], 1, "SAME", 1, "float32"], {}], "config": {"index": 744009, "code_hash": null, "entity": [["tile_f", "sp", [-1, 14, 1, 3]], ["tile_y", "sp", [-1, 1, 11, 1]], ["tile_x", "sp", [-1, 1, 1, 11]], ["tile_rc", "sp", [-1, 14]], ["tile_ry", "sp", [-1, 1]], ["tile_rx", "sp", [-1, 1]], ["auto_unroll_max_step", "ot", 512], ["unroll_explicit", "ot", 0]]}, "result": [[1.1926354915], 0, 9.615028858184814, 1637660417.3738668], "version": 0.2, "tvm_version": "0.8.dev0"}
{"input": ["cuda -keys=cuda,gpu -max_num_threads=1024 -thread_warp_size=32", "conv2d_nchw.cuda", [["TENSOR", [128, 4032, 11, 11], "float32"], ["TENSOR", [672, 4032, 1, 1], "float32"], 1, "SAME", 1, "float32"], {}], "config": {"index": 1313369, "code_hash": null, "entity": [["tile_f", "sp", [-1, 14, 3, 16]], ["tile_y", "sp", [-1, 11, 1, 1]], ["tile_x", "sp", [-1, 1, 11, 1]], ["tile_rc", "sp", [-1, 9]], ["tile_ry", "sp", [-1, 1]], ["tile_rx", "sp", [-1, 1]], ["auto_unroll_max_step", "ot", 1500], ["unroll_explicit", "ot", 0]]}, "result": [[1.2345933735], 0, 10.130947589874268, 1637660427.237562], "version": 0.2, "tvm_version": "0.8.dev0"}
{"input": ["cuda -keys=cuda,gpu -max_num_threads=1024 -thread_warp_size=32", "conv2d_nchw.cuda", [["TENSOR", [128, 4032, 11, 11], "float32"], ["TENSOR", [672, 4032, 1, 1], "float32"], 1, "SAME", 1, "float32"], {}], "config": {"index": 6070, "code_hash": null, "entity": [["tile_f", "sp", [-1, 3, 4, 14]], ["tile_y", "sp", [-1, 1, 11, 1]], ["tile_x", "sp", [-1, 11, 1, 1]], ["tile_rc", "sp", [-1, 1]], ["tile_ry", "sp", [-1, 1]], ["tile_rx", "sp", [-1, 1]], ["auto_unroll_max_step", "ot", 0], ["unroll_explicit", "ot", 0]]}, "result": [[0.97756597275], 0, 7.4649083614349365, 1637660438.9895165], "version": 0.2, "tvm_version": "0.8.dev0"}
{"input": ["cuda -keys=cuda,gpu -max_num_threads=1024 -thread_warp_size=32", "conv2d_nchw.cuda", [["TENSOR", [128, 4032, 11, 11], "float32"], ["TENSOR", [672, 4032, 1, 1], "float32"], 1, "SAME", 1, "float32"], {}], "config": {"index": 93580, "code_hash": null, "entity": [["tile_f", "sp", [-1, 21, 1, 4]], ["tile_y", "sp", [-1, 1, 1, 1]], ["tile_x", "sp", [-1, 1, 11, 1]], ["tile_rc", "sp", [-1, 8]], ["tile_ry", "sp", [-1, 1]], ["tile_rx", "sp", [-1, 1]], ["auto_unroll_max_step", "ot", 0], ["unroll_explicit", "ot", 0]]}, "result": [[0.22015264775], 0, 3.430844783782959, 1637660442.993917], "version": 0.2, "tvm_version": "0.8.dev0"}
{"input": ["cuda -keys=cuda,gpu -max_num_threads=1024 -thread_warp_size=32", "conv2d_nchw.cuda", [["TENSOR", [128, 4032, 11, 11], "float32"], ["TENSOR", [672, 4032, 1, 1], "float32"], 1, "SAME", 1, "float32"], {}], "config": {"index": 715920, "code_hash": null, "entity": [["tile_f", "sp", [-1, 56, 1, 1]], ["tile_y", "sp", [-1, 1, 1, 11]], ["tile_x", "sp", [-1, 1, 1, 11]], ["tile_rc", "sp", [-1, 9]], ["tile_ry", "sp", [-1, 1]], ["tile_rx", "sp", [-1, 1]], ["auto_unroll_max_step", "ot", 512], ["unroll_explicit", "ot", 0]]}, "result": [[24.00852394975], 0, 123.5290424823761, 1637660566.3089983], "version": 0.2, "tvm_version": "0.8.dev0"}
{"input": ["cuda -keys=cuda,gpu -max_num_threads=1024 -thread_warp_size=32", "conv2d_nchw.cuda", [["TENSOR", [128, 4032, 11, 11], "float32"], ["TENSOR", [672, 4032, 1, 1], "float32"], 1, "SAME", 1, "float32"], {}], "config": {"index": 3271289, "code_hash": null, "entity": [["tile_f", "sp", [-1, 1, 1, 224]], ["tile_y", "sp", [-1, 1, 11, 1]], ["tile_x", "sp", [-1, 1, 1, 1]], ["tile_rc", "sp", [-1, 48]], ["tile_ry", "sp", [-1, 1]], ["tile_rx", "sp", [-1, 1]], ["auto_unroll_max_step", "ot", 1500], ["unroll_explicit", "ot", 1]]}, "result": [[0.24968147124999998], 0, 15.242491722106934, 1637660574.1562557], "version": 0.2, "tvm_version": "0.8.dev0"}
{"input": ["cuda -keys=cuda,gpu -max_num_threads=1024 -thread_warp_size=32", "conv2d_nchw.cuda", [["TENSOR", [128, 4032, 11, 11], "float32"], ["TENSOR", [672, 4032, 1, 1], "float32"], 1, "SAME", 1, "float32"], {}], "config": {"index": 2002668, "code_hash": null, "entity": [["tile_f", "sp", [-1, 4, 12, 1]], ["tile_y", "sp", [-1, 1, 1, 11]], ["tile_x", "sp", [-1, 1, 11, 1]], ["tile_rc", "sp", [-1, 24]], ["tile_ry", "sp", [-1, 1]], ["tile_rx", "sp", [-1, 1]], ["auto_unroll_max_step", "ot", 0], ["unroll_explicit", "ot", 1]]}, "result": [[0.011374569888888887], 0, 2.3253064155578613, 1637660584.382479], "version": 0.2, "tvm_version": "0.8.dev0"}
{"input": ["cuda -keys=cuda,gpu -max_num_threads=1024 -thread_warp_size=32", "conv2d_nchw.cuda", [["TENSOR", [128, 4032, 11, 11], "float32"], ["TENSOR", [672, 4032, 1, 1], "float32"], 1, "SAME", 1, "float32"], {}], "config": {"index": 1578114, "code_hash": null, "entity": [["tile_f", "sp", [-1, 4, 7, 2]], ["tile_y", "sp", [-1, 11, 1, 1]], ["tile_x", "sp", [-1, 1, 1, 1]], ["tile_rc", "sp", [-1, 126]], ["tile_ry", "sp", [-1, 1]], ["tile_rx", "sp", [-1, 1]], ["auto_unroll_max_step", "ot", 1500], ["unroll_explicit", "ot", 0]]}, "result": [[0.12423062950000001], 0, 6.32485032081604, 1637660588.4333544], "version": 0.2, "tvm_version": "0.8.dev0"}
{"input": ["cuda -keys=cuda,gpu -max_num_threads=1024 -thread_warp_size=32", "conv2d_nchw.cuda", [["TENSOR", [128, 4032, 11, 11], "float32"], ["TENSOR", [672, 4032, 1, 1], "float32"], 1, "SAME", 1, "float32"], {}], "config": {"index": 1335318, "code_hash": null, "entity": [["tile_f", "sp", [-1, 28, 12, 2]], ["tile_y", "sp", [-1, 1, 11, 1]], ["tile_x", "sp", [-1, 1, 1, 1]], ["tile_rc", "sp", [-1, 14]], ["tile_ry", "sp", [-1, 1]], ["tile_rx", "sp", [-1, 1]], ["auto_unroll_max_step", "ot", 1500], ["unroll_explicit", "ot", 0]]}, "result": [[0.058565878249999995], 0, 3.6319499015808105, 1637660592.104438], "version": 0.2, "tvm_version": "0.8.dev0"}
{"input": ["cuda -keys=cuda,gpu -max_num_threads=1024 -thread_warp_size=32", "conv2d_nchw.cuda", [["TENSOR", [128, 4032, 11, 11], "float32"], ["TENSOR", [672, 4032, 1, 1], "float32"], 1, "SAME", 1, "float32"], {}], "config": {"index": 2476020, "code_hash": null, "entity": [["tile_f", "sp", [-1, 2, 16, 3]], ["tile_y", "sp", [-1, 1, 1, 11]], ["tile_x", "sp", [-1, 1, 11, 1]], ["tile_rc", "sp", [-1, 6]], ["tile_ry", "sp", [-1, 1]], ["tile_rx", "sp", [-1, 1]], ["auto_unroll_max_step", "ot", 512], ["unroll_explicit", "ot", 1]]}, "result": [[0.011873631666666667], 0, 3.0171396732330322, 1637660594.659701], "version": 0.2, "tvm_version": "0.8.dev0"}
{"input": ["cuda -keys=cuda,gpu -max_num_threads=1024 -thread_warp_size=32", "conv2d_nchw.cuda", [["TENSOR", [128, 4032, 11, 11], "float32"], ["TENSOR", [672, 4032, 1, 1], "float32"], 1, "SAME", 1, "float32"], {}], "config": {"index": 2413760, "code_hash": null, "entity": [["tile_f", "sp", [-1, 2, 8, 42]], ["tile_y", "sp", [-1, 11, 1, 1]], ["tile_x", "sp", [-1, 11, 1, 1]], ["tile_rc", "sp", [-1, 1]], ["tile_ry", "sp", [-1, 1]], ["tile_rx", "sp", [-1, 1]], ["auto_unroll_max_step", "ot", 512], ["unroll_explicit", "ot", 1]]}, "result": [[2.84087614325], 0, 18.47825574874878, 1637660614.683615], "version": 0.2, "tvm_version": "0.8.dev0"}
{"input": ["cuda -keys=cuda,gpu -max_num_threads=1024 -thread_warp_size=32", "conv2d_nchw.cuda", [["TENSOR", [128, 4032, 11, 11], "float32"], ["TENSOR", [672, 4032, 1, 1], "float32"], 1, "SAME", 1, "float32"], {}], "config": {"index": 645586, "code_hash": null, "entity": [["tile_f", "sp", [-1, 2, 28, 4]], ["tile_y", "sp", [-1, 1, 1, 1]], ["tile_x", "sp", [-1, 1, 1, 1]], ["tile_rc", "sp", [-1, 4]], ["tile_ry", "sp", [-1, 1]], ["tile_rx", "sp", [-1, 1]], ["auto_unroll_max_step", "ot", 512], ["unroll_explicit", "ot", 0]]}, "result": [[1.01381401625], 0, 7.6056249141693115, 1637660623.0430026], "version": 0.2, "tvm_version": "0.8.dev0"}
{"input": ["cuda -keys=cuda,gpu -max_num_threads=1024 -thread_warp_size=32", "conv2d_nchw.cuda", [["TENSOR", [128, 4032, 11, 11], "float32"], ["TENSOR", [672, 4032, 1, 1], "float32"], 1, "SAME", 1, "float32"], {}], "config": {"index": 2777738, "code_hash": null, "entity": [["tile_f", "sp", [-1, 1, 24, 1]], ["tile_y", "sp", [-1, 1, 1, 1]], ["tile_x", "sp", [-1, 1, 1, 11]], ["tile_rc", "sp", [-1, 112]], ["tile_ry", "sp", [-1, 1]], ["tile_rx", "sp", [-1, 1]], ["auto_unroll_max_step", "ot", 512], ["unroll_explicit", "ot", 1]]}, "result": [[0.0647711295], 0, 2.7991225719451904, 1637660627.0337608], "version": 0.2, "tvm_version": "0.8.dev0"}
{"input": ["cuda -keys=cuda,gpu -max_num_threads=1024 -thread_warp_size=32", "conv2d_nchw.cuda", [["TENSOR", [128, 4032, 11, 11], "float32"], ["TENSOR", [672, 4032, 1, 1], "float32"], 1, "SAME", 1, "float32"], {}], "config": {"index": 2544995, "code_hash": null, "entity": [["tile_f", "sp", [-1, 2, 7, 3]], ["tile_y", "sp", [-1, 1, 1, 1]], ["tile_x", "sp", [-1, 1, 11, 1]], ["tile_rc", "sp", [-1, 14]], ["tile_ry", "sp", [-1, 1]], ["tile_rx", "sp", [-1, 1]], ["auto_unroll_max_step", "ot", 512], ["unroll_explicit", "ot", 1]]}, "result": [[0.038975079], 0, 2.2366676330566406, 1637660629.7693608], "version": 0.2, "tvm_version": "0.8.dev0"}
{"input": ["cuda -keys=cuda,gpu -max_num_threads=1024 -thread_warp_size=32", "conv2d_nchw.cuda", [["TENSOR", [128, 4032, 11, 11], "float32"], ["TENSOR", [672, 4032, 1, 1], "float32"], 1, "SAME", 1, "float32"], {}], "config": {"index": 1370914, "code_hash": null, "entity": [["tile_f", "sp", [-1, 21, 2, 1]], ["tile_y", "sp", [-1, 1, 11, 1]], ["tile_x", "sp", [-1, 1, 11, 1]], ["tile_rc", "sp", [-1, 18]], ["tile_ry", "sp", [-1, 1]], ["tile_rx", "sp", [-1, 1]], ["auto_unroll_max_step", "ot", 1500], ["unroll_explicit", "ot", 0]]}, "result": [[0.01154884188888889], 0, 2.9911205768585205, 1637660632.30478], "version": 0.2, "tvm_version": "0.8.dev0"}
{"input": ["cuda -keys=cuda,gpu -max_num_threads=1024 -thread_warp_size=32", "conv2d_nchw.cuda", [["TENSOR", [128, 4032, 11, 11], "float32"], ["TENSOR", [672, 4032, 1, 1], "float32"], 1, "SAME", 1, "float32"], {}], "config": {"index": 2099436, "code_hash": null, "entity": [["tile_f", "sp", [-1, 4, 12, 1]], ["tile_y", "sp", [-1, 1, 1, 11]], ["tile_x", "sp", [-1, 11, 1, 1]], ["tile_rc", "sp", [-1, 63]], ["tile_ry", "sp", [-1, 1]], ["tile_rx", "sp", [-1, 1]], ["auto_unroll_max_step", "ot", 0], ["unroll_explicit", "ot", 1]]}, "result": [[1.3760321067499999], 0, 9.695310831069946, 1637660642.2141454], "version": 0.2, "tvm_version": "0.8.dev0"}
{"input": ["cuda -keys=cuda,gpu -max_num_threads=1024 -thread_warp_size=32", "conv2d_nchw.cuda", [["TENSOR", [128, 4032, 11, 11], "float32"], ["TENSOR", [672, 4032, 1, 1], "float32"], 1, "SAME", 1, "float32"], {}], "config": {"index": 2028953, "code_hash": null, "entity": [["tile_f", "sp", [-1, 12, 2, 4]], ["tile_y", "sp", [-1, 1, 1, 1]], ["tile_x", "sp", [-1, 1, 11, 1]], ["tile_rc", "sp", [-1, 32]], ["tile_ry", "sp", [-1, 1]], ["tile_rx", "sp", [-1, 1]], ["auto_unroll_max_step", "ot", 0], ["unroll_explicit", "ot", 1]]}, "result": [[0.0656329265], 0, 2.3887979984283447, 1637660649.1221516], "version": 0.2, "tvm_version": "0.8.dev0"}
{"input": ["cuda -keys=cuda,gpu -max_num_threads=1024 -thread_warp_size=32", "conv2d_nchw.cuda", [["TENSOR", [128, 4032, 11, 11], "float32"], ["TENSOR", [672, 4032, 1, 1], "float32"], 1, "SAME", 1, "float32"], {}], "config": {"index": 128611, "code_hash": null, "entity": [["tile_f", "sp", [-1, 16, 1, 6]], ["tile_y", "sp", [-1, 1, 1, 11]], ["tile_x", "sp", [-1, 1, 1, 11]], ["tile_rc", "sp", [-1, 12]], ["tile_ry", "sp", [-1, 1]], ["tile_rx", "sp", [-1, 1]], ["auto_unroll_max_step", "ot", 0], ["unroll_explicit", "ot", 0]]}, "result": [[23.913336423500002], 0, 123.55327081680298, 1637660772.1378498], "version": 0.2, "tvm_version": "0.8.dev0"}
{"input": ["cuda -keys=cuda,gpu -max_num_threads=1024 -thread_warp_size=32", "conv2d_nchw.cuda", [["TENSOR", [128, 4032, 11, 11], "float32"], ["TENSOR", [672, 4032, 1, 1], "float32"], 1, "SAME", 1, "float32"], {}], "config": {"index": 1871942, "code_hash": null, "entity": [["tile_f", "sp", [-1, 16, 1, 2]], ["tile_y", "sp", [-1, 11, 1, 1]], ["tile_x", "sp", [-1, 1, 11, 1]], ["tile_rc", "sp", [-1, 6]], ["tile_ry", "sp", [-1, 1]], ["tile_rx", "sp", [-1, 1]], ["auto_unroll_max_step", "ot", 0], ["unroll_explicit", "ot", 1]]}, "result": [[2.7444103857499997], 0, 16.549924850463867, 1637660787.9956284], "version": 0.2, "tvm_version": "0.8.dev0"}
{"input": ["cuda -keys=cuda,gpu -max_num_threads=1024 -thread_warp_size=32", "conv2d_nchw.cuda", [["TENSOR", [128, 4032, 11, 11], "float32"], ["TENSOR", [672, 4032, 1, 1], "float32"], 1, "SAME", 1, "float32"], {}], "config": {"index": 990497, "code_hash": null, "entity": [["tile_f", "sp", [-1, 4, 3, 4]], ["tile_y", "sp", [-1, 11, 1, 1]], ["tile_x", "sp", [-1, 1, 1, 1]], ["tile_rc", "sp", [-1, 144]], ["tile_ry", "sp", [-1, 1]], ["tile_rx", "sp", [-1, 1]], ["auto_unroll_max_step", "ot", 512], ["unroll_explicit", "ot", 0]]}, "result": [[0.4824362625], 0, 4.932036876678467, 1637660792.7018418], "version": 0.2, "tvm_version": "0.8.dev0"}
{"input": ["cuda -keys=cuda,gpu -max_num_threads=1024 -thread_warp_size=32", "conv2d_nchw.cuda", [["TENSOR", [128, 4032, 11, 11], "float32"], ["TENSOR", [672, 4032, 1, 1], "float32"], 1, "SAME", 1, "float32"], {}], "config": {"index": 170672, "code_hash": null, "entity": [["tile_f", "sp", [-1, 2, 6, 4]], ["tile_y", "sp", [-1, 1, 11, 1]], ["tile_x", "sp", [-1, 1, 1, 11]], ["tile_rc", "sp", [-1, 18]], ["tile_ry", "sp", [-1, 1]], ["tile_rx", "sp", [-1, 1]], ["auto_unroll_max_step", "ot", 0], ["unroll_explicit", "ot", 0]]}, "result": [[0.015141115571428571], 0, 2.9537923336029053, 1637660795.4052966], "version": 0.2, "tvm_version": "0.8.dev0"}
{"input": ["cuda -keys=cuda,gpu -max_num_threads=1024 -thread_warp_size=32", "conv2d_nchw.cuda", [["TENSOR", [128, 4032, 11, 11], "float32"], ["TENSOR", [672, 4032, 1, 1], "float32"], 1, "SAME", 1, "float32"], {}], "config": {"index": 1846660, "code_hash": null, "entity": [["tile_f", "sp", [-1, 6, 1, 1]], ["tile_y", "sp", [-1, 11, 1, 1]], ["tile_x", "sp", [-1, 1, 1, 11]], ["tile_rc", "sp", [-1, 3]], ["tile_ry", "sp", [-1, 1]], ["tile_rx", "sp", [-1, 1]], ["auto_unroll_max_step", "ot", 0], ["unroll_explicit", "ot", 1]]}, "result": [[25.90350145275], 0, 132.30313420295715, 1637660927.4785445], "version": 0.2, "tvm_version": "0.8.dev0"}
{"input": ["cuda -keys=cuda,gpu -max_num_threads=1024 -thread_warp_size=32", "conv2d_nchw.cuda", [["TENSOR", [128, 4032, 11, 11], "float32"], ["TENSOR", [672, 4032, 1, 1], "float32"], 1, "SAME", 1, "float32"], {}], "config": {"index": 1901804, "code_hash": null, "entity": [["tile_f", "sp", [-1, 14, 2, 6]], ["tile_y", "sp", [-1, 1, 11, 1]], ["tile_x", "sp", [-1, 1, 11, 1]], ["tile_rc", "sp", [-1, 8]], ["tile_ry", "sp", [-1, 1]], ["tile_rx", "sp", [-1, 1]], ["auto_unroll_max_step", "ot", 0], ["unroll_explicit", "ot", 1]]}, "result": [[0.019766383833333335], 0, 2.4616992473602295, 1637660929.76277], "version": 0.2, "tvm_version": "0.8.dev0"}
{"input": ["cuda -keys=cuda,gpu -max_num_threads=1024 -thread_warp_size=32", "conv2d_nchw.cuda", [["TENSOR", [128, 4032, 11, 11], "float32"], ["TENSOR", [672, 4032, 1, 1], "float32"], 1, "SAME", 1, "float32"], {}], "config": {"index": 1451907, "code_hash": null, "entity": [["tile_f", "sp", [-1, 1, 1, 4]], ["tile_y", "sp", [-1, 1, 1, 1]], ["tile_x", "sp", [-1, 11, 1, 1]], ["tile_rc", "sp", [-1, 42]], ["tile_ry", "sp", [-1, 1]], ["tile_rx", "sp", [-1, 1]], ["auto_unroll_max_step", "ot", 1500], ["unroll_explicit", "ot", 0]]}, "result": [[0.36670270875], 0, 5.327439785003662, 1637660934.320366], "version": 0.2, "tvm_version": "0.8.dev0"}
{"input": ["cuda -keys=cuda,gpu -max_num_threads=1024 -thread_warp_size=32", "conv2d_nchw.cuda", [["TENSOR", [128, 4032, 11, 11], "float32"], ["TENSOR", [672, 4032, 1, 1], "float32"], 1, "SAME", 1, "float32"], {}], "config": {"index": 2592526, "code_hash": null, "entity": [["tile_f", "sp", [-1, 28, 1, 4]], ["tile_y", "sp", [-1, 11, 1, 1]], ["tile_x", "sp", [-1, 1, 1, 11]], ["tile_rc", "sp", [-1, 21]], ["tile_ry", "sp", [-1, 1]], ["tile_rx", "sp", [-1, 1]], ["auto_unroll_max_step", "ot", 512], ["unroll_explicit", "ot", 1]]}, "result": [[26.971524141499998], 0, 140.23808217048645, 1637661071.668268], "version": 0.2, "tvm_version": "0.8.dev0"}
{"input": ["cuda -keys=cuda,gpu -max_num_threads=1024 -thread_warp_size=32", "conv2d_nchw.cuda", [["TENSOR", [128, 4032, 11, 11], "float32"], ["TENSOR", [672, 4032, 1, 1], "float32"], 1, "SAME", 1, "float32"], {}], "config": {"index": 1222033, "code_hash": null, "entity": [["tile_f", "sp", [-1, 8, 1, 28]], ["tile_y", "sp", [-1, 1, 1, 11]], ["tile_x", "sp", [-1, 1, 1, 1]], ["tile_rc", "sp", [-1, 2]], ["tile_ry", "sp", [-1, 1]], ["tile_rx", "sp", [-1, 1]], ["auto_unroll_max_step", "ot", 1500], ["unroll_explicit", "ot", 0]]}, "result": [[21.08611556025], 0, 109.17673540115356, 1637661179.9628165], "version": 0.2, "tvm_version": "0.8.dev0"}
{"input": ["cuda -keys=cuda,gpu -max_num_threads=1024 -thread_warp_size=32", "conv2d_nchw.cuda", [["TENSOR", [128, 4032, 11, 11], "float32"], ["TENSOR", [672, 4032, 1, 1], "float32"], 1, "SAME", 1, "float32"], {}], "config": {"index": 1428023, "code_hash": null, "entity": [["tile_f", "sp", [-1, 4, 4, 14]], ["tile_y", "sp", [-1, 11, 1, 1]], ["tile_x", "sp", [-1, 1, 11, 1]], ["tile_rc", "sp", [-1, 32]], ["tile_ry", "sp", [-1, 1]], ["tile_rx", "sp", [-1, 1]], ["auto_unroll_max_step", "ot", 1500], ["unroll_explicit", "ot", 0]]}, "result": [[0.6839030269999999], 0, 8.944280624389648, 1637661187.0285027], "version": 0.2, "tvm_version": "0.8.dev0"}
{"input": ["cuda -keys=cuda,gpu -max_num_threads=1024 -thread_warp_size=32", "conv2d_nchw.cuda", [["TENSOR", [128, 4032, 11, 11], "float32"], ["TENSOR", [672, 4032, 1, 1], "float32"], 1, "SAME", 1, "float32"], {}], "config": {"index": 887146, "code_hash": null, "entity": [["tile_f", "sp", [-1, 1, 12, 1]], ["tile_y", "sp", [-1, 1, 11, 1]], ["tile_x", "sp", [-1, 1, 1, 11]], ["tile_rc", "sp", [-1, 56]], ["tile_ry", "sp", [-1, 1]], ["tile_rx", "sp", [-1, 1]], ["auto_unroll_max_step", "ot", 512], ["unroll_explicit", "ot", 0]]}, "result": [[0.05453689625], 0, 2.7162926197052, 1637661189.8736544], "version": 0.2, "tvm_version": "0.8.dev0"}
{"input": ["cuda -keys=cuda,gpu -max_num_threads=1024 -thread_warp_size=32", "conv2d_nchw.cuda", [["TENSOR", [128, 4032, 11, 11], "float32"], ["TENSOR", [672, 4032, 1, 1], "float32"], 1, "SAME", 1, "float32"], {}], "config": {"index": 152727, "code_hash": null, "entity": [["tile_f", "sp", [-1, 6, 2, 4]], ["tile_y", "sp", [-1, 1, 11, 1]], ["tile_x", "sp", [-1, 1, 11, 1]], ["tile_rc", "sp", [-1, 16]], ["tile_ry", "sp", [-1, 1]], ["tile_rx", "sp", [-1, 1]], ["auto_unroll_max_step", "ot", 0], ["unroll_explicit", "ot", 0]]}, "result": [[0.019357579166666666], 0, 2.959446907043457, 1637661282.5136814], "version": 0.2, "tvm_version": "0.8.dev0"}
{"input": ["cuda -keys=cuda,gpu -max_num_threads=1024 -thread_warp_size=32", "conv2d_nchw.cuda", [["TENSOR", [128, 4032, 11, 11], "float32"], ["TENSOR", [672, 4032, 1, 1], "float32"], 1, "SAME", 1, "float32"], {}], "config": {"index": 1371479, "code_hash": null, "entity": [["tile_f", "sp", [-1, 3, 2, 8]], ["tile_y", "sp", [-1, 1, 11, 1]], ["tile_x", "sp", [-1, 1, 11, 1]], ["tile_rc", "sp", [-1, 18]], ["tile_ry", "sp", [-1, 1]], ["tile_rx", "sp", [-1, 1]], ["auto_unroll_max_step", "ot", 1500], ["unroll_explicit", "ot", 0]]}, "result": [[0.011371314444444443], 0, 3.202991008758545, 1637661285.0862045], "version": 0.2, "tvm_version": "0.8.dev0"}
{"input": ["cuda -keys=cuda,gpu -max_num_threads=1024 -thread_warp_size=32", "conv2d_nchw.cuda", [["TENSOR", [128, 4032, 11, 11], "float32"], ["TENSOR", [672, 4032, 1, 1], "float32"], 1, "SAME", 1, "float32"], {}], "config": {"index": 167255, "code_hash": null, "entity": [["tile_f", "sp", [-1, 3, 2, 8]], ["tile_y", "sp", [-1, 1, 11, 1]], ["tile_x", "sp", [-1, 1, 11, 1]], ["tile_rc", "sp", [-1, 18]], ["tile_ry", "sp", [-1, 1]], ["tile_rx", "sp", [-1, 1]], ["auto_unroll_max_step", "ot", 0], ["unroll_explicit", "ot", 0]]}, "result": [[0.018855412499999998], 0, 3.457745313644409, 1637661288.330796], "version": 0.2, "tvm_version": "0.8.dev0"}
{"input": ["cuda -keys=cuda,gpu -max_num_threads=1024 -thread_warp_size=32", "conv2d_nchw.cuda", [["TENSOR", [128, 4032, 11, 11], "float32"], ["TENSOR", [672, 4032, 1, 1], "float32"], 1, "SAME", 1, "float32"], {}], "config": {"index": 1959063, "code_hash": null, "entity": [["tile_f", "sp", [-1, 6, 2, 4]], ["tile_y", "sp", [-1, 1, 11, 1]], ["tile_x", "sp", [-1, 1, 11, 1]], ["tile_rc", "sp", [-1, 16]], ["tile_ry", "sp", [-1, 1]], ["tile_rx", "sp", [-1, 1]], ["auto_unroll_max_step", "ot", 0], ["unroll_explicit", "ot", 1]]}, "result": [[0.019799498166666665], 0, 3.2013330459594727, 1637661290.9304934], "version": 0.2, "tvm_version": "0.8.dev0"}
{"input": ["cuda -keys=cuda,gpu -max_num_threads=1024 -thread_warp_size=32", "conv2d_nchw.cuda", [["TENSOR", [128, 4032, 11, 11], "float32"], ["TENSOR", [672, 4032, 1, 1], "float32"], 1, "SAME", 1, "float32"], {}], "config": {"index": 3177815, "code_hash": null, "entity": [["tile_f", "sp", [-1, 3, 2, 8]], ["tile_y", "sp", [-1, 1, 11, 1]], ["tile_x", "sp", [-1, 1, 11, 1]], ["tile_rc", "sp", [-1, 18]], ["tile_ry", "sp", [-1, 1]], ["tile_rx", "sp", [-1, 1]], ["auto_unroll_max_step", "ot", 1500], ["unroll_explicit", "ot", 1]]}, "result": [[0.01131498311111111], 0, 3.398764133453369, 1637661293.5588288], "version": 0.2, "tvm_version": "0.8.dev0"}
{"input": ["cuda -keys=cuda,gpu -max_num_threads=1024 -thread_warp_size=32", "conv2d_nchw.cuda", [["TENSOR", [128, 4032, 11, 11], "float32"], ["TENSOR", [672, 4032, 1, 1], "float32"], 1, "SAME", 1, "float32"], {}], "config": {"index": 1973591, "code_hash": null, "entity": [["tile_f", "sp", [-1, 3, 2, 8]], ["tile_y", "sp", [-1, 1, 11, 1]], ["tile_x", "sp", [-1, 1, 11, 1]], ["tile_rc", "sp", [-1, 18]], ["tile_ry", "sp", [-1, 1]], ["tile_rx", "sp", [-1, 1]], ["auto_unroll_max_step", "ot", 0], ["unroll_explicit", "ot", 1]]}, "result": [[0.01701838983333333], 0, 2.9126718044281006, 1637661296.1324136], "version": 0.2, "tvm_version": "0.8.dev0"}
{"input": ["cuda -keys=cuda,gpu -max_num_threads=1024 -thread_warp_size=32", "conv2d_nchw.cuda", [["TENSOR", [128, 4032, 11, 11], "float32"], ["TENSOR", [672, 4032, 1, 1], "float32"], 1, "SAME", 1, "float32"], {}], "config": {"index": 1357033, "code_hash": null, "entity": [["tile_f", "sp", [-1, 4, 2, 6]], ["tile_y", "sp", [-1, 1, 11, 1]], ["tile_x", "sp", [-1, 1, 11, 1]], ["tile_rc", "sp", [-1, 16]], ["tile_ry", "sp", [-1, 1]], ["tile_rx", "sp", [-1, 1]], ["auto_unroll_max_step", "ot", 1500], ["unroll_explicit", "ot", 0]]}, "result": [[0.01349659325], 0, 3.4111979007720947, 1637661299.0190964], "version": 0.2, "tvm_version": "0.8.dev0"}
{"input": ["cuda -keys=cuda,gpu -max_num_threads=1024 -thread_warp_size=32", "conv2d_nchw.cuda", [["TENSOR", [128, 4032, 11, 11], "float32"], ["TENSOR", [672, 4032, 1, 1], "float32"], 1, "SAME", 1, "float32"], {}], "config": {"index": 1371369, "code_hash": null, "entity": [["tile_f", "sp", [-1, 4, 2, 6]], ["tile_y", "sp", [-1, 1, 11, 1]], ["tile_x", "sp", [-1, 1, 11, 1]], ["tile_rc", "sp", [-1, 18]], ["tile_ry", "sp", [-1, 1]], ["tile_rx", "sp", [-1, 1]], ["auto_unroll_max_step", "ot", 1500], ["unroll_explicit", "ot", 0]]}, "result": [[0.01158936311111111], 0, 3.755619525909424, 1637661302.0595365], "version": 0.2, "tvm_version": "0.8.dev0"}
{"input": ["cuda -keys=cuda,gpu -max_num_threads=1024 -thread_warp_size=32", "conv2d_nchw.cuda", [["TENSOR", [128, 4032, 11, 11], "float32"], ["TENSOR", [672, 4032, 1, 1], "float32"], 1, "SAME", 1, "float32"], {}], "config": {"index": 167145, "code_hash": null, "entity": [["tile_f", "sp", [-1, 4, 2, 6]], ["tile_y", "sp", [-1, 1, 11, 1]], ["tile_x", "sp", [-1, 1, 11, 1]], ["tile_rc", "sp", [-1, 18]], ["tile_ry", "sp", [-1, 1]], ["tile_rx", "sp", [-1, 1]], ["auto_unroll_max_step", "ot", 0], ["unroll_explicit", "ot", 0]]}, "result": [[0.017030939499999998], 0, 3.030897617340088, 1637661304.7359164], "version": 0.2, "tvm_version": "0.8.dev0"}
{"input": ["cuda -keys=cuda,gpu -max_num_threads=1024 -thread_warp_size=32", "conv2d_nchw.cuda", [["TENSOR", [128, 4032, 11, 11], "float32"], ["TENSOR", [672, 4032, 1, 1], "float32"], 1, "SAME", 1, "float32"], {}], "config": {"index": 152809, "code_hash": null, "entity": [["tile_f", "sp", [-1, 4, 2, 6]], ["tile_y", "sp", [-1, 1, 11, 1]], ["tile_x", "sp", [-1, 1, 11, 1]], ["tile_rc", "sp", [-1, 16]], ["tile_ry", "sp", [-1, 1]], ["tile_rx", "sp", [-1, 1]], ["auto_unroll_max_step", "ot", 0], ["unroll_explicit", "ot", 0]]}, "result": [[0.0195680895], 0, 3.070389986038208, 1637661307.6222575], "version": 0.2, "tvm_version": "0.8.dev0"}
{"input": ["cuda -keys=cuda,gpu -max_num_threads=1024 -thread_warp_size=32", "conv2d_nchw.cuda", [["TENSOR", [128, 4032, 11, 11], "float32"], ["TENSOR", [672, 4032, 1, 1], "float32"], 1, "SAME", 1, "float32"], {}], "config": {"index": 1356951, "code_hash": null, "entity": [["tile_f", "sp", [-1, 6, 2, 4]], ["tile_y", "sp", [-1, 1, 11, 1]], ["tile_x", "sp", [-1, 1, 11, 1]], ["tile_rc", "sp", [-1, 16]], ["tile_ry", "sp", [-1, 1]], ["tile_rx", "sp", [-1, 1]], ["auto_unroll_max_step", "ot", 1500], ["unroll_explicit", "ot", 0]]}, "result": [[0.013410108875], 0, 3.158191442489624, 1637661310.196551], "version": 0.2, "tvm_version": "0.8.dev0"}
{"input": ["cuda -keys=cuda,gpu -max_num_threads=1024 -thread_warp_size=32", "conv2d_nchw.cuda", [["TENSOR", [128, 4032, 11, 11], "float32"], ["TENSOR", [672, 4032, 1, 1], "float32"], 1, "SAME", 1, "float32"], {}], "config": {"index": 152660, "code_hash": null, "entity": [["tile_f", "sp", [-1, 8, 2, 3]], ["tile_y", "sp", [-1, 1, 11, 1]], ["tile_x", "sp", [-1, 1, 11, 1]], ["tile_rc", "sp", [-1, 16]], ["tile_ry", "sp", [-1, 1]], ["tile_rx", "sp", [-1, 1]], ["auto_unroll_max_step", "ot", 0], ["unroll_explicit", "ot", 0]]}, "result": [[0.017554189166666668], 0, 2.84985613822937, 1637661312.5343583], "version": 0.2, "tvm_version": "0.8.dev0"}
{"input": ["cuda -keys=cuda,gpu -max_num_threads=1024 -thread_warp_size=32", "conv2d_nchw.cuda", [["TENSOR", [128, 4032, 11, 11], "float32"], ["TENSOR", [672, 4032, 1, 1], "float32"], 1, "SAME", 1, "float32"], {}], "config": {"index": 166996, "code_hash": null, "entity": [["tile_f", "sp", [-1, 8, 2, 3]], ["tile_y", "sp", [-1, 1, 11, 1]], ["tile_x", "sp", [-1, 1, 11, 1]], ["tile_rc", "sp", [-1, 18]], ["tile_ry", "sp", [-1, 1]], ["tile_rx", "sp", [-1, 1]], ["auto_unroll_max_step", "ot", 0], ["unroll_explicit", "ot", 0]]}, "result": [[0.017028373166666666], 0, 3.584409475326538, 1637661315.7338765], "version": 0.2, "tvm_version": "0.8.dev0"}
{"input": ["cuda -keys=cuda,gpu -max_num_threads=1024 -thread_warp_size=32", "conv2d_nchw.cuda", [["TENSOR", [128, 4032, 11, 11], "float32"], ["TENSOR", [672, 4032, 1, 1], "float32"], 1, "SAME", 1, "float32"], {}], "config": {"index": 3163369, "code_hash": null, "entity": [["tile_f", "sp", [-1, 4, 2, 6]], ["tile_y", "sp", [-1, 1, 11, 1]], ["tile_x", "sp", [-1, 1, 11, 1]], ["tile_rc", "sp", [-1, 16]], ["tile_ry", "sp", [-1, 1]], ["tile_rx", "sp", [-1, 1]], ["auto_unroll_max_step", "ot", 1500], ["unroll_explicit", "ot", 1]]}, "result": [[0.01352549275], 0, 3.2981228828430176, 1637661318.316099], "version": 0.2, "tvm_version": "0.8.dev0"}
{"input": ["cuda -keys=cuda,gpu -max_num_threads=1024 -thread_warp_size=32", "conv2d_nchw.cuda", [["TENSOR", [128, 4032, 11, 11], "float32"], ["TENSOR", [672, 4032, 1, 1], "float32"], 1, "SAME", 1, "float32"], {}], "config": {"index": 3177705, "code_hash": null, "entity": [["tile_f", "sp", [-1, 4, 2, 6]], ["tile_y", "sp", [-1, 1, 11, 1]], ["tile_x", "sp", [-1, 1, 11, 1]], ["tile_rc", "sp", [-1, 18]], ["tile_ry", "sp", [-1, 1]], ["tile_rx", "sp", [-1, 1]], ["auto_unroll_max_step", "ot", 1500], ["unroll_explicit", "ot", 1]]}, "result": [[0.011454312222222221], 0, 3.209628105163574, 1637661320.6870039], "version": 0.2, "tvm_version": "0.8.dev0"}
{"input": ["cuda -keys=cuda,gpu -max_num_threads=1024 -thread_warp_size=32", "conv2d_nchw.cuda", [["TENSOR", [128, 4032, 11, 11], "float32"], ["TENSOR", [672, 4032, 1, 1], "float32"], 1, "SAME", 1, "float32"], {}], "config": {"index": 1973481, "code_hash": null, "entity": [["tile_f", "sp", [-1, 4, 2, 6]], ["tile_y", "sp", [-1, 1, 11, 1]], ["tile_x", "sp", [-1, 1, 11, 1]], ["tile_rc", "sp", [-1, 18]], ["tile_ry", "sp", [-1, 1]], ["tile_rx", "sp", [-1, 1]], ["auto_unroll_max_step", "ot", 0], ["unroll_explicit", "ot", 1]]}, "result": [[0.017031189999999998], 0, 2.891674280166626, 1637661323.3359816], "version": 0.2, "tvm_version": "0.8.dev0"}
{"input": ["cuda -keys=cuda,gpu -max_num_threads=1024 -thread_warp_size=32", "conv2d_nchw.cuda", [["TENSOR", [128, 4032, 11, 11], "float32"], ["TENSOR", [672, 4032, 1, 1], "float32"], 1, "SAME", 1, "float32"], {}], "config": {"index": 1959145, "code_hash": null, "entity": [["tile_f", "sp", [-1, 4, 2, 6]], ["tile_y", "sp", [-1, 1, 11, 1]], ["tile_x", "sp", [-1, 1, 11, 1]], ["tile_rc", "sp", [-1, 16]], ["tile_ry", "sp", [-1, 1]], ["tile_rx", "sp", [-1, 1]], ["auto_unroll_max_step", "ot", 0], ["unroll_explicit", "ot", 1]]}, "result": [[0.019557773666666667], 0, 2.8922626972198486, 1637661325.6547906], "version": 0.2, "tvm_version": "0.8.dev0"}
{"input": ["cuda -keys=cuda,gpu -max_num_threads=1024 -thread_warp_size=32", "conv2d_nchw.cuda", [["TENSOR", [128, 4032, 11, 11], "float32"], ["TENSOR", [672, 4032, 1, 1], "float32"], 1, "SAME", 1, "float32"], {}], "config": {"index": 754839, "code_hash": null, "entity": [["tile_f", "sp", [-1, 6, 2, 4]], ["tile_y", "sp", [-1, 1, 11, 1]], ["tile_x", "sp", [-1, 1, 11, 1]], ["tile_rc", "sp", [-1, 16]], ["tile_ry", "sp", [-1, 1]], ["tile_rx", "sp", [-1, 1]], ["auto_unroll_max_step", "ot", 512], ["unroll_explicit", "ot", 0]]}, "result": [[0.013411984125], 0, 3.2265806198120117, 1637661328.1618094], "version": 0.2, "tvm_version": "0.8.dev0"}
{"input": ["cuda -keys=cuda,gpu -max_num_threads=1024 -thread_warp_size=32", "conv2d_nchw.cuda", [["TENSOR", [128, 4032, 11, 11], "float32"], ["TENSOR", [672, 4032, 1, 1], "float32"], 1, "SAME", 1, "float32"], {}], "config": {"index": 3163287, "code_hash": null, "entity": [["tile_f", "sp", [-1, 6, 2, 4]], ["tile_y", "sp", [-1, 1, 11, 1]], ["tile_x", "sp", [-1, 1, 11, 1]], ["tile_rc", "sp", [-1, 16]], ["tile_ry", "sp", [-1, 1]], ["tile_rx", "sp", [-1, 1]], ["auto_unroll_max_step", "ot", 1500], ["unroll_explicit", "ot", 1]]}, "result": [[0.0134771445], 0, 3.4272661209106445, 1637661330.7044141], "version": 0.2, "tvm_version": "0.8.dev0"}
{"input": ["cuda -keys=cuda,gpu -max_num_threads=1024 -thread_warp_size=32", "conv2d_nchw.cuda", [["TENSOR", [128, 4032, 11, 11], "float32"], ["TENSOR", [672, 4032, 1, 1], "float32"], 1, "SAME", 1, "float32"], {}], "config": {"index": 152919, "code_hash": null, "entity": [["tile_f", "sp", [-1, 3, 2, 8]], ["tile_y", "sp", [-1, 1, 11, 1]], ["tile_x", "sp", [-1, 1, 11, 1]], ["tile_rc", "sp", [-1, 16]], ["tile_ry", "sp", [-1, 1]], ["tile_rx", "sp", [-1, 1]], ["auto_unroll_max_step", "ot", 0], ["unroll_explicit", "ot", 0]]}, "result": [[0.019568840166666667], 0, 3.0766959190368652, 1637661333.1408134], "version": 0.2, "tvm_version": "0.8.dev0"}
{"input": ["cuda -keys=cuda,gpu -max_num_threads=1024 -thread_warp_size=32", "conv2d_nchw.cuda", [["TENSOR", [128, 4032, 11, 11], "float32"], ["TENSOR", [672, 4032, 1, 1], "float32"], 1, "SAME", 1, "float32"], {}], "config": {"index": 1400041, "code_hash": null, "entity": [["tile_f", "sp", [-1, 4, 2, 6]], ["tile_y", "sp", [-1, 1, 11, 1]], ["tile_x", "sp", [-1, 1, 11, 1]], ["tile_rc", "sp", [-1, 24]], ["tile_ry", "sp", [-1, 1]], ["tile_rx", "sp", [-1, 1]], ["auto_unroll_max_step", "ot", 1500], ["unroll_explicit", "ot", 0]]}, "result": [[0.012511201375000001], 0, 3.151456594467163, 1637661335.499323], "version": 0.2, "tvm_version": "0.8.dev0"}
{"input": ["cuda -keys=cuda,gpu -max_num_threads=1024 -thread_warp_size=32", "conv2d_nchw.cuda", [["TENSOR", [128, 4032, 11, 11], "float32"], ["TENSOR", [672, 4032, 1, 1], "float32"], 1, "SAME", 1, "float32"], {}], "config": {"index": 769367, "code_hash": null, "entity": [["tile_f", "sp", [-1, 3, 2, 8]], ["tile_y", "sp", [-1, 1, 11, 1]], ["tile_x", "sp", [-1, 1, 11, 1]], ["tile_rc", "sp", [-1, 18]], ["tile_ry", "sp", [-1, 1]], ["tile_rx", "sp", [-1, 1]], ["auto_unroll_max_step", "ot", 512], ["unroll_explicit", "ot", 0]]}, "result": [[0.011381292666666668], 0, 2.775057315826416, 1637661337.7590845], "version": 0.2, "tvm_version": "0.8.dev0"}
{"input": ["cuda -keys=cuda,gpu -max_num_threads=1024 -thread_warp_size=32", "conv2d_nchw.cuda", [["TENSOR", [128, 4032, 11, 11], "float32"], ["TENSOR", [672, 4032, 1, 1], "float32"], 1, "SAME", 1, "float32"], {}], "config": {"index": 195817, "code_hash": null, "entity": [["tile_f", "sp", [-1, 4, 2, 6]], ["tile_y", "sp", [-1, 1, 11, 1]], ["tile_x", "sp", [-1, 1, 11, 1]], ["tile_rc", "sp", [-1, 24]], ["tile_ry", "sp", [-1, 1]], ["tile_rx", "sp", [-1, 1]], ["auto_unroll_max_step", "ot", 0], ["unroll_explicit", "ot", 0]]}, "result": [[0.016798314666666668], 0, 3.3144795894622803, 1637661340.6472197], "version": 0.2, "tvm_version": "0.8.dev0"}
{"input": ["cuda -keys=cuda,gpu -max_num_threads=1024 -thread_warp_size=32", "conv2d_nchw.cuda", [["TENSOR", [128, 4032, 11, 11], "float32"], ["TENSOR", [672, 4032, 1, 1], "float32"], 1, "SAME", 1, "float32"], {}], "config": {"index": 1958996, "code_hash": null, "entity": [["tile_f", "sp", [-1, 8, 2, 3]], ["tile_y", "sp", [-1, 1, 11, 1]], ["tile_x", "sp", [-1, 1, 11, 1]], ["tile_rc", "sp", [-1, 16]], ["tile_ry", "sp", [-1, 1]], ["tile_rx", "sp", [-1, 1]], ["auto_unroll_max_step", "ot", 0], ["unroll_explicit", "ot", 1]]}, "result": [[0.017671069333333334], 0, 3.2245821952819824, 1637661343.27431], "version": 0.2, "tvm_version": "0.8.dev0"}
{"input": ["cuda -keys=cuda,gpu -max_num_threads=1024 -thread_warp_size=32", "conv2d_nchw.cuda", [["TENSOR", [128, 4032, 11, 11], "float32"], ["TENSOR", [672, 4032, 1, 1], "float32"], 1, "SAME", 1, "float32"], {}], "config": {"index": 1973332, "code_hash": null, "entity": [["tile_f", "sp", [-1, 8, 2, 3]], ["tile_y", "sp", [-1, 1, 11, 1]], ["tile_x", "sp", [-1, 1, 11, 1]], ["tile_rc", "sp", [-1, 18]], ["tile_ry", "sp", [-1, 1]], ["tile_rx", "sp", [-1, 1]], ["auto_unroll_max_step", "ot", 0], ["unroll_explicit", "ot", 1]]}, "result": [[0.017119104333333333], 0, 2.513615846633911, 1637661347.3399723], "version": 0.2, "tvm_version": "0.8.dev0"}
{"input": ["cuda -keys=cuda,gpu -max_num_threads=1024 -thread_warp_size=32", "conv2d_nchw.cuda", [["TENSOR", [128, 4032, 11, 11], "float32"], ["TENSOR", [672, 4032, 1, 1], "float32"], 1, "SAME", 1, "float32"], {}], "config": {"index": 166997, "code_hash": null, "entity": [["tile_f", "sp", [-1, 14, 2, 3]], ["tile_y", "sp", [-1, 1, 11, 1]], ["tile_x", "sp", [-1, 1, 11, 1]], ["tile_rc", "sp", [-1, 18]], ["tile_ry", "sp", [-1, 1]], ["tile_rx", "sp", [-1, 1]], ["auto_unroll_max_step", "ot", 0], ["unroll_explicit", "ot", 0]]}, "result": [[0.016801591], 0, 2.9493720531463623, 1637661349.9728687], "version": 0.2, "tvm_version": "0.8.dev0"}
{"input": ["cuda -keys=cuda,gpu -max_num_threads=1024 -thread_warp_size=32", "conv2d_nchw.cuda", [["TENSOR", [128, 4032, 11, 11], "float32"], ["TENSOR", [672, 4032, 1, 1], "float32"], 1, "SAME", 1, "float32"], {}], "config": {"index": 2561175, "code_hash": null, "entity": [["tile_f", "sp", [-1, 6, 2, 4]], ["tile_y", "sp", [-1, 1, 11, 1]], ["tile_x", "sp", [-1, 1, 11, 1]], ["tile_rc", "sp", [-1, 16]], ["tile_ry", "sp", [-1, 1]], ["tile_rx", "sp", [-1, 1]], ["auto_unroll_max_step", "ot", 512], ["unroll_explicit", "ot", 1]]}, "result": [[0.013476132375], 0, 3.072178840637207, 1637661352.555877], "version": 0.2, "tvm_version": "0.8.dev0"}
{"input": ["cuda -keys=cuda,gpu -max_num_threads=1024 -thread_warp_size=32", "conv2d_nchw.cuda", [["TENSOR", [128, 4032, 11, 11], "float32"], ["TENSOR", [672, 4032, 1, 1], "float32"], 1, "SAME", 1, "float32"], {}], "config": {"index": 152662, "code_hash": null, "entity": [["tile_f", "sp", [-1, 16, 2, 3]], ["tile_y", "sp", [-1, 1, 11, 1]], ["tile_x", "sp", [-1, 1, 11, 1]], ["tile_rc", "sp", [-1, 16]], ["tile_ry", "sp", [-1, 1]], ["tile_rx", "sp", [-1, 1]], ["auto_unroll_max_step", "ot", 0], ["unroll_explicit", "ot", 0]]}, "result": [[0.016741400166666667], 0, 2.7890701293945312, 1637661355.0872219], "version": 0.2, "tvm_version": "0.8.dev0"}
{"input": ["cuda -keys=cuda,gpu -max_num_threads=1024 -thread_warp_size=32", "conv2d_nchw.cuda", [["TENSOR", [128, 4032, 11, 11], "float32"], ["TENSOR", [672, 4032, 1, 1], "float32"], 1, "SAME", 1, "float32"], {}], "config": {"index": 1959255, "code_hash": null, "entity": [["tile_f", "sp", [-1, 3, 2, 8]], ["tile_y", "sp", [-1, 1, 11, 1]], ["tile_x", "sp", [-1, 1, 11, 1]], ["tile_rc", "sp", [-1, 16]], ["tile_ry", "sp", [-1, 1]], ["tile_rx", "sp", [-1, 1]], ["auto_unroll_max_step", "ot", 0], ["unroll_explicit", "ot", 1]]}, "result": [[0.0195633075], 0, 2.556999921798706, 1637661357.5478172], "version": 0.2, "tvm_version": "0.8.dev0"}
{"input": ["cuda -keys=cuda,gpu -max_num_threads=1024 -thread_warp_size=32", "conv2d_nchw.cuda", [["TENSOR", [128, 4032, 11, 11], "float32"], ["TENSOR", [672, 4032, 1, 1], "float32"], 1, "SAME", 1, "float32"], {}], "config": {"index": 3206377, "code_hash": null, "entity": [["tile_f", "sp", [-1, 4, 2, 6]], ["tile_y", "sp", [-1, 1, 11, 1]], ["tile_x", "sp", [-1, 1, 11, 1]], ["tile_rc", "sp", [-1, 24]], ["tile_ry", "sp", [-1, 1]], ["tile_rx", "sp", [-1, 1]], ["auto_unroll_max_step", "ot", 1500], ["unroll_explicit", "ot", 1]]}, "result": [[0.014118048874999999], 0, 3.1365275382995605, 1637661359.8066218], "version": 0.2, "tvm_version": "0.8.dev0"}
{"input": ["cuda -keys=cuda,gpu -max_num_threads=1024 -thread_warp_size=32", "conv2d_nchw.cuda", [["TENSOR", [128, 4032, 11, 11], "float32"], ["TENSOR", [672, 4032, 1, 1], "float32"], 1, "SAME", 1, "float32"], {}], "config": {"index": 2575703, "code_hash": null, "entity": [["tile_f", "sp", [-1, 3, 2, 8]], ["tile_y", "sp", [-1, 1, 11, 1]], ["tile_x", "sp", [-1, 1, 11, 1]], ["tile_rc", "sp", [-1, 18]], ["tile_ry", "sp", [-1, 1]], ["tile_rx", "sp", [-1, 1]], ["auto_unroll_max_step", "ot", 512], ["unroll_explicit", "ot", 1]]}, "result": [[0.011310784222222224], 0, 2.6414525508880615, 1637661361.8409793], "version": 0.2, "tvm_version": "0.8.dev0"}
{"input": ["cuda -keys=cuda,gpu -max_num_threads=1024 -thread_warp_size=32", "conv2d_nchw.cuda", [["TENSOR", [128, 4032, 11, 11], "float32"], ["TENSOR", [672, 4032, 1, 1], "float32"], 1, "SAME", 1, "float32"], {}], "config": {"index": 2002153, "code_hash": null, "entity": [["tile_f", "sp", [-1, 4, 2, 6]], ["tile_y", "sp", [-1, 1, 11, 1]], ["tile_x", "sp", [-1, 1, 11, 1]], ["tile_rc", "sp", [-1, 24]], ["tile_ry", "sp", [-1, 1]], ["tile_rx", "sp", [-1, 1]], ["auto_unroll_max_step", "ot", 0], ["unroll_explicit", "ot", 1]]}, "result": [[0.016914778000000002], 0, 2.5322937965393066, 1637661364.0838752], "version": 0.2, "tvm_version": "0.8.dev0"}
{"input": ["cuda -keys=cuda,gpu -max_num_threads=1024 -thread_warp_size=32", "conv2d_nchw.cuda", [["TENSOR", [128, 4032, 11, 11], "float32"], ["TENSOR", [672, 4032, 1, 1], "float32"], 1, "SAME", 1, "float32"], {}], "config": {"index": 1973333, "code_hash": null, "entity": [["tile_f", "sp", [-1, 14, 2, 3]], ["tile_y", "sp", [-1, 1, 11, 1]], ["tile_x", "sp", [-1, 1, 11, 1]], ["tile_rc", "sp", [-1, 18]], ["tile_ry", "sp", [-1, 1]], ["tile_rx", "sp", [-1, 1]], ["auto_unroll_max_step", "ot", 0], ["unroll_explicit", "ot", 1]]}, "result": [[0.016796481999999998], 0, 2.9944069385528564, 1637661367.035566], "version": 0.2, "tvm_version": "0.8.dev0"}
{"input": ["cuda -keys=cuda,gpu -max_num_threads=1024 -thread_warp_size=32", "conv2d_nchw.cuda", [["TENSOR", [128, 4032, 11, 11], "float32"], ["TENSOR", [672, 4032, 1, 1], "float32"], 1, "SAME", 1, "float32"], {}], "config": {"index": 167063, "code_hash": null, "entity": [["tile_f", "sp", [-1, 6, 2, 4]], ["tile_y", "sp", [-1, 1, 11, 1]], ["tile_x", "sp", [-1, 1, 11, 1]], ["tile_rc", "sp", [-1, 18]], ["tile_ry", "sp", [-1, 1]], ["tile_rx", "sp", [-1, 1]], ["auto_unroll_max_step", "ot", 0], ["unroll_explicit", "ot", 0]]}, "result": [[0.017014174833333333], 0, 2.6545965671539307, 1637661369.6656148], "version": 0.2, "tvm_version": "0.8.dev0"}
{"input": ["cuda -keys=cuda,gpu -max_num_threads=1024 -thread_warp_size=32", "conv2d_nchw.cuda", [["TENSOR", [128, 4032, 11, 11], "float32"], ["TENSOR", [672, 4032, 1, 1], "float32"], 1, "SAME", 1, "float32"], {}], "config": {"index": 1356884, "code_hash": null, "entity": [["tile_f", "sp", [-1, 8, 2, 3]], ["tile_y", "sp", [-1, 1, 11, 1]], ["tile_x", "sp", [-1, 1, 11, 1]], ["tile_rc", "sp", [-1, 16]], ["tile_ry", "sp", [-1, 1]], ["tile_rx", "sp", [-1, 1]], ["auto_unroll_max_step", "ot", 1500], ["unroll_explicit", "ot", 0]]}, "result": [[0.013271089375000001], 0, 2.6796910762786865, 1637661372.1373348], "version": 0.2, "tvm_version": "0.8.dev0"}
{"input": ["cuda -keys=cuda,gpu -max_num_threads=1024 -thread_warp_size=32", "conv2d_nchw.cuda", [["TENSOR", [128, 4032, 11, 11], "float32"], ["TENSOR", [672, 4032, 1, 1], "float32"], 1, "SAME", 1, "float32"], {}], "config": {"index": 1371220, "code_hash": null, "entity": [["tile_f", "sp", [-1, 8, 2, 3]], ["tile_y", "sp", [-1, 1, 11, 1]], ["tile_x", "sp", [-1, 1, 11, 1]], ["tile_rc", "sp", [-1, 18]], ["tile_ry", "sp", [-1, 1]], ["tile_rx", "sp", [-1, 1]], ["auto_unroll_max_step", "ot", 1500], ["unroll_explicit", "ot", 0]]}, "result": [[0.011494156111111112], 0, 2.805011749267578, 1637661374.7723215], "version": 0.2, "tvm_version": "0.8.dev0"}
{"input": ["cuda -keys=cuda,gpu -max_num_threads=1024 -thread_warp_size=32", "conv2d_nchw.cuda", [["TENSOR", [128, 4032, 11, 11], "float32"], ["TENSOR", [672, 4032, 1, 1], "float32"], 1, "SAME", 1, "float32"], {}], "config": {"index": 769257, "code_hash": null, "entity": [["tile_f", "sp", [-1, 4, 2, 6]], ["tile_y", "sp", [-1, 1, 11, 1]], ["tile_x", "sp", [-1, 1, 11, 1]], ["tile_rc", "sp", [-1, 18]], ["tile_ry", "sp", [-1, 1]], ["tile_rx", "sp", [-1, 1]], ["auto_unroll_max_step", "ot", 512], ["unroll_explicit", "ot", 0]]}, "result": [[0.011537343666666667], 0, 2.6889805793762207, 1637661377.283384], "version": 0.2, "tvm_version": "0.8.dev0"}
{"input": ["cuda -keys=cuda,gpu -max_num_threads=1024 -thread_warp_size=32", "conv2d_nchw.cuda", [["TENSOR", [128, 4032, 11, 11], "float32"], ["TENSOR", [672, 4032, 1, 1], "float32"], 1, "SAME", 1, "float32"], {}], "config": {"index": 754921, "code_hash": null, "entity": [["tile_f", "sp", [-1, 4, 2, 6]], ["tile_y", "sp", [-1, 1, 11, 1]], ["tile_x", "sp", [-1, 1, 11, 1]], ["tile_rc", "sp", [-1, 16]], ["tile_ry", "sp", [-1, 1]], ["tile_rx", "sp", [-1, 1]], ["auto_unroll_max_step", "ot", 512], ["unroll_explicit", "ot", 0]]}, "result": [[0.013505181875], 0, 2.6665995121002197, 1637661379.478514], "version": 0.2, "tvm_version": "0.8.dev0"}
{"input": ["cuda -keys=cuda,gpu -max_num_threads=1024 -thread_warp_size=32", "conv2d_nchw.cuda", [["TENSOR", [128, 4032, 11, 11], "float32"], ["TENSOR", [672, 4032, 1, 1], "float32"], 1, "SAME", 1, "float32"], {}], "config": {"index": 1973399, "code_hash": null, "entity": [["tile_f", "sp", [-1, 6, 2, 4]], ["tile_y", "sp", [-1, 1, 11, 1]], ["tile_x", "sp", [-1, 1, 11, 1]], ["tile_rc", "sp", [-1, 18]], ["tile_ry", "sp", [-1, 1]], ["tile_rx", "sp", [-1, 1]], ["auto_unroll_max_step", "ot", 0], ["unroll_explicit", "ot", 1]]}, "result": [[0.017012675], 0, 2.5418057441711426, 1637661381.9059792], "version": 0.2, "tvm_version": "0.8.dev0"}
{"input": ["cuda -keys=cuda,gpu -max_num_threads=1024 -thread_warp_size=32", "conv2d_nchw.cuda", [["TENSOR", [128, 4032, 11, 11], "float32"], ["TENSOR", [672, 4032, 1, 1], "float32"], 1, "SAME", 1, "float32"], {}], "config": {"index": 1371486, "code_hash": null, "entity": [["tile_f", "sp", [-1, 2, 3, 8]], ["tile_y", "sp", [-1, 1, 11, 1]], ["tile_x", "sp", [-1, 1, 11, 1]], ["tile_rc", "sp", [-1, 18]], ["tile_ry", "sp", [-1, 1]], ["tile_rx", "sp", [-1, 1]], ["auto_unroll_max_step", "ot", 1500], ["unroll_explicit", "ot", 0]]}, "result": [[0.013882057], 0, 2.6653096675872803, 1637661384.5823555], "version": 0.2, "tvm_version": "0.8.dev0"}
{"input": ["cuda -keys=cuda,gpu -max_num_threads=1024 -thread_warp_size=32", "conv2d_nchw.cuda", [["TENSOR", [128, 4032, 11, 11], "float32"], ["TENSOR", [672, 4032, 1, 1], "float32"], 1, "SAME", 1, "float32"], {}], "config": {"index": 167262, "code_hash": null, "entity": [["tile_f", "sp", [-1, 2, 3, 8]], ["tile_y", "sp", [-1, 1, 11, 1]], ["tile_x", "sp", [-1, 1, 11, 1]], ["tile_rc", "sp", [-1, 18]], ["tile_ry", "sp", [-1, 1]], ["tile_rx", "sp", [-1, 1]], ["auto_unroll_max_step", "ot", 0], ["unroll_explicit", "ot", 0]]}, "result": [[0.011675039111111112], 0, 2.590202569961548, 1637661387.0722017], "version": 0.2, "tvm_version": "0.8.dev0"}
{"input": ["cuda -keys=cuda,gpu -max_num_threads=1024 -thread_warp_size=32", "conv2d_nchw.cuda", [["TENSOR", [128, 4032, 11, 11], "float32"], ["TENSOR", [672, 4032, 1, 1], "float32"], 1, "SAME", 1, "float32"], {}], "config": {"index": 754772, "code_hash": null, "entity": [["tile_f", "sp", [-1, 8, 2, 3]], ["tile_y", "sp", [-1, 1, 11, 1]], ["tile_x", "sp", [-1, 1, 11, 1]], ["tile_rc", "sp", [-1, 16]], ["tile_ry", "sp", [-1, 1]], ["tile_rx", "sp", [-1, 1]], ["auto_unroll_max_step", "ot", 512], ["unroll_explicit", "ot", 0]]}, "result": [[0.013267964875], 0, 2.722337007522583, 1637661389.6416647], "version": 0.2, "tvm_version": "0.8.dev0"}
{"input": ["cuda -keys=cuda,gpu -max_num_threads=1024 -thread_warp_size=32", "conv2d_nchw.cuda", [["TENSOR", [128, 4032, 11, 11], "float32"], ["TENSOR", [672, 4032, 1, 1], "float32"], 1, "SAME", 1, "float32"], {}], "config": {"index": 769108, "code_hash": null, "entity": [["tile_f", "sp", [-1, 8, 2, 3]], ["tile_y", "sp", [-1, 1, 11, 1]], ["tile_x", "sp", [-1, 1, 11, 1]], ["tile_rc", "sp", [-1, 18]], ["tile_ry", "sp", [-1, 1]], ["tile_rx", "sp", [-1, 1]], ["auto_unroll_max_step", "ot", 512], ["unroll_explicit", "ot", 0]]}, "result": [[0.011547054555555554], 0, 2.98013973236084, 1637661392.4101527], "version": 0.2, "tvm_version": "0.8.dev0"}
{"input": ["cuda -keys=cuda,gpu -max_num_threads=1024 -thread_warp_size=32", "conv2d_nchw.cuda", [["TENSOR", [128, 4032, 11, 11], "float32"], ["TENSOR", [672, 4032, 1, 1], "float32"], 1, "SAME", 1, "float32"], {}], "config": {"index": 3163220, "code_hash": null, "entity": [["tile_f", "sp", [-1, 8, 2, 3]], ["tile_y", "sp", [-1, 1, 11, 1]], ["tile_x", "sp", [-1, 1, 11, 1]], ["tile_rc", "sp", [-1, 16]], ["tile_ry", "sp", [-1, 1]], ["tile_rx", "sp", [-1, 1]], ["auto_unroll_max_step", "ot", 1500], ["unroll_explicit", "ot", 1]]}, "result": [[0.013235853375], 0, 3.228029251098633, 1637661395.249147], "version": 0.2, "tvm_version": "0.8.dev0"}
{"input": ["cuda -keys=cuda,gpu -max_num_threads=1024 -thread_warp_size=32", "conv2d_nchw.cuda", [["TENSOR", [128, 4032, 11, 11], "float32"], ["TENSOR", [672, 4032, 1, 1], "float32"], 1, "SAME", 1, "float32"], {}], "config": {"index": 3177556, "code_hash": null, "entity": [["tile_f", "sp", [-1, 8, 2, 3]], ["tile_y", "sp", [-1, 1, 11, 1]], ["tile_x", "sp", [-1, 1, 11, 1]], ["tile_rc", "sp", [-1, 18]], ["tile_ry", "sp", [-1, 1]], ["tile_rx", "sp", [-1, 1]], ["auto_unroll_max_step", "ot", 1500], ["unroll_explicit", "ot", 1]]}, "result": [[0.011448080111111111], 0, 2.9684176445007324, 1637661397.6141722], "version": 0.2, "tvm_version": "0.8.dev0"}
{"input": ["cuda -keys=cuda,gpu -max_num_threads=1024 -thread_warp_size=32", "conv2d_nchw.cuda", [["TENSOR", [128, 4032, 11, 11], "float32"], ["TENSOR", [672, 4032, 1, 1], "float32"], 1, "SAME", 1, "float32"], {}], "config": {"index": 2561257, "code_hash": null, "entity": [["tile_f", "sp", [-1, 4, 2, 6]], ["tile_y", "sp", [-1, 1, 11, 1]], ["tile_x", "sp", [-1, 1, 11, 1]], ["tile_rc", "sp", [-1, 16]], ["tile_ry", "sp", [-1, 1]], ["tile_rx", "sp", [-1, 1]], ["auto_unroll_max_step", "ot", 512], ["unroll_explicit", "ot", 1]]}, "result": [[0.013531043750000001], 0, 2.8006954193115234, 1637661399.9805052], "version": 0.2, "tvm_version": "0.8.dev0"}
{"input": ["cuda -keys=cuda,gpu -max_num_threads=1024 -thread_warp_size=32", "conv2d_nchw.cuda", [["TENSOR", [128, 4032, 11, 11], "float32"], ["TENSOR", [672, 4032, 1, 1], "float32"], 1, "SAME", 1, "float32"], {}], "config": {"index": 2575593, "code_hash": null, "entity": [["tile_f", "sp", [-1, 4, 2, 6]], ["tile_y", "sp", [-1, 1, 11, 1]], ["tile_x", "sp", [-1, 1, 11, 1]], ["tile_rc", "sp", [-1, 18]], ["tile_ry", "sp", [-1, 1]], ["tile_rx", "sp", [-1, 1]], ["auto_unroll_max_step", "ot", 512], ["unroll_explicit", "ot", 1]]}, "result": [[0.011448702444444443], 0, 2.730595588684082, 1637661402.0514176], "version": 0.2, "tvm_version": "0.8.dev0"}
{"input": ["cuda -keys=cuda,gpu -max_num_threads=1024 -thread_warp_size=32", "conv2d_nchw.cuda", [["TENSOR", [128, 4032, 11, 11], "float32"], ["TENSOR", [672, 4032, 1, 1], "float32"], 1, "SAME", 1, "float32"], {}], "config": {"index": 1371221, "code_hash": null, "entity": [["tile_f", "sp", [-1, 14, 2, 3]], ["tile_y", "sp", [-1, 1, 11, 1]], ["tile_x", "sp", [-1, 1, 11, 1]], ["tile_rc", "sp", [-1, 18]], ["tile_ry", "sp", [-1, 1]], ["tile_rx", "sp", [-1, 1]], ["auto_unroll_max_step", "ot", 1500], ["unroll_explicit", "ot", 0]]}, "result": [[0.0109742802], 0, 3.1623637676239014, 1637661404.7309651], "version": 0.2, "tvm_version": "0.8.dev0"}
{"input": ["cuda -keys=cuda,gpu -max_num_threads=1024 -thread_warp_size=32", "conv2d_nchw.cuda", [["TENSOR", [128, 4032, 11, 11], "float32"], ["TENSOR", [672, 4032, 1, 1], "float32"], 1, "SAME", 1, "float32"], {}], "config": {"index": 755031, "code_hash": null, "entity": [["tile_f", "sp", [-1, 3, 2, 8]], ["tile_y", "sp", [-1, 1, 11, 1]], ["tile_x", "sp", [-1, 1, 11, 1]], ["tile_rc", "sp", [-1, 16]], ["tile_ry", "sp", [-1, 1]], ["tile_rx", "sp", [-1, 1]], ["auto_unroll_max_step", "ot", 512], ["unroll_explicit", "ot", 0]]}, "result": [[0.014783744000000001], 0, 3.0031237602233887, 1637661413.9443285], "version": 0.2, "tvm_version": "0.8.dev0"}
{"input": ["cuda -keys=cuda,gpu -max_num_threads=1024 -thread_warp_size=32", "conv2d_nchw.cuda", [["TENSOR", [128, 4032, 11, 11], "float32"], ["TENSOR", [672, 4032, 1, 1], "float32"], 1, "SAME", 1, "float32"], {}], "config": {"index": 1356886, "code_hash": null, "entity": [["tile_f", "sp", [-1, 16, 2, 3]], ["tile_y", "sp", [-1, 1, 11, 1]], ["tile_x", "sp", [-1, 1, 11, 1]], ["tile_rc", "sp", [-1, 16]], ["tile_ry", "sp", [-1, 1]], ["tile_rx", "sp", [-1, 1]], ["auto_unroll_max_step", "ot", 1500], ["unroll_explicit", "ot", 0]]}, "result": [[0.0133805365], 0, 3.6515464782714844, 1637661416.9156077], "version": 0.2, "tvm_version": "0.8.dev0"}
{"input": ["cuda -keys=cuda,gpu -max_num_threads=1024 -thread_warp_size=32", "conv2d_nchw.cuda", [["TENSOR", [128, 4032, 11, 11], "float32"], ["TENSOR", [672, 4032, 1, 1], "float32"], 1, "SAME", 1, "float32"], {}], "config": {"index": 3177822, "code_hash": null, "entity": [["tile_f", "sp", [-1, 2, 3, 8]], ["tile_y", "sp", [-1, 1, 11, 1]], ["tile_x", "sp", [-1, 1, 11, 1]], ["tile_rc", "sp", [-1, 18]], ["tile_ry", "sp", [-1, 1]], ["tile_rx", "sp", [-1, 1]], ["auto_unroll_max_step", "ot", 1500], ["unroll_explicit", "ot", 1]]}, "result": [[0.014324273428571429], 0, 3.017249345779419, 1637661419.398699], "version": 0.2, "tvm_version": "0.8.dev0"}
{"input": ["cuda -keys=cuda,gpu -max_num_threads=1024 -thread_warp_size=32", "conv2d_nchw.cuda", [["TENSOR", [128, 4032, 11, 11], "float32"], ["TENSOR", [672, 4032, 1, 1], "float32"], 1, "SAME", 1, "float32"], {}], "config": {"index": 797929, "code_hash": null, "entity": [["tile_f", "sp", [-1, 4, 2, 6]], ["tile_y", "sp", [-1, 1, 11, 1]], ["tile_x", "sp", [-1, 1, 11, 1]], ["tile_rc", "sp", [-1, 24]], ["tile_ry", "sp", [-1, 1]], ["tile_rx", "sp", [-1, 1]], ["auto_unroll_max_step", "ot", 512], ["unroll_explicit", "ot", 0]]}, "result": [[0.0167848], 0, 2.9850409030914307, 1637661422.354302], "version": 0.2, "tvm_version": "0.8.dev0"}
{"input": ["cuda -keys=cuda,gpu -max_num_threads=1024 -thread_warp_size=32", "conv2d_nchw.cuda", [["TENSOR", [128, 4032, 11, 11], "float32"], ["TENSOR", [672, 4032, 1, 1], "float32"], 1, "SAME", 1, "float32"], {}], "config": {"index": 1973598, "code_hash": null, "entity": [["tile_f", "sp", [-1, 2, 3, 8]], ["tile_y", "sp", [-1, 1, 11, 1]], ["tile_x", "sp", [-1, 1, 11, 1]], ["tile_rc", "sp", [-1, 18]], ["tile_ry", "sp", [-1, 1]], ["tile_rx", "sp", [-1, 1]], ["auto_unroll_max_step", "ot", 0], ["unroll_explicit", "ot", 1]]}, "result": [[0.011520589222222223], 0, 2.9865922927856445, 1637661425.099439], "version": 0.2, "tvm_version": "0.8.dev0"}
{"input": ["cuda -keys=cuda,gpu -max_num_threads=1024 -thread_warp_size=32", "conv2d_nchw.cuda", [["TENSOR", [128, 4032, 11, 11], "float32"], ["TENSOR", [672, 4032, 1, 1], "float32"], 1, "SAME", 1, "float32"], {}], "config": {"index": 2561108, "code_hash": null, "entity": [["tile_f", "sp", [-1, 8, 2, 3]], ["tile_y", "sp", [-1, 1, 11, 1]], ["tile_x", "sp", [-1, 1, 11, 1]], ["tile_rc", "sp", [-1, 16]], ["tile_ry", "sp", [-1, 1]], ["tile_rx", "sp", [-1, 1]], ["auto_unroll_max_step", "ot", 512], ["unroll_explicit", "ot", 1]]}, "result": [[0.013235516374999999], 0, 3.6567373275756836, 1637661428.068163], "version": 0.2, "tvm_version": "0.8.dev0"}
{"input": ["cuda -keys=cuda,gpu -max_num_threads=1024 -thread_warp_size=32", "conv2d_nchw.cuda", [["TENSOR", [128, 4032, 11, 11], "float32"], ["TENSOR", [672, 4032, 1, 1], "float32"], 1, "SAME", 1, "float32"], {}], "config": {"index": 2575444, "code_hash": null, "entity": [["tile_f", "sp", [-1, 8, 2, 3]], ["tile_y", "sp", [-1, 1, 11, 1]], ["tile_x", "sp", [-1, 1, 11, 1]], ["tile_rc", "sp", [-1, 18]], ["tile_ry", "sp", [-1, 1]], ["tile_rx", "sp", [-1, 1]], ["auto_unroll_max_step", "ot", 512], ["unroll_explicit", "ot", 1]]}, "result": [[0.011443514], 0, 3.64768123626709, 1637661431.066829], "version": 0.2, "tvm_version": "0.8.dev0"}
{"input": ["cuda -keys=cuda,gpu -max_num_threads=1024 -thread_warp_size=32", "conv2d_nchw.cuda", [["TENSOR", [128, 4032, 11, 11], "float32"], ["TENSOR", [672, 4032, 1, 1], "float32"], 1, "SAME", 1, "float32"], {}], "config": {"index": 769109, "code_hash": null, "entity": [["tile_f", "sp", [-1, 14, 2, 3]], ["tile_y", "sp", [-1, 1, 11, 1]], ["tile_x", "sp", [-1, 1, 11, 1]], ["tile_rc", "sp", [-1, 18]], ["tile_ry", "sp", [-1, 1]], ["tile_rx", "sp", [-1, 1]], ["auto_unroll_max_step", "ot", 512], ["unroll_explicit", "ot", 0]]}, "result": [[0.016795083166666665], 0, 4.042317152023315, 1637661434.7673893], "version": 0.2, "tvm_version": "0.8.dev0"}
{"input": ["cuda -keys=cuda,gpu -max_num_threads=1024 -thread_warp_size=32", "conv2d_nchw.cuda", [["TENSOR", [128, 4032, 11, 11], "float32"], ["TENSOR", [672, 4032, 1, 1], "float32"], 1, "SAME", 1, "float32"], {}], "config": {"index": 3177557, "code_hash": null, "entity": [["tile_f", "sp", [-1, 14, 2, 3]], ["tile_y", "sp", [-1, 1, 11, 1]], ["tile_x", "sp", [-1, 1, 11, 1]], ["tile_rc", "sp", [-1, 18]], ["tile_ry", "sp", [-1, 1]], ["tile_rx", "sp", [-1, 1]], ["auto_unroll_max_step", "ot", 1500], ["unroll_explicit", "ot", 1]]}, "result": [[0.012841529375], 0, 4.178381681442261, 1637661437.6094668], "version": 0.2, "tvm_version": "0.8.dev0"}
{"input": ["cuda -keys=cuda,gpu -max_num_threads=1024 -thread_warp_size=32", "conv2d_nchw.cuda", [["TENSOR", [128, 4032, 11, 11], "float32"], ["TENSOR", [672, 4032, 1, 1], "float32"], 1, "SAME", 1, "float32"], {}], "config": {"index": 152657, "code_hash": null, "entity": [["tile_f", "sp", [-1, 2, 2, 3]], ["tile_y", "sp", [-1, 1, 11, 1]], ["tile_x", "sp", [-1, 1, 11, 1]], ["tile_rc", "sp", [-1, 16]], ["tile_ry", "sp", [-1, 1]], ["tile_rx", "sp", [-1, 1]], ["auto_unroll_max_step", "ot", 0], ["unroll_explicit", "ot", 0]]}, "result": [[0.020820068166666667], 0, 3.8403432369232178, 1637661441.484922], "version": 0.2, "tvm_version": "0.8.dev0"}
{"input": ["cuda -keys=cuda,gpu -max_num_threads=1024 -thread_warp_size=32", "conv2d_nchw.cuda", [["TENSOR", [128, 4032, 11, 11], "float32"], ["TENSOR", [672, 4032, 1, 1], "float32"], 1, "SAME", 1, "float32"], {}], "config": {"index": 166993, "code_hash": null, "entity": [["tile_f", "sp", [-1, 2, 2, 3]], ["tile_y", "sp", [-1, 1, 11, 1]], ["tile_x", "sp", [-1, 1, 11, 1]], ["tile_rc", "sp", [-1, 18]], ["tile_ry", "sp", [-1, 1]], ["tile_rx", "sp", [-1, 1]], ["auto_unroll_max_step", "ot", 0], ["unroll_explicit", "ot", 0]]}, "result": [[0.01620585514285714], 0, 2.717895030975342, 1637661443.9699364], "version": 0.2, "tvm_version": "0.8.dev0"}
{"input": ["cuda -keys=cuda,gpu -max_num_threads=1024 -thread_warp_size=32", "conv2d_nchw.cuda", [["TENSOR", [128, 4032, 11, 11], "float32"], ["TENSOR", [672, 4032, 1, 1], "float32"], 1, "SAME", 1, "float32"], {}], "config": {"index": 754774, "code_hash": null, "entity": [["tile_f", "sp", [-1, 16, 2, 3]], ["tile_y", "sp", [-1, 1, 11, 1]], ["tile_x", "sp", [-1, 1, 11, 1]], ["tile_rc", "sp", [-1, 16]], ["tile_ry", "sp", [-1, 1]], ["tile_rx", "sp", [-1, 1]], ["auto_unroll_max_step", "ot", 512], ["unroll_explicit", "ot", 0]]}, "result": [[0.01674213516666667], 0, 3.482853412628174, 1637661447.0358243], "version": 0.2, "tvm_version": "0.8.dev0"}
{"input": ["cuda -keys=cuda,gpu -max_num_threads=1024 -thread_warp_size=32", "conv2d_nchw.cuda", [["TENSOR", [128, 4032, 11, 11], "float32"], ["TENSOR", [672, 4032, 1, 1], "float32"], 1, "SAME", 1, "float32"], {}], "config": {"index": 1371287, "code_hash": null, "entity": [["tile_f", "sp", [-1, 6, 2, 4]], ["tile_y", "sp", [-1, 1, 11, 1]], ["tile_x", "sp", [-1, 1, 11, 1]], ["tile_rc", "sp", [-1, 18]], ["tile_ry", "sp", [-1, 1]], ["tile_rx", "sp", [-1, 1]], ["auto_unroll_max_step", "ot", 1500], ["unroll_explicit", "ot", 0]]}, "result": [[0.011440114333333333], 0, 3.371737241744995, 1637661450.2568274], "version": 0.2, "tvm_version": "0.8.dev0"}
{"input": ["cuda -keys=cuda,gpu -max_num_threads=1024 -thread_warp_size=32", "conv2d_nchw.cuda", [["TENSOR", [128, 4032, 11, 11], "float32"], ["TENSOR", [672, 4032, 1, 1], "float32"], 1, "SAME", 1, "float32"], {}], "config": {"index": 2445897, "code_hash": null, "entity": [["tile_f", "sp", [-1, 1, 48, 14]], ["tile_y", "sp", [-1, 11, 1, 1]], ["tile_x", "sp", [-1, 1, 11, 1]], ["tile_rc", "sp", [-1, 3]], ["tile_ry", "sp", [-1, 1]], ["tile_rx", "sp", [-1, 1]], ["auto_unroll_max_step", "ot", 512], ["unroll_explicit", "ot", 1]]}, "result": [[0.466268436], 0, 5.7188615798950195, 1637661455.229754], "version": 0.2, "tvm_version": "0.8.dev0"}
{"input": ["cuda -keys=cuda,gpu -max_num_threads=1024 -thread_warp_size=32", "conv2d_nchw.cuda", [["TENSOR", [128, 4032, 11, 11], "float32"], ["TENSOR", [672, 4032, 1, 1], "float32"], 1, "SAME", 1, "float32"], {}], "config": {"index": 3157214, "code_hash": null, "entity": [["tile_f", "sp", [-1, 2, 3, 8]], ["tile_y", "sp", [-1, 1, 1, 11]], ["tile_x", "sp", [-1, 1, 1, 1]], ["tile_rc", "sp", [-1, 16]], ["tile_ry", "sp", [-1, 1]], ["tile_rx", "sp", [-1, 1]], ["auto_unroll_max_step", "ot", 1500], ["unroll_explicit", "ot", 1]]}, "result": [[0.10001502625], 0, 4.239621639251709, 1637661458.4529972], "version": 0.2, "tvm_version": "0.8.dev0"}
{"input": ["cuda -keys=cuda,gpu -max_num_threads=1024 -thread_warp_size=32", "conv2d_nchw.cuda", [["TENSOR", [128, 4032, 11, 11], "float32"], ["TENSOR", [672, 4032, 1, 1], "float32"], 1, "SAME", 1, "float32"], {}], "config": {"index": 3394241, "code_hash": null, "entity": [["tile_f", "sp", [-1, 6, 1, 2]], ["tile_y", "sp", [-1, 1, 1, 1]], ["tile_x", "sp", [-1, 1, 1, 11]], ["tile_rc", "sp", [-1, 126]], ["tile_ry", "sp", [-1, 1]], ["tile_rx", "sp", [-1, 1]], ["auto_unroll_max_step", "ot", 1500], ["unroll_explicit", "ot", 1]]}, "result": [[0.46838557075], 0, 11.320732593536377, 1637661463.8901749], "version": 0.2, "tvm_version": "0.8.dev0"}
{"input": ["cuda -keys=cuda,gpu -max_num_threads=1024 -thread_warp_size=32", "conv2d_nchw.cuda", [["TENSOR", [128, 4032, 11, 11], "float32"], ["TENSOR", [672, 4032, 1, 1], "float32"], 1, "SAME", 1, "float32"], {}], "config": {"index": 626964, "code_hash": null, "entity": [["tile_f", "sp", [-1, 8, 7, 12]], ["tile_y", "sp", [-1, 1, 1, 11]], ["tile_x", "sp", [-1, 1, 11, 1]], ["tile_rc", "sp", [-1, 2]], ["tile_ry", "sp", [-1, 1]], ["tile_rx", "sp", [-1, 1]], ["auto_unroll_max_step", "ot", 512], ["unroll_explicit", "ot", 0]]}, "result": [[0.58299024775], 0, 5.954275846481323, 1637661469.2784195], "version": 0.2, "tvm_version": "0.8.dev0"}
{"input": ["cuda -keys=cuda,gpu -max_num_threads=1024 -thread_warp_size=32", "conv2d_nchw.cuda", [["TENSOR", [128, 4032, 11, 11], "float32"], ["TENSOR", [672, 4032, 1, 1], "float32"], 1, "SAME", 1, "float32"], {}], "config": {"index": 1421737, "code_hash": null, "entity": [["tile_f", "sp", [-1, 3, 2, 14]], ["tile_y", "sp", [-1, 1, 11, 1]], ["tile_x", "sp", [-1, 1, 1, 1]], ["tile_rc", "sp", [-1, 32]], ["tile_ry", "sp", [-1, 1]], ["tile_rx", "sp", [-1, 1]], ["auto_unroll_max_step", "ot", 1500], ["unroll_explicit", "ot", 0]]}, "result": [[0.0587026545], 0, 3.9367053508758545, 1637661472.2410178], "version": 0.2, "tvm_version": "0.8.dev0"}
{"input": ["cuda -keys=cuda,gpu -max_num_threads=1024 -thread_warp_size=32", "conv2d_nchw.cuda", [["TENSOR", [128, 4032, 11, 11], "float32"], ["TENSOR", [672, 4032, 1, 1], "float32"], 1, "SAME", 1, "float32"], {}], "config": {"index": 3191900, "code_hash": null, "entity": [["tile_f", "sp", [-1, 4, 4, 3]], ["tile_y", "sp", [-1, 1, 11, 1]], ["tile_x", "sp", [-1, 1, 11, 1]], ["tile_rc", "sp", [-1, 21]], ["tile_ry", "sp", [-1, 1]], ["tile_rx", "sp", [-1, 1]], ["auto_unroll_max_step", "ot", 1500], ["unroll_explicit", "ot", 1]]}, "result": [[0.0194318155], 0, 2.7166223526000977, 1637661548.2939148], "version": 0.2, "tvm_version": "0.8.dev0"}
{"input": ["cuda -keys=cuda,gpu -max_num_threads=1024 -thread_warp_size=32", "conv2d_nchw.cuda", [["TENSOR", [128, 4032, 11, 11], "float32"], ["TENSOR", [672, 4032, 1, 1], "float32"], 1, "SAME", 1, "float32"], {}], "config": {"index": 3177564, "code_hash": null, "entity": [["tile_f", "sp", [-1, 4, 4, 3]], ["tile_y", "sp", [-1, 1, 11, 1]], ["tile_x", "sp", [-1, 1, 11, 1]], ["tile_rc", "sp", [-1, 18]], ["tile_ry", "sp", [-1, 1]], ["tile_rx", "sp", [-1, 1]], ["auto_unroll_max_step", "ot", 1500], ["unroll_explicit", "ot", 1]]}, "result": [[0.011676174333333334], 0, 2.8644959926605225, 1637661550.7514944], "version": 0.2, "tvm_version": "0.8.dev0"}
{"input": ["cuda -keys=cuda,gpu -max_num_threads=1024 -thread_warp_size=32", "conv2d_nchw.cuda", [["TENSOR", [128, 4032, 11, 11], "float32"], ["TENSOR", [672, 4032, 1, 1], "float32"], 1, "SAME", 1, "float32"], {}], "config": {"index": 3177623, "code_hash": null, "entity": [["tile_f", "sp", [-1, 6, 2, 4]], ["tile_y", "sp", [-1, 1, 11, 1]], ["tile_x", "sp", [-1, 1, 11, 1]], ["tile_rc", "sp", [-1, 18]], ["tile_ry", "sp", [-1, 1]], ["tile_rx", "sp", [-1, 1]], ["auto_unroll_max_step", "ot", 1500], ["unroll_explicit", "ot", 1]]}, "result": [[0.01272050975], 0, 3.1931686401367188, 1637661553.5755203], "version": 0.2, "tvm_version": "0.8.dev0"}
{"input": ["cuda -keys=cuda,gpu -max_num_threads=1024 -thread_warp_size=32", "conv2d_nchw.cuda", [["TENSOR", [128, 4032, 11, 11], "float32"], ["TENSOR", [672, 4032, 1, 1], "float32"], 1, "SAME", 1, "float32"], {}], "config": {"index": 3177827, "code_hash": null, "entity": [["tile_f", "sp", [-1, 1, 4, 8]], ["tile_y", "sp", [-1, 1, 11, 1]], ["tile_x", "sp", [-1, 1, 11, 1]], ["tile_rc", "sp", [-1, 18]], ["tile_ry", "sp", [-1, 1]], ["tile_rx", "sp", [-1, 1]], ["auto_unroll_max_step", "ot", 1500], ["unroll_explicit", "ot", 1]]}, "result": [[0.013269929375], 0, 2.979268789291382, 1637661556.167214], "version": 0.2, "tvm_version": "0.8.dev0"}
