artifacts/Table3/tvm/ansor/pooling/ansor_avg_pooling_128_1008_42_42_1_1_2_VALID.log
{"i": [["[\"pool_layer\", \"avg\", 128, 1008, 42, 42, 1, 1, 2, \"VALID\"]", "cuda -keys=cuda,gpu -max_num_threads=1024 -thread_warp_size=32", [-1, 16, 64, 49152, 2147483647, 1024, 8, 32], "", 0, []], [[], [["FU", 2, [0, 1, 2, 3]], ["SP", 2, 0, 56899584, [2], 1], ["AN", 2, 0, 5], ["AN", 2, 1, 6], ["FU", 1, [0, 1, 2, 3]], ["SP", 1, 0, 56899584, [48], 1], ["AN", 1, 0, 5], ["AN", 1, 1, 6], ["PR", 1, 0, "auto_unroll_max_step$0"]]]], "r": [[0.125442], 0, 7.1983, 1638444276], "v": "v0.6"}
{"i": [["[\"pool_layer\", \"avg\", 128, 1008, 42, 42, 1, 1, 2, \"VALID\"]", "cuda -keys=cuda,gpu -max_num_threads=1024 -thread_warp_size=32", [-1, 16, 64, 49152, 2147483647, 1024, 8, 32], "", 0, []], [[], [["FU", 2, [0, 1, 2, 3]], ["SP", 2, 0, 56899584, [64], 1], ["AN", 2, 0, 5], ["AN", 2, 1, 6], ["FU", 1, [0, 1, 2, 3]], ["SP", 1, 0, 56899584, [32], 1], ["AN", 1, 0, 5], ["AN", 1, 1, 6], ["PR", 1, 0, "auto_unroll_max_step$512"]]]], "r": [[0.0121118], 0, 6.83667, 1638444283], "v": "v0.6"}
{"i": [["[\"pool_layer\", \"avg\", 128, 1008, 42, 42, 1, 1, 2, \"VALID\"]", "cuda -keys=cuda,gpu -max_num_threads=1024 -thread_warp_size=32", [-1, 16, 64, 49152, 2147483647, 1024, 8, 32], "", 0, []], [[], [["FU", 2, [0, 1, 2, 3]], ["SP", 2, 0, 56899584, [24], 1], ["AN", 2, 0, 5], ["AN", 2, 1, 6], ["FU", 1, [0, 1, 2, 3]], ["SP", 1, 0, 56899584, [32], 1], ["AN", 1, 0, 5], ["AN", 1, 1, 6], ["PR", 1, 0, "auto_unroll_max_step$16"]]]], "r": [[0.0170957], 0, 6.8482, 1638444289], "v": "v0.6"}
{"i": [["[\"pool_layer\", \"avg\", 128, 1008, 42, 42, 1, 1, 2, \"VALID\"]", "cuda -keys=cuda,gpu -max_num_threads=1024 -thread_warp_size=32", [-1, 16, 64, 49152, 2147483647, 1024, 8, 32], "", 0, []], [[], [["FU", 2, [0, 1, 2, 3]], ["SP", 2, 0, 56899584, [16], 1], ["AN", 2, 0, 5], ["AN", 2, 1, 6], ["FU", 1, [0, 1, 2, 3]], ["SP", 1, 0, 56899584, [1], 1], ["AN", 1, 0, 5], ["AN", 1, 1, 6], ["PR", 1, 0, "auto_unroll_max_step$0"]]]], "r": [[0.227069], 0, 7.79943, 1638444297], "v": "v0.6"}
{"i": [["[\"pool_layer\", \"avg\", 128, 1008, 42, 42, 1, 1, 2, \"VALID\"]", "cuda -keys=cuda,gpu -max_num_threads=1024 -thread_warp_size=32", [-1, 16, 64, 49152, 2147483647, 1024, 8, 32], "", 0, []], [[], [["FU", 2, [0, 1, 2, 3]], ["SP", 2, 0, 56899584, [4], 1], ["AN", 2, 0, 5], ["AN", 2, 1, 6], ["FU", 1, [0, 1, 2, 3]], ["SP", 1, 0, 56899584, [64], 1], ["AN", 1, 0, 5], ["AN", 1, 1, 6], ["PR", 1, 0, "auto_unroll_max_step$16"]]]], "r": [[0.0552817], 0, 7.33447, 1638444304], "v": "v0.6"}
{"i": [["[\"pool_layer\", \"avg\", 128, 1008, 42, 42, 1, 1, 2, \"VALID\"]", "cuda -keys=cuda,gpu -max_num_threads=1024 -thread_warp_size=32", [-1, 16, 64, 49152, 2147483647, 1024, 8, 32], "", 0, []], [[], [["FU", 2, [0, 1, 2, 3]], ["SP", 2, 0, 56899584, [2], 1], ["AN", 2, 0, 5], ["AN", 2, 1, 6], ["FU", 1, [0, 1, 2, 3]], ["SP", 1, 0, 56899584, [4], 1], ["AN", 1, 0, 5], ["AN", 1, 1, 6], ["PR", 1, 0, "auto_unroll_max_step$1024"]]]], "r": [[0.156801], 0, 7.54042, 1638444311], "v": "v0.6"}
{"i": [["[\"pool_layer\", \"avg\", 128, 1008, 42, 42, 1, 1, 2, \"VALID\"]", "cuda -keys=cuda,gpu -max_num_threads=1024 -thread_warp_size=32", [-1, 16, 64, 49152, 2147483647, 1024, 8, 32], "", 0, []], [[], [["FU", 2, [0, 1, 2, 3]], ["SP", 2, 0, 56899584, [24], 1], ["AN", 2, 0, 5], ["AN", 2, 1, 6], ["FU", 1, [0, 1, 2, 3]], ["SP", 1, 0, 56899584, [8], 1], ["AN", 1, 0, 5], ["AN", 1, 1, 6], ["PR", 1, 0, "auto_unroll_max_step$1024"]]]], "r": [[0.037412], 0, 8.38234, 1638444319], "v": "v0.6"}
{"i": [["[\"pool_layer\", \"avg\", 128, 1008, 42, 42, 1, 1, 2, \"VALID\"]", "cuda -keys=cuda,gpu -max_num_threads=1024 -thread_warp_size=32", [-1, 16, 64, 49152, 2147483647, 1024, 8, 32], "", 0, []], [[], [["FU", 2, [0, 1, 2, 3]], ["SP", 2, 0, 56899584, [2], 1], ["AN", 2, 0, 5], ["AN", 2, 1, 6], ["FU", 1, [0, 1, 2, 3]], ["SP", 1, 0, 56899584, [64], 1], ["AN", 1, 0, 5], ["AN", 1, 1, 6], ["PR", 1, 0, "auto_unroll_max_step$1024"]]]], "r": [[0.107398], 0, 6.97908, 1638444326], "v": "v0.6"}
{"i": [["[\"pool_layer\", \"avg\", 128, 1008, 42, 42, 1, 1, 2, \"VALID\"]", "cuda -keys=cuda,gpu -max_num_threads=1024 -thread_warp_size=32", [-1, 16, 64, 49152, 2147483647, 1024, 8, 32], "", 0, []], [[], [["FU", 2, [0, 1, 2, 3]], ["SP", 2, 0, 56899584, [48], 1], ["AN", 2, 0, 5], ["AN", 2, 1, 6], ["FU", 1, [0, 1, 2, 3]], ["SP", 1, 0, 56899584, [64], 1], ["AN", 1, 0, 5], ["AN", 1, 1, 6], ["PR", 1, 0, "auto_unroll_max_step$512"]]]], "r": [[0.010824], 0, 6.81278, 1638444332], "v": "v0.6"}
{"i": [["[\"pool_layer\", \"avg\", 128, 1008, 42, 42, 1, 1, 2, \"VALID\"]", "cuda -keys=cuda,gpu -max_num_threads=1024 -thread_warp_size=32", [-1, 16, 64, 49152, 2147483647, 1024, 8, 32], "", 0, []], [[], [["FU", 2, [0, 1, 2, 3]], ["SP", 2, 0, 56899584, [1], 1], ["AN", 2, 0, 5], ["AN", 2, 1, 6], ["FU", 1, [0, 1, 2, 3]], ["SP", 1, 0, 56899584, [8], 1], ["AN", 1, 0, 5], ["AN", 1, 1, 6], ["PR", 1, 0, "auto_unroll_max_step$0"]]]], "r": [[0.229784], 0, 7.69845, 1638444339], "v": "v0.6"}
{"i": [["[\"pool_layer\", \"avg\", 128, 1008, 42, 42, 1, 1, 2, \"VALID\"]", "cuda -keys=cuda,gpu -max_num_threads=1024 -thread_warp_size=32", [-1, 16, 64, 49152, 2147483647, 1024, 8, 32], "", 0, []], [[], [["FU", 2, [0, 1, 2, 3]], ["SP", 2, 0, 56899584, [56], 1], ["AN", 2, 0, 5], ["AN", 2, 1, 6], ["FU", 1, [0, 1, 2, 3]], ["SP", 1, 0, 56899584, [4], 1], ["AN", 1, 0, 5], ["AN", 1, 1, 6], ["PR", 1, 0, "auto_unroll_max_step$0"]]]], "r": [[0.0661754], 0, 7.15539, 1638444346], "v": "v0.6"}
{"i": [["[\"pool_layer\", \"avg\", 128, 1008, 42, 42, 1, 1, 2, \"VALID\"]", "cuda -keys=cuda,gpu -max_num_threads=1024 -thread_warp_size=32", [-1, 16, 64, 49152, 2147483647, 1024, 8, 32], "", 0, []], [[], [["FU", 2, [0, 1, 2, 3]], ["SP", 2, 0, 56899584, [1], 1], ["AN", 2, 0, 5], ["AN", 2, 1, 6], ["FU", 1, [0, 1, 2, 3]], ["SP", 1, 0, 56899584, [1], 1], ["AN", 1, 0, 5], ["AN", 1, 1, 6], ["PR", 1, 0, "auto_unroll_max_step$16"]]]], "r": [[0.414187], 0, 8.56707, 1638444355], "v": "v0.6"}
{"i": [["[\"pool_layer\", \"avg\", 128, 1008, 42, 42, 1, 1, 2, \"VALID\"]", "cuda -keys=cuda,gpu -max_num_threads=1024 -thread_warp_size=32", [-1, 16, 64, 49152, 2147483647, 1024, 8, 32], "", 0, []], [[], [["FU", 2, [0, 1, 2, 3]], ["SP", 2, 0, 56899584, [1], 1], ["AN", 2, 0, 5], ["AN", 2, 1, 6], ["FU", 1, [0, 1, 2, 3]], ["SP", 1, 0, 56899584, [8], 1], ["AN", 1, 0, 5], ["AN", 1, 1, 6], ["PR", 1, 0, "auto_unroll_max_step$16"]]]], "r": [[0.229797], 0, 7.60057, 1638444362], "v": "v0.6"}
{"i": [["[\"pool_layer\", \"avg\", 128, 1008, 42, 42, 1, 1, 2, \"VALID\"]", "cuda -keys=cuda,gpu -max_num_threads=1024 -thread_warp_size=32", [-1, 16, 64, 49152, 2147483647, 1024, 8, 32], "", 0, []], [[], [["FU", 2, [0, 1, 2, 3]], ["SP", 2, 0, 56899584, [2], 1], ["AN", 2, 0, 5], ["AN", 2, 1, 6], ["FU", 1, [0, 1, 2, 3]], ["SP", 1, 0, 56899584, [16], 1], ["AN", 1, 0, 5], ["AN", 1, 1, 6], ["PR", 1, 0, "auto_unroll_max_step$0"]]]], "r": [[0.117068], 0, 7.09414, 1638444369], "v": "v0.6"}
{"i": [["[\"pool_layer\", \"avg\", 128, 1008, 42, 42, 1, 1, 2, \"VALID\"]", "cuda -keys=cuda,gpu -max_num_threads=1024 -thread_warp_size=32", [-1, 16, 64, 49152, 2147483647, 1024, 8, 32], "", 0, []], [[], [["FU", 2, [0, 1, 2, 3]], ["SP", 2, 0, 56899584, [16], 1], ["AN", 2, 0, 5], ["AN", 2, 1, 6], ["FU", 1, [0, 1, 2, 3]], ["SP", 1, 0, 56899584, [8], 1], ["AN", 1, 0, 5], ["AN", 1, 1, 6], ["PR", 1, 0, "auto_unroll_max_step$16"]]]], "r": [[0.0411365], 0, 6.95519, 1638444375], "v": "v0.6"}
{"i": [["[\"pool_layer\", \"avg\", 128, 1008, 42, 42, 1, 1, 2, \"VALID\"]", "cuda -keys=cuda,gpu -max_num_threads=1024 -thread_warp_size=32", [-1, 16, 64, 49152, 2147483647, 1024, 8, 32], "", 0, []], [[], [["FU", 2, [0, 1, 2, 3]], ["SP", 2, 0, 56899584, [8], 1], ["AN", 2, 0, 5], ["AN", 2, 1, 6], ["FU", 1, [0, 1, 2, 3]], ["SP", 1, 0, 56899584, [4], 1], ["AN", 1, 0, 5], ["AN", 1, 1, 6], ["PR", 1, 0, "auto_unroll_max_step$0"]]]], "r": [[0.0798131], 0, 7.14458, 1638444382], "v": "v0.6"}
{"i": [["[\"pool_layer\", \"avg\", 128, 1008, 42, 42, 1, 1, 2, \"VALID\"]", "cuda -keys=cuda,gpu -max_num_threads=1024 -thread_warp_size=32", [-1, 16, 64, 49152, 2147483647, 1024, 8, 32], "", 0, []], [[], [["FU", 2, [0, 1, 2, 3]], ["SP", 2, 0, 56899584, [2], 1], ["AN", 2, 0, 5], ["AN", 2, 1, 6], ["FU", 1, [0, 1, 2, 3]], ["SP", 1, 0, 56899584, [8], 1], ["AN", 1, 0, 5], ["AN", 1, 1, 6], ["PR", 1, 0, "auto_unroll_max_step$16"]]]], "r": [[0.130386], 0, 7.19973, 1638444389], "v": "v0.6"}
{"i": [["[\"pool_layer\", \"avg\", 128, 1008, 42, 42, 1, 1, 2, \"VALID\"]", "cuda -keys=cuda,gpu -max_num_threads=1024 -thread_warp_size=32", [-1, 16, 64, 49152, 2147483647, 1024, 8, 32], "", 0, []], [[], [["FU", 2, [0, 1, 2, 3]], ["SP", 2, 0, 56899584, [64], 1], ["AN", 2, 0, 5], ["AN", 2, 1, 6], ["FU", 1, [0, 1, 2, 3]], ["SP", 1, 0, 56899584, [32], 1], ["AN", 1, 0, 5], ["AN", 1, 1, 6], ["PR", 1, 0, "auto_unroll_max_step$1024"]]]], "r": [[0.0126694], 0, 7.23445, 1638444396], "v": "v0.6"}
{"i": [["[\"pool_layer\", \"avg\", 128, 1008, 42, 42, 1, 1, 2, \"VALID\"]", "cuda -keys=cuda,gpu -max_num_threads=1024 -thread_warp_size=32", [-1, 16, 64, 49152, 2147483647, 1024, 8, 32], "", 0, []], [[], [["FU", 2, [0, 1, 2, 3]], ["SP", 2, 0, 56899584, [1], 1], ["AN", 2, 0, 5], ["AN", 2, 1, 6], ["FU", 1, [0, 1, 2, 3]], ["SP", 1, 0, 56899584, [64], 1], ["AN", 1, 0, 5], ["AN", 1, 1, 6], ["PR", 1, 0, "auto_unroll_max_step$0"]]]], "r": [[0.206851], 0, 7.54373, 1638444403], "v": "v0.6"}
{"i": [["[\"pool_layer\", \"avg\", 128, 1008, 42, 42, 1, 1, 2, \"VALID\"]", "cuda -keys=cuda,gpu -max_num_threads=1024 -thread_warp_size=32", [-1, 16, 64, 49152, 2147483647, 1024, 8, 32], "", 0, []], [[], [["FU", 2, [0, 1, 2, 3]], ["SP", 2, 0, 56899584, [32], 1], ["AN", 2, 0, 5], ["AN", 2, 1, 6], ["FU", 1, [0, 1, 2, 3]], ["SP", 1, 0, 56899584, [16], 1], ["AN", 1, 0, 5], ["AN", 1, 1, 6], ["PR", 1, 0, "auto_unroll_max_step$16"]]]], "r": [[0.0219093], 0, 6.86421, 1638444409], "v": "v0.6"}
{"i": [["[\"pool_layer\", \"avg\", 128, 1008, 42, 42, 1, 1, 2, \"VALID\"]", "cuda -keys=cuda,gpu -max_num_threads=1024 -thread_warp_size=32", [-1, 16, 64, 49152, 2147483647, 1024, 8, 32], "", 0, []], [[], [["FU", 2, [0, 1, 2, 3]], ["SP", 2, 0, 56899584, [2], 1], ["AN", 2, 0, 5], ["AN", 2, 1, 6], ["FU", 1, [0, 1, 2, 3]], ["SP", 1, 0, 56899584, [64], 1], ["AN", 1, 0, 5], ["AN", 1, 1, 6], ["PR", 1, 0, "auto_unroll_max_step$64"]]]], "r": [[0.107417], 0, 7.02361, 1638444416], "v": "v0.6"}
{"i": [["[\"pool_layer\", \"avg\", 128, 1008, 42, 42, 1, 1, 2, \"VALID\"]", "cuda -keys=cuda,gpu -max_num_threads=1024 -thread_warp_size=32", [-1, 16, 64, 49152, 2147483647, 1024, 8, 32], "", 0, []], [[], [["FU", 2, [0, 1, 2, 3]], ["SP", 2, 0, 56899584, [64], 1], ["AN", 2, 0, 5], ["AN", 2, 1, 6], ["FU", 1, [0, 1, 2, 3]], ["SP", 1, 0, 56899584, [8], 1], ["AN", 1, 0, 5], ["AN", 1, 1, 6], ["PR", 1, 0, "auto_unroll_max_step$512"]]]], "r": [[0.0324384], 0, 7.00647, 1638444423], "v": "v0.6"}
{"i": [["[\"pool_layer\", \"avg\", 128, 1008, 42, 42, 1, 1, 2, \"VALID\"]", "cuda -keys=cuda,gpu -max_num_threads=1024 -thread_warp_size=32", [-1, 16, 64, 49152, 2147483647, 1024, 8, 32], "", 0, []], [[], [["FU", 2, [0, 1, 2, 3]], ["SP", 2, 0, 56899584, [49], 1], ["AN", 2, 0, 5], ["AN", 2, 1, 6], ["FU", 1, [0, 1, 2, 3]], ["SP", 1, 0, 56899584, [16], 1], ["AN", 1, 0, 5], ["AN", 1, 1, 6], ["PR", 1, 0, "auto_unroll_max_step$512"]]]], "r": [[0.020447], 0, 6.81588, 1638444429], "v": "v0.6"}
{"i": [["[\"pool_layer\", \"avg\", 128, 1008, 42, 42, 1, 1, 2, \"VALID\"]", "cuda -keys=cuda,gpu -max_num_threads=1024 -thread_warp_size=32", [-1, 16, 64, 49152, 2147483647, 1024, 8, 32], "", 0, []], [[], [["FU", 2, [0, 1, 2, 3]], ["SP", 2, 0, 56899584, [2], 1], ["AN", 2, 0, 5], ["AN", 2, 1, 6], ["FU", 1, [0, 1, 2, 3]], ["SP", 1, 0, 56899584, [2], 1], ["AN", 1, 0, 5], ["AN", 1, 1, 6], ["PR", 1, 0, "auto_unroll_max_step$16"]]]], "r": [[0.211322], 0, 7.5957, 1638444437], "v": "v0.6"}
{"i": [["[\"pool_layer\", \"avg\", 128, 1008, 42, 42, 1, 1, 2, \"VALID\"]", "cuda -keys=cuda,gpu -max_num_threads=1024 -thread_warp_size=32", [-1, 16, 64, 49152, 2147483647, 1024, 8, 32], "", 0, []], [[], [["FU", 2, [0, 1, 2, 3]], ["SP", 2, 0, 56899584, [32], 1], ["AN", 2, 0, 5], ["AN", 2, 1, 6], ["FU", 1, [0, 1, 2, 3]], ["SP", 1, 0, 56899584, [64], 1], ["AN", 1, 0, 5], ["AN", 1, 1, 6], ["PR", 1, 0, "auto_unroll_max_step$0"]]]], "r": [[0.0126943], 0, 7.19158, 1638444443], "v": "v0.6"}
{"i": [["[\"pool_layer\", \"avg\", 128, 1008, 42, 42, 1, 1, 2, \"VALID\"]", "cuda -keys=cuda,gpu -max_num_threads=1024 -thread_warp_size=32", [-1, 16, 64, 49152, 2147483647, 1024, 8, 32], "", 0, []], [[], [["FU", 2, [0, 1, 2, 3]], ["SP", 2, 0, 56899584, [16], 1], ["AN", 2, 0, 5], ["AN", 2, 1, 6], ["FU", 1, [0, 1, 2, 3]], ["SP", 1, 0, 56899584, [64], 1], ["AN", 1, 0, 5], ["AN", 1, 1, 6], ["PR", 1, 0, "auto_unroll_max_step$512"]]]], "r": [[0.0181788], 0, 6.83961, 1638444450], "v": "v0.6"}
{"i": [["[\"pool_layer\", \"avg\", 128, 1008, 42, 42, 1, 1, 2, \"VALID\"]", "cuda -keys=cuda,gpu -max_num_threads=1024 -thread_warp_size=32", [-1, 16, 64, 49152, 2147483647, 1024, 8, 32], "", 0, []], [[], [["FU", 2, [0, 1, 2, 3]], ["SP", 2, 0, 56899584, [32], 1], ["AN", 2, 0, 5], ["AN", 2, 1, 6], ["FU", 1, [0, 1, 2, 3]], ["SP", 1, 0, 56899584, [16], 1], ["AN", 1, 0, 5], ["AN", 1, 1, 6], ["PR", 1, 0, "auto_unroll_max_step$512"]]]], "r": [[0.0219178], 0, 6.81886, 1638444456], "v": "v0.6"}
{"i": [["[\"pool_layer\", \"avg\", 128, 1008, 42, 42, 1, 1, 2, \"VALID\"]", "cuda -keys=cuda,gpu -max_num_threads=1024 -thread_warp_size=32", [-1, 16, 64, 49152, 2147483647, 1024, 8, 32], "", 0, []], [[], [["FU", 2, [0, 1, 2, 3]], ["SP", 2, 0, 56899584, [4], 1], ["AN", 2, 0, 5], ["AN", 2, 1, 6], ["FU", 1, [0, 1, 2, 3]], ["SP", 1, 0, 56899584, [4], 1], ["AN", 1, 0, 5], ["AN", 1, 1, 6], ["PR", 1, 0, "auto_unroll_max_step$16"]]]], "r": [[0.104773], 0, 7.02586, 1638444463], "v": "v0.6"}
{"i": [["[\"pool_layer\", \"avg\", 128, 1008, 42, 42, 1, 1, 2, \"VALID\"]", "cuda -keys=cuda,gpu -max_num_threads=1024 -thread_warp_size=32", [-1, 16, 64, 49152, 2147483647, 1024, 8, 32], "", 0, []], [[], [["FU", 2, [0, 1, 2, 3]], ["SP", 2, 0, 56899584, [64], 1], ["AN", 2, 0, 5], ["AN", 2, 1, 6], ["FU", 1, [0, 1, 2, 3]], ["SP", 1, 0, 56899584, [64], 1], ["AN", 1, 0, 5], ["AN", 1, 1, 6], ["PR", 1, 0, "auto_unroll_max_step$1024"]]]], "r": [[0.00947492], 0, 6.76145, 1638444470], "v": "v0.6"}
{"i": [["[\"pool_layer\", \"avg\", 128, 1008, 42, 42, 1, 1, 2, \"VALID\"]", "cuda -keys=cuda,gpu -max_num_threads=1024 -thread_warp_size=32", [-1, 16, 64, 49152, 2147483647, 1024, 8, 32], "", 0, []], [[], [["FU", 2, [0, 1, 2, 3]], ["SP", 2, 0, 56899584, [32], 1], ["AN", 2, 0, 5], ["AN", 2, 1, 6], ["FU", 1, [0, 1, 2, 3]], ["SP", 1, 0, 56899584, [32], 1], ["AN", 1, 0, 5], ["AN", 1, 1, 6], ["PR", 1, 0, "auto_unroll_max_step$64"]]]], "r": [[0.0149008], 0, 6.85495, 1638444476], "v": "v0.6"}
{"i": [["[\"pool_layer\", \"avg\", 128, 1008, 42, 42, 1, 1, 2, \"VALID\"]", "cuda -keys=cuda,gpu -max_num_threads=1024 -thread_warp_size=32", [-1, 16, 64, 49152, 2147483647, 1024, 8, 32], "", 0, []], [[], [["FU", 2, [0, 1, 2, 3]], ["SP", 2, 0, 56899584, [32], 1], ["AN", 2, 0, 5], ["AN", 2, 1, 6], ["FU", 1, [0, 1, 2, 3]], ["SP", 1, 0, 56899584, [32], 1], ["AN", 1, 0, 5], ["AN", 1, 1, 6], ["PR", 1, 0, "auto_unroll_max_step$512"]]]], "r": [[0.0149008], 0, 6.93296, 1638444483], "v": "v0.6"}
{"i": [["[\"pool_layer\", \"avg\", 128, 1008, 42, 42, 1, 1, 2, \"VALID\"]", "cuda -keys=cuda,gpu -max_num_threads=1024 -thread_warp_size=32", [-1, 16, 64, 49152, 2147483647, 1024, 8, 32], "", 0, []], [[], [["FU", 2, [0, 1, 2, 3]], ["SP", 2, 0, 56899584, [32], 1], ["AN", 2, 0, 5], ["AN", 2, 1, 6], ["FU", 1, [0, 1, 2, 3]], ["SP", 1, 0, 56899584, [36], 1], ["AN", 1, 0, 5], ["AN", 1, 1, 6], ["PR", 1, 0, "auto_unroll_max_step$0"]]]], "r": [[0.0148186], 0, 7.3017, 1638444490], "v": "v0.6"}
{"i": [["[\"pool_layer\", \"avg\", 128, 1008, 42, 42, 1, 1, 2, \"VALID\"]", "cuda -keys=cuda,gpu -max_num_threads=1024 -thread_warp_size=32", [-1, 16, 64, 49152, 2147483647, 1024, 8, 32], "", 0, []], [[], [["FU", 2, [0, 1, 2, 3]], ["SP", 2, 0, 56899584, [24], 1], ["AN", 2, 0, 5], ["AN", 2, 1, 6], ["FU", 1, [0, 1, 2, 3]], ["SP", 1, 0, 56899584, [64], 1], ["AN", 1, 0, 5], ["AN", 1, 1, 6], ["PR", 1, 0, "auto_unroll_max_step$0"]]]], "r": [[0.0144549], 0, 6.83796, 1638444496], "v": "v0.6"}
{"i": [["[\"pool_layer\", \"avg\", 128, 1008, 42, 42, 1, 1, 2, \"VALID\"]", "cuda -keys=cuda,gpu -max_num_threads=1024 -thread_warp_size=32", [-1, 16, 64, 49152, 2147483647, 1024, 8, 32], "", 0, []], [[], [["FU", 2, [0, 1, 2, 3]], ["SP", 2, 0, 56899584, [56], 1], ["AN", 2, 0, 5], ["AN", 2, 1, 6], ["FU", 1, [0, 1, 2, 3]], ["SP", 1, 0, 56899584, [32], 1], ["AN", 1, 0, 5], ["AN", 1, 1, 6], ["PR", 1, 0, "auto_unroll_max_step$512"]]]], "r": [[0.0127809], 0, 6.81001, 1638444503], "v": "v0.6"}
{"i": [["[\"pool_layer\", \"avg\", 128, 1008, 42, 42, 1, 1, 2, \"VALID\"]", "cuda -keys=cuda,gpu -max_num_threads=1024 -thread_warp_size=32", [-1, 16, 64, 49152, 2147483647, 1024, 8, 32], "", 0, []], [[], [["FU", 2, [0, 1, 2, 3]], ["SP", 2, 0, 56899584, [24], 1], ["AN", 2, 0, 5], ["AN", 2, 1, 6], ["FU", 1, [0, 1, 2, 3]], ["SP", 1, 0, 56899584, [32], 1], ["AN", 1, 0, 5], ["AN", 1, 1, 6], ["PR", 1, 0, "auto_unroll_max_step$512"]]]], "r": [[0.0170971], 0, 6.75816, 1638444509], "v": "v0.6"}
{"i": [["[\"pool_layer\", \"avg\", 128, 1008, 42, 42, 1, 1, 2, \"VALID\"]", "cuda -keys=cuda,gpu -max_num_threads=1024 -thread_warp_size=32", [-1, 16, 64, 49152, 2147483647, 1024, 8, 32], "", 0, []], [[], [["FU", 2, [0, 1, 2, 3]], ["SP", 2, 0, 56899584, [64], 1], ["AN", 2, 0, 5], ["AN", 2, 1, 6], ["FU", 1, [0, 1, 2, 3]], ["SP", 1, 0, 56899584, [32], 1], ["AN", 1, 0, 5], ["AN", 1, 1, 6], ["PR", 1, 0, "auto_unroll_max_step$0"]]]], "r": [[0.0121121], 0, 6.82097, 1638444516], "v": "v0.6"}
{"i": [["[\"pool_layer\", \"avg\", 128, 1008, 42, 42, 1, 1, 2, \"VALID\"]", "cuda -keys=cuda,gpu -max_num_threads=1024 -thread_warp_size=32", [-1, 16, 64, 49152, 2147483647, 1024, 8, 32], "", 0, []], [[], [["FU", 2, [0, 1, 2, 3]], ["SP", 2, 0, 56899584, [3], 1], ["AN", 2, 0, 5], ["AN", 2, 1, 6], ["FU", 1, [0, 1, 2, 3]], ["SP", 1, 0, 56899584, [32], 1], ["AN", 1, 0, 5], ["AN", 1, 1, 6], ["PR", 1, 0, "auto_unroll_max_step$16"]]]], "r": [[0.0760045], 0, 7.25989, 1638444523], "v": "v0.6"}
{"i": [["[\"pool_layer\", \"avg\", 128, 1008, 42, 42, 1, 1, 2, \"VALID\"]", "cuda -keys=cuda,gpu -max_num_threads=1024 -thread_warp_size=32", [-1, 16, 64, 49152, 2147483647, 1024, 8, 32], "", 0, []], [[], [["FU", 2, [0, 1, 2, 3]], ["SP", 2, 0, 56899584, [8], 1], ["AN", 2, 0, 5], ["AN", 2, 1, 6], ["FU", 1, [0, 1, 2, 3]], ["SP", 1, 0, 56899584, [16], 1], ["AN", 1, 0, 5], ["AN", 1, 1, 6], ["PR", 1, 0, "auto_unroll_max_step$0"]]]], "r": [[0.0400513], 0, 7.00595, 1638444529], "v": "v0.6"}
{"i": [["[\"pool_layer\", \"avg\", 128, 1008, 42, 42, 1, 1, 2, \"VALID\"]", "cuda -keys=cuda,gpu -max_num_threads=1024 -thread_warp_size=32", [-1, 16, 64, 49152, 2147483647, 1024, 8, 32], "", 0, []], [[], [["FU", 2, [0, 1, 2, 3]], ["SP", 2, 0, 56899584, [18], 1], ["AN", 2, 0, 5], ["AN", 2, 1, 6], ["FU", 1, [0, 1, 2, 3]], ["SP", 1, 0, 56899584, [32], 1], ["AN", 1, 0, 5], ["AN", 1, 1, 6], ["PR", 1, 0, "auto_unroll_max_step$0"]]]], "r": [[0.0210375], 0, 7.33511, 1638444537], "v": "v0.6"}
{"i": [["[\"pool_layer\", \"avg\", 128, 1008, 42, 42, 1, 1, 2, \"VALID\"]", "cuda -keys=cuda,gpu -max_num_threads=1024 -thread_warp_size=32", [-1, 16, 64, 49152, 2147483647, 1024, 8, 32], "", 0, []], [[], [["FU", 2, [0, 1, 2, 3]], ["SP", 2, 0, 56899584, [21], 1], ["AN", 2, 0, 5], ["AN", 2, 1, 6], ["FU", 1, [0, 1, 2, 3]], ["SP", 1, 0, 56899584, [8], 1], ["AN", 1, 0, 5], ["AN", 1, 1, 6], ["PR", 1, 0, "auto_unroll_max_step$512"]]]], "r": [[0.0387017], 0, 6.98795, 1638444543], "v": "v0.6"}
{"i": [["[\"pool_layer\", \"avg\", 128, 1008, 42, 42, 1, 1, 2, \"VALID\"]", "cuda -keys=cuda,gpu -max_num_threads=1024 -thread_warp_size=32", [-1, 16, 64, 49152, 2147483647, 1024, 8, 32], "", 0, []], [[], [["FU", 2, [0, 1, 2, 3]], ["SP", 2, 0, 56899584, [32], 1], ["AN", 2, 0, 5], ["AN", 2, 1, 6], ["FU", 1, [0, 1, 2, 3]], ["SP", 1, 0, 56899584, [54], 1], ["AN", 1, 0, 5], ["AN", 1, 1, 6], ["PR", 1, 0, "auto_unroll_max_step$512"]]]], "r": [[0.0126933], 0, 6.80142, 1638444550], "v": "v0.6"}
{"i": [["[\"pool_layer\", \"avg\", 128, 1008, 42, 42, 1, 1, 2, \"VALID\"]", "cuda -keys=cuda,gpu -max_num_threads=1024 -thread_warp_size=32", [-1, 16, 64, 49152, 2147483647, 1024, 8, 32], "", 0, []], [[], [["FU", 2, [0, 1, 2, 3]], ["SP", 2, 0, 56899584, [4], 1], ["AN", 2, 0, 5], ["AN", 2, 1, 6], ["FU", 1, [0, 1, 2, 3]], ["SP", 1, 0, 56899584, [2], 1], ["AN", 1, 0, 5], ["AN", 1, 1, 6], ["PR", 1, 0, "auto_unroll_max_step$512"]]]], "r": [[0.159296], 0, 7.22728, 1638444557], "v": "v0.6"}
{"i": [["[\"pool_layer\", \"avg\", 128, 1008, 42, 42, 1, 1, 2, \"VALID\"]", "cuda -keys=cuda,gpu -max_num_threads=1024 -thread_warp_size=32", [-1, 16, 64, 49152, 2147483647, 1024, 8, 32], "", 0, []], [[], [["FU", 2, [0, 1, 2, 3]], ["SP", 2, 0, 56899584, [64], 1], ["AN", 2, 0, 5], ["AN", 2, 1, 6], ["FU", 1, [0, 1, 2, 3]], ["SP", 1, 0, 56899584, [32], 1], ["AN", 1, 0, 5], ["AN", 1, 1, 6], ["PR", 1, 0, "auto_unroll_max_step$16"]]]], "r": [[0.0121121], 0, 6.73214, 1638444563], "v": "v0.6"}
{"i": [["[\"pool_layer\", \"avg\", 128, 1008, 42, 42, 1, 1, 2, \"VALID\"]", "cuda -keys=cuda,gpu -max_num_threads=1024 -thread_warp_size=32", [-1, 16, 64, 49152, 2147483647, 1024, 8, 32], "", 0, []], [[], [["FU", 2, [0, 1, 2, 3]], ["SP", 2, 0, 56899584, [64], 1], ["AN", 2, 0, 5], ["AN", 2, 1, 6], ["FU", 1, [0, 1, 2, 3]], ["SP", 1, 0, 56899584, [16], 1], ["AN", 1, 0, 5], ["AN", 1, 1, 6], ["PR", 1, 0, "auto_unroll_max_step$0"]]]], "r": [[0.0191317], 0, 6.8605, 1638444570], "v": "v0.6"}
{"i": [["[\"pool_layer\", \"avg\", 128, 1008, 42, 42, 1, 1, 2, \"VALID\"]", "cuda -keys=cuda,gpu -max_num_threads=1024 -thread_warp_size=32", [-1, 16, 64, 49152, 2147483647, 1024, 8, 32], "", 0, []], [[], [["FU", 2, [0, 1, 2, 3]], ["SP", 2, 0, 56899584, [2], 1], ["AN", 2, 0, 5], ["AN", 2, 1, 6], ["FU", 1, [0, 1, 2, 3]], ["SP", 1, 0, 56899584, [64], 1], ["AN", 1, 0, 5], ["AN", 1, 1, 6], ["PR", 1, 0, "auto_unroll_max_step$16"]]]], "r": [[0.107482], 0, 6.99222, 1638444576], "v": "v0.6"}
{"i": [["[\"pool_layer\", \"avg\", 128, 1008, 42, 42, 1, 1, 2, \"VALID\"]", "cuda -keys=cuda,gpu -max_num_threads=1024 -thread_warp_size=32", [-1, 16, 64, 49152, 2147483647, 1024, 8, 32], "", 0, []], [[], [["FU", 2, [0, 1, 2, 3]], ["SP", 2, 0, 56899584, [2], 1], ["AN", 2, 0, 5], ["AN", 2, 1, 6], ["FU", 1, [0, 1, 2, 3]], ["SP", 1, 0, 56899584, [32], 1], ["AN", 1, 0, 5], ["AN", 1, 1, 6], ["PR", 1, 0, "auto_unroll_max_step$512"]]]], "r": [[0.127235], 0, 7.10505, 1638444583], "v": "v0.6"}
{"i": [["[\"pool_layer\", \"avg\", 128, 1008, 42, 42, 1, 1, 2, \"VALID\"]", "cuda -keys=cuda,gpu -max_num_threads=1024 -thread_warp_size=32", [-1, 16, 64, 49152, 2147483647, 1024, 8, 32], "", 0, []], [[], [["FU", 2, [0, 1, 2, 3]], ["SP", 2, 0, 56899584, [16], 1], ["AN", 2, 0, 5], ["AN", 2, 1, 6], ["FU", 1, [0, 1, 2, 3]], ["SP", 1, 0, 56899584, [4], 1], ["AN", 1, 0, 5], ["AN", 1, 1, 6], ["PR", 1, 0, "auto_unroll_max_step$16"]]]], "r": [[0.0676107], 0, 7.09506, 1638444590], "v": "v0.6"}
{"i": [["[\"pool_layer\", \"avg\", 128, 1008, 42, 42, 1, 1, 2, \"VALID\"]", "cuda -keys=cuda,gpu -max_num_threads=1024 -thread_warp_size=32", [-1, 16, 64, 49152, 2147483647, 1024, 8, 32], "", 0, []], [[], [["FU", 2, [0, 1, 2, 3]], ["SP", 2, 0, 56899584, [16], 1], ["AN", 2, 0, 5], ["AN", 2, 1, 6], ["FU", 1, [0, 1, 2, 3]], ["SP", 1, 0, 56899584, [64], 1], ["AN", 1, 0, 5], ["AN", 1, 1, 6], ["PR", 1, 0, "auto_unroll_max_step$16"]]]], "r": [[0.0181751], 0, 6.78098, 1638444597], "v": "v0.6"}
{"i": [["[\"pool_layer\", \"avg\", 128, 1008, 42, 42, 1, 1, 2, \"VALID\"]", "cuda -keys=cuda,gpu -max_num_threads=1024 -thread_warp_size=32", [-1, 16, 64, 49152, 2147483647, 1024, 8, 32], "", 0, []], [[], [["FU", 2, [0, 1, 2, 3]], ["SP", 2, 0, 56899584, [2], 1], ["AN", 2, 0, 5], ["AN", 2, 1, 6], ["FU", 1, [0, 1, 2, 3]], ["SP", 1, 0, 56899584, [64], 1], ["AN", 1, 0, 5], ["AN", 1, 1, 6], ["PR", 1, 0, "auto_unroll_max_step$512"]]]], "r": [[0.107424], 0, 6.82819, 1638444605], "v": "v0.6"}
{"i": [["[\"pool_layer\", \"avg\", 128, 1008, 42, 42, 1, 1, 2, \"VALID\"]", "cuda -keys=cuda,gpu -max_num_threads=1024 -thread_warp_size=32", [-1, 16, 64, 49152, 2147483647, 1024, 8, 32], "", 0, []], [[], [["FU", 2, [0, 1, 2, 3]], ["SP", 2, 0, 56899584, [56], 1], ["AN", 2, 0, 5], ["AN", 2, 1, 6], ["FU", 1, [0, 1, 2, 3]], ["SP", 1, 0, 56899584, [4], 1], ["AN", 1, 0, 5], ["AN", 1, 1, 6], ["PR", 1, 0, "auto_unroll_max_step$512"]]]], "r": [[0.0595676], 0, 6.95811, 1638444612], "v": "v0.6"}
{"i": [["[\"pool_layer\", \"avg\", 128, 1008, 42, 42, 1, 1, 2, \"VALID\"]", "cuda -keys=cuda,gpu -max_num_threads=1024 -thread_warp_size=32", [-1, 16, 64, 49152, 2147483647, 1024, 8, 32], "", 0, []], [[], [["FU", 2, [0, 1, 2, 3]], ["SP", 2, 0, 56899584, [4], 1], ["AN", 2, 0, 5], ["AN", 2, 1, 6], ["FU", 1, [0, 1, 2, 3]], ["SP", 1, 0, 56899584, [1], 1], ["AN", 1, 0, 5], ["AN", 1, 1, 6], ["PR", 1, 0, "auto_unroll_max_step$512"]]]], "r": [[0.262758], 0, 7.70018, 1638444620], "v": "v0.6"}
{"i": [["[\"pool_layer\", \"avg\", 128, 1008, 42, 42, 1, 1, 2, \"VALID\"]", "cuda -keys=cuda,gpu -max_num_threads=1024 -thread_warp_size=32", [-1, 16, 64, 49152, 2147483647, 1024, 8, 32], "", 0, []], [[], [["FU", 2, [0, 1, 2, 3]], ["SP", 2, 0, 56899584, [32], 1], ["AN", 2, 0, 5], ["AN", 2, 1, 6], ["FU", 1, [0, 1, 2, 3]], ["SP", 1, 0, 56899584, [3], 1], ["AN", 1, 0, 5], ["AN", 1, 1, 6], ["PR", 1, 0, "auto_unroll_max_step$1024"]]]], "r": [[0.0796755], 0, 7.13805, 1638444627], "v": "v0.6"}
{"i": [["[\"pool_layer\", \"avg\", 128, 1008, 42, 42, 1, 1, 2, \"VALID\"]", "cuda -keys=cuda,gpu -max_num_threads=1024 -thread_warp_size=32", [-1, 16, 64, 49152, 2147483647, 1024, 8, 32], "", 0, []], [[], [["FU", 2, [0, 1, 2, 3]], ["SP", 2, 0, 56899584, [32], 1], ["AN", 2, 0, 5], ["AN", 2, 1, 6], ["FU", 1, [0, 1, 2, 3]], ["SP", 1, 0, 56899584, [32], 1], ["AN", 1, 0, 5], ["AN", 1, 1, 6], ["PR", 1, 0, "auto_unroll_max_step$16"]]]], "r": [[0.0148979], 0, 6.73168, 1638444633], "v": "v0.6"}
{"i": [["[\"pool_layer\", \"avg\", 128, 1008, 42, 42, 1, 1, 2, \"VALID\"]", "cuda -keys=cuda,gpu -max_num_threads=1024 -thread_warp_size=32", [-1, 16, 64, 49152, 2147483647, 1024, 8, 32], "", 0, []], [[], [["FU", 2, [0, 1, 2, 3]], ["SP", 2, 0, 56899584, [32], 1], ["AN", 2, 0, 5], ["AN", 2, 1, 6], ["FU", 1, [0, 1, 2, 3]], ["SP", 1, 0, 56899584, [2], 1], ["AN", 1, 0, 5], ["AN", 1, 1, 6], ["PR", 1, 0, "auto_unroll_max_step$0"]]]], "r": [[0.116141], 0, 7.00896, 1638444640], "v": "v0.6"}
{"i": [["[\"pool_layer\", \"avg\", 128, 1008, 42, 42, 1, 1, 2, \"VALID\"]", "cuda -keys=cuda,gpu -max_num_threads=1024 -thread_warp_size=32", [-1, 16, 64, 49152, 2147483647, 1024, 8, 32], "", 0, []], [[], [["FU", 2, [0, 1, 2, 3]], ["SP", 2, 0, 56899584, [8], 1], ["AN", 2, 0, 5], ["AN", 2, 1, 6], ["FU", 1, [0, 1, 2, 3]], ["SP", 1, 0, 56899584, [32], 1], ["AN", 1, 0, 5], ["AN", 1, 1, 6], ["PR", 1, 0, "auto_unroll_max_step$0"]]]], "r": [[0.0330302], 0, 6.85584, 1638444647], "v": "v0.6"}
{"i": [["[\"pool_layer\", \"avg\", 128, 1008, 42, 42, 1, 1, 2, \"VALID\"]", "cuda -keys=cuda,gpu -max_num_threads=1024 -thread_warp_size=32", [-1, 16, 64, 49152, 2147483647, 1024, 8, 32], "", 0, []], [[], [["FU", 2, [0, 1, 2, 3]], ["SP", 2, 0, 56899584, [4], 1], ["AN", 2, 0, 5], ["AN", 2, 1, 6], ["FU", 1, [0, 1, 2, 3]], ["SP", 1, 0, 56899584, [32], 1], ["AN", 1, 0, 5], ["AN", 1, 1, 6], ["PR", 1, 0, "auto_unroll_max_step$16"]]]], "r": [[0.0579454], 0, 7.02068, 1638444653], "v": "v0.6"}
{"i": [["[\"pool_layer\", \"avg\", 128, 1008, 42, 42, 1, 1, 2, \"VALID\"]", "cuda -keys=cuda,gpu -max_num_threads=1024 -thread_warp_size=32", [-1, 16, 64, 49152, 2147483647, 1024, 8, 32], "", 0, []], [[], [["FU", 2, [0, 1, 2, 3]], ["SP", 2, 0, 56899584, [1], 1], ["AN", 2, 0, 5], ["AN", 2, 1, 6], ["FU", 1, [0, 1, 2, 3]], ["SP", 1, 0, 56899584, [32], 1], ["AN", 1, 0, 5], ["AN", 1, 1, 6], ["PR", 1, 0, "auto_unroll_max_step$1024"]]]], "r": [[0.209516], 0, 7.37818, 1638444660], "v": "v0.6"}
{"i": [["[\"pool_layer\", \"avg\", 128, 1008, 42, 42, 1, 1, 2, \"VALID\"]", "cuda -keys=cuda,gpu -max_num_threads=1024 -thread_warp_size=32", [-1, 16, 64, 49152, 2147483647, 1024, 8, 32], "", 0, []], [[], [["FU", 2, [0, 1, 2, 3]], ["SP", 2, 0, 56899584, [14], 1], ["AN", 2, 0, 5], ["AN", 2, 1, 6], ["FU", 1, [0, 1, 2, 3]], ["SP", 1, 0, 56899584, [64], 1], ["AN", 1, 0, 5], ["AN", 1, 1, 6], ["PR", 1, 0, "auto_unroll_max_step$0"]]]], "r": [[0.0201965], 0, 6.75494, 1638444667], "v": "v0.6"}
{"i": [["[\"pool_layer\", \"avg\", 128, 1008, 42, 42, 1, 1, 2, \"VALID\"]", "cuda -keys=cuda,gpu -max_num_threads=1024 -thread_warp_size=32", [-1, 16, 64, 49152, 2147483647, 1024, 8, 32], "", 0, []], [[], [["FU", 2, [0, 1, 2, 3]], ["SP", 2, 0, 56899584, [32], 1], ["AN", 2, 0, 5], ["AN", 2, 1, 6], ["FU", 1, [0, 1, 2, 3]], ["SP", 1, 0, 56899584, [64], 1], ["AN", 1, 0, 5], ["AN", 1, 1, 6], ["PR", 1, 0, "auto_unroll_max_step$16"]]]], "r": [[0.012538], 0, 7.09204, 1638444674], "v": "v0.6"}
{"i": [["[\"pool_layer\", \"avg\", 128, 1008, 42, 42, 1, 1, 2, \"VALID\"]", "cuda -keys=cuda,gpu -max_num_threads=1024 -thread_warp_size=32", [-1, 16, 64, 49152, 2147483647, 1024, 8, 32], "", 0, []], [[], [["FU", 2, [0, 1, 2, 3]], ["SP", 2, 0, 56899584, [16], 1], ["AN", 2, 0, 5], ["AN", 2, 1, 6], ["FU", 1, [0, 1, 2, 3]], ["SP", 1, 0, 56899584, [1], 1], ["AN", 1, 0, 5], ["AN", 1, 1, 6], ["PR", 1, 0, "auto_unroll_max_step$16"]]]], "r": [[0.225627], 0, 7.52378, 1638444681], "v": "v0.6"}
{"i": [["[\"pool_layer\", \"avg\", 128, 1008, 42, 42, 1, 1, 2, \"VALID\"]", "cuda -keys=cuda,gpu -max_num_threads=1024 -thread_warp_size=32", [-1, 16, 64, 49152, 2147483647, 1024, 8, 32], "", 0, []], [[], [["FU", 2, [0, 1, 2, 3]], ["SP", 2, 0, 56899584, [16], 1], ["AN", 2, 0, 5], ["AN", 2, 1, 6], ["FU", 1, [0, 1, 2, 3]], ["SP", 1, 0, 56899584, [16], 1], ["AN", 1, 0, 5], ["AN", 1, 1, 6], ["PR", 1, 0, "auto_unroll_max_step$512"]]]], "r": [[0.0278253], 0, 6.84371, 1638444688], "v": "v0.6"}
{"i": [["[\"pool_layer\", \"avg\", 128, 1008, 42, 42, 1, 1, 2, \"VALID\"]", "cuda -keys=cuda,gpu -max_num_threads=1024 -thread_warp_size=32", [-1, 16, 64, 49152, 2147483647, 1024, 8, 32], "", 0, []], [[], [["FU", 2, [0, 1, 2, 3]], ["SP", 2, 0, 56899584, [32], 1], ["AN", 2, 0, 5], ["AN", 2, 1, 6], ["FU", 1, [0, 1, 2, 3]], ["SP", 1, 0, 56899584, [32], 1], ["AN", 1, 0, 5], ["AN", 1, 1, 6], ["PR", 1, 0, "auto_unroll_max_step$0"]]]], "r": [[0.0148944], 0, 6.73113, 1638444694], "v": "v0.6"}
{"i": [["[\"pool_layer\", \"avg\", 128, 1008, 42, 42, 1, 1, 2, \"VALID\"]", "cuda -keys=cuda,gpu -max_num_threads=1024 -thread_warp_size=32", [-1, 16, 64, 49152, 2147483647, 1024, 8, 32], "", 0, []], [[], [["FU", 2, [0, 1, 2, 3]], ["SP", 2, 0, 56899584, [32], 1], ["AN", 2, 0, 5], ["AN", 2, 1, 6], ["FU", 1, [0, 1, 2, 3]], ["SP", 1, 0, 56899584, [32], 1], ["AN", 1, 0, 5], ["AN", 1, 1, 6], ["PR", 1, 0, "auto_unroll_max_step$1024"]]]], "r": [[0.0148945], 0, 6.77767, 1638444701], "v": "v0.6"}
{"i": [["[\"pool_layer\", \"avg\", 128, 1008, 42, 42, 1, 1, 2, \"VALID\"]", "cuda -keys=cuda,gpu -max_num_threads=1024 -thread_warp_size=32", [-1, 16, 64, 49152, 2147483647, 1024, 8, 32], "", 0, []], [[], [["FU", 2, [0, 1, 2, 3]], ["SP", 2, 0, 56899584, [8], 1], ["AN", 2, 0, 5], ["AN", 2, 1, 6], ["FU", 1, [0, 1, 2, 3]], ["SP", 1, 0, 56899584, [32], 1], ["AN", 1, 0, 5], ["AN", 1, 1, 6], ["PR", 1, 0, "auto_unroll_max_step$512"]]]], "r": [[0.0330237], 0, 6.79537, 1638444707], "v": "v0.6"}
{"i": [["[\"pool_layer\", \"avg\", 128, 1008, 42, 42, 1, 1, 2, \"VALID\"]", "cuda -keys=cuda,gpu -max_num_threads=1024 -thread_warp_size=32", [-1, 16, 64, 49152, 2147483647, 1024, 8, 32], "", 0, []], [[], [["FU", 2, [0, 1, 2, 3]], ["SP", 2, 0, 56899584, [8], 1], ["AN", 2, 0, 5], ["AN", 2, 1, 6], ["FU", 1, [0, 1, 2, 3]], ["SP", 1, 0, 56899584, [8], 1], ["AN", 1, 0, 5], ["AN", 1, 1, 6], ["PR", 1, 0, "auto_unroll_max_step$1024"]]]], "r": [[0.0603277], 0, 7.05637, 1638444721], "v": "v0.6"}
{"i": [["[\"pool_layer\", \"avg\", 128, 1008, 42, 42, 1, 1, 2, \"VALID\"]", "cuda -keys=cuda,gpu -max_num_threads=1024 -thread_warp_size=32", [-1, 16, 64, 49152, 2147483647, 1024, 8, 32], "", 0, []], [[], [["FU", 2, [0, 1, 2, 3]], ["SP", 2, 0, 56899584, [64], 1], ["AN", 2, 0, 5], ["AN", 2, 1, 6], ["FU", 1, [0, 1, 2, 3]], ["SP", 1, 0, 56899584, [4], 1], ["AN", 1, 0, 5], ["AN", 1, 1, 6], ["PR", 1, 0, "auto_unroll_max_step$0"]]]], "r": [[0.0589283], 0, 7.19531, 1638444728], "v": "v0.6"}
{"i": [["[\"pool_layer\", \"avg\", 128, 1008, 42, 42, 1, 1, 2, \"VALID\"]", "cuda -keys=cuda,gpu -max_num_threads=1024 -thread_warp_size=32", [-1, 16, 64, 49152, 2147483647, 1024, 8, 32], "", 0, []], [[], [["FU", 2, [0, 1, 2, 3]], ["SP", 2, 0, 56899584, [1], 1], ["AN", 2, 0, 5], ["AN", 2, 1, 6], ["FU", 1, [0, 1, 2, 3]], ["SP", 1, 0, 56899584, [8], 1], ["AN", 1, 0, 5], ["AN", 1, 1, 6], ["PR", 1, 0, "auto_unroll_max_step$512"]]]], "r": [[0.229924], 0, 7.62449, 1638444736], "v": "v0.6"}
{"i": [["[\"pool_layer\", \"avg\", 128, 1008, 42, 42, 1, 1, 2, \"VALID\"]", "cuda -keys=cuda,gpu -max_num_threads=1024 -thread_warp_size=32", [-1, 16, 64, 49152, 2147483647, 1024, 8, 32], "", 0, []], [[], [["FU", 2, [0, 1, 2, 3]], ["SP", 2, 0, 56899584, [21], 1], ["AN", 2, 0, 5], ["AN", 2, 1, 6], ["FU", 1, [0, 1, 2, 3]], ["SP", 1, 0, 56899584, [64], 1], ["AN", 1, 0, 5], ["AN", 1, 1, 6], ["PR", 1, 0, "auto_unroll_max_step$512"]]]], "r": [[0.0157224], 0, 6.87759, 1638444742], "v": "v0.6"}
{"i": [["[\"pool_layer\", \"avg\", 128, 1008, 42, 42, 1, 1, 2, \"VALID\"]", "cuda -keys=cuda,gpu -max_num_threads=1024 -thread_warp_size=32", [-1, 16, 64, 49152, 2147483647, 1024, 8, 32], "", 0, []], [[], [["FU", 2, [0, 1, 2, 3]], ["SP", 2, 0, 56899584, [48], 1], ["AN", 2, 0, 5], ["AN", 2, 1, 6], ["FU", 1, [0, 1, 2, 3]], ["SP", 1, 0, 56899584, [4], 1], ["AN", 1, 0, 5], ["AN", 1, 1, 6], ["PR", 1, 0, "auto_unroll_max_step$0"]]]], "r": [[0.0602867], 0, 7.10277, 1638444749], "v": "v0.6"}
{"i": [["[\"pool_layer\", \"avg\", 128, 1008, 42, 42, 1, 1, 2, \"VALID\"]", "cuda -keys=cuda,gpu -max_num_threads=1024 -thread_warp_size=32", [-1, 16, 64, 49152, 2147483647, 1024, 8, 32], "", 0, []], [[], [["FU", 2, [0, 1, 2, 3]], ["SP", 2, 0, 56899584, [3], 1], ["AN", 2, 0, 5], ["AN", 2, 1, 6], ["FU", 1, [0, 1, 2, 3]], ["SP", 1, 0, 56899584, [64], 1], ["AN", 1, 0, 5], ["AN", 1, 1, 6], ["PR", 1, 0, "auto_unroll_max_step$0"]]]], "r": [[0.0733954], 0, 7.16544, 1638444756], "v": "v0.6"}
{"i": [["[\"pool_layer\", \"avg\", 128, 1008, 42, 42, 1, 1, 2, \"VALID\"]", "cuda -keys=cuda,gpu -max_num_threads=1024 -thread_warp_size=32", [-1, 16, 64, 49152, 2147483647, 1024, 8, 32], "", 0, []], [[], [["FU", 2, [0, 1, 2, 3]], ["SP", 2, 0, 56899584, [12], 1], ["AN", 2, 0, 5], ["AN", 2, 1, 6], ["FU", 1, [0, 1, 2, 3]], ["SP", 1, 0, 56899584, [1], 1], ["AN", 1, 0, 5], ["AN", 1, 1, 6], ["PR", 1, 0, "auto_unroll_max_step$16"]]]], "r": [[0.230042], 0, 7.61152, 1638444763], "v": "v0.6"}
{"i": [["[\"pool_layer\", \"avg\", 128, 1008, 42, 42, 1, 1, 2, \"VALID\"]", "cuda -keys=cuda,gpu -max_num_threads=1024 -thread_warp_size=32", [-1, 16, 64, 49152, 2147483647, 1024, 8, 32], "", 0, []], [[], [["FU", 2, [0, 1, 2, 3]], ["SP", 2, 0, 56899584, [36], 1], ["AN", 2, 0, 5], ["AN", 2, 1, 6], ["FU", 1, [0, 1, 2, 3]], ["SP", 1, 0, 56899584, [3], 1], ["AN", 1, 0, 5], ["AN", 1, 1, 6], ["PR", 1, 0, "auto_unroll_max_step$1024"]]]], "r": [[0.079626], 0, 7.17514, 1638444770], "v": "v0.6"}
{"i": [["[\"pool_layer\", \"avg\", 128, 1008, 42, 42, 1, 1, 2, \"VALID\"]", "cuda -keys=cuda,gpu -max_num_threads=1024 -thread_warp_size=32", [-1, 16, 64, 49152, 2147483647, 1024, 8, 32], "", 0, []], [[], [["FU", 2, [0, 1, 2, 3]], ["SP", 2, 0, 56899584, [2], 1], ["AN", 2, 0, 5], ["AN", 2, 1, 6], ["FU", 1, [0, 1, 2, 3]], ["SP", 1, 0, 56899584, [12], 1], ["AN", 1, 0, 5], ["AN", 1, 1, 6], ["PR", 1, 0, "auto_unroll_max_step$1024"]]]], "r": [[0.126937], 0, 7.06911, 1638444777], "v": "v0.6"}
{"i": [["[\"pool_layer\", \"avg\", 128, 1008, 42, 42, 1, 1, 2, \"VALID\"]", "cuda -keys=cuda,gpu -max_num_threads=1024 -thread_warp_size=32", [-1, 16, 64, 49152, 2147483647, 1024, 8, 32], "", 0, []], [[], [["FU", 2, [0, 1, 2, 3]], ["SP", 2, 0, 56899584, [18], 1], ["AN", 2, 0, 5], ["AN", 2, 1, 6], ["FU", 1, [0, 1, 2, 3]], ["SP", 1, 0, 56899584, [2], 1], ["AN", 1, 0, 5], ["AN", 1, 1, 6], ["PR", 1, 0, "auto_unroll_max_step$0"]]]], "r": [[0.12114], 0, 7.30038, 1638444784], "v": "v0.6"}
{"i": [["[\"pool_layer\", \"avg\", 128, 1008, 42, 42, 1, 1, 2, \"VALID\"]", "cuda -keys=cuda,gpu -max_num_threads=1024 -thread_warp_size=32", [-1, 16, 64, 49152, 2147483647, 1024, 8, 32], "", 0, []], [[], [["FU", 2, [0, 1, 2, 3]], ["SP", 2, 0, 56899584, [36], 1], ["AN", 2, 0, 5], ["AN", 2, 1, 6], ["FU", 1, [0, 1, 2, 3]], ["SP", 1, 0, 56899584, [54], 1], ["AN", 1, 0, 5], ["AN", 1, 1, 6], ["PR", 1, 0, "auto_unroll_max_step$1024"]]]], "r": [[0.0126484], 0, 6.84914, 1638444790], "v": "v0.6"}
{"i": [["[\"pool_layer\", \"avg\", 128, 1008, 42, 42, 1, 1, 2, \"VALID\"]", "cuda -keys=cuda,gpu -max_num_threads=1024 -thread_warp_size=32", [-1, 16, 64, 49152, 2147483647, 1024, 8, 32], "", 0, []], [[], [["FU", 2, [0, 1, 2, 3]], ["SP", 2, 0, 56899584, [64], 1], ["AN", 2, 0, 5], ["AN", 2, 1, 6], ["FU", 1, [0, 1, 2, 3]], ["SP", 1, 0, 56899584, [1], 1], ["AN", 1, 0, 5], ["AN", 1, 1, 6], ["PR", 1, 0, "auto_unroll_max_step$0"]]]], "r": [[0.216952], 0, 7.54502, 1638444797], "v": "v0.6"}
{"i": [["[\"pool_layer\", \"avg\", 128, 1008, 42, 42, 1, 1, 2, \"VALID\"]", "cuda -keys=cuda,gpu -max_num_threads=1024 -thread_warp_size=32", [-1, 16, 64, 49152, 2147483647, 1024, 8, 32], "", 0, []], [[], [["FU", 2, [0, 1, 2, 3]], ["SP", 2, 0, 56899584, [24], 1], ["AN", 2, 0, 5], ["AN", 2, 1, 6], ["FU", 1, [0, 1, 2, 3]], ["SP", 1, 0, 56899584, [8], 1], ["AN", 1, 0, 5], ["AN", 1, 1, 6], ["PR", 1, 0, "auto_unroll_max_step$0"]]]], "r": [[0.0374081], 0, 6.95201, 1638444804], "v": "v0.6"}
{"i": [["[\"pool_layer\", \"avg\", 128, 1008, 42, 42, 1, 1, 2, \"VALID\"]", "cuda -keys=cuda,gpu -max_num_threads=1024 -thread_warp_size=32", [-1, 16, 64, 49152, 2147483647, 1024, 8, 32], "", 0, []], [[], [["FU", 2, [0, 1, 2, 3]], ["SP", 2, 0, 56899584, [4], 1], ["AN", 2, 0, 5], ["AN", 2, 1, 6], ["FU", 1, [0, 1, 2, 3]], ["SP", 1, 0, 56899584, [16], 1], ["AN", 1, 0, 5], ["AN", 1, 1, 6], ["PR", 1, 0, "auto_unroll_max_step$0"]]]], "r": [[0.064965], 0, 7.16483, 1638444811], "v": "v0.6"}
{"i": [["[\"pool_layer\", \"avg\", 128, 1008, 42, 42, 1, 1, 2, \"VALID\"]", "cuda -keys=cuda,gpu -max_num_threads=1024 -thread_warp_size=32", [-1, 16, 64, 49152, 2147483647, 1024, 8, 32], "", 0, []], [[], [["FU", 2, [0, 1, 2, 3]], ["SP", 2, 0, 56899584, [12], 1], ["AN", 2, 0, 5], ["AN", 2, 1, 6], ["FU", 1, [0, 1, 2, 3]], ["SP", 1, 0, 56899584, [8], 1], ["AN", 1, 0, 5], ["AN", 1, 1, 6], ["PR", 1, 0, "auto_unroll_max_step$1024"]]]], "r": [[0.0514206], 0, 7.11422, 1638444817], "v": "v0.6"}
{"i": [["[\"pool_layer\", \"avg\", 128, 1008, 42, 42, 1, 1, 2, \"VALID\"]", "cuda -keys=cuda,gpu -max_num_threads=1024 -thread_warp_size=32", [-1, 16, 64, 49152, 2147483647, 1024, 8, 32], "", 0, []], [[], [["FU", 2, [0, 1, 2, 3]], ["SP", 2, 0, 56899584, [7], 1], ["AN", 2, 0, 5], ["AN", 2, 1, 6], ["FU", 1, [0, 1, 2, 3]], ["SP", 1, 0, 56899584, [64], 1], ["AN", 1, 0, 5], ["AN", 1, 1, 6], ["PR", 1, 0, "auto_unroll_max_step$512"]]]], "r": [[0.0341406], 0, 7.04689, 1638444824], "v": "v0.6"}
{"i": [["[\"pool_layer\", \"avg\", 128, 1008, 42, 42, 1, 1, 2, \"VALID\"]", "cuda -keys=cuda,gpu -max_num_threads=1024 -thread_warp_size=32", [-1, 16, 64, 49152, 2147483647, 1024, 8, 32], "", 0, []], [[], [["FU", 2, [0, 1, 2, 3]], ["SP", 2, 0, 56899584, [12], 1], ["AN", 2, 0, 5], ["AN", 2, 1, 6], ["FU", 1, [0, 1, 2, 3]], ["SP", 1, 0, 56899584, [4], 1], ["AN", 1, 0, 5], ["AN", 1, 1, 6], ["PR", 1, 0, "auto_unroll_max_step$0"]]]], "r": [[0.0718476], 0, 7.19908, 1638444831], "v": "v0.6"}
{"i": [["[\"pool_layer\", \"avg\", 128, 1008, 42, 42, 1, 1, 2, \"VALID\"]", "cuda -keys=cuda,gpu -max_num_threads=1024 -thread_warp_size=32", [-1, 16, 64, 49152, 2147483647, 1024, 8, 32], "", 0, []], [[], [["FU", 2, [0, 1, 2, 3]], ["SP", 2, 0, 56899584, [16], 1], ["AN", 2, 0, 5], ["AN", 2, 1, 6], ["FU", 1, [0, 1, 2, 3]], ["SP", 1, 0, 56899584, [9], 1], ["AN", 1, 0, 5], ["AN", 1, 1, 6], ["PR", 1, 0, "auto_unroll_max_step$0"]]]], "r": [[0.0383774], 0, 6.99389, 1638444838], "v": "v0.6"}
{"i": [["[\"pool_layer\", \"avg\", 128, 1008, 42, 42, 1, 1, 2, \"VALID\"]", "cuda -keys=cuda,gpu -max_num_threads=1024 -thread_warp_size=32", [-1, 16, 64, 49152, 2147483647, 1024, 8, 32], "", 0, []], [[], [["FU", 2, [0, 1, 2, 3]], ["SP", 2, 0, 56899584, [16], 1], ["AN", 2, 0, 5], ["AN", 2, 1, 6], ["FU", 1, [0, 1, 2, 3]], ["SP", 1, 0, 56899584, [4], 1], ["AN", 1, 0, 5], ["AN", 1, 1, 6], ["PR", 1, 0, "auto_unroll_max_step$0"]]]], "r": [[0.0676073], 0, 7.1385, 1638444844], "v": "v0.6"}
{"i": [["[\"pool_layer\", \"avg\", 128, 1008, 42, 42, 1, 1, 2, \"VALID\"]", "cuda -keys=cuda,gpu -max_num_threads=1024 -thread_warp_size=32", [-1, 16, 64, 49152, 2147483647, 1024, 8, 32], "", 0, []], [[], [["FU", 2, [0, 1, 2, 3]], ["SP", 2, 0, 56899584, [2], 1], ["AN", 2, 0, 5], ["AN", 2, 1, 6], ["FU", 1, [0, 1, 2, 3]], ["SP", 1, 0, 56899584, [8], 1], ["AN", 1, 0, 5], ["AN", 1, 1, 6], ["PR", 1, 0, "auto_unroll_max_step$1024"]]]], "r": [[0.13042], 0, 7.09653, 1638444851], "v": "v0.6"}
{"i": [["[\"pool_layer\", \"avg\", 128, 1008, 42, 42, 1, 1, 2, \"VALID\"]", "cuda -keys=cuda,gpu -max_num_threads=1024 -thread_warp_size=32", [-1, 16, 64, 49152, 2147483647, 1024, 8, 32], "", 0, []], [[], [["FU", 2, [0, 1, 2, 3]], ["SP", 2, 0, 56899584, [16], 1], ["AN", 2, 0, 5], ["AN", 2, 1, 6], ["FU", 1, [0, 1, 2, 3]], ["SP", 1, 0, 56899584, [32], 1], ["AN", 1, 0, 5], ["AN", 1, 1, 6], ["PR", 1, 0, "auto_unroll_max_step$0"]]]], "r": [[0.0208175], 0, 6.85985, 1638444858], "v": "v0.6"}
{"i": [["[\"pool_layer\", \"avg\", 128, 1008, 42, 42, 1, 1, 2, \"VALID\"]", "cuda -keys=cuda,gpu -max_num_threads=1024 -thread_warp_size=32", [-1, 16, 64, 49152, 2147483647, 1024, 8, 32], "", 0, []], [[], [["FU", 2, [0, 1, 2, 3]], ["SP", 2, 0, 56899584, [2], 1], ["AN", 2, 0, 5], ["AN", 2, 1, 6], ["FU", 1, [0, 1, 2, 3]], ["SP", 1, 0, 56899584, [32], 1], ["AN", 1, 0, 5], ["AN", 1, 1, 6], ["PR", 1, 0, "auto_unroll_max_step$16"]]]], "r": [[0.130048], 0, 7.1525, 1638444865], "v": "v0.6"}
{"i": [["[\"pool_layer\", \"avg\", 128, 1008, 42, 42, 1, 1, 2, \"VALID\"]", "cuda -keys=cuda,gpu -max_num_threads=1024 -thread_warp_size=32", [-1, 16, 64, 49152, 2147483647, 1024, 8, 32], "", 0, []], [[], [["FU", 2, [0, 1, 2, 3]], ["SP", 2, 0, 56899584, [32], 1], ["AN", 2, 0, 5], ["AN", 2, 1, 6], ["FU", 1, [0, 1, 2, 3]], ["SP", 1, 0, 56899584, [8], 1], ["AN", 1, 0, 5], ["AN", 1, 1, 6], ["PR", 1, 0, "auto_unroll_max_step$0"]]]], "r": [[0.0352257], 0, 6.97455, 1638444871], "v": "v0.6"}
{"i": [["[\"pool_layer\", \"avg\", 128, 1008, 42, 42, 1, 1, 2, \"VALID\"]", "cuda -keys=cuda,gpu -max_num_threads=1024 -thread_warp_size=32", [-1, 16, 64, 49152, 2147483647, 1024, 8, 32], "", 0, []], [[], [["FU", 2, [0, 1, 2, 3]], ["SP", 2, 0, 56899584, [4], 1], ["AN", 2, 0, 5], ["AN", 2, 1, 6], ["FU", 1, [0, 1, 2, 3]], ["SP", 1, 0, 56899584, [28], 1], ["AN", 1, 0, 5], ["AN", 1, 1, 6], ["PR", 1, 0, "auto_unroll_max_step$16"]]]], "r": [[0.0591461], 0, 7.15192, 1638444878], "v": "v0.6"}
{"i": [["[\"pool_layer\", \"avg\", 128, 1008, 42, 42, 1, 1, 2, \"VALID\"]", "cuda -keys=cuda,gpu -max_num_threads=1024 -thread_warp_size=32", [-1, 16, 64, 49152, 2147483647, 1024, 8, 32], "", 0, []], [[], [["FU", 2, [0, 1, 2, 3]], ["SP", 2, 0, 56899584, [64], 1], ["AN", 2, 0, 5], ["AN", 2, 1, 6], ["FU", 1, [0, 1, 2, 3]], ["SP", 1, 0, 56899584, [54], 1], ["AN", 1, 0, 5], ["AN", 1, 1, 6], ["PR", 1, 0, "auto_unroll_max_step$512"]]]], "r": [[0.0099084], 0, 6.80696, 1638444885], "v": "v0.6"}
{"i": [["[\"pool_layer\", \"avg\", 128, 1008, 42, 42, 1, 1, 2, \"VALID\"]", "cuda -keys=cuda,gpu -max_num_threads=1024 -thread_warp_size=32", [-1, 16, 64, 49152, 2147483647, 1024, 8, 32], "", 0, []], [[], [["FU", 2, [0, 1, 2, 3]], ["SP", 2, 0, 56899584, [56], 1], ["AN", 2, 0, 5], ["AN", 2, 1, 6], ["FU", 1, [0, 1, 2, 3]], ["SP", 1, 0, 56899584, [32], 1], ["AN", 1, 0, 5], ["AN", 1, 1, 6], ["PR", 1, 0, "auto_unroll_max_step$16"]]]], "r": [[0.0127851], 0, 6.81914, 1638444891], "v": "v0.6"}
{"i": [["[\"pool_layer\", \"avg\", 128, 1008, 42, 42, 1, 1, 2, \"VALID\"]", "cuda -keys=cuda,gpu -max_num_threads=1024 -thread_warp_size=32", [-1, 16, 64, 49152, 2147483647, 1024, 8, 32], "", 0, []], [[], [["FU", 2, [0, 1, 2, 3]], ["SP", 2, 0, 56899584, [36], 1], ["AN", 2, 0, 5], ["AN", 2, 1, 6], ["FU", 1, [0, 1, 2, 3]], ["SP", 1, 0, 56899584, [32], 1], ["AN", 1, 0, 5], ["AN", 1, 1, 6], ["PR", 1, 0, "auto_unroll_max_step$1024"]]]], "r": [[0.0148526], 0, 6.82374, 1638444898], "v": "v0.6"}
{"i": [["[\"pool_layer\", \"avg\", 128, 1008, 42, 42, 1, 1, 2, \"VALID\"]", "cuda -keys=cuda,gpu -max_num_threads=1024 -thread_warp_size=32", [-1, 16, 64, 49152, 2147483647, 1024, 8, 32], "", 0, []], [[], [["FU", 2, [0, 1, 2, 3]], ["SP", 2, 0, 56899584, [1], 1], ["AN", 2, 0, 5], ["AN", 2, 1, 6], ["FU", 1, [0, 1, 2, 3]], ["SP", 1, 0, 56899584, [56], 1], ["AN", 1, 0, 5], ["AN", 1, 1, 6], ["PR", 1, 0, "auto_unroll_max_step$1024"]]]], "r": [[0.207222], 0, 7.48126, 1638444905], "v": "v0.6"}
{"i": [["[\"pool_layer\", \"avg\", 128, 1008, 42, 42, 1, 1, 2, \"VALID\"]", "cuda -keys=cuda,gpu -max_num_threads=1024 -thread_warp_size=32", [-1, 16, 64, 49152, 2147483647, 1024, 8, 32], "", 0, []], [[], [["FU", 2, [0, 1, 2, 3]], ["SP", 2, 0, 56899584, [36], 1], ["AN", 2, 0, 5], ["AN", 2, 1, 6], ["FU", 1, [0, 1, 2, 3]], ["SP", 1, 0, 56899584, [64], 1], ["AN", 1, 0, 5], ["AN", 1, 1, 6], ["PR", 1, 0, "auto_unroll_max_step$16"]]]], "r": [[0.0128307], 0, 7.17323, 1638444912], "v": "v0.6"}
{"i": [["[\"pool_layer\", \"avg\", 128, 1008, 42, 42, 1, 1, 2, \"VALID\"]", "cuda -keys=cuda,gpu -max_num_threads=1024 -thread_warp_size=32", [-1, 16, 64, 49152, 2147483647, 1024, 8, 32], "", 0, []], [[], [["FU", 2, [0, 1, 2, 3]], ["SP", 2, 0, 56899584, [2], 1], ["AN", 2, 0, 5], ["AN", 2, 1, 6], ["FU", 1, [0, 1, 2, 3]], ["SP", 1, 0, 56899584, [2], 1], ["AN", 1, 0, 5], ["AN", 1, 1, 6], ["PR", 1, 0, "auto_unroll_max_step$1024"]]]], "r": [[0.211308], 0, 7.4985, 1638444919], "v": "v0.6"}
{"i": [["[\"pool_layer\", \"avg\", 128, 1008, 42, 42, 1, 1, 2, \"VALID\"]", "cuda -keys=cuda,gpu -max_num_threads=1024 -thread_warp_size=32", [-1, 16, 64, 49152, 2147483647, 1024, 8, 32], "", 0, []], [[], [["FU", 2, [0, 1, 2, 3]], ["SP", 2, 0, 56899584, [1], 1], ["AN", 2, 0, 5], ["AN", 2, 1, 6], ["FU", 1, [0, 1, 2, 3]], ["SP", 1, 0, 56899584, [6], 1], ["AN", 1, 0, 5], ["AN", 1, 1, 6], ["PR", 1, 0, "auto_unroll_max_step$16"]]]], "r": [[0.238708], 0, 7.68877, 1638444926], "v": "v0.6"}
{"i": [["[\"pool_layer\", \"avg\", 128, 1008, 42, 42, 1, 1, 2, \"VALID\"]", "cuda -keys=cuda,gpu -max_num_threads=1024 -thread_warp_size=32", [-1, 16, 64, 49152, 2147483647, 1024, 8, 32], "", 0, []], [[], [["FU", 2, [0, 1, 2, 3]], ["SP", 2, 0, 56899584, [56], 1], ["AN", 2, 0, 5], ["AN", 2, 1, 6], ["FU", 1, [0, 1, 2, 3]], ["SP", 1, 0, 56899584, [64], 1], ["AN", 1, 0, 5], ["AN", 1, 1, 6], ["PR", 1, 0, "auto_unroll_max_step$512"]]]], "r": [[0.01014], 0, 6.81566, 1638444933], "v": "v0.6"}
{"i": [["[\"pool_layer\", \"avg\", 128, 1008, 42, 42, 1, 1, 2, \"VALID\"]", "cuda -keys=cuda,gpu -max_num_threads=1024 -thread_warp_size=32", [-1, 16, 64, 49152, 2147483647, 1024, 8, 32], "", 0, []], [[], [["FU", 2, [0, 1, 2, 3]], ["SP", 2, 0, 56899584, [64], 1], ["AN", 2, 0, 5], ["AN", 2, 1, 6], ["FU", 1, [0, 1, 2, 3]], ["SP", 1, 0, 56899584, [6], 1], ["AN", 1, 0, 5], ["AN", 1, 1, 6], ["PR", 1, 0, "auto_unroll_max_step$512"]]]], "r": [[0.0417896], 0, 7.44251, 1638444940], "v": "v0.6"}
{"i": [["[\"pool_layer\", \"avg\", 128, 1008, 42, 42, 1, 1, 2, \"VALID\"]", "cuda -keys=cuda,gpu -max_num_threads=1024 -thread_warp_size=32", [-1, 16, 64, 49152, 2147483647, 1024, 8, 32], "", 0, []], [[], [["FU", 2, [0, 1, 2, 3]], ["SP", 2, 0, 56899584, [1], 1], ["AN", 2, 0, 5], ["AN", 2, 1, 6], ["FU", 1, [0, 1, 2, 3]], ["SP", 1, 0, 56899584, [4], 1], ["AN", 1, 0, 5], ["AN", 1, 1, 6], ["PR", 1, 0, "auto_unroll_max_step$16"]]]], "r": [[0.266435], 0, 8.48256, 1638444948], "v": "v0.6"}
{"i": [["[\"pool_layer\", \"avg\", 128, 1008, 42, 42, 1, 1, 2, \"VALID\"]", "cuda -keys=cuda,gpu -max_num_threads=1024 -thread_warp_size=32", [-1, 16, 64, 49152, 2147483647, 1024, 8, 32], "", 0, []], [[], [["FU", 2, [0, 1, 2, 3]], ["SP", 2, 0, 56899584, [2], 1], ["AN", 2, 0, 5], ["AN", 2, 1, 6], ["FU", 1, [0, 1, 2, 3]], ["SP", 1, 0, 56899584, [32], 1], ["AN", 1, 0, 5], ["AN", 1, 1, 6], ["PR", 1, 0, "auto_unroll_max_step$1024"]]]], "r": [[0.110451], 0, 7.49527, 1638444955], "v": "v0.6"}
{"i": [["[\"pool_layer\", \"avg\", 128, 1008, 42, 42, 1, 1, 2, \"VALID\"]", "cuda -keys=cuda,gpu -max_num_threads=1024 -thread_warp_size=32", [-1, 16, 64, 49152, 2147483647, 1024, 8, 32], "", 0, []], [[], [["FU", 2, [0, 1, 2, 3]], ["SP", 2, 0, 56899584, [4], 1], ["AN", 2, 0, 5], ["AN", 2, 1, 6], ["FU", 1, [0, 1, 2, 3]], ["SP", 1, 0, 56899584, [2], 1], ["AN", 1, 0, 5], ["AN", 1, 1, 6], ["PR", 1, 0, "auto_unroll_max_step$1024"]]]], "r": [[0.159295], 0, 7.22823, 1638444962], "v": "v0.6"}
{"i": [["[\"pool_layer\", \"avg\", 128, 1008, 42, 42, 1, 1, 2, \"VALID\"]", "cuda -keys=cuda,gpu -max_num_threads=1024 -thread_warp_size=32", [-1, 16, 64, 49152, 2147483647, 1024, 8, 32], "", 0, []], [[], [["FU", 2, [0, 1, 2, 3]], ["SP", 2, 0, 56899584, [16], 1], ["AN", 2, 0, 5], ["AN", 2, 1, 6], ["FU", 1, [0, 1, 2, 3]], ["SP", 1, 0, 56899584, [6], 1], ["AN", 1, 0, 5], ["AN", 1, 1, 6], ["PR", 1, 0, "auto_unroll_max_step$512"]]]], "r": [[0.0500582], 0, 7.01456, 1638444969], "v": "v0.6"}
{"i": [["[\"pool_layer\", \"avg\", 128, 1008, 42, 42, 1, 1, 2, \"VALID\"]", "cuda -keys=cuda,gpu -max_num_threads=1024 -thread_warp_size=32", [-1, 16, 64, 49152, 2147483647, 1024, 8, 32], "", 0, []], [[], [["FU", 2, [0, 1, 2, 3]], ["SP", 2, 0, 56899584, [1], 1], ["AN", 2, 0, 5], ["AN", 2, 1, 6], ["FU", 1, [0, 1, 2, 3]], ["SP", 1, 0, 56899584, [64], 1], ["AN", 1, 0, 5], ["AN", 1, 1, 6], ["PR", 1, 0, "auto_unroll_max_step$1024"]]]], "r": [[0.206983], 0, 7.45994, 1638444976], "v": "v0.6"}
{"i": [["[\"pool_layer\", \"avg\", 128, 1008, 42, 42, 1, 1, 2, \"VALID\"]", "cuda -keys=cuda,gpu -max_num_threads=1024 -thread_warp_size=32", [-1, 16, 64, 49152, 2147483647, 1024, 8, 32], "", 0, []], [[], [["FU", 2, [0, 1, 2, 3]], ["SP", 2, 0, 56899584, [3], 1], ["AN", 2, 0, 5], ["AN", 2, 1, 6], ["FU", 1, [0, 1, 2, 3]], ["SP", 1, 0, 56899584, [16], 1], ["AN", 1, 0, 5], ["AN", 1, 1, 6], ["PR", 1, 0, "auto_unroll_max_step$0"]]]], "r": [[0.0830704], 0, 7.22413, 1638444983], "v": "v0.6"}
{"i": [["[\"pool_layer\", \"avg\", 128, 1008, 42, 42, 1, 1, 2, \"VALID\"]", "cuda -keys=cuda,gpu -max_num_threads=1024 -thread_warp_size=32", [-1, 16, 64, 49152, 2147483647, 1024, 8, 32], "", 0, []], [[], [["FU", 2, [0, 1, 2, 3]], ["SP", 2, 0, 56899584, [48], 1], ["AN", 2, 0, 5], ["AN", 2, 1, 6], ["FU", 1, [0, 1, 2, 3]], ["SP", 1, 0, 56899584, [32], 1], ["AN", 1, 0, 5], ["AN", 1, 1, 6], ["PR", 1, 0, "auto_unroll_max_step$16"]]]], "r": [[0.0134667], 0, 6.81951, 1638444989], "v": "v0.6"}
{"i": [["[\"pool_layer\", \"avg\", 128, 1008, 42, 42, 1, 1, 2, \"VALID\"]", "cuda -keys=cuda,gpu -max_num_threads=1024 -thread_warp_size=32", [-1, 16, 64, 49152, 2147483647, 1024, 8, 32], "", 0, []], [[], [["FU", 2, [0, 1, 2, 3]], ["SP", 2, 0, 56899584, [3], 1], ["AN", 2, 0, 5], ["AN", 2, 1, 6], ["FU", 1, [0, 1, 2, 3]], ["SP", 1, 0, 56899584, [16], 1], ["AN", 1, 0, 5], ["AN", 1, 1, 6], ["PR", 1, 0, "auto_unroll_max_step$16"]]]], "r": [[0.0830857], 0, 7.23543, 1638444996], "v": "v0.6"}
{"i": [["[\"pool_layer\", \"avg\", 128, 1008, 42, 42, 1, 1, 2, \"VALID\"]", "cuda -keys=cuda,gpu -max_num_threads=1024 -thread_warp_size=32", [-1, 16, 64, 49152, 2147483647, 1024, 8, 32], "", 0, []], [[], [["FU", 2, [0, 1, 2, 3]], ["SP", 2, 0, 56899584, [2], 1], ["AN", 2, 0, 5], ["AN", 2, 1, 6], ["FU", 1, [0, 1, 2, 3]], ["SP", 1, 0, 56899584, [16], 1], ["AN", 1, 0, 5], ["AN", 1, 1, 6], ["PR", 1, 0, "auto_unroll_max_step$16"]]]], "r": [[0.129259], 0, 7.07929, 1638445003], "v": "v0.6"}
{"i": [["[\"pool_layer\", \"avg\", 128, 1008, 42, 42, 1, 1, 2, \"VALID\"]", "cuda -keys=cuda,gpu -max_num_threads=1024 -thread_warp_size=32", [-1, 16, 64, 49152, 2147483647, 1024, 8, 32], "", 0, []], [[], [["FU", 2, [0, 1, 2, 3]], ["SP", 2, 0, 56899584, [2], 1], ["AN", 2, 0, 5], ["AN", 2, 1, 6], ["FU", 1, [0, 1, 2, 3]], ["SP", 1, 0, 56899584, [1], 1], ["AN", 1, 0, 5], ["AN", 1, 1, 6], ["PR", 1, 0, "auto_unroll_max_step$0"]]]], "r": [[0.314866], 0, 8.04697, 1638445011], "v": "v0.6"}
{"i": [["[\"pool_layer\", \"avg\", 128, 1008, 42, 42, 1, 1, 2, \"VALID\"]", "cuda -keys=cuda,gpu -max_num_threads=1024 -thread_warp_size=32", [-1, 16, 64, 49152, 2147483647, 1024, 8, 32], "", 0, []], [[], [["FU", 2, [0, 1, 2, 3]], ["SP", 2, 0, 56899584, [32], 1], ["AN", 2, 0, 5], ["AN", 2, 1, 6], ["FU", 1, [0, 1, 2, 3]], ["SP", 1, 0, 56899584, [42], 1], ["AN", 1, 0, 5], ["AN", 1, 1, 6], ["PR", 1, 0, "auto_unroll_max_step$1024"]]]], "r": [[0.0133294], 0, 6.83845, 1638445018], "v": "v0.6"}
{"i": [["[\"pool_layer\", \"avg\", 128, 1008, 42, 42, 1, 1, 2, \"VALID\"]", "cuda -keys=cuda,gpu -max_num_threads=1024 -thread_warp_size=32", [-1, 16, 64, 49152, 2147483647, 1024, 8, 32], "", 0, []], [[], [["FU", 2, [0, 1, 2, 3]], ["SP", 2, 0, 56899584, [21], 1], ["AN", 2, 0, 5], ["AN", 2, 1, 6], ["FU", 1, [0, 1, 2, 3]], ["SP", 1, 0, 56899584, [1], 1], ["AN", 1, 0, 5], ["AN", 1, 1, 6], ["PR", 1, 0, "auto_unroll_max_step$1024"]]]], "r": [[0.223171], 0, 7.56692, 1638445025], "v": "v0.6"}
{"i": [["[\"pool_layer\", \"avg\", 128, 1008, 42, 42, 1, 1, 2, \"VALID\"]", "cuda -keys=cuda,gpu -max_num_threads=1024 -thread_warp_size=32", [-1, 16, 64, 49152, 2147483647, 1024, 8, 32], "", 0, []], [[], [["FU", 2, [0, 1, 2, 3]], ["SP", 2, 0, 56899584, [56], 1], ["AN", 2, 0, 5], ["AN", 2, 1, 6], ["FU", 1, [0, 1, 2, 3]], ["SP", 1, 0, 56899584, [28], 1], ["AN", 1, 0, 5], ["AN", 1, 1, 6], ["PR", 1, 0, "auto_unroll_max_step$1024"]]]], "r": [[0.0139713], 0, 6.77422, 1638445031], "v": "v0.6"}
{"i": [["[\"pool_layer\", \"avg\", 128, 1008, 42, 42, 1, 1, 2, \"VALID\"]", "cuda -keys=cuda,gpu -max_num_threads=1024 -thread_warp_size=32", [-1, 16, 64, 49152, 2147483647, 1024, 8, 32], "", 0, []], [[], [["FU", 2, [0, 1, 2, 3]], ["SP", 2, 0, 56899584, [21], 1], ["AN", 2, 0, 5], ["AN", 2, 1, 6], ["FU", 1, [0, 1, 2, 3]], ["SP", 1, 0, 56899584, [4], 1], ["AN", 1, 0, 5], ["AN", 1, 1, 6], ["PR", 1, 0, "auto_unroll_max_step$512"]]]], "r": [[0.0651485], 0, 7.03037, 1638445038], "v": "v0.6"}
{"i": [["[\"pool_layer\", \"avg\", 128, 1008, 42, 42, 1, 1, 2, \"VALID\"]", "cuda -keys=cuda,gpu -max_num_threads=1024 -thread_warp_size=32", [-1, 16, 64, 49152, 2147483647, 1024, 8, 32], "", 0, []], [[], [["FU", 2, [0, 1, 2, 3]], ["SP", 2, 0, 56899584, [24], 1], ["AN", 2, 0, 5], ["AN", 2, 1, 6], ["FU", 1, [0, 1, 2, 3]], ["SP", 1, 0, 56899584, [56], 1], ["AN", 1, 0, 5], ["AN", 1, 1, 6], ["PR", 1, 0, "auto_unroll_max_step$1024"]]]], "r": [[0.0147668], 0, 6.75164, 1638445045], "v": "v0.6"}
{"i": [["[\"pool_layer\", \"avg\", 128, 1008, 42, 42, 1, 1, 2, \"VALID\"]", "cuda -keys=cuda,gpu -max_num_threads=1024 -thread_warp_size=32", [-1, 16, 64, 49152, 2147483647, 1024, 8, 32], "", 0, []], [[], [["FU", 2, [0, 1, 2, 3]], ["SP", 2, 0, 56899584, [28], 1], ["AN", 2, 0, 5], ["AN", 2, 1, 6], ["FU", 1, [0, 1, 2, 3]], ["SP", 1, 0, 56899584, [64], 1], ["AN", 1, 0, 5], ["AN", 1, 1, 6], ["PR", 1, 0, "auto_unroll_max_step$0"]]]], "r": [[0.0140286], 0, 7.18788, 1638445054], "v": "v0.6"}
{"i": [["[\"pool_layer\", \"avg\", 128, 1008, 42, 42, 1, 1, 2, \"VALID\"]", "cuda -keys=cuda,gpu -max_num_threads=1024 -thread_warp_size=32", [-1, 16, 64, 49152, 2147483647, 1024, 8, 32], "", 0, []], [[], [["FU", 2, [0, 1, 2, 3]], ["SP", 2, 0, 56899584, [8], 1], ["AN", 2, 0, 5], ["AN", 2, 1, 6], ["FU", 1, [0, 1, 2, 3]], ["SP", 1, 0, 56899584, [32], 1], ["AN", 1, 0, 5], ["AN", 1, 1, 6], ["PR", 1, 0, "auto_unroll_max_step$1024"]]]], "r": [[0.0330456], 0, 6.8691, 1638445061], "v": "v0.6"}
{"i": [["[\"pool_layer\", \"avg\", 128, 1008, 42, 42, 1, 1, 2, \"VALID\"]", "cuda -keys=cuda,gpu -max_num_threads=1024 -thread_warp_size=32", [-1, 16, 64, 49152, 2147483647, 1024, 8, 32], "", 0, []], [[], [["FU", 2, [0, 1, 2, 3]], ["SP", 2, 0, 56899584, [4], 1], ["AN", 2, 0, 5], ["AN", 2, 1, 6], ["FU", 1, [0, 1, 2, 3]], ["SP", 1, 0, 56899584, [9], 1], ["AN", 1, 0, 5], ["AN", 1, 1, 6], ["PR", 1, 0, "auto_unroll_max_step$1024"]]]], "r": [[0.0755178], 0, 7.11174, 1638445067], "v": "v0.6"}
{"i": [["[\"pool_layer\", \"avg\", 128, 1008, 42, 42, 1, 1, 2, \"VALID\"]", "cuda -keys=cuda,gpu -max_num_threads=1024 -thread_warp_size=32", [-1, 16, 64, 49152, 2147483647, 1024, 8, 32], "", 0, []], [[], [["FU", 2, [0, 1, 2, 3]], ["SP", 2, 0, 56899584, [1], 1], ["AN", 2, 0, 5], ["AN", 2, 1, 6], ["FU", 1, [0, 1, 2, 3]], ["SP", 1, 0, 56899584, [48], 1], ["AN", 1, 0, 5], ["AN", 1, 1, 6], ["PR", 1, 0, "auto_unroll_max_step$0"]]]], "r": [[0.207634], 0, 7.43332, 1638445075], "v": "v0.6"}
{"i": [["[\"pool_layer\", \"avg\", 128, 1008, 42, 42, 1, 1, 2, \"VALID\"]", "cuda -keys=cuda,gpu -max_num_threads=1024 -thread_warp_size=32", [-1, 16, 64, 49152, 2147483647, 1024, 8, 32], "", 0, []], [[], [["FU", 2, [0, 1, 2, 3]], ["SP", 2, 0, 56899584, [32], 1], ["AN", 2, 0, 5], ["AN", 2, 1, 6], ["FU", 1, [0, 1, 2, 3]], ["SP", 1, 0, 56899584, [12], 1], ["AN", 1, 0, 5], ["AN", 1, 1, 6], ["PR", 1, 0, "auto_unroll_max_step$0"]]]], "r": [[0.0265024], 0, 6.82533, 1638445081], "v": "v0.6"}
{"i": [["[\"pool_layer\", \"avg\", 128, 1008, 42, 42, 1, 1, 2, \"VALID\"]", "cuda -keys=cuda,gpu -max_num_threads=1024 -thread_warp_size=32", [-1, 16, 64, 49152, 2147483647, 1024, 8, 32], "", 0, []], [[], [["FU", 2, [0, 1, 2, 3]], ["SP", 2, 0, 56899584, [54], 1], ["AN", 2, 0, 5], ["AN", 2, 1, 6], ["FU", 1, [0, 1, 2, 3]], ["SP", 1, 0, 56899584, [8], 1], ["AN", 1, 0, 5], ["AN", 1, 1, 6], ["PR", 1, 0, "auto_unroll_max_step$0"]]]], "r": [[0.0332835], 0, 6.95219, 1638445088], "v": "v0.6"}
{"i": [["[\"pool_layer\", \"avg\", 128, 1008, 42, 42, 1, 1, 2, \"VALID\"]", "cuda -keys=cuda,gpu -max_num_threads=1024 -thread_warp_size=32", [-1, 16, 64, 49152, 2147483647, 1024, 8, 32], "", 0, []], [[], [["FU", 2, [0, 1, 2, 3]], ["SP", 2, 0, 56899584, [16], 1], ["AN", 2, 0, 5], ["AN", 2, 1, 6], ["FU", 1, [0, 1, 2, 3]], ["SP", 1, 0, 56899584, [54], 1], ["AN", 1, 0, 5], ["AN", 1, 1, 6], ["PR", 1, 0, "auto_unroll_max_step$1024"]]]], "r": [[0.0186288], 0, 7.22416, 1638445095], "v": "v0.6"}
{"i": [["[\"pool_layer\", \"avg\", 128, 1008, 42, 42, 1, 1, 2, \"VALID\"]", "cuda -keys=cuda,gpu -max_num_threads=1024 -thread_warp_size=32", [-1, 16, 64, 49152, 2147483647, 1024, 8, 32], "", 0, []], [[], [["FU", 2, [0, 1, 2, 3]], ["SP", 2, 0, 56899584, [1], 1], ["AN", 2, 0, 5], ["AN", 2, 1, 6], ["FU", 1, [0, 1, 2, 3]], ["SP", 1, 0, 56899584, [48], 1], ["AN", 1, 0, 5], ["AN", 1, 1, 6], ["PR", 1, 0, "auto_unroll_max_step$16"]]]], "r": [[0.207508], 0, 7.34941, 1638445102], "v": "v0.6"}
{"i": [["[\"pool_layer\", \"avg\", 128, 1008, 42, 42, 1, 1, 2, \"VALID\"]", "cuda -keys=cuda,gpu -max_num_threads=1024 -thread_warp_size=32", [-1, 16, 64, 49152, 2147483647, 1024, 8, 32], "", 0, []], [[], [["FU", 2, [0, 1, 2, 3]], ["SP", 2, 0, 56899584, [4], 1], ["AN", 2, 0, 5], ["AN", 2, 1, 6], ["FU", 1, [0, 1, 2, 3]], ["SP", 1, 0, 56899584, [24], 1], ["AN", 1, 0, 5], ["AN", 1, 1, 6], ["PR", 1, 0, "auto_unroll_max_step$512"]]]], "r": [[0.0605967], 0, 6.94269, 1638445109], "v": "v0.6"}
{"i": [["[\"pool_layer\", \"avg\", 128, 1008, 42, 42, 1, 1, 2, \"VALID\"]", "cuda -keys=cuda,gpu -max_num_threads=1024 -thread_warp_size=32", [-1, 16, 64, 49152, 2147483647, 1024, 8, 32], "", 0, []], [[], [["FU", 2, [0, 1, 2, 3]], ["SP", 2, 0, 56899584, [3], 1], ["AN", 2, 0, 5], ["AN", 2, 1, 6], ["FU", 1, [0, 1, 2, 3]], ["SP", 1, 0, 56899584, [32], 1], ["AN", 1, 0, 5], ["AN", 1, 1, 6], ["PR", 1, 0, "auto_unroll_max_step$64"]]]], "r": [[0.0760026], 0, 7.01197, 1638445115], "v": "v0.6"}
{"i": [["[\"pool_layer\", \"avg\", 128, 1008, 42, 42, 1, 1, 2, \"VALID\"]", "cuda -keys=cuda,gpu -max_num_threads=1024 -thread_warp_size=32", [-1, 16, 64, 49152, 2147483647, 1024, 8, 32], "", 0, []], [[], [["FU", 2, [0, 1, 2, 3]], ["SP", 2, 0, 56899584, [16], 1], ["AN", 2, 0, 5], ["AN", 2, 1, 6], ["FU", 1, [0, 1, 2, 3]], ["SP", 1, 0, 56899584, [32], 1], ["AN", 1, 0, 5], ["AN", 1, 1, 6], ["PR", 1, 0, "auto_unroll_max_step$512"]]]], "r": [[0.0208183], 0, 6.76205, 1638445122], "v": "v0.6"}
{"i": [["[\"pool_layer\", \"avg\", 128, 1008, 42, 42, 1, 1, 2, \"VALID\"]", "cuda -keys=cuda,gpu -max_num_threads=1024 -thread_warp_size=32", [-1, 16, 64, 49152, 2147483647, 1024, 8, 32], "", 0, []], [[], [["FU", 2, [0, 1, 2, 3]], ["SP", 2, 0, 56899584, [1], 1], ["AN", 2, 0, 5], ["AN", 2, 1, 6], ["FU", 1, [0, 1, 2, 3]], ["SP", 1, 0, 56899584, [2], 1], ["AN", 1, 0, 5], ["AN", 1, 1, 6], ["PR", 1, 0, "auto_unroll_max_step$16"]]]], "r": [[0.310716], 0, 7.99411, 1638445130], "v": "v0.6"}
{"i": [["[\"pool_layer\", \"avg\", 128, 1008, 42, 42, 1, 1, 2, \"VALID\"]", "cuda -keys=cuda,gpu -max_num_threads=1024 -thread_warp_size=32", [-1, 16, 64, 49152, 2147483647, 1024, 8, 32], "", 0, []], [[], [["FU", 2, [0, 1, 2, 3]], ["SP", 2, 0, 56899584, [1], 1], ["AN", 2, 0, 5], ["AN", 2, 1, 6], ["FU", 1, [0, 1, 2, 3]], ["SP", 1, 0, 56899584, [4], 1], ["AN", 1, 0, 5], ["AN", 1, 1, 6], ["PR", 1, 0, "auto_unroll_max_step$0"]]]], "r": [[0.256275], 0, 7.65336, 1638445137], "v": "v0.6"}
{"i": [["[\"pool_layer\", \"avg\", 128, 1008, 42, 42, 1, 1, 2, \"VALID\"]", "cuda -keys=cuda,gpu -max_num_threads=1024 -thread_warp_size=32", [-1, 16, 64, 49152, 2147483647, 1024, 8, 32], "", 0, []], [[], [["FU", 2, [0, 1, 2, 3]], ["SP", 2, 0, 56899584, [4], 1], ["AN", 2, 0, 5], ["AN", 2, 1, 6], ["FU", 1, [0, 1, 2, 3]], ["SP", 1, 0, 56899584, [1], 1], ["AN", 1, 0, 5], ["AN", 1, 1, 6], ["PR", 1, 0, "auto_unroll_max_step$16"]]]], "r": [[0.263636], 0, 7.75915, 1638445145], "v": "v0.6"}
{"i": [["[\"pool_layer\", \"avg\", 128, 1008, 42, 42, 1, 1, 2, \"VALID\"]", "cuda -keys=cuda,gpu -max_num_threads=1024 -thread_warp_size=32", [-1, 16, 64, 49152, 2147483647, 1024, 8, 32], "", 0, []], [[], [["FU", 2, [0, 1, 2, 3]], ["SP", 2, 0, 56899584, [4], 1], ["AN", 2, 0, 5], ["AN", 2, 1, 6], ["FU", 1, [0, 1, 2, 3]], ["SP", 1, 0, 56899584, [64], 1], ["AN", 1, 0, 5], ["AN", 1, 1, 6], ["PR", 1, 0, "auto_unroll_max_step$512"]]]], "r": [[0.0553098], 0, 6.93633, 1638445151], "v": "v0.6"}
{"i": [["[\"pool_layer\", \"avg\", 128, 1008, 42, 42, 1, 1, 2, \"VALID\"]", "cuda -keys=cuda,gpu -max_num_threads=1024 -thread_warp_size=32", [-1, 16, 64, 49152, 2147483647, 1024, 8, 32], "", 0, []], [[], [["FU", 2, [0, 1, 2, 3]], ["SP", 2, 0, 56899584, [64], 1], ["AN", 2, 0, 5], ["AN", 2, 1, 6], ["FU", 1, [0, 1, 2, 3]], ["SP", 1, 0, 56899584, [2], 1], ["AN", 1, 0, 5], ["AN", 1, 1, 6], ["PR", 1, 0, "auto_unroll_max_step$1024"]]]], "r": [[0.113416], 0, 6.91539, 1638445158], "v": "v0.6"}
{"i": [["[\"pool_layer\", \"avg\", 128, 1008, 42, 42, 1, 1, 2, \"VALID\"]", "cuda -keys=cuda,gpu -max_num_threads=1024 -thread_warp_size=32", [-1, 16, 64, 49152, 2147483647, 1024, 8, 32], "", 0, []], [[], [["FU", 2, [0, 1, 2, 3]], ["SP", 2, 0, 56899584, [64], 1], ["AN", 2, 0, 5], ["AN", 2, 1, 6], ["FU", 1, [0, 1, 2, 3]], ["SP", 1, 0, 56899584, [64], 1], ["AN", 1, 0, 5], ["AN", 1, 1, 6], ["PR", 1, 0, "auto_unroll_max_step$16"]]]], "r": [[0.0094754], 0, 6.79391, 1638445172], "v": "v0.6"}
{"i": [["[\"pool_layer\", \"avg\", 128, 1008, 42, 42, 1, 1, 2, \"VALID\"]", "cuda -keys=cuda,gpu -max_num_threads=1024 -thread_warp_size=32", [-1, 16, 64, 49152, 2147483647, 1024, 8, 32], "", 0, []], [[], [["FU", 2, [0, 1, 2, 3]], ["SP", 2, 0, 56899584, [64], 1], ["AN", 2, 0, 5], ["AN", 2, 1, 6], ["FU", 1, [0, 1, 2, 3]], ["SP", 1, 0, 56899584, [64], 1], ["AN", 1, 0, 5], ["AN", 1, 1, 6], ["PR", 1, 0, "auto_unroll_max_step$64"]]]], "r": [[0.0094725], 0, 6.76447, 1638445179], "v": "v0.6"}
