artifacts/Table3/tvm/ansor/pooling/ansor_avg_pooling_128_84_83_83_3_3_2_SAME.log
{"i": [["[\"pool_layer\", \"avg\", 128, 84, 83, 83, 3, 3, 2, \"SAME\"]", "cuda -keys=cuda,gpu -max_num_threads=1024 -thread_warp_size=32", [-1, 16, 64, 49152, 2147483647, 1024, 8, 32], "", 0, []], [[], [["CI", 1], ["FU", 3, [0, 1, 2, 3]], ["SP", 3, 0, 18966528, [2], 1], ["AN", 3, 0, 5], ["AN", 3, 1, 6], ["FU", 2, [0, 1, 2, 3]], ["SP", 2, 0, 18966528, [1], 1], ["AN", 2, 0, 5], ["AN", 2, 1, 6], ["PR", 2, 0, "auto_unroll_max_step$512"]]]], "r": [[0.212908], 0, 3.82202, 1638454157], "v": "v0.6"}
{"i": [["[\"pool_layer\", \"avg\", 128, 84, 83, 83, 3, 3, 2, \"SAME\"]", "cuda -keys=cuda,gpu -max_num_threads=1024 -thread_warp_size=32", [-1, 16, 64, 49152, 2147483647, 1024, 8, 32], "", 0, []], [[], [["CI", 1], ["FU", 3, [0, 1, 2, 3]], ["SP", 3, 0, 18966528, [64], 1], ["AN", 3, 0, 5], ["AN", 3, 1, 6], ["FU", 2, [0, 1, 2, 3]], ["SP", 2, 0, 18966528, [4], 1], ["AN", 2, 0, 5], ["AN", 2, 1, 6], ["PR", 2, 0, "auto_unroll_max_step$64"]]]], "r": [[0.027646], 0, 3.09545, 1638454159], "v": "v0.6"}
{"i": [["[\"pool_layer\", \"avg\", 128, 84, 83, 83, 3, 3, 2, \"SAME\"]", "cuda -keys=cuda,gpu -max_num_threads=1024 -thread_warp_size=32", [-1, 16, 64, 49152, 2147483647, 1024, 8, 32], "", 0, []], [[], [["CI", 1], ["FU", 3, [0, 1, 2, 3]], ["SP", 3, 0, 18966528, [16], 1], ["AN", 3, 0, 5], ["AN", 3, 1, 6], ["FU", 2, [0, 1, 2, 3]], ["SP", 2, 0, 18966528, [16], 1], ["AN", 2, 0, 5], ["AN", 2, 1, 6], ["PR", 2, 0, "auto_unroll_max_step$0"]]]], "r": [[0.0111241], 0, 2.96458, 1638454162], "v": "v0.6"}
{"i": [["[\"pool_layer\", \"avg\", 128, 84, 83, 83, 3, 3, 2, \"SAME\"]", "cuda -keys=cuda,gpu -max_num_threads=1024 -thread_warp_size=32", [-1, 16, 64, 49152, 2147483647, 1024, 8, 32], "", 0, []], [[], [["CI", 1], ["FU", 3, [0, 1, 2, 3]], ["SP", 3, 0, 18966528, [2], 1], ["AN", 3, 0, 5], ["AN", 3, 1, 6], ["FU", 2, [0, 1, 2, 3]], ["SP", 2, 0, 18966528, [4], 1], ["AN", 2, 0, 5], ["AN", 2, 1, 6], ["PR", 2, 0, "auto_unroll_max_step$16"]]]], "r": [[0.0606997], 0, 3.18999, 1638454165], "v": "v0.6"}
{"i": [["[\"pool_layer\", \"avg\", 128, 84, 83, 83, 3, 3, 2, \"SAME\"]", "cuda -keys=cuda,gpu -max_num_threads=1024 -thread_warp_size=32", [-1, 16, 64, 49152, 2147483647, 1024, 8, 32], "", 0, []], [[], [["CI", 1], ["FU", 3, [0, 1, 2, 3]], ["SP", 3, 0, 18966528, [64], 1], ["AN", 3, 0, 5], ["AN", 3, 1, 6], ["FU", 2, [0, 1, 2, 3]], ["SP", 2, 0, 18966528, [16], 1], ["AN", 2, 0, 5], ["AN", 2, 1, 6], ["PR", 2, 0, "auto_unroll_max_step$0"]]]], "r": [[0.00818075], 0, 2.98776, 1638454167], "v": "v0.6"}
{"i": [["[\"pool_layer\", \"avg\", 128, 84, 83, 83, 3, 3, 2, \"SAME\"]", "cuda -keys=cuda,gpu -max_num_threads=1024 -thread_warp_size=32", [-1, 16, 64, 49152, 2147483647, 1024, 8, 32], "", 0, []], [[], [["CI", 1], ["FU", 3, [0, 1, 2, 3]], ["SP", 3, 0, 18966528, [2], 1], ["AN", 3, 0, 5], ["AN", 3, 1, 6], ["FU", 2, [0, 1, 2, 3]], ["SP", 2, 0, 18966528, [32], 1], ["AN", 2, 0, 5], ["AN", 2, 1, 6], ["PR", 2, 0, "auto_unroll_max_step$512"]]]], "r": [[0.0382812], 0, 3.17732, 1638454170], "v": "v0.6"}
{"i": [["[\"pool_layer\", \"avg\", 128, 84, 83, 83, 3, 3, 2, \"SAME\"]", "cuda -keys=cuda,gpu -max_num_threads=1024 -thread_warp_size=32", [-1, 16, 64, 49152, 2147483647, 1024, 8, 32], "", 0, []], [[], [["CI", 1], ["FU", 3, [0, 1, 2, 3]], ["SP", 3, 0, 18966528, [1], 1], ["AN", 3, 0, 5], ["AN", 3, 1, 6], ["FU", 2, [0, 1, 2, 3]], ["SP", 2, 0, 18966528, [1], 1], ["AN", 2, 0, 5], ["AN", 2, 1, 6], ["PR", 2, 0, "auto_unroll_max_step$0"]]]], "r": [[0.239925], 0, 3.83032, 1638454174], "v": "v0.6"}
{"i": [["[\"pool_layer\", \"avg\", 128, 84, 83, 83, 3, 3, 2, \"SAME\"]", "cuda -keys=cuda,gpu -max_num_threads=1024 -thread_warp_size=32", [-1, 16, 64, 49152, 2147483647, 1024, 8, 32], "", 0, []], [[], [["CI", 1], ["FU", 3, [0, 1, 2, 3]], ["SP", 3, 0, 18966528, [48], 1], ["AN", 3, 0, 5], ["AN", 3, 1, 6], ["FU", 2, [0, 1, 2, 3]], ["SP", 2, 0, 18966528, [1], 1], ["AN", 2, 0, 5], ["AN", 2, 1, 6], ["PR", 2, 0, "auto_unroll_max_step$16"]]]], "r": [[0.173625], 0, 3.44859, 1638454177], "v": "v0.6"}
{"i": [["[\"pool_layer\", \"avg\", 128, 84, 83, 83, 3, 3, 2, \"SAME\"]", "cuda -keys=cuda,gpu -max_num_threads=1024 -thread_warp_size=32", [-1, 16, 64, 49152, 2147483647, 1024, 8, 32], "", 0, []], [[], [["CI", 1], ["FU", 3, [0, 1, 2, 3]], ["SP", 3, 0, 18966528, [1], 1], ["AN", 3, 0, 5], ["AN", 3, 1, 6], ["FU", 2, [0, 1, 2, 3]], ["SP", 2, 0, 18966528, [32], 1], ["AN", 2, 0, 5], ["AN", 2, 1, 6], ["PR", 2, 0, "auto_unroll_max_step$0"]]]], "r": [[0.0720327], 0, 3.36626, 1638454180], "v": "v0.6"}
{"i": [["[\"pool_layer\", \"avg\", 128, 84, 83, 83, 3, 3, 2, \"SAME\"]", "cuda -keys=cuda,gpu -max_num_threads=1024 -thread_warp_size=32", [-1, 16, 64, 49152, 2147483647, 1024, 8, 32], "", 0, []], [[], [["CI", 1], ["FU", 3, [0, 1, 2, 3]], ["SP", 3, 0, 18966528, [1], 1], ["AN", 3, 0, 5], ["AN", 3, 1, 6], ["FU", 2, [0, 1, 2, 3]], ["SP", 2, 0, 18966528, [32], 1], ["AN", 2, 0, 5], ["AN", 2, 1, 6], ["PR", 2, 0, "auto_unroll_max_step$1024"]]]], "r": [[0.0720333], 0, 3.40253, 1638454183], "v": "v0.6"}
{"i": [["[\"pool_layer\", \"avg\", 128, 84, 83, 83, 3, 3, 2, \"SAME\"]", "cuda -keys=cuda,gpu -max_num_threads=1024 -thread_warp_size=32", [-1, 16, 64, 49152, 2147483647, 1024, 8, 32], "", 0, []], [[], [["CI", 1], ["FU", 3, [0, 1, 2, 3]], ["SP", 3, 0, 18966528, [32], 1], ["AN", 3, 0, 5], ["AN", 3, 1, 6], ["FU", 2, [0, 1, 2, 3]], ["SP", 2, 0, 18966528, [56], 1], ["AN", 2, 0, 5], ["AN", 2, 1, 6], ["PR", 2, 0, "auto_unroll_max_step$16"]]]], "r": [[0.00524688], 0, 3.4745, 1638454186], "v": "v0.6"}
{"i": [["[\"pool_layer\", \"avg\", 128, 84, 83, 83, 3, 3, 2, \"SAME\"]", "cuda -keys=cuda,gpu -max_num_threads=1024 -thread_warp_size=32", [-1, 16, 64, 49152, 2147483647, 1024, 8, 32], "", 0, []], [[], [["CI", 1], ["FU", 3, [0, 1, 2, 3]], ["SP", 3, 0, 18966528, [64], 1], ["AN", 3, 0, 5], ["AN", 3, 1, 6], ["FU", 2, [0, 1, 2, 3]], ["SP", 2, 0, 18966528, [32], 1], ["AN", 2, 0, 5], ["AN", 2, 1, 6], ["PR", 2, 0, "auto_unroll_max_step$512"]]]], "r": [[0.00523048], 0, 3.05737, 1638454188], "v": "v0.6"}
{"i": [["[\"pool_layer\", \"avg\", 128, 84, 83, 83, 3, 3, 2, \"SAME\"]", "cuda -keys=cuda,gpu -max_num_threads=1024 -thread_warp_size=32", [-1, 16, 64, 49152, 2147483647, 1024, 8, 32], "", 0, []], [[], [["CI", 1], ["FU", 3, [0, 1, 2, 3]], ["SP", 3, 0, 18966528, [4], 1], ["AN", 3, 0, 5], ["AN", 3, 1, 6], ["FU", 2, [0, 1, 2, 3]], ["SP", 2, 0, 18966528, [64], 1], ["AN", 2, 0, 5], ["AN", 2, 1, 6], ["PR", 2, 0, "auto_unroll_max_step$16"]]]], "r": [[0.0196411], 0, 3.07655, 1638454191], "v": "v0.6"}
{"i": [["[\"pool_layer\", \"avg\", 128, 84, 83, 83, 3, 3, 2, \"SAME\"]", "cuda -keys=cuda,gpu -max_num_threads=1024 -thread_warp_size=32", [-1, 16, 64, 49152, 2147483647, 1024, 8, 32], "", 0, []], [[], [["CI", 1], ["FU", 3, [0, 1, 2, 3]], ["SP", 3, 0, 18966528, [32], 1], ["AN", 3, 0, 5], ["AN", 3, 1, 6], ["FU", 2, [0, 1, 2, 3]], ["SP", 2, 0, 18966528, [64], 1], ["AN", 2, 0, 5], ["AN", 2, 1, 6], ["PR", 2, 0, "auto_unroll_max_step$0"]]]], "r": [[0.00510957], 0, 2.89138, 1638454193], "v": "v0.6"}
{"i": [["[\"pool_layer\", \"avg\", 128, 84, 83, 83, 3, 3, 2, \"SAME\"]", "cuda -keys=cuda,gpu -max_num_threads=1024 -thread_warp_size=32", [-1, 16, 64, 49152, 2147483647, 1024, 8, 32], "", 0, []], [[], [["CI", 1], ["FU", 3, [0, 1, 2, 3]], ["SP", 3, 0, 18966528, [4], 1], ["AN", 3, 0, 5], ["AN", 3, 1, 6], ["FU", 2, [0, 1, 2, 3]], ["SP", 2, 0, 18966528, [1], 1], ["AN", 2, 0, 5], ["AN", 2, 1, 6], ["PR", 2, 0, "auto_unroll_max_step$64"]]]], "r": [[0.188703], 0, 3.61795, 1638454197], "v": "v0.6"}
{"i": [["[\"pool_layer\", \"avg\", 128, 84, 83, 83, 3, 3, 2, \"SAME\"]", "cuda -keys=cuda,gpu -max_num_threads=1024 -thread_warp_size=32", [-1, 16, 64, 49152, 2147483647, 1024, 8, 32], "", 0, []], [[], [["CI", 1], ["FU", 3, [0, 1, 2, 3]], ["SP", 3, 0, 18966528, [32], 1], ["AN", 3, 0, 5], ["AN", 3, 1, 6], ["FU", 2, [0, 1, 2, 3]], ["SP", 2, 0, 18966528, [56], 1], ["AN", 2, 0, 5], ["AN", 2, 1, 6], ["PR", 2, 0, "auto_unroll_max_step$1024"]]]], "r": [[0.00524831], 0, 2.91245, 1638454199], "v": "v0.6"}
{"i": [["[\"pool_layer\", \"avg\", 128, 84, 83, 83, 3, 3, 2, \"SAME\"]", "cuda -keys=cuda,gpu -max_num_threads=1024 -thread_warp_size=32", [-1, 16, 64, 49152, 2147483647, 1024, 8, 32], "", 0, []], [[], [["CI", 1], ["FU", 3, [0, 1, 2, 3]], ["SP", 3, 0, 18966528, [8], 1], ["AN", 3, 0, 5], ["AN", 3, 1, 6], ["FU", 2, [0, 1, 2, 3]], ["SP", 2, 0, 18966528, [4], 1], ["AN", 2, 0, 5], ["AN", 2, 1, 6], ["PR", 2, 0, "auto_unroll_max_step$1024"]]]], "r": [[0.0347242], 0, 3.09849, 1638454202], "v": "v0.6"}
{"i": [["[\"pool_layer\", \"avg\", 128, 84, 83, 83, 3, 3, 2, \"SAME\"]", "cuda -keys=cuda,gpu -max_num_threads=1024 -thread_warp_size=32", [-1, 16, 64, 49152, 2147483647, 1024, 8, 32], "", 0, []], [[], [["CI", 1], ["FU", 3, [0, 1, 2, 3]], ["SP", 3, 0, 18966528, [1], 1], ["AN", 3, 0, 5], ["AN", 3, 1, 6], ["FU", 2, [0, 1, 2, 3]], ["SP", 2, 0, 18966528, [2], 1], ["AN", 2, 0, 5], ["AN", 2, 1, 6], ["PR", 2, 0, "auto_unroll_max_step$16"]]]], "r": [[0.140582], 0, 4.72506, 1638454206], "v": "v0.6"}
{"i": [["[\"pool_layer\", \"avg\", 128, 84, 83, 83, 3, 3, 2, \"SAME\"]", "cuda -keys=cuda,gpu -max_num_threads=1024 -thread_warp_size=32", [-1, 16, 64, 49152, 2147483647, 1024, 8, 32], "", 0, []], [[], [["CI", 1], ["FU", 3, [0, 1, 2, 3]], ["SP", 3, 0, 18966528, [16], 1], ["AN", 3, 0, 5], ["AN", 3, 1, 6], ["FU", 2, [0, 1, 2, 3]], ["SP", 2, 0, 18966528, [64], 1], ["AN", 2, 0, 5], ["AN", 2, 1, 6], ["PR", 2, 0, "auto_unroll_max_step$0"]]]], "r": [[0.00709054], 0, 4.42802, 1638454210], "v": "v0.6"}
{"i": [["[\"pool_layer\", \"avg\", 128, 84, 83, 83, 3, 3, 2, \"SAME\"]", "cuda -keys=cuda,gpu -max_num_threads=1024 -thread_warp_size=32", [-1, 16, 64, 49152, 2147483647, 1024, 8, 32], "", 0, []], [[], [["CI", 1], ["FU", 3, [0, 1, 2, 3]], ["SP", 3, 0, 18966528, [64], 1], ["AN", 3, 0, 5], ["AN", 3, 1, 6], ["FU", 2, [0, 1, 2, 3]], ["SP", 2, 0, 18966528, [2], 1], ["AN", 2, 0, 5], ["AN", 2, 1, 6], ["PR", 2, 0, "auto_unroll_max_step$16"]]]], "r": [[0.0538727], 0, 4.61343, 1638454215], "v": "v0.6"}
{"i": [["[\"pool_layer\", \"avg\", 128, 84, 83, 83, 3, 3, 2, \"SAME\"]", "cuda -keys=cuda,gpu -max_num_threads=1024 -thread_warp_size=32", [-1, 16, 64, 49152, 2147483647, 1024, 8, 32], "", 0, []], [[], [["CI", 1], ["FU", 3, [0, 1, 2, 3]], ["SP", 3, 0, 18966528, [2], 1], ["AN", 3, 0, 5], ["AN", 3, 1, 6], ["FU", 2, [0, 1, 2, 3]], ["SP", 2, 0, 18966528, [1], 1], ["AN", 2, 0, 5], ["AN", 2, 1, 6], ["PR", 2, 0, "auto_unroll_max_step$0"]]]], "r": [[0.206266], 0, 4.64804, 1638454219], "v": "v0.6"}
{"i": [["[\"pool_layer\", \"avg\", 128, 84, 83, 83, 3, 3, 2, \"SAME\"]", "cuda -keys=cuda,gpu -max_num_threads=1024 -thread_warp_size=32", [-1, 16, 64, 49152, 2147483647, 1024, 8, 32], "", 0, []], [[], [["CI", 1], ["FU", 3, [0, 1, 2, 3]], ["SP", 3, 0, 18966528, [2], 1], ["AN", 3, 0, 5], ["AN", 3, 1, 6], ["FU", 2, [0, 1, 2, 3]], ["SP", 2, 0, 18966528, [64], 1], ["AN", 2, 0, 5], ["AN", 2, 1, 6], ["PR", 2, 0, "auto_unroll_max_step$512"]]]], "r": [[0.0372112], 0, 4.68737, 1638454223], "v": "v0.6"}
{"i": [["[\"pool_layer\", \"avg\", 128, 84, 83, 83, 3, 3, 2, \"SAME\"]", "cuda -keys=cuda,gpu -max_num_threads=1024 -thread_warp_size=32", [-1, 16, 64, 49152, 2147483647, 1024, 8, 32], "", 0, []], [[], [["CI", 1], ["FU", 3, [0, 1, 2, 3]], ["SP", 3, 0, 18966528, [4], 1], ["AN", 3, 0, 5], ["AN", 3, 1, 6], ["FU", 2, [0, 1, 2, 3]], ["SP", 2, 0, 18966528, [32], 1], ["AN", 2, 0, 5], ["AN", 2, 1, 6], ["PR", 2, 0, "auto_unroll_max_step$64"]]]], "r": [[0.0207358], 0, 4.42029, 1638454228], "v": "v0.6"}
{"i": [["[\"pool_layer\", \"avg\", 128, 84, 83, 83, 3, 3, 2, \"SAME\"]", "cuda -keys=cuda,gpu -max_num_threads=1024 -thread_warp_size=32", [-1, 16, 64, 49152, 2147483647, 1024, 8, 32], "", 0, []], [[], [["CI", 1], ["FU", 3, [0, 1, 2, 3]], ["SP", 3, 0, 18966528, [32], 1], ["AN", 3, 0, 5], ["AN", 3, 1, 6], ["FU", 2, [0, 1, 2, 3]], ["SP", 2, 0, 18966528, [2], 1], ["AN", 2, 0, 5], ["AN", 2, 1, 6], ["PR", 2, 0, "auto_unroll_max_step$64"]]]], "r": [[0.0548468], 0, 3.99034, 1638454231], "v": "v0.6"}
{"i": [["[\"pool_layer\", \"avg\", 128, 84, 83, 83, 3, 3, 2, \"SAME\"]", "cuda -keys=cuda,gpu -max_num_threads=1024 -thread_warp_size=32", [-1, 16, 64, 49152, 2147483647, 1024, 8, 32], "", 0, []], [[], [["CI", 1], ["FU", 3, [0, 1, 2, 3]], ["SP", 3, 0, 18966528, [32], 1], ["AN", 3, 0, 5], ["AN", 3, 1, 6], ["FU", 2, [0, 1, 2, 3]], ["SP", 2, 0, 18966528, [48], 1], ["AN", 2, 0, 5], ["AN", 2, 1, 6], ["PR", 2, 0, "auto_unroll_max_step$16"]]]], "r": [[0.00559585], 0, 3.54581, 1638454235], "v": "v0.6"}
{"i": [["[\"pool_layer\", \"avg\", 128, 84, 83, 83, 3, 3, 2, \"SAME\"]", "cuda -keys=cuda,gpu -max_num_threads=1024 -thread_warp_size=32", [-1, 16, 64, 49152, 2147483647, 1024, 8, 32], "", 0, []], [[], [["CI", 1], ["FU", 3, [0, 1, 2, 3]], ["SP", 3, 0, 18966528, [8], 1], ["AN", 3, 0, 5], ["AN", 3, 1, 6], ["FU", 2, [0, 1, 2, 3]], ["SP", 2, 0, 18966528, [64], 1], ["AN", 2, 0, 5], ["AN", 2, 1, 6], ["PR", 2, 0, "auto_unroll_max_step$512"]]]], "r": [[0.0112109], 0, 4.19167, 1638454239], "v": "v0.6"}
{"i": [["[\"pool_layer\", \"avg\", 128, 84, 83, 83, 3, 3, 2, \"SAME\"]", "cuda -keys=cuda,gpu -max_num_threads=1024 -thread_warp_size=32", [-1, 16, 64, 49152, 2147483647, 1024, 8, 32], "", 0, []], [[], [["CI", 1], ["FU", 3, [0, 1, 2, 3]], ["SP", 3, 0, 18966528, [32], 1], ["AN", 3, 0, 5], ["AN", 3, 1, 6], ["FU", 2, [0, 1, 2, 3]], ["SP", 2, 0, 18966528, [48], 1], ["AN", 2, 0, 5], ["AN", 2, 1, 6], ["PR", 2, 0, "auto_unroll_max_step$0"]]]], "r": [[0.00559671], 0, 4.8187, 1638454244], "v": "v0.6"}
{"i": [["[\"pool_layer\", \"avg\", 128, 84, 83, 83, 3, 3, 2, \"SAME\"]", "cuda -keys=cuda,gpu -max_num_threads=1024 -thread_warp_size=32", [-1, 16, 64, 49152, 2147483647, 1024, 8, 32], "", 0, []], [[], [["CI", 1], ["FU", 3, [0, 1, 2, 3]], ["SP", 3, 0, 18966528, [32], 1], ["AN", 3, 0, 5], ["AN", 3, 1, 6], ["FU", 2, [0, 1, 2, 3]], ["SP", 2, 0, 18966528, [32], 1], ["AN", 2, 0, 5], ["AN", 2, 1, 6], ["PR", 2, 0, "auto_unroll_max_step$64"]]]], "r": [[0.00619929], 0, 4.91736, 1638454249], "v": "v0.6"}
{"i": [["[\"pool_layer\", \"avg\", 128, 84, 83, 83, 3, 3, 2, \"SAME\"]", "cuda -keys=cuda,gpu -max_num_threads=1024 -thread_warp_size=32", [-1, 16, 64, 49152, 2147483647, 1024, 8, 32], "", 0, []], [[], [["CI", 1], ["FU", 3, [0, 1, 2, 3]], ["SP", 3, 0, 18966528, [8], 1], ["AN", 3, 0, 5], ["AN", 3, 1, 6], ["FU", 2, [0, 1, 2, 3]], ["SP", 2, 0, 18966528, [32], 1], ["AN", 2, 0, 5], ["AN", 2, 1, 6], ["PR", 2, 0, "auto_unroll_max_step$1024"]]]], "r": [[0.012301], 0, 5.36479, 1638454254], "v": "v0.6"}
{"i": [["[\"pool_layer\", \"avg\", 128, 84, 83, 83, 3, 3, 2, \"SAME\"]", "cuda -keys=cuda,gpu -max_num_threads=1024 -thread_warp_size=32", [-1, 16, 64, 49152, 2147483647, 1024, 8, 32], "", 0, []], [[], [["CI", 1], ["FU", 3, [0, 1, 2, 3]], ["SP", 3, 0, 18966528, [1], 1], ["AN", 3, 0, 5], ["AN", 3, 1, 6], ["FU", 2, [0, 1, 2, 3]], ["SP", 2, 0, 18966528, [32], 1], ["AN", 2, 0, 5], ["AN", 2, 1, 6], ["PR", 2, 0, "auto_unroll_max_step$64"]]]], "r": [[0.0812228], 0, 4.27311, 1638454258], "v": "v0.6"}
{"i": [["[\"pool_layer\", \"avg\", 128, 84, 83, 83, 3, 3, 2, \"SAME\"]", "cuda -keys=cuda,gpu -max_num_threads=1024 -thread_warp_size=32", [-1, 16, 64, 49152, 2147483647, 1024, 8, 32], "", 0, []], [[], [["CI", 1], ["FU", 3, [0, 1, 2, 3]], ["SP", 3, 0, 18966528, [32], 1], ["AN", 3, 0, 5], ["AN", 3, 1, 6], ["FU", 2, [0, 1, 2, 3]], ["SP", 2, 0, 18966528, [12], 1], ["AN", 2, 0, 5], ["AN", 2, 1, 6], ["PR", 2, 0, "auto_unroll_max_step$0"]]]], "r": [[0.0113562], 0, 4.29946, 1638454262], "v": "v0.6"}
{"i": [["[\"pool_layer\", \"avg\", 128, 84, 83, 83, 3, 3, 2, \"SAME\"]", "cuda -keys=cuda,gpu -max_num_threads=1024 -thread_warp_size=32", [-1, 16, 64, 49152, 2147483647, 1024, 8, 32], "", 0, []], [[], [["CI", 1], ["FU", 3, [0, 1, 2, 3]], ["SP", 3, 0, 18966528, [8], 1], ["AN", 3, 0, 5], ["AN", 3, 1, 6], ["FU", 2, [0, 1, 2, 3]], ["SP", 2, 0, 18966528, [64], 1], ["AN", 2, 0, 5], ["AN", 2, 1, 6], ["PR", 2, 0, "auto_unroll_max_step$16"]]]], "r": [[0.0112169], 0, 2.9769, 1638454264], "v": "v0.6"}
{"i": [["[\"pool_layer\", \"avg\", 128, 84, 83, 83, 3, 3, 2, \"SAME\"]", "cuda -keys=cuda,gpu -max_num_threads=1024 -thread_warp_size=32", [-1, 16, 64, 49152, 2147483647, 1024, 8, 32], "", 0, []], [[], [["CI", 1], ["FU", 3, [0, 1, 2, 3]], ["SP", 3, 0, 18966528, [64], 1], ["AN", 3, 0, 5], ["AN", 3, 1, 6], ["FU", 2, [0, 1, 2, 3]], ["SP", 2, 0, 18966528, [8], 1], ["AN", 2, 0, 5], ["AN", 2, 1, 6], ["PR", 2, 0, "auto_unroll_max_step$0"]]]], "r": [[0.0146373], 0, 2.96078, 1638454267], "v": "v0.6"}
{"i": [["[\"pool_layer\", \"avg\", 128, 84, 83, 83, 3, 3, 2, \"SAME\"]", "cuda -keys=cuda,gpu -max_num_threads=1024 -thread_warp_size=32", [-1, 16, 64, 49152, 2147483647, 1024, 8, 32], "", 0, []], [[], [["CI", 1], ["FU", 3, [0, 1, 2, 3]], ["SP", 3, 0, 18966528, [24], 1], ["AN", 3, 0, 5], ["AN", 3, 1, 6], ["FU", 2, [0, 1, 2, 3]], ["SP", 2, 0, 18966528, [32], 1], ["AN", 2, 0, 5], ["AN", 2, 1, 6], ["PR", 2, 0, "auto_unroll_max_step$0"]]]], "r": [[0.00694606], 0, 3.01787, 1638454270], "v": "v0.6"}
{"i": [["[\"pool_layer\", \"avg\", 128, 84, 83, 83, 3, 3, 2, \"SAME\"]", "cuda -keys=cuda,gpu -max_num_threads=1024 -thread_warp_size=32", [-1, 16, 64, 49152, 2147483647, 1024, 8, 32], "", 0, []], [[], [["CI", 1], ["FU", 3, [0, 1, 2, 3]], ["SP", 3, 0, 18966528, [64], 1], ["AN", 3, 0, 5], ["AN", 3, 1, 6], ["FU", 2, [0, 1, 2, 3]], ["SP", 2, 0, 18966528, [1], 1], ["AN", 2, 0, 5], ["AN", 2, 1, 6], ["PR", 2, 0, "auto_unroll_max_step$0"]]]], "r": [[0.173294], 0, 3.46863, 1638454273], "v": "v0.6"}
{"i": [["[\"pool_layer\", \"avg\", 128, 84, 83, 83, 3, 3, 2, \"SAME\"]", "cuda -keys=cuda,gpu -max_num_threads=1024 -thread_warp_size=32", [-1, 16, 64, 49152, 2147483647, 1024, 8, 32], "", 0, []], [[], [["CI", 1], ["FU", 3, [0, 1, 2, 3]], ["SP", 3, 0, 18966528, [64], 1], ["AN", 3, 0, 5], ["AN", 3, 1, 6], ["FU", 2, [0, 1, 2, 3]], ["SP", 2, 0, 18966528, [12], 1], ["AN", 2, 0, 5], ["AN", 2, 1, 6], ["PR", 2, 0, "auto_unroll_max_step$512"]]]], "r": [[0.0103875], 0, 2.9892, 1638454275], "v": "v0.6"}
{"i": [["[\"pool_layer\", \"avg\", 128, 84, 83, 83, 3, 3, 2, \"SAME\"]", "cuda -keys=cuda,gpu -max_num_threads=1024 -thread_warp_size=32", [-1, 16, 64, 49152, 2147483647, 1024, 8, 32], "", 0, []], [[], [["CI", 1], ["FU", 3, [0, 1, 2, 3]], ["SP", 3, 0, 18966528, [64], 1], ["AN", 3, 0, 5], ["AN", 3, 1, 6], ["FU", 2, [0, 1, 2, 3]], ["SP", 2, 0, 18966528, [1], 1], ["AN", 2, 0, 5], ["AN", 2, 1, 6], ["PR", 2, 0, "auto_unroll_max_step$512"]]]], "r": [[0.173298], 0, 3.40117, 1638454278], "v": "v0.6"}
{"i": [["[\"pool_layer\", \"avg\", 128, 84, 83, 83, 3, 3, 2, \"SAME\"]", "cuda -keys=cuda,gpu -max_num_threads=1024 -thread_warp_size=32", [-1, 16, 64, 49152, 2147483647, 1024, 8, 32], "", 0, []], [[], [["CI", 1], ["FU", 3, [0, 1, 2, 3]], ["SP", 3, 0, 18966528, [32], 1], ["AN", 3, 0, 5], ["AN", 3, 1, 6], ["FU", 2, [0, 1, 2, 3]], ["SP", 2, 0, 18966528, [32], 1], ["AN", 2, 0, 5], ["AN", 2, 1, 6], ["PR", 2, 0, "auto_unroll_max_step$1024"]]]], "r": [[0.00620085], 0, 3.03341, 1638454281], "v": "v0.6"}
{"i": [["[\"pool_layer\", \"avg\", 128, 84, 83, 83, 3, 3, 2, \"SAME\"]", "cuda -keys=cuda,gpu -max_num_threads=1024 -thread_warp_size=32", [-1, 16, 64, 49152, 2147483647, 1024, 8, 32], "", 0, []], [[], [["CI", 1], ["FU", 3, [0, 1, 2, 3]], ["SP", 3, 0, 18966528, [2], 1], ["AN", 3, 0, 5], ["AN", 3, 1, 6], ["FU", 2, [0, 1, 2, 3]], ["SP", 2, 0, 18966528, [4], 1], ["AN", 2, 0, 5], ["AN", 2, 1, 6], ["PR", 2, 0, "auto_unroll_max_step$0"]]]], "r": [[0.06076], 0, 3.16847, 1638454284], "v": "v0.6"}
{"i": [["[\"pool_layer\", \"avg\", 128, 84, 83, 83, 3, 3, 2, \"SAME\"]", "cuda -keys=cuda,gpu -max_num_threads=1024 -thread_warp_size=32", [-1, 16, 64, 49152, 2147483647, 1024, 8, 32], "", 0, []], [[], [["CI", 1], ["FU", 3, [0, 1, 2, 3]], ["SP", 3, 0, 18966528, [1], 1], ["AN", 3, 0, 5], ["AN", 3, 1, 6], ["FU", 2, [0, 1, 2, 3]], ["SP", 2, 0, 18966528, [64], 1], ["AN", 2, 0, 5], ["AN", 2, 1, 6], ["PR", 2, 0, "auto_unroll_max_step$0"]]]], "r": [[0.0709893], 0, 3.43216, 1638454287], "v": "v0.6"}
{"i": [["[\"pool_layer\", \"avg\", 128, 84, 83, 83, 3, 3, 2, \"SAME\"]", "cuda -keys=cuda,gpu -max_num_threads=1024 -thread_warp_size=32", [-1, 16, 64, 49152, 2147483647, 1024, 8, 32], "", 0, []], [[], [["CI", 1], ["FU", 3, [0, 1, 2, 3]], ["SP", 3, 0, 18966528, [32], 1], ["AN", 3, 0, 5], ["AN", 3, 1, 6], ["FU", 2, [0, 1, 2, 3]], ["SP", 2, 0, 18966528, [1], 1], ["AN", 2, 0, 5], ["AN", 2, 1, 6], ["PR", 2, 0, "auto_unroll_max_step$512"]]]], "r": [[0.174275], 0, 3.49425, 1638454290], "v": "v0.6"}
{"i": [["[\"pool_layer\", \"avg\", 128, 84, 83, 83, 3, 3, 2, \"SAME\"]", "cuda -keys=cuda,gpu -max_num_threads=1024 -thread_warp_size=32", [-1, 16, 64, 49152, 2147483647, 1024, 8, 32], "", 0, []], [[], [["CI", 1], ["FU", 3, [0, 1, 2, 3]], ["SP", 3, 0, 18966528, [2], 1], ["AN", 3, 0, 5], ["AN", 3, 1, 6], ["FU", 2, [0, 1, 2, 3]], ["SP", 2, 0, 18966528, [8], 1], ["AN", 2, 0, 5], ["AN", 2, 1, 6], ["PR", 2, 0, "auto_unroll_max_step$0"]]]], "r": [[0.0477296], 0, 3.27771, 1638454293], "v": "v0.6"}
{"i": [["[\"pool_layer\", \"avg\", 128, 84, 83, 83, 3, 3, 2, \"SAME\"]", "cuda -keys=cuda,gpu -max_num_threads=1024 -thread_warp_size=32", [-1, 16, 64, 49152, 2147483647, 1024, 8, 32], "", 0, []], [[], [["CI", 1], ["FU", 3, [0, 1, 2, 3]], ["SP", 3, 0, 18966528, [36], 1], ["AN", 3, 0, 5], ["AN", 3, 1, 6], ["FU", 2, [0, 1, 2, 3]], ["SP", 2, 0, 18966528, [64], 1], ["AN", 2, 0, 5], ["AN", 2, 1, 6], ["PR", 2, 0, "auto_unroll_max_step$16"]]]], "r": [[0.00509839], 0, 2.90563, 1638454295], "v": "v0.6"}
{"i": [["[\"pool_layer\", \"avg\", 128, 84, 83, 83, 3, 3, 2, \"SAME\"]", "cuda -keys=cuda,gpu -max_num_threads=1024 -thread_warp_size=32", [-1, 16, 64, 49152, 2147483647, 1024, 8, 32], "", 0, []], [[], [["CI", 1], ["FU", 3, [0, 1, 2, 3]], ["SP", 3, 0, 18966528, [64], 1], ["AN", 3, 0, 5], ["AN", 3, 1, 6], ["FU", 2, [0, 1, 2, 3]], ["SP", 2, 0, 18966528, [8], 1], ["AN", 2, 0, 5], ["AN", 2, 1, 6], ["PR", 2, 0, "auto_unroll_max_step$1024"]]]], "r": [[0.0146412], 0, 2.93338, 1638454298], "v": "v0.6"}
{"i": [["[\"pool_layer\", \"avg\", 128, 84, 83, 83, 3, 3, 2, \"SAME\"]", "cuda -keys=cuda,gpu -max_num_threads=1024 -thread_warp_size=32", [-1, 16, 64, 49152, 2147483647, 1024, 8, 32], "", 0, []], [[], [["CI", 1], ["FU", 3, [0, 1, 2, 3]], ["SP", 3, 0, 18966528, [32], 1], ["AN", 3, 0, 5], ["AN", 3, 1, 6], ["FU", 2, [0, 1, 2, 3]], ["SP", 2, 0, 18966528, [64], 1], ["AN", 2, 0, 5], ["AN", 2, 1, 6], ["PR", 2, 0, "auto_unroll_max_step$512"]]]], "r": [[0.00511264], 0, 2.93305, 1638454301], "v": "v0.6"}
{"i": [["[\"pool_layer\", \"avg\", 128, 84, 83, 83, 3, 3, 2, \"SAME\"]", "cuda -keys=cuda,gpu -max_num_threads=1024 -thread_warp_size=32", [-1, 16, 64, 49152, 2147483647, 1024, 8, 32], "", 0, []], [[], [["CI", 1], ["FU", 3, [0, 1, 2, 3]], ["SP", 3, 0, 18966528, [32], 1], ["AN", 3, 0, 5], ["AN", 3, 1, 6], ["FU", 2, [0, 1, 2, 3]], ["SP", 2, 0, 18966528, [2], 1], ["AN", 2, 0, 5], ["AN", 2, 1, 6], ["PR", 2, 0, "auto_unroll_max_step$512"]]]], "r": [[0.0548672], 0, 3.21411, 1638454303], "v": "v0.6"}
{"i": [["[\"pool_layer\", \"avg\", 128, 84, 83, 83, 3, 3, 2, \"SAME\"]", "cuda -keys=cuda,gpu -max_num_threads=1024 -thread_warp_size=32", [-1, 16, 64, 49152, 2147483647, 1024, 8, 32], "", 0, []], [[], [["CI", 1], ["FU", 3, [0, 1, 2, 3]], ["SP", 3, 0, 18966528, [2], 1], ["AN", 3, 0, 5], ["AN", 3, 1, 6], ["FU", 2, [0, 1, 2, 3]], ["SP", 2, 0, 18966528, [16], 1], ["AN", 2, 0, 5], ["AN", 2, 1, 6], ["PR", 2, 0, "auto_unroll_max_step$0"]]]], "r": [[0.0412801], 0, 3.16666, 1638454306], "v": "v0.6"}
{"i": [["[\"pool_layer\", \"avg\", 128, 84, 83, 83, 3, 3, 2, \"SAME\"]", "cuda -keys=cuda,gpu -max_num_threads=1024 -thread_warp_size=32", [-1, 16, 64, 49152, 2147483647, 1024, 8, 32], "", 0, []], [[], [["CI", 1], ["FU", 3, [0, 1, 2, 3]], ["SP", 3, 0, 18966528, [64], 1], ["AN", 3, 0, 5], ["AN", 3, 1, 6], ["FU", 2, [0, 1, 2, 3]], ["SP", 2, 0, 18966528, [1], 1], ["AN", 2, 0, 5], ["AN", 2, 1, 6], ["PR", 2, 0, "auto_unroll_max_step$16"]]]], "r": [[0.173318], 0, 3.46456, 1638454309], "v": "v0.6"}
{"i": [["[\"pool_layer\", \"avg\", 128, 84, 83, 83, 3, 3, 2, \"SAME\"]", "cuda -keys=cuda,gpu -max_num_threads=1024 -thread_warp_size=32", [-1, 16, 64, 49152, 2147483647, 1024, 8, 32], "", 0, []], [[], [["CI", 1], ["FU", 3, [0, 1, 2, 3]], ["SP", 3, 0, 18966528, [64], 1], ["AN", 3, 0, 5], ["AN", 3, 1, 6], ["FU", 2, [0, 1, 2, 3]], ["SP", 2, 0, 18966528, [64], 1], ["AN", 2, 0, 5], ["AN", 2, 1, 6], ["PR", 2, 0, "auto_unroll_max_step$64"]]]], "r": [[0.00426612], 0, 3.28861, 1638454315], "v": "v0.6"}
{"i": [["[\"pool_layer\", \"avg\", 128, 84, 83, 83, 3, 3, 2, \"SAME\"]", "cuda -keys=cuda,gpu -max_num_threads=1024 -thread_warp_size=32", [-1, 16, 64, 49152, 2147483647, 1024, 8, 32], "", 0, []], [[], [["CI", 1], ["FU", 3, [0, 1, 2, 3]], ["SP", 3, 0, 18966528, [8], 1], ["AN", 3, 0, 5], ["AN", 3, 1, 6], ["FU", 2, [0, 1, 2, 3]], ["SP", 2, 0, 18966528, [2], 1], ["AN", 2, 0, 5], ["AN", 2, 1, 6], ["PR", 2, 0, "auto_unroll_max_step$16"]]]], "r": [[0.0609956], 0, 3.14171, 1638454318], "v": "v0.6"}
{"i": [["[\"pool_layer\", \"avg\", 128, 84, 83, 83, 3, 3, 2, \"SAME\"]", "cuda -keys=cuda,gpu -max_num_threads=1024 -thread_warp_size=32", [-1, 16, 64, 49152, 2147483647, 1024, 8, 32], "", 0, []], [[], [["CI", 1], ["FU", 3, [0, 1, 2, 3]], ["SP", 3, 0, 18966528, [64], 1], ["AN", 3, 0, 5], ["AN", 3, 1, 6], ["FU", 2, [0, 1, 2, 3]], ["SP", 2, 0, 18966528, [48], 1], ["AN", 2, 0, 5], ["AN", 2, 1, 6], ["PR", 2, 0, "auto_unroll_max_step$0"]]]], "r": [[0.00463122], 0, 2.83413, 1638454320], "v": "v0.6"}
{"i": [["[\"pool_layer\", \"avg\", 128, 84, 83, 83, 3, 3, 2, \"SAME\"]", "cuda -keys=cuda,gpu -max_num_threads=1024 -thread_warp_size=32", [-1, 16, 64, 49152, 2147483647, 1024, 8, 32], "", 0, []], [[], [["CI", 1], ["FU", 3, [0, 1, 2, 3]], ["SP", 3, 0, 18966528, [2], 1], ["AN", 3, 0, 5], ["AN", 3, 1, 6], ["FU", 2, [0, 1, 2, 3]], ["SP", 2, 0, 18966528, [2], 1], ["AN", 2, 0, 5], ["AN", 2, 1, 6], ["PR", 2, 0, "auto_unroll_max_step$1024"]]]], "r": [[0.0870217], 0, 3.32517, 1638454323], "v": "v0.6"}
{"i": [["[\"pool_layer\", \"avg\", 128, 84, 83, 83, 3, 3, 2, \"SAME\"]", "cuda -keys=cuda,gpu -max_num_threads=1024 -thread_warp_size=32", [-1, 16, 64, 49152, 2147483647, 1024, 8, 32], "", 0, []], [[], [["CI", 1], ["FU", 3, [0, 1, 2, 3]], ["SP", 3, 0, 18966528, [32], 1], ["AN", 3, 0, 5], ["AN", 3, 1, 6], ["FU", 2, [0, 1, 2, 3]], ["SP", 2, 0, 18966528, [32], 1], ["AN", 2, 0, 5], ["AN", 2, 1, 6], ["PR", 2, 0, "auto_unroll_max_step$512"]]]], "r": [[0.00620381], 0, 2.83865, 1638454326], "v": "v0.6"}
{"i": [["[\"pool_layer\", \"avg\", 128, 84, 83, 83, 3, 3, 2, \"SAME\"]", "cuda -keys=cuda,gpu -max_num_threads=1024 -thread_warp_size=32", [-1, 16, 64, 49152, 2147483647, 1024, 8, 32], "", 0, []], [[], [["CI", 1], ["FU", 3, [0, 1, 2, 3]], ["SP", 3, 0, 18966528, [2], 1], ["AN", 3, 0, 5], ["AN", 3, 1, 6], ["FU", 2, [0, 1, 2, 3]], ["SP", 2, 0, 18966528, [2], 1], ["AN", 2, 0, 5], ["AN", 2, 1, 6], ["PR", 2, 0, "auto_unroll_max_step$512"]]]], "r": [[0.0870148], 0, 3.24936, 1638454329], "v": "v0.6"}
{"i": [["[\"pool_layer\", \"avg\", 128, 84, 83, 83, 3, 3, 2, \"SAME\"]", "cuda -keys=cuda,gpu -max_num_threads=1024 -thread_warp_size=32", [-1, 16, 64, 49152, 2147483647, 1024, 8, 32], "", 0, []], [[], [["CI", 1], ["FU", 3, [0, 1, 2, 3]], ["SP", 3, 0, 18966528, [64], 1], ["AN", 3, 0, 5], ["AN", 3, 1, 6], ["FU", 2, [0, 1, 2, 3]], ["SP", 2, 0, 18966528, [48], 1], ["AN", 2, 0, 5], ["AN", 2, 1, 6], ["PR", 2, 0, "auto_unroll_max_step$16"]]]], "r": [[0.00463468], 0, 2.89553, 1638454331], "v": "v0.6"}
{"i": [["[\"pool_layer\", \"avg\", 128, 84, 83, 83, 3, 3, 2, \"SAME\"]", "cuda -keys=cuda,gpu -max_num_threads=1024 -thread_warp_size=32", [-1, 16, 64, 49152, 2147483647, 1024, 8, 32], "", 0, []], [[], [["CI", 1], ["FU", 3, [0, 1, 2, 3]], ["SP", 3, 0, 18966528, [16], 1], ["AN", 3, 0, 5], ["AN", 3, 1, 6], ["FU", 2, [0, 1, 2, 3]], ["SP", 2, 0, 18966528, [4], 1], ["AN", 2, 0, 5], ["AN", 2, 1, 6], ["PR", 2, 0, "auto_unroll_max_step$0"]]]], "r": [[0.0306271], 0, 3.03531, 1638454334], "v": "v0.6"}
{"i": [["[\"pool_layer\", \"avg\", 128, 84, 83, 83, 3, 3, 2, \"SAME\"]", "cuda -keys=cuda,gpu -max_num_threads=1024 -thread_warp_size=32", [-1, 16, 64, 49152, 2147483647, 1024, 8, 32], "", 0, []], [[], [["CI", 1], ["FU", 3, [0, 1, 2, 3]], ["SP", 3, 0, 18966528, [12], 1], ["AN", 3, 0, 5], ["AN", 3, 1, 6], ["FU", 2, [0, 1, 2, 3]], ["SP", 2, 0, 18966528, [36], 1], ["AN", 2, 0, 5], ["AN", 2, 1, 6], ["PR", 2, 0, "auto_unroll_max_step$16"]]]], "r": [[0.0095311], 0, 2.88786, 1638454337], "v": "v0.6"}
{"i": [["[\"pool_layer\", \"avg\", 128, 84, 83, 83, 3, 3, 2, \"SAME\"]", "cuda -keys=cuda,gpu -max_num_threads=1024 -thread_warp_size=32", [-1, 16, 64, 49152, 2147483647, 1024, 8, 32], "", 0, []], [[], [["CI", 1], ["FU", 3, [0, 1, 2, 3]], ["SP", 3, 0, 18966528, [64], 1], ["AN", 3, 0, 5], ["AN", 3, 1, 6], ["FU", 2, [0, 1, 2, 3]], ["SP", 2, 0, 18966528, [32], 1], ["AN", 2, 0, 5], ["AN", 2, 1, 6], ["PR", 2, 0, "auto_unroll_max_step$16"]]]], "r": [[0.00523582], 0, 2.85264, 1638454339], "v": "v0.6"}
{"i": [["[\"pool_layer\", \"avg\", 128, 84, 83, 83, 3, 3, 2, \"SAME\"]", "cuda -keys=cuda,gpu -max_num_threads=1024 -thread_warp_size=32", [-1, 16, 64, 49152, 2147483647, 1024, 8, 32], "", 0, []], [[], [["CI", 1], ["FU", 3, [0, 1, 2, 3]], ["SP", 3, 0, 18966528, [64], 1], ["AN", 3, 0, 5], ["AN", 3, 1, 6], ["FU", 2, [0, 1, 2, 3]], ["SP", 2, 0, 18966528, [1], 1], ["AN", 2, 0, 5], ["AN", 2, 1, 6], ["PR", 2, 0, "auto_unroll_max_step$64"]]]], "r": [[0.17334], 0, 3.35875, 1638454342], "v": "v0.6"}
{"i": [["[\"pool_layer\", \"avg\", 128, 84, 83, 83, 3, 3, 2, \"SAME\"]", "cuda -keys=cuda,gpu -max_num_threads=1024 -thread_warp_size=32", [-1, 16, 64, 49152, 2147483647, 1024, 8, 32], "", 0, []], [[], [["CI", 1], ["FU", 3, [0, 1, 2, 3]], ["SP", 3, 0, 18966528, [32], 1], ["AN", 3, 0, 5], ["AN", 3, 1, 6], ["FU", 2, [0, 1, 2, 3]], ["SP", 2, 0, 18966528, [36], 1], ["AN", 2, 0, 5], ["AN", 2, 1, 6], ["PR", 2, 0, "auto_unroll_max_step$1024"]]]], "r": [[0.00612106], 0, 3.31215, 1638454345], "v": "v0.6"}
{"i": [["[\"pool_layer\", \"avg\", 128, 84, 83, 83, 3, 3, 2, \"SAME\"]", "cuda -keys=cuda,gpu -max_num_threads=1024 -thread_warp_size=32", [-1, 16, 64, 49152, 2147483647, 1024, 8, 32], "", 0, []], [[], [["CI", 1], ["FU", 3, [0, 1, 2, 3]], ["SP", 3, 0, 18966528, [64], 1], ["AN", 3, 0, 5], ["AN", 3, 1, 6], ["FU", 2, [0, 1, 2, 3]], ["SP", 2, 0, 18966528, [42], 1], ["AN", 2, 0, 5], ["AN", 2, 1, 6], ["PR", 2, 0, "auto_unroll_max_step$512"]]]], "r": [[0.00669266], 0, 2.84628, 1638454348], "v": "v0.6"}
{"i": [["[\"pool_layer\", \"avg\", 128, 84, 83, 83, 3, 3, 2, \"SAME\"]", "cuda -keys=cuda,gpu -max_num_threads=1024 -thread_warp_size=32", [-1, 16, 64, 49152, 2147483647, 1024, 8, 32], "", 0, []], [[], [["CI", 1], ["FU", 3, [0, 1, 2, 3]], ["SP", 3, 0, 18966528, [32], 1], ["AN", 3, 0, 5], ["AN", 3, 1, 6], ["FU", 2, [0, 1, 2, 3]], ["SP", 2, 0, 18966528, [32], 1], ["AN", 2, 0, 5], ["AN", 2, 1, 6], ["PR", 2, 0, "auto_unroll_max_step$0"]]]], "r": [[0.00620238], 0, 2.79976, 1638454350], "v": "v0.6"}
{"i": [["[\"pool_layer\", \"avg\", 128, 84, 83, 83, 3, 3, 2, \"SAME\"]", "cuda -keys=cuda,gpu -max_num_threads=1024 -thread_warp_size=32", [-1, 16, 64, 49152, 2147483647, 1024, 8, 32], "", 0, []], [[], [["CI", 1], ["FU", 3, [0, 1, 2, 3]], ["SP", 3, 0, 18966528, [32], 1], ["AN", 3, 0, 5], ["AN", 3, 1, 6], ["FU", 2, [0, 1, 2, 3]], ["SP", 2, 0, 18966528, [32], 1], ["AN", 2, 0, 5], ["AN", 2, 1, 6], ["PR", 2, 0, "auto_unroll_max_step$16"]]]], "r": [[0.00620279], 0, 2.82973, 1638454353], "v": "v0.6"}
{"i": [["[\"pool_layer\", \"avg\", 128, 84, 83, 83, 3, 3, 2, \"SAME\"]", "cuda -keys=cuda,gpu -max_num_threads=1024 -thread_warp_size=32", [-1, 16, 64, 49152, 2147483647, 1024, 8, 32], "", 0, []], [[], [["CI", 1], ["FU", 3, [0, 1, 2, 3]], ["SP", 3, 0, 18966528, [1], 1], ["AN", 3, 0, 5], ["AN", 3, 1, 6], ["FU", 2, [0, 1, 2, 3]], ["SP", 2, 0, 18966528, [64], 1], ["AN", 2, 0, 5], ["AN", 2, 1, 6], ["PR", 2, 0, "auto_unroll_max_step$64"]]]], "r": [[0.0710006], 0, 3.17098, 1638454355], "v": "v0.6"}
{"i": [["[\"pool_layer\", \"avg\", 128, 84, 83, 83, 3, 3, 2, \"SAME\"]", "cuda -keys=cuda,gpu -max_num_threads=1024 -thread_warp_size=32", [-1, 16, 64, 49152, 2147483647, 1024, 8, 32], "", 0, []], [[], [["CI", 1], ["FU", 3, [0, 1, 2, 3]], ["SP", 3, 0, 18966528, [8], 1], ["AN", 3, 0, 5], ["AN", 3, 1, 6], ["FU", 2, [0, 1, 2, 3]], ["SP", 2, 0, 18966528, [8], 1], ["AN", 2, 0, 5], ["AN", 2, 1, 6], ["PR", 2, 0, "auto_unroll_max_step$64"]]]], "r": [[0.0237211], 0, 3.50729, 1638454369], "v": "v0.6"}
{"i": [["[\"pool_layer\", \"avg\", 128, 84, 83, 83, 3, 3, 2, \"SAME\"]", "cuda -keys=cuda,gpu -max_num_threads=1024 -thread_warp_size=32", [-1, 16, 64, 49152, 2147483647, 1024, 8, 32], "", 0, []], [[], [["CI", 1], ["FU", 3, [0, 1, 2, 3]], ["SP", 3, 0, 18966528, [16], 1], ["AN", 3, 0, 5], ["AN", 3, 1, 6], ["FU", 2, [0, 1, 2, 3]], ["SP", 2, 0, 18966528, [18], 1], ["AN", 2, 0, 5], ["AN", 2, 1, 6], ["PR", 2, 0, "auto_unroll_max_step$0"]]]], "r": [[0.0105948], 0, 3.03481, 1638454372], "v": "v0.6"}
{"i": [["[\"pool_layer\", \"avg\", 128, 84, 83, 83, 3, 3, 2, \"SAME\"]", "cuda -keys=cuda,gpu -max_num_threads=1024 -thread_warp_size=32", [-1, 16, 64, 49152, 2147483647, 1024, 8, 32], "", 0, []], [[], [["CI", 1], ["FU", 3, [0, 1, 2, 3]], ["SP", 3, 0, 18966528, [2], 1], ["AN", 3, 0, 5], ["AN", 3, 1, 6], ["FU", 2, [0, 1, 2, 3]], ["SP", 2, 0, 18966528, [2], 1], ["AN", 2, 0, 5], ["AN", 2, 1, 6], ["PR", 2, 0, "auto_unroll_max_step$0"]]]], "r": [[0.0870285], 0, 3.46893, 1638454375], "v": "v0.6"}
{"i": [["[\"pool_layer\", \"avg\", 128, 84, 83, 83, 3, 3, 2, \"SAME\"]", "cuda -keys=cuda,gpu -max_num_threads=1024 -thread_warp_size=32", [-1, 16, 64, 49152, 2147483647, 1024, 8, 32], "", 0, []], [[], [["CI", 1], ["FU", 3, [0, 1, 2, 3]], ["SP", 3, 0, 18966528, [16], 1], ["AN", 3, 0, 5], ["AN", 3, 1, 6], ["FU", 2, [0, 1, 2, 3]], ["SP", 2, 0, 18966528, [48], 1], ["AN", 2, 0, 5], ["AN", 2, 1, 6], ["PR", 2, 0, "auto_unroll_max_step$16"]]]], "r": [[0.00758706], 0, 2.9909, 1638454377], "v": "v0.6"}
{"i": [["[\"pool_layer\", \"avg\", 128, 84, 83, 83, 3, 3, 2, \"SAME\"]", "cuda -keys=cuda,gpu -max_num_threads=1024 -thread_warp_size=32", [-1, 16, 64, 49152, 2147483647, 1024, 8, 32], "", 0, []], [[], [["CI", 1], ["FU", 3, [0, 1, 2, 3]], ["SP", 3, 0, 18966528, [64], 1], ["AN", 3, 0, 5], ["AN", 3, 1, 6], ["FU", 2, [0, 1, 2, 3]], ["SP", 2, 0, 18966528, [7], 1], ["AN", 2, 0, 5], ["AN", 2, 1, 6], ["PR", 2, 0, "auto_unroll_max_step$64"]]]], "r": [[0.0165882], 0, 2.98717, 1638454380], "v": "v0.6"}
{"i": [["[\"pool_layer\", \"avg\", 128, 84, 83, 83, 3, 3, 2, \"SAME\"]", "cuda -keys=cuda,gpu -max_num_threads=1024 -thread_warp_size=32", [-1, 16, 64, 49152, 2147483647, 1024, 8, 32], "", 0, []], [[], [["CI", 1], ["FU", 3, [0, 1, 2, 3]], ["SP", 3, 0, 18966528, [64], 1], ["AN", 3, 0, 5], ["AN", 3, 1, 6], ["FU", 2, [0, 1, 2, 3]], ["SP", 2, 0, 18966528, [64], 1], ["AN", 2, 0, 5], ["AN", 2, 1, 6], ["PR", 2, 0, "auto_unroll_max_step$512"]]]], "r": [[0.00414741], 0, 2.97035, 1638454382], "v": "v0.6"}
{"i": [["[\"pool_layer\", \"avg\", 128, 84, 83, 83, 3, 3, 2, \"SAME\"]", "cuda -keys=cuda,gpu -max_num_threads=1024 -thread_warp_size=32", [-1, 16, 64, 49152, 2147483647, 1024, 8, 32], "", 0, []], [[], [["CI", 1], ["FU", 3, [0, 1, 2, 3]], ["SP", 3, 0, 18966528, [36], 1], ["AN", 3, 0, 5], ["AN", 3, 1, 6], ["FU", 2, [0, 1, 2, 3]], ["SP", 2, 0, 18966528, [2], 1], ["AN", 2, 0, 5], ["AN", 2, 1, 6], ["PR", 2, 0, "auto_unroll_max_step$64"]]]], "r": [[0.0548566], 0, 3.2301, 1638454385], "v": "v0.6"}
{"i": [["[\"pool_layer\", \"avg\", 128, 84, 83, 83, 3, 3, 2, \"SAME\"]", "cuda -keys=cuda,gpu -max_num_threads=1024 -thread_warp_size=32", [-1, 16, 64, 49152, 2147483647, 1024, 8, 32], "", 0, []], [[], [["CI", 1], ["FU", 3, [0, 1, 2, 3]], ["SP", 3, 0, 18966528, [2], 1], ["AN", 3, 0, 5], ["AN", 3, 1, 6], ["FU", 2, [0, 1, 2, 3]], ["SP", 2, 0, 18966528, [32], 1], ["AN", 2, 0, 5], ["AN", 2, 1, 6], ["PR", 2, 0, "auto_unroll_max_step$0"]]]], "r": [[0.0383698], 0, 3.12963, 1638454388], "v": "v0.6"}
{"i": [["[\"pool_layer\", \"avg\", 128, 84, 83, 83, 3, 3, 2, \"SAME\"]", "cuda -keys=cuda,gpu -max_num_threads=1024 -thread_warp_size=32", [-1, 16, 64, 49152, 2147483647, 1024, 8, 32], "", 0, []], [[], [["CI", 1], ["FU", 3, [0, 1, 2, 3]], ["SP", 3, 0, 18966528, [32], 1], ["AN", 3, 0, 5], ["AN", 3, 1, 6], ["FU", 2, [0, 1, 2, 3]], ["SP", 2, 0, 18966528, [2], 1], ["AN", 2, 0, 5], ["AN", 2, 1, 6], ["PR", 2, 0, "auto_unroll_max_step$0"]]]], "r": [[0.0548662], 0, 3.15741, 1638454391], "v": "v0.6"}
{"i": [["[\"pool_layer\", \"avg\", 128, 84, 83, 83, 3, 3, 2, \"SAME\"]", "cuda -keys=cuda,gpu -max_num_threads=1024 -thread_warp_size=32", [-1, 16, 64, 49152, 2147483647, 1024, 8, 32], "", 0, []], [[], [["CI", 1], ["FU", 3, [0, 1, 2, 3]], ["SP", 3, 0, 18966528, [4], 1], ["AN", 3, 0, 5], ["AN", 3, 1, 6], ["FU", 2, [0, 1, 2, 3]], ["SP", 2, 0, 18966528, [2], 1], ["AN", 2, 0, 5], ["AN", 2, 1, 6], ["PR", 2, 0, "auto_unroll_max_step$0"]]]], "r": [[0.0694483], 0, 3.3774, 1638454394], "v": "v0.6"}
{"i": [["[\"pool_layer\", \"avg\", 128, 84, 83, 83, 3, 3, 2, \"SAME\"]", "cuda -keys=cuda,gpu -max_num_threads=1024 -thread_warp_size=32", [-1, 16, 64, 49152, 2147483647, 1024, 8, 32], "", 0, []], [[], [["CI", 1], ["FU", 3, [0, 1, 2, 3]], ["SP", 3, 0, 18966528, [6], 1], ["AN", 3, 0, 5], ["AN", 3, 1, 6], ["FU", 2, [0, 1, 2, 3]], ["SP", 2, 0, 18966528, [2], 1], ["AN", 2, 0, 5], ["AN", 2, 1, 6], ["PR", 2, 0, "auto_unroll_max_step$0"]]]], "r": [[0.0639188], 0, 3.2914, 1638454396], "v": "v0.6"}
{"i": [["[\"pool_layer\", \"avg\", 128, 84, 83, 83, 3, 3, 2, \"SAME\"]", "cuda -keys=cuda,gpu -max_num_threads=1024 -thread_warp_size=32", [-1, 16, 64, 49152, 2147483647, 1024, 8, 32], "", 0, []], [[], [["CI", 1], ["FU", 3, [0, 1, 2, 3]], ["SP", 3, 0, 18966528, [48], 1], ["AN", 3, 0, 5], ["AN", 3, 1, 6], ["FU", 2, [0, 1, 2, 3]], ["SP", 2, 0, 18966528, [6], 1], ["AN", 2, 0, 5], ["AN", 2, 1, 6], ["PR", 2, 0, "auto_unroll_max_step$16"]]]], "r": [[0.0195209], 0, 3.11462, 1638454399], "v": "v0.6"}
{"i": [["[\"pool_layer\", \"avg\", 128, 84, 83, 83, 3, 3, 2, \"SAME\"]", "cuda -keys=cuda,gpu -max_num_threads=1024 -thread_warp_size=32", [-1, 16, 64, 49152, 2147483647, 1024, 8, 32], "", 0, []], [[], [["CI", 1], ["FU", 3, [0, 1, 2, 3]], ["SP", 3, 0, 18966528, [32], 1], ["AN", 3, 0, 5], ["AN", 3, 1, 6], ["FU", 2, [0, 1, 2, 3]], ["SP", 2, 0, 18966528, [1], 1], ["AN", 2, 0, 5], ["AN", 2, 1, 6], ["PR", 2, 0, "auto_unroll_max_step$0"]]]], "r": [[0.174161], 0, 3.45742, 1638454402], "v": "v0.6"}
{"i": [["[\"pool_layer\", \"avg\", 128, 84, 83, 83, 3, 3, 2, \"SAME\"]", "cuda -keys=cuda,gpu -max_num_threads=1024 -thread_warp_size=32", [-1, 16, 64, 49152, 2147483647, 1024, 8, 32], "", 0, []], [[], [["CI", 1], ["FU", 3, [0, 1, 2, 3]], ["SP", 3, 0, 18966528, [1], 1], ["AN", 3, 0, 5], ["AN", 3, 1, 6], ["FU", 2, [0, 1, 2, 3]], ["SP", 2, 0, 18966528, [4], 1], ["AN", 2, 0, 5], ["AN", 2, 1, 6], ["PR", 2, 0, "auto_unroll_max_step$0"]]]], "r": [[0.0943017], 0, 3.46555, 1638454405], "v": "v0.6"}
{"i": [["[\"pool_layer\", \"avg\", 128, 84, 83, 83, 3, 3, 2, \"SAME\"]", "cuda -keys=cuda,gpu -max_num_threads=1024 -thread_warp_size=32", [-1, 16, 64, 49152, 2147483647, 1024, 8, 32], "", 0, []], [[], [["CI", 1], ["FU", 3, [0, 1, 2, 3]], ["SP", 3, 0, 18966528, [8], 1], ["AN", 3, 0, 5], ["AN", 3, 1, 6], ["FU", 2, [0, 1, 2, 3]], ["SP", 2, 0, 18966528, [42], 1], ["AN", 2, 0, 5], ["AN", 2, 1, 6], ["PR", 2, 0, "auto_unroll_max_step$0"]]]], "r": [[0.01377], 0, 3.07028, 1638454408], "v": "v0.6"}
{"i": [["[\"pool_layer\", \"avg\", 128, 84, 83, 83, 3, 3, 2, \"SAME\"]", "cuda -keys=cuda,gpu -max_num_threads=1024 -thread_warp_size=32", [-1, 16, 64, 49152, 2147483647, 1024, 8, 32], "", 0, []], [[], [["CI", 1], ["FU", 3, [0, 1, 2, 3]], ["SP", 3, 0, 18966528, [12], 1], ["AN", 3, 0, 5], ["AN", 3, 1, 6], ["FU", 2, [0, 1, 2, 3]], ["SP", 2, 0, 18966528, [24], 1], ["AN", 2, 0, 5], ["AN", 2, 1, 6], ["PR", 2, 0, "auto_unroll_max_step$16"]]]], "r": [[0.0105853], 0, 3.03785, 1638454410], "v": "v0.6"}
{"i": [["[\"pool_layer\", \"avg\", 128, 84, 83, 83, 3, 3, 2, \"SAME\"]", "cuda -keys=cuda,gpu -max_num_threads=1024 -thread_warp_size=32", [-1, 16, 64, 49152, 2147483647, 1024, 8, 32], "", 0, []], [[], [["CI", 1], ["FU", 3, [0, 1, 2, 3]], ["SP", 3, 0, 18966528, [63], 1], ["AN", 3, 0, 5], ["AN", 3, 1, 6], ["FU", 2, [0, 1, 2, 3]], ["SP", 2, 0, 18966528, [32], 1], ["AN", 2, 0, 5], ["AN", 2, 1, 6], ["PR", 2, 0, "auto_unroll_max_step$16"]]]], "r": [[0.005286], 0, 3.04543, 1638454413], "v": "v0.6"}
{"i": [["[\"pool_layer\", \"avg\", 128, 84, 83, 83, 3, 3, 2, \"SAME\"]", "cuda -keys=cuda,gpu -max_num_threads=1024 -thread_warp_size=32", [-1, 16, 64, 49152, 2147483647, 1024, 8, 32], "", 0, []], [[], [["CI", 1], ["FU", 3, [0, 1, 2, 3]], ["SP", 3, 0, 18966528, [48], 1], ["AN", 3, 0, 5], ["AN", 3, 1, 6], ["FU", 2, [0, 1, 2, 3]], ["SP", 2, 0, 18966528, [7], 1], ["AN", 2, 0, 5], ["AN", 2, 1, 6], ["PR", 2, 0, "auto_unroll_max_step$16"]]]], "r": [[0.0170478], 0, 3.12756, 1638454415], "v": "v0.6"}
{"i": [["[\"pool_layer\", \"avg\", 128, 84, 83, 83, 3, 3, 2, \"SAME\"]", "cuda -keys=cuda,gpu -max_num_threads=1024 -thread_warp_size=32", [-1, 16, 64, 49152, 2147483647, 1024, 8, 32], "", 0, []], [[], [["CI", 1], ["FU", 3, [0, 1, 2, 3]], ["SP", 3, 0, 18966528, [32], 1], ["AN", 3, 0, 5], ["AN", 3, 1, 6], ["FU", 2, [0, 1, 2, 3]], ["SP", 2, 0, 18966528, [24], 1], ["AN", 2, 0, 5], ["AN", 2, 1, 6], ["PR", 2, 0, "auto_unroll_max_step$16"]]]], "r": [[0.00717534], 0, 3.35781, 1638454418], "v": "v0.6"}
{"i": [["[\"pool_layer\", \"avg\", 128, 84, 83, 83, 3, 3, 2, \"SAME\"]", "cuda -keys=cuda,gpu -max_num_threads=1024 -thread_warp_size=32", [-1, 16, 64, 49152, 2147483647, 1024, 8, 32], "", 0, []], [[], [["CI", 1], ["FU", 3, [0, 1, 2, 3]], ["SP", 3, 0, 18966528, [4], 1], ["AN", 3, 0, 5], ["AN", 3, 1, 6], ["FU", 2, [0, 1, 2, 3]], ["SP", 2, 0, 18966528, [4], 1], ["AN", 2, 0, 5], ["AN", 2, 1, 6], ["PR", 2, 0, "auto_unroll_max_step$64"]]]], "r": [[0.0432315], 0, 3.15293, 1638454421], "v": "v0.6"}
{"i": [["[\"pool_layer\", \"avg\", 128, 84, 83, 83, 3, 3, 2, \"SAME\"]", "cuda -keys=cuda,gpu -max_num_threads=1024 -thread_warp_size=32", [-1, 16, 64, 49152, 2147483647, 1024, 8, 32], "", 0, []], [[], [["CI", 1], ["FU", 3, [0, 1, 2, 3]], ["SP", 3, 0, 18966528, [2], 1], ["AN", 3, 0, 5], ["AN", 3, 1, 6], ["FU", 2, [0, 1, 2, 3]], ["SP", 2, 0, 18966528, [2], 1], ["AN", 2, 0, 5], ["AN", 2, 1, 6], ["PR", 2, 0, "auto_unroll_max_step$16"]]]], "r": [[0.087049], 0, 3.36093, 1638454424], "v": "v0.6"}
{"i": [["[\"pool_layer\", \"avg\", 128, 84, 83, 83, 3, 3, 2, \"SAME\"]", "cuda -keys=cuda,gpu -max_num_threads=1024 -thread_warp_size=32", [-1, 16, 64, 49152, 2147483647, 1024, 8, 32], "", 0, []], [[], [["CI", 1], ["FU", 3, [0, 1, 2, 3]], ["SP", 3, 0, 18966528, [3], 1], ["AN", 3, 0, 5], ["AN", 3, 1, 6], ["FU", 2, [0, 1, 2, 3]], ["SP", 2, 0, 18966528, [64], 1], ["AN", 2, 0, 5], ["AN", 2, 1, 6], ["PR", 2, 0, "auto_unroll_max_step$512"]]]], "r": [[0.0256652], 0, 3.15001, 1638454427], "v": "v0.6"}
{"i": [["[\"pool_layer\", \"avg\", 128, 84, 83, 83, 3, 3, 2, \"SAME\"]", "cuda -keys=cuda,gpu -max_num_threads=1024 -thread_warp_size=32", [-1, 16, 64, 49152, 2147483647, 1024, 8, 32], "", 0, []], [[], [["CI", 1], ["FU", 3, [0, 1, 2, 3]], ["SP", 3, 0, 18966528, [8], 1], ["AN", 3, 0, 5], ["AN", 3, 1, 6], ["FU", 2, [0, 1, 2, 3]], ["SP", 2, 0, 18966528, [8], 1], ["AN", 2, 0, 5], ["AN", 2, 1, 6], ["PR", 2, 0, "auto_unroll_max_step$16"]]]], "r": [[0.0217257], 0, 3.05942, 1638454429], "v": "v0.6"}
{"i": [["[\"pool_layer\", \"avg\", 128, 84, 83, 83, 3, 3, 2, \"SAME\"]", "cuda -keys=cuda,gpu -max_num_threads=1024 -thread_warp_size=32", [-1, 16, 64, 49152, 2147483647, 1024, 8, 32], "", 0, []], [[], [["CI", 1], ["FU", 3, [0, 1, 2, 3]], ["SP", 3, 0, 18966528, [2], 1], ["AN", 3, 0, 5], ["AN", 3, 1, 6], ["FU", 2, [0, 1, 2, 3]], ["SP", 2, 0, 18966528, [42], 1], ["AN", 2, 0, 5], ["AN", 2, 1, 6], ["PR", 2, 0, "auto_unroll_max_step$0"]]]], "r": [[0.0398302], 0, 3.19925, 1638454432], "v": "v0.6"}
{"i": [["[\"pool_layer\", \"avg\", 128, 84, 83, 83, 3, 3, 2, \"SAME\"]", "cuda -keys=cuda,gpu -max_num_threads=1024 -thread_warp_size=32", [-1, 16, 64, 49152, 2147483647, 1024, 8, 32], "", 0, []], [[], [["CI", 1], ["FU", 3, [0, 1, 2, 3]], ["SP", 3, 0, 18966528, [2], 1], ["AN", 3, 0, 5], ["AN", 3, 1, 6], ["FU", 2, [0, 1, 2, 3]], ["SP", 2, 0, 18966528, [4], 1], ["AN", 2, 0, 5], ["AN", 2, 1, 6], ["PR", 2, 0, "auto_unroll_max_step$64"]]]], "r": [[0.0608311], 0, 3.19078, 1638454435], "v": "v0.6"}
{"i": [["[\"pool_layer\", \"avg\", 128, 84, 83, 83, 3, 3, 2, \"SAME\"]", "cuda -keys=cuda,gpu -max_num_threads=1024 -thread_warp_size=32", [-1, 16, 64, 49152, 2147483647, 1024, 8, 32], "", 0, []], [[], [["CI", 1], ["FU", 3, [0, 1, 2, 3]], ["SP", 3, 0, 18966528, [7], 1], ["AN", 3, 0, 5], ["AN", 3, 1, 6], ["FU", 2, [0, 1, 2, 3]], ["SP", 2, 0, 18966528, [64], 1], ["AN", 2, 0, 5], ["AN", 2, 1, 6], ["PR", 2, 0, "auto_unroll_max_step$1024"]]]], "r": [[0.0125082], 0, 3.01403, 1638454437], "v": "v0.6"}
{"i": [["[\"pool_layer\", \"avg\", 128, 84, 83, 83, 3, 3, 2, \"SAME\"]", "cuda -keys=cuda,gpu -max_num_threads=1024 -thread_warp_size=32", [-1, 16, 64, 49152, 2147483647, 1024, 8, 32], "", 0, []], [[], [["CI", 1], ["FU", 3, [0, 1, 2, 3]], ["SP", 3, 0, 18966528, [24], 1], ["AN", 3, 0, 5], ["AN", 3, 1, 6], ["FU", 2, [0, 1, 2, 3]], ["SP", 2, 0, 18966528, [64], 1], ["AN", 2, 0, 5], ["AN", 2, 1, 6], ["PR", 2, 0, "auto_unroll_max_step$1024"]]]], "r": [[0.00586061], 0, 2.96806, 1638454440], "v": "v0.6"}
{"i": [["[\"pool_layer\", \"avg\", 128, 84, 83, 83, 3, 3, 2, \"SAME\"]", "cuda -keys=cuda,gpu -max_num_threads=1024 -thread_warp_size=32", [-1, 16, 64, 49152, 2147483647, 1024, 8, 32], "", 0, []], [[], [["CI", 1], ["FU", 3, [0, 1, 2, 3]], ["SP", 3, 0, 18966528, [48], 1], ["AN", 3, 0, 5], ["AN", 3, 1, 6], ["FU", 2, [0, 1, 2, 3]], ["SP", 2, 0, 18966528, [64], 1], ["AN", 2, 0, 5], ["AN", 2, 1, 6], ["PR", 2, 0, "auto_unroll_max_step$0"]]]], "r": [[0.00460668], 0, 2.99602, 1638454443], "v": "v0.6"}
{"i": [["[\"pool_layer\", \"avg\", 128, 84, 83, 83, 3, 3, 2, \"SAME\"]", "cuda -keys=cuda,gpu -max_num_threads=1024 -thread_warp_size=32", [-1, 16, 64, 49152, 2147483647, 1024, 8, 32], "", 0, []], [[], [["CI", 1], ["FU", 3, [0, 1, 2, 3]], ["SP", 3, 0, 18966528, [2], 1], ["AN", 3, 0, 5], ["AN", 3, 1, 6], ["FU", 2, [0, 1, 2, 3]], ["SP", 2, 0, 18966528, [48], 1], ["AN", 2, 0, 5], ["AN", 2, 1, 6], ["PR", 2, 0, "auto_unroll_max_step$0"]]]], "r": [[0.0377741], 0, 3.16993, 1638454445], "v": "v0.6"}
{"i": [["[\"pool_layer\", \"avg\", 128, 84, 83, 83, 3, 3, 2, \"SAME\"]", "cuda -keys=cuda,gpu -max_num_threads=1024 -thread_warp_size=32", [-1, 16, 64, 49152, 2147483647, 1024, 8, 32], "", 0, []], [[], [["CI", 1], ["FU", 3, [0, 1, 2, 3]], ["SP", 3, 0, 18966528, [2], 1], ["AN", 3, 0, 5], ["AN", 3, 1, 6], ["FU", 2, [0, 1, 2, 3]], ["SP", 2, 0, 18966528, [3], 1], ["AN", 2, 0, 5], ["AN", 2, 1, 6], ["PR", 2, 0, "auto_unroll_max_step$512"]]]], "r": [[0.0695897], 0, 3.28917, 1638454448], "v": "v0.6"}
{"i": [["[\"pool_layer\", \"avg\", 128, 84, 83, 83, 3, 3, 2, \"SAME\"]", "cuda -keys=cuda,gpu -max_num_threads=1024 -thread_warp_size=32", [-1, 16, 64, 49152, 2147483647, 1024, 8, 32], "", 0, []], [[], [["CI", 1], ["FU", 3, [0, 1, 2, 3]], ["SP", 3, 0, 18966528, [48], 1], ["AN", 3, 0, 5], ["AN", 3, 1, 6], ["FU", 2, [0, 1, 2, 3]], ["SP", 2, 0, 18966528, [1], 1], ["AN", 2, 0, 5], ["AN", 2, 1, 6], ["PR", 2, 0, "auto_unroll_max_step$0"]]]], "r": [[0.173654], 0, 3.51649, 1638454451], "v": "v0.6"}
{"i": [["[\"pool_layer\", \"avg\", 128, 84, 83, 83, 3, 3, 2, \"SAME\"]", "cuda -keys=cuda,gpu -max_num_threads=1024 -thread_warp_size=32", [-1, 16, 64, 49152, 2147483647, 1024, 8, 32], "", 0, []], [[], [["CI", 1], ["FU", 3, [0, 1, 2, 3]], ["SP", 3, 0, 18966528, [28], 1], ["AN", 3, 0, 5], ["AN", 3, 1, 6], ["FU", 2, [0, 1, 2, 3]], ["SP", 2, 0, 18966528, [64], 1], ["AN", 2, 0, 5], ["AN", 2, 1, 6], ["PR", 2, 0, "auto_unroll_max_step$512"]]]], "r": [[0.00551357], 0, 2.92764, 1638454454], "v": "v0.6"}
{"i": [["[\"pool_layer\", \"avg\", 128, 84, 83, 83, 3, 3, 2, \"SAME\"]", "cuda -keys=cuda,gpu -max_num_threads=1024 -thread_warp_size=32", [-1, 16, 64, 49152, 2147483647, 1024, 8, 32], "", 0, []], [[], [["CI", 1], ["FU", 3, [0, 1, 2, 3]], ["SP", 3, 0, 18966528, [1], 1], ["AN", 3, 0, 5], ["AN", 3, 1, 6], ["FU", 2, [0, 1, 2, 3]], ["SP", 2, 0, 18966528, [8], 1], ["AN", 2, 0, 5], ["AN", 2, 1, 6], ["PR", 2, 0, "auto_unroll_max_step$16"]]]], "r": [[0.0812863], 0, 3.36288, 1638454457], "v": "v0.6"}
{"i": [["[\"pool_layer\", \"avg\", 128, 84, 83, 83, 3, 3, 2, \"SAME\"]", "cuda -keys=cuda,gpu -max_num_threads=1024 -thread_warp_size=32", [-1, 16, 64, 49152, 2147483647, 1024, 8, 32], "", 0, []], [[], [["CI", 1], ["FU", 3, [0, 1, 2, 3]], ["SP", 3, 0, 18966528, [8], 1], ["AN", 3, 0, 5], ["AN", 3, 1, 6], ["FU", 2, [0, 1, 2, 3]], ["SP", 2, 0, 18966528, [42], 1], ["AN", 2, 0, 5], ["AN", 2, 1, 6], ["PR", 2, 0, "auto_unroll_max_step$1024"]]]], "r": [[0.0137712], 0, 2.97446, 1638454459], "v": "v0.6"}
{"i": [["[\"pool_layer\", \"avg\", 128, 84, 83, 83, 3, 3, 2, \"SAME\"]", "cuda -keys=cuda,gpu -max_num_threads=1024 -thread_warp_size=32", [-1, 16, 64, 49152, 2147483647, 1024, 8, 32], "", 0, []], [[], [["CI", 1], ["FU", 3, [0, 1, 2, 3]], ["SP", 3, 0, 18966528, [8], 1], ["AN", 3, 0, 5], ["AN", 3, 1, 6], ["FU", 2, [0, 1, 2, 3]], ["SP", 2, 0, 18966528, [1], 1], ["AN", 2, 0, 5], ["AN", 2, 1, 6], ["PR", 2, 0, "auto_unroll_max_step$16"]]]], "r": [[0.180281], 0, 3.52768, 1638454462], "v": "v0.6"}
{"i": [["[\"pool_layer\", \"avg\", 128, 84, 83, 83, 3, 3, 2, \"SAME\"]", "cuda -keys=cuda,gpu -max_num_threads=1024 -thread_warp_size=32", [-1, 16, 64, 49152, 2147483647, 1024, 8, 32], "", 0, []], [[], [["CI", 1], ["FU", 3, [0, 1, 2, 3]], ["SP", 3, 0, 18966528, [1], 1], ["AN", 3, 0, 5], ["AN", 3, 1, 6], ["FU", 2, [0, 1, 2, 3]], ["SP", 2, 0, 18966528, [3], 1], ["AN", 2, 0, 5], ["AN", 2, 1, 6], ["PR", 2, 0, "auto_unroll_max_step$0"]]]], "r": [[0.103073], 0, 3.16347, 1638454465], "v": "v0.6"}
{"i": [["[\"pool_layer\", \"avg\", 128, 84, 83, 83, 3, 3, 2, \"SAME\"]", "cuda -keys=cuda,gpu -max_num_threads=1024 -thread_warp_size=32", [-1, 16, 64, 49152, 2147483647, 1024, 8, 32], "", 0, []], [[], [["CI", 1], ["FU", 3, [0, 1, 2, 3]], ["SP", 3, 0, 18966528, [16], 1], ["AN", 3, 0, 5], ["AN", 3, 1, 6], ["FU", 2, [0, 1, 2, 3]], ["SP", 2, 0, 18966528, [9], 1], ["AN", 2, 0, 5], ["AN", 2, 1, 6], ["PR", 2, 0, "auto_unroll_max_step$16"]]]], "r": [[0.0162684], 0, 2.97806, 1638454468], "v": "v0.6"}
{"i": [["[\"pool_layer\", \"avg\", 128, 84, 83, 83, 3, 3, 2, \"SAME\"]", "cuda -keys=cuda,gpu -max_num_threads=1024 -thread_warp_size=32", [-1, 16, 64, 49152, 2147483647, 1024, 8, 32], "", 0, []], [[], [["CI", 1], ["FU", 3, [0, 1, 2, 3]], ["SP", 3, 0, 18966528, [2], 1], ["AN", 3, 0, 5], ["AN", 3, 1, 6], ["FU", 2, [0, 1, 2, 3]], ["SP", 2, 0, 18966528, [8], 1], ["AN", 2, 0, 5], ["AN", 2, 1, 6], ["PR", 2, 0, "auto_unroll_max_step$16"]]]], "r": [[0.0477876], 0, 3.16794, 1638454470], "v": "v0.6"}
{"i": [["[\"pool_layer\", \"avg\", 128, 84, 83, 83, 3, 3, 2, \"SAME\"]", "cuda -keys=cuda,gpu -max_num_threads=1024 -thread_warp_size=32", [-1, 16, 64, 49152, 2147483647, 1024, 8, 32], "", 0, []], [[], [["CI", 1], ["FU", 3, [0, 1, 2, 3]], ["SP", 3, 0, 18966528, [64], 1], ["AN", 3, 0, 5], ["AN", 3, 1, 6], ["FU", 2, [0, 1, 2, 3]], ["SP", 2, 0, 18966528, [16], 1], ["AN", 2, 0, 5], ["AN", 2, 1, 6], ["PR", 2, 0, "auto_unroll_max_step$16"]]]], "r": [[0.00819117], 0, 2.97137, 1638454473], "v": "v0.6"}
{"i": [["[\"pool_layer\", \"avg\", 128, 84, 83, 83, 3, 3, 2, \"SAME\"]", "cuda -keys=cuda,gpu -max_num_threads=1024 -thread_warp_size=32", [-1, 16, 64, 49152, 2147483647, 1024, 8, 32], "", 0, []], [[], [["CI", 1], ["FU", 3, [0, 1, 2, 3]], ["SP", 3, 0, 18966528, [6], 1], ["AN", 3, 0, 5], ["AN", 3, 1, 6], ["FU", 2, [0, 1, 2, 3]], ["SP", 2, 0, 18966528, [12], 1], ["AN", 2, 0, 5], ["AN", 2, 1, 6], ["PR", 2, 0, "auto_unroll_max_step$0"]]]], "r": [[0.0212057], 0, 3.15484, 1638454476], "v": "v0.6"}
{"i": [["[\"pool_layer\", \"avg\", 128, 84, 83, 83, 3, 3, 2, \"SAME\"]", "cuda -keys=cuda,gpu -max_num_threads=1024 -thread_warp_size=32", [-1, 16, 64, 49152, 2147483647, 1024, 8, 32], "", 0, []], [[], [["CI", 1], ["FU", 3, [0, 1, 2, 3]], ["SP", 3, 0, 18966528, [32], 1], ["AN", 3, 0, 5], ["AN", 3, 1, 6], ["FU", 2, [0, 1, 2, 3]], ["SP", 2, 0, 18966528, [16], 1], ["AN", 2, 0, 5], ["AN", 2, 1, 6], ["PR", 2, 0, "auto_unroll_max_step$16"]]]], "r": [[0.0091618], 0, 3.2449, 1638454479], "v": "v0.6"}
{"i": [["[\"pool_layer\", \"avg\", 128, 84, 83, 83, 3, 3, 2, \"SAME\"]", "cuda -keys=cuda,gpu -max_num_threads=1024 -thread_warp_size=32", [-1, 16, 64, 49152, 2147483647, 1024, 8, 32], "", 0, []], [[], [["CI", 1], ["FU", 3, [0, 1, 2, 3]], ["SP", 3, 0, 18966528, [1], 1], ["AN", 3, 0, 5], ["AN", 3, 1, 6], ["FU", 2, [0, 1, 2, 3]], ["SP", 2, 0, 18966528, [64], 1], ["AN", 2, 0, 5], ["AN", 2, 1, 6], ["PR", 2, 0, "auto_unroll_max_step$16"]]]], "r": [[0.0707795], 0, 3.50746, 1638454482], "v": "v0.6"}
{"i": [["[\"pool_layer\", \"avg\", 128, 84, 83, 83, 3, 3, 2, \"SAME\"]", "cuda -keys=cuda,gpu -max_num_threads=1024 -thread_warp_size=32", [-1, 16, 64, 49152, 2147483647, 1024, 8, 32], "", 0, []], [[], [["CI", 1], ["FU", 3, [0, 1, 2, 3]], ["SP", 3, 0, 18966528, [4], 1], ["AN", 3, 0, 5], ["AN", 3, 1, 6], ["FU", 2, [0, 1, 2, 3]], ["SP", 2, 0, 18966528, [64], 1], ["AN", 2, 0, 5], ["AN", 2, 1, 6], ["PR", 2, 0, "auto_unroll_max_step$64"]]]], "r": [[0.0204963], 0, 3.30096, 1638454485], "v": "v0.6"}
{"i": [["[\"pool_layer\", \"avg\", 128, 84, 83, 83, 3, 3, 2, \"SAME\"]", "cuda -keys=cuda,gpu -max_num_threads=1024 -thread_warp_size=32", [-1, 16, 64, 49152, 2147483647, 1024, 8, 32], "", 0, []], [[], [["CI", 1], ["FU", 3, [0, 1, 2, 3]], ["SP", 3, 0, 18966528, [12], 1], ["AN", 3, 0, 5], ["AN", 3, 1, 6], ["FU", 2, [0, 1, 2, 3]], ["SP", 2, 0, 18966528, [1], 1], ["AN", 2, 0, 5], ["AN", 2, 1, 6], ["PR", 2, 0, "auto_unroll_max_step$16"]]]], "r": [[0.184441], 0, 4.2327, 1638454489], "v": "v0.6"}
{"i": [["[\"pool_layer\", \"avg\", 128, 84, 83, 83, 3, 3, 2, \"SAME\"]", "cuda -keys=cuda,gpu -max_num_threads=1024 -thread_warp_size=32", [-1, 16, 64, 49152, 2147483647, 1024, 8, 32], "", 0, []], [[], [["CI", 1], ["FU", 3, [0, 1, 2, 3]], ["SP", 3, 0, 18966528, [4], 1], ["AN", 3, 0, 5], ["AN", 3, 1, 6], ["FU", 2, [0, 1, 2, 3]], ["SP", 2, 0, 18966528, [1], 1], ["AN", 2, 0, 5], ["AN", 2, 1, 6], ["PR", 2, 0, "auto_unroll_max_step$16"]]]], "r": [[0.188759], 0, 3.58456, 1638454492], "v": "v0.6"}
{"i": [["[\"pool_layer\", \"avg\", 128, 84, 83, 83, 3, 3, 2, \"SAME\"]", "cuda -keys=cuda,gpu -max_num_threads=1024 -thread_warp_size=32", [-1, 16, 64, 49152, 2147483647, 1024, 8, 32], "", 0, []], [[], [["CI", 1], ["FU", 3, [0, 1, 2, 3]], ["SP", 3, 0, 18966528, [1], 1], ["AN", 3, 0, 5], ["AN", 3, 1, 6], ["FU", 2, [0, 1, 2, 3]], ["SP", 2, 0, 18966528, [1], 1], ["AN", 2, 0, 5], ["AN", 2, 1, 6], ["PR", 2, 0, "auto_unroll_max_step$512"]]]], "r": [[0.239821], 0, 3.79561, 1638454495], "v": "v0.6"}
{"i": [["[\"pool_layer\", \"avg\", 128, 84, 83, 83, 3, 3, 2, \"SAME\"]", "cuda -keys=cuda,gpu -max_num_threads=1024 -thread_warp_size=32", [-1, 16, 64, 49152, 2147483647, 1024, 8, 32], "", 0, []], [[], [["CI", 1], ["FU", 3, [0, 1, 2, 3]], ["SP", 3, 0, 18966528, [32], 1], ["AN", 3, 0, 5], ["AN", 3, 1, 6], ["FU", 2, [0, 1, 2, 3]], ["SP", 2, 0, 18966528, [2], 1], ["AN", 2, 0, 5], ["AN", 2, 1, 6], ["PR", 2, 0, "auto_unroll_max_step$16"]]]], "r": [[0.0548899], 0, 3.17509, 1638454498], "v": "v0.6"}
{"i": [["[\"pool_layer\", \"avg\", 128, 84, 83, 83, 3, 3, 2, \"SAME\"]", "cuda -keys=cuda,gpu -max_num_threads=1024 -thread_warp_size=32", [-1, 16, 64, 49152, 2147483647, 1024, 8, 32], "", 0, []], [[], [["CI", 1], ["FU", 3, [0, 1, 2, 3]], ["SP", 3, 0, 18966528, [64], 1], ["AN", 3, 0, 5], ["AN", 3, 1, 6], ["FU", 2, [0, 1, 2, 3]], ["SP", 2, 0, 18966528, [64], 1], ["AN", 2, 0, 5], ["AN", 2, 1, 6], ["PR", 2, 0, "auto_unroll_max_step$0"]]]], "r": [[0.00415338], 0, 2.86088, 1638454501], "v": "v0.6"}
{"i": [["[\"pool_layer\", \"avg\", 128, 84, 83, 83, 3, 3, 2, \"SAME\"]", "cuda -keys=cuda,gpu -max_num_threads=1024 -thread_warp_size=32", [-1, 16, 64, 49152, 2147483647, 1024, 8, 32], "", 0, []], [[], [["CI", 1], ["FU", 3, [0, 1, 2, 3]], ["SP", 3, 0, 18966528, [56], 1], ["AN", 3, 0, 5], ["AN", 3, 1, 6], ["FU", 2, [0, 1, 2, 3]], ["SP", 2, 0, 18966528, [1], 1], ["AN", 2, 0, 5], ["AN", 2, 1, 6], ["PR", 2, 0, "auto_unroll_max_step$1024"]]]], "r": [[0.173402], 0, 3.39444, 1638454506], "v": "v0.6"}
{"i": [["[\"pool_layer\", \"avg\", 128, 84, 83, 83, 3, 3, 2, \"SAME\"]", "cuda -keys=cuda,gpu -max_num_threads=1024 -thread_warp_size=32", [-1, 16, 64, 49152, 2147483647, 1024, 8, 32], "", 0, []], [[], [["CI", 1], ["FU", 3, [0, 1, 2, 3]], ["SP", 3, 0, 18966528, [1], 1], ["AN", 3, 0, 5], ["AN", 3, 1, 6], ["FU", 2, [0, 1, 2, 3]], ["SP", 2, 0, 18966528, [2], 1], ["AN", 2, 0, 5], ["AN", 2, 1, 6], ["PR", 2, 0, "auto_unroll_max_step$64"]]]], "r": [[0.120541], 0, 3.15768, 1638454509], "v": "v0.6"}
{"i": [["[\"pool_layer\", \"avg\", 128, 84, 83, 83, 3, 3, 2, \"SAME\"]", "cuda -keys=cuda,gpu -max_num_threads=1024 -thread_warp_size=32", [-1, 16, 64, 49152, 2147483647, 1024, 8, 32], "", 0, []], [[], [["CI", 1], ["FU", 3, [0, 1, 2, 3]], ["SP", 3, 0, 18966528, [36], 1], ["AN", 3, 0, 5], ["AN", 3, 1, 6], ["FU", 2, [0, 1, 2, 3]], ["SP", 2, 0, 18966528, [8], 1], ["AN", 2, 0, 5], ["AN", 2, 1, 6], ["PR", 2, 0, "auto_unroll_max_step$0"]]]], "r": [[0.0155963], 0, 2.89773, 1638454512], "v": "v0.6"}
{"i": [["[\"pool_layer\", \"avg\", 128, 84, 83, 83, 3, 3, 2, \"SAME\"]", "cuda -keys=cuda,gpu -max_num_threads=1024 -thread_warp_size=32", [-1, 16, 64, 49152, 2147483647, 1024, 8, 32], "", 0, []], [[], [["CI", 1], ["FU", 3, [0, 1, 2, 3]], ["SP", 3, 0, 18966528, [1], 1], ["AN", 3, 0, 5], ["AN", 3, 1, 6], ["FU", 2, [0, 1, 2, 3]], ["SP", 2, 0, 18966528, [24], 1], ["AN", 2, 0, 5], ["AN", 2, 1, 6], ["PR", 2, 0, "auto_unroll_max_step$0"]]]], "r": [[0.0728278], 0, 3.24141, 1638454514], "v": "v0.6"}
{"i": [["[\"pool_layer\", \"avg\", 128, 84, 83, 83, 3, 3, 2, \"SAME\"]", "cuda -keys=cuda,gpu -max_num_threads=1024 -thread_warp_size=32", [-1, 16, 64, 49152, 2147483647, 1024, 8, 32], "", 0, []], [[], [["CI", 1], ["FU", 3, [0, 1, 2, 3]], ["SP", 3, 0, 18966528, [4], 1], ["AN", 3, 0, 5], ["AN", 3, 1, 6], ["FU", 2, [0, 1, 2, 3]], ["SP", 2, 0, 18966528, [8], 1], ["AN", 2, 0, 5], ["AN", 2, 1, 6], ["PR", 2, 0, "auto_unroll_max_step$1024"]]]], "r": [[0.0301936], 0, 2.95145, 1638454517], "v": "v0.6"}
{"i": [["[\"pool_layer\", \"avg\", 128, 84, 83, 83, 3, 3, 2, \"SAME\"]", "cuda -keys=cuda,gpu -max_num_threads=1024 -thread_warp_size=32", [-1, 16, 64, 49152, 2147483647, 1024, 8, 32], "", 0, []], [[], [["CI", 1], ["FU", 3, [0, 1, 2, 3]], ["SP", 3, 0, 18966528, [16], 1], ["AN", 3, 0, 5], ["AN", 3, 1, 6], ["FU", 2, [0, 1, 2, 3]], ["SP", 2, 0, 18966528, [48], 1], ["AN", 2, 0, 5], ["AN", 2, 1, 6], ["PR", 2, 0, "auto_unroll_max_step$0"]]]], "r": [[0.00758714], 0, 2.91126, 1638454520], "v": "v0.6"}
{"i": [["[\"pool_layer\", \"avg\", 128, 84, 83, 83, 3, 3, 2, \"SAME\"]", "cuda -keys=cuda,gpu -max_num_threads=1024 -thread_warp_size=32", [-1, 16, 64, 49152, 2147483647, 1024, 8, 32], "", 0, []], [[], [["CI", 1], ["FU", 3, [0, 1, 2, 3]], ["SP", 3, 0, 18966528, [64], 1], ["AN", 3, 0, 5], ["AN", 3, 1, 6], ["FU", 2, [0, 1, 2, 3]], ["SP", 2, 0, 18966528, [3], 1], ["AN", 2, 0, 5], ["AN", 2, 1, 6], ["PR", 2, 0, "auto_unroll_max_step$16"]]]], "r": [[0.0364381], 0, 3.038, 1638454522], "v": "v0.6"}
{"i": [["[\"pool_layer\", \"avg\", 128, 84, 83, 83, 3, 3, 2, \"SAME\"]", "cuda -keys=cuda,gpu -max_num_threads=1024 -thread_warp_size=32", [-1, 16, 64, 49152, 2147483647, 1024, 8, 32], "", 0, []], [[], [["CI", 1], ["FU", 3, [0, 1, 2, 3]], ["SP", 3, 0, 18966528, [12], 1], ["AN", 3, 0, 5], ["AN", 3, 1, 6], ["FU", 2, [0, 1, 2, 3]], ["SP", 2, 0, 18966528, [24], 1], ["AN", 2, 0, 5], ["AN", 2, 1, 6], ["PR", 2, 0, "auto_unroll_max_step$0"]]]], "r": [[0.0105865], 0, 2.85366, 1638454525], "v": "v0.6"}
{"i": [["[\"pool_layer\", \"avg\", 128, 84, 83, 83, 3, 3, 2, \"SAME\"]", "cuda -keys=cuda,gpu -max_num_threads=1024 -thread_warp_size=32", [-1, 16, 64, 49152, 2147483647, 1024, 8, 32], "", 0, []], [[], [["CI", 1], ["FU", 3, [0, 1, 2, 3]], ["SP", 3, 0, 18966528, [64], 1], ["AN", 3, 0, 5], ["AN", 3, 1, 6], ["FU", 2, [0, 1, 2, 3]], ["SP", 2, 0, 18966528, [64], 1], ["AN", 2, 0, 5], ["AN", 2, 1, 6], ["PR", 2, 0, "auto_unroll_max_step$16"]]]], "r": [[0.00414574], 0, 2.79359, 1638454527], "v": "v0.6"}
{"i": [["[\"pool_layer\", \"avg\", 128, 84, 83, 83, 3, 3, 2, \"SAME\"]", "cuda -keys=cuda,gpu -max_num_threads=1024 -thread_warp_size=32", [-1, 16, 64, 49152, 2147483647, 1024, 8, 32], "", 0, []], [[], [["CI", 1], ["FU", 3, [0, 1, 2, 3]], ["SP", 3, 0, 18966528, [8], 1], ["AN", 3, 0, 5], ["AN", 3, 1, 6], ["FU", 2, [0, 1, 2, 3]], ["SP", 2, 0, 18966528, [21], 1], ["AN", 2, 0, 5], ["AN", 2, 1, 6], ["PR", 2, 0, "auto_unroll_max_step$512"]]]], "r": [[0.0138953], 0, 2.90076, 1638454530], "v": "v0.6"}
{"i": [["[\"pool_layer\", \"avg\", 128, 84, 83, 83, 3, 3, 2, \"SAME\"]", "cuda -keys=cuda,gpu -max_num_threads=1024 -thread_warp_size=32", [-1, 16, 64, 49152, 2147483647, 1024, 8, 32], "", 0, []], [[], [["CI", 1], ["FU", 3, [0, 1, 2, 3]], ["SP", 3, 0, 18966528, [12], 1], ["AN", 3, 0, 5], ["AN", 3, 1, 6], ["FU", 2, [0, 1, 2, 3]], ["SP", 2, 0, 18966528, [18], 1], ["AN", 2, 0, 5], ["AN", 2, 1, 6], ["PR", 2, 0, "auto_unroll_max_step$0"]]]], "r": [[0.0120228], 0, 2.9929, 1638454533], "v": "v0.6"}
{"i": [["[\"pool_layer\", \"avg\", 128, 84, 83, 83, 3, 3, 2, \"SAME\"]", "cuda -keys=cuda,gpu -max_num_threads=1024 -thread_warp_size=32", [-1, 16, 64, 49152, 2147483647, 1024, 8, 32], "", 0, []], [[], [["CI", 1], ["FU", 3, [0, 1, 2, 3]], ["SP", 3, 0, 18966528, [1], 1], ["AN", 3, 0, 5], ["AN", 3, 1, 6], ["FU", 2, [0, 1, 2, 3]], ["SP", 2, 0, 18966528, [1], 1], ["AN", 2, 0, 5], ["AN", 2, 1, 6], ["PR", 2, 0, "auto_unroll_max_step$1024"]]]], "r": [[0.239751], 0, 3.7062, 1638454536], "v": "v0.6"}
{"i": [["[\"pool_layer\", \"avg\", 128, 84, 83, 83, 3, 3, 2, \"SAME\"]", "cuda -keys=cuda,gpu -max_num_threads=1024 -thread_warp_size=32", [-1, 16, 64, 49152, 2147483647, 1024, 8, 32], "", 0, []], [[], [["CI", 1], ["FU", 3, [0, 1, 2, 3]], ["SP", 3, 0, 18966528, [18], 1], ["AN", 3, 0, 5], ["AN", 3, 1, 6], ["FU", 2, [0, 1, 2, 3]], ["SP", 2, 0, 18966528, [4], 1], ["AN", 2, 0, 5], ["AN", 2, 1, 6], ["PR", 2, 0, "auto_unroll_max_step$16"]]]], "r": [[0.0303267], 0, 3.08236, 1638454539], "v": "v0.6"}
{"i": [["[\"pool_layer\", \"avg\", 128, 84, 83, 83, 3, 3, 2, \"SAME\"]", "cuda -keys=cuda,gpu -max_num_threads=1024 -thread_warp_size=32", [-1, 16, 64, 49152, 2147483647, 1024, 8, 32], "", 0, []], [[], [["CI", 1], ["FU", 3, [0, 1, 2, 3]], ["SP", 3, 0, 18966528, [32], 1], ["AN", 3, 0, 5], ["AN", 3, 1, 6], ["FU", 2, [0, 1, 2, 3]], ["SP", 2, 0, 18966528, [16], 1], ["AN", 2, 0, 5], ["AN", 2, 1, 6], ["PR", 2, 0, "auto_unroll_max_step$1024"]]]], "r": [[0.00916401], 0, 2.84967, 1638454541], "v": "v0.6"}
{"i": [["[\"pool_layer\", \"avg\", 128, 84, 83, 83, 3, 3, 2, \"SAME\"]", "cuda -keys=cuda,gpu -max_num_threads=1024 -thread_warp_size=32", [-1, 16, 64, 49152, 2147483647, 1024, 8, 32], "", 0, []], [[], [["CI", 1], ["FU", 3, [0, 1, 2, 3]], ["SP", 3, 0, 18966528, [8], 1], ["AN", 3, 0, 5], ["AN", 3, 1, 6], ["FU", 2, [0, 1, 2, 3]], ["SP", 2, 0, 18966528, [64], 1], ["AN", 2, 0, 5], ["AN", 2, 1, 6], ["PR", 2, 0, "auto_unroll_max_step$64"]]]], "r": [[0.0112258], 0, 2.89162, 1638454544], "v": "v0.6"}
{"i": [["[\"pool_layer\", \"avg\", 128, 84, 83, 83, 3, 3, 2, \"SAME\"]", "cuda -keys=cuda,gpu -max_num_threads=1024 -thread_warp_size=32", [-1, 16, 64, 49152, 2147483647, 1024, 8, 32], "", 0, []], [[], [["CI", 1], ["FU", 3, [0, 1, 2, 3]], ["SP", 3, 0, 18966528, [6], 1], ["AN", 3, 0, 5], ["AN", 3, 1, 6], ["FU", 2, [0, 1, 2, 3]], ["SP", 2, 0, 18966528, [32], 1], ["AN", 2, 0, 5], ["AN", 2, 1, 6], ["PR", 2, 0, "auto_unroll_max_step$1024"]]]], "r": [[0.0152506], 0, 3.06055, 1638454547], "v": "v0.6"}
