artifacts/microbenchmark/tvm/autotvm/depthwise/depthwise_128_672_11_11_3_3_1_SAME.log
{"input": ["cuda -keys=cuda,gpu -max_num_threads=1024 -thread_warp_size=32", "depthwise_conv2d_nchw.cuda", [["TENSOR", [128, 672, 11, 11], "float32"], ["TENSOR", [672, 1, 3, 3], "float32"], 1, "SAME", 1, "float32"], {}], "config": {"index": 61055, "code_hash": null, "entity": [["tile_f", "sp", [-1, 6, 16, 1]], ["tile_y", "sp", [-1, 1, 1, 1]], ["tile_x", "sp", [-1, 11, 1, 1]], ["auto_unroll_max_step", "ot", 256], ["unroll_explicit", "ot", 1]]}, "result": [[0.0033952983], 0, 4.779763460159302, 1637729804.8966582], "version": 0.2, "tvm_version": "0.8.dev0"}
{"input": ["cuda -keys=cuda,gpu -max_num_threads=1024 -thread_warp_size=32", "depthwise_conv2d_nchw.cuda", [["TENSOR", [128, 672, 11, 11], "float32"], ["TENSOR", [672, 1, 3, 3], "float32"], 1, "SAME", 1, "float32"], {}], "config": {"index": 46660, "code_hash": null, "entity": [["tile_f", "sp", [-1, 42, 4, 1]], ["tile_y", "sp", [-1, 1, 1, 1]], ["tile_x", "sp", [-1, 11, 1, 1]], ["auto_unroll_max_step", "ot", 0], ["unroll_explicit", "ot", 1]]}, "result": [[0.0259698705], 0, 4.36097264289856, 1637729807.8155804], "version": 0.2, "tvm_version": "0.8.dev0"}
{"input": ["cuda -keys=cuda,gpu -max_num_threads=1024 -thread_warp_size=32", "depthwise_conv2d_nchw.cuda", [["TENSOR", [128, 672, 11, 11], "float32"], ["TENSOR", [672, 1, 3, 3], "float32"], 1, "SAME", 1, "float32"], {}], "config": {"index": 59927, "code_hash": null, "entity": [["tile_f", "sp", [-1, 4, 2, 28]], ["tile_y", "sp", [-1, 1, 11, 1]], ["tile_x", "sp", [-1, 1, 1, 1]], ["auto_unroll_max_step", "ot", 256], ["unroll_explicit", "ot", 1]]}, "result": [[0.008496153833333334], 0, 2.5504019260406494, 1637729809.6467726], "version": 0.2, "tvm_version": "0.8.dev0"}
{"input": ["cuda -keys=cuda,gpu -max_num_threads=1024 -thread_warp_size=32", "depthwise_conv2d_nchw.cuda", [["TENSOR", [128, 672, 11, 11], "float32"], ["TENSOR", [672, 1, 3, 3], "float32"], 1, "SAME", 1, "float32"], {}], "config": {"index": 2732, "code_hash": null, "entity": [["tile_f", "sp", [-1, 1, 3, 1]], ["tile_y", "sp", [-1, 1, 1, 11]], ["tile_x", "sp", [-1, 1, 1, 1]], ["auto_unroll_max_step", "ot", 0], ["unroll_explicit", "ot", 0]]}, "result": [[0.0006032057255639097], 0, 2.9168758392333984, 1637729814.4357197], "version": 0.2, "tvm_version": "0.8.dev0"}
{"input": ["cuda -keys=cuda,gpu -max_num_threads=1024 -thread_warp_size=32", "depthwise_conv2d_nchw.cuda", [["TENSOR", [128, 672, 11, 11], "float32"], ["TENSOR", [672, 1, 3, 3], "float32"], 1, "SAME", 1, "float32"], {}], "config": {"index": 1029, "code_hash": null, "entity": [["tile_f", "sp", [-1, 2, 21, 1]], ["tile_y", "sp", [-1, 11, 1, 1]], ["tile_x", "sp", [-1, 1, 1, 1]], ["auto_unroll_max_step", "ot", 0], ["unroll_explicit", "ot", 0]]}, "result": [[0.0005247686378205128], 0, 1.661123275756836, 1637729816.931207], "version": 0.2, "tvm_version": "0.8.dev0"}
{"input": ["cuda -keys=cuda,gpu -max_num_threads=1024 -thread_warp_size=32", "depthwise_conv2d_nchw.cuda", [["TENSOR", [128, 672, 11, 11], "float32"], ["TENSOR", [672, 1, 3, 3], "float32"], 1, "SAME", 1, "float32"], {}], "config": {"index": 42173, "code_hash": null, "entity": [["tile_f", "sp", [-1, 7, 4, 1]], ["tile_y", "sp", [-1, 1, 1, 11]], ["tile_x", "sp", [-1, 1, 1, 11]], ["auto_unroll_max_step", "ot", 1500], ["unroll_explicit", "ot", 0]]}, "result": [[0.007960745923076924], 0, 15.431607246398926, 1637729825.9816945], "version": 0.2, "tvm_version": "0.8.dev0"}
{"input": ["cuda -keys=cuda,gpu -max_num_threads=1024 -thread_warp_size=32", "depthwise_conv2d_nchw.cuda", [["TENSOR", [128, 672, 11, 11], "float32"], ["TENSOR", [672, 1, 3, 3], "float32"], 1, "SAME", 1, "float32"], {}], "config": {"index": 19787, "code_hash": null, "entity": [["tile_f", "sp", [-1, 7, 6, 1]], ["tile_y", "sp", [-1, 1, 11, 1]], ["tile_x", "sp", [-1, 11, 1, 1]], ["auto_unroll_max_step", "ot", 256], ["unroll_explicit", "ot", 0]]}, "result": [[0.0022989471363636365], 0, 2.5680062770843506, 1637729828.2127724], "version": 0.2, "tvm_version": "0.8.dev0"}
{"input": ["cuda -keys=cuda,gpu -max_num_threads=1024 -thread_warp_size=32", "depthwise_conv2d_nchw.cuda", [["TENSOR", [128, 672, 11, 11], "float32"], ["TENSOR", [672, 1, 3, 3], "float32"], 1, "SAME", 1, "float32"], {}], "config": {"index": 2486, "code_hash": null, "entity": [["tile_f", "sp", [-1, 3, 4, 14]], ["tile_y", "sp", [-1, 1, 11, 1]], ["tile_x", "sp", [-1, 1, 1, 1]], ["auto_unroll_max_step", "ot", 0], ["unroll_explicit", "ot", 0]]}, "result": [[0.003853256666666667], 0, 1.808243751525879, 1637729829.5709562], "version": 0.2, "tvm_version": "0.8.dev0"}
{"input": ["cuda -keys=cuda,gpu -max_num_threads=1024 -thread_warp_size=32", "depthwise_conv2d_nchw.cuda", [["TENSOR", [128, 672, 11, 11], "float32"], ["TENSOR", [672, 1, 3, 3], "float32"], 1, "SAME", 1, "float32"], {}], "config": {"index": 26017, "code_hash": null, "entity": [["tile_f", "sp", [-1, 16, 2, 1]], ["tile_y", "sp", [-1, 11, 1, 1]], ["tile_x", "sp", [-1, 1, 1, 11]], ["auto_unroll_max_step", "ot", 256], ["unroll_explicit", "ot", 0]]}, "result": [[0.024011677333333332], 0, 2.915222406387329, 1637729832.6006887], "version": 0.2, "tvm_version": "0.8.dev0"}
{"input": ["cuda -keys=cuda,gpu -max_num_threads=1024 -thread_warp_size=32", "depthwise_conv2d_nchw.cuda", [["TENSOR", [128, 672, 11, 11], "float32"], ["TENSOR", [672, 1, 3, 3], "float32"], 1, "SAME", 1, "float32"], {}], "config": {"index": 69054, "code_hash": null, "entity": [["tile_f", "sp", [-1, 8, 4, 1]], ["tile_y", "sp", [-1, 11, 1, 1]], ["tile_x", "sp", [-1, 1, 1, 11]], ["auto_unroll_max_step", "ot", 256], ["unroll_explicit", "ot", 1]]}, "result": [[0.01159080788888889], 0, 2.55717396736145, 1637729834.7390976], "version": 0.2, "tvm_version": "0.8.dev0"}
{"input": ["cuda -keys=cuda,gpu -max_num_threads=1024 -thread_warp_size=32", "depthwise_conv2d_nchw.cuda", [["TENSOR", [128, 672, 11, 11], "float32"], ["TENSOR", [672, 1, 3, 3], "float32"], 1, "SAME", 1, "float32"], {}], "config": {"index": 262, "code_hash": null, "entity": [["tile_f", "sp", [-1, 16, 7, 2]], ["tile_y", "sp", [-1, 1, 1, 1]], ["tile_x", "sp", [-1, 1, 1, 1]], ["auto_unroll_max_step", "ot", 0], ["unroll_explicit", "ot", 0]]}, "result": [[0.016740249666666665], 0, 2.845754861831665, 1637729836.7593603], "version": 0.2, "tvm_version": "0.8.dev0"}
{"input": ["cuda -keys=cuda,gpu -max_num_threads=1024 -thread_warp_size=32", "depthwise_conv2d_nchw.cuda", [["TENSOR", [128, 672, 11, 11], "float32"], ["TENSOR", [672, 1, 3, 3], "float32"], 1, "SAME", 1, "float32"], {}], "config": {"index": 53400, "code_hash": null, "entity": [["tile_f", "sp", [-1, 3, 2, 7]], ["tile_y", "sp", [-1, 1, 1, 11]], ["tile_x", "sp", [-1, 1, 11, 1]], ["auto_unroll_max_step", "ot", 0], ["unroll_explicit", "ot", 1]]}, "result": [[0.00193255775], 0, 5.264618635177612, 1637729854.9304435], "version": 0.2, "tvm_version": "0.8.dev0"}
{"input": ["cuda -keys=cuda,gpu -max_num_threads=1024 -thread_warp_size=32", "depthwise_conv2d_nchw.cuda", [["TENSOR", [128, 672, 11, 11], "float32"], ["TENSOR", [672, 1, 3, 3], "float32"], 1, "SAME", 1, "float32"], {}], "config": {"index": 72140, "code_hash": null, "entity": [["tile_f", "sp", [-1, 2, 21, 4]], ["tile_y", "sp", [-1, 1, 1, 1]], ["tile_x", "sp", [-1, 1, 1, 1]], ["auto_unroll_max_step", "ot", 1500], ["unroll_explicit", "ot", 1]]}, "result": [[0.002963799676470588], 0, 2.009789228439331, 1637729857.2484112], "version": 0.2, "tvm_version": "0.8.dev0"}
{"input": ["cuda -keys=cuda,gpu -max_num_threads=1024 -thread_warp_size=32", "depthwise_conv2d_nchw.cuda", [["TENSOR", [128, 672, 11, 11], "float32"], ["TENSOR", [672, 1, 3, 3], "float32"], 1, "SAME", 1, "float32"], {}], "config": {"index": 26047, "code_hash": null, "entity": [["tile_f", "sp", [-1, 12, 4, 1]], ["tile_y", "sp", [-1, 11, 1, 1]], ["tile_x", "sp", [-1, 1, 1, 11]], ["auto_unroll_max_step", "ot", 256], ["unroll_explicit", "ot", 0]]}, "result": [[0.01467318942857143], 0, 3.2596940994262695, 1637729860.1033127], "version": 0.2, "tvm_version": "0.8.dev0"}
{"input": ["cuda -keys=cuda,gpu -max_num_threads=1024 -thread_warp_size=32", "depthwise_conv2d_nchw.cuda", [["TENSOR", [128, 672, 11, 11], "float32"], ["TENSOR", [672, 1, 3, 3], "float32"], 1, "SAME", 1, "float32"], {}], "config": {"index": 58452, "code_hash": null, "entity": [["tile_f", "sp", [-1, 4, 2, 2]], ["tile_y", "sp", [-1, 11, 1, 1]], ["tile_x", "sp", [-1, 1, 1, 1]], ["auto_unroll_max_step", "ot", 256], ["unroll_explicit", "ot", 1]]}, "result": [[0.016157697714285713], 0, 2.516066551208496, 1637729862.258305], "version": 0.2, "tvm_version": "0.8.dev0"}
{"input": ["cuda -keys=cuda,gpu -max_num_threads=1024 -thread_warp_size=32", "depthwise_conv2d_nchw.cuda", [["TENSOR", [128, 672, 11, 11], "float32"], ["TENSOR", [672, 1, 3, 3], "float32"], 1, "SAME", 1, "float32"], {}], "config": {"index": 29208, "code_hash": null, "entity": [["tile_f", "sp", [-1, 3, 2, 7]], ["tile_y", "sp", [-1, 1, 1, 1]], ["tile_x", "sp", [-1, 1, 1, 1]], ["auto_unroll_max_step", "ot", 1500], ["unroll_explicit", "ot", 0]]}, "result": [[0.008474504916666665], 0, 2.6851906776428223, 1637729864.3023493], "version": 0.2, "tvm_version": "0.8.dev0"}
{"input": ["cuda -keys=cuda,gpu -max_num_threads=1024 -thread_warp_size=32", "depthwise_conv2d_nchw.cuda", [["TENSOR", [128, 672, 11, 11], "float32"], ["TENSOR", [672, 1, 3, 3], "float32"], 1, "SAME", 1, "float32"], {}], "config": {"index": 25568, "code_hash": null, "entity": [["tile_f", "sp", [-1, 7, 1, 6]], ["tile_y", "sp", [-1, 1, 1, 1]], ["tile_x", "sp", [-1, 1, 1, 11]], ["auto_unroll_max_step", "ot", 256], ["unroll_explicit", "ot", 0]]}, "result": [[0.029504481], 0, 2.8977301120758057, 1637729867.015089], "version": 0.2, "tvm_version": "0.8.dev0"}
{"input": ["cuda -keys=cuda,gpu -max_num_threads=1024 -thread_warp_size=32", "depthwise_conv2d_nchw.cuda", [["TENSOR", [128, 672, 11, 11], "float32"], ["TENSOR", [672, 1, 3, 3], "float32"], 1, "SAME", 1, "float32"], {}], "config": {"index": 44754, "code_hash": null, "entity": [["tile_f", "sp", [-1, 2, 2, 56]], ["tile_y", "sp", [-1, 11, 1, 1]], ["tile_x", "sp", [-1, 1, 1, 1]], ["auto_unroll_max_step", "ot", 0], ["unroll_explicit", "ot", 1]]}, "result": [[0.0451700165], 0, 2.346494197845459, 1637729868.7023582], "version": 0.2, "tvm_version": "0.8.dev0"}
{"input": ["cuda -keys=cuda,gpu -max_num_threads=1024 -thread_warp_size=32", "depthwise_conv2d_nchw.cuda", [["TENSOR", [128, 672, 11, 11], "float32"], ["TENSOR", [672, 1, 3, 3], "float32"], 1, "SAME", 1, "float32"], {}], "config": {"index": 83915, "code_hash": null, "entity": [["tile_f", "sp", [-1, 3, 1, 8]], ["tile_y", "sp", [-1, 11, 1, 1]], ["tile_x", "sp", [-1, 1, 1, 11]], ["auto_unroll_max_step", "ot", 1500], ["unroll_explicit", "ot", 1]]}, "result": [[0.037496993250000006], 0, 9.30523419380188, 1637729871.3701625], "version": 0.2, "tvm_version": "0.8.dev0"}
{"input": ["cuda -keys=cuda,gpu -max_num_threads=1024 -thread_warp_size=32", "depthwise_conv2d_nchw.cuda", [["TENSOR", [128, 672, 11, 11], "float32"], ["TENSOR", [672, 1, 3, 3], "float32"], 1, "SAME", 1, "float32"], {}], "config": {"index": 74189, "code_hash": null, "entity": [["tile_f", "sp", [-1, 6, 1, 16]], ["tile_y", "sp", [-1, 1, 11, 1]], ["tile_x", "sp", [-1, 1, 1, 1]], ["auto_unroll_max_step", "ot", 1500], ["unroll_explicit", "ot", 1]]}, "result": [[0.0033424169000000003], 0, 6.671604633331299, 1637729874.94011], "version": 0.2, "tvm_version": "0.8.dev0"}
{"input": ["cuda -keys=cuda,gpu -max_num_threads=1024 -thread_warp_size=32", "depthwise_conv2d_nchw.cuda", [["TENSOR", [128, 672, 11, 11], "float32"], ["TENSOR", [672, 1, 3, 3], "float32"], 1, "SAME", 1, "float32"], {}], "config": {"index": 84750, "code_hash": null, "entity": [["tile_f", "sp", [-1, 6, 1, 7]], ["tile_y", "sp", [-1, 1, 11, 1]], ["tile_x", "sp", [-1, 1, 1, 11]], ["auto_unroll_max_step", "ot", 1500], ["unroll_explicit", "ot", 1]]}, "result": [[0.0050217701499999995], 0, 16.125598907470703, 1637729884.448476], "version": 0.2, "tvm_version": "0.8.dev0"}
{"input": ["cuda -keys=cuda,gpu -max_num_threads=1024 -thread_warp_size=32", "depthwise_conv2d_nchw.cuda", [["TENSOR", [128, 672, 11, 11], "float32"], ["TENSOR", [672, 1, 3, 3], "float32"], 1, "SAME", 1, "float32"], {}], "config": {"index": 3247, "code_hash": null, "entity": [["tile_f", "sp", [-1, 2, 6, 7]], ["tile_y", "sp", [-1, 1, 1, 11]], ["tile_x", "sp", [-1, 1, 1, 1]], ["auto_unroll_max_step", "ot", 0], ["unroll_explicit", "ot", 0]]}, "result": [[0.0033526092903225805], 0, 2.4690651893615723, 1637729886.2773225], "version": 0.2, "tvm_version": "0.8.dev0"}
{"input": ["cuda -keys=cuda,gpu -max_num_threads=1024 -thread_warp_size=32", "depthwise_conv2d_nchw.cuda", [["TENSOR", [128, 672, 11, 11], "float32"], ["TENSOR", [672, 1, 3, 3], "float32"], 1, "SAME", 1, "float32"], {}], "config": {"index": 15792, "code_hash": null, "entity": [["tile_f", "sp", [-1, 4, 6, 7]], ["tile_y", "sp", [-1, 11, 1, 1]], ["tile_x", "sp", [-1, 1, 1, 1]], ["auto_unroll_max_step", "ot", 256], ["unroll_explicit", "ot", 0]]}, "result": [[0.008400908846153847], 0, 2.9067490100860596, 1637729894.6691096], "version": 0.2, "tvm_version": "0.8.dev0"}
{"input": ["cuda -keys=cuda,gpu -max_num_threads=1024 -thread_warp_size=32", "depthwise_conv2d_nchw.cuda", [["TENSOR", [128, 672, 11, 11], "float32"], ["TENSOR", [672, 1, 3, 3], "float32"], 1, "SAME", 1, "float32"], {}], "config": {"index": 15226, "code_hash": null, "entity": [["tile_f", "sp", [-1, 3, 1, 224]], ["tile_y", "sp", [-1, 1, 1, 1]], ["tile_x", "sp", [-1, 1, 1, 1]], ["auto_unroll_max_step", "ot", 256], ["unroll_explicit", "ot", 0]]}, "result": [[0.16980185125], 0, 2.592555284500122, 1637729896.8070323], "version": 0.2, "tvm_version": "0.8.dev0"}
{"input": ["cuda -keys=cuda,gpu -max_num_threads=1024 -thread_warp_size=32", "depthwise_conv2d_nchw.cuda", [["TENSOR", [128, 672, 11, 11], "float32"], ["TENSOR", [672, 1, 3, 3], "float32"], 1, "SAME", 1, "float32"], {}], "config": {"index": 52456, "code_hash": null, "entity": [["tile_f", "sp", [-1, 2, 2, 6]], ["tile_y", "sp", [-1, 1, 11, 1]], ["tile_x", "sp", [-1, 1, 11, 1]], ["auto_unroll_max_step", "ot", 0], ["unroll_explicit", "ot", 1]]}, "result": [[0.0002091577394736842], 0, 2.1236462593078613, 1637729898.4612083], "version": 0.2, "tvm_version": "0.8.dev0"}
{"input": ["cuda -keys=cuda,gpu -max_num_threads=1024 -thread_warp_size=32", "depthwise_conv2d_nchw.cuda", [["TENSOR", [128, 672, 11, 11], "float32"], ["TENSOR", [672, 1, 3, 3], "float32"], 1, "SAME", 1, "float32"], {}], "config": {"index": 32690, "code_hash": null, "entity": [["tile_f", "sp", [-1, 7, 6, 4]], ["tile_y", "sp", [-1, 1, 1, 1]], ["tile_x", "sp", [-1, 11, 1, 1]], ["auto_unroll_max_step", "ot", 1500], ["unroll_explicit", "ot", 0]]}, "result": [[0.021714687333333333], 0, 13.07265591621399, 1637729905.8061545], "version": 0.2, "tvm_version": "0.8.dev0"}
{"input": ["cuda -keys=cuda,gpu -max_num_threads=1024 -thread_warp_size=32", "depthwise_conv2d_nchw.cuda", [["TENSOR", [128, 672, 11, 11], "float32"], ["TENSOR", [672, 1, 3, 3], "float32"], 1, "SAME", 1, "float32"], {}], "config": {"index": 57543, "code_hash": null, "entity": [["tile_f", "sp", [-1, 21, 1, 2]], ["tile_y", "sp", [-1, 1, 1, 1]], ["tile_x", "sp", [-1, 1, 1, 1]], ["auto_unroll_max_step", "ot", 256], ["unroll_explicit", "ot", 1]]}, "result": [[0.07155972675], 0, 4.464090585708618, 1637729908.065377], "version": 0.2, "tvm_version": "0.8.dev0"}
{"input": ["cuda -keys=cuda,gpu -max_num_threads=1024 -thread_warp_size=32", "depthwise_conv2d_nchw.cuda", [["TENSOR", [128, 672, 11, 11], "float32"], ["TENSOR", [672, 1, 3, 3], "float32"], 1, "SAME", 1, "float32"], {}], "config": {"index": 16371, "code_hash": null, "entity": [["tile_f", "sp", [-1, 21, 4, 2]], ["tile_y", "sp", [-1, 1, 11, 1]], ["tile_x", "sp", [-1, 1, 1, 1]], ["auto_unroll_max_step", "ot", 256], ["unroll_explicit", "ot", 0]]}, "result": [[0.004969566933333333], 0, 3.518484115600586, 1637729910.0370164], "version": 0.2, "tvm_version": "0.8.dev0"}
{"input": ["cuda -keys=cuda,gpu -max_num_threads=1024 -thread_warp_size=32", "depthwise_conv2d_nchw.cuda", [["TENSOR", [128, 672, 11, 11], "float32"], ["TENSOR", [672, 1, 3, 3], "float32"], 1, "SAME", 1, "float32"], {}], "config": {"index": 20804, "code_hash": null, "entity": [["tile_f", "sp", [-1, 12, 1, 2]], ["tile_y", "sp", [-1, 1, 1, 11]], ["tile_x", "sp", [-1, 11, 1, 1]], ["auto_unroll_max_step", "ot", 256], ["unroll_explicit", "ot", 0]]}, "result": [[0.0483423885], 0, 4.543839693069458, 1637729912.2828553], "version": 0.2, "tvm_version": "0.8.dev0"}
{"input": ["cuda -keys=cuda,gpu -max_num_threads=1024 -thread_warp_size=32", "depthwise_conv2d_nchw.cuda", [["TENSOR", [128, 672, 11, 11], "float32"], ["TENSOR", [672, 1, 3, 3], "float32"], 1, "SAME", 1, "float32"], {}], "config": {"index": 25128, "code_hash": null, "entity": [["tile_f", "sp", [-1, 84, 2, 1]], ["tile_y", "sp", [-1, 1, 1, 1]], ["tile_x", "sp", [-1, 1, 1, 11]], ["auto_unroll_max_step", "ot", 256], ["unroll_explicit", "ot", 0]]}, "result": [[0.032883821], 0, 4.232425212860107, 1637729914.854771], "version": 0.2, "tvm_version": "0.8.dev0"}
{"input": ["cuda -keys=cuda,gpu -max_num_threads=1024 -thread_warp_size=32", "depthwise_conv2d_nchw.cuda", [["TENSOR", [128, 672, 11, 11], "float32"], ["TENSOR", [672, 1, 3, 3], "float32"], 1, "SAME", 1, "float32"], {}], "config": {"index": 721, "code_hash": null, "entity": [["tile_f", "sp", [-1, 42, 1, 16]], ["tile_y", "sp", [-1, 1, 1, 1]], ["tile_x", "sp", [-1, 1, 1, 1]], ["auto_unroll_max_step", "ot", 0], ["unroll_explicit", "ot", 0]]}, "result": [[0.2093967045], 0, 4.242067337036133, 1637729917.58261], "version": 0.2, "tvm_version": "0.8.dev0"}
{"input": ["cuda -keys=cuda,gpu -max_num_threads=1024 -thread_warp_size=32", "depthwise_conv2d_nchw.cuda", [["TENSOR", [128, 672, 11, 11], "float32"], ["TENSOR", [672, 1, 3, 3], "float32"], 1, "SAME", 1, "float32"], {}], "config": {"index": 42359, "code_hash": null, "entity": [["tile_f", "sp", [-1, 1, 6, 2]], ["tile_y", "sp", [-1, 1, 1, 11]], ["tile_x", "sp", [-1, 1, 1, 11]], ["auto_unroll_max_step", "ot", 1500], ["unroll_explicit", "ot", 0]]}, "result": [[0.0029355008285714287], 0, 4.656084060668945, 1637729920.4316769], "version": 0.2, "tvm_version": "0.8.dev0"}
{"input": ["cuda -keys=cuda,gpu -max_num_threads=1024 -thread_warp_size=32", "depthwise_conv2d_nchw.cuda", [["TENSOR", [128, 672, 11, 11], "float32"], ["TENSOR", [672, 1, 3, 3], "float32"], 1, "SAME", 1, "float32"], {}], "config": {"index": 74112, "code_hash": null, "entity": [["tile_f", "sp", [-1, 2, 1, 12]], ["tile_y", "sp", [-1, 1, 11, 1]], ["tile_x", "sp", [-1, 1, 1, 1]], ["auto_unroll_max_step", "ot", 1500], ["unroll_explicit", "ot", 1]]}, "result": [[0.0010516780347222222], 0, 2.2061216831207275, 1637729974.9299805], "version": 0.2, "tvm_version": "0.8.dev0"}
{"input": ["cuda -keys=cuda,gpu -max_num_threads=1024 -thread_warp_size=32", "depthwise_conv2d_nchw.cuda", [["TENSOR", [128, 672, 11, 11], "float32"], ["TENSOR", [672, 1, 3, 3], "float32"], 1, "SAME", 1, "float32"], {}], "config": {"index": 31104, "code_hash": null, "entity": [["tile_f", "sp", [-1, 2, 1, 12]], ["tile_y", "sp", [-1, 1, 11, 1]], ["tile_x", "sp", [-1, 1, 1, 1]], ["auto_unroll_max_step", "ot", 1500], ["unroll_explicit", "ot", 0]]}, "result": [[0.001221551426829268], 0, 1.4912402629852295, 1637729975.9985495], "version": 0.2, "tvm_version": "0.8.dev0"}
{"input": ["cuda -keys=cuda,gpu -max_num_threads=1024 -thread_warp_size=32", "depthwise_conv2d_nchw.cuda", [["TENSOR", [128, 672, 11, 11], "float32"], ["TENSOR", [672, 1, 3, 3], "float32"], 1, "SAME", 1, "float32"], {}], "config": {"index": 59776, "code_hash": null, "entity": [["tile_f", "sp", [-1, 2, 1, 12]], ["tile_y", "sp", [-1, 1, 11, 1]], ["tile_x", "sp", [-1, 1, 1, 1]], ["auto_unroll_max_step", "ot", 256], ["unroll_explicit", "ot", 1]]}, "result": [[0.0010402844639175257], 0, 2.0375406742095947, 1637729977.22382], "version": 0.2, "tvm_version": "0.8.dev0"}
{"input": ["cuda -keys=cuda,gpu -max_num_threads=1024 -thread_warp_size=32", "depthwise_conv2d_nchw.cuda", [["TENSOR", [128, 672, 11, 11], "float32"], ["TENSOR", [672, 1, 3, 3], "float32"], 1, "SAME", 1, "float32"], {}], "config": {"index": 45440, "code_hash": null, "entity": [["tile_f", "sp", [-1, 2, 1, 12]], ["tile_y", "sp", [-1, 1, 11, 1]], ["tile_x", "sp", [-1, 1, 1, 1]], ["auto_unroll_max_step", "ot", 0], ["unroll_explicit", "ot", 1]]}, "result": [[0.0010881067391304347], 0, 1.5074174404144287, 1637729978.2510612], "version": 0.2, "tvm_version": "0.8.dev0"}
{"input": ["cuda -keys=cuda,gpu -max_num_threads=1024 -thread_warp_size=32", "depthwise_conv2d_nchw.cuda", [["TENSOR", [128, 672, 11, 11], "float32"], ["TENSOR", [672, 1, 3, 3], "float32"], 1, "SAME", 1, "float32"], {}], "config": {"index": 16768, "code_hash": null, "entity": [["tile_f", "sp", [-1, 2, 1, 12]], ["tile_y", "sp", [-1, 1, 11, 1]], ["tile_x", "sp", [-1, 1, 1, 1]], ["auto_unroll_max_step", "ot", 256], ["unroll_explicit", "ot", 0]]}, "result": [[0.001220889256097561], 0, 1.3351774215698242, 1637729979.15677], "version": 0.2, "tvm_version": "0.8.dev0"}
{"input": ["cuda -keys=cuda,gpu -max_num_threads=1024 -thread_warp_size=32", "depthwise_conv2d_nchw.cuda", [["TENSOR", [128, 672, 11, 11], "float32"], ["TENSOR", [672, 1, 3, 3], "float32"], 1, "SAME", 1, "float32"], {}], "config": {"index": 2432, "code_hash": null, "entity": [["tile_f", "sp", [-1, 2, 1, 12]], ["tile_y", "sp", [-1, 1, 11, 1]], ["tile_x", "sp", [-1, 1, 1, 1]], ["auto_unroll_max_step", "ot", 0], ["unroll_explicit", "ot", 0]]}, "result": [[0.0010881621630434782], 0, 1.4661593437194824, 1637729980.187007], "version": 0.2, "tvm_version": "0.8.dev0"}
{"input": ["cuda -keys=cuda,gpu -max_num_threads=1024 -thread_warp_size=32", "depthwise_conv2d_nchw.cuda", [["TENSOR", [128, 672, 11, 11], "float32"], ["TENSOR", [672, 1, 3, 3], "float32"], 1, "SAME", 1, "float32"], {}], "config": {"index": 16673, "code_hash": null, "entity": [["tile_f", "sp", [-1, 2, 3, 7]], ["tile_y", "sp", [-1, 1, 11, 1]], ["tile_x", "sp", [-1, 1, 1, 1]], ["auto_unroll_max_step", "ot", 256], ["unroll_explicit", "ot", 0]]}, "result": [[0.0009442794339622643], 0, 1.4314837455749512, 1637729981.2584543], "version": 0.2, "tvm_version": "0.8.dev0"}
{"input": ["cuda -keys=cuda,gpu -max_num_threads=1024 -thread_warp_size=32", "depthwise_conv2d_nchw.cuda", [["TENSOR", [128, 672, 11, 11], "float32"], ["TENSOR", [672, 1, 3, 3], "float32"], 1, "SAME", 1, "float32"], {}], "config": {"index": 2337, "code_hash": null, "entity": [["tile_f", "sp", [-1, 2, 3, 7]], ["tile_y", "sp", [-1, 1, 11, 1]], ["tile_x", "sp", [-1, 1, 1, 1]], ["auto_unroll_max_step", "ot", 0], ["unroll_explicit", "ot", 0]]}, "result": [[0.0007442552407407407], 0, 1.8062210083007812, 1637729982.739716], "version": 0.2, "tvm_version": "0.8.dev0"}
{"input": ["cuda -keys=cuda,gpu -max_num_threads=1024 -thread_warp_size=32", "depthwise_conv2d_nchw.cuda", [["TENSOR", [128, 672, 11, 11], "float32"], ["TENSOR", [672, 1, 3, 3], "float32"], 1, "SAME", 1, "float32"], {}], "config": {"index": 45345, "code_hash": null, "entity": [["tile_f", "sp", [-1, 2, 3, 7]], ["tile_y", "sp", [-1, 1, 11, 1]], ["tile_x", "sp", [-1, 1, 1, 1]], ["auto_unroll_max_step", "ot", 0], ["unroll_explicit", "ot", 1]]}, "result": [[0.0007441270046296297], 0, 1.5321006774902344, 1637729983.8505986], "version": 0.2, "tvm_version": "0.8.dev0"}
{"input": ["cuda -keys=cuda,gpu -max_num_threads=1024 -thread_warp_size=32", "depthwise_conv2d_nchw.cuda", [["TENSOR", [128, 672, 11, 11], "float32"], ["TENSOR", [672, 1, 3, 3], "float32"], 1, "SAME", 1, "float32"], {}], "config": {"index": 59681, "code_hash": null, "entity": [["tile_f", "sp", [-1, 2, 3, 7]], ["tile_y", "sp", [-1, 1, 11, 1]], ["tile_x", "sp", [-1, 1, 1, 1]], ["auto_unroll_max_step", "ot", 256], ["unroll_explicit", "ot", 1]]}, "result": [[0.0008072824193548387], 0, 1.9637446403503418, 1637729985.1014059], "version": 0.2, "tvm_version": "0.8.dev0"}
{"input": ["cuda -keys=cuda,gpu -max_num_threads=1024 -thread_warp_size=32", "depthwise_conv2d_nchw.cuda", [["TENSOR", [128, 672, 11, 11], "float32"], ["TENSOR", [672, 1, 3, 3], "float32"], 1, "SAME", 1, "float32"], {}], "config": {"index": 31009, "code_hash": null, "entity": [["tile_f", "sp", [-1, 2, 3, 7]], ["tile_y", "sp", [-1, 1, 11, 1]], ["tile_x", "sp", [-1, 1, 1, 1]], ["auto_unroll_max_step", "ot", 1500], ["unroll_explicit", "ot", 0]]}, "result": [[0.0009443143396226415], 0, 1.539374828338623, 1637729986.2491293], "version": 0.2, "tvm_version": "0.8.dev0"}
{"input": ["cuda -keys=cuda,gpu -max_num_threads=1024 -thread_warp_size=32", "depthwise_conv2d_nchw.cuda", [["TENSOR", [128, 672, 11, 11], "float32"], ["TENSOR", [672, 1, 3, 3], "float32"], 1, "SAME", 1, "float32"], {}], "config": {"index": 74017, "code_hash": null, "entity": [["tile_f", "sp", [-1, 2, 3, 7]], ["tile_y", "sp", [-1, 1, 11, 1]], ["tile_x", "sp", [-1, 1, 1, 1]], ["auto_unroll_max_step", "ot", 1500], ["unroll_explicit", "ot", 1]]}, "result": [[0.0008071219435483872], 0, 1.6347248554229736, 1637729987.2046728], "version": 0.2, "tvm_version": "0.8.dev0"}
{"input": ["cuda -keys=cuda,gpu -max_num_threads=1024 -thread_warp_size=32", "depthwise_conv2d_nchw.cuda", [["TENSOR", [128, 672, 11, 11], "float32"], ["TENSOR", [672, 1, 3, 3], "float32"], 1, "SAME", 1, "float32"], {}], "config": {"index": 2327, "code_hash": null, "entity": [["tile_f", "sp", [-1, 2, 2, 7]], ["tile_y", "sp", [-1, 1, 11, 1]], ["tile_x", "sp", [-1, 1, 1, 1]], ["auto_unroll_max_step", "ot", 0], ["unroll_explicit", "ot", 0]]}, "result": [[0.0007485671023255813], 0, 1.515352725982666, 1637729988.3772547], "version": 0.2, "tvm_version": "0.8.dev0"}
{"input": ["cuda -keys=cuda,gpu -max_num_threads=1024 -thread_warp_size=32", "depthwise_conv2d_nchw.cuda", [["TENSOR", [128, 672, 11, 11], "float32"], ["TENSOR", [672, 1, 3, 3], "float32"], 1, "SAME", 1, "float32"], {}], "config": {"index": 16663, "code_hash": null, "entity": [["tile_f", "sp", [-1, 2, 2, 7]], ["tile_y", "sp", [-1, 1, 11, 1]], ["tile_x", "sp", [-1, 1, 1, 1]], ["auto_unroll_max_step", "ot", 256], ["unroll_explicit", "ot", 0]]}, "result": [[0.0008210345819672131], 0, 1.4975571632385254, 1637729989.4262836], "version": 0.2, "tvm_version": "0.8.dev0"}
{"input": ["cuda -keys=cuda,gpu -max_num_threads=1024 -thread_warp_size=32", "depthwise_conv2d_nchw.cuda", [["TENSOR", [128, 672, 11, 11], "float32"], ["TENSOR", [672, 1, 3, 3], "float32"], 1, "SAME", 1, "float32"], {}], "config": {"index": 74142, "code_hash": null, "entity": [["tile_f", "sp", [-1, 2, 1, 14]], ["tile_y", "sp", [-1, 1, 11, 1]], ["tile_x", "sp", [-1, 1, 1, 1]], ["auto_unroll_max_step", "ot", 1500], ["unroll_explicit", "ot", 1]]}, "result": [[0.0011539840344827585], 0, 2.1391515731811523, 1637729990.6166945], "version": 0.2, "tvm_version": "0.8.dev0"}
{"input": ["cuda -keys=cuda,gpu -max_num_threads=1024 -thread_warp_size=32", "depthwise_conv2d_nchw.cuda", [["TENSOR", [128, 672, 11, 11], "float32"], ["TENSOR", [672, 1, 3, 3], "float32"], 1, "SAME", 1, "float32"], {}], "config": {"index": 59671, "code_hash": null, "entity": [["tile_f", "sp", [-1, 2, 2, 7]], ["tile_y", "sp", [-1, 1, 11, 1]], ["tile_x", "sp", [-1, 1, 1, 1]], ["auto_unroll_max_step", "ot", 256], ["unroll_explicit", "ot", 1]]}, "result": [[0.0007375038211009174], 0, 1.9222428798675537, 1637729991.8567662], "version": 0.2, "tvm_version": "0.8.dev0"}
{"input": ["cuda -keys=cuda,gpu -max_num_threads=1024 -thread_warp_size=32", "depthwise_conv2d_nchw.cuda", [["TENSOR", [128, 672, 11, 11], "float32"], ["TENSOR", [672, 1, 3, 3], "float32"], 1, "SAME", 1, "float32"], {}], "config": {"index": 45335, "code_hash": null, "entity": [["tile_f", "sp", [-1, 2, 2, 7]], ["tile_y", "sp", [-1, 1, 11, 1]], ["tile_x", "sp", [-1, 1, 1, 1]], ["auto_unroll_max_step", "ot", 0], ["unroll_explicit", "ot", 1]]}, "result": [[0.0007485001119402984], 0, 1.2628483772277832, 1637729992.741007], "version": 0.2, "tvm_version": "0.8.dev0"}
{"input": ["cuda -keys=cuda,gpu -max_num_threads=1024 -thread_warp_size=32", "depthwise_conv2d_nchw.cuda", [["TENSOR", [128, 672, 11, 11], "float32"], ["TENSOR", [672, 1, 3, 3], "float32"], 1, "SAME", 1, "float32"], {}], "config": {"index": 31134, "code_hash": null, "entity": [["tile_f", "sp", [-1, 2, 1, 14]], ["tile_y", "sp", [-1, 1, 11, 1]], ["tile_x", "sp", [-1, 1, 1, 1]], ["auto_unroll_max_step", "ot", 1500], ["unroll_explicit", "ot", 0]]}, "result": [[0.001352615135135135], 0, 1.7949035167694092, 1637729993.969172], "version": 0.2, "tvm_version": "0.8.dev0"}
{"input": ["cuda -keys=cuda,gpu -max_num_threads=1024 -thread_warp_size=32", "depthwise_conv2d_nchw.cuda", [["TENSOR", [128, 672, 11, 11], "float32"], ["TENSOR", [672, 1, 3, 3], "float32"], 1, "SAME", 1, "float32"], {}], "config": {"index": 45470, "code_hash": null, "entity": [["tile_f", "sp", [-1, 2, 1, 14]], ["tile_y", "sp", [-1, 1, 11, 1]], ["tile_x", "sp", [-1, 1, 1, 1]], ["auto_unroll_max_step", "ot", 0], ["unroll_explicit", "ot", 1]]}, "result": [[0.0012303421374045803], 0, 1.7571015357971191, 1637729995.2632284], "version": 0.2, "tvm_version": "0.8.dev0"}
{"input": ["cuda -keys=cuda,gpu -max_num_threads=1024 -thread_warp_size=32", "depthwise_conv2d_nchw.cuda", [["TENSOR", [128, 672, 11, 11], "float32"], ["TENSOR", [672, 1, 3, 3], "float32"], 1, "SAME", 1, "float32"], {}], "config": {"index": 59806, "code_hash": null, "entity": [["tile_f", "sp", [-1, 2, 1, 14]], ["tile_y", "sp", [-1, 1, 11, 1]], ["tile_x", "sp", [-1, 1, 1, 1]], ["auto_unroll_max_step", "ot", 256], ["unroll_explicit", "ot", 1]]}, "result": [[0.008119410923076923], 0, 2.2016892433166504, 1637729996.4246314], "version": 0.2, "tvm_version": "0.8.dev0"}
{"input": ["cuda -keys=cuda,gpu -max_num_threads=1024 -thread_warp_size=32", "depthwise_conv2d_nchw.cuda", [["TENSOR", [128, 672, 11, 11], "float32"], ["TENSOR", [672, 1, 3, 3], "float32"], 1, "SAME", 1, "float32"], {}], "config": {"index": 30999, "code_hash": null, "entity": [["tile_f", "sp", [-1, 2, 2, 7]], ["tile_y", "sp", [-1, 1, 11, 1]], ["tile_x", "sp", [-1, 1, 1, 1]], ["auto_unroll_max_step", "ot", 1500], ["unroll_explicit", "ot", 0]]}, "result": [[0.0008208501639344263], 0, 1.9920945167541504, 1637729998.00944], "version": 0.2, "tvm_version": "0.8.dev0"}
{"input": ["cuda -keys=cuda,gpu -max_num_threads=1024 -thread_warp_size=32", "depthwise_conv2d_nchw.cuda", [["TENSOR", [128, 672, 11, 11], "float32"], ["TENSOR", [672, 1, 3, 3], "float32"], 1, "SAME", 1, "float32"], {}], "config": {"index": 2462, "code_hash": null, "entity": [["tile_f", "sp", [-1, 2, 1, 14]], ["tile_y", "sp", [-1, 1, 11, 1]], ["tile_x", "sp", [-1, 1, 1, 1]], ["auto_unroll_max_step", "ot", 0], ["unroll_explicit", "ot", 0]]}, "result": [[0.0012309084512195122], 0, 1.4619495868682861, 1637729999.0480304], "version": 0.2, "tvm_version": "0.8.dev0"}
{"input": ["cuda -keys=cuda,gpu -max_num_threads=1024 -thread_warp_size=32", "depthwise_conv2d_nchw.cuda", [["TENSOR", [128, 672, 11, 11], "float32"], ["TENSOR", [672, 1, 3, 3], "float32"], 1, "SAME", 1, "float32"], {}], "config": {"index": 16798, "code_hash": null, "entity": [["tile_f", "sp", [-1, 2, 1, 14]], ["tile_y", "sp", [-1, 1, 11, 1]], ["tile_x", "sp", [-1, 1, 1, 1]], ["auto_unroll_max_step", "ot", 256], ["unroll_explicit", "ot", 0]]}, "result": [[0.0013530827027027027], 0, 1.562105417251587, 1637730000.1135564], "version": 0.2, "tvm_version": "0.8.dev0"}
{"input": ["cuda -keys=cuda,gpu -max_num_threads=1024 -thread_warp_size=32", "depthwise_conv2d_nchw.cuda", [["TENSOR", [128, 672, 11, 11], "float32"], ["TENSOR", [672, 1, 3, 3], "float32"], 1, "SAME", 1, "float32"], {}], "config": {"index": 74007, "code_hash": null, "entity": [["tile_f", "sp", [-1, 2, 2, 7]], ["tile_y", "sp", [-1, 1, 11, 1]], ["tile_x", "sp", [-1, 1, 1, 1]], ["auto_unroll_max_step", "ot", 1500], ["unroll_explicit", "ot", 1]]}, "result": [[0.000737728128440367], 0, 1.6379992961883545, 1637730001.146471], "version": 0.2, "tvm_version": "0.8.dev0"}
{"input": ["cuda -keys=cuda,gpu -max_num_threads=1024 -thread_warp_size=32", "depthwise_conv2d_nchw.cuda", [["TENSOR", [128, 672, 11, 11], "float32"], ["TENSOR", [672, 1, 3, 3], "float32"], 1, "SAME", 1, "float32"], {}], "config": {"index": 10066, "code_hash": null, "entity": [["tile_f", "sp", [-1, 2, 2, 2]], ["tile_y", "sp", [-1, 1, 1, 11]], ["tile_x", "sp", [-1, 1, 11, 1]], ["auto_unroll_max_step", "ot", 0], ["unroll_explicit", "ot", 0]]}, "result": [[0.0014318053513513514], 0, 1.5412344932556152, 1637730004.6026163], "version": 0.2, "tvm_version": "0.8.dev0"}
{"input": ["cuda -keys=cuda,gpu -max_num_threads=1024 -thread_warp_size=32", "depthwise_conv2d_nchw.cuda", [["TENSOR", [128, 672, 11, 11], "float32"], ["TENSOR", [672, 1, 3, 3], "float32"], 1, "SAME", 1, "float32"], {}], "config": {"index": 12754, "code_hash": null, "entity": [["tile_f", "sp", [-1, 2, 2, 2]], ["tile_y", "sp", [-1, 1, 11, 1]], ["tile_x", "sp", [-1, 1, 1, 11]], ["auto_unroll_max_step", "ot", 0], ["unroll_explicit", "ot", 0]]}, "result": [[0.00152695], 0, 1.5321309566497803, 1637730005.7036293], "version": 0.2, "tvm_version": "0.8.dev0"}
{"input": ["cuda -keys=cuda,gpu -max_num_threads=1024 -thread_warp_size=32", "depthwise_conv2d_nchw.cuda", [["TENSOR", [128, 672, 11, 11], "float32"], ["TENSOR", [672, 1, 3, 3], "float32"], 1, "SAME", 1, "float32"], {}], "config": {"index": 24402, "code_hash": null, "entity": [["tile_f", "sp", [-1, 2, 2, 2]], ["tile_y", "sp", [-1, 1, 1, 11]], ["tile_x", "sp", [-1, 1, 11, 1]], ["auto_unroll_max_step", "ot", 256], ["unroll_explicit", "ot", 0]]}, "result": [[0.0014228038407079647], 0, 1.6696979999542236, 1637730006.8894699], "version": 0.2, "tvm_version": "0.8.dev0"}
{"input": ["cuda -keys=cuda,gpu -max_num_threads=1024 -thread_warp_size=32", "depthwise_conv2d_nchw.cuda", [["TENSOR", [128, 672, 11, 11], "float32"], ["TENSOR", [672, 1, 3, 3], "float32"], 1, "SAME", 1, "float32"], {}], "config": {"index": 27090, "code_hash": null, "entity": [["tile_f", "sp", [-1, 2, 2, 2]], ["tile_y", "sp", [-1, 1, 11, 1]], ["tile_x", "sp", [-1, 1, 1, 11]], ["auto_unroll_max_step", "ot", 256], ["unroll_explicit", "ot", 0]]}, "result": [[0.0015398116818181819], 0, 1.8730101585388184, 1637730008.2604237], "version": 0.2, "tvm_version": "0.8.dev0"}
{"input": ["cuda -keys=cuda,gpu -max_num_threads=1024 -thread_warp_size=32", "depthwise_conv2d_nchw.cuda", [["TENSOR", [128, 672, 11, 11], "float32"], ["TENSOR", [672, 1, 3, 3], "float32"], 1, "SAME", 1, "float32"], {}], "config": {"index": 74187, "code_hash": null, "entity": [["tile_f", "sp", [-1, 2, 1, 16]], ["tile_y", "sp", [-1, 1, 11, 1]], ["tile_x", "sp", [-1, 1, 1, 1]], ["auto_unroll_max_step", "ot", 1500], ["unroll_explicit", "ot", 1]]}, "result": [[0.001261510653543307], 0, 2.4243109226226807, 1637730009.694177], "version": 0.2, "tvm_version": "0.8.dev0"}
{"input": ["cuda -keys=cuda,gpu -max_num_threads=1024 -thread_warp_size=32", "depthwise_conv2d_nchw.cuda", [["TENSOR", [128, 672, 11, 11], "float32"], ["TENSOR", [672, 1, 3, 3], "float32"], 1, "SAME", 1, "float32"], {}], "config": {"index": 59878, "code_hash": null, "entity": [["tile_f", "sp", [-1, 2, 1, 21]], ["tile_y", "sp", [-1, 1, 11, 1]], ["tile_x", "sp", [-1, 1, 1, 1]], ["auto_unroll_max_step", "ot", 256], ["unroll_explicit", "ot", 1]]}, "result": [[0.008271782923076924], 0, 2.413684129714966, 1637730011.0382178], "version": 0.2, "tvm_version": "0.8.dev0"}
{"input": ["cuda -keys=cuda,gpu -max_num_threads=1024 -thread_warp_size=32", "depthwise_conv2d_nchw.cuda", [["TENSOR", [128, 672, 11, 11], "float32"], ["TENSOR", [672, 1, 3, 3], "float32"], 1, "SAME", 1, "float32"], {}], "config": {"index": 45542, "code_hash": null, "entity": [["tile_f", "sp", [-1, 2, 1, 21]], ["tile_y", "sp", [-1, 1, 11, 1]], ["tile_x", "sp", [-1, 1, 1, 1]], ["auto_unroll_max_step", "ot", 0], ["unroll_explicit", "ot", 1]]}, "result": [[0.007333009857142857], 0, 1.5498452186584473, 1637730012.1447687], "version": 0.2, "tvm_version": "0.8.dev0"}
{"input": ["cuda -keys=cuda,gpu -max_num_threads=1024 -thread_warp_size=32", "depthwise_conv2d_nchw.cuda", [["TENSOR", [128, 672, 11, 11], "float32"], ["TENSOR", [672, 1, 3, 3], "float32"], 1, "SAME", 1, "float32"], {}], "config": {"index": 74214, "code_hash": null, "entity": [["tile_f", "sp", [-1, 2, 1, 21]], ["tile_y", "sp", [-1, 1, 11, 1]], ["tile_x", "sp", [-1, 1, 1, 1]], ["auto_unroll_max_step", "ot", 1500], ["unroll_explicit", "ot", 1]]}, "result": [[0.0015867807029702969], 0, 2.9348533153533936, 1637730013.6377776], "version": 0.2, "tvm_version": "0.8.dev0"}
{"input": ["cuda -keys=cuda,gpu -max_num_threads=1024 -thread_warp_size=32", "depthwise_conv2d_nchw.cuda", [["TENSOR", [128, 672, 11, 11], "float32"], ["TENSOR", [672, 1, 3, 3], "float32"], 1, "SAME", 1, "float32"], {}], "config": {"index": 10082, "code_hash": null, "entity": [["tile_f", "sp", [-1, 2, 3, 2]], ["tile_y", "sp", [-1, 1, 1, 11]], ["tile_x", "sp", [-1, 1, 11, 1]], ["auto_unroll_max_step", "ot", 0], ["unroll_explicit", "ot", 0]]}, "result": [[0.0012684685822784809], 0, 1.655238389968872, 1637730014.777095], "version": 0.2, "tvm_version": "0.8.dev0"}
{"input": ["cuda -keys=cuda,gpu -max_num_threads=1024 -thread_warp_size=32", "depthwise_conv2d_nchw.cuda", [["TENSOR", [128, 672, 11, 11], "float32"], ["TENSOR", [672, 1, 3, 3], "float32"], 1, "SAME", 1, "float32"], {}], "config": {"index": 24418, "code_hash": null, "entity": [["tile_f", "sp", [-1, 2, 3, 2]], ["tile_y", "sp", [-1, 1, 1, 11]], ["tile_x", "sp", [-1, 1, 11, 1]], ["auto_unroll_max_step", "ot", 256], ["unroll_explicit", "ot", 0]]}, "result": [[0.0012732075079365081], 0, 1.7467598915100098, 1637730016.0440266], "version": 0.2, "tvm_version": "0.8.dev0"}
{"input": ["cuda -keys=cuda,gpu -max_num_threads=1024 -thread_warp_size=32", "depthwise_conv2d_nchw.cuda", [["TENSOR", [128, 672, 11, 11], "float32"], ["TENSOR", [672, 1, 3, 3], "float32"], 1, "SAME", 1, "float32"], {}], "config": {"index": 9901, "code_hash": null, "entity": [["tile_f", "sp", [-1, 2, 3, 1]], ["tile_y", "sp", [-1, 1, 1, 11]], ["tile_x", "sp", [-1, 1, 11, 1]], ["auto_unroll_max_step", "ot", 0], ["unroll_explicit", "ot", 0]]}, "result": [[0.00023319865058479535], 0, 1.9757561683654785, 1637730017.6120493], "version": 0.2, "tvm_version": "0.8.dev0"}
{"input": ["cuda -keys=cuda,gpu -max_num_threads=1024 -thread_warp_size=32", "depthwise_conv2d_nchw.cuda", [["TENSOR", [128, 672, 11, 11], "float32"], ["TENSOR", [672, 1, 3, 3], "float32"], 1, "SAME", 1, "float32"], {}], "config": {"index": 24237, "code_hash": null, "entity": [["tile_f", "sp", [-1, 2, 3, 1]], ["tile_y", "sp", [-1, 1, 1, 11]], ["tile_x", "sp", [-1, 1, 11, 1]], ["auto_unroll_max_step", "ot", 256], ["unroll_explicit", "ot", 0]]}, "result": [[0.00024375067075038282], 0, 1.5644254684448242, 1637730018.8627298], "version": 0.2, "tvm_version": "0.8.dev0"}
{"input": ["cuda -keys=cuda,gpu -max_num_threads=1024 -thread_warp_size=32", "depthwise_conv2d_nchw.cuda", [["TENSOR", [128, 672, 11, 11], "float32"], ["TENSOR", [672, 1, 3, 3], "float32"], 1, "SAME", 1, "float32"], {}], "config": {"index": 31179, "code_hash": null, "entity": [["tile_f", "sp", [-1, 2, 1, 16]], ["tile_y", "sp", [-1, 1, 11, 1]], ["tile_x", "sp", [-1, 1, 1, 1]], ["auto_unroll_max_step", "ot", 1500], ["unroll_explicit", "ot", 0]]}, "result": [[0.00157533903125], 0, 2.0410268306732178, 1637730020.2798743], "version": 0.2, "tvm_version": "0.8.dev0"}
{"input": ["cuda -keys=cuda,gpu -max_num_threads=1024 -thread_warp_size=32", "depthwise_conv2d_nchw.cuda", [["TENSOR", [128, 672, 11, 11], "float32"], ["TENSOR", [672, 1, 3, 3], "float32"], 1, "SAME", 1, "float32"], {}], "config": {"index": 45515, "code_hash": null, "entity": [["tile_f", "sp", [-1, 2, 1, 16]], ["tile_y", "sp", [-1, 1, 11, 1]], ["tile_x", "sp", [-1, 1, 1, 1]], ["auto_unroll_max_step", "ot", 0], ["unroll_explicit", "ot", 1]]}, "result": [[0.008106173076923077], 0, 2.033245801925659, 1637730021.6151288], "version": 0.2, "tvm_version": "0.8.dev0"}
{"input": ["cuda -keys=cuda,gpu -max_num_threads=1024 -thread_warp_size=32", "depthwise_conv2d_nchw.cuda", [["TENSOR", [128, 672, 11, 11], "float32"], ["TENSOR", [672, 1, 3, 3], "float32"], 1, "SAME", 1, "float32"], {}], "config": {"index": 59851, "code_hash": null, "entity": [["tile_f", "sp", [-1, 2, 1, 16]], ["tile_y", "sp", [-1, 1, 11, 1]], ["tile_x", "sp", [-1, 1, 1, 1]], ["auto_unroll_max_step", "ot", 256], ["unroll_explicit", "ot", 1]]}, "result": [[0.007986353846153846], 0, 2.3205881118774414, 1637730022.8505547], "version": 0.2, "tvm_version": "0.8.dev0"}
{"input": ["cuda -keys=cuda,gpu -max_num_threads=1024 -thread_warp_size=32", "depthwise_conv2d_nchw.cuda", [["TENSOR", [128, 672, 11, 11], "float32"], ["TENSOR", [672, 1, 3, 3], "float32"], 1, "SAME", 1, "float32"], {}], "config": {"index": 16726, "code_hash": null, "entity": [["tile_f", "sp", [-1, 2, 2, 8]], ["tile_y", "sp", [-1, 1, 11, 1]], ["tile_x", "sp", [-1, 1, 1, 1]], ["auto_unroll_max_step", "ot", 256], ["unroll_explicit", "ot", 0]]}, "result": [[0.0008570292051282051], 0, 1.7431855201721191, 1637730024.1457672], "version": 0.2, "tvm_version": "0.8.dev0"}
{"input": ["cuda -keys=cuda,gpu -max_num_threads=1024 -thread_warp_size=32", "depthwise_conv2d_nchw.cuda", [["TENSOR", [128, 672, 11, 11], "float32"], ["TENSOR", [672, 1, 3, 3], "float32"], 1, "SAME", 1, "float32"], {}], "config": {"index": 2390, "code_hash": null, "entity": [["tile_f", "sp", [-1, 2, 2, 8]], ["tile_y", "sp", [-1, 1, 11, 1]], ["tile_x", "sp", [-1, 1, 1, 1]], ["auto_unroll_max_step", "ot", 0], ["unroll_explicit", "ot", 0]]}, "result": [[0.0008053886300000001], 0, 1.542682409286499, 1637730025.335612], "version": 0.2, "tvm_version": "0.8.dev0"}
{"input": ["cuda -keys=cuda,gpu -max_num_threads=1024 -thread_warp_size=32", "depthwise_conv2d_nchw.cuda", [["TENSOR", [128, 672, 11, 11], "float32"], ["TENSOR", [672, 1, 3, 3], "float32"], 1, "SAME", 1, "float32"], {}], "config": {"index": 2534, "code_hash": null, "entity": [["tile_f", "sp", [-1, 2, 1, 21]], ["tile_y", "sp", [-1, 1, 11, 1]], ["tile_x", "sp", [-1, 1, 1, 1]], ["auto_unroll_max_step", "ot", 0], ["unroll_explicit", "ot", 0]]}, "result": [[0.007319953214285714], 0, 2.089900016784668, 1637730026.9747417], "version": 0.2, "tvm_version": "0.8.dev0"}
{"input": ["cuda -keys=cuda,gpu -max_num_threads=1024 -thread_warp_size=32", "depthwise_conv2d_nchw.cuda", [["TENSOR", [128, 672, 11, 11], "float32"], ["TENSOR", [672, 1, 3, 3], "float32"], 1, "SAME", 1, "float32"], {}], "config": {"index": 16870, "code_hash": null, "entity": [["tile_f", "sp", [-1, 2, 1, 21]], ["tile_y", "sp", [-1, 1, 11, 1]], ["tile_x", "sp", [-1, 1, 1, 1]], ["auto_unroll_max_step", "ot", 256], ["unroll_explicit", "ot", 0]]}, "result": [[0.0075324105], 0, 2.317471504211426, 1637730028.4436834], "version": 0.2, "tvm_version": "0.8.dev0"}
{"input": ["cuda -keys=cuda,gpu -max_num_threads=1024 -thread_warp_size=32", "depthwise_conv2d_nchw.cuda", [["TENSOR", [128, 672, 11, 11], "float32"], ["TENSOR", [672, 1, 3, 3], "float32"], 1, "SAME", 1, "float32"], {}], "config": {"index": 31206, "code_hash": null, "entity": [["tile_f", "sp", [-1, 2, 1, 21]], ["tile_y", "sp", [-1, 1, 11, 1]], ["tile_x", "sp", [-1, 1, 1, 1]], ["auto_unroll_max_step", "ot", 1500], ["unroll_explicit", "ot", 0]]}, "result": [[0.001964819980392157], 0, 2.176313877105713, 1637730029.8616285], "version": 0.2, "tvm_version": "0.8.dev0"}
{"input": ["cuda -keys=cuda,gpu -max_num_threads=1024 -thread_warp_size=32", "depthwise_conv2d_nchw.cuda", [["TENSOR", [128, 672, 11, 11], "float32"], ["TENSOR", [672, 1, 3, 3], "float32"], 1, "SAME", 1, "float32"], {}], "config": {"index": 16734, "code_hash": null, "entity": [["tile_f", "sp", [-1, 2, 3, 8]], ["tile_y", "sp", [-1, 1, 11, 1]], ["tile_x", "sp", [-1, 1, 1, 1]], ["auto_unroll_max_step", "ot", 256], ["unroll_explicit", "ot", 0]]}, "result": [[0.0010616895855263156], 0, 1.8830437660217285, 1637730031.2918231], "version": 0.2, "tvm_version": "0.8.dev0"}
{"input": ["cuda -keys=cuda,gpu -max_num_threads=1024 -thread_warp_size=32", "depthwise_conv2d_nchw.cuda", [["TENSOR", [128, 672, 11, 11], "float32"], ["TENSOR", [672, 1, 3, 3], "float32"], 1, "SAME", 1, "float32"], {}], "config": {"index": 2398, "code_hash": null, "entity": [["tile_f", "sp", [-1, 2, 3, 8]], ["tile_y", "sp", [-1, 1, 11, 1]], ["tile_x", "sp", [-1, 1, 1, 1]], ["auto_unroll_max_step", "ot", 0], ["unroll_explicit", "ot", 0]]}, "result": [[0.0008478383474576272], 0, 1.3559682369232178, 1637730032.3052282], "version": 0.2, "tvm_version": "0.8.dev0"}
{"input": ["cuda -keys=cuda,gpu -max_num_threads=1024 -thread_warp_size=32", "depthwise_conv2d_nchw.cuda", [["TENSOR", [128, 672, 11, 11], "float32"], ["TENSOR", [672, 1, 3, 3], "float32"], 1, "SAME", 1, "float32"], {}], "config": {"index": 16843, "code_hash": null, "entity": [["tile_f", "sp", [-1, 2, 1, 16]], ["tile_y", "sp", [-1, 1, 11, 1]], ["tile_x", "sp", [-1, 1, 1, 1]], ["auto_unroll_max_step", "ot", 256], ["unroll_explicit", "ot", 0]]}, "result": [[0.007826789923076923], 0, 2.225560188293457, 1637730033.6646159], "version": 0.2, "tvm_version": "0.8.dev0"}
{"input": ["cuda -keys=cuda,gpu -max_num_threads=1024 -thread_warp_size=32", "depthwise_conv2d_nchw.cuda", [["TENSOR", [128, 672, 11, 11], "float32"], ["TENSOR", [672, 1, 3, 3], "float32"], 1, "SAME", 1, "float32"], {}], "config": {"index": 2507, "code_hash": null, "entity": [["tile_f", "sp", [-1, 2, 1, 16]], ["tile_y", "sp", [-1, 1, 11, 1]], ["tile_x", "sp", [-1, 1, 1, 1]], ["auto_unroll_max_step", "ot", 0], ["unroll_explicit", "ot", 0]]}, "result": [[0.008097896461538462], 0, 1.6942112445831299, 1637730034.6687045], "version": 0.2, "tvm_version": "0.8.dev0"}
{"input": ["cuda -keys=cuda,gpu -max_num_threads=1024 -thread_warp_size=32", "depthwise_conv2d_nchw.cuda", [["TENSOR", [128, 672, 11, 11], "float32"], ["TENSOR", [672, 1, 3, 3], "float32"], 1, "SAME", 1, "float32"], {}], "config": {"index": 59734, "code_hash": null, "entity": [["tile_f", "sp", [-1, 2, 2, 8]], ["tile_y", "sp", [-1, 1, 11, 1]], ["tile_x", "sp", [-1, 1, 1, 1]], ["auto_unroll_max_step", "ot", 256], ["unroll_explicit", "ot", 1]]}, "result": [[0.0007697810528846155], 0, 2.5228731632232666, 1637730039.5769758], "version": 0.2, "tvm_version": "0.8.dev0"}
{"input": ["cuda -keys=cuda,gpu -max_num_threads=1024 -thread_warp_size=32", "depthwise_conv2d_nchw.cuda", [["TENSOR", [128, 672, 11, 11], "float32"], ["TENSOR", [672, 1, 3, 3], "float32"], 1, "SAME", 1, "float32"], {}], "config": {"index": 45398, "code_hash": null, "entity": [["tile_f", "sp", [-1, 2, 2, 8]], ["tile_y", "sp", [-1, 1, 11, 1]], ["tile_x", "sp", [-1, 1, 1, 1]], ["auto_unroll_max_step", "ot", 0], ["unroll_explicit", "ot", 1]]}, "result": [[0.000805599125], 0, 1.8379218578338623, 1637730040.6730552], "version": 0.2, "tvm_version": "0.8.dev0"}
{"input": ["cuda -keys=cuda,gpu -max_num_threads=1024 -thread_warp_size=32", "depthwise_conv2d_nchw.cuda", [["TENSOR", [128, 672, 11, 11], "float32"], ["TENSOR", [672, 1, 3, 3], "float32"], 1, "SAME", 1, "float32"], {}], "config": {"index": 2328, "code_hash": null, "entity": [["tile_f", "sp", [-1, 3, 2, 7]], ["tile_y", "sp", [-1, 1, 11, 1]], ["tile_x", "sp", [-1, 1, 1, 1]], ["auto_unroll_max_step", "ot", 0], ["unroll_explicit", "ot", 0]]}, "result": [[0.0010331603741935483], 0, 2.2632546424865723, 1637730041.989062], "version": 0.2, "tvm_version": "0.8.dev0"}
{"input": ["cuda -keys=cuda,gpu -max_num_threads=1024 -thread_warp_size=32", "depthwise_conv2d_nchw.cuda", [["TENSOR", [128, 672, 11, 11], "float32"], ["TENSOR", [672, 1, 3, 3], "float32"], 1, "SAME", 1, "float32"], {}], "config": {"index": 16664, "code_hash": null, "entity": [["tile_f", "sp", [-1, 3, 2, 7]], ["tile_y", "sp", [-1, 1, 11, 1]], ["tile_x", "sp", [-1, 1, 1, 1]], ["auto_unroll_max_step", "ot", 256], ["unroll_explicit", "ot", 0]]}, "result": [[0.0011715645766423356], 0, 2.186828374862671, 1637730043.3767788], "version": 0.2, "tvm_version": "0.8.dev0"}
{"input": ["cuda -keys=cuda,gpu -max_num_threads=1024 -thread_warp_size=32", "depthwise_conv2d_nchw.cuda", [["TENSOR", [128, 672, 11, 11], "float32"], ["TENSOR", [672, 1, 3, 3], "float32"], 1, "SAME", 1, "float32"], {}], "config": {"index": 59742, "code_hash": null, "entity": [["tile_f", "sp", [-1, 2, 3, 8]], ["tile_y", "sp", [-1, 1, 11, 1]], ["tile_x", "sp", [-1, 1, 1, 1]], ["auto_unroll_max_step", "ot", 256], ["unroll_explicit", "ot", 1]]}, "result": [[0.0008542831481481481], 0, 2.3662898540496826, 1637730044.7385602], "version": 0.2, "tvm_version": "0.8.dev0"}
{"input": ["cuda -keys=cuda,gpu -max_num_threads=1024 -thread_warp_size=32", "depthwise_conv2d_nchw.cuda", [["TENSOR", [128, 672, 11, 11], "float32"], ["TENSOR", [672, 1, 3, 3], "float32"], 1, "SAME", 1, "float32"], {}], "config": {"index": 45406, "code_hash": null, "entity": [["tile_f", "sp", [-1, 2, 3, 8]], ["tile_y", "sp", [-1, 1, 11, 1]], ["tile_x", "sp", [-1, 1, 1, 1]], ["auto_unroll_max_step", "ot", 0], ["unroll_explicit", "ot", 1]]}, "result": [[0.0008478442881355932], 0, 1.6328649520874023, 1637730045.78149], "version": 0.2, "tvm_version": "0.8.dev0"}
{"input": ["cuda -keys=cuda,gpu -max_num_threads=1024 -thread_warp_size=32", "depthwise_conv2d_nchw.cuda", [["TENSOR", [128, 672, 11, 11], "float32"], ["TENSOR", [672, 1, 3, 3], "float32"], 1, "SAME", 1, "float32"], {}], "config": {"index": 31062, "code_hash": null, "entity": [["tile_f", "sp", [-1, 2, 2, 8]], ["tile_y", "sp", [-1, 1, 11, 1]], ["tile_x", "sp", [-1, 1, 1, 1]], ["auto_unroll_max_step", "ot", 1500], ["unroll_explicit", "ot", 0]]}, "result": [[0.0008564993162393162], 0, 2.2656192779541016, 1637730047.3423712], "version": 0.2, "tvm_version": "0.8.dev0"}
{"input": ["cuda -keys=cuda,gpu -max_num_threads=1024 -thread_warp_size=32", "depthwise_conv2d_nchw.cuda", [["TENSOR", [128, 672, 11, 11], "float32"], ["TENSOR", [672, 1, 3, 3], "float32"], 1, "SAME", 1, "float32"], {}], "config": {"index": 2280, "code_hash": null, "entity": [["tile_f", "sp", [-1, 2, 2, 6]], ["tile_y", "sp", [-1, 1, 11, 1]], ["tile_x", "sp", [-1, 1, 1, 1]], ["auto_unroll_max_step", "ot", 0], ["unroll_explicit", "ot", 0]]}, "result": [[0.0006746243640167363], 0, 1.9551992416381836, 1637730048.691155], "version": 0.2, "tvm_version": "0.8.dev0"}
{"input": ["cuda -keys=cuda,gpu -max_num_threads=1024 -thread_warp_size=32", "depthwise_conv2d_nchw.cuda", [["TENSOR", [128, 672, 11, 11], "float32"], ["TENSOR", [672, 1, 3, 3], "float32"], 1, "SAME", 1, "float32"], {}], "config": {"index": 16616, "code_hash": null, "entity": [["tile_f", "sp", [-1, 2, 2, 6]], ["tile_y", "sp", [-1, 1, 11, 1]], ["tile_x", "sp", [-1, 1, 1, 1]], ["auto_unroll_max_step", "ot", 256], ["unroll_explicit", "ot", 0]]}, "result": [[0.0007311687737226278], 0, 1.5576887130737305, 1637730049.6684542], "version": 0.2, "tvm_version": "0.8.dev0"}
{"input": ["cuda -keys=cuda,gpu -max_num_threads=1024 -thread_warp_size=32", "depthwise_conv2d_nchw.cuda", [["TENSOR", [128, 672, 11, 11], "float32"], ["TENSOR", [672, 1, 3, 3], "float32"], 1, "SAME", 1, "float32"], {}], "config": {"index": 12770, "code_hash": null, "entity": [["tile_f", "sp", [-1, 2, 3, 2]], ["tile_y", "sp", [-1, 1, 11, 1]], ["tile_x", "sp", [-1, 1, 1, 11]], ["auto_unroll_max_step", "ot", 0], ["unroll_explicit", "ot", 0]]}, "result": [[0.0013539097432432434], 0, 2.2291948795318604, 1637730051.0456681], "version": 0.2, "tvm_version": "0.8.dev0"}
{"input": ["cuda -keys=cuda,gpu -max_num_threads=1024 -thread_warp_size=32", "depthwise_conv2d_nchw.cuda", [["TENSOR", [128, 672, 11, 11], "float32"], ["TENSOR", [672, 1, 3, 3], "float32"], 1, "SAME", 1, "float32"], {}], "config": {"index": 27106, "code_hash": null, "entity": [["tile_f", "sp", [-1, 2, 3, 2]], ["tile_y", "sp", [-1, 1, 11, 1]], ["tile_x", "sp", [-1, 1, 1, 11]], ["auto_unroll_max_step", "ot", 256], ["unroll_explicit", "ot", 0]]}, "result": [[0.0013800824137931037], 0, 2.0053465366363525, 1637730052.5075805], "version": 0.2, "tvm_version": "0.8.dev0"}
{"input": ["cuda -keys=cuda,gpu -max_num_threads=1024 -thread_warp_size=32", "depthwise_conv2d_nchw.cuda", [["TENSOR", [128, 672, 11, 11], "float32"], ["TENSOR", [672, 1, 3, 3], "float32"], 1, "SAME", 1, "float32"], {}], "config": {"index": 31070, "code_hash": null, "entity": [["tile_f", "sp", [-1, 2, 3, 8]], ["tile_y", "sp", [-1, 1, 11, 1]], ["tile_x", "sp", [-1, 1, 1, 1]], ["auto_unroll_max_step", "ot", 1500], ["unroll_explicit", "ot", 0]]}, "result": [[0.0010617244605263157], 0, 2.2233211994171143, 1637730053.8642933], "version": 0.2, "tvm_version": "0.8.dev0"}
{"input": ["cuda -keys=cuda,gpu -max_num_threads=1024 -thread_warp_size=32", "depthwise_conv2d_nchw.cuda", [["TENSOR", [128, 672, 11, 11], "float32"], ["TENSOR", [672, 1, 3, 3], "float32"], 1, "SAME", 1, "float32"], {}], "config": {"index": 59672, "code_hash": null, "entity": [["tile_f", "sp", [-1, 3, 2, 7]], ["tile_y", "sp", [-1, 1, 11, 1]], ["tile_x", "sp", [-1, 1, 1, 1]], ["auto_unroll_max_step", "ot", 256], ["unroll_explicit", "ot", 1]]}, "result": [[0.000967567734939759], 0, 2.4600276947021484, 1637730055.0934641], "version": 0.2, "tvm_version": "0.8.dev0"}
{"input": ["cuda -keys=cuda,gpu -max_num_threads=1024 -thread_warp_size=32", "depthwise_conv2d_nchw.cuda", [["TENSOR", [128, 672, 11, 11], "float32"], ["TENSOR", [672, 1, 3, 3], "float32"], 1, "SAME", 1, "float32"], {}], "config": {"index": 17150, "code_hash": null, "entity": [["tile_f", "sp", [-1, 3, 16, 1]], ["tile_y", "sp", [-1, 1, 1, 11]], ["tile_x", "sp", [-1, 1, 1, 1]], ["auto_unroll_max_step", "ot", 256], ["unroll_explicit", "ot", 0]]}, "result": [[0.0014657074909090908], 0, 2.246267318725586, 1637730056.5387626], "version": 0.2, "tvm_version": "0.8.dev0"}
{"input": ["cuda -keys=cuda,gpu -max_num_threads=1024 -thread_warp_size=32", "depthwise_conv2d_nchw.cuda", [["TENSOR", [128, 672, 11, 11], "float32"], ["TENSOR", [672, 1, 3, 3], "float32"], 1, "SAME", 1, "float32"], {}], "config": {"index": 50703, "code_hash": null, "entity": [["tile_f", "sp", [-1, 8, 1, 7]], ["tile_y", "sp", [-1, 1, 1, 1]], ["tile_x", "sp", [-1, 1, 11, 1]], ["auto_unroll_max_step", "ot", 0], ["unroll_explicit", "ot", 1]]}, "result": [[0.0077920296153846155], 0, 2.0926513671875, 1637730057.8191192], "version": 0.2, "tvm_version": "0.8.dev0"}
{"input": ["cuda -keys=cuda,gpu -max_num_threads=1024 -thread_warp_size=32", "depthwise_conv2d_nchw.cuda", [["TENSOR", [128, 672, 11, 11], "float32"], ["TENSOR", [672, 1, 3, 3], "float32"], 1, "SAME", 1, "float32"], {}], "config": {"index": 82681, "code_hash": null, "entity": [["tile_f", "sp", [-1, 4, 6, 2]], ["tile_y", "sp", [-1, 1, 1, 1]], ["tile_x", "sp", [-1, 1, 1, 11]], ["auto_unroll_max_step", "ot", 1500], ["unroll_explicit", "ot", 1]]}, "result": [[0.001321402802631579], 0, 4.223188638687134, 1637730059.416644], "version": 0.2, "tvm_version": "0.8.dev0"}
{"input": ["cuda -keys=cuda,gpu -max_num_threads=1024 -thread_warp_size=32", "depthwise_conv2d_nchw.cuda", [["TENSOR", [128, 672, 11, 11], "float32"], ["TENSOR", [672, 1, 3, 3], "float32"], 1, "SAME", 1, "float32"], {}], "config": {"index": 483, "code_hash": null, "entity": [["tile_f", "sp", [-1, 16, 1, 6]], ["tile_y", "sp", [-1, 1, 1, 1]], ["tile_x", "sp", [-1, 1, 1, 1]], ["auto_unroll_max_step", "ot", 0], ["unroll_explicit", "ot", 0]]}, "result": [[0.08814876575], 0, 6.68684196472168, 1637730065.040259], "version": 0.2, "tvm_version": "0.8.dev0"}
{"input": ["cuda -keys=cuda,gpu -max_num_threads=1024 -thread_warp_size=32", "depthwise_conv2d_nchw.cuda", [["TENSOR", [128, 672, 11, 11], "float32"], ["TENSOR", [672, 1, 3, 3], "float32"], 1, "SAME", 1, "float32"], {}], "config": {"index": 12589, "code_hash": null, "entity": [["tile_f", "sp", [-1, 2, 3, 1]], ["tile_y", "sp", [-1, 1, 11, 1]], ["tile_x", "sp", [-1, 1, 1, 11]], ["auto_unroll_max_step", "ot", 0], ["unroll_explicit", "ot", 0]]}, "result": [[0.00040045175749318804], 0, 1.3185648918151855, 1637730105.4215312], "version": 0.2, "tvm_version": "0.8.dev0"}
{"input": ["cuda -keys=cuda,gpu -max_num_threads=1024 -thread_warp_size=32", "depthwise_conv2d_nchw.cuda", [["TENSOR", [128, 672, 11, 11], "float32"], ["TENSOR", [672, 1, 3, 3], "float32"], 1, "SAME", 1, "float32"], {}], "config": {"index": 38573, "code_hash": null, "entity": [["tile_f", "sp", [-1, 2, 3, 1]], ["tile_y", "sp", [-1, 1, 1, 11]], ["tile_x", "sp", [-1, 1, 11, 1]], ["auto_unroll_max_step", "ot", 1500], ["unroll_explicit", "ot", 0]]}, "result": [[0.00024387736946564884], 0, 1.4002892971038818, 1637730106.56328], "version": 0.2, "tvm_version": "0.8.dev0"}
{"input": ["cuda -keys=cuda,gpu -max_num_threads=1024 -thread_warp_size=32", "depthwise_conv2d_nchw.cuda", [["TENSOR", [128, 672, 11, 11], "float32"], ["TENSOR", [672, 1, 3, 3], "float32"], 1, "SAME", 1, "float32"], {}], "config": {"index": 52909, "code_hash": null, "entity": [["tile_f", "sp", [-1, 2, 3, 1]], ["tile_y", "sp", [-1, 1, 1, 11]], ["tile_x", "sp", [-1, 1, 11, 1]], ["auto_unroll_max_step", "ot", 0], ["unroll_explicit", "ot", 1]]}, "result": [[0.0002332132201166181], 0, 1.3900761604309082, 1637730107.7190273], "version": 0.2, "tvm_version": "0.8.dev0"}
{"input": ["cuda -keys=cuda,gpu -max_num_threads=1024 -thread_warp_size=32", "depthwise_conv2d_nchw.cuda", [["TENSOR", [128, 672, 11, 11], "float32"], ["TENSOR", [672, 1, 3, 3], "float32"], 1, "SAME", 1, "float32"], {}], "config": {"index": 3717, "code_hash": null, "entity": [["tile_f", "sp", [-1, 2, 21, 1]], ["tile_y", "sp", [-1, 1, 1, 1]], ["tile_x", "sp", [-1, 11, 1, 1]], ["auto_unroll_max_step", "ot", 0], ["unroll_explicit", "ot", 0]]}, "result": [[0.0010082828544303798], 0, 1.6127212047576904, 1637730109.015643], "version": 0.2, "tvm_version": "0.8.dev0"}
{"input": ["cuda -keys=cuda,gpu -max_num_threads=1024 -thread_warp_size=32", "depthwise_conv2d_nchw.cuda", [["TENSOR", [128, 672, 11, 11], "float32"], ["TENSOR", [672, 1, 3, 3], "float32"], 1, "SAME", 1, "float32"], {}], "config": {"index": 81581, "code_hash": null, "entity": [["tile_f", "sp", [-1, 2, 3, 1]], ["tile_y", "sp", [-1, 1, 1, 11]], ["tile_x", "sp", [-1, 1, 11, 1]], ["auto_unroll_max_step", "ot", 1500], ["unroll_explicit", "ot", 1]]}, "result": [[0.00022470536440677966], 0, 1.559072494506836, 1637730110.1079743], "version": 0.2, "tvm_version": "0.8.dev0"}
{"input": ["cuda -keys=cuda,gpu -max_num_threads=1024 -thread_warp_size=32", "depthwise_conv2d_nchw.cuda", [["TENSOR", [128, 672, 11, 11], "float32"], ["TENSOR", [672, 1, 3, 3], "float32"], 1, "SAME", 1, "float32"], {}], "config": {"index": 26925, "code_hash": null, "entity": [["tile_f", "sp", [-1, 2, 3, 1]], ["tile_y", "sp", [-1, 1, 11, 1]], ["tile_x", "sp", [-1, 1, 1, 11]], ["auto_unroll_max_step", "ot", 256], ["unroll_explicit", "ot", 0]]}, "result": [[0.0004064680227272727], 0, 1.5996339321136475, 1637730111.4205418], "version": 0.2, "tvm_version": "0.8.dev0"}
{"input": ["cuda -keys=cuda,gpu -max_num_threads=1024 -thread_warp_size=32", "depthwise_conv2d_nchw.cuda", [["TENSOR", [128, 672, 11, 11], "float32"], ["TENSOR", [672, 1, 3, 3], "float32"], 1, "SAME", 1, "float32"], {}], "config": {"index": 55597, "code_hash": null, "entity": [["tile_f", "sp", [-1, 2, 3, 1]], ["tile_y", "sp", [-1, 1, 11, 1]], ["tile_x", "sp", [-1, 1, 1, 11]], ["auto_unroll_max_step", "ot", 0], ["unroll_explicit", "ot", 1]]}, "result": [[0.0004005554812967581], 0, 1.2885665893554688, 1637730112.4300015], "version": 0.2, "tvm_version": "0.8.dev0"}
{"input": ["cuda -keys=cuda,gpu -max_num_threads=1024 -thread_warp_size=32", "depthwise_conv2d_nchw.cuda", [["TENSOR", [128, 672, 11, 11], "float32"], ["TENSOR", [672, 1, 3, 3], "float32"], 1, "SAME", 1, "float32"], {}], "config": {"index": 67245, "code_hash": null, "entity": [["tile_f", "sp", [-1, 2, 3, 1]], ["tile_y", "sp", [-1, 1, 1, 11]], ["tile_x", "sp", [-1, 1, 11, 1]], ["auto_unroll_max_step", "ot", 256], ["unroll_explicit", "ot", 1]]}, "result": [[0.00022479574402250348], 0, 1.5882010459899902, 1637730113.5343022], "version": 0.2, "tvm_version": "0.8.dev0"}
{"input": ["cuda -keys=cuda,gpu -max_num_threads=1024 -thread_warp_size=32", "depthwise_conv2d_nchw.cuda", [["TENSOR", [128, 672, 11, 11], "float32"], ["TENSOR", [672, 1, 3, 3], "float32"], 1, "SAME", 1, "float32"], {}], "config": {"index": 59624, "code_hash": null, "entity": [["tile_f", "sp", [-1, 2, 2, 6]], ["tile_y", "sp", [-1, 1, 11, 1]], ["tile_x", "sp", [-1, 1, 1, 1]], ["auto_unroll_max_step", "ot", 256], ["unroll_explicit", "ot", 1]]}, "result": [[0.0006594538483606558], 0, 1.9863979816436768, 1637730114.9463468], "version": 0.2, "tvm_version": "0.8.dev0"}
{"input": ["cuda -keys=cuda,gpu -max_num_threads=1024 -thread_warp_size=32", "depthwise_conv2d_nchw.cuda", [["TENSOR", [128, 672, 11, 11], "float32"], ["TENSOR", [672, 1, 3, 3], "float32"], 1, "SAME", 1, "float32"], {}], "config": {"index": 41261, "code_hash": null, "entity": [["tile_f", "sp", [-1, 2, 3, 1]], ["tile_y", "sp", [-1, 1, 11, 1]], ["tile_x", "sp", [-1, 1, 1, 11]], ["auto_unroll_max_step", "ot", 1500], ["unroll_explicit", "ot", 0]]}, "result": [[0.00040654565040650406], 0, 1.3581533432006836, 1637730115.9959989], "version": 0.2, "tvm_version": "0.8.dev0"}
{"input": ["cuda -keys=cuda,gpu -max_num_threads=1024 -thread_warp_size=32", "depthwise_conv2d_nchw.cuda", [["TENSOR", [128, 672, 11, 11], "float32"], ["TENSOR", [672, 1, 3, 3], "float32"], 1, "SAME", 1, "float32"], {}], "config": {"index": 45288, "code_hash": null, "entity": [["tile_f", "sp", [-1, 2, 2, 6]], ["tile_y", "sp", [-1, 1, 11, 1]], ["tile_x", "sp", [-1, 1, 1, 1]], ["auto_unroll_max_step", "ot", 0], ["unroll_explicit", "ot", 1]]}, "result": [[0.000674897179916318], 0, 1.5080444812774658, 1637730117.2724445], "version": 0.2, "tvm_version": "0.8.dev0"}
{"input": ["cuda -keys=cuda,gpu -max_num_threads=1024 -thread_warp_size=32", "depthwise_conv2d_nchw.cuda", [["TENSOR", [128, 672, 11, 11], "float32"], ["TENSOR", [672, 1, 3, 3], "float32"], 1, "SAME", 1, "float32"], {}], "config": {"index": 9900, "code_hash": null, "entity": [["tile_f", "sp", [-1, 1, 3, 1]], ["tile_y", "sp", [-1, 1, 1, 11]], ["tile_x", "sp", [-1, 1, 11, 1]], ["auto_unroll_max_step", "ot", 0], ["unroll_explicit", "ot", 0]]}, "result": [[0.0001812348832369942], 0, 1.3982644081115723, 1637730118.4205492], "version": 0.2, "tvm_version": "0.8.dev0"}
{"input": ["cuda -keys=cuda,gpu -max_num_threads=1024 -thread_warp_size=32", "depthwise_conv2d_nchw.cuda", [["TENSOR", [128, 672, 11, 11], "float32"], ["TENSOR", [672, 1, 3, 3], "float32"], 1, "SAME", 1, "float32"], {}], "config": {"index": 59552, "code_hash": null, "entity": [["tile_f", "sp", [-1, 2, 3, 4]], ["tile_y", "sp", [-1, 1, 11, 1]], ["tile_x", "sp", [-1, 1, 1, 1]], ["auto_unroll_max_step", "ot", 256], ["unroll_explicit", "ot", 1]]}, "result": [[0.0005748197126436782], 0, 1.7043051719665527, 1637730119.6469393], "version": 0.2, "tvm_version": "0.8.dev0"}
{"input": ["cuda -keys=cuda,gpu -max_num_threads=1024 -thread_warp_size=32", "depthwise_conv2d_nchw.cuda", [["TENSOR", [128, 672, 11, 11], "float32"], ["TENSOR", [672, 1, 3, 3], "float32"], 1, "SAME", 1, "float32"], {}], "config": {"index": 73960, "code_hash": null, "entity": [["tile_f", "sp", [-1, 2, 2, 6]], ["tile_y", "sp", [-1, 1, 11, 1]], ["tile_x", "sp", [-1, 1, 1, 1]], ["auto_unroll_max_step", "ot", 1500], ["unroll_explicit", "ot", 1]]}, "result": [[0.0006593365352697095], 0, 1.6441013813018799, 1637730120.7350972], "version": 0.2, "tvm_version": "0.8.dev0"}
{"input": ["cuda -keys=cuda,gpu -max_num_threads=1024 -thread_warp_size=32", "depthwise_conv2d_nchw.cuda", [["TENSOR", [128, 672, 11, 11], "float32"], ["TENSOR", [672, 1, 3, 3], "float32"], 1, "SAME", 1, "float32"], {}], "config": {"index": 59483, "code_hash": null, "entity": [["tile_f", "sp", [-1, 2, 4, 3]], ["tile_y", "sp", [-1, 1, 11, 1]], ["tile_x", "sp", [-1, 1, 1, 1]], ["auto_unroll_max_step", "ot", 256], ["unroll_explicit", "ot", 1]]}, "result": [[0.000501176740625], 0, 1.7277145385742188, 1637730122.1055777], "version": 0.2, "tvm_version": "0.8.dev0"}
