artifacts/microbenchmark/tvm/autotvm/depthwise/depthwise_128_42_83_83_3_3_1_SAME.log
{"input": ["cuda -keys=cuda,gpu -max_num_threads=1024 -thread_warp_size=32", "depthwise_conv2d_nchw.cuda", [["TENSOR", [128, 42, 83, 83], "float32"], ["TENSOR", [42, 1, 3, 3], "float32"], 1, "SAME", 1, "float32"], {}], "config": {"index": 211, "code_hash": null, "entity": [["tile_f", "sp", [-1, 2, 7, 1]], ["tile_y", "sp", [-1, 1, 1, 83]], ["tile_x", "sp", [-1, 1, 1, 1]], ["auto_unroll_max_step", "ot", 0], ["unroll_explicit", "ot", 0]]}, "result": [[0.019230125333333334], 0, 2.448343276977539, 1637775714.0725384], "version": 0.2, "tvm_version": "0.8.dev0"}
{"input": ["cuda -keys=cuda,gpu -max_num_threads=1024 -thread_warp_size=32", "depthwise_conv2d_nchw.cuda", [["TENSOR", [128, 42, 83, 83], "float32"], ["TENSOR", [42, 1, 3, 3], "float32"], 1, "SAME", 1, "float32"], {}], "config": {"index": 5936, "code_hash": null, "entity": [["tile_f", "sp", [-1, 1, 1, 7]], ["tile_y", "sp", [-1, 1, 1, 1]], ["tile_x", "sp", [-1, 1, 1, 83]], ["auto_unroll_max_step", "ot", 1500], ["unroll_explicit", "ot", 1]]}, "result": [[0.06716981775000001], 0, 6.026047945022583, 1637775720.2036114], "version": 0.2, "tvm_version": "0.8.dev0"}
{"input": ["cuda -keys=cuda,gpu -max_num_threads=1024 -thread_warp_size=32", "depthwise_conv2d_nchw.cuda", [["TENSOR", [128, 42, 83, 83], "float32"], ["TENSOR", [42, 1, 3, 3], "float32"], 1, "SAME", 1, "float32"], {}], "config": {"index": 3359, "code_hash": null, "entity": [["tile_f", "sp", [-1, 1, 3, 2]], ["tile_y", "sp", [-1, 1, 1, 1]], ["tile_x", "sp", [-1, 83, 1, 1]], ["auto_unroll_max_step", "ot", 0], ["unroll_explicit", "ot", 1]]}, "result": [[0.04162999775], 0, 3.1084845066070557, 1637775722.6705613], "version": 0.2, "tvm_version": "0.8.dev0"}
{"input": ["cuda -keys=cuda,gpu -max_num_threads=1024 -thread_warp_size=32", "depthwise_conv2d_nchw.cuda", [["TENSOR", [128, 42, 83, 83], "float32"], ["TENSOR", [42, 1, 3, 3], "float32"], 1, "SAME", 1, "float32"], {}], "config": {"index": 5647, "code_hash": null, "entity": [["tile_f", "sp", [-1, 14, 3, 1]], ["tile_y", "sp", [-1, 1, 1, 1]], ["tile_x", "sp", [-1, 1, 83, 1]], ["auto_unroll_max_step", "ot", 1500], ["unroll_explicit", "ot", 1]]}, "result": [[0.0017586674210526316], 0, 2.5218863487243652, 1637775725.7843752], "version": 0.2, "tvm_version": "0.8.dev0"}
{"input": ["cuda -keys=cuda,gpu -max_num_threads=1024 -thread_warp_size=32", "depthwise_conv2d_nchw.cuda", [["TENSOR", [128, 42, 83, 83], "float32"], ["TENSOR", [42, 1, 3, 3], "float32"], 1, "SAME", 1, "float32"], {}], "config": {"index": 2335, "code_hash": null, "entity": [["tile_f", "sp", [-1, 1, 3, 2]], ["tile_y", "sp", [-1, 1, 1, 1]], ["tile_x", "sp", [-1, 83, 1, 1]], ["auto_unroll_max_step", "ot", 1500], ["unroll_explicit", "ot", 0]]}, "result": [[0.08188568975], 0, 7.948064088821411, 1637775734.3251338], "version": 0.2, "tvm_version": "0.8.dev0"}
{"input": ["cuda -keys=cuda,gpu -max_num_threads=1024 -thread_warp_size=32", "depthwise_conv2d_nchw.cuda", [["TENSOR", [128, 42, 83, 83], "float32"], ["TENSOR", [42, 1, 3, 3], "float32"], 1, "SAME", 1, "float32"], {}], "config": {"index": 169, "code_hash": null, "entity": [["tile_f", "sp", [-1, 7, 2, 3]], ["tile_y", "sp", [-1, 1, 83, 1]], ["tile_x", "sp", [-1, 1, 1, 1]], ["auto_unroll_max_step", "ot", 0], ["unroll_explicit", "ot", 0]]}, "result": [[0.0034413582000000003], 0, 2.618863344192505, 1637775736.3015375], "version": 0.2, "tvm_version": "0.8.dev0"}
{"input": ["cuda -keys=cuda,gpu -max_num_threads=1024 -thread_warp_size=32", "depthwise_conv2d_nchw.cuda", [["TENSOR", [128, 42, 83, 83], "float32"], ["TENSOR", [42, 1, 3, 3], "float32"], 1, "SAME", 1, "float32"], {}], "config": {"index": 3872, "code_hash": null, "entity": [["tile_f", "sp", [-1, 7, 3, 2]], ["tile_y", "sp", [-1, 1, 1, 1]], ["tile_x", "sp", [-1, 1, 1, 83]], ["auto_unroll_max_step", "ot", 0], ["unroll_explicit", "ot", 1]]}, "result": [[0.06479647], 0, 2.4636523723602295, 1637775742.9660187], "version": 0.2, "tvm_version": "0.8.dev0"}
{"input": ["cuda -keys=cuda,gpu -max_num_threads=1024 -thread_warp_size=32", "depthwise_conv2d_nchw.cuda", [["TENSOR", [128, 42, 83, 83], "float32"], ["TENSOR", [42, 1, 3, 3], "float32"], 1, "SAME", 1, "float32"], {}], "config": {"index": 4187, "code_hash": null, "entity": [["tile_f", "sp", [-1, 1, 1, 2]], ["tile_y", "sp", [-1, 83, 1, 1]], ["tile_x", "sp", [-1, 1, 1, 1]], ["auto_unroll_max_step", "ot", 256], ["unroll_explicit", "ot", 1]]}, "result": [[0.1654918485], 0, 4.013869524002075, 1637775746.3675535], "version": 0.2, "tvm_version": "0.8.dev0"}
{"input": ["cuda -keys=cuda,gpu -max_num_threads=1024 -thread_warp_size=32", "depthwise_conv2d_nchw.cuda", [["TENSOR", [128, 42, 83, 83], "float32"], ["TENSOR", [42, 1, 3, 3], "float32"], 1, "SAME", 1, "float32"], {}], "config": {"index": 1543, "code_hash": null, "entity": [["tile_f", "sp", [-1, 42, 1, 1]], ["tile_y", "sp", [-1, 1, 1, 1]], ["tile_x", "sp", [-1, 1, 83, 1]], ["auto_unroll_max_step", "ot", 256], ["unroll_explicit", "ot", 0]]}, "result": [[0.01184111522222222], 0, 2.7753281593322754, 1637775748.5396152], "version": 0.2, "tvm_version": "0.8.dev0"}
{"input": ["cuda -keys=cuda,gpu -max_num_threads=1024 -thread_warp_size=32", "depthwise_conv2d_nchw.cuda", [["TENSOR", [128, 42, 83, 83], "float32"], ["TENSOR", [42, 1, 3, 3], "float32"], 1, "SAME", 1, "float32"], {}], "config": {"index": 532, "code_hash": null, "entity": [["tile_f", "sp", [-1, 3, 7, 1]], ["tile_y", "sp", [-1, 1, 1, 1]], ["tile_x", "sp", [-1, 1, 83, 1]], ["auto_unroll_max_step", "ot", 0], ["unroll_explicit", "ot", 0]]}, "result": [[0.0009583420833333333], 0, 2.384216785430908, 1637775751.4387097], "version": 0.2, "tvm_version": "0.8.dev0"}
{"input": ["cuda -keys=cuda,gpu -max_num_threads=1024 -thread_warp_size=32", "depthwise_conv2d_nchw.cuda", [["TENSOR", [128, 42, 83, 83], "float32"], ["TENSOR", [42, 1, 3, 3], "float32"], 1, "SAME", 1, "float32"], {}], "config": {"index": 3646, "code_hash": null, "entity": [["tile_f", "sp", [-1, 1, 2, 21]], ["tile_y", "sp", [-1, 1, 1, 1]], ["tile_x", "sp", [-1, 1, 83, 1]], ["auto_unroll_max_step", "ot", 0], ["unroll_explicit", "ot", 1]]}, "result": [[0.0026360880526315788], 0, 2.0527827739715576, 1637775755.4215717], "version": 0.2, "tvm_version": "0.8.dev0"}
{"input": ["cuda -keys=cuda,gpu -max_num_threads=1024 -thread_warp_size=32", "depthwise_conv2d_nchw.cuda", [["TENSOR", [128, 42, 83, 83], "float32"], ["TENSOR", [42, 1, 3, 3], "float32"], 1, "SAME", 1, "float32"], {}], "config": {"index": 246, "code_hash": null, "entity": [["tile_f", "sp", [-1, 1, 3, 7]], ["tile_y", "sp", [-1, 1, 1, 83]], ["tile_x", "sp", [-1, 1, 1, 1]], ["auto_unroll_max_step", "ot", 0], ["unroll_explicit", "ot", 0]]}, "result": [[0.032621540250000004], 0, 2.3812341690063477, 1637775757.5176313], "version": 0.2, "tvm_version": "0.8.dev0"}
{"input": ["cuda -keys=cuda,gpu -max_num_threads=1024 -thread_warp_size=32", "depthwise_conv2d_nchw.cuda", [["TENSOR", [128, 42, 83, 83], "float32"], ["TENSOR", [42, 1, 3, 3], "float32"], 1, "SAME", 1, "float32"], {}], "config": {"index": 4325, "code_hash": null, "entity": [["tile_f", "sp", [-1, 2, 1, 3]], ["tile_y", "sp", [-1, 1, 1, 83]], ["tile_x", "sp", [-1, 1, 1, 1]], ["auto_unroll_max_step", "ot", 256], ["unroll_explicit", "ot", 1]]}, "result": [[0.050849048], 0, 2.4600753784179688, 1637775767.6797628], "version": 0.2, "tvm_version": "0.8.dev0"}
{"input": ["cuda -keys=cuda,gpu -max_num_threads=1024 -thread_warp_size=32", "depthwise_conv2d_nchw.cuda", [["TENSOR", [128, 42, 83, 83], "float32"], ["TENSOR", [42, 1, 3, 3], "float32"], 1, "SAME", 1, "float32"], {}], "config": {"index": 3843, "code_hash": null, "entity": [["tile_f", "sp", [-1, 6, 1, 1]], ["tile_y", "sp", [-1, 1, 1, 1]], ["tile_x", "sp", [-1, 1, 1, 83]], ["auto_unroll_max_step", "ot", 0], ["unroll_explicit", "ot", 1]]}, "result": [[0.06598168125], 0, 2.4825592041015625, 1637775769.879109], "version": 0.2, "tvm_version": "0.8.dev0"}
{"input": ["cuda -keys=cuda,gpu -max_num_threads=1024 -thread_warp_size=32", "depthwise_conv2d_nchw.cuda", [["TENSOR", [128, 42, 83, 83], "float32"], ["TENSOR", [42, 1, 3, 3], "float32"], 1, "SAME", 1, "float32"], {}], "config": {"index": 5203, "code_hash": null, "entity": [["tile_f", "sp", [-1, 2, 7, 1]], ["tile_y", "sp", [-1, 83, 1, 1]], ["tile_x", "sp", [-1, 1, 1, 1]], ["auto_unroll_max_step", "ot", 1500], ["unroll_explicit", "ot", 1]]}, "result": [[0.015491782428571427], 0, 10.4180326461792, 1637775773.0708055], "version": 0.2, "tvm_version": "0.8.dev0"}
{"input": ["cuda -keys=cuda,gpu -max_num_threads=1024 -thread_warp_size=32", "depthwise_conv2d_nchw.cuda", [["TENSOR", [128, 42, 83, 83], "float32"], ["TENSOR", [42, 1, 3, 3], "float32"], 1, "SAME", 1, "float32"], {}], "config": {"index": 1105, "code_hash": null, "entity": [["tile_f", "sp", [-1, 7, 6, 1]], ["tile_y", "sp", [-1, 83, 1, 1]], ["tile_x", "sp", [-1, 1, 1, 1]], ["auto_unroll_max_step", "ot", 256], ["unroll_explicit", "ot", 0]]}, "result": [[0.15436256], 0, 2.840677499771118, 1637775775.6023757], "version": 0.2, "tvm_version": "0.8.dev0"}
{"input": ["cuda -keys=cuda,gpu -max_num_threads=1024 -thread_warp_size=32", "depthwise_conv2d_nchw.cuda", [["TENSOR", [128, 42, 83, 83], "float32"], ["TENSOR", [42, 1, 3, 3], "float32"], 1, "SAME", 1, "float32"], {}], "config": {"index": 529, "code_hash": null, "entity": [["tile_f", "sp", [-1, 7, 6, 1]], ["tile_y", "sp", [-1, 1, 1, 1]], ["tile_x", "sp", [-1, 1, 83, 1]], ["auto_unroll_max_step", "ot", 0], ["unroll_explicit", "ot", 0]]}, "result": [[0.0012960699919354838], 0, 2.242016315460205, 1637775777.6063352], "version": 0.2, "tvm_version": "0.8.dev0"}
{"input": ["cuda -keys=cuda,gpu -max_num_threads=1024 -thread_warp_size=32", "depthwise_conv2d_nchw.cuda", [["TENSOR", [128, 42, 83, 83], "float32"], ["TENSOR", [42, 1, 3, 3], "float32"], 1, "SAME", 1, "float32"], {}], "config": {"index": 1111, "code_hash": null, "entity": [["tile_f", "sp", [-1, 3, 14, 1]], ["tile_y", "sp", [-1, 83, 1, 1]], ["tile_x", "sp", [-1, 1, 1, 1]], ["auto_unroll_max_step", "ot", 256], ["unroll_explicit", "ot", 0]]}, "result": [[0.04248221975], 0, 2.9545505046844482, 1637775779.710557], "version": 0.2, "tvm_version": "0.8.dev0"}
{"input": ["cuda -keys=cuda,gpu -max_num_threads=1024 -thread_warp_size=32", "depthwise_conv2d_nchw.cuda", [["TENSOR", [128, 42, 83, 83], "float32"], ["TENSOR", [42, 1, 3, 3], "float32"], 1, "SAME", 1, "float32"], {}], "config": {"index": 3086, "code_hash": null, "entity": [["tile_f", "sp", [-1, 7, 3, 1]], ["tile_y", "sp", [-1, 1, 1, 1]], ["tile_x", "sp", [-1, 1, 1, 1]], ["auto_unroll_max_step", "ot", 0], ["unroll_explicit", "ot", 1]]}, "result": [[0.007339390142857143], 0, 2.0353946685791016, 1637775781.5158505], "version": 0.2, "tvm_version": "0.8.dev0"}
{"input": ["cuda -keys=cuda,gpu -max_num_threads=1024 -thread_warp_size=32", "depthwise_conv2d_nchw.cuda", [["TENSOR", [128, 42, 83, 83], "float32"], ["TENSOR", [42, 1, 3, 3], "float32"], 1, "SAME", 1, "float32"], {}], "config": {"index": 1545, "code_hash": null, "entity": [["tile_f", "sp", [-1, 3, 2, 1]], ["tile_y", "sp", [-1, 1, 1, 1]], ["tile_x", "sp", [-1, 1, 83, 1]], ["auto_unroll_max_step", "ot", 256], ["unroll_explicit", "ot", 0]]}, "result": [[0.0008941941607142857], 0, 2.2291476726531982, 1637775783.54896], "version": 0.2, "tvm_version": "0.8.dev0"}
{"input": ["cuda -keys=cuda,gpu -max_num_threads=1024 -thread_warp_size=32", "depthwise_conv2d_nchw.cuda", [["TENSOR", [128, 42, 83, 83], "float32"], ["TENSOR", [42, 1, 3, 3], "float32"], 1, "SAME", 1, "float32"], {}], "config": {"index": 1586, "code_hash": null, "entity": [["tile_f", "sp", [-1, 3, 1, 7]], ["tile_y", "sp", [-1, 1, 1, 1]], ["tile_x", "sp", [-1, 1, 83, 1]], ["auto_unroll_max_step", "ot", 256], ["unroll_explicit", "ot", 0]]}, "result": [[0.0023308382093023255], 0, 2.278042793273926, 1637775785.4640665], "version": 0.2, "tvm_version": "0.8.dev0"}
{"input": ["cuda -keys=cuda,gpu -max_num_threads=1024 -thread_warp_size=32", "depthwise_conv2d_nchw.cuda", [["TENSOR", [128, 42, 83, 83], "float32"], ["TENSOR", [42, 1, 3, 3], "float32"], 1, "SAME", 1, "float32"], {}], "config": {"index": 518, "code_hash": null, "entity": [["tile_f", "sp", [-1, 21, 1, 1]], ["tile_y", "sp", [-1, 1, 1, 1]], ["tile_x", "sp", [-1, 1, 83, 1]], ["auto_unroll_max_step", "ot", 0], ["unroll_explicit", "ot", 0]]}, "result": [[0.0024621639024390244], 0, 2.8948328495025635, 1637775808.063749], "version": 0.2, "tvm_version": "0.8.dev0"}
{"input": ["cuda -keys=cuda,gpu -max_num_threads=1024 -thread_warp_size=32", "depthwise_conv2d_nchw.cuda", [["TENSOR", [128, 42, 83, 83], "float32"], ["TENSOR", [42, 1, 3, 3], "float32"], 1, "SAME", 1, "float32"], {}], "config": {"index": 3590, "code_hash": null, "entity": [["tile_f", "sp", [-1, 21, 1, 1]], ["tile_y", "sp", [-1, 1, 1, 1]], ["tile_x", "sp", [-1, 1, 83, 1]], ["auto_unroll_max_step", "ot", 0], ["unroll_explicit", "ot", 1]]}, "result": [[0.0023186314772727272], 0, 3.0364561080932617, 1637775809.9543855], "version": 0.2, "tvm_version": "0.8.dev0"}
{"input": ["cuda -keys=cuda,gpu -max_num_threads=1024 -thread_warp_size=32", "depthwise_conv2d_nchw.cuda", [["TENSOR", [128, 42, 83, 83], "float32"], ["TENSOR", [42, 1, 3, 3], "float32"], 1, "SAME", 1, "float32"], {}], "config": {"index": 526, "code_hash": null, "entity": [["tile_f", "sp", [-1, 7, 3, 1]], ["tile_y", "sp", [-1, 1, 1, 1]], ["tile_x", "sp", [-1, 1, 83, 1]], ["auto_unroll_max_step", "ot", 0], ["unroll_explicit", "ot", 0]]}, "result": [[0.001326616435114504], 0, 3.347684383392334, 1637775812.3407655], "version": 0.2, "tvm_version": "0.8.dev0"}
{"input": ["cuda -keys=cuda,gpu -max_num_threads=1024 -thread_warp_size=32", "depthwise_conv2d_nchw.cuda", [["TENSOR", [128, 42, 83, 83], "float32"], ["TENSOR", [42, 1, 3, 3], "float32"], 1, "SAME", 1, "float32"], {}], "config": {"index": 550, "code_hash": null, "entity": [["tile_f", "sp", [-1, 7, 1, 3]], ["tile_y", "sp", [-1, 1, 1, 1]], ["tile_x", "sp", [-1, 1, 83, 1]], ["auto_unroll_max_step", "ot", 0], ["unroll_explicit", "ot", 0]]}, "result": [[0.0022940050227272728], 0, 3.9425199031829834, 1637775815.1079018], "version": 0.2, "tvm_version": "0.8.dev0"}
{"input": ["cuda -keys=cuda,gpu -max_num_threads=1024 -thread_warp_size=32", "depthwise_conv2d_nchw.cuda", [["TENSOR", [128, 42, 83, 83], "float32"], ["TENSOR", [42, 1, 3, 3], "float32"], 1, "SAME", 1, "float32"], {}], "config": {"index": 562, "code_hash": null, "entity": [["tile_f", "sp", [-1, 3, 1, 7]], ["tile_y", "sp", [-1, 1, 1, 1]], ["tile_x", "sp", [-1, 1, 83, 1]], ["auto_unroll_max_step", "ot", 0], ["unroll_explicit", "ot", 0]]}, "result": [[0.0022948027045454544], 0, 3.8867013454437256, 1637775817.943825], "version": 0.2, "tvm_version": "0.8.dev0"}
{"input": ["cuda -keys=cuda,gpu -max_num_threads=1024 -thread_warp_size=32", "depthwise_conv2d_nchw.cuda", [["TENSOR", [128, 42, 83, 83], "float32"], ["TENSOR", [42, 1, 3, 3], "float32"], 1, "SAME", 1, "float32"], {}], "config": {"index": 3604, "code_hash": null, "entity": [["tile_f", "sp", [-1, 3, 7, 1]], ["tile_y", "sp", [-1, 1, 1, 1]], ["tile_x", "sp", [-1, 1, 83, 1]], ["auto_unroll_max_step", "ot", 0], ["unroll_explicit", "ot", 1]]}, "result": [[0.0009580936285714286], 0, 2.360185146331787, 1637775819.5968523], "version": 0.2, "tvm_version": "0.8.dev0"}
{"input": ["cuda -keys=cuda,gpu -max_num_threads=1024 -thread_warp_size=32", "depthwise_conv2d_nchw.cuda", [["TENSOR", [128, 42, 83, 83], "float32"], ["TENSOR", [42, 1, 3, 3], "float32"], 1, "SAME", 1, "float32"], {}], "config": {"index": 3598, "code_hash": null, "entity": [["tile_f", "sp", [-1, 7, 3, 1]], ["tile_y", "sp", [-1, 1, 1, 1]], ["tile_x", "sp", [-1, 1, 83, 1]], ["auto_unroll_max_step", "ot", 0], ["unroll_explicit", "ot", 1]]}, "result": [[0.001232677503816794], 0, 2.4305639266967773, 1637775821.2503781], "version": 0.2, "tvm_version": "0.8.dev0"}
{"input": ["cuda -keys=cuda,gpu -max_num_threads=1024 -thread_warp_size=32", "depthwise_conv2d_nchw.cuda", [["TENSOR", [128, 42, 83, 83], "float32"], ["TENSOR", [42, 1, 3, 3], "float32"], 1, "SAME", 1, "float32"], {}], "config": {"index": 3634, "code_hash": null, "entity": [["tile_f", "sp", [-1, 3, 1, 7]], ["tile_y", "sp", [-1, 1, 1, 1]], ["tile_x", "sp", [-1, 1, 83, 1]], ["auto_unroll_max_step", "ot", 0], ["unroll_explicit", "ot", 1]]}, "result": [[0.0022935663863636363], 0, 2.6872024536132812, 1637775822.828015], "version": 0.2, "tvm_version": "0.8.dev0"}
{"input": ["cuda -keys=cuda,gpu -max_num_threads=1024 -thread_warp_size=32", "depthwise_conv2d_nchw.cuda", [["TENSOR", [128, 42, 83, 83], "float32"], ["TENSOR", [42, 1, 3, 3], "float32"], 1, "SAME", 1, "float32"], {}], "config": {"index": 3622, "code_hash": null, "entity": [["tile_f", "sp", [-1, 7, 1, 3]], ["tile_y", "sp", [-1, 1, 1, 1]], ["tile_x", "sp", [-1, 1, 83, 1]], ["auto_unroll_max_step", "ot", 0], ["unroll_explicit", "ot", 1]]}, "result": [[0.0022934391136363638], 0, 2.676060914993286, 1637775824.4539585], "version": 0.2, "tvm_version": "0.8.dev0"}
{"input": ["cuda -keys=cuda,gpu -max_num_threads=1024 -thread_warp_size=32", "depthwise_conv2d_nchw.cuda", [["TENSOR", [128, 42, 83, 83], "float32"], ["TENSOR", [42, 1, 3, 3], "float32"], 1, "SAME", 1, "float32"], {}], "config": {"index": 1542, "code_hash": null, "entity": [["tile_f", "sp", [-1, 21, 1, 1]], ["tile_y", "sp", [-1, 1, 1, 1]], ["tile_x", "sp", [-1, 1, 83, 1]], ["auto_unroll_max_step", "ot", 256], ["unroll_explicit", "ot", 0]]}, "result": [[0.0023195905454545455], 0, 2.7523744106292725, 1637775826.2631803], "version": 0.2, "tvm_version": "0.8.dev0"}
{"input": ["cuda -keys=cuda,gpu -max_num_threads=1024 -thread_warp_size=32", "depthwise_conv2d_nchw.cuda", [["TENSOR", [128, 42, 83, 83], "float32"], ["TENSOR", [42, 1, 3, 3], "float32"], 1, "SAME", 1, "float32"], {}], "config": {"index": 523, "code_hash": null, "entity": [["tile_f", "sp", [-1, 21, 2, 1]], ["tile_y", "sp", [-1, 1, 1, 1]], ["tile_x", "sp", [-1, 1, 83, 1]], ["auto_unroll_max_step", "ot", 0], ["unroll_explicit", "ot", 0]]}, "result": [[0.002460883463414634], 0, 3.1106326580047607, 1637775828.1496706], "version": 0.2, "tvm_version": "0.8.dev0"}
{"input": ["cuda -keys=cuda,gpu -max_num_threads=1024 -thread_warp_size=32", "depthwise_conv2d_nchw.cuda", [["TENSOR", [128, 42, 83, 83], "float32"], ["TENSOR", [42, 1, 3, 3], "float32"], 1, "SAME", 1, "float32"], {}], "config": {"index": 19, "code_hash": null, "entity": [["tile_f", "sp", [-1, 2, 7, 1]], ["tile_y", "sp", [-1, 1, 1, 1]], ["tile_x", "sp", [-1, 1, 1, 1]], ["auto_unroll_max_step", "ot", 0], ["unroll_explicit", "ot", 0]]}, "result": [[0.008880128166666666], 0, 2.7480974197387695, 1637775829.8740861], "version": 0.2, "tvm_version": "0.8.dev0"}
{"input": ["cuda -keys=cuda,gpu -max_num_threads=1024 -thread_warp_size=32", "depthwise_conv2d_nchw.cuda", [["TENSOR", [128, 42, 83, 83], "float32"], ["TENSOR", [42, 1, 3, 3], "float32"], 1, "SAME", 1, "float32"], {}], "config": {"index": 531, "code_hash": null, "entity": [["tile_f", "sp", [-1, 2, 7, 1]], ["tile_y", "sp", [-1, 1, 1, 1]], ["tile_x", "sp", [-1, 1, 83, 1]], ["auto_unroll_max_step", "ot", 0], ["unroll_explicit", "ot", 0]]}, "result": [[0.0009746091067961165], 0, 2.6734180450439453, 1637775831.6386287], "version": 0.2, "tvm_version": "0.8.dev0"}
{"input": ["cuda -keys=cuda,gpu -max_num_threads=1024 -thread_warp_size=32", "depthwise_conv2d_nchw.cuda", [["TENSOR", [128, 42, 83, 83], "float32"], ["TENSOR", [42, 1, 3, 3], "float32"], 1, "SAME", 1, "float32"], {}], "config": {"index": 1574, "code_hash": null, "entity": [["tile_f", "sp", [-1, 7, 1, 3]], ["tile_y", "sp", [-1, 1, 1, 1]], ["tile_x", "sp", [-1, 1, 83, 1]], ["auto_unroll_max_step", "ot", 256], ["unroll_explicit", "ot", 0]]}, "result": [[0.0023305266046511628], 0, 3.221419095993042, 1637775833.6906085], "version": 0.2, "tvm_version": "0.8.dev0"}
{"input": ["cuda -keys=cuda,gpu -max_num_threads=1024 -thread_warp_size=32", "depthwise_conv2d_nchw.cuda", [["TENSOR", [128, 42, 83, 83], "float32"], ["TENSOR", [42, 1, 3, 3], "float32"], 1, "SAME", 1, "float32"], {}], "config": {"index": 517, "code_hash": null, "entity": [["tile_f", "sp", [-1, 14, 1, 1]], ["tile_y", "sp", [-1, 1, 1, 1]], ["tile_x", "sp", [-1, 1, 83, 1]], ["auto_unroll_max_step", "ot", 0], ["unroll_explicit", "ot", 0]]}, "result": [[0.0016870485166666667], 0, 2.7787787914276123, 1637775835.4617746], "version": 0.2, "tvm_version": "0.8.dev0"}
{"input": ["cuda -keys=cuda,gpu -max_num_threads=1024 -thread_warp_size=32", "depthwise_conv2d_nchw.cuda", [["TENSOR", [128, 42, 83, 83], "float32"], ["TENSOR", [42, 1, 3, 3], "float32"], 1, "SAME", 1, "float32"], {}], "config": {"index": 3595, "code_hash": null, "entity": [["tile_f", "sp", [-1, 21, 2, 1]], ["tile_y", "sp", [-1, 1, 1, 1]], ["tile_x", "sp", [-1, 1, 83, 1]], ["auto_unroll_max_step", "ot", 0], ["unroll_explicit", "ot", 1]]}, "result": [[0.002461820024390244], 0, 2.7721734046936035, 1637775837.10836], "version": 0.2, "tvm_version": "0.8.dev0"}
{"input": ["cuda -keys=cuda,gpu -max_num_threads=1024 -thread_warp_size=32", "depthwise_conv2d_nchw.cuda", [["TENSOR", [128, 42, 83, 83], "float32"], ["TENSOR", [42, 1, 3, 3], "float32"], 1, "SAME", 1, "float32"], {}], "config": {"index": 2566, "code_hash": null, "entity": [["tile_f", "sp", [-1, 21, 1, 1]], ["tile_y", "sp", [-1, 1, 1, 1]], ["tile_x", "sp", [-1, 1, 83, 1]], ["auto_unroll_max_step", "ot", 1500], ["unroll_explicit", "ot", 0]]}, "result": [[0.002319426909090909], 0, 2.8933820724487305, 1637775838.9432905], "version": 0.2, "tvm_version": "0.8.dev0"}
{"input": ["cuda -keys=cuda,gpu -max_num_threads=1024 -thread_warp_size=32", "depthwise_conv2d_nchw.cuda", [["TENSOR", [128, 42, 83, 83], "float32"], ["TENSOR", [42, 1, 3, 3], "float32"], 1, "SAME", 1, "float32"], {}], "config": {"index": 20, "code_hash": null, "entity": [["tile_f", "sp", [-1, 3, 7, 1]], ["tile_y", "sp", [-1, 1, 1, 1]], ["tile_x", "sp", [-1, 1, 1, 1]], ["auto_unroll_max_step", "ot", 0], ["unroll_explicit", "ot", 0]]}, "result": [[0.008491707416666666], 0, 2.6507985591888428, 1637775840.6113608], "version": 0.2, "tvm_version": "0.8.dev0"}
{"input": ["cuda -keys=cuda,gpu -max_num_threads=1024 -thread_warp_size=32", "depthwise_conv2d_nchw.cuda", [["TENSOR", [128, 42, 83, 83], "float32"], ["TENSOR", [42, 1, 3, 3], "float32"], 1, "SAME", 1, "float32"], {}], "config": {"index": 4614, "code_hash": null, "entity": [["tile_f", "sp", [-1, 21, 1, 1]], ["tile_y", "sp", [-1, 1, 1, 1]], ["tile_x", "sp", [-1, 1, 83, 1]], ["auto_unroll_max_step", "ot", 256], ["unroll_explicit", "ot", 1]]}, "result": [[0.002130722255319149], 0, 2.96000599861145, 1637775842.3608112], "version": 0.2, "tvm_version": "0.8.dev0"}
{"input": ["cuda -keys=cuda,gpu -max_num_threads=1024 -thread_warp_size=32", "depthwise_conv2d_nchw.cuda", [["TENSOR", [128, 42, 83, 83], "float32"], ["TENSOR", [42, 1, 3, 3], "float32"], 1, "SAME", 1, "float32"], {}], "config": {"index": 522, "code_hash": null, "entity": [["tile_f", "sp", [-1, 7, 2, 1]], ["tile_y", "sp", [-1, 1, 1, 1]], ["tile_x", "sp", [-1, 1, 83, 1]], ["auto_unroll_max_step", "ot", 0], ["unroll_explicit", "ot", 0]]}, "result": [[0.0011708189302325582], 0, 2.5085175037384033, 1637775844.0970075], "version": 0.2, "tvm_version": "0.8.dev0"}
{"input": ["cuda -keys=cuda,gpu -max_num_threads=1024 -thread_warp_size=32", "depthwise_conv2d_nchw.cuda", [["TENSOR", [128, 42, 83, 83], "float32"], ["TENSOR", [42, 1, 3, 3], "float32"], 1, "SAME", 1, "float32"], {}], "config": {"index": 3091, "code_hash": null, "entity": [["tile_f", "sp", [-1, 2, 7, 1]], ["tile_y", "sp", [-1, 1, 1, 1]], ["tile_x", "sp", [-1, 1, 1, 1]], ["auto_unroll_max_step", "ot", 0], ["unroll_explicit", "ot", 1]]}, "result": [[0.0088785615], 0, 2.156977891921997, 1637775845.6867108], "version": 0.2, "tvm_version": "0.8.dev0"}
{"input": ["cuda -keys=cuda,gpu -max_num_threads=1024 -thread_warp_size=32", "depthwise_conv2d_nchw.cuda", [["TENSOR", [128, 42, 83, 83], "float32"], ["TENSOR", [42, 1, 3, 3], "float32"], 1, "SAME", 1, "float32"], {}], "config": {"index": 1043, "code_hash": null, "entity": [["tile_f", "sp", [-1, 2, 7, 1]], ["tile_y", "sp", [-1, 1, 1, 1]], ["tile_x", "sp", [-1, 1, 1, 1]], ["auto_unroll_max_step", "ot", 256], ["unroll_explicit", "ot", 0]]}, "result": [[0.008991391166666666], 0, 2.8442721366882324, 1637775847.4925575], "version": 0.2, "tvm_version": "0.8.dev0"}
{"input": ["cuda -keys=cuda,gpu -max_num_threads=1024 -thread_warp_size=32", "depthwise_conv2d_nchw.cuda", [["TENSOR", [128, 42, 83, 83], "float32"], ["TENSOR", [42, 1, 3, 3], "float32"], 1, "SAME", 1, "float32"], {}], "config": {"index": 1556, "code_hash": null, "entity": [["tile_f", "sp", [-1, 3, 7, 1]], ["tile_y", "sp", [-1, 1, 1, 1]], ["tile_x", "sp", [-1, 1, 83, 1]], ["auto_unroll_max_step", "ot", 256], ["unroll_explicit", "ot", 0]]}, "result": [[0.0009582155333333332], 0, 2.490349054336548, 1637775848.9865549], "version": 0.2, "tvm_version": "0.8.dev0"}
{"input": ["cuda -keys=cuda,gpu -max_num_threads=1024 -thread_warp_size=32", "depthwise_conv2d_nchw.cuda", [["TENSOR", [128, 42, 83, 83], "float32"], ["TENSOR", [42, 1, 3, 3], "float32"], 1, "SAME", 1, "float32"], {}], "config": {"index": 1550, "code_hash": null, "entity": [["tile_f", "sp", [-1, 7, 3, 1]], ["tile_y", "sp", [-1, 1, 1, 1]], ["tile_x", "sp", [-1, 1, 83, 1]], ["auto_unroll_max_step", "ot", 256], ["unroll_explicit", "ot", 0]]}, "result": [[0.001223490743902439], 0, 2.691847324371338, 1637775850.6264539], "version": 0.2, "tvm_version": "0.8.dev0"}
{"input": ["cuda -keys=cuda,gpu -max_num_threads=1024 -thread_warp_size=32", "depthwise_conv2d_nchw.cuda", [["TENSOR", [128, 42, 83, 83], "float32"], ["TENSOR", [42, 1, 3, 3], "float32"], 1, "SAME", 1, "float32"], {}], "config": {"index": 2610, "code_hash": null, "entity": [["tile_f", "sp", [-1, 3, 1, 7]], ["tile_y", "sp", [-1, 1, 1, 1]], ["tile_x", "sp", [-1, 1, 83, 1]], ["auto_unroll_max_step", "ot", 1500], ["unroll_explicit", "ot", 0]]}, "result": [[0.0023306707906976744], 0, 2.0882568359375, 1637775853.276045], "version": 0.2, "tvm_version": "0.8.dev0"}
{"input": ["cuda -keys=cuda,gpu -max_num_threads=1024 -thread_warp_size=32", "depthwise_conv2d_nchw.cuda", [["TENSOR", [128, 42, 83, 83], "float32"], ["TENSOR", [42, 1, 3, 3], "float32"], 1, "SAME", 1, "float32"], {}], "config": {"index": 2598, "code_hash": null, "entity": [["tile_f", "sp", [-1, 7, 1, 3]], ["tile_y", "sp", [-1, 1, 1, 1]], ["tile_x", "sp", [-1, 1, 83, 1]], ["auto_unroll_max_step", "ot", 1500], ["unroll_explicit", "ot", 0]]}, "result": [[0.0023307452093023254], 0, 2.114833116531372, 1637775854.96027], "version": 0.2, "tvm_version": "0.8.dev0"}
{"input": ["cuda -keys=cuda,gpu -max_num_threads=1024 -thread_warp_size=32", "depthwise_conv2d_nchw.cuda", [["TENSOR", [128, 42, 83, 83], "float32"], ["TENSOR", [42, 1, 3, 3], "float32"], 1, "SAME", 1, "float32"], {}], "config": {"index": 553, "code_hash": null, "entity": [["tile_f", "sp", [-1, 7, 2, 3]], ["tile_y", "sp", [-1, 1, 1, 1]], ["tile_x", "sp", [-1, 1, 83, 1]], ["auto_unroll_max_step", "ot", 0], ["unroll_explicit", "ot", 0]]}, "result": [[0.0024604639512195124], 0, 2.1039226055145264, 1637775856.6751127], "version": 0.2, "tvm_version": "0.8.dev0"}
{"input": ["cuda -keys=cuda,gpu -max_num_threads=1024 -thread_warp_size=32", "depthwise_conv2d_nchw.cuda", [["TENSOR", [128, 42, 83, 83], "float32"], ["TENSOR", [42, 1, 3, 3], "float32"], 1, "SAME", 1, "float32"], {}], "config": {"index": 22, "code_hash": null, "entity": [["tile_f", "sp", [-1, 1, 14, 1]], ["tile_y", "sp", [-1, 1, 1, 1]], ["tile_x", "sp", [-1, 1, 1, 1]], ["auto_unroll_max_step", "ot", 0], ["unroll_explicit", "ot", 0]]}, "result": [[0.005555240172413794], 0, 2.1803061962127686, 1637775858.5619776], "version": 0.2, "tvm_version": "0.8.dev0"}
{"input": ["cuda -keys=cuda,gpu -max_num_threads=1024 -thread_warp_size=32", "depthwise_conv2d_nchw.cuda", [["TENSOR", [128, 42, 83, 83], "float32"], ["TENSOR", [42, 1, 3, 3], "float32"], 1, "SAME", 1, "float32"], {}], "config": {"index": 528, "code_hash": null, "entity": [["tile_f", "sp", [-1, 1, 6, 1]], ["tile_y", "sp", [-1, 1, 1, 1]], ["tile_x", "sp", [-1, 1, 83, 1]], ["auto_unroll_max_step", "ot", 0], ["unroll_explicit", "ot", 0]]}, "result": [[0.0009578441142857144], 0, 1.8816337585449219, 1637775860.193829], "version": 0.2, "tvm_version": "0.8.dev0"}
{"input": ["cuda -keys=cuda,gpu -max_num_threads=1024 -thread_warp_size=32", "depthwise_conv2d_nchw.cuda", [["TENSOR", [128, 42, 83, 83], "float32"], ["TENSOR", [42, 1, 3, 3], "float32"], 1, "SAME", 1, "float32"], {}], "config": {"index": 525, "code_hash": null, "entity": [["tile_f", "sp", [-1, 2, 3, 1]], ["tile_y", "sp", [-1, 1, 1, 1]], ["tile_x", "sp", [-1, 1, 83, 1]], ["auto_unroll_max_step", "ot", 0], ["unroll_explicit", "ot", 0]]}, "result": [[0.0008276648429752067], 0, 1.953502893447876, 1637775861.8635511], "version": 0.2, "tvm_version": "0.8.dev0"}
{"input": ["cuda -keys=cuda,gpu -max_num_threads=1024 -thread_warp_size=32", "depthwise_conv2d_nchw.cuda", [["TENSOR", [128, 42, 83, 83], "float32"], ["TENSOR", [42, 1, 3, 3], "float32"], 1, "SAME", 1, "float32"], {}], "config": {"index": 530, "code_hash": null, "entity": [["tile_f", "sp", [-1, 1, 7, 1]], ["tile_y", "sp", [-1, 1, 1, 1]], ["tile_x", "sp", [-1, 1, 83, 1]], ["auto_unroll_max_step", "ot", 0], ["unroll_explicit", "ot", 0]]}, "result": [[0.001023788163265306], 0, 1.8134078979492188, 1637775863.43491], "version": 0.2, "tvm_version": "0.8.dev0"}
{"input": ["cuda -keys=cuda,gpu -max_num_threads=1024 -thread_warp_size=32", "depthwise_conv2d_nchw.cuda", [["TENSOR", [128, 42, 83, 83], "float32"], ["TENSOR", [42, 1, 3, 3], "float32"], 1, "SAME", 1, "float32"], {}], "config": {"index": 4658, "code_hash": null, "entity": [["tile_f", "sp", [-1, 3, 1, 7]], ["tile_y", "sp", [-1, 1, 1, 1]], ["tile_x", "sp", [-1, 1, 83, 1]], ["auto_unroll_max_step", "ot", 256], ["unroll_explicit", "ot", 1]]}, "result": [[0.0021405751276595743], 0, 2.5087239742279053, 1637775865.227059], "version": 0.2, "tvm_version": "0.8.dev0"}
{"input": ["cuda -keys=cuda,gpu -max_num_threads=1024 -thread_warp_size=32", "depthwise_conv2d_nchw.cuda", [["TENSOR", [128, 42, 83, 83], "float32"], ["TENSOR", [42, 1, 3, 3], "float32"], 1, "SAME", 1, "float32"], {}], "config": {"index": 4646, "code_hash": null, "entity": [["tile_f", "sp", [-1, 7, 1, 3]], ["tile_y", "sp", [-1, 1, 1, 1]], ["tile_x", "sp", [-1, 1, 83, 1]], ["auto_unroll_max_step", "ot", 256], ["unroll_explicit", "ot", 1]]}, "result": [[0.0021413006382978725], 0, 2.388834238052368, 1637775866.8875172], "version": 0.2, "tvm_version": "0.8.dev0"}
{"input": ["cuda -keys=cuda,gpu -max_num_threads=1024 -thread_warp_size=32", "depthwise_conv2d_nchw.cuda", [["TENSOR", [128, 42, 83, 83], "float32"], ["TENSOR", [42, 1, 3, 3], "float32"], 1, "SAME", 1, "float32"], {}], "config": {"index": 533, "code_hash": null, "entity": [["tile_f", "sp", [-1, 6, 7, 1]], ["tile_y", "sp", [-1, 1, 1, 1]], ["tile_x", "sp", [-1, 1, 83, 1]], ["auto_unroll_max_step", "ot", 0], ["unroll_explicit", "ot", 0]]}, "result": [[0.0011965873095238094], 0, 1.9243369102478027, 1637775868.5012102], "version": 0.2, "tvm_version": "0.8.dev0"}
{"input": ["cuda -keys=cuda,gpu -max_num_threads=1024 -thread_warp_size=32", "depthwise_conv2d_nchw.cuda", [["TENSOR", [128, 42, 83, 83], "float32"], ["TENSOR", [42, 1, 3, 3], "float32"], 1, "SAME", 1, "float32"], {}], "config": {"index": 527, "code_hash": null, "entity": [["tile_f", "sp", [-1, 14, 3, 1]], ["tile_y", "sp", [-1, 1, 1, 1]], ["tile_x", "sp", [-1, 1, 83, 1]], ["auto_unroll_max_step", "ot", 0], ["unroll_explicit", "ot", 0]]}, "result": [[0.0019120756037735848], 0, 2.01405930519104, 1637775870.1251254], "version": 0.2, "tvm_version": "0.8.dev0"}
{"input": ["cuda -keys=cuda,gpu -max_num_threads=1024 -thread_warp_size=32", "depthwise_conv2d_nchw.cuda", [["TENSOR", [128, 42, 83, 83], "float32"], ["TENSOR", [42, 1, 3, 3], "float32"], 1, "SAME", 1, "float32"], {}], "config": {"index": 24, "code_hash": null, "entity": [["tile_f", "sp", [-1, 1, 21, 1]], ["tile_y", "sp", [-1, 1, 1, 1]], ["tile_x", "sp", [-1, 1, 1, 1]], ["auto_unroll_max_step", "ot", 0], ["unroll_explicit", "ot", 0]]}, "result": [[0.0032200633800000002], 0, 2.1214053630828857, 1637775871.9491458], "version": 0.2, "tvm_version": "0.8.dev0"}
{"input": ["cuda -keys=cuda,gpu -max_num_threads=1024 -thread_warp_size=32", "depthwise_conv2d_nchw.cuda", [["TENSOR", [128, 42, 83, 83], "float32"], ["TENSOR", [42, 1, 3, 3], "float32"], 1, "SAME", 1, "float32"], {}], "config": {"index": 4622, "code_hash": null, "entity": [["tile_f", "sp", [-1, 7, 3, 1]], ["tile_y", "sp", [-1, 1, 1, 1]], ["tile_x", "sp", [-1, 1, 83, 1]], ["auto_unroll_max_step", "ot", 256], ["unroll_explicit", "ot", 1]]}, "result": [[0.0011561658735632185], 0, 2.3668875694274902, 1637775873.8677769], "version": 0.2, "tvm_version": "0.8.dev0"}
{"input": ["cuda -keys=cuda,gpu -max_num_threads=1024 -thread_warp_size=32", "depthwise_conv2d_nchw.cuda", [["TENSOR", [128, 42, 83, 83], "float32"], ["TENSOR", [42, 1, 3, 3], "float32"], 1, "SAME", 1, "float32"], {}], "config": {"index": 4628, "code_hash": null, "entity": [["tile_f", "sp", [-1, 3, 7, 1]], ["tile_y", "sp", [-1, 1, 1, 1]], ["tile_x", "sp", [-1, 1, 83, 1]], ["auto_unroll_max_step", "ot", 256], ["unroll_explicit", "ot", 1]]}, "result": [[0.0009451397041420118], 0, 2.134974479675293, 1637775875.6173534], "version": 0.2, "tvm_version": "0.8.dev0"}
{"input": ["cuda -keys=cuda,gpu -max_num_threads=1024 -thread_warp_size=32", "depthwise_conv2d_nchw.cuda", [["TENSOR", [128, 42, 83, 83], "float32"], ["TENSOR", [42, 1, 3, 3], "float32"], 1, "SAME", 1, "float32"], {}], "config": {"index": 3625, "code_hash": null, "entity": [["tile_f", "sp", [-1, 7, 2, 3]], ["tile_y", "sp", [-1, 1, 1, 1]], ["tile_x", "sp", [-1, 1, 83, 1]], ["auto_unroll_max_step", "ot", 0], ["unroll_explicit", "ot", 1]]}, "result": [[0.00246000787804878], 0, 1.9890897274017334, 1637775877.1584692], "version": 0.2, "tvm_version": "0.8.dev0"}
{"input": ["cuda -keys=cuda,gpu -max_num_threads=1024 -thread_warp_size=32", "depthwise_conv2d_nchw.cuda", [["TENSOR", [128, 42, 83, 83], "float32"], ["TENSOR", [42, 1, 3, 3], "float32"], 1, "SAME", 1, "float32"], {}], "config": {"index": 5638, "code_hash": null, "entity": [["tile_f", "sp", [-1, 21, 1, 1]], ["tile_y", "sp", [-1, 1, 1, 1]], ["tile_x", "sp", [-1, 1, 83, 1]], ["auto_unroll_max_step", "ot", 1500], ["unroll_explicit", "ot", 1]]}, "result": [[0.0021309690425531914], 0, 2.2435407638549805, 1637775878.7141051], "version": 0.2, "tvm_version": "0.8.dev0"}
{"input": ["cuda -keys=cuda,gpu -max_num_threads=1024 -thread_warp_size=32", "depthwise_conv2d_nchw.cuda", [["TENSOR", [128, 42, 83, 83], "float32"], ["TENSOR", [42, 1, 3, 3], "float32"], 1, "SAME", 1, "float32"], {}], "config": {"index": 33, "code_hash": null, "entity": [["tile_f", "sp", [-1, 1, 7, 2]], ["tile_y", "sp", [-1, 1, 1, 1]], ["tile_x", "sp", [-1, 1, 1, 1]], ["auto_unroll_max_step", "ot", 0], ["unroll_explicit", "ot", 0]]}, "result": [[0.008823254916666667], 0, 1.98614501953125, 1637775880.3951898], "version": 0.2, "tvm_version": "0.8.dev0"}
{"input": ["cuda -keys=cuda,gpu -max_num_threads=1024 -thread_warp_size=32", "depthwise_conv2d_nchw.cuda", [["TENSOR", [128, 42, 83, 83], "float32"], ["TENSOR", [42, 1, 3, 3], "float32"], 1, "SAME", 1, "float32"], {}], "config": {"index": 1057, "code_hash": null, "entity": [["tile_f", "sp", [-1, 1, 7, 2]], ["tile_y", "sp", [-1, 1, 1, 1]], ["tile_x", "sp", [-1, 1, 1, 1]], ["auto_unroll_max_step", "ot", 256], ["unroll_explicit", "ot", 0]]}, "result": [[0.00894179275], 0, 2.1777968406677246, 1637775882.242967], "version": 0.2, "tvm_version": "0.8.dev0"}
{"input": ["cuda -keys=cuda,gpu -max_num_threads=1024 -thread_warp_size=32", "depthwise_conv2d_nchw.cuda", [["TENSOR", [128, 42, 83, 83], "float32"], ["TENSOR", [42, 1, 3, 3], "float32"], 1, "SAME", 1, "float32"], {}], "config": {"index": 2067, "code_hash": null, "entity": [["tile_f", "sp", [-1, 2, 7, 1]], ["tile_y", "sp", [-1, 1, 1, 1]], ["tile_x", "sp", [-1, 1, 1, 1]], ["auto_unroll_max_step", "ot", 1500], ["unroll_explicit", "ot", 0]]}, "result": [[0.00898971625], 0, 2.006466865539551, 1637775883.9060771], "version": 0.2, "tvm_version": "0.8.dev0"}
{"input": ["cuda -keys=cuda,gpu -max_num_threads=1024 -thread_warp_size=32", "depthwise_conv2d_nchw.cuda", [["TENSOR", [128, 42, 83, 83], "float32"], ["TENSOR", [42, 1, 3, 3], "float32"], 1, "SAME", 1, "float32"], {}], "config": {"index": 3092, "code_hash": null, "entity": [["tile_f", "sp", [-1, 3, 7, 1]], ["tile_y", "sp", [-1, 1, 1, 1]], ["tile_x", "sp", [-1, 1, 1, 1]], ["auto_unroll_max_step", "ot", 0], ["unroll_explicit", "ot", 1]]}, "result": [[0.008491432416666667], 0, 2.0184757709503174, 1637775885.6586597], "version": 0.2, "tvm_version": "0.8.dev0"}
{"input": ["cuda -keys=cuda,gpu -max_num_threads=1024 -thread_warp_size=32", "depthwise_conv2d_nchw.cuda", [["TENSOR", [128, 42, 83, 83], "float32"], ["TENSOR", [42, 1, 3, 3], "float32"], 1, "SAME", 1, "float32"], {}], "config": {"index": 1044, "code_hash": null, "entity": [["tile_f", "sp", [-1, 3, 7, 1]], ["tile_y", "sp", [-1, 1, 1, 1]], ["tile_x", "sp", [-1, 1, 1, 1]], ["auto_unroll_max_step", "ot", 256], ["unroll_explicit", "ot", 0]]}, "result": [[0.008641544166666668], 0, 2.1994218826293945, 1637775887.5422938], "version": 0.2, "tvm_version": "0.8.dev0"}
{"input": ["cuda -keys=cuda,gpu -max_num_threads=1024 -thread_warp_size=32", "depthwise_conv2d_nchw.cuda", [["TENSOR", [128, 42, 83, 83], "float32"], ["TENSOR", [42, 1, 3, 3], "float32"], 1, "SAME", 1, "float32"], {}], "config": {"index": 3599, "code_hash": null, "entity": [["tile_f", "sp", [-1, 14, 3, 1]], ["tile_y", "sp", [-1, 1, 1, 1]], ["tile_x", "sp", [-1, 1, 83, 1]], ["auto_unroll_max_step", "ot", 0], ["unroll_explicit", "ot", 1]]}, "result": [[0.0019113303584905662], 0, 2.0195398330688477, 1637775889.23471], "version": 0.2, "tvm_version": "0.8.dev0"}
{"input": ["cuda -keys=cuda,gpu -max_num_threads=1024 -thread_warp_size=32", "depthwise_conv2d_nchw.cuda", [["TENSOR", [128, 42, 83, 83], "float32"], ["TENSOR", [42, 1, 3, 3], "float32"], 1, "SAME", 1, "float32"], {}], "config": {"index": 3601, "code_hash": null, "entity": [["tile_f", "sp", [-1, 7, 6, 1]], ["tile_y", "sp", [-1, 1, 1, 1]], ["tile_x", "sp", [-1, 1, 83, 1]], ["auto_unroll_max_step", "ot", 0], ["unroll_explicit", "ot", 1]]}, "result": [[0.0012951899615384617], 0, 1.8833117485046387, 1637775890.8096976], "version": 0.2, "tvm_version": "0.8.dev0"}
{"input": ["cuda -keys=cuda,gpu -max_num_threads=1024 -thread_warp_size=32", "depthwise_conv2d_nchw.cuda", [["TENSOR", [128, 42, 83, 83], "float32"], ["TENSOR", [42, 1, 3, 3], "float32"], 1, "SAME", 1, "float32"], {}], "config": {"index": 3605, "code_hash": null, "entity": [["tile_f", "sp", [-1, 6, 7, 1]], ["tile_y", "sp", [-1, 1, 1, 1]], ["tile_x", "sp", [-1, 1, 83, 1]], ["auto_unroll_max_step", "ot", 0], ["unroll_explicit", "ot", 1]]}, "result": [[0.0011959659047619047], 0, 1.8584790229797363, 1637775892.356392], "version": 0.2, "tvm_version": "0.8.dev0"}
{"input": ["cuda -keys=cuda,gpu -max_num_threads=1024 -thread_warp_size=32", "depthwise_conv2d_nchw.cuda", [["TENSOR", [128, 42, 83, 83], "float32"], ["TENSOR", [42, 1, 3, 3], "float32"], 1, "SAME", 1, "float32"], {}], "config": {"index": 2574, "code_hash": null, "entity": [["tile_f", "sp", [-1, 7, 3, 1]], ["tile_y", "sp", [-1, 1, 1, 1]], ["tile_x", "sp", [-1, 1, 83, 1]], ["auto_unroll_max_step", "ot", 1500], ["unroll_explicit", "ot", 0]]}, "result": [[0.0013209570789473684], 0, 1.7809889316558838, 1637775896.145153], "version": 0.2, "tvm_version": "0.8.dev0"}
{"input": ["cuda -keys=cuda,gpu -max_num_threads=1024 -thread_warp_size=32", "depthwise_conv2d_nchw.cuda", [["TENSOR", [128, 42, 83, 83], "float32"], ["TENSOR", [42, 1, 3, 3], "float32"], 1, "SAME", 1, "float32"], {}], "config": {"index": 2580, "code_hash": null, "entity": [["tile_f", "sp", [-1, 3, 7, 1]], ["tile_y", "sp", [-1, 1, 1, 1]], ["tile_x", "sp", [-1, 1, 83, 1]], ["auto_unroll_max_step", "ot", 1500], ["unroll_explicit", "ot", 0]]}, "result": [[0.0010657894134615384], 0, 2.075672149658203, 1637775897.9390774], "version": 0.2, "tvm_version": "0.8.dev0"}
{"input": ["cuda -keys=cuda,gpu -max_num_threads=1024 -thread_warp_size=32", "depthwise_conv2d_nchw.cuda", [["TENSOR", [128, 42, 83, 83], "float32"], ["TENSOR", [42, 1, 3, 3], "float32"], 1, "SAME", 1, "float32"], {}], "config": {"index": 148, "code_hash": null, "entity": [["tile_f", "sp", [-1, 3, 7, 1]], ["tile_y", "sp", [-1, 1, 83, 1]], ["tile_x", "sp", [-1, 1, 1, 1]], ["auto_unroll_max_step", "ot", 0], ["unroll_explicit", "ot", 0]]}, "result": [[0.002355651327868852], 0, 2.525007963180542, 1637775900.0865479], "version": 0.2, "tvm_version": "0.8.dev0"}
{"input": ["cuda -keys=cuda,gpu -max_num_threads=1024 -thread_warp_size=32", "depthwise_conv2d_nchw.cuda", [["TENSOR", [128, 42, 83, 83], "float32"], ["TENSOR", [42, 1, 3, 3], "float32"], 1, "SAME", 1, "float32"], {}], "config": {"index": 4115, "code_hash": null, "entity": [["tile_f", "sp", [-1, 2, 7, 1]], ["tile_y", "sp", [-1, 1, 1, 1]], ["tile_x", "sp", [-1, 1, 1, 1]], ["auto_unroll_max_step", "ot", 256], ["unroll_explicit", "ot", 1]]}, "result": [[0.0088890945], 0, 2.6208739280700684, 1637775902.2973084], "version": 0.2, "tvm_version": "0.8.dev0"}
{"input": ["cuda -keys=cuda,gpu -max_num_threads=1024 -thread_warp_size=32", "depthwise_conv2d_nchw.cuda", [["TENSOR", [128, 42, 83, 83], "float32"], ["TENSOR", [42, 1, 3, 3], "float32"], 1, "SAME", 1, "float32"], {}], "config": {"index": 1042, "code_hash": null, "entity": [["tile_f", "sp", [-1, 1, 7, 1]], ["tile_y", "sp", [-1, 1, 1, 1]], ["tile_x", "sp", [-1, 1, 1, 1]], ["auto_unroll_max_step", "ot", 256], ["unroll_explicit", "ot", 0]]}, "result": [[0.009765264545454545], 0, 2.525116205215454, 1637775904.530865], "version": 0.2, "tvm_version": "0.8.dev0"}
{"input": ["cuda -keys=cuda,gpu -max_num_threads=1024 -thread_warp_size=32", "depthwise_conv2d_nchw.cuda", [["TENSOR", [128, 42, 83, 83], "float32"], ["TENSOR", [42, 1, 3, 3], "float32"], 1, "SAME", 1, "float32"], {}], "config": {"index": 18, "code_hash": null, "entity": [["tile_f", "sp", [-1, 1, 7, 1]], ["tile_y", "sp", [-1, 1, 1, 1]], ["tile_x", "sp", [-1, 1, 1, 1]], ["auto_unroll_max_step", "ot", 0], ["unroll_explicit", "ot", 0]]}, "result": [[0.009760546454545454], 0, 2.5191242694854736, 1637775906.731895], "version": 0.2, "tvm_version": "0.8.dev0"}
{"input": ["cuda -keys=cuda,gpu -max_num_threads=1024 -thread_warp_size=32", "depthwise_conv2d_nchw.cuda", [["TENSOR", [128, 42, 83, 83], "float32"], ["TENSOR", [42, 1, 3, 3], "float32"], 1, "SAME", 1, "float32"], {}], "config": {"index": 572, "code_hash": null, "entity": [["tile_f", "sp", [-1, 1, 1, 21]], ["tile_y", "sp", [-1, 1, 1, 1]], ["tile_x", "sp", [-1, 1, 83, 1]], ["auto_unroll_max_step", "ot", 0], ["unroll_explicit", "ot", 0]]}, "result": [[0.002293952727272727], 0, 3.1089274883270264, 1637775909.4707453], "version": 0.2, "tvm_version": "0.8.dev0"}
{"input": ["cuda -keys=cuda,gpu -max_num_threads=1024 -thread_warp_size=32", "depthwise_conv2d_nchw.cuda", [["TENSOR", [128, 42, 83, 83], "float32"], ["TENSOR", [42, 1, 3, 3], "float32"], 1, "SAME", 1, "float32"], {}], "config": {"index": 3603, "code_hash": null, "entity": [["tile_f", "sp", [-1, 2, 7, 1]], ["tile_y", "sp", [-1, 1, 1, 1]], ["tile_x", "sp", [-1, 1, 83, 1]], ["auto_unroll_max_step", "ot", 0], ["unroll_explicit", "ot", 1]]}, "result": [[0.0009744838640776698], 0, 2.0101075172424316, 1637775911.1949608], "version": 0.2, "tvm_version": "0.8.dev0"}
{"input": ["cuda -keys=cuda,gpu -max_num_threads=1024 -thread_warp_size=32", "depthwise_conv2d_nchw.cuda", [["TENSOR", [128, 42, 83, 83], "float32"], ["TENSOR", [42, 1, 3, 3], "float32"], 1, "SAME", 1, "float32"], {}], "config": {"index": 5, "code_hash": null, "entity": [["tile_f", "sp", [-1, 14, 1, 1]], ["tile_y", "sp", [-1, 1, 1, 1]], ["tile_x", "sp", [-1, 1, 1, 1]], ["auto_unroll_max_step", "ot", 0], ["unroll_explicit", "ot", 0]]}, "result": [[0.021257562833333337], 0, 2.2200284004211426, 1637775913.0842338], "version": 0.2, "tvm_version": "0.8.dev0"}
{"input": ["cuda -keys=cuda,gpu -max_num_threads=1024 -thread_warp_size=32", "depthwise_conv2d_nchw.cuda", [["TENSOR", [128, 42, 83, 83], "float32"], ["TENSOR", [42, 1, 3, 3], "float32"], 1, "SAME", 1, "float32"], {}], "config": {"index": 10, "code_hash": null, "entity": [["tile_f", "sp", [-1, 7, 2, 1]], ["tile_y", "sp", [-1, 1, 1, 1]], ["tile_x", "sp", [-1, 1, 1, 1]], ["auto_unroll_max_step", "ot", 0], ["unroll_explicit", "ot", 0]]}, "result": [[0.0209448545], 0, 2.1634130477905273, 1637775914.955834], "version": 0.2, "tvm_version": "0.8.dev0"}
{"input": ["cuda -keys=cuda,gpu -max_num_threads=1024 -thread_warp_size=32", "depthwise_conv2d_nchw.cuda", [["TENSOR", [128, 42, 83, 83], "float32"], ["TENSOR", [42, 1, 3, 3], "float32"], 1, "SAME", 1, "float32"], {}], "config": {"index": 5670, "code_hash": null, "entity": [["tile_f", "sp", [-1, 7, 1, 3]], ["tile_y", "sp", [-1, 1, 1, 1]], ["tile_x", "sp", [-1, 1, 83, 1]], ["auto_unroll_max_step", "ot", 1500], ["unroll_explicit", "ot", 1]]}, "result": [[0.002141279085106383], 0, 2.3224103450775146, 1637775916.588303], "version": 0.2, "tvm_version": "0.8.dev0"}
{"input": ["cuda -keys=cuda,gpu -max_num_threads=1024 -thread_warp_size=32", "depthwise_conv2d_nchw.cuda", [["TENSOR", [128, 42, 83, 83], "float32"], ["TENSOR", [42, 1, 3, 3], "float32"], 1, "SAME", 1, "float32"], {}], "config": {"index": 5682, "code_hash": null, "entity": [["tile_f", "sp", [-1, 3, 1, 7]], ["tile_y", "sp", [-1, 1, 1, 1]], ["tile_x", "sp", [-1, 1, 83, 1]], ["auto_unroll_max_step", "ot", 1500], ["unroll_explicit", "ot", 1]]}, "result": [[0.0021408258723404254], 0, 2.539490222930908, 1637775918.4161818], "version": 0.2, "tvm_version": "0.8.dev0"}
{"input": ["cuda -keys=cuda,gpu -max_num_threads=1024 -thread_warp_size=32", "depthwise_conv2d_nchw.cuda", [["TENSOR", [128, 42, 83, 83], "float32"], ["TENSOR", [42, 1, 3, 3], "float32"], 1, "SAME", 1, "float32"], {}], "config": {"index": 521, "code_hash": null, "entity": [["tile_f", "sp", [-1, 3, 2, 1]], ["tile_y", "sp", [-1, 1, 1, 1]], ["tile_x", "sp", [-1, 1, 83, 1]], ["auto_unroll_max_step", "ot", 0], ["unroll_explicit", "ot", 0]]}, "result": [[0.0008939395446428572], 0, 1.8812956809997559, 1637775919.9418826], "version": 0.2, "tvm_version": "0.8.dev0"}
{"input": ["cuda -keys=cuda,gpu -max_num_threads=1024 -thread_warp_size=32", "depthwise_conv2d_nchw.cuda", [["TENSOR", [128, 42, 83, 83], "float32"], ["TENSOR", [42, 1, 3, 3], "float32"], 1, "SAME", 1, "float32"], {}], "config": {"index": 2851, "code_hash": null, "entity": [["tile_f", "sp", [-1, 1, 21, 2]], ["tile_y", "sp", [-1, 1, 1, 1]], ["tile_x", "sp", [-1, 1, 1, 83]], ["auto_unroll_max_step", "ot", 1500], ["unroll_explicit", "ot", 0]]}, "result": [[0.017600329], 0, 5.986972093582153, 1637775923.8359518], "version": 0.2, "tvm_version": "0.8.dev0"}
{"input": ["cuda -keys=cuda,gpu -max_num_threads=1024 -thread_warp_size=32", "depthwise_conv2d_nchw.cuda", [["TENSOR", [128, 42, 83, 83], "float32"], ["TENSOR", [42, 1, 3, 3], "float32"], 1, "SAME", 1, "float32"], {}], "config": {"index": 4399, "code_hash": null, "entity": [["tile_f", "sp", [-1, 1, 7, 6]], ["tile_y", "sp", [-1, 1, 1, 1]], ["tile_x", "sp", [-1, 83, 1, 1]], ["auto_unroll_max_step", "ot", 256], ["unroll_explicit", "ot", 1]]}, "result": [[0.042312226], 0, 3.4212427139282227, 1637775927.8672802], "version": 0.2, "tvm_version": "0.8.dev0"}
{"input": ["cuda -keys=cuda,gpu -max_num_threads=1024 -thread_warp_size=32", "depthwise_conv2d_nchw.cuda", [["TENSOR", [128, 42, 83, 83], "float32"], ["TENSOR", [42, 1, 3, 3], "float32"], 1, "SAME", 1, "float32"], {}], "config": {"index": 2259, "code_hash": null, "entity": [["tile_f", "sp", [-1, 2, 7, 1]], ["tile_y", "sp", [-1, 1, 1, 83]], ["tile_x", "sp", [-1, 1, 1, 1]], ["auto_unroll_max_step", "ot", 1500], ["unroll_explicit", "ot", 0]]}, "result": [[0.020780822833333334], 0, 4.440834999084473, 1637775930.788914], "version": 0.2, "tvm_version": "0.8.dev0"}
{"input": ["cuda -keys=cuda,gpu -max_num_threads=1024 -thread_warp_size=32", "depthwise_conv2d_nchw.cuda", [["TENSOR", [128, 42, 83, 83], "float32"], ["TENSOR", [42, 1, 3, 3], "float32"], 1, "SAME", 1, "float32"], {}], "config": {"index": 90, "code_hash": null, "entity": [["tile_f", "sp", [-1, 1, 42, 1]], ["tile_y", "sp", [-1, 83, 1, 1]], ["tile_x", "sp", [-1, 1, 1, 1]], ["auto_unroll_max_step", "ot", 0], ["unroll_explicit", "ot", 0]]}, "result": [[0.009002033250000001], 0, 2.533083915710449, 1637775932.82959], "version": 0.2, "tvm_version": "0.8.dev0"}
{"input": ["cuda -keys=cuda,gpu -max_num_threads=1024 -thread_warp_size=32", "depthwise_conv2d_nchw.cuda", [["TENSOR", [128, 42, 83, 83], "float32"], ["TENSOR", [42, 1, 3, 3], "float32"], 1, "SAME", 1, "float32"], {}], "config": {"index": 3597, "code_hash": null, "entity": [["tile_f", "sp", [-1, 2, 3, 1]], ["tile_y", "sp", [-1, 1, 1, 1]], ["tile_x", "sp", [-1, 1, 83, 1]], ["auto_unroll_max_step", "ot", 0], ["unroll_explicit", "ot", 1]]}, "result": [[0.0008562755635359116], 0, 1.8574283123016357, 1637775946.9937484], "version": 0.2, "tvm_version": "0.8.dev0"}
{"input": ["cuda -keys=cuda,gpu -max_num_threads=1024 -thread_warp_size=32", "depthwise_conv2d_nchw.cuda", [["TENSOR", [128, 42, 83, 83], "float32"], ["TENSOR", [42, 1, 3, 3], "float32"], 1, "SAME", 1, "float32"], {}], "config": {"index": 3600, "code_hash": null, "entity": [["tile_f", "sp", [-1, 1, 6, 1]], ["tile_y", "sp", [-1, 1, 1, 1]], ["tile_x", "sp", [-1, 1, 83, 1]], ["auto_unroll_max_step", "ot", 0], ["unroll_explicit", "ot", 1]]}, "result": [[0.0009585151523809524], 0, 1.8796963691711426, 1637775948.5954652], "version": 0.2, "tvm_version": "0.8.dev0"}
{"input": ["cuda -keys=cuda,gpu -max_num_threads=1024 -thread_warp_size=32", "depthwise_conv2d_nchw.cuda", [["TENSOR", [128, 42, 83, 83], "float32"], ["TENSOR", [42, 1, 3, 3], "float32"], 1, "SAME", 1, "float32"], {}], "config": {"index": 1549, "code_hash": null, "entity": [["tile_f", "sp", [-1, 2, 3, 1]], ["tile_y", "sp", [-1, 1, 1, 1]], ["tile_x", "sp", [-1, 1, 83, 1]], ["auto_unroll_max_step", "ot", 256], ["unroll_explicit", "ot", 0]]}, "result": [[0.0008278950578512397], 0, 1.8803904056549072, 1637775950.144615], "version": 0.2, "tvm_version": "0.8.dev0"}
{"input": ["cuda -keys=cuda,gpu -max_num_threads=1024 -thread_warp_size=32", "depthwise_conv2d_nchw.cuda", [["TENSOR", [128, 42, 83, 83], "float32"], ["TENSOR", [42, 1, 3, 3], "float32"], 1, "SAME", 1, "float32"], {}], "config": {"index": 3593, "code_hash": null, "entity": [["tile_f", "sp", [-1, 3, 2, 1]], ["tile_y", "sp", [-1, 1, 1, 1]], ["tile_x", "sp", [-1, 1, 83, 1]], ["auto_unroll_max_step", "ot", 0], ["unroll_explicit", "ot", 1]]}, "result": [[0.0008940955625], 0, 1.9703214168548584, 1637775951.7831647], "version": 0.2, "tvm_version": "0.8.dev0"}
{"input": ["cuda -keys=cuda,gpu -max_num_threads=1024 -thread_warp_size=32", "depthwise_conv2d_nchw.cuda", [["TENSOR", [128, 42, 83, 83], "float32"], ["TENSOR", [42, 1, 3, 3], "float32"], 1, "SAME", 1, "float32"], {}], "config": {"index": 2573, "code_hash": null, "entity": [["tile_f", "sp", [-1, 2, 3, 1]], ["tile_y", "sp", [-1, 1, 1, 1]], ["tile_x", "sp", [-1, 1, 83, 1]], ["auto_unroll_max_step", "ot", 1500], ["unroll_explicit", "ot", 0]]}, "result": [[0.0008278933884297521], 0, 1.8009095191955566, 1637775953.2844672], "version": 0.2, "tvm_version": "0.8.dev0"}
{"input": ["cuda -keys=cuda,gpu -max_num_threads=1024 -thread_warp_size=32", "depthwise_conv2d_nchw.cuda", [["TENSOR", [128, 42, 83, 83], "float32"], ["TENSOR", [42, 1, 3, 3], "float32"], 1, "SAME", 1, "float32"], {}], "config": {"index": 4621, "code_hash": null, "entity": [["tile_f", "sp", [-1, 2, 3, 1]], ["tile_y", "sp", [-1, 1, 1, 1]], ["tile_x", "sp", [-1, 1, 83, 1]], ["auto_unroll_max_step", "ot", 256], ["unroll_explicit", "ot", 1]]}, "result": [[0.000791842881773399], 0, 2.2097935676574707, 1637775955.1226678], "version": 0.2, "tvm_version": "0.8.dev0"}
{"input": ["cuda -keys=cuda,gpu -max_num_threads=1024 -thread_warp_size=32", "depthwise_conv2d_nchw.cuda", [["TENSOR", [128, 42, 83, 83], "float32"], ["TENSOR", [42, 1, 3, 3], "float32"], 1, "SAME", 1, "float32"], {}], "config": {"index": 524, "code_hash": null, "entity": [["tile_f", "sp", [-1, 1, 3, 1]], ["tile_y", "sp", [-1, 1, 1, 1]], ["tile_x", "sp", [-1, 1, 83, 1]], ["auto_unroll_max_step", "ot", 0], ["unroll_explicit", "ot", 0]]}, "result": [[0.0008968445535714285], 0, 1.8515799045562744, 1637775956.675511], "version": 0.2, "tvm_version": "0.8.dev0"}
{"input": ["cuda -keys=cuda,gpu -max_num_threads=1024 -thread_warp_size=32", "depthwise_conv2d_nchw.cuda", [["TENSOR", [128, 42, 83, 83], "float32"], ["TENSOR", [42, 1, 3, 3], "float32"], 1, "SAME", 1, "float32"], {}], "config": {"index": 5645, "code_hash": null, "entity": [["tile_f", "sp", [-1, 2, 3, 1]], ["tile_y", "sp", [-1, 1, 1, 1]], ["tile_x", "sp", [-1, 1, 83, 1]], ["auto_unroll_max_step", "ot", 1500], ["unroll_explicit", "ot", 1]]}, "result": [[0.0007917891724137932], 0, 2.0876739025115967, 1637775958.4369652], "version": 0.2, "tvm_version": "0.8.dev0"}
{"input": ["cuda -keys=cuda,gpu -max_num_threads=1024 -thread_warp_size=32", "depthwise_conv2d_nchw.cuda", [["TENSOR", [128, 42, 83, 83], "float32"], ["TENSOR", [42, 1, 3, 3], "float32"], 1, "SAME", 1, "float32"], {}], "config": {"index": 1555, "code_hash": null, "entity": [["tile_f", "sp", [-1, 2, 7, 1]], ["tile_y", "sp", [-1, 1, 1, 1]], ["tile_x", "sp", [-1, 1, 83, 1]], ["auto_unroll_max_step", "ot", 256], ["unroll_explicit", "ot", 0]]}, "result": [[0.0009743659223300971], 0, 1.9431965351104736, 1637775960.0604346], "version": 0.2, "tvm_version": "0.8.dev0"}
{"input": ["cuda -keys=cuda,gpu -max_num_threads=1024 -thread_warp_size=32", "depthwise_conv2d_nchw.cuda", [["TENSOR", [128, 42, 83, 83], "float32"], ["TENSOR", [42, 1, 3, 3], "float32"], 1, "SAME", 1, "float32"], {}], "config": {"index": 4627, "code_hash": null, "entity": [["tile_f", "sp", [-1, 2, 7, 1]], ["tile_y", "sp", [-1, 1, 1, 1]], ["tile_x", "sp", [-1, 1, 83, 1]], ["auto_unroll_max_step", "ot", 256], ["unroll_explicit", "ot", 1]]}, "result": [[0.00096596525], 0, 2.0535356998443604, 1637775961.7658052], "version": 0.2, "tvm_version": "0.8.dev0"}
{"input": ["cuda -keys=cuda,gpu -max_num_threads=1024 -thread_warp_size=32", "depthwise_conv2d_nchw.cuda", [["TENSOR", [128, 42, 83, 83], "float32"], ["TENSOR", [42, 1, 3, 3], "float32"], 1, "SAME", 1, "float32"], {}], "config": {"index": 3596, "code_hash": null, "entity": [["tile_f", "sp", [-1, 1, 3, 1]], ["tile_y", "sp", [-1, 1, 1, 1]], ["tile_x", "sp", [-1, 1, 83, 1]], ["auto_unroll_max_step", "ot", 0], ["unroll_explicit", "ot", 1]]}, "result": [[0.0008969837857142857], 0, 1.9330034255981445, 1637775963.4368308], "version": 0.2, "tvm_version": "0.8.dev0"}
{"input": ["cuda -keys=cuda,gpu -max_num_threads=1024 -thread_warp_size=32", "depthwise_conv2d_nchw.cuda", [["TENSOR", [128, 42, 83, 83], "float32"], ["TENSOR", [42, 1, 3, 3], "float32"], 1, "SAME", 1, "float32"], {}], "config": {"index": 2579, "code_hash": null, "entity": [["tile_f", "sp", [-1, 2, 7, 1]], ["tile_y", "sp", [-1, 1, 1, 1]], ["tile_x", "sp", [-1, 1, 83, 1]], ["auto_unroll_max_step", "ot", 1500], ["unroll_explicit", "ot", 0]]}, "result": [[0.000974419281553398], 0, 2.195793628692627, 1637775965.3136754], "version": 0.2, "tvm_version": "0.8.dev0"}
{"input": ["cuda -keys=cuda,gpu -max_num_threads=1024 -thread_warp_size=32", "depthwise_conv2d_nchw.cuda", [["TENSOR", [128, 42, 83, 83], "float32"], ["TENSOR", [42, 1, 3, 3], "float32"], 1, "SAME", 1, "float32"], {}], "config": {"index": 5641, "code_hash": null, "entity": [["tile_f", "sp", [-1, 3, 2, 1]], ["tile_y", "sp", [-1, 1, 1, 1]], ["tile_x", "sp", [-1, 1, 83, 1]], ["auto_unroll_max_step", "ot", 1500], ["unroll_explicit", "ot", 1]]}, "result": [[0.0008407898571428572], 0, 1.9138820171356201, 1637775966.8852468], "version": 0.2, "tvm_version": "0.8.dev0"}
{"input": ["cuda -keys=cuda,gpu -max_num_threads=1024 -thread_warp_size=32", "depthwise_conv2d_nchw.cuda", [["TENSOR", [128, 42, 83, 83], "float32"], ["TENSOR", [42, 1, 3, 3], "float32"], 1, "SAME", 1, "float32"], {}], "config": {"index": 5651, "code_hash": null, "entity": [["tile_f", "sp", [-1, 2, 7, 1]], ["tile_y", "sp", [-1, 1, 1, 1]], ["tile_x", "sp", [-1, 1, 83, 1]], ["auto_unroll_max_step", "ot", 1500], ["unroll_explicit", "ot", 1]]}, "result": [[0.000965619048076923], 0, 1.9076519012451172, 1637775968.4498498], "version": 0.2, "tvm_version": "0.8.dev0"}
{"input": ["cuda -keys=cuda,gpu -max_num_threads=1024 -thread_warp_size=32", "depthwise_conv2d_nchw.cuda", [["TENSOR", [128, 42, 83, 83], "float32"], ["TENSOR", [42, 1, 3, 3], "float32"], 1, "SAME", 1, "float32"], {}], "config": {"index": 4617, "code_hash": null, "entity": [["tile_f", "sp", [-1, 3, 2, 1]], ["tile_y", "sp", [-1, 1, 1, 1]], ["tile_x", "sp", [-1, 1, 83, 1]], ["auto_unroll_max_step", "ot", 256], ["unroll_explicit", "ot", 1]]}, "result": [[0.0008409671512605042], 0, 1.8586833477020264, 1637775969.949743], "version": 0.2, "tvm_version": "0.8.dev0"}
{"input": ["cuda -keys=cuda,gpu -max_num_threads=1024 -thread_warp_size=32", "depthwise_conv2d_nchw.cuda", [["TENSOR", [128, 42, 83, 83], "float32"], ["TENSOR", [42, 1, 3, 3], "float32"], 1, "SAME", 1, "float32"], {}], "config": {"index": 4624, "code_hash": null, "entity": [["tile_f", "sp", [-1, 1, 6, 1]], ["tile_y", "sp", [-1, 1, 1, 1]], ["tile_x", "sp", [-1, 1, 83, 1]], ["auto_unroll_max_step", "ot", 256], ["unroll_explicit", "ot", 1]]}, "result": [[0.0009083349322033898], 0, 2.161691188812256, 1637775971.7917333], "version": 0.2, "tvm_version": "0.8.dev0"}
{"input": ["cuda -keys=cuda,gpu -max_num_threads=1024 -thread_warp_size=32", "depthwise_conv2d_nchw.cuda", [["TENSOR", [128, 42, 83, 83], "float32"], ["TENSOR", [42, 1, 3, 3], "float32"], 1, "SAME", 1, "float32"], {}], "config": {"index": 2569, "code_hash": null, "entity": [["tile_f", "sp", [-1, 3, 2, 1]], ["tile_y", "sp", [-1, 1, 1, 1]], ["tile_x", "sp", [-1, 1, 83, 1]], ["auto_unroll_max_step", "ot", 1500], ["unroll_explicit", "ot", 0]]}, "result": [[0.0008939945178571429], 0, 1.82326340675354, 1637775973.286358], "version": 0.2, "tvm_version": "0.8.dev0"}
{"input": ["cuda -keys=cuda,gpu -max_num_threads=1024 -thread_warp_size=32", "depthwise_conv2d_nchw.cuda", [["TENSOR", [128, 42, 83, 83], "float32"], ["TENSOR", [42, 1, 3, 3], "float32"], 1, "SAME", 1, "float32"], {}], "config": {"index": 520, "code_hash": null, "entity": [["tile_f", "sp", [-1, 1, 2, 1]], ["tile_y", "sp", [-1, 1, 1, 1]], ["tile_x", "sp", [-1, 1, 83, 1]], ["auto_unroll_max_step", "ot", 0], ["unroll_explicit", "ot", 0]]}, "result": [[0.0010186624936708861], 0, 2.7916653156280518, 1637775975.779464], "version": 0.2, "tvm_version": "0.8.dev0"}
{"input": ["cuda -keys=cuda,gpu -max_num_threads=1024 -thread_warp_size=32", "depthwise_conv2d_nchw.cuda", [["TENSOR", [128, 42, 83, 83], "float32"], ["TENSOR", [42, 1, 3, 3], "float32"], 1, "SAME", 1, "float32"], {}], "config": {"index": 3594, "code_hash": null, "entity": [["tile_f", "sp", [-1, 7, 2, 1]], ["tile_y", "sp", [-1, 1, 1, 1]], ["tile_x", "sp", [-1, 1, 83, 1]], ["auto_unroll_max_step", "ot", 0], ["unroll_explicit", "ot", 1]]}, "result": [[0.0011707949651162792], 0, 1.933075189590454, 1637775977.3707705], "version": 0.2, "tvm_version": "0.8.dev0"}
{"input": ["cuda -keys=cuda,gpu -max_num_threads=1024 -thread_warp_size=32", "depthwise_conv2d_nchw.cuda", [["TENSOR", [128, 42, 83, 83], "float32"], ["TENSOR", [42, 1, 3, 3], "float32"], 1, "SAME", 1, "float32"], {}], "config": {"index": 3602, "code_hash": null, "entity": [["tile_f", "sp", [-1, 1, 7, 1]], ["tile_y", "sp", [-1, 1, 1, 1]], ["tile_x", "sp", [-1, 1, 83, 1]], ["auto_unroll_max_step", "ot", 0], ["unroll_explicit", "ot", 1]]}, "result": [[0.0010238722040816328], 0, 2.073167085647583, 1637775979.1089294], "version": 0.2, "tvm_version": "0.8.dev0"}
{"input": ["cuda -keys=cuda,gpu -max_num_threads=1024 -thread_warp_size=32", "depthwise_conv2d_nchw.cuda", [["TENSOR", [128, 42, 83, 83], "float32"], ["TENSOR", [42, 1, 3, 3], "float32"], 1, "SAME", 1, "float32"], {}], "config": {"index": 5648, "code_hash": null, "entity": [["tile_f", "sp", [-1, 1, 6, 1]], ["tile_y", "sp", [-1, 1, 1, 1]], ["tile_x", "sp", [-1, 1, 83, 1]], ["auto_unroll_max_step", "ot", 1500], ["unroll_explicit", "ot", 1]]}, "result": [[0.0009080998587570621], 0, 2.058903455734253, 1637775980.8554025], "version": 0.2, "tvm_version": "0.8.dev0"}
{"input": ["cuda -keys=cuda,gpu -max_num_threads=1024 -thread_warp_size=32", "depthwise_conv2d_nchw.cuda", [["TENSOR", [128, 42, 83, 83], "float32"], ["TENSOR", [42, 1, 3, 3], "float32"], 1, "SAME", 1, "float32"], {}], "config": {"index": 543, "code_hash": null, "entity": [["tile_f", "sp", [-1, 1, 3, 2]], ["tile_y", "sp", [-1, 1, 1, 1]], ["tile_x", "sp", [-1, 1, 83, 1]], ["auto_unroll_max_step", "ot", 0], ["unroll_explicit", "ot", 0]]}, "result": [[0.0007979686089108911], 0, 2.072139263153076, 1637775982.616274], "version": 0.2, "tvm_version": "0.8.dev0"}
{"input": ["cuda -keys=cuda,gpu -max_num_threads=1024 -thread_warp_size=32", "depthwise_conv2d_nchw.cuda", [["TENSOR", [128, 42, 83, 83], "float32"], ["TENSOR", [42, 1, 3, 3], "float32"], 1, "SAME", 1, "float32"], {}], "config": {"index": 5652, "code_hash": null, "entity": [["tile_f", "sp", [-1, 3, 7, 1]], ["tile_y", "sp", [-1, 1, 1, 1]], ["tile_x", "sp", [-1, 1, 83, 1]], ["auto_unroll_max_step", "ot", 1500], ["unroll_explicit", "ot", 1]]}, "result": [[0.0009454837358490566], 0, 1.8460326194763184, 1637775984.1081402], "version": 0.2, "tvm_version": "0.8.dev0"}
{"input": ["cuda -keys=cuda,gpu -max_num_threads=1024 -thread_warp_size=32", "depthwise_conv2d_nchw.cuda", [["TENSOR", [128, 42, 83, 83], "float32"], ["TENSOR", [42, 1, 3, 3], "float32"], 1, "SAME", 1, "float32"], {}], "config": {"index": 3615, "code_hash": null, "entity": [["tile_f", "sp", [-1, 1, 3, 2]], ["tile_y", "sp", [-1, 1, 1, 1]], ["tile_x", "sp", [-1, 1, 83, 1]], ["auto_unroll_max_step", "ot", 0], ["unroll_explicit", "ot", 1]]}, "result": [[0.0007972621732673267], 0, 2.1497716903686523, 1637775985.9493852], "version": 0.2, "tvm_version": "0.8.dev0"}
{"input": ["cuda -keys=cuda,gpu -max_num_threads=1024 -thread_warp_size=32", "depthwise_conv2d_nchw.cuda", [["TENSOR", [128, 42, 83, 83], "float32"], ["TENSOR", [42, 1, 3, 3], "float32"], 1, "SAME", 1, "float32"], {}], "config": {"index": 3617, "code_hash": null, "entity": [["tile_f", "sp", [-1, 1, 7, 2]], ["tile_y", "sp", [-1, 1, 1, 1]], ["tile_x", "sp", [-1, 1, 83, 1]], ["auto_unroll_max_step", "ot", 0], ["unroll_explicit", "ot", 1]]}, "result": [[0.0009386258504672897], 0, 2.2164337635040283, 1637775988.4867783], "version": 0.2, "tvm_version": "0.8.dev0"}
{"input": ["cuda -keys=cuda,gpu -max_num_threads=1024 -thread_warp_size=32", "depthwise_conv2d_nchw.cuda", [["TENSOR", [128, 42, 83, 83], "float32"], ["TENSOR", [42, 1, 3, 3], "float32"], 1, "SAME", 1, "float32"], {}], "config": {"index": 1552, "code_hash": null, "entity": [["tile_f", "sp", [-1, 1, 6, 1]], ["tile_y", "sp", [-1, 1, 1, 1]], ["tile_x", "sp", [-1, 1, 83, 1]], ["auto_unroll_max_step", "ot", 256], ["unroll_explicit", "ot", 0]]}, "result": [[0.0009580110476190476], 0, 2.298694133758545, 1637775990.159403], "version": 0.2, "tvm_version": "0.8.dev0"}
{"input": ["cuda -keys=cuda,gpu -max_num_threads=1024 -thread_warp_size=32", "depthwise_conv2d_nchw.cuda", [["TENSOR", [128, 42, 83, 83], "float32"], ["TENSOR", [42, 1, 3, 3], "float32"], 1, "SAME", 1, "float32"], {}], "config": {"index": 5642, "code_hash": null, "entity": [["tile_f", "sp", [-1, 7, 2, 1]], ["tile_y", "sp", [-1, 1, 1, 1]], ["tile_x", "sp", [-1, 1, 83, 1]], ["auto_unroll_max_step", "ot", 1500], ["unroll_explicit", "ot", 1]]}, "result": [[0.0010963255034013607], 0, 2.6431753635406494, 1637775992.014897], "version": 0.2, "tvm_version": "0.8.dev0"}
