artifacts/kernel_db/ansor_kernels/fused_conv_expr_S1D1P1_64_64_8_8_64_3_3_ansor/tune.log
{"i": [["[\"get_expr\", \"fused_conv_expr_S1D1P1\", [64, 64, 8, 8, 64, 3, 3]]", "cuda -keys=cuda,gpu -max_num_threads=1024 -thread_warp_size=32", [-1, 16, 64, 49152, 2147483647, 1024, 8, 32], "", 0, []], [[], [["SP", 4, 0, 64, [4, 16, 1, 1], 1], ["SP", 4, 5, 4096, [2, 16, 4, 1], 1], ["SP", 4, 10, 576, [2, 4], 1], ["RE", 4, [0, 5, 1, 6, 2, 7, 10, 11, 3, 8, 12, 4, 9]], ["FSP", 5, 0, 0, 3], ["FSP", 5, 4, 1, 3], ["RE", 5, [0, 4, 1, 5, 2, 6, 3, 7]], ["CA", 4, 5, 5], ["CHR", 3, "shared", [4]], ["CA", 4, 5, 6], ["CI", 3], ["CHR", 1, "shared", [5]], ["CA", 2, 6, 6], ["CI", 1], ["FU", 7, [0, 1]], ["AN", 7, 0, 5], ["FU", 7, [1, 2]], ["AN", 7, 1, 4], ["FU", 7, [2, 3]], ["AN", 7, 2, 6], ["FU", 5, [0, 1]], ["SP", 5, 0, 8, [1], 1], ["AN", 5, 1, 2], ["FFSP", 5, 0, [1, 0], 1, 1], ["AN", 5, 1, 6], ["FU", 2, [0, 1]], ["SP", 2, 0, 32, [2], 1], ["AN", 2, 1, 2], ["FFSP", 2, 0, [1, 0], 1, 1], ["AN", 2, 1, 6], ["PR", 6, 0, "auto_unroll_max_step$0"]]]], "r": [[0.000129135], 0, 2.17732, 1661160344], "v": "v0.6"}
{"i": [["[\"get_expr\", \"fused_conv_expr_S1D1P1\", [64, 64, 8, 8, 64, 3, 3]]", "cuda -keys=cuda,gpu -max_num_threads=1024 -thread_warp_size=32", [-1, 16, 64, 49152, 2147483647, 1024, 8, 32], "", 0, []], [[], [["SP", 4, 0, 64, [2, 16, 1, 2], 1], ["SP", 4, 5, 4096, [1, 2, 64, 2], 1], ["SP", 4, 10, 576, [8, 1], 1], ["RE", 4, [0, 5, 1, 6, 2, 7, 10, 11, 3, 8, 12, 4, 9]], ["FSP", 5, 0, 0, 3], ["FSP", 5, 4, 1, 3], ["RE", 5, [0, 4, 1, 5, 2, 6, 3, 7]], ["CA", 4, 5, 5], ["CHR", 3, "shared", [4]], ["CA", 4, 5, 6], ["CI", 3], ["CHR", 1, "shared", [5]], ["CA", 2, 6, 6], ["CI", 1], ["FU", 7, [0, 1]], ["AN", 7, 0, 5], ["FU", 7, [1, 2]], ["AN", 7, 1, 4], ["FU", 7, [2, 3]], ["AN", 7, 2, 6], ["FU", 5, [0, 1]], ["SP", 5, 0, 32, [1], 1], ["AN", 5, 1, 2], ["FFSP", 5, 0, [1, 0], 1, 1], ["AN", 5, 1, 6], ["FU", 2, [0, 1]], ["SP", 2, 0, 128, [1], 1], ["AN", 2, 1, 2], ["FFSP", 2, 0, [1, 0], 1, 1], ["AN", 2, 1, 6], ["PR", 6, 0, "auto_unroll_max_step$0"]]]], "r": [[0.00581746], 0, 4.07662, 1661160346], "v": "v0.6"}
{"i": [["[\"get_expr\", \"fused_conv_expr_S1D1P1\", [64, 64, 8, 8, 64, 3, 3]]", "cuda -keys=cuda,gpu -max_num_threads=1024 -thread_warp_size=32", [-1, 16, 64, 49152, 2147483647, 1024, 8, 32], "", 0, []], [[], [["SP", 4, 0, 64, [4, 1, 2, 2], 1], ["SP", 4, 5, 4096, [2, 2, 1, 32], 1], ["SP", 4, 10, 576, [4, 4], 1], ["RE", 4, [0, 5, 1, 6, 2, 7, 10, 11, 3, 8, 12, 4, 9]], ["FSP", 5, 0, 0, 3], ["FSP", 5, 4, 1, 3], ["RE", 5, [0, 4, 1, 5, 2, 6, 3, 7]], ["CA", 4, 5, 5], ["CHR", 3, "shared", [4]], ["CA", 4, 5, 6], ["CI", 3], ["CHR", 1, "shared", [5]], ["CA", 2, 6, 6], ["CI", 1], ["FU", 7, [0, 1]], ["AN", 7, 0, 5], ["FU", 7, [1, 2]], ["AN", 7, 1, 4], ["FU", 7, [2, 3]], ["AN", 7, 2, 6], ["FU", 5, [0, 1]], ["SP", 5, 0, 64, [1], 1], ["AN", 5, 1, 2], ["FFSP", 5, 0, [1, 0], 1, 1], ["AN", 5, 1, 6], ["FU", 2, [0, 1]], ["SP", 2, 0, 32, [1], 1], ["AN", 2, 1, 2], ["FFSP", 2, 0, [1, 0], 1, 1], ["AN", 2, 1, 6], ["PR", 6, 0, "auto_unroll_max_step$16"]]]], "r": [[0.0127118], 0, 5.28216, 1661160347], "v": "v0.6"}
{"i": [["[\"get_expr\", \"fused_conv_expr_S1D1P1\", [64, 64, 8, 8, 64, 3, 3]]", "cuda -keys=cuda,gpu -max_num_threads=1024 -thread_warp_size=32", [-1, 16, 64, 49152, 2147483647, 1024, 8, 32], "", 0, []], [[], [["SP", 4, 0, 64, [1, 4, 1, 2], 1], ["SP", 4, 5, 4096, [1, 4, 32, 2], 1], ["SP", 4, 10, 576, [3, 8], 1], ["RE", 4, [0, 5, 1, 6, 2, 7, 10, 11, 3, 8, 12, 4, 9]], ["FSP", 5, 0, 0, 3], ["FSP", 5, 4, 1, 3], ["RE", 5, [0, 4, 1, 5, 2, 6, 3, 7]], ["CA", 4, 5, 5], ["CHR", 3, "shared", [4]], ["CA", 4, 5, 6], ["CI", 3], ["CHR", 1, "shared", [5]], ["CA", 2, 6, 6], ["CI", 1], ["FU", 7, [0, 1]], ["AN", 7, 0, 5], ["FU", 7, [1, 2]], ["AN", 7, 1, 4], ["FU", 7, [2, 3]], ["AN", 7, 2, 6], ["FU", 5, [0, 1]], ["SP", 5, 0, 48, [1], 1], ["AN", 5, 1, 2], ["FFSP", 5, 0, [1, 0], 1, 1], ["AN", 5, 1, 6], ["FU", 2, [0, 1]], ["SP", 2, 0, 1536, [1], 1], ["AN", 2, 1, 2], ["FFSP", 2, 0, [1, 0], 1, 1], ["AN", 2, 1, 6], ["PR", 6, 0, "auto_unroll_max_step$64"]]]], "r": [[0.0018841], 0, 2.6658, 1661160348], "v": "v0.6"}
{"i": [["[\"get_expr\", \"fused_conv_expr_S1D1P1\", [64, 64, 8, 8, 64, 3, 3]]", "cuda -keys=cuda,gpu -max_num_threads=1024 -thread_warp_size=32", [-1, 16, 64, 49152, 2147483647, 1024, 8, 32], "", 0, []], [[], [["SP", 4, 0, 64, [2, 2, 2, 8], 1], ["SP", 4, 5, 4096, [1, 128, 4, 2], 1], ["SP", 4, 10, 576, [2, 2], 1], ["RE", 4, [0, 5, 1, 6, 2, 7, 10, 11, 3, 8, 12, 4, 9]], ["FSP", 5, 0, 0, 3], ["FSP", 5, 4, 1, 3], ["RE", 5, [0, 4, 1, 5, 2, 6, 3, 7]], ["CA", 4, 5, 5], ["CHR", 3, "shared", [4]], ["CA", 4, 5, 6], ["CI", 3], ["CHR", 1, "shared", [5]], ["CA", 2, 6, 6], ["CI", 1], ["FU", 7, [0, 1]], ["AN", 7, 0, 5], ["FU", 7, [1, 2]], ["AN", 7, 1, 4], ["FU", 7, [2, 3]], ["AN", 7, 2, 6], ["FU", 5, [0, 1]], ["SP", 5, 0, 64, [32], 1], ["AN", 5, 1, 2], ["FFSP", 5, 0, [1, 0], 1, 1], ["AN", 5, 1, 6], ["FU", 2, [0, 1]], ["SP", 2, 0, 32, [2], 1], ["AN", 2, 1, 2], ["FFSP", 2, 0, [1, 0], 1, 1], ["AN", 2, 1, 6], ["PR", 6, 0, "auto_unroll_max_step$0"]]]], "r": [[0.00131126], 0, 3.33329, 1661160350], "v": "v0.6"}
{"i": [["[\"get_expr\", \"fused_conv_expr_S1D1P1\", [64, 64, 8, 8, 64, 3, 3]]", "cuda -keys=cuda,gpu -max_num_threads=1024 -thread_warp_size=32", [-1, 16, 64, 49152, 2147483647, 1024, 8, 32], "", 0, []], [[], [["SP", 4, 0, 64, [1, 1, 4, 8], 1], ["SP", 4, 5, 4096, [2, 32, 2, 2], 1], ["SP", 4, 10, 576, [3, 6], 1], ["RE", 4, [0, 5, 1, 6, 2, 7, 10, 11, 3, 8, 12, 4, 9]], ["FSP", 5, 0, 0, 3], ["FSP", 5, 4, 1, 3], ["RE", 5, [0, 4, 1, 5, 2, 6, 3, 7]], ["CA", 4, 5, 5], ["CHR", 3, "shared", [4]], ["CA", 4, 5, 6], ["CI", 3], ["CHR", 1, "shared", [5]], ["CA", 2, 6, 6], ["CI", 1], ["FU", 7, [0, 1]], ["AN", 7, 0, 5], ["FU", 7, [1, 2]], ["AN", 7, 1, 4], ["FU", 7, [2, 3]], ["AN", 7, 2, 6], ["FU", 5, [0, 1]], ["SP", 5, 0, 1152, [1], 1], ["AN", 5, 1, 2], ["FFSP", 5, 0, [1, 0], 1, 1], ["AN", 5, 1, 6], ["FU", 2, [0, 1]], ["SP", 2, 0, 72, [1], 1], ["AN", 2, 1, 2], ["FFSP", 2, 0, [1, 0], 1, 1], ["AN", 2, 1, 6], ["PR", 6, 0, "auto_unroll_max_step$0"]]]], "r": [[0.00147096], 0, 3.25667, 1661160351], "v": "v0.6"}
{"i": [["[\"get_expr\", \"fused_conv_expr_S1D1P1\", [64, 64, 8, 8, 64, 3, 3]]", "cuda -keys=cuda,gpu -max_num_threads=1024 -thread_warp_size=32", [-1, 16, 64, 49152, 2147483647, 1024, 8, 32], "", 0, []], [[], [["SP", 4, 0, 64, [1, 1, 8, 8], 1], ["SP", 4, 5, 4096, [1, 64, 1, 1], 1], ["SP", 4, 10, 576, [2, 18], 1], ["RE", 4, [0, 5, 1, 6, 2, 7, 10, 11, 3, 8, 12, 4, 9]], ["FSP", 5, 0, 0, 3], ["FSP", 5, 4, 1, 3], ["RE", 5, [0, 4, 1, 5, 2, 6, 3, 7]], ["CA", 4, 5, 5], ["CHR", 3, "shared", [4]], ["CA", 4, 5, 6], ["CI", 3], ["CHR", 1, "shared", [5]], ["CA", 2, 6, 6], ["CI", 1], ["FU", 7, [0, 1]], ["AN", 7, 0, 5], ["FU", 7, [1, 2]], ["AN", 7, 1, 4], ["FU", 7, [2, 3]], ["AN", 7, 2, 6], ["FU", 5, [0, 1]], ["SP", 5, 0, 576, [2], 1], ["AN", 5, 1, 2], ["FFSP", 5, 0, [1, 0], 1, 1], ["AN", 5, 1, 6], ["FU", 2, [0, 1]], ["SP", 2, 0, 36, [3], 1], ["AN", 2, 1, 2], ["FFSP", 2, 0, [1, 0], 1, 1], ["AN", 2, 1, 6], ["PR", 6, 0, "auto_unroll_max_step$1024"]]]], "r": [[0.000155549], 0, 4.54889, 1661160353], "v": "v0.6"}
{"i": [["[\"get_expr\", \"fused_conv_expr_S1D1P1\", [64, 64, 8, 8, 64, 3, 3]]", "cuda -keys=cuda,gpu -max_num_threads=1024 -thread_warp_size=32", [-1, 16, 64, 49152, 2147483647, 1024, 8, 32], "", 0, []], [[], [["SP", 4, 0, 64, [1, 2, 1, 16], 1], ["SP", 4, 5, 4096, [2, 16, 1, 1], 1], ["SP", 4, 10, 576, [18, 2], 1], ["RE", 4, [0, 5, 1, 6, 2, 7, 10, 11, 3, 8, 12, 4, 9]], ["FSP", 5, 0, 0, 3], ["FSP", 5, 4, 1, 3], ["RE", 5, [0, 4, 1, 5, 2, 6, 3, 7]], ["CA", 4, 5, 5], ["CHR", 3, "shared", [4]], ["CA", 4, 5, 6], ["CI", 3], ["CHR", 1, "shared", [5]], ["CA", 2, 6, 6], ["CI", 1], ["FU", 7, [0, 1]], ["AN", 7, 0, 5], ["FU", 7, [1, 2]], ["AN", 7, 1, 4], ["FU", 7, [2, 3]], ["AN", 7, 2, 6], ["FU", 5, [0, 1]], ["SP", 5, 0, 576, [1], 1], ["AN", 5, 1, 2], ["FFSP", 5, 0, [1, 0], 1, 1], ["AN", 5, 1, 6], ["FU", 2, [0, 1]], ["SP", 2, 0, 36, [1], 1], ["AN", 2, 1, 2], ["FFSP", 2, 0, [1, 0], 1, 1], ["AN", 2, 1, 6], ["PR", 6, 0, "auto_unroll_max_step$512"]]]], "r": [[6.43278e-05], 0, 2.65116, 1661160354], "v": "v0.6"}
{"i": [["[\"get_expr\", \"fused_conv_expr_S1D1P1\", [64, 64, 8, 8, 64, 3, 3]]", "cuda -keys=cuda,gpu -max_num_threads=1024 -thread_warp_size=32", [-1, 16, 64, 49152, 2147483647, 1024, 8, 32], "", 0, []], [[], [["SP", 4, 0, 64, [4, 2, 4, 1], 1], ["SP", 4, 5, 4096, [1, 256, 4, 2], 1], ["SP", 4, 10, 576, [1, 4], 1], ["RE", 4, [0, 5, 1, 6, 2, 7, 10, 11, 3, 8, 12, 4, 9]], ["FSP", 5, 0, 0, 3], ["FSP", 5, 4, 1, 3], ["RE", 5, [0, 4, 1, 5, 2, 6, 3, 7]], ["CA", 4, 5, 5], ["CHR", 3, "shared", [4]], ["CA", 4, 5, 6], ["CI", 3], ["CHR", 1, "shared", [5]], ["CA", 2, 6, 6], ["CI", 1], ["FU", 7, [0, 1]], ["AN", 7, 0, 5], ["FU", 7, [1, 2]], ["AN", 7, 1, 4], ["FU", 7, [2, 3]], ["AN", 7, 2, 6], ["FU", 5, [0, 1]], ["SP", 5, 0, 32, [1], 1], ["AN", 5, 1, 2], ["FFSP", 5, 0, [1, 0], 1, 1], ["AN", 5, 1, 6], ["FU", 2, [0, 1]], ["SP", 2, 0, 32, [1], 1], ["AN", 2, 1, 2], ["FFSP", 2, 0, [1, 0], 1, 1], ["AN", 2, 1, 6], ["PR", 6, 0, "auto_unroll_max_step$16"]]]], "r": [[0.00193661], 0, 3.59258, 1661160356], "v": "v0.6"}
{"i": [["[\"get_expr\", \"fused_conv_expr_S1D1P1\", [64, 64, 8, 8, 64, 3, 3]]", "cuda -keys=cuda,gpu -max_num_threads=1024 -thread_warp_size=32", [-1, 16, 64, 49152, 2147483647, 1024, 8, 32], "", 0, []], [[], [["SP", 4, 0, 64, [8, 1, 1, 4], 1], ["SP", 4, 5, 4096, [1, 4, 2, 4], 1], ["SP", 4, 10, 576, [1, 1], 1], ["RE", 4, [0, 5, 1, 6, 2, 7, 10, 11, 3, 8, 12, 4, 9]], ["FSP", 5, 0, 0, 3], ["FSP", 5, 4, 1, 3], ["RE", 5, [0, 4, 1, 5, 2, 6, 3, 7]], ["CA", 4, 5, 5], ["CHR", 3, "shared", [4]], ["CA", 4, 5, 6], ["CI", 3], ["CHR", 1, "shared", [5]], ["CA", 2, 6, 6], ["CI", 1], ["FU", 7, [0, 1]], ["AN", 7, 0, 5], ["FU", 7, [1, 2]], ["AN", 7, 1, 4], ["FU", 7, [2, 3]], ["AN", 7, 2, 6], ["FU", 5, [0, 1]], ["SP", 5, 0, 4, [1], 1], ["AN", 5, 1, 2], ["FFSP", 5, 0, [1, 0], 1, 1], ["AN", 5, 1, 6], ["FU", 2, [0, 1]], ["SP", 2, 0, 8, [2], 1], ["AN", 2, 1, 2], ["FFSP", 2, 0, [1, 0], 1, 1], ["AN", 2, 1, 6], ["PR", 6, 0, "auto_unroll_max_step$0"]]]], "r": [[0.000637418], 0, 3.79284, 1661160358], "v": "v0.6"}
{"i": [["[\"get_expr\", \"fused_conv_expr_S1D1P1\", [64, 64, 8, 8, 64, 3, 3]]", "cuda -keys=cuda,gpu -max_num_threads=1024 -thread_warp_size=32", [-1, 16, 64, 49152, 2147483647, 1024, 8, 32], "", 0, []], [[], [["SP", 4, 0, 64, [4, 4, 4, 1], 1], ["SP", 4, 5, 4096, [1, 64, 4, 1], 1], ["SP", 4, 10, 576, [18, 2], 1], ["RE", 4, [0, 5, 1, 6, 2, 7, 10, 11, 3, 8, 12, 4, 9]], ["FSP", 5, 0, 0, 3], ["FSP", 5, 4, 1, 3], ["RE", 5, [0, 4, 1, 5, 2, 6, 3, 7]], ["CA", 4, 5, 5], ["CHR", 3, "shared", [4]], ["CA", 4, 5, 6], ["CI", 3], ["CHR", 1, "shared", [5]], ["CA", 2, 6, 6], ["CI", 1], ["FU", 7, [0, 1]], ["AN", 7, 0, 5], ["FU", 7, [1, 2]], ["AN", 7, 1, 4], ["FU", 7, [2, 3]], ["AN", 7, 2, 6], ["FU", 5, [0, 1]], ["SP", 5, 0, 144, [1], 1], ["AN", 5, 1, 2], ["FFSP", 5, 0, [1, 0], 1, 1], ["AN", 5, 1, 6], ["FU", 2, [0, 1]], ["SP", 2, 0, 144, [3], 1], ["AN", 2, 1, 2], ["FFSP", 2, 0, [1, 0], 1, 1], ["AN", 2, 1, 6], ["PR", 6, 0, "auto_unroll_max_step$1024"]]]], "r": [[0.000181479], 0, 2.99543, 1661160360], "v": "v0.6"}
{"i": [["[\"get_expr\", \"fused_conv_expr_S1D1P1\", [64, 64, 8, 8, 64, 3, 3]]", "cuda -keys=cuda,gpu -max_num_threads=1024 -thread_warp_size=32", [-1, 16, 64, 49152, 2147483647, 1024, 8, 32], "", 0, []], [[], [["SP", 4, 0, 64, [2, 1, 4, 1], 1], ["SP", 4, 5, 4096, [4, 128, 1, 4], 1], ["SP", 4, 10, 576, [1, 2], 1], ["RE", 4, [0, 5, 1, 6, 2, 7, 10, 11, 3, 8, 12, 4, 9]], ["FSP", 5, 0, 0, 3], ["FSP", 5, 4, 1, 3], ["RE", 5, [0, 4, 1, 5, 2, 6, 3, 7]], ["CA", 4, 5, 5], ["CHR", 3, "shared", [4]], ["CA", 4, 5, 6], ["CI", 3], ["CHR", 1, "shared", [5]], ["CA", 2, 6, 6], ["CI", 1], ["FU", 7, [0, 1]], ["AN", 7, 0, 5], ["FU", 7, [1, 2]], ["AN", 7, 1, 4], ["FU", 7, [2, 3]], ["AN", 7, 2, 6], ["FU", 5, [0, 1]], ["SP", 5, 0, 16, [1], 1], ["AN", 5, 1, 2], ["FFSP", 5, 0, [1, 0], 1, 1], ["AN", 5, 1, 6], ["FU", 2, [0, 1]], ["SP", 2, 0, 8, [1], 1], ["AN", 2, 1, 2], ["FFSP", 2, 0, [1, 0], 1, 1], ["AN", 2, 1, 6], ["PR", 6, 0, "auto_unroll_max_step$1024"]]]], "r": [[0.00121222], 0, 3.21199, 1661160361], "v": "v0.6"}
{"i": [["[\"get_expr\", \"fused_conv_expr_S1D1P1\", [64, 64, 8, 8, 64, 3, 3]]", "cuda -keys=cuda,gpu -max_num_threads=1024 -thread_warp_size=32", [-1, 16, 64, 49152, 2147483647, 1024, 8, 32], "", 0, []], [[], [["SP", 4, 0, 64, [1, 2, 2, 1], 1], ["SP", 4, 5, 4096, [4, 16, 1, 2], 1], ["SP", 4, 10, 576, [12, 6], 1], ["RE", 4, [0, 5, 1, 6, 2, 7, 10, 11, 3, 8, 12, 4, 9]], ["FSP", 5, 0, 0, 3], ["FSP", 5, 4, 1, 3], ["RE", 5, [0, 4, 1, 5, 2, 6, 3, 7]], ["CA", 4, 5, 5], ["CHR", 3, "shared", [4]], ["CA", 4, 5, 6], ["CI", 3], ["CHR", 1, "shared", [5]], ["CA", 2, 6, 6], ["CI", 1], ["FU", 7, [0, 1]], ["AN", 7, 0, 5], ["FU", 7, [1, 2]], ["AN", 7, 1, 4], ["FU", 7, [2, 3]], ["AN", 7, 2, 6], ["FU", 5, [0, 1]], ["SP", 5, 0, 144, [1], 1], ["AN", 5, 1, 2], ["FFSP", 5, 0, [1, 0], 1, 1], ["AN", 5, 1, 6], ["FU", 2, [0, 1]], ["SP", 2, 0, 144, [1], 1], ["AN", 2, 1, 2], ["FFSP", 2, 0, [1, 0], 1, 1], ["AN", 2, 1, 6], ["PR", 6, 0, "auto_unroll_max_step$0"]]]], "r": [[0.00140269], 0, 1.88976, 1661160362], "v": "v0.6"}
{"i": [["[\"get_expr\", \"fused_conv_expr_S1D1P1\", [64, 64, 8, 8, 64, 3, 3]]", "cuda -keys=cuda,gpu -max_num_threads=1024 -thread_warp_size=32", [-1, 16, 64, 49152, 2147483647, 1024, 8, 32], "", 0, []], [[], [["SP", 4, 0, 64, [1, 1, 4, 2], 1], ["SP", 4, 5, 4096, [2, 32, 1, 1], 1], ["SP", 4, 10, 576, [12, 1], 1], ["RE", 4, [0, 5, 1, 6, 2, 7, 10, 11, 3, 8, 12, 4, 9]], ["FSP", 5, 0, 0, 3], ["FSP", 5, 4, 1, 3], ["RE", 5, [0, 4, 1, 5, 2, 6, 3, 7]], ["CA", 4, 5, 5], ["CHR", 3, "shared", [4]], ["CA", 4, 5, 6], ["CI", 3], ["CHR", 1, "shared", [5]], ["CA", 2, 6, 6], ["CI", 1], ["FU", 7, [0, 1]], ["AN", 7, 0, 5], ["FU", 7, [1, 2]], ["AN", 7, 1, 4], ["FU", 7, [2, 3]], ["AN", 7, 2, 6], ["FU", 5, [0, 1]], ["SP", 5, 0, 48, [1], 1], ["AN", 5, 1, 2], ["FFSP", 5, 0, [1, 0], 1, 1], ["AN", 5, 1, 6], ["FU", 2, [0, 1]], ["SP", 2, 0, 12, [1], 1], ["AN", 2, 1, 2], ["FFSP", 2, 0, [1, 0], 1, 1], ["AN", 2, 1, 6], ["PR", 6, 0, "auto_unroll_max_step$16"]]]], "r": [[0.000218458], 0, 2.49876, 1661160363], "v": "v0.6"}
{"i": [["[\"get_expr\", \"fused_conv_expr_S1D1P1\", [64, 64, 8, 8, 64, 3, 3]]", "cuda -keys=cuda,gpu -max_num_threads=1024 -thread_warp_size=32", [-1, 16, 64, 49152, 2147483647, 1024, 8, 32], "", 0, []], [[], [["SP", 4, 0, 64, [1, 1, 4, 2], 1], ["SP", 4, 5, 4096, [4, 128, 1, 4], 1], ["SP", 4, 10, 576, [1, 2], 1], ["RE", 4, [0, 5, 1, 6, 2, 7, 10, 11, 3, 8, 12, 4, 9]], ["FSP", 5, 0, 0, 3], ["FSP", 5, 4, 1, 3], ["RE", 5, [0, 4, 1, 5, 2, 6, 3, 7]], ["CA", 4, 5, 5], ["CHR", 3, "shared", [4]], ["CA", 4, 5, 6], ["CI", 3], ["CHR", 1, "shared", [5]], ["CA", 2, 6, 6], ["CI", 1], ["FU", 7, [0, 1]], ["AN", 7, 0, 5], ["FU", 7, [1, 2]], ["AN", 7, 1, 4], ["FU", 7, [2, 3]], ["AN", 7, 2, 6], ["FU", 5, [0, 1]], ["SP", 5, 0, 16, [1], 1], ["AN", 5, 1, 2], ["FFSP", 5, 0, [1, 0], 1, 1], ["AN", 5, 1, 6], ["FU", 2, [0, 1]], ["SP", 2, 0, 8, [8], 1], ["AN", 2, 1, 2], ["FFSP", 2, 0, [1, 0], 1, 1], ["AN", 2, 1, 6], ["PR", 6, 0, "auto_unroll_max_step$64"]]]], "r": [[0.000704955], 0, 2.85207, 1661160365], "v": "v0.6"}
{"i": [["[\"get_expr\", \"fused_conv_expr_S1D1P1\", [64, 64, 8, 8, 64, 3, 3]]", "cuda -keys=cuda,gpu -max_num_threads=1024 -thread_warp_size=32", [-1, 16, 64, 49152, 2147483647, 1024, 8, 32], "", 0, []], [[], [["SP", 4, 0, 64, [1, 2, 1, 8], 1], ["SP", 4, 5, 4096, [2, 16, 2, 4], 1], ["SP", 4, 10, 576, [24, 1], 1], ["RE", 4, [0, 5, 1, 6, 2, 7, 10, 11, 3, 8, 12, 4, 9]], ["FSP", 5, 0, 0, 3], ["FSP", 5, 4, 1, 3], ["RE", 5, [0, 4, 1, 5, 2, 6, 3, 7]], ["CA", 4, 5, 5], ["CHR", 3, "shared", [4]], ["CA", 4, 5, 6], ["CI", 3], ["CHR", 1, "shared", [5]], ["CA", 2, 6, 6], ["CI", 1], ["FU", 7, [0, 1]], ["AN", 7, 0, 5], ["FU", 7, [1, 2]], ["AN", 7, 1, 4], ["FU", 7, [2, 3]], ["AN", 7, 2, 6], ["FU", 5, [0, 1]], ["SP", 5, 0, 192, [8], 1], ["AN", 5, 1, 2], ["FFSP", 5, 0, [1, 0], 1, 1], ["AN", 5, 1, 6], ["FU", 2, [0, 1]], ["SP", 2, 0, 192, [1], 1], ["AN", 2, 1, 2], ["FFSP", 2, 0, [1, 0], 1, 1], ["AN", 2, 1, 6], ["PR", 6, 0, "auto_unroll_max_step$0"]]]], "r": [[0.00097299], 0, 2.59849, 1661160366], "v": "v0.6"}
{"i": [["[\"get_expr\", \"fused_conv_expr_S1D1P1\", [64, 64, 8, 8, 64, 3, 3]]", "cuda -keys=cuda,gpu -max_num_threads=1024 -thread_warp_size=32", [-1, 16, 64, 49152, 2147483647, 1024, 8, 32], "", 0, []], [[], [["SP", 4, 0, 64, [2, 32, 1, 1], 1], ["SP", 4, 5, 4096, [2, 2, 4, 4], 1], ["SP", 4, 10, 576, [18, 4], 1], ["RE", 4, [0, 5, 1, 6, 2, 7, 10, 11, 3, 8, 12, 4, 9]], ["FSP", 5, 0, 0, 3], ["FSP", 5, 4, 1, 3], ["RE", 5, [0, 4, 1, 5, 2, 6, 3, 7]], ["CA", 4, 5, 5], ["CHR", 3, "shared", [4]], ["CA", 4, 5, 6], ["CI", 3], ["CHR", 1, "shared", [5]], ["CA", 2, 6, 6], ["CI", 1], ["FU", 7, [0, 1]], ["AN", 7, 0, 5], ["FU", 7, [1, 2]], ["AN", 7, 1, 4], ["FU", 7, [2, 3]], ["AN", 7, 2, 6], ["FU", 5, [0, 1]], ["SP", 5, 0, 288, [1], 1], ["AN", 5, 1, 2], ["FFSP", 5, 0, [1, 0], 1, 1], ["AN", 5, 1, 6], ["FU", 2, [0, 1]], ["SP", 2, 0, 288, [12], 1], ["AN", 2, 1, 2], ["FFSP", 2, 0, [1, 0], 1, 1], ["AN", 2, 1, 6], ["PR", 6, 0, "auto_unroll_max_step$64"]]]], "r": [[0.000125699], 0, 2.73177, 1661160367], "v": "v0.6"}
{"i": [["[\"get_expr\", \"fused_conv_expr_S1D1P1\", [64, 64, 8, 8, 64, 3, 3]]", "cuda -keys=cuda,gpu -max_num_threads=1024 -thread_warp_size=32", [-1, 16, 64, 49152, 2147483647, 1024, 8, 32], "", 0, []], [[], [["SP", 4, 0, 64, [4, 4, 4, 1], 1], ["SP", 4, 5, 4096, [1, 64, 4, 1], 1], ["SP", 4, 10, 576, [18, 2], 1], ["RE", 4, [0, 5, 1, 6, 2, 7, 10, 11, 3, 8, 12, 4, 9]], ["FSP", 5, 0, 0, 3], ["FSP", 5, 4, 1, 3], ["RE", 5, [0, 4, 1, 5, 2, 6, 3, 7]], ["CA", 4, 5, 5], ["CHR", 3, "shared", [4]], ["CA", 4, 5, 6], ["CI", 3], ["CHR", 1, "shared", [5]], ["CA", 2, 6, 6], ["CI", 1], ["FU", 7, [0, 1]], ["AN", 7, 0, 5], ["FU", 7, [1, 2]], ["AN", 7, 1, 4], ["FU", 7, [2, 3]], ["AN", 7, 2, 6], ["FU", 5, [0, 1]], ["SP", 5, 0, 144, [48], 1], ["AN", 5, 1, 2], ["FFSP", 5, 0, [1, 0], 1, 1], ["AN", 5, 1, 6], ["FU", 2, [0, 1]], ["SP", 2, 0, 144, [1], 1], ["AN", 2, 1, 2], ["FFSP", 2, 0, [1, 0], 1, 1], ["AN", 2, 1, 6], ["PR", 6, 0, "auto_unroll_max_step$1024"]]]], "r": [[0.000157397], 0, 3.39381, 1661160369], "v": "v0.6"}
{"i": [["[\"get_expr\", \"fused_conv_expr_S1D1P1\", [64, 64, 8, 8, 64, 3, 3]]", "cuda -keys=cuda,gpu -max_num_threads=1024 -thread_warp_size=32", [-1, 16, 64, 49152, 2147483647, 1024, 8, 32], "", 0, []], [[], [["SP", 4, 0, 64, [1, 2, 2, 1], 1], ["SP", 4, 5, 4096, [4, 16, 1, 2], 1], ["SP", 4, 10, 576, [12, 6], 1], ["RE", 4, [0, 5, 1, 6, 2, 7, 10, 11, 3, 8, 12, 4, 9]], ["FSP", 5, 0, 0, 3], ["FSP", 5, 4, 1, 3], ["RE", 5, [0, 4, 1, 5, 2, 6, 3, 7]], ["CA", 4, 5, 5], ["CHR", 3, "shared", [4]], ["CA", 4, 5, 6], ["CI", 3], ["CHR", 1, "shared", [5]], ["CA", 2, 6, 6], ["CI", 1], ["FU", 7, [0, 1]], ["AN", 7, 0, 5], ["FU", 7, [1, 2]], ["AN", 7, 1, 4], ["FU", 7, [2, 3]], ["AN", 7, 2, 6], ["FU", 5, [0, 1]], ["SP", 5, 0, 144, [1], 1], ["AN", 5, 1, 2], ["FFSP", 5, 0, [1, 0], 1, 1], ["AN", 5, 1, 6], ["FU", 2, [0, 1]], ["SP", 2, 0, 144, [1], 1], ["AN", 2, 1, 2], ["FFSP", 2, 0, [1, 0], 1, 1], ["AN", 2, 1, 6], ["PR", 6, 0, "auto_unroll_max_step$1024"]]]], "r": [[0.000554839], 0, 7.41748, 1661160371], "v": "v0.6"}
{"i": [["[\"get_expr\", \"fused_conv_expr_S1D1P1\", [64, 64, 8, 8, 64, 3, 3]]", "cuda -keys=cuda,gpu -max_num_threads=1024 -thread_warp_size=32", [-1, 16, 64, 49152, 2147483647, 1024, 8, 32], "", 0, []], [[], [["SP", 4, 0, 64, [1, 2, 2, 16], 1], ["SP", 4, 5, 4096, [4, 64, 1, 1], 1], ["SP", 4, 10, 576, [8, 4], 1], ["RE", 4, [0, 5, 1, 6, 2, 7, 10, 11, 3, 8, 12, 4, 9]], ["FSP", 5, 0, 0, 3], ["FSP", 5, 4, 1, 3], ["RE", 5, [0, 4, 1, 5, 2, 6, 3, 7]], ["CA", 4, 5, 5], ["CHR", 3, "shared", [4]], ["CA", 4, 5, 6], ["CI", 3], ["CHR", 1, "shared", [5]], ["CA", 2, 6, 6], ["CI", 1], ["FU", 7, [0, 1]], ["AN", 7, 0, 5], ["FU", 7, [1, 2]], ["AN", 7, 1, 4], ["FU", 7, [2, 3]], ["AN", 7, 2, 6], ["FU", 5, [0, 1]], ["SP", 5, 0, 512, [1], 1], ["AN", 5, 1, 2], ["FFSP", 5, 0, [1, 0], 1, 1], ["AN", 5, 1, 6], ["FU", 2, [0, 1]], ["SP", 2, 0, 32, [1], 1], ["AN", 2, 1, 2], ["FFSP", 2, 0, [1, 0], 1, 1], ["AN", 2, 1, 6], ["PR", 6, 0, "auto_unroll_max_step$64"]]]], "r": [[0.000337789], 0, 4.169, 1661160373], "v": "v0.6"}
{"i": [["[\"get_expr\", \"fused_conv_expr_S1D1P1\", [64, 64, 8, 8, 64, 3, 3]]", "cuda -keys=cuda,gpu -max_num_threads=1024 -thread_warp_size=32", [-1, 16, 64, 49152, 2147483647, 1024, 8, 32], "", 0, []], [[], [["SP", 4, 0, 64, [8, 1, 1, 4], 1], ["SP", 4, 5, 4096, [1, 256, 2, 4], 1], ["SP", 4, 10, 576, [1, 1], 1], ["RE", 4, [0, 5, 1, 6, 2, 7, 10, 11, 3, 8, 12, 4, 9]], ["FSP", 5, 0, 0, 3], ["FSP", 5, 4, 1, 3], ["RE", 5, [0, 4, 1, 5, 2, 6, 3, 7]], ["CA", 4, 5, 5], ["CHR", 3, "shared", [4]], ["CA", 4, 5, 6], ["CI", 3], ["CHR", 1, "shared", [5]], ["CA", 2, 6, 6], ["CI", 1], ["FU", 7, [0, 1]], ["AN", 7, 0, 5], ["FU", 7, [1, 2]], ["AN", 7, 1, 4], ["FU", 7, [2, 3]], ["AN", 7, 2, 6], ["FU", 5, [0, 1]], ["SP", 5, 0, 4, [4], 1], ["AN", 5, 1, 2], ["FFSP", 5, 0, [1, 0], 1, 1], ["AN", 5, 1, 6], ["FU", 2, [0, 1]], ["SP", 2, 0, 8, [2], 1], ["AN", 2, 1, 2], ["FFSP", 2, 0, [1, 0], 1, 1], ["AN", 2, 1, 6], ["PR", 6, 0, "auto_unroll_max_step$0"]]]], "r": [[0.001331], 0, 2.71417, 1661160374], "v": "v0.6"}
{"i": [["[\"get_expr\", \"fused_conv_expr_S1D1P1\", [64, 64, 8, 8, 64, 3, 3]]", "cuda -keys=cuda,gpu -max_num_threads=1024 -thread_warp_size=32", [-1, 16, 64, 49152, 2147483647, 1024, 8, 32], "", 0, []], [[], [["SP", 4, 0, 64, [1, 16, 2, 2], 1], ["SP", 4, 5, 4096, [4, 32, 1, 1], 1], ["SP", 4, 10, 576, [9, 2], 1], ["RE", 4, [0, 5, 1, 6, 2, 7, 10, 11, 3, 8, 12, 4, 9]], ["FSP", 5, 0, 0, 3], ["FSP", 5, 4, 1, 3], ["RE", 5, [0, 4, 1, 5, 2, 6, 3, 7]], ["CA", 4, 5, 5], ["CHR", 3, "shared", [4]], ["CA", 4, 5, 6], ["CI", 3], ["CHR", 1, "shared", [5]], ["CA", 2, 6, 6], ["CI", 1], ["FU", 7, [0, 1]], ["AN", 7, 0, 5], ["FU", 7, [1, 2]], ["AN", 7, 1, 4], ["FU", 7, [2, 3]], ["AN", 7, 2, 6], ["FU", 5, [0, 1]], ["SP", 5, 0, 576, [4], 1], ["AN", 5, 1, 2], ["FFSP", 5, 0, [1, 0], 1, 1], ["AN", 5, 1, 6], ["FU", 2, [0, 1]], ["SP", 2, 0, 18, [3], 1], ["AN", 2, 1, 2], ["FFSP", 2, 0, [1, 0], 1, 1], ["AN", 2, 1, 6], ["PR", 6, 0, "auto_unroll_max_step$64"]]]], "r": [[8.65199e-05], 0, 2.41054, 1661160376], "v": "v0.6"}
{"i": [["[\"get_expr\", \"fused_conv_expr_S1D1P1\", [64, 64, 8, 8, 64, 3, 3]]", "cuda -keys=cuda,gpu -max_num_threads=1024 -thread_warp_size=32", [-1, 16, 64, 49152, 2147483647, 1024, 8, 32], "", 0, []], [[], [["SP", 4, 0, 64, [2, 32, 1, 1], 1], ["SP", 4, 5, 4096, [1, 8, 8, 4], 1], ["SP", 4, 10, 576, [4, 1], 1], ["RE", 4, [0, 5, 1, 6, 2, 7, 10, 11, 3, 8, 12, 4, 9]], ["FSP", 5, 0, 0, 3], ["FSP", 5, 4, 1, 3], ["RE", 5, [0, 4, 1, 5, 2, 6, 3, 7]], ["CA", 4, 5, 5], ["CHR", 3, "shared", [4]], ["CA", 4, 5, 6], ["CI", 3], ["CHR", 1, "shared", [5]], ["CA", 2, 6, 6], ["CI", 1], ["FU", 7, [0, 1]], ["AN", 7, 0, 5], ["FU", 7, [1, 2]], ["AN", 7, 1, 4], ["FU", 7, [2, 3]], ["AN", 7, 2, 6], ["FU", 5, [0, 1]], ["SP", 5, 0, 4, [1], 1], ["AN", 5, 1, 2], ["FFSP", 5, 0, [1, 0], 1, 1], ["AN", 5, 1, 6], ["FU", 2, [0, 1]], ["SP", 2, 0, 128, [1], 1], ["AN", 2, 1, 2], ["FFSP", 2, 0, [1, 0], 1, 1], ["AN", 2, 1, 6], ["PR", 6, 0, "auto_unroll_max_step$16"]]]], "r": [[0.000994287], 0, 2.90629, 1661160377], "v": "v0.6"}
{"i": [["[\"get_expr\", \"fused_conv_expr_S1D1P1\", [64, 64, 8, 8, 64, 3, 3]]", "cuda -keys=cuda,gpu -max_num_threads=1024 -thread_warp_size=32", [-1, 16, 64, 49152, 2147483647, 1024, 8, 32], "", 0, []], [[], [["SP", 4, 0, 64, [1, 2, 2, 1], 1], ["SP", 4, 5, 4096, [1, 32, 1, 4], 1], ["SP", 4, 10, 576, [3, 24], 1], ["RE", 4, [0, 5, 1, 6, 2, 7, 10, 11, 3, 8, 12, 4, 9]], ["FSP", 5, 0, 0, 3], ["FSP", 5, 4, 1, 3], ["RE", 5, [0, 4, 1, 5, 2, 6, 3, 7]], ["CA", 4, 5, 5], ["CHR", 3, "shared", [4]], ["CA", 4, 5, 6], ["CI", 3], ["CHR", 1, "shared", [5]], ["CA", 2, 6, 6], ["CI", 1], ["FU", 7, [0, 1]], ["AN", 7, 0, 5], ["FU", 7, [1, 2]], ["AN", 7, 1, 4], ["FU", 7, [2, 3]], ["AN", 7, 2, 6], ["FU", 5, [0, 1]], ["SP", 5, 0, 144, [1], 1], ["AN", 5, 1, 2], ["FFSP", 5, 0, [1, 0], 1, 1], ["AN", 5, 1, 6], ["FU", 2, [0, 1]], ["SP", 2, 0, 144, [1], 1], ["AN", 2, 1, 2], ["FFSP", 2, 0, [1, 0], 1, 1], ["AN", 2, 1, 6], ["PR", 6, 0, "auto_unroll_max_step$0"]]]], "r": [[0.000850969], 0, 2.61176, 1661160379], "v": "v0.6"}
{"i": [["[\"get_expr\", \"fused_conv_expr_S1D1P1\", [64, 64, 8, 8, 64, 3, 3]]", "cuda -keys=cuda,gpu -max_num_threads=1024 -thread_warp_size=32", [-1, 16, 64, 49152, 2147483647, 1024, 8, 32], "", 0, []], [[], [["SP", 4, 0, 64, [1, 16, 1, 2], 1], ["SP", 4, 5, 4096, [1, 8, 2, 16], 1], ["SP", 4, 10, 576, [24, 1], 1], ["RE", 4, [0, 5, 1, 6, 2, 7, 10, 11, 3, 8, 12, 4, 9]], ["FSP", 5, 0, 0, 3], ["FSP", 5, 4, 1, 3], ["RE", 5, [0, 4, 1, 5, 2, 6, 3, 7]], ["CA", 4, 5, 5], ["CHR", 3, "shared", [4]], ["CA", 4, 5, 6], ["CI", 3], ["CHR", 1, "shared", [5]], ["CA", 2, 6, 6], ["CI", 1], ["FU", 7, [0, 1]], ["AN", 7, 0, 5], ["FU", 7, [1, 2]], ["AN", 7, 1, 4], ["FU", 7, [2, 3]], ["AN", 7, 2, 6], ["FU", 5, [0, 1]], ["SP", 5, 0, 48, [1], 1], ["AN", 5, 1, 2], ["FFSP", 5, 0, [1, 0], 1, 1], ["AN", 5, 1, 6], ["FU", 2, [0, 1]], ["SP", 2, 0, 384, [1], 1], ["AN", 2, 1, 2], ["FFSP", 2, 0, [1, 0], 1, 1], ["AN", 2, 1, 6], ["PR", 6, 0, "auto_unroll_max_step$0"]]]], "r": [[0.000663141], 0, 3.4391, 1661160381], "v": "v0.6"}
{"i": [["[\"get_expr\", \"fused_conv_expr_S1D1P1\", [64, 64, 8, 8, 64, 3, 3]]", "cuda -keys=cuda,gpu -max_num_threads=1024 -thread_warp_size=32", [-1, 16, 64, 49152, 2147483647, 1024, 8, 32], "", 0, []], [[], [["SP", 4, 0, 64, [1, 1, 8, 8], 1], ["SP", 4, 5, 4096, [1, 128, 2, 1], 1], ["SP", 4, 10, 576, [1, 2], 1], ["RE", 4, [0, 5, 1, 6, 2, 7, 10, 11, 3, 8, 12, 4, 9]], ["FSP", 5, 0, 0, 3], ["FSP", 5, 4, 1, 3], ["RE", 5, [0, 4, 1, 5, 2, 6, 3, 7]], ["CA", 4, 5, 5], ["CHR", 3, "shared", [4]], ["CA", 4, 5, 6], ["CI", 3], ["CHR", 1, "shared", [5]], ["CA", 2, 6, 6], ["CI", 1], ["FU", 7, [0, 1]], ["AN", 7, 0, 5], ["FU", 7, [1, 2]], ["AN", 7, 1, 4], ["FU", 7, [2, 3]], ["AN", 7, 2, 6], ["FU", 5, [0, 1]], ["SP", 5, 0, 128, [8], 1], ["AN", 5, 1, 2], ["FFSP", 5, 0, [1, 0], 1, 1], ["AN", 5, 1, 6], ["FU", 2, [0, 1]], ["SP", 2, 0, 4, [1], 1], ["AN", 2, 1, 2], ["FFSP", 2, 0, [1, 0], 1, 1], ["AN", 2, 1, 6], ["PR", 6, 0, "auto_unroll_max_step$0"]]]], "r": [[0.000362216], 0, 4.09647, 1661160384], "v": "v0.6"}
{"i": [["[\"get_expr\", \"fused_conv_expr_S1D1P1\", [64, 64, 8, 8, 64, 3, 3]]", "cuda -keys=cuda,gpu -max_num_threads=1024 -thread_warp_size=32", [-1, 16, 64, 49152, 2147483647, 1024, 8, 32], "", 0, []], [[], [["SP", 4, 0, 64, [2, 2, 1, 1], 1], ["SP", 4, 5, 4096, [1, 32, 1, 8], 1], ["SP", 4, 10, 576, [4, 9], 1], ["RE", 4, [0, 5, 1, 6, 2, 7, 10, 11, 3, 8, 12, 4, 9]], ["FSP", 5, 0, 0, 3], ["FSP", 5, 4, 1, 3], ["RE", 5, [0, 4, 1, 5, 2, 6, 3, 7]], ["CA", 4, 5, 5], ["CHR", 3, "shared", [4]], ["CA", 4, 5, 6], ["CI", 3], ["CHR", 1, "shared", [5]], ["CA", 2, 6, 6], ["CI", 1], ["FU", 7, [0, 1]], ["AN", 7, 0, 5], ["FU", 7, [1, 2]], ["AN", 7, 1, 4], ["FU", 7, [2, 3]], ["AN", 7, 2, 6], ["FU", 5, [0, 1]], ["SP", 5, 0, 36, [1], 1], ["AN", 5, 1, 2], ["FFSP", 5, 0, [1, 0], 1, 1], ["AN", 5, 1, 6], ["FU", 2, [0, 1]], ["SP", 2, 0, 288, [1], 1], ["AN", 2, 1, 2], ["FFSP", 2, 0, [1, 0], 1, 1], ["AN", 2, 1, 6], ["PR", 6, 0, "auto_unroll_max_step$0"]]]], "r": [[0.000740861], 0, 2.29936, 1661160385], "v": "v0.6"}
{"i": [["[\"get_expr\", \"fused_conv_expr_S1D1P1\", [64, 64, 8, 8, 64, 3, 3]]", "cuda -keys=cuda,gpu -max_num_threads=1024 -thread_warp_size=32", [-1, 16, 64, 49152, 2147483647, 1024, 8, 32], "", 0, []], [[], [["SP", 4, 0, 64, [2, 2, 1, 1], 1], ["SP", 4, 5, 4096, [1, 32, 1, 4], 1], ["SP", 4, 10, 576, [36, 1], 1], ["RE", 4, [0, 5, 1, 6, 2, 7, 10, 11, 3, 8, 12, 4, 9]], ["FSP", 5, 0, 0, 3], ["FSP", 5, 4, 1, 3], ["RE", 5, [0, 4, 1, 5, 2, 6, 3, 7]], ["CA", 4, 5, 5], ["CHR", 3, "shared", [4]], ["CA", 4, 5, 6], ["CI", 3], ["CHR", 1, "shared", [5]], ["CA", 2, 6, 6], ["CI", 1], ["FU", 7, [0, 1]], ["AN", 7, 0, 5], ["FU", 7, [1, 2]], ["AN", 7, 1, 4], ["FU", 7, [2, 3]], ["AN", 7, 2, 6], ["FU", 5, [0, 1]], ["SP", 5, 0, 36, [1], 1], ["AN", 5, 1, 2], ["FFSP", 5, 0, [1, 0], 1, 1], ["AN", 5, 1, 6], ["FU", 2, [0, 1]], ["SP", 2, 0, 288, [1], 1], ["AN", 2, 1, 2], ["FFSP", 2, 0, [1, 0], 1, 1], ["AN", 2, 1, 6], ["PR", 6, 0, "auto_unroll_max_step$0"]]]], "r": [[0.000392309], 0, 2.27113, 1661160386], "v": "v0.6"}
{"i": [["[\"get_expr\", \"fused_conv_expr_S1D1P1\", [64, 64, 8, 8, 64, 3, 3]]", "cuda -keys=cuda,gpu -max_num_threads=1024 -thread_warp_size=32", [-1, 16, 64, 49152, 2147483647, 1024, 8, 32], "", 0, []], [[], [["SP", 4, 0, 64, [4, 8, 2, 1], 1], ["SP", 4, 5, 4096, [1, 1, 2, 32], 1], ["SP", 4, 10, 576, [8, 1], 1], ["RE", 4, [0, 5, 1, 6, 2, 7, 10, 11, 3, 8, 12, 4, 9]], ["FSP", 5, 0, 0, 3], ["FSP", 5, 4, 1, 3], ["RE", 5, [0, 4, 1, 5, 2, 6, 3, 7]], ["CA", 4, 5, 5], ["CHR", 3, "shared", [4]], ["CA", 4, 5, 6], ["CI", 3], ["CHR", 1, "shared", [5]], ["CA", 2, 6, 6], ["CI", 1], ["FU", 7, [0, 1]], ["AN", 7, 0, 5], ["FU", 7, [1, 2]], ["AN", 7, 1, 4], ["FU", 7, [2, 3]], ["AN", 7, 2, 6], ["FU", 5, [0, 1]], ["SP", 5, 0, 8, [1], 1], ["AN", 5, 1, 2], ["FFSP", 5, 0, [1, 0], 1, 1], ["AN", 5, 1, 6], ["FU", 2, [0, 1]], ["SP", 2, 0, 16, [4], 1], ["AN", 2, 1, 2], ["FFSP", 2, 0, [1, 0], 1, 1], ["AN", 2, 1, 6], ["PR", 6, 0, "auto_unroll_max_step$64"]]]], "r": [[0.00403793], 0, 5.22062, 1661160388], "v": "v0.6"}
{"i": [["[\"get_expr\", \"fused_conv_expr_S1D1P1\", [64, 64, 8, 8, 64, 3, 3]]", "cuda -keys=cuda,gpu -max_num_threads=1024 -thread_warp_size=32", [-1, 16, 64, 49152, 2147483647, 1024, 8, 32], "", 0, []], [[], [["SP", 4, 0, 64, [4, 8, 2, 1], 1], ["SP", 4, 5, 4096, [1, 16, 32, 1], 1], ["SP", 4, 10, 576, [1, 1], 1], ["RE", 4, [0, 5, 1, 6, 2, 7, 10, 11, 3, 8, 12, 4, 9]], ["FSP", 5, 0, 0, 3], ["FSP", 5, 4, 1, 3], ["RE", 5, [0, 4, 1, 5, 2, 6, 3, 7]], ["CA", 4, 5, 5], ["CHR", 3, "shared", [4]], ["CA", 4, 5, 6], ["CI", 3], ["CHR", 1, "shared", [5]], ["CA", 2, 6, 6], ["CI", 1], ["FU", 7, [0, 1]], ["AN", 7, 0, 5], ["FU", 7, [1, 2]], ["AN", 7, 1, 4], ["FU", 7, [2, 3]], ["AN", 7, 2, 6], ["FU", 5, [0, 1]], ["SP", 5, 0, 16, [1], 1], ["AN", 5, 1, 2], ["FFSP", 5, 0, [1, 0], 1, 1], ["AN", 5, 1, 6], ["FU", 2, [0, 1]], ["SP", 2, 0, 256, [1], 1], ["AN", 2, 1, 2], ["FFSP", 2, 0, [1, 0], 1, 1], ["AN", 2, 1, 6], ["PR", 6, 0, "auto_unroll_max_step$16"]]]], "r": [[0.00113639], 0, 2.39569, 1661160389], "v": "v0.6"}
{"i": [["[\"get_expr\", \"fused_conv_expr_S1D1P1\", [64, 64, 8, 8, 64, 3, 3]]", "cuda -keys=cuda,gpu -max_num_threads=1024 -thread_warp_size=32", [-1, 16, 64, 49152, 2147483647, 1024, 8, 32], "", 0, []], [[], [["SP", 4, 0, 64, [4, 16, 1, 1], 1], ["SP", 4, 5, 4096, [2, 16, 4, 1], 1], ["SP", 4, 10, 576, [2, 4], 1], ["RE", 4, [0, 5, 1, 6, 2, 7, 10, 11, 3, 8, 12, 4, 9]], ["FSP", 5, 0, 0, 3], ["FSP", 5, 4, 1, 3], ["RE", 5, [0, 4, 1, 5, 2, 6, 3, 7]], ["CA", 4, 5, 5], ["CHR", 3, "shared", [4]], ["CA", 4, 5, 6], ["CI", 3], ["CHR", 1, "shared", [5]], ["CA", 2, 6, 6], ["CI", 1], ["FU", 7, [0, 1]], ["AN", 7, 0, 5], ["FU", 7, [1, 2]], ["AN", 7, 1, 4], ["FU", 7, [2, 3]], ["AN", 7, 2, 6], ["FU", 5, [0, 1]], ["SP", 5, 0, 8, [1], 1], ["AN", 5, 1, 2], ["FFSP", 5, 0, [1, 0], 1, 1], ["AN", 5, 1, 6], ["FU", 2, [0, 1]], ["SP", 2, 0, 32, [8], 1], ["AN", 2, 1, 2], ["FFSP", 2, 0, [1, 0], 1, 1], ["AN", 2, 1, 6], ["PR", 6, 0, "auto_unroll_max_step$0"]]]], "r": [[0.00018956], 0, 2.87584, 1661160391], "v": "v0.6"}
{"i": [["[\"get_expr\", \"fused_conv_expr_S1D1P1\", [64, 64, 8, 8, 64, 3, 3]]", "cuda -keys=cuda,gpu -max_num_threads=1024 -thread_warp_size=32", [-1, 16, 64, 49152, 2147483647, 1024, 8, 32], "", 0, []], [[], [["SP", 4, 0, 64, [1, 2, 32, 1], 1], ["SP", 4, 5, 4096, [2, 64, 4, 1], 1], ["SP", 4, 10, 576, [1, 1], 1], ["RE", 4, [0, 5, 1, 6, 2, 7, 10, 11, 3, 8, 12, 4, 9]], ["FSP", 5, 0, 0, 3], ["FSP", 5, 4, 1, 3], ["RE", 5, [0, 4, 1, 5, 2, 6, 3, 7]], ["CA", 4, 5, 5], ["CHR", 3, "shared", [4]], ["CA", 4, 5, 6], ["CI", 3], ["CHR", 1, "shared", [5]], ["CA", 2, 6, 6], ["CI", 1], ["FU", 7, [0, 1]], ["AN", 7, 0, 5], ["FU", 7, [1, 2]], ["AN", 7, 1, 4], ["FU", 7, [2, 3]], ["AN", 7, 2, 6], ["FU", 5, [0, 1]], ["SP", 5, 0, 32, [32], 1], ["AN", 5, 1, 2], ["FFSP", 5, 0, [1, 0], 1, 1], ["AN", 5, 1, 6], ["FU", 2, [0, 1]], ["SP", 2, 0, 4, [4], 1], ["AN", 2, 1, 2], ["FFSP", 2, 0, [1, 0], 1, 1], ["AN", 2, 1, 6], ["PR", 6, 0, "auto_unroll_max_step$512"]]]], "r": [[0.00137065], 0, 3.32256, 1661160393], "v": "v0.6"}
{"i": [["[\"get_expr\", \"fused_conv_expr_S1D1P1\", [64, 64, 8, 8, 64, 3, 3]]", "cuda -keys=cuda,gpu -max_num_threads=1024 -thread_warp_size=32", [-1, 16, 64, 49152, 2147483647, 1024, 8, 32], "", 0, []], [[], [["SP", 4, 0, 64, [1, 64, 1, 1], 1], ["SP", 4, 5, 4096, [2, 4, 2, 8], 1], ["SP", 4, 10, 576, [9, 2], 1], ["RE", 4, [0, 5, 1, 6, 2, 7, 10, 11, 3, 8, 12, 4, 9]], ["FSP", 5, 0, 0, 3], ["FSP", 5, 4, 1, 3], ["RE", 5, [0, 4, 1, 5, 2, 6, 3, 7]], ["CA", 4, 5, 5], ["CHR", 3, "shared", [4]], ["CA", 4, 5, 6], ["CI", 3], ["CHR", 1, "shared", [5]], ["CA", 2, 6, 6], ["CI", 1], ["FU", 7, [0, 1]], ["AN", 7, 0, 5], ["FU", 7, [1, 2]], ["AN", 7, 1, 4], ["FU", 7, [2, 3]], ["AN", 7, 2, 6], ["FU", 5, [0, 1]], ["SP", 5, 0, 18, [1], 1], ["AN", 5, 1, 2], ["FFSP", 5, 0, [1, 0], 1, 1], ["AN", 5, 1, 6], ["FU", 2, [0, 1]], ["SP", 2, 0, 288, [1], 1], ["AN", 2, 1, 2], ["FFSP", 2, 0, [1, 0], 1, 1], ["AN", 2, 1, 6], ["PR", 6, 0, "auto_unroll_max_step$0"]]]], "r": [[0.000263756], 0, 3.26391, 1661160395], "v": "v0.6"}
{"i": [["[\"get_expr\", \"fused_conv_expr_S1D1P1\", [64, 64, 8, 8, 64, 3, 3]]", "cuda -keys=cuda,gpu -max_num_threads=1024 -thread_warp_size=32", [-1, 16, 64, 49152, 2147483647, 1024, 8, 32], "", 0, []], [[], [["SP", 4, 0, 64, [1, 16, 1, 4], 1], ["SP", 4, 5, 4096, [8, 2, 8, 2], 1], ["SP", 4, 10, 576, [8, 3], 1], ["RE", 4, [0, 5, 1, 6, 2, 7, 10, 11, 3, 8, 12, 4, 9]], ["FSP", 5, 0, 0, 3], ["FSP", 5, 4, 1, 3], ["RE", 5, [0, 4, 1, 5, 2, 6, 3, 7]], ["CA", 4, 5, 5], ["CHR", 3, "shared", [4]], ["CA", 4, 5, 6], ["CI", 3], ["CHR", 1, "shared", [5]], ["CA", 2, 6, 6], ["CI", 1], ["FU", 7, [0, 1]], ["AN", 7, 0, 5], ["FU", 7, [1, 2]], ["AN", 7, 1, 4], ["FU", 7, [2, 3]], ["AN", 7, 2, 6], ["FU", 5, [0, 1]], ["SP", 5, 0, 32, [1], 1], ["AN", 5, 1, 2], ["FFSP", 5, 0, [1, 0], 1, 1], ["AN", 5, 1, 6], ["FU", 2, [0, 1]], ["SP", 2, 0, 128, [8], 1], ["AN", 2, 1, 2], ["FFSP", 2, 0, [1, 0], 1, 1], ["AN", 2, 1, 6], ["PR", 6, 0, "auto_unroll_max_step$0"]]]], "r": [[0.00141749], 0, 5.1563, 1661160398], "v": "v0.6"}
{"i": [["[\"get_expr\", \"fused_conv_expr_S1D1P1\", [64, 64, 8, 8, 64, 3, 3]]", "cuda -keys=cuda,gpu -max_num_threads=1024 -thread_warp_size=32", [-1, 16, 64, 49152, 2147483647, 1024, 8, 32], "", 0, []], [[], [["SP", 4, 0, 64, [1, 16, 1, 2], 1], ["SP", 4, 5, 4096, [4, 4, 16, 1], 1], ["SP", 4, 10, 576, [3, 4], 1], ["RE", 4, [0, 5, 1, 6, 2, 7, 10, 11, 3, 8, 12, 4, 9]], ["FSP", 5, 0, 0, 3], ["FSP", 5, 4, 1, 3], ["RE", 5, [0, 4, 1, 5, 2, 6, 3, 7]], ["CA", 4, 5, 5], ["CHR", 3, "shared", [4]], ["CA", 4, 5, 6], ["CI", 3], ["CHR", 1, "shared", [5]], ["CA", 2, 6, 6], ["CI", 1], ["FU", 7, [0, 1]], ["AN", 7, 0, 5], ["FU", 7, [1, 2]], ["AN", 7, 1, 4], ["FU", 7, [2, 3]], ["AN", 7, 2, 6], ["FU", 5, [0, 1]], ["SP", 5, 0, 24, [1], 1], ["AN", 5, 1, 2], ["FFSP", 5, 0, [1, 0], 1, 1], ["AN", 5, 1, 6], ["FU", 2, [0, 1]], ["SP", 2, 0, 192, [32], 1], ["AN", 2, 1, 2], ["FFSP", 2, 0, [1, 0], 1, 1], ["AN", 2, 1, 6], ["PR", 6, 0, "auto_unroll_max_step$0"]]]], "r": [[0.00124223], 0, 3.23716, 1661160400], "v": "v0.6"}
{"i": [["[\"get_expr\", \"fused_conv_expr_S1D1P1\", [64, 64, 8, 8, 64, 3, 3]]", "cuda -keys=cuda,gpu -max_num_threads=1024 -thread_warp_size=32", [-1, 16, 64, 49152, 2147483647, 1024, 8, 32], "", 0, []], [[], [["SP", 4, 0, 64, [1, 16, 1, 2], 1], ["SP", 4, 5, 4096, [2, 8, 2, 8], 1], ["SP", 4, 10, 576, [12, 2], 1], ["RE", 4, [0, 5, 1, 6, 2, 7, 10, 11, 3, 8, 12, 4, 9]], ["FSP", 5, 0, 0, 3], ["FSP", 5, 4, 1, 3], ["RE", 5, [0, 4, 1, 5, 2, 6, 3, 7]], ["CA", 4, 5, 5], ["CHR", 3, "shared", [4]], ["CA", 4, 5, 6], ["CI", 3], ["CHR", 1, "shared", [5]], ["CA", 2, 6, 6], ["CI", 1], ["FU", 7, [0, 1]], ["AN", 7, 0, 5], ["FU", 7, [1, 2]], ["AN", 7, 1, 4], ["FU", 7, [2, 3]], ["AN", 7, 2, 6], ["FU", 5, [0, 1]], ["SP", 5, 0, 48, [1], 1], ["AN", 5, 1, 2], ["FFSP", 5, 0, [1, 0], 1, 1], ["AN", 5, 1, 6], ["FU", 2, [0, 1]], ["SP", 2, 0, 384, [1], 1], ["AN", 2, 1, 2], ["FFSP", 2, 0, [1, 0], 1, 1], ["AN", 2, 1, 6], ["PR", 6, 0, "auto_unroll_max_step$0"]]]], "r": [[0.000441288], 0, 2.92221, 1661160402], "v": "v0.6"}
{"i": [["[\"get_expr\", \"fused_conv_expr_S1D1P1\", [64, 64, 8, 8, 64, 3, 3]]", "cuda -keys=cuda,gpu -max_num_threads=1024 -thread_warp_size=32", [-1, 16, 64, 49152, 2147483647, 1024, 8, 32], "", 0, []], [[], [["SP", 4, 0, 64, [1, 8, 4, 2], 1], ["SP", 4, 5, 4096, [1, 4, 1, 8], 1], ["SP", 4, 10, 576, [6, 4], 1], ["RE", 4, [0, 5, 1, 6, 2, 7, 10, 11, 3, 8, 12, 4, 9]], ["FSP", 5, 0, 0, 3], ["FSP", 5, 4, 1, 3], ["RE", 5, [0, 4, 1, 5, 2, 6, 3, 7]], ["CA", 4, 5, 5], ["CHR", 3, "shared", [4]], ["CA", 4, 5, 6], ["CI", 3], ["CHR", 1, "shared", [5]], ["CA", 2, 6, 6], ["CI", 1], ["FU", 7, [0, 1]], ["AN", 7, 0, 5], ["FU", 7, [1, 2]], ["AN", 7, 1, 4], ["FU", 7, [2, 3]], ["AN", 7, 2, 6], ["FU", 5, [0, 1]], ["SP", 5, 0, 192, [1], 1], ["AN", 5, 1, 2], ["FFSP", 5, 0, [1, 0], 1, 1], ["AN", 5, 1, 6], ["FU", 2, [0, 1]], ["SP", 2, 0, 192, [4], 1], ["AN", 2, 1, 2], ["FFSP", 2, 0, [1, 0], 1, 1], ["AN", 2, 1, 6], ["PR", 6, 0, "auto_unroll_max_step$16"]]]], "r": [[0.000172866], 0, 3.84479, 1661160404], "v": "v0.6"}
{"i": [["[\"get_expr\", \"fused_conv_expr_S1D1P1\", [64, 64, 8, 8, 64, 3, 3]]", "cuda -keys=cuda,gpu -max_num_threads=1024 -thread_warp_size=32", [-1, 16, 64, 49152, 2147483647, 1024, 8, 32], "", 0, []], [[], [["SP", 4, 0, 64, [1, 16, 1, 2], 1], ["SP", 4, 5, 4096, [4, 2, 1, 1], 1], ["SP", 4, 10, 576, [24, 6], 1], ["RE", 4, [0, 5, 1, 6, 2, 7, 10, 11, 3, 8, 12, 4, 9]], ["FSP", 5, 0, 0, 3], ["FSP", 5, 4, 1, 3], ["RE", 5, [0, 4, 1, 5, 2, 6, 3, 7]], ["CA", 4, 5, 5], ["CHR", 3, "shared", [4]], ["CA", 4, 5, 6], ["CI", 3], ["CHR", 1, "shared", [5]], ["CA", 2, 6, 6], ["CI", 1], ["FU", 7, [0, 1]], ["AN", 7, 0, 5], ["FU", 7, [1, 2]], ["AN", 7, 1, 4], ["FU", 7, [2, 3]], ["AN", 7, 2, 6], ["FU", 5, [0, 1]], ["SP", 5, 0, 288, [1], 1], ["AN", 5, 1, 2], ["FFSP", 5, 0, [1, 0], 1, 1], ["AN", 5, 1, 6], ["FU", 2, [0, 1]], ["SP", 2, 0, 144, [9], 1], ["AN", 2, 1, 2], ["FFSP", 2, 0, [1, 0], 1, 1], ["AN", 2, 1, 6], ["PR", 6, 0, "auto_unroll_max_step$0"]]]], "r": [[0.00023689], 0, 2.85737, 1661160406], "v": "v0.6"}
{"i": [["[\"get_expr\", \"fused_conv_expr_S1D1P1\", [64, 64, 8, 8, 64, 3, 3]]", "cuda -keys=cuda,gpu -max_num_threads=1024 -thread_warp_size=32", [-1, 16, 64, 49152, 2147483647, 1024, 8, 32], "", 0, []], [[], [["SP", 4, 0, 64, [1, 16, 4, 1], 1], ["SP", 4, 5, 4096, [2, 8, 2, 8], 1], ["SP", 4, 10, 576, [12, 2], 1], ["RE", 4, [0, 5, 1, 6, 2, 7, 10, 11, 3, 8, 12, 4, 9]], ["FSP", 5, 0, 0, 3], ["FSP", 5, 4, 1, 3], ["RE", 5, [0, 4, 1, 5, 2, 6, 3, 7]], ["CA", 4, 5, 5], ["CHR", 3, "shared", [4]], ["CA", 4, 5, 6], ["CI", 3], ["CHR", 1, "shared", [5]], ["CA", 2, 6, 6], ["CI", 1], ["FU", 7, [0, 1]], ["AN", 7, 0, 5], ["FU", 7, [1, 2]], ["AN", 7, 1, 4], ["FU", 7, [2, 3]], ["AN", 7, 2, 6], ["FU", 5, [0, 1]], ["SP", 5, 0, 48, [1], 1], ["AN", 5, 1, 2], ["FFSP", 5, 0, [1, 0], 1, 1], ["AN", 5, 1, 6], ["FU", 2, [0, 1]], ["SP", 2, 0, 384, [8], 1], ["AN", 2, 1, 2], ["FFSP", 2, 0, [1, 0], 1, 1], ["AN", 2, 1, 6], ["PR", 6, 0, "auto_unroll_max_step$0"]]]], "r": [[0.000417485], 0, 4.01369, 1661160409], "v": "v0.6"}
{"i": [["[\"get_expr\", \"fused_conv_expr_S1D1P1\", [64, 64, 8, 8, 64, 3, 3]]", "cuda -keys=cuda,gpu -max_num_threads=1024 -thread_warp_size=32", [-1, 16, 64, 49152, 2147483647, 1024, 8, 32], "", 0, []], [[], [["SP", 4, 0, 64, [4, 1, 1, 16], 1], ["SP", 4, 5, 4096, [2, 16, 1, 1], 1], ["SP", 4, 10, 576, [6, 6], 1], ["RE", 4, [0, 5, 1, 6, 2, 7, 10, 11, 3, 8, 12, 4, 9]], ["FSP", 5, 0, 0, 3], ["FSP", 5, 4, 1, 3], ["RE", 5, [0, 4, 1, 5, 2, 6, 3, 7]], ["CA", 4, 5, 5], ["CHR", 3, "shared", [4]], ["CA", 4, 5, 6], ["CI", 3], ["CHR", 1, "shared", [5]], ["CA", 2, 6, 6], ["CI", 1], ["FU", 7, [0, 1]], ["AN", 7, 0, 5], ["FU", 7, [1, 2]], ["AN", 7, 1, 4], ["FU", 7, [2, 3]], ["AN", 7, 2, 6], ["FU", 5, [0, 1]], ["SP", 5, 0, 576, [1], 1], ["AN", 5, 1, 2], ["FFSP", 5, 0, [1, 0], 1, 1], ["AN", 5, 1, 6], ["FU", 2, [0, 1]], ["SP", 2, 0, 36, [1], 1], ["AN", 2, 1, 2], ["FFSP", 2, 0, [1, 0], 1, 1], ["AN", 2, 1, 6], ["PR", 6, 0, "auto_unroll_max_step$512"]]]], "r": [[0.000341954], 0, 5.14201, 1661160411], "v": "v0.6"}
{"i": [["[\"get_expr\", \"fused_conv_expr_S1D1P1\", [64, 64, 8, 8, 64, 3, 3]]", "cuda -keys=cuda,gpu -max_num_threads=1024 -thread_warp_size=32", [-1, 16, 64, 49152, 2147483647, 1024, 8, 32], "", 0, []], [[], [["SP", 4, 0, 64, [1, 2, 2, 1], 1], ["SP", 4, 5, 4096, [2, 64, 4, 1], 1], ["SP", 4, 10, 576, [1, 1], 1], ["RE", 4, [0, 5, 1, 6, 2, 7, 10, 11, 3, 8, 12, 4, 9]], ["FSP", 5, 0, 0, 3], ["FSP", 5, 4, 1, 3], ["RE", 5, [0, 4, 1, 5, 2, 6, 3, 7]], ["CA", 4, 5, 5], ["CHR", 3, "shared", [4]], ["CA", 4, 5, 6], ["CI", 3], ["CHR", 1, "shared", [5]], ["CA", 2, 6, 6], ["CI", 1], ["FU", 7, [0, 1]], ["AN", 7, 0, 5], ["FU", 7, [1, 2]], ["AN", 7, 1, 4], ["FU", 7, [2, 3]], ["AN", 7, 2, 6], ["FU", 5, [0, 1]], ["SP", 5, 0, 32, [32], 1], ["AN", 5, 1, 2], ["FFSP", 5, 0, [1, 0], 1, 1], ["AN", 5, 1, 6], ["FU", 2, [0, 1]], ["SP", 2, 0, 4, [1], 1], ["AN", 2, 1, 2], ["FFSP", 2, 0, [1, 0], 1, 1], ["AN", 2, 1, 6], ["PR", 6, 0, "auto_unroll_max_step$16"]]]], "r": [[0.000363833], 0, 2.66125, 1661160412], "v": "v0.6"}
{"i": [["[\"get_expr\", \"fused_conv_expr_S1D1P1\", [64, 64, 8, 8, 64, 3, 3]]", "cuda -keys=cuda,gpu -max_num_threads=1024 -thread_warp_size=32", [-1, 16, 64, 49152, 2147483647, 1024, 8, 32], "", 0, []], [[], [["SP", 4, 0, 64, [1, 4, 1, 1], 1], ["SP", 4, 5, 4096, [4, 16, 1, 2], 1], ["SP", 4, 10, 576, [12, 6], 1], ["RE", 4, [0, 5, 1, 6, 2, 7, 10, 11, 3, 8, 12, 4, 9]], ["FSP", 5, 0, 0, 3], ["FSP", 5, 4, 1, 3], ["RE", 5, [0, 4, 1, 5, 2, 6, 3, 7]], ["CA", 4, 5, 5], ["CHR", 3, "shared", [4]], ["CA", 4, 5, 6], ["CI", 3], ["CHR", 1, "shared", [5]], ["CA", 2, 6, 6], ["CI", 1], ["FU", 7, [0, 1]], ["AN", 7, 0, 5], ["FU", 7, [1, 2]], ["AN", 7, 1, 4], ["FU", 7, [2, 3]], ["AN", 7, 2, 6], ["FU", 5, [0, 1]], ["SP", 5, 0, 144, [3], 1], ["AN", 5, 1, 2], ["FFSP", 5, 0, [1, 0], 1, 1], ["AN", 5, 1, 6], ["FU", 2, [0, 1]], ["SP", 2, 0, 144, [9], 1], ["AN", 2, 1, 2], ["FFSP", 2, 0, [1, 0], 1, 1], ["AN", 2, 1, 6], ["PR", 6, 0, "auto_unroll_max_step$0"]]]], "r": [[0.000726052], 0, 2.53278, 1661160414], "v": "v0.6"}
{"i": [["[\"get_expr\", \"fused_conv_expr_S1D1P1\", [64, 64, 8, 8, 64, 3, 3]]", "cuda -keys=cuda,gpu -max_num_threads=1024 -thread_warp_size=32", [-1, 16, 64, 49152, 2147483647, 1024, 8, 32], "", 0, []], [[], [["SP", 4, 0, 64, [4, 4, 2, 1], 1], ["SP", 4, 5, 4096, [2, 32, 1, 4], 1], ["SP", 4, 10, 576, [2, 8], 1], ["RE", 4, [0, 5, 1, 6, 2, 7, 10, 11, 3, 8, 12, 4, 9]], ["FSP", 5, 0, 0, 3], ["FSP", 5, 4, 1, 3], ["RE", 5, [0, 4, 1, 5, 2, 6, 3, 7]], ["CA", 4, 5, 5], ["CHR", 3, "shared", [4]], ["CA", 4, 5, 6], ["CI", 3], ["CHR", 1, "shared", [5]], ["CA", 2, 6, 6], ["CI", 1], ["FU", 7, [0, 1]], ["AN", 7, 0, 5], ["FU", 7, [1, 2]], ["AN", 7, 1, 4], ["FU", 7, [2, 3]], ["AN", 7, 2, 6], ["FU", 5, [0, 1]], ["SP", 5, 0, 32, [8], 1], ["AN", 5, 1, 2], ["FFSP", 5, 0, [1, 0], 1, 1], ["AN", 5, 1, 6], ["FU", 2, [0, 1]], ["SP", 2, 0, 64, [1], 1], ["AN", 2, 1, 2], ["FFSP", 2, 0, [1, 0], 1, 1], ["AN", 2, 1, 6], ["PR", 6, 0, "auto_unroll_max_step$512"]]]], "r": [[0.000252526], 0, 4.9841, 1661160416], "v": "v0.6"}
{"i": [["[\"get_expr\", \"fused_conv_expr_S1D1P1\", [64, 64, 8, 8, 64, 3, 3]]", "cuda -keys=cuda,gpu -max_num_threads=1024 -thread_warp_size=32", [-1, 16, 64, 49152, 2147483647, 1024, 8, 32], "", 0, []], [[], [["SP", 4, 0, 64, [1, 2, 1, 1], 1], ["SP", 4, 5, 4096, [4, 2, 1, 16], 1], ["SP", 4, 10, 576, [32, 2], 1], ["RE", 4, [0, 5, 1, 6, 2, 7, 10, 11, 3, 8, 12, 4, 9]], ["FSP", 5, 0, 0, 3], ["FSP", 5, 4, 1, 3], ["RE", 5, [0, 4, 1, 5, 2, 6, 3, 7]], ["CA", 4, 5, 5], ["CHR", 3, "shared", [4]], ["CA", 4, 5, 6], ["CI", 3], ["CHR", 1, "shared", [5]], ["CA", 2, 6, 6], ["CI", 1], ["FU", 7, [0, 1]], ["AN", 7, 0, 5], ["FU", 7, [1, 2]], ["AN", 7, 1, 4], ["FU", 7, [2, 3]], ["AN", 7, 2, 6], ["FU", 5, [0, 1]], ["SP", 5, 0, 64, [1], 1], ["AN", 5, 1, 2], ["FFSP", 5, 0, [1, 0], 1, 1], ["AN", 5, 1, 6], ["FU", 2, [0, 1]], ["SP", 2, 0, 64, [1], 1], ["AN", 2, 1, 2], ["FFSP", 2, 0, [1, 0], 1, 1], ["AN", 2, 1, 6], ["PR", 6, 0, "auto_unroll_max_step$1024"]]]], "r": [[0.0151949], 0, 3.76729, 1661160418], "v": "v0.6"}
{"i": [["[\"get_expr\", \"fused_conv_expr_S1D1P1\", [64, 64, 8, 8, 64, 3, 3]]", "cuda -keys=cuda,gpu -max_num_threads=1024 -thread_warp_size=32", [-1, 16, 64, 49152, 2147483647, 1024, 8, 32], "", 0, []], [[], [["SP", 4, 0, 64, [2, 2, 1, 1], 1], ["SP", 4, 5, 4096, [1, 32, 1, 8], 1], ["SP", 4, 10, 576, [3, 12], 1], ["RE", 4, [0, 5, 1, 6, 2, 7, 10, 11, 3, 8, 12, 4, 9]], ["FSP", 5, 0, 0, 3], ["FSP", 5, 4, 1, 3], ["RE", 5, [0, 4, 1, 5, 2, 6, 3, 7]], ["CA", 4, 5, 5], ["CHR", 3, "shared", [4]], ["CA", 4, 5, 6], ["CI", 3], ["CHR", 1, "shared", [5]], ["CA", 2, 6, 6], ["CI", 1], ["FU", 7, [0, 1]], ["AN", 7, 0, 5], ["FU", 7, [1, 2]], ["AN", 7, 1, 4], ["FU", 7, [2, 3]], ["AN", 7, 2, 6], ["FU", 5, [0, 1]], ["SP", 5, 0, 36, [1], 1], ["AN", 5, 1, 2], ["FFSP", 5, 0, [1, 0], 1, 1], ["AN", 5, 1, 6], ["FU", 2, [0, 1]], ["SP", 2, 0, 288, [1], 1], ["AN", 2, 1, 2], ["FFSP", 2, 0, [1, 0], 1, 1], ["AN", 2, 1, 6], ["PR", 6, 0, "auto_unroll_max_step$0"]]]], "r": [[0.000734685], 0, 2.69551, 1661160420], "v": "v0.6"}
{"i": [["[\"get_expr\", \"fused_conv_expr_S1D1P1\", [64, 64, 8, 8, 64, 3, 3]]", "cuda -keys=cuda,gpu -max_num_threads=1024 -thread_warp_size=32", [-1, 16, 64, 49152, 2147483647, 1024, 8, 32], "", 0, []], [[], [["SP", 4, 0, 64, [1, 1, 8, 8], 1], ["SP", 4, 5, 4096, [2, 32, 2, 2], 1], ["SP", 4, 10, 576, [1, 18], 1], ["RE", 4, [0, 5, 1, 6, 2, 7, 10, 11, 3, 8, 12, 4, 9]], ["FSP", 5, 0, 0, 3], ["FSP", 5, 4, 1, 3], ["RE", 5, [0, 4, 1, 5, 2, 6, 3, 7]], ["CA", 4, 5, 5], ["CHR", 3, "shared", [4]], ["CA", 4, 5, 6], ["CI", 3], ["CHR", 1, "shared", [5]], ["CA", 2, 6, 6], ["CI", 1], ["FU", 7, [0, 1]], ["AN", 7, 0, 5], ["FU", 7, [1, 2]], ["AN", 7, 1, 4], ["FU", 7, [2, 3]], ["AN", 7, 2, 6], ["FU", 5, [0, 1]], ["SP", 5, 0, 1152, [16], 1], ["AN", 5, 1, 2], ["FFSP", 5, 0, [1, 0], 1, 1], ["AN", 5, 1, 6], ["FU", 2, [0, 1]], ["SP", 2, 0, 72, [1], 1], ["AN", 2, 1, 2], ["FFSP", 2, 0, [1, 0], 1, 1], ["AN", 2, 1, 6], ["PR", 6, 0, "auto_unroll_max_step$512"]]]], "r": [[0.000831511], 0, 5.72715, 1661160423], "v": "v0.6"}
{"i": [["[\"get_expr\", \"fused_conv_expr_S1D1P1\", [64, 64, 8, 8, 64, 3, 3]]", "cuda -keys=cuda,gpu -max_num_threads=1024 -thread_warp_size=32", [-1, 16, 64, 49152, 2147483647, 1024, 8, 32], "", 0, []], [[], [["SP", 4, 0, 64, [8, 1, 1, 1], 1], ["SP", 4, 5, 4096, [2, 2, 4, 1], 1], ["SP", 4, 10, 576, [1, 3], 1], ["RE", 4, [0, 5, 1, 6, 2, 7, 10, 11, 3, 8, 12, 4, 9]], ["FSP", 5, 0, 0, 3], ["FSP", 5, 4, 1, 3], ["RE", 5, [0, 4, 1, 5, 2, 6, 3, 7]], ["CA", 4, 5, 5], ["CHR", 3, "shared", [4]], ["CA", 4, 5, 6], ["CI", 3], ["CHR", 1, "shared", [5]], ["CA", 2, 6, 6], ["CI", 1], ["FU", 7, [0, 1]], ["AN", 7, 0, 5], ["FU", 7, [1, 2]], ["AN", 7, 1, 4], ["FU", 7, [2, 3]], ["AN", 7, 2, 6], ["FU", 5, [0, 1]], ["SP", 5, 0, 6, [1], 1], ["AN", 5, 1, 2], ["FFSP", 5, 0, [1, 0], 1, 1], ["AN", 5, 1, 6], ["FU", 2, [0, 1]], ["SP", 2, 0, 12, [1], 1], ["AN", 2, 1, 2], ["FFSP", 2, 0, [1, 0], 1, 1], ["AN", 2, 1, 6], ["PR", 6, 0, "auto_unroll_max_step$16"]]]], "r": [[0.0012011], 0, 2.31691, 1661160424], "v": "v0.6"}
{"i": [["[\"get_expr\", \"fused_conv_expr_S1D1P1\", [64, 64, 8, 8, 64, 3, 3]]", "cuda -keys=cuda,gpu -max_num_threads=1024 -thread_warp_size=32", [-1, 16, 64, 49152, 2147483647, 1024, 8, 32], "", 0, []], [[], [["SP", 4, 0, 64, [2, 4, 1, 8], 1], ["SP", 4, 5, 4096, [2, 64, 1, 1], 1], ["SP", 4, 10, 576, [64, 1], 1], ["RE", 4, [0, 5, 1, 6, 2, 7, 10, 11, 3, 8, 12, 4, 9]], ["FSP", 5, 0, 0, 3], ["FSP", 5, 4, 1, 3], ["RE", 5, [0, 4, 1, 5, 2, 6, 3, 7]], ["CA", 4, 5, 5], ["CHR", 3, "shared", [4]], ["CA", 4, 5, 6], ["CI", 3], ["CHR", 1, "shared", [5]], ["CA", 2, 6, 6], ["CI", 1], ["FU", 7, [0, 1]], ["AN", 7, 0, 5], ["FU", 7, [1, 2]], ["AN", 7, 1, 4], ["FU", 7, [2, 3]], ["AN", 7, 2, 6], ["FU", 5, [0, 1]], ["SP", 5, 0, 256, [1], 1], ["AN", 5, 1, 2], ["FFSP", 5, 0, [1, 0], 1, 1], ["AN", 5, 1, 6], ["FU", 2, [0, 1]], ["SP", 2, 0, 32, [1], 1], ["AN", 2, 1, 2], ["FFSP", 2, 0, [1, 0], 1, 1], ["AN", 2, 1, 6], ["PR", 6, 0, "auto_unroll_max_step$16"]]]], "r": [[0.000117911], 0, 2.38449, 1661160425], "v": "v0.6"}
{"i": [["[\"get_expr\", \"fused_conv_expr_S1D1P1\", [64, 64, 8, 8, 64, 3, 3]]", "cuda -keys=cuda,gpu -max_num_threads=1024 -thread_warp_size=32", [-1, 16, 64, 49152, 2147483647, 1024, 8, 32], "", 0, []], [[], [["SP", 4, 0, 64, [1, 1, 4, 8], 1], ["SP", 4, 5, 4096, [2, 32, 2, 2], 1], ["SP", 4, 10, 576, [1, 18], 1], ["RE", 4, [0, 5, 1, 6, 2, 7, 10, 11, 3, 8, 12, 4, 9]], ["FSP", 5, 0, 0, 3], ["FSP", 5, 4, 1, 3], ["RE", 5, [0, 4, 1, 5, 2, 6, 3, 7]], ["CA", 4, 5, 5], ["CHR", 3, "shared", [4]], ["CA", 4, 5, 6], ["CI", 3], ["CHR", 1, "shared", [5]], ["CA", 2, 6, 6], ["CI", 1], ["FU", 7, [0, 1]], ["AN", 7, 0, 5], ["FU", 7, [1, 2]], ["AN", 7, 1, 4], ["FU", 7, [2, 3]], ["AN", 7, 2, 6], ["FU", 5, [0, 1]], ["SP", 5, 0, 1152, [16], 1], ["AN", 5, 1, 2], ["FFSP", 5, 0, [1, 0], 1, 1], ["AN", 5, 1, 6], ["FU", 2, [0, 1]], ["SP", 2, 0, 72, [1], 1], ["AN", 2, 1, 2], ["FFSP", 2, 0, [1, 0], 1, 1], ["AN", 2, 1, 6], ["PR", 6, 0, "auto_unroll_max_step$0"]]]], "r": [[0.00155666], 0, 5.38221, 1661160429], "v": "v0.6"}
{"i": [["[\"get_expr\", \"fused_conv_expr_S1D1P1\", [64, 64, 8, 8, 64, 3, 3]]", "cuda -keys=cuda,gpu -max_num_threads=1024 -thread_warp_size=32", [-1, 16, 64, 49152, 2147483647, 1024, 8, 32], "", 0, []], [[], [["SP", 4, 0, 64, [1, 2, 8, 1], 1], ["SP", 4, 5, 4096, [2, 16, 2, 4], 1], ["SP", 4, 10, 576, [24, 1], 1], ["RE", 4, [0, 5, 1, 6, 2, 7, 10, 11, 3, 8, 12, 4, 9]], ["FSP", 5, 0, 0, 3], ["FSP", 5, 4, 1, 3], ["RE", 5, [0, 4, 1, 5, 2, 6, 3, 7]], ["CA", 4, 5, 5], ["CHR", 3, "shared", [4]], ["CA", 4, 5, 6], ["CI", 3], ["CHR", 1, "shared", [5]], ["CA", 2, 6, 6], ["CI", 1], ["FU", 7, [0, 1]], ["AN", 7, 0, 5], ["FU", 7, [1, 2]], ["AN", 7, 1, 4], ["FU", 7, [2, 3]], ["AN", 7, 2, 6], ["FU", 5, [0, 1]], ["SP", 5, 0, 192, [1], 1], ["AN", 5, 1, 2], ["FFSP", 5, 0, [1, 0], 1, 1], ["AN", 5, 1, 6], ["FU", 2, [0, 1]], ["SP", 2, 0, 192, [1], 1], ["AN", 2, 1, 2], ["FFSP", 2, 0, [1, 0], 1, 1], ["AN", 2, 1, 6], ["PR", 6, 0, "auto_unroll_max_step$0"]]]], "r": [[0.000853148], 0, 2.33246, 1661160430], "v": "v0.6"}
{"i": [["[\"get_expr\", \"fused_conv_expr_S1D1P1\", [64, 64, 8, 8, 64, 3, 3]]", "cuda -keys=cuda,gpu -max_num_threads=1024 -thread_warp_size=32", [-1, 16, 64, 49152, 2147483647, 1024, 8, 32], "", 0, []], [[], [["SP", 4, 0, 64, [1, 2, 8, 2], 1], ["SP", 4, 5, 4096, [1, 64, 1, 1], 1], ["SP", 4, 10, 576, [2, 18], 1], ["RE", 4, [0, 5, 1, 6, 2, 7, 10, 11, 3, 8, 12, 4, 9]], ["FSP", 5, 0, 0, 3], ["FSP", 5, 4, 1, 3], ["RE", 5, [0, 4, 1, 5, 2, 6, 3, 7]], ["CA", 4, 5, 5], ["CHR", 3, "shared", [4]], ["CA", 4, 5, 6], ["CI", 3], ["CHR", 1, "shared", [5]], ["CA", 2, 6, 6], ["CI", 1], ["FU", 7, [0, 1]], ["AN", 7, 0, 5], ["FU", 7, [1, 2]], ["AN", 7, 1, 4], ["FU", 7, [2, 3]], ["AN", 7, 2, 6], ["FU", 5, [0, 1]], ["SP", 5, 0, 576, [1], 1], ["AN", 5, 1, 2], ["FFSP", 5, 0, [1, 0], 1, 1], ["AN", 5, 1, 6], ["FU", 2, [0, 1]], ["SP", 2, 0, 36, [2], 1], ["AN", 2, 1, 2], ["FFSP", 2, 0, [1, 0], 1, 1], ["AN", 2, 1, 6], ["PR", 6, 0, "auto_unroll_max_step$512"]]]], "r": [[5.04296e-05], 0, 3.99615, 1661160432], "v": "v0.6"}
{"i": [["[\"get_expr\", \"fused_conv_expr_S1D1P1\", [64, 64, 8, 8, 64, 3, 3]]", "cuda -keys=cuda,gpu -max_num_threads=1024 -thread_warp_size=32", [-1, 16, 64, 49152, 2147483647, 1024, 8, 32], "", 0, []], [[], [["SP", 4, 0, 64, [1, 8, 4, 1], 1], ["SP", 4, 5, 4096, [8, 4, 4, 1], 1], ["SP", 4, 10, 576, [1, 36], 1], ["RE", 4, [0, 5, 1, 6, 2, 7, 10, 11, 3, 8, 12, 4, 9]], ["FSP", 5, 0, 0, 3], ["FSP", 5, 4, 1, 3], ["RE", 5, [0, 4, 1, 5, 2, 6, 3, 7]], ["CA", 4, 5, 5], ["CHR", 3, "shared", [4]], ["CA", 4, 5, 6], ["CI", 3], ["CHR", 1, "shared", [5]], ["CA", 2, 6, 6], ["CI", 1], ["FU", 7, [0, 1]], ["AN", 7, 0, 5], ["FU", 7, [1, 2]], ["AN", 7, 1, 4], ["FU", 7, [2, 3]], ["AN", 7, 2, 6], ["FU", 5, [0, 1]], ["SP", 5, 0, 144, [1], 1], ["AN", 5, 1, 2], ["FFSP", 5, 0, [1, 0], 1, 1], ["AN", 5, 1, 6], ["FU", 2, [0, 1]], ["SP", 2, 0, 144, [1], 1], ["AN", 2, 1, 2], ["FFSP", 2, 0, [1, 0], 1, 1], ["AN", 2, 1, 6], ["PR", 6, 0, "auto_unroll_max_step$0"]]]], "r": [[0.000699481], 0, 3.65627, 1661160434], "v": "v0.6"}
{"i": [["[\"get_expr\", \"fused_conv_expr_S1D1P1\", [64, 64, 8, 8, 64, 3, 3]]", "cuda -keys=cuda,gpu -max_num_threads=1024 -thread_warp_size=32", [-1, 16, 64, 49152, 2147483647, 1024, 8, 32], "", 0, []], [[], [["SP", 4, 0, 64, [1, 8, 1, 2], 1], ["SP", 4, 5, 4096, [1, 4, 64, 4], 1], ["SP", 4, 10, 576, [2, 4], 1], ["RE", 4, [0, 5, 1, 6, 2, 7, 10, 11, 3, 8, 12, 4, 9]], ["FSP", 5, 0, 0, 3], ["FSP", 5, 4, 1, 3], ["RE", 5, [0, 4, 1, 5, 2, 6, 3, 7]], ["CA", 4, 5, 5], ["CHR", 3, "shared", [4]], ["CA", 4, 5, 6], ["CI", 3], ["CHR", 1, "shared", [5]], ["CA", 2, 6, 6], ["CI", 1], ["FU", 7, [0, 1]], ["AN", 7, 0, 5], ["FU", 7, [1, 2]], ["AN", 7, 1, 4], ["FU", 7, [2, 3]], ["AN", 7, 2, 6], ["FU", 5, [0, 1]], ["SP", 5, 0, 16, [1], 1], ["AN", 5, 1, 2], ["FFSP", 5, 0, [1, 0], 1, 1], ["AN", 5, 1, 6], ["FU", 2, [0, 1]], ["SP", 2, 0, 2048, [1], 1], ["AN", 2, 1, 2], ["FFSP", 2, 0, [1, 0], 1, 1], ["AN", 2, 1, 6], ["PR", 6, 0, "auto_unroll_max_step$1024"]]]], "r": [[0.00461357], 0, 7.44423, 1661160436], "v": "v0.6"}
{"i": [["[\"get_expr\", \"fused_conv_expr_S1D1P1\", [64, 64, 8, 8, 64, 3, 3]]", "cuda -keys=cuda,gpu -max_num_threads=1024 -thread_warp_size=32", [-1, 16, 64, 49152, 2147483647, 1024, 8, 32], "", 0, []], [[], [["SP", 4, 0, 64, [2, 32, 1, 1], 1], ["SP", 4, 5, 4096, [4, 8, 2, 8], 1], ["SP", 4, 10, 576, [3, 1], 1], ["RE", 4, [0, 5, 1, 6, 2, 7, 10, 11, 3, 8, 12, 4, 9]], ["FSP", 5, 0, 0, 3], ["FSP", 5, 4, 1, 3], ["RE", 5, [0, 4, 1, 5, 2, 6, 3, 7]], ["CA", 4, 5, 5], ["CHR", 3, "shared", [4]], ["CA", 4, 5, 6], ["CI", 3], ["CHR", 1, "shared", [5]], ["CA", 2, 6, 6], ["CI", 1], ["FU", 7, [0, 1]], ["AN", 7, 0, 5], ["FU", 7, [1, 2]], ["AN", 7, 1, 4], ["FU", 7, [2, 3]], ["AN", 7, 2, 6], ["FU", 5, [0, 1]], ["SP", 5, 0, 9, [1], 1], ["AN", 5, 1, 2], ["FFSP", 5, 0, [1, 0], 1, 1], ["AN", 5, 1, 6], ["FU", 2, [0, 1]], ["SP", 2, 0, 576, [1], 1], ["AN", 2, 1, 2], ["FFSP", 2, 0, [1, 0], 1, 1], ["AN", 2, 1, 6], ["PR", 6, 0, "auto_unroll_max_step$0"]]]], "r": [[0.00104814], 0, 2.91978, 1661160438], "v": "v0.6"}
{"i": [["[\"get_expr\", \"fused_conv_expr_S1D1P1\", [64, 64, 8, 8, 64, 3, 3]]", "cuda -keys=cuda,gpu -max_num_threads=1024 -thread_warp_size=32", [-1, 16, 64, 49152, 2147483647, 1024, 8, 32], "", 0, []], [[], [["SP", 4, 0, 64, [8, 8, 1, 1], 1], ["SP", 4, 5, 4096, [1, 8, 8, 4], 1], ["SP", 4, 10, 576, [16, 1], 1], ["RE", 4, [0, 5, 1, 6, 2, 7, 10, 11, 3, 8, 12, 4, 9]], ["FSP", 5, 0, 0, 3], ["FSP", 5, 4, 1, 3], ["RE", 5, [0, 4, 1, 5, 2, 6, 3, 7]], ["CA", 4, 5, 5], ["CHR", 3, "shared", [4]], ["CA", 4, 5, 6], ["CI", 3], ["CHR", 1, "shared", [5]], ["CA", 2, 6, 6], ["CI", 1], ["FU", 7, [0, 1]], ["AN", 7, 0, 5], ["FU", 7, [1, 2]], ["AN", 7, 1, 4], ["FU", 7, [2, 3]], ["AN", 7, 2, 6], ["FU", 5, [0, 1]], ["SP", 5, 0, 4, [1], 1], ["AN", 5, 1, 2], ["FFSP", 5, 0, [1, 0], 1, 1], ["AN", 5, 1, 6], ["FU", 2, [0, 1]], ["SP", 2, 0, 128, [1], 1], ["AN", 2, 1, 2], ["FFSP", 2, 0, [1, 0], 1, 1], ["AN", 2, 1, 6], ["PR", 6, 0, "auto_unroll_max_step$16"]]]], "r": [[0.00115051], 0, 2.90656, 1661160440], "v": "v0.6"}
{"i": [["[\"get_expr\", \"fused_conv_expr_S1D1P1\", [64, 64, 8, 8, 64, 3, 3]]", "cuda -keys=cuda,gpu -max_num_threads=1024 -thread_warp_size=32", [-1, 16, 64, 49152, 2147483647, 1024, 8, 32], "", 0, []], [[], [["SP", 4, 0, 64, [2, 32, 1, 1], 1], ["SP", 4, 5, 4096, [1, 1, 4, 4], 1], ["SP", 4, 10, 576, [2, 2], 1], ["RE", 4, [0, 5, 1, 6, 2, 7, 10, 11, 3, 8, 12, 4, 9]], ["FSP", 5, 0, 0, 3], ["FSP", 5, 4, 1, 3], ["RE", 5, [0, 4, 1, 5, 2, 6, 3, 7]], ["CA", 4, 5, 5], ["CHR", 3, "shared", [4]], ["CA", 4, 5, 6], ["CI", 3], ["CHR", 1, "shared", [5]], ["CA", 2, 6, 6], ["CI", 1], ["FU", 7, [0, 1]], ["AN", 7, 0, 5], ["FU", 7, [1, 2]], ["AN", 7, 1, 4], ["FU", 7, [2, 3]], ["AN", 7, 2, 6], ["FU", 5, [0, 1]], ["SP", 5, 0, 4, [2], 1], ["AN", 5, 1, 2], ["FFSP", 5, 0, [1, 0], 1, 1], ["AN", 5, 1, 6], ["FU", 2, [0, 1]], ["SP", 2, 0, 64, [32], 1], ["AN", 2, 1, 2], ["FFSP", 2, 0, [1, 0], 1, 1], ["AN", 2, 1, 6], ["PR", 6, 0, "auto_unroll_max_step$64"]]]], "r": [[0.000398157], 0, 2.38376, 1661160441], "v": "v0.6"}
{"i": [["[\"get_expr\", \"fused_conv_expr_S1D1P1\", [64, 64, 8, 8, 64, 3, 3]]", "cuda -keys=cuda,gpu -max_num_threads=1024 -thread_warp_size=32", [-1, 16, 64, 49152, 2147483647, 1024, 8, 32], "", 0, []], [[], [["SP", 4, 0, 64, [1, 1, 8, 8], 1], ["SP", 4, 5, 4096, [2, 32, 2, 2], 1], ["SP", 4, 10, 576, [1, 18], 1], ["RE", 4, [0, 5, 1, 6, 2, 7, 10, 11, 3, 8, 12, 4, 9]], ["FSP", 5, 0, 0, 3], ["FSP", 5, 4, 1, 3], ["RE", 5, [0, 4, 1, 5, 2, 6, 3, 7]], ["CA", 4, 5, 5], ["CHR", 3, "shared", [4]], ["CA", 4, 5, 6], ["CI", 3], ["CHR", 1, "shared", [5]], ["CA", 2, 6, 6], ["CI", 1], ["FU", 7, [0, 1]], ["AN", 7, 0, 5], ["FU", 7, [1, 2]], ["AN", 7, 1, 4], ["FU", 7, [2, 3]], ["AN", 7, 2, 6], ["FU", 5, [0, 1]], ["SP", 5, 0, 1152, [1], 1], ["AN", 5, 1, 2], ["FFSP", 5, 0, [1, 0], 1, 1], ["AN", 5, 1, 6], ["FU", 2, [0, 1]], ["SP", 2, 0, 72, [1], 1], ["AN", 2, 1, 2], ["FFSP", 2, 0, [1, 0], 1, 1], ["AN", 2, 1, 6], ["PR", 6, 0, "auto_unroll_max_step$0"]]]], "r": [[0.0014846], 0, 2.75611, 1661160443], "v": "v0.6"}
{"i": [["[\"get_expr\", \"fused_conv_expr_S1D1P1\", [64, 64, 8, 8, 64, 3, 3]]", "cuda -keys=cuda,gpu -max_num_threads=1024 -thread_warp_size=32", [-1, 16, 64, 49152, 2147483647, 1024, 8, 32], "", 0, []], [[], [["SP", 4, 0, 64, [1, 8, 1, 2], 1], ["SP", 4, 5, 4096, [1, 4, 64, 4], 1], ["SP", 4, 10, 576, [8, 1], 1], ["RE", 4, [0, 5, 1, 6, 2, 7, 10, 11, 3, 8, 12, 4, 9]], ["FSP", 5, 0, 0, 3], ["FSP", 5, 4, 1, 3], ["RE", 5, [0, 4, 1, 5, 2, 6, 3, 7]], ["CA", 4, 5, 5], ["CHR", 3, "shared", [4]], ["CA", 4, 5, 6], ["CI", 3], ["CHR", 1, "shared", [5]], ["CA", 2, 6, 6], ["CI", 1], ["FU", 7, [0, 1]], ["AN", 7, 0, 5], ["FU", 7, [1, 2]], ["AN", 7, 1, 4], ["FU", 7, [2, 3]], ["AN", 7, 2, 6], ["FU", 5, [0, 1]], ["SP", 5, 0, 16, [1], 1], ["AN", 5, 1, 2], ["FFSP", 5, 0, [1, 0], 1, 1], ["AN", 5, 1, 6], ["FU", 2, [0, 1]], ["SP", 2, 0, 2048, [1], 1], ["AN", 2, 1, 2], ["FFSP", 2, 0, [1, 0], 1, 1], ["AN", 2, 1, 6], ["PR", 6, 0, "auto_unroll_max_step$16"]]]], "r": [[0.0077222], 0, 2.755, 1661160444], "v": "v0.6"}
{"i": [["[\"get_expr\", \"fused_conv_expr_S1D1P1\", [64, 64, 8, 8, 64, 3, 3]]", "cuda -keys=cuda,gpu -max_num_threads=1024 -thread_warp_size=32", [-1, 16, 64, 49152, 2147483647, 1024, 8, 32], "", 0, []], [[], [["SP", 4, 0, 64, [8, 1, 2, 1], 1], ["SP", 4, 5, 4096, [1, 16, 1, 16], 1], ["SP", 4, 10, 576, [8, 1], 1], ["RE", 4, [0, 5, 1, 6, 2, 7, 10, 11, 3, 8, 12, 4, 9]], ["FSP", 5, 0, 0, 3], ["FSP", 5, 4, 1, 3], ["RE", 5, [0, 4, 1, 5, 2, 6, 3, 7]], ["CA", 4, 5, 5], ["CHR", 3, "shared", [4]], ["CA", 4, 5, 6], ["CI", 3], ["CHR", 1, "shared", [5]], ["CA", 2, 6, 6], ["CI", 1], ["FU", 7, [0, 1]], ["AN", 7, 0, 5], ["FU", 7, [1, 2]], ["AN", 7, 1, 4], ["FU", 7, [2, 3]], ["AN", 7, 2, 6], ["FU", 5, [0, 1]], ["SP", 5, 0, 16, [1], 1], ["AN", 5, 1, 2], ["FFSP", 5, 0, [1, 0], 1, 1], ["AN", 5, 1, 6], ["FU", 2, [0, 1]], ["SP", 2, 0, 64, [64], 1], ["AN", 2, 1, 2], ["FFSP", 2, 0, [1, 0], 1, 1], ["AN", 2, 1, 6], ["PR", 6, 0, "auto_unroll_max_step$64"]]]], "r": [[0.00114384], 0, 4.18811, 1661160446], "v": "v0.6"}
{"i": [["[\"get_expr\", \"fused_conv_expr_S1D1P1\", [64, 64, 8, 8, 64, 3, 3]]", "cuda -keys=cuda,gpu -max_num_threads=1024 -thread_warp_size=32", [-1, 16, 64, 49152, 2147483647, 1024, 8, 32], "", 0, []], [[], [["SP", 4, 0, 64, [1, 16, 2, 1], 1], ["SP", 4, 5, 4096, [4, 4, 16, 1], 1], ["SP", 4, 10, 576, [3, 4], 1], ["RE", 4, [0, 5, 1, 6, 2, 7, 10, 11, 3, 8, 12, 4, 9]], ["FSP", 5, 0, 0, 3], ["FSP", 5, 4, 1, 3], ["RE", 5, [0, 4, 1, 5, 2, 6, 3, 7]], ["CA", 4, 5, 5], ["CHR", 3, "shared", [4]], ["CA", 4, 5, 6], ["CI", 3], ["CHR", 1, "shared", [5]], ["CA", 2, 6, 6], ["CI", 1], ["FU", 7, [0, 1]], ["AN", 7, 0, 5], ["FU", 7, [1, 2]], ["AN", 7, 1, 4], ["FU", 7, [2, 3]], ["AN", 7, 2, 6], ["FU", 5, [0, 1]], ["SP", 5, 0, 24, [1], 1], ["AN", 5, 1, 2], ["FFSP", 5, 0, [1, 0], 1, 1], ["AN", 5, 1, 6], ["FU", 2, [0, 1]], ["SP", 2, 0, 192, [1], 1], ["AN", 2, 1, 2], ["FFSP", 2, 0, [1, 0], 1, 1], ["AN", 2, 1, 6], ["PR", 6, 0, "auto_unroll_max_step$0"]]]], "r": [[0.00060386], 0, 4.50568, 1661160448], "v": "v0.6"}
{"i": [["[\"get_expr\", \"fused_conv_expr_S1D1P1\", [64, 64, 8, 8, 64, 3, 3]]", "cuda -keys=cuda,gpu -max_num_threads=1024 -thread_warp_size=32", [-1, 16, 64, 49152, 2147483647, 1024, 8, 32], "", 0, []], [[], [["SP", 4, 0, 64, [1, 16, 1, 4], 1], ["SP", 4, 5, 4096, [4, 4, 4, 32], 1], ["SP", 4, 10, 576, [2, 2], 1], ["RE", 4, [0, 5, 1, 6, 2, 7, 10, 11, 3, 8, 12, 4, 9]], ["FSP", 5, 0, 0, 3], ["FSP", 5, 4, 1, 3], ["RE", 5, [0, 4, 1, 5, 2, 6, 3, 7]], ["CA", 4, 5, 5], ["CHR", 3, "shared", [4]], ["CA", 4, 5, 6], ["CI", 3], ["CHR", 1, "shared", [5]], ["CA", 2, 6, 6], ["CI", 1], ["FU", 7, [0, 1]], ["AN", 7, 0, 5], ["FU", 7, [1, 2]], ["AN", 7, 1, 4], ["FU", 7, [2, 3]], ["AN", 7, 2, 6], ["FU", 5, [0, 1]], ["SP", 5, 0, 16, [1], 1], ["AN", 5, 1, 2], ["FFSP", 5, 0, [1, 0], 1, 1], ["AN", 5, 1, 6], ["FU", 2, [0, 1]], ["SP", 2, 0, 512, [1], 1], ["AN", 2, 1, 2], ["FFSP", 2, 0, [1, 0], 1, 1], ["AN", 2, 1, 6], ["PR", 6, 0, "auto_unroll_max_step$0"]]]], "r": [[0.0180224], 0, 5.15815, 1661160450], "v": "v0.6"}
{"i": [["[\"get_expr\", \"fused_conv_expr_S1D1P1\", [64, 64, 8, 8, 64, 3, 3]]", "cuda -keys=cuda,gpu -max_num_threads=1024 -thread_warp_size=32", [-1, 16, 64, 49152, 2147483647, 1024, 8, 32], "", 0, []], [[], [["SP", 4, 0, 64, [1, 2, 1, 16], 1], ["SP", 4, 5, 4096, [4, 64, 1, 1], 1], ["SP", 4, 10, 576, [8, 4], 1], ["RE", 4, [0, 5, 1, 6, 2, 7, 10, 11, 3, 8, 12, 4, 9]], ["FSP", 5, 0, 0, 3], ["FSP", 5, 4, 1, 3], ["RE", 5, [0, 4, 1, 5, 2, 6, 3, 7]], ["CA", 4, 5, 5], ["CHR", 3, "shared", [4]], ["CA", 4, 5, 6], ["CI", 3], ["CHR", 1, "shared", [5]], ["CA", 2, 6, 6], ["CI", 1], ["FU", 7, [0, 1]], ["AN", 7, 0, 5], ["FU", 7, [1, 2]], ["AN", 7, 1, 4], ["FU", 7, [2, 3]], ["AN", 7, 2, 6], ["FU", 5, [0, 1]], ["SP", 5, 0, 512, [1], 1], ["AN", 5, 1, 2], ["FFSP", 5, 0, [1, 0], 1, 1], ["AN", 5, 1, 6], ["FU", 2, [0, 1]], ["SP", 2, 0, 32, [1], 1], ["AN", 2, 1, 2], ["FFSP", 2, 0, [1, 0], 1, 1], ["AN", 2, 1, 6], ["PR", 6, 0, "auto_unroll_max_step$64"]]]], "r": [[0.000235278], 0, 3.08259, 1661160451], "v": "v0.6"}
{"i": [["[\"get_expr\", \"fused_conv_expr_S1D1P1\", [64, 64, 8, 8, 64, 3, 3]]", "cuda -keys=cuda,gpu -max_num_threads=1024 -thread_warp_size=32", [-1, 16, 64, 49152, 2147483647, 1024, 8, 32], "", 0, []], [[], [["SP", 4, 0, 64, [4, 1, 1, 4], 1], ["SP", 4, 5, 4096, [1, 128, 1, 8], 1], ["SP", 4, 10, 576, [1, 8], 1], ["RE", 4, [0, 5, 1, 6, 2, 7, 10, 11, 3, 8, 12, 4, 9]], ["FSP", 5, 0, 0, 3], ["FSP", 5, 4, 1, 3], ["RE", 5, [0, 4, 1, 5, 2, 6, 3, 7]], ["CA", 4, 5, 5], ["CHR", 3, "shared", [4]], ["CA", 4, 5, 6], ["CI", 3], ["CHR", 1, "shared", [5]], ["CA", 2, 6, 6], ["CI", 1], ["FU", 7, [0, 1]], ["AN", 7, 0, 5], ["FU", 7, [1, 2]], ["AN", 7, 1, 4], ["FU", 7, [2, 3]], ["AN", 7, 2, 6], ["FU", 5, [0, 1]], ["SP", 5, 0, 64, [1], 1], ["AN", 5, 1, 2], ["FFSP", 5, 0, [1, 0], 1, 1], ["AN", 5, 1, 6], ["FU", 2, [0, 1]], ["SP", 2, 0, 64, [1], 1], ["AN", 2, 1, 2], ["FFSP", 2, 0, [1, 0], 1, 1], ["AN", 2, 1, 6], ["PR", 6, 0, "auto_unroll_max_step$16"]]]], "r": [[0.0010433], 0, 2.27766, 1661160483], "v": "v0.6"}
