artifacts/microbenchmark/tvm/e2e/autotvm_log/batch_matmul_128_16_512_512_64.log
{"input": ["cuda -keys=cuda,gpu -max_num_threads=1024 -thread_warp_size=32", "batch_matmul.cuda", [["TENSOR", [2048, 512, 512], "float32"], ["TENSOR", [2048, 512, 64], "float32"], null, null, false, false], {}], "config": {"index": 75845, "code_hash": null, "entity": [["tile_y", "sp", [-1, 1, 1]], ["tile_x", "sp", [-1, 1, 2]], ["tile_k", "sp", [-1, 512]], ["auto_unroll_max_step", "ot", 8], ["unroll_explicit", "ot", 1]]}, "result": [[1.101189835], 0, 20.263702392578125, 1639305084.908699], "version": 0.2, "tvm_version": "0.8.0"}
{"input": ["cuda -keys=cuda,gpu -max_num_threads=1024 -thread_warp_size=32", "batch_matmul.cuda", [["TENSOR", [2048, 512, 512], "float32"], ["TENSOR", [2048, 512, 64], "float32"], null, null, false, false], {}], "config": {"index": 79523, "code_hash": null, "entity": [["tile_y", "sp", [-1, 8, 64]], ["tile_x", "sp", [-1, 16, 4]], ["tile_k", "sp", [-1, 2]], ["auto_unroll_max_step", "ot", 16], ["unroll_explicit", "ot", 1]]}, "result": [[0.069466311], 0, 16.16424584388733, 1639305101.2588758], "version": 0.2, "tvm_version": "0.8.0"}
{"input": ["cuda -keys=cuda,gpu -max_num_threads=1024 -thread_warp_size=32", "batch_matmul.cuda", [["TENSOR", [2048, 512, 512], "float32"], ["TENSOR", [2048, 512, 64], "float32"], null, null, false, false], {}], "config": {"index": 50290, "code_hash": null, "entity": [["tile_y", "sp", [-1, 2, 4]], ["tile_x", "sp", [-1, 1, 8]], ["tile_k", "sp", [-1, 4]], ["auto_unroll_max_step", "ot", 64], ["unroll_explicit", "ot", 0]]}, "result": [[0.12406770225], 0, 15.693865060806274, 1639305116.643413], "version": 0.2, "tvm_version": "0.8.0"}
{"input": ["cuda -keys=cuda,gpu -max_num_threads=1024 -thread_warp_size=32", "batch_matmul.cuda", [["TENSOR", [2048, 512, 512], "float32"], ["TENSOR", [2048, 512, 64], "float32"], null, null, false, false], {}], "config": {"index": 112303, "code_hash": null, "entity": [["tile_y", "sp", [-1, 8, 64]], ["tile_x", "sp", [-1, 1, 32]], ["tile_k", "sp", [-1, 4]], ["auto_unroll_max_step", "ot", 64], ["unroll_explicit", "ot", 1]]}, "result": [[1.1123919477500002], 0, 21.003453969955444, 1639305138.0060947], "version": 0.2, "tvm_version": "0.8.0"}
{"input": ["cuda -keys=cuda,gpu -max_num_threads=1024 -thread_warp_size=32", "batch_matmul.cuda", [["TENSOR", [2048, 512, 512], "float32"], ["TENSOR", [2048, 512, 64], "float32"], null, null, false, false], {}], "config": {"index": 96824, "code_hash": null, "entity": [["tile_y", "sp", [-1, 32, 4]], ["tile_x", "sp", [-1, 4, 16]], ["tile_k", "sp", [-1, 4]], ["auto_unroll_max_step", "ot", 32], ["unroll_explicit", "ot", 1]]}, "result": [[0.013447636624999999], 0, 15.392594575881958, 1639305153.9067078], "version": 0.2, "tvm_version": "0.8.0"}
{"input": ["cuda -keys=cuda,gpu -max_num_threads=1024 -thread_warp_size=32", "batch_matmul.cuda", [["TENSOR", [2048, 512, 512], "float32"], ["TENSOR", [2048, 512, 64], "float32"], null, null, false, false], {}], "config": {"index": 52193, "code_hash": null, "entity": [["tile_y", "sp", [-1, 2, 256]], ["tile_x", "sp", [-1, 4, 16]], ["tile_k", "sp", [-1, 8]], ["auto_unroll_max_step", "ot", 64], ["unroll_explicit", "ot", 0]]}, "result": [[0.941596094], 0, 19.816362142562866, 1639305173.3422248], "version": 0.2, "tvm_version": "0.8.0"}
{"input": ["cuda -keys=cuda,gpu -max_num_threads=1024 -thread_warp_size=32", "batch_matmul.cuda", [["TENSOR", [2048, 512, 512], "float32"], ["TENSOR", [2048, 512, 64], "float32"], null, null, false, false], {}], "config": {"index": 78563, "code_hash": null, "entity": [["tile_y", "sp", [-1, 16, 4]], ["tile_x", "sp", [-1, 1, 1]], ["tile_k", "sp", [-1, 2]], ["auto_unroll_max_step", "ot", 16], ["unroll_explicit", "ot", 1]]}, "result": [[0.398934268], 0, 16.836961030960083, 1639305191.3630238], "version": 0.2, "tvm_version": "0.8.0"}
{"input": ["cuda -keys=cuda,gpu -max_num_threads=1024 -thread_warp_size=32", "batch_matmul.cuda", [["TENSOR", [2048, 512, 512], "float32"], ["TENSOR", [2048, 512, 64], "float32"], null, null, false, false], {}], "config": {"index": 84606, "code_hash": null, "entity": [["tile_y", "sp", [-1, 64, 2]], ["tile_x", "sp", [-1, 2, 32]], ["tile_k", "sp", [-1, 16]], ["auto_unroll_max_step", "ot", 16], ["unroll_explicit", "ot", 1]]}, "result": [[0.017334881833333333], 0, 15.221705675125122, 1639305206.3118339], "version": 0.2, "tvm_version": "0.8.0"}
{"input": ["cuda -keys=cuda,gpu -max_num_threads=1024 -thread_warp_size=32", "batch_matmul.cuda", [["TENSOR", [2048, 512, 512], "float32"], ["TENSOR", [2048, 512, 64], "float32"], null, null, false, false], {}], "config": {"index": 40338, "code_hash": null, "entity": [["tile_y", "sp", [-1, 16, 4]], ["tile_x", "sp", [-1, 32, 1]], ["tile_k", "sp", [-1, 64]], ["auto_unroll_max_step", "ot", 32], ["unroll_explicit", "ot", 0]]}, "result": [[0.009394647272727274], 0, 14.733490467071533, 1639305221.526197], "version": 0.2, "tvm_version": "0.8.0"}
{"input": ["cuda -keys=cuda,gpu -max_num_threads=1024 -thread_warp_size=32", "batch_matmul.cuda", [["TENSOR", [2048, 512, 512], "float32"], ["TENSOR", [2048, 512, 64], "float32"], null, null, false, false], {}], "config": {"index": 108197, "code_hash": null, "entity": [["tile_y", "sp", [-1, 4, 2]], ["tile_x", "sp", [-1, 1, 2]], ["tile_k", "sp", [-1, 1]], ["auto_unroll_max_step", "ot", 64], ["unroll_explicit", "ot", 1]]}, "result": [[0.52165568475], 0, 17.599096536636353, 1639305238.8751774], "version": 0.2, "tvm_version": "0.8.0"}
{"input": ["cuda -keys=cuda,gpu -max_num_threads=1024 -thread_warp_size=32", "batch_matmul.cuda", [["TENSOR", [2048, 512, 512], "float32"], ["TENSOR", [2048, 512, 64], "float32"], null, null, false, false], {}], "config": {"index": 3327, "code_hash": null, "entity": [["tile_y", "sp", [-1, 1, 8]], ["tile_x", "sp", [-1, 16, 1]], ["tile_k", "sp", [-1, 4]], ["auto_unroll_max_step", "ot", 8], ["unroll_explicit", "ot", 0]]}, "result": [[0.03003412775], 0, 14.53006911277771, 1639305253.8628135], "version": 0.2, "tvm_version": "0.8.0"}
{"input": ["cuda -keys=cuda,gpu -max_num_threads=1024 -thread_warp_size=32", "batch_matmul.cuda", [["TENSOR", [2048, 512, 512], "float32"], ["TENSOR", [2048, 512, 64], "float32"], null, null, false, false], {}], "config": {"index": 55590, "code_hash": null, "entity": [["tile_y", "sp", [-1, 1, 32]], ["tile_x", "sp", [-1, 4, 1]], ["tile_k", "sp", [-1, 64]], ["auto_unroll_max_step", "ot", 64], ["unroll_explicit", "ot", 0]]}, "result": [[0.11232416625000001], 0, 15.554008483886719, 1639305269.102709], "version": 0.2, "tvm_version": "0.8.0"}
{"input": ["cuda -keys=cuda,gpu -max_num_threads=1024 -thread_warp_size=32", "batch_matmul.cuda", [["TENSOR", [2048, 512, 512], "float32"], ["TENSOR", [2048, 512, 64], "float32"], null, null, false, false], {}], "config": {"index": 80246, "code_hash": null, "entity": [["tile_y", "sp", [-1, 2, 1]], ["tile_x", "sp", [-1, 8, 1]], ["tile_k", "sp", [-1, 4]], ["auto_unroll_max_step", "ot", 16], ["unroll_explicit", "ot", 1]]}, "result": [[0.11457515275], 0, 15.412453413009644, 1639305285.008842], "version": 0.2, "tvm_version": "0.8.0"}
{"input": ["cuda -keys=cuda,gpu -max_num_threads=1024 -thread_warp_size=32", "batch_matmul.cuda", [["TENSOR", [2048, 512, 512], "float32"], ["TENSOR", [2048, 512, 64], "float32"], null, null, false, false], {}], "config": {"index": 18425, "code_hash": null, "entity": [["tile_y", "sp", [-1, 1, 1]], ["tile_x", "sp", [-1, 1, 64]], ["tile_k", "sp", [-1, 2]], ["auto_unroll_max_step", "ot", 16], ["unroll_explicit", "ot", 0]]}, "result": [[0.71735676], 0, 18.190147876739502, 1639305303.6882584], "version": 0.2, "tvm_version": "0.8.0"}
{"input": ["cuda -keys=cuda,gpu -max_num_threads=1024 -thread_warp_size=32", "batch_matmul.cuda", [["TENSOR", [2048, 512, 512], "float32"], ["TENSOR", [2048, 512, 64], "float32"], null, null, false, false], {}], "config": {"index": 55506, "code_hash": null, "entity": [["tile_y", "sp", [-1, 2, 2]], ["tile_x", "sp", [-1, 2, 1]], ["tile_k", "sp", [-1, 64]], ["auto_unroll_max_step", "ot", 64], ["unroll_explicit", "ot", 0]]}, "result": [[0.35462452475], 0, 16.79262089729309, 1639305320.1925669], "version": 0.2, "tvm_version": "0.8.0"}
{"input": ["cuda -keys=cuda,gpu -max_num_threads=1024 -thread_warp_size=32", "batch_matmul.cuda", [["TENSOR", [2048, 512, 512], "float32"], ["TENSOR", [2048, 512, 64], "float32"], null, null, false, false], {}], "config": {"index": 48228, "code_hash": null, "entity": [["tile_y", "sp", [-1, 8, 64]], ["tile_x", "sp", [-1, 2, 2]], ["tile_k", "sp", [-1, 2]], ["auto_unroll_max_step", "ot", 64], ["unroll_explicit", "ot", 0]]}, "result": [[0.4210221095], 0, 17.270005464553833, 1639305337.8301613], "version": 0.2, "tvm_version": "0.8.0"}
{"input": ["cuda -keys=cuda,gpu -max_num_threads=1024 -thread_warp_size=32", "batch_matmul.cuda", [["TENSOR", [2048, 512, 512], "float32"], ["TENSOR", [2048, 512, 64], "float32"], null, null, false, false], {}], "config": {"index": 104913, "code_hash": null, "entity": [["tile_y", "sp", [-1, 2, 8]], ["tile_x", "sp", [-1, 8, 1]], ["tile_k", "sp", [-1, 256]], ["auto_unroll_max_step", "ot", 32], ["unroll_explicit", "ot", 1]]}, "result": [[0.07404595500000001], 0, 15.456682920455933, 1639305352.9244914], "version": 0.2, "tvm_version": "0.8.0"}
{"input": ["cuda -keys=cuda,gpu -max_num_threads=1024 -thread_warp_size=32", "batch_matmul.cuda", [["TENSOR", [2048, 512, 512], "float32"], ["TENSOR", [2048, 512, 64], "float32"], null, null, false, false], {}], "config": {"index": 103364, "code_hash": null, "entity": [["tile_y", "sp", [-1, 1, 4]], ["tile_x", "sp", [-1, 8, 1]], ["tile_k", "sp", [-1, 128]], ["auto_unroll_max_step", "ot", 32], ["unroll_explicit", "ot", 1]]}, "result": [[0.0786653705], 0, 15.34401798248291, 1639305368.7264206], "version": 0.2, "tvm_version": "0.8.0"}
{"input": ["cuda -keys=cuda,gpu -max_num_threads=1024 -thread_warp_size=32", "batch_matmul.cuda", [["TENSOR", [2048, 512, 512], "float32"], ["TENSOR", [2048, 512, 64], "float32"], null, null, false, false], {}], "config": {"index": 79176, "code_hash": null, "entity": [["tile_y", "sp", [-1, 16, 8]], ["tile_x", "sp", [-1, 16, 2]], ["tile_k", "sp", [-1, 2]], ["auto_unroll_max_step", "ot", 16], ["unroll_explicit", "ot", 1]]}, "result": [[0.015283468428571428], 0, 15.132470846176147, 1639305385.0685194], "version": 0.2, "tvm_version": "0.8.0"}
{"input": ["cuda -keys=cuda,gpu -max_num_threads=1024 -thread_warp_size=32", "batch_matmul.cuda", [["TENSOR", [2048, 512, 512], "float32"], ["TENSOR", [2048, 512, 64], "float32"], null, null, false, false], {}], "config": {"index": 72305, "code_hash": null, "entity": [["tile_y", "sp", [-1, 2, 16]], ["tile_x", "sp", [-1, 2, 32]], ["tile_k", "sp", [-1, 64]], ["auto_unroll_max_step", "ot", 8], ["unroll_explicit", "ot", 1]]}, "result": [[2.00961663375], 0, 24.615036249160767, 1639305410.7244444], "version": 0.2, "tvm_version": "0.8.0"}
{"input": ["cuda -keys=cuda,gpu -max_num_threads=1024 -thread_warp_size=32", "batch_matmul.cuda", [["TENSOR", [2048, 512, 512], "float32"], ["TENSOR", [2048, 512, 64], "float32"], null, null, false, false], {}], "config": {"index": 33752, "code_hash": null, "entity": [["tile_y", "sp", [-1, 8, 16]], ["tile_x", "sp", [-1, 1, 32]], ["tile_k", "sp", [-1, 2]], ["auto_unroll_max_step", "ot", 32], ["unroll_explicit", "ot", 0]]}, "result": [[1.2546142487499998], 0, 21.199876070022583, 1639305431.4726396], "version": 0.2, "tvm_version": "0.8.0"}
{"input": ["cuda -keys=cuda,gpu -max_num_threads=1024 -thread_warp_size=32", "batch_matmul.cuda", [["TENSOR", [2048, 512, 512], "float32"], ["TENSOR", [2048, 512, 64], "float32"], null, null, false, false], {}], "config": {"index": 85834, "code_hash": null, "entity": [["tile_y", "sp", [-1, 1, 16]], ["tile_x", "sp", [-1, 4, 8]], ["tile_k", "sp", [-1, 32]], ["auto_unroll_max_step", "ot", 16], ["unroll_explicit", "ot", 1]]}, "result": [[0.044509637], 0, 15.276002407073975, 1639305447.1351273], "version": 0.2, "tvm_version": "0.8.0"}
{"input": ["cuda -keys=cuda,gpu -max_num_threads=1024 -thread_warp_size=32", "batch_matmul.cuda", [["TENSOR", [2048, 512, 512], "float32"], ["TENSOR", [2048, 512, 64], "float32"], null, null, false, false], {}], "config": {"index": 61620, "code_hash": null, "entity": [["tile_y", "sp", [-1, 2, 4]], ["tile_x", "sp", [-1, 1, 1]], ["tile_k", "sp", [-1, 1]], ["auto_unroll_max_step", "ot", 8], ["unroll_explicit", "ot", 1]]}, "result": [[0.9720272365], 0, 19.92798614501953, 1639305467.5014818], "version": 0.2, "tvm_version": "0.8.0"}
{"input": ["cuda -keys=cuda,gpu -max_num_threads=1024 -thread_warp_size=32", "batch_matmul.cuda", [["TENSOR", [2048, 512, 512], "float32"], ["TENSOR", [2048, 512, 64], "float32"], null, null, false, false], {}], "config": {"index": 83961, "code_hash": null, "entity": [["tile_y", "sp", [-1, 16, 8]], ["tile_x", "sp", [-1, 2, 4]], ["tile_k", "sp", [-1, 16]], ["auto_unroll_max_step", "ot", 16], ["unroll_explicit", "ot", 1]]}, "result": [[0.038476754749999995], 0, 15.500696182250977, 1639305482.7262468], "version": 0.2, "tvm_version": "0.8.0"}
{"input": ["cuda -keys=cuda,gpu -max_num_threads=1024 -thread_warp_size=32", "batch_matmul.cuda", [["TENSOR", [2048, 512, 512], "float32"], ["TENSOR", [2048, 512, 64], "float32"], null, null, false, false], {}], "config": {"index": 57669, "code_hash": null, "entity": [["tile_y", "sp", [-1, 4, 8]], ["tile_x", "sp", [-1, 32, 2]], ["tile_k", "sp", [-1, 128]], ["auto_unroll_max_step", "ot", 64], ["unroll_explicit", "ot", 0]]}, "result": [[0.007892771307692307], 0, 14.83139681816101, 1639305498.0692105], "version": 0.2, "tvm_version": "0.8.0"}
{"input": ["cuda -keys=cuda,gpu -max_num_threads=1024 -thread_warp_size=32", "batch_matmul.cuda", [["TENSOR", [2048, 512, 512], "float32"], ["TENSOR", [2048, 512, 64], "float32"], null, null, false, false], {}], "config": {"index": 66406, "code_hash": null, "entity": [["tile_y", "sp", [-1, 4, 4]], ["tile_x", "sp", [-1, 8, 1]], ["tile_k", "sp", [-1, 8]], ["auto_unroll_max_step", "ot", 8], ["unroll_explicit", "ot", 1]]}, "result": [[0.028401271999999998], 0, 15.606996536254883, 1639305513.3958], "version": 0.2, "tvm_version": "0.8.0"}
{"input": ["cuda -keys=cuda,gpu -max_num_threads=1024 -thread_warp_size=32", "batch_matmul.cuda", [["TENSOR", [2048, 512, 512], "float32"], ["TENSOR", [2048, 512, 64], "float32"], null, null, false, false], {}], "config": {"index": 17313, "code_hash": null, "entity": [["tile_y", "sp", [-1, 8, 32]], ["tile_x", "sp", [-1, 64, 1]], ["tile_k", "sp", [-1, 2]], ["auto_unroll_max_step", "ot", 16], ["unroll_explicit", "ot", 0]]}, "result": [[0.022832253833333333], 0, 15.115689039230347, 1639305528.9584491], "version": 0.2, "tvm_version": "0.8.0"}
{"input": ["cuda -keys=cuda,gpu -max_num_threads=1024 -thread_warp_size=32", "batch_matmul.cuda", [["TENSOR", [2048, 512, 512], "float32"], ["TENSOR", [2048, 512, 64], "float32"], null, null, false, false], {}], "config": {"index": 3631, "code_hash": null, "entity": [["tile_y", "sp", [-1, 2, 1]], ["tile_x", "sp", [-1, 8, 2]], ["tile_k", "sp", [-1, 4]], ["auto_unroll_max_step", "ot", 8], ["unroll_explicit", "ot", 0]]}, "result": [[0.07423502725], 0, 15.477648496627808, 1639305544.1673877], "version": 0.2, "tvm_version": "0.8.0"}
{"input": ["cuda -keys=cuda,gpu -max_num_threads=1024 -thread_warp_size=32", "batch_matmul.cuda", [["TENSOR", [2048, 512, 512], "float32"], ["TENSOR", [2048, 512, 64], "float32"], null, null, false, false], {}], "config": {"index": 74773, "code_hash": null, "entity": [["tile_y", "sp", [-1, 2, 8]], ["tile_x", "sp", [-1, 4, 4]], ["tile_k", "sp", [-1, 256]], ["auto_unroll_max_step", "ot", 8], ["unroll_explicit", "ot", 1]]}, "result": [[0.0684930465], 0, 15.671604871749878, 1639305560.2913616], "version": 0.2, "tvm_version": "0.8.0"}
{"input": ["cuda -keys=cuda,gpu -max_num_threads=1024 -thread_warp_size=32", "batch_matmul.cuda", [["TENSOR", [2048, 512, 512], "float32"], ["TENSOR", [2048, 512, 64], "float32"], null, null, false, false], {}], "config": {"index": 108356, "code_hash": null, "entity": [["tile_y", "sp", [-1, 64, 1]], ["tile_x", "sp", [-1, 8, 2]], ["tile_k", "sp", [-1, 1]], ["auto_unroll_max_step", "ot", 64], ["unroll_explicit", "ot", 1]]}, "result": [[0.06323963475], 0, 15.317870616912842, 1639305576.0739596], "version": 0.2, "tvm_version": "0.8.0"}
{"input": ["cuda -keys=cuda,gpu -max_num_threads=1024 -thread_warp_size=32", "batch_matmul.cuda", [["TENSOR", [2048, 512, 512], "float32"], ["TENSOR", [2048, 512, 64], "float32"], null, null, false, false], {}], "config": {"index": 34508, "code_hash": null, "entity": [["tile_y", "sp", [-1, 16, 4]], ["tile_x", "sp", [-1, 16, 2]], ["tile_k", "sp", [-1, 4]], ["auto_unroll_max_step", "ot", 32], ["unroll_explicit", "ot", 0]]}, "result": [[0.011571168555555556], 0, 15.153667688369751, 1639305591.7395408], "version": 0.2, "tvm_version": "0.8.0"}
{"input": ["cuda -keys=cuda,gpu -max_num_threads=1024 -thread_warp_size=32", "batch_matmul.cuda", [["TENSOR", [2048, 512, 512], "float32"], ["TENSOR", [2048, 512, 64], "float32"], null, null, false, false], {}], "config": {"index": 24262, "code_hash": null, "entity": [["tile_y", "sp", [-1, 128, 1]], ["tile_x", "sp", [-1, 8, 8]], ["tile_k", "sp", [-1, 32]], ["auto_unroll_max_step", "ot", 16], ["unroll_explicit", "ot", 0]]}, "result": [[0.02482222066666667], 0, 15.235843420028687, 1639305607.4753876], "version": 0.2, "tvm_version": "0.8.0"}
{"input": ["cuda -keys=cuda,gpu -max_num_threads=1024 -thread_warp_size=32", "batch_matmul.cuda", [["TENSOR", [2048, 512, 512], "float32"], ["TENSOR", [2048, 512, 64], "float32"], null, null, false, false], {}], "config": {"index": 113423, "code_hash": null, "entity": [["tile_y", "sp", [-1, 8, 2]], ["tile_x", "sp", [-1, 1, 8]], ["tile_k", "sp", [-1, 8]], ["auto_unroll_max_step", "ot", 64], ["unroll_explicit", "ot", 1]]}, "result": [[0.08021955525], 0, 15.469148874282837, 1639305622.6820483], "version": 0.2, "tvm_version": "0.8.0"}
{"input": ["cuda -keys=cuda,gpu -max_num_threads=1024 -thread_warp_size=32", "batch_matmul.cuda", [["TENSOR", [2048, 512, 512], "float32"], ["TENSOR", [2048, 512, 64], "float32"], null, null, false, false], {}], "config": {"index": 50131, "code_hash": null, "entity": [["tile_y", "sp", [-1, 128, 4]], ["tile_x", "sp", [-1, 4, 4]], ["tile_k", "sp", [-1, 4]], ["auto_unroll_max_step", "ot", 64], ["unroll_explicit", "ot", 0]]}, "result": [[0.016130683714285714], 0, 15.136838912963867, 1639305638.3252645], "version": 0.2, "tvm_version": "0.8.0"}
{"input": ["cuda -keys=cuda,gpu -max_num_threads=1024 -thread_warp_size=32", "batch_matmul.cuda", [["TENSOR", [2048, 512, 512], "float32"], ["TENSOR", [2048, 512, 64], "float32"], null, null, false, false], {}], "config": {"index": 99496, "code_hash": null, "entity": [["tile_y", "sp", [-1, 2, 1]], ["tile_x", "sp", [-1, 16, 4]], ["tile_k", "sp", [-1, 16]], ["auto_unroll_max_step", "ot", 32], ["unroll_explicit", "ot", 1]]}, "result": [[0.03816890325], 0, 15.142263174057007, 1639305653.9691503], "version": 0.2, "tvm_version": "0.8.0"}
{"input": ["cuda -keys=cuda,gpu -max_num_threads=1024 -thread_warp_size=32", "batch_matmul.cuda", [["TENSOR", [2048, 512, 512], "float32"], ["TENSOR", [2048, 512, 64], "float32"], null, null, false, false], {}], "config": {"index": 116631, "code_hash": null, "entity": [["tile_y", "sp", [-1, 16, 8]], ["tile_x", "sp", [-1, 4, 8]], ["tile_k", "sp", [-1, 32]], ["auto_unroll_max_step", "ot", 64], ["unroll_explicit", "ot", 1]]}, "result": [[0.010062365142857143], 0, 15.095606565475464, 1639305669.3880064], "version": 0.2, "tvm_version": "0.8.0"}
{"input": ["cuda -keys=cuda,gpu -max_num_threads=1024 -thread_warp_size=32", "batch_matmul.cuda", [["TENSOR", [2048, 512, 512], "float32"], ["TENSOR", [2048, 512, 64], "float32"], null, null, false, false], {}], "config": {"index": 113538, "code_hash": null, "entity": [["tile_y", "sp", [-1, 256, 2]], ["tile_x", "sp", [-1, 4, 8]], ["tile_k", "sp", [-1, 8]], ["auto_unroll_max_step", "ot", 64], ["unroll_explicit", "ot", 1]]}, "result": [[0.014707119571428572], 0, 15.11365556716919, 1639305684.938459], "version": 0.2, "tvm_version": "0.8.0"}
{"input": ["cuda -keys=cuda,gpu -max_num_threads=1024 -thread_warp_size=32", "batch_matmul.cuda", [["TENSOR", [2048, 512, 512], "float32"], ["TENSOR", [2048, 512, 64], "float32"], null, null, false, false], {}], "config": {"index": 99151, "code_hash": null, "entity": [["tile_y", "sp", [-1, 2, 32]], ["tile_x", "sp", [-1, 8, 2]], ["tile_k", "sp", [-1, 16]], ["auto_unroll_max_step", "ot", 32], ["unroll_explicit", "ot", 1]]}, "result": [[0.024708189333333335], 0, 14.91978144645691, 1639305700.2489882], "version": 0.2, "tvm_version": "0.8.0"}
{"input": ["cuda -keys=cuda,gpu -max_num_threads=1024 -thread_warp_size=32", "batch_matmul.cuda", [["TENSOR", [2048, 512, 512], "float32"], ["TENSOR", [2048, 512, 64], "float32"], null, null, false, false], {}], "config": {"index": 6094, "code_hash": null, "entity": [["tile_y", "sp", [-1, 16, 32]], ["tile_x", "sp", [-1, 2, 32]], ["tile_k", "sp", [-1, 8]], ["auto_unroll_max_step", "ot", 8], ["unroll_explicit", "ot", 0]]}, "result": [[0.37513011999999996], 0, 16.614869117736816, 1639305716.5464334], "version": 0.2, "tvm_version": "0.8.0"}
{"input": ["cuda -keys=cuda,gpu -max_num_threads=1024 -thread_warp_size=32", "batch_matmul.cuda", [["TENSOR", [2048, 512, 512], "float32"], ["TENSOR", [2048, 512, 64], "float32"], null, null, false, false], {}], "config": {"index": 25530, "code_hash": null, "entity": [["tile_y", "sp", [-1, 1, 2]], ["tile_x", "sp", [-1, 8, 4]], ["tile_k", "sp", [-1, 64]], ["auto_unroll_max_step", "ot", 16], ["unroll_explicit", "ot", 0]]}, "result": [[0.06195286075], 0, 15.293435096740723, 1639305732.3864324], "version": 0.2, "tvm_version": "0.8.0"}
{"input": ["cuda -keys=cuda,gpu -max_num_threads=1024 -thread_warp_size=32", "batch_matmul.cuda", [["TENSOR", [2048, 512, 512], "float32"], ["TENSOR", [2048, 512, 64], "float32"], null, null, false, false], {}], "config": {"index": 16711, "code_hash": null, "entity": [["tile_y", "sp", [-1, 2, 64]], ["tile_x", "sp", [-1, 2, 16]], ["tile_k", "sp", [-1, 1]], ["auto_unroll_max_step", "ot", 16], ["unroll_explicit", "ot", 0]]}, "result": [[2.07933054], 0, 25.430593252182007, 1639305757.4890025], "version": 0.2, "tvm_version": "0.8.0"}
{"input": ["cuda -keys=cuda,gpu -max_num_threads=1024 -thread_warp_size=32", "batch_matmul.cuda", [["TENSOR", [2048, 512, 512], "float32"], ["TENSOR", [2048, 512, 64], "float32"], null, null, false, false], {}], "config": {"index": 79880, "code_hash": null, "entity": [["tile_y", "sp", [-1, 2, 4]], ["tile_x", "sp", [-1, 4, 16]], ["tile_k", "sp", [-1, 2]], ["auto_unroll_max_step", "ot", 16], ["unroll_explicit", "ot", 1]]}, "result": [[0.04318380075], 0, 14.594413995742798, 1639305771.8697412], "version": 0.2, "tvm_version": "0.8.0"}
{"input": ["cuda -keys=cuda,gpu -max_num_threads=1024 -thread_warp_size=32", "batch_matmul.cuda", [["TENSOR", [2048, 512, 512], "float32"], ["TENSOR", [2048, 512, 64], "float32"], null, null, false, false], {}], "config": {"index": 2506, "code_hash": null, "entity": [["tile_y", "sp", [-1, 16, 8]], ["tile_x", "sp", [-1, 16, 4]], ["tile_k", "sp", [-1, 2]], ["auto_unroll_max_step", "ot", 8], ["unroll_explicit", "ot", 0]]}, "result": [[0.0104724004], 0, 14.996976137161255, 1639305786.6118455], "version": 0.2, "tvm_version": "0.8.0"}
{"input": ["cuda -keys=cuda,gpu -max_num_threads=1024 -thread_warp_size=32", "batch_matmul.cuda", [["TENSOR", [2048, 512, 512], "float32"], ["TENSOR", [2048, 512, 64], "float32"], null, null, false, false], {}], "config": {"index": 72403, "code_hash": null, "entity": [["tile_y", "sp", [-1, 16, 4]], ["tile_x", "sp", [-1, 1, 1]], ["tile_k", "sp", [-1, 128]], ["auto_unroll_max_step", "ot", 8], ["unroll_explicit", "ot", 1]]}, "result": [[0.4934765725], 0, 18.564406156539917, 1639305804.9057612], "version": 0.2, "tvm_version": "0.8.0"}
{"input": ["cuda -keys=cuda,gpu -max_num_threads=1024 -thread_warp_size=32", "batch_matmul.cuda", [["TENSOR", [2048, 512, 512], "float32"], ["TENSOR", [2048, 512, 64], "float32"], null, null, false, false], {}], "config": {"index": 22774, "code_hash": null, "entity": [["tile_y", "sp", [-1, 16, 1]], ["tile_x", "sp", [-1, 1, 16]], ["tile_k", "sp", [-1, 16]], ["auto_unroll_max_step", "ot", 16], ["unroll_explicit", "ot", 0]]}, "result": [[0.0646854135], 0, 16.86899471282959, 1639305821.504293], "version": 0.2, "tvm_version": "0.8.0"}
{"input": ["cuda -keys=cuda,gpu -max_num_threads=1024 -thread_warp_size=32", "batch_matmul.cuda", [["TENSOR", [2048, 512, 512], "float32"], ["TENSOR", [2048, 512, 64], "float32"], null, null, false, false], {}], "config": {"index": 103914, "code_hash": null, "entity": [["tile_y", "sp", [-1, 1, 4]], ["tile_x", "sp", [-1, 1, 4]], ["tile_k", "sp", [-1, 128]], ["auto_unroll_max_step", "ot", 32], ["unroll_explicit", "ot", 1]]}, "result": [[0.5901872885], 0, 19.040799856185913, 1639305840.2638478], "version": 0.2, "tvm_version": "0.8.0"}
{"input": ["cuda -keys=cuda,gpu -max_num_threads=1024 -thread_warp_size=32", "batch_matmul.cuda", [["TENSOR", [2048, 512, 512], "float32"], ["TENSOR", [2048, 512, 64], "float32"], null, null, false, false], {}], "config": {"index": 36675, "code_hash": null, "entity": [["tile_y", "sp", [-1, 1, 64]], ["tile_x", "sp", [-1, 1, 16]], ["tile_k", "sp", [-1, 8]], ["auto_unroll_max_step", "ot", 32], ["unroll_explicit", "ot", 0]]}, "result": [[10.25361603225], 0, 66.02287936210632, 1639305905.9717307], "version": 0.2, "tvm_version": "0.8.0"}
{"input": ["cuda -keys=cuda,gpu -max_num_threads=1024 -thread_warp_size=32", "batch_matmul.cuda", [["TENSOR", [2048, 512, 512], "float32"], ["TENSOR", [2048, 512, 64], "float32"], null, null, false, false], {}], "config": {"index": 97940, "code_hash": null, "entity": [["tile_y", "sp", [-1, 1, 32]], ["tile_x", "sp", [-1, 8, 4]], ["tile_k", "sp", [-1, 8]], ["auto_unroll_max_step", "ot", 32], ["unroll_explicit", "ot", 1]]}, "result": [[0.023402523999999997], 0, 15.263453006744385, 1639305920.9037092], "version": 0.2, "tvm_version": "0.8.0"}
{"input": ["cuda -keys=cuda,gpu -max_num_threads=1024 -thread_warp_size=32", "batch_matmul.cuda", [["TENSOR", [2048, 512, 512], "float32"], ["TENSOR", [2048, 512, 64], "float32"], null, null, false, false], {}], "config": {"index": 24502, "code_hash": null, "entity": [["tile_y", "sp", [-1, 1, 8]], ["tile_x", "sp", [-1, 1, 32]], ["tile_k", "sp", [-1, 32]], ["auto_unroll_max_step", "ot", 16], ["unroll_explicit", "ot", 0]]}, "result": [[0.415863294], 0, 17.283045291900635, 1639305937.6293423], "version": 0.2, "tvm_version": "0.8.0"}
{"input": ["cuda -keys=cuda,gpu -max_num_threads=1024 -thread_warp_size=32", "batch_matmul.cuda", [["TENSOR", [2048, 512, 512], "float32"], ["TENSOR", [2048, 512, 64], "float32"], null, null, false, false], {}], "config": {"index": 52825, "code_hash": null, "entity": [["tile_y", "sp", [-1, 64, 4]], ["tile_x", "sp", [-1, 2, 2]], ["tile_k", "sp", [-1, 16]], ["auto_unroll_max_step", "ot", 64], ["unroll_explicit", "ot", 0]]}, "result": [[0.07217742725], 0, 15.248292922973633, 1639305952.5986238], "version": 0.2, "tvm_version": "0.8.0"}
{"input": ["cuda -keys=cuda,gpu -max_num_threads=1024 -thread_warp_size=32", "batch_matmul.cuda", [["TENSOR", [2048, 512, 512], "float32"], ["TENSOR", [2048, 512, 64], "float32"], null, null, false, false], {}], "config": {"index": 109767, "code_hash": null, "entity": [["tile_y", "sp", [-1, 4, 32]], ["tile_x", "sp", [-1, 1, 2]], ["tile_k", "sp", [-1, 2]], ["auto_unroll_max_step", "ot", 64], ["unroll_explicit", "ot", 1]]}, "result": [[0.25590018275], 0, 16.40431308746338, 1639305968.6333709], "version": 0.2, "tvm_version": "0.8.0"}
{"input": ["cuda -keys=cuda,gpu -max_num_threads=1024 -thread_warp_size=32", "batch_matmul.cuda", [["TENSOR", [2048, 512, 512], "float32"], ["TENSOR", [2048, 512, 64], "float32"], null, null, false, false], {}], "config": {"index": 1899, "code_hash": null, "entity": [["tile_y", "sp", [-1, 4, 8]], ["tile_x", "sp", [-1, 64, 1]], ["tile_k", "sp", [-1, 2]], ["auto_unroll_max_step", "ot", 8], ["unroll_explicit", "ot", 0]]}, "result": [[0.0191700315], 0, 15.211739540100098, 1639305983.5936384], "version": 0.2, "tvm_version": "0.8.0"}
{"input": ["cuda -keys=cuda,gpu -max_num_threads=1024 -thread_warp_size=32", "batch_matmul.cuda", [["TENSOR", [2048, 512, 512], "float32"], ["TENSOR", [2048, 512, 64], "float32"], null, null, false, false], {}], "config": {"index": 35708, "code_hash": null, "entity": [["tile_y", "sp", [-1, 8, 2]], ["tile_x", "sp", [-1, 32, 1]], ["tile_k", "sp", [-1, 8]], ["auto_unroll_max_step", "ot", 32], ["unroll_explicit", "ot", 0]]}, "result": [[0.016043198857142858], 0, 14.856534957885742, 1639305998.1861818], "version": 0.2, "tvm_version": "0.8.0"}
{"input": ["cuda -keys=cuda,gpu -max_num_threads=1024 -thread_warp_size=32", "batch_matmul.cuda", [["TENSOR", [2048, 512, 512], "float32"], ["TENSOR", [2048, 512, 64], "float32"], null, null, false, false], {}], "config": {"index": 61703, "code_hash": null, "entity": [["tile_y", "sp", [-1, 8, 64]], ["tile_x", "sp", [-1, 2, 1]], ["tile_k", "sp", [-1, 1]], ["auto_unroll_max_step", "ot", 8], ["unroll_explicit", "ot", 1]]}, "result": [[0.8539263705], 0, 19.19406771659851, 1639306017.0843456], "version": 0.2, "tvm_version": "0.8.0"}
{"input": ["cuda -keys=cuda,gpu -max_num_threads=1024 -thread_warp_size=32", "batch_matmul.cuda", [["TENSOR", [2048, 512, 512], "float32"], ["TENSOR", [2048, 512, 64], "float32"], null, null, false, false], {}], "config": {"index": 41159, "code_hash": null, "entity": [["tile_y", "sp", [-1, 1, 4]], ["tile_x", "sp", [-1, 4, 8]], ["tile_k", "sp", [-1, 64]], ["auto_unroll_max_step", "ot", 32], ["unroll_explicit", "ot", 0]]}, "result": [[0.06887488825], 0, 15.51222825050354, 1639306032.3009992], "version": 0.2, "tvm_version": "0.8.0"}
{"input": ["cuda -keys=cuda,gpu -max_num_threads=1024 -thread_warp_size=32", "batch_matmul.cuda", [["TENSOR", [2048, 512, 512], "float32"], ["TENSOR", [2048, 512, 64], "float32"], null, null, false, false], {}], "config": {"index": 111846, "code_hash": null, "entity": [["tile_y", "sp", [-1, 16, 8]], ["tile_x", "sp", [-1, 16, 4]], ["tile_k", "sp", [-1, 4]], ["auto_unroll_max_step", "ot", 64], ["unroll_explicit", "ot", 1]]}, "result": [[0.010197753899999999], 0, 14.559081554412842, 1639306071.7987773], "version": 0.2, "tvm_version": "0.8.0"}
{"input": ["cuda -keys=cuda,gpu -max_num_threads=1024 -thread_warp_size=32", "batch_matmul.cuda", [["TENSOR", [2048, 512, 512], "float32"], ["TENSOR", [2048, 512, 64], "float32"], null, null, false, false], {}], "config": {"index": 34845, "code_hash": null, "entity": [["tile_y", "sp", [-1, 8, 8]], ["tile_x", "sp", [-1, 16, 4]], ["tile_k", "sp", [-1, 4]], ["auto_unroll_max_step", "ot", 32], ["unroll_explicit", "ot", 0]]}, "result": [[0.008932415], 0, 14.99243712425232, 1639306086.4469652], "version": 0.2, "tvm_version": "0.8.0"}
{"input": ["cuda -keys=cuda,gpu -max_num_threads=1024 -thread_warp_size=32", "batch_matmul.cuda", [["TENSOR", [2048, 512, 512], "float32"], ["TENSOR", [2048, 512, 64], "float32"], null, null, false, false], {}], "config": {"index": 50245, "code_hash": null, "entity": [["tile_y", "sp", [-1, 8, 8]], ["tile_x", "sp", [-1, 16, 4]], ["tile_k", "sp", [-1, 4]], ["auto_unroll_max_step", "ot", 64], ["unroll_explicit", "ot", 0]]}, "result": [[0.009308552181818181], 0, 14.876237154006958, 1639306100.9742098], "version": 0.2, "tvm_version": "0.8.0"}
{"input": ["cuda -keys=cuda,gpu -max_num_threads=1024 -thread_warp_size=32", "batch_matmul.cuda", [["TENSOR", [2048, 512, 512], "float32"], ["TENSOR", [2048, 512, 64], "float32"], null, null, false, false], {}], "config": {"index": 50246, "code_hash": null, "entity": [["tile_y", "sp", [-1, 16, 8]], ["tile_x", "sp", [-1, 16, 4]], ["tile_k", "sp", [-1, 4]], ["auto_unroll_max_step", "ot", 64], ["unroll_explicit", "ot", 0]]}, "result": [[0.009307725636363636], 0, 14.866167068481445, 1639306115.5109067], "version": 0.2, "tvm_version": "0.8.0"}
{"input": ["cuda -keys=cuda,gpu -max_num_threads=1024 -thread_warp_size=32", "batch_matmul.cuda", [["TENSOR", [2048, 512, 512], "float32"], ["TENSOR", [2048, 512, 64], "float32"], null, null, false, false], {}], "config": {"index": 96445, "code_hash": null, "entity": [["tile_y", "sp", [-1, 8, 8]], ["tile_x", "sp", [-1, 16, 4]], ["tile_k", "sp", [-1, 4]], ["auto_unroll_max_step", "ot", 32], ["unroll_explicit", "ot", 1]]}, "result": [[0.008923906916666667], 0, 14.995262861251831, 1639306130.119369], "version": 0.2, "tvm_version": "0.8.0"}
{"input": ["cuda -keys=cuda,gpu -max_num_threads=1024 -thread_warp_size=32", "batch_matmul.cuda", [["TENSOR", [2048, 512, 512], "float32"], ["TENSOR", [2048, 512, 64], "float32"], null, null, false, false], {}], "config": {"index": 111845, "code_hash": null, "entity": [["tile_y", "sp", [-1, 8, 8]], ["tile_x", "sp", [-1, 16, 4]], ["tile_k", "sp", [-1, 4]], ["auto_unroll_max_step", "ot", 64], ["unroll_explicit", "ot", 1]]}, "result": [[0.00952619], 0, 14.684159517288208, 1639306144.4196377], "version": 0.2, "tvm_version": "0.8.0"}
{"input": ["cuda -keys=cuda,gpu -max_num_threads=1024 -thread_warp_size=32", "batch_matmul.cuda", [["TENSOR", [2048, 512, 512], "float32"], ["TENSOR", [2048, 512, 64], "float32"], null, null, false, false], {}], "config": {"index": 96446, "code_hash": null, "entity": [["tile_y", "sp", [-1, 16, 8]], ["tile_x", "sp", [-1, 16, 4]], ["tile_k", "sp", [-1, 4]], ["auto_unroll_max_step", "ot", 32], ["unroll_explicit", "ot", 1]]}, "result": [[0.009475738], 0, 15.852869749069214, 1639306159.9014385], "version": 0.2, "tvm_version": "0.8.0"}
{"input": ["cuda -keys=cuda,gpu -max_num_threads=1024 -thread_warp_size=32", "batch_matmul.cuda", [["TENSOR", [2048, 512, 512], "float32"], ["TENSOR", [2048, 512, 64], "float32"], null, null, false, false], {}], "config": {"index": 65645, "code_hash": null, "entity": [["tile_y", "sp", [-1, 8, 8]], ["tile_x", "sp", [-1, 16, 4]], ["tile_k", "sp", [-1, 4]], ["auto_unroll_max_step", "ot", 8], ["unroll_explicit", "ot", 1]]}, "result": [[0.00890911725], 0, 14.9841148853302, 1639306174.526251], "version": 0.2, "tvm_version": "0.8.0"}
{"input": ["cuda -keys=cuda,gpu -max_num_threads=1024 -thread_warp_size=32", "batch_matmul.cuda", [["TENSOR", [2048, 512, 512], "float32"], ["TENSOR", [2048, 512, 64], "float32"], null, null, false, false], {}], "config": {"index": 81045, "code_hash": null, "entity": [["tile_y", "sp", [-1, 8, 8]], ["tile_x", "sp", [-1, 16, 4]], ["tile_k", "sp", [-1, 4]], ["auto_unroll_max_step", "ot", 16], ["unroll_explicit", "ot", 1]]}, "result": [[0.009227953636363638], 0, 14.7843656539917, 1639306188.9120858], "version": 0.2, "tvm_version": "0.8.0"}
{"input": ["cuda -keys=cuda,gpu -max_num_threads=1024 -thread_warp_size=32", "batch_matmul.cuda", [["TENSOR", [2048, 512, 512], "float32"], ["TENSOR", [2048, 512, 64], "float32"], null, null, false, false], {}], "config": {"index": 65646, "code_hash": null, "entity": [["tile_y", "sp", [-1, 16, 8]], ["tile_x", "sp", [-1, 16, 4]], ["tile_k", "sp", [-1, 4]], ["auto_unroll_max_step", "ot", 8], ["unroll_explicit", "ot", 1]]}, "result": [[0.009315700727272726], 0, 15.186988115310669, 1639306203.7456183], "version": 0.2, "tvm_version": "0.8.0"}
{"input": ["cuda -keys=cuda,gpu -max_num_threads=1024 -thread_warp_size=32", "batch_matmul.cuda", [["TENSOR", [2048, 512, 512], "float32"], ["TENSOR", [2048, 512, 64], "float32"], null, null, false, false], {}], "config": {"index": 81046, "code_hash": null, "entity": [["tile_y", "sp", [-1, 16, 8]], ["tile_x", "sp", [-1, 16, 4]], ["tile_k", "sp", [-1, 4]], ["auto_unroll_max_step", "ot", 16], ["unroll_explicit", "ot", 1]]}, "result": [[0.00932027209090909], 0, 14.93540906906128, 1639306218.2833536], "version": 0.2, "tvm_version": "0.8.0"}
{"input": ["cuda -keys=cuda,gpu -max_num_threads=1024 -thread_warp_size=32", "batch_matmul.cuda", [["TENSOR", [2048, 512, 512], "float32"], ["TENSOR", [2048, 512, 64], "float32"], null, null, false, false], {}], "config": {"index": 4045, "code_hash": null, "entity": [["tile_y", "sp", [-1, 8, 8]], ["tile_x", "sp", [-1, 16, 4]], ["tile_k", "sp", [-1, 4]], ["auto_unroll_max_step", "ot", 8], ["unroll_explicit", "ot", 0]]}, "result": [[0.00894225475], 0, 14.842933177947998, 1639306232.784076], "version": 0.2, "tvm_version": "0.8.0"}
{"input": ["cuda -keys=cuda,gpu -max_num_threads=1024 -thread_warp_size=32", "batch_matmul.cuda", [["TENSOR", [2048, 512, 512], "float32"], ["TENSOR", [2048, 512, 64], "float32"], null, null, false, false], {}], "config": {"index": 19445, "code_hash": null, "entity": [["tile_y", "sp", [-1, 8, 8]], ["tile_x", "sp", [-1, 16, 4]], ["tile_k", "sp", [-1, 4]], ["auto_unroll_max_step", "ot", 16], ["unroll_explicit", "ot", 0]]}, "result": [[0.009489632818181819], 0, 14.596378564834595, 1639306247.022934], "version": 0.2, "tvm_version": "0.8.0"}
{"input": ["cuda -keys=cuda,gpu -max_num_threads=1024 -thread_warp_size=32", "batch_matmul.cuda", [["TENSOR", [2048, 512, 512], "float32"], ["TENSOR", [2048, 512, 64], "float32"], null, null, false, false], {}], "config": {"index": 34846, "code_hash": null, "entity": [["tile_y", "sp", [-1, 16, 8]], ["tile_x", "sp", [-1, 16, 4]], ["tile_k", "sp", [-1, 4]], ["auto_unroll_max_step", "ot", 32], ["unroll_explicit", "ot", 0]]}, "result": [[0.009469909090909091], 0, 14.838066577911377, 1639306261.4968681], "version": 0.2, "tvm_version": "0.8.0"}
{"input": ["cuda -keys=cuda,gpu -max_num_threads=1024 -thread_warp_size=32", "batch_matmul.cuda", [["TENSOR", [2048, 512, 512], "float32"], ["TENSOR", [2048, 512, 64], "float32"], null, null, false, false], {}], "config": {"index": 51516, "code_hash": null, "entity": [["tile_y", "sp", [-1, 4, 16]], ["tile_x", "sp", [-1, 32, 2]], ["tile_k", "sp", [-1, 8]], ["auto_unroll_max_step", "ot", 64], ["unroll_explicit", "ot", 0]]}, "result": [[0.0073430519285714296], 0, 15.317883253097534, 1639306276.4414582], "version": 0.2, "tvm_version": "0.8.0"}
{"input": ["cuda -keys=cuda,gpu -max_num_threads=1024 -thread_warp_size=32", "batch_matmul.cuda", [["TENSOR", [2048, 512, 512], "float32"], ["TENSOR", [2048, 512, 64], "float32"], null, null, false, false], {}], "config": {"index": 111735, "code_hash": null, "entity": [["tile_y", "sp", [-1, 8, 8]], ["tile_x", "sp", [-1, 4, 4]], ["tile_k", "sp", [-1, 4]], ["auto_unroll_max_step", "ot", 64], ["unroll_explicit", "ot", 1]]}, "result": [[0.047177601], 0, 15.054354190826416, 1639306291.1351733], "version": 0.2, "tvm_version": "0.8.0"}
{"input": ["cuda -keys=cuda,gpu -max_num_threads=1024 -thread_warp_size=32", "batch_matmul.cuda", [["TENSOR", [2048, 512, 512], "float32"], ["TENSOR", [2048, 512, 64], "float32"], null, null, false, false], {}], "config": {"index": 96335, "code_hash": null, "entity": [["tile_y", "sp", [-1, 8, 8]], ["tile_x", "sp", [-1, 4, 4]], ["tile_k", "sp", [-1, 4]], ["auto_unroll_max_step", "ot", 32], ["unroll_explicit", "ot", 1]]}, "result": [[0.046946562], 0, 15.036941528320312, 1639306305.7659965], "version": 0.2, "tvm_version": "0.8.0"}
{"input": ["cuda -keys=cuda,gpu -max_num_threads=1024 -thread_warp_size=32", "batch_matmul.cuda", [["TENSOR", [2048, 512, 512], "float32"], ["TENSOR", [2048, 512, 64], "float32"], null, null, false, false], {}], "config": {"index": 36109, "code_hash": null, "entity": [["tile_y", "sp", [-1, 4, 8]], ["tile_x", "sp", [-1, 32, 2]], ["tile_k", "sp", [-1, 8]], ["auto_unroll_max_step", "ot", 32], ["unroll_explicit", "ot", 0]]}, "result": [[0.0076636505], 0, 14.631356954574585, 1639306320.0275848], "version": 0.2, "tvm_version": "0.8.0"}
{"input": ["cuda -keys=cuda,gpu -max_num_threads=1024 -thread_warp_size=32", "batch_matmul.cuda", [["TENSOR", [2048, 512, 512], "float32"], ["TENSOR", [2048, 512, 64], "float32"], null, null, false, false], {}], "config": {"index": 51509, "code_hash": null, "entity": [["tile_y", "sp", [-1, 4, 8]], ["tile_x", "sp", [-1, 32, 2]], ["tile_k", "sp", [-1, 8]], ["auto_unroll_max_step", "ot", 64], ["unroll_explicit", "ot", 0]]}, "result": [[0.007828991230769232], 0, 15.680745840072632, 1639306335.3476834], "version": 0.2, "tvm_version": "0.8.0"}
{"input": ["cuda -keys=cuda,gpu -max_num_threads=1024 -thread_warp_size=32", "batch_matmul.cuda", [["TENSOR", [2048, 512, 512], "float32"], ["TENSOR", [2048, 512, 64], "float32"], null, null, false, false], {}], "config": {"index": 65535, "code_hash": null, "entity": [["tile_y", "sp", [-1, 8, 8]], ["tile_x", "sp", [-1, 4, 4]], ["tile_k", "sp", [-1, 4]], ["auto_unroll_max_step", "ot", 8], ["unroll_explicit", "ot", 1]]}, "result": [[0.04772509525], 0, 15.03909182548523, 1639306350.051924], "version": 0.2, "tvm_version": "0.8.0"}
{"input": ["cuda -keys=cuda,gpu -max_num_threads=1024 -thread_warp_size=32", "batch_matmul.cuda", [["TENSOR", [2048, 512, 512], "float32"], ["TENSOR", [2048, 512, 64], "float32"], null, null, false, false], {}], "config": {"index": 34735, "code_hash": null, "entity": [["tile_y", "sp", [-1, 8, 8]], ["tile_x", "sp", [-1, 4, 4]], ["tile_k", "sp", [-1, 4]], ["auto_unroll_max_step", "ot", 32], ["unroll_explicit", "ot", 0]]}, "result": [[0.0476221545], 0, 14.867679357528687, 1639306364.5704064], "version": 0.2, "tvm_version": "0.8.0"}
{"input": ["cuda -keys=cuda,gpu -max_num_threads=1024 -thread_warp_size=32", "batch_matmul.cuda", [["TENSOR", [2048, 512, 512], "float32"], ["TENSOR", [2048, 512, 64], "float32"], null, null, false, false], {}], "config": {"index": 50135, "code_hash": null, "entity": [["tile_y", "sp", [-1, 8, 8]], ["tile_x", "sp", [-1, 4, 4]], ["tile_k", "sp", [-1, 4]], ["auto_unroll_max_step", "ot", 64], ["unroll_explicit", "ot", 0]]}, "result": [[0.04752815225], 0, 14.84583044052124, 1639306379.065329], "version": 0.2, "tvm_version": "0.8.0"}
{"input": ["cuda -keys=cuda,gpu -max_num_threads=1024 -thread_warp_size=32", "batch_matmul.cuda", [["TENSOR", [2048, 512, 512], "float32"], ["TENSOR", [2048, 512, 64], "float32"], null, null, false, false], {}], "config": {"index": 80935, "code_hash": null, "entity": [["tile_y", "sp", [-1, 8, 8]], ["tile_x", "sp", [-1, 4, 4]], ["tile_k", "sp", [-1, 4]], ["auto_unroll_max_step", "ot", 16], ["unroll_explicit", "ot", 1]]}, "result": [[0.04671344625], 0, 14.851840496063232, 1639306393.546793], "version": 0.2, "tvm_version": "0.8.0"}
{"input": ["cuda -keys=cuda,gpu -max_num_threads=1024 -thread_warp_size=32", "batch_matmul.cuda", [["TENSOR", [2048, 512, 512], "float32"], ["TENSOR", [2048, 512, 64], "float32"], null, null, false, false], {}], "config": {"index": 48705, "code_hash": null, "entity": [["tile_y", "sp", [-1, 8, 8]], ["tile_x", "sp", [-1, 16, 4]], ["tile_k", "sp", [-1, 2]], ["auto_unroll_max_step", "ot", 64], ["unroll_explicit", "ot", 0]]}, "result": [[0.0102691565], 0, 14.934428215026855, 1639306408.1255496], "version": 0.2, "tvm_version": "0.8.0"}
{"input": ["cuda -keys=cuda,gpu -max_num_threads=1024 -thread_warp_size=32", "batch_matmul.cuda", [["TENSOR", [2048, 512, 512], "float32"], ["TENSOR", [2048, 512, 64], "float32"], null, null, false, false], {}], "config": {"index": 33305, "code_hash": null, "entity": [["tile_y", "sp", [-1, 8, 8]], ["tile_x", "sp", [-1, 16, 4]], ["tile_k", "sp", [-1, 2]], ["auto_unroll_max_step", "ot", 32], ["unroll_explicit", "ot", 0]]}, "result": [[0.010343418699999999], 0, 14.632679462432861, 1639306422.358467], "version": 0.2, "tvm_version": "0.8.0"}
{"input": ["cuda -keys=cuda,gpu -max_num_threads=1024 -thread_warp_size=32", "batch_matmul.cuda", [["TENSOR", [2048, 512, 512], "float32"], ["TENSOR", [2048, 512, 64], "float32"], null, null, false, false], {}], "config": {"index": 5309, "code_hash": null, "entity": [["tile_y", "sp", [-1, 4, 8]], ["tile_x", "sp", [-1, 32, 2]], ["tile_k", "sp", [-1, 8]], ["auto_unroll_max_step", "ot", 8], ["unroll_explicit", "ot", 0]]}, "result": [[0.0076768004285714285], 0, 14.79414439201355, 1639306436.8021033], "version": 0.2, "tvm_version": "0.8.0"}
{"input": ["cuda -keys=cuda,gpu -max_num_threads=1024 -thread_warp_size=32", "batch_matmul.cuda", [["TENSOR", [2048, 512, 512], "float32"], ["TENSOR", [2048, 512, 64], "float32"], null, null, false, false], {}], "config": {"index": 34838, "code_hash": null, "entity": [["tile_y", "sp", [-1, 16, 4]], ["tile_x", "sp", [-1, 16, 4]], ["tile_k", "sp", [-1, 4]], ["auto_unroll_max_step", "ot", 32], ["unroll_explicit", "ot", 0]]}, "result": [[0.008849449], 0, 14.699645042419434, 1639306451.202694], "version": 0.2, "tvm_version": "0.8.0"}
{"input": ["cuda -keys=cuda,gpu -max_num_threads=1024 -thread_warp_size=32", "batch_matmul.cuda", [["TENSOR", [2048, 512, 512], "float32"], ["TENSOR", [2048, 512, 64], "float32"], null, null, false, false], {}], "config": {"index": 50238, "code_hash": null, "entity": [["tile_y", "sp", [-1, 16, 4]], ["tile_x", "sp", [-1, 16, 4]], ["tile_k", "sp", [-1, 4]], ["auto_unroll_max_step", "ot", 64], ["unroll_explicit", "ot", 0]]}, "result": [[0.00963578290909091], 0, 14.57181429862976, 1639306465.4250793], "version": 0.2, "tvm_version": "0.8.0"}
{"input": ["cuda -keys=cuda,gpu -max_num_threads=1024 -thread_warp_size=32", "batch_matmul.cuda", [["TENSOR", [2048, 512, 512], "float32"], ["TENSOR", [2048, 512, 64], "float32"], null, null, false, false], {}], "config": {"index": 5199, "code_hash": null, "entity": [["tile_y", "sp", [-1, 4, 8]], ["tile_x", "sp", [-1, 8, 2]], ["tile_k", "sp", [-1, 8]], ["auto_unroll_max_step", "ot", 8], ["unroll_explicit", "ot", 0]]}, "result": [[0.015641761857142857], 0, 14.800277948379517, 1639306480.8511896], "version": 0.2, "tvm_version": "0.8.0"}
{"input": ["cuda -keys=cuda,gpu -max_num_threads=1024 -thread_warp_size=32", "batch_matmul.cuda", [["TENSOR", [2048, 512, 512], "float32"], ["TENSOR", [2048, 512, 64], "float32"], null, null, false, false], {}], "config": {"index": 53317, "code_hash": null, "entity": [["tile_y", "sp", [-1, 8, 4]], ["tile_x", "sp", [-1, 16, 4]], ["tile_k", "sp", [-1, 16]], ["auto_unroll_max_step", "ot", 64], ["unroll_explicit", "ot", 0]]}, "result": [[0.0069901448], 0, 14.753757953643799, 1639306495.1904402], "version": 0.2, "tvm_version": "0.8.0"}
{"input": ["cuda -keys=cuda,gpu -max_num_threads=1024 -thread_warp_size=32", "batch_matmul.cuda", [["TENSOR", [2048, 512, 512], "float32"], ["TENSOR", [2048, 512, 64], "float32"], null, null, false, false], {}], "config": {"index": 4046, "code_hash": null, "entity": [["tile_y", "sp", [-1, 16, 8]], ["tile_x", "sp", [-1, 16, 4]], ["tile_k", "sp", [-1, 4]], ["auto_unroll_max_step", "ot", 8], ["unroll_explicit", "ot", 0]]}, "result": [[0.009470505636363636], 0, 15.176046133041382, 1639306509.9832604], "version": 0.2, "tvm_version": "0.8.0"}
{"input": ["cuda -keys=cuda,gpu -max_num_threads=1024 -thread_warp_size=32", "batch_matmul.cuda", [["TENSOR", [2048, 512, 512], "float32"], ["TENSOR", [2048, 512, 64], "float32"], null, null, false, false], {}], "config": {"index": 94905, "code_hash": null, "entity": [["tile_y", "sp", [-1, 8, 8]], ["tile_x", "sp", [-1, 16, 4]], ["tile_k", "sp", [-1, 2]], ["auto_unroll_max_step", "ot", 32], ["unroll_explicit", "ot", 1]]}, "result": [[0.0105248865], 0, 14.534215688705444, 1639306524.1187975], "version": 0.2, "tvm_version": "0.8.0"}
{"input": ["cuda -keys=cuda,gpu -max_num_threads=1024 -thread_warp_size=32", "batch_matmul.cuda", [["TENSOR", [2048, 512, 512], "float32"], ["TENSOR", [2048, 512, 64], "float32"], null, null, false, false], {}], "config": {"index": 110305, "code_hash": null, "entity": [["tile_y", "sp", [-1, 8, 8]], ["tile_x", "sp", [-1, 16, 4]], ["tile_k", "sp", [-1, 2]], ["auto_unroll_max_step", "ot", 64], ["unroll_explicit", "ot", 1]]}, "result": [[0.009666670545454547], 0, 15.010480165481567, 1639306538.781603], "version": 0.2, "tvm_version": "0.8.0"}
{"input": ["cuda -keys=cuda,gpu -max_num_threads=1024 -thread_warp_size=32", "batch_matmul.cuda", [["TENSOR", [2048, 512, 512], "float32"], ["TENSOR", [2048, 512, 64], "float32"], null, null, false, false], {}], "config": {"index": 36116, "code_hash": null, "entity": [["tile_y", "sp", [-1, 4, 16]], ["tile_x", "sp", [-1, 32, 2]], ["tile_k", "sp", [-1, 8]], ["auto_unroll_max_step", "ot", 32], ["unroll_explicit", "ot", 0]]}, "result": [[0.0073692294999999994], 0, 15.01889157295227, 1639306553.3930721], "version": 0.2, "tvm_version": "0.8.0"}
{"input": ["cuda -keys=cuda,gpu -max_num_threads=1024 -thread_warp_size=32", "batch_matmul.cuda", [["TENSOR", [2048, 512, 512], "float32"], ["TENSOR", [2048, 512, 64], "float32"], null, null, false, false], {}], "config": {"index": 51668, "code_hash": null, "entity": [["tile_y", "sp", [-1, 16, 4]], ["tile_x", "sp", [-1, 4, 4]], ["tile_k", "sp", [-1, 8]], ["auto_unroll_max_step", "ot", 64], ["unroll_explicit", "ot", 0]]}, "result": [[0.019007377000000002], 0, 15.095962047576904, 1639306568.1426668], "version": 0.2, "tvm_version": "0.8.0"}
{"input": ["cuda -keys=cuda,gpu -max_num_threads=1024 -thread_warp_size=32", "batch_matmul.cuda", [["TENSOR", [2048, 512, 512], "float32"], ["TENSOR", [2048, 512, 64], "float32"], null, null, false, false], {}], "config": {"index": 19446, "code_hash": null, "entity": [["tile_y", "sp", [-1, 16, 8]], ["tile_x", "sp", [-1, 16, 4]], ["tile_k", "sp", [-1, 4]], ["auto_unroll_max_step", "ot", 16], ["unroll_explicit", "ot", 0]]}, "result": [[0.009308830727272727], 0, 15.122004747390747, 1639306582.9487522], "version": 0.2, "tvm_version": "0.8.0"}
{"input": ["cuda -keys=cuda,gpu -max_num_threads=1024 -thread_warp_size=32", "batch_matmul.cuda", [["TENSOR", [2048, 512, 512], "float32"], ["TENSOR", [2048, 512, 64], "float32"], null, null, false, false], {}], "config": {"index": 96438, "code_hash": null, "entity": [["tile_y", "sp", [-1, 16, 4]], ["tile_x", "sp", [-1, 16, 4]], ["tile_k", "sp", [-1, 4]], ["auto_unroll_max_step", "ot", 32], ["unroll_explicit", "ot", 1]]}, "result": [[0.008879383749999999], 0, 15.059570550918579, 1639306597.6717134], "version": 0.2, "tvm_version": "0.8.0"}
{"input": ["cuda -keys=cuda,gpu -max_num_threads=1024 -thread_warp_size=32", "batch_matmul.cuda", [["TENSOR", [2048, 512, 512], "float32"], ["TENSOR", [2048, 512, 64], "float32"], null, null, false, false], {}], "config": {"index": 111838, "code_hash": null, "entity": [["tile_y", "sp", [-1, 16, 4]], ["tile_x", "sp", [-1, 16, 4]], ["tile_k", "sp", [-1, 4]], ["auto_unroll_max_step", "ot", 64], ["unroll_explicit", "ot", 1]]}, "result": [[0.009676653454545455], 0, 14.759893417358398, 1639306612.046544], "version": 0.2, "tvm_version": "0.8.0"}
{"input": ["cuda -keys=cuda,gpu -max_num_threads=1024 -thread_warp_size=32", "batch_matmul.cuda", [["TENSOR", [2048, 512, 512], "float32"], ["TENSOR", [2048, 512, 64], "float32"], null, null, false, false], {}], "config": {"index": 5316, "code_hash": null, "entity": [["tile_y", "sp", [-1, 4, 16]], ["tile_x", "sp", [-1, 32, 2]], ["tile_k", "sp", [-1, 8]], ["auto_unroll_max_step", "ot", 8], ["unroll_explicit", "ot", 0]]}, "result": [[0.007376316357142857], 0, 14.427456855773926, 1639306626.116236], "version": 0.2, "tvm_version": "0.8.0"}
{"input": ["cuda -keys=cuda,gpu -max_num_threads=1024 -thread_warp_size=32", "batch_matmul.cuda", [["TENSOR", [2048, 512, 512], "float32"], ["TENSOR", [2048, 512, 64], "float32"], null, null, false, false], {}], "config": {"index": 94906, "code_hash": null, "entity": [["tile_y", "sp", [-1, 16, 8]], ["tile_x", "sp", [-1, 16, 4]], ["tile_k", "sp", [-1, 2]], ["auto_unroll_max_step", "ot", 32], ["unroll_explicit", "ot", 1]]}, "result": [[0.009704735818181818], 0, 14.963791608810425, 1639306640.7132468], "version": 0.2, "tvm_version": "0.8.0"}
{"input": ["cuda -keys=cuda,gpu -max_num_threads=1024 -thread_warp_size=32", "batch_matmul.cuda", [["TENSOR", [2048, 512, 512], "float32"], ["TENSOR", [2048, 512, 64], "float32"], null, null, false, false], {}], "config": {"index": 110306, "code_hash": null, "entity": [["tile_y", "sp", [-1, 16, 8]], ["tile_x", "sp", [-1, 16, 4]], ["tile_k", "sp", [-1, 2]], ["auto_unroll_max_step", "ot", 64], ["unroll_explicit", "ot", 1]]}, "result": [[0.0106444783], 0, 15.175967931747437, 1639306655.4889436], "version": 0.2, "tvm_version": "0.8.0"}
{"input": ["cuda -keys=cuda,gpu -max_num_threads=1024 -thread_warp_size=32", "batch_matmul.cuda", [["TENSOR", [2048, 512, 512], "float32"], ["TENSOR", [2048, 512, 64], "float32"], null, null, false, false], {}], "config": {"index": 50244, "code_hash": null, "entity": [["tile_y", "sp", [-1, 4, 8]], ["tile_x", "sp", [-1, 16, 4]], ["tile_k", "sp", [-1, 4]], ["auto_unroll_max_step", "ot", 64], ["unroll_explicit", "ot", 0]]}, "result": [[0.008561003833333332], 0, 14.76960301399231, 1639306669.9219463], "version": 0.2, "tvm_version": "0.8.0"}
{"input": ["cuda -keys=cuda,gpu -max_num_threads=1024 -thread_warp_size=32", "batch_matmul.cuda", [["TENSOR", [2048, 512, 512], "float32"], ["TENSOR", [2048, 512, 64], "float32"], null, null, false, false], {}], "config": {"index": 34844, "code_hash": null, "entity": [["tile_y", "sp", [-1, 4, 8]], ["tile_x", "sp", [-1, 16, 4]], ["tile_k", "sp", [-1, 4]], ["auto_unroll_max_step", "ot", 32], ["unroll_explicit", "ot", 0]]}, "result": [[0.008490111], 0, 16.13095188140869, 1639306685.6987414], "version": 0.2, "tvm_version": "0.8.0"}
{"input": ["cuda -keys=cuda,gpu -max_num_threads=1024 -thread_warp_size=32", "batch_matmul.cuda", [["TENSOR", [2048, 512, 512], "float32"], ["TENSOR", [2048, 512, 64], "float32"], null, null, false, false], {}], "config": {"index": 64105, "code_hash": null, "entity": [["tile_y", "sp", [-1, 8, 8]], ["tile_x", "sp", [-1, 16, 4]], ["tile_k", "sp", [-1, 2]], ["auto_unroll_max_step", "ot", 8], ["unroll_explicit", "ot", 1]]}, "result": [[0.0110241783], 0, 15.096280574798584, 1639306700.4190924], "version": 0.2, "tvm_version": "0.8.0"}
{"input": ["cuda -keys=cuda,gpu -max_num_threads=1024 -thread_warp_size=32", "batch_matmul.cuda", [["TENSOR", [2048, 512, 512], "float32"], ["TENSOR", [2048, 512, 64], "float32"], null, null, false, false], {}], "config": {"index": 50458, "code_hash": null, "entity": [["tile_y", "sp", [-1, 16, 4]], ["tile_x", "sp", [-1, 8, 8]], ["tile_k", "sp", [-1, 4]], ["auto_unroll_max_step", "ot", 64], ["unroll_explicit", "ot", 0]]}, "result": [[0.0107671959], 0, 14.790949821472168, 1639306714.8515253], "version": 0.2, "tvm_version": "0.8.0"}
{"input": ["cuda -keys=cuda,gpu -max_num_threads=1024 -thread_warp_size=32", "batch_matmul.cuda", [["TENSOR", [2048, 512, 512], "float32"], ["TENSOR", [2048, 512, 64], "float32"], null, null, false, false], {}], "config": {"index": 35999, "code_hash": null, "entity": [["tile_y", "sp", [-1, 4, 8]], ["tile_x", "sp", [-1, 8, 2]], ["tile_k", "sp", [-1, 8]], ["auto_unroll_max_step", "ot", 32], ["unroll_explicit", "ot", 0]]}, "result": [[0.015634369428571427], 0, 15.198684692382812, 1639306729.6487787], "version": 0.2, "tvm_version": "0.8.0"}
{"input": ["cuda -keys=cuda,gpu -max_num_threads=1024 -thread_warp_size=32", "batch_matmul.cuda", [["TENSOR", [2048, 512, 512], "float32"], ["TENSOR", [2048, 512, 64], "float32"], null, null, false, false], {}], "config": {"index": 51399, "code_hash": null, "entity": [["tile_y", "sp", [-1, 4, 8]], ["tile_x", "sp", [-1, 8, 2]], ["tile_k", "sp", [-1, 8]], ["auto_unroll_max_step", "ot", 64], ["unroll_explicit", "ot", 0]]}, "result": [[0.016383391142857143], 0, 14.86638355255127, 1639306744.1386502], "version": 0.2, "tvm_version": "0.8.0"}
{"input": ["cuda -keys=cuda,gpu -max_num_threads=1024 -thread_warp_size=32", "batch_matmul.cuda", [["TENSOR", [2048, 512, 512], "float32"], ["TENSOR", [2048, 512, 64], "float32"], null, null, false, false], {}], "config": {"index": 113268, "code_hash": null, "entity": [["tile_y", "sp", [-1, 16, 4]], ["tile_x", "sp", [-1, 4, 4]], ["tile_k", "sp", [-1, 8]], ["auto_unroll_max_step", "ot", 64], ["unroll_explicit", "ot", 1]]}, "result": [[0.018326661999999997], 0, 14.869937419891357, 1639306758.6870446], "version": 0.2, "tvm_version": "0.8.0"}
{"input": ["cuda -keys=cuda,gpu -max_num_threads=1024 -thread_warp_size=32", "batch_matmul.cuda", [["TENSOR", [2048, 512, 512], "float32"], ["TENSOR", [2048, 512, 64], "float32"], null, null, false, false], {}], "config": {"index": 36268, "code_hash": null, "entity": [["tile_y", "sp", [-1, 16, 4]], ["tile_x", "sp", [-1, 4, 4]], ["tile_k", "sp", [-1, 8]], ["auto_unroll_max_step", "ot", 32], ["unroll_explicit", "ot", 0]]}, "result": [[0.018305447333333332], 0, 14.988919973373413, 1639306773.2598722], "version": 0.2, "tvm_version": "0.8.0"}
{"input": ["cuda -keys=cuda,gpu -max_num_threads=1024 -thread_warp_size=32", "batch_matmul.cuda", [["TENSOR", [2048, 512, 512], "float32"], ["TENSOR", [2048, 512, 64], "float32"], null, null, false, false], {}], "config": {"index": 79505, "code_hash": null, "entity": [["tile_y", "sp", [-1, 8, 8]], ["tile_x", "sp", [-1, 16, 4]], ["tile_k", "sp", [-1, 2]], ["auto_unroll_max_step", "ot", 16], ["unroll_explicit", "ot", 1]]}, "result": [[0.010238068800000001], 0, 15.149880647659302, 1639306788.033397], "version": 0.2, "tvm_version": "0.8.0"}
{"input": ["cuda -keys=cuda,gpu -max_num_threads=1024 -thread_warp_size=32", "batch_matmul.cuda", [["TENSOR", [2048, 512, 512], "float32"], ["TENSOR", [2048, 512, 64], "float32"], null, null, false, false], {}], "config": {"index": 65638, "code_hash": null, "entity": [["tile_y", "sp", [-1, 16, 4]], ["tile_x", "sp", [-1, 16, 4]], ["tile_k", "sp", [-1, 4]], ["auto_unroll_max_step", "ot", 8], ["unroll_explicit", "ot", 1]]}, "result": [[0.009639882909090909], 0, 15.046841382980347, 1639306802.7461596], "version": 0.2, "tvm_version": "0.8.0"}
{"input": ["cuda -keys=cuda,gpu -max_num_threads=1024 -thread_warp_size=32", "batch_matmul.cuda", [["TENSOR", [2048, 512, 512], "float32"], ["TENSOR", [2048, 512, 64], "float32"], null, null, false, false], {}], "config": {"index": 3935, "code_hash": null, "entity": [["tile_y", "sp", [-1, 8, 8]], ["tile_x", "sp", [-1, 4, 4]], ["tile_k", "sp", [-1, 4]], ["auto_unroll_max_step", "ot", 8], ["unroll_explicit", "ot", 0]]}, "result": [[0.04693247975], 0, 15.25023865699768, 1639306817.6502736], "version": 0.2, "tvm_version": "0.8.0"}
{"input": ["cuda -keys=cuda,gpu -max_num_threads=1024 -thread_warp_size=32", "batch_matmul.cuda", [["TENSOR", [2048, 512, 512], "float32"], ["TENSOR", [2048, 512, 64], "float32"], null, null, false, false], {}], "config": {"index": 81038, "code_hash": null, "entity": [["tile_y", "sp", [-1, 16, 4]], ["tile_x", "sp", [-1, 16, 4]], ["tile_k", "sp", [-1, 4]], ["auto_unroll_max_step", "ot", 16], ["unroll_explicit", "ot", 1]]}, "result": [[0.008891455000000001], 0, 14.757301092147827, 1639306832.0241253], "version": 0.2, "tvm_version": "0.8.0"}
{"input": ["cuda -keys=cuda,gpu -max_num_threads=1024 -thread_warp_size=32", "batch_matmul.cuda", [["TENSOR", [2048, 512, 512], "float32"], ["TENSOR", [2048, 512, 64], "float32"], null, null, false, false], {}], "config": {"index": 19335, "code_hash": null, "entity": [["tile_y", "sp", [-1, 8, 8]], ["tile_x", "sp", [-1, 4, 4]], ["tile_k", "sp", [-1, 4]], ["auto_unroll_max_step", "ot", 16], ["unroll_explicit", "ot", 0]]}, "result": [[0.04600866175], 0, 15.016905784606934, 1639306846.679949], "version": 0.2, "tvm_version": "0.8.0"}
{"input": ["cuda -keys=cuda,gpu -max_num_threads=1024 -thread_warp_size=32", "batch_matmul.cuda", [["TENSOR", [2048, 512, 512], "float32"], ["TENSOR", [2048, 512, 64], "float32"], null, null, false, false], {}], "config": {"index": 113116, "code_hash": null, "entity": [["tile_y", "sp", [-1, 4, 16]], ["tile_x", "sp", [-1, 32, 2]], ["tile_k", "sp", [-1, 8]], ["auto_unroll_max_step", "ot", 64], ["unroll_explicit", "ot", 1]]}, "result": [[0.007340078071428571], 0, 15.485972166061401, 1639306861.7608702], "version": 0.2, "tvm_version": "0.8.0"}
{"input": ["cuda -keys=cuda,gpu -max_num_threads=1024 -thread_warp_size=32", "batch_matmul.cuda", [["TENSOR", [2048, 512, 512], "float32"], ["TENSOR", [2048, 512, 64], "float32"], null, null, false, false], {}], "config": {"index": 51400, "code_hash": null, "entity": [["tile_y", "sp", [-1, 8, 8]], ["tile_x", "sp", [-1, 8, 2]], ["tile_k", "sp", [-1, 8]], ["auto_unroll_max_step", "ot", 64], ["unroll_explicit", "ot", 0]]}, "result": [[0.01839536866666667], 0, 15.046711206436157, 1639306876.4267595], "version": 0.2, "tvm_version": "0.8.0"}
{"input": ["cuda -keys=cuda,gpu -max_num_threads=1024 -thread_warp_size=32", "batch_matmul.cuda", [["TENSOR", [2048, 512, 512], "float32"], ["TENSOR", [2048, 512, 64], "float32"], null, null, false, false], {}], "config": {"index": 81979, "code_hash": null, "entity": [["tile_y", "sp", [-1, 4, 8]], ["tile_x", "sp", [-1, 64, 1]], ["tile_k", "sp", [-1, 8]], ["auto_unroll_max_step", "ot", 16], ["unroll_explicit", "ot", 1]]}, "result": [[0.010853494100000001], 0, 15.021272420883179, 1639306908.4964855], "version": 0.2, "tvm_version": "0.8.0"}
{"input": ["cuda -keys=cuda,gpu -max_num_threads=1024 -thread_warp_size=32", "batch_matmul.cuda", [["TENSOR", [2048, 512, 512], "float32"], ["TENSOR", [2048, 512, 64], "float32"], null, null, false, false], {}], "config": {"index": 66579, "code_hash": null, "entity": [["tile_y", "sp", [-1, 4, 8]], ["tile_x", "sp", [-1, 64, 1]], ["tile_k", "sp", [-1, 8]], ["auto_unroll_max_step", "ot", 8], ["unroll_explicit", "ot", 1]]}, "result": [[0.0106621013], 0, 15.214652299880981, 1639306923.34382], "version": 0.2, "tvm_version": "0.8.0"}
{"input": ["cuda -keys=cuda,gpu -max_num_threads=1024 -thread_warp_size=32", "batch_matmul.cuda", [["TENSOR", [2048, 512, 512], "float32"], ["TENSOR", [2048, 512, 64], "float32"], null, null, false, false], {}], "config": {"index": 20379, "code_hash": null, "entity": [["tile_y", "sp", [-1, 4, 8]], ["tile_x", "sp", [-1, 64, 1]], ["tile_k", "sp", [-1, 8]], ["auto_unroll_max_step", "ot", 16], ["unroll_explicit", "ot", 0]]}, "result": [[0.0104734063], 0, 15.598712921142578, 1639306938.5868871], "version": 0.2, "tvm_version": "0.8.0"}
{"input": ["cuda -keys=cuda,gpu -max_num_threads=1024 -thread_warp_size=32", "batch_matmul.cuda", [["TENSOR", [2048, 512, 512], "float32"], ["TENSOR", [2048, 512, 64], "float32"], null, null, false, false], {}], "config": {"index": 4979, "code_hash": null, "entity": [["tile_y", "sp", [-1, 4, 8]], ["tile_x", "sp", [-1, 64, 1]], ["tile_k", "sp", [-1, 8]], ["auto_unroll_max_step", "ot", 8], ["unroll_explicit", "ot", 0]]}, "result": [[0.0095516761875], 0, 17.071367263793945, 1639306955.2771878], "version": 0.2, "tvm_version": "0.8.0"}
{"input": ["cuda -keys=cuda,gpu -max_num_threads=1024 -thread_warp_size=32", "batch_matmul.cuda", [["TENSOR", [2048, 512, 512], "float32"], ["TENSOR", [2048, 512, 64], "float32"], null, null, false, false], {}], "config": {"index": 97379, "code_hash": null, "entity": [["tile_y", "sp", [-1, 4, 8]], ["tile_x", "sp", [-1, 64, 1]], ["tile_k", "sp", [-1, 8]], ["auto_unroll_max_step", "ot", 32], ["unroll_explicit", "ot", 1]]}, "result": [[0.010655203899999998], 0, 14.760682106018066, 1639306969.6772888], "version": 0.2, "tvm_version": "0.8.0"}
{"input": ["cuda -keys=cuda,gpu -max_num_threads=1024 -thread_warp_size=32", "batch_matmul.cuda", [["TENSOR", [2048, 512, 512], "float32"], ["TENSOR", [2048, 512, 64], "float32"], null, null, false, false], {}], "config": {"index": 20716, "code_hash": null, "entity": [["tile_y", "sp", [-1, 4, 16]], ["tile_x", "sp", [-1, 32, 2]], ["tile_k", "sp", [-1, 8]], ["auto_unroll_max_step", "ot", 16], ["unroll_explicit", "ot", 0]]}, "result": [[0.00792067323076923], 0, 15.09323763847351, 1639306984.36787], "version": 0.2, "tvm_version": "0.8.0"}
{"input": ["cuda -keys=cuda,gpu -max_num_threads=1024 -thread_warp_size=32", "batch_matmul.cuda", [["TENSOR", [2048, 512, 512], "float32"], ["TENSOR", [2048, 512, 64], "float32"], null, null, false, false], {}], "config": {"index": 35779, "code_hash": null, "entity": [["tile_y", "sp", [-1, 4, 8]], ["tile_x", "sp", [-1, 64, 1]], ["tile_k", "sp", [-1, 8]], ["auto_unroll_max_step", "ot", 32], ["unroll_explicit", "ot", 0]]}, "result": [[0.009438603272727273], 0, 16.033586502075195, 1639306999.9744759], "version": 0.2, "tvm_version": "0.8.0"}
