artifacts/microbenchmark/tvm/e2e/autotvm_log/conv2d_128_2688_11_11_672_1_1_1_SAME_add.log
{"input": ["cuda -keys=cuda,gpu -max_num_threads=1024 -thread_warp_size=32", "conv2d_nchw.cuda", [["TENSOR", [128, 2688, 11, 11], "float32"], ["TENSOR", [672, 2688, 1, 1], "float32"], 1, "SAME", 1, "float32"], {}], "config": {"index": 2079289, "code_hash": null, "entity": [["tile_f", "sp", [-1, 1, 12, 7]], ["tile_y", "sp", [-1, 1, 1, 1]], ["tile_x", "sp", [-1, 1, 1, 1]], ["tile_rc", "sp", [-1, 64]], ["tile_ry", "sp", [-1, 1]], ["tile_rx", "sp", [-1, 1]], ["auto_unroll_max_step", "ot", 512], ["unroll_explicit", "ot", 1]]}, "result": [[0.38593409824999997], 0, 4.989099979400635, 1637711299.2875805], "version": 0.2, "tvm_version": "0.8.dev0"}
{"input": ["cuda -keys=cuda,gpu -max_num_threads=1024 -thread_warp_size=32", "conv2d_nchw.cuda", [["TENSOR", [128, 2688, 11, 11], "float32"], ["TENSOR", [672, 2688, 1, 1], "float32"], 1, "SAME", 1, "float32"], {}], "config": {"index": 1283210, "code_hash": null, "entity": [["tile_f", "sp", [-1, 1, 24, 1]], ["tile_y", "sp", [-1, 1, 1, 1]], ["tile_x", "sp", [-1, 1, 11, 1]], ["tile_rc", "sp", [-1, 336]], ["tile_ry", "sp", [-1, 1]], ["tile_rx", "sp", [-1, 1]], ["auto_unroll_max_step", "ot", 1500], ["unroll_explicit", "ot", 0]]}, "result": [[0.04000884025], 0, 2.3603711128234863, 1637711301.1311064], "version": 0.2, "tvm_version": "0.8.dev0"}
{"input": ["cuda -keys=cuda,gpu -max_num_threads=1024 -thread_warp_size=32", "conv2d_nchw.cuda", [["TENSOR", [128, 2688, 11, 11], "float32"], ["TENSOR", [672, 2688, 1, 1], "float32"], 1, "SAME", 1, "float32"], {}], "config": {"index": 461384, "code_hash": null, "entity": [["tile_f", "sp", [-1, 1, 7, 48]], ["tile_y", "sp", [-1, 1, 11, 1]], ["tile_x", "sp", [-1, 1, 1, 1]], ["tile_rc", "sp", [-1, 1]], ["tile_ry", "sp", [-1, 1]], ["tile_rx", "sp", [-1, 1]], ["auto_unroll_max_step", "ot", 512], ["unroll_explicit", "ot", 0]]}, "result": [[0.0467607025], 0, 1.8616580963134766, 1637711304.2868373], "version": 0.2, "tvm_version": "0.8.dev0"}
{"input": ["cuda -keys=cuda,gpu -max_num_threads=1024 -thread_warp_size=32", "conv2d_nchw.cuda", [["TENSOR", [128, 2688, 11, 11], "float32"], ["TENSOR", [672, 2688, 1, 1], "float32"], 1, "SAME", 1, "float32"], {}], "config": {"index": 477227, "code_hash": null, "entity": [["tile_f", "sp", [-1, 8, 4, 7]], ["tile_y", "sp", [-1, 1, 1, 1]], ["tile_x", "sp", [-1, 11, 1, 1]], ["tile_rc", "sp", [-1, 2]], ["tile_ry", "sp", [-1, 1]], ["tile_rx", "sp", [-1, 1]], ["auto_unroll_max_step", "ot", 512], ["unroll_explicit", "ot", 0]]}, "result": [[4.544740631], 0, 24.87834072113037, 1637711328.5609963], "version": 0.2, "tvm_version": "0.8.dev0"}
{"input": ["cuda -keys=cuda,gpu -max_num_threads=1024 -thread_warp_size=32", "conv2d_nchw.cuda", [["TENSOR", [128, 2688, 11, 11], "float32"], ["TENSOR", [672, 2688, 1, 1], "float32"], 1, "SAME", 1, "float32"], {}], "config": {"index": 1910370, "code_hash": null, "entity": [["tile_f", "sp", [-1, 6, 8, 1]], ["tile_y", "sp", [-1, 1, 1, 1]], ["tile_x", "sp", [-1, 11, 1, 1]], ["tile_rc", "sp", [-1, 7]], ["tile_ry", "sp", [-1, 1]], ["tile_rx", "sp", [-1, 1]], ["auto_unroll_max_step", "ot", 512], ["unroll_explicit", "ot", 1]]}, "result": [[0.03529806275], 0, 2.143690824508667, 1637711330.9313912], "version": 0.2, "tvm_version": "0.8.dev0"}
{"input": ["cuda -keys=cuda,gpu -max_num_threads=1024 -thread_warp_size=32", "conv2d_nchw.cuda", [["TENSOR", [128, 2688, 11, 11], "float32"], ["TENSOR", [672, 2688, 1, 1], "float32"], 1, "SAME", 1, "float32"], {}], "config": {"index": 2428423, "code_hash": null, "entity": [["tile_f", "sp", [-1, 24, 7, 2]], ["tile_y", "sp", [-1, 1, 11, 1]], ["tile_x", "sp", [-1, 11, 1, 1]], ["tile_rc", "sp", [-1, 16]], ["tile_ry", "sp", [-1, 1]], ["tile_rx", "sp", [-1, 1]], ["auto_unroll_max_step", "ot", 1500], ["unroll_explicit", "ot", 1]]}, "result": [[0.3688846255], 0, 5.411476373672485, 1637711334.4966605], "version": 0.2, "tvm_version": "0.8.dev0"}
{"input": ["cuda -keys=cuda,gpu -max_num_threads=1024 -thread_warp_size=32", "conv2d_nchw.cuda", [["TENSOR", [128, 2688, 11, 11], "float32"], ["TENSOR", [672, 2688, 1, 1], "float32"], 1, "SAME", 1, "float32"], {}], "config": {"index": 2470205, "code_hash": null, "entity": [["tile_f", "sp", [-1, 2, 4, 42]], ["tile_y", "sp", [-1, 1, 1, 1]], ["tile_x", "sp", [-1, 11, 1, 1]], ["tile_rc", "sp", [-1, 28]], ["tile_ry", "sp", [-1, 1]], ["tile_rx", "sp", [-1, 1]], ["auto_unroll_max_step", "ot", 1500], ["unroll_explicit", "ot", 1]]}, "result": [[3.2982067845], 0, 22.592307567596436, 1637711353.452713], "version": 0.2, "tvm_version": "0.8.dev0"}
{"input": ["cuda -keys=cuda,gpu -max_num_threads=1024 -thread_warp_size=32", "conv2d_nchw.cuda", [["TENSOR", [128, 2688, 11, 11], "float32"], ["TENSOR", [672, 2688, 1, 1], "float32"], 1, "SAME", 1, "float32"], {}], "config": {"index": 1631007, "code_hash": null, "entity": [["tile_f", "sp", [-1, 1, 16, 2]], ["tile_y", "sp", [-1, 1, 1, 1]], ["tile_x", "sp", [-1, 1, 1, 11]], ["tile_rc", "sp", [-1, 64]], ["tile_ry", "sp", [-1, 1]], ["tile_rx", "sp", [-1, 1]], ["auto_unroll_max_step", "ot", 0], ["unroll_explicit", "ot", 1]]}, "result": [[0.04368704775], 0, 1.923135757446289, 1637711355.1932092], "version": 0.2, "tvm_version": "0.8.dev0"}
{"input": ["cuda -keys=cuda,gpu -max_num_threads=1024 -thread_warp_size=32", "conv2d_nchw.cuda", [["TENSOR", [128, 2688, 11, 11], "float32"], ["TENSOR", [672, 2688, 1, 1], "float32"], 1, "SAME", 1, "float32"], {}], "config": {"index": 941067, "code_hash": null, "entity": [["tile_f", "sp", [-1, 3, 8, 2]], ["tile_y", "sp", [-1, 1, 11, 1]], ["tile_x", "sp", [-1, 1, 11, 1]], ["tile_rc", "sp", [-1, 2]], ["tile_ry", "sp", [-1, 1]], ["tile_rx", "sp", [-1, 1]], ["auto_unroll_max_step", "ot", 1500], ["unroll_explicit", "ot", 0]]}, "result": [[0.014235676124999999], 0, 1.7139744758605957, 1637711357.4722364], "version": 0.2, "tvm_version": "0.8.dev0"}
{"input": ["cuda -keys=cuda,gpu -max_num_threads=1024 -thread_warp_size=32", "conv2d_nchw.cuda", [["TENSOR", [128, 2688, 11, 11], "float32"], ["TENSOR", [672, 2688, 1, 1], "float32"], 1, "SAME", 1, "float32"], {}], "config": {"index": 659795, "code_hash": null, "entity": [["tile_f", "sp", [-1, 7, 2, 3]], ["tile_y", "sp", [-1, 1, 1, 1]], ["tile_x", "sp", [-1, 1, 1, 1]], ["tile_rc", "sp", [-1, 42]], ["tile_ry", "sp", [-1, 1]], ["tile_rx", "sp", [-1, 1]], ["auto_unroll_max_step", "ot", 512], ["unroll_explicit", "ot", 0]]}, "result": [[0.63669119875], 0, 4.719433784484863, 1637711362.8304112], "version": 0.2, "tvm_version": "0.8.dev0"}
{"input": ["cuda -keys=cuda,gpu -max_num_threads=1024 -thread_warp_size=32", "conv2d_nchw.cuda", [["TENSOR", [128, 2688, 11, 11], "float32"], ["TENSOR", [672, 2688, 1, 1], "float32"], 1, "SAME", 1, "float32"], {}], "config": {"index": 2566988, "code_hash": null, "entity": [["tile_f", "sp", [-1, 2, 1, 56]], ["tile_y", "sp", [-1, 1, 1, 1]], ["tile_x", "sp", [-1, 1, 1, 1]], ["tile_rc", "sp", [-1, 96]], ["tile_ry", "sp", [-1, 1]], ["tile_rx", "sp", [-1, 1]], ["auto_unroll_max_step", "ot", 1500], ["unroll_explicit", "ot", 1]]}, "result": [[5.1965676284999995], 0, 28.03123664855957, 1637711390.449472], "version": 0.2, "tvm_version": "0.8.dev0"}
{"input": ["cuda -keys=cuda,gpu -max_num_threads=1024 -thread_warp_size=32", "conv2d_nchw.cuda", [["TENSOR", [128, 2688, 11, 11], "float32"], ["TENSOR", [672, 2688, 1, 1], "float32"], 1, "SAME", 1, "float32"], {}], "config": {"index": 2416226, "code_hash": null, "entity": [["tile_f", "sp", [-1, 28, 3, 8]], ["tile_y", "sp", [-1, 1, 1, 1]], ["tile_x", "sp", [-1, 1, 11, 1]], ["tile_rc", "sp", [-1, 14]], ["tile_ry", "sp", [-1, 1]], ["tile_rx", "sp", [-1, 1]], ["auto_unroll_max_step", "ot", 1500], ["unroll_explicit", "ot", 1]]}, "result": [[0.09975862725000001], 0, 3.7756118774414062, 1637711393.4698937], "version": 0.2, "tvm_version": "0.8.dev0"}
{"input": ["cuda -keys=cuda,gpu -max_num_threads=1024 -thread_warp_size=32", "conv2d_nchw.cuda", [["TENSOR", [128, 2688, 11, 11], "float32"], ["TENSOR", [672, 2688, 1, 1], "float32"], 1, "SAME", 1, "float32"], {}], "config": {"index": 2385008, "code_hash": null, "entity": [["tile_f", "sp", [-1, 1, 4, 21]], ["tile_y", "sp", [-1, 11, 1, 1]], ["tile_x", "sp", [-1, 11, 1, 1]], ["tile_rc", "sp", [-1, 8]], ["tile_ry", "sp", [-1, 1]], ["tile_rx", "sp", [-1, 1]], ["auto_unroll_max_step", "ot", 1500], ["unroll_explicit", "ot", 1]]}, "result": [[4.57269987225], 0, 25.629278421401978, 1637711418.540321], "version": 0.2, "tvm_version": "0.8.dev0"}
{"input": ["cuda -keys=cuda,gpu -max_num_threads=1024 -thread_warp_size=32", "conv2d_nchw.cuda", [["TENSOR", [128, 2688, 11, 11], "float32"], ["TENSOR", [672, 2688, 1, 1], "float32"], 1, "SAME", 1, "float32"], {}], "config": {"index": 1505284, "code_hash": null, "entity": [["tile_f", "sp", [-1, 6, 1, 1]], ["tile_y", "sp", [-1, 1, 1, 1]], ["tile_x", "sp", [-1, 1, 1, 1]], ["tile_rc", "sp", [-1, 16]], ["tile_ry", "sp", [-1, 1]], ["tile_rx", "sp", [-1, 1]], ["auto_unroll_max_step", "ot", 0], ["unroll_explicit", "ot", 1]]}, "result": [[0.7615248327499999], 0, 5.342453718185425, 1637711424.401869], "version": 0.2, "tvm_version": "0.8.dev0"}
{"input": ["cuda -keys=cuda,gpu -max_num_threads=1024 -thread_warp_size=32", "conv2d_nchw.cuda", [["TENSOR", [128, 2688, 11, 11], "float32"], ["TENSOR", [672, 2688, 1, 1], "float32"], 1, "SAME", 1, "float32"], {}], "config": {"index": 2374233, "code_hash": null, "entity": [["tile_f", "sp", [-1, 14, 3, 16]], ["tile_y", "sp", [-1, 11, 1, 1]], ["tile_x", "sp", [-1, 1, 11, 1]], ["tile_rc", "sp", [-1, 7]], ["tile_ry", "sp", [-1, 1]], ["tile_rx", "sp", [-1, 1]], ["auto_unroll_max_step", "ot", 1500], ["unroll_explicit", "ot", 1]]}, "result": [[0.874318943], 0, 6.9435036182403564, 1637711431.7932074], "version": 0.2, "tvm_version": "0.8.dev0"}
{"input": ["cuda -keys=cuda,gpu -max_num_threads=1024 -thread_warp_size=32", "conv2d_nchw.cuda", [["TENSOR", [128, 2688, 11, 11], "float32"], ["TENSOR", [672, 2688, 1, 1], "float32"], 1, "SAME", 1, "float32"], {}], "config": {"index": 2068194, "code_hash": null, "entity": [["tile_f", "sp", [-1, 2, 3, 2]], ["tile_y", "sp", [-1, 1, 1, 1]], ["tile_x", "sp", [-1, 11, 1, 1]], ["tile_rc", "sp", [-1, 56]], ["tile_ry", "sp", [-1, 1]], ["tile_rx", "sp", [-1, 1]], ["auto_unroll_max_step", "ot", 512], ["unroll_explicit", "ot", 1]]}, "result": [[0.1173148205], 0, 3.0458059310913086, 1637711435.4045498], "version": 0.2, "tvm_version": "0.8.dev0"}
{"input": ["cuda -keys=cuda,gpu -max_num_threads=1024 -thread_warp_size=32", "conv2d_nchw.cuda", [["TENSOR", [128, 2688, 11, 11], "float32"], ["TENSOR", [672, 2688, 1, 1], "float32"], 1, "SAME", 1, "float32"], {}], "config": {"index": 987962, "code_hash": null, "entity": [["tile_f", "sp", [-1, 2, 12, 7]], ["tile_y", "sp", [-1, 1, 11, 1]], ["tile_x", "sp", [-1, 1, 1, 11]], ["tile_rc", "sp", [-1, 6]], ["tile_ry", "sp", [-1, 1]], ["tile_rx", "sp", [-1, 1]], ["auto_unroll_max_step", "ot", 1500], ["unroll_explicit", "ot", 0]]}, "result": [[0.013709467], 0, 2.0412368774414062, 1637711449.3176894], "version": 0.2, "tvm_version": "0.8.dev0"}
{"input": ["cuda -keys=cuda,gpu -max_num_threads=1024 -thread_warp_size=32", "conv2d_nchw.cuda", [["TENSOR", [128, 2688, 11, 11], "float32"], ["TENSOR", [672, 2688, 1, 1], "float32"], 1, "SAME", 1, "float32"], {}], "config": {"index": 1977862, "code_hash": null, "entity": [["tile_f", "sp", [-1, 4, 1, 4]], ["tile_y", "sp", [-1, 1, 1, 11]], ["tile_x", "sp", [-1, 1, 1, 11]], ["tile_rc", "sp", [-1, 16]], ["tile_ry", "sp", [-1, 1]], ["tile_rx", "sp", [-1, 1]], ["auto_unroll_max_step", "ot", 512], ["unroll_explicit", "ot", 1]]}, "result": [[12.5934589385], 0, 69.28776144981384, 1637711514.6122694], "version": 0.2, "tvm_version": "0.8.dev0"}
{"input": ["cuda -keys=cuda,gpu -max_num_threads=1024 -thread_warp_size=32", "conv2d_nchw.cuda", [["TENSOR", [128, 2688, 11, 11], "float32"], ["TENSOR", [672, 2688, 1, 1], "float32"], 1, "SAME", 1, "float32"], {}], "config": {"index": 2539152, "code_hash": null, "entity": [["tile_f", "sp", [-1, 6, 1, 28]], ["tile_y", "sp", [-1, 11, 1, 1]], ["tile_x", "sp", [-1, 1, 1, 1]], ["tile_rc", "sp", [-1, 64]], ["tile_ry", "sp", [-1, 1]], ["tile_rx", "sp", [-1, 1]], ["auto_unroll_max_step", "ot", 1500], ["unroll_explicit", "ot", 1]]}, "result": [[22.79635513925], 0, 117.27602505683899, 1637711630.9233932], "version": 0.2, "tvm_version": "0.8.dev0"}
{"input": ["cuda -keys=cuda,gpu -max_num_threads=1024 -thread_warp_size=32", "conv2d_nchw.cuda", [["TENSOR", [128, 2688, 11, 11], "float32"], ["TENSOR", [672, 2688, 1, 1], "float32"], 1, "SAME", 1, "float32"], {}], "config": {"index": 1384187, "code_hash": null, "entity": [["tile_f", "sp", [-1, 2, 1, 24]], ["tile_y", "sp", [-1, 1, 1, 1]], ["tile_x", "sp", [-1, 1, 11, 1]], ["tile_rc", "sp", [-1, 1]], ["tile_ry", "sp", [-1, 1]], ["tile_rx", "sp", [-1, 1]], ["auto_unroll_max_step", "ot", 0], ["unroll_explicit", "ot", 1]]}, "result": [[0.040426894500000005], 0, 1.7593615055084229, 1637711633.3133378], "version": 0.2, "tvm_version": "0.8.dev0"}
{"input": ["cuda -keys=cuda,gpu -max_num_threads=1024 -thread_warp_size=32", "conv2d_nchw.cuda", [["TENSOR", [128, 2688, 11, 11], "float32"], ["TENSOR", [672, 2688, 1, 1], "float32"], 1, "SAME", 1, "float32"], {}], "config": {"index": 923725, "code_hash": null, "entity": [["tile_f", "sp", [-1, 3, 1, 56]], ["tile_y", "sp", [-1, 1, 11, 1]], ["tile_x", "sp", [-1, 11, 1, 1]], ["tile_rc", "sp", [-1, 1]], ["tile_ry", "sp", [-1, 1]], ["tile_rx", "sp", [-1, 1]], ["auto_unroll_max_step", "ot", 1500], ["unroll_explicit", "ot", 0]]}, "result": [[1.51002511625], 0, 9.222007989883423, 1637711642.2842288], "version": 0.2, "tvm_version": "0.8.dev0"}
{"input": ["cuda -keys=cuda,gpu -max_num_threads=1024 -thread_warp_size=32", "conv2d_nchw.cuda", [["TENSOR", [128, 2688, 11, 11], "float32"], ["TENSOR", [672, 2688, 1, 1], "float32"], 1, "SAME", 1, "float32"], {}], "config": {"index": 111535, "code_hash": null, "entity": [["tile_f", "sp", [-1, 1, 6, 4]], ["tile_y", "sp", [-1, 1, 1, 1]], ["tile_x", "sp", [-1, 1, 1, 11]], ["tile_rc", "sp", [-1, 12]], ["tile_ry", "sp", [-1, 1]], ["tile_rx", "sp", [-1, 1]], ["auto_unroll_max_step", "ot", 0], ["unroll_explicit", "ot", 0]]}, "result": [[0.03975256575], 0, 1.80450439453125, 1637711643.8849041], "version": 0.2, "tvm_version": "0.8.dev0"}
{"input": ["cuda -keys=cuda,gpu -max_num_threads=1024 -thread_warp_size=32", "conv2d_nchw.cuda", [["TENSOR", [128, 2688, 11, 11], "float32"], ["TENSOR", [672, 2688, 1, 1], "float32"], 1, "SAME", 1, "float32"], {}], "config": {"index": 1945349, "code_hash": null, "entity": [["tile_f", "sp", [-1, 2, 21, 1]], ["tile_y", "sp", [-1, 1, 1, 11]], ["tile_x", "sp", [-1, 1, 11, 1]], ["tile_rc", "sp", [-1, 12]], ["tile_ry", "sp", [-1, 1]], ["tile_rx", "sp", [-1, 1]], ["auto_unroll_max_step", "ot", 512], ["unroll_explicit", "ot", 1]]}, "result": [[0.0077346335], 0, 1.8479640483856201, 1637711645.3980224], "version": 0.2, "tvm_version": "0.8.dev0"}
{"input": ["cuda -keys=cuda,gpu -max_num_threads=1024 -thread_warp_size=32", "conv2d_nchw.cuda", [["TENSOR", [128, 2688, 11, 11], "float32"], ["TENSOR", [672, 2688, 1, 1], "float32"], 1, "SAME", 1, "float32"], {}], "config": {"index": 2624015, "code_hash": null, "entity": [["tile_f", "sp", [-1, 8, 1, 7]], ["tile_y", "sp", [-1, 1, 1, 1]], ["tile_x", "sp", [-1, 1, 1, 1]], ["tile_rc", "sp", [-1, 192]], ["tile_ry", "sp", [-1, 1]], ["tile_rx", "sp", [-1, 1]], ["auto_unroll_max_step", "ot", 1500], ["unroll_explicit", "ot", 1]]}, "result": [[7.9456043565], 0, 41.605157136917114, 1637711687.2825022], "version": 0.2, "tvm_version": "0.8.dev0"}
{"input": ["cuda -keys=cuda,gpu -max_num_threads=1024 -thread_warp_size=32", "conv2d_nchw.cuda", [["TENSOR", [128, 2688, 11, 11], "float32"], ["TENSOR", [672, 2688, 1, 1], "float32"], 1, "SAME", 1, "float32"], {}], "config": {"index": 478454, "code_hash": null, "entity": [["tile_f", "sp", [-1, 1, 2, 168]], ["tile_y", "sp", [-1, 11, 1, 1]], ["tile_x", "sp", [-1, 11, 1, 1]], ["tile_rc", "sp", [-1, 2]], ["tile_ry", "sp", [-1, 1]], ["tile_rx", "sp", [-1, 1]], ["auto_unroll_max_step", "ot", 512], ["unroll_explicit", "ot", 0]]}, "result": [[7.71186382575], 0, 41.19564867019653, 1637711728.0653713], "version": 0.2, "tvm_version": "0.8.dev0"}
{"input": ["cuda -keys=cuda,gpu -max_num_threads=1024 -thread_warp_size=32", "conv2d_nchw.cuda", [["TENSOR", [128, 2688, 11, 11], "float32"], ["TENSOR", [672, 2688, 1, 1], "float32"], 1, "SAME", 1, "float32"], {}], "config": {"index": 1104317, "code_hash": null, "entity": [["tile_f", "sp", [-1, 1, 8, 4]], ["tile_y", "sp", [-1, 1, 1, 1]], ["tile_x", "sp", [-1, 1, 1, 1]], ["tile_rc", "sp", [-1, 32]], ["tile_ry", "sp", [-1, 1]], ["tile_rx", "sp", [-1, 1]], ["auto_unroll_max_step", "ot", 1500], ["unroll_explicit", "ot", 0]]}, "result": [[0.39112952225], 0, 3.692507266998291, 1637711731.4475927], "version": 0.2, "tvm_version": "0.8.dev0"}
{"input": ["cuda -keys=cuda,gpu -max_num_threads=1024 -thread_warp_size=32", "conv2d_nchw.cuda", [["TENSOR", [128, 2688, 11, 11], "float32"], ["TENSOR", [672, 2688, 1, 1], "float32"], 1, "SAME", 1, "float32"], {}], "config": {"index": 1078708, "code_hash": null, "entity": [["tile_f", "sp", [-1, 2, 1, 42]], ["tile_y", "sp", [-1, 1, 1, 11]], ["tile_x", "sp", [-1, 1, 1, 1]], ["tile_rc", "sp", [-1, 24]], ["tile_ry", "sp", [-1, 1]], ["tile_rx", "sp", [-1, 1]], ["auto_unroll_max_step", "ot", 1500], ["unroll_explicit", "ot", 0]]}, "result": [[8.1008660965], 0, 44.24211764335632, 1637711774.5624504], "version": 0.2, "tvm_version": "0.8.dev0"}
{"input": ["cuda -keys=cuda,gpu -max_num_threads=1024 -thread_warp_size=32", "conv2d_nchw.cuda", [["TENSOR", [128, 2688, 11, 11], "float32"], ["TENSOR", [672, 2688, 1, 1], "float32"], 1, "SAME", 1, "float32"], {}], "config": {"index": 2312471, "code_hash": null, "entity": [["tile_f", "sp", [-1, 4, 2, 28]], ["tile_y", "sp", [-1, 1, 1, 1]], ["tile_x", "sp", [-1, 11, 1, 1]], ["tile_rc", "sp", [-1, 2]], ["tile_ry", "sp", [-1, 1]], ["tile_rx", "sp", [-1, 1]], ["auto_unroll_max_step", "ot", 1500], ["unroll_explicit", "ot", 1]]}, "result": [[4.7351033815], 0, 34.759238958358765, 1637711802.37412], "version": 0.2, "tvm_version": "0.8.dev0"}
{"input": ["cuda -keys=cuda,gpu -max_num_threads=1024 -thread_warp_size=32", "conv2d_nchw.cuda", [["TENSOR", [128, 2688, 11, 11], "float32"], ["TENSOR", [672, 2688, 1, 1], "float32"], 1, "SAME", 1, "float32"], {}], "config": {"index": 714158, "code_hash": null, "entity": [["tile_f", "sp", [-1, 4, 3, 1]], ["tile_y", "sp", [-1, 11, 1, 1]], ["tile_x", "sp", [-1, 1, 1, 11]], ["tile_rc", "sp", [-1, 64]], ["tile_ry", "sp", [-1, 1]], ["tile_rx", "sp", [-1, 1]], ["auto_unroll_max_step", "ot", 512], ["unroll_explicit", "ot", 0]]}, "result": [[1.6884311937499998], 0, 11.086883068084717, 1637711812.4840434], "version": 0.2, "tvm_version": "0.8.dev0"}
{"input": ["cuda -keys=cuda,gpu -max_num_threads=1024 -thread_warp_size=32", "conv2d_nchw.cuda", [["TENSOR", [128, 2688, 11, 11], "float32"], ["TENSOR", [672, 2688, 1, 1], "float32"], 1, "SAME", 1, "float32"], {}], "config": {"index": 1958988, "code_hash": null, "entity": [["tile_f", "sp", [-1, 32, 1, 3]], ["tile_y", "sp", [-1, 1, 11, 1]], ["tile_x", "sp", [-1, 1, 11, 1]], ["tile_rc", "sp", [-1, 14]], ["tile_ry", "sp", [-1, 1]], ["tile_rx", "sp", [-1, 1]], ["auto_unroll_max_step", "ot", 512], ["unroll_explicit", "ot", 1]]}, "result": [[0.0331943465], 0, 2.217190742492676, 1637711815.1347506], "version": 0.2, "tvm_version": "0.8.dev0"}
{"input": ["cuda -keys=cuda,gpu -max_num_threads=1024 -thread_warp_size=32", "conv2d_nchw.cuda", [["TENSOR", [128, 2688, 11, 11], "float32"], ["TENSOR", [672, 2688, 1, 1], "float32"], 1, "SAME", 1, "float32"], {}], "config": {"index": 1547538, "code_hash": null, "entity": [["tile_f", "sp", [-1, 3, 28, 1]], ["tile_y", "sp", [-1, 1, 1, 11]], ["tile_x", "sp", [-1, 1, 1, 11]], ["tile_rc", "sp", [-1, 24]], ["tile_ry", "sp", [-1, 1]], ["tile_rx", "sp", [-1, 1]], ["auto_unroll_max_step", "ot", 0], ["unroll_explicit", "ot", 1]]}, "result": [[0.359508965], 0, 3.4458553791046143, 1637711823.0121138], "version": 0.2, "tvm_version": "0.8.dev0"}
{"input": ["cuda -keys=cuda,gpu -max_num_threads=1024 -thread_warp_size=32", "conv2d_nchw.cuda", [["TENSOR", [128, 2688, 11, 11], "float32"], ["TENSOR", [672, 2688, 1, 1], "float32"], 1, "SAME", 1, "float32"], {}], "config": {"index": 2418646, "code_hash": null, "entity": [["tile_f", "sp", [-1, 16, 2, 3]], ["tile_y", "sp", [-1, 1, 1, 11]], ["tile_x", "sp", [-1, 1, 11, 1]], ["tile_rc", "sp", [-1, 14]], ["tile_ry", "sp", [-1, 1]], ["tile_rx", "sp", [-1, 1]], ["auto_unroll_max_step", "ot", 1500], ["unroll_explicit", "ot", 1]]}, "result": [[0.45687047425], 0, 5.878703355789185, 1637711826.9769495], "version": 0.2, "tvm_version": "0.8.dev0"}
{"input": ["cuda -keys=cuda,gpu -max_num_threads=1024 -thread_warp_size=32", "conv2d_nchw.cuda", [["TENSOR", [128, 2688, 11, 11], "float32"], ["TENSOR", [672, 2688, 1, 1], "float32"], 1, "SAME", 1, "float32"], {}], "config": {"index": 2361359, "code_hash": null, "entity": [["tile_f", "sp", [-1, 42, 1, 4]], ["tile_y", "sp", [-1, 1, 1, 11]], ["tile_x", "sp", [-1, 1, 11, 1]], ["tile_rc", "sp", [-1, 6]], ["tile_ry", "sp", [-1, 1]], ["tile_rx", "sp", [-1, 1]], ["auto_unroll_max_step", "ot", 1500], ["unroll_explicit", "ot", 1]]}, "result": [[1.3708978115], 0, 12.68658971786499, 1637711835.675981], "version": 0.2, "tvm_version": "0.8.dev0"}
{"input": ["cuda -keys=cuda,gpu -max_num_threads=1024 -thread_warp_size=32", "conv2d_nchw.cuda", [["TENSOR", [128, 2688, 11, 11], "float32"], ["TENSOR", [672, 2688, 1, 1], "float32"], 1, "SAME", 1, "float32"], {}], "config": {"index": 1679242, "code_hash": null, "entity": [["tile_f", "sp", [-1, 1, 24, 1]], ["tile_y", "sp", [-1, 1, 11, 1]], ["tile_x", "sp", [-1, 1, 1, 1]], ["tile_rc", "sp", [-1, 128]], ["tile_ry", "sp", [-1, 1]], ["tile_rx", "sp", [-1, 1]], ["auto_unroll_max_step", "ot", 0], ["unroll_explicit", "ot", 1]]}, "result": [[0.0441206245], 0, 1.7688710689544678, 1637711837.2516716], "version": 0.2, "tvm_version": "0.8.dev0"}
{"input": ["cuda -keys=cuda,gpu -max_num_threads=1024 -thread_warp_size=32", "conv2d_nchw.cuda", [["TENSOR", [128, 2688, 11, 11], "float32"], ["TENSOR", [672, 2688, 1, 1], "float32"], 1, "SAME", 1, "float32"], {}], "config": {"index": 1277216, "code_hash": null, "entity": [["tile_f", "sp", [-1, 2, 3, 4]], ["tile_y", "sp", [-1, 11, 1, 1]], ["tile_x", "sp", [-1, 1, 1, 1]], ["tile_rc", "sp", [-1, 336]], ["tile_ry", "sp", [-1, 1]], ["tile_rx", "sp", [-1, 1]], ["auto_unroll_max_step", "ot", 1500], ["unroll_explicit", "ot", 0]]}, "result": [[0.31928264], 0, 5.67515754699707, 1637711840.5565321], "version": 0.2, "tvm_version": "0.8.dev0"}
{"input": ["cuda -keys=cuda,gpu -max_num_threads=1024 -thread_warp_size=32", "conv2d_nchw.cuda", [["TENSOR", [128, 2688, 11, 11], "float32"], ["TENSOR", [672, 2688, 1, 1], "float32"], 1, "SAME", 1, "float32"], {}], "config": {"index": 1479652, "code_hash": null, "entity": [["tile_f", "sp", [-1, 4, 7, 3]], ["tile_y", "sp", [-1, 1, 1, 11]], ["tile_x", "sp", [-1, 1, 1, 1]], ["tile_rc", "sp", [-1, 12]], ["tile_ry", "sp", [-1, 1]], ["tile_rx", "sp", [-1, 1]], ["auto_unroll_max_step", "ot", 0], ["unroll_explicit", "ot", 1]]}, "result": [[0.03630137275], 0, 1.9415867328643799, 1637711842.224773], "version": 0.2, "tvm_version": "0.8.dev0"}
{"input": ["cuda -keys=cuda,gpu -max_num_threads=1024 -thread_warp_size=32", "conv2d_nchw.cuda", [["TENSOR", [128, 2688, 11, 11], "float32"], ["TENSOR", [672, 2688, 1, 1], "float32"], 1, "SAME", 1, "float32"], {}], "config": {"index": 1012353, "code_hash": null, "entity": [["tile_f", "sp", [-1, 2, 2, 24]], ["tile_y", "sp", [-1, 11, 1, 1]], ["tile_x", "sp", [-1, 1, 11, 1]], ["tile_rc", "sp", [-1, 8]], ["tile_ry", "sp", [-1, 1]], ["tile_rx", "sp", [-1, 1]], ["auto_unroll_max_step", "ot", 1500], ["unroll_explicit", "ot", 0]]}, "result": [[0.58121019975], 0, 5.39582896232605, 1637711846.790158], "version": 0.2, "tvm_version": "0.8.dev0"}
{"input": ["cuda -keys=cuda,gpu -max_num_threads=1024 -thread_warp_size=32", "conv2d_nchw.cuda", [["TENSOR", [128, 2688, 11, 11], "float32"], ["TENSOR", [672, 2688, 1, 1], "float32"], 1, "SAME", 1, "float32"], {}], "config": {"index": 1859754, "code_hash": null, "entity": [["tile_f", "sp", [-1, 6, 4, 7]], ["tile_y", "sp", [-1, 1, 1, 11]], ["tile_x", "sp", [-1, 1, 11, 1]], ["tile_rc", "sp", [-1, 2]], ["tile_ry", "sp", [-1, 1]], ["tile_rx", "sp", [-1, 1]], ["auto_unroll_max_step", "ot", 512], ["unroll_explicit", "ot", 1]]}, "result": [[0.27839333725], 0, 4.473549842834473, 1637711849.7130363], "version": 0.2, "tvm_version": "0.8.dev0"}
{"input": ["cuda -keys=cuda,gpu -max_num_threads=1024 -thread_warp_size=32", "conv2d_nchw.cuda", [["TENSOR", [128, 2688, 11, 11], "float32"], ["TENSOR", [672, 2688, 1, 1], "float32"], 1, "SAME", 1, "float32"], {}], "config": {"index": 2342596, "code_hash": null, "entity": [["tile_f", "sp", [-1, 14, 12, 4]], ["tile_y", "sp", [-1, 1, 11, 1]], ["tile_x", "sp", [-1, 11, 1, 1]], ["tile_rc", "sp", [-1, 4]], ["tile_ry", "sp", [-1, 1]], ["tile_rx", "sp", [-1, 1]], ["auto_unroll_max_step", "ot", 1500], ["unroll_explicit", "ot", 1]]}, "result": [[0.25020890700000004], 0, 5.104156494140625, 1637711852.6379366], "version": 0.2, "tvm_version": "0.8.dev0"}
{"input": ["cuda -keys=cuda,gpu -max_num_threads=1024 -thread_warp_size=32", "conv2d_nchw.cuda", [["TENSOR", [128, 2688, 11, 11], "float32"], ["TENSOR", [672, 2688, 1, 1], "float32"], 1, "SAME", 1, "float32"], {}], "config": {"index": 2434517, "code_hash": null, "entity": [["tile_f", "sp", [-1, 4, 7, 1]], ["tile_y", "sp", [-1, 11, 1, 1]], ["tile_x", "sp", [-1, 1, 1, 11]], ["tile_rc", "sp", [-1, 16]], ["tile_ry", "sp", [-1, 1]], ["tile_rx", "sp", [-1, 1]], ["auto_unroll_max_step", "ot", 1500], ["unroll_explicit", "ot", 1]]}, "result": [[1.204122447], 0, 9.554675817489624, 1637711860.3101268], "version": 0.2, "tvm_version": "0.8.dev0"}
{"input": ["cuda -keys=cuda,gpu -max_num_threads=1024 -thread_warp_size=32", "conv2d_nchw.cuda", [["TENSOR", [128, 2688, 11, 11], "float32"], ["TENSOR", [672, 2688, 1, 1], "float32"], 1, "SAME", 1, "float32"], {}], "config": {"index": 2013085, "code_hash": null, "entity": [["tile_f", "sp", [-1, 1, 1, 14]], ["tile_y", "sp", [-1, 1, 11, 1]], ["tile_x", "sp", [-1, 11, 1, 1]], ["tile_rc", "sp", [-1, 28]], ["tile_ry", "sp", [-1, 1]], ["tile_rx", "sp", [-1, 1]], ["auto_unroll_max_step", "ot", 512], ["unroll_explicit", "ot", 1]]}, "result": [[0.020051946666666664], 0, 2.5111379623413086, 1637711862.0069163], "version": 0.2, "tvm_version": "0.8.dev0"}
{"input": ["cuda -keys=cuda,gpu -max_num_threads=1024 -thread_warp_size=32", "conv2d_nchw.cuda", [["TENSOR", [128, 2688, 11, 11], "float32"], ["TENSOR", [672, 2688, 1, 1], "float32"], 1, "SAME", 1, "float32"], {}], "config": {"index": 1156773, "code_hash": null, "entity": [["tile_f", "sp", [-1, 42, 2, 1]], ["tile_y", "sp", [-1, 1, 1, 11]], ["tile_x", "sp", [-1, 1, 11, 1]], ["tile_rc", "sp", [-1, 56]], ["tile_ry", "sp", [-1, 1]], ["tile_rx", "sp", [-1, 1]], ["auto_unroll_max_step", "ot", 1500], ["unroll_explicit", "ot", 0]]}, "result": [[0.19577880925], 0, 5.9378883838653564, 1637711865.4525535], "version": 0.2, "tvm_version": "0.8.dev0"}
{"input": ["cuda -keys=cuda,gpu -max_num_threads=1024 -thread_warp_size=32", "conv2d_nchw.cuda", [["TENSOR", [128, 2688, 11, 11], "float32"], ["TENSOR", [672, 2688, 1, 1], "float32"], 1, "SAME", 1, "float32"], {}], "config": {"index": 672098, "code_hash": null, "entity": [["tile_f", "sp", [-1, 6, 8, 1]], ["tile_y", "sp", [-1, 1, 11, 1]], ["tile_x", "sp", [-1, 1, 1, 11]], ["tile_rc", "sp", [-1, 42]], ["tile_ry", "sp", [-1, 1]], ["tile_rx", "sp", [-1, 1]], ["auto_unroll_max_step", "ot", 512], ["unroll_explicit", "ot", 0]]}, "result": [[0.009380211272727272], 0, 1.9273817539215088, 1637711867.0578914], "version": 0.2, "tvm_version": "0.8.dev0"}
{"input": ["cuda -keys=cuda,gpu -max_num_threads=1024 -thread_warp_size=32", "conv2d_nchw.cuda", [["TENSOR", [128, 2688, 11, 11], "float32"], ["TENSOR", [672, 2688, 1, 1], "float32"], 1, "SAME", 1, "float32"], {}], "config": {"index": 1589610, "code_hash": null, "entity": [["tile_f", "sp", [-1, 1, 12, 1]], ["tile_y", "sp", [-1, 1, 11, 1]], ["tile_x", "sp", [-1, 1, 1, 11]], ["tile_rc", "sp", [-1, 42]], ["tile_ry", "sp", [-1, 1]], ["tile_rx", "sp", [-1, 1]], ["auto_unroll_max_step", "ot", 0], ["unroll_explicit", "ot", 1]]}, "result": [[0.02734158125], 0, 1.787886142730713, 1637711943.0631766], "version": 0.2, "tvm_version": "0.8.dev0"}
{"input": ["cuda -keys=cuda,gpu -max_num_threads=1024 -thread_warp_size=32", "conv2d_nchw.cuda", [["TENSOR", [128, 2688, 11, 11], "float32"], ["TENSOR", [672, 2688, 1, 1], "float32"], 1, "SAME", 1, "float32"], {}], "config": {"index": 2048362, "code_hash": null, "entity": [["tile_f", "sp", [-1, 1, 12, 1]], ["tile_y", "sp", [-1, 1, 11, 1]], ["tile_x", "sp", [-1, 1, 1, 11]], ["tile_rc", "sp", [-1, 42]], ["tile_ry", "sp", [-1, 1]], ["tile_rx", "sp", [-1, 1]], ["auto_unroll_max_step", "ot", 512], ["unroll_explicit", "ot", 1]]}, "result": [[0.023773494833333336], 0, 2.471127986907959, 1637711944.6514323], "version": 0.2, "tvm_version": "0.8.dev0"}
{"input": ["cuda -keys=cuda,gpu -max_num_threads=1024 -thread_warp_size=32", "conv2d_nchw.cuda", [["TENSOR", [128, 2688, 11, 11], "float32"], ["TENSOR", [672, 2688, 1, 1], "float32"], 1, "SAME", 1, "float32"], {}], "config": {"index": 1457886, "code_hash": null, "entity": [["tile_f", "sp", [-1, 1, 8, 1]], ["tile_y", "sp", [-1, 1, 1, 11]], ["tile_x", "sp", [-1, 1, 11, 1]], ["tile_rc", "sp", [-1, 7]], ["tile_ry", "sp", [-1, 1]], ["tile_rx", "sp", [-1, 1]], ["auto_unroll_max_step", "ot", 0], ["unroll_explicit", "ot", 1]]}, "result": [[0.021374221], 0, 1.8449573516845703, 1637711946.1558168], "version": 0.2, "tvm_version": "0.8.dev0"}
{"input": ["cuda -keys=cuda,gpu -max_num_threads=1024 -thread_warp_size=32", "conv2d_nchw.cuda", [["TENSOR", [128, 2688, 11, 11], "float32"], ["TENSOR", [672, 2688, 1, 1], "float32"], 1, "SAME", 1, "float32"], {}], "config": {"index": 1916638, "code_hash": null, "entity": [["tile_f", "sp", [-1, 1, 8, 1]], ["tile_y", "sp", [-1, 1, 1, 11]], ["tile_x", "sp", [-1, 1, 11, 1]], ["tile_rc", "sp", [-1, 7]], ["tile_ry", "sp", [-1, 1]], ["tile_rx", "sp", [-1, 1]], ["auto_unroll_max_step", "ot", 512], ["unroll_explicit", "ot", 1]]}, "result": [[0.019975732], 0, 1.8973674774169922, 1637711947.647219], "version": 0.2, "tvm_version": "0.8.dev0"}
{"input": ["cuda -keys=cuda,gpu -max_num_threads=1024 -thread_warp_size=32", "conv2d_nchw.cuda", [["TENSOR", [128, 2688, 11, 11], "float32"], ["TENSOR", [672, 2688, 1, 1], "float32"], 1, "SAME", 1, "float32"], {}], "config": {"index": 1457898, "code_hash": null, "entity": [["tile_f", "sp", [-1, 1, 12, 1]], ["tile_y", "sp", [-1, 1, 1, 11]], ["tile_x", "sp", [-1, 1, 11, 1]], ["tile_rc", "sp", [-1, 7]], ["tile_ry", "sp", [-1, 1]], ["tile_rx", "sp", [-1, 1]], ["auto_unroll_max_step", "ot", 0], ["unroll_explicit", "ot", 1]]}, "result": [[0.018118457833333334], 0, 1.9189403057098389, 1637711949.1310048], "version": 0.2, "tvm_version": "0.8.dev0"}
{"input": ["cuda -keys=cuda,gpu -max_num_threads=1024 -thread_warp_size=32", "conv2d_nchw.cuda", [["TENSOR", [128, 2688, 11, 11], "float32"], ["TENSOR", [672, 2688, 1, 1], "float32"], 1, "SAME", 1, "float32"], {}], "config": {"index": 1472234, "code_hash": null, "entity": [["tile_f", "sp", [-1, 1, 12, 1]], ["tile_y", "sp", [-1, 1, 1, 11]], ["tile_x", "sp", [-1, 1, 11, 1]], ["tile_rc", "sp", [-1, 8]], ["tile_ry", "sp", [-1, 1]], ["tile_rx", "sp", [-1, 1]], ["auto_unroll_max_step", "ot", 0], ["unroll_explicit", "ot", 1]]}, "result": [[0.018829801833333333], 0, 1.9456889629364014, 1637711950.5945718], "version": 0.2, "tvm_version": "0.8.dev0"}
{"input": ["cuda -keys=cuda,gpu -max_num_threads=1024 -thread_warp_size=32", "conv2d_nchw.cuda", [["TENSOR", [128, 2688, 11, 11], "float32"], ["TENSOR", [672, 2688, 1, 1], "float32"], 1, "SAME", 1, "float32"], {}], "config": {"index": 1930986, "code_hash": null, "entity": [["tile_f", "sp", [-1, 1, 12, 1]], ["tile_y", "sp", [-1, 1, 1, 11]], ["tile_x", "sp", [-1, 1, 11, 1]], ["tile_rc", "sp", [-1, 8]], ["tile_ry", "sp", [-1, 1]], ["tile_rx", "sp", [-1, 1]], ["auto_unroll_max_step", "ot", 512], ["unroll_explicit", "ot", 1]]}, "result": [[0.0193950505], 0, 2.02754282951355, 1637711952.0867474], "version": 0.2, "tvm_version": "0.8.dev0"}
{"input": ["cuda -keys=cuda,gpu -max_num_threads=1024 -thread_warp_size=32", "conv2d_nchw.cuda", [["TENSOR", [128, 2688, 11, 11], "float32"], ["TENSOR", [672, 2688, 1, 1], "float32"], 1, "SAME", 1, "float32"], {}], "config": {"index": 1916650, "code_hash": null, "entity": [["tile_f", "sp", [-1, 1, 12, 1]], ["tile_y", "sp", [-1, 1, 1, 11]], ["tile_x", "sp", [-1, 1, 11, 1]], ["tile_rc", "sp", [-1, 7]], ["tile_ry", "sp", [-1, 1]], ["tile_rx", "sp", [-1, 1]], ["auto_unroll_max_step", "ot", 512], ["unroll_explicit", "ot", 1]]}, "result": [[0.018325601166666667], 0, 2.044536590576172, 1637711953.5958886], "version": 0.2, "tvm_version": "0.8.dev0"}
{"input": ["cuda -keys=cuda,gpu -max_num_threads=1024 -thread_warp_size=32", "conv2d_nchw.cuda", [["TENSOR", [128, 2688, 11, 11], "float32"], ["TENSOR", [672, 2688, 1, 1], "float32"], 1, "SAME", 1, "float32"], {}], "config": {"index": 672106, "code_hash": null, "entity": [["tile_f", "sp", [-1, 1, 12, 1]], ["tile_y", "sp", [-1, 1, 11, 1]], ["tile_x", "sp", [-1, 1, 1, 11]], ["tile_rc", "sp", [-1, 42]], ["tile_ry", "sp", [-1, 1]], ["tile_rx", "sp", [-1, 1]], ["auto_unroll_max_step", "ot", 512], ["unroll_explicit", "ot", 0]]}, "result": [[0.027415704000000003], 0, 2.036080837249756, 1637711955.0708609], "version": 0.2, "tvm_version": "0.8.dev0"}
{"input": ["cuda -keys=cuda,gpu -max_num_threads=1024 -thread_warp_size=32", "conv2d_nchw.cuda", [["TENSOR", [128, 2688, 11, 11], "float32"], ["TENSOR", [672, 2688, 1, 1], "float32"], 1, "SAME", 1, "float32"], {}], "config": {"index": 213354, "code_hash": null, "entity": [["tile_f", "sp", [-1, 1, 12, 1]], ["tile_y", "sp", [-1, 1, 11, 1]], ["tile_x", "sp", [-1, 1, 1, 11]], ["tile_rc", "sp", [-1, 42]], ["tile_ry", "sp", [-1, 1]], ["tile_rx", "sp", [-1, 1]], ["auto_unroll_max_step", "ot", 0], ["unroll_explicit", "ot", 0]]}, "result": [[0.024657683333333333], 0, 1.7346312999725342, 1637711956.5496836], "version": 0.2, "tvm_version": "0.8.dev0"}
{"input": ["cuda -keys=cuda,gpu -max_num_threads=1024 -thread_warp_size=32", "conv2d_nchw.cuda", [["TENSOR", [128, 2688, 11, 11], "float32"], ["TENSOR", [672, 2688, 1, 1], "float32"], 1, "SAME", 1, "float32"], {}], "config": {"index": 1930996, "code_hash": null, "entity": [["tile_f", "sp", [-1, 3, 14, 1]], ["tile_y", "sp", [-1, 1, 1, 11]], ["tile_x", "sp", [-1, 1, 11, 1]], ["tile_rc", "sp", [-1, 8]], ["tile_ry", "sp", [-1, 1]], ["tile_rx", "sp", [-1, 1]], ["auto_unroll_max_step", "ot", 512], ["unroll_explicit", "ot", 1]]}, "result": [[0.0066335955000000005], 0, 2.000068426132202, 1637711957.9573314], "version": 0.2, "tvm_version": "0.8.dev0"}
{"input": ["cuda -keys=cuda,gpu -max_num_threads=1024 -thread_warp_size=32", "conv2d_nchw.cuda", [["TENSOR", [128, 2688, 11, 11], "float32"], ["TENSOR", [672, 2688, 1, 1], "float32"], 1, "SAME", 1, "float32"], {}], "config": {"index": 1472244, "code_hash": null, "entity": [["tile_f", "sp", [-1, 3, 14, 1]], ["tile_y", "sp", [-1, 1, 1, 11]], ["tile_x", "sp", [-1, 1, 11, 1]], ["tile_rc", "sp", [-1, 8]], ["tile_ry", "sp", [-1, 1]], ["tile_rx", "sp", [-1, 1]], ["auto_unroll_max_step", "ot", 0], ["unroll_explicit", "ot", 1]]}, "result": [[0.007320853142857143], 0, 1.8034090995788574, 1637711959.3549447], "version": 0.2, "tvm_version": "0.8.dev0"}
{"input": ["cuda -keys=cuda,gpu -max_num_threads=1024 -thread_warp_size=32", "conv2d_nchw.cuda", [["TENSOR", [128, 2688, 11, 11], "float32"], ["TENSOR", [672, 2688, 1, 1], "float32"], 1, "SAME", 1, "float32"], {}], "config": {"index": 2042986, "code_hash": null, "entity": [["tile_f", "sp", [-1, 1, 12, 1]], ["tile_y", "sp", [-1, 1, 1, 1]], ["tile_x", "sp", [-1, 1, 11, 1]], ["tile_rc", "sp", [-1, 42]], ["tile_ry", "sp", [-1, 1]], ["tile_rx", "sp", [-1, 1]], ["auto_unroll_max_step", "ot", 512], ["unroll_explicit", "ot", 1]]}, "result": [[0.033128922500000005], 0, 1.7859351634979248, 1637711960.7997503], "version": 0.2, "tvm_version": "0.8.dev0"}
{"input": ["cuda -keys=cuda,gpu -max_num_threads=1024 -thread_warp_size=32", "conv2d_nchw.cuda", [["TENSOR", [128, 2688, 11, 11], "float32"], ["TENSOR", [672, 2688, 1, 1], "float32"], 1, "SAME", 1, "float32"], {}], "config": {"index": 666730, "code_hash": null, "entity": [["tile_f", "sp", [-1, 1, 12, 1]], ["tile_y", "sp", [-1, 1, 1, 1]], ["tile_x", "sp", [-1, 1, 11, 1]], ["tile_rc", "sp", [-1, 42]], ["tile_ry", "sp", [-1, 1]], ["tile_rx", "sp", [-1, 1]], ["auto_unroll_max_step", "ot", 512], ["unroll_explicit", "ot", 0]]}, "result": [[0.032297323749999995], 0, 1.960937261581421, 1637711962.2452202], "version": 0.2, "tvm_version": "0.8.dev0"}
{"input": ["cuda -keys=cuda,gpu -max_num_threads=1024 -thread_warp_size=32", "conv2d_nchw.cuda", [["TENSOR", [128, 2688, 11, 11], "float32"], ["TENSOR", [672, 2688, 1, 1], "float32"], 1, "SAME", 1, "float32"], {}], "config": {"index": 1584234, "code_hash": null, "entity": [["tile_f", "sp", [-1, 1, 12, 1]], ["tile_y", "sp", [-1, 1, 1, 1]], ["tile_x", "sp", [-1, 1, 11, 1]], ["tile_rc", "sp", [-1, 42]], ["tile_ry", "sp", [-1, 1]], ["tile_rx", "sp", [-1, 1]], ["auto_unroll_max_step", "ot", 0], ["unroll_explicit", "ot", 1]]}, "result": [[0.0327484345], 0, 1.9039762020111084, 1637711963.6532521], "version": 0.2, "tvm_version": "0.8.dev0"}
{"input": ["cuda -keys=cuda,gpu -max_num_threads=1024 -thread_warp_size=32", "conv2d_nchw.cuda", [["TENSOR", [128, 2688, 11, 11], "float32"], ["TENSOR", [672, 2688, 1, 1], "float32"], 1, "SAME", 1, "float32"], {}], "config": {"index": 207978, "code_hash": null, "entity": [["tile_f", "sp", [-1, 1, 12, 1]], ["tile_y", "sp", [-1, 1, 1, 1]], ["tile_x", "sp", [-1, 1, 11, 1]], ["tile_rc", "sp", [-1, 42]], ["tile_ry", "sp", [-1, 1]], ["tile_rx", "sp", [-1, 1]], ["auto_unroll_max_step", "ot", 0], ["unroll_explicit", "ot", 0]]}, "result": [[0.032754434250000006], 0, 1.7924327850341797, 1637711964.9739525], "version": 0.2, "tvm_version": "0.8.dev0"}
{"input": ["cuda -keys=cuda,gpu -max_num_threads=1024 -thread_warp_size=32", "conv2d_nchw.cuda", [["TENSOR", [128, 2688, 11, 11], "float32"], ["TENSOR", [672, 2688, 1, 1], "float32"], 1, "SAME", 1, "float32"], {}], "config": {"index": 2507114, "code_hash": null, "entity": [["tile_f", "sp", [-1, 1, 12, 1]], ["tile_y", "sp", [-1, 1, 11, 1]], ["tile_x", "sp", [-1, 1, 1, 11]], ["tile_rc", "sp", [-1, 42]], ["tile_ry", "sp", [-1, 1]], ["tile_rx", "sp", [-1, 1]], ["auto_unroll_max_step", "ot", 1500], ["unroll_explicit", "ot", 1]]}, "result": [[0.023547868500000003], 0, 2.3285415172576904, 1637711966.3827052], "version": 0.2, "tvm_version": "0.8.dev0"}
{"input": ["cuda -keys=cuda,gpu -max_num_threads=1024 -thread_warp_size=32", "conv2d_nchw.cuda", [["TENSOR", [128, 2688, 11, 11], "float32"], ["TENSOR", [672, 2688, 1, 1], "float32"], 1, "SAME", 1, "float32"], {}], "config": {"index": 81630, "code_hash": null, "entity": [["tile_f", "sp", [-1, 1, 8, 1]], ["tile_y", "sp", [-1, 1, 1, 11]], ["tile_x", "sp", [-1, 1, 11, 1]], ["tile_rc", "sp", [-1, 7]], ["tile_ry", "sp", [-1, 1]], ["tile_rx", "sp", [-1, 1]], ["auto_unroll_max_step", "ot", 0], ["unroll_explicit", "ot", 0]]}, "result": [[0.021245025], 0, 1.8374297618865967, 1637711967.7798557], "version": 0.2, "tvm_version": "0.8.dev0"}
{"input": ["cuda -keys=cuda,gpu -max_num_threads=1024 -thread_warp_size=32", "conv2d_nchw.cuda", [["TENSOR", [128, 2688, 11, 11], "float32"], ["TENSOR", [672, 2688, 1, 1], "float32"], 1, "SAME", 1, "float32"], {}], "config": {"index": 540382, "code_hash": null, "entity": [["tile_f", "sp", [-1, 1, 8, 1]], ["tile_y", "sp", [-1, 1, 1, 11]], ["tile_x", "sp", [-1, 1, 11, 1]], ["tile_rc", "sp", [-1, 7]], ["tile_ry", "sp", [-1, 1]], ["tile_rx", "sp", [-1, 1]], ["auto_unroll_max_step", "ot", 512], ["unroll_explicit", "ot", 0]]}, "result": [[0.021539732333333336], 0, 2.01025390625, 1637711969.2617145], "version": 0.2, "tvm_version": "0.8.dev0"}
{"input": ["cuda -keys=cuda,gpu -max_num_threads=1024 -thread_warp_size=32", "conv2d_nchw.cuda", [["TENSOR", [128, 2688, 11, 11], "float32"], ["TENSOR", [672, 2688, 1, 1], "float32"], 1, "SAME", 1, "float32"], {}], "config": {"index": 1443550, "code_hash": null, "entity": [["tile_f", "sp", [-1, 1, 8, 1]], ["tile_y", "sp", [-1, 1, 1, 11]], ["tile_x", "sp", [-1, 1, 11, 1]], ["tile_rc", "sp", [-1, 6]], ["tile_ry", "sp", [-1, 1]], ["tile_rx", "sp", [-1, 1]], ["auto_unroll_max_step", "ot", 0], ["unroll_explicit", "ot", 1]]}, "result": [[0.02083655466666667], 0, 2.029104471206665, 1637711970.7347405], "version": 0.2, "tvm_version": "0.8.dev0"}
{"input": ["cuda -keys=cuda,gpu -max_num_threads=1024 -thread_warp_size=32", "conv2d_nchw.cuda", [["TENSOR", [128, 2688, 11, 11], "float32"], ["TENSOR", [672, 2688, 1, 1], "float32"], 1, "SAME", 1, "float32"], {}], "config": {"index": 1902302, "code_hash": null, "entity": [["tile_f", "sp", [-1, 1, 8, 1]], ["tile_y", "sp", [-1, 1, 1, 11]], ["tile_x", "sp", [-1, 1, 11, 1]], ["tile_rc", "sp", [-1, 6]], ["tile_ry", "sp", [-1, 1]], ["tile_rx", "sp", [-1, 1]], ["auto_unroll_max_step", "ot", 512], ["unroll_explicit", "ot", 1]]}, "result": [[0.020320754333333333], 0, 1.845198392868042, 1637711972.1995015], "version": 0.2, "tvm_version": "0.8.dev0"}
{"input": ["cuda -keys=cuda,gpu -max_num_threads=1024 -thread_warp_size=32", "conv2d_nchw.cuda", [["TENSOR", [128, 2688, 11, 11], "float32"], ["TENSOR", [672, 2688, 1, 1], "float32"], 1, "SAME", 1, "float32"], {}], "config": {"index": 2375390, "code_hash": null, "entity": [["tile_f", "sp", [-1, 1, 8, 1]], ["tile_y", "sp", [-1, 1, 1, 11]], ["tile_x", "sp", [-1, 1, 11, 1]], ["tile_rc", "sp", [-1, 7]], ["tile_ry", "sp", [-1, 1]], ["tile_rx", "sp", [-1, 1]], ["auto_unroll_max_step", "ot", 1500], ["unroll_explicit", "ot", 1]]}, "result": [[0.0198842015], 0, 1.8805923461914062, 1637711973.6071076], "version": 0.2, "tvm_version": "0.8.dev0"}
{"input": ["cuda -keys=cuda,gpu -max_num_threads=1024 -thread_warp_size=32", "conv2d_nchw.cuda", [["TENSOR", [128, 2688, 11, 11], "float32"], ["TENSOR", [672, 2688, 1, 1], "float32"], 1, "SAME", 1, "float32"], {}], "config": {"index": 1959676, "code_hash": null, "entity": [["tile_f", "sp", [-1, 1, 16, 1]], ["tile_y", "sp", [-1, 1, 1, 11]], ["tile_x", "sp", [-1, 1, 11, 1]], ["tile_rc", "sp", [-1, 14]], ["tile_ry", "sp", [-1, 1]], ["tile_rx", "sp", [-1, 1]], ["auto_unroll_max_step", "ot", 512], ["unroll_explicit", "ot", 1]]}, "result": [[0.015178089142857143], 0, 1.9542689323425293, 1637711975.0474157], "version": 0.2, "tvm_version": "0.8.dev0"}
{"input": ["cuda -keys=cuda,gpu -max_num_threads=1024 -thread_warp_size=32", "conv2d_nchw.cuda", [["TENSOR", [128, 2688, 11, 11], "float32"], ["TENSOR", [672, 2688, 1, 1], "float32"], 1, "SAME", 1, "float32"], {}], "config": {"index": 1500924, "code_hash": null, "entity": [["tile_f", "sp", [-1, 1, 16, 1]], ["tile_y", "sp", [-1, 1, 1, 11]], ["tile_x", "sp", [-1, 1, 11, 1]], ["tile_rc", "sp", [-1, 14]], ["tile_ry", "sp", [-1, 1]], ["tile_rx", "sp", [-1, 1]], ["auto_unroll_max_step", "ot", 0], ["unroll_explicit", "ot", 1]]}, "result": [[0.015764813285714285], 0, 1.948432207107544, 1637711976.517015], "version": 0.2, "tvm_version": "0.8.dev0"}
{"input": ["cuda -keys=cuda,gpu -max_num_threads=1024 -thread_warp_size=32", "conv2d_nchw.cuda", [["TENSOR", [128, 2688, 11, 11], "float32"], ["TENSOR", [672, 2688, 1, 1], "float32"], 1, "SAME", 1, "float32"], {}], "config": {"index": 1930974, "code_hash": null, "entity": [["tile_f", "sp", [-1, 1, 8, 1]], ["tile_y", "sp", [-1, 1, 1, 11]], ["tile_x", "sp", [-1, 1, 11, 1]], ["tile_rc", "sp", [-1, 8]], ["tile_ry", "sp", [-1, 1]], ["tile_rx", "sp", [-1, 1]], ["auto_unroll_max_step", "ot", 512], ["unroll_explicit", "ot", 1]]}, "result": [[0.01673075166666667], 0, 1.6161067485809326, 1637711979.1330535], "version": 0.2, "tvm_version": "0.8.dev0"}
{"input": ["cuda -keys=cuda,gpu -max_num_threads=1024 -thread_warp_size=32", "conv2d_nchw.cuda", [["TENSOR", [128, 2688, 11, 11], "float32"], ["TENSOR", [672, 2688, 1, 1], "float32"], 1, "SAME", 1, "float32"], {}], "config": {"index": 1945310, "code_hash": null, "entity": [["tile_f", "sp", [-1, 1, 8, 1]], ["tile_y", "sp", [-1, 1, 1, 11]], ["tile_x", "sp", [-1, 1, 11, 1]], ["tile_rc", "sp", [-1, 12]], ["tile_ry", "sp", [-1, 1]], ["tile_rx", "sp", [-1, 1]], ["auto_unroll_max_step", "ot", 512], ["unroll_explicit", "ot", 1]]}, "result": [[0.020304954833333333], 0, 1.7434346675872803, 1637711980.583754], "version": 0.2, "tvm_version": "0.8.dev0"}
{"input": ["cuda -keys=cuda,gpu -max_num_threads=1024 -thread_warp_size=32", "conv2d_nchw.cuda", [["TENSOR", [128, 2688, 11, 11], "float32"], ["TENSOR", [672, 2688, 1, 1], "float32"], 1, "SAME", 1, "float32"], {}], "config": {"index": 1486558, "code_hash": null, "entity": [["tile_f", "sp", [-1, 1, 8, 1]], ["tile_y", "sp", [-1, 1, 1, 11]], ["tile_x", "sp", [-1, 1, 11, 1]], ["tile_rc", "sp", [-1, 12]], ["tile_ry", "sp", [-1, 1]], ["tile_rx", "sp", [-1, 1]], ["auto_unroll_max_step", "ot", 0], ["unroll_explicit", "ot", 1]]}, "result": [[0.020771573166666668], 0, 1.715851068496704, 1637711982.0699022], "version": 0.2, "tvm_version": "0.8.dev0"}
{"input": ["cuda -keys=cuda,gpu -max_num_threads=1024 -thread_warp_size=32", "conv2d_nchw.cuda", [["TENSOR", [128, 2688, 11, 11], "float32"], ["TENSOR", [672, 2688, 1, 1], "float32"], 1, "SAME", 1, "float32"], {}], "config": {"index": 1485892, "code_hash": null, "entity": [["tile_f", "sp", [-1, 1, 1, 3]], ["tile_y", "sp", [-1, 1, 11, 1]], ["tile_x", "sp", [-1, 1, 11, 1]], ["tile_rc", "sp", [-1, 12]], ["tile_ry", "sp", [-1, 1]], ["tile_rx", "sp", [-1, 1]], ["auto_unroll_max_step", "ot", 0], ["unroll_explicit", "ot", 1]]}, "result": [[0.03015574175], 0, 1.6285924911499023, 1637711983.5017369], "version": 0.2, "tvm_version": "0.8.dev0"}
{"input": ["cuda -keys=cuda,gpu -max_num_threads=1024 -thread_warp_size=32", "conv2d_nchw.cuda", [["TENSOR", [128, 2688, 11, 11], "float32"], ["TENSOR", [672, 2688, 1, 1], "float32"], 1, "SAME", 1, "float32"], {}], "config": {"index": 1944644, "code_hash": null, "entity": [["tile_f", "sp", [-1, 1, 1, 3]], ["tile_y", "sp", [-1, 1, 11, 1]], ["tile_x", "sp", [-1, 1, 11, 1]], ["tile_rc", "sp", [-1, 12]], ["tile_ry", "sp", [-1, 1]], ["tile_rx", "sp", [-1, 1]], ["auto_unroll_max_step", "ot", 512], ["unroll_explicit", "ot", 1]]}, "result": [[0.03018361575], 0, 1.6315369606018066, 1637711984.9173682], "version": 0.2, "tvm_version": "0.8.dev0"}
{"input": ["cuda -keys=cuda,gpu -max_num_threads=1024 -thread_warp_size=32", "conv2d_nchw.cuda", [["TENSOR", [128, 2688, 11, 11], "float32"], ["TENSOR", [672, 2688, 1, 1], "float32"], 1, "SAME", 1, "float32"], {}], "config": {"index": 1944645, "code_hash": null, "entity": [["tile_f", "sp", [-1, 2, 1, 3]], ["tile_y", "sp", [-1, 1, 11, 1]], ["tile_x", "sp", [-1, 1, 11, 1]], ["tile_rc", "sp", [-1, 12]], ["tile_ry", "sp", [-1, 1]], ["tile_rx", "sp", [-1, 1]], ["auto_unroll_max_step", "ot", 512], ["unroll_explicit", "ot", 1]]}, "result": [[0.017194203666666668], 0, 1.6711781024932861, 1637711986.3588345], "version": 0.2, "tvm_version": "0.8.dev0"}
{"input": ["cuda -keys=cuda,gpu -max_num_threads=1024 -thread_warp_size=32", "conv2d_nchw.cuda", [["TENSOR", [128, 2688, 11, 11], "float32"], ["TENSOR", [672, 2688, 1, 1], "float32"], 1, "SAME", 1, "float32"], {}], "config": {"index": 1958981, "code_hash": null, "entity": [["tile_f", "sp", [-1, 2, 1, 3]], ["tile_y", "sp", [-1, 1, 11, 1]], ["tile_x", "sp", [-1, 1, 11, 1]], ["tile_rc", "sp", [-1, 14]], ["tile_ry", "sp", [-1, 1]], ["tile_rx", "sp", [-1, 1]], ["auto_unroll_max_step", "ot", 512], ["unroll_explicit", "ot", 1]]}, "result": [[0.015810683285714285], 0, 1.6526150703430176, 1637711987.7692382], "version": 0.2, "tvm_version": "0.8.dev0"}
{"input": ["cuda -keys=cuda,gpu -max_num_threads=1024 -thread_warp_size=32", "conv2d_nchw.cuda", [["TENSOR", [128, 2688, 11, 11], "float32"], ["TENSOR", [672, 2688, 1, 1], "float32"], 1, "SAME", 1, "float32"], {}], "config": {"index": 1485893, "code_hash": null, "entity": [["tile_f", "sp", [-1, 2, 1, 3]], ["tile_y", "sp", [-1, 1, 11, 1]], ["tile_x", "sp", [-1, 1, 11, 1]], ["tile_rc", "sp", [-1, 12]], ["tile_ry", "sp", [-1, 1]], ["tile_rx", "sp", [-1, 1]], ["auto_unroll_max_step", "ot", 0], ["unroll_explicit", "ot", 1]]}, "result": [[0.016865097333333332], 0, 1.6167292594909668, 1637711989.1648016], "version": 0.2, "tvm_version": "0.8.dev0"}
{"input": ["cuda -keys=cuda,gpu -max_num_threads=1024 -thread_warp_size=32", "conv2d_nchw.cuda", [["TENSOR", [128, 2688, 11, 11], "float32"], ["TENSOR", [672, 2688, 1, 1], "float32"], 1, "SAME", 1, "float32"], {}], "config": {"index": 1500229, "code_hash": null, "entity": [["tile_f", "sp", [-1, 2, 1, 3]], ["tile_y", "sp", [-1, 1, 11, 1]], ["tile_x", "sp", [-1, 1, 11, 1]], ["tile_rc", "sp", [-1, 14]], ["tile_ry", "sp", [-1, 1]], ["tile_rx", "sp", [-1, 1]], ["auto_unroll_max_step", "ot", 0], ["unroll_explicit", "ot", 1]]}, "result": [[0.015778384285714285], 0, 1.6136705875396729, 1637711990.5716183], "version": 0.2, "tvm_version": "0.8.dev0"}
{"input": ["cuda -keys=cuda,gpu -max_num_threads=1024 -thread_warp_size=32", "conv2d_nchw.cuda", [["TENSOR", [128, 2688, 11, 11], "float32"], ["TENSOR", [672, 2688, 1, 1], "float32"], 1, "SAME", 1, "float32"], {}], "config": {"index": 1443827, "code_hash": null, "entity": [["tile_f", "sp", [-1, 1, 16, 3]], ["tile_y", "sp", [-1, 1, 1, 11]], ["tile_x", "sp", [-1, 1, 11, 1]], ["tile_rc", "sp", [-1, 6]], ["tile_ry", "sp", [-1, 1]], ["tile_rx", "sp", [-1, 1]], ["auto_unroll_max_step", "ot", 0], ["unroll_explicit", "ot", 1]]}, "result": [[0.007069775333333333], 0, 1.6310181617736816, 1637711991.975689], "version": 0.2, "tvm_version": "0.8.dev0"}
{"input": ["cuda -keys=cuda,gpu -max_num_threads=1024 -thread_warp_size=32", "conv2d_nchw.cuda", [["TENSOR", [128, 2688, 11, 11], "float32"], ["TENSOR", [672, 2688, 1, 1], "float32"], 1, "SAME", 1, "float32"], {}], "config": {"index": 1902579, "code_hash": null, "entity": [["tile_f", "sp", [-1, 1, 16, 3]], ["tile_y", "sp", [-1, 1, 1, 11]], ["tile_x", "sp", [-1, 1, 11, 1]], ["tile_rc", "sp", [-1, 6]], ["tile_ry", "sp", [-1, 1]], ["tile_rx", "sp", [-1, 1]], ["auto_unroll_max_step", "ot", 512], ["unroll_explicit", "ot", 1]]}, "result": [[0.006949792466666666], 0, 1.6989586353302002, 1637711993.343319], "version": 0.2, "tvm_version": "0.8.dev0"}
{"input": ["cuda -keys=cuda,gpu -max_num_threads=1024 -thread_warp_size=32", "conv2d_nchw.cuda", [["TENSOR", [128, 2688, 11, 11], "float32"], ["TENSOR", [672, 2688, 1, 1], "float32"], 1, "SAME", 1, "float32"], {}], "config": {"index": 95978, "code_hash": null, "entity": [["tile_f", "sp", [-1, 1, 12, 1]], ["tile_y", "sp", [-1, 1, 1, 11]], ["tile_x", "sp", [-1, 1, 11, 1]], ["tile_rc", "sp", [-1, 8]], ["tile_ry", "sp", [-1, 1]], ["tile_rx", "sp", [-1, 1]], ["auto_unroll_max_step", "ot", 0], ["unroll_explicit", "ot", 0]]}, "result": [[0.018799486], 0, 1.5653035640716553, 1637711994.7067056], "version": 0.2, "tvm_version": "0.8.dev0"}
{"input": ["cuda -keys=cuda,gpu -max_num_threads=1024 -thread_warp_size=32", "conv2d_nchw.cuda", [["TENSOR", [128, 2688, 11, 11], "float32"], ["TENSOR", [672, 2688, 1, 1], "float32"], 1, "SAME", 1, "float32"], {}], "config": {"index": 540394, "code_hash": null, "entity": [["tile_f", "sp", [-1, 1, 12, 1]], ["tile_y", "sp", [-1, 1, 1, 11]], ["tile_x", "sp", [-1, 1, 11, 1]], ["tile_rc", "sp", [-1, 7]], ["tile_ry", "sp", [-1, 1]], ["tile_rx", "sp", [-1, 1]], ["auto_unroll_max_step", "ot", 512], ["unroll_explicit", "ot", 0]]}, "result": [[0.01829023533333333], 0, 1.6295981407165527, 1637711996.1248786], "version": 0.2, "tvm_version": "0.8.dev0"}
{"input": ["cuda -keys=cuda,gpu -max_num_threads=1024 -thread_warp_size=32", "conv2d_nchw.cuda", [["TENSOR", [128, 2688, 11, 11], "float32"], ["TENSOR", [672, 2688, 1, 1], "float32"], 1, "SAME", 1, "float32"], {}], "config": {"index": 554730, "code_hash": null, "entity": [["tile_f", "sp", [-1, 1, 12, 1]], ["tile_y", "sp", [-1, 1, 1, 11]], ["tile_x", "sp", [-1, 1, 11, 1]], ["tile_rc", "sp", [-1, 8]], ["tile_ry", "sp", [-1, 1]], ["tile_rx", "sp", [-1, 1]], ["auto_unroll_max_step", "ot", 512], ["unroll_explicit", "ot", 0]]}, "result": [[0.0194847975], 0, 1.6223697662353516, 1637711997.5370684], "version": 0.2, "tvm_version": "0.8.dev0"}
{"input": ["cuda -keys=cuda,gpu -max_num_threads=1024 -thread_warp_size=32", "conv2d_nchw.cuda", [["TENSOR", [128, 2688, 11, 11], "float32"], ["TENSOR", [672, 2688, 1, 1], "float32"], 1, "SAME", 1, "float32"], {}], "config": {"index": 81642, "code_hash": null, "entity": [["tile_f", "sp", [-1, 1, 12, 1]], ["tile_y", "sp", [-1, 1, 1, 11]], ["tile_x", "sp", [-1, 1, 11, 1]], ["tile_rc", "sp", [-1, 7]], ["tile_ry", "sp", [-1, 1]], ["tile_rx", "sp", [-1, 1]], ["auto_unroll_max_step", "ot", 0], ["unroll_explicit", "ot", 0]]}, "result": [[0.018125507333333336], 0, 1.6041898727416992, 1637711998.917669], "version": 0.2, "tvm_version": "0.8.dev0"}
{"input": ["cuda -keys=cuda,gpu -max_num_threads=1024 -thread_warp_size=32", "conv2d_nchw.cuda", [["TENSOR", [128, 2688, 11, 11], "float32"], ["TENSOR", [672, 2688, 1, 1], "float32"], 1, "SAME", 1, "float32"], {}], "config": {"index": 554740, "code_hash": null, "entity": [["tile_f", "sp", [-1, 3, 14, 1]], ["tile_y", "sp", [-1, 1, 1, 11]], ["tile_x", "sp", [-1, 1, 11, 1]], ["tile_rc", "sp", [-1, 8]], ["tile_ry", "sp", [-1, 1]], ["tile_rx", "sp", [-1, 1]], ["auto_unroll_max_step", "ot", 512], ["unroll_explicit", "ot", 0]]}, "result": [[0.0071203737272727274], 0, 1.8302311897277832, 1637712000.4861336], "version": 0.2, "tvm_version": "0.8.dev0"}
{"input": ["cuda -keys=cuda,gpu -max_num_threads=1024 -thread_warp_size=32", "conv2d_nchw.cuda", [["TENSOR", [128, 2688, 11, 11], "float32"], ["TENSOR", [672, 2688, 1, 1], "float32"], 1, "SAME", 1, "float32"], {}], "config": {"index": 95988, "code_hash": null, "entity": [["tile_f", "sp", [-1, 3, 14, 1]], ["tile_y", "sp", [-1, 1, 1, 11]], ["tile_x", "sp", [-1, 1, 11, 1]], ["tile_rc", "sp", [-1, 8]], ["tile_ry", "sp", [-1, 1]], ["tile_rx", "sp", [-1, 1]], ["auto_unroll_max_step", "ot", 0], ["unroll_explicit", "ot", 0]]}, "result": [[0.007375636999999999], 0, 1.7148077487945557, 1637712001.9676673], "version": 0.2, "tvm_version": "0.8.dev0"}
{"input": ["cuda -keys=cuda,gpu -max_num_threads=1024 -thread_warp_size=32", "conv2d_nchw.cuda", [["TENSOR", [128, 2688, 11, 11], "float32"], ["TENSOR", [672, 2688, 1, 1], "float32"], 1, "SAME", 1, "float32"], {}], "config": {"index": 2375402, "code_hash": null, "entity": [["tile_f", "sp", [-1, 1, 12, 1]], ["tile_y", "sp", [-1, 1, 1, 11]], ["tile_x", "sp", [-1, 1, 11, 1]], ["tile_rc", "sp", [-1, 7]], ["tile_ry", "sp", [-1, 1]], ["tile_rx", "sp", [-1, 1]], ["auto_unroll_max_step", "ot", 1500], ["unroll_explicit", "ot", 1]]}, "result": [[0.018347017], 0, 1.716583013534546, 1637712003.4325743], "version": 0.2, "tvm_version": "0.8.dev0"}
{"input": ["cuda -keys=cuda,gpu -max_num_threads=1024 -thread_warp_size=32", "conv2d_nchw.cuda", [["TENSOR", [128, 2688, 11, 11], "float32"], ["TENSOR", [672, 2688, 1, 1], "float32"], 1, "SAME", 1, "float32"], {}], "config": {"index": 2389738, "code_hash": null, "entity": [["tile_f", "sp", [-1, 1, 12, 1]], ["tile_y", "sp", [-1, 1, 1, 11]], ["tile_x", "sp", [-1, 1, 11, 1]], ["tile_rc", "sp", [-1, 8]], ["tile_ry", "sp", [-1, 1]], ["tile_rx", "sp", [-1, 1]], ["auto_unroll_max_step", "ot", 1500], ["unroll_explicit", "ot", 1]]}, "result": [[0.01932076933333333], 0, 1.717428207397461, 1637712004.8933415], "version": 0.2, "tvm_version": "0.8.dev0"}
{"input": ["cuda -keys=cuda,gpu -max_num_threads=1024 -thread_warp_size=32", "conv2d_nchw.cuda", [["TENSOR", [128, 2688, 11, 11], "float32"], ["TENSOR", [672, 2688, 1, 1], "float32"], 1, "SAME", 1, "float32"], {}], "config": {"index": 1130858, "code_hash": null, "entity": [["tile_f", "sp", [-1, 1, 12, 1]], ["tile_y", "sp", [-1, 1, 11, 1]], ["tile_x", "sp", [-1, 1, 1, 11]], ["tile_rc", "sp", [-1, 42]], ["tile_ry", "sp", [-1, 1]], ["tile_rx", "sp", [-1, 1]], ["auto_unroll_max_step", "ot", 1500], ["unroll_explicit", "ot", 0]]}, "result": [[0.027374655], 0, 1.7357003688812256, 1637712006.2234786], "version": 0.2, "tvm_version": "0.8.dev0"}
{"input": ["cuda -keys=cuda,gpu -max_num_threads=1024 -thread_warp_size=32", "conv2d_nchw.cuda", [["TENSOR", [128, 2688, 11, 11], "float32"], ["TENSOR", [672, 2688, 1, 1], "float32"], 1, "SAME", 1, "float32"], {}], "config": {"index": 2389748, "code_hash": null, "entity": [["tile_f", "sp", [-1, 3, 14, 1]], ["tile_y", "sp", [-1, 1, 1, 11]], ["tile_x", "sp", [-1, 1, 11, 1]], ["tile_rc", "sp", [-1, 8]], ["tile_ry", "sp", [-1, 1]], ["tile_rx", "sp", [-1, 1]], ["auto_unroll_max_step", "ot", 1500], ["unroll_explicit", "ot", 1]]}, "result": [[0.0066890499375], 0, 1.644909381866455, 1637712007.5147045], "version": 0.2, "tvm_version": "0.8.dev0"}
{"input": ["cuda -keys=cuda,gpu -max_num_threads=1024 -thread_warp_size=32", "conv2d_nchw.cuda", [["TENSOR", [128, 2688, 11, 11], "float32"], ["TENSOR", [672, 2688, 1, 1], "float32"], 1, "SAME", 1, "float32"], {}], "config": {"index": 1930994, "code_hash": null, "entity": [["tile_f", "sp", [-1, 1, 14, 1]], ["tile_y", "sp", [-1, 1, 1, 11]], ["tile_x", "sp", [-1, 1, 11, 1]], ["tile_rc", "sp", [-1, 8]], ["tile_ry", "sp", [-1, 1]], ["tile_rx", "sp", [-1, 1]], ["auto_unroll_max_step", "ot", 512], ["unroll_explicit", "ot", 1]]}, "result": [[0.013338976125], 0, 1.692169189453125, 1637712008.9298162], "version": 0.2, "tvm_version": "0.8.dev0"}
{"input": ["cuda -keys=cuda,gpu -max_num_threads=1024 -thread_warp_size=32", "conv2d_nchw.cuda", [["TENSOR", [128, 2688, 11, 11], "float32"], ["TENSOR", [672, 2688, 1, 1], "float32"], 1, "SAME", 1, "float32"], {}], "config": {"index": 1472242, "code_hash": null, "entity": [["tile_f", "sp", [-1, 1, 14, 1]], ["tile_y", "sp", [-1, 1, 1, 11]], ["tile_x", "sp", [-1, 1, 11, 1]], ["tile_rc", "sp", [-1, 8]], ["tile_ry", "sp", [-1, 1]], ["tile_rx", "sp", [-1, 1]], ["auto_unroll_max_step", "ot", 0], ["unroll_explicit", "ot", 1]]}, "result": [[0.013344575875], 0, 1.6363863945007324, 1637712010.3404546], "version": 0.2, "tvm_version": "0.8.dev0"}
{"input": ["cuda -keys=cuda,gpu -max_num_threads=1024 -thread_warp_size=32", "conv2d_nchw.cuda", [["TENSOR", [128, 2688, 11, 11], "float32"], ["TENSOR", [672, 2688, 1, 1], "float32"], 1, "SAME", 1, "float32"], {}], "config": {"index": 1125482, "code_hash": null, "entity": [["tile_f", "sp", [-1, 1, 12, 1]], ["tile_y", "sp", [-1, 1, 1, 1]], ["tile_x", "sp", [-1, 1, 11, 1]], ["tile_rc", "sp", [-1, 42]], ["tile_ry", "sp", [-1, 1]], ["tile_rx", "sp", [-1, 1]], ["auto_unroll_max_step", "ot", 1500], ["unroll_explicit", "ot", 0]]}, "result": [[0.0322952485], 0, 1.5556013584136963, 1637712011.6717749], "version": 0.2, "tvm_version": "0.8.dev0"}
{"input": ["cuda -keys=cuda,gpu -max_num_threads=1024 -thread_warp_size=32", "conv2d_nchw.cuda", [["TENSOR", [128, 2688, 11, 11], "float32"], ["TENSOR", [672, 2688, 1, 1], "float32"], 1, "SAME", 1, "float32"], {}], "config": {"index": 2501738, "code_hash": null, "entity": [["tile_f", "sp", [-1, 1, 12, 1]], ["tile_y", "sp", [-1, 1, 1, 1]], ["tile_x", "sp", [-1, 1, 11, 1]], ["tile_rc", "sp", [-1, 42]], ["tile_ry", "sp", [-1, 1]], ["tile_rx", "sp", [-1, 1]], ["auto_unroll_max_step", "ot", 1500], ["unroll_explicit", "ot", 1]]}, "result": [[0.03493678975], 0, 1.6367557048797607, 1637712016.887611], "version": 0.2, "tvm_version": "0.8.dev0"}
{"input": ["cuda -keys=cuda,gpu -max_num_threads=1024 -thread_warp_size=32", "conv2d_nchw.cuda", [["TENSOR", [128, 2688, 11, 11], "float32"], ["TENSOR", [672, 2688, 1, 1], "float32"], 1, "SAME", 1, "float32"], {}], "config": {"index": 526046, "code_hash": null, "entity": [["tile_f", "sp", [-1, 1, 8, 1]], ["tile_y", "sp", [-1, 1, 1, 11]], ["tile_x", "sp", [-1, 1, 11, 1]], ["tile_rc", "sp", [-1, 6]], ["tile_ry", "sp", [-1, 1]], ["tile_rx", "sp", [-1, 1]], ["auto_unroll_max_step", "ot", 512], ["unroll_explicit", "ot", 0]]}, "result": [[0.020820271499999998], 0, 1.7684752941131592, 1637712018.4792495], "version": 0.2, "tvm_version": "0.8.dev0"}
{"input": ["cuda -keys=cuda,gpu -max_num_threads=1024 -thread_warp_size=32", "conv2d_nchw.cuda", [["TENSOR", [128, 2688, 11, 11], "float32"], ["TENSOR", [672, 2688, 1, 1], "float32"], 1, "SAME", 1, "float32"], {}], "config": {"index": 67294, "code_hash": null, "entity": [["tile_f", "sp", [-1, 1, 8, 1]], ["tile_y", "sp", [-1, 1, 1, 11]], ["tile_x", "sp", [-1, 1, 11, 1]], ["tile_rc", "sp", [-1, 6]], ["tile_ry", "sp", [-1, 1]], ["tile_rx", "sp", [-1, 1]], ["auto_unroll_max_step", "ot", 0], ["unroll_explicit", "ot", 0]]}, "result": [[0.020734574333333332], 0, 1.8099043369293213, 1637712020.0861375], "version": 0.2, "tvm_version": "0.8.dev0"}
{"input": ["cuda -keys=cuda,gpu -max_num_threads=1024 -thread_warp_size=32", "conv2d_nchw.cuda", [["TENSOR", [128, 2688, 11, 11], "float32"], ["TENSOR", [672, 2688, 1, 1], "float32"], 1, "SAME", 1, "float32"], {}], "config": {"index": 1444025, "code_hash": null, "entity": [["tile_f", "sp", [-1, 1, 12, 7]], ["tile_y", "sp", [-1, 1, 1, 11]], ["tile_x", "sp", [-1, 1, 11, 1]], ["tile_rc", "sp", [-1, 6]], ["tile_ry", "sp", [-1, 1]], ["tile_rx", "sp", [-1, 1]], ["auto_unroll_max_step", "ot", 0], ["unroll_explicit", "ot", 1]]}, "result": [[0.008416274166666666], 0, 1.7391138076782227, 1637712021.5904005], "version": 0.2, "tvm_version": "0.8.dev0"}
{"input": ["cuda -keys=cuda,gpu -max_num_threads=1024 -thread_warp_size=32", "conv2d_nchw.cuda", [["TENSOR", [128, 2688, 11, 11], "float32"], ["TENSOR", [672, 2688, 1, 1], "float32"], 1, "SAME", 1, "float32"], {}], "config": {"index": 1902777, "code_hash": null, "entity": [["tile_f", "sp", [-1, 1, 12, 7]], ["tile_y", "sp", [-1, 1, 1, 11]], ["tile_x", "sp", [-1, 1, 11, 1]], ["tile_rc", "sp", [-1, 6]], ["tile_ry", "sp", [-1, 1]], ["tile_rx", "sp", [-1, 1]], ["auto_unroll_max_step", "ot", 512], ["unroll_explicit", "ot", 1]]}, "result": [[0.009140491272727274], 0, 2.054446220397949, 1637712023.1337934], "version": 0.2, "tvm_version": "0.8.dev0"}
{"input": ["cuda -keys=cuda,gpu -max_num_threads=1024 -thread_warp_size=32", "conv2d_nchw.cuda", [["TENSOR", [128, 2688, 11, 11], "float32"], ["TENSOR", [672, 2688, 1, 1], "float32"], 1, "SAME", 1, "float32"], {}], "config": {"index": 1988348, "code_hash": null, "entity": [["tile_f", "sp", [-1, 1, 16, 1]], ["tile_y", "sp", [-1, 1, 1, 11]], ["tile_x", "sp", [-1, 1, 11, 1]], ["tile_rc", "sp", [-1, 21]], ["tile_ry", "sp", [-1, 1]], ["tile_rx", "sp", [-1, 1]], ["auto_unroll_max_step", "ot", 512], ["unroll_explicit", "ot", 1]]}, "result": [[0.014949053428571429], 0, 1.8566741943359375, 1637712024.6781943], "version": 0.2, "tvm_version": "0.8.dev0"}
{"input": ["cuda -keys=cuda,gpu -max_num_threads=1024 -thread_warp_size=32", "conv2d_nchw.cuda", [["TENSOR", [128, 2688, 11, 11], "float32"], ["TENSOR", [672, 2688, 1, 1], "float32"], 1, "SAME", 1, "float32"], {}], "config": {"index": 1529596, "code_hash": null, "entity": [["tile_f", "sp", [-1, 1, 16, 1]], ["tile_y", "sp", [-1, 1, 1, 11]], ["tile_x", "sp", [-1, 1, 11, 1]], ["tile_rc", "sp", [-1, 21]], ["tile_ry", "sp", [-1, 1]], ["tile_rx", "sp", [-1, 1]], ["auto_unroll_max_step", "ot", 0], ["unroll_explicit", "ot", 1]]}, "result": [[0.015151432714285715], 0, 1.7378969192504883, 1637712026.2111943], "version": 0.2, "tvm_version": "0.8.dev0"}
{"input": ["cuda -keys=cuda,gpu -max_num_threads=1024 -thread_warp_size=32", "conv2d_nchw.cuda", [["TENSOR", [128, 2688, 11, 11], "float32"], ["TENSOR", [672, 2688, 1, 1], "float32"], 1, "SAME", 1, "float32"], {}], "config": {"index": 1945582, "code_hash": null, "entity": [["tile_f", "sp", [-1, 1, 14, 3]], ["tile_y", "sp", [-1, 1, 1, 11]], ["tile_x", "sp", [-1, 1, 11, 1]], ["tile_rc", "sp", [-1, 12]], ["tile_ry", "sp", [-1, 1]], ["tile_rx", "sp", [-1, 1]], ["auto_unroll_max_step", "ot", 512], ["unroll_explicit", "ot", 1]]}, "result": [[0.008521220833333334], 0, 1.9693100452423096, 1637712027.7476912], "version": 0.2, "tvm_version": "0.8.dev0"}
