artifacts/microbenchmark/tvm/e2e/autotvm_log/conv2d_128_96_165_165_42_1_1_1_SAME_add.log
{"input": ["cuda -keys=cuda,gpu -max_num_threads=1024 -thread_warp_size=32", "conv2d_nchw.cuda", [["TENSOR", [128, 96, 165, 165], "float32"], ["TENSOR", [42, 96, 1, 1], "float32"], 1, "SAME", 1, "float32"], {}], "config": {"index": 3253094, "code_hash": null, "entity": [["tile_f", "sp", [-1, 7, 1, 3]], ["tile_y", "sp", [-1, 3, 5, 1]], ["tile_x", "sp", [-1, 1, 165, 1]], ["tile_rc", "sp", [-1, 1]], ["tile_ry", "sp", [-1, 1]], ["tile_rx", "sp", [-1, 1]], ["auto_unroll_max_step", "ot", 512], ["unroll_explicit", "ot", 0]]}, "result": [[0.007384384214285714], 0, 7.058011531829834, 1637671111.6656256], "version": 0.2, "tvm_version": "0.8.dev0"}
{"input": ["cuda -keys=cuda,gpu -max_num_threads=1024 -thread_warp_size=32", "conv2d_nchw.cuda", [["TENSOR", [128, 96, 165, 165], "float32"], ["TENSOR", [42, 96, 1, 1], "float32"], 1, "SAME", 1, "float32"], {}], "config": {"index": 10508618, "code_hash": null, "entity": [["tile_f", "sp", [-1, 7, 2, 1]], ["tile_y", "sp", [-1, 3, 1, 5]], ["tile_x", "sp", [-1, 33, 1, 1]], ["tile_rc", "sp", [-1, 6]], ["tile_ry", "sp", [-1, 1]], ["tile_rx", "sp", [-1, 1]], ["auto_unroll_max_step", "ot", 0], ["unroll_explicit", "ot", 1]]}, "result": [[3.854369225], 0, 26.192795515060425, 1637671138.9870348], "version": 0.2, "tvm_version": "0.8.dev0"}
{"input": ["cuda -keys=cuda,gpu -max_num_threads=1024 -thread_warp_size=32", "conv2d_nchw.cuda", [["TENSOR", [128, 96, 165, 165], "float32"], ["TENSOR", [42, 96, 1, 1], "float32"], 1, "SAME", 1, "float32"], {}], "config": {"index": 13824021, "code_hash": null, "entity": [["tile_f", "sp", [-1, 6, 7, 1]], ["tile_y", "sp", [-1, 1, 1, 1]], ["tile_x", "sp", [-1, 5, 1, 11]], ["tile_rc", "sp", [-1, 6]], ["tile_ry", "sp", [-1, 1]], ["tile_rx", "sp", [-1, 1]], ["auto_unroll_max_step", "ot", 512], ["unroll_explicit", "ot", 1]]}, "result": [[0.9995985937499999], 0, 13.317635774612427, 1637671154.2995389], "version": 0.2, "tvm_version": "0.8.dev0"}
{"input": ["cuda -keys=cuda,gpu -max_num_threads=1024 -thread_warp_size=32", "conv2d_nchw.cuda", [["TENSOR", [128, 96, 165, 165], "float32"], ["TENSOR", [42, 96, 1, 1], "float32"], 1, "SAME", 1, "float32"], {}], "config": {"index": 13385245, "code_hash": null, "entity": [["tile_f", "sp", [-1, 7, 1, 2]], ["tile_y", "sp", [-1, 1, 11, 15]], ["tile_x", "sp", [-1, 11, 1, 1]], ["tile_rc", "sp", [-1, 4]], ["tile_ry", "sp", [-1, 1]], ["tile_rx", "sp", [-1, 1]], ["auto_unroll_max_step", "ot", 512], ["unroll_explicit", "ot", 1]]}, "result": [[0.75375511525], 0, 11.41614031791687, 1637671166.0817351], "version": 0.2, "tvm_version": "0.8.dev0"}
{"input": ["cuda -keys=cuda,gpu -max_num_threads=1024 -thread_warp_size=32", "conv2d_nchw.cuda", [["TENSOR", [128, 96, 165, 165], "float32"], ["TENSOR", [42, 96, 1, 1], "float32"], 1, "SAME", 1, "float32"], {}], "config": {"index": 1348283, "code_hash": null, "entity": [["tile_f", "sp", [-1, 1, 3, 14]], ["tile_y", "sp", [-1, 11, 3, 1]], ["tile_x", "sp", [-1, 5, 3, 1]], ["tile_rc", "sp", [-1, 8]], ["tile_ry", "sp", [-1, 1]], ["tile_rx", "sp", [-1, 1]], ["auto_unroll_max_step", "ot", 0], ["unroll_explicit", "ot", 0]]}, "result": [[0.2480639825], 0, 9.505509376525879, 1637671182.2850888], "version": 0.2, "tvm_version": "0.8.dev0"}
{"input": ["cuda -keys=cuda,gpu -max_num_threads=1024 -thread_warp_size=32", "conv2d_nchw.cuda", [["TENSOR", [128, 96, 165, 165], "float32"], ["TENSOR", [42, 96, 1, 1], "float32"], 1, "SAME", 1, "float32"], {}], "config": {"index": 12614552, "code_hash": null, "entity": [["tile_f", "sp", [-1, 1, 21, 1]], ["tile_y", "sp", [-1, 3, 1, 11]], ["tile_x", "sp", [-1, 165, 1, 1]], ["tile_rc", "sp", [-1, 1]], ["tile_ry", "sp", [-1, 1]], ["tile_rx", "sp", [-1, 1]], ["auto_unroll_max_step", "ot", 512], ["unroll_explicit", "ot", 1]]}, "result": [[0.56989837075], 0, 16.44930124282837, 1637671192.3835979], "version": 0.2, "tvm_version": "0.8.dev0"}
{"input": ["cuda -keys=cuda,gpu -max_num_threads=1024 -thread_warp_size=32", "conv2d_nchw.cuda", [["TENSOR", [128, 96, 165, 165], "float32"], ["TENSOR", [42, 96, 1, 1], "float32"], 1, "SAME", 1, "float32"], {}], "config": {"index": 1132964, "code_hash": null, "entity": [["tile_f", "sp", [-1, 1, 1, 3]], ["tile_y", "sp", [-1, 11, 1, 5]], ["tile_x", "sp", [-1, 1, 15, 1]], ["tile_rc", "sp", [-1, 6]], ["tile_ry", "sp", [-1, 1]], ["tile_rx", "sp", [-1, 1]], ["auto_unroll_max_step", "ot", 0], ["unroll_explicit", "ot", 0]]}, "result": [[0.08172120025], 0, 7.855181932449341, 1637671200.3602285], "version": 0.2, "tvm_version": "0.8.dev0"}
{"input": ["cuda -keys=cuda,gpu -max_num_threads=1024 -thread_warp_size=32", "conv2d_nchw.cuda", [["TENSOR", [128, 96, 165, 165], "float32"], ["TENSOR", [42, 96, 1, 1], "float32"], 1, "SAME", 1, "float32"], {}], "config": {"index": 7933127, "code_hash": null, "entity": [["tile_f", "sp", [-1, 42, 1, 1]], ["tile_y", "sp", [-1, 1, 5, 11]], ["tile_x", "sp", [-1, 1, 11, 1]], ["tile_rc", "sp", [-1, 12]], ["tile_ry", "sp", [-1, 1]], ["tile_rx", "sp", [-1, 1]], ["auto_unroll_max_step", "ot", 1500], ["unroll_explicit", "ot", 0]]}, "result": [[0.12261723675], 0, 8.741984605789185, 1637671208.6916091], "version": 0.2, "tvm_version": "0.8.dev0"}
{"input": ["cuda -keys=cuda,gpu -max_num_threads=1024 -thread_warp_size=32", "conv2d_nchw.cuda", [["TENSOR", [128, 96, 165, 165], "float32"], ["TENSOR", [42, 96, 1, 1], "float32"], 1, "SAME", 1, "float32"], {}], "config": {"index": 16786714, "code_hash": null, "entity": [["tile_f", "sp", [-1, 1, 42, 1]], ["tile_y", "sp", [-1, 1, 15, 1]], ["tile_x", "sp", [-1, 5, 1, 1]], ["tile_rc", "sp", [-1, 6]], ["tile_ry", "sp", [-1, 1]], ["tile_rx", "sp", [-1, 1]], ["auto_unroll_max_step", "ot", 1500], ["unroll_explicit", "ot", 1]]}, "result": [[0.011270093555555555], 0, 7.689823627471924, 1637671218.0272427], "version": 0.2, "tvm_version": "0.8.dev0"}
{"input": ["cuda -keys=cuda,gpu -max_num_threads=1024 -thread_warp_size=32", "conv2d_nchw.cuda", [["TENSOR", [128, 96, 165, 165], "float32"], ["TENSOR", [42, 96, 1, 1], "float32"], 1, "SAME", 1, "float32"], {}], "config": {"index": 17488980, "code_hash": null, "entity": [["tile_f", "sp", [-1, 3, 7, 1]], ["tile_y", "sp", [-1, 1, 3, 11]], ["tile_x", "sp", [-1, 1, 1, 11]], ["tile_rc", "sp", [-1, 12]], ["tile_ry", "sp", [-1, 1]], ["tile_rx", "sp", [-1, 1]], ["auto_unroll_max_step", "ot", 1500], ["unroll_explicit", "ot", 1]]}, "result": [[0.166757994], 0, 10.905292749404907, 1637671226.4079587], "version": 0.2, "tvm_version": "0.8.dev0"}
{"input": ["cuda -keys=cuda,gpu -max_num_threads=1024 -thread_warp_size=32", "conv2d_nchw.cuda", [["TENSOR", [128, 96, 165, 165], "float32"], ["TENSOR", [42, 96, 1, 1], "float32"], 1, "SAME", 1, "float32"], {}], "config": {"index": 9752033, "code_hash": null, "entity": [["tile_f", "sp", [-1, 1, 7, 2]], ["tile_y", "sp", [-1, 11, 1, 15]], ["tile_x", "sp", [-1, 1, 5, 1]], ["tile_rc", "sp", [-1, 2]], ["tile_ry", "sp", [-1, 1]], ["tile_rx", "sp", [-1, 1]], ["auto_unroll_max_step", "ot", 0], ["unroll_explicit", "ot", 1]]}, "result": [[0.5098887485], 0, 10.741447448730469, 1637671236.6938117], "version": 0.2, "tvm_version": "0.8.dev0"}
{"input": ["cuda -keys=cuda,gpu -max_num_threads=1024 -thread_warp_size=32", "conv2d_nchw.cuda", [["TENSOR", [128, 96, 165, 165], "float32"], ["TENSOR", [42, 96, 1, 1], "float32"], 1, "SAME", 1, "float32"], {}], "config": {"index": 3906455, "code_hash": null, "entity": [["tile_f", "sp", [-1, 3, 14, 1]], ["tile_y", "sp", [-1, 3, 1, 11]], ["tile_x", "sp", [-1, 1, 1, 33]], ["tile_rc", "sp", [-1, 3]], ["tile_ry", "sp", [-1, 1]], ["tile_rx", "sp", [-1, 1]], ["auto_unroll_max_step", "ot", 512], ["unroll_explicit", "ot", 0]]}, "result": [[0.45664080875], 0, 16.428819179534912, 1637671248.6934187], "version": 0.2, "tvm_version": "0.8.dev0"}
{"input": ["cuda -keys=cuda,gpu -max_num_threads=1024 -thread_warp_size=32", "conv2d_nchw.cuda", [["TENSOR", [128, 96, 165, 165], "float32"], ["TENSOR", [42, 96, 1, 1], "float32"], 1, "SAME", 1, "float32"], {}], "config": {"index": 7114325, "code_hash": null, "entity": [["tile_f", "sp", [-1, 6, 7, 1]], ["tile_y", "sp", [-1, 1, 1, 33]], ["tile_x", "sp", [-1, 1, 3, 1]], ["tile_rc", "sp", [-1, 4]], ["tile_ry", "sp", [-1, 1]], ["tile_rx", "sp", [-1, 1]], ["auto_unroll_max_step", "ot", 1500], ["unroll_explicit", "ot", 0]]}, "result": [[0.0191736675], 0, 7.6104652881622314, 1637671257.1720178], "version": 0.2, "tvm_version": "0.8.dev0"}
{"input": ["cuda -keys=cuda,gpu -max_num_threads=1024 -thread_warp_size=32", "conv2d_nchw.cuda", [["TENSOR", [128, 96, 165, 165], "float32"], ["TENSOR", [42, 96, 1, 1], "float32"], 1, "SAME", 1, "float32"], {}], "config": {"index": 13038981, "code_hash": null, "entity": [["tile_f", "sp", [-1, 14, 1, 1]], ["tile_y", "sp", [-1, 1, 33, 1]], ["tile_x", "sp", [-1, 5, 1, 11]], ["tile_rc", "sp", [-1, 2]], ["tile_ry", "sp", [-1, 1]], ["tile_rx", "sp", [-1, 1]], ["auto_unroll_max_step", "ot", 512], ["unroll_explicit", "ot", 1]]}, "result": [[0.5582102215], 0, 10.361904382705688, 1637671267.660343], "version": 0.2, "tvm_version": "0.8.dev0"}
{"input": ["cuda -keys=cuda,gpu -max_num_threads=1024 -thread_warp_size=32", "conv2d_nchw.cuda", [["TENSOR", [128, 96, 165, 165], "float32"], ["TENSOR", [42, 96, 1, 1], "float32"], 1, "SAME", 1, "float32"], {}], "config": {"index": 10020703, "code_hash": null, "entity": [["tile_f", "sp", [-1, 1, 3, 2]], ["tile_y", "sp", [-1, 11, 1, 3]], ["tile_x", "sp", [-1, 11, 5, 1]], ["tile_rc", "sp", [-1, 3]], ["tile_ry", "sp", [-1, 1]], ["tile_rx", "sp", [-1, 1]], ["auto_unroll_max_step", "ot", 0], ["unroll_explicit", "ot", 1]]}, "result": [[0.5158894057500001], 0, 11.231379747390747, 1637671277.260956], "version": 0.2, "tvm_version": "0.8.dev0"}
{"input": ["cuda -keys=cuda,gpu -max_num_threads=1024 -thread_warp_size=32", "conv2d_nchw.cuda", [["TENSOR", [128, 96, 165, 165], "float32"], ["TENSOR", [42, 96, 1, 1], "float32"], 1, "SAME", 1, "float32"], {}], "config": {"index": 3683748, "code_hash": null, "entity": [["tile_f", "sp", [-1, 1, 1, 3]], ["tile_y", "sp", [-1, 1, 33, 1]], ["tile_x", "sp", [-1, 11, 1, 1]], ["tile_rc", "sp", [-1, 3]], ["tile_ry", "sp", [-1, 1]], ["tile_rx", "sp", [-1, 1]], ["auto_unroll_max_step", "ot", 512], ["unroll_explicit", "ot", 0]]}, "result": [[0.07273628875], 0, 7.289751291275024, 1637671288.0024166], "version": 0.2, "tvm_version": "0.8.dev0"}
{"input": ["cuda -keys=cuda,gpu -max_num_threads=1024 -thread_warp_size=32", "conv2d_nchw.cuda", [["TENSOR", [128, 96, 165, 165], "float32"], ["TENSOR", [42, 96, 1, 1], "float32"], 1, "SAME", 1, "float32"], {}], "config": {"index": 6654073, "code_hash": null, "entity": [["tile_f", "sp", [-1, 1, 1, 14]], ["tile_y", "sp", [-1, 1, 11, 3]], ["tile_x", "sp", [-1, 1, 55, 1]], ["tile_rc", "sp", [-1, 2]], ["tile_ry", "sp", [-1, 1]], ["tile_rx", "sp", [-1, 1]], ["auto_unroll_max_step", "ot", 1500], ["unroll_explicit", "ot", 0]]}, "result": [[0.008416246333333334], 0, 6.941713333129883, 1637671294.7518966], "version": 0.2, "tvm_version": "0.8.dev0"}
{"input": ["cuda -keys=cuda,gpu -max_num_threads=1024 -thread_warp_size=32", "conv2d_nchw.cuda", [["TENSOR", [128, 96, 165, 165], "float32"], ["TENSOR", [42, 96, 1, 1], "float32"], 1, "SAME", 1, "float32"], {}], "config": {"index": 3468407, "code_hash": null, "entity": [["tile_f", "sp", [-1, 2, 3, 7]], ["tile_y", "sp", [-1, 1, 3, 11]], ["tile_x", "sp", [-1, 11, 5, 1]], ["tile_rc", "sp", [-1, 2]], ["tile_ry", "sp", [-1, 1]], ["tile_rx", "sp", [-1, 1]], ["auto_unroll_max_step", "ot", 512], ["unroll_explicit", "ot", 0]]}, "result": [[0.31961348500000003], 0, 10.301127433776855, 1637671311.3391318], "version": 0.2, "tvm_version": "0.8.dev0"}
{"input": ["cuda -keys=cuda,gpu -max_num_threads=1024 -thread_warp_size=32", "conv2d_nchw.cuda", [["TENSOR", [128, 96, 165, 165], "float32"], ["TENSOR", [42, 96, 1, 1], "float32"], 1, "SAME", 1, "float32"], {}], "config": {"index": 13690816, "code_hash": null, "entity": [["tile_f", "sp", [-1, 1, 1, 1]], ["tile_y", "sp", [-1, 1, 5, 3]], ["tile_x", "sp", [-1, 11, 5, 1]], ["tile_rc", "sp", [-1, 6]], ["tile_ry", "sp", [-1, 1]], ["tile_rx", "sp", [-1, 1]], ["auto_unroll_max_step", "ot", 512], ["unroll_explicit", "ot", 1]]}, "result": [[0.1158125055], 0, 12.51886534690857, 1637671320.5197773], "version": 0.2, "tvm_version": "0.8.dev0"}
{"input": ["cuda -keys=cuda,gpu -max_num_threads=1024 -thread_warp_size=32", "conv2d_nchw.cuda", [["TENSOR", [128, 96, 165, 165], "float32"], ["TENSOR", [42, 96, 1, 1], "float32"], 1, "SAME", 1, "float32"], {}], "config": {"index": 7605351, "code_hash": null, "entity": [["tile_f", "sp", [-1, 14, 1, 3]], ["tile_y", "sp", [-1, 1, 3, 11]], ["tile_x", "sp", [-1, 1, 1, 1]], ["tile_rc", "sp", [-1, 8]], ["tile_ry", "sp", [-1, 1]], ["tile_rx", "sp", [-1, 1]], ["auto_unroll_max_step", "ot", 1500], ["unroll_explicit", "ot", 0]]}, "result": [[1.30248611775], 0, 14.347716569900513, 1637671334.0131054], "version": 0.2, "tvm_version": "0.8.dev0"}
{"input": ["cuda -keys=cuda,gpu -max_num_threads=1024 -thread_warp_size=32", "conv2d_nchw.cuda", [["TENSOR", [128, 96, 165, 165], "float32"], ["TENSOR", [42, 96, 1, 1], "float32"], 1, "SAME", 1, "float32"], {}], "config": {"index": 3385121, "code_hash": null, "entity": [["tile_f", "sp", [-1, 1, 7, 2]], ["tile_y", "sp", [-1, 5, 1, 3]], ["tile_x", "sp", [-1, 5, 1, 33]], ["tile_rc", "sp", [-1, 1]], ["tile_ry", "sp", [-1, 1]], ["tile_rx", "sp", [-1, 1]], ["auto_unroll_max_step", "ot", 512], ["unroll_explicit", "ot", 0]]}, "result": [[1.0535658375], 0, 13.674831628799438, 1637671346.8775346], "version": 0.2, "tvm_version": "0.8.dev0"}
{"input": ["cuda -keys=cuda,gpu -max_num_threads=1024 -thread_warp_size=32", "conv2d_nchw.cuda", [["TENSOR", [128, 96, 165, 165], "float32"], ["TENSOR", [42, 96, 1, 1], "float32"], 1, "SAME", 1, "float32"], {}], "config": {"index": 328998, "code_hash": null, "entity": [["tile_f", "sp", [-1, 7, 1, 3]], ["tile_y", "sp", [-1, 1, 15, 1]], ["tile_x", "sp", [-1, 1, 11, 1]], ["tile_rc", "sp", [-1, 2]], ["tile_ry", "sp", [-1, 1]], ["tile_rx", "sp", [-1, 1]], ["auto_unroll_max_step", "ot", 0], ["unroll_explicit", "ot", 0]]}, "result": [[0.006512714875000001], 0, 7.953963279724121, 1637671520.9074867], "version": 0.2, "tvm_version": "0.8.dev0"}
{"input": ["cuda -keys=cuda,gpu -max_num_threads=1024 -thread_warp_size=32", "conv2d_nchw.cuda", [["TENSOR", [128, 96, 165, 165], "float32"], ["TENSOR", [42, 96, 1, 1], "float32"], 1, "SAME", 1, "float32"], {}], "config": {"index": 6620454, "code_hash": null, "entity": [["tile_f", "sp", [-1, 7, 1, 3]], ["tile_y", "sp", [-1, 1, 15, 1]], ["tile_x", "sp", [-1, 1, 11, 1]], ["tile_rc", "sp", [-1, 2]], ["tile_ry", "sp", [-1, 1]], ["tile_rx", "sp", [-1, 1]], ["auto_unroll_max_step", "ot", 1500], ["unroll_explicit", "ot", 0]]}, "result": [[0.00651319625], 0, 8.108241319656372, 1637671528.2741187], "version": 0.2, "tvm_version": "0.8.dev0"}
{"input": ["cuda -keys=cuda,gpu -max_num_threads=1024 -thread_warp_size=32", "conv2d_nchw.cuda", [["TENSOR", [128, 96, 165, 165], "float32"], ["TENSOR", [42, 96, 1, 1], "float32"], 1, "SAME", 1, "float32"], {}], "config": {"index": 3474726, "code_hash": null, "entity": [["tile_f", "sp", [-1, 7, 1, 3]], ["tile_y", "sp", [-1, 1, 15, 1]], ["tile_x", "sp", [-1, 1, 11, 1]], ["tile_rc", "sp", [-1, 2]], ["tile_ry", "sp", [-1, 1]], ["tile_rx", "sp", [-1, 1]], ["auto_unroll_max_step", "ot", 512], ["unroll_explicit", "ot", 0]]}, "result": [[0.006486047250000001], 0, 7.489457845687866, 1637671535.1898642], "version": 0.2, "tvm_version": "0.8.dev0"}
{"input": ["cuda -keys=cuda,gpu -max_num_threads=1024 -thread_warp_size=32", "conv2d_nchw.cuda", [["TENSOR", [128, 96, 165, 165], "float32"], ["TENSOR", [42, 96, 1, 1], "float32"], 1, "SAME", 1, "float32"], {}], "config": {"index": 330105, "code_hash": null, "entity": [["tile_f", "sp", [-1, 1, 1, 14]], ["tile_y", "sp", [-1, 3, 1, 5]], ["tile_x", "sp", [-1, 1, 11, 1]], ["tile_rc", "sp", [-1, 2]], ["tile_ry", "sp", [-1, 1]], ["tile_rx", "sp", [-1, 1]], ["auto_unroll_max_step", "ot", 0], ["unroll_explicit", "ot", 0]]}, "result": [[0.017907639166666666], 0, 7.654039621353149, 1637671541.9992864], "version": 0.2, "tvm_version": "0.8.dev0"}
{"input": ["cuda -keys=cuda,gpu -max_num_threads=1024 -thread_warp_size=32", "conv2d_nchw.cuda", [["TENSOR", [128, 96, 165, 165], "float32"], ["TENSOR", [42, 96, 1, 1], "float32"], 1, "SAME", 1, "float32"], {}], "config": {"index": 3475833, "code_hash": null, "entity": [["tile_f", "sp", [-1, 1, 1, 14]], ["tile_y", "sp", [-1, 3, 1, 5]], ["tile_x", "sp", [-1, 1, 11, 1]], ["tile_rc", "sp", [-1, 2]], ["tile_ry", "sp", [-1, 1]], ["tile_rx", "sp", [-1, 1]], ["auto_unroll_max_step", "ot", 512], ["unroll_explicit", "ot", 0]]}, "result": [[0.0206276825], 0, 8.08075499534607, 1637671549.040264], "version": 0.2, "tvm_version": "0.8.dev0"}
{"input": ["cuda -keys=cuda,gpu -max_num_threads=1024 -thread_warp_size=32", "conv2d_nchw.cuda", [["TENSOR", [128, 96, 165, 165], "float32"], ["TENSOR", [42, 96, 1, 1], "float32"], 1, "SAME", 1, "float32"], {}], "config": {"index": 6621561, "code_hash": null, "entity": [["tile_f", "sp", [-1, 1, 1, 14]], ["tile_y", "sp", [-1, 3, 1, 5]], ["tile_x", "sp", [-1, 1, 11, 1]], ["tile_rc", "sp", [-1, 2]], ["tile_ry", "sp", [-1, 1]], ["tile_rx", "sp", [-1, 1]], ["auto_unroll_max_step", "ot", 1500], ["unroll_explicit", "ot", 0]]}, "result": [[0.020633715833333333], 0, 7.871756076812744, 1637671555.9497788], "version": 0.2, "tvm_version": "0.8.dev0"}
{"input": ["cuda -keys=cuda,gpu -max_num_threads=1024 -thread_warp_size=32", "conv2d_nchw.cuda", [["TENSOR", [128, 96, 165, 165], "float32"], ["TENSOR", [42, 96, 1, 1], "float32"], 1, "SAME", 1, "float32"], {}], "config": {"index": 6359026, "code_hash": null, "entity": [["tile_f", "sp", [-1, 3, 1, 7]], ["tile_y", "sp", [-1, 1, 5, 3]], ["tile_x", "sp", [-1, 1, 11, 1]], ["tile_rc", "sp", [-1, 1]], ["tile_ry", "sp", [-1, 1]], ["tile_rx", "sp", [-1, 1]], ["auto_unroll_max_step", "ot", 1500], ["unroll_explicit", "ot", 0]]}, "result": [[0.006453748625], 0, 8.354601621627808, 1637671563.426177], "version": 0.2, "tvm_version": "0.8.dev0"}
{"input": ["cuda -keys=cuda,gpu -max_num_threads=1024 -thread_warp_size=32", "conv2d_nchw.cuda", [["TENSOR", [128, 96, 165, 165], "float32"], ["TENSOR", [42, 96, 1, 1], "float32"], 1, "SAME", 1, "float32"], {}], "config": {"index": 67570, "code_hash": null, "entity": [["tile_f", "sp", [-1, 3, 1, 7]], ["tile_y", "sp", [-1, 1, 5, 3]], ["tile_x", "sp", [-1, 1, 11, 1]], ["tile_rc", "sp", [-1, 1]], ["tile_ry", "sp", [-1, 1]], ["tile_rx", "sp", [-1, 1]], ["auto_unroll_max_step", "ot", 0], ["unroll_explicit", "ot", 0]]}, "result": [[0.006484991375], 0, 7.72695779800415, 1637671570.3156383], "version": 0.2, "tvm_version": "0.8.dev0"}
{"input": ["cuda -keys=cuda,gpu -max_num_threads=1024 -thread_warp_size=32", "conv2d_nchw.cuda", [["TENSOR", [128, 96, 165, 165], "float32"], ["TENSOR", [42, 96, 1, 1], "float32"], 1, "SAME", 1, "float32"], {}], "config": {"index": 3213298, "code_hash": null, "entity": [["tile_f", "sp", [-1, 3, 1, 7]], ["tile_y", "sp", [-1, 1, 5, 3]], ["tile_x", "sp", [-1, 1, 11, 1]], ["tile_rc", "sp", [-1, 1]], ["tile_ry", "sp", [-1, 1]], ["tile_rx", "sp", [-1, 1]], ["auto_unroll_max_step", "ot", 512], ["unroll_explicit", "ot", 0]]}, "result": [[0.0064442490625], 0, 7.403240919113159, 1637671577.022813], "version": 0.2, "tvm_version": "0.8.dev0"}
{"input": ["cuda -keys=cuda,gpu -max_num_threads=1024 -thread_warp_size=32", "conv2d_nchw.cuda", [["TENSOR", [128, 96, 165, 165], "float32"], ["TENSOR", [42, 96, 1, 1], "float32"], 1, "SAME", 1, "float32"], {}], "config": {"index": 6360166, "code_hash": null, "entity": [["tile_f", "sp", [-1, 7, 1, 3]], ["tile_y", "sp", [-1, 1, 3, 11]], ["tile_x", "sp", [-1, 1, 11, 1]], ["tile_rc", "sp", [-1, 1]], ["tile_ry", "sp", [-1, 1]], ["tile_rx", "sp", [-1, 1]], ["auto_unroll_max_step", "ot", 1500], ["unroll_explicit", "ot", 0]]}, "result": [[0.010337067799999999], 0, 7.757951974868774, 1637671583.8452396], "version": 0.2, "tvm_version": "0.8.dev0"}
{"input": ["cuda -keys=cuda,gpu -max_num_threads=1024 -thread_warp_size=32", "conv2d_nchw.cuda", [["TENSOR", [128, 96, 165, 165], "float32"], ["TENSOR", [42, 96, 1, 1], "float32"], 1, "SAME", 1, "float32"], {}], "config": {"index": 6359142, "code_hash": null, "entity": [["tile_f", "sp", [-1, 7, 1, 3]], ["tile_y", "sp", [-1, 1, 11, 3]], ["tile_x", "sp", [-1, 1, 11, 1]], ["tile_rc", "sp", [-1, 1]], ["tile_ry", "sp", [-1, 1]], ["tile_rx", "sp", [-1, 1]], ["auto_unroll_max_step", "ot", 1500], ["unroll_explicit", "ot", 0]]}, "result": [[0.006393857125], 0, 8.724738836288452, 1637671591.644549], "version": 0.2, "tvm_version": "0.8.dev0"}
{"input": ["cuda -keys=cuda,gpu -max_num_threads=1024 -thread_warp_size=32", "conv2d_nchw.cuda", [["TENSOR", [128, 96, 165, 165], "float32"], ["TENSOR", [42, 96, 1, 1], "float32"], 1, "SAME", 1, "float32"], {}], "config": {"index": 3213414, "code_hash": null, "entity": [["tile_f", "sp", [-1, 7, 1, 3]], ["tile_y", "sp", [-1, 1, 11, 3]], ["tile_x", "sp", [-1, 1, 11, 1]], ["tile_rc", "sp", [-1, 1]], ["tile_ry", "sp", [-1, 1]], ["tile_rx", "sp", [-1, 1]], ["auto_unroll_max_step", "ot", 512], ["unroll_explicit", "ot", 0]]}, "result": [[0.0063876449375], 0, 7.278342962265015, 1637671598.3603153], "version": 0.2, "tvm_version": "0.8.dev0"}
{"input": ["cuda -keys=cuda,gpu -max_num_threads=1024 -thread_warp_size=32", "conv2d_nchw.cuda", [["TENSOR", [128, 96, 165, 165], "float32"], ["TENSOR", [42, 96, 1, 1], "float32"], 1, "SAME", 1, "float32"], {}], "config": {"index": 67686, "code_hash": null, "entity": [["tile_f", "sp", [-1, 7, 1, 3]], ["tile_y", "sp", [-1, 1, 11, 3]], ["tile_x", "sp", [-1, 1, 11, 1]], ["tile_rc", "sp", [-1, 1]], ["tile_ry", "sp", [-1, 1]], ["tile_rx", "sp", [-1, 1]], ["auto_unroll_max_step", "ot", 0], ["unroll_explicit", "ot", 0]]}, "result": [[0.006492229], 0, 7.890066623687744, 1637671605.4667137], "version": 0.2, "tvm_version": "0.8.dev0"}
{"input": ["cuda -keys=cuda,gpu -max_num_threads=1024 -thread_warp_size=32", "conv2d_nchw.cuda", [["TENSOR", [128, 96, 165, 165], "float32"], ["TENSOR", [42, 96, 1, 1], "float32"], 1, "SAME", 1, "float32"], {}], "config": {"index": 6621554, "code_hash": null, "entity": [["tile_f", "sp", [-1, 3, 1, 7]], ["tile_y", "sp", [-1, 3, 1, 5]], ["tile_x", "sp", [-1, 1, 11, 1]], ["tile_rc", "sp", [-1, 2]], ["tile_ry", "sp", [-1, 1]], ["tile_rx", "sp", [-1, 1]], ["auto_unroll_max_step", "ot", 1500], ["unroll_explicit", "ot", 0]]}, "result": [[1.1845624445], 0, 14.313503980636597, 1637671618.8141515], "version": 0.2, "tvm_version": "0.8.dev0"}
{"input": ["cuda -keys=cuda,gpu -max_num_threads=1024 -thread_warp_size=32", "conv2d_nchw.cuda", [["TENSOR", [128, 96, 165, 165], "float32"], ["TENSOR", [42, 96, 1, 1], "float32"], 1, "SAME", 1, "float32"], {}], "config": {"index": 3475826, "code_hash": null, "entity": [["tile_f", "sp", [-1, 3, 1, 7]], ["tile_y", "sp", [-1, 3, 1, 5]], ["tile_x", "sp", [-1, 1, 11, 1]], ["tile_rc", "sp", [-1, 2]], ["tile_ry", "sp", [-1, 1]], ["tile_rx", "sp", [-1, 1]], ["auto_unroll_max_step", "ot", 512], ["unroll_explicit", "ot", 0]]}, "result": [[0.880720229], 0, 12.278121709823608, 1637671630.1157794], "version": 0.2, "tvm_version": "0.8.dev0"}
{"input": ["cuda -keys=cuda,gpu -max_num_threads=1024 -thread_warp_size=32", "conv2d_nchw.cuda", [["TENSOR", [128, 96, 165, 165], "float32"], ["TENSOR", [42, 96, 1, 1], "float32"], 1, "SAME", 1, "float32"], {}], "config": {"index": 330098, "code_hash": null, "entity": [["tile_f", "sp", [-1, 3, 1, 7]], ["tile_y", "sp", [-1, 3, 1, 5]], ["tile_x", "sp", [-1, 1, 11, 1]], ["tile_rc", "sp", [-1, 2]], ["tile_ry", "sp", [-1, 1]], ["tile_rx", "sp", [-1, 1]], ["auto_unroll_max_step", "ot", 0], ["unroll_explicit", "ot", 0]]}, "result": [[1.07957672875], 0, 13.095160245895386, 1637671642.2193387], "version": 0.2, "tvm_version": "0.8.dev0"}
{"input": ["cuda -keys=cuda,gpu -max_num_threads=1024 -thread_warp_size=32", "conv2d_nchw.cuda", [["TENSOR", [128, 96, 165, 165], "float32"], ["TENSOR", [42, 96, 1, 1], "float32"], 1, "SAME", 1, "float32"], {}], "config": {"index": 68144, "code_hash": null, "entity": [["tile_f", "sp", [-1, 1, 1, 7]], ["tile_y", "sp", [-1, 1, 3, 5]], ["tile_x", "sp", [-1, 1, 11, 1]], ["tile_rc", "sp", [-1, 1]], ["tile_ry", "sp", [-1, 1]], ["tile_rx", "sp", [-1, 1]], ["auto_unroll_max_step", "ot", 0], ["unroll_explicit", "ot", 0]]}, "result": [[0.011467265999999999], 0, 7.706877708435059, 1637671649.1095486], "version": 0.2, "tvm_version": "0.8.dev0"}
{"input": ["cuda -keys=cuda,gpu -max_num_threads=1024 -thread_warp_size=32", "conv2d_nchw.cuda", [["TENSOR", [128, 96, 165, 165], "float32"], ["TENSOR", [42, 96, 1, 1], "float32"], 1, "SAME", 1, "float32"], {}], "config": {"index": 3213872, "code_hash": null, "entity": [["tile_f", "sp", [-1, 1, 1, 7]], ["tile_y", "sp", [-1, 1, 3, 5]], ["tile_x", "sp", [-1, 1, 11, 1]], ["tile_rc", "sp", [-1, 1]], ["tile_ry", "sp", [-1, 1]], ["tile_rx", "sp", [-1, 1]], ["auto_unroll_max_step", "ot", 512], ["unroll_explicit", "ot", 0]]}, "result": [[0.011464210666666667], 0, 7.569293022155762, 1637671655.9626749], "version": 0.2, "tvm_version": "0.8.dev0"}
{"input": ["cuda -keys=cuda,gpu -max_num_threads=1024 -thread_warp_size=32", "conv2d_nchw.cuda", [["TENSOR", [128, 96, 165, 165], "float32"], ["TENSOR", [42, 96, 1, 1], "float32"], 1, "SAME", 1, "float32"], {}], "config": {"index": 6359600, "code_hash": null, "entity": [["tile_f", "sp", [-1, 1, 1, 7]], ["tile_y", "sp", [-1, 1, 3, 5]], ["tile_x", "sp", [-1, 1, 11, 1]], ["tile_rc", "sp", [-1, 1]], ["tile_ry", "sp", [-1, 1]], ["tile_rx", "sp", [-1, 1]], ["auto_unroll_max_step", "ot", 1500], ["unroll_explicit", "ot", 0]]}, "result": [[0.01147195488888889], 0, 7.261148929595947, 1637671662.696867], "version": 0.2, "tvm_version": "0.8.dev0"}
{"input": ["cuda -keys=cuda,gpu -max_num_threads=1024 -thread_warp_size=32", "conv2d_nchw.cuda", [["TENSOR", [128, 96, 165, 165], "float32"], ["TENSOR", [42, 96, 1, 1], "float32"], 1, "SAME", 1, "float32"], {}], "config": {"index": 9766182, "code_hash": null, "entity": [["tile_f", "sp", [-1, 7, 1, 3]], ["tile_y", "sp", [-1, 1, 15, 1]], ["tile_x", "sp", [-1, 1, 11, 1]], ["tile_rc", "sp", [-1, 2]], ["tile_ry", "sp", [-1, 1]], ["tile_rx", "sp", [-1, 1]], ["auto_unroll_max_step", "ot", 0], ["unroll_explicit", "ot", 1]]}, "result": [[0.006507331250000001], 0, 7.86971378326416, 1637671669.9046495], "version": 0.2, "tvm_version": "0.8.dev0"}
{"input": ["cuda -keys=cuda,gpu -max_num_threads=1024 -thread_warp_size=32", "conv2d_nchw.cuda", [["TENSOR", [128, 96, 165, 165], "float32"], ["TENSOR", [42, 96, 1, 1], "float32"], 1, "SAME", 1, "float32"], {}], "config": {"index": 12911910, "code_hash": null, "entity": [["tile_f", "sp", [-1, 7, 1, 3]], ["tile_y", "sp", [-1, 1, 15, 1]], ["tile_x", "sp", [-1, 1, 11, 1]], ["tile_rc", "sp", [-1, 2]], ["tile_ry", "sp", [-1, 1]], ["tile_rx", "sp", [-1, 1]], ["auto_unroll_max_step", "ot", 512], ["unroll_explicit", "ot", 1]]}, "result": [[0.0064794614375], 0, 7.320783376693726, 1637671676.4542484], "version": 0.2, "tvm_version": "0.8.dev0"}
{"input": ["cuda -keys=cuda,gpu -max_num_threads=1024 -thread_warp_size=32", "conv2d_nchw.cuda", [["TENSOR", [128, 96, 165, 165], "float32"], ["TENSOR", [42, 96, 1, 1], "float32"], 1, "SAME", 1, "float32"], {}], "config": {"index": 16057638, "code_hash": null, "entity": [["tile_f", "sp", [-1, 7, 1, 3]], ["tile_y", "sp", [-1, 1, 15, 1]], ["tile_x", "sp", [-1, 1, 11, 1]], ["tile_rc", "sp", [-1, 2]], ["tile_ry", "sp", [-1, 1]], ["tile_rx", "sp", [-1, 1]], ["auto_unroll_max_step", "ot", 1500], ["unroll_explicit", "ot", 1]]}, "result": [[0.0064799864375], 0, 7.576494455337524, 1637671683.3474236], "version": 0.2, "tvm_version": "0.8.dev0"}
{"input": ["cuda -keys=cuda,gpu -max_num_threads=1024 -thread_warp_size=32", "conv2d_nchw.cuda", [["TENSOR", [128, 96, 165, 165], "float32"], ["TENSOR", [42, 96, 1, 1], "float32"], 1, "SAME", 1, "float32"], {}], "config": {"index": 3213286, "code_hash": null, "entity": [["tile_f", "sp", [-1, 7, 1, 3]], ["tile_y", "sp", [-1, 1, 5, 3]], ["tile_x", "sp", [-1, 1, 11, 1]], ["tile_rc", "sp", [-1, 1]], ["tile_ry", "sp", [-1, 1]], ["tile_rx", "sp", [-1, 1]], ["auto_unroll_max_step", "ot", 512], ["unroll_explicit", "ot", 0]]}, "result": [[0.0064830301875], 0, 7.753634691238403, 1637671690.2454464], "version": 0.2, "tvm_version": "0.8.dev0"}
{"input": ["cuda -keys=cuda,gpu -max_num_threads=1024 -thread_warp_size=32", "conv2d_nchw.cuda", [["TENSOR", [128, 96, 165, 165], "float32"], ["TENSOR", [42, 96, 1, 1], "float32"], 1, "SAME", 1, "float32"], {}], "config": {"index": 6359014, "code_hash": null, "entity": [["tile_f", "sp", [-1, 7, 1, 3]], ["tile_y", "sp", [-1, 1, 5, 3]], ["tile_x", "sp", [-1, 1, 11, 1]], ["tile_rc", "sp", [-1, 1]], ["tile_ry", "sp", [-1, 1]], ["tile_rx", "sp", [-1, 1]], ["auto_unroll_max_step", "ot", 1500], ["unroll_explicit", "ot", 0]]}, "result": [[0.0064885675625], 0, 8.283997774124146, 1637671697.7846086], "version": 0.2, "tvm_version": "0.8.dev0"}
{"input": ["cuda -keys=cuda,gpu -max_num_threads=1024 -thread_warp_size=32", "conv2d_nchw.cuda", [["TENSOR", [128, 96, 165, 165], "float32"], ["TENSOR", [42, 96, 1, 1], "float32"], 1, "SAME", 1, "float32"], {}], "config": {"index": 67558, "code_hash": null, "entity": [["tile_f", "sp", [-1, 7, 1, 3]], ["tile_y", "sp", [-1, 1, 5, 3]], ["tile_x", "sp", [-1, 1, 11, 1]], ["tile_rc", "sp", [-1, 1]], ["tile_ry", "sp", [-1, 1]], ["tile_rx", "sp", [-1, 1]], ["auto_unroll_max_step", "ot", 0], ["unroll_explicit", "ot", 0]]}, "result": [[0.006507660750000001], 0, 7.917473316192627, 1637671707.1530943], "version": 0.2, "tvm_version": "0.8.dev0"}
{"input": ["cuda -keys=cuda,gpu -max_num_threads=1024 -thread_warp_size=32", "conv2d_nchw.cuda", [["TENSOR", [128, 96, 165, 165], "float32"], ["TENSOR", [42, 96, 1, 1], "float32"], 1, "SAME", 1, "float32"], {}], "config": {"index": 3213874, "code_hash": null, "entity": [["tile_f", "sp", [-1, 3, 1, 7]], ["tile_y", "sp", [-1, 1, 3, 5]], ["tile_x", "sp", [-1, 1, 11, 1]], ["tile_rc", "sp", [-1, 1]], ["tile_ry", "sp", [-1, 1]], ["tile_rx", "sp", [-1, 1]], ["auto_unroll_max_step", "ot", 512], ["unroll_explicit", "ot", 0]]}, "result": [[0.009135844727272727], 0, 8.079617261886597, 1637671714.4657533], "version": 0.2, "tvm_version": "0.8.dev0"}
{"input": ["cuda -keys=cuda,gpu -max_num_threads=1024 -thread_warp_size=32", "conv2d_nchw.cuda", [["TENSOR", [128, 96, 165, 165], "float32"], ["TENSOR", [42, 96, 1, 1], "float32"], 1, "SAME", 1, "float32"], {}], "config": {"index": 6359602, "code_hash": null, "entity": [["tile_f", "sp", [-1, 3, 1, 7]], ["tile_y", "sp", [-1, 1, 3, 5]], ["tile_x", "sp", [-1, 1, 11, 1]], ["tile_rc", "sp", [-1, 1]], ["tile_ry", "sp", [-1, 1]], ["tile_rx", "sp", [-1, 1]], ["auto_unroll_max_step", "ot", 1500], ["unroll_explicit", "ot", 0]]}, "result": [[0.009211078727272727], 0, 7.9677369594573975, 1637671721.6267736], "version": 0.2, "tvm_version": "0.8.dev0"}
{"input": ["cuda -keys=cuda,gpu -max_num_threads=1024 -thread_warp_size=32", "conv2d_nchw.cuda", [["TENSOR", [128, 96, 165, 165], "float32"], ["TENSOR", [42, 96, 1, 1], "float32"], 1, "SAME", 1, "float32"], {}], "config": {"index": 68146, "code_hash": null, "entity": [["tile_f", "sp", [-1, 3, 1, 7]], ["tile_y", "sp", [-1, 1, 3, 5]], ["tile_x", "sp", [-1, 1, 11, 1]], ["tile_rc", "sp", [-1, 1]], ["tile_ry", "sp", [-1, 1]], ["tile_rx", "sp", [-1, 1]], ["auto_unroll_max_step", "ot", 0], ["unroll_explicit", "ot", 0]]}, "result": [[0.009165416636363636], 0, 7.572489023208618, 1637671728.5927453], "version": 0.2, "tvm_version": "0.8.dev0"}
{"input": ["cuda -keys=cuda,gpu -max_num_threads=1024 -thread_warp_size=32", "conv2d_nchw.cuda", [["TENSOR", [128, 96, 165, 165], "float32"], ["TENSOR", [42, 96, 1, 1], "float32"], 1, "SAME", 1, "float32"], {}], "config": {"index": 330290, "code_hash": null, "entity": [["tile_f", "sp", [-1, 3, 1, 7]], ["tile_y", "sp", [-1, 1, 3, 5]], ["tile_x", "sp", [-1, 1, 11, 1]], ["tile_rc", "sp", [-1, 2]], ["tile_ry", "sp", [-1, 1]], ["tile_rx", "sp", [-1, 1]], ["auto_unroll_max_step", "ot", 0], ["unroll_explicit", "ot", 0]]}, "result": [[0.009718116727272727], 0, 7.48090124130249, 1637671735.3124125], "version": 0.2, "tvm_version": "0.8.dev0"}
{"input": ["cuda -keys=cuda,gpu -max_num_threads=1024 -thread_warp_size=32", "conv2d_nchw.cuda", [["TENSOR", [128, 96, 165, 165], "float32"], ["TENSOR", [42, 96, 1, 1], "float32"], 1, "SAME", 1, "float32"], {}], "config": {"index": 6359024, "code_hash": null, "entity": [["tile_f", "sp", [-1, 1, 1, 7]], ["tile_y", "sp", [-1, 1, 5, 3]], ["tile_x", "sp", [-1, 1, 11, 1]], ["tile_rc", "sp", [-1, 1]], ["tile_ry", "sp", [-1, 1]], ["tile_rx", "sp", [-1, 1]], ["auto_unroll_max_step", "ot", 1500], ["unroll_explicit", "ot", 0]]}, "result": [[0.0108085846], 0, 7.598836898803711, 1637671742.1781676], "version": 0.2, "tvm_version": "0.8.dev0"}
{"input": ["cuda -keys=cuda,gpu -max_num_threads=1024 -thread_warp_size=32", "conv2d_nchw.cuda", [["TENSOR", [128, 96, 165, 165], "float32"], ["TENSOR", [42, 96, 1, 1], "float32"], 1, "SAME", 1, "float32"], {}], "config": {"index": 67568, "code_hash": null, "entity": [["tile_f", "sp", [-1, 1, 1, 7]], ["tile_y", "sp", [-1, 1, 5, 3]], ["tile_x", "sp", [-1, 1, 11, 1]], ["tile_rc", "sp", [-1, 1]], ["tile_ry", "sp", [-1, 1]], ["tile_rx", "sp", [-1, 1]], ["auto_unroll_max_step", "ot", 0], ["unroll_explicit", "ot", 0]]}, "result": [[0.010801395], 0, 8.065345287322998, 1637671749.4246738], "version": 0.2, "tvm_version": "0.8.dev0"}
{"input": ["cuda -keys=cuda,gpu -max_num_threads=1024 -thread_warp_size=32", "conv2d_nchw.cuda", [["TENSOR", [128, 96, 165, 165], "float32"], ["TENSOR", [42, 96, 1, 1], "float32"], 1, "SAME", 1, "float32"], {}], "config": {"index": 6359601, "code_hash": null, "entity": [["tile_f", "sp", [-1, 2, 1, 7]], ["tile_y", "sp", [-1, 1, 3, 5]], ["tile_x", "sp", [-1, 1, 11, 1]], ["tile_rc", "sp", [-1, 1]], ["tile_ry", "sp", [-1, 1]], ["tile_rx", "sp", [-1, 1]], ["auto_unroll_max_step", "ot", 1500], ["unroll_explicit", "ot", 0]]}, "result": [[0.009819795454545456], 0, 7.519383907318115, 1637671756.178624], "version": 0.2, "tvm_version": "0.8.dev0"}
{"input": ["cuda -keys=cuda,gpu -max_num_threads=1024 -thread_warp_size=32", "conv2d_nchw.cuda", [["TENSOR", [128, 96, 165, 165], "float32"], ["TENSOR", [42, 96, 1, 1], "float32"], 1, "SAME", 1, "float32"], {}], "config": {"index": 68145, "code_hash": null, "entity": [["tile_f", "sp", [-1, 2, 1, 7]], ["tile_y", "sp", [-1, 1, 3, 5]], ["tile_x", "sp", [-1, 1, 11, 1]], ["tile_rc", "sp", [-1, 1]], ["tile_ry", "sp", [-1, 1]], ["tile_rx", "sp", [-1, 1]], ["auto_unroll_max_step", "ot", 0], ["unroll_explicit", "ot", 0]]}, "result": [[0.009819913727272728], 0, 7.54804253578186, 1637671762.9719975], "version": 0.2, "tvm_version": "0.8.dev0"}
{"input": ["cuda -keys=cuda,gpu -max_num_threads=1024 -thread_warp_size=32", "conv2d_nchw.cuda", [["TENSOR", [128, 96, 165, 165], "float32"], ["TENSOR", [42, 96, 1, 1], "float32"], 1, "SAME", 1, "float32"], {}], "config": {"index": 3213873, "code_hash": null, "entity": [["tile_f", "sp", [-1, 2, 1, 7]], ["tile_y", "sp", [-1, 1, 3, 5]], ["tile_x", "sp", [-1, 1, 11, 1]], ["tile_rc", "sp", [-1, 1]], ["tile_ry", "sp", [-1, 1]], ["tile_rx", "sp", [-1, 1]], ["auto_unroll_max_step", "ot", 512], ["unroll_explicit", "ot", 0]]}, "result": [[0.009778551454545455], 0, 8.564064264297485, 1637671770.7704735], "version": 0.2, "tvm_version": "0.8.dev0"}
{"input": ["cuda -keys=cuda,gpu -max_num_threads=1024 -thread_warp_size=32", "conv2d_nchw.cuda", [["TENSOR", [128, 96, 165, 165], "float32"], ["TENSOR", [42, 96, 1, 1], "float32"], 1, "SAME", 1, "float32"], {}], "config": {"index": 3213296, "code_hash": null, "entity": [["tile_f", "sp", [-1, 1, 1, 7]], ["tile_y", "sp", [-1, 1, 5, 3]], ["tile_x", "sp", [-1, 1, 11, 1]], ["tile_rc", "sp", [-1, 1]], ["tile_ry", "sp", [-1, 1]], ["tile_rx", "sp", [-1, 1]], ["auto_unroll_max_step", "ot", 512], ["unroll_explicit", "ot", 0]]}, "result": [[0.010813894899999999], 0, 7.954531669616699, 1637671778.207106], "version": 0.2, "tvm_version": "0.8.dev0"}
{"input": ["cuda -keys=cuda,gpu -max_num_threads=1024 -thread_warp_size=32", "conv2d_nchw.cuda", [["TENSOR", [128, 96, 165, 165], "float32"], ["TENSOR", [42, 96, 1, 1], "float32"], 1, "SAME", 1, "float32"], {}], "config": {"index": 312742, "code_hash": null, "entity": [["tile_f", "sp", [-1, 7, 1, 3]], ["tile_y", "sp", [-1, 1, 33, 1]], ["tile_x", "sp", [-1, 1, 5, 1]], ["tile_rc", "sp", [-1, 2]], ["tile_ry", "sp", [-1, 1]], ["tile_rx", "sp", [-1, 1]], ["auto_unroll_max_step", "ot", 0], ["unroll_explicit", "ot", 0]]}, "result": [[0.007122252866666666], 0, 7.540846347808838, 1637671784.9848592], "version": 0.2, "tvm_version": "0.8.dev0"}
{"input": ["cuda -keys=cuda,gpu -max_num_threads=1024 -thread_warp_size=32", "conv2d_nchw.cuda", [["TENSOR", [128, 96, 165, 165], "float32"], ["TENSOR", [42, 96, 1, 1], "float32"], 1, "SAME", 1, "float32"], {}], "config": {"index": 3458470, "code_hash": null, "entity": [["tile_f", "sp", [-1, 7, 1, 3]], ["tile_y", "sp", [-1, 1, 33, 1]], ["tile_x", "sp", [-1, 1, 5, 1]], ["tile_rc", "sp", [-1, 2]], ["tile_ry", "sp", [-1, 1]], ["tile_rx", "sp", [-1, 1]], ["auto_unroll_max_step", "ot", 512], ["unroll_explicit", "ot", 0]]}, "result": [[0.007122032933333333], 0, 7.57505202293396, 1637671791.8616002], "version": 0.2, "tvm_version": "0.8.dev0"}
{"input": ["cuda -keys=cuda,gpu -max_num_threads=1024 -thread_warp_size=32", "conv2d_nchw.cuda", [["TENSOR", [128, 96, 165, 165], "float32"], ["TENSOR", [42, 96, 1, 1], "float32"], 1, "SAME", 1, "float32"], {}], "config": {"index": 6604198, "code_hash": null, "entity": [["tile_f", "sp", [-1, 7, 1, 3]], ["tile_y", "sp", [-1, 1, 33, 1]], ["tile_x", "sp", [-1, 1, 5, 1]], ["tile_rc", "sp", [-1, 2]], ["tile_ry", "sp", [-1, 1]], ["tile_rx", "sp", [-1, 1]], ["auto_unroll_max_step", "ot", 1500], ["unroll_explicit", "ot", 0]]}, "result": [[0.007116719733333333], 0, 7.65232515335083, 1637671798.8747644], "version": 0.2, "tvm_version": "0.8.dev0"}
{"input": ["cuda -keys=cuda,gpu -max_num_threads=1024 -thread_warp_size=32", "conv2d_nchw.cuda", [["TENSOR", [128, 96, 165, 165], "float32"], ["TENSOR", [42, 96, 1, 1], "float32"], 1, "SAME", 1, "float32"], {}], "config": {"index": 68528, "code_hash": null, "entity": [["tile_f", "sp", [-1, 1, 1, 7]], ["tile_y", "sp", [-1, 3, 1, 11]], ["tile_x", "sp", [-1, 1, 11, 1]], ["tile_rc", "sp", [-1, 1]], ["tile_ry", "sp", [-1, 1]], ["tile_rx", "sp", [-1, 1]], ["auto_unroll_max_step", "ot", 0], ["unroll_explicit", "ot", 0]]}, "result": [[0.024088943], 0, 8.624616622924805, 1637671806.7225168], "version": 0.2, "tvm_version": "0.8.dev0"}
{"input": ["cuda -keys=cuda,gpu -max_num_threads=1024 -thread_warp_size=32", "conv2d_nchw.cuda", [["TENSOR", [128, 96, 165, 165], "float32"], ["TENSOR", [42, 96, 1, 1], "float32"], 1, "SAME", 1, "float32"], {}], "config": {"index": 6359984, "code_hash": null, "entity": [["tile_f", "sp", [-1, 1, 1, 7]], ["tile_y", "sp", [-1, 3, 1, 11]], ["tile_x", "sp", [-1, 1, 11, 1]], ["tile_rc", "sp", [-1, 1]], ["tile_ry", "sp", [-1, 1]], ["tile_rx", "sp", [-1, 1]], ["auto_unroll_max_step", "ot", 1500], ["unroll_explicit", "ot", 0]]}, "result": [[0.019437662499999998], 0, 8.486628293991089, 1637671814.3449829], "version": 0.2, "tvm_version": "0.8.dev0"}
{"input": ["cuda -keys=cuda,gpu -max_num_threads=1024 -thread_warp_size=32", "conv2d_nchw.cuda", [["TENSOR", [128, 96, 165, 165], "float32"], ["TENSOR", [42, 96, 1, 1], "float32"], 1, "SAME", 1, "float32"], {}], "config": {"index": 3214256, "code_hash": null, "entity": [["tile_f", "sp", [-1, 1, 1, 7]], ["tile_y", "sp", [-1, 3, 1, 11]], ["tile_x", "sp", [-1, 1, 11, 1]], ["tile_rc", "sp", [-1, 1]], ["tile_ry", "sp", [-1, 1]], ["tile_rx", "sp", [-1, 1]], ["auto_unroll_max_step", "ot", 512], ["unroll_explicit", "ot", 0]]}, "result": [[0.019329449500000002], 0, 8.460569143295288, 1637671822.0829709], "version": 0.2, "tvm_version": "0.8.dev0"}
{"input": ["cuda -keys=cuda,gpu -max_num_threads=1024 -thread_warp_size=32", "conv2d_nchw.cuda", [["TENSOR", [128, 96, 165, 165], "float32"], ["TENSOR", [42, 96, 1, 1], "float32"], 1, "SAME", 1, "float32"], {}], "config": {"index": 330097, "code_hash": null, "entity": [["tile_f", "sp", [-1, 2, 1, 7]], ["tile_y", "sp", [-1, 3, 1, 5]], ["tile_x", "sp", [-1, 1, 11, 1]], ["tile_rc", "sp", [-1, 2]], ["tile_ry", "sp", [-1, 1]], ["tile_rx", "sp", [-1, 1]], ["auto_unroll_max_step", "ot", 0], ["unroll_explicit", "ot", 0]]}, "result": [[0.017913512833333332], 0, 8.749544620513916, 1637671830.0597422], "version": 0.2, "tvm_version": "0.8.dev0"}
{"input": ["cuda -keys=cuda,gpu -max_num_threads=1024 -thread_warp_size=32", "conv2d_nchw.cuda", [["TENSOR", [128, 96, 165, 165], "float32"], ["TENSOR", [42, 96, 1, 1], "float32"], 1, "SAME", 1, "float32"], {}], "config": {"index": 3211954, "code_hash": null, "entity": [["tile_f", "sp", [-1, 3, 1, 7]], ["tile_y", "sp", [-1, 11, 3, 1]], ["tile_x", "sp", [-1, 1, 11, 1]], ["tile_rc", "sp", [-1, 1]], ["tile_ry", "sp", [-1, 1]], ["tile_rx", "sp", [-1, 1]], ["auto_unroll_max_step", "ot", 512], ["unroll_explicit", "ot", 0]]}, "result": [[0.0104987459], 0, 8.912020683288574, 1637671838.0211568], "version": 0.2, "tvm_version": "0.8.dev0"}
{"input": ["cuda -keys=cuda,gpu -max_num_threads=1024 -thread_warp_size=32", "conv2d_nchw.cuda", [["TENSOR", [128, 96, 165, 165], "float32"], ["TENSOR", [42, 96, 1, 1], "float32"], 1, "SAME", 1, "float32"], {}], "config": {"index": 66226, "code_hash": null, "entity": [["tile_f", "sp", [-1, 3, 1, 7]], ["tile_y", "sp", [-1, 11, 3, 1]], ["tile_x", "sp", [-1, 1, 11, 1]], ["tile_rc", "sp", [-1, 1]], ["tile_ry", "sp", [-1, 1]], ["tile_rx", "sp", [-1, 1]], ["auto_unroll_max_step", "ot", 0], ["unroll_explicit", "ot", 0]]}, "result": [[0.0104722969], 0, 8.635208129882812, 1637671845.6873384], "version": 0.2, "tvm_version": "0.8.dev0"}
{"input": ["cuda -keys=cuda,gpu -max_num_threads=1024 -thread_warp_size=32", "conv2d_nchw.cuda", [["TENSOR", [128, 96, 165, 165], "float32"], ["TENSOR", [42, 96, 1, 1], "float32"], 1, "SAME", 1, "float32"], {}], "config": {"index": 6357682, "code_hash": null, "entity": [["tile_f", "sp", [-1, 3, 1, 7]], ["tile_y", "sp", [-1, 11, 3, 1]], ["tile_x", "sp", [-1, 1, 11, 1]], ["tile_rc", "sp", [-1, 1]], ["tile_ry", "sp", [-1, 1]], ["tile_rx", "sp", [-1, 1]], ["auto_unroll_max_step", "ot", 1500], ["unroll_explicit", "ot", 0]]}, "result": [[0.0105171454], 0, 8.110566854476929, 1637671852.8413532], "version": 0.2, "tvm_version": "0.8.dev0"}
{"input": ["cuda -keys=cuda,gpu -max_num_threads=1024 -thread_warp_size=32", "conv2d_nchw.cuda", [["TENSOR", [128, 96, 165, 165], "float32"], ["TENSOR", [42, 96, 1, 1], "float32"], 1, "SAME", 1, "float32"], {}], "config": {"index": 3214258, "code_hash": null, "entity": [["tile_f", "sp", [-1, 3, 1, 7]], ["tile_y", "sp", [-1, 3, 1, 11]], ["tile_x", "sp", [-1, 1, 11, 1]], ["tile_rc", "sp", [-1, 1]], ["tile_ry", "sp", [-1, 1]], ["tile_rx", "sp", [-1, 1]], ["auto_unroll_max_step", "ot", 512], ["unroll_explicit", "ot", 0]]}, "result": [[1.144337148], 0, 13.776924848556519, 1637671865.654762], "version": 0.2, "tvm_version": "0.8.dev0"}
{"input": ["cuda -keys=cuda,gpu -max_num_threads=1024 -thread_warp_size=32", "conv2d_nchw.cuda", [["TENSOR", [128, 96, 165, 165], "float32"], ["TENSOR", [42, 96, 1, 1], "float32"], 1, "SAME", 1, "float32"], {}], "config": {"index": 6359986, "code_hash": null, "entity": [["tile_f", "sp", [-1, 3, 1, 7]], ["tile_y", "sp", [-1, 3, 1, 11]], ["tile_x", "sp", [-1, 1, 11, 1]], ["tile_rc", "sp", [-1, 1]], ["tile_ry", "sp", [-1, 1]], ["tile_rx", "sp", [-1, 1]], ["auto_unroll_max_step", "ot", 1500], ["unroll_explicit", "ot", 0]]}, "result": [[1.236342376], 0, 15.67978024482727, 1637671879.77655], "version": 0.2, "tvm_version": "0.8.dev0"}
{"input": ["cuda -keys=cuda,gpu -max_num_threads=1024 -thread_warp_size=32", "conv2d_nchw.cuda", [["TENSOR", [128, 96, 165, 165], "float32"], ["TENSOR", [42, 96, 1, 1], "float32"], 1, "SAME", 1, "float32"], {}], "config": {"index": 68530, "code_hash": null, "entity": [["tile_f", "sp", [-1, 3, 1, 7]], ["tile_y", "sp", [-1, 3, 1, 11]], ["tile_x", "sp", [-1, 1, 11, 1]], ["tile_rc", "sp", [-1, 1]], ["tile_ry", "sp", [-1, 1]], ["tile_rx", "sp", [-1, 1]], ["auto_unroll_max_step", "ot", 0], ["unroll_explicit", "ot", 0]]}, "result": [[1.1453328187499998], 0, 13.44961142539978, 1637671892.2353399], "version": 0.2, "tvm_version": "0.8.dev0"}
{"input": ["cuda -keys=cuda,gpu -max_num_threads=1024 -thread_warp_size=32", "conv2d_nchw.cuda", [["TENSOR", [128, 96, 165, 165], "float32"], ["TENSOR", [42, 96, 1, 1], "float32"], 1, "SAME", 1, "float32"], {}], "config": {"index": 66854, "code_hash": null, "entity": [["tile_f", "sp", [-1, 7, 1, 3]], ["tile_y", "sp", [-1, 1, 15, 1]], ["tile_x", "sp", [-1, 1, 11, 1]], ["tile_rc", "sp", [-1, 1]], ["tile_ry", "sp", [-1, 1]], ["tile_rx", "sp", [-1, 1]], ["auto_unroll_max_step", "ot", 0], ["unroll_explicit", "ot", 0]]}, "result": [[0.008238345923076923], 0, 7.323288679122925, 1637671903.1803045], "version": 0.2, "tvm_version": "0.8.dev0"}
{"input": ["cuda -keys=cuda,gpu -max_num_threads=1024 -thread_warp_size=32", "conv2d_nchw.cuda", [["TENSOR", [128, 96, 165, 165], "float32"], ["TENSOR", [42, 96, 1, 1], "float32"], 1, "SAME", 1, "float32"], {}], "config": {"index": 3212582, "code_hash": null, "entity": [["tile_f", "sp", [-1, 7, 1, 3]], ["tile_y", "sp", [-1, 1, 15, 1]], ["tile_x", "sp", [-1, 1, 11, 1]], ["tile_rc", "sp", [-1, 1]], ["tile_ry", "sp", [-1, 1]], ["tile_rx", "sp", [-1, 1]], ["auto_unroll_max_step", "ot", 512], ["unroll_explicit", "ot", 0]]}, "result": [[0.008269291076923077], 0, 8.439479112625122, 1637671911.1096103], "version": 0.2, "tvm_version": "0.8.dev0"}
{"input": ["cuda -keys=cuda,gpu -max_num_threads=1024 -thread_warp_size=32", "conv2d_nchw.cuda", [["TENSOR", [128, 96, 165, 165], "float32"], ["TENSOR", [42, 96, 1, 1], "float32"], 1, "SAME", 1, "float32"], {}], "config": {"index": 3213869, "code_hash": null, "entity": [["tile_f", "sp", [-1, 1, 1, 6]], ["tile_y", "sp", [-1, 1, 3, 5]], ["tile_x", "sp", [-1, 1, 11, 1]], ["tile_rc", "sp", [-1, 1]], ["tile_ry", "sp", [-1, 1]], ["tile_rx", "sp", [-1, 1]], ["auto_unroll_max_step", "ot", 512], ["unroll_explicit", "ot", 0]]}, "result": [[0.01304698575], 0, 7.484720468521118, 1637671918.1217258], "version": 0.2, "tvm_version": "0.8.dev0"}
{"input": ["cuda -keys=cuda,gpu -max_num_threads=1024 -thread_warp_size=32", "conv2d_nchw.cuda", [["TENSOR", [128, 96, 165, 165], "float32"], ["TENSOR", [42, 96, 1, 1], "float32"], 1, "SAME", 1, "float32"], {}], "config": {"index": 6359597, "code_hash": null, "entity": [["tile_f", "sp", [-1, 1, 1, 6]], ["tile_y", "sp", [-1, 1, 3, 5]], ["tile_x", "sp", [-1, 1, 11, 1]], ["tile_rc", "sp", [-1, 1]], ["tile_ry", "sp", [-1, 1]], ["tile_rx", "sp", [-1, 1]], ["auto_unroll_max_step", "ot", 1500], ["unroll_explicit", "ot", 0]]}, "result": [[0.013036211249999999], 0, 7.766805171966553, 1637671925.3548334], "version": 0.2, "tvm_version": "0.8.dev0"}
{"input": ["cuda -keys=cuda,gpu -max_num_threads=1024 -thread_warp_size=32", "conv2d_nchw.cuda", [["TENSOR", [128, 96, 165, 165], "float32"], ["TENSOR", [42, 96, 1, 1], "float32"], 1, "SAME", 1, "float32"], {}], "config": {"index": 68141, "code_hash": null, "entity": [["tile_f", "sp", [-1, 1, 1, 6]], ["tile_y", "sp", [-1, 1, 3, 5]], ["tile_x", "sp", [-1, 1, 11, 1]], ["tile_rc", "sp", [-1, 1]], ["tile_ry", "sp", [-1, 1]], ["tile_rx", "sp", [-1, 1]], ["auto_unroll_max_step", "ot", 0], ["unroll_explicit", "ot", 0]]}, "result": [[0.013036661375], 0, 7.370573282241821, 1637671932.3611817], "version": 0.2, "tvm_version": "0.8.dev0"}
{"input": ["cuda -keys=cuda,gpu -max_num_threads=1024 -thread_warp_size=32", "conv2d_nchw.cuda", [["TENSOR", [128, 96, 165, 165], "float32"], ["TENSOR", [42, 96, 1, 1], "float32"], 1, "SAME", 1, "float32"], {}], "config": {"index": 12913017, "code_hash": null, "entity": [["tile_f", "sp", [-1, 1, 1, 14]], ["tile_y", "sp", [-1, 3, 1, 5]], ["tile_x", "sp", [-1, 1, 11, 1]], ["tile_rc", "sp", [-1, 2]], ["tile_ry", "sp", [-1, 1]], ["tile_rx", "sp", [-1, 1]], ["auto_unroll_max_step", "ot", 512], ["unroll_explicit", "ot", 1]]}, "result": [[0.019029628], 0, 7.977863550186157, 1637671939.2594988], "version": 0.2, "tvm_version": "0.8.dev0"}
{"input": ["cuda -keys=cuda,gpu -max_num_threads=1024 -thread_warp_size=32", "conv2d_nchw.cuda", [["TENSOR", [128, 96, 165, 165], "float32"], ["TENSOR", [42, 96, 1, 1], "float32"], 1, "SAME", 1, "float32"], {}], "config": {"index": 16058745, "code_hash": null, "entity": [["tile_f", "sp", [-1, 1, 1, 14]], ["tile_y", "sp", [-1, 3, 1, 5]], ["tile_x", "sp", [-1, 1, 11, 1]], ["tile_rc", "sp", [-1, 2]], ["tile_ry", "sp", [-1, 1]], ["tile_rx", "sp", [-1, 1]], ["auto_unroll_max_step", "ot", 1500], ["unroll_explicit", "ot", 1]]}, "result": [[0.019032944666666666], 0, 7.9671995639801025, 1637671946.157141], "version": 0.2, "tvm_version": "0.8.dev0"}
{"input": ["cuda -keys=cuda,gpu -max_num_threads=1024 -thread_warp_size=32", "conv2d_nchw.cuda", [["TENSOR", [128, 96, 165, 165], "float32"], ["TENSOR", [42, 96, 1, 1], "float32"], 1, "SAME", 1, "float32"], {}], "config": {"index": 9767289, "code_hash": null, "entity": [["tile_f", "sp", [-1, 1, 1, 14]], ["tile_y", "sp", [-1, 3, 1, 5]], ["tile_x", "sp", [-1, 1, 11, 1]], ["tile_rc", "sp", [-1, 2]], ["tile_ry", "sp", [-1, 1]], ["tile_rx", "sp", [-1, 1]], ["auto_unroll_max_step", "ot", 0], ["unroll_explicit", "ot", 1]]}, "result": [[0.018027294333333332], 0, 7.300030469894409, 1637671952.9639337], "version": 0.2, "tvm_version": "0.8.dev0"}
{"input": ["cuda -keys=cuda,gpu -max_num_threads=1024 -thread_warp_size=32", "conv2d_nchw.cuda", [["TENSOR", [128, 96, 165, 165], "float32"], ["TENSOR", [42, 96, 1, 1], "float32"], 1, "SAME", 1, "float32"], {}], "config": {"index": 3475558, "code_hash": null, "entity": [["tile_f", "sp", [-1, 7, 1, 3]], ["tile_y", "sp", [-1, 1, 11, 3]], ["tile_x", "sp", [-1, 1, 11, 1]], ["tile_rc", "sp", [-1, 2]], ["tile_ry", "sp", [-1, 1]], ["tile_rx", "sp", [-1, 1]], ["auto_unroll_max_step", "ot", 512], ["unroll_explicit", "ot", 0]]}, "result": [[0.006151052058823529], 0, 7.103547096252441, 1637671959.568117], "version": 0.2, "tvm_version": "0.8.dev0"}
{"input": ["cuda -keys=cuda,gpu -max_num_threads=1024 -thread_warp_size=32", "conv2d_nchw.cuda", [["TENSOR", [128, 96, 165, 165], "float32"], ["TENSOR", [42, 96, 1, 1], "float32"], 1, "SAME", 1, "float32"], {}], "config": {"index": 6621286, "code_hash": null, "entity": [["tile_f", "sp", [-1, 7, 1, 3]], ["tile_y", "sp", [-1, 1, 11, 3]], ["tile_x", "sp", [-1, 1, 11, 1]], ["tile_rc", "sp", [-1, 2]], ["tile_ry", "sp", [-1, 1]], ["tile_rx", "sp", [-1, 1]], ["auto_unroll_max_step", "ot", 1500], ["unroll_explicit", "ot", 0]]}, "result": [[0.006155022470588236], 0, 7.296079397201538, 1637671966.4370172], "version": 0.2, "tvm_version": "0.8.dev0"}
{"input": ["cuda -keys=cuda,gpu -max_num_threads=1024 -thread_warp_size=32", "conv2d_nchw.cuda", [["TENSOR", [128, 96, 165, 165], "float32"], ["TENSOR", [42, 96, 1, 1], "float32"], 1, "SAME", 1, "float32"], {}], "config": {"index": 329830, "code_hash": null, "entity": [["tile_f", "sp", [-1, 7, 1, 3]], ["tile_y", "sp", [-1, 1, 11, 3]], ["tile_x", "sp", [-1, 1, 11, 1]], ["tile_rc", "sp", [-1, 2]], ["tile_ry", "sp", [-1, 1]], ["tile_rx", "sp", [-1, 1]], ["auto_unroll_max_step", "ot", 0], ["unroll_explicit", "ot", 0]]}, "result": [[0.00637727925], 0, 7.421031951904297, 1637671973.467438], "version": 0.2, "tvm_version": "0.8.dev0"}
{"input": ["cuda -keys=cuda,gpu -max_num_threads=1024 -thread_warp_size=32", "conv2d_nchw.cuda", [["TENSOR", [128, 96, 165, 165], "float32"], ["TENSOR", [42, 96, 1, 1], "float32"], 1, "SAME", 1, "float32"], {}], "config": {"index": 68676, "code_hash": null, "entity": [["tile_f", "sp", [-1, 7, 1, 1]], ["tile_y", "sp", [-1, 1, 3, 11]], ["tile_x", "sp", [-1, 1, 11, 1]], ["tile_rc", "sp", [-1, 1]], ["tile_ry", "sp", [-1, 1]], ["tile_rx", "sp", [-1, 1]], ["auto_unroll_max_step", "ot", 0], ["unroll_explicit", "ot", 0]]}, "result": [[0.01400764275], 0, 7.348134994506836, 1637671980.262931], "version": 0.2, "tvm_version": "0.8.dev0"}
{"input": ["cuda -keys=cuda,gpu -max_num_threads=1024 -thread_warp_size=32", "conv2d_nchw.cuda", [["TENSOR", [128, 96, 165, 165], "float32"], ["TENSOR", [42, 96, 1, 1], "float32"], 1, "SAME", 1, "float32"], {}], "config": {"index": 6360132, "code_hash": null, "entity": [["tile_f", "sp", [-1, 7, 1, 1]], ["tile_y", "sp", [-1, 1, 3, 11]], ["tile_x", "sp", [-1, 1, 11, 1]], ["tile_rc", "sp", [-1, 1]], ["tile_ry", "sp", [-1, 1]], ["tile_rx", "sp", [-1, 1]], ["auto_unroll_max_step", "ot", 1500], ["unroll_explicit", "ot", 0]]}, "result": [[0.014118226625], 0, 7.362427234649658, 1637671987.080483], "version": 0.2, "tvm_version": "0.8.dev0"}
{"input": ["cuda -keys=cuda,gpu -max_num_threads=1024 -thread_warp_size=32", "conv2d_nchw.cuda", [["TENSOR", [128, 96, 165, 165], "float32"], ["TENSOR", [42, 96, 1, 1], "float32"], 1, "SAME", 1, "float32"], {}], "config": {"index": 1059812, "code_hash": null, "entity": [["tile_f", "sp", [-1, 1, 1, 3]], ["tile_y", "sp", [-1, 5, 1, 11]], ["tile_x", "sp", [-1, 5, 1, 1]], ["tile_rc", "sp", [-1, 6]], ["tile_ry", "sp", [-1, 1]], ["tile_rx", "sp", [-1, 1]], ["auto_unroll_max_step", "ot", 0], ["unroll_explicit", "ot", 0]]}, "result": [[7.49845554], 0, 45.36440086364746, 1637672038.4506493], "version": 0.2, "tvm_version": "0.8.dev0"}
{"input": ["cuda -keys=cuda,gpu -max_num_threads=1024 -thread_warp_size=32", "conv2d_nchw.cuda", [["TENSOR", [128, 96, 165, 165], "float32"], ["TENSOR", [42, 96, 1, 1], "float32"], 1, "SAME", 1, "float32"], {}], "config": {"index": 6533239, "code_hash": null, "entity": [["tile_f", "sp", [-1, 2, 3, 7]], ["tile_y", "sp", [-1, 3, 1, 1]], ["tile_x", "sp", [-1, 1, 5, 33]], ["tile_rc", "sp", [-1, 1]], ["tile_ry", "sp", [-1, 1]], ["tile_rx", "sp", [-1, 1]], ["auto_unroll_max_step", "ot", 1500], ["unroll_explicit", "ot", 0]]}, "result": [[0.7063171235], 0, 15.666499853134155, 1637672050.3919635], "version": 0.2, "tvm_version": "0.8.dev0"}
{"input": ["cuda -keys=cuda,gpu -max_num_threads=1024 -thread_warp_size=32", "conv2d_nchw.cuda", [["TENSOR", [128, 96, 165, 165], "float32"], ["TENSOR", [42, 96, 1, 1], "float32"], 1, "SAME", 1, "float32"], {}], "config": {"index": 12912742, "code_hash": null, "entity": [["tile_f", "sp", [-1, 7, 1, 3]], ["tile_y", "sp", [-1, 1, 11, 3]], ["tile_x", "sp", [-1, 1, 11, 1]], ["tile_rc", "sp", [-1, 2]], ["tile_ry", "sp", [-1, 1]], ["tile_rx", "sp", [-1, 1]], ["auto_unroll_max_step", "ot", 512], ["unroll_explicit", "ot", 1]]}, "result": [[0.006153752705882353], 0, 7.270307302474976, 1637672159.9638577], "version": 0.2, "tvm_version": "0.8.dev0"}
{"input": ["cuda -keys=cuda,gpu -max_num_threads=1024 -thread_warp_size=32", "conv2d_nchw.cuda", [["TENSOR", [128, 96, 165, 165], "float32"], ["TENSOR", [42, 96, 1, 1], "float32"], 1, "SAME", 1, "float32"], {}], "config": {"index": 16058470, "code_hash": null, "entity": [["tile_f", "sp", [-1, 7, 1, 3]], ["tile_y", "sp", [-1, 1, 11, 3]], ["tile_x", "sp", [-1, 1, 11, 1]], ["tile_rc", "sp", [-1, 2]], ["tile_ry", "sp", [-1, 1]], ["tile_rx", "sp", [-1, 1]], ["auto_unroll_max_step", "ot", 1500], ["unroll_explicit", "ot", 1]]}, "result": [[0.006126630117647059], 0, 7.302155256271362, 1637672166.8690858], "version": 0.2, "tvm_version": "0.8.dev0"}
{"input": ["cuda -keys=cuda,gpu -max_num_threads=1024 -thread_warp_size=32", "conv2d_nchw.cuda", [["TENSOR", [128, 96, 165, 165], "float32"], ["TENSOR", [42, 96, 1, 1], "float32"], 1, "SAME", 1, "float32"], {}], "config": {"index": 9767014, "code_hash": null, "entity": [["tile_f", "sp", [-1, 7, 1, 3]], ["tile_y", "sp", [-1, 1, 11, 3]], ["tile_x", "sp", [-1, 1, 11, 1]], ["tile_rc", "sp", [-1, 2]], ["tile_ry", "sp", [-1, 1]], ["tile_rx", "sp", [-1, 1]], ["auto_unroll_max_step", "ot", 0], ["unroll_explicit", "ot", 1]]}, "result": [[0.0063954106875], 0, 7.1226279735565186, 1637672173.6072972], "version": 0.2, "tvm_version": "0.8.dev0"}
{"input": ["cuda -keys=cuda,gpu -max_num_threads=1024 -thread_warp_size=32", "conv2d_nchw.cuda", [["TENSOR", [128, 96, 165, 165], "float32"], ["TENSOR", [42, 96, 1, 1], "float32"], 1, "SAME", 1, "float32"], {}], "config": {"index": 12650598, "code_hash": null, "entity": [["tile_f", "sp", [-1, 7, 1, 3]], ["tile_y", "sp", [-1, 1, 11, 3]], ["tile_x", "sp", [-1, 1, 11, 1]], ["tile_rc", "sp", [-1, 1]], ["tile_ry", "sp", [-1, 1]], ["tile_rx", "sp", [-1, 1]], ["auto_unroll_max_step", "ot", 512], ["unroll_explicit", "ot", 1]]}, "result": [[0.006380055], 0, 7.669907331466675, 1637672180.9413013], "version": 0.2, "tvm_version": "0.8.dev0"}
{"input": ["cuda -keys=cuda,gpu -max_num_threads=1024 -thread_warp_size=32", "conv2d_nchw.cuda", [["TENSOR", [128, 96, 165, 165], "float32"], ["TENSOR", [42, 96, 1, 1], "float32"], 1, "SAME", 1, "float32"], {}], "config": {"index": 12981286, "code_hash": null, "entity": [["tile_f", "sp", [-1, 7, 1, 3]], ["tile_y", "sp", [-1, 1, 11, 1]], ["tile_x", "sp", [-1, 1, 11, 3]], ["tile_rc", "sp", [-1, 2]], ["tile_ry", "sp", [-1, 1]], ["tile_rx", "sp", [-1, 1]], ["auto_unroll_max_step", "ot", 512], ["unroll_explicit", "ot", 1]]}, "result": [[0.005357188947368421], 0, 7.396900653839111, 1637672187.9303625], "version": 0.2, "tvm_version": "0.8.dev0"}
{"input": ["cuda -keys=cuda,gpu -max_num_threads=1024 -thread_warp_size=32", "conv2d_nchw.cuda", [["TENSOR", [128, 96, 165, 165], "float32"], ["TENSOR", [42, 96, 1, 1], "float32"], 1, "SAME", 1, "float32"], {}], "config": {"index": 15796326, "code_hash": null, "entity": [["tile_f", "sp", [-1, 7, 1, 3]], ["tile_y", "sp", [-1, 1, 11, 3]], ["tile_x", "sp", [-1, 1, 11, 1]], ["tile_rc", "sp", [-1, 1]], ["tile_ry", "sp", [-1, 1]], ["tile_rx", "sp", [-1, 1]], ["auto_unroll_max_step", "ot", 1500], ["unroll_explicit", "ot", 1]]}, "result": [[0.006390779687500001], 0, 7.931551933288574, 1637672195.396197], "version": 0.2, "tvm_version": "0.8.dev0"}
{"input": ["cuda -keys=cuda,gpu -max_num_threads=1024 -thread_warp_size=32", "conv2d_nchw.cuda", [["TENSOR", [128, 96, 165, 165], "float32"], ["TENSOR", [42, 96, 1, 1], "float32"], 1, "SAME", 1, "float32"], {}], "config": {"index": 16127014, "code_hash": null, "entity": [["tile_f", "sp", [-1, 7, 1, 3]], ["tile_y", "sp", [-1, 1, 11, 1]], ["tile_x", "sp", [-1, 1, 11, 3]], ["tile_rc", "sp", [-1, 2]], ["tile_ry", "sp", [-1, 1]], ["tile_rx", "sp", [-1, 1]], ["auto_unroll_max_step", "ot", 1500], ["unroll_explicit", "ot", 1]]}, "result": [[0.0053254899999999996], 0, 7.878776788711548, 1637672202.925535], "version": 0.2, "tvm_version": "0.8.dev0"}
{"input": ["cuda -keys=cuda,gpu -max_num_threads=1024 -thread_warp_size=32", "conv2d_nchw.cuda", [["TENSOR", [128, 96, 165, 165], "float32"], ["TENSOR", [42, 96, 1, 1], "float32"], 1, "SAME", 1, "float32"], {}], "config": {"index": 3544102, "code_hash": null, "entity": [["tile_f", "sp", [-1, 7, 1, 3]], ["tile_y", "sp", [-1, 1, 11, 1]], ["tile_x", "sp", [-1, 1, 11, 3]], ["tile_rc", "sp", [-1, 2]], ["tile_ry", "sp", [-1, 1]], ["tile_rx", "sp", [-1, 1]], ["auto_unroll_max_step", "ot", 512], ["unroll_explicit", "ot", 0]]}, "result": [[0.005977679315789474], 0, 7.657461404800415, 1637672210.3945165], "version": 0.2, "tvm_version": "0.8.dev0"}
{"input": ["cuda -keys=cuda,gpu -max_num_threads=1024 -thread_warp_size=32", "conv2d_nchw.cuda", [["TENSOR", [128, 96, 165, 165], "float32"], ["TENSOR", [42, 96, 1, 1], "float32"], 1, "SAME", 1, "float32"], {}], "config": {"index": 12912754, "code_hash": null, "entity": [["tile_f", "sp", [-1, 3, 1, 7]], ["tile_y", "sp", [-1, 1, 11, 3]], ["tile_x", "sp", [-1, 1, 11, 1]], ["tile_rc", "sp", [-1, 2]], ["tile_ry", "sp", [-1, 1]], ["tile_rx", "sp", [-1, 1]], ["auto_unroll_max_step", "ot", 512], ["unroll_explicit", "ot", 1]]}, "result": [[0.006124142117647059], 0, 8.165433645248413, 1637672218.7390654], "version": 0.2, "tvm_version": "0.8.dev0"}
{"input": ["cuda -keys=cuda,gpu -max_num_threads=1024 -thread_warp_size=32", "conv2d_nchw.cuda", [["TENSOR", [128, 96, 165, 165], "float32"], ["TENSOR", [42, 96, 1, 1], "float32"], 1, "SAME", 1, "float32"], {}], "config": {"index": 6689830, "code_hash": null, "entity": [["tile_f", "sp", [-1, 7, 1, 3]], ["tile_y", "sp", [-1, 1, 11, 1]], ["tile_x", "sp", [-1, 1, 11, 3]], ["tile_rc", "sp", [-1, 2]], ["tile_ry", "sp", [-1, 1]], ["tile_rx", "sp", [-1, 1]], ["auto_unroll_max_step", "ot", 1500], ["unroll_explicit", "ot", 0]]}, "result": [[0.005330005736842106], 0, 7.658718585968018, 1637672226.342001], "version": 0.2, "tvm_version": "0.8.dev0"}
{"input": ["cuda -keys=cuda,gpu -max_num_threads=1024 -thread_warp_size=32", "conv2d_nchw.cuda", [["TENSOR", [128, 96, 165, 165], "float32"], ["TENSOR", [42, 96, 1, 1], "float32"], 1, "SAME", 1, "float32"], {}], "config": {"index": 12675047, "code_hash": null, "entity": [["tile_f", "sp", [-1, 14, 1, 3]], ["tile_y", "sp", [-1, 1, 5, 3]], ["tile_x", "sp", [-1, 1, 33, 1]], ["tile_rc", "sp", [-1, 1]], ["tile_ry", "sp", [-1, 1]], ["tile_rx", "sp", [-1, 1]], ["auto_unroll_max_step", "ot", 512], ["unroll_explicit", "ot", 1]]}, "result": [[0.0063084699375], 0, 8.015251636505127, 1637672233.9404354], "version": 0.2, "tvm_version": "0.8.dev0"}
{"input": ["cuda -keys=cuda,gpu -max_num_threads=1024 -thread_warp_size=32", "conv2d_nchw.cuda", [["TENSOR", [128, 96, 165, 165], "float32"], ["TENSOR", [42, 96, 1, 1], "float32"], 1, "SAME", 1, "float32"], {}], "config": {"index": 12675046, "code_hash": null, "entity": [["tile_f", "sp", [-1, 7, 1, 3]], ["tile_y", "sp", [-1, 1, 5, 3]], ["tile_x", "sp", [-1, 1, 33, 1]], ["tile_rc", "sp", [-1, 1]], ["tile_ry", "sp", [-1, 1]], ["tile_rx", "sp", [-1, 1]], ["auto_unroll_max_step", "ot", 512], ["unroll_explicit", "ot", 1]]}, "result": [[0.0066396154999999995], 0, 8.206265687942505, 1637672241.831644], "version": 0.2, "tvm_version": "0.8.dev0"}
{"input": ["cuda -keys=cuda,gpu -max_num_threads=1024 -thread_warp_size=32", "conv2d_nchw.cuda", [["TENSOR", [128, 96, 165, 165], "float32"], ["TENSOR", [42, 96, 1, 1], "float32"], 1, "SAME", 1, "float32"], {}], "config": {"index": 12650482, "code_hash": null, "entity": [["tile_f", "sp", [-1, 3, 1, 7]], ["tile_y", "sp", [-1, 1, 5, 3]], ["tile_x", "sp", [-1, 1, 11, 1]], ["tile_rc", "sp", [-1, 1]], ["tile_ry", "sp", [-1, 1]], ["tile_rx", "sp", [-1, 1]], ["auto_unroll_max_step", "ot", 512], ["unroll_explicit", "ot", 1]]}, "result": [[0.0064377658125], 0, 8.107374906539917, 1637672249.5688996], "version": 0.2, "tvm_version": "0.8.dev0"}
{"input": ["cuda -keys=cuda,gpu -max_num_threads=1024 -thread_warp_size=32", "conv2d_nchw.cuda", [["TENSOR", [128, 96, 165, 165], "float32"], ["TENSOR", [42, 96, 1, 1], "float32"], 1, "SAME", 1, "float32"], {}], "config": {"index": 3237863, "code_hash": null, "entity": [["tile_f", "sp", [-1, 14, 1, 3]], ["tile_y", "sp", [-1, 1, 5, 3]], ["tile_x", "sp", [-1, 1, 33, 1]], ["tile_rc", "sp", [-1, 1]], ["tile_ry", "sp", [-1, 1]], ["tile_rx", "sp", [-1, 1]], ["auto_unroll_max_step", "ot", 512], ["unroll_explicit", "ot", 0]]}, "result": [[0.006195863411764706], 0, 8.002653360366821, 1637672257.1604702], "version": 0.2, "tvm_version": "0.8.dev0"}
{"input": ["cuda -keys=cuda,gpu -max_num_threads=1024 -thread_warp_size=32", "conv2d_nchw.cuda", [["TENSOR", [128, 96, 165, 165], "float32"], ["TENSOR", [42, 96, 1, 1], "float32"], 1, "SAME", 1, "float32"], {}], "config": {"index": 16058482, "code_hash": null, "entity": [["tile_f", "sp", [-1, 3, 1, 7]], ["tile_y", "sp", [-1, 1, 11, 3]], ["tile_x", "sp", [-1, 1, 11, 1]], ["tile_rc", "sp", [-1, 2]], ["tile_ry", "sp", [-1, 1]], ["tile_rx", "sp", [-1, 1]], ["auto_unroll_max_step", "ot", 1500], ["unroll_explicit", "ot", 1]]}, "result": [[0.00616159394117647], 0, 7.666321039199829, 1637672264.3904414], "version": 0.2, "tvm_version": "0.8.dev0"}
