artifacts/microbenchmark/tvm/e2e/autotvm_log/depthwise_128_42_83_83_7_7_1_SAME.log
{"input": ["cuda -keys=cuda,gpu -max_num_threads=1024 -thread_warp_size=32", "depthwise_conv2d_nchw.cuda", [["TENSOR", [128, 42, 83, 83], "float32"], ["TENSOR", [42, 1, 7, 7], "float32"], 1, "SAME", 1, "float32"], {}], "config": {"index": 5933, "code_hash": null, "entity": [["tile_f", "sp", [-1, 1, 1, 6]], ["tile_y", "sp", [-1, 1, 1, 1]], ["tile_x", "sp", [-1, 1, 1, 83]], ["auto_unroll_max_step", "ot", 1500], ["unroll_explicit", "ot", 1]]}, "result": [[0.30282010125], 0, 7.155163288116455, 1637740791.9633439], "version": 0.2, "tvm_version": "0.8.dev0"}
{"input": ["cuda -keys=cuda,gpu -max_num_threads=1024 -thread_warp_size=32", "depthwise_conv2d_nchw.cuda", [["TENSOR", [128, 42, 83, 83], "float32"], ["TENSOR", [42, 1, 7, 7], "float32"], 1, "SAME", 1, "float32"], {}], "config": {"index": 3602, "code_hash": null, "entity": [["tile_f", "sp", [-1, 1, 7, 1]], ["tile_y", "sp", [-1, 1, 1, 1]], ["tile_x", "sp", [-1, 1, 83, 1]], ["auto_unroll_max_step", "ot", 0], ["unroll_explicit", "ot", 1]]}, "result": [[0.0026513122368421052], 0, 2.274489164352417, 1637740800.3384612], "version": 0.2, "tvm_version": "0.8.dev0"}
{"input": ["cuda -keys=cuda,gpu -max_num_threads=1024 -thread_warp_size=32", "depthwise_conv2d_nchw.cuda", [["TENSOR", [128, 42, 83, 83], "float32"], ["TENSOR", [42, 1, 7, 7], "float32"], 1, "SAME", 1, "float32"], {}], "config": {"index": 1049, "code_hash": null, "entity": [["tile_f", "sp", [-1, 2, 21, 1]], ["tile_y", "sp", [-1, 1, 1, 1]], ["tile_x", "sp", [-1, 1, 1, 1]], ["auto_unroll_max_step", "ot", 256], ["unroll_explicit", "ot", 0]]}, "result": [[0.05447955075], 0, 2.6422829627990723, 1637740803.2551944], "version": 0.2, "tvm_version": "0.8.dev0"}
{"input": ["cuda -keys=cuda,gpu -max_num_threads=1024 -thread_warp_size=32", "depthwise_conv2d_nchw.cuda", [["TENSOR", [128, 42, 83, 83], "float32"], ["TENSOR", [42, 1, 7, 7], "float32"], 1, "SAME", 1, "float32"], {}], "config": {"index": 4374, "code_hash": null, "entity": [["tile_f", "sp", [-1, 1, 14, 1]], ["tile_y", "sp", [-1, 1, 1, 1]], ["tile_x", "sp", [-1, 83, 1, 1]], ["auto_unroll_max_step", "ot", 256], ["unroll_explicit", "ot", 1]]}, "result": [[0.08917256175], 0, 2.9332900047302246, 1637740807.0575495], "version": 0.2, "tvm_version": "0.8.dev0"}
{"input": ["cuda -keys=cuda,gpu -max_num_threads=1024 -thread_warp_size=32", "depthwise_conv2d_nchw.cuda", [["TENSOR", [128, 42, 83, 83], "float32"], ["TENSOR", [42, 1, 7, 7], "float32"], 1, "SAME", 1, "float32"], {}], "config": {"index": 1814, "code_hash": null, "entity": [["tile_f", "sp", [-1, 1, 14, 1]], ["tile_y", "sp", [-1, 1, 1, 1]], ["tile_x", "sp", [-1, 1, 1, 83]], ["auto_unroll_max_step", "ot", 256], ["unroll_explicit", "ot", 0]]}, "result": [[0.04904752525], 0, 2.546382188796997, 1637740809.9064484], "version": 0.2, "tvm_version": "0.8.dev0"}
{"input": ["cuda -keys=cuda,gpu -max_num_threads=1024 -thread_warp_size=32", "depthwise_conv2d_nchw.cuda", [["TENSOR", [128, 42, 83, 83], "float32"], ["TENSOR", [42, 1, 7, 7], "float32"], 1, "SAME", 1, "float32"], {}], "config": {"index": 5648, "code_hash": null, "entity": [["tile_f", "sp", [-1, 1, 6, 1]], ["tile_y", "sp", [-1, 1, 1, 1]], ["tile_x", "sp", [-1, 1, 83, 1]], ["auto_unroll_max_step", "ot", 1500], ["unroll_explicit", "ot", 1]]}, "result": [[0.0024061108333333337], 0, 2.5747225284576416, 1637740812.7501113], "version": 0.2, "tvm_version": "0.8.dev0"}
{"input": ["cuda -keys=cuda,gpu -max_num_threads=1024 -thread_warp_size=32", "depthwise_conv2d_nchw.cuda", [["TENSOR", [128, 42, 83, 83], "float32"], ["TENSOR", [42, 1, 7, 7], "float32"], 1, "SAME", 1, "float32"], {}], "config": {"index": 137, "code_hash": null, "entity": [["tile_f", "sp", [-1, 3, 2, 1]], ["tile_y", "sp", [-1, 1, 83, 1]], ["tile_x", "sp", [-1, 1, 1, 1]], ["auto_unroll_max_step", "ot", 0], ["unroll_explicit", "ot", 0]]}, "result": [[0.0033885112], 0, 2.3319239616394043, 1637740815.4122071], "version": 0.2, "tvm_version": "0.8.dev0"}
{"input": ["cuda -keys=cuda,gpu -max_num_threads=1024 -thread_warp_size=32", "depthwise_conv2d_nchw.cuda", [["TENSOR", [128, 42, 83, 83], "float32"], ["TENSOR", [42, 1, 7, 7], "float32"], 1, "SAME", 1, "float32"], {}], "config": {"index": 2095, "code_hash": null, "entity": [["tile_f", "sp", [-1, 1, 7, 6]], ["tile_y", "sp", [-1, 1, 1, 1]], ["tile_x", "sp", [-1, 1, 1, 1]], ["auto_unroll_max_step", "ot", 1500], ["unroll_explicit", "ot", 0]]}, "result": [[0.13392809975], 0, 3.7974283695220947, 1637740822.4783456], "version": 0.2, "tvm_version": "0.8.dev0"}
{"input": ["cuda -keys=cuda,gpu -max_num_threads=1024 -thread_warp_size=32", "depthwise_conv2d_nchw.cuda", [["TENSOR", [128, 42, 83, 83], "float32"], ["TENSOR", [42, 1, 7, 7], "float32"], 1, "SAME", 1, "float32"], {}], "config": {"index": 3213, "code_hash": null, "entity": [["tile_f", "sp", [-1, 2, 3, 1]], ["tile_y", "sp", [-1, 1, 83, 1]], ["tile_x", "sp", [-1, 1, 1, 1]], ["auto_unroll_max_step", "ot", 0], ["unroll_explicit", "ot", 1]]}, "result": [[0.003549461896551724], 0, 2.250534772872925, 1637740845.5111532], "version": 0.2, "tvm_version": "0.8.dev0"}
{"input": ["cuda -keys=cuda,gpu -max_num_threads=1024 -thread_warp_size=32", "depthwise_conv2d_nchw.cuda", [["TENSOR", [128, 42, 83, 83], "float32"], ["TENSOR", [42, 1, 7, 7], "float32"], 1, "SAME", 1, "float32"], {}], "config": {"index": 1825, "code_hash": null, "entity": [["tile_f", "sp", [-1, 1, 7, 2]], ["tile_y", "sp", [-1, 1, 1, 1]], ["tile_x", "sp", [-1, 1, 1, 83]], ["auto_unroll_max_step", "ot", 256], ["unroll_explicit", "ot", 0]]}, "result": [[0.07832786], 0, 3.305593729019165, 1637740849.1968625], "version": 0.2, "tvm_version": "0.8.dev0"}
{"input": ["cuda -keys=cuda,gpu -max_num_threads=1024 -thread_warp_size=32", "depthwise_conv2d_nchw.cuda", [["TENSOR", [128, 42, 83, 83], "float32"], ["TENSOR", [42, 1, 7, 7], "float32"], 1, "SAME", 1, "float32"], {}], "config": {"index": 2243, "code_hash": null, "entity": [["tile_f", "sp", [-1, 6, 1, 1]], ["tile_y", "sp", [-1, 1, 1, 83]], ["tile_x", "sp", [-1, 1, 1, 1]], ["auto_unroll_max_step", "ot", 1500], ["unroll_explicit", "ot", 0]]}, "result": [[0.52262121975], 0, 5.93136739730835, 1637740858.7197654], "version": 0.2, "tvm_version": "0.8.dev0"}
{"input": ["cuda -keys=cuda,gpu -max_num_threads=1024 -thread_warp_size=32", "depthwise_conv2d_nchw.cuda", [["TENSOR", [128, 42, 83, 83], "float32"], ["TENSOR", [42, 1, 7, 7], "float32"], 1, "SAME", 1, "float32"], {}], "config": {"index": 4392, "code_hash": null, "entity": [["tile_f", "sp", [-1, 1, 2, 3]], ["tile_y", "sp", [-1, 1, 1, 1]], ["tile_x", "sp", [-1, 83, 1, 1]], ["auto_unroll_max_step", "ot", 256], ["unroll_explicit", "ot", 1]]}, "result": [[0.38743638675], 0, 5.5943379402160645, 1637740974.4922779], "version": 0.2, "tvm_version": "0.8.dev0"}
{"input": ["cuda -keys=cuda,gpu -max_num_threads=1024 -thread_warp_size=32", "depthwise_conv2d_nchw.cuda", [["TENSOR", [128, 42, 83, 83], "float32"], ["TENSOR", [42, 1, 7, 7], "float32"], 1, "SAME", 1, "float32"], {}], "config": {"index": 2139, "code_hash": null, "entity": [["tile_f", "sp", [-1, 1, 1, 2]], ["tile_y", "sp", [-1, 83, 1, 1]], ["tile_x", "sp", [-1, 1, 1, 1]], ["auto_unroll_max_step", "ot", 1500], ["unroll_explicit", "ot", 0]]}, "result": [[0.9762097602500001], 0, 12.617958784103394, 1637740982.2922344], "version": 0.2, "tvm_version": "0.8.dev0"}
{"input": ["cuda -keys=cuda,gpu -max_num_threads=1024 -thread_warp_size=32", "depthwise_conv2d_nchw.cuda", [["TENSOR", [128, 42, 83, 83], "float32"], ["TENSOR", [42, 1, 7, 7], "float32"], 1, "SAME", 1, "float32"], {}], "config": {"index": 2576, "code_hash": null, "entity": [["tile_f", "sp", [-1, 1, 6, 1]], ["tile_y", "sp", [-1, 1, 1, 1]], ["tile_x", "sp", [-1, 1, 83, 1]], ["auto_unroll_max_step", "ot", 1500], ["unroll_explicit", "ot", 0]]}, "result": [[0.0027815856944444443], 0, 1.9678475856781006, 1637740996.0845814], "version": 0.2, "tvm_version": "0.8.dev0"}
{"input": ["cuda -keys=cuda,gpu -max_num_threads=1024 -thread_warp_size=32", "depthwise_conv2d_nchw.cuda", [["TENSOR", [128, 42, 83, 83], "float32"], ["TENSOR", [42, 1, 7, 7], "float32"], 1, "SAME", 1, "float32"], {}], "config": {"index": 4624, "code_hash": null, "entity": [["tile_f", "sp", [-1, 1, 6, 1]], ["tile_y", "sp", [-1, 1, 1, 1]], ["tile_x", "sp", [-1, 1, 83, 1]], ["auto_unroll_max_step", "ot", 256], ["unroll_explicit", "ot", 1]]}, "result": [[0.0024320202786885245], 0, 2.522165298461914, 1637740998.2093801], "version": 0.2, "tvm_version": "0.8.dev0"}
{"input": ["cuda -keys=cuda,gpu -max_num_threads=1024 -thread_warp_size=32", "depthwise_conv2d_nchw.cuda", [["TENSOR", [128, 42, 83, 83], "float32"], ["TENSOR", [42, 1, 7, 7], "float32"], 1, "SAME", 1, "float32"], {}], "config": {"index": 1552, "code_hash": null, "entity": [["tile_f", "sp", [-1, 1, 6, 1]], ["tile_y", "sp", [-1, 1, 1, 1]], ["tile_x", "sp", [-1, 1, 83, 1]], ["auto_unroll_max_step", "ot", 256], ["unroll_explicit", "ot", 0]]}, "result": [[0.002533278675], 0, 1.9682624340057373, 1637740999.8340096], "version": 0.2, "tvm_version": "0.8.dev0"}
{"input": ["cuda -keys=cuda,gpu -max_num_threads=1024 -thread_warp_size=32", "depthwise_conv2d_nchw.cuda", [["TENSOR", [128, 42, 83, 83], "float32"], ["TENSOR", [42, 1, 7, 7], "float32"], 1, "SAME", 1, "float32"], {}], "config": {"index": 528, "code_hash": null, "entity": [["tile_f", "sp", [-1, 1, 6, 1]], ["tile_y", "sp", [-1, 1, 1, 1]], ["tile_x", "sp", [-1, 1, 83, 1]], ["auto_unroll_max_step", "ot", 0], ["unroll_explicit", "ot", 0]]}, "result": [[0.002533711175], 0, 2.1579015254974365, 1637741001.5845685], "version": 0.2, "tvm_version": "0.8.dev0"}
{"input": ["cuda -keys=cuda,gpu -max_num_threads=1024 -thread_warp_size=32", "depthwise_conv2d_nchw.cuda", [["TENSOR", [128, 42, 83, 83], "float32"], ["TENSOR", [42, 1, 7, 7], "float32"], 1, "SAME", 1, "float32"], {}], "config": {"index": 3600, "code_hash": null, "entity": [["tile_f", "sp", [-1, 1, 6, 1]], ["tile_y", "sp", [-1, 1, 1, 1]], ["tile_x", "sp", [-1, 1, 83, 1]], ["auto_unroll_max_step", "ot", 0], ["unroll_explicit", "ot", 1]]}, "result": [[0.0025338861500000002], 0, 2.128873109817505, 1637741003.295969], "version": 0.2, "tvm_version": "0.8.dev0"}
{"input": ["cuda -keys=cuda,gpu -max_num_threads=1024 -thread_warp_size=32", "depthwise_conv2d_nchw.cuda", [["TENSOR", [128, 42, 83, 83], "float32"], ["TENSOR", [42, 1, 7, 7], "float32"], 1, "SAME", 1, "float32"], {}], "config": {"index": 5650, "code_hash": null, "entity": [["tile_f", "sp", [-1, 1, 7, 1]], ["tile_y", "sp", [-1, 1, 1, 1]], ["tile_x", "sp", [-1, 1, 83, 1]], ["auto_unroll_max_step", "ot", 1500], ["unroll_explicit", "ot", 1]]}, "result": [[0.0026131545897435894], 0, 2.247142791748047, 1637741005.0625515], "version": 0.2, "tvm_version": "0.8.dev0"}
{"input": ["cuda -keys=cuda,gpu -max_num_threads=1024 -thread_warp_size=32", "depthwise_conv2d_nchw.cuda", [["TENSOR", [128, 42, 83, 83], "float32"], ["TENSOR", [42, 1, 7, 7], "float32"], 1, "SAME", 1, "float32"], {}], "config": {"index": 2578, "code_hash": null, "entity": [["tile_f", "sp", [-1, 1, 7, 1]], ["tile_y", "sp", [-1, 1, 1, 1]], ["tile_x", "sp", [-1, 1, 83, 1]], ["auto_unroll_max_step", "ot", 1500], ["unroll_explicit", "ot", 0]]}, "result": [[0.002652256947368421], 0, 2.125317096710205, 1637741006.7701652], "version": 0.2, "tvm_version": "0.8.dev0"}
{"input": ["cuda -keys=cuda,gpu -max_num_threads=1024 -thread_warp_size=32", "depthwise_conv2d_nchw.cuda", [["TENSOR", [128, 42, 83, 83], "float32"], ["TENSOR", [42, 1, 7, 7], "float32"], 1, "SAME", 1, "float32"], {}], "config": {"index": 2573, "code_hash": null, "entity": [["tile_f", "sp", [-1, 2, 3, 1]], ["tile_y", "sp", [-1, 1, 1, 1]], ["tile_x", "sp", [-1, 1, 83, 1]], ["auto_unroll_max_step", "ot", 1500], ["unroll_explicit", "ot", 0]]}, "result": [[0.0025622844126984125], 0, 2.2019197940826416, 1637741008.56007], "version": 0.2, "tvm_version": "0.8.dev0"}
{"input": ["cuda -keys=cuda,gpu -max_num_threads=1024 -thread_warp_size=32", "depthwise_conv2d_nchw.cuda", [["TENSOR", [128, 42, 83, 83], "float32"], ["TENSOR", [42, 1, 7, 7], "float32"], 1, "SAME", 1, "float32"], {}], "config": {"index": 5645, "code_hash": null, "entity": [["tile_f", "sp", [-1, 2, 3, 1]], ["tile_y", "sp", [-1, 1, 1, 1]], ["tile_x", "sp", [-1, 1, 83, 1]], ["auto_unroll_max_step", "ot", 1500], ["unroll_explicit", "ot", 1]]}, "result": [[0.002389311380952381], 0, 2.5088465213775635, 1637741010.5713654], "version": 0.2, "tvm_version": "0.8.dev0"}
{"input": ["cuda -keys=cuda,gpu -max_num_threads=1024 -thread_warp_size=32", "depthwise_conv2d_nchw.cuda", [["TENSOR", [128, 42, 83, 83], "float32"], ["TENSOR", [42, 1, 7, 7], "float32"], 1, "SAME", 1, "float32"], {}], "config": {"index": 5264, "code_hash": null, "entity": [["tile_f", "sp", [-1, 1, 6, 1]], ["tile_y", "sp", [-1, 1, 83, 1]], ["tile_x", "sp", [-1, 1, 1, 1]], ["auto_unroll_max_step", "ot", 1500], ["unroll_explicit", "ot", 1]]}, "result": [[0.0031180817272727277], 0, 2.062096118927002, 1637741012.186492], "version": 0.2, "tvm_version": "0.8.dev0"}
{"input": ["cuda -keys=cuda,gpu -max_num_threads=1024 -thread_warp_size=32", "depthwise_conv2d_nchw.cuda", [["TENSOR", [128, 42, 83, 83], "float32"], ["TENSOR", [42, 1, 7, 7], "float32"], 1, "SAME", 1, "float32"], {}], "config": {"index": 2192, "code_hash": null, "entity": [["tile_f", "sp", [-1, 1, 6, 1]], ["tile_y", "sp", [-1, 1, 83, 1]], ["tile_x", "sp", [-1, 1, 1, 1]], ["auto_unroll_max_step", "ot", 1500], ["unroll_explicit", "ot", 0]]}, "result": [[0.0031516675625], 0, 2.9226863384246826, 1637741014.7960289], "version": 0.2, "tvm_version": "0.8.dev0"}
{"input": ["cuda -keys=cuda,gpu -max_num_threads=1024 -thread_warp_size=32", "depthwise_conv2d_nchw.cuda", [["TENSOR", [128, 42, 83, 83], "float32"], ["TENSOR", [42, 1, 7, 7], "float32"], 1, "SAME", 1, "float32"], {}], "config": {"index": 5142, "code_hash": null, "entity": [["tile_f", "sp", [-1, 1, 14, 1]], ["tile_y", "sp", [-1, 1, 1, 1]], ["tile_x", "sp", [-1, 1, 1, 1]], ["auto_unroll_max_step", "ot", 1500], ["unroll_explicit", "ot", 1]]}, "result": [[0.02811642225], 0, 2.2849814891815186, 1637741016.5619094], "version": 0.2, "tvm_version": "0.8.dev0"}
{"input": ["cuda -keys=cuda,gpu -max_num_threads=1024 -thread_warp_size=32", "depthwise_conv2d_nchw.cuda", [["TENSOR", [128, 42, 83, 83], "float32"], ["TENSOR", [42, 1, 7, 7], "float32"], 1, "SAME", 1, "float32"], {}], "config": {"index": 2070, "code_hash": null, "entity": [["tile_f", "sp", [-1, 1, 14, 1]], ["tile_y", "sp", [-1, 1, 1, 1]], ["tile_x", "sp", [-1, 1, 1, 1]], ["auto_unroll_max_step", "ot", 1500], ["unroll_explicit", "ot", 0]]}, "result": [[0.0265285485], 0, 2.3297619819641113, 1637741018.492685], "version": 0.2, "tvm_version": "0.8.dev0"}
{"input": ["cuda -keys=cuda,gpu -max_num_threads=1024 -thread_warp_size=32", "depthwise_conv2d_nchw.cuda", [["TENSOR", [128, 42, 83, 83], "float32"], ["TENSOR", [42, 1, 7, 7], "float32"], 1, "SAME", 1, "float32"], {}], "config": {"index": 2073, "code_hash": null, "entity": [["tile_f", "sp", [-1, 2, 21, 1]], ["tile_y", "sp", [-1, 1, 1, 1]], ["tile_x", "sp", [-1, 1, 1, 1]], ["auto_unroll_max_step", "ot", 1500], ["unroll_explicit", "ot", 0]]}, "result": [[0.05447612625], 0, 3.0702590942382812, 1637741021.0551577], "version": 0.2, "tvm_version": "0.8.dev0"}
{"input": ["cuda -keys=cuda,gpu -max_num_threads=1024 -thread_warp_size=32", "depthwise_conv2d_nchw.cuda", [["TENSOR", [128, 42, 83, 83], "float32"], ["TENSOR", [42, 1, 7, 7], "float32"], 1, "SAME", 1, "float32"], {}], "config": {"index": 5146, "code_hash": null, "entity": [["tile_f", "sp", [-1, 1, 42, 1]], ["tile_y", "sp", [-1, 1, 1, 1]], ["tile_x", "sp", [-1, 1, 1, 1]], ["auto_unroll_max_step", "ot", 1500], ["unroll_explicit", "ot", 1]]}, "result": [[0.03340432775], 0, 2.41650652885437, 1637741022.8968523], "version": 0.2, "tvm_version": "0.8.dev0"}
{"input": ["cuda -keys=cuda,gpu -max_num_threads=1024 -thread_warp_size=32", "depthwise_conv2d_nchw.cuda", [["TENSOR", [128, 42, 83, 83], "float32"], ["TENSOR", [42, 1, 7, 7], "float32"], 1, "SAME", 1, "float32"], {}], "config": {"index": 2072, "code_hash": null, "entity": [["tile_f", "sp", [-1, 1, 21, 1]], ["tile_y", "sp", [-1, 1, 1, 1]], ["tile_x", "sp", [-1, 1, 1, 1]], ["auto_unroll_max_step", "ot", 1500], ["unroll_explicit", "ot", 0]]}, "result": [[0.02766843675], 0, 2.373530626296997, 1637741024.8058527], "version": 0.2, "tvm_version": "0.8.dev0"}
{"input": ["cuda -keys=cuda,gpu -max_num_threads=1024 -thread_warp_size=32", "depthwise_conv2d_nchw.cuda", [["TENSOR", [128, 42, 83, 83], "float32"], ["TENSOR", [42, 1, 7, 7], "float32"], 1, "SAME", 1, "float32"], {}], "config": {"index": 5144, "code_hash": null, "entity": [["tile_f", "sp", [-1, 1, 21, 1]], ["tile_y", "sp", [-1, 1, 1, 1]], ["tile_x", "sp", [-1, 1, 1, 1]], ["auto_unroll_max_step", "ot", 1500], ["unroll_explicit", "ot", 1]]}, "result": [[0.029621673999999997], 0, 2.376910448074341, 1637741026.6310694], "version": 0.2, "tvm_version": "0.8.dev0"}
{"input": ["cuda -keys=cuda,gpu -max_num_threads=1024 -thread_warp_size=32", "depthwise_conv2d_nchw.cuda", [["TENSOR", [128, 42, 83, 83], "float32"], ["TENSOR", [42, 1, 7, 7], "float32"], 1, "SAME", 1, "float32"], {}], "config": {"index": 5145, "code_hash": null, "entity": [["tile_f", "sp", [-1, 2, 21, 1]], ["tile_y", "sp", [-1, 1, 1, 1]], ["tile_x", "sp", [-1, 1, 1, 1]], ["auto_unroll_max_step", "ot", 1500], ["unroll_explicit", "ot", 1]]}, "result": [[0.059440542], 0, 2.7043755054473877, 1637741028.5594702], "version": 0.2, "tvm_version": "0.8.dev0"}
{"input": ["cuda -keys=cuda,gpu -max_num_threads=1024 -thread_warp_size=32", "depthwise_conv2d_nchw.cuda", [["TENSOR", [128, 42, 83, 83], "float32"], ["TENSOR", [42, 1, 7, 7], "float32"], 1, "SAME", 1, "float32"], {}], "config": {"index": 2074, "code_hash": null, "entity": [["tile_f", "sp", [-1, 1, 42, 1]], ["tile_y", "sp", [-1, 1, 1, 1]], ["tile_x", "sp", [-1, 1, 1, 1]], ["auto_unroll_max_step", "ot", 1500], ["unroll_explicit", "ot", 0]]}, "result": [[0.031010654500000002], 0, 2.685439348220825, 1637741030.7563488], "version": 0.2, "tvm_version": "0.8.dev0"}
{"input": ["cuda -keys=cuda,gpu -max_num_threads=1024 -thread_warp_size=32", "depthwise_conv2d_nchw.cuda", [["TENSOR", [128, 42, 83, 83], "float32"], ["TENSOR", [42, 1, 7, 7], "float32"], 1, "SAME", 1, "float32"], {}], "config": {"index": 4626, "code_hash": null, "entity": [["tile_f", "sp", [-1, 1, 7, 1]], ["tile_y", "sp", [-1, 1, 1, 1]], ["tile_x", "sp", [-1, 1, 83, 1]], ["auto_unroll_max_step", "ot", 256], ["unroll_explicit", "ot", 1]]}, "result": [[0.0025925706153846154], 0, 2.2313284873962402, 1637741032.5229435], "version": 0.2, "tvm_version": "0.8.dev0"}
{"input": ["cuda -keys=cuda,gpu -max_num_threads=1024 -thread_warp_size=32", "depthwise_conv2d_nchw.cuda", [["TENSOR", [128, 42, 83, 83], "float32"], ["TENSOR", [42, 1, 7, 7], "float32"], 1, "SAME", 1, "float32"], {}], "config": {"index": 1554, "code_hash": null, "entity": [["tile_f", "sp", [-1, 1, 7, 1]], ["tile_y", "sp", [-1, 1, 1, 1]], ["tile_x", "sp", [-1, 1, 83, 1]], ["auto_unroll_max_step", "ot", 256], ["unroll_explicit", "ot", 0]]}, "result": [[0.002651238627118644], 0, 2.5185294151306152, 1637741034.7138798], "version": 0.2, "tvm_version": "0.8.dev0"}
{"input": ["cuda -keys=cuda,gpu -max_num_threads=1024 -thread_warp_size=32", "depthwise_conv2d_nchw.cuda", [["TENSOR", [128, 42, 83, 83], "float32"], ["TENSOR", [42, 1, 7, 7], "float32"], 1, "SAME", 1, "float32"], {}], "config": {"index": 530, "code_hash": null, "entity": [["tile_f", "sp", [-1, 1, 7, 1]], ["tile_y", "sp", [-1, 1, 1, 1]], ["tile_x", "sp", [-1, 1, 83, 1]], ["auto_unroll_max_step", "ot", 0], ["unroll_explicit", "ot", 0]]}, "result": [[0.002648559736842105], 0, 2.222336769104004, 1637741036.5894487], "version": 0.2, "tvm_version": "0.8.dev0"}
{"input": ["cuda -keys=cuda,gpu -max_num_threads=1024 -thread_warp_size=32", "depthwise_conv2d_nchw.cuda", [["TENSOR", [128, 42, 83, 83], "float32"], ["TENSOR", [42, 1, 7, 7], "float32"], 1, "SAME", 1, "float32"], {}], "config": {"index": 4621, "code_hash": null, "entity": [["tile_f", "sp", [-1, 2, 3, 1]], ["tile_y", "sp", [-1, 1, 1, 1]], ["tile_x", "sp", [-1, 1, 83, 1]], ["auto_unroll_max_step", "ot", 256], ["unroll_explicit", "ot", 1]]}, "result": [[0.0023889566428571428], 0, 2.1724605560302734, 1637741038.2718737], "version": 0.2, "tvm_version": "0.8.dev0"}
{"input": ["cuda -keys=cuda,gpu -max_num_threads=1024 -thread_warp_size=32", "depthwise_conv2d_nchw.cuda", [["TENSOR", [128, 42, 83, 83], "float32"], ["TENSOR", [42, 1, 7, 7], "float32"], 1, "SAME", 1, "float32"], {}], "config": {"index": 525, "code_hash": null, "entity": [["tile_f", "sp", [-1, 2, 3, 1]], ["tile_y", "sp", [-1, 1, 1, 1]], ["tile_x", "sp", [-1, 1, 83, 1]], ["auto_unroll_max_step", "ot", 0], ["unroll_explicit", "ot", 0]]}, "result": [[0.0026129366410256407], 0, 2.205306053161621, 1637741040.0389798], "version": 0.2, "tvm_version": "0.8.dev0"}
{"input": ["cuda -keys=cuda,gpu -max_num_threads=1024 -thread_warp_size=32", "depthwise_conv2d_nchw.cuda", [["TENSOR", [128, 42, 83, 83], "float32"], ["TENSOR", [42, 1, 7, 7], "float32"], 1, "SAME", 1, "float32"], {}], "config": {"index": 1549, "code_hash": null, "entity": [["tile_f", "sp", [-1, 2, 3, 1]], ["tile_y", "sp", [-1, 1, 1, 1]], ["tile_x", "sp", [-1, 1, 83, 1]], ["auto_unroll_max_step", "ot", 256], ["unroll_explicit", "ot", 0]]}, "result": [[0.0028021545], 0, 2.5626866817474365, 1637741047.2441254], "version": 0.2, "tvm_version": "0.8.dev0"}
{"input": ["cuda -keys=cuda,gpu -max_num_threads=1024 -thread_warp_size=32", "depthwise_conv2d_nchw.cuda", [["TENSOR", [128, 42, 83, 83], "float32"], ["TENSOR", [42, 1, 7, 7], "float32"], 1, "SAME", 1, "float32"], {}], "config": {"index": 3597, "code_hash": null, "entity": [["tile_f", "sp", [-1, 2, 3, 1]], ["tile_y", "sp", [-1, 1, 1, 1]], ["tile_x", "sp", [-1, 1, 83, 1]], ["auto_unroll_max_step", "ot", 0], ["unroll_explicit", "ot", 1]]}, "result": [[0.0026137161025641025], 0, 2.400336742401123, 1637741048.9480717], "version": 0.2, "tvm_version": "0.8.dev0"}
{"input": ["cuda -keys=cuda,gpu -max_num_threads=1024 -thread_warp_size=32", "depthwise_conv2d_nchw.cuda", [["TENSOR", [128, 42, 83, 83], "float32"], ["TENSOR", [42, 1, 7, 7], "float32"], 1, "SAME", 1, "float32"], {}], "config": {"index": 2067, "code_hash": null, "entity": [["tile_f", "sp", [-1, 2, 7, 1]], ["tile_y", "sp", [-1, 1, 1, 1]], ["tile_x", "sp", [-1, 1, 1, 1]], ["auto_unroll_max_step", "ot", 1500], ["unroll_explicit", "ot", 0]]}, "result": [[0.046786373], 0, 2.7150321006774902, 1637741050.9407396], "version": 0.2, "tvm_version": "0.8.dev0"}
{"input": ["cuda -keys=cuda,gpu -max_num_threads=1024 -thread_warp_size=32", "depthwise_conv2d_nchw.cuda", [["TENSOR", [128, 42, 83, 83], "float32"], ["TENSOR", [42, 1, 7, 7], "float32"], 1, "SAME", 1, "float32"], {}], "config": {"index": 5139, "code_hash": null, "entity": [["tile_f", "sp", [-1, 2, 7, 1]], ["tile_y", "sp", [-1, 1, 1, 1]], ["tile_x", "sp", [-1, 1, 1, 1]], ["auto_unroll_max_step", "ot", 1500], ["unroll_explicit", "ot", 1]]}, "result": [[0.046101095], 0, 2.785029411315918, 1637741052.8184428], "version": 0.2, "tvm_version": "0.8.dev0"}
{"input": ["cuda -keys=cuda,gpu -max_num_threads=1024 -thread_warp_size=32", "depthwise_conv2d_nchw.cuda", [["TENSOR", [128, 42, 83, 83], "float32"], ["TENSOR", [42, 1, 7, 7], "float32"], 1, "SAME", 1, "float32"], {}], "config": {"index": 5640, "code_hash": null, "entity": [["tile_f", "sp", [-1, 1, 2, 1]], ["tile_y", "sp", [-1, 1, 1, 1]], ["tile_x", "sp", [-1, 1, 83, 1]], ["auto_unroll_max_step", "ot", 1500], ["unroll_explicit", "ot", 1]]}, "result": [[0.002278399590909091], 0, 2.64585018157959, 1637741054.7954297], "version": 0.2, "tvm_version": "0.8.dev0"}
{"input": ["cuda -keys=cuda,gpu -max_num_threads=1024 -thread_warp_size=32", "depthwise_conv2d_nchw.cuda", [["TENSOR", [128, 42, 83, 83], "float32"], ["TENSOR", [42, 1, 7, 7], "float32"], 1, "SAME", 1, "float32"], {}], "config": {"index": 2568, "code_hash": null, "entity": [["tile_f", "sp", [-1, 1, 2, 1]], ["tile_y", "sp", [-1, 1, 1, 1]], ["tile_x", "sp", [-1, 1, 83, 1]], ["auto_unroll_max_step", "ot", 1500], ["unroll_explicit", "ot", 0]]}, "result": [[0.0024385156515151518], 0, 2.284592628479004, 1637741056.6571395], "version": 0.2, "tvm_version": "0.8.dev0"}
{"input": ["cuda -keys=cuda,gpu -max_num_threads=1024 -thread_warp_size=32", "depthwise_conv2d_nchw.cuda", [["TENSOR", [128, 42, 83, 83], "float32"], ["TENSOR", [42, 1, 7, 7], "float32"], 1, "SAME", 1, "float32"], {}], "config": {"index": 5641, "code_hash": null, "entity": [["tile_f", "sp", [-1, 3, 2, 1]], ["tile_y", "sp", [-1, 1, 1, 1]], ["tile_x", "sp", [-1, 1, 83, 1]], ["auto_unroll_max_step", "ot", 1500], ["unroll_explicit", "ot", 1]]}, "result": [[0.00262943362295082], 0, 2.762974739074707, 1637741058.4950917], "version": 0.2, "tvm_version": "0.8.dev0"}
{"input": ["cuda -keys=cuda,gpu -max_num_threads=1024 -thread_warp_size=32", "depthwise_conv2d_nchw.cuda", [["TENSOR", [128, 42, 83, 83], "float32"], ["TENSOR", [42, 1, 7, 7], "float32"], 1, "SAME", 1, "float32"], {}], "config": {"index": 2569, "code_hash": null, "entity": [["tile_f", "sp", [-1, 3, 2, 1]], ["tile_y", "sp", [-1, 1, 1, 1]], ["tile_x", "sp", [-1, 1, 83, 1]], ["auto_unroll_max_step", "ot", 1500], ["unroll_explicit", "ot", 0]]}, "result": [[0.0028471919444444443], 0, 2.5526909828186035, 1637741060.3482864], "version": 0.2, "tvm_version": "0.8.dev0"}
{"input": ["cuda -keys=cuda,gpu -max_num_threads=1024 -thread_warp_size=32", "depthwise_conv2d_nchw.cuda", [["TENSOR", [128, 42, 83, 83], "float32"], ["TENSOR", [42, 1, 7, 7], "float32"], 1, "SAME", 1, "float32"], {}], "config": {"index": 1168, "code_hash": null, "entity": [["tile_f", "sp", [-1, 1, 6, 1]], ["tile_y", "sp", [-1, 1, 83, 1]], ["tile_x", "sp", [-1, 1, 1, 1]], ["auto_unroll_max_step", "ot", 256], ["unroll_explicit", "ot", 0]]}, "result": [[0.0031601048125000004], 0, 2.769404411315918, 1637741062.485345], "version": 0.2, "tvm_version": "0.8.dev0"}
{"input": ["cuda -keys=cuda,gpu -max_num_threads=1024 -thread_warp_size=32", "depthwise_conv2d_nchw.cuda", [["TENSOR", [128, 42, 83, 83], "float32"], ["TENSOR", [42, 1, 7, 7], "float32"], 1, "SAME", 1, "float32"], {}], "config": {"index": 4240, "code_hash": null, "entity": [["tile_f", "sp", [-1, 1, 6, 1]], ["tile_y", "sp", [-1, 1, 83, 1]], ["tile_x", "sp", [-1, 1, 1, 1]], ["auto_unroll_max_step", "ot", 256], ["unroll_explicit", "ot", 1]]}, "result": [[0.0031223664242424247], 0, 2.641903877258301, 1637741064.4055793], "version": 0.2, "tvm_version": "0.8.dev0"}
{"input": ["cuda -keys=cuda,gpu -max_num_threads=1024 -thread_warp_size=32", "depthwise_conv2d_nchw.cuda", [["TENSOR", [128, 42, 83, 83], "float32"], ["TENSOR", [42, 1, 7, 7], "float32"], 1, "SAME", 1, "float32"], {}], "config": {"index": 3216, "code_hash": null, "entity": [["tile_f", "sp", [-1, 1, 6, 1]], ["tile_y", "sp", [-1, 1, 83, 1]], ["tile_x", "sp", [-1, 1, 1, 1]], ["auto_unroll_max_step", "ot", 0], ["unroll_explicit", "ot", 1]]}, "result": [[0.0031576392499999997], 0, 2.77963924407959, 1637741066.4978137], "version": 0.2, "tvm_version": "0.8.dev0"}
{"input": ["cuda -keys=cuda,gpu -max_num_threads=1024 -thread_warp_size=32", "depthwise_conv2d_nchw.cuda", [["TENSOR", [128, 42, 83, 83], "float32"], ["TENSOR", [42, 1, 7, 7], "float32"], 1, "SAME", 1, "float32"], {}], "config": {"index": 144, "code_hash": null, "entity": [["tile_f", "sp", [-1, 1, 6, 1]], ["tile_y", "sp", [-1, 1, 83, 1]], ["tile_x", "sp", [-1, 1, 1, 1]], ["auto_unroll_max_step", "ot", 0], ["unroll_explicit", "ot", 0]]}, "result": [[0.0034274056250000002], 0, 2.3686728477478027, 1637741068.4005275], "version": 0.2, "tvm_version": "0.8.dev0"}
{"input": ["cuda -keys=cuda,gpu -max_num_threads=1024 -thread_warp_size=32", "depthwise_conv2d_nchw.cuda", [["TENSOR", [128, 42, 83, 83], "float32"], ["TENSOR", [42, 1, 7, 7], "float32"], 1, "SAME", 1, "float32"], {}], "config": {"index": 5910, "code_hash": null, "entity": [["tile_f", "sp", [-1, 1, 14, 1]], ["tile_y", "sp", [-1, 1, 1, 1]], ["tile_x", "sp", [-1, 1, 1, 83]], ["auto_unroll_max_step", "ot", 1500], ["unroll_explicit", "ot", 1]]}, "result": [[0.039379211], 0, 11.144940376281738, 1637741074.297285], "version": 0.2, "tvm_version": "0.8.dev0"}
{"input": ["cuda -keys=cuda,gpu -max_num_threads=1024 -thread_warp_size=32", "depthwise_conv2d_nchw.cuda", [["TENSOR", [128, 42, 83, 83], "float32"], ["TENSOR", [42, 1, 7, 7], "float32"], 1, "SAME", 1, "float32"], {}], "config": {"index": 2838, "code_hash": null, "entity": [["tile_f", "sp", [-1, 1, 14, 1]], ["tile_y", "sp", [-1, 1, 1, 1]], ["tile_x", "sp", [-1, 1, 1, 83]], ["auto_unroll_max_step", "ot", 1500], ["unroll_explicit", "ot", 0]]}, "result": [[0.0616959945], 0, 5.825650453567505, 1637741078.001397], "version": 0.2, "tvm_version": "0.8.dev0"}
{"input": ["cuda -keys=cuda,gpu -max_num_threads=1024 -thread_warp_size=32", "depthwise_conv2d_nchw.cuda", [["TENSOR", [128, 42, 83, 83], "float32"], ["TENSOR", [42, 1, 7, 7], "float32"], 1, "SAME", 1, "float32"], {}], "config": {"index": 2184, "code_hash": null, "entity": [["tile_f", "sp", [-1, 1, 2, 1]], ["tile_y", "sp", [-1, 1, 83, 1]], ["tile_x", "sp", [-1, 1, 1, 1]], ["auto_unroll_max_step", "ot", 1500], ["unroll_explicit", "ot", 0]]}, "result": [[0.002778005277777778], 0, 2.3229615688323975, 1637741079.817724], "version": 0.2, "tvm_version": "0.8.dev0"}
{"input": ["cuda -keys=cuda,gpu -max_num_threads=1024 -thread_warp_size=32", "depthwise_conv2d_nchw.cuda", [["TENSOR", [128, 42, 83, 83], "float32"], ["TENSOR", [42, 1, 7, 7], "float32"], 1, "SAME", 1, "float32"], {}], "config": {"index": 5256, "code_hash": null, "entity": [["tile_f", "sp", [-1, 1, 2, 1]], ["tile_y", "sp", [-1, 1, 83, 1]], ["tile_x", "sp", [-1, 1, 1, 1]], ["auto_unroll_max_step", "ot", 1500], ["unroll_explicit", "ot", 1]]}, "result": [[0.0027252395405405402], 0, 2.429842472076416, 1637741081.5328968], "version": 0.2, "tvm_version": "0.8.dev0"}
{"input": ["cuda -keys=cuda,gpu -max_num_threads=1024 -thread_warp_size=32", "depthwise_conv2d_nchw.cuda", [["TENSOR", [128, 42, 83, 83], "float32"], ["TENSOR", [42, 1, 7, 7], "float32"], 1, "SAME", 1, "float32"], {}], "config": {"index": 3094, "code_hash": null, "entity": [["tile_f", "sp", [-1, 1, 14, 1]], ["tile_y", "sp", [-1, 1, 1, 1]], ["tile_x", "sp", [-1, 1, 1, 1]], ["auto_unroll_max_step", "ot", 0], ["unroll_explicit", "ot", 1]]}, "result": [[0.01323007525], 0, 2.465715169906616, 1637741083.4520168], "version": 0.2, "tvm_version": "0.8.dev0"}
{"input": ["cuda -keys=cuda,gpu -max_num_threads=1024 -thread_warp_size=32", "depthwise_conv2d_nchw.cuda", [["TENSOR", [128, 42, 83, 83], "float32"], ["TENSOR", [42, 1, 7, 7], "float32"], 1, "SAME", 1, "float32"], {}], "config": {"index": 4118, "code_hash": null, "entity": [["tile_f", "sp", [-1, 1, 14, 1]], ["tile_y", "sp", [-1, 1, 1, 1]], ["tile_x", "sp", [-1, 1, 1, 1]], ["auto_unroll_max_step", "ot", 256], ["unroll_explicit", "ot", 1]]}, "result": [[0.02822774375], 0, 2.608910083770752, 1637741085.227992], "version": 0.2, "tvm_version": "0.8.dev0"}
{"input": ["cuda -keys=cuda,gpu -max_num_threads=1024 -thread_warp_size=32", "depthwise_conv2d_nchw.cuda", [["TENSOR", [128, 42, 83, 83], "float32"], ["TENSOR", [42, 1, 7, 7], "float32"], 1, "SAME", 1, "float32"], {}], "config": {"index": 22, "code_hash": null, "entity": [["tile_f", "sp", [-1, 1, 14, 1]], ["tile_y", "sp", [-1, 1, 1, 1]], ["tile_x", "sp", [-1, 1, 1, 1]], ["auto_unroll_max_step", "ot", 0], ["unroll_explicit", "ot", 0]]}, "result": [[0.013227688000000001], 0, 2.5233049392700195, 1637741087.0577712], "version": 0.2, "tvm_version": "0.8.dev0"}
{"input": ["cuda -keys=cuda,gpu -max_num_threads=1024 -thread_warp_size=32", "depthwise_conv2d_nchw.cuda", [["TENSOR", [128, 42, 83, 83], "float32"], ["TENSOR", [42, 1, 7, 7], "float32"], 1, "SAME", 1, "float32"], {}], "config": {"index": 1046, "code_hash": null, "entity": [["tile_f", "sp", [-1, 1, 14, 1]], ["tile_y", "sp", [-1, 1, 1, 1]], ["tile_x", "sp", [-1, 1, 1, 1]], ["auto_unroll_max_step", "ot", 256], ["unroll_explicit", "ot", 0]]}, "result": [[0.026509823999999998], 0, 2.669741630554199, 1637741088.9908738], "version": 0.2, "tvm_version": "0.8.dev0"}
{"input": ["cuda -keys=cuda,gpu -max_num_threads=1024 -thread_warp_size=32", "depthwise_conv2d_nchw.cuda", [["TENSOR", [128, 42, 83, 83], "float32"], ["TENSOR", [42, 1, 7, 7], "float32"], 1, "SAME", 1, "float32"], {}], "config": {"index": 2092, "code_hash": null, "entity": [["tile_f", "sp", [-1, 1, 14, 3]], ["tile_y", "sp", [-1, 1, 1, 1]], ["tile_x", "sp", [-1, 1, 1, 1]], ["auto_unroll_max_step", "ot", 1500], ["unroll_explicit", "ot", 0]]}, "result": [[0.0774342965], 0, 3.2274270057678223, 1637741091.3536875], "version": 0.2, "tvm_version": "0.8.dev0"}
{"input": ["cuda -keys=cuda,gpu -max_num_threads=1024 -thread_warp_size=32", "depthwise_conv2d_nchw.cuda", [["TENSOR", [128, 42, 83, 83], "float32"], ["TENSOR", [42, 1, 7, 7], "float32"], 1, "SAME", 1, "float32"], {}], "config": {"index": 5164, "code_hash": null, "entity": [["tile_f", "sp", [-1, 1, 14, 3]], ["tile_y", "sp", [-1, 1, 1, 1]], ["tile_x", "sp", [-1, 1, 1, 1]], ["auto_unroll_max_step", "ot", 1500], ["unroll_explicit", "ot", 1]]}, "result": [[0.08347063525], 0, 3.7098352909088135, 1637741093.7270784], "version": 0.2, "tvm_version": "0.8.dev0"}
{"input": ["cuda -keys=cuda,gpu -max_num_threads=1024 -thread_warp_size=32", "depthwise_conv2d_nchw.cuda", [["TENSOR", [128, 42, 83, 83], "float32"], ["TENSOR", [42, 1, 7, 7], "float32"], 1, "SAME", 1, "float32"], {}], "config": {"index": 2185, "code_hash": null, "entity": [["tile_f", "sp", [-1, 3, 2, 1]], ["tile_y", "sp", [-1, 1, 83, 1]], ["tile_x", "sp", [-1, 1, 1, 1]], ["auto_unroll_max_step", "ot", 1500], ["unroll_explicit", "ot", 0]]}, "result": [[0.003430593066666667], 0, 2.625596284866333, 1637741095.5696971], "version": 0.2, "tvm_version": "0.8.dev0"}
{"input": ["cuda -keys=cuda,gpu -max_num_threads=1024 -thread_warp_size=32", "depthwise_conv2d_nchw.cuda", [["TENSOR", [128, 42, 83, 83], "float32"], ["TENSOR", [42, 1, 7, 7], "float32"], 1, "SAME", 1, "float32"], {}], "config": {"index": 5257, "code_hash": null, "entity": [["tile_f", "sp", [-1, 3, 2, 1]], ["tile_y", "sp", [-1, 1, 83, 1]], ["tile_x", "sp", [-1, 1, 1, 1]], ["auto_unroll_max_step", "ot", 1500], ["unroll_explicit", "ot", 1]]}, "result": [[0.00320164096875], 0, 2.9525296688079834, 1637741097.7218182], "version": 0.2, "tvm_version": "0.8.dev0"}
{"input": ["cuda -keys=cuda,gpu -max_num_threads=1024 -thread_warp_size=32", "depthwise_conv2d_nchw.cuda", [["TENSOR", [128, 42, 83, 83], "float32"], ["TENSOR", [42, 1, 7, 7], "float32"], 1, "SAME", 1, "float32"], {}], "config": {"index": 2066, "code_hash": null, "entity": [["tile_f", "sp", [-1, 1, 7, 1]], ["tile_y", "sp", [-1, 1, 1, 1]], ["tile_x", "sp", [-1, 1, 1, 1]], ["auto_unroll_max_step", "ot", 1500], ["unroll_explicit", "ot", 0]]}, "result": [[0.03127004625], 0, 2.307708501815796, 1637741108.451241], "version": 0.2, "tvm_version": "0.8.dev0"}
{"input": ["cuda -keys=cuda,gpu -max_num_threads=1024 -thread_warp_size=32", "depthwise_conv2d_nchw.cuda", [["TENSOR", [128, 42, 83, 83], "float32"], ["TENSOR", [42, 1, 7, 7], "float32"], 1, "SAME", 1, "float32"], {}], "config": {"index": 5138, "code_hash": null, "entity": [["tile_f", "sp", [-1, 1, 7, 1]], ["tile_y", "sp", [-1, 1, 1, 1]], ["tile_x", "sp", [-1, 1, 1, 1]], ["auto_unroll_max_step", "ot", 1500], ["unroll_explicit", "ot", 1]]}, "result": [[0.0286206695], 0, 3.0680582523345947, 1637741111.024864], "version": 0.2, "tvm_version": "0.8.dev0"}
{"input": ["cuda -keys=cuda,gpu -max_num_threads=1024 -thread_warp_size=32", "depthwise_conv2d_nchw.cuda", [["TENSOR", [128, 42, 83, 83], "float32"], ["TENSOR", [42, 1, 7, 7], "float32"], 1, "SAME", 1, "float32"], {}], "config": {"index": 2071, "code_hash": null, "entity": [["tile_f", "sp", [-1, 3, 14, 1]], ["tile_y", "sp", [-1, 1, 1, 1]], ["tile_x", "sp", [-1, 1, 1, 1]], ["auto_unroll_max_step", "ot", 1500], ["unroll_explicit", "ot", 0]]}, "result": [[0.07744074575000001], 0, 3.20600962638855, 1637741113.60036], "version": 0.2, "tvm_version": "0.8.dev0"}
{"input": ["cuda -keys=cuda,gpu -max_num_threads=1024 -thread_warp_size=32", "depthwise_conv2d_nchw.cuda", [["TENSOR", [128, 42, 83, 83], "float32"], ["TENSOR", [42, 1, 7, 7], "float32"], 1, "SAME", 1, "float32"], {}], "config": {"index": 5143, "code_hash": null, "entity": [["tile_f", "sp", [-1, 3, 14, 1]], ["tile_y", "sp", [-1, 1, 1, 1]], ["tile_x", "sp", [-1, 1, 1, 1]], ["auto_unroll_max_step", "ot", 1500], ["unroll_explicit", "ot", 1]]}, "result": [[0.08345772574999999], 0, 3.825066089630127, 1637741116.2709115], "version": 0.2, "tvm_version": "0.8.dev0"}
{"input": ["cuda -keys=cuda,gpu -max_num_threads=1024 -thread_warp_size=32", "depthwise_conv2d_nchw.cuda", [["TENSOR", [128, 42, 83, 83], "float32"], ["TENSOR", [42, 1, 7, 7], "float32"], 1, "SAME", 1, "float32"], {}], "config": {"index": 24, "code_hash": null, "entity": [["tile_f", "sp", [-1, 1, 21, 1]], ["tile_y", "sp", [-1, 1, 1, 1]], ["tile_x", "sp", [-1, 1, 1, 1]], ["auto_unroll_max_step", "ot", 0], ["unroll_explicit", "ot", 0]]}, "result": [[0.013163627875], 0, 2.5597336292266846, 1637741118.4857912], "version": 0.2, "tvm_version": "0.8.dev0"}
{"input": ["cuda -keys=cuda,gpu -max_num_threads=1024 -thread_warp_size=32", "depthwise_conv2d_nchw.cuda", [["TENSOR", [128, 42, 83, 83], "float32"], ["TENSOR", [42, 1, 7, 7], "float32"], 1, "SAME", 1, "float32"], {}], "config": {"index": 25, "code_hash": null, "entity": [["tile_f", "sp", [-1, 2, 21, 1]], ["tile_y", "sp", [-1, 1, 1, 1]], ["tile_x", "sp", [-1, 1, 1, 1]], ["auto_unroll_max_step", "ot", 0], ["unroll_explicit", "ot", 0]]}, "result": [[0.01874661], 0, 2.310847520828247, 1637741120.3574533], "version": 0.2, "tvm_version": "0.8.dev0"}
{"input": ["cuda -keys=cuda,gpu -max_num_threads=1024 -thread_warp_size=32", "depthwise_conv2d_nchw.cuda", [["TENSOR", [128, 42, 83, 83], "float32"], ["TENSOR", [42, 1, 7, 7], "float32"], 1, "SAME", 1, "float32"], {}], "config": {"index": 3097, "code_hash": null, "entity": [["tile_f", "sp", [-1, 2, 21, 1]], ["tile_y", "sp", [-1, 1, 1, 1]], ["tile_x", "sp", [-1, 1, 1, 1]], ["auto_unroll_max_step", "ot", 0], ["unroll_explicit", "ot", 1]]}, "result": [[0.0187421605], 0, 2.159924268722534, 1637741122.1511745], "version": 0.2, "tvm_version": "0.8.dev0"}
{"input": ["cuda -keys=cuda,gpu -max_num_threads=1024 -thread_warp_size=32", "depthwise_conv2d_nchw.cuda", [["TENSOR", [128, 42, 83, 83], "float32"], ["TENSOR", [42, 1, 7, 7], "float32"], 1, "SAME", 1, "float32"], {}], "config": {"index": 26, "code_hash": null, "entity": [["tile_f", "sp", [-1, 1, 42, 1]], ["tile_y", "sp", [-1, 1, 1, 1]], ["tile_x", "sp", [-1, 1, 1, 1]], ["auto_unroll_max_step", "ot", 0], ["unroll_explicit", "ot", 0]]}, "result": [[0.014620705285714285], 0, 2.299283027648926, 1637741124.1639469], "version": 0.2, "tvm_version": "0.8.dev0"}
{"input": ["cuda -keys=cuda,gpu -max_num_threads=1024 -thread_warp_size=32", "depthwise_conv2d_nchw.cuda", [["TENSOR", [128, 42, 83, 83], "float32"], ["TENSOR", [42, 1, 7, 7], "float32"], 1, "SAME", 1, "float32"], {}], "config": {"index": 3096, "code_hash": null, "entity": [["tile_f", "sp", [-1, 1, 21, 1]], ["tile_y", "sp", [-1, 1, 1, 1]], ["tile_x", "sp", [-1, 1, 1, 1]], ["auto_unroll_max_step", "ot", 0], ["unroll_explicit", "ot", 1]]}, "result": [[0.013161591124999998], 0, 2.2101523876190186, 1637741125.961586], "version": 0.2, "tvm_version": "0.8.dev0"}
{"input": ["cuda -keys=cuda,gpu -max_num_threads=1024 -thread_warp_size=32", "depthwise_conv2d_nchw.cuda", [["TENSOR", [128, 42, 83, 83], "float32"], ["TENSOR", [42, 1, 7, 7], "float32"], 1, "SAME", 1, "float32"], {}], "config": {"index": 4121, "code_hash": null, "entity": [["tile_f", "sp", [-1, 2, 21, 1]], ["tile_y", "sp", [-1, 1, 1, 1]], ["tile_x", "sp", [-1, 1, 1, 1]], ["auto_unroll_max_step", "ot", 256], ["unroll_explicit", "ot", 1]]}, "result": [[0.0595270625], 0, 2.91015625, 1637741128.071674], "version": 0.2, "tvm_version": "0.8.dev0"}
{"input": ["cuda -keys=cuda,gpu -max_num_threads=1024 -thread_warp_size=32", "depthwise_conv2d_nchw.cuda", [["TENSOR", [128, 42, 83, 83], "float32"], ["TENSOR", [42, 1, 7, 7], "float32"], 1, "SAME", 1, "float32"], {}], "config": {"index": 4120, "code_hash": null, "entity": [["tile_f", "sp", [-1, 1, 21, 1]], ["tile_y", "sp", [-1, 1, 1, 1]], ["tile_x", "sp", [-1, 1, 1, 1]], ["auto_unroll_max_step", "ot", 256], ["unroll_explicit", "ot", 1]]}, "result": [[0.029636086250000002], 0, 2.26876163482666, 1637741129.8217947], "version": 0.2, "tvm_version": "0.8.dev0"}
{"input": ["cuda -keys=cuda,gpu -max_num_threads=1024 -thread_warp_size=32", "depthwise_conv2d_nchw.cuda", [["TENSOR", [128, 42, 83, 83], "float32"], ["TENSOR", [42, 1, 7, 7], "float32"], 1, "SAME", 1, "float32"], {}], "config": {"index": 1048, "code_hash": null, "entity": [["tile_f", "sp", [-1, 1, 21, 1]], ["tile_y", "sp", [-1, 1, 1, 1]], ["tile_x", "sp", [-1, 1, 1, 1]], ["auto_unroll_max_step", "ot", 256], ["unroll_explicit", "ot", 0]]}, "result": [[0.0276854335], 0, 2.336265802383423, 1637741131.732975], "version": 0.2, "tvm_version": "0.8.dev0"}
{"input": ["cuda -keys=cuda,gpu -max_num_threads=1024 -thread_warp_size=32", "depthwise_conv2d_nchw.cuda", [["TENSOR", [128, 42, 83, 83], "float32"], ["TENSOR", [42, 1, 7, 7], "float32"], 1, "SAME", 1, "float32"], {}], "config": {"index": 4122, "code_hash": null, "entity": [["tile_f", "sp", [-1, 1, 42, 1]], ["tile_y", "sp", [-1, 1, 1, 1]], ["tile_x", "sp", [-1, 1, 1, 1]], ["auto_unroll_max_step", "ot", 256], ["unroll_explicit", "ot", 1]]}, "result": [[0.033397449], 0, 2.3841302394866943, 1637741133.5794544], "version": 0.2, "tvm_version": "0.8.dev0"}
{"input": ["cuda -keys=cuda,gpu -max_num_threads=1024 -thread_warp_size=32", "depthwise_conv2d_nchw.cuda", [["TENSOR", [128, 42, 83, 83], "float32"], ["TENSOR", [42, 1, 7, 7], "float32"], 1, "SAME", 1, "float32"], {}], "config": {"index": 3076, "code_hash": null, "entity": [["tile_f", "sp", [-1, 7, 1, 1]], ["tile_y", "sp", [-1, 1, 1, 1]], ["tile_x", "sp", [-1, 1, 1, 1]], ["auto_unroll_max_step", "ot", 0], ["unroll_explicit", "ot", 1]]}, "result": [[1.3821344312500001], 0, 9.44788146018982, 1637741142.2205803], "version": 0.2, "tvm_version": "0.8.dev0"}
{"input": ["cuda -keys=cuda,gpu -max_num_threads=1024 -thread_warp_size=32", "depthwise_conv2d_nchw.cuda", [["TENSOR", [128, 42, 83, 83], "float32"], ["TENSOR", [42, 1, 7, 7], "float32"], 1, "SAME", 1, "float32"], {}], "config": {"index": 2323, "code_hash": null, "entity": [["tile_f", "sp", [-1, 2, 7, 1]], ["tile_y", "sp", [-1, 1, 1, 1]], ["tile_x", "sp", [-1, 83, 1, 1]], ["auto_unroll_max_step", "ot", 1500], ["unroll_explicit", "ot", 0]]}, "result": [[0.26908833099999996], 0, 16.9847571849823, 1637741150.5831788], "version": 0.2, "tvm_version": "0.8.dev0"}
{"input": ["cuda -keys=cuda,gpu -max_num_threads=1024 -thread_warp_size=32", "depthwise_conv2d_nchw.cuda", [["TENSOR", [128, 42, 83, 83], "float32"], ["TENSOR", [42, 1, 7, 7], "float32"], 1, "SAME", 1, "float32"], {}], "config": {"index": 4337, "code_hash": null, "entity": [["tile_f", "sp", [-1, 2, 1, 7]], ["tile_y", "sp", [-1, 1, 1, 83]], ["tile_x", "sp", [-1, 1, 1, 1]], ["auto_unroll_max_step", "ot", 256], ["unroll_explicit", "ot", 1]]}, "result": [[0.4084672615], 0, 10.971345663070679, 1637741160.7491717], "version": 0.2, "tvm_version": "0.8.dev0"}
{"input": ["cuda -keys=cuda,gpu -max_num_threads=1024 -thread_warp_size=32", "depthwise_conv2d_nchw.cuda", [["TENSOR", [128, 42, 83, 83], "float32"], ["TENSOR", [42, 1, 7, 7], "float32"], 1, "SAME", 1, "float32"], {}], "config": {"index": 1100, "code_hash": null, "entity": [["tile_f", "sp", [-1, 1, 3, 1]], ["tile_y", "sp", [-1, 83, 1, 1]], ["tile_x", "sp", [-1, 1, 1, 1]], ["auto_unroll_max_step", "ot", 256], ["unroll_explicit", "ot", 0]]}, "result": [[0.27276009775], 0, 3.7448713779449463, 1637741163.9746888], "version": 0.2, "tvm_version": "0.8.dev0"}
{"input": ["cuda -keys=cuda,gpu -max_num_threads=1024 -thread_warp_size=32", "depthwise_conv2d_nchw.cuda", [["TENSOR", [128, 42, 83, 83], "float32"], ["TENSOR", [42, 1, 7, 7], "float32"], 1, "SAME", 1, "float32"], {}], "config": {"index": 5632, "code_hash": null, "entity": [["tile_f", "sp", [-1, 1, 1, 1]], ["tile_y", "sp", [-1, 1, 1, 1]], ["tile_x", "sp", [-1, 1, 83, 1]], ["auto_unroll_max_step", "ot", 1500], ["unroll_explicit", "ot", 1]]}, "result": [[0.0016829776818181818], 0, 2.4996707439422607, 1637741202.9511752], "version": 0.2, "tvm_version": "0.8.dev0"}
{"input": ["cuda -keys=cuda,gpu -max_num_threads=1024 -thread_warp_size=32", "depthwise_conv2d_nchw.cuda", [["TENSOR", [128, 42, 83, 83], "float32"], ["TENSOR", [42, 1, 7, 7], "float32"], 1, "SAME", 1, "float32"], {}], "config": {"index": 5644, "code_hash": null, "entity": [["tile_f", "sp", [-1, 1, 3, 1]], ["tile_y", "sp", [-1, 1, 1, 1]], ["tile_x", "sp", [-1, 1, 83, 1]], ["auto_unroll_max_step", "ot", 1500], ["unroll_explicit", "ot", 1]]}, "result": [[0.0022383456222222226], 0, 2.016613721847534, 1637741204.586594], "version": 0.2, "tvm_version": "0.8.dev0"}
{"input": ["cuda -keys=cuda,gpu -max_num_threads=1024 -thread_warp_size=32", "depthwise_conv2d_nchw.cuda", [["TENSOR", [128, 42, 83, 83], "float32"], ["TENSOR", [42, 1, 7, 7], "float32"], 1, "SAME", 1, "float32"], {}], "config": {"index": 4616, "code_hash": null, "entity": [["tile_f", "sp", [-1, 1, 2, 1]], ["tile_y", "sp", [-1, 1, 1, 1]], ["tile_x", "sp", [-1, 1, 83, 1]], ["auto_unroll_max_step", "ot", 256], ["unroll_explicit", "ot", 1]]}, "result": [[0.0022783675454545456], 0, 2.141829490661621, 1637741206.3409994], "version": 0.2, "tvm_version": "0.8.dev0"}
{"input": ["cuda -keys=cuda,gpu -max_num_threads=1024 -thread_warp_size=32", "depthwise_conv2d_nchw.cuda", [["TENSOR", [128, 42, 83, 83], "float32"], ["TENSOR", [42, 1, 7, 7], "float32"], 1, "SAME", 1, "float32"], {}], "config": {"index": 4620, "code_hash": null, "entity": [["tile_f", "sp", [-1, 1, 3, 1]], ["tile_y", "sp", [-1, 1, 1, 1]], ["tile_x", "sp", [-1, 1, 83, 1]], ["auto_unroll_max_step", "ot", 256], ["unroll_explicit", "ot", 1]]}, "result": [[0.0022385234444444444], 0, 2.0861706733703613, 1637741208.0755773], "version": 0.2, "tvm_version": "0.8.dev0"}
{"input": ["cuda -keys=cuda,gpu -max_num_threads=1024 -thread_warp_size=32", "depthwise_conv2d_nchw.cuda", [["TENSOR", [128, 42, 83, 83], "float32"], ["TENSOR", [42, 1, 7, 7], "float32"], 1, "SAME", 1, "float32"], {}], "config": {"index": 3592, "code_hash": null, "entity": [["tile_f", "sp", [-1, 1, 2, 1]], ["tile_y", "sp", [-1, 1, 1, 1]], ["tile_x", "sp", [-1, 1, 83, 1]], ["auto_unroll_max_step", "ot", 0], ["unroll_explicit", "ot", 1]]}, "result": [[0.002438784515151515], 0, 2.1394996643066406, 1637741209.8128984], "version": 0.2, "tvm_version": "0.8.dev0"}
{"input": ["cuda -keys=cuda,gpu -max_num_threads=1024 -thread_warp_size=32", "depthwise_conv2d_nchw.cuda", [["TENSOR", [128, 42, 83, 83], "float32"], ["TENSOR", [42, 1, 7, 7], "float32"], 1, "SAME", 1, "float32"], {}], "config": {"index": 5659, "code_hash": null, "entity": [["tile_f", "sp", [-1, 1, 1, 2]], ["tile_y", "sp", [-1, 1, 1, 1]], ["tile_x", "sp", [-1, 1, 83, 1]], ["auto_unroll_max_step", "ot", 1500], ["unroll_explicit", "ot", 1]]}, "result": [[0.0016811858833333333], 0, 2.108170509338379, 1637741211.5109742], "version": 0.2, "tvm_version": "0.8.dev0"}
{"input": ["cuda -keys=cuda,gpu -max_num_threads=1024 -thread_warp_size=32", "depthwise_conv2d_nchw.cuda", [["TENSOR", [128, 42, 83, 83], "float32"], ["TENSOR", [42, 1, 7, 7], "float32"], 1, "SAME", 1, "float32"], {}], "config": {"index": 4608, "code_hash": null, "entity": [["tile_f", "sp", [-1, 1, 1, 1]], ["tile_y", "sp", [-1, 1, 1, 1]], ["tile_x", "sp", [-1, 1, 83, 1]], ["auto_unroll_max_step", "ot", 256], ["unroll_explicit", "ot", 1]]}, "result": [[0.0016817358666666666], 0, 2.5800299644470215, 1637741213.7385921], "version": 0.2, "tvm_version": "0.8.dev0"}
{"input": ["cuda -keys=cuda,gpu -max_num_threads=1024 -thread_warp_size=32", "depthwise_conv2d_nchw.cuda", [["TENSOR", [128, 42, 83, 83], "float32"], ["TENSOR", [42, 1, 7, 7], "float32"], 1, "SAME", 1, "float32"], {}], "config": {"index": 3584, "code_hash": null, "entity": [["tile_f", "sp", [-1, 1, 1, 1]], ["tile_y", "sp", [-1, 1, 1, 1]], ["tile_x", "sp", [-1, 1, 83, 1]], ["auto_unroll_max_step", "ot", 0], ["unroll_explicit", "ot", 1]]}, "result": [[0.0016764460833333333], 0, 2.0988361835479736, 1637741215.4598122], "version": 0.2, "tvm_version": "0.8.dev0"}
{"input": ["cuda -keys=cuda,gpu -max_num_threads=1024 -thread_warp_size=32", "depthwise_conv2d_nchw.cuda", [["TENSOR", [128, 42, 83, 83], "float32"], ["TENSOR", [42, 1, 7, 7], "float32"], 1, "SAME", 1, "float32"], {}], "config": {"index": 3596, "code_hash": null, "entity": [["tile_f", "sp", [-1, 1, 3, 1]], ["tile_y", "sp", [-1, 1, 1, 1]], ["tile_x", "sp", [-1, 1, 83, 1]], ["auto_unroll_max_step", "ot", 0], ["unroll_explicit", "ot", 1]]}, "result": [[0.002341357279069768], 0, 1.9819064140319824, 1637741217.1793666], "version": 0.2, "tvm_version": "0.8.dev0"}
{"input": ["cuda -keys=cuda,gpu -max_num_threads=1024 -thread_warp_size=32", "depthwise_conv2d_nchw.cuda", [["TENSOR", [128, 42, 83, 83], "float32"], ["TENSOR", [42, 1, 7, 7], "float32"], 1, "SAME", 1, "float32"], {}], "config": {"index": 5663, "code_hash": null, "entity": [["tile_f", "sp", [-1, 1, 3, 2]], ["tile_y", "sp", [-1, 1, 1, 1]], ["tile_x", "sp", [-1, 1, 83, 1]], ["auto_unroll_max_step", "ot", 1500], ["unroll_explicit", "ot", 1]]}, "result": [[0.0021878122826086955], 0, 2.177896499633789, 1637741218.939167], "version": 0.2, "tvm_version": "0.8.dev0"}
{"input": ["cuda -keys=cuda,gpu -max_num_threads=1024 -thread_warp_size=32", "depthwise_conv2d_nchw.cuda", [["TENSOR", [128, 42, 83, 83], "float32"], ["TENSOR", [42, 1, 7, 7], "float32"], 1, "SAME", 1, "float32"], {}], "config": {"index": 5633, "code_hash": null, "entity": [["tile_f", "sp", [-1, 2, 1, 1]], ["tile_y", "sp", [-1, 1, 1, 1]], ["tile_x", "sp", [-1, 1, 83, 1]], ["auto_unroll_max_step", "ot", 1500], ["unroll_explicit", "ot", 1]]}, "result": [[0.0016838742000000002], 0, 2.384345054626465, 1637741220.9326627], "version": 0.2, "tvm_version": "0.8.dev0"}
{"input": ["cuda -keys=cuda,gpu -max_num_threads=1024 -thread_warp_size=32", "depthwise_conv2d_nchw.cuda", [["TENSOR", [128, 42, 83, 83], "float32"], ["TENSOR", [42, 1, 7, 7], "float32"], 1, "SAME", 1, "float32"], {}], "config": {"index": 2560, "code_hash": null, "entity": [["tile_f", "sp", [-1, 1, 1, 1]], ["tile_y", "sp", [-1, 1, 1, 1]], ["tile_x", "sp", [-1, 1, 83, 1]], ["auto_unroll_max_step", "ot", 1500], ["unroll_explicit", "ot", 0]]}, "result": [[0.00167634615], 0, 2.0474448204040527, 1637741222.6092222], "version": 0.2, "tvm_version": "0.8.dev0"}
{"input": ["cuda -keys=cuda,gpu -max_num_threads=1024 -thread_warp_size=32", "depthwise_conv2d_nchw.cuda", [["TENSOR", [128, 42, 83, 83], "float32"], ["TENSOR", [42, 1, 7, 7], "float32"], 1, "SAME", 1, "float32"], {}], "config": {"index": 3611, "code_hash": null, "entity": [["tile_f", "sp", [-1, 1, 1, 2]], ["tile_y", "sp", [-1, 1, 1, 1]], ["tile_x", "sp", [-1, 1, 83, 1]], ["auto_unroll_max_step", "ot", 0], ["unroll_explicit", "ot", 1]]}, "result": [[0.001908517924528302], 0, 2.2012133598327637, 1637741224.4304569], "version": 0.2, "tvm_version": "0.8.dev0"}
{"input": ["cuda -keys=cuda,gpu -max_num_threads=1024 -thread_warp_size=32", "depthwise_conv2d_nchw.cuda", [["TENSOR", [128, 42, 83, 83], "float32"], ["TENSOR", [42, 1, 7, 7], "float32"], 1, "SAME", 1, "float32"], {}], "config": {"index": 1544, "code_hash": null, "entity": [["tile_f", "sp", [-1, 1, 2, 1]], ["tile_y", "sp", [-1, 1, 1, 1]], ["tile_x", "sp", [-1, 1, 83, 1]], ["auto_unroll_max_step", "ot", 256], ["unroll_explicit", "ot", 0]]}, "result": [[0.002438645378787879], 0, 2.1871092319488525, 1637741226.3134227], "version": 0.2, "tvm_version": "0.8.dev0"}
{"input": ["cuda -keys=cuda,gpu -max_num_threads=1024 -thread_warp_size=32", "depthwise_conv2d_nchw.cuda", [["TENSOR", [128, 42, 83, 83], "float32"], ["TENSOR", [42, 1, 7, 7], "float32"], 1, "SAME", 1, "float32"], {}], "config": {"index": 4639, "code_hash": null, "entity": [["tile_f", "sp", [-1, 1, 3, 2]], ["tile_y", "sp", [-1, 1, 1, 1]], ["tile_x", "sp", [-1, 1, 83, 1]], ["auto_unroll_max_step", "ot", 256], ["unroll_explicit", "ot", 1]]}, "result": [[0.0021884384782608697], 0, 2.0440516471862793, 1637741227.927694], "version": 0.2, "tvm_version": "0.8.dev0"}
{"input": ["cuda -keys=cuda,gpu -max_num_threads=1024 -thread_warp_size=32", "depthwise_conv2d_nchw.cuda", [["TENSOR", [128, 42, 83, 83], "float32"], ["TENSOR", [42, 1, 7, 7], "float32"], 1, "SAME", 1, "float32"], {}], "config": {"index": 3615, "code_hash": null, "entity": [["tile_f", "sp", [-1, 1, 3, 2]], ["tile_y", "sp", [-1, 1, 1, 1]], ["tile_x", "sp", [-1, 1, 83, 1]], ["auto_unroll_max_step", "ot", 0], ["unroll_explicit", "ot", 1]]}, "result": [[0.0024149677142857144], 0, 2.1721889972686768, 1637741229.7711046], "version": 0.2, "tvm_version": "0.8.dev0"}
{"input": ["cuda -keys=cuda,gpu -max_num_threads=1024 -thread_warp_size=32", "depthwise_conv2d_nchw.cuda", [["TENSOR", [128, 42, 83, 83], "float32"], ["TENSOR", [42, 1, 7, 7], "float32"], 1, "SAME", 1, "float32"], {}], "config": {"index": 4635, "code_hash": null, "entity": [["tile_f", "sp", [-1, 1, 1, 2]], ["tile_y", "sp", [-1, 1, 1, 1]], ["tile_x", "sp", [-1, 1, 83, 1]], ["auto_unroll_max_step", "ot", 256], ["unroll_explicit", "ot", 1]]}, "result": [[0.0016811544166666667], 0, 2.0835866928100586, 1637741231.4666653], "version": 0.2, "tvm_version": "0.8.dev0"}
{"input": ["cuda -keys=cuda,gpu -max_num_threads=1024 -thread_warp_size=32", "depthwise_conv2d_nchw.cuda", [["TENSOR", [128, 42, 83, 83], "float32"], ["TENSOR", [42, 1, 7, 7], "float32"], 1, "SAME", 1, "float32"], {}], "config": {"index": 1548, "code_hash": null, "entity": [["tile_f", "sp", [-1, 1, 3, 1]], ["tile_y", "sp", [-1, 1, 1, 1]], ["tile_x", "sp", [-1, 1, 83, 1]], ["auto_unroll_max_step", "ot", 256], ["unroll_explicit", "ot", 0]]}, "result": [[0.002341185418604651], 0, 2.141517400741577, 1637741233.2703762], "version": 0.2, "tvm_version": "0.8.dev0"}
{"input": ["cuda -keys=cuda,gpu -max_num_threads=1024 -thread_warp_size=32", "depthwise_conv2d_nchw.cuda", [["TENSOR", [128, 42, 83, 83], "float32"], ["TENSOR", [42, 1, 7, 7], "float32"], 1, "SAME", 1, "float32"], {}], "config": {"index": 1536, "code_hash": null, "entity": [["tile_f", "sp", [-1, 1, 1, 1]], ["tile_y", "sp", [-1, 1, 1, 1]], ["tile_x", "sp", [-1, 1, 83, 1]], ["auto_unroll_max_step", "ot", 256], ["unroll_explicit", "ot", 0]]}, "result": [[0.0016764196333333332], 0, 2.1024250984191895, 1637741235.0799258], "version": 0.2, "tvm_version": "0.8.dev0"}
{"input": ["cuda -keys=cuda,gpu -max_num_threads=1024 -thread_warp_size=32", "depthwise_conv2d_nchw.cuda", [["TENSOR", [128, 42, 83, 83], "float32"], ["TENSOR", [42, 1, 7, 7], "float32"], 1, "SAME", 1, "float32"], {}], "config": {"index": 520, "code_hash": null, "entity": [["tile_f", "sp", [-1, 1, 2, 1]], ["tile_y", "sp", [-1, 1, 1, 1]], ["tile_x", "sp", [-1, 1, 83, 1]], ["auto_unroll_max_step", "ot", 0], ["unroll_explicit", "ot", 0]]}, "result": [[0.002439821257575757], 0, 2.030534029006958, 1637741236.807947], "version": 0.2, "tvm_version": "0.8.dev0"}
{"input": ["cuda -keys=cuda,gpu -max_num_threads=1024 -thread_warp_size=32", "depthwise_conv2d_nchw.cuda", [["TENSOR", [128, 42, 83, 83], "float32"], ["TENSOR", [42, 1, 7, 7], "float32"], 1, "SAME", 1, "float32"], {}], "config": {"index": 2572, "code_hash": null, "entity": [["tile_f", "sp", [-1, 1, 3, 1]], ["tile_y", "sp", [-1, 1, 1, 1]], ["tile_x", "sp", [-1, 1, 83, 1]], ["auto_unroll_max_step", "ot", 1500], ["unroll_explicit", "ot", 0]]}, "result": [[0.0023412017906976747], 0, 1.9978303909301758, 1637741238.4536934], "version": 0.2, "tvm_version": "0.8.dev0"}
{"input": ["cuda -keys=cuda,gpu -max_num_threads=1024 -thread_warp_size=32", "depthwise_conv2d_nchw.cuda", [["TENSOR", [128, 42, 83, 83], "float32"], ["TENSOR", [42, 1, 7, 7], "float32"], 1, "SAME", 1, "float32"], {}], "config": {"index": 512, "code_hash": null, "entity": [["tile_f", "sp", [-1, 1, 1, 1]], ["tile_y", "sp", [-1, 1, 1, 1]], ["tile_x", "sp", [-1, 1, 83, 1]], ["auto_unroll_max_step", "ot", 0], ["unroll_explicit", "ot", 0]]}, "result": [[0.00167643635], 0, 2.299659490585327, 1637741240.450299], "version": 0.2, "tvm_version": "0.8.dev0"}
{"input": ["cuda -keys=cuda,gpu -max_num_threads=1024 -thread_warp_size=32", "depthwise_conv2d_nchw.cuda", [["TENSOR", [128, 42, 83, 83], "float32"], ["TENSOR", [42, 1, 7, 7], "float32"], 1, "SAME", 1, "float32"], {}], "config": {"index": 3585, "code_hash": null, "entity": [["tile_f", "sp", [-1, 2, 1, 1]], ["tile_y", "sp", [-1, 1, 1, 1]], ["tile_x", "sp", [-1, 1, 83, 1]], ["auto_unroll_max_step", "ot", 0], ["unroll_explicit", "ot", 1]]}, "result": [[0.001909292575], 0, 2.1556499004364014, 1637741242.2332556], "version": 0.2, "tvm_version": "0.8.dev0"}
{"input": ["cuda -keys=cuda,gpu -max_num_threads=1024 -thread_warp_size=32", "depthwise_conv2d_nchw.cuda", [["TENSOR", [128, 42, 83, 83], "float32"], ["TENSOR", [42, 1, 7, 7], "float32"], 1, "SAME", 1, "float32"], {}], "config": {"index": 524, "code_hash": null, "entity": [["tile_f", "sp", [-1, 1, 3, 1]], ["tile_y", "sp", [-1, 1, 1, 1]], ["tile_x", "sp", [-1, 1, 83, 1]], ["auto_unroll_max_step", "ot", 0], ["unroll_explicit", "ot", 0]]}, "result": [[0.0023415041627906975], 0, 2.026954174041748, 1637741243.9038153], "version": 0.2, "tvm_version": "0.8.dev0"}
{"input": ["cuda -keys=cuda,gpu -max_num_threads=1024 -thread_warp_size=32", "depthwise_conv2d_nchw.cuda", [["TENSOR", [128, 42, 83, 83], "float32"], ["TENSOR", [42, 1, 7, 7], "float32"], 1, "SAME", 1, "float32"], {}], "config": {"index": 4609, "code_hash": null, "entity": [["tile_f", "sp", [-1, 2, 1, 1]], ["tile_y", "sp", [-1, 1, 1, 1]], ["tile_x", "sp", [-1, 1, 83, 1]], ["auto_unroll_max_step", "ot", 256], ["unroll_explicit", "ot", 1]]}, "result": [[0.0018293888], 0, 2.1436173915863037, 1637741246.7790194], "version": 0.2, "tvm_version": "0.8.dev0"}
{"input": ["cuda -keys=cuda,gpu -max_num_threads=1024 -thread_warp_size=32", "depthwise_conv2d_nchw.cuda", [["TENSOR", [128, 42, 83, 83], "float32"], ["TENSOR", [42, 1, 7, 7], "float32"], 1, "SAME", 1, "float32"], {}], "config": {"index": 5260, "code_hash": null, "entity": [["tile_f", "sp", [-1, 1, 3, 1]], ["tile_y", "sp", [-1, 1, 83, 1]], ["tile_x", "sp", [-1, 1, 1, 1]], ["auto_unroll_max_step", "ot", 1500], ["unroll_explicit", "ot", 1]]}, "result": [[0.0029572237400000002], 0, 2.6143710613250732, 1637741248.724616], "version": 0.2, "tvm_version": "0.8.dev0"}
{"input": ["cuda -keys=cuda,gpu -max_num_threads=1024 -thread_warp_size=32", "depthwise_conv2d_nchw.cuda", [["TENSOR", [128, 42, 83, 83], "float32"], ["TENSOR", [42, 1, 7, 7], "float32"], 1, "SAME", 1, "float32"], {}], "config": {"index": 2587, "code_hash": null, "entity": [["tile_f", "sp", [-1, 1, 1, 2]], ["tile_y", "sp", [-1, 1, 1, 1]], ["tile_x", "sp", [-1, 1, 83, 1]], ["auto_unroll_max_step", "ot", 1500], ["unroll_explicit", "ot", 0]]}, "result": [[0.001913442603773585], 0, 2.4000658988952637, 1637741250.7139757], "version": 0.2, "tvm_version": "0.8.dev0"}
{"input": ["cuda -keys=cuda,gpu -max_num_threads=1024 -thread_warp_size=32", "depthwise_conv2d_nchw.cuda", [["TENSOR", [128, 42, 83, 83], "float32"], ["TENSOR", [42, 1, 7, 7], "float32"], 1, "SAME", 1, "float32"], {}], "config": {"index": 539, "code_hash": null, "entity": [["tile_f", "sp", [-1, 1, 1, 2]], ["tile_y", "sp", [-1, 1, 1, 1]], ["tile_x", "sp", [-1, 1, 83, 1]], ["auto_unroll_max_step", "ot", 0], ["unroll_explicit", "ot", 0]]}, "result": [[0.0019087106981132075], 0, 2.4766969680786133, 1637741252.6362348], "version": 0.2, "tvm_version": "0.8.dev0"}
{"input": ["cuda -keys=cuda,gpu -max_num_threads=1024 -thread_warp_size=32", "depthwise_conv2d_nchw.cuda", [["TENSOR", [128, 42, 83, 83], "float32"], ["TENSOR", [42, 1, 7, 7], "float32"], 1, "SAME", 1, "float32"], {}], "config": {"index": 5668, "code_hash": null, "entity": [["tile_f", "sp", [-1, 1, 1, 3]], ["tile_y", "sp", [-1, 1, 1, 1]], ["tile_x", "sp", [-1, 1, 83, 1]], ["auto_unroll_max_step", "ot", 1500], ["unroll_explicit", "ot", 1]]}, "result": [[0.002201657913043478], 0, 2.541480779647827, 1637741254.3747933], "version": 0.2, "tvm_version": "0.8.dev0"}
{"input": ["cuda -keys=cuda,gpu -max_num_threads=1024 -thread_warp_size=32", "depthwise_conv2d_nchw.cuda", [["TENSOR", [128, 42, 83, 83], "float32"], ["TENSOR", [42, 1, 7, 7], "float32"], 1, "SAME", 1, "float32"], {}], "config": {"index": 2561, "code_hash": null, "entity": [["tile_f", "sp", [-1, 2, 1, 1]], ["tile_y", "sp", [-1, 1, 1, 1]], ["tile_x", "sp", [-1, 1, 83, 1]], ["auto_unroll_max_step", "ot", 1500], ["unroll_explicit", "ot", 0]]}, "result": [[0.001912048358490566], 0, 2.1781961917877197, 1637741256.0947556], "version": 0.2, "tvm_version": "0.8.dev0"}
{"input": ["cuda -keys=cuda,gpu -max_num_threads=1024 -thread_warp_size=32", "depthwise_conv2d_nchw.cuda", [["TENSOR", [128, 42, 83, 83], "float32"], ["TENSOR", [42, 1, 7, 7], "float32"], 1, "SAME", 1, "float32"], {}], "config": {"index": 543, "code_hash": null, "entity": [["tile_f", "sp", [-1, 1, 3, 2]], ["tile_y", "sp", [-1, 1, 1, 1]], ["tile_x", "sp", [-1, 1, 83, 1]], ["auto_unroll_max_step", "ot", 0], ["unroll_explicit", "ot", 0]]}, "result": [[0.0024150919285714284], 0, 2.7317371368408203, 1637741258.1884778], "version": 0.2, "tvm_version": "0.8.dev0"}
{"input": ["cuda -keys=cuda,gpu -max_num_threads=1024 -thread_warp_size=32", "depthwise_conv2d_nchw.cuda", [["TENSOR", [128, 42, 83, 83], "float32"], ["TENSOR", [42, 1, 7, 7], "float32"], 1, "SAME", 1, "float32"], {}], "config": {"index": 3593, "code_hash": null, "entity": [["tile_f", "sp", [-1, 3, 2, 1]], ["tile_y", "sp", [-1, 1, 1, 1]], ["tile_x", "sp", [-1, 1, 83, 1]], ["auto_unroll_max_step", "ot", 0], ["unroll_explicit", "ot", 1]]}, "result": [[0.0029349061714285716], 0, 2.252706289291382, 1637741259.9477148], "version": 0.2, "tvm_version": "0.8.dev0"}
{"input": ["cuda -keys=cuda,gpu -max_num_threads=1024 -thread_warp_size=32", "depthwise_conv2d_nchw.cuda", [["TENSOR", [128, 42, 83, 83], "float32"], ["TENSOR", [42, 1, 7, 7], "float32"], 1, "SAME", 1, "float32"], {}], "config": {"index": 1567, "code_hash": null, "entity": [["tile_f", "sp", [-1, 1, 3, 2]], ["tile_y", "sp", [-1, 1, 1, 1]], ["tile_x", "sp", [-1, 1, 83, 1]], ["auto_unroll_max_step", "ot", 256], ["unroll_explicit", "ot", 0]]}, "result": [[0.002363564093023256], 0, 2.6586475372314453, 1637741261.9009166], "version": 0.2, "tvm_version": "0.8.dev0"}
{"input": ["cuda -keys=cuda,gpu -max_num_threads=1024 -thread_warp_size=32", "depthwise_conv2d_nchw.cuda", [["TENSOR", [128, 42, 83, 83], "float32"], ["TENSOR", [42, 1, 7, 7], "float32"], 1, "SAME", 1, "float32"], {}], "config": {"index": 1563, "code_hash": null, "entity": [["tile_f", "sp", [-1, 1, 1, 2]], ["tile_y", "sp", [-1, 1, 1, 1]], ["tile_x", "sp", [-1, 1, 83, 1]], ["auto_unroll_max_step", "ot", 256], ["unroll_explicit", "ot", 0]]}, "result": [[0.0019131069056603773], 0, 2.277602195739746, 1637741263.5488336], "version": 0.2, "tvm_version": "0.8.dev0"}
{"input": ["cuda -keys=cuda,gpu -max_num_threads=1024 -thread_warp_size=32", "depthwise_conv2d_nchw.cuda", [["TENSOR", [128, 42, 83, 83], "float32"], ["TENSOR", [42, 1, 7, 7], "float32"], 1, "SAME", 1, "float32"], {}], "config": {"index": 513, "code_hash": null, "entity": [["tile_f", "sp", [-1, 2, 1, 1]], ["tile_y", "sp", [-1, 1, 1, 1]], ["tile_x", "sp", [-1, 1, 83, 1]], ["auto_unroll_max_step", "ot", 0], ["unroll_explicit", "ot", 0]]}, "result": [[0.001908767452830189], 0, 2.2262303829193115, 1637741265.1939993], "version": 0.2, "tvm_version": "0.8.dev0"}
