artifacts/microbenchmark/tvm/e2e/autotvm_log/depthwise_128_84_42_42_5_5_1_SAME.log
{"input": ["cuda -keys=cuda,gpu -max_num_threads=1024 -thread_warp_size=32", "depthwise_conv2d_nchw.cuda", [["TENSOR", [128, 84, 42, 42], "float32"], ["TENSOR", [84, 1, 5, 5], "float32"], 1, "SAME", 1, "float32"], {}], "config": {"index": 193462, "code_hash": null, "entity": [["tile_f", "sp", [-1, 4, 3, 1]], ["tile_y", "sp", [-1, 1, 1, 14]], ["tile_x", "sp", [-1, 1, 7, 1]], ["auto_unroll_max_step", "ot", 0], ["unroll_explicit", "ot", 0]]}, "result": [[0.004448609217391305], 0, 2.0745651721954346, 1637745659.0219078], "version": 0.2, "tvm_version": "0.8.dev0"}
{"input": ["cuda -keys=cuda,gpu -max_num_threads=1024 -thread_warp_size=32", "depthwise_conv2d_nchw.cuda", [["TENSOR", [128, 84, 42, 42], "float32"], ["TENSOR", [84, 1, 5, 5], "float32"], 1, "SAME", 1, "float32"], {}], "config": {"index": 1849714, "code_hash": null, "entity": [["tile_f", "sp", [-1, 1, 7, 6]], ["tile_y", "sp", [-1, 1, 2, 3]], ["tile_x", "sp", [-1, 1, 2, 7]], ["auto_unroll_max_step", "ot", 1500], ["unroll_explicit", "ot", 0]]}, "result": [[0.007607442214285715], 0, 3.9757919311523438, 1637745662.4026458], "version": 0.2, "tvm_version": "0.8.dev0"}
{"input": ["cuda -keys=cuda,gpu -max_num_threads=1024 -thread_warp_size=32", "depthwise_conv2d_nchw.cuda", [["TENSOR", [128, 84, 42, 42], "float32"], ["TENSOR", [84, 1, 5, 5], "float32"], 1, "SAME", 1, "float32"], {}], "config": {"index": 2749664, "code_hash": null, "entity": [["tile_f", "sp", [-1, 7, 2, 2]], ["tile_y", "sp", [-1, 1, 7, 2]], ["tile_x", "sp", [-1, 1, 3, 1]], ["auto_unroll_max_step", "ot", 256], ["unroll_explicit", "ot", 1]]}, "result": [[0.010567341099999999], 0, 3.9733505249023438, 1637745667.1804104], "version": 0.2, "tvm_version": "0.8.dev0"}
{"input": ["cuda -keys=cuda,gpu -max_num_threads=1024 -thread_warp_size=32", "depthwise_conv2d_nchw.cuda", [["TENSOR", [128, 84, 42, 42], "float32"], ["TENSOR", [84, 1, 5, 5], "float32"], 1, "SAME", 1, "float32"], {}], "config": {"index": 1282630, "code_hash": null, "entity": [["tile_f", "sp", [-1, 1, 6, 2]], ["tile_y", "sp", [-1, 1, 6, 1]], ["tile_x", "sp", [-1, 2, 1, 21]], ["auto_unroll_max_step", "ot", 256], ["unroll_explicit", "ot", 0]]}, "result": [[0.0035630547333333337], 0, 3.034932851791382, 1637745669.4313383], "version": 0.2, "tvm_version": "0.8.dev0"}
{"input": ["cuda -keys=cuda,gpu -max_num_threads=1024 -thread_warp_size=32", "depthwise_conv2d_nchw.cuda", [["TENSOR", [128, 84, 42, 42], "float32"], ["TENSOR", [84, 1, 5, 5], "float32"], 1, "SAME", 1, "float32"], {}], "config": {"index": 3120940, "code_hash": null, "entity": [["tile_f", "sp", [-1, 3, 1, 14]], ["tile_y", "sp", [-1, 2, 1, 7]], ["tile_x", "sp", [-1, 1, 1, 7]], ["auto_unroll_max_step", "ot", 256], ["unroll_explicit", "ot", 1]]}, "result": [[0.11475857575000001], 0, 3.6246795654296875, 1637745672.6850665], "version": 0.2, "tvm_version": "0.8.dev0"}
{"input": ["cuda -keys=cuda,gpu -max_num_threads=1024 -thread_warp_size=32", "depthwise_conv2d_nchw.cuda", [["TENSOR", [128, 84, 42, 42], "float32"], ["TENSOR", [84, 1, 5, 5], "float32"], 1, "SAME", 1, "float32"], {}], "config": {"index": 446339, "code_hash": null, "entity": [["tile_f", "sp", [-1, 1, 1, 4]], ["tile_y", "sp", [-1, 2, 1, 3]], ["tile_x", "sp", [-1, 2, 7, 3]], ["auto_unroll_max_step", "ot", 0], ["unroll_explicit", "ot", 0]]}, "result": [[0.008238005076923077], 0, 2.301809787750244, 1637745674.4013], "version": 0.2, "tvm_version": "0.8.dev0"}
{"input": ["cuda -keys=cuda,gpu -max_num_threads=1024 -thread_warp_size=32", "depthwise_conv2d_nchw.cuda", [["TENSOR", [128, 84, 42, 42], "float32"], ["TENSOR", [84, 1, 5, 5], "float32"], 1, "SAME", 1, "float32"], {}], "config": {"index": 2811084, "code_hash": null, "entity": [["tile_f", "sp", [-1, 3, 14, 1]], ["tile_y", "sp", [-1, 1, 7, 2]], ["tile_x", "sp", [-1, 1, 7, 1]], ["auto_unroll_max_step", "ot", 256], ["unroll_explicit", "ot", 1]]}, "result": [[0.0006127131578947368], 0, 2.663113594055176, 1637745676.6584275], "version": 0.2, "tvm_version": "0.8.dev0"}
{"input": ["cuda -keys=cuda,gpu -max_num_threads=1024 -thread_warp_size=32", "depthwise_conv2d_nchw.cuda", [["TENSOR", [128, 84, 42, 42], "float32"], ["TENSOR", [84, 1, 5, 5], "float32"], 1, "SAME", 1, "float32"], {}], "config": {"index": 3089957, "code_hash": null, "entity": [["tile_f", "sp", [-1, 4, 7, 1]], ["tile_y", "sp", [-1, 1, 1, 7]], ["tile_x", "sp", [-1, 1, 1, 6]], ["auto_unroll_max_step", "ot", 256], ["unroll_explicit", "ot", 1]]}, "result": [[0.0103864854], 0, 2.2778987884521484, 1637745679.1714754], "version": 0.2, "tvm_version": "0.8.dev0"}
{"input": ["cuda -keys=cuda,gpu -max_num_threads=1024 -thread_warp_size=32", "depthwise_conv2d_nchw.cuda", [["TENSOR", [128, 84, 42, 42], "float32"], ["TENSOR", [84, 1, 5, 5], "float32"], 1, "SAME", 1, "float32"], {}], "config": {"index": 3175442, "code_hash": null, "entity": [["tile_f", "sp", [-1, 2, 1, 3]], ["tile_y", "sp", [-1, 21, 1, 1]], ["tile_x", "sp", [-1, 1, 3, 7]], ["auto_unroll_max_step", "ot", 256], ["unroll_explicit", "ot", 1]]}, "result": [[0.047864041999999996], 0, 4.761695384979248, 1637745682.0109568], "version": 0.2, "tvm_version": "0.8.dev0"}
{"input": ["cuda -keys=cuda,gpu -max_num_threads=1024 -thread_warp_size=32", "depthwise_conv2d_nchw.cuda", [["TENSOR", [128, 84, 42, 42], "float32"], ["TENSOR", [84, 1, 5, 5], "float32"], 1, "SAME", 1, "float32"], {}], "config": {"index": 1241851, "code_hash": null, "entity": [["tile_f", "sp", [-1, 1, 4, 3]], ["tile_y", "sp", [-1, 7, 6, 1]], ["tile_x", "sp", [-1, 1, 1, 14]], ["auto_unroll_max_step", "ot", 256], ["unroll_explicit", "ot", 0]]}, "result": [[0.0051649582999999995], 0, 2.8950419425964355, 1637745688.0318036], "version": 0.2, "tvm_version": "0.8.dev0"}
{"input": ["cuda -keys=cuda,gpu -max_num_threads=1024 -thread_warp_size=32", "depthwise_conv2d_nchw.cuda", [["TENSOR", [128, 84, 42, 42], "float32"], ["TENSOR", [84, 1, 5, 5], "float32"], 1, "SAME", 1, "float32"], {}], "config": {"index": 1484432, "code_hash": null, "entity": [["tile_f", "sp", [-1, 1, 2, 6]], ["tile_y", "sp", [-1, 2, 1, 21]], ["tile_x", "sp", [-1, 1, 6, 1]], ["auto_unroll_max_step", "ot", 1500], ["unroll_explicit", "ot", 0]]}, "result": [[0.00941268690909091], 0, 7.28930926322937, 1637745691.699915], "version": 0.2, "tvm_version": "0.8.dev0"}
{"input": ["cuda -keys=cuda,gpu -max_num_threads=1024 -thread_warp_size=32", "depthwise_conv2d_nchw.cuda", [["TENSOR", [128, 84, 42, 42], "float32"], ["TENSOR", [84, 1, 5, 5], "float32"], 1, "SAME", 1, "float32"], {}], "config": {"index": 2862420, "code_hash": null, "entity": [["tile_f", "sp", [-1, 1, 3, 1]], ["tile_y", "sp", [-1, 3, 7, 2]], ["tile_x", "sp", [-1, 3, 14, 1]], ["auto_unroll_max_step", "ot", 256], ["unroll_explicit", "ot", 1]]}, "result": [[0.004901331666666666], 0, 3.201188087463379, 1637745704.486783], "version": 0.2, "tvm_version": "0.8.dev0"}
{"input": ["cuda -keys=cuda,gpu -max_num_threads=1024 -thread_warp_size=32", "depthwise_conv2d_nchw.cuda", [["TENSOR", [128, 84, 42, 42], "float32"], ["TENSOR", [84, 1, 5, 5], "float32"], 1, "SAME", 1, "float32"], {}], "config": {"index": 1632722, "code_hash": null, "entity": [["tile_f", "sp", [-1, 2, 1, 3]], ["tile_y", "sp", [-1, 3, 1, 2]], ["tile_x", "sp", [-1, 1, 3, 2]], ["auto_unroll_max_step", "ot", 1500], ["unroll_explicit", "ot", 0]]}, "result": [[0.018311727833333333], 0, 4.8954246044158936, 1637745706.9155362], "version": 0.2, "tvm_version": "0.8.dev0"}
{"input": ["cuda -keys=cuda,gpu -max_num_threads=1024 -thread_warp_size=32", "depthwise_conv2d_nchw.cuda", [["TENSOR", [128, 84, 42, 42], "float32"], ["TENSOR", [84, 1, 5, 5], "float32"], 1, "SAME", 1, "float32"], {}], "config": {"index": 792598, "code_hash": null, "entity": [["tile_f", "sp", [-1, 2, 1, 7]], ["tile_y", "sp", [-1, 2, 21, 1]], ["tile_x", "sp", [-1, 2, 3, 1]], ["auto_unroll_max_step", "ot", 256], ["unroll_explicit", "ot", 0]]}, "result": [[0.00857670525], 0, 3.4944233894348145, 1637745709.344154], "version": 0.2, "tvm_version": "0.8.dev0"}
{"input": ["cuda -keys=cuda,gpu -max_num_threads=1024 -thread_warp_size=32", "depthwise_conv2d_nchw.cuda", [["TENSOR", [128, 84, 42, 42], "float32"], ["TENSOR", [84, 1, 5, 5], "float32"], 1, "SAME", 1, "float32"], {}], "config": {"index": 317987, "code_hash": null, "entity": [["tile_f", "sp", [-1, 2, 3, 2]], ["tile_y", "sp", [-1, 6, 1, 1]], ["tile_x", "sp", [-1, 1, 3, 2]], ["auto_unroll_max_step", "ot", 0], ["unroll_explicit", "ot", 0]]}, "result": [[0.020527447166666667], 0, 3.3326096534729004, 1637745711.8991778], "version": 0.2, "tvm_version": "0.8.dev0"}
{"input": ["cuda -keys=cuda,gpu -max_num_threads=1024 -thread_warp_size=32", "depthwise_conv2d_nchw.cuda", [["TENSOR", [128, 84, 42, 42], "float32"], ["TENSOR", [84, 1, 5, 5], "float32"], 1, "SAME", 1, "float32"], {}], "config": {"index": 3391554, "code_hash": null, "entity": [["tile_f", "sp", [-1, 1, 7, 1]], ["tile_y", "sp", [-1, 2, 3, 1]], ["tile_x", "sp", [-1, 21, 2, 1]], ["auto_unroll_max_step", "ot", 1500], ["unroll_explicit", "ot", 1]]}, "result": [[0.000692503922413793], 0, 6.336761951446533, 1637745714.0601466], "version": 0.2, "tvm_version": "0.8.dev0"}
{"input": ["cuda -keys=cuda,gpu -max_num_threads=1024 -thread_warp_size=32", "depthwise_conv2d_nchw.cuda", [["TENSOR", [128, 84, 42, 42], "float32"], ["TENSOR", [84, 1, 5, 5], "float32"], 1, "SAME", 1, "float32"], {}], "config": {"index": 2942563, "code_hash": null, "entity": [["tile_f", "sp", [-1, 4, 1, 1]], ["tile_y", "sp", [-1, 3, 14, 1]], ["tile_x", "sp", [-1, 1, 3, 2]], ["auto_unroll_max_step", "ot", 256], ["unroll_explicit", "ot", 1]]}, "result": [[0.033696237000000004], 0, 2.960782766342163, 1637745716.3893218], "version": 0.2, "tvm_version": "0.8.dev0"}
{"input": ["cuda -keys=cuda,gpu -max_num_threads=1024 -thread_warp_size=32", "depthwise_conv2d_nchw.cuda", [["TENSOR", [128, 84, 42, 42], "float32"], ["TENSOR", [84, 1, 5, 5], "float32"], 1, "SAME", 1, "float32"], {}], "config": {"index": 1065566, "code_hash": null, "entity": [["tile_f", "sp", [-1, 6, 2, 7]], ["tile_y", "sp", [-1, 6, 1, 1]], ["tile_x", "sp", [-1, 1, 2, 3]], ["auto_unroll_max_step", "ot", 256], ["unroll_explicit", "ot", 0]]}, "result": [[0.060164604], 0, 4.390593767166138, 1637745720.976051], "version": 0.2, "tvm_version": "0.8.dev0"}
{"input": ["cuda -keys=cuda,gpu -max_num_threads=1024 -thread_warp_size=32", "depthwise_conv2d_nchw.cuda", [["TENSOR", [128, 84, 42, 42], "float32"], ["TENSOR", [84, 1, 5, 5], "float32"], 1, "SAME", 1, "float32"], {}], "config": {"index": 2667411, "code_hash": null, "entity": [["tile_f", "sp", [-1, 1, 42, 1]], ["tile_y", "sp", [-1, 1, 3, 2]], ["tile_x", "sp", [-1, 7, 1, 1]], ["auto_unroll_max_step", "ot", 256], ["unroll_explicit", "ot", 1]]}, "result": [[0.004475067565217391], 0, 3.9314522743225098, 1637745723.1060853], "version": 0.2, "tvm_version": "0.8.dev0"}
{"input": ["cuda -keys=cuda,gpu -max_num_threads=1024 -thread_warp_size=32", "depthwise_conv2d_nchw.cuda", [["TENSOR", [128, 84, 42, 42], "float32"], ["TENSOR", [84, 1, 5, 5], "float32"], 1, "SAME", 1, "float32"], {}], "config": {"index": 2197804, "code_hash": null, "entity": [["tile_f", "sp", [-1, 3, 14, 1]], ["tile_y", "sp", [-1, 1, 2, 3]], ["tile_x", "sp", [-1, 1, 14, 1]], ["auto_unroll_max_step", "ot", 0], ["unroll_explicit", "ot", 1]]}, "result": [[0.0006847491965811966], 0, 2.6320135593414307, 1637745725.607387], "version": 0.2, "tvm_version": "0.8.dev0"}
{"input": ["cuda -keys=cuda,gpu -max_num_threads=1024 -thread_warp_size=32", "depthwise_conv2d_nchw.cuda", [["TENSOR", [128, 84, 42, 42], "float32"], ["TENSOR", [84, 1, 5, 5], "float32"], 1, "SAME", 1, "float32"], {}], "config": {"index": 1884918, "code_hash": null, "entity": [["tile_f", "sp", [-1, 2, 1, 7]], ["tile_y", "sp", [-1, 7, 1, 1]], ["tile_x", "sp", [-1, 1, 6, 7]], ["auto_unroll_max_step", "ot", 1500], ["unroll_explicit", "ot", 0]]}, "result": [[0.029886743], 0, 15.984112977981567, 1637745733.8381934], "version": 0.2, "tvm_version": "0.8.dev0"}
{"input": ["cuda -keys=cuda,gpu -max_num_threads=1024 -thread_warp_size=32", "depthwise_conv2d_nchw.cuda", [["TENSOR", [128, 84, 42, 42], "float32"], ["TENSOR", [84, 1, 5, 5], "float32"], 1, "SAME", 1, "float32"], {}], "config": {"index": 133537, "code_hash": null, "entity": [["tile_f", "sp", [-1, 2, 14, 3]], ["tile_y", "sp", [-1, 3, 1, 1]], ["tile_x", "sp", [-1, 2, 3, 1]], ["auto_unroll_max_step", "ot", 0], ["unroll_explicit", "ot", 0]]}, "result": [[0.0139686985], 0, 2.6206610202789307, 1637745744.5040193], "version": 0.2, "tvm_version": "0.8.dev0"}
{"input": ["cuda -keys=cuda,gpu -max_num_threads=1024 -thread_warp_size=32", "depthwise_conv2d_nchw.cuda", [["TENSOR", [128, 84, 42, 42], "float32"], ["TENSOR", [84, 1, 5, 5], "float32"], 1, "SAME", 1, "float32"], {}], "config": {"index": 2946125, "code_hash": null, "entity": [["tile_f", "sp", [-1, 6, 14, 1]], ["tile_y", "sp", [-1, 1, 1, 6]], ["tile_x", "sp", [-1, 1, 3, 2]], ["auto_unroll_max_step", "ot", 256], ["unroll_explicit", "ot", 1]]}, "result": [[0.005839806148148148], 0, 3.937649965286255, 1637745746.642154], "version": 0.2, "tvm_version": "0.8.dev0"}
{"input": ["cuda -keys=cuda,gpu -max_num_threads=1024 -thread_warp_size=32", "depthwise_conv2d_nchw.cuda", [["TENSOR", [128, 84, 42, 42], "float32"], ["TENSOR", [84, 1, 5, 5], "float32"], 1, "SAME", 1, "float32"], {}], "config": {"index": 3294771, "code_hash": null, "entity": [["tile_f", "sp", [-1, 1, 42, 1]], ["tile_y", "sp", [-1, 1, 1, 7]], ["tile_x", "sp", [-1, 2, 1, 1]], ["auto_unroll_max_step", "ot", 1500], ["unroll_explicit", "ot", 1]]}, "result": [[0.0020684690612244898], 0, 2.323129177093506, 1637745748.2858555], "version": 0.2, "tvm_version": "0.8.dev0"}
{"input": ["cuda -keys=cuda,gpu -max_num_threads=1024 -thread_warp_size=32", "depthwise_conv2d_nchw.cuda", [["TENSOR", [128, 84, 42, 42], "float32"], ["TENSOR", [84, 1, 5, 5], "float32"], 1, "SAME", 1, "float32"], {}], "config": {"index": 2621787, "code_hash": null, "entity": [["tile_f", "sp", [-1, 3, 4, 1]], ["tile_y", "sp", [-1, 3, 1, 1]], ["tile_x", "sp", [-1, 1, 1, 1]], ["auto_unroll_max_step", "ot", 256], ["unroll_explicit", "ot", 1]]}, "result": [[0.008847170416666666], 0, 2.6996474266052246, 1637745750.1923118], "version": 0.2, "tvm_version": "0.8.dev0"}
{"input": ["cuda -keys=cuda,gpu -max_num_threads=1024 -thread_warp_size=32", "depthwise_conv2d_nchw.cuda", [["TENSOR", [128, 84, 42, 42], "float32"], ["TENSOR", [84, 1, 5, 5], "float32"], 1, "SAME", 1, "float32"], {}], "config": {"index": 1853928, "code_hash": null, "entity": [["tile_f", "sp", [-1, 21, 1, 1]], ["tile_y", "sp", [-1, 6, 1, 1]], ["tile_x", "sp", [-1, 3, 2, 7]], ["auto_unroll_max_step", "ot", 1500], ["unroll_explicit", "ot", 0]]}, "result": [[0.19406518825], 0, 7.462043046951294, 1637745753.4511735], "version": 0.2, "tvm_version": "0.8.dev0"}
{"input": ["cuda -keys=cuda,gpu -max_num_threads=1024 -thread_warp_size=32", "depthwise_conv2d_nchw.cuda", [["TENSOR", [128, 84, 42, 42], "float32"], ["TENSOR", [84, 1, 5, 5], "float32"], 1, "SAME", 1, "float32"], {}], "config": {"index": 3809599, "code_hash": null, "entity": [["tile_f", "sp", [-1, 1, 1, 84]], ["tile_y", "sp", [-1, 2, 1, 1]], ["tile_x", "sp", [-1, 1, 2, 7]], ["auto_unroll_max_step", "ot", 1500], ["unroll_explicit", "ot", 1]]}, "result": [[0.07774861075], 0, 10.904398679733276, 1637745755.9131362], "version": 0.2, "tvm_version": "0.8.dev0"}
{"input": ["cuda -keys=cuda,gpu -max_num_threads=1024 -thread_warp_size=32", "depthwise_conv2d_nchw.cuda", [["TENSOR", [128, 84, 42, 42], "float32"], ["TENSOR", [84, 1, 5, 5], "float32"], 1, "SAME", 1, "float32"], {}], "config": {"index": 2519078, "code_hash": null, "entity": [["tile_f", "sp", [-1, 6, 7, 1]], ["tile_y", "sp", [-1, 1, 1, 1]], ["tile_x", "sp", [-1, 1, 3, 7]], ["auto_unroll_max_step", "ot", 0], ["unroll_explicit", "ot", 1]]}, "result": [[0.010376650999999999], 0, 2.275721549987793, 1637745757.797376], "version": 0.2, "tvm_version": "0.8.dev0"}
{"input": ["cuda -keys=cuda,gpu -max_num_threads=1024 -thread_warp_size=32", "depthwise_conv2d_nchw.cuda", [["TENSOR", [128, 84, 42, 42], "float32"], ["TENSOR", [84, 1, 5, 5], "float32"], 1, "SAME", 1, "float32"], {}], "config": {"index": 200000, "code_hash": null, "entity": [["tile_f", "sp", [-1, 1, 1, 1]], ["tile_y", "sp", [-1, 3, 7, 2]], ["tile_x", "sp", [-1, 2, 7, 1]], ["auto_unroll_max_step", "ot", 0], ["unroll_explicit", "ot", 0]]}, "result": [[0.0003596746121076233], 0, 1.9848964214324951, 1637745759.5273397], "version": 0.2, "tvm_version": "0.8.dev0"}
{"input": ["cuda -keys=cuda,gpu -max_num_threads=1024 -thread_warp_size=32", "depthwise_conv2d_nchw.cuda", [["TENSOR", [128, 84, 42, 42], "float32"], ["TENSOR", [84, 1, 5, 5], "float32"], 1, "SAME", 1, "float32"], {}], "config": {"index": 8259, "code_hash": null, "entity": [["tile_f", "sp", [-1, 1, 1, 4]], ["tile_y", "sp", [-1, 6, 1, 7]], ["tile_x", "sp", [-1, 1, 1, 1]], ["auto_unroll_max_step", "ot", 0], ["unroll_explicit", "ot", 0]]}, "result": [[0.0652556935], 0, 2.7293190956115723, 1637745761.4353826], "version": 0.2, "tvm_version": "0.8.dev0"}
{"input": ["cuda -keys=cuda,gpu -max_num_threads=1024 -thread_warp_size=32", "depthwise_conv2d_nchw.cuda", [["TENSOR", [128, 84, 42, 42], "float32"], ["TENSOR", [84, 1, 5, 5], "float32"], 1, "SAME", 1, "float32"], {}], "config": {"index": 1984771, "code_hash": null, "entity": [["tile_f", "sp", [-1, 3, 4, 7]], ["tile_y", "sp", [-1, 1, 2, 7]], ["tile_x", "sp", [-1, 2, 1, 1]], ["auto_unroll_max_step", "ot", 0], ["unroll_explicit", "ot", 1]]}, "result": [[0.029345028750000002], 0, 2.155935525894165, 1637745762.9937897], "version": 0.2, "tvm_version": "0.8.dev0"}
{"input": ["cuda -keys=cuda,gpu -max_num_threads=1024 -thread_warp_size=32", "depthwise_conv2d_nchw.cuda", [["TENSOR", [128, 84, 42, 42], "float32"], ["TENSOR", [84, 1, 5, 5], "float32"], 1, "SAME", 1, "float32"], {}], "config": {"index": 1043474, "code_hash": null, "entity": [["tile_f", "sp", [-1, 1, 7, 6]], ["tile_y", "sp", [-1, 1, 1, 14]], ["tile_x", "sp", [-1, 2, 1, 3]], ["auto_unroll_max_step", "ot", 256], ["unroll_explicit", "ot", 0]]}, "result": [[0.016263902285714286], 0, 2.324646234512329, 1637745764.5730028], "version": 0.2, "tvm_version": "0.8.dev0"}
{"input": ["cuda -keys=cuda,gpu -max_num_threads=1024 -thread_warp_size=32", "depthwise_conv2d_nchw.cuda", [["TENSOR", [128, 84, 42, 42], "float32"], ["TENSOR", [84, 1, 5, 5], "float32"], 1, "SAME", 1, "float32"], {}], "config": {"index": 226756, "code_hash": null, "entity": [["tile_f", "sp", [-1, 3, 7, 1]], ["tile_y", "sp", [-1, 3, 2, 1]], ["tile_x", "sp", [-1, 1, 14, 1]], ["auto_unroll_max_step", "ot", 0], ["unroll_explicit", "ot", 0]]}, "result": [[0.000643883816], 0, 2.2210147380828857, 1637745766.4852085], "version": 0.2, "tvm_version": "0.8.dev0"}
{"input": ["cuda -keys=cuda,gpu -max_num_threads=1024 -thread_warp_size=32", "depthwise_conv2d_nchw.cuda", [["TENSOR", [128, 84, 42, 42], "float32"], ["TENSOR", [84, 1, 5, 5], "float32"], 1, "SAME", 1, "float32"], {}], "config": {"index": 1453549, "code_hash": null, "entity": [["tile_f", "sp", [-1, 2, 1, 6]], ["tile_y", "sp", [-1, 1, 1, 21]], ["tile_x", "sp", [-1, 2, 3, 1]], ["auto_unroll_max_step", "ot", 1500], ["unroll_explicit", "ot", 0]]}, "result": [[0.02930630325], 0, 10.326115846633911, 1637745772.5609274], "version": 0.2, "tvm_version": "0.8.dev0"}
{"input": ["cuda -keys=cuda,gpu -max_num_threads=1024 -thread_warp_size=32", "depthwise_conv2d_nchw.cuda", [["TENSOR", [128, 84, 42, 42], "float32"], ["TENSOR", [84, 1, 5, 5], "float32"], 1, "SAME", 1, "float32"], {}], "config": {"index": 1049151, "code_hash": null, "entity": [["tile_f", "sp", [-1, 2, 6, 1]], ["tile_y", "sp", [-1, 7, 1, 2]], ["tile_x", "sp", [-1, 7, 1, 3]], ["auto_unroll_max_step", "ot", 256], ["unroll_explicit", "ot", 0]]}, "result": [[0.023723147666666666], 0, 3.177297830581665, 1637745774.579607], "version": 0.2, "tvm_version": "0.8.dev0"}
{"input": ["cuda -keys=cuda,gpu -max_num_threads=1024 -thread_warp_size=32", "depthwise_conv2d_nchw.cuda", [["TENSOR", [128, 84, 42, 42], "float32"], ["TENSOR", [84, 1, 5, 5], "float32"], 1, "SAME", 1, "float32"], {}], "config": {"index": 463844, "code_hash": null, "entity": [["tile_f", "sp", [-1, 6, 1, 1]], ["tile_y", "sp", [-1, 2, 7, 1]], ["tile_x", "sp", [-1, 1, 1, 6]], ["auto_unroll_max_step", "ot", 0], ["unroll_explicit", "ot", 0]]}, "result": [[0.0226062465], 0, 2.5378148555755615, 1637745776.6696067], "version": 0.2, "tvm_version": "0.8.dev0"}
{"input": ["cuda -keys=cuda,gpu -max_num_threads=1024 -thread_warp_size=32", "depthwise_conv2d_nchw.cuda", [["TENSOR", [128, 84, 42, 42], "float32"], ["TENSOR", [84, 1, 5, 5], "float32"], 1, "SAME", 1, "float32"], {}], "config": {"index": 2791722, "code_hash": null, "entity": [["tile_f", "sp", [-1, 1, 14, 1]], ["tile_y", "sp", [-1, 1, 2, 3]], ["tile_x", "sp", [-1, 1, 6, 1]], ["auto_unroll_max_step", "ot", 256], ["unroll_explicit", "ot", 1]]}, "result": [[0.0005494397118055556], 0, 1.8994274139404297, 1637745897.6743307], "version": 0.2, "tvm_version": "0.8.dev0"}
{"input": ["cuda -keys=cuda,gpu -max_num_threads=1024 -thread_warp_size=32", "depthwise_conv2d_nchw.cuda", [["TENSOR", [128, 84, 42, 42], "float32"], ["TENSOR", [84, 1, 5, 5], "float32"], 1, "SAME", 1, "float32"], {}], "config": {"index": 2136362, "code_hash": null, "entity": [["tile_f", "sp", [-1, 1, 14, 1]], ["tile_y", "sp", [-1, 1, 2, 3]], ["tile_x", "sp", [-1, 1, 6, 1]], ["auto_unroll_max_step", "ot", 0], ["unroll_explicit", "ot", 1]]}, "result": [[0.0005320075], 0, 1.6959381103515625, 1637745899.0593855], "version": 0.2, "tvm_version": "0.8.dev0"}
{"input": ["cuda -keys=cuda,gpu -max_num_threads=1024 -thread_warp_size=32", "depthwise_conv2d_nchw.cuda", [["TENSOR", [128, 84, 42, 42], "float32"], ["TENSOR", [84, 1, 5, 5], "float32"], 1, "SAME", 1, "float32"], {}], "config": {"index": 825642, "code_hash": null, "entity": [["tile_f", "sp", [-1, 1, 14, 1]], ["tile_y", "sp", [-1, 1, 2, 3]], ["tile_x", "sp", [-1, 1, 6, 1]], ["auto_unroll_max_step", "ot", 256], ["unroll_explicit", "ot", 0]]}, "result": [[0.0005275955934426229], 0, 1.688094139099121, 1637745900.415091], "version": 0.2, "tvm_version": "0.8.dev0"}
{"input": ["cuda -keys=cuda,gpu -max_num_threads=1024 -thread_warp_size=32", "depthwise_conv2d_nchw.cuda", [["TENSOR", [128, 84, 42, 42], "float32"], ["TENSOR", [84, 1, 5, 5], "float32"], 1, "SAME", 1, "float32"], {}], "config": {"index": 1481002, "code_hash": null, "entity": [["tile_f", "sp", [-1, 1, 14, 1]], ["tile_y", "sp", [-1, 1, 2, 3]], ["tile_x", "sp", [-1, 1, 6, 1]], ["auto_unroll_max_step", "ot", 1500], ["unroll_explicit", "ot", 0]]}, "result": [[0.0005276887049180328], 0, 1.871514081954956, 1637745902.0030777], "version": 0.2, "tvm_version": "0.8.dev0"}
{"input": ["cuda -keys=cuda,gpu -max_num_threads=1024 -thread_warp_size=32", "depthwise_conv2d_nchw.cuda", [["TENSOR", [128, 84, 42, 42], "float32"], ["TENSOR", [84, 1, 5, 5], "float32"], 1, "SAME", 1, "float32"], {}], "config": {"index": 3447082, "code_hash": null, "entity": [["tile_f", "sp", [-1, 1, 14, 1]], ["tile_y", "sp", [-1, 1, 2, 3]], ["tile_x", "sp", [-1, 1, 6, 1]], ["auto_unroll_max_step", "ot", 1500], ["unroll_explicit", "ot", 1]]}, "result": [[0.0005144365846645368], 0, 1.8433606624603271, 1637745903.4531264], "version": 0.2, "tvm_version": "0.8.dev0"}
{"input": ["cuda -keys=cuda,gpu -max_num_threads=1024 -thread_warp_size=32", "depthwise_conv2d_nchw.cuda", [["TENSOR", [128, 84, 42, 42], "float32"], ["TENSOR", [84, 1, 5, 5], "float32"], 1, "SAME", 1, "float32"], {}], "config": {"index": 170282, "code_hash": null, "entity": [["tile_f", "sp", [-1, 1, 14, 1]], ["tile_y", "sp", [-1, 1, 2, 3]], ["tile_x", "sp", [-1, 1, 6, 1]], ["auto_unroll_max_step", "ot", 0], ["unroll_explicit", "ot", 0]]}, "result": [[0.0005285735526315789], 0, 1.5736513137817383, 1637745904.7652826], "version": 0.2, "tvm_version": "0.8.dev0"}
{"input": ["cuda -keys=cuda,gpu -max_num_threads=1024 -thread_warp_size=32", "depthwise_conv2d_nchw.cuda", [["TENSOR", [128, 84, 42, 42], "float32"], ["TENSOR", [84, 1, 5, 5], "float32"], 1, "SAME", 1, "float32"], {}], "config": {"index": 3447080, "code_hash": null, "entity": [["tile_f", "sp", [-1, 1, 12, 1]], ["tile_y", "sp", [-1, 1, 2, 3]], ["tile_x", "sp", [-1, 1, 6, 1]], ["auto_unroll_max_step", "ot", 1500], ["unroll_explicit", "ot", 1]]}, "result": [[0.0004948669384615385], 0, 2.038766384124756, 1637745906.4091609], "version": 0.2, "tvm_version": "0.8.dev0"}
{"input": ["cuda -keys=cuda,gpu -max_num_threads=1024 -thread_warp_size=32", "depthwise_conv2d_nchw.cuda", [["TENSOR", [128, 84, 42, 42], "float32"], ["TENSOR", [84, 1, 5, 5], "float32"], 1, "SAME", 1, "float32"], {}], "config": {"index": 1481000, "code_hash": null, "entity": [["tile_f", "sp", [-1, 1, 12, 1]], ["tile_y", "sp", [-1, 1, 2, 3]], ["tile_x", "sp", [-1, 1, 6, 1]], ["auto_unroll_max_step", "ot", 1500], ["unroll_explicit", "ot", 0]]}, "result": [[0.0005084039242902208], 0, 1.6592075824737549, 1637745907.7549188], "version": 0.2, "tvm_version": "0.8.dev0"}
{"input": ["cuda -keys=cuda,gpu -max_num_threads=1024 -thread_warp_size=32", "depthwise_conv2d_nchw.cuda", [["TENSOR", [128, 84, 42, 42], "float32"], ["TENSOR", [84, 1, 5, 5], "float32"], 1, "SAME", 1, "float32"], {}], "config": {"index": 825640, "code_hash": null, "entity": [["tile_f", "sp", [-1, 1, 12, 1]], ["tile_y", "sp", [-1, 1, 2, 3]], ["tile_x", "sp", [-1, 1, 6, 1]], ["auto_unroll_max_step", "ot", 256], ["unroll_explicit", "ot", 0]]}, "result": [[0.0005084405141955837], 0, 1.6935935020446777, 1637745909.1668062], "version": 0.2, "tvm_version": "0.8.dev0"}
{"input": ["cuda -keys=cuda,gpu -max_num_threads=1024 -thread_warp_size=32", "depthwise_conv2d_nchw.cuda", [["TENSOR", [128, 84, 42, 42], "float32"], ["TENSOR", [84, 1, 5, 5], "float32"], 1, "SAME", 1, "float32"], {}], "config": {"index": 2136360, "code_hash": null, "entity": [["tile_f", "sp", [-1, 1, 12, 1]], ["tile_y", "sp", [-1, 1, 2, 3]], ["tile_x", "sp", [-1, 1, 6, 1]], ["auto_unroll_max_step", "ot", 0], ["unroll_explicit", "ot", 1]]}, "result": [[0.000509158785488959], 0, 1.7546663284301758, 1637745910.6093485], "version": 0.2, "tvm_version": "0.8.dev0"}
{"input": ["cuda -keys=cuda,gpu -max_num_threads=1024 -thread_warp_size=32", "depthwise_conv2d_nchw.cuda", [["TENSOR", [128, 84, 42, 42], "float32"], ["TENSOR", [84, 1, 5, 5], "float32"], 1, "SAME", 1, "float32"], {}], "config": {"index": 2791720, "code_hash": null, "entity": [["tile_f", "sp", [-1, 1, 12, 1]], ["tile_y", "sp", [-1, 1, 2, 3]], ["tile_x", "sp", [-1, 1, 6, 1]], ["auto_unroll_max_step", "ot", 256], ["unroll_explicit", "ot", 1]]}, "result": [[0.0004947792515337424], 0, 2.156371831893921, 1637745912.385407], "version": 0.2, "tvm_version": "0.8.dev0"}
{"input": ["cuda -keys=cuda,gpu -max_num_threads=1024 -thread_warp_size=32", "depthwise_conv2d_nchw.cuda", [["TENSOR", [128, 84, 42, 42], "float32"], ["TENSOR", [84, 1, 5, 5], "float32"], 1, "SAME", 1, "float32"], {}], "config": {"index": 170280, "code_hash": null, "entity": [["tile_f", "sp", [-1, 1, 12, 1]], ["tile_y", "sp", [-1, 1, 2, 3]], ["tile_x", "sp", [-1, 1, 6, 1]], ["auto_unroll_max_step", "ot", 0], ["unroll_explicit", "ot", 0]]}, "result": [[0.0005089414353312303], 0, 1.785050868988037, 1637745913.837026], "version": 0.2, "tvm_version": "0.8.dev0"}
{"input": ["cuda -keys=cuda,gpu -max_num_threads=1024 -thread_warp_size=32", "depthwise_conv2d_nchw.cuda", [["TENSOR", [128, 84, 42, 42], "float32"], ["TENSOR", [84, 1, 5, 5], "float32"], 1, "SAME", 1, "float32"], {}], "config": {"index": 2066602, "code_hash": null, "entity": [["tile_f", "sp", [-1, 1, 14, 1]], ["tile_y", "sp", [-1, 1, 2, 7]], ["tile_x", "sp", [-1, 3, 2, 1]], ["auto_unroll_max_step", "ot", 0], ["unroll_explicit", "ot", 1]]}, "result": [[0.0027360218157894737], 0, 1.7956616878509521, 1637745915.2487614], "version": 0.2, "tvm_version": "0.8.dev0"}
{"input": ["cuda -keys=cuda,gpu -max_num_threads=1024 -thread_warp_size=32", "depthwise_conv2d_nchw.cuda", [["TENSOR", [128, 84, 42, 42], "float32"], ["TENSOR", [84, 1, 5, 5], "float32"], 1, "SAME", 1, "float32"], {}], "config": {"index": 100522, "code_hash": null, "entity": [["tile_f", "sp", [-1, 1, 14, 1]], ["tile_y", "sp", [-1, 1, 2, 7]], ["tile_x", "sp", [-1, 3, 2, 1]], ["auto_unroll_max_step", "ot", 0], ["unroll_explicit", "ot", 0]]}, "result": [[0.0026498953947368424], 0, 1.7053539752960205, 1637745916.5581877], "version": 0.2, "tvm_version": "0.8.dev0"}
{"input": ["cuda -keys=cuda,gpu -max_num_threads=1024 -thread_warp_size=32", "depthwise_conv2d_nchw.cuda", [["TENSOR", [128, 84, 42, 42], "float32"], ["TENSOR", [84, 1, 5, 5], "float32"], 1, "SAME", 1, "float32"], {}], "config": {"index": 2791242, "code_hash": null, "entity": [["tile_f", "sp", [-1, 1, 14, 1]], ["tile_y", "sp", [-1, 2, 1, 3]], ["tile_x", "sp", [-1, 1, 6, 1]], ["auto_unroll_max_step", "ot", 256], ["unroll_explicit", "ot", 1]]}, "result": [[0.000521518566343042], 0, 2.202122926712036, 1637745918.3692098], "version": 0.2, "tvm_version": "0.8.dev0"}
{"input": ["cuda -keys=cuda,gpu -max_num_threads=1024 -thread_warp_size=32", "depthwise_conv2d_nchw.cuda", [["TENSOR", [128, 84, 42, 42], "float32"], ["TENSOR", [84, 1, 5, 5], "float32"], 1, "SAME", 1, "float32"], {}], "config": {"index": 169802, "code_hash": null, "entity": [["tile_f", "sp", [-1, 1, 14, 1]], ["tile_y", "sp", [-1, 2, 1, 3]], ["tile_x", "sp", [-1, 1, 6, 1]], ["auto_unroll_max_step", "ot", 0], ["unroll_explicit", "ot", 0]]}, "result": [[0.0005587761944444445], 0, 1.6580770015716553, 1637745919.7030942], "version": 0.2, "tvm_version": "0.8.dev0"}
{"input": ["cuda -keys=cuda,gpu -max_num_threads=1024 -thread_warp_size=32", "depthwise_conv2d_nchw.cuda", [["TENSOR", [128, 84, 42, 42], "float32"], ["TENSOR", [84, 1, 5, 5], "float32"], 1, "SAME", 1, "float32"], {}], "config": {"index": 825162, "code_hash": null, "entity": [["tile_f", "sp", [-1, 1, 14, 1]], ["tile_y", "sp", [-1, 2, 1, 3]], ["tile_x", "sp", [-1, 1, 6, 1]], ["auto_unroll_max_step", "ot", 256], ["unroll_explicit", "ot", 0]]}, "result": [[0.0005625452552447553], 0, 1.822643518447876, 1637745921.2121673], "version": 0.2, "tvm_version": "0.8.dev0"}
{"input": ["cuda -keys=cuda,gpu -max_num_threads=1024 -thread_warp_size=32", "depthwise_conv2d_nchw.cuda", [["TENSOR", [128, 84, 42, 42], "float32"], ["TENSOR", [84, 1, 5, 5], "float32"], 1, "SAME", 1, "float32"], {}], "config": {"index": 1480522, "code_hash": null, "entity": [["tile_f", "sp", [-1, 1, 14, 1]], ["tile_y", "sp", [-1, 2, 1, 3]], ["tile_x", "sp", [-1, 1, 6, 1]], ["auto_unroll_max_step", "ot", 1500], ["unroll_explicit", "ot", 0]]}, "result": [[0.0005625798706293706], 0, 1.9920883178710938, 1637745922.9118326], "version": 0.2, "tvm_version": "0.8.dev0"}
{"input": ["cuda -keys=cuda,gpu -max_num_threads=1024 -thread_warp_size=32", "depthwise_conv2d_nchw.cuda", [["TENSOR", [128, 84, 42, 42], "float32"], ["TENSOR", [84, 1, 5, 5], "float32"], 1, "SAME", 1, "float32"], {}], "config": {"index": 2135882, "code_hash": null, "entity": [["tile_f", "sp", [-1, 1, 14, 1]], ["tile_y", "sp", [-1, 2, 1, 3]], ["tile_x", "sp", [-1, 1, 6, 1]], ["auto_unroll_max_step", "ot", 0], ["unroll_explicit", "ot", 1]]}, "result": [[0.0005784935027932961], 0, 1.6647841930389404, 1637745924.3465471], "version": 0.2, "tvm_version": "0.8.dev0"}
{"input": ["cuda -keys=cuda,gpu -max_num_threads=1024 -thread_warp_size=32", "depthwise_conv2d_nchw.cuda", [["TENSOR", [128, 84, 42, 42], "float32"], ["TENSOR", [84, 1, 5, 5], "float32"], 1, "SAME", 1, "float32"], {}], "config": {"index": 3446602, "code_hash": null, "entity": [["tile_f", "sp", [-1, 1, 14, 1]], ["tile_y", "sp", [-1, 2, 1, 3]], ["tile_x", "sp", [-1, 1, 6, 1]], ["auto_unroll_max_step", "ot", 1500], ["unroll_explicit", "ot", 1]]}, "result": [[0.0005213481197916666], 0, 1.5557024478912354, 1637745925.4547927], "version": 0.2, "tvm_version": "0.8.dev0"}
{"input": ["cuda -keys=cuda,gpu -max_num_threads=1024 -thread_warp_size=32", "depthwise_conv2d_nchw.cuda", [["TENSOR", [128, 84, 42, 42], "float32"], ["TENSOR", [84, 1, 5, 5], "float32"], 1, "SAME", 1, "float32"], {}], "config": {"index": 100842, "code_hash": null, "entity": [["tile_f", "sp", [-1, 1, 14, 1]], ["tile_y", "sp", [-1, 1, 3, 7]], ["tile_x", "sp", [-1, 3, 2, 1]], ["auto_unroll_max_step", "ot", 0], ["unroll_explicit", "ot", 0]]}, "result": [[0.003486255482758621], 0, 1.9490447044372559, 1637745926.9838738], "version": 0.2, "tvm_version": "0.8.dev0"}
{"input": ["cuda -keys=cuda,gpu -max_num_threads=1024 -thread_warp_size=32", "depthwise_conv2d_nchw.cuda", [["TENSOR", [128, 84, 42, 42], "float32"], ["TENSOR", [84, 1, 5, 5], "float32"], 1, "SAME", 1, "float32"], {}], "config": {"index": 100840, "code_hash": null, "entity": [["tile_f", "sp", [-1, 1, 12, 1]], ["tile_y", "sp", [-1, 1, 3, 7]], ["tile_x", "sp", [-1, 3, 2, 1]], ["auto_unroll_max_step", "ot", 0], ["unroll_explicit", "ot", 0]]}, "result": [[0.00362406775], 0, 1.7779932022094727, 1637745928.2984545], "version": 0.2, "tvm_version": "0.8.dev0"}
{"input": ["cuda -keys=cuda,gpu -max_num_threads=1024 -thread_warp_size=32", "depthwise_conv2d_nchw.cuda", [["TENSOR", [128, 84, 42, 42], "float32"], ["TENSOR", [84, 1, 5, 5], "float32"], 1, "SAME", 1, "float32"], {}], "config": {"index": 2066920, "code_hash": null, "entity": [["tile_f", "sp", [-1, 1, 12, 1]], ["tile_y", "sp", [-1, 1, 3, 7]], ["tile_x", "sp", [-1, 3, 2, 1]], ["auto_unroll_max_step", "ot", 0], ["unroll_explicit", "ot", 1]]}, "result": [[0.0036204714285714285], 0, 1.5341088771820068, 1637745929.418002], "version": 0.2, "tvm_version": "0.8.dev0"}
{"input": ["cuda -keys=cuda,gpu -max_num_threads=1024 -thread_warp_size=32", "depthwise_conv2d_nchw.cuda", [["TENSOR", [128, 84, 42, 42], "float32"], ["TENSOR", [84, 1, 5, 5], "float32"], 1, "SAME", 1, "float32"], {}], "config": {"index": 2066922, "code_hash": null, "entity": [["tile_f", "sp", [-1, 1, 14, 1]], ["tile_y", "sp", [-1, 1, 3, 7]], ["tile_x", "sp", [-1, 3, 2, 1]], ["auto_unroll_max_step", "ot", 0], ["unroll_explicit", "ot", 1]]}, "result": [[0.0034746075172413793], 0, 1.5268833637237549, 1637745930.5490434], "version": 0.2, "tvm_version": "0.8.dev0"}
{"input": ["cuda -keys=cuda,gpu -max_num_threads=1024 -thread_warp_size=32", "depthwise_conv2d_nchw.cuda", [["TENSOR", [128, 84, 42, 42], "float32"], ["TENSOR", [84, 1, 5, 5], "float32"], 1, "SAME", 1, "float32"], {}], "config": {"index": 1479560, "code_hash": null, "entity": [["tile_f", "sp", [-1, 1, 12, 1]], ["tile_y", "sp", [-1, 1, 3, 2]], ["tile_x", "sp", [-1, 1, 6, 1]], ["auto_unroll_max_step", "ot", 1500], ["unroll_explicit", "ot", 0]]}, "result": [[0.000565565647887324], 0, 1.8141000270843506, 1637745932.7698872], "version": 0.2, "tvm_version": "0.8.dev0"}
{"input": ["cuda -keys=cuda,gpu -max_num_threads=1024 -thread_warp_size=32", "depthwise_conv2d_nchw.cuda", [["TENSOR", [128, 84, 42, 42], "float32"], ["TENSOR", [84, 1, 5, 5], "float32"], 1, "SAME", 1, "float32"], {}], "config": {"index": 168840, "code_hash": null, "entity": [["tile_f", "sp", [-1, 1, 12, 1]], ["tile_y", "sp", [-1, 1, 3, 2]], ["tile_x", "sp", [-1, 1, 6, 1]], ["auto_unroll_max_step", "ot", 0], ["unroll_explicit", "ot", 0]]}, "result": [[0.0005655631795774648], 0, 1.6745729446411133, 1637745934.0281467], "version": 0.2, "tvm_version": "0.8.dev0"}
{"input": ["cuda -keys=cuda,gpu -max_num_threads=1024 -thread_warp_size=32", "depthwise_conv2d_nchw.cuda", [["TENSOR", [128, 84, 42, 42], "float32"], ["TENSOR", [84, 1, 5, 5], "float32"], 1, "SAME", 1, "float32"], {}], "config": {"index": 2134920, "code_hash": null, "entity": [["tile_f", "sp", [-1, 1, 12, 1]], ["tile_y", "sp", [-1, 1, 3, 2]], ["tile_x", "sp", [-1, 1, 6, 1]], ["auto_unroll_max_step", "ot", 0], ["unroll_explicit", "ot", 1]]}, "result": [[0.0005655497992957746], 0, 1.9512507915496826, 1637745935.4321744], "version": 0.2, "tvm_version": "0.8.dev0"}
{"input": ["cuda -keys=cuda,gpu -max_num_threads=1024 -thread_warp_size=32", "depthwise_conv2d_nchw.cuda", [["TENSOR", [128, 84, 42, 42], "float32"], ["TENSOR", [84, 1, 5, 5], "float32"], 1, "SAME", 1, "float32"], {}], "config": {"index": 824200, "code_hash": null, "entity": [["tile_f", "sp", [-1, 1, 12, 1]], ["tile_y", "sp", [-1, 1, 3, 2]], ["tile_x", "sp", [-1, 1, 6, 1]], ["auto_unroll_max_step", "ot", 256], ["unroll_explicit", "ot", 0]]}, "result": [[0.0005656452147887324], 0, 1.8244342803955078, 1637745936.7738123], "version": 0.2, "tvm_version": "0.8.dev0"}
{"input": ["cuda -keys=cuda,gpu -max_num_threads=1024 -thread_warp_size=32", "depthwise_conv2d_nchw.cuda", [["TENSOR", [128, 84, 42, 42], "float32"], ["TENSOR", [84, 1, 5, 5], "float32"], 1, "SAME", 1, "float32"], {}], "config": {"index": 1479562, "code_hash": null, "entity": [["tile_f", "sp", [-1, 1, 14, 1]], ["tile_y", "sp", [-1, 1, 3, 2]], ["tile_x", "sp", [-1, 1, 6, 1]], ["auto_unroll_max_step", "ot", 1500], ["unroll_explicit", "ot", 0]]}, "result": [[0.0006126694882352941], 0, 1.9955112934112549, 1637745938.2336009], "version": 0.2, "tvm_version": "0.8.dev0"}
{"input": ["cuda -keys=cuda,gpu -max_num_threads=1024 -thread_warp_size=32", "depthwise_conv2d_nchw.cuda", [["TENSOR", [128, 84, 42, 42], "float32"], ["TENSOR", [84, 1, 5, 5], "float32"], 1, "SAME", 1, "float32"], {}], "config": {"index": 3445642, "code_hash": null, "entity": [["tile_f", "sp", [-1, 1, 14, 1]], ["tile_y", "sp", [-1, 1, 3, 2]], ["tile_x", "sp", [-1, 1, 6, 1]], ["auto_unroll_max_step", "ot", 1500], ["unroll_explicit", "ot", 1]]}, "result": [[0.0005762771863799285], 0, 1.8651063442230225, 1637745939.7445083], "version": 0.2, "tvm_version": "0.8.dev0"}
{"input": ["cuda -keys=cuda,gpu -max_num_threads=1024 -thread_warp_size=32", "depthwise_conv2d_nchw.cuda", [["TENSOR", [128, 84, 42, 42], "float32"], ["TENSOR", [84, 1, 5, 5], "float32"], 1, "SAME", 1, "float32"], {}], "config": {"index": 824202, "code_hash": null, "entity": [["tile_f", "sp", [-1, 1, 14, 1]], ["tile_y", "sp", [-1, 1, 3, 2]], ["tile_x", "sp", [-1, 1, 6, 1]], ["auto_unroll_max_step", "ot", 256], ["unroll_explicit", "ot", 0]]}, "result": [[0.0006610868764705882], 0, 2.4514241218566895, 1637745941.6551478], "version": 0.2, "tvm_version": "0.8.dev0"}
{"input": ["cuda -keys=cuda,gpu -max_num_threads=1024 -thread_warp_size=32", "depthwise_conv2d_nchw.cuda", [["TENSOR", [128, 84, 42, 42], "float32"], ["TENSOR", [84, 1, 5, 5], "float32"], 1, "SAME", 1, "float32"], {}], "config": {"index": 168842, "code_hash": null, "entity": [["tile_f", "sp", [-1, 1, 14, 1]], ["tile_y", "sp", [-1, 1, 3, 2]], ["tile_x", "sp", [-1, 1, 6, 1]], ["auto_unroll_max_step", "ot", 0], ["unroll_explicit", "ot", 0]]}, "result": [[0.00058656152], 0, 2.5357234477996826, 1637745943.6776338], "version": 0.2, "tvm_version": "0.8.dev0"}
{"input": ["cuda -keys=cuda,gpu -max_num_threads=1024 -thread_warp_size=32", "depthwise_conv2d_nchw.cuda", [["TENSOR", [128, 84, 42, 42], "float32"], ["TENSOR", [84, 1, 5, 5], "float32"], 1, "SAME", 1, "float32"], {}], "config": {"index": 2790282, "code_hash": null, "entity": [["tile_f", "sp", [-1, 1, 14, 1]], ["tile_y", "sp", [-1, 1, 3, 2]], ["tile_x", "sp", [-1, 1, 6, 1]], ["auto_unroll_max_step", "ot", 256], ["unroll_explicit", "ot", 1]]}, "result": [[0.000595455817204301], 0, 2.301342725753784, 1637745945.4279292], "version": 0.2, "tvm_version": "0.8.dev0"}
{"input": ["cuda -keys=cuda,gpu -max_num_threads=1024 -thread_warp_size=32", "depthwise_conv2d_nchw.cuda", [["TENSOR", [128, 84, 42, 42], "float32"], ["TENSOR", [84, 1, 5, 5], "float32"], 1, "SAME", 1, "float32"], {}], "config": {"index": 2790280, "code_hash": null, "entity": [["tile_f", "sp", [-1, 1, 12, 1]], ["tile_y", "sp", [-1, 1, 3, 2]], ["tile_x", "sp", [-1, 1, 6, 1]], ["auto_unroll_max_step", "ot", 256], ["unroll_explicit", "ot", 1]]}, "result": [[0.0005553624221453287], 0, 1.9905383586883545, 1637745946.9085724], "version": 0.2, "tvm_version": "0.8.dev0"}
{"input": ["cuda -keys=cuda,gpu -max_num_threads=1024 -thread_warp_size=32", "depthwise_conv2d_nchw.cuda", [["TENSOR", [128, 84, 42, 42], "float32"], ["TENSOR", [84, 1, 5, 5], "float32"], 1, "SAME", 1, "float32"], {}], "config": {"index": 2134922, "code_hash": null, "entity": [["tile_f", "sp", [-1, 1, 14, 1]], ["tile_y", "sp", [-1, 1, 3, 2]], ["tile_x", "sp", [-1, 1, 6, 1]], ["auto_unroll_max_step", "ot", 0], ["unroll_explicit", "ot", 1]]}, "result": [[0.0005864258727272727], 0, 1.9324467182159424, 1637745948.356801], "version": 0.2, "tvm_version": "0.8.dev0"}
{"input": ["cuda -keys=cuda,gpu -max_num_threads=1024 -thread_warp_size=32", "depthwise_conv2d_nchw.cuda", [["TENSOR", [128, 84, 42, 42], "float32"], ["TENSOR", [84, 1, 5, 5], "float32"], 1, "SAME", 1, "float32"], {}], "config": {"index": 3445640, "code_hash": null, "entity": [["tile_f", "sp", [-1, 1, 12, 1]], ["tile_y", "sp", [-1, 1, 3, 2]], ["tile_x", "sp", [-1, 1, 6, 1]], ["auto_unroll_max_step", "ot", 1500], ["unroll_explicit", "ot", 1]]}, "result": [[0.000603424], 0, 1.6985225677490234, 1637745949.5281682], "version": 0.2, "tvm_version": "0.8.dev0"}
{"input": ["cuda -keys=cuda,gpu -max_num_threads=1024 -thread_warp_size=32", "depthwise_conv2d_nchw.cuda", [["TENSOR", [128, 84, 42, 42], "float32"], ["TENSOR", [84, 1, 5, 5], "float32"], 1, "SAME", 1, "float32"], {}], "config": {"index": 844682, "code_hash": null, "entity": [["tile_f", "sp", [-1, 1, 14, 1]], ["tile_y", "sp", [-1, 1, 3, 2]], ["tile_x", "sp", [-1, 1, 7, 1]], ["auto_unroll_max_step", "ot", 256], ["unroll_explicit", "ot", 0]]}, "result": [[0.0005872789345454546], 0, 2.519181728363037, 1637745951.6403012], "version": 0.2, "tvm_version": "0.8.dev0"}
{"input": ["cuda -keys=cuda,gpu -max_num_threads=1024 -thread_warp_size=32", "depthwise_conv2d_nchw.cuda", [["TENSOR", [128, 84, 42, 42], "float32"], ["TENSOR", [84, 1, 5, 5], "float32"], 1, "SAME", 1, "float32"], {}], "config": {"index": 2810762, "code_hash": null, "entity": [["tile_f", "sp", [-1, 1, 14, 1]], ["tile_y", "sp", [-1, 1, 3, 2]], ["tile_x", "sp", [-1, 1, 7, 1]], ["auto_unroll_max_step", "ot", 256], ["unroll_explicit", "ot", 1]]}, "result": [[0.0005796707403100775], 0, 19.254831314086914, 1637745970.3404458], "version": 0.2, "tvm_version": "0.8.dev0"}
{"input": ["cuda -keys=cuda,gpu -max_num_threads=1024 -thread_warp_size=32", "depthwise_conv2d_nchw.cuda", [["TENSOR", [128, 84, 42, 42], "float32"], ["TENSOR", [84, 1, 5, 5], "float32"], 1, "SAME", 1, "float32"], {}], "config": {"index": 1500040, "code_hash": null, "entity": [["tile_f", "sp", [-1, 1, 12, 1]], ["tile_y", "sp", [-1, 1, 3, 2]], ["tile_x", "sp", [-1, 1, 7, 1]], ["auto_unroll_max_step", "ot", 1500], ["unroll_explicit", "ot", 0]]}, "result": [[0.0005655652147887323], 0, 2.0090110301971436, 1637745971.8074553], "version": 0.2, "tvm_version": "0.8.dev0"}
{"input": ["cuda -keys=cuda,gpu -max_num_threads=1024 -thread_warp_size=32", "depthwise_conv2d_nchw.cuda", [["TENSOR", [128, 84, 42, 42], "float32"], ["TENSOR", [84, 1, 5, 5], "float32"], 1, "SAME", 1, "float32"], {}], "config": {"index": 189320, "code_hash": null, "entity": [["tile_f", "sp", [-1, 1, 12, 1]], ["tile_y", "sp", [-1, 1, 3, 2]], ["tile_x", "sp", [-1, 1, 7, 1]], ["auto_unroll_max_step", "ot", 0], ["unroll_explicit", "ot", 0]]}, "result": [[0.0005655910790960453], 0, 1.4486243724822998, 1637745972.901493], "version": 0.2, "tvm_version": "0.8.dev0"}
{"input": ["cuda -keys=cuda,gpu -max_num_threads=1024 -thread_warp_size=32", "depthwise_conv2d_nchw.cuda", [["TENSOR", [128, 84, 42, 42], "float32"], ["TENSOR", [84, 1, 5, 5], "float32"], 1, "SAME", 1, "float32"], {}], "config": {"index": 1500042, "code_hash": null, "entity": [["tile_f", "sp", [-1, 1, 14, 1]], ["tile_y", "sp", [-1, 1, 3, 2]], ["tile_x", "sp", [-1, 1, 7, 1]], ["auto_unroll_max_step", "ot", 1500], ["unroll_explicit", "ot", 0]]}, "result": [[0.0005868167199999999], 0, 1.778099775314331, 1637745974.2013195], "version": 0.2, "tvm_version": "0.8.dev0"}
{"input": ["cuda -keys=cuda,gpu -max_num_threads=1024 -thread_warp_size=32", "depthwise_conv2d_nchw.cuda", [["TENSOR", [128, 84, 42, 42], "float32"], ["TENSOR", [84, 1, 5, 5], "float32"], 1, "SAME", 1, "float32"], {}], "config": {"index": 844680, "code_hash": null, "entity": [["tile_f", "sp", [-1, 1, 12, 1]], ["tile_y", "sp", [-1, 1, 3, 2]], ["tile_x", "sp", [-1, 1, 7, 1]], ["auto_unroll_max_step", "ot", 256], ["unroll_explicit", "ot", 0]]}, "result": [[0.0005655639604519773], 0, 1.5675575733184814, 1637745975.262282], "version": 0.2, "tvm_version": "0.8.dev0"}
{"input": ["cuda -keys=cuda,gpu -max_num_threads=1024 -thread_warp_size=32", "depthwise_conv2d_nchw.cuda", [["TENSOR", [128, 84, 42, 42], "float32"], ["TENSOR", [84, 1, 5, 5], "float32"], 1, "SAME", 1, "float32"], {}], "config": {"index": 189322, "code_hash": null, "entity": [["tile_f", "sp", [-1, 1, 14, 1]], ["tile_y", "sp", [-1, 1, 3, 2]], ["tile_x", "sp", [-1, 1, 7, 1]], ["auto_unroll_max_step", "ot", 0], ["unroll_explicit", "ot", 0]]}, "result": [[0.000586874530909091], 0, 2.0047049522399902, 1637745976.7529151], "version": 0.2, "tvm_version": "0.8.dev0"}
{"input": ["cuda -keys=cuda,gpu -max_num_threads=1024 -thread_warp_size=32", "depthwise_conv2d_nchw.cuda", [["TENSOR", [128, 84, 42, 42], "float32"], ["TENSOR", [84, 1, 5, 5], "float32"], 1, "SAME", 1, "float32"], {}], "config": {"index": 2155402, "code_hash": null, "entity": [["tile_f", "sp", [-1, 1, 14, 1]], ["tile_y", "sp", [-1, 1, 3, 2]], ["tile_x", "sp", [-1, 1, 7, 1]], ["auto_unroll_max_step", "ot", 0], ["unroll_explicit", "ot", 1]]}, "result": [[0.0005868672545454545], 0, 2.0158801078796387, 1637745978.2148423], "version": 0.2, "tvm_version": "0.8.dev0"}
{"input": ["cuda -keys=cuda,gpu -max_num_threads=1024 -thread_warp_size=32", "depthwise_conv2d_nchw.cuda", [["TENSOR", [128, 84, 42, 42], "float32"], ["TENSOR", [84, 1, 5, 5], "float32"], 1, "SAME", 1, "float32"], {}], "config": {"index": 2810760, "code_hash": null, "entity": [["tile_f", "sp", [-1, 1, 12, 1]], ["tile_y", "sp", [-1, 1, 3, 2]], ["tile_x", "sp", [-1, 1, 7, 1]], ["auto_unroll_max_step", "ot", 256], ["unroll_explicit", "ot", 1]]}, "result": [[0.0005527144673539519], 0, 1.9250156879425049, 1637745979.6404984], "version": 0.2, "tvm_version": "0.8.dev0"}
{"input": ["cuda -keys=cuda,gpu -max_num_threads=1024 -thread_warp_size=32", "depthwise_conv2d_nchw.cuda", [["TENSOR", [128, 84, 42, 42], "float32"], ["TENSOR", [84, 1, 5, 5], "float32"], 1, "SAME", 1, "float32"], {}], "config": {"index": 3466120, "code_hash": null, "entity": [["tile_f", "sp", [-1, 1, 12, 1]], ["tile_y", "sp", [-1, 1, 3, 2]], ["tile_x", "sp", [-1, 1, 7, 1]], ["auto_unroll_max_step", "ot", 1500], ["unroll_explicit", "ot", 1]]}, "result": [[0.0005527635346153846], 0, 1.9173738956451416, 1637745981.0220237], "version": 0.2, "tvm_version": "0.8.dev0"}
{"input": ["cuda -keys=cuda,gpu -max_num_threads=1024 -thread_warp_size=32", "depthwise_conv2d_nchw.cuda", [["TENSOR", [128, 84, 42, 42], "float32"], ["TENSOR", [84, 1, 5, 5], "float32"], 1, "SAME", 1, "float32"], {}], "config": {"index": 2155400, "code_hash": null, "entity": [["tile_f", "sp", [-1, 1, 12, 1]], ["tile_y", "sp", [-1, 1, 3, 2]], ["tile_x", "sp", [-1, 1, 7, 1]], ["auto_unroll_max_step", "ot", 0], ["unroll_explicit", "ot", 1]]}, "result": [[0.000565628221830986], 0, 1.929431676864624, 1637745982.4003832], "version": 0.2, "tvm_version": "0.8.dev0"}
{"input": ["cuda -keys=cuda,gpu -max_num_threads=1024 -thread_warp_size=32", "depthwise_conv2d_nchw.cuda", [["TENSOR", [128, 84, 42, 42], "float32"], ["TENSOR", [84, 1, 5, 5], "float32"], 1, "SAME", 1, "float32"], {}], "config": {"index": 3466122, "code_hash": null, "entity": [["tile_f", "sp", [-1, 1, 14, 1]], ["tile_y", "sp", [-1, 1, 3, 2]], ["tile_x", "sp", [-1, 1, 7, 1]], ["auto_unroll_max_step", "ot", 1500], ["unroll_explicit", "ot", 1]]}, "result": [[0.0005711027738515901], 0, 1.9300880432128906, 1637745983.799268], "version": 0.2, "tvm_version": "0.8.dev0"}
{"input": ["cuda -keys=cuda,gpu -max_num_threads=1024 -thread_warp_size=32", "depthwise_conv2d_nchw.cuda", [["TENSOR", [128, 84, 42, 42], "float32"], ["TENSOR", [84, 1, 5, 5], "float32"], 1, "SAME", 1, "float32"], {}], "config": {"index": 1442280, "code_hash": null, "entity": [["tile_f", "sp", [-1, 1, 12, 1]], ["tile_y", "sp", [-1, 1, 3, 7]], ["tile_x", "sp", [-1, 1, 3, 1]], ["auto_unroll_max_step", "ot", 1500], ["unroll_explicit", "ot", 0]]}, "result": [[0.0006920772198275862], 0, 1.5420711040496826, 1637745986.5421844], "version": 0.2, "tvm_version": "0.8.dev0"}
{"input": ["cuda -keys=cuda,gpu -max_num_threads=1024 -thread_warp_size=32", "depthwise_conv2d_nchw.cuda", [["TENSOR", [128, 84, 42, 42], "float32"], ["TENSOR", [84, 1, 5, 5], "float32"], 1, "SAME", 1, "float32"], {}], "config": {"index": 3408360, "code_hash": null, "entity": [["tile_f", "sp", [-1, 1, 12, 1]], ["tile_y", "sp", [-1, 1, 3, 7]], ["tile_x", "sp", [-1, 1, 3, 1]], ["auto_unroll_max_step", "ot", 1500], ["unroll_explicit", "ot", 1]]}, "result": [[0.0006364806377952755], 0, 1.8425335884094238, 1637745987.96896], "version": 0.2, "tvm_version": "0.8.dev0"}
{"input": ["cuda -keys=cuda,gpu -max_num_threads=1024 -thread_warp_size=32", "depthwise_conv2d_nchw.cuda", [["TENSOR", [128, 84, 42, 42], "float32"], ["TENSOR", [84, 1, 5, 5], "float32"], 1, "SAME", 1, "float32"], {}], "config": {"index": 2066600, "code_hash": null, "entity": [["tile_f", "sp", [-1, 1, 12, 1]], ["tile_y", "sp", [-1, 1, 2, 7]], ["tile_x", "sp", [-1, 3, 2, 1]], ["auto_unroll_max_step", "ot", 0], ["unroll_explicit", "ot", 1]]}, "result": [[0.0028681887714285714], 0, 1.7989528179168701, 1637745989.407639], "version": 0.2, "tvm_version": "0.8.dev0"}
{"input": ["cuda -keys=cuda,gpu -max_num_threads=1024 -thread_warp_size=32", "depthwise_conv2d_nchw.cuda", [["TENSOR", [128, 84, 42, 42], "float32"], ["TENSOR", [84, 1, 5, 5], "float32"], 1, "SAME", 1, "float32"], {}], "config": {"index": 2066595, "code_hash": null, "entity": [["tile_f", "sp", [-1, 2, 7, 1]], ["tile_y", "sp", [-1, 1, 2, 7]], ["tile_x", "sp", [-1, 3, 2, 1]], ["auto_unroll_max_step", "ot", 0], ["unroll_explicit", "ot", 1]]}, "result": [[0.003952422150000001], 0, 1.8042166233062744, 1637745990.8398697], "version": 0.2, "tvm_version": "0.8.dev0"}
{"input": ["cuda -keys=cuda,gpu -max_num_threads=1024 -thread_warp_size=32", "depthwise_conv2d_nchw.cuda", [["TENSOR", [128, 84, 42, 42], "float32"], ["TENSOR", [84, 1, 5, 5], "float32"], 1, "SAME", 1, "float32"], {}], "config": {"index": 100515, "code_hash": null, "entity": [["tile_f", "sp", [-1, 2, 7, 1]], ["tile_y", "sp", [-1, 1, 2, 7]], ["tile_x", "sp", [-1, 3, 2, 1]], ["auto_unroll_max_step", "ot", 0], ["unroll_explicit", "ot", 0]]}, "result": [[0.003963643346153846], 0, 8.687991619110107, 1637745999.1937945], "version": 0.2, "tvm_version": "0.8.dev0"}
{"input": ["cuda -keys=cuda,gpu -max_num_threads=1024 -thread_warp_size=32", "depthwise_conv2d_nchw.cuda", [["TENSOR", [128, 84, 42, 42], "float32"], ["TENSOR", [84, 1, 5, 5], "float32"], 1, "SAME", 1, "float32"], {}], "config": {"index": 2107562, "code_hash": null, "entity": [["tile_f", "sp", [-1, 1, 14, 1]], ["tile_y", "sp", [-1, 1, 2, 7]], ["tile_x", "sp", [-1, 2, 3, 1]], ["auto_unroll_max_step", "ot", 0], ["unroll_explicit", "ot", 1]]}, "result": [[0.003581164535714286], 0, 1.8885927200317383, 1637746000.7718832], "version": 0.2, "tvm_version": "0.8.dev0"}
{"input": ["cuda -keys=cuda,gpu -max_num_threads=1024 -thread_warp_size=32", "depthwise_conv2d_nchw.cuda", [["TENSOR", [128, 84, 42, 42], "float32"], ["TENSOR", [84, 1, 5, 5], "float32"], 1, "SAME", 1, "float32"], {}], "config": {"index": 141482, "code_hash": null, "entity": [["tile_f", "sp", [-1, 1, 14, 1]], ["tile_y", "sp", [-1, 1, 2, 7]], ["tile_x", "sp", [-1, 2, 3, 1]], ["auto_unroll_max_step", "ot", 0], ["unroll_explicit", "ot", 0]]}, "result": [[0.0035812716428571425], 0, 1.4301974773406982, 1637746001.9033382], "version": 0.2, "tvm_version": "0.8.dev0"}
{"input": ["cuda -keys=cuda,gpu -max_num_threads=1024 -thread_warp_size=32", "depthwise_conv2d_nchw.cuda", [["TENSOR", [128, 84, 42, 42], "float32"], ["TENSOR", [84, 1, 5, 5], "float32"], 1, "SAME", 1, "float32"], {}], "config": {"index": 796842, "code_hash": null, "entity": [["tile_f", "sp", [-1, 1, 14, 1]], ["tile_y", "sp", [-1, 1, 2, 7]], ["tile_x", "sp", [-1, 2, 3, 1]], ["auto_unroll_max_step", "ot", 256], ["unroll_explicit", "ot", 0]]}, "result": [[0.003671376107142857], 0, 1.5867931842803955, 1637746003.1794662], "version": 0.2, "tvm_version": "0.8.dev0"}
{"input": ["cuda -keys=cuda,gpu -max_num_threads=1024 -thread_warp_size=32", "depthwise_conv2d_nchw.cuda", [["TENSOR", [128, 84, 42, 42], "float32"], ["TENSOR", [84, 1, 5, 5], "float32"], 1, "SAME", 1, "float32"], {}], "config": {"index": 1452202, "code_hash": null, "entity": [["tile_f", "sp", [-1, 1, 14, 1]], ["tile_y", "sp", [-1, 1, 2, 7]], ["tile_x", "sp", [-1, 2, 3, 1]], ["auto_unroll_max_step", "ot", 1500], ["unroll_explicit", "ot", 0]]}, "result": [[0.0006253626498054475], 0, 1.7919838428497314, 1637746004.6718745], "version": 0.2, "tvm_version": "0.8.dev0"}
{"input": ["cuda -keys=cuda,gpu -max_num_threads=1024 -thread_warp_size=32", "depthwise_conv2d_nchw.cuda", [["TENSOR", [128, 84, 42, 42], "float32"], ["TENSOR", [84, 1, 5, 5], "float32"], 1, "SAME", 1, "float32"], {}], "config": {"index": 2762922, "code_hash": null, "entity": [["tile_f", "sp", [-1, 1, 14, 1]], ["tile_y", "sp", [-1, 1, 2, 7]], ["tile_x", "sp", [-1, 2, 3, 1]], ["auto_unroll_max_step", "ot", 256], ["unroll_explicit", "ot", 1]]}, "result": [[0.004243564916666667], 0, 2.273827314376831, 1637746006.4163775], "version": 0.2, "tvm_version": "0.8.dev0"}
{"input": ["cuda -keys=cuda,gpu -max_num_threads=1024 -thread_warp_size=32", "depthwise_conv2d_nchw.cuda", [["TENSOR", [128, 84, 42, 42], "float32"], ["TENSOR", [84, 1, 5, 5], "float32"], 1, "SAME", 1, "float32"], {}], "config": {"index": 3418282, "code_hash": null, "entity": [["tile_f", "sp", [-1, 1, 14, 1]], ["tile_y", "sp", [-1, 1, 2, 7]], ["tile_x", "sp", [-1, 2, 3, 1]], ["auto_unroll_max_step", "ot", 1500], ["unroll_explicit", "ot", 1]]}, "result": [[0.00045688379545454544], 0, 1.9580023288726807, 1637746007.7627683], "version": 0.2, "tvm_version": "0.8.dev0"}
{"input": ["cuda -keys=cuda,gpu -max_num_threads=1024 -thread_warp_size=32", "depthwise_conv2d_nchw.cuda", [["TENSOR", [128, 84, 42, 42], "float32"], ["TENSOR", [84, 1, 5, 5], "float32"], 1, "SAME", 1, "float32"], {}], "config": {"index": 826442, "code_hash": null, "entity": [["tile_f", "sp", [-1, 1, 14, 1]], ["tile_y", "sp", [-1, 1, 1, 6]], ["tile_x", "sp", [-1, 1, 6, 1]], ["auto_unroll_max_step", "ot", 256], ["unroll_explicit", "ot", 0]]}, "result": [[0.0005621744615384614], 0, 1.5846831798553467, 1637746009.0923412], "version": 0.2, "tvm_version": "0.8.dev0"}
{"input": ["cuda -keys=cuda,gpu -max_num_threads=1024 -thread_warp_size=32", "depthwise_conv2d_nchw.cuda", [["TENSOR", [128, 84, 42, 42], "float32"], ["TENSOR", [84, 1, 5, 5], "float32"], 1, "SAME", 1, "float32"], {}], "config": {"index": 1481802, "code_hash": null, "entity": [["tile_f", "sp", [-1, 1, 14, 1]], ["tile_y", "sp", [-1, 1, 1, 6]], ["tile_x", "sp", [-1, 1, 6, 1]], ["auto_unroll_max_step", "ot", 1500], ["unroll_explicit", "ot", 0]]}, "result": [[0.0005621989269662921], 0, 1.3911454677581787, 1637746010.233165], "version": 0.2, "tvm_version": "0.8.dev0"}
{"input": ["cuda -keys=cuda,gpu -max_num_threads=1024 -thread_warp_size=32", "depthwise_conv2d_nchw.cuda", [["TENSOR", [128, 84, 42, 42], "float32"], ["TENSOR", [84, 1, 5, 5], "float32"], 1, "SAME", 1, "float32"], {}], "config": {"index": 2304805, "code_hash": null, "entity": [["tile_f", "sp", [-1, 7, 1, 1]], ["tile_y", "sp", [-1, 14, 1, 1]], ["tile_x", "sp", [-1, 1, 7, 2]], ["auto_unroll_max_step", "ot", 0], ["unroll_explicit", "ot", 1]]}, "result": [[0.028264604500000002], 0, 9.662246704101562, 1637746019.1195424], "version": 0.2, "tvm_version": "0.8.dev0"}
{"input": ["cuda -keys=cuda,gpu -max_num_threads=1024 -thread_warp_size=32", "depthwise_conv2d_nchw.cuda", [["TENSOR", [128, 84, 42, 42], "float32"], ["TENSOR", [84, 1, 5, 5], "float32"], 1, "SAME", 1, "float32"], {}], "config": {"index": 2761656, "code_hash": null, "entity": [["tile_f", "sp", [-1, 3, 1, 2]], ["tile_y", "sp", [-1, 1, 14, 3]], ["tile_x", "sp", [-1, 2, 3, 1]], ["auto_unroll_max_step", "ot", 256], ["unroll_explicit", "ot", 1]]}, "result": [[0.007701484999999999], 0, 2.8033056259155273, 1637746020.7771535], "version": 0.2, "tvm_version": "0.8.dev0"}
{"input": ["cuda -keys=cuda,gpu -max_num_threads=1024 -thread_warp_size=32", "depthwise_conv2d_nchw.cuda", [["TENSOR", [128, 84, 42, 42], "float32"], ["TENSOR", [84, 1, 5, 5], "float32"], 1, "SAME", 1, "float32"], {}], "config": {"index": 855360, "code_hash": null, "entity": [["tile_f", "sp", [-1, 1, 1, 1]], ["tile_y", "sp", [-1, 3, 7, 2]], ["tile_x", "sp", [-1, 2, 7, 1]], ["auto_unroll_max_step", "ot", 256], ["unroll_explicit", "ot", 0]]}, "result": [[0.00036708229095354524], 0, 1.9582035541534424, 1637746139.6139765], "version": 0.2, "tvm_version": "0.8.dev0"}
{"input": ["cuda -keys=cuda,gpu -max_num_threads=1024 -thread_warp_size=32", "depthwise_conv2d_nchw.cuda", [["TENSOR", [128, 84, 42, 42], "float32"], ["TENSOR", [84, 1, 5, 5], "float32"], 1, "SAME", 1, "float32"], {}], "config": {"index": 2821440, "code_hash": null, "entity": [["tile_f", "sp", [-1, 1, 1, 1]], ["tile_y", "sp", [-1, 3, 7, 2]], ["tile_x", "sp", [-1, 2, 7, 1]], ["auto_unroll_max_step", "ot", 256], ["unroll_explicit", "ot", 1]]}, "result": [[0.006757082133333333], 0, 2.55188250541687, 1637746140.9321406], "version": 0.2, "tvm_version": "0.8.dev0"}
{"input": ["cuda -keys=cuda,gpu -max_num_threads=1024 -thread_warp_size=32", "depthwise_conv2d_nchw.cuda", [["TENSOR", [128, 84, 42, 42], "float32"], ["TENSOR", [84, 1, 5, 5], "float32"], 1, "SAME", 1, "float32"], {}], "config": {"index": 886080, "code_hash": null, "entity": [["tile_f", "sp", [-1, 1, 1, 1]], ["tile_y", "sp", [-1, 3, 7, 2]], ["tile_x", "sp", [-1, 1, 14, 1]], ["auto_unroll_max_step", "ot", 256], ["unroll_explicit", "ot", 0]]}, "result": [[0.0003874044589371981], 0, 1.9973111152648926, 1637746142.5314355], "version": 0.2, "tvm_version": "0.8.dev0"}
{"input": ["cuda -keys=cuda,gpu -max_num_threads=1024 -thread_warp_size=32", "depthwise_conv2d_nchw.cuda", [["TENSOR", [128, 84, 42, 42], "float32"], ["TENSOR", [84, 1, 5, 5], "float32"], 1, "SAME", 1, "float32"], {}], "config": {"index": 826092, "code_hash": null, "entity": [["tile_f", "sp", [-1, 1, 2, 1]], ["tile_y", "sp", [-1, 2, 7, 3]], ["tile_x", "sp", [-1, 1, 6, 1]], ["auto_unroll_max_step", "ot", 256], ["unroll_explicit", "ot", 0]]}, "result": [[0.0003924279755501222], 0, 1.7765731811523438, 1637746143.9128442], "version": 0.2, "tvm_version": "0.8.dev0"}
{"input": ["cuda -keys=cuda,gpu -max_num_threads=1024 -thread_warp_size=32", "depthwise_conv2d_nchw.cuda", [["TENSOR", [128, 84, 42, 42], "float32"], ["TENSOR", [84, 1, 5, 5], "float32"], 1, "SAME", 1, "float32"], {}], "config": {"index": 2792172, "code_hash": null, "entity": [["tile_f", "sp", [-1, 1, 2, 1]], ["tile_y", "sp", [-1, 2, 7, 3]], ["tile_x", "sp", [-1, 1, 6, 1]], ["auto_unroll_max_step", "ot", 256], ["unroll_explicit", "ot", 1]]}, "result": [[0.00038996721951219517], 0, 1.990952730178833, 1637746145.4060984], "version": 0.2, "tvm_version": "0.8.dev0"}
{"input": ["cuda -keys=cuda,gpu -max_num_threads=1024 -thread_warp_size=32", "depthwise_conv2d_nchw.cuda", [["TENSOR", [128, 84, 42, 42], "float32"], ["TENSOR", [84, 1, 5, 5], "float32"], 1, "SAME", 1, "float32"], {}], "config": {"index": 2962412, "code_hash": null, "entity": [["tile_f", "sp", [-1, 1, 2, 1]], ["tile_y", "sp", [-1, 2, 7, 1]], ["tile_x", "sp", [-1, 1, 7, 2]], ["auto_unroll_max_step", "ot", 256], ["unroll_explicit", "ot", 1]]}, "result": [[0.0003999988603491272], 0, 1.8319132328033447, 1637746146.793375], "version": 0.2, "tvm_version": "0.8.dev0"}
{"input": ["cuda -keys=cuda,gpu -max_num_threads=1024 -thread_warp_size=32", "depthwise_conv2d_nchw.cuda", [["TENSOR", [128, 84, 42, 42], "float32"], ["TENSOR", [84, 1, 5, 5], "float32"], 1, "SAME", 1, "float32"], {}], "config": {"index": 2963040, "code_hash": null, "entity": [["tile_f", "sp", [-1, 1, 1, 1]], ["tile_y", "sp", [-1, 3, 14, 1]], ["tile_x", "sp", [-1, 1, 7, 2]], ["auto_unroll_max_step", "ot", 256], ["unroll_explicit", "ot", 1]]}, "result": [[0.00034866765577342047], 0, 2.0074262619018555, 1637746148.3796442], "version": 0.2, "tvm_version": "0.8.dev0"}
{"input": ["cuda -keys=cuda,gpu -max_num_threads=1024 -thread_warp_size=32", "depthwise_conv2d_nchw.cuda", [["TENSOR", [128, 84, 42, 42], "float32"], ["TENSOR", [84, 1, 5, 5], "float32"], 1, "SAME", 1, "float32"], {}], "config": {"index": 996960, "code_hash": null, "entity": [["tile_f", "sp", [-1, 1, 1, 1]], ["tile_y", "sp", [-1, 3, 14, 1]], ["tile_x", "sp", [-1, 1, 7, 2]], ["auto_unroll_max_step", "ot", 256], ["unroll_explicit", "ot", 0]]}, "result": [[0.00035044190371991244], 0, 1.8854858875274658, 1637746149.852529], "version": 0.2, "tvm_version": "0.8.dev0"}
{"input": ["cuda -keys=cuda,gpu -max_num_threads=1024 -thread_warp_size=32", "depthwise_conv2d_nchw.cuda", [["TENSOR", [128, 84, 42, 42], "float32"], ["TENSOR", [84, 1, 5, 5], "float32"], 1, "SAME", 1, "float32"], {}], "config": {"index": 2852160, "code_hash": null, "entity": [["tile_f", "sp", [-1, 1, 1, 1]], ["tile_y", "sp", [-1, 3, 7, 2]], ["tile_x", "sp", [-1, 1, 14, 1]], ["auto_unroll_max_step", "ot", 256], ["unroll_explicit", "ot", 1]]}, "result": [[0.0003839828806682577], 0, 1.8214082717895508, 1637746151.2744262], "version": 0.2, "tvm_version": "0.8.dev0"}
{"input": ["cuda -keys=cuda,gpu -max_num_threads=1024 -thread_warp_size=32", "depthwise_conv2d_nchw.cuda", [["TENSOR", [128, 84, 42, 42], "float32"], ["TENSOR", [84, 1, 5, 5], "float32"], 1, "SAME", 1, "float32"], {}], "config": {"index": 996332, "code_hash": null, "entity": [["tile_f", "sp", [-1, 1, 2, 1]], ["tile_y", "sp", [-1, 2, 7, 1]], ["tile_x", "sp", [-1, 1, 7, 2]], ["auto_unroll_max_step", "ot", 256], ["unroll_explicit", "ot", 0]]}, "result": [[0.0003995160773067332], 0, 1.8913543224334717, 1637746152.7930384], "version": 0.2, "tvm_version": "0.8.dev0"}
{"input": ["cuda -keys=cuda,gpu -max_num_threads=1024 -thread_warp_size=32", "depthwise_conv2d_nchw.cuda", [["TENSOR", [128, 84, 42, 42], "float32"], ["TENSOR", [84, 1, 5, 5], "float32"], 1, "SAME", 1, "float32"], {}], "config": {"index": 998720, "code_hash": null, "entity": [["tile_f", "sp", [-1, 1, 1, 1]], ["tile_y", "sp", [-1, 3, 7, 2]], ["tile_x", "sp", [-1, 1, 7, 2]], ["auto_unroll_max_step", "ot", 256], ["unroll_explicit", "ot", 0]]}, "result": [[0.00037220281062355653], 0, 1.946187973022461, 1637746154.2874281], "version": 0.2, "tvm_version": "0.8.dev0"}
{"input": ["cuda -keys=cuda,gpu -max_num_threads=1024 -thread_warp_size=32", "depthwise_conv2d_nchw.cuda", [["TENSOR", [128, 84, 42, 42], "float32"], ["TENSOR", [84, 1, 5, 5], "float32"], 1, "SAME", 1, "float32"], {}], "config": {"index": 2962572, "code_hash": null, "entity": [["tile_f", "sp", [-1, 1, 2, 1]], ["tile_y", "sp", [-1, 3, 7, 1]], ["tile_x", "sp", [-1, 1, 7, 2]], ["auto_unroll_max_step", "ot", 256], ["unroll_explicit", "ot", 1]]}, "result": [[0.0003782939763593381], 0, 1.9313819408416748, 1637746155.7558143], "version": 0.2, "tvm_version": "0.8.dev0"}
{"input": ["cuda -keys=cuda,gpu -max_num_threads=1024 -thread_warp_size=32", "depthwise_conv2d_nchw.cuda", [["TENSOR", [128, 84, 42, 42], "float32"], ["TENSOR", [84, 1, 5, 5], "float32"], 1, "SAME", 1, "float32"], {}], "config": {"index": 2964800, "code_hash": null, "entity": [["tile_f", "sp", [-1, 1, 1, 1]], ["tile_y", "sp", [-1, 3, 7, 2]], ["tile_x", "sp", [-1, 1, 7, 2]], ["auto_unroll_max_step", "ot", 256], ["unroll_explicit", "ot", 1]]}, "result": [[0.0003662379885844749], 0, 2.341871738433838, 1637746157.5945094], "version": 0.2, "tvm_version": "0.8.dev0"}
