artifacts/figure13/tvm/autotvm_kernels/relay_nasnet_imagenet_nchw_tuned.1000.best.log
{"i": ["cuda -model=unknown", "topi_nn_conv2d", [["TENSOR", [1, 1056, 7, 7], "float32"], ["TENSOR", [176, 1056, 1, 1], "float32"], [1, 1], [0, 0, 0, 0], [1, 1], "NCHW", "float32"], {}, ["conv2d", [1, 1056, 7, 7, "float32"], [176, 1056, 1, 1, "float32"], [1, 1], [0, 0, 0, 0], [1, 1], "NCHW", "float32"], {"i": 126593, "t": "direct", "c": "null", "e": [["tile_f", "sp", [-1, 1, 16, 1]], ["tile_y", "sp", [-1, 1, 1, 1]], ["tile_x", "sp", [-1, 1, 7, 1]], ["tile_rc", "sp", [-1, 16]], ["tile_ry", "sp", [-1, 1]], ["tile_rx", "sp", [-1, 1]], ["auto_unroll_max_step", "ot", 1500], ["unroll_explicit", "ot", 0]]}], "r": [[1.7699414907651718e-05], 0, 4.061846733093262, 1584503350.752573], "v": 0.1}
{"i": ["cuda -model=unknown", "topi_nn_conv2d", [["TENSOR", [1, 11, 56, 56], "float32"], ["TENSOR", [11, 11, 1, 1], "float32"], [1, 1], [0, 0, 0, 0], [1, 1], "NCHW", "float32"], {}, ["conv2d", [1, 11, 56, 56, "float32"], [11, 11, 1, 1, "float32"], [1, 1], [0, 0, 0, 0], [1, 1], "NCHW", "float32"], {"i": 84162, "t": "direct", "c": "null", "e": [["tile_f", "sp", [-1, 1, 11, 1]], ["tile_y", "sp", [-1, 1, 1, 1]], ["tile_x", "sp", [-1, 7, 8, 1]], ["tile_rc", "sp", [-1, 11]], ["tile_ry", "sp", [-1, 1]], ["tile_rx", "sp", [-1, 1]], ["auto_unroll_max_step", "ot", 512], ["unroll_explicit", "ot", 0]]}], "r": [[2.8091907029676967e-06], 0, 4.740965843200684, 1584369297.5759315], "v": 0.1}
{"i": ["cuda -model=unknown", "topi_nn_conv2d", [["TENSOR", [1, 176, 7, 7], "float32"], ["TENSOR", [176, 176, 1, 1], "float32"], [1, 1], [0, 0, 0, 0], [1, 1], "NCHW", "float32"], {}, ["conv2d", [1, 176, 7, 7, "float32"], [176, 176, 1, 1, "float32"], [1, 1], [0, 0, 0, 0], [1, 1], "NCHW", "float32"], {"i": 133313, "t": "direct", "c": "null", "e": [["tile_f", "sp", [-1, 1, 16, 1]], ["tile_y", "sp", [-1, 1, 1, 1]], ["tile_x", "sp", [-1, 1, 7, 1]], ["tile_rc", "sp", [-1, 176]], ["tile_ry", "sp", [-1, 1]], ["tile_rx", "sp", [-1, 1]], ["auto_unroll_max_step", "ot", 1500], ["unroll_explicit", "ot", 1]]}], "r": [[4.724450844496214e-06], 0, 4.535685300827026, 1584499524.5057635], "v": 0.1}
{"i": ["cuda -model=unknown", "topi_nn_conv2d", [["TENSOR", [1, 22, 28, 28], "float32"], ["TENSOR", [22, 22, 1, 1], "float32"], [1, 1], [0, 0, 0, 0], [1, 1], "NCHW", "float32"], {}, ["conv2d", [1, 22, 28, 28, "float32"], [22, 22, 1, 1, "float32"], [1, 1], [0, 0, 0, 0], [1, 1], "NCHW", "float32"], {"i": 163846, "t": "direct", "c": "null", "e": [["tile_f", "sp", [-1, 1, 11, 1]], ["tile_y", "sp", [-1, 1, 1, 1]], ["tile_x", "sp", [-1, 2, 14, 1]], ["tile_rc", "sp", [-1, 11]], ["tile_ry", "sp", [-1, 1]], ["tile_rx", "sp", [-1, 1]], ["auto_unroll_max_step", "ot", 512], ["unroll_explicit", "ot", 0]]}], "r": [[2.800729453292198e-06], 0, 7.158675193786621, 1584531158.1652286], "v": 0.1}
{"i": ["cuda -model=unknown", "topi_nn_conv2d", [["TENSOR", [1, 264, 14, 14], "float32"], ["TENSOR", [44, 264, 1, 1], "float32"], [1, 1], [0, 0, 0, 0], [1, 1], "NCHW", "float32"], {}, ["conv2d", [1, 264, 14, 14, "float32"], [44, 264, 1, 1, "float32"], [1, 1], [0, 0, 0, 0], [1, 1], "NCHW", "float32"], {"i": 783372, "t": "direct", "c": "null", "e": [["tile_f", "sp", [-1, 1, 11, 1]], ["tile_y", "sp", [-1, 1, 1, 1]], ["tile_x", "sp", [-1, 1, 14, 1]], ["tile_rc", "sp", [-1, 66]], ["tile_ry", "sp", [-1, 1]], ["tile_rx", "sp", [-1, 1]], ["auto_unroll_max_step", "ot", 512], ["unroll_explicit", "ot", 1]]}], "r": [[5.719935162862272e-06], 0, 5.472014427185059, 1584526128.3703682], "v": 0.1}
{"i": ["cuda -model=unknown", "topi_nn_conv2d", [["TENSOR", [1, 264, 28, 28], "float32"], ["TENSOR", [44, 264, 1, 1], "float32"], [1, 1], [0, 0, 0, 0], [1, 1], "NCHW", "float32"], {}, ["conv2d", [1, 264, 28, 28, "float32"], [44, 264, 1, 1, "float32"], [1, 1], [0, 0, 0, 0], [1, 1], "NCHW", "float32"], {"i": 2843224, "t": "direct", "c": "null", "e": [["tile_f", "sp", [-1, 1, 11, 2]], ["tile_y", "sp", [-1, 1, 1, 1]], ["tile_x", "sp", [-1, 1, 28, 1]], ["tile_rc", "sp", [-1, 66]], ["tile_ry", "sp", [-1, 1]], ["tile_rx", "sp", [-1, 1]], ["auto_unroll_max_step", "ot", 1500], ["unroll_explicit", "ot", 0]]}], "r": [[9.301690654952077e-06], 0, 3.131542921066284, 1584517845.7105505], "v": 0.1}
{"i": ["cuda -model=unknown", "topi_nn_conv2d", [["TENSOR", [1, 264, 28, 28], "float32"], ["TENSOR", [88, 264, 1, 1], "float32"], [1, 1], [0, 0, 0, 0], [1, 1], "NCHW", "float32"], {}, ["conv2d", [1, 264, 28, 28, "float32"], [88, 264, 1, 1, "float32"], [1, 1], [0, 0, 0, 0], [1, 1], "NCHW", "float32"], {"i": 5430442, "t": "direct", "c": "null", "e": [["tile_f", "sp", [-1, 1, 11, 2]], ["tile_y", "sp", [-1, 1, 1, 1]], ["tile_x", "sp", [-1, 1, 28, 1]], ["tile_rc", "sp", [-1, 33]], ["tile_ry", "sp", [-1, 1]], ["tile_rx", "sp", [-1, 1]], ["auto_unroll_max_step", "ot", 1500], ["unroll_explicit", "ot", 0]]}], "r": [[1.481095593913241e-05], 0, 3.909990072250366, 1584398995.8022978], "v": 0.1}
{"i": ["cuda -model=unknown", "topi_nn_conv2d", [["TENSOR", [1, 32, 111, 111], "float32"], ["TENSOR", [11, 32, 1, 1], "float32"], [1, 1], [0, 0, 0, 0], [1, 1], "NCHW", "float32"], {}, ["conv2d", [1, 32, 111, 111, "float32"], [11, 32, 1, 1, "float32"], [1, 1], [0, 0, 0, 0], [1, 1], "NCHW", "float32"], {"i": 26001, "t": "direct", "c": "null", "e": [["tile_f", "sp", [-1, 11, 1, 1]], ["tile_y", "sp", [-1, 1, 3, 1]], ["tile_x", "sp", [-1, 1, 37, 1]], ["tile_rc", "sp", [-1, 2]], ["tile_ry", "sp", [-1, 1]], ["tile_rx", "sp", [-1, 1]], ["auto_unroll_max_step", "ot", 512], ["unroll_explicit", "ot", 1]]}], "r": [[5.564568348555173e-06], 0, 3.325474262237549, 1584522620.0569165], "v": 0.1}
{"i": ["cuda -model=unknown", "topi_nn_conv2d", [["TENSOR", [1, 3, 224, 224], "float32"], ["TENSOR", [32, 3, 3, 3], "float32"], [2, 2], [0, 0, 0, 0], [1, 1], "NCHW", "float32"], {}, ["conv2d", [1, 3, 224, 224, "float32"], [32, 3, 3, 3, "float32"], [2, 2], [0, 0, 0, 0], [1, 1], "NCHW", "float32"], {"i": 179224, "t": "direct", "c": "null", "e": [["tile_f", "sp", [-1, 8, 1, 2]], ["tile_y", "sp", [-1, 1, 1, 1]], ["tile_x", "sp", [-1, 1, 111, 1]], ["tile_rc", "sp", [-1, 1]], ["tile_ry", "sp", [-1, 1]], ["tile_rx", "sp", [-1, 3]], ["auto_unroll_max_step", "ot", 512], ["unroll_explicit", "ot", 0]]}], "r": [[7.197496570174236e-06], 0, 5.2118964195251465, 1584383119.0447776], "v": 0.1}
{"i": ["cuda -model=unknown", "topi_nn_conv2d", [["TENSOR", [1, 32, 56, 56], "float32"], ["TENSOR", [11, 32, 1, 1], "float32"], [1, 1], [0, 0, 0, 0], [1, 1], "NCHW", "float32"], {}, ["conv2d", [1, 32, 56, 56, "float32"], [11, 32, 1, 1, "float32"], [1, 1], [0, 0, 0, 0], [1, 1], "NCHW", "float32"], {"i": 83846, "t": "direct", "c": "null", "e": [["tile_f", "sp", [-1, 1, 11, 1]], ["tile_y", "sp", [-1, 2, 1, 1]], ["tile_x", "sp", [-1, 1, 8, 1]], ["tile_rc", "sp", [-1, 8]], ["tile_ry", "sp", [-1, 1]], ["tile_rx", "sp", [-1, 1]], ["auto_unroll_max_step", "ot", 0], ["unroll_explicit", "ot", 0]]}], "r": [[3.607879988362508e-06], 0, 1.6106441020965576, 1584489816.8312888], "v": 0.1}
{"i": ["cuda -model=unknown", "topi_nn_conv2d", [["TENSOR", [1, 352, 14, 14], "float32"], ["TENSOR", [88, 352, 1, 1], "float32"], [1, 1], [0, 0, 0, 0], [1, 1], "NCHW", "float32"], {}, ["conv2d", [1, 352, 14, 14, "float32"], [88, 352, 1, 1, "float32"], [1, 1], [0, 0, 0, 0], [1, 1], "NCHW", "float32"], {"i": 358418, "t": "direct", "c": "null", "e": [["tile_f", "sp", [-1, 1, 8, 1]], ["tile_y", "sp", [-1, 1, 1, 1]], ["tile_x", "sp", [-1, 1, 14, 1]], ["tile_rc", "sp", [-1, 16]], ["tile_ry", "sp", [-1, 1]], ["tile_rx", "sp", [-1, 1]], ["auto_unroll_max_step", "ot", 512], ["unroll_explicit", "ot", 0]]}], "r": [[8.99040499175889e-06], 0, 4.988240957260132, 1584475901.8023016], "v": 0.1}
{"i": ["cuda -model=unknown", "topi_nn_conv2d", [["TENSOR", [1, 44, 28, 28], "float32"], ["TENSOR", [22, 44, 1, 1], "float32"], [1, 1], [0, 0, 0, 0], [1, 1], "NCHW", "float32"], {}, ["conv2d", [1, 44, 28, 28, "float32"], [22, 44, 1, 1, "float32"], [1, 1], [0, 0, 0, 0], [1, 1], "NCHW", "float32"], {"i": 113286, "t": "direct", "c": "null", "e": [["tile_f", "sp", [-1, 1, 11, 1]], ["tile_y", "sp", [-1, 1, 1, 1]], ["tile_x", "sp", [-1, 1, 28, 1]], ["tile_rc", "sp", [-1, 22]], ["tile_ry", "sp", [-1, 1]], ["tile_rx", "sp", [-1, 1]], ["auto_unroll_max_step", "ot", 0], ["unroll_explicit", "ot", 0]]}], "r": [[3.1798039238860655e-06], 0, 4.914641857147217, 1584507831.6435864], "v": 0.1}
{"i": ["cuda -model=unknown", "topi_nn_conv2d", [["TENSOR", [1, 44, 28, 28], "float32"], ["TENSOR", [44, 44, 1, 1], "float32"], [1, 1], [0, 0, 0, 0], [1, 1], "NCHW", "float32"], {}, ["conv2d", [1, 44, 28, 28, "float32"], [44, 44, 1, 1, "float32"], [1, 1], [0, 0, 0, 0], [1, 1], "NCHW", "float32"], {"i": 1371224, "t": "direct", "c": "null", "e": [["tile_f", "sp", [-1, 1, 11, 2]], ["tile_y", "sp", [-1, 1, 1, 1]], ["tile_x", "sp", [-1, 1, 28, 1]], ["tile_rc", "sp", [-1, 11]], ["tile_ry", "sp", [-1, 1]], ["tile_rx", "sp", [-1, 1]], ["auto_unroll_max_step", "ot", 0], ["unroll_explicit", "ot", 1]]}], "r": [[3.4161962712558905e-06], 0, 5.004586458206177, 1584512296.9387987], "v": 0.1}
{"i": ["cuda -model=unknown", "topi_nn_conv2d", [["TENSOR", [1, 44, 56, 56], "float32"], ["TENSOR", [22, 44, 1, 1], "float32"], [1, 1], [0, 0, 0, 0], [1, 1], "NCHW", "float32"], {}, ["conv2d", [1, 44, 56, 56, "float32"], [22, 44, 1, 1, "float32"], [1, 1], [0, 0, 0, 0], [1, 1], "NCHW", "float32"], {"i": 1571851, "t": "direct", "c": "null", "e": [["tile_f", "sp", [-1, 1, 11, 2]], ["tile_y", "sp", [-1, 1, 1, 1]], ["tile_x", "sp", [-1, 2, 28, 1]], ["tile_rc", "sp", [-1, 11]], ["tile_ry", "sp", [-1, 1]], ["tile_rx", "sp", [-1, 1]], ["auto_unroll_max_step", "ot", 1500], ["unroll_explicit", "ot", 0]]}], "r": [[4.15535301530153e-06], 0, 5.384086847305298, 1584536374.7244194], "v": 0.1}
{"i": ["cuda -model=unknown", "topi_nn_conv2d", [["TENSOR", [1, 528, 14, 14], "float32"], ["TENSOR", [176, 528, 1, 1], "float32"], [1, 1], [0, 0, 0, 0], [1, 1], "NCHW", "float32"], {}, ["conv2d", [1, 528, 14, 14, "float32"], [176, 528, 1, 1, "float32"], [1, 1], [0, 0, 0, 0], [1, 1], "NCHW", "float32"], {"i": 1810093, "t": "direct", "c": "null", "e": [["tile_f", "sp", [-1, 1, 16, 1]], ["tile_y", "sp", [-1, 2, 1, 1]], ["tile_x", "sp", [-1, 1, 14, 1]], ["tile_rc", "sp", [-1, 24]], ["tile_ry", "sp", [-1, 1]], ["tile_rx", "sp", [-1, 1]], ["auto_unroll_max_step", "ot", 1500], ["unroll_explicit", "ot", 0]]}], "r": [[1.3945706559513465e-05], 0, 4.023841857910156, 1584483756.2176507], "v": 0.1}
{"i": ["cuda -model=unknown", "topi_nn_conv2d", [["TENSOR", [1, 528, 14, 14], "float32"], ["TENSOR", [88, 528, 1, 1], "float32"], [1, 1], [0, 0, 0, 0], [1, 1], "NCHW", "float32"], {}, ["conv2d", [1, 528, 14, 14, "float32"], [88, 528, 1, 1, "float32"], [1, 1], [0, 0, 0, 0], [1, 1], "NCHW", "float32"], {"i": 2344984, "t": "direct", "c": "null", "e": [["tile_f", "sp", [-1, 1, 22, 1]], ["tile_y", "sp", [-1, 1, 1, 1]], ["tile_x", "sp", [-1, 1, 14, 1]], ["tile_rc", "sp", [-1, 66]], ["tile_ry", "sp", [-1, 1]], ["tile_rx", "sp", [-1, 1]], ["auto_unroll_max_step", "ot", 1500], ["unroll_explicit", "ot", 1]]}], "r": [[1.2188890671716166e-05], 0, 6.3889665603637695, 1584494476.8386915], "v": 0.1}
{"i": ["cuda -model=unknown", "topi_nn_conv2d", [["TENSOR", [1, 528, 7, 7], "float32"], ["TENSOR", [88, 528, 1, 1], "float32"], [1, 1], [0, 0, 0, 0], [1, 1], "NCHW", "float32"], {}, ["conv2d", [1, 528, 7, 7, "float32"], [88, 528, 1, 1, "float32"], [1, 1], [0, 0, 0, 0], [1, 1], "NCHW", "float32"], {"i": 63380, "t": "direct", "c": "null", "e": [["tile_f", "sp", [-1, 1, 11, 1]], ["tile_y", "sp", [-1, 1, 1, 1]], ["tile_x", "sp", [-1, 1, 7, 1]], ["tile_rc", "sp", [-1, 22]], ["tile_ry", "sp", [-1, 1]], ["tile_rx", "sp", [-1, 1]], ["auto_unroll_max_step", "ot", 1500], ["unroll_explicit", "ot", 0]]}], "r": [[9.282768503811944e-06], 0, 4.907365798950195, 1584462548.268744], "v": 0.1}
{"i": ["cuda -model=unknown", "topi_nn_conv2d", [["TENSOR", [1, 704, 7, 7], "float32"], ["TENSOR", [176, 704, 1, 1], "float32"], [1, 1], [0, 0, 0, 0], [1, 1], "NCHW", "float32"], {}, ["conv2d", [1, 704, 7, 7, "float32"], [176, 704, 1, 1, "float32"], [1, 1], [0, 0, 0, 0], [1, 1], "NCHW", "float32"], {"i": 79553, "t": "direct", "c": "null", "e": [["tile_f", "sp", [-1, 1, 16, 1]], ["tile_y", "sp", [-1, 1, 1, 1]], ["tile_x", "sp", [-1, 1, 7, 1]], ["tile_rc", "sp", [-1, 32]], ["tile_ry", "sp", [-1, 1]], ["tile_rx", "sp", [-1, 1]], ["auto_unroll_max_step", "ot", 1500], ["unroll_explicit", "ot", 0]]}], "r": [[1.3462256316916487e-05], 0, 5.769329071044922, 1584425674.7131267], "v": 0.1}
{"i": ["cuda -model=unknown", "topi_nn_conv2d", [["TENSOR", [1, 88, 14, 14], "float32"], ["TENSOR", [88, 88, 1, 1], "float32"], [1, 1], [0, 0, 0, 0], [1, 1], "NCHW", "float32"], {}, ["conv2d", [1, 88, 14, 14, "float32"], [88, 88, 1, 1, "float32"], [1, 1], [0, 0, 0, 0], [1, 1], "NCHW", "float32"], {"i": 440660, "t": "direct", "c": "null", "e": [["tile_f", "sp", [-1, 1, 11, 1]], ["tile_y", "sp", [-1, 1, 2, 1]], ["tile_x", "sp", [-1, 1, 14, 1]], ["tile_rc", "sp", [-1, 22]], ["tile_ry", "sp", [-1, 1]], ["tile_rx", "sp", [-1, 1]], ["auto_unroll_max_step", "ot", 1500], ["unroll_explicit", "ot", 0]]}], "r": [[3.7502285181642016e-06], 0, 4.561098575592041, 1584436667.3774781], "v": 0.1}
{"i": ["cuda -model=unknown", "topi_nn_conv2d", [["TENSOR", [1, 88, 28, 28], "float32"], ["TENSOR", [44, 88, 1, 1], "float32"], [1, 1], [0, 0, 0, 0], [1, 1], "NCHW", "float32"], {}, ["conv2d", [1, 88, 28, 28, "float32"], [44, 88, 1, 1, "float32"], [1, 1], [0, 0, 0, 0], [1, 1], "NCHW", "float32"], {"i": 347224, "t": "direct", "c": "null", "e": [["tile_f", "sp", [-1, 1, 11, 2]], ["tile_y", "sp", [-1, 1, 1, 1]], ["tile_x", "sp", [-1, 1, 28, 1]], ["tile_rc", "sp", [-1, 22]], ["tile_ry", "sp", [-1, 1]], ["tile_rx", "sp", [-1, 1]], ["auto_unroll_max_step", "ot", 0], ["unroll_explicit", "ot", 0]]}], "r": [[4.5983799908214775e-06], 0, 6.395896911621094, 1584540014.1380773], "v": 0.1}
{"i": ["cuda -model=unknown", "topi_nn_depthwise_conv2d_nchw", [["TENSOR", [1, 176, 14, 14], "float32"], ["TENSOR", [176, 1, 5, 5], "float32"], [2, 2], [1, 1, 2, 2], [1, 1], "float32"], {}, ["depthwise_conv2d_nchw", [1, 176, 14, 14, "float32"], [176, 1, 5, 5, "float32"], [2, 2], [1, 1, 2, 2], [1, 1], "float32"], {"i": 10920, "t": "direct", "c": "null", "e": [["tile_f", "sp", [-1, 1, 1, 1]], ["tile_y", "sp", [-1, 1, 7, 1]], ["tile_x", "sp", [-1, 1, 1, 7]], ["auto_unroll_max_step", "ot", 256], ["unroll_explicit", "ot", 1]]}], "r": [[3.476657373772113e-06], 0, 2.558244466781616, 1604054916.6827846], "v": 0.1}
{"i": ["cuda -model=unknown", "topi_nn_depthwise_conv2d_nchw", [["TENSOR", [1, 176, 14, 14], "float32"], ["TENSOR", [176, 1, 7, 7], "float32"], [2, 2], [2, 2, 3, 3], [1, 1], "float32"], {}, ["depthwise_conv2d_nchw", [1, 176, 14, 14, "float32"], [176, 1, 7, 7, "float32"], [2, 2], [2, 2, 3, 3], [1, 1], "float32"], {"i": 313, "t": "direct", "c": "null", "e": [["tile_f", "sp", [-1, 1, 16, 1]], ["tile_y", "sp", [-1, 1, 7, 1]], ["tile_x", "sp", [-1, 1, 1, 1]], ["auto_unroll_max_step", "ot", 0], ["unroll_explicit", "ot", 0]]}], "r": [[3.3702962738374035e-06], 0, 2.3910951614379883, 1604053762.361302], "v": 0.1}
{"i": ["cuda -model=unknown", "topi_nn_depthwise_conv2d_nchw", [["TENSOR", [1, 22, 56, 56], "float32"], ["TENSOR", [22, 1, 5, 5], "float32"], [2, 2], [1, 1, 2, 2], [1, 1], "float32"], {}, ["depthwise_conv2d_nchw", [1, 22, 56, 56, "float32"], [22, 1, 5, 5, "float32"], [2, 2], [1, 1, 2, 2], [1, 1], "float32"], {"i": 121120, "t": "direct", "c": "null", "e": [["tile_f", "sp", [-1, 1, 1, 1]], ["tile_y", "sp", [-1, 1, 4, 1]], ["tile_x", "sp", [-1, 1, 7, 4]], ["auto_unroll_max_step", "ot", 256], ["unroll_explicit", "ot", 1]]}], "r": [[3.833479751074796e-06], 0, 3.1347954273223877, 1604050089.8756762], "v": 0.1}
{"i": ["cuda -model=unknown", "topi_nn_depthwise_conv2d_nchw", [["TENSOR", [1, 22, 56, 56], "float32"], ["TENSOR", [22, 1, 7, 7], "float32"], [2, 2], [2, 2, 3, 3], [1, 1], "float32"], {}, ["depthwise_conv2d_nchw", [1, 22, 56, 56, "float32"], [22, 1, 7, 7, "float32"], [2, 2], [2, 2, 3, 3], [1, 1], "float32"], {"i": 134672, "t": "direct", "c": "null", "e": [["tile_f", "sp", [-1, 1, 1, 1]], ["tile_y", "sp", [-1, 1, 28, 1]], ["tile_x", "sp", [-1, 1, 4, 1]], ["auto_unroll_max_step", "ot", 1500], ["unroll_explicit", "ot", 1]]}], "r": [[4.491397189548352e-06], 0, 1.8605082035064697, 1604048572.629905], "v": 0.1}
{"i": ["cuda -model=unknown", "topi_nn_depthwise_conv2d_nchw", [["TENSOR", [1, 88, 28, 28], "float32"], ["TENSOR", [88, 1, 5, 5], "float32"], [2, 2], [1, 1, 2, 2], [1, 1], "float32"], {}, ["depthwise_conv2d_nchw", [1, 88, 28, 28, "float32"], [88, 1, 5, 5, "float32"], [2, 2], [1, 1, 2, 2], [1, 1], "float32"], {"i": 92800, "t": "direct", "c": "null", "e": [["tile_f", "sp", [-1, 1, 1, 1]], ["tile_y", "sp", [-1, 1, 14, 1]], ["tile_x", "sp", [-1, 1, 14, 1]], ["auto_unroll_max_step", "ot", 256], ["unroll_explicit", "ot", 1]]}], "r": [[3.895681202304937e-06], 0, 2.8883161544799805, 1604052312.5401871], "v": 0.1}
{"i": ["cuda -model=unknown", "topi_nn_depthwise_conv2d_nchw", [["TENSOR", [1, 88, 28, 28], "float32"], ["TENSOR", [88, 1, 7, 7], "float32"], [2, 2], [2, 2, 3, 3], [1, 1], "float32"], {}, ["depthwise_conv2d_nchw", [1, 88, 28, 28, "float32"], [88, 1, 7, 7, "float32"], [2, 2], [2, 2, 3, 3], [1, 1], "float32"], {"i": 92800, "t": "direct", "c": "null", "e": [["tile_f", "sp", [-1, 1, 1, 1]], ["tile_y", "sp", [-1, 1, 14, 1]], ["tile_x", "sp", [-1, 1, 14, 1]], ["auto_unroll_max_step", "ot", 256], ["unroll_explicit", "ot", 1]]}], "r": [[4.6437150185360805e-06], 0, 2.4335691928863525, 1604051050.6818066], "v": 0.1}
{"i": ["cuda -model=unknown", "topi_nn_depthwise_conv2d_nchw", [["TENSOR", [1, 11, 111, 111], "float32"], ["TENSOR", [11, 1, 5, 5], "float32"], [2, 2], [2, 2, 2, 2], [1, 1], "float32"], {}, ["depthwise_conv2d_nchw", [1, 11, 111, 111, "float32"], [11, 1, 5, 5, "float32"], [2, 2], [2, 2, 2, 2], [1, 1], "float32"], {"i": 137368, "t": "direct", "c": "null", "e": [["tile_f", "sp", [-1, 1, 1, 1]], ["tile_y", "sp", [-1, 1, 8, 1]], ["tile_x", "sp", [-1, 1, 56, 1]], ["auto_unroll_max_step", "ot", 1500], ["unroll_explicit", "ot", 1]]}], "r": [[4.024281028170066e-06], 0, 9.029714107513428, 1602226510.223122], "v": 0.1}
{"i": ["cuda -model=unknown", "topi_nn_depthwise_conv2d_nchw", [["TENSOR", [1, 11, 56, 56], "float32"], ["TENSOR", [11, 1, 3, 3], "float32"], [1, 1], [1, 1, 1, 1], [1, 1], "float32"], {}, ["depthwise_conv2d_nchw", [1, 11, 56, 56, "float32"], [11, 1, 3, 3, "float32"], [1, 1], [1, 1, 1, 1], [1, 1], "float32"], {"i": 60568, "t": "direct", "c": "null", "e": [["tile_f", "sp", [-1, 1, 1, 1]], ["tile_y", "sp", [-1, 1, 8, 1]], ["tile_x", "sp", [-1, 1, 56, 1]], ["auto_unroll_max_step", "ot", 1500], ["unroll_explicit", "ot", 0]]}], "r": [[2.850337911370364e-06], 0, 5.405620336532593, 1602228178.849065], "v": 0.1}
{"i": ["cuda -model=unknown", "topi_nn_depthwise_conv2d_nchw", [["TENSOR", [1, 11, 56, 56], "float32"], ["TENSOR", [11, 1, 5, 5], "float32"], [1, 1], [2, 2, 2, 2], [1, 1], "float32"], {}, ["depthwise_conv2d_nchw", [1, 11, 56, 56, "float32"], [11, 1, 5, 5, "float32"], [1, 1], [2, 2, 2, 2], [1, 1], "float32"], {"i": 86168, "t": "direct", "c": "null", "e": [["tile_f", "sp", [-1, 1, 1, 1]], ["tile_y", "sp", [-1, 1, 8, 1]], ["tile_x", "sp", [-1, 1, 56, 1]], ["auto_unroll_max_step", "ot", 0], ["unroll_explicit", "ot", 1]]}], "r": [[3.192592893957226e-06], 0, 8.179243564605713, 1602224006.7659457], "v": 0.1}
{"i": ["cuda -model=unknown", "topi_nn_depthwise_conv2d_nchw", [["TENSOR", [1, 11, 56, 56], "float32"], ["TENSOR", [11, 1, 7, 7], "float32"], [1, 1], [3, 3, 3, 3], [1, 1], "float32"], {}, ["depthwise_conv2d_nchw", [1, 11, 56, 56, "float32"], [11, 1, 7, 7, "float32"], [1, 1], [3, 3, 3, 3], [1, 1], "float32"], {"i": 12968, "t": "direct", "c": "null", "e": [["tile_f", "sp", [-1, 1, 1, 1]], ["tile_y", "sp", [-1, 1, 7, 2]], ["tile_x", "sp", [-1, 1, 4, 2]], ["auto_unroll_max_step", "ot", 0], ["unroll_explicit", "ot", 0]]}], "r": [[3.203309412861137e-06], 0, 9.20886778831482, 1602231537.8878853], "v": 0.1}
{"i": ["cuda -model=unknown", "topi_nn_depthwise_conv2d_nchw", [["TENSOR", [1, 176, 14, 14], "float32"], ["TENSOR", [176, 1, 5, 5], "float32"], [2, 2], [1, 1, 1, 1], [1, 1], "float32"], {}, ["depthwise_conv2d_nchw", [1, 176, 14, 14, "float32"], [176, 1, 5, 5, "float32"], [2, 2], [1, 1, 1, 1], [1, 1], "float32"], {"i": 175840, "t": "direct", "c": "null", "e": [["tile_f", "sp", [-1, 1, 1, 1]], ["tile_y", "sp", [-1, 1, 6, 1]], ["tile_x", "sp", [-1, 1, 2, 3]], ["auto_unroll_max_step", "ot", 256], ["unroll_explicit", "ot", 1]]}], "r": [[2.952888603635505e-06], 0, 8.41095781326294, 1602225927.716492], "v": 0.1}
{"i": ["cuda -model=unknown", "topi_nn_depthwise_conv2d_nchw", [["TENSOR", [1, 176, 14, 14], "float32"], ["TENSOR", [176, 1, 7, 7], "float32"], [2, 2], [2, 2, 2, 2], [1, 1], "float32"], {}, ["depthwise_conv2d_nchw", [1, 176, 14, 14, "float32"], [176, 1, 7, 7, "float32"], [2, 2], [2, 2, 2, 2], [1, 1], "float32"], {"i": 211680, "t": "direct", "c": "null", "e": [["tile_f", "sp", [-1, 1, 1, 1]], ["tile_y", "sp", [-1, 1, 6, 1]], ["tile_x", "sp", [-1, 1, 2, 3]], ["auto_unroll_max_step", "ot", 1500], ["unroll_explicit", "ot", 1]]}], "r": [[3.0378051412634898e-06], 0, 5.699370384216309, 1602229464.6920798], "v": 0.1}
{"i": ["cuda -model=unknown", "topi_nn_depthwise_conv2d_nchw", [["TENSOR", [1, 176, 7, 7], "float32"], ["TENSOR", [176, 1, 3, 3], "float32"], [1, 1], [1, 1, 1, 1], [1, 1], "float32"], {}, ["depthwise_conv2d_nchw", [1, 176, 7, 7, "float32"], [176, 1, 3, 3, "float32"], [1, 1], [1, 1, 1, 1], [1, 1], "float32"], {"i": 3650, "t": "direct", "c": "null", "e": [["tile_f", "sp", [-1, 1, 2, 1]], ["tile_y", "sp", [-1, 1, 7, 1]], ["tile_x", "sp", [-1, 1, 7, 1]], ["auto_unroll_max_step", "ot", 256], ["unroll_explicit", "ot", 0]]}], "r": [[2.7187043195556837e-06], 0, 6.004093170166016, 1602227830.9241004], "v": 0.1}
{"i": ["cuda -model=unknown", "topi_nn_depthwise_conv2d_nchw", [["TENSOR", [1, 176, 7, 7], "float32"], ["TENSOR", [176, 1, 5, 5], "float32"], [1, 1], [2, 2, 2, 2], [1, 1], "float32"], {}, ["depthwise_conv2d_nchw", [1, 176, 7, 7, "float32"], [176, 1, 5, 5, "float32"], [1, 1], [2, 2, 2, 2], [1, 1], "float32"], {"i": 13160, "t": "direct", "c": "null", "e": [["tile_f", "sp", [-1, 1, 1, 1]], ["tile_y", "sp", [-1, 1, 7, 1]], ["tile_x", "sp", [-1, 1, 1, 7]], ["auto_unroll_max_step", "ot", 1500], ["unroll_explicit", "ot", 1]]}], "r": [[2.9361110646041853e-06], 0, 4.606187582015991, 1602228118.130062], "v": 0.1}
{"i": ["cuda -model=unknown", "topi_nn_depthwise_conv2d_nchw", [["TENSOR", [1, 176, 7, 7], "float32"], ["TENSOR", [176, 1, 7, 7], "float32"], [1, 1], [3, 3, 3, 3], [1, 1], "float32"], {}, ["depthwise_conv2d_nchw", [1, 176, 7, 7, "float32"], [176, 1, 7, 7, "float32"], [1, 1], [3, 3, 3, 3], [1, 1], "float32"], {"i": 7033, "t": "direct", "c": "null", "e": [["tile_f", "sp", [-1, 1, 16, 1]], ["tile_y", "sp", [-1, 1, 7, 1]], ["tile_x", "sp", [-1, 1, 1, 1]], ["auto_unroll_max_step", "ot", 0], ["unroll_explicit", "ot", 1]]}], "r": [[2.932882734676071e-06], 0, 6.323442459106445, 1602225752.8258686], "v": 0.1}
{"i": ["cuda -model=unknown", "topi_nn_depthwise_conv2d_nchw", [["TENSOR", [1, 22, 28, 28], "float32"], ["TENSOR", [22, 1, 3, 3], "float32"], [1, 1], [1, 1, 1, 1], [1, 1], "float32"], {}, ["depthwise_conv2d_nchw", [1, 22, 28, 28, "float32"], [22, 1, 3, 3, "float32"], [1, 1], [1, 1, 1, 1], [1, 1], "float32"], {"i": 86564, "t": "direct", "c": "null", "e": [["tile_f", "sp", [-1, 1, 2, 1]], ["tile_y", "sp", [-1, 1, 4, 1]], ["tile_x", "sp", [-1, 1, 14, 1]], ["auto_unroll_max_step", "ot", 0], ["unroll_explicit", "ot", 1]]}], "r": [[2.6790294794387834e-06], 0, 5.440398693084717, 1602225058.6857915], "v": 0.1}
{"i": ["cuda -model=unknown", "topi_nn_depthwise_conv2d_nchw", [["TENSOR", [1, 22, 28, 28], "float32"], ["TENSOR", [22, 1, 5, 5], "float32"], [1, 1], [2, 2, 2, 2], [1, 1], "float32"], {}, ["depthwise_conv2d_nchw", [1, 22, 28, 28, "float32"], [22, 1, 5, 5, "float32"], [1, 1], [2, 2, 2, 2], [1, 1], "float32"], {"i": 112272, "t": "direct", "c": "null", "e": [["tile_f", "sp", [-1, 1, 1, 1]], ["tile_y", "sp", [-1, 1, 28, 1]], ["tile_x", "sp", [-1, 1, 14, 1]], ["auto_unroll_max_step", "ot", 256], ["unroll_explicit", "ot", 1]]}], "r": [[3.074097160196954e-06], 0, 5.182467460632324, 1602234021.7888672], "v": 0.1}
{"i": ["cuda -model=unknown", "topi_nn_depthwise_conv2d_nchw", [["TENSOR", [1, 22, 28, 28], "float32"], ["TENSOR", [22, 1, 7, 7], "float32"], [1, 1], [3, 3, 3, 3], [1, 1], "float32"], {}, ["depthwise_conv2d_nchw", [1, 22, 28, 28, "float32"], [22, 1, 7, 7, "float32"], [1, 1], [3, 3, 3, 3], [1, 1], "float32"], {"i": 144880, "t": "direct", "c": "null", "e": [["tile_f", "sp", [-1, 1, 1, 1]], ["tile_y", "sp", [-1, 1, 14, 1]], ["tile_x", "sp", [-1, 1, 14, 2]], ["auto_unroll_max_step", "ot", 1500], ["unroll_explicit", "ot", 1]]}], "r": [[3.557637138629387e-06], 0, 9.949081420898438, 1602226139.6236646], "v": 0.1}
{"i": ["cuda -model=unknown", "topi_nn_depthwise_conv2d_nchw", [["TENSOR", [1, 22, 56, 56], "float32"], ["TENSOR", [22, 1, 5, 5], "float32"], [2, 2], [1, 1, 1, 1], [1, 1], "float32"], {}, ["depthwise_conv2d_nchw", [1, 22, 56, 56, "float32"], [22, 1, 5, 5, "float32"], [2, 2], [1, 1, 1, 1], [1, 1], "float32"], {"i": 20720, "t": "direct", "c": "null", "e": [["tile_f", "sp", [-1, 1, 1, 1]], ["tile_y", "sp", [-1, 1, 9, 3]], ["tile_x", "sp", [-1, 1, 3, 1]], ["auto_unroll_max_step", "ot", 0], ["unroll_explicit", "ot", 1]]}], "r": [[2.938247869006122e-06], 0, 4.48298716545105, 1602230967.6640158], "v": 0.1}
{"i": ["cuda -model=unknown", "topi_nn_depthwise_conv2d_nchw", [["TENSOR", [1, 22, 56, 56], "float32"], ["TENSOR", [22, 1, 7, 7], "float32"], [2, 2], [2, 2, 2, 2], [1, 1], "float32"], {}, ["depthwise_conv2d_nchw", [1, 22, 56, 56, "float32"], [22, 1, 7, 7, "float32"], [2, 2], [2, 2, 2, 2], [1, 1], "float32"], {"i": 34992, "t": "direct", "c": "null", "e": [["tile_f", "sp", [-1, 1, 1, 1]], ["tile_y", "sp", [-1, 1, 9, 1]], ["tile_x", "sp", [-1, 1, 27, 1]], ["auto_unroll_max_step", "ot", 1500], ["unroll_explicit", "ot", 1]]}], "r": [[4.056616244683005e-06], 0, 5.981404066085815, 1602231631.4162433], "v": 0.1}
{"i": ["cuda -model=unknown", "topi_nn_depthwise_conv2d_nchw", [["TENSOR", [1, 32, 111, 111], "float32"], ["TENSOR", [32, 1, 5, 5], "float32"], [2, 2], [2, 2, 2, 2], [1, 1], "float32"], {}, ["depthwise_conv2d_nchw", [1, 32, 111, 111, "float32"], [32, 1, 5, 5, "float32"], [2, 2], [2, 2, 2, 2], [1, 1], "float32"], {"i": 1923152, "t": "direct", "c": "null", "e": [["tile_f", "sp", [-1, 1, 1, 1]], ["tile_y", "sp", [-1, 1, 8, 1]], ["tile_x", "sp", [-1, 1, 56, 1]], ["auto_unroll_max_step", "ot", 1500], ["unroll_explicit", "ot", 1]]}], "r": [[5.46412331570017e-06], 0, 4.971518039703369, 1602223606.4459932], "v": 0.1}
{"i": ["cuda -model=unknown", "topi_nn_depthwise_conv2d_nchw", [["TENSOR", [1, 32, 111, 111], "float32"], ["TENSOR", [32, 1, 7, 7], "float32"], [2, 2], [3, 3, 3, 3], [1, 1], "float32"], {}, ["depthwise_conv2d_nchw", [1, 32, 111, 111, "float32"], [32, 1, 7, 7, "float32"], [2, 2], [3, 3, 3, 3], [1, 1], "float32"], {"i": 1924160, "t": "direct", "c": "null", "e": [["tile_f", "sp", [-1, 1, 1, 1]], ["tile_y", "sp", [-1, 1, 4, 2]], ["tile_x", "sp", [-1, 1, 56, 1]], ["auto_unroll_max_step", "ot", 1500], ["unroll_explicit", "ot", 1]]}], "r": [[6.928682511376214e-06], 0, 5.667965888977051, 1602230632.9578576], "v": 0.1}
{"i": ["cuda -model=unknown", "topi_nn_depthwise_conv2d_nchw", [["TENSOR", [1, 44, 28, 28], "float32"], ["TENSOR", [44, 1, 3, 3], "float32"], [1, 1], [1, 1, 1, 1], [1, 1], "float32"], {}, ["depthwise_conv2d_nchw", [1, 44, 28, 28, "float32"], [44, 1, 3, 3, "float32"], [1, 1], [1, 1, 1, 1], [1, 1], "float32"], {"i": 24410, "t": "direct", "c": "null", "e": [["tile_f", "sp", [-1, 1, 4, 1]], ["tile_y", "sp", [-1, 1, 4, 1]], ["tile_x", "sp", [-1, 1, 14, 1]], ["auto_unroll_max_step", "ot", 0], ["unroll_explicit", "ot", 0]]}], "r": [[2.8555020585479427e-06], 0, 3.5503976345062256, 1602234191.6457472], "v": 0.1}
{"i": ["cuda -model=unknown", "topi_nn_depthwise_conv2d_nchw", [["TENSOR", [1, 44, 28, 28], "float32"], ["TENSOR", [44, 1, 5, 5], "float32"], [1, 1], [2, 2, 2, 2], [1, 1], "float32"], {}, ["depthwise_conv2d_nchw", [1, 44, 28, 28, "float32"], [44, 1, 5, 5, "float32"], [1, 1], [2, 2, 2, 2], [1, 1], "float32"], {"i": 284240, "t": "direct", "c": "null", "e": [["tile_f", "sp", [-1, 1, 1, 1]], ["tile_y", "sp", [-1, 1, 14, 2]], ["tile_x", "sp", [-1, 1, 28, 1]], ["auto_unroll_max_step", "ot", 256], ["unroll_explicit", "ot", 1]]}], "r": [[3.4427392378113686e-06], 0, 10.132624387741089, 1602229994.921316], "v": 0.1}
{"i": ["cuda -model=unknown", "topi_nn_depthwise_conv2d_nchw", [["TENSOR", [1, 88, 14, 14], "float32"], ["TENSOR", [88, 1, 3, 3], "float32"], [1, 1], [1, 1, 1, 1], [1, 1], "float32"], {}, ["depthwise_conv2d_nchw", [1, 88, 14, 14, "float32"], [88, 1, 3, 3, "float32"], [1, 1], [1, 1, 1, 1], [1, 1], "float32"], {"i": 8320, "t": "direct", "c": "null", "e": [["tile_f", "sp", [-1, 1, 1, 1]], ["tile_y", "sp", [-1, 1, 14, 1]], ["tile_x", "sp", [-1, 1, 7, 1]], ["auto_unroll_max_step", "ot", 0], ["unroll_explicit", "ot", 0]]}], "r": [[2.802014064382372e-06], 0, 8.34169864654541, 1602223490.483694], "v": 0.1}
{"i": ["cuda -model=unknown", "topi_nn_depthwise_conv2d_nchw", [["TENSOR", [1, 88, 14, 14], "float32"], ["TENSOR", [88, 1, 5, 5], "float32"], [1, 1], [2, 2, 2, 2], [1, 1], "float32"], {}, ["depthwise_conv2d_nchw", [1, 88, 14, 14, "float32"], [88, 1, 5, 5, "float32"], [1, 1], [2, 2, 2, 2], [1, 1], "float32"], {"i": 51840, "t": "direct", "c": "null", "e": [["tile_f", "sp", [-1, 1, 1, 1]], ["tile_y", "sp", [-1, 1, 14, 1]], ["tile_x", "sp", [-1, 1, 14, 1]], ["auto_unroll_max_step", "ot", 1500], ["unroll_explicit", "ot", 0]]}], "r": [[3.013546022188772e-06], 0, 3.0101308822631836, 1602233677.2128181], "v": 0.1}
{"i": ["cuda -model=unknown", "topi_nn_depthwise_conv2d_nchw", [["TENSOR", [1, 88, 14, 14], "float32"], ["TENSOR", [88, 1, 7, 7], "float32"], [1, 1], [3, 3, 3, 3], [1, 1], "float32"], {}, ["depthwise_conv2d_nchw", [1, 88, 14, 14, "float32"], [88, 1, 7, 7, "float32"], [1, 1], [3, 3, 3, 3], [1, 1], "float32"], {"i": 21134, "t": "direct", "c": "null", "e": [["tile_f", "sp", [-1, 1, 4, 1]], ["tile_y", "sp", [-1, 1, 14, 1]], ["tile_x", "sp", [-1, 1, 1, 1]], ["auto_unroll_max_step", "ot", 256], ["unroll_explicit", "ot", 0]]}], "r": [[3.5753113147004806e-06], 0, 4.232363939285278, 1602233687.480372], "v": 0.1}
{"i": ["cuda -model=unknown", "topi_nn_depthwise_conv2d_nchw", [["TENSOR", [1, 88, 28, 28], "float32"], ["TENSOR", [88, 1, 5, 5], "float32"], [2, 2], [1, 1, 1, 1], [1, 1], "float32"], {}, ["depthwise_conv2d_nchw", [1, 88, 28, 28, "float32"], [88, 1, 5, 5, "float32"], [2, 2], [1, 1, 1, 1], [1, 1], "float32"], {"i": 7200, "t": "direct", "c": "null", "e": [["tile_f", "sp", [-1, 1, 1, 1]], ["tile_y", "sp", [-1, 1, 13, 1]], ["tile_x", "sp", [-1, 1, 13, 1]], ["auto_unroll_max_step", "ot", 1500], ["unroll_explicit", "ot", 1]]}], "r": [[3.728647326796781e-06], 0, 6.4767773151397705, 1602231653.1363697], "v": 0.1}
{"i": ["cuda -model=unknown", "topi_nn_depthwise_conv2d_nchw", [["TENSOR", [1, 88, 28, 28], "float32"], ["TENSOR", [88, 1, 7, 7], "float32"], [2, 2], [2, 2, 2, 2], [1, 1], "float32"], {}, ["depthwise_conv2d_nchw", [1, 88, 28, 28, "float32"], [88, 1, 7, 7, "float32"], [2, 2], [2, 2, 2, 2], [1, 1], "float32"], {"i": 5920, "t": "direct", "c": "null", "e": [["tile_f", "sp", [-1, 1, 1, 1]], ["tile_y", "sp", [-1, 1, 13, 1]], ["tile_x", "sp", [-1, 1, 13, 1]], ["auto_unroll_max_step", "ot", 256], ["unroll_explicit", "ot", 1]]}], "r": [[4.407588412146201e-06], 0, 5.594597578048706, 1602227772.738838], "v": 0.1}
{"i": ["cuda -model=unknown", "topi_nn_dense", [["TENSOR", [1, 256], "float32"], ["TENSOR", [10, 256], "float32"], "null", "float32"], {}, ["dense", [1, 256, "float32"], [10, 256, "float32"], 0, "float32"], {"i": 8, "t": "direct", "c": "null", "e": [["tile_k", "sp", [-1, 256]]]}], "r": [[7.119619093143949e-06], 0, 1.284017562866211, 1598593296.1895127], "v": 0.1}
{"i": ["cuda -model=unknown", "topi_nn_dense", [["TENSOR", [1, 256], "float32"], ["TENSOR", [256, 256], "float32"], "null", "float32"], {}, ["dense", [1, 256, "float32"], [256, 256, "float32"], 0, "float32"], {"i": 4, "t": "direct", "c": "null", "e": [["tile_k", "sp", [-1, 16]]]}], "r": [[3.9272943868360844e-06], 0, 1.4874000549316406, 1589560142.521217], "v": 0.1}
{"i": ["cuda -model=unknown", "topi_nn_dense", [["TENSOR", [1, 256], "float32"], ["TENSOR", [512, 256], "float32"], "null", "float32"], {}, ["dense", [1, 256, "float32"], [512, 256, "float32"], 0, "float32"], {"i": 4, "t": "direct", "c": "null", "e": [["tile_k", "sp", [-1, 16]]]}], "r": [[5.024689582707895e-06], 0, 1.3716530799865723, 1589560159.4024322], "v": 0.1}
{"i": ["cuda -model=unknown", "topi_nn_dense", [["TENSOR", [1, 3008], "float32"], ["TENSOR", [1024, 3008], "float32"], "null", "float32"], {}, ["dense", [1, 3008, "float32"], [1024, 3008, "float32"], 0, "float32"], {"i": 6, "t": "direct", "c": "null", "e": [["tile_k", "sp", [-1, 47]]]}], "r": [[5.9568462432223085e-05], 0, 1.3421120643615723, 1589560183.268977], "v": 0.1}
{"i": ["cuda -model=unknown", "topi_nn_dense", [["TENSOR", [1, 4096], "float32"], ["TENSOR", [1000, 4096], "float32"], "null", "float32"], {}, ["dense", [1, 4096, "float32"], [1000, 4096, "float32"], 0, "float32"], {"i": 8, "t": "direct", "c": "null", "e": [["tile_k", "sp", [-1, 256]]]}], "r": [[2.2283410278594915e-05], 0, 1.5587024688720703, 1598593229.759367], "v": 0.1}
{"i": ["cuda -model=unknown", "topi_nn_dense", [["TENSOR", [1, 4096], "float32"], ["TENSOR", [4096, 4096], "float32"], "null", "float32"], {}, ["dense", [1, 4096, "float32"], [4096, 4096, "float32"], 0, "float32"], {"i": 7, "t": "direct", "c": "null", "e": [["tile_k", "sp", [-1, 128]]]}], "r": [[7.976237737003058e-05], 0, 1.402946949005127, 1598593247.1999054], "v": 0.1}
{"i": ["cuda -model=unknown", "topi_nn_dense", [["TENSOR", [1, 512], "float32"], ["TENSOR", [1024, 512], "float32"], "null", "float32"], {}, ["dense", [1, 512, "float32"], [1024, 512, "float32"], 0, "float32"], {"i": 6, "t": "direct", "c": "null", "e": [["tile_k", "sp", [-1, 64]]]}], "r": [[1.1998259975816204e-05], 0, 1.204136848449707, 1589560166.276897], "v": 0.1}
{"i": ["cuda -model=unknown", "topi_nn_dense", [["TENSOR", [16, 256], "float32"], ["TENSOR", [10, 256], "float32"], "null", "float32"], {}, ["dense", [16, 256, "float32"], [10, 256, "float32"], 0, "float32"], {"i": 5, "t": "direct", "c": "null", "e": [["tile_k", "sp", [-1, 32]]]}], "r": [[6.603096429699842e-06], 0, 1.0251591205596924, 1598593308.709378], "v": 0.1}
{"i": ["cuda -model=unknown", "topi_nn_dense", [["TENSOR", [16, 256], "float32"], ["TENSOR", [256, 256], "float32"], "null", "float32"], {}, ["dense", [16, 256, "float32"], [256, 256, "float32"], 0, "float32"], {"i": 4, "t": "direct", "c": "null", "e": [["tile_k", "sp", [-1, 16]]]}], "r": [[2.0001653888888887e-05], 0, 1.2540984153747559, 1589560233.508413], "v": 0.1}
{"i": ["cuda -model=unknown", "topi_nn_dense", [["TENSOR", [16, 256], "float32"], ["TENSOR", [512, 256], "float32"], "null", "float32"], {}, ["dense", [16, 256, "float32"], [512, 256, "float32"], 0, "float32"], {"i": 4, "t": "direct", "c": "null", "e": [["tile_k", "sp", [-1, 16]]]}], "r": [[3.7067250524109015e-05], 0, 1.1381449699401855, 1589560245.4277914], "v": 0.1}
{"i": ["cuda -model=unknown", "topi_nn_dense", [["TENSOR", [16, 3008], "float32"], ["TENSOR", [1024, 3008], "float32"], "null", "float32"], {}, ["dense", [16, 3008, "float32"], [1024, 3008, "float32"], 0, "float32"], {"i": 1, "t": "direct", "c": "null", "e": [["tile_k", "sp", [-1, 2]]]}], "r": [[0.0008494241534391535], 0, 1.3481941223144531, 1589560266.8103316], "v": 0.1}
{"i": ["cuda -model=unknown", "topi_nn_dense", [["TENSOR", [16, 512], "float32"], ["TENSOR", [1024, 512], "float32"], "null", "float32"], {}, ["dense", [16, 512, "float32"], [1024, 512, "float32"], 0, "float32"], {"i": 4, "t": "direct", "c": "null", "e": [["tile_k", "sp", [-1, 16]]]}], "r": [[0.00013083893075020608], 0, 1.2828025817871094, 1589560253.6325924], "v": 0.1}
{"i": ["cuda -model=unknown", "topi_nn_dense", [["TENSOR", [1, 768], "float32"], ["TENSOR", [10, 768], "float32"], "null", "float32"], {}, ["dense", [1, 768, "float32"], [10, 768, "float32"], 0, "float32"], {"i": 12, "t": "direct", "c": "null", "e": [["tile_k", "sp", [-1, 96]]]}], "r": [[6.673082214002985e-06], 0, 1.8757774829864502, 1598593333.7451859], "v": 0.1}
{"i": ["cuda -model=unknown", "topi_nn_dense", [["TENSOR", [1, 9216], "float32"], ["TENSOR", [4096, 9216], "float32"], "null", "float32"], {}, ["dense", [1, 9216, "float32"], [4096, 9216, "float32"], 0, "float32"], {"i": 23, "t": "direct", "c": "null", "e": [["tile_k", "sp", [-1, 512]]]}], "r": [[0.00017370986946902653], 0, 1.4507246017456055, 1598593286.0772245], "v": 0.1}
{"i": ["cuda -model=unknown", "topi_nn_dense", [["TENSOR", [4, 256], "float32"], ["TENSOR", [10, 256], "float32"], "null", "float32"], {}, ["dense", [4, 256, "float32"], [10, 256, "float32"], 0, "float32"], {"i": 4, "t": "direct", "c": "null", "e": [["tile_k", "sp", [-1, 16]]]}], "r": [[7.105159726413197e-06], 0, 1.1798827648162842, 1598593300.8982306], "v": 0.1}
{"i": ["cuda -model=unknown", "topi_nn_dense", [["TENSOR", [4, 256], "float32"], ["TENSOR", [256, 256], "float32"], "null", "float32"], {}, ["dense", [4, 256, "float32"], [256, 256, "float32"], 0, "float32"], {"i": 4, "t": "direct", "c": "null", "e": [["tile_k", "sp", [-1, 16]]]}], "r": [[7.486124244812187e-06], 0, 1.1337227821350098, 1589560193.985609], "v": 0.1}
{"i": ["cuda -model=unknown", "topi_nn_dense", [["TENSOR", [4, 256], "float32"], ["TENSOR", [512, 256], "float32"], "null", "float32"], {}, ["dense", [4, 256, "float32"], [512, 256, "float32"], 0, "float32"], {"i": 4, "t": "direct", "c": "null", "e": [["tile_k", "sp", [-1, 16]]]}], "r": [[1.2148426406135866e-05], 0, 1.2635562419891357, 1589560200.9748697], "v": 0.1}
{"i": ["cuda -model=unknown", "topi_nn_dense", [["TENSOR", [4, 3008], "float32"], ["TENSOR", [1024, 3008], "float32"], "null", "float32"], {}, ["dense", [4, 3008, "float32"], [1024, 3008, "float32"], 0, "float32"], {"i": 7, "t": "direct", "c": "null", "e": [["tile_k", "sp", [-1, 64]]]}], "r": [[0.00022879437268847794], 0, 1.3795244693756104, 1589560219.5618052], "v": 0.1}
{"i": ["cuda -model=unknown", "topi_nn_dense", [["TENSOR", [4, 512], "float32"], ["TENSOR", [1024, 512], "float32"], "null", "float32"], {}, ["dense", [4, 512, "float32"], [1024, 512, "float32"], 0, "float32"], {"i": 5, "t": "direct", "c": "null", "e": [["tile_k", "sp", [-1, 32]]]}], "r": [[4.001029968203498e-05], 0, 1.2714850902557373, 1589560214.5653963], "v": 0.1}
{"i": ["cuda -model=unknown", "topi_nn_dense", [["TENSOR", [75, 256], "float32"], ["TENSOR", [29, 256], "float32"], "null", "float32"], {}, ["dense", [75, 256, "float32"], [29, 256, "float32"], 0, "float32"], {"i": 5938, "t": "direct", "c": "null", "e": [["tile_x", "sp", [-1, 1, 1, 3]], ["tile_y", "sp", [-1, 1, 1, 1]], ["tile_k", "sp", [-1, 4, 32]]]}], "r": [[2.2543779026217227e-05], 0, 2.3667452335357666, 1598596415.2916846], "v": 0.1}
{"i": ["cuda -model=unknown", "topi_nn_dense", [["TENSOR", [1, 1056], "float32"], ["TENSOR", [1000, 1056], "float32"], "null", "float32"], {}, ["dense", [1, 1056, "float32"], [1000, 1056, "float32"], 0, "float32"], {"i": 18, "t": "direct", "c": "null", "e": [["tile_k", "sp", [-1, 132]]]}], "r": [[5.306785202983431e-06], 0, 2.7725157737731934, 1604049772.6183417], "v": 0.1}
{"i": ["cuda -model=unknown", "topi_nn_dense", [["TENSOR", [1, 2048], "float32"], ["TENSOR", [1000, 2048], "float32"], "null", "float32"], {}, ["dense", [1, 2048, "float32"], [1000, 2048, "float32"], 0, "float32"], {"i": 8, "t": "direct", "c": "null", "e": [["tile_k", "sp", [-1, 256]]]}], "r": [[1.268038298541907e-05], 0, 1.7815313339233398, 1604049737.3615065], "v": 0.1}
