artifacts/figure10/tvm/autotvm_kernels/relay_alexnet_nchw_tuned.1000.log
{"i": ["cuda -model=unknown", "topi_nn_conv2d", [["TENSOR", [1, 192, 13, 13], "float32"], ["TENSOR", [384, 192, 3, 3], "float32"], [1, 1], [1, 1, 1, 1], [1, 1], "NCHW", "float32"], {}, ["conv2d", [1, 192, 13, 13, "float32"], [384, 192, 3, 3, "float32"], [1, 1], [1, 1, 1, 1], [1, 1], "NCHW", "float32"], {"i": 113578, "t": "direct", "c": "null", "e": [["tile_f", "sp", [-1, 1, 2, 6]], ["tile_y", "sp", [-1, 1, 1, 1]], ["tile_x", "sp", [-1, 1, 1, 13]], ["tile_rc", "sp", [-1, 1]], ["tile_ry", "sp", [-1, 3]], ["tile_rx", "sp", [-1, 1]], ["auto_unroll_max_step", "ot", 0], ["unroll_explicit", "ot", 0]]}], "r": [[0.0016709095], 0, 1.9067118167877197, 1589313680.1428764], "v": 0.1}
{"i": ["cuda -model=unknown", "topi_nn_conv2d", [["TENSOR", [1, 192, 13, 13], "float32"], ["TENSOR", [384, 192, 3, 3], "float32"], [1, 1], [1, 1, 1, 1], [1, 1], "NCHW", "float32"], {}, ["conv2d", [1, 192, 13, 13, "float32"], [384, 192, 3, 3, "float32"], [1, 1], [1, 1, 1, 1], [1, 1], "NCHW", "float32"], {"i": 1442034, "t": "direct", "c": "null", "e": [["tile_f", "sp", [-1, 12, 1, 2]], ["tile_y", "sp", [-1, 1, 1, 1]], ["tile_x", "sp", [-1, 1, 1, 13]], ["tile_rc", "sp", [-1, 8]], ["tile_ry", "sp", [-1, 3]], ["tile_rx", "sp", [-1, 1]], ["auto_unroll_max_step", "ot", 0], ["unroll_explicit", "ot", 1]]}], "r": [[0.0515898425], 0, 2.7448432445526123, 1589313682.3744543], "v": 0.1}
{"i": ["cuda -model=unknown", "topi_nn_conv2d", [["TENSOR", [1, 192, 13, 13], "float32"], ["TENSOR", [384, 192, 3, 3], "float32"], [1, 1], [1, 1, 1, 1], [1, 1], "NCHW", "float32"], {}, ["conv2d", [1, 192, 13, 13, "float32"], [384, 192, 3, 3, "float32"], [1, 1], [1, 1, 1, 1], [1, 1], "NCHW", "float32"], {"i": 2499567, "t": "direct", "c": "null", "e": [["tile_f", "sp", [-1, 1, 4, 3]], ["tile_y", "sp", [-1, 1, 1, 13]], ["tile_x", "sp", [-1, 13, 1, 1]], ["tile_rc", "sp", [-1, 4]], ["tile_ry", "sp", [-1, 3]], ["tile_rx", "sp", [-1, 3]], ["auto_unroll_max_step", "ot", 1500], ["unroll_explicit", "ot", 1]]}], "r": [[0.01251205925], 0, 6.291043519973755, 1589313687.0599554], "v": 0.1}
{"i": ["cuda -model=unknown", "topi_nn_conv2d", [["TENSOR", [1, 192, 13, 13], "float32"], ["TENSOR", [384, 192, 3, 3], "float32"], [1, 1], [1, 1, 1, 1], [1, 1], "NCHW", "float32"], {}, ["conv2d", [1, 192, 13, 13, "float32"], [384, 192, 3, 3, "float32"], [1, 1], [1, 1, 1, 1], [1, 1], "NCHW", "float32"], {"i": 2390434, "t": "direct", "c": "null", "e": [["tile_f", "sp", [-1, 16, 3, 1]], ["tile_y", "sp", [-1, 1, 1, 1]], ["tile_x", "sp", [-1, 13, 1, 1]], ["tile_rc", "sp", [-1, 4]], ["tile_ry", "sp", [-1, 1]], ["tile_rx", "sp", [-1, 3]], ["auto_unroll_max_step", "ot", 1500], ["unroll_explicit", "ot", 1]]}], "r": [[0.0013988854999999998], 0, 3.1080336570739746, 1589313689.101049], "v": 0.1}
{"i": ["cuda -model=unknown", "topi_nn_conv2d", [["TENSOR", [1, 192, 13, 13], "float32"], ["TENSOR", [384, 192, 3, 3], "float32"], [1, 1], [1, 1, 1, 1], [1, 1], "NCHW", "float32"], {}, ["conv2d", [1, 192, 13, 13, "float32"], [384, 192, 3, 3, "float32"], [1, 1], [1, 1, 1, 1], [1, 1], "NCHW", "float32"], {"i": 1952100, "t": "direct", "c": "null", "e": [["tile_f", "sp", [-1, 1, 2, 24]], ["tile_y", "sp", [-1, 1, 13, 1]], ["tile_x", "sp", [-1, 1, 1, 1]], ["tile_rc", "sp", [-1, 3]], ["tile_ry", "sp", [-1, 1]], ["tile_rx", "sp", [-1, 3]], ["auto_unroll_max_step", "ot", 512], ["unroll_explicit", "ot", 1]]}], "r": [[0.0003828738948655257], 0, 2.197331666946411, 1589313690.8855586], "v": 0.1}
{"i": ["cuda -model=unknown", "topi_nn_conv2d", [["TENSOR", [1, 192, 13, 13], "float32"], ["TENSOR", [384, 192, 3, 3], "float32"], [1, 1], [1, 1, 1, 1], [1, 1], "NCHW", "float32"], {}, ["conv2d", [1, 192, 13, 13, "float32"], [384, 192, 3, 3, "float32"], [1, 1], [1, 1, 1, 1], [1, 1], "NCHW", "float32"], {"i": 2297793, "t": "direct", "c": "null", "e": [["tile_f", "sp", [-1, 8, 3, 1]], ["tile_y", "sp", [-1, 1, 1, 13]], ["tile_x", "sp", [-1, 1, 1, 1]], ["tile_rc", "sp", [-1, 8]], ["tile_ry", "sp", [-1, 3]], ["tile_rx", "sp", [-1, 1]], ["auto_unroll_max_step", "ot", 1500], ["unroll_explicit", "ot", 1]]}], "r": [[0.0007680904000000001], 0, 2.773171901702881, 1589313692.7778113], "v": 0.1}
{"i": ["cuda -model=unknown", "topi_nn_conv2d", [["TENSOR", [1, 192, 13, 13], "float32"], ["TENSOR", [384, 192, 3, 3], "float32"], [1, 1], [1, 1, 1, 1], [1, 1], "NCHW", "float32"], {}, ["conv2d", [1, 192, 13, 13, "float32"], [384, 192, 3, 3, "float32"], [1, 1], [1, 1, 1, 1], [1, 1], "NCHW", "float32"], {"i": 1376512, "t": "direct", "c": "null", "e": [["tile_f", "sp", [-1, 1, 8, 8]], ["tile_y", "sp", [-1, 1, 1, 13]], ["tile_x", "sp", [-1, 1, 1, 1]], ["tile_rc", "sp", [-1, 64]], ["tile_ry", "sp", [-1, 1]], ["tile_rx", "sp", [-1, 1]], ["auto_unroll_max_step", "ot", 0], ["unroll_explicit", "ot", 1]]}], "r": [[0.001054264957894737], 0, 1.8740925788879395, 1589313694.5178542], "v": 0.1}
{"i": ["cuda -model=unknown", "topi_nn_conv2d", [["TENSOR", [1, 192, 13, 13], "float32"], ["TENSOR", [384, 192, 3, 3], "float32"], [1, 1], [1, 1, 1, 1], [1, 1], "NCHW", "float32"], {}, ["conv2d", [1, 192, 13, 13, "float32"], [384, 192, 3, 3, "float32"], [1, 1], [1, 1, 1, 1], [1, 1], "NCHW", "float32"], {"i": 1156323, "t": "direct", "c": "null", "e": [["tile_f", "sp", [-1, 4, 1, 1]], ["tile_y", "sp", [-1, 13, 1, 1]], ["tile_x", "sp", [-1, 1, 13, 1]], ["tile_rc", "sp", [-1, 48]], ["tile_ry", "sp", [-1, 1]], ["tile_rx", "sp", [-1, 3]], ["auto_unroll_max_step", "ot", 1500], ["unroll_explicit", "ot", 0]]}], "r": [[0.000483427006006006], 0, 4.463346481323242, 1589313696.4079902], "v": 0.1}
{"i": ["cuda -model=unknown", "topi_nn_conv2d", [["TENSOR", [1, 192, 13, 13], "float32"], ["TENSOR", [384, 192, 3, 3], "float32"], [1, 1], [1, 1, 1, 1], [1, 1], "NCHW", "float32"], {}, ["conv2d", [1, 192, 13, 13, "float32"], [384, 192, 3, 3, "float32"], [1, 1], [1, 1, 1, 1], [1, 1], "NCHW", "float32"], {"i": 584764, "t": "direct", "c": "null", "e": [["tile_f", "sp", [-1, 3, 2, 2]], ["tile_y", "sp", [-1, 1, 13, 1]], ["tile_x", "sp", [-1, 1, 1, 1]], ["tile_rc", "sp", [-1, 12]], ["tile_ry", "sp", [-1, 3]], ["tile_rx", "sp", [-1, 1]], ["auto_unroll_max_step", "ot", 512], ["unroll_explicit", "ot", 0]]}], "r": [[0.0002787991655052265], 0, 2.2110595703125, 1589313698.4455905], "v": 0.1}
{"i": ["cuda -model=unknown", "topi_nn_conv2d", [["TENSOR", [1, 192, 13, 13], "float32"], ["TENSOR", [384, 192, 3, 3], "float32"], [1, 1], [1, 1, 1, 1], [1, 1], "NCHW", "float32"], {}, ["conv2d", [1, 192, 13, 13, "float32"], [384, 192, 3, 3, "float32"], [1, 1], [1, 1, 1, 1], [1, 1], "NCHW", "float32"], {"i": 704169, "t": "direct", "c": "null", "e": [["tile_f", "sp", [-1, 32, 1, 1]], ["tile_y", "sp", [-1, 1, 1, 13]], ["tile_x", "sp", [-1, 1, 13, 1]], ["tile_rc", "sp", [-1, 16]], ["tile_ry", "sp", [-1, 1]], ["tile_rx", "sp", [-1, 3]], ["auto_unroll_max_step", "ot", 512], ["unroll_explicit", "ot", 0]]}], "r": [[0.008057041307692307], 0, 5.612605094909668, 1589313701.430734], "v": 0.1}
{"i": ["cuda -model=unknown", "topi_nn_conv2d", [["TENSOR", [1, 192, 13, 13], "float32"], ["TENSOR", [384, 192, 3, 3], "float32"], [1, 1], [1, 1, 1, 1], [1, 1], "NCHW", "float32"], {}, ["conv2d", [1, 192, 13, 13, "float32"], [384, 192, 3, 3, "float32"], [1, 1], [1, 1, 1, 1], [1, 1], "NCHW", "float32"], {"i": 655975, "t": "direct", "c": "null", "e": [["tile_f", "sp", [-1, 16, 1, 6]], ["tile_y", "sp", [-1, 1, 13, 1]], ["tile_x", "sp", [-1, 13, 1, 1]], ["tile_rc", "sp", [-1, 2]], ["tile_ry", "sp", [-1, 1]], ["tile_rx", "sp", [-1, 3]], ["auto_unroll_max_step", "ot", 512], ["unroll_explicit", "ot", 0]]}], "r": [[0.037237036], 0, 2.6538987159729004, 1589313703.62789], "v": 0.1}
{"i": ["cuda -model=unknown", "topi_nn_conv2d", [["TENSOR", [1, 192, 13, 13], "float32"], ["TENSOR", [384, 192, 3, 3], "float32"], [1, 1], [1, 1, 1, 1], [1, 1], "NCHW", "float32"], {}, ["conv2d", [1, 192, 13, 13, "float32"], [384, 192, 3, 3, "float32"], [1, 1], [1, 1, 1, 1], [1, 1], "NCHW", "float32"], {"i": 544384, "t": "direct", "c": "null", "e": [["tile_f", "sp", [-1, 16, 8, 1]], ["tile_y", "sp", [-1, 1, 13, 1]], ["tile_x", "sp", [-1, 1, 1, 13]], ["tile_rc", "sp", [-1, 1]], ["tile_ry", "sp", [-1, 3]], ["tile_rx", "sp", [-1, 1]], ["auto_unroll_max_step", "ot", 512], ["unroll_explicit", "ot", 0]]}], "r": [[0.0013058605064935065], 0, 1.6335976123809814, 1589313705.3448625], "v": 0.1}
{"i": ["cuda -model=unknown", "topi_nn_conv2d", [["TENSOR", [1, 192, 13, 13], "float32"], ["TENSOR", [384, 192, 3, 3], "float32"], [1, 1], [1, 1, 1, 1], [1, 1], "NCHW", "float32"], {}, ["conv2d", [1, 192, 13, 13, "float32"], [384, 192, 3, 3, "float32"], [1, 1], [1, 1, 1, 1], [1, 1], "NCHW", "float32"], {"i": 277523, "t": "direct", "c": "null", "e": [["tile_f", "sp", [-1, 4, 24, 1]], ["tile_y", "sp", [-1, 1, 13, 1]], ["tile_x", "sp", [-1, 1, 1, 1]], ["tile_rc", "sp", [-1, 24]], ["tile_ry", "sp", [-1, 1]], ["tile_rx", "sp", [-1, 3]], ["auto_unroll_max_step", "ot", 0], ["unroll_explicit", "ot", 0]]}], "r": [[0.00031914755089820356], 0, 2.4416041374206543, 1589313718.1174717], "v": 0.1}
{"i": ["cuda -model=unknown", "topi_nn_conv2d", [["TENSOR", [1, 192, 13, 13], "float32"], ["TENSOR", [384, 192, 3, 3], "float32"], [1, 1], [1, 1, 1, 1], [1, 1], "NCHW", "float32"], {}, ["conv2d", [1, 192, 13, 13, "float32"], [384, 192, 3, 3, "float32"], [1, 1], [1, 1, 1, 1], [1, 1], "NCHW", "float32"], {"i": 1733620, "t": "direct", "c": "null", "e": [["tile_f", "sp", [-1, 8, 3, 8]], ["tile_y", "sp", [-1, 1, 1, 13]], ["tile_x", "sp", [-1, 1, 13, 1]], ["tile_rc", "sp", [-1, 2]], ["tile_ry", "sp", [-1, 1]], ["tile_rx", "sp", [-1, 1]], ["auto_unroll_max_step", "ot", 512], ["unroll_explicit", "ot", 1]]}], "r": [[0.064731356], 0, 3.0071709156036377, 1589313720.4163966], "v": 0.1}
{"i": ["cuda -model=unknown", "topi_nn_conv2d", [["TENSOR", [1, 192, 13, 13], "float32"], ["TENSOR", [384, 192, 3, 3], "float32"], [1, 1], [1, 1, 1, 1], [1, 1], "NCHW", "float32"], {}, ["conv2d", [1, 192, 13, 13, "float32"], [384, 192, 3, 3, "float32"], [1, 1], [1, 1, 1, 1], [1, 1], "NCHW", "float32"], {"i": 927037, "t": "direct", "c": "null", "e": [["tile_f", "sp", [-1, 1, 8, 2]], ["tile_y", "sp", [-1, 1, 1, 13]], ["tile_x", "sp", [-1, 1, 13, 1]], ["tile_rc", "sp", [-1, 24]], ["tile_ry", "sp", [-1, 1]], ["tile_rx", "sp", [-1, 1]], ["auto_unroll_max_step", "ot", 1500], ["unroll_explicit", "ot", 0]]}], "r": [[0.00030693519018404905], 0, 2.3728907108306885, 1589313722.41764], "v": 0.1}
{"i": ["cuda -model=unknown", "topi_nn_conv2d", [["TENSOR", [1, 192, 13, 13], "float32"], ["TENSOR", [384, 192, 3, 3], "float32"], [1, 1], [1, 1, 1, 1], [1, 1], "NCHW", "float32"], {}, ["conv2d", [1, 192, 13, 13, "float32"], [384, 192, 3, 3, "float32"], [1, 1], [1, 1, 1, 1], [1, 1], "NCHW", "float32"], {"i": 185319, "t": "direct", "c": "null", "e": [["tile_f", "sp", [-1, 2, 4, 1]], ["tile_y", "sp", [-1, 1, 13, 1]], ["tile_x", "sp", [-1, 1, 1, 1]], ["tile_rc", "sp", [-1, 48]], ["tile_ry", "sp", [-1, 3]], ["tile_rx", "sp", [-1, 1]], ["auto_unroll_max_step", "ot", 0], ["unroll_explicit", "ot", 0]]}], "r": [[0.00025507224920127795], 0, 2.2735342979431152, 1589313724.5910084], "v": 0.1}
{"i": ["cuda -model=unknown", "topi_nn_conv2d", [["TENSOR", [1, 192, 13, 13], "float32"], ["TENSOR", [384, 192, 3, 3], "float32"], [1, 1], [1, 1, 1, 1], [1, 1], "NCHW", "float32"], {}, ["conv2d", [1, 192, 13, 13, "float32"], [384, 192, 3, 3, "float32"], [1, 1], [1, 1, 1, 1], [1, 1], "NCHW", "float32"], {"i": 1831952, "t": "direct", "c": "null", "e": [["tile_f", "sp", [-1, 4, 8, 4]], ["tile_y", "sp", [-1, 1, 1, 1]], ["tile_x", "sp", [-1, 1, 13, 1]], ["tile_rc", "sp", [-1, 1]], ["tile_ry", "sp", [-1, 3]], ["tile_rx", "sp", [-1, 1]], ["auto_unroll_max_step", "ot", 512], ["unroll_explicit", "ot", 1]]}], "r": [[0.0004407184203296703], 0, 2.180474042892456, 1589313726.5057108], "v": 0.1}
{"i": ["cuda -model=unknown", "topi_nn_conv2d", [["TENSOR", [1, 192, 13, 13], "float32"], ["TENSOR", [384, 192, 3, 3], "float32"], [1, 1], [1, 1, 1, 1], [1, 1], "NCHW", "float32"], {}, ["conv2d", [1, 192, 13, 13, "float32"], [384, 192, 3, 3, "float32"], [1, 1], [1, 1, 1, 1], [1, 1], "NCHW", "float32"], {"i": 115314, "t": "direct", "c": "null", "e": [["tile_f", "sp", [-1, 12, 1, 2]], ["tile_y", "sp", [-1, 1, 1, 1]], ["tile_x", "sp", [-1, 1, 1, 1]], ["tile_rc", "sp", [-1, 2]], ["tile_ry", "sp", [-1, 3]], ["tile_rx", "sp", [-1, 1]], ["auto_unroll_max_step", "ot", 0], ["unroll_explicit", "ot", 0]]}], "r": [[0.003668103357142857], 0, 1.9964501857757568, 1589313728.083705], "v": 0.1}
{"i": ["cuda -model=unknown", "topi_nn_conv2d", [["TENSOR", [1, 192, 13, 13], "float32"], ["TENSOR", [384, 192, 3, 3], "float32"], [1, 1], [1, 1, 1, 1], [1, 1], "NCHW", "float32"], {}, ["conv2d", [1, 192, 13, 13, "float32"], [384, 192, 3, 3, "float32"], [1, 1], [1, 1, 1, 1], [1, 1], "NCHW", "float32"], {"i": 1977080, "t": "direct", "c": "null", "e": [["tile_f", "sp", [-1, 1, 3, 32]], ["tile_y", "sp", [-1, 1, 13, 1]], ["tile_x", "sp", [-1, 13, 1, 1]], ["tile_rc", "sp", [-1, 8]], ["tile_ry", "sp", [-1, 1]], ["tile_rx", "sp", [-1, 3]], ["auto_unroll_max_step", "ot", 512], ["unroll_explicit", "ot", 1]]}], "r": [[0.008354413833333333], 0, 4.253460645675659, 1589313730.3784564], "v": 0.1}
{"i": ["cuda -model=unknown", "topi_nn_conv2d", [["TENSOR", [1, 192, 13, 13], "float32"], ["TENSOR", [384, 192, 3, 3], "float32"], [1, 1], [1, 1, 1, 1], [1, 1], "NCHW", "float32"], {}, ["conv2d", [1, 192, 13, 13, "float32"], [384, 192, 3, 3, "float32"], [1, 1], [1, 1, 1, 1], [1, 1], "NCHW", "float32"], {"i": 1445403, "t": "direct", "c": "null", "e": [["tile_f", "sp", [-1, 2, 2, 2]], ["tile_y", "sp", [-1, 1, 1, 13]], ["tile_x", "sp", [-1, 1, 1, 1]], ["tile_rc", "sp", [-1, 12]], ["tile_ry", "sp", [-1, 3]], ["tile_rx", "sp", [-1, 1]], ["auto_unroll_max_step", "ot", 0], ["unroll_explicit", "ot", 1]]}], "r": [[0.0004380484877384196], 0, 2.7570385932922363, 1589313732.636623], "v": 0.1}
{"i": ["cuda -model=unknown", "topi_nn_conv2d", [["TENSOR", [1, 192, 13, 13], "float32"], ["TENSOR", [384, 192, 3, 3], "float32"], [1, 1], [1, 1, 1, 1], [1, 1], "NCHW", "float32"], {}, ["conv2d", [1, 192, 13, 13, "float32"], [384, 192, 3, 3, "float32"], [1, 1], [1, 1, 1, 1], [1, 1], "NCHW", "float32"], {"i": 930541, "t": "direct", "c": "null", "e": [["tile_f", "sp", [-1, 8, 2, 6]], ["tile_y", "sp", [-1, 1, 13, 1]], ["tile_x", "sp", [-1, 1, 1, 1]], ["tile_rc", "sp", [-1, 32]], ["tile_ry", "sp", [-1, 1]], ["tile_rx", "sp", [-1, 1]], ["auto_unroll_max_step", "ot", 1500], ["unroll_explicit", "ot", 0]]}], "r": [[0.0017875869642857143], 0, 2.5509328842163086, 1589313735.0686882], "v": 0.1}
{"i": ["cuda -model=unknown", "topi_nn_conv2d", [["TENSOR", [1, 192, 13, 13], "float32"], ["TENSOR", [384, 192, 3, 3], "float32"], [1, 1], [1, 1, 1, 1], [1, 1], "NCHW", "float32"], {}, ["conv2d", [1, 192, 13, 13, "float32"], [384, 192, 3, 3, "float32"], [1, 1], [1, 1, 1, 1], [1, 1], "NCHW", "float32"], {"i": 439076, "t": "direct", "c": "null", "e": [["tile_f", "sp", [-1, 1, 12, 8]], ["tile_y", "sp", [-1, 1, 13, 1]], ["tile_x", "sp", [-1, 1, 1, 1]], ["tile_rc", "sp", [-1, 2]], ["tile_ry", "sp", [-1, 1]], ["tile_rx", "sp", [-1, 1]], ["auto_unroll_max_step", "ot", 512], ["unroll_explicit", "ot", 0]]}], "r": [[0.00041566913246753246], 0, 2.1308376789093018, 1589313736.876391], "v": 0.1}
{"i": ["cuda -model=unknown", "topi_nn_conv2d", [["TENSOR", [1, 192, 13, 13], "float32"], ["TENSOR", [384, 192, 3, 3], "float32"], [1, 1], [1, 1, 1, 1], [1, 1], "NCHW", "float32"], {}, ["conv2d", [1, 192, 13, 13, "float32"], [384, 192, 3, 3, "float32"], [1, 1], [1, 1, 1, 1], [1, 1], "NCHW", "float32"], {"i": 906308, "t": "direct", "c": "null", "e": [["tile_f", "sp", [-1, 2, 12, 1]], ["tile_y", "sp", [-1, 1, 1, 1]], ["tile_x", "sp", [-1, 1, 1, 1]], ["tile_rc", "sp", [-1, 12]], ["tile_ry", "sp", [-1, 1]], ["tile_rx", "sp", [-1, 1]], ["auto_unroll_max_step", "ot", 1500], ["unroll_explicit", "ot", 0]]}], "r": [[0.0018534148363636364], 0, 2.2770891189575195, 1589313738.7874572], "v": 0.1}
{"i": ["cuda -model=unknown", "topi_nn_conv2d", [["TENSOR", [1, 192, 13, 13], "float32"], ["TENSOR", [384, 192, 3, 3], "float32"], [1, 1], [1, 1, 1, 1], [1, 1], "NCHW", "float32"], {}, ["conv2d", [1, 192, 13, 13, "float32"], [384, 192, 3, 3, "float32"], [1, 1], [1, 1, 1, 1], [1, 1], "NCHW", "float32"], {"i": 1834713, "t": "direct", "c": "null", "e": [["tile_f", "sp", [-1, 4, 6, 2]], ["tile_y", "sp", [-1, 1, 13, 1]], ["tile_x", "sp", [-1, 1, 1, 13]], ["tile_rc", "sp", [-1, 1]], ["tile_ry", "sp", [-1, 3]], ["tile_rx", "sp", [-1, 1]], ["auto_unroll_max_step", "ot", 512], ["unroll_explicit", "ot", 1]]}], "r": [[0.0009427794152046783], 0, 2.670112371444702, 1589313740.8539186], "v": 0.1}
{"i": ["cuda -model=unknown", "topi_nn_conv2d", [["TENSOR", [1, 192, 13, 13], "float32"], ["TENSOR", [384, 192, 3, 3], "float32"], [1, 1], [1, 1, 1, 1], [1, 1], "NCHW", "float32"], {}, ["conv2d", [1, 192, 13, 13, "float32"], [384, 192, 3, 3, "float32"], [1, 1], [1, 1, 1, 1], [1, 1], "NCHW", "float32"], {"i": 2160276, "t": "direct", "c": "null", "e": [["tile_f", "sp", [-1, 2, 12, 4]], ["tile_y", "sp", [-1, 1, 1, 1]], ["tile_x", "sp", [-1, 13, 1, 1]], ["tile_rc", "sp", [-1, 2]], ["tile_ry", "sp", [-1, 1]], ["tile_rx", "sp", [-1, 1]], ["auto_unroll_max_step", "ot", 1500], ["unroll_explicit", "ot", 1]]}], "r": [[0.0009762374066666666], 0, 2.472429037094116, 1589313757.928695], "v": 0.1}
{"i": ["cuda -model=unknown", "topi_nn_conv2d", [["TENSOR", [1, 192, 13, 13], "float32"], ["TENSOR", [384, 192, 3, 3], "float32"], [1, 1], [1, 1, 1, 1], [1, 1], "NCHW", "float32"], {}, ["conv2d", [1, 192, 13, 13, "float32"], [384, 192, 3, 3, "float32"], [1, 1], [1, 1, 1, 1], [1, 1], "NCHW", "float32"], {"i": 431543, "t": "direct", "c": "null", "e": [["tile_f", "sp", [-1, 16, 2, 1]], ["tile_y", "sp", [-1, 1, 1, 13]], ["tile_x", "sp", [-1, 1, 1, 1]], ["tile_rc", "sp", [-1, 1]], ["tile_ry", "sp", [-1, 1]], ["tile_rx", "sp", [-1, 1]], ["auto_unroll_max_step", "ot", 512], ["unroll_explicit", "ot", 0]]}], "r": [[0.002565865871794872], 0, 2.2394046783447266, 1589313759.8896775], "v": 0.1}
{"i": ["cuda -model=unknown", "topi_nn_conv2d", [["TENSOR", [1, 192, 13, 13], "float32"], ["TENSOR", [384, 192, 3, 3], "float32"], [1, 1], [1, 1, 1, 1], [1, 1], "NCHW", "float32"], {}, ["conv2d", [1, 192, 13, 13, "float32"], [384, 192, 3, 3, "float32"], [1, 1], [1, 1, 1, 1], [1, 1], "NCHW", "float32"], {"i": 223049, "t": "direct", "c": "null", "e": [["tile_f", "sp", [-1, 1, 2, 8]], ["tile_y", "sp", [-1, 1, 1, 1]], ["tile_x", "sp", [-1, 1, 1, 1]], ["tile_rc", "sp", [-1, 2]], ["tile_ry", "sp", [-1, 1]], ["tile_rx", "sp", [-1, 3]], ["auto_unroll_max_step", "ot", 0], ["unroll_explicit", "ot", 0]]}], "r": [[0.002126810625], 0, 1.869016170501709, 1589313761.247677], "v": 0.1}
{"i": ["cuda -model=unknown", "topi_nn_conv2d", [["TENSOR", [1, 192, 13, 13], "float32"], ["TENSOR", [384, 192, 3, 3], "float32"], [1, 1], [1, 1, 1, 1], [1, 1], "NCHW", "float32"], {}, ["conv2d", [1, 192, 13, 13, "float32"], [384, 192, 3, 3, "float32"], [1, 1], [1, 1, 1, 1], [1, 1], "NCHW", "float32"], {"i": 1308314, "t": "direct", "c": "null", "e": [["tile_f", "sp", [-1, 2, 16, 6]], ["tile_y", "sp", [-1, 13, 1, 1]], ["tile_x", "sp", [-1, 13, 1, 1]], ["tile_rc", "sp", [-1, 3]], ["tile_ry", "sp", [-1, 1]], ["tile_rx", "sp", [-1, 1]], ["auto_unroll_max_step", "ot", 0], ["unroll_explicit", "ot", 1]]}], "r": [[0.03582700075], 0, 4.5051515102386475, 1589313762.9109516], "v": 0.1}
{"i": ["cuda -model=unknown", "topi_nn_conv2d", [["TENSOR", [1, 192, 13, 13], "float32"], ["TENSOR", [384, 192, 3, 3], "float32"], [1, 1], [1, 1, 1, 1], [1, 1], "NCHW", "float32"], {}, ["conv2d", [1, 192, 13, 13, "float32"], [384, 192, 3, 3, "float32"], [1, 1], [1, 1, 1, 1], [1, 1], "NCHW", "float32"], {"i": 1316032, "t": "direct", "c": "null", "e": [["tile_f", "sp", [-1, 1, 8, 8]], ["tile_y", "sp", [-1, 13, 1, 1]], ["tile_x", "sp", [-1, 13, 1, 1]], ["tile_rc", "sp", [-1, 4]], ["tile_ry", "sp", [-1, 1]], ["tile_rx", "sp", [-1, 1]], ["auto_unroll_max_step", "ot", 0], ["unroll_explicit", "ot", 1]]}], "r": [[0.03227772925], 0, 2.9278783798217773, 1589313773.7266774], "v": 0.1}
{"i": ["cuda -model=unknown", "topi_nn_conv2d", [["TENSOR", [1, 192, 13, 13], "float32"], ["TENSOR", [384, 192, 3, 3], "float32"], [1, 1], [1, 1, 1, 1], [1, 1], "NCHW", "float32"], {}, ["conv2d", [1, 192, 13, 13, "float32"], [384, 192, 3, 3, "float32"], [1, 1], [1, 1, 1, 1], [1, 1], "NCHW", "float32"], {"i": 2456009, "t": "direct", "c": "null", "e": [["tile_f", "sp", [-1, 1, 2, 8]], ["tile_y", "sp", [-1, 1, 1, 1]], ["tile_x", "sp", [-1, 1, 1, 13]], ["tile_rc", "sp", [-1, 64]], ["tile_ry", "sp", [-1, 1]], ["tile_rx", "sp", [-1, 3]], ["auto_unroll_max_step", "ot", 1500], ["unroll_explicit", "ot", 1]]}], "r": [[0.0010221129081632652], 0, 3.986454486846924, 1589313775.4530232], "v": 0.1}
{"i": ["cuda -model=unknown", "topi_nn_conv2d", [["TENSOR", [1, 192, 13, 13], "float32"], ["TENSOR", [384, 192, 3, 3], "float32"], [1, 1], [1, 1, 1, 1], [1, 1], "NCHW", "float32"], {}, ["conv2d", [1, 192, 13, 13, "float32"], [384, 192, 3, 3, "float32"], [1, 1], [1, 1, 1, 1], [1, 1], "NCHW", "float32"], {"i": 1768680, "t": "direct", "c": "null", "e": [["tile_f", "sp", [-1, 3, 16, 8]], ["tile_y", "sp", [-1, 1, 1, 1]], ["tile_x", "sp", [-1, 13, 1, 1]], ["tile_rc", "sp", [-1, 12]], ["tile_ry", "sp", [-1, 1]], ["tile_rx", "sp", [-1, 1]], ["auto_unroll_max_step", "ot", 512], ["unroll_explicit", "ot", 1]]}], "r": [[0.0050918408], 0, 3.1958234310150146, 1589313777.1505826], "v": 0.1}
{"i": ["cuda -model=unknown", "topi_nn_conv2d", [["TENSOR", [1, 192, 13, 13], "float32"], ["TENSOR", [384, 192, 3, 3], "float32"], [1, 1], [1, 1, 1, 1], [1, 1], "NCHW", "float32"], {}, ["conv2d", [1, 192, 13, 13, "float32"], [384, 192, 3, 3, "float32"], [1, 1], [1, 1, 1, 1], [1, 1], "NCHW", "float32"], {"i": 265403, "t": "direct", "c": "null", "e": [["tile_f", "sp", [-1, 1, 4, 32]], ["tile_y", "sp", [-1, 1, 1, 1]], ["tile_x", "sp", [-1, 1, 13, 1]], ["tile_rc", "sp", [-1, 12]], ["tile_ry", "sp", [-1, 1]], ["tile_rx", "sp", [-1, 3]], ["auto_unroll_max_step", "ot", 0], ["unroll_explicit", "ot", 0]]}], "r": [[0.0016981705762711863], 0, 2.0593838691711426, 1589313778.951428], "v": 0.1}
{"i": ["cuda -model=unknown", "topi_nn_conv2d", [["TENSOR", [1, 192, 13, 13], "float32"], ["TENSOR", [384, 192, 3, 3], "float32"], [1, 1], [1, 1, 1, 1], [1, 1], "NCHW", "float32"], {}, ["conv2d", [1, 192, 13, 13, "float32"], [384, 192, 3, 3, "float32"], [1, 1], [1, 1, 1, 1], [1, 1], "NCHW", "float32"], {"i": 1022457, "t": "direct", "c": "null", "e": [["tile_f", "sp", [-1, 1, 8, 1]], ["tile_y", "sp", [-1, 1, 13, 1]], ["tile_x", "sp", [-1, 1, 1, 1]], ["tile_rc", "sp", [-1, 16]], ["tile_ry", "sp", [-1, 3]], ["tile_rx", "sp", [-1, 1]], ["auto_unroll_max_step", "ot", 1500], ["unroll_explicit", "ot", 0]]}], "r": [[0.00014326433266533066], 0, 2.188713550567627, 1589313848.9738555], "v": 0.1}
{"i": ["cuda -model=unknown", "topi_nn_conv2d", [["TENSOR", [1, 192, 13, 13], "float32"], ["TENSOR", [384, 192, 3, 3], "float32"], [1, 1], [1, 1, 1, 1], [1, 1], "NCHW", "float32"], {}, ["conv2d", [1, 192, 13, 13, "float32"], [384, 192, 3, 3, "float32"], [1, 1], [1, 1, 1, 1], [1, 1], "NCHW", "float32"], {"i": 2312697, "t": "direct", "c": "null", "e": [["tile_f", "sp", [-1, 1, 8, 1]], ["tile_y", "sp", [-1, 1, 13, 1]], ["tile_x", "sp", [-1, 1, 1, 1]], ["tile_rc", "sp", [-1, 16]], ["tile_ry", "sp", [-1, 3]], ["tile_rx", "sp", [-1, 1]], ["auto_unroll_max_step", "ot", 1500], ["unroll_explicit", "ot", 1]]}], "r": [[0.0001429751262580055], 0, 2.4889938831329346, 1589313851.0845165], "v": 0.1}
{"i": ["cuda -model=unknown", "topi_nn_conv2d", [["TENSOR", [1, 192, 13, 13], "float32"], ["TENSOR", [384, 192, 3, 3], "float32"], [1, 1], [1, 1, 1, 1], [1, 1], "NCHW", "float32"], {}, ["conv2d", [1, 192, 13, 13, "float32"], [384, 192, 3, 3, "float32"], [1, 1], [1, 1, 1, 1], [1, 1], "NCHW", "float32"], {"i": 1030137, "t": "direct", "c": "null", "e": [["tile_f", "sp", [-1, 1, 8, 1]], ["tile_y", "sp", [-1, 1, 13, 1]], ["tile_x", "sp", [-1, 1, 1, 1]], ["tile_rc", "sp", [-1, 24]], ["tile_ry", "sp", [-1, 3]], ["tile_rx", "sp", [-1, 1]], ["auto_unroll_max_step", "ot", 1500], ["unroll_explicit", "ot", 0]]}], "r": [[0.00014431726506024096], 0, 1.8446252346038818, 1589313852.6949394], "v": 0.1}
{"i": ["cuda -model=unknown", "topi_nn_conv2d", [["TENSOR", [1, 192, 13, 13], "float32"], ["TENSOR", [384, 192, 3, 3], "float32"], [1, 1], [1, 1, 1, 1], [1, 1], "NCHW", "float32"], {}, ["conv2d", [1, 192, 13, 13, "float32"], [384, 192, 3, 3, "float32"], [1, 1], [1, 1, 1, 1], [1, 1], "NCHW", "float32"], {"i": 1022439, "t": "direct", "c": "null", "e": [["tile_f", "sp", [-1, 2, 4, 1]], ["tile_y", "sp", [-1, 1, 13, 1]], ["tile_x", "sp", [-1, 1, 1, 1]], ["tile_rc", "sp", [-1, 16]], ["tile_ry", "sp", [-1, 3]], ["tile_rx", "sp", [-1, 1]], ["auto_unroll_max_step", "ot", 1500], ["unroll_explicit", "ot", 0]]}], "r": [[0.0001482323426704015], 0, 2.072129964828491, 1589313854.4356809], "v": 0.1}
{"i": ["cuda -model=unknown", "topi_nn_conv2d", [["TENSOR", [1, 192, 13, 13], "float32"], ["TENSOR", [384, 192, 3, 3], "float32"], [1, 1], [1, 1, 1, 1], [1, 1], "NCHW", "float32"], {}, ["conv2d", [1, 192, 13, 13, "float32"], [384, 192, 3, 3, "float32"], [1, 1], [1, 1, 1, 1], [1, 1], "NCHW", "float32"], {"i": 2320377, "t": "direct", "c": "null", "e": [["tile_f", "sp", [-1, 1, 8, 1]], ["tile_y", "sp", [-1, 1, 13, 1]], ["tile_x", "sp", [-1, 1, 1, 1]], ["tile_rc", "sp", [-1, 24]], ["tile_ry", "sp", [-1, 3]], ["tile_rx", "sp", [-1, 1]], ["auto_unroll_max_step", "ot", 1500], ["unroll_explicit", "ot", 1]]}], "r": [[0.00014564134048507463], 0, 2.190424680709839, 1589313856.2384982], "v": 0.1}
{"i": ["cuda -model=unknown", "topi_nn_conv2d", [["TENSOR", [1, 192, 13, 13], "float32"], ["TENSOR", [384, 192, 3, 3], "float32"], [1, 1], [1, 1, 1, 1], [1, 1], "NCHW", "float32"], {}, ["conv2d", [1, 192, 13, 13, "float32"], [384, 192, 3, 3, "float32"], [1, 1], [1, 1, 1, 1], [1, 1], "NCHW", "float32"], {"i": 2312679, "t": "direct", "c": "null", "e": [["tile_f", "sp", [-1, 2, 4, 1]], ["tile_y", "sp", [-1, 1, 13, 1]], ["tile_x", "sp", [-1, 1, 1, 1]], ["tile_rc", "sp", [-1, 16]], ["tile_ry", "sp", [-1, 3]], ["tile_rx", "sp", [-1, 1]], ["auto_unroll_max_step", "ot", 1500], ["unroll_explicit", "ot", 1]]}], "r": [[0.000146267], 0, 2.4927308559417725, 1589313858.3869994], "v": 0.1}
{"i": ["cuda -model=unknown", "topi_nn_conv2d", [["TENSOR", [1, 192, 13, 13], "float32"], ["TENSOR", [384, 192, 3, 3], "float32"], [1, 1], [1, 1, 1, 1], [1, 1], "NCHW", "float32"], {}, ["conv2d", [1, 192, 13, 13, "float32"], [384, 192, 3, 3, "float32"], [1, 1], [1, 1, 1, 1], [1, 1], "NCHW", "float32"], {"i": 1030119, "t": "direct", "c": "null", "e": [["tile_f", "sp", [-1, 2, 4, 1]], ["tile_y", "sp", [-1, 1, 13, 1]], ["tile_x", "sp", [-1, 1, 1, 1]], ["tile_rc", "sp", [-1, 24]], ["tile_ry", "sp", [-1, 3]], ["tile_rx", "sp", [-1, 1]], ["auto_unroll_max_step", "ot", 1500], ["unroll_explicit", "ot", 0]]}], "r": [[0.00015057452631578948], 0, 2.464078664779663, 1589313860.5216105], "v": 0.1}
{"i": ["cuda -model=unknown", "topi_nn_conv2d", [["TENSOR", [1, 192, 13, 13], "float32"], ["TENSOR", [384, 192, 3, 3], "float32"], [1, 1], [1, 1, 1, 1], [1, 1], "NCHW", "float32"], {}, ["conv2d", [1, 192, 13, 13, "float32"], [384, 192, 3, 3, "float32"], [1, 1], [1, 1, 1, 1], [1, 1], "NCHW", "float32"], {"i": 2320359, "t": "direct", "c": "null", "e": [["tile_f", "sp", [-1, 2, 4, 1]], ["tile_y", "sp", [-1, 1, 13, 1]], ["tile_x", "sp", [-1, 1, 1, 1]], ["tile_rc", "sp", [-1, 24]], ["tile_ry", "sp", [-1, 3]], ["tile_rx", "sp", [-1, 1]], ["auto_unroll_max_step", "ot", 1500], ["unroll_explicit", "ot", 1]]}], "r": [[0.000141094023977433], 0, 2.6443231105804443, 1589313862.5969505], "v": 0.1}
{"i": ["cuda -model=unknown", "topi_nn_conv2d", [["TENSOR", [1, 192, 13, 13], "float32"], ["TENSOR", [384, 192, 3, 3], "float32"], [1, 1], [1, 1, 1, 1], [1, 1], "NCHW", "float32"], {}, ["conv2d", [1, 192, 13, 13, "float32"], [384, 192, 3, 3, "float32"], [1, 1], [1, 1, 1, 1], [1, 1], "NCHW", "float32"], {"i": 162297, "t": "direct", "c": "null", "e": [["tile_f", "sp", [-1, 1, 8, 1]], ["tile_y", "sp", [-1, 1, 13, 1]], ["tile_x", "sp", [-1, 1, 1, 1]], ["tile_rc", "sp", [-1, 16]], ["tile_ry", "sp", [-1, 3]], ["tile_rx", "sp", [-1, 1]], ["auto_unroll_max_step", "ot", 0], ["unroll_explicit", "ot", 0]]}], "r": [[0.00014441446388888888], 0, 2.3947579860687256, 1589313864.7165651], "v": 0.1}
{"i": ["cuda -model=unknown", "topi_nn_conv2d", [["TENSOR", [1, 192, 13, 13], "float32"], ["TENSOR", [384, 192, 3, 3], "float32"], [1, 1], [1, 1, 1, 1], [1, 1], "NCHW", "float32"], {}, ["conv2d", [1, 192, 13, 13, "float32"], [384, 192, 3, 3, "float32"], [1, 1], [1, 1, 1, 1], [1, 1], "NCHW", "float32"], {"i": 592377, "t": "direct", "c": "null", "e": [["tile_f", "sp", [-1, 1, 8, 1]], ["tile_y", "sp", [-1, 1, 13, 1]], ["tile_x", "sp", [-1, 1, 1, 1]], ["tile_rc", "sp", [-1, 16]], ["tile_ry", "sp", [-1, 3]], ["tile_rx", "sp", [-1, 1]], ["auto_unroll_max_step", "ot", 512], ["unroll_explicit", "ot", 0]]}], "r": [[0.00014290119496855347], 0, 2.426633834838867, 1589313866.8208623], "v": 0.1}
{"i": ["cuda -model=unknown", "topi_nn_conv2d", [["TENSOR", [1, 192, 13, 13], "float32"], ["TENSOR", [384, 192, 3, 3], "float32"], [1, 1], [1, 1, 1, 1], [1, 1], "NCHW", "float32"], {}, ["conv2d", [1, 192, 13, 13, "float32"], [384, 192, 3, 3, "float32"], [1, 1], [1, 1, 1, 1], [1, 1], "NCHW", "float32"], {"i": 1452537, "t": "direct", "c": "null", "e": [["tile_f", "sp", [-1, 1, 8, 1]], ["tile_y", "sp", [-1, 1, 13, 1]], ["tile_x", "sp", [-1, 1, 1, 1]], ["tile_rc", "sp", [-1, 16]], ["tile_ry", "sp", [-1, 3]], ["tile_rx", "sp", [-1, 1]], ["auto_unroll_max_step", "ot", 0], ["unroll_explicit", "ot", 1]]}], "r": [[0.00014442480330882352], 0, 2.3098199367523193, 1589313868.9189079], "v": 0.1}
{"i": ["cuda -model=unknown", "topi_nn_conv2d", [["TENSOR", [1, 192, 13, 13], "float32"], ["TENSOR", [384, 192, 3, 3], "float32"], [1, 1], [1, 1, 1, 1], [1, 1], "NCHW", "float32"], {}, ["conv2d", [1, 192, 13, 13, "float32"], [384, 192, 3, 3, "float32"], [1, 1], [1, 1, 1, 1], [1, 1], "NCHW", "float32"], {"i": 1882617, "t": "direct", "c": "null", "e": [["tile_f", "sp", [-1, 1, 8, 1]], ["tile_y", "sp", [-1, 1, 13, 1]], ["tile_x", "sp", [-1, 1, 1, 1]], ["tile_rc", "sp", [-1, 16]], ["tile_ry", "sp", [-1, 3]], ["tile_rx", "sp", [-1, 1]], ["auto_unroll_max_step", "ot", 512], ["unroll_explicit", "ot", 1]]}], "r": [[0.00014293136832579185], 0, 2.021047592163086, 1589313870.5803525], "v": 0.1}
{"i": ["cuda -model=unknown", "topi_nn_conv2d", [["TENSOR", [1, 192, 13, 13], "float32"], ["TENSOR", [384, 192, 3, 3], "float32"], [1, 1], [1, 1, 1, 1], [1, 1], "NCHW", "float32"], {}, ["conv2d", [1, 192, 13, 13, "float32"], [384, 192, 3, 3, "float32"], [1, 1], [1, 1, 1, 1], [1, 1], "NCHW", "float32"], {"i": 600057, "t": "direct", "c": "null", "e": [["tile_f", "sp", [-1, 1, 8, 1]], ["tile_y", "sp", [-1, 1, 13, 1]], ["tile_x", "sp", [-1, 1, 1, 1]], ["tile_rc", "sp", [-1, 24]], ["tile_ry", "sp", [-1, 3]], ["tile_rx", "sp", [-1, 1]], ["auto_unroll_max_step", "ot", 512], ["unroll_explicit", "ot", 0]]}], "r": [[0.00014417001278538814], 0, 2.5629818439483643, 1589313872.894313], "v": 0.1}
{"i": ["cuda -model=unknown", "topi_nn_conv2d", [["TENSOR", [1, 192, 13, 13], "float32"], ["TENSOR", [384, 192, 3, 3], "float32"], [1, 1], [1, 1, 1, 1], [1, 1], "NCHW", "float32"], {}, ["conv2d", [1, 192, 13, 13, "float32"], [384, 192, 3, 3, "float32"], [1, 1], [1, 1, 1, 1], [1, 1], "NCHW", "float32"], {"i": 169977, "t": "direct", "c": "null", "e": [["tile_f", "sp", [-1, 1, 8, 1]], ["tile_y", "sp", [-1, 1, 13, 1]], ["tile_x", "sp", [-1, 1, 1, 1]], ["tile_rc", "sp", [-1, 24]], ["tile_ry", "sp", [-1, 3]], ["tile_rx", "sp", [-1, 1]], ["auto_unroll_max_step", "ot", 0], ["unroll_explicit", "ot", 0]]}], "r": [[0.00014335351011029413], 0, 2.429182529449463, 1589313875.0405226], "v": 0.1}
{"i": ["cuda -model=unknown", "topi_nn_conv2d", [["TENSOR", [1, 192, 13, 13], "float32"], ["TENSOR", [384, 192, 3, 3], "float32"], [1, 1], [1, 1, 1, 1], [1, 1], "NCHW", "float32"], {}, ["conv2d", [1, 192, 13, 13, "float32"], [384, 192, 3, 3, "float32"], [1, 1], [1, 1, 1, 1], [1, 1], "NCHW", "float32"], {"i": 1030130, "t": "direct", "c": "null", "e": [["tile_f", "sp", [-1, 1, 6, 1]], ["tile_y", "sp", [-1, 1, 13, 1]], ["tile_x", "sp", [-1, 1, 1, 1]], ["tile_rc", "sp", [-1, 24]], ["tile_ry", "sp", [-1, 3]], ["tile_rx", "sp", [-1, 1]], ["auto_unroll_max_step", "ot", 1500], ["unroll_explicit", "ot", 0]]}], "r": [[0.00017753004671857618], 0, 2.132823944091797, 1589313877.0594397], "v": 0.1}
{"i": ["cuda -model=unknown", "topi_nn_conv2d", [["TENSOR", [1, 192, 13, 13], "float32"], ["TENSOR", [384, 192, 3, 3], "float32"], [1, 1], [1, 1, 1, 1], [1, 1], "NCHW", "float32"], {}, ["conv2d", [1, 192, 13, 13, "float32"], [384, 192, 3, 3, "float32"], [1, 1], [1, 1, 1, 1], [1, 1], "NCHW", "float32"], {"i": 1030118, "t": "direct", "c": "null", "e": [["tile_f", "sp", [-1, 1, 4, 1]], ["tile_y", "sp", [-1, 1, 13, 1]], ["tile_x", "sp", [-1, 1, 1, 1]], ["tile_rc", "sp", [-1, 24]], ["tile_ry", "sp", [-1, 3]], ["tile_rx", "sp", [-1, 1]], ["auto_unroll_max_step", "ot", 1500], ["unroll_explicit", "ot", 0]]}], "r": [[0.0002150276923076923], 0, 2.1265242099761963, 1589313878.9534166], "v": 0.1}
{"i": ["cuda -model=unknown", "topi_nn_conv2d", [["TENSOR", [1, 192, 13, 13], "float32"], ["TENSOR", [384, 192, 3, 3], "float32"], [1, 1], [1, 1, 1, 1], [1, 1], "NCHW", "float32"], {}, ["conv2d", [1, 192, 13, 13, "float32"], [384, 192, 3, 3, "float32"], [1, 1], [1, 1, 1, 1], [1, 1], "NCHW", "float32"], {"i": 162279, "t": "direct", "c": "null", "e": [["tile_f", "sp", [-1, 2, 4, 1]], ["tile_y", "sp", [-1, 1, 13, 1]], ["tile_x", "sp", [-1, 1, 1, 1]], ["tile_rc", "sp", [-1, 16]], ["tile_ry", "sp", [-1, 3]], ["tile_rx", "sp", [-1, 1]], ["auto_unroll_max_step", "ot", 0], ["unroll_explicit", "ot", 0]]}], "r": [[0.0001491592384542884], 0, 1.9704153537750244, 1589313880.783232], "v": 0.1}
{"i": ["cuda -model=unknown", "topi_nn_conv2d", [["TENSOR", [1, 192, 13, 13], "float32"], ["TENSOR", [384, 192, 3, 3], "float32"], [1, 1], [1, 1, 1, 1], [1, 1], "NCHW", "float32"], {}, ["conv2d", [1, 192, 13, 13, "float32"], [384, 192, 3, 3, "float32"], [1, 1], [1, 1, 1, 1], [1, 1], "NCHW", "float32"], {"i": 592359, "t": "direct", "c": "null", "e": [["tile_f", "sp", [-1, 2, 4, 1]], ["tile_y", "sp", [-1, 1, 13, 1]], ["tile_x", "sp", [-1, 1, 1, 1]], ["tile_rc", "sp", [-1, 16]], ["tile_ry", "sp", [-1, 3]], ["tile_rx", "sp", [-1, 1]], ["auto_unroll_max_step", "ot", 512], ["unroll_explicit", "ot", 0]]}], "r": [[0.0001476360119485294], 0, 2.531263828277588, 1589313883.0292072], "v": 0.1}
{"i": ["cuda -model=unknown", "topi_nn_conv2d", [["TENSOR", [1, 192, 13, 13], "float32"], ["TENSOR", [384, 192, 3, 3], "float32"], [1, 1], [1, 1, 1, 1], [1, 1], "NCHW", "float32"], {}, ["conv2d", [1, 192, 13, 13, "float32"], [384, 192, 3, 3, "float32"], [1, 1], [1, 1, 1, 1], [1, 1], "NCHW", "float32"], {"i": 1460217, "t": "direct", "c": "null", "e": [["tile_f", "sp", [-1, 1, 8, 1]], ["tile_y", "sp", [-1, 1, 13, 1]], ["tile_x", "sp", [-1, 1, 1, 1]], ["tile_rc", "sp", [-1, 24]], ["tile_ry", "sp", [-1, 3]], ["tile_rx", "sp", [-1, 1]], ["auto_unroll_max_step", "ot", 0], ["unroll_explicit", "ot", 1]]}], "r": [[0.00014274527183600713], 0, 2.36382794380188, 1589313885.0861976], "v": 0.1}
{"i": ["cuda -model=unknown", "topi_nn_conv2d", [["TENSOR", [1, 192, 13, 13], "float32"], ["TENSOR", [384, 192, 3, 3], "float32"], [1, 1], [1, 1, 1, 1], [1, 1], "NCHW", "float32"], {}, ["conv2d", [1, 192, 13, 13, "float32"], [384, 192, 3, 3, "float32"], [1, 1], [1, 1, 1, 1], [1, 1], "NCHW", "float32"], {"i": 1890297, "t": "direct", "c": "null", "e": [["tile_f", "sp", [-1, 1, 8, 1]], ["tile_y", "sp", [-1, 1, 13, 1]], ["tile_x", "sp", [-1, 1, 1, 1]], ["tile_rc", "sp", [-1, 24]], ["tile_ry", "sp", [-1, 3]], ["tile_rx", "sp", [-1, 1]], ["auto_unroll_max_step", "ot", 512], ["unroll_explicit", "ot", 1]]}], "r": [[0.0001452470546946217], 0, 2.573732614517212, 1589313887.4122798], "v": 0.1}
{"i": ["cuda -model=unknown", "topi_nn_conv2d", [["TENSOR", [1, 192, 13, 13], "float32"], ["TENSOR", [384, 192, 3, 3], "float32"], [1, 1], [1, 1, 1, 1], [1, 1], "NCHW", "float32"], {}, ["conv2d", [1, 192, 13, 13, "float32"], [384, 192, 3, 3, "float32"], [1, 1], [1, 1, 1, 1], [1, 1], "NCHW", "float32"], {"i": 1137657, "t": "direct", "c": "null", "e": [["tile_f", "sp", [-1, 1, 8, 1]], ["tile_y", "sp", [-1, 1, 13, 1]], ["tile_x", "sp", [-1, 1, 1, 1]], ["tile_rc", "sp", [-1, 24]], ["tile_ry", "sp", [-1, 1]], ["tile_rx", "sp", [-1, 3]], ["auto_unroll_max_step", "ot", 1500], ["unroll_explicit", "ot", 0]]}], "r": [[0.0001894099208037825], 0, 2.5265450477600098, 1589313889.876578], "v": 0.1}
{"i": ["cuda -model=unknown", "topi_nn_conv2d", [["TENSOR", [1, 192, 13, 13], "float32"], ["TENSOR", [384, 192, 3, 3], "float32"], [1, 1], [1, 1, 1, 1], [1, 1], "NCHW", "float32"], {}, ["conv2d", [1, 192, 13, 13, "float32"], [384, 192, 3, 3, "float32"], [1, 1], [1, 1, 1, 1], [1, 1], "NCHW", "float32"], {"i": 1014759, "t": "direct", "c": "null", "e": [["tile_f", "sp", [-1, 2, 4, 1]], ["tile_y", "sp", [-1, 1, 13, 1]], ["tile_x", "sp", [-1, 1, 1, 1]], ["tile_rc", "sp", [-1, 12]], ["tile_ry", "sp", [-1, 3]], ["tile_rx", "sp", [-1, 1]], ["auto_unroll_max_step", "ot", 1500], ["unroll_explicit", "ot", 0]]}], "r": [[0.00014404981158088238], 0, 2.1973989009857178, 1589313891.860403], "v": 0.1}
{"i": ["cuda -model=unknown", "topi_nn_conv2d", [["TENSOR", [1, 192, 13, 13], "float32"], ["TENSOR", [384, 192, 3, 3], "float32"], [1, 1], [1, 1, 1, 1], [1, 1], "NCHW", "float32"], {}, ["conv2d", [1, 192, 13, 13, "float32"], [384, 192, 3, 3, "float32"], [1, 1], [1, 1, 1, 1], [1, 1], "NCHW", "float32"], {"i": 2320370, "t": "direct", "c": "null", "e": [["tile_f", "sp", [-1, 1, 6, 1]], ["tile_y", "sp", [-1, 1, 13, 1]], ["tile_x", "sp", [-1, 1, 1, 1]], ["tile_rc", "sp", [-1, 24]], ["tile_ry", "sp", [-1, 3]], ["tile_rx", "sp", [-1, 1]], ["auto_unroll_max_step", "ot", 1500], ["unroll_explicit", "ot", 1]]}], "r": [[0.0001749000153508772], 0, 2.3368048667907715, 1589313893.907482], "v": 0.1}
{"i": ["cuda -model=unknown", "topi_nn_conv2d", [["TENSOR", [1, 192, 13, 13], "float32"], ["TENSOR", [384, 192, 3, 3], "float32"], [1, 1], [1, 1, 1, 1], [1, 1], "NCHW", "float32"], {}, ["conv2d", [1, 192, 13, 13, "float32"], [384, 192, 3, 3, "float32"], [1, 1], [1, 1, 1, 1], [1, 1], "NCHW", "float32"], {"i": 2320358, "t": "direct", "c": "null", "e": [["tile_f", "sp", [-1, 1, 4, 1]], ["tile_y", "sp", [-1, 1, 13, 1]], ["tile_x", "sp", [-1, 1, 1, 1]], ["tile_rc", "sp", [-1, 24]], ["tile_ry", "sp", [-1, 3]], ["tile_rx", "sp", [-1, 1]], ["auto_unroll_max_step", "ot", 1500], ["unroll_explicit", "ot", 1]]}], "r": [[0.00018924831379962194], 0, 2.1173977851867676, 1589313895.5470922], "v": 0.1}
{"i": ["cuda -model=unknown", "topi_nn_conv2d", [["TENSOR", [1, 192, 13, 13], "float32"], ["TENSOR", [384, 192, 3, 3], "float32"], [1, 1], [1, 1, 1, 1], [1, 1], "NCHW", "float32"], {}, ["conv2d", [1, 192, 13, 13, "float32"], [384, 192, 3, 3, "float32"], [1, 1], [1, 1, 1, 1], [1, 1], "NCHW", "float32"], {"i": 1452519, "t": "direct", "c": "null", "e": [["tile_f", "sp", [-1, 2, 4, 1]], ["tile_y", "sp", [-1, 1, 13, 1]], ["tile_x", "sp", [-1, 1, 1, 1]], ["tile_rc", "sp", [-1, 16]], ["tile_ry", "sp", [-1, 3]], ["tile_rx", "sp", [-1, 1]], ["auto_unroll_max_step", "ot", 0], ["unroll_explicit", "ot", 1]]}], "r": [[0.0001505883414893617], 0, 1.8050236701965332, 1589313898.7335796], "v": 0.1}
{"i": ["cuda -model=unknown", "topi_nn_conv2d", [["TENSOR", [1, 192, 13, 13], "float32"], ["TENSOR", [384, 192, 3, 3], "float32"], [1, 1], [1, 1, 1, 1], [1, 1], "NCHW", "float32"], {}, ["conv2d", [1, 192, 13, 13, "float32"], [384, 192, 3, 3, "float32"], [1, 1], [1, 1, 1, 1], [1, 1], "NCHW", "float32"], {"i": 1882599, "t": "direct", "c": "null", "e": [["tile_f", "sp", [-1, 2, 4, 1]], ["tile_y", "sp", [-1, 1, 13, 1]], ["tile_x", "sp", [-1, 1, 1, 1]], ["tile_rc", "sp", [-1, 16]], ["tile_ry", "sp", [-1, 3]], ["tile_rx", "sp", [-1, 1]], ["auto_unroll_max_step", "ot", 512], ["unroll_explicit", "ot", 1]]}], "r": [[0.0001463004940092166], 0, 1.8399512767791748, 1589313900.0272171], "v": 0.1}
{"i": ["cuda -model=unknown", "topi_nn_conv2d", [["TENSOR", [1, 192, 13, 13], "float32"], ["TENSOR", [384, 192, 3, 3], "float32"], [1, 1], [1, 1, 1, 1], [1, 1], "NCHW", "float32"], {}, ["conv2d", [1, 192, 13, 13, "float32"], [384, 192, 3, 3, "float32"], [1, 1], [1, 1, 1, 1], [1, 1], "NCHW", "float32"], {"i": 600039, "t": "direct", "c": "null", "e": [["tile_f", "sp", [-1, 2, 4, 1]], ["tile_y", "sp", [-1, 1, 13, 1]], ["tile_x", "sp", [-1, 1, 1, 1]], ["tile_rc", "sp", [-1, 24]], ["tile_ry", "sp", [-1, 3]], ["tile_rx", "sp", [-1, 1]], ["auto_unroll_max_step", "ot", 512], ["unroll_explicit", "ot", 0]]}], "r": [[0.00015059235511363637], 0, 2.357503652572632, 1589313902.1800203], "v": 0.1}
{"i": ["cuda -model=unknown", "topi_nn_conv2d", [["TENSOR", [1, 192, 13, 13], "float32"], ["TENSOR", [384, 192, 3, 3], "float32"], [1, 1], [1, 1, 1, 1], [1, 1], "NCHW", "float32"], {}, ["conv2d", [1, 192, 13, 13, "float32"], [384, 192, 3, 3, "float32"], [1, 1], [1, 1, 1, 1], [1, 1], "NCHW", "float32"], {"i": 169959, "t": "direct", "c": "null", "e": [["tile_f", "sp", [-1, 2, 4, 1]], ["tile_y", "sp", [-1, 1, 13, 1]], ["tile_x", "sp", [-1, 1, 1, 1]], ["tile_rc", "sp", [-1, 24]], ["tile_ry", "sp", [-1, 3]], ["tile_rx", "sp", [-1, 1]], ["auto_unroll_max_step", "ot", 0], ["unroll_explicit", "ot", 0]]}], "r": [[0.00017938279659090908], 0, 2.575748920440674, 1589313904.4725552], "v": 0.1}
{"i": ["cuda -model=unknown", "topi_nn_conv2d", [["TENSOR", [1, 192, 13, 13], "float32"], ["TENSOR", [384, 192, 3, 3], "float32"], [1, 1], [1, 1, 1, 1], [1, 1], "NCHW", "float32"], {}, ["conv2d", [1, 192, 13, 13, "float32"], [384, 192, 3, 3, "float32"], [1, 1], [1, 1, 1, 1], [1, 1], "NCHW", "float32"], {"i": 1132857, "t": "direct", "c": "null", "e": [["tile_f", "sp", [-1, 1, 8, 1]], ["tile_y", "sp", [-1, 1, 1, 1]], ["tile_x", "sp", [-1, 1, 13, 1]], ["tile_rc", "sp", [-1, 16]], ["tile_ry", "sp", [-1, 1]], ["tile_rx", "sp", [-1, 3]], ["auto_unroll_max_step", "ot", 1500], ["unroll_explicit", "ot", 0]]}], "r": [[0.00013064504624277456], 0, 2.412954330444336, 1589313906.6984615], "v": 0.1}
{"i": ["cuda -model=unknown", "topi_nn_conv2d", [["TENSOR", [1, 192, 13, 13], "float32"], ["TENSOR", [384, 192, 3, 3], "float32"], [1, 1], [1, 1, 1, 1], [1, 1], "NCHW", "float32"], {}, ["conv2d", [1, 192, 13, 13, "float32"], [384, 192, 3, 3, "float32"], [1, 1], [1, 1, 1, 1], [1, 1], "NCHW", "float32"], {"i": 2427897, "t": "direct", "c": "null", "e": [["tile_f", "sp", [-1, 1, 8, 1]], ["tile_y", "sp", [-1, 1, 13, 1]], ["tile_x", "sp", [-1, 1, 1, 1]], ["tile_rc", "sp", [-1, 24]], ["tile_ry", "sp", [-1, 1]], ["tile_rx", "sp", [-1, 3]], ["auto_unroll_max_step", "ot", 1500], ["unroll_explicit", "ot", 1]]}], "r": [[0.00017817719594594595], 0, 2.2095723152160645, 1589313908.6116264], "v": 0.1}
{"i": ["cuda -model=unknown", "topi_nn_conv2d", [["TENSOR", [1, 192, 13, 13], "float32"], ["TENSOR", [384, 192, 3, 3], "float32"], [1, 1], [1, 1, 1, 1], [1, 1], "NCHW", "float32"], {}, ["conv2d", [1, 192, 13, 13, "float32"], [384, 192, 3, 3, "float32"], [1, 1], [1, 1, 1, 1], [1, 1], "NCHW", "float32"], {"i": 1014777, "t": "direct", "c": "null", "e": [["tile_f", "sp", [-1, 1, 8, 1]], ["tile_y", "sp", [-1, 1, 13, 1]], ["tile_x", "sp", [-1, 1, 1, 1]], ["tile_rc", "sp", [-1, 12]], ["tile_ry", "sp", [-1, 3]], ["tile_rx", "sp", [-1, 1]], ["auto_unroll_max_step", "ot", 1500], ["unroll_explicit", "ot", 0]]}], "r": [[0.00012891195713107999], 0, 1.9550025463104248, 1589313910.5193365], "v": 0.1}
{"i": ["cuda -model=unknown", "topi_nn_conv2d", [["TENSOR", [1, 192, 13, 13], "float32"], ["TENSOR", [384, 192, 3, 3], "float32"], [1, 1], [1, 1, 1, 1], [1, 1], "NCHW", "float32"], {}, ["conv2d", [1, 192, 13, 13, "float32"], [384, 192, 3, 3, "float32"], [1, 1], [1, 1, 1, 1], [1, 1], "NCHW", "float32"], {"i": 2304999, "t": "direct", "c": "null", "e": [["tile_f", "sp", [-1, 2, 4, 1]], ["tile_y", "sp", [-1, 1, 13, 1]], ["tile_x", "sp", [-1, 1, 1, 1]], ["tile_rc", "sp", [-1, 12]], ["tile_ry", "sp", [-1, 3]], ["tile_rx", "sp", [-1, 1]], ["auto_unroll_max_step", "ot", 1500], ["unroll_explicit", "ot", 1]]}], "r": [[0.00012423530757097793], 0, 2.063300848007202, 1589313912.3498783], "v": 0.1}
{"i": ["cuda -model=unknown", "topi_nn_conv2d", [["TENSOR", [1, 192, 13, 13], "float32"], ["TENSOR", [384, 192, 3, 3], "float32"], [1, 1], [1, 1, 1, 1], [1, 1], "NCHW", "float32"], {}, ["conv2d", [1, 192, 13, 13, "float32"], [384, 192, 3, 3, "float32"], [1, 1], [1, 1, 1, 1], [1, 1], "NCHW", "float32"], {"i": 1890279, "t": "direct", "c": "null", "e": [["tile_f", "sp", [-1, 2, 4, 1]], ["tile_y", "sp", [-1, 1, 13, 1]], ["tile_x", "sp", [-1, 1, 1, 1]], ["tile_rc", "sp", [-1, 24]], ["tile_ry", "sp", [-1, 3]], ["tile_rx", "sp", [-1, 1]], ["auto_unroll_max_step", "ot", 512], ["unroll_explicit", "ot", 1]]}], "r": [[0.0001410022615658363], 0, 2.242466449737549, 1589313914.1063962], "v": 0.1}
{"i": ["cuda -model=unknown", "topi_nn_conv2d", [["TENSOR", [1, 192, 13, 13], "float32"], ["TENSOR", [384, 192, 3, 3], "float32"], [1, 1], [1, 1, 1, 1], [1, 1], "NCHW", "float32"], {}, ["conv2d", [1, 192, 13, 13, "float32"], [384, 192, 3, 3, "float32"], [1, 1], [1, 1, 1, 1], [1, 1], "NCHW", "float32"], {"i": 1460199, "t": "direct", "c": "null", "e": [["tile_f", "sp", [-1, 2, 4, 1]], ["tile_y", "sp", [-1, 1, 13, 1]], ["tile_x", "sp", [-1, 1, 1, 1]], ["tile_rc", "sp", [-1, 24]], ["tile_ry", "sp", [-1, 3]], ["tile_rx", "sp", [-1, 1]], ["auto_unroll_max_step", "ot", 0], ["unroll_explicit", "ot", 1]]}], "r": [[0.00017938218531073446], 0, 1.864197015762329, 1589313915.9311378], "v": 0.1}
{"i": ["cuda -model=unknown", "topi_nn_conv2d", [["TENSOR", [1, 192, 13, 13], "float32"], ["TENSOR", [384, 192, 3, 3], "float32"], [1, 1], [1, 1, 1, 1], [1, 1], "NCHW", "float32"], {}, ["conv2d", [1, 192, 13, 13, "float32"], [384, 192, 3, 3, "float32"], [1, 1], [1, 1, 1, 1], [1, 1], "NCHW", "float32"], {"i": 2423097, "t": "direct", "c": "null", "e": [["tile_f", "sp", [-1, 1, 8, 1]], ["tile_y", "sp", [-1, 1, 1, 1]], ["tile_x", "sp", [-1, 1, 13, 1]], ["tile_rc", "sp", [-1, 16]], ["tile_ry", "sp", [-1, 1]], ["tile_rx", "sp", [-1, 3]], ["auto_unroll_max_step", "ot", 1500], ["unroll_explicit", "ot", 1]]}], "r": [[0.00012874642096642096], 0, 2.0865800380706787, 1589313917.834601], "v": 0.1}
{"i": ["cuda -model=unknown", "topi_nn_conv2d", [["TENSOR", [1, 192, 13, 13], "float32"], ["TENSOR", [384, 192, 3, 3], "float32"], [1, 1], [1, 1, 1, 1], [1, 1], "NCHW", "float32"], {}, ["conv2d", [1, 192, 13, 13, "float32"], [384, 192, 3, 3, "float32"], [1, 1], [1, 1, 1, 1], [1, 1], "NCHW", "float32"], {"i": 2305017, "t": "direct", "c": "null", "e": [["tile_f", "sp", [-1, 1, 8, 1]], ["tile_y", "sp", [-1, 1, 13, 1]], ["tile_x", "sp", [-1, 1, 1, 1]], ["tile_rc", "sp", [-1, 12]], ["tile_ry", "sp", [-1, 3]], ["tile_rx", "sp", [-1, 1]], ["auto_unroll_max_step", "ot", 1500], ["unroll_explicit", "ot", 1]]}], "r": [[0.0001274488422330097], 0, 2.019878387451172, 1589313919.6927817], "v": 0.1}
{"i": ["cuda -model=unknown", "topi_nn_conv2d", [["TENSOR", [1, 192, 13, 13], "float32"], ["TENSOR", [384, 192, 3, 3], "float32"], [1, 1], [1, 1, 1, 1], [1, 1], "NCHW", "float32"], {}, ["conv2d", [1, 192, 13, 13, "float32"], [384, 192, 3, 3, "float32"], [1, 1], [1, 1, 1, 1], [1, 1], "NCHW", "float32"], {"i": 1137639, "t": "direct", "c": "null", "e": [["tile_f", "sp", [-1, 2, 4, 1]], ["tile_y", "sp", [-1, 1, 13, 1]], ["tile_x", "sp", [-1, 1, 1, 1]], ["tile_rc", "sp", [-1, 24]], ["tile_ry", "sp", [-1, 1]], ["tile_rx", "sp", [-1, 3]], ["auto_unroll_max_step", "ot", 1500], ["unroll_explicit", "ot", 0]]}], "r": [[0.0002163700277777778], 0, 2.2139463424682617, 1589313921.6202183], "v": 0.1}
{"i": ["cuda -model=unknown", "topi_nn_conv2d", [["TENSOR", [1, 192, 13, 13], "float32"], ["TENSOR", [384, 192, 3, 3], "float32"], [1, 1], [1, 1, 1, 1], [1, 1], "NCHW", "float32"], {}, ["conv2d", [1, 192, 13, 13, "float32"], [384, 192, 3, 3, "float32"], [1, 1], [1, 1, 1, 1], [1, 1], "NCHW", "float32"], {"i": 1140537, "t": "direct", "c": "null", "e": [["tile_f", "sp", [-1, 1, 8, 1]], ["tile_y", "sp", [-1, 1, 1, 1]], ["tile_x", "sp", [-1, 1, 13, 1]], ["tile_rc", "sp", [-1, 24]], ["tile_ry", "sp", [-1, 1]], ["tile_rx", "sp", [-1, 3]], ["auto_unroll_max_step", "ot", 1500], ["unroll_explicit", "ot", 0]]}], "r": [[0.0001310459380753138], 0, 2.5115275382995605, 1589313923.8175597], "v": 0.1}
{"i": ["cuda -model=unknown", "topi_nn_conv2d", [["TENSOR", [1, 192, 13, 13], "float32"], ["TENSOR", [384, 192, 3, 3], "float32"], [1, 1], [1, 1, 1, 1], [1, 1], "NCHW", "float32"], {}, ["conv2d", [1, 192, 13, 13, "float32"], [384, 192, 3, 3, "float32"], [1, 1], [1, 1, 1, 1], [1, 1], "NCHW", "float32"], {"i": 1137650, "t": "direct", "c": "null", "e": [["tile_f", "sp", [-1, 1, 6, 1]], ["tile_y", "sp", [-1, 1, 13, 1]], ["tile_x", "sp", [-1, 1, 1, 1]], ["tile_rc", "sp", [-1, 24]], ["tile_ry", "sp", [-1, 1]], ["tile_rx", "sp", [-1, 3]], ["auto_unroll_max_step", "ot", 1500], ["unroll_explicit", "ot", 0]]}], "r": [[0.00022767313207547172], 0, 2.433317184448242, 1589313925.8462229], "v": 0.1}
{"i": ["cuda -model=unknown", "topi_nn_conv2d", [["TENSOR", [1, 192, 13, 13], "float32"], ["TENSOR", [384, 192, 3, 3], "float32"], [1, 1], [1, 1, 1, 1], [1, 1], "NCHW", "float32"], {}, ["conv2d", [1, 192, 13, 13, "float32"], [384, 192, 3, 3, "float32"], [1, 1], [1, 1, 1, 1], [1, 1], "NCHW", "float32"], {"i": 2427879, "t": "direct", "c": "null", "e": [["tile_f", "sp", [-1, 2, 4, 1]], ["tile_y", "sp", [-1, 1, 13, 1]], ["tile_x", "sp", [-1, 1, 1, 1]], ["tile_rc", "sp", [-1, 24]], ["tile_ry", "sp", [-1, 1]], ["tile_rx", "sp", [-1, 3]], ["auto_unroll_max_step", "ot", 1500], ["unroll_explicit", "ot", 1]]}], "r": [[0.00018466422209302325], 0, 2.4847075939178467, 1589313927.834896], "v": 0.1}
{"i": ["cuda -model=unknown", "topi_nn_conv2d", [["TENSOR", [1, 192, 13, 13], "float32"], ["TENSOR", [384, 192, 3, 3], "float32"], [1, 1], [1, 1, 1, 1], [1, 1], "NCHW", "float32"], {}, ["conv2d", [1, 192, 13, 13, "float32"], [384, 192, 3, 3, "float32"], [1, 1], [1, 1, 1, 1], [1, 1], "NCHW", "float32"], {"i": 272697, "t": "direct", "c": "null", "e": [["tile_f", "sp", [-1, 1, 8, 1]], ["tile_y", "sp", [-1, 1, 1, 1]], ["tile_x", "sp", [-1, 1, 13, 1]], ["tile_rc", "sp", [-1, 16]], ["tile_ry", "sp", [-1, 1]], ["tile_rx", "sp", [-1, 3]], ["auto_unroll_max_step", "ot", 0], ["unroll_explicit", "ot", 0]]}], "r": [[0.00014715341604477612], 0, 2.008188009262085, 1589313929.5912538], "v": 0.1}
{"i": ["cuda -model=unknown", "topi_nn_conv2d", [["TENSOR", [1, 192, 13, 13], "float32"], ["TENSOR", [384, 192, 3, 3], "float32"], [1, 1], [1, 1, 1, 1], [1, 1], "NCHW", "float32"], {}, ["conv2d", [1, 192, 13, 13, "float32"], [384, 192, 3, 3, "float32"], [1, 1], [1, 1, 1, 1], [1, 1], "NCHW", "float32"], {"i": 702777, "t": "direct", "c": "null", "e": [["tile_f", "sp", [-1, 1, 8, 1]], ["tile_y", "sp", [-1, 1, 1, 1]], ["tile_x", "sp", [-1, 1, 13, 1]], ["tile_rc", "sp", [-1, 16]], ["tile_ry", "sp", [-1, 1]], ["tile_rx", "sp", [-1, 3]], ["auto_unroll_max_step", "ot", 512], ["unroll_explicit", "ot", 0]]}], "r": [[0.00013071813251028805], 0, 1.7850918769836426, 1589313931.2915554], "v": 0.1}
{"i": ["cuda -model=unknown", "topi_nn_conv2d", [["TENSOR", [1, 192, 13, 13], "float32"], ["TENSOR", [384, 192, 3, 3], "float32"], [1, 1], [1, 1, 1, 1], [1, 1], "NCHW", "float32"], {}, ["conv2d", [1, 192, 13, 13, "float32"], [384, 192, 3, 3, "float32"], [1, 1], [1, 1, 1, 1], [1, 1], "NCHW", "float32"], {"i": 2427890, "t": "direct", "c": "null", "e": [["tile_f", "sp", [-1, 1, 6, 1]], ["tile_y", "sp", [-1, 1, 13, 1]], ["tile_x", "sp", [-1, 1, 1, 1]], ["tile_rc", "sp", [-1, 24]], ["tile_ry", "sp", [-1, 1]], ["tile_rx", "sp", [-1, 3]], ["auto_unroll_max_step", "ot", 1500], ["unroll_explicit", "ot", 1]]}], "r": [[0.00023644431054977713], 0, 2.7068819999694824, 1589313933.7064135], "v": 0.1}
{"i": ["cuda -model=unknown", "topi_nn_conv2d", [["TENSOR", [1, 192, 13, 13], "float32"], ["TENSOR", [384, 192, 3, 3], "float32"], [1, 1], [1, 1, 1, 1], [1, 1], "NCHW", "float32"], {}, ["conv2d", [1, 192, 13, 13, "float32"], [384, 192, 3, 3, "float32"], [1, 1], [1, 1, 1, 1], [1, 1], "NCHW", "float32"], {"i": 1030120, "t": "direct", "c": "null", "e": [["tile_f", "sp", [-1, 3, 4, 1]], ["tile_y", "sp", [-1, 1, 13, 1]], ["tile_x", "sp", [-1, 1, 1, 1]], ["tile_rc", "sp", [-1, 24]], ["tile_ry", "sp", [-1, 3]], ["tile_rx", "sp", [-1, 1]], ["auto_unroll_max_step", "ot", 1500], ["unroll_explicit", "ot", 0]]}], "r": [[0.00019646959577114428], 0, 2.4346840381622314, 1589313935.7707152], "v": 0.1}
{"i": ["cuda -model=unknown", "topi_nn_conv2d", [["TENSOR", [1, 192, 13, 13], "float32"], ["TENSOR", [384, 192, 3, 3], "float32"], [1, 1], [1, 1, 1, 1], [1, 1], "NCHW", "float32"], {}, ["conv2d", [1, 192, 13, 13, "float32"], [384, 192, 3, 3, "float32"], [1, 1], [1, 1, 1, 1], [1, 1], "NCHW", "float32"], {"i": 1222119, "t": "direct", "c": "null", "e": [["tile_f", "sp", [-1, 2, 4, 1]], ["tile_y", "sp", [-1, 1, 13, 1]], ["tile_x", "sp", [-1, 1, 1, 1]], ["tile_rc", "sp", [-1, 8]], ["tile_ry", "sp", [-1, 3]], ["tile_rx", "sp", [-1, 3]], ["auto_unroll_max_step", "ot", 1500], ["unroll_explicit", "ot", 0]]}], "r": [[0.00012520345549318364], 0, 1.89650297164917, 1589313937.5271552], "v": 0.1}
{"i": ["cuda -model=unknown", "topi_nn_conv2d", [["TENSOR", [1, 192, 13, 13], "float32"], ["TENSOR", [384, 192, 3, 3], "float32"], [1, 1], [1, 1, 1, 1], [1, 1], "NCHW", "float32"], {}, ["conv2d", [1, 192, 13, 13, "float32"], [384, 192, 3, 3, "float32"], [1, 1], [1, 1, 1, 1], [1, 1], "NCHW", "float32"], {"i": 600050, "t": "direct", "c": "null", "e": [["tile_f", "sp", [-1, 1, 6, 1]], ["tile_y", "sp", [-1, 1, 13, 1]], ["tile_x", "sp", [-1, 1, 1, 1]], ["tile_rc", "sp", [-1, 24]], ["tile_ry", "sp", [-1, 3]], ["tile_rx", "sp", [-1, 1]], ["auto_unroll_max_step", "ot", 512], ["unroll_explicit", "ot", 0]]}], "r": [[0.0001776489965317919], 0, 1.8661386966705322, 1589313939.0403035], "v": 0.1}
{"i": ["cuda -model=unknown", "topi_nn_conv2d", [["TENSOR", [1, 192, 13, 13], "float32"], ["TENSOR", [384, 192, 3, 3], "float32"], [1, 1], [1, 1, 1, 1], [1, 1], "NCHW", "float32"], {}, ["conv2d", [1, 192, 13, 13, "float32"], [384, 192, 3, 3, "float32"], [1, 1], [1, 1, 1, 1], [1, 1], "NCHW", "float32"], {"i": 169970, "t": "direct", "c": "null", "e": [["tile_f", "sp", [-1, 1, 6, 1]], ["tile_y", "sp", [-1, 1, 13, 1]], ["tile_x", "sp", [-1, 1, 1, 1]], ["tile_rc", "sp", [-1, 24]], ["tile_ry", "sp", [-1, 3]], ["tile_rx", "sp", [-1, 1]], ["auto_unroll_max_step", "ot", 0], ["unroll_explicit", "ot", 0]]}], "r": [[0.00016430050256410257], 0, 2.0443778038024902, 1589313940.9623682], "v": 0.1}
{"i": ["cuda -model=unknown", "topi_nn_conv2d", [["TENSOR", [1, 192, 13, 13], "float32"], ["TENSOR", [384, 192, 3, 3], "float32"], [1, 1], [1, 1, 1, 1], [1, 1], "NCHW", "float32"], {}, ["conv2d", [1, 192, 13, 13, "float32"], [384, 192, 3, 3, "float32"], [1, 1], [1, 1, 1, 1], [1, 1], "NCHW", "float32"], {"i": 1562937, "t": "direct", "c": "null", "e": [["tile_f", "sp", [-1, 1, 8, 1]], ["tile_y", "sp", [-1, 1, 1, 1]], ["tile_x", "sp", [-1, 1, 13, 1]], ["tile_rc", "sp", [-1, 16]], ["tile_ry", "sp", [-1, 1]], ["tile_rx", "sp", [-1, 3]], ["auto_unroll_max_step", "ot", 0], ["unroll_explicit", "ot", 1]]}], "r": [[0.00014706546153846152], 0, 1.9683942794799805, 1589313942.7216022], "v": 0.1}
{"i": ["cuda -model=unknown", "topi_nn_conv2d", [["TENSOR", [1, 192, 13, 13], "float32"], ["TENSOR", [384, 192, 3, 3], "float32"], [1, 1], [1, 1, 1, 1], [1, 1], "NCHW", "float32"], {}, ["conv2d", [1, 192, 13, 13, "float32"], [384, 192, 3, 3, "float32"], [1, 1], [1, 1, 1, 1], [1, 1], "NCHW", "float32"], {"i": 1993017, "t": "direct", "c": "null", "e": [["tile_f", "sp", [-1, 1, 8, 1]], ["tile_y", "sp", [-1, 1, 1, 1]], ["tile_x", "sp", [-1, 1, 13, 1]], ["tile_rc", "sp", [-1, 16]], ["tile_ry", "sp", [-1, 1]], ["tile_rx", "sp", [-1, 3]], ["auto_unroll_max_step", "ot", 512], ["unroll_explicit", "ot", 1]]}], "r": [[0.00012874364690265485], 0, 2.1366260051727295, 1589313947.4699903], "v": 0.1}
{"i": ["cuda -model=unknown", "topi_nn_conv2d", [["TENSOR", [1, 192, 13, 13], "float32"], ["TENSOR", [384, 192, 3, 3], "float32"], [1, 1], [1, 1, 1, 1], [1, 1], "NCHW", "float32"], {}, ["conv2d", [1, 192, 13, 13, "float32"], [384, 192, 3, 3, "float32"], [1, 1], [1, 1, 1, 1], [1, 1], "NCHW", "float32"], {"i": 600038, "t": "direct", "c": "null", "e": [["tile_f", "sp", [-1, 1, 4, 1]], ["tile_y", "sp", [-1, 1, 13, 1]], ["tile_x", "sp", [-1, 1, 1, 1]], ["tile_rc", "sp", [-1, 24]], ["tile_ry", "sp", [-1, 3]], ["tile_rx", "sp", [-1, 1]], ["auto_unroll_max_step", "ot", 512], ["unroll_explicit", "ot", 0]]}], "r": [[0.00021490809973045822], 0, 2.0877790451049805, 1589313949.2384796], "v": 0.1}
{"i": ["cuda -model=unknown", "topi_nn_conv2d", [["TENSOR", [1, 192, 13, 13], "float32"], ["TENSOR", [384, 192, 3, 3], "float32"], [1, 1], [1, 1, 1, 1], [1, 1], "NCHW", "float32"], {}, ["conv2d", [1, 192, 13, 13, "float32"], [384, 192, 3, 3, "float32"], [1, 1], [1, 1, 1, 1], [1, 1], "NCHW", "float32"], {"i": 169958, "t": "direct", "c": "null", "e": [["tile_f", "sp", [-1, 1, 4, 1]], ["tile_y", "sp", [-1, 1, 13, 1]], ["tile_x", "sp", [-1, 1, 1, 1]], ["tile_rc", "sp", [-1, 24]], ["tile_ry", "sp", [-1, 3]], ["tile_rx", "sp", [-1, 1]], ["auto_unroll_max_step", "ot", 0], ["unroll_explicit", "ot", 0]]}], "r": [[0.00021613356156968875], 0, 1.8822214603424072, 1589313950.8369823], "v": 0.1}
{"i": ["cuda -model=unknown", "topi_nn_conv2d", [["TENSOR", [1, 192, 13, 13], "float32"], ["TENSOR", [384, 192, 3, 3], "float32"], [1, 1], [1, 1, 1, 1], [1, 1], "NCHW", "float32"], {}, ["conv2d", [1, 192, 13, 13, "float32"], [384, 192, 3, 3, "float32"], [1, 1], [1, 1, 1, 1], [1, 1], "NCHW", "float32"], {"i": 280377, "t": "direct", "c": "null", "e": [["tile_f", "sp", [-1, 1, 8, 1]], ["tile_y", "sp", [-1, 1, 1, 1]], ["tile_x", "sp", [-1, 1, 13, 1]], ["tile_rc", "sp", [-1, 24]], ["tile_ry", "sp", [-1, 1]], ["tile_rx", "sp", [-1, 3]], ["auto_unroll_max_step", "ot", 0], ["unroll_explicit", "ot", 0]]}], "r": [[0.00012723928767123288], 0, 1.955113410949707, 1589313952.71326], "v": 0.1}
{"i": ["cuda -model=unknown", "topi_nn_conv2d", [["TENSOR", [1, 192, 13, 13], "float32"], ["TENSOR", [384, 192, 3, 3], "float32"], [1, 1], [1, 1, 1, 1], [1, 1], "NCHW", "float32"], {}, ["conv2d", [1, 192, 13, 13, "float32"], [384, 192, 3, 3, "float32"], [1, 1], [1, 1, 1, 1], [1, 1], "NCHW", "float32"], {"i": 1129959, "t": "direct", "c": "null", "e": [["tile_f", "sp", [-1, 2, 4, 1]], ["tile_y", "sp", [-1, 1, 13, 1]], ["tile_x", "sp", [-1, 1, 1, 1]], ["tile_rc", "sp", [-1, 16]], ["tile_ry", "sp", [-1, 1]], ["tile_rx", "sp", [-1, 3]], ["auto_unroll_max_step", "ot", 1500], ["unroll_explicit", "ot", 0]]}], "r": [[0.00021832526611796982], 0, 2.0460171699523926, 1589313954.5502982], "v": 0.1}
{"i": ["cuda -model=unknown", "topi_nn_conv2d", [["TENSOR", [1, 192, 13, 13], "float32"], ["TENSOR", [384, 192, 3, 3], "float32"], [1, 1], [1, 1, 1, 1], [1, 1], "NCHW", "float32"], {}, ["conv2d", [1, 192, 13, 13, "float32"], [384, 192, 3, 3, "float32"], [1, 1], [1, 1, 1, 1], [1, 1], "NCHW", "float32"], {"i": 707577, "t": "direct", "c": "null", "e": [["tile_f", "sp", [-1, 1, 8, 1]], ["tile_y", "sp", [-1, 1, 13, 1]], ["tile_x", "sp", [-1, 1, 1, 1]], ["tile_rc", "sp", [-1, 24]], ["tile_ry", "sp", [-1, 1]], ["tile_rx", "sp", [-1, 3]], ["auto_unroll_max_step", "ot", 512], ["unroll_explicit", "ot", 0]]}], "r": [[0.00018885604081632652], 0, 1.5727689266204834, 1589313955.9303346], "v": 0.1}
{"i": ["cuda -model=unknown", "topi_nn_conv2d", [["TENSOR", [1, 192, 13, 13], "float32"], ["TENSOR", [384, 192, 3, 3], "float32"], [1, 1], [1, 1, 1, 1], [1, 1], "NCHW", "float32"], {}, ["conv2d", [1, 192, 13, 13, "float32"], [384, 192, 3, 3, "float32"], [1, 1], [1, 1, 1, 1], [1, 1], "NCHW", "float32"], {"i": 277497, "t": "direct", "c": "null", "e": [["tile_f", "sp", [-1, 1, 8, 1]], ["tile_y", "sp", [-1, 1, 13, 1]], ["tile_x", "sp", [-1, 1, 1, 1]], ["tile_rc", "sp", [-1, 24]], ["tile_ry", "sp", [-1, 1]], ["tile_rx", "sp", [-1, 3]], ["auto_unroll_max_step", "ot", 0], ["unroll_explicit", "ot", 0]]}], "r": [[0.00017352122234513272], 0, 1.882986307144165, 1589313957.5582943], "v": 0.1}
{"i": ["cuda -model=unknown", "topi_nn_conv2d", [["TENSOR", [1, 192, 13, 13], "float32"], ["TENSOR", [384, 192, 3, 3], "float32"], [1, 1], [1, 1, 1, 1], [1, 1], "NCHW", "float32"], {}, ["conv2d", [1, 192, 13, 13, "float32"], [384, 192, 3, 3, "float32"], [1, 1], [1, 1, 1, 1], [1, 1], "NCHW", "float32"], {"i": 2320360, "t": "direct", "c": "null", "e": [["tile_f", "sp", [-1, 3, 4, 1]], ["tile_y", "sp", [-1, 1, 13, 1]], ["tile_x", "sp", [-1, 1, 1, 1]], ["tile_rc", "sp", [-1, 24]], ["tile_ry", "sp", [-1, 3]], ["tile_rx", "sp", [-1, 1]], ["auto_unroll_max_step", "ot", 1500], ["unroll_explicit", "ot", 1]]}], "r": [[0.00013343885907172995], 0, 2.676072359085083, 1589313959.4390883], "v": 0.1}
{"i": ["cuda -model=unknown", "topi_nn_conv2d", [["TENSOR", [1, 192, 13, 13], "float32"], ["TENSOR", [384, 192, 3, 3], "float32"], [1, 1], [1, 1, 1, 1], [1, 1], "NCHW", "float32"], {}, ["conv2d", [1, 192, 13, 13, "float32"], [384, 192, 3, 3, "float32"], [1, 1], [1, 1, 1, 1], [1, 1], "NCHW", "float32"], {"i": 584679, "t": "direct", "c": "null", "e": [["tile_f", "sp", [-1, 2, 4, 1]], ["tile_y", "sp", [-1, 1, 13, 1]], ["tile_x", "sp", [-1, 1, 1, 1]], ["tile_rc", "sp", [-1, 12]], ["tile_ry", "sp", [-1, 3]], ["tile_rx", "sp", [-1, 1]], ["auto_unroll_max_step", "ot", 512], ["unroll_explicit", "ot", 0]]}], "r": [[0.0001435617166212534], 0, 1.949958324432373, 1589313961.1190562], "v": 0.1}
{"i": ["cuda -model=unknown", "topi_nn_conv2d", [["TENSOR", [1, 192, 13, 13], "float32"], ["TENSOR", [384, 192, 3, 3], "float32"], [1, 1], [1, 1, 1, 1], [1, 1], "NCHW", "float32"], {}, ["conv2d", [1, 192, 13, 13, "float32"], [384, 192, 3, 3, "float32"], [1, 1], [1, 1, 1, 1], [1, 1], "NCHW", "float32"], {"i": 154599, "t": "direct", "c": "null", "e": [["tile_f", "sp", [-1, 2, 4, 1]], ["tile_y", "sp", [-1, 1, 13, 1]], ["tile_x", "sp", [-1, 1, 1, 1]], ["tile_rc", "sp", [-1, 12]], ["tile_ry", "sp", [-1, 3]], ["tile_rx", "sp", [-1, 1]], ["auto_unroll_max_step", "ot", 0], ["unroll_explicit", "ot", 0]]}], "r": [[0.00014328429533213644], 0, 2.0657730102539062, 1589313963.0450394], "v": 0.1}
{"i": ["cuda -model=unknown", "topi_nn_conv2d", [["TENSOR", [1, 192, 13, 13], "float32"], ["TENSOR", [384, 192, 3, 3], "float32"], [1, 1], [1, 1, 1, 1], [1, 1], "NCHW", "float32"], {}, ["conv2d", [1, 192, 13, 13, "float32"], [384, 192, 3, 3, "float32"], [1, 1], [1, 1, 1, 1], [1, 1], "NCHW", "float32"], {"i": 2512359, "t": "direct", "c": "null", "e": [["tile_f", "sp", [-1, 2, 4, 1]], ["tile_y", "sp", [-1, 1, 13, 1]], ["tile_x", "sp", [-1, 1, 1, 1]], ["tile_rc", "sp", [-1, 8]], ["tile_ry", "sp", [-1, 3]], ["tile_rx", "sp", [-1, 3]], ["auto_unroll_max_step", "ot", 1500], ["unroll_explicit", "ot", 1]]}], "r": [[0.00012312112412177985], 0, 2.1129655838012695, 1589313964.9087753], "v": 0.1}
{"i": ["cuda -model=unknown", "topi_nn_conv2d", [["TENSOR", [1, 192, 13, 13], "float32"], ["TENSOR", [384, 192, 3, 3], "float32"], [1, 1], [1, 1, 1, 1], [1, 1], "NCHW", "float32"], {}, ["conv2d", [1, 192, 13, 13, "float32"], [384, 192, 3, 3, "float32"], [1, 1], [1, 1, 1, 1], [1, 1], "NCHW", "float32"], {"i": 1460210, "t": "direct", "c": "null", "e": [["tile_f", "sp", [-1, 1, 6, 1]], ["tile_y", "sp", [-1, 1, 13, 1]], ["tile_x", "sp", [-1, 1, 1, 1]], ["tile_rc", "sp", [-1, 24]], ["tile_ry", "sp", [-1, 3]], ["tile_rx", "sp", [-1, 1]], ["auto_unroll_max_step", "ot", 0], ["unroll_explicit", "ot", 1]]}], "r": [[0.0001636525461928934], 0, 1.9391136169433594, 1589313966.6946223], "v": 0.1}
