artifacts/Table2/logs/matmul_65536_2_1024.log
{"input": ["cuda -keys=cuda,gpu -max_num_threads=1024 -thread_warp_size=32", "dense_large_batch.gpu", [["TENSOR", [65536, 2], "float32"], ["TENSOR", [1024, 2], "float32"]], {}], "config": {"index": 84934, "code_hash": null, "entity": [["tile_x", "sp", [-1, 8, 4, 32]], ["tile_y", "sp", [-1, 4, 4, 2]], ["tile_k", "sp", [-1, 1, 1]]]}, "result": [[0.0067179296], 0, 2.6861064434051514, 1637496186.3587587], "version": 0.2, "tvm_version": "0.8.dev0"}
{"input": ["cuda -keys=cuda,gpu -max_num_threads=1024 -thread_warp_size=32", "dense_large_batch.gpu", [["TENSOR", [65536, 2], "float32"], ["TENSOR", [1024, 2], "float32"]], {}], "config": {"index": 31647, "code_hash": null, "entity": [["tile_x", "sp", [-1, 2, 8, 32]], ["tile_y", "sp", [-1, 4, 8, 1]], ["tile_k", "sp", [-1, 1, 1]]]}, "result": [[0.001590304859375], 0, 2.323979377746582, 1637496275.7934022], "version": 0.2, "tvm_version": "0.8.dev0"}
{"input": ["cuda -keys=cuda,gpu -max_num_threads=1024 -thread_warp_size=32", "dense_large_batch.gpu", [["TENSOR", [65536, 2], "float32"], ["TENSOR", [1024, 2], "float32"]], {}], "config": {"index": 23886, "code_hash": null, "entity": [["tile_x", "sp", [-1, 4, 4, 32]], ["tile_y", "sp", [-1, 8, 4, 1]], ["tile_k", "sp", [-1, 1, 1]]]}, "result": [[0.007181753571428571], 0, 2.193842887878418, 1637496277.579833], "version": 0.2, "tvm_version": "0.8.dev0"}
{"input": ["cuda -keys=cuda,gpu -max_num_threads=1024 -thread_warp_size=32", "dense_large_batch.gpu", [["TENSOR", [65536, 2], "float32"], ["TENSOR", [1024, 2], "float32"]], {}], "config": {"index": 31458, "code_hash": null, "entity": [["tile_x", "sp", [-1, 4, 8, 8]], ["tile_y", "sp", [-1, 4, 8, 1]], ["tile_k", "sp", [-1, 1, 1]]]}, "result": [[0.0014502719710144927], 0, 2.013087749481201, 1637496279.486081], "version": 0.2, "tvm_version": "0.8.dev0"}
{"input": ["cuda -keys=cuda,gpu -max_num_threads=1024 -thread_warp_size=32", "dense_large_batch.gpu", [["TENSOR", [65536, 2], "float32"], ["TENSOR", [1024, 2], "float32"]], {}], "config": {"index": 31559, "code_hash": null, "entity": [["tile_x", "sp", [-1, 2, 8, 16]], ["tile_y", "sp", [-1, 4, 8, 1]], ["tile_k", "sp", [-1, 1, 1]]]}, "result": [[0.0014347450571428571], 0, 2.053265333175659, 1637496281.3494642], "version": 0.2, "tvm_version": "0.8.dev0"}
{"input": ["cuda -keys=cuda,gpu -max_num_threads=1024 -thread_warp_size=32", "dense_large_batch.gpu", [["TENSOR", [65536, 2], "float32"], ["TENSOR", [1024, 2], "float32"]], {}], "config": {"index": 43680, "code_hash": null, "entity": [["tile_x", "sp", [-1, 1, 32, 1]], ["tile_y", "sp", [-1, 1, 32, 1]], ["tile_k", "sp", [-1, 1, 1]]]}, "result": [[0.002689247289473684], 0, 1.812385082244873, 1637496283.0029438], "version": 0.2, "tvm_version": "0.8.dev0"}
{"input": ["cuda -keys=cuda,gpu -max_num_threads=1024 -thread_warp_size=32", "dense_large_batch.gpu", [["TENSOR", [65536, 2], "float32"], ["TENSOR", [1024, 2], "float32"]], {}], "config": {"index": 38135, "code_hash": null, "entity": [["tile_x", "sp", [-1, 2, 16, 4]], ["tile_y", "sp", [-1, 2, 16, 1]], ["tile_k", "sp", [-1, 1, 1]]]}, "result": [[0.0014819109264705883], 0, 1.8502986431121826, 1637496284.5246272], "version": 0.2, "tvm_version": "0.8.dev0"}
{"input": ["cuda -keys=cuda,gpu -max_num_threads=1024 -thread_warp_size=32", "dense_large_batch.gpu", [["TENSOR", [65536, 2], "float32"], ["TENSOR", [1024, 2], "float32"]], {}], "config": {"index": 38003, "code_hash": null, "entity": [["tile_x", "sp", [-1, 2, 16, 2]], ["tile_y", "sp", [-1, 2, 16, 1]], ["tile_k", "sp", [-1, 1, 1]]]}, "result": [[0.0013443058933333334], 0, 2.0423471927642822, 1637496286.4876785], "version": 0.2, "tvm_version": "0.8.dev0"}
{"input": ["cuda -keys=cuda,gpu -max_num_threads=1024 -thread_warp_size=32", "dense_large_batch.gpu", [["TENSOR", [65536, 2], "float32"], ["TENSOR", [1024, 2], "float32"]], {}], "config": {"index": 38134, "code_hash": null, "entity": [["tile_x", "sp", [-1, 1, 16, 4]], ["tile_y", "sp", [-1, 2, 16, 1]], ["tile_k", "sp", [-1, 1, 1]]]}, "result": [[0.00153308244], 0, 2.0035998821258545, 1637496289.7048035], "version": 0.2, "tvm_version": "0.8.dev0"}
{"input": ["cuda -keys=cuda,gpu -max_num_threads=1024 -thread_warp_size=32", "dense_large_batch.gpu", [["TENSOR", [65536, 2], "float32"], ["TENSOR", [1024, 2], "float32"]], {}], "config": {"index": 38002, "code_hash": null, "entity": [["tile_x", "sp", [-1, 1, 16, 2]], ["tile_y", "sp", [-1, 2, 16, 1]], ["tile_k", "sp", [-1, 1, 1]]]}, "result": [[0.0013420166133333333], 0, 2.0317704677581787, 1637496291.6288683], "version": 0.2, "tvm_version": "0.8.dev0"}
{"input": ["cuda -keys=cuda,gpu -max_num_threads=1024 -thread_warp_size=32", "dense_large_batch.gpu", [["TENSOR", [65536, 2], "float32"], ["TENSOR", [1024, 2], "float32"]], {}], "config": {"index": 97112, "code_hash": null, "entity": [["tile_x", "sp", [-1, 2, 16, 2]], ["tile_y", "sp", [-1, 1, 16, 2]], ["tile_k", "sp", [-1, 1, 1]]]}, "result": [[0.0013491219411764705], 0, 1.933659553527832, 1637496293.5045571], "version": 0.2, "tvm_version": "0.8.dev0"}
{"input": ["cuda -keys=cuda,gpu -max_num_threads=1024 -thread_warp_size=32", "dense_large_batch.gpu", [["TENSOR", [65536, 2], "float32"], ["TENSOR", [1024, 2], "float32"]], {}], "config": {"index": 97360, "code_hash": null, "entity": [["tile_x", "sp", [-1, 2, 16, 8]], ["tile_y", "sp", [-1, 1, 16, 2]], ["tile_k", "sp", [-1, 1, 1]]]}, "result": [[0.0021967594130434783], 0, 1.7458369731903076, 1637496295.0995572], "version": 0.2, "tvm_version": "0.8.dev0"}
{"input": ["cuda -keys=cuda,gpu -max_num_threads=1024 -thread_warp_size=32", "dense_large_batch.gpu", [["TENSOR", [65536, 2], "float32"], ["TENSOR", [1024, 2], "float32"]], {}], "config": {"index": 43828, "code_hash": null, "entity": [["tile_x", "sp", [-1, 1, 32, 2]], ["tile_y", "sp", [-1, 1, 32, 1]], ["tile_k", "sp", [-1, 1, 1]]]}, "result": [[0.00271099072972973], 0, 1.9697768688201904, 1637496296.9047945], "version": 0.2, "tvm_version": "0.8.dev0"}
{"input": ["cuda -keys=cuda,gpu -max_num_threads=1024 -thread_warp_size=32", "dense_large_batch.gpu", [["TENSOR", [65536, 2], "float32"], ["TENSOR", [1024, 2], "float32"]], {}], "config": {"index": 97244, "code_hash": null, "entity": [["tile_x", "sp", [-1, 2, 16, 4]], ["tile_y", "sp", [-1, 1, 16, 2]], ["tile_k", "sp", [-1, 1, 1]]]}, "result": [[0.0014722171176470588], 0, 1.8744688034057617, 1637496298.8030875], "version": 0.2, "tvm_version": "0.8.dev0"}
{"input": ["cuda -keys=cuda,gpu -max_num_threads=1024 -thread_warp_size=32", "dense_large_batch.gpu", [["TENSOR", [65536, 2], "float32"], ["TENSOR", [1024, 2], "float32"]], {}], "config": {"index": 91536, "code_hash": null, "entity": [["tile_x", "sp", [-1, 4, 8, 8]], ["tile_y", "sp", [-1, 2, 8, 2]], ["tile_k", "sp", [-1, 1, 1]]]}, "result": [[0.0015852933069306929], 0, 1.9747862815856934, 1637496302.3372138], "version": 0.2, "tvm_version": "0.8.dev0"}
{"input": ["cuda -keys=cuda,gpu -max_num_threads=1024 -thread_warp_size=32", "dense_large_batch.gpu", [["TENSOR", [65536, 2], "float32"], ["TENSOR", [1024, 2], "float32"]], {}], "config": {"index": 37166, "code_hash": null, "entity": [["tile_x", "sp", [-1, 2, 16, 4]], ["tile_y", "sp", [-1, 1, 16, 1]], ["tile_k", "sp", [-1, 1, 1]]]}, "result": [[0.0029165571428571425], 0, 1.773012399673462, 1637496373.21357], "version": 0.2, "tvm_version": "0.8.dev0"}
{"input": ["cuda -keys=cuda,gpu -max_num_threads=1024 -thread_warp_size=32", "dense_large_batch.gpu", [["TENSOR", [65536, 2], "float32"], ["TENSOR", [1024, 2], "float32"]], {}], "config": {"index": 30489, "code_hash": null, "entity": [["tile_x", "sp", [-1, 4, 8, 8]], ["tile_y", "sp", [-1, 2, 8, 1]], ["tile_k", "sp", [-1, 1, 1]]]}, "result": [[0.0020550764081632656], 0, 1.7117314338684082, 1637496374.7530608], "version": 0.2, "tvm_version": "0.8.dev0"}
{"input": ["cuda -keys=cuda,gpu -max_num_threads=1024 -thread_warp_size=32", "dense_large_batch.gpu", [["TENSOR", [65536, 2], "float32"], ["TENSOR", [1024, 2], "float32"]], {}], "config": {"index": 90668, "code_hash": null, "entity": [["tile_x", "sp", [-1, 2, 8, 16]], ["tile_y", "sp", [-1, 1, 8, 2]], ["tile_k", "sp", [-1, 1, 1]]]}, "result": [[0.001921040261904762], 0, 1.9577372074127197, 1637496376.5261388], "version": 0.2, "tvm_version": "0.8.dev0"}
{"input": ["cuda -keys=cuda,gpu -max_num_threads=1024 -thread_warp_size=32", "dense_large_batch.gpu", [["TENSOR", [65536, 2], "float32"], ["TENSOR", [1024, 2], "float32"]], {}], "config": {"index": 29520, "code_hash": null, "entity": [["tile_x", "sp", [-1, 4, 8, 8]], ["tile_y", "sp", [-1, 1, 8, 1]], ["tile_k", "sp", [-1, 1, 1]]]}, "result": [[0.0033408790967741934], 0, 1.8201892375946045, 1637496378.1353724], "version": 0.2, "tvm_version": "0.8.dev0"}
{"input": ["cuda -keys=cuda,gpu -max_num_threads=1024 -thread_warp_size=32", "dense_large_batch.gpu", [["TENSOR", [65536, 2], "float32"], ["TENSOR", [1024, 2], "float32"]], {}], "config": {"index": 37034, "code_hash": null, "entity": [["tile_x", "sp", [-1, 2, 16, 2]], ["tile_y", "sp", [-1, 1, 16, 1]], ["tile_k", "sp", [-1, 1, 1]]]}, "result": [[0.0021206876875], 0, 1.573896884918213, 1637496379.5391653], "version": 0.2, "tvm_version": "0.8.dev0"}
{"input": ["cuda -keys=cuda,gpu -max_num_threads=1024 -thread_warp_size=32", "dense_large_batch.gpu", [["TENSOR", [65536, 2], "float32"], ["TENSOR", [1024, 2], "float32"]], {}], "config": {"index": 29621, "code_hash": null, "entity": [["tile_x", "sp", [-1, 2, 8, 16]], ["tile_y", "sp", [-1, 1, 8, 1]], ["tile_k", "sp", [-1, 1, 1]]]}, "result": [[0.003277926258064516], 0, 1.7894558906555176, 1637496381.1308641], "version": 0.2, "tvm_version": "0.8.dev0"}
{"input": ["cuda -keys=cuda,gpu -max_num_threads=1024 -thread_warp_size=32", "dense_large_batch.gpu", [["TENSOR", [65536, 2], "float32"], ["TENSOR", [1024, 2], "float32"]], {}], "config": {"index": 30678, "code_hash": null, "entity": [["tile_x", "sp", [-1, 2, 8, 32]], ["tile_y", "sp", [-1, 2, 8, 1]], ["tile_k", "sp", [-1, 1, 1]]]}, "result": [[0.0024507061219512195], 0, 1.8063549995422363, 1637496382.6788487], "version": 0.2, "tvm_version": "0.8.dev0"}
{"input": ["cuda -keys=cuda,gpu -max_num_threads=1024 -thread_warp_size=32", "dense_large_batch.gpu", [["TENSOR", [65536, 2], "float32"], ["TENSOR", [1024, 2], "float32"]], {}], "config": {"index": 37282, "code_hash": null, "entity": [["tile_x", "sp", [-1, 2, 16, 8]], ["tile_y", "sp", [-1, 1, 16, 1]], ["tile_k", "sp", [-1, 1, 1]]]}, "result": [[0.0032479239999999997], 0, 1.80216646194458, 1637496384.3336053], "version": 0.2, "tvm_version": "0.8.dev0"}
{"input": ["cuda -keys=cuda,gpu -max_num_threads=1024 -thread_warp_size=32", "dense_large_batch.gpu", [["TENSOR", [65536, 2], "float32"], ["TENSOR", [1024, 2], "float32"]], {}], "config": {"index": 38822, "code_hash": null, "entity": [["tile_x", "sp", [-1, 1, 16, 1]], ["tile_y", "sp", [-1, 4, 16, 1]], ["tile_k", "sp", [-1, 1, 1]]]}, "result": [[0.0013526995], 0, 2.052906036376953, 1637496386.209324], "version": 0.2, "tvm_version": "0.8.dev0"}
{"input": ["cuda -keys=cuda,gpu -max_num_threads=1024 -thread_warp_size=32", "dense_large_batch.gpu", [["TENSOR", [65536, 2], "float32"], ["TENSOR", [1024, 2], "float32"]], {}], "config": {"index": 90567, "code_hash": null, "entity": [["tile_x", "sp", [-1, 4, 8, 8]], ["tile_y", "sp", [-1, 1, 8, 2]], ["tile_k", "sp", [-1, 1, 1]]]}, "result": [[0.00202965838], 0, 2.0962047576904297, 1637496388.0566516], "version": 0.2, "tvm_version": "0.8.dev0"}
{"input": ["cuda -keys=cuda,gpu -max_num_threads=1024 -thread_warp_size=32", "dense_large_batch.gpu", [["TENSOR", [65536, 2], "float32"], ["TENSOR", [1024, 2], "float32"]], {}], "config": {"index": 140955, "code_hash": null, "entity": [["tile_x", "sp", [-1, 4, 8, 8]], ["tile_y", "sp", [-1, 1, 8, 4]], ["tile_k", "sp", [-1, 1, 1]]]}, "result": [[0.0012878237435897436], 0, 1.7925605773925781, 1637496389.521821], "version": 0.2, "tvm_version": "0.8.dev0"}
{"input": ["cuda -keys=cuda,gpu -max_num_threads=1024 -thread_warp_size=32", "dense_large_batch.gpu", [["TENSOR", [65536, 2], "float32"], ["TENSOR", [1024, 2], "float32"]], {}], "config": {"index": 97111, "code_hash": null, "entity": [["tile_x", "sp", [-1, 1, 16, 2]], ["tile_y", "sp", [-1, 1, 16, 2]], ["tile_k", "sp", [-1, 1, 1]]]}, "result": [[0.00134009], 0, 1.665032148361206, 1637496391.013861], "version": 0.2, "tvm_version": "0.8.dev0"}
{"input": ["cuda -keys=cuda,gpu -max_num_threads=1024 -thread_warp_size=32", "dense_large_batch.gpu", [["TENSOR", [65536, 2], "float32"], ["TENSOR", [1024, 2], "float32"]], {}], "config": {"index": 97359, "code_hash": null, "entity": [["tile_x", "sp", [-1, 1, 16, 8]], ["tile_y", "sp", [-1, 1, 16, 2]], ["tile_k", "sp", [-1, 1, 1]]]}, "result": [[0.001716227301075269], 0, 2.085021495819092, 1637496392.923233], "version": 0.2, "tvm_version": "0.8.dev0"}
{"input": ["cuda -keys=cuda,gpu -max_num_threads=1024 -thread_warp_size=32", "dense_large_batch.gpu", [["TENSOR", [65536, 2], "float32"], ["TENSOR", [1024, 2], "float32"]], {}], "config": {"index": 91725, "code_hash": null, "entity": [["tile_x", "sp", [-1, 2, 8, 32]], ["tile_y", "sp", [-1, 2, 8, 2]], ["tile_k", "sp", [-1, 1, 1]]]}, "result": [[0.0023966034523809528], 0, 2.299682378768921, 1637496394.8367193], "version": 0.2, "tvm_version": "0.8.dev0"}
{"input": ["cuda -keys=cuda,gpu -max_num_threads=1024 -thread_warp_size=32", "dense_large_batch.gpu", [["TENSOR", [65536, 2], "float32"], ["TENSOR", [1024, 2], "float32"]], {}], "config": {"index": 96962, "code_hash": null, "entity": [["tile_x", "sp", [-1, 1, 16, 1]], ["tile_y", "sp", [-1, 1, 16, 2]], ["tile_k", "sp", [-1, 1, 1]]]}, "result": [[0.0013418019466666668], 0, 1.8093829154968262, 1637496396.4909139], "version": 0.2, "tvm_version": "0.8.dev0"}
{"input": ["cuda -keys=cuda,gpu -max_num_threads=1024 -thread_warp_size=32", "dense_large_batch.gpu", [["TENSOR", [65536, 2], "float32"], ["TENSOR", [1024, 2], "float32"]], {}], "config": {"index": 84933, "code_hash": null, "entity": [["tile_x", "sp", [-1, 4, 4, 32]], ["tile_y", "sp", [-1, 4, 4, 2]], ["tile_k", "sp", [-1, 1, 1]]]}, "result": [[0.006878730866666667], 0, 1.9731168746948242, 1637496398.1870277], "version": 0.2, "tvm_version": "0.8.dev0"}
{"input": ["cuda -keys=cuda,gpu -max_num_threads=1024 -thread_warp_size=32", "dense_large_batch.gpu", [["TENSOR", [65536, 2], "float32"], ["TENSOR", [1024, 2], "float32"]], {}], "config": {"index": 141056, "code_hash": null, "entity": [["tile_x", "sp", [-1, 2, 8, 16]], ["tile_y", "sp", [-1, 1, 8, 4]], ["tile_k", "sp", [-1, 1, 1]]]}, "result": [[0.001247644930232558], 0, 1.9128167629241943, 1637496399.8155446], "version": 0.2, "tvm_version": "0.8.dev0"}
{"input": ["cuda -keys=cuda,gpu -max_num_threads=1024 -thread_warp_size=32", "dense_large_batch.gpu", [["TENSOR", [65536, 2], "float32"], ["TENSOR", [1024, 2], "float32"]], {}], "config": {"index": 83965, "code_hash": null, "entity": [["tile_x", "sp", [-1, 8, 4, 32]], ["tile_y", "sp", [-1, 2, 4, 2]], ["tile_k", "sp", [-1, 1, 1]]]}, "result": [[0.008661444916666665], 0, 2.2522168159484863, 1637496401.4908574], "version": 0.2, "tvm_version": "0.8.dev0"}
{"input": ["cuda -keys=cuda,gpu -max_num_threads=1024 -thread_warp_size=32", "dense_large_batch.gpu", [["TENSOR", [65536, 2], "float32"], ["TENSOR", [1024, 2], "float32"]], {}], "config": {"index": 36885, "code_hash": null, "entity": [["tile_x", "sp", [-1, 2, 16, 1]], ["tile_y", "sp", [-1, 1, 16, 1]], ["tile_k", "sp", [-1, 1, 1]]]}, "result": [[0.0013637545405405405], 0, 1.6632013320922852, 1637496403.0168989], "version": 0.2, "tvm_version": "0.8.dev0"}
{"input": ["cuda -keys=cuda,gpu -max_num_threads=1024 -thread_warp_size=32", "dense_large_batch.gpu", [["TENSOR", [65536, 2], "float32"], ["TENSOR", [1024, 2], "float32"]], {}], "config": {"index": 135321, "code_hash": null, "entity": [["tile_x", "sp", [-1, 4, 4, 32]], ["tile_y", "sp", [-1, 2, 4, 4]], ["tile_k", "sp", [-1, 1, 1]]]}, "result": [[0.008047109], 0, 2.584970712661743, 1637496406.953224], "version": 0.2, "tvm_version": "0.8.dev0"}
{"input": ["cuda -keys=cuda,gpu -max_num_threads=1024 -thread_warp_size=32", "dense_large_batch.gpu", [["TENSOR", [65536, 2], "float32"], ["TENSOR", [1024, 2], "float32"]], {}], "config": {"index": 135322, "code_hash": null, "entity": [["tile_x", "sp", [-1, 8, 4, 32]], ["tile_y", "sp", [-1, 2, 4, 4]], ["tile_k", "sp", [-1, 1, 1]]]}, "result": [[0.007557784214285714], 0, 2.4260671138763428, 1637496408.7071586], "version": 0.2, "tvm_version": "0.8.dev0"}
{"input": ["cuda -keys=cuda,gpu -max_num_threads=1024 -thread_warp_size=32", "dense_large_batch.gpu", [["TENSOR", [65536, 2], "float32"], ["TENSOR", [1024, 2], "float32"]], {}], "config": {"index": 83964, "code_hash": null, "entity": [["tile_x", "sp", [-1, 4, 4, 32]], ["tile_y", "sp", [-1, 2, 4, 2]], ["tile_k", "sp", [-1, 1, 1]]]}, "result": [[0.008965101750000001], 0, 2.5379209518432617, 1637496410.4059646], "version": 0.2, "tvm_version": "0.8.dev0"}
{"input": ["cuda -keys=cuda,gpu -max_num_threads=1024 -thread_warp_size=32", "dense_large_batch.gpu", [["TENSOR", [65536, 2], "float32"], ["TENSOR", [1024, 2], "float32"]], {}], "config": {"index": 29709, "code_hash": null, "entity": [["tile_x", "sp", [-1, 2, 8, 32]], ["tile_y", "sp", [-1, 1, 8, 1]], ["tile_k", "sp", [-1, 1, 1]]]}, "result": [[0.0033308943749999994], 0, 2.0378291606903076, 1637496412.0750268], "version": 0.2, "tvm_version": "0.8.dev0"}
{"input": ["cuda -keys=cuda,gpu -max_num_threads=1024 -thread_warp_size=32", "dense_large_batch.gpu", [["TENSOR", [65536, 2], "float32"], ["TENSOR", [1024, 2], "float32"]], {}], "config": {"index": 82996, "code_hash": null, "entity": [["tile_x", "sp", [-1, 8, 4, 32]], ["tile_y", "sp", [-1, 1, 4, 2]], ["tile_k", "sp", [-1, 1, 1]]]}, "result": [[0.013301194875], 0, 2.753664255142212, 1637496413.8703015], "version": 0.2, "tvm_version": "0.8.dev0"}
{"input": ["cuda -keys=cuda,gpu -max_num_threads=1024 -thread_warp_size=32", "dense_large_batch.gpu", [["TENSOR", [65536, 2], "float32"], ["TENSOR", [1024, 2], "float32"]], {}], "config": {"index": 83876, "code_hash": null, "entity": [["tile_x", "sp", [-1, 8, 4, 16]], ["tile_y", "sp", [-1, 2, 4, 2]], ["tile_k", "sp", [-1, 1, 1]]]}, "result": [[0.009300790181818182], 0, 2.613945245742798, 1637496415.5877092], "version": 0.2, "tvm_version": "0.8.dev0"}
{"input": ["cuda -keys=cuda,gpu -max_num_threads=1024 -thread_warp_size=32", "dense_large_batch.gpu", [["TENSOR", [65536, 2], "float32"], ["TENSOR", [1024, 2], "float32"]], {}], "config": {"index": 22917, "code_hash": null, "entity": [["tile_x", "sp", [-1, 4, 4, 32]], ["tile_y", "sp", [-1, 4, 4, 1]], ["tile_k", "sp", [-1, 1, 1]]]}, "result": [[0.007821147076923078], 0, 2.2981643676757812, 1637496417.2111993], "version": 0.2, "tvm_version": "0.8.dev0"}
{"input": ["cuda -keys=cuda,gpu -max_num_threads=1024 -thread_warp_size=32", "dense_large_batch.gpu", [["TENSOR", [65536, 2], "float32"], ["TENSOR", [1024, 2], "float32"]], {}], "config": {"index": 85008, "code_hash": null, "entity": [["tile_x", "sp", [-1, 2, 4, 64]], ["tile_y", "sp", [-1, 4, 4, 2]], ["tile_k", "sp", [-1, 1, 1]]]}, "result": [[0.006814019666666667], 0, 2.114696979522705, 1637496418.7969408], "version": 0.2, "tvm_version": "0.8.dev0"}
{"input": ["cuda -keys=cuda,gpu -max_num_threads=1024 -thread_warp_size=32", "dense_large_batch.gpu", [["TENSOR", [65536, 2], "float32"], ["TENSOR", [1024, 2], "float32"]], {}], "config": {"index": 135396, "code_hash": null, "entity": [["tile_x", "sp", [-1, 2, 4, 64]], ["tile_y", "sp", [-1, 2, 4, 4]], ["tile_k", "sp", [-1, 1, 1]]]}, "result": [[0.00835313825], 0, 2.3260624408721924, 1637496420.5654066], "version": 0.2, "tvm_version": "0.8.dev0"}
{"input": ["cuda -keys=cuda,gpu -max_num_threads=1024 -thread_warp_size=32", "dense_large_batch.gpu", [["TENSOR", [65536, 2], "float32"], ["TENSOR", [1024, 2], "float32"]], {}], "config": {"index": 97931, "code_hash": null, "entity": [["tile_x", "sp", [-1, 1, 16, 1]], ["tile_y", "sp", [-1, 2, 16, 2]], ["tile_k", "sp", [-1, 1, 1]]]}, "result": [[0.00134577648], 0, 1.7844159603118896, 1637496422.0704975], "version": 0.2, "tvm_version": "0.8.dev0"}
{"input": ["cuda -keys=cuda,gpu -max_num_threads=1024 -thread_warp_size=32", "dense_large_batch.gpu", [["TENSOR", [65536, 2], "float32"], ["TENSOR", [1024, 2], "float32"]], {}], "config": {"index": 21948, "code_hash": null, "entity": [["tile_x", "sp", [-1, 4, 4, 32]], ["tile_y", "sp", [-1, 2, 4, 1]], ["tile_k", "sp", [-1, 1, 1]]]}, "result": [[0.003265816967741935], 0, 2.371011734008789, 1637496423.926891], "version": 0.2, "tvm_version": "0.8.dev0"}
{"input": ["cuda -keys=cuda,gpu -max_num_threads=1024 -thread_warp_size=32", "dense_large_batch.gpu", [["TENSOR", [65536, 2], "float32"], ["TENSOR", [1024, 2], "float32"]], {}], "config": {"index": 146530, "code_hash": null, "entity": [["tile_x", "sp", [-1, 1, 16, 2]], ["tile_y", "sp", [-1, 1, 16, 4]], ["tile_k", "sp", [-1, 1, 1]]]}, "result": [[0.0013416366133333336], 0, 2.053610324859619, 1637496425.7077749], "version": 0.2, "tvm_version": "0.8.dev0"}
{"input": ["cuda -keys=cuda,gpu -max_num_threads=1024 -thread_warp_size=32", "dense_large_batch.gpu", [["TENSOR", [65536, 2], "float32"], ["TENSOR", [1024, 2], "float32"]], {}], "config": {"index": 96963, "code_hash": null, "entity": [["tile_x", "sp", [-1, 2, 16, 1]], ["tile_y", "sp", [-1, 1, 16, 2]], ["tile_k", "sp", [-1, 1, 1]]]}, "result": [[0.0013453484933333333], 0, 1.8840734958648682, 1637496427.392094], "version": 0.2, "tvm_version": "0.8.dev0"}
{"input": ["cuda -keys=cuda,gpu -max_num_threads=1024 -thread_warp_size=32", "dense_large_batch.gpu", [["TENSOR", [65536, 2], "float32"], ["TENSOR", [1024, 2], "float32"]], {}], "config": {"index": 36884, "code_hash": null, "entity": [["tile_x", "sp", [-1, 1, 16, 1]], ["tile_y", "sp", [-1, 1, 16, 1]], ["tile_k", "sp", [-1, 1, 1]]]}, "result": [[0.0014204498450704226], 0, 1.8510358333587646, 1637496428.9406245], "version": 0.2, "tvm_version": "0.8.dev0"}
{"input": ["cuda -keys=cuda,gpu -max_num_threads=1024 -thread_warp_size=32", "dense_large_batch.gpu", [["TENSOR", [65536, 2], "float32"], ["TENSOR", [1024, 2], "float32"]], {}], "config": {"index": 82995, "code_hash": null, "entity": [["tile_x", "sp", [-1, 4, 4, 32]], ["tile_y", "sp", [-1, 1, 4, 2]], ["tile_k", "sp", [-1, 1, 1]]]}, "result": [[0.00937178790909091], 0, 2.6273043155670166, 1637496430.8114526], "version": 0.2, "tvm_version": "0.8.dev0"}
{"input": ["cuda -keys=cuda,gpu -max_num_threads=1024 -thread_warp_size=32", "dense_large_batch.gpu", [["TENSOR", [65536, 2], "float32"], ["TENSOR", [1024, 2], "float32"]], {}], "config": {"index": 84845, "code_hash": null, "entity": [["tile_x", "sp", [-1, 8, 4, 16]], ["tile_y", "sp", [-1, 4, 4, 2]], ["tile_k", "sp", [-1, 1, 1]]]}, "result": [[0.007253329714285715], 0, 2.254044771194458, 1637496432.3918083], "version": 0.2, "tvm_version": "0.8.dev0"}
{"input": ["cuda -keys=cuda,gpu -max_num_threads=1024 -thread_warp_size=32", "dense_large_batch.gpu", [["TENSOR", [65536, 2], "float32"], ["TENSOR", [1024, 2], "float32"]], {}], "config": {"index": 98212, "code_hash": null, "entity": [["tile_x", "sp", [-1, 1, 16, 4]], ["tile_y", "sp", [-1, 2, 16, 2]], ["tile_k", "sp", [-1, 1, 1]]]}, "result": [[0.0014347107428571428], 0, 1.8753061294555664, 1637496433.9913278], "version": 0.2, "tvm_version": "0.8.dev0"}
{"input": ["cuda -keys=cuda,gpu -max_num_threads=1024 -thread_warp_size=32", "dense_large_batch.gpu", [["TENSOR", [65536, 2], "float32"], ["TENSOR", [1024, 2], "float32"]], {}], "config": {"index": 23961, "code_hash": null, "entity": [["tile_x", "sp", [-1, 2, 4, 64]], ["tile_y", "sp", [-1, 8, 4, 1]], ["tile_k", "sp", [-1, 1, 1]]]}, "result": [[0.006466284625], 0, 2.313351631164551, 1637496435.7559624], "version": 0.2, "tvm_version": "0.8.dev0"}
{"input": ["cuda -keys=cuda,gpu -max_num_threads=1024 -thread_warp_size=32", "dense_large_batch.gpu", [["TENSOR", [65536, 2], "float32"], ["TENSOR", [1024, 2], "float32"]], {}], "config": {"index": 98080, "code_hash": null, "entity": [["tile_x", "sp", [-1, 1, 16, 2]], ["tile_y", "sp", [-1, 2, 16, 2]], ["tile_k", "sp", [-1, 1, 1]]]}, "result": [[0.0014731023529411763], 0, 1.7504932880401611, 1637496497.2002738], "version": 0.2, "tvm_version": "0.8.dev0"}
{"input": ["cuda -keys=cuda,gpu -max_num_threads=1024 -thread_warp_size=32", "dense_large_batch.gpu", [["TENSOR", [65536, 2], "float32"], ["TENSOR", [1024, 2], "float32"]], {}], "config": {"index": 140954, "code_hash": null, "entity": [["tile_x", "sp", [-1, 2, 8, 8]], ["tile_y", "sp", [-1, 1, 8, 4]], ["tile_k", "sp", [-1, 1, 1]]]}, "result": [[0.001156900712230216], 0, 2.178474187850952, 1637496499.1149368], "version": 0.2, "tvm_version": "0.8.dev0"}
{"input": ["cuda -keys=cuda,gpu -max_num_threads=1024 -thread_warp_size=32", "dense_large_batch.gpu", [["TENSOR", [65536, 2], "float32"], ["TENSOR", [1024, 2], "float32"]], {}], "config": {"index": 146381, "code_hash": null, "entity": [["tile_x", "sp", [-1, 1, 16, 1]], ["tile_y", "sp", [-1, 1, 16, 4]], ["tile_k", "sp", [-1, 1, 1]]]}, "result": [[0.0013628383513513513], 0, 1.9172172546386719, 1637496500.789219], "version": 0.2, "tvm_version": "0.8.dev0"}
{"input": ["cuda -keys=cuda,gpu -max_num_threads=1024 -thread_warp_size=32", "dense_large_batch.gpu", [["TENSOR", [65536, 2], "float32"], ["TENSOR", [1024, 2], "float32"]], {}], "config": {"index": 97243, "code_hash": null, "entity": [["tile_x", "sp", [-1, 1, 16, 4]], ["tile_y", "sp", [-1, 1, 16, 2]], ["tile_k", "sp", [-1, 1, 1]]]}, "result": [[0.0014459955765765765], 0, 2.170940637588501, 1637496502.6623147], "version": 0.2, "tvm_version": "0.8.dev0"}
{"input": ["cuda -keys=cuda,gpu -max_num_threads=1024 -thread_warp_size=32", "dense_large_batch.gpu", [["TENSOR", [65536, 2], "float32"], ["TENSOR", [1024, 2], "float32"]], {}], "config": {"index": 37853, "code_hash": null, "entity": [["tile_x", "sp", [-1, 1, 16, 1]], ["tile_y", "sp", [-1, 2, 16, 1]], ["tile_k", "sp", [-1, 1, 1]]]}, "result": [[0.0013441551866666666], 0, 2.3467776775360107, 1637496505.0787914], "version": 0.2, "tvm_version": "0.8.dev0"}
{"input": ["cuda -keys=cuda,gpu -max_num_threads=1024 -thread_warp_size=32", "dense_large_batch.gpu", [["TENSOR", [65536, 2], "float32"], ["TENSOR", [1024, 2], "float32"]], {}], "config": {"index": 90566, "code_hash": null, "entity": [["tile_x", "sp", [-1, 2, 8, 8]], ["tile_y", "sp", [-1, 1, 8, 2]], ["tile_k", "sp", [-1, 1, 1]]]}, "result": [[0.0020994654166666665], 0, 1.8183066844940186, 1637496507.0312312], "version": 0.2, "tvm_version": "0.8.dev0"}
{"input": ["cuda -keys=cuda,gpu -max_num_threads=1024 -thread_warp_size=32", "dense_large_batch.gpu", [["TENSOR", [65536, 2], "float32"], ["TENSOR", [1024, 2], "float32"]], {}], "config": {"index": 146662, "code_hash": null, "entity": [["tile_x", "sp", [-1, 1, 16, 4]], ["tile_y", "sp", [-1, 1, 16, 4]], ["tile_k", "sp", [-1, 1, 1]]]}, "result": [[0.0014315094142857143], 0, 1.6997153759002686, 1637496508.6130242], "version": 0.2, "tvm_version": "0.8.dev0"}
{"input": ["cuda -keys=cuda,gpu -max_num_threads=1024 -thread_warp_size=32", "dense_large_batch.gpu", [["TENSOR", [65536, 2], "float32"], ["TENSOR", [1024, 2], "float32"]], {}], "config": {"index": 140838, "code_hash": null, "entity": [["tile_x", "sp", [-1, 4, 8, 4]], ["tile_y", "sp", [-1, 1, 8, 4]], ["tile_k", "sp", [-1, 1, 1]]]}, "result": [[0.0010434448214285716], 0, 1.8504600524902344, 1637496511.9342034], "version": 0.2, "tvm_version": "0.8.dev0"}
{"input": ["cuda -keys=cuda,gpu -max_num_threads=1024 -thread_warp_size=32", "dense_large_batch.gpu", [["TENSOR", [65536, 2], "float32"], ["TENSOR", [1024, 2], "float32"]], {}], "config": {"index": 91637, "code_hash": null, "entity": [["tile_x", "sp", [-1, 2, 8, 16]], ["tile_y", "sp", [-1, 2, 8, 2]], ["tile_k", "sp", [-1, 1, 1]]]}, "result": [[0.0014226722816901409], 0, 1.8289148807525635, 1637496513.744857], "version": 0.2, "tvm_version": "0.8.dev0"}
{"input": ["cuda -keys=cuda,gpu -max_num_threads=1024 -thread_warp_size=32", "dense_large_batch.gpu", [["TENSOR", [65536, 2], "float32"], ["TENSOR", [1024, 2], "float32"]], {}], "config": {"index": 140704, "code_hash": null, "entity": [["tile_x", "sp", [-1, 2, 8, 2]], ["tile_y", "sp", [-1, 1, 8, 4]], ["tile_k", "sp", [-1, 1, 1]]]}, "result": [[0.000966687], 0, 1.6346325874328613, 1637496515.3092675], "version": 0.2, "tvm_version": "0.8.dev0"}
{"input": ["cuda -keys=cuda,gpu -max_num_threads=1024 -thread_warp_size=32", "dense_large_batch.gpu", [["TENSOR", [65536, 2], "float32"], ["TENSOR", [1024, 2], "float32"]], {}], "config": {"index": 38971, "code_hash": null, "entity": [["tile_x", "sp", [-1, 1, 16, 2]], ["tile_y", "sp", [-1, 4, 16, 1]], ["tile_k", "sp", [-1, 1, 1]]]}, "result": [[0.0013429418933333334], 0, 1.8674094676971436, 1637496517.138496], "version": 0.2, "tvm_version": "0.8.dev0"}
{"input": ["cuda -keys=cuda,gpu -max_num_threads=1024 -thread_warp_size=32", "dense_large_batch.gpu", [["TENSOR", [65536, 2], "float32"], ["TENSOR", [1024, 2], "float32"]], {}], "config": {"index": 91134, "code_hash": null, "entity": [["tile_x", "sp", [-1, 1, 8, 1]], ["tile_y", "sp", [-1, 2, 8, 2]], ["tile_k", "sp", [-1, 1, 1]]]}, "result": [[0.0007331671909090909], 0, 2.124945878982544, 1637496519.0852993], "version": 0.2, "tvm_version": "0.8.dev0"}
{"input": ["cuda -keys=cuda,gpu -max_num_threads=1024 -thread_warp_size=32", "dense_large_batch.gpu", [["TENSOR", [65536, 2], "float32"], ["TENSOR", [1024, 2], "float32"]], {}], "config": {"index": 141522, "code_hash": null, "entity": [["tile_x", "sp", [-1, 1, 8, 1]], ["tile_y", "sp", [-1, 2, 8, 4]], ["tile_k", "sp", [-1, 1, 1]]]}, "result": [[0.0010499124444444446], 0, 1.7148716449737549, 1637496522.385087], "version": 0.2, "tvm_version": "0.8.dev0"}
{"input": ["cuda -keys=cuda,gpu -max_num_threads=1024 -thread_warp_size=32", "dense_large_batch.gpu", [["TENSOR", [65536, 2], "float32"], ["TENSOR", [1024, 2], "float32"]], {}], "config": {"index": 140554, "code_hash": null, "entity": [["tile_x", "sp", [-1, 2, 8, 1]], ["tile_y", "sp", [-1, 1, 8, 4]], ["tile_k", "sp", [-1, 1, 1]]]}, "result": [[0.000986168098159509], 0, 1.8677737712860107, 1637496524.1841967], "version": 0.2, "tvm_version": "0.8.dev0"}
{"input": ["cuda -keys=cuda,gpu -max_num_threads=1024 -thread_warp_size=32", "dense_large_batch.gpu", [["TENSOR", [65536, 2], "float32"], ["TENSOR", [1024, 2], "float32"]], {}], "config": {"index": 140705, "code_hash": null, "entity": [["tile_x", "sp", [-1, 4, 8, 2]], ["tile_y", "sp", [-1, 1, 8, 4]], ["tile_k", "sp", [-1, 1, 1]]]}, "result": [[0.0009747713786407768], 0, 1.6570498943328857, 1637496525.7024868], "version": 0.2, "tvm_version": "0.8.dev0"}
{"input": ["cuda -keys=cuda,gpu -max_num_threads=1024 -thread_warp_size=32", "dense_large_batch.gpu", [["TENSOR", [65536, 2], "float32"], ["TENSOR", [1024, 2], "float32"]], {}], "config": {"index": 92104, "code_hash": null, "entity": [["tile_x", "sp", [-1, 2, 8, 1]], ["tile_y", "sp", [-1, 4, 8, 2]], ["tile_k", "sp", [-1, 1, 1]]]}, "result": [[0.000692237952586207], 0, 2.007786273956299, 1637496527.5414023], "version": 0.2, "tvm_version": "0.8.dev0"}
{"input": ["cuda -keys=cuda,gpu -max_num_threads=1024 -thread_warp_size=32", "dense_large_batch.gpu", [["TENSOR", [65536, 2], "float32"], ["TENSOR", [1024, 2], "float32"]], {}], "config": {"index": 31057, "code_hash": null, "entity": [["tile_x", "sp", [-1, 2, 8, 1]], ["tile_y", "sp", [-1, 4, 8, 1]], ["tile_k", "sp", [-1, 1, 1]]]}, "result": [[0.0006908945492957747], 0, 2.1083827018737793, 1637496569.5841033], "version": 0.2, "tvm_version": "0.8.dev0"}
{"input": ["cuda -keys=cuda,gpu -max_num_threads=1024 -thread_warp_size=32", "dense_large_batch.gpu", [["TENSOR", [65536, 2], "float32"], ["TENSOR", [1024, 2], "float32"]], {}], "config": {"index": 91135, "code_hash": null, "entity": [["tile_x", "sp", [-1, 2, 8, 1]], ["tile_y", "sp", [-1, 2, 8, 2]], ["tile_k", "sp", [-1, 1, 1]]]}, "result": [[0.0007119045586206897], 0, 1.9255001544952393, 1637496571.1580164], "version": 0.2, "tvm_version": "0.8.dev0"}
{"input": ["cuda -keys=cuda,gpu -max_num_threads=1024 -thread_warp_size=32", "dense_large_batch.gpu", [["TENSOR", [65536, 2], "float32"], ["TENSOR", [1024, 2], "float32"]], {}], "config": {"index": 140553, "code_hash": null, "entity": [["tile_x", "sp", [-1, 1, 8, 1]], ["tile_y", "sp", [-1, 1, 8, 4]], ["tile_k", "sp", [-1, 1, 1]]]}, "result": [[0.0010341129381443298], 0, 2.1320724487304688, 1637496572.8996496], "version": 0.2, "tvm_version": "0.8.dev0"}
{"input": ["cuda -keys=cuda,gpu -max_num_threads=1024 -thread_warp_size=32", "dense_large_batch.gpu", [["TENSOR", [65536, 2], "float32"], ["TENSOR", [1024, 2], "float32"]], {}], "config": {"index": 91284, "code_hash": null, "entity": [["tile_x", "sp", [-1, 1, 8, 2]], ["tile_y", "sp", [-1, 2, 8, 2]], ["tile_k", "sp", [-1, 1, 1]]]}, "result": [[0.000809955968992248], 0, 2.114823579788208, 1637496574.6591063], "version": 0.2, "tvm_version": "0.8.dev0"}
{"input": ["cuda -keys=cuda,gpu -max_num_threads=1024 -thread_warp_size=32", "dense_large_batch.gpu", [["TENSOR", [65536, 2], "float32"], ["TENSOR", [1024, 2], "float32"]], {}], "config": {"index": 31056, "code_hash": null, "entity": [["tile_x", "sp", [-1, 1, 8, 1]], ["tile_y", "sp", [-1, 4, 8, 1]], ["tile_k", "sp", [-1, 1, 1]]]}, "result": [[0.00073593575], 0, 1.9605095386505127, 1637496576.2966354], "version": 0.2, "tvm_version": "0.8.dev0"}
{"input": ["cuda -keys=cuda,gpu -max_num_threads=1024 -thread_warp_size=32", "dense_large_batch.gpu", [["TENSOR", [65536, 2], "float32"], ["TENSOR", [1024, 2], "float32"]], {}], "config": {"index": 31058, "code_hash": null, "entity": [["tile_x", "sp", [-1, 4, 8, 1]], ["tile_y", "sp", [-1, 4, 8, 1]], ["tile_k", "sp", [-1, 1, 1]]]}, "result": [[0.0007180745401785713], 0, 2.011566638946533, 1637496577.9658933], "version": 0.2, "tvm_version": "0.8.dev0"}
{"input": ["cuda -keys=cuda,gpu -max_num_threads=1024 -thread_warp_size=32", "dense_large_batch.gpu", [["TENSOR", [65536, 2], "float32"], ["TENSOR", [1024, 2], "float32"]], {}], "config": {"index": 92103, "code_hash": null, "entity": [["tile_x", "sp", [-1, 1, 8, 1]], ["tile_y", "sp", [-1, 4, 8, 2]], ["tile_k", "sp", [-1, 1, 1]]]}, "result": [[0.0007577622132701421], 0, 2.069237470626831, 1637496579.67502], "version": 0.2, "tvm_version": "0.8.dev0"}
{"input": ["cuda -keys=cuda,gpu -max_num_threads=1024 -thread_warp_size=32", "dense_large_batch.gpu", [["TENSOR", [65536, 2], "float32"], ["TENSOR", [1024, 2], "float32"]], {}], "config": {"index": 140555, "code_hash": null, "entity": [["tile_x", "sp", [-1, 4, 8, 1]], ["tile_y", "sp", [-1, 1, 8, 4]], ["tile_k", "sp", [-1, 1, 1]]]}, "result": [[0.0010191828481012659], 0, 1.9590232372283936, 1637496581.311162], "version": 0.2, "tvm_version": "0.8.dev0"}
{"input": ["cuda -keys=cuda,gpu -max_num_threads=1024 -thread_warp_size=32", "dense_large_batch.gpu", [["TENSOR", [65536, 2], "float32"], ["TENSOR", [1024, 2], "float32"]], {}], "config": {"index": 90166, "code_hash": null, "entity": [["tile_x", "sp", [-1, 2, 8, 1]], ["tile_y", "sp", [-1, 1, 8, 2]], ["tile_k", "sp", [-1, 1, 1]]]}, "result": [[0.0016939685333333333], 0, 1.8750195503234863, 1637496582.945386], "version": 0.2, "tvm_version": "0.8.dev0"}
{"input": ["cuda -keys=cuda,gpu -max_num_threads=1024 -thread_warp_size=32", "dense_large_batch.gpu", [["TENSOR", [65536, 2], "float32"], ["TENSOR", [1024, 2], "float32"]], {}], "config": {"index": 146382, "code_hash": null, "entity": [["tile_x", "sp", [-1, 2, 16, 1]], ["tile_y", "sp", [-1, 1, 16, 4]], ["tile_k", "sp", [-1, 1, 1]]]}, "result": [[0.00134494316], 0, 2.0661134719848633, 1637496584.707826], "version": 0.2, "tvm_version": "0.8.dev0"}
{"input": ["cuda -keys=cuda,gpu -max_num_threads=1024 -thread_warp_size=32", "dense_large_batch.gpu", [["TENSOR", [65536, 2], "float32"], ["TENSOR", [1024, 2], "float32"]], {}], "config": {"index": 91136, "code_hash": null, "entity": [["tile_x", "sp", [-1, 4, 8, 1]], ["tile_y", "sp", [-1, 2, 8, 2]], ["tile_k", "sp", [-1, 1, 1]]]}, "result": [[0.0010443969281045751], 0, 2.0808091163635254, 1637496586.3781238], "version": 0.2, "tvm_version": "0.8.dev0"}
{"input": ["cuda -keys=cuda,gpu -max_num_threads=1024 -thread_warp_size=32", "dense_large_batch.gpu", [["TENSOR", [65536, 2], "float32"], ["TENSOR", [1024, 2], "float32"]], {}], "config": {"index": 31207, "code_hash": null, "entity": [["tile_x", "sp", [-1, 2, 8, 2]], ["tile_y", "sp", [-1, 4, 8, 1]], ["tile_k", "sp", [-1, 1, 1]]]}, "result": [[0.0008332532066115704], 0, 1.946185827255249, 1637496587.8884735], "version": 0.2, "tvm_version": "0.8.dev0"}
{"input": ["cuda -keys=cuda,gpu -max_num_threads=1024 -thread_warp_size=32", "dense_large_batch.gpu", [["TENSOR", [65536, 2], "float32"], ["TENSOR", [1024, 2], "float32"]], {}], "config": {"index": 90755, "code_hash": null, "entity": [["tile_x", "sp", [-1, 1, 8, 32]], ["tile_y", "sp", [-1, 1, 8, 2]], ["tile_k", "sp", [-1, 1, 1]]]}, "result": [[0.0019492388653846156], 0, 2.1160566806793213, 1637496589.446143], "version": 0.2, "tvm_version": "0.8.dev0"}
{"input": ["cuda -keys=cuda,gpu -max_num_threads=1024 -thread_warp_size=32", "dense_large_batch.gpu", [["TENSOR", [65536, 2], "float32"], ["TENSOR", [1024, 2], "float32"]], {}], "config": {"index": 146531, "code_hash": null, "entity": [["tile_x", "sp", [-1, 2, 16, 2]], ["tile_y", "sp", [-1, 1, 16, 4]], ["tile_k", "sp", [-1, 1, 1]]]}, "result": [[0.0013420723240740741], 0, 2.1256234645843506, 1637496591.3511114], "version": 0.2, "tvm_version": "0.8.dev0"}
{"input": ["cuda -keys=cuda,gpu -max_num_threads=1024 -thread_warp_size=32", "dense_large_batch.gpu", [["TENSOR", [65536, 2], "float32"], ["TENSOR", [1024, 2], "float32"]], {}], "config": {"index": 38823, "code_hash": null, "entity": [["tile_x", "sp", [-1, 2, 16, 1]], ["tile_y", "sp", [-1, 4, 16, 1]], ["tile_k", "sp", [-1, 1, 1]]]}, "result": [[0.0013460577866666668], 0, 1.9791522026062012, 1637496592.9908154], "version": 0.2, "tvm_version": "0.8.dev0"}
{"input": ["cuda -keys=cuda,gpu -max_num_threads=1024 -thread_warp_size=32", "dense_large_batch.gpu", [["TENSOR", [65536, 2], "float32"], ["TENSOR", [1024, 2], "float32"]], {}], "config": {"index": 141143, "code_hash": null, "entity": [["tile_x", "sp", [-1, 1, 8, 32]], ["tile_y", "sp", [-1, 1, 8, 4]], ["tile_k", "sp", [-1, 1, 1]]]}, "result": [[0.0012759515793650796], 0, 2.2614188194274902, 1637496594.8026075], "version": 0.2, "tvm_version": "0.8.dev0"}
{"input": ["cuda -keys=cuda,gpu -max_num_threads=1024 -thread_warp_size=32", "dense_large_batch.gpu", [["TENSOR", [65536, 2], "float32"], ["TENSOR", [1024, 2], "float32"]], {}], "config": {"index": 141144, "code_hash": null, "entity": [["tile_x", "sp", [-1, 2, 8, 32]], ["tile_y", "sp", [-1, 1, 8, 4]], ["tile_k", "sp", [-1, 1, 1]]]}, "result": [[0.006871517666666668], 0, 2.3333330154418945, 1637496596.482241], "version": 0.2, "tvm_version": "0.8.dev0"}
{"input": ["cuda -keys=cuda,gpu -max_num_threads=1024 -thread_warp_size=32", "dense_large_batch.gpu", [["TENSOR", [65536, 2], "float32"], ["TENSOR", [1024, 2], "float32"]], {}], "config": {"index": 140703, "code_hash": null, "entity": [["tile_x", "sp", [-1, 1, 8, 2]], ["tile_y", "sp", [-1, 1, 8, 4]], ["tile_k", "sp", [-1, 1, 1]]]}, "result": [[0.0009627092403846154], 0, 1.87241530418396, 1637496598.0436192], "version": 0.2, "tvm_version": "0.8.dev0"}
{"input": ["cuda -keys=cuda,gpu -max_num_threads=1024 -thread_warp_size=32", "dense_large_batch.gpu", [["TENSOR", [65536, 2], "float32"], ["TENSOR", [1024, 2], "float32"]], {}], "config": {"index": 30677, "code_hash": null, "entity": [["tile_x", "sp", [-1, 1, 8, 32]], ["tile_y", "sp", [-1, 2, 8, 1]], ["tile_k", "sp", [-1, 1, 1]]]}, "result": [[0.002000769025], 0, 2.2303707599639893, 1637496599.8392694], "version": 0.2, "tvm_version": "0.8.dev0"}
{"input": ["cuda -keys=cuda,gpu -max_num_threads=1024 -thread_warp_size=32", "dense_large_batch.gpu", [["TENSOR", [65536, 2], "float32"], ["TENSOR", [1024, 2], "float32"]], {}], "config": {"index": 37854, "code_hash": null, "entity": [["tile_x", "sp", [-1, 2, 16, 1]], ["tile_y", "sp", [-1, 2, 16, 1]], ["tile_k", "sp", [-1, 1, 1]]]}, "result": [[0.0013429805466666667], 0, 1.849696397781372, 1637496601.3774757], "version": 0.2, "tvm_version": "0.8.dev0"}
{"input": ["cuda -keys=cuda,gpu -max_num_threads=1024 -thread_warp_size=32", "dense_large_batch.gpu", [["TENSOR", [65536, 2], "float32"], ["TENSOR", [1024, 2], "float32"]], {}], "config": {"index": 140556, "code_hash": null, "entity": [["tile_x", "sp", [-1, 8, 8, 1]], ["tile_y", "sp", [-1, 1, 8, 4]], ["tile_k", "sp", [-1, 1, 1]]]}, "result": [[0.0010183955316455696], 0, 2.087817668914795, 1637496603.0332897], "version": 0.2, "tvm_version": "0.8.dev0"}
{"input": ["cuda -keys=cuda,gpu -max_num_threads=1024 -thread_warp_size=32", "dense_large_batch.gpu", [["TENSOR", [65536, 2], "float32"], ["TENSOR", [1024, 2], "float32"]], {}], "config": {"index": 37033, "code_hash": null, "entity": [["tile_x", "sp", [-1, 1, 16, 2]], ["tile_y", "sp", [-1, 1, 16, 1]], ["tile_k", "sp", [-1, 1, 1]]]}, "result": [[0.0013573763513513512], 0, 1.932959794998169, 1637496604.5847783], "version": 0.2, "tvm_version": "0.8.dev0"}
{"input": ["cuda -keys=cuda,gpu -max_num_threads=1024 -thread_warp_size=32", "dense_large_batch.gpu", [["TENSOR", [65536, 2], "float32"], ["TENSOR", [1024, 2], "float32"]], {}], "config": {"index": 98081, "code_hash": null, "entity": [["tile_x", "sp", [-1, 2, 16, 2]], ["tile_y", "sp", [-1, 2, 16, 2]], ["tile_k", "sp", [-1, 1, 1]]]}, "result": [[0.0013423152399999999], 0, 1.9000325202941895, 1637496606.137897], "version": 0.2, "tvm_version": "0.8.dev0"}
{"input": ["cuda -keys=cuda,gpu -max_num_threads=1024 -thread_warp_size=32", "dense_large_batch.gpu", [["TENSOR", [65536, 2], "float32"], ["TENSOR", [1024, 2], "float32"]], {}], "config": {"index": 91285, "code_hash": null, "entity": [["tile_x", "sp", [-1, 2, 8, 2]], ["tile_y", "sp", [-1, 2, 8, 2]], ["tile_k", "sp", [-1, 1, 1]]]}, "result": [[0.0007528201943127961], 0, 2.1347241401672363, 1637496607.9124944], "version": 0.2, "tvm_version": "0.8.dev0"}
{"input": ["cuda -keys=cuda,gpu -max_num_threads=1024 -thread_warp_size=32", "dense_large_batch.gpu", [["TENSOR", [65536, 2], "float32"], ["TENSOR", [1024, 2], "float32"]], {}], "config": {"index": 90165, "code_hash": null, "entity": [["tile_x", "sp", [-1, 1, 8, 1]], ["tile_y", "sp", [-1, 1, 8, 2]], ["tile_k", "sp", [-1, 1, 1]]]}, "result": [[0.0016781962315789475], 0, 2.0165274143218994, 1637496611.1615696], "version": 0.2, "tvm_version": "0.8.dev0"}
{"input": ["cuda -keys=cuda,gpu -max_num_threads=1024 -thread_warp_size=32", "dense_large_batch.gpu", [["TENSOR", [65536, 2], "float32"], ["TENSOR", [1024, 2], "float32"]], {}], "config": {"index": 90315, "code_hash": null, "entity": [["tile_x", "sp", [-1, 1, 8, 2]], ["tile_y", "sp", [-1, 1, 8, 2]], ["tile_k", "sp", [-1, 1, 1]]]}, "result": [[0.0016402010327868854], 0, 2.0697336196899414, 1637496612.999941], "version": 0.2, "tvm_version": "0.8.dev0"}
{"input": ["cuda -keys=cuda,gpu -max_num_threads=1024 -thread_warp_size=32", "dense_large_batch.gpu", [["TENSOR", [65536, 2], "float32"], ["TENSOR", [1024, 2], "float32"]], {}], "config": {"index": 31208, "code_hash": null, "entity": [["tile_x", "sp", [-1, 4, 8, 2]], ["tile_y", "sp", [-1, 4, 8, 1]], ["tile_k", "sp", [-1, 1, 1]]]}, "result": [[0.0009432171495327103], 0, 1.8830621242523193, 1637496614.6006126], "version": 0.2, "tvm_version": "0.8.dev0"}
{"input": ["cuda -keys=cuda,gpu -max_num_threads=1024 -thread_warp_size=32", "dense_large_batch.gpu", [["TENSOR", [65536, 2], "float32"], ["TENSOR", [1024, 2], "float32"]], {}], "config": {"index": 92253, "code_hash": null, "entity": [["tile_x", "sp", [-1, 1, 8, 2]], ["tile_y", "sp", [-1, 4, 8, 2]], ["tile_k", "sp", [-1, 1, 1]]]}, "result": [[0.0006778995864978903], 0, 1.969602346420288, 1637496616.3240232], "version": 0.2, "tvm_version": "0.8.dev0"}
{"input": ["cuda -keys=cuda,gpu -max_num_threads=1024 -thread_warp_size=32", "dense_large_batch.gpu", [["TENSOR", [65536, 2], "float32"], ["TENSOR", [1024, 2], "float32"]], {}], "config": {"index": 91137, "code_hash": null, "entity": [["tile_x", "sp", [-1, 8, 8, 1]], ["tile_y", "sp", [-1, 2, 8, 2]], ["tile_k", "sp", [-1, 1, 1]]]}, "result": [[0.0019088986226415093], 0, 1.8926670551300049, 1637496617.9702566], "version": 0.2, "tvm_version": "0.8.dev0"}
{"input": ["cuda -keys=cuda,gpu -max_num_threads=1024 -thread_warp_size=32", "dense_large_batch.gpu", [["TENSOR", [65536, 2], "float32"], ["TENSOR", [1024, 2], "float32"]], {}], "config": {"index": 140837, "code_hash": null, "entity": [["tile_x", "sp", [-1, 2, 8, 4]], ["tile_y", "sp", [-1, 1, 8, 4]], ["tile_k", "sp", [-1, 1, 1]]]}, "result": [[0.0010306493525641025], 0, 2.0068790912628174, 1637496619.730512], "version": 0.2, "tvm_version": "0.8.dev0"}
{"input": ["cuda -keys=cuda,gpu -max_num_threads=1024 -thread_warp_size=32", "dense_large_batch.gpu", [["TENSOR", [65536, 2], "float32"], ["TENSOR", [1024, 2], "float32"]], {}], "config": {"index": 90667, "code_hash": null, "entity": [["tile_x", "sp", [-1, 1, 8, 16]], ["tile_y", "sp", [-1, 1, 8, 2]], ["tile_k", "sp", [-1, 1, 1]]]}, "result": [[0.0020125669], 0, 1.7200422286987305, 1637496621.2440078], "version": 0.2, "tvm_version": "0.8.dev0"}
{"input": ["cuda -keys=cuda,gpu -max_num_threads=1024 -thread_warp_size=32", "dense_large_batch.gpu", [["TENSOR", [65536, 2], "float32"], ["TENSOR", [1024, 2], "float32"]], {}], "config": {"index": 140953, "code_hash": null, "entity": [["tile_x", "sp", [-1, 1, 8, 8]], ["tile_y", "sp", [-1, 1, 8, 4]], ["tile_k", "sp", [-1, 1, 1]]]}, "result": [[0.0010812714731182795], 0, 1.8077828884124756, 1637496622.8090982], "version": 0.2, "tvm_version": "0.8.dev0"}
{"input": ["cuda -keys=cuda,gpu -max_num_threads=1024 -thread_warp_size=32", "dense_large_batch.gpu", [["TENSOR", [65536, 2], "float32"], ["TENSOR", [1024, 2], "float32"]], {}], "config": {"index": 97932, "code_hash": null, "entity": [["tile_x", "sp", [-1, 2, 16, 1]], ["tile_y", "sp", [-1, 2, 16, 2]], ["tile_k", "sp", [-1, 1, 1]]]}, "result": [[0.0013449751466666666], 0, 2.0423240661621094, 1637496624.6354942], "version": 0.2, "tvm_version": "0.8.dev0"}
{"input": ["cuda -keys=cuda,gpu -max_num_threads=1024 -thread_warp_size=32", "dense_large_batch.gpu", [["TENSOR", [65536, 2], "float32"], ["TENSOR", [1024, 2], "float32"]], {}], "config": {"index": 146383, "code_hash": null, "entity": [["tile_x", "sp", [-1, 4, 16, 1]], ["tile_y", "sp", [-1, 1, 16, 4]], ["tile_k", "sp", [-1, 1, 1]]]}, "result": [[0.0013488555210084035], 0, 2.0811290740966797, 1637496626.4747047], "version": 0.2, "tvm_version": "0.8.dev0"}
{"input": ["cuda -keys=cuda,gpu -max_num_threads=1024 -thread_warp_size=32", "dense_large_batch.gpu", [["TENSOR", [65536, 2], "float32"], ["TENSOR", [1024, 2], "float32"]], {}], "config": {"index": 30237, "code_hash": null, "entity": [["tile_x", "sp", [-1, 1, 8, 2]], ["tile_y", "sp", [-1, 2, 8, 1]], ["tile_k", "sp", [-1, 1, 1]]]}, "result": [[0.0016705754590163934], 0, 1.8528673648834229, 1637496628.098757], "version": 0.2, "tvm_version": "0.8.dev0"}
{"input": ["cuda -keys=cuda,gpu -max_num_threads=1024 -thread_warp_size=32", "dense_large_batch.gpu", [["TENSOR", [65536, 2], "float32"], ["TENSOR", [1024, 2], "float32"]], {}], "config": {"index": 141055, "code_hash": null, "entity": [["tile_x", "sp", [-1, 1, 8, 16]], ["tile_y", "sp", [-1, 1, 8, 4]], ["tile_k", "sp", [-1, 1, 1]]]}, "result": [[0.0011621379424460432], 0, 1.9971528053283691, 1637496629.8380902], "version": 0.2, "tvm_version": "0.8.dev0"}
{"input": ["cuda -keys=cuda,gpu -max_num_threads=1024 -thread_warp_size=32", "dense_large_batch.gpu", [["TENSOR", [65536, 2], "float32"], ["TENSOR", [1024, 2], "float32"]], {}], "config": {"index": 31339, "code_hash": null, "entity": [["tile_x", "sp", [-1, 1, 8, 4]], ["tile_y", "sp", [-1, 4, 8, 1]], ["tile_k", "sp", [-1, 1, 1]]]}, "result": [[0.001030996322580645], 0, 1.9308805465698242, 1637496631.5257554], "version": 0.2, "tvm_version": "0.8.dev0"}
{"input": ["cuda -keys=cuda,gpu -max_num_threads=1024 -thread_warp_size=32", "dense_large_batch.gpu", [["TENSOR", [65536, 2], "float32"], ["TENSOR", [1024, 2], "float32"]], {}], "config": {"index": 31646, "code_hash": null, "entity": [["tile_x", "sp", [-1, 1, 8, 32]], ["tile_y", "sp", [-1, 4, 8, 1]], ["tile_k", "sp", [-1, 1, 1]]]}, "result": [[0.0013714840135135135], 0, 1.8727643489837646, 1637496633.0989509], "version": 0.2, "tvm_version": "0.8.dev0"}
{"input": ["cuda -keys=cuda,gpu -max_num_threads=1024 -thread_warp_size=32", "dense_large_batch.gpu", [["TENSOR", [65536, 2], "float32"], ["TENSOR", [1024, 2], "float32"]], {}], "config": {"index": 92105, "code_hash": null, "entity": [["tile_x", "sp", [-1, 4, 8, 1]], ["tile_y", "sp", [-1, 4, 8, 2]], ["tile_k", "sp", [-1, 1, 1]]]}, "result": [[0.0012415857530864197], 0, 1.8807566165924072, 1637496634.7289596], "version": 0.2, "tvm_version": "0.8.dev0"}
{"input": ["cuda -keys=cuda,gpu -max_num_threads=1024 -thread_warp_size=32", "dense_large_batch.gpu", [["TENSOR", [65536, 2], "float32"], ["TENSOR", [1024, 2], "float32"]], {}], "config": {"index": 92106, "code_hash": null, "entity": [["tile_x", "sp", [-1, 8, 8, 1]], ["tile_y", "sp", [-1, 4, 8, 2]], ["tile_k", "sp", [-1, 1, 1]]]}, "result": [[0.0020923947916666667], 0, 1.8671340942382812, 1637496636.2745295], "version": 0.2, "tvm_version": "0.8.dev0"}
{"input": ["cuda -keys=cuda,gpu -max_num_threads=1024 -thread_warp_size=32", "dense_large_batch.gpu", [["TENSOR", [65536, 2], "float32"], ["TENSOR", [1024, 2], "float32"]], {}], "config": {"index": 31059, "code_hash": null, "entity": [["tile_x", "sp", [-1, 8, 8, 1]], ["tile_y", "sp", [-1, 4, 8, 1]], ["tile_k", "sp", [-1, 1, 1]]]}, "result": [[0.0009370799532710281], 0, 1.8846538066864014, 1637496637.9058053], "version": 0.2, "tvm_version": "0.8.dev0"}
{"input": ["cuda -keys=cuda,gpu -max_num_threads=1024 -thread_warp_size=32", "dense_large_batch.gpu", [["TENSOR", [65536, 2], "float32"], ["TENSOR", [1024, 2], "float32"]], {}], "config": {"index": 90316, "code_hash": null, "entity": [["tile_x", "sp", [-1, 2, 8, 2]], ["tile_y", "sp", [-1, 1, 8, 2]], ["tile_k", "sp", [-1, 1, 1]]]}, "result": [[0.0016916036166666666], 0, 1.9246420860290527, 1637496639.6000962], "version": 0.2, "tvm_version": "0.8.dev0"}
{"input": ["cuda -keys=cuda,gpu -max_num_threads=1024 -thread_warp_size=32", "dense_large_batch.gpu", [["TENSOR", [65536, 2], "float32"], ["TENSOR", [1024, 2], "float32"]], {}], "config": {"index": 30088, "code_hash": null, "entity": [["tile_x", "sp", [-1, 2, 8, 1]], ["tile_y", "sp", [-1, 2, 8, 1]], ["tile_k", "sp", [-1, 1, 1]]]}, "result": [[0.0017277226021505374], 0, 1.8943321704864502, 1637496641.2597284], "version": 0.2, "tvm_version": "0.8.dev0"}
{"input": ["cuda -keys=cuda,gpu -max_num_threads=1024 -thread_warp_size=32", "dense_large_batch.gpu", [["TENSOR", [65536, 2], "float32"], ["TENSOR", [1024, 2], "float32"]], {}], "config": {"index": 146778, "code_hash": null, "entity": [["tile_x", "sp", [-1, 1, 16, 8]], ["tile_y", "sp", [-1, 1, 16, 4]], ["tile_k", "sp", [-1, 1, 1]]]}, "result": [[0.002359819], 0, 1.686814546585083, 1637496642.7358031], "version": 0.2, "tvm_version": "0.8.dev0"}
{"input": ["cuda -keys=cuda,gpu -max_num_threads=1024 -thread_warp_size=32", "dense_large_batch.gpu", [["TENSOR", [65536, 2], "float32"], ["TENSOR", [1024, 2], "float32"]], {}], "config": {"index": 32025, "code_hash": null, "entity": [["tile_x", "sp", [-1, 1, 8, 1]], ["tile_y", "sp", [-1, 8, 8, 1]], ["tile_k", "sp", [-1, 1, 1]]]}, "result": [[0.0007501891527777777], 0, 2.001805067062378, 1637496644.508263], "version": 0.2, "tvm_version": "0.8.dev0"}
{"input": ["cuda -keys=cuda,gpu -max_num_threads=1024 -thread_warp_size=32", "dense_large_batch.gpu", [["TENSOR", [65536, 2], "float32"], ["TENSOR", [1024, 2], "float32"]], {}], "config": {"index": 146663, "code_hash": null, "entity": [["tile_x", "sp", [-1, 2, 16, 4]], ["tile_y", "sp", [-1, 1, 16, 4]], ["tile_k", "sp", [-1, 1, 1]]]}, "result": [[0.0021649767659574467], 0, 1.824406623840332, 1637496646.06079], "version": 0.2, "tvm_version": "0.8.dev0"}
{"input": ["cuda -keys=cuda,gpu -max_num_threads=1024 -thread_warp_size=32", "dense_large_batch.gpu", [["TENSOR", [65536, 2], "float32"], ["TENSOR", [1024, 2], "float32"]], {}], "config": {"index": 90167, "code_hash": null, "entity": [["tile_x", "sp", [-1, 4, 8, 1]], ["tile_y", "sp", [-1, 1, 8, 2]], ["tile_k", "sp", [-1, 1, 1]]]}, "result": [[0.0017251976379310345], 0, 1.827756404876709, 1637496647.7015977], "version": 0.2, "tvm_version": "0.8.dev0"}
{"input": ["cuda -keys=cuda,gpu -max_num_threads=1024 -thread_warp_size=32", "dense_large_batch.gpu", [["TENSOR", [65536, 2], "float32"], ["TENSOR", [1024, 2], "float32"]], {}], "config": {"index": 91417, "code_hash": null, "entity": [["tile_x", "sp", [-1, 1, 8, 4]], ["tile_y", "sp", [-1, 2, 8, 2]], ["tile_k", "sp", [-1, 1, 1]]]}, "result": [[0.000857383], 0, 1.9252326488494873, 1637496649.41727], "version": 0.2, "tvm_version": "0.8.dev0"}
{"input": ["cuda -keys=cuda,gpu -max_num_threads=1024 -thread_warp_size=32", "dense_large_batch.gpu", [["TENSOR", [65536, 2], "float32"], ["TENSOR", [1024, 2], "float32"]], {}], "config": {"index": 29401, "code_hash": null, "entity": [["tile_x", "sp", [-1, 1, 8, 4]], ["tile_y", "sp", [-1, 1, 8, 1]], ["tile_k", "sp", [-1, 1, 1]]]}, "result": [[0.0038411164444444447], 0, 1.9072058200836182, 1637496652.4819748], "version": 0.2, "tvm_version": "0.8.dev0"}
{"input": ["cuda -keys=cuda,gpu -max_num_threads=1024 -thread_warp_size=32", "dense_large_batch.gpu", [["TENSOR", [65536, 2], "float32"], ["TENSOR", [1024, 2], "float32"]], {}], "config": {"index": 29268, "code_hash": null, "entity": [["tile_x", "sp", [-1, 1, 8, 2]], ["tile_y", "sp", [-1, 1, 8, 1]], ["tile_k", "sp", [-1, 1, 1]]]}, "result": [[0.0038236244444444446], 0, 1.8583405017852783, 1637496654.1327896], "version": 0.2, "tvm_version": "0.8.dev0"}
{"input": ["cuda -keys=cuda,gpu -max_num_threads=1024 -thread_warp_size=32", "dense_large_batch.gpu", [["TENSOR", [65536, 2], "float32"], ["TENSOR", [1024, 2], "float32"]], {}], "config": {"index": 91636, "code_hash": null, "entity": [["tile_x", "sp", [-1, 1, 8, 16]], ["tile_y", "sp", [-1, 2, 8, 2]], ["tile_k", "sp", [-1, 1, 1]]]}, "result": [[0.001283302064102564], 0, 2.4113221168518066, 1637496656.3286302], "version": 0.2, "tvm_version": "0.8.dev0"}
{"input": ["cuda -keys=cuda,gpu -max_num_threads=1024 -thread_warp_size=32", "dense_large_batch.gpu", [["TENSOR", [65536, 2], "float32"], ["TENSOR", [1024, 2], "float32"]], {}], "config": {"index": 39103, "code_hash": null, "entity": [["tile_x", "sp", [-1, 1, 16, 4]], ["tile_y", "sp", [-1, 4, 16, 1]], ["tile_k", "sp", [-1, 1, 1]]]}, "result": [[0.0014290566142857143], 0, 1.918700933456421, 1637496658.0005674], "version": 0.2, "tvm_version": "0.8.dev0"}
{"input": ["cuda -keys=cuda,gpu -max_num_threads=1024 -thread_warp_size=32", "dense_large_batch.gpu", [["TENSOR", [65536, 2], "float32"], ["TENSOR", [1024, 2], "float32"]], {}], "config": {"index": 91535, "code_hash": null, "entity": [["tile_x", "sp", [-1, 2, 8, 8]], ["tile_y", "sp", [-1, 2, 8, 2]], ["tile_k", "sp", [-1, 1, 1]]]}, "result": [[0.0012927218790322582], 0, 2.2332911491394043, 1637496659.8630292], "version": 0.2, "tvm_version": "0.8.dev0"}
{"input": ["cuda -keys=cuda,gpu -max_num_threads=1024 -thread_warp_size=32", "dense_large_batch.gpu", [["TENSOR", [65536, 2], "float32"], ["TENSOR", [1024, 2], "float32"]], {}], "config": {"index": 29119, "code_hash": null, "entity": [["tile_x", "sp", [-1, 2, 8, 1]], ["tile_y", "sp", [-1, 1, 8, 1]], ["tile_k", "sp", [-1, 1, 1]]]}, "result": [[0.003845034851851852], 0, 1.713913917541504, 1637496661.3744302], "version": 0.2, "tvm_version": "0.8.dev0"}
{"input": ["cuda -keys=cuda,gpu -max_num_threads=1024 -thread_warp_size=32", "dense_large_batch.gpu", [["TENSOR", [65536, 2], "float32"], ["TENSOR", [1024, 2], "float32"]], {}], "config": {"index": 97460, "code_hash": null, "entity": [["tile_x", "sp", [-1, 1, 16, 16]], ["tile_y", "sp", [-1, 1, 16, 2]], ["tile_k", "sp", [-1, 1, 1]]]}, "result": [[0.0024410576097560976], 0, 1.7546534538269043, 1637496662.864516], "version": 0.2, "tvm_version": "0.8.dev0"}
{"input": ["cuda -keys=cuda,gpu -max_num_threads=1024 -thread_warp_size=32", "dense_large_batch.gpu", [["TENSOR", [65536, 2], "float32"], ["TENSOR", [1024, 2], "float32"]], {}], "config": {"index": 38972, "code_hash": null, "entity": [["tile_x", "sp", [-1, 2, 16, 2]], ["tile_y", "sp", [-1, 4, 16, 1]], ["tile_k", "sp", [-1, 1, 1]]]}, "result": [[0.0013428138933333333], 0, 1.9255383014678955, 1637496664.6122007], "version": 0.2, "tvm_version": "0.8.dev0"}
{"input": ["cuda -keys=cuda,gpu -max_num_threads=1024 -thread_warp_size=32", "dense_large_batch.gpu", [["TENSOR", [65536, 2], "float32"], ["TENSOR", [1024, 2], "float32"]], {}], "config": {"index": 91534, "code_hash": null, "entity": [["tile_x", "sp", [-1, 1, 8, 8]], ["tile_y", "sp", [-1, 2, 8, 2]], ["tile_k", "sp", [-1, 1, 1]]]}, "result": [[0.0011545959655172413], 0, 1.9638323783874512, 1637496666.324437], "version": 0.2, "tvm_version": "0.8.dev0"}
{"input": ["cuda -keys=cuda,gpu -max_num_threads=1024 -thread_warp_size=32", "dense_large_batch.gpu", [["TENSOR", [65536, 2], "float32"], ["TENSOR", [1024, 2], "float32"]], {}], "config": {"index": 97113, "code_hash": null, "entity": [["tile_x", "sp", [-1, 4, 16, 2]], ["tile_y", "sp", [-1, 1, 16, 2]], ["tile_k", "sp", [-1, 1, 1]]]}, "result": [[0.0013808032739726027], 0, 1.92830228805542, 1637496667.9958825], "version": 0.2, "tvm_version": "0.8.dev0"}
{"input": ["cuda -keys=cuda,gpu -max_num_threads=1024 -thread_warp_size=32", "dense_large_batch.gpu", [["TENSOR", [65536, 2], "float32"], ["TENSOR", [1024, 2], "float32"]], {}], "config": {"index": 30590, "code_hash": null, "entity": [["tile_x", "sp", [-1, 2, 8, 16]], ["tile_y", "sp", [-1, 2, 8, 1]], ["tile_k", "sp", [-1, 1, 1]]]}, "result": [[0.00200058728], 0, 1.7596330642700195, 1637496669.5609262], "version": 0.2, "tvm_version": "0.8.dev0"}
{"input": ["cuda -keys=cuda,gpu -max_num_threads=1024 -thread_warp_size=32", "dense_large_batch.gpu", [["TENSOR", [65536, 2], "float32"], ["TENSOR", [1024, 2], "float32"]], {}], "config": {"index": 31206, "code_hash": null, "entity": [["tile_x", "sp", [-1, 1, 8, 2]], ["tile_y", "sp", [-1, 4, 8, 1]], ["tile_k", "sp", [-1, 1, 1]]]}, "result": [[0.0007013990601851852], 0, 1.9849731922149658, 1637496704.6216204], "version": 0.2, "tvm_version": "0.8.dev0"}
{"input": ["cuda -keys=cuda,gpu -max_num_threads=1024 -thread_warp_size=32", "dense_large_batch.gpu", [["TENSOR", [65536, 2], "float32"], ["TENSOR", [1024, 2], "float32"]], {}], "config": {"index": 32175, "code_hash": null, "entity": [["tile_x", "sp", [-1, 1, 8, 2]], ["tile_y", "sp", [-1, 8, 8, 1]], ["tile_k", "sp", [-1, 1, 1]]]}, "result": [[0.0006807186525423728], 0, 1.8726248741149902, 1637496706.3181827], "version": 0.2, "tvm_version": "0.8.dev0"}
{"input": ["cuda -keys=cuda,gpu -max_num_threads=1024 -thread_warp_size=32", "dense_large_batch.gpu", [["TENSOR", [65536, 2], "float32"], ["TENSOR", [1024, 2], "float32"]], {}], "config": {"index": 140836, "code_hash": null, "entity": [["tile_x", "sp", [-1, 1, 8, 4]], ["tile_y", "sp", [-1, 1, 8, 4]], ["tile_k", "sp", [-1, 1, 1]]]}, "result": [[0.0010116975656565656], 0, 1.7069149017333984, 1637496707.853395], "version": 0.2, "tvm_version": "0.8.dev0"}
{"input": ["cuda -keys=cuda,gpu -max_num_threads=1024 -thread_warp_size=32", "dense_large_batch.gpu", [["TENSOR", [65536, 2], "float32"], ["TENSOR", [1024, 2], "float32"]], {}], "config": {"index": 32176, "code_hash": null, "entity": [["tile_x", "sp", [-1, 2, 8, 2]], ["tile_y", "sp", [-1, 8, 8, 1]], ["tile_k", "sp", [-1, 1, 1]]]}, "result": [[0.0006769110084388186], 0, 2.11580753326416, 1637496709.7669833], "version": 0.2, "tvm_version": "0.8.dev0"}
{"input": ["cuda -keys=cuda,gpu -max_num_threads=1024 -thread_warp_size=32", "dense_large_batch.gpu", [["TENSOR", [65536, 2], "float32"], ["TENSOR", [1024, 2], "float32"]], {}], "config": {"index": 32027, "code_hash": null, "entity": [["tile_x", "sp", [-1, 4, 8, 1]], ["tile_y", "sp", [-1, 8, 8, 1]], ["tile_k", "sp", [-1, 1, 1]]]}, "result": [[0.0007202730935251798], 0, 1.9164211750030518, 1637496711.5015874], "version": 0.2, "tvm_version": "0.8.dev0"}
{"input": ["cuda -keys=cuda,gpu -max_num_threads=1024 -thread_warp_size=32", "dense_large_batch.gpu", [["TENSOR", [65536, 2], "float32"], ["TENSOR", [1024, 2], "float32"]], {}], "config": {"index": 32026, "code_hash": null, "entity": [["tile_x", "sp", [-1, 2, 8, 1]], ["tile_y", "sp", [-1, 8, 8, 1]], ["tile_k", "sp", [-1, 1, 1]]]}, "result": [[0.0006915414181034483], 0, 1.9127552509307861, 1637496713.2439573], "version": 0.2, "tvm_version": "0.8.dev0"}
{"input": ["cuda -keys=cuda,gpu -max_num_threads=1024 -thread_warp_size=32", "dense_large_batch.gpu", [["TENSOR", [65536, 2], "float32"], ["TENSOR", [1024, 2], "float32"]], {}], "config": {"index": 140706, "code_hash": null, "entity": [["tile_x", "sp", [-1, 8, 8, 2]], ["tile_y", "sp", [-1, 1, 8, 4]], ["tile_k", "sp", [-1, 1, 1]]]}, "result": [[0.0009988223354037266], 0, 1.8829004764556885, 1637496715.04933], "version": 0.2, "tvm_version": "0.8.dev0"}
{"input": ["cuda -keys=cuda,gpu -max_num_threads=1024 -thread_warp_size=32", "dense_large_batch.gpu", [["TENSOR", [65536, 2], "float32"], ["TENSOR", [1024, 2], "float32"]], {}], "config": {"index": 141805, "code_hash": null, "entity": [["tile_x", "sp", [-1, 1, 8, 4]], ["tile_y", "sp", [-1, 2, 8, 4]], ["tile_k", "sp", [-1, 1, 1]]]}, "result": [[0.0010101391874999999], 0, 1.9035160541534424, 1637496716.7641187], "version": 0.2, "tvm_version": "0.8.dev0"}
{"input": ["cuda -keys=cuda,gpu -max_num_threads=1024 -thread_warp_size=32", "dense_large_batch.gpu", [["TENSOR", [65536, 2], "float32"], ["TENSOR", [1024, 2], "float32"]], {}], "config": {"index": 30089, "code_hash": null, "entity": [["tile_x", "sp", [-1, 4, 8, 1]], ["tile_y", "sp", [-1, 2, 8, 1]], ["tile_k", "sp", [-1, 1, 1]]]}, "result": [[0.0017416350172413794], 0, 1.6841514110565186, 1637496718.4874835], "version": 0.2, "tvm_version": "0.8.dev0"}
{"input": ["cuda -keys=cuda,gpu -max_num_threads=1024 -thread_warp_size=32", "dense_large_batch.gpu", [["TENSOR", [65536, 2], "float32"], ["TENSOR", [1024, 2], "float32"]], {}], "config": {"index": 32177, "code_hash": null, "entity": [["tile_x", "sp", [-1, 4, 8, 2]], ["tile_y", "sp", [-1, 8, 8, 1]], ["tile_k", "sp", [-1, 1, 1]]]}, "result": [[0.0008486004368421053], 0, 2.1070172786712646, 1637496720.3562586], "version": 0.2, "tvm_version": "0.8.dev0"}
{"input": ["cuda -keys=cuda,gpu -max_num_threads=1024 -thread_warp_size=32", "dense_large_batch.gpu", [["TENSOR", [65536, 2], "float32"], ["TENSOR", [1024, 2], "float32"]], {}], "config": {"index": 141922, "code_hash": null, "entity": [["tile_x", "sp", [-1, 1, 8, 8]], ["tile_y", "sp", [-1, 2, 8, 4]], ["tile_k", "sp", [-1, 1, 1]]]}, "result": [[0.001098960043956044], 0, 1.8821568489074707, 1637496722.0762763], "version": 0.2, "tvm_version": "0.8.dev0"}
{"input": ["cuda -keys=cuda,gpu -max_num_threads=1024 -thread_warp_size=32", "dense_large_batch.gpu", [["TENSOR", [65536, 2], "float32"], ["TENSOR", [1024, 2], "float32"]], {}], "config": {"index": 91724, "code_hash": null, "entity": [["tile_x", "sp", [-1, 1, 8, 32]], ["tile_y", "sp", [-1, 2, 8, 2]], ["tile_k", "sp", [-1, 1, 1]]]}, "result": [[0.0015468761076923077], 0, 1.785109281539917, 1637496723.724884], "version": 0.2, "tvm_version": "0.8.dev0"}
{"input": ["cuda -keys=cuda,gpu -max_num_threads=1024 -thread_warp_size=32", "dense_large_batch.gpu", [["TENSOR", [65536, 2], "float32"], ["TENSOR", [1024, 2], "float32"]], {}], "config": {"index": 32308, "code_hash": null, "entity": [["tile_x", "sp", [-1, 1, 8, 4]], ["tile_y", "sp", [-1, 8, 8, 1]], ["tile_k", "sp", [-1, 1, 1]]]}, "result": [[0.00081230221], 0, 2.401520252227783, 1637496727.302915], "version": 0.2, "tvm_version": "0.8.dev0"}
