artifacts/Table2/logs/matmul_65536_1024_4096.log
{"input": ["cuda -keys=cuda,gpu -max_num_threads=1024 -thread_warp_size=32", "dense_large_batch.gpu", [["TENSOR", [65536, 1024], "float32"], ["TENSOR", [4096, 1024], "float32"]], {}], "config": {"index": 6227263, "code_hash": null, "entity": [["tile_x", "sp", [-1, 1, 32, 8]], ["tile_y", "sp", [-1, 2, 32, 1]], ["tile_k", "sp", [-1, 8, 2]]]}, "result": [[0.37495941175], 0, 7.248502016067505, 1637519169.7172039], "version": 0.2, "tvm_version": "0.8.dev0"}
{"input": ["cuda -keys=cuda,gpu -max_num_threads=1024 -thread_warp_size=32", "dense_large_batch.gpu", [["TENSOR", [65536, 1024], "float32"], ["TENSOR", [4096, 1024], "float32"]], {}], "config": {"index": 137098, "code_hash": null, "entity": [["tile_x", "sp", [-1, 1, 32, 8]], ["tile_y", "sp", [-1, 1, 32, 2]], ["tile_k", "sp", [-1, 1, 1]]]}, "result": [[0.55012843675], 0, 8.031236171722412, 1637519280.7024379], "version": 0.2, "tvm_version": "0.8.dev0"}
{"input": ["cuda -keys=cuda,gpu -max_num_threads=1024 -thread_warp_size=32", "dense_large_batch.gpu", [["TENSOR", [65536, 1024], "float32"], ["TENSOR", [4096, 1024], "float32"]], {}], "config": {"index": 1380325, "code_hash": null, "entity": [["tile_x", "sp", [-1, 1, 32, 8]], ["tile_y", "sp", [-1, 16, 32, 1]], ["tile_k", "sp", [-1, 8, 1]]]}, "result": [[1.18372600675], 0, 11.492377996444702, 1637519291.8289094], "version": 0.2, "tvm_version": "0.8.dev0"}
{"input": ["cuda -keys=cuda,gpu -max_num_threads=1024 -thread_warp_size=32", "dense_large_batch.gpu", [["TENSOR", [65536, 1024], "float32"], ["TENSOR", [4096, 1024], "float32"]], {}], "config": {"index": 131375, "code_hash": null, "entity": [["tile_x", "sp", [-1, 1, 16, 16]], ["tile_y", "sp", [-1, 4, 16, 2]], ["tile_k", "sp", [-1, 1, 1]]]}, "result": [[0.2931263575], 0, 6.514137029647827, 1637519382.3156903], "version": 0.2, "tvm_version": "0.8.dev0"}
{"input": ["cuda -keys=cuda,gpu -max_num_threads=1024 -thread_warp_size=32", "dense_large_batch.gpu", [["TENSOR", [65536, 1024], "float32"], ["TENSOR", [4096, 1024], "float32"]], {}], "config": {"index": 46103, "code_hash": null, "entity": [["tile_x", "sp", [-1, 1, 16, 16]], ["tile_y", "sp", [-1, 2, 16, 1]], ["tile_k", "sp", [-1, 1, 1]]]}, "result": [[0.59162384075], 0, 8.180516004562378, 1637519390.4795496], "version": 0.2, "tvm_version": "0.8.dev0"}
{"input": ["cuda -keys=cuda,gpu -max_num_threads=1024 -thread_warp_size=32", "dense_large_batch.gpu", [["TENSOR", [65536, 1024], "float32"], ["TENSOR", [4096, 1024], "float32"]], {}], "config": {"index": 130406, "code_hash": null, "entity": [["tile_x", "sp", [-1, 1, 16, 16]], ["tile_y", "sp", [-1, 2, 16, 2]], ["tile_k", "sp", [-1, 1, 1]]]}, "result": [[0.32985683725000003], 0, 6.695596694946289, 1637519397.0563023], "version": 0.2, "tvm_version": "0.8.dev0"}
{"input": ["cuda -keys=cuda,gpu -max_num_threads=1024 -thread_warp_size=32", "dense_large_batch.gpu", [["TENSOR", [65536, 1024], "float32"], ["TENSOR", [4096, 1024], "float32"]], {}], "config": {"index": 45134, "code_hash": null, "entity": [["tile_x", "sp", [-1, 1, 16, 16]], ["tile_y", "sp", [-1, 1, 16, 1]], ["tile_k", "sp", [-1, 1, 1]]]}, "result": [[2.8039218522500002], 0, 18.969979286193848, 1637519415.8271701], "version": 0.2, "tvm_version": "0.8.dev0"}
{"input": ["cuda -keys=cuda,gpu -max_num_threads=1024 -thread_warp_size=32", "dense_large_batch.gpu", [["TENSOR", [65536, 1024], "float32"], ["TENSOR", [4096, 1024], "float32"]], {}], "config": {"index": 935554, "code_hash": null, "entity": [["tile_x", "sp", [-1, 1, 32, 8]], ["tile_y", "sp", [-1, 1, 32, 1]], ["tile_k", "sp", [-1, 4, 1]]]}, "result": [[0.86933497725], 0, 10.470023393630981, 1637519426.1645226], "version": 0.2, "tvm_version": "0.8.dev0"}
{"input": ["cuda -keys=cuda,gpu -max_num_threads=1024 -thread_warp_size=32", "dense_large_batch.gpu", [["TENSOR", [65536, 1024], "float32"], ["TENSOR", [4096, 1024], "float32"]], {}], "config": {"index": 5344504, "code_hash": null, "entity": [["tile_x", "sp", [-1, 1, 32, 8]], ["tile_y", "sp", [-1, 1, 32, 1]], ["tile_k", "sp", [-1, 2, 2]]]}, "result": [[0.86951137225], 0, 10.081769704818726, 1637519436.052865], "version": 0.2, "tvm_version": "0.8.dev0"}
{"input": ["cuda -keys=cuda,gpu -max_num_threads=1024 -thread_warp_size=32", "dense_large_batch.gpu", [["TENSOR", [65536, 1024], "float32"], ["TENSOR", [4096, 1024], "float32"]], {}], "config": {"index": 47072, "code_hash": null, "entity": [["tile_x", "sp", [-1, 1, 16, 16]], ["tile_y", "sp", [-1, 4, 16, 1]], ["tile_k", "sp", [-1, 1, 1]]]}, "result": [[0.33361906725], 0, 7.123617649078369, 1637519522.9023218], "version": 0.2, "tvm_version": "0.8.dev0"}
{"input": ["cuda -keys=cuda,gpu -max_num_threads=1024 -thread_warp_size=32", "dense_large_batch.gpu", [["TENSOR", [65536, 1024], "float32"], ["TENSOR", [4096, 1024], "float32"]], {}], "config": {"index": 5345473, "code_hash": null, "entity": [["tile_x", "sp", [-1, 1, 32, 8]], ["tile_y", "sp", [-1, 2, 32, 1]], ["tile_k", "sp", [-1, 2, 2]]]}, "result": [[0.47785617324999996], 0, 7.954946517944336, 1637519530.7574983], "version": 0.2, "tvm_version": "0.8.dev0"}
{"input": ["cuda -keys=cuda,gpu -max_num_threads=1024 -thread_warp_size=32", "dense_large_batch.gpu", [["TENSOR", [65536, 1024], "float32"], ["TENSOR", [4096, 1024], "float32"]], {}], "config": {"index": 4904578, "code_hash": null, "entity": [["tile_x", "sp", [-1, 1, 32, 8]], ["tile_y", "sp", [-1, 2, 32, 1]], ["tile_k", "sp", [-1, 1, 2]]]}, "result": [[0.41894579075], 0, 7.069994211196899, 1637519537.645797], "version": 0.2, "tvm_version": "0.8.dev0"}
{"input": ["cuda -keys=cuda,gpu -max_num_threads=1024 -thread_warp_size=32", "dense_large_batch.gpu", [["TENSOR", [65536, 1024], "float32"], ["TENSOR", [4096, 1024], "float32"]], {}], "config": {"index": 494659, "code_hash": null, "entity": [["tile_x", "sp", [-1, 1, 32, 8]], ["tile_y", "sp", [-1, 1, 32, 1]], ["tile_k", "sp", [-1, 2, 1]]]}, "result": [[0.7279989582499999], 0, 10.131168127059937, 1637519547.607258], "version": 0.2, "tvm_version": "0.8.dev0"}
{"input": ["cuda -keys=cuda,gpu -max_num_threads=1024 -thread_warp_size=32", "dense_large_batch.gpu", [["TENSOR", [65536, 1024], "float32"], ["TENSOR", [4096, 1024], "float32"]], {}], "config": {"index": 48041, "code_hash": null, "entity": [["tile_x", "sp", [-1, 1, 16, 16]], ["tile_y", "sp", [-1, 8, 16, 1]], ["tile_k", "sp", [-1, 1, 1]]]}, "result": [[0.29615006225], 0, 6.6374592781066895, 1637519553.99806], "version": 0.2, "tvm_version": "0.8.dev0"}
{"input": ["cuda -keys=cuda,gpu -max_num_threads=1024 -thread_warp_size=32", "dense_large_batch.gpu", [["TENSOR", [65536, 1024], "float32"], ["TENSOR", [4096, 1024], "float32"]], {}], "config": {"index": 4903609, "code_hash": null, "entity": [["tile_x", "sp", [-1, 1, 32, 8]], ["tile_y", "sp", [-1, 1, 32, 1]], ["tile_k", "sp", [-1, 1, 2]]]}, "result": [[0.728359797], 0, 9.436446189880371, 1637519563.3605337], "version": 0.2, "tvm_version": "0.8.dev0"}
{"input": ["cuda -keys=cuda,gpu -max_num_threads=1024 -thread_warp_size=32", "dense_large_batch.gpu", [["TENSOR", [65536, 1024], "float32"], ["TENSOR", [4096, 1024], "float32"]], {}], "config": {"index": 495628, "code_hash": null, "entity": [["tile_x", "sp", [-1, 1, 32, 8]], ["tile_y", "sp", [-1, 2, 32, 1]], ["tile_k", "sp", [-1, 2, 1]]]}, "result": [[0.41936482775], 0, 7.024991035461426, 1637519570.2613301], "version": 0.2, "tvm_version": "0.8.dev0"}
{"input": ["cuda -keys=cuda,gpu -max_num_threads=1024 -thread_warp_size=32", "dense_large_batch.gpu", [["TENSOR", [65536, 1024], "float32"], ["TENSOR", [4096, 1024], "float32"]], {}], "config": {"index": 5786368, "code_hash": null, "entity": [["tile_x", "sp", [-1, 1, 32, 8]], ["tile_y", "sp", [-1, 2, 32, 1]], ["tile_k", "sp", [-1, 4, 2]]]}, "result": [[0.40907813775], 0, 7.379118204116821, 1637519577.427945], "version": 0.2, "tvm_version": "0.8.dev0"}
{"input": ["cuda -keys=cuda,gpu -max_num_threads=1024 -thread_warp_size=32", "dense_large_batch.gpu", [["TENSOR", [65536, 1024], "float32"], ["TENSOR", [4096, 1024], "float32"]], {}], "config": {"index": 129437, "code_hash": null, "entity": [["tile_x", "sp", [-1, 1, 16, 16]], ["tile_y", "sp", [-1, 1, 16, 2]], ["tile_k", "sp", [-1, 1, 1]]]}, "result": [[0.5845467277499999], 0, 7.842804670333862, 1637519585.2481592], "version": 0.2, "tvm_version": "0.8.dev0"}
{"input": ["cuda -keys=cuda,gpu -max_num_threads=1024 -thread_warp_size=32", "dense_large_batch.gpu", [["TENSOR", [65536, 1024], "float32"], ["TENSOR", [4096, 1024], "float32"]], {}], "config": {"index": 53764, "code_hash": null, "entity": [["tile_x", "sp", [-1, 1, 32, 8]], ["tile_y", "sp", [-1, 1, 32, 1]], ["tile_k", "sp", [-1, 1, 1]]]}, "result": [[0.9207559122500001], 0, 9.672255277633667, 1637519594.8089178], "version": 0.2, "tvm_version": "0.8.dev0"}
{"input": ["cuda -keys=cuda,gpu -max_num_threads=1024 -thread_warp_size=32", "dense_large_batch.gpu", [["TENSOR", [65536, 1024], "float32"], ["TENSOR", [4096, 1024], "float32"]], {}], "config": {"index": 936523, "code_hash": null, "entity": [["tile_x", "sp", [-1, 1, 32, 8]], ["tile_y", "sp", [-1, 2, 32, 1]], ["tile_k", "sp", [-1, 4, 1]]]}, "result": [[0.476317025], 0, 7.8236658573150635, 1637519602.5757322], "version": 0.2, "tvm_version": "0.8.dev0"}
{"input": ["cuda -keys=cuda,gpu -max_num_threads=1024 -thread_warp_size=32", "dense_large_batch.gpu", [["TENSOR", [65536, 1024], "float32"], ["TENSOR", [4096, 1024], "float32"]], {}], "config": {"index": 577878, "code_hash": null, "entity": [["tile_x", "sp", [-1, 1, 32, 4]], ["tile_y", "sp", [-1, 1, 32, 2]], ["tile_k", "sp", [-1, 2, 1]]]}, "result": [[0.37276352100000004], 0, 7.120585680007935, 1637519676.6714287], "version": 0.2, "tvm_version": "0.8.dev0"}
{"input": ["cuda -keys=cuda,gpu -max_num_threads=1024 -thread_warp_size=32", "dense_large_batch.gpu", [["TENSOR", [65536, 1024], "float32"], ["TENSOR", [4096, 1024], "float32"]], {}], "config": {"index": 1018773, "code_hash": null, "entity": [["tile_x", "sp", [-1, 1, 32, 4]], ["tile_y", "sp", [-1, 1, 32, 2]], ["tile_k", "sp", [-1, 4, 1]]]}, "result": [[0.34973904525], 0, 7.702732801437378, 1637519684.051225], "version": 0.2, "tvm_version": "0.8.dev0"}
{"input": ["cuda -keys=cuda,gpu -max_num_threads=1024 -thread_warp_size=32", "dense_large_batch.gpu", [["TENSOR", [65536, 1024], "float32"], ["TENSOR", [4096, 1024], "float32"]], {}], "config": {"index": 494544, "code_hash": null, "entity": [["tile_x", "sp", [-1, 1, 32, 4]], ["tile_y", "sp", [-1, 1, 32, 1]], ["tile_k", "sp", [-1, 2, 1]]]}, "result": [[0.60901618425], 0, 8.341625690460205, 1637519692.1753573], "version": 0.2, "tvm_version": "0.8.dev0"}
{"input": ["cuda -keys=cuda,gpu -max_num_threads=1024 -thread_warp_size=32", "dense_large_batch.gpu", [["TENSOR", [65536, 1024], "float32"], ["TENSOR", [4096, 1024], "float32"]], {}], "config": {"index": 577993, "code_hash": null, "entity": [["tile_x", "sp", [-1, 1, 32, 8]], ["tile_y", "sp", [-1, 1, 32, 2]], ["tile_k", "sp", [-1, 2, 1]]]}, "result": [[0.42777753150000003], 0, 7.270002603530884, 1637519699.0638652], "version": 0.2, "tvm_version": "0.8.dev0"}
{"input": ["cuda -keys=cuda,gpu -max_num_threads=1024 -thread_warp_size=32", "dense_large_batch.gpu", [["TENSOR", [65536, 1024], "float32"], ["TENSOR", [4096, 1024], "float32"]], {}], "config": {"index": 1377418, "code_hash": null, "entity": [["tile_x", "sp", [-1, 1, 32, 8]], ["tile_y", "sp", [-1, 2, 32, 1]], ["tile_k", "sp", [-1, 8, 1]]]}, "result": [[0.40927175849999997], 0, 7.1410956382751465, 1637519705.8589988], "version": 0.2, "tvm_version": "0.8.dev0"}
{"input": ["cuda -keys=cuda,gpu -max_num_threads=1024 -thread_warp_size=32", "dense_large_batch.gpu", [["TENSOR", [65536, 1024], "float32"], ["TENSOR", [4096, 1024], "float32"]], {}], "config": {"index": 136983, "code_hash": null, "entity": [["tile_x", "sp", [-1, 1, 32, 4]], ["tile_y", "sp", [-1, 1, 32, 2]], ["tile_k", "sp", [-1, 1, 1]]]}, "result": [[0.5649962669999999], 0, 7.981957197189331, 1637519713.4206843], "version": 0.2, "tvm_version": "0.8.dev0"}
{"input": ["cuda -keys=cuda,gpu -max_num_threads=1024 -thread_warp_size=32", "dense_large_batch.gpu", [["TENSOR", [65536, 1024], "float32"], ["TENSOR", [4096, 1024], "float32"]], {}], "config": {"index": 495513, "code_hash": null, "entity": [["tile_x", "sp", [-1, 1, 32, 4]], ["tile_y", "sp", [-1, 2, 32, 1]], ["tile_k", "sp", [-1, 2, 1]]]}, "result": [[0.37076993649999995], 0, 7.461888313293457, 1637519720.5283096], "version": 0.2, "tvm_version": "0.8.dev0"}
{"input": ["cuda -keys=cuda,gpu -max_num_threads=1024 -thread_warp_size=32", "dense_large_batch.gpu", [["TENSOR", [65536, 1024], "float32"], ["TENSOR", [4096, 1024], "float32"]], {}], "config": {"index": 1377303, "code_hash": null, "entity": [["tile_x", "sp", [-1, 1, 32, 4]], ["tile_y", "sp", [-1, 2, 32, 1]], ["tile_k", "sp", [-1, 8, 1]]]}, "result": [[0.42400912949999997], 0, 7.718897104263306, 1637519728.032729], "version": 0.2, "tvm_version": "0.8.dev0"}
{"input": ["cuda -keys=cuda,gpu -max_num_threads=1024 -thread_warp_size=32", "dense_large_batch.gpu", [["TENSOR", [65536, 1024], "float32"], ["TENSOR", [4096, 1024], "float32"]], {}], "config": {"index": 1018888, "code_hash": null, "entity": [["tile_x", "sp", [-1, 1, 32, 8]], ["tile_y", "sp", [-1, 1, 32, 2]], ["tile_k", "sp", [-1, 4, 1]]]}, "result": [[0.47223881025], 0, 7.549588680267334, 1637519735.2910833], "version": 0.2, "tvm_version": "0.8.dev0"}
{"input": ["cuda -keys=cuda,gpu -max_num_threads=1024 -thread_warp_size=32", "dense_large_batch.gpu", [["TENSOR", [65536, 1024], "float32"], ["TENSOR", [4096, 1024], "float32"]], {}], "config": {"index": 4986943, "code_hash": null, "entity": [["tile_x", "sp", [-1, 1, 32, 8]], ["tile_y", "sp", [-1, 1, 32, 2]], ["tile_k", "sp", [-1, 1, 2]]]}, "result": [[0.427257449], 0, 7.28123140335083, 1637519742.314229], "version": 0.2, "tvm_version": "0.8.dev0"}
{"input": ["cuda -keys=cuda,gpu -max_num_threads=1024 -thread_warp_size=32", "dense_large_batch.gpu", [["TENSOR", [65536, 1024], "float32"], ["TENSOR", [4096, 1024], "float32"]], {}], "config": {"index": 5346442, "code_hash": null, "entity": [["tile_x", "sp", [-1, 1, 32, 8]], ["tile_y", "sp", [-1, 4, 32, 1]], ["tile_k", "sp", [-1, 2, 2]]]}, "result": [[0.34384038824999996], 0, 6.82740330696106, 1637519748.8164675], "version": 0.2, "tvm_version": "0.8.dev0"}
{"input": ["cuda -keys=cuda,gpu -max_num_threads=1024 -thread_warp_size=32", "dense_large_batch.gpu", [["TENSOR", [65536, 1024], "float32"], ["TENSOR", [4096, 1024], "float32"]], {}], "config": {"index": 53649, "code_hash": null, "entity": [["tile_x", "sp", [-1, 1, 32, 4]], ["tile_y", "sp", [-1, 1, 32, 1]], ["tile_k", "sp", [-1, 1, 1]]]}, "result": [[0.9443799494999999], 0, 9.940938472747803, 1637519758.488106], "version": 0.2, "tvm_version": "0.8.dev0"}
{"input": ["cuda -keys=cuda,gpu -max_num_threads=1024 -thread_warp_size=32", "dense_large_batch.gpu", [["TENSOR", [65536, 1024], "float32"], ["TENSOR", [4096, 1024], "float32"]], {}], "config": {"index": 5788306, "code_hash": null, "entity": [["tile_x", "sp", [-1, 1, 32, 8]], ["tile_y", "sp", [-1, 8, 32, 1]], ["tile_k", "sp", [-1, 4, 2]]]}, "result": [[1.25265087025], 0, 11.54506540298462, 1637519769.535767], "version": 0.2, "tvm_version": "0.8.dev0"}
{"input": ["cuda -keys=cuda,gpu -max_num_threads=1024 -thread_warp_size=32", "dense_large_batch.gpu", [["TENSOR", [65536, 1024], "float32"], ["TENSOR", [4096, 1024], "float32"]], {}], "config": {"index": 5787337, "code_hash": null, "entity": [["tile_x", "sp", [-1, 1, 32, 8]], ["tile_y", "sp", [-1, 4, 32, 1]], ["tile_k", "sp", [-1, 4, 2]]]}, "result": [[0.38699958425], 0, 7.155980110168457, 1637519776.3114789], "version": 0.2, "tvm_version": "0.8.dev0"}
{"input": ["cuda -keys=cuda,gpu -max_num_threads=1024 -thread_warp_size=32", "dense_large_batch.gpu", [["TENSOR", [65536, 1024], "float32"], ["TENSOR", [4096, 1024], "float32"]], {}], "config": {"index": 577747, "code_hash": null, "entity": [["tile_x", "sp", [-1, 1, 32, 2]], ["tile_y", "sp", [-1, 1, 32, 2]], ["tile_k", "sp", [-1, 2, 1]]]}, "result": [[0.6291673674999999], 0, 8.237569808959961, 1637519784.2267256], "version": 0.2, "tvm_version": "0.8.dev0"}
{"input": ["cuda -keys=cuda,gpu -max_num_threads=1024 -thread_warp_size=32", "dense_large_batch.gpu", [["TENSOR", [65536, 1024], "float32"], ["TENSOR", [4096, 1024], "float32"]], {}], "config": {"index": 1020711, "code_hash": null, "entity": [["tile_x", "sp", [-1, 1, 32, 4]], ["tile_y", "sp", [-1, 4, 32, 2]], ["tile_k", "sp", [-1, 4, 1]]]}, "result": [[0.211936568], 0, 6.229802131652832, 1637519790.1258733], "version": 0.2, "tvm_version": "0.8.dev0"}
{"input": ["cuda -keys=cuda,gpu -max_num_threads=1024 -thread_warp_size=32", "dense_large_batch.gpu", [["TENSOR", [65536, 1024], "float32"], ["TENSOR", [4096, 1024], "float32"]], {}], "config": {"index": 1019742, "code_hash": null, "entity": [["tile_x", "sp", [-1, 1, 32, 4]], ["tile_y", "sp", [-1, 2, 32, 2]], ["tile_k", "sp", [-1, 4, 1]]]}, "result": [[0.22392202], 0, 6.279567241668701, 1637519858.5975552], "version": 0.2, "tvm_version": "0.8.dev0"}
{"input": ["cuda -keys=cuda,gpu -max_num_threads=1024 -thread_warp_size=32", "dense_large_batch.gpu", [["TENSOR", [65536, 1024], "float32"], ["TENSOR", [4096, 1024], "float32"]], {}], "config": {"index": 648615, "code_hash": null, "entity": [["tile_x", "sp", [-1, 1, 32, 4]], ["tile_y", "sp", [-1, 1, 32, 4]], ["tile_k", "sp", [-1, 2, 1]]]}, "result": [[0.26412183475], 0, 6.363893985748291, 1637519864.6676538], "version": 0.2, "tvm_version": "0.8.dev0"}
{"input": ["cuda -keys=cuda,gpu -max_num_threads=1024 -thread_warp_size=32", "dense_large_batch.gpu", [["TENSOR", [65536, 1024], "float32"], ["TENSOR", [4096, 1024], "float32"]], {}], "config": {"index": 936408, "code_hash": null, "entity": [["tile_x", "sp", [-1, 1, 32, 4]], ["tile_y", "sp", [-1, 2, 32, 1]], ["tile_k", "sp", [-1, 4, 1]]]}, "result": [[0.3529865375], 0, 6.754119157791138, 1637519871.18812], "version": 0.2, "tvm_version": "0.8.dev0"}
{"input": ["cuda -keys=cuda,gpu -max_num_threads=1024 -thread_warp_size=32", "dense_large_batch.gpu", [["TENSOR", [65536, 1024], "float32"], ["TENSOR", [4096, 1024], "float32"]], {}], "config": {"index": 578847, "code_hash": null, "entity": [["tile_x", "sp", [-1, 1, 32, 4]], ["tile_y", "sp", [-1, 2, 32, 2]], ["tile_k", "sp", [-1, 2, 1]]]}, "result": [[0.26421224375], 0, 6.293394565582275, 1637519877.229366], "version": 0.2, "tvm_version": "0.8.dev0"}
{"input": ["cuda -keys=cuda,gpu -max_num_threads=1024 -thread_warp_size=32", "dense_large_batch.gpu", [["TENSOR", [65536, 1024], "float32"], ["TENSOR", [4096, 1024], "float32"]], {}], "config": {"index": 937377, "code_hash": null, "entity": [["tile_x", "sp", [-1, 1, 32, 4]], ["tile_y", "sp", [-1, 4, 32, 1]], ["tile_k", "sp", [-1, 4, 1]]]}, "result": [[0.2212069295], 0, 6.087823390960693, 1637519883.0436792], "version": 0.2, "tvm_version": "0.8.dev0"}
{"input": ["cuda -keys=cuda,gpu -max_num_threads=1024 -thread_warp_size=32", "dense_large_batch.gpu", [["TENSOR", [65536, 1024], "float32"], ["TENSOR", [4096, 1024], "float32"]], {}], "config": {"index": 1090479, "code_hash": null, "entity": [["tile_x", "sp", [-1, 1, 32, 4]], ["tile_y", "sp", [-1, 2, 32, 4]], ["tile_k", "sp", [-1, 4, 1]]]}, "result": [[0.21025277875], 0, 6.165950536727905, 1637519888.9001164], "version": 0.2, "tvm_version": "0.8.dev0"}
{"input": ["cuda -keys=cuda,gpu -max_num_threads=1024 -thread_warp_size=32", "dense_large_batch.gpu", [["TENSOR", [65536, 1024], "float32"], ["TENSOR", [4096, 1024], "float32"]], {}], "config": {"index": 936277, "code_hash": null, "entity": [["tile_x", "sp", [-1, 1, 32, 2]], ["tile_y", "sp", [-1, 2, 32, 1]], ["tile_k", "sp", [-1, 4, 1]]]}, "result": [[0.36248544275], 0, 6.798350811004639, 1637519895.4781456], "version": 0.2, "tvm_version": "0.8.dev0"}
{"input": ["cuda -keys=cuda,gpu -max_num_threads=1024 -thread_warp_size=32", "dense_large_batch.gpu", [["TENSOR", [65536, 1024], "float32"], ["TENSOR", [4096, 1024], "float32"]], {}], "config": {"index": 1019611, "code_hash": null, "entity": [["tile_x", "sp", [-1, 1, 32, 2]], ["tile_y", "sp", [-1, 2, 32, 2]], ["tile_k", "sp", [-1, 4, 1]]]}, "result": [[0.26734959924999996], 0, 6.326168537139893, 1637519901.578608], "version": 0.2, "tvm_version": "0.8.dev0"}
{"input": ["cuda -keys=cuda,gpu -max_num_threads=1024 -thread_warp_size=32", "dense_large_batch.gpu", [["TENSOR", [65536, 1024], "float32"], ["TENSOR", [4096, 1024], "float32"]], {}], "config": {"index": 1089510, "code_hash": null, "entity": [["tile_x", "sp", [-1, 1, 32, 4]], ["tile_y", "sp", [-1, 1, 32, 4]], ["tile_k", "sp", [-1, 4, 1]]]}, "result": [[0.22364366025000001], 0, 6.090694427490234, 1637519907.4230638], "version": 0.2, "tvm_version": "0.8.dev0"}
{"input": ["cuda -keys=cuda,gpu -max_num_threads=1024 -thread_warp_size=32", "dense_large_batch.gpu", [["TENSOR", [65536, 1024], "float32"], ["TENSOR", [4096, 1024], "float32"]], {}], "config": {"index": 5345227, "code_hash": null, "entity": [["tile_x", "sp", [-1, 1, 32, 2]], ["tile_y", "sp", [-1, 2, 32, 1]], ["tile_k", "sp", [-1, 2, 2]]]}, "result": [[0.3626577125], 0, 6.73544454574585, 1637519913.9571369], "version": 0.2, "tvm_version": "0.8.dev0"}
{"input": ["cuda -keys=cuda,gpu -max_num_threads=1024 -thread_warp_size=32", "dense_large_batch.gpu", [["TENSOR", [65536, 1024], "float32"], ["TENSOR", [4096, 1024], "float32"]], {}], "config": {"index": 5428807, "code_hash": null, "entity": [["tile_x", "sp", [-1, 1, 32, 8]], ["tile_y", "sp", [-1, 2, 32, 2]], ["tile_k", "sp", [-1, 2, 2]]]}, "result": [[0.34277200375], 0, 6.816689491271973, 1637519920.4765627], "version": 0.2, "tvm_version": "0.8.dev0"}
{"input": ["cuda -keys=cuda,gpu -max_num_threads=1024 -thread_warp_size=32", "dense_large_batch.gpu", [["TENSOR", [65536, 1024], "float32"], ["TENSOR", [4096, 1024], "float32"]], {}], "config": {"index": 4986828, "code_hash": null, "entity": [["tile_x", "sp", [-1, 1, 32, 4]], ["tile_y", "sp", [-1, 1, 32, 2]], ["tile_k", "sp", [-1, 1, 2]]]}, "result": [[0.37302733174999997], 0, 6.851677894592285, 1637519927.1593277], "version": 0.2, "tvm_version": "0.8.dev0"}
{"input": ["cuda -keys=cuda,gpu -max_num_threads=1024 -thread_warp_size=32", "dense_large_batch.gpu", [["TENSOR", [65536, 1024], "float32"], ["TENSOR", [4096, 1024], "float32"]], {}], "config": {"index": 5345358, "code_hash": null, "entity": [["tile_x", "sp", [-1, 1, 32, 4]], ["tile_y", "sp", [-1, 2, 32, 1]], ["tile_k", "sp", [-1, 2, 2]]]}, "result": [[0.3533271435], 0, 6.666733741760254, 1637519933.6553483], "version": 0.2, "tvm_version": "0.8.dev0"}
{"input": ["cuda -keys=cuda,gpu -max_num_threads=1024 -thread_warp_size=32", "dense_large_batch.gpu", [["TENSOR", [65536, 1024], "float32"], ["TENSOR", [4096, 1024], "float32"]], {}], "config": {"index": 1090348, "code_hash": null, "entity": [["tile_x", "sp", [-1, 1, 32, 2]], ["tile_y", "sp", [-1, 2, 32, 4]], ["tile_k", "sp", [-1, 4, 1]]]}, "result": [[0.20094634575], 0, 6.028155326843262, 1637519939.4547312], "version": 0.2, "tvm_version": "0.8.dev0"}
{"input": ["cuda -keys=cuda,gpu -max_num_threads=1024 -thread_warp_size=32", "dense_large_batch.gpu", [["TENSOR", [65536, 1024], "float32"], ["TENSOR", [4096, 1024], "float32"]], {}], "config": {"index": 5347411, "code_hash": null, "entity": [["tile_x", "sp", [-1, 1, 32, 8]], ["tile_y", "sp", [-1, 8, 32, 1]], ["tile_k", "sp", [-1, 2, 2]]]}, "result": [[1.5477195475], 0, 13.055251359939575, 1637519952.2279906], "version": 0.2, "tvm_version": "0.8.dev0"}
{"input": ["cuda -keys=cuda,gpu -max_num_threads=1024 -thread_warp_size=32", "dense_large_batch.gpu", [["TENSOR", [65536, 1024], "float32"], ["TENSOR", [4096, 1024], "float32"]], {}], "config": {"index": 4986697, "code_hash": null, "entity": [["tile_x", "sp", [-1, 1, 32, 2]], ["tile_y", "sp", [-1, 1, 32, 2]], ["tile_k", "sp", [-1, 1, 2]]]}, "result": [[0.6292868442499999], 0, 8.08311915397644, 1637519960.067627], "version": 0.2, "tvm_version": "0.8.dev0"}
{"input": ["cuda -keys=cuda,gpu -max_num_threads=1024 -thread_warp_size=32", "dense_large_batch.gpu", [["TENSOR", [65536, 1024], "float32"], ["TENSOR", [4096, 1024], "float32"]], {}], "config": {"index": 5346327, "code_hash": null, "entity": [["tile_x", "sp", [-1, 1, 32, 4]], ["tile_y", "sp", [-1, 4, 32, 1]], ["tile_k", "sp", [-1, 2, 2]]]}, "result": [[0.2206170555], 0, 6.16716456413269, 1637519966.0066898], "version": 0.2, "tvm_version": "0.8.dev0"}
{"input": ["cuda -keys=cuda,gpu -max_num_threads=1024 -thread_warp_size=32", "dense_large_batch.gpu", [["TENSOR", [65536, 1024], "float32"], ["TENSOR", [4096, 1024], "float32"]], {}], "config": {"index": 1377024, "code_hash": null, "entity": [["tile_x", "sp", [-1, 1, 32, 1]], ["tile_y", "sp", [-1, 2, 32, 1]], ["tile_k", "sp", [-1, 8, 1]]]}, "result": [[0.29285153275], 0, 6.380687475204468, 1637519972.1838381], "version": 0.2, "tvm_version": "0.8.dev0"}
{"input": ["cuda -keys=cuda,gpu -max_num_threads=1024 -thread_warp_size=32", "dense_large_batch.gpu", [["TENSOR", [65536, 1024], "float32"], ["TENSOR", [4096, 1024], "float32"]], {}], "config": {"index": 1378272, "code_hash": null, "entity": [["tile_x", "sp", [-1, 1, 32, 4]], ["tile_y", "sp", [-1, 4, 32, 1]], ["tile_k", "sp", [-1, 8, 1]]]}, "result": [[0.256317312], 0, 6.4059343338012695, 1637519978.3125465], "version": 0.2, "tvm_version": "0.8.dev0"}
{"input": ["cuda -keys=cuda,gpu -max_num_threads=1024 -thread_warp_size=32", "dense_large_batch.gpu", [["TENSOR", [65536, 1024], "float32"], ["TENSOR", [4096, 1024], "float32"]], {}], "config": {"index": 5428561, "code_hash": null, "entity": [["tile_x", "sp", [-1, 1, 32, 2]], ["tile_y", "sp", [-1, 2, 32, 2]], ["tile_k", "sp", [-1, 2, 2]]]}, "result": [[0.26701575650000003], 0, 6.317358493804932, 1637519984.374588], "version": 0.2, "tvm_version": "0.8.dev0"}
{"input": ["cuda -keys=cuda,gpu -max_num_threads=1024 -thread_warp_size=32", "dense_large_batch.gpu", [["TENSOR", [65536, 1024], "float32"], ["TENSOR", [4096, 1024], "float32"]], {}], "config": {"index": 648484, "code_hash": null, "entity": [["tile_x", "sp", [-1, 1, 32, 2]], ["tile_y", "sp", [-1, 1, 32, 4]], ["tile_k", "sp", [-1, 2, 1]]]}, "result": [[0.38198486175], 0, 6.830684185028076, 1637520048.5008187], "version": 0.2, "tvm_version": "0.8.dev0"}
{"input": ["cuda -keys=cuda,gpu -max_num_threads=1024 -thread_warp_size=32", "dense_large_batch.gpu", [["TENSOR", [65536, 1024], "float32"], ["TENSOR", [4096, 1024], "float32"]], {}], "config": {"index": 5428692, "code_hash": null, "entity": [["tile_x", "sp", [-1, 1, 32, 4]], ["tile_y", "sp", [-1, 2, 32, 2]], ["tile_k", "sp", [-1, 2, 2]]]}, "result": [[0.223536056], 0, 6.452672958374023, 1637520054.6996505], "version": 0.2, "tvm_version": "0.8.dev0"}
{"input": ["cuda -keys=cuda,gpu -max_num_threads=1024 -thread_warp_size=32", "dense_large_batch.gpu", [["TENSOR", [65536, 1024], "float32"], ["TENSOR", [4096, 1024], "float32"]], {}], "config": {"index": 1020580, "code_hash": null, "entity": [["tile_x", "sp", [-1, 1, 32, 2]], ["tile_y", "sp", [-1, 4, 32, 2]], ["tile_k", "sp", [-1, 4, 1]]]}, "result": [[0.20552390399999998], 0, 6.015688180923462, 1637520060.4788203], "version": 0.2, "tvm_version": "0.8.dev0"}
{"input": ["cuda -keys=cuda,gpu -max_num_threads=1024 -thread_warp_size=32", "dense_large_batch.gpu", [["TENSOR", [65536, 1024], "float32"], ["TENSOR", [4096, 1024], "float32"]], {}], "config": {"index": 4987797, "code_hash": null, "entity": [["tile_x", "sp", [-1, 1, 32, 4]], ["tile_y", "sp", [-1, 2, 32, 2]], ["tile_k", "sp", [-1, 1, 2]]]}, "result": [[0.2641229295], 0, 6.292176961898804, 1637520066.5504622], "version": 0.2, "tvm_version": "0.8.dev0"}
{"input": ["cuda -keys=cuda,gpu -max_num_threads=1024 -thread_warp_size=32", "dense_large_batch.gpu", [["TENSOR", [65536, 1024], "float32"], ["TENSOR", [4096, 1024], "float32"]], {}], "config": {"index": 5429661, "code_hash": null, "entity": [["tile_x", "sp", [-1, 1, 32, 4]], ["tile_y", "sp", [-1, 4, 32, 2]], ["tile_k", "sp", [-1, 2, 2]]]}, "result": [[0.2092693075], 0, 6.1280436515808105, 1637520072.4381924], "version": 0.2, "tvm_version": "0.8.dev0"}
{"input": ["cuda -keys=cuda,gpu -max_num_threads=1024 -thread_warp_size=32", "dense_large_batch.gpu", [["TENSOR", [65536, 1024], "float32"], ["TENSOR", [4096, 1024], "float32"]], {}], "config": {"index": 937492, "code_hash": null, "entity": [["tile_x", "sp", [-1, 1, 32, 8]], ["tile_y", "sp", [-1, 4, 32, 1]], ["tile_k", "sp", [-1, 4, 1]]]}, "result": [[0.3429993755], 0, 6.809469938278198, 1637520078.979733], "version": 0.2, "tvm_version": "0.8.dev0"}
{"input": ["cuda -keys=cuda,gpu -max_num_threads=1024 -thread_warp_size=32", "dense_large_batch.gpu", [["TENSOR", [65536, 1024], "float32"], ["TENSOR", [4096, 1024], "float32"]], {}], "config": {"index": 1018642, "code_hash": null, "entity": [["tile_x", "sp", [-1, 1, 32, 2]], ["tile_y", "sp", [-1, 1, 32, 2]], ["tile_k", "sp", [-1, 4, 1]]]}, "result": [[0.3616621465], 0, 6.721436262130737, 1637520085.4890156], "version": 0.2, "tvm_version": "0.8.dev0"}
{"input": ["cuda -keys=cuda,gpu -max_num_threads=1024 -thread_warp_size=32", "dense_large_batch.gpu", [["TENSOR", [65536, 1024], "float32"], ["TENSOR", [4096, 1024], "float32"]], {}], "config": {"index": 5057434, "code_hash": null, "entity": [["tile_x", "sp", [-1, 1, 32, 2]], ["tile_y", "sp", [-1, 1, 32, 4]], ["tile_k", "sp", [-1, 1, 2]]]}, "result": [[0.38196539175], 0, 6.773837566375732, 1637520092.1259656], "version": 0.2, "tvm_version": "0.8.dev0"}
{"input": ["cuda -keys=cuda,gpu -max_num_threads=1024 -thread_warp_size=32", "dense_large_batch.gpu", [["TENSOR", [65536, 1024], "float32"], ["TENSOR", [4096, 1024], "float32"]], {}], "config": {"index": 1019612, "code_hash": null, "entity": [["tile_x", "sp", [-1, 2, 32, 2]], ["tile_y", "sp", [-1, 2, 32, 2]], ["tile_k", "sp", [-1, 4, 1]]]}, "result": [[0.19058401749999998], 0, 5.987410068511963, 1637520097.846774], "version": 0.2, "tvm_version": "0.8.dev0"}
{"input": ["cuda -keys=cuda,gpu -max_num_threads=1024 -thread_warp_size=32", "dense_large_batch.gpu", [["TENSOR", [65536, 1024], "float32"], ["TENSOR", [4096, 1024], "float32"]], {}], "config": {"index": 938346, "code_hash": null, "entity": [["tile_x", "sp", [-1, 1, 32, 4]], ["tile_y", "sp", [-1, 8, 32, 1]], ["tile_k", "sp", [-1, 4, 1]]]}, "result": [[0.20453336075], 0, 5.972157955169678, 1637520103.6136453], "version": 0.2, "tvm_version": "0.8.dev0"}
{"input": ["cuda -keys=cuda,gpu -max_num_threads=1024 -thread_warp_size=32", "dense_large_batch.gpu", [["TENSOR", [65536, 1024], "float32"], ["TENSOR", [4096, 1024], "float32"]], {}], "config": {"index": 496482, "code_hash": null, "entity": [["tile_x", "sp", [-1, 1, 32, 4]], ["tile_y", "sp", [-1, 4, 32, 1]], ["tile_k", "sp", [-1, 2, 1]]]}, "result": [[0.2666529215], 0, 6.3376946449279785, 1637520110.1321127], "version": 0.2, "tvm_version": "0.8.dev0"}
{"input": ["cuda -keys=cuda,gpu -max_num_threads=1024 -thread_warp_size=32", "dense_large_batch.gpu", [["TENSOR", [65536, 1024], "float32"], ["TENSOR", [4096, 1024], "float32"]], {}], "config": {"index": 937246, "code_hash": null, "entity": [["tile_x", "sp", [-1, 1, 32, 2]], ["tile_y", "sp", [-1, 4, 32, 1]], ["tile_k", "sp", [-1, 4, 1]]]}, "result": [[0.26792762800000003], 0, 6.35500168800354, 1637520116.2477703], "version": 0.2, "tvm_version": "0.8.dev0"}
{"input": ["cuda -keys=cuda,gpu -max_num_threads=1024 -thread_warp_size=32", "dense_large_batch.gpu", [["TENSOR", [65536, 1024], "float32"], ["TENSOR", [4096, 1024], "float32"]], {}], "config": {"index": 937247, "code_hash": null, "entity": [["tile_x", "sp", [-1, 2, 32, 2]], ["tile_y", "sp", [-1, 4, 32, 1]], ["tile_k", "sp", [-1, 4, 1]]]}, "result": [[0.1892018985], 0, 6.1845543384552, 1637520122.1939712], "version": 0.2, "tvm_version": "0.8.dev0"}
{"input": ["cuda -keys=cuda,gpu -max_num_threads=1024 -thread_warp_size=32", "dense_large_batch.gpu", [["TENSOR", [65536, 1024], "float32"], ["TENSOR", [4096, 1024], "float32"]], {}], "config": {"index": 935439, "code_hash": null, "entity": [["tile_x", "sp", [-1, 1, 32, 4]], ["tile_y", "sp", [-1, 1, 32, 1]], ["tile_k", "sp", [-1, 4, 1]]]}, "result": [[0.5779943905], 0, 7.7886903285980225, 1637520129.7812452], "version": 0.2, "tvm_version": "0.8.dev0"}
{"input": ["cuda -keys=cuda,gpu -max_num_threads=1024 -thread_warp_size=32", "dense_large_batch.gpu", [["TENSOR", [65536, 1024], "float32"], ["TENSOR", [4096, 1024], "float32"]], {}], "config": {"index": 1089379, "code_hash": null, "entity": [["tile_x", "sp", [-1, 1, 32, 2]], ["tile_y", "sp", [-1, 1, 32, 4]], ["tile_k", "sp", [-1, 4, 1]]]}, "result": [[0.26476573775], 0, 6.190896272659302, 1637520135.7618983], "version": 0.2, "tvm_version": "0.8.dev0"}
{"input": ["cuda -keys=cuda,gpu -max_num_threads=1024 -thread_warp_size=32", "dense_large_batch.gpu", [["TENSOR", [65536, 1024], "float32"], ["TENSOR", [4096, 1024], "float32"]], {}], "config": {"index": 495383, "code_hash": null, "entity": [["tile_x", "sp", [-1, 2, 32, 2]], ["tile_y", "sp", [-1, 2, 32, 1]], ["tile_k", "sp", [-1, 2, 1]]]}, "result": [[0.342595458], 0, 6.637162446975708, 1637520142.172497], "version": 0.2, "tvm_version": "0.8.dev0"}
{"input": ["cuda -keys=cuda,gpu -max_num_threads=1024 -thread_warp_size=32", "dense_large_batch.gpu", [["TENSOR", [65536, 1024], "float32"], ["TENSOR", [4096, 1024], "float32"]], {}], "config": {"index": 1090349, "code_hash": null, "entity": [["tile_x", "sp", [-1, 2, 32, 2]], ["tile_y", "sp", [-1, 2, 32, 4]], ["tile_k", "sp", [-1, 4, 1]]]}, "result": [[0.19623594449999998], 0, 6.227176904678345, 1637520148.1723716], "version": 0.2, "tvm_version": "0.8.dev0"}
{"input": ["cuda -keys=cuda,gpu -max_num_threads=1024 -thread_warp_size=32", "dense_large_batch.gpu", [["TENSOR", [65536, 1024], "float32"], ["TENSOR", [4096, 1024], "float32"]], {}], "config": {"index": 5499429, "code_hash": null, "entity": [["tile_x", "sp", [-1, 1, 32, 4]], ["tile_y", "sp", [-1, 2, 32, 4]], ["tile_k", "sp", [-1, 2, 2]]]}, "result": [[0.20976597425], 0, 6.095173120498657, 1637520154.0517745], "version": 0.2, "tvm_version": "0.8.dev0"}
{"input": ["cuda -keys=cuda,gpu -max_num_threads=1024 -thread_warp_size=32", "dense_large_batch.gpu", [["TENSOR", [65536, 1024], "float32"], ["TENSOR", [4096, 1024], "float32"]], {}], "config": {"index": 1019743, "code_hash": null, "entity": [["tile_x", "sp", [-1, 2, 32, 4]], ["tile_y", "sp", [-1, 2, 32, 2]], ["tile_k", "sp", [-1, 4, 1]]]}, "result": [[0.2721537445], 0, 6.350046873092651, 1637520160.1363637], "version": 0.2, "tvm_version": "0.8.dev0"}
{"input": ["cuda -keys=cuda,gpu -max_num_threads=1024 -thread_warp_size=32", "dense_large_batch.gpu", [["TENSOR", [65536, 1024], "float32"], ["TENSOR", [4096, 1024], "float32"]], {}], "config": {"index": 578716, "code_hash": null, "entity": [["tile_x", "sp", [-1, 1, 32, 2]], ["tile_y", "sp", [-1, 2, 32, 2]], ["tile_k", "sp", [-1, 2, 1]]]}, "result": [[0.378514566], 0, 6.840224027633667, 1637520212.9716835], "version": 0.2, "tvm_version": "0.8.dev0"}
{"input": ["cuda -keys=cuda,gpu -max_num_threads=1024 -thread_warp_size=32", "dense_large_batch.gpu", [["TENSOR", [65536, 1024], "float32"], ["TENSOR", [4096, 1024], "float32"]], {}], "config": {"index": 5428562, "code_hash": null, "entity": [["tile_x", "sp", [-1, 2, 32, 2]], ["tile_y", "sp", [-1, 2, 32, 2]], ["tile_k", "sp", [-1, 2, 2]]]}, "result": [[0.19060091399999998], 0, 5.843442440032959, 1637520218.575975], "version": 0.2, "tvm_version": "0.8.dev0"}
{"input": ["cuda -keys=cuda,gpu -max_num_threads=1024 -thread_warp_size=32", "dense_large_batch.gpu", [["TENSOR", [65536, 1024], "float32"], ["TENSOR", [4096, 1024], "float32"]], {}], "config": {"index": 5346196, "code_hash": null, "entity": [["tile_x", "sp", [-1, 1, 32, 2]], ["tile_y", "sp", [-1, 4, 32, 1]], ["tile_k", "sp", [-1, 2, 2]]]}, "result": [[0.26824532775], 0, 6.363368034362793, 1637520224.6314576], "version": 0.2, "tvm_version": "0.8.dev0"}
{"input": ["cuda -keys=cuda,gpu -max_num_threads=1024 -thread_warp_size=32", "dense_large_batch.gpu", [["TENSOR", [65536, 1024], "float32"], ["TENSOR", [4096, 1024], "float32"]], {}], "config": {"index": 4987666, "code_hash": null, "entity": [["tile_x", "sp", [-1, 1, 32, 2]], ["tile_y", "sp", [-1, 2, 32, 2]], ["tile_k", "sp", [-1, 1, 2]]]}, "result": [[0.3779943175], 0, 7.500263929367065, 1637520231.8519995], "version": 0.2, "tvm_version": "0.8.dev0"}
{"input": ["cuda -keys=cuda,gpu -max_num_threads=1024 -thread_warp_size=32", "dense_large_batch.gpu", [["TENSOR", [65536, 1024], "float32"], ["TENSOR", [4096, 1024], "float32"]], {}], "config": {"index": 936278, "code_hash": null, "entity": [["tile_x", "sp", [-1, 2, 32, 2]], ["tile_y", "sp", [-1, 2, 32, 1]], ["tile_k", "sp", [-1, 4, 1]]]}, "result": [[0.27813656350000004], 0, 6.53393816947937, 1637520238.1270735], "version": 0.2, "tvm_version": "0.8.dev0"}
{"input": ["cuda -keys=cuda,gpu -max_num_threads=1024 -thread_warp_size=32", "dense_large_batch.gpu", [["TENSOR", [65536, 1024], "float32"], ["TENSOR", [4096, 1024], "float32"]], {}], "config": {"index": 5347296, "code_hash": null, "entity": [["tile_x", "sp", [-1, 1, 32, 4]], ["tile_y", "sp", [-1, 8, 32, 1]], ["tile_k", "sp", [-1, 2, 2]]]}, "result": [[0.20406426074999998], 0, 6.766219139099121, 1637520244.6370428], "version": 0.2, "tvm_version": "0.8.dev0"}
{"input": ["cuda -keys=cuda,gpu -max_num_threads=1024 -thread_warp_size=32", "dense_large_batch.gpu", [["TENSOR", [65536, 1024], "float32"], ["TENSOR", [4096, 1024], "float32"]], {}], "config": {"index": 496351, "code_hash": null, "entity": [["tile_x", "sp", [-1, 1, 32, 2]], ["tile_y", "sp", [-1, 4, 32, 1]], ["tile_k", "sp", [-1, 2, 1]]]}, "result": [[0.3880515405], 0, 6.897489547729492, 1637520251.3247418], "version": 0.2, "tvm_version": "0.8.dev0"}
{"input": ["cuda -keys=cuda,gpu -max_num_threads=1024 -thread_warp_size=32", "dense_large_batch.gpu", [["TENSOR", [65536, 1024], "float32"], ["TENSOR", [4096, 1024], "float32"]], {}], "config": {"index": 578717, "code_hash": null, "entity": [["tile_x", "sp", [-1, 2, 32, 2]], ["tile_y", "sp", [-1, 2, 32, 2]], ["tile_k", "sp", [-1, 2, 1]]]}, "result": [[0.26066162125], 0, 6.445826053619385, 1637520257.5183232], "version": 0.2, "tvm_version": "0.8.dev0"}
{"input": ["cuda -keys=cuda,gpu -max_num_threads=1024 -thread_warp_size=32", "dense_large_batch.gpu", [["TENSOR", [65536, 1024], "float32"], ["TENSOR", [4096, 1024], "float32"]], {}], "config": {"index": 1020581, "code_hash": null, "entity": [["tile_x", "sp", [-1, 2, 32, 2]], ["tile_y", "sp", [-1, 4, 32, 2]], ["tile_k", "sp", [-1, 4, 1]]]}, "result": [[0.196876977], 0, 6.085451126098633, 1637520263.3319774], "version": 0.2, "tvm_version": "0.8.dev0"}
{"input": ["cuda -keys=cuda,gpu -max_num_threads=1024 -thread_warp_size=32", "dense_large_batch.gpu", [["TENSOR", [65536, 1024], "float32"], ["TENSOR", [4096, 1024], "float32"]], {}], "config": {"index": 938215, "code_hash": null, "entity": [["tile_x", "sp", [-1, 1, 32, 2]], ["tile_y", "sp", [-1, 8, 32, 1]], ["tile_k", "sp", [-1, 4, 1]]]}, "result": [[0.20280139049999998], 0, 6.052174091339111, 1637520269.1182969], "version": 0.2, "tvm_version": "0.8.dev0"}
{"input": ["cuda -keys=cuda,gpu -max_num_threads=1024 -thread_warp_size=32", "dense_large_batch.gpu", [["TENSOR", [65536, 1024], "float32"], ["TENSOR", [4096, 1024], "float32"]], {}], "config": {"index": 4904463, "code_hash": null, "entity": [["tile_x", "sp", [-1, 1, 32, 4]], ["tile_y", "sp", [-1, 2, 32, 1]], ["tile_k", "sp", [-1, 1, 2]]]}, "result": [[0.37069751275], 0, 6.852448225021362, 1637520275.7566836], "version": 0.2, "tvm_version": "0.8.dev0"}
{"input": ["cuda -keys=cuda,gpu -max_num_threads=1024 -thread_warp_size=32", "dense_large_batch.gpu", [["TENSOR", [65536, 1024], "float32"], ["TENSOR", [4096, 1024], "float32"]], {}], "config": {"index": 1019464, "code_hash": null, "entity": [["tile_x", "sp", [-1, 2, 32, 1]], ["tile_y", "sp", [-1, 2, 32, 2]], ["tile_k", "sp", [-1, 4, 1]]]}, "result": [[0.23929289975], 0, 6.195407867431641, 1637520281.7077205], "version": 0.2, "tvm_version": "0.8.dev0"}
{"input": ["cuda -keys=cuda,gpu -max_num_threads=1024 -thread_warp_size=32", "dense_large_batch.gpu", [["TENSOR", [65536, 1024], "float32"], ["TENSOR", [4096, 1024], "float32"]], {}], "config": {"index": 937098, "code_hash": null, "entity": [["tile_x", "sp", [-1, 1, 32, 1]], ["tile_y", "sp", [-1, 4, 32, 1]], ["tile_k", "sp", [-1, 4, 1]]]}, "result": [[0.33032291199999997], 0, 6.678643465042114, 1637520288.2111137], "version": 0.2, "tvm_version": "0.8.dev0"}
{"input": ["cuda -keys=cuda,gpu -max_num_threads=1024 -thread_warp_size=32", "dense_large_batch.gpu", [["TENSOR", [65536, 1024], "float32"], ["TENSOR", [4096, 1024], "float32"]], {}], "config": {"index": 4905301, "code_hash": null, "entity": [["tile_x", "sp", [-1, 1, 32, 2]], ["tile_y", "sp", [-1, 4, 32, 1]], ["tile_k", "sp", [-1, 1, 2]]]}, "result": [[0.38807305875], 0, 6.982021808624268, 1637520295.0071177], "version": 0.2, "tvm_version": "0.8.dev0"}
{"input": ["cuda -keys=cuda,gpu -max_num_threads=1024 -thread_warp_size=32", "dense_large_batch.gpu", [["TENSOR", [65536, 1024], "float32"], ["TENSOR", [4096, 1024], "float32"]], {}], "config": {"index": 577748, "code_hash": null, "entity": [["tile_x", "sp", [-1, 2, 32, 2]], ["tile_y", "sp", [-1, 1, 32, 2]], ["tile_k", "sp", [-1, 2, 1]]]}, "result": [[0.34444176425], 0, 6.6721765995025635, 1637520301.4444299], "version": 0.2, "tvm_version": "0.8.dev0"}
{"input": ["cuda -keys=cuda,gpu -max_num_threads=1024 -thread_warp_size=32", "dense_large_batch.gpu", [["TENSOR", [65536, 1024], "float32"], ["TENSOR", [4096, 1024], "float32"]], {}], "config": {"index": 5429530, "code_hash": null, "entity": [["tile_x", "sp", [-1, 1, 32, 2]], ["tile_y", "sp", [-1, 4, 32, 2]], ["tile_k", "sp", [-1, 2, 2]]]}, "result": [[0.20551461750000002], 0, 5.971565008163452, 1637520307.136859], "version": 0.2, "tvm_version": "0.8.dev0"}
{"input": ["cuda -keys=cuda,gpu -max_num_threads=1024 -thread_warp_size=32", "dense_large_batch.gpu", [["TENSOR", [65536, 1024], "float32"], ["TENSOR", [4096, 1024], "float32"]], {}], "config": {"index": 938216, "code_hash": null, "entity": [["tile_x", "sp", [-1, 2, 32, 2]], ["tile_y", "sp", [-1, 8, 32, 1]], ["tile_k", "sp", [-1, 4, 1]]]}, "result": [[0.19116661275000002], 0, 6.221043586730957, 1637520312.9790561], "version": 0.2, "tvm_version": "0.8.dev0"}
{"input": ["cuda -keys=cuda,gpu -max_num_threads=1024 -thread_warp_size=32", "dense_large_batch.gpu", [["TENSOR", [65536, 1024], "float32"], ["TENSOR", [4096, 1024], "float32"]], {}], "config": {"index": 578568, "code_hash": null, "entity": [["tile_x", "sp", [-1, 1, 32, 1]], ["tile_y", "sp", [-1, 2, 32, 2]], ["tile_k", "sp", [-1, 2, 1]]]}, "result": [[0.56628983125], 0, 8.095171689987183, 1637520320.8296444], "version": 0.2, "tvm_version": "0.8.dev0"}
{"input": ["cuda -keys=cuda,gpu -max_num_threads=1024 -thread_warp_size=32", "dense_large_batch.gpu", [["TENSOR", [65536, 1024], "float32"], ["TENSOR", [4096, 1024], "float32"]], {}], "config": {"index": 649453, "code_hash": null, "entity": [["tile_x", "sp", [-1, 1, 32, 2]], ["tile_y", "sp", [-1, 2, 32, 4]], ["tile_k", "sp", [-1, 2, 1]]]}, "result": [[0.295135963], 0, 6.465967893600464, 1637520327.053996], "version": 0.2, "tvm_version": "0.8.dev0"}
{"input": ["cuda -keys=cuda,gpu -max_num_threads=1024 -thread_warp_size=32", "dense_large_batch.gpu", [["TENSOR", [65536, 1024], "float32"], ["TENSOR", [4096, 1024], "float32"]], {}], "config": {"index": 5347165, "code_hash": null, "entity": [["tile_x", "sp", [-1, 1, 32, 2]], ["tile_y", "sp", [-1, 8, 32, 1]], ["tile_k", "sp", [-1, 2, 2]]]}, "result": [[0.19975116325], 0, 6.122467994689941, 1637520332.93464], "version": 0.2, "tvm_version": "0.8.dev0"}
{"input": ["cuda -keys=cuda,gpu -max_num_threads=1024 -thread_warp_size=32", "dense_large_batch.gpu", [["TENSOR", [65536, 1024], "float32"], ["TENSOR", [4096, 1024], "float32"]], {}], "config": {"index": 1089380, "code_hash": null, "entity": [["tile_x", "sp", [-1, 2, 32, 2]], ["tile_y", "sp", [-1, 1, 32, 4]], ["tile_k", "sp", [-1, 4, 1]]]}, "result": [[0.19050435], 0, 6.282456874847412, 1637520338.8857174], "version": 0.2, "tvm_version": "0.8.dev0"}
{"input": ["cuda -keys=cuda,gpu -max_num_threads=1024 -thread_warp_size=32", "dense_large_batch.gpu", [["TENSOR", [65536, 1024], "float32"], ["TENSOR", [4096, 1024], "float32"]], {}], "config": {"index": 4905432, "code_hash": null, "entity": [["tile_x", "sp", [-1, 1, 32, 4]], ["tile_y", "sp", [-1, 4, 32, 1]], ["tile_k", "sp", [-1, 1, 2]]]}, "result": [[0.26682148899999997], 0, 6.55013108253479, 1637520345.202237], "version": 0.2, "tvm_version": "0.8.dev0"}
{"input": ["cuda -keys=cuda,gpu -max_num_threads=1024 -thread_warp_size=32", "dense_large_batch.gpu", [["TENSOR", [65536, 1024], "float32"], ["TENSOR", [4096, 1024], "float32"]], {}], "config": {"index": 5428693, "code_hash": null, "entity": [["tile_x", "sp", [-1, 2, 32, 4]], ["tile_y", "sp", [-1, 2, 32, 2]], ["tile_k", "sp", [-1, 2, 2]]]}, "result": [[0.271634936], 0, 6.4128875732421875, 1637520351.2930233], "version": 0.2, "tvm_version": "0.8.dev0"}
{"input": ["cuda -keys=cuda,gpu -max_num_threads=1024 -thread_warp_size=32", "dense_large_batch.gpu", [["TENSOR", [65536, 1024], "float32"], ["TENSOR", [4096, 1024], "float32"]], {}], "config": {"index": 496203, "code_hash": null, "entity": [["tile_x", "sp", [-1, 1, 32, 1]], ["tile_y", "sp", [-1, 4, 32, 1]], ["tile_k", "sp", [-1, 2, 1]]]}, "result": [[0.5433801375], 0, 7.673594951629639, 1637520358.6542509], "version": 0.2, "tvm_version": "0.8.dev0"}
{"input": ["cuda -keys=cuda,gpu -max_num_threads=1024 -thread_warp_size=32", "dense_large_batch.gpu", [["TENSOR", [65536, 1024], "float32"], ["TENSOR", [4096, 1024], "float32"]], {}], "config": {"index": 5499299, "code_hash": null, "entity": [["tile_x", "sp", [-1, 2, 32, 2]], ["tile_y", "sp", [-1, 2, 32, 4]], ["tile_k", "sp", [-1, 2, 2]]]}, "result": [[0.1959627025], 0, 6.053490877151489, 1637520432.6246552], "version": 0.2, "tvm_version": "0.8.dev0"}
{"input": ["cuda -keys=cuda,gpu -max_num_threads=1024 -thread_warp_size=32", "dense_large_batch.gpu", [["TENSOR", [65536, 1024], "float32"], ["TENSOR", [4096, 1024], "float32"]], {}], "config": {"index": 5498330, "code_hash": null, "entity": [["tile_x", "sp", [-1, 2, 32, 2]], ["tile_y", "sp", [-1, 1, 32, 4]], ["tile_k", "sp", [-1, 2, 2]]]}, "result": [[0.19068441675], 0, 5.919485330581665, 1637520438.3268793], "version": 0.2, "tvm_version": "0.8.dev0"}
{"input": ["cuda -keys=cuda,gpu -max_num_threads=1024 -thread_warp_size=32", "dense_large_batch.gpu", [["TENSOR", [65536, 1024], "float32"], ["TENSOR", [4096, 1024], "float32"]], {}], "config": {"index": 1019465, "code_hash": null, "entity": [["tile_x", "sp", [-1, 4, 32, 1]], ["tile_y", "sp", [-1, 2, 32, 2]], ["tile_k", "sp", [-1, 4, 1]]]}, "result": [[0.1785017225], 0, 5.844565391540527, 1637520443.8838634], "version": 0.2, "tvm_version": "0.8.dev0"}
{"input": ["cuda -keys=cuda,gpu -max_num_threads=1024 -thread_warp_size=32", "dense_large_batch.gpu", [["TENSOR", [65536, 1024], "float32"], ["TENSOR", [4096, 1024], "float32"]], {}], "config": {"index": 1018643, "code_hash": null, "entity": [["tile_x", "sp", [-1, 2, 32, 2]], ["tile_y", "sp", [-1, 1, 32, 2]], ["tile_k", "sp", [-1, 4, 1]]]}, "result": [[0.275313582], 0, 6.429717540740967, 1637520450.0327468], "version": 0.2, "tvm_version": "0.8.dev0"}
{"input": ["cuda -keys=cuda,gpu -max_num_threads=1024 -thread_warp_size=32", "dense_large_batch.gpu", [["TENSOR", [65536, 1024], "float32"], ["TENSOR", [4096, 1024], "float32"]], {}], "config": {"index": 5346197, "code_hash": null, "entity": [["tile_x", "sp", [-1, 2, 32, 2]], ["tile_y", "sp", [-1, 4, 32, 1]], ["tile_k", "sp", [-1, 2, 2]]]}, "result": [[0.1884217335], 0, 6.024927139282227, 1637520455.8112197], "version": 0.2, "tvm_version": "0.8.dev0"}
{"input": ["cuda -keys=cuda,gpu -max_num_threads=1024 -thread_warp_size=32", "dense_large_batch.gpu", [["TENSOR", [65536, 1024], "float32"], ["TENSOR", [4096, 1024], "float32"]], {}], "config": {"index": 5499298, "code_hash": null, "entity": [["tile_x", "sp", [-1, 1, 32, 2]], ["tile_y", "sp", [-1, 2, 32, 4]], ["tile_k", "sp", [-1, 2, 2]]]}, "result": [[0.2007937685], 0, 5.9368181228637695, 1637520461.5169911], "version": 0.2, "tvm_version": "0.8.dev0"}
{"input": ["cuda -keys=cuda,gpu -max_num_threads=1024 -thread_warp_size=32", "dense_large_batch.gpu", [["TENSOR", [65536, 1024], "float32"], ["TENSOR", [4096, 1024], "float32"]], {}], "config": {"index": 202733, "code_hash": null, "entity": [["tile_x", "sp", [-1, 2, 16, 2]], ["tile_y", "sp", [-1, 4, 16, 4]], ["tile_k", "sp", [-1, 1, 1]]]}, "result": [[0.260340346], 0, 6.31293511390686, 1637520467.5872815], "version": 0.2, "tvm_version": "0.8.dev0"}
{"input": ["cuda -keys=cuda,gpu -max_num_threads=1024 -thread_warp_size=32", "dense_large_batch.gpu", [["TENSOR", [65536, 1024], "float32"], ["TENSOR", [4096, 1024], "float32"]], {}], "config": {"index": 1089233, "code_hash": null, "entity": [["tile_x", "sp", [-1, 4, 32, 1]], ["tile_y", "sp", [-1, 1, 32, 4]], ["tile_k", "sp", [-1, 4, 1]]]}, "result": [[0.1757791265], 0, 5.913121223449707, 1637520473.2250135], "version": 0.2, "tvm_version": "0.8.dev0"}
{"input": ["cuda -keys=cuda,gpu -max_num_threads=1024 -thread_warp_size=32", "dense_large_batch.gpu", [["TENSOR", [65536, 1024], "float32"], ["TENSOR", [4096, 1024], "float32"]], {}], "config": {"index": 937100, "code_hash": null, "entity": [["tile_x", "sp", [-1, 4, 32, 1]], ["tile_y", "sp", [-1, 4, 32, 1]], ["tile_k", "sp", [-1, 4, 1]]]}, "result": [[0.169935634], 0, 6.002451658248901, 1637520478.9577177], "version": 0.2, "tvm_version": "0.8.dev0"}
{"input": ["cuda -keys=cuda,gpu -max_num_threads=1024 -thread_warp_size=32", "dense_large_batch.gpu", [["TENSOR", [65536, 1024], "float32"], ["TENSOR", [4096, 1024], "float32"]], {}], "config": {"index": 5058534, "code_hash": null, "entity": [["tile_x", "sp", [-1, 1, 32, 4]], ["tile_y", "sp", [-1, 2, 32, 4]], ["tile_k", "sp", [-1, 1, 2]]]}, "result": [[0.28017689175], 0, 6.644606590270996, 1637520485.3378193], "version": 0.2, "tvm_version": "0.8.dev0"}
{"input": ["cuda -keys=cuda,gpu -max_num_threads=1024 -thread_warp_size=32", "dense_large_batch.gpu", [["TENSOR", [65536, 1024], "float32"], ["TENSOR", [4096, 1024], "float32"]], {}], "config": {"index": 5346050, "code_hash": null, "entity": [["tile_x", "sp", [-1, 4, 32, 1]], ["tile_y", "sp", [-1, 4, 32, 1]], ["tile_k", "sp", [-1, 2, 2]]]}, "result": [[0.16888418924999998], 0, 6.022726774215698, 1637520491.0938299], "version": 0.2, "tvm_version": "0.8.dev0"}
{"input": ["cuda -keys=cuda,gpu -max_num_threads=1024 -thread_warp_size=32", "dense_large_batch.gpu", [["TENSOR", [65536, 1024], "float32"], ["TENSOR", [4096, 1024], "float32"]], {}], "config": {"index": 5429531, "code_hash": null, "entity": [["tile_x", "sp", [-1, 2, 32, 2]], ["tile_y", "sp", [-1, 4, 32, 2]], ["tile_k", "sp", [-1, 2, 2]]]}, "result": [[0.19452728174999998], 0, 6.120550632476807, 1637520496.9255857], "version": 0.2, "tvm_version": "0.8.dev0"}
{"input": ["cuda -keys=cuda,gpu -max_num_threads=1024 -thread_warp_size=32", "dense_large_batch.gpu", [["TENSOR", [65536, 1024], "float32"], ["TENSOR", [4096, 1024], "float32"]], {}], "config": {"index": 649584, "code_hash": null, "entity": [["tile_x", "sp", [-1, 1, 32, 4]], ["tile_y", "sp", [-1, 2, 32, 4]], ["tile_k", "sp", [-1, 2, 1]]]}, "result": [[0.2803810545], 0, 6.7396697998046875, 1637520503.4134724], "version": 0.2, "tvm_version": "0.8.dev0"}
{"input": ["cuda -keys=cuda,gpu -max_num_threads=1024 -thread_warp_size=32", "dense_large_batch.gpu", [["TENSOR", [65536, 1024], "float32"], ["TENSOR", [4096, 1024], "float32"]], {}], "config": {"index": 202732, "code_hash": null, "entity": [["tile_x", "sp", [-1, 1, 16, 2]], ["tile_y", "sp", [-1, 4, 16, 4]], ["tile_k", "sp", [-1, 1, 1]]]}, "result": [[0.4358644845], 0, 7.2149248123168945, 1637520510.378401], "version": 0.2, "tvm_version": "0.8.dev0"}
{"input": ["cuda -keys=cuda,gpu -max_num_threads=1024 -thread_warp_size=32", "dense_large_batch.gpu", [["TENSOR", [65536, 1024], "float32"], ["TENSOR", [4096, 1024], "float32"]], {}], "config": {"index": 648485, "code_hash": null, "entity": [["tile_x", "sp", [-1, 2, 32, 2]], ["tile_y", "sp", [-1, 1, 32, 4]], ["tile_k", "sp", [-1, 2, 1]]]}, "result": [[0.2574666465], 0, 6.294169664382935, 1637520516.407479], "version": 0.2, "tvm_version": "0.8.dev0"}
{"input": ["cuda -keys=cuda,gpu -max_num_threads=1024 -thread_warp_size=32", "dense_large_batch.gpu", [["TENSOR", [65536, 1024], "float32"], ["TENSOR", [4096, 1024], "float32"]], {}], "config": {"index": 9467354, "code_hash": null, "entity": [["tile_x", "sp", [-1, 2, 32, 2]], ["tile_y", "sp", [-1, 2, 32, 4]], ["tile_k", "sp", [-1, 1, 4]]]}, "result": [[0.19583693475000002], 0, 6.018722057342529, 1637520522.1221626], "version": 0.2, "tvm_version": "0.8.dev0"}
{"input": ["cuda -keys=cuda,gpu -max_num_threads=1024 -thread_warp_size=32", "dense_large_batch.gpu", [["TENSOR", [65536, 1024], "float32"], ["TENSOR", [4096, 1024], "float32"]], {}], "config": {"index": 261842, "code_hash": null, "entity": [["tile_x", "sp", [-1, 2, 16, 2]], ["tile_y", "sp", [-1, 2, 16, 8]], ["tile_k", "sp", [-1, 1, 1]]]}, "result": [[0.26200907475], 0, 6.3530662059783936, 1637520528.1903424], "version": 0.2, "tvm_version": "0.8.dev0"}
{"input": ["cuda -keys=cuda,gpu -max_num_threads=1024 -thread_warp_size=32", "dense_large_batch.gpu", [["TENSOR", [65536, 1024], "float32"], ["TENSOR", [4096, 1024], "float32"]], {}], "config": {"index": 5498183, "code_hash": null, "entity": [["tile_x", "sp", [-1, 4, 32, 1]], ["tile_y", "sp", [-1, 1, 32, 4]], ["tile_k", "sp", [-1, 2, 2]]]}, "result": [[0.1763304215], 0, 5.902599573135376, 1637520533.8455663], "version": 0.2, "tvm_version": "0.8.dev0"}
{"input": ["cuda -keys=cuda,gpu -max_num_threads=1024 -thread_warp_size=32", "dense_large_batch.gpu", [["TENSOR", [65536, 1024], "float32"], ["TENSOR", [4096, 1024], "float32"]], {}], "config": {"index": 261841, "code_hash": null, "entity": [["tile_x", "sp", [-1, 1, 16, 2]], ["tile_y", "sp", [-1, 2, 16, 8]], ["tile_k", "sp", [-1, 1, 1]]]}, "result": [[0.44011306075], 0, 7.398889064788818, 1637520541.0113287], "version": 0.2, "tvm_version": "0.8.dev0"}
{"input": ["cuda -keys=cuda,gpu -max_num_threads=1024 -thread_warp_size=32", "dense_large_batch.gpu", [["TENSOR", [65536, 1024], "float32"], ["TENSOR", [4096, 1024], "float32"]], {}], "config": {"index": 1089232, "code_hash": null, "entity": [["tile_x", "sp", [-1, 2, 32, 1]], ["tile_y", "sp", [-1, 1, 32, 4]], ["tile_k", "sp", [-1, 4, 1]]]}, "result": [[0.2505861795], 0, 6.178957223892212, 1637520546.9315064], "version": 0.2, "tvm_version": "0.8.dev0"}
{"input": ["cuda -keys=cuda,gpu -max_num_threads=1024 -thread_warp_size=32", "dense_large_batch.gpu", [["TENSOR", [65536, 1024], "float32"], ["TENSOR", [4096, 1024], "float32"]], {}], "config": {"index": 1019463, "code_hash": null, "entity": [["tile_x", "sp", [-1, 1, 32, 1]], ["tile_y", "sp", [-1, 2, 32, 2]], ["tile_k", "sp", [-1, 4, 1]]]}, "result": [[0.32804078675], 0, 6.6492719650268555, 1637520553.3331053], "version": 0.2, "tvm_version": "0.8.dev0"}
{"input": ["cuda -keys=cuda,gpu -max_num_threads=1024 -thread_warp_size=32", "dense_large_batch.gpu", [["TENSOR", [65536, 1024], "float32"], ["TENSOR", [4096, 1024], "float32"]], {}], "config": {"index": 5428414, "code_hash": null, "entity": [["tile_x", "sp", [-1, 2, 32, 1]], ["tile_y", "sp", [-1, 2, 32, 2]], ["tile_k", "sp", [-1, 2, 2]]]}, "result": [[0.2393135315], 0, 6.2917938232421875, 1637520559.3785658], "version": 0.2, "tvm_version": "0.8.dev0"}
{"input": ["cuda -keys=cuda,gpu -max_num_threads=1024 -thread_warp_size=32", "dense_large_batch.gpu", [["TENSOR", [65536, 1024], "float32"], ["TENSOR", [4096, 1024], "float32"]], {}], "config": {"index": 937099, "code_hash": null, "entity": [["tile_x", "sp", [-1, 2, 32, 1]], ["tile_y", "sp", [-1, 4, 32, 1]], ["tile_k", "sp", [-1, 4, 1]]]}, "result": [[0.24763379275], 0, 6.240835666656494, 1637520565.3449006], "version": 0.2, "tvm_version": "0.8.dev0"}
{"input": ["cuda -keys=cuda,gpu -max_num_threads=1024 -thread_warp_size=32", "dense_large_batch.gpu", [["TENSOR", [65536, 1024], "float32"], ["TENSOR", [4096, 1024], "float32"]], {}], "config": {"index": 5058403, "code_hash": null, "entity": [["tile_x", "sp", [-1, 1, 32, 2]], ["tile_y", "sp", [-1, 2, 32, 4]], ["tile_k", "sp", [-1, 1, 2]]]}, "result": [[0.29502337175000004], 0, 6.449278354644775, 1637520571.5514603], "version": 0.2, "tvm_version": "0.8.dev0"}
{"input": ["cuda -keys=cuda,gpu -max_num_threads=1024 -thread_warp_size=32", "dense_large_batch.gpu", [["TENSOR", [65536, 1024], "float32"], ["TENSOR", [4096, 1024], "float32"]], {}], "config": {"index": 5428415, "code_hash": null, "entity": [["tile_x", "sp", [-1, 4, 32, 1]], ["tile_y", "sp", [-1, 2, 32, 2]], ["tile_k", "sp", [-1, 2, 2]]]}, "result": [[0.17901169625], 0, 6.087696075439453, 1637520622.1147954], "version": 0.2, "tvm_version": "0.8.dev0"}
{"input": ["cuda -keys=cuda,gpu -max_num_threads=1024 -thread_warp_size=32", "dense_large_batch.gpu", [["TENSOR", [65536, 1024], "float32"], ["TENSOR", [4096, 1024], "float32"]], {}], "config": {"index": 9314105, "code_hash": null, "entity": [["tile_x", "sp", [-1, 4, 32, 1]], ["tile_y", "sp", [-1, 4, 32, 1]], ["tile_k", "sp", [-1, 1, 4]]]}, "result": [[0.16959419274999998], 0, 5.875165700912476, 1637520627.8061926], "version": 0.2, "tvm_version": "0.8.dev0"}
{"input": ["cuda -keys=cuda,gpu -max_num_threads=1024 -thread_warp_size=32", "dense_large_batch.gpu", [["TENSOR", [65536, 1024], "float32"], ["TENSOR", [4096, 1024], "float32"]], {}], "config": {"index": 9314252, "code_hash": null, "entity": [["tile_x", "sp", [-1, 2, 32, 2]], ["tile_y", "sp", [-1, 4, 32, 1]], ["tile_k", "sp", [-1, 1, 4]]]}, "result": [[0.18865166475], 0, 5.898250341415405, 1637520633.4953883], "version": 0.2, "tvm_version": "0.8.dev0"}
{"input": ["cuda -keys=cuda,gpu -max_num_threads=1024 -thread_warp_size=32", "dense_large_batch.gpu", [["TENSOR", [65536, 1024], "float32"], ["TENSOR", [4096, 1024], "float32"]], {}], "config": {"index": 5347166, "code_hash": null, "entity": [["tile_x", "sp", [-1, 2, 32, 2]], ["tile_y", "sp", [-1, 8, 32, 1]], ["tile_k", "sp", [-1, 2, 2]]]}, "result": [[0.19008209350000002], 0, 6.079943895339966, 1637520639.2411811], "version": 0.2, "tvm_version": "0.8.dev0"}
{"input": ["cuda -keys=cuda,gpu -max_num_threads=1024 -thread_warp_size=32", "dense_large_batch.gpu", [["TENSOR", [65536, 1024], "float32"], ["TENSOR", [4096, 1024], "float32"]], {}], "config": {"index": 5499151, "code_hash": null, "entity": [["tile_x", "sp", [-1, 2, 32, 1]], ["tile_y", "sp", [-1, 2, 32, 4]], ["tile_k", "sp", [-1, 2, 2]]]}, "result": [[0.19118173275], 0, 6.153683662414551, 1637520645.0690086], "version": 0.2, "tvm_version": "0.8.dev0"}
{"input": ["cuda -keys=cuda,gpu -max_num_threads=1024 -thread_warp_size=32", "dense_large_batch.gpu", [["TENSOR", [65536, 1024], "float32"], ["TENSOR", [4096, 1024], "float32"]], {}], "config": {"index": 5346049, "code_hash": null, "entity": [["tile_x", "sp", [-1, 2, 32, 1]], ["tile_y", "sp", [-1, 4, 32, 1]], ["tile_k", "sp", [-1, 2, 2]]]}, "result": [[0.24803480975], 0, 6.334371089935303, 1637520651.1681035], "version": 0.2, "tvm_version": "0.8.dev0"}
{"input": ["cuda -keys=cuda,gpu -max_num_threads=1024 -thread_warp_size=32", "dense_large_batch.gpu", [["TENSOR", [65536, 1024], "float32"], ["TENSOR", [4096, 1024], "float32"]], {}], "config": {"index": 9466238, "code_hash": null, "entity": [["tile_x", "sp", [-1, 4, 32, 1]], ["tile_y", "sp", [-1, 1, 32, 4]], ["tile_k", "sp", [-1, 1, 4]]]}, "result": [[0.175764018], 0, 6.296553611755371, 1637520657.1614656], "version": 0.2, "tvm_version": "0.8.dev0"}
{"input": ["cuda -keys=cuda,gpu -max_num_threads=1024 -thread_warp_size=32", "dense_large_batch.gpu", [["TENSOR", [65536, 1024], "float32"], ["TENSOR", [4096, 1024], "float32"]], {}], "config": {"index": 9467206, "code_hash": null, "entity": [["tile_x", "sp", [-1, 2, 32, 1]], ["tile_y", "sp", [-1, 2, 32, 4]], ["tile_k", "sp", [-1, 1, 4]]]}, "result": [[0.1910949325], 0, 6.212913990020752, 1637520663.0481555], "version": 0.2, "tvm_version": "0.8.dev0"}
{"input": ["cuda -keys=cuda,gpu -max_num_threads=1024 -thread_warp_size=32", "dense_large_batch.gpu", [["TENSOR", [65536, 1024], "float32"], ["TENSOR", [4096, 1024], "float32"]], {}], "config": {"index": 9314382, "code_hash": null, "entity": [["tile_x", "sp", [-1, 1, 32, 4]], ["tile_y", "sp", [-1, 4, 32, 1]], ["tile_k", "sp", [-1, 1, 4]]]}, "result": [[0.22039842974999999], 0, 5.995226144790649, 1637520668.7791774], "version": 0.2, "tvm_version": "0.8.dev0"}
{"input": ["cuda -keys=cuda,gpu -max_num_threads=1024 -thread_warp_size=32", "dense_large_batch.gpu", [["TENSOR", [65536, 1024], "float32"], ["TENSOR", [4096, 1024], "float32"]], {}], "config": {"index": 9396617, "code_hash": null, "entity": [["tile_x", "sp", [-1, 2, 32, 2]], ["tile_y", "sp", [-1, 2, 32, 2]], ["tile_k", "sp", [-1, 1, 4]]]}, "result": [[0.19107630625], 0, 6.079941511154175, 1637520674.5718184], "version": 0.2, "tvm_version": "0.8.dev0"}
{"input": ["cuda -keys=cuda,gpu -max_num_threads=1024 -thread_warp_size=32", "dense_large_batch.gpu", [["TENSOR", [65536, 1024], "float32"], ["TENSOR", [4096, 1024], "float32"]], {}], "config": {"index": 5499152, "code_hash": null, "entity": [["tile_x", "sp", [-1, 4, 32, 1]], ["tile_y", "sp", [-1, 2, 32, 4]], ["tile_k", "sp", [-1, 2, 2]]]}, "result": [[0.18915096625], 0, 6.078276634216309, 1637520680.377711], "version": 0.2, "tvm_version": "0.8.dev0"}
{"input": ["cuda -keys=cuda,gpu -max_num_threads=1024 -thread_warp_size=32", "dense_large_batch.gpu", [["TENSOR", [65536, 1024], "float32"], ["TENSOR", [4096, 1024], "float32"]], {}], "config": {"index": 261843, "code_hash": null, "entity": [["tile_x", "sp", [-1, 4, 16, 2]], ["tile_y", "sp", [-1, 2, 16, 8]], ["tile_k", "sp", [-1, 1, 1]]]}, "result": [[0.27249852825], 0, 6.4569830894470215, 1637520686.4926243], "version": 0.2, "tvm_version": "0.8.dev0"}
{"input": ["cuda -keys=cuda,gpu -max_num_threads=1024 -thread_warp_size=32", "dense_large_batch.gpu", [["TENSOR", [65536, 1024], "float32"], ["TENSOR", [4096, 1024], "float32"]], {}], "config": {"index": 9396470, "code_hash": null, "entity": [["tile_x", "sp", [-1, 4, 32, 1]], ["tile_y", "sp", [-1, 2, 32, 2]], ["tile_k", "sp", [-1, 1, 4]]]}, "result": [[0.17852595075], 0, 5.905357837677002, 1637520692.0896292], "version": 0.2, "tvm_version": "0.8.dev0"}
{"input": ["cuda -keys=cuda,gpu -max_num_threads=1024 -thread_warp_size=32", "dense_large_batch.gpu", [["TENSOR", [65536, 1024], "float32"], ["TENSOR", [4096, 1024], "float32"]], {}], "config": {"index": 9397438, "code_hash": null, "entity": [["tile_x", "sp", [-1, 2, 32, 1]], ["tile_y", "sp", [-1, 4, 32, 2]], ["tile_k", "sp", [-1, 1, 4]]]}, "result": [[0.19933991599999998], 0, 5.986072301864624, 1637520697.750459], "version": 0.2, "tvm_version": "0.8.dev0"}
{"input": ["cuda -keys=cuda,gpu -max_num_threads=1024 -thread_warp_size=32", "dense_large_batch.gpu", [["TENSOR", [65536, 1024], "float32"], ["TENSOR", [4096, 1024], "float32"]], {}], "config": {"index": 5429383, "code_hash": null, "entity": [["tile_x", "sp", [-1, 2, 32, 1]], ["tile_y", "sp", [-1, 4, 32, 2]], ["tile_k", "sp", [-1, 2, 2]]]}, "result": [[0.19937978874999998], 0, 5.9179394245147705, 1637520703.4103408], "version": 0.2, "tvm_version": "0.8.dev0"}
{"input": ["cuda -keys=cuda,gpu -max_num_threads=1024 -thread_warp_size=32", "dense_large_batch.gpu", [["TENSOR", [65536, 1024], "float32"], ["TENSOR", [4096, 1024], "float32"]], {}], "config": {"index": 5347019, "code_hash": null, "entity": [["tile_x", "sp", [-1, 4, 32, 1]], ["tile_y", "sp", [-1, 8, 32, 1]], ["tile_k", "sp", [-1, 2, 2]]]}, "result": [[0.18414207049999998], 0, 5.959932565689087, 1637520709.0398998], "version": 0.2, "tvm_version": "0.8.dev0"}
