artifacts/Table3/tvm/autotvm/conv/conv2d_128_2688_11_11_672_1_1_1_0.log
{"input": ["cuda -keys=cuda,gpu -max_num_threads=1024 -thread_warp_size=32", "conv2d_nchw.cuda", [["TENSOR", [128, 2688, 11, 11], "float32"], ["TENSOR", [672, 2688, 1, 1], "float32"], 1, "SAME", 1, "float32"], {}], "config": {"index": 2315392, "code_hash": null, "entity": [["tile_f", "sp", [-1, 7, 16, 1]], ["tile_y", "sp", [-1, 1, 1, 1]], ["tile_x", "sp", [-1, 1, 11, 1]], ["tile_rc", "sp", [-1, 2]], ["tile_ry", "sp", [-1, 1]], ["tile_rx", "sp", [-1, 1]], ["auto_unroll_max_step", "ot", 1500], ["unroll_explicit", "ot", 1]]}, "result": [[0.140813], 0, 2.8634655475616455, 1639026907.281988], "version": 0.2, "tvm_version": "0.8.dev0"}
{"input": ["cuda -keys=cuda,gpu -max_num_threads=1024 -thread_warp_size=32", "conv2d_nchw.cuda", [["TENSOR", [128, 2688, 11, 11], "float32"], ["TENSOR", [672, 2688, 1, 1], "float32"], 1, "SAME", 1, "float32"], {}], "config": {"index": 2458973, "code_hash": null, "entity": [["tile_f", "sp", [-1, 7, 4, 3]], ["tile_y", "sp", [-1, 1, 1, 1]], ["tile_x", "sp", [-1, 1, 11, 1]], ["tile_rc", "sp", [-1, 24]], ["tile_ry", "sp", [-1, 1]], ["tile_rx", "sp", [-1, 1]], ["auto_unroll_max_step", "ot", 1500], ["unroll_explicit", "ot", 1]]}, "result": [[0.1401276], 0, 3.3909969329833984, 1639026911.5648282], "version": 0.2, "tvm_version": "0.8.dev0"}
{"input": ["cuda -keys=cuda,gpu -max_num_threads=1024 -thread_warp_size=32", "conv2d_nchw.cuda", [["TENSOR", [128, 2688, 11, 11], "float32"], ["TENSOR", [672, 2688, 1, 1], "float32"], 1, "SAME", 1, "float32"], {}], "config": {"index": 966929, "code_hash": null, "entity": [["tile_f", "sp", [-1, 2, 28, 1]], ["tile_y", "sp", [-1, 1, 1, 11]], ["tile_x", "sp", [-1, 11, 1, 1]], ["tile_rc", "sp", [-1, 4]], ["tile_ry", "sp", [-1, 1]], ["tile_rx", "sp", [-1, 1]], ["auto_unroll_max_step", "ot", 1500], ["unroll_explicit", "ot", 0]]}, "result": [[0.475054], 0, 5.174412965774536, 1639027122.1998777], "version": 0.2, "tvm_version": "0.8.dev0"}
{"input": ["cuda -keys=cuda,gpu -max_num_threads=1024 -thread_warp_size=32", "conv2d_nchw.cuda", [["TENSOR", [128, 2688, 11, 11], "float32"], ["TENSOR", [672, 2688, 1, 1], "float32"], 1, "SAME", 1, "float32"], {}], "config": {"index": 698736, "code_hash": null, "entity": [["tile_f", "sp", [-1, 1, 4, 21]], ["tile_y", "sp", [-1, 1, 1, 11]], ["tile_x", "sp", [-1, 1, 11, 1]], ["tile_rc", "sp", [-1, 56]], ["tile_ry", "sp", [-1, 1]], ["tile_rx", "sp", [-1, 1]], ["auto_unroll_max_step", "ot", 512], ["unroll_explicit", "ot", 0]]}, "result": [[0.211747825], 0, 4.053476333618164, 1639027127.166287], "version": 0.2, "tvm_version": "0.8.dev0"}
{"input": ["cuda -keys=cuda,gpu -max_num_threads=1024 -thread_warp_size=32", "conv2d_nchw.cuda", [["TENSOR", [128, 2688, 11, 11], "float32"], ["TENSOR", [672, 2688, 1, 1], "float32"], 1, "SAME", 1, "float32"], {}], "config": {"index": 166194, "code_hash": null, "entity": [["tile_f", "sp", [-1, 7, 6, 4]], ["tile_y", "sp", [-1, 11, 1, 1]], ["tile_x", "sp", [-1, 1, 11, 1]], ["tile_rc", "sp", [-1, 24]], ["tile_ry", "sp", [-1, 1]], ["tile_rx", "sp", [-1, 1]], ["auto_unroll_max_step", "ot", 0], ["unroll_explicit", "ot", 0]]}, "result": [[2.328372625], 0, 13.871675252914429, 1639027141.4463766], "version": 0.2, "tvm_version": "0.8.dev0"}
{"input": ["cuda -keys=cuda,gpu -max_num_threads=1024 -thread_warp_size=32", "conv2d_nchw.cuda", [["TENSOR", [128, 2688, 11, 11], "float32"], ["TENSOR", [672, 2688, 1, 1], "float32"], 1, "SAME", 1, "float32"], {}], "config": {"index": 1958019, "code_hash": null, "entity": [["tile_f", "sp", [-1, 6, 7, 2]], ["tile_y", "sp", [-1, 11, 1, 1]], ["tile_x", "sp", [-1, 1, 11, 1]], ["tile_rc", "sp", [-1, 14]], ["tile_ry", "sp", [-1, 1]], ["tile_rx", "sp", [-1, 1]], ["auto_unroll_max_step", "ot", 512], ["unroll_explicit", "ot", 1]]}, "result": [[0.051374225], 0, 2.289316415786743, 1639027146.730608], "version": 0.2, "tvm_version": "0.8.dev0"}
{"input": ["cuda -keys=cuda,gpu -max_num_threads=1024 -thread_warp_size=32", "conv2d_nchw.cuda", [["TENSOR", [128, 2688, 11, 11], "float32"], ["TENSOR", [672, 2688, 1, 1], "float32"], 1, "SAME", 1, "float32"], {}], "config": {"index": 2363774, "code_hash": null, "entity": [["tile_f", "sp", [-1, 3, 16, 1]], ["tile_y", "sp", [-1, 1, 11, 1]], ["tile_x", "sp", [-1, 1, 1, 11]], ["tile_rc", "sp", [-1, 6]], ["tile_ry", "sp", [-1, 1]], ["tile_rx", "sp", [-1, 1]], ["auto_unroll_max_step", "ot", 1500], ["unroll_explicit", "ot", 1]]}, "result": [[0.06421582499999999], 0, 2.9698643684387207, 1639027355.484402], "version": 0.2, "tvm_version": "0.8.dev0"}
{"input": ["cuda -keys=cuda,gpu -max_num_threads=1024 -thread_warp_size=32", "conv2d_nchw.cuda", [["TENSOR", [128, 2688, 11, 11], "float32"], ["TENSOR", [672, 2688, 1, 1], "float32"], 1, "SAME", 1, "float32"], {}], "config": {"index": 1378171, "code_hash": null, "entity": [["tile_f", "sp", [-1, 48, 14, 1]], ["tile_y", "sp", [-1, 1, 11, 1]], ["tile_x", "sp", [-1, 1, 1, 1]], ["tile_rc", "sp", [-1, 1]], ["tile_ry", "sp", [-1, 1]], ["tile_rx", "sp", [-1, 1]], ["auto_unroll_max_step", "ot", 0], ["unroll_explicit", "ot", 1]]}, "result": [[1.046965975], 0, 7.795107126235962, 1639027367.104886], "version": 0.2, "tvm_version": "0.8.dev0"}
{"input": ["cuda -keys=cuda,gpu -max_num_threads=1024 -thread_warp_size=32", "conv2d_nchw.cuda", [["TENSOR", [128, 2688, 11, 11], "float32"], ["TENSOR", [672, 2688, 1, 1], "float32"], 1, "SAME", 1, "float32"], {}], "config": {"index": 572238, "code_hash": null, "entity": [["tile_f", "sp", [-1, 7, 1, 8]], ["tile_y", "sp", [-1, 1, 11, 1]], ["tile_x", "sp", [-1, 1, 1, 11]], ["tile_rc", "sp", [-1, 12]], ["tile_ry", "sp", [-1, 1]], ["tile_rx", "sp", [-1, 1]], ["auto_unroll_max_step", "ot", 512], ["unroll_explicit", "ot", 0]]}, "result": [[4.293283349999999], 0, 24.803621768951416, 1639027392.230532], "version": 0.2, "tvm_version": "0.8.dev0"}
{"input": ["cuda -keys=cuda,gpu -max_num_threads=1024 -thread_warp_size=32", "conv2d_nchw.cuda", [["TENSOR", [128, 2688, 11, 11], "float32"], ["TENSOR", [672, 2688, 1, 1], "float32"], 1, "SAME", 1, "float32"], {}], "config": {"index": 65008, "code_hash": null, "entity": [["tile_f", "sp", [-1, 2, 4, 6]], ["tile_y", "sp", [-1, 1, 1, 1]], ["tile_x", "sp", [-1, 1, 11, 1]], ["tile_rc", "sp", [-1, 6]], ["tile_ry", "sp", [-1, 1]], ["tile_rx", "sp", [-1, 1]], ["auto_unroll_max_step", "ot", 0], ["unroll_explicit", "ot", 0]]}, "result": [[0.1678263], 0, 2.9811549186706543, 1639027395.6059103], "version": 0.2, "tvm_version": "0.8.dev0"}
{"input": ["cuda -keys=cuda,gpu -max_num_threads=1024 -thread_warp_size=32", "conv2d_nchw.cuda", [["TENSOR", [128, 2688, 11, 11], "float32"], ["TENSOR", [672, 2688, 1, 1], "float32"], 1, "SAME", 1, "float32"], {}], "config": {"index": 570546, "code_hash": null, "entity": [["tile_f", "sp", [-1, 8, 3, 14]], ["tile_y", "sp", [-1, 1, 1, 1]], ["tile_x", "sp", [-1, 1, 1, 11]], ["tile_rc", "sp", [-1, 12]], ["tile_ry", "sp", [-1, 1]], ["tile_rx", "sp", [-1, 1]], ["auto_unroll_max_step", "ot", 512], ["unroll_explicit", "ot", 0]]}, "result": [[19.9862178], 0, 102.557049036026, 1639027499.1226845], "version": 0.2, "tvm_version": "0.8.dev0"}
{"input": ["cuda -keys=cuda,gpu -max_num_threads=1024 -thread_warp_size=32", "conv2d_nchw.cuda", [["TENSOR", [128, 2688, 11, 11], "float32"], ["TENSOR", [672, 2688, 1, 1], "float32"], 1, "SAME", 1, "float32"], {}], "config": {"index": 189185, "code_hash": null, "entity": [["tile_f", "sp", [-1, 14, 16, 1]], ["tile_y", "sp", [-1, 1, 1, 11]], ["tile_x", "sp", [-1, 1, 1, 1]], ["tile_rc", "sp", [-1, 32]], ["tile_ry", "sp", [-1, 1]], ["tile_rx", "sp", [-1, 1]], ["auto_unroll_max_step", "ot", 0], ["unroll_explicit", "ot", 0]]}, "result": [[1.13009375], 0, 8.804747343063354, 1639027507.1470816], "version": 0.2, "tvm_version": "0.8.dev0"}
{"input": ["cuda -keys=cuda,gpu -max_num_threads=1024 -thread_warp_size=32", "conv2d_nchw.cuda", [["TENSOR", [128, 2688, 11, 11], "float32"], ["TENSOR", [672, 2688, 1, 1], "float32"], 1, "SAME", 1, "float32"], {}], "config": {"index": 1489358, "code_hash": null, "entity": [["tile_f", "sp", [-1, 112, 1, 2]], ["tile_y", "sp", [-1, 1, 11, 1]], ["tile_x", "sp", [-1, 1, 1, 11]], ["tile_rc", "sp", [-1, 12]], ["tile_ry", "sp", [-1, 1]], ["tile_rx", "sp", [-1, 1]], ["auto_unroll_max_step", "ot", 0], ["unroll_explicit", "ot", 1]]}, "result": [[6.311131424999999], 0, 34.97203707695007, 1639027545.1077657], "version": 0.2, "tvm_version": "0.8.dev0"}
{"input": ["cuda -keys=cuda,gpu -max_num_threads=1024 -thread_warp_size=32", "conv2d_nchw.cuda", [["TENSOR", [128, 2688, 11, 11], "float32"], ["TENSOR", [672, 2688, 1, 1], "float32"], 1, "SAME", 1, "float32"], {}], "config": {"index": 1941004, "code_hash": null, "entity": [["tile_f", "sp", [-1, 6, 8, 2]], ["tile_y", "sp", [-1, 1, 11, 1]], ["tile_x", "sp", [-1, 11, 1, 1]], ["tile_rc", "sp", [-1, 12]], ["tile_ry", "sp", [-1, 1]], ["tile_rx", "sp", [-1, 1]], ["auto_unroll_max_step", "ot", 512], ["unroll_explicit", "ot", 1]]}, "result": [[0.044832925], 0, 2.8770015239715576, 1639027549.0623605], "version": 0.2, "tvm_version": "0.8.dev0"}
{"input": ["cuda -keys=cuda,gpu -max_num_threads=1024 -thread_warp_size=32", "conv2d_nchw.cuda", [["TENSOR", [128, 2688, 11, 11], "float32"], ["TENSOR", [672, 2688, 1, 1], "float32"], 1, "SAME", 1, "float32"], {}], "config": {"index": 652960, "code_hash": null, "entity": [["tile_f", "sp", [-1, 4, 1, 14]], ["tile_y", "sp", [-1, 1, 1, 1]], ["tile_x", "sp", [-1, 1, 11, 1]], ["tile_rc", "sp", [-1, 32]], ["tile_ry", "sp", [-1, 1]], ["tile_rx", "sp", [-1, 1]], ["auto_unroll_max_step", "ot", 512], ["unroll_explicit", "ot", 0]]}, "result": [[0.492012525], 0, 5.375241994857788, 1639027562.4470015], "version": 0.2, "tvm_version": "0.8.dev0"}
{"input": ["cuda -keys=cuda,gpu -max_num_threads=1024 -thread_warp_size=32", "conv2d_nchw.cuda", [["TENSOR", [128, 2688, 11, 11], "float32"], ["TENSOR", [672, 2688, 1, 1], "float32"], 1, "SAME", 1, "float32"], {}], "config": {"index": 925218, "code_hash": null, "entity": [["tile_f", "sp", [-1, 4, 3, 7]], ["tile_y", "sp", [-1, 1, 1, 1]], ["tile_x", "sp", [-1, 1, 11, 1]], ["tile_rc", "sp", [-1, 1]], ["tile_ry", "sp", [-1, 1]], ["tile_rx", "sp", [-1, 1]], ["auto_unroll_max_step", "ot", 1500], ["unroll_explicit", "ot", 0]]}, "result": [[0.58947605], 0, 4.940530300140381, 1639027567.0073197], "version": 0.2, "tvm_version": "0.8.dev0"}
{"input": ["cuda -keys=cuda,gpu -max_num_threads=1024 -thread_warp_size=32", "conv2d_nchw.cuda", [["TENSOR", [128, 2688, 11, 11], "float32"], ["TENSOR", [672, 2688, 1, 1], "float32"], 1, "SAME", 1, "float32"], {}], "config": {"index": 1560911, "code_hash": null, "entity": [["tile_f", "sp", [-1, 28, 6, 1]], ["tile_y", "sp", [-1, 1, 11, 1]], ["tile_x", "sp", [-1, 1, 1, 11]], ["tile_rc", "sp", [-1, 28]], ["tile_ry", "sp", [-1, 1]], ["tile_rx", "sp", [-1, 1]], ["auto_unroll_max_step", "ot", 0], ["unroll_explicit", "ot", 1]]}, "result": [[2.4751060750000002], 0, 14.486799716949463, 1639027581.1654496], "version": 0.2, "tvm_version": "0.8.dev0"}
{"input": ["cuda -keys=cuda,gpu -max_num_threads=1024 -thread_warp_size=32", "conv2d_nchw.cuda", [["TENSOR", [128, 2688, 11, 11], "float32"], ["TENSOR", [672, 2688, 1, 1], "float32"], 1, "SAME", 1, "float32"], {}], "config": {"index": 1017789, "code_hash": null, "entity": [["tile_f", "sp", [-1, 2, 4, 42]], ["tile_y", "sp", [-1, 1, 1, 11]], ["tile_x", "sp", [-1, 1, 1, 11]], ["tile_rc", "sp", [-1, 8]], ["tile_ry", "sp", [-1, 1]], ["tile_rx", "sp", [-1, 1]], ["auto_unroll_max_step", "ot", 1500], ["unroll_explicit", "ot", 0]]}, "result": [[13.6060833], 0, 73.31073236465454, 1639027651.4258516], "version": 0.2, "tvm_version": "0.8.dev0"}
{"input": ["cuda -keys=cuda,gpu -max_num_threads=1024 -thread_warp_size=32", "conv2d_nchw.cuda", [["TENSOR", [128, 2688, 11, 11], "float32"], ["TENSOR", [672, 2688, 1, 1], "float32"], 1, "SAME", 1, "float32"], {}], "config": {"index": 1634742, "code_hash": null, "entity": [["tile_f", "sp", [-1, 2, 7, 4]], ["tile_y", "sp", [-1, 1, 1, 1]], ["tile_x", "sp", [-1, 1, 1, 1]], ["tile_rc", "sp", [-1, 84]], ["tile_ry", "sp", [-1, 1]], ["tile_rx", "sp", [-1, 1]], ["auto_unroll_max_step", "ot", 0], ["unroll_explicit", "ot", 1]]}, "result": [[9.3734101], 0, 49.28531289100647, 1639027700.435517], "version": 0.2, "tvm_version": "0.8.dev0"}
{"input": ["cuda -keys=cuda,gpu -max_num_threads=1024 -thread_warp_size=32", "conv2d_nchw.cuda", [["TENSOR", [128, 2688, 11, 11], "float32"], ["TENSOR", [672, 2688, 1, 1], "float32"], 1, "SAME", 1, "float32"], {}], "config": {"index": 2496458, "code_hash": null, "entity": [["tile_f", "sp", [-1, 42, 1, 2]], ["tile_y", "sp", [-1, 1, 11, 1]], ["tile_x", "sp", [-1, 1, 1, 1]], ["tile_rc", "sp", [-1, 42]], ["tile_ry", "sp", [-1, 1]], ["tile_rx", "sp", [-1, 1]], ["auto_unroll_max_step", "ot", 1500], ["unroll_explicit", "ot", 1]]}, "result": [[1.343196825], 0, 11.828232049942017, 1639027710.9353755], "version": 0.2, "tvm_version": "0.8.dev0"}
{"input": ["cuda -keys=cuda,gpu -max_num_threads=1024 -thread_warp_size=32", "conv2d_nchw.cuda", [["TENSOR", [128, 2688, 11, 11], "float32"], ["TENSOR", [672, 2688, 1, 1], "float32"], 1, "SAME", 1, "float32"], {}], "config": {"index": 2343120, "code_hash": null, "entity": [["tile_f", "sp", [-1, 56, 6, 1]], ["tile_y", "sp", [-1, 1, 1, 11]], ["tile_x", "sp", [-1, 11, 1, 1]], ["tile_rc", "sp", [-1, 4]], ["tile_ry", "sp", [-1, 1]], ["tile_rx", "sp", [-1, 1]], ["auto_unroll_max_step", "ot", 1500], ["unroll_explicit", "ot", 1]]}, "result": [[9.028217725000001], 0, 55.28114461898804, 1639027758.5817106], "version": 0.2, "tvm_version": "0.8.dev0"}
{"input": ["cuda -keys=cuda,gpu -max_num_threads=1024 -thread_warp_size=32", "conv2d_nchw.cuda", [["TENSOR", [128, 2688, 11, 11], "float32"], ["TENSOR", [672, 2688, 1, 1], "float32"], 1, "SAME", 1, "float32"], {}], "config": {"index": 1032541, "code_hash": null, "entity": [["tile_f", "sp", [-1, 7, 4, 3]], ["tile_y", "sp", [-1, 1, 1, 1]], ["tile_x", "sp", [-1, 1, 1, 1]], ["tile_rc", "sp", [-1, 14]], ["tile_ry", "sp", [-1, 1]], ["tile_rx", "sp", [-1, 1]], ["auto_unroll_max_step", "ot", 1500], ["unroll_explicit", "ot", 0]]}, "result": [[1.967197275], 0, 12.56711721420288, 1639027770.3455024], "version": 0.2, "tvm_version": "0.8.dev0"}
{"input": ["cuda -keys=cuda,gpu -max_num_threads=1024 -thread_warp_size=32", "conv2d_nchw.cuda", [["TENSOR", [128, 2688, 11, 11], "float32"], ["TENSOR", [672, 2688, 1, 1], "float32"], 1, "SAME", 1, "float32"], {}], "config": {"index": 1048162, "code_hash": null, "entity": [["tile_f", "sp", [-1, 1, 21, 16]], ["tile_y", "sp", [-1, 11, 1, 1]], ["tile_x", "sp", [-1, 1, 1, 1]], ["tile_rc", "sp", [-1, 16]], ["tile_ry", "sp", [-1, 1]], ["tile_rx", "sp", [-1, 1]], ["auto_unroll_max_step", "ot", 1500], ["unroll_explicit", "ot", 0]]}, "result": [[0.639120775], 0, 5.815201044082642, 1639027775.4624727], "version": 0.2, "tvm_version": "0.8.dev0"}
{"input": ["cuda -keys=cuda,gpu -max_num_threads=1024 -thread_warp_size=32", "conv2d_nchw.cuda", [["TENSOR", [128, 2688, 11, 11], "float32"], ["TENSOR", [672, 2688, 1, 1], "float32"], 1, "SAME", 1, "float32"], {}], "config": {"index": 1892265, "code_hash": null, "entity": [["tile_f", "sp", [-1, 1, 24, 28]], ["tile_y", "sp", [-1, 1, 1, 11]], ["tile_x", "sp", [-1, 1, 1, 11]], ["tile_rc", "sp", [-1, 4]], ["tile_ry", "sp", [-1, 1]], ["tile_rx", "sp", [-1, 1]], ["auto_unroll_max_step", "ot", 512], ["unroll_explicit", "ot", 1]]}, "result": [[2.8255019750000003], 0, 17.186107635498047, 1639027791.7137208], "version": 0.2, "tvm_version": "0.8.dev0"}
{"input": ["cuda -keys=cuda,gpu -max_num_threads=1024 -thread_warp_size=32", "conv2d_nchw.cuda", [["TENSOR", [128, 2688, 11, 11], "float32"], ["TENSOR", [672, 2688, 1, 1], "float32"], 1, "SAME", 1, "float32"], {}], "config": {"index": 2335701, "code_hash": null, "entity": [["tile_f", "sp", [-1, 21, 2, 16]], ["tile_y", "sp", [-1, 1, 11, 1]], ["tile_x", "sp", [-1, 1, 1, 11]], ["tile_rc", "sp", [-1, 3]], ["tile_ry", "sp", [-1, 1]], ["tile_rx", "sp", [-1, 1]], ["auto_unroll_max_step", "ot", 1500], ["unroll_explicit", "ot", 1]]}, "result": [[2.430565075], 0, 15.784956693649292, 1639027805.7128706], "version": 0.2, "tvm_version": "0.8.dev0"}
{"input": ["cuda -keys=cuda,gpu -max_num_threads=1024 -thread_warp_size=32", "conv2d_nchw.cuda", [["TENSOR", [128, 2688, 11, 11], "float32"], ["TENSOR", [672, 2688, 1, 1], "float32"], 1, "SAME", 1, "float32"], {}], "config": {"index": 480515, "code_hash": null, "entity": [["tile_f", "sp", [-1, 6, 7, 2]], ["tile_y", "sp", [-1, 1, 1, 1]], ["tile_x", "sp", [-1, 1, 11, 1]], ["tile_rc", "sp", [-1, 2]], ["tile_ry", "sp", [-1, 1]], ["tile_rx", "sp", [-1, 1]], ["auto_unroll_max_step", "ot", 512], ["unroll_explicit", "ot", 0]]}, "result": [[0.16937995], 0, 3.8402559757232666, 1639027974.703875], "version": 0.2, "tvm_version": "0.8.dev0"}
{"input": ["cuda -keys=cuda,gpu -max_num_threads=1024 -thread_warp_size=32", "conv2d_nchw.cuda", [["TENSOR", [128, 2688, 11, 11], "float32"], ["TENSOR", [672, 2688, 1, 1], "float32"], 1, "SAME", 1, "float32"], {}], "config": {"index": 21755, "code_hash": null, "entity": [["tile_f", "sp", [-1, 8, 6, 2]], ["tile_y", "sp", [-1, 1, 1, 1]], ["tile_x", "sp", [-1, 1, 11, 1]], ["tile_rc", "sp", [-1, 2]], ["tile_ry", "sp", [-1, 1]], ["tile_rx", "sp", [-1, 1]], ["auto_unroll_max_step", "ot", 0], ["unroll_explicit", "ot", 0]]}, "result": [[0.231298925], 0, 4.210707426071167, 1639027978.0127556], "version": 0.2, "tvm_version": "0.8.dev0"}
{"input": ["cuda -keys=cuda,gpu -max_num_threads=1024 -thread_warp_size=32", "conv2d_nchw.cuda", [["TENSOR", [128, 2688, 11, 11], "float32"], ["TENSOR", [672, 2688, 1, 1], "float32"], 1, "SAME", 1, "float32"], {}], "config": {"index": 21581, "code_hash": null, "entity": [["tile_f", "sp", [-1, 14, 6, 1]], ["tile_y", "sp", [-1, 1, 1, 1]], ["tile_x", "sp", [-1, 1, 11, 1]], ["tile_rc", "sp", [-1, 2]], ["tile_ry", "sp", [-1, 1]], ["tile_rx", "sp", [-1, 1]], ["auto_unroll_max_step", "ot", 0], ["unroll_explicit", "ot", 0]]}, "result": [[0.1551206], 0, 3.778323173522949, 1639027980.9528673], "version": 0.2, "tvm_version": "0.8.dev0"}
{"input": ["cuda -keys=cuda,gpu -max_num_threads=1024 -thread_warp_size=32", "conv2d_nchw.cuda", [["TENSOR", [128, 2688, 11, 11], "float32"], ["TENSOR", [672, 2688, 1, 1], "float32"], 1, "SAME", 1, "float32"], {}], "config": {"index": 939085, "code_hash": null, "entity": [["tile_f", "sp", [-1, 14, 6, 1]], ["tile_y", "sp", [-1, 1, 1, 1]], ["tile_x", "sp", [-1, 1, 11, 1]], ["tile_rc", "sp", [-1, 2]], ["tile_ry", "sp", [-1, 1]], ["tile_rx", "sp", [-1, 1]], ["auto_unroll_max_step", "ot", 1500], ["unroll_explicit", "ot", 0]]}, "result": [[0.15235205], 0, 3.680025815963745, 1639027983.9201376], "version": 0.2, "tvm_version": "0.8.dev0"}
{"input": ["cuda -keys=cuda,gpu -max_num_threads=1024 -thread_warp_size=32", "conv2d_nchw.cuda", [["TENSOR", [128, 2688, 11, 11], "float32"], ["TENSOR", [672, 2688, 1, 1], "float32"], 1, "SAME", 1, "float32"], {}], "config": {"index": 2315341, "code_hash": null, "entity": [["tile_f", "sp", [-1, 14, 6, 1]], ["tile_y", "sp", [-1, 1, 1, 1]], ["tile_x", "sp", [-1, 1, 11, 1]], ["tile_rc", "sp", [-1, 2]], ["tile_ry", "sp", [-1, 1]], ["tile_rx", "sp", [-1, 1]], ["auto_unroll_max_step", "ot", 1500], ["unroll_explicit", "ot", 1]]}, "result": [[0.15187565], 0, 3.6978983879089355, 1639027986.7566557], "version": 0.2, "tvm_version": "0.8.dev0"}
{"input": ["cuda -keys=cuda,gpu -max_num_threads=1024 -thread_warp_size=32", "conv2d_nchw.cuda", [["TENSOR", [128, 2688, 11, 11], "float32"], ["TENSOR", [672, 2688, 1, 1], "float32"], 1, "SAME", 1, "float32"], {}], "config": {"index": 1856771, "code_hash": null, "entity": [["tile_f", "sp", [-1, 6, 7, 2]], ["tile_y", "sp", [-1, 1, 1, 1]], ["tile_x", "sp", [-1, 1, 11, 1]], ["tile_rc", "sp", [-1, 2]], ["tile_ry", "sp", [-1, 1]], ["tile_rx", "sp", [-1, 1]], ["auto_unroll_max_step", "ot", 512], ["unroll_explicit", "ot", 1]]}, "result": [[0.1549594], 0, 3.650679349899292, 1639027989.5070393], "version": 0.2, "tvm_version": "0.8.dev0"}
{"input": ["cuda -keys=cuda,gpu -max_num_threads=1024 -thread_warp_size=32", "conv2d_nchw.cuda", [["TENSOR", [128, 2688, 11, 11], "float32"], ["TENSOR", [672, 2688, 1, 1], "float32"], 1, "SAME", 1, "float32"], {}], "config": {"index": 21764, "code_hash": null, "entity": [["tile_f", "sp", [-1, 8, 7, 2]], ["tile_y", "sp", [-1, 1, 1, 1]], ["tile_x", "sp", [-1, 1, 11, 1]], ["tile_rc", "sp", [-1, 2]], ["tile_ry", "sp", [-1, 1]], ["tile_rx", "sp", [-1, 1]], ["auto_unroll_max_step", "ot", 0], ["unroll_explicit", "ot", 0]]}, "result": [[0.322649025], 0, 4.6371684074401855, 1639027993.2299457], "version": 0.2, "tvm_version": "0.8.dev0"}
{"input": ["cuda -keys=cuda,gpu -max_num_threads=1024 -thread_warp_size=32", "conv2d_nchw.cuda", [["TENSOR", [128, 2688, 11, 11], "float32"], ["TENSOR", [672, 2688, 1, 1], "float32"], 1, "SAME", 1, "float32"], {}], "config": {"index": 21763, "code_hash": null, "entity": [["tile_f", "sp", [-1, 6, 7, 2]], ["tile_y", "sp", [-1, 1, 1, 1]], ["tile_x", "sp", [-1, 1, 11, 1]], ["tile_rc", "sp", [-1, 2]], ["tile_ry", "sp", [-1, 1]], ["tile_rx", "sp", [-1, 1]], ["auto_unroll_max_step", "ot", 0], ["unroll_explicit", "ot", 0]]}, "result": [[0.16180632499999997], 0, 3.849383592605591, 1639027996.1604912], "version": 0.2, "tvm_version": "0.8.dev0"}
{"input": ["cuda -keys=cuda,gpu -max_num_threads=1024 -thread_warp_size=32", "conv2d_nchw.cuda", [["TENSOR", [128, 2688, 11, 11], "float32"], ["TENSOR", [672, 2688, 1, 1], "float32"], 1, "SAME", 1, "float32"], {}], "config": {"index": 1856589, "code_hash": null, "entity": [["tile_f", "sp", [-1, 14, 6, 1]], ["tile_y", "sp", [-1, 1, 1, 1]], ["tile_x", "sp", [-1, 1, 11, 1]], ["tile_rc", "sp", [-1, 2]], ["tile_ry", "sp", [-1, 1]], ["tile_rx", "sp", [-1, 1]], ["auto_unroll_max_step", "ot", 512], ["unroll_explicit", "ot", 1]]}, "result": [[0.15576827499999998], 0, 4.153737545013428, 1639027999.3278806], "version": 0.2, "tvm_version": "0.8.dev0"}
{"input": ["cuda -keys=cuda,gpu -max_num_threads=1024 -thread_warp_size=32", "conv2d_nchw.cuda", [["TENSOR", [128, 2688, 11, 11], "float32"], ["TENSOR", [672, 2688, 1, 1], "float32"], 1, "SAME", 1, "float32"], {}], "config": {"index": 480516, "code_hash": null, "entity": [["tile_f", "sp", [-1, 8, 7, 2]], ["tile_y", "sp", [-1, 1, 1, 1]], ["tile_x", "sp", [-1, 1, 11, 1]], ["tile_rc", "sp", [-1, 2]], ["tile_ry", "sp", [-1, 1]], ["tile_rx", "sp", [-1, 1]], ["auto_unroll_max_step", "ot", 512], ["unroll_explicit", "ot", 0]]}, "result": [[0.33212445], 0, 4.477992534637451, 1639028003.04656], "version": 0.2, "tvm_version": "0.8.dev0"}
{"input": ["cuda -keys=cuda,gpu -max_num_threads=1024 -thread_warp_size=32", "conv2d_nchw.cuda", [["TENSOR", [128, 2688, 11, 11], "float32"], ["TENSOR", [672, 2688, 1, 1], "float32"], 1, "SAME", 1, "float32"], {}], "config": {"index": 939267, "code_hash": null, "entity": [["tile_f", "sp", [-1, 6, 7, 2]], ["tile_y", "sp", [-1, 1, 1, 1]], ["tile_x", "sp", [-1, 1, 11, 1]], ["tile_rc", "sp", [-1, 2]], ["tile_ry", "sp", [-1, 1]], ["tile_rx", "sp", [-1, 1]], ["auto_unroll_max_step", "ot", 1500], ["unroll_explicit", "ot", 0]]}, "result": [[0.160286825], 0, 3.8826968669891357, 1639028006.1284084], "version": 0.2, "tvm_version": "0.8.dev0"}
{"input": ["cuda -keys=cuda,gpu -max_num_threads=1024 -thread_warp_size=32", "conv2d_nchw.cuda", [["TENSOR", [128, 2688, 11, 11], "float32"], ["TENSOR", [672, 2688, 1, 1], "float32"], 1, "SAME", 1, "float32"], {}], "config": {"index": 480333, "code_hash": null, "entity": [["tile_f", "sp", [-1, 14, 6, 1]], ["tile_y", "sp", [-1, 1, 1, 1]], ["tile_x", "sp", [-1, 1, 11, 1]], ["tile_rc", "sp", [-1, 2]], ["tile_ry", "sp", [-1, 1]], ["tile_rx", "sp", [-1, 1]], ["auto_unroll_max_step", "ot", 512], ["unroll_explicit", "ot", 0]]}, "result": [[0.15312547499999998], 0, 4.019288063049316, 1639028009.2953973], "version": 0.2, "tvm_version": "0.8.dev0"}
{"input": ["cuda -keys=cuda,gpu -max_num_threads=1024 -thread_warp_size=32", "conv2d_nchw.cuda", [["TENSOR", [128, 2688, 11, 11], "float32"], ["TENSOR", [672, 2688, 1, 1], "float32"], 1, "SAME", 1, "float32"], {}], "config": {"index": 1398019, "code_hash": null, "entity": [["tile_f", "sp", [-1, 6, 7, 2]], ["tile_y", "sp", [-1, 1, 1, 1]], ["tile_x", "sp", [-1, 1, 11, 1]], ["tile_rc", "sp", [-1, 2]], ["tile_ry", "sp", [-1, 1]], ["tile_rx", "sp", [-1, 1]], ["auto_unroll_max_step", "ot", 0], ["unroll_explicit", "ot", 1]]}, "result": [[0.163468425], 0, 4.151126861572266, 1639028012.4748209], "version": 0.2, "tvm_version": "0.8.dev0"}
{"input": ["cuda -keys=cuda,gpu -max_num_threads=1024 -thread_warp_size=32", "conv2d_nchw.cuda", [["TENSOR", [128, 2688, 11, 11], "float32"], ["TENSOR", [672, 2688, 1, 1], "float32"], 1, "SAME", 1, "float32"], {}], "config": {"index": 939268, "code_hash": null, "entity": [["tile_f", "sp", [-1, 8, 7, 2]], ["tile_y", "sp", [-1, 1, 1, 1]], ["tile_x", "sp", [-1, 1, 11, 1]], ["tile_rc", "sp", [-1, 2]], ["tile_ry", "sp", [-1, 1]], ["tile_rx", "sp", [-1, 1]], ["auto_unroll_max_step", "ot", 1500], ["unroll_explicit", "ot", 0]]}, "result": [[0.3215489], 0, 4.872179269790649, 1639028016.5021787], "version": 0.2, "tvm_version": "0.8.dev0"}
{"input": ["cuda -keys=cuda,gpu -max_num_threads=1024 -thread_warp_size=32", "conv2d_nchw.cuda", [["TENSOR", [128, 2688, 11, 11], "float32"], ["TENSOR", [672, 2688, 1, 1], "float32"], 1, "SAME", 1, "float32"], {}], "config": {"index": 2315524, "code_hash": null, "entity": [["tile_f", "sp", [-1, 8, 7, 2]], ["tile_y", "sp", [-1, 1, 1, 1]], ["tile_x", "sp", [-1, 1, 11, 1]], ["tile_rc", "sp", [-1, 2]], ["tile_ry", "sp", [-1, 1]], ["tile_rx", "sp", [-1, 1]], ["auto_unroll_max_step", "ot", 1500], ["unroll_explicit", "ot", 1]]}, "result": [[0.32641739999999997], 0, 4.695660591125488, 1639028020.4608822], "version": 0.2, "tvm_version": "0.8.dev0"}
{"input": ["cuda -keys=cuda,gpu -max_num_threads=1024 -thread_warp_size=32", "conv2d_nchw.cuda", [["TENSOR", [128, 2688, 11, 11], "float32"], ["TENSOR", [672, 2688, 1, 1], "float32"], 1, "SAME", 1, "float32"], {}], "config": {"index": 1398020, "code_hash": null, "entity": [["tile_f", "sp", [-1, 8, 7, 2]], ["tile_y", "sp", [-1, 1, 1, 1]], ["tile_x", "sp", [-1, 1, 11, 1]], ["tile_rc", "sp", [-1, 2]], ["tile_ry", "sp", [-1, 1]], ["tile_rx", "sp", [-1, 1]], ["auto_unroll_max_step", "ot", 0], ["unroll_explicit", "ot", 1]]}, "result": [[0.32044144999999996], 0, 4.565081596374512, 1639028024.0088158], "version": 0.2, "tvm_version": "0.8.dev0"}
{"input": ["cuda -keys=cuda,gpu -max_num_threads=1024 -thread_warp_size=32", "conv2d_nchw.cuda", [["TENSOR", [128, 2688, 11, 11], "float32"], ["TENSOR", [672, 2688, 1, 1], "float32"], 1, "SAME", 1, "float32"], {}], "config": {"index": 939259, "code_hash": null, "entity": [["tile_f", "sp", [-1, 8, 6, 2]], ["tile_y", "sp", [-1, 1, 1, 1]], ["tile_x", "sp", [-1, 1, 11, 1]], ["tile_rc", "sp", [-1, 2]], ["tile_ry", "sp", [-1, 1]], ["tile_rx", "sp", [-1, 1]], ["auto_unroll_max_step", "ot", 1500], ["unroll_explicit", "ot", 0]]}, "result": [[0.233813775], 0, 3.605008840560913, 1639028026.6913433], "version": 0.2, "tvm_version": "0.8.dev0"}
{"input": ["cuda -keys=cuda,gpu -max_num_threads=1024 -thread_warp_size=32", "conv2d_nchw.cuda", [["TENSOR", [128, 2688, 11, 11], "float32"], ["TENSOR", [672, 2688, 1, 1], "float32"], 1, "SAME", 1, "float32"], {}], "config": {"index": 1398011, "code_hash": null, "entity": [["tile_f", "sp", [-1, 8, 6, 2]], ["tile_y", "sp", [-1, 1, 1, 1]], ["tile_x", "sp", [-1, 1, 11, 1]], ["tile_rc", "sp", [-1, 2]], ["tile_ry", "sp", [-1, 1]], ["tile_rx", "sp", [-1, 1]], ["auto_unroll_max_step", "ot", 0], ["unroll_explicit", "ot", 1]]}, "result": [[0.226453575], 0, 3.563298225402832, 1639028029.4218988], "version": 0.2, "tvm_version": "0.8.dev0"}
{"input": ["cuda -keys=cuda,gpu -max_num_threads=1024 -thread_warp_size=32", "conv2d_nchw.cuda", [["TENSOR", [128, 2688, 11, 11], "float32"], ["TENSOR", [672, 2688, 1, 1], "float32"], 1, "SAME", 1, "float32"], {}], "config": {"index": 1856772, "code_hash": null, "entity": [["tile_f", "sp", [-1, 8, 7, 2]], ["tile_y", "sp", [-1, 1, 1, 1]], ["tile_x", "sp", [-1, 1, 11, 1]], ["tile_rc", "sp", [-1, 2]], ["tile_ry", "sp", [-1, 1]], ["tile_rx", "sp", [-1, 1]], ["auto_unroll_max_step", "ot", 512], ["unroll_explicit", "ot", 1]]}, "result": [[0.331871725], 0, 4.133130788803101, 1639028032.6405497], "version": 0.2, "tvm_version": "0.8.dev0"}
{"input": ["cuda -keys=cuda,gpu -max_num_threads=1024 -thread_warp_size=32", "conv2d_nchw.cuda", [["TENSOR", [128, 2688, 11, 11], "float32"], ["TENSOR", [672, 2688, 1, 1], "float32"], 1, "SAME", 1, "float32"], {}], "config": {"index": 2315515, "code_hash": null, "entity": [["tile_f", "sp", [-1, 8, 6, 2]], ["tile_y", "sp", [-1, 1, 1, 1]], ["tile_x", "sp", [-1, 1, 11, 1]], ["tile_rc", "sp", [-1, 2]], ["tile_ry", "sp", [-1, 1]], ["tile_rx", "sp", [-1, 1]], ["auto_unroll_max_step", "ot", 1500], ["unroll_explicit", "ot", 1]]}, "result": [[0.236590925], 0, 3.6114609241485596, 1639028035.4045234], "version": 0.2, "tvm_version": "0.8.dev0"}
{"input": ["cuda -keys=cuda,gpu -max_num_threads=1024 -thread_warp_size=32", "conv2d_nchw.cuda", [["TENSOR", [128, 2688, 11, 11], "float32"], ["TENSOR", [672, 2688, 1, 1], "float32"], 1, "SAME", 1, "float32"], {}], "config": {"index": 1397837, "code_hash": null, "entity": [["tile_f", "sp", [-1, 14, 6, 1]], ["tile_y", "sp", [-1, 1, 1, 1]], ["tile_x", "sp", [-1, 1, 11, 1]], ["tile_rc", "sp", [-1, 2]], ["tile_ry", "sp", [-1, 1]], ["tile_rx", "sp", [-1, 1]], ["auto_unroll_max_step", "ot", 0], ["unroll_explicit", "ot", 1]]}, "result": [[0.152293725], 0, 3.1837246417999268, 1639028037.6674347], "version": 0.2, "tvm_version": "0.8.dev0"}
{"input": ["cuda -keys=cuda,gpu -max_num_threads=1024 -thread_warp_size=32", "conv2d_nchw.cuda", [["TENSOR", [128, 2688, 11, 11], "float32"], ["TENSOR", [672, 2688, 1, 1], "float32"], 1, "SAME", 1, "float32"], {}], "config": {"index": 2315523, "code_hash": null, "entity": [["tile_f", "sp", [-1, 6, 7, 2]], ["tile_y", "sp", [-1, 1, 1, 1]], ["tile_x", "sp", [-1, 1, 11, 1]], ["tile_rc", "sp", [-1, 2]], ["tile_ry", "sp", [-1, 1]], ["tile_rx", "sp", [-1, 1]], ["auto_unroll_max_step", "ot", 1500], ["unroll_explicit", "ot", 1]]}, "result": [[0.153696], 0, 3.083996295928955, 1639028039.9857264], "version": 0.2, "tvm_version": "0.8.dev0"}
{"input": ["cuda -keys=cuda,gpu -max_num_threads=1024 -thread_warp_size=32", "conv2d_nchw.cuda", [["TENSOR", [128, 2688, 11, 11], "float32"], ["TENSOR", [672, 2688, 1, 1], "float32"], 1, "SAME", 1, "float32"], {}], "config": {"index": 475130, "code_hash": null, "entity": [["tile_f", "sp", [-1, 7, 6, 2]], ["tile_y", "sp", [-1, 1, 11, 1]], ["tile_x", "sp", [-1, 1, 1, 1]], ["tile_rc", "sp", [-1, 2]], ["tile_ry", "sp", [-1, 1]], ["tile_rx", "sp", [-1, 1]], ["auto_unroll_max_step", "ot", 512], ["unroll_explicit", "ot", 0]]}, "result": [[0.229859375], 0, 3.772049903869629, 1639028042.8838613], "version": 0.2, "tvm_version": "0.8.dev0"}
{"input": ["cuda -keys=cuda,gpu -max_num_threads=1024 -thread_warp_size=32", "conv2d_nchw.cuda", [["TENSOR", [128, 2688, 11, 11], "float32"], ["TENSOR", [672, 2688, 1, 1], "float32"], 1, "SAME", 1, "float32"], {}], "config": {"index": 16378, "code_hash": null, "entity": [["tile_f", "sp", [-1, 7, 6, 2]], ["tile_y", "sp", [-1, 1, 11, 1]], ["tile_x", "sp", [-1, 1, 1, 1]], ["tile_rc", "sp", [-1, 2]], ["tile_ry", "sp", [-1, 1]], ["tile_rx", "sp", [-1, 1]], ["auto_unroll_max_step", "ot", 0], ["unroll_explicit", "ot", 0]]}, "result": [[0.22579115], 0, 3.5491669178009033, 1639028045.5175235], "version": 0.2, "tvm_version": "0.8.dev0"}
{"input": ["cuda -keys=cuda,gpu -max_num_threads=1024 -thread_warp_size=32", "conv2d_nchw.cuda", [["TENSOR", [128, 2688, 11, 11], "float32"], ["TENSOR", [672, 2688, 1, 1], "float32"], 1, "SAME", 1, "float32"], {}], "config": {"index": 1392635, "code_hash": null, "entity": [["tile_f", "sp", [-1, 8, 6, 2]], ["tile_y", "sp", [-1, 1, 11, 1]], ["tile_x", "sp", [-1, 1, 1, 1]], ["tile_rc", "sp", [-1, 2]], ["tile_ry", "sp", [-1, 1]], ["tile_rx", "sp", [-1, 1]], ["auto_unroll_max_step", "ot", 0], ["unroll_explicit", "ot", 1]]}, "result": [[0.30714825], 0, 3.5372002124786377, 1639028050.1376603], "version": 0.2, "tvm_version": "0.8.dev0"}
{"input": ["cuda -keys=cuda,gpu -max_num_threads=1024 -thread_warp_size=32", "conv2d_nchw.cuda", [["TENSOR", [128, 2688, 11, 11], "float32"], ["TENSOR", [672, 2688, 1, 1], "float32"], 1, "SAME", 1, "float32"], {}], "config": {"index": 16379, "code_hash": null, "entity": [["tile_f", "sp", [-1, 8, 6, 2]], ["tile_y", "sp", [-1, 1, 11, 1]], ["tile_x", "sp", [-1, 1, 1, 1]], ["tile_rc", "sp", [-1, 2]], ["tile_ry", "sp", [-1, 1]], ["tile_rx", "sp", [-1, 1]], ["auto_unroll_max_step", "ot", 0], ["unroll_explicit", "ot", 0]]}, "result": [[0.300581775], 0, 3.5792953968048096, 1639028053.1564574], "version": 0.2, "tvm_version": "0.8.dev0"}
{"input": ["cuda -keys=cuda,gpu -max_num_threads=1024 -thread_warp_size=32", "conv2d_nchw.cuda", [["TENSOR", [128, 2688, 11, 11], "float32"], ["TENSOR", [672, 2688, 1, 1], "float32"], 1, "SAME", 1, "float32"], {}], "config": {"index": 933882, "code_hash": null, "entity": [["tile_f", "sp", [-1, 7, 6, 2]], ["tile_y", "sp", [-1, 1, 11, 1]], ["tile_x", "sp", [-1, 1, 1, 1]], ["tile_rc", "sp", [-1, 2]], ["tile_ry", "sp", [-1, 1]], ["tile_rx", "sp", [-1, 1]], ["auto_unroll_max_step", "ot", 1500], ["unroll_explicit", "ot", 0]]}, "result": [[0.22622065], 0, 2.9913582801818848, 1639028055.7848885], "version": 0.2, "tvm_version": "0.8.dev0"}
{"input": ["cuda -keys=cuda,gpu -max_num_threads=1024 -thread_warp_size=32", "conv2d_nchw.cuda", [["TENSOR", [128, 2688, 11, 11], "float32"], ["TENSOR", [672, 2688, 1, 1], "float32"], 1, "SAME", 1, "float32"], {}], "config": {"index": 16387, "code_hash": null, "entity": [["tile_f", "sp", [-1, 6, 7, 2]], ["tile_y", "sp", [-1, 1, 11, 1]], ["tile_x", "sp", [-1, 1, 1, 1]], ["tile_rc", "sp", [-1, 2]], ["tile_ry", "sp", [-1, 1]], ["tile_rx", "sp", [-1, 1]], ["auto_unroll_max_step", "ot", 0], ["unroll_explicit", "ot", 0]]}, "result": [[0.23466177500000002], 0, 3.106363296508789, 1639028058.4981368], "version": 0.2, "tvm_version": "0.8.dev0"}
{"input": ["cuda -keys=cuda,gpu -max_num_threads=1024 -thread_warp_size=32", "conv2d_nchw.cuda", [["TENSOR", [128, 2688, 11, 11], "float32"], ["TENSOR", [672, 2688, 1, 1], "float32"], 1, "SAME", 1, "float32"], {}], "config": {"index": 1851386, "code_hash": null, "entity": [["tile_f", "sp", [-1, 7, 6, 2]], ["tile_y", "sp", [-1, 1, 11, 1]], ["tile_x", "sp", [-1, 1, 1, 1]], ["tile_rc", "sp", [-1, 2]], ["tile_ry", "sp", [-1, 1]], ["tile_rx", "sp", [-1, 1]], ["auto_unroll_max_step", "ot", 512], ["unroll_explicit", "ot", 1]]}, "result": [[0.2334464], 0, 3.1594507694244385, 1639028061.246788], "version": 0.2, "tvm_version": "0.8.dev0"}
{"input": ["cuda -keys=cuda,gpu -max_num_threads=1024 -thread_warp_size=32", "conv2d_nchw.cuda", [["TENSOR", [128, 2688, 11, 11], "float32"], ["TENSOR", [672, 2688, 1, 1], "float32"], 1, "SAME", 1, "float32"], {}], "config": {"index": 933883, "code_hash": null, "entity": [["tile_f", "sp", [-1, 8, 6, 2]], ["tile_y", "sp", [-1, 1, 11, 1]], ["tile_x", "sp", [-1, 1, 1, 1]], ["tile_rc", "sp", [-1, 2]], ["tile_ry", "sp", [-1, 1]], ["tile_rx", "sp", [-1, 1]], ["auto_unroll_max_step", "ot", 1500], ["unroll_explicit", "ot", 0]]}, "result": [[0.30259175], 0, 3.534162998199463, 1639028064.252681], "version": 0.2, "tvm_version": "0.8.dev0"}
{"input": ["cuda -keys=cuda,gpu -max_num_threads=1024 -thread_warp_size=32", "conv2d_nchw.cuda", [["TENSOR", [128, 2688, 11, 11], "float32"], ["TENSOR", [672, 2688, 1, 1], "float32"], 1, "SAME", 1, "float32"], {}], "config": {"index": 1851387, "code_hash": null, "entity": [["tile_f", "sp", [-1, 8, 6, 2]], ["tile_y", "sp", [-1, 1, 11, 1]], ["tile_x", "sp", [-1, 1, 1, 1]], ["tile_rc", "sp", [-1, 2]], ["tile_ry", "sp", [-1, 1]], ["tile_rx", "sp", [-1, 1]], ["auto_unroll_max_step", "ot", 512], ["unroll_explicit", "ot", 1]]}, "result": [[0.323744125], 0, 3.6119866371154785, 1639028067.3588336], "version": 0.2, "tvm_version": "0.8.dev0"}
{"input": ["cuda -keys=cuda,gpu -max_num_threads=1024 -thread_warp_size=32", "conv2d_nchw.cuda", [["TENSOR", [128, 2688, 11, 11], "float32"], ["TENSOR", [672, 2688, 1, 1], "float32"], 1, "SAME", 1, "float32"], {}], "config": {"index": 1392643, "code_hash": null, "entity": [["tile_f", "sp", [-1, 6, 7, 2]], ["tile_y", "sp", [-1, 1, 11, 1]], ["tile_x", "sp", [-1, 1, 1, 1]], ["tile_rc", "sp", [-1, 2]], ["tile_ry", "sp", [-1, 1]], ["tile_rx", "sp", [-1, 1]], ["auto_unroll_max_step", "ot", 0], ["unroll_explicit", "ot", 1]]}, "result": [[0.2347293], 0, 3.148611068725586, 1639028070.022204], "version": 0.2, "tvm_version": "0.8.dev0"}
{"input": ["cuda -keys=cuda,gpu -max_num_threads=1024 -thread_warp_size=32", "conv2d_nchw.cuda", [["TENSOR", [128, 2688, 11, 11], "float32"], ["TENSOR", [672, 2688, 1, 1], "float32"], 1, "SAME", 1, "float32"], {}], "config": {"index": 2310138, "code_hash": null, "entity": [["tile_f", "sp", [-1, 7, 6, 2]], ["tile_y", "sp", [-1, 1, 11, 1]], ["tile_x", "sp", [-1, 1, 1, 1]], ["tile_rc", "sp", [-1, 2]], ["tile_ry", "sp", [-1, 1]], ["tile_rx", "sp", [-1, 1]], ["auto_unroll_max_step", "ot", 1500], ["unroll_explicit", "ot", 1]]}, "result": [[0.228688075], 0, 3.28432559967041, 1639028072.819792], "version": 0.2, "tvm_version": "0.8.dev0"}
{"input": ["cuda -keys=cuda,gpu -max_num_threads=1024 -thread_warp_size=32", "conv2d_nchw.cuda", [["TENSOR", [128, 2688, 11, 11], "float32"], ["TENSOR", [672, 2688, 1, 1], "float32"], 1, "SAME", 1, "float32"], {}], "config": {"index": 933891, "code_hash": null, "entity": [["tile_f", "sp", [-1, 6, 7, 2]], ["tile_y", "sp", [-1, 1, 11, 1]], ["tile_x", "sp", [-1, 1, 1, 1]], ["tile_rc", "sp", [-1, 2]], ["tile_ry", "sp", [-1, 1]], ["tile_rx", "sp", [-1, 1]], ["auto_unroll_max_step", "ot", 1500], ["unroll_explicit", "ot", 0]]}, "result": [[0.2380102], 0, 3.2310988903045654, 1639028075.5646706], "version": 0.2, "tvm_version": "0.8.dev0"}
{"input": ["cuda -keys=cuda,gpu -max_num_threads=1024 -thread_warp_size=32", "conv2d_nchw.cuda", [["TENSOR", [128, 2688, 11, 11], "float32"], ["TENSOR", [672, 2688, 1, 1], "float32"], 1, "SAME", 1, "float32"], {}], "config": {"index": 1851395, "code_hash": null, "entity": [["tile_f", "sp", [-1, 6, 7, 2]], ["tile_y", "sp", [-1, 1, 11, 1]], ["tile_x", "sp", [-1, 1, 1, 1]], ["tile_rc", "sp", [-1, 2]], ["tile_ry", "sp", [-1, 1]], ["tile_rx", "sp", [-1, 1]], ["auto_unroll_max_step", "ot", 512], ["unroll_explicit", "ot", 1]]}, "result": [[0.23376785], 0, 3.3453946113586426, 1639028078.3825324], "version": 0.2, "tvm_version": "0.8.dev0"}
{"input": ["cuda -keys=cuda,gpu -max_num_threads=1024 -thread_warp_size=32", "conv2d_nchw.cuda", [["TENSOR", [128, 2688, 11, 11], "float32"], ["TENSOR", [672, 2688, 1, 1], "float32"], 1, "SAME", 1, "float32"], {}], "config": {"index": 2310139, "code_hash": null, "entity": [["tile_f", "sp", [-1, 8, 6, 2]], ["tile_y", "sp", [-1, 1, 11, 1]], ["tile_x", "sp", [-1, 1, 1, 1]], ["tile_rc", "sp", [-1, 2]], ["tile_ry", "sp", [-1, 1]], ["tile_rx", "sp", [-1, 1]], ["auto_unroll_max_step", "ot", 1500], ["unroll_explicit", "ot", 1]]}, "result": [[0.32617084999999996], 0, 3.6249611377716064, 1639028081.5656972], "version": 0.2, "tvm_version": "0.8.dev0"}
{"input": ["cuda -keys=cuda,gpu -max_num_threads=1024 -thread_warp_size=32", "conv2d_nchw.cuda", [["TENSOR", [128, 2688, 11, 11], "float32"], ["TENSOR", [672, 2688, 1, 1], "float32"], 1, "SAME", 1, "float32"], {}], "config": {"index": 475139, "code_hash": null, "entity": [["tile_f", "sp", [-1, 6, 7, 2]], ["tile_y", "sp", [-1, 1, 11, 1]], ["tile_x", "sp", [-1, 1, 1, 1]], ["tile_rc", "sp", [-1, 2]], ["tile_ry", "sp", [-1, 1]], ["tile_rx", "sp", [-1, 1]], ["auto_unroll_max_step", "ot", 512], ["unroll_explicit", "ot", 0]]}, "result": [[0.23197675], 0, 3.2936654090881348, 1639028084.4307382], "version": 0.2, "tvm_version": "0.8.dev0"}
{"input": ["cuda -keys=cuda,gpu -max_num_threads=1024 -thread_warp_size=32", "conv2d_nchw.cuda", [["TENSOR", [128, 2688, 11, 11], "float32"], ["TENSOR", [672, 2688, 1, 1], "float32"], 1, "SAME", 1, "float32"], {}], "config": {"index": 2310147, "code_hash": null, "entity": [["tile_f", "sp", [-1, 6, 7, 2]], ["tile_y", "sp", [-1, 1, 11, 1]], ["tile_x", "sp", [-1, 1, 1, 1]], ["tile_rc", "sp", [-1, 2]], ["tile_ry", "sp", [-1, 1]], ["tile_rx", "sp", [-1, 1]], ["auto_unroll_max_step", "ot", 1500], ["unroll_explicit", "ot", 1]]}, "result": [[0.227400625], 0, 3.285041332244873, 1639028087.2920718], "version": 0.2, "tvm_version": "0.8.dev0"}
{"input": ["cuda -keys=cuda,gpu -max_num_threads=1024 -thread_warp_size=32", "conv2d_nchw.cuda", [["TENSOR", [128, 2688, 11, 11], "float32"], ["TENSOR", [672, 2688, 1, 1], "float32"], 1, "SAME", 1, "float32"], {}], "config": {"index": 475131, "code_hash": null, "entity": [["tile_f", "sp", [-1, 8, 6, 2]], ["tile_y", "sp", [-1, 1, 11, 1]], ["tile_x", "sp", [-1, 1, 1, 1]], ["tile_rc", "sp", [-1, 2]], ["tile_ry", "sp", [-1, 1]], ["tile_rx", "sp", [-1, 1]], ["auto_unroll_max_step", "ot", 512], ["unroll_explicit", "ot", 0]]}, "result": [[0.30445819999999996], 0, 3.582563638687134, 1639028090.4053104], "version": 0.2, "tvm_version": "0.8.dev0"}
{"input": ["cuda -keys=cuda,gpu -max_num_threads=1024 -thread_warp_size=32", "conv2d_nchw.cuda", [["TENSOR", [128, 2688, 11, 11], "float32"], ["TENSOR", [672, 2688, 1, 1], "float32"], 1, "SAME", 1, "float32"], {}], "config": {"index": 1392634, "code_hash": null, "entity": [["tile_f", "sp", [-1, 7, 6, 2]], ["tile_y", "sp", [-1, 1, 11, 1]], ["tile_x", "sp", [-1, 1, 1, 1]], ["tile_rc", "sp", [-1, 2]], ["tile_ry", "sp", [-1, 1]], ["tile_rx", "sp", [-1, 1]], ["auto_unroll_max_step", "ot", 0], ["unroll_explicit", "ot", 1]]}, "result": [[0.22738707500000002], 0, 3.3341495990753174, 1639028093.2421541], "version": 0.2, "tvm_version": "0.8.dev0"}
{"input": ["cuda -keys=cuda,gpu -max_num_threads=1024 -thread_warp_size=32", "conv2d_nchw.cuda", [["TENSOR", [128, 2688, 11, 11], "float32"], ["TENSOR", [672, 2688, 1, 1], "float32"], 1, "SAME", 1, "float32"], {}], "config": {"index": 465983, "code_hash": null, "entity": [["tile_f", "sp", [-1, 12, 4, 1]], ["tile_y", "sp", [-1, 1, 1, 1]], ["tile_x", "sp", [-1, 1, 11, 1]], ["tile_rc", "sp", [-1, 1]], ["tile_ry", "sp", [-1, 1]], ["tile_rx", "sp", [-1, 1]], ["auto_unroll_max_step", "ot", 512], ["unroll_explicit", "ot", 0]]}, "result": [[0.20321755], 0, 3.049384355545044, 1639028095.8566043], "version": 0.2, "tvm_version": "0.8.dev0"}
{"input": ["cuda -keys=cuda,gpu -max_num_threads=1024 -thread_warp_size=32", "conv2d_nchw.cuda", [["TENSOR", [128, 2688, 11, 11], "float32"], ["TENSOR", [672, 2688, 1, 1], "float32"], 1, "SAME", 1, "float32"], {}], "config": {"index": 7231, "code_hash": null, "entity": [["tile_f", "sp", [-1, 12, 4, 1]], ["tile_y", "sp", [-1, 1, 1, 1]], ["tile_x", "sp", [-1, 1, 11, 1]], ["tile_rc", "sp", [-1, 1]], ["tile_ry", "sp", [-1, 1]], ["tile_rx", "sp", [-1, 1]], ["auto_unroll_max_step", "ot", 0], ["unroll_explicit", "ot", 0]]}, "result": [[0.201373775], 0, 2.911038637161255, 1639028098.3730087], "version": 0.2, "tvm_version": "0.8.dev0"}
{"input": ["cuda -keys=cuda,gpu -max_num_threads=1024 -thread_warp_size=32", "conv2d_nchw.cuda", [["TENSOR", [128, 2688, 11, 11], "float32"], ["TENSOR", [672, 2688, 1, 1], "float32"], 1, "SAME", 1, "float32"], {}], "config": {"index": 2300991, "code_hash": null, "entity": [["tile_f", "sp", [-1, 12, 4, 1]], ["tile_y", "sp", [-1, 1, 1, 1]], ["tile_x", "sp", [-1, 1, 11, 1]], ["tile_rc", "sp", [-1, 1]], ["tile_ry", "sp", [-1, 1]], ["tile_rx", "sp", [-1, 1]], ["auto_unroll_max_step", "ot", 1500], ["unroll_explicit", "ot", 1]]}, "result": [[0.19725835], 0, 3.0313198566436768, 1639028100.9582255], "version": 0.2, "tvm_version": "0.8.dev0"}
{"input": ["cuda -keys=cuda,gpu -max_num_threads=1024 -thread_warp_size=32", "conv2d_nchw.cuda", [["TENSOR", [128, 2688, 11, 11], "float32"], ["TENSOR", [672, 2688, 1, 1], "float32"], 1, "SAME", 1, "float32"], {}], "config": {"index": 924735, "code_hash": null, "entity": [["tile_f", "sp", [-1, 12, 4, 1]], ["tile_y", "sp", [-1, 1, 1, 1]], ["tile_x", "sp", [-1, 1, 11, 1]], ["tile_rc", "sp", [-1, 1]], ["tile_ry", "sp", [-1, 1]], ["tile_rx", "sp", [-1, 1]], ["auto_unroll_max_step", "ot", 1500], ["unroll_explicit", "ot", 0]]}, "result": [[0.196025325], 0, 3.483560562133789, 1639028104.1290805], "version": 0.2, "tvm_version": "0.8.dev0"}
{"input": ["cuda -keys=cuda,gpu -max_num_threads=1024 -thread_warp_size=32", "conv2d_nchw.cuda", [["TENSOR", [128, 2688, 11, 11], "float32"], ["TENSOR", [672, 2688, 1, 1], "float32"], 1, "SAME", 1, "float32"], {}], "config": {"index": 1842239, "code_hash": null, "entity": [["tile_f", "sp", [-1, 12, 4, 1]], ["tile_y", "sp", [-1, 1, 1, 1]], ["tile_x", "sp", [-1, 1, 11, 1]], ["tile_rc", "sp", [-1, 1]], ["tile_ry", "sp", [-1, 1]], ["tile_rx", "sp", [-1, 1]], ["auto_unroll_max_step", "ot", 512], ["unroll_explicit", "ot", 1]]}, "result": [[0.1974312], 0, 3.0041122436523438, 1639028106.7108195], "version": 0.2, "tvm_version": "0.8.dev0"}
{"input": ["cuda -keys=cuda,gpu -max_num_threads=1024 -thread_warp_size=32", "conv2d_nchw.cuda", [["TENSOR", [128, 2688, 11, 11], "float32"], ["TENSOR", [672, 2688, 1, 1], "float32"], 1, "SAME", 1, "float32"], {}], "config": {"index": 1383487, "code_hash": null, "entity": [["tile_f", "sp", [-1, 12, 4, 1]], ["tile_y", "sp", [-1, 1, 1, 1]], ["tile_x", "sp", [-1, 1, 11, 1]], ["tile_rc", "sp", [-1, 1]], ["tile_ry", "sp", [-1, 1]], ["tile_rx", "sp", [-1, 1]], ["auto_unroll_max_step", "ot", 0], ["unroll_explicit", "ot", 1]]}, "result": [[0.1981066], 0, 2.920017719268799, 1639028109.246817], "version": 0.2, "tvm_version": "0.8.dev0"}
{"input": ["cuda -keys=cuda,gpu -max_num_threads=1024 -thread_warp_size=32", "conv2d_nchw.cuda", [["TENSOR", [128, 2688, 11, 11], "float32"], ["TENSOR", [672, 2688, 1, 1], "float32"], 1, "SAME", 1, "float32"], {}], "config": {"index": 1923165, "code_hash": null, "entity": [["tile_f", "sp", [-1, 7, 4, 3]], ["tile_y", "sp", [-1, 1, 11, 1]], ["tile_x", "sp", [-1, 1, 1, 1]], ["tile_rc", "sp", [-1, 8]], ["tile_ry", "sp", [-1, 1]], ["tile_rx", "sp", [-1, 1]], ["auto_unroll_max_step", "ot", 512], ["unroll_explicit", "ot", 1]]}, "result": [[0.141669225], 0, 2.8650150299072266, 1639028111.582416], "version": 0.2, "tvm_version": "0.8.dev0"}
{"input": ["cuda -keys=cuda,gpu -max_num_threads=1024 -thread_warp_size=32", "conv2d_nchw.cuda", [["TENSOR", [128, 2688, 11, 11], "float32"], ["TENSOR", [672, 2688, 1, 1], "float32"], 1, "SAME", 1, "float32"], {}], "config": {"index": 546909, "code_hash": null, "entity": [["tile_f", "sp", [-1, 7, 4, 3]], ["tile_y", "sp", [-1, 1, 11, 1]], ["tile_x", "sp", [-1, 1, 1, 1]], ["tile_rc", "sp", [-1, 8]], ["tile_ry", "sp", [-1, 1]], ["tile_rx", "sp", [-1, 1]], ["auto_unroll_max_step", "ot", 512], ["unroll_explicit", "ot", 0]]}, "result": [[0.16419565], 0, 2.9650933742523193, 1639028114.0799701], "version": 0.2, "tvm_version": "0.8.dev0"}
{"input": ["cuda -keys=cuda,gpu -max_num_threads=1024 -thread_warp_size=32", "conv2d_nchw.cuda", [["TENSOR", [128, 2688, 11, 11], "float32"], ["TENSOR", [672, 2688, 1, 1], "float32"], 1, "SAME", 1, "float32"], {}], "config": {"index": 1005661, "code_hash": null, "entity": [["tile_f", "sp", [-1, 7, 4, 3]], ["tile_y", "sp", [-1, 1, 11, 1]], ["tile_x", "sp", [-1, 1, 1, 1]], ["tile_rc", "sp", [-1, 8]], ["tile_ry", "sp", [-1, 1]], ["tile_rx", "sp", [-1, 1]], ["auto_unroll_max_step", "ot", 1500], ["unroll_explicit", "ot", 0]]}, "result": [[0.179948825], 0, 3.272937536239624, 1639028121.5643477], "version": 0.2, "tvm_version": "0.8.dev0"}
{"input": ["cuda -keys=cuda,gpu -max_num_threads=1024 -thread_warp_size=32", "conv2d_nchw.cuda", [["TENSOR", [128, 2688, 11, 11], "float32"], ["TENSOR", [672, 2688, 1, 1], "float32"], 1, "SAME", 1, "float32"], {}], "config": {"index": 2381917, "code_hash": null, "entity": [["tile_f", "sp", [-1, 7, 4, 3]], ["tile_y", "sp", [-1, 1, 11, 1]], ["tile_x", "sp", [-1, 1, 1, 1]], ["tile_rc", "sp", [-1, 8]], ["tile_ry", "sp", [-1, 1]], ["tile_rx", "sp", [-1, 1]], ["auto_unroll_max_step", "ot", 1500], ["unroll_explicit", "ot", 1]]}, "result": [[0.1387653], 0, 3.174266815185547, 1639028124.0667825], "version": 0.2, "tvm_version": "0.8.dev0"}
{"input": ["cuda -keys=cuda,gpu -max_num_threads=1024 -thread_warp_size=32", "conv2d_nchw.cuda", [["TENSOR", [128, 2688, 11, 11], "float32"], ["TENSOR", [672, 2688, 1, 1], "float32"], 1, "SAME", 1, "float32"], {}], "config": {"index": 88157, "code_hash": null, "entity": [["tile_f", "sp", [-1, 7, 4, 3]], ["tile_y", "sp", [-1, 1, 11, 1]], ["tile_x", "sp", [-1, 1, 1, 1]], ["tile_rc", "sp", [-1, 8]], ["tile_ry", "sp", [-1, 1]], ["tile_rx", "sp", [-1, 1]], ["auto_unroll_max_step", "ot", 0], ["unroll_explicit", "ot", 0]]}, "result": [[0.302065875], 0, 3.864985466003418, 1639028127.3561828], "version": 0.2, "tvm_version": "0.8.dev0"}
{"input": ["cuda -keys=cuda,gpu -max_num_threads=1024 -thread_warp_size=32", "conv2d_nchw.cuda", [["TENSOR", [128, 2688, 11, 11], "float32"], ["TENSOR", [672, 2688, 1, 1], "float32"], 1, "SAME", 1, "float32"], {}], "config": {"index": 1464413, "code_hash": null, "entity": [["tile_f", "sp", [-1, 7, 4, 3]], ["tile_y", "sp", [-1, 1, 11, 1]], ["tile_x", "sp", [-1, 1, 1, 1]], ["tile_rc", "sp", [-1, 8]], ["tile_ry", "sp", [-1, 1]], ["tile_rx", "sp", [-1, 1]], ["auto_unroll_max_step", "ot", 0], ["unroll_explicit", "ot", 1]]}, "result": [[0.302267275], 0, 3.9266271591186523, 1639028130.746067], "version": 0.2, "tvm_version": "0.8.dev0"}
{"input": ["cuda -keys=cuda,gpu -max_num_threads=1024 -thread_warp_size=32", "conv2d_nchw.cuda", [["TENSOR", [128, 2688, 11, 11], "float32"], ["TENSOR", [672, 2688, 1, 1], "float32"], 1, "SAME", 1, "float32"], {}], "config": {"index": 589917, "code_hash": null, "entity": [["tile_f", "sp", [-1, 7, 4, 3]], ["tile_y", "sp", [-1, 1, 11, 1]], ["tile_x", "sp", [-1, 1, 1, 1]], ["tile_rc", "sp", [-1, 16]], ["tile_ry", "sp", [-1, 1]], ["tile_rx", "sp", [-1, 1]], ["auto_unroll_max_step", "ot", 512], ["unroll_explicit", "ot", 0]]}, "result": [[0.150907775], 0, 3.5317232608795166, 1639028133.4266906], "version": 0.2, "tvm_version": "0.8.dev0"}
{"input": ["cuda -keys=cuda,gpu -max_num_threads=1024 -thread_warp_size=32", "conv2d_nchw.cuda", [["TENSOR", [128, 2688, 11, 11], "float32"], ["TENSOR", [672, 2688, 1, 1], "float32"], 1, "SAME", 1, "float32"], {}], "config": {"index": 131165, "code_hash": null, "entity": [["tile_f", "sp", [-1, 7, 4, 3]], ["tile_y", "sp", [-1, 1, 11, 1]], ["tile_x", "sp", [-1, 1, 1, 1]], ["tile_rc", "sp", [-1, 16]], ["tile_ry", "sp", [-1, 1]], ["tile_rx", "sp", [-1, 1]], ["auto_unroll_max_step", "ot", 0], ["unroll_explicit", "ot", 0]]}, "result": [[0.279705875], 0, 3.7677900791168213, 1639028136.6124601], "version": 0.2, "tvm_version": "0.8.dev0"}
{"input": ["cuda -keys=cuda,gpu -max_num_threads=1024 -thread_warp_size=32", "conv2d_nchw.cuda", [["TENSOR", [128, 2688, 11, 11], "float32"], ["TENSOR", [672, 2688, 1, 1], "float32"], 1, "SAME", 1, "float32"], {}], "config": {"index": 1048669, "code_hash": null, "entity": [["tile_f", "sp", [-1, 7, 4, 3]], ["tile_y", "sp", [-1, 1, 11, 1]], ["tile_x", "sp", [-1, 1, 1, 1]], ["tile_rc", "sp", [-1, 16]], ["tile_ry", "sp", [-1, 1]], ["tile_rx", "sp", [-1, 1]], ["auto_unroll_max_step", "ot", 1500], ["unroll_explicit", "ot", 0]]}, "result": [[0.14797139999999998], 0, 3.9873809814453125, 1639028139.9433818], "version": 0.2, "tvm_version": "0.8.dev0"}
{"input": ["cuda -keys=cuda,gpu -max_num_threads=1024 -thread_warp_size=32", "conv2d_nchw.cuda", [["TENSOR", [128, 2688, 11, 11], "float32"], ["TENSOR", [672, 2688, 1, 1], "float32"], 1, "SAME", 1, "float32"], {}], "config": {"index": 2424925, "code_hash": null, "entity": [["tile_f", "sp", [-1, 7, 4, 3]], ["tile_y", "sp", [-1, 1, 11, 1]], ["tile_x", "sp", [-1, 1, 1, 1]], ["tile_rc", "sp", [-1, 16]], ["tile_ry", "sp", [-1, 1]], ["tile_rx", "sp", [-1, 1]], ["auto_unroll_max_step", "ot", 1500], ["unroll_explicit", "ot", 1]]}, "result": [[0.153271125], 0, 3.384857177734375, 1639028142.562818], "version": 0.2, "tvm_version": "0.8.dev0"}
{"input": ["cuda -keys=cuda,gpu -max_num_threads=1024 -thread_warp_size=32", "conv2d_nchw.cuda", [["TENSOR", [128, 2688, 11, 11], "float32"], ["TENSOR", [672, 2688, 1, 1], "float32"], 1, "SAME", 1, "float32"], {}], "config": {"index": 1966173, "code_hash": null, "entity": [["tile_f", "sp", [-1, 7, 4, 3]], ["tile_y", "sp", [-1, 1, 11, 1]], ["tile_x", "sp", [-1, 1, 1, 1]], ["tile_rc", "sp", [-1, 16]], ["tile_ry", "sp", [-1, 1]], ["tile_rx", "sp", [-1, 1]], ["auto_unroll_max_step", "ot", 512], ["unroll_explicit", "ot", 1]]}, "result": [[0.15215885], 0, 3.8467845916748047, 1639028145.461524], "version": 0.2, "tvm_version": "0.8.dev0"}
{"input": ["cuda -keys=cuda,gpu -max_num_threads=1024 -thread_warp_size=32", "conv2d_nchw.cuda", [["TENSOR", [128, 2688, 11, 11], "float32"], ["TENSOR", [672, 2688, 1, 1], "float32"], 1, "SAME", 1, "float32"], {}], "config": {"index": 1507421, "code_hash": null, "entity": [["tile_f", "sp", [-1, 7, 4, 3]], ["tile_y", "sp", [-1, 1, 11, 1]], ["tile_x", "sp", [-1, 1, 1, 1]], ["tile_rc", "sp", [-1, 16]], ["tile_ry", "sp", [-1, 1]], ["tile_rx", "sp", [-1, 1]], ["auto_unroll_max_step", "ot", 0], ["unroll_explicit", "ot", 1]]}, "result": [[0.277407075], 0, 3.671206474304199, 1639028148.7278423], "version": 0.2, "tvm_version": "0.8.dev0"}
{"input": ["cuda -keys=cuda,gpu -max_num_threads=1024 -thread_warp_size=32", "conv2d_nchw.cuda", [["TENSOR", [128, 2688, 11, 11], "float32"], ["TENSOR", [672, 2688, 1, 1], "float32"], 1, "SAME", 1, "float32"], {}], "config": {"index": 116739, "code_hash": null, "entity": [["tile_f", "sp", [-1, 6, 7, 2]], ["tile_y", "sp", [-1, 1, 11, 1]], ["tile_x", "sp", [-1, 1, 1, 1]], ["tile_rc", "sp", [-1, 14]], ["tile_ry", "sp", [-1, 1]], ["tile_rx", "sp", [-1, 1]], ["auto_unroll_max_step", "ot", 0], ["unroll_explicit", "ot", 0]]}, "result": [[0.209261325], 0, 3.739400863647461, 1639028152.1207767], "version": 0.2, "tvm_version": "0.8.dev0"}
{"input": ["cuda -keys=cuda,gpu -max_num_threads=1024 -thread_warp_size=32", "conv2d_nchw.cuda", [["TENSOR", [128, 2688, 11, 11], "float32"], ["TENSOR", [672, 2688, 1, 1], "float32"], 1, "SAME", 1, "float32"], {}], "config": {"index": 561146, "code_hash": null, "entity": [["tile_f", "sp", [-1, 7, 6, 2]], ["tile_y", "sp", [-1, 1, 11, 1]], ["tile_x", "sp", [-1, 1, 1, 1]], ["tile_rc", "sp", [-1, 12]], ["tile_ry", "sp", [-1, 1]], ["tile_rx", "sp", [-1, 1]], ["auto_unroll_max_step", "ot", 512], ["unroll_explicit", "ot", 0]]}, "result": [[0.18941329999999998], 0, 3.6246843338012695, 1639028155.2182584], "version": 0.2, "tvm_version": "0.8.dev0"}
{"input": ["cuda -keys=cuda,gpu -max_num_threads=1024 -thread_warp_size=32", "conv2d_nchw.cuda", [["TENSOR", [128, 2688, 11, 11], "float32"], ["TENSOR", [672, 2688, 1, 1], "float32"], 1, "SAME", 1, "float32"], {}], "config": {"index": 1034243, "code_hash": null, "entity": [["tile_f", "sp", [-1, 6, 7, 2]], ["tile_y", "sp", [-1, 1, 11, 1]], ["tile_x", "sp", [-1, 1, 1, 1]], ["tile_rc", "sp", [-1, 14]], ["tile_ry", "sp", [-1, 1]], ["tile_rx", "sp", [-1, 1]], ["auto_unroll_max_step", "ot", 1500], ["unroll_explicit", "ot", 0]]}, "result": [[0.187856775], 0, 3.164947032928467, 1639028158.0271642], "version": 0.2, "tvm_version": "0.8.dev0"}
{"input": ["cuda -keys=cuda,gpu -max_num_threads=1024 -thread_warp_size=32", "conv2d_nchw.cuda", [["TENSOR", [128, 2688, 11, 11], "float32"], ["TENSOR", [672, 2688, 1, 1], "float32"], 1, "SAME", 1, "float32"], {}], "config": {"index": 1534694, "code_hash": null, "entity": [["tile_f", "sp", [-1, 2, 1, 21]], ["tile_y", "sp", [-1, 1, 1, 1]], ["tile_x", "sp", [-1, 1, 1, 1]], ["tile_rc", "sp", [-1, 24]], ["tile_ry", "sp", [-1, 1]], ["tile_rx", "sp", [-1, 1]], ["auto_unroll_max_step", "ot", 0], ["unroll_explicit", "ot", 1]]}, "result": [[17.051486375], 0, 87.84024095535278, 1639028245.2557275], "version": 0.2, "tvm_version": "0.8.dev0"}
{"input": ["cuda -keys=cuda,gpu -max_num_threads=1024 -thread_warp_size=32", "conv2d_nchw.cuda", [["TENSOR", [128, 2688, 11, 11], "float32"], ["TENSOR", [672, 2688, 1, 1], "float32"], 1, "SAME", 1, "float32"], {}], "config": {"index": 980317, "code_hash": null, "entity": [["tile_f", "sp", [-1, 96, 7, 1]], ["tile_y", "sp", [-1, 1, 11, 1]], ["tile_x", "sp", [-1, 11, 1, 1]], ["tile_rc", "sp", [-1, 6]], ["tile_ry", "sp", [-1, 1]], ["tile_rx", "sp", [-1, 1]], ["auto_unroll_max_step", "ot", 1500], ["unroll_explicit", "ot", 0]]}, "result": [[1.6807528500000002], 0, 14.823012828826904, 1639028462.1387348], "version": 0.2, "tvm_version": "0.8.dev0"}
{"input": ["cuda -keys=cuda,gpu -max_num_threads=1024 -thread_warp_size=32", "conv2d_nchw.cuda", [["TENSOR", [128, 2688, 11, 11], "float32"], ["TENSOR", [672, 2688, 1, 1], "float32"], 1, "SAME", 1, "float32"], {}], "config": {"index": 1417773, "code_hash": null, "entity": [["tile_f", "sp", [-1, 2, 28, 2]], ["tile_y", "sp", [-1, 1, 11, 1]], ["tile_x", "sp", [-1, 1, 1, 11]], ["tile_rc", "sp", [-1, 3]], ["tile_ry", "sp", [-1, 1]], ["tile_rx", "sp", [-1, 1]], ["auto_unroll_max_step", "ot", 0], ["unroll_explicit", "ot", 1]]}, "result": [[0.056040525], 0, 2.674239158630371, 1639028464.43976], "version": 0.2, "tvm_version": "0.8.dev0"}
{"input": ["cuda -keys=cuda,gpu -max_num_threads=1024 -thread_warp_size=32", "conv2d_nchw.cuda", [["TENSOR", [128, 2688, 11, 11], "float32"], ["TENSOR", [672, 2688, 1, 1], "float32"], 1, "SAME", 1, "float32"], {}], "config": {"index": 1899441, "code_hash": null, "entity": [["tile_f", "sp", [-1, 3, 7, 32]], ["tile_y", "sp", [-1, 1, 1, 11]], ["tile_x", "sp", [-1, 11, 1, 1]], ["tile_rc", "sp", [-1, 6]], ["tile_ry", "sp", [-1, 1]], ["tile_rx", "sp", [-1, 1]], ["auto_unroll_max_step", "ot", 512], ["unroll_explicit", "ot", 1]]}, "result": [[9.462815025], 0, 54.122578144073486, 1639028514.671851], "version": 0.2, "tvm_version": "0.8.dev0"}
{"input": ["cuda -keys=cuda,gpu -max_num_threads=1024 -thread_warp_size=32", "conv2d_nchw.cuda", [["TENSOR", [128, 2688, 11, 11], "float32"], ["TENSOR", [672, 2688, 1, 1], "float32"], 1, "SAME", 1, "float32"], {}], "config": {"index": 2402435, "code_hash": null, "entity": [["tile_f", "sp", [-1, 6, 7, 2]], ["tile_y", "sp", [-1, 11, 1, 1]], ["tile_x", "sp", [-1, 1, 11, 1]], ["tile_rc", "sp", [-1, 12]], ["tile_ry", "sp", [-1, 1]], ["tile_rx", "sp", [-1, 1]], ["auto_unroll_max_step", "ot", 1500], ["unroll_explicit", "ot", 1]]}, "result": [[0.070797575], 0, 3.9684150218963623, 1639028638.8007596], "version": 0.2, "tvm_version": "0.8.dev0"}
{"input": ["cuda -keys=cuda,gpu -max_num_threads=1024 -thread_warp_size=32", "conv2d_nchw.cuda", [["TENSOR", [128, 2688, 11, 11], "float32"], ["TENSOR", [672, 2688, 1, 1], "float32"], 1, "SAME", 1, "float32"], {}], "config": {"index": 1026179, "code_hash": null, "entity": [["tile_f", "sp", [-1, 6, 7, 2]], ["tile_y", "sp", [-1, 11, 1, 1]], ["tile_x", "sp", [-1, 1, 11, 1]], ["tile_rc", "sp", [-1, 12]], ["tile_ry", "sp", [-1, 1]], ["tile_rx", "sp", [-1, 1]], ["auto_unroll_max_step", "ot", 1500], ["unroll_explicit", "ot", 0]]}, "result": [[0.092848525], 0, 3.9916574954986572, 1639028641.5288038], "version": 0.2, "tvm_version": "0.8.dev0"}
{"input": ["cuda -keys=cuda,gpu -max_num_threads=1024 -thread_warp_size=32", "conv2d_nchw.cuda", [["TENSOR", [128, 2688, 11, 11], "float32"], ["TENSOR", [672, 2688, 1, 1], "float32"], 1, "SAME", 1, "float32"], {}], "config": {"index": 1943683, "code_hash": null, "entity": [["tile_f", "sp", [-1, 6, 7, 2]], ["tile_y", "sp", [-1, 11, 1, 1]], ["tile_x", "sp", [-1, 1, 11, 1]], ["tile_rc", "sp", [-1, 12]], ["tile_ry", "sp", [-1, 1]], ["tile_rx", "sp", [-1, 1]], ["auto_unroll_max_step", "ot", 512], ["unroll_explicit", "ot", 1]]}, "result": [[0.0513454], 0, 3.758913993835449, 1639028643.9735248], "version": 0.2, "tvm_version": "0.8.dev0"}
{"input": ["cuda -keys=cuda,gpu -max_num_threads=1024 -thread_warp_size=32", "conv2d_nchw.cuda", [["TENSOR", [128, 2688, 11, 11], "float32"], ["TENSOR", [672, 2688, 1, 1], "float32"], 1, "SAME", 1, "float32"], {}], "config": {"index": 2330752, "code_hash": null, "entity": [["tile_f", "sp", [-1, 2, 7, 2]], ["tile_y", "sp", [-1, 11, 1, 1]], ["tile_x", "sp", [-1, 1, 11, 1]], ["tile_rc", "sp", [-1, 3]], ["tile_ry", "sp", [-1, 1]], ["tile_rx", "sp", [-1, 1]], ["auto_unroll_max_step", "ot", 1500], ["unroll_explicit", "ot", 1]]}, "result": [[0.06993940000000001], 0, 3.198741912841797, 1639028646.2321534], "version": 0.2, "tvm_version": "0.8.dev0"}
{"input": ["cuda -keys=cuda,gpu -max_num_threads=1024 -thread_warp_size=32", "conv2d_nchw.cuda", [["TENSOR", [128, 2688, 11, 11], "float32"], ["TENSOR", [672, 2688, 1, 1], "float32"], 1, "SAME", 1, "float32"], {}], "config": {"index": 567427, "code_hash": null, "entity": [["tile_f", "sp", [-1, 6, 7, 2]], ["tile_y", "sp", [-1, 11, 1, 1]], ["tile_x", "sp", [-1, 1, 11, 1]], ["tile_rc", "sp", [-1, 12]], ["tile_ry", "sp", [-1, 1]], ["tile_rx", "sp", [-1, 1]], ["auto_unroll_max_step", "ot", 512], ["unroll_explicit", "ot", 0]]}, "result": [[0.07948967500000001], 0, 3.728996753692627, 1639028648.631532], "version": 0.2, "tvm_version": "0.8.dev0"}
{"input": ["cuda -keys=cuda,gpu -max_num_threads=1024 -thread_warp_size=32", "conv2d_nchw.cuda", [["TENSOR", [128, 2688, 11, 11], "float32"], ["TENSOR", [672, 2688, 1, 1], "float32"], 1, "SAME", 1, "float32"], {}], "config": {"index": 1872000, "code_hash": null, "entity": [["tile_f", "sp", [-1, 2, 7, 2]], ["tile_y", "sp", [-1, 11, 1, 1]], ["tile_x", "sp", [-1, 1, 11, 1]], ["tile_rc", "sp", [-1, 3]], ["tile_ry", "sp", [-1, 1]], ["tile_rx", "sp", [-1, 1]], ["auto_unroll_max_step", "ot", 512], ["unroll_explicit", "ot", 1]]}, "result": [[0.06900035], 0, 3.535449981689453, 1639028650.9529166], "version": 0.2, "tvm_version": "0.8.dev0"}
{"input": ["cuda -keys=cuda,gpu -max_num_threads=1024 -thread_warp_size=32", "conv2d_nchw.cuda", [["TENSOR", [128, 2688, 11, 11], "float32"], ["TENSOR", [672, 2688, 1, 1], "float32"], 1, "SAME", 1, "float32"], {}], "config": {"index": 2416760, "code_hash": null, "entity": [["tile_f", "sp", [-1, 2, 6, 2]], ["tile_y", "sp", [-1, 11, 1, 1]], ["tile_x", "sp", [-1, 1, 11, 1]], ["tile_rc", "sp", [-1, 14]], ["tile_ry", "sp", [-1, 1]], ["tile_rx", "sp", [-1, 1]], ["auto_unroll_max_step", "ot", 1500], ["unroll_explicit", "ot", 1]]}, "result": [[0.08029304999999999], 0, 4.370901107788086, 1639028653.5152276], "version": 0.2, "tvm_version": "0.8.dev0"}
{"input": ["cuda -keys=cuda,gpu -max_num_threads=1024 -thread_warp_size=32", "conv2d_nchw.cuda", [["TENSOR", [128, 2688, 11, 11], "float32"], ["TENSOR", [672, 2688, 1, 1], "float32"], 1, "SAME", 1, "float32"], {}], "config": {"index": 2330744, "code_hash": null, "entity": [["tile_f", "sp", [-1, 2, 6, 2]], ["tile_y", "sp", [-1, 11, 1, 1]], ["tile_x", "sp", [-1, 1, 11, 1]], ["tile_rc", "sp", [-1, 3]], ["tile_ry", "sp", [-1, 1]], ["tile_rx", "sp", [-1, 1]], ["auto_unroll_max_step", "ot", 1500], ["unroll_explicit", "ot", 1]]}, "result": [[0.0790265], 0, 3.4131877422332764, 1639028655.8073645], "version": 0.2, "tvm_version": "0.8.dev0"}
{"input": ["cuda -keys=cuda,gpu -max_num_threads=1024 -thread_warp_size=32", "conv2d_nchw.cuda", [["TENSOR", [128, 2688, 11, 11], "float32"], ["TENSOR", [672, 2688, 1, 1], "float32"], 1, "SAME", 1, "float32"], {}], "config": {"index": 567436, "code_hash": null, "entity": [["tile_f", "sp", [-1, 6, 8, 2]], ["tile_y", "sp", [-1, 11, 1, 1]], ["tile_x", "sp", [-1, 1, 11, 1]], ["tile_rc", "sp", [-1, 12]], ["tile_ry", "sp", [-1, 1]], ["tile_rx", "sp", [-1, 1]], ["auto_unroll_max_step", "ot", 512], ["unroll_explicit", "ot", 0]]}, "result": [[0.048651775], 0, 3.819725751876831, 1639028658.121772], "version": 0.2, "tvm_version": "0.8.dev0"}
