artifacts/Table3/tvm/autotvm/conv/conv2d_128_336_21_21_336_1_1_1_0.log
{"input": ["cuda -keys=cuda,gpu -max_num_threads=1024 -thread_warp_size=32", "conv2d_nchw.cuda", [["TENSOR", [128, 336, 21, 21], "float32"], ["TENSOR", [336, 336, 1, 1], "float32"], 1, "VALID", 1, "float32"], {}], "config": {"index": 3015721, "code_hash": null, "entity": [["tile_f", "sp", [-1, 1, 48, 1]], ["tile_y", "sp", [-1, 1, 1, 3]], ["tile_x", "sp", [-1, 1, 1, 1]], ["tile_rc", "sp", [-1, 2]], ["tile_ry", "sp", [-1, 1]], ["tile_rx", "sp", [-1, 1]], ["auto_unroll_max_step", "ot", 512], ["unroll_explicit", "ot", 0]]}, "result": [[0.06768605], 0, 3.27864933013916, 1638965729.339047], "version": 0.2, "tvm_version": "0.8.dev0"}
{"input": ["cuda -keys=cuda,gpu -max_num_threads=1024 -thread_warp_size=32", "conv2d_nchw.cuda", [["TENSOR", [128, 336, 21, 21], "float32"], ["TENSOR", [336, 336, 1, 1], "float32"], 1, "VALID", 1, "float32"], {}], "config": {"index": 13478937, "code_hash": null, "entity": [["tile_f", "sp", [-1, 3, 4, 4]], ["tile_y", "sp", [-1, 7, 3, 1]], ["tile_x", "sp", [-1, 1, 1, 1]], ["tile_rc", "sp", [-1, 48]], ["tile_ry", "sp", [-1, 1]], ["tile_rx", "sp", [-1, 1]], ["auto_unroll_max_step", "ot", 512], ["unroll_explicit", "ot", 1]]}, "result": [[0.083802175], 0, 4.164036512374878, 1638965733.680852], "version": 0.2, "tvm_version": "0.8.dev0"}
{"input": ["cuda -keys=cuda,gpu -max_num_threads=1024 -thread_warp_size=32", "conv2d_nchw.cuda", [["TENSOR", [128, 336, 21, 21], "float32"], ["TENSOR", [336, 336, 1, 1], "float32"], 1, "VALID", 1, "float32"], {}], "config": {"index": 13011367, "code_hash": null, "entity": [["tile_f", "sp", [-1, 7, 1, 6]], ["tile_y", "sp", [-1, 7, 1, 1]], ["tile_x", "sp", [-1, 1, 1, 7]], ["tile_rc", "sp", [-1, 21]], ["tile_ry", "sp", [-1, 1]], ["tile_rx", "sp", [-1, 1]], ["auto_unroll_max_step", "ot", 512], ["unroll_explicit", "ot", 1]]}, "result": [[10.886922049999999], 0, 60.65209484100342, 1638965791.229082], "version": 0.2, "tvm_version": "0.8.dev0"}
{"input": ["cuda -keys=cuda,gpu -max_num_threads=1024 -thread_warp_size=32", "conv2d_nchw.cuda", [["TENSOR", [128, 336, 21, 21], "float32"], ["TENSOR", [336, 336, 1, 1], "float32"], 1, "VALID", 1, "float32"], {}], "config": {"index": 1870123, "code_hash": null, "entity": [["tile_f", "sp", [-1, 2, 2, 4]], ["tile_y", "sp", [-1, 1, 7, 3]], ["tile_x", "sp", [-1, 1, 1, 1]], ["tile_rc", "sp", [-1, 42]], ["tile_ry", "sp", [-1, 1]], ["tile_rx", "sp", [-1, 1]], ["auto_unroll_max_step", "ot", 0], ["unroll_explicit", "ot", 0]]}, "result": [[0.06511114999999999], 0, 3.471337080001831, 1638965795.3472948], "version": 0.2, "tvm_version": "0.8.dev0"}
{"input": ["cuda -keys=cuda,gpu -max_num_threads=1024 -thread_warp_size=32", "conv2d_nchw.cuda", [["TENSOR", [128, 336, 21, 21], "float32"], ["TENSOR", [336, 336, 1, 1], "float32"], 1, "VALID", 1, "float32"], {}], "config": {"index": 12072140, "code_hash": null, "entity": [["tile_f", "sp", [-1, 1, 56, 2]], ["tile_y", "sp", [-1, 7, 3, 1]], ["tile_x", "sp", [-1, 21, 1, 1]], ["tile_rc", "sp", [-1, 6]], ["tile_ry", "sp", [-1, 1]], ["tile_rx", "sp", [-1, 1]], ["auto_unroll_max_step", "ot", 512], ["unroll_explicit", "ot", 1]]}, "result": [[0.07624692500000001], 0, 4.153753280639648, 1638965800.0119574], "version": 0.2, "tvm_version": "0.8.dev0"}
{"input": ["cuda -keys=cuda,gpu -max_num_threads=1024 -thread_warp_size=32", "conv2d_nchw.cuda", [["TENSOR", [128, 336, 21, 21], "float32"], ["TENSOR", [336, 336, 1, 1], "float32"], 1, "VALID", 1, "float32"], {}], "config": {"index": 1911175, "code_hash": null, "entity": [["tile_f", "sp", [-1, 4, 2, 14]], ["tile_y", "sp", [-1, 1, 3, 1]], ["tile_x", "sp", [-1, 7, 3, 1]], ["tile_rc", "sp", [-1, 42]], ["tile_ry", "sp", [-1, 1]], ["tile_rx", "sp", [-1, 1]], ["auto_unroll_max_step", "ot", 0], ["unroll_explicit", "ot", 0]]}, "result": [[1.07256585], 0, 9.110909700393677, 1638965808.2746503], "version": 0.2, "tvm_version": "0.8.dev0"}
{"input": ["cuda -keys=cuda,gpu -max_num_threads=1024 -thread_warp_size=32", "conv2d_nchw.cuda", [["TENSOR", [128, 336, 21, 21], "float32"], ["TENSOR", [336, 336, 1, 1], "float32"], 1, "VALID", 1, "float32"], {}], "config": {"index": 10409790, "code_hash": null, "entity": [["tile_f", "sp", [-1, 4, 1, 28]], ["tile_y", "sp", [-1, 1, 1, 7]], ["tile_x", "sp", [-1, 1, 1, 3]], ["tile_rc", "sp", [-1, 28]], ["tile_ry", "sp", [-1, 1]], ["tile_rx", "sp", [-1, 1]], ["auto_unroll_max_step", "ot", 0], ["unroll_explicit", "ot", 1]]}, "result": [[13.105416025], 0, 68.69066572189331, 1638965876.8924716], "version": 0.2, "tvm_version": "0.8.dev0"}
{"input": ["cuda -keys=cuda,gpu -max_num_threads=1024 -thread_warp_size=32", "conv2d_nchw.cuda", [["TENSOR", [128, 336, 21, 21], "float32"], ["TENSOR", [336, 336, 1, 1], "float32"], 1, "VALID", 1, "float32"], {}], "config": {"index": 15713128, "code_hash": null, "entity": [["tile_f", "sp", [-1, 14, 12, 1]], ["tile_y", "sp", [-1, 1, 7, 3]], ["tile_x", "sp", [-1, 1, 1, 3]], ["tile_rc", "sp", [-1, 16]], ["tile_ry", "sp", [-1, 1]], ["tile_rx", "sp", [-1, 1]], ["auto_unroll_max_step", "ot", 1500], ["unroll_explicit", "ot", 1]]}, "result": [[0.0127808125], 0, 3.572706699371338, 1638965879.7563272], "version": 0.2, "tvm_version": "0.8.dev0"}
{"input": ["cuda -keys=cuda,gpu -max_num_threads=1024 -thread_warp_size=32", "conv2d_nchw.cuda", [["TENSOR", [128, 336, 21, 21], "float32"], ["TENSOR", [336, 336, 1, 1], "float32"], 1, "VALID", 1, "float32"], {}], "config": {"index": 5846290, "code_hash": null, "entity": [["tile_f", "sp", [-1, 12, 1, 14]], ["tile_y", "sp", [-1, 3, 7, 1]], ["tile_x", "sp", [-1, 1, 1, 7]], ["tile_rc", "sp", [-1, 1]], ["tile_ry", "sp", [-1, 1]], ["tile_rx", "sp", [-1, 1]], ["auto_unroll_max_step", "ot", 1500], ["unroll_explicit", "ot", 0]]}, "result": [[1.592990825], 0, 11.741206407546997, 1638965890.4359245], "version": 0.2, "tvm_version": "0.8.dev0"}
{"input": ["cuda -keys=cuda,gpu -max_num_threads=1024 -thread_warp_size=32", "conv2d_nchw.cuda", [["TENSOR", [128, 336, 21, 21], "float32"], ["TENSOR", [336, 336, 1, 1], "float32"], 1, "VALID", 1, "float32"], {}], "config": {"index": 9213989, "code_hash": null, "entity": [["tile_f", "sp", [-1, 12, 7, 4]], ["tile_y", "sp", [-1, 7, 3, 1]], ["tile_x", "sp", [-1, 1, 3, 1]], ["tile_rc", "sp", [-1, 6]], ["tile_ry", "sp", [-1, 1]], ["tile_rx", "sp", [-1, 1]], ["auto_unroll_max_step", "ot", 0], ["unroll_explicit", "ot", 1]]}, "result": [[0.3959963], 0, 5.647110223770142, 1638965896.0934403], "version": 0.2, "tvm_version": "0.8.dev0"}
{"input": ["cuda -keys=cuda,gpu -max_num_threads=1024 -thread_warp_size=32", "conv2d_nchw.cuda", [["TENSOR", [128, 336, 21, 21], "float32"], ["TENSOR", [336, 336, 1, 1], "float32"], 1, "VALID", 1, "float32"], {}], "config": {"index": 8836340, "code_hash": null, "entity": [["tile_f", "sp", [-1, 7, 16, 1]], ["tile_y", "sp", [-1, 21, 1, 1]], ["tile_x", "sp", [-1, 7, 1, 3]], ["tile_rc", "sp", [-1, 2]], ["tile_ry", "sp", [-1, 1]], ["tile_rx", "sp", [-1, 1]], ["auto_unroll_max_step", "ot", 0], ["unroll_explicit", "ot", 1]]}, "result": [[0.68426185], 0, 16.586007118225098, 1638965904.285861], "version": 0.2, "tvm_version": "0.8.dev0"}
{"input": ["cuda -keys=cuda,gpu -max_num_threads=1024 -thread_warp_size=32", "conv2d_nchw.cuda", [["TENSOR", [128, 336, 21, 21], "float32"], ["TENSOR", [336, 336, 1, 1], "float32"], 1, "VALID", 1, "float32"], {}], "config": {"index": 6489251, "code_hash": null, "entity": [["tile_f", "sp", [-1, 4, 2, 42]], ["tile_y", "sp", [-1, 21, 1, 1]], ["tile_x", "sp", [-1, 1, 3, 1]], ["tile_rc", "sp", [-1, 7]], ["tile_ry", "sp", [-1, 1]], ["tile_rx", "sp", [-1, 1]], ["auto_unroll_max_step", "ot", 1500], ["unroll_explicit", "ot", 0]]}, "result": [[1.830105525], 0, 14.037592649459839, 1638965918.6737025], "version": 0.2, "tvm_version": "0.8.dev0"}
{"input": ["cuda -keys=cuda,gpu -max_num_threads=1024 -thread_warp_size=32", "conv2d_nchw.cuda", [["TENSOR", [128, 336, 21, 21], "float32"], ["TENSOR", [336, 336, 1, 1], "float32"], 1, "VALID", 1, "float32"], {}], "config": {"index": 15855274, "code_hash": null, "entity": [["tile_f", "sp", [-1, 3, 1, 112]], ["tile_y", "sp", [-1, 1, 21, 1]], ["tile_x", "sp", [-1, 1, 1, 3]], ["tile_rc", "sp", [-1, 21]], ["tile_ry", "sp", [-1, 1]], ["tile_rx", "sp", [-1, 1]], ["auto_unroll_max_step", "ot", 1500], ["unroll_explicit", "ot", 1]]}, "result": [[0.715281675], 0, 14.891460180282593, 1638965927.5677032], "version": 0.2, "tvm_version": "0.8.dev0"}
{"input": ["cuda -keys=cuda,gpu -max_num_threads=1024 -thread_warp_size=32", "conv2d_nchw.cuda", [["TENSOR", [128, 336, 21, 21], "float32"], ["TENSOR", [336, 336, 1, 1], "float32"], 1, "VALID", 1, "float32"], {}], "config": {"index": 2922796, "code_hash": null, "entity": [["tile_f", "sp", [-1, 7, 2, 2]], ["tile_y", "sp", [-1, 21, 1, 1]], ["tile_x", "sp", [-1, 1, 7, 1]], ["tile_rc", "sp", [-1, 1]], ["tile_ry", "sp", [-1, 1]], ["tile_rx", "sp", [-1, 1]], ["auto_unroll_max_step", "ot", 512], ["unroll_explicit", "ot", 0]]}, "result": [[0.224442175], 0, 4.803823471069336, 1638965931.6980476], "version": 0.2, "tvm_version": "0.8.dev0"}
{"input": ["cuda -keys=cuda,gpu -max_num_threads=1024 -thread_warp_size=32", "conv2d_nchw.cuda", [["TENSOR", [128, 336, 21, 21], "float32"], ["TENSOR", [336, 336, 1, 1], "float32"], 1, "VALID", 1, "float32"], {}], "config": {"index": 9467655, "code_hash": null, "entity": [["tile_f", "sp", [-1, 28, 3, 4]], ["tile_y", "sp", [-1, 7, 1, 3]], ["tile_x", "sp", [-1, 1, 1, 1]], ["tile_rc", "sp", [-1, 8]], ["tile_ry", "sp", [-1, 1]], ["tile_rx", "sp", [-1, 1]], ["auto_unroll_max_step", "ot", 0], ["unroll_explicit", "ot", 1]]}, "result": [[3.746097525], 0, 22.72442936897278, 1638965954.1050825], "version": 0.2, "tvm_version": "0.8.dev0"}
{"input": ["cuda -keys=cuda,gpu -max_num_threads=1024 -thread_warp_size=32", "conv2d_nchw.cuda", [["TENSOR", [128, 336, 21, 21], "float32"], ["TENSOR", [336, 336, 1, 1], "float32"], 1, "VALID", 1, "float32"], {}], "config": {"index": 13200326, "code_hash": null, "entity": [["tile_f", "sp", [-1, 8, 1, 1]], ["tile_y", "sp", [-1, 1, 3, 1]], ["tile_x", "sp", [-1, 3, 1, 1]], ["tile_rc", "sp", [-1, 28]], ["tile_ry", "sp", [-1, 1]], ["tile_rx", "sp", [-1, 1]], ["auto_unroll_max_step", "ot", 512], ["unroll_explicit", "ot", 1]]}, "result": [[0.195138175], 0, 3.8321268558502197, 1638965957.2229424], "version": 0.2, "tvm_version": "0.8.dev0"}
{"input": ["cuda -keys=cuda,gpu -max_num_threads=1024 -thread_warp_size=32", "conv2d_nchw.cuda", [["TENSOR", [128, 336, 21, 21], "float32"], ["TENSOR", [336, 336, 1, 1], "float32"], 1, "VALID", 1, "float32"], {}], "config": {"index": 4366350, "code_hash": null, "entity": [["tile_f", "sp", [-1, 24, 2, 1]], ["tile_y", "sp", [-1, 7, 3, 1]], ["tile_x", "sp", [-1, 3, 7, 1]], ["tile_rc", "sp", [-1, 21]], ["tile_ry", "sp", [-1, 1]], ["tile_rx", "sp", [-1, 1]], ["auto_unroll_max_step", "ot", 512], ["unroll_explicit", "ot", 0]]}, "result": [[0.37914375], 0, 7.772237777709961, 1638965963.8750718], "version": 0.2, "tvm_version": "0.8.dev0"}
{"input": ["cuda -keys=cuda,gpu -max_num_threads=1024 -thread_warp_size=32", "conv2d_nchw.cuda", [["TENSOR", [128, 336, 21, 21], "float32"], ["TENSOR", [336, 336, 1, 1], "float32"], 1, "VALID", 1, "float32"], {}], "config": {"index": 14693854, "code_hash": null, "entity": [["tile_f", "sp", [-1, 48, 1, 1]], ["tile_y", "sp", [-1, 1, 1, 21]], ["tile_x", "sp", [-1, 3, 7, 1]], ["tile_rc", "sp", [-1, 3]], ["tile_ry", "sp", [-1, 1]], ["tile_rx", "sp", [-1, 1]], ["auto_unroll_max_step", "ot", 1500], ["unroll_explicit", "ot", 1]]}, "result": [[1.6402685], 0, 11.476381301879883, 1638965987.1508262], "version": 0.2, "tvm_version": "0.8.dev0"}
{"input": ["cuda -keys=cuda,gpu -max_num_threads=1024 -thread_warp_size=32", "conv2d_nchw.cuda", [["TENSOR", [128, 336, 21, 21], "float32"], ["TENSOR", [336, 336, 1, 1], "float32"], 1, "VALID", 1, "float32"], {}], "config": {"index": 979929, "code_hash": null, "entity": [["tile_f", "sp", [-1, 2, 2, 21]], ["tile_y", "sp", [-1, 7, 3, 1]], ["tile_x", "sp", [-1, 3, 1, 7]], ["tile_rc", "sp", [-1, 8]], ["tile_ry", "sp", [-1, 1]], ["tile_rx", "sp", [-1, 1]], ["auto_unroll_max_step", "ot", 0], ["unroll_explicit", "ot", 0]]}, "result": [[2.31357305], 0, 16.34330677986145, 1638966002.403056], "version": 0.2, "tvm_version": "0.8.dev0"}
{"input": ["cuda -keys=cuda,gpu -max_num_threads=1024 -thread_warp_size=32", "conv2d_nchw.cuda", [["TENSOR", [128, 336, 21, 21], "float32"], ["TENSOR", [336, 336, 1, 1], "float32"], 1, "VALID", 1, "float32"], {}], "config": {"index": 564422, "code_hash": null, "entity": [["tile_f", "sp", [-1, 1, 2, 24]], ["tile_y", "sp", [-1, 1, 1, 21]], ["tile_x", "sp", [-1, 1, 3, 7]], ["tile_rc", "sp", [-1, 4]], ["tile_ry", "sp", [-1, 1]], ["tile_rx", "sp", [-1, 1]], ["auto_unroll_max_step", "ot", 0], ["unroll_explicit", "ot", 0]]}, "result": [[1.643705375], 0, 11.219225883483887, 1638966014.1022747], "version": 0.2, "tvm_version": "0.8.dev0"}
{"input": ["cuda -keys=cuda,gpu -max_num_threads=1024 -thread_warp_size=32", "conv2d_nchw.cuda", [["TENSOR", [128, 336, 21, 21], "float32"], ["TENSOR", [336, 336, 1, 1], "float32"], 1, "VALID", 1, "float32"], {}], "config": {"index": 10914267, "code_hash": null, "entity": [["tile_f", "sp", [-1, 2, 1, 12]], ["tile_y", "sp", [-1, 3, 1, 1]], ["tile_x", "sp", [-1, 7, 1, 1]], ["tile_rc", "sp", [-1, 84]], ["tile_ry", "sp", [-1, 1]], ["tile_rx", "sp", [-1, 1]], ["auto_unroll_max_step", "ot", 0], ["unroll_explicit", "ot", 1]]}, "result": [[14.27225195], 0, 74.23614931106567, 1638966088.8155596], "version": 0.2, "tvm_version": "0.8.dev0"}
{"input": ["cuda -keys=cuda,gpu -max_num_threads=1024 -thread_warp_size=32", "conv2d_nchw.cuda", [["TENSOR", [128, 336, 21, 21], "float32"], ["TENSOR", [336, 336, 1, 1], "float32"], 1, "VALID", 1, "float32"], {}], "config": {"index": 1235158, "code_hash": null, "entity": [["tile_f", "sp", [-1, 6, 1, 7]], ["tile_y", "sp", [-1, 3, 1, 7]], ["tile_x", "sp", [-1, 1, 1, 3]], ["tile_rc", "sp", [-1, 14]], ["tile_ry", "sp", [-1, 1]], ["tile_rx", "sp", [-1, 1]], ["auto_unroll_max_step", "ot", 0], ["unroll_explicit", "ot", 0]]}, "result": [[10.6506978], 0, 56.152501821517944, 1638966144.9596252], "version": 0.2, "tvm_version": "0.8.dev0"}
{"input": ["cuda -keys=cuda,gpu -max_num_threads=1024 -thread_warp_size=32", "conv2d_nchw.cuda", [["TENSOR", [128, 336, 21, 21], "float32"], ["TENSOR", [336, 336, 1, 1], "float32"], 1, "VALID", 1, "float32"], {}], "config": {"index": 7155102, "code_hash": null, "entity": [["tile_f", "sp", [-1, 1, 2, 56]], ["tile_y", "sp", [-1, 1, 21, 1]], ["tile_x", "sp", [-1, 1, 3, 7]], ["tile_rc", "sp", [-1, 16]], ["tile_ry", "sp", [-1, 1]], ["tile_rx", "sp", [-1, 1]], ["auto_unroll_max_step", "ot", 1500], ["unroll_explicit", "ot", 0]]}, "result": [[0.161292875], 0, 4.819018363952637, 1638966148.5948105], "version": 0.2, "tvm_version": "0.8.dev0"}
{"input": ["cuda -keys=cuda,gpu -max_num_threads=1024 -thread_warp_size=32", "conv2d_nchw.cuda", [["TENSOR", [128, 336, 21, 21], "float32"], ["TENSOR", [336, 336, 1, 1], "float32"], 1, "VALID", 1, "float32"], {}], "config": {"index": 9745425, "code_hash": null, "entity": [["tile_f", "sp", [-1, 2, 7, 4]], ["tile_y", "sp", [-1, 7, 1, 3]], ["tile_x", "sp", [-1, 1, 1, 21]], ["tile_rc", "sp", [-1, 12]], ["tile_ry", "sp", [-1, 1]], ["tile_rx", "sp", [-1, 1]], ["auto_unroll_max_step", "ot", 0], ["unroll_explicit", "ot", 1]]}, "result": [[2.798065525], 0, 17.635478734970093, 1638966165.9550498], "version": 0.2, "tvm_version": "0.8.dev0"}
{"input": ["cuda -keys=cuda,gpu -max_num_threads=1024 -thread_warp_size=32", "conv2d_nchw.cuda", [["TENSOR", [128, 336, 21, 21], "float32"], ["TENSOR", [336, 336, 1, 1], "float32"], 1, "VALID", 1, "float32"], {}], "config": {"index": 3946145, "code_hash": null, "entity": [["tile_f", "sp", [-1, 4, 6, 7]], ["tile_y", "sp", [-1, 1, 7, 1]], ["tile_x", "sp", [-1, 1, 21, 1]], ["tile_rc", "sp", [-1, 12]], ["tile_ry", "sp", [-1, 1]], ["tile_rx", "sp", [-1, 1]], ["auto_unroll_max_step", "ot", 512], ["unroll_explicit", "ot", 0]]}, "result": [[0.014384325], 0, 2.639888286590576, 1638966168.1775453], "version": 0.2, "tvm_version": "0.8.dev0"}
{"input": ["cuda -keys=cuda,gpu -max_num_threads=1024 -thread_warp_size=32", "conv2d_nchw.cuda", [["TENSOR", [128, 336, 21, 21], "float32"], ["TENSOR", [336, 336, 1, 1], "float32"], 1, "VALID", 1, "float32"], {}], "config": {"index": 12621560, "code_hash": null, "entity": [["tile_f", "sp", [-1, 42, 1, 4]], ["tile_y", "sp", [-1, 7, 1, 3]], ["tile_x", "sp", [-1, 1, 1, 1]], ["tile_rc", "sp", [-1, 14]], ["tile_ry", "sp", [-1, 1]], ["tile_rx", "sp", [-1, 1]], ["auto_unroll_max_step", "ot", 512], ["unroll_explicit", "ot", 1]]}, "result": [[11.1053487], 0, 61.945767641067505, 1638966227.8838809], "version": 0.2, "tvm_version": "0.8.dev0"}
{"input": ["cuda -keys=cuda,gpu -max_num_threads=1024 -thread_warp_size=32", "conv2d_nchw.cuda", [["TENSOR", [128, 336, 21, 21], "float32"], ["TENSOR", [336, 336, 1, 1], "float32"], 1, "VALID", 1, "float32"], {}], "config": {"index": 11759395, "code_hash": null, "entity": [["tile_f", "sp", [-1, 3, 2, 28]], ["tile_y", "sp", [-1, 1, 7, 1]], ["tile_x", "sp", [-1, 1, 1, 1]], ["tile_rc", "sp", [-1, 3]], ["tile_ry", "sp", [-1, 1]], ["tile_rx", "sp", [-1, 1]], ["auto_unroll_max_step", "ot", 512], ["unroll_explicit", "ot", 1]]}, "result": [[0.089712], 0, 3.847944736480713, 1638966231.431706], "version": 0.2, "tvm_version": "0.8.dev0"}
{"input": ["cuda -keys=cuda,gpu -max_num_threads=1024 -thread_warp_size=32", "conv2d_nchw.cuda", [["TENSOR", [128, 336, 21, 21], "float32"], ["TENSOR", [336, 336, 1, 1], "float32"], 1, "VALID", 1, "float32"], {}], "config": {"index": 9474404, "code_hash": null, "entity": [["tile_f", "sp", [-1, 1, 1, 6]], ["tile_y", "sp", [-1, 1, 7, 1]], ["tile_x", "sp", [-1, 3, 1, 1]], ["tile_rc", "sp", [-1, 8]], ["tile_ry", "sp", [-1, 1]], ["tile_rx", "sp", [-1, 1]], ["auto_unroll_max_step", "ot", 0], ["unroll_explicit", "ot", 1]]}, "result": [[0.09437155], 0, 2.8586833477020264, 1638966234.6797094], "version": 0.2, "tvm_version": "0.8.dev0"}
{"input": ["cuda -keys=cuda,gpu -max_num_threads=1024 -thread_warp_size=32", "conv2d_nchw.cuda", [["TENSOR", [128, 336, 21, 21], "float32"], ["TENSOR", [336, 336, 1, 1], "float32"], 1, "VALID", 1, "float32"], {}], "config": {"index": 2990012, "code_hash": null, "entity": [["tile_f", "sp", [-1, 2, 4, 2]], ["tile_y", "sp", [-1, 1, 7, 3]], ["tile_x", "sp", [-1, 3, 1, 7]], ["tile_rc", "sp", [-1, 1]], ["tile_ry", "sp", [-1, 1]], ["tile_rx", "sp", [-1, 1]], ["auto_unroll_max_step", "ot", 512], ["unroll_explicit", "ot", 0]]}, "result": [[0.035384225], 0, 2.8737878799438477, 1638966237.5491207], "version": 0.2, "tvm_version": "0.8.dev0"}
{"input": ["cuda -keys=cuda,gpu -max_num_threads=1024 -thread_warp_size=32", "conv2d_nchw.cuda", [["TENSOR", [128, 336, 21, 21], "float32"], ["TENSOR", [336, 336, 1, 1], "float32"], 1, "VALID", 1, "float32"], {}], "config": {"index": 8697431, "code_hash": null, "entity": [["tile_f", "sp", [-1, 8, 7, 1]], ["tile_y", "sp", [-1, 1, 7, 3]], ["tile_x", "sp", [-1, 7, 1, 3]], ["tile_rc", "sp", [-1, 1]], ["tile_ry", "sp", [-1, 1]], ["tile_rx", "sp", [-1, 1]], ["auto_unroll_max_step", "ot", 0], ["unroll_explicit", "ot", 1]]}, "result": [[0.546536175], 0, 5.483034610748291, 1638966254.659794], "version": 0.2, "tvm_version": "0.8.dev0"}
{"input": ["cuda -keys=cuda,gpu -max_num_threads=1024 -thread_warp_size=32", "conv2d_nchw.cuda", [["TENSOR", [128, 336, 21, 21], "float32"], ["TENSOR", [336, 336, 1, 1], "float32"], 1, "VALID", 1, "float32"], {}], "config": {"index": 1491456, "code_hash": null, "entity": [["tile_f", "sp", [-1, 14, 4, 2]], ["tile_y", "sp", [-1, 3, 7, 1]], ["tile_x", "sp", [-1, 1, 7, 1]], ["tile_rc", "sp", [-1, 21]], ["tile_ry", "sp", [-1, 1]], ["tile_rx", "sp", [-1, 1]], ["auto_unroll_max_step", "ot", 0], ["unroll_explicit", "ot", 0]]}, "result": [[0.014835814285714287], 0, 2.429682493209839, 1638966256.9025056], "version": 0.2, "tvm_version": "0.8.dev0"}
{"input": ["cuda -keys=cuda,gpu -max_num_threads=1024 -thread_warp_size=32", "conv2d_nchw.cuda", [["TENSOR", [128, 336, 21, 21], "float32"], ["TENSOR", [336, 336, 1, 1], "float32"], 1, "VALID", 1, "float32"], {}], "config": {"index": 13481075, "code_hash": null, "entity": [["tile_f", "sp", [-1, 7, 8, 2]], ["tile_y", "sp", [-1, 1, 1, 3]], ["tile_x", "sp", [-1, 1, 1, 1]], ["tile_rc", "sp", [-1, 48]], ["tile_ry", "sp", [-1, 1]], ["tile_rx", "sp", [-1, 1]], ["auto_unroll_max_step", "ot", 512], ["unroll_explicit", "ot", 1]]}, "result": [[0.8254442249999999], 0, 7.03176736831665, 1638966263.6918557], "version": 0.2, "tvm_version": "0.8.dev0"}
{"input": ["cuda -keys=cuda,gpu -max_num_threads=1024 -thread_warp_size=32", "conv2d_nchw.cuda", [["TENSOR", [128, 336, 21, 21], "float32"], ["TENSOR", [336, 336, 1, 1], "float32"], 1, "VALID", 1, "float32"], {}], "config": {"index": 15376522, "code_hash": null, "entity": [["tile_f", "sp", [-1, 16, 3, 1]], ["tile_y", "sp", [-1, 7, 1, 1]], ["tile_x", "sp", [-1, 1, 3, 1]], ["tile_rc", "sp", [-1, 12]], ["tile_ry", "sp", [-1, 1]], ["tile_rx", "sp", [-1, 1]], ["auto_unroll_max_step", "ot", 1500], ["unroll_explicit", "ot", 1]]}, "result": [[0.0555557], 0, 4.911559820175171, 1638966266.2429278], "version": 0.2, "tvm_version": "0.8.dev0"}
{"input": ["cuda -keys=cuda,gpu -max_num_threads=1024 -thread_warp_size=32", "conv2d_nchw.cuda", [["TENSOR", [128, 336, 21, 21], "float32"], ["TENSOR", [336, 336, 1, 1], "float32"], 1, "VALID", 1, "float32"], {}], "config": {"index": 9098857, "code_hash": null, "entity": [["tile_f", "sp", [-1, 1, 7, 48]], ["tile_y", "sp", [-1, 3, 7, 1]], ["tile_x", "sp", [-1, 3, 7, 1]], ["tile_rc", "sp", [-1, 4]], ["tile_ry", "sp", [-1, 1]], ["tile_rx", "sp", [-1, 1]], ["auto_unroll_max_step", "ot", 0], ["unroll_explicit", "ot", 1]]}, "result": [[0.39812355000000005], 0, 5.57487154006958, 1638966271.2042832], "version": 0.2, "tvm_version": "0.8.dev0"}
{"input": ["cuda -keys=cuda,gpu -max_num_threads=1024 -thread_warp_size=32", "conv2d_nchw.cuda", [["TENSOR", [128, 336, 21, 21], "float32"], ["TENSOR", [336, 336, 1, 1], "float32"], 1, "VALID", 1, "float32"], {}], "config": {"index": 4152101, "code_hash": null, "entity": [["tile_f", "sp", [-1, 8, 14, 3]], ["tile_y", "sp", [-1, 1, 7, 1]], ["tile_x", "sp", [-1, 1, 1, 21]], ["tile_rc", "sp", [-1, 14]], ["tile_ry", "sp", [-1, 1]], ["tile_rx", "sp", [-1, 1]], ["auto_unroll_max_step", "ot", 512], ["unroll_explicit", "ot", 0]]}, "result": [[0.288155125], 0, 5.8060302734375, 1638966276.040393], "version": 0.2, "tvm_version": "0.8.dev0"}
{"input": ["cuda -keys=cuda,gpu -max_num_threads=1024 -thread_warp_size=32", "conv2d_nchw.cuda", [["TENSOR", [128, 336, 21, 21], "float32"], ["TENSOR", [336, 336, 1, 1], "float32"], 1, "VALID", 1, "float32"], {}], "config": {"index": 13312769, "code_hash": null, "entity": [["tile_f", "sp", [-1, 8, 1, 14]], ["tile_y", "sp", [-1, 1, 1, 7]], ["tile_x", "sp", [-1, 3, 1, 7]], ["tile_rc", "sp", [-1, 28]], ["tile_ry", "sp", [-1, 1]], ["tile_rx", "sp", [-1, 1]], ["auto_unroll_max_step", "ot", 512], ["unroll_explicit", "ot", 1]]}, "result": [[21.531030925], 0, 112.02101922035217, 1638966386.7518497], "version": 0.2, "tvm_version": "0.8.dev0"}
{"input": ["cuda -keys=cuda,gpu -max_num_threads=1024 -thread_warp_size=32", "conv2d_nchw.cuda", [["TENSOR", [128, 336, 21, 21], "float32"], ["TENSOR", [336, 336, 1, 1], "float32"], 1, "VALID", 1, "float32"], {}], "config": {"index": 4190694, "code_hash": null, "entity": [["tile_f", "sp", [-1, 2, 28, 2]], ["tile_y", "sp", [-1, 1, 7, 3]], ["tile_x", "sp", [-1, 21, 1, 1]], ["tile_rc", "sp", [-1, 16]], ["tile_ry", "sp", [-1, 1]], ["tile_rx", "sp", [-1, 1]], ["auto_unroll_max_step", "ot", 512], ["unroll_explicit", "ot", 0]]}, "result": [[0.02163595], 0, 2.784959077835083, 1638966389.2461863], "version": 0.2, "tvm_version": "0.8.dev0"}
{"input": ["cuda -keys=cuda,gpu -max_num_threads=1024 -thread_warp_size=32", "conv2d_nchw.cuda", [["TENSOR", [128, 336, 21, 21], "float32"], ["TENSOR", [336, 336, 1, 1], "float32"], 1, "VALID", 1, "float32"], {}], "config": {"index": 14866493, "code_hash": null, "entity": [["tile_f", "sp", [-1, 3, 4, 2]], ["tile_y", "sp", [-1, 21, 1, 1]], ["tile_x", "sp", [-1, 1, 7, 3]], ["tile_rc", "sp", [-1, 4]], ["tile_ry", "sp", [-1, 1]], ["tile_rx", "sp", [-1, 1]], ["auto_unroll_max_step", "ot", 1500], ["unroll_explicit", "ot", 1]]}, "result": [[0.291763125], 0, 5.803668737411499, 1638966394.0159795], "version": 0.2, "tvm_version": "0.8.dev0"}
{"input": ["cuda -keys=cuda,gpu -max_num_threads=1024 -thread_warp_size=32", "conv2d_nchw.cuda", [["TENSOR", [128, 336, 21, 21], "float32"], ["TENSOR", [336, 336, 1, 1], "float32"], 1, "VALID", 1, "float32"], {}], "config": {"index": 528575, "code_hash": null, "entity": [["tile_f", "sp", [-1, 1, 8, 21]], ["tile_y", "sp", [-1, 1, 1, 21]], ["tile_x", "sp", [-1, 7, 1, 3]], ["tile_rc", "sp", [-1, 4]], ["tile_ry", "sp", [-1, 1]], ["tile_rx", "sp", [-1, 1]], ["auto_unroll_max_step", "ot", 0], ["unroll_explicit", "ot", 0]]}, "result": [[1.447220925], 0, 10.668274164199829, 1638966404.1001003], "version": 0.2, "tvm_version": "0.8.dev0"}
{"input": ["cuda -keys=cuda,gpu -max_num_threads=1024 -thread_warp_size=32", "conv2d_nchw.cuda", [["TENSOR", [128, 336, 21, 21], "float32"], ["TENSOR", [336, 336, 1, 1], "float32"], 1, "VALID", 1, "float32"], {}], "config": {"index": 13234031, "code_hash": null, "entity": [["tile_f", "sp", [-1, 1, 28, 1]], ["tile_y", "sp", [-1, 1, 1, 1]], ["tile_x", "sp", [-1, 7, 3, 1]], ["tile_rc", "sp", [-1, 28]], ["tile_ry", "sp", [-1, 1]], ["tile_rx", "sp", [-1, 1]], ["auto_unroll_max_step", "ot", 512], ["unroll_explicit", "ot", 1]]}, "result": [[0.02612445], 0, 2.5101921558380127, 1638966406.228215], "version": 0.2, "tvm_version": "0.8.dev0"}
{"input": ["cuda -keys=cuda,gpu -max_num_threads=1024 -thread_warp_size=32", "conv2d_nchw.cuda", [["TENSOR", [128, 336, 21, 21], "float32"], ["TENSOR", [336, 336, 1, 1], "float32"], 1, "VALID", 1, "float32"], {}], "config": {"index": 3219760, "code_hash": null, "entity": [["tile_f", "sp", [-1, 3, 28, 4]], ["tile_y", "sp", [-1, 7, 3, 1]], ["tile_x", "sp", [-1, 3, 7, 1]], ["tile_rc", "sp", [-1, 3]], ["tile_ry", "sp", [-1, 1]], ["tile_rx", "sp", [-1, 1]], ["auto_unroll_max_step", "ot", 512], ["unroll_explicit", "ot", 0]]}, "result": [[0.28608367500000004], 0, 3.9809389114379883, 1638966410.0980473], "version": 0.2, "tvm_version": "0.8.dev0"}
{"input": ["cuda -keys=cuda,gpu -max_num_threads=1024 -thread_warp_size=32", "conv2d_nchw.cuda", [["TENSOR", [128, 336, 21, 21], "float32"], ["TENSOR", [336, 336, 1, 1], "float32"], 1, "VALID", 1, "float32"], {}], "config": {"index": 9886066, "code_hash": null, "entity": [["tile_f", "sp", [-1, 8, 6, 7]], ["tile_y", "sp", [-1, 7, 3, 1]], ["tile_x", "sp", [-1, 1, 1, 21]], ["tile_rc", "sp", [-1, 14]], ["tile_ry", "sp", [-1, 1]], ["tile_rx", "sp", [-1, 1]], ["auto_unroll_max_step", "ot", 0], ["unroll_explicit", "ot", 1]]}, "result": [[1.7225237500000001], 0, 10.963379859924316, 1638966420.4717069], "version": 0.2, "tvm_version": "0.8.dev0"}
{"input": ["cuda -keys=cuda,gpu -max_num_threads=1024 -thread_warp_size=32", "conv2d_nchw.cuda", [["TENSOR", [128, 336, 21, 21], "float32"], ["TENSOR", [336, 336, 1, 1], "float32"], 1, "VALID", 1, "float32"], {}], "config": {"index": 1414238, "code_hash": null, "entity": [["tile_f", "sp", [-1, 7, 2, 3]], ["tile_y", "sp", [-1, 3, 1, 7]], ["tile_x", "sp", [-1, 3, 1, 7]], ["tile_rc", "sp", [-1, 16]], ["tile_ry", "sp", [-1, 1]], ["tile_rx", "sp", [-1, 1]], ["auto_unroll_max_step", "ot", 0], ["unroll_explicit", "ot", 0]]}, "result": [[11.139809425], 0, 60.10058259963989, 1638966479.9021082], "version": 0.2, "tvm_version": "0.8.dev0"}
{"input": ["cuda -keys=cuda,gpu -max_num_threads=1024 -thread_warp_size=32", "conv2d_nchw.cuda", [["TENSOR", [128, 336, 21, 21], "float32"], ["TENSOR", [336, 336, 1, 1], "float32"], 1, "VALID", 1, "float32"], {}], "config": {"index": 14597008, "code_hash": null, "entity": [["tile_f", "sp", [-1, 3, 4, 1]], ["tile_y", "sp", [-1, 7, 1, 1]], ["tile_x", "sp", [-1, 3, 1, 7]], ["tile_rc", "sp", [-1, 2]], ["tile_ry", "sp", [-1, 1]], ["tile_rx", "sp", [-1, 1]], ["auto_unroll_max_step", "ot", 1500], ["unroll_explicit", "ot", 1]]}, "result": [[1.797251825], 0, 14.209766387939453, 1638966492.0426452], "version": 0.2, "tvm_version": "0.8.dev0"}
{"input": ["cuda -keys=cuda,gpu -max_num_threads=1024 -thread_warp_size=32", "conv2d_nchw.cuda", [["TENSOR", [128, 336, 21, 21], "float32"], ["TENSOR", [336, 336, 1, 1], "float32"], 1, "VALID", 1, "float32"], {}], "config": {"index": 14685587, "code_hash": null, "entity": [["tile_f", "sp", [-1, 42, 1, 2]], ["tile_y", "sp", [-1, 1, 1, 1]], ["tile_x", "sp", [-1, 3, 7, 1]], ["tile_rc", "sp", [-1, 3]], ["tile_ry", "sp", [-1, 1]], ["tile_rx", "sp", [-1, 1]], ["auto_unroll_max_step", "ot", 1500], ["unroll_explicit", "ot", 1]]}, "result": [[0.076658625], 0, 3.682874917984009, 1638966494.6706057], "version": 0.2, "tvm_version": "0.8.dev0"}
{"input": ["cuda -keys=cuda,gpu -max_num_threads=1024 -thread_warp_size=32", "conv2d_nchw.cuda", [["TENSOR", [128, 336, 21, 21], "float32"], ["TENSOR", [336, 336, 1, 1], "float32"], 1, "VALID", 1, "float32"], {}], "config": {"index": 3641413, "code_hash": null, "entity": [["tile_f", "sp", [-1, 7, 3, 4]], ["tile_y", "sp", [-1, 1, 7, 1]], ["tile_x", "sp", [-1, 1, 7, 1]], ["tile_rc", "sp", [-1, 7]], ["tile_ry", "sp", [-1, 1]], ["tile_rx", "sp", [-1, 1]], ["auto_unroll_max_step", "ot", 512], ["unroll_explicit", "ot", 0]]}, "result": [[0.025853075], 0, 2.404385566711426, 1638966643.9160333], "version": 0.2, "tvm_version": "0.8.dev0"}
{"input": ["cuda -keys=cuda,gpu -max_num_threads=1024 -thread_warp_size=32", "conv2d_nchw.cuda", [["TENSOR", [128, 336, 21, 21], "float32"], ["TENSOR", [336, 336, 1, 1], "float32"], 1, "VALID", 1, "float32"], {}], "config": {"index": 12243013, "code_hash": null, "entity": [["tile_f", "sp", [-1, 7, 3, 4]], ["tile_y", "sp", [-1, 1, 7, 1]], ["tile_x", "sp", [-1, 1, 7, 1]], ["tile_rc", "sp", [-1, 7]], ["tile_ry", "sp", [-1, 1]], ["tile_rx", "sp", [-1, 1]], ["auto_unroll_max_step", "ot", 512], ["unroll_explicit", "ot", 1]]}, "result": [[0.025689675000000002], 0, 2.789926528930664, 1638966646.4415393], "version": 0.2, "tvm_version": "0.8.dev0"}
{"input": ["cuda -keys=cuda,gpu -max_num_threads=1024 -thread_warp_size=32", "conv2d_nchw.cuda", [["TENSOR", [128, 336, 21, 21], "float32"], ["TENSOR", [336, 336, 1, 1], "float32"], 1, "VALID", 1, "float32"], {}], "config": {"index": 12243018, "code_hash": null, "entity": [["tile_f", "sp", [-1, 7, 4, 4]], ["tile_y", "sp", [-1, 1, 7, 1]], ["tile_x", "sp", [-1, 1, 7, 1]], ["tile_rc", "sp", [-1, 7]], ["tile_ry", "sp", [-1, 1]], ["tile_rx", "sp", [-1, 1]], ["auto_unroll_max_step", "ot", 512], ["unroll_explicit", "ot", 1]]}, "result": [[0.02318158333333333], 0, 2.6884782314300537, 1638966649.0543363], "version": 0.2, "tvm_version": "0.8.dev0"}
{"input": ["cuda -keys=cuda,gpu -max_num_threads=1024 -thread_warp_size=32", "conv2d_nchw.cuda", [["TENSOR", [128, 336, 21, 21], "float32"], ["TENSOR", [336, 336, 1, 1], "float32"], 1, "VALID", 1, "float32"], {}], "config": {"index": 3641418, "code_hash": null, "entity": [["tile_f", "sp", [-1, 7, 4, 4]], ["tile_y", "sp", [-1, 1, 7, 1]], ["tile_x", "sp", [-1, 1, 7, 1]], ["tile_rc", "sp", [-1, 7]], ["tile_ry", "sp", [-1, 1]], ["tile_rx", "sp", [-1, 1]], ["auto_unroll_max_step", "ot", 512], ["unroll_explicit", "ot", 0]]}, "result": [[0.03836055], 0, 3.26776385307312, 1638966652.157342], "version": 0.2, "tvm_version": "0.8.dev0"}
{"input": ["cuda -keys=cuda,gpu -max_num_threads=1024 -thread_warp_size=32", "conv2d_nchw.cuda", [["TENSOR", [128, 336, 21, 21], "float32"], ["TENSOR", [336, 336, 1, 1], "float32"], 1, "VALID", 1, "float32"], {}], "config": {"index": 12226294, "code_hash": null, "entity": [["tile_f", "sp", [-1, 4, 3, 7]], ["tile_y", "sp", [-1, 1, 21, 1]], ["tile_x", "sp", [-1, 1, 3, 1]], ["tile_rc", "sp", [-1, 7]], ["tile_ry", "sp", [-1, 1]], ["tile_rx", "sp", [-1, 1]], ["auto_unroll_max_step", "ot", 512], ["unroll_explicit", "ot", 1]]}, "result": [[0.032897125], 0, 2.7456886768341064, 1638966654.7162359], "version": 0.2, "tvm_version": "0.8.dev0"}
{"input": ["cuda -keys=cuda,gpu -max_num_threads=1024 -thread_warp_size=32", "conv2d_nchw.cuda", [["TENSOR", [128, 336, 21, 21], "float32"], ["TENSOR", [336, 336, 1, 1], "float32"], 1, "VALID", 1, "float32"], {}], "config": {"index": 3624694, "code_hash": null, "entity": [["tile_f", "sp", [-1, 4, 3, 7]], ["tile_y", "sp", [-1, 1, 21, 1]], ["tile_x", "sp", [-1, 1, 3, 1]], ["tile_rc", "sp", [-1, 7]], ["tile_ry", "sp", [-1, 1]], ["tile_rx", "sp", [-1, 1]], ["auto_unroll_max_step", "ot", 512], ["unroll_explicit", "ot", 0]]}, "result": [[0.033183174999999995], 0, 2.5440449714660645, 1638966657.2190135], "version": 0.2, "tvm_version": "0.8.dev0"}
{"input": ["cuda -keys=cuda,gpu -max_num_threads=1024 -thread_warp_size=32", "conv2d_nchw.cuda", [["TENSOR", [128, 336, 21, 21], "float32"], ["TENSOR", [336, 336, 1, 1], "float32"], 1, "VALID", 1, "float32"], {}], "config": {"index": 3642059, "code_hash": null, "entity": [["tile_f", "sp", [-1, 3, 4, 7]], ["tile_y", "sp", [-1, 3, 7, 1]], ["tile_x", "sp", [-1, 1, 7, 1]], ["tile_rc", "sp", [-1, 7]], ["tile_ry", "sp", [-1, 1]], ["tile_rx", "sp", [-1, 1]], ["auto_unroll_max_step", "ot", 512], ["unroll_explicit", "ot", 0]]}, "result": [[0.017351433333333333], 0, 2.7293450832366943, 1638966659.7188046], "version": 0.2, "tvm_version": "0.8.dev0"}
{"input": ["cuda -keys=cuda,gpu -max_num_threads=1024 -thread_warp_size=32", "conv2d_nchw.cuda", [["TENSOR", [128, 336, 21, 21], "float32"], ["TENSOR", [336, 336, 1, 1], "float32"], 1, "VALID", 1, "float32"], {}], "config": {"index": 3498699, "code_hash": null, "entity": [["tile_f", "sp", [-1, 3, 4, 7]], ["tile_y", "sp", [-1, 3, 7, 1]], ["tile_x", "sp", [-1, 1, 7, 1]], ["tile_rc", "sp", [-1, 6]], ["tile_ry", "sp", [-1, 1]], ["tile_rx", "sp", [-1, 1]], ["auto_unroll_max_step", "ot", 512], ["unroll_explicit", "ot", 0]]}, "result": [[0.0138776375], 0, 2.694580316543579, 1638966662.1682663], "version": 0.2, "tvm_version": "0.8.dev0"}
{"input": ["cuda -keys=cuda,gpu -max_num_threads=1024 -thread_warp_size=32", "conv2d_nchw.cuda", [["TENSOR", [128, 336, 21, 21], "float32"], ["TENSOR", [336, 336, 1, 1], "float32"], 1, "VALID", 1, "float32"], {}], "config": {"index": 12100299, "code_hash": null, "entity": [["tile_f", "sp", [-1, 3, 4, 7]], ["tile_y", "sp", [-1, 3, 7, 1]], ["tile_x", "sp", [-1, 1, 7, 1]], ["tile_rc", "sp", [-1, 6]], ["tile_ry", "sp", [-1, 1]], ["tile_rx", "sp", [-1, 1]], ["auto_unroll_max_step", "ot", 512], ["unroll_explicit", "ot", 1]]}, "result": [[0.01454117142857143], 0, 2.942373752593994, 1638966664.59635], "version": 0.2, "tvm_version": "0.8.dev0"}
{"input": ["cuda -keys=cuda,gpu -max_num_threads=1024 -thread_warp_size=32", "conv2d_nchw.cuda", [["TENSOR", [128, 336, 21, 21], "float32"], ["TENSOR", [336, 336, 1, 1], "float32"], 1, "VALID", 1, "float32"], {}], "config": {"index": 12243659, "code_hash": null, "entity": [["tile_f", "sp", [-1, 3, 4, 7]], ["tile_y", "sp", [-1, 3, 7, 1]], ["tile_x", "sp", [-1, 1, 7, 1]], ["tile_rc", "sp", [-1, 7]], ["tile_ry", "sp", [-1, 1]], ["tile_rx", "sp", [-1, 1]], ["auto_unroll_max_step", "ot", 512], ["unroll_explicit", "ot", 1]]}, "result": [[0.014836128571428573], 0, 2.99189829826355, 1638966667.0288994], "version": 0.2, "tvm_version": "0.8.dev0"}
{"input": ["cuda -keys=cuda,gpu -max_num_threads=1024 -thread_warp_size=32", "conv2d_nchw.cuda", [["TENSOR", [128, 336, 21, 21], "float32"], ["TENSOR", [336, 336, 1, 1], "float32"], 1, "VALID", 1, "float32"], {}], "config": {"index": 3641288, "code_hash": null, "entity": [["tile_f", "sp", [-1, 14, 3, 2]], ["tile_y", "sp", [-1, 1, 7, 1]], ["tile_x", "sp", [-1, 1, 7, 1]], ["tile_rc", "sp", [-1, 7]], ["tile_ry", "sp", [-1, 1]], ["tile_rx", "sp", [-1, 1]], ["auto_unroll_max_step", "ot", 512], ["unroll_explicit", "ot", 0]]}, "result": [[0.018732683333333333], 0, 2.7743470668792725, 1638966670.059702], "version": 0.2, "tvm_version": "0.8.dev0"}
{"input": ["cuda -keys=cuda,gpu -max_num_threads=1024 -thread_warp_size=32", "conv2d_nchw.cuda", [["TENSOR", [128, 336, 21, 21], "float32"], ["TENSOR", [336, 336, 1, 1], "float32"], 1, "VALID", 1, "float32"], {}], "config": {"index": 12242888, "code_hash": null, "entity": [["tile_f", "sp", [-1, 14, 3, 2]], ["tile_y", "sp", [-1, 1, 7, 1]], ["tile_x", "sp", [-1, 1, 7, 1]], ["tile_rc", "sp", [-1, 7]], ["tile_ry", "sp", [-1, 1]], ["tile_rx", "sp", [-1, 1]], ["auto_unroll_max_step", "ot", 512], ["unroll_explicit", "ot", 1]]}, "result": [[0.01874285], 0, 2.7715702056884766, 1638966672.5767248], "version": 0.2, "tvm_version": "0.8.dev0"}
{"input": ["cuda -keys=cuda,gpu -max_num_threads=1024 -thread_warp_size=32", "conv2d_nchw.cuda", [["TENSOR", [128, 336, 21, 21], "float32"], ["TENSOR", [336, 336, 1, 1], "float32"], 1, "VALID", 1, "float32"], {}], "config": {"index": 12386248, "code_hash": null, "entity": [["tile_f", "sp", [-1, 14, 3, 2]], ["tile_y", "sp", [-1, 1, 7, 1]], ["tile_x", "sp", [-1, 1, 7, 1]], ["tile_rc", "sp", [-1, 8]], ["tile_ry", "sp", [-1, 1]], ["tile_rx", "sp", [-1, 1]], ["auto_unroll_max_step", "ot", 512], ["unroll_explicit", "ot", 1]]}, "result": [[0.0184246], 0, 3.7794480323791504, 1638966676.003794], "version": 0.2, "tvm_version": "0.8.dev0"}
{"input": ["cuda -keys=cuda,gpu -max_num_threads=1024 -thread_warp_size=32", "conv2d_nchw.cuda", [["TENSOR", [128, 336, 21, 21], "float32"], ["TENSOR", [336, 336, 1, 1], "float32"], 1, "VALID", 1, "float32"], {}], "config": {"index": 12243026, "code_hash": null, "entity": [["tile_f", "sp", [-1, 3, 7, 4]], ["tile_y", "sp", [-1, 1, 7, 1]], ["tile_x", "sp", [-1, 1, 7, 1]], ["tile_rc", "sp", [-1, 7]], ["tile_ry", "sp", [-1, 1]], ["tile_rx", "sp", [-1, 1]], ["auto_unroll_max_step", "ot", 512], ["unroll_explicit", "ot", 1]]}, "result": [[0.02653745], 0, 2.4720048904418945, 1638966678.2868898], "version": 0.2, "tvm_version": "0.8.dev0"}
{"input": ["cuda -keys=cuda,gpu -max_num_threads=1024 -thread_warp_size=32", "conv2d_nchw.cuda", [["TENSOR", [128, 336, 21, 21], "float32"], ["TENSOR", [336, 336, 1, 1], "float32"], 1, "VALID", 1, "float32"], {}], "config": {"index": 3641426, "code_hash": null, "entity": [["tile_f", "sp", [-1, 3, 7, 4]], ["tile_y", "sp", [-1, 1, 7, 1]], ["tile_x", "sp", [-1, 1, 7, 1]], ["tile_rc", "sp", [-1, 7]], ["tile_ry", "sp", [-1, 1]], ["tile_rx", "sp", [-1, 1]], ["auto_unroll_max_step", "ot", 512], ["unroll_explicit", "ot", 0]]}, "result": [[0.026186425], 0, 2.600766897201538, 1638966680.6862676], "version": 0.2, "tvm_version": "0.8.dev0"}
{"input": ["cuda -keys=cuda,gpu -max_num_threads=1024 -thread_warp_size=32", "conv2d_nchw.cuda", [["TENSOR", [128, 336, 21, 21], "float32"], ["TENSOR", [336, 336, 1, 1], "float32"], 1, "VALID", 1, "float32"], {}], "config": {"index": 3751691, "code_hash": null, "entity": [["tile_f", "sp", [-1, 4, 7, 3]], ["tile_y", "sp", [-1, 1, 7, 3]], ["tile_x", "sp", [-1, 7, 1, 1]], ["tile_rc", "sp", [-1, 8]], ["tile_ry", "sp", [-1, 1]], ["tile_rx", "sp", [-1, 1]], ["auto_unroll_max_step", "ot", 512], ["unroll_explicit", "ot", 0]]}, "result": [[0.05239945], 0, 3.09433913230896, 1638966683.4127054], "version": 0.2, "tvm_version": "0.8.dev0"}
{"input": ["cuda -keys=cuda,gpu -max_num_threads=1024 -thread_warp_size=32", "conv2d_nchw.cuda", [["TENSOR", [128, 336, 21, 21], "float32"], ["TENSOR", [336, 336, 1, 1], "float32"], 1, "VALID", 1, "float32"], {}], "config": {"index": 12353291, "code_hash": null, "entity": [["tile_f", "sp", [-1, 4, 7, 3]], ["tile_y", "sp", [-1, 1, 7, 3]], ["tile_x", "sp", [-1, 7, 1, 1]], ["tile_rc", "sp", [-1, 8]], ["tile_ry", "sp", [-1, 1]], ["tile_rx", "sp", [-1, 1]], ["auto_unroll_max_step", "ot", 512], ["unroll_explicit", "ot", 1]]}, "result": [[0.049543425], 0, 3.3310067653656006, 1638966685.739819], "version": 0.2, "tvm_version": "0.8.dev0"}
{"input": ["cuda -keys=cuda,gpu -max_num_threads=1024 -thread_warp_size=32", "conv2d_nchw.cuda", [["TENSOR", [128, 336, 21, 21], "float32"], ["TENSOR", [336, 336, 1, 1], "float32"], 1, "VALID", 1, "float32"], {}], "config": {"index": 12243660, "code_hash": null, "entity": [["tile_f", "sp", [-1, 4, 4, 7]], ["tile_y", "sp", [-1, 3, 7, 1]], ["tile_x", "sp", [-1, 1, 7, 1]], ["tile_rc", "sp", [-1, 7]], ["tile_ry", "sp", [-1, 1]], ["tile_rx", "sp", [-1, 1]], ["auto_unroll_max_step", "ot", 512], ["unroll_explicit", "ot", 1]]}, "result": [[0.0135756], 0, 2.80354380607605, 1638966687.8025842], "version": 0.2, "tvm_version": "0.8.dev0"}
{"input": ["cuda -keys=cuda,gpu -max_num_threads=1024 -thread_warp_size=32", "conv2d_nchw.cuda", [["TENSOR", [128, 336, 21, 21], "float32"], ["TENSOR", [336, 336, 1, 1], "float32"], 1, "VALID", 1, "float32"], {}], "config": {"index": 3642060, "code_hash": null, "entity": [["tile_f", "sp", [-1, 4, 4, 7]], ["tile_y", "sp", [-1, 3, 7, 1]], ["tile_x", "sp", [-1, 1, 7, 1]], ["tile_rc", "sp", [-1, 7]], ["tile_ry", "sp", [-1, 1]], ["tile_rx", "sp", [-1, 1]], ["auto_unroll_max_step", "ot", 512], ["unroll_explicit", "ot", 0]]}, "result": [[0.014379200000000002], 0, 3.4283106327056885, 1638966690.883537], "version": 0.2, "tvm_version": "0.8.dev0"}
{"input": ["cuda -keys=cuda,gpu -max_num_threads=1024 -thread_warp_size=32", "conv2d_nchw.cuda", [["TENSOR", [128, 336, 21, 21], "float32"], ["TENSOR", [336, 336, 1, 1], "float32"], 1, "VALID", 1, "float32"], {}], "config": {"index": 12242971, "code_hash": null, "entity": [["tile_f", "sp", [-1, 4, 7, 3]], ["tile_y", "sp", [-1, 1, 7, 1]], ["tile_x", "sp", [-1, 1, 7, 1]], ["tile_rc", "sp", [-1, 7]], ["tile_ry", "sp", [-1, 1]], ["tile_rx", "sp", [-1, 1]], ["auto_unroll_max_step", "ot", 512], ["unroll_explicit", "ot", 1]]}, "result": [[0.02636925], 0, 2.5233819484710693, 1638966693.0982094], "version": 0.2, "tvm_version": "0.8.dev0"}
{"input": ["cuda -keys=cuda,gpu -max_num_threads=1024 -thread_warp_size=32", "conv2d_nchw.cuda", [["TENSOR", [128, 336, 21, 21], "float32"], ["TENSOR", [336, 336, 1, 1], "float32"], 1, "VALID", 1, "float32"], {}], "config": {"index": 3641371, "code_hash": null, "entity": [["tile_f", "sp", [-1, 4, 7, 3]], ["tile_y", "sp", [-1, 1, 7, 1]], ["tile_x", "sp", [-1, 1, 7, 1]], ["tile_rc", "sp", [-1, 7]], ["tile_ry", "sp", [-1, 1]], ["tile_rx", "sp", [-1, 1]], ["auto_unroll_max_step", "ot", 512], ["unroll_explicit", "ot", 0]]}, "result": [[0.025429925], 0, 3.0460736751556396, 1638966696.2323806], "version": 0.2, "tvm_version": "0.8.dev0"}
{"input": ["cuda -keys=cuda,gpu -max_num_threads=1024 -thread_warp_size=32", "conv2d_nchw.cuda", [["TENSOR", [128, 336, 21, 21], "float32"], ["TENSOR", [336, 336, 1, 1], "float32"], 1, "VALID", 1, "float32"], {}], "config": {"index": 3742787, "code_hash": null, "entity": [["tile_f", "sp", [-1, 4, 7, 4]], ["tile_y", "sp", [-1, 1, 7, 3]], ["tile_x", "sp", [-1, 3, 1, 1]], ["tile_rc", "sp", [-1, 8]], ["tile_ry", "sp", [-1, 1]], ["tile_rx", "sp", [-1, 1]], ["auto_unroll_max_step", "ot", 512], ["unroll_explicit", "ot", 0]]}, "result": [[0.02035735], 0, 2.7227842807769775, 1638966698.6789892], "version": 0.2, "tvm_version": "0.8.dev0"}
{"input": ["cuda -keys=cuda,gpu -max_num_threads=1024 -thread_warp_size=32", "conv2d_nchw.cuda", [["TENSOR", [128, 336, 21, 21], "float32"], ["TENSOR", [336, 336, 1, 1], "float32"], 1, "VALID", 1, "float32"], {}], "config": {"index": 12344387, "code_hash": null, "entity": [["tile_f", "sp", [-1, 4, 7, 4]], ["tile_y", "sp", [-1, 1, 7, 3]], ["tile_x", "sp", [-1, 3, 1, 1]], ["tile_rc", "sp", [-1, 8]], ["tile_ry", "sp", [-1, 1]], ["tile_rx", "sp", [-1, 1]], ["auto_unroll_max_step", "ot", 512], ["unroll_explicit", "ot", 1]]}, "result": [[0.028089275], 0, 3.6264772415161133, 1638966701.7259305], "version": 0.2, "tvm_version": "0.8.dev0"}
{"input": ["cuda -keys=cuda,gpu -max_num_threads=1024 -thread_warp_size=32", "conv2d_nchw.cuda", [["TENSOR", [128, 336, 21, 21], "float32"], ["TENSOR", [336, 336, 1, 1], "float32"], 1, "VALID", 1, "float32"], {}], "config": {"index": 3498698, "code_hash": null, "entity": [["tile_f", "sp", [-1, 2, 4, 7]], ["tile_y", "sp", [-1, 3, 7, 1]], ["tile_x", "sp", [-1, 1, 7, 1]], ["tile_rc", "sp", [-1, 6]], ["tile_ry", "sp", [-1, 1]], ["tile_rx", "sp", [-1, 1]], ["auto_unroll_max_step", "ot", 512], ["unroll_explicit", "ot", 0]]}, "result": [[0.018984066666666664], 0, 2.618417263031006, 1638966704.0497024], "version": 0.2, "tvm_version": "0.8.dev0"}
{"input": ["cuda -keys=cuda,gpu -max_num_threads=1024 -thread_warp_size=32", "conv2d_nchw.cuda", [["TENSOR", [128, 336, 21, 21], "float32"], ["TENSOR", [336, 336, 1, 1], "float32"], 1, "VALID", 1, "float32"], {}], "config": {"index": 12100298, "code_hash": null, "entity": [["tile_f", "sp", [-1, 2, 4, 7]], ["tile_y", "sp", [-1, 3, 7, 1]], ["tile_x", "sp", [-1, 1, 7, 1]], ["tile_rc", "sp", [-1, 6]], ["tile_ry", "sp", [-1, 1]], ["tile_rx", "sp", [-1, 1]], ["auto_unroll_max_step", "ot", 512], ["unroll_explicit", "ot", 1]]}, "result": [[0.017642883333333335], 0, 2.1432347297668457, 1638966707.2065525], "version": 0.2, "tvm_version": "0.8.dev0"}
{"input": ["cuda -keys=cuda,gpu -max_num_threads=1024 -thread_warp_size=32", "conv2d_nchw.cuda", [["TENSOR", [128, 336, 21, 21], "float32"], ["TENSOR", [336, 336, 1, 1], "float32"], 1, "VALID", 1, "float32"], {}], "config": {"index": 12369012, "code_hash": null, "entity": [["tile_f", "sp", [-1, 4, 3, 4]], ["tile_y", "sp", [-1, 3, 7, 1]], ["tile_x", "sp", [-1, 1, 3, 1]], ["tile_rc", "sp", [-1, 8]], ["tile_ry", "sp", [-1, 1]], ["tile_rx", "sp", [-1, 1]], ["auto_unroll_max_step", "ot", 512], ["unroll_explicit", "ot", 1]]}, "result": [[0.013071044444444443], 0, 2.7681782245635986, 1638966709.4992933], "version": 0.2, "tvm_version": "0.8.dev0"}
{"input": ["cuda -keys=cuda,gpu -max_num_threads=1024 -thread_warp_size=32", "conv2d_nchw.cuda", [["TENSOR", [128, 336, 21, 21], "float32"], ["TENSOR", [336, 336, 1, 1], "float32"], 1, "VALID", 1, "float32"], {}], "config": {"index": 3767412, "code_hash": null, "entity": [["tile_f", "sp", [-1, 4, 3, 4]], ["tile_y", "sp", [-1, 3, 7, 1]], ["tile_x", "sp", [-1, 1, 3, 1]], ["tile_rc", "sp", [-1, 8]], ["tile_ry", "sp", [-1, 1]], ["tile_rx", "sp", [-1, 1]], ["auto_unroll_max_step", "ot", 512], ["unroll_explicit", "ot", 0]]}, "result": [[0.0129444625], 0, 3.406095027923584, 1638966712.649065], "version": 0.2, "tvm_version": "0.8.dev0"}
{"input": ["cuda -keys=cuda,gpu -max_num_threads=1024 -thread_warp_size=32", "conv2d_nchw.cuda", [["TENSOR", [128, 336, 21, 21], "float32"], ["TENSOR", [336, 336, 1, 1], "float32"], 1, "VALID", 1, "float32"], {}], "config": {"index": 3597814, "code_hash": null, "entity": [["tile_f", "sp", [-1, 4, 3, 7]], ["tile_y", "sp", [-1, 1, 21, 1]], ["tile_x", "sp", [-1, 3, 1, 1]], ["tile_rc", "sp", [-1, 7]], ["tile_ry", "sp", [-1, 1]], ["tile_rx", "sp", [-1, 1]], ["auto_unroll_max_step", "ot", 512], ["unroll_explicit", "ot", 0]]}, "result": [[0.016872750000000002], 0, 2.5244367122650146, 1638966715.1251178], "version": 0.2, "tvm_version": "0.8.dev0"}
{"input": ["cuda -keys=cuda,gpu -max_num_threads=1024 -thread_warp_size=32", "conv2d_nchw.cuda", [["TENSOR", [128, 336, 21, 21], "float32"], ["TENSOR", [336, 336, 1, 1], "float32"], 1, "VALID", 1, "float32"], {}], "config": {"index": 12199414, "code_hash": null, "entity": [["tile_f", "sp", [-1, 4, 3, 7]], ["tile_y", "sp", [-1, 1, 21, 1]], ["tile_x", "sp", [-1, 3, 1, 1]], ["tile_rc", "sp", [-1, 7]], ["tile_ry", "sp", [-1, 1]], ["tile_rx", "sp", [-1, 1]], ["auto_unroll_max_step", "ot", 512], ["unroll_explicit", "ot", 1]]}, "result": [[0.016148385714285715], 0, 2.68656063079834, 1638966717.6331534], "version": 0.2, "tvm_version": "0.8.dev0"}
{"input": ["cuda -keys=cuda,gpu -max_num_threads=1024 -thread_warp_size=32", "conv2d_nchw.cuda", [["TENSOR", [128, 336, 21, 21], "float32"], ["TENSOR", [336, 336, 1, 1], "float32"], 1, "VALID", 1, "float32"], {}], "config": {"index": 3784773, "code_hash": null, "entity": [["tile_f", "sp", [-1, 7, 3, 4]], ["tile_y", "sp", [-1, 1, 7, 1]], ["tile_x", "sp", [-1, 1, 7, 1]], ["tile_rc", "sp", [-1, 8]], ["tile_ry", "sp", [-1, 1]], ["tile_rx", "sp", [-1, 1]], ["auto_unroll_max_step", "ot", 512], ["unroll_explicit", "ot", 0]]}, "result": [[0.02127403333333333], 0, 2.546783685684204, 1638966720.0605357], "version": 0.2, "tvm_version": "0.8.dev0"}
{"input": ["cuda -keys=cuda,gpu -max_num_threads=1024 -thread_warp_size=32", "conv2d_nchw.cuda", [["TENSOR", [128, 336, 21, 21], "float32"], ["TENSOR", [336, 336, 1, 1], "float32"], 1, "VALID", 1, "float32"], {}], "config": {"index": 12225734, "code_hash": null, "entity": [["tile_f", "sp", [-1, 4, 3, 7]], ["tile_y", "sp", [-1, 3, 7, 1]], ["tile_x", "sp", [-1, 1, 3, 1]], ["tile_rc", "sp", [-1, 7]], ["tile_ry", "sp", [-1, 1]], ["tile_rx", "sp", [-1, 1]], ["auto_unroll_max_step", "ot", 512], ["unroll_explicit", "ot", 1]]}, "result": [[0.012603755555555556], 0, 3.408712148666382, 1638966723.1647851], "version": 0.2, "tvm_version": "0.8.dev0"}
{"input": ["cuda -keys=cuda,gpu -max_num_threads=1024 -thread_warp_size=32", "conv2d_nchw.cuda", [["TENSOR", [128, 336, 21, 21], "float32"], ["TENSOR", [336, 336, 1, 1], "float32"], 1, "VALID", 1, "float32"], {}], "config": {"index": 3624134, "code_hash": null, "entity": [["tile_f", "sp", [-1, 4, 3, 7]], ["tile_y", "sp", [-1, 3, 7, 1]], ["tile_x", "sp", [-1, 1, 3, 1]], ["tile_rc", "sp", [-1, 7]], ["tile_ry", "sp", [-1, 1]], ["tile_rx", "sp", [-1, 1]], ["auto_unroll_max_step", "ot", 512], ["unroll_explicit", "ot", 0]]}, "result": [[0.015073142857142856], 0, 3.040311813354492, 1638966726.1391096], "version": 0.2, "tvm_version": "0.8.dev0"}
{"input": ["cuda -keys=cuda,gpu -max_num_threads=1024 -thread_warp_size=32", "conv2d_nchw.cuda", [["TENSOR", [128, 336, 21, 21], "float32"], ["TENSOR", [336, 336, 1, 1], "float32"], 1, "VALID", 1, "float32"], {}], "config": {"index": 9375813, "code_hash": null, "entity": [["tile_f", "sp", [-1, 7, 3, 4]], ["tile_y", "sp", [-1, 1, 7, 1]], ["tile_x", "sp", [-1, 1, 7, 1]], ["tile_rc", "sp", [-1, 7]], ["tile_ry", "sp", [-1, 1]], ["tile_rx", "sp", [-1, 1]], ["auto_unroll_max_step", "ot", 0], ["unroll_explicit", "ot", 1]]}, "result": [[0.03289065], 0, 2.408022403717041, 1638966728.6430988], "version": 0.2, "tvm_version": "0.8.dev0"}
{"input": ["cuda -keys=cuda,gpu -max_num_threads=1024 -thread_warp_size=32", "conv2d_nchw.cuda", [["TENSOR", [128, 336, 21, 21], "float32"], ["TENSOR", [336, 336, 1, 1], "float32"], 1, "VALID", 1, "float32"], {}], "config": {"index": 774213, "code_hash": null, "entity": [["tile_f", "sp", [-1, 7, 3, 4]], ["tile_y", "sp", [-1, 1, 7, 1]], ["tile_x", "sp", [-1, 1, 7, 1]], ["tile_rc", "sp", [-1, 7]], ["tile_ry", "sp", [-1, 1]], ["tile_rx", "sp", [-1, 1]], ["auto_unroll_max_step", "ot", 0], ["unroll_explicit", "ot", 0]]}, "result": [[0.029695125], 0, 3.0668039321899414, 1638966731.4860418], "version": 0.2, "tvm_version": "0.8.dev0"}
{"input": ["cuda -keys=cuda,gpu -max_num_threads=1024 -thread_warp_size=32", "conv2d_nchw.cuda", [["TENSOR", [128, 336, 21, 21], "float32"], ["TENSOR", [336, 336, 1, 1], "float32"], 1, "VALID", 1, "float32"], {}], "config": {"index": 9375688, "code_hash": null, "entity": [["tile_f", "sp", [-1, 14, 3, 2]], ["tile_y", "sp", [-1, 1, 7, 1]], ["tile_x", "sp", [-1, 1, 7, 1]], ["tile_rc", "sp", [-1, 7]], ["tile_ry", "sp", [-1, 1]], ["tile_rx", "sp", [-1, 1]], ["auto_unroll_max_step", "ot", 0], ["unroll_explicit", "ot", 1]]}, "result": [[0.02665785], 0, 2.501605987548828, 1638966734.0166519], "version": 0.2, "tvm_version": "0.8.dev0"}
{"input": ["cuda -keys=cuda,gpu -max_num_threads=1024 -thread_warp_size=32", "conv2d_nchw.cuda", [["TENSOR", [128, 336, 21, 21], "float32"], ["TENSOR", [336, 336, 1, 1], "float32"], 1, "VALID", 1, "float32"], {}], "config": {"index": 774088, "code_hash": null, "entity": [["tile_f", "sp", [-1, 14, 3, 2]], ["tile_y", "sp", [-1, 1, 7, 1]], ["tile_x", "sp", [-1, 1, 7, 1]], ["tile_rc", "sp", [-1, 7]], ["tile_ry", "sp", [-1, 1]], ["tile_rx", "sp", [-1, 1]], ["auto_unroll_max_step", "ot", 0], ["unroll_explicit", "ot", 0]]}, "result": [[0.0272262], 0, 3.1446659564971924, 1638966737.0429158], "version": 0.2, "tvm_version": "0.8.dev0"}
{"input": ["cuda -keys=cuda,gpu -max_num_threads=1024 -thread_warp_size=32", "conv2d_nchw.cuda", [["TENSOR", [128, 336, 21, 21], "float32"], ["TENSOR", [336, 336, 1, 1], "float32"], 1, "VALID", 1, "float32"], {}], "config": {"index": 6795346, "code_hash": null, "entity": [["tile_f", "sp", [-1, 3, 7, 4]], ["tile_y", "sp", [-1, 1, 7, 1]], ["tile_x", "sp", [-1, 1, 7, 1]], ["tile_rc", "sp", [-1, 12]], ["tile_ry", "sp", [-1, 1]], ["tile_rx", "sp", [-1, 1]], ["auto_unroll_max_step", "ot", 1500], ["unroll_explicit", "ot", 0]]}, "result": [[0.0177881], 0, 2.379589557647705, 1638966739.459489], "version": 0.2, "tvm_version": "0.8.dev0"}
{"input": ["cuda -keys=cuda,gpu -max_num_threads=1024 -thread_warp_size=32", "conv2d_nchw.cuda", [["TENSOR", [128, 336, 21, 21], "float32"], ["TENSOR", [336, 336, 1, 1], "float32"], 1, "VALID", 1, "float32"], {}], "config": {"index": 15396946, "code_hash": null, "entity": [["tile_f", "sp", [-1, 3, 7, 4]], ["tile_y", "sp", [-1, 1, 7, 1]], ["tile_x", "sp", [-1, 1, 7, 1]], ["tile_rc", "sp", [-1, 12]], ["tile_ry", "sp", [-1, 1]], ["tile_rx", "sp", [-1, 1]], ["auto_unroll_max_step", "ot", 1500], ["unroll_explicit", "ot", 1]]}, "result": [[0.020253133333333333], 0, 3.362384080886841, 1638966742.6712224], "version": 0.2, "tvm_version": "0.8.dev0"}
{"input": ["cuda -keys=cuda,gpu -max_num_threads=1024 -thread_warp_size=32", "conv2d_nchw.cuda", [["TENSOR", [128, 336, 21, 21], "float32"], ["TENSOR", [336, 336, 1, 1], "float32"], 1, "VALID", 1, "float32"], {}], "config": {"index": 3389433, "code_hash": null, "entity": [["tile_f", "sp", [-1, 2, 14, 4]], ["tile_y", "sp", [-1, 1, 3, 1]], ["tile_x", "sp", [-1, 7, 1, 3]], ["tile_rc", "sp", [-1, 4]], ["tile_ry", "sp", [-1, 1]], ["tile_rx", "sp", [-1, 1]], ["auto_unroll_max_step", "ot", 512], ["unroll_explicit", "ot", 0]]}, "result": [[0.021410833333333334], 0, 2.778164863586426, 1638966745.228221], "version": 0.2, "tvm_version": "0.8.dev0"}
{"input": ["cuda -keys=cuda,gpu -max_num_threads=1024 -thread_warp_size=32", "conv2d_nchw.cuda", [["TENSOR", [128, 336, 21, 21], "float32"], ["TENSOR", [336, 336, 1, 1], "float32"], 1, "VALID", 1, "float32"], {}], "config": {"index": 11991033, "code_hash": null, "entity": [["tile_f", "sp", [-1, 2, 14, 4]], ["tile_y", "sp", [-1, 1, 3, 1]], ["tile_x", "sp", [-1, 7, 1, 3]], ["tile_rc", "sp", [-1, 4]], ["tile_ry", "sp", [-1, 1]], ["tile_rx", "sp", [-1, 1]], ["auto_unroll_max_step", "ot", 512], ["unroll_explicit", "ot", 1]]}, "result": [[0.020896566666666668], 0, 3.8278117179870605, 1638966748.4435723], "version": 0.2, "tvm_version": "0.8.dev0"}
{"input": ["cuda -keys=cuda,gpu -max_num_threads=1024 -thread_warp_size=32", "conv2d_nchw.cuda", [["TENSOR", [128, 336, 21, 21], "float32"], ["TENSOR", [336, 336, 1, 1], "float32"], 1, "VALID", 1, "float32"], {}], "config": {"index": 3641278, "code_hash": null, "entity": [["tile_f", "sp", [-1, 14, 2, 2]], ["tile_y", "sp", [-1, 1, 7, 1]], ["tile_x", "sp", [-1, 1, 7, 1]], ["tile_rc", "sp", [-1, 7]], ["tile_ry", "sp", [-1, 1]], ["tile_rx", "sp", [-1, 1]], ["auto_unroll_max_step", "ot", 512], ["unroll_explicit", "ot", 0]]}, "result": [[0.02118725], 0, 2.5730128288269043, 1638966750.6527586], "version": 0.2, "tvm_version": "0.8.dev0"}
{"input": ["cuda -keys=cuda,gpu -max_num_threads=1024 -thread_warp_size=32", "conv2d_nchw.cuda", [["TENSOR", [128, 336, 21, 21], "float32"], ["TENSOR", [336, 336, 1, 1], "float32"], 1, "VALID", 1, "float32"], {}], "config": {"index": 12242878, "code_hash": null, "entity": [["tile_f", "sp", [-1, 14, 2, 2]], ["tile_y", "sp", [-1, 1, 7, 1]], ["tile_x", "sp", [-1, 1, 7, 1]], ["tile_rc", "sp", [-1, 7]], ["tile_ry", "sp", [-1, 1]], ["tile_rx", "sp", [-1, 1]], ["auto_unroll_max_step", "ot", 512], ["unroll_explicit", "ot", 1]]}, "result": [[0.021822366666666666], 0, 2.6969010829925537, 1638966753.0616457], "version": 0.2, "tvm_version": "0.8.dev0"}
{"input": ["cuda -keys=cuda,gpu -max_num_threads=1024 -thread_warp_size=32", "conv2d_nchw.cuda", [["TENSOR", [128, 336, 21, 21], "float32"], ["TENSOR", [336, 336, 1, 1], "float32"], 1, "VALID", 1, "float32"], {}], "config": {"index": 12243100, "code_hash": null, "entity": [["tile_f", "sp", [-1, 4, 4, 7]], ["tile_y", "sp", [-1, 1, 7, 1]], ["tile_x", "sp", [-1, 1, 7, 1]], ["tile_rc", "sp", [-1, 7]], ["tile_ry", "sp", [-1, 1]], ["tile_rx", "sp", [-1, 1]], ["auto_unroll_max_step", "ot", 512], ["unroll_explicit", "ot", 1]]}, "result": [[0.030003175], 0, 2.5234804153442383, 1638966755.2093916], "version": 0.2, "tvm_version": "0.8.dev0"}
{"input": ["cuda -keys=cuda,gpu -max_num_threads=1024 -thread_warp_size=32", "conv2d_nchw.cuda", [["TENSOR", [128, 336, 21, 21], "float32"], ["TENSOR", [336, 336, 1, 1], "float32"], 1, "VALID", 1, "float32"], {}], "config": {"index": 3641500, "code_hash": null, "entity": [["tile_f", "sp", [-1, 4, 4, 7]], ["tile_y", "sp", [-1, 1, 7, 1]], ["tile_x", "sp", [-1, 1, 7, 1]], ["tile_rc", "sp", [-1, 7]], ["tile_ry", "sp", [-1, 1]], ["tile_rx", "sp", [-1, 1]], ["auto_unroll_max_step", "ot", 512], ["unroll_explicit", "ot", 0]]}, "result": [[0.034722], 0, 3.0945582389831543, 1638966758.1834066], "version": 0.2, "tvm_version": "0.8.dev0"}
{"input": ["cuda -keys=cuda,gpu -max_num_threads=1024 -thread_warp_size=32", "conv2d_nchw.cuda", [["TENSOR", [128, 336, 21, 21], "float32"], ["TENSOR", [336, 336, 1, 1], "float32"], 1, "VALID", 1, "float32"], {}], "config": {"index": 774218, "code_hash": null, "entity": [["tile_f", "sp", [-1, 7, 4, 4]], ["tile_y", "sp", [-1, 1, 7, 1]], ["tile_x", "sp", [-1, 1, 7, 1]], ["tile_rc", "sp", [-1, 7]], ["tile_ry", "sp", [-1, 1]], ["tile_rx", "sp", [-1, 1]], ["auto_unroll_max_step", "ot", 0], ["unroll_explicit", "ot", 0]]}, "result": [[0.037334525], 0, 2.542433977127075, 1638966760.6757512], "version": 0.2, "tvm_version": "0.8.dev0"}
{"input": ["cuda -keys=cuda,gpu -max_num_threads=1024 -thread_warp_size=32", "conv2d_nchw.cuda", [["TENSOR", [128, 336, 21, 21], "float32"], ["TENSOR", [336, 336, 1, 1], "float32"], 1, "VALID", 1, "float32"], {}], "config": {"index": 9375818, "code_hash": null, "entity": [["tile_f", "sp", [-1, 7, 4, 4]], ["tile_y", "sp", [-1, 1, 7, 1]], ["tile_x", "sp", [-1, 1, 7, 1]], ["tile_rc", "sp", [-1, 7]], ["tile_ry", "sp", [-1, 1]], ["tile_rx", "sp", [-1, 1]], ["auto_unroll_max_step", "ot", 0], ["unroll_explicit", "ot", 1]]}, "result": [[0.037276975], 0, 2.3102574348449707, 1638966762.822419], "version": 0.2, "tvm_version": "0.8.dev0"}
{"input": ["cuda -keys=cuda,gpu -max_num_threads=1024 -thread_warp_size=32", "conv2d_nchw.cuda", [["TENSOR", [128, 336, 21, 21], "float32"], ["TENSOR", [336, 336, 1, 1], "float32"], 1, "VALID", 1, "float32"], {}], "config": {"index": 12297776, "code_hash": null, "entity": [["tile_f", "sp", [-1, 14, 4, 2]], ["tile_y", "sp", [-1, 1, 21, 1]], ["tile_x", "sp", [-1, 1, 1, 7]], ["tile_rc", "sp", [-1, 7]], ["tile_ry", "sp", [-1, 1]], ["tile_rx", "sp", [-1, 1]], ["auto_unroll_max_step", "ot", 512], ["unroll_explicit", "ot", 1]]}, "result": [[0.0185705], 0, 2.8845152854919434, 1638966765.250447], "version": 0.2, "tvm_version": "0.8.dev0"}
{"input": ["cuda -keys=cuda,gpu -max_num_threads=1024 -thread_warp_size=32", "conv2d_nchw.cuda", [["TENSOR", [128, 336, 21, 21], "float32"], ["TENSOR", [336, 336, 1, 1], "float32"], 1, "VALID", 1, "float32"], {}], "config": {"index": 3696176, "code_hash": null, "entity": [["tile_f", "sp", [-1, 14, 4, 2]], ["tile_y", "sp", [-1, 1, 21, 1]], ["tile_x", "sp", [-1, 1, 1, 7]], ["tile_rc", "sp", [-1, 7]], ["tile_ry", "sp", [-1, 1]], ["tile_rx", "sp", [-1, 1]], ["auto_unroll_max_step", "ot", 512], ["unroll_explicit", "ot", 0]]}, "result": [[0.0180767], 0, 2.6443846225738525, 1638966767.564277], "version": 0.2, "tvm_version": "0.8.dev0"}
{"input": ["cuda -keys=cuda,gpu -max_num_threads=1024 -thread_warp_size=32", "conv2d_nchw.cuda", [["TENSOR", [128, 336, 21, 21], "float32"], ["TENSOR", [336, 336, 1, 1], "float32"], 1, "VALID", 1, "float32"], {}], "config": {"index": 12251978, "code_hash": null, "entity": [["tile_f", "sp", [-1, 7, 4, 4]], ["tile_y", "sp", [-1, 1, 7, 1]], ["tile_x", "sp", [-1, 3, 7, 1]], ["tile_rc", "sp", [-1, 7]], ["tile_ry", "sp", [-1, 1]], ["tile_rx", "sp", [-1, 1]], ["auto_unroll_max_step", "ot", 512], ["unroll_explicit", "ot", 1]]}, "result": [[0.014652314285714285], 0, 1.9964163303375244, 1638966779.8063734], "version": 0.2, "tvm_version": "0.8.dev0"}
{"input": ["cuda -keys=cuda,gpu -max_num_threads=1024 -thread_warp_size=32", "conv2d_nchw.cuda", [["TENSOR", [128, 336, 21, 21], "float32"], ["TENSOR", [336, 336, 1, 1], "float32"], 1, "VALID", 1, "float32"], {}], "config": {"index": 3650378, "code_hash": null, "entity": [["tile_f", "sp", [-1, 7, 4, 4]], ["tile_y", "sp", [-1, 1, 7, 1]], ["tile_x", "sp", [-1, 3, 7, 1]], ["tile_rc", "sp", [-1, 7]], ["tile_ry", "sp", [-1, 1]], ["tile_rx", "sp", [-1, 1]], ["auto_unroll_max_step", "ot", 512], ["unroll_explicit", "ot", 0]]}, "result": [[0.015037614285714287], 0, 2.5164706707000732, 1638966782.1380584], "version": 0.2, "tvm_version": "0.8.dev0"}
{"input": ["cuda -keys=cuda,gpu -max_num_threads=1024 -thread_warp_size=32", "conv2d_nchw.cuda", [["TENSOR", [128, 336, 21, 21], "float32"], ["TENSOR", [336, 336, 1, 1], "float32"], 1, "VALID", 1, "float32"], {}], "config": {"index": 12243094, "code_hash": null, "entity": [["tile_f", "sp", [-1, 4, 3, 7]], ["tile_y", "sp", [-1, 1, 7, 1]], ["tile_x", "sp", [-1, 1, 7, 1]], ["tile_rc", "sp", [-1, 7]], ["tile_ry", "sp", [-1, 1]], ["tile_rx", "sp", [-1, 1]], ["auto_unroll_max_step", "ot", 512], ["unroll_explicit", "ot", 1]]}, "result": [[0.027107125], 0, 2.492417335510254, 1638966784.440277], "version": 0.2, "tvm_version": "0.8.dev0"}
{"input": ["cuda -keys=cuda,gpu -max_num_threads=1024 -thread_warp_size=32", "conv2d_nchw.cuda", [["TENSOR", [128, 336, 21, 21], "float32"], ["TENSOR", [336, 336, 1, 1], "float32"], 1, "VALID", 1, "float32"], {}], "config": {"index": 3641494, "code_hash": null, "entity": [["tile_f", "sp", [-1, 4, 3, 7]], ["tile_y", "sp", [-1, 1, 7, 1]], ["tile_x", "sp", [-1, 1, 7, 1]], ["tile_rc", "sp", [-1, 7]], ["tile_ry", "sp", [-1, 1]], ["tile_rx", "sp", [-1, 1]], ["auto_unroll_max_step", "ot", 512], ["unroll_explicit", "ot", 0]]}, "result": [[0.026823125], 0, 2.3250365257263184, 1638966787.172465], "version": 0.2, "tvm_version": "0.8.dev0"}
{"input": ["cuda -keys=cuda,gpu -max_num_threads=1024 -thread_warp_size=32", "conv2d_nchw.cuda", [["TENSOR", [128, 336, 21, 21], "float32"], ["TENSOR", [336, 336, 1, 1], "float32"], 1, "VALID", 1, "float32"], {}], "config": {"index": 3624052, "code_hash": null, "entity": [["tile_f", "sp", [-1, 4, 3, 4]], ["tile_y", "sp", [-1, 3, 7, 1]], ["tile_x", "sp", [-1, 1, 3, 1]], ["tile_rc", "sp", [-1, 7]], ["tile_ry", "sp", [-1, 1]], ["tile_rx", "sp", [-1, 1]], ["auto_unroll_max_step", "ot", 512], ["unroll_explicit", "ot", 0]]}, "result": [[0.01119974], 0, 3.209967613220215, 1638966790.0194974], "version": 0.2, "tvm_version": "0.8.dev0"}
{"input": ["cuda -keys=cuda,gpu -max_num_threads=1024 -thread_warp_size=32", "conv2d_nchw.cuda", [["TENSOR", [128, 336, 21, 21], "float32"], ["TENSOR", [336, 336, 1, 1], "float32"], 1, "VALID", 1, "float32"], {}], "config": {"index": 3623506, "code_hash": null, "entity": [["tile_f", "sp", [-1, 3, 7, 4]], ["tile_y", "sp", [-1, 1, 7, 1]], ["tile_x", "sp", [-1, 1, 3, 1]], ["tile_rc", "sp", [-1, 7]], ["tile_ry", "sp", [-1, 1]], ["tile_rx", "sp", [-1, 1]], ["auto_unroll_max_step", "ot", 512], ["unroll_explicit", "ot", 0]]}, "result": [[0.03531845], 0, 2.4217307567596436, 1638966792.8181372], "version": 0.2, "tvm_version": "0.8.dev0"}
