artifacts/Table3/tvm/autotvm/conv/conv2d_128_336_42_42_168_1_1_1_0.log
{"input": ["cuda -keys=cuda,gpu -max_num_threads=1024 -thread_warp_size=32", "conv2d_nchw.cuda", [["TENSOR", [128, 336, 42, 42], "float32"], ["TENSOR", [168, 336, 1, 1], "float32"], 1, "SAME", 1, "float32"], {}], "config": {"index": 88802650, "code_hash": null, "entity": [["tile_f", "sp", [-1, 1, 1, 2]], ["tile_y", "sp", [-1, 7, 1, 1]], ["tile_x", "sp", [-1, 1, 1, 7]], ["tile_rc", "sp", [-1, 12]], ["tile_ry", "sp", [-1, 1]], ["tile_rx", "sp", [-1, 1]], ["auto_unroll_max_step", "ot", 0], ["unroll_explicit", "ot", 1]]}, "result": [[6.1636747], 0, 34.72532320022583, 1639040312.321908], "version": 0.2, "tvm_version": "0.8.dev0"}
{"input": ["cuda -keys=cuda,gpu -max_num_threads=1024 -thread_warp_size=32", "conv2d_nchw.cuda", [["TENSOR", [128, 336, 42, 42], "float32"], ["TENSOR", [168, 336, 1, 1], "float32"], 1, "SAME", 1, "float32"], {}], "config": {"index": 22329096, "code_hash": null, "entity": [["tile_f", "sp", [-1, 1, 21, 2]], ["tile_y", "sp", [-1, 1, 7, 1]], ["tile_x", "sp", [-1, 3, 1, 1]], ["tile_rc", "sp", [-1, 112]], ["tile_ry", "sp", [-1, 1]], ["tile_rx", "sp", [-1, 1]], ["auto_unroll_max_step", "ot", 0], ["unroll_explicit", "ot", 0]]}, "result": [[0.06799184999999999], 0, 4.136460542678833, 1639040317.5465658], "version": 0.2, "tvm_version": "0.8.dev0"}
{"input": ["cuda -keys=cuda,gpu -max_num_threads=1024 -thread_warp_size=32", "conv2d_nchw.cuda", [["TENSOR", [128, 336, 42, 42], "float32"], ["TENSOR", [168, 336, 1, 1], "float32"], 1, "SAME", 1, "float32"], {}], "config": {"index": 134540150, "code_hash": null, "entity": [["tile_f", "sp", [-1, 1, 2, 42]], ["tile_y", "sp", [-1, 6, 7, 1]], ["tile_x", "sp", [-1, 7, 2, 3]], ["tile_rc", "sp", [-1, 3]], ["tile_ry", "sp", [-1, 1]], ["tile_rx", "sp", [-1, 1]], ["auto_unroll_max_step", "ot", 1500], ["unroll_explicit", "ot", 1]]}, "result": [[1.2428867499999998], 0, 11.502954244613647, 1639040328.7344034], "version": 0.2, "tvm_version": "0.8.dev0"}
{"input": ["cuda -keys=cuda,gpu -max_num_threads=1024 -thread_warp_size=32", "conv2d_nchw.cuda", [["TENSOR", [128, 336, 42, 42], "float32"], ["TENSOR", [168, 336, 1, 1], "float32"], 1, "SAME", 1, "float32"], {}], "config": {"index": 16380114, "code_hash": null, "entity": [["tile_f", "sp", [-1, 2, 2, 14]], ["tile_y", "sp", [-1, 6, 1, 7]], ["tile_x", "sp", [-1, 1, 3, 2]], ["tile_rc", "sp", [-1, 28]], ["tile_ry", "sp", [-1, 1]], ["tile_rx", "sp", [-1, 1]], ["auto_unroll_max_step", "ot", 0], ["unroll_explicit", "ot", 0]]}, "result": [[4.573205700000001], 0, 27.195514917373657, 1639040355.309886], "version": 0.2, "tvm_version": "0.8.dev0"}
{"input": ["cuda -keys=cuda,gpu -max_num_threads=1024 -thread_warp_size=32", "conv2d_nchw.cuda", [["TENSOR", [128, 336, 42, 42], "float32"], ["TENSOR", [168, 336, 1, 1], "float32"], 1, "SAME", 1, "float32"], {}], "config": {"index": 16283326, "code_hash": null, "entity": [["tile_f", "sp", [-1, 3, 7, 2]], ["tile_y", "sp", [-1, 14, 1, 1]], ["tile_x", "sp", [-1, 1, 1, 2]], ["tile_rc", "sp", [-1, 28]], ["tile_ry", "sp", [-1, 1]], ["tile_rx", "sp", [-1, 1]], ["auto_unroll_max_step", "ot", 0], ["unroll_explicit", "ot", 0]]}, "result": [[0.09171805000000001], 0, 4.312685489654541, 1639040360.3070178], "version": 0.2, "tvm_version": "0.8.dev0"}
{"input": ["cuda -keys=cuda,gpu -max_num_threads=1024 -thread_warp_size=32", "conv2d_nchw.cuda", [["TENSOR", [128, 336, 42, 42], "float32"], ["TENSOR", [168, 336, 1, 1], "float32"], 1, "SAME", 1, "float32"], {}], "config": {"index": 27105313, "code_hash": null, "entity": [["tile_f", "sp", [-1, 14, 3, 1]], ["tile_y", "sp", [-1, 7, 3, 2]], ["tile_x", "sp", [-1, 2, 7, 3]], ["tile_rc", "sp", [-1, 1]], ["tile_ry", "sp", [-1, 1]], ["tile_rx", "sp", [-1, 1]], ["auto_unroll_max_step", "ot", 512], ["unroll_explicit", "ot", 0]]}, "result": [[0.838840225], 0, 10.497136354446411, 1639040369.2865033], "version": 0.2, "tvm_version": "0.8.dev0"}
{"input": ["cuda -keys=cuda,gpu -max_num_threads=1024 -thread_warp_size=32", "conv2d_nchw.cuda", [["TENSOR", [128, 336, 42, 42], "float32"], ["TENSOR", [168, 336, 1, 1], "float32"], 1, "SAME", 1, "float32"], {}], "config": {"index": 55534617, "code_hash": null, "entity": [["tile_f", "sp", [-1, 2, 14, 6]], ["tile_y", "sp", [-1, 7, 2, 3]], ["tile_x", "sp", [-1, 3, 14, 1]], ["tile_rc", "sp", [-1, 3]], ["tile_ry", "sp", [-1, 1]], ["tile_rx", "sp", [-1, 1]], ["auto_unroll_max_step", "ot", 1500], ["unroll_explicit", "ot", 0]]}, "result": [[0.7211037], 0, 8.922332763671875, 1639040377.4609637], "version": 0.2, "tvm_version": "0.8.dev0"}
{"input": ["cuda -keys=cuda,gpu -max_num_threads=1024 -thread_warp_size=32", "conv2d_nchw.cuda", [["TENSOR", [128, 336, 42, 42], "float32"], ["TENSOR", [168, 336, 1, 1], "float32"], 1, "SAME", 1, "float32"], {}], "config": {"index": 54277970, "code_hash": null, "entity": [["tile_f", "sp", [-1, 14, 2, 6]], ["tile_y", "sp", [-1, 1, 7, 1]], ["tile_x", "sp", [-1, 1, 42, 1]], ["tile_rc", "sp", [-1, 2]], ["tile_ry", "sp", [-1, 1]], ["tile_rx", "sp", [-1, 1]], ["auto_unroll_max_step", "ot", 1500], ["unroll_explicit", "ot", 0]]}, "result": [[0.03032975], 0, 3.7276368141174316, 1639040382.152653], "version": 0.2, "tvm_version": "0.8.dev0"}
{"input": ["cuda -keys=cuda,gpu -max_num_threads=1024 -thread_warp_size=32", "conv2d_nchw.cuda", [["TENSOR", [128, 336, 42, 42], "float32"], ["TENSOR", [168, 336, 1, 1], "float32"], 1, "SAME", 1, "float32"], {}], "config": {"index": 106874639, "code_hash": null, "entity": [["tile_f", "sp", [-1, 2, 28, 1]], ["tile_y", "sp", [-1, 1, 3, 2]], ["tile_x", "sp", [-1, 3, 7, 2]], ["tile_rc", "sp", [-1, 2]], ["tile_ry", "sp", [-1, 1]], ["tile_rx", "sp", [-1, 1]], ["auto_unroll_max_step", "ot", 512], ["unroll_explicit", "ot", 1]]}, "result": [[0.039595125], 0, 3.682248592376709, 1639040385.565297], "version": 0.2, "tvm_version": "0.8.dev0"}
{"input": ["cuda -keys=cuda,gpu -max_num_threads=1024 -thread_warp_size=32", "conv2d_nchw.cuda", [["TENSOR", [128, 336, 42, 42], "float32"], ["TENSOR", [168, 336, 1, 1], "float32"], 1, "SAME", 1, "float32"], {}], "config": {"index": 79883757, "code_hash": null, "entity": [["tile_f", "sp", [-1, 1, 4, 7]], ["tile_y", "sp", [-1, 1, 1, 3]], ["tile_x", "sp", [-1, 1, 1, 21]], ["tile_rc", "sp", [-1, 1]], ["tile_ry", "sp", [-1, 1]], ["tile_rx", "sp", [-1, 1]], ["auto_unroll_max_step", "ot", 0], ["unroll_explicit", "ot", 1]]}, "result": [[4.9176085249999995], 0, 28.76566195487976, 1639040414.6312525], "version": 0.2, "tvm_version": "0.8.dev0"}
{"input": ["cuda -keys=cuda,gpu -max_num_threads=1024 -thread_warp_size=32", "conv2d_nchw.cuda", [["TENSOR", [128, 336, 42, 42], "float32"], ["TENSOR", [168, 336, 1, 1], "float32"], 1, "SAME", 1, "float32"], {}], "config": {"index": 88610513, "code_hash": null, "entity": [["tile_f", "sp", [-1, 1, 2, 14]], ["tile_y", "sp", [-1, 2, 7, 3]], ["tile_x", "sp", [-1, 7, 1, 3]], ["tile_rc", "sp", [-1, 12]], ["tile_ry", "sp", [-1, 1]], ["tile_rx", "sp", [-1, 1]], ["auto_unroll_max_step", "ot", 0], ["unroll_explicit", "ot", 1]]}, "result": [[4.183264025000001], 0, 25.016347408294678, 1639040440.5840118], "version": 0.2, "tvm_version": "0.8.dev0"}
{"input": ["cuda -keys=cuda,gpu -max_num_threads=1024 -thread_warp_size=32", "conv2d_nchw.cuda", [["TENSOR", [128, 336, 42, 42], "float32"], ["TENSOR", [168, 336, 1, 1], "float32"], 1, "SAME", 1, "float32"], {}], "config": {"index": 30310583, "code_hash": null, "entity": [["tile_f", "sp", [-1, 3, 2, 4]], ["tile_y", "sp", [-1, 1, 1, 1]], ["tile_x", "sp", [-1, 1, 2, 1]], ["tile_rc", "sp", [-1, 4]], ["tile_ry", "sp", [-1, 1]], ["tile_rx", "sp", [-1, 1]], ["auto_unroll_max_step", "ot", 512], ["unroll_explicit", "ot", 0]]}, "result": [[0.47094285], 0, 6.033867359161377, 1639040446.8653681], "version": 0.2, "tvm_version": "0.8.dev0"}
{"input": ["cuda -keys=cuda,gpu -max_num_threads=1024 -thread_warp_size=32", "conv2d_nchw.cuda", [["TENSOR", [128, 336, 42, 42], "float32"], ["TENSOR", [168, 336, 1, 1], "float32"], 1, "SAME", 1, "float32"], {}], "config": {"index": 2550118, "code_hash": null, "entity": [["tile_f", "sp", [-1, 3, 4, 1]], ["tile_y", "sp", [-1, 1, 7, 2]], ["tile_x", "sp", [-1, 1, 1, 21]], ["tile_rc", "sp", [-1, 2]], ["tile_ry", "sp", [-1, 1]], ["tile_rx", "sp", [-1, 1]], ["auto_unroll_max_step", "ot", 0], ["unroll_explicit", "ot", 0]]}, "result": [[0.034462475], 0, 3.823554039001465, 1639040451.2777195], "version": 0.2, "tvm_version": "0.8.dev0"}
{"input": ["cuda -keys=cuda,gpu -max_num_threads=1024 -thread_warp_size=32", "conv2d_nchw.cuda", [["TENSOR", [128, 336, 42, 42], "float32"], ["TENSOR", [168, 336, 1, 1], "float32"], 1, "SAME", 1, "float32"], {}], "config": {"index": 112874443, "code_hash": null, "entity": [["tile_f", "sp", [-1, 4, 1, 6]], ["tile_y", "sp", [-1, 3, 1, 2]], ["tile_x", "sp", [-1, 42, 1, 1]], ["tile_rc", "sp", [-1, 8]], ["tile_ry", "sp", [-1, 1]], ["tile_rx", "sp", [-1, 1]], ["auto_unroll_max_step", "ot", 512], ["unroll_explicit", "ot", 1]]}, "result": [[21.890805225], 0, 120.22483134269714, 1639040565.0771997], "version": 0.2, "tvm_version": "0.8.dev0"}
{"input": ["cuda -keys=cuda,gpu -max_num_threads=1024 -thread_warp_size=32", "conv2d_nchw.cuda", [["TENSOR", [128, 336, 42, 42], "float32"], ["TENSOR", [168, 336, 1, 1], "float32"], 1, "SAME", 1, "float32"], {}], "config": {"index": 41001959, "code_hash": null, "entity": [["tile_f", "sp", [-1, 6, 4, 1]], ["tile_y", "sp", [-1, 6, 1, 1]], ["tile_x", "sp", [-1, 1, 7, 1]], ["tile_rc", "sp", [-1, 24]], ["tile_ry", "sp", [-1, 1]], ["tile_rx", "sp", [-1, 1]], ["auto_unroll_max_step", "ot", 512], ["unroll_explicit", "ot", 0]]}, "result": [[0.037353000000000004], 0, 4.094672679901123, 1639040569.5207837], "version": 0.2, "tvm_version": "0.8.dev0"}
{"input": ["cuda -keys=cuda,gpu -max_num_threads=1024 -thread_warp_size=32", "conv2d_nchw.cuda", [["TENSOR", [128, 336, 42, 42], "float32"], ["TENSOR", [168, 336, 1, 1], "float32"], 1, "SAME", 1, "float32"], {}], "config": {"index": 574637, "code_hash": null, "entity": [["tile_f", "sp", [-1, 1, 4, 7]], ["tile_y", "sp", [-1, 6, 1, 1]], ["tile_x", "sp", [-1, 3, 1, 2]], ["tile_rc", "sp", [-1, 1]], ["tile_ry", "sp", [-1, 1]], ["tile_rx", "sp", [-1, 1]], ["auto_unroll_max_step", "ot", 0], ["unroll_explicit", "ot", 0]]}, "result": [[0.73355165], 0, 7.578519582748413, 1639040576.7667875], "version": 0.2, "tvm_version": "0.8.dev0"}
{"input": ["cuda -keys=cuda,gpu -max_num_threads=1024 -thread_warp_size=32", "conv2d_nchw.cuda", [["TENSOR", [128, 336, 42, 42], "float32"], ["TENSOR", [168, 336, 1, 1], "float32"], 1, "SAME", 1, "float32"], {}], "config": {"index": 4797246, "code_hash": null, "entity": [["tile_f", "sp", [-1, 3, 7, 2]], ["tile_y", "sp", [-1, 14, 3, 1]], ["tile_x", "sp", [-1, 1, 7, 3]], ["tile_rc", "sp", [-1, 4]], ["tile_ry", "sp", [-1, 1]], ["tile_rx", "sp", [-1, 1]], ["auto_unroll_max_step", "ot", 0], ["unroll_explicit", "ot", 0]]}, "result": [[0.0487838], 0, 4.126853704452515, 1639040581.5384862], "version": 0.2, "tvm_version": "0.8.dev0"}
{"input": ["cuda -keys=cuda,gpu -max_num_threads=1024 -thread_warp_size=32", "conv2d_nchw.cuda", [["TENSOR", [128, 336, 42, 42], "float32"], ["TENSOR", [168, 336, 1, 1], "float32"], 1, "SAME", 1, "float32"], {}], "config": {"index": 6486207, "code_hash": null, "entity": [["tile_f", "sp", [-1, 4, 7, 2]], ["tile_y", "sp", [-1, 1, 1, 6]], ["tile_x", "sp", [-1, 1, 1, 21]], ["tile_rc", "sp", [-1, 6]], ["tile_ry", "sp", [-1, 1]], ["tile_rx", "sp", [-1, 1]], ["auto_unroll_max_step", "ot", 0], ["unroll_explicit", "ot", 0]]}, "result": [[3.2164728], 0, 21.487815141677856, 1639040602.9542005], "version": 0.2, "tvm_version": "0.8.dev0"}
{"input": ["cuda -keys=cuda,gpu -max_num_threads=1024 -thread_warp_size=32", "conv2d_nchw.cuda", [["TENSOR", [128, 336, 42, 42], "float32"], ["TENSOR", [168, 336, 1, 1], "float32"], 1, "SAME", 1, "float32"], {}], "config": {"index": 59184176, "code_hash": null, "entity": [["tile_f", "sp", [-1, 3, 1, 4]], ["tile_y", "sp", [-1, 1, 3, 7]], ["tile_x", "sp", [-1, 3, 2, 1]], ["tile_rc", "sp", [-1, 7]], ["tile_ry", "sp", [-1, 1]], ["tile_rx", "sp", [-1, 1]], ["auto_unroll_max_step", "ot", 1500], ["unroll_explicit", "ot", 0]]}, "result": [[1.833958325], 0, 14.075322389602661, 1639040620.6848507], "version": 0.2, "tvm_version": "0.8.dev0"}
{"input": ["cuda -keys=cuda,gpu -max_num_threads=1024 -thread_warp_size=32", "conv2d_nchw.cuda", [["TENSOR", [128, 336, 42, 42], "float32"], ["TENSOR", [168, 336, 1, 1], "float32"], 1, "SAME", 1, "float32"], {}], "config": {"index": 60464494, "code_hash": null, "entity": [["tile_f", "sp", [-1, 1, 1, 4]], ["tile_y", "sp", [-1, 3, 14, 1]], ["tile_x", "sp", [-1, 1, 2, 1]], ["tile_rc", "sp", [-1, 8]], ["tile_ry", "sp", [-1, 1]], ["tile_rx", "sp", [-1, 1]], ["auto_unroll_max_step", "ot", 1500], ["unroll_explicit", "ot", 0]]}, "result": [[0.41790710000000003], 0, 5.827994346618652, 1639040626.2466738], "version": 0.2, "tvm_version": "0.8.dev0"}
{"input": ["cuda -keys=cuda,gpu -max_num_threads=1024 -thread_warp_size=32", "conv2d_nchw.cuda", [["TENSOR", [128, 336, 42, 42], "float32"], ["TENSOR", [168, 336, 1, 1], "float32"], 1, "SAME", 1, "float32"], {}], "config": {"index": 88827713, "code_hash": null, "entity": [["tile_f", "sp", [-1, 2, 7, 4]], ["tile_y", "sp", [-1, 1, 7, 1]], ["tile_x", "sp", [-1, 2, 1, 7]], ["tile_rc", "sp", [-1, 12]], ["tile_ry", "sp", [-1, 1]], ["tile_rx", "sp", [-1, 1]], ["auto_unroll_max_step", "ot", 0], ["unroll_explicit", "ot", 1]]}, "result": [[0.03892405], 0, 4.022181272506714, 1639040630.8832512], "version": 0.2, "tvm_version": "0.8.dev0"}
{"input": ["cuda -keys=cuda,gpu -max_num_threads=1024 -thread_warp_size=32", "conv2d_nchw.cuda", [["TENSOR", [128, 336, 42, 42], "float32"], ["TENSOR", [168, 336, 1, 1], "float32"], 1, "SAME", 1, "float32"], {}], "config": {"index": 131487194, "code_hash": null, "entity": [["tile_f", "sp", [-1, 4, 2, 3]], ["tile_y", "sp", [-1, 7, 6, 1]], ["tile_x", "sp", [-1, 3, 7, 1]], ["tile_rc", "sp", [-1, 1]], ["tile_ry", "sp", [-1, 1]], ["tile_rx", "sp", [-1, 1]], ["auto_unroll_max_step", "ot", 1500], ["unroll_explicit", "ot", 1]]}, "result": [[0.09862662500000001], 0, 4.681999444961548, 1639040635.8341792], "version": 0.2, "tvm_version": "0.8.dev0"}
{"input": ["cuda -keys=cuda,gpu -max_num_threads=1024 -thread_warp_size=32", "conv2d_nchw.cuda", [["TENSOR", [128, 336, 42, 42], "float32"], ["TENSOR", [168, 336, 1, 1], "float32"], 1, "SAME", 1, "float32"], {}], "config": {"index": 15763541, "code_hash": null, "entity": [["tile_f", "sp", [-1, 7, 2, 1]], ["tile_y", "sp", [-1, 1, 1, 6]], ["tile_x", "sp", [-1, 2, 1, 1]], ["tile_rc", "sp", [-1, 28]], ["tile_ry", "sp", [-1, 1]], ["tile_rx", "sp", [-1, 1]], ["auto_unroll_max_step", "ot", 0], ["unroll_explicit", "ot", 0]]}, "result": [[0.434085975], 0, 6.736299276351929, 1639040642.7202253], "version": 0.2, "tvm_version": "0.8.dev0"}
{"input": ["cuda -keys=cuda,gpu -max_num_threads=1024 -thread_warp_size=32", "conv2d_nchw.cuda", [["TENSOR", [128, 336, 42, 42], "float32"], ["TENSOR", [168, 336, 1, 1], "float32"], 1, "SAME", 1, "float32"], {}], "config": {"index": 102914819, "code_hash": null, "entity": [["tile_f", "sp", [-1, 2, 1, 12]], ["tile_y", "sp", [-1, 1, 2, 1]], ["tile_x", "sp", [-1, 1, 7, 2]], ["tile_rc", "sp", [-1, 168]], ["tile_ry", "sp", [-1, 1]], ["tile_rx", "sp", [-1, 1]], ["auto_unroll_max_step", "ot", 0], ["unroll_explicit", "ot", 1]]}, "result": [[0.375824825], 0, 6.102457046508789, 1639040648.5308282], "version": 0.2, "tvm_version": "0.8.dev0"}
{"input": ["cuda -keys=cuda,gpu -max_num_threads=1024 -thread_warp_size=32", "conv2d_nchw.cuda", [["TENSOR", [128, 336, 42, 42], "float32"], ["TENSOR", [168, 336, 1, 1], "float32"], 1, "SAME", 1, "float32"], {}], "config": {"index": 88027237, "code_hash": null, "entity": [["tile_f", "sp", [-1, 2, 4, 1]], ["tile_y", "sp", [-1, 2, 3, 1]], ["tile_x", "sp", [-1, 7, 2, 1]], ["tile_rc", "sp", [-1, 12]], ["tile_ry", "sp", [-1, 1]], ["tile_rx", "sp", [-1, 1]], ["auto_unroll_max_step", "ot", 0], ["unroll_explicit", "ot", 1]]}, "result": [[0.05537495], 0, 4.173686742782593, 1639040652.7288744], "version": 0.2, "tvm_version": "0.8.dev0"}
{"input": ["cuda -keys=cuda,gpu -max_num_threads=1024 -thread_warp_size=32", "conv2d_nchw.cuda", [["TENSOR", [128, 336, 42, 42], "float32"], ["TENSOR", [168, 336, 1, 1], "float32"], 1, "SAME", 1, "float32"], {}], "config": {"index": 54835859, "code_hash": null, "entity": [["tile_f", "sp", [-1, 4, 2, 1]], ["tile_y", "sp", [-1, 3, 7, 2]], ["tile_x", "sp", [-1, 3, 2, 7]], ["tile_rc", "sp", [-1, 2]], ["tile_ry", "sp", [-1, 1]], ["tile_rx", "sp", [-1, 1]], ["auto_unroll_max_step", "ot", 1500], ["unroll_explicit", "ot", 0]]}, "result": [[0.7274089], 0, 8.998779773712158, 1639040661.3239806], "version": 0.2, "tvm_version": "0.8.dev0"}
{"input": ["cuda -keys=cuda,gpu -max_num_threads=1024 -thread_warp_size=32", "conv2d_nchw.cuda", [["TENSOR", [128, 336, 42, 42], "float32"], ["TENSOR", [168, 336, 1, 1], "float32"], 1, "SAME", 1, "float32"], {}], "config": {"index": 149751329, "code_hash": null, "entity": [["tile_f", "sp", [-1, 1, 2, 21]], ["tile_y", "sp", [-1, 7, 1, 1]], ["tile_x", "sp", [-1, 1, 6, 1]], ["tile_rc", "sp", [-1, 48]], ["tile_ry", "sp", [-1, 1]], ["tile_rx", "sp", [-1, 1]], ["auto_unroll_max_step", "ot", 1500], ["unroll_explicit", "ot", 1]]}, "result": [[0.130303625], 0, 5.479000568389893, 1639040666.4991086], "version": 0.2, "tvm_version": "0.8.dev0"}
{"input": ["cuda -keys=cuda,gpu -max_num_threads=1024 -thread_warp_size=32", "conv2d_nchw.cuda", [["TENSOR", [128, 336, 42, 42], "float32"], ["TENSOR", [168, 336, 1, 1], "float32"], 1, "SAME", 1, "float32"], {}], "config": {"index": 78869183, "code_hash": null, "entity": [["tile_f", "sp", [-1, 2, 12, 1]], ["tile_y", "sp", [-1, 3, 1, 1]], ["tile_x", "sp", [-1, 21, 2, 1]], ["tile_rc", "sp", [-1, 1]], ["tile_ry", "sp", [-1, 1]], ["tile_rx", "sp", [-1, 1]], ["auto_unroll_max_step", "ot", 0], ["unroll_explicit", "ot", 1]]}, "result": [[0.039489474999999996], 0, 3.9380204677581787, 1639040670.955168], "version": 0.2, "tvm_version": "0.8.dev0"}
{"input": ["cuda -keys=cuda,gpu -max_num_threads=1024 -thread_warp_size=32", "conv2d_nchw.cuda", [["TENSOR", [128, 336, 42, 42], "float32"], ["TENSOR", [168, 336, 1, 1], "float32"], 1, "SAME", 1, "float32"], {}], "config": {"index": 66359502, "code_hash": null, "entity": [["tile_f", "sp", [-1, 2, 42, 2]], ["tile_y", "sp", [-1, 2, 3, 1]], ["tile_x", "sp", [-1, 1, 2, 3]], ["tile_rc", "sp", [-1, 21]], ["tile_ry", "sp", [-1, 1]], ["tile_rx", "sp", [-1, 1]], ["auto_unroll_max_step", "ot", 1500], ["unroll_explicit", "ot", 0]]}, "result": [[0.032539775], 0, 3.810952663421631, 1639040674.6563447], "version": 0.2, "tvm_version": "0.8.dev0"}
{"input": ["cuda -keys=cuda,gpu -max_num_threads=1024 -thread_warp_size=32", "conv2d_nchw.cuda", [["TENSOR", [128, 336, 42, 42], "float32"], ["TENSOR", [168, 336, 1, 1], "float32"], 1, "SAME", 1, "float32"], {}], "config": {"index": 114738513, "code_hash": null, "entity": [["tile_f", "sp", [-1, 1, 2, 14]], ["tile_y", "sp", [-1, 7, 1, 2]], ["tile_x", "sp", [-1, 3, 7, 2]], ["tile_rc", "sp", [-1, 12]], ["tile_ry", "sp", [-1, 1]], ["tile_rx", "sp", [-1, 1]], ["auto_unroll_max_step", "ot", 512], ["unroll_explicit", "ot", 1]]}, "result": [[2.4364214499999997], 0, 17.52933406829834, 1639040692.1139207], "version": 0.2, "tvm_version": "0.8.dev0"}
{"input": ["cuda -keys=cuda,gpu -max_num_threads=1024 -thread_warp_size=32", "conv2d_nchw.cuda", [["TENSOR", [128, 336, 42, 42], "float32"], ["TENSOR", [168, 336, 1, 1], "float32"], 1, "SAME", 1, "float32"], {}], "config": {"index": 69068661, "code_hash": null, "entity": [["tile_f", "sp", [-1, 42, 1, 4]], ["tile_y", "sp", [-1, 1, 3, 2]], ["tile_x", "sp", [-1, 1, 14, 3]], ["tile_rc", "sp", [-1, 28]], ["tile_ry", "sp", [-1, 1]], ["tile_rx", "sp", [-1, 1]], ["auto_unroll_max_step", "ot", 1500], ["unroll_explicit", "ot", 0]]}, "result": [[1.3054158500000002], 0, 14.075640201568604, 1639040704.417356], "version": 0.2, "tvm_version": "0.8.dev0"}
{"input": ["cuda -keys=cuda,gpu -max_num_threads=1024 -thread_warp_size=32", "conv2d_nchw.cuda", [["TENSOR", [128, 336, 42, 42], "float32"], ["TENSOR", [168, 336, 1, 1], "float32"], 1, "SAME", 1, "float32"], {}], "config": {"index": 131878892, "code_hash": null, "entity": [["tile_f", "sp", [-1, 2, 28, 3]], ["tile_y", "sp", [-1, 2, 21, 1]], ["tile_x", "sp", [-1, 14, 1, 3]], ["tile_rc", "sp", [-1, 1]], ["tile_ry", "sp", [-1, 1]], ["tile_rx", "sp", [-1, 1]], ["auto_unroll_max_step", "ot", 1500], ["unroll_explicit", "ot", 1]]}, "result": [[0.6925275249999999], 0, 9.371175289154053, 1639040712.1308186], "version": 0.2, "tvm_version": "0.8.dev0"}
{"input": ["cuda -keys=cuda,gpu -max_num_threads=1024 -thread_warp_size=32", "conv2d_nchw.cuda", [["TENSOR", [128, 336, 42, 42], "float32"], ["TENSOR", [168, 336, 1, 1], "float32"], 1, "SAME", 1, "float32"], {}], "config": {"index": 30589979, "code_hash": null, "entity": [["tile_f", "sp", [-1, 1, 1, 7]], ["tile_y", "sp", [-1, 7, 2, 3]], ["tile_x", "sp", [-1, 6, 7, 1]], ["tile_rc", "sp", [-1, 4]], ["tile_ry", "sp", [-1, 1]], ["tile_rx", "sp", [-1, 1]], ["auto_unroll_max_step", "ot", 512], ["unroll_explicit", "ot", 0]]}, "result": [[2.62293955], 0, 18.263706922531128, 1639040729.748277], "version": 0.2, "tvm_version": "0.8.dev0"}
{"input": ["cuda -keys=cuda,gpu -max_num_threads=1024 -thread_warp_size=32", "conv2d_nchw.cuda", [["TENSOR", [128, 336, 42, 42], "float32"], ["TENSOR", [168, 336, 1, 1], "float32"], 1, "SAME", 1, "float32"], {}], "config": {"index": 12188217, "code_hash": null, "entity": [["tile_f", "sp", [-1, 24, 7, 1]], ["tile_y", "sp", [-1, 1, 2, 1]], ["tile_x", "sp", [-1, 2, 7, 1]], ["tile_rc", "sp", [-1, 16]], ["tile_ry", "sp", [-1, 1]], ["tile_rx", "sp", [-1, 1]], ["auto_unroll_max_step", "ot", 0], ["unroll_explicit", "ot", 0]]}, "result": [[0.082623725], 0, 4.144182920455933, 1639040734.1382525], "version": 0.2, "tvm_version": "0.8.dev0"}
{"input": ["cuda -keys=cuda,gpu -max_num_threads=1024 -thread_warp_size=32", "conv2d_nchw.cuda", [["TENSOR", [128, 336, 42, 42], "float32"], ["TENSOR", [168, 336, 1, 1], "float32"], 1, "SAME", 1, "float32"], {}], "config": {"index": 115032550, "code_hash": null, "entity": [["tile_f", "sp", [-1, 4, 2, 7]], ["tile_y", "sp", [-1, 1, 2, 7]], ["tile_x", "sp", [-1, 1, 1, 7]], ["tile_rc", "sp", [-1, 12]], ["tile_ry", "sp", [-1, 1]], ["tile_rx", "sp", [-1, 1]], ["auto_unroll_max_step", "ot", 512], ["unroll_explicit", "ot", 1]]}, "result": [[5.39011455], 0, 32.4048969745636, 1639040774.6951747], "version": 0.2, "tvm_version": "0.8.dev0"}
{"input": ["cuda -keys=cuda,gpu -max_num_threads=1024 -thread_warp_size=32", "conv2d_nchw.cuda", [["TENSOR", [128, 336, 42, 42], "float32"], ["TENSOR", [168, 336, 1, 1], "float32"], 1, "SAME", 1, "float32"], {}], "config": {"index": 95296063, "code_hash": null, "entity": [["tile_f", "sp", [-1, 2, 12, 1]], ["tile_y", "sp", [-1, 1, 2, 1]], ["tile_x", "sp", [-1, 1, 1, 6]], ["tile_rc", "sp", [-1, 28]], ["tile_ry", "sp", [-1, 1]], ["tile_rx", "sp", [-1, 1]], ["auto_unroll_max_step", "ot", 0], ["unroll_explicit", "ot", 1]]}, "result": [[0.049923575], 0, 3.920614719390869, 1639040778.7665727], "version": 0.2, "tvm_version": "0.8.dev0"}
{"input": ["cuda -keys=cuda,gpu -max_num_threads=1024 -thread_warp_size=32", "conv2d_nchw.cuda", [["TENSOR", [128, 336, 42, 42], "float32"], ["TENSOR", [168, 336, 1, 1], "float32"], 1, "SAME", 1, "float32"], {}], "config": {"index": 42006535, "code_hash": null, "entity": [["tile_f", "sp", [-1, 6, 14, 2]], ["tile_y", "sp", [-1, 21, 1, 1]], ["tile_x", "sp", [-1, 6, 1, 1]], ["tile_rc", "sp", [-1, 28]], ["tile_ry", "sp", [-1, 1]], ["tile_rx", "sp", [-1, 1]], ["auto_unroll_max_step", "ot", 512], ["unroll_explicit", "ot", 0]]}, "result": [[2.986133225], 0, 26.063427686691284, 1639040798.662615], "version": 0.2, "tvm_version": "0.8.dev0"}
{"input": ["cuda -keys=cuda,gpu -max_num_threads=1024 -thread_warp_size=32", "conv2d_nchw.cuda", [["TENSOR", [128, 336, 42, 42], "float32"], ["TENSOR", [168, 336, 1, 1], "float32"], 1, "SAME", 1, "float32"], {}], "config": {"index": 94032511, "code_hash": null, "entity": [["tile_f", "sp", [-1, 7, 6, 4]], ["tile_y", "sp", [-1, 1, 1, 2]], ["tile_x", "sp", [-1, 1, 7, 6]], ["tile_rc", "sp", [-1, 24]], ["tile_ry", "sp", [-1, 1]], ["tile_rx", "sp", [-1, 1]], ["auto_unroll_max_step", "ot", 0], ["unroll_explicit", "ot", 1]]}, "result": [[1.044031825], 0, 9.344483375549316, 1639040807.5421793], "version": 0.2, "tvm_version": "0.8.dev0"}
{"input": ["cuda -keys=cuda,gpu -max_num_threads=1024 -thread_warp_size=32", "conv2d_nchw.cuda", [["TENSOR", [128, 336, 42, 42], "float32"], ["TENSOR", [168, 336, 1, 1], "float32"], 1, "SAME", 1, "float32"], {}], "config": {"index": 145106395, "code_hash": null, "entity": [["tile_f", "sp", [-1, 7, 2, 3]], ["tile_y", "sp", [-1, 7, 6, 1]], ["tile_x", "sp", [-1, 1, 1, 6]], ["tile_rc", "sp", [-1, 21]], ["tile_ry", "sp", [-1, 1]], ["tile_rx", "sp", [-1, 1]], ["auto_unroll_max_step", "ot", 1500], ["unroll_explicit", "ot", 1]]}, "result": [[2.319029425], 0, 24.39877223968506, 1639040825.3597999], "version": 0.2, "tvm_version": "0.8.dev0"}
{"input": ["cuda -keys=cuda,gpu -max_num_threads=1024 -thread_warp_size=32", "conv2d_nchw.cuda", [["TENSOR", [128, 336, 42, 42], "float32"], ["TENSOR", [168, 336, 1, 1], "float32"], 1, "SAME", 1, "float32"], {}], "config": {"index": 79725769, "code_hash": null, "entity": [["tile_f", "sp", [-1, 21, 1, 1]], ["tile_y", "sp", [-1, 2, 3, 7]], ["tile_x", "sp", [-1, 1, 2, 7]], ["tile_rc", "sp", [-1, 1]], ["tile_ry", "sp", [-1, 1]], ["tile_rx", "sp", [-1, 1]], ["auto_unroll_max_step", "ot", 0], ["unroll_explicit", "ot", 1]]}, "result": [[3.496865375], 0, 21.54499316215515, 1639040846.4372368], "version": 0.2, "tvm_version": "0.8.dev0"}
{"input": ["cuda -keys=cuda,gpu -max_num_threads=1024 -thread_warp_size=32", "conv2d_nchw.cuda", [["TENSOR", [128, 336, 42, 42], "float32"], ["TENSOR", [168, 336, 1, 1], "float32"], 1, "SAME", 1, "float32"], {}], "config": {"index": 87813833, "code_hash": null, "entity": [["tile_f", "sp", [-1, 2, 21, 1]], ["tile_y", "sp", [-1, 3, 1, 7]], ["tile_x", "sp", [-1, 1, 1, 42]], ["tile_rc", "sp", [-1, 8]], ["tile_ry", "sp", [-1, 1]], ["tile_rx", "sp", [-1, 1]], ["auto_unroll_max_step", "ot", 0], ["unroll_explicit", "ot", 1]]}, "result": [[1.410328775], 0, 11.776185274124146, 1639040857.2889266], "version": 0.2, "tvm_version": "0.8.dev0"}
{"input": ["cuda -keys=cuda,gpu -max_num_threads=1024 -thread_warp_size=32", "conv2d_nchw.cuda", [["TENSOR", [128, 336, 42, 42], "float32"], ["TENSOR", [168, 336, 1, 1], "float32"], 1, "SAME", 1, "float32"], {}], "config": {"index": 8207995, "code_hash": null, "entity": [["tile_f", "sp", [-1, 1, 3, 56]], ["tile_y", "sp", [-1, 2, 1, 7]], ["tile_x", "sp", [-1, 1, 6, 1]], ["tile_rc", "sp", [-1, 8]], ["tile_ry", "sp", [-1, 1]], ["tile_rx", "sp", [-1, 1]], ["auto_unroll_max_step", "ot", 0], ["unroll_explicit", "ot", 0]]}, "result": [[1.24042115], 0, 10.046127557754517, 1639040867.5200307], "version": 0.2, "tvm_version": "0.8.dev0"}
{"input": ["cuda -keys=cuda,gpu -max_num_threads=1024 -thread_warp_size=32", "conv2d_nchw.cuda", [["TENSOR", [128, 336, 42, 42], "float32"], ["TENSOR", [168, 336, 1, 1], "float32"], 1, "SAME", 1, "float32"], {}], "config": {"index": 76267710, "code_hash": null, "entity": [["tile_f", "sp", [-1, 1, 6, 4]], ["tile_y", "sp", [-1, 1, 1, 1]], ["tile_x", "sp", [-1, 1, 3, 1]], ["tile_rc", "sp", [-1, 168]], ["tile_ry", "sp", [-1, 1]], ["tile_rx", "sp", [-1, 1]], ["auto_unroll_max_step", "ot", 1500], ["unroll_explicit", "ot", 0]]}, "result": [[0.8966154749999999], 0, 9.716407299041748, 1639040876.259551], "version": 0.2, "tvm_version": "0.8.dev0"}
{"input": ["cuda -keys=cuda,gpu -max_num_threads=1024 -thread_warp_size=32", "conv2d_nchw.cuda", [["TENSOR", [128, 336, 42, 42], "float32"], ["TENSOR", [168, 336, 1, 1], "float32"], 1, "SAME", 1, "float32"], {}], "config": {"index": 139778783, "code_hash": null, "entity": [["tile_f", "sp", [-1, 6, 1, 7]], ["tile_y", "sp", [-1, 1, 2, 1]], ["tile_x", "sp", [-1, 7, 2, 3]], ["tile_rc", "sp", [-1, 8]], ["tile_ry", "sp", [-1, 1]], ["tile_rx", "sp", [-1, 1]], ["auto_unroll_max_step", "ot", 1500], ["unroll_explicit", "ot", 1]]}, "result": [[4.69288], 0, 32.69743299484253, 1639040904.4183989], "version": 0.2, "tvm_version": "0.8.dev0"}
{"input": ["cuda -keys=cuda,gpu -max_num_threads=1024 -thread_warp_size=32", "conv2d_nchw.cuda", [["TENSOR", [128, 336, 42, 42], "float32"], ["TENSOR", [168, 336, 1, 1], "float32"], 1, "SAME", 1, "float32"], {}], "config": {"index": 28729863, "code_hash": null, "entity": [["tile_f", "sp", [-1, 7, 2, 12]], ["tile_y", "sp", [-1, 1, 2, 7]], ["tile_x", "sp", [-1, 3, 1, 14]], ["tile_rc", "sp", [-1, 2]], ["tile_ry", "sp", [-1, 1]], ["tile_rx", "sp", [-1, 1]], ["auto_unroll_max_step", "ot", 512], ["unroll_explicit", "ot", 0]]}, "result": [[6.338310625], 0, 37.89369821548462, 1639040940.3465273], "version": 0.2, "tvm_version": "0.8.dev0"}
{"input": ["cuda -keys=cuda,gpu -max_num_threads=1024 -thread_warp_size=32", "conv2d_nchw.cuda", [["TENSOR", [128, 336, 42, 42], "float32"], ["TENSOR", [168, 336, 1, 1], "float32"], 1, "SAME", 1, "float32"], {}], "config": {"index": 4365078, "code_hash": null, "entity": [["tile_f", "sp", [-1, 2, 3, 14]], ["tile_y", "sp", [-1, 1, 2, 1]], ["tile_x", "sp", [-1, 6, 7, 1]], ["tile_rc", "sp", [-1, 4]], ["tile_ry", "sp", [-1, 1]], ["tile_rx", "sp", [-1, 1]], ["auto_unroll_max_step", "ot", 0], ["unroll_explicit", "ot", 0]]}, "result": [[0.03140225], 0, 3.934007167816162, 1639040943.9437263], "version": 0.2, "tvm_version": "0.8.dev0"}
{"input": ["cuda -keys=cuda,gpu -max_num_threads=1024 -thread_warp_size=32", "conv2d_nchw.cuda", [["TENSOR", [128, 336, 42, 42], "float32"], ["TENSOR", [168, 336, 1, 1], "float32"], 1, "SAME", 1, "float32"], {}], "config": {"index": 85829543, "code_hash": null, "entity": [["tile_f", "sp", [-1, 2, 2, 2]], ["tile_y", "sp", [-1, 1, 1, 14]], ["tile_x", "sp", [-1, 21, 1, 2]], ["tile_rc", "sp", [-1, 7]], ["tile_ry", "sp", [-1, 1]], ["tile_rx", "sp", [-1, 1]], ["auto_unroll_max_step", "ot", 0], ["unroll_explicit", "ot", 1]]}, "result": [[10.622165925], 0, 57.41743516921997, 1639041000.9690185], "version": 0.2, "tvm_version": "0.8.dev0"}
{"input": ["cuda -keys=cuda,gpu -max_num_threads=1024 -thread_warp_size=32", "conv2d_nchw.cuda", [["TENSOR", [128, 336, 42, 42], "float32"], ["TENSOR", [168, 336, 1, 1], "float32"], 1, "SAME", 1, "float32"], {}], "config": {"index": 85555193, "code_hash": null, "entity": [["tile_f", "sp", [-1, 1, 1, 56]], ["tile_y", "sp", [-1, 1, 3, 2]], ["tile_x", "sp", [-1, 7, 6, 1]], ["tile_rc", "sp", [-1, 7]], ["tile_ry", "sp", [-1, 1]], ["tile_rx", "sp", [-1, 1]], ["auto_unroll_max_step", "ot", 0], ["unroll_explicit", "ot", 1]]}, "result": [[1.27636125], 0, 10.887715101242065, 1639041011.5734837], "version": 0.2, "tvm_version": "0.8.dev0"}
{"input": ["cuda -keys=cuda,gpu -max_num_threads=1024 -thread_warp_size=32", "conv2d_nchw.cuda", [["TENSOR", [128, 336, 42, 42], "float32"], ["TENSOR", [168, 336, 1, 1], "float32"], 1, "SAME", 1, "float32"], {}], "config": {"index": 71767292, "code_hash": null, "entity": [["tile_f", "sp", [-1, 21, 1, 8]], ["tile_y", "sp", [-1, 1, 6, 1]], ["tile_x", "sp", [-1, 1, 1, 7]], ["tile_rc", "sp", [-1, 48]], ["tile_ry", "sp", [-1, 1]], ["tile_rx", "sp", [-1, 1]], ["auto_unroll_max_step", "ot", 1500], ["unroll_explicit", "ot", 0]]}, "result": [[7.162350125], 0, 52.71676850318909, 1639041054.8470826], "version": 0.2, "tvm_version": "0.8.dev0"}
{"input": ["cuda -keys=cuda,gpu -max_num_threads=1024 -thread_warp_size=32", "conv2d_nchw.cuda", [["TENSOR", [128, 336, 42, 42], "float32"], ["TENSOR", [168, 336, 1, 1], "float32"], 1, "SAME", 1, "float32"], {}], "config": {"index": 4332927, "code_hash": null, "entity": [["tile_f", "sp", [-1, 4, 7, 2]], ["tile_y", "sp", [-1, 1, 1, 3]], ["tile_x", "sp", [-1, 2, 7, 1]], ["tile_rc", "sp", [-1, 4]], ["tile_ry", "sp", [-1, 1]], ["tile_rx", "sp", [-1, 1]], ["auto_unroll_max_step", "ot", 0], ["unroll_explicit", "ot", 0]]}, "result": [[0.045406275], 0, 3.5437092781066895, 1639041148.6428976], "version": 0.2, "tvm_version": "0.8.dev0"}
{"input": ["cuda -keys=cuda,gpu -max_num_threads=1024 -thread_warp_size=32", "conv2d_nchw.cuda", [["TENSOR", [128, 336, 42, 42], "float32"], ["TENSOR", [168, 336, 1, 1], "float32"], 1, "SAME", 1, "float32"], {}], "config": {"index": 5519166, "code_hash": null, "entity": [["tile_f", "sp", [-1, 3, 7, 2]], ["tile_y", "sp", [-1, 1, 3, 2]], ["tile_x", "sp", [-1, 2, 3, 1]], ["tile_rc", "sp", [-1, 6]], ["tile_ry", "sp", [-1, 1]], ["tile_rx", "sp", [-1, 1]], ["auto_unroll_max_step", "ot", 0], ["unroll_explicit", "ot", 0]]}, "result": [[0.044362], 0, 3.6905767917633057, 1639041152.0840652], "version": 0.2, "tvm_version": "0.8.dev0"}
{"input": ["cuda -keys=cuda,gpu -max_num_threads=1024 -thread_warp_size=32", "conv2d_nchw.cuda", [["TENSOR", [128, 336, 42, 42], "float32"], ["TENSOR", [168, 336, 1, 1], "float32"], 1, "SAME", 1, "float32"], {}], "config": {"index": 5519161, "code_hash": null, "entity": [["tile_f", "sp", [-1, 2, 6, 2]], ["tile_y", "sp", [-1, 1, 3, 2]], ["tile_x", "sp", [-1, 2, 3, 1]], ["tile_rc", "sp", [-1, 6]], ["tile_ry", "sp", [-1, 1]], ["tile_rx", "sp", [-1, 1]], ["auto_unroll_max_step", "ot", 0], ["unroll_explicit", "ot", 0]]}, "result": [[0.0378603], 0, 3.6700804233551025, 1639041155.4726], "version": 0.2, "tvm_version": "0.8.dev0"}
{"input": ["cuda -keys=cuda,gpu -max_num_threads=1024 -thread_warp_size=32", "conv2d_nchw.cuda", [["TENSOR", [128, 336, 42, 42], "float32"], ["TENSOR", [168, 336, 1, 1], "float32"], 1, "SAME", 1, "float32"], {}], "config": {"index": 5574525, "code_hash": null, "entity": [["tile_f", "sp", [-1, 2, 7, 2]], ["tile_y", "sp", [-1, 1, 3, 1]], ["tile_x", "sp", [-1, 1, 6, 1]], ["tile_rc", "sp", [-1, 6]], ["tile_ry", "sp", [-1, 1]], ["tile_rx", "sp", [-1, 1]], ["auto_unroll_max_step", "ot", 0], ["unroll_explicit", "ot", 0]]}, "result": [[0.050121075], 0, 3.92448091506958, 1639041159.284111], "version": 0.2, "tvm_version": "0.8.dev0"}
{"input": ["cuda -keys=cuda,gpu -max_num_threads=1024 -thread_warp_size=32", "conv2d_nchw.cuda", [["TENSOR", [128, 336, 42, 42], "float32"], ["TENSOR", [168, 336, 1, 1], "float32"], 1, "SAME", 1, "float32"], {}], "config": {"index": 5574526, "code_hash": null, "entity": [["tile_f", "sp", [-1, 3, 7, 2]], ["tile_y", "sp", [-1, 1, 3, 1]], ["tile_x", "sp", [-1, 1, 6, 1]], ["tile_rc", "sp", [-1, 6]], ["tile_ry", "sp", [-1, 1]], ["tile_rx", "sp", [-1, 1]], ["auto_unroll_max_step", "ot", 0], ["unroll_explicit", "ot", 0]]}, "result": [[0.04172575], 0, 3.8650074005126953, 1639041162.9639542], "version": 0.2, "tvm_version": "0.8.dev0"}
{"input": ["cuda -keys=cuda,gpu -max_num_threads=1024 -thread_warp_size=32", "conv2d_nchw.cuda", [["TENSOR", [128, 336, 42, 42], "float32"], ["TENSOR", [168, 336, 1, 1], "float32"], 1, "SAME", 1, "float32"], {}], "config": {"index": 5580601, "code_hash": null, "entity": [["tile_f", "sp", [-1, 2, 6, 2]], ["tile_y", "sp", [-1, 1, 3, 2]], ["tile_x", "sp", [-1, 1, 6, 1]], ["tile_rc", "sp", [-1, 6]], ["tile_ry", "sp", [-1, 1]], ["tile_rx", "sp", [-1, 1]], ["auto_unroll_max_step", "ot", 0], ["unroll_explicit", "ot", 0]]}, "result": [[0.043000225], 0, 4.381432056427002, 1639041167.097405], "version": 0.2, "tvm_version": "0.8.dev0"}
{"input": ["cuda -keys=cuda,gpu -max_num_threads=1024 -thread_warp_size=32", "conv2d_nchw.cuda", [["TENSOR", [128, 336, 42, 42], "float32"], ["TENSOR", [168, 336, 1, 1], "float32"], 1, "SAME", 1, "float32"], {}], "config": {"index": 56761727, "code_hash": null, "entity": [["tile_f", "sp", [-1, 4, 7, 2]], ["tile_y", "sp", [-1, 1, 1, 3]], ["tile_x", "sp", [-1, 2, 7, 1]], ["tile_rc", "sp", [-1, 4]], ["tile_ry", "sp", [-1, 1]], ["tile_rx", "sp", [-1, 1]], ["auto_unroll_max_step", "ot", 1500], ["unroll_explicit", "ot", 0]]}, "result": [[0.033786675], 0, 4.652269124984741, 1639041171.486359], "version": 0.2, "tvm_version": "0.8.dev0"}
{"input": ["cuda -keys=cuda,gpu -max_num_threads=1024 -thread_warp_size=32", "conv2d_nchw.cuda", [["TENSOR", [128, 336, 42, 42], "float32"], ["TENSOR", [168, 336, 1, 1], "float32"], 1, "SAME", 1, "float32"], {}], "config": {"index": 30547327, "code_hash": null, "entity": [["tile_f", "sp", [-1, 4, 7, 2]], ["tile_y", "sp", [-1, 1, 1, 3]], ["tile_x", "sp", [-1, 2, 7, 1]], ["tile_rc", "sp", [-1, 4]], ["tile_ry", "sp", [-1, 1]], ["tile_rx", "sp", [-1, 1]], ["auto_unroll_max_step", "ot", 512], ["unroll_explicit", "ot", 0]]}, "result": [[0.0337988], 0, 3.6927077770233154, 1639041174.8258555], "version": 0.2, "tvm_version": "0.8.dev0"}
{"input": ["cuda -keys=cuda,gpu -max_num_threads=1024 -thread_warp_size=32", "conv2d_nchw.cuda", [["TENSOR", [128, 336, 42, 42], "float32"], ["TENSOR", [168, 336, 1, 1], "float32"], 1, "SAME", 1, "float32"], {}], "config": {"index": 4335808, "code_hash": null, "entity": [["tile_f", "sp", [-1, 6, 7, 2]], ["tile_y", "sp", [-1, 1, 1, 6]], ["tile_x", "sp", [-1, 2, 7, 1]], ["tile_rc", "sp", [-1, 4]], ["tile_ry", "sp", [-1, 1]], ["tile_rx", "sp", [-1, 1]], ["auto_unroll_max_step", "ot", 0], ["unroll_explicit", "ot", 0]]}, "result": [[0.0373405], 0, 3.8860557079315186, 1639041178.4890387], "version": 0.2, "tvm_version": "0.8.dev0"}
{"input": ["cuda -keys=cuda,gpu -max_num_threads=1024 -thread_warp_size=32", "conv2d_nchw.cuda", [["TENSOR", [128, 336, 42, 42], "float32"], ["TENSOR", [168, 336, 1, 1], "float32"], 1, "SAME", 1, "float32"], {}], "config": {"index": 5499321, "code_hash": null, "entity": [["tile_f", "sp", [-1, 2, 6, 2]], ["tile_y", "sp", [-1, 1, 7, 2]], ["tile_x", "sp", [-1, 1, 3, 1]], ["tile_rc", "sp", [-1, 6]], ["tile_ry", "sp", [-1, 1]], ["tile_rx", "sp", [-1, 1]], ["auto_unroll_max_step", "ot", 0], ["unroll_explicit", "ot", 0]]}, "result": [[0.0499728], 0, 3.9982075691223145, 1639041182.2549715], "version": 0.2, "tvm_version": "0.8.dev0"}
{"input": ["cuda -keys=cuda,gpu -max_num_threads=1024 -thread_warp_size=32", "conv2d_nchw.cuda", [["TENSOR", [128, 336, 42, 42], "float32"], ["TENSOR", [168, 336, 1, 1], "float32"], 1, "SAME", 1, "float32"], {}], "config": {"index": 5513086, "code_hash": null, "entity": [["tile_f", "sp", [-1, 3, 7, 2]], ["tile_y", "sp", [-1, 1, 3, 1]], ["tile_x", "sp", [-1, 2, 3, 1]], ["tile_rc", "sp", [-1, 6]], ["tile_ry", "sp", [-1, 1]], ["tile_rx", "sp", [-1, 1]], ["auto_unroll_max_step", "ot", 0], ["unroll_explicit", "ot", 0]]}, "result": [[0.049969825], 0, 3.774203300476074, 1639041186.1498742], "version": 0.2, "tvm_version": "0.8.dev0"}
{"input": ["cuda -keys=cuda,gpu -max_num_threads=1024 -thread_warp_size=32", "conv2d_nchw.cuda", [["TENSOR", [128, 336, 42, 42], "float32"], ["TENSOR", [168, 336, 1, 1], "float32"], 1, "SAME", 1, "float32"], {}], "config": {"index": 4291966, "code_hash": null, "entity": [["tile_f", "sp", [-1, 3, 7, 2]], ["tile_y", "sp", [-1, 1, 1, 3]], ["tile_x", "sp", [-1, 7, 6, 1]], ["tile_rc", "sp", [-1, 4]], ["tile_ry", "sp", [-1, 1]], ["tile_rx", "sp", [-1, 1]], ["auto_unroll_max_step", "ot", 0], ["unroll_explicit", "ot", 0]]}, "result": [[0.0274193], 0, 3.9032461643218994, 1639041189.8425076], "version": 0.2, "tvm_version": "0.8.dev0"}
{"input": ["cuda -keys=cuda,gpu -max_num_threads=1024 -thread_warp_size=32", "conv2d_nchw.cuda", [["TENSOR", [128, 336, 42, 42], "float32"], ["TENSOR", [168, 336, 1, 1], "float32"], 1, "SAME", 1, "float32"], {}], "config": {"index": 84162361, "code_hash": null, "entity": [["tile_f", "sp", [-1, 2, 6, 2]], ["tile_y", "sp", [-1, 1, 3, 2]], ["tile_x", "sp", [-1, 2, 3, 1]], ["tile_rc", "sp", [-1, 6]], ["tile_ry", "sp", [-1, 1]], ["tile_rx", "sp", [-1, 1]], ["auto_unroll_max_step", "ot", 0], ["unroll_explicit", "ot", 1]]}, "result": [[0.036089550000000005], 0, 3.811701774597168, 1639041193.6085489], "version": 0.2, "tvm_version": "0.8.dev0"}
{"input": ["cuda -keys=cuda,gpu -max_num_threads=1024 -thread_warp_size=32", "conv2d_nchw.cuda", [["TENSOR", [128, 336, 42, 42], "float32"], ["TENSOR", [168, 336, 1, 1], "float32"], 1, "SAME", 1, "float32"], {}], "config": {"index": 4334206, "code_hash": null, "entity": [["tile_f", "sp", [-1, 3, 7, 2]], ["tile_y", "sp", [-1, 1, 2, 3]], ["tile_x", "sp", [-1, 2, 7, 1]], ["tile_rc", "sp", [-1, 4]], ["tile_ry", "sp", [-1, 1]], ["tile_rx", "sp", [-1, 1]], ["auto_unroll_max_step", "ot", 0], ["unroll_explicit", "ot", 0]]}, "result": [[0.045788325], 0, 3.8627266883850098, 1639041197.3709648], "version": 0.2, "tvm_version": "0.8.dev0"}
{"input": ["cuda -keys=cuda,gpu -max_num_threads=1024 -thread_warp_size=32", "conv2d_nchw.cuda", [["TENSOR", [128, 336, 42, 42], "float32"], ["TENSOR", [168, 336, 1, 1], "float32"], 1, "SAME", 1, "float32"], {}], "config": {"index": 6829886, "code_hash": null, "entity": [["tile_f", "sp", [-1, 3, 7, 2]], ["tile_y", "sp", [-1, 1, 3, 2]], ["tile_x", "sp", [-1, 2, 3, 1]], ["tile_rc", "sp", [-1, 7]], ["tile_ry", "sp", [-1, 1]], ["tile_rx", "sp", [-1, 1]], ["auto_unroll_max_step", "ot", 0], ["unroll_explicit", "ot", 0]]}, "result": [[0.03267565], 0, 3.771939754486084, 1639041200.9414556], "version": 0.2, "tvm_version": "0.8.dev0"}
{"input": ["cuda -keys=cuda,gpu -max_num_threads=1024 -thread_warp_size=32", "conv2d_nchw.cuda", [["TENSOR", [128, 336, 42, 42], "float32"], ["TENSOR", [168, 336, 1, 1], "float32"], 1, "SAME", 1, "float32"], {}], "config": {"index": 5620597, "code_hash": null, "entity": [["tile_f", "sp", [-1, 3, 4, 2]], ["tile_y", "sp", [-1, 3, 1, 2]], ["tile_x", "sp", [-1, 1, 7, 1]], ["tile_rc", "sp", [-1, 6]], ["tile_ry", "sp", [-1, 1]], ["tile_rx", "sp", [-1, 1]], ["auto_unroll_max_step", "ot", 0], ["unroll_explicit", "ot", 0]]}, "result": [[0.0416521], 0, 3.989959478378296, 1639041204.903279], "version": 0.2, "tvm_version": "0.8.dev0"}
{"input": ["cuda -keys=cuda,gpu -max_num_threads=1024 -thread_warp_size=32", "conv2d_nchw.cuda", [["TENSOR", [128, 336, 42, 42], "float32"], ["TENSOR", [168, 336, 1, 1], "float32"], 1, "SAME", 1, "float32"], {}], "config": {"index": 6743834, "code_hash": null, "entity": [["tile_f", "sp", [-1, 4, 2, 3]], ["tile_y", "sp", [-1, 1, 7, 1]], ["tile_x", "sp", [-1, 3, 2, 1]], ["tile_rc", "sp", [-1, 7]], ["tile_ry", "sp", [-1, 1]], ["tile_rx", "sp", [-1, 1]], ["auto_unroll_max_step", "ot", 0], ["unroll_explicit", "ot", 0]]}, "result": [[0.046448275000000004], 0, 3.702781915664673, 1639041208.3989801], "version": 0.2, "tvm_version": "0.8.dev0"}
{"input": ["cuda -keys=cuda,gpu -max_num_threads=1024 -thread_warp_size=32", "conv2d_nchw.cuda", [["TENSOR", [128, 336, 42, 42], "float32"], ["TENSOR", [168, 336, 1, 1], "float32"], 1, "SAME", 1, "float32"], {}], "config": {"index": 5571326, "code_hash": null, "entity": [["tile_f", "sp", [-1, 3, 7, 2]], ["tile_y", "sp", [-1, 3, 1, 1]], ["tile_x", "sp", [-1, 1, 6, 1]], ["tile_rc", "sp", [-1, 6]], ["tile_ry", "sp", [-1, 1]], ["tile_rx", "sp", [-1, 1]], ["auto_unroll_max_step", "ot", 0], ["unroll_explicit", "ot", 0]]}, "result": [[0.060187649999999995], 0, 3.8439509868621826, 1639041212.1520066], "version": 0.2, "tvm_version": "0.8.dev0"}
{"input": ["cuda -keys=cuda,gpu -max_num_threads=1024 -thread_warp_size=32", "conv2d_nchw.cuda", [["TENSOR", [128, 336, 42, 42], "float32"], ["TENSOR", [168, 336, 1, 1], "float32"], 1, "SAME", 1, "float32"], {}], "config": {"index": 31733566, "code_hash": null, "entity": [["tile_f", "sp", [-1, 3, 7, 2]], ["tile_y", "sp", [-1, 1, 3, 2]], ["tile_x", "sp", [-1, 2, 3, 1]], ["tile_rc", "sp", [-1, 6]], ["tile_ry", "sp", [-1, 1]], ["tile_rx", "sp", [-1, 1]], ["auto_unroll_max_step", "ot", 512], ["unroll_explicit", "ot", 0]]}, "result": [[0.027191083333333334], 0, 3.852703094482422, 1639041215.7558057], "version": 0.2, "tvm_version": "0.8.dev0"}
{"input": ["cuda -keys=cuda,gpu -max_num_threads=1024 -thread_warp_size=32", "conv2d_nchw.cuda", [["TENSOR", [128, 336, 42, 42], "float32"], ["TENSOR", [168, 336, 1, 1], "float32"], 1, "SAME", 1, "float32"], {}], "config": {"index": 57947966, "code_hash": null, "entity": [["tile_f", "sp", [-1, 3, 7, 2]], ["tile_y", "sp", [-1, 1, 3, 2]], ["tile_x", "sp", [-1, 2, 3, 1]], ["tile_rc", "sp", [-1, 6]], ["tile_ry", "sp", [-1, 1]], ["tile_rx", "sp", [-1, 1]], ["auto_unroll_max_step", "ot", 1500], ["unroll_explicit", "ot", 0]]}, "result": [[0.029285425], 0, 4.037414789199829, 1639041219.484439], "version": 0.2, "tvm_version": "0.8.dev0"}
{"input": ["cuda -keys=cuda,gpu -max_num_threads=1024 -thread_warp_size=32", "conv2d_nchw.cuda", [["TENSOR", [128, 336, 42, 42], "float32"], ["TENSOR", [168, 336, 1, 1], "float32"], 1, "SAME", 1, "float32"], {}], "config": {"index": 4315328, "code_hash": null, "entity": [["tile_f", "sp", [-1, 6, 7, 2]], ["tile_y", "sp", [-1, 1, 1, 6]], ["tile_x", "sp", [-1, 1, 7, 1]], ["tile_rc", "sp", [-1, 4]], ["tile_ry", "sp", [-1, 1]], ["tile_rx", "sp", [-1, 1]], ["auto_unroll_max_step", "ot", 0], ["unroll_explicit", "ot", 0]]}, "result": [[0.04360855], 0, 3.8637783527374268, 1639041223.383498], "version": 0.2, "tvm_version": "0.8.dev0"}
{"input": ["cuda -keys=cuda,gpu -max_num_threads=1024 -thread_warp_size=32", "conv2d_nchw.cuda", [["TENSOR", [128, 336, 42, 42], "float32"], ["TENSOR", [168, 336, 1, 1], "float32"], 1, "SAME", 1, "float32"], {}], "config": {"index": 5493885, "code_hash": null, "entity": [["tile_f", "sp", [-1, 2, 7, 2]], ["tile_y", "sp", [-1, 1, 6, 1]], ["tile_x", "sp", [-1, 1, 3, 1]], ["tile_rc", "sp", [-1, 6]], ["tile_ry", "sp", [-1, 1]], ["tile_rx", "sp", [-1, 1]], ["auto_unroll_max_step", "ot", 0], ["unroll_explicit", "ot", 0]]}, "result": [[0.054165625], 0, 3.86423659324646, 1639041227.071978], "version": 0.2, "tvm_version": "0.8.dev0"}
{"input": ["cuda -keys=cuda,gpu -max_num_threads=1024 -thread_warp_size=32", "conv2d_nchw.cuda", [["TENSOR", [128, 336, 42, 42], "float32"], ["TENSOR", [168, 336, 1, 1], "float32"], 1, "SAME", 1, "float32"], {}], "config": {"index": 5294521, "code_hash": null, "entity": [["tile_f", "sp", [-1, 2, 6, 2]], ["tile_y", "sp", [-1, 1, 7, 2]], ["tile_x", "sp", [-1, 3, 1, 1]], ["tile_rc", "sp", [-1, 6]], ["tile_ry", "sp", [-1, 1]], ["tile_rx", "sp", [-1, 1]], ["auto_unroll_max_step", "ot", 0], ["unroll_explicit", "ot", 0]]}, "result": [[0.09101904999999999], 0, 4.087186336517334, 1639041231.3997474], "version": 0.2, "tvm_version": "0.8.dev0"}
{"input": ["cuda -keys=cuda,gpu -max_num_threads=1024 -thread_warp_size=32", "conv2d_nchw.cuda", [["TENSOR", [128, 336, 42, 42], "float32"], ["TENSOR", [168, 336, 1, 1], "float32"], 1, "SAME", 1, "float32"], {}], "config": {"index": 4792767, "code_hash": null, "entity": [["tile_f", "sp", [-1, 4, 7, 2]], ["tile_y", "sp", [-1, 2, 1, 1]], ["tile_x", "sp", [-1, 1, 7, 3]], ["tile_rc", "sp", [-1, 4]], ["tile_ry", "sp", [-1, 1]], ["tile_rx", "sp", [-1, 1]], ["auto_unroll_max_step", "ot", 0], ["unroll_explicit", "ot", 0]]}, "result": [[0.034056675], 0, 3.6319477558135986, 1639041234.769127], "version": 0.2, "tvm_version": "0.8.dev0"}
{"input": ["cuda -keys=cuda,gpu -max_num_threads=1024 -thread_warp_size=32", "conv2d_nchw.cuda", [["TENSOR", [128, 336, 42, 42], "float32"], ["TENSOR", [168, 336, 1, 1], "float32"], 1, "SAME", 1, "float32"], {}], "config": {"index": 6882719, "code_hash": null, "entity": [["tile_f", "sp", [-1, 2, 4, 3]], ["tile_y", "sp", [-1, 7, 1, 1]], ["tile_x", "sp", [-1, 1, 6, 1]], ["tile_rc", "sp", [-1, 7]], ["tile_ry", "sp", [-1, 1]], ["tile_rx", "sp", [-1, 1]], ["auto_unroll_max_step", "ot", 0], ["unroll_explicit", "ot", 0]]}, "result": [[0.045601575], 0, 3.7470526695251465, 1639041239.3588192], "version": 0.2, "tvm_version": "0.8.dev0"}
{"input": ["cuda -keys=cuda,gpu -max_num_threads=1024 -thread_warp_size=32", "conv2d_nchw.cuda", [["TENSOR", [128, 336, 42, 42], "float32"], ["TENSOR", [168, 336, 1, 1], "float32"], 1, "SAME", 1, "float32"], {}], "config": {"index": 4332926, "code_hash": null, "entity": [["tile_f", "sp", [-1, 3, 7, 2]], ["tile_y", "sp", [-1, 1, 1, 3]], ["tile_x", "sp", [-1, 2, 7, 1]], ["tile_rc", "sp", [-1, 4]], ["tile_ry", "sp", [-1, 1]], ["tile_rx", "sp", [-1, 1]], ["auto_unroll_max_step", "ot", 0], ["unroll_explicit", "ot", 0]]}, "result": [[0.039730049999999996], 0, 3.980987071990967, 1639041243.5533628], "version": 0.2, "tvm_version": "0.8.dev0"}
{"input": ["cuda -keys=cuda,gpu -max_num_threads=1024 -thread_warp_size=32", "conv2d_nchw.cuda", [["TENSOR", [128, 336, 42, 42], "float32"], ["TENSOR", [168, 336, 1, 1], "float32"], 1, "SAME", 1, "float32"], {}], "config": {"index": 31733561, "code_hash": null, "entity": [["tile_f", "sp", [-1, 2, 6, 2]], ["tile_y", "sp", [-1, 1, 3, 2]], ["tile_x", "sp", [-1, 2, 3, 1]], ["tile_rc", "sp", [-1, 6]], ["tile_ry", "sp", [-1, 1]], ["tile_rx", "sp", [-1, 1]], ["auto_unroll_max_step", "ot", 512], ["unroll_explicit", "ot", 0]]}, "result": [[0.036519675], 0, 3.7473721504211426, 1639041247.172655], "version": 0.2, "tvm_version": "0.8.dev0"}
{"input": ["cuda -keys=cuda,gpu -max_num_threads=1024 -thread_warp_size=32", "conv2d_nchw.cuda", [["TENSOR", [128, 336, 42, 42], "float32"], ["TENSOR", [168, 336, 1, 1], "float32"], 1, "SAME", 1, "float32"], {}], "config": {"index": 57947961, "code_hash": null, "entity": [["tile_f", "sp", [-1, 2, 6, 2]], ["tile_y", "sp", [-1, 1, 3, 2]], ["tile_x", "sp", [-1, 2, 3, 1]], ["tile_rc", "sp", [-1, 6]], ["tile_ry", "sp", [-1, 1]], ["tile_rx", "sp", [-1, 1]], ["auto_unroll_max_step", "ot", 1500], ["unroll_explicit", "ot", 0]]}, "result": [[0.041277575], 0, 3.8304591178894043, 1639041250.8105757], "version": 0.2, "tvm_version": "0.8.dev0"}
{"input": ["cuda -keys=cuda,gpu -max_num_threads=1024 -thread_warp_size=32", "conv2d_nchw.cuda", [["TENSOR", [128, 336, 42, 42], "float32"], ["TENSOR", [168, 336, 1, 1], "float32"], 1, "SAME", 1, "float32"], {}], "config": {"index": 56764608, "code_hash": null, "entity": [["tile_f", "sp", [-1, 6, 7, 2]], ["tile_y", "sp", [-1, 1, 1, 6]], ["tile_x", "sp", [-1, 2, 7, 1]], ["tile_rc", "sp", [-1, 4]], ["tile_ry", "sp", [-1, 1]], ["tile_rx", "sp", [-1, 1]], ["auto_unroll_max_step", "ot", 1500], ["unroll_explicit", "ot", 0]]}, "result": [[0.026652000000000002], 0, 4.040120601654053, 1639041254.5618167], "version": 0.2, "tvm_version": "0.8.dev0"}
{"input": ["cuda -keys=cuda,gpu -max_num_threads=1024 -thread_warp_size=32", "conv2d_nchw.cuda", [["TENSOR", [128, 336, 42, 42], "float32"], ["TENSOR", [168, 336, 1, 1], "float32"], 1, "SAME", 1, "float32"], {}], "config": {"index": 30550208, "code_hash": null, "entity": [["tile_f", "sp", [-1, 6, 7, 2]], ["tile_y", "sp", [-1, 1, 1, 6]], ["tile_x", "sp", [-1, 2, 7, 1]], ["tile_rc", "sp", [-1, 4]], ["tile_ry", "sp", [-1, 1]], ["tile_rx", "sp", [-1, 1]], ["auto_unroll_max_step", "ot", 512], ["unroll_explicit", "ot", 0]]}, "result": [[0.035723700000000004], 0, 3.885923147201538, 1639041258.1507936], "version": 0.2, "tvm_version": "0.8.dev0"}
{"input": ["cuda -keys=cuda,gpu -max_num_threads=1024 -thread_warp_size=32", "conv2d_nchw.cuda", [["TENSOR", [128, 336, 42, 42], "float32"], ["TENSOR", [168, 336, 1, 1], "float32"], 1, "SAME", 1, "float32"], {}], "config": {"index": 6885599, "code_hash": null, "entity": [["tile_f", "sp", [-1, 2, 4, 3]], ["tile_y", "sp", [-1, 2, 3, 1]], ["tile_x", "sp", [-1, 1, 6, 1]], ["tile_rc", "sp", [-1, 7]], ["tile_ry", "sp", [-1, 1]], ["tile_rx", "sp", [-1, 1]], ["auto_unroll_max_step", "ot", 0], ["unroll_explicit", "ot", 0]]}, "result": [[0.06530045], 0, 3.8833224773406982, 1639041261.7492352], "version": 0.2, "tvm_version": "0.8.dev0"}
{"input": ["cuda -keys=cuda,gpu -max_num_threads=1024 -thread_warp_size=32", "conv2d_nchw.cuda", [["TENSOR", [128, 336, 42, 42], "float32"], ["TENSOR", [168, 336, 1, 1], "float32"], 1, "SAME", 1, "float32"], {}], "config": {"index": 4315327, "code_hash": null, "entity": [["tile_f", "sp", [-1, 4, 7, 2]], ["tile_y", "sp", [-1, 1, 1, 6]], ["tile_x", "sp", [-1, 1, 7, 1]], ["tile_rc", "sp", [-1, 4]], ["tile_ry", "sp", [-1, 1]], ["tile_rx", "sp", [-1, 1]], ["auto_unroll_max_step", "ot", 0], ["unroll_explicit", "ot", 0]]}, "result": [[0.0366612], 0, 3.7446577548980713, 1639041265.2986953], "version": 0.2, "tvm_version": "0.8.dev0"}
{"input": ["cuda -keys=cuda,gpu -max_num_threads=1024 -thread_warp_size=32", "conv2d_nchw.cuda", [["TENSOR", [128, 336, 42, 42], "float32"], ["TENSOR", [168, 336, 1, 1], "float32"], 1, "SAME", 1, "float32"], {}], "config": {"index": 5573566, "code_hash": null, "entity": [["tile_f", "sp", [-1, 3, 7, 2]], ["tile_y", "sp", [-1, 3, 2, 1]], ["tile_x", "sp", [-1, 1, 6, 1]], ["tile_rc", "sp", [-1, 6]], ["tile_ry", "sp", [-1, 1]], ["tile_rx", "sp", [-1, 1]], ["auto_unroll_max_step", "ot", 0], ["unroll_explicit", "ot", 0]]}, "result": [[0.037945374999999996], 0, 3.8346056938171387, 1639041269.0195525], "version": 0.2, "tvm_version": "0.8.dev0"}
{"input": ["cuda -keys=cuda,gpu -max_num_threads=1024 -thread_warp_size=32", "conv2d_nchw.cuda", [["TENSOR", [128, 336, 42, 42], "float32"], ["TENSOR", [168, 336, 1, 1], "float32"], 1, "SAME", 1, "float32"], {}], "config": {"index": 58310841, "code_hash": null, "entity": [["tile_f", "sp", [-1, 2, 6, 2]], ["tile_y", "sp", [-1, 2, 3, 1]], ["tile_x", "sp", [-1, 1, 3, 2]], ["tile_rc", "sp", [-1, 6]], ["tile_ry", "sp", [-1, 1]], ["tile_rx", "sp", [-1, 1]], ["auto_unroll_max_step", "ot", 1500], ["unroll_explicit", "ot", 0]]}, "result": [[0.033234975], 0, 3.782886266708374, 1639041272.5352356], "version": 0.2, "tvm_version": "0.8.dev0"}
{"input": ["cuda -keys=cuda,gpu -max_num_threads=1024 -thread_warp_size=32", "conv2d_nchw.cuda", [["TENSOR", [128, 336, 42, 42], "float32"], ["TENSOR", [168, 336, 1, 1], "float32"], 1, "SAME", 1, "float32"], {}], "config": {"index": 6743152, "code_hash": null, "entity": [["tile_f", "sp", [-1, 4, 3, 2]], ["tile_y", "sp", [-1, 1, 6, 1]], ["tile_x", "sp", [-1, 3, 2, 1]], ["tile_rc", "sp", [-1, 7]], ["tile_ry", "sp", [-1, 1]], ["tile_rx", "sp", [-1, 1]], ["auto_unroll_max_step", "ot", 0], ["unroll_explicit", "ot", 0]]}, "result": [[0.057215325], 0, 4.018712520599365, 1639041276.47735], "version": 0.2, "tvm_version": "0.8.dev0"}
{"input": ["cuda -keys=cuda,gpu -max_num_threads=1024 -thread_warp_size=32", "conv2d_nchw.cuda", [["TENSOR", [128, 336, 42, 42], "float32"], ["TENSOR", [168, 336, 1, 1], "float32"], 1, "SAME", 1, "float32"], {}], "config": {"index": 8627268, "code_hash": null, "entity": [["tile_f", "sp", [-1, 3, 14, 1]], ["tile_y", "sp", [-1, 1, 6, 1]], ["tile_x", "sp", [-1, 2, 1, 3]], ["tile_rc", "sp", [-1, 8]], ["tile_ry", "sp", [-1, 1]], ["tile_rx", "sp", [-1, 1]], ["auto_unroll_max_step", "ot", 0], ["unroll_explicit", "ot", 0]]}, "result": [[0.03871535], 0, 3.691164970397949, 1639041279.8834786], "version": 0.2, "tvm_version": "0.8.dev0"}
{"input": ["cuda -keys=cuda,gpu -max_num_threads=1024 -thread_warp_size=32", "conv2d_nchw.cuda", [["TENSOR", [128, 336, 42, 42], "float32"], ["TENSOR", [168, 336, 1, 1], "float32"], 1, "SAME", 1, "float32"], {}], "config": {"index": 4269877, "code_hash": null, "entity": [["tile_f", "sp", [-1, 3, 4, 2]], ["tile_y", "sp", [-1, 1, 3, 2]], ["tile_x", "sp", [-1, 1, 6, 1]], ["tile_rc", "sp", [-1, 4]], ["tile_ry", "sp", [-1, 1]], ["tile_rx", "sp", [-1, 1]], ["auto_unroll_max_step", "ot", 0], ["unroll_explicit", "ot", 0]]}, "result": [[0.043600349999999996], 0, 3.9886879920959473, 1639041283.7816966], "version": 0.2, "tvm_version": "0.8.dev0"}
{"input": ["cuda -keys=cuda,gpu -max_num_threads=1024 -thread_warp_size=32", "conv2d_nchw.cuda", [["TENSOR", [128, 336, 42, 42], "float32"], ["TENSOR", [168, 336, 1, 1], "float32"], 1, "SAME", 1, "float32"], {}], "config": {"index": 4356288, "code_hash": null, "entity": [["tile_f", "sp", [-1, 6, 7, 2]], ["tile_y", "sp", [-1, 1, 1, 6]], ["tile_x", "sp", [-1, 3, 7, 1]], ["tile_rc", "sp", [-1, 4]], ["tile_ry", "sp", [-1, 1]], ["tile_rx", "sp", [-1, 1]], ["auto_unroll_max_step", "ot", 0], ["unroll_explicit", "ot", 0]]}, "result": [[0.033664099999999995], 0, 3.991441488265991, 1639041287.6440809], "version": 0.2, "tvm_version": "0.8.dev0"}
{"input": ["cuda -keys=cuda,gpu -max_num_threads=1024 -thread_warp_size=32", "conv2d_nchw.cuda", [["TENSOR", [128, 336, 42, 42], "float32"], ["TENSOR", [168, 336, 1, 1], "float32"], 1, "SAME", 1, "float32"], {}], "config": {"index": 31788925, "code_hash": null, "entity": [["tile_f", "sp", [-1, 2, 7, 2]], ["tile_y", "sp", [-1, 1, 3, 1]], ["tile_x", "sp", [-1, 1, 6, 1]], ["tile_rc", "sp", [-1, 6]], ["tile_ry", "sp", [-1, 1]], ["tile_rx", "sp", [-1, 1]], ["auto_unroll_max_step", "ot", 512], ["unroll_explicit", "ot", 0]]}, "result": [[0.051044675], 0, 3.832981586456299, 1639041291.335534], "version": 0.2, "tvm_version": "0.8.dev0"}
{"input": ["cuda -keys=cuda,gpu -max_num_threads=1024 -thread_warp_size=32", "conv2d_nchw.cuda", [["TENSOR", [128, 336, 42, 42], "float32"], ["TENSOR", [168, 336, 1, 1], "float32"], 1, "SAME", 1, "float32"], {}], "config": {"index": 58003325, "code_hash": null, "entity": [["tile_f", "sp", [-1, 2, 7, 2]], ["tile_y", "sp", [-1, 1, 3, 1]], ["tile_x", "sp", [-1, 1, 6, 1]], ["tile_rc", "sp", [-1, 6]], ["tile_ry", "sp", [-1, 1]], ["tile_rx", "sp", [-1, 1]], ["auto_unroll_max_step", "ot", 1500], ["unroll_explicit", "ot", 0]]}, "result": [[0.051998775000000004], 0, 4.116981267929077, 1639041295.24894], "version": 0.2, "tvm_version": "0.8.dev0"}
{"input": ["cuda -keys=cuda,gpu -max_num_threads=1024 -thread_warp_size=32", "conv2d_nchw.cuda", [["TENSOR", [128, 336, 42, 42], "float32"], ["TENSOR", [168, 336, 1, 1], "float32"], 1, "SAME", 1, "float32"], {}], "config": {"index": 31788926, "code_hash": null, "entity": [["tile_f", "sp", [-1, 3, 7, 2]], ["tile_y", "sp", [-1, 1, 3, 1]], ["tile_x", "sp", [-1, 1, 6, 1]], ["tile_rc", "sp", [-1, 6]], ["tile_ry", "sp", [-1, 1]], ["tile_rx", "sp", [-1, 1]], ["auto_unroll_max_step", "ot", 512], ["unroll_explicit", "ot", 0]]}, "result": [[0.050364775], 0, 3.869459867477417, 1639041299.3649497], "version": 0.2, "tvm_version": "0.8.dev0"}
{"input": ["cuda -keys=cuda,gpu -max_num_threads=1024 -thread_warp_size=32", "conv2d_nchw.cuda", [["TENSOR", [128, 336, 42, 42], "float32"], ["TENSOR", [168, 336, 1, 1], "float32"], 1, "SAME", 1, "float32"], {}], "config": {"index": 58003326, "code_hash": null, "entity": [["tile_f", "sp", [-1, 3, 7, 2]], ["tile_y", "sp", [-1, 1, 3, 1]], ["tile_x", "sp", [-1, 1, 6, 1]], ["tile_rc", "sp", [-1, 6]], ["tile_ry", "sp", [-1, 1]], ["tile_rx", "sp", [-1, 1]], ["auto_unroll_max_step", "ot", 1500], ["unroll_explicit", "ot", 0]]}, "result": [[0.041766599999999994], 0, 3.8642160892486572, 1639041303.1991732], "version": 0.2, "tvm_version": "0.8.dev0"}
{"input": ["cuda -keys=cuda,gpu -max_num_threads=1024 -thread_warp_size=32", "conv2d_nchw.cuda", [["TENSOR", [128, 336, 42, 42], "float32"], ["TENSOR", [168, 336, 1, 1], "float32"], 1, "SAME", 1, "float32"], {}], "config": {"index": 4183784, "code_hash": null, "entity": [["tile_f", "sp", [-1, 3, 2, 2]], ["tile_y", "sp", [-1, 1, 7, 1]], ["tile_x", "sp", [-1, 1, 3, 1]], ["tile_rc", "sp", [-1, 4]], ["tile_ry", "sp", [-1, 1]], ["tile_rx", "sp", [-1, 1]], ["auto_unroll_max_step", "ot", 0], ["unroll_explicit", "ot", 0]]}, "result": [[0.084706125], 0, 4.79109525680542, 1639041307.6905339], "version": 0.2, "tvm_version": "0.8.dev0"}
{"input": ["cuda -keys=cuda,gpu -max_num_threads=1024 -thread_warp_size=32", "conv2d_nchw.cuda", [["TENSOR", [128, 336, 42, 42], "float32"], ["TENSOR", [168, 336, 1, 1], "float32"], 1, "SAME", 1, "float32"], {}], "config": {"index": 84162366, "code_hash": null, "entity": [["tile_f", "sp", [-1, 3, 7, 2]], ["tile_y", "sp", [-1, 1, 3, 2]], ["tile_x", "sp", [-1, 2, 3, 1]], ["tile_rc", "sp", [-1, 6]], ["tile_ry", "sp", [-1, 1]], ["tile_rx", "sp", [-1, 1]], ["auto_unroll_max_step", "ot", 0], ["unroll_explicit", "ot", 1]]}, "result": [[0.037750324999999994], 0, 3.7888922691345215, 1639041311.4324214], "version": 0.2, "tvm_version": "0.8.dev0"}
{"input": ["cuda -keys=cuda,gpu -max_num_threads=1024 -thread_warp_size=32", "conv2d_nchw.cuda", [["TENSOR", [128, 336, 42, 42], "float32"], ["TENSOR", [168, 336, 1, 1], "float32"], 1, "SAME", 1, "float32"], {}], "config": {"index": 31795001, "code_hash": null, "entity": [["tile_f", "sp", [-1, 2, 6, 2]], ["tile_y", "sp", [-1, 1, 3, 2]], ["tile_x", "sp", [-1, 1, 6, 1]], ["tile_rc", "sp", [-1, 6]], ["tile_ry", "sp", [-1, 1]], ["tile_rx", "sp", [-1, 1]], ["auto_unroll_max_step", "ot", 512], ["unroll_explicit", "ot", 0]]}, "result": [[0.04012095], 0, 3.835207223892212, 1639041315.2377248], "version": 0.2, "tvm_version": "0.8.dev0"}
{"input": ["cuda -keys=cuda,gpu -max_num_threads=1024 -thread_warp_size=32", "conv2d_nchw.cuda", [["TENSOR", [128, 336, 42, 42], "float32"], ["TENSOR", [168, 336, 1, 1], "float32"], 1, "SAME", 1, "float32"], {}], "config": {"index": 58009401, "code_hash": null, "entity": [["tile_f", "sp", [-1, 2, 6, 2]], ["tile_y", "sp", [-1, 1, 3, 2]], ["tile_x", "sp", [-1, 1, 6, 1]], ["tile_rc", "sp", [-1, 6]], ["tile_ry", "sp", [-1, 1]], ["tile_rx", "sp", [-1, 1]], ["auto_unroll_max_step", "ot", 1500], ["unroll_explicit", "ot", 0]]}, "result": [[0.04279415], 0, 4.118214845657349, 1639041319.192287], "version": 0.2, "tvm_version": "0.8.dev0"}
{"input": ["cuda -keys=cuda,gpu -max_num_threads=1024 -thread_warp_size=32", "conv2d_nchw.cuda", [["TENSOR", [128, 336, 42, 42], "float32"], ["TENSOR", [168, 336, 1, 1], "float32"], 1, "SAME", 1, "float32"], {}], "config": {"index": 6923359, "code_hash": null, "entity": [["tile_f", "sp", [-1, 2, 4, 3]], ["tile_y", "sp", [-1, 6, 1, 1]], ["tile_x", "sp", [-1, 1, 7, 1]], ["tile_rc", "sp", [-1, 7]], ["tile_ry", "sp", [-1, 1]], ["tile_rx", "sp", [-1, 1]], ["auto_unroll_max_step", "ot", 0], ["unroll_explicit", "ot", 0]]}, "result": [[0.044564950000000006], 0, 4.394935846328735, 1639041323.8065257], "version": 0.2, "tvm_version": "0.8.dev0"}
{"input": ["cuda -keys=cuda,gpu -max_num_threads=1024 -thread_warp_size=32", "conv2d_nchw.cuda", [["TENSOR", [128, 336, 42, 42], "float32"], ["TENSOR", [168, 336, 1, 1], "float32"], 1, "SAME", 1, "float32"], {}], "config": {"index": 5573246, "code_hash": null, "entity": [["tile_f", "sp", [-1, 3, 7, 2]], ["tile_y", "sp", [-1, 1, 2, 1]], ["tile_x", "sp", [-1, 1, 6, 1]], ["tile_rc", "sp", [-1, 6]], ["tile_ry", "sp", [-1, 1]], ["tile_rx", "sp", [-1, 1]], ["auto_unroll_max_step", "ot", 0], ["unroll_explicit", "ot", 0]]}, "result": [[0.0486667], 0, 4.177308797836304, 1639041328.250314], "version": 0.2, "tvm_version": "0.8.dev0"}
{"input": ["cuda -keys=cuda,gpu -max_num_threads=1024 -thread_warp_size=32", "conv2d_nchw.cuda", [["TENSOR", [128, 336, 42, 42], "float32"], ["TENSOR", [168, 336, 1, 1], "float32"], 1, "SAME", 1, "float32"], {}], "config": {"index": 4755646, "code_hash": null, "entity": [["tile_f", "sp", [-1, 3, 7, 2]], ["tile_y", "sp", [-1, 2, 3, 1]], ["tile_x", "sp", [-1, 1, 2, 3]], ["tile_rc", "sp", [-1, 4]], ["tile_ry", "sp", [-1, 1]], ["tile_rx", "sp", [-1, 1]], ["auto_unroll_max_step", "ot", 0], ["unroll_explicit", "ot", 0]]}, "result": [[0.049742775], 0, 3.93188738822937, 1639041337.111031], "version": 0.2, "tvm_version": "0.8.dev0"}
{"input": ["cuda -keys=cuda,gpu -max_num_threads=1024 -thread_warp_size=32", "conv2d_nchw.cuda", [["TENSOR", [128, 336, 42, 42], "float32"], ["TENSOR", [168, 336, 1, 1], "float32"], 1, "SAME", 1, "float32"], {}], "config": {"index": 4268912, "code_hash": null, "entity": [["tile_f", "sp", [-1, 4, 3, 2]], ["tile_y", "sp", [-1, 3, 1, 2]], ["tile_x", "sp", [-1, 1, 6, 1]], ["tile_rc", "sp", [-1, 4]], ["tile_ry", "sp", [-1, 1]], ["tile_rx", "sp", [-1, 1]], ["auto_unroll_max_step", "ot", 0], ["unroll_explicit", "ot", 0]]}, "result": [[0.05425485], 0, 4.066808462142944, 1639041341.1849897], "version": 0.2, "tvm_version": "0.8.dev0"}
{"input": ["cuda -keys=cuda,gpu -max_num_threads=1024 -thread_warp_size=32", "conv2d_nchw.cuda", [["TENSOR", [128, 336, 42, 42], "float32"], ["TENSOR", [168, 336, 1, 1], "float32"], 1, "SAME", 1, "float32"], {}], "config": {"index": 4432437, "code_hash": null, "entity": [["tile_f", "sp", [-1, 3, 4, 2]], ["tile_y", "sp", [-1, 1, 1, 2]], ["tile_x", "sp", [-1, 1, 21, 1]], ["tile_rc", "sp", [-1, 4]], ["tile_ry", "sp", [-1, 1]], ["tile_rx", "sp", [-1, 1]], ["auto_unroll_max_step", "ot", 0], ["unroll_explicit", "ot", 0]]}, "result": [[0.0359476], 0, 4.5045390129089355, 1639041345.3512037], "version": 0.2, "tvm_version": "0.8.dev0"}
