artifacts/Table3/tvm/autotvm/conv/conv2d_128_2016_11_11_336_1_1_1_0.log
{"input": ["cuda -keys=cuda,gpu -max_num_threads=1024 -thread_warp_size=32", "conv2d_nchw.cuda", [["TENSOR", [128, 2016, 11, 11], "float32"], ["TENSOR", [336, 2016, 1, 1], "float32"], 1, "SAME", 1, "float32"], {}], "config": {"index": 23683, "code_hash": null, "entity": [["tile_f", "sp", [-1, 1, 3, 2]], ["tile_y", "sp", [-1, 1, 11, 1]], ["tile_x", "sp", [-1, 1, 11, 1]], ["tile_rc", "sp", [-1, 3]], ["tile_ry", "sp", [-1, 1]], ["tile_rx", "sp", [-1, 1]], ["auto_unroll_max_step", "ot", 0], ["unroll_explicit", "ot", 0]]}, "result": [[0.093228825], 0, 2.0332891941070557, 1638898024.294006], "version": 0.2, "tvm_version": "0.8.dev0"}
{"input": ["cuda -keys=cuda,gpu -max_num_threads=1024 -thread_warp_size=32", "conv2d_nchw.cuda", [["TENSOR", [128, 2016, 11, 11], "float32"], ["TENSOR", [336, 2016, 1, 1], "float32"], 1, "SAME", 1, "float32"], {}], "config": {"index": 1541321, "code_hash": null, "entity": [["tile_f", "sp", [-1, 1, 14, 2]], ["tile_y", "sp", [-1, 1, 1, 1]], ["tile_x", "sp", [-1, 1, 1, 1]], ["tile_rc", "sp", [-1, 224]], ["tile_ry", "sp", [-1, 1]], ["tile_rx", "sp", [-1, 1]], ["auto_unroll_max_step", "ot", 512], ["unroll_explicit", "ot", 1]]}, "result": [[2.050031975], 0, 13.562627077102661, 1638898036.1050587], "version": 0.2, "tvm_version": "0.8.dev0"}
{"input": ["cuda -keys=cuda,gpu -max_num_threads=1024 -thread_warp_size=32", "conv2d_nchw.cuda", [["TENSOR", [128, 2016, 11, 11], "float32"], ["TENSOR", [336, 2016, 1, 1], "float32"], 1, "SAME", 1, "float32"], {}], "config": {"index": 1027568, "code_hash": null, "entity": [["tile_f", "sp", [-1, 8, 1, 42]], ["tile_y", "sp", [-1, 1, 11, 1]], ["tile_x", "sp", [-1, 1, 11, 1]], ["tile_rc", "sp", [-1, 8]], ["tile_ry", "sp", [-1, 1]], ["tile_rx", "sp", [-1, 1]], ["auto_unroll_max_step", "ot", 0], ["unroll_explicit", "ot", 1]]}, "result": [[0.6554655749999999], 0, 5.228515148162842, 1638898041.743865], "version": 0.2, "tvm_version": "0.8.dev0"}
{"input": ["cuda -keys=cuda,gpu -max_num_threads=1024 -thread_warp_size=32", "conv2d_nchw.cuda", [["TENSOR", [128, 2016, 11, 11], "float32"], ["TENSOR", [336, 2016, 1, 1], "float32"], 1, "SAME", 1, "float32"], {}], "config": {"index": 391044, "code_hash": null, "entity": [["tile_f", "sp", [-1, 2, 3, 2]], ["tile_y", "sp", [-1, 1, 11, 1]], ["tile_x", "sp", [-1, 1, 11, 1]], ["tile_rc", "sp", [-1, 9]], ["tile_ry", "sp", [-1, 1]], ["tile_rx", "sp", [-1, 1]], ["auto_unroll_max_step", "ot", 512], ["unroll_explicit", "ot", 0]]}, "result": [[0.048749425], 0, 1.735898733139038, 1638898044.0915473], "version": 0.2, "tvm_version": "0.8.dev0"}
{"input": ["cuda -keys=cuda,gpu -max_num_threads=1024 -thread_warp_size=32", "conv2d_nchw.cuda", [["TENSOR", [128, 2016, 11, 11], "float32"], ["TENSOR", [336, 2016, 1, 1], "float32"], 1, "SAME", 1, "float32"], {}], "config": {"index": 719299, "code_hash": null, "entity": [["tile_f", "sp", [-1, 2, 14, 3]], ["tile_y", "sp", [-1, 1, 1, 1]], ["tile_x", "sp", [-1, 11, 1, 1]], ["tile_rc", "sp", [-1, 12]], ["tile_ry", "sp", [-1, 1]], ["tile_rx", "sp", [-1, 1]], ["auto_unroll_max_step", "ot", 1500], ["unroll_explicit", "ot", 0]]}, "result": [[0.04681035], 0, 2.0136125087738037, 1638898045.6529324], "version": 0.2, "tvm_version": "0.8.dev0"}
{"input": ["cuda -keys=cuda,gpu -max_num_threads=1024 -thread_warp_size=32", "conv2d_nchw.cuda", [["TENSOR", [128, 2016, 11, 11], "float32"], ["TENSOR", [336, 2016, 1, 1], "float32"], 1, "SAME", 1, "float32"], {}], "config": {"index": 1418363, "code_hash": null, "entity": [["tile_f", "sp", [-1, 1, 28, 12]], ["tile_y", "sp", [-1, 1, 1, 1]], ["tile_x", "sp", [-1, 11, 1, 1]], ["tile_rc", "sp", [-1, 28]], ["tile_ry", "sp", [-1, 1]], ["tile_rx", "sp", [-1, 1]], ["auto_unroll_max_step", "ot", 512], ["unroll_explicit", "ot", 1]]}, "result": [[0.29274747500000003], 0, 3.878499746322632, 1638898050.3882325], "version": 0.2, "tvm_version": "0.8.dev0"}
{"input": ["cuda -keys=cuda,gpu -max_num_threads=1024 -thread_warp_size=32", "conv2d_nchw.cuda", [["TENSOR", [128, 2016, 11, 11], "float32"], ["TENSOR", [336, 2016, 1, 1], "float32"], 1, "SAME", 1, "float32"], {}], "config": {"index": 1408236, "code_hash": null, "entity": [["tile_f", "sp", [-1, 1, 24, 7]], ["tile_y", "sp", [-1, 1, 11, 1]], ["tile_x", "sp", [-1, 1, 1, 1]], ["tile_rc", "sp", [-1, 24]], ["tile_ry", "sp", [-1, 1]], ["tile_rx", "sp", [-1, 1]], ["auto_unroll_max_step", "ot", 512], ["unroll_explicit", "ot", 1]]}, "result": [[0.045408775], 0, 1.8740384578704834, 1638898051.9304194], "version": 0.2, "tvm_version": "0.8.dev0"}
{"input": ["cuda -keys=cuda,gpu -max_num_threads=1024 -thread_warp_size=32", "conv2d_nchw.cuda", [["TENSOR", [128, 2016, 11, 11], "float32"], ["TENSOR", [336, 2016, 1, 1], "float32"], 1, "SAME", 1, "float32"], {}], "config": {"index": 1076407, "code_hash": null, "entity": [["tile_f", "sp", [-1, 7, 12, 1]], ["tile_y", "sp", [-1, 1, 11, 1]], ["tile_x", "sp", [-1, 1, 1, 1]], ["tile_rc", "sp", [-1, 21]], ["tile_ry", "sp", [-1, 1]], ["tile_rx", "sp", [-1, 1]], ["auto_unroll_max_step", "ot", 0], ["unroll_explicit", "ot", 1]]}, "result": [[0.0697574], 0, 1.8438937664031982, 1638898055.2236574], "version": 0.2, "tvm_version": "0.8.dev0"}
{"input": ["cuda -keys=cuda,gpu -max_num_threads=1024 -thread_warp_size=32", "conv2d_nchw.cuda", [["TENSOR", [128, 2016, 11, 11], "float32"], ["TENSOR", [336, 2016, 1, 1], "float32"], 1, "SAME", 1, "float32"], {}], "config": {"index": 48250, "code_hash": null, "entity": [["tile_f", "sp", [-1, 1, 14, 1]], ["tile_y", "sp", [-1, 1, 11, 1]], ["tile_x", "sp", [-1, 11, 1, 1]], ["tile_rc", "sp", [-1, 7]], ["tile_ry", "sp", [-1, 1]], ["tile_rx", "sp", [-1, 1]], ["auto_unroll_max_step", "ot", 0], ["unroll_explicit", "ot", 0]]}, "result": [[0.0541354], 0, 1.7272000312805176, 1638898057.4810872], "version": 0.2, "tvm_version": "0.8.dev0"}
{"input": ["cuda -keys=cuda,gpu -max_num_threads=1024 -thread_warp_size=32", "conv2d_nchw.cuda", [["TENSOR", [128, 2016, 11, 11], "float32"], ["TENSOR", [336, 2016, 1, 1], "float32"], 1, "SAME", 1, "float32"], {}], "config": {"index": 157191, "code_hash": null, "entity": [["tile_f", "sp", [-1, 1, 12, 7]], ["tile_y", "sp", [-1, 1, 1, 1]], ["tile_x", "sp", [-1, 1, 11, 1]], ["tile_rc", "sp", [-1, 42]], ["tile_ry", "sp", [-1, 1]], ["tile_rx", "sp", [-1, 1]], ["auto_unroll_max_step", "ot", 0], ["unroll_explicit", "ot", 0]]}, "result": [[0.06250435], 0, 1.8263752460479736, 1638898059.9214299], "version": 0.2, "tvm_version": "0.8.dev0"}
{"input": ["cuda -keys=cuda,gpu -max_num_threads=1024 -thread_warp_size=32", "conv2d_nchw.cuda", [["TENSOR", [128, 2016, 11, 11], "float32"], ["TENSOR", [336, 2016, 1, 1], "float32"], 1, "SAME", 1, "float32"], {}], "config": {"index": 695685, "code_hash": null, "entity": [["tile_f", "sp", [-1, 4, 3, 2]], ["tile_y", "sp", [-1, 1, 11, 1]], ["tile_x", "sp", [-1, 1, 11, 1]], ["tile_rc", "sp", [-1, 7]], ["tile_ry", "sp", [-1, 1]], ["tile_rx", "sp", [-1, 1]], ["auto_unroll_max_step", "ot", 1500], ["unroll_explicit", "ot", 0]]}, "result": [[0.046648024999999996], 0, 1.7690606117248535, 1638898061.4623337], "version": 0.2, "tvm_version": "0.8.dev0"}
{"input": ["cuda -keys=cuda,gpu -max_num_threads=1024 -thread_warp_size=32", "conv2d_nchw.cuda", [["TENSOR", [128, 2016, 11, 11], "float32"], ["TENSOR", [336, 2016, 1, 1], "float32"], 1, "SAME", 1, "float32"], {}], "config": {"index": 1074778, "code_hash": null, "entity": [["tile_f", "sp", [-1, 4, 1, 2]], ["tile_y", "sp", [-1, 1, 1, 11]], ["tile_x", "sp", [-1, 1, 1, 11]], ["tile_rc", "sp", [-1, 18]], ["tile_ry", "sp", [-1, 1]], ["tile_rx", "sp", [-1, 1]], ["auto_unroll_max_step", "ot", 0], ["unroll_explicit", "ot", 1]]}, "result": [[16.608794999999997], 0, 85.1252715587616, 1638898146.6969237], "version": 0.2, "tvm_version": "0.8.dev0"}
{"input": ["cuda -keys=cuda,gpu -max_num_threads=1024 -thread_warp_size=32", "conv2d_nchw.cuda", [["TENSOR", [128, 2016, 11, 11], "float32"], ["TENSOR", [336, 2016, 1, 1], "float32"], 1, "SAME", 1, "float32"], {}], "config": {"index": 22865, "code_hash": null, "entity": [["tile_f", "sp", [-1, 6, 4, 14]], ["tile_y", "sp", [-1, 1, 1, 1]], ["tile_x", "sp", [-1, 1, 11, 1]], ["tile_rc", "sp", [-1, 3]], ["tile_ry", "sp", [-1, 1]], ["tile_rx", "sp", [-1, 1]], ["auto_unroll_max_step", "ot", 0], ["unroll_explicit", "ot", 0]]}, "result": [[0.1633414], 0, 2.3773622512817383, 1638898148.7952816], "version": 0.2, "tvm_version": "0.8.dev0"}
{"input": ["cuda -keys=cuda,gpu -max_num_threads=1024 -thread_warp_size=32", "conv2d_nchw.cuda", [["TENSOR", [128, 2016, 11, 11], "float32"], ["TENSOR", [336, 2016, 1, 1], "float32"], 1, "SAME", 1, "float32"], {}], "config": {"index": 1653201, "code_hash": null, "entity": [["tile_f", "sp", [-1, 14, 8, 1]], ["tile_y", "sp", [-1, 1, 1, 1]], ["tile_x", "sp", [-1, 1, 11, 1]], ["tile_rc", "sp", [-1, 6]], ["tile_ry", "sp", [-1, 1]], ["tile_rx", "sp", [-1, 1]], ["auto_unroll_max_step", "ot", 1500], ["unroll_explicit", "ot", 1]]}, "result": [[0.044732575], 0, 1.6958441734313965, 1638898151.0479977], "version": 0.2, "tvm_version": "0.8.dev0"}
{"input": ["cuda -keys=cuda,gpu -max_num_threads=1024 -thread_warp_size=32", "conv2d_nchw.cuda", [["TENSOR", [128, 2016, 11, 11], "float32"], ["TENSOR", [336, 2016, 1, 1], "float32"], 1, "SAME", 1, "float32"], {}], "config": {"index": 463391, "code_hash": null, "entity": [["tile_f", "sp", [-1, 2, 1, 4]], ["tile_y", "sp", [-1, 1, 1, 11]], ["tile_x", "sp", [-1, 1, 11, 1]], ["tile_rc", "sp", [-1, 32]], ["tile_ry", "sp", [-1, 1]], ["tile_rx", "sp", [-1, 1]], ["auto_unroll_max_step", "ot", 512], ["unroll_explicit", "ot", 0]]}, "result": [[0.181891575], 0, 3.0020012855529785, 1638898154.2260377], "version": 0.2, "tvm_version": "0.8.dev0"}
{"input": ["cuda -keys=cuda,gpu -max_num_threads=1024 -thread_warp_size=32", "conv2d_nchw.cuda", [["TENSOR", [128, 2016, 11, 11], "float32"], ["TENSOR", [336, 2016, 1, 1], "float32"], 1, "SAME", 1, "float32"], {}], "config": {"index": 73104, "code_hash": null, "entity": [["tile_f", "sp", [-1, 1, 7, 4]], ["tile_y", "sp", [-1, 1, 11, 1]], ["tile_x", "sp", [-1, 1, 1, 1]], ["tile_rc", "sp", [-1, 12]], ["tile_ry", "sp", [-1, 1]], ["tile_rx", "sp", [-1, 1]], ["auto_unroll_max_step", "ot", 0], ["unroll_explicit", "ot", 0]]}, "result": [[0.061366149999999994], 0, 1.7921075820922852, 1638898157.4730422], "version": 0.2, "tvm_version": "0.8.dev0"}
{"input": ["cuda -keys=cuda,gpu -max_num_threads=1024 -thread_warp_size=32", "conv2d_nchw.cuda", [["TENSOR", [128, 2016, 11, 11], "float32"], ["TENSOR", [336, 2016, 1, 1], "float32"], 1, "SAME", 1, "float32"], {}], "config": {"index": 464923, "code_hash": null, "entity": [["tile_f", "sp", [-1, 1, 56, 1]], ["tile_y", "sp", [-1, 1, 11, 1]], ["tile_x", "sp", [-1, 1, 1, 11]], ["tile_rc", "sp", [-1, 32]], ["tile_ry", "sp", [-1, 1]], ["tile_rx", "sp", [-1, 1]], ["auto_unroll_max_step", "ot", 512], ["unroll_explicit", "ot", 0]]}, "result": [[0.04582565], 0, 1.9472436904907227, 1638898170.3035586], "version": 0.2, "tvm_version": "0.8.dev0"}
{"input": ["cuda -keys=cuda,gpu -max_num_threads=1024 -thread_warp_size=32", "conv2d_nchw.cuda", [["TENSOR", [128, 2016, 11, 11], "float32"], ["TENSOR", [336, 2016, 1, 1], "float32"], 1, "SAME", 1, "float32"], {}], "config": {"index": 725873, "code_hash": null, "entity": [["tile_f", "sp", [-1, 3, 28, 1]], ["tile_y", "sp", [-1, 1, 1, 1]], ["tile_x", "sp", [-1, 1, 1, 1]], ["tile_rc", "sp", [-1, 14]], ["tile_ry", "sp", [-1, 1]], ["tile_rx", "sp", [-1, 1]], ["auto_unroll_max_step", "ot", 1500], ["unroll_explicit", "ot", 0]]}, "result": [[0.19160307499999998], 0, 2.5555202960968018, 1638898172.5781069], "version": 0.2, "tvm_version": "0.8.dev0"}
{"input": ["cuda -keys=cuda,gpu -max_num_threads=1024 -thread_warp_size=32", "conv2d_nchw.cuda", [["TENSOR", [128, 2016, 11, 11], "float32"], ["TENSOR", [336, 2016, 1, 1], "float32"], 1, "SAME", 1, "float32"], {}], "config": {"index": 1178293, "code_hash": null, "entity": [["tile_f", "sp", [-1, 14, 4, 1]], ["tile_y", "sp", [-1, 1, 1, 1]], ["tile_x", "sp", [-1, 1, 11, 1]], ["tile_rc", "sp", [-1, 96]], ["tile_ry", "sp", [-1, 1]], ["tile_rx", "sp", [-1, 1]], ["auto_unroll_max_step", "ot", 0], ["unroll_explicit", "ot", 1]]}, "result": [[0.22915154999999998], 0, 2.677375555038452, 1638898175.7736495], "version": 0.2, "tvm_version": "0.8.dev0"}
{"input": ["cuda -keys=cuda,gpu -max_num_threads=1024 -thread_warp_size=32", "conv2d_nchw.cuda", [["TENSOR", [128, 2016, 11, 11], "float32"], ["TENSOR", [336, 2016, 1, 1], "float32"], 1, "SAME", 1, "float32"], {}], "config": {"index": 1426779, "code_hash": null, "entity": [["tile_f", "sp", [-1, 2, 3, 14]], ["tile_y", "sp", [-1, 1, 1, 11]], ["tile_x", "sp", [-1, 1, 1, 1]], ["tile_rc", "sp", [-1, 32]], ["tile_ry", "sp", [-1, 1]], ["tile_rx", "sp", [-1, 1]], ["auto_unroll_max_step", "ot", 512], ["unroll_explicit", "ot", 1]]}, "result": [[1.39105955], 0, 9.354965686798096, 1638898184.1033788], "version": 0.2, "tvm_version": "0.8.dev0"}
{"input": ["cuda -keys=cuda,gpu -max_num_threads=1024 -thread_warp_size=32", "conv2d_nchw.cuda", [["TENSOR", [128, 2016, 11, 11], "float32"], ["TENSOR", [336, 2016, 1, 1], "float32"], 1, "SAME", 1, "float32"], {}], "config": {"index": 1489740, "code_hash": null, "entity": [["tile_f", "sp", [-1, 7, 1, 2]], ["tile_y", "sp", [-1, 1, 1, 1]], ["tile_x", "sp", [-1, 11, 1, 1]], ["tile_rc", "sp", [-1, 84]], ["tile_ry", "sp", [-1, 1]], ["tile_rx", "sp", [-1, 1]], ["auto_unroll_max_step", "ot", 512], ["unroll_explicit", "ot", 1]]}, "result": [[1.1634803999999999], 0, 7.686938047409058, 1638898192.1298625], "version": 0.2, "tvm_version": "0.8.dev0"}
{"input": ["cuda -keys=cuda,gpu -max_num_threads=1024 -thread_warp_size=32", "conv2d_nchw.cuda", [["TENSOR", [128, 2016, 11, 11], "float32"], ["TENSOR", [336, 2016, 1, 1], "float32"], 1, "SAME", 1, "float32"], {}], "config": {"index": 785798, "code_hash": null, "entity": [["tile_f", "sp", [-1, 2, 42, 1]], ["tile_y", "sp", [-1, 1, 1, 11]], ["tile_x", "sp", [-1, 1, 11, 1]], ["tile_rc", "sp", [-1, 32]], ["tile_ry", "sp", [-1, 1]], ["tile_rx", "sp", [-1, 1]], ["auto_unroll_max_step", "ot", 1500], ["unroll_explicit", "ot", 0]]}, "result": [[0.024340716666666665], 0, 2.129526376724243, 1638898194.7345304], "version": 0.2, "tvm_version": "0.8.dev0"}
{"input": ["cuda -keys=cuda,gpu -max_num_threads=1024 -thread_warp_size=32", "conv2d_nchw.cuda", [["TENSOR", [128, 2016, 11, 11], "float32"], ["TENSOR", [336, 2016, 1, 1], "float32"], 1, "SAME", 1, "float32"], {}], "config": {"index": 1066841, "code_hash": null, "entity": [["tile_f", "sp", [-1, 14, 3, 1]], ["tile_y", "sp", [-1, 11, 1, 1]], ["tile_x", "sp", [-1, 1, 1, 1]], ["tile_rc", "sp", [-1, 18]], ["tile_ry", "sp", [-1, 1]], ["tile_rx", "sp", [-1, 1]], ["auto_unroll_max_step", "ot", 0], ["unroll_explicit", "ot", 1]]}, "result": [[0.18542372499999998], 0, 2.852463483810425, 1638898197.897381], "version": 0.2, "tvm_version": "0.8.dev0"}
{"input": ["cuda -keys=cuda,gpu -max_num_threads=1024 -thread_warp_size=32", "conv2d_nchw.cuda", [["TENSOR", [128, 2016, 11, 11], "float32"], ["TENSOR", [336, 2016, 1, 1], "float32"], 1, "SAME", 1, "float32"], {}], "config": {"index": 35511, "code_hash": null, "entity": [["tile_f", "sp", [-1, 16, 1, 3]], ["tile_y", "sp", [-1, 1, 1, 11]], ["tile_x", "sp", [-1, 1, 1, 11]], ["tile_rc", "sp", [-1, 4]], ["tile_ry", "sp", [-1, 1]], ["tile_rx", "sp", [-1, 1]], ["auto_unroll_max_step", "ot", 0], ["unroll_explicit", "ot", 0]]}, "result": [[18.02909705], 0, 92.71333909034729, 1638898289.6419969], "version": 0.2, "tvm_version": "0.8.dev0"}
{"input": ["cuda -keys=cuda,gpu -max_num_threads=1024 -thread_warp_size=32", "conv2d_nchw.cuda", [["TENSOR", [128, 2016, 11, 11], "float32"], ["TENSOR", [336, 2016, 1, 1], "float32"], 1, "SAME", 1, "float32"], {}], "config": {"index": 415590, "code_hash": null, "entity": [["tile_f", "sp", [-1, 6, 7, 1]], ["tile_y", "sp", [-1, 1, 11, 1]], ["tile_x", "sp", [-1, 11, 1, 1]], ["tile_rc", "sp", [-1, 16]], ["tile_ry", "sp", [-1, 1]], ["tile_rx", "sp", [-1, 1]], ["auto_unroll_max_step", "ot", 512], ["unroll_explicit", "ot", 0]]}, "result": [[0.029474625], 0, 1.7928531169891357, 1638898291.9062958], "version": 0.2, "tvm_version": "0.8.dev0"}
{"input": ["cuda -keys=cuda,gpu -max_num_threads=1024 -thread_warp_size=32", "conv2d_nchw.cuda", [["TENSOR", [128, 2016, 11, 11], "float32"], ["TENSOR", [336, 2016, 1, 1], "float32"], 1, "SAME", 1, "float32"], {}], "config": {"index": 1374128, "code_hash": null, "entity": [["tile_f", "sp", [-1, 6, 1, 14]], ["tile_y", "sp", [-1, 11, 1, 1]], ["tile_x", "sp", [-1, 11, 1, 1]], ["tile_rc", "sp", [-1, 14]], ["tile_ry", "sp", [-1, 1]], ["tile_rx", "sp", [-1, 1]], ["auto_unroll_max_step", "ot", 512], ["unroll_explicit", "ot", 1]]}, "result": [[19.828917949999997], 0, 111.79626607894897, 1638898394.2500076], "version": 0.2, "tvm_version": "0.8.dev0"}
{"input": ["cuda -keys=cuda,gpu -max_num_threads=1024 -thread_warp_size=32", "conv2d_nchw.cuda", [["TENSOR", [128, 2016, 11, 11], "float32"], ["TENSOR", [336, 2016, 1, 1], "float32"], 1, "SAME", 1, "float32"], {}], "config": {"index": 1456637, "code_hash": null, "entity": [["tile_f", "sp", [-1, 2, 8, 1]], ["tile_y", "sp", [-1, 11, 1, 1]], ["tile_x", "sp", [-1, 1, 11, 1]], ["tile_rc", "sp", [-1, 48]], ["tile_ry", "sp", [-1, 1]], ["tile_rx", "sp", [-1, 1]], ["auto_unroll_max_step", "ot", 512], ["unroll_explicit", "ot", 1]]}, "result": [[0.034710325], 0, 1.800412654876709, 1638898396.4317706], "version": 0.2, "tvm_version": "0.8.dev0"}
{"input": ["cuda -keys=cuda,gpu -max_num_threads=1024 -thread_warp_size=32", "conv2d_nchw.cuda", [["TENSOR", [128, 2016, 11, 11], "float32"], ["TENSOR", [336, 2016, 1, 1], "float32"], 1, "SAME", 1, "float32"], {}], "config": {"index": 1625953, "code_hash": null, "entity": [["tile_f", "sp", [-1, 4, 1, 4]], ["tile_y", "sp", [-1, 1, 1, 11]], ["tile_x", "sp", [-1, 11, 1, 1]], ["tile_rc", "sp", [-1, 2]], ["tile_ry", "sp", [-1, 1]], ["tile_rx", "sp", [-1, 1]], ["auto_unroll_max_step", "ot", 1500], ["unroll_explicit", "ot", 1]]}, "result": [[17.9694526], 0, 96.75106453895569, 1638898488.8047192], "version": 0.2, "tvm_version": "0.8.dev0"}
{"input": ["cuda -keys=cuda,gpu -max_num_threads=1024 -thread_warp_size=32", "conv2d_nchw.cuda", [["TENSOR", [128, 2016, 11, 11], "float32"], ["TENSOR", [336, 2016, 1, 1], "float32"], 1, "SAME", 1, "float32"], {}], "config": {"index": 506988, "code_hash": null, "entity": [["tile_f", "sp", [-1, 4, 7, 2]], ["tile_y", "sp", [-1, 11, 1, 1]], ["tile_x", "sp", [-1, 1, 11, 1]], ["tile_rc", "sp", [-1, 63]], ["tile_ry", "sp", [-1, 1]], ["tile_rx", "sp", [-1, 1]], ["auto_unroll_max_step", "ot", 512], ["unroll_explicit", "ot", 0]]}, "result": [[0.033964775], 0, 2.0599443912506104, 1638898491.1777956], "version": 0.2, "tvm_version": "0.8.dev0"}
{"input": ["cuda -keys=cuda,gpu -max_num_threads=1024 -thread_warp_size=32", "conv2d_nchw.cuda", [["TENSOR", [128, 2016, 11, 11], "float32"], ["TENSOR", [336, 2016, 1, 1], "float32"], 1, "SAME", 1, "float32"], {}], "config": {"index": 183895, "code_hash": null, "entity": [["tile_f", "sp", [-1, 3, 28, 2]], ["tile_y", "sp", [-1, 1, 1, 1]], ["tile_x", "sp", [-1, 1, 11, 1]], ["tile_rc", "sp", [-1, 63]], ["tile_ry", "sp", [-1, 1]], ["tile_rx", "sp", [-1, 1]], ["auto_unroll_max_step", "ot", 0], ["unroll_explicit", "ot", 0]]}, "result": [[0.078923575], 0, 1.9226148128509521, 1638898493.707972], "version": 0.2, "tvm_version": "0.8.dev0"}
{"input": ["cuda -keys=cuda,gpu -max_num_threads=1024 -thread_warp_size=32", "conv2d_nchw.cuda", [["TENSOR", [128, 2016, 11, 11], "float32"], ["TENSOR", [336, 2016, 1, 1], "float32"], 1, "SAME", 1, "float32"], {}], "config": {"index": 990427, "code_hash": null, "entity": [["tile_f", "sp", [-1, 7, 8, 6]], ["tile_y", "sp", [-1, 1, 1, 1]], ["tile_x", "sp", [-1, 1, 11, 1]], ["tile_rc", "sp", [-1, 3]], ["tile_ry", "sp", [-1, 1]], ["tile_rx", "sp", [-1, 1]], ["auto_unroll_max_step", "ot", 0], ["unroll_explicit", "ot", 1]]}, "result": [[0.10353897499999999], 0, 2.237619400024414, 1638898506.1589606], "version": 0.2, "tvm_version": "0.8.dev0"}
{"input": ["cuda -keys=cuda,gpu -max_num_threads=1024 -thread_warp_size=32", "conv2d_nchw.cuda", [["TENSOR", [128, 2016, 11, 11], "float32"], ["TENSOR", [336, 2016, 1, 1], "float32"], 1, "SAME", 1, "float32"], {}], "config": {"index": 517966, "code_hash": null, "entity": [["tile_f", "sp", [-1, 2, 1, 42]], ["tile_y", "sp", [-1, 1, 1, 1]], ["tile_x", "sp", [-1, 1, 1, 11]], ["tile_rc", "sp", [-1, 72]], ["tile_ry", "sp", [-1, 1]], ["tile_rx", "sp", [-1, 1]], ["auto_unroll_max_step", "ot", 512], ["unroll_explicit", "ot", 0]]}, "result": [[31.162068125], 0, 157.50834345817566, 1638898663.2500525], "version": 0.2, "tvm_version": "0.8.dev0"}
{"input": ["cuda -keys=cuda,gpu -max_num_threads=1024 -thread_warp_size=32", "conv2d_nchw.cuda", [["TENSOR", [128, 2016, 11, 11], "float32"], ["TENSOR", [336, 2016, 1, 1], "float32"], 1, "SAME", 1, "float32"], {}], "config": {"index": 97715, "code_hash": null, "entity": [["tile_f", "sp", [-1, 7, 1, 4]], ["tile_y", "sp", [-1, 1, 11, 1]], ["tile_x", "sp", [-1, 1, 1, 11]], ["tile_rc", "sp", [-1, 16]], ["tile_ry", "sp", [-1, 1]], ["tile_rx", "sp", [-1, 1]], ["auto_unroll_max_step", "ot", 0], ["unroll_explicit", "ot", 0]]}, "result": [[1.61443625], 0, 9.935067653656006, 1638898672.670873], "version": 0.2, "tvm_version": "0.8.dev0"}
{"input": ["cuda -keys=cuda,gpu -max_num_threads=1024 -thread_warp_size=32", "conv2d_nchw.cuda", [["TENSOR", [128, 2016, 11, 11], "float32"], ["TENSOR", [336, 2016, 1, 1], "float32"], 1, "SAME", 1, "float32"], {}], "config": {"index": 1047105, "code_hash": null, "entity": [["tile_f", "sp", [-1, 6, 4, 14]], ["tile_y", "sp", [-1, 11, 1, 1]], ["tile_x", "sp", [-1, 1, 1, 11]], ["tile_rc", "sp", [-1, 12]], ["tile_ry", "sp", [-1, 1]], ["tile_rx", "sp", [-1, 1]], ["auto_unroll_max_step", "ot", 0], ["unroll_explicit", "ot", 1]]}, "result": [[6.3367069], 0, 33.67078924179077, 1638898705.757197], "version": 0.2, "tvm_version": "0.8.dev0"}
{"input": ["cuda -keys=cuda,gpu -max_num_threads=1024 -thread_warp_size=32", "conv2d_nchw.cuda", [["TENSOR", [128, 2016, 11, 11], "float32"], ["TENSOR", [336, 2016, 1, 1], "float32"], 1, "SAME", 1, "float32"], {}], "config": {"index": 126642, "code_hash": null, "entity": [["tile_f", "sp", [-1, 21, 8, 1]], ["tile_y", "sp", [-1, 1, 11, 1]], ["tile_x", "sp", [-1, 1, 1, 1]], ["tile_rc", "sp", [-1, 28]], ["tile_ry", "sp", [-1, 1]], ["tile_rx", "sp", [-1, 1]], ["auto_unroll_max_step", "ot", 0], ["unroll_explicit", "ot", 0]]}, "result": [[0.064881225], 0, 1.8947527408599854, 1638898707.3708143], "version": 0.2, "tvm_version": "0.8.dev0"}
{"input": ["cuda -keys=cuda,gpu -max_num_threads=1024 -thread_warp_size=32", "conv2d_nchw.cuda", [["TENSOR", [128, 2016, 11, 11], "float32"], ["TENSOR", [336, 2016, 1, 1], "float32"], 1, "SAME", 1, "float32"], {}], "config": {"index": 1320532, "code_hash": null, "entity": [["tile_f", "sp", [-1, 12, 4, 1]], ["tile_y", "sp", [-1, 1, 11, 1]], ["tile_x", "sp", [-1, 11, 1, 1]], ["tile_rc", "sp", [-1, 4]], ["tile_ry", "sp", [-1, 1]], ["tile_rx", "sp", [-1, 1]], ["auto_unroll_max_step", "ot", 512], ["unroll_explicit", "ot", 1]]}, "result": [[0.021132650000000003], 0, 1.965641736984253, 1638898708.850916], "version": 0.2, "tvm_version": "0.8.dev0"}
{"input": ["cuda -keys=cuda,gpu -max_num_threads=1024 -thread_warp_size=32", "conv2d_nchw.cuda", [["TENSOR", [128, 2016, 11, 11], "float32"], ["TENSOR", [336, 2016, 1, 1], "float32"], 1, "SAME", 1, "float32"], {}], "config": {"index": 1057901, "code_hash": null, "entity": [["tile_f", "sp", [-1, 7, 6, 1]], ["tile_y", "sp", [-1, 11, 1, 1]], ["tile_x", "sp", [-1, 1, 1, 1]], ["tile_rc", "sp", [-1, 16]], ["tile_ry", "sp", [-1, 1]], ["tile_rx", "sp", [-1, 1]], ["auto_unroll_max_step", "ot", 0], ["unroll_explicit", "ot", 1]]}, "result": [[0.117027275], 0, 2.3477230072021484, 1638898710.8578677], "version": 0.2, "tvm_version": "0.8.dev0"}
{"input": ["cuda -keys=cuda,gpu -max_num_threads=1024 -thread_warp_size=32", "conv2d_nchw.cuda", [["TENSOR", [128, 2016, 11, 11], "float32"], ["TENSOR", [336, 2016, 1, 1], "float32"], 1, "SAME", 1, "float32"], {}], "config": {"index": 540286, "code_hash": null, "entity": [["tile_f", "sp", [-1, 3, 1, 14]], ["tile_y", "sp", [-1, 1, 1, 1]], ["tile_x", "sp", [-1, 11, 1, 1]], ["tile_rc", "sp", [-1, 112]], ["tile_ry", "sp", [-1, 1]], ["tile_rx", "sp", [-1, 1]], ["auto_unroll_max_step", "ot", 512], ["unroll_explicit", "ot", 0]]}, "result": [[13.0418182], 0, 67.44463515281677, 1638898777.453059], "version": 0.2, "tvm_version": "0.8.dev0"}
{"input": ["cuda -keys=cuda,gpu -max_num_threads=1024 -thread_warp_size=32", "conv2d_nchw.cuda", [["TENSOR", [128, 2016, 11, 11], "float32"], ["TENSOR", [336, 2016, 1, 1], "float32"], 1, "SAME", 1, "float32"], {}], "config": {"index": 735601, "code_hash": null, "entity": [["tile_f", "sp", [-1, 1, 42, 4]], ["tile_y", "sp", [-1, 11, 1, 1]], ["tile_x", "sp", [-1, 1, 1, 1]], ["tile_rc", "sp", [-1, 16]], ["tile_ry", "sp", [-1, 1]], ["tile_rx", "sp", [-1, 1]], ["auto_unroll_max_step", "ot", 1500], ["unroll_explicit", "ot", 0]]}, "result": [[0.079597375], 0, 2.1673436164855957, 1638898779.1723628], "version": 0.2, "tvm_version": "0.8.dev0"}
{"input": ["cuda -keys=cuda,gpu -max_num_threads=1024 -thread_warp_size=32", "conv2d_nchw.cuda", [["TENSOR", [128, 2016, 11, 11], "float32"], ["TENSOR", [336, 2016, 1, 1], "float32"], 1, "SAME", 1, "float32"], {}], "config": {"index": 681223, "code_hash": null, "entity": [["tile_f", "sp", [-1, 7, 16, 3]], ["tile_y", "sp", [-1, 1, 1, 1]], ["tile_x", "sp", [-1, 1, 1, 1]], ["tile_rc", "sp", [-1, 6]], ["tile_ry", "sp", [-1, 1]], ["tile_rx", "sp", [-1, 1]], ["auto_unroll_max_step", "ot", 1500], ["unroll_explicit", "ot", 0]]}, "result": [[0.602814], 0, 4.762512445449829, 1638898783.5503752], "version": 0.2, "tvm_version": "0.8.dev0"}
{"input": ["cuda -keys=cuda,gpu -max_num_threads=1024 -thread_warp_size=32", "conv2d_nchw.cuda", [["TENSOR", [128, 2016, 11, 11], "float32"], ["TENSOR", [336, 2016, 1, 1], "float32"], 1, "SAME", 1, "float32"], {}], "config": {"index": 531308, "code_hash": null, "entity": [["tile_f", "sp", [-1, 4, 1, 12]], ["tile_y", "sp", [-1, 1, 1, 1]], ["tile_x", "sp", [-1, 11, 1, 1]], ["tile_rc", "sp", [-1, 96]], ["tile_ry", "sp", [-1, 1]], ["tile_rx", "sp", [-1, 1]], ["auto_unroll_max_step", "ot", 512], ["unroll_explicit", "ot", 0]]}, "result": [[26.175079275], 0, 132.67430210113525, 1638898915.7379563], "version": 0.2, "tvm_version": "0.8.dev0"}
{"input": ["cuda -keys=cuda,gpu -max_num_threads=1024 -thread_warp_size=32", "conv2d_nchw.cuda", [["TENSOR", [128, 2016, 11, 11], "float32"], ["TENSOR", [336, 2016, 1, 1], "float32"], 1, "SAME", 1, "float32"], {}], "config": {"index": 1158237, "code_hash": null, "entity": [["tile_f", "sp", [-1, 12, 2, 2]], ["tile_y", "sp", [-1, 1, 1, 1]], ["tile_x", "sp", [-1, 11, 1, 1]], ["tile_rc", "sp", [-1, 72]], ["tile_ry", "sp", [-1, 1]], ["tile_rx", "sp", [-1, 1]], ["auto_unroll_max_step", "ot", 0], ["unroll_explicit", "ot", 1]]}, "result": [[10.576634174999999], 0, 55.309640645980835, 1638898970.0328217], "version": 0.2, "tvm_version": "0.8.dev0"}
{"input": ["cuda -keys=cuda,gpu -max_num_threads=1024 -thread_warp_size=32", "conv2d_nchw.cuda", [["TENSOR", [128, 2016, 11, 11], "float32"], ["TENSOR", [336, 2016, 1, 1], "float32"], 1, "SAME", 1, "float32"], {}], "config": {"index": 753402, "code_hash": null, "entity": [["tile_f", "sp", [-1, 2, 14, 2]], ["tile_y", "sp", [-1, 11, 1, 1]], ["tile_x", "sp", [-1, 1, 1, 1]], ["tile_rc", "sp", [-1, 21]], ["tile_ry", "sp", [-1, 1]], ["tile_rx", "sp", [-1, 1]], ["auto_unroll_max_step", "ot", 1500], ["unroll_explicit", "ot", 0]]}, "result": [[0.06407245], 0, 2.2105894088745117, 1638898971.7076914], "version": 0.2, "tvm_version": "0.8.dev0"}
{"input": ["cuda -keys=cuda,gpu -max_num_threads=1024 -thread_warp_size=32", "conv2d_nchw.cuda", [["TENSOR", [128, 2016, 11, 11], "float32"], ["TENSOR", [336, 2016, 1, 1], "float32"], 1, "SAME", 1, "float32"], {}], "config": {"index": 1044787, "code_hash": null, "entity": [["tile_f", "sp", [-1, 1, 8, 7]], ["tile_y", "sp", [-1, 11, 1, 1]], ["tile_x", "sp", [-1, 1, 11, 1]], ["tile_rc", "sp", [-1, 12]], ["tile_ry", "sp", [-1, 1]], ["tile_rx", "sp", [-1, 1]], ["auto_unroll_max_step", "ot", 0], ["unroll_explicit", "ot", 1]]}, "result": [[0.02627905], 0, 1.8052184581756592, 1638899025.6703532], "version": 0.2, "tvm_version": "0.8.dev0"}
{"input": ["cuda -keys=cuda,gpu -max_num_threads=1024 -thread_warp_size=32", "conv2d_nchw.cuda", [["TENSOR", [128, 2016, 11, 11], "float32"], ["TENSOR", [336, 2016, 1, 1], "float32"], 1, "SAME", 1, "float32"], {}], "config": {"index": 77107, "code_hash": null, "entity": [["tile_f", "sp", [-1, 1, 8, 7]], ["tile_y", "sp", [-1, 11, 1, 1]], ["tile_x", "sp", [-1, 1, 11, 1]], ["tile_rc", "sp", [-1, 12]], ["tile_ry", "sp", [-1, 1]], ["tile_rx", "sp", [-1, 1]], ["auto_unroll_max_step", "ot", 0], ["unroll_explicit", "ot", 0]]}, "result": [[0.022327633333333333], 0, 1.7881152629852295, 1638899027.1405423], "version": 0.2, "tvm_version": "0.8.dev0"}
{"input": ["cuda -keys=cuda,gpu -max_num_threads=1024 -thread_warp_size=32", "conv2d_nchw.cuda", [["TENSOR", [128, 2016, 11, 11], "float32"], ["TENSOR", [336, 2016, 1, 1], "float32"], 1, "SAME", 1, "float32"], {}], "config": {"index": 1367347, "code_hash": null, "entity": [["tile_f", "sp", [-1, 1, 8, 7]], ["tile_y", "sp", [-1, 11, 1, 1]], ["tile_x", "sp", [-1, 1, 11, 1]], ["tile_rc", "sp", [-1, 12]], ["tile_ry", "sp", [-1, 1]], ["tile_rx", "sp", [-1, 1]], ["auto_unroll_max_step", "ot", 512], ["unroll_explicit", "ot", 1]]}, "result": [[0.019593416666666665], 0, 1.8845441341400146, 1638899028.5521753], "version": 0.2, "tvm_version": "0.8.dev0"}
{"input": ["cuda -keys=cuda,gpu -max_num_threads=1024 -thread_warp_size=32", "conv2d_nchw.cuda", [["TENSOR", [128, 2016, 11, 11], "float32"], ["TENSOR", [336, 2016, 1, 1], "float32"], 1, "SAME", 1, "float32"], {}], "config": {"index": 1044817, "code_hash": null, "entity": [["tile_f", "sp", [-1, 1, 7, 8]], ["tile_y", "sp", [-1, 11, 1, 1]], ["tile_x", "sp", [-1, 1, 11, 1]], ["tile_rc", "sp", [-1, 12]], ["tile_ry", "sp", [-1, 1]], ["tile_rx", "sp", [-1, 1]], ["auto_unroll_max_step", "ot", 0], ["unroll_explicit", "ot", 1]]}, "result": [[0.0280553], 0, 1.8438587188720703, 1638899029.9764452], "version": 0.2, "tvm_version": "0.8.dev0"}
{"input": ["cuda -keys=cuda,gpu -max_num_threads=1024 -thread_warp_size=32", "conv2d_nchw.cuda", [["TENSOR", [128, 2016, 11, 11], "float32"], ["TENSOR", [336, 2016, 1, 1], "float32"], 1, "SAME", 1, "float32"], {}], "config": {"index": 399667, "code_hash": null, "entity": [["tile_f", "sp", [-1, 1, 8, 7]], ["tile_y", "sp", [-1, 11, 1, 1]], ["tile_x", "sp", [-1, 1, 11, 1]], ["tile_rc", "sp", [-1, 12]], ["tile_ry", "sp", [-1, 1]], ["tile_rx", "sp", [-1, 1]], ["auto_unroll_max_step", "ot", 512], ["unroll_explicit", "ot", 0]]}, "result": [[0.01940175], 0, 1.8672010898590088, 1638899031.4499996], "version": 0.2, "tvm_version": "0.8.dev0"}
{"input": ["cuda -keys=cuda,gpu -max_num_threads=1024 -thread_warp_size=32", "conv2d_nchw.cuda", [["TENSOR", [128, 2016, 11, 11], "float32"], ["TENSOR", [336, 2016, 1, 1], "float32"], 1, "SAME", 1, "float32"], {}], "config": {"index": 77137, "code_hash": null, "entity": [["tile_f", "sp", [-1, 1, 7, 8]], ["tile_y", "sp", [-1, 11, 1, 1]], ["tile_x", "sp", [-1, 1, 11, 1]], ["tile_rc", "sp", [-1, 12]], ["tile_ry", "sp", [-1, 1]], ["tile_rx", "sp", [-1, 1]], ["auto_unroll_max_step", "ot", 0], ["unroll_explicit", "ot", 0]]}, "result": [[0.02601205], 0, 1.664940357208252, 1638899032.7327583], "version": 0.2, "tvm_version": "0.8.dev0"}
{"input": ["cuda -keys=cuda,gpu -max_num_threads=1024 -thread_warp_size=32", "conv2d_nchw.cuda", [["TENSOR", [128, 2016, 11, 11], "float32"], ["TENSOR", [336, 2016, 1, 1], "float32"], 1, "SAME", 1, "float32"], {}], "config": {"index": 1044746, "code_hash": null, "entity": [["tile_f", "sp", [-1, 1, 8, 6]], ["tile_y", "sp", [-1, 11, 1, 1]], ["tile_x", "sp", [-1, 1, 11, 1]], ["tile_rc", "sp", [-1, 12]], ["tile_ry", "sp", [-1, 1]], ["tile_rx", "sp", [-1, 1]], ["auto_unroll_max_step", "ot", 0], ["unroll_explicit", "ot", 1]]}, "result": [[0.020483333333333336], 0, 1.8373463153839111, 1638899034.1866934], "version": 0.2, "tvm_version": "0.8.dev0"}
{"input": ["cuda -keys=cuda,gpu -max_num_threads=1024 -thread_warp_size=32", "conv2d_nchw.cuda", [["TENSOR", [128, 2016, 11, 11], "float32"], ["TENSOR", [336, 2016, 1, 1], "float32"], 1, "SAME", 1, "float32"], {}], "config": {"index": 1367377, "code_hash": null, "entity": [["tile_f", "sp", [-1, 1, 7, 8]], ["tile_y", "sp", [-1, 11, 1, 1]], ["tile_x", "sp", [-1, 1, 11, 1]], ["tile_rc", "sp", [-1, 12]], ["tile_ry", "sp", [-1, 1]], ["tile_rx", "sp", [-1, 1]], ["auto_unroll_max_step", "ot", 512], ["unroll_explicit", "ot", 1]]}, "result": [[0.028192025000000002], 0, 1.826343059539795, 1638899035.5832484], "version": 0.2, "tvm_version": "0.8.dev0"}
{"input": ["cuda -keys=cuda,gpu -max_num_threads=1024 -thread_warp_size=32", "conv2d_nchw.cuda", [["TENSOR", [128, 2016, 11, 11], "float32"], ["TENSOR", [336, 2016, 1, 1], "float32"], 1, "SAME", 1, "float32"], {}], "config": {"index": 1689907, "code_hash": null, "entity": [["tile_f", "sp", [-1, 1, 8, 7]], ["tile_y", "sp", [-1, 11, 1, 1]], ["tile_x", "sp", [-1, 1, 11, 1]], ["tile_rc", "sp", [-1, 12]], ["tile_ry", "sp", [-1, 1]], ["tile_rx", "sp", [-1, 1]], ["auto_unroll_max_step", "ot", 1500], ["unroll_explicit", "ot", 1]]}, "result": [[0.017325049999999998], 0, 2.7121529579162598, 1638899037.0600653], "version": 0.2, "tvm_version": "0.8.dev0"}
{"input": ["cuda -keys=cuda,gpu -max_num_threads=1024 -thread_warp_size=32", "conv2d_nchw.cuda", [["TENSOR", [128, 2016, 11, 11], "float32"], ["TENSOR", [336, 2016, 1, 1], "float32"], 1, "SAME", 1, "float32"], {}], "config": {"index": 1053706, "code_hash": null, "entity": [["tile_f", "sp", [-1, 1, 8, 6]], ["tile_y", "sp", [-1, 11, 1, 1]], ["tile_x", "sp", [-1, 1, 11, 1]], ["tile_rc", "sp", [-1, 14]], ["tile_ry", "sp", [-1, 1]], ["tile_rx", "sp", [-1, 1]], ["auto_unroll_max_step", "ot", 0], ["unroll_explicit", "ot", 1]]}, "result": [[0.022692666666666667], 0, 1.8176884651184082, 1638899038.53096], "version": 0.2, "tvm_version": "0.8.dev0"}
{"input": ["cuda -keys=cuda,gpu -max_num_threads=1024 -thread_warp_size=32", "conv2d_nchw.cuda", [["TENSOR", [128, 2016, 11, 11], "float32"], ["TENSOR", [336, 2016, 1, 1], "float32"], 1, "SAME", 1, "float32"], {}], "config": {"index": 77066, "code_hash": null, "entity": [["tile_f", "sp", [-1, 1, 8, 6]], ["tile_y", "sp", [-1, 11, 1, 1]], ["tile_x", "sp", [-1, 1, 11, 1]], ["tile_rc", "sp", [-1, 12]], ["tile_ry", "sp", [-1, 1]], ["tile_rx", "sp", [-1, 1]], ["auto_unroll_max_step", "ot", 0], ["unroll_explicit", "ot", 0]]}, "result": [[0.0208957], 0, 1.8111131191253662, 1638899039.9562716], "version": 0.2, "tvm_version": "0.8.dev0"}
{"input": ["cuda -keys=cuda,gpu -max_num_threads=1024 -thread_warp_size=32", "conv2d_nchw.cuda", [["TENSOR", [128, 2016, 11, 11], "float32"], ["TENSOR", [336, 2016, 1, 1], "float32"], 1, "SAME", 1, "float32"], {}], "config": {"index": 399697, "code_hash": null, "entity": [["tile_f", "sp", [-1, 1, 7, 8]], ["tile_y", "sp", [-1, 11, 1, 1]], ["tile_x", "sp", [-1, 1, 11, 1]], ["tile_rc", "sp", [-1, 12]], ["tile_ry", "sp", [-1, 1]], ["tile_rx", "sp", [-1, 1]], ["auto_unroll_max_step", "ot", 512], ["unroll_explicit", "ot", 0]]}, "result": [[0.027208749999999997], 0, 1.8780913352966309, 1638899041.3952527], "version": 0.2, "tvm_version": "0.8.dev0"}
{"input": ["cuda -keys=cuda,gpu -max_num_threads=1024 -thread_warp_size=32", "conv2d_nchw.cuda", [["TENSOR", [128, 2016, 11, 11], "float32"], ["TENSOR", [336, 2016, 1, 1], "float32"], 1, "SAME", 1, "float32"], {}], "config": {"index": 1035827, "code_hash": null, "entity": [["tile_f", "sp", [-1, 1, 8, 7]], ["tile_y", "sp", [-1, 11, 1, 1]], ["tile_x", "sp", [-1, 1, 11, 1]], ["tile_rc", "sp", [-1, 9]], ["tile_ry", "sp", [-1, 1]], ["tile_rx", "sp", [-1, 1]], ["auto_unroll_max_step", "ot", 0], ["unroll_explicit", "ot", 1]]}, "result": [[0.019594583333333332], 0, 1.7753756046295166, 1638899042.8290672], "version": 0.2, "tvm_version": "0.8.dev0"}
{"input": ["cuda -keys=cuda,gpu -max_num_threads=1024 -thread_warp_size=32", "conv2d_nchw.cuda", [["TENSOR", [128, 2016, 11, 11], "float32"], ["TENSOR", [336, 2016, 1, 1], "float32"], 1, "SAME", 1, "float32"], {}], "config": {"index": 722227, "code_hash": null, "entity": [["tile_f", "sp", [-1, 1, 8, 7]], ["tile_y", "sp", [-1, 11, 1, 1]], ["tile_x", "sp", [-1, 1, 11, 1]], ["tile_rc", "sp", [-1, 12]], ["tile_ry", "sp", [-1, 1]], ["tile_rx", "sp", [-1, 1]], ["auto_unroll_max_step", "ot", 1500], ["unroll_explicit", "ot", 0]]}, "result": [[0.01869233333333333], 0, 2.028017282485962, 1638899044.3586695], "version": 0.2, "tvm_version": "0.8.dev0"}
{"input": ["cuda -keys=cuda,gpu -max_num_threads=1024 -thread_warp_size=32", "conv2d_nchw.cuda", [["TENSOR", [128, 2016, 11, 11], "float32"], ["TENSOR", [336, 2016, 1, 1], "float32"], 1, "SAME", 1, "float32"], {}], "config": {"index": 1367306, "code_hash": null, "entity": [["tile_f", "sp", [-1, 1, 8, 6]], ["tile_y", "sp", [-1, 11, 1, 1]], ["tile_x", "sp", [-1, 1, 11, 1]], ["tile_rc", "sp", [-1, 12]], ["tile_ry", "sp", [-1, 1]], ["tile_rx", "sp", [-1, 1]], ["auto_unroll_max_step", "ot", 512], ["unroll_explicit", "ot", 1]]}, "result": [[0.020472133333333333], 0, 1.817246675491333, 1638899045.8109806], "version": 0.2, "tvm_version": "0.8.dev0"}
{"input": ["cuda -keys=cuda,gpu -max_num_threads=1024 -thread_warp_size=32", "conv2d_nchw.cuda", [["TENSOR", [128, 2016, 11, 11], "float32"], ["TENSOR", [336, 2016, 1, 1], "float32"], 1, "SAME", 1, "float32"], {}], "config": {"index": 86026, "code_hash": null, "entity": [["tile_f", "sp", [-1, 1, 8, 6]], ["tile_y", "sp", [-1, 11, 1, 1]], ["tile_x", "sp", [-1, 1, 11, 1]], ["tile_rc", "sp", [-1, 14]], ["tile_ry", "sp", [-1, 1]], ["tile_rx", "sp", [-1, 1]], ["auto_unroll_max_step", "ot", 0], ["unroll_explicit", "ot", 0]]}, "result": [[0.022732016666666664], 0, 1.803985595703125, 1638899047.2681713], "version": 0.2, "tvm_version": "0.8.dev0"}
{"input": ["cuda -keys=cuda,gpu -max_num_threads=1024 -thread_warp_size=32", "conv2d_nchw.cuda", [["TENSOR", [128, 2016, 11, 11], "float32"], ["TENSOR", [336, 2016, 1, 1], "float32"], 1, "SAME", 1, "float32"], {}], "config": {"index": 1044783, "code_hash": null, "entity": [["tile_f", "sp", [-1, 1, 6, 7]], ["tile_y", "sp", [-1, 11, 1, 1]], ["tile_x", "sp", [-1, 1, 11, 1]], ["tile_rc", "sp", [-1, 12]], ["tile_ry", "sp", [-1, 1]], ["tile_rx", "sp", [-1, 1]], ["auto_unroll_max_step", "ot", 0], ["unroll_explicit", "ot", 1]]}, "result": [[0.02454366666666667], 0, 1.863746166229248, 1638899048.7872438], "version": 0.2, "tvm_version": "0.8.dev0"}
{"input": ["cuda -keys=cuda,gpu -max_num_threads=1024 -thread_warp_size=32", "conv2d_nchw.cuda", [["TENSOR", [128, 2016, 11, 11], "float32"], ["TENSOR", [336, 2016, 1, 1], "float32"], 1, "SAME", 1, "float32"], {}], "config": {"index": 1062662, "code_hash": null, "entity": [["tile_f", "sp", [-1, 1, 7, 6]], ["tile_y", "sp", [-1, 11, 1, 1]], ["tile_x", "sp", [-1, 1, 11, 1]], ["tile_rc", "sp", [-1, 16]], ["tile_ry", "sp", [-1, 1]], ["tile_rx", "sp", [-1, 1]], ["auto_unroll_max_step", "ot", 0], ["unroll_explicit", "ot", 1]]}, "result": [[0.031698899999999995], 0, 1.7168850898742676, 1638899050.1937437], "version": 0.2, "tvm_version": "0.8.dev0"}
{"input": ["cuda -keys=cuda,gpu -max_num_threads=1024 -thread_warp_size=32", "conv2d_nchw.cuda", [["TENSOR", [128, 2016, 11, 11], "float32"], ["TENSOR", [336, 2016, 1, 1], "float32"], 1, "SAME", 1, "float32"], {}], "config": {"index": 1689937, "code_hash": null, "entity": [["tile_f", "sp", [-1, 1, 7, 8]], ["tile_y", "sp", [-1, 11, 1, 1]], ["tile_x", "sp", [-1, 1, 11, 1]], ["tile_rc", "sp", [-1, 12]], ["tile_ry", "sp", [-1, 1]], ["tile_rx", "sp", [-1, 1]], ["auto_unroll_max_step", "ot", 1500], ["unroll_explicit", "ot", 1]]}, "result": [[0.020102433333333333], 0, 3.118664264678955, 1638899051.7134066], "version": 0.2, "tvm_version": "0.8.dev0"}
{"input": ["cuda -keys=cuda,gpu -max_num_threads=1024 -thread_warp_size=32", "conv2d_nchw.cuda", [["TENSOR", [128, 2016, 11, 11], "float32"], ["TENSOR", [336, 2016, 1, 1], "float32"], 1, "SAME", 1, "float32"], {}], "config": {"index": 68147, "code_hash": null, "entity": [["tile_f", "sp", [-1, 1, 8, 7]], ["tile_y", "sp", [-1, 11, 1, 1]], ["tile_x", "sp", [-1, 1, 11, 1]], ["tile_rc", "sp", [-1, 9]], ["tile_ry", "sp", [-1, 1]], ["tile_rx", "sp", [-1, 1]], ["auto_unroll_max_step", "ot", 0], ["unroll_explicit", "ot", 0]]}, "result": [[0.01942345], 0, 1.7780423164367676, 1638899053.0862815], "version": 0.2, "tvm_version": "0.8.dev0"}
{"input": ["cuda -keys=cuda,gpu -max_num_threads=1024 -thread_warp_size=32", "conv2d_nchw.cuda", [["TENSOR", [128, 2016, 11, 11], "float32"], ["TENSOR", [336, 2016, 1, 1], "float32"], 1, "SAME", 1, "float32"], {}], "config": {"index": 1376266, "code_hash": null, "entity": [["tile_f", "sp", [-1, 1, 8, 6]], ["tile_y", "sp", [-1, 11, 1, 1]], ["tile_x", "sp", [-1, 1, 11, 1]], ["tile_rc", "sp", [-1, 14]], ["tile_ry", "sp", [-1, 1]], ["tile_rx", "sp", [-1, 1]], ["auto_unroll_max_step", "ot", 512], ["unroll_explicit", "ot", 1]]}, "result": [[0.020458516666666666], 0, 1.842137336730957, 1638899054.5200288], "version": 0.2, "tvm_version": "0.8.dev0"}
{"input": ["cuda -keys=cuda,gpu -max_num_threads=1024 -thread_warp_size=32", "conv2d_nchw.cuda", [["TENSOR", [128, 2016, 11, 11], "float32"], ["TENSOR", [336, 2016, 1, 1], "float32"], 1, "SAME", 1, "float32"], {}], "config": {"index": 399626, "code_hash": null, "entity": [["tile_f", "sp", [-1, 1, 8, 6]], ["tile_y", "sp", [-1, 11, 1, 1]], ["tile_x", "sp", [-1, 1, 11, 1]], ["tile_rc", "sp", [-1, 12]], ["tile_ry", "sp", [-1, 1]], ["tile_rx", "sp", [-1, 1]], ["auto_unroll_max_step", "ot", 512], ["unroll_explicit", "ot", 0]]}, "result": [[0.020621533333333334], 0, 1.692563772201538, 1638899055.9370058], "version": 0.2, "tvm_version": "0.8.dev0"}
{"input": ["cuda -keys=cuda,gpu -max_num_threads=1024 -thread_warp_size=32", "conv2d_nchw.cuda", [["TENSOR", [128, 2016, 11, 11], "float32"], ["TENSOR", [336, 2016, 1, 1], "float32"], 1, "SAME", 1, "float32"], {}], "config": {"index": 1053747, "code_hash": null, "entity": [["tile_f", "sp", [-1, 1, 8, 7]], ["tile_y", "sp", [-1, 11, 1, 1]], ["tile_x", "sp", [-1, 1, 11, 1]], ["tile_rc", "sp", [-1, 14]], ["tile_ry", "sp", [-1, 1]], ["tile_rx", "sp", [-1, 1]], ["auto_unroll_max_step", "ot", 0], ["unroll_explicit", "ot", 1]]}, "result": [[0.0211966], 0, 2.010483980178833, 1638899057.568837], "version": 0.2, "tvm_version": "0.8.dev0"}
{"input": ["cuda -keys=cuda,gpu -max_num_threads=1024 -thread_warp_size=32", "conv2d_nchw.cuda", [["TENSOR", [128, 2016, 11, 11], "float32"], ["TENSOR", [336, 2016, 1, 1], "float32"], 1, "SAME", 1, "float32"], {}], "config": {"index": 1358387, "code_hash": null, "entity": [["tile_f", "sp", [-1, 1, 8, 7]], ["tile_y", "sp", [-1, 11, 1, 1]], ["tile_x", "sp", [-1, 1, 11, 1]], ["tile_rc", "sp", [-1, 9]], ["tile_ry", "sp", [-1, 1]], ["tile_rx", "sp", [-1, 1]], ["auto_unroll_max_step", "ot", 512], ["unroll_explicit", "ot", 1]]}, "result": [[0.018850099999999998], 0, 1.7925639152526855, 1638899059.0330813], "version": 0.2, "tvm_version": "0.8.dev0"}
{"input": ["cuda -keys=cuda,gpu -max_num_threads=1024 -thread_warp_size=32", "conv2d_nchw.cuda", [["TENSOR", [128, 2016, 11, 11], "float32"], ["TENSOR", [336, 2016, 1, 1], "float32"], 1, "SAME", 1, "float32"], {}], "config": {"index": 77103, "code_hash": null, "entity": [["tile_f", "sp", [-1, 1, 6, 7]], ["tile_y", "sp", [-1, 11, 1, 1]], ["tile_x", "sp", [-1, 1, 11, 1]], ["tile_rc", "sp", [-1, 12]], ["tile_ry", "sp", [-1, 1]], ["tile_rx", "sp", [-1, 1]], ["auto_unroll_max_step", "ot", 0], ["unroll_explicit", "ot", 0]]}, "result": [[0.032722225], 0, 1.6803810596466064, 1638899062.2098541], "version": 0.2, "tvm_version": "0.8.dev0"}
{"input": ["cuda -keys=cuda,gpu -max_num_threads=1024 -thread_warp_size=32", "conv2d_nchw.cuda", [["TENSOR", [128, 2016, 11, 11], "float32"], ["TENSOR", [336, 2016, 1, 1], "float32"], 1, "SAME", 1, "float32"], {}], "config": {"index": 94982, "code_hash": null, "entity": [["tile_f", "sp", [-1, 1, 7, 6]], ["tile_y", "sp", [-1, 11, 1, 1]], ["tile_x", "sp", [-1, 1, 11, 1]], ["tile_rc", "sp", [-1, 16]], ["tile_ry", "sp", [-1, 1]], ["tile_rx", "sp", [-1, 1]], ["auto_unroll_max_step", "ot", 0], ["unroll_explicit", "ot", 0]]}, "result": [[0.037981625], 0, 1.738473653793335, 1638899063.5863204], "version": 0.2, "tvm_version": "0.8.dev0"}
{"input": ["cuda -keys=cuda,gpu -max_num_threads=1024 -thread_warp_size=32", "conv2d_nchw.cuda", [["TENSOR", [128, 2016, 11, 11], "float32"], ["TENSOR", [336, 2016, 1, 1], "float32"], 1, "SAME", 1, "float32"], {}], "config": {"index": 1071592, "code_hash": null, "entity": [["tile_f", "sp", [-1, 1, 14, 4]], ["tile_y", "sp", [-1, 11, 1, 1]], ["tile_x", "sp", [-1, 1, 11, 1]], ["tile_rc", "sp", [-1, 18]], ["tile_ry", "sp", [-1, 1]], ["tile_rx", "sp", [-1, 1]], ["auto_unroll_max_step", "ot", 0], ["unroll_explicit", "ot", 1]]}, "result": [[0.025109000000000003], 0, 1.7031667232513428, 1638899064.930951], "version": 0.2, "tvm_version": "0.8.dev0"}
{"input": ["cuda -keys=cuda,gpu -max_num_threads=1024 -thread_warp_size=32", "conv2d_nchw.cuda", [["TENSOR", [128, 2016, 11, 11], "float32"], ["TENSOR", [336, 2016, 1, 1], "float32"], 1, "SAME", 1, "float32"], {}], "config": {"index": 1062632, "code_hash": null, "entity": [["tile_f", "sp", [-1, 1, 14, 4]], ["tile_y", "sp", [-1, 11, 1, 1]], ["tile_x", "sp", [-1, 1, 11, 1]], ["tile_rc", "sp", [-1, 16]], ["tile_ry", "sp", [-1, 1]], ["tile_rx", "sp", [-1, 1]], ["auto_unroll_max_step", "ot", 0], ["unroll_explicit", "ot", 1]]}, "result": [[0.031893375], 0, 1.7709205150604248, 1638899066.3699722], "version": 0.2, "tvm_version": "0.8.dev0"}
{"input": ["cuda -keys=cuda,gpu -max_num_threads=1024 -thread_warp_size=32", "conv2d_nchw.cuda", [["TENSOR", [128, 2016, 11, 11], "float32"], ["TENSOR", [336, 2016, 1, 1], "float32"], 1, "SAME", 1, "float32"], {}], "config": {"index": 722257, "code_hash": null, "entity": [["tile_f", "sp", [-1, 1, 7, 8]], ["tile_y", "sp", [-1, 11, 1, 1]], ["tile_x", "sp", [-1, 1, 11, 1]], ["tile_rc", "sp", [-1, 12]], ["tile_ry", "sp", [-1, 1]], ["tile_rx", "sp", [-1, 1]], ["auto_unroll_max_step", "ot", 1500], ["unroll_explicit", "ot", 0]]}, "result": [[0.023009366666666666], 0, 2.0917603969573975, 1638899067.976569], "version": 0.2, "tvm_version": "0.8.dev0"}
{"input": ["cuda -keys=cuda,gpu -max_num_threads=1024 -thread_warp_size=32", "conv2d_nchw.cuda", [["TENSOR", [128, 2016, 11, 11], "float32"], ["TENSOR", [336, 2016, 1, 1], "float32"], 1, "SAME", 1, "float32"], {}], "config": {"index": 1689866, "code_hash": null, "entity": [["tile_f", "sp", [-1, 1, 8, 6]], ["tile_y", "sp", [-1, 11, 1, 1]], ["tile_x", "sp", [-1, 1, 11, 1]], ["tile_rc", "sp", [-1, 12]], ["tile_ry", "sp", [-1, 1]], ["tile_rx", "sp", [-1, 1]], ["auto_unroll_max_step", "ot", 1500], ["unroll_explicit", "ot", 1]]}, "result": [[0.017902683333333332], 0, 2.5438716411590576, 1638899069.4995587], "version": 0.2, "tvm_version": "0.8.dev0"}
{"input": ["cuda -keys=cuda,gpu -max_num_threads=1024 -thread_warp_size=32", "conv2d_nchw.cuda", [["TENSOR", [128, 2016, 11, 11], "float32"], ["TENSOR", [336, 2016, 1, 1], "float32"], 1, "SAME", 1, "float32"], {}], "config": {"index": 1035857, "code_hash": null, "entity": [["tile_f", "sp", [-1, 1, 7, 8]], ["tile_y", "sp", [-1, 11, 1, 1]], ["tile_x", "sp", [-1, 1, 11, 1]], ["tile_rc", "sp", [-1, 9]], ["tile_ry", "sp", [-1, 1]], ["tile_rx", "sp", [-1, 1]], ["auto_unroll_max_step", "ot", 0], ["unroll_explicit", "ot", 1]]}, "result": [[0.02269241666666667], 0, 1.879939079284668, 1638899071.0388653], "version": 0.2, "tvm_version": "0.8.dev0"}
{"input": ["cuda -keys=cuda,gpu -max_num_threads=1024 -thread_warp_size=32", "conv2d_nchw.cuda", [["TENSOR", [128, 2016, 11, 11], "float32"], ["TENSOR", [336, 2016, 1, 1], "float32"], 1, "SAME", 1, "float32"], {}], "config": {"index": 408586, "code_hash": null, "entity": [["tile_f", "sp", [-1, 1, 8, 6]], ["tile_y", "sp", [-1, 11, 1, 1]], ["tile_x", "sp", [-1, 1, 11, 1]], ["tile_rc", "sp", [-1, 14]], ["tile_ry", "sp", [-1, 1]], ["tile_rx", "sp", [-1, 1]], ["auto_unroll_max_step", "ot", 512], ["unroll_explicit", "ot", 0]]}, "result": [[0.023562383333333336], 0, 1.8547229766845703, 1638899072.5143962], "version": 0.2, "tvm_version": "0.8.dev0"}
{"input": ["cuda -keys=cuda,gpu -max_num_threads=1024 -thread_warp_size=32", "conv2d_nchw.cuda", [["TENSOR", [128, 2016, 11, 11], "float32"], ["TENSOR", [336, 2016, 1, 1], "float32"], 1, "SAME", 1, "float32"], {}], "config": {"index": 1367343, "code_hash": null, "entity": [["tile_f", "sp", [-1, 1, 6, 7]], ["tile_y", "sp", [-1, 11, 1, 1]], ["tile_x", "sp", [-1, 1, 11, 1]], ["tile_rc", "sp", [-1, 12]], ["tile_ry", "sp", [-1, 1]], ["tile_rx", "sp", [-1, 1]], ["auto_unroll_max_step", "ot", 512], ["unroll_explicit", "ot", 1]]}, "result": [[0.023163633333333333], 0, 1.8471310138702393, 1638899073.9377337], "version": 0.2, "tvm_version": "0.8.dev0"}
{"input": ["cuda -keys=cuda,gpu -max_num_threads=1024 -thread_warp_size=32", "conv2d_nchw.cuda", [["TENSOR", [128, 2016, 11, 11], "float32"], ["TENSOR", [336, 2016, 1, 1], "float32"], 1, "SAME", 1, "float32"], {}], "config": {"index": 1385222, "code_hash": null, "entity": [["tile_f", "sp", [-1, 1, 7, 6]], ["tile_y", "sp", [-1, 11, 1, 1]], ["tile_x", "sp", [-1, 1, 11, 1]], ["tile_rc", "sp", [-1, 16]], ["tile_ry", "sp", [-1, 1]], ["tile_rx", "sp", [-1, 1]], ["auto_unroll_max_step", "ot", 512], ["unroll_explicit", "ot", 1]]}, "result": [[0.02888975], 0, 1.8244171142578125, 1638899075.3494005], "version": 0.2, "tvm_version": "0.8.dev0"}
{"input": ["cuda -keys=cuda,gpu -max_num_threads=1024 -thread_warp_size=32", "conv2d_nchw.cuda", [["TENSOR", [128, 2016, 11, 11], "float32"], ["TENSOR", [336, 2016, 1, 1], "float32"], 1, "SAME", 1, "float32"], {}], "config": {"index": 1044815, "code_hash": null, "entity": [["tile_f", "sp", [-1, 1, 6, 8]], ["tile_y", "sp", [-1, 11, 1, 1]], ["tile_x", "sp", [-1, 1, 11, 1]], ["tile_rc", "sp", [-1, 12]], ["tile_ry", "sp", [-1, 1]], ["tile_rx", "sp", [-1, 1]], ["auto_unroll_max_step", "ot", 0], ["unroll_explicit", "ot", 1]]}, "result": [[0.029225024999999998], 0, 1.7123403549194336, 1638899076.7002187], "version": 0.2, "tvm_version": "0.8.dev0"}
{"input": ["cuda -keys=cuda,gpu -max_num_threads=1024 -thread_warp_size=32", "conv2d_nchw.cuda", [["TENSOR", [128, 2016, 11, 11], "float32"], ["TENSOR", [336, 2016, 1, 1], "float32"], 1, "SAME", 1, "float32"], {}], "config": {"index": 86067, "code_hash": null, "entity": [["tile_f", "sp", [-1, 1, 8, 7]], ["tile_y", "sp", [-1, 11, 1, 1]], ["tile_x", "sp", [-1, 1, 11, 1]], ["tile_rc", "sp", [-1, 14]], ["tile_ry", "sp", [-1, 1]], ["tile_rx", "sp", [-1, 1]], ["auto_unroll_max_step", "ot", 0], ["unroll_explicit", "ot", 0]]}, "result": [[0.020481383333333335], 0, 1.8335883617401123, 1638899078.1450858], "version": 0.2, "tvm_version": "0.8.dev0"}
{"input": ["cuda -keys=cuda,gpu -max_num_threads=1024 -thread_warp_size=32", "conv2d_nchw.cuda", [["TENSOR", [128, 2016, 11, 11], "float32"], ["TENSOR", [336, 2016, 1, 1], "float32"], 1, "SAME", 1, "float32"], {}], "config": {"index": 1044712, "code_hash": null, "entity": [["tile_f", "sp", [-1, 1, 14, 4]], ["tile_y", "sp", [-1, 11, 1, 1]], ["tile_x", "sp", [-1, 1, 11, 1]], ["tile_rc", "sp", [-1, 12]], ["tile_ry", "sp", [-1, 1]], ["tile_rx", "sp", [-1, 1]], ["auto_unroll_max_step", "ot", 0], ["unroll_explicit", "ot", 1]]}, "result": [[0.024813316666666665], 0, 1.9178991317749023, 1638899079.708217], "version": 0.2, "tvm_version": "0.8.dev0"}
{"input": ["cuda -keys=cuda,gpu -max_num_threads=1024 -thread_warp_size=32", "conv2d_nchw.cuda", [["TENSOR", [128, 2016, 11, 11], "float32"], ["TENSOR", [336, 2016, 1, 1], "float32"], 1, "SAME", 1, "float32"], {}], "config": {"index": 1062578, "code_hash": null, "entity": [["tile_f", "sp", [-1, 1, 14, 3]], ["tile_y", "sp", [-1, 11, 1, 1]], ["tile_x", "sp", [-1, 1, 11, 1]], ["tile_rc", "sp", [-1, 16]], ["tile_ry", "sp", [-1, 1]], ["tile_rx", "sp", [-1, 1]], ["auto_unroll_max_step", "ot", 0], ["unroll_explicit", "ot", 1]]}, "result": [[0.026632674999999998], 0, 1.6376361846923828, 1638899081.0339372], "version": 0.2, "tvm_version": "0.8.dev0"}
{"input": ["cuda -keys=cuda,gpu -max_num_threads=1024 -thread_warp_size=32", "conv2d_nchw.cuda", [["TENSOR", [128, 2016, 11, 11], "float32"], ["TENSOR", [336, 2016, 1, 1], "float32"], 1, "SAME", 1, "float32"], {}], "config": {"index": 390707, "code_hash": null, "entity": [["tile_f", "sp", [-1, 1, 8, 7]], ["tile_y", "sp", [-1, 11, 1, 1]], ["tile_x", "sp", [-1, 1, 11, 1]], ["tile_rc", "sp", [-1, 9]], ["tile_ry", "sp", [-1, 1]], ["tile_rx", "sp", [-1, 1]], ["auto_unroll_max_step", "ot", 512], ["unroll_explicit", "ot", 0]]}, "result": [[0.0194945], 0, 1.8637559413909912, 1638899082.505173], "version": 0.2, "tvm_version": "0.8.dev0"}
{"input": ["cuda -keys=cuda,gpu -max_num_threads=1024 -thread_warp_size=32", "conv2d_nchw.cuda", [["TENSOR", [128, 2016, 11, 11], "float32"], ["TENSOR", [336, 2016, 1, 1], "float32"], 1, "SAME", 1, "float32"], {}], "config": {"index": 1107321, "code_hash": null, "entity": [["tile_f", "sp", [-1, 1, 14, 2]], ["tile_y", "sp", [-1, 11, 1, 1]], ["tile_x", "sp", [-1, 1, 11, 1]], ["tile_rc", "sp", [-1, 32]], ["tile_ry", "sp", [-1, 1]], ["tile_rx", "sp", [-1, 1]], ["auto_unroll_max_step", "ot", 0], ["unroll_explicit", "ot", 1]]}, "result": [[0.03477695], 0, 1.7044601440429688, 1638899083.894082], "version": 0.2, "tvm_version": "0.8.dev0"}
{"input": ["cuda -keys=cuda,gpu -max_num_threads=1024 -thread_warp_size=32", "conv2d_nchw.cuda", [["TENSOR", [128, 2016, 11, 11], "float32"], ["TENSOR", [336, 2016, 1, 1], "float32"], 1, "SAME", 1, "float32"], {}], "config": {"index": 1035823, "code_hash": null, "entity": [["tile_f", "sp", [-1, 1, 6, 7]], ["tile_y", "sp", [-1, 11, 1, 1]], ["tile_x", "sp", [-1, 1, 11, 1]], ["tile_rc", "sp", [-1, 9]], ["tile_ry", "sp", [-1, 1]], ["tile_rx", "sp", [-1, 1]], ["auto_unroll_max_step", "ot", 0], ["unroll_explicit", "ot", 1]]}, "result": [[0.025833175], 0, 1.733835220336914, 1638899085.2675], "version": 0.2, "tvm_version": "0.8.dev0"}
{"input": ["cuda -keys=cuda,gpu -max_num_threads=1024 -thread_warp_size=32", "conv2d_nchw.cuda", [["TENSOR", [128, 2016, 11, 11], "float32"], ["TENSOR", [336, 2016, 1, 1], "float32"], 1, "SAME", 1, "float32"], {}], "config": {"index": 1062386, "code_hash": null, "entity": [["tile_f", "sp", [-1, 1, 7, 1]], ["tile_y", "sp", [-1, 11, 1, 1]], ["tile_x", "sp", [-1, 1, 11, 1]], ["tile_rc", "sp", [-1, 16]], ["tile_ry", "sp", [-1, 1]], ["tile_rx", "sp", [-1, 1]], ["auto_unroll_max_step", "ot", 0], ["unroll_explicit", "ot", 1]]}, "result": [[0.07044299999999999], 0, 1.8876924514770508, 1638899086.8355718], "version": 0.2, "tvm_version": "0.8.dev0"}
{"input": ["cuda -keys=cuda,gpu -max_num_threads=1024 -thread_warp_size=32", "conv2d_nchw.cuda", [["TENSOR", [128, 2016, 11, 11], "float32"], ["TENSOR", [336, 2016, 1, 1], "float32"], 1, "SAME", 1, "float32"], {}], "config": {"index": 1062387, "code_hash": null, "entity": [["tile_f", "sp", [-1, 2, 7, 1]], ["tile_y", "sp", [-1, 11, 1, 1]], ["tile_x", "sp", [-1, 1, 11, 1]], ["tile_rc", "sp", [-1, 16]], ["tile_ry", "sp", [-1, 1]], ["tile_rx", "sp", [-1, 1]], ["auto_unroll_max_step", "ot", 0], ["unroll_explicit", "ot", 1]]}, "result": [[0.041321975000000004], 0, 1.6995289325714111, 1638899088.2480903], "version": 0.2, "tvm_version": "0.8.dev0"}
{"input": ["cuda -keys=cuda,gpu -max_num_threads=1024 -thread_warp_size=32", "conv2d_nchw.cuda", [["TENSOR", [128, 2016, 11, 11], "float32"], ["TENSOR", [336, 2016, 1, 1], "float32"], 1, "SAME", 1, "float32"], {}], "config": {"index": 103912, "code_hash": null, "entity": [["tile_f", "sp", [-1, 1, 14, 4]], ["tile_y", "sp", [-1, 11, 1, 1]], ["tile_x", "sp", [-1, 1, 11, 1]], ["tile_rc", "sp", [-1, 18]], ["tile_ry", "sp", [-1, 1]], ["tile_rx", "sp", [-1, 1]], ["auto_unroll_max_step", "ot", 0], ["unroll_explicit", "ot", 0]]}, "result": [[0.022924233333333335], 0, 1.8115856647491455, 1638899089.7123227], "version": 0.2, "tvm_version": "0.8.dev0"}
{"input": ["cuda -keys=cuda,gpu -max_num_threads=1024 -thread_warp_size=32", "conv2d_nchw.cuda", [["TENSOR", [128, 2016, 11, 11], "float32"], ["TENSOR", [336, 2016, 1, 1], "float32"], 1, "SAME", 1, "float32"], {}], "config": {"index": 1698826, "code_hash": null, "entity": [["tile_f", "sp", [-1, 1, 8, 6]], ["tile_y", "sp", [-1, 11, 1, 1]], ["tile_x", "sp", [-1, 1, 11, 1]], ["tile_rc", "sp", [-1, 14]], ["tile_ry", "sp", [-1, 1]], ["tile_rx", "sp", [-1, 1]], ["auto_unroll_max_step", "ot", 1500], ["unroll_explicit", "ot", 1]]}, "result": [[0.019067733333333333], 0, 2.722815752029419, 1638899091.222517], "version": 0.2, "tvm_version": "0.8.dev0"}
{"input": ["cuda -keys=cuda,gpu -max_num_threads=1024 -thread_warp_size=32", "conv2d_nchw.cuda", [["TENSOR", [128, 2016, 11, 11], "float32"], ["TENSOR", [336, 2016, 1, 1], "float32"], 1, "SAME", 1, "float32"], {}], "config": {"index": 722186, "code_hash": null, "entity": [["tile_f", "sp", [-1, 1, 8, 6]], ["tile_y", "sp", [-1, 11, 1, 1]], ["tile_x", "sp", [-1, 1, 11, 1]], ["tile_rc", "sp", [-1, 12]], ["tile_ry", "sp", [-1, 1]], ["tile_rx", "sp", [-1, 1]], ["auto_unroll_max_step", "ot", 1500], ["unroll_explicit", "ot", 0]]}, "result": [[0.0191173], 0, 1.964048147201538, 1638899092.736401], "version": 0.2, "tvm_version": "0.8.dev0"}
{"input": ["cuda -keys=cuda,gpu -max_num_threads=1024 -thread_warp_size=32", "conv2d_nchw.cuda", [["TENSOR", [128, 2016, 11, 11], "float32"], ["TENSOR", [336, 2016, 1, 1], "float32"], 1, "SAME", 1, "float32"], {}], "config": {"index": 1376307, "code_hash": null, "entity": [["tile_f", "sp", [-1, 1, 8, 7]], ["tile_y", "sp", [-1, 11, 1, 1]], ["tile_x", "sp", [-1, 1, 11, 1]], ["tile_rc", "sp", [-1, 14]], ["tile_ry", "sp", [-1, 1]], ["tile_rx", "sp", [-1, 1]], ["auto_unroll_max_step", "ot", 512], ["unroll_explicit", "ot", 1]]}, "result": [[0.01979145], 0, 1.914961338043213, 1638899094.220099], "version": 0.2, "tvm_version": "0.8.dev0"}
{"input": ["cuda -keys=cuda,gpu -max_num_threads=1024 -thread_warp_size=32", "conv2d_nchw.cuda", [["TENSOR", [128, 2016, 11, 11], "float32"], ["TENSOR", [336, 2016, 1, 1], "float32"], 1, "SAME", 1, "float32"], {}], "config": {"index": 417504, "code_hash": null, "entity": [["tile_f", "sp", [-1, 1, 7, 4]], ["tile_y", "sp", [-1, 11, 1, 1]], ["tile_x", "sp", [-1, 1, 11, 1]], ["tile_rc", "sp", [-1, 16]], ["tile_ry", "sp", [-1, 1]], ["tile_rx", "sp", [-1, 1]], ["auto_unroll_max_step", "ot", 512], ["unroll_explicit", "ot", 0]]}, "result": [[0.035841250000000005], 0, 1.8130090236663818, 1638899095.694878], "version": 0.2, "tvm_version": "0.8.dev0"}
{"input": ["cuda -keys=cuda,gpu -max_num_threads=1024 -thread_warp_size=32", "conv2d_nchw.cuda", [["TENSOR", [128, 2016, 11, 11], "float32"], ["TENSOR", [336, 2016, 1, 1], "float32"], 1, "SAME", 1, "float32"], {}], "config": {"index": 68177, "code_hash": null, "entity": [["tile_f", "sp", [-1, 1, 7, 8]], ["tile_y", "sp", [-1, 11, 1, 1]], ["tile_x", "sp", [-1, 1, 11, 1]], ["tile_rc", "sp", [-1, 9]], ["tile_ry", "sp", [-1, 1]], ["tile_rx", "sp", [-1, 1]], ["auto_unroll_max_step", "ot", 0], ["unroll_explicit", "ot", 0]]}, "result": [[0.021317033333333332], 0, 1.7798948287963867, 1638899107.6158192], "version": 0.2, "tvm_version": "0.8.dev0"}
{"input": ["cuda -keys=cuda,gpu -max_num_threads=1024 -thread_warp_size=32", "conv2d_nchw.cuda", [["TENSOR", [128, 2016, 11, 11], "float32"], ["TENSOR", [336, 2016, 1, 1], "float32"], 1, "SAME", 1, "float32"], {}], "config": {"index": 399663, "code_hash": null, "entity": [["tile_f", "sp", [-1, 1, 6, 7]], ["tile_y", "sp", [-1, 11, 1, 1]], ["tile_x", "sp", [-1, 1, 11, 1]], ["tile_rc", "sp", [-1, 12]], ["tile_ry", "sp", [-1, 1]], ["tile_rx", "sp", [-1, 1]], ["auto_unroll_max_step", "ot", 512], ["unroll_explicit", "ot", 0]]}, "result": [[0.024305383333333333], 0, 1.793452262878418, 1638899109.043646], "version": 0.2, "tvm_version": "0.8.dev0"}
{"input": ["cuda -keys=cuda,gpu -max_num_threads=1024 -thread_warp_size=32", "conv2d_nchw.cuda", [["TENSOR", [128, 2016, 11, 11], "float32"], ["TENSOR", [336, 2016, 1, 1], "float32"], 1, "SAME", 1, "float32"], {}], "config": {"index": 417542, "code_hash": null, "entity": [["tile_f", "sp", [-1, 1, 7, 6]], ["tile_y", "sp", [-1, 11, 1, 1]], ["tile_x", "sp", [-1, 1, 11, 1]], ["tile_rc", "sp", [-1, 16]], ["tile_ry", "sp", [-1, 1]], ["tile_rx", "sp", [-1, 1]], ["auto_unroll_max_step", "ot", 512], ["unroll_explicit", "ot", 0]]}, "result": [[0.03774235], 0, 1.8475580215454102, 1638899110.5131767], "version": 0.2, "tvm_version": "0.8.dev0"}
{"input": ["cuda -keys=cuda,gpu -max_num_threads=1024 -thread_warp_size=32", "conv2d_nchw.cuda", [["TENSOR", [128, 2016, 11, 11], "float32"], ["TENSOR", [336, 2016, 1, 1], "float32"], 1, "SAME", 1, "float32"], {}], "config": {"index": 1394152, "code_hash": null, "entity": [["tile_f", "sp", [-1, 1, 14, 4]], ["tile_y", "sp", [-1, 11, 1, 1]], ["tile_x", "sp", [-1, 1, 11, 1]], ["tile_rc", "sp", [-1, 18]], ["tile_ry", "sp", [-1, 1]], ["tile_rx", "sp", [-1, 1]], ["auto_unroll_max_step", "ot", 512], ["unroll_explicit", "ot", 1]]}, "result": [[0.021915766666666666], 0, 1.7922413349151611, 1638899111.9378064], "version": 0.2, "tvm_version": "0.8.dev0"}
{"input": ["cuda -keys=cuda,gpu -max_num_threads=1024 -thread_warp_size=32", "conv2d_nchw.cuda", [["TENSOR", [128, 2016, 11, 11], "float32"], ["TENSOR", [336, 2016, 1, 1], "float32"], 1, "SAME", 1, "float32"], {}], "config": {"index": 1680947, "code_hash": null, "entity": [["tile_f", "sp", [-1, 1, 8, 7]], ["tile_y", "sp", [-1, 11, 1, 1]], ["tile_x", "sp", [-1, 1, 11, 1]], ["tile_rc", "sp", [-1, 9]], ["tile_ry", "sp", [-1, 1]], ["tile_rx", "sp", [-1, 1]], ["auto_unroll_max_step", "ot", 1500], ["unroll_explicit", "ot", 1]]}, "result": [[0.018439883333333334], 0, 2.3573989868164062, 1638899113.4352908], "version": 0.2, "tvm_version": "0.8.dev0"}
{"input": ["cuda -keys=cuda,gpu -max_num_threads=1024 -thread_warp_size=32", "conv2d_nchw.cuda", [["TENSOR", [128, 2016, 11, 11], "float32"], ["TENSOR", [336, 2016, 1, 1], "float32"], 1, "SAME", 1, "float32"], {}], "config": {"index": 77135, "code_hash": null, "entity": [["tile_f", "sp", [-1, 1, 6, 8]], ["tile_y", "sp", [-1, 11, 1, 1]], ["tile_x", "sp", [-1, 1, 11, 1]], ["tile_rc", "sp", [-1, 12]], ["tile_ry", "sp", [-1, 1]], ["tile_rx", "sp", [-1, 1]], ["auto_unroll_max_step", "ot", 0], ["unroll_explicit", "ot", 0]]}, "result": [[0.028383400000000003], 0, 1.723179817199707, 1638899114.8052444], "version": 0.2, "tvm_version": "0.8.dev0"}
{"input": ["cuda -keys=cuda,gpu -max_num_threads=1024 -thread_warp_size=32", "conv2d_nchw.cuda", [["TENSOR", [128, 2016, 11, 11], "float32"], ["TENSOR", [336, 2016, 1, 1], "float32"], 1, "SAME", 1, "float32"], {}], "config": {"index": 77032, "code_hash": null, "entity": [["tile_f", "sp", [-1, 1, 14, 4]], ["tile_y", "sp", [-1, 11, 1, 1]], ["tile_x", "sp", [-1, 1, 11, 1]], ["tile_rc", "sp", [-1, 12]], ["tile_ry", "sp", [-1, 1]], ["tile_rx", "sp", [-1, 1]], ["auto_unroll_max_step", "ot", 0], ["unroll_explicit", "ot", 0]]}, "result": [[0.024898966666666664], 0, 1.7504429817199707, 1638899116.2424889], "version": 0.2, "tvm_version": "0.8.dev0"}
{"input": ["cuda -keys=cuda,gpu -max_num_threads=1024 -thread_warp_size=32", "conv2d_nchw.cuda", [["TENSOR", [128, 2016, 11, 11], "float32"], ["TENSOR", [336, 2016, 1, 1], "float32"], 1, "SAME", 1, "float32"], {}], "config": {"index": 94898, "code_hash": null, "entity": [["tile_f", "sp", [-1, 1, 14, 3]], ["tile_y", "sp", [-1, 11, 1, 1]], ["tile_x", "sp", [-1, 1, 11, 1]], ["tile_rc", "sp", [-1, 16]], ["tile_ry", "sp", [-1, 1]], ["tile_rx", "sp", [-1, 1]], ["auto_unroll_max_step", "ot", 0], ["unroll_explicit", "ot", 0]]}, "result": [[0.026446024999999998], 0, 1.686896562576294, 1638899117.5931146], "version": 0.2, "tvm_version": "0.8.dev0"}
