artifacts/Table3/tvm/autotvm/conv/conv2d_128_1008_42_42_168_1_1_1_0.log
{"input": ["cuda -keys=cuda,gpu -max_num_threads=1024 -thread_warp_size=32", "conv2d_nchw.cuda", [["TENSOR", [128, 1008, 42, 42], "float32"], ["TENSOR", [168, 1008, 1, 1], "float32"], 1, "SAME", 1, "float32"], {}], "config": {"index": 84721459, "code_hash": null, "entity": [["tile_f", "sp", [-1, 14, 1, 4]], ["tile_y", "sp", [-1, 3, 1, 7]], ["tile_x", "sp", [-1, 1, 2, 3]], ["tile_rc", "sp", [-1, 6]], ["tile_ry", "sp", [-1, 1]], ["tile_rx", "sp", [-1, 1]], ["auto_unroll_max_step", "ot", 1500], ["unroll_explicit", "ot", 0]]}, "result": [[35.230516375], 0, 192.7477867603302, 1639034461.3548496], "version": 0.2, "tvm_version": "0.8.dev0"}
{"input": ["cuda -keys=cuda,gpu -max_num_threads=1024 -thread_warp_size=32", "conv2d_nchw.cuda", [["TENSOR", [128, 1008, 42, 42], "float32"], ["TENSOR", [168, 1008, 1, 1], "float32"], 1, "SAME", 1, "float32"], {}], "config": {"index": 129771433, "code_hash": null, "entity": [["tile_f", "sp", [-1, 1, 3, 7]], ["tile_y", "sp", [-1, 1, 3, 2]], ["tile_x", "sp", [-1, 1, 1, 1]], ["tile_rc", "sp", [-1, 14]], ["tile_ry", "sp", [-1, 1]], ["tile_rx", "sp", [-1, 1]], ["auto_unroll_max_step", "ot", 0], ["unroll_explicit", "ot", 1]]}, "result": [[1.1238960999999998], 0, 12.778539896011353, 1639034681.180467], "version": 0.2, "tvm_version": "0.8.dev0"}
{"input": ["cuda -keys=cuda,gpu -max_num_threads=1024 -thread_warp_size=32", "conv2d_nchw.cuda", [["TENSOR", [128, 1008, 42, 42], "float32"], ["TENSOR", [168, 1008, 1, 1], "float32"], 1, "SAME", 1, "float32"], {}], "config": {"index": 26481496, "code_hash": null, "entity": [["tile_f", "sp", [-1, 1, 14, 6]], ["tile_y", "sp", [-1, 3, 1, 1]], ["tile_x", "sp", [-1, 2, 3, 1]], ["tile_rc", "sp", [-1, 72]], ["tile_ry", "sp", [-1, 1]], ["tile_rx", "sp", [-1, 1]], ["auto_unroll_max_step", "ot", 0], ["unroll_explicit", "ot", 0]]}, "result": [[0.42463544999999997], 0, 10.857825994491577, 1639034692.950638], "version": 0.2, "tvm_version": "0.8.dev0"}
{"input": ["cuda -keys=cuda,gpu -max_num_threads=1024 -thread_warp_size=32", "conv2d_nchw.cuda", [["TENSOR", [128, 1008, 42, 42], "float32"], ["TENSOR", [168, 1008, 1, 1], "float32"], 1, "SAME", 1, "float32"], {}], "config": {"index": 168460177, "code_hash": null, "entity": [["tile_f", "sp", [-1, 2, 2, 1]], ["tile_y", "sp", [-1, 7, 1, 3]], ["tile_x", "sp", [-1, 1, 7, 2]], ["tile_rc", "sp", [-1, 12]], ["tile_ry", "sp", [-1, 1]], ["tile_rx", "sp", [-1, 1]], ["auto_unroll_max_step", "ot", 512], ["unroll_explicit", "ot", 1]]}, "result": [[0.529608], 0, 11.960777282714844, 1639034705.187317], "version": 0.2, "tvm_version": "0.8.dev0"}
{"input": ["cuda -keys=cuda,gpu -max_num_threads=1024 -thread_warp_size=32", "conv2d_nchw.cuda", [["TENSOR", [128, 1008, 42, 42], "float32"], ["TENSOR", [168, 1008, 1, 1], "float32"], 1, "SAME", 1, "float32"], {}], "config": {"index": 52309247, "code_hash": null, "entity": [["tile_f", "sp", [-1, 4, 7, 2]], ["tile_y", "sp", [-1, 7, 2, 1]], ["tile_x", "sp", [-1, 3, 1, 14]], ["tile_rc", "sp", [-1, 14]], ["tile_ry", "sp", [-1, 1]], ["tile_rx", "sp", [-1, 1]], ["auto_unroll_max_step", "ot", 512], ["unroll_explicit", "ot", 0]]}, "result": [[9.03639575], 0, 53.81805992126465, 1639034759.2258346], "version": 0.2, "tvm_version": "0.8.dev0"}
{"input": ["cuda -keys=cuda,gpu -max_num_threads=1024 -thread_warp_size=32", "conv2d_nchw.cuda", [["TENSOR", [128, 1008, 42, 42], "float32"], ["TENSOR", [168, 1008, 1, 1], "float32"], 1, "SAME", 1, "float32"], {}], "config": {"index": 84276086, "code_hash": null, "entity": [["tile_f", "sp", [-1, 1, 12, 7]], ["tile_y", "sp", [-1, 3, 1, 1]], ["tile_x", "sp", [-1, 2, 7, 1]], ["tile_rc", "sp", [-1, 6]], ["tile_ry", "sp", [-1, 1]], ["tile_rx", "sp", [-1, 1]], ["auto_unroll_max_step", "ot", 1500], ["unroll_explicit", "ot", 0]]}, "result": [[0.07551184999999999], 0, 8.534317970275879, 1639034767.799648], "version": 0.2, "tvm_version": "0.8.dev0"}
{"input": ["cuda -keys=cuda,gpu -max_num_threads=1024 -thread_warp_size=32", "conv2d_nchw.cuda", [["TENSOR", [128, 1008, 42, 42], "float32"], ["TENSOR", [168, 1008, 1, 1], "float32"], 1, "SAME", 1, "float32"], {}], "config": {"index": 168243413, "code_hash": null, "entity": [["tile_f", "sp", [-1, 1, 7, 6]], ["tile_y", "sp", [-1, 1, 1, 1]], ["tile_x", "sp", [-1, 3, 14, 1]], ["tile_rc", "sp", [-1, 12]], ["tile_ry", "sp", [-1, 1]], ["tile_rx", "sp", [-1, 1]], ["auto_unroll_max_step", "ot", 512], ["unroll_explicit", "ot", 1]]}, "result": [[0.11096355], 0, 8.600662469863892, 1639034777.214662], "version": 0.2, "tvm_version": "0.8.dev0"}
{"input": ["cuda -keys=cuda,gpu -max_num_threads=1024 -thread_warp_size=32", "conv2d_nchw.cuda", [["TENSOR", [128, 1008, 42, 42], "float32"], ["TENSOR", [168, 1008, 1, 1], "float32"], 1, "SAME", 1, "float32"], {}], "config": {"index": 211306067, "code_hash": null, "entity": [["tile_f", "sp", [-1, 7, 1, 3]], ["tile_y", "sp", [-1, 2, 7, 3]], ["tile_x", "sp", [-1, 2, 3, 1]], ["tile_rc", "sp", [-1, 18]], ["tile_ry", "sp", [-1, 1]], ["tile_rx", "sp", [-1, 1]], ["auto_unroll_max_step", "ot", 1500], ["unroll_explicit", "ot", 1]]}, "result": [[0.36294540000000003], 0, 10.765211343765259, 1639034787.99019], "version": 0.2, "tvm_version": "0.8.dev0"}
{"input": ["cuda -keys=cuda,gpu -max_num_threads=1024 -thread_warp_size=32", "conv2d_nchw.cuda", [["TENSOR", [128, 1008, 42, 42], "float32"], ["TENSOR", [168, 1008, 1, 1], "float32"], 1, "SAME", 1, "float32"], {}], "config": {"index": 206292891, "code_hash": null, "entity": [["tile_f", "sp", [-1, 2, 1, 2]], ["tile_y", "sp", [-1, 1, 1, 14]], ["tile_x", "sp", [-1, 1, 21, 1]], ["tile_rc", "sp", [-1, 9]], ["tile_ry", "sp", [-1, 1]], ["tile_rx", "sp", [-1, 1]], ["auto_unroll_max_step", "ot", 1500], ["unroll_explicit", "ot", 1]]}, "result": [[0.49502999999999997], 0, 11.719492197036743, 1639034799.486492], "version": 0.2, "tvm_version": "0.8.dev0"}
{"input": ["cuda -keys=cuda,gpu -max_num_threads=1024 -thread_warp_size=32", "conv2d_nchw.cuda", [["TENSOR", [128, 1008, 42, 42], "float32"], ["TENSOR", [168, 1008, 1, 1], "float32"], 1, "SAME", 1, "float32"], {}], "config": {"index": 221030251, "code_hash": null, "entity": [["tile_f", "sp", [-1, 1, 28, 3]], ["tile_y", "sp", [-1, 1, 3, 2]], ["tile_x", "sp", [-1, 1, 2, 3]], ["tile_rc", "sp", [-1, 56]], ["tile_ry", "sp", [-1, 1]], ["tile_rx", "sp", [-1, 1]], ["auto_unroll_max_step", "ot", 1500], ["unroll_explicit", "ot", 1]]}, "result": [[0.0871711], 0, 10.122951984405518, 1639034808.5395756], "version": 0.2, "tvm_version": "0.8.dev0"}
{"input": ["cuda -keys=cuda,gpu -max_num_threads=1024 -thread_warp_size=32", "conv2d_nchw.cuda", [["TENSOR", [128, 1008, 42, 42], "float32"], ["TENSOR", [168, 1008, 1, 1], "float32"], 1, "SAME", 1, "float32"], {}], "config": {"index": 160458583, "code_hash": null, "entity": [["tile_f", "sp", [-1, 14, 2, 1]], ["tile_y", "sp", [-1, 1, 1, 14]], ["tile_x", "sp", [-1, 1, 42, 1]], ["tile_rc", "sp", [-1, 3]], ["tile_ry", "sp", [-1, 1]], ["tile_rx", "sp", [-1, 1]], ["auto_unroll_max_step", "ot", 512], ["unroll_explicit", "ot", 1]]}, "result": [[0.31106085], 0, 9.421555280685425, 1639034818.8608437], "version": 0.2, "tvm_version": "0.8.dev0"}
{"input": ["cuda -keys=cuda,gpu -max_num_threads=1024 -thread_warp_size=32", "conv2d_nchw.cuda", [["TENSOR", [128, 1008, 42, 42], "float32"], ["TENSOR", [168, 1008, 1, 1], "float32"], 1, "SAME", 1, "float32"], {}], "config": {"index": 131306014, "code_hash": null, "entity": [["tile_f", "sp", [-1, 6, 1, 2]], ["tile_y", "sp", [-1, 1, 1, 2]], ["tile_x", "sp", [-1, 21, 2, 1]], ["tile_rc", "sp", [-1, 16]], ["tile_ry", "sp", [-1, 1]], ["tile_rx", "sp", [-1, 1]], ["auto_unroll_max_step", "ot", 0], ["unroll_explicit", "ot", 1]]}, "result": [[31.056479449999998], 0, 164.26604437828064, 1639034982.5922086], "version": 0.2, "tvm_version": "0.8.dev0"}
{"input": ["cuda -keys=cuda,gpu -max_num_threads=1024 -thread_warp_size=32", "conv2d_nchw.cuda", [["TENSOR", [128, 1008, 42, 42], "float32"], ["TENSOR", [168, 1008, 1, 1], "float32"], 1, "SAME", 1, "float32"], {}], "config": {"index": 89774901, "code_hash": null, "entity": [["tile_f", "sp", [-1, 42, 1, 4]], ["tile_y", "sp", [-1, 3, 7, 2]], ["tile_x", "sp", [-1, 1, 3, 2]], ["tile_rc", "sp", [-1, 12]], ["tile_ry", "sp", [-1, 1]], ["tile_rx", "sp", [-1, 1]], ["auto_unroll_max_step", "ot", 1500], ["unroll_explicit", "ot", 0]]}, "result": [[4.35261245], 0, 33.11093306541443, 1639035018.869806], "version": 0.2, "tvm_version": "0.8.dev0"}
{"input": ["cuda -keys=cuda,gpu -max_num_threads=1024 -thread_warp_size=32", "conv2d_nchw.cuda", [["TENSOR", [128, 1008, 42, 42], "float32"], ["TENSOR", [168, 1008, 1, 1], "float32"], 1, "SAME", 1, "float32"], {}], "config": {"index": 55507853, "code_hash": null, "entity": [["tile_f", "sp", [-1, 56, 1, 1]], ["tile_y", "sp", [-1, 1, 14, 1]], ["tile_x", "sp", [-1, 1, 14, 1]], ["tile_rc", "sp", [-1, 21]], ["tile_ry", "sp", [-1, 1]], ["tile_rx", "sp", [-1, 1]], ["auto_unroll_max_step", "ot", 512], ["unroll_explicit", "ot", 0]]}, "result": [[0.16013805], 0, 9.491193056106567, 1639035028.88973], "version": 0.2, "tvm_version": "0.8.dev0"}
{"input": ["cuda -keys=cuda,gpu -max_num_threads=1024 -thread_warp_size=32", "conv2d_nchw.cuda", [["TENSOR", [128, 1008, 42, 42], "float32"], ["TENSOR", [168, 1008, 1, 1], "float32"], 1, "SAME", 1, "float32"], {}], "config": {"index": 48646576, "code_hash": null, "entity": [["tile_f", "sp", [-1, 3, 1, 4]], ["tile_y", "sp", [-1, 3, 7, 1]], ["tile_x", "sp", [-1, 42, 1, 1]], ["tile_rc", "sp", [-1, 9]], ["tile_ry", "sp", [-1, 1]], ["tile_rx", "sp", [-1, 1]], ["auto_unroll_max_step", "ot", 512], ["unroll_explicit", "ot", 0]]}, "result": [[18.632032749999997], 0, 102.85694885253906, 1639035129.8794389], "version": 0.2, "tvm_version": "0.8.dev0"}
{"input": ["cuda -keys=cuda,gpu -max_num_threads=1024 -thread_warp_size=32", "conv2d_nchw.cuda", [["TENSOR", [128, 1008, 42, 42], "float32"], ["TENSOR", [168, 1008, 1, 1], "float32"], 1, "SAME", 1, "float32"], {}], "config": {"index": 220663538, "code_hash": null, "entity": [["tile_f", "sp", [-1, 7, 1, 4]], ["tile_y", "sp", [-1, 2, 1, 3]], ["tile_x", "sp", [-1, 1, 14, 1]], ["tile_rc", "sp", [-1, 56]], ["tile_ry", "sp", [-1, 1]], ["tile_rx", "sp", [-1, 1]], ["auto_unroll_max_step", "ot", 1500], ["unroll_explicit", "ot", 1]]}, "result": [[0.29372815], 0, 10.354616165161133, 1639035140.4800816], "version": 0.2, "tvm_version": "0.8.dev0"}
{"input": ["cuda -keys=cuda,gpu -max_num_threads=1024 -thread_warp_size=32", "conv2d_nchw.cuda", [["TENSOR", [128, 1008, 42, 42], "float32"], ["TENSOR", [168, 1008, 1, 1], "float32"], 1, "SAME", 1, "float32"], {}], "config": {"index": 87539854, "code_hash": null, "entity": [["tile_f", "sp", [-1, 84, 1, 1]], ["tile_y", "sp", [-1, 1, 42, 1]], ["tile_x", "sp", [-1, 3, 1, 7]], ["tile_rc", "sp", [-1, 8]], ["tile_ry", "sp", [-1, 1]], ["tile_rx", "sp", [-1, 1]], ["auto_unroll_max_step", "ot", 1500], ["unroll_explicit", "ot", 0]]}, "result": [[4.248654999999999], 0, 29.2200710773468, 1639035170.2321928], "version": 0.2, "tvm_version": "0.8.dev0"}
{"input": ["cuda -keys=cuda,gpu -max_num_threads=1024 -thread_warp_size=32", "conv2d_nchw.cuda", [["TENSOR", [128, 1008, 42, 42], "float32"], ["TENSOR", [168, 1008, 1, 1], "float32"], 1, "SAME", 1, "float32"], {}], "config": {"index": 136851290, "code_hash": null, "entity": [["tile_f", "sp", [-1, 1, 1, 2]], ["tile_y", "sp", [-1, 1, 3, 1]], ["tile_x", "sp", [-1, 1, 42, 1]], ["tile_rc", "sp", [-1, 28]], ["tile_ry", "sp", [-1, 1]], ["tile_rx", "sp", [-1, 1]], ["auto_unroll_max_step", "ot", 0], ["unroll_explicit", "ot", 1]]}, "result": [[0.9071106], 0, 12.515257120132446, 1639035185.1727586], "version": 0.2, "tvm_version": "0.8.dev0"}
{"input": ["cuda -keys=cuda,gpu -max_num_threads=1024 -thread_warp_size=32", "conv2d_nchw.cuda", [["TENSOR", [128, 1008, 42, 42], "float32"], ["TENSOR", [168, 1008, 1, 1], "float32"], 1, "SAME", 1, "float32"], {}], "config": {"index": 162354403, "code_hash": null, "entity": [["tile_f", "sp", [-1, 2, 7, 3]], ["tile_y", "sp", [-1, 7, 1, 2]], ["tile_x", "sp", [-1, 2, 3, 7]], ["tile_rc", "sp", [-1, 4]], ["tile_ry", "sp", [-1, 1]], ["tile_rx", "sp", [-1, 1]], ["auto_unroll_max_step", "ot", 512], ["unroll_explicit", "ot", 1]]}, "result": [[3.324435], 0, 29.260451793670654, 1639035222.1387224], "version": 0.2, "tvm_version": "0.8.dev0"}
{"input": ["cuda -keys=cuda,gpu -max_num_threads=1024 -thread_warp_size=32", "conv2d_nchw.cuda", [["TENSOR", [128, 1008, 42, 42], "float32"], ["TENSOR", [168, 1008, 1, 1], "float32"], 1, "SAME", 1, "float32"], {}], "config": {"index": 144179626, "code_hash": null, "entity": [["tile_f", "sp", [-1, 7, 2, 2]], ["tile_y", "sp", [-1, 2, 1, 1]], ["tile_x", "sp", [-1, 1, 1, 1]], ["tile_rc", "sp", [-1, 72]], ["tile_ry", "sp", [-1, 1]], ["tile_rx", "sp", [-1, 1]], ["auto_unroll_max_step", "ot", 0], ["unroll_explicit", "ot", 1]]}, "result": [[5.7502227999999995], 0, 36.3685417175293, 1639035258.2342415], "version": 0.2, "tvm_version": "0.8.dev0"}
{"input": ["cuda -keys=cuda,gpu -max_num_threads=1024 -thread_warp_size=32", "conv2d_nchw.cuda", [["TENSOR", [128, 1008, 42, 42], "float32"], ["TENSOR", [168, 1008, 1, 1], "float32"], 1, "SAME", 1, "float32"], {}], "config": {"index": 87168919, "code_hash": null, "entity": [["tile_f", "sp", [-1, 4, 3, 14]], ["tile_y", "sp", [-1, 1, 7, 1]], ["tile_x", "sp", [-1, 7, 3, 2]], ["tile_rc", "sp", [-1, 8]], ["tile_ry", "sp", [-1, 1]], ["tile_rx", "sp", [-1, 1]], ["auto_unroll_max_step", "ot", 1500], ["unroll_explicit", "ot", 0]]}, "result": [[1.8311598], 0, 19.432987689971924, 1639035276.072022], "version": 0.2, "tvm_version": "0.8.dev0"}
{"input": ["cuda -keys=cuda,gpu -max_num_threads=1024 -thread_warp_size=32", "conv2d_nchw.cuda", [["TENSOR", [128, 1008, 42, 42], "float32"], ["TENSOR", [168, 1008, 1, 1], "float32"], 1, "SAME", 1, "float32"], {}], "config": {"index": 122707712, "code_hash": null, "entity": [["tile_f", "sp", [-1, 1, 7, 4]], ["tile_y", "sp", [-1, 2, 1, 3]], ["tile_x", "sp", [-1, 14, 1, 3]], ["tile_rc", "sp", [-1, 4]], ["tile_ry", "sp", [-1, 1]], ["tile_rx", "sp", [-1, 1]], ["auto_unroll_max_step", "ot", 0], ["unroll_explicit", "ot", 1]]}, "result": [[9.8267964], 0, 58.05456352233887, 1639035333.6179533], "version": 0.2, "tvm_version": "0.8.dev0"}
{"input": ["cuda -keys=cuda,gpu -max_num_threads=1024 -thread_warp_size=32", "conv2d_nchw.cuda", [["TENSOR", [128, 1008, 42, 42], "float32"], ["TENSOR", [168, 1008, 1, 1], "float32"], 1, "SAME", 1, "float32"], {}], "config": {"index": 84466640, "code_hash": null, "entity": [["tile_f", "sp", [-1, 3, 28, 1]], ["tile_y", "sp", [-1, 1, 14, 1]], ["tile_x", "sp", [-1, 3, 1, 2]], ["tile_rc", "sp", [-1, 6]], ["tile_ry", "sp", [-1, 1]], ["tile_rx", "sp", [-1, 1]], ["auto_unroll_max_step", "ot", 1500], ["unroll_explicit", "ot", 0]]}, "result": [[0.10005507500000001], 0, 8.204368829727173, 1639035341.7140546], "version": 0.2, "tvm_version": "0.8.dev0"}
{"input": ["cuda -keys=cuda,gpu -max_num_threads=1024 -thread_warp_size=32", "conv2d_nchw.cuda", [["TENSOR", [128, 1008, 42, 42], "float32"], ["TENSOR", [168, 1008, 1, 1], "float32"], 1, "SAME", 1, "float32"], {}], "config": {"index": 83258153, "code_hash": null, "entity": [["tile_f", "sp", [-1, 1, 3, 7]], ["tile_y", "sp", [-1, 6, 7, 1]], ["tile_x", "sp", [-1, 1, 7, 2]], ["tile_rc", "sp", [-1, 4]], ["tile_ry", "sp", [-1, 1]], ["tile_rx", "sp", [-1, 1]], ["auto_unroll_max_step", "ot", 1500], ["unroll_explicit", "ot", 0]]}, "result": [[0.11197265], 0, 9.902442455291748, 1639035351.9234717], "version": 0.2, "tvm_version": "0.8.dev0"}
{"input": ["cuda -keys=cuda,gpu -max_num_threads=1024 -thread_warp_size=32", "conv2d_nchw.cuda", [["TENSOR", [128, 1008, 42, 42], "float32"], ["TENSOR", [168, 1008, 1, 1], "float32"], 1, "SAME", 1, "float32"], {}], "config": {"index": 199474521, "code_hash": null, "entity": [["tile_f", "sp", [-1, 3, 4, 14]], ["tile_y", "sp", [-1, 2, 1, 21]], ["tile_x", "sp", [-1, 21, 2, 1]], ["tile_rc", "sp", [-1, 3]], ["tile_ry", "sp", [-1, 1]], ["tile_rx", "sp", [-1, 1]], ["auto_unroll_max_step", "ot", 1500], ["unroll_explicit", "ot", 1]]}, "result": [[14.790518375], 0, 87.12245059013367, 1639035436.4882867], "version": 0.2, "tvm_version": "0.8.dev0"}
{"input": ["cuda -keys=cuda,gpu -max_num_threads=1024 -thread_warp_size=32", "conv2d_nchw.cuda", [["TENSOR", [128, 1008, 42, 42], "float32"], ["TENSOR", [168, 1008, 1, 1], "float32"], 1, "SAME", 1, "float32"], {}], "config": {"index": 159199384, "code_hash": null, "entity": [["tile_f", "sp", [-1, 21, 2, 1]], ["tile_y", "sp", [-1, 1, 42, 1]], ["tile_x", "sp", [-1, 7, 1, 2]], ["tile_rc", "sp", [-1, 2]], ["tile_ry", "sp", [-1, 1]], ["tile_rx", "sp", [-1, 1]], ["auto_unroll_max_step", "ot", 512], ["unroll_explicit", "ot", 1]]}, "result": [[0.905608675], 0, 13.364946603775024, 1639035449.2125597], "version": 0.2, "tvm_version": "0.8.dev0"}
{"input": ["cuda -keys=cuda,gpu -max_num_threads=1024 -thread_warp_size=32", "conv2d_nchw.cuda", [["TENSOR", [128, 1008, 42, 42], "float32"], ["TENSOR", [168, 1008, 1, 1], "float32"], 1, "SAME", 1, "float32"], {}], "config": {"index": 222827233, "code_hash": null, "entity": [["tile_f", "sp", [-1, 14, 3, 1]], ["tile_y", "sp", [-1, 14, 3, 1]], ["tile_x", "sp", [-1, 1, 1, 1]], ["tile_rc", "sp", [-1, 72]], ["tile_ry", "sp", [-1, 1]], ["tile_rx", "sp", [-1, 1]], ["auto_unroll_max_step", "ot", 1500], ["unroll_explicit", "ot", 1]]}, "result": [[0.71862995], 0, 15.042481899261475, 1639035461.5542912], "version": 0.2, "tvm_version": "0.8.dev0"}
{"input": ["cuda -keys=cuda,gpu -max_num_threads=1024 -thread_warp_size=32", "conv2d_nchw.cuda", [["TENSOR", [128, 1008, 42, 42], "float32"], ["TENSOR", [168, 1008, 1, 1], "float32"], 1, "SAME", 1, "float32"], {}], "config": {"index": 92398070, "code_hash": null, "entity": [["tile_f", "sp", [-1, 1, 2, 42]], ["tile_y", "sp", [-1, 14, 1, 3]], ["tile_x", "sp", [-1, 1, 3, 2]], ["tile_rc", "sp", [-1, 16]], ["tile_ry", "sp", [-1, 1]], ["tile_rx", "sp", [-1, 1]], ["auto_unroll_max_step", "ot", 1500], ["unroll_explicit", "ot", 0]]}, "result": [[10.620715775], 0, 64.33194923400879, 1639035523.1823766], "version": 0.2, "tvm_version": "0.8.dev0"}
{"input": ["cuda -keys=cuda,gpu -max_num_threads=1024 -thread_warp_size=32", "conv2d_nchw.cuda", [["TENSOR", [128, 1008, 42, 42], "float32"], ["TENSOR", [168, 1008, 1, 1], "float32"], 1, "SAME", 1, "float32"], {}], "config": {"index": 132307052, "code_hash": null, "entity": [["tile_f", "sp", [-1, 2, 28, 3]], ["tile_y", "sp", [-1, 2, 7, 1]], ["tile_x", "sp", [-1, 1, 1, 21]], ["tile_rc", "sp", [-1, 16]], ["tile_ry", "sp", [-1, 1]], ["tile_rx", "sp", [-1, 1]], ["auto_unroll_max_step", "ot", 0], ["unroll_explicit", "ot", 1]]}, "result": [[0.139059875], 0, 8.907710075378418, 1639035531.990369], "version": 0.2, "tvm_version": "0.8.dev0"}
{"input": ["cuda -keys=cuda,gpu -max_num_threads=1024 -thread_warp_size=32", "conv2d_nchw.cuda", [["TENSOR", [128, 1008, 42, 42], "float32"], ["TENSOR", [168, 1008, 1, 1], "float32"], 1, "SAME", 1, "float32"], {}], "config": {"index": 145533628, "code_hash": null, "entity": [["tile_f", "sp", [-1, 7, 3, 4]], ["tile_y", "sp", [-1, 1, 2, 1]], ["tile_x", "sp", [-1, 3, 1, 1]], ["tile_rc", "sp", [-1, 84]], ["tile_ry", "sp", [-1, 1]], ["tile_rx", "sp", [-1, 1]], ["auto_unroll_max_step", "ot", 0], ["unroll_explicit", "ot", 1]]}, "result": [[3.696547175], 0, 26.85045075416565, 1639035558.8818653], "version": 0.2, "tvm_version": "0.8.dev0"}
{"input": ["cuda -keys=cuda,gpu -max_num_threads=1024 -thread_warp_size=32", "conv2d_nchw.cuda", [["TENSOR", [128, 1008, 42, 42], "float32"], ["TENSOR", [168, 1008, 1, 1], "float32"], 1, "SAME", 1, "float32"], {}], "config": {"index": 160370089, "code_hash": null, "entity": [["tile_f", "sp", [-1, 2, 14, 3]], ["tile_y", "sp", [-1, 1, 1, 3]], ["tile_x", "sp", [-1, 1, 14, 1]], ["tile_rc", "sp", [-1, 3]], ["tile_ry", "sp", [-1, 1]], ["tile_rx", "sp", [-1, 1]], ["auto_unroll_max_step", "ot", 512], ["unroll_explicit", "ot", 1]]}, "result": [[0.13728167500000002], 0, 8.783341884613037, 1639035760.2092173], "version": 0.2, "tvm_version": "0.8.dev0"}
{"input": ["cuda -keys=cuda,gpu -max_num_threads=1024 -thread_warp_size=32", "conv2d_nchw.cuda", [["TENSOR", [128, 1008, 42, 42], "float32"], ["TENSOR", [168, 1008, 1, 1], "float32"], 1, "SAME", 1, "float32"], {}], "config": {"index": 121048489, "code_hash": null, "entity": [["tile_f", "sp", [-1, 2, 14, 3]], ["tile_y", "sp", [-1, 1, 1, 3]], ["tile_x", "sp", [-1, 1, 14, 1]], ["tile_rc", "sp", [-1, 3]], ["tile_ry", "sp", [-1, 1]], ["tile_rx", "sp", [-1, 1]], ["auto_unroll_max_step", "ot", 0], ["unroll_explicit", "ot", 1]]}, "result": [[0.1137875], 0, 12.172210931777954, 1639035771.4279127], "version": 0.2, "tvm_version": "0.8.dev0"}
{"input": ["cuda -keys=cuda,gpu -max_num_threads=1024 -thread_warp_size=32", "conv2d_nchw.cuda", [["TENSOR", [128, 1008, 42, 42], "float32"], ["TENSOR", [168, 1008, 1, 1], "float32"], 1, "SAME", 1, "float32"], {}], "config": {"index": 199691689, "code_hash": null, "entity": [["tile_f", "sp", [-1, 2, 14, 3]], ["tile_y", "sp", [-1, 1, 1, 3]], ["tile_x", "sp", [-1, 1, 14, 1]], ["tile_rc", "sp", [-1, 3]], ["tile_ry", "sp", [-1, 1]], ["tile_rx", "sp", [-1, 1]], ["auto_unroll_max_step", "ot", 1500], ["unroll_explicit", "ot", 1]]}, "result": [[0.10419485], 0, 8.714796781539917, 1639035779.4409084], "version": 0.2, "tvm_version": "0.8.dev0"}
{"input": ["cuda -keys=cuda,gpu -max_num_threads=1024 -thread_warp_size=32", "conv2d_nchw.cuda", [["TENSOR", [128, 1008, 42, 42], "float32"], ["TENSOR", [168, 1008, 1, 1], "float32"], 1, "SAME", 1, "float32"], {}], "config": {"index": 206245259, "code_hash": null, "entity": [["tile_f", "sp", [-1, 1, 28, 2]], ["tile_y", "sp", [-1, 1, 1, 3]], ["tile_x", "sp", [-1, 1, 14, 1]], ["tile_rc", "sp", [-1, 9]], ["tile_ry", "sp", [-1, 1]], ["tile_rx", "sp", [-1, 1]], ["auto_unroll_max_step", "ot", 1500], ["unroll_explicit", "ot", 1]]}, "result": [[0.11297360000000001], 0, 9.119229316711426, 1639035787.518891], "version": 0.2, "tvm_version": "0.8.dev0"}
{"input": ["cuda -keys=cuda,gpu -max_num_threads=1024 -thread_warp_size=32", "conv2d_nchw.cuda", [["TENSOR", [128, 1008, 42, 42], "float32"], ["TENSOR", [168, 1008, 1, 1], "float32"], 1, "SAME", 1, "float32"], {}], "config": {"index": 126291339, "code_hash": null, "entity": [["tile_f", "sp", [-1, 1, 28, 2]], ["tile_y", "sp", [-1, 1, 1, 3]], ["tile_x", "sp", [-1, 1, 14, 1]], ["tile_rc", "sp", [-1, 8]], ["tile_ry", "sp", [-1, 1]], ["tile_rx", "sp", [-1, 1]], ["auto_unroll_max_step", "ot", 0], ["unroll_explicit", "ot", 1]]}, "result": [[0.127297725], 0, 9.747588872909546, 1639035796.212113], "version": 0.2, "tvm_version": "0.8.dev0"}
{"input": ["cuda -keys=cuda,gpu -max_num_threads=1024 -thread_warp_size=32", "conv2d_nchw.cuda", [["TENSOR", [128, 1008, 42, 42], "float32"], ["TENSOR", [168, 1008, 1, 1], "float32"], 1, "SAME", 1, "float32"], {}], "config": {"index": 204934539, "code_hash": null, "entity": [["tile_f", "sp", [-1, 1, 28, 2]], ["tile_y", "sp", [-1, 1, 1, 3]], ["tile_x", "sp", [-1, 1, 14, 1]], ["tile_rc", "sp", [-1, 8]], ["tile_ry", "sp", [-1, 1]], ["tile_rx", "sp", [-1, 1]], ["auto_unroll_max_step", "ot", 1500], ["unroll_explicit", "ot", 1]]}, "result": [[0.11677984999999999], 0, 9.53665566444397, 1639035805.0840056], "version": 0.2, "tvm_version": "0.8.dev0"}
{"input": ["cuda -keys=cuda,gpu -max_num_threads=1024 -thread_warp_size=32", "conv2d_nchw.cuda", [["TENSOR", [128, 1008, 42, 42], "float32"], ["TENSOR", [168, 1008, 1, 1], "float32"], 1, "SAME", 1, "float32"], {}], "config": {"index": 165612939, "code_hash": null, "entity": [["tile_f", "sp", [-1, 1, 28, 2]], ["tile_y", "sp", [-1, 1, 1, 3]], ["tile_x", "sp", [-1, 1, 14, 1]], ["tile_rc", "sp", [-1, 8]], ["tile_ry", "sp", [-1, 1]], ["tile_rx", "sp", [-1, 1]], ["auto_unroll_max_step", "ot", 512], ["unroll_explicit", "ot", 1]]}, "result": [[0.13008519999999998], 0, 8.62377381324768, 1639035812.784392], "version": 0.2, "tvm_version": "0.8.dev0"}
{"input": ["cuda -keys=cuda,gpu -max_num_threads=1024 -thread_warp_size=32", "conv2d_nchw.cuda", [["TENSOR", [128, 1008, 42, 42], "float32"], ["TENSOR", [168, 1008, 1, 1], "float32"], 1, "SAME", 1, "float32"], {}], "config": {"index": 127602059, "code_hash": null, "entity": [["tile_f", "sp", [-1, 1, 28, 2]], ["tile_y", "sp", [-1, 1, 1, 3]], ["tile_x", "sp", [-1, 1, 14, 1]], ["tile_rc", "sp", [-1, 9]], ["tile_ry", "sp", [-1, 1]], ["tile_rx", "sp", [-1, 1]], ["auto_unroll_max_step", "ot", 0], ["unroll_explicit", "ot", 1]]}, "result": [[0.120554175], 0, 8.89848017692566, 1639035821.630941], "version": 0.2, "tvm_version": "0.8.dev0"}
{"input": ["cuda -keys=cuda,gpu -max_num_threads=1024 -thread_warp_size=32", "conv2d_nchw.cuda", [["TENSOR", [128, 1008, 42, 42], "float32"], ["TENSOR", [168, 1008, 1, 1], "float32"], 1, "SAME", 1, "float32"], {}], "config": {"index": 166923659, "code_hash": null, "entity": [["tile_f", "sp", [-1, 1, 28, 2]], ["tile_y", "sp", [-1, 1, 1, 3]], ["tile_x", "sp", [-1, 1, 14, 1]], ["tile_rc", "sp", [-1, 9]], ["tile_ry", "sp", [-1, 1]], ["tile_rx", "sp", [-1, 1]], ["auto_unroll_max_step", "ot", 512], ["unroll_explicit", "ot", 1]]}, "result": [[0.111241725], 0, 9.244218111038208, 1639035829.809315], "version": 0.2, "tvm_version": "0.8.dev0"}
{"input": ["cuda -keys=cuda,gpu -max_num_threads=1024 -thread_warp_size=32", "conv2d_nchw.cuda", [["TENSOR", [128, 1008, 42, 42], "float32"], ["TENSOR", [168, 1008, 1, 1], "float32"], 1, "SAME", 1, "float32"], {}], "config": {"index": 199691654, "code_hash": null, "entity": [["tile_f", "sp", [-1, 3, 14, 2]], ["tile_y", "sp", [-1, 1, 1, 3]], ["tile_x", "sp", [-1, 1, 14, 1]], ["tile_rc", "sp", [-1, 3]], ["tile_ry", "sp", [-1, 1]], ["tile_rx", "sp", [-1, 1]], ["auto_unroll_max_step", "ot", 1500], ["unroll_explicit", "ot", 1]]}, "result": [[0.0904459], 0, 9.377586126327515, 1639035838.1836972], "version": 0.2, "tvm_version": "0.8.dev0"}
{"input": ["cuda -keys=cuda,gpu -max_num_threads=1024 -thread_warp_size=32", "conv2d_nchw.cuda", [["TENSOR", [128, 1008, 42, 42], "float32"], ["TENSOR", [168, 1008, 1, 1], "float32"], 1, "SAME", 1, "float32"], {}], "config": {"index": 160370054, "code_hash": null, "entity": [["tile_f", "sp", [-1, 3, 14, 2]], ["tile_y", "sp", [-1, 1, 1, 3]], ["tile_x", "sp", [-1, 1, 14, 1]], ["tile_rc", "sp", [-1, 3]], ["tile_ry", "sp", [-1, 1]], ["tile_rx", "sp", [-1, 1]], ["auto_unroll_max_step", "ot", 512], ["unroll_explicit", "ot", 1]]}, "result": [[0.09236499999999999], 0, 9.312422037124634, 1639035846.731451], "version": 0.2, "tvm_version": "0.8.dev0"}
{"input": ["cuda -keys=cuda,gpu -max_num_threads=1024 -thread_warp_size=32", "conv2d_nchw.cuda", [["TENSOR", [128, 1008, 42, 42], "float32"], ["TENSOR", [168, 1008, 1, 1], "float32"], 1, "SAME", 1, "float32"], {}], "config": {"index": 121048454, "code_hash": null, "entity": [["tile_f", "sp", [-1, 3, 14, 2]], ["tile_y", "sp", [-1, 1, 1, 3]], ["tile_x", "sp", [-1, 1, 14, 1]], ["tile_rc", "sp", [-1, 3]], ["tile_ry", "sp", [-1, 1]], ["tile_rx", "sp", [-1, 1]], ["auto_unroll_max_step", "ot", 0], ["unroll_explicit", "ot", 1]]}, "result": [[0.094109425], 0, 8.600526094436646, 1639035854.3304036], "version": 0.2, "tvm_version": "0.8.dev0"}
{"input": ["cuda -keys=cuda,gpu -max_num_threads=1024 -thread_warp_size=32", "conv2d_nchw.cuda", [["TENSOR", [128, 1008, 42, 42], "float32"], ["TENSOR", [168, 1008, 1, 1], "float32"], 1, "SAME", 1, "float32"], {}], "config": {"index": 3083654, "code_hash": null, "entity": [["tile_f", "sp", [-1, 3, 14, 2]], ["tile_y", "sp", [-1, 1, 1, 3]], ["tile_x", "sp", [-1, 1, 14, 1]], ["tile_rc", "sp", [-1, 3]], ["tile_ry", "sp", [-1, 1]], ["tile_rx", "sp", [-1, 1]], ["auto_unroll_max_step", "ot", 0], ["unroll_explicit", "ot", 0]]}, "result": [[0.0999661], 0, 9.17374062538147, 1639035863.0781653], "version": 0.2, "tvm_version": "0.8.dev0"}
{"input": ["cuda -keys=cuda,gpu -max_num_threads=1024 -thread_warp_size=32", "conv2d_nchw.cuda", [["TENSOR", [128, 1008, 42, 42], "float32"], ["TENSOR", [168, 1008, 1, 1], "float32"], 1, "SAME", 1, "float32"], {}], "config": {"index": 81726854, "code_hash": null, "entity": [["tile_f", "sp", [-1, 3, 14, 2]], ["tile_y", "sp", [-1, 1, 1, 3]], ["tile_x", "sp", [-1, 1, 14, 1]], ["tile_rc", "sp", [-1, 3]], ["tile_ry", "sp", [-1, 1]], ["tile_rx", "sp", [-1, 1]], ["auto_unroll_max_step", "ot", 1500], ["unroll_explicit", "ot", 0]]}, "result": [[0.0893933], 0, 10.05787968635559, 1639035872.8361547], "version": 0.2, "tvm_version": "0.8.dev0"}
{"input": ["cuda -keys=cuda,gpu -max_num_threads=1024 -thread_warp_size=32", "conv2d_nchw.cuda", [["TENSOR", [128, 1008, 42, 42], "float32"], ["TENSOR", [168, 1008, 1, 1], "float32"], 1, "SAME", 1, "float32"], {}], "config": {"index": 42405254, "code_hash": null, "entity": [["tile_f", "sp", [-1, 3, 14, 2]], ["tile_y", "sp", [-1, 1, 1, 3]], ["tile_x", "sp", [-1, 1, 14, 1]], ["tile_rc", "sp", [-1, 3]], ["tile_ry", "sp", [-1, 1]], ["tile_rx", "sp", [-1, 1]], ["auto_unroll_max_step", "ot", 512], ["unroll_explicit", "ot", 0]]}, "result": [[0.089283575], 0, 8.392580032348633, 1639035880.69997], "version": 0.2, "tvm_version": "0.8.dev0"}
{"input": ["cuda -keys=cuda,gpu -max_num_threads=1024 -thread_warp_size=32", "conv2d_nchw.cuda", [["TENSOR", [128, 1008, 42, 42], "float32"], ["TENSOR", [168, 1008, 1, 1], "float32"], 1, "SAME", 1, "float32"], {}], "config": {"index": 9637259, "code_hash": null, "entity": [["tile_f", "sp", [-1, 1, 28, 2]], ["tile_y", "sp", [-1, 1, 1, 3]], ["tile_x", "sp", [-1, 1, 14, 1]], ["tile_rc", "sp", [-1, 9]], ["tile_ry", "sp", [-1, 1]], ["tile_rx", "sp", [-1, 1]], ["auto_unroll_max_step", "ot", 0], ["unroll_explicit", "ot", 0]]}, "result": [[0.124355525], 0, 8.42638087272644, 1639035888.3733165], "version": 0.2, "tvm_version": "0.8.dev0"}
{"input": ["cuda -keys=cuda,gpu -max_num_threads=1024 -thread_warp_size=32", "conv2d_nchw.cuda", [["TENSOR", [128, 1008, 42, 42], "float32"], ["TENSOR", [168, 1008, 1, 1], "float32"], 1, "SAME", 1, "float32"], {}], "config": {"index": 48958859, "code_hash": null, "entity": [["tile_f", "sp", [-1, 1, 28, 2]], ["tile_y", "sp", [-1, 1, 1, 3]], ["tile_x", "sp", [-1, 1, 14, 1]], ["tile_rc", "sp", [-1, 9]], ["tile_ry", "sp", [-1, 1]], ["tile_rx", "sp", [-1, 1]], ["auto_unroll_max_step", "ot", 512], ["unroll_explicit", "ot", 0]]}, "result": [[0.11956055], 0, 8.593070268630981, 1639035896.3577175], "version": 0.2, "tvm_version": "0.8.dev0"}
{"input": ["cuda -keys=cuda,gpu -max_num_threads=1024 -thread_warp_size=32", "conv2d_nchw.cuda", [["TENSOR", [128, 1008, 42, 42], "float32"], ["TENSOR", [168, 1008, 1, 1], "float32"], 1, "SAME", 1, "float32"], {}], "config": {"index": 88280459, "code_hash": null, "entity": [["tile_f", "sp", [-1, 1, 28, 2]], ["tile_y", "sp", [-1, 1, 1, 3]], ["tile_x", "sp", [-1, 1, 14, 1]], ["tile_rc", "sp", [-1, 9]], ["tile_ry", "sp", [-1, 1]], ["tile_rx", "sp", [-1, 1]], ["auto_unroll_max_step", "ot", 1500], ["unroll_explicit", "ot", 0]]}, "result": [[0.119716525], 0, 9.097235679626465, 1639035905.0920043], "version": 0.2, "tvm_version": "0.8.dev0"}
{"input": ["cuda -keys=cuda,gpu -max_num_threads=1024 -thread_warp_size=32", "conv2d_nchw.cuda", [["TENSOR", [128, 1008, 42, 42], "float32"], ["TENSOR", [168, 1008, 1, 1], "float32"], 1, "SAME", 1, "float32"], {}], "config": {"index": 47648139, "code_hash": null, "entity": [["tile_f", "sp", [-1, 1, 28, 2]], ["tile_y", "sp", [-1, 1, 1, 3]], ["tile_x", "sp", [-1, 1, 14, 1]], ["tile_rc", "sp", [-1, 8]], ["tile_ry", "sp", [-1, 1]], ["tile_rx", "sp", [-1, 1]], ["auto_unroll_max_step", "ot", 512], ["unroll_explicit", "ot", 0]]}, "result": [[0.131175025], 0, 9.100309610366821, 1639035913.6183062], "version": 0.2, "tvm_version": "0.8.dev0"}
{"input": ["cuda -keys=cuda,gpu -max_num_threads=1024 -thread_warp_size=32", "conv2d_nchw.cuda", [["TENSOR", [128, 1008, 42, 42], "float32"], ["TENSOR", [168, 1008, 1, 1], "float32"], 1, "SAME", 1, "float32"], {}], "config": {"index": 8326539, "code_hash": null, "entity": [["tile_f", "sp", [-1, 1, 28, 2]], ["tile_y", "sp", [-1, 1, 1, 3]], ["tile_x", "sp", [-1, 1, 14, 1]], ["tile_rc", "sp", [-1, 8]], ["tile_ry", "sp", [-1, 1]], ["tile_rx", "sp", [-1, 1]], ["auto_unroll_max_step", "ot", 0], ["unroll_explicit", "ot", 0]]}, "result": [[0.123726025], 0, 8.65843677520752, 1639035921.632445], "version": 0.2, "tvm_version": "0.8.dev0"}
{"input": ["cuda -keys=cuda,gpu -max_num_threads=1024 -thread_warp_size=32", "conv2d_nchw.cuda", [["TENSOR", [128, 1008, 42, 42], "float32"], ["TENSOR", [168, 1008, 1, 1], "float32"], 1, "SAME", 1, "float32"], {}], "config": {"index": 123608491, "code_hash": null, "entity": [["tile_f", "sp", [-1, 1, 28, 3]], ["tile_y", "sp", [-1, 1, 1, 3]], ["tile_x", "sp", [-1, 2, 7, 1]], ["tile_rc", "sp", [-1, 6]], ["tile_ry", "sp", [-1, 1]], ["tile_rx", "sp", [-1, 1]], ["auto_unroll_max_step", "ot", 0], ["unroll_explicit", "ot", 1]]}, "result": [[0.0996281], 0, 8.403144836425781, 1639035929.3887253], "version": 0.2, "tvm_version": "0.8.dev0"}
{"input": ["cuda -keys=cuda,gpu -max_num_threads=1024 -thread_warp_size=32", "conv2d_nchw.cuda", [["TENSOR", [128, 1008, 42, 42], "float32"], ["TENSOR", [168, 1008, 1, 1], "float32"], 1, "SAME", 1, "float32"], {}], "config": {"index": 202251691, "code_hash": null, "entity": [["tile_f", "sp", [-1, 1, 28, 3]], ["tile_y", "sp", [-1, 1, 1, 3]], ["tile_x", "sp", [-1, 2, 7, 1]], ["tile_rc", "sp", [-1, 6]], ["tile_ry", "sp", [-1, 1]], ["tile_rx", "sp", [-1, 1]], ["auto_unroll_max_step", "ot", 1500], ["unroll_explicit", "ot", 1]]}, "result": [[0.09508355], 0, 8.875324010848999, 1639035937.3745103], "version": 0.2, "tvm_version": "0.8.dev0"}
{"input": ["cuda -keys=cuda,gpu -max_num_threads=1024 -thread_warp_size=32", "conv2d_nchw.cuda", [["TENSOR", [128, 1008, 42, 42], "float32"], ["TENSOR", [168, 1008, 1, 1], "float32"], 1, "SAME", 1, "float32"], {}], "config": {"index": 162930091, "code_hash": null, "entity": [["tile_f", "sp", [-1, 1, 28, 3]], ["tile_y", "sp", [-1, 1, 1, 3]], ["tile_x", "sp", [-1, 2, 7, 1]], ["tile_rc", "sp", [-1, 6]], ["tile_ry", "sp", [-1, 1]], ["tile_rx", "sp", [-1, 1]], ["auto_unroll_max_step", "ot", 512], ["unroll_explicit", "ot", 1]]}, "result": [[0.0954609], 0, 9.347353219985962, 1639035945.8619795], "version": 0.2, "tvm_version": "0.8.dev0"}
{"input": ["cuda -keys=cuda,gpu -max_num_threads=1024 -thread_warp_size=32", "conv2d_nchw.cuda", [["TENSOR", [128, 1008, 42, 42], "float32"], ["TENSOR", [168, 1008, 1, 1], "float32"], 1, "SAME", 1, "float32"], {}], "config": {"index": 84286891, "code_hash": null, "entity": [["tile_f", "sp", [-1, 1, 28, 3]], ["tile_y", "sp", [-1, 1, 1, 3]], ["tile_x", "sp", [-1, 2, 7, 1]], ["tile_rc", "sp", [-1, 6]], ["tile_ry", "sp", [-1, 1]], ["tile_rx", "sp", [-1, 1]], ["auto_unroll_max_step", "ot", 1500], ["unroll_explicit", "ot", 0]]}, "result": [[0.091805375], 0, 8.98332142829895, 1639035953.9849918], "version": 0.2, "tvm_version": "0.8.dev0"}
{"input": ["cuda -keys=cuda,gpu -max_num_threads=1024 -thread_warp_size=32", "conv2d_nchw.cuda", [["TENSOR", [128, 1008, 42, 42], "float32"], ["TENSOR", [168, 1008, 1, 1], "float32"], 1, "SAME", 1, "float32"], {}], "config": {"index": 5643691, "code_hash": null, "entity": [["tile_f", "sp", [-1, 1, 28, 3]], ["tile_y", "sp", [-1, 1, 1, 3]], ["tile_x", "sp", [-1, 2, 7, 1]], ["tile_rc", "sp", [-1, 6]], ["tile_ry", "sp", [-1, 1]], ["tile_rx", "sp", [-1, 1]], ["auto_unroll_max_step", "ot", 0], ["unroll_explicit", "ot", 0]]}, "result": [[0.11256152500000001], 0, 7.926305294036865, 1639035962.9369774], "version": 0.2, "tvm_version": "0.8.dev0"}
{"input": ["cuda -keys=cuda,gpu -max_num_threads=1024 -thread_warp_size=32", "conv2d_nchw.cuda", [["TENSOR", [128, 1008, 42, 42], "float32"], ["TENSOR", [168, 1008, 1, 1], "float32"], 1, "SAME", 1, "float32"], {}], "config": {"index": 44965291, "code_hash": null, "entity": [["tile_f", "sp", [-1, 1, 28, 3]], ["tile_y", "sp", [-1, 1, 1, 3]], ["tile_x", "sp", [-1, 2, 7, 1]], ["tile_rc", "sp", [-1, 6]], ["tile_ry", "sp", [-1, 1]], ["tile_rx", "sp", [-1, 1]], ["auto_unroll_max_step", "ot", 512], ["unroll_explicit", "ot", 0]]}, "result": [[0.09765197499999999], 0, 8.485706567764282, 1639035970.9841912], "version": 0.2, "tvm_version": "0.8.dev0"}
{"input": ["cuda -keys=cuda,gpu -max_num_threads=1024 -thread_warp_size=32", "conv2d_nchw.cuda", [["TENSOR", [128, 1008, 42, 42], "float32"], ["TENSOR", [168, 1008, 1, 1], "float32"], 1, "SAME", 1, "float32"], {}], "config": {"index": 163021366, "code_hash": null, "entity": [["tile_f", "sp", [-1, 1, 12, 7]], ["tile_y", "sp", [-1, 2, 1, 1]], ["tile_x", "sp", [-1, 1, 21, 1]], ["tile_rc", "sp", [-1, 6]], ["tile_ry", "sp", [-1, 1]], ["tile_rx", "sp", [-1, 1]], ["auto_unroll_max_step", "ot", 512], ["unroll_explicit", "ot", 1]]}, "result": [[0.067876], 0, 8.72033405303955, 1639035979.4758577], "version": 0.2, "tvm_version": "0.8.dev0"}
{"input": ["cuda -keys=cuda,gpu -max_num_threads=1024 -thread_warp_size=32", "conv2d_nchw.cuda", [["TENSOR", [128, 1008, 42, 42], "float32"], ["TENSOR", [168, 1008, 1, 1], "float32"], 1, "SAME", 1, "float32"], {}], "config": {"index": 202342966, "code_hash": null, "entity": [["tile_f", "sp", [-1, 1, 12, 7]], ["tile_y", "sp", [-1, 2, 1, 1]], ["tile_x", "sp", [-1, 1, 21, 1]], ["tile_rc", "sp", [-1, 6]], ["tile_ry", "sp", [-1, 1]], ["tile_rx", "sp", [-1, 1]], ["auto_unroll_max_step", "ot", 1500], ["unroll_explicit", "ot", 1]]}, "result": [[0.0740329], 0, 7.716192245483398, 1639035986.7017047], "version": 0.2, "tvm_version": "0.8.dev0"}
{"input": ["cuda -keys=cuda,gpu -max_num_threads=1024 -thread_warp_size=32", "conv2d_nchw.cuda", [["TENSOR", [128, 1008, 42, 42], "float32"], ["TENSOR", [168, 1008, 1, 1], "float32"], 1, "SAME", 1, "float32"], {}], "config": {"index": 123699766, "code_hash": null, "entity": [["tile_f", "sp", [-1, 1, 12, 7]], ["tile_y", "sp", [-1, 2, 1, 1]], ["tile_x", "sp", [-1, 1, 21, 1]], ["tile_rc", "sp", [-1, 6]], ["tile_ry", "sp", [-1, 1]], ["tile_rx", "sp", [-1, 1]], ["auto_unroll_max_step", "ot", 0], ["unroll_explicit", "ot", 1]]}, "result": [[0.075405175], 0, 8.337494611740112, 1639035994.9114022], "version": 0.2, "tvm_version": "0.8.dev0"}
{"input": ["cuda -keys=cuda,gpu -max_num_threads=1024 -thread_warp_size=32", "conv2d_nchw.cuda", [["TENSOR", [128, 1008, 42, 42], "float32"], ["TENSOR", [168, 1008, 1, 1], "float32"], 1, "SAME", 1, "float32"], {}], "config": {"index": 128912774, "code_hash": null, "entity": [["tile_f", "sp", [-1, 3, 14, 2]], ["tile_y", "sp", [-1, 1, 1, 3]], ["tile_x", "sp", [-1, 1, 14, 1]], ["tile_rc", "sp", [-1, 12]], ["tile_ry", "sp", [-1, 1]], ["tile_rx", "sp", [-1, 1]], ["auto_unroll_max_step", "ot", 0], ["unroll_explicit", "ot", 1]]}, "result": [[0.09675235], 0, 8.920029640197754, 1639036003.7230809], "version": 0.2, "tvm_version": "0.8.dev0"}
{"input": ["cuda -keys=cuda,gpu -max_num_threads=1024 -thread_warp_size=32", "conv2d_nchw.cuda", [["TENSOR", [128, 1008, 42, 42], "float32"], ["TENSOR", [168, 1008, 1, 1], "float32"], 1, "SAME", 1, "float32"], {}], "config": {"index": 168234374, "code_hash": null, "entity": [["tile_f", "sp", [-1, 3, 14, 2]], ["tile_y", "sp", [-1, 1, 1, 3]], ["tile_x", "sp", [-1, 1, 14, 1]], ["tile_rc", "sp", [-1, 12]], ["tile_ry", "sp", [-1, 1]], ["tile_rx", "sp", [-1, 1]], ["auto_unroll_max_step", "ot", 512], ["unroll_explicit", "ot", 1]]}, "result": [[0.11833202500000001], 0, 8.871944427490234, 1639036012.0177543], "version": 0.2, "tvm_version": "0.8.dev0"}
{"input": ["cuda -keys=cuda,gpu -max_num_threads=1024 -thread_warp_size=32", "conv2d_nchw.cuda", [["TENSOR", [128, 1008, 42, 42], "float32"], ["TENSOR", [168, 1008, 1, 1], "float32"], 1, "SAME", 1, "float32"], {}], "config": {"index": 207555974, "code_hash": null, "entity": [["tile_f", "sp", [-1, 3, 14, 2]], ["tile_y", "sp", [-1, 1, 1, 3]], ["tile_x", "sp", [-1, 1, 14, 1]], ["tile_rc", "sp", [-1, 12]], ["tile_ry", "sp", [-1, 1]], ["tile_rx", "sp", [-1, 1]], ["auto_unroll_max_step", "ot", 1500], ["unroll_explicit", "ot", 1]]}, "result": [[0.104560575], 0, 8.644468307495117, 1639036020.6620398], "version": 0.2, "tvm_version": "0.8.dev0"}
{"input": ["cuda -keys=cuda,gpu -max_num_threads=1024 -thread_warp_size=32", "conv2d_nchw.cuda", [["TENSOR", [128, 1008, 42, 42], "float32"], ["TENSOR", [168, 1008, 1, 1], "float32"], 1, "SAME", 1, "float32"], {}], "config": {"index": 130223531, "code_hash": null, "entity": [["tile_f", "sp", [-1, 1, 28, 3]], ["tile_y", "sp", [-1, 1, 1, 3]], ["tile_x", "sp", [-1, 1, 14, 1]], ["tile_rc", "sp", [-1, 14]], ["tile_ry", "sp", [-1, 1]], ["tile_rx", "sp", [-1, 1]], ["auto_unroll_max_step", "ot", 0], ["unroll_explicit", "ot", 1]]}, "result": [[0.101756025], 0, 8.518231868743896, 1639036029.185137], "version": 0.2, "tvm_version": "0.8.dev0"}
{"input": ["cuda -keys=cuda,gpu -max_num_threads=1024 -thread_warp_size=32", "conv2d_nchw.cuda", [["TENSOR", [128, 1008, 42, 42], "float32"], ["TENSOR", [168, 1008, 1, 1], "float32"], 1, "SAME", 1, "float32"], {}], "config": {"index": 208866731, "code_hash": null, "entity": [["tile_f", "sp", [-1, 1, 28, 3]], ["tile_y", "sp", [-1, 1, 1, 3]], ["tile_x", "sp", [-1, 1, 14, 1]], ["tile_rc", "sp", [-1, 14]], ["tile_ry", "sp", [-1, 1]], ["tile_rx", "sp", [-1, 1]], ["auto_unroll_max_step", "ot", 1500], ["unroll_explicit", "ot", 1]]}, "result": [[0.10196282499999999], 0, 8.81106448173523, 1639036037.5572004], "version": 0.2, "tvm_version": "0.8.dev0"}
{"input": ["cuda -keys=cuda,gpu -max_num_threads=1024 -thread_warp_size=32", "conv2d_nchw.cuda", [["TENSOR", [128, 1008, 42, 42], "float32"], ["TENSOR", [168, 1008, 1, 1], "float32"], 1, "SAME", 1, "float32"], {}], "config": {"index": 169545131, "code_hash": null, "entity": [["tile_f", "sp", [-1, 1, 28, 3]], ["tile_y", "sp", [-1, 1, 1, 3]], ["tile_x", "sp", [-1, 1, 14, 1]], ["tile_rc", "sp", [-1, 14]], ["tile_ry", "sp", [-1, 1]], ["tile_rx", "sp", [-1, 1]], ["auto_unroll_max_step", "ot", 512], ["unroll_explicit", "ot", 1]]}, "result": [[0.10180845], 0, 8.032578468322754, 1639036045.6554651], "version": 0.2, "tvm_version": "0.8.dev0"}
{"input": ["cuda -keys=cuda,gpu -max_num_threads=1024 -thread_warp_size=32", "conv2d_nchw.cuda", [["TENSOR", [128, 1008, 42, 42], "float32"], ["TENSOR", [168, 1008, 1, 1], "float32"], 1, "SAME", 1, "float32"], {}], "config": {"index": 164302251, "code_hash": null, "entity": [["tile_f", "sp", [-1, 1, 28, 3]], ["tile_y", "sp", [-1, 1, 1, 3]], ["tile_x", "sp", [-1, 1, 14, 1]], ["tile_rc", "sp", [-1, 7]], ["tile_ry", "sp", [-1, 1]], ["tile_rx", "sp", [-1, 1]], ["auto_unroll_max_step", "ot", 512], ["unroll_explicit", "ot", 1]]}, "result": [[0.10981847500000001], 0, 8.865332126617432, 1639036054.012177], "version": 0.2, "tvm_version": "0.8.dev0"}
{"input": ["cuda -keys=cuda,gpu -max_num_threads=1024 -thread_warp_size=32", "conv2d_nchw.cuda", [["TENSOR", [128, 1008, 42, 42], "float32"], ["TENSOR", [168, 1008, 1, 1], "float32"], 1, "SAME", 1, "float32"], {}], "config": {"index": 203623851, "code_hash": null, "entity": [["tile_f", "sp", [-1, 1, 28, 3]], ["tile_y", "sp", [-1, 1, 1, 3]], ["tile_x", "sp", [-1, 1, 14, 1]], ["tile_rc", "sp", [-1, 7]], ["tile_ry", "sp", [-1, 1]], ["tile_rx", "sp", [-1, 1]], ["auto_unroll_max_step", "ot", 1500], ["unroll_explicit", "ot", 1]]}, "result": [[0.1340704], 0, 10.06567120552063, 1639036063.7088904], "version": 0.2, "tvm_version": "0.8.dev0"}
{"input": ["cuda -keys=cuda,gpu -max_num_threads=1024 -thread_warp_size=32", "conv2d_nchw.cuda", [["TENSOR", [128, 1008, 42, 42], "float32"], ["TENSOR", [168, 1008, 1, 1], "float32"], 1, "SAME", 1, "float32"], {}], "config": {"index": 124980651, "code_hash": null, "entity": [["tile_f", "sp", [-1, 1, 28, 3]], ["tile_y", "sp", [-1, 1, 1, 3]], ["tile_x", "sp", [-1, 1, 14, 1]], ["tile_rc", "sp", [-1, 7]], ["tile_ry", "sp", [-1, 1]], ["tile_rx", "sp", [-1, 1]], ["auto_unroll_max_step", "ot", 0], ["unroll_explicit", "ot", 1]]}, "result": [[0.121611575], 0, 8.571288108825684, 1639036072.4051886], "version": 0.2, "tvm_version": "0.8.dev0"}
{"input": ["cuda -keys=cuda,gpu -max_num_threads=1024 -thread_warp_size=32", "conv2d_nchw.cuda", [["TENSOR", [128, 1008, 42, 42], "float32"], ["TENSOR", [168, 1008, 1, 1], "float32"], 1, "SAME", 1, "float32"], {}], "config": {"index": 121273771, "code_hash": null, "entity": [["tile_f", "sp", [-1, 1, 28, 3]], ["tile_y", "sp", [-1, 1, 1, 3]], ["tile_x", "sp", [-1, 1, 7, 2]], ["tile_rc", "sp", [-1, 3]], ["tile_ry", "sp", [-1, 1]], ["tile_rx", "sp", [-1, 1]], ["auto_unroll_max_step", "ot", 0], ["unroll_explicit", "ot", 1]]}, "result": [[0.0903656], 0, 10.43576169013977, 1639036082.5178206], "version": 0.2, "tvm_version": "0.8.dev0"}
{"input": ["cuda -keys=cuda,gpu -max_num_threads=1024 -thread_warp_size=32", "conv2d_nchw.cuda", [["TENSOR", [128, 1008, 42, 42], "float32"], ["TENSOR", [168, 1008, 1, 1], "float32"], 1, "SAME", 1, "float32"], {}], "config": {"index": 160595371, "code_hash": null, "entity": [["tile_f", "sp", [-1, 1, 28, 3]], ["tile_y", "sp", [-1, 1, 1, 3]], ["tile_x", "sp", [-1, 1, 7, 2]], ["tile_rc", "sp", [-1, 3]], ["tile_ry", "sp", [-1, 1]], ["tile_rx", "sp", [-1, 1]], ["auto_unroll_max_step", "ot", 512], ["unroll_explicit", "ot", 1]]}, "result": [[0.09129825], 0, 9.195564270019531, 1639036091.4814181], "version": 0.2, "tvm_version": "0.8.dev0"}
{"input": ["cuda -keys=cuda,gpu -max_num_threads=1024 -thread_warp_size=32", "conv2d_nchw.cuda", [["TENSOR", [128, 1008, 42, 42], "float32"], ["TENSOR", [168, 1008, 1, 1], "float32"], 1, "SAME", 1, "float32"], {}], "config": {"index": 199916971, "code_hash": null, "entity": [["tile_f", "sp", [-1, 1, 28, 3]], ["tile_y", "sp", [-1, 1, 1, 3]], ["tile_x", "sp", [-1, 1, 7, 2]], ["tile_rc", "sp", [-1, 3]], ["tile_ry", "sp", [-1, 1]], ["tile_rx", "sp", [-1, 1]], ["auto_unroll_max_step", "ot", 1500], ["unroll_explicit", "ot", 1]]}, "result": [[0.091386], 0, 9.148642778396606, 1639036101.0224116], "version": 0.2, "tvm_version": "0.8.dev0"}
{"input": ["cuda -keys=cuda,gpu -max_num_threads=1024 -thread_warp_size=32", "conv2d_nchw.cuda", [["TENSOR", [128, 1008, 42, 42], "float32"], ["TENSOR", [168, 1008, 1, 1], "float32"], 1, "SAME", 1, "float32"], {}], "config": {"index": 7015851, "code_hash": null, "entity": [["tile_f", "sp", [-1, 1, 28, 3]], ["tile_y", "sp", [-1, 1, 1, 3]], ["tile_x", "sp", [-1, 1, 14, 1]], ["tile_rc", "sp", [-1, 7]], ["tile_ry", "sp", [-1, 1]], ["tile_rx", "sp", [-1, 1]], ["auto_unroll_max_step", "ot", 0], ["unroll_explicit", "ot", 0]]}, "result": [[0.152589025], 0, 10.500731468200684, 1639036111.6211982], "version": 0.2, "tvm_version": "0.8.dev0"}
{"input": ["cuda -keys=cuda,gpu -max_num_threads=1024 -thread_warp_size=32", "conv2d_nchw.cuda", [["TENSOR", [128, 1008, 42, 42], "float32"], ["TENSOR", [168, 1008, 1, 1], "float32"], 1, "SAME", 1, "float32"], {}], "config": {"index": 85659051, "code_hash": null, "entity": [["tile_f", "sp", [-1, 1, 28, 3]], ["tile_y", "sp", [-1, 1, 1, 3]], ["tile_x", "sp", [-1, 1, 14, 1]], ["tile_rc", "sp", [-1, 7]], ["tile_ry", "sp", [-1, 1]], ["tile_rx", "sp", [-1, 1]], ["auto_unroll_max_step", "ot", 1500], ["unroll_explicit", "ot", 0]]}, "result": [[0.1407839], 0, 9.448367595672607, 1639036120.9816248], "version": 0.2, "tvm_version": "0.8.dev0"}
{"input": ["cuda -keys=cuda,gpu -max_num_threads=1024 -thread_warp_size=32", "conv2d_nchw.cuda", [["TENSOR", [128, 1008, 42, 42], "float32"], ["TENSOR", [168, 1008, 1, 1], "float32"], 1, "SAME", 1, "float32"], {}], "config": {"index": 46337451, "code_hash": null, "entity": [["tile_f", "sp", [-1, 1, 28, 3]], ["tile_y", "sp", [-1, 1, 1, 3]], ["tile_x", "sp", [-1, 1, 14, 1]], ["tile_rc", "sp", [-1, 7]], ["tile_ry", "sp", [-1, 1]], ["tile_rx", "sp", [-1, 1]], ["auto_unroll_max_step", "ot", 512], ["unroll_explicit", "ot", 0]]}, "result": [[0.131465125], 0, 10.167459487915039, 1639036131.5344603], "version": 0.2, "tvm_version": "0.8.dev0"}
{"input": ["cuda -keys=cuda,gpu -max_num_threads=1024 -thread_warp_size=32", "conv2d_nchw.cuda", [["TENSOR", [128, 1008, 42, 42], "float32"], ["TENSOR", [168, 1008, 1, 1], "float32"], 1, "SAME", 1, "float32"], {}], "config": {"index": 81952171, "code_hash": null, "entity": [["tile_f", "sp", [-1, 1, 28, 3]], ["tile_y", "sp", [-1, 1, 1, 3]], ["tile_x", "sp", [-1, 1, 7, 2]], ["tile_rc", "sp", [-1, 3]], ["tile_ry", "sp", [-1, 1]], ["tile_rx", "sp", [-1, 1]], ["auto_unroll_max_step", "ot", 1500], ["unroll_explicit", "ot", 0]]}, "result": [[0.08529325], 0, 9.248831987380981, 1639036140.5376644], "version": 0.2, "tvm_version": "0.8.dev0"}
{"input": ["cuda -keys=cuda,gpu -max_num_threads=1024 -thread_warp_size=32", "conv2d_nchw.cuda", [["TENSOR", [128, 1008, 42, 42], "float32"], ["TENSOR", [168, 1008, 1, 1], "float32"], 1, "SAME", 1, "float32"], {}], "config": {"index": 3308971, "code_hash": null, "entity": [["tile_f", "sp", [-1, 1, 28, 3]], ["tile_y", "sp", [-1, 1, 1, 3]], ["tile_x", "sp", [-1, 1, 7, 2]], ["tile_rc", "sp", [-1, 3]], ["tile_ry", "sp", [-1, 1]], ["tile_rx", "sp", [-1, 1]], ["auto_unroll_max_step", "ot", 0], ["unroll_explicit", "ot", 0]]}, "result": [[0.09159865], 0, 10.306441068649292, 1639036150.4091623], "version": 0.2, "tvm_version": "0.8.dev0"}
{"input": ["cuda -keys=cuda,gpu -max_num_threads=1024 -thread_warp_size=32", "conv2d_nchw.cuda", [["TENSOR", [128, 1008, 42, 42], "float32"], ["TENSOR", [168, 1008, 1, 1], "float32"], 1, "SAME", 1, "float32"], {}], "config": {"index": 161680809, "code_hash": null, "entity": [["tile_f", "sp", [-1, 2, 14, 3]], ["tile_y", "sp", [-1, 1, 1, 3]], ["tile_x", "sp", [-1, 1, 14, 1]], ["tile_rc", "sp", [-1, 4]], ["tile_ry", "sp", [-1, 1]], ["tile_rx", "sp", [-1, 1]], ["auto_unroll_max_step", "ot", 512], ["unroll_explicit", "ot", 1]]}, "result": [[0.1062094], 0, 10.639380931854248, 1639036160.5312524], "version": 0.2, "tvm_version": "0.8.dev0"}
{"input": ["cuda -keys=cuda,gpu -max_num_threads=1024 -thread_warp_size=32", "conv2d_nchw.cuda", [["TENSOR", [128, 1008, 42, 42], "float32"], ["TENSOR", [168, 1008, 1, 1], "float32"], 1, "SAME", 1, "float32"], {}], "config": {"index": 201002409, "code_hash": null, "entity": [["tile_f", "sp", [-1, 2, 14, 3]], ["tile_y", "sp", [-1, 1, 1, 3]], ["tile_x", "sp", [-1, 1, 14, 1]], ["tile_rc", "sp", [-1, 4]], ["tile_ry", "sp", [-1, 1]], ["tile_rx", "sp", [-1, 1]], ["auto_unroll_max_step", "ot", 1500], ["unroll_explicit", "ot", 1]]}, "result": [[0.086453575], 0, 8.78355884552002, 1639036169.682889], "version": 0.2, "tvm_version": "0.8.dev0"}
{"input": ["cuda -keys=cuda,gpu -max_num_threads=1024 -thread_warp_size=32", "conv2d_nchw.cuda", [["TENSOR", [128, 1008, 42, 42], "float32"], ["TENSOR", [168, 1008, 1, 1], "float32"], 1, "SAME", 1, "float32"], {}], "config": {"index": 122359209, "code_hash": null, "entity": [["tile_f", "sp", [-1, 2, 14, 3]], ["tile_y", "sp", [-1, 1, 1, 3]], ["tile_x", "sp", [-1, 1, 14, 1]], ["tile_rc", "sp", [-1, 4]], ["tile_ry", "sp", [-1, 1]], ["tile_rx", "sp", [-1, 1]], ["auto_unroll_max_step", "ot", 0], ["unroll_explicit", "ot", 1]]}, "result": [[0.087443625], 0, 7.744239807128906, 1639036180.9480307], "version": 0.2, "tvm_version": "0.8.dev0"}
{"input": ["cuda -keys=cuda,gpu -max_num_threads=1024 -thread_warp_size=32", "conv2d_nchw.cuda", [["TENSOR", [128, 1008, 42, 42], "float32"], ["TENSOR", [168, 1008, 1, 1], "float32"], 1, "SAME", 1, "float32"], {}], "config": {"index": 166923656, "code_hash": null, "entity": [["tile_f", "sp", [-1, 1, 21, 2]], ["tile_y", "sp", [-1, 1, 1, 3]], ["tile_x", "sp", [-1, 1, 14, 1]], ["tile_rc", "sp", [-1, 9]], ["tile_ry", "sp", [-1, 1]], ["tile_rx", "sp", [-1, 1]], ["auto_unroll_max_step", "ot", 512], ["unroll_explicit", "ot", 1]]}, "result": [[0.1241155], 0, 9.067777395248413, 1639036189.755903], "version": 0.2, "tvm_version": "0.8.dev0"}
{"input": ["cuda -keys=cuda,gpu -max_num_threads=1024 -thread_warp_size=32", "conv2d_nchw.cuda", [["TENSOR", [128, 1008, 42, 42], "float32"], ["TENSOR", [168, 1008, 1, 1], "float32"], 1, "SAME", 1, "float32"], {}], "config": {"index": 127602056, "code_hash": null, "entity": [["tile_f", "sp", [-1, 1, 21, 2]], ["tile_y", "sp", [-1, 1, 1, 3]], ["tile_x", "sp", [-1, 1, 14, 1]], ["tile_rc", "sp", [-1, 9]], ["tile_ry", "sp", [-1, 1]], ["tile_rx", "sp", [-1, 1]], ["auto_unroll_max_step", "ot", 0], ["unroll_explicit", "ot", 1]]}, "result": [[0.138870025], 0, 9.28926968574524, 1639036198.1906176], "version": 0.2, "tvm_version": "0.8.dev0"}
{"input": ["cuda -keys=cuda,gpu -max_num_threads=1024 -thread_warp_size=32", "conv2d_nchw.cuda", [["TENSOR", [128, 1008, 42, 42], "float32"], ["TENSOR", [168, 1008, 1, 1], "float32"], 1, "SAME", 1, "float32"], {}], "config": {"index": 4394409, "code_hash": null, "entity": [["tile_f", "sp", [-1, 2, 14, 3]], ["tile_y", "sp", [-1, 1, 1, 3]], ["tile_x", "sp", [-1, 1, 14, 1]], ["tile_rc", "sp", [-1, 4]], ["tile_ry", "sp", [-1, 1]], ["tile_rx", "sp", [-1, 1]], ["auto_unroll_max_step", "ot", 0], ["unroll_explicit", "ot", 0]]}, "result": [[0.087955775], 0, 8.475630521774292, 1639036206.2558637], "version": 0.2, "tvm_version": "0.8.dev0"}
{"input": ["cuda -keys=cuda,gpu -max_num_threads=1024 -thread_warp_size=32", "conv2d_nchw.cuda", [["TENSOR", [128, 1008, 42, 42], "float32"], ["TENSOR", [168, 1008, 1, 1], "float32"], 1, "SAME", 1, "float32"], {}], "config": {"index": 83037609, "code_hash": null, "entity": [["tile_f", "sp", [-1, 2, 14, 3]], ["tile_y", "sp", [-1, 1, 1, 3]], ["tile_x", "sp", [-1, 1, 14, 1]], ["tile_rc", "sp", [-1, 4]], ["tile_ry", "sp", [-1, 1]], ["tile_rx", "sp", [-1, 1]], ["auto_unroll_max_step", "ot", 1500], ["unroll_explicit", "ot", 0]]}, "result": [[0.09797117500000001], 0, 8.897772312164307, 1639036214.6779747], "version": 0.2, "tvm_version": "0.8.dev0"}
{"input": ["cuda -keys=cuda,gpu -max_num_threads=1024 -thread_warp_size=32", "conv2d_nchw.cuda", [["TENSOR", [128, 1008, 42, 42], "float32"], ["TENSOR", [168, 1008, 1, 1], "float32"], 1, "SAME", 1, "float32"], {}], "config": {"index": 43716009, "code_hash": null, "entity": [["tile_f", "sp", [-1, 2, 14, 3]], ["tile_y", "sp", [-1, 1, 1, 3]], ["tile_x", "sp", [-1, 1, 14, 1]], ["tile_rc", "sp", [-1, 4]], ["tile_ry", "sp", [-1, 1]], ["tile_rx", "sp", [-1, 1]], ["auto_unroll_max_step", "ot", 512], ["unroll_explicit", "ot", 0]]}, "result": [[0.08415375], 0, 8.610948085784912, 1639036223.0388157], "version": 0.2, "tvm_version": "0.8.dev0"}
{"input": ["cuda -keys=cuda,gpu -max_num_threads=1024 -thread_warp_size=32", "conv2d_nchw.cuda", [["TENSOR", [128, 1008, 42, 42], "float32"], ["TENSOR", [168, 1008, 1, 1], "float32"], 1, "SAME", 1, "float32"], {}], "config": {"index": 202251689, "code_hash": null, "entity": [["tile_f", "sp", [-1, 2, 14, 3]], ["tile_y", "sp", [-1, 1, 1, 3]], ["tile_x", "sp", [-1, 2, 7, 1]], ["tile_rc", "sp", [-1, 6]], ["tile_ry", "sp", [-1, 1]], ["tile_rx", "sp", [-1, 1]], ["auto_unroll_max_step", "ot", 1500], ["unroll_explicit", "ot", 1]]}, "result": [[0.07995502500000001], 0, 8.355581283569336, 1639036230.3924809], "version": 0.2, "tvm_version": "0.8.dev0"}
{"input": ["cuda -keys=cuda,gpu -max_num_threads=1024 -thread_warp_size=32", "conv2d_nchw.cuda", [["TENSOR", [128, 1008, 42, 42], "float32"], ["TENSOR", [168, 1008, 1, 1], "float32"], 1, "SAME", 1, "float32"], {}], "config": {"index": 123600886, "code_hash": null, "entity": [["tile_f", "sp", [-1, 1, 12, 7]], ["tile_y", "sp", [-1, 1, 3, 1]], ["tile_x", "sp", [-1, 2, 7, 1]], ["tile_rc", "sp", [-1, 6]], ["tile_ry", "sp", [-1, 1]], ["tile_rx", "sp", [-1, 1]], ["auto_unroll_max_step", "ot", 0], ["unroll_explicit", "ot", 1]]}, "result": [[0.07916089999999999], 0, 9.560546636581421, 1639036239.0808415], "version": 0.2, "tvm_version": "0.8.dev0"}
{"input": ["cuda -keys=cuda,gpu -max_num_threads=1024 -thread_warp_size=32", "conv2d_nchw.cuda", [["TENSOR", [128, 1008, 42, 42], "float32"], ["TENSOR", [168, 1008, 1, 1], "float32"], 1, "SAME", 1, "float32"], {}], "config": {"index": 202244086, "code_hash": null, "entity": [["tile_f", "sp", [-1, 1, 12, 7]], ["tile_y", "sp", [-1, 1, 3, 1]], ["tile_x", "sp", [-1, 2, 7, 1]], ["tile_rc", "sp", [-1, 6]], ["tile_ry", "sp", [-1, 1]], ["tile_rx", "sp", [-1, 1]], ["auto_unroll_max_step", "ot", 1500], ["unroll_explicit", "ot", 1]]}, "result": [[0.0806799], 0, 9.104616165161133, 1639036247.1920798], "version": 0.2, "tvm_version": "0.8.dev0"}
{"input": ["cuda -keys=cuda,gpu -max_num_threads=1024 -thread_warp_size=32", "conv2d_nchw.cuda", [["TENSOR", [128, 1008, 42, 42], "float32"], ["TENSOR", [168, 1008, 1, 1], "float32"], 1, "SAME", 1, "float32"], {}], "config": {"index": 162922486, "code_hash": null, "entity": [["tile_f", "sp", [-1, 1, 12, 7]], ["tile_y", "sp", [-1, 1, 3, 1]], ["tile_x", "sp", [-1, 2, 7, 1]], ["tile_rc", "sp", [-1, 6]], ["tile_ry", "sp", [-1, 1]], ["tile_rx", "sp", [-1, 1]], ["auto_unroll_max_step", "ot", 512], ["unroll_explicit", "ot", 1]]}, "result": [[0.081067325], 0, 8.429654836654663, 1639036255.2587912], "version": 0.2, "tvm_version": "0.8.dev0"}
{"input": ["cuda -keys=cuda,gpu -max_num_threads=1024 -thread_warp_size=32", "conv2d_nchw.cuda", [["TENSOR", [128, 1008, 42, 42], "float32"], ["TENSOR", [168, 1008, 1, 1], "float32"], 1, "SAME", 1, "float32"], {}], "config": {"index": 89591174, "code_hash": null, "entity": [["tile_f", "sp", [-1, 3, 14, 2]], ["tile_y", "sp", [-1, 1, 1, 3]], ["tile_x", "sp", [-1, 1, 14, 1]], ["tile_rc", "sp", [-1, 12]], ["tile_ry", "sp", [-1, 1]], ["tile_rx", "sp", [-1, 1]], ["auto_unroll_max_step", "ot", 1500], ["unroll_explicit", "ot", 0]]}, "result": [[0.116973375], 0, 9.059352159500122, 1639036263.7392814], "version": 0.2, "tvm_version": "0.8.dev0"}
{"input": ["cuda -keys=cuda,gpu -max_num_threads=1024 -thread_warp_size=32", "conv2d_nchw.cuda", [["TENSOR", [128, 1008, 42, 42], "float32"], ["TENSOR", [168, 1008, 1, 1], "float32"], 1, "SAME", 1, "float32"], {}], "config": {"index": 50269574, "code_hash": null, "entity": [["tile_f", "sp", [-1, 3, 14, 2]], ["tile_y", "sp", [-1, 1, 1, 3]], ["tile_x", "sp", [-1, 1, 14, 1]], ["tile_rc", "sp", [-1, 12]], ["tile_ry", "sp", [-1, 1]], ["tile_rx", "sp", [-1, 1]], ["auto_unroll_max_step", "ot", 512], ["unroll_explicit", "ot", 0]]}, "result": [[0.1046535], 0, 9.085930585861206, 1639036271.9976459], "version": 0.2, "tvm_version": "0.8.dev0"}
{"input": ["cuda -keys=cuda,gpu -max_num_threads=1024 -thread_warp_size=32", "conv2d_nchw.cuda", [["TENSOR", [128, 1008, 42, 42], "float32"], ["TENSOR", [168, 1008, 1, 1], "float32"], 1, "SAME", 1, "float32"], {}], "config": {"index": 10947974, "code_hash": null, "entity": [["tile_f", "sp", [-1, 3, 14, 2]], ["tile_y", "sp", [-1, 1, 1, 3]], ["tile_x", "sp", [-1, 1, 14, 1]], ["tile_rc", "sp", [-1, 12]], ["tile_ry", "sp", [-1, 1]], ["tile_rx", "sp", [-1, 1]], ["auto_unroll_max_step", "ot", 0], ["unroll_explicit", "ot", 0]]}, "result": [[0.0960636], 0, 9.060741662979126, 1639036280.569478], "version": 0.2, "tvm_version": "0.8.dev0"}
{"input": ["cuda -keys=cuda,gpu -max_num_threads=1024 -thread_warp_size=32", "conv2d_nchw.cuda", [["TENSOR", [128, 1008, 42, 42], "float32"], ["TENSOR", [168, 1008, 1, 1], "float32"], 1, "SAME", 1, "float32"], {}], "config": {"index": 157659174, "code_hash": null, "entity": [["tile_f", "sp", [-1, 1, 8, 21]], ["tile_y", "sp", [-1, 1, 3, 1]], ["tile_x", "sp", [-1, 1, 7, 1]], ["tile_rc", "sp", [-1, 1]], ["tile_ry", "sp", [-1, 1]], ["tile_rx", "sp", [-1, 1]], ["auto_unroll_max_step", "ot", 512], ["unroll_explicit", "ot", 1]]}, "result": [[0.20354292499999999], 0, 8.86140751838684, 1639036494.0380957], "version": 0.2, "tvm_version": "0.8.dev0"}
{"input": ["cuda -keys=cuda,gpu -max_num_threads=1024 -thread_warp_size=32", "conv2d_nchw.cuda", [["TENSOR", [128, 1008, 42, 42], "float32"], ["TENSOR", [168, 1008, 1, 1], "float32"], 1, "SAME", 1, "float32"], {}], "config": {"index": 170510610, "code_hash": null, "entity": [["tile_f", "sp", [-1, 14, 2, 6]], ["tile_y", "sp", [-1, 1, 1, 6]], ["tile_x", "sp", [-1, 14, 1, 1]], ["tile_rc", "sp", [-1, 16]], ["tile_ry", "sp", [-1, 1]], ["tile_rx", "sp", [-1, 1]], ["auto_unroll_max_step", "ot", 512], ["unroll_explicit", "ot", 1]]}, "result": [[36.681056375], 0, 192.76364850997925, 1639036684.8202581], "version": 0.2, "tvm_version": "0.8.dev0"}
{"input": ["cuda -keys=cuda,gpu -max_num_threads=1024 -thread_warp_size=32", "conv2d_nchw.cuda", [["TENSOR", [128, 1008, 42, 42], "float32"], ["TENSOR", [168, 1008, 1, 1], "float32"], 1, "SAME", 1, "float32"], {}], "config": {"index": 84378166, "code_hash": null, "entity": [["tile_f", "sp", [-1, 1, 12, 7]], ["tile_y", "sp", [-1, 2, 1, 1]], ["tile_x", "sp", [-1, 1, 21, 1]], ["tile_rc", "sp", [-1, 6]], ["tile_ry", "sp", [-1, 1]], ["tile_rx", "sp", [-1, 1]], ["auto_unroll_max_step", "ot", 1500], ["unroll_explicit", "ot", 0]]}, "result": [[0.0833952], 0, 7.280392169952393, 1639036843.8117015], "version": 0.2, "tvm_version": "0.8.dev0"}
{"input": ["cuda -keys=cuda,gpu -max_num_threads=1024 -thread_warp_size=32", "conv2d_nchw.cuda", [["TENSOR", [128, 1008, 42, 42], "float32"], ["TENSOR", [168, 1008, 1, 1], "float32"], 1, "SAME", 1, "float32"], {}], "config": {"index": 45056566, "code_hash": null, "entity": [["tile_f", "sp", [-1, 1, 12, 7]], ["tile_y", "sp", [-1, 2, 1, 1]], ["tile_x", "sp", [-1, 1, 21, 1]], ["tile_rc", "sp", [-1, 6]], ["tile_ry", "sp", [-1, 1]], ["tile_rx", "sp", [-1, 1]], ["auto_unroll_max_step", "ot", 512], ["unroll_explicit", "ot", 0]]}, "result": [[0.07833745], 0, 8.11911916732788, 1639036852.2217493], "version": 0.2, "tvm_version": "0.8.dev0"}
{"input": ["cuda -keys=cuda,gpu -max_num_threads=1024 -thread_warp_size=32", "conv2d_nchw.cuda", [["TENSOR", [128, 1008, 42, 42], "float32"], ["TENSOR", [168, 1008, 1, 1], "float32"], 1, "SAME", 1, "float32"], {}], "config": {"index": 84296246, "code_hash": null, "entity": [["tile_f", "sp", [-1, 1, 12, 7]], ["tile_y", "sp", [-1, 2, 1, 1]], ["tile_x", "sp", [-1, 3, 7, 1]], ["tile_rc", "sp", [-1, 6]], ["tile_ry", "sp", [-1, 1]], ["tile_rx", "sp", [-1, 1]], ["auto_unroll_max_step", "ot", 1500], ["unroll_explicit", "ot", 0]]}, "result": [[0.06810985], 0, 8.293312311172485, 1639036860.1672149], "version": 0.2, "tvm_version": "0.8.dev0"}
{"input": ["cuda -keys=cuda,gpu -max_num_threads=1024 -thread_warp_size=32", "conv2d_nchw.cuda", [["TENSOR", [128, 1008, 42, 42], "float32"], ["TENSOR", [168, 1008, 1, 1], "float32"], 1, "SAME", 1, "float32"], {}], "config": {"index": 202261046, "code_hash": null, "entity": [["tile_f", "sp", [-1, 1, 12, 7]], ["tile_y", "sp", [-1, 2, 1, 1]], ["tile_x", "sp", [-1, 3, 7, 1]], ["tile_rc", "sp", [-1, 6]], ["tile_ry", "sp", [-1, 1]], ["tile_rx", "sp", [-1, 1]], ["auto_unroll_max_step", "ot", 1500], ["unroll_explicit", "ot", 1]]}, "result": [[0.0710408], 0, 9.271994352340698, 1639036869.0152278], "version": 0.2, "tvm_version": "0.8.dev0"}
{"input": ["cuda -keys=cuda,gpu -max_num_threads=1024 -thread_warp_size=32", "conv2d_nchw.cuda", [["TENSOR", [128, 1008, 42, 42], "float32"], ["TENSOR", [168, 1008, 1, 1], "float32"], 1, "SAME", 1, "float32"], {}], "config": {"index": 44974646, "code_hash": null, "entity": [["tile_f", "sp", [-1, 1, 12, 7]], ["tile_y", "sp", [-1, 2, 1, 1]], ["tile_x", "sp", [-1, 3, 7, 1]], ["tile_rc", "sp", [-1, 6]], ["tile_ry", "sp", [-1, 1]], ["tile_rx", "sp", [-1, 1]], ["auto_unroll_max_step", "ot", 512], ["unroll_explicit", "ot", 0]]}, "result": [[0.067282575], 0, 7.677756071090698, 1639036876.6945288], "version": 0.2, "tvm_version": "0.8.dev0"}
{"input": ["cuda -keys=cuda,gpu -max_num_threads=1024 -thread_warp_size=32", "conv2d_nchw.cuda", [["TENSOR", [128, 1008, 42, 42], "float32"], ["TENSOR", [168, 1008, 1, 1], "float32"], 1, "SAME", 1, "float32"], {}], "config": {"index": 5734966, "code_hash": null, "entity": [["tile_f", "sp", [-1, 1, 12, 7]], ["tile_y", "sp", [-1, 2, 1, 1]], ["tile_x", "sp", [-1, 1, 21, 1]], ["tile_rc", "sp", [-1, 6]], ["tile_ry", "sp", [-1, 1]], ["tile_rx", "sp", [-1, 1]], ["auto_unroll_max_step", "ot", 0], ["unroll_explicit", "ot", 0]]}, "result": [[0.089505975], 0, 7.376403331756592, 1639036883.8600113], "version": 0.2, "tvm_version": "0.8.dev0"}
