artifacts/kernel_db/ansor_kernels/fused_conv_expr_S1D1P1_64_32_16_16_32_3_3_ansor/tune.log
{"i": [["[\"get_expr\", \"fused_conv_expr_S1D1P1\", [64, 32, 16, 16, 32, 3, 3]]", "cuda -keys=cuda,gpu -max_num_threads=1024 -thread_warp_size=32", [-1, 16, 64, 49152, 2147483647, 1024, 8, 32], "", 0, []], [[], [["SP", 4, 0, 32, [4, 1, 2, 1], 1], ["SP", 4, 5, 16384, [1, 32, 2, 2], 1], ["SP", 4, 10, 288, [1, 32], 1], ["RE", 4, [0, 5, 1, 6, 2, 7, 10, 11, 3, 8, 12, 4, 9]], ["FSP", 5, 0, 0, 3], ["FSP", 5, 4, 1, 3], ["RE", 5, [0, 4, 1, 5, 2, 6, 3, 7]], ["CA", 4, 5, 5], ["CHR", 3, "shared", [4]], ["CA", 4, 5, 6], ["CI", 3], ["CHR", 1, "shared", [5]], ["CA", 2, 6, 6], ["CI", 1], ["FU", 7, [0, 1]], ["AN", 7, 0, 5], ["FU", 7, [1, 2]], ["AN", 7, 1, 4], ["FU", 7, [2, 3]], ["AN", 7, 2, 6], ["FU", 5, [0, 1]], ["SP", 5, 0, 32, [1], 1], ["AN", 5, 1, 2], ["FFSP", 5, 0, [1, 0], 1, 1], ["AN", 5, 1, 6], ["FU", 2, [0, 1]], ["SP", 2, 0, 64, [1], 1], ["AN", 2, 1, 2], ["FFSP", 2, 0, [1, 0], 1, 1], ["AN", 2, 1, 6], ["PR", 6, 0, "auto_unroll_max_step$0"]]]], "r": [[0.000383372], 0, 2.45187, 1661162522], "v": "v0.6"}
{"i": [["[\"get_expr\", \"fused_conv_expr_S1D1P1\", [64, 32, 16, 16, 32, 3, 3]]", "cuda -keys=cuda,gpu -max_num_threads=1024 -thread_warp_size=32", [-1, 16, 64, 49152, 2147483647, 1024, 8, 32], "", 0, []], [[], [["SP", 4, 0, 32, [2, 1, 1, 16], 1], ["SP", 4, 5, 16384, [1, 128, 2, 1], 1], ["SP", 4, 10, 288, [18, 1], 1], ["RE", 4, [0, 5, 1, 6, 2, 7, 10, 11, 3, 8, 12, 4, 9]], ["FSP", 5, 0, 0, 3], ["FSP", 5, 4, 1, 3], ["RE", 5, [0, 4, 1, 5, 2, 6, 3, 7]], ["CA", 4, 5, 5], ["CHR", 3, "shared", [4]], ["CA", 4, 5, 6], ["CI", 3], ["CHR", 1, "shared", [5]], ["CA", 2, 6, 6], ["CI", 1], ["FU", 7, [0, 1]], ["AN", 7, 0, 5], ["FU", 7, [1, 2]], ["AN", 7, 1, 4], ["FU", 7, [2, 3]], ["AN", 7, 2, 6], ["FU", 5, [0, 1]], ["SP", 5, 0, 72, [1], 1], ["AN", 5, 1, 2], ["FFSP", 5, 0, [1, 0], 1, 1], ["AN", 5, 1, 6], ["FU", 2, [0, 1]], ["SP", 2, 0, 36, [18], 1], ["AN", 2, 1, 2], ["FFSP", 2, 0, [1, 0], 1, 1], ["AN", 2, 1, 6], ["PR", 6, 0, "auto_unroll_max_step$1024"]]]], "r": [[6.34268e-05], 0, 2.8507, 1661162524], "v": "v0.6"}
{"i": [["[\"get_expr\", \"fused_conv_expr_S1D1P1\", [64, 32, 16, 16, 32, 3, 3]]", "cuda -keys=cuda,gpu -max_num_threads=1024 -thread_warp_size=32", [-1, 16, 64, 49152, 2147483647, 1024, 8, 32], "", 0, []], [[], [["SP", 4, 0, 32, [2, 2, 1, 1], 1], ["SP", 4, 5, 16384, [1, 32, 2, 2], 1], ["SP", 4, 10, 288, [1, 1], 1], ["RE", 4, [0, 5, 1, 6, 2, 7, 10, 11, 3, 8, 12, 4, 9]], ["FSP", 5, 0, 0, 3], ["FSP", 5, 4, 1, 3], ["RE", 5, [0, 4, 1, 5, 2, 6, 3, 7]], ["CA", 4, 5, 5], ["CHR", 3, "shared", [4]], ["CA", 4, 5, 6], ["CI", 3], ["CHR", 1, "shared", [5]], ["CA", 2, 6, 6], ["CI", 1], ["FU", 7, [0, 1]], ["AN", 7, 0, 5], ["FU", 7, [1, 2]], ["AN", 7, 1, 4], ["FU", 7, [2, 3]], ["AN", 7, 2, 6], ["FU", 5, [0, 1]], ["SP", 5, 0, 2, [1], 1], ["AN", 5, 1, 2], ["FFSP", 5, 0, [1, 0], 1, 1], ["AN", 5, 1, 6], ["FU", 2, [0, 1]], ["SP", 2, 0, 8, [1], 1], ["AN", 2, 1, 2], ["FFSP", 2, 0, [1, 0], 1, 1], ["AN", 2, 1, 6], ["PR", 6, 0, "auto_unroll_max_step$0"]]]], "r": [[0.000146708], 0, 2.86022, 1661162526], "v": "v0.6"}
{"i": [["[\"get_expr\", \"fused_conv_expr_S1D1P1\", [64, 32, 16, 16, 32, 3, 3]]", "cuda -keys=cuda,gpu -max_num_threads=1024 -thread_warp_size=32", [-1, 16, 64, 49152, 2147483647, 1024, 8, 32], "", 0, []], [[], [["SP", 4, 0, 32, [1, 32, 1, 1], 1], ["SP", 4, 5, 16384, [2, 2, 32, 1], 1], ["SP", 4, 10, 288, [9, 8], 1], ["RE", 4, [0, 5, 1, 6, 2, 7, 10, 11, 3, 8, 12, 4, 9]], ["FSP", 5, 0, 0, 3], ["FSP", 5, 4, 1, 3], ["RE", 5, [0, 4, 1, 5, 2, 6, 3, 7]], ["CA", 4, 5, 5], ["CHR", 3, "shared", [4]], ["CA", 4, 5, 6], ["CI", 3], ["CHR", 1, "shared", [5]], ["CA", 2, 6, 6], ["CI", 1], ["FU", 7, [0, 1]], ["AN", 7, 0, 5], ["FU", 7, [1, 2]], ["AN", 7, 1, 4], ["FU", 7, [2, 3]], ["AN", 7, 2, 6], ["FU", 5, [0, 1]], ["SP", 5, 0, 144, [1], 1], ["AN", 5, 1, 2], ["FFSP", 5, 0, [1, 0], 1, 1], ["AN", 5, 1, 6], ["FU", 2, [0, 1]], ["SP", 2, 0, 2304, [12], 1], ["AN", 2, 1, 2], ["FFSP", 2, 0, [1, 0], 1, 1], ["AN", 2, 1, 6], ["PR", 6, 0, "auto_unroll_max_step$16"]]]], "r": [[0.000202374], 0, 3.27989, 1661162528], "v": "v0.6"}
{"i": [["[\"get_expr\", \"fused_conv_expr_S1D1P1\", [64, 32, 16, 16, 32, 3, 3]]", "cuda -keys=cuda,gpu -max_num_threads=1024 -thread_warp_size=32", [-1, 16, 64, 49152, 2147483647, 1024, 8, 32], "", 0, []], [[], [["SP", 4, 0, 32, [1, 32, 1, 1], 1], ["SP", 4, 5, 16384, [1, 16, 2, 2], 1], ["SP", 4, 10, 288, [72, 1], 1], ["RE", 4, [0, 5, 1, 6, 2, 7, 10, 11, 3, 8, 12, 4, 9]], ["FSP", 5, 0, 0, 3], ["FSP", 5, 4, 1, 3], ["RE", 5, [0, 4, 1, 5, 2, 6, 3, 7]], ["CA", 4, 5, 5], ["CHR", 3, "shared", [4]], ["CA", 4, 5, 6], ["CI", 3], ["CHR", 1, "shared", [5]], ["CA", 2, 6, 6], ["CI", 1], ["FU", 7, [0, 1]], ["AN", 7, 0, 5], ["FU", 7, [1, 2]], ["AN", 7, 1, 4], ["FU", 7, [2, 3]], ["AN", 7, 2, 6], ["FU", 5, [0, 1]], ["SP", 5, 0, 288, [1], 1], ["AN", 5, 1, 2], ["FFSP", 5, 0, [1, 0], 1, 1], ["AN", 5, 1, 6], ["FU", 2, [0, 1]], ["SP", 2, 0, 288, [1], 1], ["AN", 2, 1, 2], ["FFSP", 2, 0, [1, 0], 1, 1], ["AN", 2, 1, 6], ["PR", 6, 0, "auto_unroll_max_step$512"]]]], "r": [[7.95206e-05], 0, 2.97066, 1661162529], "v": "v0.6"}
{"i": [["[\"get_expr\", \"fused_conv_expr_S1D1P1\", [64, 32, 16, 16, 32, 3, 3]]", "cuda -keys=cuda,gpu -max_num_threads=1024 -thread_warp_size=32", [-1, 16, 64, 49152, 2147483647, 1024, 8, 32], "", 0, []], [[], [["SP", 4, 0, 32, [4, 2, 1, 4], 1], ["SP", 4, 5, 16384, [1, 64, 1, 1], 1], ["SP", 4, 10, 288, [1, 1], 1], ["RE", 4, [0, 5, 1, 6, 2, 7, 10, 11, 3, 8, 12, 4, 9]], ["FSP", 5, 0, 0, 3], ["FSP", 5, 4, 1, 3], ["RE", 5, [0, 4, 1, 5, 2, 6, 3, 7]], ["CA", 4, 5, 5], ["CHR", 3, "shared", [4]], ["CA", 4, 5, 6], ["CI", 3], ["CHR", 1, "shared", [5]], ["CA", 2, 6, 6], ["CI", 1], ["FU", 7, [0, 1]], ["AN", 7, 0, 5], ["FU", 7, [1, 2]], ["AN", 7, 1, 4], ["FU", 7, [2, 3]], ["AN", 7, 2, 6], ["FU", 5, [0, 1]], ["SP", 5, 0, 144, [1], 1], ["AN", 5, 1, 2], ["FFSP", 5, 0, [1, 0], 1, 1], ["AN", 5, 1, 6], ["FU", 2, [0, 1]], ["SP", 2, 0, 72, [2], 1], ["AN", 2, 1, 2], ["FFSP", 2, 0, [1, 0], 1, 1], ["AN", 2, 1, 6], ["PR", 6, 0, "auto_unroll_max_step$16"]]]], "r": [[0.00013124], 0, 1.94205, 1661162531], "v": "v0.6"}
{"i": [["[\"get_expr\", \"fused_conv_expr_S1D1P1\", [64, 32, 16, 16, 32, 3, 3]]", "cuda -keys=cuda,gpu -max_num_threads=1024 -thread_warp_size=32", [-1, 16, 64, 49152, 2147483647, 1024, 8, 32], "", 0, []], [[], [["SP", 4, 0, 32, [1, 1, 16, 1], 1], ["SP", 4, 5, 16384, [1, 32, 2, 1], 1], ["SP", 4, 10, 288, [1, 48], 1], ["RE", 4, [0, 5, 1, 6, 2, 7, 10, 11, 3, 8, 12, 4, 9]], ["FSP", 5, 0, 0, 3], ["FSP", 5, 4, 1, 3], ["RE", 5, [0, 4, 1, 5, 2, 6, 3, 7]], ["CA", 4, 5, 5], ["CHR", 3, "shared", [4]], ["CA", 4, 5, 6], ["CI", 3], ["CHR", 1, "shared", [5]], ["CA", 2, 6, 6], ["CI", 1], ["FU", 7, [0, 1]], ["AN", 7, 0, 5], ["FU", 7, [1, 2]], ["AN", 7, 1, 4], ["FU", 7, [2, 3]], ["AN", 7, 2, 6], ["FU", 5, [0, 1]], ["SP", 5, 0, 256, [1], 1], ["AN", 5, 1, 2], ["FFSP", 5, 0, [1, 0], 1, 1], ["AN", 5, 1, 6], ["FU", 2, [0, 1]], ["SP", 2, 0, 32, [1], 1], ["AN", 2, 1, 2], ["FFSP", 2, 0, [1, 0], 1, 1], ["AN", 2, 1, 6], ["PR", 6, 0, "auto_unroll_max_step$0"]]]], "r": [[0.000213249], 0, 2.2244, 1661162532], "v": "v0.6"}
{"i": [["[\"get_expr\", \"fused_conv_expr_S1D1P1\", [64, 32, 16, 16, 32, 3, 3]]", "cuda -keys=cuda,gpu -max_num_threads=1024 -thread_warp_size=32", [-1, 16, 64, 49152, 2147483647, 1024, 8, 32], "", 0, []], [[], [["SP", 4, 0, 32, [2, 2, 2, 1], 1], ["SP", 4, 5, 16384, [1, 32, 8, 2], 1], ["SP", 4, 10, 288, [3, 6], 1], ["RE", 4, [0, 5, 1, 6, 2, 7, 10, 11, 3, 8, 12, 4, 9]], ["FSP", 5, 0, 0, 3], ["FSP", 5, 4, 1, 3], ["RE", 5, [0, 4, 1, 5, 2, 6, 3, 7]], ["CA", 4, 5, 5], ["CHR", 3, "shared", [4]], ["CA", 4, 5, 6], ["CI", 3], ["CHR", 1, "shared", [5]], ["CA", 2, 6, 6], ["CI", 1], ["FU", 7, [0, 1]], ["AN", 7, 0, 5], ["FU", 7, [1, 2]], ["AN", 7, 1, 4], ["FU", 7, [2, 3]], ["AN", 7, 2, 6], ["FU", 5, [0, 1]], ["SP", 5, 0, 36, [1], 1], ["AN", 5, 1, 2], ["FFSP", 5, 0, [1, 0], 1, 1], ["AN", 5, 1, 6], ["FU", 2, [0, 1]], ["SP", 2, 0, 144, [1], 1], ["AN", 2, 1, 2], ["FFSP", 2, 0, [1, 0], 1, 1], ["AN", 2, 1, 6], ["PR", 6, 0, "auto_unroll_max_step$16"]]]], "r": [[0.000403002], 0, 2.7654, 1661162534], "v": "v0.6"}
{"i": [["[\"get_expr\", \"fused_conv_expr_S1D1P1\", [64, 32, 16, 16, 32, 3, 3]]", "cuda -keys=cuda,gpu -max_num_threads=1024 -thread_warp_size=32", [-1, 16, 64, 49152, 2147483647, 1024, 8, 32], "", 0, []], [[], [["SP", 4, 0, 32, [8, 2, 2, 1], 1], ["SP", 4, 5, 16384, [1, 32, 1, 32], 1], ["SP", 4, 10, 288, [1, 3], 1], ["RE", 4, [0, 5, 1, 6, 2, 7, 10, 11, 3, 8, 12, 4, 9]], ["FSP", 5, 0, 0, 3], ["FSP", 5, 4, 1, 3], ["RE", 5, [0, 4, 1, 5, 2, 6, 3, 7]], ["CA", 4, 5, 5], ["CHR", 3, "shared", [4]], ["CA", 4, 5, 6], ["CI", 3], ["CHR", 1, "shared", [5]], ["CA", 2, 6, 6], ["CI", 1], ["FU", 7, [0, 1]], ["AN", 7, 0, 5], ["FU", 7, [1, 2]], ["AN", 7, 1, 4], ["FU", 7, [2, 3]], ["AN", 7, 2, 6], ["FU", 5, [0, 1]], ["SP", 5, 0, 18, [9], 1], ["AN", 5, 1, 2], ["FFSP", 5, 0, [1, 0], 1, 1], ["AN", 5, 1, 6], ["FU", 2, [0, 1]], ["SP", 2, 0, 288, [24], 1], ["AN", 2, 1, 2], ["FFSP", 2, 0, [1, 0], 1, 1], ["AN", 2, 1, 6], ["PR", 6, 0, "auto_unroll_max_step$0"]]]], "r": [[0.00115418], 0, 3.98937, 1661162535], "v": "v0.6"}
{"i": [["[\"get_expr\", \"fused_conv_expr_S1D1P1\", [64, 32, 16, 16, 32, 3, 3]]", "cuda -keys=cuda,gpu -max_num_threads=1024 -thread_warp_size=32", [-1, 16, 64, 49152, 2147483647, 1024, 8, 32], "", 0, []], [[], [["SP", 4, 0, 32, [1, 16, 1, 2], 1], ["SP", 4, 5, 16384, [2, 2, 32, 1], 1], ["SP", 4, 10, 288, [9, 8], 1], ["RE", 4, [0, 5, 1, 6, 2, 7, 10, 11, 3, 8, 12, 4, 9]], ["FSP", 5, 0, 0, 3], ["FSP", 5, 4, 1, 3], ["RE", 5, [0, 4, 1, 5, 2, 6, 3, 7]], ["CA", 4, 5, 5], ["CHR", 3, "shared", [4]], ["CA", 4, 5, 6], ["CI", 3], ["CHR", 1, "shared", [5]], ["CA", 2, 6, 6], ["CI", 1], ["FU", 7, [0, 1]], ["AN", 7, 0, 5], ["FU", 7, [1, 2]], ["AN", 7, 1, 4], ["FU", 7, [2, 3]], ["AN", 7, 2, 6], ["FU", 5, [0, 1]], ["SP", 5, 0, 144, [1], 1], ["AN", 5, 1, 2], ["FFSP", 5, 0, [1, 0], 1, 1], ["AN", 5, 1, 6], ["FU", 2, [0, 1]], ["SP", 2, 0, 2304, [1], 1], ["AN", 2, 1, 2], ["FFSP", 2, 0, [1, 0], 1, 1], ["AN", 2, 1, 6], ["PR", 6, 0, "auto_unroll_max_step$16"]]]], "r": [[0.000489983], 0, 2.92921, 1661162537], "v": "v0.6"}
{"i": [["[\"get_expr\", \"fused_conv_expr_S1D1P1\", [64, 32, 16, 16, 32, 3, 3]]", "cuda -keys=cuda,gpu -max_num_threads=1024 -thread_warp_size=32", [-1, 16, 64, 49152, 2147483647, 1024, 8, 32], "", 0, []], [[], [["SP", 4, 0, 32, [1, 1, 2, 1], 1], ["SP", 4, 5, 16384, [2, 32, 8, 2], 1], ["SP", 4, 10, 288, [4, 2], 1], ["RE", 4, [0, 5, 1, 6, 2, 7, 10, 11, 3, 8, 12, 4, 9]], ["FSP", 5, 0, 0, 3], ["FSP", 5, 4, 1, 3], ["RE", 5, [0, 4, 1, 5, 2, 6, 3, 7]], ["CA", 4, 5, 5], ["CHR", 3, "shared", [4]], ["CA", 4, 5, 6], ["CI", 3], ["CHR", 1, "shared", [5]], ["CA", 2, 6, 6], ["CI", 1], ["FU", 7, [0, 1]], ["AN", 7, 0, 5], ["FU", 7, [1, 2]], ["AN", 7, 1, 4], ["FU", 7, [2, 3]], ["AN", 7, 2, 6], ["FU", 5, [0, 1]], ["SP", 5, 0, 64, [64], 1], ["AN", 5, 1, 2], ["FFSP", 5, 0, [1, 0], 1, 1], ["AN", 5, 1, 6], ["FU", 2, [0, 1]], ["SP", 2, 0, 128, [32], 1], ["AN", 2, 1, 2], ["FFSP", 2, 0, [1, 0], 1, 1], ["AN", 2, 1, 6], ["PR", 6, 0, "auto_unroll_max_step$64"]]]], "r": [[0.00189489], 0, 2.36514, 1661162538], "v": "v0.6"}
{"i": [["[\"get_expr\", \"fused_conv_expr_S1D1P1\", [64, 32, 16, 16, 32, 3, 3]]", "cuda -keys=cuda,gpu -max_num_threads=1024 -thread_warp_size=32", [-1, 16, 64, 49152, 2147483647, 1024, 8, 32], "", 0, []], [[], [["SP", 4, 0, 32, [2, 8, 1, 1], 1], ["SP", 4, 5, 16384, [1, 16, 1, 8], 1], ["SP", 4, 10, 288, [2, 2], 1], ["RE", 4, [0, 5, 1, 6, 2, 7, 10, 11, 3, 8, 12, 4, 9]], ["FSP", 5, 0, 0, 3], ["FSP", 5, 4, 1, 3], ["RE", 5, [0, 4, 1, 5, 2, 6, 3, 7]], ["CA", 4, 5, 5], ["CHR", 3, "shared", [4]], ["CA", 4, 5, 6], ["CI", 3], ["CHR", 1, "shared", [5]], ["CA", 2, 6, 6], ["CI", 1], ["FU", 7, [0, 1]], ["AN", 7, 0, 5], ["FU", 7, [1, 2]], ["AN", 7, 1, 4], ["FU", 7, [2, 3]], ["AN", 7, 2, 6], ["FU", 5, [0, 1]], ["SP", 5, 0, 4, [1], 1], ["AN", 5, 1, 2], ["FFSP", 5, 0, [1, 0], 1, 1], ["AN", 5, 1, 6], ["FU", 2, [0, 1]], ["SP", 2, 0, 32, [8], 1], ["AN", 2, 1, 2], ["FFSP", 2, 0, [1, 0], 1, 1], ["AN", 2, 1, 6], ["PR", 6, 0, "auto_unroll_max_step$1024"]]]], "r": [[0.000150219], 0, 2.4955, 1661162540], "v": "v0.6"}
{"i": [["[\"get_expr\", \"fused_conv_expr_S1D1P1\", [64, 32, 16, 16, 32, 3, 3]]", "cuda -keys=cuda,gpu -max_num_threads=1024 -thread_warp_size=32", [-1, 16, 64, 49152, 2147483647, 1024, 8, 32], "", 0, []], [[], [["SP", 4, 0, 32, [4, 8, 1, 1], 1], ["SP", 4, 5, 16384, [1, 1, 4, 8], 1], ["SP", 4, 10, 288, [16, 9], 1], ["RE", 4, [0, 5, 1, 6, 2, 7, 10, 11, 3, 8, 12, 4, 9]], ["FSP", 5, 0, 0, 3], ["FSP", 5, 4, 1, 3], ["RE", 5, [0, 4, 1, 5, 2, 6, 3, 7]], ["CA", 4, 5, 5], ["CHR", 3, "shared", [4]], ["CA", 4, 5, 6], ["CI", 3], ["CHR", 1, "shared", [5]], ["CA", 2, 6, 6], ["CI", 1], ["FU", 7, [0, 1]], ["AN", 7, 0, 5], ["FU", 7, [1, 2]], ["AN", 7, 1, 4], ["FU", 7, [2, 3]], ["AN", 7, 2, 6], ["FU", 5, [0, 1]], ["SP", 5, 0, 144, [1], 1], ["AN", 5, 1, 2], ["FFSP", 5, 0, [1, 0], 1, 1], ["AN", 5, 1, 6], ["FU", 2, [0, 1]], ["SP", 2, 0, 4608, [1], 1], ["AN", 2, 1, 2], ["FFSP", 2, 0, [1, 0], 1, 1], ["AN", 2, 1, 6], ["PR", 6, 0, "auto_unroll_max_step$512"]]]], "r": [[0.00106744], 0, 3.34391, 1661162542], "v": "v0.6"}
{"i": [["[\"get_expr\", \"fused_conv_expr_S1D1P1\", [64, 32, 16, 16, 32, 3, 3]]", "cuda -keys=cuda,gpu -max_num_threads=1024 -thread_warp_size=32", [-1, 16, 64, 49152, 2147483647, 1024, 8, 32], "", 0, []], [[], [["SP", 4, 0, 32, [1, 8, 1, 4], 1], ["SP", 4, 5, 16384, [8, 4, 1, 2], 1], ["SP", 4, 10, 288, [6, 4], 1], ["RE", 4, [0, 5, 1, 6, 2, 7, 10, 11, 3, 8, 12, 4, 9]], ["FSP", 5, 0, 0, 3], ["FSP", 5, 4, 1, 3], ["RE", 5, [0, 4, 1, 5, 2, 6, 3, 7]], ["CA", 4, 5, 5], ["CHR", 3, "shared", [4]], ["CA", 4, 5, 6], ["CI", 3], ["CHR", 1, "shared", [5]], ["CA", 2, 6, 6], ["CI", 1], ["FU", 7, [0, 1]], ["AN", 7, 0, 5], ["FU", 7, [1, 2]], ["AN", 7, 1, 4], ["FU", 7, [2, 3]], ["AN", 7, 2, 6], ["FU", 5, [0, 1]], ["SP", 5, 0, 24, [1], 1], ["AN", 5, 1, 2], ["FFSP", 5, 0, [1, 0], 1, 1], ["AN", 5, 1, 6], ["FU", 2, [0, 1]], ["SP", 2, 0, 12, [6], 1], ["AN", 2, 1, 2], ["FFSP", 2, 0, [1, 0], 1, 1], ["AN", 2, 1, 6], ["PR", 6, 0, "auto_unroll_max_step$0"]]]], "r": [[9.27688e-05], 0, 2.56007, 1661162544], "v": "v0.6"}
{"i": [["[\"get_expr\", \"fused_conv_expr_S1D1P1\", [64, 32, 16, 16, 32, 3, 3]]", "cuda -keys=cuda,gpu -max_num_threads=1024 -thread_warp_size=32", [-1, 16, 64, 49152, 2147483647, 1024, 8, 32], "", 0, []], [[], [["SP", 4, 0, 32, [1, 16, 1, 1], 1], ["SP", 4, 5, 16384, [8, 4, 2, 1], 1], ["SP", 4, 10, 288, [4, 12], 1], ["RE", 4, [0, 5, 1, 6, 2, 7, 10, 11, 3, 8, 12, 4, 9]], ["FSP", 5, 0, 0, 3], ["FSP", 5, 4, 1, 3], ["RE", 5, [0, 4, 1, 5, 2, 6, 3, 7]], ["CA", 4, 5, 5], ["CHR", 3, "shared", [4]], ["CA", 4, 5, 6], ["CI", 3], ["CHR", 1, "shared", [5]], ["CA", 2, 6, 6], ["CI", 1], ["FU", 7, [0, 1]], ["AN", 7, 0, 5], ["FU", 7, [1, 2]], ["AN", 7, 1, 4], ["FU", 7, [2, 3]], ["AN", 7, 2, 6], ["FU", 5, [0, 1]], ["SP", 5, 0, 48, [1], 1], ["AN", 5, 1, 2], ["FFSP", 5, 0, [1, 0], 1, 1], ["AN", 5, 1, 6], ["FU", 2, [0, 1]], ["SP", 2, 0, 768, [16], 1], ["AN", 2, 1, 2], ["FFSP", 2, 0, [1, 0], 1, 1], ["AN", 2, 1, 6], ["PR", 6, 0, "auto_unroll_max_step$0"]]]], "r": [[0.000149074], 0, 3.18651, 1661162546], "v": "v0.6"}
{"i": [["[\"get_expr\", \"fused_conv_expr_S1D1P1\", [64, 32, 16, 16, 32, 3, 3]]", "cuda -keys=cuda,gpu -max_num_threads=1024 -thread_warp_size=32", [-1, 16, 64, 49152, 2147483647, 1024, 8, 32], "", 0, []], [[], [["SP", 4, 0, 32, [2, 1, 16, 1], 1], ["SP", 4, 5, 16384, [4, 64, 1, 1], 1], ["SP", 4, 10, 288, [6, 1], 1], ["RE", 4, [0, 5, 1, 6, 2, 7, 10, 11, 3, 8, 12, 4, 9]], ["FSP", 5, 0, 0, 3], ["FSP", 5, 4, 1, 3], ["RE", 5, [0, 4, 1, 5, 2, 6, 3, 7]], ["CA", 4, 5, 5], ["CHR", 3, "shared", [4]], ["CA", 4, 5, 6], ["CI", 3], ["CHR", 1, "shared", [5]], ["CA", 2, 6, 6], ["CI", 1], ["FU", 7, [0, 1]], ["AN", 7, 0, 5], ["FU", 7, [1, 2]], ["AN", 7, 1, 4], ["FU", 7, [2, 3]], ["AN", 7, 2, 6], ["FU", 5, [0, 1]], ["SP", 5, 0, 96, [1], 1], ["AN", 5, 1, 2], ["FFSP", 5, 0, [1, 0], 1, 1], ["AN", 5, 1, 6], ["FU", 2, [0, 1]], ["SP", 2, 0, 6, [6], 1], ["AN", 2, 1, 2], ["FFSP", 2, 0, [1, 0], 1, 1], ["AN", 2, 1, 6], ["PR", 6, 0, "auto_unroll_max_step$16"]]]], "r": [[0.000304413], 0, 2.53851, 1661162547], "v": "v0.6"}
{"i": [["[\"get_expr\", \"fused_conv_expr_S1D1P1\", [64, 32, 16, 16, 32, 3, 3]]", "cuda -keys=cuda,gpu -max_num_threads=1024 -thread_warp_size=32", [-1, 16, 64, 49152, 2147483647, 1024, 8, 32], "", 0, []], [[], [["SP", 4, 0, 32, [1, 32, 1, 1], 1], ["SP", 4, 5, 16384, [1, 32, 2, 16], 1], ["SP", 4, 10, 288, [2, 1], 1], ["RE", 4, [0, 5, 1, 6, 2, 7, 10, 11, 3, 8, 12, 4, 9]], ["FSP", 5, 0, 0, 3], ["FSP", 5, 4, 1, 3], ["RE", 5, [0, 4, 1, 5, 2, 6, 3, 7]], ["CA", 4, 5, 5], ["CHR", 3, "shared", [4]], ["CA", 4, 5, 6], ["CI", 3], ["CHR", 1, "shared", [5]], ["CA", 2, 6, 6], ["CI", 1], ["FU", 7, [0, 1]], ["AN", 7, 0, 5], ["FU", 7, [1, 2]], ["AN", 7, 1, 4], ["FU", 7, [2, 3]], ["AN", 7, 2, 6], ["FU", 5, [0, 1]], ["SP", 5, 0, 8, [8], 1], ["AN", 5, 1, 2], ["FFSP", 5, 0, [1, 0], 1, 1], ["AN", 5, 1, 6], ["FU", 2, [0, 1]], ["SP", 2, 0, 256, [1], 1], ["AN", 2, 1, 2], ["FFSP", 2, 0, [1, 0], 1, 1], ["AN", 2, 1, 6], ["PR", 6, 0, "auto_unroll_max_step$0"]]]], "r": [[0.00192476], 0, 1.71575, 1661162548], "v": "v0.6"}
{"i": [["[\"get_expr\", \"fused_conv_expr_S1D1P1\", [64, 32, 16, 16, 32, 3, 3]]", "cuda -keys=cuda,gpu -max_num_threads=1024 -thread_warp_size=32", [-1, 16, 64, 49152, 2147483647, 1024, 8, 32], "", 0, []], [[], [["SP", 4, 0, 32, [1, 4, 2, 4], 1], ["SP", 4, 5, 16384, [2, 32, 2, 2], 1], ["SP", 4, 10, 288, [4, 2], 1], ["RE", 4, [0, 5, 1, 6, 2, 7, 10, 11, 3, 8, 12, 4, 9]], ["FSP", 5, 0, 0, 3], ["FSP", 5, 4, 1, 3], ["RE", 5, [0, 4, 1, 5, 2, 6, 3, 7]], ["CA", 4, 5, 5], ["CHR", 3, "shared", [4]], ["CA", 4, 5, 6], ["CI", 3], ["CHR", 1, "shared", [5]], ["CA", 2, 6, 6], ["CI", 1], ["FU", 7, [0, 1]], ["AN", 7, 0, 5], ["FU", 7, [1, 2]], ["AN", 7, 1, 4], ["FU", 7, [2, 3]], ["AN", 7, 2, 6], ["FU", 5, [0, 1]], ["SP", 5, 0, 32, [16], 1], ["AN", 5, 1, 2], ["FFSP", 5, 0, [1, 0], 1, 1], ["AN", 5, 1, 6], ["FU", 2, [0, 1]], ["SP", 2, 0, 32, [1], 1], ["AN", 2, 1, 2], ["FFSP", 2, 0, [1, 0], 1, 1], ["AN", 2, 1, 6], ["PR", 6, 0, "auto_unroll_max_step$0"]]]], "r": [[0.000153742], 0, 2.19283, 1661162550], "v": "v0.6"}
{"i": [["[\"get_expr\", \"fused_conv_expr_S1D1P1\", [64, 32, 16, 16, 32, 3, 3]]", "cuda -keys=cuda,gpu -max_num_threads=1024 -thread_warp_size=32", [-1, 16, 64, 49152, 2147483647, 1024, 8, 32], "", 0, []], [[], [["SP", 4, 0, 32, [1, 4, 2, 4], 1], ["SP", 4, 5, 16384, [2, 32, 2, 2], 1], ["SP", 4, 10, 288, [4, 2], 1], ["RE", 4, [0, 5, 1, 6, 2, 7, 10, 11, 3, 8, 12, 4, 9]], ["FSP", 5, 0, 0, 3], ["FSP", 5, 4, 1, 3], ["RE", 5, [0, 4, 1, 5, 2, 6, 3, 7]], ["CA", 4, 5, 5], ["CHR", 3, "shared", [4]], ["CA", 4, 5, 6], ["CI", 3], ["CHR", 1, "shared", [5]], ["CA", 2, 6, 6], ["CI", 1], ["FU", 7, [0, 1]], ["AN", 7, 0, 5], ["FU", 7, [1, 2]], ["AN", 7, 1, 4], ["FU", 7, [2, 3]], ["AN", 7, 2, 6], ["FU", 5, [0, 1]], ["SP", 5, 0, 32, [16], 1], ["AN", 5, 1, 2], ["FFSP", 5, 0, [1, 0], 1, 1], ["AN", 5, 1, 6], ["FU", 2, [0, 1]], ["SP", 2, 0, 32, [1], 1], ["AN", 2, 1, 2], ["FFSP", 2, 0, [1, 0], 1, 1], ["AN", 2, 1, 6], ["PR", 6, 0, "auto_unroll_max_step$64"]]]], "r": [[0.000126147], 0, 2.38821, 1661162551], "v": "v0.6"}
{"i": [["[\"get_expr\", \"fused_conv_expr_S1D1P1\", [64, 32, 16, 16, 32, 3, 3]]", "cuda -keys=cuda,gpu -max_num_threads=1024 -thread_warp_size=32", [-1, 16, 64, 49152, 2147483647, 1024, 8, 32], "", 0, []], [[], [["SP", 4, 0, 32, [4, 1, 2, 1], 1], ["SP", 4, 5, 16384, [1, 32, 2, 2], 1], ["SP", 4, 10, 288, [1, 16], 1], ["RE", 4, [0, 5, 1, 6, 2, 7, 10, 11, 3, 8, 12, 4, 9]], ["FSP", 5, 0, 0, 3], ["FSP", 5, 4, 1, 3], ["RE", 5, [0, 4, 1, 5, 2, 6, 3, 7]], ["CA", 4, 5, 5], ["CHR", 3, "shared", [4]], ["CA", 4, 5, 6], ["CI", 3], ["CHR", 1, "shared", [5]], ["CA", 2, 6, 6], ["CI", 1], ["FU", 7, [0, 1]], ["AN", 7, 0, 5], ["FU", 7, [1, 2]], ["AN", 7, 1, 4], ["FU", 7, [2, 3]], ["AN", 7, 2, 6], ["FU", 5, [0, 1]], ["SP", 5, 0, 32, [1], 1], ["AN", 5, 1, 2], ["FFSP", 5, 0, [1, 0], 1, 1], ["AN", 5, 1, 6], ["FU", 2, [0, 1]], ["SP", 2, 0, 64, [16], 1], ["AN", 2, 1, 2], ["FFSP", 2, 0, [1, 0], 1, 1], ["AN", 2, 1, 6], ["PR", 6, 0, "auto_unroll_max_step$0"]]]], "r": [[0.000212135], 0, 2.49052, 1661162552], "v": "v0.6"}
{"i": [["[\"get_expr\", \"fused_conv_expr_S1D1P1\", [64, 32, 16, 16, 32, 3, 3]]", "cuda -keys=cuda,gpu -max_num_threads=1024 -thread_warp_size=32", [-1, 16, 64, 49152, 2147483647, 1024, 8, 32], "", 0, []], [[], [["SP", 4, 0, 32, [4, 1, 2, 2], 1], ["SP", 4, 5, 16384, [1, 256, 32, 1], 1], ["SP", 4, 10, 288, [1, 1], 1], ["RE", 4, [0, 5, 1, 6, 2, 7, 10, 11, 3, 8, 12, 4, 9]], ["FSP", 5, 0, 0, 3], ["FSP", 5, 4, 1, 3], ["RE", 5, [0, 4, 1, 5, 2, 6, 3, 7]], ["CA", 4, 5, 5], ["CHR", 3, "shared", [4]], ["CA", 4, 5, 6], ["CI", 3], ["CHR", 1, "shared", [5]], ["CA", 2, 6, 6], ["CI", 1], ["FU", 7, [0, 1]], ["AN", 7, 0, 5], ["FU", 7, [1, 2]], ["AN", 7, 1, 4], ["FU", 7, [2, 3]], ["AN", 7, 2, 6], ["FU", 5, [0, 1]], ["SP", 5, 0, 12, [1], 1], ["AN", 5, 1, 2], ["FFSP", 5, 0, [1, 0], 1, 1], ["AN", 5, 1, 6], ["FU", 2, [0, 1]], ["SP", 2, 0, 3, [3], 1], ["AN", 2, 1, 2], ["FFSP", 2, 0, [1, 0], 1, 1], ["AN", 2, 1, 6], ["PR", 6, 0, "auto_unroll_max_step$512"]]]], "r": [[0.00638345], 0, 3.81358, 1661162554], "v": "v0.6"}
{"i": [["[\"get_expr\", \"fused_conv_expr_S1D1P1\", [64, 32, 16, 16, 32, 3, 3]]", "cuda -keys=cuda,gpu -max_num_threads=1024 -thread_warp_size=32", [-1, 16, 64, 49152, 2147483647, 1024, 8, 32], "", 0, []], [[], [["SP", 4, 0, 32, [32, 1, 1, 1], 1], ["SP", 4, 5, 16384, [1, 4, 4, 1], 1], ["SP", 4, 10, 288, [18, 1], 1], ["RE", 4, [0, 5, 1, 6, 2, 7, 10, 11, 3, 8, 12, 4, 9]], ["FSP", 5, 0, 0, 3], ["FSP", 5, 4, 1, 3], ["RE", 5, [0, 4, 1, 5, 2, 6, 3, 7]], ["CA", 4, 5, 5], ["CHR", 3, "shared", [4]], ["CA", 4, 5, 6], ["CI", 3], ["CHR", 1, "shared", [5]], ["CA", 2, 6, 6], ["CI", 1], ["FU", 7, [0, 1]], ["AN", 7, 0, 5], ["FU", 7, [1, 2]], ["AN", 7, 1, 4], ["FU", 7, [2, 3]], ["AN", 7, 2, 6], ["FU", 5, [0, 1]], ["SP", 5, 0, 36, [1], 1], ["AN", 5, 1, 2], ["FFSP", 5, 0, [1, 0], 1, 1], ["AN", 5, 1, 6], ["FU", 2, [0, 1]], ["SP", 2, 0, 72, [1], 1], ["AN", 2, 1, 2], ["FFSP", 2, 0, [1, 0], 1, 1], ["AN", 2, 1, 6], ["PR", 6, 0, "auto_unroll_max_step$16"]]]], "r": [[0.000724436], 0, 2.44983, 1661162555], "v": "v0.6"}
{"i": [["[\"get_expr\", \"fused_conv_expr_S1D1P1\", [64, 32, 16, 16, 32, 3, 3]]", "cuda -keys=cuda,gpu -max_num_threads=1024 -thread_warp_size=32", [-1, 16, 64, 49152, 2147483647, 1024, 8, 32], "", 0, []], [[], [["SP", 4, 0, 32, [1, 8, 1, 4], 1], ["SP", 4, 5, 16384, [8, 4, 1, 2], 1], ["SP", 4, 10, 288, [6, 1], 1], ["RE", 4, [0, 5, 1, 6, 2, 7, 10, 11, 3, 8, 12, 4, 9]], ["FSP", 5, 0, 0, 3], ["FSP", 5, 4, 1, 3], ["RE", 5, [0, 4, 1, 5, 2, 6, 3, 7]], ["CA", 4, 5, 5], ["CHR", 3, "shared", [4]], ["CA", 4, 5, 6], ["CI", 3], ["CHR", 1, "shared", [5]], ["CA", 2, 6, 6], ["CI", 1], ["FU", 7, [0, 1]], ["AN", 7, 0, 5], ["FU", 7, [1, 2]], ["AN", 7, 1, 4], ["FU", 7, [2, 3]], ["AN", 7, 2, 6], ["FU", 5, [0, 1]], ["SP", 5, 0, 24, [1], 1], ["AN", 5, 1, 2], ["FFSP", 5, 0, [1, 0], 1, 1], ["AN", 5, 1, 6], ["FU", 2, [0, 1]], ["SP", 2, 0, 12, [12], 1], ["AN", 2, 1, 2], ["FFSP", 2, 0, [1, 0], 1, 1], ["AN", 2, 1, 6], ["PR", 6, 0, "auto_unroll_max_step$0"]]]], "r": [[9.15821e-05], 0, 2.3835, 1661162557], "v": "v0.6"}
{"i": [["[\"get_expr\", \"fused_conv_expr_S1D1P1\", [64, 32, 16, 16, 32, 3, 3]]", "cuda -keys=cuda,gpu -max_num_threads=1024 -thread_warp_size=32", [-1, 16, 64, 49152, 2147483647, 1024, 8, 32], "", 0, []], [[], [["SP", 4, 0, 32, [1, 1, 8, 2], 1], ["SP", 4, 5, 16384, [1, 32, 2, 1], 1], ["SP", 4, 10, 288, [1, 16], 1], ["RE", 4, [0, 5, 1, 6, 2, 7, 10, 11, 3, 8, 12, 4, 9]], ["FSP", 5, 0, 0, 3], ["FSP", 5, 4, 1, 3], ["RE", 5, [0, 4, 1, 5, 2, 6, 3, 7]], ["CA", 4, 5, 5], ["CHR", 3, "shared", [4]], ["CA", 4, 5, 6], ["CI", 3], ["CHR", 1, "shared", [5]], ["CA", 2, 6, 6], ["CI", 1], ["FU", 7, [0, 1]], ["AN", 7, 0, 5], ["FU", 7, [1, 2]], ["AN", 7, 1, 4], ["FU", 7, [2, 3]], ["AN", 7, 2, 6], ["FU", 5, [0, 1]], ["SP", 5, 0, 256, [1], 1], ["AN", 5, 1, 2], ["FFSP", 5, 0, [1, 0], 1, 1], ["AN", 5, 1, 6], ["FU", 2, [0, 1]], ["SP", 2, 0, 32, [1], 1], ["AN", 2, 1, 2], ["FFSP", 2, 0, [1, 0], 1, 1], ["AN", 2, 1, 6], ["PR", 6, 0, "auto_unroll_max_step$1024"]]]], "r": [[0.000109738], 0, 3.26816, 1661162559], "v": "v0.6"}
{"i": [["[\"get_expr\", \"fused_conv_expr_S1D1P1\", [64, 32, 16, 16, 32, 3, 3]]", "cuda -keys=cuda,gpu -max_num_threads=1024 -thread_warp_size=32", [-1, 16, 64, 49152, 2147483647, 1024, 8, 32], "", 0, []], [[], [["SP", 4, 0, 32, [1, 16, 1, 2], 1], ["SP", 4, 5, 16384, [2, 4, 4, 4], 1], ["SP", 4, 10, 288, [4, 12], 1], ["RE", 4, [0, 5, 1, 6, 2, 7, 10, 11, 3, 8, 12, 4, 9]], ["FSP", 5, 0, 0, 3], ["FSP", 5, 4, 1, 3], ["RE", 5, [0, 4, 1, 5, 2, 6, 3, 7]], ["CA", 4, 5, 5], ["CHR", 3, "shared", [4]], ["CA", 4, 5, 6], ["CI", 3], ["CHR", 1, "shared", [5]], ["CA", 2, 6, 6], ["CI", 1], ["FU", 7, [0, 1]], ["AN", 7, 0, 5], ["FU", 7, [1, 2]], ["AN", 7, 1, 4], ["FU", 7, [2, 3]], ["AN", 7, 2, 6], ["FU", 5, [0, 1]], ["SP", 5, 0, 48, [1], 1], ["AN", 5, 1, 2], ["FFSP", 5, 0, [1, 0], 1, 1], ["AN", 5, 1, 6], ["FU", 2, [0, 1]], ["SP", 2, 0, 768, [32], 1], ["AN", 2, 1, 2], ["FFSP", 2, 0, [1, 0], 1, 1], ["AN", 2, 1, 6], ["PR", 6, 0, "auto_unroll_max_step$64"]]]], "r": [[0.00018243], 0, 4.0062, 1661162561], "v": "v0.6"}
{"i": [["[\"get_expr\", \"fused_conv_expr_S1D1P1\", [64, 32, 16, 16, 32, 3, 3]]", "cuda -keys=cuda,gpu -max_num_threads=1024 -thread_warp_size=32", [-1, 16, 64, 49152, 2147483647, 1024, 8, 32], "", 0, []], [[], [["SP", 4, 0, 32, [1, 1, 1, 4], 1], ["SP", 4, 5, 16384, [1, 16, 1, 32], 1], ["SP", 4, 10, 288, [4, 2], 1], ["RE", 4, [0, 5, 1, 6, 2, 7, 10, 11, 3, 8, 12, 4, 9]], ["FSP", 5, 0, 0, 3], ["FSP", 5, 4, 1, 3], ["RE", 5, [0, 4, 1, 5, 2, 6, 3, 7]], ["CA", 4, 5, 5], ["CHR", 3, "shared", [4]], ["CA", 4, 5, 6], ["CI", 3], ["CHR", 1, "shared", [5]], ["CA", 2, 6, 6], ["CI", 1], ["FU", 7, [0, 1]], ["AN", 7, 0, 5], ["FU", 7, [1, 2]], ["AN", 7, 1, 4], ["FU", 7, [2, 3]], ["AN", 7, 2, 6], ["FU", 5, [0, 1]], ["SP", 5, 0, 32, [16], 1], ["AN", 5, 1, 2], ["FFSP", 5, 0, [1, 0], 1, 1], ["AN", 5, 1, 6], ["FU", 2, [0, 1]], ["SP", 2, 0, 256, [1], 1], ["AN", 2, 1, 2], ["FFSP", 2, 0, [1, 0], 1, 1], ["AN", 2, 1, 6], ["PR", 6, 0, "auto_unroll_max_step$16"]]]], "r": [[0.00152435], 0, 2.58986, 1661162563], "v": "v0.6"}
{"i": [["[\"get_expr\", \"fused_conv_expr_S1D1P1\", [64, 32, 16, 16, 32, 3, 3]]", "cuda -keys=cuda,gpu -max_num_threads=1024 -thread_warp_size=32", [-1, 16, 64, 49152, 2147483647, 1024, 8, 32], "", 0, []], [[], [["SP", 4, 0, 32, [2, 16, 1, 1], 1], ["SP", 4, 5, 16384, [1, 32, 2, 16], 1], ["SP", 4, 10, 288, [2, 4], 1], ["RE", 4, [0, 5, 1, 6, 2, 7, 10, 11, 3, 8, 12, 4, 9]], ["FSP", 5, 0, 0, 3], ["FSP", 5, 4, 1, 3], ["RE", 5, [0, 4, 1, 5, 2, 6, 3, 7]], ["CA", 4, 5, 5], ["CHR", 3, "shared", [4]], ["CA", 4, 5, 6], ["CI", 3], ["CHR", 1, "shared", [5]], ["CA", 2, 6, 6], ["CI", 1], ["FU", 7, [0, 1]], ["AN", 7, 0, 5], ["FU", 7, [1, 2]], ["AN", 7, 1, 4], ["FU", 7, [2, 3]], ["AN", 7, 2, 6], ["FU", 5, [0, 1]], ["SP", 5, 0, 8, [4], 1], ["AN", 5, 1, 2], ["FFSP", 5, 0, [1, 0], 1, 1], ["AN", 5, 1, 6], ["FU", 2, [0, 1]], ["SP", 2, 0, 256, [1], 1], ["AN", 2, 1, 2], ["FFSP", 2, 0, [1, 0], 1, 1], ["AN", 2, 1, 6], ["PR", 6, 0, "auto_unroll_max_step$0"]]]], "r": [[0.0010462], 0, 2.58799, 1661162565], "v": "v0.6"}
{"i": [["[\"get_expr\", \"fused_conv_expr_S1D1P1\", [64, 32, 16, 16, 32, 3, 3]]", "cuda -keys=cuda,gpu -max_num_threads=1024 -thread_warp_size=32", [-1, 16, 64, 49152, 2147483647, 1024, 8, 32], "", 0, []], [[], [["SP", 4, 0, 32, [4, 4, 1, 2], 1], ["SP", 4, 5, 16384, [1, 1, 1, 1], 1], ["SP", 4, 10, 288, [72, 1], 1], ["RE", 4, [0, 5, 1, 6, 2, 7, 10, 11, 3, 8, 12, 4, 9]], ["FSP", 5, 0, 0, 3], ["FSP", 5, 4, 1, 3], ["RE", 5, [0, 4, 1, 5, 2, 6, 3, 7]], ["CA", 4, 5, 5], ["CHR", 3, "shared", [4]], ["CA", 4, 5, 6], ["CI", 3], ["CHR", 1, "shared", [5]], ["CA", 2, 6, 6], ["CI", 1], ["FU", 7, [0, 1]], ["AN", 7, 0, 5], ["FU", 7, [1, 2]], ["AN", 7, 1, 4], ["FU", 7, [2, 3]], ["AN", 7, 2, 6], ["FU", 5, [0, 1]], ["SP", 5, 0, 144, [1], 1], ["AN", 5, 1, 2], ["FFSP", 5, 0, [1, 0], 1, 1], ["AN", 5, 1, 6], ["FU", 2, [0, 1]], ["SP", 2, 0, 72, [36], 1], ["AN", 2, 1, 2], ["FFSP", 2, 0, [1, 0], 1, 1], ["AN", 2, 1, 6], ["PR", 6, 0, "auto_unroll_max_step$512"]]]], "r": [[0.00248545], 0, 1.92429, 1661162566], "v": "v0.6"}
{"i": [["[\"get_expr\", \"fused_conv_expr_S1D1P1\", [64, 32, 16, 16, 32, 3, 3]]", "cuda -keys=cuda,gpu -max_num_threads=1024 -thread_warp_size=32", [-1, 16, 64, 49152, 2147483647, 1024, 8, 32], "", 0, []], [[], [["SP", 4, 0, 32, [2, 8, 1, 2], 1], ["SP", 4, 5, 16384, [1, 4, 4, 1], 1], ["SP", 4, 10, 288, [3, 6], 1], ["RE", 4, [0, 5, 1, 6, 2, 7, 10, 11, 3, 8, 12, 4, 9]], ["FSP", 5, 0, 0, 3], ["FSP", 5, 4, 1, 3], ["RE", 5, [0, 4, 1, 5, 2, 6, 3, 7]], ["CA", 4, 5, 5], ["CHR", 3, "shared", [4]], ["CA", 4, 5, 6], ["CI", 3], ["CHR", 1, "shared", [5]], ["CA", 2, 6, 6], ["CI", 1], ["FU", 7, [0, 1]], ["AN", 7, 0, 5], ["FU", 7, [1, 2]], ["AN", 7, 1, 4], ["FU", 7, [2, 3]], ["AN", 7, 2, 6], ["FU", 5, [0, 1]], ["SP", 5, 0, 36, [1], 1], ["AN", 5, 1, 2], ["FFSP", 5, 0, [1, 0], 1, 1], ["AN", 5, 1, 6], ["FU", 2, [0, 1]], ["SP", 2, 0, 72, [1], 1], ["AN", 2, 1, 2], ["FFSP", 2, 0, [1, 0], 1, 1], ["AN", 2, 1, 6], ["PR", 6, 0, "auto_unroll_max_step$0"]]]], "r": [[5.645e-05], 0, 2.00359, 1661162567], "v": "v0.6"}
{"i": [["[\"get_expr\", \"fused_conv_expr_S1D1P1\", [64, 32, 16, 16, 32, 3, 3]]", "cuda -keys=cuda,gpu -max_num_threads=1024 -thread_warp_size=32", [-1, 16, 64, 49152, 2147483647, 1024, 8, 32], "", 0, []], [[], [["SP", 4, 0, 32, [1, 32, 1, 1], 1], ["SP", 4, 5, 16384, [1, 16, 32, 8], 1], ["SP", 4, 10, 288, [2, 1], 1], ["RE", 4, [0, 5, 1, 6, 2, 7, 10, 11, 3, 8, 12, 4, 9]], ["FSP", 5, 0, 0, 3], ["FSP", 5, 4, 1, 3], ["RE", 5, [0, 4, 1, 5, 2, 6, 3, 7]], ["CA", 4, 5, 5], ["CHR", 3, "shared", [4]], ["CA", 4, 5, 6], ["CI", 3], ["CHR", 1, "shared", [5]], ["CA", 2, 6, 6], ["CI", 1], ["FU", 7, [0, 1]], ["AN", 7, 0, 5], ["FU", 7, [1, 2]], ["AN", 7, 1, 4], ["FU", 7, [2, 3]], ["AN", 7, 2, 6], ["FU", 5, [0, 1]], ["SP", 5, 0, 2, [1], 1], ["AN", 5, 1, 2], ["FFSP", 5, 0, [1, 0], 1, 1], ["AN", 5, 1, 6], ["FU", 2, [0, 1]], ["SP", 2, 0, 512, [8], 1], ["AN", 2, 1, 2], ["FFSP", 2, 0, [1, 0], 1, 1], ["AN", 2, 1, 6], ["PR", 6, 0, "auto_unroll_max_step$64"]]]], "r": [[0.0103157], 0, 2.28729, 1661162568], "v": "v0.6"}
{"i": [["[\"get_expr\", \"fused_conv_expr_S1D1P1\", [64, 32, 16, 16, 32, 3, 3]]", "cuda -keys=cuda,gpu -max_num_threads=1024 -thread_warp_size=32", [-1, 16, 64, 49152, 2147483647, 1024, 8, 32], "", 0, []], [[], [["SP", 4, 0, 32, [2, 8, 1, 1], 1], ["SP", 4, 5, 16384, [1, 16, 1, 2], 1], ["SP", 4, 10, 288, [2, 2], 1], ["RE", 4, [0, 5, 1, 6, 2, 7, 10, 11, 3, 8, 12, 4, 9]], ["FSP", 5, 0, 0, 3], ["FSP", 5, 4, 1, 3], ["RE", 5, [0, 4, 1, 5, 2, 6, 3, 7]], ["CA", 4, 5, 5], ["CHR", 3, "shared", [4]], ["CA", 4, 5, 6], ["CI", 3], ["CHR", 1, "shared", [5]], ["CA", 2, 6, 6], ["CI", 1], ["FU", 7, [0, 1]], ["AN", 7, 0, 5], ["FU", 7, [1, 2]], ["AN", 7, 1, 4], ["FU", 7, [2, 3]], ["AN", 7, 2, 6], ["FU", 5, [0, 1]], ["SP", 5, 0, 4, [1], 1], ["AN", 5, 1, 2], ["FFSP", 5, 0, [1, 0], 1, 1], ["AN", 5, 1, 6], ["FU", 2, [0, 1]], ["SP", 2, 0, 32, [1], 1], ["AN", 2, 1, 2], ["FFSP", 2, 0, [1, 0], 1, 1], ["AN", 2, 1, 6], ["PR", 6, 0, "auto_unroll_max_step$1024"]]]], "r": [[7.30331e-05], 0, 2.11699, 1661162569], "v": "v0.6"}
{"i": [["[\"get_expr\", \"fused_conv_expr_S1D1P1\", [64, 32, 16, 16, 32, 3, 3]]", "cuda -keys=cuda,gpu -max_num_threads=1024 -thread_warp_size=32", [-1, 16, 64, 49152, 2147483647, 1024, 8, 32], "", 0, []], [[], [["SP", 4, 0, 32, [2, 8, 1, 2], 1], ["SP", 4, 5, 16384, [4, 2, 1, 16], 1], ["SP", 4, 10, 288, [1, 9], 1], ["RE", 4, [0, 5, 1, 6, 2, 7, 10, 11, 3, 8, 12, 4, 9]], ["FSP", 5, 0, 0, 3], ["FSP", 5, 4, 1, 3], ["RE", 5, [0, 4, 1, 5, 2, 6, 3, 7]], ["CA", 4, 5, 5], ["CHR", 3, "shared", [4]], ["CA", 4, 5, 6], ["CI", 3], ["CHR", 1, "shared", [5]], ["CA", 2, 6, 6], ["CI", 1], ["FU", 7, [0, 1]], ["AN", 7, 0, 5], ["FU", 7, [1, 2]], ["AN", 7, 1, 4], ["FU", 7, [2, 3]], ["AN", 7, 2, 6], ["FU", 5, [0, 1]], ["SP", 5, 0, 36, [4], 1], ["AN", 5, 1, 2], ["FFSP", 5, 0, [1, 0], 1, 1], ["AN", 5, 1, 6], ["FU", 2, [0, 1]], ["SP", 2, 0, 144, [1], 1], ["AN", 2, 1, 2], ["FFSP", 2, 0, [1, 0], 1, 1], ["AN", 2, 1, 6], ["PR", 6, 0, "auto_unroll_max_step$64"]]]], "r": [[0.000607567], 0, 2.76168, 1661162571], "v": "v0.6"}
{"i": [["[\"get_expr\", \"fused_conv_expr_S1D1P1\", [64, 32, 16, 16, 32, 3, 3]]", "cuda -keys=cuda,gpu -max_num_threads=1024 -thread_warp_size=32", [-1, 16, 64, 49152, 2147483647, 1024, 8, 32], "", 0, []], [[], [["SP", 4, 0, 32, [1, 4, 1, 1], 1], ["SP", 4, 5, 16384, [4, 8, 1, 16], 1], ["SP", 4, 10, 288, [1, 12], 1], ["RE", 4, [0, 5, 1, 6, 2, 7, 10, 11, 3, 8, 12, 4, 9]], ["FSP", 5, 0, 0, 3], ["FSP", 5, 4, 1, 3], ["RE", 5, [0, 4, 1, 5, 2, 6, 3, 7]], ["CA", 4, 5, 5], ["CHR", 3, "shared", [4]], ["CA", 4, 5, 6], ["CI", 3], ["CHR", 1, "shared", [5]], ["CA", 2, 6, 6], ["CI", 1], ["FU", 7, [0, 1]], ["AN", 7, 0, 5], ["FU", 7, [1, 2]], ["AN", 7, 1, 4], ["FU", 7, [2, 3]], ["AN", 7, 2, 6], ["FU", 5, [0, 1]], ["SP", 5, 0, 24, [24], 1], ["AN", 5, 1, 2], ["FFSP", 5, 0, [1, 0], 1, 1], ["AN", 5, 1, 6], ["FU", 2, [0, 1]], ["SP", 2, 0, 192, [1], 1], ["AN", 2, 1, 2], ["FFSP", 2, 0, [1, 0], 1, 1], ["AN", 2, 1, 6], ["PR", 6, 0, "auto_unroll_max_step$64"]]]], "r": [[0.00164991], 0, 1.98161, 1661162572], "v": "v0.6"}
{"i": [["[\"get_expr\", \"fused_conv_expr_S1D1P1\", [64, 32, 16, 16, 32, 3, 3]]", "cuda -keys=cuda,gpu -max_num_threads=1024 -thread_warp_size=32", [-1, 16, 64, 49152, 2147483647, 1024, 8, 32], "", 0, []], [[], [["SP", 4, 0, 32, [1, 16, 1, 2], 1], ["SP", 4, 5, 16384, [2, 2, 32, 1], 1], ["SP", 4, 10, 288, [9, 8], 1], ["RE", 4, [0, 5, 1, 6, 2, 7, 10, 11, 3, 8, 12, 4, 9]], ["FSP", 5, 0, 0, 3], ["FSP", 5, 4, 1, 3], ["RE", 5, [0, 4, 1, 5, 2, 6, 3, 7]], ["CA", 4, 5, 5], ["CHR", 3, "shared", [4]], ["CA", 4, 5, 6], ["CI", 3], ["CHR", 1, "shared", [5]], ["CA", 2, 6, 6], ["CI", 1], ["FU", 7, [0, 1]], ["AN", 7, 0, 5], ["FU", 7, [1, 2]], ["AN", 7, 1, 4], ["FU", 7, [2, 3]], ["AN", 7, 2, 6], ["FU", 5, [0, 1]], ["SP", 5, 0, 144, [1], 1], ["AN", 5, 1, 2], ["FFSP", 5, 0, [1, 0], 1, 1], ["AN", 5, 1, 6], ["FU", 2, [0, 1]], ["SP", 2, 0, 2304, [2], 1], ["AN", 2, 1, 2], ["FFSP", 2, 0, [1, 0], 1, 1], ["AN", 2, 1, 6], ["PR", 6, 0, "auto_unroll_max_step$16"]]]], "r": [[0.000472561], 0, 2.37732, 1661162573], "v": "v0.6"}
{"i": [["[\"get_expr\", \"fused_conv_expr_S1D1P1\", [64, 32, 16, 16, 32, 3, 3]]", "cuda -keys=cuda,gpu -max_num_threads=1024 -thread_warp_size=32", [-1, 16, 64, 49152, 2147483647, 1024, 8, 32], "", 0, []], [[], [["SP", 4, 0, 32, [1, 1, 8, 1], 1], ["SP", 4, 5, 16384, [1, 32, 16, 2], 1], ["SP", 4, 10, 288, [4, 2], 1], ["RE", 4, [0, 5, 1, 6, 2, 7, 10, 11, 3, 8, 12, 4, 9]], ["FSP", 5, 0, 0, 3], ["FSP", 5, 4, 1, 3], ["RE", 5, [0, 4, 1, 5, 2, 6, 3, 7]], ["CA", 4, 5, 5], ["CHR", 3, "shared", [4]], ["CA", 4, 5, 6], ["CI", 3], ["CHR", 1, "shared", [5]], ["CA", 2, 6, 6], ["CI", 1], ["FU", 7, [0, 1]], ["AN", 7, 0, 5], ["FU", 7, [1, 2]], ["AN", 7, 1, 4], ["FU", 7, [2, 3]], ["AN", 7, 2, 6], ["FU", 5, [0, 1]], ["SP", 5, 0, 64, [1], 1], ["AN", 5, 1, 2], ["FFSP", 5, 0, [1, 0], 1, 1], ["AN", 5, 1, 6], ["FU", 2, [0, 1]], ["SP", 2, 0, 128, [1], 1], ["AN", 2, 1, 2], ["FFSP", 2, 0, [1, 0], 1, 1], ["AN", 2, 1, 6], ["PR", 6, 0, "auto_unroll_max_step$64"]]]], "r": [[0.00219387], 0, 1.86219, 1661162574], "v": "v0.6"}
{"i": [["[\"get_expr\", \"fused_conv_expr_S1D1P1\", [64, 32, 16, 16, 32, 3, 3]]", "cuda -keys=cuda,gpu -max_num_threads=1024 -thread_warp_size=32", [-1, 16, 64, 49152, 2147483647, 1024, 8, 32], "", 0, []], [[], [["SP", 4, 0, 32, [1, 1, 32, 1], 1], ["SP", 4, 5, 16384, [2, 8, 32, 2], 1], ["SP", 4, 10, 288, [4, 2], 1], ["RE", 4, [0, 5, 1, 6, 2, 7, 10, 11, 3, 8, 12, 4, 9]], ["FSP", 5, 0, 0, 3], ["FSP", 5, 4, 1, 3], ["RE", 5, [0, 4, 1, 5, 2, 6, 3, 7]], ["CA", 4, 5, 5], ["CHR", 3, "shared", [4]], ["CA", 4, 5, 6], ["CI", 3], ["CHR", 1, "shared", [5]], ["CA", 2, 6, 6], ["CI", 1], ["FU", 7, [0, 1]], ["AN", 7, 0, 5], ["FU", 7, [1, 2]], ["AN", 7, 1, 4], ["FU", 7, [2, 3]], ["AN", 7, 2, 6], ["FU", 5, [0, 1]], ["SP", 5, 0, 64, [1], 1], ["AN", 5, 1, 2], ["FFSP", 5, 0, [1, 0], 1, 1], ["AN", 5, 1, 6], ["FU", 2, [0, 1]], ["SP", 2, 0, 128, [1], 1], ["AN", 2, 1, 2], ["FFSP", 2, 0, [1, 0], 1, 1], ["AN", 2, 1, 6], ["PR", 6, 0, "auto_unroll_max_step$64"]]]], "r": [[0.0254851], 0, 2.79804, 1661162575], "v": "v0.6"}
{"i": [["[\"get_expr\", \"fused_conv_expr_S1D1P1\", [64, 32, 16, 16, 32, 3, 3]]", "cuda -keys=cuda,gpu -max_num_threads=1024 -thread_warp_size=32", [-1, 16, 64, 49152, 2147483647, 1024, 8, 32], "", 0, []], [[], [["SP", 4, 0, 32, [4, 2, 1, 2], 1], ["SP", 4, 5, 16384, [1, 16, 2, 8], 1], ["SP", 4, 10, 288, [24, 1], 1], ["RE", 4, [0, 5, 1, 6, 2, 7, 10, 11, 3, 8, 12, 4, 9]], ["FSP", 5, 0, 0, 3], ["FSP", 5, 4, 1, 3], ["RE", 5, [0, 4, 1, 5, 2, 6, 3, 7]], ["CA", 4, 5, 5], ["CHR", 3, "shared", [4]], ["CA", 4, 5, 6], ["CI", 3], ["CHR", 1, "shared", [5]], ["CA", 2, 6, 6], ["CI", 1], ["FU", 7, [0, 1]], ["AN", 7, 0, 5], ["FU", 7, [1, 2]], ["AN", 7, 1, 4], ["FU", 7, [2, 3]], ["AN", 7, 2, 6], ["FU", 5, [0, 1]], ["SP", 5, 0, 48, [1], 1], ["AN", 5, 1, 2], ["FFSP", 5, 0, [1, 0], 1, 1], ["AN", 5, 1, 6], ["FU", 2, [0, 1]], ["SP", 2, 0, 384, [2], 1], ["AN", 2, 1, 2], ["FFSP", 2, 0, [1, 0], 1, 1], ["AN", 2, 1, 6], ["PR", 6, 0, "auto_unroll_max_step$16"]]]], "r": [[0.000419187], 0, 2.47512, 1661162577], "v": "v0.6"}
{"i": [["[\"get_expr\", \"fused_conv_expr_S1D1P1\", [64, 32, 16, 16, 32, 3, 3]]", "cuda -keys=cuda,gpu -max_num_threads=1024 -thread_warp_size=32", [-1, 16, 64, 49152, 2147483647, 1024, 8, 32], "", 0, []], [[], [["SP", 4, 0, 32, [2, 8, 1, 1], 1], ["SP", 4, 5, 16384, [4, 8, 4, 16], 1], ["SP", 4, 10, 288, [1, 2], 1], ["RE", 4, [0, 5, 1, 6, 2, 7, 10, 11, 3, 8, 12, 4, 9]], ["FSP", 5, 0, 0, 3], ["FSP", 5, 4, 1, 3], ["RE", 5, [0, 4, 1, 5, 2, 6, 3, 7]], ["CA", 4, 5, 5], ["CHR", 3, "shared", [4]], ["CA", 4, 5, 6], ["CI", 3], ["CHR", 1, "shared", [5]], ["CA", 2, 6, 6], ["CI", 1], ["FU", 7, [0, 1]], ["AN", 7, 0, 5], ["FU", 7, [1, 2]], ["AN", 7, 1, 4], ["FU", 7, [2, 3]], ["AN", 7, 2, 6], ["FU", 5, [0, 1]], ["SP", 5, 0, 2, [1], 1], ["AN", 5, 1, 2], ["FFSP", 5, 0, [1, 0], 1, 1], ["AN", 5, 1, 6], ["FU", 2, [0, 1]], ["SP", 2, 0, 128, [1], 1], ["AN", 2, 1, 2], ["FFSP", 2, 0, [1, 0], 1, 1], ["AN", 2, 1, 6], ["PR", 6, 0, "auto_unroll_max_step$512"]]]], "r": [[0.00201678], 0, 3.87489, 1661162579], "v": "v0.6"}
{"i": [["[\"get_expr\", \"fused_conv_expr_S1D1P1\", [64, 32, 16, 16, 32, 3, 3]]", "cuda -keys=cuda,gpu -max_num_threads=1024 -thread_warp_size=32", [-1, 16, 64, 49152, 2147483647, 1024, 8, 32], "", 0, []], [[], [["SP", 4, 0, 32, [1, 1, 1, 4], 1], ["SP", 4, 5, 16384, [4, 128, 2, 1], 1], ["SP", 4, 10, 288, [4, 1], 1], ["RE", 4, [0, 5, 1, 6, 2, 7, 10, 11, 3, 8, 12, 4, 9]], ["FSP", 5, 0, 0, 3], ["FSP", 5, 4, 1, 3], ["RE", 5, [0, 4, 1, 5, 2, 6, 3, 7]], ["CA", 4, 5, 5], ["CHR", 3, "shared", [4]], ["CA", 4, 5, 6], ["CI", 3], ["CHR", 1, "shared", [5]], ["CA", 2, 6, 6], ["CI", 1], ["FU", 7, [0, 1]], ["AN", 7, 0, 5], ["FU", 7, [1, 2]], ["AN", 7, 1, 4], ["FU", 7, [2, 3]], ["AN", 7, 2, 6], ["FU", 5, [0, 1]], ["SP", 5, 0, 16, [8], 1], ["AN", 5, 1, 2], ["FFSP", 5, 0, [1, 0], 1, 1], ["AN", 5, 1, 6], ["FU", 2, [0, 1]], ["SP", 2, 0, 8, [1], 1], ["AN", 2, 1, 2], ["FFSP", 2, 0, [1, 0], 1, 1], ["AN", 2, 1, 6], ["PR", 6, 0, "auto_unroll_max_step$512"]]]], "r": [[0.000334757], 0, 3.11311, 1661162581], "v": "v0.6"}
{"i": [["[\"get_expr\", \"fused_conv_expr_S1D1P1\", [64, 32, 16, 16, 32, 3, 3]]", "cuda -keys=cuda,gpu -max_num_threads=1024 -thread_warp_size=32", [-1, 16, 64, 49152, 2147483647, 1024, 8, 32], "", 0, []], [[], [["SP", 4, 0, 32, [4, 4, 1, 2], 1], ["SP", 4, 5, 16384, [1, 1, 1, 1], 1], ["SP", 4, 10, 288, [72, 1], 1], ["RE", 4, [0, 5, 1, 6, 2, 7, 10, 11, 3, 8, 12, 4, 9]], ["FSP", 5, 0, 0, 3], ["FSP", 5, 4, 1, 3], ["RE", 5, [0, 4, 1, 5, 2, 6, 3, 7]], ["CA", 4, 5, 5], ["CHR", 3, "shared", [4]], ["CA", 4, 5, 6], ["CI", 3], ["CHR", 1, "shared", [5]], ["CA", 2, 6, 6], ["CI", 1], ["FU", 7, [0, 1]], ["AN", 7, 0, 5], ["FU", 7, [1, 2]], ["AN", 7, 1, 4], ["FU", 7, [2, 3]], ["AN", 7, 2, 6], ["FU", 5, [0, 1]], ["SP", 5, 0, 144, [3], 1], ["AN", 5, 1, 2], ["FFSP", 5, 0, [1, 0], 1, 1], ["AN", 5, 1, 6], ["FU", 2, [0, 1]], ["SP", 2, 0, 72, [1], 1], ["AN", 2, 1, 2], ["FFSP", 2, 0, [1, 0], 1, 1], ["AN", 2, 1, 6], ["PR", 6, 0, "auto_unroll_max_step$512"]]]], "r": [[0.00120737], 0, 4.75207, 1661162583], "v": "v0.6"}
{"i": [["[\"get_expr\", \"fused_conv_expr_S1D1P1\", [64, 32, 16, 16, 32, 3, 3]]", "cuda -keys=cuda,gpu -max_num_threads=1024 -thread_warp_size=32", [-1, 16, 64, 49152, 2147483647, 1024, 8, 32], "", 0, []], [[], [["SP", 4, 0, 32, [1, 32, 1, 1], 1], ["SP", 4, 5, 16384, [4, 1, 32, 1], 1], ["SP", 4, 10, 288, [18, 2], 1], ["RE", 4, [0, 5, 1, 6, 2, 7, 10, 11, 3, 8, 12, 4, 9]], ["FSP", 5, 0, 0, 3], ["FSP", 5, 4, 1, 3], ["RE", 5, [0, 4, 1, 5, 2, 6, 3, 7]], ["CA", 4, 5, 5], ["CHR", 3, "shared", [4]], ["CA", 4, 5, 6], ["CI", 3], ["CHR", 1, "shared", [5]], ["CA", 2, 6, 6], ["CI", 1], ["FU", 7, [0, 1]], ["AN", 7, 0, 5], ["FU", 7, [1, 2]], ["AN", 7, 1, 4], ["FU", 7, [2, 3]], ["AN", 7, 2, 6], ["FU", 5, [0, 1]], ["SP", 5, 0, 18, [1], 1], ["AN", 5, 1, 2], ["FFSP", 5, 0, [1, 0], 1, 1], ["AN", 5, 1, 6], ["FU", 2, [0, 1]], ["SP", 2, 0, 576, [1], 1], ["AN", 2, 1, 2], ["FFSP", 2, 0, [1, 0], 1, 1], ["AN", 2, 1, 6], ["PR", 6, 0, "auto_unroll_max_step$64"]]]], "r": [[0.000272366], 0, 2.68249, 1661162584], "v": "v0.6"}
{"i": [["[\"get_expr\", \"fused_conv_expr_S1D1P1\", [64, 32, 16, 16, 32, 3, 3]]", "cuda -keys=cuda,gpu -max_num_threads=1024 -thread_warp_size=32", [-1, 16, 64, 49152, 2147483647, 1024, 8, 32], "", 0, []], [[], [["SP", 4, 0, 32, [2, 2, 2, 1], 1], ["SP", 4, 5, 16384, [1, 4, 16, 1], 1], ["SP", 4, 10, 288, [3, 6], 1], ["RE", 4, [0, 5, 1, 6, 2, 7, 10, 11, 3, 8, 12, 4, 9]], ["FSP", 5, 0, 0, 3], ["FSP", 5, 4, 1, 3], ["RE", 5, [0, 4, 1, 5, 2, 6, 3, 7]], ["CA", 4, 5, 5], ["CHR", 3, "shared", [4]], ["CA", 4, 5, 6], ["CI", 3], ["CHR", 1, "shared", [5]], ["CA", 2, 6, 6], ["CI", 1], ["FU", 7, [0, 1]], ["AN", 7, 0, 5], ["FU", 7, [1, 2]], ["AN", 7, 1, 4], ["FU", 7, [2, 3]], ["AN", 7, 2, 6], ["FU", 5, [0, 1]], ["SP", 5, 0, 36, [1], 1], ["AN", 5, 1, 2], ["FFSP", 5, 0, [1, 0], 1, 1], ["AN", 5, 1, 6], ["FU", 2, [0, 1]], ["SP", 2, 0, 144, [3], 1], ["AN", 2, 1, 2], ["FFSP", 2, 0, [1, 0], 1, 1], ["AN", 2, 1, 6], ["PR", 6, 0, "auto_unroll_max_step$16"]]]], "r": [[0.000826979], 0, 2.13825, 1661162585], "v": "v0.6"}
{"i": [["[\"get_expr\", \"fused_conv_expr_S1D1P1\", [64, 32, 16, 16, 32, 3, 3]]", "cuda -keys=cuda,gpu -max_num_threads=1024 -thread_warp_size=32", [-1, 16, 64, 49152, 2147483647, 1024, 8, 32], "", 0, []], [[], [["SP", 4, 0, 32, [1, 32, 1, 1], 1], ["SP", 4, 5, 16384, [2, 2, 1, 8], 1], ["SP", 4, 10, 288, [1, 12], 1], ["RE", 4, [0, 5, 1, 6, 2, 7, 10, 11, 3, 8, 12, 4, 9]], ["FSP", 5, 0, 0, 3], ["FSP", 5, 4, 1, 3], ["RE", 5, [0, 4, 1, 5, 2, 6, 3, 7]], ["CA", 4, 5, 5], ["CHR", 3, "shared", [4]], ["CA", 4, 5, 6], ["CI", 3], ["CHR", 1, "shared", [5]], ["CA", 2, 6, 6], ["CI", 1], ["FU", 7, [0, 1]], ["AN", 7, 0, 5], ["FU", 7, [1, 2]], ["AN", 7, 1, 4], ["FU", 7, [2, 3]], ["AN", 7, 2, 6], ["FU", 5, [0, 1]], ["SP", 5, 0, 6, [1], 1], ["AN", 5, 1, 2], ["FFSP", 5, 0, [1, 0], 1, 1], ["AN", 5, 1, 6], ["FU", 2, [0, 1]], ["SP", 2, 0, 48, [1], 1], ["AN", 2, 1, 2], ["FFSP", 2, 0, [1, 0], 1, 1], ["AN", 2, 1, 6], ["PR", 6, 0, "auto_unroll_max_step$64"]]]], "r": [[6.36586e-05], 0, 2.00837, 1661162587], "v": "v0.6"}
{"i": [["[\"get_expr\", \"fused_conv_expr_S1D1P1\", [64, 32, 16, 16, 32, 3, 3]]", "cuda -keys=cuda,gpu -max_num_threads=1024 -thread_warp_size=32", [-1, 16, 64, 49152, 2147483647, 1024, 8, 32], "", 0, []], [[], [["SP", 4, 0, 32, [4, 4, 1, 2], 1], ["SP", 4, 5, 16384, [1, 4, 4, 1], 1], ["SP", 4, 10, 288, [3, 6], 1], ["RE", 4, [0, 5, 1, 6, 2, 7, 10, 11, 3, 8, 12, 4, 9]], ["FSP", 5, 0, 0, 3], ["FSP", 5, 4, 1, 3], ["RE", 5, [0, 4, 1, 5, 2, 6, 3, 7]], ["CA", 4, 5, 5], ["CHR", 3, "shared", [4]], ["CA", 4, 5, 6], ["CI", 3], ["CHR", 1, "shared", [5]], ["CA", 2, 6, 6], ["CI", 1], ["FU", 7, [0, 1]], ["AN", 7, 0, 5], ["FU", 7, [1, 2]], ["AN", 7, 1, 4], ["FU", 7, [2, 3]], ["AN", 7, 2, 6], ["FU", 5, [0, 1]], ["SP", 5, 0, 36, [1], 1], ["AN", 5, 1, 2], ["FFSP", 5, 0, [1, 0], 1, 1], ["AN", 5, 1, 6], ["FU", 2, [0, 1]], ["SP", 2, 0, 72, [1], 1], ["AN", 2, 1, 2], ["FFSP", 2, 0, [1, 0], 1, 1], ["AN", 2, 1, 6], ["PR", 6, 0, "auto_unroll_max_step$16"]]]], "r": [[9.19882e-05], 0, 2.01664, 1661162588], "v": "v0.6"}
{"i": [["[\"get_expr\", \"fused_conv_expr_S1D1P1\", [64, 32, 16, 16, 32, 3, 3]]", "cuda -keys=cuda,gpu -max_num_threads=1024 -thread_warp_size=32", [-1, 16, 64, 49152, 2147483647, 1024, 8, 32], "", 0, []], [[], [["SP", 4, 0, 32, [1, 4, 2, 1], 1], ["SP", 4, 5, 16384, [1, 64, 1, 2], 1], ["SP", 4, 10, 288, [72, 1], 1], ["RE", 4, [0, 5, 1, 6, 2, 7, 10, 11, 3, 8, 12, 4, 9]], ["FSP", 5, 0, 0, 3], ["FSP", 5, 4, 1, 3], ["RE", 5, [0, 4, 1, 5, 2, 6, 3, 7]], ["CA", 4, 5, 5], ["CHR", 3, "shared", [4]], ["CA", 4, 5, 6], ["CI", 3], ["CHR", 1, "shared", [5]], ["CA", 2, 6, 6], ["CI", 1], ["FU", 7, [0, 1]], ["AN", 7, 0, 5], ["FU", 7, [1, 2]], ["AN", 7, 1, 4], ["FU", 7, [2, 3]], ["AN", 7, 2, 6], ["FU", 5, [0, 1]], ["SP", 5, 0, 72, [1], 1], ["AN", 5, 1, 2], ["FFSP", 5, 0, [1, 0], 1, 1], ["AN", 5, 1, 6], ["FU", 2, [0, 1]], ["SP", 2, 0, 144, [24], 1], ["AN", 2, 1, 2], ["FFSP", 2, 0, [1, 0], 1, 1], ["AN", 2, 1, 6], ["PR", 6, 0, "auto_unroll_max_step$512"]]]], "r": [[0.000146937], 0, 3.22686, 1661162589], "v": "v0.6"}
{"i": [["[\"get_expr\", \"fused_conv_expr_S1D1P1\", [64, 32, 16, 16, 32, 3, 3]]", "cuda -keys=cuda,gpu -max_num_threads=1024 -thread_warp_size=32", [-1, 16, 64, 49152, 2147483647, 1024, 8, 32], "", 0, []], [[], [["SP", 4, 0, 32, [1, 8, 1, 1], 1], ["SP", 4, 5, 16384, [4, 16, 1, 64], 1], ["SP", 4, 10, 288, [1, 2], 1], ["RE", 4, [0, 5, 1, 6, 2, 7, 10, 11, 3, 8, 12, 4, 9]], ["FSP", 5, 0, 0, 3], ["FSP", 5, 4, 1, 3], ["RE", 5, [0, 4, 1, 5, 2, 6, 3, 7]], ["CA", 4, 5, 5], ["CHR", 3, "shared", [4]], ["CA", 4, 5, 6], ["CI", 3], ["CHR", 1, "shared", [5]], ["CA", 2, 6, 6], ["CI", 1], ["FU", 7, [0, 1]], ["AN", 7, 0, 5], ["FU", 7, [1, 2]], ["AN", 7, 1, 4], ["FU", 7, [2, 3]], ["AN", 7, 2, 6], ["FU", 5, [0, 1]], ["SP", 5, 0, 2, [1], 1], ["AN", 5, 1, 2], ["FFSP", 5, 0, [1, 0], 1, 1], ["AN", 5, 1, 6], ["FU", 2, [0, 1]], ["SP", 2, 0, 128, [1], 1], ["AN", 2, 1, 2], ["FFSP", 2, 0, [1, 0], 1, 1], ["AN", 2, 1, 6], ["PR", 6, 0, "auto_unroll_max_step$512"]]]], "r": [[0.0034497], 0, 3.5691, 1661162591], "v": "v0.6"}
{"i": [["[\"get_expr\", \"fused_conv_expr_S1D1P1\", [64, 32, 16, 16, 32, 3, 3]]", "cuda -keys=cuda,gpu -max_num_threads=1024 -thread_warp_size=32", [-1, 16, 64, 49152, 2147483647, 1024, 8, 32], "", 0, []], [[], [["SP", 4, 0, 32, [2, 1, 1, 4], 1], ["SP", 4, 5, 16384, [4, 128, 2, 1], 1], ["SP", 4, 10, 288, [4, 1], 1], ["RE", 4, [0, 5, 1, 6, 2, 7, 10, 11, 3, 8, 12, 4, 9]], ["FSP", 5, 0, 0, 3], ["FSP", 5, 4, 1, 3], ["RE", 5, [0, 4, 1, 5, 2, 6, 3, 7]], ["CA", 4, 5, 5], ["CHR", 3, "shared", [4]], ["CA", 4, 5, 6], ["CI", 3], ["CHR", 1, "shared", [5]], ["CA", 2, 6, 6], ["CI", 1], ["FU", 7, [0, 1]], ["AN", 7, 0, 5], ["FU", 7, [1, 2]], ["AN", 7, 1, 4], ["FU", 7, [2, 3]], ["AN", 7, 2, 6], ["FU", 5, [0, 1]], ["SP", 5, 0, 16, [1], 1], ["AN", 5, 1, 2], ["FFSP", 5, 0, [1, 0], 1, 1], ["AN", 5, 1, 6], ["FU", 2, [0, 1]], ["SP", 2, 0, 8, [1], 1], ["AN", 2, 1, 2], ["FFSP", 2, 0, [1, 0], 1, 1], ["AN", 2, 1, 6], ["PR", 6, 0, "auto_unroll_max_step$16"]]]], "r": [[0.000376989], 0, 2.1869, 1661162592], "v": "v0.6"}
{"i": [["[\"get_expr\", \"fused_conv_expr_S1D1P1\", [64, 32, 16, 16, 32, 3, 3]]", "cuda -keys=cuda,gpu -max_num_threads=1024 -thread_warp_size=32", [-1, 16, 64, 49152, 2147483647, 1024, 8, 32], "", 0, []], [[], [["SP", 4, 0, 32, [1, 1, 1, 1], 1], ["SP", 4, 5, 16384, [4, 1, 32, 1], 1], ["SP", 4, 10, 288, [9, 2], 1], ["RE", 4, [0, 5, 1, 6, 2, 7, 10, 11, 3, 8, 12, 4, 9]], ["FSP", 5, 0, 0, 3], ["FSP", 5, 4, 1, 3], ["RE", 5, [0, 4, 1, 5, 2, 6, 3, 7]], ["CA", 4, 5, 5], ["CHR", 3, "shared", [4]], ["CA", 4, 5, 6], ["CI", 3], ["CHR", 1, "shared", [5]], ["CA", 2, 6, 6], ["CI", 1], ["FU", 7, [0, 1]], ["AN", 7, 0, 5], ["FU", 7, [1, 2]], ["AN", 7, 1, 4], ["FU", 7, [2, 3]], ["AN", 7, 2, 6], ["FU", 5, [0, 1]], ["SP", 5, 0, 18, [1], 1], ["AN", 5, 1, 2], ["FFSP", 5, 0, [1, 0], 1, 1], ["AN", 5, 1, 6], ["FU", 2, [0, 1]], ["SP", 2, 0, 576, [1], 1], ["AN", 2, 1, 2], ["FFSP", 2, 0, [1, 0], 1, 1], ["AN", 2, 1, 6], ["PR", 6, 0, "auto_unroll_max_step$512"]]]], "r": [[0.0283917], 0, 3.01056, 1661162594], "v": "v0.6"}
{"i": [["[\"get_expr\", \"fused_conv_expr_S1D1P1\", [64, 32, 16, 16, 32, 3, 3]]", "cuda -keys=cuda,gpu -max_num_threads=1024 -thread_warp_size=32", [-1, 16, 64, 49152, 2147483647, 1024, 8, 32], "", 0, []], [[], [["SP", 4, 0, 32, [1, 32, 1, 1], 1], ["SP", 4, 5, 16384, [4, 1, 32, 1], 1], ["SP", 4, 10, 288, [1, 6], 1], ["RE", 4, [0, 5, 1, 6, 2, 7, 10, 11, 3, 8, 12, 4, 9]], ["FSP", 5, 0, 0, 3], ["FSP", 5, 4, 1, 3], ["RE", 5, [0, 4, 1, 5, 2, 6, 3, 7]], ["CA", 4, 5, 5], ["CHR", 3, "shared", [4]], ["CA", 4, 5, 6], ["CI", 3], ["CHR", 1, "shared", [5]], ["CA", 2, 6, 6], ["CI", 1], ["FU", 7, [0, 1]], ["AN", 7, 0, 5], ["FU", 7, [1, 2]], ["AN", 7, 1, 4], ["FU", 7, [2, 3]], ["AN", 7, 2, 6], ["FU", 5, [0, 1]], ["SP", 5, 0, 18, [2], 1], ["AN", 5, 1, 2], ["FFSP", 5, 0, [1, 0], 1, 1], ["AN", 5, 1, 6], ["FU", 2, [0, 1]], ["SP", 2, 0, 576, [1], 1], ["AN", 2, 1, 2], ["FFSP", 2, 0, [1, 0], 1, 1], ["AN", 2, 1, 6], ["PR", 6, 0, "auto_unroll_max_step$64"]]]], "r": [[0.000210019], 0, 2.72181, 1661162595], "v": "v0.6"}
{"i": [["[\"get_expr\", \"fused_conv_expr_S1D1P1\", [64, 32, 16, 16, 32, 3, 3]]", "cuda -keys=cuda,gpu -max_num_threads=1024 -thread_warp_size=32", [-1, 16, 64, 49152, 2147483647, 1024, 8, 32], "", 0, []], [[], [["SP", 4, 0, 32, [1, 16, 1, 1], 1], ["SP", 4, 5, 16384, [2, 16, 1, 4], 1], ["SP", 4, 10, 288, [4, 12], 1], ["RE", 4, [0, 5, 1, 6, 2, 7, 10, 11, 3, 8, 12, 4, 9]], ["FSP", 5, 0, 0, 3], ["FSP", 5, 4, 1, 3], ["RE", 5, [0, 4, 1, 5, 2, 6, 3, 7]], ["CA", 4, 5, 5], ["CHR", 3, "shared", [4]], ["CA", 4, 5, 6], ["CI", 3], ["CHR", 1, "shared", [5]], ["CA", 2, 6, 6], ["CI", 1], ["FU", 7, [0, 1]], ["AN", 7, 0, 5], ["FU", 7, [1, 2]], ["AN", 7, 1, 4], ["FU", 7, [2, 3]], ["AN", 7, 2, 6], ["FU", 5, [0, 1]], ["SP", 5, 0, 48, [8], 1], ["AN", 5, 1, 2], ["FFSP", 5, 0, [1, 0], 1, 1], ["AN", 5, 1, 6], ["FU", 2, [0, 1]], ["SP", 2, 0, 768, [1], 1], ["AN", 2, 1, 2], ["FFSP", 2, 0, [1, 0], 1, 1], ["AN", 2, 1, 6], ["PR", 6, 0, "auto_unroll_max_step$0"]]]], "r": [[9.29232e-05], 0, 1.98465, 1661162597], "v": "v0.6"}
{"i": [["[\"get_expr\", \"fused_conv_expr_S1D1P1\", [64, 32, 16, 16, 32, 3, 3]]", "cuda -keys=cuda,gpu -max_num_threads=1024 -thread_warp_size=32", [-1, 16, 64, 49152, 2147483647, 1024, 8, 32], "", 0, []], [[], [["SP", 4, 0, 32, [1, 32, 1, 1], 1], ["SP", 4, 5, 16384, [1, 1, 64, 2], 1], ["SP", 4, 10, 288, [1, 32], 1], ["RE", 4, [0, 5, 1, 6, 2, 7, 10, 11, 3, 8, 12, 4, 9]], ["FSP", 5, 0, 0, 3], ["FSP", 5, 4, 1, 3], ["RE", 5, [0, 4, 1, 5, 2, 6, 3, 7]], ["CA", 4, 5, 5], ["CHR", 3, "shared", [4]], ["CA", 4, 5, 6], ["CI", 3], ["CHR", 1, "shared", [5]], ["CA", 2, 6, 6], ["CI", 1], ["FU", 7, [0, 1]], ["AN", 7, 0, 5], ["FU", 7, [1, 2]], ["AN", 7, 1, 4], ["FU", 7, [2, 3]], ["AN", 7, 2, 6], ["FU", 5, [0, 1]], ["SP", 5, 0, 32, [1], 1], ["AN", 5, 1, 2], ["FFSP", 5, 0, [1, 0], 1, 1], ["AN", 5, 1, 6], ["FU", 2, [0, 1]], ["SP", 2, 0, 4096, [1], 1], ["AN", 2, 1, 2], ["FFSP", 2, 0, [1, 0], 1, 1], ["AN", 2, 1, 6], ["PR", 6, 0, "auto_unroll_max_step$16"]]]], "r": [[0.000376636], 0, 2.04938, 1661162598], "v": "v0.6"}
{"i": [["[\"get_expr\", \"fused_conv_expr_S1D1P1\", [64, 32, 16, 16, 32, 3, 3]]", "cuda -keys=cuda,gpu -max_num_threads=1024 -thread_warp_size=32", [-1, 16, 64, 49152, 2147483647, 1024, 8, 32], "", 0, []], [[], [["SP", 4, 0, 32, [1, 1, 1, 4], 1], ["SP", 4, 5, 16384, [4, 128, 2, 1], 1], ["SP", 4, 10, 288, [4, 1], 1], ["RE", 4, [0, 5, 1, 6, 2, 7, 10, 11, 3, 8, 12, 4, 9]], ["FSP", 5, 0, 0, 3], ["FSP", 5, 4, 1, 3], ["RE", 5, [0, 4, 1, 5, 2, 6, 3, 7]], ["CA", 4, 5, 5], ["CHR", 3, "shared", [4]], ["CA", 4, 5, 6], ["CI", 3], ["CHR", 1, "shared", [5]], ["CA", 2, 6, 6], ["CI", 1], ["FU", 7, [0, 1]], ["AN", 7, 0, 5], ["FU", 7, [1, 2]], ["AN", 7, 1, 4], ["FU", 7, [2, 3]], ["AN", 7, 2, 6], ["FU", 5, [0, 1]], ["SP", 5, 0, 16, [1], 1], ["AN", 5, 1, 2], ["FFSP", 5, 0, [1, 0], 1, 1], ["AN", 5, 1, 6], ["FU", 2, [0, 1]], ["SP", 2, 0, 8, [2], 1], ["AN", 2, 1, 2], ["FFSP", 2, 0, [1, 0], 1, 1], ["AN", 2, 1, 6], ["PR", 6, 0, "auto_unroll_max_step$512"]]]], "r": [[0.000303313], 0, 2.5377, 1661162599], "v": "v0.6"}
{"i": [["[\"get_expr\", \"fused_conv_expr_S1D1P1\", [64, 32, 16, 16, 32, 3, 3]]", "cuda -keys=cuda,gpu -max_num_threads=1024 -thread_warp_size=32", [-1, 16, 64, 49152, 2147483647, 1024, 8, 32], "", 0, []], [[], [["SP", 4, 0, 32, [8, 1, 2, 1], 1], ["SP", 4, 5, 16384, [2, 32, 1, 2], 1], ["SP", 4, 10, 288, [1, 2], 1], ["RE", 4, [0, 5, 1, 6, 2, 7, 10, 11, 3, 8, 12, 4, 9]], ["FSP", 5, 0, 0, 3], ["FSP", 5, 4, 1, 3], ["RE", 5, [0, 4, 1, 5, 2, 6, 3, 7]], ["CA", 4, 5, 5], ["CHR", 3, "shared", [4]], ["CA", 4, 5, 6], ["CI", 3], ["CHR", 1, "shared", [5]], ["CA", 2, 6, 6], ["CI", 1], ["FU", 7, [0, 1]], ["AN", 7, 0, 5], ["FU", 7, [1, 2]], ["AN", 7, 1, 4], ["FU", 7, [2, 3]], ["AN", 7, 2, 6], ["FU", 5, [0, 1]], ["SP", 5, 0, 24, [1], 1], ["AN", 5, 1, 2], ["FFSP", 5, 0, [1, 0], 1, 1], ["AN", 5, 1, 6], ["FU", 2, [0, 1]], ["SP", 2, 0, 24, [1], 1], ["AN", 2, 1, 2], ["FFSP", 2, 0, [1, 0], 1, 1], ["AN", 2, 1, 6], ["PR", 6, 0, "auto_unroll_max_step$0"]]]], "r": [[0.000195874], 0, 2.01285, 1661162600], "v": "v0.6"}
{"i": [["[\"get_expr\", \"fused_conv_expr_S1D1P1\", [64, 32, 16, 16, 32, 3, 3]]", "cuda -keys=cuda,gpu -max_num_threads=1024 -thread_warp_size=32", [-1, 16, 64, 49152, 2147483647, 1024, 8, 32], "", 0, []], [[], [["SP", 4, 0, 32, [8, 1, 1, 1], 1], ["SP", 4, 5, 16384, [1, 32, 4, 2], 1], ["SP", 4, 10, 288, [1, 9], 1], ["RE", 4, [0, 5, 1, 6, 2, 7, 10, 11, 3, 8, 12, 4, 9]], ["FSP", 5, 0, 0, 3], ["FSP", 5, 4, 1, 3], ["RE", 5, [0, 4, 1, 5, 2, 6, 3, 7]], ["CA", 4, 5, 5], ["CHR", 3, "shared", [4]], ["CA", 4, 5, 6], ["CI", 3], ["CHR", 1, "shared", [5]], ["CA", 2, 6, 6], ["CI", 1], ["FU", 7, [0, 1]], ["AN", 7, 0, 5], ["FU", 7, [1, 2]], ["AN", 7, 1, 4], ["FU", 7, [2, 3]], ["AN", 7, 2, 6], ["FU", 5, [0, 1]], ["SP", 5, 0, 18, [6], 1], ["AN", 5, 1, 2], ["FFSP", 5, 0, [1, 0], 1, 1], ["AN", 5, 1, 6], ["FU", 2, [0, 1]], ["SP", 2, 0, 72, [8], 1], ["AN", 2, 1, 2], ["FFSP", 2, 0, [1, 0], 1, 1], ["AN", 2, 1, 6], ["PR", 6, 0, "auto_unroll_max_step$512"]]]], "r": [[0.000149946], 0, 2.392, 1661162602], "v": "v0.6"}
{"i": [["[\"get_expr\", \"fused_conv_expr_S1D1P1\", [64, 32, 16, 16, 32, 3, 3]]", "cuda -keys=cuda,gpu -max_num_threads=1024 -thread_warp_size=32", [-1, 16, 64, 49152, 2147483647, 1024, 8, 32], "", 0, []], [[], [["SP", 4, 0, 32, [1, 8, 1, 1], 1], ["SP", 4, 5, 16384, [1, 64, 1, 2], 1], ["SP", 4, 10, 288, [72, 1], 1], ["RE", 4, [0, 5, 1, 6, 2, 7, 10, 11, 3, 8, 12, 4, 9]], ["FSP", 5, 0, 0, 3], ["FSP", 5, 4, 1, 3], ["RE", 5, [0, 4, 1, 5, 2, 6, 3, 7]], ["CA", 4, 5, 5], ["CHR", 3, "shared", [4]], ["CA", 4, 5, 6], ["CI", 3], ["CHR", 1, "shared", [5]], ["CA", 2, 6, 6], ["CI", 1], ["FU", 7, [0, 1]], ["AN", 7, 0, 5], ["FU", 7, [1, 2]], ["AN", 7, 1, 4], ["FU", 7, [2, 3]], ["AN", 7, 2, 6], ["FU", 5, [0, 1]], ["SP", 5, 0, 72, [1], 1], ["AN", 5, 1, 2], ["FFSP", 5, 0, [1, 0], 1, 1], ["AN", 5, 1, 6], ["FU", 2, [0, 1]], ["SP", 2, 0, 144, [6], 1], ["AN", 2, 1, 2], ["FFSP", 2, 0, [1, 0], 1, 1], ["AN", 2, 1, 6], ["PR", 6, 0, "auto_unroll_max_step$512"]]]], "r": [[0.000113042], 0, 3.38446, 1661162604], "v": "v0.6"}
{"i": [["[\"get_expr\", \"fused_conv_expr_S1D1P1\", [64, 32, 16, 16, 32, 3, 3]]", "cuda -keys=cuda,gpu -max_num_threads=1024 -thread_warp_size=32", [-1, 16, 64, 49152, 2147483647, 1024, 8, 32], "", 0, []], [[], [["SP", 4, 0, 32, [1, 4, 1, 4], 1], ["SP", 4, 5, 16384, [4, 16, 8, 2], 1], ["SP", 4, 10, 288, [8, 1], 1], ["RE", 4, [0, 5, 1, 6, 2, 7, 10, 11, 3, 8, 12, 4, 9]], ["FSP", 5, 0, 0, 3], ["FSP", 5, 4, 1, 3], ["RE", 5, [0, 4, 1, 5, 2, 6, 3, 7]], ["CA", 4, 5, 5], ["CHR", 3, "shared", [4]], ["CA", 4, 5, 6], ["CI", 3], ["CHR", 1, "shared", [5]], ["CA", 2, 6, 6], ["CI", 1], ["FU", 7, [0, 1]], ["AN", 7, 0, 5], ["FU", 7, [1, 2]], ["AN", 7, 1, 4], ["FU", 7, [2, 3]], ["AN", 7, 2, 6], ["FU", 5, [0, 1]], ["SP", 5, 0, 32, [4], 1], ["AN", 5, 1, 2], ["FFSP", 5, 0, [1, 0], 1, 1], ["AN", 5, 1, 6], ["FU", 2, [0, 1]], ["SP", 2, 0, 128, [16], 1], ["AN", 2, 1, 2], ["FFSP", 2, 0, [1, 0], 1, 1], ["AN", 2, 1, 6], ["PR", 6, 0, "auto_unroll_max_step$64"]]]], "r": [[0.000673664], 0, 2.71869, 1661162605], "v": "v0.6"}
{"i": [["[\"get_expr\", \"fused_conv_expr_S1D1P1\", [64, 32, 16, 16, 32, 3, 3]]", "cuda -keys=cuda,gpu -max_num_threads=1024 -thread_warp_size=32", [-1, 16, 64, 49152, 2147483647, 1024, 8, 32], "", 0, []], [[], [["SP", 4, 0, 32, [1, 8, 2, 2], 1], ["SP", 4, 5, 16384, [1, 16, 2, 2], 1], ["SP", 4, 10, 288, [12, 6], 1], ["RE", 4, [0, 5, 1, 6, 2, 7, 10, 11, 3, 8, 12, 4, 9]], ["FSP", 5, 0, 0, 3], ["FSP", 5, 4, 1, 3], ["RE", 5, [0, 4, 1, 5, 2, 6, 3, 7]], ["CA", 4, 5, 5], ["CHR", 3, "shared", [4]], ["CA", 4, 5, 6], ["CI", 3], ["CHR", 1, "shared", [5]], ["CA", 2, 6, 6], ["CI", 1], ["FU", 7, [0, 1]], ["AN", 7, 0, 5], ["FU", 7, [1, 2]], ["AN", 7, 1, 4], ["FU", 7, [2, 3]], ["AN", 7, 2, 6], ["FU", 5, [0, 1]], ["SP", 5, 0, 288, [8], 1], ["AN", 5, 1, 2], ["FFSP", 5, 0, [1, 0], 1, 1], ["AN", 5, 1, 6], ["FU", 2, [0, 1]], ["SP", 2, 0, 288, [1], 1], ["AN", 2, 1, 2], ["FFSP", 2, 0, [1, 0], 1, 1], ["AN", 2, 1, 6], ["PR", 6, 0, "auto_unroll_max_step$512"]]]], "r": [[5.35808e-05], 0, 2.28701, 1661162606], "v": "v0.6"}
{"i": [["[\"get_expr\", \"fused_conv_expr_S1D1P1\", [64, 32, 16, 16, 32, 3, 3]]", "cuda -keys=cuda,gpu -max_num_threads=1024 -thread_warp_size=32", [-1, 16, 64, 49152, 2147483647, 1024, 8, 32], "", 0, []], [[], [["SP", 4, 0, 32, [2, 8, 1, 1], 1], ["SP", 4, 5, 16384, [1, 4, 16, 8], 1], ["SP", 4, 10, 288, [6, 1], 1], ["RE", 4, [0, 5, 1, 6, 2, 7, 10, 11, 3, 8, 12, 4, 9]], ["FSP", 5, 0, 0, 3], ["FSP", 5, 4, 1, 3], ["RE", 5, [0, 4, 1, 5, 2, 6, 3, 7]], ["CA", 4, 5, 5], ["CHR", 3, "shared", [4]], ["CA", 4, 5, 6], ["CI", 3], ["CHR", 1, "shared", [5]], ["CA", 2, 6, 6], ["CI", 1], ["FU", 7, [0, 1]], ["AN", 7, 0, 5], ["FU", 7, [1, 2]], ["AN", 7, 1, 4], ["FU", 7, [2, 3]], ["AN", 7, 2, 6], ["FU", 5, [0, 1]], ["SP", 5, 0, 6, [2], 1], ["AN", 5, 1, 2], ["FFSP", 5, 0, [1, 0], 1, 1], ["AN", 5, 1, 6], ["FU", 2, [0, 1]], ["SP", 2, 0, 768, [1], 1], ["AN", 2, 1, 2], ["FFSP", 2, 0, [1, 0], 1, 1], ["AN", 2, 1, 6], ["PR", 6, 0, "auto_unroll_max_step$512"]]]], "r": [[0.000822867], 0, 3.3432, 1661162608], "v": "v0.6"}
{"i": [["[\"get_expr\", \"fused_conv_expr_S1D1P1\", [64, 32, 16, 16, 32, 3, 3]]", "cuda -keys=cuda,gpu -max_num_threads=1024 -thread_warp_size=32", [-1, 16, 64, 49152, 2147483647, 1024, 8, 32], "", 0, []], [[], [["SP", 4, 0, 32, [1, 1, 1, 1], 1], ["SP", 4, 5, 16384, [2, 2, 32, 1], 1], ["SP", 4, 10, 288, [9, 8], 1], ["RE", 4, [0, 5, 1, 6, 2, 7, 10, 11, 3, 8, 12, 4, 9]], ["FSP", 5, 0, 0, 3], ["FSP", 5, 4, 1, 3], ["RE", 5, [0, 4, 1, 5, 2, 6, 3, 7]], ["CA", 4, 5, 5], ["CHR", 3, "shared", [4]], ["CA", 4, 5, 6], ["CI", 3], ["CHR", 1, "shared", [5]], ["CA", 2, 6, 6], ["CI", 1], ["FU", 7, [0, 1]], ["AN", 7, 0, 5], ["FU", 7, [1, 2]], ["AN", 7, 1, 4], ["FU", 7, [2, 3]], ["AN", 7, 2, 6], ["FU", 5, [0, 1]], ["SP", 5, 0, 144, [1], 1], ["AN", 5, 1, 2], ["FFSP", 5, 0, [1, 0], 1, 1], ["AN", 5, 1, 6], ["FU", 2, [0, 1]], ["SP", 2, 0, 2304, [1], 1], ["AN", 2, 1, 2], ["FFSP", 2, 0, [1, 0], 1, 1], ["AN", 2, 1, 6], ["PR", 6, 0, "auto_unroll_max_step$16"]]]], "r": [[0.0573907], 0, 2.35284, 1661162620], "v": "v0.6"}
{"i": [["[\"get_expr\", \"fused_conv_expr_S1D1P1\", [64, 32, 16, 16, 32, 3, 3]]", "cuda -keys=cuda,gpu -max_num_threads=1024 -thread_warp_size=32", [-1, 16, 64, 49152, 2147483647, 1024, 8, 32], "", 0, []], [[], [["SP", 4, 0, 32, [4, 4, 1, 2], 1], ["SP", 4, 5, 16384, [1, 4, 1, 16], 1], ["SP", 4, 10, 288, [72, 1], 1], ["RE", 4, [0, 5, 1, 6, 2, 7, 10, 11, 3, 8, 12, 4, 9]], ["FSP", 5, 0, 0, 3], ["FSP", 5, 4, 1, 3], ["RE", 5, [0, 4, 1, 5, 2, 6, 3, 7]], ["CA", 4, 5, 5], ["CHR", 3, "shared", [4]], ["CA", 4, 5, 6], ["CI", 3], ["CHR", 1, "shared", [5]], ["CA", 2, 6, 6], ["CI", 1], ["FU", 7, [0, 1]], ["AN", 7, 0, 5], ["FU", 7, [1, 2]], ["AN", 7, 1, 4], ["FU", 7, [2, 3]], ["AN", 7, 2, 6], ["FU", 5, [0, 1]], ["SP", 5, 0, 144, [1], 1], ["AN", 5, 1, 2], ["FFSP", 5, 0, [1, 0], 1, 1], ["AN", 5, 1, 6], ["FU", 2, [0, 1]], ["SP", 2, 0, 72, [1], 1], ["AN", 2, 1, 2], ["FFSP", 2, 0, [1, 0], 1, 1], ["AN", 2, 1, 6], ["PR", 6, 0, "auto_unroll_max_step$16"]]]], "r": [[0.000518258], 0, 2.45015, 1661162621], "v": "v0.6"}
{"i": [["[\"get_expr\", \"fused_conv_expr_S1D1P1\", [64, 32, 16, 16, 32, 3, 3]]", "cuda -keys=cuda,gpu -max_num_threads=1024 -thread_warp_size=32", [-1, 16, 64, 49152, 2147483647, 1024, 8, 32], "", 0, []], [[], [["SP", 4, 0, 32, [1, 8, 1, 1], 1], ["SP", 4, 5, 16384, [4, 8, 4, 16], 1], ["SP", 4, 10, 288, [1, 2], 1], ["RE", 4, [0, 5, 1, 6, 2, 7, 10, 11, 3, 8, 12, 4, 9]], ["FSP", 5, 0, 0, 3], ["FSP", 5, 4, 1, 3], ["RE", 5, [0, 4, 1, 5, 2, 6, 3, 7]], ["CA", 4, 5, 5], ["CHR", 3, "shared", [4]], ["CA", 4, 5, 6], ["CI", 3], ["CHR", 1, "shared", [5]], ["CA", 2, 6, 6], ["CI", 1], ["FU", 7, [0, 1]], ["AN", 7, 0, 5], ["FU", 7, [1, 2]], ["AN", 7, 1, 4], ["FU", 7, [2, 3]], ["AN", 7, 2, 6], ["FU", 5, [0, 1]], ["SP", 5, 0, 2, [1], 1], ["AN", 5, 1, 2], ["FFSP", 5, 0, [1, 0], 1, 1], ["AN", 5, 1, 6], ["FU", 2, [0, 1]], ["SP", 2, 0, 128, [1], 1], ["AN", 2, 1, 2], ["FFSP", 2, 0, [1, 0], 1, 1], ["AN", 2, 1, 6], ["PR", 6, 0, "auto_unroll_max_step$512"]]]], "r": [[0.0020911], 0, 3.24118, 1661162622], "v": "v0.6"}
{"i": [["[\"get_expr\", \"fused_conv_expr_S1D1P1\", [64, 32, 16, 16, 32, 3, 3]]", "cuda -keys=cuda,gpu -max_num_threads=1024 -thread_warp_size=32", [-1, 16, 64, 49152, 2147483647, 1024, 8, 32], "", 0, []], [[], [["SP", 4, 0, 32, [1, 4, 1, 2], 1], ["SP", 4, 5, 16384, [4, 8, 1, 16], 1], ["SP", 4, 10, 288, [2, 6], 1], ["RE", 4, [0, 5, 1, 6, 2, 7, 10, 11, 3, 8, 12, 4, 9]], ["FSP", 5, 0, 0, 3], ["FSP", 5, 4, 1, 3], ["RE", 5, [0, 4, 1, 5, 2, 6, 3, 7]], ["CA", 4, 5, 5], ["CHR", 3, "shared", [4]], ["CA", 4, 5, 6], ["CI", 3], ["CHR", 1, "shared", [5]], ["CA", 2, 6, 6], ["CI", 1], ["FU", 7, [0, 1]], ["AN", 7, 0, 5], ["FU", 7, [1, 2]], ["AN", 7, 1, 4], ["FU", 7, [2, 3]], ["AN", 7, 2, 6], ["FU", 5, [0, 1]], ["SP", 5, 0, 24, [1], 1], ["AN", 5, 1, 2], ["FFSP", 5, 0, [1, 0], 1, 1], ["AN", 5, 1, 6], ["FU", 2, [0, 1]], ["SP", 2, 0, 192, [1], 1], ["AN", 2, 1, 2], ["FFSP", 2, 0, [1, 0], 1, 1], ["AN", 2, 1, 6], ["PR", 6, 0, "auto_unroll_max_step$64"]]]], "r": [[0.000832808], 0, 2.27751, 1661162624], "v": "v0.6"}
{"i": [["[\"get_expr\", \"fused_conv_expr_S1D1P1\", [64, 32, 16, 16, 32, 3, 3]]", "cuda -keys=cuda,gpu -max_num_threads=1024 -thread_warp_size=32", [-1, 16, 64, 49152, 2147483647, 1024, 8, 32], "", 0, []], [[], [["SP", 4, 0, 32, [2, 8, 1, 1], 1], ["SP", 4, 5, 16384, [1, 16, 1, 8], 1], ["SP", 4, 10, 288, [2, 2], 1], ["RE", 4, [0, 5, 1, 6, 2, 7, 10, 11, 3, 8, 12, 4, 9]], ["FSP", 5, 0, 0, 3], ["FSP", 5, 4, 1, 3], ["RE", 5, [0, 4, 1, 5, 2, 6, 3, 7]], ["CA", 4, 5, 5], ["CHR", 3, "shared", [4]], ["CA", 4, 5, 6], ["CI", 3], ["CHR", 1, "shared", [5]], ["CA", 2, 6, 6], ["CI", 1], ["FU", 7, [0, 1]], ["AN", 7, 0, 5], ["FU", 7, [1, 2]], ["AN", 7, 1, 4], ["FU", 7, [2, 3]], ["AN", 7, 2, 6], ["FU", 5, [0, 1]], ["SP", 5, 0, 4, [1], 1], ["AN", 5, 1, 2], ["FFSP", 5, 0, [1, 0], 1, 1], ["AN", 5, 1, 6], ["FU", 2, [0, 1]], ["SP", 2, 0, 32, [1], 1], ["AN", 2, 1, 2], ["FFSP", 2, 0, [1, 0], 1, 1], ["AN", 2, 1, 6], ["PR", 6, 0, "auto_unroll_max_step$1024"]]]], "r": [[0.000105263], 0, 2.05033, 1661162625], "v": "v0.6"}
