artifacts/Table4/tvm/ansor/pooling/ansor_avg_pooling_128_84_42_42_3_3_1_SAME.log
{"i": [["[\"pool_layer\", \"avg\", 128, 84, 42, 42, 3, 3, 1, \"SAME\"]", "rocm -keys=rocm,gpu -max_num_threads=256 -mcpu=gfx906 -mtriple=amdgcn-amd-amdhsa-hcc -thread_warp_size=64", [-1, 16, 64, 65536, 2147483647, 1024, 16, 64], "", 0, []], [[], [["CI", 1], ["FU", 3, [0, 1, 2, 3]], ["SP", 3, 0, 18966528, [4], 1], ["AN", 3, 0, 5], ["AN", 3, 1, 6], ["FU", 2, [0, 1, 2, 3]], ["SP", 2, 0, 18966528, [32], 1], ["AN", 2, 0, 5], ["AN", 2, 1, 6], ["PR", 2, 0, "auto_unroll_max_step$16"]]]], "r": [[0.0128128], 0, 2.10782, 1639069326], "v": "v0.6"}
{"i": [["[\"pool_layer\", \"avg\", 128, 84, 42, 42, 3, 3, 1, \"SAME\"]", "rocm -keys=rocm,gpu -max_num_threads=256 -mcpu=gfx906 -mtriple=amdgcn-amd-amdhsa-hcc -thread_warp_size=64", [-1, 16, 64, 65536, 2147483647, 1024, 16, 64], "", 0, []], [[], [["CI", 1], ["FU", 3, [0, 1, 2, 3]], ["SP", 3, 0, 18966528, [64], 1], ["AN", 3, 0, 5], ["AN", 3, 1, 6], ["FU", 2, [0, 1, 2, 3]], ["SP", 2, 0, 18966528, [2], 1], ["AN", 2, 0, 5], ["AN", 2, 1, 6], ["PR", 2, 0, "auto_unroll_max_step$0"]]]], "r": [[0.0228074], 0, 2.27329, 1639069328], "v": "v0.6"}
{"i": [["[\"pool_layer\", \"avg\", 128, 84, 42, 42, 3, 3, 1, \"SAME\"]", "rocm -keys=rocm,gpu -max_num_threads=256 -mcpu=gfx906 -mtriple=amdgcn-amd-amdhsa-hcc -thread_warp_size=64", [-1, 16, 64, 65536, 2147483647, 1024, 16, 64], "", 0, []], [[], [["CI", 1], ["FU", 3, [0, 1, 2, 3]], ["SP", 3, 0, 18966528, [16], 1], ["AN", 3, 0, 5], ["AN", 3, 1, 6], ["FU", 2, [0, 1, 2, 3]], ["SP", 2, 0, 18966528, [24], 1], ["AN", 2, 0, 5], ["AN", 2, 1, 6], ["PR", 2, 0, "auto_unroll_max_step$0"]]]], "r": [[0.00474646], 0, 2.0448, 1639069330], "v": "v0.6"}
{"i": [["[\"pool_layer\", \"avg\", 128, 84, 42, 42, 3, 3, 1, \"SAME\"]", "rocm -keys=rocm,gpu -max_num_threads=256 -mcpu=gfx906 -mtriple=amdgcn-amd-amdhsa-hcc -thread_warp_size=64", [-1, 16, 64, 65536, 2147483647, 1024, 16, 64], "", 0, []], [[], [["CI", 1], ["FU", 3, [0, 1, 2, 3]], ["SP", 3, 0, 18966528, [16], 1], ["AN", 3, 0, 5], ["AN", 3, 1, 6], ["FU", 2, [0, 1, 2, 3]], ["SP", 2, 0, 18966528, [4], 1], ["AN", 2, 0, 5], ["AN", 2, 1, 6], ["PR", 2, 0, "auto_unroll_max_step$64"]]]], "r": [[0.0142148], 0, 2.12663, 1639069332], "v": "v0.6"}
{"i": [["[\"pool_layer\", \"avg\", 128, 84, 42, 42, 3, 3, 1, \"SAME\"]", "rocm -keys=rocm,gpu -max_num_threads=256 -mcpu=gfx906 -mtriple=amdgcn-amd-amdhsa-hcc -thread_warp_size=64", [-1, 16, 64, 65536, 2147483647, 1024, 16, 64], "", 0, []], [[], [["CI", 1], ["FU", 3, [0, 1, 2, 3]], ["SP", 3, 0, 18966528, [64], 1], ["AN", 3, 0, 5], ["AN", 3, 1, 6], ["FU", 2, [0, 1, 2, 3]], ["SP", 2, 0, 18966528, [56], 1], ["AN", 2, 0, 5], ["AN", 2, 1, 6], ["PR", 2, 0, "auto_unroll_max_step$0"]]]], "r": [[0.00148646], 0, 2.39868, 1639069334], "v": "v0.6"}
{"i": [["[\"pool_layer\", \"avg\", 128, 84, 42, 42, 3, 3, 1, \"SAME\"]", "rocm -keys=rocm,gpu -max_num_threads=256 -mcpu=gfx906 -mtriple=amdgcn-amd-amdhsa-hcc -thread_warp_size=64", [-1, 16, 64, 65536, 2147483647, 1024, 16, 64], "", 0, []], [[], [["CI", 1], ["FU", 3, [0, 1, 2, 3]], ["SP", 3, 0, 18966528, [1], 1], ["AN", 3, 0, 5], ["AN", 3, 1, 6], ["FU", 2, [0, 1, 2, 3]], ["SP", 2, 0, 18966528, [64], 1], ["AN", 2, 0, 5], ["AN", 2, 1, 6], ["PR", 2, 0, "auto_unroll_max_step$16"]]]], "r": [[0.0449222], 0, 2.422, 1639069336], "v": "v0.6"}
{"i": [["[\"pool_layer\", \"avg\", 128, 84, 42, 42, 3, 3, 1, \"SAME\"]", "rocm -keys=rocm,gpu -max_num_threads=256 -mcpu=gfx906 -mtriple=amdgcn-amd-amdhsa-hcc -thread_warp_size=64", [-1, 16, 64, 65536, 2147483647, 1024, 16, 64], "", 0, []], [[], [["CI", 1], ["FU", 3, [0, 1, 2, 3]], ["SP", 3, 0, 18966528, [1], 1], ["AN", 3, 0, 5], ["AN", 3, 1, 6], ["FU", 2, [0, 1, 2, 3]], ["SP", 2, 0, 18966528, [2], 1], ["AN", 2, 0, 5], ["AN", 2, 1, 6], ["PR", 2, 0, "auto_unroll_max_step$512"]]]], "r": [[0.0663293], 0, 2.51192, 1639069338], "v": "v0.6"}
{"i": [["[\"pool_layer\", \"avg\", 128, 84, 42, 42, 3, 3, 1, \"SAME\"]", "rocm -keys=rocm,gpu -max_num_threads=256 -mcpu=gfx906 -mtriple=amdgcn-amd-amdhsa-hcc -thread_warp_size=64", [-1, 16, 64, 65536, 2147483647, 1024, 16, 64], "", 0, []], [[], [["CI", 1], ["FU", 3, [0, 1, 2, 3]], ["SP", 3, 0, 18966528, [4], 1], ["AN", 3, 0, 5], ["AN", 3, 1, 6], ["FU", 2, [0, 1, 2, 3]], ["SP", 2, 0, 18966528, [16], 1], ["AN", 2, 0, 5], ["AN", 2, 1, 6], ["PR", 2, 0, "auto_unroll_max_step$1024"]]]], "r": [[0.0138239], 0, 2.20485, 1639069340], "v": "v0.6"}
{"i": [["[\"pool_layer\", \"avg\", 128, 84, 42, 42, 3, 3, 1, \"SAME\"]", "rocm -keys=rocm,gpu -max_num_threads=256 -mcpu=gfx906 -mtriple=amdgcn-amd-amdhsa-hcc -thread_warp_size=64", [-1, 16, 64, 65536, 2147483647, 1024, 16, 64], "", 0, []], [[], [["CI", 1], ["FU", 3, [0, 1, 2, 3]], ["SP", 3, 0, 18966528, [28], 1], ["AN", 3, 0, 5], ["AN", 3, 1, 6], ["FU", 2, [0, 1, 2, 3]], ["SP", 2, 0, 18966528, [1], 1], ["AN", 2, 0, 5], ["AN", 2, 1, 6], ["PR", 2, 0, "auto_unroll_max_step$1024"]]]], "r": [[0.0458084], 0, 2.37939, 1639069342], "v": "v0.6"}
{"i": [["[\"pool_layer\", \"avg\", 128, 84, 42, 42, 3, 3, 1, \"SAME\"]", "rocm -keys=rocm,gpu -max_num_threads=256 -mcpu=gfx906 -mtriple=amdgcn-amd-amdhsa-hcc -thread_warp_size=64", [-1, 16, 64, 65536, 2147483647, 1024, 16, 64], "", 0, []], [[], [["CI", 1], ["FU", 3, [0, 1, 2, 3]], ["SP", 3, 0, 18966528, [16], 1], ["AN", 3, 0, 5], ["AN", 3, 1, 6], ["FU", 2, [0, 1, 2, 3]], ["SP", 2, 0, 18966528, [1], 1], ["AN", 2, 0, 5], ["AN", 2, 1, 6], ["PR", 2, 0, "auto_unroll_max_step$16"]]]], "r": [[0.0469921], 0, 2.35341, 1639069344], "v": "v0.6"}
{"i": [["[\"pool_layer\", \"avg\", 128, 84, 42, 42, 3, 3, 1, \"SAME\"]", "rocm -keys=rocm,gpu -max_num_threads=256 -mcpu=gfx906 -mtriple=amdgcn-amd-amdhsa-hcc -thread_warp_size=64", [-1, 16, 64, 65536, 2147483647, 1024, 16, 64], "", 0, []], [[], [["CI", 1], ["FU", 3, [0, 1, 2, 3]], ["SP", 3, 0, 18966528, [64], 1], ["AN", 3, 0, 5], ["AN", 3, 1, 6], ["FU", 2, [0, 1, 2, 3]], ["SP", 2, 0, 18966528, [24], 1], ["AN", 2, 0, 5], ["AN", 2, 1, 6], ["PR", 2, 0, "auto_unroll_max_step$16"]]]], "r": [[0.00253823], 0, 2.51902, 1639069346], "v": "v0.6"}
{"i": [["[\"pool_layer\", \"avg\", 128, 84, 42, 42, 3, 3, 1, \"SAME\"]", "rocm -keys=rocm,gpu -max_num_threads=256 -mcpu=gfx906 -mtriple=amdgcn-amd-amdhsa-hcc -thread_warp_size=64", [-1, 16, 64, 65536, 2147483647, 1024, 16, 64], "", 0, []], [[], [["CI", 1], ["FU", 3, [0, 1, 2, 3]], ["SP", 3, 0, 18966528, [16], 1], ["AN", 3, 0, 5], ["AN", 3, 1, 6], ["FU", 2, [0, 1, 2, 3]], ["SP", 2, 0, 18966528, [12], 1], ["AN", 2, 0, 5], ["AN", 2, 1, 6], ["PR", 2, 0, "auto_unroll_max_step$512"]]]], "r": [[0.00664039], 0, 2.19185, 1639069348], "v": "v0.6"}
{"i": [["[\"pool_layer\", \"avg\", 128, 84, 42, 42, 3, 3, 1, \"SAME\"]", "rocm -keys=rocm,gpu -max_num_threads=256 -mcpu=gfx906 -mtriple=amdgcn-amd-amdhsa-hcc -thread_warp_size=64", [-1, 16, 64, 65536, 2147483647, 1024, 16, 64], "", 0, []], [[], [["CI", 1], ["FU", 3, [0, 1, 2, 3]], ["SP", 3, 0, 18966528, [4], 1], ["AN", 3, 0, 5], ["AN", 3, 1, 6], ["FU", 2, [0, 1, 2, 3]], ["SP", 2, 0, 18966528, [8], 1], ["AN", 2, 0, 5], ["AN", 2, 1, 6], ["PR", 2, 0, "auto_unroll_max_step$512"]]]], "r": [[0.0165862], 0, 2.46692, 1639069350], "v": "v0.6"}
{"i": [["[\"pool_layer\", \"avg\", 128, 84, 42, 42, 3, 3, 1, \"SAME\"]", "rocm -keys=rocm,gpu -max_num_threads=256 -mcpu=gfx906 -mtriple=amdgcn-amd-amdhsa-hcc -thread_warp_size=64", [-1, 16, 64, 65536, 2147483647, 1024, 16, 64], "", 0, []], [[], [["CI", 1], ["FU", 3, [0, 1, 2, 3]], ["SP", 3, 0, 18966528, [54], 1], ["AN", 3, 0, 5], ["AN", 3, 1, 6], ["FU", 2, [0, 1, 2, 3]], ["SP", 2, 0, 18966528, [64], 1], ["AN", 2, 0, 5], ["AN", 2, 1, 6], ["PR", 2, 0, "auto_unroll_max_step$64"]]]], "r": [[0.00151566], 0, 2.53333, 1639069352], "v": "v0.6"}
{"i": [["[\"pool_layer\", \"avg\", 128, 84, 42, 42, 3, 3, 1, \"SAME\"]", "rocm -keys=rocm,gpu -max_num_threads=256 -mcpu=gfx906 -mtriple=amdgcn-amd-amdhsa-hcc -thread_warp_size=64", [-1, 16, 64, 65536, 2147483647, 1024, 16, 64], "", 0, []], [[], [["CI", 1], ["FU", 3, [0, 1, 2, 3]], ["SP", 3, 0, 18966528, [32], 1], ["AN", 3, 0, 5], ["AN", 3, 1, 6], ["FU", 2, [0, 1, 2, 3]], ["SP", 2, 0, 18966528, [64], 1], ["AN", 2, 0, 5], ["AN", 2, 1, 6], ["PR", 2, 0, "auto_unroll_max_step$16"]]]], "r": [[0.00207902], 0, 2.40849, 1639069354], "v": "v0.6"}
{"i": [["[\"pool_layer\", \"avg\", 128, 84, 42, 42, 3, 3, 1, \"SAME\"]", "rocm -keys=rocm,gpu -max_num_threads=256 -mcpu=gfx906 -mtriple=amdgcn-amd-amdhsa-hcc -thread_warp_size=64", [-1, 16, 64, 65536, 2147483647, 1024, 16, 64], "", 0, []], [[], [["CI", 1], ["FU", 3, [0, 1, 2, 3]], ["SP", 3, 0, 18966528, [8], 1], ["AN", 3, 0, 5], ["AN", 3, 1, 6], ["FU", 2, [0, 1, 2, 3]], ["SP", 2, 0, 18966528, [32], 1], ["AN", 2, 0, 5], ["AN", 2, 1, 6], ["PR", 2, 0, "auto_unroll_max_step$16"]]]], "r": [[0.00711689], 0, 2.12129, 1639069356], "v": "v0.6"}
{"i": [["[\"pool_layer\", \"avg\", 128, 84, 42, 42, 3, 3, 1, \"SAME\"]", "rocm -keys=rocm,gpu -max_num_threads=256 -mcpu=gfx906 -mtriple=amdgcn-amd-amdhsa-hcc -thread_warp_size=64", [-1, 16, 64, 65536, 2147483647, 1024, 16, 64], "", 0, []], [[], [["CI", 1], ["FU", 3, [0, 1, 2, 3]], ["SP", 3, 0, 18966528, [8], 1], ["AN", 3, 0, 5], ["AN", 3, 1, 6], ["FU", 2, [0, 1, 2, 3]], ["SP", 2, 0, 18966528, [32], 1], ["AN", 2, 0, 5], ["AN", 2, 1, 6], ["PR", 2, 0, "auto_unroll_max_step$512"]]]], "r": [[0.00691396], 0, 2.44994, 1639069358], "v": "v0.6"}
{"i": [["[\"pool_layer\", \"avg\", 128, 84, 42, 42, 3, 3, 1, \"SAME\"]", "rocm -keys=rocm,gpu -max_num_threads=256 -mcpu=gfx906 -mtriple=amdgcn-amd-amdhsa-hcc -thread_warp_size=64", [-1, 16, 64, 65536, 2147483647, 1024, 16, 64], "", 0, []], [[], [["CI", 1], ["FU", 3, [0, 1, 2, 3]], ["SP", 3, 0, 18966528, [64], 1], ["AN", 3, 0, 5], ["AN", 3, 1, 6], ["FU", 2, [0, 1, 2, 3]], ["SP", 2, 0, 18966528, [3], 1], ["AN", 2, 0, 5], ["AN", 2, 1, 6], ["PR", 2, 0, "auto_unroll_max_step$1024"]]]], "r": [[0.0154354], 0, 2.55463, 1639069360], "v": "v0.6"}
{"i": [["[\"pool_layer\", \"avg\", 128, 84, 42, 42, 3, 3, 1, \"SAME\"]", "rocm -keys=rocm,gpu -max_num_threads=256 -mcpu=gfx906 -mtriple=amdgcn-amd-amdhsa-hcc -thread_warp_size=64", [-1, 16, 64, 65536, 2147483647, 1024, 16, 64], "", 0, []], [[], [["CI", 1], ["FU", 3, [0, 1, 2, 3]], ["SP", 3, 0, 18966528, [32], 1], ["AN", 3, 0, 5], ["AN", 3, 1, 6], ["FU", 2, [0, 1, 2, 3]], ["SP", 2, 0, 18966528, [48], 1], ["AN", 2, 0, 5], ["AN", 2, 1, 6], ["PR", 2, 0, "auto_unroll_max_step$1024"]]]], "r": [[0.00230806], 0, 2.46919, 1639069363], "v": "v0.6"}
{"i": [["[\"pool_layer\", \"avg\", 128, 84, 42, 42, 3, 3, 1, \"SAME\"]", "rocm -keys=rocm,gpu -max_num_threads=256 -mcpu=gfx906 -mtriple=amdgcn-amd-amdhsa-hcc -thread_warp_size=64", [-1, 16, 64, 65536, 2147483647, 1024, 16, 64], "", 0, []], [[], [["CI", 1], ["FU", 3, [0, 1, 2, 3]], ["SP", 3, 0, 18966528, [32], 1], ["AN", 3, 0, 5], ["AN", 3, 1, 6], ["FU", 2, [0, 1, 2, 3]], ["SP", 2, 0, 18966528, [8], 1], ["AN", 2, 0, 5], ["AN", 2, 1, 6], ["PR", 2, 0, "auto_unroll_max_step$1024"]]]], "r": [[0.00712172], 0, 1.98772, 1639069364], "v": "v0.6"}
{"i": [["[\"pool_layer\", \"avg\", 128, 84, 42, 42, 3, 3, 1, \"SAME\"]", "rocm -keys=rocm,gpu -max_num_threads=256 -mcpu=gfx906 -mtriple=amdgcn-amd-amdhsa-hcc -thread_warp_size=64", [-1, 16, 64, 65536, 2147483647, 1024, 16, 64], "", 0, []], [[], [["CI", 1], ["FU", 3, [0, 1, 2, 3]], ["SP", 3, 0, 18966528, [4], 1], ["AN", 3, 0, 5], ["AN", 3, 1, 6], ["FU", 2, [0, 1, 2, 3]], ["SP", 2, 0, 18966528, [8], 1], ["AN", 2, 0, 5], ["AN", 2, 1, 6], ["PR", 2, 0, "auto_unroll_max_step$1024"]]]], "r": [[0.0165859], 0, 2.21139, 1639069366], "v": "v0.6"}
{"i": [["[\"pool_layer\", \"avg\", 128, 84, 42, 42, 3, 3, 1, \"SAME\"]", "rocm -keys=rocm,gpu -max_num_threads=256 -mcpu=gfx906 -mtriple=amdgcn-amd-amdhsa-hcc -thread_warp_size=64", [-1, 16, 64, 65536, 2147483647, 1024, 16, 64], "", 0, []], [[], [["CI", 1], ["FU", 3, [0, 1, 2, 3]], ["SP", 3, 0, 18966528, [21], 1], ["AN", 3, 0, 5], ["AN", 3, 1, 6], ["FU", 2, [0, 1, 2, 3]], ["SP", 2, 0, 18966528, [16], 1], ["AN", 2, 0, 5], ["AN", 2, 1, 6], ["PR", 2, 0, "auto_unroll_max_step$0"]]]], "r": [[0.00487357], 0, 2.26112, 1639069368], "v": "v0.6"}
{"i": [["[\"pool_layer\", \"avg\", 128, 84, 42, 42, 3, 3, 1, \"SAME\"]", "rocm -keys=rocm,gpu -max_num_threads=256 -mcpu=gfx906 -mtriple=amdgcn-amd-amdhsa-hcc -thread_warp_size=64", [-1, 16, 64, 65536, 2147483647, 1024, 16, 64], "", 0, []], [[], [["CI", 1], ["FU", 3, [0, 1, 2, 3]], ["SP", 3, 0, 18966528, [4], 1], ["AN", 3, 0, 5], ["AN", 3, 1, 6], ["FU", 2, [0, 1, 2, 3]], ["SP", 2, 0, 18966528, [64], 1], ["AN", 2, 0, 5], ["AN", 2, 1, 6], ["PR", 2, 0, "auto_unroll_max_step$512"]]]], "r": [[0.0120971], 0, 2.1266, 1639069370], "v": "v0.6"}
{"i": [["[\"pool_layer\", \"avg\", 128, 84, 42, 42, 3, 3, 1, \"SAME\"]", "rocm -keys=rocm,gpu -max_num_threads=256 -mcpu=gfx906 -mtriple=amdgcn-amd-amdhsa-hcc -thread_warp_size=64", [-1, 16, 64, 65536, 2147483647, 1024, 16, 64], "", 0, []], [[], [["CI", 1], ["FU", 3, [0, 1, 2, 3]], ["SP", 3, 0, 18966528, [64], 1], ["AN", 3, 0, 5], ["AN", 3, 1, 6], ["FU", 2, [0, 1, 2, 3]], ["SP", 2, 0, 18966528, [24], 1], ["AN", 2, 0, 5], ["AN", 2, 1, 6], ["PR", 2, 0, "auto_unroll_max_step$0"]]]], "r": [[0.00253822], 0, 2.57632, 1639069372], "v": "v0.6"}
{"i": [["[\"pool_layer\", \"avg\", 128, 84, 42, 42, 3, 3, 1, \"SAME\"]", "rocm -keys=rocm,gpu -max_num_threads=256 -mcpu=gfx906 -mtriple=amdgcn-amd-amdhsa-hcc -thread_warp_size=64", [-1, 16, 64, 65536, 2147483647, 1024, 16, 64], "", 0, []], [[], [["CI", 1], ["FU", 3, [0, 1, 2, 3]], ["SP", 3, 0, 18966528, [64], 1], ["AN", 3, 0, 5], ["AN", 3, 1, 6], ["FU", 2, [0, 1, 2, 3]], ["SP", 2, 0, 18966528, [4], 1], ["AN", 2, 0, 5], ["AN", 2, 1, 6], ["PR", 2, 0, "auto_unroll_max_step$1024"]]]], "r": [[0.0117519], 0, 2.14758, 1639069374], "v": "v0.6"}
{"i": [["[\"pool_layer\", \"avg\", 128, 84, 42, 42, 3, 3, 1, \"SAME\"]", "rocm -keys=rocm,gpu -max_num_threads=256 -mcpu=gfx906 -mtriple=amdgcn-amd-amdhsa-hcc -thread_warp_size=64", [-1, 16, 64, 65536, 2147483647, 1024, 16, 64], "", 0, []], [[], [["CI", 1], ["FU", 3, [0, 1, 2, 3]], ["SP", 3, 0, 18966528, [4], 1], ["AN", 3, 0, 5], ["AN", 3, 1, 6], ["FU", 2, [0, 1, 2, 3]], ["SP", 2, 0, 18966528, [64], 1], ["AN", 2, 0, 5], ["AN", 2, 1, 6], ["PR", 2, 0, "auto_unroll_max_step$64"]]]], "r": [[0.0117523], 0, 2.47426, 1639069376], "v": "v0.6"}
{"i": [["[\"pool_layer\", \"avg\", 128, 84, 42, 42, 3, 3, 1, \"SAME\"]", "rocm -keys=rocm,gpu -max_num_threads=256 -mcpu=gfx906 -mtriple=amdgcn-amd-amdhsa-hcc -thread_warp_size=64", [-1, 16, 64, 65536, 2147483647, 1024, 16, 64], "", 0, []], [[], [["CI", 1], ["FU", 3, [0, 1, 2, 3]], ["SP", 3, 0, 18966528, [8], 1], ["AN", 3, 0, 5], ["AN", 3, 1, 6], ["FU", 2, [0, 1, 2, 3]], ["SP", 2, 0, 18966528, [16], 1], ["AN", 2, 0, 5], ["AN", 2, 1, 6], ["PR", 2, 0, "auto_unroll_max_step$0"]]]], "r": [[0.00854945], 0, 1.9634, 1639069378], "v": "v0.6"}
{"i": [["[\"pool_layer\", \"avg\", 128, 84, 42, 42, 3, 3, 1, \"SAME\"]", "rocm -keys=rocm,gpu -max_num_threads=256 -mcpu=gfx906 -mtriple=amdgcn-amd-amdhsa-hcc -thread_warp_size=64", [-1, 16, 64, 65536, 2147483647, 1024, 16, 64], "", 0, []], [[], [["CI", 1], ["FU", 3, [0, 1, 2, 3]], ["SP", 3, 0, 18966528, [64], 1], ["AN", 3, 0, 5], ["AN", 3, 1, 6], ["FU", 2, [0, 1, 2, 3]], ["SP", 2, 0, 18966528, [16], 1], ["AN", 2, 0, 5], ["AN", 2, 1, 6], ["PR", 2, 0, "auto_unroll_max_step$512"]]]], "r": [[0.00356525], 0, 2.10274, 1639069380], "v": "v0.6"}
{"i": [["[\"pool_layer\", \"avg\", 128, 84, 42, 42, 3, 3, 1, \"SAME\"]", "rocm -keys=rocm,gpu -max_num_threads=256 -mcpu=gfx906 -mtriple=amdgcn-amd-amdhsa-hcc -thread_warp_size=64", [-1, 16, 64, 65536, 2147483647, 1024, 16, 64], "", 0, []], [[], [["CI", 1], ["FU", 3, [0, 1, 2, 3]], ["SP", 3, 0, 18966528, [6], 1], ["AN", 3, 0, 5], ["AN", 3, 1, 6], ["FU", 2, [0, 1, 2, 3]], ["SP", 2, 0, 18966528, [64], 1], ["AN", 2, 0, 5], ["AN", 2, 1, 6], ["PR", 2, 0, "auto_unroll_max_step$64"]]]], "r": [[0.00830952], 0, 2.00822, 1639069382], "v": "v0.6"}
{"i": [["[\"pool_layer\", \"avg\", 128, 84, 42, 42, 3, 3, 1, \"SAME\"]", "rocm -keys=rocm,gpu -max_num_threads=256 -mcpu=gfx906 -mtriple=amdgcn-amd-amdhsa-hcc -thread_warp_size=64", [-1, 16, 64, 65536, 2147483647, 1024, 16, 64], "", 0, []], [[], [["CI", 1], ["FU", 3, [0, 1, 2, 3]], ["SP", 3, 0, 18966528, [48], 1], ["AN", 3, 0, 5], ["AN", 3, 1, 6], ["FU", 2, [0, 1, 2, 3]], ["SP", 2, 0, 18966528, [64], 1], ["AN", 2, 0, 5], ["AN", 2, 1, 6], ["PR", 2, 0, "auto_unroll_max_step$16"]]]], "r": [[0.00161854], 0, 2.49794, 1639069384], "v": "v0.6"}
{"i": [["[\"pool_layer\", \"avg\", 128, 84, 42, 42, 3, 3, 1, \"SAME\"]", "rocm -keys=rocm,gpu -max_num_threads=256 -mcpu=gfx906 -mtriple=amdgcn-amd-amdhsa-hcc -thread_warp_size=64", [-1, 16, 64, 65536, 2147483647, 1024, 16, 64], "", 0, []], [[], [["CI", 1], ["FU", 3, [0, 1, 2, 3]], ["SP", 3, 0, 18966528, [1], 1], ["AN", 3, 0, 5], ["AN", 3, 1, 6], ["FU", 2, [0, 1, 2, 3]], ["SP", 2, 0, 18966528, [8], 1], ["AN", 2, 0, 5], ["AN", 2, 1, 6], ["PR", 2, 0, "auto_unroll_max_step$16"]]]], "r": [[0.0497592], 0, 2.39785, 1639069386], "v": "v0.6"}
{"i": [["[\"pool_layer\", \"avg\", 128, 84, 42, 42, 3, 3, 1, \"SAME\"]", "rocm -keys=rocm,gpu -max_num_threads=256 -mcpu=gfx906 -mtriple=amdgcn-amd-amdhsa-hcc -thread_warp_size=64", [-1, 16, 64, 65536, 2147483647, 1024, 16, 64], "", 0, []], [[], [["CI", 1], ["FU", 3, [0, 1, 2, 3]], ["SP", 3, 0, 18966528, [1], 1], ["AN", 3, 0, 5], ["AN", 3, 1, 6], ["FU", 2, [0, 1, 2, 3]], ["SP", 2, 0, 18966528, [1], 1], ["AN", 2, 0, 5], ["AN", 2, 1, 6], ["PR", 2, 0, "auto_unroll_max_step$0"]]]], "r": [[0.0884344], 0, 2.5505, 1639069388], "v": "v0.6"}
{"i": [["[\"pool_layer\", \"avg\", 128, 84, 42, 42, 3, 3, 1, \"SAME\"]", "rocm -keys=rocm,gpu -max_num_threads=256 -mcpu=gfx906 -mtriple=amdgcn-amd-amdhsa-hcc -thread_warp_size=64", [-1, 16, 64, 65536, 2147483647, 1024, 16, 64], "", 0, []], [[], [["CI", 1], ["FU", 3, [0, 1, 2, 3]], ["SP", 3, 0, 18966528, [12], 1], ["AN", 3, 0, 5], ["AN", 3, 1, 6], ["FU", 2, [0, 1, 2, 3]], ["SP", 2, 0, 18966528, [32], 1], ["AN", 2, 0, 5], ["AN", 2, 1, 6], ["PR", 2, 0, "auto_unroll_max_step$1024"]]]], "r": [[0.00521947], 0, 2.07224, 1639069390], "v": "v0.6"}
{"i": [["[\"pool_layer\", \"avg\", 128, 84, 42, 42, 3, 3, 1, \"SAME\"]", "rocm -keys=rocm,gpu -max_num_threads=256 -mcpu=gfx906 -mtriple=amdgcn-amd-amdhsa-hcc -thread_warp_size=64", [-1, 16, 64, 65536, 2147483647, 1024, 16, 64], "", 0, []], [[], [["CI", 1], ["FU", 3, [0, 1, 2, 3]], ["SP", 3, 0, 18966528, [32], 1], ["AN", 3, 0, 5], ["AN", 3, 1, 6], ["FU", 2, [0, 1, 2, 3]], ["SP", 2, 0, 18966528, [64], 1], ["AN", 2, 0, 5], ["AN", 2, 1, 6], ["PR", 2, 0, "auto_unroll_max_step$1024"]]]], "r": [[0.00207869], 0, 2.43243, 1639069392], "v": "v0.6"}
{"i": [["[\"pool_layer\", \"avg\", 128, 84, 42, 42, 3, 3, 1, \"SAME\"]", "rocm -keys=rocm,gpu -max_num_threads=256 -mcpu=gfx906 -mtriple=amdgcn-amd-amdhsa-hcc -thread_warp_size=64", [-1, 16, 64, 65536, 2147483647, 1024, 16, 64], "", 0, []], [[], [["CI", 1], ["FU", 3, [0, 1, 2, 3]], ["SP", 3, 0, 18966528, [64], 1], ["AN", 3, 0, 5], ["AN", 3, 1, 6], ["FU", 2, [0, 1, 2, 3]], ["SP", 2, 0, 18966528, [42], 1], ["AN", 2, 0, 5], ["AN", 2, 1, 6], ["PR", 2, 0, "auto_unroll_max_step$16"]]]], "r": [[0.00174938], 0, 2.48097, 1639069394], "v": "v0.6"}
{"i": [["[\"pool_layer\", \"avg\", 128, 84, 42, 42, 3, 3, 1, \"SAME\"]", "rocm -keys=rocm,gpu -max_num_threads=256 -mcpu=gfx906 -mtriple=amdgcn-amd-amdhsa-hcc -thread_warp_size=64", [-1, 16, 64, 65536, 2147483647, 1024, 16, 64], "", 0, []], [[], [["CI", 1], ["FU", 3, [0, 1, 2, 3]], ["SP", 3, 0, 18966528, [4], 1], ["AN", 3, 0, 5], ["AN", 3, 1, 6], ["FU", 2, [0, 1, 2, 3]], ["SP", 2, 0, 18966528, [4], 1], ["AN", 2, 0, 5], ["AN", 2, 1, 6], ["PR", 2, 0, "auto_unroll_max_step$1024"]]]], "r": [[0.0221197], 0, 2.28135, 1639069396], "v": "v0.6"}
{"i": [["[\"pool_layer\", \"avg\", 128, 84, 42, 42, 3, 3, 1, \"SAME\"]", "rocm -keys=rocm,gpu -max_num_threads=256 -mcpu=gfx906 -mtriple=amdgcn-amd-amdhsa-hcc -thread_warp_size=64", [-1, 16, 64, 65536, 2147483647, 1024, 16, 64], "", 0, []], [[], [["CI", 1], ["FU", 3, [0, 1, 2, 3]], ["SP", 3, 0, 18966528, [8], 1], ["AN", 3, 0, 5], ["AN", 3, 1, 6], ["FU", 2, [0, 1, 2, 3]], ["SP", 2, 0, 18966528, [64], 1], ["AN", 2, 0, 5], ["AN", 2, 1, 6], ["PR", 2, 0, "auto_unroll_max_step$1024"]]]], "r": [[0.00622437], 0, 2.34748, 1639069398], "v": "v0.6"}
{"i": [["[\"pool_layer\", \"avg\", 128, 84, 42, 42, 3, 3, 1, \"SAME\"]", "rocm -keys=rocm,gpu -max_num_threads=256 -mcpu=gfx906 -mtriple=amdgcn-amd-amdhsa-hcc -thread_warp_size=64", [-1, 16, 64, 65536, 2147483647, 1024, 16, 64], "", 0, []], [[], [["CI", 1], ["FU", 3, [0, 1, 2, 3]], ["SP", 3, 0, 18966528, [8], 1], ["AN", 3, 0, 5], ["AN", 3, 1, 6], ["FU", 2, [0, 1, 2, 3]], ["SP", 2, 0, 18966528, [1], 1], ["AN", 2, 0, 5], ["AN", 2, 1, 6], ["PR", 2, 0, "auto_unroll_max_step$0"]]]], "r": [[0.0497557], 0, 2.32859, 1639069400], "v": "v0.6"}
{"i": [["[\"pool_layer\", \"avg\", 128, 84, 42, 42, 3, 3, 1, \"SAME\"]", "rocm -keys=rocm,gpu -max_num_threads=256 -mcpu=gfx906 -mtriple=amdgcn-amd-amdhsa-hcc -thread_warp_size=64", [-1, 16, 64, 65536, 2147483647, 1024, 16, 64], "", 0, []], [[], [["CI", 1], ["FU", 3, [0, 1, 2, 3]], ["SP", 3, 0, 18966528, [64], 1], ["AN", 3, 0, 5], ["AN", 3, 1, 6], ["FU", 2, [0, 1, 2, 3]], ["SP", 2, 0, 18966528, [64], 1], ["AN", 2, 0, 5], ["AN", 2, 1, 6], ["PR", 2, 0, "auto_unroll_max_step$0"]]]], "r": [[0.00138815], 0, 2.40323, 1639069402], "v": "v0.6"}
{"i": [["[\"pool_layer\", \"avg\", 128, 84, 42, 42, 3, 3, 1, \"SAME\"]", "rocm -keys=rocm,gpu -max_num_threads=256 -mcpu=gfx906 -mtriple=amdgcn-amd-amdhsa-hcc -thread_warp_size=64", [-1, 16, 64, 65536, 2147483647, 1024, 16, 64], "", 0, []], [[], [["CI", 1], ["FU", 3, [0, 1, 2, 3]], ["SP", 3, 0, 18966528, [1], 1], ["AN", 3, 0, 5], ["AN", 3, 1, 6], ["FU", 2, [0, 1, 2, 3]], ["SP", 2, 0, 18966528, [64], 1], ["AN", 2, 0, 5], ["AN", 2, 1, 6], ["PR", 2, 0, "auto_unroll_max_step$0"]]]], "r": [[0.0449231], 0, 2.28805, 1639069404], "v": "v0.6"}
{"i": [["[\"pool_layer\", \"avg\", 128, 84, 42, 42, 3, 3, 1, \"SAME\"]", "rocm -keys=rocm,gpu -max_num_threads=256 -mcpu=gfx906 -mtriple=amdgcn-amd-amdhsa-hcc -thread_warp_size=64", [-1, 16, 64, 65536, 2147483647, 1024, 16, 64], "", 0, []], [[], [["CI", 1], ["FU", 3, [0, 1, 2, 3]], ["SP", 3, 0, 18966528, [64], 1], ["AN", 3, 0, 5], ["AN", 3, 1, 6], ["FU", 2, [0, 1, 2, 3]], ["SP", 2, 0, 18966528, [27], 1], ["AN", 2, 0, 5], ["AN", 2, 1, 6], ["PR", 2, 0, "auto_unroll_max_step$64"]]]], "r": [[0.00233329], 0, 2.53643, 1639069407], "v": "v0.6"}
{"i": [["[\"pool_layer\", \"avg\", 128, 84, 42, 42, 3, 3, 1, \"SAME\"]", "rocm -keys=rocm,gpu -max_num_threads=256 -mcpu=gfx906 -mtriple=amdgcn-amd-amdhsa-hcc -thread_warp_size=64", [-1, 16, 64, 65536, 2147483647, 1024, 16, 64], "", 0, []], [[], [["CI", 1], ["FU", 3, [0, 1, 2, 3]], ["SP", 3, 0, 18966528, [4], 1], ["AN", 3, 0, 5], ["AN", 3, 1, 6], ["FU", 2, [0, 1, 2, 3]], ["SP", 2, 0, 18966528, [32], 1], ["AN", 2, 0, 5], ["AN", 2, 1, 6], ["PR", 2, 0, "auto_unroll_max_step$0"]]]], "r": [[0.0128131], 0, 2.12421, 1639069408], "v": "v0.6"}
{"i": [["[\"pool_layer\", \"avg\", 128, 84, 42, 42, 3, 3, 1, \"SAME\"]", "rocm -keys=rocm,gpu -max_num_threads=256 -mcpu=gfx906 -mtriple=amdgcn-amd-amdhsa-hcc -thread_warp_size=64", [-1, 16, 64, 65536, 2147483647, 1024, 16, 64], "", 0, []], [[], [["CI", 1], ["FU", 3, [0, 1, 2, 3]], ["SP", 3, 0, 18966528, [48], 1], ["AN", 3, 0, 5], ["AN", 3, 1, 6], ["FU", 2, [0, 1, 2, 3]], ["SP", 2, 0, 18966528, [2], 1], ["AN", 2, 0, 5], ["AN", 2, 1, 6], ["PR", 2, 0, "auto_unroll_max_step$16"]]]], "r": [[0.0230343], 0, 2.5917, 1639069411], "v": "v0.6"}
{"i": [["[\"pool_layer\", \"avg\", 128, 84, 42, 42, 3, 3, 1, \"SAME\"]", "rocm -keys=rocm,gpu -max_num_threads=256 -mcpu=gfx906 -mtriple=amdgcn-amd-amdhsa-hcc -thread_warp_size=64", [-1, 16, 64, 65536, 2147483647, 1024, 16, 64], "", 0, []], [[], [["CI", 1], ["FU", 3, [0, 1, 2, 3]], ["SP", 3, 0, 18966528, [14], 1], ["AN", 3, 0, 5], ["AN", 3, 1, 6], ["FU", 2, [0, 1, 2, 3]], ["SP", 2, 0, 18966528, [56], 1], ["AN", 2, 0, 5], ["AN", 2, 1, 6], ["PR", 2, 0, "auto_unroll_max_step$64"]]]], "r": [[0.00407686], 0, 1.94151, 1639069412], "v": "v0.6"}
{"i": [["[\"pool_layer\", \"avg\", 128, 84, 42, 42, 3, 3, 1, \"SAME\"]", "rocm -keys=rocm,gpu -max_num_threads=256 -mcpu=gfx906 -mtriple=amdgcn-amd-amdhsa-hcc -thread_warp_size=64", [-1, 16, 64, 65536, 2147483647, 1024, 16, 64], "", 0, []], [[], [["CI", 1], ["FU", 3, [0, 1, 2, 3]], ["SP", 3, 0, 18966528, [1], 1], ["AN", 3, 0, 5], ["AN", 3, 1, 6], ["FU", 2, [0, 1, 2, 3]], ["SP", 2, 0, 18966528, [64], 1], ["AN", 2, 0, 5], ["AN", 2, 1, 6], ["PR", 2, 0, "auto_unroll_max_step$512"]]]], "r": [[0.0449231], 0, 2.22644, 1639069414], "v": "v0.6"}
{"i": [["[\"pool_layer\", \"avg\", 128, 84, 42, 42, 3, 3, 1, \"SAME\"]", "rocm -keys=rocm,gpu -max_num_threads=256 -mcpu=gfx906 -mtriple=amdgcn-amd-amdhsa-hcc -thread_warp_size=64", [-1, 16, 64, 65536, 2147483647, 1024, 16, 64], "", 0, []], [[], [["CI", 1], ["FU", 3, [0, 1, 2, 3]], ["SP", 3, 0, 18966528, [2], 1], ["AN", 3, 0, 5], ["AN", 3, 1, 6], ["FU", 2, [0, 1, 2, 3]], ["SP", 2, 0, 18966528, [56], 1], ["AN", 2, 0, 5], ["AN", 2, 1, 6], ["PR", 2, 0, "auto_unroll_max_step$64"]]]], "r": [[0.0229072], 0, 2.16019, 1639069416], "v": "v0.6"}
{"i": [["[\"pool_layer\", \"avg\", 128, 84, 42, 42, 3, 3, 1, \"SAME\"]", "rocm -keys=rocm,gpu -max_num_threads=256 -mcpu=gfx906 -mtriple=amdgcn-amd-amdhsa-hcc -thread_warp_size=64", [-1, 16, 64, 65536, 2147483647, 1024, 16, 64], "", 0, []], [[], [["CI", 1], ["FU", 3, [0, 1, 2, 3]], ["SP", 3, 0, 18966528, [36], 1], ["AN", 3, 0, 5], ["AN", 3, 1, 6], ["FU", 2, [0, 1, 2, 3]], ["SP", 2, 0, 18966528, [16], 1], ["AN", 2, 0, 5], ["AN", 2, 1, 6], ["PR", 2, 0, "auto_unroll_max_step$64"]]]], "r": [[0.00399583], 0, 2.49265, 1639069419], "v": "v0.6"}
{"i": [["[\"pool_layer\", \"avg\", 128, 84, 42, 42, 3, 3, 1, \"SAME\"]", "rocm -keys=rocm,gpu -max_num_threads=256 -mcpu=gfx906 -mtriple=amdgcn-amd-amdhsa-hcc -thread_warp_size=64", [-1, 16, 64, 65536, 2147483647, 1024, 16, 64], "", 0, []], [[], [["CI", 1], ["FU", 3, [0, 1, 2, 3]], ["SP", 3, 0, 18966528, [64], 1], ["AN", 3, 0, 5], ["AN", 3, 1, 6], ["FU", 2, [0, 1, 2, 3]], ["SP", 2, 0, 18966528, [2], 1], ["AN", 2, 0, 5], ["AN", 2, 1, 6], ["PR", 2, 0, "auto_unroll_max_step$512"]]]], "r": [[0.0228079], 0, 2.20403, 1639069421], "v": "v0.6"}
{"i": [["[\"pool_layer\", \"avg\", 128, 84, 42, 42, 3, 3, 1, \"SAME\"]", "rocm -keys=rocm,gpu -max_num_threads=256 -mcpu=gfx906 -mtriple=amdgcn-amd-amdhsa-hcc -thread_warp_size=64", [-1, 16, 64, 65536, 2147483647, 1024, 16, 64], "", 0, []], [[], [["CI", 1], ["FU", 3, [0, 1, 2, 3]], ["SP", 3, 0, 18966528, [1], 1], ["AN", 3, 0, 5], ["AN", 3, 1, 6], ["FU", 2, [0, 1, 2, 3]], ["SP", 2, 0, 18966528, [12], 1], ["AN", 2, 0, 5], ["AN", 2, 1, 6], ["PR", 2, 0, "auto_unroll_max_step$1024"]]]], "r": [[0.0479131], 0, 2.30133, 1639069423], "v": "v0.6"}
{"i": [["[\"pool_layer\", \"avg\", 128, 84, 42, 42, 3, 3, 1, \"SAME\"]", "rocm -keys=rocm,gpu -max_num_threads=256 -mcpu=gfx906 -mtriple=amdgcn-amd-amdhsa-hcc -thread_warp_size=64", [-1, 16, 64, 65536, 2147483647, 1024, 16, 64], "", 0, []], [[], [["CI", 1], ["FU", 3, [0, 1, 2, 3]], ["SP", 3, 0, 18966528, [1], 1], ["AN", 3, 0, 5], ["AN", 3, 1, 6], ["FU", 2, [0, 1, 2, 3]], ["SP", 2, 0, 18966528, [1], 1], ["AN", 2, 0, 5], ["AN", 2, 1, 6], ["PR", 2, 0, "auto_unroll_max_step$1024"]]]], "r": [[0.0884521], 0, 2.56669, 1639069425], "v": "v0.6"}
{"i": [["[\"pool_layer\", \"avg\", 128, 84, 42, 42, 3, 3, 1, \"SAME\"]", "rocm -keys=rocm,gpu -max_num_threads=256 -mcpu=gfx906 -mtriple=amdgcn-amd-amdhsa-hcc -thread_warp_size=64", [-1, 16, 64, 65536, 2147483647, 1024, 16, 64], "", 0, []], [[], [["CI", 1], ["FU", 3, [0, 1, 2, 3]], ["SP", 3, 0, 18966528, [64], 1], ["AN", 3, 0, 5], ["AN", 3, 1, 6], ["FU", 2, [0, 1, 2, 3]], ["SP", 2, 0, 18966528, [4], 1], ["AN", 2, 0, 5], ["AN", 2, 1, 6], ["PR", 2, 0, "auto_unroll_max_step$64"]]]], "r": [[0.0117501], 0, 2.45593, 1639069427], "v": "v0.6"}
{"i": [["[\"pool_layer\", \"avg\", 128, 84, 42, 42, 3, 3, 1, \"SAME\"]", "rocm -keys=rocm,gpu -max_num_threads=256 -mcpu=gfx906 -mtriple=amdgcn-amd-amdhsa-hcc -thread_warp_size=64", [-1, 16, 64, 65536, 2147483647, 1024, 16, 64], "", 0, []], [[], [["CI", 1], ["FU", 3, [0, 1, 2, 3]], ["SP", 3, 0, 18966528, [8], 1], ["AN", 3, 0, 5], ["AN", 3, 1, 6], ["FU", 2, [0, 1, 2, 3]], ["SP", 2, 0, 18966528, [16], 1], ["AN", 2, 0, 5], ["AN", 2, 1, 6], ["PR", 2, 0, "auto_unroll_max_step$512"]]]], "r": [[0.00829587], 0, 2.38763, 1639069429], "v": "v0.6"}
{"i": [["[\"pool_layer\", \"avg\", 128, 84, 42, 42, 3, 3, 1, \"SAME\"]", "rocm -keys=rocm,gpu -max_num_threads=256 -mcpu=gfx906 -mtriple=amdgcn-amd-amdhsa-hcc -thread_warp_size=64", [-1, 16, 64, 65536, 2147483647, 1024, 16, 64], "", 0, []], [[], [["CI", 1], ["FU", 3, [0, 1, 2, 3]], ["SP", 3, 0, 18966528, [48], 1], ["AN", 3, 0, 5], ["AN", 3, 1, 6], ["FU", 2, [0, 1, 2, 3]], ["SP", 2, 0, 18966528, [2], 1], ["AN", 2, 0, 5], ["AN", 2, 1, 6], ["PR", 2, 0, "auto_unroll_max_step$64"]]]], "r": [[0.0230337], 0, 2.1727, 1639069431], "v": "v0.6"}
{"i": [["[\"pool_layer\", \"avg\", 128, 84, 42, 42, 3, 3, 1, \"SAME\"]", "rocm -keys=rocm,gpu -max_num_threads=256 -mcpu=gfx906 -mtriple=amdgcn-amd-amdhsa-hcc -thread_warp_size=64", [-1, 16, 64, 65536, 2147483647, 1024, 16, 64], "", 0, []], [[], [["CI", 1], ["FU", 3, [0, 1, 2, 3]], ["SP", 3, 0, 18966528, [16], 1], ["AN", 3, 0, 5], ["AN", 3, 1, 6], ["FU", 2, [0, 1, 2, 3]], ["SP", 2, 0, 18966528, [64], 1], ["AN", 2, 0, 5], ["AN", 2, 1, 6], ["PR", 2, 0, "auto_unroll_max_step$1024"]]]], "r": [[0.00356567], 0, 2.04272, 1639069433], "v": "v0.6"}
{"i": [["[\"pool_layer\", \"avg\", 128, 84, 42, 42, 3, 3, 1, \"SAME\"]", "rocm -keys=rocm,gpu -max_num_threads=256 -mcpu=gfx906 -mtriple=amdgcn-amd-amdhsa-hcc -thread_warp_size=64", [-1, 16, 64, 65536, 2147483647, 1024, 16, 64], "", 0, []], [[], [["CI", 1], ["FU", 3, [0, 1, 2, 3]], ["SP", 3, 0, 18966528, [64], 1], ["AN", 3, 0, 5], ["AN", 3, 1, 6], ["FU", 2, [0, 1, 2, 3]], ["SP", 2, 0, 18966528, [48], 1], ["AN", 2, 0, 5], ["AN", 2, 1, 6], ["PR", 2, 0, "auto_unroll_max_step$1024"]]]], "r": [[0.00161719], 0, 2.33516, 1639069435], "v": "v0.6"}
{"i": [["[\"pool_layer\", \"avg\", 128, 84, 42, 42, 3, 3, 1, \"SAME\"]", "rocm -keys=rocm,gpu -max_num_threads=256 -mcpu=gfx906 -mtriple=amdgcn-amd-amdhsa-hcc -thread_warp_size=64", [-1, 16, 64, 65536, 2147483647, 1024, 16, 64], "", 0, []], [[], [["CI", 1], ["FU", 3, [0, 1, 2, 3]], ["SP", 3, 0, 18966528, [1], 1], ["AN", 3, 0, 5], ["AN", 3, 1, 6], ["FU", 2, [0, 1, 2, 3]], ["SP", 2, 0, 18966528, [7], 1], ["AN", 2, 0, 5], ["AN", 2, 1, 6], ["PR", 2, 0, "auto_unroll_max_step$1024"]]]], "r": [[0.0505468], 0, 2.24773, 1639069437], "v": "v0.6"}
{"i": [["[\"pool_layer\", \"avg\", 128, 84, 42, 42, 3, 3, 1, \"SAME\"]", "rocm -keys=rocm,gpu -max_num_threads=256 -mcpu=gfx906 -mtriple=amdgcn-amd-amdhsa-hcc -thread_warp_size=64", [-1, 16, 64, 65536, 2147483647, 1024, 16, 64], "", 0, []], [[], [["CI", 1], ["FU", 3, [0, 1, 2, 3]], ["SP", 3, 0, 18966528, [32], 1], ["AN", 3, 0, 5], ["AN", 3, 1, 6], ["FU", 2, [0, 1, 2, 3]], ["SP", 2, 0, 18966528, [2], 1], ["AN", 2, 0, 5], ["AN", 2, 1, 6], ["PR", 2, 0, "auto_unroll_max_step$0"]]]], "r": [[0.0234989], 0, 2.10886, 1639069439], "v": "v0.6"}
{"i": [["[\"pool_layer\", \"avg\", 128, 84, 42, 42, 3, 3, 1, \"SAME\"]", "rocm -keys=rocm,gpu -max_num_threads=256 -mcpu=gfx906 -mtriple=amdgcn-amd-amdhsa-hcc -thread_warp_size=64", [-1, 16, 64, 65536, 2147483647, 1024, 16, 64], "", 0, []], [[], [["CI", 1], ["FU", 3, [0, 1, 2, 3]], ["SP", 3, 0, 18966528, [1], 1], ["AN", 3, 0, 5], ["AN", 3, 1, 6], ["FU", 2, [0, 1, 2, 3]], ["SP", 2, 0, 18966528, [4], 1], ["AN", 2, 0, 5], ["AN", 2, 1, 6], ["PR", 2, 0, "auto_unroll_max_step$16"]]]], "r": [[0.0552747], 0, 2.24278, 1639069441], "v": "v0.6"}
{"i": [["[\"pool_layer\", \"avg\", 128, 84, 42, 42, 3, 3, 1, \"SAME\"]", "rocm -keys=rocm,gpu -max_num_threads=256 -mcpu=gfx906 -mtriple=amdgcn-amd-amdhsa-hcc -thread_warp_size=64", [-1, 16, 64, 65536, 2147483647, 1024, 16, 64], "", 0, []], [[], [["CI", 1], ["FU", 3, [0, 1, 2, 3]], ["SP", 3, 0, 18966528, [16], 1], ["AN", 3, 0, 5], ["AN", 3, 1, 6], ["FU", 2, [0, 1, 2, 3]], ["SP", 2, 0, 18966528, [64], 1], ["AN", 2, 0, 5], ["AN", 2, 1, 6], ["PR", 2, 0, "auto_unroll_max_step$64"]]]], "r": [[0.00357011], 0, 2.07123, 1639069443], "v": "v0.6"}
{"i": [["[\"pool_layer\", \"avg\", 128, 84, 42, 42, 3, 3, 1, \"SAME\"]", "rocm -keys=rocm,gpu -max_num_threads=256 -mcpu=gfx906 -mtriple=amdgcn-amd-amdhsa-hcc -thread_warp_size=64", [-1, 16, 64, 65536, 2147483647, 1024, 16, 64], "", 0, []], [[], [["CI", 1], ["FU", 3, [0, 1, 2, 3]], ["SP", 3, 0, 18966528, [1], 1], ["AN", 3, 0, 5], ["AN", 3, 1, 6], ["FU", 2, [0, 1, 2, 3]], ["SP", 2, 0, 18966528, [1], 1], ["AN", 2, 0, 5], ["AN", 2, 1, 6], ["PR", 2, 0, "auto_unroll_max_step$16"]]]], "r": [[0.088449], 0, 2.48792, 1639069445], "v": "v0.6"}
{"i": [["[\"pool_layer\", \"avg\", 128, 84, 42, 42, 3, 3, 1, \"SAME\"]", "rocm -keys=rocm,gpu -max_num_threads=256 -mcpu=gfx906 -mtriple=amdgcn-amd-amdhsa-hcc -thread_warp_size=64", [-1, 16, 64, 65536, 2147483647, 1024, 16, 64], "", 0, []], [[], [["CI", 1], ["FU", 3, [0, 1, 2, 3]], ["SP", 3, 0, 18966528, [12], 1], ["AN", 3, 0, 5], ["AN", 3, 1, 6], ["FU", 2, [0, 1, 2, 3]], ["SP", 2, 0, 18966528, [4], 1], ["AN", 2, 0, 5], ["AN", 2, 1, 6], ["PR", 2, 0, "auto_unroll_max_step$0"]]]], "r": [[0.0147438], 0, 2.4273, 1639069447], "v": "v0.6"}
{"i": [["[\"pool_layer\", \"avg\", 128, 84, 42, 42, 3, 3, 1, \"SAME\"]", "rocm -keys=rocm,gpu -max_num_threads=256 -mcpu=gfx906 -mtriple=amdgcn-amd-amdhsa-hcc -thread_warp_size=64", [-1, 16, 64, 65536, 2147483647, 1024, 16, 64], "", 0, []], [[], [["CI", 1], ["FU", 3, [0, 1, 2, 3]], ["SP", 3, 0, 18966528, [64], 1], ["AN", 3, 0, 5], ["AN", 3, 1, 6], ["FU", 2, [0, 1, 2, 3]], ["SP", 2, 0, 18966528, [64], 1], ["AN", 2, 0, 5], ["AN", 2, 1, 6], ["PR", 2, 0, "auto_unroll_max_step$512"]]]], "r": [[0.00138878], 0, 2.36533, 1639069449], "v": "v0.6"}
{"i": [["[\"pool_layer\", \"avg\", 128, 84, 42, 42, 3, 3, 1, \"SAME\"]", "rocm -keys=rocm,gpu -max_num_threads=256 -mcpu=gfx906 -mtriple=amdgcn-amd-amdhsa-hcc -thread_warp_size=64", [-1, 16, 64, 65536, 2147483647, 1024, 16, 64], "", 0, []], [[], [["CI", 1], ["FU", 3, [0, 1, 2, 3]], ["SP", 3, 0, 18966528, [64], 1], ["AN", 3, 0, 5], ["AN", 3, 1, 6], ["FU", 2, [0, 1, 2, 3]], ["SP", 2, 0, 18966528, [64], 1], ["AN", 2, 0, 5], ["AN", 2, 1, 6], ["PR", 2, 0, "auto_unroll_max_step$16"]]]], "r": [[0.00138806], 0, 2.37459, 1639069452], "v": "v0.6"}
{"i": [["[\"pool_layer\", \"avg\", 128, 84, 42, 42, 3, 3, 1, \"SAME\"]", "rocm -keys=rocm,gpu -max_num_threads=256 -mcpu=gfx906 -mtriple=amdgcn-amd-amdhsa-hcc -thread_warp_size=64", [-1, 16, 64, 65536, 2147483647, 1024, 16, 64], "", 0, []], [[], [["CI", 1], ["FU", 3, [0, 1, 2, 3]], ["SP", 3, 0, 18966528, [64], 1], ["AN", 3, 0, 5], ["AN", 3, 1, 6], ["FU", 2, [0, 1, 2, 3]], ["SP", 2, 0, 18966528, [64], 1], ["AN", 2, 0, 5], ["AN", 2, 1, 6], ["PR", 2, 0, "auto_unroll_max_step$1024"]]]], "r": [[0.0013889], 0, 2.34088, 1639069454], "v": "v0.6"}
{"i": [["[\"pool_layer\", \"avg\", 128, 84, 42, 42, 3, 3, 1, \"SAME\"]", "rocm -keys=rocm,gpu -max_num_threads=256 -mcpu=gfx906 -mtriple=amdgcn-amd-amdhsa-hcc -thread_warp_size=64", [-1, 16, 64, 65536, 2147483647, 1024, 16, 64], "", 0, []], [[], [["CI", 1], ["FU", 3, [0, 1, 2, 3]], ["SP", 3, 0, 18966528, [12], 1], ["AN", 3, 0, 5], ["AN", 3, 1, 6], ["FU", 2, [0, 1, 2, 3]], ["SP", 2, 0, 18966528, [4], 1], ["AN", 2, 0, 5], ["AN", 2, 1, 6], ["PR", 2, 0, "auto_unroll_max_step$1024"]]]], "r": [[0.0151602], 0, 2.11857, 1639069469], "v": "v0.6"}
{"i": [["[\"pool_layer\", \"avg\", 128, 84, 42, 42, 3, 3, 1, \"SAME\"]", "rocm -keys=rocm,gpu -max_num_threads=256 -mcpu=gfx906 -mtriple=amdgcn-amd-amdhsa-hcc -thread_warp_size=64", [-1, 16, 64, 65536, 2147483647, 1024, 16, 64], "", 0, []], [[], [["CI", 1], ["FU", 3, [0, 1, 2, 3]], ["SP", 3, 0, 18966528, [64], 1], ["AN", 3, 0, 5], ["AN", 3, 1, 6], ["FU", 2, [0, 1, 2, 3]], ["SP", 2, 0, 18966528, [2], 1], ["AN", 2, 0, 5], ["AN", 2, 1, 6], ["PR", 2, 0, "auto_unroll_max_step$16"]]]], "r": [[0.0228075], 0, 2.26867, 1639069471], "v": "v0.6"}
{"i": [["[\"pool_layer\", \"avg\", 128, 84, 42, 42, 3, 3, 1, \"SAME\"]", "rocm -keys=rocm,gpu -max_num_threads=256 -mcpu=gfx906 -mtriple=amdgcn-amd-amdhsa-hcc -thread_warp_size=64", [-1, 16, 64, 65536, 2147483647, 1024, 16, 64], "", 0, []], [[], [["CI", 1], ["FU", 3, [0, 1, 2, 3]], ["SP", 3, 0, 18966528, [54], 1], ["AN", 3, 0, 5], ["AN", 3, 1, 6], ["FU", 2, [0, 1, 2, 3]], ["SP", 2, 0, 18966528, [2], 1], ["AN", 2, 0, 5], ["AN", 2, 1, 6], ["PR", 2, 0, "auto_unroll_max_step$64"]]]], "r": [[0.0229356], 0, 2.36363, 1639069473], "v": "v0.6"}
{"i": [["[\"pool_layer\", \"avg\", 128, 84, 42, 42, 3, 3, 1, \"SAME\"]", "rocm -keys=rocm,gpu -max_num_threads=256 -mcpu=gfx906 -mtriple=amdgcn-amd-amdhsa-hcc -thread_warp_size=64", [-1, 16, 64, 65536, 2147483647, 1024, 16, 64], "", 0, []], [[], [["CI", 1], ["FU", 3, [0, 1, 2, 3]], ["SP", 3, 0, 18966528, [64], 1], ["AN", 3, 0, 5], ["AN", 3, 1, 6], ["FU", 2, [0, 1, 2, 3]], ["SP", 2, 0, 18966528, [1], 1], ["AN", 2, 0, 5], ["AN", 2, 1, 6], ["PR", 2, 0, "auto_unroll_max_step$512"]]]], "r": [[0.0449195], 0, 2.398, 1639069475], "v": "v0.6"}
{"i": [["[\"pool_layer\", \"avg\", 128, 84, 42, 42, 3, 3, 1, \"SAME\"]", "rocm -keys=rocm,gpu -max_num_threads=256 -mcpu=gfx906 -mtriple=amdgcn-amd-amdhsa-hcc -thread_warp_size=64", [-1, 16, 64, 65536, 2147483647, 1024, 16, 64], "", 0, []], [[], [["CI", 1], ["FU", 3, [0, 1, 2, 3]], ["SP", 3, 0, 18966528, [16], 1], ["AN", 3, 0, 5], ["AN", 3, 1, 6], ["FU", 2, [0, 1, 2, 3]], ["SP", 2, 0, 18966528, [64], 1], ["AN", 2, 0, 5], ["AN", 2, 1, 6], ["PR", 2, 0, "auto_unroll_max_step$512"]]]], "r": [[0.00357018], 0, 2.13501, 1639069476], "v": "v0.6"}
{"i": [["[\"pool_layer\", \"avg\", 128, 84, 42, 42, 3, 3, 1, \"SAME\"]", "rocm -keys=rocm,gpu -max_num_threads=256 -mcpu=gfx906 -mtriple=amdgcn-amd-amdhsa-hcc -thread_warp_size=64", [-1, 16, 64, 65536, 2147483647, 1024, 16, 64], "", 0, []], [[], [["CI", 1], ["FU", 3, [0, 1, 2, 3]], ["SP", 3, 0, 18966528, [32], 1], ["AN", 3, 0, 5], ["AN", 3, 1, 6], ["FU", 2, [0, 1, 2, 3]], ["SP", 2, 0, 18966528, [1], 1], ["AN", 2, 0, 5], ["AN", 2, 1, 6], ["PR", 2, 0, "auto_unroll_max_step$0"]]]], "r": [[0.045613], 0, 2.29903, 1639069478], "v": "v0.6"}
{"i": [["[\"pool_layer\", \"avg\", 128, 84, 42, 42, 3, 3, 1, \"SAME\"]", "rocm -keys=rocm,gpu -max_num_threads=256 -mcpu=gfx906 -mtriple=amdgcn-amd-amdhsa-hcc -thread_warp_size=64", [-1, 16, 64, 65536, 2147483647, 1024, 16, 64], "", 0, []], [[], [["CI", 1], ["FU", 3, [0, 1, 2, 3]], ["SP", 3, 0, 18966528, [1], 1], ["AN", 3, 0, 5], ["AN", 3, 1, 6], ["FU", 2, [0, 1, 2, 3]], ["SP", 2, 0, 18966528, [2], 1], ["AN", 2, 0, 5], ["AN", 2, 1, 6], ["PR", 2, 0, "auto_unroll_max_step$16"]]]], "r": [[0.0663404], 0, 2.50324, 1639069480], "v": "v0.6"}
{"i": [["[\"pool_layer\", \"avg\", 128, 84, 42, 42, 3, 3, 1, \"SAME\"]", "rocm -keys=rocm,gpu -max_num_threads=256 -mcpu=gfx906 -mtriple=amdgcn-amd-amdhsa-hcc -thread_warp_size=64", [-1, 16, 64, 65536, 2147483647, 1024, 16, 64], "", 0, []], [[], [["CI", 1], ["FU", 3, [0, 1, 2, 3]], ["SP", 3, 0, 18966528, [21], 1], ["AN", 3, 0, 5], ["AN", 3, 1, 6], ["FU", 2, [0, 1, 2, 3]], ["SP", 2, 0, 18966528, [8], 1], ["AN", 2, 0, 5], ["AN", 2, 1, 6], ["PR", 2, 0, "auto_unroll_max_step$0"]]]], "r": [[0.00763737], 0, 2.46632, 1639069482], "v": "v0.6"}
{"i": [["[\"pool_layer\", \"avg\", 128, 84, 42, 42, 3, 3, 1, \"SAME\"]", "rocm -keys=rocm,gpu -max_num_threads=256 -mcpu=gfx906 -mtriple=amdgcn-amd-amdhsa-hcc -thread_warp_size=64", [-1, 16, 64, 65536, 2147483647, 1024, 16, 64], "", 0, []], [[], [["CI", 1], ["FU", 3, [0, 1, 2, 3]], ["SP", 3, 0, 18966528, [4], 1], ["AN", 3, 0, 5], ["AN", 3, 1, 6], ["FU", 2, [0, 1, 2, 3]], ["SP", 2, 0, 18966528, [8], 1], ["AN", 2, 0, 5], ["AN", 2, 1, 6], ["PR", 2, 0, "auto_unroll_max_step$16"]]]], "r": [[0.0165862], 0, 2.49005, 1639069485], "v": "v0.6"}
{"i": [["[\"pool_layer\", \"avg\", 128, 84, 42, 42, 3, 3, 1, \"SAME\"]", "rocm -keys=rocm,gpu -max_num_threads=256 -mcpu=gfx906 -mtriple=amdgcn-amd-amdhsa-hcc -thread_warp_size=64", [-1, 16, 64, 65536, 2147483647, 1024, 16, 64], "", 0, []], [[], [["CI", 1], ["FU", 3, [0, 1, 2, 3]], ["SP", 3, 0, 18966528, [64], 1], ["AN", 3, 0, 5], ["AN", 3, 1, 6], ["FU", 2, [0, 1, 2, 3]], ["SP", 2, 0, 18966528, [4], 1], ["AN", 2, 0, 5], ["AN", 2, 1, 6], ["PR", 2, 0, "auto_unroll_max_step$0"]]]], "r": [[0.0117503], 0, 2.56796, 1639069487], "v": "v0.6"}
{"i": [["[\"pool_layer\", \"avg\", 128, 84, 42, 42, 3, 3, 1, \"SAME\"]", "rocm -keys=rocm,gpu -max_num_threads=256 -mcpu=gfx906 -mtriple=amdgcn-amd-amdhsa-hcc -thread_warp_size=64", [-1, 16, 64, 65536, 2147483647, 1024, 16, 64], "", 0, []], [[], [["CI", 1], ["FU", 3, [0, 1, 2, 3]], ["SP", 3, 0, 18966528, [8], 1], ["AN", 3, 0, 5], ["AN", 3, 1, 6], ["FU", 2, [0, 1, 2, 3]], ["SP", 2, 0, 18966528, [4], 1], ["AN", 2, 0, 5], ["AN", 2, 1, 6], ["PR", 2, 0, "auto_unroll_max_step$16"]]]], "r": [[0.0165884], 0, 2.28569, 1639069489], "v": "v0.6"}
{"i": [["[\"pool_layer\", \"avg\", 128, 84, 42, 42, 3, 3, 1, \"SAME\"]", "rocm -keys=rocm,gpu -max_num_threads=256 -mcpu=gfx906 -mtriple=amdgcn-amd-amdhsa-hcc -thread_warp_size=64", [-1, 16, 64, 65536, 2147483647, 1024, 16, 64], "", 0, []], [[], [["CI", 1], ["FU", 3, [0, 1, 2, 3]], ["SP", 3, 0, 18966528, [1], 1], ["AN", 3, 0, 5], ["AN", 3, 1, 6], ["FU", 2, [0, 1, 2, 3]], ["SP", 2, 0, 18966528, [8], 1], ["AN", 2, 0, 5], ["AN", 2, 1, 6], ["PR", 2, 0, "auto_unroll_max_step$0"]]]], "r": [[0.0497539], 0, 2.44859, 1639069491], "v": "v0.6"}
{"i": [["[\"pool_layer\", \"avg\", 128, 84, 42, 42, 3, 3, 1, \"SAME\"]", "rocm -keys=rocm,gpu -max_num_threads=256 -mcpu=gfx906 -mtriple=amdgcn-amd-amdhsa-hcc -thread_warp_size=64", [-1, 16, 64, 65536, 2147483647, 1024, 16, 64], "", 0, []], [[], [["CI", 1], ["FU", 3, [0, 1, 2, 3]], ["SP", 3, 0, 18966528, [42], 1], ["AN", 3, 0, 5], ["AN", 3, 1, 6], ["FU", 2, [0, 1, 2, 3]], ["SP", 2, 0, 18966528, [64], 1], ["AN", 2, 0, 5], ["AN", 2, 1, 6], ["PR", 2, 0, "auto_unroll_max_step$0"]]]], "r": [[0.00175009], 0, 2.43636, 1639069493], "v": "v0.6"}
{"i": [["[\"pool_layer\", \"avg\", 128, 84, 42, 42, 3, 3, 1, \"SAME\"]", "rocm -keys=rocm,gpu -max_num_threads=256 -mcpu=gfx906 -mtriple=amdgcn-amd-amdhsa-hcc -thread_warp_size=64", [-1, 16, 64, 65536, 2147483647, 1024, 16, 64], "", 0, []], [[], [["CI", 1], ["FU", 3, [0, 1, 2, 3]], ["SP", 3, 0, 18966528, [2], 1], ["AN", 3, 0, 5], ["AN", 3, 1, 6], ["FU", 2, [0, 1, 2, 3]], ["SP", 2, 0, 18966528, [4], 1], ["AN", 2, 0, 5], ["AN", 2, 1, 6], ["PR", 2, 0, "auto_unroll_max_step$512"]]]], "r": [[0.0331666], 0, 2.76985, 1639069495], "v": "v0.6"}
{"i": [["[\"pool_layer\", \"avg\", 128, 84, 42, 42, 3, 3, 1, \"SAME\"]", "rocm -keys=rocm,gpu -max_num_threads=256 -mcpu=gfx906 -mtriple=amdgcn-amd-amdhsa-hcc -thread_warp_size=64", [-1, 16, 64, 65536, 2147483647, 1024, 16, 64], "", 0, []], [[], [["CI", 1], ["FU", 3, [0, 1, 2, 3]], ["SP", 3, 0, 18966528, [2], 1], ["AN", 3, 0, 5], ["AN", 3, 1, 6], ["FU", 2, [0, 1, 2, 3]], ["SP", 2, 0, 18966528, [56], 1], ["AN", 2, 0, 5], ["AN", 2, 1, 6], ["PR", 2, 0, "auto_unroll_max_step$1024"]]]], "r": [[0.02291], 0, 2.2574, 1639069497], "v": "v0.6"}
{"i": [["[\"pool_layer\", \"avg\", 128, 84, 42, 42, 3, 3, 1, \"SAME\"]", "rocm -keys=rocm,gpu -max_num_threads=256 -mcpu=gfx906 -mtriple=amdgcn-amd-amdhsa-hcc -thread_warp_size=64", [-1, 16, 64, 65536, 2147483647, 1024, 16, 64], "", 0, []], [[], [["CI", 1], ["FU", 3, [0, 1, 2, 3]], ["SP", 3, 0, 18966528, [64], 1], ["AN", 3, 0, 5], ["AN", 3, 1, 6], ["FU", 2, [0, 1, 2, 3]], ["SP", 2, 0, 18966528, [2], 1], ["AN", 2, 0, 5], ["AN", 2, 1, 6], ["PR", 2, 0, "auto_unroll_max_step$64"]]]], "r": [[0.0228078], 0, 2.24516, 1639069499], "v": "v0.6"}
{"i": [["[\"pool_layer\", \"avg\", 128, 84, 42, 42, 3, 3, 1, \"SAME\"]", "rocm -keys=rocm,gpu -max_num_threads=256 -mcpu=gfx906 -mtriple=amdgcn-amd-amdhsa-hcc -thread_warp_size=64", [-1, 16, 64, 65536, 2147483647, 1024, 16, 64], "", 0, []], [[], [["CI", 1], ["FU", 3, [0, 1, 2, 3]], ["SP", 3, 0, 18966528, [32], 1], ["AN", 3, 0, 5], ["AN", 3, 1, 6], ["FU", 2, [0, 1, 2, 3]], ["SP", 2, 0, 18966528, [2], 1], ["AN", 2, 0, 5], ["AN", 2, 1, 6], ["PR", 2, 0, "auto_unroll_max_step$64"]]]], "r": [[0.0234989], 0, 2.27312, 1639069501], "v": "v0.6"}
{"i": [["[\"pool_layer\", \"avg\", 128, 84, 42, 42, 3, 3, 1, \"SAME\"]", "rocm -keys=rocm,gpu -max_num_threads=256 -mcpu=gfx906 -mtriple=amdgcn-amd-amdhsa-hcc -thread_warp_size=64", [-1, 16, 64, 65536, 2147483647, 1024, 16, 64], "", 0, []], [[], [["CI", 1], ["FU", 3, [0, 1, 2, 3]], ["SP", 3, 0, 18966528, [6], 1], ["AN", 3, 0, 5], ["AN", 3, 1, 6], ["FU", 2, [0, 1, 2, 3]], ["SP", 2, 0, 18966528, [56], 1], ["AN", 2, 0, 5], ["AN", 2, 1, 6], ["PR", 2, 0, "auto_unroll_max_step$16"]]]], "r": [[0.00816522], 0, 2.20293, 1639069503], "v": "v0.6"}
{"i": [["[\"pool_layer\", \"avg\", 128, 84, 42, 42, 3, 3, 1, \"SAME\"]", "rocm -keys=rocm,gpu -max_num_threads=256 -mcpu=gfx906 -mtriple=amdgcn-amd-amdhsa-hcc -thread_warp_size=64", [-1, 16, 64, 65536, 2147483647, 1024, 16, 64], "", 0, []], [[], [["CI", 1], ["FU", 3, [0, 1, 2, 3]], ["SP", 3, 0, 18966528, [64], 1], ["AN", 3, 0, 5], ["AN", 3, 1, 6], ["FU", 2, [0, 1, 2, 3]], ["SP", 2, 0, 18966528, [32], 1], ["AN", 2, 0, 5], ["AN", 2, 1, 6], ["PR", 2, 0, "auto_unroll_max_step$64"]]]], "r": [[0.00207692], 0, 2.35118, 1639069505], "v": "v0.6"}
{"i": [["[\"pool_layer\", \"avg\", 128, 84, 42, 42, 3, 3, 1, \"SAME\"]", "rocm -keys=rocm,gpu -max_num_threads=256 -mcpu=gfx906 -mtriple=amdgcn-amd-amdhsa-hcc -thread_warp_size=64", [-1, 16, 64, 65536, 2147483647, 1024, 16, 64], "", 0, []], [[], [["CI", 1], ["FU", 3, [0, 1, 2, 3]], ["SP", 3, 0, 18966528, [42], 1], ["AN", 3, 0, 5], ["AN", 3, 1, 6], ["FU", 2, [0, 1, 2, 3]], ["SP", 2, 0, 18966528, [56], 1], ["AN", 2, 0, 5], ["AN", 2, 1, 6], ["PR", 2, 0, "auto_unroll_max_step$16"]]]], "r": [[0.00184849], 0, 2.47656, 1639069507], "v": "v0.6"}
{"i": [["[\"pool_layer\", \"avg\", 128, 84, 42, 42, 3, 3, 1, \"SAME\"]", "rocm -keys=rocm,gpu -max_num_threads=256 -mcpu=gfx906 -mtriple=amdgcn-amd-amdhsa-hcc -thread_warp_size=64", [-1, 16, 64, 65536, 2147483647, 1024, 16, 64], "", 0, []], [[], [["CI", 1], ["FU", 3, [0, 1, 2, 3]], ["SP", 3, 0, 18966528, [64], 1], ["AN", 3, 0, 5], ["AN", 3, 1, 6], ["FU", 2, [0, 1, 2, 3]], ["SP", 2, 0, 18966528, [1], 1], ["AN", 2, 0, 5], ["AN", 2, 1, 6], ["PR", 2, 0, "auto_unroll_max_step$0"]]]], "r": [[0.0449205], 0, 2.33058, 1639069509], "v": "v0.6"}
{"i": [["[\"pool_layer\", \"avg\", 128, 84, 42, 42, 3, 3, 1, \"SAME\"]", "rocm -keys=rocm,gpu -max_num_threads=256 -mcpu=gfx906 -mtriple=amdgcn-amd-amdhsa-hcc -thread_warp_size=64", [-1, 16, 64, 65536, 2147483647, 1024, 16, 64], "", 0, []], [[], [["CI", 1], ["FU", 3, [0, 1, 2, 3]], ["SP", 3, 0, 18966528, [4], 1], ["AN", 3, 0, 5], ["AN", 3, 1, 6], ["FU", 2, [0, 1, 2, 3]], ["SP", 2, 0, 18966528, [36], 1], ["AN", 2, 0, 5], ["AN", 2, 1, 6], ["PR", 2, 0, "auto_unroll_max_step$64"]]]], "r": [[0.0122877], 0, 2.43295, 1639069512], "v": "v0.6"}
{"i": [["[\"pool_layer\", \"avg\", 128, 84, 42, 42, 3, 3, 1, \"SAME\"]", "rocm -keys=rocm,gpu -max_num_threads=256 -mcpu=gfx906 -mtriple=amdgcn-amd-amdhsa-hcc -thread_warp_size=64", [-1, 16, 64, 65536, 2147483647, 1024, 16, 64], "", 0, []], [[], [["CI", 1], ["FU", 3, [0, 1, 2, 3]], ["SP", 3, 0, 18966528, [4], 1], ["AN", 3, 0, 5], ["AN", 3, 1, 6], ["FU", 2, [0, 1, 2, 3]], ["SP", 2, 0, 18966528, [16], 1], ["AN", 2, 0, 5], ["AN", 2, 1, 6], ["PR", 2, 0, "auto_unroll_max_step$512"]]]], "r": [[0.0141775], 0, 2.08582, 1639069513], "v": "v0.6"}
{"i": [["[\"pool_layer\", \"avg\", 128, 84, 42, 42, 3, 3, 1, \"SAME\"]", "rocm -keys=rocm,gpu -max_num_threads=256 -mcpu=gfx906 -mtriple=amdgcn-amd-amdhsa-hcc -thread_warp_size=64", [-1, 16, 64, 65536, 2147483647, 1024, 16, 64], "", 0, []], [[], [["CI", 1], ["FU", 3, [0, 1, 2, 3]], ["SP", 3, 0, 18966528, [12], 1], ["AN", 3, 0, 5], ["AN", 3, 1, 6], ["FU", 2, [0, 1, 2, 3]], ["SP", 2, 0, 18966528, [49], 1], ["AN", 2, 0, 5], ["AN", 2, 1, 6], ["PR", 2, 0, "auto_unroll_max_step$64"]]]], "r": [[0.00473145], 0, 2.02946, 1639069515], "v": "v0.6"}
{"i": [["[\"pool_layer\", \"avg\", 128, 84, 42, 42, 3, 3, 1, \"SAME\"]", "rocm -keys=rocm,gpu -max_num_threads=256 -mcpu=gfx906 -mtriple=amdgcn-amd-amdhsa-hcc -thread_warp_size=64", [-1, 16, 64, 65536, 2147483647, 1024, 16, 64], "", 0, []], [[], [["CI", 1], ["FU", 3, [0, 1, 2, 3]], ["SP", 3, 0, 18966528, [56], 1], ["AN", 3, 0, 5], ["AN", 3, 1, 6], ["FU", 2, [0, 1, 2, 3]], ["SP", 2, 0, 18966528, [32], 1], ["AN", 2, 0, 5], ["AN", 2, 1, 6], ["PR", 2, 0, "auto_unroll_max_step$512"]]]], "r": [[0.00217632], 0, 2.37532, 1639069517], "v": "v0.6"}
{"i": [["[\"pool_layer\", \"avg\", 128, 84, 42, 42, 3, 3, 1, \"SAME\"]", "rocm -keys=rocm,gpu -max_num_threads=256 -mcpu=gfx906 -mtriple=amdgcn-amd-amdhsa-hcc -thread_warp_size=64", [-1, 16, 64, 65536, 2147483647, 1024, 16, 64], "", 0, []], [[], [["CI", 1], ["FU", 3, [0, 1, 2, 3]], ["SP", 3, 0, 18966528, [64], 1], ["AN", 3, 0, 5], ["AN", 3, 1, 6], ["FU", 2, [0, 1, 2, 3]], ["SP", 2, 0, 18966528, [2], 1], ["AN", 2, 0, 5], ["AN", 2, 1, 6], ["PR", 2, 0, "auto_unroll_max_step$1024"]]]], "r": [[0.0228039], 0, 2.56678, 1639069520], "v": "v0.6"}
{"i": [["[\"pool_layer\", \"avg\", 128, 84, 42, 42, 3, 3, 1, \"SAME\"]", "rocm -keys=rocm,gpu -max_num_threads=256 -mcpu=gfx906 -mtriple=amdgcn-amd-amdhsa-hcc -thread_warp_size=64", [-1, 16, 64, 65536, 2147483647, 1024, 16, 64], "", 0, []], [[], [["CI", 1], ["FU", 3, [0, 1, 2, 3]], ["SP", 3, 0, 18966528, [1], 1], ["AN", 3, 0, 5], ["AN", 3, 1, 6], ["FU", 2, [0, 1, 2, 3]], ["SP", 2, 0, 18966528, [4], 1], ["AN", 2, 0, 5], ["AN", 2, 1, 6], ["PR", 2, 0, "auto_unroll_max_step$64"]]]], "r": [[0.0552827], 0, 2.32648, 1639069522], "v": "v0.6"}
{"i": [["[\"pool_layer\", \"avg\", 128, 84, 42, 42, 3, 3, 1, \"SAME\"]", "rocm -keys=rocm,gpu -max_num_threads=256 -mcpu=gfx906 -mtriple=amdgcn-amd-amdhsa-hcc -thread_warp_size=64", [-1, 16, 64, 65536, 2147483647, 1024, 16, 64], "", 0, []], [[], [["CI", 1], ["FU", 3, [0, 1, 2, 3]], ["SP", 3, 0, 18966528, [2], 1], ["AN", 3, 0, 5], ["AN", 3, 1, 6], ["FU", 2, [0, 1, 2, 3]], ["SP", 2, 0, 18966528, [64], 1], ["AN", 2, 0, 5], ["AN", 2, 1, 6], ["PR", 2, 0, "auto_unroll_max_step$64"]]]], "r": [[0.0228096], 0, 2.24963, 1639069524], "v": "v0.6"}
{"i": [["[\"pool_layer\", \"avg\", 128, 84, 42, 42, 3, 3, 1, \"SAME\"]", "rocm -keys=rocm,gpu -max_num_threads=256 -mcpu=gfx906 -mtriple=amdgcn-amd-amdhsa-hcc -thread_warp_size=64", [-1, 16, 64, 65536, 2147483647, 1024, 16, 64], "", 0, []], [[], [["CI", 1], ["FU", 3, [0, 1, 2, 3]], ["SP", 3, 0, 18966528, [8], 1], ["AN", 3, 0, 5], ["AN", 3, 1, 6], ["FU", 2, [0, 1, 2, 3]], ["SP", 2, 0, 18966528, [16], 1], ["AN", 2, 0, 5], ["AN", 2, 1, 6], ["PR", 2, 0, "auto_unroll_max_step$1024"]]]], "r": [[0.0085225], 0, 2.20437, 1639069525], "v": "v0.6"}
{"i": [["[\"pool_layer\", \"avg\", 128, 84, 42, 42, 3, 3, 1, \"SAME\"]", "rocm -keys=rocm,gpu -max_num_threads=256 -mcpu=gfx906 -mtriple=amdgcn-amd-amdhsa-hcc -thread_warp_size=64", [-1, 16, 64, 65536, 2147483647, 1024, 16, 64], "", 0, []], [[], [["CI", 1], ["FU", 3, [0, 1, 2, 3]], ["SP", 3, 0, 18966528, [3], 1], ["AN", 3, 0, 5], ["AN", 3, 1, 6], ["FU", 2, [0, 1, 2, 3]], ["SP", 2, 0, 18966528, [4], 1], ["AN", 2, 0, 5], ["AN", 2, 1, 6], ["PR", 2, 0, "auto_unroll_max_step$64"]]]], "r": [[0.0257977], 0, 2.55632, 1639069528], "v": "v0.6"}
{"i": [["[\"pool_layer\", \"avg\", 128, 84, 42, 42, 3, 3, 1, \"SAME\"]", "rocm -keys=rocm,gpu -max_num_threads=256 -mcpu=gfx906 -mtriple=amdgcn-amd-amdhsa-hcc -thread_warp_size=64", [-1, 16, 64, 65536, 2147483647, 1024, 16, 64], "", 0, []], [[], [["CI", 1], ["FU", 3, [0, 1, 2, 3]], ["SP", 3, 0, 18966528, [4], 1], ["AN", 3, 0, 5], ["AN", 3, 1, 6], ["FU", 2, [0, 1, 2, 3]], ["SP", 2, 0, 18966528, [1], 1], ["AN", 2, 0, 5], ["AN", 2, 1, 6], ["PR", 2, 0, "auto_unroll_max_step$16"]]]], "r": [[0.0552736], 0, 2.34627, 1639069530], "v": "v0.6"}
{"i": [["[\"pool_layer\", \"avg\", 128, 84, 42, 42, 3, 3, 1, \"SAME\"]", "rocm -keys=rocm,gpu -max_num_threads=256 -mcpu=gfx906 -mtriple=amdgcn-amd-amdhsa-hcc -thread_warp_size=64", [-1, 16, 64, 65536, 2147483647, 1024, 16, 64], "", 0, []], [[], [["CI", 1], ["FU", 3, [0, 1, 2, 3]], ["SP", 3, 0, 18966528, [64], 1], ["AN", 3, 0, 5], ["AN", 3, 1, 6], ["FU", 2, [0, 1, 2, 3]], ["SP", 2, 0, 18966528, [8], 1], ["AN", 2, 0, 5], ["AN", 2, 1, 6], ["PR", 2, 0, "auto_unroll_max_step$0"]]]], "r": [[0.0064092], 0, 2.10492, 1639069531], "v": "v0.6"}
{"i": [["[\"pool_layer\", \"avg\", 128, 84, 42, 42, 3, 3, 1, \"SAME\"]", "rocm -keys=rocm,gpu -max_num_threads=256 -mcpu=gfx906 -mtriple=amdgcn-amd-amdhsa-hcc -thread_warp_size=64", [-1, 16, 64, 65536, 2147483647, 1024, 16, 64], "", 0, []], [[], [["CI", 1], ["FU", 3, [0, 1, 2, 3]], ["SP", 3, 0, 18966528, [21], 1], ["AN", 3, 0, 5], ["AN", 3, 1, 6], ["FU", 2, [0, 1, 2, 3]], ["SP", 2, 0, 18966528, [8], 1], ["AN", 2, 0, 5], ["AN", 2, 1, 6], ["PR", 2, 0, "auto_unroll_max_step$64"]]]], "r": [[0.00786472], 0, 2.10369, 1639069533], "v": "v0.6"}
{"i": [["[\"pool_layer\", \"avg\", 128, 84, 42, 42, 3, 3, 1, \"SAME\"]", "rocm -keys=rocm,gpu -max_num_threads=256 -mcpu=gfx906 -mtriple=amdgcn-amd-amdhsa-hcc -thread_warp_size=64", [-1, 16, 64, 65536, 2147483647, 1024, 16, 64], "", 0, []], [[], [["CI", 1], ["FU", 3, [0, 1, 2, 3]], ["SP", 3, 0, 18966528, [32], 1], ["AN", 3, 0, 5], ["AN", 3, 1, 6], ["FU", 2, [0, 1, 2, 3]], ["SP", 2, 0, 18966528, [27], 1], ["AN", 2, 0, 5], ["AN", 2, 1, 6], ["PR", 2, 0, "auto_unroll_max_step$64"]]]], "r": [[0.00302393], 0, 2.48696, 1639069535], "v": "v0.6"}
{"i": [["[\"pool_layer\", \"avg\", 128, 84, 42, 42, 3, 3, 1, \"SAME\"]", "rocm -keys=rocm,gpu -max_num_threads=256 -mcpu=gfx906 -mtriple=amdgcn-amd-amdhsa-hcc -thread_warp_size=64", [-1, 16, 64, 65536, 2147483647, 1024, 16, 64], "", 0, []], [[], [["CI", 1], ["FU", 3, [0, 1, 2, 3]], ["SP", 3, 0, 18966528, [6], 1], ["AN", 3, 0, 5], ["AN", 3, 1, 6], ["FU", 2, [0, 1, 2, 3]], ["SP", 2, 0, 18966528, [27], 1], ["AN", 2, 0, 5], ["AN", 2, 1, 6], ["PR", 2, 0, "auto_unroll_max_step$64"]]]], "r": [[0.00901089], 0, 2.35816, 1639069538], "v": "v0.6"}
{"i": [["[\"pool_layer\", \"avg\", 128, 84, 42, 42, 3, 3, 1, \"SAME\"]", "rocm -keys=rocm,gpu -max_num_threads=256 -mcpu=gfx906 -mtriple=amdgcn-amd-amdhsa-hcc -thread_warp_size=64", [-1, 16, 64, 65536, 2147483647, 1024, 16, 64], "", 0, []], [[], [["CI", 1], ["FU", 3, [0, 1, 2, 3]], ["SP", 3, 0, 18966528, [1], 1], ["AN", 3, 0, 5], ["AN", 3, 1, 6], ["FU", 2, [0, 1, 2, 3]], ["SP", 2, 0, 18966528, [24], 1], ["AN", 2, 0, 5], ["AN", 2, 1, 6], ["PR", 2, 0, "auto_unroll_max_step$16"]]]], "r": [[0.0460701], 0, 2.21985, 1639069540], "v": "v0.6"}
{"i": [["[\"pool_layer\", \"avg\", 128, 84, 42, 42, 3, 3, 1, \"SAME\"]", "rocm -keys=rocm,gpu -max_num_threads=256 -mcpu=gfx906 -mtriple=amdgcn-amd-amdhsa-hcc -thread_warp_size=64", [-1, 16, 64, 65536, 2147483647, 1024, 16, 64], "", 0, []], [[], [["CI", 1], ["FU", 3, [0, 1, 2, 3]], ["SP", 3, 0, 18966528, [32], 1], ["AN", 3, 0, 5], ["AN", 3, 1, 6], ["FU", 2, [0, 1, 2, 3]], ["SP", 2, 0, 18966528, [64], 1], ["AN", 2, 0, 5], ["AN", 2, 1, 6], ["PR", 2, 0, "auto_unroll_max_step$512"]]]], "r": [[0.00207855], 0, 2.38462, 1639069542], "v": "v0.6"}
{"i": [["[\"pool_layer\", \"avg\", 128, 84, 42, 42, 3, 3, 1, \"SAME\"]", "rocm -keys=rocm,gpu -max_num_threads=256 -mcpu=gfx906 -mtriple=amdgcn-amd-amdhsa-hcc -thread_warp_size=64", [-1, 16, 64, 65536, 2147483647, 1024, 16, 64], "", 0, []], [[], [["CI", 1], ["FU", 3, [0, 1, 2, 3]], ["SP", 3, 0, 18966528, [2], 1], ["AN", 3, 0, 5], ["AN", 3, 1, 6], ["FU", 2, [0, 1, 2, 3]], ["SP", 2, 0, 18966528, [21], 1], ["AN", 2, 0, 5], ["AN", 2, 1, 6], ["PR", 2, 0, "auto_unroll_max_step$16"]]]], "r": [[0.024223], 0, 2.26993, 1639069544], "v": "v0.6"}
{"i": [["[\"pool_layer\", \"avg\", 128, 84, 42, 42, 3, 3, 1, \"SAME\"]", "rocm -keys=rocm,gpu -max_num_threads=256 -mcpu=gfx906 -mtriple=amdgcn-amd-amdhsa-hcc -thread_warp_size=64", [-1, 16, 64, 65536, 2147483647, 1024, 16, 64], "", 0, []], [[], [["CI", 1], ["FU", 3, [0, 1, 2, 3]], ["SP", 3, 0, 18966528, [8], 1], ["AN", 3, 0, 5], ["AN", 3, 1, 6], ["FU", 2, [0, 1, 2, 3]], ["SP", 2, 0, 18966528, [1], 1], ["AN", 2, 0, 5], ["AN", 2, 1, 6], ["PR", 2, 0, "auto_unroll_max_step$512"]]]], "r": [[0.0497552], 0, 2.42998, 1639069546], "v": "v0.6"}
{"i": [["[\"pool_layer\", \"avg\", 128, 84, 42, 42, 3, 3, 1, \"SAME\"]", "rocm -keys=rocm,gpu -max_num_threads=256 -mcpu=gfx906 -mtriple=amdgcn-amd-amdhsa-hcc -thread_warp_size=64", [-1, 16, 64, 65536, 2147483647, 1024, 16, 64], "", 0, []], [[], [["CI", 1], ["FU", 3, [0, 1, 2, 3]], ["SP", 3, 0, 18966528, [4], 1], ["AN", 3, 0, 5], ["AN", 3, 1, 6], ["FU", 2, [0, 1, 2, 3]], ["SP", 2, 0, 18966528, [24], 1], ["AN", 2, 0, 5], ["AN", 2, 1, 6], ["PR", 2, 0, "auto_unroll_max_step$0"]]]], "r": [[0.0129017], 0, 2.43579, 1639069548], "v": "v0.6"}
{"i": [["[\"pool_layer\", \"avg\", 128, 84, 42, 42, 3, 3, 1, \"SAME\"]", "rocm -keys=rocm,gpu -max_num_threads=256 -mcpu=gfx906 -mtriple=amdgcn-amd-amdhsa-hcc -thread_warp_size=64", [-1, 16, 64, 65536, 2147483647, 1024, 16, 64], "", 0, []], [[], [["CI", 1], ["FU", 3, [0, 1, 2, 3]], ["SP", 3, 0, 18966528, [2], 1], ["AN", 3, 0, 5], ["AN", 3, 1, 6], ["FU", 2, [0, 1, 2, 3]], ["SP", 2, 0, 18966528, [4], 1], ["AN", 2, 0, 5], ["AN", 2, 1, 6], ["PR", 2, 0, "auto_unroll_max_step$64"]]]], "r": [[0.0331718], 0, 2.25246, 1639069550], "v": "v0.6"}
{"i": [["[\"pool_layer\", \"avg\", 128, 84, 42, 42, 3, 3, 1, \"SAME\"]", "rocm -keys=rocm,gpu -max_num_threads=256 -mcpu=gfx906 -mtriple=amdgcn-amd-amdhsa-hcc -thread_warp_size=64", [-1, 16, 64, 65536, 2147483647, 1024, 16, 64], "", 0, []], [[], [["CI", 1], ["FU", 3, [0, 1, 2, 3]], ["SP", 3, 0, 18966528, [4], 1], ["AN", 3, 0, 5], ["AN", 3, 1, 6], ["FU", 2, [0, 1, 2, 3]], ["SP", 2, 0, 18966528, [12], 1], ["AN", 2, 0, 5], ["AN", 2, 1, 6], ["PR", 2, 0, "auto_unroll_max_step$1024"]]]], "r": [[0.0147442], 0, 2.49675, 1639069552], "v": "v0.6"}
{"i": [["[\"pool_layer\", \"avg\", 128, 84, 42, 42, 3, 3, 1, \"SAME\"]", "rocm -keys=rocm,gpu -max_num_threads=256 -mcpu=gfx906 -mtriple=amdgcn-amd-amdhsa-hcc -thread_warp_size=64", [-1, 16, 64, 65536, 2147483647, 1024, 16, 64], "", 0, []], [[], [["CI", 1], ["FU", 3, [0, 1, 2, 3]], ["SP", 3, 0, 18966528, [1], 1], ["AN", 3, 0, 5], ["AN", 3, 1, 6], ["FU", 2, [0, 1, 2, 3]], ["SP", 2, 0, 18966528, [16], 1], ["AN", 2, 0, 5], ["AN", 2, 1, 6], ["PR", 2, 0, "auto_unroll_max_step$16"]]]], "r": [[0.046995], 0, 2.36761, 1639069554], "v": "v0.6"}
{"i": [["[\"pool_layer\", \"avg\", 128, 84, 42, 42, 3, 3, 1, \"SAME\"]", "rocm -keys=rocm,gpu -max_num_threads=256 -mcpu=gfx906 -mtriple=amdgcn-amd-amdhsa-hcc -thread_warp_size=64", [-1, 16, 64, 65536, 2147483647, 1024, 16, 64], "", 0, []], [[], [["CI", 1], ["FU", 3, [0, 1, 2, 3]], ["SP", 3, 0, 18966528, [28], 1], ["AN", 3, 0, 5], ["AN", 3, 1, 6], ["FU", 2, [0, 1, 2, 3]], ["SP", 2, 0, 18966528, [1], 1], ["AN", 2, 0, 5], ["AN", 2, 1, 6], ["PR", 2, 0, "auto_unroll_max_step$512"]]]], "r": [[0.0458081], 0, 2.37109, 1639069556], "v": "v0.6"}
{"i": [["[\"pool_layer\", \"avg\", 128, 84, 42, 42, 3, 3, 1, \"SAME\"]", "rocm -keys=rocm,gpu -max_num_threads=256 -mcpu=gfx906 -mtriple=amdgcn-amd-amdhsa-hcc -thread_warp_size=64", [-1, 16, 64, 65536, 2147483647, 1024, 16, 64], "", 0, []], [[], [["CI", 1], ["FU", 3, [0, 1, 2, 3]], ["SP", 3, 0, 18966528, [4], 1], ["AN", 3, 0, 5], ["AN", 3, 1, 6], ["FU", 2, [0, 1, 2, 3]], ["SP", 2, 0, 18966528, [16], 1], ["AN", 2, 0, 5], ["AN", 2, 1, 6], ["PR", 2, 0, "auto_unroll_max_step$0"]]]], "r": [[0.0138224], 0, 2.50173, 1639069558], "v": "v0.6"}
{"i": [["[\"pool_layer\", \"avg\", 128, 84, 42, 42, 3, 3, 1, \"SAME\"]", "rocm -keys=rocm,gpu -max_num_threads=256 -mcpu=gfx906 -mtriple=amdgcn-amd-amdhsa-hcc -thread_warp_size=64", [-1, 16, 64, 65536, 2147483647, 1024, 16, 64], "", 0, []], [[], [["CI", 1], ["FU", 3, [0, 1, 2, 3]], ["SP", 3, 0, 18966528, [8], 1], ["AN", 3, 0, 5], ["AN", 3, 1, 6], ["FU", 2, [0, 1, 2, 3]], ["SP", 2, 0, 18966528, [49], 1], ["AN", 2, 0, 5], ["AN", 2, 1, 6], ["PR", 2, 0, "auto_unroll_max_step$1024"]]]], "r": [[0.00643576], 0, 2.32992, 1639069560], "v": "v0.6"}
{"i": [["[\"pool_layer\", \"avg\", 128, 84, 42, 42, 3, 3, 1, \"SAME\"]", "rocm -keys=rocm,gpu -max_num_threads=256 -mcpu=gfx906 -mtriple=amdgcn-amd-amdhsa-hcc -thread_warp_size=64", [-1, 16, 64, 65536, 2147483647, 1024, 16, 64], "", 0, []], [[], [["CI", 1], ["FU", 3, [0, 1, 2, 3]], ["SP", 3, 0, 18966528, [16], 1], ["AN", 3, 0, 5], ["AN", 3, 1, 6], ["FU", 2, [0, 1, 2, 3]], ["SP", 2, 0, 18966528, [16], 1], ["AN", 2, 0, 5], ["AN", 2, 1, 6], ["PR", 2, 0, "auto_unroll_max_step$1024"]]]], "r": [[0.00570063], 0, 2.15414, 1639069562], "v": "v0.6"}
{"i": [["[\"pool_layer\", \"avg\", 128, 84, 42, 42, 3, 3, 1, \"SAME\"]", "rocm -keys=rocm,gpu -max_num_threads=256 -mcpu=gfx906 -mtriple=amdgcn-amd-amdhsa-hcc -thread_warp_size=64", [-1, 16, 64, 65536, 2147483647, 1024, 16, 64], "", 0, []], [[], [["CI", 1], ["FU", 3, [0, 1, 2, 3]], ["SP", 3, 0, 18966528, [36], 1], ["AN", 3, 0, 5], ["AN", 3, 1, 6], ["FU", 2, [0, 1, 2, 3]], ["SP", 2, 0, 18966528, [64], 1], ["AN", 2, 0, 5], ["AN", 2, 1, 6], ["PR", 2, 0, "auto_unroll_max_step$1024"]]]], "r": [[0.00192555], 0, 2.54113, 1639069564], "v": "v0.6"}
{"i": [["[\"pool_layer\", \"avg\", 128, 84, 42, 42, 3, 3, 1, \"SAME\"]", "rocm -keys=rocm,gpu -max_num_threads=256 -mcpu=gfx906 -mtriple=amdgcn-amd-amdhsa-hcc -thread_warp_size=64", [-1, 16, 64, 65536, 2147483647, 1024, 16, 64], "", 0, []], [[], [["CI", 1], ["FU", 3, [0, 1, 2, 3]], ["SP", 3, 0, 18966528, [8], 1], ["AN", 3, 0, 5], ["AN", 3, 1, 6], ["FU", 2, [0, 1, 2, 3]], ["SP", 2, 0, 18966528, [42], 1], ["AN", 2, 0, 5], ["AN", 2, 1, 6], ["PR", 2, 0, "auto_unroll_max_step$16"]]]], "r": [[0.00678351], 0, 1.9595, 1639069566], "v": "v0.6"}
{"i": [["[\"pool_layer\", \"avg\", 128, 84, 42, 42, 3, 3, 1, \"SAME\"]", "rocm -keys=rocm,gpu -max_num_threads=256 -mcpu=gfx906 -mtriple=amdgcn-amd-amdhsa-hcc -thread_warp_size=64", [-1, 16, 64, 65536, 2147483647, 1024, 16, 64], "", 0, []], [[], [["CI", 1], ["FU", 3, [0, 1, 2, 3]], ["SP", 3, 0, 18966528, [48], 1], ["AN", 3, 0, 5], ["AN", 3, 1, 6], ["FU", 2, [0, 1, 2, 3]], ["SP", 2, 0, 18966528, [6], 1], ["AN", 2, 0, 5], ["AN", 2, 1, 6], ["PR", 2, 0, "auto_unroll_max_step$512"]]]], "r": [[0.00829464], 0, 2.60753, 1639069568], "v": "v0.6"}
{"i": [["[\"pool_layer\", \"avg\", 128, 84, 42, 42, 3, 3, 1, \"SAME\"]", "rocm -keys=rocm,gpu -max_num_threads=256 -mcpu=gfx906 -mtriple=amdgcn-amd-amdhsa-hcc -thread_warp_size=64", [-1, 16, 64, 65536, 2147483647, 1024, 16, 64], "", 0, []], [[], [["CI", 1], ["FU", 3, [0, 1, 2, 3]], ["SP", 3, 0, 18966528, [2], 1], ["AN", 3, 0, 5], ["AN", 3, 1, 6], ["FU", 2, [0, 1, 2, 3]], ["SP", 2, 0, 18966528, [56], 1], ["AN", 2, 0, 5], ["AN", 2, 1, 6], ["PR", 2, 0, "auto_unroll_max_step$512"]]]], "r": [[0.0229074], 0, 2.17917, 1639069570], "v": "v0.6"}
{"i": [["[\"pool_layer\", \"avg\", 128, 84, 42, 42, 3, 3, 1, \"SAME\"]", "rocm -keys=rocm,gpu -max_num_threads=256 -mcpu=gfx906 -mtriple=amdgcn-amd-amdhsa-hcc -thread_warp_size=64", [-1, 16, 64, 65536, 2147483647, 1024, 16, 64], "", 0, []], [[], [["CI", 1], ["FU", 3, [0, 1, 2, 3]], ["SP", 3, 0, 18966528, [21], 1], ["AN", 3, 0, 5], ["AN", 3, 1, 6], ["FU", 2, [0, 1, 2, 3]], ["SP", 2, 0, 18966528, [64], 1], ["AN", 2, 0, 5], ["AN", 2, 1, 6], ["PR", 2, 0, "auto_unroll_max_step$512"]]]], "r": [[0.00280197], 0, 2.69075, 1639069573], "v": "v0.6"}
{"i": [["[\"pool_layer\", \"avg\", 128, 84, 42, 42, 3, 3, 1, \"SAME\"]", "rocm -keys=rocm,gpu -max_num_threads=256 -mcpu=gfx906 -mtriple=amdgcn-amd-amdhsa-hcc -thread_warp_size=64", [-1, 16, 64, 65536, 2147483647, 1024, 16, 64], "", 0, []], [[], [["CI", 1], ["FU", 3, [0, 1, 2, 3]], ["SP", 3, 0, 18966528, [28], 1], ["AN", 3, 0, 5], ["AN", 3, 1, 6], ["FU", 2, [0, 1, 2, 3]], ["SP", 2, 0, 18966528, [56], 1], ["AN", 2, 0, 5], ["AN", 2, 1, 6], ["PR", 2, 0, "auto_unroll_max_step$64"]]]], "r": [[0.00237438], 0, 2.46726, 1639069575], "v": "v0.6"}
