artifacts/Table4/tvm/ansor/pooling/ansor_avg_pooling_128_168_83_83_1_1_2_VALID.log
{"i": [["[\"pool_layer\", \"avg\", 128, 168, 83, 83, 1, 1, 2, \"VALID\"]", "rocm -keys=rocm,gpu -max_num_threads=256 -mcpu=gfx906 -mtriple=amdgcn-amd-amdhsa-hcc -thread_warp_size=64", [-1, 16, 64, 65536, 2147483647, 1024, 16, 64], "", 0, []], [[], [["FU", 2, [0, 1, 2, 3]], ["SP", 2, 0, 37933056, [16], 1], ["AN", 2, 0, 5], ["AN", 2, 1, 6], ["FU", 1, [0, 1, 2, 3]], ["SP", 1, 0, 37933056, [1], 1], ["AN", 1, 0, 5], ["AN", 1, 1, 6], ["PR", 1, 0, "auto_unroll_max_step$1024"]]]], "r": [[0.0939835], 0, 6.61743, 1639020033], "v": "v0.6"}
{"i": [["[\"pool_layer\", \"avg\", 128, 168, 83, 83, 1, 1, 2, \"VALID\"]", "rocm -keys=rocm,gpu -max_num_threads=256 -mcpu=gfx906 -mtriple=amdgcn-amd-amdhsa-hcc -thread_warp_size=64", [-1, 16, 64, 65536, 2147483647, 1024, 16, 64], "", 0, []], [[], [["FU", 2, [0, 1, 2, 3]], ["SP", 2, 0, 37933056, [2], 1], ["AN", 2, 0, 5], ["AN", 2, 1, 6], ["FU", 1, [0, 1, 2, 3]], ["SP", 1, 0, 37933056, [6], 1], ["AN", 1, 0, 5], ["AN", 1, 1, 6], ["PR", 1, 0, "auto_unroll_max_step$64"]]]], "r": [[0.058964], 0, 5.72622, 1639020038], "v": "v0.6"}
{"i": [["[\"pool_layer\", \"avg\", 128, 168, 83, 83, 1, 1, 2, \"VALID\"]", "rocm -keys=rocm,gpu -max_num_threads=256 -mcpu=gfx906 -mtriple=amdgcn-amd-amdhsa-hcc -thread_warp_size=64", [-1, 16, 64, 65536, 2147483647, 1024, 16, 64], "", 0, []], [[], [["FU", 2, [0, 1, 2, 3]], ["SP", 2, 0, 37933056, [64], 1], ["AN", 2, 0, 5], ["AN", 2, 1, 6], ["FU", 1, [0, 1, 2, 3]], ["SP", 1, 0, 37933056, [12], 1], ["AN", 1, 0, 5], ["AN", 1, 1, 6], ["PR", 1, 0, "auto_unroll_max_step$0"]]]], "r": [[0.00901519], 0, 6.05284, 1639020044], "v": "v0.6"}
{"i": [["[\"pool_layer\", \"avg\", 128, 168, 83, 83, 1, 1, 2, \"VALID\"]", "rocm -keys=rocm,gpu -max_num_threads=256 -mcpu=gfx906 -mtriple=amdgcn-amd-amdhsa-hcc -thread_warp_size=64", [-1, 16, 64, 65536, 2147483647, 1024, 16, 64], "", 0, []], [[], [["FU", 2, [0, 1, 2, 3]], ["SP", 2, 0, 37933056, [64], 1], ["AN", 2, 0, 5], ["AN", 2, 1, 6], ["FU", 1, [0, 1, 2, 3]], ["SP", 1, 0, 37933056, [4], 1], ["AN", 1, 0, 5], ["AN", 1, 1, 6], ["PR", 1, 0, "auto_unroll_max_step$16"]]]], "r": [[0.0234986], 0, 6.09357, 1639020049], "v": "v0.6"}
{"i": [["[\"pool_layer\", \"avg\", 128, 168, 83, 83, 1, 1, 2, \"VALID\"]", "rocm -keys=rocm,gpu -max_num_threads=256 -mcpu=gfx906 -mtriple=amdgcn-amd-amdhsa-hcc -thread_warp_size=64", [-1, 16, 64, 65536, 2147483647, 1024, 16, 64], "", 0, []], [[], [["FU", 2, [0, 1, 2, 3]], ["SP", 2, 0, 37933056, [64], 1], ["AN", 2, 0, 5], ["AN", 2, 1, 6], ["FU", 1, [0, 1, 2, 3]], ["SP", 1, 0, 37933056, [32], 1], ["AN", 1, 0, 5], ["AN", 1, 1, 6], ["PR", 1, 0, "auto_unroll_max_step$64"]]]], "r": [[0.00414874], 0, 7.35295, 1639020056], "v": "v0.6"}
{"i": [["[\"pool_layer\", \"avg\", 128, 168, 83, 83, 1, 1, 2, \"VALID\"]", "rocm -keys=rocm,gpu -max_num_threads=256 -mcpu=gfx906 -mtriple=amdgcn-amd-amdhsa-hcc -thread_warp_size=64", [-1, 16, 64, 65536, 2147483647, 1024, 16, 64], "", 0, []], [[], [["FU", 2, [0, 1, 2, 3]], ["SP", 2, 0, 37933056, [64], 1], ["AN", 2, 0, 5], ["AN", 2, 1, 6], ["FU", 1, [0, 1, 2, 3]], ["SP", 1, 0, 37933056, [48], 1], ["AN", 1, 0, 5], ["AN", 1, 1, 6], ["PR", 1, 0, "auto_unroll_max_step$64"]]]], "r": [[0.00322829], 0, 6.62855, 1639020063], "v": "v0.6"}
{"i": [["[\"pool_layer\", \"avg\", 128, 168, 83, 83, 1, 1, 2, \"VALID\"]", "rocm -keys=rocm,gpu -max_num_threads=256 -mcpu=gfx906 -mtriple=amdgcn-amd-amdhsa-hcc -thread_warp_size=64", [-1, 16, 64, 65536, 2147483647, 1024, 16, 64], "", 0, []], [[], [["FU", 2, [0, 1, 2, 3]], ["SP", 2, 0, 37933056, [16], 1], ["AN", 2, 0, 5], ["AN", 2, 1, 6], ["FU", 1, [0, 1, 2, 3]], ["SP", 1, 0, 37933056, [16], 1], ["AN", 1, 0, 5], ["AN", 1, 1, 6], ["PR", 1, 0, "auto_unroll_max_step$16"]]]], "r": [[0.0110589], 0, 6.11165, 1639020069], "v": "v0.6"}
{"i": [["[\"pool_layer\", \"avg\", 128, 168, 83, 83, 1, 1, 2, \"VALID\"]", "rocm -keys=rocm,gpu -max_num_threads=256 -mcpu=gfx906 -mtriple=amdgcn-amd-amdhsa-hcc -thread_warp_size=64", [-1, 16, 64, 65536, 2147483647, 1024, 16, 64], "", 0, []], [[], [["FU", 2, [0, 1, 2, 3]], ["SP", 2, 0, 37933056, [1], 1], ["AN", 2, 0, 5], ["AN", 2, 1, 6], ["FU", 1, [0, 1, 2, 3]], ["SP", 1, 0, 37933056, [32], 1], ["AN", 1, 0, 5], ["AN", 1, 1, 6], ["PR", 1, 0, "auto_unroll_max_step$0"]]]], "r": [[0.0934344], 0, 6.04158, 1639020074], "v": "v0.6"}
{"i": [["[\"pool_layer\", \"avg\", 128, 168, 83, 83, 1, 1, 2, \"VALID\"]", "rocm -keys=rocm,gpu -max_num_threads=256 -mcpu=gfx906 -mtriple=amdgcn-amd-amdhsa-hcc -thread_warp_size=64", [-1, 16, 64, 65536, 2147483647, 1024, 16, 64], "", 0, []], [[], [["FU", 2, [0, 1, 2, 3]], ["SP", 2, 0, 37933056, [56], 1], ["AN", 2, 0, 5], ["AN", 2, 1, 6], ["FU", 1, [0, 1, 2, 3]], ["SP", 1, 0, 37933056, [64], 1], ["AN", 1, 0, 5], ["AN", 1, 1, 6], ["PR", 1, 0, "auto_unroll_max_step$16"]]]], "r": [[0.00296517], 0, 6.62727, 1639020081], "v": "v0.6"}
{"i": [["[\"pool_layer\", \"avg\", 128, 168, 83, 83, 1, 1, 2, \"VALID\"]", "rocm -keys=rocm,gpu -max_num_threads=256 -mcpu=gfx906 -mtriple=amdgcn-amd-amdhsa-hcc -thread_warp_size=64", [-1, 16, 64, 65536, 2147483647, 1024, 16, 64], "", 0, []], [[], [["FU", 2, [0, 1, 2, 3]], ["SP", 2, 0, 37933056, [4], 1], ["AN", 2, 0, 5], ["AN", 2, 1, 6], ["FU", 1, [0, 1, 2, 3]], ["SP", 1, 0, 37933056, [16], 1], ["AN", 1, 0, 5], ["AN", 1, 1, 6], ["PR", 1, 0, "auto_unroll_max_step$16"]]]], "r": [[0.0276459], 0, 6.14845, 1639020086], "v": "v0.6"}
{"i": [["[\"pool_layer\", \"avg\", 128, 168, 83, 83, 1, 1, 2, \"VALID\"]", "rocm -keys=rocm,gpu -max_num_threads=256 -mcpu=gfx906 -mtriple=amdgcn-amd-amdhsa-hcc -thread_warp_size=64", [-1, 16, 64, 65536, 2147483647, 1024, 16, 64], "", 0, []], [[], [["FU", 2, [0, 1, 2, 3]], ["SP", 2, 0, 37933056, [54], 1], ["AN", 2, 0, 5], ["AN", 2, 1, 6], ["FU", 1, [0, 1, 2, 3]], ["SP", 1, 0, 37933056, [16], 1], ["AN", 1, 0, 5], ["AN", 1, 1, 6], ["PR", 1, 0, "auto_unroll_max_step$64"]]]], "r": [[0.00738895], 0, 5.3324, 1639020091], "v": "v0.6"}
{"i": [["[\"pool_layer\", \"avg\", 128, 168, 83, 83, 1, 1, 2, \"VALID\"]", "rocm -keys=rocm,gpu -max_num_threads=256 -mcpu=gfx906 -mtriple=amdgcn-amd-amdhsa-hcc -thread_warp_size=64", [-1, 16, 64, 65536, 2147483647, 1024, 16, 64], "", 0, []], [[], [["FU", 2, [0, 1, 2, 3]], ["SP", 2, 0, 37933056, [2], 1], ["AN", 2, 0, 5], ["AN", 2, 1, 6], ["FU", 1, [0, 1, 2, 3]], ["SP", 1, 0, 37933056, [1], 1], ["AN", 1, 0, 5], ["AN", 1, 1, 6], ["PR", 1, 0, "auto_unroll_max_step$0"]]]], "r": [[0.132659], 0, 5.78372, 1639020097], "v": "v0.6"}
{"i": [["[\"pool_layer\", \"avg\", 128, 168, 83, 83, 1, 1, 2, \"VALID\"]", "rocm -keys=rocm,gpu -max_num_threads=256 -mcpu=gfx906 -mtriple=amdgcn-amd-amdhsa-hcc -thread_warp_size=64", [-1, 16, 64, 65536, 2147483647, 1024, 16, 64], "", 0, []], [[], [["FU", 2, [0, 1, 2, 3]], ["SP", 2, 0, 37933056, [48], 1], ["AN", 2, 0, 5], ["AN", 2, 1, 6], ["FU", 1, [0, 1, 2, 3]], ["SP", 1, 0, 37933056, [64], 1], ["AN", 1, 0, 5], ["AN", 1, 1, 6], ["PR", 1, 0, "auto_unroll_max_step$1024"]]]], "r": [[0.00322836], 0, 6.63821, 1639020103], "v": "v0.6"}
{"i": [["[\"pool_layer\", \"avg\", 128, 168, 83, 83, 1, 1, 2, \"VALID\"]", "rocm -keys=rocm,gpu -max_num_threads=256 -mcpu=gfx906 -mtriple=amdgcn-amd-amdhsa-hcc -thread_warp_size=64", [-1, 16, 64, 65536, 2147483647, 1024, 16, 64], "", 0, []], [[], [["FU", 2, [0, 1, 2, 3]], ["SP", 2, 0, 37933056, [32], 1], ["AN", 2, 0, 5], ["AN", 2, 1, 6], ["FU", 1, [0, 1, 2, 3]], ["SP", 1, 0, 37933056, [4], 1], ["AN", 1, 0, 5], ["AN", 1, 1, 6], ["PR", 1, 0, "auto_unroll_max_step$64"]]]], "r": [[0.0248798], 0, 6.01665, 1639020109], "v": "v0.6"}
{"i": [["[\"pool_layer\", \"avg\", 128, 168, 83, 83, 1, 1, 2, \"VALID\"]", "rocm -keys=rocm,gpu -max_num_threads=256 -mcpu=gfx906 -mtriple=amdgcn-amd-amdhsa-hcc -thread_warp_size=64", [-1, 16, 64, 65536, 2147483647, 1024, 16, 64], "", 0, []], [[], [["FU", 2, [0, 1, 2, 3]], ["SP", 2, 0, 37933056, [1], 1], ["AN", 2, 0, 5], ["AN", 2, 1, 6], ["FU", 1, [0, 1, 2, 3]], ["SP", 1, 0, 37933056, [1], 1], ["AN", 1, 0, 5], ["AN", 1, 1, 6], ["PR", 1, 0, "auto_unroll_max_step$512"]]]], "r": [[0.176868], 0, 6.77523, 1639020115], "v": "v0.6"}
{"i": [["[\"pool_layer\", \"avg\", 128, 168, 83, 83, 1, 1, 2, \"VALID\"]", "rocm -keys=rocm,gpu -max_num_threads=256 -mcpu=gfx906 -mtriple=amdgcn-amd-amdhsa-hcc -thread_warp_size=64", [-1, 16, 64, 65536, 2147483647, 1024, 16, 64], "", 0, []], [[], [["FU", 2, [0, 1, 2, 3]], ["SP", 2, 0, 37933056, [64], 1], ["AN", 2, 0, 5], ["AN", 2, 1, 6], ["FU", 1, [0, 1, 2, 3]], ["SP", 1, 0, 37933056, [2], 1], ["AN", 1, 0, 5], ["AN", 1, 1, 6], ["PR", 1, 0, "auto_unroll_max_step$64"]]]], "r": [[0.0456155], 0, 6.66208, 1639020122], "v": "v0.6"}
{"i": [["[\"pool_layer\", \"avg\", 128, 168, 83, 83, 1, 1, 2, \"VALID\"]", "rocm -keys=rocm,gpu -max_num_threads=256 -mcpu=gfx906 -mtriple=amdgcn-amd-amdhsa-hcc -thread_warp_size=64", [-1, 16, 64, 65536, 2147483647, 1024, 16, 64], "", 0, []], [[], [["FU", 2, [0, 1, 2, 3]], ["SP", 2, 0, 37933056, [64], 1], ["AN", 2, 0, 5], ["AN", 2, 1, 6], ["FU", 1, [0, 1, 2, 3]], ["SP", 1, 0, 37933056, [1], 1], ["AN", 1, 0, 5], ["AN", 1, 1, 6], ["PR", 1, 0, "auto_unroll_max_step$0"]]]], "r": [[0.0898272], 0, 5.77844, 1639020127], "v": "v0.6"}
{"i": [["[\"pool_layer\", \"avg\", 128, 168, 83, 83, 1, 1, 2, \"VALID\"]", "rocm -keys=rocm,gpu -max_num_threads=256 -mcpu=gfx906 -mtriple=amdgcn-amd-amdhsa-hcc -thread_warp_size=64", [-1, 16, 64, 65536, 2147483647, 1024, 16, 64], "", 0, []], [[], [["FU", 2, [0, 1, 2, 3]], ["SP", 2, 0, 37933056, [8], 1], ["AN", 2, 0, 5], ["AN", 2, 1, 6], ["FU", 1, [0, 1, 2, 3]], ["SP", 1, 0, 37933056, [2], 1], ["AN", 1, 0, 5], ["AN", 1, 1, 6], ["PR", 1, 0, "auto_unroll_max_step$512"]]]], "r": [[0.0552901], 0, 6.40229, 1639020133], "v": "v0.6"}
{"i": [["[\"pool_layer\", \"avg\", 128, 168, 83, 83, 1, 1, 2, \"VALID\"]", "rocm -keys=rocm,gpu -max_num_threads=256 -mcpu=gfx906 -mtriple=amdgcn-amd-amdhsa-hcc -thread_warp_size=64", [-1, 16, 64, 65536, 2147483647, 1024, 16, 64], "", 0, []], [[], [["FU", 2, [0, 1, 2, 3]], ["SP", 2, 0, 37933056, [16], 1], ["AN", 2, 0, 5], ["AN", 2, 1, 6], ["FU", 1, [0, 1, 2, 3]], ["SP", 1, 0, 37933056, [64], 1], ["AN", 1, 0, 5], ["AN", 1, 1, 6], ["PR", 1, 0, "auto_unroll_max_step$512"]]]], "r": [[0.00691265], 0, 6.59154, 1639020140], "v": "v0.6"}
{"i": [["[\"pool_layer\", \"avg\", 128, 168, 83, 83, 1, 1, 2, \"VALID\"]", "rocm -keys=rocm,gpu -max_num_threads=256 -mcpu=gfx906 -mtriple=amdgcn-amd-amdhsa-hcc -thread_warp_size=64", [-1, 16, 64, 65536, 2147483647, 1024, 16, 64], "", 0, []], [[], [["FU", 2, [0, 1, 2, 3]], ["SP", 2, 0, 37933056, [1], 1], ["AN", 2, 0, 5], ["AN", 2, 1, 6], ["FU", 1, [0, 1, 2, 3]], ["SP", 1, 0, 37933056, [8], 1], ["AN", 1, 0, 5], ["AN", 1, 1, 6], ["PR", 1, 0, "auto_unroll_max_step$16"]]]], "r": [[0.102539], 0, 6.14427, 1639020145], "v": "v0.6"}
{"i": [["[\"pool_layer\", \"avg\", 128, 168, 83, 83, 1, 1, 2, \"VALID\"]", "rocm -keys=rocm,gpu -max_num_threads=256 -mcpu=gfx906 -mtriple=amdgcn-amd-amdhsa-hcc -thread_warp_size=64", [-1, 16, 64, 65536, 2147483647, 1024, 16, 64], "", 0, []], [[], [["FU", 2, [0, 1, 2, 3]], ["SP", 2, 0, 37933056, [2], 1], ["AN", 2, 0, 5], ["AN", 2, 1, 6], ["FU", 1, [0, 1, 2, 3]], ["SP", 1, 0, 37933056, [63], 1], ["AN", 1, 0, 5], ["AN", 1, 1, 6], ["PR", 1, 0, "auto_unroll_max_step$0"]]]], "r": [[0.046939], 0, 6.38799, 1639020152], "v": "v0.6"}
{"i": [["[\"pool_layer\", \"avg\", 128, 168, 83, 83, 1, 1, 2, \"VALID\"]", "rocm -keys=rocm,gpu -max_num_threads=256 -mcpu=gfx906 -mtriple=amdgcn-amd-amdhsa-hcc -thread_warp_size=64", [-1, 16, 64, 65536, 2147483647, 1024, 16, 64], "", 0, []], [[], [["FU", 2, [0, 1, 2, 3]], ["SP", 2, 0, 37933056, [1], 1], ["AN", 2, 0, 5], ["AN", 2, 1, 6], ["FU", 1, [0, 1, 2, 3]], ["SP", 1, 0, 37933056, [32], 1], ["AN", 1, 0, 5], ["AN", 1, 1, 6], ["PR", 1, 0, "auto_unroll_max_step$512"]]]], "r": [[0.0934837], 0, 6.51049, 1639020158], "v": "v0.6"}
{"i": [["[\"pool_layer\", \"avg\", 128, 168, 83, 83, 1, 1, 2, \"VALID\"]", "rocm -keys=rocm,gpu -max_num_threads=256 -mcpu=gfx906 -mtriple=amdgcn-amd-amdhsa-hcc -thread_warp_size=64", [-1, 16, 64, 65536, 2147483647, 1024, 16, 64], "", 0, []], [[], [["FU", 2, [0, 1, 2, 3]], ["SP", 2, 0, 37933056, [28], 1], ["AN", 2, 0, 5], ["AN", 2, 1, 6], ["FU", 1, [0, 1, 2, 3]], ["SP", 1, 0, 37933056, [1], 1], ["AN", 1, 0, 5], ["AN", 1, 1, 6], ["PR", 1, 0, "auto_unroll_max_step$512"]]]], "r": [[0.0938647], 0, 6.40451, 1639020164], "v": "v0.6"}
{"i": [["[\"pool_layer\", \"avg\", 128, 168, 83, 83, 1, 1, 2, \"VALID\"]", "rocm -keys=rocm,gpu -max_num_threads=256 -mcpu=gfx906 -mtriple=amdgcn-amd-amdhsa-hcc -thread_warp_size=64", [-1, 16, 64, 65536, 2147483647, 1024, 16, 64], "", 0, []], [[], [["FU", 2, [0, 1, 2, 3]], ["SP", 2, 0, 37933056, [3], 1], ["AN", 2, 0, 5], ["AN", 2, 1, 6], ["FU", 1, [0, 1, 2, 3]], ["SP", 1, 0, 37933056, [64], 1], ["AN", 1, 0, 5], ["AN", 1, 1, 6], ["PR", 1, 0, "auto_unroll_max_step$64"]]]], "r": [[0.0308696], 0, 5.50935, 1639020169], "v": "v0.6"}
{"i": [["[\"pool_layer\", \"avg\", 128, 168, 83, 83, 1, 1, 2, \"VALID\"]", "rocm -keys=rocm,gpu -max_num_threads=256 -mcpu=gfx906 -mtriple=amdgcn-amd-amdhsa-hcc -thread_warp_size=64", [-1, 16, 64, 65536, 2147483647, 1024, 16, 64], "", 0, []], [[], [["FU", 2, [0, 1, 2, 3]], ["SP", 2, 0, 37933056, [64], 1], ["AN", 2, 0, 5], ["AN", 2, 1, 6], ["FU", 1, [0, 1, 2, 3]], ["SP", 1, 0, 37933056, [56], 1], ["AN", 1, 0, 5], ["AN", 1, 1, 6], ["PR", 1, 0, "auto_unroll_max_step$1024"]]]], "r": [[0.00296504], 0, 6.5539, 1639020176], "v": "v0.6"}
{"i": [["[\"pool_layer\", \"avg\", 128, 168, 83, 83, 1, 1, 2, \"VALID\"]", "rocm -keys=rocm,gpu -max_num_threads=256 -mcpu=gfx906 -mtriple=amdgcn-amd-amdhsa-hcc -thread_warp_size=64", [-1, 16, 64, 65536, 2147483647, 1024, 16, 64], "", 0, []], [[], [["FU", 2, [0, 1, 2, 3]], ["SP", 2, 0, 37933056, [2], 1], ["AN", 2, 0, 5], ["AN", 2, 1, 6], ["FU", 1, [0, 1, 2, 3]], ["SP", 1, 0, 37933056, [64], 1], ["AN", 1, 0, 5], ["AN", 1, 1, 6], ["PR", 1, 0, "auto_unroll_max_step$0"]]]], "r": [[0.0456109], 0, 5.66271, 1639020181], "v": "v0.6"}
{"i": [["[\"pool_layer\", \"avg\", 128, 168, 83, 83, 1, 1, 2, \"VALID\"]", "rocm -keys=rocm,gpu -max_num_threads=256 -mcpu=gfx906 -mtriple=amdgcn-amd-amdhsa-hcc -thread_warp_size=64", [-1, 16, 64, 65536, 2147483647, 1024, 16, 64], "", 0, []], [[], [["FU", 2, [0, 1, 2, 3]], ["SP", 2, 0, 37933056, [1], 1], ["AN", 2, 0, 5], ["AN", 2, 1, 6], ["FU", 1, [0, 1, 2, 3]], ["SP", 1, 0, 37933056, [4], 1], ["AN", 1, 0, 5], ["AN", 1, 1, 6], ["PR", 1, 0, "auto_unroll_max_step$16"]]]], "r": [[0.110561], 0, 6.31635, 1639020187], "v": "v0.6"}
{"i": [["[\"pool_layer\", \"avg\", 128, 168, 83, 83, 1, 1, 2, \"VALID\"]", "rocm -keys=rocm,gpu -max_num_threads=256 -mcpu=gfx906 -mtriple=amdgcn-amd-amdhsa-hcc -thread_warp_size=64", [-1, 16, 64, 65536, 2147483647, 1024, 16, 64], "", 0, []], [[], [["FU", 2, [0, 1, 2, 3]], ["SP", 2, 0, 37933056, [4], 1], ["AN", 2, 0, 5], ["AN", 2, 1, 6], ["FU", 1, [0, 1, 2, 3]], ["SP", 1, 0, 37933056, [64], 1], ["AN", 1, 0, 5], ["AN", 1, 1, 6], ["PR", 1, 0, "auto_unroll_max_step$64"]]]], "r": [[0.0234994], 0, 6.16797, 1639020193], "v": "v0.6"}
{"i": [["[\"pool_layer\", \"avg\", 128, 168, 83, 83, 1, 1, 2, \"VALID\"]", "rocm -keys=rocm,gpu -max_num_threads=256 -mcpu=gfx906 -mtriple=amdgcn-amd-amdhsa-hcc -thread_warp_size=64", [-1, 16, 64, 65536, 2147483647, 1024, 16, 64], "", 0, []], [[], [["FU", 2, [0, 1, 2, 3]], ["SP", 2, 0, 37933056, [1], 1], ["AN", 2, 0, 5], ["AN", 2, 1, 6], ["FU", 1, [0, 1, 2, 3]], ["SP", 1, 0, 37933056, [4], 1], ["AN", 1, 0, 5], ["AN", 1, 1, 6], ["PR", 1, 0, "auto_unroll_max_step$64"]]]], "r": [[0.113574], 0, 6.38561, 1639020199], "v": "v0.6"}
{"i": [["[\"pool_layer\", \"avg\", 128, 168, 83, 83, 1, 1, 2, \"VALID\"]", "rocm -keys=rocm,gpu -max_num_threads=256 -mcpu=gfx906 -mtriple=amdgcn-amd-amdhsa-hcc -thread_warp_size=64", [-1, 16, 64, 65536, 2147483647, 1024, 16, 64], "", 0, []], [[], [["FU", 2, [0, 1, 2, 3]], ["SP", 2, 0, 37933056, [64], 1], ["AN", 2, 0, 5], ["AN", 2, 1, 6], ["FU", 1, [0, 1, 2, 3]], ["SP", 1, 0, 37933056, [8], 1], ["AN", 1, 0, 5], ["AN", 1, 1, 6], ["PR", 1, 0, "auto_unroll_max_step$16"]]]], "r": [[0.0124398], 0, 7.04087, 1639020206], "v": "v0.6"}
{"i": [["[\"pool_layer\", \"avg\", 128, 168, 83, 83, 1, 1, 2, \"VALID\"]", "rocm -keys=rocm,gpu -max_num_threads=256 -mcpu=gfx906 -mtriple=amdgcn-amd-amdhsa-hcc -thread_warp_size=64", [-1, 16, 64, 65536, 2147483647, 1024, 16, 64], "", 0, []], [[], [["FU", 2, [0, 1, 2, 3]], ["SP", 2, 0, 37933056, [16], 1], ["AN", 2, 0, 5], ["AN", 2, 1, 6], ["FU", 1, [0, 1, 2, 3]], ["SP", 1, 0, 37933056, [64], 1], ["AN", 1, 0, 5], ["AN", 1, 1, 6], ["PR", 1, 0, "auto_unroll_max_step$0"]]]], "r": [[0.00712305], 0, 6.20225, 1639020211], "v": "v0.6"}
{"i": [["[\"pool_layer\", \"avg\", 128, 168, 83, 83, 1, 1, 2, \"VALID\"]", "rocm -keys=rocm,gpu -max_num_threads=256 -mcpu=gfx906 -mtriple=amdgcn-amd-amdhsa-hcc -thread_warp_size=64", [-1, 16, 64, 65536, 2147483647, 1024, 16, 64], "", 0, []], [[], [["FU", 2, [0, 1, 2, 3]], ["SP", 2, 0, 37933056, [12], 1], ["AN", 2, 0, 5], ["AN", 2, 1, 6], ["FU", 1, [0, 1, 2, 3]], ["SP", 1, 0, 37933056, [4], 1], ["AN", 1, 0, 5], ["AN", 1, 1, 6], ["PR", 1, 0, "auto_unroll_max_step$512"]]]], "r": [[0.0303163], 0, 6.30363, 1639020217], "v": "v0.6"}
{"i": [["[\"pool_layer\", \"avg\", 128, 168, 83, 83, 1, 1, 2, \"VALID\"]", "rocm -keys=rocm,gpu -max_num_threads=256 -mcpu=gfx906 -mtriple=amdgcn-amd-amdhsa-hcc -thread_warp_size=64", [-1, 16, 64, 65536, 2147483647, 1024, 16, 64], "", 0, []], [[], [["FU", 2, [0, 1, 2, 3]], ["SP", 2, 0, 37933056, [4], 1], ["AN", 2, 0, 5], ["AN", 2, 1, 6], ["FU", 1, [0, 1, 2, 3]], ["SP", 1, 0, 37933056, [18], 1], ["AN", 1, 0, 5], ["AN", 1, 1, 6], ["PR", 1, 0, "auto_unroll_max_step$0"]]]], "r": [[0.027793], 0, 6.28201, 1639020223], "v": "v0.6"}
{"i": [["[\"pool_layer\", \"avg\", 128, 168, 83, 83, 1, 1, 2, \"VALID\"]", "rocm -keys=rocm,gpu -max_num_threads=256 -mcpu=gfx906 -mtriple=amdgcn-amd-amdhsa-hcc -thread_warp_size=64", [-1, 16, 64, 65536, 2147483647, 1024, 16, 64], "", 0, []], [[], [["FU", 2, [0, 1, 2, 3]], ["SP", 2, 0, 37933056, [2], 1], ["AN", 2, 0, 5], ["AN", 2, 1, 6], ["FU", 1, [0, 1, 2, 3]], ["SP", 1, 0, 37933056, [64], 1], ["AN", 1, 0, 5], ["AN", 1, 1, 6], ["PR", 1, 0, "auto_unroll_max_step$1024"]]]], "r": [[0.0469046], 0, 5.97336, 1639020229], "v": "v0.6"}
{"i": [["[\"pool_layer\", \"avg\", 128, 168, 83, 83, 1, 1, 2, \"VALID\"]", "rocm -keys=rocm,gpu -max_num_threads=256 -mcpu=gfx906 -mtriple=amdgcn-amd-amdhsa-hcc -thread_warp_size=64", [-1, 16, 64, 65536, 2147483647, 1024, 16, 64], "", 0, []], [[], [["FU", 2, [0, 1, 2, 3]], ["SP", 2, 0, 37933056, [2], 1], ["AN", 2, 0, 5], ["AN", 2, 1, 6], ["FU", 1, [0, 1, 2, 3]], ["SP", 1, 0, 37933056, [8], 1], ["AN", 1, 0, 5], ["AN", 1, 1, 6], ["PR", 1, 0, "auto_unroll_max_step$512"]]]], "r": [[0.0567996], 0, 6.18469, 1639020235], "v": "v0.6"}
{"i": [["[\"pool_layer\", \"avg\", 128, 168, 83, 83, 1, 1, 2, \"VALID\"]", "rocm -keys=rocm,gpu -max_num_threads=256 -mcpu=gfx906 -mtriple=amdgcn-amd-amdhsa-hcc -thread_warp_size=64", [-1, 16, 64, 65536, 2147483647, 1024, 16, 64], "", 0, []], [[], [["FU", 2, [0, 1, 2, 3]], ["SP", 2, 0, 37933056, [32], 1], ["AN", 2, 0, 5], ["AN", 2, 1, 6], ["FU", 1, [0, 1, 2, 3]], ["SP", 1, 0, 37933056, [4], 1], ["AN", 1, 0, 5], ["AN", 1, 1, 6], ["PR", 1, 0, "auto_unroll_max_step$1024"]]]], "r": [[0.0248766], 0, 6.85859, 1639020242], "v": "v0.6"}
{"i": [["[\"pool_layer\", \"avg\", 128, 168, 83, 83, 1, 1, 2, \"VALID\"]", "rocm -keys=rocm,gpu -max_num_threads=256 -mcpu=gfx906 -mtriple=amdgcn-amd-amdhsa-hcc -thread_warp_size=64", [-1, 16, 64, 65536, 2147483647, 1024, 16, 64], "", 0, []], [[], [["FU", 2, [0, 1, 2, 3]], ["SP", 2, 0, 37933056, [1], 1], ["AN", 2, 0, 5], ["AN", 2, 1, 6], ["FU", 1, [0, 1, 2, 3]], ["SP", 1, 0, 37933056, [32], 1], ["AN", 1, 0, 5], ["AN", 1, 1, 6], ["PR", 1, 0, "auto_unroll_max_step$64"]]]], "r": [[0.0912138], 0, 6.43295, 1639020248], "v": "v0.6"}
{"i": [["[\"pool_layer\", \"avg\", 128, 168, 83, 83, 1, 1, 2, \"VALID\"]", "rocm -keys=rocm,gpu -max_num_threads=256 -mcpu=gfx906 -mtriple=amdgcn-amd-amdhsa-hcc -thread_warp_size=64", [-1, 16, 64, 65536, 2147483647, 1024, 16, 64], "", 0, []], [[], [["FU", 2, [0, 1, 2, 3]], ["SP", 2, 0, 37933056, [64], 1], ["AN", 2, 0, 5], ["AN", 2, 1, 6], ["FU", 1, [0, 1, 2, 3]], ["SP", 1, 0, 37933056, [8], 1], ["AN", 1, 0, 5], ["AN", 1, 1, 6], ["PR", 1, 0, "auto_unroll_max_step$0"]]]], "r": [[0.01281], 0, 6.21998, 1639020254], "v": "v0.6"}
{"i": [["[\"pool_layer\", \"avg\", 128, 168, 83, 83, 1, 1, 2, \"VALID\"]", "rocm -keys=rocm,gpu -max_num_threads=256 -mcpu=gfx906 -mtriple=amdgcn-amd-amdhsa-hcc -thread_warp_size=64", [-1, 16, 64, 65536, 2147483647, 1024, 16, 64], "", 0, []], [[], [["FU", 2, [0, 1, 2, 3]], ["SP", 2, 0, 37933056, [2], 1], ["AN", 2, 0, 5], ["AN", 2, 1, 6], ["FU", 1, [0, 1, 2, 3]], ["SP", 1, 0, 37933056, [1], 1], ["AN", 1, 0, 5], ["AN", 1, 1, 6], ["PR", 1, 0, "auto_unroll_max_step$512"]]]], "r": [[0.132671], 0, 6.46363, 1639020260], "v": "v0.6"}
{"i": [["[\"pool_layer\", \"avg\", 128, 168, 83, 83, 1, 1, 2, \"VALID\"]", "rocm -keys=rocm,gpu -max_num_threads=256 -mcpu=gfx906 -mtriple=amdgcn-amd-amdhsa-hcc -thread_warp_size=64", [-1, 16, 64, 65536, 2147483647, 1024, 16, 64], "", 0, []], [[], [["FU", 2, [0, 1, 2, 3]], ["SP", 2, 0, 37933056, [21], 1], ["AN", 2, 0, 5], ["AN", 2, 1, 6], ["FU", 1, [0, 1, 2, 3]], ["SP", 1, 0, 37933056, [8], 1], ["AN", 1, 0, 5], ["AN", 1, 1, 6], ["PR", 1, 0, "auto_unroll_max_step$0"]]]], "r": [[0.0157234], 0, 6.20174, 1639020266], "v": "v0.6"}
{"i": [["[\"pool_layer\", \"avg\", 128, 168, 83, 83, 1, 1, 2, \"VALID\"]", "rocm -keys=rocm,gpu -max_num_threads=256 -mcpu=gfx906 -mtriple=amdgcn-amd-amdhsa-hcc -thread_warp_size=64", [-1, 16, 64, 65536, 2147483647, 1024, 16, 64], "", 0, []], [[], [["FU", 2, [0, 1, 2, 3]], ["SP", 2, 0, 37933056, [8], 1], ["AN", 2, 0, 5], ["AN", 2, 1, 6], ["FU", 1, [0, 1, 2, 3]], ["SP", 1, 0, 37933056, [64], 1], ["AN", 1, 0, 5], ["AN", 1, 1, 6], ["PR", 1, 0, "auto_unroll_max_step$0"]]]], "r": [[0.0126772], 0, 6.39486, 1639020272], "v": "v0.6"}
{"i": [["[\"pool_layer\", \"avg\", 128, 168, 83, 83, 1, 1, 2, \"VALID\"]", "rocm -keys=rocm,gpu -max_num_threads=256 -mcpu=gfx906 -mtriple=amdgcn-amd-amdhsa-hcc -thread_warp_size=64", [-1, 16, 64, 65536, 2147483647, 1024, 16, 64], "", 0, []], [[], [["FU", 2, [0, 1, 2, 3]], ["SP", 2, 0, 37933056, [4], 1], ["AN", 2, 0, 5], ["AN", 2, 1, 6], ["FU", 1, [0, 1, 2, 3]], ["SP", 1, 0, 37933056, [48], 1], ["AN", 1, 0, 5], ["AN", 1, 1, 6], ["PR", 1, 0, "auto_unroll_max_step$64"]]]], "r": [[0.0246596], 0, 6.23897, 1639020278], "v": "v0.6"}
{"i": [["[\"pool_layer\", \"avg\", 128, 168, 83, 83, 1, 1, 2, \"VALID\"]", "rocm -keys=rocm,gpu -max_num_threads=256 -mcpu=gfx906 -mtriple=amdgcn-amd-amdhsa-hcc -thread_warp_size=64", [-1, 16, 64, 65536, 2147483647, 1024, 16, 64], "", 0, []], [[], [["FU", 2, [0, 1, 2, 3]], ["SP", 2, 0, 37933056, [8], 1], ["AN", 2, 0, 5], ["AN", 2, 1, 6], ["FU", 1, [0, 1, 2, 3]], ["SP", 1, 0, 37933056, [4], 1], ["AN", 1, 0, 5], ["AN", 1, 1, 6], ["PR", 1, 0, "auto_unroll_max_step$1024"]]]], "r": [[0.0331673], 0, 6.19639, 1639020284], "v": "v0.6"}
{"i": [["[\"pool_layer\", \"avg\", 128, 168, 83, 83, 1, 1, 2, \"VALID\"]", "rocm -keys=rocm,gpu -max_num_threads=256 -mcpu=gfx906 -mtriple=amdgcn-amd-amdhsa-hcc -thread_warp_size=64", [-1, 16, 64, 65536, 2147483647, 1024, 16, 64], "", 0, []], [[], [["FU", 2, [0, 1, 2, 3]], ["SP", 2, 0, 37933056, [4], 1], ["AN", 2, 0, 5], ["AN", 2, 1, 6], ["FU", 1, [0, 1, 2, 3]], ["SP", 1, 0, 37933056, [64], 1], ["AN", 1, 0, 5], ["AN", 1, 1, 6], ["PR", 1, 0, "auto_unroll_max_step$16"]]]], "r": [[0.0241947], 0, 6.2287, 1639020290], "v": "v0.6"}
{"i": [["[\"pool_layer\", \"avg\", 128, 168, 83, 83, 1, 1, 2, \"VALID\"]", "rocm -keys=rocm,gpu -max_num_threads=256 -mcpu=gfx906 -mtriple=amdgcn-amd-amdhsa-hcc -thread_warp_size=64", [-1, 16, 64, 65536, 2147483647, 1024, 16, 64], "", 0, []], [[], [["FU", 2, [0, 1, 2, 3]], ["SP", 2, 0, 37933056, [1], 1], ["AN", 2, 0, 5], ["AN", 2, 1, 6], ["FU", 1, [0, 1, 2, 3]], ["SP", 1, 0, 37933056, [16], 1], ["AN", 1, 0, 5], ["AN", 1, 1, 6], ["PR", 1, 0, "auto_unroll_max_step$512"]]]], "r": [[0.0939718], 0, 6.00769, 1639020295], "v": "v0.6"}
{"i": [["[\"pool_layer\", \"avg\", 128, 168, 83, 83, 1, 1, 2, \"VALID\"]", "rocm -keys=rocm,gpu -max_num_threads=256 -mcpu=gfx906 -mtriple=amdgcn-amd-amdhsa-hcc -thread_warp_size=64", [-1, 16, 64, 65536, 2147483647, 1024, 16, 64], "", 0, []], [[], [["FU", 2, [0, 1, 2, 3]], ["SP", 2, 0, 37933056, [2], 1], ["AN", 2, 0, 5], ["AN", 2, 1, 6], ["FU", 1, [0, 1, 2, 3]], ["SP", 1, 0, 37933056, [8], 1], ["AN", 1, 0, 5], ["AN", 1, 1, 6], ["PR", 1, 0, "auto_unroll_max_step$0"]]]], "r": [[0.0568026], 0, 6.41261, 1639020302], "v": "v0.6"}
{"i": [["[\"pool_layer\", \"avg\", 128, 168, 83, 83, 1, 1, 2, \"VALID\"]", "rocm -keys=rocm,gpu -max_num_threads=256 -mcpu=gfx906 -mtriple=amdgcn-amd-amdhsa-hcc -thread_warp_size=64", [-1, 16, 64, 65536, 2147483647, 1024, 16, 64], "", 0, []], [[], [["FU", 2, [0, 1, 2, 3]], ["SP", 2, 0, 37933056, [4], 1], ["AN", 2, 0, 5], ["AN", 2, 1, 6], ["FU", 1, [0, 1, 2, 3]], ["SP", 1, 0, 37933056, [24], 1], ["AN", 1, 0, 5], ["AN", 1, 1, 6], ["PR", 1, 0, "auto_unroll_max_step$16"]]]], "r": [[0.0265553], 0, 6.1372, 1639020307], "v": "v0.6"}
{"i": [["[\"pool_layer\", \"avg\", 128, 168, 83, 83, 1, 1, 2, \"VALID\"]", "rocm -keys=rocm,gpu -max_num_threads=256 -mcpu=gfx906 -mtriple=amdgcn-amd-amdhsa-hcc -thread_warp_size=64", [-1, 16, 64, 65536, 2147483647, 1024, 16, 64], "", 0, []], [[], [["FU", 2, [0, 1, 2, 3]], ["SP", 2, 0, 37933056, [8], 1], ["AN", 2, 0, 5], ["AN", 2, 1, 6], ["FU", 1, [0, 1, 2, 3]], ["SP", 1, 0, 37933056, [12], 1], ["AN", 1, 0, 5], ["AN", 1, 1, 6], ["PR", 1, 0, "auto_unroll_max_step$16"]]]], "r": [[0.0184314], 0, 6.17289, 1639020313], "v": "v0.6"}
{"i": [["[\"pool_layer\", \"avg\", 128, 168, 83, 83, 1, 1, 2, \"VALID\"]", "rocm -keys=rocm,gpu -max_num_threads=256 -mcpu=gfx906 -mtriple=amdgcn-amd-amdhsa-hcc -thread_warp_size=64", [-1, 16, 64, 65536, 2147483647, 1024, 16, 64], "", 0, []], [[], [["FU", 2, [0, 1, 2, 3]], ["SP", 2, 0, 37933056, [32], 1], ["AN", 2, 0, 5], ["AN", 2, 1, 6], ["FU", 1, [0, 1, 2, 3]], ["SP", 1, 0, 37933056, [8], 1], ["AN", 1, 0, 5], ["AN", 1, 1, 6], ["PR", 1, 0, "auto_unroll_max_step$512"]]]], "r": [[0.014236], 0, 6.07262, 1639020319], "v": "v0.6"}
{"i": [["[\"pool_layer\", \"avg\", 128, 168, 83, 83, 1, 1, 2, \"VALID\"]", "rocm -keys=rocm,gpu -max_num_threads=256 -mcpu=gfx906 -mtriple=amdgcn-amd-amdhsa-hcc -thread_warp_size=64", [-1, 16, 64, 65536, 2147483647, 1024, 16, 64], "", 0, []], [[], [["FU", 2, [0, 1, 2, 3]], ["SP", 2, 0, 37933056, [1], 1], ["AN", 2, 0, 5], ["AN", 2, 1, 6], ["FU", 1, [0, 1, 2, 3]], ["SP", 1, 0, 37933056, [12], 1], ["AN", 1, 0, 5], ["AN", 1, 1, 6], ["PR", 1, 0, "auto_unroll_max_step$512"]]]], "r": [[0.0958138], 0, 6.7922, 1639020326], "v": "v0.6"}
{"i": [["[\"pool_layer\", \"avg\", 128, 168, 83, 83, 1, 1, 2, \"VALID\"]", "rocm -keys=rocm,gpu -max_num_threads=256 -mcpu=gfx906 -mtriple=amdgcn-amd-amdhsa-hcc -thread_warp_size=64", [-1, 16, 64, 65536, 2147483647, 1024, 16, 64], "", 0, []], [[], [["FU", 2, [0, 1, 2, 3]], ["SP", 2, 0, 37933056, [64], 1], ["AN", 2, 0, 5], ["AN", 2, 1, 6], ["FU", 1, [0, 1, 2, 3]], ["SP", 1, 0, 37933056, [4], 1], ["AN", 1, 0, 5], ["AN", 1, 1, 6], ["PR", 1, 0, "auto_unroll_max_step$1024"]]]], "r": [[0.0241992], 0, 6.31363, 1639020332], "v": "v0.6"}
{"i": [["[\"pool_layer\", \"avg\", 128, 168, 83, 83, 1, 1, 2, \"VALID\"]", "rocm -keys=rocm,gpu -max_num_threads=256 -mcpu=gfx906 -mtriple=amdgcn-amd-amdhsa-hcc -thread_warp_size=64", [-1, 16, 64, 65536, 2147483647, 1024, 16, 64], "", 0, []], [[], [["FU", 2, [0, 1, 2, 3]], ["SP", 2, 0, 37933056, [64], 1], ["AN", 2, 0, 5], ["AN", 2, 1, 6], ["FU", 1, [0, 1, 2, 3]], ["SP", 1, 0, 37933056, [36], 1], ["AN", 1, 0, 5], ["AN", 1, 1, 6], ["PR", 1, 0, "auto_unroll_max_step$16"]]]], "r": [[0.00396219], 0, 6.07444, 1639020338], "v": "v0.6"}
{"i": [["[\"pool_layer\", \"avg\", 128, 168, 83, 83, 1, 1, 2, \"VALID\"]", "rocm -keys=rocm,gpu -max_num_threads=256 -mcpu=gfx906 -mtriple=amdgcn-amd-amdhsa-hcc -thread_warp_size=64", [-1, 16, 64, 65536, 2147483647, 1024, 16, 64], "", 0, []], [[], [["FU", 2, [0, 1, 2, 3]], ["SP", 2, 0, 37933056, [6], 1], ["AN", 2, 0, 5], ["AN", 2, 1, 6], ["FU", 1, [0, 1, 2, 3]], ["SP", 1, 0, 37933056, [64], 1], ["AN", 1, 0, 5], ["AN", 1, 1, 6], ["PR", 1, 0, "auto_unroll_max_step$64"]]]], "r": [[0.0166063], 0, 6.11826, 1639020344], "v": "v0.6"}
{"i": [["[\"pool_layer\", \"avg\", 128, 168, 83, 83, 1, 1, 2, \"VALID\"]", "rocm -keys=rocm,gpu -max_num_threads=256 -mcpu=gfx906 -mtriple=amdgcn-amd-amdhsa-hcc -thread_warp_size=64", [-1, 16, 64, 65536, 2147483647, 1024, 16, 64], "", 0, []], [[], [["FU", 2, [0, 1, 2, 3]], ["SP", 2, 0, 37933056, [1], 1], ["AN", 2, 0, 5], ["AN", 2, 1, 6], ["FU", 1, [0, 1, 2, 3]], ["SP", 1, 0, 37933056, [16], 1], ["AN", 1, 0, 5], ["AN", 1, 1, 6], ["PR", 1, 0, "auto_unroll_max_step$16"]]]], "r": [[0.0939827], 0, 6.58124, 1639020350], "v": "v0.6"}
{"i": [["[\"pool_layer\", \"avg\", 128, 168, 83, 83, 1, 1, 2, \"VALID\"]", "rocm -keys=rocm,gpu -max_num_threads=256 -mcpu=gfx906 -mtriple=amdgcn-amd-amdhsa-hcc -thread_warp_size=64", [-1, 16, 64, 65536, 2147483647, 1024, 16, 64], "", 0, []], [[], [["FU", 2, [0, 1, 2, 3]], ["SP", 2, 0, 37933056, [64], 1], ["AN", 2, 0, 5], ["AN", 2, 1, 6], ["FU", 1, [0, 1, 2, 3]], ["SP", 1, 0, 37933056, [1], 1], ["AN", 1, 0, 5], ["AN", 1, 1, 6], ["PR", 1, 0, "auto_unroll_max_step$1024"]]]], "r": [[0.089828], 0, 6.5038, 1639020356], "v": "v0.6"}
{"i": [["[\"pool_layer\", \"avg\", 128, 168, 83, 83, 1, 1, 2, \"VALID\"]", "rocm -keys=rocm,gpu -max_num_threads=256 -mcpu=gfx906 -mtriple=amdgcn-amd-amdhsa-hcc -thread_warp_size=64", [-1, 16, 64, 65536, 2147483647, 1024, 16, 64], "", 0, []], [[], [["FU", 2, [0, 1, 2, 3]], ["SP", 2, 0, 37933056, [4], 1], ["AN", 2, 0, 5], ["AN", 2, 1, 6], ["FU", 1, [0, 1, 2, 3]], ["SP", 1, 0, 37933056, [32], 1], ["AN", 1, 0, 5], ["AN", 1, 1, 6], ["PR", 1, 0, "auto_unroll_max_step$512"]]]], "r": [[0.0255702], 0, 6.22774, 1639020362], "v": "v0.6"}
{"i": [["[\"pool_layer\", \"avg\", 128, 168, 83, 83, 1, 1, 2, \"VALID\"]", "rocm -keys=rocm,gpu -max_num_threads=256 -mcpu=gfx906 -mtriple=amdgcn-amd-amdhsa-hcc -thread_warp_size=64", [-1, 16, 64, 65536, 2147483647, 1024, 16, 64], "", 0, []], [[], [["FU", 2, [0, 1, 2, 3]], ["SP", 2, 0, 37933056, [4], 1], ["AN", 2, 0, 5], ["AN", 2, 1, 6], ["FU", 1, [0, 1, 2, 3]], ["SP", 1, 0, 37933056, [64], 1], ["AN", 1, 0, 5], ["AN", 1, 1, 6], ["PR", 1, 0, "auto_unroll_max_step$1024"]]]], "r": [[0.023499], 0, 5.43633, 1639020367], "v": "v0.6"}
{"i": [["[\"pool_layer\", \"avg\", 128, 168, 83, 83, 1, 1, 2, \"VALID\"]", "rocm -keys=rocm,gpu -max_num_threads=256 -mcpu=gfx906 -mtriple=amdgcn-amd-amdhsa-hcc -thread_warp_size=64", [-1, 16, 64, 65536, 2147483647, 1024, 16, 64], "", 0, []], [[], [["FU", 2, [0, 1, 2, 3]], ["SP", 2, 0, 37933056, [16], 1], ["AN", 2, 0, 5], ["AN", 2, 1, 6], ["FU", 1, [0, 1, 2, 3]], ["SP", 1, 0, 37933056, [64], 1], ["AN", 1, 0, 5], ["AN", 1, 1, 6], ["PR", 1, 0, "auto_unroll_max_step$64"]]]], "r": [[0.0069127], 0, 5.86257, 1639020373], "v": "v0.6"}
{"i": [["[\"pool_layer\", \"avg\", 128, 168, 83, 83, 1, 1, 2, \"VALID\"]", "rocm -keys=rocm,gpu -max_num_threads=256 -mcpu=gfx906 -mtriple=amdgcn-amd-amdhsa-hcc -thread_warp_size=64", [-1, 16, 64, 65536, 2147483647, 1024, 16, 64], "", 0, []], [[], [["FU", 2, [0, 1, 2, 3]], ["SP", 2, 0, 37933056, [64], 1], ["AN", 2, 0, 5], ["AN", 2, 1, 6], ["FU", 1, [0, 1, 2, 3]], ["SP", 1, 0, 37933056, [4], 1], ["AN", 1, 0, 5], ["AN", 1, 1, 6], ["PR", 1, 0, "auto_unroll_max_step$0"]]]], "r": [[0.0234984], 0, 5.17378, 1639020378], "v": "v0.6"}
{"i": [["[\"pool_layer\", \"avg\", 128, 168, 83, 83, 1, 1, 2, \"VALID\"]", "rocm -keys=rocm,gpu -max_num_threads=256 -mcpu=gfx906 -mtriple=amdgcn-amd-amdhsa-hcc -thread_warp_size=64", [-1, 16, 64, 65536, 2147483647, 1024, 16, 64], "", 0, []], [[], [["FU", 2, [0, 1, 2, 3]], ["SP", 2, 0, 37933056, [2], 1], ["AN", 2, 0, 5], ["AN", 2, 1, 6], ["FU", 1, [0, 1, 2, 3]], ["SP", 1, 0, 37933056, [2], 1], ["AN", 1, 0, 5], ["AN", 1, 1, 6], ["PR", 1, 0, "auto_unroll_max_step$0"]]]], "r": [[0.0884593], 0, 6.5724, 1639020385], "v": "v0.6"}
{"i": [["[\"pool_layer\", \"avg\", 128, 168, 83, 83, 1, 1, 2, \"VALID\"]", "rocm -keys=rocm,gpu -max_num_threads=256 -mcpu=gfx906 -mtriple=amdgcn-amd-amdhsa-hcc -thread_warp_size=64", [-1, 16, 64, 65536, 2147483647, 1024, 16, 64], "", 0, []], [[], [["FU", 2, [0, 1, 2, 3]], ["SP", 2, 0, 37933056, [54], 1], ["AN", 2, 0, 5], ["AN", 2, 1, 6], ["FU", 1, [0, 1, 2, 3]], ["SP", 1, 0, 37933056, [8], 1], ["AN", 1, 0, 5], ["AN", 1, 1, 6], ["PR", 1, 0, "auto_unroll_max_step$16"]]]], "r": [[0.0126982], 0, 6.16387, 1639020390], "v": "v0.6"}
{"i": [["[\"pool_layer\", \"avg\", 128, 168, 83, 83, 1, 1, 2, \"VALID\"]", "rocm -keys=rocm,gpu -max_num_threads=256 -mcpu=gfx906 -mtriple=amdgcn-amd-amdhsa-hcc -thread_warp_size=64", [-1, 16, 64, 65536, 2147483647, 1024, 16, 64], "", 0, []], [[], [["FU", 2, [0, 1, 2, 3]], ["SP", 2, 0, 37933056, [64], 1], ["AN", 2, 0, 5], ["AN", 2, 1, 6], ["FU", 1, [0, 1, 2, 3]], ["SP", 1, 0, 37933056, [64], 1], ["AN", 1, 0, 5], ["AN", 1, 1, 6], ["PR", 1, 0, "auto_unroll_max_step$512"]]]], "r": [[0.00276766], 0, 6.42561, 1639020397], "v": "v0.6"}
{"i": [["[\"pool_layer\", \"avg\", 128, 168, 83, 83, 1, 1, 2, \"VALID\"]", "rocm -keys=rocm,gpu -max_num_threads=256 -mcpu=gfx906 -mtriple=amdgcn-amd-amdhsa-hcc -thread_warp_size=64", [-1, 16, 64, 65536, 2147483647, 1024, 16, 64], "", 0, []], [[], [["FU", 2, [0, 1, 2, 3]], ["SP", 2, 0, 37933056, [64], 1], ["AN", 2, 0, 5], ["AN", 2, 1, 6], ["FU", 1, [0, 1, 2, 3]], ["SP", 1, 0, 37933056, [64], 1], ["AN", 1, 0, 5], ["AN", 1, 1, 6], ["PR", 1, 0, "auto_unroll_max_step$64"]]]], "r": [[0.00282147], 0, 5.84704, 1639020402], "v": "v0.6"}
{"i": [["[\"pool_layer\", \"avg\", 128, 168, 83, 83, 1, 1, 2, \"VALID\"]", "rocm -keys=rocm,gpu -max_num_threads=256 -mcpu=gfx906 -mtriple=amdgcn-amd-amdhsa-hcc -thread_warp_size=64", [-1, 16, 64, 65536, 2147483647, 1024, 16, 64], "", 0, []], [[], [["FU", 2, [0, 1, 2, 3]], ["SP", 2, 0, 37933056, [64], 1], ["AN", 2, 0, 5], ["AN", 2, 1, 6], ["FU", 1, [0, 1, 2, 3]], ["SP", 1, 0, 37933056, [64], 1], ["AN", 1, 0, 5], ["AN", 1, 1, 6], ["PR", 1, 0, "auto_unroll_max_step$16"]]]], "r": [[0.00276771], 0, 6.50984, 1639020409], "v": "v0.6"}
{"i": [["[\"pool_layer\", \"avg\", 128, 168, 83, 83, 1, 1, 2, \"VALID\"]", "rocm -keys=rocm,gpu -max_num_threads=256 -mcpu=gfx906 -mtriple=amdgcn-amd-amdhsa-hcc -thread_warp_size=64", [-1, 16, 64, 65536, 2147483647, 1024, 16, 64], "", 0, []], [[], [["FU", 2, [0, 1, 2, 3]], ["SP", 2, 0, 37933056, [2], 1], ["AN", 2, 0, 5], ["AN", 2, 1, 6], ["FU", 1, [0, 1, 2, 3]], ["SP", 1, 0, 37933056, [21], 1], ["AN", 1, 0, 5], ["AN", 1, 1, 6], ["PR", 1, 0, "auto_unroll_max_step$0"]]]], "r": [[0.0484324], 0, 6.17419, 1639020425], "v": "v0.6"}
{"i": [["[\"pool_layer\", \"avg\", 128, 168, 83, 83, 1, 1, 2, \"VALID\"]", "rocm -keys=rocm,gpu -max_num_threads=256 -mcpu=gfx906 -mtriple=amdgcn-amd-amdhsa-hcc -thread_warp_size=64", [-1, 16, 64, 65536, 2147483647, 1024, 16, 64], "", 0, []], [[], [["FU", 2, [0, 1, 2, 3]], ["SP", 2, 0, 37933056, [4], 1], ["AN", 2, 0, 5], ["AN", 2, 1, 6], ["FU", 1, [0, 1, 2, 3]], ["SP", 1, 0, 37933056, [2], 1], ["AN", 1, 0, 5], ["AN", 1, 1, 6], ["PR", 1, 0, "auto_unroll_max_step$16"]]]], "r": [[0.0663399], 0, 7.21474, 1639020432], "v": "v0.6"}
{"i": [["[\"pool_layer\", \"avg\", 128, 168, 83, 83, 1, 1, 2, \"VALID\"]", "rocm -keys=rocm,gpu -max_num_threads=256 -mcpu=gfx906 -mtriple=amdgcn-amd-amdhsa-hcc -thread_warp_size=64", [-1, 16, 64, 65536, 2147483647, 1024, 16, 64], "", 0, []], [[], [["FU", 2, [0, 1, 2, 3]], ["SP", 2, 0, 37933056, [36], 1], ["AN", 2, 0, 5], ["AN", 2, 1, 6], ["FU", 1, [0, 1, 2, 3]], ["SP", 1, 0, 37933056, [64], 1], ["AN", 1, 0, 5], ["AN", 1, 1, 6], ["PR", 1, 0, "auto_unroll_max_step$1024"]]]], "r": [[0.00396155], 0, 6.23831, 1639020438], "v": "v0.6"}
{"i": [["[\"pool_layer\", \"avg\", 128, 168, 83, 83, 1, 1, 2, \"VALID\"]", "rocm -keys=rocm,gpu -max_num_threads=256 -mcpu=gfx906 -mtriple=amdgcn-amd-amdhsa-hcc -thread_warp_size=64", [-1, 16, 64, 65536, 2147483647, 1024, 16, 64], "", 0, []], [[], [["FU", 2, [0, 1, 2, 3]], ["SP", 2, 0, 37933056, [16], 1], ["AN", 2, 0, 5], ["AN", 2, 1, 6], ["FU", 1, [0, 1, 2, 3]], ["SP", 1, 0, 37933056, [1], 1], ["AN", 1, 0, 5], ["AN", 1, 1, 6], ["PR", 1, 0, "auto_unroll_max_step$64"]]]], "r": [[0.0939772], 0, 6.56575, 1639020444], "v": "v0.6"}
{"i": [["[\"pool_layer\", \"avg\", 128, 168, 83, 83, 1, 1, 2, \"VALID\"]", "rocm -keys=rocm,gpu -max_num_threads=256 -mcpu=gfx906 -mtriple=amdgcn-amd-amdhsa-hcc -thread_warp_size=64", [-1, 16, 64, 65536, 2147483647, 1024, 16, 64], "", 0, []], [[], [["FU", 2, [0, 1, 2, 3]], ["SP", 2, 0, 37933056, [36], 1], ["AN", 2, 0, 5], ["AN", 2, 1, 6], ["FU", 1, [0, 1, 2, 3]], ["SP", 1, 0, 37933056, [64], 1], ["AN", 1, 0, 5], ["AN", 1, 1, 6], ["PR", 1, 0, "auto_unroll_max_step$64"]]]], "r": [[0.00391745], 0, 6.61527, 1639020450], "v": "v0.6"}
{"i": [["[\"pool_layer\", \"avg\", 128, 168, 83, 83, 1, 1, 2, \"VALID\"]", "rocm -keys=rocm,gpu -max_num_threads=256 -mcpu=gfx906 -mtriple=amdgcn-amd-amdhsa-hcc -thread_warp_size=64", [-1, 16, 64, 65536, 2147483647, 1024, 16, 64], "", 0, []], [[], [["FU", 2, [0, 1, 2, 3]], ["SP", 2, 0, 37933056, [56], 1], ["AN", 2, 0, 5], ["AN", 2, 1, 6], ["FU", 1, [0, 1, 2, 3]], ["SP", 1, 0, 37933056, [1], 1], ["AN", 1, 0, 5], ["AN", 1, 1, 6], ["PR", 1, 0, "auto_unroll_max_step$0"]]]], "r": [[0.0900251], 0, 6.90416, 1639020457], "v": "v0.6"}
{"i": [["[\"pool_layer\", \"avg\", 128, 168, 83, 83, 1, 1, 2, \"VALID\"]", "rocm -keys=rocm,gpu -max_num_threads=256 -mcpu=gfx906 -mtriple=amdgcn-amd-amdhsa-hcc -thread_warp_size=64", [-1, 16, 64, 65536, 2147483647, 1024, 16, 64], "", 0, []], [[], [["FU", 2, [0, 1, 2, 3]], ["SP", 2, 0, 37933056, [8], 1], ["AN", 2, 0, 5], ["AN", 2, 1, 6], ["FU", 1, [0, 1, 2, 3]], ["SP", 1, 0, 37933056, [1], 1], ["AN", 1, 0, 5], ["AN", 1, 1, 6], ["PR", 1, 0, "auto_unroll_max_step$1024"]]]], "r": [[0.102527], 0, 6.17258, 1639020463], "v": "v0.6"}
{"i": [["[\"pool_layer\", \"avg\", 128, 168, 83, 83, 1, 1, 2, \"VALID\"]", "rocm -keys=rocm,gpu -max_num_threads=256 -mcpu=gfx906 -mtriple=amdgcn-amd-amdhsa-hcc -thread_warp_size=64", [-1, 16, 64, 65536, 2147483647, 1024, 16, 64], "", 0, []], [[], [["FU", 2, [0, 1, 2, 3]], ["SP", 2, 0, 37933056, [56], 1], ["AN", 2, 0, 5], ["AN", 2, 1, 6], ["FU", 1, [0, 1, 2, 3]], ["SP", 1, 0, 37933056, [2], 1], ["AN", 1, 0, 5], ["AN", 1, 1, 6], ["PR", 1, 0, "auto_unroll_max_step$0"]]]], "r": [[0.0458088], 0, 6.13933, 1639020468], "v": "v0.6"}
{"i": [["[\"pool_layer\", \"avg\", 128, 168, 83, 83, 1, 1, 2, \"VALID\"]", "rocm -keys=rocm,gpu -max_num_threads=256 -mcpu=gfx906 -mtriple=amdgcn-amd-amdhsa-hcc -thread_warp_size=64", [-1, 16, 64, 65536, 2147483647, 1024, 16, 64], "", 0, []], [[], [["FU", 2, [0, 1, 2, 3]], ["SP", 2, 0, 37933056, [18], 1], ["AN", 2, 0, 5], ["AN", 2, 1, 6], ["FU", 1, [0, 1, 2, 3]], ["SP", 1, 0, 37933056, [64], 1], ["AN", 1, 0, 5], ["AN", 1, 1, 6], ["PR", 1, 0, "auto_unroll_max_step$16"]]]], "r": [[0.00629998], 0, 6.05101, 1639020474], "v": "v0.6"}
{"i": [["[\"pool_layer\", \"avg\", 128, 168, 83, 83, 1, 1, 2, \"VALID\"]", "rocm -keys=rocm,gpu -max_num_threads=256 -mcpu=gfx906 -mtriple=amdgcn-amd-amdhsa-hcc -thread_warp_size=64", [-1, 16, 64, 65536, 2147483647, 1024, 16, 64], "", 0, []], [[], [["FU", 2, [0, 1, 2, 3]], ["SP", 2, 0, 37933056, [32], 1], ["AN", 2, 0, 5], ["AN", 2, 1, 6], ["FU", 1, [0, 1, 2, 3]], ["SP", 1, 0, 37933056, [6], 1], ["AN", 1, 0, 5], ["AN", 1, 1, 6], ["PR", 1, 0, "auto_unroll_max_step$0"]]]], "r": [[0.0180096], 0, 6.06034, 1639020480], "v": "v0.6"}
{"i": [["[\"pool_layer\", \"avg\", 128, 168, 83, 83, 1, 1, 2, \"VALID\"]", "rocm -keys=rocm,gpu -max_num_threads=256 -mcpu=gfx906 -mtriple=amdgcn-amd-amdhsa-hcc -thread_warp_size=64", [-1, 16, 64, 65536, 2147483647, 1024, 16, 64], "", 0, []], [[], [["FU", 2, [0, 1, 2, 3]], ["SP", 2, 0, 37933056, [24], 1], ["AN", 2, 0, 5], ["AN", 2, 1, 6], ["FU", 1, [0, 1, 2, 3]], ["SP", 1, 0, 37933056, [8], 1], ["AN", 1, 0, 5], ["AN", 1, 1, 6], ["PR", 1, 0, "auto_unroll_max_step$0"]]]], "r": [[0.0151801], 0, 6.12262, 1639020486], "v": "v0.6"}
{"i": [["[\"pool_layer\", \"avg\", 128, 168, 83, 83, 1, 1, 2, \"VALID\"]", "rocm -keys=rocm,gpu -max_num_threads=256 -mcpu=gfx906 -mtriple=amdgcn-amd-amdhsa-hcc -thread_warp_size=64", [-1, 16, 64, 65536, 2147483647, 1024, 16, 64], "", 0, []], [[], [["FU", 2, [0, 1, 2, 3]], ["SP", 2, 0, 37933056, [4], 1], ["AN", 2, 0, 5], ["AN", 2, 1, 6], ["FU", 1, [0, 1, 2, 3]], ["SP", 1, 0, 37933056, [56], 1], ["AN", 1, 0, 5], ["AN", 1, 1, 6], ["PR", 1, 0, "auto_unroll_max_step$1024"]]]], "r": [[0.0236922], 0, 6.833, 1639020492], "v": "v0.6"}
{"i": [["[\"pool_layer\", \"avg\", 128, 168, 83, 83, 1, 1, 2, \"VALID\"]", "rocm -keys=rocm,gpu -max_num_threads=256 -mcpu=gfx906 -mtriple=amdgcn-amd-amdhsa-hcc -thread_warp_size=64", [-1, 16, 64, 65536, 2147483647, 1024, 16, 64], "", 0, []], [[], [["FU", 2, [0, 1, 2, 3]], ["SP", 2, 0, 37933056, [4], 1], ["AN", 2, 0, 5], ["AN", 2, 1, 6], ["FU", 1, [0, 1, 2, 3]], ["SP", 1, 0, 37933056, [24], 1], ["AN", 1, 0, 5], ["AN", 1, 1, 6], ["PR", 1, 0, "auto_unroll_max_step$64"]]]], "r": [[0.0257999], 0, 6.17322, 1639020498], "v": "v0.6"}
{"i": [["[\"pool_layer\", \"avg\", 128, 168, 83, 83, 1, 1, 2, \"VALID\"]", "rocm -keys=rocm,gpu -max_num_threads=256 -mcpu=gfx906 -mtriple=amdgcn-amd-amdhsa-hcc -thread_warp_size=64", [-1, 16, 64, 65536, 2147483647, 1024, 16, 64], "", 0, []], [[], [["FU", 2, [0, 1, 2, 3]], ["SP", 2, 0, 37933056, [24], 1], ["AN", 2, 0, 5], ["AN", 2, 1, 6], ["FU", 1, [0, 1, 2, 3]], ["SP", 1, 0, 37933056, [1], 1], ["AN", 1, 0, 5], ["AN", 1, 1, 6], ["PR", 1, 0, "auto_unroll_max_step$512"]]]], "r": [[0.0921339], 0, 6.48741, 1639020504], "v": "v0.6"}
{"i": [["[\"pool_layer\", \"avg\", 128, 168, 83, 83, 1, 1, 2, \"VALID\"]", "rocm -keys=rocm,gpu -max_num_threads=256 -mcpu=gfx906 -mtriple=amdgcn-amd-amdhsa-hcc -thread_warp_size=64", [-1, 16, 64, 65536, 2147483647, 1024, 16, 64], "", 0, []], [[], [["FU", 2, [0, 1, 2, 3]], ["SP", 2, 0, 37933056, [27], 1], ["AN", 2, 0, 5], ["AN", 2, 1, 6], ["FU", 1, [0, 1, 2, 3]], ["SP", 1, 0, 37933056, [64], 1], ["AN", 1, 0, 5], ["AN", 1, 1, 6], ["PR", 1, 0, "auto_unroll_max_step$64"]]]], "r": [[0.00465991], 0, 6.50959, 1639020510], "v": "v0.6"}
{"i": [["[\"pool_layer\", \"avg\", 128, 168, 83, 83, 1, 1, 2, \"VALID\"]", "rocm -keys=rocm,gpu -max_num_threads=256 -mcpu=gfx906 -mtriple=amdgcn-amd-amdhsa-hcc -thread_warp_size=64", [-1, 16, 64, 65536, 2147483647, 1024, 16, 64], "", 0, []], [[], [["FU", 2, [0, 1, 2, 3]], ["SP", 2, 0, 37933056, [1], 1], ["AN", 2, 0, 5], ["AN", 2, 1, 6], ["FU", 1, [0, 1, 2, 3]], ["SP", 1, 0, 37933056, [8], 1], ["AN", 1, 0, 5], ["AN", 1, 1, 6], ["PR", 1, 0, "auto_unroll_max_step$1024"]]]], "r": [[0.102545], 0, 6.32561, 1639020516], "v": "v0.6"}
{"i": [["[\"pool_layer\", \"avg\", 128, 168, 83, 83, 1, 1, 2, \"VALID\"]", "rocm -keys=rocm,gpu -max_num_threads=256 -mcpu=gfx906 -mtriple=amdgcn-amd-amdhsa-hcc -thread_warp_size=64", [-1, 16, 64, 65536, 2147483647, 1024, 16, 64], "", 0, []], [[], [["FU", 2, [0, 1, 2, 3]], ["SP", 2, 0, 37933056, [2], 1], ["AN", 2, 0, 5], ["AN", 2, 1, 6], ["FU", 1, [0, 1, 2, 3]], ["SP", 1, 0, 37933056, [1], 1], ["AN", 1, 0, 5], ["AN", 1, 1, 6], ["PR", 1, 0, "auto_unroll_max_step$1024"]]]], "r": [[0.135652], 0, 6.30779, 1639020523], "v": "v0.6"}
{"i": [["[\"pool_layer\", \"avg\", 128, 168, 83, 83, 1, 1, 2, \"VALID\"]", "rocm -keys=rocm,gpu -max_num_threads=256 -mcpu=gfx906 -mtriple=amdgcn-amd-amdhsa-hcc -thread_warp_size=64", [-1, 16, 64, 65536, 2147483647, 1024, 16, 64], "", 0, []], [[], [["FU", 2, [0, 1, 2, 3]], ["SP", 2, 0, 37933056, [1], 1], ["AN", 2, 0, 5], ["AN", 2, 1, 6], ["FU", 1, [0, 1, 2, 3]], ["SP", 1, 0, 37933056, [2], 1], ["AN", 1, 0, 5], ["AN", 1, 1, 6], ["PR", 1, 0, "auto_unroll_max_step$0"]]]], "r": [[0.132976], 0, 6.50726, 1639020529], "v": "v0.6"}
{"i": [["[\"pool_layer\", \"avg\", 128, 168, 83, 83, 1, 1, 2, \"VALID\"]", "rocm -keys=rocm,gpu -max_num_threads=256 -mcpu=gfx906 -mtriple=amdgcn-amd-amdhsa-hcc -thread_warp_size=64", [-1, 16, 64, 65536, 2147483647, 1024, 16, 64], "", 0, []], [[], [["FU", 2, [0, 1, 2, 3]], ["SP", 2, 0, 37933056, [18], 1], ["AN", 2, 0, 5], ["AN", 2, 1, 6], ["FU", 1, [0, 1, 2, 3]], ["SP", 1, 0, 37933056, [2], 1], ["AN", 1, 0, 5], ["AN", 1, 1, 6], ["PR", 1, 0, "auto_unroll_max_step$16"]]]], "r": [[0.050441], 0, 6.42508, 1639020535], "v": "v0.6"}
{"i": [["[\"pool_layer\", \"avg\", 128, 168, 83, 83, 1, 1, 2, \"VALID\"]", "rocm -keys=rocm,gpu -max_num_threads=256 -mcpu=gfx906 -mtriple=amdgcn-amd-amdhsa-hcc -thread_warp_size=64", [-1, 16, 64, 65536, 2147483647, 1024, 16, 64], "", 0, []], [[], [["FU", 2, [0, 1, 2, 3]], ["SP", 2, 0, 37933056, [1], 1], ["AN", 2, 0, 5], ["AN", 2, 1, 6], ["FU", 1, [0, 1, 2, 3]], ["SP", 1, 0, 37933056, [9], 1], ["AN", 1, 0, 5], ["AN", 1, 1, 6], ["PR", 1, 0, "auto_unroll_max_step$1024"]]]], "r": [[0.0982695], 0, 5.86701, 1639020540], "v": "v0.6"}
{"i": [["[\"pool_layer\", \"avg\", 128, 168, 83, 83, 1, 1, 2, \"VALID\"]", "rocm -keys=rocm,gpu -max_num_threads=256 -mcpu=gfx906 -mtriple=amdgcn-amd-amdhsa-hcc -thread_warp_size=64", [-1, 16, 64, 65536, 2147483647, 1024, 16, 64], "", 0, []], [[], [["FU", 2, [0, 1, 2, 3]], ["SP", 2, 0, 37933056, [1], 1], ["AN", 2, 0, 5], ["AN", 2, 1, 6], ["FU", 1, [0, 1, 2, 3]], ["SP", 1, 0, 37933056, [64], 1], ["AN", 1, 0, 5], ["AN", 1, 1, 6], ["PR", 1, 0, "auto_unroll_max_step$64"]]]], "r": [[0.0898411], 0, 6.63761, 1639020547], "v": "v0.6"}
{"i": [["[\"pool_layer\", \"avg\", 128, 168, 83, 83, 1, 1, 2, \"VALID\"]", "rocm -keys=rocm,gpu -max_num_threads=256 -mcpu=gfx906 -mtriple=amdgcn-amd-amdhsa-hcc -thread_warp_size=64", [-1, 16, 64, 65536, 2147483647, 1024, 16, 64], "", 0, []], [[], [["FU", 2, [0, 1, 2, 3]], ["SP", 2, 0, 37933056, [24], 1], ["AN", 2, 0, 5], ["AN", 2, 1, 6], ["FU", 1, [0, 1, 2, 3]], ["SP", 1, 0, 37933056, [48], 1], ["AN", 1, 0, 5], ["AN", 1, 1, 6], ["PR", 1, 0, "auto_unroll_max_step$64"]]]], "r": [[0.00563802], 0, 6.73902, 1639020553], "v": "v0.6"}
{"i": [["[\"pool_layer\", \"avg\", 128, 168, 83, 83, 1, 1, 2, \"VALID\"]", "rocm -keys=rocm,gpu -max_num_threads=256 -mcpu=gfx906 -mtriple=amdgcn-amd-amdhsa-hcc -thread_warp_size=64", [-1, 16, 64, 65536, 2147483647, 1024, 16, 64], "", 0, []], [[], [["FU", 2, [0, 1, 2, 3]], ["SP", 2, 0, 37933056, [32], 1], ["AN", 2, 0, 5], ["AN", 2, 1, 6], ["FU", 1, [0, 1, 2, 3]], ["SP", 1, 0, 37933056, [48], 1], ["AN", 1, 0, 5], ["AN", 1, 1, 6], ["PR", 1, 0, "auto_unroll_max_step$1024"]]]], "r": [[0.00475165], 0, 6.09625, 1639020559], "v": "v0.6"}
{"i": [["[\"pool_layer\", \"avg\", 128, 168, 83, 83, 1, 1, 2, \"VALID\"]", "rocm -keys=rocm,gpu -max_num_threads=256 -mcpu=gfx906 -mtriple=amdgcn-amd-amdhsa-hcc -thread_warp_size=64", [-1, 16, 64, 65536, 2147483647, 1024, 16, 64], "", 0, []], [[], [["FU", 2, [0, 1, 2, 3]], ["SP", 2, 0, 37933056, [54], 1], ["AN", 2, 0, 5], ["AN", 2, 1, 6], ["FU", 1, [0, 1, 2, 3]], ["SP", 1, 0, 37933056, [16], 1], ["AN", 1, 0, 5], ["AN", 1, 1, 6], ["PR", 1, 0, "auto_unroll_max_step$512"]]]], "r": [[0.00738671], 0, 6.31675, 1639020565], "v": "v0.6"}
{"i": [["[\"pool_layer\", \"avg\", 128, 168, 83, 83, 1, 1, 2, \"VALID\"]", "rocm -keys=rocm,gpu -max_num_threads=256 -mcpu=gfx906 -mtriple=amdgcn-amd-amdhsa-hcc -thread_warp_size=64", [-1, 16, 64, 65536, 2147483647, 1024, 16, 64], "", 0, []], [[], [["FU", 2, [0, 1, 2, 3]], ["SP", 2, 0, 37933056, [56], 1], ["AN", 2, 0, 5], ["AN", 2, 1, 6], ["FU", 1, [0, 1, 2, 3]], ["SP", 1, 0, 37933056, [64], 1], ["AN", 1, 0, 5], ["AN", 1, 1, 6], ["PR", 1, 0, "auto_unroll_max_step$1024"]]]], "r": [[0.00296521], 0, 6.45176, 1639020571], "v": "v0.6"}
{"i": [["[\"pool_layer\", \"avg\", 128, 168, 83, 83, 1, 1, 2, \"VALID\"]", "rocm -keys=rocm,gpu -max_num_threads=256 -mcpu=gfx906 -mtriple=amdgcn-amd-amdhsa-hcc -thread_warp_size=64", [-1, 16, 64, 65536, 2147483647, 1024, 16, 64], "", 0, []], [[], [["FU", 2, [0, 1, 2, 3]], ["SP", 2, 0, 37933056, [27], 1], ["AN", 2, 0, 5], ["AN", 2, 1, 6], ["FU", 1, [0, 1, 2, 3]], ["SP", 1, 0, 37933056, [36], 1], ["AN", 1, 0, 5], ["AN", 1, 1, 6], ["PR", 1, 0, "auto_unroll_max_step$64"]]]], "r": [[0.00584516], 0, 6.62546, 1639020577], "v": "v0.6"}
{"i": [["[\"pool_layer\", \"avg\", 128, 168, 83, 83, 1, 1, 2, \"VALID\"]", "rocm -keys=rocm,gpu -max_num_threads=256 -mcpu=gfx906 -mtriple=amdgcn-amd-amdhsa-hcc -thread_warp_size=64", [-1, 16, 64, 65536, 2147483647, 1024, 16, 64], "", 0, []], [[], [["FU", 2, [0, 1, 2, 3]], ["SP", 2, 0, 37933056, [16], 1], ["AN", 2, 0, 5], ["AN", 2, 1, 6], ["FU", 1, [0, 1, 2, 3]], ["SP", 1, 0, 37933056, [24], 1], ["AN", 1, 0, 5], ["AN", 1, 1, 6], ["PR", 1, 0, "auto_unroll_max_step$0"]]]], "r": [[0.00949097], 0, 6.17463, 1639020583], "v": "v0.6"}
{"i": [["[\"pool_layer\", \"avg\", 128, 168, 83, 83, 1, 1, 2, \"VALID\"]", "rocm -keys=rocm,gpu -max_num_threads=256 -mcpu=gfx906 -mtriple=amdgcn-amd-amdhsa-hcc -thread_warp_size=64", [-1, 16, 64, 65536, 2147483647, 1024, 16, 64], "", 0, []], [[], [["FU", 2, [0, 1, 2, 3]], ["SP", 2, 0, 37933056, [2], 1], ["AN", 2, 0, 5], ["AN", 2, 1, 6], ["FU", 1, [0, 1, 2, 3]], ["SP", 1, 0, 37933056, [9], 1], ["AN", 1, 0, 5], ["AN", 1, 1, 6], ["PR", 1, 0, "auto_unroll_max_step$1024"]]]], "r": [[0.0540586], 0, 6.65278, 1639020590], "v": "v0.6"}
{"i": [["[\"pool_layer\", \"avg\", 128, 168, 83, 83, 1, 1, 2, \"VALID\"]", "rocm -keys=rocm,gpu -max_num_threads=256 -mcpu=gfx906 -mtriple=amdgcn-amd-amdhsa-hcc -thread_warp_size=64", [-1, 16, 64, 65536, 2147483647, 1024, 16, 64], "", 0, []], [[], [["FU", 2, [0, 1, 2, 3]], ["SP", 2, 0, 37933056, [32], 1], ["AN", 2, 0, 5], ["AN", 2, 1, 6], ["FU", 1, [0, 1, 2, 3]], ["SP", 1, 0, 37933056, [6], 1], ["AN", 1, 0, 5], ["AN", 1, 1, 6], ["PR", 1, 0, "auto_unroll_max_step$16"]]]], "r": [[0.0175098], 0, 6.18807, 1639020595], "v": "v0.6"}
{"i": [["[\"pool_layer\", \"avg\", 128, 168, 83, 83, 1, 1, 2, \"VALID\"]", "rocm -keys=rocm,gpu -max_num_threads=256 -mcpu=gfx906 -mtriple=amdgcn-amd-amdhsa-hcc -thread_warp_size=64", [-1, 16, 64, 65536, 2147483647, 1024, 16, 64], "", 0, []], [[], [["FU", 2, [0, 1, 2, 3]], ["SP", 2, 0, 37933056, [8], 1], ["AN", 2, 0, 5], ["AN", 2, 1, 6], ["FU", 1, [0, 1, 2, 3]], ["SP", 1, 0, 37933056, [1], 1], ["AN", 1, 0, 5], ["AN", 1, 1, 6], ["PR", 1, 0, "auto_unroll_max_step$64"]]]], "r": [[0.0994956], 0, 6.70205, 1639020602], "v": "v0.6"}
{"i": [["[\"pool_layer\", \"avg\", 128, 168, 83, 83, 1, 1, 2, \"VALID\"]", "rocm -keys=rocm,gpu -max_num_threads=256 -mcpu=gfx906 -mtriple=amdgcn-amd-amdhsa-hcc -thread_warp_size=64", [-1, 16, 64, 65536, 2147483647, 1024, 16, 64], "", 0, []], [[], [["FU", 2, [0, 1, 2, 3]], ["SP", 2, 0, 37933056, [48], 1], ["AN", 2, 0, 5], ["AN", 2, 1, 6], ["FU", 1, [0, 1, 2, 3]], ["SP", 1, 0, 37933056, [1], 1], ["AN", 1, 0, 5], ["AN", 1, 1, 6], ["PR", 1, 0, "auto_unroll_max_step$1024"]]]], "r": [[0.0902961], 0, 6.6759, 1639020608], "v": "v0.6"}
{"i": [["[\"pool_layer\", \"avg\", 128, 168, 83, 83, 1, 1, 2, \"VALID\"]", "rocm -keys=rocm,gpu -max_num_threads=256 -mcpu=gfx906 -mtriple=amdgcn-amd-amdhsa-hcc -thread_warp_size=64", [-1, 16, 64, 65536, 2147483647, 1024, 16, 64], "", 0, []], [[], [["FU", 2, [0, 1, 2, 3]], ["SP", 2, 0, 37933056, [36], 1], ["AN", 2, 0, 5], ["AN", 2, 1, 6], ["FU", 1, [0, 1, 2, 3]], ["SP", 1, 0, 37933056, [2], 1], ["AN", 1, 0, 5], ["AN", 1, 1, 6], ["PR", 1, 0, "auto_unroll_max_step$16"]]]], "r": [[0.047973], 0, 6.19633, 1639020614], "v": "v0.6"}
{"i": [["[\"pool_layer\", \"avg\", 128, 168, 83, 83, 1, 1, 2, \"VALID\"]", "rocm -keys=rocm,gpu -max_num_threads=256 -mcpu=gfx906 -mtriple=amdgcn-amd-amdhsa-hcc -thread_warp_size=64", [-1, 16, 64, 65536, 2147483647, 1024, 16, 64], "", 0, []], [[], [["FU", 2, [0, 1, 2, 3]], ["SP", 2, 0, 37933056, [14], 1], ["AN", 2, 0, 5], ["AN", 2, 1, 6], ["FU", 1, [0, 1, 2, 3]], ["SP", 1, 0, 37933056, [4], 1], ["AN", 1, 0, 5], ["AN", 1, 1, 6], ["PR", 1, 0, "auto_unroll_max_step$1024"]]]], "r": [[0.0292573], 0, 6.12761, 1639020620], "v": "v0.6"}
{"i": [["[\"pool_layer\", \"avg\", 128, 168, 83, 83, 1, 1, 2, \"VALID\"]", "rocm -keys=rocm,gpu -max_num_threads=256 -mcpu=gfx906 -mtriple=amdgcn-amd-amdhsa-hcc -thread_warp_size=64", [-1, 16, 64, 65536, 2147483647, 1024, 16, 64], "", 0, []], [[], [["FU", 2, [0, 1, 2, 3]], ["SP", 2, 0, 37933056, [56], 1], ["AN", 2, 0, 5], ["AN", 2, 1, 6], ["FU", 1, [0, 1, 2, 3]], ["SP", 1, 0, 37933056, [16], 1], ["AN", 1, 0, 5], ["AN", 1, 1, 6], ["PR", 1, 0, "auto_unroll_max_step$512"]]]], "r": [[0.00732809], 0, 5.87699, 1639020626], "v": "v0.6"}
{"i": [["[\"pool_layer\", \"avg\", 128, 168, 83, 83, 1, 1, 2, \"VALID\"]", "rocm -keys=rocm,gpu -max_num_threads=256 -mcpu=gfx906 -mtriple=amdgcn-amd-amdhsa-hcc -thread_warp_size=64", [-1, 16, 64, 65536, 2147483647, 1024, 16, 64], "", 0, []], [[], [["FU", 2, [0, 1, 2, 3]], ["SP", 2, 0, 37933056, [1], 1], ["AN", 2, 0, 5], ["AN", 2, 1, 6], ["FU", 1, [0, 1, 2, 3]], ["SP", 1, 0, 37933056, [14], 1], ["AN", 1, 0, 5], ["AN", 1, 1, 6], ["PR", 1, 0, "auto_unroll_max_step$1024"]]]], "r": [[0.0947615], 0, 6.87308, 1639020632], "v": "v0.6"}
{"i": [["[\"pool_layer\", \"avg\", 128, 168, 83, 83, 1, 1, 2, \"VALID\"]", "rocm -keys=rocm,gpu -max_num_threads=256 -mcpu=gfx906 -mtriple=amdgcn-amd-amdhsa-hcc -thread_warp_size=64", [-1, 16, 64, 65536, 2147483647, 1024, 16, 64], "", 0, []], [[], [["FU", 2, [0, 1, 2, 3]], ["SP", 2, 0, 37933056, [8], 1], ["AN", 2, 0, 5], ["AN", 2, 1, 6], ["FU", 1, [0, 1, 2, 3]], ["SP", 1, 0, 37933056, [49], 1], ["AN", 1, 0, 5], ["AN", 1, 1, 6], ["PR", 1, 0, "auto_unroll_max_step$64"]]]], "r": [[0.0132471], 0, 6.23348, 1639020638], "v": "v0.6"}
{"i": [["[\"pool_layer\", \"avg\", 128, 168, 83, 83, 1, 1, 2, \"VALID\"]", "rocm -keys=rocm,gpu -max_num_threads=256 -mcpu=gfx906 -mtriple=amdgcn-amd-amdhsa-hcc -thread_warp_size=64", [-1, 16, 64, 65536, 2147483647, 1024, 16, 64], "", 0, []], [[], [["FU", 2, [0, 1, 2, 3]], ["SP", 2, 0, 37933056, [1], 1], ["AN", 2, 0, 5], ["AN", 2, 1, 6], ["FU", 1, [0, 1, 2, 3]], ["SP", 1, 0, 37933056, [2], 1], ["AN", 1, 0, 5], ["AN", 1, 1, 6], ["PR", 1, 0, "auto_unroll_max_step$1024"]]]], "r": [[0.132677], 0, 6.56457, 1639020644], "v": "v0.6"}
{"i": [["[\"pool_layer\", \"avg\", 128, 168, 83, 83, 1, 1, 2, \"VALID\"]", "rocm -keys=rocm,gpu -max_num_threads=256 -mcpu=gfx906 -mtriple=amdgcn-amd-amdhsa-hcc -thread_warp_size=64", [-1, 16, 64, 65536, 2147483647, 1024, 16, 64], "", 0, []], [[], [["FU", 2, [0, 1, 2, 3]], ["SP", 2, 0, 37933056, [16], 1], ["AN", 2, 0, 5], ["AN", 2, 1, 6], ["FU", 1, [0, 1, 2, 3]], ["SP", 1, 0, 37933056, [7], 1], ["AN", 1, 0, 5], ["AN", 1, 1, 6], ["PR", 1, 0, "auto_unroll_max_step$1024"]]]], "r": [[0.0181675], 0, 6.15464, 1639020650], "v": "v0.6"}
{"i": [["[\"pool_layer\", \"avg\", 128, 168, 83, 83, 1, 1, 2, \"VALID\"]", "rocm -keys=rocm,gpu -max_num_threads=256 -mcpu=gfx906 -mtriple=amdgcn-amd-amdhsa-hcc -thread_warp_size=64", [-1, 16, 64, 65536, 2147483647, 1024, 16, 64], "", 0, []], [[], [["FU", 2, [0, 1, 2, 3]], ["SP", 2, 0, 37933056, [64], 1], ["AN", 2, 0, 5], ["AN", 2, 1, 6], ["FU", 1, [0, 1, 2, 3]], ["SP", 1, 0, 37933056, [8], 1], ["AN", 1, 0, 5], ["AN", 1, 1, 6], ["PR", 1, 0, "auto_unroll_max_step$1024"]]]], "r": [[0.0128061], 0, 6.11646, 1639020656], "v": "v0.6"}
{"i": [["[\"pool_layer\", \"avg\", 128, 168, 83, 83, 1, 1, 2, \"VALID\"]", "rocm -keys=rocm,gpu -max_num_threads=256 -mcpu=gfx906 -mtriple=amdgcn-amd-amdhsa-hcc -thread_warp_size=64", [-1, 16, 64, 65536, 2147483647, 1024, 16, 64], "", 0, []], [[], [["FU", 2, [0, 1, 2, 3]], ["SP", 2, 0, 37933056, [9], 1], ["AN", 2, 0, 5], ["AN", 2, 1, 6], ["FU", 1, [0, 1, 2, 3]], ["SP", 1, 0, 37933056, [64], 1], ["AN", 1, 0, 5], ["AN", 1, 1, 6], ["PR", 1, 0, "auto_unroll_max_step$64"]]]], "r": [[0.011551], 0, 6.12925, 1639020662], "v": "v0.6"}
{"i": [["[\"pool_layer\", \"avg\", 128, 168, 83, 83, 1, 1, 2, \"VALID\"]", "rocm -keys=rocm,gpu -max_num_threads=256 -mcpu=gfx906 -mtriple=amdgcn-amd-amdhsa-hcc -thread_warp_size=64", [-1, 16, 64, 65536, 2147483647, 1024, 16, 64], "", 0, []], [[], [["FU", 2, [0, 1, 2, 3]], ["SP", 2, 0, 37933056, [48], 1], ["AN", 2, 0, 5], ["AN", 2, 1, 6], ["FU", 1, [0, 1, 2, 3]], ["SP", 1, 0, 37933056, [1], 1], ["AN", 1, 0, 5], ["AN", 1, 1, 6], ["PR", 1, 0, "auto_unroll_max_step$16"]]]], "r": [[0.092535], 0, 6.40783, 1639020668], "v": "v0.6"}
{"i": [["[\"pool_layer\", \"avg\", 128, 168, 83, 83, 1, 1, 2, \"VALID\"]", "rocm -keys=rocm,gpu -max_num_threads=256 -mcpu=gfx906 -mtriple=amdgcn-amd-amdhsa-hcc -thread_warp_size=64", [-1, 16, 64, 65536, 2147483647, 1024, 16, 64], "", 0, []], [[], [["FU", 2, [0, 1, 2, 3]], ["SP", 2, 0, 37933056, [9], 1], ["AN", 2, 0, 5], ["AN", 2, 1, 6], ["FU", 1, [0, 1, 2, 3]], ["SP", 1, 0, 37933056, [2], 1], ["AN", 1, 0, 5], ["AN", 1, 1, 6], ["PR", 1, 0, "auto_unroll_max_step$0"]]]], "r": [[0.0540548], 0, 5.57981, 1639020674], "v": "v0.6"}
{"i": [["[\"pool_layer\", \"avg\", 128, 168, 83, 83, 1, 1, 2, \"VALID\"]", "rocm -keys=rocm,gpu -max_num_threads=256 -mcpu=gfx906 -mtriple=amdgcn-amd-amdhsa-hcc -thread_warp_size=64", [-1, 16, 64, 65536, 2147483647, 1024, 16, 64], "", 0, []], [[], [["FU", 2, [0, 1, 2, 3]], ["SP", 2, 0, 37933056, [64], 1], ["AN", 2, 0, 5], ["AN", 2, 1, 6], ["FU", 1, [0, 1, 2, 3]], ["SP", 1, 0, 37933056, [32], 1], ["AN", 1, 0, 5], ["AN", 1, 1, 6], ["PR", 1, 0, "auto_unroll_max_step$16"]]]], "r": [[0.0042758], 0, 6.17654, 1639020680], "v": "v0.6"}
{"i": [["[\"pool_layer\", \"avg\", 128, 168, 83, 83, 1, 1, 2, \"VALID\"]", "rocm -keys=rocm,gpu -max_num_threads=256 -mcpu=gfx906 -mtriple=amdgcn-amd-amdhsa-hcc -thread_warp_size=64", [-1, 16, 64, 65536, 2147483647, 1024, 16, 64], "", 0, []], [[], [["FU", 2, [0, 1, 2, 3]], ["SP", 2, 0, 37933056, [8], 1], ["AN", 2, 0, 5], ["AN", 2, 1, 6], ["FU", 1, [0, 1, 2, 3]], ["SP", 1, 0, 37933056, [2], 1], ["AN", 1, 0, 5], ["AN", 1, 1, 6], ["PR", 1, 0, "auto_unroll_max_step$16"]]]], "r": [[0.0552838], 0, 5.79053, 1639020685], "v": "v0.6"}
{"i": [["[\"pool_layer\", \"avg\", 128, 168, 83, 83, 1, 1, 2, \"VALID\"]", "rocm -keys=rocm,gpu -max_num_threads=256 -mcpu=gfx906 -mtriple=amdgcn-amd-amdhsa-hcc -thread_warp_size=64", [-1, 16, 64, 65536, 2147483647, 1024, 16, 64], "", 0, []], [[], [["FU", 2, [0, 1, 2, 3]], ["SP", 2, 0, 37933056, [56], 1], ["AN", 2, 0, 5], ["AN", 2, 1, 6], ["FU", 1, [0, 1, 2, 3]], ["SP", 1, 0, 37933056, [2], 1], ["AN", 1, 0, 5], ["AN", 1, 1, 6], ["PR", 1, 0, "auto_unroll_max_step$16"]]]], "r": [[0.045802], 0, 6.38958, 1639020691], "v": "v0.6"}
{"i": [["[\"pool_layer\", \"avg\", 128, 168, 83, 83, 1, 1, 2, \"VALID\"]", "rocm -keys=rocm,gpu -max_num_threads=256 -mcpu=gfx906 -mtriple=amdgcn-amd-amdhsa-hcc -thread_warp_size=64", [-1, 16, 64, 65536, 2147483647, 1024, 16, 64], "", 0, []], [[], [["FU", 2, [0, 1, 2, 3]], ["SP", 2, 0, 37933056, [1], 1], ["AN", 2, 0, 5], ["AN", 2, 1, 6], ["FU", 1, [0, 1, 2, 3]], ["SP", 1, 0, 37933056, [48], 1], ["AN", 1, 0, 5], ["AN", 1, 1, 6], ["PR", 1, 0, "auto_unroll_max_step$64"]]]], "r": [[0.0902932], 0, 6.40162, 1639020697], "v": "v0.6"}
{"i": [["[\"pool_layer\", \"avg\", 128, 168, 83, 83, 1, 1, 2, \"VALID\"]", "rocm -keys=rocm,gpu -max_num_threads=256 -mcpu=gfx906 -mtriple=amdgcn-amd-amdhsa-hcc -thread_warp_size=64", [-1, 16, 64, 65536, 2147483647, 1024, 16, 64], "", 0, []], [[], [["FU", 2, [0, 1, 2, 3]], ["SP", 2, 0, 37933056, [42], 1], ["AN", 2, 0, 5], ["AN", 2, 1, 6], ["FU", 1, [0, 1, 2, 3]], ["SP", 1, 0, 37933056, [28], 1], ["AN", 1, 0, 5], ["AN", 1, 1, 6], ["PR", 1, 0, "auto_unroll_max_step$512"]]]], "r": [[0.00541882], 0, 6.02225, 1639020703], "v": "v0.6"}
{"i": [["[\"pool_layer\", \"avg\", 128, 168, 83, 83, 1, 1, 2, \"VALID\"]", "rocm -keys=rocm,gpu -max_num_threads=256 -mcpu=gfx906 -mtriple=amdgcn-amd-amdhsa-hcc -thread_warp_size=64", [-1, 16, 64, 65536, 2147483647, 1024, 16, 64], "", 0, []], [[], [["FU", 2, [0, 1, 2, 3]], ["SP", 2, 0, 37933056, [8], 1], ["AN", 2, 0, 5], ["AN", 2, 1, 6], ["FU", 1, [0, 1, 2, 3]], ["SP", 1, 0, 37933056, [32], 1], ["AN", 1, 0, 5], ["AN", 1, 1, 6], ["PR", 1, 0, "auto_unroll_max_step$512"]]]], "r": [[0.0142372], 0, 6.29398, 1639020709], "v": "v0.6"}
{"i": [["[\"pool_layer\", \"avg\", 128, 168, 83, 83, 1, 1, 2, \"VALID\"]", "rocm -keys=rocm,gpu -max_num_threads=256 -mcpu=gfx906 -mtriple=amdgcn-amd-amdhsa-hcc -thread_warp_size=64", [-1, 16, 64, 65536, 2147483647, 1024, 16, 64], "", 0, []], [[], [["FU", 2, [0, 1, 2, 3]], ["SP", 2, 0, 37933056, [8], 1], ["AN", 2, 0, 5], ["AN", 2, 1, 6], ["FU", 1, [0, 1, 2, 3]], ["SP", 1, 0, 37933056, [56], 1], ["AN", 1, 0, 5], ["AN", 1, 1, 6], ["PR", 1, 0, "auto_unroll_max_step$64"]]]], "r": [[0.0130193], 0, 6.16984, 1639020715], "v": "v0.6"}
{"i": [["[\"pool_layer\", \"avg\", 128, 168, 83, 83, 1, 1, 2, \"VALID\"]", "rocm -keys=rocm,gpu -max_num_threads=256 -mcpu=gfx906 -mtriple=amdgcn-amd-amdhsa-hcc -thread_warp_size=64", [-1, 16, 64, 65536, 2147483647, 1024, 16, 64], "", 0, []], [[], [["FU", 2, [0, 1, 2, 3]], ["SP", 2, 0, 37933056, [1], 1], ["AN", 2, 0, 5], ["AN", 2, 1, 6], ["FU", 1, [0, 1, 2, 3]], ["SP", 1, 0, 37933056, [1], 1], ["AN", 1, 0, 5], ["AN", 1, 1, 6], ["PR", 1, 0, "auto_unroll_max_step$64"]]]], "r": [[0.176876], 0, 6.47231, 1639020721], "v": "v0.6"}
{"i": [["[\"pool_layer\", \"avg\", 128, 168, 83, 83, 1, 1, 2, \"VALID\"]", "rocm -keys=rocm,gpu -max_num_threads=256 -mcpu=gfx906 -mtriple=amdgcn-amd-amdhsa-hcc -thread_warp_size=64", [-1, 16, 64, 65536, 2147483647, 1024, 16, 64], "", 0, []], [[], [["FU", 2, [0, 1, 2, 3]], ["SP", 2, 0, 37933056, [36], 1], ["AN", 2, 0, 5], ["AN", 2, 1, 6], ["FU", 1, [0, 1, 2, 3]], ["SP", 1, 0, 37933056, [12], 1], ["AN", 1, 0, 5], ["AN", 1, 1, 6], ["PR", 1, 0, "auto_unroll_max_step$0"]]]], "r": [[0.0100963], 0, 6.33731, 1639020727], "v": "v0.6"}
{"i": [["[\"pool_layer\", \"avg\", 128, 168, 83, 83, 1, 1, 2, \"VALID\"]", "rocm -keys=rocm,gpu -max_num_threads=256 -mcpu=gfx906 -mtriple=amdgcn-amd-amdhsa-hcc -thread_warp_size=64", [-1, 16, 64, 65536, 2147483647, 1024, 16, 64], "", 0, []], [[], [["FU", 2, [0, 1, 2, 3]], ["SP", 2, 0, 37933056, [1], 1], ["AN", 2, 0, 5], ["AN", 2, 1, 6], ["FU", 1, [0, 1, 2, 3]], ["SP", 1, 0, 37933056, [48], 1], ["AN", 1, 0, 5], ["AN", 1, 1, 6], ["PR", 1, 0, "auto_unroll_max_step$0"]]]], "r": [[0.0902888], 0, 6.70197, 1639020734], "v": "v0.6"}
{"i": [["[\"pool_layer\", \"avg\", 128, 168, 83, 83, 1, 1, 2, \"VALID\"]", "rocm -keys=rocm,gpu -max_num_threads=256 -mcpu=gfx906 -mtriple=amdgcn-amd-amdhsa-hcc -thread_warp_size=64", [-1, 16, 64, 65536, 2147483647, 1024, 16, 64], "", 0, []], [[], [["FU", 2, [0, 1, 2, 3]], ["SP", 2, 0, 37933056, [2], 1], ["AN", 2, 0, 5], ["AN", 2, 1, 6], ["FU", 1, [0, 1, 2, 3]], ["SP", 1, 0, 37933056, [48], 1], ["AN", 1, 0, 5], ["AN", 1, 1, 6], ["PR", 1, 0, "auto_unroll_max_step$0"]]]], "r": [[0.0460727], 0, 6.33639, 1639020740], "v": "v0.6"}
{"i": [["[\"pool_layer\", \"avg\", 128, 168, 83, 83, 1, 1, 2, \"VALID\"]", "rocm -keys=rocm,gpu -max_num_threads=256 -mcpu=gfx906 -mtriple=amdgcn-amd-amdhsa-hcc -thread_warp_size=64", [-1, 16, 64, 65536, 2147483647, 1024, 16, 64], "", 0, []], [[], [["FU", 2, [0, 1, 2, 3]], ["SP", 2, 0, 37933056, [14], 1], ["AN", 2, 0, 5], ["AN", 2, 1, 6], ["FU", 1, [0, 1, 2, 3]], ["SP", 1, 0, 37933056, [64], 1], ["AN", 1, 0, 5], ["AN", 1, 1, 6], ["PR", 1, 0, "auto_unroll_max_step$1024"]]]], "r": [[0.0079343], 0, 6.21698, 1639020746], "v": "v0.6"}
{"i": [["[\"pool_layer\", \"avg\", 128, 168, 83, 83, 1, 1, 2, \"VALID\"]", "rocm -keys=rocm,gpu -max_num_threads=256 -mcpu=gfx906 -mtriple=amdgcn-amd-amdhsa-hcc -thread_warp_size=64", [-1, 16, 64, 65536, 2147483647, 1024, 16, 64], "", 0, []], [[], [["FU", 2, [0, 1, 2, 3]], ["SP", 2, 0, 37933056, [1], 1], ["AN", 2, 0, 5], ["AN", 2, 1, 6], ["FU", 1, [0, 1, 2, 3]], ["SP", 1, 0, 37933056, [8], 1], ["AN", 1, 0, 5], ["AN", 1, 1, 6], ["PR", 1, 0, "auto_unroll_max_step$0"]]]], "r": [[0.10173], 0, 6.50148, 1639020752], "v": "v0.6"}
{"i": [["[\"pool_layer\", \"avg\", 128, 168, 83, 83, 1, 1, 2, \"VALID\"]", "rocm -keys=rocm,gpu -max_num_threads=256 -mcpu=gfx906 -mtriple=amdgcn-amd-amdhsa-hcc -thread_warp_size=64", [-1, 16, 64, 65536, 2147483647, 1024, 16, 64], "", 0, []], [[], [["FU", 2, [0, 1, 2, 3]], ["SP", 2, 0, 37933056, [4], 1], ["AN", 2, 0, 5], ["AN", 2, 1, 6], ["FU", 1, [0, 1, 2, 3]], ["SP", 1, 0, 37933056, [1], 1], ["AN", 1, 0, 5], ["AN", 1, 1, 6], ["PR", 1, 0, "auto_unroll_max_step$512"]]]], "r": [[0.113592], 0, 6.29693, 1639020758], "v": "v0.6"}
