artifacts/Table4/tvm/ansor/pooling/ansor_avg_pooling_128_84_83_83_3_3_2_SAME.log
{"i": [["[\"pool_layer\", \"avg\", 128, 84, 83, 83, 3, 3, 2, \"SAME\"]", "rocm -keys=rocm,gpu -max_num_threads=256 -mcpu=gfx906 -mtriple=amdgcn-amd-amdhsa-hcc -thread_warp_size=64", [-1, 16, 64, 65536, 2147483647, 1024, 16, 64], "", 0, []], [[], [["CI", 1], ["FU", 3, [0, 1, 2, 3]], ["SP", 3, 0, 18966528, [8], 1], ["AN", 3, 0, 5], ["AN", 3, 1, 6], ["FU", 2, [0, 1, 2, 3]], ["SP", 2, 0, 18966528, [64], 1], ["AN", 2, 0, 5], ["AN", 2, 1, 6], ["PR", 2, 0, "auto_unroll_max_step$16"]]]], "r": [[0.0063686], 0, 3.89304, 1639045189], "v": "v0.6"}
{"i": [["[\"pool_layer\", \"avg\", 128, 84, 83, 83, 3, 3, 2, \"SAME\"]", "rocm -keys=rocm,gpu -max_num_threads=256 -mcpu=gfx906 -mtriple=amdgcn-amd-amdhsa-hcc -thread_warp_size=64", [-1, 16, 64, 65536, 2147483647, 1024, 16, 64], "", 0, []], [[], [["CI", 1], ["FU", 3, [0, 1, 2, 3]], ["SP", 3, 0, 18966528, [4], 1], ["AN", 3, 0, 5], ["AN", 3, 1, 6], ["FU", 2, [0, 1, 2, 3]], ["SP", 2, 0, 18966528, [1], 1], ["AN", 2, 0, 5], ["AN", 2, 1, 6], ["PR", 2, 0, "auto_unroll_max_step$0"]]]], "r": [[0.0552841], 0, 3.77887, 1639045193], "v": "v0.6"}
{"i": [["[\"pool_layer\", \"avg\", 128, 84, 83, 83, 3, 3, 2, \"SAME\"]", "rocm -keys=rocm,gpu -max_num_threads=256 -mcpu=gfx906 -mtriple=amdgcn-amd-amdhsa-hcc -thread_warp_size=64", [-1, 16, 64, 65536, 2147483647, 1024, 16, 64], "", 0, []], [[], [["CI", 1], ["FU", 3, [0, 1, 2, 3]], ["SP", 3, 0, 18966528, [56], 1], ["AN", 3, 0, 5], ["AN", 3, 1, 6], ["FU", 2, [0, 1, 2, 3]], ["SP", 2, 0, 18966528, [2], 1], ["AN", 2, 0, 5], ["AN", 2, 1, 6], ["PR", 2, 0, "auto_unroll_max_step$64"]]]], "r": [[0.0229059], 0, 3.51522, 1639045196], "v": "v0.6"}
{"i": [["[\"pool_layer\", \"avg\", 128, 84, 83, 83, 3, 3, 2, \"SAME\"]", "rocm -keys=rocm,gpu -max_num_threads=256 -mcpu=gfx906 -mtriple=amdgcn-amd-amdhsa-hcc -thread_warp_size=64", [-1, 16, 64, 65536, 2147483647, 1024, 16, 64], "", 0, []], [[], [["CI", 1], ["FU", 3, [0, 1, 2, 3]], ["SP", 3, 0, 18966528, [2], 1], ["AN", 3, 0, 5], ["AN", 3, 1, 6], ["FU", 2, [0, 1, 2, 3]], ["SP", 2, 0, 18966528, [8], 1], ["AN", 2, 0, 5], ["AN", 2, 1, 6], ["PR", 2, 0, "auto_unroll_max_step$64"]]]], "r": [[0.027642], 0, 3.5131, 1639045199], "v": "v0.6"}
{"i": [["[\"pool_layer\", \"avg\", 128, 84, 83, 83, 3, 3, 2, \"SAME\"]", "rocm -keys=rocm,gpu -max_num_threads=256 -mcpu=gfx906 -mtriple=amdgcn-amd-amdhsa-hcc -thread_warp_size=64", [-1, 16, 64, 65536, 2147483647, 1024, 16, 64], "", 0, []], [[], [["CI", 1], ["FU", 3, [0, 1, 2, 3]], ["SP", 3, 0, 18966528, [64], 1], ["AN", 3, 0, 5], ["AN", 3, 1, 6], ["FU", 2, [0, 1, 2, 3]], ["SP", 2, 0, 18966528, [4], 1], ["AN", 2, 0, 5], ["AN", 2, 1, 6], ["PR", 2, 0, "auto_unroll_max_step$16"]]]], "r": [[0.0117523], 0, 3.45104, 1639045202], "v": "v0.6"}
{"i": [["[\"pool_layer\", \"avg\", 128, 84, 83, 83, 3, 3, 2, \"SAME\"]", "rocm -keys=rocm,gpu -max_num_threads=256 -mcpu=gfx906 -mtriple=amdgcn-amd-amdhsa-hcc -thread_warp_size=64", [-1, 16, 64, 65536, 2147483647, 1024, 16, 64], "", 0, []], [[], [["CI", 1], ["FU", 3, [0, 1, 2, 3]], ["SP", 3, 0, 18966528, [64], 1], ["AN", 3, 0, 5], ["AN", 3, 1, 6], ["FU", 2, [0, 1, 2, 3]], ["SP", 2, 0, 18966528, [49], 1], ["AN", 2, 0, 5], ["AN", 2, 1, 6], ["PR", 2, 0, "auto_unroll_max_step$512"]]]], "r": [[0.00161224], 0, 3.8338, 1639045206], "v": "v0.6"}
{"i": [["[\"pool_layer\", \"avg\", 128, 84, 83, 83, 3, 3, 2, \"SAME\"]", "rocm -keys=rocm,gpu -max_num_threads=256 -mcpu=gfx906 -mtriple=amdgcn-amd-amdhsa-hcc -thread_warp_size=64", [-1, 16, 64, 65536, 2147483647, 1024, 16, 64], "", 0, []], [[], [["CI", 1], ["FU", 3, [0, 1, 2, 3]], ["SP", 3, 0, 18966528, [27], 1], ["AN", 3, 0, 5], ["AN", 3, 1, 6], ["FU", 2, [0, 1, 2, 3]], ["SP", 2, 0, 18966528, [32], 1], ["AN", 2, 0, 5], ["AN", 2, 1, 6], ["PR", 2, 0, "auto_unroll_max_step$1024"]]]], "r": [[0.00302527], 0, 3.93193, 1639045209], "v": "v0.6"}
{"i": [["[\"pool_layer\", \"avg\", 128, 84, 83, 83, 3, 3, 2, \"SAME\"]", "rocm -keys=rocm,gpu -max_num_threads=256 -mcpu=gfx906 -mtriple=amdgcn-amd-amdhsa-hcc -thread_warp_size=64", [-1, 16, 64, 65536, 2147483647, 1024, 16, 64], "", 0, []], [[], [["CI", 1], ["FU", 3, [0, 1, 2, 3]], ["SP", 3, 0, 18966528, [56], 1], ["AN", 3, 0, 5], ["AN", 3, 1, 6], ["FU", 2, [0, 1, 2, 3]], ["SP", 2, 0, 18966528, [64], 1], ["AN", 2, 0, 5], ["AN", 2, 1, 6], ["PR", 2, 0, "auto_unroll_max_step$0"]]]], "r": [[0.0016318], 0, 3.79908, 1639045213], "v": "v0.6"}
{"i": [["[\"pool_layer\", \"avg\", 128, 84, 83, 83, 3, 3, 2, \"SAME\"]", "rocm -keys=rocm,gpu -max_num_threads=256 -mcpu=gfx906 -mtriple=amdgcn-amd-amdhsa-hcc -thread_warp_size=64", [-1, 16, 64, 65536, 2147483647, 1024, 16, 64], "", 0, []], [[], [["CI", 1], ["FU", 3, [0, 1, 2, 3]], ["SP", 3, 0, 18966528, [16], 1], ["AN", 3, 0, 5], ["AN", 3, 1, 6], ["FU", 2, [0, 1, 2, 3]], ["SP", 2, 0, 18966528, [32], 1], ["AN", 2, 0, 5], ["AN", 2, 1, 6], ["PR", 2, 0, "auto_unroll_max_step$64"]]]], "r": [[0.00415096], 0, 3.78582, 1639045216], "v": "v0.6"}
{"i": [["[\"pool_layer\", \"avg\", 128, 84, 83, 83, 3, 3, 2, \"SAME\"]", "rocm -keys=rocm,gpu -max_num_threads=256 -mcpu=gfx906 -mtriple=amdgcn-amd-amdhsa-hcc -thread_warp_size=64", [-1, 16, 64, 65536, 2147483647, 1024, 16, 64], "", 0, []], [[], [["CI", 1], ["FU", 3, [0, 1, 2, 3]], ["SP", 3, 0, 18966528, [4], 1], ["AN", 3, 0, 5], ["AN", 3, 1, 6], ["FU", 2, [0, 1, 2, 3]], ["SP", 2, 0, 18966528, [2], 1], ["AN", 2, 0, 5], ["AN", 2, 1, 6], ["PR", 2, 0, "auto_unroll_max_step$16"]]]], "r": [[0.0331719], 0, 3.7104, 1639045220], "v": "v0.6"}
{"i": [["[\"pool_layer\", \"avg\", 128, 84, 83, 83, 3, 3, 2, \"SAME\"]", "rocm -keys=rocm,gpu -max_num_threads=256 -mcpu=gfx906 -mtriple=amdgcn-amd-amdhsa-hcc -thread_warp_size=64", [-1, 16, 64, 65536, 2147483647, 1024, 16, 64], "", 0, []], [[], [["CI", 1], ["FU", 3, [0, 1, 2, 3]], ["SP", 3, 0, 18966528, [64], 1], ["AN", 3, 0, 5], ["AN", 3, 1, 6], ["FU", 2, [0, 1, 2, 3]], ["SP", 2, 0, 18966528, [24], 1], ["AN", 2, 0, 5], ["AN", 2, 1, 6], ["PR", 2, 0, "auto_unroll_max_step$512"]]]], "r": [[0.00253816], 0, 3.75427, 1639045223], "v": "v0.6"}
{"i": [["[\"pool_layer\", \"avg\", 128, 84, 83, 83, 3, 3, 2, \"SAME\"]", "rocm -keys=rocm,gpu -max_num_threads=256 -mcpu=gfx906 -mtriple=amdgcn-amd-amdhsa-hcc -thread_warp_size=64", [-1, 16, 64, 65536, 2147483647, 1024, 16, 64], "", 0, []], [[], [["CI", 1], ["FU", 3, [0, 1, 2, 3]], ["SP", 3, 0, 18966528, [4], 1], ["AN", 3, 0, 5], ["AN", 3, 1, 6], ["FU", 2, [0, 1, 2, 3]], ["SP", 2, 0, 18966528, [32], 1], ["AN", 2, 0, 5], ["AN", 2, 1, 6], ["PR", 2, 0, "auto_unroll_max_step$16"]]]], "r": [[0.0124415], 0, 3.80645, 1639045227], "v": "v0.6"}
{"i": [["[\"pool_layer\", \"avg\", 128, 84, 83, 83, 3, 3, 2, \"SAME\"]", "rocm -keys=rocm,gpu -max_num_threads=256 -mcpu=gfx906 -mtriple=amdgcn-amd-amdhsa-hcc -thread_warp_size=64", [-1, 16, 64, 65536, 2147483647, 1024, 16, 64], "", 0, []], [[], [["CI", 1], ["FU", 3, [0, 1, 2, 3]], ["SP", 3, 0, 18966528, [64], 1], ["AN", 3, 0, 5], ["AN", 3, 1, 6], ["FU", 2, [0, 1, 2, 3]], ["SP", 2, 0, 18966528, [1], 1], ["AN", 2, 0, 5], ["AN", 2, 1, 6], ["PR", 2, 0, "auto_unroll_max_step$16"]]]], "r": [[0.0449203], 0, 3.59383, 1639045230], "v": "v0.6"}
{"i": [["[\"pool_layer\", \"avg\", 128, 84, 83, 83, 3, 3, 2, \"SAME\"]", "rocm -keys=rocm,gpu -max_num_threads=256 -mcpu=gfx906 -mtriple=amdgcn-amd-amdhsa-hcc -thread_warp_size=64", [-1, 16, 64, 65536, 2147483647, 1024, 16, 64], "", 0, []], [[], [["CI", 1], ["FU", 3, [0, 1, 2, 3]], ["SP", 3, 0, 18966528, [1], 1], ["AN", 3, 0, 5], ["AN", 3, 1, 6], ["FU", 2, [0, 1, 2, 3]], ["SP", 2, 0, 18966528, [4], 1], ["AN", 2, 0, 5], ["AN", 2, 1, 6], ["PR", 2, 0, "auto_unroll_max_step$0"]]]], "r": [[0.0552752], 0, 3.74028, 1639045233], "v": "v0.6"}
{"i": [["[\"pool_layer\", \"avg\", 128, 84, 83, 83, 3, 3, 2, \"SAME\"]", "rocm -keys=rocm,gpu -max_num_threads=256 -mcpu=gfx906 -mtriple=amdgcn-amd-amdhsa-hcc -thread_warp_size=64", [-1, 16, 64, 65536, 2147483647, 1024, 16, 64], "", 0, []], [[], [["CI", 1], ["FU", 3, [0, 1, 2, 3]], ["SP", 3, 0, 18966528, [16], 1], ["AN", 3, 0, 5], ["AN", 3, 1, 6], ["FU", 2, [0, 1, 2, 3]], ["SP", 2, 0, 18966528, [8], 1], ["AN", 2, 0, 5], ["AN", 2, 1, 6], ["PR", 2, 0, "auto_unroll_max_step$64"]]]], "r": [[0.00829546], 0, 3.89599, 1639045237], "v": "v0.6"}
{"i": [["[\"pool_layer\", \"avg\", 128, 84, 83, 83, 3, 3, 2, \"SAME\"]", "rocm -keys=rocm,gpu -max_num_threads=256 -mcpu=gfx906 -mtriple=amdgcn-amd-amdhsa-hcc -thread_warp_size=64", [-1, 16, 64, 65536, 2147483647, 1024, 16, 64], "", 0, []], [[], [["CI", 1], ["FU", 3, [0, 1, 2, 3]], ["SP", 3, 0, 18966528, [64], 1], ["AN", 3, 0, 5], ["AN", 3, 1, 6], ["FU", 2, [0, 1, 2, 3]], ["SP", 2, 0, 18966528, [4], 1], ["AN", 2, 0, 5], ["AN", 2, 1, 6], ["PR", 2, 0, "auto_unroll_max_step$0"]]]], "r": [[0.0117517], 0, 3.3945, 1639045240], "v": "v0.6"}
{"i": [["[\"pool_layer\", \"avg\", 128, 84, 83, 83, 3, 3, 2, \"SAME\"]", "rocm -keys=rocm,gpu -max_num_threads=256 -mcpu=gfx906 -mtriple=amdgcn-amd-amdhsa-hcc -thread_warp_size=64", [-1, 16, 64, 65536, 2147483647, 1024, 16, 64], "", 0, []], [[], [["CI", 1], ["FU", 3, [0, 1, 2, 3]], ["SP", 3, 0, 18966528, [32], 1], ["AN", 3, 0, 5], ["AN", 3, 1, 6], ["FU", 2, [0, 1, 2, 3]], ["SP", 2, 0, 18966528, [4], 1], ["AN", 2, 0, 5], ["AN", 2, 1, 6], ["PR", 2, 0, "auto_unroll_max_step$0"]]]], "r": [[0.0124414], 0, 3.40037, 1639045243], "v": "v0.6"}
{"i": [["[\"pool_layer\", \"avg\", 128, 84, 83, 83, 3, 3, 2, \"SAME\"]", "rocm -keys=rocm,gpu -max_num_threads=256 -mcpu=gfx906 -mtriple=amdgcn-amd-amdhsa-hcc -thread_warp_size=64", [-1, 16, 64, 65536, 2147483647, 1024, 16, 64], "", 0, []], [[], [["CI", 1], ["FU", 3, [0, 1, 2, 3]], ["SP", 3, 0, 18966528, [8], 1], ["AN", 3, 0, 5], ["AN", 3, 1, 6], ["FU", 2, [0, 1, 2, 3]], ["SP", 2, 0, 18966528, [64], 1], ["AN", 2, 0, 5], ["AN", 2, 1, 6], ["PR", 2, 0, "auto_unroll_max_step$0"]]]], "r": [[0.00636821], 0, 3.89272, 1639045246], "v": "v0.6"}
{"i": [["[\"pool_layer\", \"avg\", 128, 84, 83, 83, 3, 3, 2, \"SAME\"]", "rocm -keys=rocm,gpu -max_num_threads=256 -mcpu=gfx906 -mtriple=amdgcn-amd-amdhsa-hcc -thread_warp_size=64", [-1, 16, 64, 65536, 2147483647, 1024, 16, 64], "", 0, []], [[], [["CI", 1], ["FU", 3, [0, 1, 2, 3]], ["SP", 3, 0, 18966528, [32], 1], ["AN", 3, 0, 5], ["AN", 3, 1, 6], ["FU", 2, [0, 1, 2, 3]], ["SP", 2, 0, 18966528, [16], 1], ["AN", 2, 0, 5], ["AN", 2, 1, 6], ["PR", 2, 0, "auto_unroll_max_step$64"]]]], "r": [[0.00414948], 0, 3.97072, 1639045250], "v": "v0.6"}
{"i": [["[\"pool_layer\", \"avg\", 128, 84, 83, 83, 3, 3, 2, \"SAME\"]", "rocm -keys=rocm,gpu -max_num_threads=256 -mcpu=gfx906 -mtriple=amdgcn-amd-amdhsa-hcc -thread_warp_size=64", [-1, 16, 64, 65536, 2147483647, 1024, 16, 64], "", 0, []], [[], [["CI", 1], ["FU", 3, [0, 1, 2, 3]], ["SP", 3, 0, 18966528, [28], 1], ["AN", 3, 0, 5], ["AN", 3, 1, 6], ["FU", 2, [0, 1, 2, 3]], ["SP", 2, 0, 18966528, [64], 1], ["AN", 2, 0, 5], ["AN", 2, 1, 6], ["PR", 2, 0, "auto_unroll_max_step$1024"]]]], "r": [[0.00242166], 0, 3.94399, 1639045254], "v": "v0.6"}
{"i": [["[\"pool_layer\", \"avg\", 128, 84, 83, 83, 3, 3, 2, \"SAME\"]", "rocm -keys=rocm,gpu -max_num_threads=256 -mcpu=gfx906 -mtriple=amdgcn-amd-amdhsa-hcc -thread_warp_size=64", [-1, 16, 64, 65536, 2147483647, 1024, 16, 64], "", 0, []], [[], [["CI", 1], ["FU", 3, [0, 1, 2, 3]], ["SP", 3, 0, 18966528, [1], 1], ["AN", 3, 0, 5], ["AN", 3, 1, 6], ["FU", 2, [0, 1, 2, 3]], ["SP", 2, 0, 18966528, [4], 1], ["AN", 2, 0, 5], ["AN", 2, 1, 6], ["PR", 2, 0, "auto_unroll_max_step$512"]]]], "r": [[0.0552856], 0, 3.59962, 1639045257], "v": "v0.6"}
{"i": [["[\"pool_layer\", \"avg\", 128, 84, 83, 83, 3, 3, 2, \"SAME\"]", "rocm -keys=rocm,gpu -max_num_threads=256 -mcpu=gfx906 -mtriple=amdgcn-amd-amdhsa-hcc -thread_warp_size=64", [-1, 16, 64, 65536, 2147483647, 1024, 16, 64], "", 0, []], [[], [["CI", 1], ["FU", 3, [0, 1, 2, 3]], ["SP", 3, 0, 18966528, [36], 1], ["AN", 3, 0, 5], ["AN", 3, 1, 6], ["FU", 2, [0, 1, 2, 3]], ["SP", 2, 0, 18966528, [1], 1], ["AN", 2, 0, 5], ["AN", 2, 1, 6], ["PR", 2, 0, "auto_unroll_max_step$0"]]]], "r": [[0.0454571], 0, 3.56834, 1639045260], "v": "v0.6"}
{"i": [["[\"pool_layer\", \"avg\", 128, 84, 83, 83, 3, 3, 2, \"SAME\"]", "rocm -keys=rocm,gpu -max_num_threads=256 -mcpu=gfx906 -mtriple=amdgcn-amd-amdhsa-hcc -thread_warp_size=64", [-1, 16, 64, 65536, 2147483647, 1024, 16, 64], "", 0, []], [[], [["CI", 1], ["FU", 3, [0, 1, 2, 3]], ["SP", 3, 0, 18966528, [4], 1], ["AN", 3, 0, 5], ["AN", 3, 1, 6], ["FU", 2, [0, 1, 2, 3]], ["SP", 2, 0, 18966528, [4], 1], ["AN", 2, 0, 5], ["AN", 2, 1, 6], ["PR", 2, 0, "auto_unroll_max_step$512"]]]], "r": [[0.0221176], 0, 3.53522, 1639045263], "v": "v0.6"}
{"i": [["[\"pool_layer\", \"avg\", 128, 84, 83, 83, 3, 3, 2, \"SAME\"]", "rocm -keys=rocm,gpu -max_num_threads=256 -mcpu=gfx906 -mtriple=amdgcn-amd-amdhsa-hcc -thread_warp_size=64", [-1, 16, 64, 65536, 2147483647, 1024, 16, 64], "", 0, []], [[], [["CI", 1], ["FU", 3, [0, 1, 2, 3]], ["SP", 3, 0, 18966528, [4], 1], ["AN", 3, 0, 5], ["AN", 3, 1, 6], ["FU", 2, [0, 1, 2, 3]], ["SP", 2, 0, 18966528, [8], 1], ["AN", 2, 0, 5], ["AN", 2, 1, 6], ["PR", 2, 0, "auto_unroll_max_step$64"]]]], "r": [[0.016589], 0, 3.43999, 1639045266], "v": "v0.6"}
{"i": [["[\"pool_layer\", \"avg\", 128, 84, 83, 83, 3, 3, 2, \"SAME\"]", "rocm -keys=rocm,gpu -max_num_threads=256 -mcpu=gfx906 -mtriple=amdgcn-amd-amdhsa-hcc -thread_warp_size=64", [-1, 16, 64, 65536, 2147483647, 1024, 16, 64], "", 0, []], [[], [["CI", 1], ["FU", 3, [0, 1, 2, 3]], ["SP", 3, 0, 18966528, [1], 1], ["AN", 3, 0, 5], ["AN", 3, 1, 6], ["FU", 2, [0, 1, 2, 3]], ["SP", 2, 0, 18966528, [48], 1], ["AN", 2, 0, 5], ["AN", 2, 1, 6], ["PR", 2, 0, "auto_unroll_max_step$1024"]]]], "r": [[0.0451558], 0, 3.58726, 1639045270], "v": "v0.6"}
{"i": [["[\"pool_layer\", \"avg\", 128, 84, 83, 83, 3, 3, 2, \"SAME\"]", "rocm -keys=rocm,gpu -max_num_threads=256 -mcpu=gfx906 -mtriple=amdgcn-amd-amdhsa-hcc -thread_warp_size=64", [-1, 16, 64, 65536, 2147483647, 1024, 16, 64], "", 0, []], [[], [["CI", 1], ["FU", 3, [0, 1, 2, 3]], ["SP", 3, 0, 18966528, [4], 1], ["AN", 3, 0, 5], ["AN", 3, 1, 6], ["FU", 2, [0, 1, 2, 3]], ["SP", 2, 0, 18966528, [36], 1], ["AN", 2, 0, 5], ["AN", 2, 1, 6], ["PR", 2, 0, "auto_unroll_max_step$1024"]]]], "r": [[0.0122928], 0, 3.46557, 1639045273], "v": "v0.6"}
{"i": [["[\"pool_layer\", \"avg\", 128, 84, 83, 83, 3, 3, 2, \"SAME\"]", "rocm -keys=rocm,gpu -max_num_threads=256 -mcpu=gfx906 -mtriple=amdgcn-amd-amdhsa-hcc -thread_warp_size=64", [-1, 16, 64, 65536, 2147483647, 1024, 16, 64], "", 0, []], [[], [["CI", 1], ["FU", 3, [0, 1, 2, 3]], ["SP", 3, 0, 18966528, [24], 1], ["AN", 3, 0, 5], ["AN", 3, 1, 6], ["FU", 2, [0, 1, 2, 3]], ["SP", 2, 0, 18966528, [2], 1], ["AN", 2, 0, 5], ["AN", 2, 1, 6], ["PR", 2, 0, "auto_unroll_max_step$64"]]]], "r": [[0.0239599], 0, 3.47714, 1639045276], "v": "v0.6"}
{"i": [["[\"pool_layer\", \"avg\", 128, 84, 83, 83, 3, 3, 2, \"SAME\"]", "rocm -keys=rocm,gpu -max_num_threads=256 -mcpu=gfx906 -mtriple=amdgcn-amd-amdhsa-hcc -thread_warp_size=64", [-1, 16, 64, 65536, 2147483647, 1024, 16, 64], "", 0, []], [[], [["CI", 1], ["FU", 3, [0, 1, 2, 3]], ["SP", 3, 0, 18966528, [54], 1], ["AN", 3, 0, 5], ["AN", 3, 1, 6], ["FU", 2, [0, 1, 2, 3]], ["SP", 2, 0, 18966528, [64], 1], ["AN", 2, 0, 5], ["AN", 2, 1, 6], ["PR", 2, 0, "auto_unroll_max_step$1024"]]]], "r": [[0.00166101], 0, 3.58458, 1639045279], "v": "v0.6"}
{"i": [["[\"pool_layer\", \"avg\", 128, 84, 83, 83, 3, 3, 2, \"SAME\"]", "rocm -keys=rocm,gpu -max_num_threads=256 -mcpu=gfx906 -mtriple=amdgcn-amd-amdhsa-hcc -thread_warp_size=64", [-1, 16, 64, 65536, 2147483647, 1024, 16, 64], "", 0, []], [[], [["CI", 1], ["FU", 3, [0, 1, 2, 3]], ["SP", 3, 0, 18966528, [8], 1], ["AN", 3, 0, 5], ["AN", 3, 1, 6], ["FU", 2, [0, 1, 2, 3]], ["SP", 2, 0, 18966528, [48], 1], ["AN", 2, 0, 5], ["AN", 2, 1, 6], ["PR", 2, 0, "auto_unroll_max_step$1024"]]]], "r": [[0.00646356], 0, 3.82626, 1639045283], "v": "v0.6"}
{"i": [["[\"pool_layer\", \"avg\", 128, 84, 83, 83, 3, 3, 2, \"SAME\"]", "rocm -keys=rocm,gpu -max_num_threads=256 -mcpu=gfx906 -mtriple=amdgcn-amd-amdhsa-hcc -thread_warp_size=64", [-1, 16, 64, 65536, 2147483647, 1024, 16, 64], "", 0, []], [[], [["CI", 1], ["FU", 3, [0, 1, 2, 3]], ["SP", 3, 0, 18966528, [42], 1], ["AN", 3, 0, 5], ["AN", 3, 1, 6], ["FU", 2, [0, 1, 2, 3]], ["SP", 2, 0, 18966528, [16], 1], ["AN", 2, 0, 5], ["AN", 2, 1, 6], ["PR", 2, 0, "auto_unroll_max_step$64"]]]], "r": [[0.00382082], 0, 3.90835, 1639045286], "v": "v0.6"}
{"i": [["[\"pool_layer\", \"avg\", 128, 84, 83, 83, 3, 3, 2, \"SAME\"]", "rocm -keys=rocm,gpu -max_num_threads=256 -mcpu=gfx906 -mtriple=amdgcn-amd-amdhsa-hcc -thread_warp_size=64", [-1, 16, 64, 65536, 2147483647, 1024, 16, 64], "", 0, []], [[], [["CI", 1], ["FU", 3, [0, 1, 2, 3]], ["SP", 3, 0, 18966528, [2], 1], ["AN", 3, 0, 5], ["AN", 3, 1, 6], ["FU", 2, [0, 1, 2, 3]], ["SP", 2, 0, 18966528, [64], 1], ["AN", 2, 0, 5], ["AN", 2, 1, 6], ["PR", 2, 0, "auto_unroll_max_step$16"]]]], "r": [[0.0229501], 0, 3.31131, 1639045289], "v": "v0.6"}
{"i": [["[\"pool_layer\", \"avg\", 128, 84, 83, 83, 3, 3, 2, \"SAME\"]", "rocm -keys=rocm,gpu -max_num_threads=256 -mcpu=gfx906 -mtriple=amdgcn-amd-amdhsa-hcc -thread_warp_size=64", [-1, 16, 64, 65536, 2147483647, 1024, 16, 64], "", 0, []], [[], [["CI", 1], ["FU", 3, [0, 1, 2, 3]], ["SP", 3, 0, 18966528, [8], 1], ["AN", 3, 0, 5], ["AN", 3, 1, 6], ["FU", 2, [0, 1, 2, 3]], ["SP", 2, 0, 18966528, [16], 1], ["AN", 2, 0, 5], ["AN", 2, 1, 6], ["PR", 2, 0, "auto_unroll_max_step$64"]]]], "r": [[0.00829382], 0, 3.868, 1639045293], "v": "v0.6"}
{"i": [["[\"pool_layer\", \"avg\", 128, 84, 83, 83, 3, 3, 2, \"SAME\"]", "rocm -keys=rocm,gpu -max_num_threads=256 -mcpu=gfx906 -mtriple=amdgcn-amd-amdhsa-hcc -thread_warp_size=64", [-1, 16, 64, 65536, 2147483647, 1024, 16, 64], "", 0, []], [[], [["CI", 1], ["FU", 3, [0, 1, 2, 3]], ["SP", 3, 0, 18966528, [4], 1], ["AN", 3, 0, 5], ["AN", 3, 1, 6], ["FU", 2, [0, 1, 2, 3]], ["SP", 2, 0, 18966528, [4], 1], ["AN", 2, 0, 5], ["AN", 2, 1, 6], ["PR", 2, 0, "auto_unroll_max_step$64"]]]], "r": [[0.0221172], 0, 3.52306, 1639045296], "v": "v0.6"}
{"i": [["[\"pool_layer\", \"avg\", 128, 84, 83, 83, 3, 3, 2, \"SAME\"]", "rocm -keys=rocm,gpu -max_num_threads=256 -mcpu=gfx906 -mtriple=amdgcn-amd-amdhsa-hcc -thread_warp_size=64", [-1, 16, 64, 65536, 2147483647, 1024, 16, 64], "", 0, []], [[], [["CI", 1], ["FU", 3, [0, 1, 2, 3]], ["SP", 3, 0, 18966528, [32], 1], ["AN", 3, 0, 5], ["AN", 3, 1, 6], ["FU", 2, [0, 1, 2, 3]], ["SP", 2, 0, 18966528, [2], 1], ["AN", 2, 0, 5], ["AN", 2, 1, 6], ["PR", 2, 0, "auto_unroll_max_step$64"]]]], "r": [[0.0234988], 0, 3.427, 1639045299], "v": "v0.6"}
{"i": [["[\"pool_layer\", \"avg\", 128, 84, 83, 83, 3, 3, 2, \"SAME\"]", "rocm -keys=rocm,gpu -max_num_threads=256 -mcpu=gfx906 -mtriple=amdgcn-amd-amdhsa-hcc -thread_warp_size=64", [-1, 16, 64, 65536, 2147483647, 1024, 16, 64], "", 0, []], [[], [["CI", 1], ["FU", 3, [0, 1, 2, 3]], ["SP", 3, 0, 18966528, [56], 1], ["AN", 3, 0, 5], ["AN", 3, 1, 6], ["FU", 2, [0, 1, 2, 3]], ["SP", 2, 0, 18966528, [64], 1], ["AN", 2, 0, 5], ["AN", 2, 1, 6], ["PR", 2, 0, "auto_unroll_max_step$16"]]]], "r": [[0.00163187], 0, 3.5381, 1639045302], "v": "v0.6"}
{"i": [["[\"pool_layer\", \"avg\", 128, 84, 83, 83, 3, 3, 2, \"SAME\"]", "rocm -keys=rocm,gpu -max_num_threads=256 -mcpu=gfx906 -mtriple=amdgcn-amd-amdhsa-hcc -thread_warp_size=64", [-1, 16, 64, 65536, 2147483647, 1024, 16, 64], "", 0, []], [[], [["CI", 1], ["FU", 3, [0, 1, 2, 3]], ["SP", 3, 0, 18966528, [27], 1], ["AN", 3, 0, 5], ["AN", 3, 1, 6], ["FU", 2, [0, 1, 2, 3]], ["SP", 2, 0, 18966528, [4], 1], ["AN", 2, 0, 5], ["AN", 2, 1, 6], ["PR", 2, 0, "auto_unroll_max_step$0"]]]], "r": [[0.012699], 0, 3.44102, 1639045306], "v": "v0.6"}
{"i": [["[\"pool_layer\", \"avg\", 128, 84, 83, 83, 3, 3, 2, \"SAME\"]", "rocm -keys=rocm,gpu -max_num_threads=256 -mcpu=gfx906 -mtriple=amdgcn-amd-amdhsa-hcc -thread_warp_size=64", [-1, 16, 64, 65536, 2147483647, 1024, 16, 64], "", 0, []], [[], [["CI", 1], ["FU", 3, [0, 1, 2, 3]], ["SP", 3, 0, 18966528, [1], 1], ["AN", 3, 0, 5], ["AN", 3, 1, 6], ["FU", 2, [0, 1, 2, 3]], ["SP", 2, 0, 18966528, [32], 1], ["AN", 2, 0, 5], ["AN", 2, 1, 6], ["PR", 2, 0, "auto_unroll_max_step$64"]]]], "r": [[0.0456053], 0, 3.60195, 1639045309], "v": "v0.6"}
{"i": [["[\"pool_layer\", \"avg\", 128, 84, 83, 83, 3, 3, 2, \"SAME\"]", "rocm -keys=rocm,gpu -max_num_threads=256 -mcpu=gfx906 -mtriple=amdgcn-amd-amdhsa-hcc -thread_warp_size=64", [-1, 16, 64, 65536, 2147483647, 1024, 16, 64], "", 0, []], [[], [["CI", 1], ["FU", 3, [0, 1, 2, 3]], ["SP", 3, 0, 18966528, [16], 1], ["AN", 3, 0, 5], ["AN", 3, 1, 6], ["FU", 2, [0, 1, 2, 3]], ["SP", 2, 0, 18966528, [6], 1], ["AN", 2, 0, 5], ["AN", 2, 1, 6], ["PR", 2, 0, "auto_unroll_max_step$1024"]]]], "r": [[0.0101404], 0, 3.37095, 1639045312], "v": "v0.6"}
{"i": [["[\"pool_layer\", \"avg\", 128, 84, 83, 83, 3, 3, 2, \"SAME\"]", "rocm -keys=rocm,gpu -max_num_threads=256 -mcpu=gfx906 -mtriple=amdgcn-amd-amdhsa-hcc -thread_warp_size=64", [-1, 16, 64, 65536, 2147483647, 1024, 16, 64], "", 0, []], [[], [["CI", 1], ["FU", 3, [0, 1, 2, 3]], ["SP", 3, 0, 18966528, [1], 1], ["AN", 3, 0, 5], ["AN", 3, 1, 6], ["FU", 2, [0, 1, 2, 3]], ["SP", 2, 0, 18966528, [1], 1], ["AN", 2, 0, 5], ["AN", 2, 1, 6], ["PR", 2, 0, "auto_unroll_max_step$64"]]]], "r": [[0.0884473], 0, 3.76387, 1639045315], "v": "v0.6"}
{"i": [["[\"pool_layer\", \"avg\", 128, 84, 83, 83, 3, 3, 2, \"SAME\"]", "rocm -keys=rocm,gpu -max_num_threads=256 -mcpu=gfx906 -mtriple=amdgcn-amd-amdhsa-hcc -thread_warp_size=64", [-1, 16, 64, 65536, 2147483647, 1024, 16, 64], "", 0, []], [[], [["CI", 1], ["FU", 3, [0, 1, 2, 3]], ["SP", 3, 0, 18966528, [8], 1], ["AN", 3, 0, 5], ["AN", 3, 1, 6], ["FU", 2, [0, 1, 2, 3]], ["SP", 2, 0, 18966528, [8], 1], ["AN", 2, 0, 5], ["AN", 2, 1, 6], ["PR", 2, 0, "auto_unroll_max_step$0"]]]], "r": [[0.011057], 0, 3.85159, 1639045319], "v": "v0.6"}
{"i": [["[\"pool_layer\", \"avg\", 128, 84, 83, 83, 3, 3, 2, \"SAME\"]", "rocm -keys=rocm,gpu -max_num_threads=256 -mcpu=gfx906 -mtriple=amdgcn-amd-amdhsa-hcc -thread_warp_size=64", [-1, 16, 64, 65536, 2147483647, 1024, 16, 64], "", 0, []], [[], [["CI", 1], ["FU", 3, [0, 1, 2, 3]], ["SP", 3, 0, 18966528, [64], 1], ["AN", 3, 0, 5], ["AN", 3, 1, 6], ["FU", 2, [0, 1, 2, 3]], ["SP", 2, 0, 18966528, [7], 1], ["AN", 2, 0, 5], ["AN", 2, 1, 6], ["PR", 2, 0, "auto_unroll_max_step$64"]]]], "r": [[0.00701371], 0, 3.36201, 1639045322], "v": "v0.6"}
{"i": [["[\"pool_layer\", \"avg\", 128, 84, 83, 83, 3, 3, 2, \"SAME\"]", "rocm -keys=rocm,gpu -max_num_threads=256 -mcpu=gfx906 -mtriple=amdgcn-amd-amdhsa-hcc -thread_warp_size=64", [-1, 16, 64, 65536, 2147483647, 1024, 16, 64], "", 0, []], [[], [["CI", 1], ["FU", 3, [0, 1, 2, 3]], ["SP", 3, 0, 18966528, [8], 1], ["AN", 3, 0, 5], ["AN", 3, 1, 6], ["FU", 2, [0, 1, 2, 3]], ["SP", 2, 0, 18966528, [4], 1], ["AN", 2, 0, 5], ["AN", 2, 1, 6], ["PR", 2, 0, "auto_unroll_max_step$16"]]]], "r": [[0.0165892], 0, 3.46635, 1639045325], "v": "v0.6"}
{"i": [["[\"pool_layer\", \"avg\", 128, 84, 83, 83, 3, 3, 2, \"SAME\"]", "rocm -keys=rocm,gpu -max_num_threads=256 -mcpu=gfx906 -mtriple=amdgcn-amd-amdhsa-hcc -thread_warp_size=64", [-1, 16, 64, 65536, 2147483647, 1024, 16, 64], "", 0, []], [[], [["CI", 1], ["FU", 3, [0, 1, 2, 3]], ["SP", 3, 0, 18966528, [16], 1], ["AN", 3, 0, 5], ["AN", 3, 1, 6], ["FU", 2, [0, 1, 2, 3]], ["SP", 2, 0, 18966528, [4], 1], ["AN", 2, 0, 5], ["AN", 2, 1, 6], ["PR", 2, 0, "auto_unroll_max_step$0"]]]], "r": [[0.0138254], 0, 3.44175, 1639045328], "v": "v0.6"}
{"i": [["[\"pool_layer\", \"avg\", 128, 84, 83, 83, 3, 3, 2, \"SAME\"]", "rocm -keys=rocm,gpu -max_num_threads=256 -mcpu=gfx906 -mtriple=amdgcn-amd-amdhsa-hcc -thread_warp_size=64", [-1, 16, 64, 65536, 2147483647, 1024, 16, 64], "", 0, []], [[], [["CI", 1], ["FU", 3, [0, 1, 2, 3]], ["SP", 3, 0, 18966528, [24], 1], ["AN", 3, 0, 5], ["AN", 3, 1, 6], ["FU", 2, [0, 1, 2, 3]], ["SP", 2, 0, 18966528, [2], 1], ["AN", 2, 0, 5], ["AN", 2, 1, 6], ["PR", 2, 0, "auto_unroll_max_step$512"]]]], "r": [[0.0239597], 0, 3.49281, 1639045332], "v": "v0.6"}
{"i": [["[\"pool_layer\", \"avg\", 128, 84, 83, 83, 3, 3, 2, \"SAME\"]", "rocm -keys=rocm,gpu -max_num_threads=256 -mcpu=gfx906 -mtriple=amdgcn-amd-amdhsa-hcc -thread_warp_size=64", [-1, 16, 64, 65536, 2147483647, 1024, 16, 64], "", 0, []], [[], [["CI", 1], ["FU", 3, [0, 1, 2, 3]], ["SP", 3, 0, 18966528, [64], 1], ["AN", 3, 0, 5], ["AN", 3, 1, 6], ["FU", 2, [0, 1, 2, 3]], ["SP", 2, 0, 18966528, [2], 1], ["AN", 2, 0, 5], ["AN", 2, 1, 6], ["PR", 2, 0, "auto_unroll_max_step$16"]]]], "r": [[0.0228081], 0, 3.44815, 1639045335], "v": "v0.6"}
{"i": [["[\"pool_layer\", \"avg\", 128, 84, 83, 83, 3, 3, 2, \"SAME\"]", "rocm -keys=rocm,gpu -max_num_threads=256 -mcpu=gfx906 -mtriple=amdgcn-amd-amdhsa-hcc -thread_warp_size=64", [-1, 16, 64, 65536, 2147483647, 1024, 16, 64], "", 0, []], [[], [["CI", 1], ["FU", 3, [0, 1, 2, 3]], ["SP", 3, 0, 18966528, [4], 1], ["AN", 3, 0, 5], ["AN", 3, 1, 6], ["FU", 2, [0, 1, 2, 3]], ["SP", 2, 0, 18966528, [64], 1], ["AN", 2, 0, 5], ["AN", 2, 1, 6], ["PR", 2, 0, "auto_unroll_max_step$16"]]]], "r": [[0.0118994], 0, 3.35793, 1639045338], "v": "v0.6"}
{"i": [["[\"pool_layer\", \"avg\", 128, 84, 83, 83, 3, 3, 2, \"SAME\"]", "rocm -keys=rocm,gpu -max_num_threads=256 -mcpu=gfx906 -mtriple=amdgcn-amd-amdhsa-hcc -thread_warp_size=64", [-1, 16, 64, 65536, 2147483647, 1024, 16, 64], "", 0, []], [[], [["CI", 1], ["FU", 3, [0, 1, 2, 3]], ["SP", 3, 0, 18966528, [4], 1], ["AN", 3, 0, 5], ["AN", 3, 1, 6], ["FU", 2, [0, 1, 2, 3]], ["SP", 2, 0, 18966528, [64], 1], ["AN", 2, 0, 5], ["AN", 2, 1, 6], ["PR", 2, 0, "auto_unroll_max_step$64"]]]], "r": [[0.0118967], 0, 3.39466, 1639045341], "v": "v0.6"}
{"i": [["[\"pool_layer\", \"avg\", 128, 84, 83, 83, 3, 3, 2, \"SAME\"]", "rocm -keys=rocm,gpu -max_num_threads=256 -mcpu=gfx906 -mtriple=amdgcn-amd-amdhsa-hcc -thread_warp_size=64", [-1, 16, 64, 65536, 2147483647, 1024, 16, 64], "", 0, []], [[], [["CI", 1], ["FU", 3, [0, 1, 2, 3]], ["SP", 3, 0, 18966528, [1], 1], ["AN", 3, 0, 5], ["AN", 3, 1, 6], ["FU", 2, [0, 1, 2, 3]], ["SP", 2, 0, 18966528, [64], 1], ["AN", 2, 0, 5], ["AN", 2, 1, 6], ["PR", 2, 0, "auto_unroll_max_step$64"]]]], "r": [[0.0450686], 0, 3.66513, 1639045344], "v": "v0.6"}
{"i": [["[\"pool_layer\", \"avg\", 128, 84, 83, 83, 3, 3, 2, \"SAME\"]", "rocm -keys=rocm,gpu -max_num_threads=256 -mcpu=gfx906 -mtriple=amdgcn-amd-amdhsa-hcc -thread_warp_size=64", [-1, 16, 64, 65536, 2147483647, 1024, 16, 64], "", 0, []], [[], [["CI", 1], ["FU", 3, [0, 1, 2, 3]], ["SP", 3, 0, 18966528, [64], 1], ["AN", 3, 0, 5], ["AN", 3, 1, 6], ["FU", 2, [0, 1, 2, 3]], ["SP", 2, 0, 18966528, [28], 1], ["AN", 2, 0, 5], ["AN", 2, 1, 6], ["PR", 2, 0, "auto_unroll_max_step$512"]]]], "r": [[0.0022754], 0, 3.75572, 1639045348], "v": "v0.6"}
{"i": [["[\"pool_layer\", \"avg\", 128, 84, 83, 83, 3, 3, 2, \"SAME\"]", "rocm -keys=rocm,gpu -max_num_threads=256 -mcpu=gfx906 -mtriple=amdgcn-amd-amdhsa-hcc -thread_warp_size=64", [-1, 16, 64, 65536, 2147483647, 1024, 16, 64], "", 0, []], [[], [["CI", 1], ["FU", 3, [0, 1, 2, 3]], ["SP", 3, 0, 18966528, [64], 1], ["AN", 3, 0, 5], ["AN", 3, 1, 6], ["FU", 2, [0, 1, 2, 3]], ["SP", 2, 0, 18966528, [64], 1], ["AN", 2, 0, 5], ["AN", 2, 1, 6], ["PR", 2, 0, "auto_unroll_max_step$64"]]]], "r": [[0.00153313], 0, 3.60327, 1639045351], "v": "v0.6"}
{"i": [["[\"pool_layer\", \"avg\", 128, 84, 83, 83, 3, 3, 2, \"SAME\"]", "rocm -keys=rocm,gpu -max_num_threads=256 -mcpu=gfx906 -mtriple=amdgcn-amd-amdhsa-hcc -thread_warp_size=64", [-1, 16, 64, 65536, 2147483647, 1024, 16, 64], "", 0, []], [[], [["CI", 1], ["FU", 3, [0, 1, 2, 3]], ["SP", 3, 0, 18966528, [16], 1], ["AN", 3, 0, 5], ["AN", 3, 1, 6], ["FU", 2, [0, 1, 2, 3]], ["SP", 2, 0, 18966528, [2], 1], ["AN", 2, 0, 5], ["AN", 2, 1, 6], ["PR", 2, 0, "auto_unroll_max_step$512"]]]], "r": [[0.0248816], 0, 3.45567, 1639045354], "v": "v0.6"}
{"i": [["[\"pool_layer\", \"avg\", 128, 84, 83, 83, 3, 3, 2, \"SAME\"]", "rocm -keys=rocm,gpu -max_num_threads=256 -mcpu=gfx906 -mtriple=amdgcn-amd-amdhsa-hcc -thread_warp_size=64", [-1, 16, 64, 65536, 2147483647, 1024, 16, 64], "", 0, []], [[], [["CI", 1], ["FU", 3, [0, 1, 2, 3]], ["SP", 3, 0, 18966528, [16], 1], ["AN", 3, 0, 5], ["AN", 3, 1, 6], ["FU", 2, [0, 1, 2, 3]], ["SP", 2, 0, 18966528, [16], 1], ["AN", 2, 0, 5], ["AN", 2, 1, 6], ["PR", 2, 0, "auto_unroll_max_step$512"]]]], "r": [[0.00553042], 0, 3.79336, 1639045358], "v": "v0.6"}
{"i": [["[\"pool_layer\", \"avg\", 128, 84, 83, 83, 3, 3, 2, \"SAME\"]", "rocm -keys=rocm,gpu -max_num_threads=256 -mcpu=gfx906 -mtriple=amdgcn-amd-amdhsa-hcc -thread_warp_size=64", [-1, 16, 64, 65536, 2147483647, 1024, 16, 64], "", 0, []], [[], [["CI", 1], ["FU", 3, [0, 1, 2, 3]], ["SP", 3, 0, 18966528, [64], 1], ["AN", 3, 0, 5], ["AN", 3, 1, 6], ["FU", 2, [0, 1, 2, 3]], ["SP", 2, 0, 18966528, [32], 1], ["AN", 2, 0, 5], ["AN", 2, 1, 6], ["PR", 2, 0, "auto_unroll_max_step$1024"]]]], "r": [[0.00207868], 0, 3.61319, 1639045361], "v": "v0.6"}
{"i": [["[\"pool_layer\", \"avg\", 128, 84, 83, 83, 3, 3, 2, \"SAME\"]", "rocm -keys=rocm,gpu -max_num_threads=256 -mcpu=gfx906 -mtriple=amdgcn-amd-amdhsa-hcc -thread_warp_size=64", [-1, 16, 64, 65536, 2147483647, 1024, 16, 64], "", 0, []], [[], [["CI", 1], ["FU", 3, [0, 1, 2, 3]], ["SP", 3, 0, 18966528, [1], 1], ["AN", 3, 0, 5], ["AN", 3, 1, 6], ["FU", 2, [0, 1, 2, 3]], ["SP", 2, 0, 18966528, [8], 1], ["AN", 2, 0, 5], ["AN", 2, 1, 6], ["PR", 2, 0, "auto_unroll_max_step$64"]]]], "r": [[0.0497545], 0, 3.59455, 1639045365], "v": "v0.6"}
{"i": [["[\"pool_layer\", \"avg\", 128, 84, 83, 83, 3, 3, 2, \"SAME\"]", "rocm -keys=rocm,gpu -max_num_threads=256 -mcpu=gfx906 -mtriple=amdgcn-amd-amdhsa-hcc -thread_warp_size=64", [-1, 16, 64, 65536, 2147483647, 1024, 16, 64], "", 0, []], [[], [["CI", 1], ["FU", 3, [0, 1, 2, 3]], ["SP", 3, 0, 18966528, [4], 1], ["AN", 3, 0, 5], ["AN", 3, 1, 6], ["FU", 2, [0, 1, 2, 3]], ["SP", 2, 0, 18966528, [8], 1], ["AN", 2, 0, 5], ["AN", 2, 1, 6], ["PR", 2, 0, "auto_unroll_max_step$1024"]]]], "r": [[0.0165869], 0, 3.41735, 1639045368], "v": "v0.6"}
{"i": [["[\"pool_layer\", \"avg\", 128, 84, 83, 83, 3, 3, 2, \"SAME\"]", "rocm -keys=rocm,gpu -max_num_threads=256 -mcpu=gfx906 -mtriple=amdgcn-amd-amdhsa-hcc -thread_warp_size=64", [-1, 16, 64, 65536, 2147483647, 1024, 16, 64], "", 0, []], [[], [["CI", 1], ["FU", 3, [0, 1, 2, 3]], ["SP", 3, 0, 18966528, [63], 1], ["AN", 3, 0, 5], ["AN", 3, 1, 6], ["FU", 2, [0, 1, 2, 3]], ["SP", 2, 0, 18966528, [32], 1], ["AN", 2, 0, 5], ["AN", 2, 1, 6], ["PR", 2, 0, "auto_unroll_max_step$0"]]]], "r": [[0.00208956], 0, 3.72559, 1639045371], "v": "v0.6"}
{"i": [["[\"pool_layer\", \"avg\", 128, 84, 83, 83, 3, 3, 2, \"SAME\"]", "rocm -keys=rocm,gpu -max_num_threads=256 -mcpu=gfx906 -mtriple=amdgcn-amd-amdhsa-hcc -thread_warp_size=64", [-1, 16, 64, 65536, 2147483647, 1024, 16, 64], "", 0, []], [[], [["CI", 1], ["FU", 3, [0, 1, 2, 3]], ["SP", 3, 0, 18966528, [1], 1], ["AN", 3, 0, 5], ["AN", 3, 1, 6], ["FU", 2, [0, 1, 2, 3]], ["SP", 2, 0, 18966528, [16], 1], ["AN", 2, 0, 5], ["AN", 2, 1, 6], ["PR", 2, 0, "auto_unroll_max_step$16"]]]], "r": [[0.0469932], 0, 3.44639, 1639045374], "v": "v0.6"}
{"i": [["[\"pool_layer\", \"avg\", 128, 84, 83, 83, 3, 3, 2, \"SAME\"]", "rocm -keys=rocm,gpu -max_num_threads=256 -mcpu=gfx906 -mtriple=amdgcn-amd-amdhsa-hcc -thread_warp_size=64", [-1, 16, 64, 65536, 2147483647, 1024, 16, 64], "", 0, []], [[], [["CI", 1], ["FU", 3, [0, 1, 2, 3]], ["SP", 3, 0, 18966528, [2], 1], ["AN", 3, 0, 5], ["AN", 3, 1, 6], ["FU", 2, [0, 1, 2, 3]], ["SP", 2, 0, 18966528, [4], 1], ["AN", 2, 0, 5], ["AN", 2, 1, 6], ["PR", 2, 0, "auto_unroll_max_step$0"]]]], "r": [[0.0331717], 0, 3.4112, 1639045378], "v": "v0.6"}
{"i": [["[\"pool_layer\", \"avg\", 128, 84, 83, 83, 3, 3, 2, \"SAME\"]", "rocm -keys=rocm,gpu -max_num_threads=256 -mcpu=gfx906 -mtriple=amdgcn-amd-amdhsa-hcc -thread_warp_size=64", [-1, 16, 64, 65536, 2147483647, 1024, 16, 64], "", 0, []], [[], [["CI", 1], ["FU", 3, [0, 1, 2, 3]], ["SP", 3, 0, 18966528, [2], 1], ["AN", 3, 0, 5], ["AN", 3, 1, 6], ["FU", 2, [0, 1, 2, 3]], ["SP", 2, 0, 18966528, [48], 1], ["AN", 2, 0, 5], ["AN", 2, 1, 6], ["PR", 2, 0, "auto_unroll_max_step$64"]]]], "r": [[0.023045], 0, 3.85506, 1639045381], "v": "v0.6"}
{"i": [["[\"pool_layer\", \"avg\", 128, 84, 83, 83, 3, 3, 2, \"SAME\"]", "rocm -keys=rocm,gpu -max_num_threads=256 -mcpu=gfx906 -mtriple=amdgcn-amd-amdhsa-hcc -thread_warp_size=64", [-1, 16, 64, 65536, 2147483647, 1024, 16, 64], "", 0, []], [[], [["CI", 1], ["FU", 3, [0, 1, 2, 3]], ["SP", 3, 0, 18966528, [54], 1], ["AN", 3, 0, 5], ["AN", 3, 1, 6], ["FU", 2, [0, 1, 2, 3]], ["SP", 2, 0, 18966528, [1], 1], ["AN", 2, 0, 5], ["AN", 2, 1, 6], ["PR", 2, 0, "auto_unroll_max_step$64"]]]], "r": [[0.0450486], 0, 3.48992, 1639045384], "v": "v0.6"}
{"i": [["[\"pool_layer\", \"avg\", 128, 84, 83, 83, 3, 3, 2, \"SAME\"]", "rocm -keys=rocm,gpu -max_num_threads=256 -mcpu=gfx906 -mtriple=amdgcn-amd-amdhsa-hcc -thread_warp_size=64", [-1, 16, 64, 65536, 2147483647, 1024, 16, 64], "", 0, []], [[], [["CI", 1], ["FU", 3, [0, 1, 2, 3]], ["SP", 3, 0, 18966528, [32], 1], ["AN", 3, 0, 5], ["AN", 3, 1, 6], ["FU", 2, [0, 1, 2, 3]], ["SP", 2, 0, 18966528, [8], 1], ["AN", 2, 0, 5], ["AN", 2, 1, 6], ["PR", 2, 0, "auto_unroll_max_step$512"]]]], "r": [[0.00691307], 0, 3.78937, 1639045388], "v": "v0.6"}
{"i": [["[\"pool_layer\", \"avg\", 128, 84, 83, 83, 3, 3, 2, \"SAME\"]", "rocm -keys=rocm,gpu -max_num_threads=256 -mcpu=gfx906 -mtriple=amdgcn-amd-amdhsa-hcc -thread_warp_size=64", [-1, 16, 64, 65536, 2147483647, 1024, 16, 64], "", 0, []], [[], [["CI", 1], ["FU", 3, [0, 1, 2, 3]], ["SP", 3, 0, 18966528, [64], 1], ["AN", 3, 0, 5], ["AN", 3, 1, 6], ["FU", 2, [0, 1, 2, 3]], ["SP", 2, 0, 18966528, [64], 1], ["AN", 2, 0, 5], ["AN", 2, 1, 6], ["PR", 2, 0, "auto_unroll_max_step$512"]]]], "r": [[0.00153394], 0, 3.60996, 1639045391], "v": "v0.6"}
{"i": [["[\"pool_layer\", \"avg\", 128, 84, 83, 83, 3, 3, 2, \"SAME\"]", "rocm -keys=rocm,gpu -max_num_threads=256 -mcpu=gfx906 -mtriple=amdgcn-amd-amdhsa-hcc -thread_warp_size=64", [-1, 16, 64, 65536, 2147483647, 1024, 16, 64], "", 0, []], [[], [["CI", 1], ["FU", 3, [0, 1, 2, 3]], ["SP", 3, 0, 18966528, [64], 1], ["AN", 3, 0, 5], ["AN", 3, 1, 6], ["FU", 2, [0, 1, 2, 3]], ["SP", 2, 0, 18966528, [64], 1], ["AN", 2, 0, 5], ["AN", 2, 1, 6], ["PR", 2, 0, "auto_unroll_max_step$16"]]]], "r": [[0.0015337], 0, 3.64588, 1639045395], "v": "v0.6"}
{"i": [["[\"pool_layer\", \"avg\", 128, 84, 83, 83, 3, 3, 2, \"SAME\"]", "rocm -keys=rocm,gpu -max_num_threads=256 -mcpu=gfx906 -mtriple=amdgcn-amd-amdhsa-hcc -thread_warp_size=64", [-1, 16, 64, 65536, 2147483647, 1024, 16, 64], "", 0, []], [[], [["CI", 1], ["FU", 3, [0, 1, 2, 3]], ["SP", 3, 0, 18966528, [64], 1], ["AN", 3, 0, 5], ["AN", 3, 1, 6], ["FU", 2, [0, 1, 2, 3]], ["SP", 2, 0, 18966528, [64], 1], ["AN", 2, 0, 5], ["AN", 2, 1, 6], ["PR", 2, 0, "auto_unroll_max_step$0"]]]], "r": [[0.00153423], 0, 3.62892, 1639045398], "v": "v0.6"}
{"i": [["[\"pool_layer\", \"avg\", 128, 84, 83, 83, 3, 3, 2, \"SAME\"]", "rocm -keys=rocm,gpu -max_num_threads=256 -mcpu=gfx906 -mtriple=amdgcn-amd-amdhsa-hcc -thread_warp_size=64", [-1, 16, 64, 65536, 2147483647, 1024, 16, 64], "", 0, []], [[], [["CI", 1], ["FU", 3, [0, 1, 2, 3]], ["SP", 3, 0, 18966528, [7], 1], ["AN", 3, 0, 5], ["AN", 3, 1, 6], ["FU", 2, [0, 1, 2, 3]], ["SP", 2, 0, 18966528, [4], 1], ["AN", 2, 0, 5], ["AN", 2, 1, 6], ["PR", 2, 0, "auto_unroll_max_step$0"]]]], "r": [[0.0173785], 0, 3.38968, 1639045415], "v": "v0.6"}
{"i": [["[\"pool_layer\", \"avg\", 128, 84, 83, 83, 3, 3, 2, \"SAME\"]", "rocm -keys=rocm,gpu -max_num_threads=256 -mcpu=gfx906 -mtriple=amdgcn-amd-amdhsa-hcc -thread_warp_size=64", [-1, 16, 64, 65536, 2147483647, 1024, 16, 64], "", 0, []], [[], [["CI", 1], ["FU", 3, [0, 1, 2, 3]], ["SP", 3, 0, 18966528, [2], 1], ["AN", 3, 0, 5], ["AN", 3, 1, 6], ["FU", 2, [0, 1, 2, 3]], ["SP", 2, 0, 18966528, [32], 1], ["AN", 2, 0, 5], ["AN", 2, 1, 6], ["PR", 2, 0, "auto_unroll_max_step$64"]]]], "r": [[0.0235024], 0, 3.5322, 1639045418], "v": "v0.6"}
{"i": [["[\"pool_layer\", \"avg\", 128, 84, 83, 83, 3, 3, 2, \"SAME\"]", "rocm -keys=rocm,gpu -max_num_threads=256 -mcpu=gfx906 -mtriple=amdgcn-amd-amdhsa-hcc -thread_warp_size=64", [-1, 16, 64, 65536, 2147483647, 1024, 16, 64], "", 0, []], [[], [["CI", 1], ["FU", 3, [0, 1, 2, 3]], ["SP", 3, 0, 18966528, [8], 1], ["AN", 3, 0, 5], ["AN", 3, 1, 6], ["FU", 2, [0, 1, 2, 3]], ["SP", 2, 0, 18966528, [32], 1], ["AN", 2, 0, 5], ["AN", 2, 1, 6], ["PR", 2, 0, "auto_unroll_max_step$64"]]]], "r": [[0.00691544], 0, 4.01529, 1639045422], "v": "v0.6"}
{"i": [["[\"pool_layer\", \"avg\", 128, 84, 83, 83, 3, 3, 2, \"SAME\"]", "rocm -keys=rocm,gpu -max_num_threads=256 -mcpu=gfx906 -mtriple=amdgcn-amd-amdhsa-hcc -thread_warp_size=64", [-1, 16, 64, 65536, 2147483647, 1024, 16, 64], "", 0, []], [[], [["CI", 1], ["FU", 3, [0, 1, 2, 3]], ["SP", 3, 0, 18966528, [6], 1], ["AN", 3, 0, 5], ["AN", 3, 1, 6], ["FU", 2, [0, 1, 2, 3]], ["SP", 2, 0, 18966528, [2], 1], ["AN", 2, 0, 5], ["AN", 2, 1, 6], ["PR", 2, 0, "auto_unroll_max_step$16"]]]], "r": [[0.0294882], 0, 3.63624, 1639045425], "v": "v0.6"}
{"i": [["[\"pool_layer\", \"avg\", 128, 84, 83, 83, 3, 3, 2, \"SAME\"]", "rocm -keys=rocm,gpu -max_num_threads=256 -mcpu=gfx906 -mtriple=amdgcn-amd-amdhsa-hcc -thread_warp_size=64", [-1, 16, 64, 65536, 2147483647, 1024, 16, 64], "", 0, []], [[], [["CI", 1], ["FU", 3, [0, 1, 2, 3]], ["SP", 3, 0, 18966528, [21], 1], ["AN", 3, 0, 5], ["AN", 3, 1, 6], ["FU", 2, [0, 1, 2, 3]], ["SP", 2, 0, 18966528, [24], 1], ["AN", 2, 0, 5], ["AN", 2, 1, 6], ["PR", 2, 0, "auto_unroll_max_step$512"]]]], "r": [[0.00395193], 0, 3.89033, 1639045428], "v": "v0.6"}
{"i": [["[\"pool_layer\", \"avg\", 128, 84, 83, 83, 3, 3, 2, \"SAME\"]", "rocm -keys=rocm,gpu -max_num_threads=256 -mcpu=gfx906 -mtriple=amdgcn-amd-amdhsa-hcc -thread_warp_size=64", [-1, 16, 64, 65536, 2147483647, 1024, 16, 64], "", 0, []], [[], [["CI", 1], ["FU", 3, [0, 1, 2, 3]], ["SP", 3, 0, 18966528, [16], 1], ["AN", 3, 0, 5], ["AN", 3, 1, 6], ["FU", 2, [0, 1, 2, 3]], ["SP", 2, 0, 18966528, [18], 1], ["AN", 2, 0, 5], ["AN", 2, 1, 6], ["PR", 2, 0, "auto_unroll_max_step$64"]]]], "r": [[0.00522436], 0, 3.95524, 1639045432], "v": "v0.6"}
{"i": [["[\"pool_layer\", \"avg\", 128, 84, 83, 83, 3, 3, 2, \"SAME\"]", "rocm -keys=rocm,gpu -max_num_threads=256 -mcpu=gfx906 -mtriple=amdgcn-amd-amdhsa-hcc -thread_warp_size=64", [-1, 16, 64, 65536, 2147483647, 1024, 16, 64], "", 0, []], [[], [["CI", 1], ["FU", 3, [0, 1, 2, 3]], ["SP", 3, 0, 18966528, [54], 1], ["AN", 3, 0, 5], ["AN", 3, 1, 6], ["FU", 2, [0, 1, 2, 3]], ["SP", 2, 0, 18966528, [32], 1], ["AN", 2, 0, 5], ["AN", 2, 1, 6], ["PR", 2, 0, "auto_unroll_max_step$64"]]]], "r": [[0.00220677], 0, 3.83016, 1639045435], "v": "v0.6"}
{"i": [["[\"pool_layer\", \"avg\", 128, 84, 83, 83, 3, 3, 2, \"SAME\"]", "rocm -keys=rocm,gpu -max_num_threads=256 -mcpu=gfx906 -mtriple=amdgcn-amd-amdhsa-hcc -thread_warp_size=64", [-1, 16, 64, 65536, 2147483647, 1024, 16, 64], "", 0, []], [[], [["CI", 1], ["FU", 3, [0, 1, 2, 3]], ["SP", 3, 0, 18966528, [6], 1], ["AN", 3, 0, 5], ["AN", 3, 1, 6], ["FU", 2, [0, 1, 2, 3]], ["SP", 2, 0, 18966528, [32], 1], ["AN", 2, 0, 5], ["AN", 2, 1, 6], ["PR", 2, 0, "auto_unroll_max_step$64"]]]], "r": [[0.00875964], 0, 3.46439, 1639045438], "v": "v0.6"}
{"i": [["[\"pool_layer\", \"avg\", 128, 84, 83, 83, 3, 3, 2, \"SAME\"]", "rocm -keys=rocm,gpu -max_num_threads=256 -mcpu=gfx906 -mtriple=amdgcn-amd-amdhsa-hcc -thread_warp_size=64", [-1, 16, 64, 65536, 2147483647, 1024, 16, 64], "", 0, []], [[], [["CI", 1], ["FU", 3, [0, 1, 2, 3]], ["SP", 3, 0, 18966528, [64], 1], ["AN", 3, 0, 5], ["AN", 3, 1, 6], ["FU", 2, [0, 1, 2, 3]], ["SP", 2, 0, 18966528, [56], 1], ["AN", 2, 0, 5], ["AN", 2, 1, 6], ["PR", 2, 0, "auto_unroll_max_step$512"]]]], "r": [[0.00156873], 0, 3.76847, 1639045442], "v": "v0.6"}
{"i": [["[\"pool_layer\", \"avg\", 128, 84, 83, 83, 3, 3, 2, \"SAME\"]", "rocm -keys=rocm,gpu -max_num_threads=256 -mcpu=gfx906 -mtriple=amdgcn-amd-amdhsa-hcc -thread_warp_size=64", [-1, 16, 64, 65536, 2147483647, 1024, 16, 64], "", 0, []], [[], [["CI", 1], ["FU", 3, [0, 1, 2, 3]], ["SP", 3, 0, 18966528, [8], 1], ["AN", 3, 0, 5], ["AN", 3, 1, 6], ["FU", 2, [0, 1, 2, 3]], ["SP", 2, 0, 18966528, [4], 1], ["AN", 2, 0, 5], ["AN", 2, 1, 6], ["PR", 2, 0, "auto_unroll_max_step$512"]]]], "r": [[0.0165872], 0, 3.61075, 1639045445], "v": "v0.6"}
{"i": [["[\"pool_layer\", \"avg\", 128, 84, 83, 83, 3, 3, 2, \"SAME\"]", "rocm -keys=rocm,gpu -max_num_threads=256 -mcpu=gfx906 -mtriple=amdgcn-amd-amdhsa-hcc -thread_warp_size=64", [-1, 16, 64, 65536, 2147483647, 1024, 16, 64], "", 0, []], [[], [["CI", 1], ["FU", 3, [0, 1, 2, 3]], ["SP", 3, 0, 18966528, [1], 1], ["AN", 3, 0, 5], ["AN", 3, 1, 6], ["FU", 2, [0, 1, 2, 3]], ["SP", 2, 0, 18966528, [36], 1], ["AN", 2, 0, 5], ["AN", 2, 1, 6], ["PR", 2, 0, "auto_unroll_max_step$16"]]]], "r": [[0.0454643], 0, 3.71794, 1639045448], "v": "v0.6"}
{"i": [["[\"pool_layer\", \"avg\", 128, 84, 83, 83, 3, 3, 2, \"SAME\"]", "rocm -keys=rocm,gpu -max_num_threads=256 -mcpu=gfx906 -mtriple=amdgcn-amd-amdhsa-hcc -thread_warp_size=64", [-1, 16, 64, 65536, 2147483647, 1024, 16, 64], "", 0, []], [[], [["CI", 1], ["FU", 3, [0, 1, 2, 3]], ["SP", 3, 0, 18966528, [12], 1], ["AN", 3, 0, 5], ["AN", 3, 1, 6], ["FU", 2, [0, 1, 2, 3]], ["SP", 2, 0, 18966528, [3], 1], ["AN", 2, 0, 5], ["AN", 2, 1, 6], ["PR", 2, 0, "auto_unroll_max_step$0"]]]], "r": [[0.0184333], 0, 3.39455, 1639045452], "v": "v0.6"}
{"i": [["[\"pool_layer\", \"avg\", 128, 84, 83, 83, 3, 3, 2, \"SAME\"]", "rocm -keys=rocm,gpu -max_num_threads=256 -mcpu=gfx906 -mtriple=amdgcn-amd-amdhsa-hcc -thread_warp_size=64", [-1, 16, 64, 65536, 2147483647, 1024, 16, 64], "", 0, []], [[], [["CI", 1], ["FU", 3, [0, 1, 2, 3]], ["SP", 3, 0, 18966528, [54], 1], ["AN", 3, 0, 5], ["AN", 3, 1, 6], ["FU", 2, [0, 1, 2, 3]], ["SP", 2, 0, 18966528, [1], 1], ["AN", 2, 0, 5], ["AN", 2, 1, 6], ["PR", 2, 0, "auto_unroll_max_step$1024"]]]], "r": [[0.04505], 0, 3.67969, 1639045455], "v": "v0.6"}
{"i": [["[\"pool_layer\", \"avg\", 128, 84, 83, 83, 3, 3, 2, \"SAME\"]", "rocm -keys=rocm,gpu -max_num_threads=256 -mcpu=gfx906 -mtriple=amdgcn-amd-amdhsa-hcc -thread_warp_size=64", [-1, 16, 64, 65536, 2147483647, 1024, 16, 64], "", 0, []], [[], [["CI", 1], ["FU", 3, [0, 1, 2, 3]], ["SP", 3, 0, 18966528, [1], 1], ["AN", 3, 0, 5], ["AN", 3, 1, 6], ["FU", 2, [0, 1, 2, 3]], ["SP", 2, 0, 18966528, [3], 1], ["AN", 2, 0, 5], ["AN", 2, 1, 6], ["PR", 2, 0, "auto_unroll_max_step$512"]]]], "r": [[0.0589663], 0, 3.76742, 1639045458], "v": "v0.6"}
{"i": [["[\"pool_layer\", \"avg\", 128, 84, 83, 83, 3, 3, 2, \"SAME\"]", "rocm -keys=rocm,gpu -max_num_threads=256 -mcpu=gfx906 -mtriple=amdgcn-amd-amdhsa-hcc -thread_warp_size=64", [-1, 16, 64, 65536, 2147483647, 1024, 16, 64], "", 0, []], [[], [["CI", 1], ["FU", 3, [0, 1, 2, 3]], ["SP", 3, 0, 18966528, [8], 1], ["AN", 3, 0, 5], ["AN", 3, 1, 6], ["FU", 2, [0, 1, 2, 3]], ["SP", 2, 0, 18966528, [12], 1], ["AN", 2, 0, 5], ["AN", 2, 1, 6], ["PR", 2, 0, "auto_unroll_max_step$64"]]]], "r": [[0.00921769], 0, 3.49537, 1639045461], "v": "v0.6"}
{"i": [["[\"pool_layer\", \"avg\", 128, 84, 83, 83, 3, 3, 2, \"SAME\"]", "rocm -keys=rocm,gpu -max_num_threads=256 -mcpu=gfx906 -mtriple=amdgcn-amd-amdhsa-hcc -thread_warp_size=64", [-1, 16, 64, 65536, 2147483647, 1024, 16, 64], "", 0, []], [[], [["CI", 1], ["FU", 3, [0, 1, 2, 3]], ["SP", 3, 0, 18966528, [1], 1], ["AN", 3, 0, 5], ["AN", 3, 1, 6], ["FU", 2, [0, 1, 2, 3]], ["SP", 2, 0, 18966528, [24], 1], ["AN", 2, 0, 5], ["AN", 2, 1, 6], ["PR", 2, 0, "auto_unroll_max_step$512"]]]], "r": [[0.0460735], 0, 3.57276, 1639045465], "v": "v0.6"}
{"i": [["[\"pool_layer\", \"avg\", 128, 84, 83, 83, 3, 3, 2, \"SAME\"]", "rocm -keys=rocm,gpu -max_num_threads=256 -mcpu=gfx906 -mtriple=amdgcn-amd-amdhsa-hcc -thread_warp_size=64", [-1, 16, 64, 65536, 2147483647, 1024, 16, 64], "", 0, []], [[], [["CI", 1], ["FU", 3, [0, 1, 2, 3]], ["SP", 3, 0, 18966528, [8], 1], ["AN", 3, 0, 5], ["AN", 3, 1, 6], ["FU", 2, [0, 1, 2, 3]], ["SP", 2, 0, 18966528, [3], 1], ["AN", 2, 0, 5], ["AN", 2, 1, 6], ["PR", 2, 0, "auto_unroll_max_step$16"]]]], "r": [[0.0202747], 0, 3.48089, 1639045468], "v": "v0.6"}
{"i": [["[\"pool_layer\", \"avg\", 128, 84, 83, 83, 3, 3, 2, \"SAME\"]", "rocm -keys=rocm,gpu -max_num_threads=256 -mcpu=gfx906 -mtriple=amdgcn-amd-amdhsa-hcc -thread_warp_size=64", [-1, 16, 64, 65536, 2147483647, 1024, 16, 64], "", 0, []], [[], [["CI", 1], ["FU", 3, [0, 1, 2, 3]], ["SP", 3, 0, 18966528, [63], 1], ["AN", 3, 0, 5], ["AN", 3, 1, 6], ["FU", 2, [0, 1, 2, 3]], ["SP", 2, 0, 18966528, [8], 1], ["AN", 2, 0, 5], ["AN", 2, 1, 6], ["PR", 2, 0, "auto_unroll_max_step$0"]]]], "r": [[0.00623322], 0, 3.9006, 1639045471], "v": "v0.6"}
{"i": [["[\"pool_layer\", \"avg\", 128, 84, 83, 83, 3, 3, 2, \"SAME\"]", "rocm -keys=rocm,gpu -max_num_threads=256 -mcpu=gfx906 -mtriple=amdgcn-amd-amdhsa-hcc -thread_warp_size=64", [-1, 16, 64, 65536, 2147483647, 1024, 16, 64], "", 0, []], [[], [["CI", 1], ["FU", 3, [0, 1, 2, 3]], ["SP", 3, 0, 18966528, [56], 1], ["AN", 3, 0, 5], ["AN", 3, 1, 6], ["FU", 2, [0, 1, 2, 3]], ["SP", 2, 0, 18966528, [1], 1], ["AN", 2, 0, 5], ["AN", 2, 1, 6], ["PR", 2, 0, "auto_unroll_max_step$16"]]]], "r": [[0.0450195], 0, 3.48951, 1639045475], "v": "v0.6"}
{"i": [["[\"pool_layer\", \"avg\", 128, 84, 83, 83, 3, 3, 2, \"SAME\"]", "rocm -keys=rocm,gpu -max_num_threads=256 -mcpu=gfx906 -mtriple=amdgcn-amd-amdhsa-hcc -thread_warp_size=64", [-1, 16, 64, 65536, 2147483647, 1024, 16, 64], "", 0, []], [[], [["CI", 1], ["FU", 3, [0, 1, 2, 3]], ["SP", 3, 0, 18966528, [2], 1], ["AN", 3, 0, 5], ["AN", 3, 1, 6], ["FU", 2, [0, 1, 2, 3]], ["SP", 2, 0, 18966528, [64], 1], ["AN", 2, 0, 5], ["AN", 2, 1, 6], ["PR", 2, 0, "auto_unroll_max_step$1024"]]]], "r": [[0.0229507], 0, 3.52921, 1639045478], "v": "v0.6"}
{"i": [["[\"pool_layer\", \"avg\", 128, 84, 83, 83, 3, 3, 2, \"SAME\"]", "rocm -keys=rocm,gpu -max_num_threads=256 -mcpu=gfx906 -mtriple=amdgcn-amd-amdhsa-hcc -thread_warp_size=64", [-1, 16, 64, 65536, 2147483647, 1024, 16, 64], "", 0, []], [[], [["CI", 1], ["FU", 3, [0, 1, 2, 3]], ["SP", 3, 0, 18966528, [64], 1], ["AN", 3, 0, 5], ["AN", 3, 1, 6], ["FU", 2, [0, 1, 2, 3]], ["SP", 2, 0, 18966528, [1], 1], ["AN", 2, 0, 5], ["AN", 2, 1, 6], ["PR", 2, 0, "auto_unroll_max_step$64"]]]], "r": [[0.0449178], 0, 3.69592, 1639045481], "v": "v0.6"}
{"i": [["[\"pool_layer\", \"avg\", 128, 84, 83, 83, 3, 3, 2, \"SAME\"]", "rocm -keys=rocm,gpu -max_num_threads=256 -mcpu=gfx906 -mtriple=amdgcn-amd-amdhsa-hcc -thread_warp_size=64", [-1, 16, 64, 65536, 2147483647, 1024, 16, 64], "", 0, []], [[], [["CI", 1], ["FU", 3, [0, 1, 2, 3]], ["SP", 3, 0, 18966528, [4], 1], ["AN", 3, 0, 5], ["AN", 3, 1, 6], ["FU", 2, [0, 1, 2, 3]], ["SP", 2, 0, 18966528, [18], 1], ["AN", 2, 0, 5], ["AN", 2, 1, 6], ["PR", 2, 0, "auto_unroll_max_step$1024"]]]], "r": [[0.0135181], 0, 3.53054, 1639045484], "v": "v0.6"}
{"i": [["[\"pool_layer\", \"avg\", 128, 84, 83, 83, 3, 3, 2, \"SAME\"]", "rocm -keys=rocm,gpu -max_num_threads=256 -mcpu=gfx906 -mtriple=amdgcn-amd-amdhsa-hcc -thread_warp_size=64", [-1, 16, 64, 65536, 2147483647, 1024, 16, 64], "", 0, []], [[], [["CI", 1], ["FU", 3, [0, 1, 2, 3]], ["SP", 3, 0, 18966528, [2], 1], ["AN", 3, 0, 5], ["AN", 3, 1, 6], ["FU", 2, [0, 1, 2, 3]], ["SP", 2, 0, 18966528, [56], 1], ["AN", 2, 0, 5], ["AN", 2, 1, 6], ["PR", 2, 0, "auto_unroll_max_step$16"]]]], "r": [[0.0229867], 0, 3.5775, 1639045487], "v": "v0.6"}
{"i": [["[\"pool_layer\", \"avg\", 128, 84, 83, 83, 3, 3, 2, \"SAME\"]", "rocm -keys=rocm,gpu -max_num_threads=256 -mcpu=gfx906 -mtriple=amdgcn-amd-amdhsa-hcc -thread_warp_size=64", [-1, 16, 64, 65536, 2147483647, 1024, 16, 64], "", 0, []], [[], [["CI", 1], ["FU", 3, [0, 1, 2, 3]], ["SP", 3, 0, 18966528, [8], 1], ["AN", 3, 0, 5], ["AN", 3, 1, 6], ["FU", 2, [0, 1, 2, 3]], ["SP", 2, 0, 18966528, [56], 1], ["AN", 2, 0, 5], ["AN", 2, 1, 6], ["PR", 2, 0, "auto_unroll_max_step$64"]]]], "r": [[0.00640564], 0, 3.46832, 1639045491], "v": "v0.6"}
{"i": [["[\"pool_layer\", \"avg\", 128, 84, 83, 83, 3, 3, 2, \"SAME\"]", "rocm -keys=rocm,gpu -max_num_threads=256 -mcpu=gfx906 -mtriple=amdgcn-amd-amdhsa-hcc -thread_warp_size=64", [-1, 16, 64, 65536, 2147483647, 1024, 16, 64], "", 0, []], [[], [["CI", 1], ["FU", 3, [0, 1, 2, 3]], ["SP", 3, 0, 18966528, [3], 1], ["AN", 3, 0, 5], ["AN", 3, 1, 6], ["FU", 2, [0, 1, 2, 3]], ["SP", 2, 0, 18966528, [1], 1], ["AN", 2, 0, 5], ["AN", 2, 1, 6], ["PR", 2, 0, "auto_unroll_max_step$64"]]]], "r": [[0.05896], 0, 3.76225, 1639045494], "v": "v0.6"}
{"i": [["[\"pool_layer\", \"avg\", 128, 84, 83, 83, 3, 3, 2, \"SAME\"]", "rocm -keys=rocm,gpu -max_num_threads=256 -mcpu=gfx906 -mtriple=amdgcn-amd-amdhsa-hcc -thread_warp_size=64", [-1, 16, 64, 65536, 2147483647, 1024, 16, 64], "", 0, []], [[], [["CI", 1], ["FU", 3, [0, 1, 2, 3]], ["SP", 3, 0, 18966528, [1], 1], ["AN", 3, 0, 5], ["AN", 3, 1, 6], ["FU", 2, [0, 1, 2, 3]], ["SP", 2, 0, 18966528, [1], 1], ["AN", 2, 0, 5], ["AN", 2, 1, 6], ["PR", 2, 0, "auto_unroll_max_step$512"]]]], "r": [[0.0884358], 0, 3.90375, 1639045497], "v": "v0.6"}
{"i": [["[\"pool_layer\", \"avg\", 128, 84, 83, 83, 3, 3, 2, \"SAME\"]", "rocm -keys=rocm,gpu -max_num_threads=256 -mcpu=gfx906 -mtriple=amdgcn-amd-amdhsa-hcc -thread_warp_size=64", [-1, 16, 64, 65536, 2147483647, 1024, 16, 64], "", 0, []], [[], [["CI", 1], ["FU", 3, [0, 1, 2, 3]], ["SP", 3, 0, 18966528, [4], 1], ["AN", 3, 0, 5], ["AN", 3, 1, 6], ["FU", 2, [0, 1, 2, 3]], ["SP", 2, 0, 18966528, [2], 1], ["AN", 2, 0, 5], ["AN", 2, 1, 6], ["PR", 2, 0, "auto_unroll_max_step$0"]]]], "r": [[0.0331727], 0, 3.61086, 1639045501], "v": "v0.6"}
{"i": [["[\"pool_layer\", \"avg\", 128, 84, 83, 83, 3, 3, 2, \"SAME\"]", "rocm -keys=rocm,gpu -max_num_threads=256 -mcpu=gfx906 -mtriple=amdgcn-amd-amdhsa-hcc -thread_warp_size=64", [-1, 16, 64, 65536, 2147483647, 1024, 16, 64], "", 0, []], [[], [["CI", 1], ["FU", 3, [0, 1, 2, 3]], ["SP", 3, 0, 18966528, [36], 1], ["AN", 3, 0, 5], ["AN", 3, 1, 6], ["FU", 2, [0, 1, 2, 3]], ["SP", 2, 0, 18966528, [2], 1], ["AN", 2, 0, 5], ["AN", 2, 1, 6], ["PR", 2, 0, "auto_unroll_max_step$512"]]]], "r": [[0.0233464], 0, 3.36858, 1639045504], "v": "v0.6"}
{"i": [["[\"pool_layer\", \"avg\", 128, 84, 83, 83, 3, 3, 2, \"SAME\"]", "rocm -keys=rocm,gpu -max_num_threads=256 -mcpu=gfx906 -mtriple=amdgcn-amd-amdhsa-hcc -thread_warp_size=64", [-1, 16, 64, 65536, 2147483647, 1024, 16, 64], "", 0, []], [[], [["CI", 1], ["FU", 3, [0, 1, 2, 3]], ["SP", 3, 0, 18966528, [1], 1], ["AN", 3, 0, 5], ["AN", 3, 1, 6], ["FU", 2, [0, 1, 2, 3]], ["SP", 2, 0, 18966528, [64], 1], ["AN", 2, 0, 5], ["AN", 2, 1, 6], ["PR", 2, 0, "auto_unroll_max_step$16"]]]], "r": [[0.0450662], 0, 3.5652, 1639045507], "v": "v0.6"}
{"i": [["[\"pool_layer\", \"avg\", 128, 84, 83, 83, 3, 3, 2, \"SAME\"]", "rocm -keys=rocm,gpu -max_num_threads=256 -mcpu=gfx906 -mtriple=amdgcn-amd-amdhsa-hcc -thread_warp_size=64", [-1, 16, 64, 65536, 2147483647, 1024, 16, 64], "", 0, []], [[], [["CI", 1], ["FU", 3, [0, 1, 2, 3]], ["SP", 3, 0, 18966528, [8], 1], ["AN", 3, 0, 5], ["AN", 3, 1, 6], ["FU", 2, [0, 1, 2, 3]], ["SP", 2, 0, 18966528, [64], 1], ["AN", 2, 0, 5], ["AN", 2, 1, 6], ["PR", 2, 0, "auto_unroll_max_step$64"]]]], "r": [[0.00636932], 0, 3.93428, 1639045511], "v": "v0.6"}
{"i": [["[\"pool_layer\", \"avg\", 128, 84, 83, 83, 3, 3, 2, \"SAME\"]", "rocm -keys=rocm,gpu -max_num_threads=256 -mcpu=gfx906 -mtriple=amdgcn-amd-amdhsa-hcc -thread_warp_size=64", [-1, 16, 64, 65536, 2147483647, 1024, 16, 64], "", 0, []], [[], [["CI", 1], ["FU", 3, [0, 1, 2, 3]], ["SP", 3, 0, 18966528, [12], 1], ["AN", 3, 0, 5], ["AN", 3, 1, 6], ["FU", 2, [0, 1, 2, 3]], ["SP", 2, 0, 18966528, [48], 1], ["AN", 2, 0, 5], ["AN", 2, 1, 6], ["PR", 2, 0, "auto_unroll_max_step$16"]]]], "r": [[0.00462331], 0, 3.32384, 1639045514], "v": "v0.6"}
{"i": [["[\"pool_layer\", \"avg\", 128, 84, 83, 83, 3, 3, 2, \"SAME\"]", "rocm -keys=rocm,gpu -max_num_threads=256 -mcpu=gfx906 -mtriple=amdgcn-amd-amdhsa-hcc -thread_warp_size=64", [-1, 16, 64, 65536, 2147483647, 1024, 16, 64], "", 0, []], [[], [["CI", 1], ["FU", 3, [0, 1, 2, 3]], ["SP", 3, 0, 18966528, [4], 1], ["AN", 3, 0, 5], ["AN", 3, 1, 6], ["FU", 2, [0, 1, 2, 3]], ["SP", 2, 0, 18966528, [42], 1], ["AN", 2, 0, 5], ["AN", 2, 1, 6], ["PR", 2, 0, "auto_unroll_max_step$0"]]]], "r": [[0.012131], 0, 3.50815, 1639045517], "v": "v0.6"}
{"i": [["[\"pool_layer\", \"avg\", 128, 84, 83, 83, 3, 3, 2, \"SAME\"]", "rocm -keys=rocm,gpu -max_num_threads=256 -mcpu=gfx906 -mtriple=amdgcn-amd-amdhsa-hcc -thread_warp_size=64", [-1, 16, 64, 65536, 2147483647, 1024, 16, 64], "", 0, []], [[], [["CI", 1], ["FU", 3, [0, 1, 2, 3]], ["SP", 3, 0, 18966528, [1], 1], ["AN", 3, 0, 5], ["AN", 3, 1, 6], ["FU", 2, [0, 1, 2, 3]], ["SP", 2, 0, 18966528, [56], 1], ["AN", 2, 0, 5], ["AN", 2, 1, 6], ["PR", 2, 0, "auto_unroll_max_step$16"]]]], "r": [[0.0451024], 0, 3.48201, 1639045520], "v": "v0.6"}
{"i": [["[\"pool_layer\", \"avg\", 128, 84, 83, 83, 3, 3, 2, \"SAME\"]", "rocm -keys=rocm,gpu -max_num_threads=256 -mcpu=gfx906 -mtriple=amdgcn-amd-amdhsa-hcc -thread_warp_size=64", [-1, 16, 64, 65536, 2147483647, 1024, 16, 64], "", 0, []], [[], [["CI", 1], ["FU", 3, [0, 1, 2, 3]], ["SP", 3, 0, 18966528, [8], 1], ["AN", 3, 0, 5], ["AN", 3, 1, 6], ["FU", 2, [0, 1, 2, 3]], ["SP", 2, 0, 18966528, [2], 1], ["AN", 2, 0, 5], ["AN", 2, 1, 6], ["PR", 2, 0, "auto_unroll_max_step$512"]]]], "r": [[0.027646], 0, 3.38504, 1639045523], "v": "v0.6"}
{"i": [["[\"pool_layer\", \"avg\", 128, 84, 83, 83, 3, 3, 2, \"SAME\"]", "rocm -keys=rocm,gpu -max_num_threads=256 -mcpu=gfx906 -mtriple=amdgcn-amd-amdhsa-hcc -thread_warp_size=64", [-1, 16, 64, 65536, 2147483647, 1024, 16, 64], "", 0, []], [[], [["CI", 1], ["FU", 3, [0, 1, 2, 3]], ["SP", 3, 0, 18966528, [32], 1], ["AN", 3, 0, 5], ["AN", 3, 1, 6], ["FU", 2, [0, 1, 2, 3]], ["SP", 2, 0, 18966528, [4], 1], ["AN", 2, 0, 5], ["AN", 2, 1, 6], ["PR", 2, 0, "auto_unroll_max_step$16"]]]], "r": [[0.0124435], 0, 3.44496, 1639045526], "v": "v0.6"}
{"i": [["[\"pool_layer\", \"avg\", 128, 84, 83, 83, 3, 3, 2, \"SAME\"]", "rocm -keys=rocm,gpu -max_num_threads=256 -mcpu=gfx906 -mtriple=amdgcn-amd-amdhsa-hcc -thread_warp_size=64", [-1, 16, 64, 65536, 2147483647, 1024, 16, 64], "", 0, []], [[], [["CI", 1], ["FU", 3, [0, 1, 2, 3]], ["SP", 3, 0, 18966528, [16], 1], ["AN", 3, 0, 5], ["AN", 3, 1, 6], ["FU", 2, [0, 1, 2, 3]], ["SP", 2, 0, 18966528, [2], 1], ["AN", 2, 0, 5], ["AN", 2, 1, 6], ["PR", 2, 0, "auto_unroll_max_step$16"]]]], "r": [[0.0248815], 0, 3.4368, 1639045530], "v": "v0.6"}
{"i": [["[\"pool_layer\", \"avg\", 128, 84, 83, 83, 3, 3, 2, \"SAME\"]", "rocm -keys=rocm,gpu -max_num_threads=256 -mcpu=gfx906 -mtriple=amdgcn-amd-amdhsa-hcc -thread_warp_size=64", [-1, 16, 64, 65536, 2147483647, 1024, 16, 64], "", 0, []], [[], [["CI", 1], ["FU", 3, [0, 1, 2, 3]], ["SP", 3, 0, 18966528, [6], 1], ["AN", 3, 0, 5], ["AN", 3, 1, 6], ["FU", 2, [0, 1, 2, 3]], ["SP", 2, 0, 18966528, [1], 1], ["AN", 2, 0, 5], ["AN", 2, 1, 6], ["PR", 2, 0, "auto_unroll_max_step$64"]]]], "r": [[0.0515941], 0, 3.49591, 1639045533], "v": "v0.6"}
{"i": [["[\"pool_layer\", \"avg\", 128, 84, 83, 83, 3, 3, 2, \"SAME\"]", "rocm -keys=rocm,gpu -max_num_threads=256 -mcpu=gfx906 -mtriple=amdgcn-amd-amdhsa-hcc -thread_warp_size=64", [-1, 16, 64, 65536, 2147483647, 1024, 16, 64], "", 0, []], [[], [["CI", 1], ["FU", 3, [0, 1, 2, 3]], ["SP", 3, 0, 18966528, [27], 1], ["AN", 3, 0, 5], ["AN", 3, 1, 6], ["FU", 2, [0, 1, 2, 3]], ["SP", 2, 0, 18966528, [32], 1], ["AN", 2, 0, 5], ["AN", 2, 1, 6], ["PR", 2, 0, "auto_unroll_max_step$64"]]]], "r": [[0.00302561], 0, 3.69332, 1639045536], "v": "v0.6"}
{"i": [["[\"pool_layer\", \"avg\", 128, 84, 83, 83, 3, 3, 2, \"SAME\"]", "rocm -keys=rocm,gpu -max_num_threads=256 -mcpu=gfx906 -mtriple=amdgcn-amd-amdhsa-hcc -thread_warp_size=64", [-1, 16, 64, 65536, 2147483647, 1024, 16, 64], "", 0, []], [[], [["CI", 1], ["FU", 3, [0, 1, 2, 3]], ["SP", 3, 0, 18966528, [49], 1], ["AN", 3, 0, 5], ["AN", 3, 1, 6], ["FU", 2, [0, 1, 2, 3]], ["SP", 2, 0, 18966528, [56], 1], ["AN", 2, 0, 5], ["AN", 2, 1, 6], ["PR", 2, 0, "auto_unroll_max_step$16"]]]], "r": [[0.00178038], 0, 3.82773, 1639045540], "v": "v0.6"}
{"i": [["[\"pool_layer\", \"avg\", 128, 84, 83, 83, 3, 3, 2, \"SAME\"]", "rocm -keys=rocm,gpu -max_num_threads=256 -mcpu=gfx906 -mtriple=amdgcn-amd-amdhsa-hcc -thread_warp_size=64", [-1, 16, 64, 65536, 2147483647, 1024, 16, 64], "", 0, []], [[], [["CI", 1], ["FU", 3, [0, 1, 2, 3]], ["SP", 3, 0, 18966528, [64], 1], ["AN", 3, 0, 5], ["AN", 3, 1, 6], ["FU", 2, [0, 1, 2, 3]], ["SP", 2, 0, 18966528, [48], 1], ["AN", 2, 0, 5], ["AN", 2, 1, 6], ["PR", 2, 0, "auto_unroll_max_step$64"]]]], "r": [[0.00162948], 0, 3.7397, 1639045543], "v": "v0.6"}
{"i": [["[\"pool_layer\", \"avg\", 128, 84, 83, 83, 3, 3, 2, \"SAME\"]", "rocm -keys=rocm,gpu -max_num_threads=256 -mcpu=gfx906 -mtriple=amdgcn-amd-amdhsa-hcc -thread_warp_size=64", [-1, 16, 64, 65536, 2147483647, 1024, 16, 64], "", 0, []], [[], [["CI", 1], ["FU", 3, [0, 1, 2, 3]], ["SP", 3, 0, 18966528, [7], 1], ["AN", 3, 0, 5], ["AN", 3, 1, 6], ["FU", 2, [0, 1, 2, 3]], ["SP", 2, 0, 18966528, [16], 1], ["AN", 2, 0, 5], ["AN", 2, 1, 6], ["PR", 2, 0, "auto_unroll_max_step$16"]]]], "r": [[0.00908439], 0, 3.91056, 1639045547], "v": "v0.6"}
{"i": [["[\"pool_layer\", \"avg\", 128, 84, 83, 83, 3, 3, 2, \"SAME\"]", "rocm -keys=rocm,gpu -max_num_threads=256 -mcpu=gfx906 -mtriple=amdgcn-amd-amdhsa-hcc -thread_warp_size=64", [-1, 16, 64, 65536, 2147483647, 1024, 16, 64], "", 0, []], [[], [["CI", 1], ["FU", 3, [0, 1, 2, 3]], ["SP", 3, 0, 18966528, [4], 1], ["AN", 3, 0, 5], ["AN", 3, 1, 6], ["FU", 2, [0, 1, 2, 3]], ["SP", 2, 0, 18966528, [56], 1], ["AN", 2, 0, 5], ["AN", 2, 1, 6], ["PR", 2, 0, "auto_unroll_max_step$0"]]]], "r": [[0.0119344], 0, 3.4711, 1639045550], "v": "v0.6"}
{"i": [["[\"pool_layer\", \"avg\", 128, 84, 83, 83, 3, 3, 2, \"SAME\"]", "rocm -keys=rocm,gpu -max_num_threads=256 -mcpu=gfx906 -mtriple=amdgcn-amd-amdhsa-hcc -thread_warp_size=64", [-1, 16, 64, 65536, 2147483647, 1024, 16, 64], "", 0, []], [[], [["CI", 1], ["FU", 3, [0, 1, 2, 3]], ["SP", 3, 0, 18966528, [7], 1], ["AN", 3, 0, 5], ["AN", 3, 1, 6], ["FU", 2, [0, 1, 2, 3]], ["SP", 2, 0, 18966528, [32], 1], ["AN", 2, 0, 5], ["AN", 2, 1, 6], ["PR", 2, 0, "auto_unroll_max_step$0"]]]], "r": [[0.00770409], 0, 3.41179, 1639045553], "v": "v0.6"}
{"i": [["[\"pool_layer\", \"avg\", 128, 84, 83, 83, 3, 3, 2, \"SAME\"]", "rocm -keys=rocm,gpu -max_num_threads=256 -mcpu=gfx906 -mtriple=amdgcn-amd-amdhsa-hcc -thread_warp_size=64", [-1, 16, 64, 65536, 2147483647, 1024, 16, 64], "", 0, []], [[], [["CI", 1], ["FU", 3, [0, 1, 2, 3]], ["SP", 3, 0, 18966528, [9], 1], ["AN", 3, 0, 5], ["AN", 3, 1, 6], ["FU", 2, [0, 1, 2, 3]], ["SP", 2, 0, 18966528, [9], 1], ["AN", 2, 0, 5], ["AN", 2, 1, 6], ["PR", 2, 0, "auto_unroll_max_step$64"]]]], "r": [[0.00983122], 0, 3.44551, 1639045556], "v": "v0.6"}
{"i": [["[\"pool_layer\", \"avg\", 128, 84, 83, 83, 3, 3, 2, \"SAME\"]", "rocm -keys=rocm,gpu -max_num_threads=256 -mcpu=gfx906 -mtriple=amdgcn-amd-amdhsa-hcc -thread_warp_size=64", [-1, 16, 64, 65536, 2147483647, 1024, 16, 64], "", 0, []], [[], [["CI", 1], ["FU", 3, [0, 1, 2, 3]], ["SP", 3, 0, 18966528, [6], 1], ["AN", 3, 0, 5], ["AN", 3, 1, 6], ["FU", 2, [0, 1, 2, 3]], ["SP", 2, 0, 18966528, [9], 1], ["AN", 2, 0, 5], ["AN", 2, 1, 6], ["PR", 2, 0, "auto_unroll_max_step$0"]]]], "r": [[0.0122892], 0, 3.45082, 1639045559], "v": "v0.6"}
{"i": [["[\"pool_layer\", \"avg\", 128, 84, 83, 83, 3, 3, 2, \"SAME\"]", "rocm -keys=rocm,gpu -max_num_threads=256 -mcpu=gfx906 -mtriple=amdgcn-amd-amdhsa-hcc -thread_warp_size=64", [-1, 16, 64, 65536, 2147483647, 1024, 16, 64], "", 0, []], [[], [["CI", 1], ["FU", 3, [0, 1, 2, 3]], ["SP", 3, 0, 18966528, [8], 1], ["AN", 3, 0, 5], ["AN", 3, 1, 6], ["FU", 2, [0, 1, 2, 3]], ["SP", 2, 0, 18966528, [36], 1], ["AN", 2, 0, 5], ["AN", 2, 1, 6], ["PR", 2, 0, "auto_unroll_max_step$1024"]]]], "r": [[0.00676867], 0, 3.30342, 1639045562], "v": "v0.6"}
{"i": [["[\"pool_layer\", \"avg\", 128, 84, 83, 83, 3, 3, 2, \"SAME\"]", "rocm -keys=rocm,gpu -max_num_threads=256 -mcpu=gfx906 -mtriple=amdgcn-amd-amdhsa-hcc -thread_warp_size=64", [-1, 16, 64, 65536, 2147483647, 1024, 16, 64], "", 0, []], [[], [["CI", 1], ["FU", 3, [0, 1, 2, 3]], ["SP", 3, 0, 18966528, [42], 1], ["AN", 3, 0, 5], ["AN", 3, 1, 6], ["FU", 2, [0, 1, 2, 3]], ["SP", 2, 0, 18966528, [64], 1], ["AN", 2, 0, 5], ["AN", 2, 1, 6], ["PR", 2, 0, "auto_unroll_max_step$0"]]]], "r": [[0.00189581], 0, 3.67636, 1639045566], "v": "v0.6"}
{"i": [["[\"pool_layer\", \"avg\", 128, 84, 83, 83, 3, 3, 2, \"SAME\"]", "rocm -keys=rocm,gpu -max_num_threads=256 -mcpu=gfx906 -mtriple=amdgcn-amd-amdhsa-hcc -thread_warp_size=64", [-1, 16, 64, 65536, 2147483647, 1024, 16, 64], "", 0, []], [[], [["CI", 1], ["FU", 3, [0, 1, 2, 3]], ["SP", 3, 0, 18966528, [1], 1], ["AN", 3, 0, 5], ["AN", 3, 1, 6], ["FU", 2, [0, 1, 2, 3]], ["SP", 2, 0, 18966528, [12], 1], ["AN", 2, 0, 5], ["AN", 2, 1, 6], ["PR", 2, 0, "auto_unroll_max_step$64"]]]], "r": [[0.0479138], 0, 3.66379, 1639045569], "v": "v0.6"}
{"i": [["[\"pool_layer\", \"avg\", 128, 84, 83, 83, 3, 3, 2, \"SAME\"]", "rocm -keys=rocm,gpu -max_num_threads=256 -mcpu=gfx906 -mtriple=amdgcn-amd-amdhsa-hcc -thread_warp_size=64", [-1, 16, 64, 65536, 2147483647, 1024, 16, 64], "", 0, []], [[], [["CI", 1], ["FU", 3, [0, 1, 2, 3]], ["SP", 3, 0, 18966528, [4], 1], ["AN", 3, 0, 5], ["AN", 3, 1, 6], ["FU", 2, [0, 1, 2, 3]], ["SP", 2, 0, 18966528, [2], 1], ["AN", 2, 0, 5], ["AN", 2, 1, 6], ["PR", 2, 0, "auto_unroll_max_step$1024"]]]], "r": [[0.0331724], 0, 3.51323, 1639045572], "v": "v0.6"}
{"i": [["[\"pool_layer\", \"avg\", 128, 84, 83, 83, 3, 3, 2, \"SAME\"]", "rocm -keys=rocm,gpu -max_num_threads=256 -mcpu=gfx906 -mtriple=amdgcn-amd-amdhsa-hcc -thread_warp_size=64", [-1, 16, 64, 65536, 2147483647, 1024, 16, 64], "", 0, []], [[], [["CI", 1], ["FU", 3, [0, 1, 2, 3]], ["SP", 3, 0, 18966528, [2], 1], ["AN", 3, 0, 5], ["AN", 3, 1, 6], ["FU", 2, [0, 1, 2, 3]], ["SP", 2, 0, 18966528, [24], 1], ["AN", 2, 0, 5], ["AN", 2, 1, 6], ["PR", 2, 0, "auto_unroll_max_step$512"]]]], "r": [[0.0239606], 0, 3.49465, 1639045576], "v": "v0.6"}
{"i": [["[\"pool_layer\", \"avg\", 128, 84, 83, 83, 3, 3, 2, \"SAME\"]", "rocm -keys=rocm,gpu -max_num_threads=256 -mcpu=gfx906 -mtriple=amdgcn-amd-amdhsa-hcc -thread_warp_size=64", [-1, 16, 64, 65536, 2147483647, 1024, 16, 64], "", 0, []], [[], [["CI", 1], ["FU", 3, [0, 1, 2, 3]], ["SP", 3, 0, 18966528, [2], 1], ["AN", 3, 0, 5], ["AN", 3, 1, 6], ["FU", 2, [0, 1, 2, 3]], ["SP", 2, 0, 18966528, [1], 1], ["AN", 2, 0, 5], ["AN", 2, 1, 6], ["PR", 2, 0, "auto_unroll_max_step$0"]]]], "r": [[0.0663304], 0, 3.57817, 1639045579], "v": "v0.6"}
{"i": [["[\"pool_layer\", \"avg\", 128, 84, 83, 83, 3, 3, 2, \"SAME\"]", "rocm -keys=rocm,gpu -max_num_threads=256 -mcpu=gfx906 -mtriple=amdgcn-amd-amdhsa-hcc -thread_warp_size=64", [-1, 16, 64, 65536, 2147483647, 1024, 16, 64], "", 0, []], [[], [["CI", 1], ["FU", 3, [0, 1, 2, 3]], ["SP", 3, 0, 18966528, [1], 1], ["AN", 3, 0, 5], ["AN", 3, 1, 6], ["FU", 2, [0, 1, 2, 3]], ["SP", 2, 0, 18966528, [1], 1], ["AN", 2, 0, 5], ["AN", 2, 1, 6], ["PR", 2, 0, "auto_unroll_max_step$16"]]]], "r": [[0.0884488], 0, 3.82602, 1639045582], "v": "v0.6"}
{"i": [["[\"pool_layer\", \"avg\", 128, 84, 83, 83, 3, 3, 2, \"SAME\"]", "rocm -keys=rocm,gpu -max_num_threads=256 -mcpu=gfx906 -mtriple=amdgcn-amd-amdhsa-hcc -thread_warp_size=64", [-1, 16, 64, 65536, 2147483647, 1024, 16, 64], "", 0, []], [[], [["CI", 1], ["FU", 3, [0, 1, 2, 3]], ["SP", 3, 0, 18966528, [63], 1], ["AN", 3, 0, 5], ["AN", 3, 1, 6], ["FU", 2, [0, 1, 2, 3]], ["SP", 2, 0, 18966528, [64], 1], ["AN", 2, 0, 5], ["AN", 2, 1, 6], ["PR", 2, 0, "auto_unroll_max_step$512"]]]], "r": [[0.00154493], 0, 3.67078, 1639045586], "v": "v0.6"}
{"i": [["[\"pool_layer\", \"avg\", 128, 84, 83, 83, 3, 3, 2, \"SAME\"]", "rocm -keys=rocm,gpu -max_num_threads=256 -mcpu=gfx906 -mtriple=amdgcn-amd-amdhsa-hcc -thread_warp_size=64", [-1, 16, 64, 65536, 2147483647, 1024, 16, 64], "", 0, []], [[], [["CI", 1], ["FU", 3, [0, 1, 2, 3]], ["SP", 3, 0, 18966528, [54], 1], ["AN", 3, 0, 5], ["AN", 3, 1, 6], ["FU", 2, [0, 1, 2, 3]], ["SP", 2, 0, 18966528, [48], 1], ["AN", 2, 0, 5], ["AN", 2, 1, 6], ["PR", 2, 0, "auto_unroll_max_step$1024"]]]], "r": [[0.00175646], 0, 3.67778, 1639045589], "v": "v0.6"}
