artifacts/Table4/tvm/ansor/pooling/ansor_avg_pooling_128_672_11_11_3_3_1_SAME.log
{"i": [["[\"pool_layer\", \"avg\", 128, 672, 11, 11, 3, 3, 1, \"SAME\"]", "rocm -keys=rocm,gpu -max_num_threads=256 -mcpu=gfx906 -mtriple=amdgcn-amd-amdhsa-hcc -thread_warp_size=64", [-1, 16, 64, 65536, 2147483647, 1024, 16, 64], "", 0, []], [[], [["CI", 1], ["FU", 3, [0, 1, 2, 3]], ["SP", 3, 0, 10407936, [32], 1], ["AN", 3, 0, 5], ["AN", 3, 1, 6], ["FU", 2, [0, 1, 2, 3]], ["SP", 2, 0, 10407936, [64], 1], ["AN", 2, 0, 5], ["AN", 2, 1, 6], ["PR", 2, 0, "auto_unroll_max_step$1024"]]]], "r": [[0.00117079], 0, 2.05243, 1639048978], "v": "v0.6"}
{"i": [["[\"pool_layer\", \"avg\", 128, 672, 11, 11, 3, 3, 1, \"SAME\"]", "rocm -keys=rocm,gpu -max_num_threads=256 -mcpu=gfx906 -mtriple=amdgcn-amd-amdhsa-hcc -thread_warp_size=64", [-1, 16, 64, 65536, 2147483647, 1024, 16, 64], "", 0, []], [[], [["CI", 1], ["FU", 3, [0, 1, 2, 3]], ["SP", 3, 0, 10407936, [2], 1], ["AN", 3, 0, 5], ["AN", 3, 1, 6], ["FU", 2, [0, 1, 2, 3]], ["SP", 2, 0, 10407936, [2], 1], ["AN", 2, 0, 5], ["AN", 2, 1, 6], ["PR", 2, 0, "auto_unroll_max_step$64"]]]], "r": [[0.0249561], 0, 1.88185, 1639048980], "v": "v0.6"}
{"i": [["[\"pool_layer\", \"avg\", 128, 672, 11, 11, 3, 3, 1, \"SAME\"]", "rocm -keys=rocm,gpu -max_num_threads=256 -mcpu=gfx906 -mtriple=amdgcn-amd-amdhsa-hcc -thread_warp_size=64", [-1, 16, 64, 65536, 2147483647, 1024, 16, 64], "", 0, []], [[], [["CI", 1], ["FU", 3, [0, 1, 2, 3]], ["SP", 3, 0, 10407936, [8], 1], ["AN", 3, 0, 5], ["AN", 3, 1, 6], ["FU", 2, [0, 1, 2, 3]], ["SP", 2, 0, 10407936, [1], 1], ["AN", 2, 0, 5], ["AN", 2, 1, 6], ["PR", 2, 0, "auto_unroll_max_step$1024"]]]], "r": [[0.0281124], 0, 1.92857, 1639048981], "v": "v0.6"}
{"i": [["[\"pool_layer\", \"avg\", 128, 672, 11, 11, 3, 3, 1, \"SAME\"]", "rocm -keys=rocm,gpu -max_num_threads=256 -mcpu=gfx906 -mtriple=amdgcn-amd-amdhsa-hcc -thread_warp_size=64", [-1, 16, 64, 65536, 2147483647, 1024, 16, 64], "", 0, []], [[], [["CI", 1], ["FU", 3, [0, 1, 2, 3]], ["SP", 3, 0, 10407936, [64], 1], ["AN", 3, 0, 5], ["AN", 3, 1, 6], ["FU", 2, [0, 1, 2, 3]], ["SP", 2, 0, 10407936, [3], 1], ["AN", 2, 0, 5], ["AN", 2, 1, 6], ["PR", 2, 0, "auto_unroll_max_step$64"]]]], "r": [[0.00847233], 0, 1.66207, 1639048983], "v": "v0.6"}
{"i": [["[\"pool_layer\", \"avg\", 128, 672, 11, 11, 3, 3, 1, \"SAME\"]", "rocm -keys=rocm,gpu -max_num_threads=256 -mcpu=gfx906 -mtriple=amdgcn-amd-amdhsa-hcc -thread_warp_size=64", [-1, 16, 64, 65536, 2147483647, 1024, 16, 64], "", 0, []], [[], [["CI", 1], ["FU", 3, [0, 1, 2, 3]], ["SP", 3, 0, 10407936, [44], 1], ["AN", 3, 0, 5], ["AN", 3, 1, 6], ["FU", 2, [0, 1, 2, 3]], ["SP", 2, 0, 10407936, [8], 1], ["AN", 2, 0, 5], ["AN", 2, 1, 6], ["PR", 2, 0, "auto_unroll_max_step$64"]]]], "r": [[0.00365759], 0, 2.13847, 1639048984], "v": "v0.6"}
{"i": [["[\"pool_layer\", \"avg\", 128, 672, 11, 11, 3, 3, 1, \"SAME\"]", "rocm -keys=rocm,gpu -max_num_threads=256 -mcpu=gfx906 -mtriple=amdgcn-amd-amdhsa-hcc -thread_warp_size=64", [-1, 16, 64, 65536, 2147483647, 1024, 16, 64], "", 0, []], [[], [["CI", 1], ["FU", 3, [0, 1, 2, 3]], ["SP", 3, 0, 10407936, [8], 1], ["AN", 3, 0, 5], ["AN", 3, 1, 6], ["FU", 2, [0, 1, 2, 3]], ["SP", 2, 0, 10407936, [64], 1], ["AN", 2, 0, 5], ["AN", 2, 1, 6], ["PR", 2, 0, "auto_unroll_max_step$64"]]]], "r": [[0.00348342], 0, 2.31329, 1639048986], "v": "v0.6"}
{"i": [["[\"pool_layer\", \"avg\", 128, 672, 11, 11, 3, 3, 1, \"SAME\"]", "rocm -keys=rocm,gpu -max_num_threads=256 -mcpu=gfx906 -mtriple=amdgcn-amd-amdhsa-hcc -thread_warp_size=64", [-1, 16, 64, 65536, 2147483647, 1024, 16, 64], "", 0, []], [[], [["CI", 1], ["FU", 3, [0, 1, 2, 3]], ["SP", 3, 0, 10407936, [33], 1], ["AN", 3, 0, 5], ["AN", 3, 1, 6], ["FU", 2, [0, 1, 2, 3]], ["SP", 2, 0, 10407936, [1], 1], ["AN", 2, 0, 5], ["AN", 2, 1, 6], ["PR", 2, 0, "auto_unroll_max_step$0"]]]], "r": [[0.0257455], 0, 1.97857, 1639048988], "v": "v0.6"}
{"i": [["[\"pool_layer\", \"avg\", 128, 672, 11, 11, 3, 3, 1, \"SAME\"]", "rocm -keys=rocm,gpu -max_num_threads=256 -mcpu=gfx906 -mtriple=amdgcn-amd-amdhsa-hcc -thread_warp_size=64", [-1, 16, 64, 65536, 2147483647, 1024, 16, 64], "", 0, []], [[], [["CI", 1], ["FU", 3, [0, 1, 2, 3]], ["SP", 3, 0, 10407936, [64], 1], ["AN", 3, 0, 5], ["AN", 3, 1, 6], ["FU", 2, [0, 1, 2, 3]], ["SP", 2, 0, 10407936, [33], 1], ["AN", 2, 0, 5], ["AN", 2, 1, 6], ["PR", 2, 0, "auto_unroll_max_step$0"]]]], "r": [[0.00114528], 0, 2.19401, 1639048990], "v": "v0.6"}
{"i": [["[\"pool_layer\", \"avg\", 128, 672, 11, 11, 3, 3, 1, \"SAME\"]", "rocm -keys=rocm,gpu -max_num_threads=256 -mcpu=gfx906 -mtriple=amdgcn-amd-amdhsa-hcc -thread_warp_size=64", [-1, 16, 64, 65536, 2147483647, 1024, 16, 64], "", 0, []], [[], [["CI", 1], ["FU", 3, [0, 1, 2, 3]], ["SP", 3, 0, 10407936, [8], 1], ["AN", 3, 0, 5], ["AN", 3, 1, 6], ["FU", 2, [0, 1, 2, 3]], ["SP", 2, 0, 10407936, [32], 1], ["AN", 2, 0, 5], ["AN", 2, 1, 6], ["PR", 2, 0, "auto_unroll_max_step$64"]]]], "r": [[0.00386836], 0, 2.24835, 1639048992], "v": "v0.6"}
{"i": [["[\"pool_layer\", \"avg\", 128, 672, 11, 11, 3, 3, 1, \"SAME\"]", "rocm -keys=rocm,gpu -max_num_threads=256 -mcpu=gfx906 -mtriple=amdgcn-amd-amdhsa-hcc -thread_warp_size=64", [-1, 16, 64, 65536, 2147483647, 1024, 16, 64], "", 0, []], [[], [["CI", 1], ["FU", 3, [0, 1, 2, 3]], ["SP", 3, 0, 10407936, [16], 1], ["AN", 3, 0, 5], ["AN", 3, 1, 6], ["FU", 2, [0, 1, 2, 3]], ["SP", 2, 0, 10407936, [4], 1], ["AN", 2, 0, 5], ["AN", 2, 1, 6], ["PR", 2, 0, "auto_unroll_max_step$0"]]]], "r": [[0.00758838], 0, 1.77913, 1639048993], "v": "v0.6"}
{"i": [["[\"pool_layer\", \"avg\", 128, 672, 11, 11, 3, 3, 1, \"SAME\"]", "rocm -keys=rocm,gpu -max_num_threads=256 -mcpu=gfx906 -mtriple=amdgcn-amd-amdhsa-hcc -thread_warp_size=64", [-1, 16, 64, 65536, 2147483647, 1024, 16, 64], "", 0, []], [[], [["CI", 1], ["FU", 3, [0, 1, 2, 3]], ["SP", 3, 0, 10407936, [64], 1], ["AN", 3, 0, 5], ["AN", 3, 1, 6], ["FU", 2, [0, 1, 2, 3]], ["SP", 2, 0, 10407936, [2], 1], ["AN", 2, 0, 5], ["AN", 2, 1, 6], ["PR", 2, 0, "auto_unroll_max_step$512"]]]], "r": [[0.0125185], 0, 1.80967, 1639048994], "v": "v0.6"}
{"i": [["[\"pool_layer\", \"avg\", 128, 672, 11, 11, 3, 3, 1, \"SAME\"]", "rocm -keys=rocm,gpu -max_num_threads=256 -mcpu=gfx906 -mtriple=amdgcn-amd-amdhsa-hcc -thread_warp_size=64", [-1, 16, 64, 65536, 2147483647, 1024, 16, 64], "", 0, []], [[], [["CI", 1], ["FU", 3, [0, 1, 2, 3]], ["SP", 3, 0, 10407936, [4], 1], ["AN", 3, 0, 5], ["AN", 3, 1, 6], ["FU", 2, [0, 1, 2, 3]], ["SP", 2, 0, 10407936, [8], 1], ["AN", 2, 0, 5], ["AN", 2, 1, 6], ["PR", 2, 0, "auto_unroll_max_step$512"]]]], "r": [[0.00910548], 0, 1.76064, 1639048996], "v": "v0.6"}
{"i": [["[\"pool_layer\", \"avg\", 128, 672, 11, 11, 3, 3, 1, \"SAME\"]", "rocm -keys=rocm,gpu -max_num_threads=256 -mcpu=gfx906 -mtriple=amdgcn-amd-amdhsa-hcc -thread_warp_size=64", [-1, 16, 64, 65536, 2147483647, 1024, 16, 64], "", 0, []], [[], [["CI", 1], ["FU", 3, [0, 1, 2, 3]], ["SP", 3, 0, 10407936, [16], 1], ["AN", 3, 0, 5], ["AN", 3, 1, 6], ["FU", 2, [0, 1, 2, 3]], ["SP", 2, 0, 10407936, [64], 1], ["AN", 2, 0, 5], ["AN", 2, 1, 6], ["PR", 2, 0, "auto_unroll_max_step$16"]]]], "r": [[0.00194342], 0, 2.12907, 1639048998], "v": "v0.6"}
{"i": [["[\"pool_layer\", \"avg\", 128, 672, 11, 11, 3, 3, 1, \"SAME\"]", "rocm -keys=rocm,gpu -max_num_threads=256 -mcpu=gfx906 -mtriple=amdgcn-amd-amdhsa-hcc -thread_warp_size=64", [-1, 16, 64, 65536, 2147483647, 1024, 16, 64], "", 0, []], [[], [["CI", 1], ["FU", 3, [0, 1, 2, 3]], ["SP", 3, 0, 10407936, [24], 1], ["AN", 3, 0, 5], ["AN", 3, 1, 6], ["FU", 2, [0, 1, 2, 3]], ["SP", 2, 0, 10407936, [16], 1], ["AN", 2, 0, 5], ["AN", 2, 1, 6], ["PR", 2, 0, "auto_unroll_max_step$512"]]]], "r": [[0.00258295], 0, 2.16152, 1639048999], "v": "v0.6"}
{"i": [["[\"pool_layer\", \"avg\", 128, 672, 11, 11, 3, 3, 1, \"SAME\"]", "rocm -keys=rocm,gpu -max_num_threads=256 -mcpu=gfx906 -mtriple=amdgcn-amd-amdhsa-hcc -thread_warp_size=64", [-1, 16, 64, 65536, 2147483647, 1024, 16, 64], "", 0, []], [[], [["CI", 1], ["FU", 3, [0, 1, 2, 3]], ["SP", 3, 0, 10407936, [64], 1], ["AN", 3, 0, 5], ["AN", 3, 1, 6], ["FU", 2, [0, 1, 2, 3]], ["SP", 2, 0, 10407936, [56], 1], ["AN", 2, 0, 5], ["AN", 2, 1, 6], ["PR", 2, 0, "auto_unroll_max_step$0"]]]], "r": [[0.000837191], 0, 2.0944, 1639049001], "v": "v0.6"}
{"i": [["[\"pool_layer\", \"avg\", 128, 672, 11, 11, 3, 3, 1, \"SAME\"]", "rocm -keys=rocm,gpu -max_num_threads=256 -mcpu=gfx906 -mtriple=amdgcn-amd-amdhsa-hcc -thread_warp_size=64", [-1, 16, 64, 65536, 2147483647, 1024, 16, 64], "", 0, []], [[], [["CI", 1], ["FU", 3, [0, 1, 2, 3]], ["SP", 3, 0, 10407936, [16], 1], ["AN", 3, 0, 5], ["AN", 3, 1, 6], ["FU", 2, [0, 1, 2, 3]], ["SP", 2, 0, 10407936, [8], 1], ["AN", 2, 0, 5], ["AN", 2, 1, 6], ["PR", 2, 0, "auto_unroll_max_step$0"]]]], "r": [[0.00464038], 0, 2.27035, 1639049003], "v": "v0.6"}
{"i": [["[\"pool_layer\", \"avg\", 128, 672, 11, 11, 3, 3, 1, \"SAME\"]", "rocm -keys=rocm,gpu -max_num_threads=256 -mcpu=gfx906 -mtriple=amdgcn-amd-amdhsa-hcc -thread_warp_size=64", [-1, 16, 64, 65536, 2147483647, 1024, 16, 64], "", 0, []], [[], [["CI", 1], ["FU", 3, [0, 1, 2, 3]], ["SP", 3, 0, 10407936, [4], 1], ["AN", 3, 0, 5], ["AN", 3, 1, 6], ["FU", 2, [0, 1, 2, 3]], ["SP", 2, 0, 10407936, [2], 1], ["AN", 2, 0, 5], ["AN", 2, 1, 6], ["PR", 2, 0, "auto_unroll_max_step$16"]]]], "r": [[0.0182065], 0, 1.85198, 1639049005], "v": "v0.6"}
{"i": [["[\"pool_layer\", \"avg\", 128, 672, 11, 11, 3, 3, 1, \"SAME\"]", "rocm -keys=rocm,gpu -max_num_threads=256 -mcpu=gfx906 -mtriple=amdgcn-amd-amdhsa-hcc -thread_warp_size=64", [-1, 16, 64, 65536, 2147483647, 1024, 16, 64], "", 0, []], [[], [["CI", 1], ["FU", 3, [0, 1, 2, 3]], ["SP", 3, 0, 10407936, [64], 1], ["AN", 3, 0, 5], ["AN", 3, 1, 6], ["FU", 2, [0, 1, 2, 3]], ["SP", 2, 0, 10407936, [28], 1], ["AN", 2, 0, 5], ["AN", 2, 1, 6], ["PR", 2, 0, "auto_unroll_max_step$64"]]]], "r": [[0.00127843], 0, 2.17839, 1639049006], "v": "v0.6"}
{"i": [["[\"pool_layer\", \"avg\", 128, 672, 11, 11, 3, 3, 1, \"SAME\"]", "rocm -keys=rocm,gpu -max_num_threads=256 -mcpu=gfx906 -mtriple=amdgcn-amd-amdhsa-hcc -thread_warp_size=64", [-1, 16, 64, 65536, 2147483647, 1024, 16, 64], "", 0, []], [[], [["CI", 1], ["FU", 3, [0, 1, 2, 3]], ["SP", 3, 0, 10407936, [16], 1], ["AN", 3, 0, 5], ["AN", 3, 1, 6], ["FU", 2, [0, 1, 2, 3]], ["SP", 2, 0, 10407936, [64], 1], ["AN", 2, 0, 5], ["AN", 2, 1, 6], ["PR", 2, 0, "auto_unroll_max_step$1024"]]]], "r": [[0.00194349], 0, 2.14774, 1639049008], "v": "v0.6"}
{"i": [["[\"pool_layer\", \"avg\", 128, 672, 11, 11, 3, 3, 1, \"SAME\"]", "rocm -keys=rocm,gpu -max_num_threads=256 -mcpu=gfx906 -mtriple=amdgcn-amd-amdhsa-hcc -thread_warp_size=64", [-1, 16, 64, 65536, 2147483647, 1024, 16, 64], "", 0, []], [[], [["CI", 1], ["FU", 3, [0, 1, 2, 3]], ["SP", 3, 0, 10407936, [12], 1], ["AN", 3, 0, 5], ["AN", 3, 1, 6], ["FU", 2, [0, 1, 2, 3]], ["SP", 2, 0, 10407936, [4], 1], ["AN", 2, 0, 5], ["AN", 2, 1, 6], ["PR", 2, 0, "auto_unroll_max_step$16"]]]], "r": [[0.0082433], 0, 2.2505, 1639049010], "v": "v0.6"}
{"i": [["[\"pool_layer\", \"avg\", 128, 672, 11, 11, 3, 3, 1, \"SAME\"]", "rocm -keys=rocm,gpu -max_num_threads=256 -mcpu=gfx906 -mtriple=amdgcn-amd-amdhsa-hcc -thread_warp_size=64", [-1, 16, 64, 65536, 2147483647, 1024, 16, 64], "", 0, []], [[], [["CI", 1], ["FU", 3, [0, 1, 2, 3]], ["SP", 3, 0, 10407936, [32], 1], ["AN", 3, 0, 5], ["AN", 3, 1, 6], ["FU", 2, [0, 1, 2, 3]], ["SP", 2, 0, 10407936, [4], 1], ["AN", 2, 0, 5], ["AN", 2, 1, 6], ["PR", 2, 0, "auto_unroll_max_step$64"]]]], "r": [[0.00683006], 0, 1.77195, 1639049012], "v": "v0.6"}
{"i": [["[\"pool_layer\", \"avg\", 128, 672, 11, 11, 3, 3, 1, \"SAME\"]", "rocm -keys=rocm,gpu -max_num_threads=256 -mcpu=gfx906 -mtriple=amdgcn-amd-amdhsa-hcc -thread_warp_size=64", [-1, 16, 64, 65536, 2147483647, 1024, 16, 64], "", 0, []], [[], [["CI", 1], ["FU", 3, [0, 1, 2, 3]], ["SP", 3, 0, 10407936, [64], 1], ["AN", 3, 0, 5], ["AN", 3, 1, 6], ["FU", 2, [0, 1, 2, 3]], ["SP", 2, 0, 10407936, [1], 1], ["AN", 2, 0, 5], ["AN", 2, 1, 6], ["PR", 2, 0, "auto_unroll_max_step$0"]]]], "r": [[0.0253278], 0, 1.87822, 1639049013], "v": "v0.6"}
{"i": [["[\"pool_layer\", \"avg\", 128, 672, 11, 11, 3, 3, 1, \"SAME\"]", "rocm -keys=rocm,gpu -max_num_threads=256 -mcpu=gfx906 -mtriple=amdgcn-amd-amdhsa-hcc -thread_warp_size=64", [-1, 16, 64, 65536, 2147483647, 1024, 16, 64], "", 0, []], [[], [["CI", 1], ["FU", 3, [0, 1, 2, 3]], ["SP", 3, 0, 10407936, [8], 1], ["AN", 3, 0, 5], ["AN", 3, 1, 6], ["FU", 2, [0, 1, 2, 3]], ["SP", 2, 0, 10407936, [16], 1], ["AN", 2, 0, 5], ["AN", 2, 1, 6], ["PR", 2, 0, "auto_unroll_max_step$64"]]]], "r": [[0.00455506], 0, 1.7266, 1639049014], "v": "v0.6"}
{"i": [["[\"pool_layer\", \"avg\", 128, 672, 11, 11, 3, 3, 1, \"SAME\"]", "rocm -keys=rocm,gpu -max_num_threads=256 -mcpu=gfx906 -mtriple=amdgcn-amd-amdhsa-hcc -thread_warp_size=64", [-1, 16, 64, 65536, 2147483647, 1024, 16, 64], "", 0, []], [[], [["CI", 1], ["FU", 3, [0, 1, 2, 3]], ["SP", 3, 0, 10407936, [48], 1], ["AN", 3, 0, 5], ["AN", 3, 1, 6], ["FU", 2, [0, 1, 2, 3]], ["SP", 2, 0, 10407936, [8], 1], ["AN", 2, 0, 5], ["AN", 2, 1, 6], ["PR", 2, 0, "auto_unroll_max_step$16"]]]], "r": [[0.00360749], 0, 2.08517, 1639049016], "v": "v0.6"}
{"i": [["[\"pool_layer\", \"avg\", 128, 672, 11, 11, 3, 3, 1, \"SAME\"]", "rocm -keys=rocm,gpu -max_num_threads=256 -mcpu=gfx906 -mtriple=amdgcn-amd-amdhsa-hcc -thread_warp_size=64", [-1, 16, 64, 65536, 2147483647, 1024, 16, 64], "", 0, []], [[], [["CI", 1], ["FU", 3, [0, 1, 2, 3]], ["SP", 3, 0, 10407936, [64], 1], ["AN", 3, 0, 5], ["AN", 3, 1, 6], ["FU", 2, [0, 1, 2, 3]], ["SP", 2, 0, 10407936, [48], 1], ["AN", 2, 0, 5], ["AN", 2, 1, 6], ["PR", 2, 0, "auto_unroll_max_step$0"]]]], "r": [[0.00091189], 0, 2.02558, 1639049018], "v": "v0.6"}
{"i": [["[\"pool_layer\", \"avg\", 128, 672, 11, 11, 3, 3, 1, \"SAME\"]", "rocm -keys=rocm,gpu -max_num_threads=256 -mcpu=gfx906 -mtriple=amdgcn-amd-amdhsa-hcc -thread_warp_size=64", [-1, 16, 64, 65536, 2147483647, 1024, 16, 64], "", 0, []], [[], [["CI", 1], ["FU", 3, [0, 1, 2, 3]], ["SP", 3, 0, 10407936, [64], 1], ["AN", 3, 0, 5], ["AN", 3, 1, 6], ["FU", 2, [0, 1, 2, 3]], ["SP", 2, 0, 10407936, [32], 1], ["AN", 2, 0, 5], ["AN", 2, 1, 6], ["PR", 2, 0, "auto_unroll_max_step$0"]]]], "r": [[0.00116859], 0, 2.08293, 1639049020], "v": "v0.6"}
{"i": [["[\"pool_layer\", \"avg\", 128, 672, 11, 11, 3, 3, 1, \"SAME\"]", "rocm -keys=rocm,gpu -max_num_threads=256 -mcpu=gfx906 -mtriple=amdgcn-amd-amdhsa-hcc -thread_warp_size=64", [-1, 16, 64, 65536, 2147483647, 1024, 16, 64], "", 0, []], [[], [["CI", 1], ["FU", 3, [0, 1, 2, 3]], ["SP", 3, 0, 10407936, [24], 1], ["AN", 3, 0, 5], ["AN", 3, 1, 6], ["FU", 2, [0, 1, 2, 3]], ["SP", 2, 0, 10407936, [4], 1], ["AN", 2, 0, 5], ["AN", 2, 1, 6], ["PR", 2, 0, "auto_unroll_max_step$512"]]]], "r": [[0.00721161], 0, 2.24748, 1639049022], "v": "v0.6"}
{"i": [["[\"pool_layer\", \"avg\", 128, 672, 11, 11, 3, 3, 1, \"SAME\"]", "rocm -keys=rocm,gpu -max_num_threads=256 -mcpu=gfx906 -mtriple=amdgcn-amd-amdhsa-hcc -thread_warp_size=64", [-1, 16, 64, 65536, 2147483647, 1024, 16, 64], "", 0, []], [[], [["CI", 1], ["FU", 3, [0, 1, 2, 3]], ["SP", 3, 0, 10407936, [64], 1], ["AN", 3, 0, 5], ["AN", 3, 1, 6], ["FU", 2, [0, 1, 2, 3]], ["SP", 2, 0, 10407936, [24], 1], ["AN", 2, 0, 5], ["AN", 2, 1, 6], ["PR", 2, 0, "auto_unroll_max_step$16"]]]], "r": [[0.00142862], 0, 2.12615, 1639049023], "v": "v0.6"}
{"i": [["[\"pool_layer\", \"avg\", 128, 672, 11, 11, 3, 3, 1, \"SAME\"]", "rocm -keys=rocm,gpu -max_num_threads=256 -mcpu=gfx906 -mtriple=amdgcn-amd-amdhsa-hcc -thread_warp_size=64", [-1, 16, 64, 65536, 2147483647, 1024, 16, 64], "", 0, []], [[], [["CI", 1], ["FU", 3, [0, 1, 2, 3]], ["SP", 3, 0, 10407936, [16], 1], ["AN", 3, 0, 5], ["AN", 3, 1, 6], ["FU", 2, [0, 1, 2, 3]], ["SP", 2, 0, 10407936, [8], 1], ["AN", 2, 0, 5], ["AN", 2, 1, 6], ["PR", 2, 0, "auto_unroll_max_step$512"]]]], "r": [[0.00455383], 0, 1.72627, 1639049025], "v": "v0.6"}
{"i": [["[\"pool_layer\", \"avg\", 128, 672, 11, 11, 3, 3, 1, \"SAME\"]", "rocm -keys=rocm,gpu -max_num_threads=256 -mcpu=gfx906 -mtriple=amdgcn-amd-amdhsa-hcc -thread_warp_size=64", [-1, 16, 64, 65536, 2147483647, 1024, 16, 64], "", 0, []], [[], [["CI", 1], ["FU", 3, [0, 1, 2, 3]], ["SP", 3, 0, 10407936, [4], 1], ["AN", 3, 0, 5], ["AN", 3, 1, 6], ["FU", 2, [0, 1, 2, 3]], ["SP", 2, 0, 10407936, [64], 1], ["AN", 2, 0, 5], ["AN", 2, 1, 6], ["PR", 2, 0, "auto_unroll_max_step$1024"]]]], "r": [[0.006452], 0, 1.79909, 1639049026], "v": "v0.6"}
{"i": [["[\"pool_layer\", \"avg\", 128, 672, 11, 11, 3, 3, 1, \"SAME\"]", "rocm -keys=rocm,gpu -max_num_threads=256 -mcpu=gfx906 -mtriple=amdgcn-amd-amdhsa-hcc -thread_warp_size=64", [-1, 16, 64, 65536, 2147483647, 1024, 16, 64], "", 0, []], [[], [["CI", 1], ["FU", 3, [0, 1, 2, 3]], ["SP", 3, 0, 10407936, [3], 1], ["AN", 3, 0, 5], ["AN", 3, 1, 6], ["FU", 2, [0, 1, 2, 3]], ["SP", 2, 0, 10407936, [8], 1], ["AN", 2, 0, 5], ["AN", 2, 1, 6], ["PR", 2, 0, "auto_unroll_max_step$16"]]]], "r": [[0.0111273], 0, 1.78148, 1639049028], "v": "v0.6"}
{"i": [["[\"pool_layer\", \"avg\", 128, 672, 11, 11, 3, 3, 1, \"SAME\"]", "rocm -keys=rocm,gpu -max_num_threads=256 -mcpu=gfx906 -mtriple=amdgcn-amd-amdhsa-hcc -thread_warp_size=64", [-1, 16, 64, 65536, 2147483647, 1024, 16, 64], "", 0, []], [[], [["CI", 1], ["FU", 3, [0, 1, 2, 3]], ["SP", 3, 0, 10407936, [16], 1], ["AN", 3, 0, 5], ["AN", 3, 1, 6], ["FU", 2, [0, 1, 2, 3]], ["SP", 2, 0, 10407936, [8], 1], ["AN", 2, 0, 5], ["AN", 2, 1, 6], ["PR", 2, 0, "auto_unroll_max_step$64"]]]], "r": [[0.00455403], 0, 1.76027, 1639049029], "v": "v0.6"}
{"i": [["[\"pool_layer\", \"avg\", 128, 672, 11, 11, 3, 3, 1, \"SAME\"]", "rocm -keys=rocm,gpu -max_num_threads=256 -mcpu=gfx906 -mtriple=amdgcn-amd-amdhsa-hcc -thread_warp_size=64", [-1, 16, 64, 65536, 2147483647, 1024, 16, 64], "", 0, []], [[], [["CI", 1], ["FU", 3, [0, 1, 2, 3]], ["SP", 3, 0, 10407936, [32], 1], ["AN", 3, 0, 5], ["AN", 3, 1, 6], ["FU", 2, [0, 1, 2, 3]], ["SP", 2, 0, 10407936, [1], 1], ["AN", 2, 0, 5], ["AN", 2, 1, 6], ["PR", 2, 0, "auto_unroll_max_step$64"]]]], "r": [[0.0250325], 0, 1.81387, 1639049030], "v": "v0.6"}
{"i": [["[\"pool_layer\", \"avg\", 128, 672, 11, 11, 3, 3, 1, \"SAME\"]", "rocm -keys=rocm,gpu -max_num_threads=256 -mcpu=gfx906 -mtriple=amdgcn-amd-amdhsa-hcc -thread_warp_size=64", [-1, 16, 64, 65536, 2147483647, 1024, 16, 64], "", 0, []], [[], [["CI", 1], ["FU", 3, [0, 1, 2, 3]], ["SP", 3, 0, 10407936, [1], 1], ["AN", 3, 0, 5], ["AN", 3, 1, 6], ["FU", 2, [0, 1, 2, 3]], ["SP", 2, 0, 10407936, [64], 1], ["AN", 2, 0, 5], ["AN", 2, 1, 6], ["PR", 2, 0, "auto_unroll_max_step$16"]]]], "r": [[0.0253315], 0, 1.88609, 1639049032], "v": "v0.6"}
{"i": [["[\"pool_layer\", \"avg\", 128, 672, 11, 11, 3, 3, 1, \"SAME\"]", "rocm -keys=rocm,gpu -max_num_threads=256 -mcpu=gfx906 -mtriple=amdgcn-amd-amdhsa-hcc -thread_warp_size=64", [-1, 16, 64, 65536, 2147483647, 1024, 16, 64], "", 0, []], [[], [["CI", 1], ["FU", 3, [0, 1, 2, 3]], ["SP", 3, 0, 10407936, [64], 1], ["AN", 3, 0, 5], ["AN", 3, 1, 6], ["FU", 2, [0, 1, 2, 3]], ["SP", 2, 0, 10407936, [2], 1], ["AN", 2, 0, 5], ["AN", 2, 1, 6], ["PR", 2, 0, "auto_unroll_max_step$1024"]]]], "r": [[0.0125184], 0, 1.74938, 1639049033], "v": "v0.6"}
{"i": [["[\"pool_layer\", \"avg\", 128, 672, 11, 11, 3, 3, 1, \"SAME\"]", "rocm -keys=rocm,gpu -max_num_threads=256 -mcpu=gfx906 -mtriple=amdgcn-amd-amdhsa-hcc -thread_warp_size=64", [-1, 16, 64, 65536, 2147483647, 1024, 16, 64], "", 0, []], [[], [["CI", 1], ["FU", 3, [0, 1, 2, 3]], ["SP", 3, 0, 10407936, [4], 1], ["AN", 3, 0, 5], ["AN", 3, 1, 6], ["FU", 2, [0, 1, 2, 3]], ["SP", 2, 0, 10407936, [16], 1], ["AN", 2, 0, 5], ["AN", 2, 1, 6], ["PR", 2, 0, "auto_unroll_max_step$64"]]]], "r": [[0.00758864], 0, 1.76152, 1639049035], "v": "v0.6"}
{"i": [["[\"pool_layer\", \"avg\", 128, 672, 11, 11, 3, 3, 1, \"SAME\"]", "rocm -keys=rocm,gpu -max_num_threads=256 -mcpu=gfx906 -mtriple=amdgcn-amd-amdhsa-hcc -thread_warp_size=64", [-1, 16, 64, 65536, 2147483647, 1024, 16, 64], "", 0, []], [[], [["CI", 1], ["FU", 3, [0, 1, 2, 3]], ["SP", 3, 0, 10407936, [8], 1], ["AN", 3, 0, 5], ["AN", 3, 1, 6], ["FU", 2, [0, 1, 2, 3]], ["SP", 2, 0, 10407936, [64], 1], ["AN", 2, 0, 5], ["AN", 2, 1, 6], ["PR", 2, 0, "auto_unroll_max_step$16"]]]], "r": [[0.00348351], 0, 2.23106, 1639049037], "v": "v0.6"}
{"i": [["[\"pool_layer\", \"avg\", 128, 672, 11, 11, 3, 3, 1, \"SAME\"]", "rocm -keys=rocm,gpu -max_num_threads=256 -mcpu=gfx906 -mtriple=amdgcn-amd-amdhsa-hcc -thread_warp_size=64", [-1, 16, 64, 65536, 2147483647, 1024, 16, 64], "", 0, []], [[], [["CI", 1], ["FU", 3, [0, 1, 2, 3]], ["SP", 3, 0, 10407936, [2], 1], ["AN", 3, 0, 5], ["AN", 3, 1, 6], ["FU", 2, [0, 1, 2, 3]], ["SP", 2, 0, 10407936, [8], 1], ["AN", 2, 0, 5], ["AN", 2, 1, 6], ["PR", 2, 0, "auto_unroll_max_step$512"]]]], "r": [[0.0156092], 0, 1.88106, 1639049038], "v": "v0.6"}
{"i": [["[\"pool_layer\", \"avg\", 128, 672, 11, 11, 3, 3, 1, \"SAME\"]", "rocm -keys=rocm,gpu -max_num_threads=256 -mcpu=gfx906 -mtriple=amdgcn-amd-amdhsa-hcc -thread_warp_size=64", [-1, 16, 64, 65536, 2147483647, 1024, 16, 64], "", 0, []], [[], [["CI", 1], ["FU", 3, [0, 1, 2, 3]], ["SP", 3, 0, 10407936, [8], 1], ["AN", 3, 0, 5], ["AN", 3, 1, 6], ["FU", 2, [0, 1, 2, 3]], ["SP", 2, 0, 10407936, [16], 1], ["AN", 2, 0, 5], ["AN", 2, 1, 6], ["PR", 2, 0, "auto_unroll_max_step$1024"]]]], "r": [[0.00464144], 0, 2.22186, 1639049040], "v": "v0.6"}
{"i": [["[\"pool_layer\", \"avg\", 128, 672, 11, 11, 3, 3, 1, \"SAME\"]", "rocm -keys=rocm,gpu -max_num_threads=256 -mcpu=gfx906 -mtriple=amdgcn-amd-amdhsa-hcc -thread_warp_size=64", [-1, 16, 64, 65536, 2147483647, 1024, 16, 64], "", 0, []], [[], [["CI", 1], ["FU", 3, [0, 1, 2, 3]], ["SP", 3, 0, 10407936, [16], 1], ["AN", 3, 0, 5], ["AN", 3, 1, 6], ["FU", 2, [0, 1, 2, 3]], ["SP", 2, 0, 10407936, [16], 1], ["AN", 2, 0, 5], ["AN", 2, 1, 6], ["PR", 2, 0, "auto_unroll_max_step$512"]]]], "r": [[0.00309792], 0, 2.18199, 1639049042], "v": "v0.6"}
{"i": [["[\"pool_layer\", \"avg\", 128, 672, 11, 11, 3, 3, 1, \"SAME\"]", "rocm -keys=rocm,gpu -max_num_threads=256 -mcpu=gfx906 -mtriple=amdgcn-amd-amdhsa-hcc -thread_warp_size=64", [-1, 16, 64, 65536, 2147483647, 1024, 16, 64], "", 0, []], [[], [["CI", 1], ["FU", 3, [0, 1, 2, 3]], ["SP", 3, 0, 10407936, [4], 1], ["AN", 3, 0, 5], ["AN", 3, 1, 6], ["FU", 2, [0, 1, 2, 3]], ["SP", 2, 0, 10407936, [64], 1], ["AN", 2, 0, 5], ["AN", 2, 1, 6], ["PR", 2, 0, "auto_unroll_max_step$512"]]]], "r": [[0.0064514], 0, 1.72808, 1639049043], "v": "v0.6"}
{"i": [["[\"pool_layer\", \"avg\", 128, 672, 11, 11, 3, 3, 1, \"SAME\"]", "rocm -keys=rocm,gpu -max_num_threads=256 -mcpu=gfx906 -mtriple=amdgcn-amd-amdhsa-hcc -thread_warp_size=64", [-1, 16, 64, 65536, 2147483647, 1024, 16, 64], "", 0, []], [[], [["CI", 1], ["FU", 3, [0, 1, 2, 3]], ["SP", 3, 0, 10407936, [1], 1], ["AN", 3, 0, 5], ["AN", 3, 1, 6], ["FU", 2, [0, 1, 2, 3]], ["SP", 2, 0, 10407936, [2], 1], ["AN", 2, 0, 5], ["AN", 2, 1, 6], ["PR", 2, 0, "auto_unroll_max_step$0"]]]], "r": [[0.0373912], 0, 1.85401, 1639049045], "v": "v0.6"}
{"i": [["[\"pool_layer\", \"avg\", 128, 672, 11, 11, 3, 3, 1, \"SAME\"]", "rocm -keys=rocm,gpu -max_num_threads=256 -mcpu=gfx906 -mtriple=amdgcn-amd-amdhsa-hcc -thread_warp_size=64", [-1, 16, 64, 65536, 2147483647, 1024, 16, 64], "", 0, []], [[], [["CI", 1], ["FU", 3, [0, 1, 2, 3]], ["SP", 3, 0, 10407936, [8], 1], ["AN", 3, 0, 5], ["AN", 3, 1, 6], ["FU", 2, [0, 1, 2, 3]], ["SP", 2, 0, 10407936, [1], 1], ["AN", 2, 0, 5], ["AN", 2, 1, 6], ["PR", 2, 0, "auto_unroll_max_step$16"]]]], "r": [[0.02811], 0, 1.86989, 1639049046], "v": "v0.6"}
{"i": [["[\"pool_layer\", \"avg\", 128, 672, 11, 11, 3, 3, 1, \"SAME\"]", "rocm -keys=rocm,gpu -max_num_threads=256 -mcpu=gfx906 -mtriple=amdgcn-amd-amdhsa-hcc -thread_warp_size=64", [-1, 16, 64, 65536, 2147483647, 1024, 16, 64], "", 0, []], [[], [["CI", 1], ["FU", 3, [0, 1, 2, 3]], ["SP", 3, 0, 10407936, [1], 1], ["AN", 3, 0, 5], ["AN", 3, 1, 6], ["FU", 2, [0, 1, 2, 3]], ["SP", 2, 0, 10407936, [2], 1], ["AN", 2, 0, 5], ["AN", 2, 1, 6], ["PR", 2, 0, "auto_unroll_max_step$64"]]]], "r": [[0.0374069], 0, 1.87265, 1639049048], "v": "v0.6"}
{"i": [["[\"pool_layer\", \"avg\", 128, 672, 11, 11, 3, 3, 1, \"SAME\"]", "rocm -keys=rocm,gpu -max_num_threads=256 -mcpu=gfx906 -mtriple=amdgcn-amd-amdhsa-hcc -thread_warp_size=64", [-1, 16, 64, 65536, 2147483647, 1024, 16, 64], "", 0, []], [[], [["CI", 1], ["FU", 3, [0, 1, 2, 3]], ["SP", 3, 0, 10407936, [48], 1], ["AN", 3, 0, 5], ["AN", 3, 1, 6], ["FU", 2, [0, 1, 2, 3]], ["SP", 2, 0, 10407936, [16], 1], ["AN", 2, 0, 5], ["AN", 2, 1, 6], ["PR", 2, 0, "auto_unroll_max_step$64"]]]], "r": [[0.00207168], 0, 2.11651, 1639049050], "v": "v0.6"}
{"i": [["[\"pool_layer\", \"avg\", 128, 672, 11, 11, 3, 3, 1, \"SAME\"]", "rocm -keys=rocm,gpu -max_num_threads=256 -mcpu=gfx906 -mtriple=amdgcn-amd-amdhsa-hcc -thread_warp_size=64", [-1, 16, 64, 65536, 2147483647, 1024, 16, 64], "", 0, []], [[], [["CI", 1], ["FU", 3, [0, 1, 2, 3]], ["SP", 3, 0, 10407936, [16], 1], ["AN", 3, 0, 5], ["AN", 3, 1, 6], ["FU", 2, [0, 1, 2, 3]], ["SP", 2, 0, 10407936, [2], 1], ["AN", 2, 0, 5], ["AN", 2, 1, 6], ["PR", 2, 0, "auto_unroll_max_step$512"]]]], "r": [[0.0136563], 0, 1.72129, 1639049051], "v": "v0.6"}
{"i": [["[\"pool_layer\", \"avg\", 128, 672, 11, 11, 3, 3, 1, \"SAME\"]", "rocm -keys=rocm,gpu -max_num_threads=256 -mcpu=gfx906 -mtriple=amdgcn-amd-amdhsa-hcc -thread_warp_size=64", [-1, 16, 64, 65536, 2147483647, 1024, 16, 64], "", 0, []], [[], [["CI", 1], ["FU", 3, [0, 1, 2, 3]], ["SP", 3, 0, 10407936, [64], 1], ["AN", 3, 0, 5], ["AN", 3, 1, 6], ["FU", 2, [0, 1, 2, 3]], ["SP", 2, 0, 10407936, [16], 1], ["AN", 2, 0, 5], ["AN", 2, 1, 6], ["PR", 2, 0, "auto_unroll_max_step$64"]]]], "r": [[0.00193951], 0, 2.06752, 1639049053], "v": "v0.6"}
{"i": [["[\"pool_layer\", \"avg\", 128, 672, 11, 11, 3, 3, 1, \"SAME\"]", "rocm -keys=rocm,gpu -max_num_threads=256 -mcpu=gfx906 -mtriple=amdgcn-amd-amdhsa-hcc -thread_warp_size=64", [-1, 16, 64, 65536, 2147483647, 1024, 16, 64], "", 0, []], [[], [["CI", 1], ["FU", 3, [0, 1, 2, 3]], ["SP", 3, 0, 10407936, [2], 1], ["AN", 3, 0, 5], ["AN", 3, 1, 6], ["FU", 2, [0, 1, 2, 3]], ["SP", 2, 0, 10407936, [28], 1], ["AN", 2, 0, 5], ["AN", 2, 1, 6], ["PR", 2, 0, "auto_unroll_max_step$0"]]]], "r": [[0.0132411], 0, 2.43538, 1639049055], "v": "v0.6"}
{"i": [["[\"pool_layer\", \"avg\", 128, 672, 11, 11, 3, 3, 1, \"SAME\"]", "rocm -keys=rocm,gpu -max_num_threads=256 -mcpu=gfx906 -mtriple=amdgcn-amd-amdhsa-hcc -thread_warp_size=64", [-1, 16, 64, 65536, 2147483647, 1024, 16, 64], "", 0, []], [[], [["CI", 1], ["FU", 3, [0, 1, 2, 3]], ["SP", 3, 0, 10407936, [64], 1], ["AN", 3, 0, 5], ["AN", 3, 1, 6], ["FU", 2, [0, 1, 2, 3]], ["SP", 2, 0, 10407936, [14], 1], ["AN", 2, 0, 5], ["AN", 2, 1, 6], ["PR", 2, 0, "auto_unroll_max_step$512"]]]], "r": [[0.00216282], 0, 2.07921, 1639049057], "v": "v0.6"}
{"i": [["[\"pool_layer\", \"avg\", 128, 672, 11, 11, 3, 3, 1, \"SAME\"]", "rocm -keys=rocm,gpu -max_num_threads=256 -mcpu=gfx906 -mtriple=amdgcn-amd-amdhsa-hcc -thread_warp_size=64", [-1, 16, 64, 65536, 2147483647, 1024, 16, 64], "", 0, []], [[], [["CI", 1], ["FU", 3, [0, 1, 2, 3]], ["SP", 3, 0, 10407936, [8], 1], ["AN", 3, 0, 5], ["AN", 3, 1, 6], ["FU", 2, [0, 1, 2, 3]], ["SP", 2, 0, 10407936, [64], 1], ["AN", 2, 0, 5], ["AN", 2, 1, 6], ["PR", 2, 0, "auto_unroll_max_step$0"]]]], "r": [[0.00348104], 0, 2.17939, 1639049058], "v": "v0.6"}
{"i": [["[\"pool_layer\", \"avg\", 128, 672, 11, 11, 3, 3, 1, \"SAME\"]", "rocm -keys=rocm,gpu -max_num_threads=256 -mcpu=gfx906 -mtriple=amdgcn-amd-amdhsa-hcc -thread_warp_size=64", [-1, 16, 64, 65536, 2147483647, 1024, 16, 64], "", 0, []], [[], [["CI", 1], ["FU", 3, [0, 1, 2, 3]], ["SP", 3, 0, 10407936, [64], 1], ["AN", 3, 0, 5], ["AN", 3, 1, 6], ["FU", 2, [0, 1, 2, 3]], ["SP", 2, 0, 10407936, [48], 1], ["AN", 2, 0, 5], ["AN", 2, 1, 6], ["PR", 2, 0, "auto_unroll_max_step$512"]]]], "r": [[0.000912664], 0, 1.98764, 1639049060], "v": "v0.6"}
{"i": [["[\"pool_layer\", \"avg\", 128, 672, 11, 11, 3, 3, 1, \"SAME\"]", "rocm -keys=rocm,gpu -max_num_threads=256 -mcpu=gfx906 -mtriple=amdgcn-amd-amdhsa-hcc -thread_warp_size=64", [-1, 16, 64, 65536, 2147483647, 1024, 16, 64], "", 0, []], [[], [["CI", 1], ["FU", 3, [0, 1, 2, 3]], ["SP", 3, 0, 10407936, [2], 1], ["AN", 3, 0, 5], ["AN", 3, 1, 6], ["FU", 2, [0, 1, 2, 3]], ["SP", 2, 0, 10407936, [1], 1], ["AN", 2, 0, 5], ["AN", 2, 1, 6], ["PR", 2, 0, "auto_unroll_max_step$0"]]]], "r": [[0.0374096], 0, 1.87091, 1639049062], "v": "v0.6"}
{"i": [["[\"pool_layer\", \"avg\", 128, 672, 11, 11, 3, 3, 1, \"SAME\"]", "rocm -keys=rocm,gpu -max_num_threads=256 -mcpu=gfx906 -mtriple=amdgcn-amd-amdhsa-hcc -thread_warp_size=64", [-1, 16, 64, 65536, 2147483647, 1024, 16, 64], "", 0, []], [[], [["CI", 1], ["FU", 3, [0, 1, 2, 3]], ["SP", 3, 0, 10407936, [8], 1], ["AN", 3, 0, 5], ["AN", 3, 1, 6], ["FU", 2, [0, 1, 2, 3]], ["SP", 2, 0, 10407936, [8], 1], ["AN", 2, 0, 5], ["AN", 2, 1, 6], ["PR", 2, 0, "auto_unroll_max_step$64"]]]], "r": [[0.00607045], 0, 1.74076, 1639049063], "v": "v0.6"}
{"i": [["[\"pool_layer\", \"avg\", 128, 672, 11, 11, 3, 3, 1, \"SAME\"]", "rocm -keys=rocm,gpu -max_num_threads=256 -mcpu=gfx906 -mtriple=amdgcn-amd-amdhsa-hcc -thread_warp_size=64", [-1, 16, 64, 65536, 2147483647, 1024, 16, 64], "", 0, []], [[], [["CI", 1], ["FU", 3, [0, 1, 2, 3]], ["SP", 3, 0, 10407936, [4], 1], ["AN", 3, 0, 5], ["AN", 3, 1, 6], ["FU", 2, [0, 1, 2, 3]], ["SP", 2, 0, 10407936, [42], 1], ["AN", 2, 0, 5], ["AN", 2, 1, 6], ["PR", 2, 0, "auto_unroll_max_step$16"]]]], "r": [[0.00677218], 0, 2.14451, 1639049065], "v": "v0.6"}
{"i": [["[\"pool_layer\", \"avg\", 128, 672, 11, 11, 3, 3, 1, \"SAME\"]", "rocm -keys=rocm,gpu -max_num_threads=256 -mcpu=gfx906 -mtriple=amdgcn-amd-amdhsa-hcc -thread_warp_size=64", [-1, 16, 64, 65536, 2147483647, 1024, 16, 64], "", 0, []], [[], [["CI", 1], ["FU", 3, [0, 1, 2, 3]], ["SP", 3, 0, 10407936, [32], 1], ["AN", 3, 0, 5], ["AN", 3, 1, 6], ["FU", 2, [0, 1, 2, 3]], ["SP", 2, 0, 10407936, [2], 1], ["AN", 2, 0, 5], ["AN", 2, 1, 6], ["PR", 2, 0, "auto_unroll_max_step$1024"]]]], "r": [[0.012895], 0, 1.65613, 1639049067], "v": "v0.6"}
{"i": [["[\"pool_layer\", \"avg\", 128, 672, 11, 11, 3, 3, 1, \"SAME\"]", "rocm -keys=rocm,gpu -max_num_threads=256 -mcpu=gfx906 -mtriple=amdgcn-amd-amdhsa-hcc -thread_warp_size=64", [-1, 16, 64, 65536, 2147483647, 1024, 16, 64], "", 0, []], [[], [["CI", 1], ["FU", 3, [0, 1, 2, 3]], ["SP", 3, 0, 10407936, [64], 1], ["AN", 3, 0, 5], ["AN", 3, 1, 6], ["FU", 2, [0, 1, 2, 3]], ["SP", 2, 0, 10407936, [44], 1], ["AN", 2, 0, 5], ["AN", 2, 1, 6], ["PR", 2, 0, "auto_unroll_max_step$16"]]]], "r": [[0.000959708], 0, 1.96845, 1639049068], "v": "v0.6"}
{"i": [["[\"pool_layer\", \"avg\", 128, 672, 11, 11, 3, 3, 1, \"SAME\"]", "rocm -keys=rocm,gpu -max_num_threads=256 -mcpu=gfx906 -mtriple=amdgcn-amd-amdhsa-hcc -thread_warp_size=64", [-1, 16, 64, 65536, 2147483647, 1024, 16, 64], "", 0, []], [[], [["CI", 1], ["FU", 3, [0, 1, 2, 3]], ["SP", 3, 0, 10407936, [1], 1], ["AN", 3, 0, 5], ["AN", 3, 1, 6], ["FU", 2, [0, 1, 2, 3]], ["SP", 2, 0, 10407936, [48], 1], ["AN", 2, 0, 5], ["AN", 2, 1, 6], ["PR", 2, 0, "auto_unroll_max_step$0"]]]], "r": [[0.0254271], 0, 1.73404, 1639049070], "v": "v0.6"}
{"i": [["[\"pool_layer\", \"avg\", 128, 672, 11, 11, 3, 3, 1, \"SAME\"]", "rocm -keys=rocm,gpu -max_num_threads=256 -mcpu=gfx906 -mtriple=amdgcn-amd-amdhsa-hcc -thread_warp_size=64", [-1, 16, 64, 65536, 2147483647, 1024, 16, 64], "", 0, []], [[], [["CI", 1], ["FU", 3, [0, 1, 2, 3]], ["SP", 3, 0, 10407936, [32], 1], ["AN", 3, 0, 5], ["AN", 3, 1, 6], ["FU", 2, [0, 1, 2, 3]], ["SP", 2, 0, 10407936, [1], 1], ["AN", 2, 0, 5], ["AN", 2, 1, 6], ["PR", 2, 0, "auto_unroll_max_step$0"]]]], "r": [[0.0257679], 0, 1.78184, 1639049071], "v": "v0.6"}
{"i": [["[\"pool_layer\", \"avg\", 128, 672, 11, 11, 3, 3, 1, \"SAME\"]", "rocm -keys=rocm,gpu -max_num_threads=256 -mcpu=gfx906 -mtriple=amdgcn-amd-amdhsa-hcc -thread_warp_size=64", [-1, 16, 64, 65536, 2147483647, 1024, 16, 64], "", 0, []], [[], [["CI", 1], ["FU", 3, [0, 1, 2, 3]], ["SP", 3, 0, 10407936, [4], 1], ["AN", 3, 0, 5], ["AN", 3, 1, 6], ["FU", 2, [0, 1, 2, 3]], ["SP", 2, 0, 10407936, [32], 1], ["AN", 2, 0, 5], ["AN", 2, 1, 6], ["PR", 2, 0, "auto_unroll_max_step$16"]]]], "r": [[0.00683061], 0, 1.59951, 1639049073], "v": "v0.6"}
{"i": [["[\"pool_layer\", \"avg\", 128, 672, 11, 11, 3, 3, 1, \"SAME\"]", "rocm -keys=rocm,gpu -max_num_threads=256 -mcpu=gfx906 -mtriple=amdgcn-amd-amdhsa-hcc -thread_warp_size=64", [-1, 16, 64, 65536, 2147483647, 1024, 16, 64], "", 0, []], [[], [["CI", 1], ["FU", 3, [0, 1, 2, 3]], ["SP", 3, 0, 10407936, [32], 1], ["AN", 3, 0, 5], ["AN", 3, 1, 6], ["FU", 2, [0, 1, 2, 3]], ["SP", 2, 0, 10407936, [14], 1], ["AN", 2, 0, 5], ["AN", 2, 1, 6], ["PR", 2, 0, "auto_unroll_max_step$0"]]]], "r": [[0.00254541], 0, 2.03289, 1639049075], "v": "v0.6"}
{"i": [["[\"pool_layer\", \"avg\", 128, 672, 11, 11, 3, 3, 1, \"SAME\"]", "rocm -keys=rocm,gpu -max_num_threads=256 -mcpu=gfx906 -mtriple=amdgcn-amd-amdhsa-hcc -thread_warp_size=64", [-1, 16, 64, 65536, 2147483647, 1024, 16, 64], "", 0, []], [[], [["CI", 1], ["FU", 3, [0, 1, 2, 3]], ["SP", 3, 0, 10407936, [64], 1], ["AN", 3, 0, 5], ["AN", 3, 1, 6], ["FU", 2, [0, 1, 2, 3]], ["SP", 2, 0, 10407936, [4], 1], ["AN", 2, 0, 5], ["AN", 2, 1, 6], ["PR", 2, 0, "auto_unroll_max_step$1024"]]]], "r": [[0.00645062], 0, 1.65266, 1639049076], "v": "v0.6"}
{"i": [["[\"pool_layer\", \"avg\", 128, 672, 11, 11, 3, 3, 1, \"SAME\"]", "rocm -keys=rocm,gpu -max_num_threads=256 -mcpu=gfx906 -mtriple=amdgcn-amd-amdhsa-hcc -thread_warp_size=64", [-1, 16, 64, 65536, 2147483647, 1024, 16, 64], "", 0, []], [[], [["CI", 1], ["FU", 3, [0, 1, 2, 3]], ["SP", 3, 0, 10407936, [64], 1], ["AN", 3, 0, 5], ["AN", 3, 1, 6], ["FU", 2, [0, 1, 2, 3]], ["SP", 2, 0, 10407936, [64], 1], ["AN", 2, 0, 5], ["AN", 2, 1, 6], ["PR", 2, 0, "auto_unroll_max_step$64"]]]], "r": [[0.000784435], 0, 1.91415, 1639049078], "v": "v0.6"}
{"i": [["[\"pool_layer\", \"avg\", 128, 672, 11, 11, 3, 3, 1, \"SAME\"]", "rocm -keys=rocm,gpu -max_num_threads=256 -mcpu=gfx906 -mtriple=amdgcn-amd-amdhsa-hcc -thread_warp_size=64", [-1, 16, 64, 65536, 2147483647, 1024, 16, 64], "", 0, []], [[], [["CI", 1], ["FU", 3, [0, 1, 2, 3]], ["SP", 3, 0, 10407936, [64], 1], ["AN", 3, 0, 5], ["AN", 3, 1, 6], ["FU", 2, [0, 1, 2, 3]], ["SP", 2, 0, 10407936, [64], 1], ["AN", 2, 0, 5], ["AN", 2, 1, 6], ["PR", 2, 0, "auto_unroll_max_step$512"]]]], "r": [[0.000783572], 0, 1.98957, 1639049080], "v": "v0.6"}
{"i": [["[\"pool_layer\", \"avg\", 128, 672, 11, 11, 3, 3, 1, \"SAME\"]", "rocm -keys=rocm,gpu -max_num_threads=256 -mcpu=gfx906 -mtriple=amdgcn-amd-amdhsa-hcc -thread_warp_size=64", [-1, 16, 64, 65536, 2147483647, 1024, 16, 64], "", 0, []], [[], [["CI", 1], ["FU", 3, [0, 1, 2, 3]], ["SP", 3, 0, 10407936, [64], 1], ["AN", 3, 0, 5], ["AN", 3, 1, 6], ["FU", 2, [0, 1, 2, 3]], ["SP", 2, 0, 10407936, [64], 1], ["AN", 2, 0, 5], ["AN", 2, 1, 6], ["PR", 2, 0, "auto_unroll_max_step$16"]]]], "r": [[0.000784227], 0, 1.90032, 1639049081], "v": "v0.6"}
{"i": [["[\"pool_layer\", \"avg\", 128, 672, 11, 11, 3, 3, 1, \"SAME\"]", "rocm -keys=rocm,gpu -max_num_threads=256 -mcpu=gfx906 -mtriple=amdgcn-amd-amdhsa-hcc -thread_warp_size=64", [-1, 16, 64, 65536, 2147483647, 1024, 16, 64], "", 0, []], [[], [["CI", 1], ["FU", 3, [0, 1, 2, 3]], ["SP", 3, 0, 10407936, [1], 1], ["AN", 3, 0, 5], ["AN", 3, 1, 6], ["FU", 2, [0, 1, 2, 3]], ["SP", 2, 0, 10407936, [24], 1], ["AN", 2, 0, 5], ["AN", 2, 1, 6], ["PR", 2, 0, "auto_unroll_max_step$16"]]]], "r": [[0.025285], 0, 1.76572, 1639049096], "v": "v0.6"}
{"i": [["[\"pool_layer\", \"avg\", 128, 672, 11, 11, 3, 3, 1, \"SAME\"]", "rocm -keys=rocm,gpu -max_num_threads=256 -mcpu=gfx906 -mtriple=amdgcn-amd-amdhsa-hcc -thread_warp_size=64", [-1, 16, 64, 65536, 2147483647, 1024, 16, 64], "", 0, []], [[], [["CI", 1], ["FU", 3, [0, 1, 2, 3]], ["SP", 3, 0, 10407936, [24], 1], ["AN", 3, 0, 5], ["AN", 3, 1, 6], ["FU", 2, [0, 1, 2, 3]], ["SP", 2, 0, 10407936, [2], 1], ["AN", 2, 0, 5], ["AN", 2, 1, 6], ["PR", 2, 0, "auto_unroll_max_step$16"]]]], "r": [[0.0131483], 0, 1.72489, 1639049097], "v": "v0.6"}
{"i": [["[\"pool_layer\", \"avg\", 128, 672, 11, 11, 3, 3, 1, \"SAME\"]", "rocm -keys=rocm,gpu -max_num_threads=256 -mcpu=gfx906 -mtriple=amdgcn-amd-amdhsa-hcc -thread_warp_size=64", [-1, 16, 64, 65536, 2147483647, 1024, 16, 64], "", 0, []], [[], [["CI", 1], ["FU", 3, [0, 1, 2, 3]], ["SP", 3, 0, 10407936, [3], 1], ["AN", 3, 0, 5], ["AN", 3, 1, 6], ["FU", 2, [0, 1, 2, 3]], ["SP", 2, 0, 10407936, [4], 1], ["AN", 2, 0, 5], ["AN", 2, 1, 6], ["PR", 2, 0, "auto_unroll_max_step$16"]]]], "r": [[0.0141606], 0, 1.83723, 1639049099], "v": "v0.6"}
{"i": [["[\"pool_layer\", \"avg\", 128, 672, 11, 11, 3, 3, 1, \"SAME\"]", "rocm -keys=rocm,gpu -max_num_threads=256 -mcpu=gfx906 -mtriple=amdgcn-amd-amdhsa-hcc -thread_warp_size=64", [-1, 16, 64, 65536, 2147483647, 1024, 16, 64], "", 0, []], [[], [["CI", 1], ["FU", 3, [0, 1, 2, 3]], ["SP", 3, 0, 10407936, [1], 1], ["AN", 3, 0, 5], ["AN", 3, 1, 6], ["FU", 2, [0, 1, 2, 3]], ["SP", 2, 0, 10407936, [64], 1], ["AN", 2, 0, 5], ["AN", 2, 1, 6], ["PR", 2, 0, "auto_unroll_max_step$64"]]]], "r": [[0.02533], 0, 1.84813, 1639049100], "v": "v0.6"}
{"i": [["[\"pool_layer\", \"avg\", 128, 672, 11, 11, 3, 3, 1, \"SAME\"]", "rocm -keys=rocm,gpu -max_num_threads=256 -mcpu=gfx906 -mtriple=amdgcn-amd-amdhsa-hcc -thread_warp_size=64", [-1, 16, 64, 65536, 2147483647, 1024, 16, 64], "", 0, []], [[], [["CI", 1], ["FU", 3, [0, 1, 2, 3]], ["SP", 3, 0, 10407936, [12], 1], ["AN", 3, 0, 5], ["AN", 3, 1, 6], ["FU", 2, [0, 1, 2, 3]], ["SP", 2, 0, 10407936, [1], 1], ["AN", 2, 0, 5], ["AN", 2, 1, 6], ["PR", 2, 0, "auto_unroll_max_step$1024"]]]], "r": [[0.0270098], 0, 1.83829, 1639049102], "v": "v0.6"}
{"i": [["[\"pool_layer\", \"avg\", 128, 672, 11, 11, 3, 3, 1, \"SAME\"]", "rocm -keys=rocm,gpu -max_num_threads=256 -mcpu=gfx906 -mtriple=amdgcn-amd-amdhsa-hcc -thread_warp_size=64", [-1, 16, 64, 65536, 2147483647, 1024, 16, 64], "", 0, []], [[], [["CI", 1], ["FU", 3, [0, 1, 2, 3]], ["SP", 3, 0, 10407936, [16], 1], ["AN", 3, 0, 5], ["AN", 3, 1, 6], ["FU", 2, [0, 1, 2, 3]], ["SP", 2, 0, 10407936, [64], 1], ["AN", 2, 0, 5], ["AN", 2, 1, 6], ["PR", 2, 0, "auto_unroll_max_step$64"]]]], "r": [[0.0019412], 0, 2.05524, 1639049104], "v": "v0.6"}
{"i": [["[\"pool_layer\", \"avg\", 128, 672, 11, 11, 3, 3, 1, \"SAME\"]", "rocm -keys=rocm,gpu -max_num_threads=256 -mcpu=gfx906 -mtriple=amdgcn-amd-amdhsa-hcc -thread_warp_size=64", [-1, 16, 64, 65536, 2147483647, 1024, 16, 64], "", 0, []], [[], [["CI", 1], ["FU", 3, [0, 1, 2, 3]], ["SP", 3, 0, 10407936, [11], 1], ["AN", 3, 0, 5], ["AN", 3, 1, 6], ["FU", 2, [0, 1, 2, 3]], ["SP", 2, 0, 10407936, [28], 1], ["AN", 2, 0, 5], ["AN", 2, 1, 6], ["PR", 2, 0, "auto_unroll_max_step$0"]]]], "r": [[0.00313949], 0, 2.15212, 1639049105], "v": "v0.6"}
{"i": [["[\"pool_layer\", \"avg\", 128, 672, 11, 11, 3, 3, 1, \"SAME\"]", "rocm -keys=rocm,gpu -max_num_threads=256 -mcpu=gfx906 -mtriple=amdgcn-amd-amdhsa-hcc -thread_warp_size=64", [-1, 16, 64, 65536, 2147483647, 1024, 16, 64], "", 0, []], [[], [["CI", 1], ["FU", 3, [0, 1, 2, 3]], ["SP", 3, 0, 10407936, [2], 1], ["AN", 3, 0, 5], ["AN", 3, 1, 6], ["FU", 2, [0, 1, 2, 3]], ["SP", 2, 0, 10407936, [12], 1], ["AN", 2, 0, 5], ["AN", 2, 1, 6], ["PR", 2, 0, "auto_unroll_max_step$0"]]]], "r": [[0.014159], 0, 1.77971, 1639049107], "v": "v0.6"}
{"i": [["[\"pool_layer\", \"avg\", 128, 672, 11, 11, 3, 3, 1, \"SAME\"]", "rocm -keys=rocm,gpu -max_num_threads=256 -mcpu=gfx906 -mtriple=amdgcn-amd-amdhsa-hcc -thread_warp_size=64", [-1, 16, 64, 65536, 2147483647, 1024, 16, 64], "", 0, []], [[], [["CI", 1], ["FU", 3, [0, 1, 2, 3]], ["SP", 3, 0, 10407936, [6], 1], ["AN", 3, 0, 5], ["AN", 3, 1, 6], ["FU", 2, [0, 1, 2, 3]], ["SP", 2, 0, 10407936, [64], 1], ["AN", 2, 0, 5], ["AN", 2, 1, 6], ["PR", 2, 0, "auto_unroll_max_step$0"]]]], "r": [[0.00451192], 0, 2.1843, 1639049109], "v": "v0.6"}
{"i": [["[\"pool_layer\", \"avg\", 128, 672, 11, 11, 3, 3, 1, \"SAME\"]", "rocm -keys=rocm,gpu -max_num_threads=256 -mcpu=gfx906 -mtriple=amdgcn-amd-amdhsa-hcc -thread_warp_size=64", [-1, 16, 64, 65536, 2147483647, 1024, 16, 64], "", 0, []], [[], [["CI", 1], ["FU", 3, [0, 1, 2, 3]], ["SP", 3, 0, 10407936, [1], 1], ["AN", 3, 0, 5], ["AN", 3, 1, 6], ["FU", 2, [0, 1, 2, 3]], ["SP", 2, 0, 10407936, [48], 1], ["AN", 2, 0, 5], ["AN", 2, 1, 6], ["PR", 2, 0, "auto_unroll_max_step$16"]]]], "r": [[0.0254541], 0, 1.92475, 1639049110], "v": "v0.6"}
{"i": [["[\"pool_layer\", \"avg\", 128, 672, 11, 11, 3, 3, 1, \"SAME\"]", "rocm -keys=rocm,gpu -max_num_threads=256 -mcpu=gfx906 -mtriple=amdgcn-amd-amdhsa-hcc -thread_warp_size=64", [-1, 16, 64, 65536, 2147483647, 1024, 16, 64], "", 0, []], [[], [["CI", 1], ["FU", 3, [0, 1, 2, 3]], ["SP", 3, 0, 10407936, [32], 1], ["AN", 3, 0, 5], ["AN", 3, 1, 6], ["FU", 2, [0, 1, 2, 3]], ["SP", 2, 0, 10407936, [56], 1], ["AN", 2, 0, 5], ["AN", 2, 1, 6], ["PR", 2, 0, "auto_unroll_max_step$64"]]]], "r": [[0.00122673], 0, 2.09409, 1639049112], "v": "v0.6"}
{"i": [["[\"pool_layer\", \"avg\", 128, 672, 11, 11, 3, 3, 1, \"SAME\"]", "rocm -keys=rocm,gpu -max_num_threads=256 -mcpu=gfx906 -mtriple=amdgcn-amd-amdhsa-hcc -thread_warp_size=64", [-1, 16, 64, 65536, 2147483647, 1024, 16, 64], "", 0, []], [[], [["CI", 1], ["FU", 3, [0, 1, 2, 3]], ["SP", 3, 0, 10407936, [4], 1], ["AN", 3, 0, 5], ["AN", 3, 1, 6], ["FU", 2, [0, 1, 2, 3]], ["SP", 2, 0, 10407936, [1], 1], ["AN", 2, 0, 5], ["AN", 2, 1, 6], ["PR", 2, 0, "auto_unroll_max_step$0"]]]], "r": [[0.0312483], 0, 1.84497, 1639049114], "v": "v0.6"}
{"i": [["[\"pool_layer\", \"avg\", 128, 672, 11, 11, 3, 3, 1, \"SAME\"]", "rocm -keys=rocm,gpu -max_num_threads=256 -mcpu=gfx906 -mtriple=amdgcn-amd-amdhsa-hcc -thread_warp_size=64", [-1, 16, 64, 65536, 2147483647, 1024, 16, 64], "", 0, []], [[], [["CI", 1], ["FU", 3, [0, 1, 2, 3]], ["SP", 3, 0, 10407936, [11], 1], ["AN", 3, 0, 5], ["AN", 3, 1, 6], ["FU", 2, [0, 1, 2, 3]], ["SP", 2, 0, 10407936, [56], 1], ["AN", 2, 0, 5], ["AN", 2, 1, 6], ["PR", 2, 0, "auto_unroll_max_step$0"]]]], "r": [[0.00269944], 0, 2.19143, 1639049115], "v": "v0.6"}
{"i": [["[\"pool_layer\", \"avg\", 128, 672, 11, 11, 3, 3, 1, \"SAME\"]", "rocm -keys=rocm,gpu -max_num_threads=256 -mcpu=gfx906 -mtriple=amdgcn-amd-amdhsa-hcc -thread_warp_size=64", [-1, 16, 64, 65536, 2147483647, 1024, 16, 64], "", 0, []], [[], [["CI", 1], ["FU", 3, [0, 1, 2, 3]], ["SP", 3, 0, 10407936, [33], 1], ["AN", 3, 0, 5], ["AN", 3, 1, 6], ["FU", 2, [0, 1, 2, 3]], ["SP", 2, 0, 10407936, [8], 1], ["AN", 2, 0, 5], ["AN", 2, 1, 6], ["PR", 2, 0, "auto_unroll_max_step$64"]]]], "r": [[0.00384437], 0, 2.24413, 1639049117], "v": "v0.6"}
{"i": [["[\"pool_layer\", \"avg\", 128, 672, 11, 11, 3, 3, 1, \"SAME\"]", "rocm -keys=rocm,gpu -max_num_threads=256 -mcpu=gfx906 -mtriple=amdgcn-amd-amdhsa-hcc -thread_warp_size=64", [-1, 16, 64, 65536, 2147483647, 1024, 16, 64], "", 0, []], [[], [["CI", 1], ["FU", 3, [0, 1, 2, 3]], ["SP", 3, 0, 10407936, [1], 1], ["AN", 3, 0, 5], ["AN", 3, 1, 6], ["FU", 2, [0, 1, 2, 3]], ["SP", 2, 0, 10407936, [1], 1], ["AN", 2, 0, 5], ["AN", 2, 1, 6], ["PR", 2, 0, "auto_unroll_max_step$16"]]]], "r": [[0.0498265], 0, 1.97404, 1639049119], "v": "v0.6"}
{"i": [["[\"pool_layer\", \"avg\", 128, 672, 11, 11, 3, 3, 1, \"SAME\"]", "rocm -keys=rocm,gpu -max_num_threads=256 -mcpu=gfx906 -mtriple=amdgcn-amd-amdhsa-hcc -thread_warp_size=64", [-1, 16, 64, 65536, 2147483647, 1024, 16, 64], "", 0, []], [[], [["CI", 1], ["FU", 3, [0, 1, 2, 3]], ["SP", 3, 0, 10407936, [32], 1], ["AN", 3, 0, 5], ["AN", 3, 1, 6], ["FU", 2, [0, 1, 2, 3]], ["SP", 2, 0, 10407936, [33], 1], ["AN", 2, 0, 5], ["AN", 2, 1, 6], ["PR", 2, 0, "auto_unroll_max_step$64"]]]], "r": [[0.00153151], 0, 2.11182, 1639049121], "v": "v0.6"}
{"i": [["[\"pool_layer\", \"avg\", 128, 672, 11, 11, 3, 3, 1, \"SAME\"]", "rocm -keys=rocm,gpu -max_num_threads=256 -mcpu=gfx906 -mtriple=amdgcn-amd-amdhsa-hcc -thread_warp_size=64", [-1, 16, 64, 65536, 2147483647, 1024, 16, 64], "", 0, []], [[], [["CI", 1], ["FU", 3, [0, 1, 2, 3]], ["SP", 3, 0, 10407936, [32], 1], ["AN", 3, 0, 5], ["AN", 3, 1, 6], ["FU", 2, [0, 1, 2, 3]], ["SP", 2, 0, 10407936, [1], 1], ["AN", 2, 0, 5], ["AN", 2, 1, 6], ["PR", 2, 0, "auto_unroll_max_step$1024"]]]], "r": [[0.0250324], 0, 1.81499, 1639049122], "v": "v0.6"}
{"i": [["[\"pool_layer\", \"avg\", 128, 672, 11, 11, 3, 3, 1, \"SAME\"]", "rocm -keys=rocm,gpu -max_num_threads=256 -mcpu=gfx906 -mtriple=amdgcn-amd-amdhsa-hcc -thread_warp_size=64", [-1, 16, 64, 65536, 2147483647, 1024, 16, 64], "", 0, []], [[], [["CI", 1], ["FU", 3, [0, 1, 2, 3]], ["SP", 3, 0, 10407936, [16], 1], ["AN", 3, 0, 5], ["AN", 3, 1, 6], ["FU", 2, [0, 1, 2, 3]], ["SP", 2, 0, 10407936, [16], 1], ["AN", 2, 0, 5], ["AN", 2, 1, 6], ["PR", 2, 0, "auto_unroll_max_step$0"]]]], "r": [[0.00309867], 0, 2.1047, 1639049124], "v": "v0.6"}
{"i": [["[\"pool_layer\", \"avg\", 128, 672, 11, 11, 3, 3, 1, \"SAME\"]", "rocm -keys=rocm,gpu -max_num_threads=256 -mcpu=gfx906 -mtriple=amdgcn-amd-amdhsa-hcc -thread_warp_size=64", [-1, 16, 64, 65536, 2147483647, 1024, 16, 64], "", 0, []], [[], [["CI", 1], ["FU", 3, [0, 1, 2, 3]], ["SP", 3, 0, 10407936, [2], 1], ["AN", 3, 0, 5], ["AN", 3, 1, 6], ["FU", 2, [0, 1, 2, 3]], ["SP", 2, 0, 10407936, [1], 1], ["AN", 2, 0, 5], ["AN", 2, 1, 6], ["PR", 2, 0, "auto_unroll_max_step$1024"]]]], "r": [[0.0374023], 0, 1.89298, 1639049126], "v": "v0.6"}
{"i": [["[\"pool_layer\", \"avg\", 128, 672, 11, 11, 3, 3, 1, \"SAME\"]", "rocm -keys=rocm,gpu -max_num_threads=256 -mcpu=gfx906 -mtriple=amdgcn-amd-amdhsa-hcc -thread_warp_size=64", [-1, 16, 64, 65536, 2147483647, 1024, 16, 64], "", 0, []], [[], [["CI", 1], ["FU", 3, [0, 1, 2, 3]], ["SP", 3, 0, 10407936, [4], 1], ["AN", 3, 0, 5], ["AN", 3, 1, 6], ["FU", 2, [0, 1, 2, 3]], ["SP", 2, 0, 10407936, [16], 1], ["AN", 2, 0, 5], ["AN", 2, 1, 6], ["PR", 2, 0, "auto_unroll_max_step$0"]]]], "r": [[0.00758878], 0, 1.67047, 1639049127], "v": "v0.6"}
{"i": [["[\"pool_layer\", \"avg\", 128, 672, 11, 11, 3, 3, 1, \"SAME\"]", "rocm -keys=rocm,gpu -max_num_threads=256 -mcpu=gfx906 -mtriple=amdgcn-amd-amdhsa-hcc -thread_warp_size=64", [-1, 16, 64, 65536, 2147483647, 1024, 16, 64], "", 0, []], [[], [["CI", 1], ["FU", 3, [0, 1, 2, 3]], ["SP", 3, 0, 10407936, [64], 1], ["AN", 3, 0, 5], ["AN", 3, 1, 6], ["FU", 2, [0, 1, 2, 3]], ["SP", 2, 0, 10407936, [2], 1], ["AN", 2, 0, 5], ["AN", 2, 1, 6], ["PR", 2, 0, "auto_unroll_max_step$0"]]]], "r": [[0.0125162], 0, 1.69262, 1639049128], "v": "v0.6"}
{"i": [["[\"pool_layer\", \"avg\", 128, 672, 11, 11, 3, 3, 1, \"SAME\"]", "rocm -keys=rocm,gpu -max_num_threads=256 -mcpu=gfx906 -mtriple=amdgcn-amd-amdhsa-hcc -thread_warp_size=64", [-1, 16, 64, 65536, 2147483647, 1024, 16, 64], "", 0, []], [[], [["CI", 1], ["FU", 3, [0, 1, 2, 3]], ["SP", 3, 0, 10407936, [64], 1], ["AN", 3, 0, 5], ["AN", 3, 1, 6], ["FU", 2, [0, 1, 2, 3]], ["SP", 2, 0, 10407936, [1], 1], ["AN", 2, 0, 5], ["AN", 2, 1, 6], ["PR", 2, 0, "auto_unroll_max_step$512"]]]], "r": [[0.0253388], 0, 1.85306, 1639049130], "v": "v0.6"}
{"i": [["[\"pool_layer\", \"avg\", 128, 672, 11, 11, 3, 3, 1, \"SAME\"]", "rocm -keys=rocm,gpu -max_num_threads=256 -mcpu=gfx906 -mtriple=amdgcn-amd-amdhsa-hcc -thread_warp_size=64", [-1, 16, 64, 65536, 2147483647, 1024, 16, 64], "", 0, []], [[], [["CI", 1], ["FU", 3, [0, 1, 2, 3]], ["SP", 3, 0, 10407936, [8], 1], ["AN", 3, 0, 5], ["AN", 3, 1, 6], ["FU", 2, [0, 1, 2, 3]], ["SP", 2, 0, 10407936, [2], 1], ["AN", 2, 0, 5], ["AN", 2, 1, 6], ["PR", 2, 0, "auto_unroll_max_step$16"]]]], "r": [[0.0156169], 0, 1.89951, 1639049131], "v": "v0.6"}
{"i": [["[\"pool_layer\", \"avg\", 128, 672, 11, 11, 3, 3, 1, \"SAME\"]", "rocm -keys=rocm,gpu -max_num_threads=256 -mcpu=gfx906 -mtriple=amdgcn-amd-amdhsa-hcc -thread_warp_size=64", [-1, 16, 64, 65536, 2147483647, 1024, 16, 64], "", 0, []], [[], [["CI", 1], ["FU", 3, [0, 1, 2, 3]], ["SP", 3, 0, 10407936, [11], 1], ["AN", 3, 0, 5], ["AN", 3, 1, 6], ["FU", 2, [0, 1, 2, 3]], ["SP", 2, 0, 10407936, [32], 1], ["AN", 2, 0, 5], ["AN", 2, 1, 6], ["PR", 2, 0, "auto_unroll_max_step$16"]]]], "r": [[0.00302704], 0, 2.14209, 1639049133], "v": "v0.6"}
{"i": [["[\"pool_layer\", \"avg\", 128, 672, 11, 11, 3, 3, 1, \"SAME\"]", "rocm -keys=rocm,gpu -max_num_threads=256 -mcpu=gfx906 -mtriple=amdgcn-amd-amdhsa-hcc -thread_warp_size=64", [-1, 16, 64, 65536, 2147483647, 1024, 16, 64], "", 0, []], [[], [["CI", 1], ["FU", 3, [0, 1, 2, 3]], ["SP", 3, 0, 10407936, [2], 1], ["AN", 3, 0, 5], ["AN", 3, 1, 6], ["FU", 2, [0, 1, 2, 3]], ["SP", 2, 0, 10407936, [16], 1], ["AN", 2, 0, 5], ["AN", 2, 1, 6], ["PR", 2, 0, "auto_unroll_max_step$512"]]]], "r": [[0.0136568], 0, 1.69127, 1639049135], "v": "v0.6"}
{"i": [["[\"pool_layer\", \"avg\", 128, 672, 11, 11, 3, 3, 1, \"SAME\"]", "rocm -keys=rocm,gpu -max_num_threads=256 -mcpu=gfx906 -mtriple=amdgcn-amd-amdhsa-hcc -thread_warp_size=64", [-1, 16, 64, 65536, 2147483647, 1024, 16, 64], "", 0, []], [[], [["CI", 1], ["FU", 3, [0, 1, 2, 3]], ["SP", 3, 0, 10407936, [32], 1], ["AN", 3, 0, 5], ["AN", 3, 1, 6], ["FU", 2, [0, 1, 2, 3]], ["SP", 2, 0, 10407936, [32], 1], ["AN", 2, 0, 5], ["AN", 2, 1, 6], ["PR", 2, 0, "auto_unroll_max_step$512"]]]], "r": [[0.00155692], 0, 2.15134, 1639049136], "v": "v0.6"}
{"i": [["[\"pool_layer\", \"avg\", 128, 672, 11, 11, 3, 3, 1, \"SAME\"]", "rocm -keys=rocm,gpu -max_num_threads=256 -mcpu=gfx906 -mtriple=amdgcn-amd-amdhsa-hcc -thread_warp_size=64", [-1, 16, 64, 65536, 2147483647, 1024, 16, 64], "", 0, []], [[], [["CI", 1], ["FU", 3, [0, 1, 2, 3]], ["SP", 3, 0, 10407936, [1], 1], ["AN", 3, 0, 5], ["AN", 3, 1, 6], ["FU", 2, [0, 1, 2, 3]], ["SP", 2, 0, 10407936, [7], 1], ["AN", 2, 0, 5], ["AN", 2, 1, 6], ["PR", 2, 0, "auto_unroll_max_step$0"]]]], "r": [[0.0284979], 0, 1.89084, 1639049138], "v": "v0.6"}
{"i": [["[\"pool_layer\", \"avg\", 128, 672, 11, 11, 3, 3, 1, \"SAME\"]", "rocm -keys=rocm,gpu -max_num_threads=256 -mcpu=gfx906 -mtriple=amdgcn-amd-amdhsa-hcc -thread_warp_size=64", [-1, 16, 64, 65536, 2147483647, 1024, 16, 64], "", 0, []], [[], [["CI", 1], ["FU", 3, [0, 1, 2, 3]], ["SP", 3, 0, 10407936, [8], 1], ["AN", 3, 0, 5], ["AN", 3, 1, 6], ["FU", 2, [0, 1, 2, 3]], ["SP", 2, 0, 10407936, [48], 1], ["AN", 2, 0, 5], ["AN", 2, 1, 6], ["PR", 2, 0, "auto_unroll_max_step$0"]]]], "r": [[0.0036085], 0, 2.20029, 1639049140], "v": "v0.6"}
{"i": [["[\"pool_layer\", \"avg\", 128, 672, 11, 11, 3, 3, 1, \"SAME\"]", "rocm -keys=rocm,gpu -max_num_threads=256 -mcpu=gfx906 -mtriple=amdgcn-amd-amdhsa-hcc -thread_warp_size=64", [-1, 16, 64, 65536, 2147483647, 1024, 16, 64], "", 0, []], [[], [["CI", 1], ["FU", 3, [0, 1, 2, 3]], ["SP", 3, 0, 10407936, [32], 1], ["AN", 3, 0, 5], ["AN", 3, 1, 6], ["FU", 2, [0, 1, 2, 3]], ["SP", 2, 0, 10407936, [64], 1], ["AN", 2, 0, 5], ["AN", 2, 1, 6], ["PR", 2, 0, "auto_unroll_max_step$16"]]]], "r": [[0.00117097], 0, 2.04331, 1639049142], "v": "v0.6"}
{"i": [["[\"pool_layer\", \"avg\", 128, 672, 11, 11, 3, 3, 1, \"SAME\"]", "rocm -keys=rocm,gpu -max_num_threads=256 -mcpu=gfx906 -mtriple=amdgcn-amd-amdhsa-hcc -thread_warp_size=64", [-1, 16, 64, 65536, 2147483647, 1024, 16, 64], "", 0, []], [[], [["CI", 1], ["FU", 3, [0, 1, 2, 3]], ["SP", 3, 0, 10407936, [64], 1], ["AN", 3, 0, 5], ["AN", 3, 1, 6], ["FU", 2, [0, 1, 2, 3]], ["SP", 2, 0, 10407936, [16], 1], ["AN", 2, 0, 5], ["AN", 2, 1, 6], ["PR", 2, 0, "auto_unroll_max_step$512"]]]], "r": [[0.00194244], 0, 2.08972, 1639049143], "v": "v0.6"}
{"i": [["[\"pool_layer\", \"avg\", 128, 672, 11, 11, 3, 3, 1, \"SAME\"]", "rocm -keys=rocm,gpu -max_num_threads=256 -mcpu=gfx906 -mtriple=amdgcn-amd-amdhsa-hcc -thread_warp_size=64", [-1, 16, 64, 65536, 2147483647, 1024, 16, 64], "", 0, []], [[], [["CI", 1], ["FU", 3, [0, 1, 2, 3]], ["SP", 3, 0, 10407936, [4], 1], ["AN", 3, 0, 5], ["AN", 3, 1, 6], ["FU", 2, [0, 1, 2, 3]], ["SP", 2, 0, 10407936, [2], 1], ["AN", 2, 0, 5], ["AN", 2, 1, 6], ["PR", 2, 0, "auto_unroll_max_step$1024"]]]], "r": [[0.0182058], 0, 1.83357, 1639049145], "v": "v0.6"}
{"i": [["[\"pool_layer\", \"avg\", 128, 672, 11, 11, 3, 3, 1, \"SAME\"]", "rocm -keys=rocm,gpu -max_num_threads=256 -mcpu=gfx906 -mtriple=amdgcn-amd-amdhsa-hcc -thread_warp_size=64", [-1, 16, 64, 65536, 2147483647, 1024, 16, 64], "", 0, []], [[], [["CI", 1], ["FU", 3, [0, 1, 2, 3]], ["SP", 3, 0, 10407936, [48], 1], ["AN", 3, 0, 5], ["AN", 3, 1, 6], ["FU", 2, [0, 1, 2, 3]], ["SP", 2, 0, 10407936, [8], 1], ["AN", 2, 0, 5], ["AN", 2, 1, 6], ["PR", 2, 0, "auto_unroll_max_step$64"]]]], "r": [[0.00360928], 0, 2.18825, 1639049147], "v": "v0.6"}
{"i": [["[\"pool_layer\", \"avg\", 128, 672, 11, 11, 3, 3, 1, \"SAME\"]", "rocm -keys=rocm,gpu -max_num_threads=256 -mcpu=gfx906 -mtriple=amdgcn-amd-amdhsa-hcc -thread_warp_size=64", [-1, 16, 64, 65536, 2147483647, 1024, 16, 64], "", 0, []], [[], [["CI", 1], ["FU", 3, [0, 1, 2, 3]], ["SP", 3, 0, 10407936, [22], 1], ["AN", 3, 0, 5], ["AN", 3, 1, 6], ["FU", 2, [0, 1, 2, 3]], ["SP", 2, 0, 10407936, [56], 1], ["AN", 2, 0, 5], ["AN", 2, 1, 6], ["PR", 2, 0, "auto_unroll_max_step$64"]]]], "r": [[0.00157583], 0, 2.0997, 1639049149], "v": "v0.6"}
{"i": [["[\"pool_layer\", \"avg\", 128, 672, 11, 11, 3, 3, 1, \"SAME\"]", "rocm -keys=rocm,gpu -max_num_threads=256 -mcpu=gfx906 -mtriple=amdgcn-amd-amdhsa-hcc -thread_warp_size=64", [-1, 16, 64, 65536, 2147483647, 1024, 16, 64], "", 0, []], [[], [["CI", 1], ["FU", 3, [0, 1, 2, 3]], ["SP", 3, 0, 10407936, [24], 1], ["AN", 3, 0, 5], ["AN", 3, 1, 6], ["FU", 2, [0, 1, 2, 3]], ["SP", 2, 0, 10407936, [1], 1], ["AN", 2, 0, 5], ["AN", 2, 1, 6], ["PR", 2, 0, "auto_unroll_max_step$0"]]]], "r": [[0.0260273], 0, 1.88213, 1639049150], "v": "v0.6"}
{"i": [["[\"pool_layer\", \"avg\", 128, 672, 11, 11, 3, 3, 1, \"SAME\"]", "rocm -keys=rocm,gpu -max_num_threads=256 -mcpu=gfx906 -mtriple=amdgcn-amd-amdhsa-hcc -thread_warp_size=64", [-1, 16, 64, 65536, 2147483647, 1024, 16, 64], "", 0, []], [[], [["CI", 1], ["FU", 3, [0, 1, 2, 3]], ["SP", 3, 0, 10407936, [32], 1], ["AN", 3, 0, 5], ["AN", 3, 1, 6], ["FU", 2, [0, 1, 2, 3]], ["SP", 2, 0, 10407936, [22], 1], ["AN", 2, 0, 5], ["AN", 2, 1, 6], ["PR", 2, 0, "auto_unroll_max_step$0"]]]], "r": [[0.00190796], 0, 1.97452, 1639049152], "v": "v0.6"}
{"i": [["[\"pool_layer\", \"avg\", 128, 672, 11, 11, 3, 3, 1, \"SAME\"]", "rocm -keys=rocm,gpu -max_num_threads=256 -mcpu=gfx906 -mtriple=amdgcn-amd-amdhsa-hcc -thread_warp_size=64", [-1, 16, 64, 65536, 2147483647, 1024, 16, 64], "", 0, []], [[], [["CI", 1], ["FU", 3, [0, 1, 2, 3]], ["SP", 3, 0, 10407936, [1], 1], ["AN", 3, 0, 5], ["AN", 3, 1, 6], ["FU", 2, [0, 1, 2, 3]], ["SP", 2, 0, 10407936, [1], 1], ["AN", 2, 0, 5], ["AN", 2, 1, 6], ["PR", 2, 0, "auto_unroll_max_step$0"]]]], "r": [[0.0498214], 0, 1.89987, 1639049153], "v": "v0.6"}
{"i": [["[\"pool_layer\", \"avg\", 128, 672, 11, 11, 3, 3, 1, \"SAME\"]", "rocm -keys=rocm,gpu -max_num_threads=256 -mcpu=gfx906 -mtriple=amdgcn-amd-amdhsa-hcc -thread_warp_size=64", [-1, 16, 64, 65536, 2147483647, 1024, 16, 64], "", 0, []], [[], [["CI", 1], ["FU", 3, [0, 1, 2, 3]], ["SP", 3, 0, 10407936, [4], 1], ["AN", 3, 0, 5], ["AN", 3, 1, 6], ["FU", 2, [0, 1, 2, 3]], ["SP", 2, 0, 10407936, [6], 1], ["AN", 2, 0, 5], ["AN", 2, 1, 6], ["PR", 2, 0, "auto_unroll_max_step$64"]]]], "r": [[0.0101163], 0, 1.7359, 1639049155], "v": "v0.6"}
{"i": [["[\"pool_layer\", \"avg\", 128, 672, 11, 11, 3, 3, 1, \"SAME\"]", "rocm -keys=rocm,gpu -max_num_threads=256 -mcpu=gfx906 -mtriple=amdgcn-amd-amdhsa-hcc -thread_warp_size=64", [-1, 16, 64, 65536, 2147483647, 1024, 16, 64], "", 0, []], [[], [["CI", 1], ["FU", 3, [0, 1, 2, 3]], ["SP", 3, 0, 10407936, [16], 1], ["AN", 3, 0, 5], ["AN", 3, 1, 6], ["FU", 2, [0, 1, 2, 3]], ["SP", 2, 0, 10407936, [1], 1], ["AN", 2, 0, 5], ["AN", 2, 1, 6], ["PR", 2, 0, "auto_unroll_max_step$1024"]]]], "r": [[0.0265263], 0, 1.82997, 1639049156], "v": "v0.6"}
{"i": [["[\"pool_layer\", \"avg\", 128, 672, 11, 11, 3, 3, 1, \"SAME\"]", "rocm -keys=rocm,gpu -max_num_threads=256 -mcpu=gfx906 -mtriple=amdgcn-amd-amdhsa-hcc -thread_warp_size=64", [-1, 16, 64, 65536, 2147483647, 1024, 16, 64], "", 0, []], [[], [["CI", 1], ["FU", 3, [0, 1, 2, 3]], ["SP", 3, 0, 10407936, [4], 1], ["AN", 3, 0, 5], ["AN", 3, 1, 6], ["FU", 2, [0, 1, 2, 3]], ["SP", 2, 0, 10407936, [28], 1], ["AN", 2, 0, 5], ["AN", 2, 1, 6], ["PR", 2, 0, "auto_unroll_max_step$16"]]]], "r": [[0.00706768], 0, 2.06886, 1639049158], "v": "v0.6"}
{"i": [["[\"pool_layer\", \"avg\", 128, 672, 11, 11, 3, 3, 1, \"SAME\"]", "rocm -keys=rocm,gpu -max_num_threads=256 -mcpu=gfx906 -mtriple=amdgcn-amd-amdhsa-hcc -thread_warp_size=64", [-1, 16, 64, 65536, 2147483647, 1024, 16, 64], "", 0, []], [[], [["CI", 1], ["FU", 3, [0, 1, 2, 3]], ["SP", 3, 0, 10407936, [16], 1], ["AN", 3, 0, 5], ["AN", 3, 1, 6], ["FU", 2, [0, 1, 2, 3]], ["SP", 2, 0, 10407936, [1], 1], ["AN", 2, 0, 5], ["AN", 2, 1, 6], ["PR", 2, 0, "auto_unroll_max_step$512"]]]], "r": [[0.0265193], 0, 1.79605, 1639049160], "v": "v0.6"}
{"i": [["[\"pool_layer\", \"avg\", 128, 672, 11, 11, 3, 3, 1, \"SAME\"]", "rocm -keys=rocm,gpu -max_num_threads=256 -mcpu=gfx906 -mtriple=amdgcn-amd-amdhsa-hcc -thread_warp_size=64", [-1, 16, 64, 65536, 2147483647, 1024, 16, 64], "", 0, []], [[], [["CI", 1], ["FU", 3, [0, 1, 2, 3]], ["SP", 3, 0, 10407936, [48], 1], ["AN", 3, 0, 5], ["AN", 3, 1, 6], ["FU", 2, [0, 1, 2, 3]], ["SP", 2, 0, 10407936, [32], 1], ["AN", 2, 0, 5], ["AN", 2, 1, 6], ["PR", 2, 0, "auto_unroll_max_step$16"]]]], "r": [[0.0013001], 0, 1.97046, 1639049162], "v": "v0.6"}
{"i": [["[\"pool_layer\", \"avg\", 128, 672, 11, 11, 3, 3, 1, \"SAME\"]", "rocm -keys=rocm,gpu -max_num_threads=256 -mcpu=gfx906 -mtriple=amdgcn-amd-amdhsa-hcc -thread_warp_size=64", [-1, 16, 64, 65536, 2147483647, 1024, 16, 64], "", 0, []], [[], [["CI", 1], ["FU", 3, [0, 1, 2, 3]], ["SP", 3, 0, 10407936, [12], 1], ["AN", 3, 0, 5], ["AN", 3, 1, 6], ["FU", 2, [0, 1, 2, 3]], ["SP", 2, 0, 10407936, [14], 1], ["AN", 2, 0, 5], ["AN", 2, 1, 6], ["PR", 2, 0, "auto_unroll_max_step$16"]]]], "r": [[0.00383167], 0, 2.1514, 1639049163], "v": "v0.6"}
{"i": [["[\"pool_layer\", \"avg\", 128, 672, 11, 11, 3, 3, 1, \"SAME\"]", "rocm -keys=rocm,gpu -max_num_threads=256 -mcpu=gfx906 -mtriple=amdgcn-amd-amdhsa-hcc -thread_warp_size=64", [-1, 16, 64, 65536, 2147483647, 1024, 16, 64], "", 0, []], [[], [["CI", 1], ["FU", 3, [0, 1, 2, 3]], ["SP", 3, 0, 10407936, [1], 1], ["AN", 3, 0, 5], ["AN", 3, 1, 6], ["FU", 2, [0, 1, 2, 3]], ["SP", 2, 0, 10407936, [4], 1], ["AN", 2, 0, 5], ["AN", 2, 1, 6], ["PR", 2, 0, "auto_unroll_max_step$0"]]]], "r": [[0.0311452], 0, 1.72959, 1639049165], "v": "v0.6"}
{"i": [["[\"pool_layer\", \"avg\", 128, 672, 11, 11, 3, 3, 1, \"SAME\"]", "rocm -keys=rocm,gpu -max_num_threads=256 -mcpu=gfx906 -mtriple=amdgcn-amd-amdhsa-hcc -thread_warp_size=64", [-1, 16, 64, 65536, 2147483647, 1024, 16, 64], "", 0, []], [[], [["CI", 1], ["FU", 3, [0, 1, 2, 3]], ["SP", 3, 0, 10407936, [8], 1], ["AN", 3, 0, 5], ["AN", 3, 1, 6], ["FU", 2, [0, 1, 2, 3]], ["SP", 2, 0, 10407936, [48], 1], ["AN", 2, 0, 5], ["AN", 2, 1, 6], ["PR", 2, 0, "auto_unroll_max_step$512"]]]], "r": [[0.00361004], 0, 2.1456, 1639049167], "v": "v0.6"}
{"i": [["[\"pool_layer\", \"avg\", 128, 672, 11, 11, 3, 3, 1, \"SAME\"]", "rocm -keys=rocm,gpu -max_num_threads=256 -mcpu=gfx906 -mtriple=amdgcn-amd-amdhsa-hcc -thread_warp_size=64", [-1, 16, 64, 65536, 2147483647, 1024, 16, 64], "", 0, []], [[], [["CI", 1], ["FU", 3, [0, 1, 2, 3]], ["SP", 3, 0, 10407936, [16], 1], ["AN", 3, 0, 5], ["AN", 3, 1, 6], ["FU", 2, [0, 1, 2, 3]], ["SP", 2, 0, 10407936, [42], 1], ["AN", 2, 0, 5], ["AN", 2, 1, 6], ["PR", 2, 0, "auto_unroll_max_step$512"]]]], "r": [[0.00214431], 0, 2.17335, 1639049169], "v": "v0.6"}
{"i": [["[\"pool_layer\", \"avg\", 128, 672, 11, 11, 3, 3, 1, \"SAME\"]", "rocm -keys=rocm,gpu -max_num_threads=256 -mcpu=gfx906 -mtriple=amdgcn-amd-amdhsa-hcc -thread_warp_size=64", [-1, 16, 64, 65536, 2147483647, 1024, 16, 64], "", 0, []], [[], [["CI", 1], ["FU", 3, [0, 1, 2, 3]], ["SP", 3, 0, 10407936, [11], 1], ["AN", 3, 0, 5], ["AN", 3, 1, 6], ["FU", 2, [0, 1, 2, 3]], ["SP", 2, 0, 10407936, [1], 1], ["AN", 2, 0, 5], ["AN", 2, 1, 6], ["PR", 2, 0, "auto_unroll_max_step$0"]]]], "r": [[0.0272148], 0, 1.96236, 1639049170], "v": "v0.6"}
{"i": [["[\"pool_layer\", \"avg\", 128, 672, 11, 11, 3, 3, 1, \"SAME\"]", "rocm -keys=rocm,gpu -max_num_threads=256 -mcpu=gfx906 -mtriple=amdgcn-amd-amdhsa-hcc -thread_warp_size=64", [-1, 16, 64, 65536, 2147483647, 1024, 16, 64], "", 0, []], [[], [["CI", 1], ["FU", 3, [0, 1, 2, 3]], ["SP", 3, 0, 10407936, [44], 1], ["AN", 3, 0, 5], ["AN", 3, 1, 6], ["FU", 2, [0, 1, 2, 3]], ["SP", 2, 0, 10407936, [32], 1], ["AN", 2, 0, 5], ["AN", 2, 1, 6], ["PR", 2, 0, "auto_unroll_max_step$64"]]]], "r": [[0.00134319], 0, 2.04885, 1639049172], "v": "v0.6"}
{"i": [["[\"pool_layer\", \"avg\", 128, 672, 11, 11, 3, 3, 1, \"SAME\"]", "rocm -keys=rocm,gpu -max_num_threads=256 -mcpu=gfx906 -mtriple=amdgcn-amd-amdhsa-hcc -thread_warp_size=64", [-1, 16, 64, 65536, 2147483647, 1024, 16, 64], "", 0, []], [[], [["CI", 1], ["FU", 3, [0, 1, 2, 3]], ["SP", 3, 0, 10407936, [8], 1], ["AN", 3, 0, 5], ["AN", 3, 1, 6], ["FU", 2, [0, 1, 2, 3]], ["SP", 2, 0, 10407936, [2], 1], ["AN", 2, 0, 5], ["AN", 2, 1, 6], ["PR", 2, 0, "auto_unroll_max_step$0"]]]], "r": [[0.0151707], 0, 1.62654, 1639049173], "v": "v0.6"}
{"i": [["[\"pool_layer\", \"avg\", 128, 672, 11, 11, 3, 3, 1, \"SAME\"]", "rocm -keys=rocm,gpu -max_num_threads=256 -mcpu=gfx906 -mtriple=amdgcn-amd-amdhsa-hcc -thread_warp_size=64", [-1, 16, 64, 65536, 2147483647, 1024, 16, 64], "", 0, []], [[], [["CI", 1], ["FU", 3, [0, 1, 2, 3]], ["SP", 3, 0, 10407936, [4], 1], ["AN", 3, 0, 5], ["AN", 3, 1, 6], ["FU", 2, [0, 1, 2, 3]], ["SP", 2, 0, 10407936, [33], 1], ["AN", 2, 0, 5], ["AN", 2, 1, 6], ["PR", 2, 0, "auto_unroll_max_step$0"]]]], "r": [[0.00693138], 0, 2.19178, 1639049175], "v": "v0.6"}
{"i": [["[\"pool_layer\", \"avg\", 128, 672, 11, 11, 3, 3, 1, \"SAME\"]", "rocm -keys=rocm,gpu -max_num_threads=256 -mcpu=gfx906 -mtriple=amdgcn-amd-amdhsa-hcc -thread_warp_size=64", [-1, 16, 64, 65536, 2147483647, 1024, 16, 64], "", 0, []], [[], [["CI", 1], ["FU", 3, [0, 1, 2, 3]], ["SP", 3, 0, 10407936, [11], 1], ["AN", 3, 0, 5], ["AN", 3, 1, 6], ["FU", 2, [0, 1, 2, 3]], ["SP", 2, 0, 10407936, [21], 1], ["AN", 2, 0, 5], ["AN", 2, 1, 6], ["PR", 2, 0, "auto_unroll_max_step$512"]]]], "r": [[0.00343156], 0, 2.0879, 1639049177], "v": "v0.6"}
{"i": [["[\"pool_layer\", \"avg\", 128, 672, 11, 11, 3, 3, 1, \"SAME\"]", "rocm -keys=rocm,gpu -max_num_threads=256 -mcpu=gfx906 -mtriple=amdgcn-amd-amdhsa-hcc -thread_warp_size=64", [-1, 16, 64, 65536, 2147483647, 1024, 16, 64], "", 0, []], [[], [["CI", 1], ["FU", 3, [0, 1, 2, 3]], ["SP", 3, 0, 10407936, [48], 1], ["AN", 3, 0, 5], ["AN", 3, 1, 6], ["FU", 2, [0, 1, 2, 3]], ["SP", 2, 0, 10407936, [1], 1], ["AN", 2, 0, 5], ["AN", 2, 1, 6], ["PR", 2, 0, "auto_unroll_max_step$1024"]]]], "r": [[0.0254603], 0, 1.76264, 1639049179], "v": "v0.6"}
{"i": [["[\"pool_layer\", \"avg\", 128, 672, 11, 11, 3, 3, 1, \"SAME\"]", "rocm -keys=rocm,gpu -max_num_threads=256 -mcpu=gfx906 -mtriple=amdgcn-amd-amdhsa-hcc -thread_warp_size=64", [-1, 16, 64, 65536, 2147483647, 1024, 16, 64], "", 0, []], [[], [["CI", 1], ["FU", 3, [0, 1, 2, 3]], ["SP", 3, 0, 10407936, [64], 1], ["AN", 3, 0, 5], ["AN", 3, 1, 6], ["FU", 2, [0, 1, 2, 3]], ["SP", 2, 0, 10407936, [21], 1], ["AN", 2, 0, 5], ["AN", 2, 1, 6], ["PR", 2, 0, "auto_unroll_max_step$0"]]]], "r": [[0.00157651], 0, 2.02632, 1639049180], "v": "v0.6"}
{"i": [["[\"pool_layer\", \"avg\", 128, 672, 11, 11, 3, 3, 1, \"SAME\"]", "rocm -keys=rocm,gpu -max_num_threads=256 -mcpu=gfx906 -mtriple=amdgcn-amd-amdhsa-hcc -thread_warp_size=64", [-1, 16, 64, 65536, 2147483647, 1024, 16, 64], "", 0, []], [[], [["CI", 1], ["FU", 3, [0, 1, 2, 3]], ["SP", 3, 0, 10407936, [4], 1], ["AN", 3, 0, 5], ["AN", 3, 1, 6], ["FU", 2, [0, 1, 2, 3]], ["SP", 2, 0, 10407936, [3], 1], ["AN", 2, 0, 5], ["AN", 2, 1, 6], ["PR", 2, 0, "auto_unroll_max_step$16"]]]], "r": [[0.0145666], 0, 1.82254, 1639049182], "v": "v0.6"}
