artifacts/Table4/tvm/ansor/depthwise/ansor_depthwise_128_672_11_11_5_5_1_SAME.log
{"i": [["[\"depthwise_conv2d_layer\", 128, 672, 11, 11, 5, 5, 1, \"SAME\"]", "rocm -keys=rocm,gpu -max_num_threads=256 -mcpu=gfx906 -mtriple=amdgcn-amd-amdhsa-hcc -thread_warp_size=64", [-1, 16, 64, 65536, 2147483647, 1024, 16, 64], "", 0, []], [[], [["CHW", 3, "local"], ["SP", 3, 0, 128, [2, 1, 1, 1], 1], ["SP", 3, 5, 672, [6, 2, 1, 1], 1], ["SP", 3, 10, 11, [1, 1, 1, 1], 1], ["SP", 3, 15, 11, [1, 1, 11, 1], 1], ["SP", 3, 20, 5, [1, 1], 1], ["SP", 3, 23, 5, [1, 5], 1], ["RE", 3, [0, 5, 10, 15, 1, 6, 11, 16, 2, 7, 12, 17, 20, 23, 21, 24, 3, 8, 13, 18, 22, 25, 4, 9, 14, 19]], ["FSP", 4, 0, 1, 3], ["FSP", 4, 4, 2, 3], ["FSP", 4, 8, 3, 3], ["FSP", 4, 12, 4, 3], ["RE", 4, [0, 4, 8, 12, 1, 5, 9, 13, 2, 6, 10, 14, 3, 7, 11, 15]], ["CA", 3, 4, 11], ["CHR", 2, "shared", [3]], ["CA", 3, 4, 13], ["CHR", 1, "shared", [4]], ["CA", 2, 5, 13], ["CI", 1], ["FU", 6, [0, 1, 2, 3]], ["AN", 6, 0, 5], ["FU", 6, [1, 2, 3, 4]], ["AN", 6, 1, 4], ["FU", 6, [2, 3, 4, 5]], ["AN", 6, 2, 6], ["FU", 4, [0, 1, 2, 3]], ["SP", 4, 0, 5, [1], 1], ["AN", 4, 1, 2], ["FFSP", 4, 0, [4, 3, 2, 1], 1, 1], ["AN", 4, 1, 6], ["FU", 2, [0, 1, 2, 3]], ["SP", 2, 0, 10, [1], 1], ["AN", 2, 1, 2], ["FFSP", 2, 0, [4, 3, 2, 1], 1, 1], ["AN", 2, 1, 6], ["PR", 5, 0, "auto_unroll_max_step$1024"]]]], "r": [[0.0463316], 0, 7.53637, 1638590614], "v": "v0.6"}
{"i": [["[\"depthwise_conv2d_layer\", 128, 672, 11, 11, 5, 5, 1, \"SAME\"]", "rocm -keys=rocm,gpu -max_num_threads=256 -mcpu=gfx906 -mtriple=amdgcn-amd-amdhsa-hcc -thread_warp_size=64", [-1, 16, 64, 65536, 2147483647, 1024, 16, 64], "", 0, []], [[], [["CHW", 3, "local"], ["SP", 3, 0, 128, [4, 4, 1, 2], 1], ["SP", 3, 5, 672, [1, 3, 1, 1], 1], ["SP", 3, 10, 11, [1, 1, 1, 1], 1], ["SP", 3, 15, 11, [1, 1, 1, 11], 1], ["SP", 3, 20, 5, [1, 1], 1], ["SP", 3, 23, 5, [1, 1], 1], ["RE", 3, [0, 5, 10, 15, 1, 6, 11, 16, 2, 7, 12, 17, 20, 23, 21, 24, 3, 8, 13, 18, 22, 25, 4, 9, 14, 19]], ["FSP", 4, 0, 1, 3], ["FSP", 4, 4, 2, 3], ["FSP", 4, 8, 3, 3], ["FSP", 4, 12, 4, 3], ["RE", 4, [0, 4, 8, 12, 1, 5, 9, 13, 2, 6, 10, 14, 3, 7, 11, 15]], ["CA", 3, 4, 11], ["CHR", 2, "shared", [3]], ["CA", 3, 4, 13], ["CHR", 1, "shared", [4]], ["CA", 2, 5, 13], ["CI", 1], ["FU", 6, [0, 1, 2, 3]], ["AN", 6, 0, 5], ["FU", 6, [1, 2, 3, 4]], ["AN", 6, 1, 4], ["FU", 6, [2, 3, 4, 5]], ["AN", 6, 2, 6], ["FU", 4, [0, 1, 2, 3]], ["SP", 4, 0, 1, [1], 1], ["AN", 4, 1, 2], ["FFSP", 4, 0, [4, 3, 2, 1], 1, 1], ["AN", 4, 1, 6], ["FU", 2, [0, 1, 2, 3]], ["SP", 2, 0, 22, [1], 1], ["AN", 2, 1, 2], ["FFSP", 2, 0, [4, 3, 2, 1], 1, 1], ["AN", 2, 1, 6], ["PR", 5, 0, "auto_unroll_max_step$512"]]]], "r": [[0.0258242], 0, 4.704, 1638590615], "v": "v0.6"}
{"i": [["[\"depthwise_conv2d_layer\", 128, 672, 11, 11, 5, 5, 1, \"SAME\"]", "rocm -keys=rocm,gpu -max_num_threads=256 -mcpu=gfx906 -mtriple=amdgcn-amd-amdhsa-hcc -thread_warp_size=64", [-1, 16, 64, 65536, 2147483647, 1024, 16, 64], "", 0, []], [[], [["CHW", 3, "local"], ["SP", 3, 0, 128, [1, 2, 1, 1], 1], ["SP", 3, 5, 672, [1, 21, 2, 1], 1], ["SP", 3, 10, 11, [1, 11, 1, 1], 1], ["SP", 3, 15, 11, [1, 1, 1, 1], 1], ["SP", 3, 20, 5, [5, 1], 1], ["SP", 3, 23, 5, [1, 1], 1], ["RE", 3, [0, 5, 10, 15, 1, 6, 11, 16, 2, 7, 12, 17, 20, 23, 21, 24, 3, 8, 13, 18, 22, 25, 4, 9, 14, 19]], ["FSP", 4, 0, 1, 3], ["FSP", 4, 4, 2, 3], ["FSP", 4, 8, 3, 3], ["FSP", 4, 12, 4, 3], ["RE", 4, [0, 4, 8, 12, 1, 5, 9, 13, 2, 6, 10, 14, 3, 7, 11, 15]], ["CA", 3, 4, 11], ["CHR", 2, "shared", [3]], ["CA", 3, 4, 13], ["CHR", 1, "shared", [4]], ["CA", 2, 5, 13], ["CI", 1], ["FU", 6, [0, 1, 2, 3]], ["AN", 6, 0, 5], ["FU", 6, [1, 2, 3, 4]], ["AN", 6, 1, 4], ["FU", 6, [2, 3, 4, 5]], ["AN", 6, 2, 6], ["FU", 4, [0, 1, 2, 3]], ["SP", 4, 0, 10, [1], 1], ["AN", 4, 1, 2], ["FFSP", 4, 0, [4, 3, 2, 1], 1, 1], ["AN", 4, 1, 6], ["FU", 2, [0, 1, 2, 3]], ["SP", 2, 0, 10, [5], 1], ["AN", 2, 1, 2], ["FFSP", 2, 0, [4, 3, 2, 1], 1, 1], ["AN", 2, 1, 6], ["PR", 5, 0, "auto_unroll_max_step$512"]]]], "r": [[0.00217059], 0, 2.65606, 1638590617], "v": "v0.6"}
{"i": [["[\"depthwise_conv2d_layer\", 128, 672, 11, 11, 5, 5, 1, \"SAME\"]", "rocm -keys=rocm,gpu -max_num_threads=256 -mcpu=gfx906 -mtriple=amdgcn-amd-amdhsa-hcc -thread_warp_size=64", [-1, 16, 64, 65536, 2147483647, 1024, 16, 64], "", 0, []], [[], [["CHW", 3, "local"], ["SP", 3, 0, 128, [2, 4, 1, 2], 1], ["SP", 3, 5, 672, [2, 2, 1, 3], 1], ["SP", 3, 10, 11, [1, 1, 1, 1], 1], ["SP", 3, 15, 11, [1, 1, 11, 1], 1], ["SP", 3, 20, 5, [1, 1], 1], ["SP", 3, 23, 5, [1, 1], 1], ["RE", 3, [0, 5, 10, 15, 1, 6, 11, 16, 2, 7, 12, 17, 20, 23, 21, 24, 3, 8, 13, 18, 22, 25, 4, 9, 14, 19]], ["FSP", 4, 0, 1, 3], ["FSP", 4, 4, 2, 3], ["FSP", 4, 8, 3, 3], ["FSP", 4, 12, 4, 3], ["RE", 4, [0, 4, 8, 12, 1, 5, 9, 13, 2, 6, 10, 14, 3, 7, 11, 15]], ["CA", 3, 4, 11], ["CHR", 2, "shared", [3]], ["CA", 3, 4, 13], ["CHR", 1, "shared", [4]], ["CA", 2, 5, 13], ["CI", 1], ["FU", 6, [0, 1, 2, 3]], ["AN", 6, 0, 5], ["FU", 6, [1, 2, 3, 4]], ["AN", 6, 1, 4], ["FU", 6, [2, 3, 4, 5]], ["AN", 6, 2, 6], ["FU", 4, [0, 1, 2, 3]], ["SP", 4, 0, 3, [1], 1], ["AN", 4, 1, 2], ["FFSP", 4, 0, [4, 3, 2, 1], 1, 1], ["AN", 4, 1, 6], ["FU", 2, [0, 1, 2, 3]], ["SP", 2, 0, 6, [1], 1], ["AN", 2, 1, 2], ["FFSP", 2, 0, [4, 3, 2, 1], 1, 1], ["AN", 2, 1, 6], ["PR", 5, 0, "auto_unroll_max_step$512"]]]], "r": [[0.129892], 0, 7.12273, 1638590619], "v": "v0.6"}
{"i": [["[\"depthwise_conv2d_layer\", 128, 672, 11, 11, 5, 5, 1, \"SAME\"]", "rocm -keys=rocm,gpu -max_num_threads=256 -mcpu=gfx906 -mtriple=amdgcn-amd-amdhsa-hcc -thread_warp_size=64", [-1, 16, 64, 65536, 2147483647, 1024, 16, 64], "", 0, []], [[], [["CHW", 3, "local"], ["SP", 3, 0, 128, [1, 1, 1, 4], 1], ["SP", 3, 5, 672, [1, 8, 1, 2], 1], ["SP", 3, 10, 11, [11, 1, 1, 1], 1], ["SP", 3, 15, 11, [1, 1, 1, 11], 1], ["SP", 3, 20, 5, [1, 5], 1], ["SP", 3, 23, 5, [1, 5], 1], ["RE", 3, [0, 5, 10, 15, 1, 6, 11, 16, 2, 7, 12, 17, 20, 23, 21, 24, 3, 8, 13, 18, 22, 25, 4, 9, 14, 19]], ["FSP", 4, 0, 1, 3], ["FSP", 4, 4, 2, 3], ["FSP", 4, 8, 3, 3], ["FSP", 4, 12, 4, 3], ["RE", 4, [0, 4, 8, 12, 1, 5, 9, 13, 2, 6, 10, 14, 3, 7, 11, 15]], ["CA", 3, 4, 11], ["CHR", 2, "shared", [3]], ["CA", 3, 4, 13], ["CHR", 1, "shared", [4]], ["CA", 2, 5, 13], ["CI", 1], ["FU", 6, [0, 1, 2, 3]], ["AN", 6, 0, 5], ["FU", 6, [1, 2, 3, 4]], ["AN", 6, 1, 4], ["FU", 6, [2, 3, 4, 5]], ["AN", 6, 2, 6], ["FU", 4, [0, 1, 2, 3]], ["SP", 4, 0, 50, [1], 1], ["AN", 4, 1, 2], ["FFSP", 4, 0, [4, 3, 2, 1], 1, 1], ["AN", 4, 1, 6], ["FU", 2, [0, 1, 2, 3]], ["SP", 2, 0, 600, [1], 1], ["AN", 2, 1, 2], ["FFSP", 2, 0, [4, 3, 2, 1], 1, 1], ["AN", 2, 1, 6], ["PR", 5, 0, "auto_unroll_max_step$512"]]]], "r": [[0.0544797], 0, 4.56945, 1638590620], "v": "v0.6"}
{"i": [["[\"depthwise_conv2d_layer\", 128, 672, 11, 11, 5, 5, 1, \"SAME\"]", "rocm -keys=rocm,gpu -max_num_threads=256 -mcpu=gfx906 -mtriple=amdgcn-amd-amdhsa-hcc -thread_warp_size=64", [-1, 16, 64, 65536, 2147483647, 1024, 16, 64], "", 0, []], [[], [["CHW", 3, "local"], ["SP", 3, 0, 128, [1, 1, 2, 4], 1], ["SP", 3, 5, 672, [1, 1, 1, 12], 1], ["SP", 3, 10, 11, [1, 11, 1, 1], 1], ["SP", 3, 15, 11, [1, 1, 1, 1], 1], ["SP", 3, 20, 5, [1, 1], 1], ["SP", 3, 23, 5, [1, 1], 1], ["RE", 3, [0, 5, 10, 15, 1, 6, 11, 16, 2, 7, 12, 17, 20, 23, 21, 24, 3, 8, 13, 18, 22, 25, 4, 9, 14, 19]], ["FSP", 4, 0, 1, 3], ["FSP", 4, 4, 2, 3], ["FSP", 4, 8, 3, 3], ["FSP", 4, 12, 4, 3], ["RE", 4, [0, 4, 8, 12, 1, 5, 9, 13, 2, 6, 10, 14, 3, 7, 11, 15]], ["CA", 3, 4, 11], ["CHR", 2, "shared", [3]], ["CA", 3, 4, 13], ["CHR", 1, "shared", [4]], ["CA", 2, 5, 13], ["CI", 1], ["FU", 6, [0, 1, 2, 3]], ["AN", 6, 0, 5], ["FU", 6, [1, 2, 3, 4]], ["AN", 6, 1, 4], ["FU", 6, [2, 3, 4, 5]], ["AN", 6, 2, 6], ["FU", 4, [0, 1, 2, 3]], ["SP", 4, 0, 20, [1], 1], ["AN", 4, 1, 2], ["FFSP", 4, 0, [4, 3, 2, 1], 1, 1], ["AN", 4, 1, 6], ["FU", 2, [0, 1, 2, 3]], ["SP", 2, 0, 160, [4], 1], ["AN", 2, 1, 2], ["FFSP", 2, 0, [4, 3, 2, 1], 1, 1], ["AN", 2, 1, 6], ["PR", 5, 0, "auto_unroll_max_step$64"]]]], "r": [[0.0168829], 0, 2.42164, 1638590622], "v": "v0.6"}
{"i": [["[\"depthwise_conv2d_layer\", 128, 672, 11, 11, 5, 5, 1, \"SAME\"]", "rocm -keys=rocm,gpu -max_num_threads=256 -mcpu=gfx906 -mtriple=amdgcn-amd-amdhsa-hcc -thread_warp_size=64", [-1, 16, 64, 65536, 2147483647, 1024, 16, 64], "", 0, []], [[], [["CHW", 3, "local"], ["SP", 3, 0, 128, [1, 2, 8, 1], 1], ["SP", 3, 5, 672, [1, 1, 1, 4], 1], ["SP", 3, 10, 11, [1, 11, 1, 1], 1], ["SP", 3, 15, 11, [11, 1, 1, 1], 1], ["SP", 3, 20, 5, [5, 1], 1], ["SP", 3, 23, 5, [1, 1], 1], ["RE", 3, [0, 5, 10, 15, 1, 6, 11, 16, 2, 7, 12, 17, 20, 23, 21, 24, 3, 8, 13, 18, 22, 25, 4, 9, 14, 19]], ["FSP", 4, 0, 1, 3], ["FSP", 4, 4, 2, 3], ["FSP", 4, 8, 3, 3], ["FSP", 4, 12, 4, 3], ["RE", 4, [0, 4, 8, 12, 1, 5, 9, 13, 2, 6, 10, 14, 3, 7, 11, 15]], ["CA", 3, 4, 11], ["CHR", 2, "shared", [3]], ["CA", 3, 4, 13], ["CHR", 1, "shared", [4]], ["CA", 2, 5, 13], ["CI", 1], ["FU", 6, [0, 1, 2, 3]], ["AN", 6, 0, 5], ["FU", 6, [1, 2, 3, 4]], ["AN", 6, 1, 4], ["FU", 6, [2, 3, 4, 5]], ["AN", 6, 2, 6], ["FU", 4, [0, 1, 2, 3]], ["SP", 4, 0, 20, [1], 1], ["AN", 4, 1, 2], ["FFSP", 4, 0, [4, 3, 2, 1], 1, 1], ["AN", 4, 1, 6], ["FU", 2, [0, 1, 2, 3]], ["SP", 2, 0, 160, [1], 1], ["AN", 2, 1, 2], ["FFSP", 2, 0, [4, 3, 2, 1], 1, 1], ["AN", 2, 1, 6], ["PR", 5, 0, "auto_unroll_max_step$0"]]]], "r": [[0.0696908], 0, 2.63045, 1638590624], "v": "v0.6"}
{"i": [["[\"depthwise_conv2d_layer\", 128, 672, 11, 11, 5, 5, 1, \"SAME\"]", "rocm -keys=rocm,gpu -max_num_threads=256 -mcpu=gfx906 -mtriple=amdgcn-amd-amdhsa-hcc -thread_warp_size=64", [-1, 16, 64, 65536, 2147483647, 1024, 16, 64], "", 0, []], [[], [["CHW", 3, "local"], ["SP", 3, 0, 128, [2, 8, 1, 4], 1], ["SP", 3, 5, 672, [1, 1, 12, 1], 1], ["SP", 3, 10, 11, [1, 1, 1, 1], 1], ["SP", 3, 15, 11, [1, 11, 1, 1], 1], ["SP", 3, 20, 5, [1, 1], 1], ["SP", 3, 23, 5, [1, 5], 1], ["RE", 3, [0, 5, 10, 15, 1, 6, 11, 16, 2, 7, 12, 17, 20, 23, 21, 24, 3, 8, 13, 18, 22, 25, 4, 9, 14, 19]], ["FSP", 4, 0, 1, 3], ["FSP", 4, 4, 2, 3], ["FSP", 4, 8, 3, 3], ["FSP", 4, 12, 4, 3], ["RE", 4, [0, 4, 8, 12, 1, 5, 9, 13, 2, 6, 10, 14, 3, 7, 11, 15]], ["CA", 3, 4, 11], ["CHR", 2, "shared", [3]], ["CA", 3, 4, 13], ["CHR", 1, "shared", [4]], ["CA", 2, 5, 13], ["CI", 1], ["FU", 6, [0, 1, 2, 3]], ["AN", 6, 0, 5], ["FU", 6, [1, 2, 3, 4]], ["AN", 6, 1, 4], ["FU", 6, [2, 3, 4, 5]], ["AN", 6, 2, 6], ["FU", 4, [0, 1, 2, 3]], ["SP", 4, 0, 60, [60], 1], ["AN", 4, 1, 2], ["FFSP", 4, 0, [4, 3, 2, 1], 1, 1], ["AN", 4, 1, 6], ["FU", 2, [0, 1, 2, 3]], ["SP", 2, 0, 240, [1], 1], ["AN", 2, 1, 2], ["FFSP", 2, 0, [4, 3, 2, 1], 1, 1], ["AN", 2, 1, 6], ["PR", 5, 0, "auto_unroll_max_step$64"]]]], "r": [[0.00858515], 0, 2.8313, 1638590625], "v": "v0.6"}
{"i": [["[\"depthwise_conv2d_layer\", 128, 672, 11, 11, 5, 5, 1, \"SAME\"]", "rocm -keys=rocm,gpu -max_num_threads=256 -mcpu=gfx906 -mtriple=amdgcn-amd-amdhsa-hcc -thread_warp_size=64", [-1, 16, 64, 65536, 2147483647, 1024, 16, 64], "", 0, []], [[], [["CHW", 3, "local"], ["SP", 3, 0, 128, [2, 1, 1, 2], 1], ["SP", 3, 5, 672, [6, 1, 1, 1], 1], ["SP", 3, 10, 11, [1, 1, 1, 1], 1], ["SP", 3, 15, 11, [1, 11, 1, 1], 1], ["SP", 3, 20, 5, [1, 1], 1], ["SP", 3, 23, 5, [1, 5], 1], ["RE", 3, [0, 5, 10, 15, 1, 6, 11, 16, 2, 7, 12, 17, 20, 23, 21, 24, 3, 8, 13, 18, 22, 25, 4, 9, 14, 19]], ["FSP", 4, 0, 1, 3], ["FSP", 4, 4, 2, 3], ["FSP", 4, 8, 3, 3], ["FSP", 4, 12, 4, 3], ["RE", 4, [0, 4, 8, 12, 1, 5, 9, 13, 2, 6, 10, 14, 3, 7, 11, 15]], ["CA", 3, 4, 11], ["CHR", 2, "shared", [3]], ["CA", 3, 4, 13], ["CHR", 1, "shared", [4]], ["CA", 2, 5, 13], ["CI", 1], ["FU", 6, [0, 1, 2, 3]], ["AN", 6, 0, 5], ["FU", 6, [1, 2, 3, 4]], ["AN", 6, 1, 4], ["FU", 6, [2, 3, 4, 5]], ["AN", 6, 2, 6], ["FU", 4, [0, 1, 2, 3]], ["SP", 4, 0, 5, [1], 1], ["AN", 4, 1, 2], ["FFSP", 4, 0, [4, 3, 2, 1], 1, 1], ["AN", 4, 1, 6], ["FU", 2, [0, 1, 2, 3]], ["SP", 2, 0, 10, [1], 1], ["AN", 2, 1, 2], ["FFSP", 2, 0, [4, 3, 2, 1], 1, 1], ["AN", 2, 1, 6], ["PR", 5, 0, "auto_unroll_max_step$64"]]]], "r": [[0.00514021], 0, 3.112, 1638590627], "v": "v0.6"}
{"i": [["[\"depthwise_conv2d_layer\", 128, 672, 11, 11, 5, 5, 1, \"SAME\"]", "rocm -keys=rocm,gpu -max_num_threads=256 -mcpu=gfx906 -mtriple=amdgcn-amd-amdhsa-hcc -thread_warp_size=64", [-1, 16, 64, 65536, 2147483647, 1024, 16, 64], "", 0, []], [[], [["CHW", 3, "local"], ["SP", 3, 0, 128, [2, 1, 1, 2], 1], ["SP", 3, 5, 672, [6, 2, 1, 1], 1], ["SP", 3, 10, 11, [1, 11, 1, 1], 1], ["SP", 3, 15, 11, [1, 11, 1, 1], 1], ["SP", 3, 20, 5, [1, 5], 1], ["SP", 3, 23, 5, [1, 5], 1], ["RE", 3, [0, 5, 10, 15, 1, 6, 11, 16, 2, 7, 12, 17, 20, 23, 21, 24, 3, 8, 13, 18, 22, 25, 4, 9, 14, 19]], ["FSP", 4, 0, 1, 3], ["FSP", 4, 4, 2, 3], ["FSP", 4, 8, 3, 3], ["FSP", 4, 12, 4, 3], ["RE", 4, [0, 4, 8, 12, 1, 5, 9, 13, 2, 6, 10, 14, 3, 7, 11, 15]], ["CA", 3, 4, 11], ["CHR", 2, "shared", [3]], ["CA", 3, 4, 13], ["CHR", 1, "shared", [4]], ["CA", 2, 5, 13], ["CI", 1], ["FU", 6, [0, 1, 2, 3]], ["AN", 6, 0, 5], ["FU", 6, [1, 2, 3, 4]], ["AN", 6, 1, 4], ["FU", 6, [2, 3, 4, 5]], ["AN", 6, 2, 6], ["FU", 4, [0, 1, 2, 3]], ["SP", 4, 0, 5, [1], 1], ["AN", 4, 1, 2], ["FFSP", 4, 0, [4, 3, 2, 1], 1, 1], ["AN", 4, 1, 6], ["FU", 2, [0, 1, 2, 3]], ["SP", 2, 0, 10, [1], 1], ["AN", 2, 1, 2], ["FFSP", 2, 0, [4, 3, 2, 1], 1, 1], ["AN", 2, 1, 6], ["PR", 5, 0, "auto_unroll_max_step$64"]]]], "r": [[0.00110639], 0, 3.58272, 1638590629], "v": "v0.6"}
{"i": [["[\"depthwise_conv2d_layer\", 128, 672, 11, 11, 5, 5, 1, \"SAME\"]", "rocm -keys=rocm,gpu -max_num_threads=256 -mcpu=gfx906 -mtriple=amdgcn-amd-amdhsa-hcc -thread_warp_size=64", [-1, 16, 64, 65536, 2147483647, 1024, 16, 64], "", 0, []], [[], [["CHW", 3, "local"], ["SP", 3, 0, 128, [1, 4, 1, 1], 1], ["SP", 3, 5, 672, [1, 7, 4, 1], 1], ["SP", 3, 10, 11, [1, 1, 1, 1], 1], ["SP", 3, 15, 11, [11, 1, 1, 1], 1], ["SP", 3, 20, 5, [5, 1], 1], ["SP", 3, 23, 5, [1, 1], 1], ["RE", 3, [0, 5, 10, 15, 1, 6, 11, 16, 2, 7, 12, 17, 20, 23, 21, 24, 3, 8, 13, 18, 22, 25, 4, 9, 14, 19]], ["FSP", 4, 0, 1, 3], ["FSP", 4, 4, 2, 3], ["FSP", 4, 8, 3, 3], ["FSP", 4, 12, 4, 3], ["RE", 4, [0, 4, 8, 12, 1, 5, 9, 13, 2, 6, 10, 14, 3, 7, 11, 15]], ["CA", 3, 4, 11], ["CHR", 2, "shared", [3]], ["CA", 3, 4, 13], ["CHR", 1, "shared", [4]], ["CA", 2, 5, 13], ["CI", 1], ["FU", 6, [0, 1, 2, 3]], ["AN", 6, 0, 5], ["FU", 6, [1, 2, 3, 4]], ["AN", 6, 1, 4], ["FU", 6, [2, 3, 4, 5]], ["AN", 6, 2, 6], ["FU", 4, [0, 1, 2, 3]], ["SP", 4, 0, 4, [4], 1], ["AN", 4, 1, 2], ["FFSP", 4, 0, [4, 3, 2, 1], 1, 1], ["AN", 4, 1, 6], ["FU", 2, [0, 1, 2, 3]], ["SP", 2, 0, 4, [1], 1], ["AN", 2, 1, 2], ["FFSP", 2, 0, [4, 3, 2, 1], 1, 1], ["AN", 2, 1, 6], ["PR", 5, 0, "auto_unroll_max_step$16"]]]], "r": [[0.0314116], 0, 2.48046, 1638590630], "v": "v0.6"}
{"i": [["[\"depthwise_conv2d_layer\", 128, 672, 11, 11, 5, 5, 1, \"SAME\"]", "rocm -keys=rocm,gpu -max_num_threads=256 -mcpu=gfx906 -mtriple=amdgcn-amd-amdhsa-hcc -thread_warp_size=64", [-1, 16, 64, 65536, 2147483647, 1024, 16, 64], "", 0, []], [[], [["CHW", 3, "local"], ["SP", 3, 0, 128, [1, 1, 8, 1], 1], ["SP", 3, 5, 672, [1, 32, 3, 1], 1], ["SP", 3, 10, 11, [1, 1, 1, 1], 1], ["SP", 3, 15, 11, [1, 1, 1, 1], 1], ["SP", 3, 20, 5, [1, 1], 1], ["SP", 3, 23, 5, [1, 5], 1], ["RE", 3, [0, 5, 10, 15, 1, 6, 11, 16, 2, 7, 12, 17, 20, 23, 21, 24, 3, 8, 13, 18, 22, 25, 4, 9, 14, 19]], ["FSP", 4, 0, 1, 3], ["FSP", 4, 4, 2, 3], ["FSP", 4, 8, 3, 3], ["FSP", 4, 12, 4, 3], ["RE", 4, [0, 4, 8, 12, 1, 5, 9, 13, 2, 6, 10, 14, 3, 7, 11, 15]], ["CA", 3, 4, 11], ["CHR", 2, "shared", [3]], ["CA", 3, 4, 13], ["CHR", 1, "shared", [4]], ["CA", 2, 5, 13], ["CI", 1], ["FU", 6, [0, 1, 2, 3]], ["AN", 6, 0, 5], ["FU", 6, [1, 2, 3, 4]], ["AN", 6, 1, 4], ["FU", 6, [2, 3, 4, 5]], ["AN", 6, 2, 6], ["FU", 4, [0, 1, 2, 3]], ["SP", 4, 0, 15, [1], 1], ["AN", 4, 1, 2], ["FFSP", 4, 0, [4, 3, 2, 1], 1, 1], ["AN", 4, 1, 6], ["FU", 2, [0, 1, 2, 3]], ["SP", 2, 0, 60, [1], 1], ["AN", 2, 1, 2], ["FFSP", 2, 0, [4, 3, 2, 1], 1, 1], ["AN", 2, 1, 6], ["PR", 5, 0, "auto_unroll_max_step$512"]]]], "r": [[0.0212007], 0, 4.51058, 1638590632], "v": "v0.6"}
{"i": [["[\"depthwise_conv2d_layer\", 128, 672, 11, 11, 5, 5, 1, \"SAME\"]", "rocm -keys=rocm,gpu -max_num_threads=256 -mcpu=gfx906 -mtriple=amdgcn-amd-amdhsa-hcc -thread_warp_size=64", [-1, 16, 64, 65536, 2147483647, 1024, 16, 64], "", 0, []], [[], [["CHW", 3, "local"], ["SP", 3, 0, 128, [1, 2, 8, 1], 1], ["SP", 3, 5, 672, [1, 1, 2, 2], 1], ["SP", 3, 10, 11, [1, 11, 1, 1], 1], ["SP", 3, 15, 11, [1, 11, 1, 1], 1], ["SP", 3, 20, 5, [5, 1], 1], ["SP", 3, 23, 5, [1, 1], 1], ["RE", 3, [0, 5, 10, 15, 1, 6, 11, 16, 2, 7, 12, 17, 20, 23, 21, 24, 3, 8, 13, 18, 22, 25, 4, 9, 14, 19]], ["FSP", 4, 0, 1, 3], ["FSP", 4, 4, 2, 3], ["FSP", 4, 8, 3, 3], ["FSP", 4, 12, 4, 3], ["RE", 4, [0, 4, 8, 12, 1, 5, 9, 13, 2, 6, 10, 14, 3, 7, 11, 15]], ["CA", 3, 4, 11], ["CHR", 2, "shared", [3]], ["CA", 3, 4, 13], ["CHR", 1, "shared", [4]], ["CA", 2, 5, 13], ["CI", 1], ["FU", 6, [0, 1, 2, 3]], ["AN", 6, 0, 5], ["FU", 6, [1, 2, 3, 4]], ["AN", 6, 1, 4], ["FU", 6, [2, 3, 4, 5]], ["AN", 6, 2, 6], ["FU", 4, [0, 1, 2, 3]], ["SP", 4, 0, 20, [2], 1], ["AN", 4, 1, 2], ["FFSP", 4, 0, [4, 3, 2, 1], 1, 1], ["AN", 4, 1, 6], ["FU", 2, [0, 1, 2, 3]], ["SP", 2, 0, 160, [1], 1], ["AN", 2, 1, 2], ["FFSP", 2, 0, [4, 3, 2, 1], 1, 1], ["AN", 2, 1, 6], ["PR", 5, 0, "auto_unroll_max_step$0"]]]], "r": [[0.005208], 0, 2.84147, 1638590634], "v": "v0.6"}
{"i": [["[\"depthwise_conv2d_layer\", 128, 672, 11, 11, 5, 5, 1, \"SAME\"]", "rocm -keys=rocm,gpu -max_num_threads=256 -mcpu=gfx906 -mtriple=amdgcn-amd-amdhsa-hcc -thread_warp_size=64", [-1, 16, 64, 65536, 2147483647, 1024, 16, 64], "", 0, []], [[], [["CHW", 3, "local"], ["SP", 3, 0, 128, [1, 2, 8, 1], 1], ["SP", 3, 5, 672, [1, 1, 1, 4], 1], ["SP", 3, 10, 11, [1, 1, 1, 1], 1], ["SP", 3, 15, 11, [1, 1, 1, 1], 1], ["SP", 3, 20, 5, [5, 1], 1], ["SP", 3, 23, 5, [1, 1], 1], ["RE", 3, [0, 5, 10, 15, 1, 6, 11, 16, 2, 7, 12, 17, 20, 23, 21, 24, 3, 8, 13, 18, 22, 25, 4, 9, 14, 19]], ["FSP", 4, 0, 1, 3], ["FSP", 4, 4, 2, 3], ["FSP", 4, 8, 3, 3], ["FSP", 4, 12, 4, 3], ["RE", 4, [0, 4, 8, 12, 1, 5, 9, 13, 2, 6, 10, 14, 3, 7, 11, 15]], ["CA", 3, 4, 11], ["CHR", 2, "shared", [3]], ["CA", 3, 4, 13], ["CHR", 1, "shared", [4]], ["CA", 2, 5, 13], ["CI", 1], ["FU", 6, [0, 1, 2, 3]], ["AN", 6, 0, 5], ["FU", 6, [1, 2, 3, 4]], ["AN", 6, 1, 4], ["FU", 6, [2, 3, 4, 5]], ["AN", 6, 2, 6], ["FU", 4, [0, 1, 2, 3]], ["SP", 4, 0, 20, [1], 1], ["AN", 4, 1, 2], ["FFSP", 4, 0, [4, 3, 2, 1], 1, 1], ["AN", 4, 1, 6], ["FU", 2, [0, 1, 2, 3]], ["SP", 2, 0, 160, [1], 1], ["AN", 2, 1, 2], ["FFSP", 2, 0, [4, 3, 2, 1], 1, 1], ["AN", 2, 1, 6], ["PR", 5, 0, "auto_unroll_max_step$64"]]]], "r": [[0.0501781], 0, 3.00382, 1638590636], "v": "v0.6"}
{"i": [["[\"depthwise_conv2d_layer\", 128, 672, 11, 11, 5, 5, 1, \"SAME\"]", "rocm -keys=rocm,gpu -max_num_threads=256 -mcpu=gfx906 -mtriple=amdgcn-amd-amdhsa-hcc -thread_warp_size=64", [-1, 16, 64, 65536, 2147483647, 1024, 16, 64], "", 0, []], [[], [["CHW", 3, "local"], ["SP", 3, 0, 128, [2, 2, 1, 1], 1], ["SP", 3, 5, 672, [1, 8, 2, 1], 1], ["SP", 3, 10, 11, [1, 1, 1, 1], 1], ["SP", 3, 15, 11, [1, 11, 1, 1], 1], ["SP", 3, 20, 5, [5, 1], 1], ["SP", 3, 23, 5, [1, 1], 1], ["RE", 3, [0, 5, 10, 15, 1, 6, 11, 16, 2, 7, 12, 17, 20, 23, 21, 24, 3, 8, 13, 18, 22, 25, 4, 9, 14, 19]], ["FSP", 4, 0, 1, 3], ["FSP", 4, 4, 2, 3], ["FSP", 4, 8, 3, 3], ["FSP", 4, 12, 4, 3], ["RE", 4, [0, 4, 8, 12, 1, 5, 9, 13, 2, 6, 10, 14, 3, 7, 11, 15]], ["CA", 3, 4, 11], ["CHR", 2, "shared", [3]], ["CA", 3, 4, 13], ["CHR", 1, "shared", [4]], ["CA", 2, 5, 13], ["CI", 1], ["FU", 6, [0, 1, 2, 3]], ["AN", 6, 0, 5], ["FU", 6, [1, 2, 3, 4]], ["AN", 6, 1, 4], ["FU", 6, [2, 3, 4, 5]], ["AN", 6, 2, 6], ["FU", 4, [0, 1, 2, 3]], ["SP", 4, 0, 30, [1], 1], ["AN", 4, 1, 2], ["FFSP", 4, 0, [4, 3, 2, 1], 1, 1], ["AN", 4, 1, 6], ["FU", 2, [0, 1, 2, 3]], ["SP", 2, 0, 30, [1], 1], ["AN", 2, 1, 2], ["FFSP", 2, 0, [4, 3, 2, 1], 1, 1], ["AN", 2, 1, 6], ["PR", 5, 0, "auto_unroll_max_step$1024"]]]], "r": [[0.00726495], 0, 3.30722, 1638590637], "v": "v0.6"}
{"i": [["[\"depthwise_conv2d_layer\", 128, 672, 11, 11, 5, 5, 1, \"SAME\"]", "rocm -keys=rocm,gpu -max_num_threads=256 -mcpu=gfx906 -mtriple=amdgcn-amd-amdhsa-hcc -thread_warp_size=64", [-1, 16, 64, 65536, 2147483647, 1024, 16, 64], "", 0, []], [[], [["CHW", 3, "local"], ["SP", 3, 0, 128, [1, 2, 1, 2], 1], ["SP", 3, 5, 672, [1, 4, 1, 3], 1], ["SP", 3, 10, 11, [1, 11, 1, 1], 1], ["SP", 3, 15, 11, [1, 1, 11, 1], 1], ["SP", 3, 20, 5, [5, 1], 1], ["SP", 3, 23, 5, [1, 5], 1], ["RE", 3, [0, 5, 10, 15, 1, 6, 11, 16, 2, 7, 12, 17, 20, 23, 21, 24, 3, 8, 13, 18, 22, 25, 4, 9, 14, 19]], ["FSP", 4, 0, 1, 3], ["FSP", 4, 4, 2, 3], ["FSP", 4, 8, 3, 3], ["FSP", 4, 12, 4, 3], ["RE", 4, [0, 4, 8, 12, 1, 5, 9, 13, 2, 6, 10, 14, 3, 7, 11, 15]], ["CA", 3, 4, 11], ["CHR", 2, "shared", [3]], ["CA", 3, 4, 13], ["CHR", 1, "shared", [4]], ["CA", 2, 5, 13], ["CI", 1], ["FU", 6, [0, 1, 2, 3]], ["AN", 6, 0, 5], ["FU", 6, [1, 2, 3, 4]], ["AN", 6, 1, 4], ["FU", 6, [2, 3, 4, 5]], ["AN", 6, 2, 6], ["FU", 4, [0, 1, 2, 3]], ["SP", 4, 0, 75, [1], 1], ["AN", 4, 1, 2], ["FFSP", 4, 0, [4, 3, 2, 1], 1, 1], ["AN", 4, 1, 6], ["FU", 2, [0, 1, 2, 3]], ["SP", 2, 0, 150, [1], 1], ["AN", 2, 1, 2], ["FFSP", 2, 0, [4, 3, 2, 1], 1, 1], ["AN", 2, 1, 6], ["PR", 5, 0, "auto_unroll_max_step$64"]]]], "r": [[0.00349821], 0, 3.22796, 1638590639], "v": "v0.6"}
{"i": [["[\"depthwise_conv2d_layer\", 128, 672, 11, 11, 5, 5, 1, \"SAME\"]", "rocm -keys=rocm,gpu -max_num_threads=256 -mcpu=gfx906 -mtriple=amdgcn-amd-amdhsa-hcc -thread_warp_size=64", [-1, 16, 64, 65536, 2147483647, 1024, 16, 64], "", 0, []], [[], [["CHW", 3, "local"], ["SP", 3, 0, 128, [2, 4, 1, 2], 1], ["SP", 3, 5, 672, [2, 2, 1, 3], 1], ["SP", 3, 10, 11, [1, 1, 1, 1], 1], ["SP", 3, 15, 11, [1, 11, 1, 1], 1], ["SP", 3, 20, 5, [1, 1], 1], ["SP", 3, 23, 5, [1, 1], 1], ["RE", 3, [0, 5, 10, 15, 1, 6, 11, 16, 2, 7, 12, 17, 20, 23, 21, 24, 3, 8, 13, 18, 22, 25, 4, 9, 14, 19]], ["FSP", 4, 0, 1, 3], ["FSP", 4, 4, 2, 3], ["FSP", 4, 8, 3, 3], ["FSP", 4, 12, 4, 3], ["RE", 4, [0, 4, 8, 12, 1, 5, 9, 13, 2, 6, 10, 14, 3, 7, 11, 15]], ["CA", 3, 4, 11], ["CHR", 2, "shared", [3]], ["CA", 3, 4, 13], ["CHR", 1, "shared", [4]], ["CA", 2, 5, 13], ["CI", 1], ["FU", 6, [0, 1, 2, 3]], ["AN", 6, 0, 5], ["FU", 6, [1, 2, 3, 4]], ["AN", 6, 1, 4], ["FU", 6, [2, 3, 4, 5]], ["AN", 6, 2, 6], ["FU", 4, [0, 1, 2, 3]], ["SP", 4, 0, 3, [1], 1], ["AN", 4, 1, 2], ["FFSP", 4, 0, [4, 3, 2, 1], 1, 1], ["AN", 4, 1, 6], ["FU", 2, [0, 1, 2, 3]], ["SP", 2, 0, 6, [1], 1], ["AN", 2, 1, 2], ["FFSP", 2, 0, [4, 3, 2, 1], 1, 1], ["AN", 2, 1, 6], ["PR", 5, 0, "auto_unroll_max_step$64"]]]], "r": [[0.0019104], 0, 2.86334, 1638590641], "v": "v0.6"}
{"i": [["[\"depthwise_conv2d_layer\", 128, 672, 11, 11, 5, 5, 1, \"SAME\"]", "rocm -keys=rocm,gpu -max_num_threads=256 -mcpu=gfx906 -mtriple=amdgcn-amd-amdhsa-hcc -thread_warp_size=64", [-1, 16, 64, 65536, 2147483647, 1024, 16, 64], "", 0, []], [[], [["CHW", 3, "local"], ["SP", 3, 0, 128, [1, 2, 1, 2], 1], ["SP", 3, 5, 672, [1, 4, 1, 3], 1], ["SP", 3, 10, 11, [1, 11, 1, 1], 1], ["SP", 3, 15, 11, [11, 1, 1, 1], 1], ["SP", 3, 20, 5, [1, 5], 1], ["SP", 3, 23, 5, [5, 1], 1], ["RE", 3, [0, 5, 10, 15, 1, 6, 11, 16, 2, 7, 12, 17, 20, 23, 21, 24, 3, 8, 13, 18, 22, 25, 4, 9, 14, 19]], ["FSP", 4, 0, 1, 3], ["FSP", 4, 4, 2, 3], ["FSP", 4, 8, 3, 3], ["FSP", 4, 12, 4, 3], ["RE", 4, [0, 4, 8, 12, 1, 5, 9, 13, 2, 6, 10, 14, 3, 7, 11, 15]], ["CA", 3, 4, 11], ["CHR", 2, "shared", [3]], ["CA", 3, 4, 13], ["CHR", 1, "shared", [4]], ["CA", 2, 5, 13], ["CI", 1], ["FU", 6, [0, 1, 2, 3]], ["AN", 6, 0, 5], ["FU", 6, [1, 2, 3, 4]], ["AN", 6, 1, 4], ["FU", 6, [2, 3, 4, 5]], ["AN", 6, 2, 6], ["FU", 4, [0, 1, 2, 3]], ["SP", 4, 0, 75, [1], 1], ["AN", 4, 1, 2], ["FFSP", 4, 0, [4, 3, 2, 1], 1, 1], ["AN", 4, 1, 6], ["FU", 2, [0, 1, 2, 3]], ["SP", 2, 0, 150, [1], 1], ["AN", 2, 1, 2], ["FFSP", 2, 0, [4, 3, 2, 1], 1, 1], ["AN", 2, 1, 6], ["PR", 5, 0, "auto_unroll_max_step$64"]]]], "r": [[0.0372919], 0, 3.21151, 1638590642], "v": "v0.6"}
{"i": [["[\"depthwise_conv2d_layer\", 128, 672, 11, 11, 5, 5, 1, \"SAME\"]", "rocm -keys=rocm,gpu -max_num_threads=256 -mcpu=gfx906 -mtriple=amdgcn-amd-amdhsa-hcc -thread_warp_size=64", [-1, 16, 64, 65536, 2147483647, 1024, 16, 64], "", 0, []], [[], [["CHW", 3, "local"], ["SP", 3, 0, 128, [1, 8, 1, 2], 1], ["SP", 3, 5, 672, [1, 2, 4, 1], 1], ["SP", 3, 10, 11, [1, 11, 1, 1], 1], ["SP", 3, 15, 11, [1, 1, 1, 1], 1], ["SP", 3, 20, 5, [1, 1], 1], ["SP", 3, 23, 5, [1, 1], 1], ["RE", 3, [0, 5, 10, 15, 1, 6, 11, 16, 2, 7, 12, 17, 20, 23, 21, 24, 3, 8, 13, 18, 22, 25, 4, 9, 14, 19]], ["FSP", 4, 0, 1, 3], ["FSP", 4, 4, 2, 3], ["FSP", 4, 8, 3, 3], ["FSP", 4, 12, 4, 3], ["RE", 4, [0, 4, 8, 12, 1, 5, 9, 13, 2, 6, 10, 14, 3, 7, 11, 15]], ["CA", 3, 4, 11], ["CHR", 2, "shared", [3]], ["CA", 3, 4, 13], ["CHR", 1, "shared", [4]], ["CA", 2, 5, 13], ["CI", 1], ["FU", 6, [0, 1, 2, 3]], ["AN", 6, 0, 5], ["FU", 6, [1, 2, 3, 4]], ["AN", 6, 1, 4], ["FU", 6, [2, 3, 4, 5]], ["AN", 6, 2, 6], ["FU", 4, [0, 1, 2, 3]], ["SP", 4, 0, 4, [2], 1], ["AN", 4, 1, 2], ["FFSP", 4, 0, [4, 3, 2, 1], 1, 1], ["AN", 4, 1, 6], ["FU", 2, [0, 1, 2, 3]], ["SP", 2, 0, 8, [1], 1], ["AN", 2, 1, 2], ["FFSP", 2, 0, [4, 3, 2, 1], 1, 1], ["AN", 2, 1, 6], ["PR", 5, 0, "auto_unroll_max_step$64"]]]], "r": [[0.00591732], 0, 1.88626, 1638590643], "v": "v0.6"}
{"i": [["[\"depthwise_conv2d_layer\", 128, 672, 11, 11, 5, 5, 1, \"SAME\"]", "rocm -keys=rocm,gpu -max_num_threads=256 -mcpu=gfx906 -mtriple=amdgcn-amd-amdhsa-hcc -thread_warp_size=64", [-1, 16, 64, 65536, 2147483647, 1024, 16, 64], "", 0, []], [[], [["CHW", 3, "local"], ["SP", 3, 0, 128, [1, 1, 2, 4], 1], ["SP", 3, 5, 672, [3, 7, 1, 4], 1], ["SP", 3, 10, 11, [1, 11, 1, 1], 1], ["SP", 3, 15, 11, [1, 1, 1, 1], 1], ["SP", 3, 20, 5, [5, 1], 1], ["SP", 3, 23, 5, [1, 1], 1], ["RE", 3, [0, 5, 10, 15, 1, 6, 11, 16, 2, 7, 12, 17, 20, 23, 21, 24, 3, 8, 13, 18, 22, 25, 4, 9, 14, 19]], ["FSP", 4, 0, 1, 3], ["FSP", 4, 4, 2, 3], ["FSP", 4, 8, 3, 3], ["FSP", 4, 12, 4, 3], ["RE", 4, [0, 4, 8, 12, 1, 5, 9, 13, 2, 6, 10, 14, 3, 7, 11, 15]], ["CA", 3, 4, 11], ["CHR", 2, "shared", [3]], ["CA", 3, 4, 13], ["CHR", 1, "shared", [4]], ["CA", 2, 5, 13], ["CI", 1], ["FU", 6, [0, 1, 2, 3]], ["AN", 6, 0, 5], ["FU", 6, [1, 2, 3, 4]], ["AN", 6, 1, 4], ["FU", 6, [2, 3, 4, 5]], ["AN", 6, 2, 6], ["FU", 4, [0, 1, 2, 3]], ["SP", 4, 0, 20, [20], 1], ["AN", 4, 1, 2], ["FFSP", 4, 0, [4, 3, 2, 1], 1, 1], ["AN", 4, 1, 6], ["FU", 2, [0, 1, 2, 3]], ["SP", 2, 0, 160, [5], 1], ["AN", 2, 1, 2], ["FFSP", 2, 0, [4, 3, 2, 1], 1, 1], ["AN", 2, 1, 6], ["PR", 5, 0, "auto_unroll_max_step$64"]]]], "r": [[0.013326], 0, 3.04107, 1638590645], "v": "v0.6"}
{"i": [["[\"depthwise_conv2d_layer\", 128, 672, 11, 11, 5, 5, 1, \"SAME\"]", "rocm -keys=rocm,gpu -max_num_threads=256 -mcpu=gfx906 -mtriple=amdgcn-amd-amdhsa-hcc -thread_warp_size=64", [-1, 16, 64, 65536, 2147483647, 1024, 16, 64], "", 0, []], [[], [["CHW", 3, "local"], ["SP", 3, 0, 128, [1, 2, 1, 1], 1], ["SP", 3, 5, 672, [1, 4, 1, 3], 1], ["SP", 3, 10, 11, [1, 11, 1, 1], 1], ["SP", 3, 15, 11, [11, 1, 1, 1], 1], ["SP", 3, 20, 5, [1, 1], 1], ["SP", 3, 23, 5, [5, 1], 1], ["RE", 3, [0, 5, 10, 15, 1, 6, 11, 16, 2, 7, 12, 17, 20, 23, 21, 24, 3, 8, 13, 18, 22, 25, 4, 9, 14, 19]], ["FSP", 4, 0, 1, 3], ["FSP", 4, 4, 2, 3], ["FSP", 4, 8, 3, 3], ["FSP", 4, 12, 4, 3], ["RE", 4, [0, 4, 8, 12, 1, 5, 9, 13, 2, 6, 10, 14, 3, 7, 11, 15]], ["CA", 3, 4, 11], ["CHR", 2, "shared", [3]], ["CA", 3, 4, 13], ["CHR", 1, "shared", [4]], ["CA", 2, 5, 13], ["CI", 1], ["FU", 6, [0, 1, 2, 3]], ["AN", 6, 0, 5], ["FU", 6, [1, 2, 3, 4]], ["AN", 6, 1, 4], ["FU", 6, [2, 3, 4, 5]], ["AN", 6, 2, 6], ["FU", 4, [0, 1, 2, 3]], ["SP", 4, 0, 75, [1], 1], ["AN", 4, 1, 2], ["FFSP", 4, 0, [4, 3, 2, 1], 1, 1], ["AN", 4, 1, 6], ["FU", 2, [0, 1, 2, 3]], ["SP", 2, 0, 150, [1], 1], ["AN", 2, 1, 2], ["FFSP", 2, 0, [4, 3, 2, 1], 1, 1], ["AN", 2, 1, 6], ["PR", 5, 0, "auto_unroll_max_step$64"]]]], "r": [[0.00336171], 0, 3.22576, 1638590647], "v": "v0.6"}
{"i": [["[\"depthwise_conv2d_layer\", 128, 672, 11, 11, 5, 5, 1, \"SAME\"]", "rocm -keys=rocm,gpu -max_num_threads=256 -mcpu=gfx906 -mtriple=amdgcn-amd-amdhsa-hcc -thread_warp_size=64", [-1, 16, 64, 65536, 2147483647, 1024, 16, 64], "", 0, []], [[], [["CHW", 3, "local"], ["SP", 3, 0, 128, [1, 1, 1, 2], 1], ["SP", 3, 5, 672, [1, 2, 4, 2], 1], ["SP", 3, 10, 11, [1, 11, 1, 1], 1], ["SP", 3, 15, 11, [1, 1, 1, 1], 1], ["SP", 3, 20, 5, [1, 1], 1], ["SP", 3, 23, 5, [1, 1], 1], ["RE", 3, [0, 5, 10, 15, 1, 6, 11, 16, 2, 7, 12, 17, 20, 23, 21, 24, 3, 8, 13, 18, 22, 25, 4, 9, 14, 19]], ["FSP", 4, 0, 1, 3], ["FSP", 4, 4, 2, 3], ["FSP", 4, 8, 3, 3], ["FSP", 4, 12, 4, 3], ["RE", 4, [0, 4, 8, 12, 1, 5, 9, 13, 2, 6, 10, 14, 3, 7, 11, 15]], ["CA", 3, 4, 11], ["CHR", 2, "shared", [3]], ["CA", 3, 4, 13], ["CHR", 1, "shared", [4]], ["CA", 2, 5, 13], ["CI", 1], ["FU", 6, [0, 1, 2, 3]], ["AN", 6, 0, 5], ["FU", 6, [1, 2, 3, 4]], ["AN", 6, 1, 4], ["FU", 6, [2, 3, 4, 5]], ["AN", 6, 2, 6], ["FU", 4, [0, 1, 2, 3]], ["SP", 4, 0, 8, [1], 1], ["AN", 4, 1, 2], ["FFSP", 4, 0, [4, 3, 2, 1], 1, 1], ["AN", 4, 1, 6], ["FU", 2, [0, 1, 2, 3]], ["SP", 2, 0, 16, [8], 1], ["AN", 2, 1, 2], ["FFSP", 2, 0, [4, 3, 2, 1], 1, 1], ["AN", 2, 1, 6], ["PR", 5, 0, "auto_unroll_max_step$0"]]]], "r": [[0.00816242], 0, 1.9907, 1638590648], "v": "v0.6"}
{"i": [["[\"depthwise_conv2d_layer\", 128, 672, 11, 11, 5, 5, 1, \"SAME\"]", "rocm -keys=rocm,gpu -max_num_threads=256 -mcpu=gfx906 -mtriple=amdgcn-amd-amdhsa-hcc -thread_warp_size=64", [-1, 16, 64, 65536, 2147483647, 1024, 16, 64], "", 0, []], [[], [["CHW", 3, "local"], ["SP", 3, 0, 128, [1, 4, 2, 2], 1], ["SP", 3, 5, 672, [4, 2, 3, 2], 1], ["SP", 3, 10, 11, [1, 1, 1, 1], 1], ["SP", 3, 15, 11, [1, 11, 1, 1], 1], ["SP", 3, 20, 5, [1, 1], 1], ["SP", 3, 23, 5, [5, 1], 1], ["RE", 3, [0, 5, 10, 15, 1, 6, 11, 16, 2, 7, 12, 17, 20, 23, 21, 24, 3, 8, 13, 18, 22, 25, 4, 9, 14, 19]], ["FSP", 4, 0, 1, 3], ["FSP", 4, 4, 2, 3], ["FSP", 4, 8, 3, 3], ["FSP", 4, 12, 4, 3], ["RE", 4, [0, 4, 8, 12, 1, 5, 9, 13, 2, 6, 10, 14, 3, 7, 11, 15]], ["CA", 3, 4, 11], ["CHR", 2, "shared", [3]], ["CA", 3, 4, 13], ["CHR", 1, "shared", [4]], ["CA", 2, 5, 13], ["CI", 1], ["FU", 6, [0, 1, 2, 3]], ["AN", 6, 0, 5], ["FU", 6, [1, 2, 3, 4]], ["AN", 6, 1, 4], ["FU", 6, [2, 3, 4, 5]], ["AN", 6, 2, 6], ["FU", 4, [0, 1, 2, 3]], ["SP", 4, 0, 30, [1], 1], ["AN", 4, 1, 2], ["FFSP", 4, 0, [4, 3, 2, 1], 1, 1], ["AN", 4, 1, 6], ["FU", 2, [0, 1, 2, 3]], ["SP", 2, 0, 120, [1], 1], ["AN", 2, 1, 2], ["FFSP", 2, 0, [4, 3, 2, 1], 1, 1], ["AN", 2, 1, 6], ["PR", 5, 0, "auto_unroll_max_step$512"]]]], "r": [[0.0170041], 0, 6.05231, 1638590650], "v": "v0.6"}
{"i": [["[\"depthwise_conv2d_layer\", 128, 672, 11, 11, 5, 5, 1, \"SAME\"]", "rocm -keys=rocm,gpu -max_num_threads=256 -mcpu=gfx906 -mtriple=amdgcn-amd-amdhsa-hcc -thread_warp_size=64", [-1, 16, 64, 65536, 2147483647, 1024, 16, 64], "", 0, []], [[], [["CHW", 3, "local"], ["SP", 3, 0, 128, [1, 4, 4, 1], 1], ["SP", 3, 5, 672, [1, 7, 6, 2], 1], ["SP", 3, 10, 11, [1, 11, 1, 1], 1], ["SP", 3, 15, 11, [1, 1, 1, 1], 1], ["SP", 3, 20, 5, [1, 1], 1], ["SP", 3, 23, 5, [1, 1], 1], ["RE", 3, [0, 5, 10, 15, 1, 6, 11, 16, 2, 7, 12, 17, 20, 23, 21, 24, 3, 8, 13, 18, 22, 25, 4, 9, 14, 19]], ["FSP", 4, 0, 1, 3], ["FSP", 4, 4, 2, 3], ["FSP", 4, 8, 3, 3], ["FSP", 4, 12, 4, 3], ["RE", 4, [0, 4, 8, 12, 1, 5, 9, 13, 2, 6, 10, 14, 3, 7, 11, 15]], ["CA", 3, 4, 11], ["CHR", 2, "shared", [3]], ["CA", 3, 4, 13], ["CHR", 1, "shared", [4]], ["CA", 2, 5, 13], ["CI", 1], ["FU", 6, [0, 1, 2, 3]], ["AN", 6, 0, 5], ["FU", 6, [1, 2, 3, 4]], ["AN", 6, 1, 4], ["FU", 6, [2, 3, 4, 5]], ["AN", 6, 2, 6], ["FU", 4, [0, 1, 2, 3]], ["SP", 4, 0, 12, [1], 1], ["AN", 4, 1, 2], ["FFSP", 4, 0, [4, 3, 2, 1], 1, 1], ["AN", 4, 1, 6], ["FU", 2, [0, 1, 2, 3]], ["SP", 2, 0, 24, [1], 1], ["AN", 2, 1, 2], ["FFSP", 2, 0, [4, 3, 2, 1], 1, 1], ["AN", 2, 1, 6], ["PR", 5, 0, "auto_unroll_max_step$1024"]]]], "r": [[0.0171986], 0, 4.5017, 1638590651], "v": "v0.6"}
{"i": [["[\"depthwise_conv2d_layer\", 128, 672, 11, 11, 5, 5, 1, \"SAME\"]", "rocm -keys=rocm,gpu -max_num_threads=256 -mcpu=gfx906 -mtriple=amdgcn-amd-amdhsa-hcc -thread_warp_size=64", [-1, 16, 64, 65536, 2147483647, 1024, 16, 64], "", 0, []], [[], [["CHW", 3, "local"], ["SP", 3, 0, 128, [2, 4, 2, 1], 1], ["SP", 3, 5, 672, [1, 7, 6, 2], 1], ["SP", 3, 10, 11, [1, 11, 1, 1], 1], ["SP", 3, 15, 11, [1, 1, 1, 1], 1], ["SP", 3, 20, 5, [1, 1], 1], ["SP", 3, 23, 5, [1, 1], 1], ["RE", 3, [0, 5, 10, 15, 1, 6, 11, 16, 2, 7, 12, 17, 20, 23, 21, 24, 3, 8, 13, 18, 22, 25, 4, 9, 14, 19]], ["FSP", 4, 0, 1, 3], ["FSP", 4, 4, 2, 3], ["FSP", 4, 8, 3, 3], ["FSP", 4, 12, 4, 3], ["RE", 4, [0, 4, 8, 12, 1, 5, 9, 13, 2, 6, 10, 14, 3, 7, 11, 15]], ["CA", 3, 4, 11], ["CHR", 2, "shared", [3]], ["CA", 3, 4, 13], ["CHR", 1, "shared", [4]], ["CA", 2, 5, 13], ["CI", 1], ["FU", 6, [0, 1, 2, 3]], ["AN", 6, 0, 5], ["FU", 6, [1, 2, 3, 4]], ["AN", 6, 1, 4], ["FU", 6, [2, 3, 4, 5]], ["AN", 6, 2, 6], ["FU", 4, [0, 1, 2, 3]], ["SP", 4, 0, 12, [1], 1], ["AN", 4, 1, 2], ["FFSP", 4, 0, [4, 3, 2, 1], 1, 1], ["AN", 4, 1, 6], ["FU", 2, [0, 1, 2, 3]], ["SP", 2, 0, 24, [1], 1], ["AN", 2, 1, 2], ["FFSP", 2, 0, [4, 3, 2, 1], 1, 1], ["AN", 2, 1, 6], ["PR", 5, 0, "auto_unroll_max_step$1024"]]]], "r": [[0.0141208], 0, 4.19216, 1638590652], "v": "v0.6"}
{"i": [["[\"depthwise_conv2d_layer\", 128, 672, 11, 11, 5, 5, 1, \"SAME\"]", "rocm -keys=rocm,gpu -max_num_threads=256 -mcpu=gfx906 -mtriple=amdgcn-amd-amdhsa-hcc -thread_warp_size=64", [-1, 16, 64, 65536, 2147483647, 1024, 16, 64], "", 0, []], [[], [["CHW", 3, "local"], ["SP", 3, 0, 128, [2, 8, 1, 4], 1], ["SP", 3, 5, 672, [1, 1, 12, 1], 1], ["SP", 3, 10, 11, [1, 1, 1, 1], 1], ["SP", 3, 15, 11, [1, 11, 1, 1], 1], ["SP", 3, 20, 5, [1, 1], 1], ["SP", 3, 23, 5, [1, 5], 1], ["RE", 3, [0, 5, 10, 15, 1, 6, 11, 16, 2, 7, 12, 17, 20, 23, 21, 24, 3, 8, 13, 18, 22, 25, 4, 9, 14, 19]], ["FSP", 4, 0, 1, 3], ["FSP", 4, 4, 2, 3], ["FSP", 4, 8, 3, 3], ["FSP", 4, 12, 4, 3], ["RE", 4, [0, 4, 8, 12, 1, 5, 9, 13, 2, 6, 10, 14, 3, 7, 11, 15]], ["CA", 3, 4, 11], ["CHR", 2, "shared", [3]], ["CA", 3, 4, 13], ["CHR", 1, "shared", [4]], ["CA", 2, 5, 13], ["CI", 1], ["FU", 6, [0, 1, 2, 3]], ["AN", 6, 0, 5], ["FU", 6, [1, 2, 3, 4]], ["AN", 6, 1, 4], ["FU", 6, [2, 3, 4, 5]], ["AN", 6, 2, 6], ["FU", 4, [0, 1, 2, 3]], ["SP", 4, 0, 60, [1], 1], ["AN", 4, 1, 2], ["FFSP", 4, 0, [4, 3, 2, 1], 1, 1], ["AN", 4, 1, 6], ["FU", 2, [0, 1, 2, 3]], ["SP", 2, 0, 240, [1], 1], ["AN", 2, 1, 2], ["FFSP", 2, 0, [4, 3, 2, 1], 1, 1], ["AN", 2, 1, 6], ["PR", 5, 0, "auto_unroll_max_step$64"]]]], "r": [[0.00822865], 0, 2.50497, 1638590654], "v": "v0.6"}
{"i": [["[\"depthwise_conv2d_layer\", 128, 672, 11, 11, 5, 5, 1, \"SAME\"]", "rocm -keys=rocm,gpu -max_num_threads=256 -mcpu=gfx906 -mtriple=amdgcn-amd-amdhsa-hcc -thread_warp_size=64", [-1, 16, 64, 65536, 2147483647, 1024, 16, 64], "", 0, []], [[], [["CHW", 3, "local"], ["SP", 3, 0, 128, [2, 2, 2, 1], 1], ["SP", 3, 5, 672, [1, 1, 4, 1], 1], ["SP", 3, 10, 11, [1, 11, 1, 1], 1], ["SP", 3, 15, 11, [1, 11, 1, 1], 1], ["SP", 3, 20, 5, [5, 1], 1], ["SP", 3, 23, 5, [1, 5], 1], ["RE", 3, [0, 5, 10, 15, 1, 6, 11, 16, 2, 7, 12, 17, 20, 23, 21, 24, 3, 8, 13, 18, 22, 25, 4, 9, 14, 19]], ["FSP", 4, 0, 1, 3], ["FSP", 4, 4, 2, 3], ["FSP", 4, 8, 3, 3], ["FSP", 4, 12, 4, 3], ["RE", 4, [0, 4, 8, 12, 1, 5, 9, 13, 2, 6, 10, 14, 3, 7, 11, 15]], ["CA", 3, 4, 11], ["CHR", 2, "shared", [3]], ["CA", 3, 4, 13], ["CHR", 1, "shared", [4]], ["CA", 2, 5, 13], ["CI", 1], ["FU", 6, [0, 1, 2, 3]], ["AN", 6, 0, 5], ["FU", 6, [1, 2, 3, 4]], ["AN", 6, 1, 4], ["FU", 6, [2, 3, 4, 5]], ["AN", 6, 2, 6], ["FU", 4, [0, 1, 2, 3]], ["SP", 4, 0, 50, [1], 1], ["AN", 4, 1, 2], ["FFSP", 4, 0, [4, 3, 2, 1], 1, 1], ["AN", 4, 1, 6], ["FU", 2, [0, 1, 2, 3]], ["SP", 2, 0, 100, [50], 1], ["AN", 2, 1, 2], ["FFSP", 2, 0, [4, 3, 2, 1], 1, 1], ["AN", 2, 1, 6], ["PR", 5, 0, "auto_unroll_max_step$0"]]]], "r": [[0.000779521], 0, 2.67929, 1638590656], "v": "v0.6"}
{"i": [["[\"depthwise_conv2d_layer\", 128, 672, 11, 11, 5, 5, 1, \"SAME\"]", "rocm -keys=rocm,gpu -max_num_threads=256 -mcpu=gfx906 -mtriple=amdgcn-amd-amdhsa-hcc -thread_warp_size=64", [-1, 16, 64, 65536, 2147483647, 1024, 16, 64], "", 0, []], [[], [["CHW", 3, "local"], ["SP", 3, 0, 128, [2, 1, 1, 2], 1], ["SP", 3, 5, 672, [6, 2, 1, 1], 1], ["SP", 3, 10, 11, [1, 11, 1, 1], 1], ["SP", 3, 15, 11, [1, 11, 1, 1], 1], ["SP", 3, 20, 5, [1, 5], 1], ["SP", 3, 23, 5, [1, 5], 1], ["RE", 3, [0, 5, 10, 15, 1, 6, 11, 16, 2, 7, 12, 17, 20, 23, 21, 24, 3, 8, 13, 18, 22, 25, 4, 9, 14, 19]], ["FSP", 4, 0, 1, 3], ["FSP", 4, 4, 2, 3], ["FSP", 4, 8, 3, 3], ["FSP", 4, 12, 4, 3], ["RE", 4, [0, 4, 8, 12, 1, 5, 9, 13, 2, 6, 10, 14, 3, 7, 11, 15]], ["CA", 3, 4, 11], ["CHR", 2, "shared", [3]], ["CA", 3, 4, 13], ["CHR", 1, "shared", [4]], ["CA", 2, 5, 13], ["CI", 1], ["FU", 6, [0, 1, 2, 3]], ["AN", 6, 0, 5], ["FU", 6, [1, 2, 3, 4]], ["AN", 6, 1, 4], ["FU", 6, [2, 3, 4, 5]], ["AN", 6, 2, 6], ["FU", 4, [0, 1, 2, 3]], ["SP", 4, 0, 5, [1], 1], ["AN", 4, 1, 2], ["FFSP", 4, 0, [4, 3, 2, 1], 1, 1], ["AN", 4, 1, 6], ["FU", 2, [0, 1, 2, 3]], ["SP", 2, 0, 10, [10], 1], ["AN", 2, 1, 2], ["FFSP", 2, 0, [4, 3, 2, 1], 1, 1], ["AN", 2, 1, 6], ["PR", 5, 0, "auto_unroll_max_step$64"]]]], "r": [[0.0009152], 0, 3.53417, 1638590657], "v": "v0.6"}
{"i": [["[\"depthwise_conv2d_layer\", 128, 672, 11, 11, 5, 5, 1, \"SAME\"]", "rocm -keys=rocm,gpu -max_num_threads=256 -mcpu=gfx906 -mtriple=amdgcn-amd-amdhsa-hcc -thread_warp_size=64", [-1, 16, 64, 65536, 2147483647, 1024, 16, 64], "", 0, []], [[], [["CHW", 3, "local"], ["SP", 3, 0, 128, [2, 1, 1, 2], 1], ["SP", 3, 5, 672, [2, 1, 2, 3], 1], ["SP", 3, 10, 11, [1, 1, 1, 1], 1], ["SP", 3, 15, 11, [1, 11, 1, 1], 1], ["SP", 3, 20, 5, [1, 1], 1], ["SP", 3, 23, 5, [1, 1], 1], ["RE", 3, [0, 5, 10, 15, 1, 6, 11, 16, 2, 7, 12, 17, 20, 23, 21, 24, 3, 8, 13, 18, 22, 25, 4, 9, 14, 19]], ["FSP", 4, 0, 1, 3], ["FSP", 4, 4, 2, 3], ["FSP", 4, 8, 3, 3], ["FSP", 4, 12, 4, 3], ["RE", 4, [0, 4, 8, 12, 1, 5, 9, 13, 2, 6, 10, 14, 3, 7, 11, 15]], ["CA", 3, 4, 11], ["CHR", 2, "shared", [3]], ["CA", 3, 4, 13], ["CHR", 1, "shared", [4]], ["CA", 2, 5, 13], ["CI", 1], ["FU", 6, [0, 1, 2, 3]], ["AN", 6, 0, 5], ["FU", 6, [1, 2, 3, 4]], ["AN", 6, 1, 4], ["FU", 6, [2, 3, 4, 5]], ["AN", 6, 2, 6], ["FU", 4, [0, 1, 2, 3]], ["SP", 4, 0, 3, [3], 1], ["AN", 4, 1, 2], ["FFSP", 4, 0, [4, 3, 2, 1], 1, 1], ["AN", 4, 1, 6], ["FU", 2, [0, 1, 2, 3]], ["SP", 2, 0, 6, [1], 1], ["AN", 2, 1, 2], ["FFSP", 2, 0, [4, 3, 2, 1], 1, 1], ["AN", 2, 1, 6], ["PR", 5, 0, "auto_unroll_max_step$1024"]]]], "r": [[0.0155558], 0, 4.02816, 1638590659], "v": "v0.6"}
{"i": [["[\"depthwise_conv2d_layer\", 128, 672, 11, 11, 5, 5, 1, \"SAME\"]", "rocm -keys=rocm,gpu -max_num_threads=256 -mcpu=gfx906 -mtriple=amdgcn-amd-amdhsa-hcc -thread_warp_size=64", [-1, 16, 64, 65536, 2147483647, 1024, 16, 64], "", 0, []], [[], [["CHW", 3, "local"], ["SP", 3, 0, 128, [2, 2, 2, 2], 1], ["SP", 3, 5, 672, [1, 3, 1, 1], 1], ["SP", 3, 10, 11, [1, 11, 1, 1], 1], ["SP", 3, 15, 11, [1, 1, 1, 1], 1], ["SP", 3, 20, 5, [1, 1], 1], ["SP", 3, 23, 5, [1, 1], 1], ["RE", 3, [0, 5, 10, 15, 1, 6, 11, 16, 2, 7, 12, 17, 20, 23, 21, 24, 3, 8, 13, 18, 22, 25, 4, 9, 14, 19]], ["FSP", 4, 0, 1, 3], ["FSP", 4, 4, 2, 3], ["FSP", 4, 8, 3, 3], ["FSP", 4, 12, 4, 3], ["RE", 4, [0, 4, 8, 12, 1, 5, 9, 13, 2, 6, 10, 14, 3, 7, 11, 15]], ["CA", 3, 4, 11], ["CHR", 2, "shared", [3]], ["CA", 3, 4, 13], ["CHR", 1, "shared", [4]], ["CA", 2, 5, 13], ["CI", 1], ["FU", 6, [0, 1, 2, 3]], ["AN", 6, 0, 5], ["FU", 6, [1, 2, 3, 4]], ["AN", 6, 1, 4], ["FU", 6, [2, 3, 4, 5]], ["AN", 6, 2, 6], ["FU", 4, [0, 1, 2, 3]], ["SP", 4, 0, 1, [1], 1], ["AN", 4, 1, 2], ["FFSP", 4, 0, [4, 3, 2, 1], 1, 1], ["AN", 4, 1, 6], ["FU", 2, [0, 1, 2, 3]], ["SP", 2, 0, 4, [2], 1], ["AN", 2, 1, 2], ["FFSP", 2, 0, [4, 3, 2, 1], 1, 1], ["AN", 2, 1, 6], ["PR", 5, 0, "auto_unroll_max_step$0"]]]], "r": [[0.00805509], 0, 2.3099, 1638590660], "v": "v0.6"}
{"i": [["[\"depthwise_conv2d_layer\", 128, 672, 11, 11, 5, 5, 1, \"SAME\"]", "rocm -keys=rocm,gpu -max_num_threads=256 -mcpu=gfx906 -mtriple=amdgcn-amd-amdhsa-hcc -thread_warp_size=64", [-1, 16, 64, 65536, 2147483647, 1024, 16, 64], "", 0, []], [[], [["CHW", 3, "local"], ["SP", 3, 0, 128, [2, 16, 2, 1], 1], ["SP", 3, 5, 672, [2, 24, 1, 1], 1], ["SP", 3, 10, 11, [1, 1, 1, 1], 1], ["SP", 3, 15, 11, [1, 1, 1, 1], 1], ["SP", 3, 20, 5, [1, 1], 1], ["SP", 3, 23, 5, [5, 1], 1], ["RE", 3, [0, 5, 10, 15, 1, 6, 11, 16, 2, 7, 12, 17, 20, 23, 21, 24, 3, 8, 13, 18, 22, 25, 4, 9, 14, 19]], ["FSP", 4, 0, 1, 3], ["FSP", 4, 4, 2, 3], ["FSP", 4, 8, 3, 3], ["FSP", 4, 12, 4, 3], ["RE", 4, [0, 4, 8, 12, 1, 5, 9, 13, 2, 6, 10, 14, 3, 7, 11, 15]], ["CA", 3, 4, 11], ["CHR", 2, "shared", [3]], ["CA", 3, 4, 13], ["CHR", 1, "shared", [4]], ["CA", 2, 5, 13], ["CI", 1], ["FU", 6, [0, 1, 2, 3]], ["AN", 6, 0, 5], ["FU", 6, [1, 2, 3, 4]], ["AN", 6, 1, 4], ["FU", 6, [2, 3, 4, 5]], ["AN", 6, 2, 6], ["FU", 4, [0, 1, 2, 3]], ["SP", 4, 0, 5, [1], 1], ["AN", 4, 1, 2], ["FFSP", 4, 0, [4, 3, 2, 1], 1, 1], ["AN", 4, 1, 6], ["FU", 2, [0, 1, 2, 3]], ["SP", 2, 0, 10, [1], 1], ["AN", 2, 1, 2], ["FFSP", 2, 0, [4, 3, 2, 1], 1, 1], ["AN", 2, 1, 6], ["PR", 5, 0, "auto_unroll_max_step$16"]]]], "r": [[0.00634903], 0, 3.0221, 1638590662], "v": "v0.6"}
{"i": [["[\"depthwise_conv2d_layer\", 128, 672, 11, 11, 5, 5, 1, \"SAME\"]", "rocm -keys=rocm,gpu -max_num_threads=256 -mcpu=gfx906 -mtriple=amdgcn-amd-amdhsa-hcc -thread_warp_size=64", [-1, 16, 64, 65536, 2147483647, 1024, 16, 64], "", 0, []], [[], [["CHW", 3, "local"], ["SP", 3, 0, 128, [2, 1, 1, 2], 1], ["SP", 3, 5, 672, [6, 2, 1, 1], 1], ["SP", 3, 10, 11, [1, 11, 1, 1], 1], ["SP", 3, 15, 11, [1, 11, 1, 1], 1], ["SP", 3, 20, 5, [1, 1], 1], ["SP", 3, 23, 5, [1, 5], 1], ["RE", 3, [0, 5, 10, 15, 1, 6, 11, 16, 2, 7, 12, 17, 20, 23, 21, 24, 3, 8, 13, 18, 22, 25, 4, 9, 14, 19]], ["FSP", 4, 0, 1, 3], ["FSP", 4, 4, 2, 3], ["FSP", 4, 8, 3, 3], ["FSP", 4, 12, 4, 3], ["RE", 4, [0, 4, 8, 12, 1, 5, 9, 13, 2, 6, 10, 14, 3, 7, 11, 15]], ["CA", 3, 4, 11], ["CHR", 2, "shared", [3]], ["CA", 3, 4, 13], ["CHR", 1, "shared", [4]], ["CA", 2, 5, 13], ["CI", 1], ["FU", 6, [0, 1, 2, 3]], ["AN", 6, 0, 5], ["FU", 6, [1, 2, 3, 4]], ["AN", 6, 1, 4], ["FU", 6, [2, 3, 4, 5]], ["AN", 6, 2, 6], ["FU", 4, [0, 1, 2, 3]], ["SP", 4, 0, 5, [1], 1], ["AN", 4, 1, 2], ["FFSP", 4, 0, [4, 3, 2, 1], 1, 1], ["AN", 4, 1, 6], ["FU", 2, [0, 1, 2, 3]], ["SP", 2, 0, 10, [1], 1], ["AN", 2, 1, 2], ["FFSP", 2, 0, [4, 3, 2, 1], 1, 1], ["AN", 2, 1, 6], ["PR", 5, 0, "auto_unroll_max_step$1024"]]]], "r": [[0.00592825], 0, 4.6828, 1638590664], "v": "v0.6"}
{"i": [["[\"depthwise_conv2d_layer\", 128, 672, 11, 11, 5, 5, 1, \"SAME\"]", "rocm -keys=rocm,gpu -max_num_threads=256 -mcpu=gfx906 -mtriple=amdgcn-amd-amdhsa-hcc -thread_warp_size=64", [-1, 16, 64, 65536, 2147483647, 1024, 16, 64], "", 0, []], [[], [["CHW", 3, "local"], ["SP", 3, 0, 128, [1, 1, 1, 4], 1], ["SP", 3, 5, 672, [1, 8, 1, 2], 1], ["SP", 3, 10, 11, [1, 11, 1, 1], 1], ["SP", 3, 15, 11, [1, 1, 1, 1], 1], ["SP", 3, 20, 5, [1, 5], 1], ["SP", 3, 23, 5, [1, 5], 1], ["RE", 3, [0, 5, 10, 15, 1, 6, 11, 16, 2, 7, 12, 17, 20, 23, 21, 24, 3, 8, 13, 18, 22, 25, 4, 9, 14, 19]], ["FSP", 4, 0, 1, 3], ["FSP", 4, 4, 2, 3], ["FSP", 4, 8, 3, 3], ["FSP", 4, 12, 4, 3], ["RE", 4, [0, 4, 8, 12, 1, 5, 9, 13, 2, 6, 10, 14, 3, 7, 11, 15]], ["CA", 3, 4, 11], ["CHR", 2, "shared", [3]], ["CA", 3, 4, 13], ["CHR", 1, "shared", [4]], ["CA", 2, 5, 13], ["CI", 1], ["FU", 6, [0, 1, 2, 3]], ["AN", 6, 0, 5], ["FU", 6, [1, 2, 3, 4]], ["AN", 6, 1, 4], ["FU", 6, [2, 3, 4, 5]], ["AN", 6, 2, 6], ["FU", 4, [0, 1, 2, 3]], ["SP", 4, 0, 50, [1], 1], ["AN", 4, 1, 2], ["FFSP", 4, 0, [4, 3, 2, 1], 1, 1], ["AN", 4, 1, 6], ["FU", 2, [0, 1, 2, 3]], ["SP", 2, 0, 600, [1], 1], ["AN", 2, 1, 2], ["FFSP", 2, 0, [4, 3, 2, 1], 1, 1], ["AN", 2, 1, 6], ["PR", 5, 0, "auto_unroll_max_step$512"]]]], "r": [[0.00270657], 0, 3.31561, 1638590665], "v": "v0.6"}
{"i": [["[\"depthwise_conv2d_layer\", 128, 672, 11, 11, 5, 5, 1, \"SAME\"]", "rocm -keys=rocm,gpu -max_num_threads=256 -mcpu=gfx906 -mtriple=amdgcn-amd-amdhsa-hcc -thread_warp_size=64", [-1, 16, 64, 65536, 2147483647, 1024, 16, 64], "", 0, []], [[], [["CHW", 3, "local"], ["SP", 3, 0, 128, [1, 1, 2, 2], 1], ["SP", 3, 5, 672, [2, 28, 2, 2], 1], ["SP", 3, 10, 11, [1, 1, 1, 1], 1], ["SP", 3, 15, 11, [1, 11, 1, 1], 1], ["SP", 3, 20, 5, [1, 1], 1], ["SP", 3, 23, 5, [5, 1], 1], ["RE", 3, [0, 5, 10, 15, 1, 6, 11, 16, 2, 7, 12, 17, 20, 23, 21, 24, 3, 8, 13, 18, 22, 25, 4, 9, 14, 19]], ["FSP", 4, 0, 1, 3], ["FSP", 4, 4, 2, 3], ["FSP", 4, 8, 3, 3], ["FSP", 4, 12, 4, 3], ["RE", 4, [0, 4, 8, 12, 1, 5, 9, 13, 2, 6, 10, 14, 3, 7, 11, 15]], ["CA", 3, 4, 11], ["CHR", 2, "shared", [3]], ["CA", 3, 4, 13], ["CHR", 1, "shared", [4]], ["CA", 2, 5, 13], ["CI", 1], ["FU", 6, [0, 1, 2, 3]], ["AN", 6, 0, 5], ["FU", 6, [1, 2, 3, 4]], ["AN", 6, 1, 4], ["FU", 6, [2, 3, 4, 5]], ["AN", 6, 2, 6], ["FU", 4, [0, 1, 2, 3]], ["SP", 4, 0, 20, [1], 1], ["AN", 4, 1, 2], ["FFSP", 4, 0, [4, 3, 2, 1], 1, 1], ["AN", 4, 1, 6], ["FU", 2, [0, 1, 2, 3]], ["SP", 2, 0, 80, [1], 1], ["AN", 2, 1, 2], ["FFSP", 2, 0, [4, 3, 2, 1], 1, 1], ["AN", 2, 1, 6], ["PR", 5, 0, "auto_unroll_max_step$1024"]]]], "r": [[0.00393546], 0, 3.41216, 1638590667], "v": "v0.6"}
{"i": [["[\"depthwise_conv2d_layer\", 128, 672, 11, 11, 5, 5, 1, \"SAME\"]", "rocm -keys=rocm,gpu -max_num_threads=256 -mcpu=gfx906 -mtriple=amdgcn-amd-amdhsa-hcc -thread_warp_size=64", [-1, 16, 64, 65536, 2147483647, 1024, 16, 64], "", 0, []], [[], [["CHW", 3, "local"], ["SP", 3, 0, 128, [1, 32, 1, 1], 1], ["SP", 3, 5, 672, [4, 2, 1, 3], 1], ["SP", 3, 10, 11, [1, 1, 1, 1], 1], ["SP", 3, 15, 11, [1, 1, 11, 1], 1], ["SP", 3, 20, 5, [1, 1], 1], ["SP", 3, 23, 5, [5, 1], 1], ["RE", 3, [0, 5, 10, 15, 1, 6, 11, 16, 2, 7, 12, 17, 20, 23, 21, 24, 3, 8, 13, 18, 22, 25, 4, 9, 14, 19]], ["FSP", 4, 0, 1, 3], ["FSP", 4, 4, 2, 3], ["FSP", 4, 8, 3, 3], ["FSP", 4, 12, 4, 3], ["RE", 4, [0, 4, 8, 12, 1, 5, 9, 13, 2, 6, 10, 14, 3, 7, 11, 15]], ["CA", 3, 4, 11], ["CHR", 2, "shared", [3]], ["CA", 3, 4, 13], ["CHR", 1, "shared", [4]], ["CA", 2, 5, 13], ["CI", 1], ["FU", 6, [0, 1, 2, 3]], ["AN", 6, 0, 5], ["FU", 6, [1, 2, 3, 4]], ["AN", 6, 1, 4], ["FU", 6, [2, 3, 4, 5]], ["AN", 6, 2, 6], ["FU", 4, [0, 1, 2, 3]], ["SP", 4, 0, 15, [3], 1], ["AN", 4, 1, 2], ["FFSP", 4, 0, [4, 3, 2, 1], 1, 1], ["AN", 4, 1, 6], ["FU", 2, [0, 1, 2, 3]], ["SP", 2, 0, 45, [1], 1], ["AN", 2, 1, 2], ["FFSP", 2, 0, [4, 3, 2, 1], 1, 1], ["AN", 2, 1, 6], ["PR", 5, 0, "auto_unroll_max_step$16"]]]], "r": [[0.020734], 0, 3.15577, 1638590669], "v": "v0.6"}
{"i": [["[\"depthwise_conv2d_layer\", 128, 672, 11, 11, 5, 5, 1, \"SAME\"]", "rocm -keys=rocm,gpu -max_num_threads=256 -mcpu=gfx906 -mtriple=amdgcn-amd-amdhsa-hcc -thread_warp_size=64", [-1, 16, 64, 65536, 2147483647, 1024, 16, 64], "", 0, []], [[], [["CHW", 3, "local"], ["SP", 3, 0, 128, [1, 1, 2, 4], 1], ["SP", 3, 5, 672, [3, 7, 1, 4], 1], ["SP", 3, 10, 11, [1, 11, 1, 1], 1], ["SP", 3, 15, 11, [1, 1, 1, 1], 1], ["SP", 3, 20, 5, [5, 1], 1], ["SP", 3, 23, 5, [1, 1], 1], ["RE", 3, [0, 5, 10, 15, 1, 6, 11, 16, 2, 7, 12, 17, 20, 23, 21, 24, 3, 8, 13, 18, 22, 25, 4, 9, 14, 19]], ["FSP", 4, 0, 1, 3], ["FSP", 4, 4, 2, 3], ["FSP", 4, 8, 3, 3], ["FSP", 4, 12, 4, 3], ["RE", 4, [0, 4, 8, 12, 1, 5, 9, 13, 2, 6, 10, 14, 3, 7, 11, 15]], ["CA", 3, 4, 11], ["CHR", 2, "shared", [3]], ["CA", 3, 4, 13], ["CHR", 1, "shared", [4]], ["CA", 2, 5, 13], ["CI", 1], ["FU", 6, [0, 1, 2, 3]], ["AN", 6, 0, 5], ["FU", 6, [1, 2, 3, 4]], ["AN", 6, 1, 4], ["FU", 6, [2, 3, 4, 5]], ["AN", 6, 2, 6], ["FU", 4, [0, 1, 2, 3]], ["SP", 4, 0, 20, [2], 1], ["AN", 4, 1, 2], ["FFSP", 4, 0, [4, 3, 2, 1], 1, 1], ["AN", 4, 1, 6], ["FU", 2, [0, 1, 2, 3]], ["SP", 2, 0, 160, [1], 1], ["AN", 2, 1, 2], ["FFSP", 2, 0, [4, 3, 2, 1], 1, 1], ["AN", 2, 1, 6], ["PR", 5, 0, "auto_unroll_max_step$64"]]]], "r": [[0.0120875], 0, 2.87728, 1638590670], "v": "v0.6"}
{"i": [["[\"depthwise_conv2d_layer\", 128, 672, 11, 11, 5, 5, 1, \"SAME\"]", "rocm -keys=rocm,gpu -max_num_threads=256 -mcpu=gfx906 -mtriple=amdgcn-amd-amdhsa-hcc -thread_warp_size=64", [-1, 16, 64, 65536, 2147483647, 1024, 16, 64], "", 0, []], [[], [["CHW", 3, "local"], ["SP", 3, 0, 128, [1, 2, 1, 1], 1], ["SP", 3, 5, 672, [1, 1, 1, 4], 1], ["SP", 3, 10, 11, [1, 1, 1, 11], 1], ["SP", 3, 15, 11, [1, 1, 1, 11], 1], ["SP", 3, 20, 5, [5, 1], 1], ["SP", 3, 23, 5, [1, 1], 1], ["RE", 3, [0, 5, 10, 15, 1, 6, 11, 16, 2, 7, 12, 17, 20, 23, 21, 24, 3, 8, 13, 18, 22, 25, 4, 9, 14, 19]], ["FSP", 4, 0, 1, 3], ["FSP", 4, 4, 2, 3], ["FSP", 4, 8, 3, 3], ["FSP", 4, 12, 4, 3], ["RE", 4, [0, 4, 8, 12, 1, 5, 9, 13, 2, 6, 10, 14, 3, 7, 11, 15]], ["CA", 3, 4, 11], ["CHR", 2, "shared", [3]], ["CA", 3, 4, 13], ["CHR", 1, "shared", [4]], ["CA", 2, 5, 13], ["CI", 1], ["FU", 6, [0, 1, 2, 3]], ["AN", 6, 0, 5], ["FU", 6, [1, 2, 3, 4]], ["AN", 6, 1, 4], ["FU", 6, [2, 3, 4, 5]], ["AN", 6, 2, 6], ["FU", 4, [0, 1, 2, 3]], ["SP", 4, 0, 20, [1], 1], ["AN", 4, 1, 2], ["FFSP", 4, 0, [4, 3, 2, 1], 1, 1], ["AN", 4, 1, 6], ["FU", 2, [0, 1, 2, 3]], ["SP", 2, 0, 160, [1], 1], ["AN", 2, 1, 2], ["FFSP", 2, 0, [4, 3, 2, 1], 1, 1], ["AN", 2, 1, 6], ["PR", 5, 0, "auto_unroll_max_step$512"]]]], "r": [[0.174237], 0, 7.71527, 1638590672], "v": "v0.6"}
{"i": [["[\"depthwise_conv2d_layer\", 128, 672, 11, 11, 5, 5, 1, \"SAME\"]", "rocm -keys=rocm,gpu -max_num_threads=256 -mcpu=gfx906 -mtriple=amdgcn-amd-amdhsa-hcc -thread_warp_size=64", [-1, 16, 64, 65536, 2147483647, 1024, 16, 64], "", 0, []], [[], [["CHW", 3, "local"], ["SP", 3, 0, 128, [1, 1, 4, 1], 1], ["SP", 3, 5, 672, [12, 1, 2, 1], 1], ["SP", 3, 10, 11, [1, 1, 1, 1], 1], ["SP", 3, 15, 11, [1, 11, 1, 1], 1], ["SP", 3, 20, 5, [5, 1], 1], ["SP", 3, 23, 5, [1, 1], 1], ["RE", 3, [0, 5, 10, 15, 1, 6, 11, 16, 2, 7, 12, 17, 20, 23, 21, 24, 3, 8, 13, 18, 22, 25, 4, 9, 14, 19]], ["FSP", 4, 0, 1, 3], ["FSP", 4, 4, 2, 3], ["FSP", 4, 8, 3, 3], ["FSP", 4, 12, 4, 3], ["RE", 4, [0, 4, 8, 12, 1, 5, 9, 13, 2, 6, 10, 14, 3, 7, 11, 15]], ["CA", 3, 4, 11], ["CHR", 2, "shared", [3]], ["CA", 3, 4, 13], ["CHR", 1, "shared", [4]], ["CA", 2, 5, 13], ["CI", 1], ["FU", 6, [0, 1, 2, 3]], ["AN", 6, 0, 5], ["FU", 6, [1, 2, 3, 4]], ["AN", 6, 1, 4], ["FU", 6, [2, 3, 4, 5]], ["AN", 6, 2, 6], ["FU", 4, [0, 1, 2, 3]], ["SP", 4, 0, 2, [1], 1], ["AN", 4, 1, 2], ["FFSP", 4, 0, [4, 3, 2, 1], 1, 1], ["AN", 4, 1, 6], ["FU", 2, [0, 1, 2, 3]], ["SP", 2, 0, 8, [2], 1], ["AN", 2, 1, 2], ["FFSP", 2, 0, [4, 3, 2, 1], 1, 1], ["AN", 2, 1, 6], ["PR", 5, 0, "auto_unroll_max_step$16"]]]], "r": [[0.0814606], 0, 3.20938, 1638590674], "v": "v0.6"}
{"i": [["[\"depthwise_conv2d_layer\", 128, 672, 11, 11, 5, 5, 1, \"SAME\"]", "rocm -keys=rocm,gpu -max_num_threads=256 -mcpu=gfx906 -mtriple=amdgcn-amd-amdhsa-hcc -thread_warp_size=64", [-1, 16, 64, 65536, 2147483647, 1024, 16, 64], "", 0, []], [[], [["CHW", 3, "local"], ["SP", 3, 0, 128, [1, 2, 1, 4], 1], ["SP", 3, 5, 672, [1, 14, 2, 3], 1], ["SP", 3, 10, 11, [1, 1, 1, 1], 1], ["SP", 3, 15, 11, [1, 11, 1, 1], 1], ["SP", 3, 20, 5, [1, 1], 1], ["SP", 3, 23, 5, [1, 5], 1], ["RE", 3, [0, 5, 10, 15, 1, 6, 11, 16, 2, 7, 12, 17, 20, 23, 21, 24, 3, 8, 13, 18, 22, 25, 4, 9, 14, 19]], ["FSP", 4, 0, 1, 3], ["FSP", 4, 4, 2, 3], ["FSP", 4, 8, 3, 3], ["FSP", 4, 12, 4, 3], ["RE", 4, [0, 4, 8, 12, 1, 5, 9, 13, 2, 6, 10, 14, 3, 7, 11, 15]], ["CA", 3, 4, 11], ["CHR", 2, "shared", [3]], ["CA", 3, 4, 13], ["CHR", 1, "shared", [4]], ["CA", 2, 5, 13], ["CI", 1], ["FU", 6, [0, 1, 2, 3]], ["AN", 6, 0, 5], ["FU", 6, [1, 2, 3, 4]], ["AN", 6, 1, 4], ["FU", 6, [2, 3, 4, 5]], ["AN", 6, 2, 6], ["FU", 4, [0, 1, 2, 3]], ["SP", 4, 0, 30, [1], 1], ["AN", 4, 1, 2], ["FFSP", 4, 0, [4, 3, 2, 1], 1, 1], ["AN", 4, 1, 6], ["FU", 2, [0, 1, 2, 3]], ["SP", 2, 0, 120, [1], 1], ["AN", 2, 1, 2], ["FFSP", 2, 0, [4, 3, 2, 1], 1, 1], ["AN", 2, 1, 6], ["PR", 5, 0, "auto_unroll_max_step$512"]]]], "r": [[0.00319769], 0, 3.19564, 1638590676], "v": "v0.6"}
{"i": [["[\"depthwise_conv2d_layer\", 128, 672, 11, 11, 5, 5, 1, \"SAME\"]", "rocm -keys=rocm,gpu -max_num_threads=256 -mcpu=gfx906 -mtriple=amdgcn-amd-amdhsa-hcc -thread_warp_size=64", [-1, 16, 64, 65536, 2147483647, 1024, 16, 64], "", 0, []], [[], [["CHW", 3, "local"], ["SP", 3, 0, 128, [2, 1, 1, 1], 1], ["SP", 3, 5, 672, [7, 16, 3, 1], 1], ["SP", 3, 10, 11, [1, 1, 1, 1], 1], ["SP", 3, 15, 11, [1, 11, 1, 1], 1], ["SP", 3, 20, 5, [1, 1], 1], ["SP", 3, 23, 5, [1, 5], 1], ["RE", 3, [0, 5, 10, 15, 1, 6, 11, 16, 2, 7, 12, 17, 20, 23, 21, 24, 3, 8, 13, 18, 22, 25, 4, 9, 14, 19]], ["FSP", 4, 0, 1, 3], ["FSP", 4, 4, 2, 3], ["FSP", 4, 8, 3, 3], ["FSP", 4, 12, 4, 3], ["RE", 4, [0, 4, 8, 12, 1, 5, 9, 13, 2, 6, 10, 14, 3, 7, 11, 15]], ["CA", 3, 4, 11], ["CHR", 2, "shared", [3]], ["CA", 3, 4, 13], ["CHR", 1, "shared", [4]], ["CA", 2, 5, 13], ["CI", 1], ["FU", 6, [0, 1, 2, 3]], ["AN", 6, 0, 5], ["FU", 6, [1, 2, 3, 4]], ["AN", 6, 1, 4], ["FU", 6, [2, 3, 4, 5]], ["AN", 6, 2, 6], ["FU", 4, [0, 1, 2, 3]], ["SP", 4, 0, 3, [1], 1], ["AN", 4, 1, 2], ["FFSP", 4, 0, [4, 3, 2, 1], 1, 1], ["AN", 4, 1, 6], ["FU", 2, [0, 1, 2, 3]], ["SP", 2, 0, 3, [3], 1], ["AN", 2, 1, 2], ["FFSP", 2, 0, [4, 3, 2, 1], 1, 1], ["AN", 2, 1, 6], ["PR", 5, 0, "auto_unroll_max_step$0"]]]], "r": [[0.00520919], 0, 3.07715, 1638590677], "v": "v0.6"}
{"i": [["[\"depthwise_conv2d_layer\", 128, 672, 11, 11, 5, 5, 1, \"SAME\"]", "rocm -keys=rocm,gpu -max_num_threads=256 -mcpu=gfx906 -mtriple=amdgcn-amd-amdhsa-hcc -thread_warp_size=64", [-1, 16, 64, 65536, 2147483647, 1024, 16, 64], "", 0, []], [[], [["CHW", 3, "local"], ["SP", 3, 0, 128, [1, 2, 8, 1], 1], ["SP", 3, 5, 672, [1, 1, 1, 4], 1], ["SP", 3, 10, 11, [1, 11, 1, 1], 1], ["SP", 3, 15, 11, [1, 11, 1, 1], 1], ["SP", 3, 20, 5, [5, 1], 1], ["SP", 3, 23, 5, [1, 5], 1], ["RE", 3, [0, 5, 10, 15, 1, 6, 11, 16, 2, 7, 12, 17, 20, 23, 21, 24, 3, 8, 13, 18, 22, 25, 4, 9, 14, 19]], ["FSP", 4, 0, 1, 3], ["FSP", 4, 4, 2, 3], ["FSP", 4, 8, 3, 3], ["FSP", 4, 12, 4, 3], ["RE", 4, [0, 4, 8, 12, 1, 5, 9, 13, 2, 6, 10, 14, 3, 7, 11, 15]], ["CA", 3, 4, 11], ["CHR", 2, "shared", [3]], ["CA", 3, 4, 13], ["CHR", 1, "shared", [4]], ["CA", 2, 5, 13], ["CI", 1], ["FU", 6, [0, 1, 2, 3]], ["AN", 6, 0, 5], ["FU", 6, [1, 2, 3, 4]], ["AN", 6, 1, 4], ["FU", 6, [2, 3, 4, 5]], ["AN", 6, 2, 6], ["FU", 4, [0, 1, 2, 3]], ["SP", 4, 0, 20, [1], 1], ["AN", 4, 1, 2], ["FFSP", 4, 0, [4, 3, 2, 1], 1, 1], ["AN", 4, 1, 6], ["FU", 2, [0, 1, 2, 3]], ["SP", 2, 0, 160, [32], 1], ["AN", 2, 1, 2], ["FFSP", 2, 0, [4, 3, 2, 1], 1, 1], ["AN", 2, 1, 6], ["PR", 5, 0, "auto_unroll_max_step$64"]]]], "r": [[0.00241545], 0, 4.24811, 1638590679], "v": "v0.6"}
{"i": [["[\"depthwise_conv2d_layer\", 128, 672, 11, 11, 5, 5, 1, \"SAME\"]", "rocm -keys=rocm,gpu -max_num_threads=256 -mcpu=gfx906 -mtriple=amdgcn-amd-amdhsa-hcc -thread_warp_size=64", [-1, 16, 64, 65536, 2147483647, 1024, 16, 64], "", 0, []], [[], [["CHW", 3, "local"], ["SP", 3, 0, 128, [1, 1, 1, 32], 1], ["SP", 3, 5, 672, [1, 1, 1, 1], 1], ["SP", 3, 10, 11, [1, 11, 1, 1], 1], ["SP", 3, 15, 11, [1, 1, 1, 1], 1], ["SP", 3, 20, 5, [5, 1], 1], ["SP", 3, 23, 5, [1, 5], 1], ["RE", 3, [0, 5, 10, 15, 1, 6, 11, 16, 2, 7, 12, 17, 20, 23, 21, 24, 3, 8, 13, 18, 22, 25, 4, 9, 14, 19]], ["FSP", 4, 0, 1, 3], ["FSP", 4, 4, 2, 3], ["FSP", 4, 8, 3, 3], ["FSP", 4, 12, 4, 3], ["RE", 4, [0, 4, 8, 12, 1, 5, 9, 13, 2, 6, 10, 14, 3, 7, 11, 15]], ["CA", 3, 4, 11], ["CHR", 2, "shared", [3]], ["CA", 3, 4, 13], ["CHR", 1, "shared", [4]], ["CA", 2, 5, 13], ["CI", 1], ["FU", 6, [0, 1, 2, 3]], ["AN", 6, 0, 5], ["FU", 6, [1, 2, 3, 4]], ["AN", 6, 1, 4], ["FU", 6, [2, 3, 4, 5]], ["AN", 6, 2, 6], ["FU", 4, [0, 1, 2, 3]], ["SP", 4, 0, 5, [1], 1], ["AN", 4, 1, 2], ["FFSP", 4, 0, [4, 3, 2, 1], 1, 1], ["AN", 4, 1, 6], ["FU", 2, [0, 1, 2, 3]], ["SP", 2, 0, 5, [5], 1], ["AN", 2, 1, 2], ["FFSP", 2, 0, [4, 3, 2, 1], 1, 1], ["AN", 2, 1, 6], ["PR", 5, 0, "auto_unroll_max_step$512"]]]], "r": [[0.00458553], 0, 4.09326, 1638590681], "v": "v0.6"}
{"i": [["[\"depthwise_conv2d_layer\", 128, 672, 11, 11, 5, 5, 1, \"SAME\"]", "rocm -keys=rocm,gpu -max_num_threads=256 -mcpu=gfx906 -mtriple=amdgcn-amd-amdhsa-hcc -thread_warp_size=64", [-1, 16, 64, 65536, 2147483647, 1024, 16, 64], "", 0, []], [[], [["CHW", 3, "local"], ["SP", 3, 0, 128, [1, 4, 1, 2], 1], ["SP", 3, 5, 672, [1, 4, 28, 1], 1], ["SP", 3, 10, 11, [1, 11, 1, 1], 1], ["SP", 3, 15, 11, [1, 1, 1, 1], 1], ["SP", 3, 20, 5, [5, 1], 1], ["SP", 3, 23, 5, [1, 1], 1], ["RE", 3, [0, 5, 10, 15, 1, 6, 11, 16, 2, 7, 12, 17, 20, 23, 21, 24, 3, 8, 13, 18, 22, 25, 4, 9, 14, 19]], ["FSP", 4, 0, 1, 3], ["FSP", 4, 4, 2, 3], ["FSP", 4, 8, 3, 3], ["FSP", 4, 12, 4, 3], ["RE", 4, [0, 4, 8, 12, 1, 5, 9, 13, 2, 6, 10, 14, 3, 7, 11, 15]], ["CA", 3, 4, 11], ["CHR", 2, "shared", [3]], ["CA", 3, 4, 13], ["CHR", 1, "shared", [4]], ["CA", 2, 5, 13], ["CI", 1], ["FU", 6, [0, 1, 2, 3]], ["AN", 6, 0, 5], ["FU", 6, [1, 2, 3, 4]], ["AN", 6, 1, 4], ["FU", 6, [2, 3, 4, 5]], ["AN", 6, 2, 6], ["FU", 4, [0, 1, 2, 3]], ["SP", 4, 0, 140, [1], 1], ["AN", 4, 1, 2], ["FFSP", 4, 0, [4, 3, 2, 1], 1, 1], ["AN", 4, 1, 6], ["FU", 2, [0, 1, 2, 3]], ["SP", 2, 0, 140, [14], 1], ["AN", 2, 1, 2], ["FFSP", 2, 0, [4, 3, 2, 1], 1, 1], ["AN", 2, 1, 6], ["PR", 5, 0, "auto_unroll_max_step$64"]]]], "r": [[0.0905863], 0, 10.3862, 1638590683], "v": "v0.6"}
{"i": [["[\"depthwise_conv2d_layer\", 128, 672, 11, 11, 5, 5, 1, \"SAME\"]", "rocm -keys=rocm,gpu -max_num_threads=256 -mcpu=gfx906 -mtriple=amdgcn-amd-amdhsa-hcc -thread_warp_size=64", [-1, 16, 64, 65536, 2147483647, 1024, 16, 64], "", 0, []], [[], [["CHW", 3, "local"], ["SP", 3, 0, 128, [1, 2, 8, 1], 1], ["SP", 3, 5, 672, [1, 1, 1, 4], 1], ["SP", 3, 10, 11, [1, 1, 1, 1], 1], ["SP", 3, 15, 11, [1, 11, 1, 1], 1], ["SP", 3, 20, 5, [1, 1], 1], ["SP", 3, 23, 5, [1, 1], 1], ["RE", 3, [0, 5, 10, 15, 1, 6, 11, 16, 2, 7, 12, 17, 20, 23, 21, 24, 3, 8, 13, 18, 22, 25, 4, 9, 14, 19]], ["FSP", 4, 0, 1, 3], ["FSP", 4, 4, 2, 3], ["FSP", 4, 8, 3, 3], ["FSP", 4, 12, 4, 3], ["RE", 4, [0, 4, 8, 12, 1, 5, 9, 13, 2, 6, 10, 14, 3, 7, 11, 15]], ["CA", 3, 4, 11], ["CHR", 2, "shared", [3]], ["CA", 3, 4, 13], ["CHR", 1, "shared", [4]], ["CA", 2, 5, 13], ["CI", 1], ["FU", 6, [0, 1, 2, 3]], ["AN", 6, 0, 5], ["FU", 6, [1, 2, 3, 4]], ["AN", 6, 1, 4], ["FU", 6, [2, 3, 4, 5]], ["AN", 6, 2, 6], ["FU", 4, [0, 1, 2, 3]], ["SP", 4, 0, 20, [2], 1], ["AN", 4, 1, 2], ["FFSP", 4, 0, [4, 3, 2, 1], 1, 1], ["AN", 4, 1, 6], ["FU", 2, [0, 1, 2, 3]], ["SP", 2, 0, 160, [1], 1], ["AN", 2, 1, 2], ["FFSP", 2, 0, [4, 3, 2, 1], 1, 1], ["AN", 2, 1, 6], ["PR", 5, 0, "auto_unroll_max_step$64"]]]], "r": [[0.0032827], 0, 3.15878, 1638590685], "v": "v0.6"}
{"i": [["[\"depthwise_conv2d_layer\", 128, 672, 11, 11, 5, 5, 1, \"SAME\"]", "rocm -keys=rocm,gpu -max_num_threads=256 -mcpu=gfx906 -mtriple=amdgcn-amd-amdhsa-hcc -thread_warp_size=64", [-1, 16, 64, 65536, 2147483647, 1024, 16, 64], "", 0, []], [[], [["CHW", 3, "local"], ["SP", 3, 0, 128, [1, 2, 2, 2], 1], ["SP", 3, 5, 672, [1, 14, 2, 3], 1], ["SP", 3, 10, 11, [1, 1, 1, 1], 1], ["SP", 3, 15, 11, [1, 11, 1, 1], 1], ["SP", 3, 20, 5, [1, 1], 1], ["SP", 3, 23, 5, [1, 5], 1], ["RE", 3, [0, 5, 10, 15, 1, 6, 11, 16, 2, 7, 12, 17, 20, 23, 21, 24, 3, 8, 13, 18, 22, 25, 4, 9, 14, 19]], ["FSP", 4, 0, 1, 3], ["FSP", 4, 4, 2, 3], ["FSP", 4, 8, 3, 3], ["FSP", 4, 12, 4, 3], ["RE", 4, [0, 4, 8, 12, 1, 5, 9, 13, 2, 6, 10, 14, 3, 7, 11, 15]], ["CA", 3, 4, 11], ["CHR", 2, "shared", [3]], ["CA", 3, 4, 13], ["CHR", 1, "shared", [4]], ["CA", 2, 5, 13], ["CI", 1], ["FU", 6, [0, 1, 2, 3]], ["AN", 6, 0, 5], ["FU", 6, [1, 2, 3, 4]], ["AN", 6, 1, 4], ["FU", 6, [2, 3, 4, 5]], ["AN", 6, 2, 6], ["FU", 4, [0, 1, 2, 3]], ["SP", 4, 0, 30, [1], 1], ["AN", 4, 1, 2], ["FFSP", 4, 0, [4, 3, 2, 1], 1, 1], ["AN", 4, 1, 6], ["FU", 2, [0, 1, 2, 3]], ["SP", 2, 0, 120, [1], 1], ["AN", 2, 1, 2], ["FFSP", 2, 0, [4, 3, 2, 1], 1, 1], ["AN", 2, 1, 6], ["PR", 5, 0, "auto_unroll_max_step$64"]]]], "r": [[0.00373542], 0, 3.15923, 1638590687], "v": "v0.6"}
{"i": [["[\"depthwise_conv2d_layer\", 128, 672, 11, 11, 5, 5, 1, \"SAME\"]", "rocm -keys=rocm,gpu -max_num_threads=256 -mcpu=gfx906 -mtriple=amdgcn-amd-amdhsa-hcc -thread_warp_size=64", [-1, 16, 64, 65536, 2147483647, 1024, 16, 64], "", 0, []], [[], [["CHW", 3, "local"], ["SP", 3, 0, 128, [1, 2, 1, 1], 1], ["SP", 3, 5, 672, [1, 21, 2, 1], 1], ["SP", 3, 10, 11, [1, 11, 1, 1], 1], ["SP", 3, 15, 11, [1, 1, 11, 1], 1], ["SP", 3, 20, 5, [5, 1], 1], ["SP", 3, 23, 5, [1, 1], 1], ["RE", 3, [0, 5, 10, 15, 1, 6, 11, 16, 2, 7, 12, 17, 20, 23, 21, 24, 3, 8, 13, 18, 22, 25, 4, 9, 14, 19]], ["FSP", 4, 0, 1, 3], ["FSP", 4, 4, 2, 3], ["FSP", 4, 8, 3, 3], ["FSP", 4, 12, 4, 3], ["RE", 4, [0, 4, 8, 12, 1, 5, 9, 13, 2, 6, 10, 14, 3, 7, 11, 15]], ["CA", 3, 4, 11], ["CHR", 2, "shared", [3]], ["CA", 3, 4, 13], ["CHR", 1, "shared", [4]], ["CA", 2, 5, 13], ["CI", 1], ["FU", 6, [0, 1, 2, 3]], ["AN", 6, 0, 5], ["FU", 6, [1, 2, 3, 4]], ["AN", 6, 1, 4], ["FU", 6, [2, 3, 4, 5]], ["AN", 6, 2, 6], ["FU", 4, [0, 1, 2, 3]], ["SP", 4, 0, 10, [1], 1], ["AN", 4, 1, 2], ["FFSP", 4, 0, [4, 3, 2, 1], 1, 1], ["AN", 4, 1, 6], ["FU", 2, [0, 1, 2, 3]], ["SP", 2, 0, 10, [1], 1], ["AN", 2, 1, 2], ["FFSP", 2, 0, [4, 3, 2, 1], 1, 1], ["AN", 2, 1, 6], ["PR", 5, 0, "auto_unroll_max_step$64"]]]], "r": [[0.00180791], 0, 2.97995, 1638590688], "v": "v0.6"}
{"i": [["[\"depthwise_conv2d_layer\", 128, 672, 11, 11, 5, 5, 1, \"SAME\"]", "rocm -keys=rocm,gpu -max_num_threads=256 -mcpu=gfx906 -mtriple=amdgcn-amd-amdhsa-hcc -thread_warp_size=64", [-1, 16, 64, 65536, 2147483647, 1024, 16, 64], "", 0, []], [[], [["CHW", 3, "local"], ["SP", 3, 0, 128, [2, 4, 2, 1], 1], ["SP", 3, 5, 672, [1, 7, 6, 2], 1], ["SP", 3, 10, 11, [1, 11, 1, 1], 1], ["SP", 3, 15, 11, [1, 1, 1, 1], 1], ["SP", 3, 20, 5, [1, 1], 1], ["SP", 3, 23, 5, [1, 1], 1], ["RE", 3, [0, 5, 10, 15, 1, 6, 11, 16, 2, 7, 12, 17, 20, 23, 21, 24, 3, 8, 13, 18, 22, 25, 4, 9, 14, 19]], ["FSP", 4, 0, 1, 3], ["FSP", 4, 4, 2, 3], ["FSP", 4, 8, 3, 3], ["FSP", 4, 12, 4, 3], ["RE", 4, [0, 4, 8, 12, 1, 5, 9, 13, 2, 6, 10, 14, 3, 7, 11, 15]], ["CA", 3, 4, 11], ["CHR", 2, "shared", [3]], ["CA", 3, 4, 13], ["CHR", 1, "shared", [4]], ["CA", 2, 5, 13], ["CI", 1], ["FU", 6, [0, 1, 2, 3]], ["AN", 6, 0, 5], ["FU", 6, [1, 2, 3, 4]], ["AN", 6, 1, 4], ["FU", 6, [2, 3, 4, 5]], ["AN", 6, 2, 6], ["FU", 4, [0, 1, 2, 3]], ["SP", 4, 0, 12, [2], 1], ["AN", 4, 1, 2], ["FFSP", 4, 0, [4, 3, 2, 1], 1, 1], ["AN", 4, 1, 6], ["FU", 2, [0, 1, 2, 3]], ["SP", 2, 0, 24, [1], 1], ["AN", 2, 1, 2], ["FFSP", 2, 0, [4, 3, 2, 1], 1, 1], ["AN", 2, 1, 6], ["PR", 5, 0, "auto_unroll_max_step$1024"]]]], "r": [[0.0170292], 0, 4.10318, 1638590690], "v": "v0.6"}
{"i": [["[\"depthwise_conv2d_layer\", 128, 672, 11, 11, 5, 5, 1, \"SAME\"]", "rocm -keys=rocm,gpu -max_num_threads=256 -mcpu=gfx906 -mtriple=amdgcn-amd-amdhsa-hcc -thread_warp_size=64", [-1, 16, 64, 65536, 2147483647, 1024, 16, 64], "", 0, []], [[], [["CHW", 3, "local"], ["SP", 3, 0, 128, [2, 4, 1, 2], 1], ["SP", 3, 5, 672, [2, 2, 1, 3], 1], ["SP", 3, 10, 11, [1, 1, 1, 1], 1], ["SP", 3, 15, 11, [1, 11, 1, 1], 1], ["SP", 3, 20, 5, [1, 1], 1], ["SP", 3, 23, 5, [1, 1], 1], ["RE", 3, [0, 5, 10, 15, 1, 6, 11, 16, 2, 7, 12, 17, 20, 23, 21, 24, 3, 8, 13, 18, 22, 25, 4, 9, 14, 19]], ["FSP", 4, 0, 1, 3], ["FSP", 4, 4, 2, 3], ["FSP", 4, 8, 3, 3], ["FSP", 4, 12, 4, 3], ["RE", 4, [0, 4, 8, 12, 1, 5, 9, 13, 2, 6, 10, 14, 3, 7, 11, 15]], ["CA", 3, 4, 11], ["CHR", 2, "shared", [3]], ["CA", 3, 4, 13], ["CHR", 1, "shared", [4]], ["CA", 2, 5, 13], ["CI", 1], ["FU", 6, [0, 1, 2, 3]], ["AN", 6, 0, 5], ["FU", 6, [1, 2, 3, 4]], ["AN", 6, 1, 4], ["FU", 6, [2, 3, 4, 5]], ["AN", 6, 2, 6], ["FU", 4, [0, 1, 2, 3]], ["SP", 4, 0, 3, [1], 1], ["AN", 4, 1, 2], ["FFSP", 4, 0, [4, 3, 2, 1], 1, 1], ["AN", 4, 1, 6], ["FU", 2, [0, 1, 2, 3]], ["SP", 2, 0, 6, [1], 1], ["AN", 2, 1, 2], ["FFSP", 2, 0, [4, 3, 2, 1], 1, 1], ["AN", 2, 1, 6], ["PR", 5, 0, "auto_unroll_max_step$1024"]]]], "r": [[0.0072441], 0, 4.09156, 1638590692], "v": "v0.6"}
