artifacts/Table4/tvm/ansor/elementwise/ansor_relu_128_512_7_7.log
{"i": [["[\"relu_layer\", 128, 512, 7, 7]", "rocm -keys=rocm,gpu -max_num_threads=256 -mcpu=gfx906 -mtriple=amdgcn-amd-amdhsa-hcc -thread_warp_size=64", [-1, 16, 64, 65536, 2147483647, 1024, 16, 64], "", 0, []], [[], [["FU", 1, [0, 1, 2, 3]], ["SP", 1, 0, 3211264, [7], 1], ["AN", 1, 0, 5], ["AN", 1, 1, 6]]]], "r": [[0.00107137], 0, 1.47631, 1639119501], "v": "v0.6"}
{"i": [["[\"relu_layer\", 128, 512, 7, 7]", "rocm -keys=rocm,gpu -max_num_threads=256 -mcpu=gfx906 -mtriple=amdgcn-amd-amdhsa-hcc -thread_warp_size=64", [-1, 16, 64, 65536, 2147483647, 1024, 16, 64], "", 0, []], [[], [["FU", 1, [0, 1, 2, 3]], ["SP", 1, 0, 3211264, [16], 1], ["AN", 1, 0, 5], ["AN", 1, 1, 6]]]], "r": [[0.000469706], 0, 1.57515, 1639119502], "v": "v0.6"}
{"i": [["[\"relu_layer\", 128, 512, 7, 7]", "rocm -keys=rocm,gpu -max_num_threads=256 -mcpu=gfx906 -mtriple=amdgcn-amd-amdhsa-hcc -thread_warp_size=64", [-1, 16, 64, 65536, 2147483647, 1024, 16, 64], "", 0, []], [[], [["FU", 1, [0, 1, 2, 3]], ["SP", 1, 0, 3211264, [56], 1], ["AN", 1, 0, 5], ["AN", 1, 1, 6]]]], "r": [[0.000135348], 0, 1.59634, 1639119503], "v": "v0.6"}
{"i": [["[\"relu_layer\", 128, 512, 7, 7]", "rocm -keys=rocm,gpu -max_num_threads=256 -mcpu=gfx906 -mtriple=amdgcn-amd-amdhsa-hcc -thread_warp_size=64", [-1, 16, 64, 65536, 2147483647, 1024, 16, 64], "", 0, []], [[], [["FU", 1, [0, 1, 2, 3]], ["SP", 1, 0, 3211264, [2], 1], ["AN", 1, 0, 5], ["AN", 1, 1, 6]]]], "r": [[0.0038504], 0, 1.77775, 1639119505], "v": "v0.6"}
{"i": [["[\"relu_layer\", 128, 512, 7, 7]", "rocm -keys=rocm,gpu -max_num_threads=256 -mcpu=gfx906 -mtriple=amdgcn-amd-amdhsa-hcc -thread_warp_size=64", [-1, 16, 64, 65536, 2147483647, 1024, 16, 64], "", 0, []], [[], [["FU", 1, [0, 1, 2, 3]], ["SP", 1, 0, 3211264, [8], 1], ["AN", 1, 0, 5], ["AN", 1, 1, 6]]]], "r": [[0.000937572], 0, 1.59817, 1639119506], "v": "v0.6"}
{"i": [["[\"relu_layer\", 128, 512, 7, 7]", "rocm -keys=rocm,gpu -max_num_threads=256 -mcpu=gfx906 -mtriple=amdgcn-amd-amdhsa-hcc -thread_warp_size=64", [-1, 16, 64, 65536, 2147483647, 1024, 16, 64], "", 0, []], [[], [["FU", 1, [0, 1, 2, 3]], ["SP", 1, 0, 3211264, [4], 1], ["AN", 1, 0, 5], ["AN", 1, 1, 6]]]], "r": [[0.00187351], 0, 1.64641, 1639119508], "v": "v0.6"}
{"i": [["[\"relu_layer\", 128, 512, 7, 7]", "rocm -keys=rocm,gpu -max_num_threads=256 -mcpu=gfx906 -mtriple=amdgcn-amd-amdhsa-hcc -thread_warp_size=64", [-1, 16, 64, 65536, 2147483647, 1024, 16, 64], "", 0, []], [[], [["FU", 1, [0, 1, 2, 3]], ["SP", 1, 0, 3211264, [32], 1], ["AN", 1, 0, 5], ["AN", 1, 1, 6]]]], "r": [[0.000235844], 0, 1.58814, 1639119509], "v": "v0.6"}
{"i": [["[\"relu_layer\", 128, 512, 7, 7]", "rocm -keys=rocm,gpu -max_num_threads=256 -mcpu=gfx906 -mtriple=amdgcn-amd-amdhsa-hcc -thread_warp_size=64", [-1, 16, 64, 65536, 2147483647, 1024, 16, 64], "", 0, []], [[], [["FU", 1, [0, 1, 2, 3]], ["SP", 1, 0, 3211264, [64], 1], ["AN", 1, 0, 5], ["AN", 1, 1, 6]]]], "r": [[0.000118921], 0, 1.52395, 1639119511], "v": "v0.6"}
{"i": [["[\"relu_layer\", 128, 512, 7, 7]", "rocm -keys=rocm,gpu -max_num_threads=256 -mcpu=gfx906 -mtriple=amdgcn-amd-amdhsa-hcc -thread_warp_size=64", [-1, 16, 64, 65536, 2147483647, 1024, 16, 64], "", 0, []], [[], [["FU", 1, [0, 1, 2, 3]], ["SP", 1, 0, 3211264, [1], 1], ["AN", 1, 0, 5], ["AN", 1, 1, 6]]]], "r": [[0.00762905], 0, 1.75935, 1639119512], "v": "v0.6"}
{"i": [["[\"relu_layer\", 128, 512, 7, 7]", "rocm -keys=rocm,gpu -max_num_threads=256 -mcpu=gfx906 -mtriple=amdgcn-amd-amdhsa-hcc -thread_warp_size=64", [-1, 16, 64, 65536, 2147483647, 1024, 16, 64], "", 0, []], [[], [["FU", 1, [0, 1, 2, 3]], ["SP", 1, 0, 3211264, [28], 1], ["AN", 1, 0, 5], ["AN", 1, 1, 6]]]], "r": [[0.00026937], 0, 1.58867, 1639119514], "v": "v0.6"}
{"i": [["[\"relu_layer\", 128, 512, 7, 7]", "rocm -keys=rocm,gpu -max_num_threads=256 -mcpu=gfx906 -mtriple=amdgcn-amd-amdhsa-hcc -thread_warp_size=64", [-1, 16, 64, 65536, 2147483647, 1024, 16, 64], "", 0, []], [[], [["FU", 1, [0, 1, 2, 3]], ["SP", 1, 0, 3211264, [49], 1], ["AN", 1, 0, 5], ["AN", 1, 1, 6]]]], "r": [[0.000154796], 0, 1.56298, 1639119515], "v": "v0.6"}
{"i": [["[\"relu_layer\", 128, 512, 7, 7]", "rocm -keys=rocm,gpu -max_num_threads=256 -mcpu=gfx906 -mtriple=amdgcn-amd-amdhsa-hcc -thread_warp_size=64", [-1, 16, 64, 65536, 2147483647, 1024, 16, 64], "", 0, []], [[], [["FU", 1, [0, 1, 2, 3]], ["SP", 1, 0, 3211264, [14], 1], ["AN", 1, 0, 5], ["AN", 1, 1, 6]]]], "r": [[0.000536097], 0, 1.52862, 1639119516], "v": "v0.6"}
