artifacts/Table4/tvm/ansor/elementwise/ansor_relu_128_84_42_42.log
{"i": [["[\"relu_layer\", 128, 84, 42, 42]", "rocm -keys=rocm,gpu -max_num_threads=256 -mcpu=gfx906 -mtriple=amdgcn-amd-amdhsa-hcc -thread_warp_size=64", [-1, 16, 64, 65536, 2147483647, 1024, 16, 64], "", 0, []], [[], [["FU", 1, [0, 1, 2, 3]], ["SP", 1, 0, 18966528, [24], 1], ["AN", 1, 0, 5], ["AN", 1, 1, 6]]]], "r": [[0.00184446], 0, 2.38216, 1639120300], "v": "v0.6"}
{"i": [["[\"relu_layer\", 128, 84, 42, 42]", "rocm -keys=rocm,gpu -max_num_threads=256 -mcpu=gfx906 -mtriple=amdgcn-amd-amdhsa-hcc -thread_warp_size=64", [-1, 16, 64, 65536, 2147483647, 1024, 16, 64], "", 0, []], [[], [["FU", 1, [0, 1, 2, 3]], ["SP", 1, 0, 18966528, [9], 1], ["AN", 1, 0, 5], ["AN", 1, 1, 6]]]], "r": [[0.00506544], 0, 1.98697, 1639120302], "v": "v0.6"}
{"i": [["[\"relu_layer\", 128, 84, 42, 42]", "rocm -keys=rocm,gpu -max_num_threads=256 -mcpu=gfx906 -mtriple=amdgcn-amd-amdhsa-hcc -thread_warp_size=64", [-1, 16, 64, 65536, 2147483647, 1024, 16, 64], "", 0, []], [[], [["FU", 1, [0, 1, 2, 3]], ["SP", 1, 0, 18966528, [48], 1], ["AN", 1, 0, 5], ["AN", 1, 1, 6]]]], "r": [[0.000923149], 0, 2.33815, 1639120304], "v": "v0.6"}
{"i": [["[\"relu_layer\", 128, 84, 42, 42]", "rocm -keys=rocm,gpu -max_num_threads=256 -mcpu=gfx906 -mtriple=amdgcn-amd-amdhsa-hcc -thread_warp_size=64", [-1, 16, 64, 65536, 2147483647, 1024, 16, 64], "", 0, []], [[], [["FU", 1, [0, 1, 2, 3]], ["SP", 1, 0, 18966528, [36], 1], ["AN", 1, 0, 5], ["AN", 1, 1, 6]]]], "r": [[0.0012303], 0, 2.35021, 1639120306], "v": "v0.6"}
{"i": [["[\"relu_layer\", 128, 84, 42, 42]", "rocm -keys=rocm,gpu -max_num_threads=256 -mcpu=gfx906 -mtriple=amdgcn-amd-amdhsa-hcc -thread_warp_size=64", [-1, 16, 64, 65536, 2147483647, 1024, 16, 64], "", 0, []], [[], [["FU", 1, [0, 1, 2, 3]], ["SP", 1, 0, 18966528, [14], 1], ["AN", 1, 0, 5], ["AN", 1, 1, 6]]]], "r": [[0.00315993], 0, 2.39975, 1639120308], "v": "v0.6"}
{"i": [["[\"relu_layer\", 128, 84, 42, 42]", "rocm -keys=rocm,gpu -max_num_threads=256 -mcpu=gfx906 -mtriple=amdgcn-amd-amdhsa-hcc -thread_warp_size=64", [-1, 16, 64, 65536, 2147483647, 1024, 16, 64], "", 0, []], [[], [["FU", 1, [0, 1, 2, 3]], ["SP", 1, 0, 18966528, [42], 1], ["AN", 1, 0, 5], ["AN", 1, 1, 6]]]], "r": [[0.0010546], 0, 2.45738, 1639120310], "v": "v0.6"}
{"i": [["[\"relu_layer\", 128, 84, 42, 42]", "rocm -keys=rocm,gpu -max_num_threads=256 -mcpu=gfx906 -mtriple=amdgcn-amd-amdhsa-hcc -thread_warp_size=64", [-1, 16, 64, 65536, 2147483647, 1024, 16, 64], "", 0, []], [[], [["FU", 1, [0, 1, 2, 3]], ["SP", 1, 0, 18966528, [7], 1], ["AN", 1, 0, 5], ["AN", 1, 1, 6]]]], "r": [[0.00632007], 0, 2.03207, 1639120312], "v": "v0.6"}
{"i": [["[\"relu_layer\", 128, 84, 42, 42]", "rocm -keys=rocm,gpu -max_num_threads=256 -mcpu=gfx906 -mtriple=amdgcn-amd-amdhsa-hcc -thread_warp_size=64", [-1, 16, 64, 65536, 2147483647, 1024, 16, 64], "", 0, []], [[], [["FU", 1, [0, 1, 2, 3]], ["SP", 1, 0, 18966528, [54], 1], ["AN", 1, 0, 5], ["AN", 1, 1, 6]]]], "r": [[0.000820748], 0, 2.36308, 1639120314], "v": "v0.6"}
{"i": [["[\"relu_layer\", 128, 84, 42, 42]", "rocm -keys=rocm,gpu -max_num_threads=256 -mcpu=gfx906 -mtriple=amdgcn-amd-amdhsa-hcc -thread_warp_size=64", [-1, 16, 64, 65536, 2147483647, 1024, 16, 64], "", 0, []], [[], [["FU", 1, [0, 1, 2, 3]], ["SP", 1, 0, 18966528, [18], 1], ["AN", 1, 0, 5], ["AN", 1, 1, 6]]]], "r": [[0.0024579], 0, 2.4275, 1639120316], "v": "v0.6"}
{"i": [["[\"relu_layer\", 128, 84, 42, 42]", "rocm -keys=rocm,gpu -max_num_threads=256 -mcpu=gfx906 -mtriple=amdgcn-amd-amdhsa-hcc -thread_warp_size=64", [-1, 16, 64, 65536, 2147483647, 1024, 16, 64], "", 0, []], [[], [["FU", 1, [0, 1, 2, 3]], ["SP", 1, 0, 18966528, [49], 1], ["AN", 1, 0, 5], ["AN", 1, 1, 6]]]], "r": [[0.000904459], 0, 2.28172, 1639120319], "v": "v0.6"}
{"i": [["[\"relu_layer\", 128, 84, 42, 42]", "rocm -keys=rocm,gpu -max_num_threads=256 -mcpu=gfx906 -mtriple=amdgcn-amd-amdhsa-hcc -thread_warp_size=64", [-1, 16, 64, 65536, 2147483647, 1024, 16, 64], "", 0, []], [[], [["FU", 1, [0, 1, 2, 3]], ["SP", 1, 0, 18966528, [56], 1], ["AN", 1, 0, 5], ["AN", 1, 1, 6]]]], "r": [[0.000791761], 0, 2.39714, 1639120321], "v": "v0.6"}
{"i": [["[\"relu_layer\", 128, 84, 42, 42]", "rocm -keys=rocm,gpu -max_num_threads=256 -mcpu=gfx906 -mtriple=amdgcn-amd-amdhsa-hcc -thread_warp_size=64", [-1, 16, 64, 65536, 2147483647, 1024, 16, 64], "", 0, []], [[], [["FU", 1, [0, 1, 2, 3]], ["SP", 1, 0, 18966528, [27], 1], ["AN", 1, 0, 5], ["AN", 1, 1, 6]]]], "r": [[0.00163958], 0, 2.41949, 1639120323], "v": "v0.6"}
{"i": [["[\"relu_layer\", 128, 84, 42, 42]", "rocm -keys=rocm,gpu -max_num_threads=256 -mcpu=gfx906 -mtriple=amdgcn-amd-amdhsa-hcc -thread_warp_size=64", [-1, 16, 64, 65536, 2147483647, 1024, 16, 64], "", 0, []], [[], [["FU", 1, [0, 1, 2, 3]], ["SP", 1, 0, 18966528, [2], 1], ["AN", 1, 0, 5], ["AN", 1, 1, 6]]]], "r": [[0.0221109], 0, 2.45206, 1639120325], "v": "v0.6"}
{"i": [["[\"relu_layer\", 128, 84, 42, 42]", "rocm -keys=rocm,gpu -max_num_threads=256 -mcpu=gfx906 -mtriple=amdgcn-amd-amdhsa-hcc -thread_warp_size=64", [-1, 16, 64, 65536, 2147483647, 1024, 16, 64], "", 0, []], [[], [["FU", 1, [0, 1, 2, 3]], ["SP", 1, 0, 18966528, [4], 1], ["AN", 1, 0, 5], ["AN", 1, 1, 6]]]], "r": [[0.0113879], 0, 1.93999, 1639120327], "v": "v0.6"}
{"i": [["[\"relu_layer\", 128, 84, 42, 42]", "rocm -keys=rocm,gpu -max_num_threads=256 -mcpu=gfx906 -mtriple=amdgcn-amd-amdhsa-hcc -thread_warp_size=64", [-1, 16, 64, 65536, 2147483647, 1024, 16, 64], "", 0, []], [[], [["FU", 1, [0, 1, 2, 3]], ["SP", 1, 0, 18966528, [28], 1], ["AN", 1, 0, 5], ["AN", 1, 1, 6]]]], "r": [[0.00158103], 0, 2.34913, 1639120329], "v": "v0.6"}
{"i": [["[\"relu_layer\", 128, 84, 42, 42]", "rocm -keys=rocm,gpu -max_num_threads=256 -mcpu=gfx906 -mtriple=amdgcn-amd-amdhsa-hcc -thread_warp_size=64", [-1, 16, 64, 65536, 2147483647, 1024, 16, 64], "", 0, []], [[], [["FU", 1, [0, 1, 2, 3]], ["SP", 1, 0, 18966528, [1], 1], ["AN", 1, 0, 5], ["AN", 1, 1, 6]]]], "r": [[0.0442193], 0, 2.25441, 1639120331], "v": "v0.6"}
{"i": [["[\"relu_layer\", 128, 84, 42, 42]", "rocm -keys=rocm,gpu -max_num_threads=256 -mcpu=gfx906 -mtriple=amdgcn-amd-amdhsa-hcc -thread_warp_size=64", [-1, 16, 64, 65536, 2147483647, 1024, 16, 64], "", 0, []], [[], [["FU", 1, [0, 1, 2, 3]], ["SP", 1, 0, 18966528, [3], 1], ["AN", 1, 0, 5], ["AN", 1, 1, 6]]]], "r": [[0.0147436], 0, 2.11868, 1639120333], "v": "v0.6"}
{"i": [["[\"relu_layer\", 128, 84, 42, 42]", "rocm -keys=rocm,gpu -max_num_threads=256 -mcpu=gfx906 -mtriple=amdgcn-amd-amdhsa-hcc -thread_warp_size=64", [-1, 16, 64, 65536, 2147483647, 1024, 16, 64], "", 0, []], [[], [["FU", 1, [0, 1, 2, 3]], ["SP", 1, 0, 18966528, [21], 1], ["AN", 1, 0, 5], ["AN", 1, 1, 6]]]], "r": [[0.00210747], 0, 2.36564, 1639120335], "v": "v0.6"}
{"i": [["[\"relu_layer\", 128, 84, 42, 42]", "rocm -keys=rocm,gpu -max_num_threads=256 -mcpu=gfx906 -mtriple=amdgcn-amd-amdhsa-hcc -thread_warp_size=64", [-1, 16, 64, 65536, 2147483647, 1024, 16, 64], "", 0, []], [[], [["FU", 1, [0, 1, 2, 3]], ["SP", 1, 0, 18966528, [63], 1], ["AN", 1, 0, 5], ["AN", 1, 1, 6]]]], "r": [[0.000703891], 0, 2.33221, 1639120337], "v": "v0.6"}
{"i": [["[\"relu_layer\", 128, 84, 42, 42]", "rocm -keys=rocm,gpu -max_num_threads=256 -mcpu=gfx906 -mtriple=amdgcn-amd-amdhsa-hcc -thread_warp_size=64", [-1, 16, 64, 65536, 2147483647, 1024, 16, 64], "", 0, []], [[], [["FU", 1, [0, 1, 2, 3]], ["SP", 1, 0, 18966528, [64], 1], ["AN", 1, 0, 5], ["AN", 1, 1, 6]]]], "r": [[0.000692882], 0, 2.34189, 1639120339], "v": "v0.6"}
{"i": [["[\"relu_layer\", 128, 84, 42, 42]", "rocm -keys=rocm,gpu -max_num_threads=256 -mcpu=gfx906 -mtriple=amdgcn-amd-amdhsa-hcc -thread_warp_size=64", [-1, 16, 64, 65536, 2147483647, 1024, 16, 64], "", 0, []], [[], [["FU", 1, [0, 1, 2, 3]], ["SP", 1, 0, 18966528, [12], 1], ["AN", 1, 0, 5], ["AN", 1, 1, 6]]]], "r": [[0.00379921], 0, 2.00915, 1639120341], "v": "v0.6"}
{"i": [["[\"relu_layer\", 128, 84, 42, 42]", "rocm -keys=rocm,gpu -max_num_threads=256 -mcpu=gfx906 -mtriple=amdgcn-amd-amdhsa-hcc -thread_warp_size=64", [-1, 16, 64, 65536, 2147483647, 1024, 16, 64], "", 0, []], [[], [["FU", 1, [0, 1, 2, 3]], ["SP", 1, 0, 18966528, [32], 1], ["AN", 1, 0, 5], ["AN", 1, 1, 6]]]], "r": [[0.00138371], 0, 2.31415, 1639120343], "v": "v0.6"}
{"i": [["[\"relu_layer\", 128, 84, 42, 42]", "rocm -keys=rocm,gpu -max_num_threads=256 -mcpu=gfx906 -mtriple=amdgcn-amd-amdhsa-hcc -thread_warp_size=64", [-1, 16, 64, 65536, 2147483647, 1024, 16, 64], "", 0, []], [[], [["FU", 1, [0, 1, 2, 3]], ["SP", 1, 0, 18966528, [16], 1], ["AN", 1, 0, 5], ["AN", 1, 1, 6]]]], "r": [[0.00276534], 0, 2.55444, 1639120346], "v": "v0.6"}
{"i": [["[\"relu_layer\", 128, 84, 42, 42]", "rocm -keys=rocm,gpu -max_num_threads=256 -mcpu=gfx906 -mtriple=amdgcn-amd-amdhsa-hcc -thread_warp_size=64", [-1, 16, 64, 65536, 2147483647, 1024, 16, 64], "", 0, []], [[], [["FU", 1, [0, 1, 2, 3]], ["SP", 1, 0, 18966528, [8], 1], ["AN", 1, 0, 5], ["AN", 1, 1, 6]]]], "r": [[0.0056968], 0, 2.03093, 1639120347], "v": "v0.6"}
{"i": [["[\"relu_layer\", 128, 84, 42, 42]", "rocm -keys=rocm,gpu -max_num_threads=256 -mcpu=gfx906 -mtriple=amdgcn-amd-amdhsa-hcc -thread_warp_size=64", [-1, 16, 64, 65536, 2147483647, 1024, 16, 64], "", 0, []], [[], [["FU", 1, [0, 1, 2, 3]], ["SP", 1, 0, 18966528, [6], 1], ["AN", 1, 0, 5], ["AN", 1, 1, 6]]]], "r": [[0.00758688], 0, 2.0167, 1639120349], "v": "v0.6"}
