artifacts/Table4/tvm/ansor/elementwise/ansor_relu_128_1024_14_14.log
{"i": [["[\"relu_layer\", 128, 1024, 14, 14]", "rocm -keys=rocm,gpu -max_num_threads=256 -mcpu=gfx906 -mtriple=amdgcn-amd-amdhsa-hcc -thread_warp_size=64", [-1, 16, 64, 65536, 2147483647, 1024, 16, 64], "", 0, []], [[], [["FU", 1, [0, 1, 2, 3]], ["SP", 1, 0, 25690112, [14], 1], ["AN", 1, 0, 5], ["AN", 1, 1, 6]]]], "r": [[0.00427957], 0, 2.74099, 1639117678], "v": "v0.6"}
{"i": [["[\"relu_layer\", 128, 1024, 14, 14]", "rocm -keys=rocm,gpu -max_num_threads=256 -mcpu=gfx906 -mtriple=amdgcn-amd-amdhsa-hcc -thread_warp_size=64", [-1, 16, 64, 65536, 2147483647, 1024, 16, 64], "", 0, []], [[], [["FU", 1, [0, 1, 2, 3]], ["SP", 1, 0, 25690112, [56], 1], ["AN", 1, 0, 5], ["AN", 1, 1, 6]]]], "r": [[0.00107125], 0, 2.73935, 1639117681], "v": "v0.6"}
{"i": [["[\"relu_layer\", 128, 1024, 14, 14]", "rocm -keys=rocm,gpu -max_num_threads=256 -mcpu=gfx906 -mtriple=amdgcn-amd-amdhsa-hcc -thread_warp_size=64", [-1, 16, 64, 65536, 2147483647, 1024, 16, 64], "", 0, []], [[], [["FU", 1, [0, 1, 2, 3]], ["SP", 1, 0, 25690112, [16], 1], ["AN", 1, 0, 5], ["AN", 1, 1, 6]]]], "r": [[0.00374504], 0, 2.80154, 1639117683], "v": "v0.6"}
{"i": [["[\"relu_layer\", 128, 1024, 14, 14]", "rocm -keys=rocm,gpu -max_num_threads=256 -mcpu=gfx906 -mtriple=amdgcn-amd-amdhsa-hcc -thread_warp_size=64", [-1, 16, 64, 65536, 2147483647, 1024, 16, 64], "", 0, []], [[], [["FU", 1, [0, 1, 2, 3]], ["SP", 1, 0, 25690112, [64], 1], ["AN", 1, 0, 5], ["AN", 1, 1, 6]]]], "r": [[0.00093763], 0, 2.68932, 1639117686], "v": "v0.6"}
{"i": [["[\"relu_layer\", 128, 1024, 14, 14]", "rocm -keys=rocm,gpu -max_num_threads=256 -mcpu=gfx906 -mtriple=amdgcn-amd-amdhsa-hcc -thread_warp_size=64", [-1, 16, 64, 65536, 2147483647, 1024, 16, 64], "", 0, []], [[], [["FU", 1, [0, 1, 2, 3]], ["SP", 1, 0, 25690112, [7], 1], ["AN", 1, 0, 5], ["AN", 1, 1, 6]]]], "r": [[0.00855649], 0, 2.80334, 1639117688], "v": "v0.6"}
{"i": [["[\"relu_layer\", 128, 1024, 14, 14]", "rocm -keys=rocm,gpu -max_num_threads=256 -mcpu=gfx906 -mtriple=amdgcn-amd-amdhsa-hcc -thread_warp_size=64", [-1, 16, 64, 65536, 2147483647, 1024, 16, 64], "", 0, []], [[], [["FU", 1, [0, 1, 2, 3]], ["SP", 1, 0, 25690112, [32], 1], ["AN", 1, 0, 5], ["AN", 1, 1, 6]]]], "r": [[0.00187327], 0, 2.71704, 1639117691], "v": "v0.6"}
{"i": [["[\"relu_layer\", 128, 1024, 14, 14]", "rocm -keys=rocm,gpu -max_num_threads=256 -mcpu=gfx906 -mtriple=amdgcn-amd-amdhsa-hcc -thread_warp_size=64", [-1, 16, 64, 65536, 2147483647, 1024, 16, 64], "", 0, []], [[], [["FU", 1, [0, 1, 2, 3]], ["SP", 1, 0, 25690112, [8], 1], ["AN", 1, 0, 5], ["AN", 1, 1, 6]]]], "r": [[0.00748817], 0, 2.88954, 1639117693], "v": "v0.6"}
{"i": [["[\"relu_layer\", 128, 1024, 14, 14]", "rocm -keys=rocm,gpu -max_num_threads=256 -mcpu=gfx906 -mtriple=amdgcn-amd-amdhsa-hcc -thread_warp_size=64", [-1, 16, 64, 65536, 2147483647, 1024, 16, 64], "", 0, []], [[], [["FU", 1, [0, 1, 2, 3]], ["SP", 1, 0, 25690112, [4], 1], ["AN", 1, 0, 5], ["AN", 1, 1, 6]]]], "r": [[0.0149737], 0, 2.89959, 1639117696], "v": "v0.6"}
{"i": [["[\"relu_layer\", 128, 1024, 14, 14]", "rocm -keys=rocm,gpu -max_num_threads=256 -mcpu=gfx906 -mtriple=amdgcn-amd-amdhsa-hcc -thread_warp_size=64", [-1, 16, 64, 65536, 2147483647, 1024, 16, 64], "", 0, []], [[], [["FU", 1, [0, 1, 2, 3]], ["SP", 1, 0, 25690112, [1], 1], ["AN", 1, 0, 5], ["AN", 1, 1, 6]]]], "r": [[0.0598847], 0, 2.71638, 1639117699], "v": "v0.6"}
{"i": [["[\"relu_layer\", 128, 1024, 14, 14]", "rocm -keys=rocm,gpu -max_num_threads=256 -mcpu=gfx906 -mtriple=amdgcn-amd-amdhsa-hcc -thread_warp_size=64", [-1, 16, 64, 65536, 2147483647, 1024, 16, 64], "", 0, []], [[], [["FU", 1, [0, 1, 2, 3]], ["SP", 1, 0, 25690112, [2], 1], ["AN", 1, 0, 5], ["AN", 1, 1, 6]]]], "r": [[0.0299456], 0, 3.0288, 1639117701], "v": "v0.6"}
{"i": [["[\"relu_layer\", 128, 1024, 14, 14]", "rocm -keys=rocm,gpu -max_num_threads=256 -mcpu=gfx906 -mtriple=amdgcn-amd-amdhsa-hcc -thread_warp_size=64", [-1, 16, 64, 65536, 2147483647, 1024, 16, 64], "", 0, []], [[], [["FU", 1, [0, 1, 2, 3]], ["SP", 1, 0, 25690112, [49], 1], ["AN", 1, 0, 5], ["AN", 1, 1, 6]]]], "r": [[0.00122421], 0, 2.73213, 1639117704], "v": "v0.6"}
{"i": [["[\"relu_layer\", 128, 1024, 14, 14]", "rocm -keys=rocm,gpu -max_num_threads=256 -mcpu=gfx906 -mtriple=amdgcn-amd-amdhsa-hcc -thread_warp_size=64", [-1, 16, 64, 65536, 2147483647, 1024, 16, 64], "", 0, []], [[], [["FU", 1, [0, 1, 2, 3]], ["SP", 1, 0, 25690112, [28], 1], ["AN", 1, 0, 5], ["AN", 1, 1, 6]]]], "r": [[0.00214087], 0, 2.77326, 1639117706], "v": "v0.6"}
