artifacts/Table4/tvm/ansor/elementwise/ansor_relu_128_2048_7_7.log
{"i": [["[\"relu_layer\", 128, 2048, 7, 7]", "rocm -keys=rocm,gpu -max_num_threads=256 -mcpu=gfx906 -mtriple=amdgcn-amd-amdhsa-hcc -thread_warp_size=64", [-1, 16, 64, 65536, 2147483647, 1024, 16, 64], "", 0, []], [[], [["FU", 1, [0, 1, 2, 3]], ["SP", 1, 0, 12845056, [14], 1], ["AN", 1, 0, 5], ["AN", 1, 1, 6]]]], "r": [[0.00220606], 0, 2.02202, 1639119541], "v": "v0.6"}
{"i": [["[\"relu_layer\", 128, 2048, 7, 7]", "rocm -keys=rocm,gpu -max_num_threads=256 -mcpu=gfx906 -mtriple=amdgcn-amd-amdhsa-hcc -thread_warp_size=64", [-1, 16, 64, 65536, 2147483647, 1024, 16, 64], "", 0, []], [[], [["FU", 1, [0, 1, 2, 3]], ["SP", 1, 0, 12845056, [4], 1], ["AN", 1, 0, 5], ["AN", 1, 1, 6]]]], "r": [[0.00771905], 0, 1.70118, 1639119543], "v": "v0.6"}
{"i": [["[\"relu_layer\", 128, 2048, 7, 7]", "rocm -keys=rocm,gpu -max_num_threads=256 -mcpu=gfx906 -mtriple=amdgcn-amd-amdhsa-hcc -thread_warp_size=64", [-1, 16, 64, 65536, 2147483647, 1024, 16, 64], "", 0, []], [[], [["FU", 1, [0, 1, 2, 3]], ["SP", 1, 0, 12845056, [1], 1], ["AN", 1, 0, 5], ["AN", 1, 1, 6]]]], "r": [[0.0311378], 0, 1.88514, 1639119544], "v": "v0.6"}
{"i": [["[\"relu_layer\", 128, 2048, 7, 7]", "rocm -keys=rocm,gpu -max_num_threads=256 -mcpu=gfx906 -mtriple=amdgcn-amd-amdhsa-hcc -thread_warp_size=64", [-1, 16, 64, 65536, 2147483647, 1024, 16, 64], "", 0, []], [[], [["FU", 1, [0, 1, 2, 3]], ["SP", 1, 0, 12845056, [2], 1], ["AN", 1, 0, 5], ["AN", 1, 1, 6]]]], "r": [[0.0155838], 0, 1.69681, 1639119546], "v": "v0.6"}
{"i": [["[\"relu_layer\", 128, 2048, 7, 7]", "rocm -keys=rocm,gpu -max_num_threads=256 -mcpu=gfx906 -mtriple=amdgcn-amd-amdhsa-hcc -thread_warp_size=64", [-1, 16, 64, 65536, 2147483647, 1024, 16, 64], "", 0, []], [[], [["FU", 1, [0, 1, 2, 3]], ["SP", 1, 0, 12845056, [49], 1], ["AN", 1, 0, 5], ["AN", 1, 1, 6]]]], "r": [[0.000628687], 0, 2.03025, 1639119548], "v": "v0.6"}
{"i": [["[\"relu_layer\", 128, 2048, 7, 7]", "rocm -keys=rocm,gpu -max_num_threads=256 -mcpu=gfx906 -mtriple=amdgcn-amd-amdhsa-hcc -thread_warp_size=64", [-1, 16, 64, 65536, 2147483647, 1024, 16, 64], "", 0, []], [[], [["FU", 1, [0, 1, 2, 3]], ["SP", 1, 0, 12845056, [56], 1], ["AN", 1, 0, 5], ["AN", 1, 1, 6]]]], "r": [[0.00055009], 0, 1.94484, 1639119550], "v": "v0.6"}
{"i": [["[\"relu_layer\", 128, 2048, 7, 7]", "rocm -keys=rocm,gpu -max_num_threads=256 -mcpu=gfx906 -mtriple=amdgcn-amd-amdhsa-hcc -thread_warp_size=64", [-1, 16, 64, 65536, 2147483647, 1024, 16, 64], "", 0, []], [[], [["FU", 1, [0, 1, 2, 3]], ["SP", 1, 0, 12845056, [8], 1], ["AN", 1, 0, 5], ["AN", 1, 1, 6]]]], "r": [[0.00381407], 0, 2.11392, 1639119552], "v": "v0.6"}
{"i": [["[\"relu_layer\", 128, 2048, 7, 7]", "rocm -keys=rocm,gpu -max_num_threads=256 -mcpu=gfx906 -mtriple=amdgcn-amd-amdhsa-hcc -thread_warp_size=64", [-1, 16, 64, 65536, 2147483647, 1024, 16, 64], "", 0, []], [[], [["FU", 1, [0, 1, 2, 3]], ["SP", 1, 0, 12845056, [7], 1], ["AN", 1, 0, 5], ["AN", 1, 1, 6]]]], "r": [[0.00446451], 0, 1.74798, 1639119553], "v": "v0.6"}
{"i": [["[\"relu_layer\", 128, 2048, 7, 7]", "rocm -keys=rocm,gpu -max_num_threads=256 -mcpu=gfx906 -mtriple=amdgcn-amd-amdhsa-hcc -thread_warp_size=64", [-1, 16, 64, 65536, 2147483647, 1024, 16, 64], "", 0, []], [[], [["FU", 1, [0, 1, 2, 3]], ["SP", 1, 0, 12845056, [28], 1], ["AN", 1, 0, 5], ["AN", 1, 1, 6]]]], "r": [[0.00109704], 0, 1.9923, 1639119555], "v": "v0.6"}
{"i": [["[\"relu_layer\", 128, 2048, 7, 7]", "rocm -keys=rocm,gpu -max_num_threads=256 -mcpu=gfx906 -mtriple=amdgcn-amd-amdhsa-hcc -thread_warp_size=64", [-1, 16, 64, 65536, 2147483647, 1024, 16, 64], "", 0, []], [[], [["FU", 1, [0, 1, 2, 3]], ["SP", 1, 0, 12845056, [32], 1], ["AN", 1, 0, 5], ["AN", 1, 1, 6]]]], "r": [[0.00096964], 0, 2.02697, 1639119557], "v": "v0.6"}
{"i": [["[\"relu_layer\", 128, 2048, 7, 7]", "rocm -keys=rocm,gpu -max_num_threads=256 -mcpu=gfx906 -mtriple=amdgcn-amd-amdhsa-hcc -thread_warp_size=64", [-1, 16, 64, 65536, 2147483647, 1024, 16, 64], "", 0, []], [[], [["FU", 1, [0, 1, 2, 3]], ["SP", 1, 0, 12845056, [16], 1], ["AN", 1, 0, 5], ["AN", 1, 1, 6]]]], "r": [[0.00192873], 0, 2.12141, 1639119559], "v": "v0.6"}
{"i": [["[\"relu_layer\", 128, 2048, 7, 7]", "rocm -keys=rocm,gpu -max_num_threads=256 -mcpu=gfx906 -mtriple=amdgcn-amd-amdhsa-hcc -thread_warp_size=64", [-1, 16, 64, 65536, 2147483647, 1024, 16, 64], "", 0, []], [[], [["FU", 1, [0, 1, 2, 3]], ["SP", 1, 0, 12845056, [64], 1], ["AN", 1, 0, 5], ["AN", 1, 1, 6]]]], "r": [[0.000482861], 0, 2.00043, 1639119561], "v": "v0.6"}
