artifacts/figure12/tvm/autotvm_kernels/relay_resnext_nchw_tuned.1000.best.log
{"i": ["cuda -model=unknown", "topi_nn_conv2d", [["TENSOR", [1, 1024, 16, 16], "float32"], ["TENSOR", [128, 1024, 1, 1], "float32"], [1, 1], [0, 0, 0, 0], [1, 1], "NCHW", "float32"], {}, ["conv2d", [1, 1024, 16, 16, "float32"], [128, 1024, 1, 1, "float32"], [1, 1], [0, 0, 0, 0], [1, 1], "NCHW", "float32"], {"i": 8879426, "t": "direct", "c": "null", "e": [["tile_f", "sp", [-1, 1, 16, 1]], ["tile_y", "sp", [-1, 1, 2, 1]], ["tile_x", "sp", [-1, 1, 16, 1]], ["tile_rc", "sp", [-1, 32]], ["tile_ry", "sp", [-1, 1]], ["tile_rx", "sp", [-1, 1]], ["auto_unroll_max_step", "ot", 1500], ["unroll_explicit", "ot", 1]]}], "r": [[2.5603714377820762e-05], 0, 6.077045917510986, 1582124542.7361429], "v": 0.1}
{"i": ["cuda -model=unknown", "topi_nn_conv2d", [["TENSOR", [1, 1024, 32, 32], "float32"], ["TENSOR", [64, 1024, 1, 1], "float32"], [1, 1], [0, 0, 0, 0], [1, 1], "NCHW", "float32"], {}, ["conv2d", [1, 1024, 32, 32, "float32"], [64, 1024, 1, 1, "float32"], [1, 1], [0, 0, 0, 0], [1, 1], "NCHW", "float32"], {"i": 15894862, "t": "direct", "c": "null", "e": [["tile_f", "sp", [-1, 1, 16, 2]], ["tile_y", "sp", [-1, 1, 1, 1]], ["tile_x", "sp", [-1, 2, 16, 1]], ["tile_rc", "sp", [-1, 32]], ["tile_ry", "sp", [-1, 1]], ["tile_rx", "sp", [-1, 1]], ["auto_unroll_max_step", "ot", 1500], ["unroll_explicit", "ot", 1]]}], "r": [[3.882639112786315e-05], 0, 2.4769604206085205, 1582131894.752548], "v": 0.1}
{"i": ["cuda -model=unknown", "topi_nn_conv2d", [["TENSOR", [1, 1024, 8, 8], "float32"], ["TENSOR", [256, 1024, 1, 1], "float32"], [1, 1], [0, 0, 0, 0], [1, 1], "NCHW", "float32"], {}, ["conv2d", [1, 1024, 8, 8, "float32"], [256, 1024, 1, 1, "float32"], [1, 1], [0, 0, 0, 0], [1, 1], "NCHW", "float32"], {"i": 1812390, "t": "direct", "c": "null", "e": [["tile_f", "sp", [-1, 1, 16, 1]], ["tile_y", "sp", [-1, 1, 2, 1]], ["tile_x", "sp", [-1, 1, 8, 1]], ["tile_rc", "sp", [-1, 32]], ["tile_ry", "sp", [-1, 1]], ["tile_rx", "sp", [-1, 1]], ["auto_unroll_max_step", "ot", 1500], ["unroll_explicit", "ot", 0]]}], "r": [[1.700600162999185e-05], 0, 2.1174890995025635, 1582136702.365969], "v": 0.1}
{"i": ["cuda -model=unknown", "topi_nn_conv2d", [["TENSOR", [1, 128, 16, 16], "float32"], ["TENSOR", [64, 128, 1, 1], "float32"], [1, 1], [0, 0, 0, 0], [1, 1], "NCHW", "float32"], {}, ["conv2d", [1, 128, 16, 16, "float32"], [64, 128, 1, 1, "float32"], [1, 1], [0, 0, 0, 0], [1, 1], "NCHW", "float32"], {"i": 2085238, "t": "direct", "c": "null", "e": [["tile_f", "sp", [-1, 1, 16, 1]], ["tile_y", "sp", [-1, 1, 4, 1]], ["tile_x", "sp", [-1, 1, 4, 1]], ["tile_rc", "sp", [-1, 16]], ["tile_ry", "sp", [-1, 1]], ["tile_rx", "sp", [-1, 1]], ["auto_unroll_max_step", "ot", 1500], ["unroll_explicit", "ot", 0]]}], "r": [[1.5598216479211424e-05], 0, 2.019443988800049, 1582130480.25359], "v": 0.1}
{"i": ["cuda -model=unknown", "topi_nn_conv2d", [["TENSOR", [1, 128, 16, 16], "float32"], ["TENSOR", [64, 128, 1, 1], "float32"], [2, 2], [0, 0, 0, 0], [1, 1], "NCHW", "float32"], {}, ["conv2d", [1, 128, 16, 16, "float32"], [64, 128, 1, 1, "float32"], [2, 2], [0, 0, 0, 0], [1, 1], "NCHW", "float32"], {"i": 370195, "t": "direct", "c": "null", "e": [["tile_f", "sp", [-1, 1, 2, 1]], ["tile_y", "sp", [-1, 1, 4, 1]], ["tile_x", "sp", [-1, 1, 1, 1]], ["tile_rc", "sp", [-1, 8]], ["tile_ry", "sp", [-1, 1]], ["tile_rx", "sp", [-1, 1]], ["auto_unroll_max_step", "ot", 512], ["unroll_explicit", "ot", 0]]}], "r": [[1.2632558923788654e-05], 0, 1.9715750217437744, 1582143638.5089276], "v": 0.1}
{"i": ["cuda -model=unknown", "topi_nn_conv2d", [["TENSOR", [1, 1, 340, 181], "float32"], ["TENSOR", [32, 1, 41, 11], "float32"], [2, 2], [0, 0, 0, 0], [1, 1], "NCHW", "float32"], {}, ["conv2d", [1, 1, 340, 181, "float32"], [32, 1, 41, 11, "float32"], [2, 2], [0, 0, 0, 0], [1, 1], "NCHW", "float32"], {"i": 1532243, "t": "direct", "c": "null", "e": [["tile_f", "sp", [-1, 2, 2, 2]], ["tile_y", "sp", [-1, 2, 1, 1]], ["tile_x", "sp", [-1, 1, 43, 2]], ["tile_rc", "sp", [-1, 1]], ["tile_ry", "sp", [-1, 1]], ["tile_rx", "sp", [-1, 11]], ["auto_unroll_max_step", "ot", 1500], ["unroll_explicit", "ot", 0]]}], "r": [[5.553316313868613e-05], 0, 1.434511661529541, 1582738805.89131], "v": 0.1}
{"i": ["cuda -model=unknown", "topi_nn_conv2d", [["TENSOR", [1, 256, 8, 8], "float32"], ["TENSOR", [64, 256, 1, 1], "float32"], [1, 1], [0, 0, 0, 0], [1, 1], "NCHW", "float32"], {}, ["conv2d", [1, 256, 8, 8, "float32"], [64, 256, 1, 1, "float32"], [1, 1], [0, 0, 0, 0], [1, 1], "NCHW", "float32"], {"i": 1399794, "t": "direct", "c": "null", "e": [["tile_f", "sp", [-1, 1, 8, 1]], ["tile_y", "sp", [-1, 1, 2, 1]], ["tile_x", "sp", [-1, 1, 2, 2]], ["tile_rc", "sp", [-1, 32]], ["tile_ry", "sp", [-1, 1]], ["tile_rx", "sp", [-1, 1]], ["auto_unroll_max_step", "ot", 512], ["unroll_explicit", "ot", 1]]}], "r": [[1.5185480895522388e-05], 0, 2.856790781021118, 1582123315.5636163], "v": 0.1}
{"i": ["cuda -model=unknown", "topi_nn_conv2d", [["TENSOR", [1, 32, 170, 96], "float32"], ["TENSOR", [32, 32, 21, 11], "float32"], [2, 1], [0, 0, 0, 0], [1, 1], "NCHW", "float32"], {}, ["conv2d", [1, 32, 170, 96, "float32"], [32, 32, 21, 11, "float32"], [2, 1], [0, 0, 0, 0], [1, 1], "NCHW", "float32"], {"i": 4096420, "t": "direct", "c": "null", "e": [["tile_f", "sp", [-1, 1, 32, 1]], ["tile_y", "sp", [-1, 1, 5, 5]], ["tile_x", "sp", [-1, 1, 2, 1]], ["tile_rc", "sp", [-1, 1]], ["tile_ry", "sp", [-1, 21]], ["tile_rx", "sp", [-1, 1]], ["auto_unroll_max_step", "ot", 1500], ["unroll_explicit", "ot", 0]]}], "r": [[0.0005170236709677419], 0, 2.457875967025757, 1582733947.8156085], "v": 0.1}
{"i": ["cuda -model=unknown", "topi_nn_conv2d", [["TENSOR", [1, 3, 32, 32], "float32"], ["TENSOR", [64, 3, 3, 3], "float32"], [1, 1], [1, 1, 1, 1], [1, 1], "NCHW", "float32"], {}, ["conv2d", [1, 3, 32, 32, "float32"], [64, 3, 3, 3, "float32"], [1, 1], [1, 1, 1, 1], [1, 1], "NCHW", "float32"], {"i": 10900888, "t": "direct", "c": "null", "e": [["tile_f", "sp", [-1, 2, 4, 2]], ["tile_y", "sp", [-1, 1, 32, 1]], ["tile_x", "sp", [-1, 1, 1, 2]], ["tile_rc", "sp", [-1, 3]], ["tile_ry", "sp", [-1, 1]], ["tile_rx", "sp", [-1, 1]], ["auto_unroll_max_step", "ot", 1500], ["unroll_explicit", "ot", 1]]}], "r": [[1.5170634743231526e-05], 0, 2.4715635776519775, 1582124509.4761434], "v": 0.1}
{"i": ["cuda -model=unknown", "topi_nn_conv2d", [["TENSOR", [1, 64, 16, 16], "float32"], ["TENSOR", [64, 64, 3, 3], "float32"], [1, 1], [1, 1, 1, 1], [1, 1], "NCHW", "float32"], {}, ["conv2d", [1, 64, 16, 16, "float32"], [64, 64, 3, 3, "float32"], [1, 1], [1, 1, 1, 1], [1, 1], "NCHW", "float32"], {"i": 5489413, "t": "direct", "c": "null", "e": [["tile_f", "sp", [-1, 1, 4, 1]], ["tile_y", "sp", [-1, 1, 2, 1]], ["tile_x", "sp", [-1, 1, 8, 1]], ["tile_rc", "sp", [-1, 16]], ["tile_ry", "sp", [-1, 3]], ["tile_rx", "sp", [-1, 3]], ["auto_unroll_max_step", "ot", 512], ["unroll_explicit", "ot", 0]]}], "r": [[1.4820616847565076e-05], 0, 3.8529789447784424, 1582132042.9728615], "v": 0.1}
{"i": ["cuda -model=unknown", "topi_nn_conv2d", [["TENSOR", [1, 64, 32, 32], "float32"], ["TENSOR", [64, 64, 1, 1], "float32"], [2, 2], [0, 0, 0, 0], [1, 1], "NCHW", "float32"], {}, ["conv2d", [1, 64, 32, 32, "float32"], [64, 64, 1, 1, "float32"], [2, 2], [0, 0, 0, 0], [1, 1], "NCHW", "float32"], {"i": 2383274, "t": "direct", "c": "null", "e": [["tile_f", "sp", [-1, 2, 32, 1]], ["tile_y", "sp", [-1, 1, 4, 2]], ["tile_x", "sp", [-1, 1, 2, 1]], ["tile_rc", "sp", [-1, 4]], ["tile_ry", "sp", [-1, 1]], ["tile_rx", "sp", [-1, 1]], ["auto_unroll_max_step", "ot", 0], ["unroll_explicit", "ot", 1]]}], "r": [[1.3375952955665025e-05], 0, 2.677605390548706, 1582138600.7238305], "v": 0.1}
{"i": ["cuda -model=unknown", "topi_nn_conv2d", [["TENSOR", [1, 64, 32, 32], "float32"], ["TENSOR", [64, 64, 1, 1], "float32"], [1, 1], [0, 0, 0, 0], [1, 1], "NCHW", "float32"], {}, ["conv2d", [1, 64, 32, 32, "float32"], [64, 64, 1, 1, "float32"], [1, 1], [0, 0, 0, 0], [1, 1], "NCHW", "float32"], {"i": 824479, "t": "direct", "c": "null", "e": [["tile_f", "sp", [-1, 2, 8, 1]], ["tile_y", "sp", [-1, 1, 8, 1]], ["tile_x", "sp", [-1, 2, 2, 1]], ["tile_rc", "sp", [-1, 8]], ["tile_ry", "sp", [-1, 1]], ["tile_rx", "sp", [-1, 1]], ["auto_unroll_max_step", "ot", 0], ["unroll_explicit", "ot", 0]]}], "r": [[1.4627062120189063e-05], 0, 2.323371410369873, 1582135731.8131685], "v": 0.1}
{"i": ["cuda -model=unknown", "topi_nn_conv2d", [["TENSOR", [1, 64, 32, 32], "float32"], ["TENSOR", [64, 64, 3, 3], "float32"], [1, 1], [1, 1, 1, 1], [1, 1], "NCHW", "float32"], {}, ["conv2d", [1, 64, 32, 32, "float32"], [64, 64, 3, 3, "float32"], [1, 1], [1, 1, 1, 1], [1, 1], "NCHW", "float32"], {"i": 39861886, "t": "direct", "c": "null", "e": [["tile_f", "sp", [-1, 1, 16, 1]], ["tile_y", "sp", [-1, 4, 1, 1]], ["tile_x", "sp", [-1, 1, 16, 1]], ["tile_rc", "sp", [-1, 16]], ["tile_ry", "sp", [-1, 3]], ["tile_rx", "sp", [-1, 1]], ["auto_unroll_max_step", "ot", 1500], ["unroll_explicit", "ot", 1]]}], "r": [[1.888499423527292e-05], 0, 2.3514864444732666, 1582143987.8647575], "v": 0.1}
{"i": ["cuda -model=unknown", "topi_nn_conv2d", [["TENSOR", [1, 64, 8, 8], "float32"], ["TENSOR", [64, 64, 3, 3], "float32"], [1, 1], [1, 1, 1, 1], [1, 1], "NCHW", "float32"], {}, ["conv2d", [1, 64, 8, 8, "float32"], [64, 64, 3, 3, "float32"], [1, 1], [1, 1, 1, 1], [1, 1], "NCHW", "float32"], {"i": 919723, "t": "direct", "c": "null", "e": [["tile_f", "sp", [-1, 1, 2, 1]], ["tile_y", "sp", [-1, 1, 8, 1]], ["tile_x", "sp", [-1, 1, 4, 1]], ["tile_rc", "sp", [-1, 64]], ["tile_ry", "sp", [-1, 3]], ["tile_rx", "sp", [-1, 3]], ["auto_unroll_max_step", "ot", 0], ["unroll_explicit", "ot", 0]]}], "r": [[1.3682770341094595e-05], 0, 2.8623929023742676, 1582144103.51813], "v": 0.1}
{"i": ["cuda -model=unknown", "topi_nn_dense", [["TENSOR", [1, 256], "float32"], ["TENSOR", [10, 256], "float32"], "null", "float32"], {}, ["dense", [1, 256, "float32"], [10, 256, "float32"], 0, "float32"], {"i": 8, "t": "direct", "c": "null", "e": [["tile_k", "sp", [-1, 256]]]}], "r": [[7.119619093143949e-06], 0, 1.284017562866211, 1598593296.1895127], "v": 0.1}
{"i": ["cuda -model=unknown", "topi_nn_dense", [["TENSOR", [1, 256], "float32"], ["TENSOR", [256, 256], "float32"], "null", "float32"], {}, ["dense", [1, 256, "float32"], [256, 256, "float32"], 0, "float32"], {"i": 5, "t": "direct", "c": "null", "e": [["tile_k", "sp", [-1, 32]]]}], "r": [[6.947641272444751e-06], 0, 1.5646946430206299, 1598592547.6135566], "v": 0.1}
{"i": ["cuda -model=unknown", "topi_nn_dense", [["TENSOR", [1, 256], "float32"], ["TENSOR", [512, 256], "float32"], "null", "float32"], {}, ["dense", [1, 256, "float32"], [512, 256, "float32"], 0, "float32"], {"i": 1, "t": "direct", "c": "null", "e": [["tile_k", "sp", [-1, 2]]]}], "r": [[7.588072542755121e-06], 0, 1.5308971405029297, 1598592556.8581634], "v": 0.1}
{"i": ["cuda -model=unknown", "topi_nn_dense", [["TENSOR", [1, 3008], "float32"], ["TENSOR", [1024, 3008], "float32"], "null", "float32"], {}, ["dense", [1, 3008, "float32"], [1024, 3008, "float32"], 0, "float32"], {"i": 9, "t": "direct", "c": "null", "e": [["tile_k", "sp", [-1, 188]]]}], "r": [[1.784395792926412e-05], 0, 1.4987506866455078, 1598592581.4783933], "v": 0.1}
{"i": ["cuda -model=unknown", "topi_nn_dense", [["TENSOR", [1, 4096], "float32"], ["TENSOR", [1000, 4096], "float32"], "null", "float32"], {}, ["dense", [1, 4096, "float32"], [1000, 4096, "float32"], 0, "float32"], {"i": 8, "t": "direct", "c": "null", "e": [["tile_k", "sp", [-1, 256]]]}], "r": [[2.2283410278594915e-05], 0, 1.5587024688720703, 1598593229.759367], "v": 0.1}
{"i": ["cuda -model=unknown", "topi_nn_dense", [["TENSOR", [1, 4096], "float32"], ["TENSOR", [4096, 4096], "float32"], "null", "float32"], {}, ["dense", [1, 4096, "float32"], [4096, 4096, "float32"], 0, "float32"], {"i": 7, "t": "direct", "c": "null", "e": [["tile_k", "sp", [-1, 128]]]}], "r": [[7.976237737003058e-05], 0, 1.402946949005127, 1598593247.1999054], "v": 0.1}
{"i": ["cuda -model=unknown", "topi_nn_dense", [["TENSOR", [1, 512], "float32"], ["TENSOR", [1024, 512], "float32"], "null", "float32"], {}, ["dense", [1, 512, "float32"], [1024, 512, "float32"], 0, "float32"], {"i": 6, "t": "direct", "c": "null", "e": [["tile_k", "sp", [-1, 64]]]}], "r": [[7.400099817620651e-06], 0, 1.0337629318237305, 1598592566.13695], "v": 0.1}
{"i": ["cuda -model=unknown", "topi_nn_dense", [["TENSOR", [16, 256], "float32"], ["TENSOR", [10, 256], "float32"], "null", "float32"], {}, ["dense", [16, 256, "float32"], [10, 256, "float32"], 0, "float32"], {"i": 5, "t": "direct", "c": "null", "e": [["tile_k", "sp", [-1, 32]]]}], "r": [[6.603096429699842e-06], 0, 1.0251591205596924, 1598593308.709378], "v": 0.1}
{"i": ["cuda -model=unknown", "topi_nn_dense", [["TENSOR", [16, 256], "float32"], ["TENSOR", [256, 256], "float32"], "null", "float32"], {}, ["dense", [16, 256, "float32"], [256, 256, "float32"], 0, "float32"], {"i": 6, "t": "direct", "c": "null", "e": [["tile_k", "sp", [-1, 64]]]}], "r": [[9.195143798681846e-06], 0, 1.0027287006378174, 1598592638.1331623], "v": 0.1}
{"i": ["cuda -model=unknown", "topi_nn_dense", [["TENSOR", [16, 256], "float32"], ["TENSOR", [512, 256], "float32"], "null", "float32"], {}, ["dense", [16, 256, "float32"], [512, 256, "float32"], 0, "float32"], {"i": 5, "t": "direct", "c": "null", "e": [["tile_k", "sp", [-1, 32]]]}], "r": [[1.561282218309859e-05], 0, 1.0831847190856934, 1598592648.498312], "v": 0.1}
{"i": ["cuda -model=unknown", "topi_nn_dense", [["TENSOR", [16, 3008], "float32"], ["TENSOR", [1024, 3008], "float32"], "null", "float32"], {}, ["dense", [16, 3008, "float32"], [1024, 3008, "float32"], 0, "float32"], {"i": 5, "t": "direct", "c": "null", "e": [["tile_k", "sp", [-1, 32]]]}], "r": [[0.0001861694829612221], 0, 1.6113417148590088, 1598592677.4075751], "v": 0.1}
{"i": ["cuda -model=unknown", "topi_nn_dense", [["TENSOR", [16, 512], "float32"], ["TENSOR", [1024, 512], "float32"], "null", "float32"], {}, ["dense", [16, 512, "float32"], [1024, 512, "float32"], 0, "float32"], {"i": 6, "t": "direct", "c": "null", "e": [["tile_k", "sp", [-1, 64]]]}], "r": [[2.860727228027044e-05], 0, 1.2675786018371582, 1598592658.353851], "v": 0.1}
{"i": ["cuda -model=unknown", "topi_nn_dense", [["TENSOR", [1, 768], "float32"], ["TENSOR", [10, 768], "float32"], "null", "float32"], {}, ["dense", [1, 768, "float32"], [10, 768, "float32"], 0, "float32"], {"i": 12, "t": "direct", "c": "null", "e": [["tile_k", "sp", [-1, 96]]]}], "r": [[6.673082214002985e-06], 0, 1.8757774829864502, 1598593333.7451859], "v": 0.1}
{"i": ["cuda -model=unknown", "topi_nn_dense", [["TENSOR", [1, 9216], "float32"], ["TENSOR", [4096, 9216], "float32"], "null", "float32"], {}, ["dense", [1, 9216, "float32"], [4096, 9216, "float32"], 0, "float32"], {"i": 23, "t": "direct", "c": "null", "e": [["tile_k", "sp", [-1, 512]]]}], "r": [[0.00017370986946902653], 0, 1.4507246017456055, 1598593286.0772245], "v": 0.1}
{"i": ["cuda -model=unknown", "topi_nn_dense", [["TENSOR", [4, 256], "float32"], ["TENSOR", [10, 256], "float32"], "null", "float32"], {}, ["dense", [4, 256, "float32"], [10, 256, "float32"], 0, "float32"], {"i": 4, "t": "direct", "c": "null", "e": [["tile_k", "sp", [-1, 16]]]}], "r": [[7.105159726413197e-06], 0, 1.1798827648162842, 1598593300.8982306], "v": 0.1}
{"i": ["cuda -model=unknown", "topi_nn_dense", [["TENSOR", [4, 256], "float32"], ["TENSOR", [256, 256], "float32"], "null", "float32"], {}, ["dense", [4, 256, "float32"], [256, 256, "float32"], 0, "float32"], {"i": 3, "t": "direct", "c": "null", "e": [["tile_k", "sp", [-1, 8]]]}], "r": [[6.947334618184933e-06], 0, 1.4380486011505127, 1598592594.289689], "v": 0.1}
{"i": ["cuda -model=unknown", "topi_nn_dense", [["TENSOR", [4, 256], "float32"], ["TENSOR", [512, 256], "float32"], "null", "float32"], {}, ["dense", [4, 256, "float32"], [512, 256, "float32"], 0, "float32"], {"i": 5, "t": "direct", "c": "null", "e": [["tile_k", "sp", [-1, 32]]]}], "r": [[7.02730880933579e-06], 0, 1.3694701194763184, 1598592601.2095952], "v": 0.1}
{"i": ["cuda -model=unknown", "topi_nn_dense", [["TENSOR", [4, 3008], "float32"], ["TENSOR", [1024, 3008], "float32"], "null", "float32"], {}, ["dense", [4, 3008, "float32"], [1024, 3008, "float32"], 0, "float32"], {"i": 5, "t": "direct", "c": "null", "e": [["tile_k", "sp", [-1, 32]]]}], "r": [[3.8188918238993706e-05], 0, 1.190007209777832, 1598592623.5387523], "v": 0.1}
{"i": ["cuda -model=unknown", "topi_nn_dense", [["TENSOR", [4, 512], "float32"], ["TENSOR", [1024, 512], "float32"], "null", "float32"], {}, ["dense", [4, 512, "float32"], [1024, 512, "float32"], 0, "float32"], {"i": 6, "t": "direct", "c": "null", "e": [["tile_k", "sp", [-1, 64]]]}], "r": [[9.398909516380655e-06], 0, 1.676652193069458, 1598592620.4378686], "v": 0.1}
{"i": ["cuda -model=unknown", "topi_nn_dense", [["TENSOR", [75, 256], "float32"], ["TENSOR", [29, 256], "float32"], "null", "float32"], {}, ["dense", [75, 256, "float32"], [29, 256, "float32"], 0, "float32"], {"i": 5938, "t": "direct", "c": "null", "e": [["tile_x", "sp", [-1, 1, 1, 3]], ["tile_y", "sp", [-1, 1, 1, 1]], ["tile_k", "sp", [-1, 4, 32]]]}], "r": [[2.2543779026217227e-05], 0, 2.3667452335357666, 1598596415.2916846], "v": 0.1}
