artifacts/microbenchmark/tvm/ansor/depthwise/ansor_depthwise_128_336_42_42_5_5_2_SAME.log
{"i": [["[\"depthwise_conv2d_layer\", 128, 336, 42, 42, 5, 5, 2, \"SAME\"]", "cuda -keys=cuda,gpu -max_num_threads=1024 -thread_warp_size=32", [-1, 16, 64, 49152, 2147483647, 1024, 8, 32], "", 0, []], [[], [["CHW", 3, "local"], ["SP", 3, 0, 128, [1, 1, 1, 4], 1], ["SP", 3, 5, 336, [1, 21, 1, 1], 1], ["SP", 3, 10, 21, [1, 1, 1, 3], 1], ["SP", 3, 15, 21, [1, 3, 1, 1], 1], ["SP", 3, 20, 5, [1, 1], 1], ["SP", 3, 23, 5, [1, 5], 1], ["RE", 3, [0, 5, 10, 15, 1, 6, 11, 16, 2, 7, 12, 17, 20, 23, 21, 24, 3, 8, 13, 18, 22, 25, 4, 9, 14, 19]], ["FSP", 4, 0, 1, 3], ["FSP", 4, 4, 2, 3], ["FSP", 4, 8, 3, 3], ["FSP", 4, 12, 4, 3], ["RE", 4, [0, 4, 8, 12, 1, 5, 9, 13, 2, 6, 10, 14, 3, 7, 11, 15]], ["CA", 3, 4, 11], ["CHR", 2, "shared", [3]], ["CA", 3, 4, 13], ["CHR", 1, "shared", [4]], ["CA", 2, 5, 13], ["CI", 1], ["FU", 6, [0, 1, 2, 3]], ["AN", 6, 0, 5], ["FU", 6, [1, 2, 3, 4]], ["AN", 6, 1, 4], ["FU", 6, [2, 3, 4, 5]], ["AN", 6, 2, 6], ["FU", 4, [0, 1, 2, 3]], ["SP", 4, 0, 10, [1], 1], ["AN", 4, 1, 2], ["FFSP", 4, 0, [4, 3, 2, 1], 1, 1], ["AN", 4, 1, 6], ["FU", 2, [0, 1, 2, 3]], ["SP", 2, 0, 200, [1], 1], ["AN", 2, 1, 2], ["FFSP", 2, 0, [4, 3, 2, 1], 1, 1], ["AN", 2, 1, 6], ["PR", 5, 0, "auto_unroll_max_step$1024"]]]], "r": [[0.00335413], 0, 5.62827, 1637780785], "v": "v0.6"}
{"i": [["[\"depthwise_conv2d_layer\", 128, 336, 42, 42, 5, 5, 2, \"SAME\"]", "cuda -keys=cuda,gpu -max_num_threads=1024 -thread_warp_size=32", [-1, 16, 64, 49152, 2147483647, 1024, 8, 32], "", 0, []], [[], [["CHW", 3, "local"], ["SP", 3, 0, 128, [1, 4, 1, 8], 1], ["SP", 3, 5, 336, [1, 1, 6, 1], 1], ["SP", 3, 10, 21, [1, 3, 1, 1], 1], ["SP", 3, 15, 21, [3, 1, 1, 1], 1], ["SP", 3, 20, 5, [1, 1], 1], ["SP", 3, 23, 5, [1, 1], 1], ["RE", 3, [0, 5, 10, 15, 1, 6, 11, 16, 2, 7, 12, 17, 20, 23, 21, 24, 3, 8, 13, 18, 22, 25, 4, 9, 14, 19]], ["FSP", 4, 0, 1, 3], ["FSP", 4, 4, 2, 3], ["FSP", 4, 8, 3, 3], ["FSP", 4, 12, 4, 3], ["RE", 4, [0, 4, 8, 12, 1, 5, 9, 13, 2, 6, 10, 14, 3, 7, 11, 15]], ["CA", 3, 4, 11], ["CHR", 2, "shared", [3]], ["CA", 3, 4, 13], ["CHR", 1, "shared", [4]], ["CA", 2, 5, 13], ["CI", 1], ["FU", 6, [0, 1, 2, 3]], ["AN", 6, 0, 5], ["FU", 6, [1, 2, 3, 4]], ["AN", 6, 1, 4], ["FU", 6, [2, 3, 4, 5]], ["AN", 6, 2, 6], ["FU", 4, [0, 1, 2, 3]], ["SP", 4, 0, 2, [1], 1], ["AN", 4, 1, 2], ["FFSP", 4, 0, [4, 3, 2, 1], 1, 1], ["AN", 4, 1, 6], ["FU", 2, [0, 1, 2, 3]], ["SP", 2, 0, 80, [20], 1], ["AN", 2, 1, 2], ["FFSP", 2, 0, [4, 3, 2, 1], 1, 1], ["AN", 2, 1, 6], ["PR", 5, 0, "auto_unroll_max_step$512"]]]], "r": [[0.0192075], 0, 6.77924, 1637780788], "v": "v0.6"}
{"i": [["[\"depthwise_conv2d_layer\", 128, 336, 42, 42, 5, 5, 2, \"SAME\"]", "cuda -keys=cuda,gpu -max_num_threads=1024 -thread_warp_size=32", [-1, 16, 64, 49152, 2147483647, 1024, 8, 32], "", 0, []], [[], [["CHW", 3, "local"], ["SP", 3, 0, 128, [1, 8, 2, 2], 1], ["SP", 3, 5, 336, [2, 7, 1, 2], 1], ["SP", 3, 10, 21, [1, 1, 1, 3], 1], ["SP", 3, 15, 21, [1, 1, 1, 1], 1], ["SP", 3, 20, 5, [1, 1], 1], ["SP", 3, 23, 5, [1, 1], 1], ["RE", 3, [0, 5, 10, 15, 1, 6, 11, 16, 2, 7, 12, 17, 20, 23, 21, 24, 3, 8, 13, 18, 22, 25, 4, 9, 14, 19]], ["FSP", 4, 0, 1, 3], ["FSP", 4, 4, 2, 3], ["FSP", 4, 8, 3, 3], ["FSP", 4, 12, 4, 3], ["RE", 4, [0, 4, 8, 12, 1, 5, 9, 13, 2, 6, 10, 14, 3, 7, 11, 15]], ["CA", 3, 4, 11], ["CHR", 2, "shared", [3]], ["CA", 3, 4, 13], ["CHR", 1, "shared", [4]], ["CA", 2, 5, 13], ["CI", 1], ["FU", 6, [0, 1, 2, 3]], ["AN", 6, 0, 5], ["FU", 6, [1, 2, 3, 4]], ["AN", 6, 1, 4], ["FU", 6, [2, 3, 4, 5]], ["AN", 6, 2, 6], ["FU", 4, [0, 1, 2, 3]], ["SP", 4, 0, 10, [1], 1], ["AN", 4, 1, 2], ["FFSP", 4, 0, [4, 3, 2, 1], 1, 1], ["AN", 4, 1, 6], ["FU", 2, [0, 1, 2, 3]], ["SP", 2, 0, 72, [1], 1], ["AN", 2, 1, 2], ["FFSP", 2, 0, [4, 3, 2, 1], 1, 1], ["AN", 2, 1, 6], ["PR", 5, 0, "auto_unroll_max_step$0"]]]], "r": [[0.0518198], 0, 2.89486, 1637780790], "v": "v0.6"}
{"i": [["[\"depthwise_conv2d_layer\", 128, 336, 42, 42, 5, 5, 2, \"SAME\"]", "cuda -keys=cuda,gpu -max_num_threads=1024 -thread_warp_size=32", [-1, 16, 64, 49152, 2147483647, 1024, 8, 32], "", 0, []], [[], [["CHW", 3, "local"], ["SP", 3, 0, 128, [1, 2, 2, 2], 1], ["SP", 3, 5, 336, [1, 7, 1, 2], 1], ["SP", 3, 10, 21, [1, 1, 1, 1], 1], ["SP", 3, 15, 21, [1, 1, 3, 1], 1], ["SP", 3, 20, 5, [1, 1], 1], ["SP", 3, 23, 5, [5, 1], 1], ["RE", 3, [0, 5, 10, 15, 1, 6, 11, 16, 2, 7, 12, 17, 20, 23, 21, 24, 3, 8, 13, 18, 22, 25, 4, 9, 14, 19]], ["FSP", 4, 0, 1, 3], ["FSP", 4, 4, 2, 3], ["FSP", 4, 8, 3, 3], ["FSP", 4, 12, 4, 3], ["RE", 4, [0, 4, 8, 12, 1, 5, 9, 13, 2, 6, 10, 14, 3, 7, 11, 15]], ["CA", 3, 4, 11], ["CHR", 2, "shared", [3]], ["CA", 3, 4, 13], ["CHR", 1, "shared", [4]], ["CA", 2, 5, 13], ["CI", 1], ["FU", 6, [0, 1, 2, 3]], ["AN", 6, 0, 5], ["FU", 6, [1, 2, 3, 4]], ["AN", 6, 1, 4], ["FU", 6, [2, 3, 4, 5]], ["AN", 6, 2, 6], ["FU", 4, [0, 1, 2, 3]], ["SP", 4, 0, 2, [1], 1], ["AN", 4, 1, 2], ["FFSP", 4, 0, [4, 3, 2, 1], 1, 1], ["AN", 4, 1, 6], ["FU", 2, [0, 1, 2, 3]], ["SP", 2, 0, 8, [1], 1], ["AN", 2, 1, 2], ["FFSP", 2, 0, [4, 3, 2, 1], 1, 1], ["AN", 2, 1, 6], ["PR", 5, 0, "auto_unroll_max_step$1024"]]]], "r": [[0.00559495], 0, 6.50904, 1637780794], "v": "v0.6"}
{"i": [["[\"depthwise_conv2d_layer\", 128, 336, 42, 42, 5, 5, 2, \"SAME\"]", "cuda -keys=cuda,gpu -max_num_threads=1024 -thread_warp_size=32", [-1, 16, 64, 49152, 2147483647, 1024, 8, 32], "", 0, []], [[], [["CHW", 3, "local"], ["SP", 3, 0, 128, [1, 64, 2, 1], 1], ["SP", 3, 5, 336, [1, 1, 1, 1], 1], ["SP", 3, 10, 21, [1, 1, 1, 1], 1], ["SP", 3, 15, 21, [3, 1, 1, 1], 1], ["SP", 3, 20, 5, [5, 1], 1], ["SP", 3, 23, 5, [1, 5], 1], ["RE", 3, [0, 5, 10, 15, 1, 6, 11, 16, 2, 7, 12, 17, 20, 23, 21, 24, 3, 8, 13, 18, 22, 25, 4, 9, 14, 19]], ["FSP", 4, 0, 1, 3], ["FSP", 4, 4, 2, 3], ["FSP", 4, 8, 3, 3], ["FSP", 4, 12, 4, 3], ["RE", 4, [0, 4, 8, 12, 1, 5, 9, 13, 2, 6, 10, 14, 3, 7, 11, 15]], ["CA", 3, 4, 11], ["CHR", 2, "shared", [3]], ["CA", 3, 4, 13], ["CHR", 1, "shared", [4]], ["CA", 2, 5, 13], ["CI", 1], ["FU", 6, [0, 1, 2, 3]], ["AN", 6, 0, 5], ["FU", 6, [1, 2, 3, 4]], ["AN", 6, 1, 4], ["FU", 6, [2, 3, 4, 5]], ["AN", 6, 2, 6], ["FU", 4, [0, 1, 2, 3]], ["SP", 4, 0, 25, [1], 1], ["AN", 4, 1, 2], ["FFSP", 4, 0, [4, 3, 2, 1], 1, 1], ["AN", 4, 1, 6], ["FU", 2, [0, 1, 2, 3]], ["SP", 2, 0, 50, [25], 1], ["AN", 2, 1, 2], ["FFSP", 2, 0, [4, 3, 2, 1], 1, 1], ["AN", 2, 1, 6], ["PR", 5, 0, "auto_unroll_max_step$16"]]]], "r": [[0.0146005], 0, 2.801, 1637780796], "v": "v0.6"}
{"i": [["[\"depthwise_conv2d_layer\", 128, 336, 42, 42, 5, 5, 2, \"SAME\"]", "cuda -keys=cuda,gpu -max_num_threads=1024 -thread_warp_size=32", [-1, 16, 64, 49152, 2147483647, 1024, 8, 32], "", 0, []], [[], [["CHW", 3, "local"], ["SP", 3, 0, 128, [4, 2, 2, 1], 1], ["SP", 3, 5, 336, [2, 2, 1, 1], 1], ["SP", 3, 10, 21, [1, 3, 1, 1], 1], ["SP", 3, 15, 21, [1, 7, 1, 1], 1], ["SP", 3, 20, 5, [5, 1], 1], ["SP", 3, 23, 5, [1, 1], 1], ["RE", 3, [0, 5, 10, 15, 1, 6, 11, 16, 2, 7, 12, 17, 20, 23, 21, 24, 3, 8, 13, 18, 22, 25, 4, 9, 14, 19]], ["FSP", 4, 0, 1, 3], ["FSP", 4, 4, 2, 3], ["FSP", 4, 8, 3, 3], ["FSP", 4, 12, 4, 3], ["RE", 4, [0, 4, 8, 12, 1, 5, 9, 13, 2, 6, 10, 14, 3, 7, 11, 15]], ["CA", 3, 4, 11], ["CHR", 2, "shared", [3]], ["CA", 3, 4, 13], ["CHR", 1, "shared", [4]], ["CA", 2, 5, 13], ["CI", 1], ["FU", 6, [0, 1, 2, 3]], ["AN", 6, 0, 5], ["FU", 6, [1, 2, 3, 4]], ["AN", 6, 1, 4], ["FU", 6, [2, 3, 4, 5]], ["AN", 6, 2, 6], ["FU", 4, [0, 1, 2, 3]], ["SP", 4, 0, 25, [1], 1], ["AN", 4, 1, 2], ["FFSP", 4, 0, [4, 3, 2, 1], 1, 1], ["AN", 4, 1, 6], ["FU", 2, [0, 1, 2, 3]], ["SP", 2, 0, 50, [1], 1], ["AN", 2, 1, 2], ["FFSP", 2, 0, [4, 3, 2, 1], 1, 1], ["AN", 2, 1, 6], ["PR", 5, 0, "auto_unroll_max_step$1024"]]]], "r": [[0.0162261], 0, 10.1509, 1637780800], "v": "v0.6"}
{"i": [["[\"depthwise_conv2d_layer\", 128, 336, 42, 42, 5, 5, 2, \"SAME\"]", "cuda -keys=cuda,gpu -max_num_threads=1024 -thread_warp_size=32", [-1, 16, 64, 49152, 2147483647, 1024, 8, 32], "", 0, []], [[], [["CHW", 3, "local"], ["SP", 3, 0, 128, [1, 2, 2, 2], 1], ["SP", 3, 5, 336, [1, 7, 1, 2], 1], ["SP", 3, 10, 21, [1, 1, 1, 1], 1], ["SP", 3, 15, 21, [1, 3, 1, 1], 1], ["SP", 3, 20, 5, [1, 1], 1], ["SP", 3, 23, 5, [1, 1], 1], ["RE", 3, [0, 5, 10, 15, 1, 6, 11, 16, 2, 7, 12, 17, 20, 23, 21, 24, 3, 8, 13, 18, 22, 25, 4, 9, 14, 19]], ["FSP", 4, 0, 1, 3], ["FSP", 4, 4, 2, 3], ["FSP", 4, 8, 3, 3], ["FSP", 4, 12, 4, 3], ["RE", 4, [0, 4, 8, 12, 1, 5, 9, 13, 2, 6, 10, 14, 3, 7, 11, 15]], ["CA", 3, 4, 11], ["CHR", 2, "shared", [3]], ["CA", 3, 4, 13], ["CHR", 1, "shared", [4]], ["CA", 2, 5, 13], ["CI", 1], ["FU", 6, [0, 1, 2, 3]], ["AN", 6, 0, 5], ["FU", 6, [1, 2, 3, 4]], ["AN", 6, 1, 4], ["FU", 6, [2, 3, 4, 5]], ["AN", 6, 2, 6], ["FU", 4, [0, 1, 2, 3]], ["SP", 4, 0, 2, [1], 1], ["AN", 4, 1, 2], ["FFSP", 4, 0, [4, 3, 2, 1], 1, 1], ["AN", 4, 1, 6], ["FU", 2, [0, 1, 2, 3]], ["SP", 2, 0, 8, [1], 1], ["AN", 2, 1, 2], ["FFSP", 2, 0, [4, 3, 2, 1], 1, 1], ["AN", 2, 1, 6], ["PR", 5, 0, "auto_unroll_max_step$1024"]]]], "r": [[0.00658238], 0, 4.13591, 1637780803], "v": "v0.6"}
{"i": [["[\"depthwise_conv2d_layer\", 128, 336, 42, 42, 5, 5, 2, \"SAME\"]", "cuda -keys=cuda,gpu -max_num_threads=1024 -thread_warp_size=32", [-1, 16, 64, 49152, 2147483647, 1024, 8, 32], "", 0, []], [[], [["CHW", 3, "local"], ["SP", 3, 0, 128, [2, 2, 1, 4], 1], ["SP", 3, 5, 336, [2, 3, 1, 1], 1], ["SP", 3, 10, 21, [1, 1, 1, 1], 1], ["SP", 3, 15, 21, [1, 21, 1, 1], 1], ["SP", 3, 20, 5, [1, 1], 1], ["SP", 3, 23, 5, [5, 1], 1], ["RE", 3, [0, 5, 10, 15, 1, 6, 11, 16, 2, 7, 12, 17, 20, 23, 21, 24, 3, 8, 13, 18, 22, 25, 4, 9, 14, 19]], ["FSP", 4, 0, 1, 3], ["FSP", 4, 4, 2, 3], ["FSP", 4, 8, 3, 3], ["FSP", 4, 12, 4, 3], ["RE", 4, [0, 4, 8, 12, 1, 5, 9, 13, 2, 6, 10, 14, 3, 7, 11, 15]], ["CA", 3, 4, 11], ["CHR", 2, "shared", [3]], ["CA", 3, 4, 13], ["CHR", 1, "shared", [4]], ["CA", 2, 5, 13], ["CI", 1], ["FU", 6, [0, 1, 2, 3]], ["AN", 6, 0, 5], ["FU", 6, [1, 2, 3, 4]], ["AN", 6, 1, 4], ["FU", 6, [2, 3, 4, 5]], ["AN", 6, 2, 6], ["FU", 4, [0, 1, 2, 3]], ["SP", 4, 0, 1, [1], 1], ["AN", 4, 1, 2], ["FFSP", 4, 0, [4, 3, 2, 1], 1, 1], ["AN", 4, 1, 6], ["FU", 2, [0, 1, 2, 3]], ["SP", 2, 0, 4, [2], 1], ["AN", 2, 1, 2], ["FFSP", 2, 0, [4, 3, 2, 1], 1, 1], ["AN", 2, 1, 6], ["PR", 5, 0, "auto_unroll_max_step$16"]]]], "r": [[0.0022894], 0, 2.88671, 1637780805], "v": "v0.6"}
{"i": [["[\"depthwise_conv2d_layer\", 128, 336, 42, 42, 5, 5, 2, \"SAME\"]", "cuda -keys=cuda,gpu -max_num_threads=1024 -thread_warp_size=32", [-1, 16, 64, 49152, 2147483647, 1024, 8, 32], "", 0, []], [[], [["CHW", 3, "local"], ["SP", 3, 0, 128, [1, 1, 1, 2], 1], ["SP", 3, 5, 336, [2, 3, 1, 2], 1], ["SP", 3, 10, 21, [1, 21, 1, 1], 1], ["SP", 3, 15, 21, [1, 1, 1, 1], 1], ["SP", 3, 20, 5, [5, 1], 1], ["SP", 3, 23, 5, [1, 5], 1], ["RE", 3, [0, 5, 10, 15, 1, 6, 11, 16, 2, 7, 12, 17, 20, 23, 21, 24, 3, 8, 13, 18, 22, 25, 4, 9, 14, 19]], ["FSP", 4, 0, 1, 3], ["FSP", 4, 4, 2, 3], ["FSP", 4, 8, 3, 3], ["FSP", 4, 12, 4, 3], ["RE", 4, [0, 4, 8, 12, 1, 5, 9, 13, 2, 6, 10, 14, 3, 7, 11, 15]], ["CA", 3, 4, 11], ["CHR", 2, "shared", [3]], ["CA", 3, 4, 13], ["CHR", 1, "shared", [4]], ["CA", 2, 5, 13], ["CI", 1], ["FU", 6, [0, 1, 2, 3]], ["AN", 6, 0, 5], ["FU", 6, [1, 2, 3, 4]], ["AN", 6, 1, 4], ["FU", 6, [2, 3, 4, 5]], ["AN", 6, 2, 6], ["FU", 4, [0, 1, 2, 3]], ["SP", 4, 0, 25, [1], 1], ["AN", 4, 1, 2], ["FFSP", 4, 0, [4, 3, 2, 1], 1, 1], ["AN", 4, 1, 6], ["FU", 2, [0, 1, 2, 3]], ["SP", 2, 0, 50, [1], 1], ["AN", 2, 1, 2], ["FFSP", 2, 0, [4, 3, 2, 1], 1, 1], ["AN", 2, 1, 6], ["PR", 5, 0, "auto_unroll_max_step$512"]]]], "r": [[0.00460977], 0, 3.05595, 1637780807], "v": "v0.6"}
{"i": [["[\"depthwise_conv2d_layer\", 128, 336, 42, 42, 5, 5, 2, \"SAME\"]", "cuda -keys=cuda,gpu -max_num_threads=1024 -thread_warp_size=32", [-1, 16, 64, 49152, 2147483647, 1024, 8, 32], "", 0, []], [[], [["CHW", 3, "local"], ["SP", 3, 0, 128, [1, 2, 2, 2], 1], ["SP", 3, 5, 336, [1, 7, 1, 2], 1], ["SP", 3, 10, 21, [1, 1, 1, 1], 1], ["SP", 3, 15, 21, [1, 1, 1, 1], 1], ["SP", 3, 20, 5, [1, 1], 1], ["SP", 3, 23, 5, [1, 1], 1], ["RE", 3, [0, 5, 10, 15, 1, 6, 11, 16, 2, 7, 12, 17, 20, 23, 21, 24, 3, 8, 13, 18, 22, 25, 4, 9, 14, 19]], ["FSP", 4, 0, 1, 3], ["FSP", 4, 4, 2, 3], ["FSP", 4, 8, 3, 3], ["FSP", 4, 12, 4, 3], ["RE", 4, [0, 4, 8, 12, 1, 5, 9, 13, 2, 6, 10, 14, 3, 7, 11, 15]], ["CA", 3, 4, 11], ["CHR", 2, "shared", [3]], ["CA", 3, 4, 13], ["CHR", 1, "shared", [4]], ["CA", 2, 5, 13], ["CI", 1], ["FU", 6, [0, 1, 2, 3]], ["AN", 6, 0, 5], ["FU", 6, [1, 2, 3, 4]], ["AN", 6, 1, 4], ["FU", 6, [2, 3, 4, 5]], ["AN", 6, 2, 6], ["FU", 4, [0, 1, 2, 3]], ["SP", 4, 0, 2, [1], 1], ["AN", 4, 1, 2], ["FFSP", 4, 0, [4, 3, 2, 1], 1, 1], ["AN", 4, 1, 6], ["FU", 2, [0, 1, 2, 3]], ["SP", 2, 0, 8, [1], 1], ["AN", 2, 1, 2], ["FFSP", 2, 0, [4, 3, 2, 1], 1, 1], ["AN", 2, 1, 6], ["PR", 5, 0, "auto_unroll_max_step$1024"]]]], "r": [[0.00528071], 0, 2.98973, 1637780809], "v": "v0.6"}
{"i": [["[\"depthwise_conv2d_layer\", 128, 336, 42, 42, 5, 5, 2, \"SAME\"]", "cuda -keys=cuda,gpu -max_num_threads=1024 -thread_warp_size=32", [-1, 16, 64, 49152, 2147483647, 1024, 8, 32], "", 0, []], [[], [["CHW", 3, "local"], ["SP", 3, 0, 128, [2, 32, 2, 1], 1], ["SP", 3, 5, 336, [2, 2, 1, 1], 1], ["SP", 3, 10, 21, [1, 1, 1, 1], 1], ["SP", 3, 15, 21, [1, 1, 1, 1], 1], ["SP", 3, 20, 5, [1, 1], 1], ["SP", 3, 23, 5, [1, 1], 1], ["RE", 3, [0, 5, 10, 15, 1, 6, 11, 16, 2, 7, 12, 17, 20, 23, 21, 24, 3, 8, 13, 18, 22, 25, 4, 9, 14, 19]], ["FSP", 4, 0, 1, 3], ["FSP", 4, 4, 2, 3], ["FSP", 4, 8, 3, 3], ["FSP", 4, 12, 4, 3], ["RE", 4, [0, 4, 8, 12, 1, 5, 9, 13, 2, 6, 10, 14, 3, 7, 11, 15]], ["CA", 3, 4, 11], ["CHR", 2, "shared", [3]], ["CA", 3, 4, 13], ["CHR", 1, "shared", [4]], ["CA", 2, 5, 13], ["CI", 1], ["FU", 6, [0, 1, 2, 3]], ["AN", 6, 0, 5], ["FU", 6, [1, 2, 3, 4]], ["AN", 6, 1, 4], ["FU", 6, [2, 3, 4, 5]], ["AN", 6, 2, 6], ["FU", 4, [0, 1, 2, 3]], ["SP", 4, 0, 5, [1], 1], ["AN", 4, 1, 2], ["FFSP", 4, 0, [4, 3, 2, 1], 1, 1], ["AN", 4, 1, 6], ["FU", 2, [0, 1, 2, 3]], ["SP", 2, 0, 10, [1], 1], ["AN", 2, 1, 2], ["FFSP", 2, 0, [4, 3, 2, 1], 1, 1], ["AN", 2, 1, 6], ["PR", 5, 0, "auto_unroll_max_step$512"]]]], "r": [[0.0365847], 0, 3.36305, 1637780812], "v": "v0.6"}
{"i": [["[\"depthwise_conv2d_layer\", 128, 336, 42, 42, 5, 5, 2, \"SAME\"]", "cuda -keys=cuda,gpu -max_num_threads=1024 -thread_warp_size=32", [-1, 16, 64, 49152, 2147483647, 1024, 8, 32], "", 0, []], [[], [["CHW", 3, "local"], ["SP", 3, 0, 128, [1, 1, 1, 2], 1], ["SP", 3, 5, 336, [6, 1, 1, 2], 1], ["SP", 3, 10, 21, [1, 21, 1, 1], 1], ["SP", 3, 15, 21, [1, 1, 1, 1], 1], ["SP", 3, 20, 5, [5, 1], 1], ["SP", 3, 23, 5, [1, 5], 1], ["RE", 3, [0, 5, 10, 15, 1, 6, 11, 16, 2, 7, 12, 17, 20, 23, 21, 24, 3, 8, 13, 18, 22, 25, 4, 9, 14, 19]], ["FSP", 4, 0, 1, 3], ["FSP", 4, 4, 2, 3], ["FSP", 4, 8, 3, 3], ["FSP", 4, 12, 4, 3], ["RE", 4, [0, 4, 8, 12, 1, 5, 9, 13, 2, 6, 10, 14, 3, 7, 11, 15]], ["CA", 3, 4, 11], ["CHR", 2, "shared", [3]], ["CA", 3, 4, 13], ["CHR", 1, "shared", [4]], ["CA", 2, 5, 13], ["CI", 1], ["FU", 6, [0, 1, 2, 3]], ["AN", 6, 0, 5], ["FU", 6, [1, 2, 3, 4]], ["AN", 6, 1, 4], ["FU", 6, [2, 3, 4, 5]], ["AN", 6, 2, 6], ["FU", 4, [0, 1, 2, 3]], ["SP", 4, 0, 25, [1], 1], ["AN", 4, 1, 2], ["FFSP", 4, 0, [4, 3, 2, 1], 1, 1], ["AN", 4, 1, 6], ["FU", 2, [0, 1, 2, 3]], ["SP", 2, 0, 50, [5], 1], ["AN", 2, 1, 2], ["FFSP", 2, 0, [4, 3, 2, 1], 1, 1], ["AN", 2, 1, 6], ["PR", 5, 0, "auto_unroll_max_step$512"]]]], "r": [[0.0022591], 0, 3.77231, 1637780814], "v": "v0.6"}
{"i": [["[\"depthwise_conv2d_layer\", 128, 336, 42, 42, 5, 5, 2, \"SAME\"]", "cuda -keys=cuda,gpu -max_num_threads=1024 -thread_warp_size=32", [-1, 16, 64, 49152, 2147483647, 1024, 8, 32], "", 0, []], [[], [["CHW", 3, "local"], ["SP", 3, 0, 128, [1, 8, 2, 1], 1], ["SP", 3, 5, 336, [1, 28, 1, 2], 1], ["SP", 3, 10, 21, [3, 1, 1, 1], 1], ["SP", 3, 15, 21, [1, 1, 1, 1], 1], ["SP", 3, 20, 5, [1, 1], 1], ["SP", 3, 23, 5, [1, 1], 1], ["RE", 3, [0, 5, 10, 15, 1, 6, 11, 16, 2, 7, 12, 17, 20, 23, 21, 24, 3, 8, 13, 18, 22, 25, 4, 9, 14, 19]], ["FSP", 4, 0, 1, 3], ["FSP", 4, 4, 2, 3], ["FSP", 4, 8, 3, 3], ["FSP", 4, 12, 4, 3], ["RE", 4, [0, 4, 8, 12, 1, 5, 9, 13, 2, 6, 10, 14, 3, 7, 11, 15]], ["CA", 3, 4, 11], ["CHR", 2, "shared", [3]], ["CA", 3, 4, 13], ["CHR", 1, "shared", [4]], ["CA", 2, 5, 13], ["CI", 1], ["FU", 6, [0, 1, 2, 3]], ["AN", 6, 0, 5], ["FU", 6, [1, 2, 3, 4]], ["AN", 6, 1, 4], ["FU", 6, [2, 3, 4, 5]], ["AN", 6, 2, 6], ["FU", 4, [0, 1, 2, 3]], ["SP", 4, 0, 2, [2], 1], ["AN", 4, 1, 2], ["FFSP", 4, 0, [4, 3, 2, 1], 1, 1], ["AN", 4, 1, 6], ["FU", 2, [0, 1, 2, 3]], ["SP", 2, 0, 4, [2], 1], ["AN", 2, 1, 2], ["FFSP", 2, 0, [4, 3, 2, 1], 1, 1], ["AN", 2, 1, 6], ["PR", 5, 0, "auto_unroll_max_step$512"]]]], "r": [[0.0209409], 0, 3.45873, 1637780816], "v": "v0.6"}
{"i": [["[\"depthwise_conv2d_layer\", 128, 336, 42, 42, 5, 5, 2, \"SAME\"]", "cuda -keys=cuda,gpu -max_num_threads=1024 -thread_warp_size=32", [-1, 16, 64, 49152, 2147483647, 1024, 8, 32], "", 0, []], [[], [["CHW", 3, "local"], ["SP", 3, 0, 128, [1, 2, 4, 2], 1], ["SP", 3, 5, 336, [1, 4, 1, 3], 1], ["SP", 3, 10, 21, [1, 3, 1, 1], 1], ["SP", 3, 15, 21, [1, 3, 1, 1], 1], ["SP", 3, 20, 5, [1, 5], 1], ["SP", 3, 23, 5, [1, 1], 1], ["RE", 3, [0, 5, 10, 15, 1, 6, 11, 16, 2, 7, 12, 17, 20, 23, 21, 24, 3, 8, 13, 18, 22, 25, 4, 9, 14, 19]], ["FSP", 4, 0, 1, 3], ["FSP", 4, 4, 2, 3], ["FSP", 4, 8, 3, 3], ["FSP", 4, 12, 4, 3], ["RE", 4, [0, 4, 8, 12, 1, 5, 9, 13, 2, 6, 10, 14, 3, 7, 11, 15]], ["CA", 3, 4, 11], ["CHR", 2, "shared", [3]], ["CA", 3, 4, 13], ["CHR", 1, "shared", [4]], ["CA", 2, 5, 13], ["CI", 1], ["FU", 6, [0, 1, 2, 3]], ["AN", 6, 0, 5], ["FU", 6, [1, 2, 3, 4]], ["AN", 6, 1, 4], ["FU", 6, [2, 3, 4, 5]], ["AN", 6, 2, 6], ["FU", 4, [0, 1, 2, 3]], ["SP", 4, 0, 15, [1], 1], ["AN", 4, 1, 2], ["FFSP", 4, 0, [4, 3, 2, 1], 1, 1], ["AN", 4, 1, 6], ["FU", 2, [0, 1, 2, 3]], ["SP", 2, 0, 120, [1], 1], ["AN", 2, 1, 2], ["FFSP", 2, 0, [4, 3, 2, 1], 1, 1], ["AN", 2, 1, 6], ["PR", 5, 0, "auto_unroll_max_step$0"]]]], "r": [[0.0162292], 0, 2.56075, 1637780818], "v": "v0.6"}
{"i": [["[\"depthwise_conv2d_layer\", 128, 336, 42, 42, 5, 5, 2, \"SAME\"]", "cuda -keys=cuda,gpu -max_num_threads=1024 -thread_warp_size=32", [-1, 16, 64, 49152, 2147483647, 1024, 8, 32], "", 0, []], [[], [["CHW", 3, "local"], ["SP", 3, 0, 128, [1, 2, 2, 2], 1], ["SP", 3, 5, 336, [1, 7, 1, 2], 1], ["SP", 3, 10, 21, [1, 1, 1, 1], 1], ["SP", 3, 15, 21, [1, 3, 1, 1], 1], ["SP", 3, 20, 5, [5, 1], 1], ["SP", 3, 23, 5, [1, 1], 1], ["RE", 3, [0, 5, 10, 15, 1, 6, 11, 16, 2, 7, 12, 17, 20, 23, 21, 24, 3, 8, 13, 18, 22, 25, 4, 9, 14, 19]], ["FSP", 4, 0, 1, 3], ["FSP", 4, 4, 2, 3], ["FSP", 4, 8, 3, 3], ["FSP", 4, 12, 4, 3], ["RE", 4, [0, 4, 8, 12, 1, 5, 9, 13, 2, 6, 10, 14, 3, 7, 11, 15]], ["CA", 3, 4, 11], ["CHR", 2, "shared", [3]], ["CA", 3, 4, 13], ["CHR", 1, "shared", [4]], ["CA", 2, 5, 13], ["CI", 1], ["FU", 6, [0, 1, 2, 3]], ["AN", 6, 0, 5], ["FU", 6, [1, 2, 3, 4]], ["AN", 6, 1, 4], ["FU", 6, [2, 3, 4, 5]], ["AN", 6, 2, 6], ["FU", 4, [0, 1, 2, 3]], ["SP", 4, 0, 2, [1], 1], ["AN", 4, 1, 2], ["FFSP", 4, 0, [4, 3, 2, 1], 1, 1], ["AN", 4, 1, 6], ["FU", 2, [0, 1, 2, 3]], ["SP", 2, 0, 8, [1], 1], ["AN", 2, 1, 2], ["FFSP", 2, 0, [4, 3, 2, 1], 1, 1], ["AN", 2, 1, 6], ["PR", 5, 0, "auto_unroll_max_step$1024"]]]], "r": [[0.014186], 0, 6.25242, 1637780821], "v": "v0.6"}
{"i": [["[\"depthwise_conv2d_layer\", 128, 336, 42, 42, 5, 5, 2, \"SAME\"]", "cuda -keys=cuda,gpu -max_num_threads=1024 -thread_warp_size=32", [-1, 16, 64, 49152, 2147483647, 1024, 8, 32], "", 0, []], [[], [["CHW", 3, "local"], ["SP", 3, 0, 128, [1, 2, 2, 1], 1], ["SP", 3, 5, 336, [1, 14, 3, 1], 1], ["SP", 3, 10, 21, [1, 1, 1, 1], 1], ["SP", 3, 15, 21, [3, 7, 1, 1], 1], ["SP", 3, 20, 5, [1, 1], 1], ["SP", 3, 23, 5, [1, 1], 1], ["RE", 3, [0, 5, 10, 15, 1, 6, 11, 16, 2, 7, 12, 17, 20, 23, 21, 24, 3, 8, 13, 18, 22, 25, 4, 9, 14, 19]], ["FSP", 4, 0, 1, 3], ["FSP", 4, 4, 2, 3], ["FSP", 4, 8, 3, 3], ["FSP", 4, 12, 4, 3], ["RE", 4, [0, 4, 8, 12, 1, 5, 9, 13, 2, 6, 10, 14, 3, 7, 11, 15]], ["CA", 3, 4, 11], ["CHR", 2, "shared", [3]], ["CA", 3, 4, 13], ["CHR", 1, "shared", [4]], ["CA", 2, 5, 13], ["CI", 1], ["FU", 6, [0, 1, 2, 3]], ["AN", 6, 0, 5], ["FU", 6, [1, 2, 3, 4]], ["AN", 6, 1, 4], ["FU", 6, [2, 3, 4, 5]], ["AN", 6, 2, 6], ["FU", 4, [0, 1, 2, 3]], ["SP", 4, 0, 3, [1], 1], ["AN", 4, 1, 2], ["FFSP", 4, 0, [4, 3, 2, 1], 1, 1], ["AN", 4, 1, 6], ["FU", 2, [0, 1, 2, 3]], ["SP", 2, 0, 6, [1], 1], ["AN", 2, 1, 2], ["FFSP", 2, 0, [4, 3, 2, 1], 1, 1], ["AN", 2, 1, 6], ["PR", 5, 0, "auto_unroll_max_step$512"]]]], "r": [[0.00222579], 0, 3.70787, 1637780823], "v": "v0.6"}
{"i": [["[\"depthwise_conv2d_layer\", 128, 336, 42, 42, 5, 5, 2, \"SAME\"]", "cuda -keys=cuda,gpu -max_num_threads=1024 -thread_warp_size=32", [-1, 16, 64, 49152, 2147483647, 1024, 8, 32], "", 0, []], [[], [["CHW", 3, "local"], ["SP", 3, 0, 128, [1, 2, 1, 1], 1], ["SP", 3, 5, 336, [1, 6, 1, 2], 1], ["SP", 3, 10, 21, [7, 3, 1, 1], 1], ["SP", 3, 15, 21, [1, 1, 1, 3], 1], ["SP", 3, 20, 5, [1, 5], 1], ["SP", 3, 23, 5, [5, 1], 1], ["RE", 3, [0, 5, 10, 15, 1, 6, 11, 16, 2, 7, 12, 17, 20, 23, 21, 24, 3, 8, 13, 18, 22, 25, 4, 9, 14, 19]], ["FSP", 4, 0, 1, 3], ["FSP", 4, 4, 2, 3], ["FSP", 4, 8, 3, 3], ["FSP", 4, 12, 4, 3], ["RE", 4, [0, 4, 8, 12, 1, 5, 9, 13, 2, 6, 10, 14, 3, 7, 11, 15]], ["CA", 3, 4, 11], ["CHR", 2, "shared", [3]], ["CA", 3, 4, 13], ["CHR", 1, "shared", [4]], ["CA", 2, 5, 13], ["CI", 1], ["FU", 6, [0, 1, 2, 3]], ["AN", 6, 0, 5], ["FU", 6, [1, 2, 3, 4]], ["AN", 6, 1, 4], ["FU", 6, [2, 3, 4, 5]], ["AN", 6, 2, 6], ["FU", 4, [0, 1, 2, 3]], ["SP", 4, 0, 10, [1], 1], ["AN", 4, 1, 2], ["FFSP", 4, 0, [4, 3, 2, 1], 1, 1], ["AN", 4, 1, 6], ["FU", 2, [0, 1, 2, 3]], ["SP", 2, 0, 18, [1], 1], ["AN", 2, 1, 2], ["FFSP", 2, 0, [4, 3, 2, 1], 1, 1], ["AN", 2, 1, 6], ["PR", 5, 0, "auto_unroll_max_step$512"]]]], "r": [[0.00369989], 0, 5.29182, 1637780827], "v": "v0.6"}
{"i": [["[\"depthwise_conv2d_layer\", 128, 336, 42, 42, 5, 5, 2, \"SAME\"]", "cuda -keys=cuda,gpu -max_num_threads=1024 -thread_warp_size=32", [-1, 16, 64, 49152, 2147483647, 1024, 8, 32], "", 0, []], [[], [["CHW", 3, "local"], ["SP", 3, 0, 128, [2, 2, 2, 1], 1], ["SP", 3, 5, 336, [2, 2, 1, 1], 1], ["SP", 3, 10, 21, [1, 3, 1, 1], 1], ["SP", 3, 15, 21, [1, 7, 1, 1], 1], ["SP", 3, 20, 5, [5, 1], 1], ["SP", 3, 23, 5, [1, 5], 1], ["RE", 3, [0, 5, 10, 15, 1, 6, 11, 16, 2, 7, 12, 17, 20, 23, 21, 24, 3, 8, 13, 18, 22, 25, 4, 9, 14, 19]], ["FSP", 4, 0, 1, 3], ["FSP", 4, 4, 2, 3], ["FSP", 4, 8, 3, 3], ["FSP", 4, 12, 4, 3], ["RE", 4, [0, 4, 8, 12, 1, 5, 9, 13, 2, 6, 10, 14, 3, 7, 11, 15]], ["CA", 3, 4, 11], ["CHR", 2, "shared", [3]], ["CA", 3, 4, 13], ["CHR", 1, "shared", [4]], ["CA", 2, 5, 13], ["CI", 1], ["FU", 6, [0, 1, 2, 3]], ["AN", 6, 0, 5], ["FU", 6, [1, 2, 3, 4]], ["AN", 6, 1, 4], ["FU", 6, [2, 3, 4, 5]], ["AN", 6, 2, 6], ["FU", 4, [0, 1, 2, 3]], ["SP", 4, 0, 25, [1], 1], ["AN", 4, 1, 2], ["FFSP", 4, 0, [4, 3, 2, 1], 1, 1], ["AN", 4, 1, 6], ["FU", 2, [0, 1, 2, 3]], ["SP", 2, 0, 50, [1], 1], ["AN", 2, 1, 2], ["FFSP", 2, 0, [4, 3, 2, 1], 1, 1], ["AN", 2, 1, 6], ["PR", 5, 0, "auto_unroll_max_step$1024"]]]], "r": [[0.00286095], 0, 3.67491, 1637780830], "v": "v0.6"}
{"i": [["[\"depthwise_conv2d_layer\", 128, 336, 42, 42, 5, 5, 2, \"SAME\"]", "cuda -keys=cuda,gpu -max_num_threads=1024 -thread_warp_size=32", [-1, 16, 64, 49152, 2147483647, 1024, 8, 32], "", 0, []], [[], [["CHW", 3, "local"], ["SP", 3, 0, 128, [1, 2, 2, 2], 1], ["SP", 3, 5, 336, [1, 7, 1, 2], 1], ["SP", 3, 10, 21, [1, 1, 1, 1], 1], ["SP", 3, 15, 21, [1, 21, 1, 1], 1], ["SP", 3, 20, 5, [1, 1], 1], ["SP", 3, 23, 5, [1, 1], 1], ["RE", 3, [0, 5, 10, 15, 1, 6, 11, 16, 2, 7, 12, 17, 20, 23, 21, 24, 3, 8, 13, 18, 22, 25, 4, 9, 14, 19]], ["FSP", 4, 0, 1, 3], ["FSP", 4, 4, 2, 3], ["FSP", 4, 8, 3, 3], ["FSP", 4, 12, 4, 3], ["RE", 4, [0, 4, 8, 12, 1, 5, 9, 13, 2, 6, 10, 14, 3, 7, 11, 15]], ["CA", 3, 4, 11], ["CHR", 2, "shared", [3]], ["CA", 3, 4, 13], ["CHR", 1, "shared", [4]], ["CA", 2, 5, 13], ["CI", 1], ["FU", 6, [0, 1, 2, 3]], ["AN", 6, 0, 5], ["FU", 6, [1, 2, 3, 4]], ["AN", 6, 1, 4], ["FU", 6, [2, 3, 4, 5]], ["AN", 6, 2, 6], ["FU", 4, [0, 1, 2, 3]], ["SP", 4, 0, 2, [2], 1], ["AN", 4, 1, 2], ["FFSP", 4, 0, [4, 3, 2, 1], 1, 1], ["AN", 4, 1, 6], ["FU", 2, [0, 1, 2, 3]], ["SP", 2, 0, 8, [1], 1], ["AN", 2, 1, 2], ["FFSP", 2, 0, [4, 3, 2, 1], 1, 1], ["AN", 2, 1, 6], ["PR", 5, 0, "auto_unroll_max_step$512"]]]], "r": [[0.00264175], 0, 2.82008, 1637780832], "v": "v0.6"}
{"i": [["[\"depthwise_conv2d_layer\", 128, 336, 42, 42, 5, 5, 2, \"SAME\"]", "cuda -keys=cuda,gpu -max_num_threads=1024 -thread_warp_size=32", [-1, 16, 64, 49152, 2147483647, 1024, 8, 32], "", 0, []], [[], [["CHW", 3, "local"], ["SP", 3, 0, 128, [1, 1, 1, 2], 1], ["SP", 3, 5, 336, [1, 2, 1, 1], 1], ["SP", 3, 10, 21, [3, 7, 1, 1], 1], ["SP", 3, 15, 21, [1, 7, 1, 3], 1], ["SP", 3, 20, 5, [1, 1], 1], ["SP", 3, 23, 5, [1, 5], 1], ["RE", 3, [0, 5, 10, 15, 1, 6, 11, 16, 2, 7, 12, 17, 20, 23, 21, 24, 3, 8, 13, 18, 22, 25, 4, 9, 14, 19]], ["FSP", 4, 0, 1, 3], ["FSP", 4, 4, 2, 3], ["FSP", 4, 8, 3, 3], ["FSP", 4, 12, 4, 3], ["RE", 4, [0, 4, 8, 12, 1, 5, 9, 13, 2, 6, 10, 14, 3, 7, 11, 15]], ["CA", 3, 4, 11], ["CHR", 2, "shared", [3]], ["CA", 3, 4, 13], ["CHR", 1, "shared", [4]], ["CA", 2, 5, 13], ["CI", 1], ["FU", 6, [0, 1, 2, 3]], ["AN", 6, 0, 5], ["FU", 6, [1, 2, 3, 4]], ["AN", 6, 1, 4], ["FU", 6, [2, 3, 4, 5]], ["AN", 6, 2, 6], ["FU", 4, [0, 1, 2, 3]], ["SP", 4, 0, 5, [1], 1], ["AN", 4, 1, 2], ["FFSP", 4, 0, [4, 3, 2, 1], 1, 1], ["AN", 4, 1, 6], ["FU", 2, [0, 1, 2, 3]], ["SP", 2, 0, 18, [6], 1], ["AN", 2, 1, 2], ["FFSP", 2, 0, [4, 3, 2, 1], 1, 1], ["AN", 2, 1, 6], ["PR", 5, 0, "auto_unroll_max_step$1024"]]]], "r": [[0.00805447], 0, 6.4364, 1637780835], "v": "v0.6"}
{"i": [["[\"depthwise_conv2d_layer\", 128, 336, 42, 42, 5, 5, 2, \"SAME\"]", "cuda -keys=cuda,gpu -max_num_threads=1024 -thread_warp_size=32", [-1, 16, 64, 49152, 2147483647, 1024, 8, 32], "", 0, []], [[], [["CHW", 3, "local"], ["SP", 3, 0, 128, [1, 2, 1, 2], 1], ["SP", 3, 5, 336, [2, 6, 1, 1], 1], ["SP", 3, 10, 21, [1, 21, 1, 1], 1], ["SP", 3, 15, 21, [1, 1, 1, 1], 1], ["SP", 3, 20, 5, [5, 1], 1], ["SP", 3, 23, 5, [1, 5], 1], ["RE", 3, [0, 5, 10, 15, 1, 6, 11, 16, 2, 7, 12, 17, 20, 23, 21, 24, 3, 8, 13, 18, 22, 25, 4, 9, 14, 19]], ["FSP", 4, 0, 1, 3], ["FSP", 4, 4, 2, 3], ["FSP", 4, 8, 3, 3], ["FSP", 4, 12, 4, 3], ["RE", 4, [0, 4, 8, 12, 1, 5, 9, 13, 2, 6, 10, 14, 3, 7, 11, 15]], ["CA", 3, 4, 11], ["CHR", 2, "shared", [3]], ["CA", 3, 4, 13], ["CHR", 1, "shared", [4]], ["CA", 2, 5, 13], ["CI", 1], ["FU", 6, [0, 1, 2, 3]], ["AN", 6, 0, 5], ["FU", 6, [1, 2, 3, 4]], ["AN", 6, 1, 4], ["FU", 6, [2, 3, 4, 5]], ["AN", 6, 2, 6], ["FU", 4, [0, 1, 2, 3]], ["SP", 4, 0, 25, [1], 1], ["AN", 4, 1, 2], ["FFSP", 4, 0, [4, 3, 2, 1], 1, 1], ["AN", 4, 1, 6], ["FU", 2, [0, 1, 2, 3]], ["SP", 2, 0, 50, [1], 1], ["AN", 2, 1, 2], ["FFSP", 2, 0, [4, 3, 2, 1], 1, 1], ["AN", 2, 1, 6], ["PR", 5, 0, "auto_unroll_max_step$512"]]]], "r": [[0.00324166], 0, 2.71852, 1637780837], "v": "v0.6"}
{"i": [["[\"depthwise_conv2d_layer\", 128, 336, 42, 42, 5, 5, 2, \"SAME\"]", "cuda -keys=cuda,gpu -max_num_threads=1024 -thread_warp_size=32", [-1, 16, 64, 49152, 2147483647, 1024, 8, 32], "", 0, []], [[], [["CHW", 3, "local"], ["SP", 3, 0, 128, [2, 1, 1, 1], 1], ["SP", 3, 5, 336, [1, 2, 1, 8], 1], ["SP", 3, 10, 21, [1, 7, 1, 1], 1], ["SP", 3, 15, 21, [1, 3, 1, 1], 1], ["SP", 3, 20, 5, [1, 1], 1], ["SP", 3, 23, 5, [5, 1], 1], ["RE", 3, [0, 5, 10, 15, 1, 6, 11, 16, 2, 7, 12, 17, 20, 23, 21, 24, 3, 8, 13, 18, 22, 25, 4, 9, 14, 19]], ["FSP", 4, 0, 1, 3], ["FSP", 4, 4, 2, 3], ["FSP", 4, 8, 3, 3], ["FSP", 4, 12, 4, 3], ["RE", 4, [0, 4, 8, 12, 1, 5, 9, 13, 2, 6, 10, 14, 3, 7, 11, 15]], ["CA", 3, 4, 11], ["CHR", 2, "shared", [3]], ["CA", 3, 4, 13], ["CHR", 1, "shared", [4]], ["CA", 2, 5, 13], ["CI", 1], ["FU", 6, [0, 1, 2, 3]], ["AN", 6, 0, 5], ["FU", 6, [1, 2, 3, 4]], ["AN", 6, 1, 4], ["FU", 6, [2, 3, 4, 5]], ["AN", 6, 2, 6], ["FU", 4, [0, 1, 2, 3]], ["SP", 4, 0, 40, [1], 1], ["AN", 4, 1, 2], ["FFSP", 4, 0, [4, 3, 2, 1], 1, 1], ["AN", 4, 1, 6], ["FU", 2, [0, 1, 2, 3]], ["SP", 2, 0, 40, [1], 1], ["AN", 2, 1, 2], ["FFSP", 2, 0, [4, 3, 2, 1], 1, 1], ["AN", 2, 1, 6], ["PR", 5, 0, "auto_unroll_max_step$0"]]]], "r": [[0.0112957], 0, 2.52791, 1637780839], "v": "v0.6"}
{"i": [["[\"depthwise_conv2d_layer\", 128, 336, 42, 42, 5, 5, 2, \"SAME\"]", "cuda -keys=cuda,gpu -max_num_threads=1024 -thread_warp_size=32", [-1, 16, 64, 49152, 2147483647, 1024, 8, 32], "", 0, []], [[], [["CHW", 3, "local"], ["SP", 3, 0, 128, [1, 8, 2, 2], 1], ["SP", 3, 5, 336, [2, 7, 1, 2], 1], ["SP", 3, 10, 21, [1, 1, 1, 3], 1], ["SP", 3, 15, 21, [1, 1, 1, 1], 1], ["SP", 3, 20, 5, [5, 1], 1], ["SP", 3, 23, 5, [1, 1], 1], ["RE", 3, [0, 5, 10, 15, 1, 6, 11, 16, 2, 7, 12, 17, 20, 23, 21, 24, 3, 8, 13, 18, 22, 25, 4, 9, 14, 19]], ["FSP", 4, 0, 1, 3], ["FSP", 4, 4, 2, 3], ["FSP", 4, 8, 3, 3], ["FSP", 4, 12, 4, 3], ["RE", 4, [0, 4, 8, 12, 1, 5, 9, 13, 2, 6, 10, 14, 3, 7, 11, 15]], ["CA", 3, 4, 11], ["CHR", 2, "shared", [3]], ["CA", 3, 4, 13], ["CHR", 1, "shared", [4]], ["CA", 2, 5, 13], ["CI", 1], ["FU", 6, [0, 1, 2, 3]], ["AN", 6, 0, 5], ["FU", 6, [1, 2, 3, 4]], ["AN", 6, 1, 4], ["FU", 6, [2, 3, 4, 5]], ["AN", 6, 2, 6], ["FU", 4, [0, 1, 2, 3]], ["SP", 4, 0, 10, [1], 1], ["AN", 4, 1, 2], ["FFSP", 4, 0, [4, 3, 2, 1], 1, 1], ["AN", 4, 1, 6], ["FU", 2, [0, 1, 2, 3]], ["SP", 2, 0, 72, [1], 1], ["AN", 2, 1, 2], ["FFSP", 2, 0, [4, 3, 2, 1], 1, 1], ["AN", 2, 1, 6], ["PR", 5, 0, "auto_unroll_max_step$16"]]]], "r": [[0.0080566], 0, 3.14668, 1637780842], "v": "v0.6"}
{"i": [["[\"depthwise_conv2d_layer\", 128, 336, 42, 42, 5, 5, 2, \"SAME\"]", "cuda -keys=cuda,gpu -max_num_threads=1024 -thread_warp_size=32", [-1, 16, 64, 49152, 2147483647, 1024, 8, 32], "", 0, []], [[], [["CHW", 3, "local"], ["SP", 3, 0, 128, [1, 4, 1, 8], 1], ["SP", 3, 5, 336, [1, 3, 2, 1], 1], ["SP", 3, 10, 21, [1, 3, 1, 1], 1], ["SP", 3, 15, 21, [1, 1, 1, 3], 1], ["SP", 3, 20, 5, [1, 1], 1], ["SP", 3, 23, 5, [1, 1], 1], ["RE", 3, [0, 5, 10, 15, 1, 6, 11, 16, 2, 7, 12, 17, 20, 23, 21, 24, 3, 8, 13, 18, 22, 25, 4, 9, 14, 19]], ["FSP", 4, 0, 1, 3], ["FSP", 4, 4, 2, 3], ["FSP", 4, 8, 3, 3], ["FSP", 4, 12, 4, 3], ["RE", 4, [0, 4, 8, 12, 1, 5, 9, 13, 2, 6, 10, 14, 3, 7, 11, 15]], ["CA", 3, 4, 11], ["CHR", 2, "shared", [3]], ["CA", 3, 4, 13], ["CHR", 1, "shared", [4]], ["CA", 2, 5, 13], ["CI", 1], ["FU", 6, [0, 1, 2, 3]], ["AN", 6, 0, 5], ["FU", 6, [1, 2, 3, 4]], ["AN", 6, 1, 4], ["FU", 6, [2, 3, 4, 5]], ["AN", 6, 2, 6], ["FU", 4, [0, 1, 2, 3]], ["SP", 4, 0, 2, [1], 1], ["AN", 4, 1, 2], ["FFSP", 4, 0, [4, 3, 2, 1], 1, 1], ["AN", 4, 1, 6], ["FU", 2, [0, 1, 2, 3]], ["SP", 2, 0, 80, [5], 1], ["AN", 2, 1, 2], ["FFSP", 2, 0, [4, 3, 2, 1], 1, 1], ["AN", 2, 1, 6], ["PR", 5, 0, "auto_unroll_max_step$1024"]]]], "r": [[0.0250516], 0, 8.18165, 1637780844], "v": "v0.6"}
{"i": [["[\"depthwise_conv2d_layer\", 128, 336, 42, 42, 5, 5, 2, \"SAME\"]", "cuda -keys=cuda,gpu -max_num_threads=1024 -thread_warp_size=32", [-1, 16, 64, 49152, 2147483647, 1024, 8, 32], "", 0, []], [[], [["CHW", 3, "local"], ["SP", 3, 0, 128, [2, 1, 1, 16], 1], ["SP", 3, 5, 336, [1, 2, 1, 1], 1], ["SP", 3, 10, 21, [1, 21, 1, 1], 1], ["SP", 3, 15, 21, [1, 1, 1, 1], 1], ["SP", 3, 20, 5, [1, 1], 1], ["SP", 3, 23, 5, [1, 1], 1], ["RE", 3, [0, 5, 10, 15, 1, 6, 11, 16, 2, 7, 12, 17, 20, 23, 21, 24, 3, 8, 13, 18, 22, 25, 4, 9, 14, 19]], ["FSP", 4, 0, 1, 3], ["FSP", 4, 4, 2, 3], ["FSP", 4, 8, 3, 3], ["FSP", 4, 12, 4, 3], ["RE", 4, [0, 4, 8, 12, 1, 5, 9, 13, 2, 6, 10, 14, 3, 7, 11, 15]], ["CA", 3, 4, 11], ["CHR", 2, "shared", [3]], ["CA", 3, 4, 13], ["CHR", 1, "shared", [4]], ["CA", 2, 5, 13], ["CI", 1], ["FU", 6, [0, 1, 2, 3]], ["AN", 6, 0, 5], ["FU", 6, [1, 2, 3, 4]], ["AN", 6, 1, 4], ["FU", 6, [2, 3, 4, 5]], ["AN", 6, 2, 6], ["FU", 4, [0, 1, 2, 3]], ["SP", 4, 0, 1, [1], 1], ["AN", 4, 1, 2], ["FFSP", 4, 0, [4, 3, 2, 1], 1, 1], ["AN", 4, 1, 6], ["FU", 2, [0, 1, 2, 3]], ["SP", 2, 0, 32, [1], 1], ["AN", 2, 1, 2], ["FFSP", 2, 0, [4, 3, 2, 1], 1, 1], ["AN", 2, 1, 6], ["PR", 5, 0, "auto_unroll_max_step$16"]]]], "r": [[0.0212015], 0, 2.60272, 1637780846], "v": "v0.6"}
{"i": [["[\"depthwise_conv2d_layer\", 128, 336, 42, 42, 5, 5, 2, \"SAME\"]", "cuda -keys=cuda,gpu -max_num_threads=1024 -thread_warp_size=32", [-1, 16, 64, 49152, 2147483647, 1024, 8, 32], "", 0, []], [[], [["CHW", 3, "local"], ["SP", 3, 0, 128, [1, 4, 1, 1], 1], ["SP", 3, 5, 336, [1, 56, 1, 2], 1], ["SP", 3, 10, 21, [3, 1, 1, 1], 1], ["SP", 3, 15, 21, [1, 1, 1, 1], 1], ["SP", 3, 20, 5, [1, 1], 1], ["SP", 3, 23, 5, [1, 1], 1], ["RE", 3, [0, 5, 10, 15, 1, 6, 11, 16, 2, 7, 12, 17, 20, 23, 21, 24, 3, 8, 13, 18, 22, 25, 4, 9, 14, 19]], ["FSP", 4, 0, 1, 3], ["FSP", 4, 4, 2, 3], ["FSP", 4, 8, 3, 3], ["FSP", 4, 12, 4, 3], ["RE", 4, [0, 4, 8, 12, 1, 5, 9, 13, 2, 6, 10, 14, 3, 7, 11, 15]], ["CA", 3, 4, 11], ["CHR", 2, "shared", [3]], ["CA", 3, 4, 13], ["CHR", 1, "shared", [4]], ["CA", 2, 5, 13], ["CI", 1], ["FU", 6, [0, 1, 2, 3]], ["AN", 6, 0, 5], ["FU", 6, [1, 2, 3, 4]], ["AN", 6, 1, 4], ["FU", 6, [2, 3, 4, 5]], ["AN", 6, 2, 6], ["FU", 4, [0, 1, 2, 3]], ["SP", 4, 0, 2, [1], 1], ["AN", 4, 1, 2], ["FFSP", 4, 0, [4, 3, 2, 1], 1, 1], ["AN", 4, 1, 6], ["FU", 2, [0, 1, 2, 3]], ["SP", 2, 0, 4, [1], 1], ["AN", 2, 1, 2], ["FFSP", 2, 0, [4, 3, 2, 1], 1, 1], ["AN", 2, 1, 6], ["PR", 5, 0, "auto_unroll_max_step$1024"]]]], "r": [[0.0197879], 0, 3.6576, 1637780849], "v": "v0.6"}
{"i": [["[\"depthwise_conv2d_layer\", 128, 336, 42, 42, 5, 5, 2, \"SAME\"]", "cuda -keys=cuda,gpu -max_num_threads=1024 -thread_warp_size=32", [-1, 16, 64, 49152, 2147483647, 1024, 8, 32], "", 0, []], [[], [["CHW", 3, "local"], ["SP", 3, 0, 128, [1, 2, 1, 1], 1], ["SP", 3, 5, 336, [1, 6, 1, 2], 1], ["SP", 3, 10, 21, [7, 3, 1, 1], 1], ["SP", 3, 15, 21, [1, 1, 3, 1], 1], ["SP", 3, 20, 5, [1, 1], 1], ["SP", 3, 23, 5, [1, 5], 1], ["RE", 3, [0, 5, 10, 15, 1, 6, 11, 16, 2, 7, 12, 17, 20, 23, 21, 24, 3, 8, 13, 18, 22, 25, 4, 9, 14, 19]], ["FSP", 4, 0, 1, 3], ["FSP", 4, 4, 2, 3], ["FSP", 4, 8, 3, 3], ["FSP", 4, 12, 4, 3], ["RE", 4, [0, 4, 8, 12, 1, 5, 9, 13, 2, 6, 10, 14, 3, 7, 11, 15]], ["CA", 3, 4, 11], ["CHR", 2, "shared", [3]], ["CA", 3, 4, 13], ["CHR", 1, "shared", [4]], ["CA", 2, 5, 13], ["CI", 1], ["FU", 6, [0, 1, 2, 3]], ["AN", 6, 0, 5], ["FU", 6, [1, 2, 3, 4]], ["AN", 6, 1, 4], ["FU", 6, [2, 3, 4, 5]], ["AN", 6, 2, 6], ["FU", 4, [0, 1, 2, 3]], ["SP", 4, 0, 10, [2], 1], ["AN", 4, 1, 2], ["FFSP", 4, 0, [4, 3, 2, 1], 1, 1], ["AN", 4, 1, 6], ["FU", 2, [0, 1, 2, 3]], ["SP", 2, 0, 18, [1], 1], ["AN", 2, 1, 2], ["FFSP", 2, 0, [4, 3, 2, 1], 1, 1], ["AN", 2, 1, 6], ["PR", 5, 0, "auto_unroll_max_step$512"]]]], "r": [[0.00825625], 0, 6.05717, 1637780851], "v": "v0.6"}
{"i": [["[\"depthwise_conv2d_layer\", 128, 336, 42, 42, 5, 5, 2, \"SAME\"]", "cuda -keys=cuda,gpu -max_num_threads=1024 -thread_warp_size=32", [-1, 16, 64, 49152, 2147483647, 1024, 8, 32], "", 0, []], [[], [["CHW", 3, "local"], ["SP", 3, 0, 128, [1, 2, 1, 2], 1], ["SP", 3, 5, 336, [1, 7, 2, 2], 1], ["SP", 3, 10, 21, [1, 1, 1, 1], 1], ["SP", 3, 15, 21, [1, 7, 1, 3], 1], ["SP", 3, 20, 5, [1, 1], 1], ["SP", 3, 23, 5, [1, 5], 1], ["RE", 3, [0, 5, 10, 15, 1, 6, 11, 16, 2, 7, 12, 17, 20, 23, 21, 24, 3, 8, 13, 18, 22, 25, 4, 9, 14, 19]], ["FSP", 4, 0, 1, 3], ["FSP", 4, 4, 2, 3], ["FSP", 4, 8, 3, 3], ["FSP", 4, 12, 4, 3], ["RE", 4, [0, 4, 8, 12, 1, 5, 9, 13, 2, 6, 10, 14, 3, 7, 11, 15]], ["CA", 3, 4, 11], ["CHR", 2, "shared", [3]], ["CA", 3, 4, 13], ["CHR", 1, "shared", [4]], ["CA", 2, 5, 13], ["CI", 1], ["FU", 6, [0, 1, 2, 3]], ["AN", 6, 0, 5], ["FU", 6, [1, 2, 3, 4]], ["AN", 6, 1, 4], ["FU", 6, [2, 3, 4, 5]], ["AN", 6, 2, 6], ["FU", 4, [0, 1, 2, 3]], ["SP", 4, 0, 20, [1], 1], ["AN", 4, 1, 2], ["FFSP", 4, 0, [4, 3, 2, 1], 1, 1], ["AN", 4, 1, 6], ["FU", 2, [0, 1, 2, 3]], ["SP", 2, 0, 72, [24], 1], ["AN", 2, 1, 2], ["FFSP", 2, 0, [4, 3, 2, 1], 1, 1], ["AN", 2, 1, 6], ["PR", 5, 0, "auto_unroll_max_step$1024"]]]], "r": [[0.00472669], 0, 5.96286, 1637780854], "v": "v0.6"}
{"i": [["[\"depthwise_conv2d_layer\", 128, 336, 42, 42, 5, 5, 2, \"SAME\"]", "cuda -keys=cuda,gpu -max_num_threads=1024 -thread_warp_size=32", [-1, 16, 64, 49152, 2147483647, 1024, 8, 32], "", 0, []], [[], [["CHW", 3, "local"], ["SP", 3, 0, 128, [1, 1, 1, 1], 1], ["SP", 3, 5, 336, [1, 84, 2, 2], 1], ["SP", 3, 10, 21, [1, 3, 1, 1], 1], ["SP", 3, 15, 21, [1, 1, 1, 1], 1], ["SP", 3, 20, 5, [5, 1], 1], ["SP", 3, 23, 5, [1, 1], 1], ["RE", 3, [0, 5, 10, 15, 1, 6, 11, 16, 2, 7, 12, 17, 20, 23, 21, 24, 3, 8, 13, 18, 22, 25, 4, 9, 14, 19]], ["FSP", 4, 0, 1, 3], ["FSP", 4, 4, 2, 3], ["FSP", 4, 8, 3, 3], ["FSP", 4, 12, 4, 3], ["RE", 4, [0, 4, 8, 12, 1, 5, 9, 13, 2, 6, 10, 14, 3, 7, 11, 15]], ["CA", 3, 4, 11], ["CHR", 2, "shared", [3]], ["CA", 3, 4, 13], ["CHR", 1, "shared", [4]], ["CA", 2, 5, 13], ["CI", 1], ["FU", 6, [0, 1, 2, 3]], ["AN", 6, 0, 5], ["FU", 6, [1, 2, 3, 4]], ["AN", 6, 1, 4], ["FU", 6, [2, 3, 4, 5]], ["AN", 6, 2, 6], ["FU", 4, [0, 1, 2, 3]], ["SP", 4, 0, 4, [1], 1], ["AN", 4, 1, 2], ["FFSP", 4, 0, [4, 3, 2, 1], 1, 1], ["AN", 4, 1, 6], ["FU", 2, [0, 1, 2, 3]], ["SP", 2, 0, 4, [1], 1], ["AN", 2, 1, 2], ["FFSP", 2, 0, [4, 3, 2, 1], 1, 1], ["AN", 2, 1, 6], ["PR", 5, 0, "auto_unroll_max_step$1024"]]]], "r": [[0.00729692], 0, 2.94034, 1637780857], "v": "v0.6"}
{"i": [["[\"depthwise_conv2d_layer\", 128, 336, 42, 42, 5, 5, 2, \"SAME\"]", "cuda -keys=cuda,gpu -max_num_threads=1024 -thread_warp_size=32", [-1, 16, 64, 49152, 2147483647, 1024, 8, 32], "", 0, []], [[], [["CHW", 3, "local"], ["SP", 3, 0, 128, [2, 32, 1, 1], 1], ["SP", 3, 5, 336, [1, 1, 2, 1], 1], ["SP", 3, 10, 21, [3, 1, 1, 1], 1], ["SP", 3, 15, 21, [1, 1, 1, 3], 1], ["SP", 3, 20, 5, [1, 1], 1], ["SP", 3, 23, 5, [1, 1], 1], ["RE", 3, [0, 5, 10, 15, 1, 6, 11, 16, 2, 7, 12, 17, 20, 23, 21, 24, 3, 8, 13, 18, 22, 25, 4, 9, 14, 19]], ["FSP", 4, 0, 1, 3], ["FSP", 4, 4, 2, 3], ["FSP", 4, 8, 3, 3], ["FSP", 4, 12, 4, 3], ["RE", 4, [0, 4, 8, 12, 1, 5, 9, 13, 2, 6, 10, 14, 3, 7, 11, 15]], ["CA", 3, 4, 11], ["CHR", 2, "shared", [3]], ["CA", 3, 4, 13], ["CHR", 1, "shared", [4]], ["CA", 2, 5, 13], ["CI", 1], ["FU", 6, [0, 1, 2, 3]], ["AN", 6, 0, 5], ["FU", 6, [1, 2, 3, 4]], ["AN", 6, 1, 4], ["FU", 6, [2, 3, 4, 5]], ["AN", 6, 2, 6], ["FU", 4, [0, 1, 2, 3]], ["SP", 4, 0, 10, [10], 1], ["AN", 4, 1, 2], ["FFSP", 4, 0, [4, 3, 2, 1], 1, 1], ["AN", 4, 1, 6], ["FU", 2, [0, 1, 2, 3]], ["SP", 2, 0, 18, [1], 1], ["AN", 2, 1, 2], ["FFSP", 2, 0, [4, 3, 2, 1], 1, 1], ["AN", 2, 1, 6], ["PR", 5, 0, "auto_unroll_max_step$512"]]]], "r": [[0.0321853], 0, 3.89531, 1637780859], "v": "v0.6"}
{"i": [["[\"depthwise_conv2d_layer\", 128, 336, 42, 42, 5, 5, 2, \"SAME\"]", "cuda -keys=cuda,gpu -max_num_threads=1024 -thread_warp_size=32", [-1, 16, 64, 49152, 2147483647, 1024, 8, 32], "", 0, []], [[], [["CHW", 3, "local"], ["SP", 3, 0, 128, [1, 2, 8, 1], 1], ["SP", 3, 5, 336, [1, 1, 3, 2], 1], ["SP", 3, 10, 21, [1, 21, 1, 1], 1], ["SP", 3, 15, 21, [1, 1, 1, 1], 1], ["SP", 3, 20, 5, [1, 1], 1], ["SP", 3, 23, 5, [1, 1], 1], ["RE", 3, [0, 5, 10, 15, 1, 6, 11, 16, 2, 7, 12, 17, 20, 23, 21, 24, 3, 8, 13, 18, 22, 25, 4, 9, 14, 19]], ["FSP", 4, 0, 1, 3], ["FSP", 4, 4, 2, 3], ["FSP", 4, 8, 3, 3], ["FSP", 4, 12, 4, 3], ["RE", 4, [0, 4, 8, 12, 1, 5, 9, 13, 2, 6, 10, 14, 3, 7, 11, 15]], ["CA", 3, 4, 11], ["CHR", 2, "shared", [3]], ["CA", 3, 4, 13], ["CHR", 1, "shared", [4]], ["CA", 2, 5, 13], ["CI", 1], ["FU", 6, [0, 1, 2, 3]], ["AN", 6, 0, 5], ["FU", 6, [1, 2, 3, 4]], ["AN", 6, 1, 4], ["FU", 6, [2, 3, 4, 5]], ["AN", 6, 2, 6], ["FU", 4, [0, 1, 2, 3]], ["SP", 4, 0, 2, [1], 1], ["AN", 4, 1, 2], ["FFSP", 4, 0, [4, 3, 2, 1], 1, 1], ["AN", 4, 1, 6], ["FU", 2, [0, 1, 2, 3]], ["SP", 2, 0, 16, [1], 1], ["AN", 2, 1, 2], ["FFSP", 2, 0, [4, 3, 2, 1], 1, 1], ["AN", 2, 1, 6], ["PR", 5, 0, "auto_unroll_max_step$0"]]]], "r": [[0.0260887], 0, 2.62267, 1637780861], "v": "v0.6"}
{"i": [["[\"depthwise_conv2d_layer\", 128, 336, 42, 42, 5, 5, 2, \"SAME\"]", "cuda -keys=cuda,gpu -max_num_threads=1024 -thread_warp_size=32", [-1, 16, 64, 49152, 2147483647, 1024, 8, 32], "", 0, []], [[], [["CHW", 3, "local"], ["SP", 3, 0, 128, [1, 2, 1, 2], 1], ["SP", 3, 5, 336, [2, 6, 1, 2], 1], ["SP", 3, 10, 21, [1, 1, 1, 1], 1], ["SP", 3, 15, 21, [1, 3, 1, 1], 1], ["SP", 3, 20, 5, [5, 1], 1], ["SP", 3, 23, 5, [1, 5], 1], ["RE", 3, [0, 5, 10, 15, 1, 6, 11, 16, 2, 7, 12, 17, 20, 23, 21, 24, 3, 8, 13, 18, 22, 25, 4, 9, 14, 19]], ["FSP", 4, 0, 1, 3], ["FSP", 4, 4, 2, 3], ["FSP", 4, 8, 3, 3], ["FSP", 4, 12, 4, 3], ["RE", 4, [0, 4, 8, 12, 1, 5, 9, 13, 2, 6, 10, 14, 3, 7, 11, 15]], ["CA", 3, 4, 11], ["CHR", 2, "shared", [3]], ["CA", 3, 4, 13], ["CHR", 1, "shared", [4]], ["CA", 2, 5, 13], ["CI", 1], ["FU", 6, [0, 1, 2, 3]], ["AN", 6, 0, 5], ["FU", 6, [1, 2, 3, 4]], ["AN", 6, 1, 4], ["FU", 6, [2, 3, 4, 5]], ["AN", 6, 2, 6], ["FU", 4, [0, 1, 2, 3]], ["SP", 4, 0, 50, [1], 1], ["AN", 4, 1, 2], ["FFSP", 4, 0, [4, 3, 2, 1], 1, 1], ["AN", 4, 1, 6], ["FU", 2, [0, 1, 2, 3]], ["SP", 2, 0, 100, [50], 1], ["AN", 2, 1, 2], ["FFSP", 2, 0, [4, 3, 2, 1], 1, 1], ["AN", 2, 1, 6], ["PR", 5, 0, "auto_unroll_max_step$0"]]]], "r": [[0.0128415], 0, 2.54876, 1637780863], "v": "v0.6"}
{"i": [["[\"depthwise_conv2d_layer\", 128, 336, 42, 42, 5, 5, 2, \"SAME\"]", "cuda -keys=cuda,gpu -max_num_threads=1024 -thread_warp_size=32", [-1, 16, 64, 49152, 2147483647, 1024, 8, 32], "", 0, []], [[], [["CHW", 3, "local"], ["SP", 3, 0, 128, [1, 1, 1, 1], 1], ["SP", 3, 5, 336, [1, 2, 1, 8], 1], ["SP", 3, 10, 21, [3, 7, 1, 1], 1], ["SP", 3, 15, 21, [1, 3, 1, 1], 1], ["SP", 3, 20, 5, [1, 1], 1], ["SP", 3, 23, 5, [1, 5], 1], ["RE", 3, [0, 5, 10, 15, 1, 6, 11, 16, 2, 7, 12, 17, 20, 23, 21, 24, 3, 8, 13, 18, 22, 25, 4, 9, 14, 19]], ["FSP", 4, 0, 1, 3], ["FSP", 4, 4, 2, 3], ["FSP", 4, 8, 3, 3], ["FSP", 4, 12, 4, 3], ["RE", 4, [0, 4, 8, 12, 1, 5, 9, 13, 2, 6, 10, 14, 3, 7, 11, 15]], ["CA", 3, 4, 11], ["CHR", 2, "shared", [3]], ["CA", 3, 4, 13], ["CHR", 1, "shared", [4]], ["CA", 2, 5, 13], ["CI", 1], ["FU", 6, [0, 1, 2, 3]], ["AN", 6, 0, 5], ["FU", 6, [1, 2, 3, 4]], ["AN", 6, 1, 4], ["FU", 6, [2, 3, 4, 5]], ["AN", 6, 2, 6], ["FU", 4, [0, 1, 2, 3]], ["SP", 4, 0, 40, [2], 1], ["AN", 4, 1, 2], ["FFSP", 4, 0, [4, 3, 2, 1], 1, 1], ["AN", 4, 1, 6], ["FU", 2, [0, 1, 2, 3]], ["SP", 2, 0, 40, [1], 1], ["AN", 2, 1, 2], ["FFSP", 2, 0, [4, 3, 2, 1], 1, 1], ["AN", 2, 1, 6], ["PR", 5, 0, "auto_unroll_max_step$1024"]]]], "r": [[0.00246377], 0, 4.89804, 1637780865], "v": "v0.6"}
{"i": [["[\"depthwise_conv2d_layer\", 128, 336, 42, 42, 5, 5, 2, \"SAME\"]", "cuda -keys=cuda,gpu -max_num_threads=1024 -thread_warp_size=32", [-1, 16, 64, 49152, 2147483647, 1024, 8, 32], "", 0, []], [[], [["CHW", 3, "local"], ["SP", 3, 0, 128, [1, 2, 2, 1], 1], ["SP", 3, 5, 336, [2, 6, 4, 1], 1], ["SP", 3, 10, 21, [1, 3, 7, 1], 1], ["SP", 3, 15, 21, [1, 1, 1, 1], 1], ["SP", 3, 20, 5, [1, 1], 1], ["SP", 3, 23, 5, [1, 1], 1], ["RE", 3, [0, 5, 10, 15, 1, 6, 11, 16, 2, 7, 12, 17, 20, 23, 21, 24, 3, 8, 13, 18, 22, 25, 4, 9, 14, 19]], ["FSP", 4, 0, 1, 3], ["FSP", 4, 4, 2, 3], ["FSP", 4, 8, 3, 3], ["FSP", 4, 12, 4, 3], ["RE", 4, [0, 4, 8, 12, 1, 5, 9, 13, 2, 6, 10, 14, 3, 7, 11, 15]], ["CA", 3, 4, 11], ["CHR", 2, "shared", [3]], ["CA", 3, 4, 13], ["CHR", 1, "shared", [4]], ["CA", 2, 5, 13], ["CI", 1], ["FU", 6, [0, 1, 2, 3]], ["AN", 6, 0, 5], ["FU", 6, [1, 2, 3, 4]], ["AN", 6, 1, 4], ["FU", 6, [2, 3, 4, 5]], ["AN", 6, 2, 6], ["FU", 4, [0, 1, 2, 3]], ["SP", 4, 0, 4, [1], 1], ["AN", 4, 1, 2], ["FFSP", 4, 0, [4, 3, 2, 1], 1, 1], ["AN", 4, 1, 6], ["FU", 2, [0, 1, 2, 3]], ["SP", 2, 0, 104, [52], 1], ["AN", 2, 1, 2], ["FFSP", 2, 0, [4, 3, 2, 1], 1, 1], ["AN", 2, 1, 6], ["PR", 5, 0, "auto_unroll_max_step$64"]]]], "r": [[0.0731085], 0, 3.96515, 1637780868], "v": "v0.6"}
{"i": [["[\"depthwise_conv2d_layer\", 128, 336, 42, 42, 5, 5, 2, \"SAME\"]", "cuda -keys=cuda,gpu -max_num_threads=1024 -thread_warp_size=32", [-1, 16, 64, 49152, 2147483647, 1024, 8, 32], "", 0, []], [[], [["CHW", 3, "local"], ["SP", 3, 0, 128, [1, 2, 1, 2], 1], ["SP", 3, 5, 336, [1, 1, 1, 6], 1], ["SP", 3, 10, 21, [1, 3, 1, 1], 1], ["SP", 3, 15, 21, [1, 3, 1, 1], 1], ["SP", 3, 20, 5, [1, 1], 1], ["SP", 3, 23, 5, [5, 1], 1], ["RE", 3, [0, 5, 10, 15, 1, 6, 11, 16, 2, 7, 12, 17, 20, 23, 21, 24, 3, 8, 13, 18, 22, 25, 4, 9, 14, 19]], ["FSP", 4, 0, 1, 3], ["FSP", 4, 4, 2, 3], ["FSP", 4, 8, 3, 3], ["FSP", 4, 12, 4, 3], ["RE", 4, [0, 4, 8, 12, 1, 5, 9, 13, 2, 6, 10, 14, 3, 7, 11, 15]], ["CA", 3, 4, 11], ["CHR", 2, "shared", [3]], ["CA", 3, 4, 13], ["CHR", 1, "shared", [4]], ["CA", 2, 5, 13], ["CI", 1], ["FU", 6, [0, 1, 2, 3]], ["AN", 6, 0, 5], ["FU", 6, [1, 2, 3, 4]], ["AN", 6, 1, 4], ["FU", 6, [2, 3, 4, 5]], ["AN", 6, 2, 6], ["FU", 4, [0, 1, 2, 3]], ["SP", 4, 0, 60, [1], 1], ["AN", 4, 1, 2], ["FFSP", 4, 0, [4, 3, 2, 1], 1, 1], ["AN", 4, 1, 6], ["FU", 2, [0, 1, 2, 3]], ["SP", 2, 0, 120, [1], 1], ["AN", 2, 1, 2], ["FFSP", 2, 0, [4, 3, 2, 1], 1, 1], ["AN", 2, 1, 6], ["PR", 5, 0, "auto_unroll_max_step$0"]]]], "r": [[0.00280719], 0, 2.37314, 1637780870], "v": "v0.6"}
{"i": [["[\"depthwise_conv2d_layer\", 128, 336, 42, 42, 5, 5, 2, \"SAME\"]", "cuda -keys=cuda,gpu -max_num_threads=1024 -thread_warp_size=32", [-1, 16, 64, 49152, 2147483647, 1024, 8, 32], "", 0, []], [[], [["CHW", 3, "local"], ["SP", 3, 0, 128, [1, 2, 1, 1], 1], ["SP", 3, 5, 336, [1, 6, 1, 2], 1], ["SP", 3, 10, 21, [7, 3, 1, 1], 1], ["SP", 3, 15, 21, [1, 1, 1, 3], 1], ["SP", 3, 20, 5, [1, 5], 1], ["SP", 3, 23, 5, [1, 5], 1], ["RE", 3, [0, 5, 10, 15, 1, 6, 11, 16, 2, 7, 12, 17, 20, 23, 21, 24, 3, 8, 13, 18, 22, 25, 4, 9, 14, 19]], ["FSP", 4, 0, 1, 3], ["FSP", 4, 4, 2, 3], ["FSP", 4, 8, 3, 3], ["FSP", 4, 12, 4, 3], ["RE", 4, [0, 4, 8, 12, 1, 5, 9, 13, 2, 6, 10, 14, 3, 7, 11, 15]], ["CA", 3, 4, 11], ["CHR", 2, "shared", [3]], ["CA", 3, 4, 13], ["CHR", 1, "shared", [4]], ["CA", 2, 5, 13], ["CI", 1], ["FU", 6, [0, 1, 2, 3]], ["AN", 6, 0, 5], ["FU", 6, [1, 2, 3, 4]], ["AN", 6, 1, 4], ["FU", 6, [2, 3, 4, 5]], ["AN", 6, 2, 6], ["FU", 4, [0, 1, 2, 3]], ["SP", 4, 0, 10, [2], 1], ["AN", 4, 1, 2], ["FFSP", 4, 0, [4, 3, 2, 1], 1, 1], ["AN", 4, 1, 6], ["FU", 2, [0, 1, 2, 3]], ["SP", 2, 0, 18, [1], 1], ["AN", 2, 1, 2], ["FFSP", 2, 0, [4, 3, 2, 1], 1, 1], ["AN", 2, 1, 6], ["PR", 5, 0, "auto_unroll_max_step$512"]]]], "r": [[0.00329829], 0, 5.69233, 1637780874], "v": "v0.6"}
{"i": [["[\"depthwise_conv2d_layer\", 128, 336, 42, 42, 5, 5, 2, \"SAME\"]", "cuda -keys=cuda,gpu -max_num_threads=1024 -thread_warp_size=32", [-1, 16, 64, 49152, 2147483647, 1024, 8, 32], "", 0, []], [[], [["CHW", 3, "local"], ["SP", 3, 0, 128, [2, 16, 1, 1], 1], ["SP", 3, 5, 336, [1, 1, 1, 2], 1], ["SP", 3, 10, 21, [1, 1, 1, 21], 1], ["SP", 3, 15, 21, [1, 1, 1, 1], 1], ["SP", 3, 20, 5, [5, 1], 1], ["SP", 3, 23, 5, [1, 1], 1], ["RE", 3, [0, 5, 10, 15, 1, 6, 11, 16, 2, 7, 12, 17, 20, 23, 21, 24, 3, 8, 13, 18, 22, 25, 4, 9, 14, 19]], ["FSP", 4, 0, 1, 3], ["FSP", 4, 4, 2, 3], ["FSP", 4, 8, 3, 3], ["FSP", 4, 12, 4, 3], ["RE", 4, [0, 4, 8, 12, 1, 5, 9, 13, 2, 6, 10, 14, 3, 7, 11, 15]], ["CA", 3, 4, 11], ["CHR", 2, "shared", [3]], ["CA", 3, 4, 13], ["CHR", 1, "shared", [4]], ["CA", 2, 5, 13], ["CI", 1], ["FU", 6, [0, 1, 2, 3]], ["AN", 6, 0, 5], ["FU", 6, [1, 2, 3, 4]], ["AN", 6, 1, 4], ["FU", 6, [2, 3, 4, 5]], ["AN", 6, 2, 6], ["FU", 4, [0, 1, 2, 3]], ["SP", 4, 0, 10, [1], 1], ["AN", 4, 1, 2], ["FFSP", 4, 0, [4, 3, 2, 1], 1, 1], ["AN", 4, 1, 6], ["FU", 2, [0, 1, 2, 3]], ["SP", 2, 0, 18, [1], 1], ["AN", 2, 1, 2], ["FFSP", 2, 0, [4, 3, 2, 1], 1, 1], ["AN", 2, 1, 6], ["PR", 5, 0, "auto_unroll_max_step$0"]]]], "r": [[0.00636364], 0, 2.41076, 1637780876], "v": "v0.6"}
{"i": [["[\"depthwise_conv2d_layer\", 128, 336, 42, 42, 5, 5, 2, \"SAME\"]", "cuda -keys=cuda,gpu -max_num_threads=1024 -thread_warp_size=32", [-1, 16, 64, 49152, 2147483647, 1024, 8, 32], "", 0, []], [[], [["CHW", 3, "local"], ["SP", 3, 0, 128, [1, 2, 1, 2], 1], ["SP", 3, 5, 336, [1, 1, 2, 6], 1], ["SP", 3, 10, 21, [1, 3, 1, 1], 1], ["SP", 3, 15, 21, [1, 21, 1, 1], 1], ["SP", 3, 20, 5, [1, 1], 1], ["SP", 3, 23, 5, [5, 1], 1], ["RE", 3, [0, 5, 10, 15, 1, 6, 11, 16, 2, 7, 12, 17, 20, 23, 21, 24, 3, 8, 13, 18, 22, 25, 4, 9, 14, 19]], ["FSP", 4, 0, 1, 3], ["FSP", 4, 4, 2, 3], ["FSP", 4, 8, 3, 3], ["FSP", 4, 12, 4, 3], ["RE", 4, [0, 4, 8, 12, 1, 5, 9, 13, 2, 6, 10, 14, 3, 7, 11, 15]], ["CA", 3, 4, 11], ["CHR", 2, "shared", [3]], ["CA", 3, 4, 13], ["CHR", 1, "shared", [4]], ["CA", 2, 5, 13], ["CI", 1], ["FU", 6, [0, 1, 2, 3]], ["AN", 6, 0, 5], ["FU", 6, [1, 2, 3, 4]], ["AN", 6, 1, 4], ["FU", 6, [2, 3, 4, 5]], ["AN", 6, 2, 6], ["FU", 4, [0, 1, 2, 3]], ["SP", 4, 0, 60, [1], 1], ["AN", 4, 1, 2], ["FFSP", 4, 0, [4, 3, 2, 1], 1, 1], ["AN", 4, 1, 6], ["FU", 2, [0, 1, 2, 3]], ["SP", 2, 0, 120, [1], 1], ["AN", 2, 1, 2], ["FFSP", 2, 0, [4, 3, 2, 1], 1, 1], ["AN", 2, 1, 6], ["PR", 5, 0, "auto_unroll_max_step$16"]]]], "r": [[0.00903663], 0, 2.52627, 1637780878], "v": "v0.6"}
{"i": [["[\"depthwise_conv2d_layer\", 128, 336, 42, 42, 5, 5, 2, \"SAME\"]", "cuda -keys=cuda,gpu -max_num_threads=1024 -thread_warp_size=32", [-1, 16, 64, 49152, 2147483647, 1024, 8, 32], "", 0, []], [[], [["CHW", 3, "local"], ["SP", 3, 0, 128, [2, 4, 1, 8], 1], ["SP", 3, 5, 336, [1, 3, 2, 1], 1], ["SP", 3, 10, 21, [1, 1, 1, 1], 1], ["SP", 3, 15, 21, [1, 1, 1, 3], 1], ["SP", 3, 20, 5, [1, 1], 1], ["SP", 3, 23, 5, [1, 1], 1], ["RE", 3, [0, 5, 10, 15, 1, 6, 11, 16, 2, 7, 12, 17, 20, 23, 21, 24, 3, 8, 13, 18, 22, 25, 4, 9, 14, 19]], ["FSP", 4, 0, 1, 3], ["FSP", 4, 4, 2, 3], ["FSP", 4, 8, 3, 3], ["FSP", 4, 12, 4, 3], ["RE", 4, [0, 4, 8, 12, 1, 5, 9, 13, 2, 6, 10, 14, 3, 7, 11, 15]], ["CA", 3, 4, 11], ["CHR", 2, "shared", [3]], ["CA", 3, 4, 13], ["CHR", 1, "shared", [4]], ["CA", 2, 5, 13], ["CI", 1], ["FU", 6, [0, 1, 2, 3]], ["AN", 6, 0, 5], ["FU", 6, [1, 2, 3, 4]], ["AN", 6, 1, 4], ["FU", 6, [2, 3, 4, 5]], ["AN", 6, 2, 6], ["FU", 4, [0, 1, 2, 3]], ["SP", 4, 0, 2, [2], 1], ["AN", 4, 1, 2], ["FFSP", 4, 0, [4, 3, 2, 1], 1, 1], ["AN", 4, 1, 6], ["FU", 2, [0, 1, 2, 3]], ["SP", 2, 0, 80, [1], 1], ["AN", 2, 1, 2], ["FFSP", 2, 0, [4, 3, 2, 1], 1, 1], ["AN", 2, 1, 6], ["PR", 5, 0, "auto_unroll_max_step$1024"]]]], "r": [[0.0409532], 0, 4.86395, 1637780881], "v": "v0.6"}
{"i": [["[\"depthwise_conv2d_layer\", 128, 336, 42, 42, 5, 5, 2, \"SAME\"]", "cuda -keys=cuda,gpu -max_num_threads=1024 -thread_warp_size=32", [-1, 16, 64, 49152, 2147483647, 1024, 8, 32], "", 0, []], [[], [["CHW", 3, "local"], ["SP", 3, 0, 128, [1, 1, 1, 1], 1], ["SP", 3, 5, 336, [1, 28, 6, 2], 1], ["SP", 3, 10, 21, [1, 3, 1, 1], 1], ["SP", 3, 15, 21, [1, 1, 3, 1], 1], ["SP", 3, 20, 5, [1, 1], 1], ["SP", 3, 23, 5, [1, 1], 1], ["RE", 3, [0, 5, 10, 15, 1, 6, 11, 16, 2, 7, 12, 17, 20, 23, 21, 24, 3, 8, 13, 18, 22, 25, 4, 9, 14, 19]], ["FSP", 4, 0, 1, 3], ["FSP", 4, 4, 2, 3], ["FSP", 4, 8, 3, 3], ["FSP", 4, 12, 4, 3], ["RE", 4, [0, 4, 8, 12, 1, 5, 9, 13, 2, 6, 10, 14, 3, 7, 11, 15]], ["CA", 3, 4, 11], ["CHR", 2, "shared", [3]], ["CA", 3, 4, 13], ["CHR", 1, "shared", [4]], ["CA", 2, 5, 13], ["CI", 1], ["FU", 6, [0, 1, 2, 3]], ["AN", 6, 0, 5], ["FU", 6, [1, 2, 3, 4]], ["AN", 6, 1, 4], ["FU", 6, [2, 3, 4, 5]], ["AN", 6, 2, 6], ["FU", 4, [0, 1, 2, 3]], ["SP", 4, 0, 4, [1], 1], ["AN", 4, 1, 2], ["FFSP", 4, 0, [4, 3, 2, 1], 1, 1], ["AN", 4, 1, 6], ["FU", 2, [0, 1, 2, 3]], ["SP", 2, 0, 4, [2], 1], ["AN", 2, 1, 2], ["FFSP", 2, 0, [4, 3, 2, 1], 1, 1], ["AN", 2, 1, 6], ["PR", 5, 0, "auto_unroll_max_step$1024"]]]], "r": [[0.0258084], 0, 7.04803, 1637780883], "v": "v0.6"}
{"i": [["[\"depthwise_conv2d_layer\", 128, 336, 42, 42, 5, 5, 2, \"SAME\"]", "cuda -keys=cuda,gpu -max_num_threads=1024 -thread_warp_size=32", [-1, 16, 64, 49152, 2147483647, 1024, 8, 32], "", 0, []], [[], [["CHW", 3, "local"], ["SP", 3, 0, 128, [1, 2, 1, 2], 1], ["SP", 3, 5, 336, [1, 1, 2, 6], 1], ["SP", 3, 10, 21, [1, 3, 1, 1], 1], ["SP", 3, 15, 21, [1, 3, 7, 1], 1], ["SP", 3, 20, 5, [1, 1], 1], ["SP", 3, 23, 5, [5, 1], 1], ["RE", 3, [0, 5, 10, 15, 1, 6, 11, 16, 2, 7, 12, 17, 20, 23, 21, 24, 3, 8, 13, 18, 22, 25, 4, 9, 14, 19]], ["FSP", 4, 0, 1, 3], ["FSP", 4, 4, 2, 3], ["FSP", 4, 8, 3, 3], ["FSP", 4, 12, 4, 3], ["RE", 4, [0, 4, 8, 12, 1, 5, 9, 13, 2, 6, 10, 14, 3, 7, 11, 15]], ["CA", 3, 4, 11], ["CHR", 2, "shared", [3]], ["CA", 3, 4, 13], ["CHR", 1, "shared", [4]], ["CA", 2, 5, 13], ["CI", 1], ["FU", 6, [0, 1, 2, 3]], ["AN", 6, 0, 5], ["FU", 6, [1, 2, 3, 4]], ["AN", 6, 1, 4], ["FU", 6, [2, 3, 4, 5]], ["AN", 6, 2, 6], ["FU", 4, [0, 1, 2, 3]], ["SP", 4, 0, 60, [1], 1], ["AN", 4, 1, 2], ["FFSP", 4, 0, [4, 3, 2, 1], 1, 1], ["AN", 4, 1, 6], ["FU", 2, [0, 1, 2, 3]], ["SP", 2, 0, 120, [4], 1], ["AN", 2, 1, 2], ["FFSP", 2, 0, [4, 3, 2, 1], 1, 1], ["AN", 2, 1, 6], ["PR", 5, 0, "auto_unroll_max_step$0"]]]], "r": [[0.0327672], 0, 3.01757, 1637780885], "v": "v0.6"}
{"i": [["[\"depthwise_conv2d_layer\", 128, 336, 42, 42, 5, 5, 2, \"SAME\"]", "cuda -keys=cuda,gpu -max_num_threads=1024 -thread_warp_size=32", [-1, 16, 64, 49152, 2147483647, 1024, 8, 32], "", 0, []], [[], [["CHW", 3, "local"], ["SP", 3, 0, 128, [1, 4, 1, 1], 1], ["SP", 3, 5, 336, [1, 24, 1, 2], 1], ["SP", 3, 10, 21, [1, 1, 1, 1], 1], ["SP", 3, 15, 21, [7, 3, 1, 1], 1], ["SP", 3, 20, 5, [1, 1], 1], ["SP", 3, 23, 5, [5, 1], 1], ["RE", 3, [0, 5, 10, 15, 1, 6, 11, 16, 2, 7, 12, 17, 20, 23, 21, 24, 3, 8, 13, 18, 22, 25, 4, 9, 14, 19]], ["FSP", 4, 0, 1, 3], ["FSP", 4, 4, 2, 3], ["FSP", 4, 8, 3, 3], ["FSP", 4, 12, 4, 3], ["RE", 4, [0, 4, 8, 12, 1, 5, 9, 13, 2, 6, 10, 14, 3, 7, 11, 15]], ["CA", 3, 4, 11], ["CHR", 2, "shared", [3]], ["CA", 3, 4, 13], ["CHR", 1, "shared", [4]], ["CA", 2, 5, 13], ["CI", 1], ["FU", 6, [0, 1, 2, 3]], ["AN", 6, 0, 5], ["FU", 6, [1, 2, 3, 4]], ["AN", 6, 1, 4], ["FU", 6, [2, 3, 4, 5]], ["AN", 6, 2, 6], ["FU", 4, [0, 1, 2, 3]], ["SP", 4, 0, 10, [2], 1], ["AN", 4, 1, 2], ["FFSP", 4, 0, [4, 3, 2, 1], 1, 1], ["AN", 4, 1, 6], ["FU", 2, [0, 1, 2, 3]], ["SP", 2, 0, 10, [10], 1], ["AN", 2, 1, 2], ["FFSP", 2, 0, [4, 3, 2, 1], 1, 1], ["AN", 2, 1, 6], ["PR", 5, 0, "auto_unroll_max_step$0"]]]], "r": [[0.00165735], 0, 2.5291, 1637780887], "v": "v0.6"}
{"i": [["[\"depthwise_conv2d_layer\", 128, 336, 42, 42, 5, 5, 2, \"SAME\"]", "cuda -keys=cuda,gpu -max_num_threads=1024 -thread_warp_size=32", [-1, 16, 64, 49152, 2147483647, 1024, 8, 32], "", 0, []], [[], [["CHW", 3, "local"], ["SP", 3, 0, 128, [1, 8, 2, 1], 1], ["SP", 3, 5, 336, [1, 56, 1, 2], 1], ["SP", 3, 10, 21, [3, 1, 1, 1], 1], ["SP", 3, 15, 21, [1, 1, 1, 1], 1], ["SP", 3, 20, 5, [1, 1], 1], ["SP", 3, 23, 5, [1, 1], 1], ["RE", 3, [0, 5, 10, 15, 1, 6, 11, 16, 2, 7, 12, 17, 20, 23, 21, 24, 3, 8, 13, 18, 22, 25, 4, 9, 14, 19]], ["FSP", 4, 0, 1, 3], ["FSP", 4, 4, 2, 3], ["FSP", 4, 8, 3, 3], ["FSP", 4, 12, 4, 3], ["RE", 4, [0, 4, 8, 12, 1, 5, 9, 13, 2, 6, 10, 14, 3, 7, 11, 15]], ["CA", 3, 4, 11], ["CHR", 2, "shared", [3]], ["CA", 3, 4, 13], ["CHR", 1, "shared", [4]], ["CA", 2, 5, 13], ["CI", 1], ["FU", 6, [0, 1, 2, 3]], ["AN", 6, 0, 5], ["FU", 6, [1, 2, 3, 4]], ["AN", 6, 1, 4], ["FU", 6, [2, 3, 4, 5]], ["AN", 6, 2, 6], ["FU", 4, [0, 1, 2, 3]], ["SP", 4, 0, 2, [2], 1], ["AN", 4, 1, 2], ["FFSP", 4, 0, [4, 3, 2, 1], 1, 1], ["AN", 4, 1, 6], ["FU", 2, [0, 1, 2, 3]], ["SP", 2, 0, 4, [1], 1], ["AN", 2, 1, 2], ["FFSP", 2, 0, [4, 3, 2, 1], 1, 1], ["AN", 2, 1, 6], ["PR", 5, 0, "auto_unroll_max_step$512"]]]], "r": [[0.0157471], 0, 3.25281, 1637780890], "v": "v0.6"}
{"i": [["[\"depthwise_conv2d_layer\", 128, 336, 42, 42, 5, 5, 2, \"SAME\"]", "cuda -keys=cuda,gpu -max_num_threads=1024 -thread_warp_size=32", [-1, 16, 64, 49152, 2147483647, 1024, 8, 32], "", 0, []], [[], [["CHW", 3, "local"], ["SP", 3, 0, 128, [2, 32, 2, 1], 1], ["SP", 3, 5, 336, [2, 2, 1, 1], 1], ["SP", 3, 10, 21, [1, 1, 1, 1], 1], ["SP", 3, 15, 21, [1, 1, 1, 1], 1], ["SP", 3, 20, 5, [1, 1], 1], ["SP", 3, 23, 5, [1, 1], 1], ["RE", 3, [0, 5, 10, 15, 1, 6, 11, 16, 2, 7, 12, 17, 20, 23, 21, 24, 3, 8, 13, 18, 22, 25, 4, 9, 14, 19]], ["FSP", 4, 0, 1, 3], ["FSP", 4, 4, 2, 3], ["FSP", 4, 8, 3, 3], ["FSP", 4, 12, 4, 3], ["RE", 4, [0, 4, 8, 12, 1, 5, 9, 13, 2, 6, 10, 14, 3, 7, 11, 15]], ["CA", 3, 4, 11], ["CHR", 2, "shared", [3]], ["CA", 3, 4, 13], ["CHR", 1, "shared", [4]], ["CA", 2, 5, 13], ["CI", 1], ["FU", 6, [0, 1, 2, 3]], ["AN", 6, 0, 5], ["FU", 6, [1, 2, 3, 4]], ["AN", 6, 1, 4], ["FU", 6, [2, 3, 4, 5]], ["AN", 6, 2, 6], ["FU", 4, [0, 1, 2, 3]], ["SP", 4, 0, 5, [5], 1], ["AN", 4, 1, 2], ["FFSP", 4, 0, [4, 3, 2, 1], 1, 1], ["AN", 4, 1, 6], ["FU", 2, [0, 1, 2, 3]], ["SP", 2, 0, 10, [1], 1], ["AN", 2, 1, 2], ["FFSP", 2, 0, [4, 3, 2, 1], 1, 1], ["AN", 2, 1, 6], ["PR", 5, 0, "auto_unroll_max_step$512"]]]], "r": [[0.0377607], 0, 3.17073, 1637780892], "v": "v0.6"}
{"i": [["[\"depthwise_conv2d_layer\", 128, 336, 42, 42, 5, 5, 2, \"SAME\"]", "cuda -keys=cuda,gpu -max_num_threads=1024 -thread_warp_size=32", [-1, 16, 64, 49152, 2147483647, 1024, 8, 32], "", 0, []], [[], [["CHW", 3, "local"], ["SP", 3, 0, 128, [2, 16, 1, 1], 1], ["SP", 3, 5, 336, [1, 3, 1, 2], 1], ["SP", 3, 10, 21, [1, 1, 1, 3], 1], ["SP", 3, 15, 21, [1, 1, 1, 1], 1], ["SP", 3, 20, 5, [1, 5], 1], ["SP", 3, 23, 5, [1, 5], 1], ["RE", 3, [0, 5, 10, 15, 1, 6, 11, 16, 2, 7, 12, 17, 20, 23, 21, 24, 3, 8, 13, 18, 22, 25, 4, 9, 14, 19]], ["FSP", 4, 0, 1, 3], ["FSP", 4, 4, 2, 3], ["FSP", 4, 8, 3, 3], ["FSP", 4, 12, 4, 3], ["RE", 4, [0, 4, 8, 12, 1, 5, 9, 13, 2, 6, 10, 14, 3, 7, 11, 15]], ["CA", 3, 4, 11], ["CHR", 2, "shared", [3]], ["CA", 3, 4, 13], ["CHR", 1, "shared", [4]], ["CA", 2, 5, 13], ["CI", 1], ["FU", 6, [0, 1, 2, 3]], ["AN", 6, 0, 5], ["FU", 6, [1, 2, 3, 4]], ["AN", 6, 1, 4], ["FU", 6, [2, 3, 4, 5]], ["AN", 6, 2, 6], ["FU", 4, [0, 1, 2, 3]], ["SP", 4, 0, 10, [1], 1], ["AN", 4, 1, 2], ["FFSP", 4, 0, [4, 3, 2, 1], 1, 1], ["AN", 4, 1, 6], ["FU", 2, [0, 1, 2, 3]], ["SP", 2, 0, 18, [1], 1], ["AN", 2, 1, 2], ["FFSP", 2, 0, [4, 3, 2, 1], 1, 1], ["AN", 2, 1, 6], ["PR", 5, 0, "auto_unroll_max_step$0"]]]], "r": [[0.0158762], 0, 2.57822, 1637780894], "v": "v0.6"}
{"i": [["[\"depthwise_conv2d_layer\", 128, 336, 42, 42, 5, 5, 2, \"SAME\"]", "cuda -keys=cuda,gpu -max_num_threads=1024 -thread_warp_size=32", [-1, 16, 64, 49152, 2147483647, 1024, 8, 32], "", 0, []], [[], [["CHW", 3, "local"], ["SP", 3, 0, 128, [1, 2, 1, 2], 1], ["SP", 3, 5, 336, [1, 1, 2, 6], 1], ["SP", 3, 10, 21, [1, 3, 1, 1], 1], ["SP", 3, 15, 21, [1, 21, 1, 1], 1], ["SP", 3, 20, 5, [1, 1], 1], ["SP", 3, 23, 5, [5, 1], 1], ["RE", 3, [0, 5, 10, 15, 1, 6, 11, 16, 2, 7, 12, 17, 20, 23, 21, 24, 3, 8, 13, 18, 22, 25, 4, 9, 14, 19]], ["FSP", 4, 0, 1, 3], ["FSP", 4, 4, 2, 3], ["FSP", 4, 8, 3, 3], ["FSP", 4, 12, 4, 3], ["RE", 4, [0, 4, 8, 12, 1, 5, 9, 13, 2, 6, 10, 14, 3, 7, 11, 15]], ["CA", 3, 4, 11], ["CHR", 2, "shared", [3]], ["CA", 3, 4, 13], ["CHR", 1, "shared", [4]], ["CA", 2, 5, 13], ["CI", 1], ["FU", 6, [0, 1, 2, 3]], ["AN", 6, 0, 5], ["FU", 6, [1, 2, 3, 4]], ["AN", 6, 1, 4], ["FU", 6, [2, 3, 4, 5]], ["AN", 6, 2, 6], ["FU", 4, [0, 1, 2, 3]], ["SP", 4, 0, 60, [20], 1], ["AN", 4, 1, 2], ["FFSP", 4, 0, [4, 3, 2, 1], 1, 1], ["AN", 4, 1, 6], ["FU", 2, [0, 1, 2, 3]], ["SP", 2, 0, 120, [1], 1], ["AN", 2, 1, 2], ["FFSP", 2, 0, [4, 3, 2, 1], 1, 1], ["AN", 2, 1, 6], ["PR", 5, 0, "auto_unroll_max_step$0"]]]], "r": [[0.00924493], 0, 2.60874, 1637780896], "v": "v0.6"}
{"i": [["[\"depthwise_conv2d_layer\", 128, 336, 42, 42, 5, 5, 2, \"SAME\"]", "cuda -keys=cuda,gpu -max_num_threads=1024 -thread_warp_size=32", [-1, 16, 64, 49152, 2147483647, 1024, 8, 32], "", 0, []], [[], [["CHW", 3, "local"], ["SP", 3, 0, 128, [4, 2, 4, 1], 1], ["SP", 3, 5, 336, [2, 2, 1, 1], 1], ["SP", 3, 10, 21, [1, 3, 1, 1], 1], ["SP", 3, 15, 21, [1, 7, 1, 1], 1], ["SP", 3, 20, 5, [1, 1], 1], ["SP", 3, 23, 5, [1, 5], 1], ["RE", 3, [0, 5, 10, 15, 1, 6, 11, 16, 2, 7, 12, 17, 20, 23, 21, 24, 3, 8, 13, 18, 22, 25, 4, 9, 14, 19]], ["FSP", 4, 0, 1, 3], ["FSP", 4, 4, 2, 3], ["FSP", 4, 8, 3, 3], ["FSP", 4, 12, 4, 3], ["RE", 4, [0, 4, 8, 12, 1, 5, 9, 13, 2, 6, 10, 14, 3, 7, 11, 15]], ["CA", 3, 4, 11], ["CHR", 2, "shared", [3]], ["CA", 3, 4, 13], ["CHR", 1, "shared", [4]], ["CA", 2, 5, 13], ["CI", 1], ["FU", 6, [0, 1, 2, 3]], ["AN", 6, 0, 5], ["FU", 6, [1, 2, 3, 4]], ["AN", 6, 1, 4], ["FU", 6, [2, 3, 4, 5]], ["AN", 6, 2, 6], ["FU", 4, [0, 1, 2, 3]], ["SP", 4, 0, 25, [1], 1], ["AN", 4, 1, 2], ["FFSP", 4, 0, [4, 3, 2, 1], 1, 1], ["AN", 4, 1, 6], ["FU", 2, [0, 1, 2, 3]], ["SP", 2, 0, 50, [1], 1], ["AN", 2, 1, 2], ["FFSP", 2, 0, [4, 3, 2, 1], 1, 1], ["AN", 2, 1, 6], ["PR", 5, 0, "auto_unroll_max_step$1024"]]]], "r": [[0.00492269], 0, 4.42612, 1637780899], "v": "v0.6"}
{"i": [["[\"depthwise_conv2d_layer\", 128, 336, 42, 42, 5, 5, 2, \"SAME\"]", "cuda -keys=cuda,gpu -max_num_threads=1024 -thread_warp_size=32", [-1, 16, 64, 49152, 2147483647, 1024, 8, 32], "", 0, []], [[], [["CHW", 3, "local"], ["SP", 3, 0, 128, [1, 4, 1, 8], 1], ["SP", 3, 5, 336, [1, 3, 2, 1], 1], ["SP", 3, 10, 21, [1, 3, 1, 1], 1], ["SP", 3, 15, 21, [1, 1, 1, 3], 1], ["SP", 3, 20, 5, [1, 1], 1], ["SP", 3, 23, 5, [1, 1], 1], ["RE", 3, [0, 5, 10, 15, 1, 6, 11, 16, 2, 7, 12, 17, 20, 23, 21, 24, 3, 8, 13, 18, 22, 25, 4, 9, 14, 19]], ["FSP", 4, 0, 1, 3], ["FSP", 4, 4, 2, 3], ["FSP", 4, 8, 3, 3], ["FSP", 4, 12, 4, 3], ["RE", 4, [0, 4, 8, 12, 1, 5, 9, 13, 2, 6, 10, 14, 3, 7, 11, 15]], ["CA", 3, 4, 11], ["CHR", 2, "shared", [3]], ["CA", 3, 4, 13], ["CHR", 1, "shared", [4]], ["CA", 2, 5, 13], ["CI", 1], ["FU", 6, [0, 1, 2, 3]], ["AN", 6, 0, 5], ["FU", 6, [1, 2, 3, 4]], ["AN", 6, 1, 4], ["FU", 6, [2, 3, 4, 5]], ["AN", 6, 2, 6], ["FU", 4, [0, 1, 2, 3]], ["SP", 4, 0, 2, [2], 1], ["AN", 4, 1, 2], ["FFSP", 4, 0, [4, 3, 2, 1], 1, 1], ["AN", 4, 1, 6], ["FU", 2, [0, 1, 2, 3]], ["SP", 2, 0, 80, [1], 1], ["AN", 2, 1, 2], ["FFSP", 2, 0, [4, 3, 2, 1], 1, 1], ["AN", 2, 1, 6], ["PR", 5, 0, "auto_unroll_max_step$1024"]]]], "r": [[0.0229169], 0, 9.07929, 1637780902], "v": "v0.6"}
{"i": [["[\"depthwise_conv2d_layer\", 128, 336, 42, 42, 5, 5, 2, \"SAME\"]", "cuda -keys=cuda,gpu -max_num_threads=1024 -thread_warp_size=32", [-1, 16, 64, 49152, 2147483647, 1024, 8, 32], "", 0, []], [[], [["CHW", 3, "local"], ["SP", 3, 0, 128, [1, 8, 4, 1], 1], ["SP", 3, 5, 336, [1, 1, 4, 1], 1], ["SP", 3, 10, 21, [3, 1, 1, 1], 1], ["SP", 3, 15, 21, [1, 7, 1, 1], 1], ["SP", 3, 20, 5, [1, 1], 1], ["SP", 3, 23, 5, [5, 1], 1], ["RE", 3, [0, 5, 10, 15, 1, 6, 11, 16, 2, 7, 12, 17, 20, 23, 21, 24, 3, 8, 13, 18, 22, 25, 4, 9, 14, 19]], ["FSP", 4, 0, 1, 3], ["FSP", 4, 4, 2, 3], ["FSP", 4, 8, 3, 3], ["FSP", 4, 12, 4, 3], ["RE", 4, [0, 4, 8, 12, 1, 5, 9, 13, 2, 6, 10, 14, 3, 7, 11, 15]], ["CA", 3, 4, 11], ["CHR", 2, "shared", [3]], ["CA", 3, 4, 13], ["CHR", 1, "shared", [4]], ["CA", 2, 5, 13], ["CI", 1], ["FU", 6, [0, 1, 2, 3]], ["AN", 6, 0, 5], ["FU", 6, [1, 2, 3, 4]], ["AN", 6, 1, 4], ["FU", 6, [2, 3, 4, 5]], ["AN", 6, 2, 6], ["FU", 4, [0, 1, 2, 3]], ["SP", 4, 0, 20, [10], 1], ["AN", 4, 1, 2], ["FFSP", 4, 0, [4, 3, 2, 1], 1, 1], ["AN", 4, 1, 6], ["FU", 2, [0, 1, 2, 3]], ["SP", 2, 0, 80, [1], 1], ["AN", 2, 1, 2], ["FFSP", 2, 0, [4, 3, 2, 1], 1, 1], ["AN", 2, 1, 6], ["PR", 5, 0, "auto_unroll_max_step$16"]]]], "r": [[0.0197825], 0, 2.58452, 1637780917], "v": "v0.6"}
{"i": [["[\"depthwise_conv2d_layer\", 128, 336, 42, 42, 5, 5, 2, \"SAME\"]", "cuda -keys=cuda,gpu -max_num_threads=1024 -thread_warp_size=32", [-1, 16, 64, 49152, 2147483647, 1024, 8, 32], "", 0, []], [[], [["CHW", 3, "local"], ["SP", 3, 0, 128, [1, 1, 1, 2], 1], ["SP", 3, 5, 336, [2, 6, 1, 1], 1], ["SP", 3, 10, 21, [1, 7, 1, 3], 1], ["SP", 3, 15, 21, [1, 3, 1, 1], 1], ["SP", 3, 20, 5, [1, 5], 1], ["SP", 3, 23, 5, [1, 5], 1], ["RE", 3, [0, 5, 10, 15, 1, 6, 11, 16, 2, 7, 12, 17, 20, 23, 21, 24, 3, 8, 13, 18, 22, 25, 4, 9, 14, 19]], ["FSP", 4, 0, 1, 3], ["FSP", 4, 4, 2, 3], ["FSP", 4, 8, 3, 3], ["FSP", 4, 12, 4, 3], ["RE", 4, [0, 4, 8, 12, 1, 5, 9, 13, 2, 6, 10, 14, 3, 7, 11, 15]], ["CA", 3, 4, 11], ["CHR", 2, "shared", [3]], ["CA", 3, 4, 13], ["CHR", 1, "shared", [4]], ["CA", 2, 5, 13], ["CI", 1], ["FU", 6, [0, 1, 2, 3]], ["AN", 6, 0, 5], ["FU", 6, [1, 2, 3, 4]], ["AN", 6, 1, 4], ["FU", 6, [2, 3, 4, 5]], ["AN", 6, 2, 6], ["FU", 4, [0, 1, 2, 3]], ["SP", 4, 0, 25, [1], 1], ["AN", 4, 1, 2], ["FFSP", 4, 0, [4, 3, 2, 1], 1, 1], ["AN", 4, 1, 6], ["FU", 2, [0, 1, 2, 3]], ["SP", 2, 0, 50, [1], 1], ["AN", 2, 1, 2], ["FFSP", 2, 0, [4, 3, 2, 1], 1, 1], ["AN", 2, 1, 6], ["PR", 5, 0, "auto_unroll_max_step$512"]]]], "r": [[0.00195236], 0, 3.4908, 1637780919], "v": "v0.6"}
