artifacts/microbenchmark/tvm/ansor/elementwise/ansor_relu_128_168_83_83.log
{"i": [["[\"relu_layer\", 128, 168, 83, 83]", "cuda -keys=cuda,gpu -max_num_threads=1024 -thread_warp_size=32", [-1, 16, 64, 49152, 2147483647, 1024, 8, 32], "", 0, []], [[], [["FU", 1, [0, 1, 2, 3]], ["SP", 1, 0, 148141056, [8], 1], ["AN", 1, 0, 5], ["AN", 1, 1, 6]]]], "r": [[0.0288834], 0, 5.10455, 1639296353], "v": "v0.6"}
{"i": [["[\"relu_layer\", 128, 168, 83, 83]", "cuda -keys=cuda,gpu -max_num_threads=1024 -thread_warp_size=32", [-1, 16, 64, 49152, 2147483647, 1024, 8, 32], "", 0, []], [[], [["FU", 1, [0, 1, 2, 3]], ["SP", 1, 0, 148141056, [6], 1], ["AN", 1, 0, 5], ["AN", 1, 1, 6]]]], "r": [[0.0385073], 0, 4.75414, 1639296358], "v": "v0.6"}
{"i": [["[\"relu_layer\", 128, 168, 83, 83]", "cuda -keys=cuda,gpu -max_num_threads=1024 -thread_warp_size=32", [-1, 16, 64, 49152, 2147483647, 1024, 8, 32], "", 0, []], [[], [["FU", 1, [0, 1, 2, 3]], ["SP", 1, 0, 148141056, [2], 1], ["AN", 1, 0, 5], ["AN", 1, 1, 6]]]], "r": [[0.115521], 0, 4.82521, 1639296362], "v": "v0.6"}
{"i": [["[\"relu_layer\", 128, 168, 83, 83]", "cuda -keys=cuda,gpu -max_num_threads=1024 -thread_warp_size=32", [-1, 16, 64, 49152, 2147483647, 1024, 8, 32], "", 0, []], [[], [["FU", 1, [0, 1, 2, 3]], ["SP", 1, 0, 148141056, [56], 1], ["AN", 1, 0, 5], ["AN", 1, 1, 6]]]], "r": [[0.00412902], 0, 4.73326, 1639296367], "v": "v0.6"}
{"i": [["[\"relu_layer\", 128, 168, 83, 83]", "cuda -keys=cuda,gpu -max_num_threads=1024 -thread_warp_size=32", [-1, 16, 64, 49152, 2147483647, 1024, 8, 32], "", 0, []], [[], [["FU", 1, [0, 1, 2, 3]], ["SP", 1, 0, 148141056, [14], 1], ["AN", 1, 0, 5], ["AN", 1, 1, 6]]]], "r": [[0.0165056], 0, 4.66878, 1639296371], "v": "v0.6"}
{"i": [["[\"relu_layer\", 128, 168, 83, 83]", "cuda -keys=cuda,gpu -max_num_threads=1024 -thread_warp_size=32", [-1, 16, 64, 49152, 2147483647, 1024, 8, 32], "", 0, []], [[], [["FU", 1, [0, 1, 2, 3]], ["SP", 1, 0, 148141056, [64], 1], ["AN", 1, 0, 5], ["AN", 1, 1, 6]]]], "r": [[0.00361337], 0, 5.17654, 1639296376], "v": "v0.6"}
{"i": [["[\"relu_layer\", 128, 168, 83, 83]", "cuda -keys=cuda,gpu -max_num_threads=1024 -thread_warp_size=32", [-1, 16, 64, 49152, 2147483647, 1024, 8, 32], "", 0, []], [[], [["FU", 1, [0, 1, 2, 3]], ["SP", 1, 0, 148141056, [21], 1], ["AN", 1, 0, 5], ["AN", 1, 1, 6]]]], "r": [[0.0110037], 0, 4.8483, 1639296381], "v": "v0.6"}
{"i": [["[\"relu_layer\", 128, 168, 83, 83]", "cuda -keys=cuda,gpu -max_num_threads=1024 -thread_warp_size=32", [-1, 16, 64, 49152, 2147483647, 1024, 8, 32], "", 0, []], [[], [["FU", 1, [0, 1, 2, 3]], ["SP", 1, 0, 148141056, [32], 1], ["AN", 1, 0, 5], ["AN", 1, 1, 6]]]], "r": [[0.00722206], 0, 4.6494, 1639296385], "v": "v0.6"}
{"i": [["[\"relu_layer\", 128, 168, 83, 83]", "cuda -keys=cuda,gpu -max_num_threads=1024 -thread_warp_size=32", [-1, 16, 64, 49152, 2147483647, 1024, 8, 32], "", 0, []], [[], [["FU", 1, [0, 1, 2, 3]], ["SP", 1, 0, 148141056, [42], 1], ["AN", 1, 0, 5], ["AN", 1, 1, 6]]]], "r": [[0.0055045], 0, 4.76647, 1639296390], "v": "v0.6"}
{"i": [["[\"relu_layer\", 128, 168, 83, 83]", "cuda -keys=cuda,gpu -max_num_threads=1024 -thread_warp_size=32", [-1, 16, 64, 49152, 2147483647, 1024, 8, 32], "", 0, []], [[], [["FU", 1, [0, 1, 2, 3]], ["SP", 1, 0, 148141056, [12], 1], ["AN", 1, 0, 5], ["AN", 1, 1, 6]]]], "r": [[0.0192629], 0, 5.21986, 1639296395], "v": "v0.6"}
{"i": [["[\"relu_layer\", 128, 168, 83, 83]", "cuda -keys=cuda,gpu -max_num_threads=1024 -thread_warp_size=32", [-1, 16, 64, 49152, 2147483647, 1024, 8, 32], "", 0, []], [[], [["FU", 1, [0, 1, 2, 3]], ["SP", 1, 0, 148141056, [28], 1], ["AN", 1, 0, 5], ["AN", 1, 1, 6]]]], "r": [[0.00825337], 0, 4.57198, 1639296399], "v": "v0.6"}
{"i": [["[\"relu_layer\", 128, 168, 83, 83]", "cuda -keys=cuda,gpu -max_num_threads=1024 -thread_warp_size=32", [-1, 16, 64, 49152, 2147483647, 1024, 8, 32], "", 0, []], [[], [["FU", 1, [0, 1, 2, 3]], ["SP", 1, 0, 148141056, [16], 1], ["AN", 1, 0, 5], ["AN", 1, 1, 6]]]], "r": [[0.0144426], 0, 4.58922, 1639296403], "v": "v0.6"}
{"i": [["[\"relu_layer\", 128, 168, 83, 83]", "cuda -keys=cuda,gpu -max_num_threads=1024 -thread_warp_size=32", [-1, 16, 64, 49152, 2147483647, 1024, 8, 32], "", 0, []], [[], [["FU", 1, [0, 1, 2, 3]], ["SP", 1, 0, 148141056, [24], 1], ["AN", 1, 0, 5], ["AN", 1, 1, 6]]]], "r": [[0.00962913], 0, 4.59963, 1639296408], "v": "v0.6"}
{"i": [["[\"relu_layer\", 128, 168, 83, 83]", "cuda -keys=cuda,gpu -max_num_threads=1024 -thread_warp_size=32", [-1, 16, 64, 49152, 2147483647, 1024, 8, 32], "", 0, []], [[], [["FU", 1, [0, 1, 2, 3]], ["SP", 1, 0, 148141056, [7], 1], ["AN", 1, 0, 5], ["AN", 1, 1, 6]]]], "r": [[0.0330079], 0, 4.76458, 1639296412], "v": "v0.6"}
{"i": [["[\"relu_layer\", 128, 168, 83, 83]", "cuda -keys=cuda,gpu -max_num_threads=1024 -thread_warp_size=32", [-1, 16, 64, 49152, 2147483647, 1024, 8, 32], "", 0, []], [[], [["FU", 1, [0, 1, 2, 3]], ["SP", 1, 0, 148141056, [4], 1], ["AN", 1, 0, 5], ["AN", 1, 1, 6]]]], "r": [[0.0577635], 0, 4.87711, 1639296417], "v": "v0.6"}
{"i": [["[\"relu_layer\", 128, 168, 83, 83]", "cuda -keys=cuda,gpu -max_num_threads=1024 -thread_warp_size=32", [-1, 16, 64, 49152, 2147483647, 1024, 8, 32], "", 0, []], [[], [["FU", 1, [0, 1, 2, 3]], ["SP", 1, 0, 148141056, [48], 1], ["AN", 1, 0, 5], ["AN", 1, 1, 6]]]], "r": [[0.00481646], 0, 4.52722, 1639296421], "v": "v0.6"}
{"i": [["[\"relu_layer\", 128, 168, 83, 83]", "cuda -keys=cuda,gpu -max_num_threads=1024 -thread_warp_size=32", [-1, 16, 64, 49152, 2147483647, 1024, 8, 32], "", 0, []], [[], [["FU", 1, [0, 1, 2, 3]], ["SP", 1, 0, 148141056, [1], 1], ["AN", 1, 0, 5], ["AN", 1, 1, 6]]]], "r": [[0.231027], 0, 5.37626, 1639296426], "v": "v0.6"}
{"i": [["[\"relu_layer\", 128, 168, 83, 83]", "cuda -keys=cuda,gpu -max_num_threads=1024 -thread_warp_size=32", [-1, 16, 64, 49152, 2147483647, 1024, 8, 32], "", 0, []], [[], [["FU", 1, [0, 1, 2, 3]], ["SP", 1, 0, 148141056, [3], 1], ["AN", 1, 0, 5], ["AN", 1, 1, 6]]]], "r": [[0.077017], 0, 4.91151, 1639296431], "v": "v0.6"}
