artifacts/microbenchmark/tvm/ansor/elementwise/ansor_relu_128_1024_14_14.log
{"i": [["[\"relu_layer\", 128, 1024, 14, 14]", "cuda -keys=cuda,gpu -max_num_threads=1024 -thread_warp_size=32", [-1, 16, 64, 49152, 2147483647, 1024, 8, 32], "", 0, []], [[], [["FU", 1, [0, 1, 2, 3]], ["SP", 1, 0, 25690112, [2], 1], ["AN", 1, 0, 5], ["AN", 1, 1, 6]]]], "r": [[0.0200981], 0, 1.62079, 1639295441], "v": "v0.6"}
{"i": [["[\"relu_layer\", 128, 1024, 14, 14]", "cuda -keys=cuda,gpu -max_num_threads=1024 -thread_warp_size=32", [-1, 16, 64, 49152, 2147483647, 1024, 8, 32], "", 0, []], [[], [["FU", 1, [0, 1, 2, 3]], ["SP", 1, 0, 25690112, [32], 1], ["AN", 1, 0, 5], ["AN", 1, 1, 6]]]], "r": [[0.00125437], 0, 2.01571, 1639295443], "v": "v0.6"}
{"i": [["[\"relu_layer\", 128, 1024, 14, 14]", "cuda -keys=cuda,gpu -max_num_threads=1024 -thread_warp_size=32", [-1, 16, 64, 49152, 2147483647, 1024, 8, 32], "", 0, []], [[], [["FU", 1, [0, 1, 2, 3]], ["SP", 1, 0, 25690112, [56], 1], ["AN", 1, 0, 5], ["AN", 1, 1, 6]]]], "r": [[0.000718016], 0, 2.02476, 1639295445], "v": "v0.6"}
{"i": [["[\"relu_layer\", 128, 1024, 14, 14]", "cuda -keys=cuda,gpu -max_num_threads=1024 -thread_warp_size=32", [-1, 16, 64, 49152, 2147483647, 1024, 8, 32], "", 0, []], [[], [["FU", 1, [0, 1, 2, 3]], ["SP", 1, 0, 25690112, [8], 1], ["AN", 1, 0, 5], ["AN", 1, 1, 6]]]], "r": [[0.00501029], 0, 1.57212, 1639295446], "v": "v0.6"}
{"i": [["[\"relu_layer\", 128, 1024, 14, 14]", "cuda -keys=cuda,gpu -max_num_threads=1024 -thread_warp_size=32", [-1, 16, 64, 49152, 2147483647, 1024, 8, 32], "", 0, []], [[], [["FU", 1, [0, 1, 2, 3]], ["SP", 1, 0, 25690112, [49], 1], ["AN", 1, 0, 5], ["AN", 1, 1, 6]]]], "r": [[0.000820183], 0, 2.00907, 1639295448], "v": "v0.6"}
{"i": [["[\"relu_layer\", 128, 1024, 14, 14]", "cuda -keys=cuda,gpu -max_num_threads=1024 -thread_warp_size=32", [-1, 16, 64, 49152, 2147483647, 1024, 8, 32], "", 0, []], [[], [["FU", 1, [0, 1, 2, 3]], ["SP", 1, 0, 25690112, [4], 1], ["AN", 1, 0, 5], ["AN", 1, 1, 6]]]], "r": [[0.0100182], 0, 1.57685, 1639295449], "v": "v0.6"}
{"i": [["[\"relu_layer\", 128, 1024, 14, 14]", "cuda -keys=cuda,gpu -max_num_threads=1024 -thread_warp_size=32", [-1, 16, 64, 49152, 2147483647, 1024, 8, 32], "", 0, []], [[], [["FU", 1, [0, 1, 2, 3]], ["SP", 1, 0, 25690112, [64], 1], ["AN", 1, 0, 5], ["AN", 1, 1, 6]]]], "r": [[0.000628603], 0, 2.02306, 1639295451], "v": "v0.6"}
{"i": [["[\"relu_layer\", 128, 1024, 14, 14]", "cuda -keys=cuda,gpu -max_num_threads=1024 -thread_warp_size=32", [-1, 16, 64, 49152, 2147483647, 1024, 8, 32], "", 0, []], [[], [["FU", 1, [0, 1, 2, 3]], ["SP", 1, 0, 25690112, [28], 1], ["AN", 1, 0, 5], ["AN", 1, 1, 6]]]], "r": [[0.00143333], 0, 2.04408, 1639295453], "v": "v0.6"}
{"i": [["[\"relu_layer\", 128, 1024, 14, 14]", "cuda -keys=cuda,gpu -max_num_threads=1024 -thread_warp_size=32", [-1, 16, 64, 49152, 2147483647, 1024, 8, 32], "", 0, []], [[], [["FU", 1, [0, 1, 2, 3]], ["SP", 1, 0, 25690112, [16], 1], ["AN", 1, 0, 5], ["AN", 1, 1, 6]]]], "r": [[0.00250648], 0, 1.5732, 1639295454], "v": "v0.6"}
{"i": [["[\"relu_layer\", 128, 1024, 14, 14]", "cuda -keys=cuda,gpu -max_num_threads=1024 -thread_warp_size=32", [-1, 16, 64, 49152, 2147483647, 1024, 8, 32], "", 0, []], [[], [["FU", 1, [0, 1, 2, 3]], ["SP", 1, 0, 25690112, [14], 1], ["AN", 1, 0, 5], ["AN", 1, 1, 6]]]], "r": [[0.00286403], 0, 1.5718, 1639295456], "v": "v0.6"}
{"i": [["[\"relu_layer\", 128, 1024, 14, 14]", "cuda -keys=cuda,gpu -max_num_threads=1024 -thread_warp_size=32", [-1, 16, 64, 49152, 2147483647, 1024, 8, 32], "", 0, []], [[], [["FU", 1, [0, 1, 2, 3]], ["SP", 1, 0, 25690112, [1], 1], ["AN", 1, 0, 5], ["AN", 1, 1, 6]]]], "r": [[0.0400655], 0, 1.75795, 1639295457], "v": "v0.6"}
{"i": [["[\"relu_layer\", 128, 1024, 14, 14]", "cuda -keys=cuda,gpu -max_num_threads=1024 -thread_warp_size=32", [-1, 16, 64, 49152, 2147483647, 1024, 8, 32], "", 0, []], [[], [["FU", 1, [0, 1, 2, 3]], ["SP", 1, 0, 25690112, [7], 1], ["AN", 1, 0, 5], ["AN", 1, 1, 6]]]], "r": [[0.00572566], 0, 1.59155, 1639295458], "v": "v0.6"}
