artifacts/microbenchmark/tvm/ansor/elementwise/ansor_relu_128_42_165_165.log
{"i": [["[\"relu_layer\", 128, 42, 165, 165]", "cuda -keys=cuda,gpu -max_num_threads=1024 -thread_warp_size=32", [-1, 16, 64, 49152, 2147483647, 1024, 8, 32], "", 0, []], [[], [["FU", 1, [0, 1, 2, 3]], ["SP", 1, 0, 146361600, [64], 1], ["AN", 1, 0, 5], ["AN", 1, 1, 6]]]], "r": [[0.00357663], 0, 5.2692, 1639296908], "v": "v0.6"}
{"i": [["[\"relu_layer\", 128, 42, 165, 165]", "cuda -keys=cuda,gpu -max_num_threads=1024 -thread_warp_size=32", [-1, 16, 64, 49152, 2147483647, 1024, 8, 32], "", 0, []], [[], [["FU", 1, [0, 1, 2, 3]], ["SP", 1, 0, 146361600, [21], 1], ["AN", 1, 0, 5], ["AN", 1, 1, 6]]]], "r": [[0.0108726], 0, 4.72213, 1639296912], "v": "v0.6"}
{"i": [["[\"relu_layer\", 128, 42, 165, 165]", "cuda -keys=cuda,gpu -max_num_threads=1024 -thread_warp_size=32", [-1, 16, 64, 49152, 2147483647, 1024, 8, 32], "", 0, []], [[], [["FU", 1, [0, 1, 2, 3]], ["SP", 1, 0, 146361600, [28], 1], ["AN", 1, 0, 5], ["AN", 1, 1, 6]]]], "r": [[0.00815496], 0, 4.6351, 1639296917], "v": "v0.6"}
{"i": [["[\"relu_layer\", 128, 42, 165, 165]", "cuda -keys=cuda,gpu -max_num_threads=1024 -thread_warp_size=32", [-1, 16, 64, 49152, 2147483647, 1024, 8, 32], "", 0, []], [[], [["FU", 1, [0, 1, 2, 3]], ["SP", 1, 0, 146361600, [14], 1], ["AN", 1, 0, 5], ["AN", 1, 1, 6]]]], "r": [[0.0163112], 0, 4.83405, 1639296921], "v": "v0.6"}
{"i": [["[\"relu_layer\", 128, 42, 165, 165]", "cuda -keys=cuda,gpu -max_num_threads=1024 -thread_warp_size=32", [-1, 16, 64, 49152, 2147483647, 1024, 8, 32], "", 0, []], [[], [["FU", 1, [0, 1, 2, 3]], ["SP", 1, 0, 146361600, [48], 1], ["AN", 1, 0, 5], ["AN", 1, 1, 6]]]], "r": [[0.00475906], 0, 5.15735, 1639296926], "v": "v0.6"}
{"i": [["[\"relu_layer\", 128, 42, 165, 165]", "cuda -keys=cuda,gpu -max_num_threads=1024 -thread_warp_size=32", [-1, 16, 64, 49152, 2147483647, 1024, 8, 32], "", 0, []], [[], [["FU", 1, [0, 1, 2, 3]], ["SP", 1, 0, 146361600, [16], 1], ["AN", 1, 0, 5], ["AN", 1, 1, 6]]]], "r": [[0.0142695], 0, 4.73019, 1639296930], "v": "v0.6"}
{"i": [["[\"relu_layer\", 128, 42, 165, 165]", "cuda -keys=cuda,gpu -max_num_threads=1024 -thread_warp_size=32", [-1, 16, 64, 49152, 2147483647, 1024, 8, 32], "", 0, []], [[], [["FU", 1, [0, 1, 2, 3]], ["SP", 1, 0, 146361600, [22], 1], ["AN", 1, 0, 5], ["AN", 1, 1, 6]]]], "r": [[0.0103782], 0, 4.8303, 1639296935], "v": "v0.6"}
{"i": [["[\"relu_layer\", 128, 42, 165, 165]", "cuda -keys=cuda,gpu -max_num_threads=1024 -thread_warp_size=32", [-1, 16, 64, 49152, 2147483647, 1024, 8, 32], "", 0, []], [[], [["FU", 1, [0, 1, 2, 3]], ["SP", 1, 0, 146361600, [27], 1], ["AN", 1, 0, 5], ["AN", 1, 1, 6]]]], "r": [[0.00847088], 0, 5.13686, 1639296940], "v": "v0.6"}
{"i": [["[\"relu_layer\", 128, 42, 165, 165]", "cuda -keys=cuda,gpu -max_num_threads=1024 -thread_warp_size=32", [-1, 16, 64, 49152, 2147483647, 1024, 8, 32], "", 0, []], [[], [["FU", 1, [0, 1, 2, 3]], ["SP", 1, 0, 146361600, [2], 1], ["AN", 1, 0, 5], ["AN", 1, 1, 6]]]], "r": [[0.114147], 0, 4.88957, 1639296944], "v": "v0.6"}
{"i": [["[\"relu_layer\", 128, 42, 165, 165]", "cuda -keys=cuda,gpu -max_num_threads=1024 -thread_warp_size=32", [-1, 16, 64, 49152, 2147483647, 1024, 8, 32], "", 0, []], [[], [["FU", 1, [0, 1, 2, 3]], ["SP", 1, 0, 146361600, [10], 1], ["AN", 1, 0, 5], ["AN", 1, 1, 6]]]], "r": [[0.0228298], 0, 4.86626, 1639296949], "v": "v0.6"}
{"i": [["[\"relu_layer\", 128, 42, 165, 165]", "cuda -keys=cuda,gpu -max_num_threads=1024 -thread_warp_size=32", [-1, 16, 64, 49152, 2147483647, 1024, 8, 32], "", 0, []], [[], [["FU", 1, [0, 1, 2, 3]], ["SP", 1, 0, 146361600, [42], 1], ["AN", 1, 0, 5], ["AN", 1, 1, 6]]]], "r": [[0.00543831], 0, 4.71944, 1639296953], "v": "v0.6"}
{"i": [["[\"relu_layer\", 128, 42, 165, 165]", "cuda -keys=cuda,gpu -max_num_threads=1024 -thread_warp_size=32", [-1, 16, 64, 49152, 2147483647, 1024, 8, 32], "", 0, []], [[], [["FU", 1, [0, 1, 2, 3]], ["SP", 1, 0, 146361600, [3], 1], ["AN", 1, 0, 5], ["AN", 1, 1, 6]]]], "r": [[0.0760914], 0, 5.04465, 1639296958], "v": "v0.6"}
{"i": [["[\"relu_layer\", 128, 42, 165, 165]", "cuda -keys=cuda,gpu -max_num_threads=1024 -thread_warp_size=32", [-1, 16, 64, 49152, 2147483647, 1024, 8, 32], "", 0, []], [[], [["FU", 1, [0, 1, 2, 3]], ["SP", 1, 0, 146361600, [54], 1], ["AN", 1, 0, 5], ["AN", 1, 1, 6]]]], "r": [[0.00423103], 0, 4.67895, 1639296962], "v": "v0.6"}
{"i": [["[\"relu_layer\", 128, 42, 165, 165]", "cuda -keys=cuda,gpu -max_num_threads=1024 -thread_warp_size=32", [-1, 16, 64, 49152, 2147483647, 1024, 8, 32], "", 0, []], [[], [["FU", 1, [0, 1, 2, 3]], ["SP", 1, 0, 146361600, [9], 1], ["AN", 1, 0, 5], ["AN", 1, 1, 6]]]], "r": [[0.025366], 0, 4.74916, 1639296966], "v": "v0.6"}
{"i": [["[\"relu_layer\", 128, 42, 165, 165]", "cuda -keys=cuda,gpu -max_num_threads=1024 -thread_warp_size=32", [-1, 16, 64, 49152, 2147483647, 1024, 8, 32], "", 0, []], [[], [["FU", 1, [0, 1, 2, 3]], ["SP", 1, 0, 146361600, [8], 1], ["AN", 1, 0, 5], ["AN", 1, 1, 6]]]], "r": [[0.0285364], 0, 5.038, 1639296971], "v": "v0.6"}
{"i": [["[\"relu_layer\", 128, 42, 165, 165]", "cuda -keys=cuda,gpu -max_num_threads=1024 -thread_warp_size=32", [-1, 16, 64, 49152, 2147483647, 1024, 8, 32], "", 0, []], [[], [["FU", 1, [0, 1, 2, 3]], ["SP", 1, 0, 146361600, [45], 1], ["AN", 1, 0, 5], ["AN", 1, 1, 6]]]], "r": [[0.00507646], 0, 4.88752, 1639296976], "v": "v0.6"}
{"i": [["[\"relu_layer\", 128, 42, 165, 165]", "cuda -keys=cuda,gpu -max_num_threads=1024 -thread_warp_size=32", [-1, 16, 64, 49152, 2147483647, 1024, 8, 32], "", 0, []], [[], [["FU", 1, [0, 1, 2, 3]], ["SP", 1, 0, 146361600, [36], 1], ["AN", 1, 0, 5], ["AN", 1, 1, 6]]]], "r": [[0.00634412], 0, 4.76969, 1639296980], "v": "v0.6"}
{"i": [["[\"relu_layer\", 128, 42, 165, 165]", "cuda -keys=cuda,gpu -max_num_threads=1024 -thread_warp_size=32", [-1, 16, 64, 49152, 2147483647, 1024, 8, 32], "", 0, []], [[], [["FU", 1, [0, 1, 2, 3]], ["SP", 1, 0, 146361600, [24], 1], ["AN", 1, 0, 5], ["AN", 1, 1, 6]]]], "r": [[0.00951432], 0, 5.23694, 1639296985], "v": "v0.6"}
{"i": [["[\"relu_layer\", 128, 42, 165, 165]", "cuda -keys=cuda,gpu -max_num_threads=1024 -thread_warp_size=32", [-1, 16, 64, 49152, 2147483647, 1024, 8, 32], "", 0, []], [[], [["FU", 1, [0, 1, 2, 3]], ["SP", 1, 0, 146361600, [15], 1], ["AN", 1, 0, 5], ["AN", 1, 1, 6]]]], "r": [[0.0152226], 0, 4.78722, 1639296989], "v": "v0.6"}
{"i": [["[\"relu_layer\", 128, 42, 165, 165]", "cuda -keys=cuda,gpu -max_num_threads=1024 -thread_warp_size=32", [-1, 16, 64, 49152, 2147483647, 1024, 8, 32], "", 0, []], [[], [["FU", 1, [0, 1, 2, 3]], ["SP", 1, 0, 146361600, [50], 1], ["AN", 1, 0, 5], ["AN", 1, 1, 6]]]], "r": [[0.00456909], 0, 4.72938, 1639296994], "v": "v0.6"}
{"i": [["[\"relu_layer\", 128, 42, 165, 165]", "cuda -keys=cuda,gpu -max_num_threads=1024 -thread_warp_size=32", [-1, 16, 64, 49152, 2147483647, 1024, 8, 32], "", 0, []], [[], [["FU", 1, [0, 1, 2, 3]], ["SP", 1, 0, 146361600, [12], 1], ["AN", 1, 0, 5], ["AN", 1, 1, 6]]]], "r": [[0.0190246], 0, 4.85667, 1639296998], "v": "v0.6"}
{"i": [["[\"relu_layer\", 128, 42, 165, 165]", "cuda -keys=cuda,gpu -max_num_threads=1024 -thread_warp_size=32", [-1, 16, 64, 49152, 2147483647, 1024, 8, 32], "", 0, []], [[], [["FU", 1, [0, 1, 2, 3]], ["SP", 1, 0, 146361600, [44], 1], ["AN", 1, 0, 5], ["AN", 1, 1, 6]]]], "r": [[0.00519093], 0, 4.78763, 1639297003], "v": "v0.6"}
{"i": [["[\"relu_layer\", 128, 42, 165, 165]", "cuda -keys=cuda,gpu -max_num_threads=1024 -thread_warp_size=32", [-1, 16, 64, 49152, 2147483647, 1024, 8, 32], "", 0, []], [[], [["FU", 1, [0, 1, 2, 3]], ["SP", 1, 0, 146361600, [63], 1], ["AN", 1, 0, 5], ["AN", 1, 1, 6]]]], "r": [[0.00362683], 0, 4.64218, 1639297007], "v": "v0.6"}
{"i": [["[\"relu_layer\", 128, 42, 165, 165]", "cuda -keys=cuda,gpu -max_num_threads=1024 -thread_warp_size=32", [-1, 16, 64, 49152, 2147483647, 1024, 8, 32], "", 0, []], [[], [["FU", 1, [0, 1, 2, 3]], ["SP", 1, 0, 146361600, [60], 1], ["AN", 1, 0, 5], ["AN", 1, 1, 6]]]], "r": [[0.00380785], 0, 4.60624, 1639297011], "v": "v0.6"}
{"i": [["[\"relu_layer\", 128, 42, 165, 165]", "cuda -keys=cuda,gpu -max_num_threads=1024 -thread_warp_size=32", [-1, 16, 64, 49152, 2147483647, 1024, 8, 32], "", 0, []], [[], [["FU", 1, [0, 1, 2, 3]], ["SP", 1, 0, 146361600, [25], 1], ["AN", 1, 0, 5], ["AN", 1, 1, 6]]]], "r": [[0.00913524], 0, 4.6648, 1639297016], "v": "v0.6"}
{"i": [["[\"relu_layer\", 128, 42, 165, 165]", "cuda -keys=cuda,gpu -max_num_threads=1024 -thread_warp_size=32", [-1, 16, 64, 49152, 2147483647, 1024, 8, 32], "", 0, []], [[], [["FU", 1, [0, 1, 2, 3]], ["SP", 1, 0, 146361600, [5], 1], ["AN", 1, 0, 5], ["AN", 1, 1, 6]]]], "r": [[0.0456603], 0, 4.94215, 1639297020], "v": "v0.6"}
{"i": [["[\"relu_layer\", 128, 42, 165, 165]", "cuda -keys=cuda,gpu -max_num_threads=1024 -thread_warp_size=32", [-1, 16, 64, 49152, 2147483647, 1024, 8, 32], "", 0, []], [[], [["FU", 1, [0, 1, 2, 3]], ["SP", 1, 0, 146361600, [56], 1], ["AN", 1, 0, 5], ["AN", 1, 1, 6]]]], "r": [[0.00407978], 0, 4.67623, 1639297025], "v": "v0.6"}
{"i": [["[\"relu_layer\", 128, 42, 165, 165]", "cuda -keys=cuda,gpu -max_num_threads=1024 -thread_warp_size=32", [-1, 16, 64, 49152, 2147483647, 1024, 8, 32], "", 0, []], [[], [["FU", 1, [0, 1, 2, 3]], ["SP", 1, 0, 146361600, [20], 1], ["AN", 1, 0, 5], ["AN", 1, 1, 6]]]], "r": [[0.0114174], 0, 4.70959, 1639297029], "v": "v0.6"}
{"i": [["[\"relu_layer\", 128, 42, 165, 165]", "cuda -keys=cuda,gpu -max_num_threads=1024 -thread_warp_size=32", [-1, 16, 64, 49152, 2147483647, 1024, 8, 32], "", 0, []], [[], [["FU", 1, [0, 1, 2, 3]], ["SP", 1, 0, 146361600, [55], 1], ["AN", 1, 0, 5], ["AN", 1, 1, 6]]]], "r": [[0.00415667], 0, 4.97191, 1639297034], "v": "v0.6"}
{"i": [["[\"relu_layer\", 128, 42, 165, 165]", "cuda -keys=cuda,gpu -max_num_threads=1024 -thread_warp_size=32", [-1, 16, 64, 49152, 2147483647, 1024, 8, 32], "", 0, []], [[], [["FU", 1, [0, 1, 2, 3]], ["SP", 1, 0, 146361600, [11], 1], ["AN", 1, 0, 5], ["AN", 1, 1, 6]]]], "r": [[0.0207545], 0, 4.72504, 1639297038], "v": "v0.6"}
{"i": [["[\"relu_layer\", 128, 42, 165, 165]", "cuda -keys=cuda,gpu -max_num_threads=1024 -thread_warp_size=32", [-1, 16, 64, 49152, 2147483647, 1024, 8, 32], "", 0, []], [[], [["FU", 1, [0, 1, 2, 3]], ["SP", 1, 0, 146361600, [33], 1], ["AN", 1, 0, 5], ["AN", 1, 1, 6]]]], "r": [[0.00692049], 0, 4.6499, 1639297042], "v": "v0.6"}
{"i": [["[\"relu_layer\", 128, 42, 165, 165]", "cuda -keys=cuda,gpu -max_num_threads=1024 -thread_warp_size=32", [-1, 16, 64, 49152, 2147483647, 1024, 8, 32], "", 0, []], [[], [["FU", 1, [0, 1, 2, 3]], ["SP", 1, 0, 146361600, [32], 1], ["AN", 1, 0, 5], ["AN", 1, 1, 6]]]], "r": [[0.00713596], 0, 4.82039, 1639297047], "v": "v0.6"}
{"i": [["[\"relu_layer\", 128, 42, 165, 165]", "cuda -keys=cuda,gpu -max_num_threads=1024 -thread_warp_size=32", [-1, 16, 64, 49152, 2147483647, 1024, 8, 32], "", 0, []], [[], [["FU", 1, [0, 1, 2, 3]], ["SP", 1, 0, 146361600, [1], 1], ["AN", 1, 0, 5], ["AN", 1, 1, 6]]]], "r": [[0.22828], 0, 5.56435, 1639297052], "v": "v0.6"}
{"i": [["[\"relu_layer\", 128, 42, 165, 165]", "cuda -keys=cuda,gpu -max_num_threads=1024 -thread_warp_size=32", [-1, 16, 64, 49152, 2147483647, 1024, 8, 32], "", 0, []], [[], [["FU", 1, [0, 1, 2, 3]], ["SP", 1, 0, 146361600, [6], 1], ["AN", 1, 0, 5], ["AN", 1, 1, 6]]]], "r": [[0.0380789], 0, 4.75225, 1639297057], "v": "v0.6"}
{"i": [["[\"relu_layer\", 128, 42, 165, 165]", "cuda -keys=cuda,gpu -max_num_threads=1024 -thread_warp_size=32", [-1, 16, 64, 49152, 2147483647, 1024, 8, 32], "", 0, []], [[], [["FU", 1, [0, 1, 2, 3]], ["SP", 1, 0, 146361600, [7], 1], ["AN", 1, 0, 5], ["AN", 1, 1, 6]]]], "r": [[0.0326141], 0, 4.79831, 1639297061], "v": "v0.6"}
{"i": [["[\"relu_layer\", 128, 42, 165, 165]", "cuda -keys=cuda,gpu -max_num_threads=1024 -thread_warp_size=32", [-1, 16, 64, 49152, 2147483647, 1024, 8, 32], "", 0, []], [[], [["FU", 1, [0, 1, 2, 3]], ["SP", 1, 0, 146361600, [30], 1], ["AN", 1, 0, 5], ["AN", 1, 1, 6]]]], "r": [[0.00761158], 0, 4.6784, 1639297066], "v": "v0.6"}
{"i": [["[\"relu_layer\", 128, 42, 165, 165]", "cuda -keys=cuda,gpu -max_num_threads=1024 -thread_warp_size=32", [-1, 16, 64, 49152, 2147483647, 1024, 8, 32], "", 0, []], [[], [["FU", 1, [0, 1, 2, 3]], ["SP", 1, 0, 146361600, [18], 1], ["AN", 1, 0, 5], ["AN", 1, 1, 6]]]], "r": [[0.012684], 0, 4.60235, 1639297070], "v": "v0.6"}
{"i": [["[\"relu_layer\", 128, 42, 165, 165]", "cuda -keys=cuda,gpu -max_num_threads=1024 -thread_warp_size=32", [-1, 16, 64, 49152, 2147483647, 1024, 8, 32], "", 0, []], [[], [["FU", 1, [0, 1, 2, 3]], ["SP", 1, 0, 146361600, [35], 1], ["AN", 1, 0, 5], ["AN", 1, 1, 6]]]], "r": [[0.00652519], 0, 4.64156, 1639297074], "v": "v0.6"}
{"i": [["[\"relu_layer\", 128, 42, 165, 165]", "cuda -keys=cuda,gpu -max_num_threads=1024 -thread_warp_size=32", [-1, 16, 64, 49152, 2147483647, 1024, 8, 32], "", 0, []], [[], [["FU", 1, [0, 1, 2, 3]], ["SP", 1, 0, 146361600, [40], 1], ["AN", 1, 0, 5], ["AN", 1, 1, 6]]]], "r": [[0.00571484], 0, 5.06688, 1639297079], "v": "v0.6"}
{"i": [["[\"relu_layer\", 128, 42, 165, 165]", "cuda -keys=cuda,gpu -max_num_threads=1024 -thread_warp_size=32", [-1, 16, 64, 49152, 2147483647, 1024, 8, 32], "", 0, []], [[], [["FU", 1, [0, 1, 2, 3]], ["SP", 1, 0, 146361600, [4], 1], ["AN", 1, 0, 5], ["AN", 1, 1, 6]]]], "r": [[0.0570714], 0, 4.94391, 1639297084], "v": "v0.6"}
