artifacts/microbenchmark/tvm/ansor/elementwise/ansor_relu_128_512_7_7.log
{"i": [["[\"relu_layer\", 128, 512, 7, 7]", "cuda -keys=cuda,gpu -max_num_threads=1024 -thread_warp_size=32", [-1, 16, 64, 49152, 2147483647, 1024, 8, 32], "", 0, []], [[], [["FU", 1, [0, 1, 2, 3]], ["SP", 1, 0, 3211264, [2], 1], ["AN", 1, 0, 5], ["AN", 1, 1, 6]]]], "r": [[0.00251173], 0, 1.41401, 1639296682], "v": "v0.6"}
{"i": [["[\"relu_layer\", 128, 512, 7, 7]", "cuda -keys=cuda,gpu -max_num_threads=1024 -thread_warp_size=32", [-1, 16, 64, 49152, 2147483647, 1024, 8, 32], "", 0, []], [[], [["FU", 1, [0, 1, 2, 3]], ["SP", 1, 0, 3211264, [64], 1], ["AN", 1, 0, 5], ["AN", 1, 1, 6]]]], "r": [[8.08146e-05], 0, 1.46211, 1639296683], "v": "v0.6"}
{"i": [["[\"relu_layer\", 128, 512, 7, 7]", "cuda -keys=cuda,gpu -max_num_threads=1024 -thread_warp_size=32", [-1, 16, 64, 49152, 2147483647, 1024, 8, 32], "", 0, []], [[], [["FU", 1, [0, 1, 2, 3]], ["SP", 1, 0, 3211264, [4], 1], ["AN", 1, 0, 5], ["AN", 1, 1, 6]]]], "r": [[0.00125437], 0, 1.52157, 1639296684], "v": "v0.6"}
{"i": [["[\"relu_layer\", 128, 512, 7, 7]", "cuda -keys=cuda,gpu -max_num_threads=1024 -thread_warp_size=32", [-1, 16, 64, 49152, 2147483647, 1024, 8, 32], "", 0, []], [[], [["FU", 1, [0, 1, 2, 3]], ["SP", 1, 0, 3211264, [14], 1], ["AN", 1, 0, 5], ["AN", 1, 1, 6]]]], "r": [[0.000360102], 0, 1.54314, 1639296685], "v": "v0.6"}
{"i": [["[\"relu_layer\", 128, 512, 7, 7]", "cuda -keys=cuda,gpu -max_num_threads=1024 -thread_warp_size=32", [-1, 16, 64, 49152, 2147483647, 1024, 8, 32], "", 0, []], [[], [["FU", 1, [0, 1, 2, 3]], ["SP", 1, 0, 3211264, [7], 1], ["AN", 1, 0, 5], ["AN", 1, 1, 6]]]], "r": [[0.000717838], 0, 1.77846, 1639296687], "v": "v0.6"}
{"i": [["[\"relu_layer\", 128, 512, 7, 7]", "cuda -keys=cuda,gpu -max_num_threads=1024 -thread_warp_size=32", [-1, 16, 64, 49152, 2147483647, 1024, 8, 32], "", 0, []], [[], [["FU", 1, [0, 1, 2, 3]], ["SP", 1, 0, 3211264, [56], 1], ["AN", 1, 0, 5], ["AN", 1, 1, 6]]]], "r": [[9.18828e-05], 0, 1.70933, 1639296688], "v": "v0.6"}
{"i": [["[\"relu_layer\", 128, 512, 7, 7]", "cuda -keys=cuda,gpu -max_num_threads=1024 -thread_warp_size=32", [-1, 16, 64, 49152, 2147483647, 1024, 8, 32], "", 0, []], [[], [["FU", 1, [0, 1, 2, 3]], ["SP", 1, 0, 3211264, [49], 1], ["AN", 1, 0, 5], ["AN", 1, 1, 6]]]], "r": [[0.000104645], 0, 1.58778, 1639296690], "v": "v0.6"}
{"i": [["[\"relu_layer\", 128, 512, 7, 7]", "cuda -keys=cuda,gpu -max_num_threads=1024 -thread_warp_size=32", [-1, 16, 64, 49152, 2147483647, 1024, 8, 32], "", 0, []], [[], [["FU", 1, [0, 1, 2, 3]], ["SP", 1, 0, 3211264, [32], 1], ["AN", 1, 0, 5], ["AN", 1, 1, 6]]]], "r": [[0.000158953], 0, 1.62071, 1639296691], "v": "v0.6"}
{"i": [["[\"relu_layer\", 128, 512, 7, 7]", "cuda -keys=cuda,gpu -max_num_threads=1024 -thread_warp_size=32", [-1, 16, 64, 49152, 2147483647, 1024, 8, 32], "", 0, []], [[], [["FU", 1, [0, 1, 2, 3]], ["SP", 1, 0, 3211264, [8], 1], ["AN", 1, 0, 5], ["AN", 1, 1, 6]]]], "r": [[0.000628369], 0, 1.63094, 1639296693], "v": "v0.6"}
{"i": [["[\"relu_layer\", 128, 512, 7, 7]", "cuda -keys=cuda,gpu -max_num_threads=1024 -thread_warp_size=32", [-1, 16, 64, 49152, 2147483647, 1024, 8, 32], "", 0, []], [[], [["FU", 1, [0, 1, 2, 3]], ["SP", 1, 0, 3211264, [28], 1], ["AN", 1, 0, 5], ["AN", 1, 1, 6]]]], "r": [[0.000181268], 0, 1.64198, 1639296694], "v": "v0.6"}
{"i": [["[\"relu_layer\", 128, 512, 7, 7]", "cuda -keys=cuda,gpu -max_num_threads=1024 -thread_warp_size=32", [-1, 16, 64, 49152, 2147483647, 1024, 8, 32], "", 0, []], [[], [["FU", 1, [0, 1, 2, 3]], ["SP", 1, 0, 3211264, [1], 1], ["AN", 1, 0, 5], ["AN", 1, 1, 6]]]], "r": [[0.00501011], 0, 1.17048, 1639296695], "v": "v0.6"}
{"i": [["[\"relu_layer\", 128, 512, 7, 7]", "cuda -keys=cuda,gpu -max_num_threads=1024 -thread_warp_size=32", [-1, 16, 64, 49152, 2147483647, 1024, 8, 32], "", 0, []], [[], [["FU", 1, [0, 1, 2, 3]], ["SP", 1, 0, 3211264, [16], 1], ["AN", 1, 0, 5], ["AN", 1, 1, 6]]]], "r": [[0.000315346], 0, 1.4991, 1639296696], "v": "v0.6"}
