artifacts/microbenchmark/tvm/ansor/elementwise/ansor_relu_128_512_14_14.log
{"i": [["[\"relu_layer\", 128, 512, 14, 14]", "cuda -keys=cuda,gpu -max_num_threads=1024 -thread_warp_size=32", [-1, 16, 64, 49152, 2147483647, 1024, 8, 32], "", 0, []], [[], [["FU", 1, [0, 1, 2, 3]], ["SP", 1, 0, 12845056, [28], 1], ["AN", 1, 0, 5], ["AN", 1, 1, 6]]]], "r": [[0.000719136], 0, 1.63519, 1639295477], "v": "v0.6"}
{"i": [["[\"relu_layer\", 128, 512, 14, 14]", "cuda -keys=cuda,gpu -max_num_threads=1024 -thread_warp_size=32", [-1, 16, 64, 49152, 2147483647, 1024, 8, 32], "", 0, []], [[], [["FU", 1, [0, 1, 2, 3]], ["SP", 1, 0, 12845056, [49], 1], ["AN", 1, 0, 5], ["AN", 1, 1, 6]]]], "r": [[0.000411324], 0, 1.7336, 1639295478], "v": "v0.6"}
{"i": [["[\"relu_layer\", 128, 512, 14, 14]", "cuda -keys=cuda,gpu -max_num_threads=1024 -thread_warp_size=32", [-1, 16, 64, 49152, 2147483647, 1024, 8, 32], "", 0, []], [[], [["FU", 1, [0, 1, 2, 3]], ["SP", 1, 0, 12845056, [4], 1], ["AN", 1, 0, 5], ["AN", 1, 1, 6]]]], "r": [[0.00501016], 0, 1.2646, 1639295479], "v": "v0.6"}
{"i": [["[\"relu_layer\", 128, 512, 14, 14]", "cuda -keys=cuda,gpu -max_num_threads=1024 -thread_warp_size=32", [-1, 16, 64, 49152, 2147483647, 1024, 8, 32], "", 0, []], [[], [["FU", 1, [0, 1, 2, 3]], ["SP", 1, 0, 12845056, [7], 1], ["AN", 1, 0, 5], ["AN", 1, 1, 6]]]], "r": [[0.00286396], 0, 1.22695, 1639295480], "v": "v0.6"}
{"i": [["[\"relu_layer\", 128, 512, 14, 14]", "cuda -keys=cuda,gpu -max_num_threads=1024 -thread_warp_size=32", [-1, 16, 64, 49152, 2147483647, 1024, 8, 32], "", 0, []], [[], [["FU", 1, [0, 1, 2, 3]], ["SP", 1, 0, 12845056, [16], 1], ["AN", 1, 0, 5], ["AN", 1, 1, 6]]]], "r": [[0.00125446], 0, 1.74204, 1639295482], "v": "v0.6"}
{"i": [["[\"relu_layer\", 128, 512, 14, 14]", "cuda -keys=cuda,gpu -max_num_threads=1024 -thread_warp_size=32", [-1, 16, 64, 49152, 2147483647, 1024, 8, 32], "", 0, []], [[], [["FU", 1, [0, 1, 2, 3]], ["SP", 1, 0, 12845056, [2], 1], ["AN", 1, 0, 5], ["AN", 1, 1, 6]]]], "r": [[0.0100179], 0, 1.29458, 1639295483], "v": "v0.6"}
{"i": [["[\"relu_layer\", 128, 512, 14, 14]", "cuda -keys=cuda,gpu -max_num_threads=1024 -thread_warp_size=32", [-1, 16, 64, 49152, 2147483647, 1024, 8, 32], "", 0, []], [[], [["FU", 1, [0, 1, 2, 3]], ["SP", 1, 0, 12845056, [8], 1], ["AN", 1, 0, 5], ["AN", 1, 1, 6]]]], "r": [[0.00250633], 0, 1.47681, 1639295484], "v": "v0.6"}
{"i": [["[\"relu_layer\", 128, 512, 14, 14]", "cuda -keys=cuda,gpu -max_num_threads=1024 -thread_warp_size=32", [-1, 16, 64, 49152, 2147483647, 1024, 8, 32], "", 0, []], [[], [["FU", 1, [0, 1, 2, 3]], ["SP", 1, 0, 12845056, [32], 1], ["AN", 1, 0, 5], ["AN", 1, 1, 6]]]], "r": [[0.000628392], 0, 1.7074, 1639295485], "v": "v0.6"}
{"i": [["[\"relu_layer\", 128, 512, 14, 14]", "cuda -keys=cuda,gpu -max_num_threads=1024 -thread_warp_size=32", [-1, 16, 64, 49152, 2147483647, 1024, 8, 32], "", 0, []], [[], [["FU", 1, [0, 1, 2, 3]], ["SP", 1, 0, 12845056, [64], 1], ["AN", 1, 0, 5], ["AN", 1, 1, 6]]]], "r": [[0.000315474], 0, 1.73637, 1639295487], "v": "v0.6"}
{"i": [["[\"relu_layer\", 128, 512, 14, 14]", "cuda -keys=cuda,gpu -max_num_threads=1024 -thread_warp_size=32", [-1, 16, 64, 49152, 2147483647, 1024, 8, 32], "", 0, []], [[], [["FU", 1, [0, 1, 2, 3]], ["SP", 1, 0, 12845056, [1], 1], ["AN", 1, 0, 5], ["AN", 1, 1, 6]]]], "r": [[0.0200339], 0, 1.32644, 1639295488], "v": "v0.6"}
{"i": [["[\"relu_layer\", 128, 512, 14, 14]", "cuda -keys=cuda,gpu -max_num_threads=1024 -thread_warp_size=32", [-1, 16, 64, 49152, 2147483647, 1024, 8, 32], "", 0, []], [[], [["FU", 1, [0, 1, 2, 3]], ["SP", 1, 0, 12845056, [56], 1], ["AN", 1, 0, 5], ["AN", 1, 1, 6]]]], "r": [[0.000360217], 0, 1.71594, 1639295489], "v": "v0.6"}
{"i": [["[\"relu_layer\", 128, 512, 14, 14]", "cuda -keys=cuda,gpu -max_num_threads=1024 -thread_warp_size=32", [-1, 16, 64, 49152, 2147483647, 1024, 8, 32], "", 0, []], [[], [["FU", 1, [0, 1, 2, 3]], ["SP", 1, 0, 12845056, [14], 1], ["AN", 1, 0, 5], ["AN", 1, 1, 6]]]], "r": [[0.00143328], 0, 1.73119, 1639295491], "v": "v0.6"}
