artifacts/kernel_db/ansor_kernels/fused_conv_bias_relu_expr_S1D1P1_64_16_32_32_16_3_3_ansor/fused_conv_bias_relu_expr_S1D1P1_64_16_32_32_16_3_3_ansor/tune.log
{"i": [["[\"get_expr\", \"fused_conv_bias_relu_expr_S1D1P1\", [64, 16, 32, 32, 16, 3, 3]]", "cuda -keys=cuda,gpu -max_num_threads=1024 -thread_warp_size=32", [-1, 16, 64, 49152, 2147483647, 1024, 8, 32], "", 0, []], [[], [["SP", 4, 0, 16, [2, 2, 2, 2], 1], ["SP", 4, 5, 65536, [1, 64, 1, 1], 1], ["SP", 4, 10, 144, [3, 24], 1], ["RE", 4, [0, 5, 1, 6, 2, 7, 10, 11, 3, 8, 12, 4, 9]], ["FSP", 6, 0, 0, 3], ["FSP", 6, 4, 1, 3], ["RE", 6, [0, 4, 1, 5, 2, 6, 3, 7]], ["CA", 4, 6, 5], ["CHR", 3, "shared", [4]], ["CA", 4, 5, 6], ["CI", 3], ["CHR", 1, "shared", [5]], ["CA", 2, 6, 6], ["CI", 1], ["FU", 8, [0, 1]], ["AN", 8, 0, 5], ["FU", 8, [1, 2]], ["AN", 8, 1, 4], ["FU", 8, [2, 3]], ["AN", 8, 2, 6], ["FU", 5, [0, 1]], ["SP", 5, 0, 144, [1], 1], ["AN", 5, 1, 2], ["FFSP", 5, 0, [1, 0], 1, 1], ["AN", 5, 1, 6], ["FU", 2, [0, 1]], ["SP", 2, 0, 72, [1], 1], ["AN", 2, 1, 2], ["FFSP", 2, 0, [1, 0], 1, 1], ["AN", 2, 1, 6], ["PR", 6, 0, "auto_unroll_max_step$0"]]]], "r": [[0.000105977], 0, 4.30492, 1661162418], "v": "v0.6"}
{"i": [["[\"get_expr\", \"fused_conv_bias_relu_expr_S1D1P1\", [64, 16, 32, 32, 16, 3, 3]]", "cuda -keys=cuda,gpu -max_num_threads=1024 -thread_warp_size=32", [-1, 16, 64, 49152, 2147483647, 1024, 8, 32], "", 0, []], [[], [["SP", 4, 0, 16, [1, 1, 1, 2], 1], ["SP", 4, 5, 65536, [1, 8, 1, 2], 1], ["SP", 4, 10, 144, [2, 18], 1], ["RE", 4, [0, 5, 1, 6, 2, 7, 10, 11, 3, 8, 12, 4, 9]], ["FSP", 6, 0, 0, 3], ["FSP", 6, 4, 1, 3], ["RE", 6, [0, 4, 1, 5, 2, 6, 3, 7]], ["CA", 4, 6, 5], ["CHR", 3, "shared", [4]], ["CA", 4, 5, 6], ["CI", 3], ["CHR", 1, "shared", [5]], ["CA", 2, 6, 6], ["CI", 1], ["FU", 8, [0, 1]], ["AN", 8, 0, 5], ["FU", 8, [1, 2]], ["AN", 8, 1, 4], ["FU", 8, [2, 3]], ["AN", 8, 2, 6], ["FU", 5, [0, 1]], ["SP", 5, 0, 72, [1], 1], ["AN", 5, 1, 2], ["FFSP", 5, 0, [1, 0], 1, 1], ["AN", 5, 1, 6], ["FU", 2, [0, 1]], ["SP", 2, 0, 72, [1], 1], ["AN", 2, 1, 2], ["FFSP", 2, 0, [1, 0], 1, 1], ["AN", 2, 1, 6], ["PR", 6, 0, "auto_unroll_max_step$0"]]]], "r": [[0.00107764], 0, 3.3744, 1661162419], "v": "v0.6"}
{"i": [["[\"get_expr\", \"fused_conv_bias_relu_expr_S1D1P1\", [64, 16, 32, 32, 16, 3, 3]]", "cuda -keys=cuda,gpu -max_num_threads=1024 -thread_warp_size=32", [-1, 16, 64, 49152, 2147483647, 1024, 8, 32], "", 0, []], [[], [["SP", 4, 0, 16, [1, 1, 1, 4], 1], ["SP", 4, 5, 65536, [4, 32, 4, 2], 1], ["SP", 4, 10, 144, [1, 1], 1], ["RE", 4, [0, 5, 1, 6, 2, 7, 10, 11, 3, 8, 12, 4, 9]], ["FSP", 6, 0, 0, 3], ["FSP", 6, 4, 1, 3], ["RE", 6, [0, 4, 1, 5, 2, 6, 3, 7]], ["CA", 4, 6, 5], ["CHR", 3, "shared", [4]], ["CA", 4, 5, 6], ["CI", 3], ["CHR", 1, "shared", [5]], ["CA", 2, 6, 6], ["CI", 1], ["FU", 8, [0, 1]], ["AN", 8, 0, 5], ["FU", 8, [1, 2]], ["AN", 8, 1, 4], ["FU", 8, [2, 3]], ["AN", 8, 2, 6], ["FU", 5, [0, 1]], ["SP", 5, 0, 4, [4], 1], ["AN", 5, 1, 2], ["FFSP", 5, 0, [1, 0], 1, 1], ["AN", 5, 1, 6], ["FU", 2, [0, 1]], ["SP", 2, 0, 4, [1], 1], ["AN", 2, 1, 2], ["FFSP", 2, 0, [1, 0], 1, 1], ["AN", 2, 1, 6], ["PR", 6, 0, "auto_unroll_max_step$64"]]]], "r": [[0.000128751], 0, 4.20245, 1661162421], "v": "v0.6"}
{"i": [["[\"get_expr\", \"fused_conv_bias_relu_expr_S1D1P1\", [64, 16, 32, 32, 16, 3, 3]]", "cuda -keys=cuda,gpu -max_num_threads=1024 -thread_warp_size=32", [-1, 16, 64, 49152, 2147483647, 1024, 8, 32], "", 0, []], [[], [["SP", 4, 0, 16, [1, 4, 1, 2], 1], ["SP", 4, 5, 65536, [1, 8, 1, 2], 1], ["SP", 4, 10, 144, [12, 3], 1], ["RE", 4, [0, 5, 1, 6, 2, 7, 10, 11, 3, 8, 12, 4, 9]], ["FSP", 6, 0, 0, 3], ["FSP", 6, 4, 1, 3], ["RE", 6, [0, 4, 1, 5, 2, 6, 3, 7]], ["CA", 4, 6, 5], ["CHR", 3, "shared", [4]], ["CA", 4, 5, 6], ["CI", 3], ["CHR", 1, "shared", [5]], ["CA", 2, 6, 6], ["CI", 1], ["FU", 8, [0, 1]], ["AN", 8, 0, 5], ["FU", 8, [1, 2]], ["AN", 8, 1, 4], ["FU", 8, [2, 3]], ["AN", 8, 2, 6], ["FU", 5, [0, 1]], ["SP", 5, 0, 72, [1], 1], ["AN", 5, 1, 2], ["FFSP", 5, 0, [1, 0], 1, 1], ["AN", 5, 1, 6], ["FU", 2, [0, 1]], ["SP", 2, 0, 72, [1], 1], ["AN", 2, 1, 2], ["FFSP", 2, 0, [1, 0], 1, 1], ["AN", 2, 1, 6], ["PR", 6, 0, "auto_unroll_max_step$1024"]]]], "r": [[9.28846e-05], 0, 5.641, 1661162423], "v": "v0.6"}
{"i": [["[\"get_expr\", \"fused_conv_bias_relu_expr_S1D1P1\", [64, 16, 32, 32, 16, 3, 3]]", "cuda -keys=cuda,gpu -max_num_threads=1024 -thread_warp_size=32", [-1, 16, 64, 49152, 2147483647, 1024, 8, 32], "", 0, []], [[], [["SP", 4, 0, 16, [2, 2, 4, 1], 1], ["SP", 4, 5, 65536, [1, 32, 1, 1], 1], ["SP", 4, 10, 144, [9, 1], 1], ["RE", 4, [0, 5, 1, 6, 2, 7, 10, 11, 3, 8, 12, 4, 9]], ["FSP", 6, 0, 0, 3], ["FSP", 6, 4, 1, 3], ["RE", 6, [0, 4, 1, 5, 2, 6, 3, 7]], ["CA", 4, 6, 5], ["CHR", 3, "shared", [4]], ["CA", 4, 5, 6], ["CI", 3], ["CHR", 1, "shared", [5]], ["CA", 2, 6, 6], ["CI", 1], ["FU", 8, [0, 1]], ["AN", 8, 0, 5], ["FU", 8, [1, 2]], ["AN", 8, 1, 4], ["FU", 8, [2, 3]], ["AN", 8, 2, 6], ["FU", 5, [0, 1]], ["SP", 5, 0, 288, [1], 1], ["AN", 5, 1, 2], ["FFSP", 5, 0, [1, 0], 1, 1], ["AN", 5, 1, 6], ["FU", 2, [0, 1]], ["SP", 2, 0, 144, [4], 1], ["AN", 2, 1, 2], ["FFSP", 2, 0, [1, 0], 1, 1], ["AN", 2, 1, 6], ["PR", 6, 0, "auto_unroll_max_step$0"]]]], "r": [[0.000107257], 0, 2.9744, 1661162424], "v": "v0.6"}
{"i": [["[\"get_expr\", \"fused_conv_bias_relu_expr_S1D1P1\", [64, 16, 32, 32, 16, 3, 3]]", "cuda -keys=cuda,gpu -max_num_threads=1024 -thread_warp_size=32", [-1, 16, 64, 49152, 2147483647, 1024, 8, 32], "", 0, []], [[], [["SP", 4, 0, 16, [2, 4, 1, 2], 1], ["SP", 4, 5, 65536, [32, 1, 2, 1], 1], ["SP", 4, 10, 144, [1, 1], 1], ["RE", 4, [0, 5, 1, 6, 2, 7, 10, 11, 3, 8, 12, 4, 9]], ["FSP", 6, 0, 0, 3], ["FSP", 6, 4, 1, 3], ["RE", 6, [0, 4, 1, 5, 2, 6, 3, 7]], ["CA", 4, 6, 5], ["CHR", 3, "shared", [4]], ["CA", 4, 5, 6], ["CI", 3], ["CHR", 1, "shared", [5]], ["CA", 2, 6, 6], ["CI", 1], ["FU", 8, [0, 1]], ["AN", 8, 0, 5], ["FU", 8, [1, 2]], ["AN", 8, 1, 4], ["FU", 8, [2, 3]], ["AN", 8, 2, 6], ["FU", 5, [0, 1]], ["SP", 5, 0, 4, [1], 1], ["AN", 5, 1, 2], ["FFSP", 5, 0, [1, 0], 1, 1], ["AN", 5, 1, 6], ["FU", 2, [0, 1]], ["SP", 2, 0, 4, [4], 1], ["AN", 2, 1, 2], ["FFSP", 2, 0, [1, 0], 1, 1], ["AN", 2, 1, 6], ["PR", 6, 0, "auto_unroll_max_step$1024"]]]], "r": [[0.00072317], 0, 4.84633, 1661162427], "v": "v0.6"}
{"i": [["[\"get_expr\", \"fused_conv_bias_relu_expr_S1D1P1\", [64, 16, 32, 32, 16, 3, 3]]", "cuda -keys=cuda,gpu -max_num_threads=1024 -thread_warp_size=32", [-1, 16, 64, 49152, 2147483647, 1024, 8, 32], "", 0, []], [[], [["SP", 4, 0, 16, [2, 2, 1, 2], 1], ["SP", 4, 5, 65536, [1, 32, 2, 2], 1], ["SP", 4, 10, 144, [24, 3], 1], ["RE", 4, [0, 5, 1, 6, 2, 7, 10, 11, 3, 8, 12, 4, 9]], ["FSP", 6, 0, 0, 3], ["FSP", 6, 4, 1, 3], ["RE", 6, [0, 4, 1, 5, 2, 6, 3, 7]], ["CA", 4, 6, 5], ["CHR", 3, "shared", [4]], ["CA", 4, 5, 6], ["CI", 3], ["CHR", 1, "shared", [5]], ["CA", 2, 6, 6], ["CI", 1], ["FU", 8, [0, 1]], ["AN", 8, 0, 5], ["FU", 8, [1, 2]], ["AN", 8, 1, 4], ["FU", 8, [2, 3]], ["AN", 8, 2, 6], ["FU", 5, [0, 1]], ["SP", 5, 0, 144, [6], 1], ["AN", 5, 1, 2], ["FFSP", 5, 0, [1, 0], 1, 1], ["AN", 5, 1, 6], ["FU", 2, [0, 1]], ["SP", 2, 0, 288, [12], 1], ["AN", 2, 1, 2], ["FFSP", 2, 0, [1, 0], 1, 1], ["AN", 2, 1, 6], ["PR", 6, 0, "auto_unroll_max_step$1024"]]]], "r": [[0.000127344], 0, 8.04001, 1661162429], "v": "v0.6"}
{"i": [["[\"get_expr\", \"fused_conv_bias_relu_expr_S1D1P1\", [64, 16, 32, 32, 16, 3, 3]]", "cuda -keys=cuda,gpu -max_num_threads=1024 -thread_warp_size=32", [-1, 16, 64, 49152, 2147483647, 1024, 8, 32], "", 0, []], [[], [["SP", 4, 0, 16, [1, 2, 8, 1], 1], ["SP", 4, 5, 65536, [1, 8, 64, 1], 1], ["SP", 4, 10, 144, [6, 2], 1], ["RE", 4, [0, 5, 1, 6, 2, 7, 10, 11, 3, 8, 12, 4, 9]], ["FSP", 6, 0, 0, 3], ["FSP", 6, 4, 1, 3], ["RE", 6, [0, 4, 1, 5, 2, 6, 3, 7]], ["CA", 4, 6, 5], ["CHR", 3, "shared", [4]], ["CA", 4, 5, 6], ["CI", 3], ["CHR", 1, "shared", [5]], ["CA", 2, 6, 6], ["CI", 1], ["FU", 8, [0, 1]], ["AN", 8, 0, 5], ["FU", 8, [1, 2]], ["AN", 8, 1, 4], ["FU", 8, [2, 3]], ["AN", 8, 2, 6], ["FU", 5, [0, 1]], ["SP", 5, 0, 48, [1], 1], ["AN", 5, 1, 2], ["FFSP", 5, 0, [1, 0], 1, 1], ["AN", 5, 1, 6], ["FU", 2, [0, 1]], ["SP", 2, 0, 768, [1], 1], ["AN", 2, 1, 2], ["FFSP", 2, 0, [1, 0], 1, 1], ["AN", 2, 1, 6], ["PR", 6, 0, "auto_unroll_max_step$64"]]]], "r": [[0.00160945], 0, 5.01962, 1661162431], "v": "v0.6"}
{"i": [["[\"get_expr\", \"fused_conv_bias_relu_expr_S1D1P1\", [64, 16, 32, 32, 16, 3, 3]]", "cuda -keys=cuda,gpu -max_num_threads=1024 -thread_warp_size=32", [-1, 16, 64, 49152, 2147483647, 1024, 8, 32], "", 0, []], [[], [["SP", 4, 0, 16, [2, 2, 4, 1], 1], ["SP", 4, 5, 65536, [1, 16, 1, 8], 1], ["SP", 4, 10, 144, [2, 3], 1], ["RE", 4, [0, 5, 1, 6, 2, 7, 10, 11, 3, 8, 12, 4, 9]], ["FSP", 6, 0, 0, 3], ["FSP", 6, 4, 1, 3], ["RE", 6, [0, 4, 1, 5, 2, 6, 3, 7]], ["CA", 4, 6, 5], ["CHR", 3, "shared", [4]], ["CA", 4, 5, 6], ["CI", 3], ["CHR", 1, "shared", [5]], ["CA", 2, 6, 6], ["CI", 1], ["FU", 8, [0, 1]], ["AN", 8, 0, 5], ["FU", 8, [1, 2]], ["AN", 8, 1, 4], ["FU", 8, [2, 3]], ["AN", 8, 2, 6], ["FU", 5, [0, 1]], ["SP", 5, 0, 24, [1], 1], ["AN", 5, 1, 2], ["FFSP", 5, 0, [1, 0], 1, 1], ["AN", 5, 1, 6], ["FU", 2, [0, 1]], ["SP", 2, 0, 48, [16], 1], ["AN", 2, 1, 2], ["FFSP", 2, 0, [1, 0], 1, 1], ["AN", 2, 1, 6], ["PR", 6, 0, "auto_unroll_max_step$1024"]]]], "r": [[0.000135285], 0, 6.2277, 1661162434], "v": "v0.6"}
{"i": [["[\"get_expr\", \"fused_conv_bias_relu_expr_S1D1P1\", [64, 16, 32, 32, 16, 3, 3]]", "cuda -keys=cuda,gpu -max_num_threads=1024 -thread_warp_size=32", [-1, 16, 64, 49152, 2147483647, 1024, 8, 32], "", 0, []], [[], [["SP", 4, 0, 16, [1, 1, 1, 8], 1], ["SP", 4, 5, 65536, [2, 32, 4, 1], 1], ["SP", 4, 10, 144, [1, 3], 1], ["RE", 4, [0, 5, 1, 6, 2, 7, 10, 11, 3, 8, 12, 4, 9]], ["FSP", 6, 0, 0, 3], ["FSP", 6, 4, 1, 3], ["RE", 6, [0, 4, 1, 5, 2, 6, 3, 7]], ["CA", 4, 6, 5], ["CHR", 3, "shared", [4]], ["CA", 4, 5, 6], ["CI", 3], ["CHR", 1, "shared", [5]], ["CA", 2, 6, 6], ["CI", 1], ["FU", 8, [0, 1]], ["AN", 8, 0, 5], ["FU", 8, [1, 2]], ["AN", 8, 1, 4], ["FU", 8, [2, 3]], ["AN", 8, 2, 6], ["FU", 5, [0, 1]], ["SP", 5, 0, 48, [1], 1], ["AN", 5, 1, 2], ["FFSP", 5, 0, [1, 0], 1, 1], ["AN", 5, 1, 6], ["FU", 2, [0, 1]], ["SP", 2, 0, 24, [1], 1], ["AN", 2, 1, 2], ["FFSP", 2, 0, [1, 0], 1, 1], ["AN", 2, 1, 6], ["PR", 6, 0, "auto_unroll_max_step$1024"]]]], "r": [[0.000141003], 0, 4.74258, 1661162437], "v": "v0.6"}
{"i": [["[\"get_expr\", \"fused_conv_bias_relu_expr_S1D1P1\", [64, 16, 32, 32, 16, 3, 3]]", "cuda -keys=cuda,gpu -max_num_threads=1024 -thread_warp_size=32", [-1, 16, 64, 49152, 2147483647, 1024, 8, 32], "", 0, []], [[], [["SP", 4, 0, 16, [2, 1, 4, 1], 1], ["SP", 4, 5, 65536, [1, 128, 2, 1], 1], ["SP", 4, 10, 144, [9, 1], 1], ["RE", 4, [0, 5, 1, 6, 2, 7, 10, 11, 3, 8, 12, 4, 9]], ["FSP", 6, 0, 0, 3], ["FSP", 6, 4, 1, 3], ["RE", 6, [0, 4, 1, 5, 2, 6, 3, 7]], ["CA", 4, 6, 5], ["CHR", 3, "shared", [4]], ["CA", 4, 5, 6], ["CI", 3], ["CHR", 1, "shared", [5]], ["CA", 2, 6, 6], ["CI", 1], ["FU", 8, [0, 1]], ["AN", 8, 0, 5], ["FU", 8, [1, 2]], ["AN", 8, 1, 4], ["FU", 8, [2, 3]], ["AN", 8, 2, 6], ["FU", 5, [0, 1]], ["SP", 5, 0, 36, [4], 1], ["AN", 5, 1, 2], ["FFSP", 5, 0, [1, 0], 1, 1], ["AN", 5, 1, 6], ["FU", 2, [0, 1]], ["SP", 2, 0, 18, [18], 1], ["AN", 2, 1, 2], ["FFSP", 2, 0, [1, 0], 1, 1], ["AN", 2, 1, 6], ["PR", 6, 0, "auto_unroll_max_step$512"]]]], "r": [[7.28561e-05], 0, 4.488, 1661162439], "v": "v0.6"}
{"i": [["[\"get_expr\", \"fused_conv_bias_relu_expr_S1D1P1\", [64, 16, 32, 32, 16, 3, 3]]", "cuda -keys=cuda,gpu -max_num_threads=1024 -thread_warp_size=32", [-1, 16, 64, 49152, 2147483647, 1024, 8, 32], "", 0, []], [[], [["SP", 4, 0, 16, [1, 4, 2, 1], 1], ["SP", 4, 5, 65536, [1, 16, 1, 8], 1], ["SP", 4, 10, 144, [24, 3], 1], ["RE", 4, [0, 5, 1, 6, 2, 7, 10, 11, 3, 8, 12, 4, 9]], ["FSP", 6, 0, 0, 3], ["FSP", 6, 4, 1, 3], ["RE", 6, [0, 4, 1, 5, 2, 6, 3, 7]], ["CA", 4, 6, 5], ["CHR", 3, "shared", [4]], ["CA", 4, 5, 6], ["CI", 3], ["CHR", 1, "shared", [5]], ["CA", 2, 6, 6], ["CI", 1], ["FU", 8, [0, 1]], ["AN", 8, 0, 5], ["FU", 8, [1, 2]], ["AN", 8, 1, 4], ["FU", 8, [2, 3]], ["AN", 8, 2, 6], ["FU", 5, [0, 1]], ["SP", 5, 0, 144, [2], 1], ["AN", 5, 1, 2], ["FFSP", 5, 0, [1, 0], 1, 1], ["AN", 5, 1, 6], ["FU", 2, [0, 1]], ["SP", 2, 0, 576, [24], 1], ["AN", 2, 1, 2], ["FFSP", 2, 0, [1, 0], 1, 1], ["AN", 2, 1, 6], ["PR", 6, 0, "auto_unroll_max_step$64"]]]], "r": [[0.00025232], 0, 4.16795, 1661162441], "v": "v0.6"}
{"i": [["[\"get_expr\", \"fused_conv_bias_relu_expr_S1D1P1\", [64, 16, 32, 32, 16, 3, 3]]", "cuda -keys=cuda,gpu -max_num_threads=1024 -thread_warp_size=32", [-1, 16, 64, 49152, 2147483647, 1024, 8, 32], "", 0, []], [[], [["SP", 4, 0, 16, [4, 1, 1, 4], 1], ["SP", 4, 5, 65536, [1, 256, 1, 1], 1], ["SP", 4, 10, 144, [1, 24], 1], ["RE", 4, [0, 5, 1, 6, 2, 7, 10, 11, 3, 8, 12, 4, 9]], ["FSP", 6, 0, 0, 3], ["FSP", 6, 4, 1, 3], ["RE", 6, [0, 4, 1, 5, 2, 6, 3, 7]], ["CA", 4, 6, 5], ["CHR", 3, "shared", [4]], ["CA", 4, 5, 6], ["CI", 3], ["CHR", 1, "shared", [5]], ["CA", 2, 6, 6], ["CI", 1], ["FU", 8, [0, 1]], ["AN", 8, 0, 5], ["FU", 8, [1, 2]], ["AN", 8, 1, 4], ["FU", 8, [2, 3]], ["AN", 8, 2, 6], ["FU", 5, [0, 1]], ["SP", 5, 0, 24, [1], 1], ["AN", 5, 1, 2], ["FFSP", 5, 0, [1, 0], 1, 1], ["AN", 5, 1, 6], ["FU", 2, [0, 1]], ["SP", 2, 0, 24, [8], 1], ["AN", 2, 1, 2], ["FFSP", 2, 0, [1, 0], 1, 1], ["AN", 2, 1, 6], ["PR", 6, 0, "auto_unroll_max_step$64"]]]], "r": [[9.98961e-05], 0, 3.77529, 1661162442], "v": "v0.6"}
{"i": [["[\"get_expr\", \"fused_conv_bias_relu_expr_S1D1P1\", [64, 16, 32, 32, 16, 3, 3]]", "cuda -keys=cuda,gpu -max_num_threads=1024 -thread_warp_size=32", [-1, 16, 64, 49152, 2147483647, 1024, 8, 32], "", 0, []], [[], [["SP", 4, 0, 16, [1, 1, 4, 1], 1], ["SP", 4, 5, 65536, [4, 32, 1, 1], 1], ["SP", 4, 10, 144, [6, 4], 1], ["RE", 4, [0, 5, 1, 6, 2, 7, 10, 11, 3, 8, 12, 4, 9]], ["FSP", 6, 0, 0, 3], ["FSP", 6, 4, 1, 3], ["RE", 6, [0, 4, 1, 5, 2, 6, 3, 7]], ["CA", 4, 6, 5], ["CHR", 3, "shared", [4]], ["CA", 4, 5, 6], ["CI", 3], ["CHR", 1, "shared", [5]], ["CA", 2, 6, 6], ["CI", 1], ["FU", 8, [0, 1]], ["AN", 8, 0, 5], ["FU", 8, [1, 2]], ["AN", 8, 1, 4], ["FU", 8, [2, 3]], ["AN", 8, 2, 6], ["FU", 5, [0, 1]], ["SP", 5, 0, 96, [1], 1], ["AN", 5, 1, 2], ["FFSP", 5, 0, [1, 0], 1, 1], ["AN", 5, 1, 6], ["FU", 2, [0, 1]], ["SP", 2, 0, 24, [24], 1], ["AN", 2, 1, 2], ["FFSP", 2, 0, [1, 0], 1, 1], ["AN", 2, 1, 6], ["PR", 6, 0, "auto_unroll_max_step$0"]]]], "r": [[0.000434004], 0, 2.79388, 1661162444], "v": "v0.6"}
{"i": [["[\"get_expr\", \"fused_conv_bias_relu_expr_S1D1P1\", [64, 16, 32, 32, 16, 3, 3]]", "cuda -keys=cuda,gpu -max_num_threads=1024 -thread_warp_size=32", [-1, 16, 64, 49152, 2147483647, 1024, 8, 32], "", 0, []], [[], [["SP", 4, 0, 16, [1, 4, 2, 1], 1], ["SP", 4, 5, 65536, [1, 16, 1, 8], 1], ["SP", 4, 10, 144, [24, 3], 1], ["RE", 4, [0, 5, 1, 6, 2, 7, 10, 11, 3, 8, 12, 4, 9]], ["FSP", 6, 0, 0, 3], ["FSP", 6, 4, 1, 3], ["RE", 6, [0, 4, 1, 5, 2, 6, 3, 7]], ["CA", 4, 6, 5], ["CHR", 3, "shared", [4]], ["CA", 4, 5, 6], ["CI", 3], ["CHR", 1, "shared", [5]], ["CA", 2, 6, 6], ["CI", 1], ["FU", 8, [0, 1]], ["AN", 8, 0, 5], ["FU", 8, [1, 2]], ["AN", 8, 1, 4], ["FU", 8, [2, 3]], ["AN", 8, 2, 6], ["FU", 5, [0, 1]], ["SP", 5, 0, 144, [1], 1], ["AN", 5, 1, 2], ["FFSP", 5, 0, [1, 0], 1, 1], ["AN", 5, 1, 6], ["FU", 2, [0, 1]], ["SP", 2, 0, 576, [4], 1], ["AN", 2, 1, 2], ["FFSP", 2, 0, [1, 0], 1, 1], ["AN", 2, 1, 6], ["PR", 6, 0, "auto_unroll_max_step$64"]]]], "r": [[0.000416806], 0, 3.13315, 1661162445], "v": "v0.6"}
{"i": [["[\"get_expr\", \"fused_conv_bias_relu_expr_S1D1P1\", [64, 16, 32, 32, 16, 3, 3]]", "cuda -keys=cuda,gpu -max_num_threads=1024 -thread_warp_size=32", [-1, 16, 64, 49152, 2147483647, 1024, 8, 32], "", 0, []], [[], [["SP", 4, 0, 16, [1, 4, 2, 1], 1], ["SP", 4, 5, 65536, [1, 16, 1, 8], 1], ["SP", 4, 10, 144, [24, 3], 1], ["RE", 4, [0, 5, 1, 6, 2, 7, 10, 11, 3, 8, 12, 4, 9]], ["FSP", 6, 0, 0, 3], ["FSP", 6, 4, 1, 3], ["RE", 6, [0, 4, 1, 5, 2, 6, 3, 7]], ["CA", 4, 6, 5], ["CHR", 3, "shared", [4]], ["CA", 4, 5, 6], ["CI", 3], ["CHR", 1, "shared", [5]], ["CA", 2, 6, 6], ["CI", 1], ["FU", 8, [0, 1]], ["AN", 8, 0, 5], ["FU", 8, [1, 2]], ["AN", 8, 1, 4], ["FU", 8, [2, 3]], ["AN", 8, 2, 6], ["FU", 5, [0, 1]], ["SP", 5, 0, 144, [1], 1], ["AN", 5, 1, 2], ["FFSP", 5, 0, [1, 0], 1, 1], ["AN", 5, 1, 6], ["FU", 2, [0, 1]], ["SP", 2, 0, 576, [1], 1], ["AN", 2, 1, 2], ["FFSP", 2, 0, [1, 0], 1, 1], ["AN", 2, 1, 6], ["PR", 6, 0, "auto_unroll_max_step$64"]]]], "r": [[0.00041584], 0, 3.02764, 1661162446], "v": "v0.6"}
{"i": [["[\"get_expr\", \"fused_conv_bias_relu_expr_S1D1P1\", [64, 16, 32, 32, 16, 3, 3]]", "cuda -keys=cuda,gpu -max_num_threads=1024 -thread_warp_size=32", [-1, 16, 64, 49152, 2147483647, 1024, 8, 32], "", 0, []], [[], [["SP", 4, 0, 16, [2, 4, 2, 1], 1], ["SP", 4, 5, 65536, [1, 16, 4, 2], 1], ["SP", 4, 10, 144, [12, 1], 1], ["RE", 4, [0, 5, 1, 6, 2, 7, 10, 11, 3, 8, 12, 4, 9]], ["FSP", 6, 0, 0, 3], ["FSP", 6, 4, 1, 3], ["RE", 6, [0, 4, 1, 5, 2, 6, 3, 7]], ["CA", 4, 6, 5], ["CHR", 3, "shared", [4]], ["CA", 4, 5, 6], ["CI", 3], ["CHR", 1, "shared", [5]], ["CA", 2, 6, 6], ["CI", 1], ["FU", 8, [0, 1]], ["AN", 8, 0, 5], ["FU", 8, [1, 2]], ["AN", 8, 1, 4], ["FU", 8, [2, 3]], ["AN", 8, 2, 6], ["FU", 5, [0, 1]], ["SP", 5, 0, 48, [16], 1], ["AN", 5, 1, 2], ["FFSP", 5, 0, [1, 0], 1, 1], ["AN", 5, 1, 6], ["FU", 2, [0, 1]], ["SP", 2, 0, 96, [1], 1], ["AN", 2, 1, 2], ["FFSP", 2, 0, [1, 0], 1, 1], ["AN", 2, 1, 6], ["PR", 6, 0, "auto_unroll_max_step$64"]]]], "r": [[8.26036e-05], 0, 5.17415, 1661162450], "v": "v0.6"}
{"i": [["[\"get_expr\", \"fused_conv_bias_relu_expr_S1D1P1\", [64, 16, 32, 32, 16, 3, 3]]", "cuda -keys=cuda,gpu -max_num_threads=1024 -thread_warp_size=32", [-1, 16, 64, 49152, 2147483647, 1024, 8, 32], "", 0, []], [[], [["SP", 4, 0, 16, [1, 1, 4, 2], 1], ["SP", 4, 5, 65536, [4, 32, 1, 1], 1], ["SP", 4, 10, 144, [6, 4], 1], ["RE", 4, [0, 5, 1, 6, 2, 7, 10, 11, 3, 8, 12, 4, 9]], ["FSP", 6, 0, 0, 3], ["FSP", 6, 4, 1, 3], ["RE", 6, [0, 4, 1, 5, 2, 6, 3, 7]], ["CA", 4, 6, 5], ["CHR", 3, "shared", [4]], ["CA", 4, 5, 6], ["CI", 3], ["CHR", 1, "shared", [5]], ["CA", 2, 6, 6], ["CI", 1], ["FU", 8, [0, 1]], ["AN", 8, 0, 5], ["FU", 8, [1, 2]], ["AN", 8, 1, 4], ["FU", 8, [2, 3]], ["AN", 8, 2, 6], ["FU", 5, [0, 1]], ["SP", 5, 0, 96, [1], 1], ["AN", 5, 1, 2], ["FFSP", 5, 0, [1, 0], 1, 1], ["AN", 5, 1, 6], ["FU", 2, [0, 1]], ["SP", 2, 0, 24, [3], 1], ["AN", 2, 1, 2], ["FFSP", 2, 0, [1, 0], 1, 1], ["AN", 2, 1, 6], ["PR", 6, 0, "auto_unroll_max_step$0"]]]], "r": [[0.000241812], 0, 3.47886, 1661162452], "v": "v0.6"}
{"i": [["[\"get_expr\", \"fused_conv_bias_relu_expr_S1D1P1\", [64, 16, 32, 32, 16, 3, 3]]", "cuda -keys=cuda,gpu -max_num_threads=1024 -thread_warp_size=32", [-1, 16, 64, 49152, 2147483647, 1024, 8, 32], "", 0, []], [[], [["SP", 4, 0, 16, [2, 1, 1, 1], 1], ["SP", 4, 5, 65536, [2, 32, 1, 16], 1], ["SP", 4, 10, 144, [1, 9], 1], ["RE", 4, [0, 5, 1, 6, 2, 7, 10, 11, 3, 8, 12, 4, 9]], ["FSP", 6, 0, 0, 3], ["FSP", 6, 4, 1, 3], ["RE", 6, [0, 4, 1, 5, 2, 6, 3, 7]], ["CA", 4, 6, 5], ["CHR", 3, "shared", [4]], ["CA", 4, 5, 6], ["CI", 3], ["CHR", 1, "shared", [5]], ["CA", 2, 6, 6], ["CI", 1], ["FU", 8, [0, 1]], ["AN", 8, 0, 5], ["FU", 8, [1, 2]], ["AN", 8, 1, 4], ["FU", 8, [2, 3]], ["AN", 8, 2, 6], ["FU", 5, [0, 1]], ["SP", 5, 0, 9, [3], 1], ["AN", 5, 1, 2], ["FFSP", 5, 0, [1, 0], 1, 1], ["AN", 5, 1, 6], ["FU", 2, [0, 1]], ["SP", 2, 0, 144, [2], 1], ["AN", 2, 1, 2], ["FFSP", 2, 0, [1, 0], 1, 1], ["AN", 2, 1, 6], ["PR", 6, 0, "auto_unroll_max_step$16"]]]], "r": [[0.00212122], 0, 3.30152, 1661162453], "v": "v0.6"}
{"i": [["[\"get_expr\", \"fused_conv_bias_relu_expr_S1D1P1\", [64, 16, 32, 32, 16, 3, 3]]", "cuda -keys=cuda,gpu -max_num_threads=1024 -thread_warp_size=32", [-1, 16, 64, 49152, 2147483647, 1024, 8, 32], "", 0, []], [[], [["SP", 4, 0, 16, [1, 2, 1, 4], 1], ["SP", 4, 5, 65536, [8, 32, 4, 1], 1], ["SP", 4, 10, 144, [1, 1], 1], ["RE", 4, [0, 5, 1, 6, 2, 7, 10, 11, 3, 8, 12, 4, 9]], ["FSP", 6, 0, 0, 3], ["FSP", 6, 4, 1, 3], ["RE", 6, [0, 4, 1, 5, 2, 6, 3, 7]], ["CA", 4, 6, 5], ["CHR", 3, "shared", [4]], ["CA", 4, 5, 6], ["CI", 3], ["CHR", 1, "shared", [5]], ["CA", 2, 6, 6], ["CI", 1], ["FU", 8, [0, 1]], ["AN", 8, 0, 5], ["FU", 8, [1, 2]], ["AN", 8, 1, 4], ["FU", 8, [2, 3]], ["AN", 8, 2, 6], ["FU", 5, [0, 1]], ["SP", 5, 0, 4, [1], 1], ["AN", 5, 1, 2], ["FFSP", 5, 0, [1, 0], 1, 1], ["AN", 5, 1, 6], ["FU", 2, [0, 1]], ["SP", 2, 0, 4, [1], 1], ["AN", 2, 1, 2], ["FFSP", 2, 0, [1, 0], 1, 1], ["AN", 2, 1, 6], ["PR", 6, 0, "auto_unroll_max_step$64"]]]], "r": [[9.50915e-05], 0, 3.06289, 1661162455], "v": "v0.6"}
{"i": [["[\"get_expr\", \"fused_conv_bias_relu_expr_S1D1P1\", [64, 16, 32, 32, 16, 3, 3]]", "cuda -keys=cuda,gpu -max_num_threads=1024 -thread_warp_size=32", [-1, 16, 64, 49152, 2147483647, 1024, 8, 32], "", 0, []], [[], [["SP", 4, 0, 16, [1, 4, 1, 2], 1], ["SP", 4, 5, 65536, [2, 8, 1, 2], 1], ["SP", 4, 10, 144, [12, 3], 1], ["RE", 4, [0, 5, 1, 6, 2, 7, 10, 11, 3, 8, 12, 4, 9]], ["FSP", 6, 0, 0, 3], ["FSP", 6, 4, 1, 3], ["RE", 6, [0, 4, 1, 5, 2, 6, 3, 7]], ["CA", 4, 6, 5], ["CHR", 3, "shared", [4]], ["CA", 4, 5, 6], ["CI", 3], ["CHR", 1, "shared", [5]], ["CA", 2, 6, 6], ["CI", 1], ["FU", 8, [0, 1]], ["AN", 8, 0, 5], ["FU", 8, [1, 2]], ["AN", 8, 1, 4], ["FU", 8, [2, 3]], ["AN", 8, 2, 6], ["FU", 5, [0, 1]], ["SP", 5, 0, 72, [1], 1], ["AN", 5, 1, 2], ["FFSP", 5, 0, [1, 0], 1, 1], ["AN", 5, 1, 6], ["FU", 2, [0, 1]], ["SP", 2, 0, 72, [1], 1], ["AN", 2, 1, 2], ["FFSP", 2, 0, [1, 0], 1, 1], ["AN", 2, 1, 6], ["PR", 6, 0, "auto_unroll_max_step$1024"]]]], "r": [[5.33166e-05], 0, 4.15927, 1661162457], "v": "v0.6"}
{"i": [["[\"get_expr\", \"fused_conv_bias_relu_expr_S1D1P1\", [64, 16, 32, 32, 16, 3, 3]]", "cuda -keys=cuda,gpu -max_num_threads=1024 -thread_warp_size=32", [-1, 16, 64, 49152, 2147483647, 1024, 8, 32], "", 0, []], [[], [["SP", 4, 0, 16, [1, 1, 1, 2], 1], ["SP", 4, 5, 65536, [1, 8, 1, 2], 1], ["SP", 4, 10, 144, [12, 3], 1], ["RE", 4, [0, 5, 1, 6, 2, 7, 10, 11, 3, 8, 12, 4, 9]], ["FSP", 6, 0, 0, 3], ["FSP", 6, 4, 1, 3], ["RE", 6, [0, 4, 1, 5, 2, 6, 3, 7]], ["CA", 4, 6, 5], ["CHR", 3, "shared", [4]], ["CA", 4, 5, 6], ["CI", 3], ["CHR", 1, "shared", [5]], ["CA", 2, 6, 6], ["CI", 1], ["FU", 8, [0, 1]], ["AN", 8, 0, 5], ["FU", 8, [1, 2]], ["AN", 8, 1, 4], ["FU", 8, [2, 3]], ["AN", 8, 2, 6], ["FU", 5, [0, 1]], ["SP", 5, 0, 72, [4], 1], ["AN", 5, 1, 2], ["FFSP", 5, 0, [1, 0], 1, 1], ["AN", 5, 1, 6], ["FU", 2, [0, 1]], ["SP", 2, 0, 72, [1], 1], ["AN", 2, 1, 2], ["FFSP", 2, 0, [1, 0], 1, 1], ["AN", 2, 1, 6], ["PR", 6, 0, "auto_unroll_max_step$0"]]]], "r": [[0.00107908], 0, 3.549, 1661162459], "v": "v0.6"}
{"i": [["[\"get_expr\", \"fused_conv_bias_relu_expr_S1D1P1\", [64, 16, 32, 32, 16, 3, 3]]", "cuda -keys=cuda,gpu -max_num_threads=1024 -thread_warp_size=32", [-1, 16, 64, 49152, 2147483647, 1024, 8, 32], "", 0, []], [[], [["SP", 4, 0, 16, [1, 8, 1, 2], 1], ["SP", 4, 5, 65536, [1, 64, 1, 1], 1], ["SP", 4, 10, 144, [24, 2], 1], ["RE", 4, [0, 5, 1, 6, 2, 7, 10, 11, 3, 8, 12, 4, 9]], ["FSP", 6, 0, 0, 3], ["FSP", 6, 4, 1, 3], ["RE", 6, [0, 4, 1, 5, 2, 6, 3, 7]], ["CA", 4, 6, 5], ["CHR", 3, "shared", [4]], ["CA", 4, 5, 6], ["CI", 3], ["CHR", 1, "shared", [5]], ["CA", 2, 6, 6], ["CI", 1], ["FU", 8, [0, 1]], ["AN", 8, 0, 5], ["FU", 8, [1, 2]], ["AN", 8, 1, 4], ["FU", 8, [2, 3]], ["AN", 8, 2, 6], ["FU", 5, [0, 1]], ["SP", 5, 0, 96, [1], 1], ["AN", 5, 1, 2], ["FFSP", 5, 0, [1, 0], 1, 1], ["AN", 5, 1, 6], ["FU", 2, [0, 1]], ["SP", 2, 0, 384, [1], 1], ["AN", 2, 1, 2], ["FFSP", 2, 0, [1, 0], 1, 1], ["AN", 2, 1, 6], ["PR", 6, 0, "auto_unroll_max_step$16"]]]], "r": [[6.7952e-05], 0, 2.72607, 1661162460], "v": "v0.6"}
{"i": [["[\"get_expr\", \"fused_conv_bias_relu_expr_S1D1P1\", [64, 16, 32, 32, 16, 3, 3]]", "cuda -keys=cuda,gpu -max_num_threads=1024 -thread_warp_size=32", [-1, 16, 64, 49152, 2147483647, 1024, 8, 32], "", 0, []], [[], [["SP", 4, 0, 16, [1, 16, 1, 1], 1], ["SP", 4, 5, 65536, [1, 4, 1, 32], 1], ["SP", 4, 10, 144, [9, 8], 1], ["RE", 4, [0, 5, 1, 6, 2, 7, 10, 11, 3, 8, 12, 4, 9]], ["FSP", 6, 0, 0, 3], ["FSP", 6, 4, 1, 3], ["RE", 6, [0, 4, 1, 5, 2, 6, 3, 7]], ["CA", 4, 6, 5], ["CHR", 3, "shared", [4]], ["CA", 4, 5, 6], ["CI", 3], ["CHR", 1, "shared", [5]], ["CA", 2, 6, 6], ["CI", 1], ["FU", 8, [0, 1]], ["AN", 8, 0, 5], ["FU", 8, [1, 2]], ["AN", 8, 1, 4], ["FU", 8, [2, 3]], ["AN", 8, 2, 6], ["FU", 5, [0, 1]], ["SP", 5, 0, 72, [1], 1], ["AN", 5, 1, 2], ["FFSP", 5, 0, [1, 0], 1, 1], ["AN", 5, 1, 6], ["FU", 2, [0, 1]], ["SP", 2, 0, 2304, [1], 1], ["AN", 2, 1, 2], ["FFSP", 2, 0, [1, 0], 1, 1], ["AN", 2, 1, 6], ["PR", 6, 0, "auto_unroll_max_step$64"]]]], "r": [[0.000419259], 0, 3.03169, 1661162461], "v": "v0.6"}
{"i": [["[\"get_expr\", \"fused_conv_bias_relu_expr_S1D1P1\", [64, 16, 32, 32, 16, 3, 3]]", "cuda -keys=cuda,gpu -max_num_threads=1024 -thread_warp_size=32", [-1, 16, 64, 49152, 2147483647, 1024, 8, 32], "", 0, []], [[], [["SP", 4, 0, 16, [2, 1, 1, 1], 1], ["SP", 4, 5, 65536, [1, 32, 1, 2], 1], ["SP", 4, 10, 144, [12, 4], 1], ["RE", 4, [0, 5, 1, 6, 2, 7, 10, 11, 3, 8, 12, 4, 9]], ["FSP", 6, 0, 0, 3], ["FSP", 6, 4, 1, 3], ["RE", 6, [0, 4, 1, 5, 2, 6, 3, 7]], ["CA", 4, 6, 5], ["CHR", 3, "shared", [4]], ["CA", 4, 5, 6], ["CI", 3], ["CHR", 1, "shared", [5]], ["CA", 2, 6, 6], ["CI", 1], ["FU", 8, [0, 1]], ["AN", 8, 0, 5], ["FU", 8, [1, 2]], ["AN", 8, 1, 4], ["FU", 8, [2, 3]], ["AN", 8, 2, 6], ["FU", 5, [0, 1]], ["SP", 5, 0, 8, [8], 1], ["AN", 5, 1, 2], ["FFSP", 5, 0, [1, 0], 1, 1], ["AN", 5, 1, 6], ["FU", 2, [0, 1]], ["SP", 2, 0, 16, [1], 1], ["AN", 2, 1, 2], ["FFSP", 2, 0, [1, 0], 1, 1], ["AN", 2, 1, 6], ["PR", 6, 0, "auto_unroll_max_step$64"]]]], "r": [[0.000705759], 0, 2.77946, 1661162463], "v": "v0.6"}
{"i": [["[\"get_expr\", \"fused_conv_bias_relu_expr_S1D1P1\", [64, 16, 32, 32, 16, 3, 3]]", "cuda -keys=cuda,gpu -max_num_threads=1024 -thread_warp_size=32", [-1, 16, 64, 49152, 2147483647, 1024, 8, 32], "", 0, []], [[], [["SP", 4, 0, 16, [1, 1, 1, 2], 1], ["SP", 4, 5, 65536, [4, 32, 1, 1], 1], ["SP", 4, 10, 144, [3, 2], 1], ["RE", 4, [0, 5, 1, 6, 2, 7, 10, 11, 3, 8, 12, 4, 9]], ["FSP", 6, 0, 0, 3], ["FSP", 6, 4, 1, 3], ["RE", 6, [0, 4, 1, 5, 2, 6, 3, 7]], ["CA", 4, 6, 5], ["CHR", 3, "shared", [4]], ["CA", 4, 5, 6], ["CI", 3], ["CHR", 1, "shared", [5]], ["CA", 2, 6, 6], ["CI", 1], ["FU", 8, [0, 1]], ["AN", 8, 0, 5], ["FU", 8, [1, 2]], ["AN", 8, 1, 4], ["FU", 8, [2, 3]], ["AN", 8, 2, 6], ["FU", 5, [0, 1]], ["SP", 5, 0, 6, [1], 1], ["AN", 5, 1, 2], ["FFSP", 5, 0, [1, 0], 1, 1], ["AN", 5, 1, 6], ["FU", 2, [0, 1]], ["SP", 2, 0, 6, [2], 1], ["AN", 2, 1, 2], ["FFSP", 2, 0, [1, 0], 1, 1], ["AN", 2, 1, 6], ["PR", 6, 0, "auto_unroll_max_step$1024"]]]], "r": [[0.000194056], 0, 3.37759, 1661162464], "v": "v0.6"}
{"i": [["[\"get_expr\", \"fused_conv_bias_relu_expr_S1D1P1\", [64, 16, 32, 32, 16, 3, 3]]", "cuda -keys=cuda,gpu -max_num_threads=1024 -thread_warp_size=32", [-1, 16, 64, 49152, 2147483647, 1024, 8, 32], "", 0, []], [[], [["SP", 4, 0, 16, [2, 2, 2, 1], 1], ["SP", 4, 5, 65536, [1, 32, 2, 2], 1], ["SP", 4, 10, 144, [24, 3], 1], ["RE", 4, [0, 5, 1, 6, 2, 7, 10, 11, 3, 8, 12, 4, 9]], ["FSP", 6, 0, 0, 3], ["FSP", 6, 4, 1, 3], ["RE", 6, [0, 4, 1, 5, 2, 6, 3, 7]], ["CA", 4, 6, 5], ["CHR", 3, "shared", [4]], ["CA", 4, 5, 6], ["CI", 3], ["CHR", 1, "shared", [5]], ["CA", 2, 6, 6], ["CI", 1], ["FU", 8, [0, 1]], ["AN", 8, 0, 5], ["FU", 8, [1, 2]], ["AN", 8, 1, 4], ["FU", 8, [2, 3]], ["AN", 8, 2, 6], ["FU", 5, [0, 1]], ["SP", 5, 0, 144, [1], 1], ["AN", 5, 1, 2], ["FFSP", 5, 0, [1, 0], 1, 1], ["AN", 5, 1, 6], ["FU", 2, [0, 1]], ["SP", 2, 0, 288, [1], 1], ["AN", 2, 1, 2], ["FFSP", 2, 0, [1, 0], 1, 1], ["AN", 2, 1, 6], ["PR", 6, 0, "auto_unroll_max_step$16"]]]], "r": [[0.000379498], 0, 2.96892, 1661162466], "v": "v0.6"}
{"i": [["[\"get_expr\", \"fused_conv_bias_relu_expr_S1D1P1\", [64, 16, 32, 32, 16, 3, 3]]", "cuda -keys=cuda,gpu -max_num_threads=1024 -thread_warp_size=32", [-1, 16, 64, 49152, 2147483647, 1024, 8, 32], "", 0, []], [[], [["SP", 4, 0, 16, [2, 4, 1, 1], 1], ["SP", 4, 5, 65536, [2, 8, 1, 64], 1], ["SP", 4, 10, 144, [2, 4], 1], ["RE", 4, [0, 5, 1, 6, 2, 7, 10, 11, 3, 8, 12, 4, 9]], ["FSP", 6, 0, 0, 3], ["FSP", 6, 4, 1, 3], ["RE", 6, [0, 4, 1, 5, 2, 6, 3, 7]], ["CA", 4, 6, 5], ["CHR", 3, "shared", [4]], ["CA", 4, 5, 6], ["CI", 3], ["CHR", 1, "shared", [5]], ["CA", 2, 6, 6], ["CI", 1], ["FU", 8, [0, 1]], ["AN", 8, 0, 5], ["FU", 8, [1, 2]], ["AN", 8, 1, 4], ["FU", 8, [2, 3]], ["AN", 8, 2, 6], ["FU", 5, [0, 1]], ["SP", 5, 0, 8, [1], 1], ["AN", 5, 1, 2], ["FFSP", 5, 0, [1, 0], 1, 1], ["AN", 5, 1, 6], ["FU", 2, [0, 1]], ["SP", 2, 0, 512, [8], 1], ["AN", 2, 1, 2], ["FFSP", 2, 0, [1, 0], 1, 1], ["AN", 2, 1, 6], ["PR", 6, 0, "auto_unroll_max_step$1024"]]]], "r": [[0.00101721], 0, 15.1725, 1661162471], "v": "v0.6"}
{"i": [["[\"get_expr\", \"fused_conv_bias_relu_expr_S1D1P1\", [64, 16, 32, 32, 16, 3, 3]]", "cuda -keys=cuda,gpu -max_num_threads=1024 -thread_warp_size=32", [-1, 16, 64, 49152, 2147483647, 1024, 8, 32], "", 0, []], [[], [["SP", 4, 0, 16, [1, 4, 1, 2], 1], ["SP", 4, 5, 65536, [1, 32, 2, 1], 1], ["SP", 4, 10, 144, [1, 1], 1], ["RE", 4, [0, 5, 1, 6, 2, 7, 10, 11, 3, 8, 12, 4, 9]], ["FSP", 6, 0, 0, 3], ["FSP", 6, 4, 1, 3], ["RE", 6, [0, 4, 1, 5, 2, 6, 3, 7]], ["CA", 4, 6, 5], ["CHR", 3, "shared", [4]], ["CA", 4, 5, 6], ["CI", 3], ["CHR", 1, "shared", [5]], ["CA", 2, 6, 6], ["CI", 1], ["FU", 8, [0, 1]], ["AN", 8, 0, 5], ["FU", 8, [1, 2]], ["AN", 8, 1, 4], ["FU", 8, [2, 3]], ["AN", 8, 2, 6], ["FU", 5, [0, 1]], ["SP", 5, 0, 4, [1], 1], ["AN", 5, 1, 2], ["FFSP", 5, 0, [1, 0], 1, 1], ["AN", 5, 1, 6], ["FU", 2, [0, 1]], ["SP", 2, 0, 4, [1], 1], ["AN", 2, 1, 2], ["FFSP", 2, 0, [1, 0], 1, 1], ["AN", 2, 1, 6], ["PR", 6, 0, "auto_unroll_max_step$1024"]]]], "r": [[0.000193997], 0, 8.08946, 1661162475], "v": "v0.6"}
{"i": [["[\"get_expr\", \"fused_conv_bias_relu_expr_S1D1P1\", [64, 16, 32, 32, 16, 3, 3]]", "cuda -keys=cuda,gpu -max_num_threads=1024 -thread_warp_size=32", [-1, 16, 64, 49152, 2147483647, 1024, 8, 32], "", 0, []], [[], [["SP", 4, 0, 16, [2, 2, 1, 1], 1], ["SP", 4, 5, 65536, [2, 32, 4, 1], 1], ["SP", 4, 10, 144, [36, 1], 1], ["RE", 4, [0, 5, 1, 6, 2, 7, 10, 11, 3, 8, 12, 4, 9]], ["FSP", 6, 0, 0, 3], ["FSP", 6, 4, 1, 3], ["RE", 6, [0, 4, 1, 5, 2, 6, 3, 7]], ["CA", 4, 6, 5], ["CHR", 3, "shared", [4]], ["CA", 4, 5, 6], ["CI", 3], ["CHR", 1, "shared", [5]], ["CA", 2, 6, 6], ["CI", 1], ["FU", 8, [0, 1]], ["AN", 8, 0, 5], ["FU", 8, [1, 2]], ["AN", 8, 1, 4], ["FU", 8, [2, 3]], ["AN", 8, 2, 6], ["FU", 5, [0, 1]], ["SP", 5, 0, 2, [1], 1], ["AN", 5, 1, 2], ["FFSP", 5, 0, [1, 0], 1, 1], ["AN", 5, 1, 6], ["FU", 2, [0, 1]], ["SP", 2, 0, 8, [1], 1], ["AN", 2, 1, 2], ["FFSP", 2, 0, [1, 0], 1, 1], ["AN", 2, 1, 6], ["PR", 6, 0, "auto_unroll_max_step$512"]]]], "r": [[0.000125297], 0, 6.08399, 1661162477], "v": "v0.6"}
{"i": [["[\"get_expr\", \"fused_conv_bias_relu_expr_S1D1P1\", [64, 16, 32, 32, 16, 3, 3]]", "cuda -keys=cuda,gpu -max_num_threads=1024 -thread_warp_size=32", [-1, 16, 64, 49152, 2147483647, 1024, 8, 32], "", 0, []], [[], [["SP", 4, 0, 16, [1, 2, 2, 4], 1], ["SP", 4, 5, 65536, [4, 4, 64, 2], 1], ["SP", 4, 10, 144, [1, 2], 1], ["RE", 4, [0, 5, 1, 6, 2, 7, 10, 11, 3, 8, 12, 4, 9]], ["FSP", 6, 0, 0, 3], ["FSP", 6, 4, 1, 3], ["RE", 6, [0, 4, 1, 5, 2, 6, 3, 7]], ["CA", 4, 6, 5], ["CHR", 3, "shared", [4]], ["CA", 4, 5, 6], ["CI", 3], ["CHR", 1, "shared", [5]], ["CA", 2, 6, 6], ["CI", 1], ["FU", 8, [0, 1]], ["AN", 8, 0, 5], ["FU", 8, [1, 2]], ["AN", 8, 1, 4], ["FU", 8, [2, 3]], ["AN", 8, 2, 6], ["FU", 5, [0, 1]], ["SP", 5, 0, 16, [1], 1], ["AN", 5, 1, 2], ["FFSP", 5, 0, [1, 0], 1, 1], ["AN", 5, 1, 6], ["FU", 2, [0, 1]], ["SP", 2, 0, 16, [1], 1], ["AN", 2, 1, 2], ["FFSP", 2, 0, [1, 0], 1, 1], ["AN", 2, 1, 6], ["PR", 6, 0, "auto_unroll_max_step$16"]]]], "r": [[0.0154023], 0, 3.85507, 1661162479], "v": "v0.6"}
{"i": [["[\"get_expr\", \"fused_conv_bias_relu_expr_S1D1P1\", [64, 16, 32, 32, 16, 3, 3]]", "cuda -keys=cuda,gpu -max_num_threads=1024 -thread_warp_size=32", [-1, 16, 64, 49152, 2147483647, 1024, 8, 32], "", 0, []], [[], [["SP", 4, 0, 16, [2, 2, 4, 1], 1], ["SP", 4, 5, 65536, [4, 16, 2, 1], 1], ["SP", 4, 10, 144, [24, 1], 1], ["RE", 4, [0, 5, 1, 6, 2, 7, 10, 11, 3, 8, 12, 4, 9]], ["FSP", 6, 0, 0, 3], ["FSP", 6, 4, 1, 3], ["RE", 6, [0, 4, 1, 5, 2, 6, 3, 7]], ["CA", 4, 6, 5], ["CHR", 3, "shared", [4]], ["CA", 4, 5, 6], ["CI", 3], ["CHR", 1, "shared", [5]], ["CA", 2, 6, 6], ["CI", 1], ["FU", 8, [0, 1]], ["AN", 8, 0, 5], ["FU", 8, [1, 2]], ["AN", 8, 1, 4], ["FU", 8, [2, 3]], ["AN", 8, 2, 6], ["FU", 5, [0, 1]], ["SP", 5, 0, 96, [1], 1], ["AN", 5, 1, 2], ["FFSP", 5, 0, [1, 0], 1, 1], ["AN", 5, 1, 6], ["FU", 2, [0, 1]], ["SP", 2, 0, 48, [1], 1], ["AN", 2, 1, 2], ["FFSP", 2, 0, [1, 0], 1, 1], ["AN", 2, 1, 6], ["PR", 6, 0, "auto_unroll_max_step$1024"]]]], "r": [[7.12454e-05], 0, 4.16171, 1661162480], "v": "v0.6"}
{"i": [["[\"get_expr\", \"fused_conv_bias_relu_expr_S1D1P1\", [64, 16, 32, 32, 16, 3, 3]]", "cuda -keys=cuda,gpu -max_num_threads=1024 -thread_warp_size=32", [-1, 16, 64, 49152, 2147483647, 1024, 8, 32], "", 0, []], [[], [["SP", 4, 0, 16, [2, 4, 2, 1], 1], ["SP", 4, 5, 65536, [1, 16, 4, 1], 1], ["SP", 4, 10, 144, [3, 2], 1], ["RE", 4, [0, 5, 1, 6, 2, 7, 10, 11, 3, 8, 12, 4, 9]], ["FSP", 6, 0, 0, 3], ["FSP", 6, 4, 1, 3], ["RE", 6, [0, 4, 1, 5, 2, 6, 3, 7]], ["CA", 4, 6, 5], ["CHR", 3, "shared", [4]], ["CA", 4, 5, 6], ["CI", 3], ["CHR", 1, "shared", [5]], ["CA", 2, 6, 6], ["CI", 1], ["FU", 8, [0, 1]], ["AN", 8, 0, 5], ["FU", 8, [1, 2]], ["AN", 8, 1, 4], ["FU", 8, [2, 3]], ["AN", 8, 2, 6], ["FU", 5, [0, 1]], ["SP", 5, 0, 48, [1], 1], ["AN", 5, 1, 2], ["FFSP", 5, 0, [1, 0], 1, 1], ["AN", 5, 1, 6], ["FU", 2, [0, 1]], ["SP", 2, 0, 96, [4], 1], ["AN", 2, 1, 2], ["FFSP", 2, 0, [1, 0], 1, 1], ["AN", 2, 1, 6], ["PR", 6, 0, "auto_unroll_max_step$64"]]]], "r": [[6.31994e-05], 0, 3.03141, 1661162482], "v": "v0.6"}
{"i": [["[\"get_expr\", \"fused_conv_bias_relu_expr_S1D1P1\", [64, 16, 32, 32, 16, 3, 3]]", "cuda -keys=cuda,gpu -max_num_threads=1024 -thread_warp_size=32", [-1, 16, 64, 49152, 2147483647, 1024, 8, 32], "", 0, []], [[], [["SP", 4, 0, 16, [1, 16, 1, 1], 1], ["SP", 4, 5, 65536, [2, 8, 1, 16], 1], ["SP", 4, 10, 144, [6, 1], 1], ["RE", 4, [0, 5, 1, 6, 2, 7, 10, 11, 3, 8, 12, 4, 9]], ["FSP", 6, 0, 0, 3], ["FSP", 6, 4, 1, 3], ["RE", 6, [0, 4, 1, 5, 2, 6, 3, 7]], ["CA", 4, 6, 5], ["CHR", 3, "shared", [4]], ["CA", 4, 5, 6], ["CI", 3], ["CHR", 1, "shared", [5]], ["CA", 2, 6, 6], ["CI", 1], ["FU", 8, [0, 1]], ["AN", 8, 0, 5], ["FU", 8, [1, 2]], ["AN", 8, 1, 4], ["FU", 8, [2, 3]], ["AN", 8, 2, 6], ["FU", 5, [0, 1]], ["SP", 5, 0, 12, [1], 1], ["AN", 5, 1, 2], ["FFSP", 5, 0, [1, 0], 1, 1], ["AN", 5, 1, 6], ["FU", 2, [0, 1]], ["SP", 2, 0, 96, [1], 1], ["AN", 2, 1, 2], ["FFSP", 2, 0, [1, 0], 1, 1], ["AN", 2, 1, 6], ["PR", 6, 0, "auto_unroll_max_step$512"]]]], "r": [[0.000244755], 0, 3.84781, 1661162483], "v": "v0.6"}
{"i": [["[\"get_expr\", \"fused_conv_bias_relu_expr_S1D1P1\", [64, 16, 32, 32, 16, 3, 3]]", "cuda -keys=cuda,gpu -max_num_threads=1024 -thread_warp_size=32", [-1, 16, 64, 49152, 2147483647, 1024, 8, 32], "", 0, []], [[], [["SP", 4, 0, 16, [2, 1, 1, 1], 1], ["SP", 4, 5, 65536, [1, 32, 1, 2], 1], ["SP", 4, 10, 144, [2, 1], 1], ["RE", 4, [0, 5, 1, 6, 2, 7, 10, 11, 3, 8, 12, 4, 9]], ["FSP", 6, 0, 0, 3], ["FSP", 6, 4, 1, 3], ["RE", 6, [0, 4, 1, 5, 2, 6, 3, 7]], ["CA", 4, 6, 5], ["CHR", 3, "shared", [4]], ["CA", 4, 5, 6], ["CI", 3], ["CHR", 1, "shared", [5]], ["CA", 2, 6, 6], ["CI", 1], ["FU", 8, [0, 1]], ["AN", 8, 0, 5], ["FU", 8, [1, 2]], ["AN", 8, 1, 4], ["FU", 8, [2, 3]], ["AN", 8, 2, 6], ["FU", 5, [0, 1]], ["SP", 5, 0, 8, [4], 1], ["AN", 5, 1, 2], ["FFSP", 5, 0, [1, 0], 1, 1], ["AN", 5, 1, 6], ["FU", 2, [0, 1]], ["SP", 2, 0, 16, [1], 1], ["AN", 2, 1, 2], ["FFSP", 2, 0, [1, 0], 1, 1], ["AN", 2, 1, 6], ["PR", 6, 0, "auto_unroll_max_step$64"]]]], "r": [[0.000292208], 0, 2.84327, 1661162485], "v": "v0.6"}
{"i": [["[\"get_expr\", \"fused_conv_bias_relu_expr_S1D1P1\", [64, 16, 32, 32, 16, 3, 3]]", "cuda -keys=cuda,gpu -max_num_threads=1024 -thread_warp_size=32", [-1, 16, 64, 49152, 2147483647, 1024, 8, 32], "", 0, []], [[], [["SP", 4, 0, 16, [1, 16, 1, 1], 1], ["SP", 4, 5, 65536, [8, 4, 1, 2], 1], ["SP", 4, 10, 144, [9, 4], 1], ["RE", 4, [0, 5, 1, 6, 2, 7, 10, 11, 3, 8, 12, 4, 9]], ["FSP", 6, 0, 0, 3], ["FSP", 6, 4, 1, 3], ["RE", 6, [0, 4, 1, 5, 2, 6, 3, 7]], ["CA", 4, 6, 5], ["CHR", 3, "shared", [4]], ["CA", 4, 5, 6], ["CI", 3], ["CHR", 1, "shared", [5]], ["CA", 2, 6, 6], ["CI", 1], ["FU", 8, [0, 1]], ["AN", 8, 0, 5], ["FU", 8, [1, 2]], ["AN", 8, 1, 4], ["FU", 8, [2, 3]], ["AN", 8, 2, 6], ["FU", 5, [0, 1]], ["SP", 5, 0, 36, [1], 1], ["AN", 5, 1, 2], ["FFSP", 5, 0, [1, 0], 1, 1], ["AN", 5, 1, 6], ["FU", 2, [0, 1]], ["SP", 2, 0, 72, [1], 1], ["AN", 2, 1, 2], ["FFSP", 2, 0, [1, 0], 1, 1], ["AN", 2, 1, 6], ["PR", 6, 0, "auto_unroll_max_step$0"]]]], "r": [[7.09859e-05], 0, 2.96801, 1661162485], "v": "v0.6"}
{"i": [["[\"get_expr\", \"fused_conv_bias_relu_expr_S1D1P1\", [64, 16, 32, 32, 16, 3, 3]]", "cuda -keys=cuda,gpu -max_num_threads=1024 -thread_warp_size=32", [-1, 16, 64, 49152, 2147483647, 1024, 8, 32], "", 0, []], [[], [["SP", 4, 0, 16, [2, 1, 4, 1], 1], ["SP", 4, 5, 65536, [2, 32, 2, 1], 1], ["SP", 4, 10, 144, [6, 4], 1], ["RE", 4, [0, 5, 1, 6, 2, 7, 10, 11, 3, 8, 12, 4, 9]], ["FSP", 6, 0, 0, 3], ["FSP", 6, 4, 1, 3], ["RE", 6, [0, 4, 1, 5, 2, 6, 3, 7]], ["CA", 4, 6, 5], ["CHR", 3, "shared", [4]], ["CA", 4, 5, 6], ["CI", 3], ["CHR", 1, "shared", [5]], ["CA", 2, 6, 6], ["CI", 1], ["FU", 8, [0, 1]], ["AN", 8, 0, 5], ["FU", 8, [1, 2]], ["AN", 8, 1, 4], ["FU", 8, [2, 3]], ["AN", 8, 2, 6], ["FU", 5, [0, 1]], ["SP", 5, 0, 96, [1], 1], ["AN", 5, 1, 2], ["FFSP", 5, 0, [1, 0], 1, 1], ["AN", 5, 1, 6], ["FU", 2, [0, 1]], ["SP", 2, 0, 24, [1], 1], ["AN", 2, 1, 2], ["FFSP", 2, 0, [1, 0], 1, 1], ["AN", 2, 1, 6], ["PR", 6, 0, "auto_unroll_max_step$16"]]]], "r": [[0.000237876], 0, 3.56725, 1661162488], "v": "v0.6"}
{"i": [["[\"get_expr\", \"fused_conv_bias_relu_expr_S1D1P1\", [64, 16, 32, 32, 16, 3, 3]]", "cuda -keys=cuda,gpu -max_num_threads=1024 -thread_warp_size=32", [-1, 16, 64, 49152, 2147483647, 1024, 8, 32], "", 0, []], [[], [["SP", 4, 0, 16, [8, 1, 1, 1], 1], ["SP", 4, 5, 65536, [1, 32, 32, 1], 1], ["SP", 4, 10, 144, [2, 2], 1], ["RE", 4, [0, 5, 1, 6, 2, 7, 10, 11, 3, 8, 12, 4, 9]], ["FSP", 6, 0, 0, 3], ["FSP", 6, 4, 1, 3], ["RE", 6, [0, 4, 1, 5, 2, 6, 3, 7]], ["CA", 4, 6, 5], ["CHR", 3, "shared", [4]], ["CA", 4, 5, 6], ["CI", 3], ["CHR", 1, "shared", [5]], ["CA", 2, 6, 6], ["CI", 1], ["FU", 8, [0, 1]], ["AN", 8, 0, 5], ["FU", 8, [1, 2]], ["AN", 8, 1, 4], ["FU", 8, [2, 3]], ["AN", 8, 2, 6], ["FU", 5, [0, 1]], ["SP", 5, 0, 1, [1], 1], ["AN", 5, 1, 2], ["FFSP", 5, 0, [1, 0], 1, 1], ["AN", 5, 1, 6], ["FU", 2, [0, 1]], ["SP", 2, 0, 32, [1], 1], ["AN", 2, 1, 2], ["FFSP", 2, 0, [1, 0], 1, 1], ["AN", 2, 1, 6], ["PR", 6, 0, "auto_unroll_max_step$512"]]]], "r": [[0.000647064], 0, 6.99067, 1661162491], "v": "v0.6"}
{"i": [["[\"get_expr\", \"fused_conv_bias_relu_expr_S1D1P1\", [64, 16, 32, 32, 16, 3, 3]]", "cuda -keys=cuda,gpu -max_num_threads=1024 -thread_warp_size=32", [-1, 16, 64, 49152, 2147483647, 1024, 8, 32], "", 0, []], [[], [["SP", 4, 0, 16, [4, 4, 1, 1], 1], ["SP", 4, 5, 65536, [1, 256, 1, 1], 1], ["SP", 4, 10, 144, [12, 2], 1], ["RE", 4, [0, 5, 1, 6, 2, 7, 10, 11, 3, 8, 12, 4, 9]], ["FSP", 6, 0, 0, 3], ["FSP", 6, 4, 1, 3], ["RE", 6, [0, 4, 1, 5, 2, 6, 3, 7]], ["CA", 4, 6, 5], ["CHR", 3, "shared", [4]], ["CA", 4, 5, 6], ["CI", 3], ["CHR", 1, "shared", [5]], ["CA", 2, 6, 6], ["CI", 1], ["FU", 8, [0, 1]], ["AN", 8, 0, 5], ["FU", 8, [1, 2]], ["AN", 8, 1, 4], ["FU", 8, [2, 3]], ["AN", 8, 2, 6], ["FU", 5, [0, 1]], ["SP", 5, 0, 24, [1], 1], ["AN", 5, 1, 2], ["FFSP", 5, 0, [1, 0], 1, 1], ["AN", 5, 1, 6], ["FU", 2, [0, 1]], ["SP", 2, 0, 24, [1], 1], ["AN", 2, 1, 2], ["FFSP", 2, 0, [1, 0], 1, 1], ["AN", 2, 1, 6], ["PR", 6, 0, "auto_unroll_max_step$1024"]]]], "r": [[0.000103861], 0, 4.30409, 1661162492], "v": "v0.6"}
{"i": [["[\"get_expr\", \"fused_conv_bias_relu_expr_S1D1P1\", [64, 16, 32, 32, 16, 3, 3]]", "cuda -keys=cuda,gpu -max_num_threads=1024 -thread_warp_size=32", [-1, 16, 64, 49152, 2147483647, 1024, 8, 32], "", 0, []], [[], [["SP", 4, 0, 16, [2, 4, 2, 1], 1], ["SP", 4, 5, 65536, [1, 32, 4, 1], 1], ["SP", 4, 10, 144, [12, 2], 1], ["RE", 4, [0, 5, 1, 6, 2, 7, 10, 11, 3, 8, 12, 4, 9]], ["FSP", 6, 0, 0, 3], ["FSP", 6, 4, 1, 3], ["RE", 6, [0, 4, 1, 5, 2, 6, 3, 7]], ["CA", 4, 6, 5], ["CHR", 3, "shared", [4]], ["CA", 4, 5, 6], ["CI", 3], ["CHR", 1, "shared", [5]], ["CA", 2, 6, 6], ["CI", 1], ["FU", 8, [0, 1]], ["AN", 8, 0, 5], ["FU", 8, [1, 2]], ["AN", 8, 1, 4], ["FU", 8, [2, 3]], ["AN", 8, 2, 6], ["FU", 5, [0, 1]], ["SP", 5, 0, 48, [1], 1], ["AN", 5, 1, 2], ["FFSP", 5, 0, [1, 0], 1, 1], ["AN", 5, 1, 6], ["FU", 2, [0, 1]], ["SP", 2, 0, 96, [48], 1], ["AN", 2, 1, 2], ["FFSP", 2, 0, [1, 0], 1, 1], ["AN", 2, 1, 6], ["PR", 6, 0, "auto_unroll_max_step$0"]]]], "r": [[0.00012377], 0, 3.05947, 1661162494], "v": "v0.6"}
{"i": [["[\"get_expr\", \"fused_conv_bias_relu_expr_S1D1P1\", [64, 16, 32, 32, 16, 3, 3]]", "cuda -keys=cuda,gpu -max_num_threads=1024 -thread_warp_size=32", [-1, 16, 64, 49152, 2147483647, 1024, 8, 32], "", 0, []], [[], [["SP", 4, 0, 16, [8, 1, 1, 1], 1], ["SP", 4, 5, 65536, [1, 32, 32, 1], 1], ["SP", 4, 10, 144, [1, 1], 1], ["RE", 4, [0, 5, 1, 6, 2, 7, 10, 11, 3, 8, 12, 4, 9]], ["FSP", 6, 0, 0, 3], ["FSP", 6, 4, 1, 3], ["RE", 6, [0, 4, 1, 5, 2, 6, 3, 7]], ["CA", 4, 6, 5], ["CHR", 3, "shared", [4]], ["CA", 4, 5, 6], ["CI", 3], ["CHR", 1, "shared", [5]], ["CA", 2, 6, 6], ["CI", 1], ["FU", 8, [0, 1]], ["AN", 8, 0, 5], ["FU", 8, [1, 2]], ["AN", 8, 1, 4], ["FU", 8, [2, 3]], ["AN", 8, 2, 6], ["FU", 5, [0, 1]], ["SP", 5, 0, 1, [1], 1], ["AN", 5, 1, 2], ["FFSP", 5, 0, [1, 0], 1, 1], ["AN", 5, 1, 6], ["FU", 2, [0, 1]], ["SP", 2, 0, 32, [1], 1], ["AN", 2, 1, 2], ["FFSP", 2, 0, [1, 0], 1, 1], ["AN", 2, 1, 6], ["PR", 6, 0, "auto_unroll_max_step$1024"]]]], "r": [[0.000291953], 0, 3.86076, 1661162495], "v": "v0.6"}
{"i": [["[\"get_expr\", \"fused_conv_bias_relu_expr_S1D1P1\", [64, 16, 32, 32, 16, 3, 3]]", "cuda -keys=cuda,gpu -max_num_threads=1024 -thread_warp_size=32", [-1, 16, 64, 49152, 2147483647, 1024, 8, 32], "", 0, []], [[], [["SP", 4, 0, 16, [1, 8, 2, 1], 1], ["SP", 4, 5, 65536, [1, 64, 1, 16], 1], ["SP", 4, 10, 144, [1, 4], 1], ["RE", 4, [0, 5, 1, 6, 2, 7, 10, 11, 3, 8, 12, 4, 9]], ["FSP", 6, 0, 0, 3], ["FSP", 6, 4, 1, 3], ["RE", 6, [0, 4, 1, 5, 2, 6, 3, 7]], ["CA", 4, 6, 5], ["CHR", 3, "shared", [4]], ["CA", 4, 5, 6], ["CI", 3], ["CHR", 1, "shared", [5]], ["CA", 2, 6, 6], ["CI", 1], ["FU", 8, [0, 1]], ["AN", 8, 0, 5], ["FU", 8, [1, 2]], ["AN", 8, 1, 4], ["FU", 8, [2, 3]], ["AN", 8, 2, 6], ["FU", 5, [0, 1]], ["SP", 5, 0, 8, [2], 1], ["AN", 5, 1, 2], ["FFSP", 5, 0, [1, 0], 1, 1], ["AN", 5, 1, 6], ["FU", 2, [0, 1]], ["SP", 2, 0, 16, [1], 1], ["AN", 2, 1, 2], ["FFSP", 2, 0, [1, 0], 1, 1], ["AN", 2, 1, 6], ["PR", 6, 0, "auto_unroll_max_step$1024"]]]], "r": [[0.000208039], 0, 3.32027, 1661162496], "v": "v0.6"}
{"i": [["[\"get_expr\", \"fused_conv_bias_relu_expr_S1D1P1\", [64, 16, 32, 32, 16, 3, 3]]", "cuda -keys=cuda,gpu -max_num_threads=1024 -thread_warp_size=32", [-1, 16, 64, 49152, 2147483647, 1024, 8, 32], "", 0, []], [[], [["SP", 4, 0, 16, [2, 4, 2, 1], 1], ["SP", 4, 5, 65536, [1, 32, 4, 1], 1], ["SP", 4, 10, 144, [12, 2], 1], ["RE", 4, [0, 5, 1, 6, 2, 7, 10, 11, 3, 8, 12, 4, 9]], ["FSP", 6, 0, 0, 3], ["FSP", 6, 4, 1, 3], ["RE", 6, [0, 4, 1, 5, 2, 6, 3, 7]], ["CA", 4, 6, 5], ["CHR", 3, "shared", [4]], ["CA", 4, 5, 6], ["CI", 3], ["CHR", 1, "shared", [5]], ["CA", 2, 6, 6], ["CI", 1], ["FU", 8, [0, 1]], ["AN", 8, 0, 5], ["FU", 8, [1, 2]], ["AN", 8, 1, 4], ["FU", 8, [2, 3]], ["AN", 8, 2, 6], ["FU", 5, [0, 1]], ["SP", 5, 0, 48, [16], 1], ["AN", 5, 1, 2], ["FFSP", 5, 0, [1, 0], 1, 1], ["AN", 5, 1, 6], ["FU", 2, [0, 1]], ["SP", 2, 0, 96, [3], 1], ["AN", 2, 1, 2], ["FFSP", 2, 0, [1, 0], 1, 1], ["AN", 2, 1, 6], ["PR", 6, 0, "auto_unroll_max_step$64"]]]], "r": [[6.2162e-05], 0, 3.80414, 1661162498], "v": "v0.6"}
{"i": [["[\"get_expr\", \"fused_conv_bias_relu_expr_S1D1P1\", [64, 16, 32, 32, 16, 3, 3]]", "cuda -keys=cuda,gpu -max_num_threads=1024 -thread_warp_size=32", [-1, 16, 64, 49152, 2147483647, 1024, 8, 32], "", 0, []], [[], [["SP", 4, 0, 16, [2, 2, 4, 1], 1], ["SP", 4, 5, 65536, [1, 32, 1, 2], 1], ["SP", 4, 10, 144, [3, 8], 1], ["RE", 4, [0, 5, 1, 6, 2, 7, 10, 11, 3, 8, 12, 4, 9]], ["FSP", 6, 0, 0, 3], ["FSP", 6, 4, 1, 3], ["RE", 6, [0, 4, 1, 5, 2, 6, 3, 7]], ["CA", 4, 6, 5], ["CHR", 3, "shared", [4]], ["CA", 4, 5, 6], ["CI", 3], ["CHR", 1, "shared", [5]], ["CA", 2, 6, 6], ["CI", 1], ["FU", 8, [0, 1]], ["AN", 8, 0, 5], ["FU", 8, [1, 2]], ["AN", 8, 1, 4], ["FU", 8, [2, 3]], ["AN", 8, 2, 6], ["FU", 5, [0, 1]], ["SP", 5, 0, 288, [1], 1], ["AN", 5, 1, 2], ["FFSP", 5, 0, [1, 0], 1, 1], ["AN", 5, 1, 6], ["FU", 2, [0, 1]], ["SP", 2, 0, 144, [1], 1], ["AN", 2, 1, 2], ["FFSP", 2, 0, [1, 0], 1, 1], ["AN", 2, 1, 6], ["PR", 6, 0, "auto_unroll_max_step$64"]]]], "r": [[4.54899e-05], 0, 4.01042, 1661162500], "v": "v0.6"}
{"i": [["[\"get_expr\", \"fused_conv_bias_relu_expr_S1D1P1\", [64, 16, 32, 32, 16, 3, 3]]", "cuda -keys=cuda,gpu -max_num_threads=1024 -thread_warp_size=32", [-1, 16, 64, 49152, 2147483647, 1024, 8, 32], "", 0, []], [[], [["SP", 4, 0, 16, [2, 1, 4, 1], 1], ["SP", 4, 5, 65536, [1, 32, 1, 4], 1], ["SP", 4, 10, 144, [6, 4], 1], ["RE", 4, [0, 5, 1, 6, 2, 7, 10, 11, 3, 8, 12, 4, 9]], ["FSP", 6, 0, 0, 3], ["FSP", 6, 4, 1, 3], ["RE", 6, [0, 4, 1, 5, 2, 6, 3, 7]], ["CA", 4, 6, 5], ["CHR", 3, "shared", [4]], ["CA", 4, 5, 6], ["CI", 3], ["CHR", 1, "shared", [5]], ["CA", 2, 6, 6], ["CI", 1], ["FU", 8, [0, 1]], ["AN", 8, 0, 5], ["FU", 8, [1, 2]], ["AN", 8, 1, 4], ["FU", 8, [2, 3]], ["AN", 8, 2, 6], ["FU", 5, [0, 1]], ["SP", 5, 0, 96, [16], 1], ["AN", 5, 1, 2], ["FFSP", 5, 0, [1, 0], 1, 1], ["AN", 5, 1, 6], ["FU", 2, [0, 1]], ["SP", 2, 0, 24, [24], 1], ["AN", 2, 1, 2], ["FFSP", 2, 0, [1, 0], 1, 1], ["AN", 2, 1, 6], ["PR", 6, 0, "auto_unroll_max_step$0"]]]], "r": [[0.000266747], 0, 3.09719, 1661162501], "v": "v0.6"}
{"i": [["[\"get_expr\", \"fused_conv_bias_relu_expr_S1D1P1\", [64, 16, 32, 32, 16, 3, 3]]", "cuda -keys=cuda,gpu -max_num_threads=1024 -thread_warp_size=32", [-1, 16, 64, 49152, 2147483647, 1024, 8, 32], "", 0, []], [[], [["SP", 4, 0, 16, [1, 4, 1, 1], 1], ["SP", 4, 5, 65536, [1, 16, 8, 8], 1], ["SP", 4, 10, 144, [3, 1], 1], ["RE", 4, [0, 5, 1, 6, 2, 7, 10, 11, 3, 8, 12, 4, 9]], ["FSP", 6, 0, 0, 3], ["FSP", 6, 4, 1, 3], ["RE", 6, [0, 4, 1, 5, 2, 6, 3, 7]], ["CA", 4, 6, 5], ["CHR", 3, "shared", [4]], ["CA", 4, 5, 6], ["CI", 3], ["CHR", 1, "shared", [5]], ["CA", 2, 6, 6], ["CI", 1], ["FU", 8, [0, 1]], ["AN", 8, 0, 5], ["FU", 8, [1, 2]], ["AN", 8, 1, 4], ["FU", 8, [2, 3]], ["AN", 8, 2, 6], ["FU", 5, [0, 1]], ["SP", 5, 0, 6, [1], 1], ["AN", 5, 1, 2], ["FFSP", 5, 0, [1, 0], 1, 1], ["AN", 5, 1, 6], ["FU", 2, [0, 1]], ["SP", 2, 0, 384, [1], 1], ["AN", 2, 1, 2], ["FFSP", 2, 0, [1, 0], 1, 1], ["AN", 2, 1, 6], ["PR", 6, 0, "auto_unroll_max_step$1024"]]]], "r": [[0.000556906], 0, 3.79415, 1661162503], "v": "v0.6"}
{"i": [["[\"get_expr\", \"fused_conv_bias_relu_expr_S1D1P1\", [64, 16, 32, 32, 16, 3, 3]]", "cuda -keys=cuda,gpu -max_num_threads=1024 -thread_warp_size=32", [-1, 16, 64, 49152, 2147483647, 1024, 8, 32], "", 0, []], [[], [["SP", 4, 0, 16, [1, 16, 1, 1], 1], ["SP", 4, 5, 65536, [2, 2, 64, 2], 1], ["SP", 4, 10, 144, [4, 4], 1], ["RE", 4, [0, 5, 1, 6, 2, 7, 10, 11, 3, 8, 12, 4, 9]], ["FSP", 6, 0, 0, 3], ["FSP", 6, 4, 1, 3], ["RE", 6, [0, 4, 1, 5, 2, 6, 3, 7]], ["CA", 4, 6, 5], ["CHR", 3, "shared", [4]], ["CA", 4, 5, 6], ["CI", 3], ["CHR", 1, "shared", [5]], ["CA", 2, 6, 6], ["CI", 1], ["FU", 8, [0, 1]], ["AN", 8, 0, 5], ["FU", 8, [1, 2]], ["AN", 8, 1, 4], ["FU", 8, [2, 3]], ["AN", 8, 2, 6], ["FU", 5, [0, 1]], ["SP", 5, 0, 16, [4], 1], ["AN", 5, 1, 2], ["FFSP", 5, 0, [1, 0], 1, 1], ["AN", 5, 1, 6], ["FU", 2, [0, 1]], ["SP", 2, 0, 2048, [1], 1], ["AN", 2, 1, 2], ["FFSP", 2, 0, [1, 0], 1, 1], ["AN", 2, 1, 6], ["PR", 6, 0, "auto_unroll_max_step$0"]]]], "r": [[0.00102949], 0, 5.78754, 1661162506], "v": "v0.6"}
{"i": [["[\"get_expr\", \"fused_conv_bias_relu_expr_S1D1P1\", [64, 16, 32, 32, 16, 3, 3]]", "cuda -keys=cuda,gpu -max_num_threads=1024 -thread_warp_size=32", [-1, 16, 64, 49152, 2147483647, 1024, 8, 32], "", 0, []], [[], [["SP", 4, 0, 16, [1, 4, 2, 1], 1], ["SP", 4, 5, 65536, [1, 8, 1, 16], 1], ["SP", 4, 10, 144, [24, 3], 1], ["RE", 4, [0, 5, 1, 6, 2, 7, 10, 11, 3, 8, 12, 4, 9]], ["FSP", 6, 0, 0, 3], ["FSP", 6, 4, 1, 3], ["RE", 6, [0, 4, 1, 5, 2, 6, 3, 7]], ["CA", 4, 6, 5], ["CHR", 3, "shared", [4]], ["CA", 4, 5, 6], ["CI", 3], ["CHR", 1, "shared", [5]], ["CA", 2, 6, 6], ["CI", 1], ["FU", 8, [0, 1]], ["AN", 8, 0, 5], ["FU", 8, [1, 2]], ["AN", 8, 1, 4], ["FU", 8, [2, 3]], ["AN", 8, 2, 6], ["FU", 5, [0, 1]], ["SP", 5, 0, 144, [48], 1], ["AN", 5, 1, 2], ["FFSP", 5, 0, [1, 0], 1, 1], ["AN", 5, 1, 6], ["FU", 2, [0, 1]], ["SP", 2, 0, 576, [1], 1], ["AN", 2, 1, 2], ["FFSP", 2, 0, [1, 0], 1, 1], ["AN", 2, 1, 6], ["PR", 6, 0, "auto_unroll_max_step$64"]]]], "r": [[0.000775047], 0, 3.85075, 1661162508], "v": "v0.6"}
{"i": [["[\"get_expr\", \"fused_conv_bias_relu_expr_S1D1P1\", [64, 16, 32, 32, 16, 3, 3]]", "cuda -keys=cuda,gpu -max_num_threads=1024 -thread_warp_size=32", [-1, 16, 64, 49152, 2147483647, 1024, 8, 32], "", 0, []], [[], [["SP", 4, 0, 16, [2, 4, 2, 1], 1], ["SP", 4, 5, 65536, [1, 8, 64, 2], 1], ["SP", 4, 10, 144, [6, 1], 1], ["RE", 4, [0, 5, 1, 6, 2, 7, 10, 11, 3, 8, 12, 4, 9]], ["FSP", 6, 0, 0, 3], ["FSP", 6, 4, 1, 3], ["RE", 6, [0, 4, 1, 5, 2, 6, 3, 7]], ["CA", 4, 6, 5], ["CHR", 3, "shared", [4]], ["CA", 4, 5, 6], ["CI", 3], ["CHR", 1, "shared", [5]], ["CA", 2, 6, 6], ["CI", 1], ["FU", 8, [0, 1]], ["AN", 8, 0, 5], ["FU", 8, [1, 2]], ["AN", 8, 1, 4], ["FU", 8, [2, 3]], ["AN", 8, 2, 6], ["FU", 5, [0, 1]], ["SP", 5, 0, 12, [1], 1], ["AN", 5, 1, 2], ["FFSP", 5, 0, [1, 0], 1, 1], ["AN", 5, 1, 6], ["FU", 2, [0, 1]], ["SP", 2, 0, 768, [1], 1], ["AN", 2, 1, 2], ["FFSP", 2, 0, [1, 0], 1, 1], ["AN", 2, 1, 6], ["PR", 6, 0, "auto_unroll_max_step$512"]]]], "r": [[0.00152953], 0, 8.38698, 1661162511], "v": "v0.6"}
{"i": [["[\"get_expr\", \"fused_conv_bias_relu_expr_S1D1P1\", [64, 16, 32, 32, 16, 3, 3]]", "cuda -keys=cuda,gpu -max_num_threads=1024 -thread_warp_size=32", [-1, 16, 64, 49152, 2147483647, 1024, 8, 32], "", 0, []], [[], [["SP", 4, 0, 16, [4, 2, 1, 2], 1], ["SP", 4, 5, 65536, [1, 32, 8, 2], 1], ["SP", 4, 10, 144, [1, 9], 1], ["RE", 4, [0, 5, 1, 6, 2, 7, 10, 11, 3, 8, 12, 4, 9]], ["FSP", 6, 0, 0, 3], ["FSP", 6, 4, 1, 3], ["RE", 6, [0, 4, 1, 5, 2, 6, 3, 7]], ["CA", 4, 6, 5], ["CHR", 3, "shared", [4]], ["CA", 4, 5, 6], ["CI", 3], ["CHR", 1, "shared", [5]], ["CA", 2, 6, 6], ["CI", 1], ["FU", 8, [0, 1]], ["AN", 8, 0, 5], ["FU", 8, [1, 2]], ["AN", 8, 1, 4], ["FU", 8, [2, 3]], ["AN", 8, 2, 6], ["FU", 5, [0, 1]], ["SP", 5, 0, 18, [1], 1], ["AN", 5, 1, 2], ["FFSP", 5, 0, [1, 0], 1, 1], ["AN", 5, 1, 6], ["FU", 2, [0, 1]], ["SP", 2, 0, 144, [1], 1], ["AN", 2, 1, 2], ["FFSP", 2, 0, [1, 0], 1, 1], ["AN", 2, 1, 6], ["PR", 6, 0, "auto_unroll_max_step$0"]]]], "r": [[0.000327667], 0, 3.2926, 1661162512], "v": "v0.6"}
{"i": [["[\"get_expr\", \"fused_conv_bias_relu_expr_S1D1P1\", [64, 16, 32, 32, 16, 3, 3]]", "cuda -keys=cuda,gpu -max_num_threads=1024 -thread_warp_size=32", [-1, 16, 64, 49152, 2147483647, 1024, 8, 32], "", 0, []], [[], [["SP", 4, 0, 16, [2, 2, 1, 1], 1], ["SP", 4, 5, 65536, [1, 32, 1, 2], 1], ["SP", 4, 10, 144, [9, 8], 1], ["RE", 4, [0, 5, 1, 6, 2, 7, 10, 11, 3, 8, 12, 4, 9]], ["FSP", 6, 0, 0, 3], ["FSP", 6, 4, 1, 3], ["RE", 6, [0, 4, 1, 5, 2, 6, 3, 7]], ["CA", 4, 6, 5], ["CHR", 3, "shared", [4]], ["CA", 4, 5, 6], ["CI", 3], ["CHR", 1, "shared", [5]], ["CA", 2, 6, 6], ["CI", 1], ["FU", 8, [0, 1]], ["AN", 8, 0, 5], ["FU", 8, [1, 2]], ["AN", 8, 1, 4], ["FU", 8, [2, 3]], ["AN", 8, 2, 6], ["FU", 5, [0, 1]], ["SP", 5, 0, 288, [1], 1], ["AN", 5, 1, 2], ["FFSP", 5, 0, [1, 0], 1, 1], ["AN", 5, 1, 6], ["FU", 2, [0, 1]], ["SP", 2, 0, 144, [1], 1], ["AN", 2, 1, 2], ["FFSP", 2, 0, [1, 0], 1, 1], ["AN", 2, 1, 6], ["PR", 6, 0, "auto_unroll_max_step$0"]]]], "r": [[0.000176637], 0, 2.74742, 1661162524], "v": "v0.6"}
{"i": [["[\"get_expr\", \"fused_conv_bias_relu_expr_S1D1P1\", [64, 16, 32, 32, 16, 3, 3]]", "cuda -keys=cuda,gpu -max_num_threads=1024 -thread_warp_size=32", [-1, 16, 64, 49152, 2147483647, 1024, 8, 32], "", 0, []], [[], [["SP", 4, 0, 16, [1, 2, 1, 1], 1], ["SP", 4, 5, 65536, [1, 32, 2, 1], 1], ["SP", 4, 10, 144, [1, 3], 1], ["RE", 4, [0, 5, 1, 6, 2, 7, 10, 11, 3, 8, 12, 4, 9]], ["FSP", 6, 0, 0, 3], ["FSP", 6, 4, 1, 3], ["RE", 6, [0, 4, 1, 5, 2, 6, 3, 7]], ["CA", 4, 6, 5], ["CHR", 3, "shared", [4]], ["CA", 4, 5, 6], ["CI", 3], ["CHR", 1, "shared", [5]], ["CA", 2, 6, 6], ["CI", 1], ["FU", 8, [0, 1]], ["AN", 8, 0, 5], ["FU", 8, [1, 2]], ["AN", 8, 1, 4], ["FU", 8, [2, 3]], ["AN", 8, 2, 6], ["FU", 5, [0, 1]], ["SP", 5, 0, 3, [3], 1], ["AN", 5, 1, 2], ["FFSP", 5, 0, [1, 0], 1, 1], ["AN", 5, 1, 6], ["FU", 2, [0, 1]], ["SP", 2, 0, 6, [1], 1], ["AN", 2, 1, 2], ["FFSP", 2, 0, [1, 0], 1, 1], ["AN", 2, 1, 6], ["PR", 6, 0, "auto_unroll_max_step$512"]]]], "r": [[0.00019666], 0, 4.8757, 1661162526], "v": "v0.6"}
{"i": [["[\"get_expr\", \"fused_conv_bias_relu_expr_S1D1P1\", [64, 16, 32, 32, 16, 3, 3]]", "cuda -keys=cuda,gpu -max_num_threads=1024 -thread_warp_size=32", [-1, 16, 64, 49152, 2147483647, 1024, 8, 32], "", 0, []], [[], [["SP", 4, 0, 16, [1, 1, 1, 4], 1], ["SP", 4, 5, 65536, [16, 16, 4, 1], 1], ["SP", 4, 10, 144, [1, 1], 1], ["RE", 4, [0, 5, 1, 6, 2, 7, 10, 11, 3, 8, 12, 4, 9]], ["FSP", 6, 0, 0, 3], ["FSP", 6, 4, 1, 3], ["RE", 6, [0, 4, 1, 5, 2, 6, 3, 7]], ["CA", 4, 6, 5], ["CHR", 3, "shared", [4]], ["CA", 4, 5, 6], ["CI", 3], ["CHR", 1, "shared", [5]], ["CA", 2, 6, 6], ["CI", 1], ["FU", 8, [0, 1]], ["AN", 8, 0, 5], ["FU", 8, [1, 2]], ["AN", 8, 1, 4], ["FU", 8, [2, 3]], ["AN", 8, 2, 6], ["FU", 5, [0, 1]], ["SP", 5, 0, 4, [1], 1], ["AN", 5, 1, 2], ["FFSP", 5, 0, [1, 0], 1, 1], ["AN", 5, 1, 6], ["FU", 2, [0, 1]], ["SP", 2, 0, 4, [4], 1], ["AN", 2, 1, 2], ["FFSP", 2, 0, [1, 0], 1, 1], ["AN", 2, 1, 6], ["PR", 6, 0, "auto_unroll_max_step$1024"]]]], "r": [[0.000456373], 0, 4.53705, 1661162528], "v": "v0.6"}
{"i": [["[\"get_expr\", \"fused_conv_bias_relu_expr_S1D1P1\", [64, 16, 32, 32, 16, 3, 3]]", "cuda -keys=cuda,gpu -max_num_threads=1024 -thread_warp_size=32", [-1, 16, 64, 49152, 2147483647, 1024, 8, 32], "", 0, []], [[], [["SP", 4, 0, 16, [2, 4, 2, 1], 1], ["SP", 4, 5, 65536, [1, 8, 64, 2], 1], ["SP", 4, 10, 144, [3, 1], 1], ["RE", 4, [0, 5, 1, 6, 2, 7, 10, 11, 3, 8, 12, 4, 9]], ["FSP", 6, 0, 0, 3], ["FSP", 6, 4, 1, 3], ["RE", 6, [0, 4, 1, 5, 2, 6, 3, 7]], ["CA", 4, 6, 5], ["CHR", 3, "shared", [4]], ["CA", 4, 5, 6], ["CI", 3], ["CHR", 1, "shared", [5]], ["CA", 2, 6, 6], ["CI", 1], ["FU", 8, [0, 1]], ["AN", 8, 0, 5], ["FU", 8, [1, 2]], ["AN", 8, 1, 4], ["FU", 8, [2, 3]], ["AN", 8, 2, 6], ["FU", 5, [0, 1]], ["SP", 5, 0, 12, [2], 1], ["AN", 5, 1, 2], ["FFSP", 5, 0, [1, 0], 1, 1], ["AN", 5, 1, 6], ["FU", 2, [0, 1]], ["SP", 2, 0, 768, [12], 1], ["AN", 2, 1, 2], ["FFSP", 2, 0, [1, 0], 1, 1], ["AN", 2, 1, 6], ["PR", 6, 0, "auto_unroll_max_step$512"]]]], "r": [[0.00189991], 0, 6.65389, 1661162530], "v": "v0.6"}
{"i": [["[\"get_expr\", \"fused_conv_bias_relu_expr_S1D1P1\", [64, 16, 32, 32, 16, 3, 3]]", "cuda -keys=cuda,gpu -max_num_threads=1024 -thread_warp_size=32", [-1, 16, 64, 49152, 2147483647, 1024, 8, 32], "", 0, []], [[], [["SP", 4, 0, 16, [2, 1, 4, 1], 1], ["SP", 4, 5, 65536, [2, 128, 1, 1], 1], ["SP", 4, 10, 144, [9, 1], 1], ["RE", 4, [0, 5, 1, 6, 2, 7, 10, 11, 3, 8, 12, 4, 9]], ["FSP", 6, 0, 0, 3], ["FSP", 6, 4, 1, 3], ["RE", 6, [0, 4, 1, 5, 2, 6, 3, 7]], ["CA", 4, 6, 5], ["CHR", 3, "shared", [4]], ["CA", 4, 5, 6], ["CI", 3], ["CHR", 1, "shared", [5]], ["CA", 2, 6, 6], ["CI", 1], ["FU", 8, [0, 1]], ["AN", 8, 0, 5], ["FU", 8, [1, 2]], ["AN", 8, 1, 4], ["FU", 8, [2, 3]], ["AN", 8, 2, 6], ["FU", 5, [0, 1]], ["SP", 5, 0, 36, [18], 1], ["AN", 5, 1, 2], ["FFSP", 5, 0, [1, 0], 1, 1], ["AN", 5, 1, 6], ["FU", 2, [0, 1]], ["SP", 2, 0, 18, [18], 1], ["AN", 2, 1, 2], ["FFSP", 2, 0, [1, 0], 1, 1], ["AN", 2, 1, 6], ["PR", 6, 0, "auto_unroll_max_step$512"]]]], "r": [[7.17607e-05], 0, 3.40472, 1661162532], "v": "v0.6"}
{"i": [["[\"get_expr\", \"fused_conv_bias_relu_expr_S1D1P1\", [64, 16, 32, 32, 16, 3, 3]]", "cuda -keys=cuda,gpu -max_num_threads=1024 -thread_warp_size=32", [-1, 16, 64, 49152, 2147483647, 1024, 8, 32], "", 0, []], [[], [["SP", 4, 0, 16, [2, 2, 2, 1], 1], ["SP", 4, 5, 65536, [1, 16, 1, 8], 1], ["SP", 4, 10, 144, [1, 3], 1], ["RE", 4, [0, 5, 1, 6, 2, 7, 10, 11, 3, 8, 12, 4, 9]], ["FSP", 6, 0, 0, 3], ["FSP", 6, 4, 1, 3], ["RE", 6, [0, 4, 1, 5, 2, 6, 3, 7]], ["CA", 4, 6, 5], ["CHR", 3, "shared", [4]], ["CA", 4, 5, 6], ["CI", 3], ["CHR", 1, "shared", [5]], ["CA", 2, 6, 6], ["CI", 1], ["FU", 8, [0, 1]], ["AN", 8, 0, 5], ["FU", 8, [1, 2]], ["AN", 8, 1, 4], ["FU", 8, [2, 3]], ["AN", 8, 2, 6], ["FU", 5, [0, 1]], ["SP", 5, 0, 24, [24], 1], ["AN", 5, 1, 2], ["FFSP", 5, 0, [1, 0], 1, 1], ["AN", 5, 1, 6], ["FU", 2, [0, 1]], ["SP", 2, 0, 48, [1], 1], ["AN", 2, 1, 2], ["FFSP", 2, 0, [1, 0], 1, 1], ["AN", 2, 1, 6], ["PR", 6, 0, "auto_unroll_max_step$1024"]]]], "r": [[0.000123238], 0, 3.73811, 1661162534], "v": "v0.6"}
{"i": [["[\"get_expr\", \"fused_conv_bias_relu_expr_S1D1P1\", [64, 16, 32, 32, 16, 3, 3]]", "cuda -keys=cuda,gpu -max_num_threads=1024 -thread_warp_size=32", [-1, 16, 64, 49152, 2147483647, 1024, 8, 32], "", 0, []], [[], [["SP", 4, 0, 16, [2, 4, 2, 1], 1], ["SP", 4, 5, 65536, [1, 8, 64, 1], 1], ["SP", 4, 10, 144, [6, 2], 1], ["RE", 4, [0, 5, 1, 6, 2, 7, 10, 11, 3, 8, 12, 4, 9]], ["FSP", 6, 0, 0, 3], ["FSP", 6, 4, 1, 3], ["RE", 6, [0, 4, 1, 5, 2, 6, 3, 7]], ["CA", 4, 6, 5], ["CHR", 3, "shared", [4]], ["CA", 4, 5, 6], ["CI", 3], ["CHR", 1, "shared", [5]], ["CA", 2, 6, 6], ["CI", 1], ["FU", 8, [0, 1]], ["AN", 8, 0, 5], ["FU", 8, [1, 2]], ["AN", 8, 1, 4], ["FU", 8, [2, 3]], ["AN", 8, 2, 6], ["FU", 5, [0, 1]], ["SP", 5, 0, 48, [1], 1], ["AN", 5, 1, 2], ["FFSP", 5, 0, [1, 0], 1, 1], ["AN", 5, 1, 6], ["FU", 2, [0, 1]], ["SP", 2, 0, 768, [1], 1], ["AN", 2, 1, 2], ["FFSP", 2, 0, [1, 0], 1, 1], ["AN", 2, 1, 6], ["PR", 6, 0, "auto_unroll_max_step$64"]]]], "r": [[0.000800051], 0, 4.71462, 1661162536], "v": "v0.6"}
{"i": [["[\"get_expr\", \"fused_conv_bias_relu_expr_S1D1P1\", [64, 16, 32, 32, 16, 3, 3]]", "cuda -keys=cuda,gpu -max_num_threads=1024 -thread_warp_size=32", [-1, 16, 64, 49152, 2147483647, 1024, 8, 32], "", 0, []], [[], [["SP", 4, 0, 16, [2, 4, 1, 2], 1], ["SP", 4, 5, 65536, [1, 32, 2, 1], 1], ["SP", 4, 10, 144, [2, 1], 1], ["RE", 4, [0, 5, 1, 6, 2, 7, 10, 11, 3, 8, 12, 4, 9]], ["FSP", 6, 0, 0, 3], ["FSP", 6, 4, 1, 3], ["RE", 6, [0, 4, 1, 5, 2, 6, 3, 7]], ["CA", 4, 6, 5], ["CHR", 3, "shared", [4]], ["CA", 4, 5, 6], ["CI", 3], ["CHR", 1, "shared", [5]], ["CA", 2, 6, 6], ["CI", 1], ["FU", 8, [0, 1]], ["AN", 8, 0, 5], ["FU", 8, [1, 2]], ["AN", 8, 1, 4], ["FU", 8, [2, 3]], ["AN", 8, 2, 6], ["FU", 5, [0, 1]], ["SP", 5, 0, 4, [1], 1], ["AN", 5, 1, 2], ["FFSP", 5, 0, [1, 0], 1, 1], ["AN", 5, 1, 6], ["FU", 2, [0, 1]], ["SP", 2, 0, 4, [1], 1], ["AN", 2, 1, 2], ["FFSP", 2, 0, [1, 0], 1, 1], ["AN", 2, 1, 6], ["PR", 6, 0, "auto_unroll_max_step$1024"]]]], "r": [[8.26394e-05], 0, 3.26835, 1661162538], "v": "v0.6"}
{"i": [["[\"get_expr\", \"fused_conv_bias_relu_expr_S1D1P1\", [64, 16, 32, 32, 16, 3, 3]]", "cuda -keys=cuda,gpu -max_num_threads=1024 -thread_warp_size=32", [-1, 16, 64, 49152, 2147483647, 1024, 8, 32], "", 0, []], [[], [["SP", 4, 0, 16, [1, 16, 1, 1], 1], ["SP", 4, 5, 65536, [1, 4, 64, 2], 1], ["SP", 4, 10, 144, [8, 2], 1], ["RE", 4, [0, 5, 1, 6, 2, 7, 10, 11, 3, 8, 12, 4, 9]], ["FSP", 6, 0, 0, 3], ["FSP", 6, 4, 1, 3], ["RE", 6, [0, 4, 1, 5, 2, 6, 3, 7]], ["CA", 4, 6, 5], ["CHR", 3, "shared", [4]], ["CA", 4, 5, 6], ["CI", 3], ["CHR", 1, "shared", [5]], ["CA", 2, 6, 6], ["CI", 1], ["FU", 8, [0, 1]], ["AN", 8, 0, 5], ["FU", 8, [1, 2]], ["AN", 8, 1, 4], ["FU", 8, [2, 3]], ["AN", 8, 2, 6], ["FU", 5, [0, 1]], ["SP", 5, 0, 16, [1], 1], ["AN", 5, 1, 2], ["FFSP", 5, 0, [1, 0], 1, 1], ["AN", 5, 1, 6], ["FU", 2, [0, 1]], ["SP", 2, 0, 2048, [64], 1], ["AN", 2, 1, 2], ["FFSP", 2, 0, [1, 0], 1, 1], ["AN", 2, 1, 6], ["PR", 6, 0, "auto_unroll_max_step$0"]]]], "r": [[0.00063666], 0, 3.9424, 1661162540], "v": "v0.6"}
{"i": [["[\"get_expr\", \"fused_conv_bias_relu_expr_S1D1P1\", [64, 16, 32, 32, 16, 3, 3]]", "cuda -keys=cuda,gpu -max_num_threads=1024 -thread_warp_size=32", [-1, 16, 64, 49152, 2147483647, 1024, 8, 32], "", 0, []], [[], [["SP", 4, 0, 16, [2, 4, 2, 1], 1], ["SP", 4, 5, 65536, [1, 32, 4, 1], 1], ["SP", 4, 10, 144, [12, 2], 1], ["RE", 4, [0, 5, 1, 6, 2, 7, 10, 11, 3, 8, 12, 4, 9]], ["FSP", 6, 0, 0, 3], ["FSP", 6, 4, 1, 3], ["RE", 6, [0, 4, 1, 5, 2, 6, 3, 7]], ["CA", 4, 6, 5], ["CHR", 3, "shared", [4]], ["CA", 4, 5, 6], ["CI", 3], ["CHR", 1, "shared", [5]], ["CA", 2, 6, 6], ["CI", 1], ["FU", 8, [0, 1]], ["AN", 8, 0, 5], ["FU", 8, [1, 2]], ["AN", 8, 1, 4], ["FU", 8, [2, 3]], ["AN", 8, 2, 6], ["FU", 5, [0, 1]], ["SP", 5, 0, 48, [1], 1], ["AN", 5, 1, 2], ["FFSP", 5, 0, [1, 0], 1, 1], ["AN", 5, 1, 6], ["FU", 2, [0, 1]], ["SP", 2, 0, 96, [1], 1], ["AN", 2, 1, 2], ["FFSP", 2, 0, [1, 0], 1, 1], ["AN", 2, 1, 6], ["PR", 6, 0, "auto_unroll_max_step$64"]]]], "r": [[4.99096e-05], 0, 3.28444, 1661162541], "v": "v0.6"}
{"i": [["[\"get_expr\", \"fused_conv_bias_relu_expr_S1D1P1\", [64, 16, 32, 32, 16, 3, 3]]", "cuda -keys=cuda,gpu -max_num_threads=1024 -thread_warp_size=32", [-1, 16, 64, 49152, 2147483647, 1024, 8, 32], "", 0, []], [[], [["SP", 4, 0, 16, [4, 1, 2, 2], 1], ["SP", 4, 5, 65536, [1, 32, 1, 1], 1], ["SP", 4, 10, 144, [4, 9], 1], ["RE", 4, [0, 5, 1, 6, 2, 7, 10, 11, 3, 8, 12, 4, 9]], ["FSP", 6, 0, 0, 3], ["FSP", 6, 4, 1, 3], ["RE", 6, [0, 4, 1, 5, 2, 6, 3, 7]], ["CA", 4, 6, 5], ["CHR", 3, "shared", [4]], ["CA", 4, 5, 6], ["CI", 3], ["CHR", 1, "shared", [5]], ["CA", 2, 6, 6], ["CI", 1], ["FU", 8, [0, 1]], ["AN", 8, 0, 5], ["FU", 8, [1, 2]], ["AN", 8, 1, 4], ["FU", 8, [2, 3]], ["AN", 8, 2, 6], ["FU", 5, [0, 1]], ["SP", 5, 0, 144, [1], 1], ["AN", 5, 1, 2], ["FFSP", 5, 0, [1, 0], 1, 1], ["AN", 5, 1, 6], ["FU", 2, [0, 1]], ["SP", 2, 0, 36, [1], 1], ["AN", 2, 1, 2], ["FFSP", 2, 0, [1, 0], 1, 1], ["AN", 2, 1, 6], ["PR", 6, 0, "auto_unroll_max_step$64"]]]], "r": [[4.75158e-05], 0, 3.42035, 1661162543], "v": "v0.6"}
{"i": [["[\"get_expr\", \"fused_conv_bias_relu_expr_S1D1P1\", [64, 16, 32, 32, 16, 3, 3]]", "cuda -keys=cuda,gpu -max_num_threads=1024 -thread_warp_size=32", [-1, 16, 64, 49152, 2147483647, 1024, 8, 32], "", 0, []], [[], [["SP", 4, 0, 16, [1, 1, 1, 16], 1], ["SP", 4, 5, 65536, [4, 128, 1, 1], 1], ["SP", 4, 10, 144, [3, 3], 1], ["RE", 4, [0, 5, 1, 6, 2, 7, 10, 11, 3, 8, 12, 4, 9]], ["FSP", 6, 0, 0, 3], ["FSP", 6, 4, 1, 3], ["RE", 6, [0, 4, 1, 5, 2, 6, 3, 7]], ["CA", 4, 6, 5], ["CHR", 3, "shared", [4]], ["CA", 4, 5, 6], ["CI", 3], ["CHR", 1, "shared", [5]], ["CA", 2, 6, 6], ["CI", 1], ["FU", 8, [0, 1]], ["AN", 8, 0, 5], ["FU", 8, [1, 2]], ["AN", 8, 1, 4], ["FU", 8, [2, 3]], ["AN", 8, 2, 6], ["FU", 5, [0, 1]], ["SP", 5, 0, 144, [1], 1], ["AN", 5, 1, 2], ["FFSP", 5, 0, [1, 0], 1, 1], ["AN", 5, 1, 6], ["FU", 2, [0, 1]], ["SP", 2, 0, 9, [1], 1], ["AN", 2, 1, 2], ["FFSP", 2, 0, [1, 0], 1, 1], ["AN", 2, 1, 6], ["PR", 6, 0, "auto_unroll_max_step$512"]]]], "r": [[6.81074e-05], 0, 3.28294, 1661162544], "v": "v0.6"}
