artifacts/microbenchmark/tvm/autotvm/matmul_nt/matmul_128_2048_1000.log
{"input": ["cuda -keys=cuda,gpu -max_num_threads=1024 -thread_warp_size=32", "dense_large_batch.gpu", [["TENSOR", [128, 2048], "float32"], ["TENSOR", [1000, 2048], "float32"]], {}], "config": {"index": 1106952, "code_hash": null, "entity": [["tile_x", "sp", [-1, 4, 2, 4]], ["tile_y", "sp", [-1, 100, 2, 1]], ["tile_k", "sp", [-1, 1, 4]]]}, "result": [[0.20043732875], 0, 4.662396430969238, 1637515365.2241232], "version": 0.2, "tvm_version": "0.8.dev0"}
{"input": ["cuda -keys=cuda,gpu -max_num_threads=1024 -thread_warp_size=32", "dense_large_batch.gpu", [["TENSOR", [128, 2048], "float32"], ["TENSOR", [1000, 2048], "float32"]], {}], "config": {"index": 237361, "code_hash": null, "entity": [["tile_x", "sp", [-1, 2, 1, 1]], ["tile_y", "sp", [-1, 2, 1, 125]], ["tile_k", "sp", [-1, 16, 1]]]}, "result": [[0.349531627], 0, 4.152995824813843, 1637515370.9362977], "version": 0.2, "tvm_version": "0.8.dev0"}
{"input": ["cuda -keys=cuda,gpu -max_num_threads=1024 -thread_warp_size=32", "dense_large_batch.gpu", [["TENSOR", [128, 2048], "float32"], ["TENSOR", [1000, 2048], "float32"]], {}], "config": {"index": 1598145, "code_hash": null, "entity": [["tile_x", "sp", [-1, 2, 2, 16]], ["tile_y", "sp", [-1, 50, 2, 2]], ["tile_k", "sp", [-1, 1, 8]]]}, "result": [[0.06134623475], 0, 2.9556262493133545, 1637515372.3327057], "version": 0.2, "tvm_version": "0.8.dev0"}
{"input": ["cuda -keys=cuda,gpu -max_num_threads=1024 -thread_warp_size=32", "dense_large_batch.gpu", [["TENSOR", [128, 2048], "float32"], ["TENSOR", [1000, 2048], "float32"]], {}], "config": {"index": 711, "code_hash": null, "entity": [["tile_x", "sp", [-1, 2, 1, 32]], ["tile_y", "sp", [-1, 10, 1, 1]], ["tile_k", "sp", [-1, 1, 1]]]}, "result": [[0.16300817674999998], 0, 2.029874086380005, 1637515401.588918], "version": 0.2, "tvm_version": "0.8.dev0"}
{"input": ["cuda -keys=cuda,gpu -max_num_threads=1024 -thread_warp_size=32", "dense_large_batch.gpu", [["TENSOR", [128, 2048], "float32"], ["TENSOR", [1000, 2048], "float32"]], {}], "config": {"index": 716, "code_hash": null, "entity": [["tile_x", "sp", [-1, 1, 1, 64]], ["tile_y", "sp", [-1, 10, 1, 1]], ["tile_k", "sp", [-1, 1, 1]]]}, "result": [[0.12961882175], 0, 1.860032320022583, 1637515403.137052], "version": 0.2, "tvm_version": "0.8.dev0"}
{"input": ["cuda -keys=cuda,gpu -max_num_threads=1024 -thread_warp_size=32", "dense_large_batch.gpu", [["TENSOR", [128, 2048], "float32"], ["TENSOR", [1000, 2048], "float32"]], {}], "config": {"index": 31627, "code_hash": null, "entity": [["tile_x", "sp", [-1, 8, 1, 4]], ["tile_y", "sp", [-1, 5, 1, 10]], ["tile_k", "sp", [-1, 1, 1]]]}, "result": [[0.24743867149999998], 0, 3.0873560905456543, 1637515405.318748], "version": 0.2, "tvm_version": "0.8.dev0"}
{"input": ["cuda -keys=cuda,gpu -max_num_threads=1024 -thread_warp_size=32", "dense_large_batch.gpu", [["TENSOR", [128, 2048], "float32"], ["TENSOR", [1000, 2048], "float32"]], {}], "config": {"index": 60427, "code_hash": null, "entity": [["tile_x", "sp", [-1, 8, 1, 4]], ["tile_y", "sp", [-1, 5, 1, 2]], ["tile_k", "sp", [-1, 2, 1]]]}, "result": [[0.11158989925], 0, 2.3797993659973145, 1637515407.0642192], "version": 0.2, "tvm_version": "0.8.dev0"}
{"input": ["cuda -keys=cuda,gpu -max_num_threads=1024 -thread_warp_size=32", "dense_large_batch.gpu", [["TENSOR", [128, 2048], "float32"], ["TENSOR", [1000, 2048], "float32"]], {}], "config": {"index": 179796, "code_hash": null, "entity": [["tile_x", "sp", [-1, 1, 1, 2]], ["tile_y", "sp", [-1, 5, 1, 20]], ["tile_k", "sp", [-1, 8, 1]]]}, "result": [[0.009334673636363637], 0, 3.413407325744629, 1637515409.0558949], "version": 0.2, "tvm_version": "0.8.dev0"}
{"input": ["cuda -keys=cuda,gpu -max_num_threads=1024 -thread_warp_size=32", "dense_large_batch.gpu", [["TENSOR", [128, 2048], "float32"], ["TENSOR", [1000, 2048], "float32"]], {}], "config": {"index": 127598, "code_hash": null, "entity": [["tile_x", "sp", [-1, 4, 1, 2]], ["tile_y", "sp", [-1, 5, 1, 10]], ["tile_k", "sp", [-1, 4, 1]]]}, "result": [[0.09848316925], 0, 5.045552730560303, 1637515411.9397354], "version": 0.2, "tvm_version": "0.8.dev0"}
{"input": ["cuda -keys=cuda,gpu -max_num_threads=1024 -thread_warp_size=32", "dense_large_batch.gpu", [["TENSOR", [128, 2048], "float32"], ["TENSOR", [1000, 2048], "float32"]], {}], "config": {"index": 134078, "code_hash": null, "entity": [["tile_x", "sp", [-1, 4, 1, 2]], ["tile_y", "sp", [-1, 5, 1, 25]], ["tile_k", "sp", [-1, 4, 1]]]}, "result": [[0.3703238335], 0, 4.4204182624816895, 1637515414.9111083], "version": 0.2, "tvm_version": "0.8.dev0"}
{"input": ["cuda -keys=cuda,gpu -max_num_threads=1024 -thread_warp_size=32", "dense_large_batch.gpu", [["TENSOR", [128, 2048], "float32"], ["TENSOR", [1000, 2048], "float32"]], {}], "config": {"index": 157060, "code_hash": null, "entity": [["tile_x", "sp", [-1, 1, 1, 16]], ["tile_y", "sp", [-1, 100, 1, 2]], ["tile_k", "sp", [-1, 8, 1]]]}, "result": [[0.24434731974999999], 0, 12.964998960494995, 1637515428.7616696], "version": 0.2, "tvm_version": "0.8.dev0"}
{"input": ["cuda -keys=cuda,gpu -max_num_threads=1024 -thread_warp_size=32", "dense_large_batch.gpu", [["TENSOR", [128, 2048], "float32"], ["TENSOR", [1000, 2048], "float32"]], {}], "config": {"index": 643744, "code_hash": null, "entity": [["tile_x", "sp", [-1, 1, 1, 4]], ["tile_y", "sp", [-1, 25, 1, 4]], ["tile_k", "sp", [-1, 2, 2]]]}, "result": [[0.08613831475], 0, 3.062281370162964, 1637515430.663715], "version": 0.2, "tvm_version": "0.8.dev0"}
{"input": ["cuda -keys=cuda,gpu -max_num_threads=1024 -thread_warp_size=32", "dense_large_batch.gpu", [["TENSOR", [128, 2048], "float32"], ["TENSOR", [1000, 2048], "float32"]], {}], "config": {"index": 215605, "code_hash": null, "entity": [["tile_x", "sp", [-1, 1, 1, 8]], ["tile_y", "sp", [-1, 20, 1, 5]], ["tile_k", "sp", [-1, 16, 1]]]}, "result": [[0.11428151275000001], 0, 9.553017616271973, 1637515434.198348], "version": 0.2, "tvm_version": "0.8.dev0"}
{"input": ["cuda -keys=cuda,gpu -max_num_threads=1024 -thread_warp_size=32", "dense_large_batch.gpu", [["TENSOR", [128, 2048], "float32"], ["TENSOR", [1000, 2048], "float32"]], {}], "config": {"index": 720925, "code_hash": null, "entity": [["tile_x", "sp", [-1, 1, 1, 8]], ["tile_y", "sp", [-1, 25, 1, 1]], ["tile_k", "sp", [-1, 8, 2]]]}, "result": [[0.004716957954545455], 0, 4.882362604141235, 1637515437.4378614], "version": 0.2, "tvm_version": "0.8.dev0"}
{"input": ["cuda -keys=cuda,gpu -max_num_threads=1024 -thread_warp_size=32", "dense_large_batch.gpu", [["TENSOR", [128, 2048], "float32"], ["TENSOR", [1000, 2048], "float32"]], {}], "config": {"index": 707919, "code_hash": null, "entity": [["tile_x", "sp", [-1, 8, 1, 2]], ["tile_y", "sp", [-1, 10, 1, 20]], ["tile_k", "sp", [-1, 4, 2]]]}, "result": [[0.590927062], 0, 7.060022830963135, 1637515441.8721032], "version": 0.2, "tvm_version": "0.8.dev0"}
{"input": ["cuda -keys=cuda,gpu -max_num_threads=1024 -thread_warp_size=32", "dense_large_batch.gpu", [["TENSOR", [128, 2048], "float32"], ["TENSOR", [1000, 2048], "float32"]], {}], "config": {"index": 744644, "code_hash": null, "entity": [["tile_x", "sp", [-1, 2, 2, 2]], ["tile_y", "sp", [-1, 5, 2, 5]], ["tile_k", "sp", [-1, 8, 2]]]}, "result": [[0.0009250439137931033], 0, 2.352085828781128, 1637515443.1501946], "version": 0.2, "tvm_version": "0.8.dev0"}
{"input": ["cuda -keys=cuda,gpu -max_num_threads=1024 -thread_warp_size=32", "dense_large_batch.gpu", [["TENSOR", [128, 2048], "float32"], ["TENSOR", [1000, 2048], "float32"]], {}], "config": {"index": 156545, "code_hash": null, "entity": [["tile_x", "sp", [-1, 2, 1, 4]], ["tile_y", "sp", [-1, 10, 1, 2]], ["tile_k", "sp", [-1, 8, 1]]]}, "result": [[0.0034266735333333335], 0, 2.040891647338867, 1637515444.3364275], "version": 0.2, "tvm_version": "0.8.dev0"}
{"input": ["cuda -keys=cuda,gpu -max_num_threads=1024 -thread_warp_size=32", "dense_large_batch.gpu", [["TENSOR", [128, 2048], "float32"], ["TENSOR", [1000, 2048], "float32"]], {}], "config": {"index": 146730, "code_hash": null, "entity": [["tile_x", "sp", [-1, 1, 2, 8]], ["tile_y", "sp", [-1, 25, 2, 1]], ["tile_k", "sp", [-1, 8, 1]]]}, "result": [[0.0015465027384615386], 0, 2.288384437561035, 1637515445.8173897], "version": 0.2, "tvm_version": "0.8.dev0"}
{"input": ["cuda -keys=cuda,gpu -max_num_threads=1024 -thread_warp_size=32", "dense_large_batch.gpu", [["TENSOR", [128, 2048], "float32"], ["TENSOR", [1000, 2048], "float32"]], {}], "config": {"index": 144786, "code_hash": null, "entity": [["tile_x", "sp", [-1, 4, 1, 4]], ["tile_y", "sp", [-1, 20, 1, 1]], ["tile_k", "sp", [-1, 8, 1]]]}, "result": [[0.12305368124999999], 0, 3.195120096206665, 1637515447.6032467], "version": 0.2, "tvm_version": "0.8.dev0"}
{"input": ["cuda -keys=cuda,gpu -max_num_threads=1024 -thread_warp_size=32", "dense_large_batch.gpu", [["TENSOR", [128, 2048], "float32"], ["TENSOR", [1000, 2048], "float32"]], {}], "config": {"index": 637070, "code_hash": null, "entity": [["tile_x", "sp", [-1, 1, 1, 32]], ["tile_y", "sp", [-1, 100, 1, 2]], ["tile_k", "sp", [-1, 2, 2]]]}, "result": [[0.258572988], 0, 5.1969733238220215, 1637515450.384478], "version": 0.2, "tvm_version": "0.8.dev0"}
{"input": ["cuda -keys=cuda,gpu -max_num_threads=1024 -thread_warp_size=32", "dense_large_batch.gpu", [["TENSOR", [128, 2048], "float32"], ["TENSOR", [1000, 2048], "float32"]], {}], "config": {"index": 1172490, "code_hash": null, "entity": [["tile_x", "sp", [-1, 1, 2, 8]], ["tile_y", "sp", [-1, 25, 2, 4]], ["tile_k", "sp", [-1, 2, 4]]]}, "result": [[0.025361237249999998], 0, 2.439744472503662, 1637515451.4238164], "version": 0.2, "tvm_version": "0.8.dev0"}
{"input": ["cuda -keys=cuda,gpu -max_num_threads=1024 -thread_warp_size=32", "dense_large_batch.gpu", [["TENSOR", [128, 2048], "float32"], ["TENSOR", [1000, 2048], "float32"]], {}], "config": {"index": 636806, "code_hash": null, "entity": [["tile_x", "sp", [-1, 2, 1, 8]], ["tile_y", "sp", [-1, 25, 1, 2]], ["tile_k", "sp", [-1, 2, 2]]]}, "result": [[0.08873225625], 0, 2.3088929653167725, 1637515452.752074], "version": 0.2, "tvm_version": "0.8.dev0"}
{"input": ["cuda -keys=cuda,gpu -max_num_threads=1024 -thread_warp_size=32", "dense_large_batch.gpu", [["TENSOR", [128, 2048], "float32"], ["TENSOR", [1000, 2048], "float32"]], {}], "config": {"index": 685725, "code_hash": null, "entity": [["tile_x", "sp", [-1, 4, 2, 2]], ["tile_y", "sp", [-1, 5, 2, 2]], ["tile_k", "sp", [-1, 4, 2]]]}, "result": [[0.0005822121376811595], 0, 1.548499345779419, 1637515453.774832], "version": 0.2, "tvm_version": "0.8.dev0"}
{"input": ["cuda -keys=cuda,gpu -max_num_threads=1024 -thread_warp_size=32", "dense_large_batch.gpu", [["TENSOR", [128, 2048], "float32"], ["TENSOR", [1000, 2048], "float32"]], {}], "config": {"index": 1116820, "code_hash": null, "entity": [["tile_x", "sp", [-1, 1, 1, 16]], ["tile_y", "sp", [-1, 25, 1, 2]], ["tile_k", "sp", [-1, 1, 4]]]}, "result": [[0.0670598755], 0, 1.6967875957489014, 1637515461.8051848], "version": 0.2, "tvm_version": "0.8.dev0"}
{"input": ["cuda -keys=cuda,gpu -max_num_threads=1024 -thread_warp_size=32", "dense_large_batch.gpu", [["TENSOR", [128, 2048], "float32"], ["TENSOR", [1000, 2048], "float32"]], {}], "config": {"index": 720904, "code_hash": null, "entity": [["tile_x", "sp", [-1, 1, 1, 4]], ["tile_y", "sp", [-1, 25, 1, 1]], ["tile_k", "sp", [-1, 8, 2]]]}, "result": [[0.0028736634444444446], 0, 1.92311692237854, 1637515462.9006433], "version": 0.2, "tvm_version": "0.8.dev0"}
{"input": ["cuda -keys=cuda,gpu -max_num_threads=1024 -thread_warp_size=32", "dense_large_batch.gpu", [["TENSOR", [128, 2048], "float32"], ["TENSOR", [1000, 2048], "float32"]], {}], "config": {"index": 739744, "code_hash": null, "entity": [["tile_x", "sp", [-1, 1, 1, 4]], ["tile_y", "sp", [-1, 25, 1, 4]], ["tile_k", "sp", [-1, 8, 2]]]}, "result": [[0.086610724], 0, 9.219027280807495, 1637515465.585129], "version": 0.2, "tvm_version": "0.8.dev0"}
{"input": ["cuda -keys=cuda,gpu -max_num_threads=1024 -thread_warp_size=32", "dense_large_batch.gpu", [["TENSOR", [128, 2048], "float32"], ["TENSOR", [1000, 2048], "float32"]], {}], "config": {"index": 1152806, "code_hash": null, "entity": [["tile_x", "sp", [-1, 2, 1, 8]], ["tile_y", "sp", [-1, 20, 1, 1]], ["tile_k", "sp", [-1, 2, 4]]]}, "result": [[0.113445539], 0, 2.3055033683776855, 1637515467.0308762], "version": 0.2, "tvm_version": "0.8.dev0"}
{"input": ["cuda -keys=cuda,gpu -max_num_threads=1024 -thread_warp_size=32", "dense_large_batch.gpu", [["TENSOR", [128, 2048], "float32"], ["TENSOR", [1000, 2048], "float32"]], {}], "config": {"index": 644370, "code_hash": null, "entity": [["tile_x", "sp", [-1, 1, 2, 8]], ["tile_y", "sp", [-1, 5, 2, 4]], ["tile_k", "sp", [-1, 2, 2]]]}, "result": [[0.002339252930232558], 0, 1.5907678604125977, 1637515468.0887065], "version": 0.2, "tvm_version": "0.8.dev0"}
{"input": ["cuda -keys=cuda,gpu -max_num_threads=1024 -thread_warp_size=32", "dense_large_batch.gpu", [["TENSOR", [128, 2048], "float32"], ["TENSOR", [1000, 2048], "float32"]], {}], "config": {"index": 126326, "code_hash": null, "entity": [["tile_x", "sp", [-1, 2, 1, 8]], ["tile_y", "sp", [-1, 25, 1, 8]], ["tile_k", "sp", [-1, 4, 1]]]}, "result": [[1.025643701], 0, 8.602114200592041, 1637515474.5664277], "version": 0.2, "tvm_version": "0.8.dev0"}
{"input": ["cuda -keys=cuda,gpu -max_num_threads=1024 -thread_warp_size=32", "dense_large_batch.gpu", [["TENSOR", [128, 2048], "float32"], ["TENSOR", [1000, 2048], "float32"]], {}], "config": {"index": 624787, "code_hash": null, "entity": [["tile_x", "sp", [-1, 8, 1, 4]], ["tile_y", "sp", [-1, 20, 1, 1]], ["tile_k", "sp", [-1, 2, 2]]]}, "result": [[0.18949472625000002], 0, 3.226922035217285, 1637515476.3653076], "version": 0.2, "tvm_version": "0.8.dev0"}
{"input": ["cuda -keys=cuda,gpu -max_num_threads=1024 -thread_warp_size=32", "dense_large_batch.gpu", [["TENSOR", [128, 2048], "float32"], ["TENSOR", [1000, 2048], "float32"]], {}], "config": {"index": 624925, "code_hash": null, "entity": [["tile_x", "sp", [-1, 1, 1, 8]], ["tile_y", "sp", [-1, 25, 1, 1]], ["tile_k", "sp", [-1, 2, 2]]]}, "result": [[0.004878110285714285], 0, 2.2040693759918213, 1637515538.8226776], "version": 0.2, "tvm_version": "0.8.dev0"}
{"input": ["cuda -keys=cuda,gpu -max_num_threads=1024 -thread_warp_size=32", "dense_large_batch.gpu", [["TENSOR", [128, 2048], "float32"], ["TENSOR", [1000, 2048], "float32"]], {}], "config": {"index": 672925, "code_hash": null, "entity": [["tile_x", "sp", [-1, 1, 1, 8]], ["tile_y", "sp", [-1, 25, 1, 1]], ["tile_k", "sp", [-1, 4, 2]]]}, "result": [[0.0041751687631578945], 0, 3.799043893814087, 1637515541.2436295], "version": 0.2, "tvm_version": "0.8.dev0"}
{"input": ["cuda -keys=cuda,gpu -max_num_threads=1024 -thread_warp_size=32", "dense_large_batch.gpu", [["TENSOR", [128, 2048], "float32"], ["TENSOR", [1000, 2048], "float32"]], {}], "config": {"index": 144925, "code_hash": null, "entity": [["tile_x", "sp", [-1, 1, 1, 8]], ["tile_y", "sp", [-1, 25, 1, 1]], ["tile_k", "sp", [-1, 8, 1]]]}, "result": [[0.005345833894736841], 0, 2.8862650394439697, 1637515542.7443562], "version": 0.2, "tvm_version": "0.8.dev0"}
{"input": ["cuda -keys=cuda,gpu -max_num_threads=1024 -thread_warp_size=32", "dense_large_batch.gpu", [["TENSOR", [128, 2048], "float32"], ["TENSOR", [1000, 2048], "float32"]], {}], "config": {"index": 108805, "code_hash": null, "entity": [["tile_x", "sp", [-1, 1, 1, 8]], ["tile_y", "sp", [-1, 25, 1, 2]], ["tile_k", "sp", [-1, 4, 1]]]}, "result": [[0.1256461465], 0, 2.7780983448028564, 1637515544.2202835], "version": 0.2, "tvm_version": "0.8.dev0"}
{"input": ["cuda -keys=cuda,gpu -max_num_threads=1024 -thread_warp_size=32", "dense_large_batch.gpu", [["TENSOR", [128, 2048], "float32"], ["TENSOR", [1000, 2048], "float32"]], {}], "config": {"index": 108685, "code_hash": null, "entity": [["tile_x", "sp", [-1, 1, 1, 8]], ["tile_y", "sp", [-1, 20, 1, 2]], ["tile_k", "sp", [-1, 4, 1]]]}, "result": [[0.07225708324999999], 0, 2.227323055267334, 1637515545.3833876], "version": 0.2, "tvm_version": "0.8.dev0"}
{"input": ["cuda -keys=cuda,gpu -max_num_threads=1024 -thread_warp_size=32", "dense_large_batch.gpu", [["TENSOR", [128, 2048], "float32"], ["TENSOR", [1000, 2048], "float32"]], {}], "config": {"index": 636805, "code_hash": null, "entity": [["tile_x", "sp", [-1, 1, 1, 8]], ["tile_y", "sp", [-1, 25, 1, 2]], ["tile_k", "sp", [-1, 2, 2]]]}, "result": [[0.07847525899999999], 0, 2.685093879699707, 1637515546.5747194], "version": 0.2, "tvm_version": "0.8.dev0"}
{"input": ["cuda -keys=cuda,gpu -max_num_threads=1024 -thread_warp_size=32", "dense_large_batch.gpu", [["TENSOR", [128, 2048], "float32"], ["TENSOR", [1000, 2048], "float32"]], {}], "config": {"index": 144805, "code_hash": null, "entity": [["tile_x", "sp", [-1, 1, 1, 8]], ["tile_y", "sp", [-1, 20, 1, 1]], ["tile_k", "sp", [-1, 8, 1]]]}, "result": [[0.0034379664333333334], 0, 2.2929534912109375, 1637515547.7473798], "version": 0.2, "tvm_version": "0.8.dev0"}
{"input": ["cuda -keys=cuda,gpu -max_num_threads=1024 -thread_warp_size=32", "dense_large_batch.gpu", [["TENSOR", [128, 2048], "float32"], ["TENSOR", [1000, 2048], "float32"]], {}], "config": {"index": 643765, "code_hash": null, "entity": [["tile_x", "sp", [-1, 1, 1, 8]], ["tile_y", "sp", [-1, 25, 1, 4]], ["tile_k", "sp", [-1, 2, 2]]]}, "result": [[0.06806014275], 0, 3.1696650981903076, 1637515549.1308203], "version": 0.2, "tvm_version": "0.8.dev0"}
{"input": ["cuda -keys=cuda,gpu -max_num_threads=1024 -thread_warp_size=32", "dense_large_batch.gpu", [["TENSOR", [128, 2048], "float32"], ["TENSOR", [1000, 2048], "float32"]], {}], "config": {"index": 636685, "code_hash": null, "entity": [["tile_x", "sp", [-1, 1, 1, 8]], ["tile_y", "sp", [-1, 20, 1, 2]], ["tile_k", "sp", [-1, 2, 2]]]}, "result": [[0.086022442], 0, 2.136237621307373, 1637515550.3672266], "version": 0.2, "tvm_version": "0.8.dev0"}
{"input": ["cuda -keys=cuda,gpu -max_num_threads=1024 -thread_warp_size=32", "dense_large_batch.gpu", [["TENSOR", [128, 2048], "float32"], ["TENSOR", [1000, 2048], "float32"]], {}], "config": {"index": 672926, "code_hash": null, "entity": [["tile_x", "sp", [-1, 2, 1, 8]], ["tile_y", "sp", [-1, 25, 1, 1]], ["tile_k", "sp", [-1, 4, 2]]]}, "result": [[0.12201921299999999], 0, 3.257200241088867, 1637515552.094635], "version": 0.2, "tvm_version": "0.8.dev0"}
{"input": ["cuda -keys=cuda,gpu -max_num_threads=1024 -thread_warp_size=32", "dense_large_batch.gpu", [["TENSOR", [128, 2048], "float32"], ["TENSOR", [1000, 2048], "float32"]], {}], "config": {"index": 1116805, "code_hash": null, "entity": [["tile_x", "sp", [-1, 1, 1, 8]], ["tile_y", "sp", [-1, 25, 1, 2]], ["tile_k", "sp", [-1, 1, 4]]]}, "result": [[0.0898724435], 0, 2.602708339691162, 1637515553.4238863], "version": 0.2, "tvm_version": "0.8.dev0"}
{"input": ["cuda -keys=cuda,gpu -max_num_threads=1024 -thread_warp_size=32", "dense_large_batch.gpu", [["TENSOR", [128, 2048], "float32"], ["TENSOR", [1000, 2048], "float32"]], {}], "config": {"index": 624805, "code_hash": null, "entity": [["tile_x", "sp", [-1, 1, 1, 8]], ["tile_y", "sp", [-1, 20, 1, 1]], ["tile_k", "sp", [-1, 2, 2]]]}, "result": [[0.00419387752], 0, 2.0063018798828125, 1637515554.4654748], "version": 0.2, "tvm_version": "0.8.dev0"}
{"input": ["cuda -keys=cuda,gpu -max_num_threads=1024 -thread_warp_size=32", "dense_large_batch.gpu", [["TENSOR", [128, 2048], "float32"], ["TENSOR", [1000, 2048], "float32"]], {}], "config": {"index": 96925, "code_hash": null, "entity": [["tile_x", "sp", [-1, 1, 1, 8]], ["tile_y", "sp", [-1, 25, 1, 1]], ["tile_k", "sp", [-1, 4, 1]]]}, "result": [[0.00318063865625], 0, 2.16829514503479, 1637515555.6017947], "version": 0.2, "tvm_version": "0.8.dev0"}
{"input": ["cuda -keys=cuda,gpu -max_num_threads=1024 -thread_warp_size=32", "dense_large_batch.gpu", [["TENSOR", [128, 2048], "float32"], ["TENSOR", [1000, 2048], "float32"]], {}], "config": {"index": 625045, "code_hash": null, "entity": [["tile_x", "sp", [-1, 1, 1, 8]], ["tile_y", "sp", [-1, 40, 1, 1]], ["tile_k", "sp", [-1, 2, 2]]]}, "result": [[0.11718396774999999], 0, 3.2335643768310547, 1637515557.7770126], "version": 0.2, "tvm_version": "0.8.dev0"}
{"input": ["cuda -keys=cuda,gpu -max_num_threads=1024 -thread_warp_size=32", "dense_large_batch.gpu", [["TENSOR", [128, 2048], "float32"], ["TENSOR", [1000, 2048], "float32"]], {}], "config": {"index": 588820, "code_hash": null, "entity": [["tile_x", "sp", [-1, 1, 1, 16]], ["tile_y", "sp", [-1, 25, 1, 2]], ["tile_k", "sp", [-1, 1, 2]]]}, "result": [[0.07576892075000001], 0, 1.99302339553833, 1637515558.9157941], "version": 0.2, "tvm_version": "0.8.dev0"}
{"input": ["cuda -keys=cuda,gpu -max_num_threads=1024 -thread_warp_size=32", "dense_large_batch.gpu", [["TENSOR", [128, 2048], "float32"], ["TENSOR", [1000, 2048], "float32"]], {}], "config": {"index": 624940, "code_hash": null, "entity": [["tile_x", "sp", [-1, 1, 1, 16]], ["tile_y", "sp", [-1, 25, 1, 1]], ["tile_k", "sp", [-1, 2, 2]]]}, "result": [[0.1138227505], 0, 2.3049042224884033, 1637515560.1904423], "version": 0.2, "tvm_version": "0.8.dev0"}
{"input": ["cuda -keys=cuda,gpu -max_num_threads=1024 -thread_warp_size=32", "dense_large_batch.gpu", [["TENSOR", [128, 2048], "float32"], ["TENSOR", [1000, 2048], "float32"]], {}], "config": {"index": 624904, "code_hash": null, "entity": [["tile_x", "sp", [-1, 1, 1, 4]], ["tile_y", "sp", [-1, 25, 1, 1]], ["tile_k", "sp", [-1, 2, 2]]]}, "result": [[0.0019630877012987015], 0, 1.5774242877960205, 1637515561.155391], "version": 0.2, "tvm_version": "0.8.dev0"}
{"input": ["cuda -keys=cuda,gpu -max_num_threads=1024 -thread_warp_size=32", "dense_large_batch.gpu", [["TENSOR", [128, 2048], "float32"], ["TENSOR", [1000, 2048], "float32"]], {}], "config": {"index": 576925, "code_hash": null, "entity": [["tile_x", "sp", [-1, 1, 1, 8]], ["tile_y", "sp", [-1, 25, 1, 1]], ["tile_k", "sp", [-1, 1, 2]]]}, "result": [[0.006569851875], 0, 1.9181792736053467, 1637515562.1164658], "version": 0.2, "tvm_version": "0.8.dev0"}
{"input": ["cuda -keys=cuda,gpu -max_num_threads=1024 -thread_warp_size=32", "dense_large_batch.gpu", [["TENSOR", [128, 2048], "float32"], ["TENSOR", [1000, 2048], "float32"]], {}], "config": {"index": 595645, "code_hash": null, "entity": [["tile_x", "sp", [-1, 1, 1, 8]], ["tile_y", "sp", [-1, 10, 1, 4]], ["tile_k", "sp", [-1, 1, 2]]]}, "result": [[0.0690983095], 0, 1.9437928199768066, 1637515563.2960188], "version": 0.2, "tvm_version": "0.8.dev0"}
{"input": ["cuda -keys=cuda,gpu -max_num_threads=1024 -thread_warp_size=32", "dense_large_batch.gpu", [["TENSOR", [128, 2048], "float32"], ["TENSOR", [1000, 2048], "float32"]], {}], "config": {"index": 647605, "code_hash": null, "entity": [["tile_x", "sp", [-1, 1, 1, 8]], ["tile_y", "sp", [-1, 20, 1, 5]], ["tile_k", "sp", [-1, 2, 2]]]}, "result": [[0.0938888145], 0, 3.1707658767700195, 1637515564.7455428], "version": 0.2, "tvm_version": "0.8.dev0"}
{"input": ["cuda -keys=cuda,gpu -max_num_threads=1024 -thread_warp_size=32", "dense_large_batch.gpu", [["TENSOR", [128, 2048], "float32"], ["TENSOR", [1000, 2048], "float32"]], {}], "config": {"index": 108820, "code_hash": null, "entity": [["tile_x", "sp", [-1, 1, 1, 16]], ["tile_y", "sp", [-1, 25, 1, 2]], ["tile_k", "sp", [-1, 4, 1]]]}, "result": [[0.10231224450000001], 0, 2.5094199180603027, 1637515566.0902445], "version": 0.2, "tvm_version": "0.8.dev0"}
{"input": ["cuda -keys=cuda,gpu -max_num_threads=1024 -thread_warp_size=32", "dense_large_batch.gpu", [["TENSOR", [128, 2048], "float32"], ["TENSOR", [1000, 2048], "float32"]], {}], "config": {"index": 588700, "code_hash": null, "entity": [["tile_x", "sp", [-1, 1, 1, 16]], ["tile_y", "sp", [-1, 20, 1, 2]], ["tile_k", "sp", [-1, 1, 2]]]}, "result": [[0.07476632775], 0, 1.9940307140350342, 1637515567.2181456], "version": 0.2, "tvm_version": "0.8.dev0"}
{"input": ["cuda -keys=cuda,gpu -max_num_threads=1024 -thread_warp_size=32", "dense_large_batch.gpu", [["TENSOR", [128, 2048], "float32"], ["TENSOR", [1000, 2048], "float32"]], {}], "config": {"index": 636820, "code_hash": null, "entity": [["tile_x", "sp", [-1, 1, 1, 16]], ["tile_y", "sp", [-1, 25, 1, 2]], ["tile_k", "sp", [-1, 2, 2]]]}, "result": [[0.07645557375], 0, 2.340839385986328, 1637515568.3485656], "version": 0.2, "tvm_version": "0.8.dev0"}
{"input": ["cuda -keys=cuda,gpu -max_num_threads=1024 -thread_warp_size=32", "dense_large_batch.gpu", [["TENSOR", [128, 2048], "float32"], ["TENSOR", [1000, 2048], "float32"]], {}], "config": {"index": 576950, "code_hash": null, "entity": [["tile_x", "sp", [-1, 1, 1, 32]], ["tile_y", "sp", [-1, 25, 1, 1]], ["tile_k", "sp", [-1, 1, 2]]]}, "result": [[0.13352311875], 0, 2.2578821182250977, 1637515569.6879067], "version": 0.2, "tvm_version": "0.8.dev0"}
{"input": ["cuda -keys=cuda,gpu -max_num_threads=1024 -thread_warp_size=32", "dense_large_batch.gpu", [["TENSOR", [128, 2048], "float32"], ["TENSOR", [1000, 2048], "float32"]], {}], "config": {"index": 643645, "code_hash": null, "entity": [["tile_x", "sp", [-1, 1, 1, 8]], ["tile_y", "sp", [-1, 10, 1, 4]], ["tile_k", "sp", [-1, 2, 2]]]}, "result": [[0.070175325], 0, 2.006042003631592, 1637515574.178879], "version": 0.2, "tvm_version": "0.8.dev0"}
{"input": ["cuda -keys=cuda,gpu -max_num_threads=1024 -thread_warp_size=32", "dense_large_batch.gpu", [["TENSOR", [128, 2048], "float32"], ["TENSOR", [1000, 2048], "float32"]], {}], "config": {"index": 636784, "code_hash": null, "entity": [["tile_x", "sp", [-1, 1, 1, 4]], ["tile_y", "sp", [-1, 25, 1, 2]], ["tile_k", "sp", [-1, 2, 2]]]}, "result": [[0.027599465], 0, 2.046639919281006, 1637515575.362724], "version": 0.2, "tvm_version": "0.8.dev0"}
{"input": ["cuda -keys=cuda,gpu -max_num_threads=1024 -thread_warp_size=32", "dense_large_batch.gpu", [["TENSOR", [128, 2048], "float32"], ["TENSOR", [1000, 2048], "float32"]], {}], "config": {"index": 96940, "code_hash": null, "entity": [["tile_x", "sp", [-1, 1, 1, 16]], ["tile_y", "sp", [-1, 25, 1, 1]], ["tile_k", "sp", [-1, 4, 1]]]}, "result": [[0.12579141675], 0, 2.1075878143310547, 1637515576.7332451], "version": 0.2, "tvm_version": "0.8.dev0"}
{"input": ["cuda -keys=cuda,gpu -max_num_threads=1024 -thread_warp_size=32", "dense_large_batch.gpu", [["TENSOR", [128, 2048], "float32"], ["TENSOR", [1000, 2048], "float32"]], {}], "config": {"index": 1154730, "code_hash": null, "entity": [["tile_x", "sp", [-1, 1, 2, 8]], ["tile_y", "sp", [-1, 25, 2, 1]], ["tile_k", "sp", [-1, 2, 4]]]}, "result": [[0.001811177642857143], 0, 1.9290459156036377, 1637515577.799932], "version": 0.2, "tvm_version": "0.8.dev0"}
{"input": ["cuda -keys=cuda,gpu -max_num_threads=1024 -thread_warp_size=32", "dense_large_batch.gpu", [["TENSOR", [128, 2048], "float32"], ["TENSOR", [1000, 2048], "float32"]], {}], "config": {"index": 108565, "code_hash": null, "entity": [["tile_x", "sp", [-1, 1, 1, 8]], ["tile_y", "sp", [-1, 10, 1, 2]], ["tile_k", "sp", [-1, 4, 1]]]}, "result": [[0.002324938492753623], 0, 1.7268989086151123, 1637515578.857921], "version": 0.2, "tvm_version": "0.8.dev0"}
{"input": ["cuda -keys=cuda,gpu -max_num_threads=1024 -thread_warp_size=32", "dense_large_batch.gpu", [["TENSOR", [128, 2048], "float32"], ["TENSOR", [1000, 2048], "float32"]], {}], "config": {"index": 156544, "code_hash": null, "entity": [["tile_x", "sp", [-1, 1, 1, 4]], ["tile_y", "sp", [-1, 10, 1, 2]], ["tile_k", "sp", [-1, 8, 1]]]}, "result": [[0.002503422225], 0, 1.9819695949554443, 1637515580.0302188], "version": 0.2, "tvm_version": "0.8.dev0"}
{"input": ["cuda -keys=cuda,gpu -max_num_threads=1024 -thread_warp_size=32", "dense_large_batch.gpu", [["TENSOR", [128, 2048], "float32"], ["TENSOR", [1000, 2048], "float32"]], {}], "config": {"index": 624926, "code_hash": null, "entity": [["tile_x", "sp", [-1, 2, 1, 8]], ["tile_y", "sp", [-1, 25, 1, 1]], ["tile_k", "sp", [-1, 2, 2]]]}, "result": [[0.12151770349999999], 0, 2.4387500286102295, 1637515581.6113164], "version": 0.2, "tvm_version": "0.8.dev0"}
{"input": ["cuda -keys=cuda,gpu -max_num_threads=1024 -thread_warp_size=32", "dense_large_batch.gpu", [["TENSOR", [128, 2048], "float32"], ["TENSOR", [1000, 2048], "float32"]], {}], "config": {"index": 156565, "code_hash": null, "entity": [["tile_x", "sp", [-1, 1, 1, 8]], ["tile_y", "sp", [-1, 10, 1, 2]], ["tile_k", "sp", [-1, 8, 1]]]}, "result": [[0.0034283834], 0, 2.3445847034454346, 1637515582.962984], "version": 0.2, "tvm_version": "0.8.dev0"}
{"input": ["cuda -keys=cuda,gpu -max_num_threads=1024 -thread_warp_size=32", "dense_large_batch.gpu", [["TENSOR", [128, 2048], "float32"], ["TENSOR", [1000, 2048], "float32"]], {}], "config": {"index": 636686, "code_hash": null, "entity": [["tile_x", "sp", [-1, 2, 1, 8]], ["tile_y", "sp", [-1, 20, 1, 2]], ["tile_k", "sp", [-1, 2, 2]]]}, "result": [[0.08937993400000001], 0, 2.330533981323242, 1637515584.289656], "version": 0.2, "tvm_version": "0.8.dev0"}
{"input": ["cuda -keys=cuda,gpu -max_num_threads=1024 -thread_warp_size=32", "dense_large_batch.gpu", [["TENSOR", [128, 2048], "float32"], ["TENSOR", [1000, 2048], "float32"]], {}], "config": {"index": 156805, "code_hash": null, "entity": [["tile_x", "sp", [-1, 1, 1, 8]], ["tile_y", "sp", [-1, 25, 1, 2]], ["tile_k", "sp", [-1, 8, 1]]]}, "result": [[0.06788047324999999], 0, 2.9758970737457275, 1637515585.7742307], "version": 0.2, "tvm_version": "0.8.dev0"}
{"input": ["cuda -keys=cuda,gpu -max_num_threads=1024 -thread_warp_size=32", "dense_large_batch.gpu", [["TENSOR", [128, 2048], "float32"], ["TENSOR", [1000, 2048], "float32"]], {}], "config": {"index": 684820, "code_hash": null, "entity": [["tile_x", "sp", [-1, 1, 1, 16]], ["tile_y", "sp", [-1, 25, 1, 2]], ["tile_k", "sp", [-1, 4, 2]]]}, "result": [[0.07491624775], 0, 3.3380184173583984, 1637515587.8059542], "version": 0.2, "tvm_version": "0.8.dev0"}
{"input": ["cuda -keys=cuda,gpu -max_num_threads=1024 -thread_warp_size=32", "dense_large_batch.gpu", [["TENSOR", [128, 2048], "float32"], ["TENSOR", [1000, 2048], "float32"]], {}], "config": {"index": 625165, "code_hash": null, "entity": [["tile_x", "sp", [-1, 1, 1, 8]], ["tile_y", "sp", [-1, 50, 1, 1]], ["tile_k", "sp", [-1, 2, 2]]]}, "result": [[0.1171531185], 0, 2.4699807167053223, 1637515589.3135736], "version": 0.2, "tvm_version": "0.8.dev0"}
{"input": ["cuda -keys=cuda,gpu -max_num_threads=1024 -thread_warp_size=32", "dense_large_batch.gpu", [["TENSOR", [128, 2048], "float32"], ["TENSOR", [1000, 2048], "float32"]], {}], "config": {"index": 108784, "code_hash": null, "entity": [["tile_x", "sp", [-1, 1, 1, 4]], ["tile_y", "sp", [-1, 25, 1, 2]], ["tile_k", "sp", [-1, 4, 1]]]}, "result": [[0.002555708523809524], 0, 2.259711265563965, 1637515590.7756336], "version": 0.2, "tvm_version": "0.8.dev0"}
{"input": ["cuda -keys=cuda,gpu -max_num_threads=1024 -thread_warp_size=32", "dense_large_batch.gpu", [["TENSOR", [128, 2048], "float32"], ["TENSOR", [1000, 2048], "float32"]], {}], "config": {"index": 60700, "code_hash": null, "entity": [["tile_x", "sp", [-1, 1, 1, 16]], ["tile_y", "sp", [-1, 20, 1, 2]], ["tile_k", "sp", [-1, 2, 1]]]}, "result": [[0.10613729675], 0, 2.0247645378112793, 1637515592.1210992], "version": 0.2, "tvm_version": "0.8.dev0"}
{"input": ["cuda -keys=cuda,gpu -max_num_threads=1024 -thread_warp_size=32", "dense_large_batch.gpu", [["TENSOR", [128, 2048], "float32"], ["TENSOR", [1000, 2048], "float32"]], {}], "config": {"index": 588566, "code_hash": null, "entity": [["tile_x", "sp", [-1, 2, 1, 8]], ["tile_y", "sp", [-1, 10, 1, 2]], ["tile_k", "sp", [-1, 1, 2]]]}, "result": [[0.08205589375], 0, 2.0785484313964844, 1637515593.3993013], "version": 0.2, "tvm_version": "0.8.dev0"}
{"input": ["cuda -keys=cuda,gpu -max_num_threads=1024 -thread_warp_size=32", "dense_large_batch.gpu", [["TENSOR", [128, 2048], "float32"], ["TENSOR", [1000, 2048], "float32"]], {}], "config": {"index": 144926, "code_hash": null, "entity": [["tile_x", "sp", [-1, 2, 1, 8]], ["tile_y", "sp", [-1, 25, 1, 1]], ["tile_k", "sp", [-1, 8, 1]]]}, "result": [[0.13441343975], 0, 3.17443585395813, 1637515595.4150405], "version": 0.2, "tvm_version": "0.8.dev0"}
{"input": ["cuda -keys=cuda,gpu -max_num_threads=1024 -thread_warp_size=32", "dense_large_batch.gpu", [["TENSOR", [128, 2048], "float32"], ["TENSOR", [1000, 2048], "float32"]], {}], "config": {"index": 672904, "code_hash": null, "entity": [["tile_x", "sp", [-1, 1, 1, 4]], ["tile_y", "sp", [-1, 25, 1, 1]], ["tile_k", "sp", [-1, 4, 2]]]}, "result": [[0.002592993769230769], 0, 1.7575392723083496, 1637515596.5745718], "version": 0.2, "tvm_version": "0.8.dev0"}
{"input": ["cuda -keys=cuda,gpu -max_num_threads=1024 -thread_warp_size=32", "dense_large_batch.gpu", [["TENSOR", [128, 2048], "float32"], ["TENSOR", [1000, 2048], "float32"]], {}], "config": {"index": 599486, "code_hash": null, "entity": [["tile_x", "sp", [-1, 2, 1, 8]], ["tile_y", "sp", [-1, 10, 1, 5]], ["tile_k", "sp", [-1, 1, 2]]]}, "result": [[0.095051952], 0, 2.6604607105255127, 1637515598.0628173], "version": 0.2, "tvm_version": "0.8.dev0"}
{"input": ["cuda -keys=cuda,gpu -max_num_threads=1024 -thread_warp_size=32", "dense_large_batch.gpu", [["TENSOR", [128, 2048], "float32"], ["TENSOR", [1000, 2048], "float32"]], {}], "config": {"index": 684784, "code_hash": null, "entity": [["tile_x", "sp", [-1, 1, 1, 4]], ["tile_y", "sp", [-1, 25, 1, 2]], ["tile_k", "sp", [-1, 4, 2]]]}, "result": [[0.020468077], 0, 3.5554020404815674, 1637515600.265909], "version": 0.2, "tvm_version": "0.8.dev0"}
{"input": ["cuda -keys=cuda,gpu -max_num_threads=1024 -thread_warp_size=32", "dense_large_batch.gpu", [["TENSOR", [128, 2048], "float32"], ["TENSOR", [1000, 2048], "float32"]], {}], "config": {"index": 595646, "code_hash": null, "entity": [["tile_x", "sp", [-1, 2, 1, 8]], ["tile_y", "sp", [-1, 10, 1, 4]], ["tile_k", "sp", [-1, 1, 2]]]}, "result": [[0.08007073225000001], 0, 1.9433250427246094, 1637515601.3740294], "version": 0.2, "tvm_version": "0.8.dev0"}
{"input": ["cuda -keys=cuda,gpu -max_num_threads=1024 -thread_warp_size=32", "dense_large_batch.gpu", [["TENSOR", [128, 2048], "float32"], ["TENSOR", [1000, 2048], "float32"]], {}], "config": {"index": 588685, "code_hash": null, "entity": [["tile_x", "sp", [-1, 1, 1, 8]], ["tile_y", "sp", [-1, 20, 1, 2]], ["tile_k", "sp", [-1, 1, 2]]]}, "result": [[0.08915999075], 0, 2.1071126461029053, 1637515602.6851392], "version": 0.2, "tvm_version": "0.8.dev0"}
{"input": ["cuda -keys=cuda,gpu -max_num_threads=1024 -thread_warp_size=32", "dense_large_batch.gpu", [["TENSOR", [128, 2048], "float32"], ["TENSOR", [1000, 2048], "float32"]], {}], "config": {"index": 1127605, "code_hash": null, "entity": [["tile_x", "sp", [-1, 1, 1, 8]], ["tile_y", "sp", [-1, 20, 1, 5]], ["tile_k", "sp", [-1, 1, 4]]]}, "result": [[0.13267067075], 0, 2.6065125465393066, 1637515604.294122], "version": 0.2, "tvm_version": "0.8.dev0"}
{"input": ["cuda -keys=cuda,gpu -max_num_threads=1024 -thread_warp_size=32", "dense_large_batch.gpu", [["TENSOR", [128, 2048], "float32"], ["TENSOR", [1000, 2048], "float32"]], {}], "config": {"index": 108664, "code_hash": null, "entity": [["tile_x", "sp", [-1, 1, 1, 4]], ["tile_y", "sp", [-1, 20, 1, 2]], ["tile_k", "sp", [-1, 4, 1]]]}, "result": [[0.0029895629411764704], 0, 1.8855037689208984, 1637515605.3659387], "version": 0.2, "tvm_version": "0.8.dev0"}
{"input": ["cuda -keys=cuda,gpu -max_num_threads=1024 -thread_warp_size=32", "dense_large_batch.gpu", [["TENSOR", [128, 2048], "float32"], ["TENSOR", [1000, 2048], "float32"]], {}], "config": {"index": 175744, "code_hash": null, "entity": [["tile_x", "sp", [-1, 1, 1, 4]], ["tile_y", "sp", [-1, 10, 1, 10]], ["tile_k", "sp", [-1, 8, 1]]]}, "result": [[0.06834695825], 0, 4.984999179840088, 1637515607.4930055], "version": 0.2, "tvm_version": "0.8.dev0"}
{"input": ["cuda -keys=cuda,gpu -max_num_threads=1024 -thread_warp_size=32", "dense_large_batch.gpu", [["TENSOR", [128, 2048], "float32"], ["TENSOR", [1000, 2048], "float32"]], {}], "config": {"index": 108544, "code_hash": null, "entity": [["tile_x", "sp", [-1, 1, 1, 4]], ["tile_y", "sp", [-1, 10, 1, 2]], ["tile_k", "sp", [-1, 4, 1]]]}, "result": [[0.0025282389], 0, 2.144749879837036, 1637515665.1404862], "version": 0.2, "tvm_version": "0.8.dev0"}
{"input": ["cuda -keys=cuda,gpu -max_num_threads=1024 -thread_warp_size=32", "dense_large_batch.gpu", [["TENSOR", [128, 2048], "float32"], ["TENSOR", [1000, 2048], "float32"]], {}], "config": {"index": 588784, "code_hash": null, "entity": [["tile_x", "sp", [-1, 1, 1, 4]], ["tile_y", "sp", [-1, 25, 1, 2]], ["tile_k", "sp", [-1, 1, 2]]]}, "result": [[0.02936303325], 0, 2.557605266571045, 1637515666.1833274], "version": 0.2, "tvm_version": "0.8.dev0"}
{"input": ["cuda -keys=cuda,gpu -max_num_threads=1024 -thread_warp_size=32", "dense_large_batch.gpu", [["TENSOR", [128, 2048], "float32"], ["TENSOR", [1000, 2048], "float32"]], {}], "config": {"index": 876, "code_hash": null, "entity": [["tile_x", "sp", [-1, 1, 1, 2]], ["tile_y", "sp", [-1, 25, 1, 1]], ["tile_k", "sp", [-1, 1, 1]]]}, "result": [[0.005067166047619047], 0, 2.1162662506103516, 1637515667.0900555], "version": 0.2, "tvm_version": "0.8.dev0"}
{"input": ["cuda -keys=cuda,gpu -max_num_threads=1024 -thread_warp_size=32", "dense_large_batch.gpu", [["TENSOR", [128, 2048], "float32"], ["TENSOR", [1000, 2048], "float32"]], {}], "config": {"index": 1586730, "code_hash": null, "entity": [["tile_x", "sp", [-1, 1, 2, 8]], ["tile_y", "sp", [-1, 25, 2, 1]], ["tile_k", "sp", [-1, 1, 8]]]}, "result": [[0.00294490555882353], 0, 2.757283926010132, 1637515668.1166804], "version": 0.2, "tvm_version": "0.8.dev0"}
{"input": ["cuda -keys=cuda,gpu -max_num_threads=1024 -thread_warp_size=32", "dense_large_batch.gpu", [["TENSOR", [128, 2048], "float32"], ["TENSOR", [1000, 2048], "float32"]], {}], "config": {"index": 144904, "code_hash": null, "entity": [["tile_x", "sp", [-1, 1, 1, 4]], ["tile_y", "sp", [-1, 25, 1, 1]], ["tile_k", "sp", [-1, 8, 1]]]}, "result": [[0.0025909015128205127], 0, 2.530792713165283, 1637515669.102498], "version": 0.2, "tvm_version": "0.8.dev0"}
{"input": ["cuda -keys=cuda,gpu -max_num_threads=1024 -thread_warp_size=32", "dense_large_batch.gpu", [["TENSOR", [128, 2048], "float32"], ["TENSOR", [1000, 2048], "float32"]], {}], "config": {"index": 840, "code_hash": null, "entity": [["tile_x", "sp", [-1, 1, 1, 1]], ["tile_y", "sp", [-1, 25, 1, 1]], ["tile_k", "sp", [-1, 1, 1]]]}, "result": [[0.00859707425], 0, 2.1166281700134277, 1637515670.0902307], "version": 0.2, "tvm_version": "0.8.dev0"}
{"input": ["cuda -keys=cuda,gpu -max_num_threads=1024 -thread_warp_size=32", "dense_large_batch.gpu", [["TENSOR", [128, 2048], "float32"], ["TENSOR", [1000, 2048], "float32"]], {}], "config": {"index": 96904, "code_hash": null, "entity": [["tile_x", "sp", [-1, 1, 1, 4]], ["tile_y", "sp", [-1, 25, 1, 1]], ["tile_k", "sp", [-1, 4, 1]]]}, "result": [[0.0019434261153846155], 0, 2.388284206390381, 1637515670.9568505], "version": 0.2, "tvm_version": "0.8.dev0"}
{"input": ["cuda -keys=cuda,gpu -max_num_threads=1024 -thread_warp_size=32", "dense_large_batch.gpu", [["TENSOR", [128, 2048], "float32"], ["TENSOR", [1000, 2048], "float32"]], {}], "config": {"index": 156685, "code_hash": null, "entity": [["tile_x", "sp", [-1, 1, 1, 8]], ["tile_y", "sp", [-1, 20, 1, 2]], ["tile_k", "sp", [-1, 8, 1]]]}, "result": [[0.07136496099999999], 0, 3.3214938640594482, 1637515672.3279562], "version": 0.2, "tvm_version": "0.8.dev0"}
{"input": ["cuda -keys=cuda,gpu -max_num_threads=1024 -thread_warp_size=32", "dense_large_batch.gpu", [["TENSOR", [128, 2048], "float32"], ["TENSOR", [1000, 2048], "float32"]], {}], "config": {"index": 904, "code_hash": null, "entity": [["tile_x", "sp", [-1, 1, 1, 4]], ["tile_y", "sp", [-1, 25, 1, 1]], ["tile_k", "sp", [-1, 1, 1]]]}, "result": [[0.0023637893023255815], 0, 1.6807069778442383, 1637515673.1951892], "version": 0.2, "tvm_version": "0.8.dev0"}
{"input": ["cuda -keys=cuda,gpu -max_num_threads=1024 -thread_warp_size=32", "dense_large_batch.gpu", [["TENSOR", [128, 2048], "float32"], ["TENSOR", [1000, 2048], "float32"]], {}], "config": {"index": 60784, "code_hash": null, "entity": [["tile_x", "sp", [-1, 1, 1, 4]], ["tile_y", "sp", [-1, 25, 1, 2]], ["tile_k", "sp", [-1, 2, 1]]]}, "result": [[0.0021498948723404254], 0, 2.3246347904205322, 1637515674.236587], "version": 0.2, "tvm_version": "0.8.dev0"}
{"input": ["cuda -keys=cuda,gpu -max_num_threads=1024 -thread_warp_size=32", "dense_large_batch.gpu", [["TENSOR", [128, 2048], "float32"], ["TENSOR", [1000, 2048], "float32"]], {}], "config": {"index": 576904, "code_hash": null, "entity": [["tile_x", "sp", [-1, 1, 1, 4]], ["tile_y", "sp", [-1, 25, 1, 1]], ["tile_k", "sp", [-1, 1, 2]]]}, "result": [[0.002555014873015873], 0, 2.2605063915252686, 1637515675.2081037], "version": 0.2, "tvm_version": "0.8.dev0"}
{"input": ["cuda -keys=cuda,gpu -max_num_threads=1024 -thread_warp_size=32", "dense_large_batch.gpu", [["TENSOR", [128, 2048], "float32"], ["TENSOR", [1000, 2048], "float32"]], {}], "config": {"index": 48904, "code_hash": null, "entity": [["tile_x", "sp", [-1, 1, 1, 4]], ["tile_y", "sp", [-1, 25, 1, 1]], ["tile_k", "sp", [-1, 2, 1]]]}, "result": [[0.0025723277435897437], 0, 1.7712814807891846, 1637515676.0123596], "version": 0.2, "tvm_version": "0.8.dev0"}
{"input": ["cuda -keys=cuda,gpu -max_num_threads=1024 -thread_warp_size=32", "dense_large_batch.gpu", [["TENSOR", [128, 2048], "float32"], ["TENSOR", [1000, 2048], "float32"]], {}], "config": {"index": 48876, "code_hash": null, "entity": [["tile_x", "sp", [-1, 1, 1, 2]], ["tile_y", "sp", [-1, 25, 1, 1]], ["tile_k", "sp", [-1, 2, 1]]]}, "result": [[0.0038059890370370367], 0, 2.8284435272216797, 1637515677.6295078], "version": 0.2, "tvm_version": "0.8.dev0"}
{"input": ["cuda -keys=cuda,gpu -max_num_threads=1024 -thread_warp_size=32", "dense_large_batch.gpu", [["TENSOR", [128, 2048], "float32"], ["TENSOR", [1000, 2048], "float32"]], {}], "config": {"index": 163624, "code_hash": null, "entity": [["tile_x", "sp", [-1, 1, 1, 4]], ["tile_y", "sp", [-1, 10, 1, 4]], ["tile_k", "sp", [-1, 8, 1]]]}, "result": [[0.0035106356896551726], 0, 3.1022837162017822, 1637515678.8653579], "version": 0.2, "tvm_version": "0.8.dev0"}
{"input": ["cuda -keys=cuda,gpu -max_num_threads=1024 -thread_warp_size=32", "dense_large_batch.gpu", [["TENSOR", [128, 2048], "float32"], ["TENSOR", [1000, 2048], "float32"]], {}], "config": {"index": 204544, "code_hash": null, "entity": [["tile_x", "sp", [-1, 1, 1, 4]], ["tile_y", "sp", [-1, 10, 1, 2]], ["tile_k", "sp", [-1, 16, 1]]]}, "result": [[0.002692884813559322], 0, 3.59332013130188, 1637515680.0596387], "version": 0.2, "tvm_version": "0.8.dev0"}
{"input": ["cuda -keys=cuda,gpu -max_num_threads=1024 -thread_warp_size=32", "dense_large_batch.gpu", [["TENSOR", [128, 2048], "float32"], ["TENSOR", [1000, 2048], "float32"]], {}], "config": {"index": 672805, "code_hash": null, "entity": [["tile_x", "sp", [-1, 1, 1, 8]], ["tile_y", "sp", [-1, 20, 1, 1]], ["tile_k", "sp", [-1, 4, 2]]]}, "result": [[0.004881972], 0, 3.144103527069092, 1637515681.329511], "version": 0.2, "tvm_version": "0.8.dev0"}
{"input": ["cuda -keys=cuda,gpu -max_num_threads=1024 -thread_warp_size=32", "dense_large_batch.gpu", [["TENSOR", [128, 2048], "float32"], ["TENSOR", [1000, 2048], "float32"]], {}], "config": {"index": 996, "code_hash": null, "entity": [["tile_x", "sp", [-1, 1, 1, 2]], ["tile_y", "sp", [-1, 40, 1, 1]], ["tile_k", "sp", [-1, 1, 1]]]}, "result": [[0.004055537486486486], 0, 2.161698341369629, 1637515682.2410505], "version": 0.2, "tvm_version": "0.8.dev0"}
{"input": ["cuda -keys=cuda,gpu -max_num_threads=1024 -thread_warp_size=32", "dense_large_batch.gpu", [["TENSOR", [128, 2048], "float32"], ["TENSOR", [1000, 2048], "float32"]], {}], "config": {"index": 960, "code_hash": null, "entity": [["tile_x", "sp", [-1, 1, 1, 1]], ["tile_y", "sp", [-1, 40, 1, 1]], ["tile_k", "sp", [-1, 1, 1]]]}, "result": [[0.0071170984], 0, 1.7935898303985596, 1637515683.0838768], "version": 0.2, "tvm_version": "0.8.dev0"}
{"input": ["cuda -keys=cuda,gpu -max_num_threads=1024 -thread_warp_size=32", "dense_large_batch.gpu", [["TENSOR", [128, 2048], "float32"], ["TENSOR", [1000, 2048], "float32"]], {}], "config": {"index": 12636, "code_hash": null, "entity": [["tile_x", "sp", [-1, 1, 1, 2]], ["tile_y", "sp", [-1, 20, 1, 2]], ["tile_k", "sp", [-1, 1, 1]]]}, "result": [[0.0039465984249999995], 0, 2.087553024291992, 1637515684.0646589], "version": 0.2, "tvm_version": "0.8.dev0"}
{"input": ["cuda -keys=cuda,gpu -max_num_threads=1024 -thread_warp_size=32", "dense_large_batch.gpu", [["TENSOR", [128, 2048], "float32"], ["TENSOR", [1000, 2048], "float32"]], {}], "config": {"index": 144784, "code_hash": null, "entity": [["tile_x", "sp", [-1, 1, 1, 4]], ["tile_y", "sp", [-1, 20, 1, 1]], ["tile_k", "sp", [-1, 8, 1]]]}, "result": [[0.0024973540487804877], 0, 2.2397940158843994, 1637515684.9493454], "version": 0.2, "tvm_version": "0.8.dev0"}
{"input": ["cuda -keys=cuda,gpu -max_num_threads=1024 -thread_warp_size=32", "dense_large_batch.gpu", [["TENSOR", [128, 2048], "float32"], ["TENSOR", [1000, 2048], "float32"]], {}], "config": {"index": 588756, "code_hash": null, "entity": [["tile_x", "sp", [-1, 1, 1, 2]], ["tile_y", "sp", [-1, 25, 1, 2]], ["tile_k", "sp", [-1, 1, 2]]]}, "result": [[0.00401643116], 0, 2.431394338607788, 1637515685.796699], "version": 0.2, "tvm_version": "0.8.dev0"}
{"input": ["cuda -keys=cuda,gpu -max_num_threads=1024 -thread_warp_size=32", "dense_large_batch.gpu", [["TENSOR", [128, 2048], "float32"], ["TENSOR", [1000, 2048], "float32"]], {}], "config": {"index": 192904, "code_hash": null, "entity": [["tile_x", "sp", [-1, 1, 1, 4]], ["tile_y", "sp", [-1, 25, 1, 1]], ["tile_k", "sp", [-1, 16, 1]]]}, "result": [[0.0028762526571428568], 0, 3.0889852046966553, 1637515686.9692092], "version": 0.2, "tvm_version": "0.8.dev0"}
{"input": ["cuda -keys=cuda,gpu -max_num_threads=1024 -thread_warp_size=32", "dense_large_batch.gpu", [["TENSOR", [128, 2048], "float32"], ["TENSOR", [1000, 2048], "float32"]], {}], "config": {"index": 685870, "code_hash": null, "entity": [["tile_x", "sp", [-1, 1, 2, 4]], ["tile_y", "sp", [-1, 10, 2, 2]], ["tile_k", "sp", [-1, 4, 2]]]}, "result": [[0.0006835987415254237], 0, 2.7766644954681396, 1637515688.0039785], "version": 0.2, "tvm_version": "0.8.dev0"}
{"input": ["cuda -keys=cuda,gpu -max_num_threads=1024 -thread_warp_size=32", "dense_large_batch.gpu", [["TENSOR", [128, 2048], "float32"], ["TENSOR", [1000, 2048], "float32"]], {}], "config": {"index": 48840, "code_hash": null, "entity": [["tile_x", "sp", [-1, 1, 1, 1]], ["tile_y", "sp", [-1, 25, 1, 1]], ["tile_k", "sp", [-1, 2, 1]]]}, "result": [[0.0063369176875], 0, 2.012470245361328, 1637515688.7648551], "version": 0.2, "tvm_version": "0.8.dev0"}
{"input": ["cuda -keys=cuda,gpu -max_num_threads=1024 -thread_warp_size=32", "dense_large_batch.gpu", [["TENSOR", [128, 2048], "float32"], ["TENSOR", [1000, 2048], "float32"]], {}], "config": {"index": 672784, "code_hash": null, "entity": [["tile_x", "sp", [-1, 1, 1, 4]], ["tile_y", "sp", [-1, 20, 1, 1]], ["tile_k", "sp", [-1, 4, 2]]]}, "result": [[0.002603912282051282], 0, 1.478238582611084, 1637515692.2476985], "version": 0.2, "tvm_version": "0.8.dev0"}
{"input": ["cuda -keys=cuda,gpu -max_num_threads=1024 -thread_warp_size=32", "dense_large_batch.gpu", [["TENSOR", [128, 2048], "float32"], ["TENSOR", [1000, 2048], "float32"]], {}], "config": {"index": 576876, "code_hash": null, "entity": [["tile_x", "sp", [-1, 1, 1, 2]], ["tile_y", "sp", [-1, 25, 1, 1]], ["tile_k", "sp", [-1, 1, 2]]]}, "result": [[0.003835478148148148], 0, 1.1494269371032715, 1637515693.130315], "version": 0.2, "tvm_version": "0.8.dev0"}
{"input": ["cuda -keys=cuda,gpu -max_num_threads=1024 -thread_warp_size=32", "dense_large_batch.gpu", [["TENSOR", [128, 2048], "float32"], ["TENSOR", [1000, 2048], "float32"]], {}], "config": {"index": 576840, "code_hash": null, "entity": [["tile_x", "sp", [-1, 1, 1, 1]], ["tile_y", "sp", [-1, 25, 1, 1]], ["tile_k", "sp", [-1, 1, 2]]]}, "result": [[0.0063300180625], 0, 1.1065328121185303, 1637515693.9963424], "version": 0.2, "tvm_version": "0.8.dev0"}
{"input": ["cuda -keys=cuda,gpu -max_num_threads=1024 -thread_warp_size=32", "dense_large_batch.gpu", [["TENSOR", [128, 2048], "float32"], ["TENSOR", [1000, 2048], "float32"]], {}], "config": {"index": 144876, "code_hash": null, "entity": [["tile_x", "sp", [-1, 1, 1, 2]], ["tile_y", "sp", [-1, 25, 1, 1]], ["tile_k", "sp", [-1, 8, 1]]]}, "result": [[0.00318067728125], 0, 1.5004637241363525, 1637515695.0569508], "version": 0.2, "tvm_version": "0.8.dev0"}
{"input": ["cuda -keys=cuda,gpu -max_num_threads=1024 -thread_warp_size=32", "dense_large_batch.gpu", [["TENSOR", [128, 2048], "float32"], ["TENSOR", [1000, 2048], "float32"]], {}], "config": {"index": 684544, "code_hash": null, "entity": [["tile_x", "sp", [-1, 1, 1, 4]], ["tile_y", "sp", [-1, 10, 1, 2]], ["tile_k", "sp", [-1, 4, 2]]]}, "result": [[0.0023517277906976745], 0, 1.5472395420074463, 1637515696.086052], "version": 0.2, "tvm_version": "0.8.dev0"}
{"input": ["cuda -keys=cuda,gpu -max_num_threads=1024 -thread_warp_size=32", "dense_large_batch.gpu", [["TENSOR", [128, 2048], "float32"], ["TENSOR", [1000, 2048], "float32"]], {}], "config": {"index": 684685, "code_hash": null, "entity": [["tile_x", "sp", [-1, 1, 1, 8]], ["tile_y", "sp", [-1, 20, 1, 2]], ["tile_k", "sp", [-1, 4, 2]]]}, "result": [[0.08624721175000001], 0, 2.503875494003296, 1637515697.5216258], "version": 0.2, "tvm_version": "0.8.dev0"}
{"input": ["cuda -keys=cuda,gpu -max_num_threads=1024 -thread_warp_size=32", "dense_large_batch.gpu", [["TENSOR", [128, 2048], "float32"], ["TENSOR", [1000, 2048], "float32"]], {}], "config": {"index": 163625, "code_hash": null, "entity": [["tile_x", "sp", [-1, 2, 1, 4]], ["tile_y", "sp", [-1, 10, 1, 4]], ["tile_k", "sp", [-1, 8, 1]]]}, "result": [[0.09240344874999999], 0, 3.4740798473358154, 1637515699.1087573], "version": 0.2, "tvm_version": "0.8.dev0"}
{"input": ["cuda -keys=cuda,gpu -max_num_threads=1024 -thread_warp_size=32", "dense_large_batch.gpu", [["TENSOR", [128, 2048], "float32"], ["TENSOR", [1000, 2048], "float32"]], {}], "config": {"index": 12664, "code_hash": null, "entity": [["tile_x", "sp", [-1, 1, 1, 4]], ["tile_y", "sp", [-1, 20, 1, 2]], ["tile_k", "sp", [-1, 1, 1]]]}, "result": [[0.0028582352857142858], 0, 1.3171055316925049, 1637515700.0585227], "version": 0.2, "tvm_version": "0.8.dev0"}
{"input": ["cuda -keys=cuda,gpu -max_num_threads=1024 -thread_warp_size=32", "dense_large_batch.gpu", [["TENSOR", [128, 2048], "float32"], ["TENSOR", [1000, 2048], "float32"]], {}], "config": {"index": 12600, "code_hash": null, "entity": [["tile_x", "sp", [-1, 1, 1, 1]], ["tile_y", "sp", [-1, 20, 1, 2]], ["tile_k", "sp", [-1, 1, 1]]]}, "result": [[0.0072164633999999995], 0, 1.1360938549041748, 1637515700.9542022], "version": 0.2, "tvm_version": "0.8.dev0"}
{"input": ["cuda -keys=cuda,gpu -max_num_threads=1024 -thread_warp_size=32", "dense_large_batch.gpu", [["TENSOR", [128, 2048], "float32"], ["TENSOR", [1000, 2048], "float32"]], {}], "config": {"index": 841, "code_hash": null, "entity": [["tile_x", "sp", [-1, 2, 1, 1]], ["tile_y", "sp", [-1, 25, 1, 1]], ["tile_k", "sp", [-1, 1, 1]]]}, "result": [[0.00500078685], 0, 1.3411049842834473, 1637515702.0171502], "version": 0.2, "tvm_version": "0.8.dev0"}
{"input": ["cuda -keys=cuda,gpu -max_num_threads=1024 -thread_warp_size=32", "dense_large_batch.gpu", [["TENSOR", [128, 2048], "float32"], ["TENSOR", [1000, 2048], "float32"]], {}], "config": {"index": 60544, "code_hash": null, "entity": [["tile_x", "sp", [-1, 1, 1, 4]], ["tile_y", "sp", [-1, 10, 1, 2]], ["tile_k", "sp", [-1, 2, 1]]]}, "result": [[0.002469055777777778], 0, 1.3738737106323242, 1637515703.1008403], "version": 0.2, "tvm_version": "0.8.dev0"}
{"input": ["cuda -keys=cuda,gpu -max_num_threads=1024 -thread_warp_size=32", "dense_large_batch.gpu", [["TENSOR", [128, 2048], "float32"], ["TENSOR", [1000, 2048], "float32"]], {}], "config": {"index": 97024, "code_hash": null, "entity": [["tile_x", "sp", [-1, 1, 1, 4]], ["tile_y", "sp", [-1, 40, 1, 1]], ["tile_k", "sp", [-1, 4, 1]]]}, "result": [[0.002989334764705882], 0, 1.5536243915557861, 1637515704.1612177], "version": 0.2, "tvm_version": "0.8.dev0"}
{"input": ["cuda -keys=cuda,gpu -max_num_threads=1024 -thread_warp_size=32", "dense_large_batch.gpu", [["TENSOR", [128, 2048], "float32"], ["TENSOR", [1000, 2048], "float32"]], {}], "config": {"index": 672876, "code_hash": null, "entity": [["tile_x", "sp", [-1, 1, 1, 2]], ["tile_y", "sp", [-1, 25, 1, 1]], ["tile_k", "sp", [-1, 4, 2]]]}, "result": [[0.00317891184375], 0, 1.3184871673583984, 1637515705.0496528], "version": 0.2, "tvm_version": "0.8.dev0"}
{"input": ["cuda -keys=cuda,gpu -max_num_threads=1024 -thread_warp_size=32", "dense_large_batch.gpu", [["TENSOR", [128, 2048], "float32"], ["TENSOR", [1000, 2048], "float32"]], {}], "config": {"index": 684805, "code_hash": null, "entity": [["tile_x", "sp", [-1, 1, 1, 8]], ["tile_y", "sp", [-1, 25, 1, 2]], ["tile_k", "sp", [-1, 4, 2]]]}, "result": [[0.07574230350000001], 0, 2.9515557289123535, 1637515706.5858173], "version": 0.2, "tvm_version": "0.8.dev0"}
{"input": ["cuda -keys=cuda,gpu -max_num_threads=1024 -thread_warp_size=32", "dense_large_batch.gpu", [["TENSOR", [128, 2048], "float32"], ["TENSOR", [1000, 2048], "float32"]], {}], "config": {"index": 756, "code_hash": null, "entity": [["tile_x", "sp", [-1, 1, 1, 2]], ["tile_y", "sp", [-1, 20, 1, 1]], ["tile_k", "sp", [-1, 1, 1]]]}, "result": [[0.003619106892857143], 0, 1.2504422664642334, 1637515707.5368588], "version": 0.2, "tvm_version": "0.8.dev0"}
{"input": ["cuda -keys=cuda,gpu -max_num_threads=1024 -thread_warp_size=32", "dense_large_batch.gpu", [["TENSOR", [128, 2048], "float32"], ["TENSOR", [1000, 2048], "float32"]], {}], "config": {"index": 691625, "code_hash": null, "entity": [["tile_x", "sp", [-1, 2, 1, 4]], ["tile_y", "sp", [-1, 10, 1, 4]], ["tile_k", "sp", [-1, 4, 2]]]}, "result": [[0.08909979224999999], 0, 3.1722500324249268, 1637515708.9875696], "version": 0.2, "tvm_version": "0.8.dev0"}
{"input": ["cuda -keys=cuda,gpu -max_num_threads=1024 -thread_warp_size=32", "dense_large_batch.gpu", [["TENSOR", [128, 2048], "float32"], ["TENSOR", [1000, 2048], "float32"]], {}], "config": {"index": 211624, "code_hash": null, "entity": [["tile_x", "sp", [-1, 1, 1, 4]], ["tile_y", "sp", [-1, 10, 1, 4]], ["tile_k", "sp", [-1, 16, 1]]]}, "result": [[0.00509219385], 0, 3.482224941253662, 1637515710.7232955], "version": 0.2, "tvm_version": "0.8.dev0"}
{"input": ["cuda -keys=cuda,gpu -max_num_threads=1024 -thread_warp_size=32", "dense_large_batch.gpu", [["TENSOR", [128, 2048], "float32"], ["TENSOR", [1000, 2048], "float32"]], {}], "config": {"index": 686, "code_hash": null, "entity": [["tile_x", "sp", [-1, 2, 1, 8]], ["tile_y", "sp", [-1, 10, 1, 1]], ["tile_k", "sp", [-1, 1, 1]]]}, "result": [[0.002342007372093023], 0, 1.270233154296875, 1637515711.670393], "version": 0.2, "tvm_version": "0.8.dev0"}
{"input": ["cuda -keys=cuda,gpu -max_num_threads=1024 -thread_warp_size=32", "dense_large_batch.gpu", [["TENSOR", [128, 2048], "float32"], ["TENSOR", [1000, 2048], "float32"]], {}], "config": {"index": 674730, "code_hash": null, "entity": [["tile_x", "sp", [-1, 1, 2, 8]], ["tile_y", "sp", [-1, 25, 2, 1]], ["tile_k", "sp", [-1, 4, 2]]]}, "result": [[0.0024710926097560974], 0, 2.5262415409088135, 1637515713.2108455], "version": 0.2, "tvm_version": "0.8.dev0"}
{"input": ["cuda -keys=cuda,gpu -max_num_threads=1024 -thread_warp_size=32", "dense_large_batch.gpu", [["TENSOR", [128, 2048], "float32"], ["TENSOR", [1000, 2048], "float32"]], {}], "config": {"index": 624784, "code_hash": null, "entity": [["tile_x", "sp", [-1, 1, 1, 4]], ["tile_y", "sp", [-1, 20, 1, 1]], ["tile_k", "sp", [-1, 2, 2]]]}, "result": [[0.0022930002499999998], 0, 1.1989753246307373, 1637515713.9908092], "version": 0.2, "tvm_version": "0.8.dev0"}
{"input": ["cuda -keys=cuda,gpu -max_num_threads=1024 -thread_warp_size=32", "dense_large_batch.gpu", [["TENSOR", [128, 2048], "float32"], ["TENSOR", [1000, 2048], "float32"]], {}], "config": {"index": 167196, "code_hash": null, "entity": [["tile_x", "sp", [-1, 1, 1, 2]], ["tile_y", "sp", [-1, 5, 1, 5]], ["tile_k", "sp", [-1, 8, 1]]]}, "result": [[0.0031775995], 0, 1.3432667255401611, 1637515714.915317], "version": 0.2, "tvm_version": "0.8.dev0"}
{"input": ["cuda -keys=cuda,gpu -max_num_threads=1024 -thread_warp_size=32", "dense_large_batch.gpu", [["TENSOR", [128, 2048], "float32"], ["TENSOR", [1000, 2048], "float32"]], {}], "config": {"index": 588720, "code_hash": null, "entity": [["tile_x", "sp", [-1, 1, 1, 1]], ["tile_y", "sp", [-1, 25, 1, 2]], ["tile_k", "sp", [-1, 1, 2]]]}, "result": [[0.006975565466666667], 0, 1.240955114364624, 1637515715.850428], "version": 0.2, "tvm_version": "0.8.dev0"}
{"input": ["cuda -keys=cuda,gpu -max_num_threads=1024 -thread_warp_size=32", "dense_large_batch.gpu", [["TENSOR", [128, 2048], "float32"], ["TENSOR", [1000, 2048], "float32"]], {}], "config": {"index": 685890, "code_hash": null, "entity": [["tile_x", "sp", [-1, 1, 2, 8]], ["tile_y", "sp", [-1, 10, 2, 2]], ["tile_k", "sp", [-1, 4, 2]]]}, "result": [[0.0014464626126126127], 0, 2.4349172115325928, 1637515717.3719342], "version": 0.2, "tvm_version": "0.8.dev0"}
{"input": ["cuda -keys=cuda,gpu -max_num_threads=1024 -thread_warp_size=32", "dense_large_batch.gpu", [["TENSOR", [128, 2048], "float32"], ["TENSOR", [1000, 2048], "float32"]], {}], "config": {"index": 48877, "code_hash": null, "entity": [["tile_x", "sp", [-1, 2, 1, 2]], ["tile_y", "sp", [-1, 25, 1, 1]], ["tile_k", "sp", [-1, 2, 1]]]}, "result": [[0.0025633114126984127], 0, 1.2814767360687256, 1637515718.3290212], "version": 0.2, "tvm_version": "0.8.dev0"}
{"input": ["cuda -keys=cuda,gpu -max_num_threads=1024 -thread_warp_size=32", "dense_large_batch.gpu", [["TENSOR", [128, 2048], "float32"], ["TENSOR", [1000, 2048], "float32"]], {}], "config": {"index": 96876, "code_hash": null, "entity": [["tile_x", "sp", [-1, 1, 1, 2]], ["tile_y", "sp", [-1, 25, 1, 1]], ["tile_k", "sp", [-1, 4, 1]]]}, "result": [[0.0034867623103448275], 0, 1.2496440410614014, 1637515721.9436293], "version": 0.2, "tvm_version": "0.8.dev0"}
{"input": ["cuda -keys=cuda,gpu -max_num_threads=1024 -thread_warp_size=32", "dense_large_batch.gpu", [["TENSOR", [128, 2048], "float32"], ["TENSOR", [1000, 2048], "float32"]], {}], "config": {"index": 576877, "code_hash": null, "entity": [["tile_x", "sp", [-1, 2, 1, 2]], ["tile_y", "sp", [-1, 25, 1, 1]], ["tile_k", "sp", [-1, 1, 2]]]}, "result": [[0.0025743238974358976], 0, 1.0109968185424805, 1637515722.6856818], "version": 0.2, "tvm_version": "0.8.dev0"}
{"input": ["cuda -keys=cuda,gpu -max_num_threads=1024 -thread_warp_size=32", "dense_large_batch.gpu", [["TENSOR", [128, 2048], "float32"], ["TENSOR", [1000, 2048], "float32"]], {}], "config": {"index": 156516, "code_hash": null, "entity": [["tile_x", "sp", [-1, 1, 1, 2]], ["tile_y", "sp", [-1, 10, 1, 2]], ["tile_k", "sp", [-1, 8, 1]]]}, "result": [[0.0035116959655172413], 0, 1.3796758651733398, 1637515723.5837426], "version": 0.2, "tvm_version": "0.8.dev0"}
{"input": ["cuda -keys=cuda,gpu -max_num_threads=1024 -thread_warp_size=32", "dense_large_batch.gpu", [["TENSOR", [128, 2048], "float32"], ["TENSOR", [1000, 2048], "float32"]], {}], "config": {"index": 96805, "code_hash": null, "entity": [["tile_x", "sp", [-1, 1, 1, 8]], ["tile_y", "sp", [-1, 20, 1, 1]], ["tile_k", "sp", [-1, 4, 1]]]}, "result": [[0.002333682209302326], 0, 1.4986257553100586, 1637515724.6600175], "version": 0.2, "tvm_version": "0.8.dev0"}
{"input": ["cuda -keys=cuda,gpu -max_num_threads=1024 -thread_warp_size=32", "dense_large_batch.gpu", [["TENSOR", [128, 2048], "float32"], ["TENSOR", [1000, 2048], "float32"]], {}], "config": {"index": 1024, "code_hash": null, "entity": [["tile_x", "sp", [-1, 1, 1, 4]], ["tile_y", "sp", [-1, 40, 1, 1]], ["tile_k", "sp", [-1, 1, 1]]]}, "result": [[0.002871349428571429], 0, 1.193765640258789, 1637515725.5559056], "version": 0.2, "tvm_version": "0.8.dev0"}
{"input": ["cuda -keys=cuda,gpu -max_num_threads=1024 -thread_warp_size=32", "dense_large_batch.gpu", [["TENSOR", [128, 2048], "float32"], ["TENSOR", [1000, 2048], "float32"]], {}], "config": {"index": 167465, "code_hash": null, "entity": [["tile_x", "sp", [-1, 2, 1, 4]], ["tile_y", "sp", [-1, 10, 1, 5]], ["tile_k", "sp", [-1, 8, 1]]]}, "result": [[0.12318974725], 0, 4.255721569061279, 1637515727.6944492], "version": 0.2, "tvm_version": "0.8.dev0"}
{"input": ["cuda -keys=cuda,gpu -max_num_threads=1024 -thread_warp_size=32", "dense_large_batch.gpu", [["TENSOR", [128, 2048], "float32"], ["TENSOR", [1000, 2048], "float32"]], {}], "config": {"index": 174156, "code_hash": null, "entity": [["tile_x", "sp", [-1, 1, 1, 2]], ["tile_y", "sp", [-1, 5, 1, 8]], ["tile_k", "sp", [-1, 8, 1]]]}, "result": [[0.0040103296], 0, 1.6356828212738037, 1637515728.7435565], "version": 0.2, "tvm_version": "0.8.dev0"}
{"input": ["cuda -keys=cuda,gpu -max_num_threads=1024 -thread_warp_size=32", "dense_large_batch.gpu", [["TENSOR", [128, 2048], "float32"], ["TENSOR", [1000, 2048], "float32"]], {}], "config": {"index": 636544, "code_hash": null, "entity": [["tile_x", "sp", [-1, 1, 1, 4]], ["tile_y", "sp", [-1, 10, 1, 2]], ["tile_k", "sp", [-1, 2, 2]]]}, "result": [[0.002293525386363636], 0, 1.1288235187530518, 1637515729.5627387], "version": 0.2, "tvm_version": "0.8.dev0"}
{"input": ["cuda -keys=cuda,gpu -max_num_threads=1024 -thread_warp_size=32", "dense_large_batch.gpu", [["TENSOR", [128, 2048], "float32"], ["TENSOR", [1000, 2048], "float32"]], {}], "config": {"index": 156396, "code_hash": null, "entity": [["tile_x", "sp", [-1, 1, 1, 2]], ["tile_y", "sp", [-1, 5, 1, 2]], ["tile_k", "sp", [-1, 8, 1]]]}, "result": [[0.0037096291428571427], 0, 1.226069450378418, 1637515730.4369972], "version": 0.2, "tvm_version": "0.8.dev0"}
{"input": ["cuda -keys=cuda,gpu -max_num_threads=1024 -thread_warp_size=32", "dense_large_batch.gpu", [["TENSOR", [128, 2048], "float32"], ["TENSOR", [1000, 2048], "float32"]], {}], "config": {"index": 96784, "code_hash": null, "entity": [["tile_x", "sp", [-1, 1, 1, 4]], ["tile_y", "sp", [-1, 20, 1, 1]], ["tile_k", "sp", [-1, 4, 1]]]}, "result": [[0.002283757568181818], 0, 1.1270043849945068, 1637515731.262317], "version": 0.2, "tvm_version": "0.8.dev0"}
{"input": ["cuda -keys=cuda,gpu -max_num_threads=1024 -thread_warp_size=32", "dense_large_batch.gpu", [["TENSOR", [128, 2048], "float32"], ["TENSOR", [1000, 2048], "float32"]], {}], "config": {"index": 96996, "code_hash": null, "entity": [["tile_x", "sp", [-1, 1, 1, 2]], ["tile_y", "sp", [-1, 40, 1, 1]], ["tile_k", "sp", [-1, 4, 1]]]}, "result": [[0.003691419071428572], 0, 1.1601762771606445, 1637515732.110913], "version": 0.2, "tvm_version": "0.8.dev0"}
{"input": ["cuda -keys=cuda,gpu -max_num_threads=1024 -thread_warp_size=32", "dense_large_batch.gpu", [["TENSOR", [128, 2048], "float32"], ["TENSOR", [1000, 2048], "float32"]], {}], "config": {"index": 625024, "code_hash": null, "entity": [["tile_x", "sp", [-1, 1, 1, 4]], ["tile_y", "sp", [-1, 40, 1, 1]], ["tile_k", "sp", [-1, 2, 2]]]}, "result": [[0.01196786488888889], 0, 1.7495238780975342, 1637515733.2927], "version": 0.2, "tvm_version": "0.8.dev0"}
{"input": ["cuda -keys=cuda,gpu -max_num_threads=1024 -thread_warp_size=32", "dense_large_batch.gpu", [["TENSOR", [128, 2048], "float32"], ["TENSOR", [1000, 2048], "float32"]], {}], "config": {"index": 108516, "code_hash": null, "entity": [["tile_x", "sp", [-1, 1, 1, 2]], ["tile_y", "sp", [-1, 10, 1, 2]], ["tile_k", "sp", [-1, 4, 1]]]}, "result": [[0.0031301264062500002], 0, 1.1221919059753418, 1637515734.0887766], "version": 0.2, "tvm_version": "0.8.dev0"}
