artifacts/microbenchmark/tvm/autotvm/matmul_nt/matmul_65536_30522_1024.log
{"input": ["cuda -keys=cuda,gpu -max_num_threads=1024 -thread_warp_size=32", "dense_large_batch.gpu", [["TENSOR", [65536, 30522], "float32"], ["TENSOR", [1024, 30522], "float32"]], {}], "config": {"index": 2350980, "code_hash": null, "entity": [["tile_x", "sp", [-1, 4, 4, 2]], ["tile_y", "sp", [-1, 1, 4, 4]], ["tile_k", "sp", [-1, 1, 2]]]}, "result": [[11.3418140125], 0, 83.52546238899231, 1637552784.8761096], "version": 0.2, "tvm_version": "0.8.dev0"}
{"input": ["cuda -keys=cuda,gpu -max_num_threads=1024 -thread_warp_size=32", "dense_large_batch.gpu", [["TENSOR", [65536, 30522], "float32"], ["TENSOR", [1024, 30522], "float32"]], {}], "config": {"index": 973, "code_hash": null, "entity": [["tile_x", "sp", [-1, 16, 1, 1]], ["tile_y", "sp", [-1, 2, 1, 1]], ["tile_k", "sp", [-1, 1, 1]]]}, "result": [[27.63994873475], 0, 165.87715578079224, 1637552998.855995], "version": 0.2, "tvm_version": "0.8.dev0"}
{"input": ["cuda -keys=cuda,gpu -max_num_threads=1024 -thread_warp_size=32", "dense_large_batch.gpu", [["TENSOR", [65536, 30522], "float32"], ["TENSOR", [1024, 30522], "float32"]], {}], "config": {"index": 1941, "code_hash": null, "entity": [["tile_x", "sp", [-1, 8, 1, 1]], ["tile_y", "sp", [-1, 4, 1, 1]], ["tile_k", "sp", [-1, 1, 1]]]}, "result": [[20.059336665], 0, 127.51553058624268, 1637553126.2460976], "version": 0.2, "tvm_version": "0.8.dev0"}
{"input": ["cuda -keys=cuda,gpu -max_num_threads=1024 -thread_warp_size=32", "dense_large_batch.gpu", [["TENSOR", [65536, 30522], "float32"], ["TENSOR", [1024, 30522], "float32"]], {}], "config": {"index": 63958, "code_hash": null, "entity": [["tile_x", "sp", [-1, 16, 1, 1]], ["tile_y", "sp", [-1, 1, 1, 2]], ["tile_k", "sp", [-1, 1, 1]]]}, "result": [[27.771731025], 0, 165.92507576942444, 1637553292.159079], "version": 0.2, "tvm_version": "0.8.dev0"}
{"input": ["cuda -keys=cuda,gpu -max_num_threads=1024 -thread_warp_size=32", "dense_large_batch.gpu", [["TENSOR", [65536, 30522], "float32"], ["TENSOR", [1024, 30522], "float32"]], {}], "config": {"index": 1259, "code_hash": null, "entity": [["tile_x", "sp", [-1, 2, 1, 4]], ["tile_y", "sp", [-1, 2, 1, 1]], ["tile_k", "sp", [-1, 1, 1]]]}, "result": [[33.7906956555], 0, 197.87367296218872, 1637553489.8814275], "version": 0.2, "tvm_version": "0.8.dev0"}
{"input": ["cuda -keys=cuda,gpu -max_num_threads=1024 -thread_warp_size=32", "dense_large_batch.gpu", [["TENSOR", [65536, 30522], "float32"], ["TENSOR", [1024, 30522], "float32"]], {}], "config": {"index": 2911, "code_hash": null, "entity": [["tile_x", "sp", [-1, 16, 1, 1]], ["tile_y", "sp", [-1, 8, 1, 1]], ["tile_k", "sp", [-1, 1, 1]]]}, "result": [[12.6910334845], 0, 93.43346762657166, 1637553783.8031542], "version": 0.2, "tvm_version": "0.8.dev0"}
{"input": ["cuda -keys=cuda,gpu -max_num_threads=1024 -thread_warp_size=32", "dense_large_batch.gpu", [["TENSOR", [65536, 30522], "float32"], ["TENSOR", [1024, 30522], "float32"]], {}], "config": {"index": 228702, "code_hash": null, "entity": [["tile_x", "sp", [-1, 2, 2, 1]], ["tile_y", "sp", [-1, 1, 2, 32]], ["tile_k", "sp", [-1, 1, 1]]]}, "result": [[28.04609544975], 0, 166.99526453018188, 1637553951.437069], "version": 0.2, "tvm_version": "0.8.dev0"}
{"input": ["cuda -keys=cuda,gpu -max_num_threads=1024 -thread_warp_size=32", "dense_large_batch.gpu", [["TENSOR", [65536, 30522], "float32"], ["TENSOR", [1024, 30522], "float32"]], {}], "config": {"index": 1942, "code_hash": null, "entity": [["tile_x", "sp", [-1, 16, 1, 1]], ["tile_y", "sp", [-1, 4, 1, 1]], ["tile_k", "sp", [-1, 1, 1]]]}, "result": [[17.37988075475], 0, 114.43563675880432, 1637554328.7840095], "version": 0.2, "tvm_version": "0.8.dev0"}
{"input": ["cuda -keys=cuda,gpu -max_num_threads=1024 -thread_warp_size=32", "dense_large_batch.gpu", [["TENSOR", [65536, 30522], "float32"], ["TENSOR", [1024, 30522], "float32"]], {}], "config": {"index": 972, "code_hash": null, "entity": [["tile_x", "sp", [-1, 8, 1, 1]], ["tile_y", "sp", [-1, 2, 1, 1]], ["tile_k", "sp", [-1, 1, 1]]]}, "result": [[33.735677022999994], 0, 196.09042596817017, 1637554524.7394035], "version": 0.2, "tvm_version": "0.8.dev0"}
{"input": ["cuda -keys=cuda,gpu -max_num_threads=1024 -thread_warp_size=32", "dense_large_batch.gpu", [["TENSOR", [65536, 30522], "float32"], ["TENSOR", [1024, 30522], "float32"]], {}], "config": {"index": 2281031, "code_hash": null, "entity": [["tile_x", "sp", [-1, 32, 1, 1]], ["tile_y", "sp", [-1, 1, 1, 2]], ["tile_k", "sp", [-1, 1, 2]]]}, "result": [[26.87417313425], 0, 161.44663166999817, 1637555287.555982], "version": 0.2, "tvm_version": "0.8.dev0"}
{"input": ["cuda -keys=cuda,gpu -max_num_threads=1024 -thread_warp_size=32", "dense_large_batch.gpu", [["TENSOR", [65536, 30522], "float32"], ["TENSOR", [1024, 30522], "float32"]], {}], "config": {"index": 394388, "code_hash": null, "entity": [["tile_x", "sp", [-1, 32, 1, 1]], ["tile_y", "sp", [-1, 1, 1, 4]], ["tile_k", "sp", [-1, 2, 1]]]}, "result": [[17.897361150749997], 0, 116.19772362709045, 1637556004.982183], "version": 0.2, "tvm_version": "0.8.dev0"}
{"input": ["cuda -keys=cuda,gpu -max_num_threads=1024 -thread_warp_size=32", "dense_large_batch.gpu", [["TENSOR", [65536, 30522], "float32"], ["TENSOR", [1024, 30522], "float32"]], {}], "config": {"index": 341093, "code_hash": null, "entity": [["tile_x", "sp", [-1, 32, 1, 1]], ["tile_y", "sp", [-1, 1, 1, 2]], ["tile_k", "sp", [-1, 2, 1]]]}, "result": [[26.87852785925], 0, 162.9451560974121, 1637556167.690862], "version": 0.2, "tvm_version": "0.8.dev0"}
{"input": ["cuda -keys=cuda,gpu -max_num_threads=1024 -thread_warp_size=32", "dense_large_batch.gpu", [["TENSOR", [65536, 30522], "float32"], ["TENSOR", [1024, 30522], "float32"]], {}], "config": {"index": 2334326, "code_hash": null, "entity": [["tile_x", "sp", [-1, 32, 1, 1]], ["tile_y", "sp", [-1, 1, 1, 4]], ["tile_k", "sp", [-1, 1, 2]]]}, "result": [[17.91439889075], 0, 117.74254751205444, 1637556285.1279385], "version": 0.2, "tvm_version": "0.8.dev0"}
{"input": ["cuda -keys=cuda,gpu -max_num_threads=1024 -thread_warp_size=32", "dense_large_batch.gpu", [["TENSOR", [65536, 30522], "float32"], ["TENSOR", [1024, 30522], "float32"]], {}], "config": {"index": 2218046, "code_hash": null, "entity": [["tile_x", "sp", [-1, 32, 1, 1]], ["tile_y", "sp", [-1, 2, 1, 1]], ["tile_k", "sp", [-1, 1, 2]]]}, "result": [[28.52704758275], 0, 171.2707462310791, 1637556656.6466575], "version": 0.2, "tvm_version": "0.8.dev0"}
{"input": ["cuda -keys=cuda,gpu -max_num_threads=1024 -thread_warp_size=32", "dense_large_batch.gpu", [["TENSOR", [65536, 30522], "float32"], ["TENSOR", [1024, 30522], "float32"]], {}], "config": {"index": 280046, "code_hash": null, "entity": [["tile_x", "sp", [-1, 32, 1, 1]], ["tile_y", "sp", [-1, 8, 1, 1]], ["tile_k", "sp", [-1, 2, 1]]]}, "result": [[30.563971616], 0, 180.3132905960083, 1637556836.5701995], "version": 0.2, "tvm_version": "0.8.dev0"}
{"input": ["cuda -keys=cuda,gpu -max_num_threads=1024 -thread_warp_size=32", "dense_large_batch.gpu", [["TENSOR", [65536, 30522], "float32"], ["TENSOR", [1024, 30522], "float32"]], {}], "config": {"index": 2219015, "code_hash": null, "entity": [["tile_x", "sp", [-1, 32, 1, 1]], ["tile_y", "sp", [-1, 4, 1, 1]], ["tile_k", "sp", [-1, 1, 2]]]}, "result": [[17.939442619], 0, 118.52616119384766, 1637557355.9338865], "version": 0.2, "tvm_version": "0.8.dev0"}
{"input": ["cuda -keys=cuda,gpu -max_num_threads=1024 -thread_warp_size=32", "dense_large_batch.gpu", [["TENSOR", [65536, 30522], "float32"], ["TENSOR", [1024, 30522], "float32"]], {}], "config": {"index": 1125, "code_hash": null, "entity": [["tile_x", "sp", [-1, 8, 1, 2]], ["tile_y", "sp", [-1, 2, 1, 1]], ["tile_k", "sp", [-1, 1, 1]]]}, "result": [[27.730559132], 0, 165.86886358261108, 1637557521.6217368], "version": 0.2, "tvm_version": "0.8.dev0"}
{"input": ["cuda -keys=cuda,gpu -max_num_threads=1024 -thread_warp_size=32", "dense_large_batch.gpu", [["TENSOR", [65536, 30522], "float32"], ["TENSOR", [1024, 30522], "float32"]], {}], "config": {"index": 195742, "code_hash": null, "entity": [["tile_x", "sp", [-1, 16, 1, 1]], ["tile_y", "sp", [-1, 1, 1, 16]], ["tile_k", "sp", [-1, 1, 1]]]}, "result": [[22.537670013750002], 0, 141.585684299469, 1637558063.6963308], "version": 0.2, "tvm_version": "0.8.dev0"}
{"input": ["cuda -keys=cuda,gpu -max_num_threads=1024 -thread_warp_size=32", "dense_large_batch.gpu", [["TENSOR", [65536, 30522], "float32"], ["TENSOR", [1024, 30522], "float32"]], {}], "config": {"index": 118222, "code_hash": null, "entity": [["tile_x", "sp", [-1, 16, 1, 1]], ["tile_y", "sp", [-1, 2, 1, 4]], ["tile_k", "sp", [-1, 1, 1]]]}, "result": [[12.7591812285], 0, 93.0998010635376, 1637558422.823837], "version": 0.2, "tvm_version": "0.8.dev0"}
{"input": ["cuda -keys=cuda,gpu -max_num_threads=1024 -thread_warp_size=32", "dense_large_batch.gpu", [["TENSOR", [65536, 30522], "float32"], ["TENSOR", [1024, 30522], "float32"]], {}], "config": {"index": 2282000, "code_hash": null, "entity": [["tile_x", "sp", [-1, 32, 1, 1]], ["tile_y", "sp", [-1, 2, 1, 2]], ["tile_k", "sp", [-1, 1, 2]]]}, "result": [[17.845114908], 0, 115.93343496322632, 1637558538.4904323], "version": 0.2, "tvm_version": "0.8.dev0"}
{"input": ["cuda -keys=cuda,gpu -max_num_threads=1024 -thread_warp_size=32", "dense_large_batch.gpu", [["TENSOR", [65536, 30522], "float32"], ["TENSOR", [1024, 30522], "float32"]], {}], "config": {"index": 64927, "code_hash": null, "entity": [["tile_x", "sp", [-1, 16, 1, 1]], ["tile_y", "sp", [-1, 2, 1, 2]], ["tile_k", "sp", [-1, 1, 1]]]}, "result": [[17.490614491749998], 0, 115.76589035987854, 1637558654.007282], "version": 0.2, "tvm_version": "0.8.dev0"}
{"input": ["cuda -keys=cuda,gpu -max_num_threads=1024 -thread_warp_size=32", "dense_large_batch.gpu", [["TENSOR", [65536, 30522], "float32"], ["TENSOR", [1024, 30522], "float32"]], {}], "config": {"index": 342062, "code_hash": null, "entity": [["tile_x", "sp", [-1, 32, 1, 1]], ["tile_y", "sp", [-1, 2, 1, 2]], ["tile_k", "sp", [-1, 2, 1]]]}, "result": [[17.88328468075], 0, 116.7073130607605, 1637558770.4170153], "version": 0.2, "tvm_version": "0.8.dev0"}
{"input": ["cuda -keys=cuda,gpu -max_num_threads=1024 -thread_warp_size=32", "dense_large_batch.gpu", [["TENSOR", [65536, 30522], "float32"], ["TENSOR", [1024, 30522], "float32"]], {}], "config": {"index": 65896, "code_hash": null, "entity": [["tile_x", "sp", [-1, 16, 1, 1]], ["tile_y", "sp", [-1, 4, 1, 2]], ["tile_k", "sp", [-1, 1, 1]]]}, "result": [[12.824385657999999], 0, 92.3535213470459, 1637558862.527594], "version": 0.2, "tvm_version": "0.8.dev0"}
{"input": ["cuda -keys=cuda,gpu -max_num_threads=1024 -thread_warp_size=32", "dense_large_batch.gpu", [["TENSOR", [65536, 30522], "float32"], ["TENSOR", [1024, 30522], "float32"]], {}], "config": {"index": 161827, "code_hash": null, "entity": [["tile_x", "sp", [-1, 16, 1, 1]], ["tile_y", "sp", [-1, 2, 1, 8]], ["tile_k", "sp", [-1, 1, 1]]]}, "result": [[23.73175449575], 0, 145.60194730758667, 1637559007.7729902], "version": 0.2, "tvm_version": "0.8.dev0"}
{"input": ["cuda -keys=cuda,gpu -max_num_threads=1024 -thread_warp_size=32", "dense_large_batch.gpu", [["TENSOR", [65536, 30522], "float32"], ["TENSOR", [1024, 30522], "float32"]], {}], "config": {"index": 279077, "code_hash": null, "entity": [["tile_x", "sp", [-1, 32, 1, 1]], ["tile_y", "sp", [-1, 4, 1, 1]], ["tile_k", "sp", [-1, 2, 1]]]}, "result": [[17.941213723249998], 0, 116.45666217803955, 1637559123.916354], "version": 0.2, "tvm_version": "0.8.dev0"}
{"input": ["cuda -keys=cuda,gpu -max_num_threads=1024 -thread_warp_size=32", "dense_large_batch.gpu", [["TENSOR", [65536, 30522], "float32"], ["TENSOR", [1024, 30522], "float32"]], {}], "config": {"index": 118221, "code_hash": null, "entity": [["tile_x", "sp", [-1, 8, 1, 1]], ["tile_y", "sp", [-1, 2, 1, 4]], ["tile_k", "sp", [-1, 1, 1]]]}, "result": [[14.046446755749999], 0, 96.99040222167969, 1637559220.596364], "version": 0.2, "tvm_version": "0.8.dev0"}
{"input": ["cuda -keys=cuda,gpu -max_num_threads=1024 -thread_warp_size=32", "dense_large_batch.gpu", [["TENSOR", [65536, 30522], "float32"], ["TENSOR", [1024, 30522], "float32"]], {}], "config": {"index": 160858, "code_hash": null, "entity": [["tile_x", "sp", [-1, 16, 1, 1]], ["tile_y", "sp", [-1, 1, 1, 8]], ["tile_k", "sp", [-1, 1, 1]]]}, "result": [[12.788263033749999], 0, 91.69075083732605, 1637559713.0142088], "version": 0.2, "tvm_version": "0.8.dev0"}
{"input": ["cuda -keys=cuda,gpu -max_num_threads=1024 -thread_warp_size=32", "dense_large_batch.gpu", [["TENSOR", [65536, 30522], "float32"], ["TENSOR", [1024, 30522], "float32"]], {}], "config": {"index": 342061, "code_hash": null, "entity": [["tile_x", "sp", [-1, 16, 1, 1]], ["tile_y", "sp", [-1, 2, 1, 2]], ["tile_k", "sp", [-1, 2, 1]]]}, "result": [[17.78792901225], 0, 116.10925102233887, 1637559828.8656468], "version": 0.2, "tvm_version": "0.8.dev0"}
{"input": ["cuda -keys=cuda,gpu -max_num_threads=1024 -thread_warp_size=32", "dense_large_batch.gpu", [["TENSOR", [65536, 30522], "float32"], ["TENSOR", [1024, 30522], "float32"]], {}], "config": {"index": 2281999, "code_hash": null, "entity": [["tile_x", "sp", [-1, 16, 1, 1]], ["tile_y", "sp", [-1, 2, 1, 2]], ["tile_k", "sp", [-1, 1, 2]]]}, "result": [[17.824760487], 0, 116.89734482765198, 1637559945.4578023], "version": 0.2, "tvm_version": "0.8.dev0"}
{"input": ["cuda -keys=cuda,gpu -max_num_threads=1024 -thread_warp_size=32", "dense_large_batch.gpu", [["TENSOR", [65536, 30522], "float32"], ["TENSOR", [1024, 30522], "float32"]], {}], "config": {"index": 117253, "code_hash": null, "entity": [["tile_x", "sp", [-1, 16, 1, 1]], ["tile_y", "sp", [-1, 1, 1, 4]], ["tile_k", "sp", [-1, 1, 1]]]}, "result": [[17.368661402500003], 0, 115.95766806602478, 1637560061.1633458], "version": 0.2, "tvm_version": "0.8.dev0"}
{"input": ["cuda -keys=cuda,gpu -max_num_threads=1024 -thread_warp_size=32", "dense_large_batch.gpu", [["TENSOR", [65536, 30522], "float32"], ["TENSOR", [1024, 30522], "float32"]], {}], "config": {"index": 279076, "code_hash": null, "entity": [["tile_x", "sp", [-1, 16, 1, 1]], ["tile_y", "sp", [-1, 4, 1, 1]], ["tile_k", "sp", [-1, 2, 1]]]}, "result": [[17.772765823500002], 0, 115.59281301498413, 1637560176.4516835], "version": 0.2, "tvm_version": "0.8.dev0"}
{"input": ["cuda -keys=cuda,gpu -max_num_threads=1024 -thread_warp_size=32", "dense_large_batch.gpu", [["TENSOR", [65536, 30522], "float32"], ["TENSOR", [1024, 30522], "float32"]], {}], "config": {"index": 65079, "code_hash": null, "entity": [["tile_x", "sp", [-1, 8, 1, 2]], ["tile_y", "sp", [-1, 2, 1, 2]], ["tile_k", "sp", [-1, 1, 1]]]}, "result": [[17.5244909055], 0, 114.99266409873962, 1637560291.1151705], "version": 0.2, "tvm_version": "0.8.dev0"}
{"input": ["cuda -keys=cuda,gpu -max_num_threads=1024 -thread_warp_size=32", "dense_large_batch.gpu", [["TENSOR", [65536, 30522], "float32"], ["TENSOR", [1024, 30522], "float32"]], {}], "config": {"index": 2219014, "code_hash": null, "entity": [["tile_x", "sp", [-1, 16, 1, 1]], ["tile_y", "sp", [-1, 4, 1, 1]], ["tile_k", "sp", [-1, 1, 2]]]}, "result": [[17.78400203725], 0, 116.14054703712463, 1637560406.9500864], "version": 0.2, "tvm_version": "0.8.dev0"}
{"input": ["cuda -keys=cuda,gpu -max_num_threads=1024 -thread_warp_size=32", "dense_large_batch.gpu", [["TENSOR", [65536, 30522], "float32"], ["TENSOR", [1024, 30522], "float32"]], {}], "config": {"index": 343031, "code_hash": null, "entity": [["tile_x", "sp", [-1, 32, 1, 1]], ["tile_y", "sp", [-1, 4, 1, 2]], ["tile_k", "sp", [-1, 2, 1]]]}, "result": [[30.52176819825], 0, 180.52358436584473, 1637560586.953019], "version": 0.2, "tvm_version": "0.8.dev0"}
{"input": ["cuda -keys=cuda,gpu -max_num_threads=1024 -thread_warp_size=32", "dense_large_batch.gpu", [["TENSOR", [65536, 30522], "float32"], ["TENSOR", [1024, 30522], "float32"]], {}], "config": {"index": 555243, "code_hash": null, "entity": [["tile_x", "sp", [-1, 64, 1, 1]], ["tile_y", "sp", [-1, 2, 1, 1]], ["tile_k", "sp", [-1, 3, 1]]]}, "result": [[25.97805932775], 0, 159.3860514163971, 1637560745.8632994], "version": 0.2, "tvm_version": "0.8.dev0"}
{"input": ["cuda -keys=cuda,gpu -max_num_threads=1024 -thread_warp_size=32", "dense_large_batch.gpu", [["TENSOR", [65536, 30522], "float32"], ["TENSOR", [1024, 30522], "float32"]], {}], "config": {"index": 64926, "code_hash": null, "entity": [["tile_x", "sp", [-1, 8, 1, 1]], ["tile_y", "sp", [-1, 2, 1, 2]], ["tile_k", "sp", [-1, 1, 1]]]}, "result": [[20.17003351125], 0, 129.60017251968384, 1637560875.1843598], "version": 0.2, "tvm_version": "0.8.dev0"}
{"input": ["cuda -keys=cuda,gpu -max_num_threads=1024 -thread_warp_size=32", "dense_large_batch.gpu", [["TENSOR", [65536, 30522], "float32"], ["TENSOR", [1024, 30522], "float32"]], {}], "config": {"index": 119191, "code_hash": null, "entity": [["tile_x", "sp", [-1, 16, 1, 1]], ["tile_y", "sp", [-1, 4, 1, 4]], ["tile_k", "sp", [-1, 1, 1]]]}, "result": [[22.00344556925], 0, 136.70153641700745, 1637561011.4061463], "version": 0.2, "tvm_version": "0.8.dev0"}
{"input": ["cuda -keys=cuda,gpu -max_num_threads=1024 -thread_warp_size=32", "dense_large_batch.gpu", [["TENSOR", [65536, 30522], "float32"], ["TENSOR", [1024, 30522], "float32"]], {}], "config": {"index": 278108, "code_hash": null, "entity": [["tile_x", "sp", [-1, 32, 1, 1]], ["tile_y", "sp", [-1, 2, 1, 1]], ["tile_k", "sp", [-1, 2, 1]]]}, "result": [[28.530196263], 0, 169.81496214866638, 1637561180.8585188], "version": 0.2, "tvm_version": "0.8.dev0"}
{"input": ["cuda -keys=cuda,gpu -max_num_threads=1024 -thread_warp_size=32", "dense_large_batch.gpu", [["TENSOR", [65536, 30522], "float32"], ["TENSOR", [1024, 30522], "float32"]], {}], "config": {"index": 2334325, "code_hash": null, "entity": [["tile_x", "sp", [-1, 16, 1, 1]], ["tile_y", "sp", [-1, 1, 1, 4]], ["tile_k", "sp", [-1, 1, 2]]]}, "result": [[17.926141638500003], 0, 116.47835206985474, 1637561297.023475], "version": 0.2, "tvm_version": "0.8.dev0"}
{"input": ["cuda -keys=cuda,gpu -max_num_threads=1024 -thread_warp_size=32", "dense_large_batch.gpu", [["TENSOR", [65536, 30522], "float32"], ["TENSOR", [1024, 30522], "float32"]], {}], "config": {"index": 161826, "code_hash": null, "entity": [["tile_x", "sp", [-1, 8, 1, 1]], ["tile_y", "sp", [-1, 2, 1, 8]], ["tile_k", "sp", [-1, 1, 1]]]}, "result": [[13.394404976], 0, 95.97315335273743, 1637561392.6320262], "version": 0.2, "tvm_version": "0.8.dev0"}
{"input": ["cuda -keys=cuda,gpu -max_num_threads=1024 -thread_warp_size=32", "dense_large_batch.gpu", [["TENSOR", [65536, 30522], "float32"], ["TENSOR", [1024, 30522], "float32"]], {}], "config": {"index": 65895, "code_hash": null, "entity": [["tile_x", "sp", [-1, 8, 1, 1]], ["tile_y", "sp", [-1, 4, 1, 2]], ["tile_k", "sp", [-1, 1, 1]]]}, "result": [[14.089272618999999], 0, 99.47786784172058, 1637561532.921475], "version": 0.2, "tvm_version": "0.8.dev0"}
{"input": ["cuda -keys=cuda,gpu -max_num_threads=1024 -thread_warp_size=32", "dense_large_batch.gpu", [["TENSOR", [65536, 30522], "float32"], ["TENSOR", [1024, 30522], "float32"]], {}], "config": {"index": 2094, "code_hash": null, "entity": [["tile_x", "sp", [-1, 8, 1, 2]], ["tile_y", "sp", [-1, 4, 1, 1]], ["tile_k", "sp", [-1, 1, 1]]]}, "result": [[17.3726621635], 0, 116.29866194725037, 1637561648.9841895], "version": 0.2, "tvm_version": "0.8.dev0"}
{"input": ["cuda -keys=cuda,gpu -max_num_threads=1024 -thread_warp_size=32", "dense_large_batch.gpu", [["TENSOR", [65536, 30522], "float32"], ["TENSOR", [1024, 30522], "float32"]], {}], "config": {"index": 2910, "code_hash": null, "entity": [["tile_x", "sp", [-1, 8, 1, 1]], ["tile_y", "sp", [-1, 8, 1, 1]], ["tile_k", "sp", [-1, 1, 1]]]}, "result": [[14.134504508], 0, 97.87620449066162, 1637561746.6227002], "version": 0.2, "tvm_version": "0.8.dev0"}
{"input": ["cuda -keys=cuda,gpu -max_num_threads=1024 -thread_warp_size=32", "dense_large_batch.gpu", [["TENSOR", [65536, 30522], "float32"], ["TENSOR", [1024, 30522], "float32"]], {}], "config": {"index": 2219166, "code_hash": null, "entity": [["tile_x", "sp", [-1, 8, 1, 2]], ["tile_y", "sp", [-1, 4, 1, 1]], ["tile_k", "sp", [-1, 1, 2]]]}, "result": [[17.7821530285], 0, 117.74976253509521, 1637561864.1412709], "version": 0.2, "tvm_version": "0.8.dev0"}
{"input": ["cuda -keys=cuda,gpu -max_num_threads=1024 -thread_warp_size=32", "dense_large_batch.gpu", [["TENSOR", [65536, 30522], "float32"], ["TENSOR", [1024, 30522], "float32"]], {}], "config": {"index": 160857, "code_hash": null, "entity": [["tile_x", "sp", [-1, 8, 1, 1]], ["tile_y", "sp", [-1, 1, 1, 8]], ["tile_k", "sp", [-1, 1, 1]]]}, "result": [[13.958860593999999], 0, 96.7862458229065, 1637561960.7551491], "version": 0.2, "tvm_version": "0.8.dev0"}
{"input": ["cuda -keys=cuda,gpu -max_num_threads=1024 -thread_warp_size=32", "dense_large_batch.gpu", [["TENSOR", [65536, 30522], "float32"], ["TENSOR", [1024, 30522], "float32"]], {}], "config": {"index": 2219167, "code_hash": null, "entity": [["tile_x", "sp", [-1, 16, 1, 2]], ["tile_y", "sp", [-1, 4, 1, 1]], ["tile_k", "sp", [-1, 1, 2]]]}, "result": [[17.938602264500002], 0, 118.84938645362854, 1637562079.352346], "version": 0.2, "tvm_version": "0.8.dev0"}
{"input": ["cuda -keys=cuda,gpu -max_num_threads=1024 -thread_warp_size=32", "dense_large_batch.gpu", [["TENSOR", [65536, 30522], "float32"], ["TENSOR", [1024, 30522], "float32"]], {}], "config": {"index": 394387, "code_hash": null, "entity": [["tile_x", "sp", [-1, 16, 1, 1]], ["tile_y", "sp", [-1, 1, 1, 4]], ["tile_k", "sp", [-1, 2, 1]]]}, "result": [[17.90777759825], 0, 117.50421690940857, 1637562196.665158], "version": 0.2, "tvm_version": "0.8.dev0"}
{"input": ["cuda -keys=cuda,gpu -max_num_threads=1024 -thread_warp_size=32", "dense_large_batch.gpu", [["TENSOR", [65536, 30522], "float32"], ["TENSOR", [1024, 30522], "float32"]], {}], "config": {"index": 66048, "code_hash": null, "entity": [["tile_x", "sp", [-1, 8, 1, 2]], ["tile_y", "sp", [-1, 4, 1, 2]], ["tile_k", "sp", [-1, 1, 1]]]}, "result": [[12.9132289365], 0, 93.36015367507935, 1637562289.7645102], "version": 0.2, "tvm_version": "0.8.dev0"}
{"input": ["cuda -keys=cuda,gpu -max_num_threads=1024 -thread_warp_size=32", "dense_large_batch.gpu", [["TENSOR", [65536, 30522], "float32"], ["TENSOR", [1024, 30522], "float32"]], {}], "config": {"index": 118220, "code_hash": null, "entity": [["tile_x", "sp", [-1, 4, 1, 1]], ["tile_y", "sp", [-1, 2, 1, 4]], ["tile_k", "sp", [-1, 1, 1]]]}, "result": [[30.11029999825], 0, 168.41284489631653, 1637562458.0474734], "version": 0.2, "tvm_version": "0.8.dev0"}
{"input": ["cuda -keys=cuda,gpu -max_num_threads=1024 -thread_warp_size=32", "dense_large_batch.gpu", [["TENSOR", [65536, 30522], "float32"], ["TENSOR", [1024, 30522], "float32"]], {}], "config": {"index": 342060, "code_hash": null, "entity": [["tile_x", "sp", [-1, 8, 1, 1]], ["tile_y", "sp", [-1, 2, 1, 2]], ["tile_k", "sp", [-1, 2, 1]]]}, "result": [[27.5011339685], 0, 195.75812888145447, 1637562653.5871885], "version": 0.2, "tvm_version": "0.8.dev0"}
{"input": ["cuda -keys=cuda,gpu -max_num_threads=1024 -thread_warp_size=32", "dense_large_batch.gpu", [["TENSOR", [65536, 30522], "float32"], ["TENSOR", [1024, 30522], "float32"]], {}], "config": {"index": 161825, "code_hash": null, "entity": [["tile_x", "sp", [-1, 4, 1, 1]], ["tile_y", "sp", [-1, 2, 1, 8]], ["tile_k", "sp", [-1, 1, 1]]]}, "result": [[24.91422907125], 0, 160.7819962501526, 1637562814.2259903], "version": 0.2, "tvm_version": "0.8.dev0"}
{"input": ["cuda -keys=cuda,gpu -max_num_threads=1024 -thread_warp_size=32", "dense_large_batch.gpu", [["TENSOR", [65536, 30522], "float32"], ["TENSOR", [1024, 30522], "float32"]], {}], "config": {"index": 343029, "code_hash": null, "entity": [["tile_x", "sp", [-1, 8, 1, 1]], ["tile_y", "sp", [-1, 4, 1, 2]], ["tile_k", "sp", [-1, 2, 1]]]}, "result": [[19.876348051249998], 0, 122.28617286682129, 1637562936.3168955], "version": 0.2, "tvm_version": "0.8.dev0"}
{"input": ["cuda -keys=cuda,gpu -max_num_threads=1024 -thread_warp_size=32", "dense_large_batch.gpu", [["TENSOR", [65536, 30522], "float32"], ["TENSOR", [1024, 30522], "float32"]], {}], "config": {"index": 2909, "code_hash": null, "entity": [["tile_x", "sp", [-1, 4, 1, 1]], ["tile_y", "sp", [-1, 8, 1, 1]], ["tile_k", "sp", [-1, 1, 1]]]}, "result": [[30.233760199749998], 0, 184.27468276023865, 1637563120.451939], "version": 0.2, "tvm_version": "0.8.dev0"}
{"input": ["cuda -keys=cuda,gpu -max_num_threads=1024 -thread_warp_size=32", "dense_large_batch.gpu", [["TENSOR", [65536, 30522], "float32"], ["TENSOR", [1024, 30522], "float32"]], {}], "config": {"index": 280045, "code_hash": null, "entity": [["tile_x", "sp", [-1, 16, 1, 1]], ["tile_y", "sp", [-1, 8, 1, 1]], ["tile_k", "sp", [-1, 2, 1]]]}, "result": [[17.75384325675], 0, 154.38971829414368, 1637563274.6528823], "version": 0.2, "tvm_version": "0.8.dev0"}
{"input": ["cuda -keys=cuda,gpu -max_num_threads=1024 -thread_warp_size=32", "dense_large_batch.gpu", [["TENSOR", [65536, 30522], "float32"], ["TENSOR", [1024, 30522], "float32"]], {}], "config": {"index": 279229, "code_hash": null, "entity": [["tile_x", "sp", [-1, 16, 1, 2]], ["tile_y", "sp", [-1, 4, 1, 1]], ["tile_k", "sp", [-1, 2, 1]]]}, "result": [[20.95830996825], 0, 130.53177189826965, 1637563404.8294082], "version": 0.2, "tvm_version": "0.8.dev0"}
{"input": ["cuda -keys=cuda,gpu -max_num_threads=1024 -thread_warp_size=32", "dense_large_batch.gpu", [["TENSOR", [65536, 30522], "float32"], ["TENSOR", [1024, 30522], "float32"]], {}], "config": {"index": 2282968, "code_hash": null, "entity": [["tile_x", "sp", [-1, 16, 1, 1]], ["tile_y", "sp", [-1, 4, 1, 2]], ["tile_k", "sp", [-1, 1, 2]]]}, "result": [[25.3345461225], 0, 148.4495244026184, 1637563553.4994025], "version": 0.2, "tvm_version": "0.8.dev0"}
{"input": ["cuda -keys=cuda,gpu -max_num_threads=1024 -thread_warp_size=32", "dense_large_batch.gpu", [["TENSOR", [65536, 30522], "float32"], ["TENSOR", [1024, 30522], "float32"]], {}], "config": {"index": 395356, "code_hash": null, "entity": [["tile_x", "sp", [-1, 16, 1, 1]], ["tile_y", "sp", [-1, 2, 1, 4]], ["tile_k", "sp", [-1, 2, 1]]]}, "result": [[18.41190019425], 0, 128.38377451896667, 1637563681.6054416], "version": 0.2, "tvm_version": "0.8.dev0"}
{"input": ["cuda -keys=cuda,gpu -max_num_threads=1024 -thread_warp_size=32", "dense_large_batch.gpu", [["TENSOR", [65536, 30522], "float32"], ["TENSOR", [1024, 30522], "float32"]], {}], "config": {"index": 119190, "code_hash": null, "entity": [["tile_x", "sp", [-1, 8, 1, 1]], ["tile_y", "sp", [-1, 4, 1, 4]], ["tile_k", "sp", [-1, 1, 1]]]}, "result": [[16.76630473475], 0, 146.64962482452393, 1637563828.0401878], "version": 0.2, "tvm_version": "0.8.dev0"}
{"input": ["cuda -keys=cuda,gpu -max_num_threads=1024 -thread_warp_size=32", "dense_large_batch.gpu", [["TENSOR", [65536, 30522], "float32"], ["TENSOR", [1024, 30522], "float32"]], {}], "config": {"index": 343030, "code_hash": null, "entity": [["tile_x", "sp", [-1, 16, 1, 1]], ["tile_y", "sp", [-1, 4, 1, 2]], ["tile_k", "sp", [-1, 2, 1]]]}, "result": [[29.826621866], 0, 191.55491852760315, 1637564019.3533516], "version": 0.2, "tvm_version": "0.8.dev0"}
{"input": ["cuda -keys=cuda,gpu -max_num_threads=1024 -thread_warp_size=32", "dense_large_batch.gpu", [["TENSOR", [65536, 30522], "float32"], ["TENSOR", [1024, 30522], "float32"]], {}], "config": {"index": 279075, "code_hash": null, "entity": [["tile_x", "sp", [-1, 8, 1, 1]], ["tile_y", "sp", [-1, 4, 1, 1]], ["tile_k", "sp", [-1, 2, 1]]]}, "result": [[30.502155230249997], 0, 187.03758025169373, 1637564206.1381972], "version": 0.2, "tvm_version": "0.8.dev0"}
{"input": ["cuda -keys=cuda,gpu -max_num_threads=1024 -thread_warp_size=32", "dense_large_batch.gpu", [["TENSOR", [65536, 30522], "float32"], ["TENSOR", [1024, 30522], "float32"]], {}], "config": {"index": 279228, "code_hash": null, "entity": [["tile_x", "sp", [-1, 8, 1, 2]], ["tile_y", "sp", [-1, 4, 1, 1]], ["tile_k", "sp", [-1, 2, 1]]]}, "result": [[17.7773861265], 0, 147.12288069725037, 1637564353.0247202], "version": 0.2, "tvm_version": "0.8.dev0"}
{"input": ["cuda -keys=cuda,gpu -max_num_threads=1024 -thread_warp_size=32", "dense_large_batch.gpu", [["TENSOR", [65536, 30522], "float32"], ["TENSOR", [1024, 30522], "float32"]], {}], "config": {"index": 2219301, "code_hash": null, "entity": [["tile_x", "sp", [-1, 4, 1, 4]], ["tile_y", "sp", [-1, 4, 1, 1]], ["tile_k", "sp", [-1, 1, 2]]]}, "result": [[17.78747760325], 0, 145.71209478378296, 1637564500.0387344], "version": 0.2, "tvm_version": "0.8.dev0"}
{"input": ["cuda -keys=cuda,gpu -max_num_threads=1024 -thread_warp_size=32", "dense_large_batch.gpu", [["TENSOR", [65536, 30522], "float32"], ["TENSOR", [1024, 30522], "float32"]], {}], "config": {"index": 555241, "code_hash": null, "entity": [["tile_x", "sp", [-1, 16, 1, 1]], ["tile_y", "sp", [-1, 2, 1, 1]], ["tile_k", "sp", [-1, 3, 1]]]}, "result": [[33.89910428975], 0, 190.83299851417542, 1637564890.6934335], "version": 0.2, "tvm_version": "0.8.dev0"}
{"input": ["cuda -keys=cuda,gpu -max_num_threads=1024 -thread_warp_size=32", "dense_large_batch.gpu", [["TENSOR", [65536, 30522], "float32"], ["TENSOR", [1024, 30522], "float32"]], {}], "config": {"index": 555242, "code_hash": null, "entity": [["tile_x", "sp", [-1, 32, 1, 1]], ["tile_y", "sp", [-1, 2, 1, 1]], ["tile_k", "sp", [-1, 3, 1]]]}, "result": [[34.0056774735], 0, 198.8035533428192, 1637565292.139196], "version": 0.2, "tvm_version": "0.8.dev0"}
{"input": ["cuda -keys=cuda,gpu -max_num_threads=1024 -thread_warp_size=32", "dense_large_batch.gpu", [["TENSOR", [65536, 30522], "float32"], ["TENSOR", [1024, 30522], "float32"]], {}], "config": {"index": 394386, "code_hash": null, "entity": [["tile_x", "sp", [-1, 8, 1, 1]], ["tile_y", "sp", [-1, 1, 1, 4]], ["tile_k", "sp", [-1, 2, 1]]]}, "result": [[25.82146957275], 0, 167.65811729431152, 1637566094.8140776], "version": 0.2, "tvm_version": "0.8.dev0"}
{"input": ["cuda -keys=cuda,gpu -max_num_threads=1024 -thread_warp_size=32", "dense_large_batch.gpu", [["TENSOR", [65536, 30522], "float32"], ["TENSOR", [1024, 30522], "float32"]], {}], "config": {"index": 3063, "code_hash": null, "entity": [["tile_x", "sp", [-1, 8, 1, 2]], ["tile_y", "sp", [-1, 8, 1, 1]], ["tile_k", "sp", [-1, 1, 1]]]}, "result": [[16.015467983], 0, 154.82795763015747, 1637566483.3933625], "version": 0.2, "tvm_version": "0.8.dev0"}
{"input": ["cuda -keys=cuda,gpu -max_num_threads=1024 -thread_warp_size=32", "dense_large_batch.gpu", [["TENSOR", [65536, 30522], "float32"], ["TENSOR", [1024, 30522], "float32"]], {}], "config": {"index": 117252, "code_hash": null, "entity": [["tile_x", "sp", [-1, 8, 1, 1]], ["tile_y", "sp", [-1, 1, 1, 4]], ["tile_k", "sp", [-1, 1, 1]]]}, "result": [[21.69183149275], 0, 148.38495802879333, 1637567122.4230971], "version": 0.2, "tvm_version": "0.8.dev0"}
{"input": ["cuda -keys=cuda,gpu -max_num_threads=1024 -thread_warp_size=32", "dense_large_batch.gpu", [["TENSOR", [65536, 30522], "float32"], ["TENSOR", [1024, 30522], "float32"]], {}], "config": {"index": 2335294, "code_hash": null, "entity": [["tile_x", "sp", [-1, 16, 1, 1]], ["tile_y", "sp", [-1, 2, 1, 4]], ["tile_k", "sp", [-1, 1, 2]]]}, "result": [[14.146281246500001], 0, 146.9247488975525, 1637567268.7257662], "version": 0.2, "tvm_version": "0.8.dev0"}
{"input": ["cuda -keys=cuda,gpu -max_num_threads=1024 -thread_warp_size=32", "dense_large_batch.gpu", [["TENSOR", [65536, 30522], "float32"], ["TENSOR", [1024, 30522], "float32"]], {}], "config": {"index": 3198, "code_hash": null, "entity": [["tile_x", "sp", [-1, 4, 1, 4]], ["tile_y", "sp", [-1, 8, 1, 1]], ["tile_k", "sp", [-1, 1, 1]]]}, "result": [[13.350570198249999], 0, 191.09138298034668, 1637567459.1182199], "version": 0.2, "tvm_version": "0.8.dev0"}
{"input": ["cuda -keys=cuda,gpu -max_num_threads=1024 -thread_warp_size=32", "dense_large_batch.gpu", [["TENSOR", [65536, 30522], "float32"], ["TENSOR", [1024, 30522], "float32"]], {}], "config": {"index": 556210, "code_hash": null, "entity": [["tile_x", "sp", [-1, 16, 1, 1]], ["tile_y", "sp", [-1, 4, 1, 1]], ["tile_k", "sp", [-1, 3, 1]]]}, "result": [[15.126491371], 0, 133.32226634025574, 1637567592.0383658], "version": 0.2, "tvm_version": "0.8.dev0"}
{"input": ["cuda -keys=cuda,gpu -max_num_threads=1024 -thread_warp_size=32", "dense_large_batch.gpu", [["TENSOR", [65536, 30522], "float32"], ["TENSOR", [1024, 30522], "float32"]], {}], "config": {"index": 2219302, "code_hash": null, "entity": [["tile_x", "sp", [-1, 8, 1, 4]], ["tile_y", "sp", [-1, 4, 1, 1]], ["tile_k", "sp", [-1, 1, 2]]]}, "result": [[25.58397224675], 0, 148.0998260974884, 1637567943.338784], "version": 0.2, "tvm_version": "0.8.dev0"}
{"input": ["cuda -keys=cuda,gpu -max_num_threads=1024 -thread_warp_size=32", "dense_large_batch.gpu", [["TENSOR", [65536, 30522], "float32"], ["TENSOR", [1024, 30522], "float32"]], {}], "config": {"index": 118374, "code_hash": null, "entity": [["tile_x", "sp", [-1, 8, 1, 2]], ["tile_y", "sp", [-1, 2, 1, 4]], ["tile_k", "sp", [-1, 1, 1]]]}, "result": [[16.0744168], 0, 130.07086563110352, 1637568139.2949216], "version": 0.2, "tvm_version": "0.8.dev0"}
{"input": ["cuda -keys=cuda,gpu -max_num_threads=1024 -thread_warp_size=32", "dense_large_batch.gpu", [["TENSOR", [65536, 30522], "float32"], ["TENSOR", [1024, 30522], "float32"]], {}], "config": {"index": 195741, "code_hash": null, "entity": [["tile_x", "sp", [-1, 8, 1, 1]], ["tile_y", "sp", [-1, 1, 1, 16]], ["tile_k", "sp", [-1, 1, 1]]]}, "result": [[13.634405307749999], 0, 98.12968707084656, 1637568237.1482544], "version": 0.2, "tvm_version": "0.8.dev0"}
{"input": ["cuda -keys=cuda,gpu -max_num_threads=1024 -thread_warp_size=32", "dense_large_batch.gpu", [["TENSOR", [65536, 30522], "float32"], ["TENSOR", [1024, 30522], "float32"]], {}], "config": {"index": 619195, "code_hash": null, "entity": [["tile_x", "sp", [-1, 16, 1, 1]], ["tile_y", "sp", [-1, 2, 1, 2]], ["tile_k", "sp", [-1, 3, 1]]]}, "result": [[15.28731231025], 0, 136.16174340248108, 1637568373.658681], "version": 0.2, "tvm_version": "0.8.dev0"}
{"input": ["cuda -keys=cuda,gpu -max_num_threads=1024 -thread_warp_size=32", "dense_large_batch.gpu", [["TENSOR", [65536, 30522], "float32"], ["TENSOR", [1024, 30522], "float32"]], {}], "config": {"index": 619196, "code_hash": null, "entity": [["tile_x", "sp", [-1, 32, 1, 1]], ["tile_y", "sp", [-1, 2, 1, 2]], ["tile_k", "sp", [-1, 3, 1]]]}, "result": [[21.1471662495], 0, 191.06462240219116, 1637568564.2973068], "version": 0.2, "tvm_version": "0.8.dev0"}
{"input": ["cuda -keys=cuda,gpu -max_num_threads=1024 -thread_warp_size=32", "dense_large_batch.gpu", [["TENSOR", [65536, 30522], "float32"], ["TENSOR", [1024, 30522], "float32"]], {}], "config": {"index": 2282152, "code_hash": null, "entity": [["tile_x", "sp", [-1, 16, 1, 2]], ["tile_y", "sp", [-1, 2, 1, 2]], ["tile_k", "sp", [-1, 1, 2]]]}, "result": [[17.777816827], 0, 128.32520818710327, 1637568692.3313267], "version": 0.2, "tvm_version": "0.8.dev0"}
{"input": ["cuda -keys=cuda,gpu -max_num_threads=1024 -thread_warp_size=32", "dense_large_batch.gpu", [["TENSOR", [65536, 30522], "float32"], ["TENSOR", [1024, 30522], "float32"]], {}], "config": {"index": 342213, "code_hash": null, "entity": [["tile_x", "sp", [-1, 8, 1, 2]], ["tile_y", "sp", [-1, 2, 1, 2]], ["tile_k", "sp", [-1, 2, 1]]]}, "result": [[21.259499387749997], 0, 185.60343956947327, 1637568877.5536141], "version": 0.2, "tvm_version": "0.8.dev0"}
{"input": ["cuda -keys=cuda,gpu -max_num_threads=1024 -thread_warp_size=32", "dense_large_batch.gpu", [["TENSOR", [65536, 30522], "float32"], ["TENSOR", [1024, 30522], "float32"]], {}], "config": {"index": 161010, "code_hash": null, "entity": [["tile_x", "sp", [-1, 8, 1, 2]], ["tile_y", "sp", [-1, 1, 1, 8]], ["tile_k", "sp", [-1, 1, 1]]]}, "result": [[15.6883391345], 0, 127.63781547546387, 1637569004.8651628], "version": 0.2, "tvm_version": "0.8.dev0"}
{"input": ["cuda -keys=cuda,gpu -max_num_threads=1024 -thread_warp_size=32", "dense_large_batch.gpu", [["TENSOR", [65536, 30522], "float32"], ["TENSOR", [1024, 30522], "float32"]], {}], "config": {"index": 342214, "code_hash": null, "entity": [["tile_x", "sp", [-1, 16, 1, 2]], ["tile_y", "sp", [-1, 2, 1, 2]], ["tile_k", "sp", [-1, 2, 1]]]}, "result": [[17.74954734125], 0, 177.94225120544434, 1637569182.8593524], "version": 0.2, "tvm_version": "0.8.dev0"}
{"input": ["cuda -keys=cuda,gpu -max_num_threads=1024 -thread_warp_size=32", "dense_large_batch.gpu", [["TENSOR", [65536, 30522], "float32"], ["TENSOR", [1024, 30522], "float32"]], {}], "config": {"index": 117405, "code_hash": null, "entity": [["tile_x", "sp", [-1, 8, 1, 2]], ["tile_y", "sp", [-1, 1, 1, 4]], ["tile_k", "sp", [-1, 1, 1]]]}, "result": [[31.68710770575], 0, 173.32861471176147, 1637569355.923333], "version": 0.2, "tvm_version": "0.8.dev0"}
{"input": ["cuda -keys=cuda,gpu -max_num_threads=1024 -thread_warp_size=32", "dense_large_batch.gpu", [["TENSOR", [65536, 30522], "float32"], ["TENSOR", [1024, 30522], "float32"]], {}], "config": {"index": 556211, "code_hash": null, "entity": [["tile_x", "sp", [-1, 32, 1, 1]], ["tile_y", "sp", [-1, 4, 1, 1]], ["tile_k", "sp", [-1, 3, 1]]]}, "result": [[15.970495693], 0, 122.72282552719116, 1637569694.447828], "version": 0.2, "tvm_version": "0.8.dev0"}
{"input": ["cuda -keys=cuda,gpu -max_num_threads=1024 -thread_warp_size=32", "dense_large_batch.gpu", [["TENSOR", [65536, 30522], "float32"], ["TENSOR", [1024, 30522], "float32"]], {}], "config": {"index": 66047, "code_hash": null, "entity": [["tile_x", "sp", [-1, 4, 1, 2]], ["tile_y", "sp", [-1, 4, 1, 2]], ["tile_k", "sp", [-1, 1, 1]]]}, "result": [[21.91940195425], 0, 200.79413390159607, 1637570098.6886153], "version": 0.2, "tvm_version": "0.8.dev0"}
{"input": ["cuda -keys=cuda,gpu -max_num_threads=1024 -thread_warp_size=32", "dense_large_batch.gpu", [["TENSOR", [65536, 30522], "float32"], ["TENSOR", [1024, 30522], "float32"]], {}], "config": {"index": 2229, "code_hash": null, "entity": [["tile_x", "sp", [-1, 4, 1, 4]], ["tile_y", "sp", [-1, 4, 1, 1]], ["tile_k", "sp", [-1, 1, 1]]]}, "result": [[17.568591836750002], 0, 135.82639575004578, 1637570235.9461017], "version": 0.2, "tvm_version": "0.8.dev0"}
{"input": ["cuda -keys=cuda,gpu -max_num_threads=1024 -thread_warp_size=32", "dense_large_batch.gpu", [["TENSOR", [65536, 30522], "float32"], ["TENSOR", [1024, 30522], "float32"]], {}], "config": {"index": 66864, "code_hash": null, "entity": [["tile_x", "sp", [-1, 8, 1, 1]], ["tile_y", "sp", [-1, 8, 1, 2]], ["tile_k", "sp", [-1, 1, 1]]]}, "result": [[21.817912513499998], 0, 199.57456040382385, 1637570435.6004338], "version": 0.2, "tvm_version": "0.8.dev0"}
{"input": ["cuda -keys=cuda,gpu -max_num_threads=1024 -thread_warp_size=32", "dense_large_batch.gpu", [["TENSOR", [65536, 30522], "float32"], ["TENSOR", [1024, 30522], "float32"]], {}], "config": {"index": 394539, "code_hash": null, "entity": [["tile_x", "sp", [-1, 8, 1, 2]], ["tile_y", "sp", [-1, 1, 1, 4]], ["tile_k", "sp", [-1, 2, 1]]]}, "result": [[17.6902155565], 0, 147.83379101753235, 1637570583.217356], "version": 0.2, "tvm_version": "0.8.dev0"}
{"input": ["cuda -keys=cuda,gpu -max_num_threads=1024 -thread_warp_size=32", "dense_large_batch.gpu", [["TENSOR", [65536, 30522], "float32"], ["TENSOR", [1024, 30522], "float32"]], {}], "config": {"index": 3062, "code_hash": null, "entity": [["tile_x", "sp", [-1, 4, 1, 2]], ["tile_y", "sp", [-1, 8, 1, 1]], ["tile_k", "sp", [-1, 1, 1]]]}, "result": [[18.09741239975], 0, 147.70350241661072, 1637570974.688305], "version": 0.2, "tvm_version": "0.8.dev0"}
{"input": ["cuda -keys=cuda,gpu -max_num_threads=1024 -thread_warp_size=32", "dense_large_batch.gpu", [["TENSOR", [65536, 30522], "float32"], ["TENSOR", [1024, 30522], "float32"]], {}], "config": {"index": 66183, "code_hash": null, "entity": [["tile_x", "sp", [-1, 4, 1, 4]], ["tile_y", "sp", [-1, 4, 1, 2]], ["tile_k", "sp", [-1, 1, 1]]]}, "result": [[21.11948413775], 0, 126.46587753295898, 1637571100.894958], "version": 0.2, "tvm_version": "0.8.dev0"}
{"input": ["cuda -keys=cuda,gpu -max_num_threads=1024 -thread_warp_size=32", "dense_large_batch.gpu", [["TENSOR", [65536, 30522], "float32"], ["TENSOR", [1024, 30522], "float32"]], {}], "config": {"index": 671521, "code_hash": null, "entity": [["tile_x", "sp", [-1, 16, 1, 1]], ["tile_y", "sp", [-1, 1, 1, 4]], ["tile_k", "sp", [-1, 3, 1]]]}, "result": [[18.26063310825], 0, 151.64760661125183, 1637571252.1515136], "version": 0.2, "tvm_version": "0.8.dev0"}
{"input": ["cuda -keys=cuda,gpu -max_num_threads=1024 -thread_warp_size=32", "dense_large_batch.gpu", [["TENSOR", [65536, 30522], "float32"], ["TENSOR", [1024, 30522], "float32"]], {}], "config": {"index": 279364, "code_hash": null, "entity": [["tile_x", "sp", [-1, 8, 1, 4]], ["tile_y", "sp", [-1, 4, 1, 1]], ["tile_k", "sp", [-1, 2, 1]]]}, "result": [[30.4126740865], 0, 167.5748119354248, 1637571419.3350403], "version": 0.2, "tvm_version": "0.8.dev0"}
{"input": ["cuda -keys=cuda,gpu -max_num_threads=1024 -thread_warp_size=32", "dense_large_batch.gpu", [["TENSOR", [65536, 30522], "float32"], ["TENSOR", [1024, 30522], "float32"]], {}], "config": {"index": 556363, "code_hash": null, "entity": [["tile_x", "sp", [-1, 16, 1, 2]], ["tile_y", "sp", [-1, 4, 1, 1]], ["tile_k", "sp", [-1, 3, 1]]]}, "result": [[24.334950526500002], 0, 168.55177402496338, 1637571587.5055783], "version": 0.2, "tvm_version": "0.8.dev0"}
{"input": ["cuda -keys=cuda,gpu -max_num_threads=1024 -thread_warp_size=32", "dense_large_batch.gpu", [["TENSOR", [65536, 30522], "float32"], ["TENSOR", [1024, 30522], "float32"]], {}], "config": {"index": 556209, "code_hash": null, "entity": [["tile_x", "sp", [-1, 8, 1, 1]], ["tile_y", "sp", [-1, 4, 1, 1]], ["tile_k", "sp", [-1, 3, 1]]]}, "result": [[18.77299446975], 0, 120.14922785758972, 1637571707.4348826], "version": 0.2, "tvm_version": "0.8.dev0"}
{"input": ["cuda -keys=cuda,gpu -max_num_threads=1024 -thread_warp_size=32", "dense_large_batch.gpu", [["TENSOR", [65536, 30522], "float32"], ["TENSOR", [1024, 30522], "float32"]], {}], "config": {"index": 3197, "code_hash": null, "entity": [["tile_x", "sp", [-1, 2, 1, 4]], ["tile_y", "sp", [-1, 8, 1, 1]], ["tile_k", "sp", [-1, 1, 1]]]}, "result": [[15.4036607095], 0, 124.82000732421875, 1637571833.9993274], "version": 0.2, "tvm_version": "0.8.dev0"}
{"input": ["cuda -keys=cuda,gpu -max_num_threads=1024 -thread_warp_size=32", "dense_large_batch.gpu", [["TENSOR", [65536, 30522], "float32"], ["TENSOR", [1024, 30522], "float32"]], {}], "config": {"index": 279363, "code_hash": null, "entity": [["tile_x", "sp", [-1, 4, 1, 4]], ["tile_y", "sp", [-1, 4, 1, 1]], ["tile_k", "sp", [-1, 2, 1]]]}, "result": [[17.7742339845], 0, 130.35373520851135, 1637571963.9719656], "version": 0.2, "tvm_version": "0.8.dev0"}
{"input": ["cuda -keys=cuda,gpu -max_num_threads=1024 -thread_warp_size=32", "dense_large_batch.gpu", [["TENSOR", [65536, 30522], "float32"], ["TENSOR", [1024, 30522], "float32"]], {}], "config": {"index": 2334478, "code_hash": null, "entity": [["tile_x", "sp", [-1, 16, 1, 2]], ["tile_y", "sp", [-1, 1, 1, 4]], ["tile_k", "sp", [-1, 1, 2]]]}, "result": [[22.1105919325], 0, 155.948983669281, 1637572119.5444162], "version": 0.2, "tvm_version": "0.8.dev0"}
{"input": ["cuda -keys=cuda,gpu -max_num_threads=1024 -thread_warp_size=32", "dense_large_batch.gpu", [["TENSOR", [65536, 30522], "float32"], ["TENSOR", [1024, 30522], "float32"]], {}], "config": {"index": 3317, "code_hash": null, "entity": [["tile_x", "sp", [-1, 2, 1, 8]], ["tile_y", "sp", [-1, 8, 1, 1]], ["tile_k", "sp", [-1, 1, 1]]]}, "result": [[12.688822696499999], 0, 112.12700247764587, 1637572231.3546665], "version": 0.2, "tvm_version": "0.8.dev0"}
{"input": ["cuda -keys=cuda,gpu -max_num_threads=1024 -thread_warp_size=32", "dense_large_batch.gpu", [["TENSOR", [65536, 30522], "float32"], ["TENSOR", [1024, 30522], "float32"]], {}], "config": {"index": 619348, "code_hash": null, "entity": [["tile_x", "sp", [-1, 16, 1, 2]], ["tile_y", "sp", [-1, 2, 1, 2]], ["tile_k", "sp", [-1, 3, 1]]]}, "result": [[16.29691545675], 0, 134.39646410942078, 1637572365.3456907], "version": 0.2, "tvm_version": "0.8.dev0"}
{"input": ["cuda -keys=cuda,gpu -max_num_threads=1024 -thread_warp_size=32", "dense_large_batch.gpu", [["TENSOR", [65536, 30522], "float32"], ["TENSOR", [1024, 30522], "float32"]], {}], "config": {"index": 65080, "code_hash": null, "entity": [["tile_x", "sp", [-1, 16, 1, 2]], ["tile_y", "sp", [-1, 2, 1, 2]], ["tile_k", "sp", [-1, 1, 1]]]}, "result": [[27.32944488975], 0, 155.54234981536865, 1637572520.5336647], "version": 0.2, "tvm_version": "0.8.dev0"}
{"input": ["cuda -keys=cuda,gpu -max_num_threads=1024 -thread_warp_size=32", "dense_large_batch.gpu", [["TENSOR", [65536, 30522], "float32"], ["TENSOR", [1024, 30522], "float32"]], {}], "config": {"index": 117254, "code_hash": null, "entity": [["tile_x", "sp", [-1, 32, 1, 1]], ["tile_y", "sp", [-1, 1, 1, 4]], ["tile_k", "sp", [-1, 1, 1]]]}, "result": [[18.90274301375], 0, 130.88486433029175, 1637572651.077917], "version": 0.2, "tvm_version": "0.8.dev0"}
{"input": ["cuda -keys=cuda,gpu -max_num_threads=1024 -thread_warp_size=32", "dense_large_batch.gpu", [["TENSOR", [65536, 30522], "float32"], ["TENSOR", [1024, 30522], "float32"]], {}], "config": {"index": 618379, "code_hash": null, "entity": [["tile_x", "sp", [-1, 16, 1, 2]], ["tile_y", "sp", [-1, 1, 1, 2]], ["tile_k", "sp", [-1, 3, 1]]]}, "result": [[33.131392766], 0, 184.45662331581116, 1637573036.6832707], "version": 0.2, "tvm_version": "0.8.dev0"}
{"input": ["cuda -keys=cuda,gpu -max_num_threads=1024 -thread_warp_size=32", "dense_large_batch.gpu", [["TENSOR", [65536, 30522], "float32"], ["TENSOR", [1024, 30522], "float32"]], {}], "config": {"index": 119343, "code_hash": null, "entity": [["tile_x", "sp", [-1, 8, 1, 2]], ["tile_y", "sp", [-1, 4, 1, 4]], ["tile_k", "sp", [-1, 1, 1]]]}, "result": [[22.2668002965], 0, 138.91917061805725, 1637573175.203664], "version": 0.2, "tvm_version": "0.8.dev0"}
{"input": ["cuda -keys=cuda,gpu -max_num_threads=1024 -thread_warp_size=32", "dense_large_batch.gpu", [["TENSOR", [65536, 30522], "float32"], ["TENSOR", [1024, 30522], "float32"]], {}], "config": {"index": 64110, "code_hash": null, "entity": [["tile_x", "sp", [-1, 8, 1, 2]], ["tile_y", "sp", [-1, 1, 1, 2]], ["tile_k", "sp", [-1, 1, 1]]]}, "result": [[27.831604824499998], 0, 167.75737619400024, 1637573342.6179295], "version": 0.2, "tvm_version": "0.8.dev0"}
{"input": ["cuda -keys=cuda,gpu -max_num_threads=1024 -thread_warp_size=32", "dense_large_batch.gpu", [["TENSOR", [65536, 30522], "float32"], ["TENSOR", [1024, 30522], "float32"]], {}], "config": {"index": 126141, "code_hash": null, "entity": [["tile_x", "sp", [-1, 4, 2, 2]], ["tile_y", "sp", [-1, 1, 2, 4]], ["tile_k", "sp", [-1, 1, 1]]]}, "result": [[16.463116963], 0, 111.21255016326904, 1637573453.57901], "version": 0.2, "tvm_version": "0.8.dev0"}
{"input": ["cuda -keys=cuda,gpu -max_num_threads=1024 -thread_warp_size=32", "dense_large_batch.gpu", [["TENSOR", [65536, 30522], "float32"], ["TENSOR", [1024, 30522], "float32"]], {}], "config": {"index": 618378, "code_hash": null, "entity": [["tile_x", "sp", [-1, 8, 1, 2]], ["tile_y", "sp", [-1, 1, 1, 2]], ["tile_k", "sp", [-1, 3, 1]]]}, "result": [[25.224519321749998], 0, 153.21999597549438, 1637573606.4625], "version": 0.2, "tvm_version": "0.8.dev0"}
{"input": ["cuda -keys=cuda,gpu -max_num_threads=1024 -thread_warp_size=32", "dense_large_batch.gpu", [["TENSOR", [65536, 30522], "float32"], ["TENSOR", [1024, 30522], "float32"]], {}], "config": {"index": 118373, "code_hash": null, "entity": [["tile_x", "sp", [-1, 4, 1, 2]], ["tile_y", "sp", [-1, 2, 1, 4]], ["tile_k", "sp", [-1, 1, 1]]]}, "result": [[14.2089911845], 0, 99.32461166381836, 1637573705.4100628], "version": 0.2, "tvm_version": "0.8.dev0"}
{"input": ["cuda -keys=cuda,gpu -max_num_threads=1024 -thread_warp_size=32", "dense_large_batch.gpu", [["TENSOR", [65536, 30522], "float32"], ["TENSOR", [1024, 30522], "float32"]], {}], "config": {"index": 2350979, "code_hash": null, "entity": [["tile_x", "sp", [-1, 2, 4, 2]], ["tile_y", "sp", [-1, 1, 4, 4]], ["tile_k", "sp", [-1, 1, 2]]]}, "result": [[3.826404071], 0, 48.624804973602295, 1637573753.7361913], "version": 0.2, "tvm_version": "0.8.dev0"}
{"input": ["cuda -keys=cuda,gpu -max_num_threads=1024 -thread_warp_size=32", "dense_large_batch.gpu", [["TENSOR", [65536, 30522], "float32"], ["TENSOR", [1024, 30522], "float32"]], {}], "config": {"index": 2093, "code_hash": null, "entity": [["tile_x", "sp", [-1, 4, 1, 2]], ["tile_y", "sp", [-1, 4, 1, 1]], ["tile_k", "sp", [-1, 1, 1]]]}, "result": [[20.059705626], 0, 127.75732064247131, 1637574081.6493227], "version": 0.2, "tvm_version": "0.8.dev0"}
{"input": ["cuda -keys=cuda,gpu -max_num_threads=1024 -thread_warp_size=32", "dense_large_batch.gpu", [["TENSOR", [65536, 30522], "float32"], ["TENSOR", [1024, 30522], "float32"]], {}], "config": {"index": 2219983, "code_hash": null, "entity": [["tile_x", "sp", [-1, 16, 1, 1]], ["tile_y", "sp", [-1, 8, 1, 1]], ["tile_k", "sp", [-1, 1, 2]]]}, "result": [[17.734065000250002], 0, 118.4884524345398, 1637574199.6789944], "version": 0.2, "tvm_version": "0.8.dev0"}
{"input": ["cuda -keys=cuda,gpu -max_num_threads=1024 -thread_warp_size=32", "dense_large_batch.gpu", [["TENSOR", [65536, 30522], "float32"], ["TENSOR", [1024, 30522], "float32"]], {}], "config": {"index": 3318, "code_hash": null, "entity": [["tile_x", "sp", [-1, 4, 1, 8]], ["tile_y", "sp", [-1, 8, 1, 1]], ["tile_k", "sp", [-1, 1, 1]]]}, "result": [[26.6253787945], 0, 162.07772731781006, 1637574361.3059266], "version": 0.2, "tvm_version": "0.8.dev0"}
{"input": ["cuda -keys=cuda,gpu -max_num_threads=1024 -thread_warp_size=32", "dense_large_batch.gpu", [["TENSOR", [65536, 30522], "float32"], ["TENSOR", [1024, 30522], "float32"]], {}], "config": {"index": 342349, "code_hash": null, "entity": [["tile_x", "sp", [-1, 8, 1, 4]], ["tile_y", "sp", [-1, 2, 1, 2]], ["tile_k", "sp", [-1, 2, 1]]]}, "result": [[17.7842217725], 0, 120.04860544204712, 1637574480.9231176], "version": 0.2, "tvm_version": "0.8.dev0"}
{"input": ["cuda -keys=cuda,gpu -max_num_threads=1024 -thread_warp_size=32", "dense_large_batch.gpu", [["TENSOR", [65536, 30522], "float32"], ["TENSOR", [1024, 30522], "float32"]], {}], "config": {"index": 280044, "code_hash": null, "entity": [["tile_x", "sp", [-1, 8, 1, 1]], ["tile_y", "sp", [-1, 8, 1, 1]], ["tile_k", "sp", [-1, 2, 1]]]}, "result": [[15.3564025535], 0, 105.71763491630554, 1637574786.9045846], "version": 0.2, "tvm_version": "0.8.dev0"}
{"input": ["cuda -keys=cuda,gpu -max_num_threads=1024 -thread_warp_size=32", "dense_large_batch.gpu", [["TENSOR", [65536, 30522], "float32"], ["TENSOR", [1024, 30522], "float32"]], {}], "config": {"index": 619347, "code_hash": null, "entity": [["tile_x", "sp", [-1, 8, 1, 2]], ["tile_y", "sp", [-1, 2, 1, 2]], ["tile_k", "sp", [-1, 3, 1]]]}, "result": [[15.123366563], 0, 104.31875419616699, 1637574890.7871692], "version": 0.2, "tvm_version": "0.8.dev0"}
{"input": ["cuda -keys=cuda,gpu -max_num_threads=1024 -thread_warp_size=32", "dense_large_batch.gpu", [["TENSOR", [65536, 30522], "float32"], ["TENSOR", [1024, 30522], "float32"]], {}], "config": {"index": 66182, "code_hash": null, "entity": [["tile_x", "sp", [-1, 2, 1, 4]], ["tile_y", "sp", [-1, 4, 1, 2]], ["tile_k", "sp", [-1, 1, 1]]]}, "result": [[14.21586814775], 0, 109.8874409198761, 1637575034.7723832], "version": 0.2, "tvm_version": "0.8.dev0"}
{"input": ["cuda -keys=cuda,gpu -max_num_threads=1024 -thread_warp_size=32", "dense_large_batch.gpu", [["TENSOR", [65536, 30522], "float32"], ["TENSOR", [1024, 30522], "float32"]], {}], "config": {"index": 557179, "code_hash": null, "entity": [["tile_x", "sp", [-1, 16, 1, 1]], ["tile_y", "sp", [-1, 8, 1, 1]], ["tile_k", "sp", [-1, 3, 1]]]}, "result": [[12.5768628365], 0, 91.03140449523926, 1637575124.9372442], "version": 0.2, "tvm_version": "0.8.dev0"}
{"input": ["cuda -keys=cuda,gpu -max_num_threads=1024 -thread_warp_size=32", "dense_large_batch.gpu", [["TENSOR", [65536, 30522], "float32"], ["TENSOR", [1024, 30522], "float32"]], {}], "config": {"index": 119477, "code_hash": null, "entity": [["tile_x", "sp", [-1, 2, 1, 4]], ["tile_y", "sp", [-1, 4, 1, 4]], ["tile_k", "sp", [-1, 1, 1]]]}, "result": [[13.531833762], 0, 96.20228743553162, 1637575220.1984944], "version": 0.2, "tvm_version": "0.8.dev0"}
{"input": ["cuda -keys=cuda,gpu -max_num_threads=1024 -thread_warp_size=32", "dense_large_batch.gpu", [["TENSOR", [65536, 30522], "float32"], ["TENSOR", [1024, 30522], "float32"]], {}], "config": {"index": 557178, "code_hash": null, "entity": [["tile_x", "sp", [-1, 8, 1, 1]], ["tile_y", "sp", [-1, 8, 1, 1]], ["tile_k", "sp", [-1, 3, 1]]]}, "result": [[12.677218580749999], 0, 90.80723786354065, 1637575309.8580232], "version": 0.2, "tvm_version": "0.8.dev0"}
{"input": ["cuda -keys=cuda,gpu -max_num_threads=1024 -thread_warp_size=32", "dense_large_batch.gpu", [["TENSOR", [65536, 30522], "float32"], ["TENSOR", [1024, 30522], "float32"]], {}], "config": {"index": 118508, "code_hash": null, "entity": [["tile_x", "sp", [-1, 2, 1, 4]], ["tile_y", "sp", [-1, 2, 1, 4]], ["tile_k", "sp", [-1, 1, 1]]]}, "result": [[14.01178939125], 0, 98.39576315879822, 1637575407.4814737], "version": 0.2, "tvm_version": "0.8.dev0"}
{"input": ["cuda -keys=cuda,gpu -max_num_threads=1024 -thread_warp_size=32", "dense_large_batch.gpu", [["TENSOR", [65536, 30522], "float32"], ["TENSOR", [1024, 30522], "float32"]], {}], "config": {"index": 66302, "code_hash": null, "entity": [["tile_x", "sp", [-1, 2, 1, 8]], ["tile_y", "sp", [-1, 4, 1, 2]], ["tile_k", "sp", [-1, 1, 1]]]}, "result": [[12.86657312625], 0, 92.91050219535828, 1637575499.551539], "version": 0.2, "tvm_version": "0.8.dev0"}
{"input": ["cuda -keys=cuda,gpu -max_num_threads=1024 -thread_warp_size=32", "dense_large_batch.gpu", [["TENSOR", [65536, 30522], "float32"], ["TENSOR", [1024, 30522], "float32"]], {}], "config": {"index": 558147, "code_hash": null, "entity": [["tile_x", "sp", [-1, 8, 1, 1]], ["tile_y", "sp", [-1, 16, 1, 1]], ["tile_k", "sp", [-1, 3, 1]]]}, "result": [[11.82426300675], 0, 88.55207180976868, 1637575587.2188396], "version": 0.2, "tvm_version": "0.8.dev0"}
{"input": ["cuda -keys=cuda,gpu -max_num_threads=1024 -thread_warp_size=32", "dense_large_batch.gpu", [["TENSOR", [65536, 30522], "float32"], ["TENSOR", [1024, 30522], "float32"]], {}], "config": {"index": 67270, "code_hash": null, "entity": [["tile_x", "sp", [-1, 1, 1, 8]], ["tile_y", "sp", [-1, 8, 1, 2]], ["tile_k", "sp", [-1, 1, 1]]]}, "result": [[13.38861210975], 0, 96.15057587623596, 1637575682.5962467], "version": 0.2, "tvm_version": "0.8.dev0"}
{"input": ["cuda -keys=cuda,gpu -max_num_threads=1024 -thread_warp_size=32", "dense_large_batch.gpu", [["TENSOR", [65536, 30522], "float32"], ["TENSOR", [1024, 30522], "float32"]], {}], "config": {"index": 343316, "code_hash": null, "entity": [["tile_x", "sp", [-1, 2, 1, 4]], ["tile_y", "sp", [-1, 4, 1, 2]], ["tile_k", "sp", [-1, 2, 1]]]}, "result": [[14.121654774500001], 0, 100.5836534500122, 1637575782.3764892], "version": 0.2, "tvm_version": "0.8.dev0"}
{"input": ["cuda -keys=cuda,gpu -max_num_threads=1024 -thread_warp_size=32", "dense_large_batch.gpu", [["TENSOR", [65536, 30522], "float32"], ["TENSOR", [1024, 30522], "float32"]], {}], "config": {"index": 342467, "code_hash": null, "entity": [["tile_x", "sp", [-1, 2, 1, 8]], ["tile_y", "sp", [-1, 2, 1, 2]], ["tile_k", "sp", [-1, 2, 1]]]}, "result": [[17.704385407500002], 0, 116.59185791015625, 1637575898.2495341], "version": 0.2, "tvm_version": "0.8.dev0"}
{"input": ["cuda -keys=cuda,gpu -max_num_threads=1024 -thread_warp_size=32", "dense_large_batch.gpu", [["TENSOR", [65536, 30522], "float32"], ["TENSOR", [1024, 30522], "float32"]], {}], "config": {"index": 119342, "code_hash": null, "entity": [["tile_x", "sp", [-1, 4, 1, 2]], ["tile_y", "sp", [-1, 4, 1, 4]], ["tile_k", "sp", [-1, 1, 1]]]}, "result": [[13.646877677500001], 0, 95.88905906677246, 1637575993.5808277], "version": 0.2, "tvm_version": "0.8.dev0"}
{"input": ["cuda -keys=cuda,gpu -max_num_threads=1024 -thread_warp_size=32", "dense_large_batch.gpu", [["TENSOR", [65536, 30522], "float32"], ["TENSOR", [1024, 30522], "float32"]], {}], "config": {"index": 343436, "code_hash": null, "entity": [["tile_x", "sp", [-1, 2, 1, 8]], ["tile_y", "sp", [-1, 4, 1, 2]], ["tile_k", "sp", [-1, 2, 1]]]}, "result": [[13.98139003825], 0, 98.03727793693542, 1637576090.761227], "version": 0.2, "tvm_version": "0.8.dev0"}
{"input": ["cuda -keys=cuda,gpu -max_num_threads=1024 -thread_warp_size=32", "dense_large_batch.gpu", [["TENSOR", [65536, 30522], "float32"], ["TENSOR", [1024, 30522], "float32"]], {}], "config": {"index": 65213, "code_hash": null, "entity": [["tile_x", "sp", [-1, 2, 1, 4]], ["tile_y", "sp", [-1, 2, 1, 2]], ["tile_k", "sp", [-1, 1, 1]]]}, "result": [[20.198182370250002], 0, 129.89207410812378, 1637576219.8719625], "version": 0.2, "tvm_version": "0.8.dev0"}
{"input": ["cuda -keys=cuda,gpu -max_num_threads=1024 -thread_warp_size=32", "dense_large_batch.gpu", [["TENSOR", [65536, 30522], "float32"], ["TENSOR", [1024, 30522], "float32"]], {}], "config": {"index": 65333, "code_hash": null, "entity": [["tile_x", "sp", [-1, 2, 1, 8]], ["tile_y", "sp", [-1, 2, 1, 2]], ["tile_k", "sp", [-1, 1, 1]]]}, "result": [[17.496740944749998], 0, 116.96068477630615, 1637576335.9903343], "version": 0.2, "tvm_version": "0.8.dev0"}
{"input": ["cuda -keys=cuda,gpu -max_num_threads=1024 -thread_warp_size=32", "dense_large_batch.gpu", [["TENSOR", [65536, 30522], "float32"], ["TENSOR", [1024, 30522], "float32"]], {}], "config": {"index": 64244, "code_hash": null, "entity": [["tile_x", "sp", [-1, 2, 1, 4]], ["tile_y", "sp", [-1, 1, 1, 2]], ["tile_k", "sp", [-1, 1, 1]]]}, "result": [[33.778410829], 0, 196.5779197216034, 1637576531.650675], "version": 0.2, "tvm_version": "0.8.dev0"}
{"input": ["cuda -keys=cuda,gpu -max_num_threads=1024 -thread_warp_size=32", "dense_large_batch.gpu", [["TENSOR", [65536, 30522], "float32"], ["TENSOR", [1024, 30522], "float32"]], {}], "config": {"index": 619482, "code_hash": null, "entity": [["tile_x", "sp", [-1, 4, 1, 4]], ["tile_y", "sp", [-1, 2, 1, 2]], ["tile_k", "sp", [-1, 3, 1]]]}, "result": [[15.0534417605], 0, 106.1035144329071, 1637576636.8829725], "version": 0.2, "tvm_version": "0.8.dev0"}
{"input": ["cuda -keys=cuda,gpu -max_num_threads=1024 -thread_warp_size=32", "dense_large_batch.gpu", [["TENSOR", [65536, 30522], "float32"], ["TENSOR", [1024, 30522], "float32"]], {}], "config": {"index": 342348, "code_hash": null, "entity": [["tile_x", "sp", [-1, 4, 1, 4]], ["tile_y", "sp", [-1, 2, 1, 2]], ["tile_k", "sp", [-1, 2, 1]]]}, "result": [[17.66373593775], 0, 120.83679032325745, 1637576757.0275464], "version": 0.2, "tvm_version": "0.8.dev0"}
{"input": ["cuda -keys=cuda,gpu -max_num_threads=1024 -thread_warp_size=32", "dense_large_batch.gpu", [["TENSOR", [65536, 30522], "float32"], ["TENSOR", [1024, 30522], "float32"]], {}], "config": {"index": 279482, "code_hash": null, "entity": [["tile_x", "sp", [-1, 2, 1, 8]], ["tile_y", "sp", [-1, 4, 1, 1]], ["tile_k", "sp", [-1, 2, 1]]]}, "result": [[17.791403852], 0, 116.37582206726074, 1637576872.5586526], "version": 0.2, "tvm_version": "0.8.dev0"}
{"input": ["cuda -keys=cuda,gpu -max_num_threads=1024 -thread_warp_size=32", "dense_large_batch.gpu", [["TENSOR", [65536, 30522], "float32"], ["TENSOR", [1024, 30522], "float32"]], {}], "config": {"index": 65214, "code_hash": null, "entity": [["tile_x", "sp", [-1, 4, 1, 4]], ["tile_y", "sp", [-1, 2, 1, 2]], ["tile_k", "sp", [-1, 1, 1]]]}, "result": [[17.45046775375], 0, 114.69330787658691, 1637576986.7068453], "version": 0.2, "tvm_version": "0.8.dev0"}
{"input": ["cuda -keys=cuda,gpu -max_num_threads=1024 -thread_warp_size=32", "dense_large_batch.gpu", [["TENSOR", [65536, 30522], "float32"], ["TENSOR", [1024, 30522], "float32"]], {}], "config": {"index": 66301, "code_hash": null, "entity": [["tile_x", "sp", [-1, 1, 1, 8]], ["tile_y", "sp", [-1, 4, 1, 2]], ["tile_k", "sp", [-1, 1, 1]]]}, "result": [[14.2175744105], 0, 101.69339323043823, 1637577087.7638924], "version": 0.2, "tvm_version": "0.8.dev0"}
{"input": ["cuda -keys=cuda,gpu -max_num_threads=1024 -thread_warp_size=32", "dense_large_batch.gpu", [["TENSOR", [65536, 30522], "float32"], ["TENSOR", [1024, 30522], "float32"]], {}], "config": {"index": 2348, "code_hash": null, "entity": [["tile_x", "sp", [-1, 2, 1, 8]], ["tile_y", "sp", [-1, 4, 1, 1]], ["tile_k", "sp", [-1, 1, 1]]]}, "result": [[17.429406285749998], 0, 116.71500730514526, 1637577203.6396065], "version": 0.2, "tvm_version": "0.8.dev0"}
{"input": ["cuda -keys=cuda,gpu -max_num_threads=1024 -thread_warp_size=32", "dense_large_batch.gpu", [["TENSOR", [65536, 30522], "float32"], ["TENSOR", [1024, 30522], "float32"]], {}], "config": {"index": 2220270, "code_hash": null, "entity": [["tile_x", "sp", [-1, 4, 1, 4]], ["tile_y", "sp", [-1, 8, 1, 1]], ["tile_k", "sp", [-1, 1, 2]]]}, "result": [[17.74301046975], 0, 118.13440942764282, 1637577320.9224803], "version": 0.2, "tvm_version": "0.8.dev0"}
{"input": ["cuda -keys=cuda,gpu -max_num_threads=1024 -thread_warp_size=32", "dense_large_batch.gpu", [["TENSOR", [65536, 30522], "float32"], ["TENSOR", [1024, 30522], "float32"]], {}], "config": {"index": 2219420, "code_hash": null, "entity": [["tile_x", "sp", [-1, 2, 1, 8]], ["tile_y", "sp", [-1, 4, 1, 1]], ["tile_k", "sp", [-1, 1, 2]]]}, "result": [[17.784669642], 0, 121.23916673660278, 1637577441.3771303], "version": 0.2, "tvm_version": "0.8.dev0"}
{"input": ["cuda -keys=cuda,gpu -max_num_threads=1024 -thread_warp_size=32", "dense_large_batch.gpu", [["TENSOR", [65536, 30522], "float32"], ["TENSOR", [1024, 30522], "float32"]], {}], "config": {"index": 394794, "code_hash": null, "entity": [["tile_x", "sp", [-1, 4, 1, 8]], ["tile_y", "sp", [-1, 1, 1, 4]], ["tile_k", "sp", [-1, 2, 1]]]}, "result": [[17.907142748], 0, 118.33085083961487, 1637577558.6968098], "version": 0.2, "tvm_version": "0.8.dev0"}
{"input": ["cuda -keys=cuda,gpu -max_num_threads=1024 -thread_warp_size=32", "dense_large_batch.gpu", [["TENSOR", [65536, 30522], "float32"], ["TENSOR", [1024, 30522], "float32"]], {}], "config": {"index": 620570, "code_hash": null, "entity": [["tile_x", "sp", [-1, 2, 1, 8]], ["tile_y", "sp", [-1, 4, 1, 2]], ["tile_k", "sp", [-1, 3, 1]]]}, "result": [[12.647766925500001], 0, 97.43347024917603, 1637577657.7419589], "version": 0.2, "tvm_version": "0.8.dev0"}
{"input": ["cuda -keys=cuda,gpu -max_num_threads=1024 -thread_warp_size=32", "dense_large_batch.gpu", [["TENSOR", [65536, 30522], "float32"], ["TENSOR", [1024, 30522], "float32"]], {}], "config": {"index": 117539, "code_hash": null, "entity": [["tile_x", "sp", [-1, 2, 1, 4]], ["tile_y", "sp", [-1, 1, 1, 4]], ["tile_k", "sp", [-1, 1, 1]]]}, "result": [[20.11142814325], 0, 143.11399507522583, 1637577799.9879098], "version": 0.2, "tvm_version": "0.8.dev0"}
{"input": ["cuda -keys=cuda,gpu -max_num_threads=1024 -thread_warp_size=32", "dense_large_batch.gpu", [["TENSOR", [65536, 30522], "float32"], ["TENSOR", [1024, 30522], "float32"]], {}], "config": {"index": 620450, "code_hash": null, "entity": [["tile_x", "sp", [-1, 2, 1, 4]], ["tile_y", "sp", [-1, 4, 1, 2]], ["tile_k", "sp", [-1, 3, 1]]]}, "result": [[12.72354940175], 0, 93.52659130096436, 1637577892.608257], "version": 0.2, "tvm_version": "0.8.dev0"}
{"input": ["cuda -keys=cuda,gpu -max_num_threads=1024 -thread_warp_size=32", "dense_large_batch.gpu", [["TENSOR", [65536, 30522], "float32"], ["TENSOR", [1024, 30522], "float32"]], {}], "config": {"index": 3421, "code_hash": null, "entity": [["tile_x", "sp", [-1, 1, 1, 16]], ["tile_y", "sp", [-1, 8, 1, 1]], ["tile_k", "sp", [-1, 1, 1]]]}, "result": [[12.69396654175], 0, 93.04512333869934, 1637577984.9811], "version": 0.2, "tvm_version": "0.8.dev0"}
