artifacts/microbenchmark/tvm/ansor/conv/ansor_conv2d_128_1008_42_42_336_1_1_1_SAME.log
{"i": [["[\"conv2d_layer\", 128, 1008, 42, 42, 336, 1, 1, 1, \"SAME\"]", "cuda -keys=cuda,gpu -max_num_threads=1024 -thread_warp_size=32", [-1, 16, 64, 49152, 2147483647, 1024, 8, 32], "", 0, []], [[], [["CHW", 3, "local"], ["SP", 3, 0, 128, [1, 4, 2, 4], 1], ["SP", 3, 5, 336, [1, 56, 2, 3], 1], ["SP", 3, 10, 42, [1, 1, 1, 21], 1], ["SP", 3, 15, 42, [1, 1, 1, 2], 1], ["SP", 3, 20, 1008, [3, 1], 1], ["SP", 3, 23, 1, [1, 1], 1], ["SP", 3, 26, 1, [1, 1], 1], ["RE", 3, [0, 5, 10, 15, 1, 6, 11, 16, 2, 7, 12, 17, 20, 23, 26, 21, 24, 27, 3, 8, 13, 18, 22, 25, 28, 4, 9, 14, 19]], ["FSP", 4, 0, 1, 3], ["FSP", 4, 4, 2, 3], ["FSP", 4, 8, 3, 3], ["FSP", 4, 12, 4, 3], ["RE", 4, [0, 4, 8, 12, 1, 5, 9, 13, 2, 6, 10, 14, 3, 7, 11, 15]], ["CA", 3, 4, 11], ["CHR", 2, "shared", [3]], ["CA", 3, 4, 14], ["CHR", 1, "shared", [4]], ["CA", 2, 5, 14], ["CI", 1], ["FU", 6, [0, 1, 2, 3]], ["AN", 6, 0, 5], ["FU", 6, [1, 2, 3, 4]], ["AN", 6, 1, 4], ["FU", 6, [2, 3, 4, 5]], ["AN", 6, 2, 6], ["FU", 4, [0, 1, 2, 3]], ["SP", 4, 0, 18, [1], 1], ["AN", 4, 1, 2], ["FFSP", 4, 0, [4, 3, 2, 1], 1, 1], ["AN", 4, 1, 6], ["FU", 2, [0, 1, 2, 3]], ["SP", 2, 0, 252, [1], 1], ["AN", 2, 1, 2], ["FFSP", 2, 0, [4, 3, 2, 1], 1, 1], ["AN", 2, 1, 6], ["PR", 5, 0, "auto_unroll_max_step$64"]]]], "r": [[0.869453], 0, 11.5024, 1649178411], "v": "v0.6"}
{"i": [["[\"conv2d_layer\", 128, 1008, 42, 42, 336, 1, 1, 1, \"SAME\"]", "cuda -keys=cuda,gpu -max_num_threads=1024 -thread_warp_size=32", [-1, 16, 64, 49152, 2147483647, 1024, 8, 32], "", 0, []], [[], [["CHW", 3, "local"], ["SP", 3, 0, 128, [1, 1, 4, 4], 1], ["SP", 3, 5, 336, [1, 42, 4, 2], 1], ["SP", 3, 10, 42, [1, 7, 1, 1], 1], ["SP", 3, 15, 42, [1, 1, 1, 3], 1], ["SP", 3, 20, 1008, [2, 1], 1], ["SP", 3, 23, 1, [1, 1], 1], ["SP", 3, 26, 1, [1, 1], 1], ["RE", 3, [0, 5, 10, 15, 1, 6, 11, 16, 2, 7, 12, 17, 20, 23, 26, 21, 24, 27, 3, 8, 13, 18, 22, 25, 28, 4, 9, 14, 19]], ["FSP", 4, 0, 1, 3], ["FSP", 4, 4, 2, 3], ["FSP", 4, 8, 3, 3], ["FSP", 4, 12, 4, 3], ["RE", 4, [0, 4, 8, 12, 1, 5, 9, 13, 2, 6, 10, 14, 3, 7, 11, 15]], ["CA", 3, 4, 11], ["CHR", 2, "shared", [3]], ["CA", 3, 4, 14], ["CHR", 1, "shared", [4]], ["CA", 2, 5, 14], ["CI", 1], ["FU", 6, [0, 1, 2, 3]], ["AN", 6, 0, 5], ["FU", 6, [1, 2, 3, 4]], ["AN", 6, 1, 4], ["FU", 6, [2, 3, 4, 5]], ["AN", 6, 2, 6], ["FU", 4, [0, 1, 2, 3]], ["SP", 4, 0, 96, [1], 1], ["AN", 4, 1, 2], ["FFSP", 4, 0, [4, 3, 2, 1], 1, 1], ["AN", 4, 1, 6], ["FU", 2, [0, 1, 2, 3]], ["SP", 2, 0, 576, [1], 1], ["AN", 2, 1, 2], ["FFSP", 2, 0, [4, 3, 2, 1], 1, 1], ["AN", 2, 1, 6], ["PR", 5, 0, "auto_unroll_max_step$16"]]]], "r": [[0.882301], 0, 9.8077, 1649178420], "v": "v0.6"}
{"i": [["[\"conv2d_layer\", 128, 1008, 42, 42, 336, 1, 1, 1, \"SAME\"]", "cuda -keys=cuda,gpu -max_num_threads=1024 -thread_warp_size=32", [-1, 16, 64, 49152, 2147483647, 1024, 8, 32], "", 0, []], [[], [["CHW", 3, "local"], ["SP", 3, 0, 128, [1, 1, 2, 1], 1], ["SP", 3, 5, 336, [1, 1, 6, 56], 1], ["SP", 3, 10, 42, [1, 21, 2, 1], 1], ["SP", 3, 15, 42, [1, 1, 1, 2], 1], ["SP", 3, 20, 1008, [9, 2], 1], ["SP", 3, 23, 1, [1, 1], 1], ["SP", 3, 26, 1, [1, 1], 1], ["RE", 3, [0, 5, 10, 15, 1, 6, 11, 16, 2, 7, 12, 17, 20, 23, 26, 21, 24, 27, 3, 8, 13, 18, 22, 25, 28, 4, 9, 14, 19]], ["FSP", 4, 0, 1, 3], ["FSP", 4, 4, 2, 3], ["FSP", 4, 8, 3, 3], ["FSP", 4, 12, 4, 3], ["RE", 4, [0, 4, 8, 12, 1, 5, 9, 13, 2, 6, 10, 14, 3, 7, 11, 15]], ["CA", 3, 4, 11], ["CHR", 2, "shared", [3]], ["CA", 3, 4, 14], ["CHR", 1, "shared", [4]], ["CA", 2, 5, 14], ["CI", 1], ["FU", 6, [0, 1, 2, 3]], ["AN", 6, 0, 5], ["FU", 6, [1, 2, 3, 4]], ["AN", 6, 1, 4], ["FU", 6, [2, 3, 4, 5]], ["AN", 6, 2, 6], ["FU", 4, [0, 1, 2, 3]], ["SP", 4, 0, 3024, [1], 1], ["AN", 4, 1, 2], ["FFSP", 4, 0, [4, 3, 2, 1], 1, 1], ["AN", 4, 1, 6], ["FU", 2, [0, 1, 2, 3]], ["SP", 2, 0, 144, [1], 1], ["AN", 2, 1, 2], ["FFSP", 2, 0, [4, 3, 2, 1], 1, 1], ["AN", 2, 1, 6], ["PR", 5, 0, "auto_unroll_max_step$16"]]]], "r": [[0.639387], 0, 8.93982, 1649178427], "v": "v0.6"}
{"i": [["[\"conv2d_layer\", 128, 1008, 42, 42, 336, 1, 1, 1, \"SAME\"]", "cuda -keys=cuda,gpu -max_num_threads=1024 -thread_warp_size=32", [-1, 16, 64, 49152, 2147483647, 1024, 8, 32], "", 0, []], [[], [["CHW", 3, "local"], ["SP", 3, 0, 128, [2, 1, 2, 1], 1], ["SP", 3, 5, 336, [1, 2, 3, 56], 1], ["SP", 3, 10, 42, [1, 21, 2, 1], 1], ["SP", 3, 15, 42, [1, 1, 1, 2], 1], ["SP", 3, 20, 1008, [1, 12], 1], ["SP", 3, 23, 1, [1, 1], 1], ["SP", 3, 26, 1, [1, 1], 1], ["RE", 3, [0, 5, 10, 15, 1, 6, 11, 16, 2, 7, 12, 17, 20, 23, 26, 21, 24, 27, 3, 8, 13, 18, 22, 25, 28, 4, 9, 14, 19]], ["FSP", 4, 0, 1, 3], ["FSP", 4, 4, 2, 3], ["FSP", 4, 8, 3, 3], ["FSP", 4, 12, 4, 3], ["RE", 4, [0, 4, 8, 12, 1, 5, 9, 13, 2, 6, 10, 14, 3, 7, 11, 15]], ["CA", 3, 4, 11], ["CHR", 2, "shared", [3]], ["CA", 3, 4, 14], ["CHR", 1, "shared", [4]], ["CA", 2, 5, 14], ["CI", 1], ["FU", 6, [0, 1, 2, 3]], ["AN", 6, 0, 5], ["FU", 6, [1, 2, 3, 4]], ["AN", 6, 1, 4], ["FU", 6, [2, 3, 4, 5]], ["AN", 6, 2, 6], ["FU", 4, [0, 1, 2, 3]], ["SP", 4, 0, 3024, [1], 1], ["AN", 4, 1, 2], ["FFSP", 4, 0, [4, 3, 2, 1], 1, 1], ["AN", 4, 1, 6], ["FU", 2, [0, 1, 2, 3]], ["SP", 2, 0, 144, [1], 1], ["AN", 2, 1, 2], ["FFSP", 2, 0, [4, 3, 2, 1], 1, 1], ["AN", 2, 1, 6], ["PR", 5, 0, "auto_unroll_max_step$0"]]]], "r": [[0.98616], 0, 11.0051, 1649178437], "v": "v0.6"}
{"i": [["[\"conv2d_layer\", 128, 1008, 42, 42, 336, 1, 1, 1, \"SAME\"]", "cuda -keys=cuda,gpu -max_num_threads=1024 -thread_warp_size=32", [-1, 16, 64, 49152, 2147483647, 1024, 8, 32], "", 0, []], [[], [["CHW", 3, "local"], ["SP", 3, 0, 128, [2, 64, 1, 1], 1], ["SP", 3, 5, 336, [1, 1, 48, 7], 1], ["SP", 3, 10, 42, [1, 1, 1, 1], 1], ["SP", 3, 15, 42, [1, 3, 1, 1], 1], ["SP", 3, 20, 1008, [1, 1], 1], ["SP", 3, 23, 1, [1, 1], 1], ["SP", 3, 26, 1, [1, 1], 1], ["RE", 3, [0, 5, 10, 15, 1, 6, 11, 16, 2, 7, 12, 17, 20, 23, 26, 21, 24, 27, 3, 8, 13, 18, 22, 25, 28, 4, 9, 14, 19]], ["FSP", 4, 0, 1, 3], ["FSP", 4, 4, 2, 3], ["FSP", 4, 8, 3, 3], ["FSP", 4, 12, 4, 3], ["RE", 4, [0, 4, 8, 12, 1, 5, 9, 13, 2, 6, 10, 14, 3, 7, 11, 15]], ["CA", 3, 4, 11], ["CHR", 2, "shared", [3]], ["CA", 3, 4, 14], ["CHR", 1, "shared", [4]], ["CA", 2, 5, 14], ["CI", 1], ["FU", 6, [0, 1, 2, 3]], ["AN", 6, 0, 5], ["FU", 6, [1, 2, 3, 4]], ["AN", 6, 1, 4], ["FU", 6, [2, 3, 4, 5]], ["AN", 6, 2, 6], ["FU", 4, [0, 1, 2, 3]], ["SP", 4, 0, 42, [1], 1], ["AN", 4, 1, 2], ["FFSP", 4, 0, [4, 3, 2, 1], 1, 1], ["AN", 4, 1, 6], ["FU", 2, [0, 1, 2, 3]], ["SP", 2, 0, 1, [1], 1], ["AN", 2, 1, 2], ["FFSP", 2, 0, [4, 3, 2, 1], 1, 1], ["AN", 2, 1, 6], ["PR", 5, 0, "auto_unroll_max_step$1024"]]]], "r": [[0.909205], 0, 13.3338, 1649178457], "v": "v0.6"}
{"i": [["[\"conv2d_layer\", 128, 1008, 42, 42, 336, 1, 1, 1, \"SAME\"]", "cuda -keys=cuda,gpu -max_num_threads=1024 -thread_warp_size=32", [-1, 16, 64, 49152, 2147483647, 1024, 8, 32], "", 0, []], [[], [["CHW", 3, "local"], ["SP", 3, 0, 128, [1, 1, 2, 1], 1], ["SP", 3, 5, 336, [2, 56, 1, 3], 1], ["SP", 3, 10, 42, [1, 1, 2, 1], 1], ["SP", 3, 15, 42, [1, 7, 1, 6], 1], ["SP", 3, 20, 1008, [1, 1], 1], ["SP", 3, 23, 1, [1, 1], 1], ["SP", 3, 26, 1, [1, 1], 1], ["RE", 3, [0, 5, 10, 15, 1, 6, 11, 16, 2, 7, 12, 17, 20, 23, 26, 21, 24, 27, 3, 8, 13, 18, 22, 25, 28, 4, 9, 14, 19]], ["FSP", 4, 0, 1, 3], ["FSP", 4, 4, 2, 3], ["FSP", 4, 8, 3, 3], ["FSP", 4, 12, 4, 3], ["RE", 4, [0, 4, 8, 12, 1, 5, 9, 13, 2, 6, 10, 14, 3, 7, 11, 15]], ["CA", 3, 4, 11], ["CHR", 2, "shared", [3]], ["CA", 3, 4, 14], ["CHR", 1, "shared", [4]], ["CA", 2, 5, 14], ["CI", 1], ["FU", 6, [0, 1, 2, 3]], ["AN", 6, 0, 5], ["FU", 6, [1, 2, 3, 4]], ["AN", 6, 1, 4], ["FU", 6, [2, 3, 4, 5]], ["AN", 6, 2, 6], ["FU", 4, [0, 1, 2, 3]], ["SP", 4, 0, 3, [1], 1], ["AN", 4, 1, 2], ["FFSP", 4, 0, [4, 3, 2, 1], 1, 1], ["AN", 4, 1, 6], ["FU", 2, [0, 1, 2, 3]], ["SP", 2, 0, 384, [1], 1], ["AN", 2, 1, 2], ["FFSP", 2, 0, [4, 3, 2, 1], 1, 1], ["AN", 2, 1, 6], ["PR", 5, 0, "auto_unroll_max_step$0"]]]], "r": [[0.139559], 0, 5.69761, 1649178461], "v": "v0.6"}
{"i": [["[\"conv2d_layer\", 128, 1008, 42, 42, 336, 1, 1, 1, \"SAME\"]", "cuda -keys=cuda,gpu -max_num_threads=1024 -thread_warp_size=32", [-1, 16, 64, 49152, 2147483647, 1024, 8, 32], "", 0, []], [[], [["CHW", 3, "local"], ["SP", 3, 0, 128, [2, 16, 2, 1], 1], ["SP", 3, 5, 336, [4, 1, 2, 21], 1], ["SP", 3, 10, 42, [1, 3, 1, 2], 1], ["SP", 3, 15, 42, [1, 1, 1, 1], 1], ["SP", 3, 20, 1008, [1, 14], 1], ["SP", 3, 23, 1, [1, 1], 1], ["SP", 3, 26, 1, [1, 1], 1], ["RE", 3, [0, 5, 10, 15, 1, 6, 11, 16, 2, 7, 12, 17, 20, 23, 26, 21, 24, 27, 3, 8, 13, 18, 22, 25, 28, 4, 9, 14, 19]], ["FSP", 4, 0, 1, 3], ["FSP", 4, 4, 2, 3], ["FSP", 4, 8, 3, 3], ["FSP", 4, 12, 4, 3], ["RE", 4, [0, 4, 8, 12, 1, 5, 9, 13, 2, 6, 10, 14, 3, 7, 11, 15]], ["CA", 3, 4, 11], ["CHR", 2, "shared", [3]], ["CA", 3, 4, 14], ["CHR", 1, "shared", [4]], ["CA", 2, 5, 14], ["CI", 1], ["FU", 6, [0, 1, 2, 3]], ["AN", 6, 0, 5], ["FU", 6, [1, 2, 3, 4]], ["AN", 6, 1, 4], ["FU", 6, [2, 3, 4, 5]], ["AN", 6, 2, 6], ["FU", 4, [0, 1, 2, 3]], ["SP", 4, 0, 84, [1], 1], ["AN", 4, 1, 2], ["FFSP", 4, 0, [4, 3, 2, 1], 1, 1], ["AN", 4, 1, 6], ["FU", 2, [0, 1, 2, 3]], ["SP", 2, 0, 56, [1], 1], ["AN", 2, 1, 2], ["FFSP", 2, 0, [4, 3, 2, 1], 1, 1], ["AN", 2, 1, 6], ["PR", 5, 0, "auto_unroll_max_step$16"]]]], "r": [[0.944526], 0, 10.8397, 1649178471], "v": "v0.6"}
{"i": [["[\"conv2d_layer\", 128, 1008, 42, 42, 336, 1, 1, 1, \"SAME\"]", "cuda -keys=cuda,gpu -max_num_threads=1024 -thread_warp_size=32", [-1, 16, 64, 49152, 2147483647, 1024, 8, 32], "", 0, []], [[], [["CHW", 3, "local"], ["SP", 3, 0, 128, [1, 4, 1, 1], 1], ["SP", 3, 5, 336, [2, 14, 1, 3], 1], ["SP", 3, 10, 42, [1, 6, 1, 7], 1], ["SP", 3, 15, 42, [1, 1, 2, 3], 1], ["SP", 3, 20, 1008, [1, 6], 1], ["SP", 3, 23, 1, [1, 1], 1], ["SP", 3, 26, 1, [1, 1], 1], ["RE", 3, [0, 5, 10, 15, 1, 6, 11, 16, 2, 7, 12, 17, 20, 23, 26, 21, 24, 27, 3, 8, 13, 18, 22, 25, 28, 4, 9, 14, 19]], ["FSP", 4, 0, 1, 3], ["FSP", 4, 4, 2, 3], ["FSP", 4, 8, 3, 3], ["FSP", 4, 12, 4, 3], ["RE", 4, [0, 4, 8, 12, 1, 5, 9, 13, 2, 6, 10, 14, 3, 7, 11, 15]], ["CA", 3, 4, 11], ["CHR", 2, "shared", [3]], ["CA", 3, 4, 14], ["CHR", 1, "shared", [4]], ["CA", 2, 5, 14], ["CI", 1], ["FU", 6, [0, 1, 2, 3]], ["AN", 6, 0, 5], ["FU", 6, [1, 2, 3, 4]], ["AN", 6, 1, 4], ["FU", 6, [2, 3, 4, 5]], ["AN", 6, 2, 6], ["FU", 4, [0, 1, 2, 3]], ["SP", 4, 0, 18, [2], 1], ["AN", 4, 1, 2], ["FFSP", 4, 0, [4, 3, 2, 1], 1, 1], ["AN", 4, 1, 6], ["FU", 2, [0, 1, 2, 3]], ["SP", 2, 0, 252, [1], 1], ["AN", 2, 1, 2], ["FFSP", 2, 0, [4, 3, 2, 1], 1, 1], ["AN", 2, 1, 6], ["PR", 5, 0, "auto_unroll_max_step$0"]]]], "r": [[0.180293], 0, 6.8566, 1649178476], "v": "v0.6"}
{"i": [["[\"conv2d_layer\", 128, 1008, 42, 42, 336, 1, 1, 1, \"SAME\"]", "cuda -keys=cuda,gpu -max_num_threads=1024 -thread_warp_size=32", [-1, 16, 64, 49152, 2147483647, 1024, 8, 32], "", 0, []], [[], [["CHW", 3, "local"], ["SP", 3, 0, 128, [2, 4, 1, 1], 1], ["SP", 3, 5, 336, [1, 2, 1, 56], 1], ["SP", 3, 10, 42, [1, 6, 1, 1], 1], ["SP", 3, 15, 42, [2, 1, 3, 7], 1], ["SP", 3, 20, 1008, [1, 4], 1], ["SP", 3, 23, 1, [1, 1], 1], ["SP", 3, 26, 1, [1, 1], 1], ["RE", 3, [0, 5, 10, 15, 1, 6, 11, 16, 2, 7, 12, 17, 20, 23, 26, 21, 24, 27, 3, 8, 13, 18, 22, 25, 28, 4, 9, 14, 19]], ["FSP", 4, 0, 1, 3], ["FSP", 4, 4, 2, 3], ["FSP", 4, 8, 3, 3], ["FSP", 4, 12, 4, 3], ["RE", 4, [0, 4, 8, 12, 1, 5, 9, 13, 2, 6, 10, 14, 3, 7, 11, 15]], ["CA", 3, 4, 11], ["CHR", 2, "shared", [3]], ["CA", 3, 4, 14], ["CHR", 1, "shared", [4]], ["CA", 2, 5, 14], ["CI", 1], ["FU", 6, [0, 1, 2, 3]], ["AN", 6, 0, 5], ["FU", 6, [1, 2, 3, 4]], ["AN", 6, 1, 4], ["FU", 6, [2, 3, 4, 5]], ["AN", 6, 2, 6], ["FU", 4, [0, 1, 2, 3]], ["SP", 4, 0, 112, [1], 1], ["AN", 4, 1, 2], ["FFSP", 4, 0, [4, 3, 2, 1], 1, 1], ["AN", 4, 1, 6], ["FU", 2, [0, 1, 2, 3]], ["SP", 2, 0, 42, [1], 1], ["AN", 2, 1, 2], ["FFSP", 2, 0, [4, 3, 2, 1], 1, 1], ["AN", 2, 1, 6], ["PR", 5, 0, "auto_unroll_max_step$0"]]]], "r": [[0.98645], 0, 10.2049, 1649178486], "v": "v0.6"}
{"i": [["[\"conv2d_layer\", 128, 1008, 42, 42, 336, 1, 1, 1, \"SAME\"]", "cuda -keys=cuda,gpu -max_num_threads=1024 -thread_warp_size=32", [-1, 16, 64, 49152, 2147483647, 1024, 8, 32], "", 0, []], [[], [["CHW", 3, "local"], ["SP", 3, 0, 128, [2, 4, 1, 1], 1], ["SP", 3, 5, 336, [1, 2, 1, 56], 1], ["SP", 3, 10, 42, [1, 6, 1, 1], 1], ["SP", 3, 15, 42, [2, 1, 3, 7], 1], ["SP", 3, 20, 1008, [1, 4], 1], ["SP", 3, 23, 1, [1, 1], 1], ["SP", 3, 26, 1, [1, 1], 1], ["RE", 3, [0, 5, 10, 15, 1, 6, 11, 16, 2, 7, 12, 17, 20, 23, 26, 21, 24, 27, 3, 8, 13, 18, 22, 25, 28, 4, 9, 14, 19]], ["FSP", 4, 0, 1, 3], ["FSP", 4, 4, 2, 3], ["FSP", 4, 8, 3, 3], ["FSP", 4, 12, 4, 3], ["RE", 4, [0, 4, 8, 12, 1, 5, 9, 13, 2, 6, 10, 14, 3, 7, 11, 15]], ["CA", 3, 4, 11], ["CHR", 2, "shared", [3]], ["CA", 3, 4, 14], ["CHR", 1, "shared", [4]], ["CA", 2, 5, 14], ["CI", 1], ["FU", 6, [0, 1, 2, 3]], ["AN", 6, 0, 5], ["FU", 6, [1, 2, 3, 4]], ["AN", 6, 1, 4], ["FU", 6, [2, 3, 4, 5]], ["AN", 6, 2, 6], ["FU", 4, [0, 1, 2, 3]], ["SP", 4, 0, 112, [2], 1], ["AN", 4, 1, 2], ["FFSP", 4, 0, [4, 3, 2, 1], 1, 1], ["AN", 4, 1, 6], ["FU", 2, [0, 1, 2, 3]], ["SP", 2, 0, 42, [1], 1], ["AN", 2, 1, 2], ["FFSP", 2, 0, [4, 3, 2, 1], 1, 1], ["AN", 2, 1, 6], ["PR", 5, 0, "auto_unroll_max_step$0"]]]], "r": [[0.986267], 0, 10.4256, 1649178495], "v": "v0.6"}
{"i": [["[\"conv2d_layer\", 128, 1008, 42, 42, 336, 1, 1, 1, \"SAME\"]", "cuda -keys=cuda,gpu -max_num_threads=1024 -thread_warp_size=32", [-1, 16, 64, 49152, 2147483647, 1024, 8, 32], "", 0, []], [[], [["CHW", 3, "local"], ["SP", 3, 0, 128, [8, 2, 1, 2], 1], ["SP", 3, 5, 336, [1, 7, 4, 6], 1], ["SP", 3, 10, 42, [1, 3, 1, 1], 1], ["SP", 3, 15, 42, [1, 7, 1, 1], 1], ["SP", 3, 20, 1008, [7, 1], 1], ["SP", 3, 23, 1, [1, 1], 1], ["SP", 3, 26, 1, [1, 1], 1], ["RE", 3, [0, 5, 10, 15, 1, 6, 11, 16, 2, 7, 12, 17, 20, 23, 26, 21, 24, 27, 3, 8, 13, 18, 22, 25, 28, 4, 9, 14, 19]], ["FSP", 4, 0, 1, 3], ["FSP", 4, 4, 2, 3], ["FSP", 4, 8, 3, 3], ["FSP", 4, 12, 4, 3], ["RE", 4, [0, 4, 8, 12, 1, 5, 9, 13, 2, 6, 10, 14, 3, 7, 11, 15]], ["CA", 3, 4, 11], ["CHR", 2, "shared", [3]], ["CA", 3, 4, 14], ["CHR", 1, "shared", [4]], ["CA", 2, 5, 14], ["CI", 1], ["FU", 6, [0, 1, 2, 3]], ["AN", 6, 0, 5], ["FU", 6, [1, 2, 3, 4]], ["AN", 6, 1, 4], ["FU", 6, [2, 3, 4, 5]], ["AN", 6, 2, 6], ["FU", 4, [0, 1, 2, 3]], ["SP", 4, 0, 168, [1], 1], ["AN", 4, 1, 2], ["FFSP", 4, 0, [4, 3, 2, 1], 1, 1], ["AN", 4, 1, 6], ["FU", 2, [0, 1, 2, 3]], ["SP", 2, 0, 42, [1], 1], ["AN", 2, 1, 2], ["FFSP", 2, 0, [4, 3, 2, 1], 1, 1], ["AN", 2, 1, 6], ["PR", 5, 0, "auto_unroll_max_step$64"]]]], "r": [[0.884382], 0, 10.0987, 1649178504], "v": "v0.6"}
{"i": [["[\"conv2d_layer\", 128, 1008, 42, 42, 336, 1, 1, 1, \"SAME\"]", "cuda -keys=cuda,gpu -max_num_threads=1024 -thread_warp_size=32", [-1, 16, 64, 49152, 2147483647, 1024, 8, 32], "", 0, []], [[], [["CHW", 3, "local"], ["SP", 3, 0, 128, [1, 2, 8, 1], 1], ["SP", 3, 5, 336, [1, 16, 21, 1], 1], ["SP", 3, 10, 42, [1, 6, 1, 7], 1], ["SP", 3, 15, 42, [1, 3, 1, 1], 1], ["SP", 3, 20, 1008, [1, 4], 1], ["SP", 3, 23, 1, [1, 1], 1], ["SP", 3, 26, 1, [1, 1], 1], ["RE", 3, [0, 5, 10, 15, 1, 6, 11, 16, 2, 7, 12, 17, 20, 23, 26, 21, 24, 27, 3, 8, 13, 18, 22, 25, 28, 4, 9, 14, 19]], ["FSP", 4, 0, 1, 3], ["FSP", 4, 4, 2, 3], ["FSP", 4, 8, 3, 3], ["FSP", 4, 12, 4, 3], ["RE", 4, [0, 4, 8, 12, 1, 5, 9, 13, 2, 6, 10, 14, 3, 7, 11, 15]], ["CA", 3, 4, 11], ["CHR", 2, "shared", [3]], ["CA", 3, 4, 14], ["CHR", 1, "shared", [4]], ["CA", 2, 5, 14], ["CI", 1], ["FU", 6, [0, 1, 2, 3]], ["AN", 6, 0, 5], ["FU", 6, [1, 2, 3, 4]], ["AN", 6, 1, 4], ["FU", 6, [2, 3, 4, 5]], ["AN", 6, 2, 6], ["FU", 4, [0, 1, 2, 3]], ["SP", 4, 0, 21, [1], 1], ["AN", 4, 1, 2], ["FFSP", 4, 0, [4, 3, 2, 1], 1, 1], ["AN", 4, 1, 6], ["FU", 2, [0, 1, 2, 3]], ["SP", 2, 0, 168, [1], 1], ["AN", 2, 1, 2], ["FFSP", 2, 0, [4, 3, 2, 1], 1, 1], ["AN", 2, 1, 6], ["PR", 5, 0, "auto_unroll_max_step$16"]]]], "r": [[0.229734], 0, 7.48814, 1649178510], "v": "v0.6"}
{"i": [["[\"conv2d_layer\", 128, 1008, 42, 42, 336, 1, 1, 1, \"SAME\"]", "cuda -keys=cuda,gpu -max_num_threads=1024 -thread_warp_size=32", [-1, 16, 64, 49152, 2147483647, 1024, 8, 32], "", 0, []], [[], [["CHW", 3, "local"], ["SP", 3, 0, 128, [1, 1, 2, 1], 1], ["SP", 3, 5, 336, [2, 14, 2, 2], 1], ["SP", 3, 10, 42, [3, 7, 1, 1], 1], ["SP", 3, 15, 42, [1, 1, 2, 1], 1], ["SP", 3, 20, 1008, [6, 1], 1], ["SP", 3, 23, 1, [1, 1], 1], ["SP", 3, 26, 1, [1, 1], 1], ["RE", 3, [0, 5, 10, 15, 1, 6, 11, 16, 2, 7, 12, 17, 20, 23, 26, 21, 24, 27, 3, 8, 13, 18, 22, 25, 28, 4, 9, 14, 19]], ["FSP", 4, 0, 1, 3], ["FSP", 4, 4, 2, 3], ["FSP", 4, 8, 3, 3], ["FSP", 4, 12, 4, 3], ["RE", 4, [0, 4, 8, 12, 1, 5, 9, 13, 2, 6, 10, 14, 3, 7, 11, 15]], ["CA", 3, 4, 11], ["CHR", 2, "shared", [3]], ["CA", 3, 4, 14], ["CHR", 1, "shared", [4]], ["CA", 2, 5, 14], ["CI", 1], ["FU", 6, [0, 1, 2, 3]], ["AN", 6, 0, 5], ["FU", 6, [1, 2, 3, 4]], ["AN", 6, 1, 4], ["FU", 6, [2, 3, 4, 5]], ["AN", 6, 2, 6], ["FU", 4, [0, 1, 2, 3]], ["SP", 4, 0, 144, [1], 1], ["AN", 4, 1, 2], ["FFSP", 4, 0, [4, 3, 2, 1], 1, 1], ["AN", 4, 1, 6], ["FU", 2, [0, 1, 2, 3]], ["SP", 2, 0, 144, [1], 1], ["AN", 2, 1, 2], ["FFSP", 2, 0, [4, 3, 2, 1], 1, 1], ["AN", 2, 1, 6], ["PR", 5, 0, "auto_unroll_max_step$16"]]]], "r": [[0.0240542], 0, 5.78295, 1649178525], "v": "v0.6"}
{"i": [["[\"conv2d_layer\", 128, 1008, 42, 42, 336, 1, 1, 1, \"SAME\"]", "cuda -keys=cuda,gpu -max_num_threads=1024 -thread_warp_size=32", [-1, 16, 64, 49152, 2147483647, 1024, 8, 32], "", 0, []], [[], [["CHW", 3, "local"], ["SP", 3, 0, 128, [1, 2, 8, 2], 1], ["SP", 3, 5, 336, [1, 12, 4, 1], 1], ["SP", 3, 10, 42, [1, 21, 2, 1], 1], ["SP", 3, 15, 42, [1, 1, 1, 1], 1], ["SP", 3, 20, 1008, [1, 4], 1], ["SP", 3, 23, 1, [1, 1], 1], ["SP", 3, 26, 1, [1, 1], 1], ["RE", 3, [0, 5, 10, 15, 1, 6, 11, 16, 2, 7, 12, 17, 20, 23, 26, 21, 24, 27, 3, 8, 13, 18, 22, 25, 28, 4, 9, 14, 19]], ["FSP", 4, 0, 1, 3], ["FSP", 4, 4, 2, 3], ["FSP", 4, 8, 3, 3], ["FSP", 4, 12, 4, 3], ["RE", 4, [0, 4, 8, 12, 1, 5, 9, 13, 2, 6, 10, 14, 3, 7, 11, 15]], ["CA", 3, 4, 11], ["CHR", 2, "shared", [3]], ["CA", 3, 4, 14], ["CHR", 1, "shared", [4]], ["CA", 2, 5, 14], ["CI", 1], ["FU", 6, [0, 1, 2, 3]], ["AN", 6, 0, 5], ["FU", 6, [1, 2, 3, 4]], ["AN", 6, 1, 4], ["FU", 6, [2, 3, 4, 5]], ["AN", 6, 2, 6], ["FU", 4, [0, 1, 2, 3]], ["SP", 4, 0, 16, [1], 1], ["AN", 4, 1, 2], ["FFSP", 4, 0, [4, 3, 2, 1], 1, 1], ["AN", 4, 1, 6], ["FU", 2, [0, 1, 2, 3]], ["SP", 2, 0, 128, [1], 1], ["AN", 2, 1, 2], ["FFSP", 2, 0, [4, 3, 2, 1], 1, 1], ["AN", 2, 1, 6], ["PR", 5, 0, "auto_unroll_max_step$16"]]]], "r": [[0.330372], 0, 7.40263, 1649178532], "v": "v0.6"}
{"i": [["[\"conv2d_layer\", 128, 1008, 42, 42, 336, 1, 1, 1, \"SAME\"]", "cuda -keys=cuda,gpu -max_num_threads=1024 -thread_warp_size=32", [-1, 16, 64, 49152, 2147483647, 1024, 8, 32], "", 0, []], [[], [["CHW", 3, "local"], ["SP", 3, 0, 128, [2, 1, 1, 1], 1], ["SP", 3, 5, 336, [1, 6, 2, 28], 1], ["SP", 3, 10, 42, [3, 7, 1, 2], 1], ["SP", 3, 15, 42, [1, 3, 7, 2], 1], ["SP", 3, 20, 1008, [1, 1], 1], ["SP", 3, 23, 1, [1, 1], 1], ["SP", 3, 26, 1, [1, 1], 1], ["RE", 3, [0, 5, 10, 15, 1, 6, 11, 16, 2, 7, 12, 17, 20, 23, 26, 21, 24, 27, 3, 8, 13, 18, 22, 25, 28, 4, 9, 14, 19]], ["FSP", 4, 0, 1, 3], ["FSP", 4, 4, 2, 3], ["FSP", 4, 8, 3, 3], ["FSP", 4, 12, 4, 3], ["RE", 4, [0, 4, 8, 12, 1, 5, 9, 13, 2, 6, 10, 14, 3, 7, 11, 15]], ["CA", 3, 4, 11], ["CHR", 2, "shared", [3]], ["CA", 3, 4, 14], ["CHR", 1, "shared", [4]], ["CA", 2, 5, 14], ["CI", 1], ["FU", 6, [0, 1, 2, 3]], ["AN", 6, 0, 5], ["FU", 6, [1, 2, 3, 4]], ["AN", 6, 1, 4], ["FU", 6, [2, 3, 4, 5]], ["AN", 6, 2, 6], ["FU", 4, [0, 1, 2, 3]], ["SP", 4, 0, 84, [1], 1], ["AN", 4, 1, 2], ["FFSP", 4, 0, [4, 3, 2, 1], 1, 1], ["AN", 4, 1, 6], ["FU", 2, [0, 1, 2, 3]], ["SP", 2, 0, 84, [1], 1], ["AN", 2, 1, 2], ["FFSP", 2, 0, [4, 3, 2, 1], 1, 1], ["AN", 2, 1, 6], ["PR", 5, 0, "auto_unroll_max_step$1024"]]]], "r": [[0.867075], 0, 17.1796, 1649178551], "v": "v0.6"}
{"i": [["[\"conv2d_layer\", 128, 1008, 42, 42, 336, 1, 1, 1, \"SAME\"]", "cuda -keys=cuda,gpu -max_num_threads=1024 -thread_warp_size=32", [-1, 16, 64, 49152, 2147483647, 1024, 8, 32], "", 0, []], [[], [["CHW", 3, "local"], ["SP", 3, 0, 128, [2, 1, 1, 2], 1], ["SP", 3, 5, 336, [2, 6, 7, 1], 1], ["SP", 3, 10, 42, [1, 7, 1, 3], 1], ["SP", 3, 15, 42, [1, 1, 3, 1], 1], ["SP", 3, 20, 1008, [3, 12], 1], ["SP", 3, 23, 1, [1, 1], 1], ["SP", 3, 26, 1, [1, 1], 1], ["RE", 3, [0, 5, 10, 15, 1, 6, 11, 16, 2, 7, 12, 17, 20, 23, 26, 21, 24, 27, 3, 8, 13, 18, 22, 25, 28, 4, 9, 14, 19]], ["FSP", 4, 0, 1, 3], ["FSP", 4, 4, 2, 3], ["FSP", 4, 8, 3, 3], ["FSP", 4, 12, 4, 3], ["RE", 4, [0, 4, 8, 12, 1, 5, 9, 13, 2, 6, 10, 14, 3, 7, 11, 15]], ["CA", 3, 4, 11], ["CHR", 2, "shared", [3]], ["CA", 3, 4, 14], ["CHR", 1, "shared", [4]], ["CA", 2, 5, 14], ["CI", 1], ["FU", 6, [0, 1, 2, 3]], ["AN", 6, 0, 5], ["FU", 6, [1, 2, 3, 4]], ["AN", 6, 1, 4], ["FU", 6, [2, 3, 4, 5]], ["AN", 6, 2, 6], ["FU", 4, [0, 1, 2, 3]], ["SP", 4, 0, 252, [1], 1], ["AN", 4, 1, 2], ["FFSP", 4, 0, [4, 3, 2, 1], 1, 1], ["AN", 4, 1, 6], ["FU", 2, [0, 1, 2, 3]], ["SP", 2, 0, 648, [1], 1], ["AN", 2, 1, 2], ["FFSP", 2, 0, [4, 3, 2, 1], 1, 1], ["AN", 2, 1, 6], ["PR", 5, 0, "auto_unroll_max_step$1024"]]]], "r": [[0.178646], 0, 12.0608, 1649178557], "v": "v0.6"}
{"i": [["[\"conv2d_layer\", 128, 1008, 42, 42, 336, 1, 1, 1, \"SAME\"]", "cuda -keys=cuda,gpu -max_num_threads=1024 -thread_warp_size=32", [-1, 16, 64, 49152, 2147483647, 1024, 8, 32], "", 0, []], [[], [["CHW", 3, "local"], ["SP", 3, 0, 128, [8, 2, 8, 1], 1], ["SP", 3, 5, 336, [1, 42, 2, 2], 1], ["SP", 3, 10, 42, [1, 7, 1, 6], 1], ["SP", 3, 15, 42, [1, 1, 1, 1], 1], ["SP", 3, 20, 1008, [1, 1], 1], ["SP", 3, 23, 1, [1, 1], 1], ["SP", 3, 26, 1, [1, 1], 1], ["RE", 3, [0, 5, 10, 15, 1, 6, 11, 16, 2, 7, 12, 17, 20, 23, 26, 21, 24, 27, 3, 8, 13, 18, 22, 25, 28, 4, 9, 14, 19]], ["FSP", 4, 0, 1, 3], ["FSP", 4, 4, 2, 3], ["FSP", 4, 8, 3, 3], ["FSP", 4, 12, 4, 3], ["RE", 4, [0, 4, 8, 12, 1, 5, 9, 13, 2, 6, 10, 14, 3, 7, 11, 15]], ["CA", 3, 4, 11], ["CHR", 2, "shared", [3]], ["CA", 3, 4, 14], ["CHR", 1, "shared", [4]], ["CA", 2, 5, 14], ["CI", 1], ["FU", 6, [0, 1, 2, 3]], ["AN", 6, 0, 5], ["FU", 6, [1, 2, 3, 4]], ["AN", 6, 1, 4], ["FU", 6, [2, 3, 4, 5]], ["AN", 6, 2, 6], ["FU", 4, [0, 1, 2, 3]], ["SP", 4, 0, 4, [1], 1], ["AN", 4, 1, 2], ["FFSP", 4, 0, [4, 3, 2, 1], 1, 1], ["AN", 4, 1, 6], ["FU", 2, [0, 1, 2, 3]], ["SP", 2, 0, 96, [1], 1], ["AN", 2, 1, 2], ["FFSP", 2, 0, [4, 3, 2, 1], 1, 1], ["AN", 2, 1, 6], ["PR", 5, 0, "auto_unroll_max_step$64"]]]], "r": [[0.935974], 0, 10.6695, 1649178566], "v": "v0.6"}
{"i": [["[\"conv2d_layer\", 128, 1008, 42, 42, 336, 1, 1, 1, \"SAME\"]", "cuda -keys=cuda,gpu -max_num_threads=1024 -thread_warp_size=32", [-1, 16, 64, 49152, 2147483647, 1024, 8, 32], "", 0, []], [[], [["CHW", 3, "local"], ["SP", 3, 0, 128, [1, 1, 2, 1], 1], ["SP", 3, 5, 336, [1, 6, 1, 4], 1], ["SP", 3, 10, 42, [1, 2, 1, 1], 1], ["SP", 3, 15, 42, [1, 6, 1, 1], 1], ["SP", 3, 20, 1008, [8, 7], 1], ["SP", 3, 23, 1, [1, 1], 1], ["SP", 3, 26, 1, [1, 1], 1], ["RE", 3, [0, 5, 10, 15, 1, 6, 11, 16, 2, 7, 12, 17, 20, 23, 26, 21, 24, 27, 3, 8, 13, 18, 22, 25, 28, 4, 9, 14, 19]], ["FSP", 4, 0, 1, 3], ["FSP", 4, 4, 2, 3], ["FSP", 4, 8, 3, 3], ["FSP", 4, 12, 4, 3], ["RE", 4, [0, 4, 8, 12, 1, 5, 9, 13, 2, 6, 10, 14, 3, 7, 11, 15]], ["CA", 3, 4, 11], ["CHR", 2, "shared", [3]], ["CA", 3, 4, 14], ["CHR", 1, "shared", [4]], ["CA", 2, 5, 14], ["CI", 1], ["FU", 6, [0, 1, 2, 3]], ["AN", 6, 0, 5], ["FU", 6, [1, 2, 3, 4]], ["AN", 6, 1, 4], ["FU", 6, [2, 3, 4, 5]], ["AN", 6, 2, 6], ["FU", 4, [0, 1, 2, 3]], ["SP", 4, 0, 224, [1], 1], ["AN", 4, 1, 2], ["FFSP", 4, 0, [4, 3, 2, 1], 1, 1], ["AN", 4, 1, 6], ["FU", 2, [0, 1, 2, 3]], ["SP", 2, 0, 112, [1], 1], ["AN", 2, 1, 2], ["FFSP", 2, 0, [4, 3, 2, 1], 1, 1], ["AN", 2, 1, 6], ["PR", 5, 0, "auto_unroll_max_step$1024"]]]], "r": [[0.0325246], 0, 6.31351, 1649178571], "v": "v0.6"}
{"i": [["[\"conv2d_layer\", 128, 1008, 42, 42, 336, 1, 1, 1, \"SAME\"]", "cuda -keys=cuda,gpu -max_num_threads=1024 -thread_warp_size=32", [-1, 16, 64, 49152, 2147483647, 1024, 8, 32], "", 0, []], [[], [["CHW", 3, "local"], ["SP", 3, 0, 128, [1, 4, 2, 1], 1], ["SP", 3, 5, 336, [2, 42, 1, 2], 1], ["SP", 3, 10, 42, [1, 3, 2, 7], 1], ["SP", 3, 15, 42, [1, 1, 2, 1], 1], ["SP", 3, 20, 1008, [8, 1], 1], ["SP", 3, 23, 1, [1, 1], 1], ["SP", 3, 26, 1, [1, 1], 1], ["RE", 3, [0, 5, 10, 15, 1, 6, 11, 16, 2, 7, 12, 17, 20, 23, 26, 21, 24, 27, 3, 8, 13, 18, 22, 25, 28, 4, 9, 14, 19]], ["FSP", 4, 0, 1, 3], ["FSP", 4, 4, 2, 3], ["FSP", 4, 8, 3, 3], ["FSP", 4, 12, 4, 3], ["RE", 4, [0, 4, 8, 12, 1, 5, 9, 13, 2, 6, 10, 14, 3, 7, 11, 15]], ["CA", 3, 4, 11], ["CHR", 2, "shared", [3]], ["CA", 3, 4, 14], ["CHR", 1, "shared", [4]], ["CA", 2, 5, 14], ["CI", 1], ["FU", 6, [0, 1, 2, 3]], ["AN", 6, 0, 5], ["FU", 6, [1, 2, 3, 4]], ["AN", 6, 1, 4], ["FU", 6, [2, 3, 4, 5]], ["AN", 6, 2, 6], ["FU", 4, [0, 1, 2, 3]], ["SP", 4, 0, 16, [1], 1], ["AN", 4, 1, 2], ["FFSP", 4, 0, [4, 3, 2, 1], 1, 1], ["AN", 4, 1, 6], ["FU", 2, [0, 1, 2, 3]], ["SP", 2, 0, 448, [1], 1], ["AN", 2, 1, 2], ["FFSP", 2, 0, [4, 3, 2, 1], 1, 1], ["AN", 2, 1, 6], ["PR", 5, 0, "auto_unroll_max_step$0"]]]], "r": [[0.831094], 0, 10.4179, 1649178590], "v": "v0.6"}
{"i": [["[\"conv2d_layer\", 128, 1008, 42, 42, 336, 1, 1, 1, \"SAME\"]", "cuda -keys=cuda,gpu -max_num_threads=1024 -thread_warp_size=32", [-1, 16, 64, 49152, 2147483647, 1024, 8, 32], "", 0, []], [[], [["CHW", 3, "local"], ["SP", 3, 0, 128, [8, 2, 8, 1], 1], ["SP", 3, 5, 336, [1, 21, 2, 4], 1], ["SP", 3, 10, 42, [1, 7, 1, 6], 1], ["SP", 3, 15, 42, [1, 1, 1, 2], 1], ["SP", 3, 20, 1008, [1, 1], 1], ["SP", 3, 23, 1, [1, 1], 1], ["SP", 3, 26, 1, [1, 1], 1], ["RE", 3, [0, 5, 10, 15, 1, 6, 11, 16, 2, 7, 12, 17, 20, 23, 26, 21, 24, 27, 3, 8, 13, 18, 22, 25, 28, 4, 9, 14, 19]], ["FSP", 4, 0, 1, 3], ["FSP", 4, 4, 2, 3], ["FSP", 4, 8, 3, 3], ["FSP", 4, 12, 4, 3], ["RE", 4, [0, 4, 8, 12, 1, 5, 9, 13, 2, 6, 10, 14, 3, 7, 11, 15]], ["CA", 3, 4, 11], ["CHR", 2, "shared", [3]], ["CA", 3, 4, 14], ["CHR", 1, "shared", [4]], ["CA", 2, 5, 14], ["CI", 1], ["FU", 6, [0, 1, 2, 3]], ["AN", 6, 0, 5], ["FU", 6, [1, 2, 3, 4]], ["AN", 6, 1, 4], ["FU", 6, [2, 3, 4, 5]], ["AN", 6, 2, 6], ["FU", 4, [0, 1, 2, 3]], ["SP", 4, 0, 4, [1], 1], ["AN", 4, 1, 2], ["FFSP", 4, 0, [4, 3, 2, 1], 1, 1], ["AN", 4, 1, 6], ["FU", 2, [0, 1, 2, 3]], ["SP", 2, 0, 96, [3], 1], ["AN", 2, 1, 2], ["FFSP", 2, 0, [4, 3, 2, 1], 1, 1], ["AN", 2, 1, 6], ["PR", 5, 0, "auto_unroll_max_step$64"]]]], "r": [[0.876161], 0, 11.4611, 1649178599], "v": "v0.6"}
{"i": [["[\"conv2d_layer\", 128, 1008, 42, 42, 336, 1, 1, 1, \"SAME\"]", "cuda -keys=cuda,gpu -max_num_threads=1024 -thread_warp_size=32", [-1, 16, 64, 49152, 2147483647, 1024, 8, 32], "", 0, []], [[], [["CHW", 3, "local"], ["SP", 3, 0, 128, [1, 1, 1, 2], 1], ["SP", 3, 5, 336, [1, 1, 4, 1], 1], ["SP", 3, 10, 42, [1, 6, 1, 1], 1], ["SP", 3, 15, 42, [1, 7, 1, 2], 1], ["SP", 3, 20, 1008, [2, 2], 1], ["SP", 3, 23, 1, [1, 1], 1], ["SP", 3, 26, 1, [1, 1], 1], ["RE", 3, [0, 5, 10, 15, 1, 6, 11, 16, 2, 7, 12, 17, 20, 23, 26, 21, 24, 27, 3, 8, 13, 18, 22, 25, 28, 4, 9, 14, 19]], ["FSP", 4, 0, 1, 3], ["FSP", 4, 4, 2, 3], ["FSP", 4, 8, 3, 3], ["FSP", 4, 12, 4, 3], ["RE", 4, [0, 4, 8, 12, 1, 5, 9, 13, 2, 6, 10, 14, 3, 7, 11, 15]], ["CA", 3, 4, 11], ["CHR", 2, "shared", [3]], ["CA", 3, 4, 14], ["CHR", 1, "shared", [4]], ["CA", 2, 5, 14], ["CI", 1], ["FU", 6, [0, 1, 2, 3]], ["AN", 6, 0, 5], ["FU", 6, [1, 2, 3, 4]], ["AN", 6, 1, 4], ["FU", 6, [2, 3, 4, 5]], ["AN", 6, 2, 6], ["FU", 4, [0, 1, 2, 3]], ["SP", 4, 0, 16, [1], 1], ["AN", 4, 1, 2], ["FFSP", 4, 0, [4, 3, 2, 1], 1, 1], ["AN", 4, 1, 6], ["FU", 2, [0, 1, 2, 3]], ["SP", 2, 0, 8, [4], 1], ["AN", 2, 1, 2], ["FFSP", 2, 0, [4, 3, 2, 1], 1, 1], ["AN", 2, 1, 6], ["PR", 5, 0, "auto_unroll_max_step$0"]]]], "r": [[0.117098], 0, 6.31462, 1649178605], "v": "v0.6"}
{"i": [["[\"conv2d_layer\", 128, 1008, 42, 42, 336, 1, 1, 1, \"SAME\"]", "cuda -keys=cuda,gpu -max_num_threads=1024 -thread_warp_size=32", [-1, 16, 64, 49152, 2147483647, 1024, 8, 32], "", 0, []], [[], [["CHW", 3, "local"], ["SP", 3, 0, 128, [2, 1, 2, 4], 1], ["SP", 3, 5, 336, [1, 84, 2, 2], 1], ["SP", 3, 10, 42, [1, 1, 2, 1], 1], ["SP", 3, 15, 42, [1, 1, 7, 1], 1], ["SP", 3, 20, 1008, [4, 3], 1], ["SP", 3, 23, 1, [1, 1], 1], ["SP", 3, 26, 1, [1, 1], 1], ["RE", 3, [0, 5, 10, 15, 1, 6, 11, 16, 2, 7, 12, 17, 20, 23, 26, 21, 24, 27, 3, 8, 13, 18, 22, 25, 28, 4, 9, 14, 19]], ["FSP", 4, 0, 1, 3], ["FSP", 4, 4, 2, 3], ["FSP", 4, 8, 3, 3], ["FSP", 4, 12, 4, 3], ["RE", 4, [0, 4, 8, 12, 1, 5, 9, 13, 2, 6, 10, 14, 3, 7, 11, 15]], ["CA", 3, 4, 11], ["CHR", 2, "shared", [3]], ["CA", 3, 4, 14], ["CHR", 1, "shared", [4]], ["CA", 2, 5, 14], ["CI", 1], ["FU", 6, [0, 1, 2, 3]], ["AN", 6, 0, 5], ["FU", 6, [1, 2, 3, 4]], ["AN", 6, 1, 4], ["FU", 6, [2, 3, 4, 5]], ["AN", 6, 2, 6], ["FU", 4, [0, 1, 2, 3]], ["SP", 4, 0, 48, [4], 1], ["AN", 4, 1, 2], ["FFSP", 4, 0, [4, 3, 2, 1], 1, 1], ["AN", 4, 1, 6], ["FU", 2, [0, 1, 2, 3]], ["SP", 2, 0, 1344, [12], 1], ["AN", 2, 1, 2], ["FFSP", 2, 0, [4, 3, 2, 1], 1, 1], ["AN", 2, 1, 6], ["PR", 5, 0, "auto_unroll_max_step$0"]]]], "r": [[0.432103], 0, 8.22394, 1649178611], "v": "v0.6"}
{"i": [["[\"conv2d_layer\", 128, 1008, 42, 42, 336, 1, 1, 1, \"SAME\"]", "cuda -keys=cuda,gpu -max_num_threads=1024 -thread_warp_size=32", [-1, 16, 64, 49152, 2147483647, 1024, 8, 32], "", 0, []], [[], [["CHW", 3, "local"], ["SP", 3, 0, 128, [2, 8, 1, 1], 1], ["SP", 3, 5, 336, [1, 14, 6, 2], 1], ["SP", 3, 10, 42, [1, 1, 1, 2], 1], ["SP", 3, 15, 42, [1, 1, 1, 2], 1], ["SP", 3, 20, 1008, [4, 1], 1], ["SP", 3, 23, 1, [1, 1], 1], ["SP", 3, 26, 1, [1, 1], 1], ["RE", 3, [0, 5, 10, 15, 1, 6, 11, 16, 2, 7, 12, 17, 20, 23, 26, 21, 24, 27, 3, 8, 13, 18, 22, 25, 28, 4, 9, 14, 19]], ["FSP", 4, 0, 1, 3], ["FSP", 4, 4, 2, 3], ["FSP", 4, 8, 3, 3], ["FSP", 4, 12, 4, 3], ["RE", 4, [0, 4, 8, 12, 1, 5, 9, 13, 2, 6, 10, 14, 3, 7, 11, 15]], ["CA", 3, 4, 11], ["CHR", 2, "shared", [3]], ["CA", 3, 4, 14], ["CHR", 1, "shared", [4]], ["CA", 2, 5, 14], ["CI", 1], ["FU", 6, [0, 1, 2, 3]], ["AN", 6, 0, 5], ["FU", 6, [1, 2, 3, 4]], ["AN", 6, 1, 4], ["FU", 6, [2, 3, 4, 5]], ["AN", 6, 2, 6], ["FU", 4, [0, 1, 2, 3]], ["SP", 4, 0, 48, [1], 1], ["AN", 4, 1, 2], ["FFSP", 4, 0, [4, 3, 2, 1], 1, 1], ["AN", 4, 1, 6], ["FU", 2, [0, 1, 2, 3]], ["SP", 2, 0, 56, [1], 1], ["AN", 2, 1, 2], ["FFSP", 2, 0, [4, 3, 2, 1], 1, 1], ["AN", 2, 1, 6], ["PR", 5, 0, "auto_unroll_max_step$512"]]]], "r": [[0.0268889], 0, 5.74053, 1649178626], "v": "v0.6"}
{"i": [["[\"conv2d_layer\", 128, 1008, 42, 42, 336, 1, 1, 1, \"SAME\"]", "cuda -keys=cuda,gpu -max_num_threads=1024 -thread_warp_size=32", [-1, 16, 64, 49152, 2147483647, 1024, 8, 32], "", 0, []], [[], [["CHW", 3, "local"], ["SP", 3, 0, 128, [1, 8, 1, 8], 1], ["SP", 3, 5, 336, [1, 21, 1, 2], 1], ["SP", 3, 10, 42, [1, 3, 1, 1], 1], ["SP", 3, 15, 42, [7, 1, 1, 1], 1], ["SP", 3, 20, 1008, [4, 1], 1], ["SP", 3, 23, 1, [1, 1], 1], ["SP", 3, 26, 1, [1, 1], 1], ["RE", 3, [0, 5, 10, 15, 1, 6, 11, 16, 2, 7, 12, 17, 20, 23, 26, 21, 24, 27, 3, 8, 13, 18, 22, 25, 28, 4, 9, 14, 19]], ["FSP", 4, 0, 1, 3], ["FSP", 4, 4, 2, 3], ["FSP", 4, 8, 3, 3], ["FSP", 4, 12, 4, 3], ["RE", 4, [0, 4, 8, 12, 1, 5, 9, 13, 2, 6, 10, 14, 3, 7, 11, 15]], ["CA", 3, 4, 11], ["CHR", 2, "shared", [3]], ["CA", 3, 4, 14], ["CHR", 1, "shared", [4]], ["CA", 2, 5, 14], ["CI", 1], ["FU", 6, [0, 1, 2, 3]], ["AN", 6, 0, 5], ["FU", 6, [1, 2, 3, 4]], ["AN", 6, 1, 4], ["FU", 6, [2, 3, 4, 5]], ["AN", 6, 2, 6], ["FU", 4, [0, 1, 2, 3]], ["SP", 4, 0, 8, [1], 1], ["AN", 4, 1, 2], ["FFSP", 4, 0, [4, 3, 2, 1], 1, 1], ["AN", 4, 1, 6], ["FU", 2, [0, 1, 2, 3]], ["SP", 2, 0, 16, [4], 1], ["AN", 2, 1, 2], ["FFSP", 2, 0, [4, 3, 2, 1], 1, 1], ["AN", 2, 1, 6], ["PR", 5, 0, "auto_unroll_max_step$512"]]]], "r": [[0.133016], 0, 6.79291, 1649178632], "v": "v0.6"}
{"i": [["[\"conv2d_layer\", 128, 1008, 42, 42, 336, 1, 1, 1, \"SAME\"]", "cuda -keys=cuda,gpu -max_num_threads=1024 -thread_warp_size=32", [-1, 16, 64, 49152, 2147483647, 1024, 8, 32], "", 0, []], [[], [["CHW", 3, "local"], ["SP", 3, 0, 128, [2, 1, 1, 2], 1], ["SP", 3, 5, 336, [1, 84, 1, 4], 1], ["SP", 3, 10, 42, [1, 1, 1, 6], 1], ["SP", 3, 15, 42, [2, 1, 1, 1], 1], ["SP", 3, 20, 1008, [8, 3], 1], ["SP", 3, 23, 1, [1, 1], 1], ["SP", 3, 26, 1, [1, 1], 1], ["RE", 3, [0, 5, 10, 15, 1, 6, 11, 16, 2, 7, 12, 17, 20, 23, 26, 21, 24, 27, 3, 8, 13, 18, 22, 25, 28, 4, 9, 14, 19]], ["FSP", 4, 0, 1, 3], ["FSP", 4, 4, 2, 3], ["FSP", 4, 8, 3, 3], ["FSP", 4, 12, 4, 3], ["RE", 4, [0, 4, 8, 12, 1, 5, 9, 13, 2, 6, 10, 14, 3, 7, 11, 15]], ["CA", 3, 4, 11], ["CHR", 2, "shared", [3]], ["CA", 3, 4, 14], ["CHR", 1, "shared", [4]], ["CA", 2, 5, 14], ["CI", 1], ["FU", 6, [0, 1, 2, 3]], ["AN", 6, 0, 5], ["FU", 6, [1, 2, 3, 4]], ["AN", 6, 1, 4], ["FU", 6, [2, 3, 4, 5]], ["AN", 6, 2, 6], ["FU", 4, [0, 1, 2, 3]], ["SP", 4, 0, 96, [1], 1], ["AN", 4, 1, 2], ["FFSP", 4, 0, [4, 3, 2, 1], 1, 1], ["AN", 4, 1, 6], ["FU", 2, [0, 1, 2, 3]], ["SP", 2, 0, 144, [1], 1], ["AN", 2, 1, 2], ["FFSP", 2, 0, [4, 3, 2, 1], 1, 1], ["AN", 2, 1, 6], ["PR", 5, 0, "auto_unroll_max_step$64"]]]], "r": [[0.0353454], 0, 5.75287, 1649178641], "v": "v0.6"}
{"i": [["[\"conv2d_layer\", 128, 1008, 42, 42, 336, 1, 1, 1, \"SAME\"]", "cuda -keys=cuda,gpu -max_num_threads=1024 -thread_warp_size=32", [-1, 16, 64, 49152, 2147483647, 1024, 8, 32], "", 0, []], [[], [["CHW", 3, "local"], ["SP", 3, 0, 128, [1, 4, 1, 1], 1], ["SP", 3, 5, 336, [2, 14, 1, 3], 1], ["SP", 3, 10, 42, [1, 1, 1, 42], 1], ["SP", 3, 15, 42, [1, 1, 2, 3], 1], ["SP", 3, 20, 1008, [1, 6], 1], ["SP", 3, 23, 1, [1, 1], 1], ["SP", 3, 26, 1, [1, 1], 1], ["RE", 3, [0, 5, 10, 15, 1, 6, 11, 16, 2, 7, 12, 17, 20, 23, 26, 21, 24, 27, 3, 8, 13, 18, 22, 25, 28, 4, 9, 14, 19]], ["FSP", 4, 0, 1, 3], ["FSP", 4, 4, 2, 3], ["FSP", 4, 8, 3, 3], ["FSP", 4, 12, 4, 3], ["RE", 4, [0, 4, 8, 12, 1, 5, 9, 13, 2, 6, 10, 14, 3, 7, 11, 15]], ["CA", 3, 4, 11], ["CHR", 2, "shared", [3]], ["CA", 3, 4, 14], ["CHR", 1, "shared", [4]], ["CA", 2, 5, 14], ["CI", 1], ["FU", 6, [0, 1, 2, 3]], ["AN", 6, 0, 5], ["FU", 6, [1, 2, 3, 4]], ["AN", 6, 1, 4], ["FU", 6, [2, 3, 4, 5]], ["AN", 6, 2, 6], ["FU", 4, [0, 1, 2, 3]], ["SP", 4, 0, 18, [1], 1], ["AN", 4, 1, 2], ["FFSP", 4, 0, [4, 3, 2, 1], 1, 1], ["AN", 4, 1, 6], ["FU", 2, [0, 1, 2, 3]], ["SP", 2, 0, 252, [1], 1], ["AN", 2, 1, 2], ["FFSP", 2, 0, [4, 3, 2, 1], 1, 1], ["AN", 2, 1, 6], ["PR", 5, 0, "auto_unroll_max_step$0"]]]], "r": [[0.971543], 0, 10.482, 1649178650], "v": "v0.6"}
{"i": [["[\"conv2d_layer\", 128, 1008, 42, 42, 336, 1, 1, 1, \"SAME\"]", "cuda -keys=cuda,gpu -max_num_threads=1024 -thread_warp_size=32", [-1, 16, 64, 49152, 2147483647, 1024, 8, 32], "", 0, []], [[], [["CHW", 3, "local"], ["SP", 3, 0, 128, [2, 1, 1, 1], 1], ["SP", 3, 5, 336, [1, 6, 2, 14], 1], ["SP", 3, 10, 42, [1, 21, 1, 2], 1], ["SP", 3, 15, 42, [1, 3, 7, 2], 1], ["SP", 3, 20, 1008, [3, 1], 1], ["SP", 3, 23, 1, [1, 1], 1], ["SP", 3, 26, 1, [1, 1], 1], ["RE", 3, [0, 5, 10, 15, 1, 6, 11, 16, 2, 7, 12, 17, 20, 23, 26, 21, 24, 27, 3, 8, 13, 18, 22, 25, 28, 4, 9, 14, 19]], ["FSP", 4, 0, 1, 3], ["FSP", 4, 4, 2, 3], ["FSP", 4, 8, 3, 3], ["FSP", 4, 12, 4, 3], ["RE", 4, [0, 4, 8, 12, 1, 5, 9, 13, 2, 6, 10, 14, 3, 7, 11, 15]], ["CA", 3, 4, 11], ["CHR", 2, "shared", [3]], ["CA", 3, 4, 14], ["CHR", 1, "shared", [4]], ["CA", 2, 5, 14], ["CI", 1], ["FU", 6, [0, 1, 2, 3]], ["AN", 6, 0, 5], ["FU", 6, [1, 2, 3, 4]], ["AN", 6, 1, 4], ["FU", 6, [2, 3, 4, 5]], ["AN", 6, 2, 6], ["FU", 4, [0, 1, 2, 3]], ["SP", 4, 0, 84, [28], 1], ["AN", 4, 1, 2], ["FFSP", 4, 0, [4, 3, 2, 1], 1, 1], ["AN", 4, 1, 6], ["FU", 2, [0, 1, 2, 3]], ["SP", 2, 0, 84, [1], 1], ["AN", 2, 1, 2], ["FFSP", 2, 0, [4, 3, 2, 1], 1, 1], ["AN", 2, 1, 6], ["PR", 5, 0, "auto_unroll_max_step$1024"]]]], "r": [[0.84763], 0, 17.2577, 1649178659], "v": "v0.6"}
{"i": [["[\"conv2d_layer\", 128, 1008, 42, 42, 336, 1, 1, 1, \"SAME\"]", "cuda -keys=cuda,gpu -max_num_threads=1024 -thread_warp_size=32", [-1, 16, 64, 49152, 2147483647, 1024, 8, 32], "", 0, []], [[], [["CHW", 3, "local"], ["SP", 3, 0, 128, [1, 1, 1, 2], 1], ["SP", 3, 5, 336, [1, 1, 16, 1], 1], ["SP", 3, 10, 42, [1, 6, 1, 1], 1], ["SP", 3, 15, 42, [1, 7, 1, 1], 1], ["SP", 3, 20, 1008, [2, 2], 1], ["SP", 3, 23, 1, [1, 1], 1], ["SP", 3, 26, 1, [1, 1], 1], ["RE", 3, [0, 5, 10, 15, 1, 6, 11, 16, 2, 7, 12, 17, 20, 23, 26, 21, 24, 27, 3, 8, 13, 18, 22, 25, 28, 4, 9, 14, 19]], ["FSP", 4, 0, 1, 3], ["FSP", 4, 4, 2, 3], ["FSP", 4, 8, 3, 3], ["FSP", 4, 12, 4, 3], ["RE", 4, [0, 4, 8, 12, 1, 5, 9, 13, 2, 6, 10, 14, 3, 7, 11, 15]], ["CA", 3, 4, 11], ["CHR", 2, "shared", [3]], ["CA", 3, 4, 14], ["CHR", 1, "shared", [4]], ["CA", 2, 5, 14], ["CI", 1], ["FU", 6, [0, 1, 2, 3]], ["AN", 6, 0, 5], ["FU", 6, [1, 2, 3, 4]], ["AN", 6, 1, 4], ["FU", 6, [2, 3, 4, 5]], ["AN", 6, 2, 6], ["FU", 4, [0, 1, 2, 3]], ["SP", 4, 0, 16, [16], 1], ["AN", 4, 1, 2], ["FFSP", 4, 0, [4, 3, 2, 1], 1, 1], ["AN", 4, 1, 6], ["FU", 2, [0, 1, 2, 3]], ["SP", 2, 0, 8, [1], 1], ["AN", 2, 1, 2], ["FFSP", 2, 0, [4, 3, 2, 1], 1, 1], ["AN", 2, 1, 6], ["PR", 5, 0, "auto_unroll_max_step$0"]]]], "r": [[0.0568061], 0, 5.46535, 1649178674], "v": "v0.6"}
{"i": [["[\"conv2d_layer\", 128, 1008, 42, 42, 336, 1, 1, 1, \"SAME\"]", "cuda -keys=cuda,gpu -max_num_threads=1024 -thread_warp_size=32", [-1, 16, 64, 49152, 2147483647, 1024, 8, 32], "", 0, []], [[], [["CHW", 3, "local"], ["SP", 3, 0, 128, [2, 1, 1, 2], 1], ["SP", 3, 5, 336, [1, 84, 1, 4], 1], ["SP", 3, 10, 42, [1, 1, 1, 1], 1], ["SP", 3, 15, 42, [2, 1, 1, 1], 1], ["SP", 3, 20, 1008, [8, 3], 1], ["SP", 3, 23, 1, [1, 1], 1], ["SP", 3, 26, 1, [1, 1], 1], ["RE", 3, [0, 5, 10, 15, 1, 6, 11, 16, 2, 7, 12, 17, 20, 23, 26, 21, 24, 27, 3, 8, 13, 18, 22, 25, 28, 4, 9, 14, 19]], ["FSP", 4, 0, 1, 3], ["FSP", 4, 4, 2, 3], ["FSP", 4, 8, 3, 3], ["FSP", 4, 12, 4, 3], ["RE", 4, [0, 4, 8, 12, 1, 5, 9, 13, 2, 6, 10, 14, 3, 7, 11, 15]], ["CA", 3, 4, 11], ["CHR", 2, "shared", [3]], ["CA", 3, 4, 14], ["CHR", 1, "shared", [4]], ["CA", 2, 5, 14], ["CI", 1], ["FU", 6, [0, 1, 2, 3]], ["AN", 6, 0, 5], ["FU", 6, [1, 2, 3, 4]], ["AN", 6, 1, 4], ["FU", 6, [2, 3, 4, 5]], ["AN", 6, 2, 6], ["FU", 4, [0, 1, 2, 3]], ["SP", 4, 0, 96, [1], 1], ["AN", 4, 1, 2], ["FFSP", 4, 0, [4, 3, 2, 1], 1, 1], ["AN", 4, 1, 6], ["FU", 2, [0, 1, 2, 3]], ["SP", 2, 0, 144, [1], 1], ["AN", 2, 1, 2], ["FFSP", 2, 0, [4, 3, 2, 1], 1, 1], ["AN", 2, 1, 6], ["PR", 5, 0, "auto_unroll_max_step$16"]]]], "r": [[0.0670019], 0, 5.93274, 1649178679], "v": "v0.6"}
{"i": [["[\"conv2d_layer\", 128, 1008, 42, 42, 336, 1, 1, 1, \"SAME\"]", "cuda -keys=cuda,gpu -max_num_threads=1024 -thread_warp_size=32", [-1, 16, 64, 49152, 2147483647, 1024, 8, 32], "", 0, []], [[], [["CHW", 3, "local"], ["SP", 3, 0, 128, [1, 1, 2, 1], 1], ["SP", 3, 5, 336, [2, 14, 2, 2], 1], ["SP", 3, 10, 42, [3, 7, 1, 1], 1], ["SP", 3, 15, 42, [1, 1, 1, 1], 1], ["SP", 3, 20, 1008, [6, 1], 1], ["SP", 3, 23, 1, [1, 1], 1], ["SP", 3, 26, 1, [1, 1], 1], ["RE", 3, [0, 5, 10, 15, 1, 6, 11, 16, 2, 7, 12, 17, 20, 23, 26, 21, 24, 27, 3, 8, 13, 18, 22, 25, 28, 4, 9, 14, 19]], ["FSP", 4, 0, 1, 3], ["FSP", 4, 4, 2, 3], ["FSP", 4, 8, 3, 3], ["FSP", 4, 12, 4, 3], ["RE", 4, [0, 4, 8, 12, 1, 5, 9, 13, 2, 6, 10, 14, 3, 7, 11, 15]], ["CA", 3, 4, 11], ["CHR", 2, "shared", [3]], ["CA", 3, 4, 14], ["CHR", 1, "shared", [4]], ["CA", 2, 5, 14], ["CI", 1], ["FU", 6, [0, 1, 2, 3]], ["AN", 6, 0, 5], ["FU", 6, [1, 2, 3, 4]], ["AN", 6, 1, 4], ["FU", 6, [2, 3, 4, 5]], ["AN", 6, 2, 6], ["FU", 4, [0, 1, 2, 3]], ["SP", 4, 0, 144, [1], 1], ["AN", 4, 1, 2], ["FFSP", 4, 0, [4, 3, 2, 1], 1, 1], ["AN", 4, 1, 6], ["FU", 2, [0, 1, 2, 3]], ["SP", 2, 0, 144, [1], 1], ["AN", 2, 1, 2], ["FFSP", 2, 0, [4, 3, 2, 1], 1, 1], ["AN", 2, 1, 6], ["PR", 5, 0, "auto_unroll_max_step$16"]]]], "r": [[0.0372537], 0, 6.04776, 1649178685], "v": "v0.6"}
{"i": [["[\"conv2d_layer\", 128, 1008, 42, 42, 336, 1, 1, 1, \"SAME\"]", "cuda -keys=cuda,gpu -max_num_threads=1024 -thread_warp_size=32", [-1, 16, 64, 49152, 2147483647, 1024, 8, 32], "", 0, []], [[], [["CHW", 3, "local"], ["SP", 3, 0, 128, [1, 2, 2, 1], 1], ["SP", 3, 5, 336, [1, 21, 1, 8], 1], ["SP", 3, 10, 42, [1, 2, 1, 1], 1], ["SP", 3, 15, 42, [7, 1, 2, 1], 1], ["SP", 3, 20, 1008, [2, 14], 1], ["SP", 3, 23, 1, [1, 1], 1], ["SP", 3, 26, 1, [1, 1], 1], ["RE", 3, [0, 5, 10, 15, 1, 6, 11, 16, 2, 7, 12, 17, 20, 23, 26, 21, 24, 27, 3, 8, 13, 18, 22, 25, 28, 4, 9, 14, 19]], ["FSP", 4, 0, 1, 3], ["FSP", 4, 4, 2, 3], ["FSP", 4, 8, 3, 3], ["FSP", 4, 12, 4, 3], ["RE", 4, [0, 4, 8, 12, 1, 5, 9, 13, 2, 6, 10, 14, 3, 7, 11, 15]], ["CA", 3, 4, 11], ["CHR", 2, "shared", [3]], ["CA", 3, 4, 14], ["CHR", 1, "shared", [4]], ["CA", 2, 5, 14], ["CI", 1], ["FU", 6, [0, 1, 2, 3]], ["AN", 6, 0, 5], ["FU", 6, [1, 2, 3, 4]], ["AN", 6, 1, 4], ["FU", 6, [2, 3, 4, 5]], ["AN", 6, 2, 6], ["FU", 4, [0, 1, 2, 3]], ["SP", 4, 0, 224, [16], 1], ["AN", 4, 1, 2], ["FFSP", 4, 0, [4, 3, 2, 1], 1, 1], ["AN", 4, 1, 6], ["FU", 2, [0, 1, 2, 3]], ["SP", 2, 0, 112, [7], 1], ["AN", 2, 1, 2], ["FFSP", 2, 0, [4, 3, 2, 1], 1, 1], ["AN", 2, 1, 6], ["PR", 5, 0, "auto_unroll_max_step$512"]]]], "r": [[0.0691882], 0, 7.46374, 1649178690], "v": "v0.6"}
{"i": [["[\"conv2d_layer\", 128, 1008, 42, 42, 336, 1, 1, 1, \"SAME\"]", "cuda -keys=cuda,gpu -max_num_threads=1024 -thread_warp_size=32", [-1, 16, 64, 49152, 2147483647, 1024, 8, 32], "", 0, []], [[], [["CHW", 3, "local"], ["SP", 3, 0, 128, [1, 1, 2, 1], 1], ["SP", 3, 5, 336, [1, 6, 1, 4], 1], ["SP", 3, 10, 42, [1, 2, 1, 1], 1], ["SP", 3, 15, 42, [1, 6, 1, 1], 1], ["SP", 3, 20, 1008, [8, 7], 1], ["SP", 3, 23, 1, [1, 1], 1], ["SP", 3, 26, 1, [1, 1], 1], ["RE", 3, [0, 5, 10, 15, 1, 6, 11, 16, 2, 7, 12, 17, 20, 23, 26, 21, 24, 27, 3, 8, 13, 18, 22, 25, 28, 4, 9, 14, 19]], ["FSP", 4, 0, 1, 3], ["FSP", 4, 4, 2, 3], ["FSP", 4, 8, 3, 3], ["FSP", 4, 12, 4, 3], ["RE", 4, [0, 4, 8, 12, 1, 5, 9, 13, 2, 6, 10, 14, 3, 7, 11, 15]], ["CA", 3, 4, 11], ["CHR", 2, "shared", [3]], ["CA", 3, 4, 14], ["CHR", 1, "shared", [4]], ["CA", 2, 5, 14], ["CI", 1], ["FU", 6, [0, 1, 2, 3]], ["AN", 6, 0, 5], ["FU", 6, [1, 2, 3, 4]], ["AN", 6, 1, 4], ["FU", 6, [2, 3, 4, 5]], ["AN", 6, 2, 6], ["FU", 4, [0, 1, 2, 3]], ["SP", 4, 0, 224, [7], 1], ["AN", 4, 1, 2], ["FFSP", 4, 0, [4, 3, 2, 1], 1, 1], ["AN", 4, 1, 6], ["FU", 2, [0, 1, 2, 3]], ["SP", 2, 0, 112, [7], 1], ["AN", 2, 1, 2], ["FFSP", 2, 0, [4, 3, 2, 1], 1, 1], ["AN", 2, 1, 6], ["PR", 5, 0, "auto_unroll_max_step$1024"]]]], "r": [[0.0419983], 0, 7.16855, 1649178705], "v": "v0.6"}
{"i": [["[\"conv2d_layer\", 128, 1008, 42, 42, 336, 1, 1, 1, \"SAME\"]", "cuda -keys=cuda,gpu -max_num_threads=1024 -thread_warp_size=32", [-1, 16, 64, 49152, 2147483647, 1024, 8, 32], "", 0, []], [[], [["CHW", 3, "local"], ["SP", 3, 0, 128, [1, 4, 1, 1], 1], ["SP", 3, 5, 336, [2, 14, 1, 3], 1], ["SP", 3, 10, 42, [1, 6, 1, 7], 1], ["SP", 3, 15, 42, [1, 1, 2, 3], 1], ["SP", 3, 20, 1008, [1, 3], 1], ["SP", 3, 23, 1, [1, 1], 1], ["SP", 3, 26, 1, [1, 1], 1], ["RE", 3, [0, 5, 10, 15, 1, 6, 11, 16, 2, 7, 12, 17, 20, 23, 26, 21, 24, 27, 3, 8, 13, 18, 22, 25, 28, 4, 9, 14, 19]], ["FSP", 4, 0, 1, 3], ["FSP", 4, 4, 2, 3], ["FSP", 4, 8, 3, 3], ["FSP", 4, 12, 4, 3], ["RE", 4, [0, 4, 8, 12, 1, 5, 9, 13, 2, 6, 10, 14, 3, 7, 11, 15]], ["CA", 3, 4, 11], ["CHR", 2, "shared", [3]], ["CA", 3, 4, 14], ["CHR", 1, "shared", [4]], ["CA", 2, 5, 14], ["CI", 1], ["FU", 6, [0, 1, 2, 3]], ["AN", 6, 0, 5], ["FU", 6, [1, 2, 3, 4]], ["AN", 6, 1, 4], ["FU", 6, [2, 3, 4, 5]], ["AN", 6, 2, 6], ["FU", 4, [0, 1, 2, 3]], ["SP", 4, 0, 18, [3], 1], ["AN", 4, 1, 2], ["FFSP", 4, 0, [4, 3, 2, 1], 1, 1], ["AN", 4, 1, 6], ["FU", 2, [0, 1, 2, 3]], ["SP", 2, 0, 252, [63], 1], ["AN", 2, 1, 2], ["FFSP", 2, 0, [4, 3, 2, 1], 1, 1], ["AN", 2, 1, 6], ["PR", 5, 0, "auto_unroll_max_step$0"]]]], "r": [[0.310407], 0, 7.88176, 1649178711], "v": "v0.6"}
{"i": [["[\"conv2d_layer\", 128, 1008, 42, 42, 336, 1, 1, 1, \"SAME\"]", "cuda -keys=cuda,gpu -max_num_threads=1024 -thread_warp_size=32", [-1, 16, 64, 49152, 2147483647, 1024, 8, 32], "", 0, []], [[], [["CHW", 3, "local"], ["SP", 3, 0, 128, [1, 4, 2, 1], 1], ["SP", 3, 5, 336, [1, 56, 1, 6], 1], ["SP", 3, 10, 42, [1, 1, 1, 21], 1], ["SP", 3, 15, 42, [3, 1, 1, 2], 1], ["SP", 3, 20, 1008, [3, 1], 1], ["SP", 3, 23, 1, [1, 1], 1], ["SP", 3, 26, 1, [1, 1], 1], ["RE", 3, [0, 5, 10, 15, 1, 6, 11, 16, 2, 7, 12, 17, 20, 23, 26, 21, 24, 27, 3, 8, 13, 18, 22, 25, 28, 4, 9, 14, 19]], ["FSP", 4, 0, 1, 3], ["FSP", 4, 4, 2, 3], ["FSP", 4, 8, 3, 3], ["FSP", 4, 12, 4, 3], ["RE", 4, [0, 4, 8, 12, 1, 5, 9, 13, 2, 6, 10, 14, 3, 7, 11, 15]], ["CA", 3, 4, 11], ["CHR", 2, "shared", [3]], ["CA", 3, 4, 14], ["CHR", 1, "shared", [4]], ["CA", 2, 5, 14], ["CI", 1], ["FU", 6, [0, 1, 2, 3]], ["AN", 6, 0, 5], ["FU", 6, [1, 2, 3, 4]], ["AN", 6, 1, 4], ["FU", 6, [2, 3, 4, 5]], ["AN", 6, 2, 6], ["FU", 4, [0, 1, 2, 3]], ["SP", 4, 0, 18, [1], 1], ["AN", 4, 1, 2], ["FFSP", 4, 0, [4, 3, 2, 1], 1, 1], ["AN", 4, 1, 6], ["FU", 2, [0, 1, 2, 3]], ["SP", 2, 0, 252, [21], 1], ["AN", 2, 1, 2], ["FFSP", 2, 0, [4, 3, 2, 1], 1, 1], ["AN", 2, 1, 6], ["PR", 5, 0, "auto_unroll_max_step$64"]]]], "r": [[0.819605], 0, 11.7179, 1649178731], "v": "v0.6"}
{"i": [["[\"conv2d_layer\", 128, 1008, 42, 42, 336, 1, 1, 1, \"SAME\"]", "cuda -keys=cuda,gpu -max_num_threads=1024 -thread_warp_size=32", [-1, 16, 64, 49152, 2147483647, 1024, 8, 32], "", 0, []], [[], [["CHW", 3, "local"], ["SP", 3, 0, 128, [1, 4, 1, 1], 1], ["SP", 3, 5, 336, [2, 14, 1, 3], 1], ["SP", 3, 10, 42, [1, 6, 1, 7], 1], ["SP", 3, 15, 42, [1, 1, 2, 3], 1], ["SP", 3, 20, 1008, [1, 6], 1], ["SP", 3, 23, 1, [1, 1], 1], ["SP", 3, 26, 1, [1, 1], 1], ["RE", 3, [0, 5, 10, 15, 1, 6, 11, 16, 2, 7, 12, 17, 20, 23, 26, 21, 24, 27, 3, 8, 13, 18, 22, 25, 28, 4, 9, 14, 19]], ["FSP", 4, 0, 1, 3], ["FSP", 4, 4, 2, 3], ["FSP", 4, 8, 3, 3], ["FSP", 4, 12, 4, 3], ["RE", 4, [0, 4, 8, 12, 1, 5, 9, 13, 2, 6, 10, 14, 3, 7, 11, 15]], ["CA", 3, 4, 11], ["CHR", 2, "shared", [3]], ["CA", 3, 4, 14], ["CHR", 1, "shared", [4]], ["CA", 2, 5, 14], ["CI", 1], ["FU", 6, [0, 1, 2, 3]], ["AN", 6, 0, 5], ["FU", 6, [1, 2, 3, 4]], ["AN", 6, 1, 4], ["FU", 6, [2, 3, 4, 5]], ["AN", 6, 2, 6], ["FU", 4, [0, 1, 2, 3]], ["SP", 4, 0, 18, [3], 1], ["AN", 4, 1, 2], ["FFSP", 4, 0, [4, 3, 2, 1], 1, 1], ["AN", 4, 1, 6], ["FU", 2, [0, 1, 2, 3]], ["SP", 2, 0, 252, [21], 1], ["AN", 2, 1, 2], ["FFSP", 2, 0, [4, 3, 2, 1], 1, 1], ["AN", 2, 1, 6], ["PR", 5, 0, "auto_unroll_max_step$0"]]]], "r": [[0.170096], 0, 7.00656, 1649178757], "v": "v0.6"}
{"i": [["[\"conv2d_layer\", 128, 1008, 42, 42, 336, 1, 1, 1, \"SAME\"]", "cuda -keys=cuda,gpu -max_num_threads=1024 -thread_warp_size=32", [-1, 16, 64, 49152, 2147483647, 1024, 8, 32], "", 0, []], [[], [["CHW", 3, "local"], ["SP", 3, 0, 128, [1, 4, 1, 1], 1], ["SP", 3, 5, 336, [2, 14, 1, 3], 1], ["SP", 3, 10, 42, [1, 6, 1, 7], 1], ["SP", 3, 15, 42, [1, 1, 2, 3], 1], ["SP", 3, 20, 1008, [1, 6], 1], ["SP", 3, 23, 1, [1, 1], 1], ["SP", 3, 26, 1, [1, 1], 1], ["RE", 3, [0, 5, 10, 15, 1, 6, 11, 16, 2, 7, 12, 17, 20, 23, 26, 21, 24, 27, 3, 8, 13, 18, 22, 25, 28, 4, 9, 14, 19]], ["FSP", 4, 0, 1, 3], ["FSP", 4, 4, 2, 3], ["FSP", 4, 8, 3, 3], ["FSP", 4, 12, 4, 3], ["RE", 4, [0, 4, 8, 12, 1, 5, 9, 13, 2, 6, 10, 14, 3, 7, 11, 15]], ["CA", 3, 4, 11], ["CHR", 2, "shared", [3]], ["CA", 3, 4, 14], ["CHR", 1, "shared", [4]], ["CA", 2, 5, 14], ["CI", 1], ["FU", 6, [0, 1, 2, 3]], ["AN", 6, 0, 5], ["FU", 6, [1, 2, 3, 4]], ["AN", 6, 1, 4], ["FU", 6, [2, 3, 4, 5]], ["AN", 6, 2, 6], ["FU", 4, [0, 1, 2, 3]], ["SP", 4, 0, 18, [1], 1], ["AN", 4, 1, 2], ["FFSP", 4, 0, [4, 3, 2, 1], 1, 1], ["AN", 4, 1, 6], ["FU", 2, [0, 1, 2, 3]], ["SP", 2, 0, 252, [1], 1], ["AN", 2, 1, 2], ["FFSP", 2, 0, [4, 3, 2, 1], 1, 1], ["AN", 2, 1, 6], ["PR", 5, 0, "auto_unroll_max_step$512"]]]], "r": [[0.852563], 0, 10.7114, 1649178765], "v": "v0.6"}
{"i": [["[\"conv2d_layer\", 128, 1008, 42, 42, 336, 1, 1, 1, \"SAME\"]", "cuda -keys=cuda,gpu -max_num_threads=1024 -thread_warp_size=32", [-1, 16, 64, 49152, 2147483647, 1024, 8, 32], "", 0, []], [[], [["CHW", 3, "local"], ["SP", 3, 0, 128, [1, 1, 2, 1], 1], ["SP", 3, 5, 336, [2, 14, 2, 2], 1], ["SP", 3, 10, 42, [3, 7, 1, 1], 1], ["SP", 3, 15, 42, [1, 2, 1, 1], 1], ["SP", 3, 20, 1008, [6, 6], 1], ["SP", 3, 23, 1, [1, 1], 1], ["SP", 3, 26, 1, [1, 1], 1], ["RE", 3, [0, 5, 10, 15, 1, 6, 11, 16, 2, 7, 12, 17, 20, 23, 26, 21, 24, 27, 3, 8, 13, 18, 22, 25, 28, 4, 9, 14, 19]], ["FSP", 4, 0, 1, 3], ["FSP", 4, 4, 2, 3], ["FSP", 4, 8, 3, 3], ["FSP", 4, 12, 4, 3], ["RE", 4, [0, 4, 8, 12, 1, 5, 9, 13, 2, 6, 10, 14, 3, 7, 11, 15]], ["CA", 3, 4, 11], ["CHR", 2, "shared", [3]], ["CA", 3, 4, 14], ["CHR", 1, "shared", [4]], ["CA", 2, 5, 14], ["CI", 1], ["FU", 6, [0, 1, 2, 3]], ["AN", 6, 0, 5], ["FU", 6, [1, 2, 3, 4]], ["AN", 6, 1, 4], ["FU", 6, [2, 3, 4, 5]], ["AN", 6, 2, 6], ["FU", 4, [0, 1, 2, 3]], ["SP", 4, 0, 144, [1], 1], ["AN", 4, 1, 2], ["FFSP", 4, 0, [4, 3, 2, 1], 1, 1], ["AN", 4, 1, 6], ["FU", 2, [0, 1, 2, 3]], ["SP", 2, 0, 144, [2], 1], ["AN", 2, 1, 2], ["FFSP", 2, 0, [4, 3, 2, 1], 1, 1], ["AN", 2, 1, 6], ["PR", 5, 0, "auto_unroll_max_step$16"]]]], "r": [[0.0278627], 0, 6.25611, 1649178770], "v": "v0.6"}
{"i": [["[\"conv2d_layer\", 128, 1008, 42, 42, 336, 1, 1, 1, \"SAME\"]", "cuda -keys=cuda,gpu -max_num_threads=1024 -thread_warp_size=32", [-1, 16, 64, 49152, 2147483647, 1024, 8, 32], "", 0, []], [[], [["CHW", 3, "local"], ["SP", 3, 0, 128, [1, 1, 4, 4], 1], ["SP", 3, 5, 336, [1, 42, 4, 2], 1], ["SP", 3, 10, 42, [1, 7, 1, 1], 1], ["SP", 3, 15, 42, [1, 1, 1, 3], 1], ["SP", 3, 20, 1008, [2, 6], 1], ["SP", 3, 23, 1, [1, 1], 1], ["SP", 3, 26, 1, [1, 1], 1], ["RE", 3, [0, 5, 10, 15, 1, 6, 11, 16, 2, 7, 12, 17, 20, 23, 26, 21, 24, 27, 3, 8, 13, 18, 22, 25, 28, 4, 9, 14, 19]], ["FSP", 4, 0, 1, 3], ["FSP", 4, 4, 2, 3], ["FSP", 4, 8, 3, 3], ["FSP", 4, 12, 4, 3], ["RE", 4, [0, 4, 8, 12, 1, 5, 9, 13, 2, 6, 10, 14, 3, 7, 11, 15]], ["CA", 3, 4, 11], ["CHR", 2, "shared", [3]], ["CA", 3, 4, 14], ["CHR", 1, "shared", [4]], ["CA", 2, 5, 14], ["CI", 1], ["FU", 6, [0, 1, 2, 3]], ["AN", 6, 0, 5], ["FU", 6, [1, 2, 3, 4]], ["AN", 6, 1, 4], ["FU", 6, [2, 3, 4, 5]], ["AN", 6, 2, 6], ["FU", 4, [0, 1, 2, 3]], ["SP", 4, 0, 96, [1], 1], ["AN", 4, 1, 2], ["FFSP", 4, 0, [4, 3, 2, 1], 1, 1], ["AN", 4, 1, 6], ["FU", 2, [0, 1, 2, 3]], ["SP", 2, 0, 576, [8], 1], ["AN", 2, 1, 2], ["FFSP", 2, 0, [4, 3, 2, 1], 1, 1], ["AN", 2, 1, 6], ["PR", 5, 0, "auto_unroll_max_step$16"]]]], "r": [[0.165526], 0, 6.20038, 1649178785], "v": "v0.6"}
{"i": [["[\"conv2d_layer\", 128, 1008, 42, 42, 336, 1, 1, 1, \"SAME\"]", "cuda -keys=cuda,gpu -max_num_threads=1024 -thread_warp_size=32", [-1, 16, 64, 49152, 2147483647, 1024, 8, 32], "", 0, []], [[], [["CHW", 3, "local"], ["SP", 3, 0, 128, [1, 1, 1, 1], 1], ["SP", 3, 5, 336, [2, 14, 1, 3], 1], ["SP", 3, 10, 42, [1, 6, 1, 1], 1], ["SP", 3, 15, 42, [1, 1, 2, 3], 1], ["SP", 3, 20, 1008, [1, 6], 1], ["SP", 3, 23, 1, [1, 1], 1], ["SP", 3, 26, 1, [1, 1], 1], ["RE", 3, [0, 5, 10, 15, 1, 6, 11, 16, 2, 7, 12, 17, 20, 23, 26, 21, 24, 27, 3, 8, 13, 18, 22, 25, 28, 4, 9, 14, 19]], ["FSP", 4, 0, 1, 3], ["FSP", 4, 4, 2, 3], ["FSP", 4, 8, 3, 3], ["FSP", 4, 12, 4, 3], ["RE", 4, [0, 4, 8, 12, 1, 5, 9, 13, 2, 6, 10, 14, 3, 7, 11, 15]], ["CA", 3, 4, 11], ["CHR", 2, "shared", [3]], ["CA", 3, 4, 14], ["CHR", 1, "shared", [4]], ["CA", 2, 5, 14], ["CI", 1], ["FU", 6, [0, 1, 2, 3]], ["AN", 6, 0, 5], ["FU", 6, [1, 2, 3, 4]], ["AN", 6, 1, 4], ["FU", 6, [2, 3, 4, 5]], ["AN", 6, 2, 6], ["FU", 4, [0, 1, 2, 3]], ["SP", 4, 0, 18, [1], 1], ["AN", 4, 1, 2], ["FFSP", 4, 0, [4, 3, 2, 1], 1, 1], ["AN", 4, 1, 6], ["FU", 2, [0, 1, 2, 3]], ["SP", 2, 0, 252, [1], 1], ["AN", 2, 1, 2], ["FFSP", 2, 0, [4, 3, 2, 1], 1, 1], ["AN", 2, 1, 6], ["PR", 5, 0, "auto_unroll_max_step$0"]]]], "r": [[0.019495], 0, 5.01385, 1649178789], "v": "v0.6"}
{"i": [["[\"conv2d_layer\", 128, 1008, 42, 42, 336, 1, 1, 1, \"SAME\"]", "cuda -keys=cuda,gpu -max_num_threads=1024 -thread_warp_size=32", [-1, 16, 64, 49152, 2147483647, 1024, 8, 32], "", 0, []], [[], [["CHW", 3, "local"], ["SP", 3, 0, 128, [2, 1, 1, 1], 1], ["SP", 3, 5, 336, [1, 6, 2, 14], 1], ["SP", 3, 10, 42, [1, 21, 1, 2], 1], ["SP", 3, 15, 42, [1, 3, 7, 2], 1], ["SP", 3, 20, 1008, [3, 1], 1], ["SP", 3, 23, 1, [1, 1], 1], ["SP", 3, 26, 1, [1, 1], 1], ["RE", 3, [0, 5, 10, 15, 1, 6, 11, 16, 2, 7, 12, 17, 20, 23, 26, 21, 24, 27, 3, 8, 13, 18, 22, 25, 28, 4, 9, 14, 19]], ["FSP", 4, 0, 1, 3], ["FSP", 4, 4, 2, 3], ["FSP", 4, 8, 3, 3], ["FSP", 4, 12, 4, 3], ["RE", 4, [0, 4, 8, 12, 1, 5, 9, 13, 2, 6, 10, 14, 3, 7, 11, 15]], ["CA", 3, 4, 11], ["CHR", 2, "shared", [3]], ["CA", 3, 4, 14], ["CHR", 1, "shared", [4]], ["CA", 2, 5, 14], ["CI", 1], ["FU", 6, [0, 1, 2, 3]], ["AN", 6, 0, 5], ["FU", 6, [1, 2, 3, 4]], ["AN", 6, 1, 4], ["FU", 6, [2, 3, 4, 5]], ["AN", 6, 2, 6], ["FU", 4, [0, 1, 2, 3]], ["SP", 4, 0, 84, [2], 1], ["AN", 4, 1, 2], ["FFSP", 4, 0, [4, 3, 2, 1], 1, 1], ["AN", 4, 1, 6], ["FU", 2, [0, 1, 2, 3]], ["SP", 2, 0, 84, [1], 1], ["AN", 2, 1, 2], ["FFSP", 2, 0, [4, 3, 2, 1], 1, 1], ["AN", 2, 1, 6], ["PR", 5, 0, "auto_unroll_max_step$1024"]]]], "r": [[0.847129], 0, 15.2056, 1649178798], "v": "v0.6"}
{"i": [["[\"conv2d_layer\", 128, 1008, 42, 42, 336, 1, 1, 1, \"SAME\"]", "cuda -keys=cuda,gpu -max_num_threads=1024 -thread_warp_size=32", [-1, 16, 64, 49152, 2147483647, 1024, 8, 32], "", 0, []], [[], [["CHW", 3, "local"], ["SP", 3, 0, 128, [1, 1, 1, 1], 1], ["SP", 3, 5, 336, [1, 2, 3, 56], 1], ["SP", 3, 10, 42, [1, 42, 1, 1], 1], ["SP", 3, 15, 42, [1, 1, 1, 2], 1], ["SP", 3, 20, 1008, [1, 18], 1], ["SP", 3, 23, 1, [1, 1], 1], ["SP", 3, 26, 1, [1, 1], 1], ["RE", 3, [0, 5, 10, 15, 1, 6, 11, 16, 2, 7, 12, 17, 20, 23, 26, 21, 24, 27, 3, 8, 13, 18, 22, 25, 28, 4, 9, 14, 19]], ["FSP", 4, 0, 1, 3], ["FSP", 4, 4, 2, 3], ["FSP", 4, 8, 3, 3], ["FSP", 4, 12, 4, 3], ["RE", 4, [0, 4, 8, 12, 1, 5, 9, 13, 2, 6, 10, 14, 3, 7, 11, 15]], ["CA", 3, 4, 11], ["CHR", 2, "shared", [3]], ["CA", 3, 4, 14], ["CHR", 1, "shared", [4]], ["CA", 2, 5, 14], ["CI", 1], ["FU", 6, [0, 1, 2, 3]], ["AN", 6, 0, 5], ["FU", 6, [1, 2, 3, 4]], ["AN", 6, 1, 4], ["FU", 6, [2, 3, 4, 5]], ["AN", 6, 2, 6], ["FU", 4, [0, 1, 2, 3]], ["SP", 4, 0, 3024, [1], 1], ["AN", 4, 1, 2], ["FFSP", 4, 0, [4, 3, 2, 1], 1, 1], ["AN", 4, 1, 6], ["FU", 2, [0, 1, 2, 3]], ["SP", 2, 0, 144, [1], 1], ["AN", 2, 1, 2], ["FFSP", 2, 0, [4, 3, 2, 1], 1, 1], ["AN", 2, 1, 6], ["PR", 5, 0, "auto_unroll_max_step$16"]]]], "r": [[0.0769877], 0, 7.42785, 1649178816], "v": "v0.6"}
{"i": [["[\"conv2d_layer\", 128, 1008, 42, 42, 336, 1, 1, 1, \"SAME\"]", "cuda -keys=cuda,gpu -max_num_threads=1024 -thread_warp_size=32", [-1, 16, 64, 49152, 2147483647, 1024, 8, 32], "", 0, []], [[], [["CHW", 3, "local"], ["SP", 3, 0, 128, [1, 1, 1, 1], 1], ["SP", 3, 5, 336, [1, 6, 1, 4], 1], ["SP", 3, 10, 42, [1, 2, 1, 1], 1], ["SP", 3, 15, 42, [1, 6, 1, 1], 1], ["SP", 3, 20, 1008, [8, 7], 1], ["SP", 3, 23, 1, [1, 1], 1], ["SP", 3, 26, 1, [1, 1], 1], ["RE", 3, [0, 5, 10, 15, 1, 6, 11, 16, 2, 7, 12, 17, 20, 23, 26, 21, 24, 27, 3, 8, 13, 18, 22, 25, 28, 4, 9, 14, 19]], ["FSP", 4, 0, 1, 3], ["FSP", 4, 4, 2, 3], ["FSP", 4, 8, 3, 3], ["FSP", 4, 12, 4, 3], ["RE", 4, [0, 4, 8, 12, 1, 5, 9, 13, 2, 6, 10, 14, 3, 7, 11, 15]], ["CA", 3, 4, 11], ["CHR", 2, "shared", [3]], ["CA", 3, 4, 14], ["CHR", 1, "shared", [4]], ["CA", 2, 5, 14], ["CI", 1], ["FU", 6, [0, 1, 2, 3]], ["AN", 6, 0, 5], ["FU", 6, [1, 2, 3, 4]], ["AN", 6, 1, 4], ["FU", 6, [2, 3, 4, 5]], ["AN", 6, 2, 6], ["FU", 4, [0, 1, 2, 3]], ["SP", 4, 0, 224, [1], 1], ["AN", 4, 1, 2], ["FFSP", 4, 0, [4, 3, 2, 1], 1, 1], ["AN", 4, 1, 6], ["FU", 2, [0, 1, 2, 3]], ["SP", 2, 0, 112, [1], 1], ["AN", 2, 1, 2], ["FFSP", 2, 0, [4, 3, 2, 1], 1, 1], ["AN", 2, 1, 6], ["PR", 5, 0, "auto_unroll_max_step$1024"]]]], "r": [[0.0497314], 0, 5.47621, 1649178831], "v": "v0.6"}
{"i": [["[\"conv2d_layer\", 128, 1008, 42, 42, 336, 1, 1, 1, \"SAME\"]", "cuda -keys=cuda,gpu -max_num_threads=1024 -thread_warp_size=32", [-1, 16, 64, 49152, 2147483647, 1024, 8, 32], "", 0, []], [[], [["CHW", 3, "local"], ["SP", 3, 0, 128, [2, 2, 1, 8], 1], ["SP", 3, 5, 336, [1, 84, 2, 2], 1], ["SP", 3, 10, 42, [1, 1, 2, 1], 1], ["SP", 3, 15, 42, [1, 1, 7, 1], 1], ["SP", 3, 20, 1008, [4, 3], 1], ["SP", 3, 23, 1, [1, 1], 1], ["SP", 3, 26, 1, [1, 1], 1], ["RE", 3, [0, 5, 10, 15, 1, 6, 11, 16, 2, 7, 12, 17, 20, 23, 26, 21, 24, 27, 3, 8, 13, 18, 22, 25, 28, 4, 9, 14, 19]], ["FSP", 4, 0, 1, 3], ["FSP", 4, 4, 2, 3], ["FSP", 4, 8, 3, 3], ["FSP", 4, 12, 4, 3], ["RE", 4, [0, 4, 8, 12, 1, 5, 9, 13, 2, 6, 10, 14, 3, 7, 11, 15]], ["CA", 3, 4, 11], ["CHR", 2, "shared", [3]], ["CA", 3, 4, 14], ["CHR", 1, "shared", [4]], ["CA", 2, 5, 14], ["CI", 1], ["FU", 6, [0, 1, 2, 3]], ["AN", 6, 0, 5], ["FU", 6, [1, 2, 3, 4]], ["AN", 6, 1, 4], ["FU", 6, [2, 3, 4, 5]], ["AN", 6, 2, 6], ["FU", 4, [0, 1, 2, 3]], ["SP", 4, 0, 48, [1], 1], ["AN", 4, 1, 2], ["FFSP", 4, 0, [4, 3, 2, 1], 1, 1], ["AN", 4, 1, 6], ["FU", 2, [0, 1, 2, 3]], ["SP", 2, 0, 1344, [3], 1], ["AN", 2, 1, 2], ["FFSP", 2, 0, [4, 3, 2, 1], 1, 1], ["AN", 2, 1, 6], ["PR", 5, 0, "auto_unroll_max_step$0"]]]], "r": [[0.471297], 0, 7.51188, 1649178848], "v": "v0.6"}
{"i": [["[\"conv2d_layer\", 128, 1008, 42, 42, 336, 1, 1, 1, \"SAME\"]", "cuda -keys=cuda,gpu -max_num_threads=1024 -thread_warp_size=32", [-1, 16, 64, 49152, 2147483647, 1024, 8, 32], "", 0, []], [[], [["CHW", 3, "local"], ["SP", 3, 0, 128, [1, 1, 2, 1], 1], ["SP", 3, 5, 336, [2, 14, 2, 2], 1], ["SP", 3, 10, 42, [3, 7, 1, 1], 1], ["SP", 3, 15, 42, [1, 1, 2, 1], 1], ["SP", 3, 20, 1008, [6, 6], 1], ["SP", 3, 23, 1, [1, 1], 1], ["SP", 3, 26, 1, [1, 1], 1], ["RE", 3, [0, 5, 10, 15, 1, 6, 11, 16, 2, 7, 12, 17, 20, 23, 26, 21, 24, 27, 3, 8, 13, 18, 22, 25, 28, 4, 9, 14, 19]], ["FSP", 4, 0, 1, 3], ["FSP", 4, 4, 2, 3], ["FSP", 4, 8, 3, 3], ["FSP", 4, 12, 4, 3], ["RE", 4, [0, 4, 8, 12, 1, 5, 9, 13, 2, 6, 10, 14, 3, 7, 11, 15]], ["CA", 3, 4, 11], ["CHR", 2, "shared", [3]], ["CA", 3, 4, 14], ["CHR", 1, "shared", [4]], ["CA", 2, 5, 14], ["CI", 1], ["FU", 6, [0, 1, 2, 3]], ["AN", 6, 0, 5], ["FU", 6, [1, 2, 3, 4]], ["AN", 6, 1, 4], ["FU", 6, [2, 3, 4, 5]], ["AN", 6, 2, 6], ["FU", 4, [0, 1, 2, 3]], ["SP", 4, 0, 144, [1], 1], ["AN", 4, 1, 2], ["FFSP", 4, 0, [4, 3, 2, 1], 1, 1], ["AN", 4, 1, 6], ["FU", 2, [0, 1, 2, 3]], ["SP", 2, 0, 144, [9], 1], ["AN", 2, 1, 2], ["FFSP", 2, 0, [4, 3, 2, 1], 1, 1], ["AN", 2, 1, 6], ["PR", 5, 0, "auto_unroll_max_step$16"]]]], "r": [[0.146396], 0, 5.75136, 1649178853], "v": "v0.6"}
{"i": [["[\"conv2d_layer\", 128, 1008, 42, 42, 336, 1, 1, 1, \"SAME\"]", "cuda -keys=cuda,gpu -max_num_threads=1024 -thread_warp_size=32", [-1, 16, 64, 49152, 2147483647, 1024, 8, 32], "", 0, []], [[], [["CHW", 3, "local"], ["SP", 3, 0, 128, [1, 2, 2, 1], 1], ["SP", 3, 5, 336, [1, 21, 16, 1], 1], ["SP", 3, 10, 42, [1, 1, 21, 1], 1], ["SP", 3, 15, 42, [1, 3, 1, 2], 1], ["SP", 3, 20, 1008, [1, 8], 1], ["SP", 3, 23, 1, [1, 1], 1], ["SP", 3, 26, 1, [1, 1], 1], ["RE", 3, [0, 5, 10, 15, 1, 6, 11, 16, 2, 7, 12, 17, 20, 23, 26, 21, 24, 27, 3, 8, 13, 18, 22, 25, 28, 4, 9, 14, 19]], ["FSP", 4, 0, 1, 3], ["FSP", 4, 4, 2, 3], ["FSP", 4, 8, 3, 3], ["FSP", 4, 12, 4, 3], ["RE", 4, [0, 4, 8, 12, 1, 5, 9, 13, 2, 6, 10, 14, 3, 7, 11, 15]], ["CA", 3, 4, 11], ["CHR", 2, "shared", [3]], ["CA", 3, 4, 14], ["CHR", 1, "shared", [4]], ["CA", 2, 5, 14], ["CI", 1], ["FU", 6, [0, 1, 2, 3]], ["AN", 6, 0, 5], ["FU", 6, [1, 2, 3, 4]], ["AN", 6, 1, 4], ["FU", 6, [2, 3, 4, 5]], ["AN", 6, 2, 6], ["FU", 4, [0, 1, 2, 3]], ["SP", 4, 0, 128, [1], 1], ["AN", 4, 1, 2], ["FFSP", 4, 0, [4, 3, 2, 1], 1, 1], ["AN", 4, 1, 6], ["FU", 2, [0, 1, 2, 3]], ["SP", 2, 0, 336, [1], 1], ["AN", 2, 1, 2], ["FFSP", 2, 0, [4, 3, 2, 1], 1, 1], ["AN", 2, 1, 6], ["PR", 5, 0, "auto_unroll_max_step$64"]]]], "r": [[0.131593], 0, 5.58591, 1649178869], "v": "v0.6"}
{"i": [["[\"conv2d_layer\", 128, 1008, 42, 42, 336, 1, 1, 1, \"SAME\"]", "cuda -keys=cuda,gpu -max_num_threads=1024 -thread_warp_size=32", [-1, 16, 64, 49152, 2147483647, 1024, 8, 32], "", 0, []], [[], [["CHW", 3, "local"], ["SP", 3, 0, 128, [1, 4, 1, 1], 1], ["SP", 3, 5, 336, [2, 14, 1, 3], 1], ["SP", 3, 10, 42, [1, 6, 1, 7], 1], ["SP", 3, 15, 42, [1, 1, 2, 3], 1], ["SP", 3, 20, 1008, [1, 6], 1], ["SP", 3, 23, 1, [1, 1], 1], ["SP", 3, 26, 1, [1, 1], 1], ["RE", 3, [0, 5, 10, 15, 1, 6, 11, 16, 2, 7, 12, 17, 20, 23, 26, 21, 24, 27, 3, 8, 13, 18, 22, 25, 28, 4, 9, 14, 19]], ["FSP", 4, 0, 1, 3], ["FSP", 4, 4, 2, 3], ["FSP", 4, 8, 3, 3], ["FSP", 4, 12, 4, 3], ["RE", 4, [0, 4, 8, 12, 1, 5, 9, 13, 2, 6, 10, 14, 3, 7, 11, 15]], ["CA", 3, 4, 11], ["CHR", 2, "shared", [3]], ["CA", 3, 4, 14], ["CHR", 1, "shared", [4]], ["CA", 2, 5, 14], ["CI", 1], ["FU", 6, [0, 1, 2, 3]], ["AN", 6, 0, 5], ["FU", 6, [1, 2, 3, 4]], ["AN", 6, 1, 4], ["FU", 6, [2, 3, 4, 5]], ["AN", 6, 2, 6], ["FU", 4, [0, 1, 2, 3]], ["SP", 4, 0, 18, [3], 1], ["AN", 4, 1, 2], ["FFSP", 4, 0, [4, 3, 2, 1], 1, 1], ["AN", 4, 1, 6], ["FU", 2, [0, 1, 2, 3]], ["SP", 2, 0, 252, [1], 1], ["AN", 2, 1, 2], ["FFSP", 2, 0, [4, 3, 2, 1], 1, 1], ["AN", 2, 1, 6], ["PR", 5, 0, "auto_unroll_max_step$0"]]]], "r": [[0.180988], 0, 5.90765, 1649178874], "v": "v0.6"}
{"i": [["[\"conv2d_layer\", 128, 1008, 42, 42, 336, 1, 1, 1, \"SAME\"]", "cuda -keys=cuda,gpu -max_num_threads=1024 -thread_warp_size=32", [-1, 16, 64, 49152, 2147483647, 1024, 8, 32], "", 0, []], [[], [["CHW", 3, "local"], ["SP", 3, 0, 128, [4, 2, 1, 2], 1], ["SP", 3, 5, 336, [1, 2, 7, 1], 1], ["SP", 3, 10, 42, [1, 3, 1, 2], 1], ["SP", 3, 15, 42, [1, 7, 3, 2], 1], ["SP", 3, 20, 1008, [1, 3], 1], ["SP", 3, 23, 1, [1, 1], 1], ["SP", 3, 26, 1, [1, 1], 1], ["RE", 3, [0, 5, 10, 15, 1, 6, 11, 16, 2, 7, 12, 17, 20, 23, 26, 21, 24, 27, 3, 8, 13, 18, 22, 25, 28, 4, 9, 14, 19]], ["FSP", 4, 0, 1, 3], ["FSP", 4, 4, 2, 3], ["FSP", 4, 8, 3, 3], ["FSP", 4, 12, 4, 3], ["RE", 4, [0, 4, 8, 12, 1, 5, 9, 13, 2, 6, 10, 14, 3, 7, 11, 15]], ["CA", 3, 4, 11], ["CHR", 2, "shared", [3]], ["CA", 3, 4, 14], ["CHR", 1, "shared", [4]], ["CA", 2, 5, 14], ["CI", 1], ["FU", 6, [0, 1, 2, 3]], ["AN", 6, 0, 5], ["FU", 6, [1, 2, 3, 4]], ["AN", 6, 1, 4], ["FU", 6, [2, 3, 4, 5]], ["AN", 6, 2, 6], ["FU", 4, [0, 1, 2, 3]], ["SP", 4, 0, 21, [1], 1], ["AN", 4, 1, 2], ["FFSP", 4, 0, [4, 3, 2, 1], 1, 1], ["AN", 4, 1, 6], ["FU", 2, [0, 1, 2, 3]], ["SP", 2, 0, 72, [1], 1], ["AN", 2, 1, 2], ["FFSP", 2, 0, [4, 3, 2, 1], 1, 1], ["AN", 2, 1, 6], ["PR", 5, 0, "auto_unroll_max_step$64"]]]], "r": [[0.350194], 0, 6.64812, 1649178880], "v": "v0.6"}
{"i": [["[\"conv2d_layer\", 128, 1008, 42, 42, 336, 1, 1, 1, \"SAME\"]", "cuda -keys=cuda,gpu -max_num_threads=1024 -thread_warp_size=32", [-1, 16, 64, 49152, 2147483647, 1024, 8, 32], "", 0, []], [[], [["CHW", 3, "local"], ["SP", 3, 0, 128, [1, 2, 16, 1], 1], ["SP", 3, 5, 336, [2, 56, 1, 1], 1], ["SP", 3, 10, 42, [1, 1, 2, 1], 1], ["SP", 3, 15, 42, [1, 3, 2, 1], 1], ["SP", 3, 20, 1008, [1, 24], 1], ["SP", 3, 23, 1, [1, 1], 1], ["SP", 3, 26, 1, [1, 1], 1], ["RE", 3, [0, 5, 10, 15, 1, 6, 11, 16, 2, 7, 12, 17, 20, 23, 26, 21, 24, 27, 3, 8, 13, 18, 22, 25, 28, 4, 9, 14, 19]], ["FSP", 4, 0, 1, 3], ["FSP", 4, 4, 2, 3], ["FSP", 4, 8, 3, 3], ["FSP", 4, 12, 4, 3], ["RE", 4, [0, 4, 8, 12, 1, 5, 9, 13, 2, 6, 10, 14, 3, 7, 11, 15]], ["CA", 3, 4, 11], ["CHR", 2, "shared", [3]], ["CA", 3, 4, 14], ["CHR", 1, "shared", [4]], ["CA", 2, 5, 14], ["CI", 1], ["FU", 6, [0, 1, 2, 3]], ["AN", 6, 0, 5], ["FU", 6, [1, 2, 3, 4]], ["AN", 6, 1, 4], ["FU", 6, [2, 3, 4, 5]], ["AN", 6, 2, 6], ["FU", 4, [0, 1, 2, 3]], ["SP", 4, 0, 24, [1], 1], ["AN", 4, 1, 2], ["FFSP", 4, 0, [4, 3, 2, 1], 1, 1], ["AN", 4, 1, 6], ["FU", 2, [0, 1, 2, 3]], ["SP", 2, 0, 1536, [1], 1], ["AN", 2, 1, 2], ["FFSP", 2, 0, [4, 3, 2, 1], 1, 1], ["AN", 2, 1, 6], ["PR", 5, 0, "auto_unroll_max_step$16"]]]], "r": [[0.0538827], 0, 5.44225, 1649178885], "v": "v0.6"}
