artifacts/Table3/tvm/autotvm/matmul/matmul_65536_2_1024.log
{"input": ["cuda -keys=cuda,gpu -max_num_threads=1024 -thread_warp_size=32", "dense_large_batch.gpu", [["TENSOR", [65536, 2], "float32"], ["TENSOR", [2, 1024], "float32"]], {}], "config": {"index": 144436, "code_hash": null, "entity": [["tile_x", "sp", [-1, 128, 8, 1]], ["tile_y", "sp", [-1, 16, 8, 4]], ["tile_k", "sp", [-1, 1, 1]]]}, "result": [[0.042806325], 0, 3.173677921295166, 1638791984.459645], "version": 0.2, "tvm_version": "0.8.dev0"}
{"input": ["cuda -keys=cuda,gpu -max_num_threads=1024 -thread_warp_size=32", "dense_large_batch.gpu", [["TENSOR", [65536, 2], "float32"], ["TENSOR", [2, 1024], "float32"]], {}], "config": {"index": 126959, "code_hash": null, "entity": [["tile_x", "sp", [-1, 8, 2, 1]], ["tile_y", "sp", [-1, 2, 2, 4]], ["tile_k", "sp", [-1, 1, 1]]]}, "result": [[0.015357177777777778], 0, 3.335627555847168, 1638791993.454748], "version": 0.2, "tvm_version": "0.8.dev0"}
{"input": ["cuda -keys=cuda,gpu -max_num_threads=1024 -thread_warp_size=32", "dense_large_batch.gpu", [["TENSOR", [65536, 2], "float32"], ["TENSOR", [2, 1024], "float32"]], {}], "config": {"index": 121125, "code_hash": null, "entity": [["tile_x", "sp", [-1, 1, 1, 1]], ["tile_y", "sp", [-1, 16, 1, 4]], ["tile_k", "sp", [-1, 1, 1]]]}, "result": [[0.035047675], 0, 2.485018014907837, 1638792014.4425185], "version": 0.2, "tvm_version": "0.8.dev0"}
{"input": ["cuda -keys=cuda,gpu -max_num_threads=1024 -thread_warp_size=32", "dense_large_batch.gpu", [["TENSOR", [65536, 2], "float32"], ["TENSOR", [2, 1024], "float32"]], {}], "config": {"index": 120156, "code_hash": null, "entity": [["tile_x", "sp", [-1, 1, 1, 1]], ["tile_y", "sp", [-1, 8, 1, 4]], ["tile_k", "sp", [-1, 1, 1]]]}, "result": [[0.03812565], 0, 2.5214858055114746, 1638792016.753966], "version": 0.2, "tvm_version": "0.8.dev0"}
{"input": ["cuda -keys=cuda,gpu -max_num_threads=1024 -thread_warp_size=32", "dense_large_batch.gpu", [["TENSOR", [65536, 2], "float32"], ["TENSOR", [2, 1024], "float32"]], {}], "config": {"index": 170561, "code_hash": null, "entity": [["tile_x", "sp", [-1, 1, 2, 1]], ["tile_y", "sp", [-1, 4, 2, 8]], ["tile_k", "sp", [-1, 1, 1]]]}, "result": [[0.0140097], 0, 2.4325931072235107, 1638792019.0180428], "version": 0.2, "tvm_version": "0.8.dev0"}
{"input": ["cuda -keys=cuda,gpu -max_num_threads=1024 -thread_warp_size=32", "dense_large_batch.gpu", [["TENSOR", [65536, 2], "float32"], ["TENSOR", [2, 1024], "float32"]], {}], "config": {"index": 126957, "code_hash": null, "entity": [["tile_x", "sp", [-1, 2, 2, 1]], ["tile_y", "sp", [-1, 2, 2, 4]], ["tile_k", "sp", [-1, 1, 1]]]}, "result": [[0.01734785], 0, 2.347607374191284, 1638792021.1896844], "version": 0.2, "tvm_version": "0.8.dev0"}
{"input": ["cuda -keys=cuda,gpu -max_num_threads=1024 -thread_warp_size=32", "dense_large_batch.gpu", [["TENSOR", [65536, 2], "float32"], ["TENSOR", [2, 1024], "float32"]], {}], "config": {"index": 134724, "code_hash": null, "entity": [["tile_x", "sp", [-1, 1, 4, 1]], ["tile_y", "sp", [-1, 2, 4, 4]], ["tile_k", "sp", [-1, 1, 1]]]}, "result": [[0.007244864285714287], 0, 2.295827865600586, 1638792023.4828188], "version": 0.2, "tvm_version": "0.8.dev0"}
{"input": ["cuda -keys=cuda,gpu -max_num_threads=1024 -thread_warp_size=32", "dense_large_batch.gpu", [["TENSOR", [65536, 2], "float32"], ["TENSOR", [2, 1024], "float32"]], {}], "config": {"index": 163761, "code_hash": null, "entity": [["tile_x", "sp", [-1, 1, 1, 1]], ["tile_y", "sp", [-1, 8, 1, 8]], ["tile_k", "sp", [-1, 1, 1]]]}, "result": [[0.034577325], 0, 2.491210460662842, 1638792025.7505286], "version": 0.2, "tvm_version": "0.8.dev0"}
{"input": ["cuda -keys=cuda,gpu -max_num_threads=1024 -thread_warp_size=32", "dense_large_batch.gpu", [["TENSOR", [65536, 2], "float32"], ["TENSOR", [2, 1024], "float32"]], {}], "config": {"index": 169594, "code_hash": null, "entity": [["tile_x", "sp", [-1, 4, 2, 1]], ["tile_y", "sp", [-1, 2, 2, 8]], ["tile_k", "sp", [-1, 1, 1]]]}, "result": [[0.01024138], 0, 2.378944158554077, 1638792029.409618], "version": 0.2, "tvm_version": "0.8.dev0"}
{"input": ["cuda -keys=cuda,gpu -max_num_threads=1024 -thread_warp_size=32", "dense_large_batch.gpu", [["TENSOR", [65536, 2], "float32"], ["TENSOR", [2, 1024], "float32"]], {}], "config": {"index": 203507, "code_hash": null, "entity": [["tile_x", "sp", [-1, 1, 2, 1]], ["tile_y", "sp", [-1, 2, 2, 16]], ["tile_k", "sp", [-1, 1, 1]]]}, "result": [[0.0140195], 0, 2.409754753112793, 1638792031.6866605], "version": 0.2, "tvm_version": "0.8.dev0"}
{"input": ["cuda -keys=cuda,gpu -max_num_threads=1024 -thread_warp_size=32", "dense_large_batch.gpu", [["TENSOR", [65536, 2], "float32"], ["TENSOR", [2, 1024], "float32"]], {}], "config": {"index": 195739, "code_hash": null, "entity": [["tile_x", "sp", [-1, 2, 1, 1]], ["tile_y", "sp", [-1, 1, 1, 16]], ["tile_k", "sp", [-1, 1, 1]]]}, "result": [[0.027117799999999997], 0, 2.3204116821289062, 1638792033.8279777], "version": 0.2, "tvm_version": "0.8.dev0"}
{"input": ["cuda -keys=cuda,gpu -max_num_threads=1024 -thread_warp_size=32", "dense_large_batch.gpu", [["TENSOR", [65536, 2], "float32"], ["TENSOR", [2, 1024], "float32"]], {}], "config": {"index": 128895, "code_hash": null, "entity": [["tile_x", "sp", [-1, 2, 2, 1]], ["tile_y", "sp", [-1, 8, 2, 4]], ["tile_k", "sp", [-1, 1, 1]]]}, "result": [[0.01066797], 0, 2.428577184677124, 1638792036.0002537], "version": 0.2, "tvm_version": "0.8.dev0"}
{"input": ["cuda -keys=cuda,gpu -max_num_threads=1024 -thread_warp_size=32", "dense_large_batch.gpu", [["TENSOR", [65536, 2], "float32"], ["TENSOR", [2, 1024], "float32"]], {}], "config": {"index": 161823, "code_hash": null, "entity": [["tile_x", "sp", [-1, 1, 1, 1]], ["tile_y", "sp", [-1, 2, 1, 8]], ["tile_k", "sp", [-1, 1, 1]]]}, "result": [[0.046055900000000004], 0, 2.544055223464966, 1638792038.436115], "version": 0.2, "tvm_version": "0.8.dev0"}
{"input": ["cuda -keys=cuda,gpu -max_num_threads=1024 -thread_warp_size=32", "dense_large_batch.gpu", [["TENSOR", [65536, 2], "float32"], ["TENSOR", [2, 1024], "float32"]], {}], "config": {"index": 248081, "code_hash": null, "entity": [["tile_x", "sp", [-1, 1, 2, 1]], ["tile_y", "sp", [-1, 1, 2, 64]], ["tile_k", "sp", [-1, 1, 1]]]}, "result": [[0.032864525], 0, 2.509812831878662, 1638792040.7444816], "version": 0.2, "tvm_version": "0.8.dev0"}
{"input": ["cuda -keys=cuda,gpu -max_num_threads=1024 -thread_warp_size=32", "dense_large_batch.gpu", [["TENSOR", [65536, 2], "float32"], ["TENSOR", [2, 1024], "float32"]], {}], "config": {"index": 197676, "code_hash": null, "entity": [["tile_x", "sp", [-1, 1, 1, 1]], ["tile_y", "sp", [-1, 4, 1, 16]], ["tile_k", "sp", [-1, 1, 1]]]}, "result": [[0.034997525], 0, 2.507786273956299, 1638792043.0647001], "version": 0.2, "tvm_version": "0.8.dev0"}
{"input": ["cuda -keys=cuda,gpu -max_num_threads=1024 -thread_warp_size=32", "dense_large_batch.gpu", [["TENSOR", [65536, 2], "float32"], ["TENSOR", [2, 1024], "float32"]], {}], "config": {"index": 198646, "code_hash": null, "entity": [["tile_x", "sp", [-1, 2, 1, 1]], ["tile_y", "sp", [-1, 8, 1, 16]], ["tile_k", "sp", [-1, 1, 1]]]}, "result": [[0.02288935], 0, 2.884284496307373, 1638792045.5545294], "version": 0.2, "tvm_version": "0.8.dev0"}
{"input": ["cuda -keys=cuda,gpu -max_num_threads=1024 -thread_warp_size=32", "dense_large_batch.gpu", [["TENSOR", [65536, 2], "float32"], ["TENSOR", [2, 1024], "float32"]], {}], "config": {"index": 257754, "code_hash": null, "entity": [["tile_x", "sp", [-1, 1, 1, 1]], ["tile_y", "sp", [-1, 1, 1, 128]], ["tile_k", "sp", [-1, 1, 1]]]}, "result": [[0.5619998500000001], 0, 9.617184162139893, 1638792054.8046162], "version": 0.2, "tvm_version": "0.8.dev0"}
{"input": ["cuda -keys=cuda,gpu -max_num_threads=1024 -thread_warp_size=32", "dense_large_batch.gpu", [["TENSOR", [65536, 2], "float32"], ["TENSOR", [2, 1024], "float32"]], {}], "config": {"index": 225777, "code_hash": null, "entity": [["tile_x", "sp", [-1, 1, 1, 1]], ["tile_y", "sp", [-1, 8, 1, 32]], ["tile_k", "sp", [-1, 1, 1]]]}, "result": [[0.0482534], 0, 3.1709330081939697, 1638792057.6529984], "version": 0.2, "tvm_version": "0.8.dev0"}
{"input": ["cuda -keys=cuda,gpu -max_num_threads=1024 -thread_warp_size=32", "dense_large_batch.gpu", [["TENSOR", [65536, 2], "float32"], ["TENSOR", [2, 1024], "float32"]], {}], "config": {"index": 175422, "code_hash": null, "entity": [["tile_x", "sp", [-1, 1, 4, 1]], ["tile_y", "sp", [-1, 1, 4, 8]], ["tile_k", "sp", [-1, 1, 1]]]}, "result": [[0.0093016375], 0, 2.493119239807129, 1638792061.2710962], "version": 0.2, "tvm_version": "0.8.dev0"}
{"input": ["cuda -keys=cuda,gpu -max_num_threads=1024 -thread_warp_size=32", "dense_large_batch.gpu", [["TENSOR", [65536, 2], "float32"], ["TENSOR", [2, 1024], "float32"]], {}], "config": {"index": 204476, "code_hash": null, "entity": [["tile_x", "sp", [-1, 1, 2, 1]], ["tile_y", "sp", [-1, 4, 2, 16]], ["tile_k", "sp", [-1, 1, 1]]]}, "result": [[0.015690042857142854], 0, 2.492591619491577, 1638792063.599962], "version": 0.2, "tvm_version": "0.8.dev0"}
{"input": ["cuda -keys=cuda,gpu -max_num_threads=1024 -thread_warp_size=32", "dense_large_batch.gpu", [["TENSOR", [65536, 2], "float32"], ["TENSOR", [2, 1024], "float32"]], {}], "config": {"index": 171530, "code_hash": null, "entity": [["tile_x", "sp", [-1, 1, 2, 1]], ["tile_y", "sp", [-1, 8, 2, 8]], ["tile_k", "sp", [-1, 1, 1]]]}, "result": [[0.01461487142857143], 0, 2.4505527019500732, 1638792065.8557444], "version": 0.2, "tvm_version": "0.8.dev0"}
{"input": ["cuda -keys=cuda,gpu -max_num_threads=1024 -thread_warp_size=32", "dense_large_batch.gpu", [["TENSOR", [65536, 2], "float32"], ["TENSOR", [2, 1024], "float32"]], {}], "config": {"index": 203508, "code_hash": null, "entity": [["tile_x", "sp", [-1, 2, 2, 1]], ["tile_y", "sp", [-1, 2, 2, 16]], ["tile_k", "sp", [-1, 1, 1]]]}, "result": [[0.014908985714285714], 0, 2.6140623092651367, 1638792112.1551535], "version": 0.2, "tvm_version": "0.8.dev0"}
{"input": ["cuda -keys=cuda,gpu -max_num_threads=1024 -thread_warp_size=32", "dense_large_batch.gpu", [["TENSOR", [65536, 2], "float32"], ["TENSOR", [2, 1024], "float32"]], {}], "config": {"index": 170562, "code_hash": null, "entity": [["tile_x", "sp", [-1, 2, 2, 1]], ["tile_y", "sp", [-1, 4, 2, 8]], ["tile_k", "sp", [-1, 1, 1]]]}, "result": [[0.0111393], 0, 2.5385422706604004, 1638792114.558332], "version": 0.2, "tvm_version": "0.8.dev0"}
{"input": ["cuda -keys=cuda,gpu -max_num_threads=1024 -thread_warp_size=32", "dense_large_batch.gpu", [["TENSOR", [65536, 2], "float32"], ["TENSOR", [2, 1024], "float32"]], {}], "config": {"index": 224810, "code_hash": null, "entity": [["tile_x", "sp", [-1, 4, 1, 1]], ["tile_y", "sp", [-1, 4, 1, 32]], ["tile_k", "sp", [-1, 1, 1]]]}, "result": [[0.42037975], 0, 7.777372598648071, 1638792122.1237292], "version": 0.2, "tvm_version": "0.8.dev0"}
{"input": ["cuda -keys=cuda,gpu -max_num_threads=1024 -thread_warp_size=32", "dense_large_batch.gpu", [["TENSOR", [65536, 2], "float32"], ["TENSOR", [2, 1024], "float32"]], {}], "config": {"index": 198648, "code_hash": null, "entity": [["tile_x", "sp", [-1, 8, 1, 1]], ["tile_y", "sp", [-1, 8, 1, 16]], ["tile_k", "sp", [-1, 1, 1]]]}, "result": [[0.42514825], 0, 7.916181802749634, 1638792131.5229464], "version": 0.2, "tvm_version": "0.8.dev0"}
{"input": ["cuda -keys=cuda,gpu -max_num_threads=1024 -thread_warp_size=32", "dense_large_batch.gpu", [["TENSOR", [65536, 2], "float32"], ["TENSOR", [2, 1024], "float32"]], {}], "config": {"index": 198647, "code_hash": null, "entity": [["tile_x", "sp", [-1, 4, 1, 1]], ["tile_y", "sp", [-1, 8, 1, 16]], ["tile_k", "sp", [-1, 1, 1]]]}, "result": [[0.44586844999999997], 0, 8.206146717071533, 1638792139.3396955], "version": 0.2, "tvm_version": "0.8.dev0"}
{"input": ["cuda -keys=cuda,gpu -max_num_threads=1024 -thread_warp_size=32", "dense_large_batch.gpu", [["TENSOR", [65536, 2], "float32"], ["TENSOR", [2, 1024], "float32"]], {}], "config": {"index": 169593, "code_hash": null, "entity": [["tile_x", "sp", [-1, 2, 2, 1]], ["tile_y", "sp", [-1, 2, 2, 8]], ["tile_k", "sp", [-1, 1, 1]]]}, "result": [[0.012666700000000001], 0, 2.3714492321014404, 1638792141.8584864], "version": 0.2, "tvm_version": "0.8.dev0"}
{"input": ["cuda -keys=cuda,gpu -max_num_threads=1024 -thread_warp_size=32", "dense_large_batch.gpu", [["TENSOR", [65536, 2], "float32"], ["TENSOR", [2, 1024], "float32"]], {}], "config": {"index": 224809, "code_hash": null, "entity": [["tile_x", "sp", [-1, 2, 1, 1]], ["tile_y", "sp", [-1, 4, 1, 32]], ["tile_k", "sp", [-1, 1, 1]]]}, "result": [[0.0229869], 0, 2.8552122116088867, 1638792144.3851306], "version": 0.2, "tvm_version": "0.8.dev0"}
{"input": ["cuda -keys=cuda,gpu -max_num_threads=1024 -thread_warp_size=32", "dense_large_batch.gpu", [["TENSOR", [65536, 2], "float32"], ["TENSOR", [2, 1024], "float32"]], {}], "config": {"index": 198645, "code_hash": null, "entity": [["tile_x", "sp", [-1, 1, 1, 1]], ["tile_y", "sp", [-1, 8, 1, 16]], ["tile_k", "sp", [-1, 1, 1]]]}, "result": [[0.036198], 0, 2.620342969894409, 1638792146.746346], "version": 0.2, "tvm_version": "0.8.dev0"}
{"input": ["cuda -keys=cuda,gpu -max_num_threads=1024 -thread_warp_size=32", "dense_large_batch.gpu", [["TENSOR", [65536, 2], "float32"], ["TENSOR", [2, 1024], "float32"]], {}], "config": {"index": 224811, "code_hash": null, "entity": [["tile_x", "sp", [-1, 8, 1, 1]], ["tile_y", "sp", [-1, 4, 1, 32]], ["tile_k", "sp", [-1, 1, 1]]]}, "result": [[0.423356075], 0, 7.7159037590026855, 1638792154.1092474], "version": 0.2, "tvm_version": "0.8.dev0"}
{"input": ["cuda -keys=cuda,gpu -max_num_threads=1024 -thread_warp_size=32", "dense_large_batch.gpu", [["TENSOR", [65536, 2], "float32"], ["TENSOR", [2, 1024], "float32"]], {}], "config": {"index": 203509, "code_hash": null, "entity": [["tile_x", "sp", [-1, 4, 2, 1]], ["tile_y", "sp", [-1, 2, 2, 16]], ["tile_k", "sp", [-1, 1, 1]]]}, "result": [[0.0136492], 0, 2.705228805541992, 1638792190.93124], "version": 0.2, "tvm_version": "0.8.dev0"}
{"input": ["cuda -keys=cuda,gpu -max_num_threads=1024 -thread_warp_size=32", "dense_large_batch.gpu", [["TENSOR", [65536, 2], "float32"], ["TENSOR", [2, 1024], "float32"]], {}], "config": {"index": 170563, "code_hash": null, "entity": [["tile_x", "sp", [-1, 4, 2, 1]], ["tile_y", "sp", [-1, 4, 2, 8]], ["tile_k", "sp", [-1, 1, 1]]]}, "result": [[0.009456292857142858], 0, 2.685614824295044, 1638792193.3187292], "version": 0.2, "tvm_version": "0.8.dev0"}
{"input": ["cuda -keys=cuda,gpu -max_num_threads=1024 -thread_warp_size=32", "dense_large_batch.gpu", [["TENSOR", [65536, 2], "float32"], ["TENSOR", [2, 1024], "float32"]], {}], "config": {"index": 128896, "code_hash": null, "entity": [["tile_x", "sp", [-1, 4, 2, 1]], ["tile_y", "sp", [-1, 8, 2, 4]], ["tile_k", "sp", [-1, 1, 1]]]}, "result": [[0.009182063636363636], 0, 2.6920273303985596, 1638792195.6680386], "version": 0.2, "tvm_version": "0.8.dev0"}
{"input": ["cuda -keys=cuda,gpu -max_num_threads=1024 -thread_warp_size=32", "dense_large_batch.gpu", [["TENSOR", [65536, 2], "float32"], ["TENSOR", [2, 1024], "float32"]], {}], "config": {"index": 126958, "code_hash": null, "entity": [["tile_x", "sp", [-1, 4, 2, 1]], ["tile_y", "sp", [-1, 2, 2, 4]], ["tile_k", "sp", [-1, 1, 1]]]}, "result": [[0.0131302625], 0, 2.383103132247925, 1638792197.8339033], "version": 0.2, "tvm_version": "0.8.dev0"}
{"input": ["cuda -keys=cuda,gpu -max_num_threads=1024 -thread_warp_size=32", "dense_large_batch.gpu", [["TENSOR", [65536, 2], "float32"], ["TENSOR", [2, 1024], "float32"]], {}], "config": {"index": 197677, "code_hash": null, "entity": [["tile_x", "sp", [-1, 2, 1, 1]], ["tile_y", "sp", [-1, 4, 1, 16]], ["tile_k", "sp", [-1, 1, 1]]]}, "result": [[0.02144415], 0, 2.6102397441864014, 1638792200.1686552], "version": 0.2, "tvm_version": "0.8.dev0"}
{"input": ["cuda -keys=cuda,gpu -max_num_threads=1024 -thread_warp_size=32", "dense_large_batch.gpu", [["TENSOR", [65536, 2], "float32"], ["TENSOR", [2, 1024], "float32"]], {}], "config": {"index": 228702, "code_hash": null, "entity": [["tile_x", "sp", [-1, 2, 2, 1]], ["tile_y", "sp", [-1, 1, 2, 32]], ["tile_k", "sp", [-1, 1, 1]]]}, "result": [[0.0139671], 0, 2.4451630115509033, 1638792202.3855042], "version": 0.2, "tvm_version": "0.8.dev0"}
{"input": ["cuda -keys=cuda,gpu -max_num_threads=1024 -thread_warp_size=32", "dense_large_batch.gpu", [["TENSOR", [65536, 2], "float32"], ["TENSOR", [2, 1024], "float32"]], {}], "config": {"index": 228701, "code_hash": null, "entity": [["tile_x", "sp", [-1, 1, 2, 1]], ["tile_y", "sp", [-1, 1, 2, 32]], ["tile_k", "sp", [-1, 1, 1]]]}, "result": [[0.017386466666666666], 0, 2.424248695373535, 1638792204.5838943], "version": 0.2, "tvm_version": "0.8.dev0"}
{"input": ["cuda -keys=cuda,gpu -max_num_threads=1024 -thread_warp_size=32", "dense_large_batch.gpu", [["TENSOR", [65536, 2], "float32"], ["TENSOR", [2, 1024], "float32"]], {}], "config": {"index": 205445, "code_hash": null, "entity": [["tile_x", "sp", [-1, 1, 2, 1]], ["tile_y", "sp", [-1, 8, 2, 16]], ["tile_k", "sp", [-1, 1, 1]]]}, "result": [[0.0156798], 0, 2.556364059448242, 1638792206.7965546], "version": 0.2, "tvm_version": "0.8.dev0"}
{"input": ["cuda -keys=cuda,gpu -max_num_threads=1024 -thread_warp_size=32", "dense_large_batch.gpu", [["TENSOR", [65536, 2], "float32"], ["TENSOR", [2, 1024], "float32"]], {}], "config": {"index": 171531, "code_hash": null, "entity": [["tile_x", "sp", [-1, 2, 2, 1]], ["tile_y", "sp", [-1, 8, 2, 8]], ["tile_k", "sp", [-1, 1, 1]]]}, "result": [[0.01075555], 0, 2.542309045791626, 1638792209.0181663], "version": 0.2, "tvm_version": "0.8.dev0"}
{"input": ["cuda -keys=cuda,gpu -max_num_threads=1024 -thread_warp_size=32", "dense_large_batch.gpu", [["TENSOR", [65536, 2], "float32"], ["TENSOR", [2, 1024], "float32"]], {}], "config": {"index": 196708, "code_hash": null, "entity": [["tile_x", "sp", [-1, 2, 1, 1]], ["tile_y", "sp", [-1, 2, 1, 16]], ["tile_k", "sp", [-1, 1, 1]]]}, "result": [[0.02311268333333333], 0, 2.591512441635132, 1638792211.346535], "version": 0.2, "tvm_version": "0.8.dev0"}
{"input": ["cuda -keys=cuda,gpu -max_num_threads=1024 -thread_warp_size=32", "dense_large_batch.gpu", [["TENSOR", [65536, 2], "float32"], ["TENSOR", [2, 1024], "float32"]], {}], "config": {"index": 195738, "code_hash": null, "entity": [["tile_x", "sp", [-1, 1, 1, 1]], ["tile_y", "sp", [-1, 1, 1, 16]], ["tile_k", "sp", [-1, 1, 1]]]}, "result": [[0.044561050000000005], 0, 2.5683932304382324, 1638792213.7283955], "version": 0.2, "tvm_version": "0.8.dev0"}
{"input": ["cuda -keys=cuda,gpu -max_num_threads=1024 -thread_warp_size=32", "dense_large_batch.gpu", [["TENSOR", [65536, 2], "float32"], ["TENSOR", [2, 1024], "float32"]], {}], "config": {"index": 127927, "code_hash": null, "entity": [["tile_x", "sp", [-1, 4, 2, 1]], ["tile_y", "sp", [-1, 4, 2, 4]], ["tile_k", "sp", [-1, 1, 1]]]}, "result": [[0.01039744], 0, 2.417969226837158, 1638792215.9001067], "version": 0.2, "tvm_version": "0.8.dev0"}
{"input": ["cuda -keys=cuda,gpu -max_num_threads=1024 -thread_warp_size=32", "dense_large_batch.gpu", [["TENSOR", [65536, 2], "float32"], ["TENSOR", [2, 1024], "float32"]], {}], "config": {"index": 171532, "code_hash": null, "entity": [["tile_x", "sp", [-1, 4, 2, 1]], ["tile_y", "sp", [-1, 8, 2, 8]], ["tile_k", "sp", [-1, 1, 1]]]}, "result": [[0.008889416666666667], 0, 2.734537363052368, 1638792218.1463935], "version": 0.2, "tvm_version": "0.8.dev0"}
{"input": ["cuda -keys=cuda,gpu -max_num_threads=1024 -thread_warp_size=32", "dense_large_batch.gpu", [["TENSOR", [65536, 2], "float32"], ["TENSOR", [2, 1024], "float32"]], {}], "config": {"index": 4845, "code_hash": null, "entity": [["tile_x", "sp", [-1, 1, 1, 1]], ["tile_y", "sp", [-1, 32, 1, 1]], ["tile_k", "sp", [-1, 1, 1]]]}, "result": [[0.038512], 0, 2.5056495666503906, 1638792220.4343686], "version": 0.2, "tvm_version": "0.8.dev0"}
{"input": ["cuda -keys=cuda,gpu -max_num_threads=1024 -thread_warp_size=32", "dense_large_batch.gpu", [["TENSOR", [65536, 2], "float32"], ["TENSOR", [2, 1024], "float32"]], {}], "config": {"index": 165699, "code_hash": null, "entity": [["tile_x", "sp", [-1, 1, 1, 1]], ["tile_y", "sp", [-1, 32, 1, 8]], ["tile_k", "sp", [-1, 1, 1]]]}, "result": [[0.17482525000000002], 0, 5.091535568237305, 1638792224.851229], "version": 0.2, "tvm_version": "0.8.dev0"}
{"input": ["cuda -keys=cuda,gpu -max_num_threads=1024 -thread_warp_size=32", "dense_large_batch.gpu", [["TENSOR", [65536, 2], "float32"], ["TENSOR", [2, 1024], "float32"]], {}], "config": {"index": 228703, "code_hash": null, "entity": [["tile_x", "sp", [-1, 4, 2, 1]], ["tile_y", "sp", [-1, 1, 2, 32]], ["tile_k", "sp", [-1, 1, 1]]]}, "result": [[0.012352733333333333], 0, 2.509836196899414, 1638792227.0792892], "version": 0.2, "tvm_version": "0.8.dev0"}
{"input": ["cuda -keys=cuda,gpu -max_num_threads=1024 -thread_warp_size=32", "dense_large_batch.gpu", [["TENSOR", [65536, 2], "float32"], ["TENSOR", [2, 1024], "float32"]], {}], "config": {"index": 164730, "code_hash": null, "entity": [["tile_x", "sp", [-1, 1, 1, 1]], ["tile_y", "sp", [-1, 16, 1, 8]], ["tile_k", "sp", [-1, 1, 1]]]}, "result": [[0.036177774999999995], 0, 2.6440587043762207, 1638792229.4153814], "version": 0.2, "tvm_version": "0.8.dev0"}
{"input": ["cuda -keys=cuda,gpu -max_num_threads=1024 -thread_warp_size=32", "dense_large_batch.gpu", [["TENSOR", [65536, 2], "float32"], ["TENSOR", [2, 1024], "float32"]], {}], "config": {"index": 267444, "code_hash": null, "entity": [["tile_x", "sp", [-1, 1, 1, 1]], ["tile_y", "sp", [-1, 1, 1, 256]], ["tile_k", "sp", [-1, 1, 1]]]}, "result": [[0.636666125], 0, 10.474789381027222, 1638792239.6374226], "version": 0.2, "tvm_version": "0.8.dev0"}
{"input": ["cuda -keys=cuda,gpu -max_num_threads=1024 -thread_warp_size=32", "dense_large_batch.gpu", [["TENSOR", [65536, 2], "float32"], ["TENSOR", [2, 1024], "float32"]], {}], "config": {"index": 128897, "code_hash": null, "entity": [["tile_x", "sp", [-1, 8, 2, 1]], ["tile_y", "sp", [-1, 8, 2, 4]], ["tile_k", "sp", [-1, 1, 1]]]}, "result": [[0.008643633333333333], 0, 2.736811876296997, 1638792241.851733], "version": 0.2, "tvm_version": "0.8.dev0"}
{"input": ["cuda -keys=cuda,gpu -max_num_threads=1024 -thread_warp_size=32", "dense_large_batch.gpu", [["TENSOR", [65536, 2], "float32"], ["TENSOR", [2, 1024], "float32"]], {}], "config": {"index": 273259, "code_hash": null, "entity": [["tile_x", "sp", [-1, 2, 1, 1]], ["tile_y", "sp", [-1, 1, 1, 512]], ["tile_k", "sp", [-1, 1, 1]]]}, "result": [[0.47002482500000003], 0, 8.51640009880066, 1638792250.1477456], "version": 0.2, "tvm_version": "0.8.dev0"}
{"input": ["cuda -keys=cuda,gpu -max_num_threads=1024 -thread_warp_size=32", "dense_large_batch.gpu", [["TENSOR", [65536, 2], "float32"], ["TENSOR", [2, 1024], "float32"]], {}], "config": {"index": 267445, "code_hash": null, "entity": [["tile_x", "sp", [-1, 2, 1, 1]], ["tile_y", "sp", [-1, 1, 1, 256]], ["tile_k", "sp", [-1, 1, 1]]]}, "result": [[0.4641852], 0, 8.214802980422974, 1638792258.1478403], "version": 0.2, "tvm_version": "0.8.dev0"}
{"input": ["cuda -keys=cuda,gpu -max_num_threads=1024 -thread_warp_size=32", "dense_large_batch.gpu", [["TENSOR", [65536, 2], "float32"], ["TENSOR", [2, 1024], "float32"]], {}], "config": {"index": 170564, "code_hash": null, "entity": [["tile_x", "sp", [-1, 8, 2, 1]], ["tile_y", "sp", [-1, 4, 2, 8]], ["tile_k", "sp", [-1, 1, 1]]]}, "result": [[0.008663933333333334], 0, 2.680716037750244, 1638792260.3713076], "version": 0.2, "tvm_version": "0.8.dev0"}
{"input": ["cuda -keys=cuda,gpu -max_num_threads=1024 -thread_warp_size=32", "dense_large_batch.gpu", [["TENSOR", [65536, 2], "float32"], ["TENSOR", [2, 1024], "float32"]], {}], "config": {"index": 244189, "code_hash": null, "entity": [["tile_x", "sp", [-1, 2, 1, 1]], ["tile_y", "sp", [-1, 2, 1, 64]], ["tile_k", "sp", [-1, 1, 1]]]}, "result": [[0.1409252], 0, 4.298006772994995, 1638792264.1088057], "version": 0.2, "tvm_version": "0.8.dev0"}
{"input": ["cuda -keys=cuda,gpu -max_num_threads=1024 -thread_warp_size=32", "dense_large_batch.gpu", [["TENSOR", [65536, 2], "float32"], ["TENSOR", [2, 1024], "float32"]], {}], "config": {"index": 162792, "code_hash": null, "entity": [["tile_x", "sp", [-1, 1, 1, 1]], ["tile_y", "sp", [-1, 4, 1, 8]], ["tile_k", "sp", [-1, 1, 1]]]}, "result": [[0.0369993], 0, 2.5188119411468506, 1638792266.3953965], "version": 0.2, "tvm_version": "0.8.dev0"}
{"input": ["cuda -keys=cuda,gpu -max_num_threads=1024 -thread_warp_size=32", "dense_large_batch.gpu", [["TENSOR", [65536, 2], "float32"], ["TENSOR", [2, 1024], "float32"]], {}], "config": {"index": 3876, "code_hash": null, "entity": [["tile_x", "sp", [-1, 1, 1, 1]], ["tile_y", "sp", [-1, 16, 1, 1]], ["tile_k", "sp", [-1, 1, 1]]]}, "result": [[0.053245575], 0, 2.632676362991333, 1638792270.5948553], "version": 0.2, "tvm_version": "0.8.dev0"}
{"input": ["cuda -keys=cuda,gpu -max_num_threads=1024 -thread_warp_size=32", "dense_large_batch.gpu", [["TENSOR", [65536, 2], "float32"], ["TENSOR", [2, 1024], "float32"]], {}], "config": {"index": 228704, "code_hash": null, "entity": [["tile_x", "sp", [-1, 8, 2, 1]], ["tile_y", "sp", [-1, 1, 2, 32]], ["tile_k", "sp", [-1, 1, 1]]]}, "result": [[0.01202571111111111], 0, 2.671475887298584, 1638792272.8554306], "version": 0.2, "tvm_version": "0.8.dev0"}
{"input": ["cuda -keys=cuda,gpu -max_num_threads=1024 -thread_warp_size=32", "dense_large_batch.gpu", [["TENSOR", [65536, 2], "float32"], ["TENSOR", [2, 1024], "float32"]], {}], "config": {"index": 168625, "code_hash": null, "entity": [["tile_x", "sp", [-1, 4, 2, 1]], ["tile_y", "sp", [-1, 1, 2, 8]], ["tile_k", "sp", [-1, 1, 1]]]}, "result": [[0.013099375], 0, 2.3924577236175537, 1638792275.0284288], "version": 0.2, "tvm_version": "0.8.dev0"}
{"input": ["cuda -keys=cuda,gpu -max_num_threads=1024 -thread_warp_size=32", "dense_large_batch.gpu", [["TENSOR", [65536, 2], "float32"], ["TENSOR", [2, 1024], "float32"]], {}], "config": {"index": 273258, "code_hash": null, "entity": [["tile_x", "sp", [-1, 1, 1, 1]], ["tile_y", "sp", [-1, 1, 1, 512]], ["tile_k", "sp", [-1, 1, 1]]]}, "result": [[0.6268893000000001], 0, 10.550918817520142, 1638792285.3472173], "version": 0.2, "tvm_version": "0.8.dev0"}
{"input": ["cuda -keys=cuda,gpu -max_num_threads=1024 -thread_warp_size=32", "dense_large_batch.gpu", [["TENSOR", [65536, 2], "float32"], ["TENSOR", [2, 1024], "float32"]], {}], "config": {"index": 199615, "code_hash": null, "entity": [["tile_x", "sp", [-1, 2, 1, 1]], ["tile_y", "sp", [-1, 16, 1, 16]], ["tile_k", "sp", [-1, 1, 1]]]}, "result": [[0.5449191250000001], 0, 9.700992584228516, 1638792294.3944483], "version": 0.2, "tvm_version": "0.8.dev0"}
{"input": ["cuda -keys=cuda,gpu -max_num_threads=1024 -thread_warp_size=32", "dense_large_batch.gpu", [["TENSOR", [65536, 2], "float32"], ["TENSOR", [2, 1024], "float32"]], {}], "config": {"index": 258724, "code_hash": null, "entity": [["tile_x", "sp", [-1, 2, 1, 1]], ["tile_y", "sp", [-1, 2, 1, 128]], ["tile_k", "sp", [-1, 1, 1]]]}, "result": [[0.46186225000000003], 0, 8.160401821136475, 1638792302.3498075], "version": 0.2, "tvm_version": "0.8.dev0"}
{"input": ["cuda -keys=cuda,gpu -max_num_threads=1024 -thread_warp_size=32", "dense_large_batch.gpu", [["TENSOR", [65536, 2], "float32"], ["TENSOR", [2, 1024], "float32"]], {}], "config": {"index": 68799, "code_hash": null, "entity": [["tile_x", "sp", [-1, 1, 1, 1]], ["tile_y", "sp", [-1, 32, 1, 2]], ["tile_k", "sp", [-1, 1, 1]]]}, "result": [[0.03489595], 0, 2.4961934089660645, 1638792304.6194582], "version": 0.2, "tvm_version": "0.8.dev0"}
{"input": ["cuda -keys=cuda,gpu -max_num_threads=1024 -thread_warp_size=32", "dense_large_batch.gpu", [["TENSOR", [65536, 2], "float32"], ["TENSOR", [2, 1024], "float32"]], {}], "config": {"index": 244188, "code_hash": null, "entity": [["tile_x", "sp", [-1, 1, 1, 1]], ["tile_y", "sp", [-1, 2, 1, 64]], ["tile_k", "sp", [-1, 1, 1]]]}, "result": [[0.143255975], 0, 4.099609613418579, 1638792308.3664086], "version": 0.2, "tvm_version": "0.8.dev0"}
{"input": ["cuda -keys=cuda,gpu -max_num_threads=1024 -thread_warp_size=32", "dense_large_batch.gpu", [["TENSOR", [65536, 2], "float32"], ["TENSOR", [2, 1024], "float32"]], {}], "config": {"index": 127926, "code_hash": null, "entity": [["tile_x", "sp", [-1, 2, 2, 1]], ["tile_y", "sp", [-1, 4, 2, 4]], ["tile_k", "sp", [-1, 1, 1]]]}, "result": [[0.0126970625], 0, 2.3545210361480713, 1638792310.514949], "version": 0.2, "tvm_version": "0.8.dev0"}
{"input": ["cuda -keys=cuda,gpu -max_num_threads=1024 -thread_warp_size=32", "dense_large_batch.gpu", [["TENSOR", [65536, 2], "float32"], ["TENSOR", [2, 1024], "float32"]], {}], "config": {"index": 257755, "code_hash": null, "entity": [["tile_x", "sp", [-1, 2, 1, 1]], ["tile_y", "sp", [-1, 1, 1, 128]], ["tile_k", "sp", [-1, 1, 1]]]}, "result": [[0.4305347], 0, 7.749321222305298, 1638792318.0523987], "version": 0.2, "tvm_version": "0.8.dev0"}
{"input": ["cuda -keys=cuda,gpu -max_num_threads=1024 -thread_warp_size=32", "dense_large_batch.gpu", [["TENSOR", [65536, 2], "float32"], ["TENSOR", [2, 1024], "float32"]], {}], "config": {"index": 171534, "code_hash": null, "entity": [["tile_x", "sp", [-1, 16, 2, 1]], ["tile_y", "sp", [-1, 8, 2, 8]], ["tile_k", "sp", [-1, 1, 1]]]}, "result": [[0.12818247500000002], 0, 4.2875847816467285, 1638792321.7384703], "version": 0.2, "tvm_version": "0.8.dev0"}
{"input": ["cuda -keys=cuda,gpu -max_num_threads=1024 -thread_warp_size=32", "dense_large_batch.gpu", [["TENSOR", [65536, 2], "float32"], ["TENSOR", [2, 1024], "float32"]], {}], "config": {"index": 3877, "code_hash": null, "entity": [["tile_x", "sp", [-1, 2, 1, 1]], ["tile_y", "sp", [-1, 16, 1, 1]], ["tile_k", "sp", [-1, 1, 1]]]}, "result": [[0.027215225], 0, 2.3226284980773926, 1638792323.8646007], "version": 0.2, "tvm_version": "0.8.dev0"}
{"input": ["cuda -keys=cuda,gpu -max_num_threads=1024 -thread_warp_size=32", "dense_large_batch.gpu", [["TENSOR", [65536, 2], "float32"], ["TENSOR", [2, 1024], "float32"]], {}], "config": {"index": 67831, "code_hash": null, "entity": [["tile_x", "sp", [-1, 2, 1, 1]], ["tile_y", "sp", [-1, 16, 1, 2]], ["tile_k", "sp", [-1, 1, 1]]]}, "result": [[0.023109466666666665], 0, 2.5758397579193115, 1638792326.1823628], "version": 0.2, "tvm_version": "0.8.dev0"}
{"input": ["cuda -keys=cuda,gpu -max_num_threads=1024 -thread_warp_size=32", "dense_large_batch.gpu", [["TENSOR", [65536, 2], "float32"], ["TENSOR", [2, 1024], "float32"]], {}], "config": {"index": 224808, "code_hash": null, "entity": [["tile_x", "sp", [-1, 1, 1, 1]], ["tile_y", "sp", [-1, 4, 1, 32]], ["tile_k", "sp", [-1, 1, 1]]]}, "result": [[0.036183125], 0, 2.640651226043701, 1638792328.5455363], "version": 0.2, "tvm_version": "0.8.dev0"}
{"input": ["cuda -keys=cuda,gpu -max_num_threads=1024 -thread_warp_size=32", "dense_large_batch.gpu", [["TENSOR", [65536, 2], "float32"], ["TENSOR", [2, 1024], "float32"]], {}], "config": {"index": 4846, "code_hash": null, "entity": [["tile_x", "sp", [-1, 2, 1, 1]], ["tile_y", "sp", [-1, 32, 1, 1]], ["tile_k", "sp", [-1, 1, 1]]]}, "result": [[0.023199800000000003], 0, 2.5730133056640625, 1638792330.8730733], "version": 0.2, "tvm_version": "0.8.dev0"}
{"input": ["cuda -keys=cuda,gpu -max_num_threads=1024 -thread_warp_size=32", "dense_large_batch.gpu", [["TENSOR", [65536, 2], "float32"], ["TENSOR", [2, 1024], "float32"]], {}], "config": {"index": 129864, "code_hash": null, "entity": [["tile_x", "sp", [-1, 2, 2, 1]], ["tile_y", "sp", [-1, 16, 2, 4]], ["tile_k", "sp", [-1, 1, 1]]]}, "result": [[0.01076773], 0, 2.550781488418579, 1638792333.0974069], "version": 0.2, "tvm_version": "0.8.dev0"}
{"input": ["cuda -keys=cuda,gpu -max_num_threads=1024 -thread_warp_size=32", "dense_large_batch.gpu", [["TENSOR", [65536, 2], "float32"], ["TENSOR", [2, 1024], "float32"]], {}], "config": {"index": 128894, "code_hash": null, "entity": [["tile_x", "sp", [-1, 1, 2, 1]], ["tile_y", "sp", [-1, 8, 2, 4]], ["tile_k", "sp", [-1, 1, 1]]]}, "result": [[0.014046025], 0, 2.4125521183013916, 1638792335.283566], "version": 0.2, "tvm_version": "0.8.dev0"}
{"input": ["cuda -keys=cuda,gpu -max_num_threads=1024 -thread_warp_size=32", "dense_large_batch.gpu", [["TENSOR", [65536, 2], "float32"], ["TENSOR", [2, 1024], "float32"]], {}], "config": {"index": 204477, "code_hash": null, "entity": [["tile_x", "sp", [-1, 2, 2, 1]], ["tile_y", "sp", [-1, 4, 2, 16]], ["tile_k", "sp", [-1, 1, 1]]]}, "result": [[0.01077728], 0, 2.5386877059936523, 1638792337.5316315], "version": 0.2, "tvm_version": "0.8.dev0"}
{"input": ["cuda -keys=cuda,gpu -max_num_threads=1024 -thread_warp_size=32", "dense_large_batch.gpu", [["TENSOR", [65536, 2], "float32"], ["TENSOR", [2, 1024], "float32"]], {}], "config": {"index": 199614, "code_hash": null, "entity": [["tile_x", "sp", [-1, 1, 1, 1]], ["tile_y", "sp", [-1, 16, 1, 16]], ["tile_k", "sp", [-1, 1, 1]]]}, "result": [[0.231343925], 0, 5.761811971664429, 1638792342.6776776], "version": 0.2, "tvm_version": "0.8.dev0"}
{"input": ["cuda -keys=cuda,gpu -max_num_threads=1024 -thread_warp_size=32", "dense_large_batch.gpu", [["TENSOR", [65536, 2], "float32"], ["TENSOR", [2, 1024], "float32"]], {}], "config": {"index": 131802, "code_hash": null, "entity": [["tile_x", "sp", [-1, 2, 2, 1]], ["tile_y", "sp", [-1, 64, 2, 4]], ["tile_k", "sp", [-1, 1, 1]]]}, "result": [[0.156909775], 0, 4.943570375442505, 1638792346.8445396], "version": 0.2, "tvm_version": "0.8.dev0"}
{"input": ["cuda -keys=cuda,gpu -max_num_threads=1024 -thread_warp_size=32", "dense_large_batch.gpu", [["TENSOR", [65536, 2], "float32"], ["TENSOR", [2, 1024], "float32"]], {}], "config": {"index": 205447, "code_hash": null, "entity": [["tile_x", "sp", [-1, 4, 2, 1]], ["tile_y", "sp", [-1, 8, 2, 16]], ["tile_k", "sp", [-1, 1, 1]]]}, "result": [[0.1415908], 0, 4.281332015991211, 1638792350.5362616], "version": 0.2, "tvm_version": "0.8.dev0"}
{"input": ["cuda -keys=cuda,gpu -max_num_threads=1024 -thread_warp_size=32", "dense_large_batch.gpu", [["TENSOR", [65536, 2], "float32"], ["TENSOR", [2, 1024], "float32"]], {}], "config": {"index": 229671, "code_hash": null, "entity": [["tile_x", "sp", [-1, 2, 2, 1]], ["tile_y", "sp", [-1, 2, 2, 32]], ["tile_k", "sp", [-1, 1, 1]]]}, "result": [[0.013725225], 0, 2.586230993270874, 1638792352.836183], "version": 0.2, "tvm_version": "0.8.dev0"}
{"input": ["cuda -keys=cuda,gpu -max_num_threads=1024 -thread_warp_size=32", "dense_large_batch.gpu", [["TENSOR", [65536, 2], "float32"], ["TENSOR", [2, 1024], "float32"]], {}], "config": {"index": 68801, "code_hash": null, "entity": [["tile_x", "sp", [-1, 4, 1, 1]], ["tile_y", "sp", [-1, 32, 1, 2]], ["tile_k", "sp", [-1, 1, 1]]]}, "result": [[0.460049325], 0, 8.811033964157104, 1638792360.9525807], "version": 0.2, "tvm_version": "0.8.dev0"}
{"input": ["cuda -keys=cuda,gpu -max_num_threads=1024 -thread_warp_size=32", "dense_large_batch.gpu", [["TENSOR", [65536, 2], "float32"], ["TENSOR", [2, 1024], "float32"]], {}], "config": {"index": 162795, "code_hash": null, "entity": [["tile_x", "sp", [-1, 8, 1, 1]], ["tile_y", "sp", [-1, 4, 1, 8]], ["tile_k", "sp", [-1, 1, 1]]]}, "result": [[0.012735274999999999], 0, 2.6602351665496826, 1638792365.3143926], "version": 0.2, "tvm_version": "0.8.dev0"}
{"input": ["cuda -keys=cuda,gpu -max_num_threads=1024 -thread_warp_size=32", "dense_large_batch.gpu", [["TENSOR", [65536, 2], "float32"], ["TENSOR", [2, 1024], "float32"]], {}], "config": {"index": 267446, "code_hash": null, "entity": [["tile_x", "sp", [-1, 4, 1, 1]], ["tile_y", "sp", [-1, 1, 1, 256]], ["tile_k", "sp", [-1, 1, 1]]]}, "result": [[0.4321214], 0, 7.815580129623413, 1638792372.9064445], "version": 0.2, "tvm_version": "0.8.dev0"}
{"input": ["cuda -keys=cuda,gpu -max_num_threads=1024 -thread_warp_size=32", "dense_large_batch.gpu", [["TENSOR", [65536, 2], "float32"], ["TENSOR", [2, 1024], "float32"]], {}], "config": {"index": 76570, "code_hash": null, "entity": [["tile_x", "sp", [-1, 4, 2, 1]], ["tile_y", "sp", [-1, 8, 2, 2]], ["tile_k", "sp", [-1, 1, 1]]]}, "result": [[0.01043776], 0, 2.5829410552978516, 1638792375.2483377], "version": 0.2, "tvm_version": "0.8.dev0"}
{"input": ["cuda -keys=cuda,gpu -max_num_threads=1024 -thread_warp_size=32", "dense_large_batch.gpu", [["TENSOR", [65536, 2], "float32"], ["TENSOR", [2, 1024], "float32"]], {}], "config": {"index": 248083, "code_hash": null, "entity": [["tile_x", "sp", [-1, 4, 2, 1]], ["tile_y", "sp", [-1, 1, 2, 64]], ["tile_k", "sp", [-1, 1, 1]]]}, "result": [[0.045324199999999995], 0, 3.032395839691162, 1638792377.7462637], "version": 0.2, "tvm_version": "0.8.dev0"}
{"input": ["cuda -keys=cuda,gpu -max_num_threads=1024 -thread_warp_size=32", "dense_large_batch.gpu", [["TENSOR", [65536, 2], "float32"], ["TENSOR", [2, 1024], "float32"]], {}], "config": {"index": 205448, "code_hash": null, "entity": [["tile_x", "sp", [-1, 8, 2, 1]], ["tile_y", "sp", [-1, 8, 2, 16]], ["tile_k", "sp", [-1, 1, 1]]]}, "result": [[0.142636875], 0, 4.291890859603882, 1638792381.495245], "version": 0.2, "tvm_version": "0.8.dev0"}
{"input": ["cuda -keys=cuda,gpu -max_num_threads=1024 -thread_warp_size=32", "dense_large_batch.gpu", [["TENSOR", [65536, 2], "float32"], ["TENSOR", [2, 1024], "float32"]], {}], "config": {"index": 222870, "code_hash": null, "entity": [["tile_x", "sp", [-1, 1, 1, 1]], ["tile_y", "sp", [-1, 1, 1, 32]], ["tile_k", "sp", [-1, 1, 1]]]}, "result": [[0.03835205], 0, 2.451200008392334, 1638792383.7474227], "version": 0.2, "tvm_version": "0.8.dev0"}
{"input": ["cuda -keys=cuda,gpu -max_num_threads=1024 -thread_warp_size=32", "dense_large_batch.gpu", [["TENSOR", [65536, 2], "float32"], ["TENSOR", [2, 1024], "float32"]], {}], "config": {"index": 258723, "code_hash": null, "entity": [["tile_x", "sp", [-1, 1, 1, 1]], ["tile_y", "sp", [-1, 2, 1, 128]], ["tile_k", "sp", [-1, 1, 1]]]}, "result": [[0.641292325], 0, 10.492616415023804, 1638792394.0412047], "version": 0.2, "tvm_version": "0.8.dev0"}
{"input": ["cuda -keys=cuda,gpu -max_num_threads=1024 -thread_warp_size=32", "dense_large_batch.gpu", [["TENSOR", [65536, 2], "float32"], ["TENSOR", [2, 1024], "float32"]], {}], "config": {"index": 131808, "code_hash": null, "entity": [["tile_x", "sp", [-1, 128, 2, 1]], ["tile_y", "sp", [-1, 64, 2, 4]], ["tile_k", "sp", [-1, 1, 1]]]}, "result": [[0.1172684], 0, 4.01613450050354, 1638792397.5176191], "version": 0.2, "tvm_version": "0.8.dev0"}
{"input": ["cuda -keys=cuda,gpu -max_num_threads=1024 -thread_warp_size=32", "dense_large_batch.gpu", [["TENSOR", [65536, 2], "float32"], ["TENSOR", [2, 1024], "float32"]], {}], "config": {"index": 131809, "code_hash": null, "entity": [["tile_x", "sp", [-1, 256, 2, 1]], ["tile_y", "sp", [-1, 64, 2, 4]], ["tile_k", "sp", [-1, 1, 1]]]}, "result": [[0.13013745], 0, 4.335846900939941, 1638792401.3247435], "version": 0.2, "tvm_version": "0.8.dev0"}
{"input": ["cuda -keys=cuda,gpu -max_num_threads=1024 -thread_warp_size=32", "dense_large_batch.gpu", [["TENSOR", [65536, 2], "float32"], ["TENSOR", [2, 1024], "float32"]], {}], "config": {"index": 248082, "code_hash": null, "entity": [["tile_x", "sp", [-1, 2, 2, 1]], ["tile_y", "sp", [-1, 1, 2, 64]], ["tile_k", "sp", [-1, 1, 1]]]}, "result": [[0.041210975], 0, 2.7358641624450684, 1638792406.2382221], "version": 0.2, "tvm_version": "0.8.dev0"}
{"input": ["cuda -keys=cuda,gpu -max_num_threads=1024 -thread_warp_size=32", "dense_large_batch.gpu", [["TENSOR", [65536, 2], "float32"], ["TENSOR", [2, 1024], "float32"]], {}], "config": {"index": 119187, "code_hash": null, "entity": [["tile_x", "sp", [-1, 1, 1, 1]], ["tile_y", "sp", [-1, 4, 1, 4]], ["tile_k", "sp", [-1, 1, 1]]]}, "result": [[0.044618525], 0, 2.5484707355499268, 1638792408.598944], "version": 0.2, "tvm_version": "0.8.dev0"}
{"input": ["cuda -keys=cuda,gpu -max_num_threads=1024 -thread_warp_size=32", "dense_large_batch.gpu", [["TENSOR", [65536, 2], "float32"], ["TENSOR", [2, 1024], "float32"]], {}], "config": {"index": 131803, "code_hash": null, "entity": [["tile_x", "sp", [-1, 4, 2, 1]], ["tile_y", "sp", [-1, 64, 2, 4]], ["tile_k", "sp", [-1, 1, 1]]]}, "result": [[0.151061575], 0, 5.475242853164673, 1638792412.8745677], "version": 0.2, "tvm_version": "0.8.dev0"}
{"input": ["cuda -keys=cuda,gpu -max_num_threads=1024 -thread_warp_size=32", "dense_large_batch.gpu", [["TENSOR", [65536, 2], "float32"], ["TENSOR", [2, 1024], "float32"]], {}], "config": {"index": 95010, "code_hash": null, "entity": [["tile_x", "sp", [-1, 1, 8, 1]], ["tile_y", "sp", [-1, 32, 8, 2]], ["tile_k", "sp", [-1, 1, 1]]]}, "result": [[0.0058353611111111115], 0, 2.450698137283325, 1638792415.3191402], "version": 0.2, "tvm_version": "0.8.dev0"}
{"input": ["cuda -keys=cuda,gpu -max_num_threads=1024 -thread_warp_size=32", "dense_large_batch.gpu", [["TENSOR", [65536, 2], "float32"], ["TENSOR", [2, 1024], "float32"]], {}], "config": {"index": 127928, "code_hash": null, "entity": [["tile_x", "sp", [-1, 8, 2, 1]], ["tile_y", "sp", [-1, 4, 2, 4]], ["tile_k", "sp", [-1, 1, 1]]]}, "result": [[0.012746227272727272], 0, 2.7480580806732178, 1638792456.0307853], "version": 0.2, "tvm_version": "0.8.dev0"}
{"input": ["cuda -keys=cuda,gpu -max_num_threads=1024 -thread_warp_size=32", "dense_large_batch.gpu", [["TENSOR", [65536, 2], "float32"], ["TENSOR", [2, 1024], "float32"]], {}], "config": {"index": 41729, "code_hash": null, "entity": [["tile_x", "sp", [-1, 1, 16, 1]], ["tile_y", "sp", [-1, 32, 16, 1]], ["tile_k", "sp", [-1, 1, 1]]]}, "result": [[0.0040801243243243236], 0, 2.587907075881958, 1638792458.4686737], "version": 0.2, "tvm_version": "0.8.dev0"}
{"input": ["cuda -keys=cuda,gpu -max_num_threads=1024 -thread_warp_size=32", "dense_large_batch.gpu", [["TENSOR", [65536, 2], "float32"], ["TENSOR", [2, 1024], "float32"]], {}], "config": {"index": 33963, "code_hash": null, "entity": [["tile_x", "sp", [-1, 1, 8, 1]], ["tile_y", "sp", [-1, 32, 8, 1]], ["tile_k", "sp", [-1, 1, 1]]]}, "result": [[0.0032166375], 0, 2.6605641841888428, 1638792460.9154053], "version": 0.2, "tvm_version": "0.8.dev0"}
{"input": ["cuda -keys=cuda,gpu -max_num_threads=1024 -thread_warp_size=32", "dense_large_batch.gpu", [["TENSOR", [65536, 2], "float32"], ["TENSOR", [2, 1024], "float32"]], {}], "config": {"index": 34932, "code_hash": null, "entity": [["tile_x", "sp", [-1, 1, 8, 1]], ["tile_y", "sp", [-1, 64, 8, 1]], ["tile_k", "sp", [-1, 1, 1]]]}, "result": [[0.006797386666666667], 0, 2.4535481929779053, 1638792463.126313], "version": 0.2, "tvm_version": "0.8.dev0"}
{"input": ["cuda -keys=cuda,gpu -max_num_threads=1024 -thread_warp_size=32", "dense_large_batch.gpu", [["TENSOR", [65536, 2], "float32"], ["TENSOR", [2, 1024], "float32"]], {}], "config": {"index": 95011, "code_hash": null, "entity": [["tile_x", "sp", [-1, 2, 8, 1]], ["tile_y", "sp", [-1, 32, 8, 2]], ["tile_k", "sp", [-1, 1, 1]]]}, "result": [[0.009407772727272728], 0, 2.536799192428589, 1638792465.3599598], "version": 0.2, "tvm_version": "0.8.dev0"}
{"input": ["cuda -keys=cuda,gpu -max_num_threads=1024 -thread_warp_size=32", "dense_large_batch.gpu", [["TENSOR", [65536, 2], "float32"], ["TENSOR", [2, 1024], "float32"]], {}], "config": {"index": 33964, "code_hash": null, "entity": [["tile_x", "sp", [-1, 2, 8, 1]], ["tile_y", "sp", [-1, 32, 8, 1]], ["tile_k", "sp", [-1, 1, 1]]]}, "result": [[0.005105295], 0, 2.4357686042785645, 1638792467.5695412], "version": 0.2, "tvm_version": "0.8.dev0"}
{"input": ["cuda -keys=cuda,gpu -max_num_threads=1024 -thread_warp_size=32", "dense_large_batch.gpu", [["TENSOR", [65536, 2], "float32"], ["TENSOR", [2, 1024], "float32"]], {}], "config": {"index": 95979, "code_hash": null, "entity": [["tile_x", "sp", [-1, 1, 8, 1]], ["tile_y", "sp", [-1, 64, 8, 2]], ["tile_k", "sp", [-1, 1, 1]]]}, "result": [[0.02392486666666667], 0, 2.9316840171813965, 1638792470.0845644], "version": 0.2, "tvm_version": "0.8.dev0"}
{"input": ["cuda -keys=cuda,gpu -max_num_threads=1024 -thread_warp_size=32", "dense_large_batch.gpu", [["TENSOR", [65536, 2], "float32"], ["TENSOR", [2, 1024], "float32"]], {}], "config": {"index": 40760, "code_hash": null, "entity": [["tile_x", "sp", [-1, 1, 16, 1]], ["tile_y", "sp", [-1, 16, 16, 1]], ["tile_k", "sp", [-1, 1, 1]]]}, "result": [[0.0038627222222222223], 0, 2.3267412185668945, 1638792472.3356566], "version": 0.2, "tvm_version": "0.8.dev0"}
{"input": ["cuda -keys=cuda,gpu -max_num_threads=1024 -thread_warp_size=32", "dense_large_batch.gpu", [["TENSOR", [65536, 2], "float32"], ["TENSOR", [2, 1024], "float32"]], {}], "config": {"index": 94041, "code_hash": null, "entity": [["tile_x", "sp", [-1, 1, 8, 1]], ["tile_y", "sp", [-1, 16, 8, 2]], ["tile_k", "sp", [-1, 1, 1]]]}, "result": [[0.0027071], 0, 2.3696084022521973, 1638792476.1434555], "version": 0.2, "tvm_version": "0.8.dev0"}
{"input": ["cuda -keys=cuda,gpu -max_num_threads=1024 -thread_warp_size=32", "dense_large_batch.gpu", [["TENSOR", [65536, 2], "float32"], ["TENSOR", [2, 1024], "float32"]], {}], "config": {"index": 34933, "code_hash": null, "entity": [["tile_x", "sp", [-1, 2, 8, 1]], ["tile_y", "sp", [-1, 64, 8, 1]], ["tile_k", "sp", [-1, 1, 1]]]}, "result": [[0.008322461538461539], 0, 2.5930016040802, 1638792478.4130774], "version": 0.2, "tvm_version": "0.8.dev0"}
{"input": ["cuda -keys=cuda,gpu -max_num_threads=1024 -thread_warp_size=32", "dense_large_batch.gpu", [["TENSOR", [65536, 2], "float32"], ["TENSOR", [2, 1024], "float32"]], {}], "config": {"index": 39791, "code_hash": null, "entity": [["tile_x", "sp", [-1, 1, 16, 1]], ["tile_y", "sp", [-1, 8, 16, 1]], ["tile_k", "sp", [-1, 1, 1]]]}, "result": [[0.004007326923076923], 0, 2.3569676876068115, 1638792480.5815742], "version": 0.2, "tvm_version": "0.8.dev0"}
{"input": ["cuda -keys=cuda,gpu -max_num_threads=1024 -thread_warp_size=32", "dense_large_batch.gpu", [["TENSOR", [65536, 2], "float32"], ["TENSOR", [2, 1024], "float32"]], {}], "config": {"index": 32995, "code_hash": null, "entity": [["tile_x", "sp", [-1, 2, 8, 1]], ["tile_y", "sp", [-1, 16, 8, 1]], ["tile_k", "sp", [-1, 1, 1]]]}, "result": [[0.004941346875], 0, 2.5981318950653076, 1638792483.0644674], "version": 0.2, "tvm_version": "0.8.dev0"}
{"input": ["cuda -keys=cuda,gpu -max_num_threads=1024 -thread_warp_size=32", "dense_large_batch.gpu", [["TENSOR", [65536, 2], "float32"], ["TENSOR", [2, 1024], "float32"]], {}], "config": {"index": 94042, "code_hash": null, "entity": [["tile_x", "sp", [-1, 2, 8, 1]], ["tile_y", "sp", [-1, 16, 8, 2]], ["tile_k", "sp", [-1, 1, 1]]]}, "result": [[0.007667571428571428], 0, 2.416210651397705, 1638792485.2833488], "version": 0.2, "tvm_version": "0.8.dev0"}
{"input": ["cuda -keys=cuda,gpu -max_num_threads=1024 -thread_warp_size=32", "dense_large_batch.gpu", [["TENSOR", [65536, 2], "float32"], ["TENSOR", [2, 1024], "float32"]], {}], "config": {"index": 95012, "code_hash": null, "entity": [["tile_x", "sp", [-1, 4, 8, 1]], ["tile_y", "sp", [-1, 32, 8, 2]], ["tile_k", "sp", [-1, 1, 1]]]}, "result": [[0.022661816666666668], 0, 3.380941867828369, 1638792488.004945], "version": 0.2, "tvm_version": "0.8.dev0"}
{"input": ["cuda -keys=cuda,gpu -max_num_threads=1024 -thread_warp_size=32", "dense_large_batch.gpu", [["TENSOR", [65536, 2], "float32"], ["TENSOR", [2, 1024], "float32"]], {}], "config": {"index": 35901, "code_hash": null, "entity": [["tile_x", "sp", [-1, 1, 8, 1]], ["tile_y", "sp", [-1, 128, 8, 1]], ["tile_k", "sp", [-1, 1, 1]]]}, "result": [[0.019433333333333334], 0, 2.747836112976074, 1638792490.3544521], "version": 0.2, "tvm_version": "0.8.dev0"}
{"input": ["cuda -keys=cuda,gpu -max_num_threads=1024 -thread_warp_size=32", "dense_large_batch.gpu", [["TENSOR", [65536, 2], "float32"], ["TENSOR", [2, 1024], "float32"]], {}], "config": {"index": 42698, "code_hash": null, "entity": [["tile_x", "sp", [-1, 1, 16, 1]], ["tile_y", "sp", [-1, 64, 16, 1]], ["tile_k", "sp", [-1, 1, 1]]]}, "result": [[0.013214133333333333], 0, 2.5599846839904785, 1638792492.693414], "version": 0.2, "tvm_version": "0.8.dev0"}
{"input": ["cuda -keys=cuda,gpu -max_num_threads=1024 -thread_warp_size=32", "dense_large_batch.gpu", [["TENSOR", [65536, 2], "float32"], ["TENSOR", [2, 1024], "float32"]], {}], "config": {"index": 78508, "code_hash": null, "entity": [["tile_x", "sp", [-1, 4, 2, 1]], ["tile_y", "sp", [-1, 32, 2, 2]], ["tile_k", "sp", [-1, 1, 1]]]}, "result": [[0.11851815], 0, 4.468053340911865, 1638792498.553899], "version": 0.2, "tvm_version": "0.8.dev0"}
{"input": ["cuda -keys=cuda,gpu -max_num_threads=1024 -thread_warp_size=32", "dense_large_batch.gpu", [["TENSOR", [65536, 2], "float32"], ["TENSOR", [2, 1024], "float32"]], {}], "config": {"index": 75600, "code_hash": null, "entity": [["tile_x", "sp", [-1, 2, 2, 1]], ["tile_y", "sp", [-1, 4, 2, 2]], ["tile_k", "sp", [-1, 1, 1]]]}, "result": [[0.01758321666666667], 0, 2.7994930744171143, 1638792501.7129073], "version": 0.2, "tvm_version": "0.8.dev0"}
{"input": ["cuda -keys=cuda,gpu -max_num_threads=1024 -thread_warp_size=32", "dense_large_batch.gpu", [["TENSOR", [65536, 2], "float32"], ["TENSOR", [2, 1024], "float32"]], {}], "config": {"index": 33965, "code_hash": null, "entity": [["tile_x", "sp", [-1, 4, 8, 1]], ["tile_y", "sp", [-1, 32, 8, 1]], ["tile_k", "sp", [-1, 1, 1]]]}, "result": [[0.005936052941176471], 0, 2.9398179054260254, 1638792504.4078653], "version": 0.2, "tvm_version": "0.8.dev0"}
{"input": ["cuda -keys=cuda,gpu -max_num_threads=1024 -thread_warp_size=32", "dense_large_batch.gpu", [["TENSOR", [65536, 2], "float32"], ["TENSOR", [2, 1024], "float32"]], {}], "config": {"index": 41730, "code_hash": null, "entity": [["tile_x", "sp", [-1, 2, 16, 1]], ["tile_y", "sp", [-1, 32, 16, 1]], ["tile_k", "sp", [-1, 1, 1]]]}, "result": [[0.0039000296296296294], 0, 2.994882822036743, 1638792507.5017948], "version": 0.2, "tvm_version": "0.8.dev0"}
{"input": ["cuda -keys=cuda,gpu -max_num_threads=1024 -thread_warp_size=32", "dense_large_batch.gpu", [["TENSOR", [65536, 2], "float32"], ["TENSOR", [2, 1024], "float32"]], {}], "config": {"index": 93072, "code_hash": null, "entity": [["tile_x", "sp", [-1, 1, 8, 1]], ["tile_y", "sp", [-1, 8, 8, 2]], ["tile_k", "sp", [-1, 1, 1]]]}, "result": [[0.0032560697674418604], 0, 2.539977550506592, 1638792540.8405724], "version": 0.2, "tvm_version": "0.8.dev0"}
{"input": ["cuda -keys=cuda,gpu -max_num_threads=1024 -thread_warp_size=32", "dense_large_batch.gpu", [["TENSOR", [65536, 2], "float32"], ["TENSOR", [2, 1024], "float32"]], {}], "config": {"index": 67833, "code_hash": null, "entity": [["tile_x", "sp", [-1, 8, 1, 1]], ["tile_y", "sp", [-1, 16, 1, 2]], ["tile_k", "sp", [-1, 1, 1]]]}, "result": [[0.41152595000000003], 0, 8.076909065246582, 1638792548.3149164], "version": 0.2, "tvm_version": "0.8.dev0"}
{"input": ["cuda -keys=cuda,gpu -max_num_threads=1024 -thread_warp_size=32", "dense_large_batch.gpu", [["TENSOR", [65536, 2], "float32"], ["TENSOR", [2, 1024], "float32"]], {}], "config": {"index": 32026, "code_hash": null, "entity": [["tile_x", "sp", [-1, 2, 8, 1]], ["tile_y", "sp", [-1, 8, 8, 1]], ["tile_k", "sp", [-1, 1, 1]]]}, "result": [[0.00512669], 0, 2.3416733741760254, 1638792550.4629467], "version": 0.2, "tvm_version": "0.8.dev0"}
{"input": ["cuda -keys=cuda,gpu -max_num_threads=1024 -thread_warp_size=32", "dense_large_batch.gpu", [["TENSOR", [65536, 2], "float32"], ["TENSOR", [2, 1024], "float32"]], {}], "config": {"index": 93073, "code_hash": null, "entity": [["tile_x", "sp", [-1, 2, 8, 1]], ["tile_y", "sp", [-1, 8, 8, 2]], ["tile_k", "sp", [-1, 1, 1]]]}, "result": [[0.005941558823529412], 0, 2.3790347576141357, 1638792552.6061985], "version": 0.2, "tvm_version": "0.8.dev0"}
{"input": ["cuda -keys=cuda,gpu -max_num_threads=1024 -thread_warp_size=32", "dense_large_batch.gpu", [["TENSOR", [65536, 2], "float32"], ["TENSOR", [2, 1024], "float32"]], {}], "config": {"index": 32994, "code_hash": null, "entity": [["tile_x", "sp", [-1, 1, 8, 1]], ["tile_y", "sp", [-1, 16, 8, 1]], ["tile_k", "sp", [-1, 1, 1]]]}, "result": [[0.00265714], 0, 2.2886152267456055, 1638792554.724002], "version": 0.2, "tvm_version": "0.8.dev0"}
{"input": ["cuda -keys=cuda,gpu -max_num_threads=1024 -thread_warp_size=32", "dense_large_batch.gpu", [["TENSOR", [65536, 2], "float32"], ["TENSOR", [2, 1024], "float32"]], {}], "config": {"index": 40761, "code_hash": null, "entity": [["tile_x", "sp", [-1, 2, 16, 1]], ["tile_y", "sp", [-1, 16, 16, 1]], ["tile_k", "sp", [-1, 1, 1]]]}, "result": [[0.003788566666666667], 0, 2.3733816146850586, 1638792556.9321127], "version": 0.2, "tvm_version": "0.8.dev0"}
{"input": ["cuda -keys=cuda,gpu -max_num_threads=1024 -thread_warp_size=32", "dense_large_batch.gpu", [["TENSOR", [65536, 2], "float32"], ["TENSOR", [2, 1024], "float32"]], {}], "config": {"index": 144430, "code_hash": null, "entity": [["tile_x", "sp", [-1, 2, 8, 1]], ["tile_y", "sp", [-1, 16, 8, 4]], ["tile_k", "sp", [-1, 1, 1]]]}, "result": [[0.00516959], 0, 2.5366404056549072, 1638792559.1923404], "version": 0.2, "tvm_version": "0.8.dev0"}
{"input": ["cuda -keys=cuda,gpu -max_num_threads=1024 -thread_warp_size=32", "dense_large_batch.gpu", [["TENSOR", [65536, 2], "float32"], ["TENSOR", [2, 1024], "float32"]], {}], "config": {"index": 77539, "code_hash": null, "entity": [["tile_x", "sp", [-1, 4, 2, 1]], ["tile_y", "sp", [-1, 16, 2, 2]], ["tile_k", "sp", [-1, 1, 1]]]}, "result": [[0.009255781818181817], 0, 2.4760377407073975, 1638792561.4097955], "version": 0.2, "tvm_version": "0.8.dev0"}
{"input": ["cuda -keys=cuda,gpu -max_num_threads=1024 -thread_warp_size=32", "dense_large_batch.gpu", [["TENSOR", [65536, 2], "float32"], ["TENSOR", [2, 1024], "float32"]], {}], "config": {"index": 39792, "code_hash": null, "entity": [["tile_x", "sp", [-1, 2, 16, 1]], ["tile_y", "sp", [-1, 8, 16, 1]], ["tile_k", "sp", [-1, 1, 1]]]}, "result": [[0.0038857222222222227], 0, 2.386690855026245, 1638792563.607899], "version": 0.2, "tvm_version": "0.8.dev0"}
{"input": ["cuda -keys=cuda,gpu -max_num_threads=1024 -thread_warp_size=32", "dense_large_batch.gpu", [["TENSOR", [65536, 2], "float32"], ["TENSOR", [2, 1024], "float32"]], {}], "config": {"index": 144429, "code_hash": null, "entity": [["tile_x", "sp", [-1, 1, 8, 1]], ["tile_y", "sp", [-1, 16, 8, 4]], ["tile_k", "sp", [-1, 1, 1]]]}, "result": [[0.006295275], 0, 2.4133944511413574, 1638792565.816621], "version": 0.2, "tvm_version": "0.8.dev0"}
{"input": ["cuda -keys=cuda,gpu -max_num_threads=1024 -thread_warp_size=32", "dense_large_batch.gpu", [["TENSOR", [65536, 2], "float32"], ["TENSOR", [2, 1024], "float32"]], {}], "config": {"index": 76568, "code_hash": null, "entity": [["tile_x", "sp", [-1, 1, 2, 1]], ["tile_y", "sp", [-1, 8, 2, 2]], ["tile_k", "sp", [-1, 1, 1]]]}, "result": [[0.017997116666666667], 0, 2.460123300552368, 1638792568.1210744], "version": 0.2, "tvm_version": "0.8.dev0"}
{"input": ["cuda -keys=cuda,gpu -max_num_threads=1024 -thread_warp_size=32", "dense_large_batch.gpu", [["TENSOR", [65536, 2], "float32"], ["TENSOR", [2, 1024], "float32"]], {}], "config": {"index": 67830, "code_hash": null, "entity": [["tile_x", "sp", [-1, 1, 1, 1]], ["tile_y", "sp", [-1, 16, 1, 2]], ["tile_k", "sp", [-1, 1, 1]]]}, "result": [[0.038249925], 0, 2.478128433227539, 1638792570.4038248], "version": 0.2, "tvm_version": "0.8.dev0"}
{"input": ["cuda -keys=cuda,gpu -max_num_threads=1024 -thread_warp_size=32", "dense_large_batch.gpu", [["TENSOR", [65536, 2], "float32"], ["TENSOR", [2, 1024], "float32"]], {}], "config": {"index": 229672, "code_hash": null, "entity": [["tile_x", "sp", [-1, 4, 2, 1]], ["tile_y", "sp", [-1, 2, 2, 32]], ["tile_k", "sp", [-1, 1, 1]]]}, "result": [[0.012119322222222222], 0, 2.7264816761016846, 1638792572.8309207], "version": 0.2, "tvm_version": "0.8.dev0"}
{"input": ["cuda -keys=cuda,gpu -max_num_threads=1024 -thread_warp_size=32", "dense_large_batch.gpu", [["TENSOR", [65536, 2], "float32"], ["TENSOR", [2, 1024], "float32"]], {}], "config": {"index": 205446, "code_hash": null, "entity": [["tile_x", "sp", [-1, 2, 2, 1]], ["tile_y", "sp", [-1, 8, 2, 16]], ["tile_k", "sp", [-1, 1, 1]]]}, "result": [[0.01110308], 0, 2.7460176944732666, 1638792575.093363], "version": 0.2, "tvm_version": "0.8.dev0"}
{"input": ["cuda -keys=cuda,gpu -max_num_threads=1024 -thread_warp_size=32", "dense_large_batch.gpu", [["TENSOR", [65536, 2], "float32"], ["TENSOR", [2, 1024], "float32"]], {}], "config": {"index": 38822, "code_hash": null, "entity": [["tile_x", "sp", [-1, 1, 16, 1]], ["tile_y", "sp", [-1, 4, 16, 1]], ["tile_k", "sp", [-1, 1, 1]]]}, "result": [[0.0056596599999999995], 0, 2.471980094909668, 1638792578.8669367], "version": 0.2, "tvm_version": "0.8.dev0"}
{"input": ["cuda -keys=cuda,gpu -max_num_threads=1024 -thread_warp_size=32", "dense_large_batch.gpu", [["TENSOR", [65536, 2], "float32"], ["TENSOR", [2, 1024], "float32"]], {}], "config": {"index": 164733, "code_hash": null, "entity": [["tile_x", "sp", [-1, 8, 1, 1]], ["tile_y", "sp", [-1, 16, 1, 8]], ["tile_k", "sp", [-1, 1, 1]]]}, "result": [[0.434748025], 0, 8.28511643409729, 1638792586.504556], "version": 0.2, "tvm_version": "0.8.dev0"}
{"input": ["cuda -keys=cuda,gpu -max_num_threads=1024 -thread_warp_size=32", "dense_large_batch.gpu", [["TENSOR", [65536, 2], "float32"], ["TENSOR", [2, 1024], "float32"]], {}], "config": {"index": 14555, "code_hash": null, "entity": [["tile_x", "sp", [-1, 8, 2, 1]], ["tile_y", "sp", [-1, 16, 2, 1]], ["tile_k", "sp", [-1, 1, 1]]]}, "result": [[0.009355154545454545], 0, 2.484555959701538, 1638792588.7047753], "version": 0.2, "tvm_version": "0.8.dev0"}
{"input": ["cuda -keys=cuda,gpu -max_num_threads=1024 -thread_warp_size=32", "dense_large_batch.gpu", [["TENSOR", [65536, 2], "float32"], ["TENSOR", [2, 1024], "float32"]], {}], "config": {"index": 168626, "code_hash": null, "entity": [["tile_x", "sp", [-1, 8, 2, 1]], ["tile_y", "sp", [-1, 1, 2, 8]], ["tile_k", "sp", [-1, 1, 1]]]}, "result": [[0.011692655555555556], 0, 2.4925479888916016, 1638792590.962823], "version": 0.2, "tvm_version": "0.8.dev0"}
{"input": ["cuda -keys=cuda,gpu -max_num_threads=1024 -thread_warp_size=32", "dense_large_batch.gpu", [["TENSOR", [65536, 2], "float32"], ["TENSOR", [2, 1024], "float32"]], {}], "config": {"index": 76571, "code_hash": null, "entity": [["tile_x", "sp", [-1, 8, 2, 1]], ["tile_y", "sp", [-1, 8, 2, 2]], ["tile_k", "sp", [-1, 1, 1]]]}, "result": [[0.009341709090909091], 0, 2.5859155654907227, 1638792593.1770442], "version": 0.2, "tvm_version": "0.8.dev0"}
{"input": ["cuda -keys=cuda,gpu -max_num_threads=1024 -thread_warp_size=32", "dense_large_batch.gpu", [["TENSOR", [65536, 2], "float32"], ["TENSOR", [2, 1024], "float32"]], {}], "config": {"index": 37853, "code_hash": null, "entity": [["tile_x", "sp", [-1, 1, 16, 1]], ["tile_y", "sp", [-1, 2, 16, 1]], ["tile_k", "sp", [-1, 1, 1]]]}, "result": [[0.006558262499999999], 0, 2.3224620819091797, 1638792595.3282485], "version": 0.2, "tvm_version": "0.8.dev0"}
{"input": ["cuda -keys=cuda,gpu -max_num_threads=1024 -thread_warp_size=32", "dense_large_batch.gpu", [["TENSOR", [65536, 2], "float32"], ["TENSOR", [2, 1024], "float32"]], {}], "config": {"index": 13583, "code_hash": null, "entity": [["tile_x", "sp", [-1, 1, 2, 1]], ["tile_y", "sp", [-1, 8, 2, 1]], ["tile_k", "sp", [-1, 1, 1]]]}, "result": [[0.0261324], 0, 3.316774368286133, 1638792598.608621], "version": 0.2, "tvm_version": "0.8.dev0"}
{"input": ["cuda -keys=cuda,gpu -max_num_threads=1024 -thread_warp_size=32", "dense_large_batch.gpu", [["TENSOR", [65536, 2], "float32"], ["TENSOR", [2, 1024], "float32"]], {}], "config": {"index": 143461, "code_hash": null, "entity": [["tile_x", "sp", [-1, 2, 8, 1]], ["tile_y", "sp", [-1, 8, 8, 4]], ["tile_k", "sp", [-1, 1, 1]]]}, "result": [[0.007053713333333334], 0, 2.921818733215332, 1638792601.5436497], "version": 0.2, "tvm_version": "0.8.dev0"}
{"input": ["cuda -keys=cuda,gpu -max_num_threads=1024 -thread_warp_size=32", "dense_large_batch.gpu", [["TENSOR", [65536, 2], "float32"], ["TENSOR", [2, 1024], "float32"]], {}], "config": {"index": 42699, "code_hash": null, "entity": [["tile_x", "sp", [-1, 2, 16, 1]], ["tile_y", "sp", [-1, 64, 16, 1]], ["tile_k", "sp", [-1, 1, 1]]]}, "result": [[0.011865355555555556], 0, 3.1141624450683594, 1638792604.4004571], "version": 0.2, "tvm_version": "0.8.dev0"}
{"input": ["cuda -keys=cuda,gpu -max_num_threads=1024 -thread_warp_size=32", "dense_large_batch.gpu", [["TENSOR", [65536, 2], "float32"], ["TENSOR", [2, 1024], "float32"]], {}], "config": {"index": 202541, "code_hash": null, "entity": [["tile_x", "sp", [-1, 8, 2, 1]], ["tile_y", "sp", [-1, 1, 2, 16]], ["tile_k", "sp", [-1, 1, 1]]]}, "result": [[0.009295972727272728], 0, 3.0262162685394287, 1638792607.2768617], "version": 0.2, "tvm_version": "0.8.dev0"}
{"input": ["cuda -keys=cuda,gpu -max_num_threads=1024 -thread_warp_size=32", "dense_large_batch.gpu", [["TENSOR", [65536, 2], "float32"], ["TENSOR", [2, 1024], "float32"]], {}], "config": {"index": 32025, "code_hash": null, "entity": [["tile_x", "sp", [-1, 1, 8, 1]], ["tile_y", "sp", [-1, 8, 8, 1]], ["tile_k", "sp", [-1, 1, 1]]]}, "result": [[0.0029753823529411767], 0, 2.852173089981079, 1638792610.0111158], "version": 0.2, "tvm_version": "0.8.dev0"}
{"input": ["cuda -keys=cuda,gpu -max_num_threads=1024 -thread_warp_size=32", "dense_large_batch.gpu", [["TENSOR", [65536, 2], "float32"], ["TENSOR", [2, 1024], "float32"]], {}], "config": {"index": 32027, "code_hash": null, "entity": [["tile_x", "sp", [-1, 4, 8, 1]], ["tile_y", "sp", [-1, 8, 8, 1]], ["tile_k", "sp", [-1, 1, 1]]]}, "result": [[0.006175908], 0, 3.3995344638824463, 1638792613.5614698], "version": 0.2, "tvm_version": "0.8.dev0"}
{"input": ["cuda -keys=cuda,gpu -max_num_threads=1024 -thread_warp_size=32", "dense_large_batch.gpu", [["TENSOR", [65536, 2], "float32"], ["TENSOR", [2, 1024], "float32"]], {}], "config": {"index": 93074, "code_hash": null, "entity": [["tile_x", "sp", [-1, 4, 8, 1]], ["tile_y", "sp", [-1, 8, 8, 2]], ["tile_k", "sp", [-1, 1, 1]]]}, "result": [[0.009180527272727272], 0, 3.3979315757751465, 1638792616.8123934], "version": 0.2, "tvm_version": "0.8.dev0"}
{"input": ["cuda -keys=cuda,gpu -max_num_threads=1024 -thread_warp_size=32", "dense_large_batch.gpu", [["TENSOR", [65536, 2], "float32"], ["TENSOR", [2, 1024], "float32"]], {}], "config": {"index": 92104, "code_hash": null, "entity": [["tile_x", "sp", [-1, 2, 8, 1]], ["tile_y", "sp", [-1, 4, 8, 2]], ["tile_k", "sp", [-1, 1, 1]]]}, "result": [[0.00501836], 0, 3.4670135974884033, 1638792620.1609764], "version": 0.2, "tvm_version": "0.8.dev0"}
{"input": ["cuda -keys=cuda,gpu -max_num_threads=1024 -thread_warp_size=32", "dense_large_batch.gpu", [["TENSOR", [65536, 2], "float32"], ["TENSOR", [2, 1024], "float32"]], {}], "config": {"index": 203510, "code_hash": null, "entity": [["tile_x", "sp", [-1, 8, 2, 1]], ["tile_y", "sp", [-1, 2, 2, 16]], ["tile_k", "sp", [-1, 1, 1]]]}, "result": [[0.008612941666666667], 0, 3.2012624740600586, 1638792622.9481506], "version": 0.2, "tvm_version": "0.8.dev0"}
{"input": ["cuda -keys=cuda,gpu -max_num_threads=1024 -thread_warp_size=32", "dense_large_batch.gpu", [["TENSOR", [65536, 2], "float32"], ["TENSOR", [2, 1024], "float32"]], {}], "config": {"index": 133755, "code_hash": null, "entity": [["tile_x", "sp", [-1, 1, 4, 1]], ["tile_y", "sp", [-1, 1, 4, 4]], ["tile_k", "sp", [-1, 1, 1]]]}, "result": [[0.011831466666666665], 0, 3.102832555770874, 1638792626.3323443], "version": 0.2, "tvm_version": "0.8.dev0"}
{"input": ["cuda -keys=cuda,gpu -max_num_threads=1024 -thread_warp_size=32", "dense_large_batch.gpu", [["TENSOR", [65536, 2], "float32"], ["TENSOR", [2, 1024], "float32"]], {}], "config": {"index": 230640, "code_hash": null, "entity": [["tile_x", "sp", [-1, 2, 2, 1]], ["tile_y", "sp", [-1, 4, 2, 32]], ["tile_k", "sp", [-1, 1, 1]]]}, "result": [[0.015858514285714286], 0, 3.4267985820770264, 1638792629.3815374], "version": 0.2, "tvm_version": "0.8.dev0"}
{"input": ["cuda -keys=cuda,gpu -max_num_threads=1024 -thread_warp_size=32", "dense_large_batch.gpu", [["TENSOR", [65536, 2], "float32"], ["TENSOR", [2, 1024], "float32"]], {}], "config": {"index": 32996, "code_hash": null, "entity": [["tile_x", "sp", [-1, 4, 8, 1]], ["tile_y", "sp", [-1, 16, 8, 1]], ["tile_k", "sp", [-1, 1, 1]]]}, "result": [[0.0062003647058823524], 0, 2.9858274459838867, 1638792632.283875], "version": 0.2, "tvm_version": "0.8.dev0"}
