artifacts/Table3/tvm/autotvm/matmul/matmul_65536_1024_4096.log
{"input": ["cuda -keys=cuda,gpu -max_num_threads=1024 -thread_warp_size=32", "dense_large_batch.gpu", [["TENSOR", [65536, 1024], "float32"], ["TENSOR", [1024, 4096], "float32"]], {}], "config": {"index": 13541999, "code_hash": null, "entity": [["tile_x", "sp", [-1, 2, 32, 2]], ["tile_y", "sp", [-1, 1, 32, 16]], ["tile_k", "sp", [-1, 1, 8]]]}, "result": [[11.58539965], 0, 159.6756489276886, 1638801911.9956093], "version": 0.2, "tvm_version": "0.8.dev0"}
{"input": ["cuda -keys=cuda,gpu -max_num_threads=1024 -thread_warp_size=32", "dense_large_batch.gpu", [["TENSOR", [65536, 1024], "float32"], ["TENSOR", [1024, 4096], "float32"]], {}], "config": {"index": 383948, "code_hash": null, "entity": [["tile_x", "sp", [-1, 2, 32, 2]], ["tile_y", "sp", [-1, 1, 32, 64]], ["tile_k", "sp", [-1, 1, 1]]]}, "result": [[26.935268800000003], 0, 362.11459493637085, 1638802391.0037196], "version": 0.2, "tvm_version": "0.8.dev0"}
{"input": ["cuda -keys=cuda,gpu -max_num_threads=1024 -thread_warp_size=32", "dense_large_batch.gpu", [["TENSOR", [65536, 1024], "float32"], ["TENSOR", [1024, 4096], "float32"]], {}], "config": {"index": 353909, "code_hash": null, "entity": [["tile_x", "sp", [-1, 2, 32, 2]], ["tile_y", "sp", [-1, 1, 32, 32]], ["tile_k", "sp", [-1, 1, 1]]]}, "result": [[21.576826725], 0, 289.31704545021057, 1638802680.631895], "version": 0.2, "tvm_version": "0.8.dev0"}
{"input": ["cuda -keys=cuda,gpu -max_num_threads=1024 -thread_warp_size=32", "dense_large_batch.gpu", [["TENSOR", [65536, 1024], "float32"], ["TENSOR", [1024, 4096], "float32"]], {}], "config": {"index": 315149, "code_hash": null, "entity": [["tile_x", "sp", [-1, 2, 32, 2]], ["tile_y", "sp", [-1, 1, 32, 16]], ["tile_k", "sp", [-1, 1, 1]]]}, "result": [[6.283950625], 0, 90.7077784538269, 1638802771.595789], "version": 0.2, "tvm_version": "0.8.dev0"}
{"input": ["cuda -keys=cuda,gpu -max_num_threads=1024 -thread_warp_size=32", "dense_large_batch.gpu", [["TENSOR", [65536, 1024], "float32"], ["TENSOR", [1024, 4096], "float32"]], {}], "config": {"index": 266699, "code_hash": null, "entity": [["tile_x", "sp", [-1, 2, 32, 2]], ["tile_y", "sp", [-1, 1, 32, 8]], ["tile_k", "sp", [-1, 1, 1]]]}, "result": [[1.408040725], 0, 27.440317392349243, 1638803018.3332253], "version": 0.2, "tvm_version": "0.8.dev0"}
{"input": ["cuda -keys=cuda,gpu -max_num_threads=1024 -thread_warp_size=32", "dense_large_batch.gpu", [["TENSOR", [65536, 1024], "float32"], ["TENSOR", [1024, 4096], "float32"]], {}], "config": {"index": 406235, "code_hash": null, "entity": [["tile_x", "sp", [-1, 2, 32, 2]], ["tile_y", "sp", [-1, 1, 32, 128]], ["tile_k", "sp", [-1, 1, 1]]]}, "result": [[21.9135057], 0, 293.86465215682983, 1638803448.2276855], "version": 0.2, "tvm_version": "0.8.dev0"}
{"input": ["cuda -keys=cuda,gpu -max_num_threads=1024 -thread_warp_size=32", "dense_large_batch.gpu", [["TENSOR", [65536, 1024], "float32"], ["TENSOR", [1024, 4096], "float32"]], {}], "config": {"index": 5164994, "code_hash": null, "entity": [["tile_x", "sp", [-1, 2, 32, 2]], ["tile_y", "sp", [-1, 1, 32, 16]], ["tile_k", "sp", [-1, 1, 2]]]}, "result": [[7.187334225], 0, 102.78990960121155, 1638803551.148192], "version": 0.2, "tvm_version": "0.8.dev0"}
{"input": ["cuda -keys=cuda,gpu -max_num_threads=1024 -thread_warp_size=32", "dense_large_batch.gpu", [["TENSOR", [65536, 1024], "float32"], ["TENSOR", [1024, 4096], "float32"]], {}], "config": {"index": 9612704, "code_hash": null, "entity": [["tile_x", "sp", [-1, 2, 32, 2]], ["tile_y", "sp", [-1, 1, 32, 32]], ["tile_k", "sp", [-1, 1, 4]]]}, "result": [[24.581235975], 0, 329.73838686943054, 1638803881.0016124], "version": 0.2, "tvm_version": "0.8.dev0"}
{"input": ["cuda -keys=cuda,gpu -max_num_threads=1024 -thread_warp_size=32", "dense_large_batch.gpu", [["TENSOR", [65536, 1024], "float32"], ["TENSOR", [1024, 4096], "float32"]], {}], "config": {"index": 9573944, "code_hash": null, "entity": [["tile_x", "sp", [-1, 2, 32, 2]], ["tile_y", "sp", [-1, 1, 32, 16]], ["tile_k", "sp", [-1, 1, 4]]]}, "result": [[9.259312874999999], 0, 129.25840163230896, 1638804010.3056998], "version": 0.2, "tvm_version": "0.8.dev0"}
{"input": ["cuda -keys=cuda,gpu -max_num_threads=1024 -thread_warp_size=32", "dense_large_batch.gpu", [["TENSOR", [65536, 1024], "float32"], ["TENSOR", [1024, 4096], "float32"]], {}], "config": {"index": 5203754, "code_hash": null, "entity": [["tile_x", "sp", [-1, 2, 32, 2]], ["tile_y", "sp", [-1, 1, 32, 32]], ["tile_k", "sp", [-1, 1, 2]]]}, "result": [[19.296740975000002], 0, 260.93547320365906, 1638804271.707757], "version": 0.2, "tvm_version": "0.8.dev0"}
{"input": ["cuda -keys=cuda,gpu -max_num_threads=1024 -thread_warp_size=32", "dense_large_batch.gpu", [["TENSOR", [65536, 1024], "float32"], ["TENSOR", [1024, 4096], "float32"]], {}], "config": {"index": 1589384, "code_hash": null, "entity": [["tile_x", "sp", [-1, 2, 32, 2]], ["tile_y", "sp", [-1, 1, 32, 8]], ["tile_k", "sp", [-1, 8, 1]]]}, "result": [[0.882893975], 0, 19.916884183883667, 1638804291.5410697], "version": 0.2, "tvm_version": "0.8.dev0"}
{"input": ["cuda -keys=cuda,gpu -max_num_threads=1024 -thread_warp_size=32", "dense_large_batch.gpu", [["TENSOR", [65536, 1024], "float32"], ["TENSOR", [1024, 4096], "float32"]], {}], "config": {"index": 6046784, "code_hash": null, "entity": [["tile_x", "sp", [-1, 2, 32, 2]], ["tile_y", "sp", [-1, 1, 32, 16]], ["tile_k", "sp", [-1, 4, 2]]]}, "result": [[10.8684616], 0, 149.87667298316956, 1638804441.4397428], "version": 0.2, "tvm_version": "0.8.dev0"}
