artifacts/Table3/tvm/autotvm/matmul/matmul_128_2048_1000.log
{"input": ["cuda -keys=cuda,gpu -max_num_threads=1024 -thread_warp_size=32", "dense_large_batch.gpu", [["TENSOR", [128, 2048], "float32"], ["TENSOR", [2048, 1000], "float32"]], {}], "config": {"index": 626650, "code_hash": null, "entity": [["tile_x", "sp", [-1, 4, 2, 1]], ["tile_y", "sp", [-1, 25, 2, 1]], ["tile_k", "sp", [-1, 2, 2]]]}, "result": [[0.01925365], 0, 3.0835018157958984, 1638796232.5764012], "version": 0.2, "tvm_version": "0.8.dev0"}
{"input": ["cuda -keys=cuda,gpu -max_num_threads=1024 -thread_warp_size=32", "dense_large_batch.gpu", [["TENSOR", [128, 2048], "float32"], ["TENSOR", [2048, 1000], "float32"]], {}], "config": {"index": 1586505, "code_hash": null, "entity": [["tile_x", "sp", [-1, 2, 2, 16]], ["tile_y", "sp", [-1, 10, 2, 1]], ["tile_k", "sp", [-1, 1, 8]]]}, "result": [[0.14265325], 0, 4.772290945053101, 1638796241.587323], "version": 0.2, "tvm_version": "0.8.dev0"}
{"input": ["cuda -keys=cuda,gpu -max_num_threads=1024 -thread_warp_size=32", "dense_large_batch.gpu", [["TENSOR", [128, 2048], "float32"], ["TENSOR", [2048, 1000], "float32"]], {}], "config": {"index": 1082, "code_hash": null, "entity": [["tile_x", "sp", [-1, 4, 1, 1]], ["tile_y", "sp", [-1, 50, 1, 1]], ["tile_k", "sp", [-1, 1, 1]]]}, "result": [[0.0514291], 0, 1.8587195873260498, 1638796305.066738], "version": 0.2, "tvm_version": "0.8.dev0"}
{"input": ["cuda -keys=cuda,gpu -max_num_threads=1024 -thread_warp_size=32", "dense_large_batch.gpu", [["TENSOR", [128, 2048], "float32"], ["TENSOR", [2048, 1000], "float32"]], {}], "config": {"index": 843, "code_hash": null, "entity": [["tile_x", "sp", [-1, 8, 1, 1]], ["tile_y", "sp", [-1, 25, 1, 1]], ["tile_k", "sp", [-1, 1, 1]]]}, "result": [[0.02655765], 0, 2.0875885486602783, 1638796307.0351534], "version": 0.2, "tvm_version": "0.8.dev0"}
{"input": ["cuda -keys=cuda,gpu -max_num_threads=1024 -thread_warp_size=32", "dense_large_batch.gpu", [["TENSOR", [128, 2048], "float32"], ["TENSOR", [2048, 1000], "float32"]], {}], "config": {"index": 48844, "code_hash": null, "entity": [["tile_x", "sp", [-1, 16, 1, 1]], ["tile_y", "sp", [-1, 25, 1, 1]], ["tile_k", "sp", [-1, 2, 1]]]}, "result": [[0.4703306], 0, 8.476220846176147, 1638796315.4525785], "version": 0.2, "tvm_version": "0.8.dev0"}
{"input": ["cuda -keys=cuda,gpu -max_num_threads=1024 -thread_warp_size=32", "dense_large_batch.gpu", [["TENSOR", [128, 2048], "float32"], ["TENSOR", [2048, 1000], "float32"]], {}], "config": {"index": 1119, "code_hash": null, "entity": [["tile_x", "sp", [-1, 8, 1, 2]], ["tile_y", "sp", [-1, 50, 1, 1]], ["tile_k", "sp", [-1, 1, 1]]]}, "result": [[0.470113125], 0, 10.75287389755249, 1638796323.8394337], "version": 0.2, "tvm_version": "0.8.dev0"}
{"input": ["cuda -keys=cuda,gpu -max_num_threads=1024 -thread_warp_size=32", "dense_large_batch.gpu", [["TENSOR", [128, 2048], "float32"], ["TENSOR", [2048, 1000], "float32"]], {}], "config": {"index": 963, "code_hash": null, "entity": [["tile_x", "sp", [-1, 8, 1, 1]], ["tile_y", "sp", [-1, 40, 1, 1]], ["tile_k", "sp", [-1, 1, 1]]]}, "result": [[0.1105433], 0, 3.2141964435577393, 1638796326.8813653], "version": 0.2, "tvm_version": "0.8.dev0"}
{"input": ["cuda -keys=cuda,gpu -max_num_threads=1024 -thread_warp_size=32", "dense_large_batch.gpu", [["TENSOR", [128, 2048], "float32"], ["TENSOR", [2048, 1000], "float32"]], {}], "config": {"index": 999, "code_hash": null, "entity": [["tile_x", "sp", [-1, 8, 1, 2]], ["tile_y", "sp", [-1, 40, 1, 1]], ["tile_k", "sp", [-1, 1, 1]]]}, "result": [[0.482521525], 0, 9.821305274963379, 1638796335.1076033], "version": 0.2, "tvm_version": "0.8.dev0"}
{"input": ["cuda -keys=cuda,gpu -max_num_threads=1024 -thread_warp_size=32", "dense_large_batch.gpu", [["TENSOR", [128, 2048], "float32"], ["TENSOR", [2048, 1000], "float32"]], {}], "config": {"index": 576844, "code_hash": null, "entity": [["tile_x", "sp", [-1, 16, 1, 1]], ["tile_y", "sp", [-1, 25, 1, 1]], ["tile_k", "sp", [-1, 1, 2]]]}, "result": [[0.46553685], 0, 8.198115348815918, 1638796342.8547156], "version": 0.2, "tvm_version": "0.8.dev0"}
{"input": ["cuda -keys=cuda,gpu -max_num_threads=1024 -thread_warp_size=32", "dense_large_batch.gpu", [["TENSOR", [128, 2048], "float32"], ["TENSOR", [2048, 1000], "float32"]], {}], "config": {"index": 49118, "code_hash": null, "entity": [["tile_x", "sp", [-1, 4, 1, 2]], ["tile_y", "sp", [-1, 50, 1, 1]], ["tile_k", "sp", [-1, 2, 1]]]}, "result": [[0.4535651], 0, 9.588313102722168, 1638796351.452313], "version": 0.2, "tvm_version": "0.8.dev0"}
{"input": ["cuda -keys=cuda,gpu -max_num_threads=1024 -thread_warp_size=32", "dense_large_batch.gpu", [["TENSOR", [128, 2048], "float32"], ["TENSOR", [2048, 1000], "float32"]], {}], "config": {"index": 49119, "code_hash": null, "entity": [["tile_x", "sp", [-1, 8, 1, 2]], ["tile_y", "sp", [-1, 50, 1, 1]], ["tile_k", "sp", [-1, 2, 1]]]}, "result": [[0.4804715], 0, 12.676196575164795, 1638796360.5388947], "version": 0.2, "tvm_version": "0.8.dev0"}
{"input": ["cuda -keys=cuda,gpu -max_num_threads=1024 -thread_warp_size=32", "dense_large_batch.gpu", [["TENSOR", [128, 2048], "float32"], ["TENSOR", [2048, 1000], "float32"]], {}], "config": {"index": 12786, "code_hash": null, "entity": [["tile_x", "sp", [-1, 4, 1, 4]], ["tile_y", "sp", [-1, 25, 1, 2]], ["tile_k", "sp", [-1, 1, 1]]]}, "result": [[0.4994729], 0, 9.1794114112854, 1638796370.015066], "version": 0.2, "tvm_version": "0.8.dev0"}
{"input": ["cuda -keys=cuda,gpu -max_num_threads=1024 -thread_warp_size=32", "dense_large_batch.gpu", [["TENSOR", [128, 2048], "float32"], ["TENSOR", [2048, 1000], "float32"]], {}], "config": {"index": 12758, "code_hash": null, "entity": [["tile_x", "sp", [-1, 4, 1, 2]], ["tile_y", "sp", [-1, 25, 1, 2]], ["tile_k", "sp", [-1, 1, 1]]]}, "result": [[0.49633885], 0, 9.405805826187134, 1638796378.9729989], "version": 0.2, "tvm_version": "0.8.dev0"}
{"input": ["cuda -keys=cuda,gpu -max_num_threads=1024 -thread_warp_size=32", "dense_large_batch.gpu", [["TENSOR", [128, 2048], "float32"], ["TENSOR", [2048, 1000], "float32"]], {}], "config": {"index": 12639, "code_hash": null, "entity": [["tile_x", "sp", [-1, 8, 1, 2]], ["tile_y", "sp", [-1, 20, 1, 2]], ["tile_k", "sp", [-1, 1, 1]]]}, "result": [[0.579799725], 0, 10.619854211807251, 1638796388.9571183], "version": 0.2, "tvm_version": "0.8.dev0"}
{"input": ["cuda -keys=cuda,gpu -max_num_threads=1024 -thread_warp_size=32", "dense_large_batch.gpu", [["TENSOR", [128, 2048], "float32"], ["TENSOR", [2048, 1000], "float32"]], {}], "config": {"index": 1083, "code_hash": null, "entity": [["tile_x", "sp", [-1, 8, 1, 1]], ["tile_y", "sp", [-1, 50, 1, 1]], ["tile_k", "sp", [-1, 1, 1]]]}, "result": [[0.46397837500000005], 0, 8.403560638427734, 1638796396.8593252], "version": 0.2, "tvm_version": "0.8.dev0"}
{"input": ["cuda -keys=cuda,gpu -max_num_threads=1024 -thread_warp_size=32", "dense_large_batch.gpu", [["TENSOR", [128, 2048], "float32"], ["TENSOR", [2048, 1000], "float32"]], {}], "config": {"index": 50650, "code_hash": null, "entity": [["tile_x", "sp", [-1, 4, 2, 1]], ["tile_y", "sp", [-1, 25, 2, 1]], ["tile_k", "sp", [-1, 2, 1]]]}, "result": [[0.00966670909090909], 0, 2.274305820465088, 1638796399.0069087], "version": 0.2, "tvm_version": "0.8.dev0"}
{"input": ["cuda -keys=cuda,gpu -max_num_threads=1024 -thread_warp_size=32", "dense_large_batch.gpu", [["TENSOR", [128, 2048], "float32"], ["TENSOR", [2048, 1000], "float32"]], {}], "config": {"index": 48964, "code_hash": null, "entity": [["tile_x", "sp", [-1, 16, 1, 1]], ["tile_y", "sp", [-1, 40, 1, 1]], ["tile_k", "sp", [-1, 2, 1]]]}, "result": [[0.43669705], 0, 8.34493374824524, 1638796413.0828128], "version": 0.2, "tvm_version": "0.8.dev0"}
{"input": ["cuda -keys=cuda,gpu -max_num_threads=1024 -thread_warp_size=32", "dense_large_batch.gpu", [["TENSOR", [128, 2048], "float32"], ["TENSOR", [2048, 1000], "float32"]], {}], "config": {"index": 1118, "code_hash": null, "entity": [["tile_x", "sp", [-1, 4, 1, 2]], ["tile_y", "sp", [-1, 50, 1, 1]], ["tile_k", "sp", [-1, 1, 1]]]}, "result": [[0.45622205000000005], 0, 10.336064100265503, 1638796421.4078295], "version": 0.2, "tvm_version": "0.8.dev0"}
{"input": ["cuda -keys=cuda,gpu -max_num_threads=1024 -thread_warp_size=32", "dense_large_batch.gpu", [["TENSOR", [128, 2048], "float32"], ["TENSOR", [2048, 1000], "float32"]], {}], "config": {"index": 577083, "code_hash": null, "entity": [["tile_x", "sp", [-1, 8, 1, 1]], ["tile_y", "sp", [-1, 50, 1, 1]], ["tile_k", "sp", [-1, 1, 2]]]}, "result": [[0.615299475], 0, 13.494027137756348, 1638796432.8173015], "version": 0.2, "tvm_version": "0.8.dev0"}
{"input": ["cuda -keys=cuda,gpu -max_num_threads=1024 -thread_warp_size=32", "dense_large_batch.gpu", [["TENSOR", [128, 2048], "float32"], ["TENSOR", [2048, 1000], "float32"]], {}], "config": {"index": 625084, "code_hash": null, "entity": [["tile_x", "sp", [-1, 16, 1, 1]], ["tile_y", "sp", [-1, 50, 1, 1]], ["tile_k", "sp", [-1, 2, 2]]]}, "result": [[0.438884275], 0, 9.309388875961304, 1638796441.2570653], "version": 0.2, "tvm_version": "0.8.dev0"}
{"input": ["cuda -keys=cuda,gpu -max_num_threads=1024 -thread_warp_size=32", "dense_large_batch.gpu", [["TENSOR", [128, 2048], "float32"], ["TENSOR", [2048, 1000], "float32"]], {}], "config": {"index": 578650, "code_hash": null, "entity": [["tile_x", "sp", [-1, 4, 2, 1]], ["tile_y", "sp", [-1, 25, 2, 1]], ["tile_k", "sp", [-1, 1, 2]]]}, "result": [[0.009670954545454545], 0, 2.761972427368164, 1638796443.032721], "version": 0.2, "tvm_version": "0.8.dev0"}
{"input": ["cuda -keys=cuda,gpu -max_num_threads=1024 -thread_warp_size=32", "dense_large_batch.gpu", [["TENSOR", [128, 2048], "float32"], ["TENSOR", [2048, 1000], "float32"]], {}], "config": {"index": 577119, "code_hash": null, "entity": [["tile_x", "sp", [-1, 8, 1, 2]], ["tile_y", "sp", [-1, 50, 1, 1]], ["tile_k", "sp", [-1, 1, 2]]]}, "result": [[0.5601174999999999], 0, 15.135105848312378, 1638796452.9758105], "version": 0.2, "tvm_version": "0.8.dev0"}
{"input": ["cuda -keys=cuda,gpu -max_num_threads=1024 -thread_warp_size=32", "dense_large_batch.gpu", [["TENSOR", [128, 2048], "float32"], ["TENSOR", [2048, 1000], "float32"]], {}], "config": {"index": 1105120, "code_hash": null, "entity": [["tile_x", "sp", [-1, 16, 1, 2]], ["tile_y", "sp", [-1, 50, 1, 1]], ["tile_k", "sp", [-1, 1, 4]]]}, "result": [[0.588907725], 0, 11.928647756576538, 1638796462.5676317], "version": 0.2, "tvm_version": "0.8.dev0"}
{"input": ["cuda -keys=cuda,gpu -max_num_threads=1024 -thread_warp_size=32", "dense_large_batch.gpu", [["TENSOR", [128, 2048], "float32"], ["TENSOR", [2048, 1000], "float32"]], {}], "config": {"index": 577147, "code_hash": null, "entity": [["tile_x", "sp", [-1, 8, 1, 4]], ["tile_y", "sp", [-1, 50, 1, 1]], ["tile_k", "sp", [-1, 1, 2]]]}, "result": [[0.6208484999999999], 0, 14.79185700416565, 1638796472.7855706], "version": 0.2, "tvm_version": "0.8.dev0"}
{"input": ["cuda -keys=cuda,gpu -max_num_threads=1024 -thread_warp_size=32", "dense_large_batch.gpu", [["TENSOR", [128, 2048], "float32"], ["TENSOR", [2048, 1000], "float32"]], {}], "config": {"index": 625120, "code_hash": null, "entity": [["tile_x", "sp", [-1, 16, 1, 2]], ["tile_y", "sp", [-1, 50, 1, 1]], ["tile_k", "sp", [-1, 2, 2]]]}, "result": [[0.5670804500000001], 0, 11.338850021362305, 1638796482.298465], "version": 0.2, "tvm_version": "0.8.dev0"}
{"input": ["cuda -keys=cuda,gpu -max_num_threads=1024 -thread_warp_size=32", "dense_large_batch.gpu", [["TENSOR", [128, 2048], "float32"], ["TENSOR", [2048, 1000], "float32"]], {}], "config": {"index": 50649, "code_hash": null, "entity": [["tile_x", "sp", [-1, 2, 2, 1]], ["tile_y", "sp", [-1, 25, 2, 1]], ["tile_k", "sp", [-1, 2, 1]]]}, "result": [[0.016464742857142858], 0, 2.493972063064575, 1638796483.707885], "version": 0.2, "tvm_version": "0.8.dev0"}
{"input": ["cuda -keys=cuda,gpu -max_num_threads=1024 -thread_warp_size=32", "dense_large_batch.gpu", [["TENSOR", [128, 2048], "float32"], ["TENSOR", [2048, 1000], "float32"]], {}], "config": {"index": 1116760, "code_hash": null, "entity": [["tile_x", "sp", [-1, 16, 1, 2]], ["tile_y", "sp", [-1, 25, 1, 2]], ["tile_k", "sp", [-1, 1, 4]]]}, "result": [[0.6037418], 0, 12.382725477218628, 1638796493.5105684], "version": 0.2, "tvm_version": "0.8.dev0"}
{"input": ["cuda -keys=cuda,gpu -max_num_threads=1024 -thread_warp_size=32", "dense_large_batch.gpu", [["TENSOR", [128, 2048], "float32"], ["TENSOR", [2048, 1000], "float32"]], {}], "config": {"index": 588604, "code_hash": null, "entity": [["tile_x", "sp", [-1, 16, 1, 1]], ["tile_y", "sp", [-1, 20, 1, 2]], ["tile_k", "sp", [-1, 1, 2]]]}, "result": [[0.44209912500000004], 0, 8.538496017456055, 1638796501.075429], "version": 0.2, "tvm_version": "0.8.dev0"}
{"input": ["cuda -keys=cuda,gpu -max_num_threads=1024 -thread_warp_size=32", "dense_large_batch.gpu", [["TENSOR", [128, 2048], "float32"], ["TENSOR", [2048, 1000], "float32"]], {}], "config": {"index": 1105084, "code_hash": null, "entity": [["tile_x", "sp", [-1, 16, 1, 1]], ["tile_y", "sp", [-1, 50, 1, 1]], ["tile_k", "sp", [-1, 1, 4]]]}, "result": [[0.437515875], 0, 9.503285884857178, 1638796508.9672554], "version": 0.2, "tvm_version": "0.8.dev0"}
{"input": ["cuda -keys=cuda,gpu -max_num_threads=1024 -thread_warp_size=32", "dense_large_batch.gpu", [["TENSOR", [128, 2048], "float32"], ["TENSOR", [2048, 1000], "float32"]], {}], "config": {"index": 49147, "code_hash": null, "entity": [["tile_x", "sp", [-1, 8, 1, 4]], ["tile_y", "sp", [-1, 50, 1, 1]], ["tile_k", "sp", [-1, 2, 1]]]}, "result": [[0.5722979749999999], 0, 15.612909317016602, 1638796519.4534807], "version": 0.2, "tvm_version": "0.8.dev0"}
{"input": ["cuda -keys=cuda,gpu -max_num_threads=1024 -thread_warp_size=32", "dense_large_batch.gpu", [["TENSOR", [128, 2048], "float32"], ["TENSOR", [2048, 1000], "float32"]], {}], "config": {"index": 576964, "code_hash": null, "entity": [["tile_x", "sp", [-1, 16, 1, 1]], ["tile_y", "sp", [-1, 40, 1, 1]], ["tile_k", "sp", [-1, 1, 2]]]}, "result": [[0.4840925], 0, 9.470712900161743, 1638796527.5157208], "version": 0.2, "tvm_version": "0.8.dev0"}
{"input": ["cuda -keys=cuda,gpu -max_num_threads=1024 -thread_warp_size=32", "dense_large_batch.gpu", [["TENSOR", [128, 2048], "float32"], ["TENSOR", [2048, 1000], "float32"]], {}], "config": {"index": 49027, "code_hash": null, "entity": [["tile_x", "sp", [-1, 8, 1, 4]], ["tile_y", "sp", [-1, 40, 1, 1]], ["tile_k", "sp", [-1, 2, 1]]]}, "result": [[0.513957325], 0, 13.639584302902222, 1638796537.6166496], "version": 0.2, "tvm_version": "0.8.dev0"}
{"input": ["cuda -keys=cuda,gpu -max_num_threads=1024 -thread_warp_size=32", "dense_large_batch.gpu", [["TENSOR", [128, 2048], "float32"], ["TENSOR", [2048, 1000], "float32"]], {}], "config": {"index": 49084, "code_hash": null, "entity": [["tile_x", "sp", [-1, 16, 1, 1]], ["tile_y", "sp", [-1, 50, 1, 1]], ["tile_k", "sp", [-1, 2, 1]]]}, "result": [[0.44738535], 0, 9.313151359558105, 1638796545.8905864], "version": 0.2, "tvm_version": "0.8.dev0"}
{"input": ["cuda -keys=cuda,gpu -max_num_threads=1024 -thread_warp_size=32", "dense_large_batch.gpu", [["TENSOR", [128, 2048], "float32"], ["TENSOR", [2048, 1000], "float32"]], {}], "config": {"index": 588759, "code_hash": null, "entity": [["tile_x", "sp", [-1, 8, 1, 2]], ["tile_y", "sp", [-1, 25, 1, 2]], ["tile_k", "sp", [-1, 1, 2]]]}, "result": [[0.5824633250000001], 0, 13.245570182800293, 1638796556.2087154], "version": 0.2, "tvm_version": "0.8.dev0"}
{"input": ["cuda -keys=cuda,gpu -max_num_threads=1024 -thread_warp_size=32", "dense_large_batch.gpu", [["TENSOR", [128, 2048], "float32"], ["TENSOR", [2048, 1000], "float32"]], {}], "config": {"index": 1146, "code_hash": null, "entity": [["tile_x", "sp", [-1, 4, 1, 4]], ["tile_y", "sp", [-1, 50, 1, 1]], ["tile_k", "sp", [-1, 1, 1]]]}, "result": [[0.43715550000000003], 0, 9.131030559539795, 1638796563.6350439], "version": 0.2, "tvm_version": "0.8.dev0"}
{"input": ["cuda -keys=cuda,gpu -max_num_threads=1024 -thread_warp_size=32", "dense_large_batch.gpu", [["TENSOR", [128, 2048], "float32"], ["TENSOR", [2048, 1000], "float32"]], {}], "config": {"index": 49082, "code_hash": null, "entity": [["tile_x", "sp", [-1, 4, 1, 1]], ["tile_y", "sp", [-1, 50, 1, 1]], ["tile_k", "sp", [-1, 2, 1]]]}, "result": [[0.16160295], 0, 3.9442341327667236, 1638796569.7874155], "version": 0.2, "tvm_version": "0.8.dev0"}
{"input": ["cuda -keys=cuda,gpu -max_num_threads=1024 -thread_warp_size=32", "dense_large_batch.gpu", [["TENSOR", [128, 2048], "float32"], ["TENSOR", [2048, 1000], "float32"]], {}], "config": {"index": 625000, "code_hash": null, "entity": [["tile_x", "sp", [-1, 16, 1, 2]], ["tile_y", "sp", [-1, 40, 1, 1]], ["tile_k", "sp", [-1, 2, 2]]]}, "result": [[0.5071929749999999], 0, 10.773757934570312, 1638796579.453808], "version": 0.2, "tvm_version": "0.8.dev0"}
{"input": ["cuda -keys=cuda,gpu -max_num_threads=1024 -thread_warp_size=32", "dense_large_batch.gpu", [["TENSOR", [128, 2048], "float32"], ["TENSOR", [2048, 1000], "float32"]], {}], "config": {"index": 624844, "code_hash": null, "entity": [["tile_x", "sp", [-1, 16, 1, 1]], ["tile_y", "sp", [-1, 25, 1, 1]], ["tile_k", "sp", [-1, 2, 2]]]}, "result": [[0.4670348], 0, 11.624013185501099, 1638796590.3588471], "version": 0.2, "tvm_version": "0.8.dev0"}
{"input": ["cuda -keys=cuda,gpu -max_num_threads=1024 -thread_warp_size=32", "dense_large_batch.gpu", [["TENSOR", [128, 2048], "float32"], ["TENSOR", [2048, 1000], "float32"]], {}], "config": {"index": 49146, "code_hash": null, "entity": [["tile_x", "sp", [-1, 4, 1, 4]], ["tile_y", "sp", [-1, 50, 1, 1]], ["tile_k", "sp", [-1, 2, 1]]]}, "result": [[0.43693055], 0, 9.907455444335938, 1638796598.961782], "version": 0.2, "tvm_version": "0.8.dev0"}
{"input": ["cuda -keys=cuda,gpu -max_num_threads=1024 -thread_warp_size=32", "dense_large_batch.gpu", [["TENSOR", [128, 2048], "float32"], ["TENSOR", [2048, 1000], "float32"]], {}], "config": {"index": 48724, "code_hash": null, "entity": [["tile_x", "sp", [-1, 16, 1, 1]], ["tile_y", "sp", [-1, 20, 1, 1]], ["tile_k", "sp", [-1, 2, 1]]]}, "result": [[0.45990565], 0, 8.398101568222046, 1638796606.9085298], "version": 0.2, "tvm_version": "0.8.dev0"}
{"input": ["cuda -keys=cuda,gpu -max_num_threads=1024 -thread_warp_size=32", "dense_large_batch.gpu", [["TENSOR", [128, 2048], "float32"], ["TENSOR", [2048, 1000], "float32"]], {}], "config": {"index": 1116724, "code_hash": null, "entity": [["tile_x", "sp", [-1, 16, 1, 1]], ["tile_y", "sp", [-1, 25, 1, 2]], ["tile_k", "sp", [-1, 1, 4]]]}, "result": [[0.4522797], 0, 8.651911497116089, 1638796614.7404351], "version": 0.2, "tvm_version": "0.8.dev0"}
{"input": ["cuda -keys=cuda,gpu -max_num_threads=1024 -thread_warp_size=32", "dense_large_batch.gpu", [["TENSOR", [128, 2048], "float32"], ["TENSOR", [2048, 1000], "float32"]], {}], "config": {"index": 1152963, "code_hash": null, "entity": [["tile_x", "sp", [-1, 8, 1, 1]], ["tile_y", "sp", [-1, 40, 1, 1]], ["tile_k", "sp", [-1, 2, 4]]]}, "result": [[0.238769475], 0, 6.995938539505005, 1638796620.1971967], "version": 0.2, "tvm_version": "0.8.dev0"}
{"input": ["cuda -keys=cuda,gpu -max_num_threads=1024 -thread_warp_size=32", "dense_large_batch.gpu", [["TENSOR", [128, 2048], "float32"], ["TENSOR", [2048, 1000], "float32"]], {}], "config": {"index": 1584840, "code_hash": null, "entity": [["tile_x", "sp", [-1, 1, 1, 1]], ["tile_y", "sp", [-1, 25, 1, 1]], ["tile_k", "sp", [-1, 1, 8]]]}, "result": [[0.088478875], 0, 3.3269903659820557, 1638796623.3526096], "version": 0.2, "tvm_version": "0.8.dev0"}
{"input": ["cuda -keys=cuda,gpu -max_num_threads=1024 -thread_warp_size=32", "dense_large_batch.gpu", [["TENSOR", [128, 2048], "float32"], ["TENSOR", [2048, 1000], "float32"]], {}], "config": {"index": 1104841, "code_hash": null, "entity": [["tile_x", "sp", [-1, 2, 1, 1]], ["tile_y", "sp", [-1, 25, 1, 1]], ["tile_k", "sp", [-1, 1, 4]]]}, "result": [[0.074520225], 0, 3.484248638153076, 1638796726.9629264], "version": 0.2, "tvm_version": "0.8.dev0"}
{"input": ["cuda -keys=cuda,gpu -max_num_threads=1024 -thread_warp_size=32", "dense_large_batch.gpu", [["TENSOR", [128, 2048], "float32"], ["TENSOR", [2048, 1000], "float32"]], {}], "config": {"index": 1104842, "code_hash": null, "entity": [["tile_x", "sp", [-1, 4, 1, 1]], ["tile_y", "sp", [-1, 25, 1, 1]], ["tile_k", "sp", [-1, 1, 4]]]}, "result": [[0.174769175], 0, 4.39373779296875, 1638796730.8608155], "version": 0.2, "tvm_version": "0.8.dev0"}
{"input": ["cuda -keys=cuda,gpu -max_num_threads=1024 -thread_warp_size=32", "dense_large_batch.gpu", [["TENSOR", [128, 2048], "float32"], ["TENSOR", [2048, 1000], "float32"]], {}], "config": {"index": 1104843, "code_hash": null, "entity": [["tile_x", "sp", [-1, 8, 1, 1]], ["tile_y", "sp", [-1, 25, 1, 1]], ["tile_k", "sp", [-1, 1, 4]]]}, "result": [[0.1041438], 0, 4.589599132537842, 1638796734.3462157], "version": 0.2, "tvm_version": "0.8.dev0"}
{"input": ["cuda -keys=cuda,gpu -max_num_threads=1024 -thread_warp_size=32", "dense_large_batch.gpu", [["TENSOR", [128, 2048], "float32"], ["TENSOR", [2048, 1000], "float32"]], {}], "config": {"index": 1584842, "code_hash": null, "entity": [["tile_x", "sp", [-1, 4, 1, 1]], ["tile_y", "sp", [-1, 25, 1, 1]], ["tile_k", "sp", [-1, 1, 8]]]}, "result": [[0.17718405], 0, 4.899273872375488, 1638796738.3565803], "version": 0.2, "tvm_version": "0.8.dev0"}
{"input": ["cuda -keys=cuda,gpu -max_num_threads=1024 -thread_warp_size=32", "dense_large_batch.gpu", [["TENSOR", [128, 2048], "float32"], ["TENSOR", [2048, 1000], "float32"]], {}], "config": {"index": 1584841, "code_hash": null, "entity": [["tile_x", "sp", [-1, 2, 1, 1]], ["tile_y", "sp", [-1, 25, 1, 1]], ["tile_k", "sp", [-1, 1, 8]]]}, "result": [[0.32801955], 0, 6.549369812011719, 1638796744.240867], "version": 0.2, "tvm_version": "0.8.dev0"}
{"input": ["cuda -keys=cuda,gpu -max_num_threads=1024 -thread_warp_size=32", "dense_large_batch.gpu", [["TENSOR", [128, 2048], "float32"], ["TENSOR", [2048, 1000], "float32"]], {}], "config": {"index": 1104601, "code_hash": null, "entity": [["tile_x", "sp", [-1, 2, 1, 1]], ["tile_y", "sp", [-1, 10, 1, 1]], ["tile_k", "sp", [-1, 1, 4]]]}, "result": [[0.055458775], 0, 2.941782236099243, 1638796746.813913], "version": 0.2, "tvm_version": "0.8.dev0"}
{"input": ["cuda -keys=cuda,gpu -max_num_threads=1024 -thread_warp_size=32", "dense_large_batch.gpu", [["TENSOR", [128, 2048], "float32"], ["TENSOR", [2048, 1000], "float32"]], {}], "config": {"index": 1104722, "code_hash": null, "entity": [["tile_x", "sp", [-1, 4, 1, 1]], ["tile_y", "sp", [-1, 20, 1, 1]], ["tile_k", "sp", [-1, 1, 4]]]}, "result": [[0.15683445000000001], 0, 4.7181854248046875, 1638796750.9588654], "version": 0.2, "tvm_version": "0.8.dev0"}
{"input": ["cuda -keys=cuda,gpu -max_num_threads=1024 -thread_warp_size=32", "dense_large_batch.gpu", [["TENSOR", [128, 2048], "float32"], ["TENSOR", [2048, 1000], "float32"]], {}], "config": {"index": 1152842, "code_hash": null, "entity": [["tile_x", "sp", [-1, 4, 1, 1]], ["tile_y", "sp", [-1, 25, 1, 1]], ["tile_k", "sp", [-1, 2, 4]]]}, "result": [[0.177707], 0, 5.357709646224976, 1638796755.346972], "version": 0.2, "tvm_version": "0.8.dev0"}
{"input": ["cuda -keys=cuda,gpu -max_num_threads=1024 -thread_warp_size=32", "dense_large_batch.gpu", [["TENSOR", [128, 2048], "float32"], ["TENSOR", [2048, 1000], "float32"]], {}], "config": {"index": 1152841, "code_hash": null, "entity": [["tile_x", "sp", [-1, 2, 1, 1]], ["tile_y", "sp", [-1, 25, 1, 1]], ["tile_k", "sp", [-1, 2, 4]]]}, "result": [[0.06515655], 0, 4.099729537963867, 1638796758.9189217], "version": 0.2, "tvm_version": "0.8.dev0"}
{"input": ["cuda -keys=cuda,gpu -max_num_threads=1024 -thread_warp_size=32", "dense_large_batch.gpu", [["TENSOR", [128, 2048], "float32"], ["TENSOR", [2048, 1000], "float32"]], {}], "config": {"index": 1584601, "code_hash": null, "entity": [["tile_x", "sp", [-1, 2, 1, 1]], ["tile_y", "sp", [-1, 10, 1, 1]], ["tile_k", "sp", [-1, 1, 8]]]}, "result": [[0.055715200000000006], 0, 2.923058271408081, 1638796761.5527587], "version": 0.2, "tvm_version": "0.8.dev0"}
{"input": ["cuda -keys=cuda,gpu -max_num_threads=1024 -thread_warp_size=32", "dense_large_batch.gpu", [["TENSOR", [128, 2048], "float32"], ["TENSOR", [2048, 1000], "float32"]], {}], "config": {"index": 841, "code_hash": null, "entity": [["tile_x", "sp", [-1, 2, 1, 1]], ["tile_y", "sp", [-1, 25, 1, 1]], ["tile_k", "sp", [-1, 1, 1]]]}, "result": [[0.0665449], 0, 3.7691001892089844, 1638796765.1469471], "version": 0.2, "tvm_version": "0.8.dev0"}
{"input": ["cuda -keys=cuda,gpu -max_num_threads=1024 -thread_warp_size=32", "dense_large_batch.gpu", [["TENSOR", [128, 2048], "float32"], ["TENSOR", [2048, 1000], "float32"]], {}], "config": {"index": 840, "code_hash": null, "entity": [["tile_x", "sp", [-1, 1, 1, 1]], ["tile_y", "sp", [-1, 25, 1, 1]], ["tile_k", "sp", [-1, 1, 1]]]}, "result": [[0.1219133], 0, 4.384339809417725, 1638796768.7650204], "version": 0.2, "tvm_version": "0.8.dev0"}
{"input": ["cuda -keys=cuda,gpu -max_num_threads=1024 -thread_warp_size=32", "dense_large_batch.gpu", [["TENSOR", [128, 2048], "float32"], ["TENSOR", [2048, 1000], "float32"]], {}], "config": {"index": 96841, "code_hash": null, "entity": [["tile_x", "sp", [-1, 2, 1, 1]], ["tile_y", "sp", [-1, 25, 1, 1]], ["tile_k", "sp", [-1, 4, 1]]]}, "result": [[0.062115475], 0, 2.9309957027435303, 1638796771.0350862], "version": 0.2, "tvm_version": "0.8.dev0"}
{"input": ["cuda -keys=cuda,gpu -max_num_threads=1024 -thread_warp_size=32", "dense_large_batch.gpu", [["TENSOR", [128, 2048], "float32"], ["TENSOR", [2048, 1000], "float32"]], {}], "config": {"index": 96843, "code_hash": null, "entity": [["tile_x", "sp", [-1, 8, 1, 1]], ["tile_y", "sp", [-1, 25, 1, 1]], ["tile_k", "sp", [-1, 4, 1]]]}, "result": [[0.11380082500000001], 0, 5.364391326904297, 1638796775.3282201], "version": 0.2, "tvm_version": "0.8.dev0"}
{"input": ["cuda -keys=cuda,gpu -max_num_threads=1024 -thread_warp_size=32", "dense_large_batch.gpu", [["TENSOR", [128, 2048], "float32"], ["TENSOR", [2048, 1000], "float32"]], {}], "config": {"index": 842, "code_hash": null, "entity": [["tile_x", "sp", [-1, 4, 1, 1]], ["tile_y", "sp", [-1, 25, 1, 1]], ["tile_k", "sp", [-1, 1, 1]]]}, "result": [[0.036863325], 0, 2.4595963954925537, 1638796777.683569], "version": 0.2, "tvm_version": "0.8.dev0"}
{"input": ["cuda -keys=cuda,gpu -max_num_threads=1024 -thread_warp_size=32", "dense_large_batch.gpu", [["TENSOR", [128, 2048], "float32"], ["TENSOR", [2048, 1000], "float32"]], {}], "config": {"index": 1104602, "code_hash": null, "entity": [["tile_x", "sp", [-1, 4, 1, 1]], ["tile_y", "sp", [-1, 10, 1, 1]], ["tile_k", "sp", [-1, 1, 4]]]}, "result": [[0.031057775], 0, 3.457685708999634, 1638796780.2989988], "version": 0.2, "tvm_version": "0.8.dev0"}
{"input": ["cuda -keys=cuda,gpu -max_num_threads=1024 -thread_warp_size=32", "dense_large_batch.gpu", [["TENSOR", [128, 2048], "float32"], ["TENSOR", [2048, 1000], "float32"]], {}], "config": {"index": 1104840, "code_hash": null, "entity": [["tile_x", "sp", [-1, 1, 1, 1]], ["tile_y", "sp", [-1, 25, 1, 1]], ["tile_k", "sp", [-1, 1, 4]]]}, "result": [[0.11597385], 0, 3.7046008110046387, 1638796783.4212186], "version": 0.2, "tvm_version": "0.8.dev0"}
{"input": ["cuda -keys=cuda,gpu -max_num_threads=1024 -thread_warp_size=32", "dense_large_batch.gpu", [["TENSOR", [128, 2048], "float32"], ["TENSOR", [2048, 1000], "float32"]], {}], "config": {"index": 96842, "code_hash": null, "entity": [["tile_x", "sp", [-1, 4, 1, 1]], ["tile_y", "sp", [-1, 25, 1, 1]], ["tile_k", "sp", [-1, 4, 1]]]}, "result": [[0.043137375], 0, 2.6428160667419434, 1638796785.2165518], "version": 0.2, "tvm_version": "0.8.dev0"}
{"input": ["cuda -keys=cuda,gpu -max_num_threads=1024 -thread_warp_size=32", "dense_large_batch.gpu", [["TENSOR", [128, 2048], "float32"], ["TENSOR", [2048, 1000], "float32"]], {}], "config": {"index": 144841, "code_hash": null, "entity": [["tile_x", "sp", [-1, 2, 1, 1]], ["tile_y", "sp", [-1, 25, 1, 1]], ["tile_k", "sp", [-1, 8, 1]]]}, "result": [[0.06422087500000001], 0, 2.9759082794189453, 1638796788.0793524], "version": 0.2, "tvm_version": "0.8.dev0"}
{"input": ["cuda -keys=cuda,gpu -max_num_threads=1024 -thread_warp_size=32", "dense_large_batch.gpu", [["TENSOR", [128, 2048], "float32"], ["TENSOR", [2048, 1000], "float32"]], {}], "config": {"index": 144842, "code_hash": null, "entity": [["tile_x", "sp", [-1, 4, 1, 1]], ["tile_y", "sp", [-1, 25, 1, 1]], ["tile_k", "sp", [-1, 8, 1]]]}, "result": [[0.04650925], 0, 3.7083630561828613, 1638796791.154759], "version": 0.2, "tvm_version": "0.8.dev0"}
{"input": ["cuda -keys=cuda,gpu -max_num_threads=1024 -thread_warp_size=32", "dense_large_batch.gpu", [["TENSOR", [128, 2048], "float32"], ["TENSOR", [2048, 1000], "float32"]], {}], "config": {"index": 624601, "code_hash": null, "entity": [["tile_x", "sp", [-1, 2, 1, 1]], ["tile_y", "sp", [-1, 10, 1, 1]], ["tile_k", "sp", [-1, 2, 2]]]}, "result": [[0.055510075], 0, 3.440674304962158, 1638796794.4008622], "version": 0.2, "tvm_version": "0.8.dev0"}
{"input": ["cuda -keys=cuda,gpu -max_num_threads=1024 -thread_warp_size=32", "dense_large_batch.gpu", [["TENSOR", [128, 2048], "float32"], ["TENSOR", [2048, 1000], "float32"]], {}], "config": {"index": 1104481, "code_hash": null, "entity": [["tile_x", "sp", [-1, 2, 1, 1]], ["tile_y", "sp", [-1, 8, 1, 1]], ["tile_k", "sp", [-1, 1, 4]]]}, "result": [[0.049131925], 0, 3.760544776916504, 1638796797.857874], "version": 0.2, "tvm_version": "0.8.dev0"}
{"input": ["cuda -keys=cuda,gpu -max_num_threads=1024 -thread_warp_size=32", "dense_large_batch.gpu", [["TENSOR", [128, 2048], "float32"], ["TENSOR", [2048, 1000], "float32"]], {}], "config": {"index": 1104723, "code_hash": null, "entity": [["tile_x", "sp", [-1, 8, 1, 1]], ["tile_y", "sp", [-1, 20, 1, 1]], ["tile_k", "sp", [-1, 1, 4]]]}, "result": [[0.094069675], 0, 3.886662244796753, 1638796800.9217534], "version": 0.2, "tvm_version": "0.8.dev0"}
{"input": ["cuda -keys=cuda,gpu -max_num_threads=1024 -thread_warp_size=32", "dense_large_batch.gpu", [["TENSOR", [128, 2048], "float32"], ["TENSOR", [2048, 1000], "float32"]], {}], "config": {"index": 624841, "code_hash": null, "entity": [["tile_x", "sp", [-1, 2, 1, 1]], ["tile_y", "sp", [-1, 25, 1, 1]], ["tile_k", "sp", [-1, 2, 2]]]}, "result": [[0.06217495], 0, 2.83807373046875, 1638796803.0143306], "version": 0.2, "tvm_version": "0.8.dev0"}
{"input": ["cuda -keys=cuda,gpu -max_num_threads=1024 -thread_warp_size=32", "dense_large_batch.gpu", [["TENSOR", [128, 2048], "float32"], ["TENSOR", [2048, 1000], "float32"]], {}], "config": {"index": 1584721, "code_hash": null, "entity": [["tile_x", "sp", [-1, 2, 1, 1]], ["tile_y", "sp", [-1, 20, 1, 1]], ["tile_k", "sp", [-1, 1, 8]]]}, "result": [[0.32960567500000004], 0, 6.95791220664978, 1638796811.788007], "version": 0.2, "tvm_version": "0.8.dev0"}
{"input": ["cuda -keys=cuda,gpu -max_num_threads=1024 -thread_warp_size=32", "dense_large_batch.gpu", [["TENSOR", [128, 2048], "float32"], ["TENSOR", [2048, 1000], "float32"]], {}], "config": {"index": 1584602, "code_hash": null, "entity": [["tile_x", "sp", [-1, 4, 1, 1]], ["tile_y", "sp", [-1, 10, 1, 1]], ["tile_k", "sp", [-1, 1, 8]]]}, "result": [[0.036541424999999995], 0, 2.5004897117614746, 1638796813.5454175], "version": 0.2, "tvm_version": "0.8.dev0"}
{"input": ["cuda -keys=cuda,gpu -max_num_threads=1024 -thread_warp_size=32", "dense_large_batch.gpu", [["TENSOR", [128, 2048], "float32"], ["TENSOR", [2048, 1000], "float32"]], {}], "config": {"index": 1104603, "code_hash": null, "entity": [["tile_x", "sp", [-1, 8, 1, 1]], ["tile_y", "sp", [-1, 10, 1, 1]], ["tile_k", "sp", [-1, 1, 4]]]}, "result": [[0.025148575], 0, 2.602064609527588, 1638796815.1879027], "version": 0.2, "tvm_version": "0.8.dev0"}
{"input": ["cuda -keys=cuda,gpu -max_num_threads=1024 -thread_warp_size=32", "dense_large_batch.gpu", [["TENSOR", [128, 2048], "float32"], ["TENSOR", [2048, 1000], "float32"]], {}], "config": {"index": 1116481, "code_hash": null, "entity": [["tile_x", "sp", [-1, 2, 1, 1]], ["tile_y", "sp", [-1, 10, 1, 2]], ["tile_k", "sp", [-1, 1, 4]]]}, "result": [[0.050723525000000005], 0, 2.9310314655303955, 1638796817.3697376], "version": 0.2, "tvm_version": "0.8.dev0"}
{"input": ["cuda -keys=cuda,gpu -max_num_threads=1024 -thread_warp_size=32", "dense_large_batch.gpu", [["TENSOR", [128, 2048], "float32"], ["TENSOR", [2048, 1000], "float32"]], {}], "config": {"index": 624842, "code_hash": null, "entity": [["tile_x", "sp", [-1, 4, 1, 1]], ["tile_y", "sp", [-1, 25, 1, 1]], ["tile_k", "sp", [-1, 2, 2]]]}, "result": [[0.043612025000000006], 0, 3.5885705947875977, 1638796820.65624], "version": 0.2, "tvm_version": "0.8.dev0"}
{"input": ["cuda -keys=cuda,gpu -max_num_threads=1024 -thread_warp_size=32", "dense_large_batch.gpu", [["TENSOR", [128, 2048], "float32"], ["TENSOR", [2048, 1000], "float32"]], {}], "config": {"index": 1584361, "code_hash": null, "entity": [["tile_x", "sp", [-1, 2, 1, 1]], ["tile_y", "sp", [-1, 5, 1, 1]], ["tile_k", "sp", [-1, 1, 8]]]}, "result": [[0.05496105], 0, 3.3971924781799316, 1638796823.3828366], "version": 0.2, "tvm_version": "0.8.dev0"}
{"input": ["cuda -keys=cuda,gpu -max_num_threads=1024 -thread_warp_size=32", "dense_large_batch.gpu", [["TENSOR", [128, 2048], "float32"], ["TENSOR", [2048, 1000], "float32"]], {}], "config": {"index": 1584362, "code_hash": null, "entity": [["tile_x", "sp", [-1, 4, 1, 1]], ["tile_y", "sp", [-1, 5, 1, 1]], ["tile_k", "sp", [-1, 1, 8]]]}, "result": [[0.033295975], 0, 2.3981823921203613, 1638796825.1415722], "version": 0.2, "tvm_version": "0.8.dev0"}
{"input": ["cuda -keys=cuda,gpu -max_num_threads=1024 -thread_warp_size=32", "dense_large_batch.gpu", [["TENSOR", [128, 2048], "float32"], ["TENSOR", [2048, 1000], "float32"]], {}], "config": {"index": 576842, "code_hash": null, "entity": [["tile_x", "sp", [-1, 4, 1, 1]], ["tile_y", "sp", [-1, 25, 1, 1]], ["tile_k", "sp", [-1, 1, 2]]]}, "result": [[0.039004800000000006], 0, 3.516606330871582, 1638796827.8528833], "version": 0.2, "tvm_version": "0.8.dev0"}
{"input": ["cuda -keys=cuda,gpu -max_num_threads=1024 -thread_warp_size=32", "dense_large_batch.gpu", [["TENSOR", [128, 2048], "float32"], ["TENSOR", [2048, 1000], "float32"]], {}], "config": {"index": 624843, "code_hash": null, "entity": [["tile_x", "sp", [-1, 8, 1, 1]], ["tile_y", "sp", [-1, 25, 1, 1]], ["tile_k", "sp", [-1, 2, 2]]]}, "result": [[0.23440205], 0, 5.860024452209473, 1638796832.6894345], "version": 0.2, "tvm_version": "0.8.dev0"}
{"input": ["cuda -keys=cuda,gpu -max_num_threads=1024 -thread_warp_size=32", "dense_large_batch.gpu", [["TENSOR", [128, 2048], "float32"], ["TENSOR", [2048, 1000], "float32"]], {}], "config": {"index": 361, "code_hash": null, "entity": [["tile_x", "sp", [-1, 2, 1, 1]], ["tile_y", "sp", [-1, 5, 1, 1]], ["tile_k", "sp", [-1, 1, 1]]]}, "result": [[0.09051665], 0, 3.008657455444336, 1638796835.6280775], "version": 0.2, "tvm_version": "0.8.dev0"}
{"input": ["cuda -keys=cuda,gpu -max_num_threads=1024 -thread_warp_size=32", "dense_large_batch.gpu", [["TENSOR", [128, 2048], "float32"], ["TENSOR", [2048, 1000], "float32"]], {}], "config": {"index": 120, "code_hash": null, "entity": [["tile_x", "sp", [-1, 1, 1, 1]], ["tile_y", "sp", [-1, 2, 1, 1]], ["tile_k", "sp", [-1, 1, 1]]]}, "result": [[0.158580275], 0, 3.9233150482177734, 1638796839.3088691], "version": 0.2, "tvm_version": "0.8.dev0"}
{"input": ["cuda -keys=cuda,gpu -max_num_threads=1024 -thread_warp_size=32", "dense_large_batch.gpu", [["TENSOR", [128, 2048], "float32"], ["TENSOR", [2048, 1000], "float32"]], {}], "config": {"index": 0, "code_hash": null, "entity": [["tile_x", "sp", [-1, 1, 1, 1]], ["tile_y", "sp", [-1, 1, 1, 1]], ["tile_k", "sp", [-1, 1, 1]]]}, "result": [[0.2293889], 0, 5.522668838500977, 1638796845.1079788], "version": 0.2, "tvm_version": "0.8.dev0"}
{"input": ["cuda -keys=cuda,gpu -max_num_threads=1024 -thread_warp_size=32", "dense_large_batch.gpu", [["TENSOR", [128, 2048], "float32"], ["TENSOR", [2048, 1000], "float32"]], {}], "config": {"index": 121, "code_hash": null, "entity": [["tile_x", "sp", [-1, 2, 1, 1]], ["tile_y", "sp", [-1, 2, 1, 1]], ["tile_k", "sp", [-1, 1, 1]]]}, "result": [[0.1045759], 0, 3.2150042057037354, 1638796847.9916613], "version": 0.2, "tvm_version": "0.8.dev0"}
{"input": ["cuda -keys=cuda,gpu -max_num_threads=1024 -thread_warp_size=32", "dense_large_batch.gpu", [["TENSOR", [128, 2048], "float32"], ["TENSOR", [2048, 1000], "float32"]], {}], "config": {"index": 96601, "code_hash": null, "entity": [["tile_x", "sp", [-1, 2, 1, 1]], ["tile_y", "sp", [-1, 10, 1, 1]], ["tile_k", "sp", [-1, 4, 1]]]}, "result": [[0.055495275], 0, 2.5942769050598145, 1638796849.9091706], "version": 0.2, "tvm_version": "0.8.dev0"}
{"input": ["cuda -keys=cuda,gpu -max_num_threads=1024 -thread_warp_size=32", "dense_large_batch.gpu", [["TENSOR", [128, 2048], "float32"], ["TENSOR", [2048, 1000], "float32"]], {}], "config": {"index": 1104600, "code_hash": null, "entity": [["tile_x", "sp", [-1, 1, 1, 1]], ["tile_y", "sp", [-1, 10, 1, 1]], ["tile_k", "sp", [-1, 1, 4]]]}, "result": [[0.1067269], 0, 4.2307233810424805, 1638796853.3612716], "version": 0.2, "tvm_version": "0.8.dev0"}
{"input": ["cuda -keys=cuda,gpu -max_num_threads=1024 -thread_warp_size=32", "dense_large_batch.gpu", [["TENSOR", [128, 2048], "float32"], ["TENSOR", [2048, 1000], "float32"]], {}], "config": {"index": 1104361, "code_hash": null, "entity": [["tile_x", "sp", [-1, 2, 1, 1]], ["tile_y", "sp", [-1, 5, 1, 1]], ["tile_k", "sp", [-1, 1, 4]]]}, "result": [[0.056946975000000004], 0, 3.3252110481262207, 1638796856.1908512], "version": 0.2, "tvm_version": "0.8.dev0"}
{"input": ["cuda -keys=cuda,gpu -max_num_threads=1024 -thread_warp_size=32", "dense_large_batch.gpu", [["TENSOR", [128, 2048], "float32"], ["TENSOR", [2048, 1000], "float32"]], {}], "config": {"index": 603, "code_hash": null, "entity": [["tile_x", "sp", [-1, 8, 1, 1]], ["tile_y", "sp", [-1, 10, 1, 1]], ["tile_k", "sp", [-1, 1, 1]]]}, "result": [[0.02858165], 0, 2.4581124782562256, 1638796857.7802186], "version": 0.2, "tvm_version": "0.8.dev0"}
{"input": ["cuda -keys=cuda,gpu -max_num_threads=1024 -thread_warp_size=32", "dense_large_batch.gpu", [["TENSOR", [128, 2048], "float32"], ["TENSOR", [2048, 1000], "float32"]], {}], "config": {"index": 1104962, "code_hash": null, "entity": [["tile_x", "sp", [-1, 4, 1, 1]], ["tile_y", "sp", [-1, 40, 1, 1]], ["tile_k", "sp", [-1, 1, 4]]]}, "result": [[0.147561625], 0, 4.527542591094971, 1638796861.4082792], "version": 0.2, "tvm_version": "0.8.dev0"}
{"input": ["cuda -keys=cuda,gpu -max_num_threads=1024 -thread_warp_size=32", "dense_large_batch.gpu", [["TENSOR", [128, 2048], "float32"], ["TENSOR", [2048, 1000], "float32"]], {}], "config": {"index": 602, "code_hash": null, "entity": [["tile_x", "sp", [-1, 4, 1, 1]], ["tile_y", "sp", [-1, 10, 1, 1]], ["tile_k", "sp", [-1, 1, 1]]]}, "result": [[0.039578625], 0, 2.5842502117156982, 1638796863.3446605], "version": 0.2, "tvm_version": "0.8.dev0"}
{"input": ["cuda -keys=cuda,gpu -max_num_threads=1024 -thread_warp_size=32", "dense_large_batch.gpu", [["TENSOR", [128, 2048], "float32"], ["TENSOR", [2048, 1000], "float32"]], {}], "config": {"index": 1584843, "code_hash": null, "entity": [["tile_x", "sp", [-1, 8, 1, 1]], ["tile_y", "sp", [-1, 25, 1, 1]], ["tile_k", "sp", [-1, 1, 8]]]}, "result": [[0.10795665], 0, 4.534848213195801, 1638796866.6529334], "version": 0.2, "tvm_version": "0.8.dev0"}
{"input": ["cuda -keys=cuda,gpu -max_num_threads=1024 -thread_warp_size=32", "dense_large_batch.gpu", [["TENSOR", [128, 2048], "float32"], ["TENSOR", [2048, 1000], "float32"]], {}], "config": {"index": 1584600, "code_hash": null, "entity": [["tile_x", "sp", [-1, 1, 1, 1]], ["tile_y", "sp", [-1, 10, 1, 1]], ["tile_k", "sp", [-1, 1, 8]]]}, "result": [[0.10596639999999999], 0, 3.517031669616699, 1638796869.541714], "version": 0.2, "tvm_version": "0.8.dev0"}
{"input": ["cuda -keys=cuda,gpu -max_num_threads=1024 -thread_warp_size=32", "dense_large_batch.gpu", [["TENSOR", [128, 2048], "float32"], ["TENSOR", [2048, 1000], "float32"]], {}], "config": {"index": 1584481, "code_hash": null, "entity": [["tile_x", "sp", [-1, 2, 1, 1]], ["tile_y", "sp", [-1, 8, 1, 1]], ["tile_k", "sp", [-1, 1, 8]]]}, "result": [[0.0428685], 0, 2.9915027618408203, 1638796871.8165872], "version": 0.2, "tvm_version": "0.8.dev0"}
{"input": ["cuda -keys=cuda,gpu -max_num_threads=1024 -thread_warp_size=32", "dense_large_batch.gpu", [["TENSOR", [128, 2048], "float32"], ["TENSOR", [2048, 1000], "float32"]], {}], "config": {"index": 1584364, "code_hash": null, "entity": [["tile_x", "sp", [-1, 16, 1, 1]], ["tile_y", "sp", [-1, 5, 1, 1]], ["tile_k", "sp", [-1, 1, 8]]]}, "result": [[0.15476849999999998], 0, 4.0147740840911865, 1638796875.0249493], "version": 0.2, "tvm_version": "0.8.dev0"}
{"input": ["cuda -keys=cuda,gpu -max_num_threads=1024 -thread_warp_size=32", "dense_large_batch.gpu", [["TENSOR", [128, 2048], "float32"], ["TENSOR", [2048, 1000], "float32"]], {}], "config": {"index": 1584603, "code_hash": null, "entity": [["tile_x", "sp", [-1, 8, 1, 1]], ["tile_y", "sp", [-1, 10, 1, 1]], ["tile_k", "sp", [-1, 1, 8]]]}, "result": [[0.133771825], 0, 4.417434453964233, 1638796878.876404], "version": 0.2, "tvm_version": "0.8.dev0"}
{"input": ["cuda -keys=cuda,gpu -max_num_threads=1024 -thread_warp_size=32", "dense_large_batch.gpu", [["TENSOR", [128, 2048], "float32"], ["TENSOR", [2048, 1000], "float32"]], {}], "config": {"index": 1104362, "code_hash": null, "entity": [["tile_x", "sp", [-1, 4, 1, 1]], ["tile_y", "sp", [-1, 5, 1, 1]], ["tile_k", "sp", [-1, 1, 4]]]}, "result": [[0.048717149999999994], 0, 2.3135437965393066, 1638796959.298867], "version": 0.2, "tvm_version": "0.8.dev0"}
{"input": ["cuda -keys=cuda,gpu -max_num_threads=1024 -thread_warp_size=32", "dense_large_batch.gpu", [["TENSOR", [128, 2048], "float32"], ["TENSOR", [2048, 1000], "float32"]], {}], "config": {"index": 1106290, "code_hash": null, "entity": [["tile_x", "sp", [-1, 4, 2, 1]], ["tile_y", "sp", [-1, 5, 2, 1]], ["tile_k", "sp", [-1, 1, 4]]]}, "result": [[0.012694825], 0, 1.9427146911621094, 1638796960.9395244], "version": 0.2, "tvm_version": "0.8.dev0"}
{"input": ["cuda -keys=cuda,gpu -max_num_threads=1024 -thread_warp_size=32", "dense_large_batch.gpu", [["TENSOR", [128, 2048], "float32"], ["TENSOR", [2048, 1000], "float32"]], {}], "config": {"index": 576638, "code_hash": null, "entity": [["tile_x", "sp", [-1, 4, 1, 2]], ["tile_y", "sp", [-1, 10, 1, 1]], ["tile_k", "sp", [-1, 1, 2]]]}, "result": [[0.019925966666666666], 0, 2.720825433731079, 1638796963.2764573], "version": 0.2, "tvm_version": "0.8.dev0"}
{"input": ["cuda -keys=cuda,gpu -max_num_threads=1024 -thread_warp_size=32", "dense_large_batch.gpu", [["TENSOR", [128, 2048], "float32"], ["TENSOR", [2048, 1000], "float32"]], {}], "config": {"index": 578049, "code_hash": null, "entity": [["tile_x", "sp", [-1, 2, 2, 1]], ["tile_y", "sp", [-1, 2, 2, 1]], ["tile_k", "sp", [-1, 1, 2]]]}, "result": [[0.044953150000000004], 0, 1.930556297302246, 1638796964.982531], "version": 0.2, "tvm_version": "0.8.dev0"}
{"input": ["cuda -keys=cuda,gpu -max_num_threads=1024 -thread_warp_size=32", "dense_large_batch.gpu", [["TENSOR", [128, 2048], "float32"], ["TENSOR", [2048, 1000], "float32"]], {}], "config": {"index": 1116362, "code_hash": null, "entity": [["tile_x", "sp", [-1, 4, 1, 1]], ["tile_y", "sp", [-1, 5, 1, 2]], ["tile_k", "sp", [-1, 1, 4]]]}, "result": [[0.031916925], 0, 2.5086722373962402, 1638796967.1908314], "version": 0.2, "tvm_version": "0.8.dev0"}
{"input": ["cuda -keys=cuda,gpu -max_num_threads=1024 -thread_warp_size=32", "dense_large_batch.gpu", [["TENSOR", [128, 2048], "float32"], ["TENSOR", [2048, 1000], "float32"]], {}], "config": {"index": 1104364, "code_hash": null, "entity": [["tile_x", "sp", [-1, 16, 1, 1]], ["tile_y", "sp", [-1, 5, 1, 1]], ["tile_k", "sp", [-1, 1, 4]]]}, "result": [[0.020009866666666667], 0, 1.9562718868255615, 1638796968.960174], "version": 0.2, "tvm_version": "0.8.dev0"}
{"input": ["cuda -keys=cuda,gpu -max_num_threads=1024 -thread_warp_size=32", "dense_large_batch.gpu", [["TENSOR", [128, 2048], "float32"], ["TENSOR", [2048, 1000], "float32"]], {}], "config": {"index": 1116361, "code_hash": null, "entity": [["tile_x", "sp", [-1, 2, 1, 1]], ["tile_y", "sp", [-1, 5, 1, 2]], ["tile_k", "sp", [-1, 1, 4]]]}, "result": [[0.054985725], 0, 2.665867328643799, 1638796971.3297925], "version": 0.2, "tvm_version": "0.8.dev0"}
{"input": ["cuda -keys=cuda,gpu -max_num_threads=1024 -thread_warp_size=32", "dense_large_batch.gpu", [["TENSOR", [128, 2048], "float32"], ["TENSOR", [2048, 1000], "float32"]], {}], "config": {"index": 1106289, "code_hash": null, "entity": [["tile_x", "sp", [-1, 2, 2, 1]], ["tile_y", "sp", [-1, 5, 2, 1]], ["tile_k", "sp", [-1, 1, 4]]]}, "result": [[0.017676566666666668], 0, 1.669116497039795, 1638796973.084288], "version": 0.2, "tvm_version": "0.8.dev0"}
{"input": ["cuda -keys=cuda,gpu -max_num_threads=1024 -thread_warp_size=32", "dense_large_batch.gpu", [["TENSOR", [128, 2048], "float32"], ["TENSOR", [2048, 1000], "float32"]], {}], "config": {"index": 1104363, "code_hash": null, "entity": [["tile_x", "sp", [-1, 8, 1, 1]], ["tile_y", "sp", [-1, 5, 1, 1]], ["tile_k", "sp", [-1, 1, 4]]]}, "result": [[0.024431016666666666], 0, 1.884819507598877, 1638796974.645786], "version": 0.2, "tvm_version": "0.8.dev0"}
{"input": ["cuda -keys=cuda,gpu -max_num_threads=1024 -thread_warp_size=32", "dense_large_batch.gpu", [["TENSOR", [128, 2048], "float32"], ["TENSOR", [2048, 1000], "float32"]], {}], "config": {"index": 665, "code_hash": null, "entity": [["tile_x", "sp", [-1, 2, 1, 4]], ["tile_y", "sp", [-1, 10, 1, 1]], ["tile_k", "sp", [-1, 1, 1]]]}, "result": [[0.028596525], 0, 2.2970287799835205, 1638796977.0305607], "version": 0.2, "tvm_version": "0.8.dev0"}
{"input": ["cuda -keys=cuda,gpu -max_num_threads=1024 -thread_warp_size=32", "dense_large_batch.gpu", [["TENSOR", [128, 2048], "float32"], ["TENSOR", [2048, 1000], "float32"]], {}], "config": {"index": 576398, "code_hash": null, "entity": [["tile_x", "sp", [-1, 4, 1, 2]], ["tile_y", "sp", [-1, 5, 1, 1]], ["tile_k", "sp", [-1, 1, 2]]]}, "result": [[0.0273283], 0, 1.6685409545898438, 1638796978.5434232], "version": 0.2, "tvm_version": "0.8.dev0"}
{"input": ["cuda -keys=cuda,gpu -max_num_threads=1024 -thread_warp_size=32", "dense_large_batch.gpu", [["TENSOR", [128, 2048], "float32"], ["TENSOR", [2048, 1000], "float32"]], {}], "config": {"index": 578289, "code_hash": null, "entity": [["tile_x", "sp", [-1, 2, 2, 1]], ["tile_y", "sp", [-1, 5, 2, 1]], ["tile_k", "sp", [-1, 1, 2]]]}, "result": [[0.027221125000000002], 0, 1.653270959854126, 1638796979.9143822], "version": 0.2, "tvm_version": "0.8.dev0"}
{"input": ["cuda -keys=cuda,gpu -max_num_threads=1024 -thread_warp_size=32", "dense_large_batch.gpu", [["TENSOR", [128, 2048], "float32"], ["TENSOR", [2048, 1000], "float32"]], {}], "config": {"index": 50049, "code_hash": null, "entity": [["tile_x", "sp", [-1, 2, 2, 1]], ["tile_y", "sp", [-1, 2, 2, 1]], ["tile_k", "sp", [-1, 2, 1]]]}, "result": [[0.04505625], 0, 1.8414170742034912, 1638796981.5093951], "version": 0.2, "tvm_version": "0.8.dev0"}
{"input": ["cuda -keys=cuda,gpu -max_num_threads=1024 -thread_warp_size=32", "dense_large_batch.gpu", [["TENSOR", [128, 2048], "float32"], ["TENSOR", [2048, 1000], "float32"]], {}], "config": {"index": 1104482, "code_hash": null, "entity": [["tile_x", "sp", [-1, 4, 1, 1]], ["tile_y", "sp", [-1, 8, 1, 1]], ["tile_k", "sp", [-1, 1, 4]]]}, "result": [[0.030409500000000003], 0, 2.1407506465911865, 1638796983.72237], "version": 0.2, "tvm_version": "0.8.dev0"}
{"input": ["cuda -keys=cuda,gpu -max_num_threads=1024 -thread_warp_size=32", "dense_large_batch.gpu", [["TENSOR", [128, 2048], "float32"], ["TENSOR", [2048, 1000], "float32"]], {}], "config": {"index": 1107495, "code_hash": null, "entity": [["tile_x", "sp", [-1, 1, 4, 1]], ["tile_y", "sp", [-1, 2, 4, 1]], ["tile_k", "sp", [-1, 1, 4]]]}, "result": [[0.01139091111111111], 0, 1.6813852787017822, 1638796985.1330755], "version": 0.2, "tvm_version": "0.8.dev0"}
{"input": ["cuda -keys=cuda,gpu -max_num_threads=1024 -thread_warp_size=32", "dense_large_batch.gpu", [["TENSOR", [128, 2048], "float32"], ["TENSOR", [2048, 1000], "float32"]], {}], "config": {"index": 578323, "code_hash": null, "entity": [["tile_x", "sp", [-1, 1, 2, 2]], ["tile_y", "sp", [-1, 5, 2, 1]], ["tile_k", "sp", [-1, 1, 2]]]}, "result": [[0.027142875], 0, 1.766329050064087, 1638796986.6416976], "version": 0.2, "tvm_version": "0.8.dev0"}
{"input": ["cuda -keys=cuda,gpu -max_num_threads=1024 -thread_warp_size=32", "dense_large_batch.gpu", [["TENSOR", [128, 2048], "float32"], ["TENSOR", [2048, 1000], "float32"]], {}], "config": {"index": 50290, "code_hash": null, "entity": [["tile_x", "sp", [-1, 4, 2, 1]], ["tile_y", "sp", [-1, 5, 2, 1]], ["tile_k", "sp", [-1, 2, 1]]]}, "result": [[0.01725865], 0, 1.9132492542266846, 1638796988.603413], "version": 0.2, "tvm_version": "0.8.dev0"}
{"input": ["cuda -keys=cuda,gpu -max_num_threads=1024 -thread_warp_size=32", "dense_large_batch.gpu", [["TENSOR", [128, 2048], "float32"], ["TENSOR", [2048, 1000], "float32"]], {}], "config": {"index": 1106323, "code_hash": null, "entity": [["tile_x", "sp", [-1, 1, 2, 2]], ["tile_y", "sp", [-1, 5, 2, 1]], ["tile_k", "sp", [-1, 1, 4]]]}, "result": [[0.017807833333333332], 0, 2.9796030521392822, 1638796991.3220398], "version": 0.2, "tvm_version": "0.8.dev0"}
{"input": ["cuda -keys=cuda,gpu -max_num_threads=1024 -thread_warp_size=32", "dense_large_batch.gpu", [["TENSOR", [128, 2048], "float32"], ["TENSOR", [2048, 1000], "float32"]], {}], "config": {"index": 578290, "code_hash": null, "entity": [["tile_x", "sp", [-1, 4, 2, 1]], ["tile_y", "sp", [-1, 5, 2, 1]], ["tile_k", "sp", [-1, 1, 2]]]}, "result": [[0.017028983333333334], 0, 2.7807440757751465, 1638796994.0245554], "version": 0.2, "tvm_version": "0.8.dev0"}
{"input": ["cuda -keys=cuda,gpu -max_num_threads=1024 -thread_warp_size=32", "dense_large_batch.gpu", [["TENSOR", [128, 2048], "float32"], ["TENSOR", [2048, 1000], "float32"]], {}], "config": {"index": 96362, "code_hash": null, "entity": [["tile_x", "sp", [-1, 4, 1, 1]], ["tile_y", "sp", [-1, 5, 1, 1]], ["tile_k", "sp", [-1, 4, 1]]]}, "result": [[0.03318535], 0, 2.031301975250244, 1638796996.9498248], "version": 0.2, "tvm_version": "0.8.dev0"}
{"input": ["cuda -keys=cuda,gpu -max_num_threads=1024 -thread_warp_size=32", "dense_large_batch.gpu", [["TENSOR", [128, 2048], "float32"], ["TENSOR", [2048, 1000], "float32"]], {}], "config": {"index": 1106050, "code_hash": null, "entity": [["tile_x", "sp", [-1, 4, 2, 1]], ["tile_y", "sp", [-1, 2, 2, 1]], ["tile_k", "sp", [-1, 1, 4]]]}, "result": [[0.020955016666666663], 0, 2.9649553298950195, 1638796999.6028433], "version": 0.2, "tvm_version": "0.8.dev0"}
{"input": ["cuda -keys=cuda,gpu -max_num_threads=1024 -thread_warp_size=32", "dense_large_batch.gpu", [["TENSOR", [128, 2048], "float32"], ["TENSOR", [2048, 1000], "float32"]], {}], "config": {"index": 362, "code_hash": null, "entity": [["tile_x", "sp", [-1, 4, 1, 1]], ["tile_y", "sp", [-1, 5, 1, 1]], ["tile_k", "sp", [-1, 1, 1]]]}, "result": [[0.057248625], 0, 2.629443883895874, 1638797001.9131062], "version": 0.2, "tvm_version": "0.8.dev0"}
{"input": ["cuda -keys=cuda,gpu -max_num_threads=1024 -thread_warp_size=32", "dense_large_batch.gpu", [["TENSOR", [128, 2048], "float32"], ["TENSOR", [2048, 1000], "float32"]], {}], "config": {"index": 1116363, "code_hash": null, "entity": [["tile_x", "sp", [-1, 8, 1, 1]], ["tile_y", "sp", [-1, 5, 1, 2]], ["tile_k", "sp", [-1, 1, 4]]]}, "result": [[0.02600075], 0, 3.1144304275512695, 1638797004.9135995], "version": 0.2, "tvm_version": "0.8.dev0"}
{"input": ["cuda -keys=cuda,gpu -max_num_threads=1024 -thread_warp_size=32", "dense_large_batch.gpu", [["TENSOR", [128, 2048], "float32"], ["TENSOR", [2048, 1000], "float32"]], {}], "config": {"index": 1104483, "code_hash": null, "entity": [["tile_x", "sp", [-1, 8, 1, 1]], ["tile_y", "sp", [-1, 8, 1, 1]], ["tile_k", "sp", [-1, 1, 4]]]}, "result": [[0.017531683333333332], 0, 4.199313640594482, 1638797008.828406], "version": 0.2, "tvm_version": "0.8.dev0"}
{"input": ["cuda -keys=cuda,gpu -max_num_threads=1024 -thread_warp_size=32", "dense_large_batch.gpu", [["TENSOR", [128, 2048], "float32"], ["TENSOR", [2048, 1000], "float32"]], {}], "config": {"index": 1104637, "code_hash": null, "entity": [["tile_x", "sp", [-1, 2, 1, 2]], ["tile_y", "sp", [-1, 10, 1, 1]], ["tile_k", "sp", [-1, 1, 4]]]}, "result": [[0.03120465], 0, 2.7430100440979004, 1638797011.4402342], "version": 0.2, "tvm_version": "0.8.dev0"}
{"input": ["cuda -keys=cuda,gpu -max_num_threads=1024 -thread_warp_size=32", "dense_large_batch.gpu", [["TENSOR", [128, 2048], "float32"], ["TENSOR", [2048, 1000], "float32"]], {}], "config": {"index": 576363, "code_hash": null, "entity": [["tile_x", "sp", [-1, 8, 1, 1]], ["tile_y", "sp", [-1, 5, 1, 1]], ["tile_k", "sp", [-1, 1, 2]]]}, "result": [[0.027355625], 0, 3.136082887649536, 1638797014.3540444], "version": 0.2, "tvm_version": "0.8.dev0"}
{"input": ["cuda -keys=cuda,gpu -max_num_threads=1024 -thread_warp_size=32", "dense_large_batch.gpu", [["TENSOR", [128, 2048], "float32"], ["TENSOR", [2048, 1000], "float32"]], {}], "config": {"index": 96602, "code_hash": null, "entity": [["tile_x", "sp", [-1, 4, 1, 1]], ["tile_y", "sp", [-1, 10, 1, 1]], ["tile_k", "sp", [-1, 4, 1]]]}, "result": [[0.03105285], 0, 2.4622178077697754, 1638797016.6113958], "version": 0.2, "tvm_version": "0.8.dev0"}
{"input": ["cuda -keys=cuda,gpu -max_num_threads=1024 -thread_warp_size=32", "dense_large_batch.gpu", [["TENSOR", [128, 2048], "float32"], ["TENSOR", [2048, 1000], "float32"]], {}], "config": {"index": 425, "code_hash": null, "entity": [["tile_x", "sp", [-1, 2, 1, 4]], ["tile_y", "sp", [-1, 5, 1, 1]], ["tile_k", "sp", [-1, 1, 1]]]}, "result": [[0.031248425], 0, 2.8892762660980225, 1638797019.2550912], "version": 0.2, "tvm_version": "0.8.dev0"}
{"input": ["cuda -keys=cuda,gpu -max_num_threads=1024 -thread_warp_size=32", "dense_large_batch.gpu", [["TENSOR", [128, 2048], "float32"], ["TENSOR", [2048, 1000], "float32"]], {}], "config": {"index": 1104604, "code_hash": null, "entity": [["tile_x", "sp", [-1, 16, 1, 1]], ["tile_y", "sp", [-1, 10, 1, 1]], ["tile_k", "sp", [-1, 1, 4]]]}, "result": [[0.0887036], 0, 4.1837451457977295, 1638797023.2087736], "version": 0.2, "tvm_version": "0.8.dev0"}
{"input": ["cuda -keys=cuda,gpu -max_num_threads=1024 -thread_warp_size=32", "dense_large_batch.gpu", [["TENSOR", [128, 2048], "float32"], ["TENSOR", [2048, 1000], "float32"]], {}], "config": {"index": 50289, "code_hash": null, "entity": [["tile_x", "sp", [-1, 2, 2, 1]], ["tile_y", "sp", [-1, 5, 2, 1]], ["tile_k", "sp", [-1, 2, 1]]]}, "result": [[0.0269651], 0, 2.2051448822021484, 1638797025.435974], "version": 0.2, "tvm_version": "0.8.dev0"}
{"input": ["cuda -keys=cuda,gpu -max_num_threads=1024 -thread_warp_size=32", "dense_large_batch.gpu", [["TENSOR", [128, 2048], "float32"], ["TENSOR", [2048, 1000], "float32"]], {}], "config": {"index": 624637, "code_hash": null, "entity": [["tile_x", "sp", [-1, 2, 1, 2]], ["tile_y", "sp", [-1, 10, 1, 1]], ["tile_k", "sp", [-1, 2, 2]]]}, "result": [[0.03117445], 0, 2.170027494430542, 1638797027.4163227], "version": 0.2, "tvm_version": "0.8.dev0"}
{"input": ["cuda -keys=cuda,gpu -max_num_threads=1024 -thread_warp_size=32", "dense_large_batch.gpu", [["TENSOR", [128, 2048], "float32"], ["TENSOR", [2048, 1000], "float32"]], {}], "config": {"index": 576399, "code_hash": null, "entity": [["tile_x", "sp", [-1, 8, 1, 2]], ["tile_y", "sp", [-1, 5, 1, 1]], ["tile_k", "sp", [-1, 1, 2]]]}, "result": [[0.020895166666666663], 0, 2.203864097595215, 1638797029.4318318], "version": 0.2, "tvm_version": "0.8.dev0"}
{"input": ["cuda -keys=cuda,gpu -max_num_threads=1024 -thread_warp_size=32", "dense_large_batch.gpu", [["TENSOR", [128, 2048], "float32"], ["TENSOR", [2048, 1000], "float32"]], {}], "config": {"index": 1104665, "code_hash": null, "entity": [["tile_x", "sp", [-1, 2, 1, 4]], ["tile_y", "sp", [-1, 10, 1, 1]], ["tile_k", "sp", [-1, 1, 4]]]}, "result": [[0.025128750000000002], 0, 2.8959763050079346, 1638797031.810152], "version": 0.2, "tvm_version": "0.8.dev0"}
{"input": ["cuda -keys=cuda,gpu -max_num_threads=1024 -thread_warp_size=32", "dense_large_batch.gpu", [["TENSOR", [128, 2048], "float32"], ["TENSOR", [2048, 1000], "float32"]], {}], "config": {"index": 185, "code_hash": null, "entity": [["tile_x", "sp", [-1, 2, 1, 4]], ["tile_y", "sp", [-1, 2, 1, 1]], ["tile_k", "sp", [-1, 1, 1]]]}, "result": [[0.06863464999999999], 0, 2.392296314239502, 1638797035.4696121], "version": 0.2, "tvm_version": "0.8.dev0"}
{"input": ["cuda -keys=cuda,gpu -max_num_threads=1024 -thread_warp_size=32", "dense_large_batch.gpu", [["TENSOR", [128, 2048], "float32"], ["TENSOR", [2048, 1000], "float32"]], {}], "config": {"index": 48362, "code_hash": null, "entity": [["tile_x", "sp", [-1, 4, 1, 1]], ["tile_y", "sp", [-1, 5, 1, 1]], ["tile_k", "sp", [-1, 2, 1]]]}, "result": [[0.03968565], 0, 2.756690263748169, 1638797038.464038], "version": 0.2, "tvm_version": "0.8.dev0"}
{"input": ["cuda -keys=cuda,gpu -max_num_threads=1024 -thread_warp_size=32", "dense_large_batch.gpu", [["TENSOR", [128, 2048], "float32"], ["TENSOR", [2048, 1000], "float32"]], {}], "config": {"index": 48398, "code_hash": null, "entity": [["tile_x", "sp", [-1, 4, 1, 2]], ["tile_y", "sp", [-1, 5, 1, 1]], ["tile_k", "sp", [-1, 2, 1]]]}, "result": [[0.027227150000000002], 0, 1.915125846862793, 1638797040.406314], "version": 0.2, "tvm_version": "0.8.dev0"}
{"input": ["cuda -keys=cuda,gpu -max_num_threads=1024 -thread_warp_size=32", "dense_large_batch.gpu", [["TENSOR", [128, 2048], "float32"], ["TENSOR", [2048, 1000], "float32"]], {}], "config": {"index": 1584242, "code_hash": null, "entity": [["tile_x", "sp", [-1, 4, 1, 1]], ["tile_y", "sp", [-1, 4, 1, 1]], ["tile_k", "sp", [-1, 1, 8]]]}, "result": [[0.039280225], 0, 1.9403884410858154, 1638797041.9680622], "version": 0.2, "tvm_version": "0.8.dev0"}
{"input": ["cuda -keys=cuda,gpu -max_num_threads=1024 -thread_warp_size=32", "dense_large_batch.gpu", [["TENSOR", [128, 2048], "float32"], ["TENSOR", [2048, 1000], "float32"]], {}], "config": {"index": 1104638, "code_hash": null, "entity": [["tile_x", "sp", [-1, 4, 1, 2]], ["tile_y", "sp", [-1, 10, 1, 1]], ["tile_k", "sp", [-1, 1, 4]]]}, "result": [[0.0252078], 0, 1.8883657455444336, 1638797043.767116], "version": 0.2, "tvm_version": "0.8.dev0"}
{"input": ["cuda -keys=cuda,gpu -max_num_threads=1024 -thread_warp_size=32", "dense_large_batch.gpu", [["TENSOR", [128, 2048], "float32"], ["TENSOR", [2048, 1000], "float32"]], {}], "config": {"index": 588363, "code_hash": null, "entity": [["tile_x", "sp", [-1, 8, 1, 1]], ["tile_y", "sp", [-1, 5, 1, 2]], ["tile_k", "sp", [-1, 1, 2]]]}, "result": [[0.020110833333333335], 0, 1.865373134613037, 1638797045.1991682], "version": 0.2, "tvm_version": "0.8.dev0"}
{"input": ["cuda -keys=cuda,gpu -max_num_threads=1024 -thread_warp_size=32", "dense_large_batch.gpu", [["TENSOR", [128, 2048], "float32"], ["TENSOR", [2048, 1000], "float32"]], {}], "config": {"index": 588398, "code_hash": null, "entity": [["tile_x", "sp", [-1, 4, 1, 2]], ["tile_y", "sp", [-1, 5, 1, 2]], ["tile_k", "sp", [-1, 1, 2]]]}, "result": [[0.028109775], 0, 1.6430408954620361, 1638797092.194083], "version": 0.2, "tvm_version": "0.8.dev0"}
{"input": ["cuda -keys=cuda,gpu -max_num_threads=1024 -thread_warp_size=32", "dense_large_batch.gpu", [["TENSOR", [128, 2048], "float32"], ["TENSOR", [2048, 1000], "float32"]], {}], "config": {"index": 588362, "code_hash": null, "entity": [["tile_x", "sp", [-1, 4, 1, 1]], ["tile_y", "sp", [-1, 5, 1, 2]], ["tile_k", "sp", [-1, 1, 2]]]}, "result": [[0.043527325], 0, 1.7923462390899658, 1638797093.5790398], "version": 0.2, "tvm_version": "0.8.dev0"}
{"input": ["cuda -keys=cuda,gpu -max_num_threads=1024 -thread_warp_size=32", "dense_large_batch.gpu", [["TENSOR", [128, 2048], "float32"], ["TENSOR", [2048, 1000], "float32"]], {}], "config": {"index": 624363, "code_hash": null, "entity": [["tile_x", "sp", [-1, 8, 1, 1]], ["tile_y", "sp", [-1, 5, 1, 1]], ["tile_k", "sp", [-1, 2, 2]]]}, "result": [[0.02442645], 0, 2.2995612621307373, 1638797095.4854572], "version": 0.2, "tvm_version": "0.8.dev0"}
{"input": ["cuda -keys=cuda,gpu -max_num_threads=1024 -thread_warp_size=32", "dense_large_batch.gpu", [["TENSOR", [128, 2048], "float32"], ["TENSOR", [2048, 1000], "float32"]], {}], "config": {"index": 588425, "code_hash": null, "entity": [["tile_x", "sp", [-1, 2, 1, 4]], ["tile_y", "sp", [-1, 5, 1, 2]], ["tile_k", "sp", [-1, 1, 2]]]}, "result": [[0.019990533333333334], 0, 1.8979132175445557, 1638797097.4686925], "version": 0.2, "tvm_version": "0.8.dev0"}
{"input": ["cuda -keys=cuda,gpu -max_num_threads=1024 -thread_warp_size=32", "dense_large_batch.gpu", [["TENSOR", [128, 2048], "float32"], ["TENSOR", [2048, 1000], "float32"]], {}], "config": {"index": 636243, "code_hash": null, "entity": [["tile_x", "sp", [-1, 8, 1, 1]], ["tile_y", "sp", [-1, 4, 1, 2]], ["tile_k", "sp", [-1, 2, 2]]]}, "result": [[0.01751945], 0, 1.8905079364776611, 1638797099.330341], "version": 0.2, "tvm_version": "0.8.dev0"}
{"input": ["cuda -keys=cuda,gpu -max_num_threads=1024 -thread_warp_size=32", "dense_large_batch.gpu", [["TENSOR", [128, 2048], "float32"], ["TENSOR", [2048, 1000], "float32"]], {}], "config": {"index": 576517, "code_hash": null, "entity": [["tile_x", "sp", [-1, 2, 1, 2]], ["tile_y", "sp", [-1, 8, 1, 1]], ["tile_k", "sp", [-1, 1, 2]]]}, "result": [[0.0350297], 0, 2.3634560108184814, 1638797101.858713], "version": 0.2, "tvm_version": "0.8.dev0"}
{"input": ["cuda -keys=cuda,gpu -max_num_threads=1024 -thread_warp_size=32", "dense_large_batch.gpu", [["TENSOR", [128, 2048], "float32"], ["TENSOR", [2048, 1000], "float32"]], {}], "config": {"index": 1116243, "code_hash": null, "entity": [["tile_x", "sp", [-1, 8, 1, 1]], ["tile_y", "sp", [-1, 4, 1, 2]], ["tile_k", "sp", [-1, 1, 4]]]}, "result": [[0.0175261], 0, 1.829326868057251, 1638797103.2569752], "version": 0.2, "tvm_version": "0.8.dev0"}
{"input": ["cuda -keys=cuda,gpu -max_num_threads=1024 -thread_warp_size=32", "dense_large_batch.gpu", [["TENSOR", [128, 2048], "float32"], ["TENSOR", [2048, 1000], "float32"]], {}], "config": {"index": 588243, "code_hash": null, "entity": [["tile_x", "sp", [-1, 8, 1, 1]], ["tile_y", "sp", [-1, 4, 1, 2]], ["tile_k", "sp", [-1, 1, 2]]]}, "result": [[0.023756266666666664], 0, 1.9050071239471436, 1638797104.7068996], "version": 0.2, "tvm_version": "0.8.dev0"}
{"input": ["cuda -keys=cuda,gpu -max_num_threads=1024 -thread_warp_size=32", "dense_large_batch.gpu", [["TENSOR", [128, 2048], "float32"], ["TENSOR", [2048, 1000], "float32"]], {}], "config": {"index": 48397, "code_hash": null, "entity": [["tile_x", "sp", [-1, 2, 1, 2]], ["tile_y", "sp", [-1, 5, 1, 1]], ["tile_k", "sp", [-1, 2, 1]]]}, "result": [[0.040687575000000004], 0, 1.7233030796051025, 1638797106.56319], "version": 0.2, "tvm_version": "0.8.dev0"}
{"input": ["cuda -keys=cuda,gpu -max_num_threads=1024 -thread_warp_size=32", "dense_large_batch.gpu", [["TENSOR", [128, 2048], "float32"], ["TENSOR", [2048, 1000], "float32"]], {}], "config": {"index": 60362, "code_hash": null, "entity": [["tile_x", "sp", [-1, 4, 1, 1]], ["tile_y", "sp", [-1, 5, 1, 2]], ["tile_k", "sp", [-1, 2, 1]]]}, "result": [[0.034755600000000005], 0, 1.7419703006744385, 1638797108.4727952], "version": 0.2, "tvm_version": "0.8.dev0"}
{"input": ["cuda -keys=cuda,gpu -max_num_threads=1024 -thread_warp_size=32", "dense_large_batch.gpu", [["TENSOR", [128, 2048], "float32"], ["TENSOR", [2048, 1000], "float32"]], {}], "config": {"index": 588278, "code_hash": null, "entity": [["tile_x", "sp", [-1, 4, 1, 2]], ["tile_y", "sp", [-1, 4, 1, 2]], ["tile_k", "sp", [-1, 1, 2]]]}, "result": [[0.022192933333333335], 0, 2.049744129180908, 1638797110.847996], "version": 0.2, "tvm_version": "0.8.dev0"}
