artifacts/Table3/tvm/autotvm/matmul/matmul_128_4032_1000.log
{"input": ["cuda -keys=cuda,gpu -max_num_threads=1024 -thread_warp_size=32", "dense_large_batch.gpu", [["TENSOR", [128, 4032], "float32"], ["TENSOR", [4032, 1000], "float32"]], {}], "config": {"index": 16158036, "code_hash": null, "entity": [["tile_x", "sp", [-1, 1, 1, 2]], ["tile_y", "sp", [-1, 1, 1, 8]], ["tile_k", "sp", [-1, 7, 32]]]}, "result": [[0.757602125], 0, 18.39082098007202, 1638793070.8925428], "version": 0.2, "tvm_version": "0.8.dev0"}
{"input": ["cuda -keys=cuda,gpu -max_num_threads=1024 -thread_warp_size=32", "dense_large_batch.gpu", [["TENSOR", [128, 4032], "float32"], ["TENSOR", [4032, 1000], "float32"]], {}], "config": {"index": 211420, "code_hash": null, "entity": [["tile_x", "sp", [-1, 1, 1, 16]], ["tile_y", "sp", [-1, 2, 1, 4]], ["tile_k", "sp", [-1, 6, 1]]]}, "result": [[0.05030535], 0, 1.9308488368988037, 1638793093.0958602], "version": 0.2, "tvm_version": "0.8.dev0"}
{"input": ["cuda -keys=cuda,gpu -max_num_threads=1024 -thread_warp_size=32", "dense_large_batch.gpu", [["TENSOR", [128, 4032], "float32"], ["TENSOR", [4032, 1000], "float32"]], {}], "config": {"index": 2527265, "code_hash": null, "entity": [["tile_x", "sp", [-1, 2, 1, 4]], ["tile_y", "sp", [-1, 1, 1, 10]], ["tile_k", "sp", [-1, 16, 2]]]}, "result": [[0.0575344], 0, 3.2238364219665527, 1638793095.343841], "version": 0.2, "tvm_version": "0.8.dev0"}
{"input": ["cuda -keys=cuda,gpu -max_num_threads=1024 -thread_warp_size=32", "dense_large_batch.gpu", [["TENSOR", [128, 4032], "float32"], ["TENSOR", [4032, 1000], "float32"]], {}], "config": {"index": 4339300, "code_hash": null, "entity": [["tile_x", "sp", [-1, 1, 1, 16]], ["tile_y", "sp", [-1, 1, 1, 4]], ["tile_k", "sp", [-1, 28, 3]]]}, "result": [[0.0963164], 0, 9.071276664733887, 1638793099.721034], "version": 0.2, "tvm_version": "0.8.dev0"}
{"input": ["cuda -keys=cuda,gpu -max_num_threads=1024 -thread_warp_size=32", "dense_large_batch.gpu", [["TENSOR", [128, 4032], "float32"], ["TENSOR", [4032, 1000], "float32"]], {}], "config": {"index": 13920205, "code_hash": null, "entity": [["tile_x", "sp", [-1, 1, 1, 8]], ["tile_y", "sp", [-1, 2, 1, 1]], ["tile_k", "sp", [-1, 4, 21]]]}, "result": [[0.085790975], 0, 3.4084393978118896, 1638793112.673159], "version": 0.2, "tvm_version": "0.8.dev0"}
{"input": ["cuda -keys=cuda,gpu -max_num_threads=1024 -thread_warp_size=32", "dense_large_batch.gpu", [["TENSOR", [128, 4032], "float32"], ["TENSOR", [4032, 1000], "float32"]], {}], "config": {"index": 15324065, "code_hash": null, "entity": [["tile_x", "sp", [-1, 2, 1, 4]], ["tile_y", "sp", [-1, 1, 1, 2]], ["tile_k", "sp", [-1, 3, 28]]]}, "result": [[0.69003085], 0, 11.74631953239441, 1638793123.0090783], "version": 0.2, "tvm_version": "0.8.dev0"}
{"input": ["cuda -keys=cuda,gpu -max_num_threads=1024 -thread_warp_size=32", "dense_large_batch.gpu", [["TENSOR", [128, 4032], "float32"], ["TENSOR", [4032, 1000], "float32"]], {}], "config": {"index": 214910, "code_hash": null, "entity": [["tile_x", "sp", [-1, 1, 1, 32]], ["tile_y", "sp", [-1, 1, 1, 5]], ["tile_k", "sp", [-1, 6, 1]]]}, "result": [[0.0688976], 0, 2.8586854934692383, 1638793178.0797343], "version": 0.2, "tvm_version": "0.8.dev0"}
{"input": ["cuda -keys=cuda,gpu -max_num_threads=1024 -thread_warp_size=32", "dense_large_batch.gpu", [["TENSOR", [128, 4032], "float32"], ["TENSOR", [4032, 1000], "float32"]], {}], "config": {"index": 307310, "code_hash": null, "entity": [["tile_x", "sp", [-1, 1, 1, 32]], ["tile_y", "sp", [-1, 1, 1, 4]], ["tile_k", "sp", [-1, 8, 1]]]}, "result": [[0.04770725], 0, 2.734550952911377, 1638793179.6577716], "version": 0.2, "tvm_version": "0.8.dev0"}
{"input": ["cuda -keys=cuda,gpu -max_num_threads=1024 -thread_warp_size=32", "dense_large_batch.gpu", [["TENSOR", [128, 4032], "float32"], ["TENSOR", [4032, 1000], "float32"]], {}], "config": {"index": 643420, "code_hash": null, "entity": [["tile_x", "sp", [-1, 1, 1, 16]], ["tile_y", "sp", [-1, 2, 1, 4]], ["tile_k", "sp", [-1, 24, 1]]]}, "result": [[0.037469425], 0, 4.2367777824401855, 1638793181.7068748], "version": 0.2, "tvm_version": "0.8.dev0"}
{"input": ["cuda -keys=cuda,gpu -max_num_threads=1024 -thread_warp_size=32", "dense_large_batch.gpu", [["TENSOR", [128, 4032], "float32"], ["TENSOR", [4032, 1000], "float32"]], {}], "config": {"index": 499300, "code_hash": null, "entity": [["tile_x", "sp", [-1, 1, 1, 16]], ["tile_y", "sp", [-1, 1, 1, 4]], ["tile_k", "sp", [-1, 16, 1]]]}, "result": [[0.044572375000000004], 0, 2.2894973754882812, 1638793183.0673137], "version": 0.2, "tvm_version": "0.8.dev0"}
{"input": ["cuda -keys=cuda,gpu -max_num_threads=1024 -thread_warp_size=32", "dense_large_batch.gpu", [["TENSOR", [128, 4032], "float32"], ["TENSOR", [4032, 1000], "float32"]], {}], "config": {"index": 2286110, "code_hash": null, "entity": [["tile_x", "sp", [-1, 1, 1, 32]], ["tile_y", "sp", [-1, 1, 1, 8]], ["tile_k", "sp", [-1, 7, 2]]]}, "result": [[0.961485825], 0, 15.438585758209229, 1638793197.036823], "version": 0.2, "tvm_version": "0.8.dev0"}
{"input": ["cuda -keys=cuda,gpu -max_num_threads=1024 -thread_warp_size=32", "dense_large_batch.gpu", [["TENSOR", [128, 4032], "float32"], ["TENSOR", [4032, 1000], "float32"]], {}], "config": {"index": 2131310, "code_hash": null, "entity": [["tile_x", "sp", [-1, 1, 1, 32]], ["tile_y", "sp", [-1, 1, 1, 4]], ["tile_k", "sp", [-1, 3, 2]]]}, "result": [[0.054573], 0, 2.7233266830444336, 1638793198.592579], "version": 0.2, "tvm_version": "0.8.dev0"}
{"input": ["cuda -keys=cuda,gpu -max_num_threads=1024 -thread_warp_size=32", "dense_large_batch.gpu", [["TENSOR", [128, 4032], "float32"], ["TENSOR", [4032, 1000], "float32"]], {}], "config": {"index": 2419420, "code_hash": null, "entity": [["tile_x", "sp", [-1, 1, 1, 16]], ["tile_y", "sp", [-1, 2, 1, 4]], ["tile_k", "sp", [-1, 12, 2]]]}, "result": [[0.037471725], 0, 4.110897064208984, 1638793200.6265337], "version": 0.2, "tvm_version": "0.8.dev0"}
{"input": ["cuda -keys=cuda,gpu -max_num_threads=1024 -thread_warp_size=32", "dense_large_batch.gpu", [["TENSOR", [128, 4032], "float32"], ["TENSOR", [4032, 1000], "float32"]], {}], "config": {"index": 5406085, "code_hash": null, "entity": [["tile_x", "sp", [-1, 1, 1, 8]], ["tile_y", "sp", [-1, 1, 1, 8]], ["tile_k", "sp", [-1, 8, 4]]]}, "result": [[0.0411027], 0, 3.154808759689331, 1638793202.160736], "version": 0.2, "tvm_version": "0.8.dev0"}
{"input": ["cuda -keys=cuda,gpu -max_num_threads=1024 -thread_warp_size=32", "dense_large_batch.gpu", [["TENSOR", [128, 4032], "float32"], ["TENSOR", [4032, 1000], "float32"]], {}], "config": {"index": 6979264, "code_hash": null, "entity": [["tile_x", "sp", [-1, 1, 1, 4]], ["tile_y", "sp", [-1, 1, 1, 4]], ["tile_k", "sp", [-1, 16, 6]]]}, "result": [[0.091941675], 0, 3.981804370880127, 1638793204.404312], "version": 0.2, "tvm_version": "0.8.dev0"}
{"input": ["cuda -keys=cuda,gpu -max_num_threads=1024 -thread_warp_size=32", "dense_large_batch.gpu", [["TENSOR", [128, 4032], "float32"], ["TENSOR", [4032, 1000], "float32"]], {}], "config": {"index": 4014100, "code_hash": null, "entity": [["tile_x", "sp", [-1, 1, 1, 16]], ["tile_y", "sp", [-1, 1, 1, 8]], ["tile_k", "sp", [-1, 7, 3]]]}, "result": [[0.193224275], 0, 6.2946226596832275, 1638793208.9420698], "version": 0.2, "tvm_version": "0.8.dev0"}
{"input": ["cuda -keys=cuda,gpu -max_num_threads=1024 -thread_warp_size=32", "dense_large_batch.gpu", [["TENSOR", [128, 4032], "float32"], ["TENSOR", [4032, 1000], "float32"]], {}], "config": {"index": 2718064, "code_hash": null, "entity": [["tile_x", "sp", [-1, 1, 1, 4]], ["tile_y", "sp", [-1, 1, 1, 8]], ["tile_k", "sp", [-1, 28, 2]]]}, "result": [[0.056914725], 0, 4.088036298751831, 1638793210.7175765], "version": 0.2, "tvm_version": "0.8.dev0"}
{"input": ["cuda -keys=cuda,gpu -max_num_threads=1024 -thread_warp_size=32", "dense_large_batch.gpu", [["TENSOR", [128, 4032], "float32"], ["TENSOR", [4032, 1000], "float32"]], {}], "config": {"index": 4254064, "code_hash": null, "entity": [["tile_x", "sp", [-1, 1, 1, 4]], ["tile_y", "sp", [-1, 1, 1, 8]], ["tile_k", "sp", [-1, 21, 3]]]}, "result": [[0.0638017], 0, 4.299567699432373, 1638793212.8735957], "version": 0.2, "tvm_version": "0.8.dev0"}
{"input": ["cuda -keys=cuda,gpu -max_num_threads=1024 -thread_warp_size=32", "dense_large_batch.gpu", [["TENSOR", [128, 4032], "float32"], ["TENSOR", [4032, 1000], "float32"]], {}], "config": {"index": 2230910, "code_hash": null, "entity": [["tile_x", "sp", [-1, 1, 1, 32]], ["tile_y", "sp", [-1, 1, 1, 5]], ["tile_k", "sp", [-1, 6, 2]]]}, "result": [[0.470631625], 0, 9.454233884811401, 1638793220.5676694], "version": 0.2, "tvm_version": "0.8.dev0"}
{"input": ["cuda -keys=cuda,gpu -max_num_threads=1024 -thread_warp_size=32", "dense_large_batch.gpu", [["TENSOR", [128, 4032], "float32"], ["TENSOR", [4032, 1000], "float32"]], {}], "config": {"index": 2460100, "code_hash": null, "entity": [["tile_x", "sp", [-1, 1, 1, 16]], ["tile_y", "sp", [-1, 1, 1, 2]], ["tile_k", "sp", [-1, 14, 2]]]}, "result": [[0.076263125], 0, 3.220160961151123, 1638793222.3130004], "version": 0.2, "tvm_version": "0.8.dev0"}
{"input": ["cuda -keys=cuda,gpu -max_num_threads=1024 -thread_warp_size=32", "dense_large_batch.gpu", [["TENSOR", [128, 4032], "float32"], ["TENSOR", [4032, 1000], "float32"]], {}], "config": {"index": 3766919, "code_hash": null, "entity": [["tile_x", "sp", [-1, 1, 1, 128]], ["tile_y", "sp", [-1, 1, 1, 5]], ["tile_k", "sp", [-1, 1, 3]]]}, "result": [[1.1179807000000002], 0, 15.556686401367188, 1638793237.4040473], "version": 0.2, "tvm_version": "0.8.dev0"}
{"input": ["cuda -keys=cuda,gpu -max_num_threads=1024 -thread_warp_size=32", "dense_large_batch.gpu", [["TENSOR", [128, 4032], "float32"], ["TENSOR", [4032, 1000], "float32"]], {}], "config": {"index": 5683264, "code_hash": null, "entity": [["tile_x", "sp", [-1, 1, 1, 4]], ["tile_y", "sp", [-1, 1, 1, 4]], ["tile_k", "sp", [-1, 21, 4]]]}, "result": [[0.079528625], 0, 3.946028709411621, 1638793239.355008], "version": 0.2, "tvm_version": "0.8.dev0"}
{"input": ["cuda -keys=cuda,gpu -max_num_threads=1024 -thread_warp_size=32", "dense_large_batch.gpu", [["TENSOR", [128, 4032], "float32"], ["TENSOR", [4032, 1000], "float32"]], {}], "config": {"index": 5484085, "code_hash": null, "entity": [["tile_x", "sp", [-1, 1, 1, 8]], ["tile_y", "sp", [-1, 1, 1, 2]], ["tile_k", "sp", [-1, 12, 4]]]}, "result": [[0.08311892500000001], 0, 3.3392174243927, 1638793241.157729], "version": 0.2, "tvm_version": "0.8.dev0"}
{"input": ["cuda -keys=cuda,gpu -max_num_threads=1024 -thread_warp_size=32", "dense_large_batch.gpu", [["TENSOR", [128, 4032], "float32"], ["TENSOR", [4032, 1000], "float32"]], {}], "config": {"index": 7702910, "code_hash": null, "entity": [["tile_x", "sp", [-1, 1, 1, 32]], ["tile_y", "sp", [-1, 1, 1, 5]], ["tile_k", "sp", [-1, 1, 7]]]}, "result": [[0.27363055000000003], 0, 5.332163333892822, 1638793245.42768], "version": 0.2, "tvm_version": "0.8.dev0"}
{"input": ["cuda -keys=cuda,gpu -max_num_threads=1024 -thread_warp_size=32", "dense_large_batch.gpu", [["TENSOR", [128, 4032], "float32"], ["TENSOR", [4032, 1000], "float32"]], {}], "config": {"index": 7747300, "code_hash": null, "entity": [["tile_x", "sp", [-1, 1, 1, 16]], ["tile_y", "sp", [-1, 1, 1, 4]], ["tile_k", "sp", [-1, 2, 7]]]}, "result": [[0.34949855], 0, 6.34461236000061, 1638793250.5955343], "version": 0.2, "tvm_version": "0.8.dev0"}
{"input": ["cuda -keys=cuda,gpu -max_num_threads=1024 -thread_warp_size=32", "dense_large_batch.gpu", [["TENSOR", [128, 4032], "float32"], ["TENSOR", [4032, 1000], "float32"]], {}], "config": {"index": 6598910, "code_hash": null, "entity": [["tile_x", "sp", [-1, 1, 1, 32]], ["tile_y", "sp", [-1, 1, 1, 5]], ["tile_k", "sp", [-1, 2, 6]]]}, "result": [[0.253582075], 0, 5.610137224197388, 1638793254.7595692], "version": 0.2, "tvm_version": "0.8.dev0"}
{"input": ["cuda -keys=cuda,gpu -max_num_threads=1024 -thread_warp_size=32", "dense_large_batch.gpu", [["TENSOR", [128, 4032], "float32"], ["TENSOR", [4032, 1000], "float32"]], {}], "config": {"index": 4110085, "code_hash": null, "entity": [["tile_x", "sp", [-1, 1, 1, 8]], ["tile_y", "sp", [-1, 1, 1, 8]], ["tile_k", "sp", [-1, 12, 3]]]}, "result": [[0.04205575], 0, 3.247951030731201, 1638793256.3270957], "version": 0.2, "tvm_version": "0.8.dev0"}
{"input": ["cuda -keys=cuda,gpu -max_num_threads=1024 -thread_warp_size=32", "dense_large_batch.gpu", [["TENSOR", [128, 4032], "float32"], ["TENSOR", [4032, 1000], "float32"]], {}], "config": {"index": 5214110, "code_hash": null, "entity": [["tile_x", "sp", [-1, 1, 1, 32]], ["tile_y", "sp", [-1, 1, 1, 8]], ["tile_k", "sp", [-1, 3, 4]]]}, "result": [[0.93236975], 0, 14.630077838897705, 1638793269.5999703], "version": 0.2, "tvm_version": "0.8.dev0"}
{"input": ["cuda -keys=cuda,gpu -max_num_threads=1024 -thread_warp_size=32", "dense_large_batch.gpu", [["TENSOR", [128, 4032], "float32"], ["TENSOR", [4032, 1000], "float32"]], {}], "config": {"index": 4158064, "code_hash": null, "entity": [["tile_x", "sp", [-1, 1, 1, 4]], ["tile_y", "sp", [-1, 1, 1, 8]], ["tile_k", "sp", [-1, 14, 3]]]}, "result": [[0.062461575000000005], 0, 3.382582426071167, 1638793271.3148189], "version": 0.2, "tvm_version": "0.8.dev0"}
{"input": ["cuda -keys=cuda,gpu -max_num_threads=1024 -thread_warp_size=32", "dense_large_batch.gpu", [["TENSOR", [128, 4032], "float32"], ["TENSOR", [4032, 1000], "float32"]], {}], "config": {"index": 7702916, "code_hash": null, "entity": [["tile_x", "sp", [-1, 1, 1, 64]], ["tile_y", "sp", [-1, 1, 1, 5]], ["tile_k", "sp", [-1, 1, 7]]]}, "result": [[1.0886170750000002], 0, 15.715146541595459, 1638793286.2901258], "version": 0.2, "tvm_version": "0.8.dev0"}
{"input": ["cuda -keys=cuda,gpu -max_num_threads=1024 -thread_warp_size=32", "dense_large_batch.gpu", [["TENSOR", [128, 4032], "float32"], ["TENSOR", [4032, 1000], "float32"]], {}], "config": {"index": 5446885, "code_hash": null, "entity": [["tile_x", "sp", [-1, 1, 1, 8]], ["tile_y", "sp", [-1, 1, 1, 5]], ["tile_k", "sp", [-1, 9, 4]]]}, "result": [[0.06940197499999999], 0, 2.896192789077759, 1638793290.8623793], "version": 0.2, "tvm_version": "0.8.dev0"}
{"input": ["cuda -keys=cuda,gpu -max_num_threads=1024 -thread_warp_size=32", "dense_large_batch.gpu", [["TENSOR", [128, 4032], "float32"], ["TENSOR", [4032, 1000], "float32"]], {}], "config": {"index": 5502085, "code_hash": null, "entity": [["tile_x", "sp", [-1, 1, 1, 8]], ["tile_y", "sp", [-1, 1, 1, 8]], ["tile_k", "sp", [-1, 12, 4]]]}, "result": [[0.044500975], 0, 3.642428398132324, 1638793292.755332], "version": 0.2, "tvm_version": "0.8.dev0"}
{"input": ["cuda -keys=cuda,gpu -max_num_threads=1024 -thread_warp_size=32", "dense_large_batch.gpu", [["TENSOR", [128, 4032], "float32"], ["TENSOR", [4032, 1000], "float32"]], {}], "config": {"index": 2574064, "code_hash": null, "entity": [["tile_x", "sp", [-1, 1, 1, 4]], ["tile_y", "sp", [-1, 1, 1, 8]], ["tile_k", "sp", [-1, 18, 2]]]}, "result": [[0.056177174999999996], 0, 2.6621227264404297, 1638793294.304548], "version": 0.2, "tvm_version": "0.8.dev0"}
{"input": ["cuda -keys=cuda,gpu -max_num_threads=1024 -thread_warp_size=32", "dense_large_batch.gpu", [["TENSOR", [128, 4032], "float32"], ["TENSOR", [4032, 1000], "float32"]], {}], "config": {"index": 3862910, "code_hash": null, "entity": [["tile_x", "sp", [-1, 1, 1, 32]], ["tile_y", "sp", [-1, 1, 1, 5]], ["tile_k", "sp", [-1, 3, 3]]]}, "result": [[0.294715425], 0, 5.631195545196533, 1638793298.9982128], "version": 0.2, "tvm_version": "0.8.dev0"}
{"input": ["cuda -keys=cuda,gpu -max_num_threads=1024 -thread_warp_size=32", "dense_large_batch.gpu", [["TENSOR", [128, 4032], "float32"], ["TENSOR", [4032, 1000], "float32"]], {}], "config": {"index": 5539405, "code_hash": null, "entity": [["tile_x", "sp", [-1, 1, 1, 8]], ["tile_y", "sp", [-1, 2, 1, 4]], ["tile_k", "sp", [-1, 14, 4]]]}, "result": [[0.048065025], 0, 4.314432144165039, 1638793301.3256686], "version": 0.2, "tvm_version": "0.8.dev0"}
{"input": ["cuda -keys=cuda,gpu -max_num_threads=1024 -thread_warp_size=32", "dense_large_batch.gpu", [["TENSOR", [128, 4032], "float32"], ["TENSOR", [4032, 1000], "float32"]], {}], "config": {"index": 5502064, "code_hash": null, "entity": [["tile_x", "sp", [-1, 1, 1, 4]], ["tile_y", "sp", [-1, 1, 1, 8]], ["tile_k", "sp", [-1, 12, 4]]]}, "result": [[0.056694925], 0, 2.8404433727264404, 1638793302.9353724], "version": 0.2, "tvm_version": "0.8.dev0"}
{"input": ["cuda -keys=cuda,gpu -max_num_threads=1024 -thread_warp_size=32", "dense_large_batch.gpu", [["TENSOR", [128, 4032], "float32"], ["TENSOR", [4032, 1000], "float32"]], {}], "config": {"index": 3966085, "code_hash": null, "entity": [["tile_x", "sp", [-1, 1, 1, 8]], ["tile_y", "sp", [-1, 1, 1, 8]], ["tile_k", "sp", [-1, 6, 3]]]}, "result": [[0.052838325], 0, 2.1780200004577637, 1638793304.3470037], "version": 0.2, "tvm_version": "0.8.dev0"}
{"input": ["cuda -keys=cuda,gpu -max_num_threads=1024 -thread_warp_size=32", "dense_large_batch.gpu", [["TENSOR", [128, 4032], "float32"], ["TENSOR", [4032, 1000], "float32"]], {}], "config": {"index": 8958085, "code_hash": null, "entity": [["tile_x", "sp", [-1, 1, 1, 8]], ["tile_y", "sp", [-1, 1, 1, 8]], ["tile_k", "sp", [-1, 7, 8]]]}, "result": [[0.23508745], 0, 6.219902753829956, 1638793308.476506], "version": 0.2, "tvm_version": "0.8.dev0"}
{"input": ["cuda -keys=cuda,gpu -max_num_threads=1024 -thread_warp_size=32", "dense_large_batch.gpu", [["TENSOR", [128, 4032], "float32"], ["TENSOR", [4032, 1000], "float32"]], {}], "config": {"index": 8899285, "code_hash": null, "entity": [["tile_x", "sp", [-1, 1, 1, 8]], ["tile_y", "sp", [-1, 1, 1, 4]], ["tile_k", "sp", [-1, 6, 8]]]}, "result": [[0.056749474999999994], 0, 2.6745645999908447, 1638793310.0755818], "version": 0.2, "tvm_version": "0.8.dev0"}
{"input": ["cuda -keys=cuda,gpu -max_num_threads=1024 -thread_warp_size=32", "dense_large_batch.gpu", [["TENSOR", [128, 4032], "float32"], ["TENSOR", [4032, 1000], "float32"]], {}], "config": {"index": 14563264, "code_hash": null, "entity": [["tile_x", "sp", [-1, 1, 1, 4]], ["tile_y", "sp", [-1, 1, 1, 4]], ["tile_k", "sp", [-1, 3, 24]]]}, "result": [[0.532859325], 0, 8.835328578948975, 1638793317.864866], "version": 0.2, "tvm_version": "0.8.dev0"}
{"input": ["cuda -keys=cuda,gpu -max_num_threads=1024 -thread_warp_size=32", "dense_large_batch.gpu", [["TENSOR", [128, 4032], "float32"], ["TENSOR", [4032, 1000], "float32"]], {}], "config": {"index": 12454864, "code_hash": null, "entity": [["tile_x", "sp", [-1, 1, 1, 4]], ["tile_y", "sp", [-1, 1, 1, 5]], ["tile_k", "sp", [-1, 3, 16]]]}, "result": [[0.512495625], 0, 8.291407108306885, 1638793325.2419055], "version": 0.2, "tvm_version": "0.8.dev0"}
{"input": ["cuda -keys=cuda,gpu -max_num_threads=1024 -thread_warp_size=32", "dense_large_batch.gpu", [["TENSOR", [128, 4032], "float32"], ["TENSOR", [4032, 1000], "float32"]], {}], "config": {"index": 17590885, "code_hash": null, "entity": [["tile_x", "sp", [-1, 1, 1, 8]], ["tile_y", "sp", [-1, 1, 1, 5]], ["tile_k", "sp", [-1, 1, 48]]]}, "result": [[0.36694605], 0, 6.26791787147522, 1638793330.7587006], "version": 0.2, "tvm_version": "0.8.dev0"}
{"input": ["cuda -keys=cuda,gpu -max_num_threads=1024 -thread_warp_size=32", "dense_large_batch.gpu", [["TENSOR", [128, 4032], "float32"], ["TENSOR", [4032, 1000], "float32"]], {}], "config": {"index": 12451405, "code_hash": null, "entity": [["tile_x", "sp", [-1, 1, 1, 8]], ["tile_y", "sp", [-1, 2, 1, 4]], ["tile_k", "sp", [-1, 3, 16]]]}, "result": [[0.287728625], 0, 6.5954132080078125, 1638793335.3688803], "version": 0.2, "tvm_version": "0.8.dev0"}
{"input": ["cuda -keys=cuda,gpu -max_num_threads=1024 -thread_warp_size=32", "dense_large_batch.gpu", [["TENSOR", [128, 4032], "float32"], ["TENSOR", [4032, 1000], "float32"]], {}], "config": {"index": 18163405, "code_hash": null, "entity": [["tile_x", "sp", [-1, 1, 1, 8]], ["tile_y", "sp", [-1, 2, 1, 4]], ["tile_k", "sp", [-1, 1, 56]]]}, "result": [[0.292615525], 0, 5.233692169189453, 1638793340.1089299], "version": 0.2, "tvm_version": "0.8.dev0"}
{"input": ["cuda -keys=cuda,gpu -max_num_threads=1024 -thread_warp_size=32", "dense_large_batch.gpu", [["TENSOR", [128, 4032], "float32"], ["TENSOR", [4032, 1000], "float32"]], {}], "config": {"index": 14515405, "code_hash": null, "entity": [["tile_x", "sp", [-1, 1, 1, 8]], ["tile_y", "sp", [-1, 2, 1, 4]], ["tile_k", "sp", [-1, 2, 24]]]}, "result": [[0.282725825], 0, 6.479717254638672, 1638793344.7516592], "version": 0.2, "tvm_version": "0.8.dev0"}
{"input": ["cuda -keys=cuda,gpu -max_num_threads=1024 -thread_warp_size=32", "dense_large_batch.gpu", [["TENSOR", [128, 4032], "float32"], ["TENSOR", [4032, 1000], "float32"]], {}], "config": {"index": 19086064, "code_hash": null, "entity": [["tile_x", "sp", [-1, 1, 1, 4]], ["tile_y", "sp", [-1, 1, 1, 8]], ["tile_k", "sp", [-1, 1, 64]]]}, "result": [[0.414208925], 0, 6.827840566635132, 1638793350.953481], "version": 0.2, "tvm_version": "0.8.dev0"}
{"input": ["cuda -keys=cuda,gpu -max_num_threads=1024 -thread_warp_size=32", "dense_large_batch.gpu", [["TENSOR", [128, 4032], "float32"], ["TENSOR", [4032, 1000], "float32"]], {}], "config": {"index": 8806885, "code_hash": null, "entity": [["tile_x", "sp", [-1, 1, 1, 8]], ["tile_y", "sp", [-1, 1, 1, 5]], ["tile_k", "sp", [-1, 3, 8]]]}, "result": [[0.33097067500000005], 0, 5.745969295501709, 1638793355.983881], "version": 0.2, "tvm_version": "0.8.dev0"}
{"input": ["cuda -keys=cuda,gpu -max_num_threads=1024 -thread_warp_size=32", "dense_large_batch.gpu", [["TENSOR", [128, 4032], "float32"], ["TENSOR", [4032, 1000], "float32"]], {}], "config": {"index": 9910900, "code_hash": null, "entity": [["tile_x", "sp", [-1, 1, 1, 16]], ["tile_y", "sp", [-1, 1, 1, 5]], ["tile_k", "sp", [-1, 2, 9]]]}, "result": [[0.328046375], 0, 5.905091285705566, 1638793361.015036], "version": 0.2, "tvm_version": "0.8.dev0"}
{"input": ["cuda -keys=cuda,gpu -max_num_threads=1024 -thread_warp_size=32", "dense_large_batch.gpu", [["TENSOR", [128, 4032], "float32"], ["TENSOR", [4032, 1000], "float32"]], {}], "config": {"index": 12403285, "code_hash": null, "entity": [["tile_x", "sp", [-1, 1, 1, 8]], ["tile_y", "sp", [-1, 1, 1, 4]], ["tile_k", "sp", [-1, 2, 16]]]}, "result": [[0.41928825000000003], 0, 6.980650901794434, 1638793367.1480591], "version": 0.2, "tvm_version": "0.8.dev0"}
{"input": ["cuda -keys=cuda,gpu -max_num_threads=1024 -thread_warp_size=32", "dense_large_batch.gpu", [["TENSOR", [128, 4032], "float32"], ["TENSOR", [4032, 1000], "float32"]], {}], "config": {"index": 7699316, "code_hash": null, "entity": [["tile_x", "sp", [-1, 1, 1, 64]], ["tile_y", "sp", [-1, 1, 1, 4]], ["tile_k", "sp", [-1, 1, 7]]]}, "result": [[1.09878545], 0, 16.06919550895691, 1638793382.7438793], "version": 0.2, "tvm_version": "0.8.dev0"}
{"input": ["cuda -keys=cuda,gpu -max_num_threads=1024 -thread_warp_size=32", "dense_large_batch.gpu", [["TENSOR", [128, 4032], "float32"], ["TENSOR", [4032, 1000], "float32"]], {}], "config": {"index": 5395285, "code_hash": null, "entity": [["tile_x", "sp", [-1, 1, 1, 8]], ["tile_y", "sp", [-1, 1, 1, 4]], ["tile_k", "sp", [-1, 8, 4]]]}, "result": [[0.0556599], 0, 2.2970807552337646, 1638793384.18691], "version": 0.2, "tvm_version": "0.8.dev0"}
{"input": ["cuda -keys=cuda,gpu -max_num_threads=1024 -thread_warp_size=32", "dense_large_batch.gpu", [["TENSOR", [128, 4032], "float32"], ["TENSOR", [4032, 1000], "float32"]], {}], "config": {"index": 8748220, "code_hash": null, "entity": [["tile_x", "sp", [-1, 1, 1, 16]], ["tile_y", "sp", [-1, 2, 1, 2]], ["tile_k", "sp", [-1, 2, 8]]]}, "result": [[0.33399725], 0, 5.758501052856445, 1638793389.154736], "version": 0.2, "tvm_version": "0.8.dev0"}
{"input": ["cuda -keys=cuda,gpu -max_num_threads=1024 -thread_warp_size=32", "dense_large_batch.gpu", [["TENSOR", [128, 4032], "float32"], ["TENSOR", [4032, 1000], "float32"]], {}], "config": {"index": 5280220, "code_hash": null, "entity": [["tile_x", "sp", [-1, 1, 1, 16]], ["tile_y", "sp", [-1, 2, 1, 1]], ["tile_k", "sp", [-1, 6, 4]]]}, "result": [[0.07795229999999999], 0, 2.5623793601989746, 1638793390.8612473], "version": 0.2, "tvm_version": "0.8.dev0"}
{"input": ["cuda -keys=cuda,gpu -max_num_threads=1024 -thread_warp_size=32", "dense_large_batch.gpu", [["TENSOR", [128, 4032], "float32"], ["TENSOR", [4032, 1000], "float32"]], {}], "config": {"index": 7798885, "code_hash": null, "entity": [["tile_x", "sp", [-1, 1, 1, 8]], ["tile_y", "sp", [-1, 1, 1, 5]], ["tile_k", "sp", [-1, 3, 7]]]}, "result": [[0.2403434], 0, 4.483884811401367, 1638793394.6687977], "version": 0.2, "tvm_version": "0.8.dev0"}
{"input": ["cuda -keys=cuda,gpu -max_num_threads=1024 -thread_warp_size=32", "dense_large_batch.gpu", [["TENSOR", [128, 4032], "float32"], ["TENSOR", [4032, 1000], "float32"]], {}], "config": {"index": 2430085, "code_hash": null, "entity": [["tile_x", "sp", [-1, 1, 1, 8]], ["tile_y", "sp", [-1, 1, 1, 8]], ["tile_k", "sp", [-1, 12, 2]]]}, "result": [[0.053762325], 0, 2.924921751022339, 1638793451.1851676], "version": 0.2, "tvm_version": "0.8.dev0"}
{"input": ["cuda -keys=cuda,gpu -max_num_threads=1024 -thread_warp_size=32", "dense_large_batch.gpu", [["TENSOR", [128, 4032], "float32"], ["TENSOR", [4032, 1000], "float32"]], {}], "config": {"index": 2419285, "code_hash": null, "entity": [["tile_x", "sp", [-1, 1, 1, 8]], ["tile_y", "sp", [-1, 1, 1, 4]], ["tile_k", "sp", [-1, 12, 2]]]}, "result": [[0.05658025], 0, 2.4385178089141846, 1638793452.820086], "version": 0.2, "tvm_version": "0.8.dev0"}
{"input": ["cuda -keys=cuda,gpu -max_num_threads=1024 -thread_warp_size=32", "dense_large_batch.gpu", [["TENSOR", [128, 4032], "float32"], ["TENSOR", [4032, 1000], "float32"]], {}], "config": {"index": 5358085, "code_hash": null, "entity": [["tile_x", "sp", [-1, 1, 1, 8]], ["tile_y", "sp", [-1, 1, 1, 8]], ["tile_k", "sp", [-1, 7, 4]]]}, "result": [[0.0406679], 0, 2.5070993900299072, 1638793454.2300723], "version": 0.2, "tvm_version": "0.8.dev0"}
{"input": ["cuda -keys=cuda,gpu -max_num_threads=1024 -thread_warp_size=32", "dense_large_batch.gpu", [["TENSOR", [128, 4032], "float32"], ["TENSOR", [4032, 1000], "float32"]], {}], "config": {"index": 2323300, "code_hash": null, "entity": [["tile_x", "sp", [-1, 1, 1, 16]], ["tile_y", "sp", [-1, 1, 1, 4]], ["tile_k", "sp", [-1, 8, 2]]]}, "result": [[0.0447679], 0, 2.4050307273864746, 1638793455.6074934], "version": 0.2, "tvm_version": "0.8.dev0"}
{"input": ["cuda -keys=cuda,gpu -max_num_threads=1024 -thread_warp_size=32", "dense_large_batch.gpu", [["TENSOR", [128, 4032], "float32"], ["TENSOR", [4032, 1000], "float32"]], {}], "config": {"index": 2515285, "code_hash": null, "entity": [["tile_x", "sp", [-1, 1, 1, 8]], ["tile_y", "sp", [-1, 1, 1, 4]], ["tile_k", "sp", [-1, 16, 2]]]}, "result": [[0.05551605], 0, 2.286834239959717, 1638793456.8113723], "version": 0.2, "tvm_version": "0.8.dev0"}
{"input": ["cuda -keys=cuda,gpu -max_num_threads=1024 -thread_warp_size=32", "dense_large_batch.gpu", [["TENSOR", [128, 4032], "float32"], ["TENSOR", [4032, 1000], "float32"]], {}], "config": {"index": 5310085, "code_hash": null, "entity": [["tile_x", "sp", [-1, 1, 1, 8]], ["tile_y", "sp", [-1, 1, 1, 8]], ["tile_k", "sp", [-1, 6, 4]]]}, "result": [[0.040870725000000004], 0, 1.9448134899139404, 1638793457.8073044], "version": 0.2, "tvm_version": "0.8.dev0"}
{"input": ["cuda -keys=cuda,gpu -max_num_threads=1024 -thread_warp_size=32", "dense_large_batch.gpu", [["TENSOR", [128, 4032], "float32"], ["TENSOR", [4032, 1000], "float32"]], {}], "config": {"index": 403300, "code_hash": null, "entity": [["tile_x", "sp", [-1, 1, 1, 16]], ["tile_y", "sp", [-1, 1, 1, 4]], ["tile_k", "sp", [-1, 12, 1]]]}, "result": [[0.0453275], 0, 1.9590835571289062, 1638793459.0741343], "version": 0.2, "tvm_version": "0.8.dev0"}
{"input": ["cuda -keys=cuda,gpu -max_num_threads=1024 -thread_warp_size=32", "dense_large_batch.gpu", [["TENSOR", [128, 4032], "float32"], ["TENSOR", [4032, 1000], "float32"]], {}], "config": {"index": 2227300, "code_hash": null, "entity": [["tile_x", "sp", [-1, 1, 1, 16]], ["tile_y", "sp", [-1, 1, 1, 4]], ["tile_k", "sp", [-1, 6, 2]]]}, "result": [[0.04569915], 0, 1.9804320335388184, 1638793460.370661], "version": 0.2, "tvm_version": "0.8.dev0"}
{"input": ["cuda -keys=cuda,gpu -max_num_threads=1024 -thread_warp_size=32", "dense_large_batch.gpu", [["TENSOR", [128, 4032], "float32"], ["TENSOR", [4032, 1000], "float32"]], {}], "config": {"index": 2467285, "code_hash": null, "entity": [["tile_x", "sp", [-1, 1, 1, 8]], ["tile_y", "sp", [-1, 1, 1, 4]], ["tile_k", "sp", [-1, 14, 2]]]}, "result": [[0.056528100000000005], 0, 2.29611873626709, 1638793461.78743], "version": 0.2, "tvm_version": "0.8.dev0"}
{"input": ["cuda -keys=cuda,gpu -max_num_threads=1024 -thread_warp_size=32", "dense_large_batch.gpu", [["TENSOR", [128, 4032], "float32"], ["TENSOR", [4032, 1000], "float32"]], {}], "config": {"index": 2467420, "code_hash": null, "entity": [["tile_x", "sp", [-1, 1, 1, 16]], ["tile_y", "sp", [-1, 2, 1, 4]], ["tile_k", "sp", [-1, 14, 2]]]}, "result": [[0.041614375], 0, 4.2433717250823975, 1638793464.042484], "version": 0.2, "tvm_version": "0.8.dev0"}
{"input": ["cuda -keys=cuda,gpu -max_num_threads=1024 -thread_warp_size=32", "dense_large_batch.gpu", [["TENSOR", [128, 4032], "float32"], ["TENSOR", [4032, 1000], "float32"]], {}], "config": {"index": 4051285, "code_hash": null, "entity": [["tile_x", "sp", [-1, 1, 1, 8]], ["tile_y", "sp", [-1, 1, 1, 4]], ["tile_k", "sp", [-1, 8, 3]]]}, "result": [[0.056613375], 0, 1.9249615669250488, 1638793465.2289078], "version": 0.2, "tvm_version": "0.8.dev0"}
{"input": ["cuda -keys=cuda,gpu -max_num_threads=1024 -thread_warp_size=32", "dense_large_batch.gpu", [["TENSOR", [128, 4032], "float32"], ["TENSOR", [4032, 1000], "float32"]], {}], "config": {"index": 2526085, "code_hash": null, "entity": [["tile_x", "sp", [-1, 1, 1, 8]], ["tile_y", "sp", [-1, 1, 1, 8]], ["tile_k", "sp", [-1, 16, 2]]]}, "result": [[0.041128525000000006], 0, 2.4117586612701416, 1638793466.2308025], "version": 0.2, "tvm_version": "0.8.dev0"}
{"input": ["cuda -keys=cuda,gpu -max_num_threads=1024 -thread_warp_size=32", "dense_large_batch.gpu", [["TENSOR", [128, 4032], "float32"], ["TENSOR", [4032, 1000], "float32"]], {}], "config": {"index": 654085, "code_hash": null, "entity": [["tile_x", "sp", [-1, 1, 1, 8]], ["tile_y", "sp", [-1, 1, 1, 8]], ["tile_k", "sp", [-1, 24, 1]]]}, "result": [[0.04100955], 0, 2.470351219177246, 1638793467.6388679], "version": 0.2, "tvm_version": "0.8.dev0"}
{"input": ["cuda -keys=cuda,gpu -max_num_threads=1024 -thread_warp_size=32", "dense_large_batch.gpu", [["TENSOR", [128, 4032], "float32"], ["TENSOR", [4032, 1000], "float32"]], {}], "config": {"index": 4051300, "code_hash": null, "entity": [["tile_x", "sp", [-1, 1, 1, 16]], ["tile_y", "sp", [-1, 1, 1, 4]], ["tile_k", "sp", [-1, 8, 3]]]}, "result": [[0.0487394], 0, 2.6887319087982178, 1638793469.1995046], "version": 0.2, "tvm_version": "0.8.dev0"}
{"input": ["cuda -keys=cuda,gpu -max_num_threads=1024 -thread_warp_size=32", "dense_large_batch.gpu", [["TENSOR", [128, 4032], "float32"], ["TENSOR", [4032, 1000], "float32"]], {}], "config": {"index": 4051420, "code_hash": null, "entity": [["tile_x", "sp", [-1, 1, 1, 16]], ["tile_y", "sp", [-1, 2, 1, 4]], ["tile_k", "sp", [-1, 8, 3]]]}, "result": [[0.17007375], 0, 6.217947959899902, 1638793473.7420244], "version": 0.2, "tvm_version": "0.8.dev0"}
{"input": ["cuda -keys=cuda,gpu -max_num_threads=1024 -thread_warp_size=32", "dense_large_batch.gpu", [["TENSOR", [128, 4032], "float32"], ["TENSOR", [4032, 1000], "float32"]], {}], "config": {"index": 2430065, "code_hash": null, "entity": [["tile_x", "sp", [-1, 2, 1, 4]], ["tile_y", "sp", [-1, 1, 1, 8]], ["tile_k", "sp", [-1, 12, 2]]]}, "result": [[0.04100465], 0, 2.429203748703003, 1638793475.2094073], "version": 0.2, "tvm_version": "0.8.dev0"}
{"input": ["cuda -keys=cuda,gpu -max_num_threads=1024 -thread_warp_size=32", "dense_large_batch.gpu", [["TENSOR", [128, 4032], "float32"], ["TENSOR", [4032, 1000], "float32"]], {}], "config": {"index": 5491405, "code_hash": null, "entity": [["tile_x", "sp", [-1, 1, 1, 8]], ["tile_y", "sp", [-1, 2, 1, 4]], ["tile_k", "sp", [-1, 12, 4]]]}, "result": [[0.0448585], 0, 3.904496431350708, 1638793477.102424], "version": 0.2, "tvm_version": "0.8.dev0"}
{"input": ["cuda -keys=cuda,gpu -max_num_threads=1024 -thread_warp_size=32", "dense_large_batch.gpu", [["TENSOR", [128, 4032], "float32"], ["TENSOR", [4032, 1000], "float32"]], {}], "config": {"index": 702085, "code_hash": null, "entity": [["tile_x", "sp", [-1, 1, 1, 8]], ["tile_y", "sp", [-1, 1, 1, 8]], ["tile_k", "sp", [-1, 28, 1]]]}, "result": [[0.04128845], 0, 2.706395149230957, 1638793478.5162606], "version": 0.2, "tvm_version": "0.8.dev0"}
{"input": ["cuda -keys=cuda,gpu -max_num_threads=1024 -thread_warp_size=32", "dense_large_batch.gpu", [["TENSOR", [128, 4032], "float32"], ["TENSOR", [4032, 1000], "float32"]], {}], "config": {"index": 2430086, "code_hash": null, "entity": [["tile_x", "sp", [-1, 2, 1, 8]], ["tile_y", "sp", [-1, 1, 1, 8]], ["tile_k", "sp", [-1, 12, 2]]]}, "result": [[0.03761125], 0, 3.6144609451293945, 1638793480.5531085], "version": 0.2, "tvm_version": "0.8.dev0"}
{"input": ["cuda -keys=cuda,gpu -max_num_threads=1024 -thread_warp_size=32", "dense_large_batch.gpu", [["TENSOR", [128, 4032], "float32"], ["TENSOR", [4032, 1000], "float32"]], {}], "config": {"index": 2659285, "code_hash": null, "entity": [["tile_x", "sp", [-1, 1, 1, 8]], ["tile_y", "sp", [-1, 1, 1, 4]], ["tile_k", "sp", [-1, 24, 2]]]}, "result": [[0.0567513], 0, 2.9223413467407227, 1638793481.7700663], "version": 0.2, "tvm_version": "0.8.dev0"}
{"input": ["cuda -keys=cuda,gpu -max_num_threads=1024 -thread_warp_size=32", "dense_large_batch.gpu", [["TENSOR", [128, 4032], "float32"], ["TENSOR", [4032, 1000], "float32"]], {}], "config": {"index": 5454085, "code_hash": null, "entity": [["tile_x", "sp", [-1, 1, 1, 8]], ["tile_y", "sp", [-1, 1, 1, 8]], ["tile_k", "sp", [-1, 9, 4]]]}, "result": [[0.04208265], 0, 2.36141300201416, 1638793482.771817], "version": 0.2, "tvm_version": "0.8.dev0"}
{"input": ["cuda -keys=cuda,gpu -max_num_threads=1024 -thread_warp_size=32", "dense_large_batch.gpu", [["TENSOR", [128, 4032], "float32"], ["TENSOR", [4032, 1000], "float32"]], {}], "config": {"index": 2419300, "code_hash": null, "entity": [["tile_x", "sp", [-1, 1, 1, 16]], ["tile_y", "sp", [-1, 1, 1, 4]], ["tile_k", "sp", [-1, 12, 2]]]}, "result": [[0.0487321], 0, 2.3268210887908936, 1638793483.8672936], "version": 0.2, "tvm_version": "0.8.dev0"}
{"input": ["cuda -keys=cuda,gpu -max_num_threads=1024 -thread_warp_size=32", "dense_large_batch.gpu", [["TENSOR", [128, 4032], "float32"], ["TENSOR", [4032, 1000], "float32"]], {}], "config": {"index": 414086, "code_hash": null, "entity": [["tile_x", "sp", [-1, 2, 1, 8]], ["tile_y", "sp", [-1, 1, 1, 8]], ["tile_k", "sp", [-1, 12, 1]]]}, "result": [[0.0344813], 0, 2.391348361968994, 1638793485.320839], "version": 0.2, "tvm_version": "0.8.dev0"}
{"input": ["cuda -keys=cuda,gpu -max_num_threads=1024 -thread_warp_size=32", "dense_large_batch.gpu", [["TENSOR", [128, 4032], "float32"], ["TENSOR", [4032, 1000], "float32"]], {}], "config": {"index": 307300, "code_hash": null, "entity": [["tile_x", "sp", [-1, 1, 1, 16]], ["tile_y", "sp", [-1, 1, 1, 4]], ["tile_k", "sp", [-1, 8, 1]]]}, "result": [[0.042673125], 0, 1.8157718181610107, 1638793486.4900653], "version": 0.2, "tvm_version": "0.8.dev0"}
{"input": ["cuda -keys=cuda,gpu -max_num_threads=1024 -thread_warp_size=32", "dense_large_batch.gpu", [["TENSOR", [128, 4032], "float32"], ["TENSOR", [4032, 1000], "float32"]], {}], "config": {"index": 5251300, "code_hash": null, "entity": [["tile_x", "sp", [-1, 1, 1, 16]], ["tile_y", "sp", [-1, 1, 1, 4]], ["tile_k", "sp", [-1, 4, 4]]]}, "result": [[0.057950875000000006], 0, 2.0744991302490234, 1638793490.7926], "version": 0.2, "tvm_version": "0.8.dev0"}
{"input": ["cuda -keys=cuda,gpu -max_num_threads=1024 -thread_warp_size=32", "dense_large_batch.gpu", [["TENSOR", [128, 4032], "float32"], ["TENSOR", [4032, 1000], "float32"]], {}], "config": {"index": 643300, "code_hash": null, "entity": [["tile_x", "sp", [-1, 1, 1, 16]], ["tile_y", "sp", [-1, 1, 1, 4]], ["tile_k", "sp", [-1, 24, 1]]]}, "result": [[0.04875105], 0, 2.824631452560425, 1638793492.3824172], "version": 0.2, "tvm_version": "0.8.dev0"}
{"input": ["cuda -keys=cuda,gpu -max_num_threads=1024 -thread_warp_size=32", "dense_large_batch.gpu", [["TENSOR", [128, 4032], "float32"], ["TENSOR", [4032, 1000], "float32"]], {}], "config": {"index": 2707285, "code_hash": null, "entity": [["tile_x", "sp", [-1, 1, 1, 8]], ["tile_y", "sp", [-1, 1, 1, 4]], ["tile_k", "sp", [-1, 28, 2]]]}, "result": [[0.0594937], 0, 3.8522822856903076, 1638793494.174157], "version": 0.2, "tvm_version": "0.8.dev0"}
{"input": ["cuda -keys=cuda,gpu -max_num_threads=1024 -thread_warp_size=32", "dense_large_batch.gpu", [["TENSOR", [128, 4032], "float32"], ["TENSOR", [4032, 1000], "float32"]], {}], "config": {"index": 2238100, "code_hash": null, "entity": [["tile_x", "sp", [-1, 1, 1, 16]], ["tile_y", "sp", [-1, 1, 1, 8]], ["tile_k", "sp", [-1, 6, 2]]]}, "result": [[0.0346906], 0, 2.348856210708618, 1638793495.555382], "version": 0.2, "tvm_version": "0.8.dev0"}
{"input": ["cuda -keys=cuda,gpu -max_num_threads=1024 -thread_warp_size=32", "dense_large_batch.gpu", [["TENSOR", [128, 4032], "float32"], ["TENSOR", [4032, 1000], "float32"]], {}], "config": {"index": 3907300, "code_hash": null, "entity": [["tile_x", "sp", [-1, 1, 1, 16]], ["tile_y", "sp", [-1, 1, 1, 4]], ["tile_k", "sp", [-1, 4, 3]]]}, "result": [[0.045711175], 0, 1.6797010898590088, 1638793496.5956511], "version": 0.2, "tvm_version": "0.8.dev0"}
{"input": ["cuda -keys=cuda,gpu -max_num_threads=1024 -thread_warp_size=32", "dense_large_batch.gpu", [["TENSOR", [128, 4032], "float32"], ["TENSOR", [4032, 1000], "float32"]], {}], "config": {"index": 2323285, "code_hash": null, "entity": [["tile_x", "sp", [-1, 1, 1, 8]], ["tile_y", "sp", [-1, 1, 1, 4]], ["tile_k", "sp", [-1, 8, 2]]]}, "result": [[0.0527295], 0, 1.8980321884155273, 1638793497.855813], "version": 0.2, "tvm_version": "0.8.dev0"}
{"input": ["cuda -keys=cuda,gpu -max_num_threads=1024 -thread_warp_size=32", "dense_large_batch.gpu", [["TENSOR", [128, 4032], "float32"], ["TENSOR", [4032, 1000], "float32"]], {}], "config": {"index": 2382085, "code_hash": null, "entity": [["tile_x", "sp", [-1, 1, 1, 8]], ["tile_y", "sp", [-1, 1, 1, 8]], ["tile_k", "sp", [-1, 9, 2]]]}, "result": [[0.052800625], 0, 2.019343852996826, 1638793498.985212], "version": 0.2, "tvm_version": "0.8.dev0"}
{"input": ["cuda -keys=cuda,gpu -max_num_threads=1024 -thread_warp_size=32", "dense_large_batch.gpu", [["TENSOR", [128, 4032], "float32"], ["TENSOR", [4032, 1000], "float32"]], {}], "config": {"index": 2334086, "code_hash": null, "entity": [["tile_x", "sp", [-1, 2, 1, 8]], ["tile_y", "sp", [-1, 1, 1, 8]], ["tile_k", "sp", [-1, 8, 2]]]}, "result": [[0.0381745], 0, 2.8119728565216064, 1638793500.63201], "version": 0.2, "tvm_version": "0.8.dev0"}
{"input": ["cuda -keys=cuda,gpu -max_num_threads=1024 -thread_warp_size=32", "dense_large_batch.gpu", [["TENSOR", [128, 4032], "float32"], ["TENSOR", [4032, 1000], "float32"]], {}], "config": {"index": 2659405, "code_hash": null, "entity": [["tile_x", "sp", [-1, 1, 1, 8]], ["tile_y", "sp", [-1, 2, 1, 4]], ["tile_k", "sp", [-1, 24, 2]]]}, "result": [[0.044804825], 0, 3.294443130493164, 1638793501.6633055], "version": 0.2, "tvm_version": "0.8.dev0"}
{"input": ["cuda -keys=cuda,gpu -max_num_threads=1024 -thread_warp_size=32", "dense_large_batch.gpu", [["TENSOR", [128, 4032], "float32"], ["TENSOR", [4032, 1000], "float32"]], {}], "config": {"index": 2227420, "code_hash": null, "entity": [["tile_x", "sp", [-1, 1, 1, 16]], ["tile_y", "sp", [-1, 2, 1, 4]], ["tile_k", "sp", [-1, 6, 2]]]}, "result": [[0.034702875], 0, 2.448143720626831, 1638793503.1404378], "version": 0.2, "tvm_version": "0.8.dev0"}
{"input": ["cuda -keys=cuda,gpu -max_num_threads=1024 -thread_warp_size=32", "dense_large_batch.gpu", [["TENSOR", [128, 4032], "float32"], ["TENSOR", [4032, 1000], "float32"]], {}], "config": {"index": 2334085, "code_hash": null, "entity": [["tile_x", "sp", [-1, 1, 1, 8]], ["tile_y", "sp", [-1, 1, 1, 8]], ["tile_k", "sp", [-1, 8, 2]]]}, "result": [[0.038353700000000004], 0, 1.9776394367218018, 1638793504.3329902], "version": 0.2, "tvm_version": "0.8.dev0"}
{"input": ["cuda -keys=cuda,gpu -max_num_threads=1024 -thread_warp_size=32", "dense_large_batch.gpu", [["TENSOR", [128, 4032], "float32"], ["TENSOR", [4032, 1000], "float32"]], {}], "config": {"index": 2326900, "code_hash": null, "entity": [["tile_x", "sp", [-1, 1, 1, 16]], ["tile_y", "sp", [-1, 1, 1, 5]], ["tile_k", "sp", [-1, 8, 2]]]}, "result": [[0.04615229999999999], 0, 2.6324543952941895, 1638793505.7936614], "version": 0.2, "tvm_version": "0.8.dev0"}
{"input": ["cuda -keys=cuda,gpu -max_num_threads=1024 -thread_warp_size=32", "dense_large_batch.gpu", [["TENSOR", [128, 4032], "float32"], ["TENSOR", [4032, 1000], "float32"]], {}], "config": {"index": 643285, "code_hash": null, "entity": [["tile_x", "sp", [-1, 1, 1, 8]], ["tile_y", "sp", [-1, 1, 1, 4]], ["tile_k", "sp", [-1, 24, 1]]]}, "result": [[0.05667655], 0, 2.4823999404907227, 1638793507.1594818], "version": 0.2, "tvm_version": "0.8.dev0"}
{"input": ["cuda -keys=cuda,gpu -max_num_threads=1024 -thread_warp_size=32", "dense_large_batch.gpu", [["TENSOR", [128, 4032], "float32"], ["TENSOR", [4032, 1000], "float32"]], {}], "config": {"index": 2419405, "code_hash": null, "entity": [["tile_x", "sp", [-1, 1, 1, 8]], ["tile_y", "sp", [-1, 2, 1, 4]], ["tile_k", "sp", [-1, 12, 2]]]}, "result": [[0.041127775], 0, 2.4343137741088867, 1638793508.5153472], "version": 0.2, "tvm_version": "0.8.dev0"}
{"input": ["cuda -keys=cuda,gpu -max_num_threads=1024 -thread_warp_size=32", "dense_large_batch.gpu", [["TENSOR", [128, 4032], "float32"], ["TENSOR", [4032, 1000], "float32"]], {}], "config": {"index": 4158085, "code_hash": null, "entity": [["tile_x", "sp", [-1, 1, 1, 8]], ["tile_y", "sp", [-1, 1, 1, 8]], ["tile_k", "sp", [-1, 14, 3]]]}, "result": [[0.05830490000000001], 0, 3.5988924503326416, 1638793510.44597], "version": 0.2, "tvm_version": "0.8.dev0"}
{"input": ["cuda -keys=cuda,gpu -max_num_threads=1024 -thread_warp_size=32", "dense_large_batch.gpu", [["TENSOR", [128, 4032], "float32"], ["TENSOR", [4032, 1000], "float32"]], {}], "config": {"index": 2563285, "code_hash": null, "entity": [["tile_x", "sp", [-1, 1, 1, 8]], ["tile_y", "sp", [-1, 1, 1, 4]], ["tile_k", "sp", [-1, 18, 2]]]}, "result": [[0.056344975], 0, 2.8248043060302734, 1638793511.9457698], "version": 0.2, "tvm_version": "0.8.dev0"}
{"input": ["cuda -keys=cuda,gpu -max_num_threads=1024 -thread_warp_size=32", "dense_large_batch.gpu", [["TENSOR", [128, 4032], "float32"], ["TENSOR", [4032, 1000], "float32"]], {}], "config": {"index": 5299420, "code_hash": null, "entity": [["tile_x", "sp", [-1, 1, 1, 16]], ["tile_y", "sp", [-1, 2, 1, 4]], ["tile_k", "sp", [-1, 6, 4]]]}, "result": [[0.159309425], 0, 4.722714185714722, 1638793515.0195556], "version": 0.2, "tvm_version": "0.8.dev0"}
{"input": ["cuda -keys=cuda,gpu -max_num_threads=1024 -thread_warp_size=32", "dense_large_batch.gpu", [["TENSOR", [128, 4032], "float32"], ["TENSOR", [4032, 1000], "float32"]], {}], "config": {"index": 4195405, "code_hash": null, "entity": [["tile_x", "sp", [-1, 1, 1, 8]], ["tile_y", "sp", [-1, 2, 1, 4]], ["tile_k", "sp", [-1, 16, 3]]]}, "result": [[0.044845925], 0, 2.9310755729675293, 1638793516.0444505], "version": 0.2, "tvm_version": "0.8.dev0"}
{"input": ["cuda -keys=cuda,gpu -max_num_threads=1024 -thread_warp_size=32", "dense_large_batch.gpu", [["TENSOR", [128, 4032], "float32"], ["TENSOR", [4032, 1000], "float32"]], {}], "config": {"index": 2179310, "code_hash": null, "entity": [["tile_x", "sp", [-1, 1, 1, 32]], ["tile_y", "sp", [-1, 1, 1, 4]], ["tile_k", "sp", [-1, 4, 2]]]}, "result": [[0.0476631], 0, 2.3838515281677246, 1638793517.5850763], "version": 0.2, "tvm_version": "0.8.dev0"}
{"input": ["cuda -keys=cuda,gpu -max_num_threads=1024 -thread_warp_size=32", "dense_large_batch.gpu", [["TENSOR", [128, 4032], "float32"], ["TENSOR", [4032, 1000], "float32"]], {}], "config": {"index": 5299285, "code_hash": null, "entity": [["tile_x", "sp", [-1, 1, 1, 8]], ["tile_y", "sp", [-1, 1, 1, 4]], ["tile_k", "sp", [-1, 6, 4]]]}, "result": [[0.0566569], 0, 2.1960196495056152, 1638793519.1600487], "version": 0.2, "tvm_version": "0.8.dev0"}
{"input": ["cuda -keys=cuda,gpu -max_num_threads=1024 -thread_warp_size=32", "dense_large_batch.gpu", [["TENSOR", [128, 4032], "float32"], ["TENSOR", [4032, 1000], "float32"]], {}], "config": {"index": 2467300, "code_hash": null, "entity": [["tile_x", "sp", [-1, 1, 1, 16]], ["tile_y", "sp", [-1, 1, 1, 4]], ["tile_k", "sp", [-1, 14, 2]]]}, "result": [[0.048827125], 0, 3.0153326988220215, 1638793520.7682717], "version": 0.2, "tvm_version": "0.8.dev0"}
{"input": ["cuda -keys=cuda,gpu -max_num_threads=1024 -thread_warp_size=32", "dense_large_batch.gpu", [["TENSOR", [128, 4032], "float32"], ["TENSOR", [4032, 1000], "float32"]], {}], "config": {"index": 2478065, "code_hash": null, "entity": [["tile_x", "sp", [-1, 2, 1, 4]], ["tile_y", "sp", [-1, 1, 1, 8]], ["tile_k", "sp", [-1, 14, 2]]]}, "result": [[0.0409524], 0, 2.6810858249664307, 1638793522.2425897], "version": 0.2, "tvm_version": "0.8.dev0"}
{"input": ["cuda -keys=cuda,gpu -max_num_threads=1024 -thread_warp_size=32", "dense_large_batch.gpu", [["TENSOR", [128, 4032], "float32"], ["TENSOR", [4032, 1000], "float32"]], {}], "config": {"index": 2323420, "code_hash": null, "entity": [["tile_x", "sp", [-1, 1, 1, 16]], ["tile_y", "sp", [-1, 2, 1, 4]], ["tile_k", "sp", [-1, 8, 2]]]}, "result": [[0.03820025], 0, 2.7830774784088135, 1638793523.89037], "version": 0.2, "tvm_version": "0.8.dev0"}
{"input": ["cuda -keys=cuda,gpu -max_num_threads=1024 -thread_warp_size=32", "dense_large_batch.gpu", [["TENSOR", [128, 4032], "float32"], ["TENSOR", [4032, 1000], "float32"]], {}], "config": {"index": 414085, "code_hash": null, "entity": [["tile_x", "sp", [-1, 1, 1, 8]], ["tile_y", "sp", [-1, 1, 1, 8]], ["tile_k", "sp", [-1, 12, 1]]]}, "result": [[0.0382489], 0, 1.8193402290344238, 1638793525.0454116], "version": 0.2, "tvm_version": "0.8.dev0"}
{"input": ["cuda -keys=cuda,gpu -max_num_threads=1024 -thread_warp_size=32", "dense_large_batch.gpu", [["TENSOR", [128, 4032], "float32"], ["TENSOR", [4032, 1000], "float32"]], {}], "config": {"index": 2371285, "code_hash": null, "entity": [["tile_x", "sp", [-1, 1, 1, 8]], ["tile_y", "sp", [-1, 1, 1, 4]], ["tile_k", "sp", [-1, 9, 2]]]}, "result": [[0.08648687499999999], 0, 2.446037530899048, 1638793537.6121209], "version": 0.2, "tvm_version": "0.8.dev0"}
{"input": ["cuda -keys=cuda,gpu -max_num_threads=1024 -thread_warp_size=32", "dense_large_batch.gpu", [["TENSOR", [128, 4032], "float32"], ["TENSOR", [4032, 1000], "float32"]], {}], "config": {"index": 4195285, "code_hash": null, "entity": [["tile_x", "sp", [-1, 1, 1, 8]], ["tile_y", "sp", [-1, 1, 1, 4]], ["tile_k", "sp", [-1, 16, 3]]]}, "result": [[0.056791825000000004], 0, 2.374563455581665, 1638793538.789232], "version": 0.2, "tvm_version": "0.8.dev0"}
{"input": ["cuda -keys=cuda,gpu -max_num_threads=1024 -thread_warp_size=32", "dense_large_batch.gpu", [["TENSOR", [128, 4032], "float32"], ["TENSOR", [4032, 1000], "float32"]], {}], "config": {"index": 4099285, "code_hash": null, "entity": [["tile_x", "sp", [-1, 1, 1, 8]], ["tile_y", "sp", [-1, 1, 1, 4]], ["tile_k", "sp", [-1, 12, 3]]]}, "result": [[0.056326275], 0, 2.0704634189605713, 1638793539.9978125], "version": 0.2, "tvm_version": "0.8.dev0"}
{"input": ["cuda -keys=cuda,gpu -max_num_threads=1024 -thread_warp_size=32", "dense_large_batch.gpu", [["TENSOR", [128, 4032], "float32"], ["TENSOR", [4032, 1000], "float32"]], {}], "config": {"index": 2518885, "code_hash": null, "entity": [["tile_x", "sp", [-1, 1, 1, 8]], ["tile_y", "sp", [-1, 1, 1, 5]], ["tile_k", "sp", [-1, 16, 2]]]}, "result": [[0.058383000000000004], 0, 2.5670933723449707, 1638793541.5406864], "version": 0.2, "tvm_version": "0.8.dev0"}
{"input": ["cuda -keys=cuda,gpu -max_num_threads=1024 -thread_warp_size=32", "dense_large_batch.gpu", [["TENSOR", [128, 4032], "float32"], ["TENSOR", [4032, 1000], "float32"]], {}], "config": {"index": 691420, "code_hash": null, "entity": [["tile_x", "sp", [-1, 1, 1, 16]], ["tile_y", "sp", [-1, 2, 1, 4]], ["tile_k", "sp", [-1, 28, 1]]]}, "result": [[0.042141649999999996], 0, 3.9922378063201904, 1638793543.7916253], "version": 0.2, "tvm_version": "0.8.dev0"}
{"input": ["cuda -keys=cuda,gpu -max_num_threads=1024 -thread_warp_size=32", "dense_large_batch.gpu", [["TENSOR", [128, 4032], "float32"], ["TENSOR", [4032, 1000], "float32"]], {}], "config": {"index": 691300, "code_hash": null, "entity": [["tile_x", "sp", [-1, 1, 1, 16]], ["tile_y", "sp", [-1, 1, 1, 4]], ["tile_k", "sp", [-1, 28, 1]]]}, "result": [[0.048582825], 0, 2.865941286087036, 1638793545.4046252], "version": 0.2, "tvm_version": "0.8.dev0"}
{"input": ["cuda -keys=cuda,gpu -max_num_threads=1024 -thread_warp_size=32", "dense_large_batch.gpu", [["TENSOR", [128, 4032], "float32"], ["TENSOR", [4032, 1000], "float32"]], {}], "config": {"index": 2323286, "code_hash": null, "entity": [["tile_x", "sp", [-1, 2, 1, 8]], ["tile_y", "sp", [-1, 1, 1, 4]], ["tile_k", "sp", [-1, 8, 2]]]}, "result": [[0.04496555], 0, 2.013705253601074, 1638793546.7431042], "version": 0.2, "tvm_version": "0.8.dev0"}
{"input": ["cuda -keys=cuda,gpu -max_num_threads=1024 -thread_warp_size=32", "dense_large_batch.gpu", [["TENSOR", [128, 4032], "float32"], ["TENSOR", [4032, 1000], "float32"]], {}], "config": {"index": 5299300, "code_hash": null, "entity": [["tile_x", "sp", [-1, 1, 1, 16]], ["tile_y", "sp", [-1, 1, 1, 4]], ["tile_k", "sp", [-1, 6, 4]]]}, "result": [[0.04876155], 0, 1.9718620777130127, 1638793547.8182898], "version": 0.2, "tvm_version": "0.8.dev0"}
{"input": ["cuda -keys=cuda,gpu -max_num_threads=1024 -thread_warp_size=32", "dense_large_batch.gpu", [["TENSOR", [128, 4032], "float32"], ["TENSOR", [4032, 1000], "float32"]], {}], "config": {"index": 2431285, "code_hash": null, "entity": [["tile_x", "sp", [-1, 1, 1, 8]], ["tile_y", "sp", [-1, 1, 1, 10]], ["tile_k", "sp", [-1, 12, 2]]]}, "result": [[0.056766374999999994], 0, 2.6737091541290283, 1638793549.4959853], "version": 0.2, "tvm_version": "0.8.dev0"}
{"input": ["cuda -keys=cuda,gpu -max_num_threads=1024 -thread_warp_size=32", "dense_large_batch.gpu", [["TENSOR", [128, 4032], "float32"], ["TENSOR", [4032, 1000], "float32"]], {}], "config": {"index": 307420, "code_hash": null, "entity": [["tile_x", "sp", [-1, 1, 1, 16]], ["tile_y", "sp", [-1, 2, 1, 4]], ["tile_k", "sp", [-1, 8, 1]]]}, "result": [[0.034137875], 0, 1.7645015716552734, 1638793550.6959393], "version": 0.2, "tvm_version": "0.8.dev0"}
{"input": ["cuda -keys=cuda,gpu -max_num_threads=1024 -thread_warp_size=32", "dense_large_batch.gpu", [["TENSOR", [128, 4032], "float32"], ["TENSOR", [4032, 1000], "float32"]], {}], "config": {"index": 451300, "code_hash": null, "entity": [["tile_x", "sp", [-1, 1, 1, 16]], ["tile_y", "sp", [-1, 1, 1, 4]], ["tile_k", "sp", [-1, 14, 1]]]}, "result": [[0.078689725], 0, 2.4322423934936523, 1638793552.5189285], "version": 0.2, "tvm_version": "0.8.dev0"}
{"input": ["cuda -keys=cuda,gpu -max_num_threads=1024 -thread_warp_size=32", "dense_large_batch.gpu", [["TENSOR", [128, 4032], "float32"], ["TENSOR", [4032, 1000], "float32"]], {}], "config": {"index": 414100, "code_hash": null, "entity": [["tile_x", "sp", [-1, 1, 1, 16]], ["tile_y", "sp", [-1, 1, 1, 8]], ["tile_k", "sp", [-1, 12, 1]]]}, "result": [[0.03440945], 0, 2.1183078289031982, 1638793553.8954084], "version": 0.2, "tvm_version": "0.8.dev0"}
{"input": ["cuda -keys=cuda,gpu -max_num_threads=1024 -thread_warp_size=32", "dense_large_batch.gpu", [["TENSOR", [128, 4032], "float32"], ["TENSOR", [4032, 1000], "float32"]], {}], "config": {"index": 355300, "code_hash": null, "entity": [["tile_x", "sp", [-1, 1, 1, 16]], ["tile_y", "sp", [-1, 1, 1, 4]], ["tile_k", "sp", [-1, 9, 1]]]}, "result": [[0.063637075], 0, 1.9376442432403564, 1638793555.3844848], "version": 0.2, "tvm_version": "0.8.dev0"}
{"input": ["cuda -keys=cuda,gpu -max_num_threads=1024 -thread_warp_size=32", "dense_large_batch.gpu", [["TENSOR", [128, 4032], "float32"], ["TENSOR", [4032, 1000], "float32"]], {}], "config": {"index": 318100, "code_hash": null, "entity": [["tile_x", "sp", [-1, 1, 1, 16]], ["tile_y", "sp", [-1, 1, 1, 8]], ["tile_k", "sp", [-1, 8, 1]]]}, "result": [[0.0448119], 0, 1.9792263507843018, 1638793628.4101896], "version": 0.2, "tvm_version": "0.8.dev0"}
{"input": ["cuda -keys=cuda,gpu -max_num_threads=1024 -thread_warp_size=32", "dense_large_batch.gpu", [["TENSOR", [128, 4032], "float32"], ["TENSOR", [4032, 1000], "float32"]], {}], "config": {"index": 2190100, "code_hash": null, "entity": [["tile_x", "sp", [-1, 1, 1, 16]], ["tile_y", "sp", [-1, 1, 1, 8]], ["tile_k", "sp", [-1, 4, 2]]]}, "result": [[0.035283724999999995], 0, 1.9009063243865967, 1638793629.644889], "version": 0.2, "tvm_version": "0.8.dev0"}
{"input": ["cuda -keys=cuda,gpu -max_num_threads=1024 -thread_warp_size=32", "dense_large_batch.gpu", [["TENSOR", [128, 4032], "float32"], ["TENSOR", [4032, 1000], "float32"]], {}], "config": {"index": 2179420, "code_hash": null, "entity": [["tile_x", "sp", [-1, 1, 1, 16]], ["tile_y", "sp", [-1, 2, 1, 4]], ["tile_k", "sp", [-1, 4, 2]]]}, "result": [[0.034445275000000004], 0, 1.8476061820983887, 1638793630.9285998], "version": 0.2, "tvm_version": "0.8.dev0"}
{"input": ["cuda -keys=cuda,gpu -max_num_threads=1024 -thread_warp_size=32", "dense_large_batch.gpu", [["TENSOR", [128, 4032], "float32"], ["TENSOR", [4032, 1000], "float32"]], {}], "config": {"index": 2238086, "code_hash": null, "entity": [["tile_x", "sp", [-1, 2, 1, 8]], ["tile_y", "sp", [-1, 1, 1, 8]], ["tile_k", "sp", [-1, 6, 2]]]}, "result": [[0.03462435], 0, 2.3009088039398193, 1638793632.3702815], "version": 0.2, "tvm_version": "0.8.dev0"}
{"input": ["cuda -keys=cuda,gpu -max_num_threads=1024 -thread_warp_size=32", "dense_large_batch.gpu", [["TENSOR", [128, 4032], "float32"], ["TENSOR", [4032, 1000], "float32"]], {}], "config": {"index": 403420, "code_hash": null, "entity": [["tile_x", "sp", [-1, 1, 1, 16]], ["tile_y", "sp", [-1, 2, 1, 4]], ["tile_k", "sp", [-1, 12, 1]]]}, "result": [[0.034495649999999996], 0, 2.3108482360839844, 1638793633.7675219], "version": 0.2, "tvm_version": "0.8.dev0"}
{"input": ["cuda -keys=cuda,gpu -max_num_threads=1024 -thread_warp_size=32", "dense_large_batch.gpu", [["TENSOR", [128, 4032], "float32"], ["TENSOR", [4032, 1000], "float32"]], {}], "config": {"index": 2238085, "code_hash": null, "entity": [["tile_x", "sp", [-1, 1, 1, 8]], ["tile_y", "sp", [-1, 1, 1, 8]], ["tile_k", "sp", [-1, 6, 2]]]}, "result": [[0.0382233], 0, 2.3331871032714844, 1638793635.595192], "version": 0.2, "tvm_version": "0.8.dev0"}
{"input": ["cuda -keys=cuda,gpu -max_num_threads=1024 -thread_warp_size=32", "dense_large_batch.gpu", [["TENSOR", [128, 4032], "float32"], ["TENSOR", [4032, 1000], "float32"]], {}], "config": {"index": 499420, "code_hash": null, "entity": [["tile_x", "sp", [-1, 1, 1, 16]], ["tile_y", "sp", [-1, 2, 1, 4]], ["tile_k", "sp", [-1, 16, 1]]]}, "result": [[0.037982550000000004], 0, 3.3865537643432617, 1638793638.18916], "version": 0.2, "tvm_version": "0.8.dev0"}
{"input": ["cuda -keys=cuda,gpu -max_num_threads=1024 -thread_warp_size=32", "dense_large_batch.gpu", [["TENSOR", [128, 4032], "float32"], ["TENSOR", [4032, 1000], "float32"]], {}], "config": {"index": 318086, "code_hash": null, "entity": [["tile_x", "sp", [-1, 2, 1, 8]], ["tile_y", "sp", [-1, 1, 1, 8]], ["tile_k", "sp", [-1, 8, 1]]]}, "result": [[0.034128425], 0, 2.3768649101257324, 1638793640.380929], "version": 0.2, "tvm_version": "0.8.dev0"}
{"input": ["cuda -keys=cuda,gpu -max_num_threads=1024 -thread_warp_size=32", "dense_large_batch.gpu", [["TENSOR", [128, 4032], "float32"], ["TENSOR", [4032, 1000], "float32"]], {}], "config": {"index": 3918085, "code_hash": null, "entity": [["tile_x", "sp", [-1, 1, 1, 8]], ["tile_y", "sp", [-1, 1, 1, 8]], ["tile_k", "sp", [-1, 4, 3]]]}, "result": [[0.038218550000000004], 0, 1.9597256183624268, 1638793642.105214], "version": 0.2, "tvm_version": "0.8.dev0"}
{"input": ["cuda -keys=cuda,gpu -max_num_threads=1024 -thread_warp_size=32", "dense_large_batch.gpu", [["TENSOR", [128, 4032], "float32"], ["TENSOR", [4032, 1000], "float32"]], {}], "config": {"index": 318085, "code_hash": null, "entity": [["tile_x", "sp", [-1, 1, 1, 8]], ["tile_y", "sp", [-1, 1, 1, 8]], ["tile_k", "sp", [-1, 8, 1]]]}, "result": [[0.036127725], 0, 2.027428150177002, 1638793643.629649], "version": 0.2, "tvm_version": "0.8.dev0"}
{"input": ["cuda -keys=cuda,gpu -max_num_threads=1024 -thread_warp_size=32", "dense_large_batch.gpu", [["TENSOR", [128, 4032], "float32"], ["TENSOR", [4032, 1000], "float32"]], {}], "config": {"index": 5214085, "code_hash": null, "entity": [["tile_x", "sp", [-1, 1, 1, 8]], ["tile_y", "sp", [-1, 1, 1, 8]], ["tile_k", "sp", [-1, 3, 4]]]}, "result": [[0.038286125], 0, 1.8410346508026123, 1638793645.3700545], "version": 0.2, "tvm_version": "0.8.dev0"}
{"input": ["cuda -keys=cuda,gpu -max_num_threads=1024 -thread_warp_size=32", "dense_large_batch.gpu", [["TENSOR", [128, 4032], "float32"], ["TENSOR", [4032, 1000], "float32"]], {}], "config": {"index": 5214086, "code_hash": null, "entity": [["tile_x", "sp", [-1, 2, 1, 8]], ["tile_y", "sp", [-1, 1, 1, 8]], ["tile_k", "sp", [-1, 3, 4]]]}, "result": [[0.18566485], 0, 4.327632904052734, 1638793648.9068918], "version": 0.2, "tvm_version": "0.8.dev0"}
{"input": ["cuda -keys=cuda,gpu -max_num_threads=1024 -thread_warp_size=32", "dense_large_batch.gpu", [["TENSOR", [128, 4032], "float32"], ["TENSOR", [4032, 1000], "float32"]], {}], "config": {"index": 510086, "code_hash": null, "entity": [["tile_x", "sp", [-1, 2, 1, 8]], ["tile_y", "sp", [-1, 1, 1, 8]], ["tile_k", "sp", [-1, 16, 1]]]}, "result": [[0.037924725], 0, 3.1869688034057617, 1638793651.3594356], "version": 0.2, "tvm_version": "0.8.dev0"}
{"input": ["cuda -keys=cuda,gpu -max_num_threads=1024 -thread_warp_size=32", "dense_large_batch.gpu", [["TENSOR", [128, 4032], "float32"], ["TENSOR", [4032, 1000], "float32"]], {}], "config": {"index": 510085, "code_hash": null, "entity": [["tile_x", "sp", [-1, 1, 1, 8]], ["tile_y", "sp", [-1, 1, 1, 8]], ["tile_k", "sp", [-1, 16, 1]]]}, "result": [[0.038370800000000004], 0, 2.4772984981536865, 1638793653.4842746], "version": 0.2, "tvm_version": "0.8.dev0"}
{"input": ["cuda -keys=cuda,gpu -max_num_threads=1024 -thread_warp_size=32", "dense_large_batch.gpu", [["TENSOR", [128, 4032], "float32"], ["TENSOR", [4032, 1000], "float32"]], {}], "config": {"index": 510100, "code_hash": null, "entity": [["tile_x", "sp", [-1, 1, 1, 16]], ["tile_y", "sp", [-1, 1, 1, 8]], ["tile_k", "sp", [-1, 16, 1]]]}, "result": [[0.03814425], 0, 3.2655038833618164, 1638793655.8736727], "version": 0.2, "tvm_version": "0.8.dev0"}
{"input": ["cuda -keys=cuda,gpu -max_num_threads=1024 -thread_warp_size=32", "dense_large_batch.gpu", [["TENSOR", [128, 4032], "float32"], ["TENSOR", [4032, 1000], "float32"]], {}], "config": {"index": 2419406, "code_hash": null, "entity": [["tile_x", "sp", [-1, 2, 1, 8]], ["tile_y", "sp", [-1, 2, 1, 4]], ["tile_k", "sp", [-1, 12, 2]]]}, "result": [[0.037717725], 0, 3.9282901287078857, 1638793658.26099], "version": 0.2, "tvm_version": "0.8.dev0"}
{"input": ["cuda -keys=cuda,gpu -max_num_threads=1024 -thread_warp_size=32", "dense_large_batch.gpu", [["TENSOR", [128, 4032], "float32"], ["TENSOR", [4032, 1000], "float32"]], {}], "config": {"index": 4062085, "code_hash": null, "entity": [["tile_x", "sp", [-1, 1, 1, 8]], ["tile_y", "sp", [-1, 1, 1, 8]], ["tile_k", "sp", [-1, 8, 3]]]}, "result": [[0.040807724999999996], 0, 2.56302809715271, 1638793660.0116806], "version": 0.2, "tvm_version": "0.8.dev0"}
{"input": ["cuda -keys=cuda,gpu -max_num_threads=1024 -thread_warp_size=32", "dense_large_batch.gpu", [["TENSOR", [128, 4032], "float32"], ["TENSOR", [4032, 1000], "float32"]], {}], "config": {"index": 2190085, "code_hash": null, "entity": [["tile_x", "sp", [-1, 1, 1, 8]], ["tile_y", "sp", [-1, 1, 1, 8]], ["tile_k", "sp", [-1, 4, 2]]]}, "result": [[0.0464062], 0, 1.8295722007751465, 1638793664.8501127], "version": 0.2, "tvm_version": "0.8.dev0"}
{"input": ["cuda -keys=cuda,gpu -max_num_threads=1024 -thread_warp_size=32", "dense_large_batch.gpu", [["TENSOR", [128, 4032], "float32"], ["TENSOR", [4032, 1000], "float32"]], {}], "config": {"index": 2190086, "code_hash": null, "entity": [["tile_x", "sp", [-1, 2, 1, 8]], ["tile_y", "sp", [-1, 1, 1, 8]], ["tile_k", "sp", [-1, 4, 2]]]}, "result": [[0.034464100000000004], 0, 2.349587917327881, 1638793667.0292056], "version": 0.2, "tvm_version": "0.8.dev0"}
{"input": ["cuda -keys=cuda,gpu -max_num_threads=1024 -thread_warp_size=32", "dense_large_batch.gpu", [["TENSOR", [128, 4032], "float32"], ["TENSOR", [4032, 1000], "float32"]], {}], "config": {"index": 2179300, "code_hash": null, "entity": [["tile_x", "sp", [-1, 1, 1, 16]], ["tile_y", "sp", [-1, 1, 1, 4]], ["tile_k", "sp", [-1, 4, 2]]]}, "result": [[0.04267219999999999], 0, 2.126535177230835, 1638793668.9088826], "version": 0.2, "tvm_version": "0.8.dev0"}
{"input": ["cuda -keys=cuda,gpu -max_num_threads=1024 -thread_warp_size=32", "dense_large_batch.gpu", [["TENSOR", [128, 4032], "float32"], ["TENSOR", [4032, 1000], "float32"]], {}], "config": {"index": 2094100, "code_hash": null, "entity": [["tile_x", "sp", [-1, 1, 1, 16]], ["tile_y", "sp", [-1, 1, 1, 8]], ["tile_k", "sp", [-1, 2, 2]]]}, "result": [[0.031853575], 0, 1.9721040725708008, 1638793670.7245042], "version": 0.2, "tvm_version": "0.8.dev0"}
{"input": ["cuda -keys=cuda,gpu -max_num_threads=1024 -thread_warp_size=32", "dense_large_batch.gpu", [["TENSOR", [128, 4032], "float32"], ["TENSOR", [4032, 1000], "float32"]], {}], "config": {"index": 5262085, "code_hash": null, "entity": [["tile_x", "sp", [-1, 1, 1, 8]], ["tile_y", "sp", [-1, 1, 1, 8]], ["tile_k", "sp", [-1, 4, 4]]]}, "result": [[0.038301675], 0, 2.474428653717041, 1638793672.6313632], "version": 0.2, "tvm_version": "0.8.dev0"}
{"input": ["cuda -keys=cuda,gpu -max_num_threads=1024 -thread_warp_size=32", "dense_large_batch.gpu", [["TENSOR", [128, 4032], "float32"], ["TENSOR", [4032, 1000], "float32"]], {}], "config": {"index": 2172340, "code_hash": null, "entity": [["tile_x", "sp", [-1, 1, 1, 16]], ["tile_y", "sp", [-1, 4, 1, 2]], ["tile_k", "sp", [-1, 4, 2]]]}, "result": [[0.03424455], 0, 2.2643449306488037, 1638793674.3461742], "version": 0.2, "tvm_version": "0.8.dev0"}
{"input": ["cuda -keys=cuda,gpu -max_num_threads=1024 -thread_warp_size=32", "dense_large_batch.gpu", [["TENSOR", [128, 4032], "float32"], ["TENSOR", [4032, 1000], "float32"]], {}], "config": {"index": 2419286, "code_hash": null, "entity": [["tile_x", "sp", [-1, 2, 1, 8]], ["tile_y", "sp", [-1, 1, 1, 4]], ["tile_k", "sp", [-1, 12, 2]]]}, "result": [[0.048755450000000006], 0, 3.047194242477417, 1638793676.549542], "version": 0.2, "tvm_version": "0.8.dev0"}
{"input": ["cuda -keys=cuda,gpu -max_num_threads=1024 -thread_warp_size=32", "dense_large_batch.gpu", [["TENSOR", [128, 4032], "float32"], ["TENSOR", [4032, 1000], "float32"]], {}], "config": {"index": 2467406, "code_hash": null, "entity": [["tile_x", "sp", [-1, 2, 1, 8]], ["tile_y", "sp", [-1, 2, 1, 4]], ["tile_k", "sp", [-1, 14, 2]]]}, "result": [[0.041973075], 0, 4.306479215621948, 1638793679.1850476], "version": 0.2, "tvm_version": "0.8.dev0"}
{"input": ["cuda -keys=cuda,gpu -max_num_threads=1024 -thread_warp_size=32", "dense_large_batch.gpu", [["TENSOR", [128, 4032], "float32"], ["TENSOR", [4032, 1000], "float32"]], {}], "config": {"index": 2083420, "code_hash": null, "entity": [["tile_x", "sp", [-1, 1, 1, 16]], ["tile_y", "sp", [-1, 2, 1, 4]], ["tile_k", "sp", [-1, 2, 2]]]}, "result": [[0.032124274999999994], 0, 1.8427557945251465, 1638793680.6077394], "version": 0.2, "tvm_version": "0.8.dev0"}
