artifacts/microbenchmark/tvm/scale_out/conv_scale/conv2d_256_1024_14_14_2048_1_1_2_VALID.log
{"input": ["cuda -keys=cuda,gpu -max_num_threads=1024 -thread_warp_size=32", "conv2d_nchw.cuda", [["TENSOR", [256, 1024, 14, 14], "float32"], ["TENSOR", [2048, 1024, 1, 1], "float32"], 2, "VALID", 1, "float32"], {}], "config": {"index": 295791, "code_hash": null, "entity": [["tile_f", "sp", [-1, 1, 8, 8]], ["tile_y", "sp", [-1, 1, 1, 1]], ["tile_x", "sp", [-1, 1, 1, 7]], ["tile_rc", "sp", [-1, 64]], ["tile_ry", "sp", [-1, 1]], ["tile_rx", "sp", [-1, 1]], ["auto_unroll_max_step", "ot", 512], ["unroll_explicit", "ot", 1]]}, "result": [[0.08848000125], 0, 3.8715343475341797, 1638966493.62494], "version": 0.2, "tvm_version": "0.8.dev0"}
{"input": ["cuda -keys=cuda,gpu -max_num_threads=1024 -thread_warp_size=32", "conv2d_nchw.cuda", [["TENSOR", [256, 1024, 14, 14], "float32"], ["TENSOR", [2048, 1024, 1, 1], "float32"], 2, "VALID", 1, "float32"], {}], "config": {"index": 211250, "code_hash": null, "entity": [["tile_f", "sp", [-1, 2, 64, 2]], ["tile_y", "sp", [-1, 1, 1, 1]], ["tile_x", "sp", [-1, 7, 1, 1]], ["tile_rc", "sp", [-1, 8]], ["tile_ry", "sp", [-1, 1]], ["tile_rx", "sp", [-1, 1]], ["auto_unroll_max_step", "ot", 0], ["unroll_explicit", "ot", 1]]}, "result": [[0.056372384750000004], 0, 2.035860061645508, 1638966496.238124], "version": 0.2, "tvm_version": "0.8.dev0"}
{"input": ["cuda -keys=cuda,gpu -max_num_threads=1024 -thread_warp_size=32", "conv2d_nchw.cuda", [["TENSOR", [256, 1024, 14, 14], "float32"], ["TENSOR", [2048, 1024, 1, 1], "float32"], 2, "VALID", 1, "float32"], {}], "config": {"index": 218420, "code_hash": null, "entity": [["tile_f", "sp", [-1, 256, 2, 1]], ["tile_y", "sp", [-1, 1, 1, 1]], ["tile_x", "sp", [-1, 1, 7, 1]], ["tile_rc", "sp", [-1, 16]], ["tile_ry", "sp", [-1, 1]], ["tile_rx", "sp", [-1, 1]], ["auto_unroll_max_step", "ot", 0], ["unroll_explicit", "ot", 1]]}, "result": [[0.62336790325], 0, 5.448864221572876, 1638966502.1350586], "version": 0.2, "tvm_version": "0.8.dev0"}
{"input": ["cuda -keys=cuda,gpu -max_num_threads=1024 -thread_warp_size=32", "conv2d_nchw.cuda", [["TENSOR", [256, 1024, 14, 14], "float32"], ["TENSOR", [2048, 1024, 1, 1], "float32"], 2, "VALID", 1, "float32"], {}], "config": {"index": 197028, "code_hash": null, "entity": [["tile_f", "sp", [-1, 32, 4, 2]], ["tile_y", "sp", [-1, 7, 1, 1]], ["tile_x", "sp", [-1, 1, 1, 7]], ["tile_rc", "sp", [-1, 1]], ["tile_ry", "sp", [-1, 1]], ["tile_rx", "sp", [-1, 1]], ["auto_unroll_max_step", "ot", 0], ["unroll_explicit", "ot", 1]]}, "result": [[4.30538801025], 0, 24.295375108718872, 1638966526.3403394], "version": 0.2, "tvm_version": "0.8.dev0"}
{"input": ["cuda -keys=cuda,gpu -max_num_threads=1024 -thread_warp_size=32", "conv2d_nchw.cuda", [["TENSOR", [256, 1024, 14, 14], "float32"], ["TENSOR", [2048, 1024, 1, 1], "float32"], 2, "VALID", 1, "float32"], {}], "config": {"index": 212825, "code_hash": null, "entity": [["tile_f", "sp", [-1, 32, 1, 16]], ["tile_y", "sp", [-1, 1, 1, 1]], ["tile_x", "sp", [-1, 1, 7, 1]], ["tile_rc", "sp", [-1, 8]], ["tile_ry", "sp", [-1, 1]], ["tile_rx", "sp", [-1, 1]], ["auto_unroll_max_step", "ot", 0], ["unroll_explicit", "ot", 1]]}, "result": [[1.5357636175], 0, 10.085782527923584, 1638966536.7219975], "version": 0.2, "tvm_version": "0.8.dev0"}
{"input": ["cuda -keys=cuda,gpu -max_num_threads=1024 -thread_warp_size=32", "conv2d_nchw.cuda", [["TENSOR", [256, 1024, 14, 14], "float32"], ["TENSOR", [2048, 1024, 1, 1], "float32"], 2, "VALID", 1, "float32"], {}], "config": {"index": 4298, "code_hash": null, "entity": [["tile_f", "sp", [-1, 2, 4, 32]], ["tile_y", "sp", [-1, 1, 1, 7]], ["tile_x", "sp", [-1, 1, 7, 1]], ["tile_rc", "sp", [-1, 1]], ["tile_ry", "sp", [-1, 1]], ["tile_rx", "sp", [-1, 1]], ["auto_unroll_max_step", "ot", 0], ["unroll_explicit", "ot", 0]]}, "result": [[0.6075743579999999], 0, 4.944681406021118, 1638966543.7036304], "version": 0.2, "tvm_version": "0.8.dev0"}
{"input": ["cuda -keys=cuda,gpu -max_num_threads=1024 -thread_warp_size=32", "conv2d_nchw.cuda", [["TENSOR", [256, 1024, 14, 14], "float32"], ["TENSOR", [2048, 1024, 1, 1], "float32"], 2, "VALID", 1, "float32"], {}], "config": {"index": 205018, "code_hash": null, "entity": [["tile_f", "sp", [-1, 256, 1, 2]], ["tile_y", "sp", [-1, 1, 1, 7]], ["tile_x", "sp", [-1, 1, 1, 1]], ["tile_rc", "sp", [-1, 4]], ["tile_ry", "sp", [-1, 1]], ["tile_rx", "sp", [-1, 1]], ["auto_unroll_max_step", "ot", 0], ["unroll_explicit", "ot", 1]]}, "result": [[14.09723635275], 0, 72.86456990242004, 1638966617.654143], "version": 0.2, "tvm_version": "0.8.dev0"}
{"input": ["cuda -keys=cuda,gpu -max_num_threads=1024 -thread_warp_size=32", "conv2d_nchw.cuda", [["TENSOR", [256, 1024, 14, 14], "float32"], ["TENSOR", [2048, 1024, 1, 1], "float32"], 2, "VALID", 1, "float32"], {}], "config": {"index": 86389, "code_hash": null, "entity": [["tile_f", "sp", [-1, 32, 16, 2]], ["tile_y", "sp", [-1, 7, 1, 1]], ["tile_x", "sp", [-1, 1, 1, 7]], ["tile_rc", "sp", [-1, 8]], ["tile_ry", "sp", [-1, 1]], ["tile_rx", "sp", [-1, 1]], ["auto_unroll_max_step", "ot", 512], ["unroll_explicit", "ot", 0]]}, "result": [[1.2009256855000001], 0, 9.968621969223022, 1638966627.139285], "version": 0.2, "tvm_version": "0.8.dev0"}
{"input": ["cuda -keys=cuda,gpu -max_num_threads=1024 -thread_warp_size=32", "conv2d_nchw.cuda", [["TENSOR", [256, 1024, 14, 14], "float32"], ["TENSOR", [2048, 1024, 1, 1], "float32"], 2, "VALID", 1, "float32"], {}], "config": {"index": 69652, "code_hash": null, "entity": [["tile_f", "sp", [-1, 32, 32, 2]], ["tile_y", "sp", [-1, 1, 1, 7]], ["tile_x", "sp", [-1, 1, 1, 7]], ["tile_rc", "sp", [-1, 1]], ["tile_ry", "sp", [-1, 1]], ["tile_rx", "sp", [-1, 1]], ["auto_unroll_max_step", "ot", 512], ["unroll_explicit", "ot", 0]]}, "result": [[0.33871348725], 0, 4.524221897125244, 1638966641.897272], "version": 0.2, "tvm_version": "0.8.dev0"}
{"input": ["cuda -keys=cuda,gpu -max_num_threads=1024 -thread_warp_size=32", "conv2d_nchw.cuda", [["TENSOR", [256, 1024, 14, 14], "float32"], ["TENSOR", [2048, 1024, 1, 1], "float32"], 2, "VALID", 1, "float32"], {}], "config": {"index": 78686, "code_hash": null, "entity": [["tile_f", "sp", [-1, 32, 64, 1]], ["tile_y", "sp", [-1, 1, 1, 1]], ["tile_x", "sp", [-1, 1, 7, 1]], ["tile_rc", "sp", [-1, 4]], ["tile_ry", "sp", [-1, 1]], ["tile_rx", "sp", [-1, 1]], ["auto_unroll_max_step", "ot", 512], ["unroll_explicit", "ot", 0]]}, "result": [[0.04371479175], 0, 1.9977891445159912, 1638966645.1725283], "version": 0.2, "tvm_version": "0.8.dev0"}
{"input": ["cuda -keys=cuda,gpu -max_num_threads=1024 -thread_warp_size=32", "conv2d_nchw.cuda", [["TENSOR", [256, 1024, 14, 14], "float32"], ["TENSOR", [2048, 1024, 1, 1], "float32"], 2, "VALID", 1, "float32"], {}], "config": {"index": 96840, "code_hash": null, "entity": [["tile_f", "sp", [-1, 16, 2, 1]], ["tile_y", "sp", [-1, 1, 7, 1]], ["tile_x", "sp", [-1, 1, 7, 1]], ["tile_rc", "sp", [-1, 32]], ["tile_ry", "sp", [-1, 1]], ["tile_rx", "sp", [-1, 1]], ["auto_unroll_max_step", "ot", 512], ["unroll_explicit", "ot", 0]]}, "result": [[0.025640273749999998], 0, 2.560134172439575, 1638966647.2434056], "version": 0.2, "tvm_version": "0.8.dev0"}
{"input": ["cuda -keys=cuda,gpu -max_num_threads=1024 -thread_warp_size=32", "conv2d_nchw.cuda", [["TENSOR", [256, 1024, 14, 14], "float32"], ["TENSOR", [2048, 1024, 1, 1], "float32"], 2, "VALID", 1, "float32"], {}], "config": {"index": 228027, "code_hash": null, "entity": [["tile_f", "sp", [-1, 1, 4, 4]], ["tile_y", "sp", [-1, 1, 7, 1]], ["tile_x", "sp", [-1, 1, 1, 1]], ["tile_rc", "sp", [-1, 64]], ["tile_ry", "sp", [-1, 1]], ["tile_rx", "sp", [-1, 1]], ["auto_unroll_max_step", "ot", 0], ["unroll_explicit", "ot", 1]]}, "result": [[0.1192585575], 0, 2.41279935836792, 1638966650.2674952], "version": 0.2, "tvm_version": "0.8.dev0"}
{"input": ["cuda -keys=cuda,gpu -max_num_threads=1024 -thread_warp_size=32", "conv2d_nchw.cuda", [["TENSOR", [256, 1024, 14, 14], "float32"], ["TENSOR", [2048, 1024, 1, 1], "float32"], 2, "VALID", 1, "float32"], {}], "config": {"index": 203685, "code_hash": null, "entity": [["tile_f", "sp", [-1, 2, 2, 8]], ["tile_y", "sp", [-1, 1, 1, 7]], ["tile_x", "sp", [-1, 1, 1, 7]], ["tile_rc", "sp", [-1, 2]], ["tile_ry", "sp", [-1, 1]], ["tile_rx", "sp", [-1, 1]], ["auto_unroll_max_step", "ot", 0], ["unroll_explicit", "ot", 1]]}, "result": [[5.56777034675], 0, 30.136531829833984, 1638966679.9239562], "version": 0.2, "tvm_version": "0.8.dev0"}
{"input": ["cuda -keys=cuda,gpu -max_num_threads=1024 -thread_warp_size=32", "conv2d_nchw.cuda", [["TENSOR", [256, 1024, 14, 14], "float32"], ["TENSOR", [2048, 1024, 1, 1], "float32"], 2, "VALID", 1, "float32"], {}], "config": {"index": 219095, "code_hash": null, "entity": [["tile_f", "sp", [-1, 4, 1, 128]], ["tile_y", "sp", [-1, 7, 1, 1]], ["tile_x", "sp", [-1, 1, 7, 1]], ["tile_rc", "sp", [-1, 16]], ["tile_ry", "sp", [-1, 1]], ["tile_rx", "sp", [-1, 1]], ["auto_unroll_max_step", "ot", 0], ["unroll_explicit", "ot", 1]]}, "result": [[1.0901130975000002], 0, 7.443808555603027, 1638966688.7679672], "version": 0.2, "tvm_version": "0.8.dev0"}
{"input": ["cuda -keys=cuda,gpu -max_num_threads=1024 -thread_warp_size=32", "conv2d_nchw.cuda", [["TENSOR", [256, 1024, 14, 14], "float32"], ["TENSOR", [2048, 1024, 1, 1], "float32"], 2, "VALID", 1, "float32"], {}], "config": {"index": 129470, "code_hash": null, "entity": [["tile_f", "sp", [-1, 64, 1, 16]], ["tile_y", "sp", [-1, 1, 1, 7]], ["tile_x", "sp", [-1, 1, 1, 1]], ["tile_rc", "sp", [-1, 1]], ["tile_ry", "sp", [-1, 1]], ["tile_rx", "sp", [-1, 1]], ["auto_unroll_max_step", "ot", 1500], ["unroll_explicit", "ot", 0]]}, "result": [[17.44139599275], 0, 94.8608922958374, 1638966778.9932413], "version": 0.2, "tvm_version": "0.8.dev0"}
{"input": ["cuda -keys=cuda,gpu -max_num_threads=1024 -thread_warp_size=32", "conv2d_nchw.cuda", [["TENSOR", [256, 1024, 14, 14], "float32"], ["TENSOR", [2048, 1024, 1, 1], "float32"], 2, "VALID", 1, "float32"], {}], "config": {"index": 274, "code_hash": null, "entity": [["tile_f", "sp", [-1, 1, 32, 16]], ["tile_y", "sp", [-1, 1, 1, 1]], ["tile_x", "sp", [-1, 1, 1, 1]], ["tile_rc", "sp", [-1, 1]], ["tile_ry", "sp", [-1, 1]], ["tile_rx", "sp", [-1, 1]], ["auto_unroll_max_step", "ot", 0], ["unroll_explicit", "ot", 0]]}, "result": [[0.936199573], 0, 6.5024707317352295, 1638966785.336093], "version": 0.2, "tvm_version": "0.8.dev0"}
{"input": ["cuda -keys=cuda,gpu -max_num_threads=1024 -thread_warp_size=32", "conv2d_nchw.cuda", [["TENSOR", [256, 1024, 14, 14], "float32"], ["TENSOR", [2048, 1024, 1, 1], "float32"], 2, "VALID", 1, "float32"], {}], "config": {"index": 207527, "code_hash": null, "entity": [["tile_f", "sp", [-1, 32, 16, 1]], ["tile_y", "sp", [-1, 1, 7, 1]], ["tile_x", "sp", [-1, 1, 7, 1]], ["tile_rc", "sp", [-1, 4]], ["tile_ry", "sp", [-1, 1]], ["tile_rx", "sp", [-1, 1]], ["auto_unroll_max_step", "ot", 0], ["unroll_explicit", "ot", 1]]}, "result": [[0.015261908], 0, 2.0434374809265137, 1638966789.7790956], "version": 0.2, "tvm_version": "0.8.dev0"}
{"input": ["cuda -keys=cuda,gpu -max_num_threads=1024 -thread_warp_size=32", "conv2d_nchw.cuda", [["TENSOR", [256, 1024, 14, 14], "float32"], ["TENSOR", [2048, 1024, 1, 1], "float32"], 2, "VALID", 1, "float32"], {}], "config": {"index": 9023, "code_hash": null, "entity": [["tile_f", "sp", [-1, 1, 2, 32]], ["tile_y", "sp", [-1, 1, 1, 1]], ["tile_x", "sp", [-1, 1, 7, 1]], ["tile_rc", "sp", [-1, 2]], ["tile_ry", "sp", [-1, 1]], ["tile_rx", "sp", [-1, 1]], ["auto_unroll_max_step", "ot", 0], ["unroll_explicit", "ot", 0]]}, "result": [[0.062398013499999995], 0, 2.0680606365203857, 1638966798.0974746], "version": 0.2, "tvm_version": "0.8.dev0"}
{"input": ["cuda -keys=cuda,gpu -max_num_threads=1024 -thread_warp_size=32", "conv2d_nchw.cuda", [["TENSOR", [256, 1024, 14, 14], "float32"], ["TENSOR", [2048, 1024, 1, 1], "float32"], 2, "VALID", 1, "float32"], {}], "config": {"index": 102228, "code_hash": null, "entity": [["tile_f", "sp", [-1, 1, 1, 64]], ["tile_y", "sp", [-1, 1, 1, 1]], ["tile_x", "sp", [-1, 1, 7, 1]], ["tile_rc", "sp", [-1, 64]], ["tile_ry", "sp", [-1, 1]], ["tile_rx", "sp", [-1, 1]], ["auto_unroll_max_step", "ot", 512], ["unroll_explicit", "ot", 0]]}, "result": [[0.6606991520000001], 0, 5.97903037071228, 1638966805.5978544], "version": 0.2, "tvm_version": "0.8.dev0"}
{"input": ["cuda -keys=cuda,gpu -max_num_threads=1024 -thread_warp_size=32", "conv2d_nchw.cuda", [["TENSOR", [256, 1024, 14, 14], "float32"], ["TENSOR", [2048, 1024, 1, 1], "float32"], 2, "VALID", 1, "float32"], {}], "config": {"index": 328293, "code_hash": null, "entity": [["tile_f", "sp", [-1, 1, 1, 128]], ["tile_y", "sp", [-1, 7, 1, 1]], ["tile_x", "sp", [-1, 7, 1, 1]], ["tile_rc", "sp", [-1, 2]], ["tile_ry", "sp", [-1, 1]], ["tile_rx", "sp", [-1, 1]], ["auto_unroll_max_step", "ot", 1500], ["unroll_explicit", "ot", 1]]}, "result": [[15.111815727249999], 0, 78.86635732650757, 1638966882.9934638], "version": 0.2, "tvm_version": "0.8.dev0"}
{"input": ["cuda -keys=cuda,gpu -max_num_threads=1024 -thread_warp_size=32", "conv2d_nchw.cuda", [["TENSOR", [256, 1024, 14, 14], "float32"], ["TENSOR", [2048, 1024, 1, 1], "float32"], 2, "VALID", 1, "float32"], {}], "config": {"index": 280322, "code_hash": null, "entity": [["tile_f", "sp", [-1, 1, 16, 1]], ["tile_y", "sp", [-1, 1, 7, 1]], ["tile_x", "sp", [-1, 1, 1, 1]], ["tile_rc", "sp", [-1, 16]], ["tile_ry", "sp", [-1, 1]], ["tile_rx", "sp", [-1, 1]], ["auto_unroll_max_step", "ot", 512], ["unroll_explicit", "ot", 1]]}, "result": [[0.0583517185], 0, 2.10390043258667, 1638966884.934721], "version": 0.2, "tvm_version": "0.8.dev0"}
{"input": ["cuda -keys=cuda,gpu -max_num_threads=1024 -thread_warp_size=32", "conv2d_nchw.cuda", [["TENSOR", [256, 1024, 14, 14], "float32"], ["TENSOR", [2048, 1024, 1, 1], "float32"], 2, "VALID", 1, "float32"], {}], "config": {"index": 135501, "code_hash": null, "entity": [["tile_f", "sp", [-1, 16, 2, 2]], ["tile_y", "sp", [-1, 1, 1, 1]], ["tile_x", "sp", [-1, 7, 1, 1]], ["tile_rc", "sp", [-1, 2]], ["tile_ry", "sp", [-1, 1]], ["tile_rx", "sp", [-1, 1]], ["auto_unroll_max_step", "ot", 1500], ["unroll_explicit", "ot", 0]]}, "result": [[0.11237592675000001], 0, 2.83728289604187, 1638966887.3814356], "version": 0.2, "tvm_version": "0.8.dev0"}
{"input": ["cuda -keys=cuda,gpu -max_num_threads=1024 -thread_warp_size=32", "conv2d_nchw.cuda", [["TENSOR", [256, 1024, 14, 14], "float32"], ["TENSOR", [2048, 1024, 1, 1], "float32"], 2, "VALID", 1, "float32"], {}], "config": {"index": 146389, "code_hash": null, "entity": [["tile_f", "sp", [-1, 16, 64, 1]], ["tile_y", "sp", [-1, 1, 7, 1]], ["tile_x", "sp", [-1, 1, 1, 1]], ["tile_rc", "sp", [-1, 8]], ["tile_ry", "sp", [-1, 1]], ["tile_rx", "sp", [-1, 1]], ["auto_unroll_max_step", "ot", 1500], ["unroll_explicit", "ot", 0]]}, "result": [[0.05485505625], 0, 2.343937873840332, 1638966889.5013258], "version": 0.2, "tvm_version": "0.8.dev0"}
{"input": ["cuda -keys=cuda,gpu -max_num_threads=1024 -thread_warp_size=32", "conv2d_nchw.cuda", [["TENSOR", [256, 1024, 14, 14], "float32"], ["TENSOR", [2048, 1024, 1, 1], "float32"], 2, "VALID", 1, "float32"], {}], "config": {"index": 325510, "code_hash": null, "entity": [["tile_f", "sp", [-1, 32, 2, 2]], ["tile_y", "sp", [-1, 1, 7, 1]], ["tile_x", "sp", [-1, 1, 1, 7]], ["tile_rc", "sp", [-1, 1]], ["tile_ry", "sp", [-1, 1]], ["tile_rx", "sp", [-1, 1]], ["auto_unroll_max_step", "ot", 1500], ["unroll_explicit", "ot", 1]]}, "result": [[0.984905669], 0, 8.29148244857788, 1638966896.3010967], "version": 0.2, "tvm_version": "0.8.dev0"}
{"input": ["cuda -keys=cuda,gpu -max_num_threads=1024 -thread_warp_size=32", "conv2d_nchw.cuda", [["TENSOR", [256, 1024, 14, 14], "float32"], ["TENSOR", [2048, 1024, 1, 1], "float32"], 2, "VALID", 1, "float32"], {}], "config": {"index": 324442, "code_hash": null, "entity": [["tile_f", "sp", [-1, 4, 16, 2]], ["tile_y", "sp", [-1, 1, 1, 7]], ["tile_x", "sp", [-1, 1, 7, 1]], ["tile_rc", "sp", [-1, 1]], ["tile_ry", "sp", [-1, 1]], ["tile_rx", "sp", [-1, 1]], ["auto_unroll_max_step", "ot", 1500], ["unroll_explicit", "ot", 1]]}, "result": [[0.0102313601], 0, 1.9457035064697266, 1638966898.033703], "version": 0.2, "tvm_version": "0.8.dev0"}
{"input": ["cuda -keys=cuda,gpu -max_num_threads=1024 -thread_warp_size=32", "conv2d_nchw.cuda", [["TENSOR", [256, 1024, 14, 14], "float32"], ["TENSOR", [2048, 1024, 1, 1], "float32"], 2, "VALID", 1, "float32"], {}], "config": {"index": 271880, "code_hash": null, "entity": [["tile_f", "sp", [-1, 4, 2, 128]], ["tile_y", "sp", [-1, 1, 7, 1]], ["tile_x", "sp", [-1, 1, 7, 1]], ["tile_rc", "sp", [-1, 4]], ["tile_ry", "sp", [-1, 1]], ["tile_rx", "sp", [-1, 1]], ["auto_unroll_max_step", "ot", 512], ["unroll_explicit", "ot", 1]]}, "result": [[0.330832458], 0, 6.409592151641846, 1638966901.8793252], "version": 0.2, "tvm_version": "0.8.dev0"}
{"input": ["cuda -keys=cuda,gpu -max_num_threads=1024 -thread_warp_size=32", "conv2d_nchw.cuda", [["TENSOR", [256, 1024, 14, 14], "float32"], ["TENSOR", [2048, 1024, 1, 1], "float32"], 2, "VALID", 1, "float32"], {}], "config": {"index": 13564, "code_hash": null, "entity": [["tile_f", "sp", [-1, 128, 2, 2]], ["tile_y", "sp", [-1, 7, 1, 1]], ["tile_x", "sp", [-1, 7, 1, 1]], ["tile_rc", "sp", [-1, 4]], ["tile_ry", "sp", [-1, 1]], ["tile_rx", "sp", [-1, 1]], ["auto_unroll_max_step", "ot", 0], ["unroll_explicit", "ot", 0]]}, "result": [[7.1595644389999995], 0, 41.820679903030396, 1638966941.578152], "version": 0.2, "tvm_version": "0.8.dev0"}
{"input": ["cuda -keys=cuda,gpu -max_num_threads=1024 -thread_warp_size=32", "conv2d_nchw.cuda", [["TENSOR", [256, 1024, 14, 14], "float32"], ["TENSOR", [2048, 1024, 1, 1], "float32"], 2, "VALID", 1, "float32"], {}], "config": {"index": 24469, "code_hash": null, "entity": [["tile_f", "sp", [-1, 8, 1, 2]], ["tile_y", "sp", [-1, 1, 1, 7]], ["tile_x", "sp", [-1, 1, 1, 1]], ["tile_rc", "sp", [-1, 16]], ["tile_ry", "sp", [-1, 1]], ["tile_rx", "sp", [-1, 1]], ["auto_unroll_max_step", "ot", 0], ["unroll_explicit", "ot", 0]]}, "result": [[0.27985100075], 0, 3.9933114051818848, 1638966945.3167815], "version": 0.2, "tvm_version": "0.8.dev0"}
{"input": ["cuda -keys=cuda,gpu -max_num_threads=1024 -thread_warp_size=32", "conv2d_nchw.cuda", [["TENSOR", [256, 1024, 14, 14], "float32"], ["TENSOR", [2048, 1024, 1, 1], "float32"], 2, "VALID", 1, "float32"], {}], "config": {"index": 83195, "code_hash": null, "entity": [["tile_f", "sp", [-1, 16, 1, 8]], ["tile_y", "sp", [-1, 1, 1, 1]], ["tile_x", "sp", [-1, 7, 1, 1]], ["tile_rc", "sp", [-1, 8]], ["tile_ry", "sp", [-1, 1]], ["tile_rx", "sp", [-1, 1]], ["auto_unroll_max_step", "ot", 512], ["unroll_explicit", "ot", 0]]}, "result": [[14.9048163045], 0, 76.67436027526855, 1638967021.5265622], "version": 0.2, "tvm_version": "0.8.dev0"}
{"input": ["cuda -keys=cuda,gpu -max_num_threads=1024 -thread_warp_size=32", "conv2d_nchw.cuda", [["TENSOR", [256, 1024, 14, 14], "float32"], ["TENSOR", [2048, 1024, 1, 1], "float32"], 2, "VALID", 1, "float32"], {}], "config": {"index": 77990, "code_hash": null, "entity": [["tile_f", "sp", [-1, 32, 2, 2]], ["tile_y", "sp", [-1, 1, 7, 1]], ["tile_x", "sp", [-1, 7, 1, 1]], ["tile_rc", "sp", [-1, 4]], ["tile_ry", "sp", [-1, 1]], ["tile_rx", "sp", [-1, 1]], ["auto_unroll_max_step", "ot", 512], ["unroll_explicit", "ot", 0]]}, "result": [[0.61068287975], 0, 6.331854343414307, 1638967026.7283552], "version": 0.2, "tvm_version": "0.8.dev0"}
{"input": ["cuda -keys=cuda,gpu -max_num_threads=1024 -thread_warp_size=32", "conv2d_nchw.cuda", [["TENSOR", [256, 1024, 14, 14], "float32"], ["TENSOR", [2048, 1024, 1, 1], "float32"], 2, "VALID", 1, "float32"], {}], "config": {"index": 73696, "code_hash": null, "entity": [["tile_f", "sp", [-1, 32, 4, 4]], ["tile_y", "sp", [-1, 1, 7, 1]], ["tile_x", "sp", [-1, 1, 7, 1]], ["tile_rc", "sp", [-1, 2]], ["tile_ry", "sp", [-1, 1]], ["tile_rx", "sp", [-1, 1]], ["auto_unroll_max_step", "ot", 512], ["unroll_explicit", "ot", 0]]}, "result": [[0.015648162], 0, 2.2433884143829346, 1638967067.3721979], "version": 0.2, "tvm_version": "0.8.dev0"}
{"input": ["cuda -keys=cuda,gpu -max_num_threads=1024 -thread_warp_size=32", "conv2d_nchw.cuda", [["TENSOR", [256, 1024, 14, 14], "float32"], ["TENSOR", [2048, 1024, 1, 1], "float32"], 2, "VALID", 1, "float32"], {}], "config": {"index": 9632, "code_hash": null, "entity": [["tile_f", "sp", [-1, 32, 4, 4]], ["tile_y", "sp", [-1, 1, 7, 1]], ["tile_x", "sp", [-1, 1, 7, 1]], ["tile_rc", "sp", [-1, 2]], ["tile_ry", "sp", [-1, 1]], ["tile_rx", "sp", [-1, 1]], ["auto_unroll_max_step", "ot", 0], ["unroll_explicit", "ot", 0]]}, "result": [[0.017949354333333334], 0, 2.0668814182281494, 1638967069.1194367], "version": 0.2, "tvm_version": "0.8.dev0"}
{"input": ["cuda -keys=cuda,gpu -max_num_threads=1024 -thread_warp_size=32", "conv2d_nchw.cuda", [["TENSOR", [256, 1024, 14, 14], "float32"], ["TENSOR", [2048, 1024, 1, 1], "float32"], 2, "VALID", 1, "float32"], {}], "config": {"index": 265888, "code_hash": null, "entity": [["tile_f", "sp", [-1, 32, 4, 4]], ["tile_y", "sp", [-1, 1, 7, 1]], ["tile_x", "sp", [-1, 1, 7, 1]], ["tile_rc", "sp", [-1, 2]], ["tile_ry", "sp", [-1, 1]], ["tile_rx", "sp", [-1, 1]], ["auto_unroll_max_step", "ot", 512], ["unroll_explicit", "ot", 1]]}, "result": [[0.015969156285714287], 0, 2.423786163330078, 1638967070.9162898], "version": 0.2, "tvm_version": "0.8.dev0"}
{"input": ["cuda -keys=cuda,gpu -max_num_threads=1024 -thread_warp_size=32", "conv2d_nchw.cuda", [["TENSOR", [256, 1024, 14, 14], "float32"], ["TENSOR", [2048, 1024, 1, 1], "float32"], 2, "VALID", 1, "float32"], {}], "config": {"index": 201824, "code_hash": null, "entity": [["tile_f", "sp", [-1, 32, 4, 4]], ["tile_y", "sp", [-1, 1, 7, 1]], ["tile_x", "sp", [-1, 1, 7, 1]], ["tile_rc", "sp", [-1, 2]], ["tile_ry", "sp", [-1, 1]], ["tile_rx", "sp", [-1, 1]], ["auto_unroll_max_step", "ot", 0], ["unroll_explicit", "ot", 1]]}, "result": [[0.0179262385], 0, 2.0509769916534424, 1638967072.6316082], "version": 0.2, "tvm_version": "0.8.dev0"}
{"input": ["cuda -keys=cuda,gpu -max_num_threads=1024 -thread_warp_size=32", "conv2d_nchw.cuda", [["TENSOR", [256, 1024, 14, 14], "float32"], ["TENSOR", [2048, 1024, 1, 1], "float32"], 2, "VALID", 1, "float32"], {}], "config": {"index": 73575, "code_hash": null, "entity": [["tile_f", "sp", [-1, 32, 16, 1]], ["tile_y", "sp", [-1, 1, 7, 1]], ["tile_x", "sp", [-1, 1, 7, 1]], ["tile_rc", "sp", [-1, 2]], ["tile_ry", "sp", [-1, 1]], ["tile_rx", "sp", [-1, 1]], ["auto_unroll_max_step", "ot", 512], ["unroll_explicit", "ot", 0]]}, "result": [[0.016091723714285713], 0, 2.0872058868408203, 1638967074.4618516], "version": 0.2, "tvm_version": "0.8.dev0"}
{"input": ["cuda -keys=cuda,gpu -max_num_threads=1024 -thread_warp_size=32", "conv2d_nchw.cuda", [["TENSOR", [256, 1024, 14, 14], "float32"], ["TENSOR", [2048, 1024, 1, 1], "float32"], 2, "VALID", 1, "float32"], {}], "config": {"index": 265767, "code_hash": null, "entity": [["tile_f", "sp", [-1, 32, 16, 1]], ["tile_y", "sp", [-1, 1, 7, 1]], ["tile_x", "sp", [-1, 1, 7, 1]], ["tile_rc", "sp", [-1, 2]], ["tile_ry", "sp", [-1, 1]], ["tile_rx", "sp", [-1, 1]], ["auto_unroll_max_step", "ot", 512], ["unroll_explicit", "ot", 1]]}, "result": [[0.01596125657142857], 0, 1.984452247619629, 1638967076.1803565], "version": 0.2, "tvm_version": "0.8.dev0"}
{"input": ["cuda -keys=cuda,gpu -max_num_threads=1024 -thread_warp_size=32", "conv2d_nchw.cuda", [["TENSOR", [256, 1024, 14, 14], "float32"], ["TENSOR", [2048, 1024, 1, 1], "float32"], 2, "VALID", 1, "float32"], {}], "config": {"index": 9511, "code_hash": null, "entity": [["tile_f", "sp", [-1, 32, 16, 1]], ["tile_y", "sp", [-1, 1, 7, 1]], ["tile_x", "sp", [-1, 1, 7, 1]], ["tile_rc", "sp", [-1, 2]], ["tile_ry", "sp", [-1, 1]], ["tile_rx", "sp", [-1, 1]], ["auto_unroll_max_step", "ot", 0], ["unroll_explicit", "ot", 0]]}, "result": [[0.01607911], 0, 1.931504487991333, 1638967077.8773952], "version": 0.2, "tvm_version": "0.8.dev0"}
{"input": ["cuda -keys=cuda,gpu -max_num_threads=1024 -thread_warp_size=32", "conv2d_nchw.cuda", [["TENSOR", [256, 1024, 14, 14], "float32"], ["TENSOR", [2048, 1024, 1, 1], "float32"], 2, "VALID", 1, "float32"], {}], "config": {"index": 201703, "code_hash": null, "entity": [["tile_f", "sp", [-1, 32, 16, 1]], ["tile_y", "sp", [-1, 1, 7, 1]], ["tile_x", "sp", [-1, 1, 7, 1]], ["tile_rc", "sp", [-1, 2]], ["tile_ry", "sp", [-1, 1]], ["tile_rx", "sp", [-1, 1]], ["auto_unroll_max_step", "ot", 0], ["unroll_explicit", "ot", 1]]}, "result": [[0.016082652714285713], 0, 1.8991913795471191, 1638967079.5228496], "version": 0.2, "tvm_version": "0.8.dev0"}
{"input": ["cuda -keys=cuda,gpu -max_num_threads=1024 -thread_warp_size=32", "conv2d_nchw.cuda", [["TENSOR", [256, 1024, 14, 14], "float32"], ["TENSOR", [2048, 1024, 1, 1], "float32"], 2, "VALID", 1, "float32"], {}], "config": {"index": 201876, "code_hash": null, "entity": [["tile_f", "sp", [-1, 16, 4, 8]], ["tile_y", "sp", [-1, 1, 7, 1]], ["tile_x", "sp", [-1, 1, 7, 1]], ["tile_rc", "sp", [-1, 2]], ["tile_ry", "sp", [-1, 1]], ["tile_rx", "sp", [-1, 1]], ["auto_unroll_max_step", "ot", 0], ["unroll_explicit", "ot", 1]]}, "result": [[0.017895522833333333], 0, 2.204347848892212, 1638967081.4337065], "version": 0.2, "tvm_version": "0.8.dev0"}
{"input": ["cuda -keys=cuda,gpu -max_num_threads=1024 -thread_warp_size=32", "conv2d_nchw.cuda", [["TENSOR", [256, 1024, 14, 14], "float32"], ["TENSOR", [2048, 1024, 1, 1], "float32"], 2, "VALID", 1, "float32"], {}], "config": {"index": 265940, "code_hash": null, "entity": [["tile_f", "sp", [-1, 16, 4, 8]], ["tile_y", "sp", [-1, 1, 7, 1]], ["tile_x", "sp", [-1, 1, 7, 1]], ["tile_rc", "sp", [-1, 2]], ["tile_ry", "sp", [-1, 1]], ["tile_rx", "sp", [-1, 1]], ["auto_unroll_max_step", "ot", 512], ["unroll_explicit", "ot", 1]]}, "result": [[0.016151250428571427], 0, 2.3998262882232666, 1638967083.1954138], "version": 0.2, "tvm_version": "0.8.dev0"}
{"input": ["cuda -keys=cuda,gpu -max_num_threads=1024 -thread_warp_size=32", "conv2d_nchw.cuda", [["TENSOR", [256, 1024, 14, 14], "float32"], ["TENSOR", [2048, 1024, 1, 1], "float32"], 2, "VALID", 1, "float32"], {}], "config": {"index": 73748, "code_hash": null, "entity": [["tile_f", "sp", [-1, 16, 4, 8]], ["tile_y", "sp", [-1, 1, 7, 1]], ["tile_x", "sp", [-1, 1, 7, 1]], ["tile_rc", "sp", [-1, 2]], ["tile_ry", "sp", [-1, 1]], ["tile_rx", "sp", [-1, 1]], ["auto_unroll_max_step", "ot", 512], ["unroll_explicit", "ot", 0]]}, "result": [[0.015387203714285714], 0, 2.0224626064300537, 1638967084.825173], "version": 0.2, "tvm_version": "0.8.dev0"}
{"input": ["cuda -keys=cuda,gpu -max_num_threads=1024 -thread_warp_size=32", "conv2d_nchw.cuda", [["TENSOR", [256, 1024, 14, 14], "float32"], ["TENSOR", [2048, 1024, 1, 1], "float32"], 2, "VALID", 1, "float32"], {}], "config": {"index": 9684, "code_hash": null, "entity": [["tile_f", "sp", [-1, 16, 4, 8]], ["tile_y", "sp", [-1, 1, 7, 1]], ["tile_x", "sp", [-1, 1, 7, 1]], ["tile_rc", "sp", [-1, 2]], ["tile_ry", "sp", [-1, 1]], ["tile_rx", "sp", [-1, 1]], ["auto_unroll_max_step", "ot", 0], ["unroll_explicit", "ot", 0]]}, "result": [[0.017904522500000002], 0, 1.9477543830871582, 1638967086.470812], "version": 0.2, "tvm_version": "0.8.dev0"}
{"input": ["cuda -keys=cuda,gpu -max_num_threads=1024 -thread_warp_size=32", "conv2d_nchw.cuda", [["TENSOR", [256, 1024, 14, 14], "float32"], ["TENSOR", [2048, 1024, 1, 1], "float32"], 2, "VALID", 1, "float32"], {}], "config": {"index": 201831, "code_hash": null, "entity": [["tile_f", "sp", [-1, 16, 8, 4]], ["tile_y", "sp", [-1, 1, 7, 1]], ["tile_x", "sp", [-1, 1, 7, 1]], ["tile_rc", "sp", [-1, 2]], ["tile_ry", "sp", [-1, 1]], ["tile_rx", "sp", [-1, 1]], ["auto_unroll_max_step", "ot", 0], ["unroll_explicit", "ot", 1]]}, "result": [[0.019360092166666665], 0, 2.013246536254883, 1638967088.193729], "version": 0.2, "tvm_version": "0.8.dev0"}
{"input": ["cuda -keys=cuda,gpu -max_num_threads=1024 -thread_warp_size=32", "conv2d_nchw.cuda", [["TENSOR", [256, 1024, 14, 14], "float32"], ["TENSOR", [2048, 1024, 1, 1], "float32"], 2, "VALID", 1, "float32"], {}], "config": {"index": 73703, "code_hash": null, "entity": [["tile_f", "sp", [-1, 16, 8, 4]], ["tile_y", "sp", [-1, 1, 7, 1]], ["tile_x", "sp", [-1, 1, 7, 1]], ["tile_rc", "sp", [-1, 2]], ["tile_ry", "sp", [-1, 1]], ["tile_rx", "sp", [-1, 1]], ["auto_unroll_max_step", "ot", 512], ["unroll_explicit", "ot", 0]]}, "result": [[0.016089081142857144], 0, 2.0385327339172363, 1638967089.9724026], "version": 0.2, "tvm_version": "0.8.dev0"}
{"input": ["cuda -keys=cuda,gpu -max_num_threads=1024 -thread_warp_size=32", "conv2d_nchw.cuda", [["TENSOR", [256, 1024, 14, 14], "float32"], ["TENSOR", [2048, 1024, 1, 1], "float32"], 2, "VALID", 1, "float32"], {}], "config": {"index": 9639, "code_hash": null, "entity": [["tile_f", "sp", [-1, 16, 8, 4]], ["tile_y", "sp", [-1, 1, 7, 1]], ["tile_x", "sp", [-1, 1, 7, 1]], ["tile_rc", "sp", [-1, 2]], ["tile_ry", "sp", [-1, 1]], ["tile_rx", "sp", [-1, 1]], ["auto_unroll_max_step", "ot", 0], ["unroll_explicit", "ot", 0]]}, "result": [[0.019357642333333334], 0, 1.9837141036987305, 1638967091.6906264], "version": 0.2, "tvm_version": "0.8.dev0"}
{"input": ["cuda -keys=cuda,gpu -max_num_threads=1024 -thread_warp_size=32", "conv2d_nchw.cuda", [["TENSOR", [256, 1024, 14, 14], "float32"], ["TENSOR", [2048, 1024, 1, 1], "float32"], 2, "VALID", 1, "float32"], {}], "config": {"index": 265895, "code_hash": null, "entity": [["tile_f", "sp", [-1, 16, 8, 4]], ["tile_y", "sp", [-1, 1, 7, 1]], ["tile_x", "sp", [-1, 1, 7, 1]], ["tile_rc", "sp", [-1, 2]], ["tile_ry", "sp", [-1, 1]], ["tile_rx", "sp", [-1, 1]], ["auto_unroll_max_step", "ot", 512], ["unroll_explicit", "ot", 1]]}, "result": [[0.015855788571428574], 0, 2.146017074584961, 1638967093.4211566], "version": 0.2, "tvm_version": "0.8.dev0"}
{"input": ["cuda -keys=cuda,gpu -max_num_threads=1024 -thread_warp_size=32", "conv2d_nchw.cuda", [["TENSOR", [256, 1024, 14, 14], "float32"], ["TENSOR", [2048, 1024, 1, 1], "float32"], 2, "VALID", 1, "float32"], {}], "config": {"index": 15326, "code_hash": null, "entity": [["tile_f", "sp", [-1, 32, 8, 1]], ["tile_y", "sp", [-1, 1, 7, 1]], ["tile_x", "sp", [-1, 1, 7, 1]], ["tile_rc", "sp", [-1, 4]], ["tile_ry", "sp", [-1, 1]], ["tile_rx", "sp", [-1, 1]], ["auto_unroll_max_step", "ot", 0], ["unroll_explicit", "ot", 0]]}, "result": [[0.013129314000000001], 0, 1.9559822082519531, 1638967095.1270816], "version": 0.2, "tvm_version": "0.8.dev0"}
{"input": ["cuda -keys=cuda,gpu -max_num_threads=1024 -thread_warp_size=32", "conv2d_nchw.cuda", [["TENSOR", [256, 1024, 14, 14], "float32"], ["TENSOR", [2048, 1024, 1, 1], "float32"], 2, "VALID", 1, "float32"], {}], "config": {"index": 79390, "code_hash": null, "entity": [["tile_f", "sp", [-1, 32, 8, 1]], ["tile_y", "sp", [-1, 1, 7, 1]], ["tile_x", "sp", [-1, 1, 7, 1]], ["tile_rc", "sp", [-1, 4]], ["tile_ry", "sp", [-1, 1]], ["tile_rx", "sp", [-1, 1]], ["auto_unroll_max_step", "ot", 512], ["unroll_explicit", "ot", 0]]}, "result": [[0.010944806900000001], 0, 1.938692331314087, 1638967096.8197548], "version": 0.2, "tvm_version": "0.8.dev0"}
{"input": ["cuda -keys=cuda,gpu -max_num_threads=1024 -thread_warp_size=32", "conv2d_nchw.cuda", [["TENSOR", [256, 1024, 14, 14], "float32"], ["TENSOR", [2048, 1024, 1, 1], "float32"], 2, "VALID", 1, "float32"], {}], "config": {"index": 271582, "code_hash": null, "entity": [["tile_f", "sp", [-1, 32, 8, 1]], ["tile_y", "sp", [-1, 1, 7, 1]], ["tile_x", "sp", [-1, 1, 7, 1]], ["tile_rc", "sp", [-1, 4]], ["tile_ry", "sp", [-1, 1]], ["tile_rx", "sp", [-1, 1]], ["auto_unroll_max_step", "ot", 512], ["unroll_explicit", "ot", 1]]}, "result": [[0.0108354505], 0, 2.104492664337158, 1638967098.5806162], "version": 0.2, "tvm_version": "0.8.dev0"}
{"input": ["cuda -keys=cuda,gpu -max_num_threads=1024 -thread_warp_size=32", "conv2d_nchw.cuda", [["TENSOR", [256, 1024, 14, 14], "float32"], ["TENSOR", [2048, 1024, 1, 1], "float32"], 2, "VALID", 1, "float32"], {}], "config": {"index": 207518, "code_hash": null, "entity": [["tile_f", "sp", [-1, 32, 8, 1]], ["tile_y", "sp", [-1, 1, 7, 1]], ["tile_x", "sp", [-1, 1, 7, 1]], ["tile_rc", "sp", [-1, 4]], ["tile_ry", "sp", [-1, 1]], ["tile_rx", "sp", [-1, 1]], ["auto_unroll_max_step", "ot", 0], ["unroll_explicit", "ot", 1]]}, "result": [[0.013128739124999999], 0, 1.9188642501831055, 1638967100.2036612], "version": 0.2, "tvm_version": "0.8.dev0"}
{"input": ["cuda -keys=cuda,gpu -max_num_threads=1024 -thread_warp_size=32", "conv2d_nchw.cuda", [["TENSOR", [256, 1024, 14, 14], "float32"], ["TENSOR", [2048, 1024, 1, 1], "float32"], 2, "VALID", 1, "float32"], {}], "config": {"index": 73939, "code_hash": null, "entity": [["tile_f", "sp", [-1, 32, 16, 1]], ["tile_y", "sp", [-1, 1, 1, 7]], ["tile_x", "sp", [-1, 1, 7, 1]], ["tile_rc", "sp", [-1, 2]], ["tile_ry", "sp", [-1, 1]], ["tile_rx", "sp", [-1, 1]], ["auto_unroll_max_step", "ot", 512], ["unroll_explicit", "ot", 0]]}, "result": [[0.012126775444444444], 0, 2.160536527633667, 1638967101.9725747], "version": 0.2, "tvm_version": "0.8.dev0"}
{"input": ["cuda -keys=cuda,gpu -max_num_threads=1024 -thread_warp_size=32", "conv2d_nchw.cuda", [["TENSOR", [256, 1024, 14, 14], "float32"], ["TENSOR", [2048, 1024, 1, 1], "float32"], 2, "VALID", 1, "float32"], {}], "config": {"index": 9875, "code_hash": null, "entity": [["tile_f", "sp", [-1, 32, 16, 1]], ["tile_y", "sp", [-1, 1, 1, 7]], ["tile_x", "sp", [-1, 1, 7, 1]], ["tile_rc", "sp", [-1, 2]], ["tile_ry", "sp", [-1, 1]], ["tile_rx", "sp", [-1, 1]], ["auto_unroll_max_step", "ot", 0], ["unroll_explicit", "ot", 0]]}, "result": [[0.01259754375], 0, 2.3936290740966797, 1638967103.7989569], "version": 0.2, "tvm_version": "0.8.dev0"}
{"input": ["cuda -keys=cuda,gpu -max_num_threads=1024 -thread_warp_size=32", "conv2d_nchw.cuda", [["TENSOR", [256, 1024, 14, 14], "float32"], ["TENSOR", [2048, 1024, 1, 1], "float32"], 2, "VALID", 1, "float32"], {}], "config": {"index": 329952, "code_hash": null, "entity": [["tile_f", "sp", [-1, 32, 4, 4]], ["tile_y", "sp", [-1, 1, 7, 1]], ["tile_x", "sp", [-1, 1, 7, 1]], ["tile_rc", "sp", [-1, 2]], ["tile_ry", "sp", [-1, 1]], ["tile_rx", "sp", [-1, 1]], ["auto_unroll_max_step", "ot", 1500], ["unroll_explicit", "ot", 1]]}, "result": [[0.015959956571428572], 0, 2.286067485809326, 1638967105.4562538], "version": 0.2, "tvm_version": "0.8.dev0"}
{"input": ["cuda -keys=cuda,gpu -max_num_threads=1024 -thread_warp_size=32", "conv2d_nchw.cuda", [["TENSOR", [256, 1024, 14, 14], "float32"], ["TENSOR", [2048, 1024, 1, 1], "float32"], 2, "VALID", 1, "float32"], {}], "config": {"index": 137760, "code_hash": null, "entity": [["tile_f", "sp", [-1, 32, 4, 4]], ["tile_y", "sp", [-1, 1, 7, 1]], ["tile_x", "sp", [-1, 1, 7, 1]], ["tile_rc", "sp", [-1, 2]], ["tile_ry", "sp", [-1, 1]], ["tile_rx", "sp", [-1, 1]], ["auto_unroll_max_step", "ot", 1500], ["unroll_explicit", "ot", 0]]}, "result": [[0.015528113428571428], 0, 2.072864294052124, 1638967107.165128], "version": 0.2, "tvm_version": "0.8.dev0"}
{"input": ["cuda -keys=cuda,gpu -max_num_threads=1024 -thread_warp_size=32", "conv2d_nchw.cuda", [["TENSOR", [256, 1024, 14, 14], "float32"], ["TENSOR", [2048, 1024, 1, 1], "float32"], 2, "VALID", 1, "float32"], {}], "config": {"index": 271591, "code_hash": null, "entity": [["tile_f", "sp", [-1, 32, 16, 1]], ["tile_y", "sp", [-1, 1, 7, 1]], ["tile_x", "sp", [-1, 1, 7, 1]], ["tile_rc", "sp", [-1, 4]], ["tile_ry", "sp", [-1, 1]], ["tile_rx", "sp", [-1, 1]], ["auto_unroll_max_step", "ot", 512], ["unroll_explicit", "ot", 1]]}, "result": [[0.32425006624999997], 0, 3.421978235244751, 1638967111.3738992], "version": 0.2, "tvm_version": "0.8.dev0"}
{"input": ["cuda -keys=cuda,gpu -max_num_threads=1024 -thread_warp_size=32", "conv2d_nchw.cuda", [["TENSOR", [256, 1024, 14, 14], "float32"], ["TENSOR", [2048, 1024, 1, 1], "float32"], 2, "VALID", 1, "float32"], {}], "config": {"index": 79399, "code_hash": null, "entity": [["tile_f", "sp", [-1, 32, 16, 1]], ["tile_y", "sp", [-1, 1, 7, 1]], ["tile_x", "sp", [-1, 1, 7, 1]], ["tile_rc", "sp", [-1, 4]], ["tile_ry", "sp", [-1, 1]], ["tile_rx", "sp", [-1, 1]], ["auto_unroll_max_step", "ot", 512], ["unroll_explicit", "ot", 0]]}, "result": [[0.3228751355], 0, 3.4315712451934814, 1638967114.5405915], "version": 0.2, "tvm_version": "0.8.dev0"}
{"input": ["cuda -keys=cuda,gpu -max_num_threads=1024 -thread_warp_size=32", "conv2d_nchw.cuda", [["TENSOR", [256, 1024, 14, 14], "float32"], ["TENSOR", [2048, 1024, 1, 1], "float32"], 2, "VALID", 1, "float32"], {}], "config": {"index": 15335, "code_hash": null, "entity": [["tile_f", "sp", [-1, 32, 16, 1]], ["tile_y", "sp", [-1, 1, 7, 1]], ["tile_x", "sp", [-1, 1, 7, 1]], ["tile_rc", "sp", [-1, 4]], ["tile_ry", "sp", [-1, 1]], ["tile_rx", "sp", [-1, 1]], ["auto_unroll_max_step", "ot", 0], ["unroll_explicit", "ot", 0]]}, "result": [[0.01508177057142857], 0, 1.860041856765747, 1638967116.172002], "version": 0.2, "tvm_version": "0.8.dev0"}
{"input": ["cuda -keys=cuda,gpu -max_num_threads=1024 -thread_warp_size=32", "conv2d_nchw.cuda", [["TENSOR", [256, 1024, 14, 14], "float32"], ["TENSOR", [2048, 1024, 1, 1], "float32"], 2, "VALID", 1, "float32"], {}], "config": {"index": 73576, "code_hash": null, "entity": [["tile_f", "sp", [-1, 64, 16, 1]], ["tile_y", "sp", [-1, 1, 7, 1]], ["tile_x", "sp", [-1, 1, 7, 1]], ["tile_rc", "sp", [-1, 2]], ["tile_ry", "sp", [-1, 1]], ["tile_rx", "sp", [-1, 1]], ["auto_unroll_max_step", "ot", 512], ["unroll_explicit", "ot", 0]]}, "result": [[0.016746659833333333], 0, 1.9773669242858887, 1638967117.8995898], "version": 0.2, "tvm_version": "0.8.dev0"}
{"input": ["cuda -keys=cuda,gpu -max_num_threads=1024 -thread_warp_size=32", "conv2d_nchw.cuda", [["TENSOR", [256, 1024, 14, 14], "float32"], ["TENSOR", [2048, 1024, 1, 1], "float32"], 2, "VALID", 1, "float32"], {}], "config": {"index": 265768, "code_hash": null, "entity": [["tile_f", "sp", [-1, 64, 16, 1]], ["tile_y", "sp", [-1, 1, 7, 1]], ["tile_x", "sp", [-1, 1, 7, 1]], ["tile_rc", "sp", [-1, 2]], ["tile_ry", "sp", [-1, 1]], ["tile_rx", "sp", [-1, 1]], ["auto_unroll_max_step", "ot", 512], ["unroll_explicit", "ot", 1]]}, "result": [[0.016934953833333332], 0, 2.031578779220581, 1638967119.6095772], "version": 0.2, "tvm_version": "0.8.dev0"}
{"input": ["cuda -keys=cuda,gpu -max_num_threads=1024 -thread_warp_size=32", "conv2d_nchw.cuda", [["TENSOR", [256, 1024, 14, 14], "float32"], ["TENSOR", [2048, 1024, 1, 1], "float32"], 2, "VALID", 1, "float32"], {}], "config": {"index": 201704, "code_hash": null, "entity": [["tile_f", "sp", [-1, 64, 16, 1]], ["tile_y", "sp", [-1, 1, 7, 1]], ["tile_x", "sp", [-1, 1, 7, 1]], ["tile_rc", "sp", [-1, 2]], ["tile_ry", "sp", [-1, 1]], ["tile_rx", "sp", [-1, 1]], ["auto_unroll_max_step", "ot", 0], ["unroll_explicit", "ot", 1]]}, "result": [[0.020918975333333336], 0, 2.012460231781006, 1638967121.366466], "version": 0.2, "tvm_version": "0.8.dev0"}
{"input": ["cuda -keys=cuda,gpu -max_num_threads=1024 -thread_warp_size=32", "conv2d_nchw.cuda", [["TENSOR", [256, 1024, 14, 14], "float32"], ["TENSOR", [2048, 1024, 1, 1], "float32"], 2, "VALID", 1, "float32"], {}], "config": {"index": 9512, "code_hash": null, "entity": [["tile_f", "sp", [-1, 64, 16, 1]], ["tile_y", "sp", [-1, 1, 7, 1]], ["tile_x", "sp", [-1, 1, 7, 1]], ["tile_rc", "sp", [-1, 2]], ["tile_ry", "sp", [-1, 1]], ["tile_rx", "sp", [-1, 1]], ["auto_unroll_max_step", "ot", 0], ["unroll_explicit", "ot", 0]]}, "result": [[0.020933724833333334], 0, 1.9909629821777344, 1638967123.0886693], "version": 0.2, "tvm_version": "0.8.dev0"}
{"input": ["cuda -keys=cuda,gpu -max_num_threads=1024 -thread_warp_size=32", "conv2d_nchw.cuda", [["TENSOR", [256, 1024, 14, 14], "float32"], ["TENSOR", [2048, 1024, 1, 1], "float32"], 2, "VALID", 1, "float32"], {}], "config": {"index": 12496, "code_hash": null, "entity": [["tile_f", "sp", [-1, 16, 16, 2]], ["tile_y", "sp", [-1, 1, 7, 1]], ["tile_x", "sp", [-1, 1, 1, 1]], ["tile_rc", "sp", [-1, 4]], ["tile_ry", "sp", [-1, 1]], ["tile_rx", "sp", [-1, 1]], ["auto_unroll_max_step", "ot", 0], ["unroll_explicit", "ot", 0]]}, "result": [[0.0561910125], 0, 2.1017682552337646, 1638967124.9003568], "version": 0.2, "tvm_version": "0.8.dev0"}
{"input": ["cuda -keys=cuda,gpu -max_num_threads=1024 -thread_warp_size=32", "conv2d_nchw.cuda", [["TENSOR", [256, 1024, 14, 14], "float32"], ["TENSOR", [2048, 1024, 1, 1], "float32"], 2, "VALID", 1, "float32"], {}], "config": {"index": 204688, "code_hash": null, "entity": [["tile_f", "sp", [-1, 16, 16, 2]], ["tile_y", "sp", [-1, 1, 7, 1]], ["tile_x", "sp", [-1, 1, 1, 1]], ["tile_rc", "sp", [-1, 4]], ["tile_ry", "sp", [-1, 1]], ["tile_rx", "sp", [-1, 1]], ["auto_unroll_max_step", "ot", 0], ["unroll_explicit", "ot", 1]]}, "result": [[0.05634585725], 0, 1.9735028743743896, 1638967126.6331692], "version": 0.2, "tvm_version": "0.8.dev0"}
{"input": ["cuda -keys=cuda,gpu -max_num_threads=1024 -thread_warp_size=32", "conv2d_nchw.cuda", [["TENSOR", [256, 1024, 14, 14], "float32"], ["TENSOR", [2048, 1024, 1, 1], "float32"], 2, "VALID", 1, "float32"], {}], "config": {"index": 76560, "code_hash": null, "entity": [["tile_f", "sp", [-1, 16, 16, 2]], ["tile_y", "sp", [-1, 1, 7, 1]], ["tile_x", "sp", [-1, 1, 1, 1]], ["tile_rc", "sp", [-1, 4]], ["tile_ry", "sp", [-1, 1]], ["tile_rx", "sp", [-1, 1]], ["auto_unroll_max_step", "ot", 512], ["unroll_explicit", "ot", 0]]}, "result": [[0.03787652825], 0, 2.0155627727508545, 1638967128.357409], "version": 0.2, "tvm_version": "0.8.dev0"}
{"input": ["cuda -keys=cuda,gpu -max_num_threads=1024 -thread_warp_size=32", "conv2d_nchw.cuda", [["TENSOR", [256, 1024, 14, 14], "float32"], ["TENSOR", [2048, 1024, 1, 1], "float32"], 2, "VALID", 1, "float32"], {}], "config": {"index": 268752, "code_hash": null, "entity": [["tile_f", "sp", [-1, 16, 16, 2]], ["tile_y", "sp", [-1, 1, 7, 1]], ["tile_x", "sp", [-1, 1, 1, 1]], ["tile_rc", "sp", [-1, 4]], ["tile_ry", "sp", [-1, 1]], ["tile_rx", "sp", [-1, 1]], ["auto_unroll_max_step", "ot", 512], ["unroll_explicit", "ot", 1]]}, "result": [[0.040136280249999996], 0, 2.0455923080444336, 1638967130.09075], "version": 0.2, "tvm_version": "0.8.dev0"}
{"input": ["cuda -keys=cuda,gpu -max_num_threads=1024 -thread_warp_size=32", "conv2d_nchw.cuda", [["TENSOR", [256, 1024, 14, 14], "float32"], ["TENSOR", [2048, 1024, 1, 1], "float32"], 2, "VALID", 1, "float32"], {}], "config": {"index": 265833, "code_hash": null, "entity": [["tile_f", "sp", [-1, 32, 8, 2]], ["tile_y", "sp", [-1, 1, 7, 1]], ["tile_x", "sp", [-1, 1, 7, 1]], ["tile_rc", "sp", [-1, 2]], ["tile_ry", "sp", [-1, 1]], ["tile_rx", "sp", [-1, 1]], ["auto_unroll_max_step", "ot", 512], ["unroll_explicit", "ot", 1]]}, "result": [[0.015846988857142856], 0, 2.122832775115967, 1638967131.8970232], "version": 0.2, "tvm_version": "0.8.dev0"}
{"input": ["cuda -keys=cuda,gpu -max_num_threads=1024 -thread_warp_size=32", "conv2d_nchw.cuda", [["TENSOR", [256, 1024, 14, 14], "float32"], ["TENSOR", [2048, 1024, 1, 1], "float32"], 2, "VALID", 1, "float32"], {}], "config": {"index": 201769, "code_hash": null, "entity": [["tile_f", "sp", [-1, 32, 8, 2]], ["tile_y", "sp", [-1, 1, 7, 1]], ["tile_x", "sp", [-1, 1, 7, 1]], ["tile_rc", "sp", [-1, 2]], ["tile_ry", "sp", [-1, 1]], ["tile_rx", "sp", [-1, 1]], ["auto_unroll_max_step", "ot", 0], ["unroll_explicit", "ot", 1]]}, "result": [[0.019354942333333333], 0, 1.9927797317504883, 1638967133.6170998], "version": 0.2, "tvm_version": "0.8.dev0"}
{"input": ["cuda -keys=cuda,gpu -max_num_threads=1024 -thread_warp_size=32", "conv2d_nchw.cuda", [["TENSOR", [256, 1024, 14, 14], "float32"], ["TENSOR", [2048, 1024, 1, 1], "float32"], 2, "VALID", 1, "float32"], {}], "config": {"index": 9577, "code_hash": null, "entity": [["tile_f", "sp", [-1, 32, 8, 2]], ["tile_y", "sp", [-1, 1, 7, 1]], ["tile_x", "sp", [-1, 1, 7, 1]], ["tile_rc", "sp", [-1, 2]], ["tile_ry", "sp", [-1, 1]], ["tile_rx", "sp", [-1, 1]], ["auto_unroll_max_step", "ot", 0], ["unroll_explicit", "ot", 0]]}, "result": [[0.0193592755], 0, 1.9450795650482178, 1638967135.275517], "version": 0.2, "tvm_version": "0.8.dev0"}
{"input": ["cuda -keys=cuda,gpu -max_num_threads=1024 -thread_warp_size=32", "conv2d_nchw.cuda", [["TENSOR", [256, 1024, 14, 14], "float32"], ["TENSOR", [2048, 1024, 1, 1], "float32"], 2, "VALID", 1, "float32"], {}], "config": {"index": 73641, "code_hash": null, "entity": [["tile_f", "sp", [-1, 32, 8, 2]], ["tile_y", "sp", [-1, 1, 7, 1]], ["tile_x", "sp", [-1, 1, 7, 1]], ["tile_rc", "sp", [-1, 2]], ["tile_ry", "sp", [-1, 1]], ["tile_rx", "sp", [-1, 1]], ["auto_unroll_max_step", "ot", 512], ["unroll_explicit", "ot", 0]]}, "result": [[0.015913986714285715], 0, 2.0075948238372803, 1638967136.9911525], "version": 0.2, "tvm_version": "0.8.dev0"}
{"input": ["cuda -keys=cuda,gpu -max_num_threads=1024 -thread_warp_size=32", "conv2d_nchw.cuda", [["TENSOR", [256, 1024, 14, 14], "float32"], ["TENSOR", [2048, 1024, 1, 1], "float32"], 2, "VALID", 1, "float32"], {}], "config": {"index": 137639, "code_hash": null, "entity": [["tile_f", "sp", [-1, 32, 16, 1]], ["tile_y", "sp", [-1, 1, 7, 1]], ["tile_x", "sp", [-1, 1, 7, 1]], ["tile_rc", "sp", [-1, 2]], ["tile_ry", "sp", [-1, 1]], ["tile_rx", "sp", [-1, 1]], ["auto_unroll_max_step", "ot", 1500], ["unroll_explicit", "ot", 0]]}, "result": [[0.016079224142857142], 0, 2.05358624458313, 1638967138.7597668], "version": 0.2, "tvm_version": "0.8.dev0"}
{"input": ["cuda -keys=cuda,gpu -max_num_threads=1024 -thread_warp_size=32", "conv2d_nchw.cuda", [["TENSOR", [256, 1024, 14, 14], "float32"], ["TENSOR", [2048, 1024, 1, 1], "float32"], 2, "VALID", 1, "float32"], {}], "config": {"index": 329831, "code_hash": null, "entity": [["tile_f", "sp", [-1, 32, 16, 1]], ["tile_y", "sp", [-1, 1, 7, 1]], ["tile_x", "sp", [-1, 1, 7, 1]], ["tile_rc", "sp", [-1, 2]], ["tile_ry", "sp", [-1, 1]], ["tile_rx", "sp", [-1, 1]], ["auto_unroll_max_step", "ot", 1500], ["unroll_explicit", "ot", 1]]}, "result": [[0.015969499142857144], 0, 2.0194296836853027, 1638967140.4865265], "version": 0.2, "tvm_version": "0.8.dev0"}
{"input": ["cuda -keys=cuda,gpu -max_num_threads=1024 -thread_warp_size=32", "conv2d_nchw.cuda", [["TENSOR", [256, 1024, 14, 14], "float32"], ["TENSOR", [2048, 1024, 1, 1], "float32"], 2, "VALID", 1, "float32"], {}], "config": {"index": 330004, "code_hash": null, "entity": [["tile_f", "sp", [-1, 16, 4, 8]], ["tile_y", "sp", [-1, 1, 7, 1]], ["tile_x", "sp", [-1, 1, 7, 1]], ["tile_rc", "sp", [-1, 2]], ["tile_ry", "sp", [-1, 1]], ["tile_rx", "sp", [-1, 1]], ["auto_unroll_max_step", "ot", 1500], ["unroll_explicit", "ot", 1]]}, "result": [[0.016150179], 0, 2.334789991378784, 1638967142.1502068], "version": 0.2, "tvm_version": "0.8.dev0"}
{"input": ["cuda -keys=cuda,gpu -max_num_threads=1024 -thread_warp_size=32", "conv2d_nchw.cuda", [["TENSOR", [256, 1024, 14, 14], "float32"], ["TENSOR", [2048, 1024, 1, 1], "float32"], 2, "VALID", 1, "float32"], {}], "config": {"index": 329959, "code_hash": null, "entity": [["tile_f", "sp", [-1, 16, 8, 4]], ["tile_y", "sp", [-1, 1, 7, 1]], ["tile_x", "sp", [-1, 1, 7, 1]], ["tile_rc", "sp", [-1, 2]], ["tile_ry", "sp", [-1, 1]], ["tile_rx", "sp", [-1, 1]], ["auto_unroll_max_step", "ot", 1500], ["unroll_explicit", "ot", 1]]}, "result": [[0.015856631285714285], 0, 1.9681360721588135, 1638967143.784808], "version": 0.2, "tvm_version": "0.8.dev0"}
{"input": ["cuda -keys=cuda,gpu -max_num_threads=1024 -thread_warp_size=32", "conv2d_nchw.cuda", [["TENSOR", [256, 1024, 14, 14], "float32"], ["TENSOR", [2048, 1024, 1, 1], "float32"], 2, "VALID", 1, "float32"], {}], "config": {"index": 137767, "code_hash": null, "entity": [["tile_f", "sp", [-1, 16, 8, 4]], ["tile_y", "sp", [-1, 1, 7, 1]], ["tile_x", "sp", [-1, 1, 7, 1]], ["tile_rc", "sp", [-1, 2]], ["tile_ry", "sp", [-1, 1]], ["tile_rx", "sp", [-1, 1]], ["auto_unroll_max_step", "ot", 1500], ["unroll_explicit", "ot", 0]]}, "result": [[0.01609129514285714], 0, 1.933333158493042, 1638967145.4389179], "version": 0.2, "tvm_version": "0.8.dev0"}
{"input": ["cuda -keys=cuda,gpu -max_num_threads=1024 -thread_warp_size=32", "conv2d_nchw.cuda", [["TENSOR", [256, 1024, 14, 14], "float32"], ["TENSOR", [2048, 1024, 1, 1], "float32"], 2, "VALID", 1, "float32"], {}], "config": {"index": 14680, "code_hash": null, "entity": [["tile_f", "sp", [-1, 16, 16, 2]], ["tile_y", "sp", [-1, 1, 1, 1]], ["tile_x", "sp", [-1, 1, 7, 1]], ["tile_rc", "sp", [-1, 4]], ["tile_ry", "sp", [-1, 1]], ["tile_rx", "sp", [-1, 1]], ["auto_unroll_max_step", "ot", 0], ["unroll_explicit", "ot", 0]]}, "result": [[0.0553241655], 0, 2.018230676651001, 1638967147.2386377], "version": 0.2, "tvm_version": "0.8.dev0"}
{"input": ["cuda -keys=cuda,gpu -max_num_threads=1024 -thread_warp_size=32", "conv2d_nchw.cuda", [["TENSOR", [256, 1024, 14, 14], "float32"], ["TENSOR", [2048, 1024, 1, 1], "float32"], 2, "VALID", 1, "float32"], {}], "config": {"index": 78744, "code_hash": null, "entity": [["tile_f", "sp", [-1, 16, 16, 2]], ["tile_y", "sp", [-1, 1, 1, 1]], ["tile_x", "sp", [-1, 1, 7, 1]], ["tile_rc", "sp", [-1, 4]], ["tile_ry", "sp", [-1, 1]], ["tile_rx", "sp", [-1, 1]], ["auto_unroll_max_step", "ot", 512], ["unroll_explicit", "ot", 0]]}, "result": [[0.03754681375], 0, 2.1204044818878174, 1638967149.088917], "version": 0.2, "tvm_version": "0.8.dev0"}
{"input": ["cuda -keys=cuda,gpu -max_num_threads=1024 -thread_warp_size=32", "conv2d_nchw.cuda", [["TENSOR", [256, 1024, 14, 14], "float32"], ["TENSOR", [2048, 1024, 1, 1], "float32"], 2, "VALID", 1, "float32"], {}], "config": {"index": 206872, "code_hash": null, "entity": [["tile_f", "sp", [-1, 16, 16, 2]], ["tile_y", "sp", [-1, 1, 1, 1]], ["tile_x", "sp", [-1, 1, 7, 1]], ["tile_rc", "sp", [-1, 4]], ["tile_ry", "sp", [-1, 1]], ["tile_rx", "sp", [-1, 1]], ["auto_unroll_max_step", "ot", 0], ["unroll_explicit", "ot", 1]]}, "result": [[0.05525039275], 0, 1.957444190979004, 1638967150.8130105], "version": 0.2, "tvm_version": "0.8.dev0"}
{"input": ["cuda -keys=cuda,gpu -max_num_threads=1024 -thread_warp_size=32", "conv2d_nchw.cuda", [["TENSOR", [256, 1024, 14, 14], "float32"], ["TENSOR", [2048, 1024, 1, 1], "float32"], 2, "VALID", 1, "float32"], {}], "config": {"index": 270936, "code_hash": null, "entity": [["tile_f", "sp", [-1, 16, 16, 2]], ["tile_y", "sp", [-1, 1, 1, 1]], ["tile_x", "sp", [-1, 1, 7, 1]], ["tile_rc", "sp", [-1, 4]], ["tile_ry", "sp", [-1, 1]], ["tile_rx", "sp", [-1, 1]], ["auto_unroll_max_step", "ot", 512], ["unroll_explicit", "ot", 1]]}, "result": [[0.039522575000000004], 0, 2.0328893661499023, 1638967152.5329554], "version": 0.2, "tvm_version": "0.8.dev0"}
{"input": ["cuda -keys=cuda,gpu -max_num_threads=1024 -thread_warp_size=32", "conv2d_nchw.cuda", [["TENSOR", [256, 1024, 14, 14], "float32"], ["TENSOR", [2048, 1024, 1, 1], "float32"], 2, "VALID", 1, "float32"], {}], "config": {"index": 8917, "code_hash": null, "entity": [["tile_f", "sp", [-1, 8, 16, 4]], ["tile_y", "sp", [-1, 1, 1, 1]], ["tile_x", "sp", [-1, 1, 7, 1]], ["tile_rc", "sp", [-1, 2]], ["tile_ry", "sp", [-1, 1]], ["tile_rx", "sp", [-1, 1]], ["auto_unroll_max_step", "ot", 0], ["unroll_explicit", "ot", 0]]}, "result": [[0.05475715875], 0, 1.9941632747650146, 1638967160.1884668], "version": 0.2, "tvm_version": "0.8.dev0"}
{"input": ["cuda -keys=cuda,gpu -max_num_threads=1024 -thread_warp_size=32", "conv2d_nchw.cuda", [["TENSOR", [256, 1024, 14, 14], "float32"], ["TENSOR", [2048, 1024, 1, 1], "float32"], 2, "VALID", 1, "float32"], {}], "config": {"index": 265173, "code_hash": null, "entity": [["tile_f", "sp", [-1, 8, 16, 4]], ["tile_y", "sp", [-1, 1, 1, 1]], ["tile_x", "sp", [-1, 1, 7, 1]], ["tile_rc", "sp", [-1, 2]], ["tile_ry", "sp", [-1, 1]], ["tile_rx", "sp", [-1, 1]], ["auto_unroll_max_step", "ot", 512], ["unroll_explicit", "ot", 1]]}, "result": [[0.050182556249999996], 0, 1.9835152626037598, 1638967161.9495502], "version": 0.2, "tvm_version": "0.8.dev0"}
{"input": ["cuda -keys=cuda,gpu -max_num_threads=1024 -thread_warp_size=32", "conv2d_nchw.cuda", [["TENSOR", [256, 1024, 14, 14], "float32"], ["TENSOR", [2048, 1024, 1, 1], "float32"], 2, "VALID", 1, "float32"], {}], "config": {"index": 201109, "code_hash": null, "entity": [["tile_f", "sp", [-1, 8, 16, 4]], ["tile_y", "sp", [-1, 1, 1, 1]], ["tile_x", "sp", [-1, 1, 7, 1]], ["tile_rc", "sp", [-1, 2]], ["tile_ry", "sp", [-1, 1]], ["tile_rx", "sp", [-1, 1]], ["auto_unroll_max_step", "ot", 0], ["unroll_explicit", "ot", 1]]}, "result": [[0.05065489075], 0, 1.9013700485229492, 1638967163.6529317], "version": 0.2, "tvm_version": "0.8.dev0"}
{"input": ["cuda -keys=cuda,gpu -max_num_threads=1024 -thread_warp_size=32", "conv2d_nchw.cuda", [["TENSOR", [256, 1024, 14, 14], "float32"], ["TENSOR", [2048, 1024, 1, 1], "float32"], 2, "VALID", 1, "float32"], {}], "config": {"index": 72981, "code_hash": null, "entity": [["tile_f", "sp", [-1, 8, 16, 4]], ["tile_y", "sp", [-1, 1, 1, 1]], ["tile_x", "sp", [-1, 1, 7, 1]], ["tile_rc", "sp", [-1, 2]], ["tile_ry", "sp", [-1, 1]], ["tile_rx", "sp", [-1, 1]], ["auto_unroll_max_step", "ot", 512], ["unroll_explicit", "ot", 0]]}, "result": [[0.050126883], 0, 2.0166659355163574, 1638967165.4365542], "version": 0.2, "tvm_version": "0.8.dev0"}
{"input": ["cuda -keys=cuda,gpu -max_num_threads=1024 -thread_warp_size=32", "conv2d_nchw.cuda", [["TENSOR", [256, 1024, 14, 14], "float32"], ["TENSOR", [2048, 1024, 1, 1], "float32"], 2, "VALID", 1, "float32"], {}], "config": {"index": 335646, "code_hash": null, "entity": [["tile_f", "sp", [-1, 32, 8, 1]], ["tile_y", "sp", [-1, 1, 7, 1]], ["tile_x", "sp", [-1, 1, 7, 1]], ["tile_rc", "sp", [-1, 4]], ["tile_ry", "sp", [-1, 1]], ["tile_rx", "sp", [-1, 1]], ["auto_unroll_max_step", "ot", 1500], ["unroll_explicit", "ot", 1]]}, "result": [[0.0108422103], 0, 1.8956539630889893, 1638967167.0668397], "version": 0.2, "tvm_version": "0.8.dev0"}
{"input": ["cuda -keys=cuda,gpu -max_num_threads=1024 -thread_warp_size=32", "conv2d_nchw.cuda", [["TENSOR", [256, 1024, 14, 14], "float32"], ["TENSOR", [2048, 1024, 1, 1], "float32"], 2, "VALID", 1, "float32"], {}], "config": {"index": 143454, "code_hash": null, "entity": [["tile_f", "sp", [-1, 32, 8, 1]], ["tile_y", "sp", [-1, 1, 7, 1]], ["tile_x", "sp", [-1, 1, 7, 1]], ["tile_rc", "sp", [-1, 4]], ["tile_ry", "sp", [-1, 1]], ["tile_rx", "sp", [-1, 1]], ["auto_unroll_max_step", "ot", 1500], ["unroll_explicit", "ot", 0]]}, "result": [[0.0109543866], 0, 1.8978593349456787, 1638967168.7277064], "version": 0.2, "tvm_version": "0.8.dev0"}
{"input": ["cuda -keys=cuda,gpu -max_num_threads=1024 -thread_warp_size=32", "conv2d_nchw.cuda", [["TENSOR", [256, 1024, 14, 14], "float32"], ["TENSOR", [2048, 1024, 1, 1], "float32"], 2, "VALID", 1, "float32"], {}], "config": {"index": 73695, "code_hash": null, "entity": [["tile_f", "sp", [-1, 16, 4, 4]], ["tile_y", "sp", [-1, 1, 7, 1]], ["tile_x", "sp", [-1, 1, 7, 1]], ["tile_rc", "sp", [-1, 2]], ["tile_ry", "sp", [-1, 1]], ["tile_rx", "sp", [-1, 1]], ["auto_unroll_max_step", "ot", 512], ["unroll_explicit", "ot", 0]]}, "result": [[0.011555782777777778], 0, 1.9191813468933105, 1638967170.414258], "version": 0.2, "tvm_version": "0.8.dev0"}
{"input": ["cuda -keys=cuda,gpu -max_num_threads=1024 -thread_warp_size=32", "conv2d_nchw.cuda", [["TENSOR", [256, 1024, 14, 14], "float32"], ["TENSOR", [2048, 1024, 1, 1], "float32"], 2, "VALID", 1, "float32"], {}], "config": {"index": 201823, "code_hash": null, "entity": [["tile_f", "sp", [-1, 16, 4, 4]], ["tile_y", "sp", [-1, 1, 7, 1]], ["tile_x", "sp", [-1, 1, 7, 1]], ["tile_rc", "sp", [-1, 2]], ["tile_ry", "sp", [-1, 1]], ["tile_rx", "sp", [-1, 1]], ["auto_unroll_max_step", "ot", 0], ["unroll_explicit", "ot", 1]]}, "result": [[0.015169139142857143], 0, 1.9146356582641602, 1638967172.0987637], "version": 0.2, "tvm_version": "0.8.dev0"}
{"input": ["cuda -keys=cuda,gpu -max_num_threads=1024 -thread_warp_size=32", "conv2d_nchw.cuda", [["TENSOR", [256, 1024, 14, 14], "float32"], ["TENSOR", [2048, 1024, 1, 1], "float32"], 2, "VALID", 1, "float32"], {}], "config": {"index": 265887, "code_hash": null, "entity": [["tile_f", "sp", [-1, 16, 4, 4]], ["tile_y", "sp", [-1, 1, 7, 1]], ["tile_x", "sp", [-1, 1, 7, 1]], ["tile_rc", "sp", [-1, 2]], ["tile_ry", "sp", [-1, 1]], ["tile_rx", "sp", [-1, 1]], ["auto_unroll_max_step", "ot", 512], ["unroll_explicit", "ot", 1]]}, "result": [[0.013046329125], 0, 2.0090794563293457, 1638967173.8037171], "version": 0.2, "tvm_version": "0.8.dev0"}
{"input": ["cuda -keys=cuda,gpu -max_num_threads=1024 -thread_warp_size=32", "conv2d_nchw.cuda", [["TENSOR", [256, 1024, 14, 14], "float32"], ["TENSOR", [2048, 1024, 1, 1], "float32"], 2, "VALID", 1, "float32"], {}], "config": {"index": 330195, "code_hash": null, "entity": [["tile_f", "sp", [-1, 32, 16, 1]], ["tile_y", "sp", [-1, 1, 1, 7]], ["tile_x", "sp", [-1, 1, 7, 1]], ["tile_rc", "sp", [-1, 2]], ["tile_ry", "sp", [-1, 1]], ["tile_rx", "sp", [-1, 1]], ["auto_unroll_max_step", "ot", 1500], ["unroll_explicit", "ot", 1]]}, "result": [[0.013448478625], 0, 2.4976468086242676, 1638967175.5638816], "version": 0.2, "tvm_version": "0.8.dev0"}
{"input": ["cuda -keys=cuda,gpu -max_num_threads=1024 -thread_warp_size=32", "conv2d_nchw.cuda", [["TENSOR", [256, 1024, 14, 14], "float32"], ["TENSOR", [2048, 1024, 1, 1], "float32"], 2, "VALID", 1, "float32"], {}], "config": {"index": 138003, "code_hash": null, "entity": [["tile_f", "sp", [-1, 32, 16, 1]], ["tile_y", "sp", [-1, 1, 1, 7]], ["tile_x", "sp", [-1, 1, 7, 1]], ["tile_rc", "sp", [-1, 2]], ["tile_ry", "sp", [-1, 1]], ["tile_rx", "sp", [-1, 1]], ["auto_unroll_max_step", "ot", 1500], ["unroll_explicit", "ot", 0]]}, "result": [[0.012136508444444446], 0, 1.9854199886322021, 1638967177.172189], "version": 0.2, "tvm_version": "0.8.dev0"}
{"input": ["cuda -keys=cuda,gpu -max_num_threads=1024 -thread_warp_size=32", "conv2d_nchw.cuda", [["TENSOR", [256, 1024, 14, 14], "float32"], ["TENSOR", [2048, 1024, 1, 1], "float32"], 2, "VALID", 1, "float32"], {}], "config": {"index": 72975, "code_hash": null, "entity": [["tile_f", "sp", [-1, 16, 8, 4]], ["tile_y", "sp", [-1, 1, 1, 1]], ["tile_x", "sp", [-1, 1, 7, 1]], ["tile_rc", "sp", [-1, 2]], ["tile_ry", "sp", [-1, 1]], ["tile_rx", "sp", [-1, 1]], ["auto_unroll_max_step", "ot", 512], ["unroll_explicit", "ot", 0]]}, "result": [[0.044532388500000006], 0, 2.1103084087371826, 1638967179.0386446], "version": 0.2, "tvm_version": "0.8.dev0"}
{"input": ["cuda -keys=cuda,gpu -max_num_threads=1024 -thread_warp_size=32", "conv2d_nchw.cuda", [["TENSOR", [256, 1024, 14, 14], "float32"], ["TENSOR", [2048, 1024, 1, 1], "float32"], 2, "VALID", 1, "float32"], {}], "config": {"index": 8911, "code_hash": null, "entity": [["tile_f", "sp", [-1, 16, 8, 4]], ["tile_y", "sp", [-1, 1, 1, 1]], ["tile_x", "sp", [-1, 1, 7, 1]], ["tile_rc", "sp", [-1, 2]], ["tile_ry", "sp", [-1, 1]], ["tile_rx", "sp", [-1, 1]], ["auto_unroll_max_step", "ot", 0], ["unroll_explicit", "ot", 0]]}, "result": [[0.055821724], 0, 2.030571937561035, 1638967180.8523078], "version": 0.2, "tvm_version": "0.8.dev0"}
{"input": ["cuda -keys=cuda,gpu -max_num_threads=1024 -thread_warp_size=32", "conv2d_nchw.cuda", [["TENSOR", [256, 1024, 14, 14], "float32"], ["TENSOR", [2048, 1024, 1, 1], "float32"], 2, "VALID", 1, "float32"], {}], "config": {"index": 146255, "code_hash": null, "entity": [["tile_f", "sp", [-1, 16, 2, 32]], ["tile_y", "sp", [-1, 7, 1, 1]], ["tile_x", "sp", [-1, 1, 1, 1]], ["tile_rc", "sp", [-1, 8]], ["tile_ry", "sp", [-1, 1]], ["tile_rx", "sp", [-1, 1]], ["auto_unroll_max_step", "ot", 1500], ["unroll_explicit", "ot", 0]]}, "result": [[5.614982261750001], 0, 30.125004053115845, 1638967210.555999], "version": 0.2, "tvm_version": "0.8.dev0"}
{"input": ["cuda -keys=cuda,gpu -max_num_threads=1024 -thread_warp_size=32", "conv2d_nchw.cuda", [["TENSOR", [256, 1024, 14, 14], "float32"], ["TENSOR", [2048, 1024, 1, 1], "float32"], 2, "VALID", 1, "float32"], {}], "config": {"index": 286614, "code_hash": null, "entity": [["tile_f", "sp", [-1, 4, 1, 4]], ["tile_y", "sp", [-1, 1, 1, 7]], ["tile_x", "sp", [-1, 1, 1, 1]], ["tile_rc", "sp", [-1, 32]], ["tile_ry", "sp", [-1, 1]], ["tile_rx", "sp", [-1, 1]], ["auto_unroll_max_step", "ot", 512], ["unroll_explicit", "ot", 1]]}, "result": [[0.23568462175], 0, 5.837863922119141, 1638967213.528495], "version": 0.2, "tvm_version": "0.8.dev0"}
{"input": ["cuda -keys=cuda,gpu -max_num_threads=1024 -thread_warp_size=32", "conv2d_nchw.cuda", [["TENSOR", [256, 1024, 14, 14], "float32"], ["TENSOR", [2048, 1024, 1, 1], "float32"], 2, "VALID", 1, "float32"], {}], "config": {"index": 268002, "code_hash": null, "entity": [["tile_f", "sp", [-1, 512, 2, 2]], ["tile_y", "sp", [-1, 1, 1, 1]], ["tile_x", "sp", [-1, 1, 1, 1]], ["tile_rc", "sp", [-1, 4]], ["tile_ry", "sp", [-1, 1]], ["tile_rx", "sp", [-1, 1]], ["auto_unroll_max_step", "ot", 512], ["unroll_explicit", "ot", 1]]}, "result": [[4.20735124175], 0, 28.813997268676758, 1638967236.9788415], "version": 0.2, "tvm_version": "0.8.dev0"}
{"input": ["cuda -keys=cuda,gpu -max_num_threads=1024 -thread_warp_size=32", "conv2d_nchw.cuda", [["TENSOR", [256, 1024, 14, 14], "float32"], ["TENSOR", [2048, 1024, 1, 1], "float32"], 2, "VALID", 1, "float32"], {}], "config": {"index": 259531, "code_hash": null, "entity": [["tile_f", "sp", [-1, 1, 1, 2048]], ["tile_y", "sp", [-1, 1, 1, 1]], ["tile_x", "sp", [-1, 1, 7, 1]], ["tile_rc", "sp", [-1, 1]], ["tile_ry", "sp", [-1, 1]], ["tile_rx", "sp", [-1, 1]], ["auto_unroll_max_step", "ot", 512], ["unroll_explicit", "ot", 1]]}, "result": [[1.20488267875], 0, 8.129480361938477, 1638967244.5929708], "version": 0.2, "tvm_version": "0.8.dev0"}
{"input": ["cuda -keys=cuda,gpu -max_num_threads=1024 -thread_warp_size=32", "conv2d_nchw.cuda", [["TENSOR", [256, 1024, 14, 14], "float32"], ["TENSOR", [2048, 1024, 1, 1], "float32"], 2, "VALID", 1, "float32"], {}], "config": {"index": 143435, "code_hash": null, "entity": [["tile_f", "sp", [-1, 128, 2, 1]], ["tile_y", "sp", [-1, 1, 7, 1]], ["tile_x", "sp", [-1, 1, 7, 1]], ["tile_rc", "sp", [-1, 4]], ["tile_ry", "sp", [-1, 1]], ["tile_rx", "sp", [-1, 1]], ["auto_unroll_max_step", "ot", 1500], ["unroll_explicit", "ot", 0]]}, "result": [[0.014332980428571427], 0, 2.336843729019165, 1638967246.4123626], "version": 0.2, "tvm_version": "0.8.dev0"}
{"input": ["cuda -keys=cuda,gpu -max_num_threads=1024 -thread_warp_size=32", "conv2d_nchw.cuda", [["TENSOR", [256, 1024, 14, 14], "float32"], ["TENSOR", [2048, 1024, 1, 1], "float32"], 2, "VALID", 1, "float32"], {}], "config": {"index": 335645, "code_hash": null, "entity": [["tile_f", "sp", [-1, 16, 8, 1]], ["tile_y", "sp", [-1, 1, 7, 1]], ["tile_x", "sp", [-1, 1, 7, 1]], ["tile_rc", "sp", [-1, 4]], ["tile_ry", "sp", [-1, 1]], ["tile_rx", "sp", [-1, 1]], ["auto_unroll_max_step", "ot", 1500], ["unroll_explicit", "ot", 1]]}, "result": [[0.014990473428571429], 0, 2.1099436283111572, 1638967281.9193254], "version": 0.2, "tvm_version": "0.8.dev0"}
{"input": ["cuda -keys=cuda,gpu -max_num_threads=1024 -thread_warp_size=32", "conv2d_nchw.cuda", [["TENSOR", [256, 1024, 14, 14], "float32"], ["TENSOR", [2048, 1024, 1, 1], "float32"], 2, "VALID", 1, "float32"], {}], "config": {"index": 329532, "code_hash": null, "entity": [["tile_f", "sp", [-1, 16, 8, 2]], ["tile_y", "sp", [-1, 7, 1, 1]], ["tile_x", "sp", [-1, 1, 7, 1]], ["tile_rc", "sp", [-1, 2]], ["tile_ry", "sp", [-1, 1]], ["tile_rx", "sp", [-1, 1]], ["auto_unroll_max_step", "ot", 1500], ["unroll_explicit", "ot", 1]]}, "result": [[0.011224771222222223], 0, 2.3855111598968506, 1638967283.5409808], "version": 0.2, "tvm_version": "0.8.dev0"}
{"input": ["cuda -keys=cuda,gpu -max_num_threads=1024 -thread_warp_size=32", "conv2d_nchw.cuda", [["TENSOR", [256, 1024, 14, 14], "float32"], ["TENSOR", [2048, 1024, 1, 1], "float32"], 2, "VALID", 1, "float32"], {}], "config": {"index": 271581, "code_hash": null, "entity": [["tile_f", "sp", [-1, 16, 8, 1]], ["tile_y", "sp", [-1, 1, 7, 1]], ["tile_x", "sp", [-1, 1, 7, 1]], ["tile_rc", "sp", [-1, 4]], ["tile_ry", "sp", [-1, 1]], ["tile_rx", "sp", [-1, 1]], ["auto_unroll_max_step", "ot", 512], ["unroll_explicit", "ot", 1]]}, "result": [[0.01353548825], 0, 3.095446825027466, 1638967286.3986163], "version": 0.2, "tvm_version": "0.8.dev0"}
