artifacts/Table4/tvm/ansor/reduction/ansor_reduction_65536_1024_axis_1.log
{"i": [["[\"reduction_layer\", [65536, 1024], 1, false]", "rocm -keys=rocm,gpu -max_num_threads=256 -mcpu=gfx906 -mtriple=amdgcn-amd-amdhsa-hcc -thread_warp_size=64", [-1, 16, 64, 65536, 2147483647, 1024, 16, 64], "", 0, []], [[], [["SP", 1, 0, 65536, [16], 1], ["AN", 1, 0, 5], ["AN", 1, 1, 6], ["PR", 1, 0, "auto_unroll_max_step$0"]]]], "r": [[0.00196146], 0, 3.17509, 1639291506], "v": "v0.6"}
{"i": [["[\"reduction_layer\", [65536, 1024], 1, false]", "rocm -keys=rocm,gpu -max_num_threads=256 -mcpu=gfx906 -mtriple=amdgcn-amd-amdhsa-hcc -thread_warp_size=64", [-1, 16, 64, 65536, 2147483647, 1024, 16, 64], "", 0, []], [[], [["SP", 1, 1, 1024, [1], 1], ["AN", 1, 2, 6], ["AN", 1, 0, 5], ["PR", 1, 0, "auto_unroll_max_step$0"]]]], "r": [[0.00108152], 0, 3.38497, 1639291508], "v": "v0.6"}
{"i": [["[\"reduction_layer\", [65536, 1024], 1, false]", "rocm -keys=rocm,gpu -max_num_threads=256 -mcpu=gfx906 -mtriple=amdgcn-amd-amdhsa-hcc -thread_warp_size=64", [-1, 16, 64, 65536, 2147483647, 1024, 16, 64], "", 0, []], [[], [["SP", 1, 1, 1024, [1], 1], ["AN", 1, 2, 6], ["AN", 1, 0, 5], ["PR", 1, 0, "auto_unroll_max_step$16"]]]], "r": [[0.00107907], 0, 3.40609, 1639291511], "v": "v0.6"}
{"i": [["[\"reduction_layer\", [65536, 1024], 1, false]", "rocm -keys=rocm,gpu -max_num_threads=256 -mcpu=gfx906 -mtriple=amdgcn-amd-amdhsa-hcc -thread_warp_size=64", [-1, 16, 64, 65536, 2147483647, 1024, 16, 64], "", 0, []], [[], [["SP", 1, 0, 65536, [2], 1], ["AN", 1, 0, 5], ["AN", 1, 1, 6], ["PR", 1, 0, "auto_unroll_max_step$1024"]]]], "r": [[0.00178875], 0, 3.09181, 1639291514], "v": "v0.6"}
{"i": [["[\"reduction_layer\", [65536, 1024], 1, false]", "rocm -keys=rocm,gpu -max_num_threads=256 -mcpu=gfx906 -mtriple=amdgcn-amd-amdhsa-hcc -thread_warp_size=64", [-1, 16, 64, 65536, 2147483647, 1024, 16, 64], "", 0, []], [[], [["SP", 1, 1, 1024, [64], 1], ["AN", 1, 2, 6], ["AN", 1, 0, 5], ["PR", 1, 0, "auto_unroll_max_step$16"]]]], "r": [[0.0003303], 0, 3.11784, 1639291517], "v": "v0.6"}
{"i": [["[\"reduction_layer\", [65536, 1024], 1, false]", "rocm -keys=rocm,gpu -max_num_threads=256 -mcpu=gfx906 -mtriple=amdgcn-amd-amdhsa-hcc -thread_warp_size=64", [-1, 16, 64, 65536, 2147483647, 1024, 16, 64], "", 0, []], [[], [["SP", 1, 1, 1024, [2], 1], ["AN", 1, 2, 6], ["AN", 1, 0, 5], ["PR", 1, 0, "auto_unroll_max_step$512"]]]], "r": [[0.00507857], 0, 3.86359, 1639291520], "v": "v0.6"}
{"i": [["[\"reduction_layer\", [65536, 1024], 1, false]", "rocm -keys=rocm,gpu -max_num_threads=256 -mcpu=gfx906 -mtriple=amdgcn-amd-amdhsa-hcc -thread_warp_size=64", [-1, 16, 64, 65536, 2147483647, 1024, 16, 64], "", 0, []], [[], [["SP", 1, 0, 65536, [16], 1], ["AN", 1, 0, 5], ["AN", 1, 1, 6], ["PR", 1, 0, "auto_unroll_max_step$512"]]]], "r": [[0.00196744], 0, 3.64704, 1639291523], "v": "v0.6"}
{"i": [["[\"reduction_layer\", [65536, 1024], 1, false]", "rocm -keys=rocm,gpu -max_num_threads=256 -mcpu=gfx906 -mtriple=amdgcn-amd-amdhsa-hcc -thread_warp_size=64", [-1, 16, 64, 65536, 2147483647, 1024, 16, 64], "", 0, []], [[], [["SP", 1, 0, 65536, [4], 1], ["AN", 1, 0, 5], ["AN", 1, 1, 6], ["PR", 1, 0, "auto_unroll_max_step$16"]]]], "r": [[0.00103622], 0, 3.61612, 1639291525], "v": "v0.6"}
{"i": [["[\"reduction_layer\", [65536, 1024], 1, false]", "rocm -keys=rocm,gpu -max_num_threads=256 -mcpu=gfx906 -mtriple=amdgcn-amd-amdhsa-hcc -thread_warp_size=64", [-1, 16, 64, 65536, 2147483647, 1024, 16, 64], "", 0, []], [[], [["SP", 1, 0, 65536, [2], 1], ["AN", 1, 0, 5], ["AN", 1, 1, 6], ["PR", 1, 0, "auto_unroll_max_step$0"]]]], "r": [[0.00180784], 0, 3.57371, 1639291528], "v": "v0.6"}
{"i": [["[\"reduction_layer\", [65536, 1024], 1, false]", "rocm -keys=rocm,gpu -max_num_threads=256 -mcpu=gfx906 -mtriple=amdgcn-amd-amdhsa-hcc -thread_warp_size=64", [-1, 16, 64, 65536, 2147483647, 1024, 16, 64], "", 0, []], [[], [["SP", 1, 0, 65536, [16], 1], ["AN", 1, 0, 5], ["AN", 1, 1, 6], ["PR", 1, 0, "auto_unroll_max_step$64"]]]], "r": [[0.00197772], 0, 3.30755, 1639291531], "v": "v0.6"}
{"i": [["[\"reduction_layer\", [65536, 1024], 1, false]", "rocm -keys=rocm,gpu -max_num_threads=256 -mcpu=gfx906 -mtriple=amdgcn-amd-amdhsa-hcc -thread_warp_size=64", [-1, 16, 64, 65536, 2147483647, 1024, 16, 64], "", 0, []], [[], [["SP", 1, 1, 1024, [32], 1], ["AN", 1, 2, 6], ["AN", 1, 0, 5], ["PR", 1, 0, "auto_unroll_max_step$64"]]]], "r": [[0.000350581], 0, 3.60927, 1639291534], "v": "v0.6"}
{"i": [["[\"reduction_layer\", [65536, 1024], 1, false]", "rocm -keys=rocm,gpu -max_num_threads=256 -mcpu=gfx906 -mtriple=amdgcn-amd-amdhsa-hcc -thread_warp_size=64", [-1, 16, 64, 65536, 2147483647, 1024, 16, 64], "", 0, []], [[], [["SP", 1, 0, 65536, [32], 1], ["AN", 1, 0, 5], ["AN", 1, 1, 6], ["PR", 1, 0, "auto_unroll_max_step$16"]]]], "r": [[0.00213234], 0, 3.13135, 1639291537], "v": "v0.6"}
{"i": [["[\"reduction_layer\", [65536, 1024], 1, false]", "rocm -keys=rocm,gpu -max_num_threads=256 -mcpu=gfx906 -mtriple=amdgcn-amd-amdhsa-hcc -thread_warp_size=64", [-1, 16, 64, 65536, 2147483647, 1024, 16, 64], "", 0, []], [[], [["SP", 1, 0, 65536, [1], 1], ["AN", 1, 0, 5], ["AN", 1, 1, 6], ["PR", 1, 0, "auto_unroll_max_step$512"]]]], "r": [[0.00107877], 0, 3.6676, 1639291540], "v": "v0.6"}
{"i": [["[\"reduction_layer\", [65536, 1024], 1, false]", "rocm -keys=rocm,gpu -max_num_threads=256 -mcpu=gfx906 -mtriple=amdgcn-amd-amdhsa-hcc -thread_warp_size=64", [-1, 16, 64, 65536, 2147483647, 1024, 16, 64], "", 0, []], [[], [["SP", 1, 1, 1024, [64], 1], ["AN", 1, 2, 6], ["AN", 1, 0, 5], ["PR", 1, 0, "auto_unroll_max_step$64"]]]], "r": [[0.000327212], 0, 3.65337, 1639291542], "v": "v0.6"}
{"i": [["[\"reduction_layer\", [65536, 1024], 1, false]", "rocm -keys=rocm,gpu -max_num_threads=256 -mcpu=gfx906 -mtriple=amdgcn-amd-amdhsa-hcc -thread_warp_size=64", [-1, 16, 64, 65536, 2147483647, 1024, 16, 64], "", 0, []], [[], [["SP", 1, 0, 65536, [2], 1], ["AN", 1, 0, 5], ["AN", 1, 1, 6], ["PR", 1, 0, "auto_unroll_max_step$16"]]]], "r": [[0.00178904], 0, 3.68539, 1639291545], "v": "v0.6"}
{"i": [["[\"reduction_layer\", [65536, 1024], 1, false]", "rocm -keys=rocm,gpu -max_num_threads=256 -mcpu=gfx906 -mtriple=amdgcn-amd-amdhsa-hcc -thread_warp_size=64", [-1, 16, 64, 65536, 2147483647, 1024, 16, 64], "", 0, []], [[], [["SP", 1, 1, 1024, [64], 1], ["AN", 1, 2, 6], ["AN", 1, 0, 5], ["PR", 1, 0, "auto_unroll_max_step$512"]]]], "r": [[0.000328678], 0, 3.39632, 1639291548], "v": "v0.6"}
{"i": [["[\"reduction_layer\", [65536, 1024], 1, false]", "rocm -keys=rocm,gpu -max_num_threads=256 -mcpu=gfx906 -mtriple=amdgcn-amd-amdhsa-hcc -thread_warp_size=64", [-1, 16, 64, 65536, 2147483647, 1024, 16, 64], "", 0, []], [[], [["SP", 1, 1, 1024, [8], 1], ["AN", 1, 2, 6], ["AN", 1, 0, 5], ["PR", 1, 0, "auto_unroll_max_step$1024"]]]], "r": [[0.00152564], 0, 3.58762, 1639291551], "v": "v0.6"}
{"i": [["[\"reduction_layer\", [65536, 1024], 1, false]", "rocm -keys=rocm,gpu -max_num_threads=256 -mcpu=gfx906 -mtriple=amdgcn-amd-amdhsa-hcc -thread_warp_size=64", [-1, 16, 64, 65536, 2147483647, 1024, 16, 64], "", 0, []], [[], [["SP", 1, 0, 65536, [1], 1], ["AN", 1, 0, 5], ["AN", 1, 1, 6], ["PR", 1, 0, "auto_unroll_max_step$0"]]]], "r": [[0.00107975], 0, 3.3057, 1639291554], "v": "v0.6"}
{"i": [["[\"reduction_layer\", [65536, 1024], 1, false]", "rocm -keys=rocm,gpu -max_num_threads=256 -mcpu=gfx906 -mtriple=amdgcn-amd-amdhsa-hcc -thread_warp_size=64", [-1, 16, 64, 65536, 2147483647, 1024, 16, 64], "", 0, []], [[], [["SP", 1, 0, 65536, [2], 1], ["AN", 1, 0, 5], ["AN", 1, 1, 6], ["PR", 1, 0, "auto_unroll_max_step$512"]]]], "r": [[0.00179457], 0, 3.59473, 1639291557], "v": "v0.6"}
{"i": [["[\"reduction_layer\", [65536, 1024], 1, false]", "rocm -keys=rocm,gpu -max_num_threads=256 -mcpu=gfx906 -mtriple=amdgcn-amd-amdhsa-hcc -thread_warp_size=64", [-1, 16, 64, 65536, 2147483647, 1024, 16, 64], "", 0, []], [[], [["SP", 1, 1, 1024, [8], 1], ["AN", 1, 2, 6], ["AN", 1, 0, 5], ["PR", 1, 0, "auto_unroll_max_step$16"]]]], "r": [[0.00152438], 0, 3.48513, 1639291559], "v": "v0.6"}
{"i": [["[\"reduction_layer\", [65536, 1024], 1, false]", "rocm -keys=rocm,gpu -max_num_threads=256 -mcpu=gfx906 -mtriple=amdgcn-amd-amdhsa-hcc -thread_warp_size=64", [-1, 16, 64, 65536, 2147483647, 1024, 16, 64], "", 0, []], [[], [["SP", 1, 1, 1024, [1], 1], ["AN", 1, 2, 6], ["AN", 1, 0, 5], ["PR", 1, 0, "auto_unroll_max_step$64"]]]], "r": [[0.0010795], 0, 3.60993, 1639291562], "v": "v0.6"}
{"i": [["[\"reduction_layer\", [65536, 1024], 1, false]", "rocm -keys=rocm,gpu -max_num_threads=256 -mcpu=gfx906 -mtriple=amdgcn-amd-amdhsa-hcc -thread_warp_size=64", [-1, 16, 64, 65536, 2147483647, 1024, 16, 64], "", 0, []], [[], [["SP", 1, 1, 1024, [32], 1], ["AN", 1, 2, 6], ["AN", 1, 0, 5], ["PR", 1, 0, "auto_unroll_max_step$0"]]]], "r": [[0.000347743], 0, 3.45722, 1639291565], "v": "v0.6"}
{"i": [["[\"reduction_layer\", [65536, 1024], 1, false]", "rocm -keys=rocm,gpu -max_num_threads=256 -mcpu=gfx906 -mtriple=amdgcn-amd-amdhsa-hcc -thread_warp_size=64", [-1, 16, 64, 65536, 2147483647, 1024, 16, 64], "", 0, []], [[], [["SP", 1, 0, 65536, [8], 1], ["AN", 1, 0, 5], ["AN", 1, 1, 6], ["PR", 1, 0, "auto_unroll_max_step$64"]]]], "r": [[0.00183684], 0, 3.59195, 1639291568], "v": "v0.6"}
{"i": [["[\"reduction_layer\", [65536, 1024], 1, false]", "rocm -keys=rocm,gpu -max_num_threads=256 -mcpu=gfx906 -mtriple=amdgcn-amd-amdhsa-hcc -thread_warp_size=64", [-1, 16, 64, 65536, 2147483647, 1024, 16, 64], "", 0, []], [[], [["SP", 1, 1, 1024, [32], 1], ["AN", 1, 2, 6], ["AN", 1, 0, 5], ["PR", 1, 0, "auto_unroll_max_step$512"]]]], "r": [[0.000341083], 0, 3.6719, 1639291571], "v": "v0.6"}
{"i": [["[\"reduction_layer\", [65536, 1024], 1, false]", "rocm -keys=rocm,gpu -max_num_threads=256 -mcpu=gfx906 -mtriple=amdgcn-amd-amdhsa-hcc -thread_warp_size=64", [-1, 16, 64, 65536, 2147483647, 1024, 16, 64], "", 0, []], [[], [["SP", 1, 0, 65536, [32], 1], ["AN", 1, 0, 5], ["AN", 1, 1, 6], ["PR", 1, 0, "auto_unroll_max_step$1024"]]]], "r": [[0.00216327], 0, 3.62873, 1639291574], "v": "v0.6"}
{"i": [["[\"reduction_layer\", [65536, 1024], 1, false]", "rocm -keys=rocm,gpu -max_num_threads=256 -mcpu=gfx906 -mtriple=amdgcn-amd-amdhsa-hcc -thread_warp_size=64", [-1, 16, 64, 65536, 2147483647, 1024, 16, 64], "", 0, []], [[], [["SP", 1, 0, 65536, [8], 1], ["AN", 1, 0, 5], ["AN", 1, 1, 6], ["PR", 1, 0, "auto_unroll_max_step$512"]]]], "r": [[0.00183149], 0, 3.59304, 1639291576], "v": "v0.6"}
{"i": [["[\"reduction_layer\", [65536, 1024], 1, false]", "rocm -keys=rocm,gpu -max_num_threads=256 -mcpu=gfx906 -mtriple=amdgcn-amd-amdhsa-hcc -thread_warp_size=64", [-1, 16, 64, 65536, 2147483647, 1024, 16, 64], "", 0, []], [[], [["SP", 1, 1, 1024, [32], 1], ["AN", 1, 2, 6], ["AN", 1, 0, 5], ["PR", 1, 0, "auto_unroll_max_step$16"]]]], "r": [[0.000347921], 0, 3.55888, 1639291579], "v": "v0.6"}
{"i": [["[\"reduction_layer\", [65536, 1024], 1, false]", "rocm -keys=rocm,gpu -max_num_threads=256 -mcpu=gfx906 -mtriple=amdgcn-amd-amdhsa-hcc -thread_warp_size=64", [-1, 16, 64, 65536, 2147483647, 1024, 16, 64], "", 0, []], [[], [["SP", 1, 1, 1024, [64], 1], ["AN", 1, 2, 6], ["AN", 1, 0, 5], ["PR", 1, 0, "auto_unroll_max_step$0"]]]], "r": [[0.000331171], 0, 3.62083, 1639291582], "v": "v0.6"}
{"i": [["[\"reduction_layer\", [65536, 1024], 1, false]", "rocm -keys=rocm,gpu -max_num_threads=256 -mcpu=gfx906 -mtriple=amdgcn-amd-amdhsa-hcc -thread_warp_size=64", [-1, 16, 64, 65536, 2147483647, 1024, 16, 64], "", 0, []], [[], [["SP", 1, 0, 65536, [4], 1], ["AN", 1, 0, 5], ["AN", 1, 1, 6], ["PR", 1, 0, "auto_unroll_max_step$0"]]]], "r": [[0.00103497], 0, 3.61728, 1639291585], "v": "v0.6"}
{"i": [["[\"reduction_layer\", [65536, 1024], 1, false]", "rocm -keys=rocm,gpu -max_num_threads=256 -mcpu=gfx906 -mtriple=amdgcn-amd-amdhsa-hcc -thread_warp_size=64", [-1, 16, 64, 65536, 2147483647, 1024, 16, 64], "", 0, []], [[], [["SP", 1, 0, 65536, [64], 1], ["AN", 1, 0, 5], ["AN", 1, 1, 6], ["PR", 1, 0, "auto_unroll_max_step$512"]]]], "r": [[0.00307651], 0, 3.55756, 1639291588], "v": "v0.6"}
{"i": [["[\"reduction_layer\", [65536, 1024], 1, false]", "rocm -keys=rocm,gpu -max_num_threads=256 -mcpu=gfx906 -mtriple=amdgcn-amd-amdhsa-hcc -thread_warp_size=64", [-1, 16, 64, 65536, 2147483647, 1024, 16, 64], "", 0, []], [[], [["SP", 1, 1, 1024, [8], 1], ["AN", 1, 2, 6], ["AN", 1, 0, 5], ["PR", 1, 0, "auto_unroll_max_step$0"]]]], "r": [[0.00152501], 0, 3.38205, 1639291591], "v": "v0.6"}
{"i": [["[\"reduction_layer\", [65536, 1024], 1, false]", "rocm -keys=rocm,gpu -max_num_threads=256 -mcpu=gfx906 -mtriple=amdgcn-amd-amdhsa-hcc -thread_warp_size=64", [-1, 16, 64, 65536, 2147483647, 1024, 16, 64], "", 0, []], [[], [["SP", 1, 1, 1024, [4], 1], ["AN", 1, 2, 6], ["AN", 1, 0, 5], ["PR", 1, 0, "auto_unroll_max_step$1024"]]]], "r": [[0.00277709], 0, 3.64205, 1639291594], "v": "v0.6"}
{"i": [["[\"reduction_layer\", [65536, 1024], 1, false]", "rocm -keys=rocm,gpu -max_num_threads=256 -mcpu=gfx906 -mtriple=amdgcn-amd-amdhsa-hcc -thread_warp_size=64", [-1, 16, 64, 65536, 2147483647, 1024, 16, 64], "", 0, []], [[], [["SP", 1, 0, 65536, [8], 1], ["AN", 1, 0, 5], ["AN", 1, 1, 6], ["PR", 1, 0, "auto_unroll_max_step$1024"]]]], "r": [[0.00181315], 0, 3.19668, 1639291596], "v": "v0.6"}
{"i": [["[\"reduction_layer\", [65536, 1024], 1, false]", "rocm -keys=rocm,gpu -max_num_threads=256 -mcpu=gfx906 -mtriple=amdgcn-amd-amdhsa-hcc -thread_warp_size=64", [-1, 16, 64, 65536, 2147483647, 1024, 16, 64], "", 0, []], [[], [["SP", 1, 1, 1024, [1], 1], ["AN", 1, 2, 6], ["AN", 1, 0, 5], ["PR", 1, 0, "auto_unroll_max_step$1024"]]]], "r": [[0.00107969], 0, 3.52434, 1639291599], "v": "v0.6"}
{"i": [["[\"reduction_layer\", [65536, 1024], 1, false]", "rocm -keys=rocm,gpu -max_num_threads=256 -mcpu=gfx906 -mtriple=amdgcn-amd-amdhsa-hcc -thread_warp_size=64", [-1, 16, 64, 65536, 2147483647, 1024, 16, 64], "", 0, []], [[], [["SP", 1, 1, 1024, [16], 1], ["AN", 1, 2, 6], ["AN", 1, 0, 5], ["PR", 1, 0, "auto_unroll_max_step$16"]]]], "r": [[0.000859527], 0, 3.40085, 1639291602], "v": "v0.6"}
{"i": [["[\"reduction_layer\", [65536, 1024], 1, false]", "rocm -keys=rocm,gpu -max_num_threads=256 -mcpu=gfx906 -mtriple=amdgcn-amd-amdhsa-hcc -thread_warp_size=64", [-1, 16, 64, 65536, 2147483647, 1024, 16, 64], "", 0, []], [[], [["SP", 1, 1, 1024, [4], 1], ["AN", 1, 2, 6], ["AN", 1, 0, 5], ["PR", 1, 0, "auto_unroll_max_step$16"]]]], "r": [[0.00277685], 0, 3.71909, 1639291605], "v": "v0.6"}
{"i": [["[\"reduction_layer\", [65536, 1024], 1, false]", "rocm -keys=rocm,gpu -max_num_threads=256 -mcpu=gfx906 -mtriple=amdgcn-amd-amdhsa-hcc -thread_warp_size=64", [-1, 16, 64, 65536, 2147483647, 1024, 16, 64], "", 0, []], [[], [["SP", 1, 0, 65536, [32], 1], ["AN", 1, 0, 5], ["AN", 1, 1, 6], ["PR", 1, 0, "auto_unroll_max_step$512"]]]], "r": [[0.00214174], 0, 3.58602, 1639291608], "v": "v0.6"}
{"i": [["[\"reduction_layer\", [65536, 1024], 1, false]", "rocm -keys=rocm,gpu -max_num_threads=256 -mcpu=gfx906 -mtriple=amdgcn-amd-amdhsa-hcc -thread_warp_size=64", [-1, 16, 64, 65536, 2147483647, 1024, 16, 64], "", 0, []], [[], [["SP", 1, 1, 1024, [16], 1], ["AN", 1, 2, 6], ["AN", 1, 0, 5], ["PR", 1, 0, "auto_unroll_max_step$1024"]]]], "r": [[0.000860618], 0, 3.67607, 1639291611], "v": "v0.6"}
{"i": [["[\"reduction_layer\", [65536, 1024], 1, false]", "rocm -keys=rocm,gpu -max_num_threads=256 -mcpu=gfx906 -mtriple=amdgcn-amd-amdhsa-hcc -thread_warp_size=64", [-1, 16, 64, 65536, 2147483647, 1024, 16, 64], "", 0, []], [[], [["SP", 1, 1, 1024, [4], 1], ["AN", 1, 2, 6], ["AN", 1, 0, 5], ["PR", 1, 0, "auto_unroll_max_step$0"]]]], "r": [[0.00277519], 0, 3.66954, 1639291614], "v": "v0.6"}
{"i": [["[\"reduction_layer\", [65536, 1024], 1, false]", "rocm -keys=rocm,gpu -max_num_threads=256 -mcpu=gfx906 -mtriple=amdgcn-amd-amdhsa-hcc -thread_warp_size=64", [-1, 16, 64, 65536, 2147483647, 1024, 16, 64], "", 0, []], [[], [["SP", 1, 0, 65536, [8], 1], ["AN", 1, 0, 5], ["AN", 1, 1, 6], ["PR", 1, 0, "auto_unroll_max_step$16"]]]], "r": [[0.00181845], 0, 3.50456, 1639291616], "v": "v0.6"}
{"i": [["[\"reduction_layer\", [65536, 1024], 1, false]", "rocm -keys=rocm,gpu -max_num_threads=256 -mcpu=gfx906 -mtriple=amdgcn-amd-amdhsa-hcc -thread_warp_size=64", [-1, 16, 64, 65536, 2147483647, 1024, 16, 64], "", 0, []], [[], [["SP", 1, 0, 65536, [1], 1], ["AN", 1, 0, 5], ["AN", 1, 1, 6], ["PR", 1, 0, "auto_unroll_max_step$1024"]]]], "r": [[0.00108267], 0, 3.47497, 1639291619], "v": "v0.6"}
{"i": [["[\"reduction_layer\", [65536, 1024], 1, false]", "rocm -keys=rocm,gpu -max_num_threads=256 -mcpu=gfx906 -mtriple=amdgcn-amd-amdhsa-hcc -thread_warp_size=64", [-1, 16, 64, 65536, 2147483647, 1024, 16, 64], "", 0, []], [[], [["SP", 1, 1, 1024, [8], 1], ["AN", 1, 2, 6], ["AN", 1, 0, 5], ["PR", 1, 0, "auto_unroll_max_step$512"]]]], "r": [[0.00152466], 0, 3.41119, 1639291622], "v": "v0.6"}
{"i": [["[\"reduction_layer\", [65536, 1024], 1, false]", "rocm -keys=rocm,gpu -max_num_threads=256 -mcpu=gfx906 -mtriple=amdgcn-amd-amdhsa-hcc -thread_warp_size=64", [-1, 16, 64, 65536, 2147483647, 1024, 16, 64], "", 0, []], [[], [["SP", 1, 0, 65536, [32], 1], ["AN", 1, 0, 5], ["AN", 1, 1, 6], ["PR", 1, 0, "auto_unroll_max_step$64"]]]], "r": [[0.00216146], 0, 3.10191, 1639291625], "v": "v0.6"}
{"i": [["[\"reduction_layer\", [65536, 1024], 1, false]", "rocm -keys=rocm,gpu -max_num_threads=256 -mcpu=gfx906 -mtriple=amdgcn-amd-amdhsa-hcc -thread_warp_size=64", [-1, 16, 64, 65536, 2147483647, 1024, 16, 64], "", 0, []], [[], [["SP", 1, 0, 65536, [2], 1], ["AN", 1, 0, 5], ["AN", 1, 1, 6], ["PR", 1, 0, "auto_unroll_max_step$64"]]]], "r": [[0.00179312], 0, 3.59599, 1639291628], "v": "v0.6"}
{"i": [["[\"reduction_layer\", [65536, 1024], 1, false]", "rocm -keys=rocm,gpu -max_num_threads=256 -mcpu=gfx906 -mtriple=amdgcn-amd-amdhsa-hcc -thread_warp_size=64", [-1, 16, 64, 65536, 2147483647, 1024, 16, 64], "", 0, []], [[], [["SP", 1, 1, 1024, [16], 1], ["AN", 1, 2, 6], ["AN", 1, 0, 5], ["PR", 1, 0, "auto_unroll_max_step$512"]]]], "r": [[0.000859495], 0, 3.70636, 1639291630], "v": "v0.6"}
{"i": [["[\"reduction_layer\", [65536, 1024], 1, false]", "rocm -keys=rocm,gpu -max_num_threads=256 -mcpu=gfx906 -mtriple=amdgcn-amd-amdhsa-hcc -thread_warp_size=64", [-1, 16, 64, 65536, 2147483647, 1024, 16, 64], "", 0, []], [[], [["SP", 1, 0, 65536, [4], 1], ["AN", 1, 0, 5], ["AN", 1, 1, 6], ["PR", 1, 0, "auto_unroll_max_step$512"]]]], "r": [[0.0010501], 0, 3.5071, 1639291633], "v": "v0.6"}
{"i": [["[\"reduction_layer\", [65536, 1024], 1, false]", "rocm -keys=rocm,gpu -max_num_threads=256 -mcpu=gfx906 -mtriple=amdgcn-amd-amdhsa-hcc -thread_warp_size=64", [-1, 16, 64, 65536, 2147483647, 1024, 16, 64], "", 0, []], [[], [["SP", 1, 1, 1024, [4], 1], ["AN", 1, 2, 6], ["AN", 1, 0, 5], ["PR", 1, 0, "auto_unroll_max_step$512"]]]], "r": [[0.00280222], 0, 3.50688, 1639291636], "v": "v0.6"}
{"i": [["[\"reduction_layer\", [65536, 1024], 1, false]", "rocm -keys=rocm,gpu -max_num_threads=256 -mcpu=gfx906 -mtriple=amdgcn-amd-amdhsa-hcc -thread_warp_size=64", [-1, 16, 64, 65536, 2147483647, 1024, 16, 64], "", 0, []], [[], [["SP", 1, 0, 65536, [1], 1], ["AN", 1, 0, 5], ["AN", 1, 1, 6], ["PR", 1, 0, "auto_unroll_max_step$64"]]]], "r": [[0.00105631], 0, 3.43091, 1639291639], "v": "v0.6"}
{"i": [["[\"reduction_layer\", [65536, 1024], 1, false]", "rocm -keys=rocm,gpu -max_num_threads=256 -mcpu=gfx906 -mtriple=amdgcn-amd-amdhsa-hcc -thread_warp_size=64", [-1, 16, 64, 65536, 2147483647, 1024, 16, 64], "", 0, []], [[], [["SP", 1, 0, 65536, [64], 1], ["AN", 1, 0, 5], ["AN", 1, 1, 6], ["PR", 1, 0, "auto_unroll_max_step$64"]]]], "r": [[0.00306148], 0, 3.10318, 1639291642], "v": "v0.6"}
{"i": [["[\"reduction_layer\", [65536, 1024], 1, false]", "rocm -keys=rocm,gpu -max_num_threads=256 -mcpu=gfx906 -mtriple=amdgcn-amd-amdhsa-hcc -thread_warp_size=64", [-1, 16, 64, 65536, 2147483647, 1024, 16, 64], "", 0, []], [[], [["SP", 1, 0, 65536, [64], 1], ["AN", 1, 0, 5], ["AN", 1, 1, 6], ["PR", 1, 0, "auto_unroll_max_step$0"]]]], "r": [[0.00306069], 0, 3.02043, 1639291645], "v": "v0.6"}
{"i": [["[\"reduction_layer\", [65536, 1024], 1, false]", "rocm -keys=rocm,gpu -max_num_threads=256 -mcpu=gfx906 -mtriple=amdgcn-amd-amdhsa-hcc -thread_warp_size=64", [-1, 16, 64, 65536, 2147483647, 1024, 16, 64], "", 0, []], [[], [["SP", 1, 0, 65536, [8], 1], ["AN", 1, 0, 5], ["AN", 1, 1, 6], ["PR", 1, 0, "auto_unroll_max_step$0"]]]], "r": [[0.00181301], 0, 3.12803, 1639291648], "v": "v0.6"}
{"i": [["[\"reduction_layer\", [65536, 1024], 1, false]", "rocm -keys=rocm,gpu -max_num_threads=256 -mcpu=gfx906 -mtriple=amdgcn-amd-amdhsa-hcc -thread_warp_size=64", [-1, 16, 64, 65536, 2147483647, 1024, 16, 64], "", 0, []], [[], [["SP", 1, 1, 1024, [32], 1], ["AN", 1, 2, 6], ["AN", 1, 0, 5], ["PR", 1, 0, "auto_unroll_max_step$1024"]]]], "r": [[0.000348162], 0, 3.10571, 1639291651], "v": "v0.6"}
{"i": [["[\"reduction_layer\", [65536, 1024], 1, false]", "rocm -keys=rocm,gpu -max_num_threads=256 -mcpu=gfx906 -mtriple=amdgcn-amd-amdhsa-hcc -thread_warp_size=64", [-1, 16, 64, 65536, 2147483647, 1024, 16, 64], "", 0, []], [[], [["SP", 1, 1, 1024, [2], 1], ["AN", 1, 2, 6], ["AN", 1, 0, 5], ["PR", 1, 0, "auto_unroll_max_step$64"]]]], "r": [[0.00506634], 0, 3.09855, 1639291653], "v": "v0.6"}
{"i": [["[\"reduction_layer\", [65536, 1024], 1, false]", "rocm -keys=rocm,gpu -max_num_threads=256 -mcpu=gfx906 -mtriple=amdgcn-amd-amdhsa-hcc -thread_warp_size=64", [-1, 16, 64, 65536, 2147483647, 1024, 16, 64], "", 0, []], [[], [["SP", 1, 1, 1024, [16], 1], ["AN", 1, 2, 6], ["AN", 1, 0, 5], ["PR", 1, 0, "auto_unroll_max_step$64"]]]], "r": [[0.000861795], 0, 3.06075, 1639291656], "v": "v0.6"}
{"i": [["[\"reduction_layer\", [65536, 1024], 1, false]", "rocm -keys=rocm,gpu -max_num_threads=256 -mcpu=gfx906 -mtriple=amdgcn-amd-amdhsa-hcc -thread_warp_size=64", [-1, 16, 64, 65536, 2147483647, 1024, 16, 64], "", 0, []], [[], [["SP", 1, 1, 1024, [4], 1], ["AN", 1, 2, 6], ["AN", 1, 0, 5], ["PR", 1, 0, "auto_unroll_max_step$64"]]]], "r": [[0.00277936], 0, 3.14562, 1639291659], "v": "v0.6"}
{"i": [["[\"reduction_layer\", [65536, 1024], 1, false]", "rocm -keys=rocm,gpu -max_num_threads=256 -mcpu=gfx906 -mtriple=amdgcn-amd-amdhsa-hcc -thread_warp_size=64", [-1, 16, 64, 65536, 2147483647, 1024, 16, 64], "", 0, []], [[], [["SP", 1, 1, 1024, [8], 1], ["AN", 1, 2, 6], ["AN", 1, 0, 5], ["PR", 1, 0, "auto_unroll_max_step$64"]]]], "r": [[0.00152591], 0, 3.05661, 1639291662], "v": "v0.6"}
{"i": [["[\"reduction_layer\", [65536, 1024], 1, false]", "rocm -keys=rocm,gpu -max_num_threads=256 -mcpu=gfx906 -mtriple=amdgcn-amd-amdhsa-hcc -thread_warp_size=64", [-1, 16, 64, 65536, 2147483647, 1024, 16, 64], "", 0, []], [[], [["SP", 1, 0, 65536, [32], 1], ["AN", 1, 0, 5], ["AN", 1, 1, 6], ["PR", 1, 0, "auto_unroll_max_step$0"]]]], "r": [[0.00214018], 0, 3.11277, 1639291665], "v": "v0.6"}
{"i": [["[\"reduction_layer\", [65536, 1024], 1, false]", "rocm -keys=rocm,gpu -max_num_threads=256 -mcpu=gfx906 -mtriple=amdgcn-amd-amdhsa-hcc -thread_warp_size=64", [-1, 16, 64, 65536, 2147483647, 1024, 16, 64], "", 0, []], [[], [["SP", 1, 1, 1024, [16], 1], ["AN", 1, 2, 6], ["AN", 1, 0, 5], ["PR", 1, 0, "auto_unroll_max_step$0"]]]], "r": [[0.000859578], 0, 2.97404, 1639291668], "v": "v0.6"}
{"i": [["[\"reduction_layer\", [65536, 1024], 1, false]", "rocm -keys=rocm,gpu -max_num_threads=256 -mcpu=gfx906 -mtriple=amdgcn-amd-amdhsa-hcc -thread_warp_size=64", [-1, 16, 64, 65536, 2147483647, 1024, 16, 64], "", 0, []], [[], [["SP", 1, 0, 65536, [16], 1], ["AN", 1, 0, 5], ["AN", 1, 1, 6], ["PR", 1, 0, "auto_unroll_max_step$1024"]]]], "r": [[0.00195706], 0, 3.09717, 1639291671], "v": "v0.6"}
{"i": [["[\"reduction_layer\", [65536, 1024], 1, false]", "rocm -keys=rocm,gpu -max_num_threads=256 -mcpu=gfx906 -mtriple=amdgcn-amd-amdhsa-hcc -thread_warp_size=64", [-1, 16, 64, 65536, 2147483647, 1024, 16, 64], "", 0, []], [[], [["SP", 1, 1, 1024, [64], 1], ["AN", 1, 2, 6], ["AN", 1, 0, 5], ["PR", 1, 0, "auto_unroll_max_step$1024"]]]], "r": [[0.000328956], 0, 3.04962, 1639291673], "v": "v0.6"}
{"i": [["[\"reduction_layer\", [65536, 1024], 1, false]", "rocm -keys=rocm,gpu -max_num_threads=256 -mcpu=gfx906 -mtriple=amdgcn-amd-amdhsa-hcc -thread_warp_size=64", [-1, 16, 64, 65536, 2147483647, 1024, 16, 64], "", 0, []], [[], [["SP", 1, 0, 65536, [64], 1], ["AN", 1, 0, 5], ["AN", 1, 1, 6], ["PR", 1, 0, "auto_unroll_max_step$16"]]]], "r": [[0.00308347], 0, 3.11787, 1639291676], "v": "v0.6"}
{"i": [["[\"reduction_layer\", [65536, 1024], 1, false]", "rocm -keys=rocm,gpu -max_num_threads=256 -mcpu=gfx906 -mtriple=amdgcn-amd-amdhsa-hcc -thread_warp_size=64", [-1, 16, 64, 65536, 2147483647, 1024, 16, 64], "", 0, []], [[], [["SP", 1, 1, 1024, [1], 1], ["AN", 1, 2, 6], ["AN", 1, 0, 5], ["PR", 1, 0, "auto_unroll_max_step$512"]]]], "r": [[0.00107838], 0, 3.09582, 1639291679], "v": "v0.6"}
{"i": [["[\"reduction_layer\", [65536, 1024], 1, false]", "rocm -keys=rocm,gpu -max_num_threads=256 -mcpu=gfx906 -mtriple=amdgcn-amd-amdhsa-hcc -thread_warp_size=64", [-1, 16, 64, 65536, 2147483647, 1024, 16, 64], "", 0, []], [[], [["SP", 1, 0, 65536, [4], 1], ["AN", 1, 0, 5], ["AN", 1, 1, 6], ["PR", 1, 0, "auto_unroll_max_step$64"]]]], "r": [[0.0010451], 0, 2.92126, 1639291682], "v": "v0.6"}
{"i": [["[\"reduction_layer\", [65536, 1024], 1, false]", "rocm -keys=rocm,gpu -max_num_threads=256 -mcpu=gfx906 -mtriple=amdgcn-amd-amdhsa-hcc -thread_warp_size=64", [-1, 16, 64, 65536, 2147483647, 1024, 16, 64], "", 0, []], [[], [["SP", 1, 0, 65536, [16], 1], ["AN", 1, 0, 5], ["AN", 1, 1, 6], ["PR", 1, 0, "auto_unroll_max_step$16"]]]], "r": [[0.00196421], 0, 2.94389, 1639291685], "v": "v0.6"}
{"i": [["[\"reduction_layer\", [65536, 1024], 1, false]", "rocm -keys=rocm,gpu -max_num_threads=256 -mcpu=gfx906 -mtriple=amdgcn-amd-amdhsa-hcc -thread_warp_size=64", [-1, 16, 64, 65536, 2147483647, 1024, 16, 64], "", 0, []], [[], [["SP", 1, 1, 1024, [2], 1], ["AN", 1, 2, 6], ["AN", 1, 0, 5], ["PR", 1, 0, "auto_unroll_max_step$16"]]]], "r": [[0.00509526], 0, 3.1323, 1639291692], "v": "v0.6"}
{"i": [["[\"reduction_layer\", [65536, 1024], 1, false]", "rocm -keys=rocm,gpu -max_num_threads=256 -mcpu=gfx906 -mtriple=amdgcn-amd-amdhsa-hcc -thread_warp_size=64", [-1, 16, 64, 65536, 2147483647, 1024, 16, 64], "", 0, []], [[], [["SP", 1, 1, 1024, [2], 1], ["AN", 1, 2, 6], ["AN", 1, 0, 5], ["PR", 1, 0, "auto_unroll_max_step$0"]]]], "r": [[0.00511117], 0, 3.07404, 1639291695], "v": "v0.6"}
{"i": [["[\"reduction_layer\", [65536, 1024], 1, false]", "rocm -keys=rocm,gpu -max_num_threads=256 -mcpu=gfx906 -mtriple=amdgcn-amd-amdhsa-hcc -thread_warp_size=64", [-1, 16, 64, 65536, 2147483647, 1024, 16, 64], "", 0, []], [[], [["SP", 1, 0, 65536, [4], 1], ["AN", 1, 0, 5], ["AN", 1, 1, 6], ["PR", 1, 0, "auto_unroll_max_step$1024"]]]], "r": [[0.00103632], 0, 2.97869, 1639291698], "v": "v0.6"}
{"i": [["[\"reduction_layer\", [65536, 1024], 1, false]", "rocm -keys=rocm,gpu -max_num_threads=256 -mcpu=gfx906 -mtriple=amdgcn-amd-amdhsa-hcc -thread_warp_size=64", [-1, 16, 64, 65536, 2147483647, 1024, 16, 64], "", 0, []], [[], [["SP", 1, 0, 65536, [64], 1], ["AN", 1, 0, 5], ["AN", 1, 1, 6], ["PR", 1, 0, "auto_unroll_max_step$1024"]]]], "r": [[0.00307739], 0, 3.03815, 1639291701], "v": "v0.6"}
{"i": [["[\"reduction_layer\", [65536, 1024], 1, false]", "rocm -keys=rocm,gpu -max_num_threads=256 -mcpu=gfx906 -mtriple=amdgcn-amd-amdhsa-hcc -thread_warp_size=64", [-1, 16, 64, 65536, 2147483647, 1024, 16, 64], "", 0, []], [[], [["SP", 1, 1, 1024, [2], 1], ["AN", 1, 2, 6], ["AN", 1, 0, 5], ["PR", 1, 0, "auto_unroll_max_step$1024"]]]], "r": [[0.00507201], 0, 3.14219, 1639291704], "v": "v0.6"}
{"i": [["[\"reduction_layer\", [65536, 1024], 1, false]", "rocm -keys=rocm,gpu -max_num_threads=256 -mcpu=gfx906 -mtriple=amdgcn-amd-amdhsa-hcc -thread_warp_size=64", [-1, 16, 64, 65536, 2147483647, 1024, 16, 64], "", 0, []], [[], [["SP", 1, 0, 65536, [1], 1], ["AN", 1, 0, 5], ["AN", 1, 1, 6], ["PR", 1, 0, "auto_unroll_max_step$16"]]]], "r": [[0.00109157], 0, 3.00317, 1639291706], "v": "v0.6"}
