artifacts/Table3/tvm/autotvm/depthwise/depthwise_128_84_42_42_5_5_1_SAME.log
{"input": ["cuda -keys=cuda,gpu -max_num_threads=1024 -thread_warp_size=32", "depthwise_conv2d_nchw.cuda", [["TENSOR", [128, 84, 42, 42], "float32"], ["TENSOR", [84, 1, 5, 5], "float32"], 1, "SAME", 1, "float32"], {}], "config": {"index": 2391781, "code_hash": null, "entity": [["tile_f", "sp", [-1, 7, 1, 4]], ["tile_y", "sp", [-1, 1, 1, 3]], ["tile_x", "sp", [-1, 7, 2, 3]], ["auto_unroll_max_step", "ot", 0], ["unroll_explicit", "ot", 1]]}, "result": [[1.4864983999999999], 0, 12.663460731506348, 1639024840.3434794], "version": 0.2, "tvm_version": "0.8.dev0"}
{"input": ["cuda -keys=cuda,gpu -max_num_threads=1024 -thread_warp_size=32", "depthwise_conv2d_nchw.cuda", [["TENSOR", [128, 84, 42, 42], "float32"], ["TENSOR", [84, 1, 5, 5], "float32"], 1, "SAME", 1, "float32"], {}], "config": {"index": 3162885, "code_hash": null, "entity": [["tile_f", "sp", [-1, 7, 1, 1]], ["tile_y", "sp", [-1, 1, 6, 7]], ["tile_x", "sp", [-1, 1, 2, 7]], ["auto_unroll_max_step", "ot", 256], ["unroll_explicit", "ot", 1]]}, "result": [[0.089261825], 0, 4.001894474029541, 1639024843.6978745], "version": 0.2, "tvm_version": "0.8.dev0"}
{"input": ["cuda -keys=cuda,gpu -max_num_threads=1024 -thread_warp_size=32", "depthwise_conv2d_nchw.cuda", [["TENSOR", [128, 84, 42, 42], "float32"], ["TENSOR", [84, 1, 5, 5], "float32"], 1, "SAME", 1, "float32"], {}], "config": {"index": 1704234, "code_hash": null, "entity": [["tile_f", "sp", [-1, 3, 7, 2]], ["tile_y", "sp", [-1, 1, 1, 2]], ["tile_x", "sp", [-1, 7, 1, 3]], ["auto_unroll_max_step", "ot", 1500], ["unroll_explicit", "ot", 0]]}, "result": [[0.4047354], 0, 15.2473886013031, 1639024856.296508], "version": 0.2, "tvm_version": "0.8.dev0"}
{"input": ["cuda -keys=cuda,gpu -max_num_threads=1024 -thread_warp_size=32", "depthwise_conv2d_nchw.cuda", [["TENSOR", [128, 84, 42, 42], "float32"], ["TENSOR", [84, 1, 5, 5], "float32"], 1, "SAME", 1, "float32"], {}], "config": {"index": 15899, "code_hash": null, "entity": [["tile_f", "sp", [-1, 14, 1, 2]], ["tile_y", "sp", [-1, 1, 21, 2]], ["tile_x", "sp", [-1, 2, 1, 1]], ["auto_unroll_max_step", "ot", 0], ["unroll_explicit", "ot", 0]]}, "result": [[0.1756046], 0, 4.343422174453735, 1639024861.1657462], "version": 0.2, "tvm_version": "0.8.dev0"}
{"input": ["cuda -keys=cuda,gpu -max_num_threads=1024 -thread_warp_size=32", "depthwise_conv2d_nchw.cuda", [["TENSOR", [128, 84, 42, 42], "float32"], ["TENSOR", [84, 1, 5, 5], "float32"], 1, "SAME", 1, "float32"], {}], "config": {"index": 664982, "code_hash": null, "entity": [["tile_f", "sp", [-1, 4, 3, 1]], ["tile_y", "sp", [-1, 1, 1, 21]], ["tile_x", "sp", [-1, 1, 1, 1]], ["auto_unroll_max_step", "ot", 256], ["unroll_explicit", "ot", 0]]}, "result": [[0.23585820000000002], 0, 4.590713739395142, 1639024866.67385], "version": 0.2, "tvm_version": "0.8.dev0"}
{"input": ["cuda -keys=cuda,gpu -max_num_threads=1024 -thread_warp_size=32", "depthwise_conv2d_nchw.cuda", [["TENSOR", [128, 84, 42, 42], "float32"], ["TENSOR", [84, 1, 5, 5], "float32"], 1, "SAME", 1, "float32"], {}], "config": {"index": 2933079, "code_hash": null, "entity": [["tile_f", "sp", [-1, 3, 1, 7]], ["tile_y", "sp", [-1, 1, 1, 2]], ["tile_x", "sp", [-1, 21, 1, 2]], ["auto_unroll_max_step", "ot", 256], ["unroll_explicit", "ot", 1]]}, "result": [[1.608006525], 0, 12.210414171218872, 1639024879.442662], "version": 0.2, "tvm_version": "0.8.dev0"}
{"input": ["cuda -keys=cuda,gpu -max_num_threads=1024 -thread_warp_size=32", "depthwise_conv2d_nchw.cuda", [["TENSOR", [128, 84, 42, 42], "float32"], ["TENSOR", [84, 1, 5, 5], "float32"], 1, "SAME", 1, "float32"], {}], "config": {"index": 2107550, "code_hash": null, "entity": [["tile_f", "sp", [-1, 1, 6, 1]], ["tile_y", "sp", [-1, 1, 2, 7]], ["tile_x", "sp", [-1, 2, 3, 1]], ["auto_unroll_max_step", "ot", 0], ["unroll_explicit", "ot", 1]]}, "result": [[0.031729275], 0, 3.113814115524292, 1639024883.6678686], "version": 0.2, "tvm_version": "0.8.dev0"}
{"input": ["cuda -keys=cuda,gpu -max_num_threads=1024 -thread_warp_size=32", "depthwise_conv2d_nchw.cuda", [["TENSOR", [128, 84, 42, 42], "float32"], ["TENSOR", [84, 1, 5, 5], "float32"], 1, "SAME", 1, "float32"], {}], "config": {"index": 3407057, "code_hash": null, "entity": [["tile_f", "sp", [-1, 14, 2, 1]], ["tile_y", "sp", [-1, 7, 1, 6]], ["tile_x", "sp", [-1, 1, 3, 1]], ["auto_unroll_max_step", "ot", 1500], ["unroll_explicit", "ot", 1]]}, "result": [[0.7339482500000001], 0, 12.097172260284424, 1639024901.183194], "version": 0.2, "tvm_version": "0.8.dev0"}
{"input": ["cuda -keys=cuda,gpu -max_num_threads=1024 -thread_warp_size=32", "depthwise_conv2d_nchw.cuda", [["TENSOR", [128, 84, 42, 42], "float32"], ["TENSOR", [84, 1, 5, 5], "float32"], 1, "SAME", 1, "float32"], {}], "config": {"index": 3093557, "code_hash": null, "entity": [["tile_f", "sp", [-1, 1, 1, 7]], ["tile_y", "sp", [-1, 21, 1, 1]], ["tile_x", "sp", [-1, 7, 1, 6]], ["auto_unroll_max_step", "ot", 256], ["unroll_explicit", "ot", 1]]}, "result": [[1.7096641], 0, 13.759046077728271, 1639024913.5114062], "version": 0.2, "tvm_version": "0.8.dev0"}
{"input": ["cuda -keys=cuda,gpu -max_num_threads=1024 -thread_warp_size=32", "depthwise_conv2d_nchw.cuda", [["TENSOR", [128, 84, 42, 42], "float32"], ["TENSOR", [84, 1, 5, 5], "float32"], 1, "SAME", 1, "float32"], {}], "config": {"index": 2238199, "code_hash": null, "entity": [["tile_f", "sp", [-1, 3, 1, 7]], ["tile_y", "sp", [-1, 1, 1, 3]], ["tile_x", "sp", [-1, 1, 42, 1]], ["auto_unroll_max_step", "ot", 0], ["unroll_explicit", "ot", 1]]}, "result": [[0.06533425], 0, 3.790416955947876, 1639024917.599309], "version": 0.2, "tvm_version": "0.8.dev0"}
{"input": ["cuda -keys=cuda,gpu -max_num_threads=1024 -thread_warp_size=32", "depthwise_conv2d_nchw.cuda", [["TENSOR", [128, 84, 42, 42], "float32"], ["TENSOR", [84, 1, 5, 5], "float32"], 1, "SAME", 1, "float32"], {}], "config": {"index": 790963, "code_hash": null, "entity": [["tile_f", "sp", [-1, 4, 1, 3]], ["tile_y", "sp", [-1, 14, 3, 1]], ["tile_x", "sp", [-1, 2, 3, 1]], ["auto_unroll_max_step", "ot", 256], ["unroll_explicit", "ot", 0]]}, "result": [[0.269203275], 0, 6.084705591201782, 1639024924.1341875], "version": 0.2, "tvm_version": "0.8.dev0"}
{"input": ["cuda -keys=cuda,gpu -max_num_threads=1024 -thread_warp_size=32", "depthwise_conv2d_nchw.cuda", [["TENSOR", [128, 84, 42, 42], "float32"], ["TENSOR", [84, 1, 5, 5], "float32"], 1, "SAME", 1, "float32"], {}], "config": {"index": 129177, "code_hash": null, "entity": [["tile_f", "sp", [-1, 6, 1, 2]], ["tile_y", "sp", [-1, 14, 1, 3]], ["tile_x", "sp", [-1, 1, 3, 1]], ["auto_unroll_max_step", "ot", 0], ["unroll_explicit", "ot", 0]]}, "result": [[0.433864425], 0, 6.230798959732056, 1639024930.1109312], "version": 0.2, "tvm_version": "0.8.dev0"}
{"input": ["cuda -keys=cuda,gpu -max_num_threads=1024 -thread_warp_size=32", "depthwise_conv2d_nchw.cuda", [["TENSOR", [128, 84, 42, 42], "float32"], ["TENSOR", [84, 1, 5, 5], "float32"], 1, "SAME", 1, "float32"], {}], "config": {"index": 1215693, "code_hash": null, "entity": [["tile_f", "sp", [-1, 2, 2, 1]], ["tile_y", "sp", [-1, 7, 1, 6]], ["tile_x", "sp", [-1, 1, 3, 7]], ["auto_unroll_max_step", "ot", 256], ["unroll_explicit", "ot", 0]]}, "result": [[0.18151040000000002], 0, 3.5198495388031006, 1639024934.1805694], "version": 0.2, "tvm_version": "0.8.dev0"}
{"input": ["cuda -keys=cuda,gpu -max_num_threads=1024 -thread_warp_size=32", "depthwise_conv2d_nchw.cuda", [["TENSOR", [128, 84, 42, 42], "float32"], ["TENSOR", [84, 1, 5, 5], "float32"], 1, "SAME", 1, "float32"], {}], "config": {"index": 12997, "code_hash": null, "entity": [["tile_f", "sp", [-1, 4, 7, 1]], ["tile_y", "sp", [-1, 7, 6, 1]], ["tile_x", "sp", [-1, 2, 1, 1]], ["auto_unroll_max_step", "ot", 0], ["unroll_explicit", "ot", 0]]}, "result": [[0.08182905], 0, 3.6560821533203125, 1639024938.6803925], "version": 0.2, "tvm_version": "0.8.dev0"}
{"input": ["cuda -keys=cuda,gpu -max_num_threads=1024 -thread_warp_size=32", "depthwise_conv2d_nchw.cuda", [["TENSOR", [128, 84, 42, 42], "float32"], ["TENSOR", [84, 1, 5, 5], "float32"], 1, "SAME", 1, "float32"], {}], "config": {"index": 1035063, "code_hash": null, "entity": [["tile_f", "sp", [-1, 7, 3, 1]], ["tile_y", "sp", [-1, 14, 1, 1]], ["tile_x", "sp", [-1, 2, 1, 3]], ["auto_unroll_max_step", "ot", 256], ["unroll_explicit", "ot", 0]]}, "result": [[0.41296035000000003], 0, 6.602236747741699, 1639024943.883561], "version": 0.2, "tvm_version": "0.8.dev0"}
{"input": ["cuda -keys=cuda,gpu -max_num_threads=1024 -thread_warp_size=32", "depthwise_conv2d_nchw.cuda", [["TENSOR", [128, 84, 42, 42], "float32"], ["TENSOR", [84, 1, 5, 5], "float32"], 1, "SAME", 1, "float32"], {}], "config": {"index": 1589934, "code_hash": null, "entity": [["tile_f", "sp", [-1, 3, 2, 1]], ["tile_y", "sp", [-1, 7, 6, 1]], ["tile_x", "sp", [-1, 1, 1, 2]], ["auto_unroll_max_step", "ot", 1500], ["unroll_explicit", "ot", 0]]}, "result": [[0.0172314], 0, 2.9918084144592285, 1639024948.00803], "version": 0.2, "tvm_version": "0.8.dev0"}
{"input": ["cuda -keys=cuda,gpu -max_num_threads=1024 -thread_warp_size=32", "depthwise_conv2d_nchw.cuda", [["TENSOR", [128, 84, 42, 42], "float32"], ["TENSOR", [84, 1, 5, 5], "float32"], 1, "SAME", 1, "float32"], {}], "config": {"index": 3786616, "code_hash": null, "entity": [["tile_f", "sp", [-1, 3, 1, 2]], ["tile_y", "sp", [-1, 3, 1, 7]], ["tile_x", "sp", [-1, 2, 1, 7]], ["auto_unroll_max_step", "ot", 1500], ["unroll_explicit", "ot", 1]]}, "result": [[0.701617825], 0, 14.605859518051147, 1639024954.1665707], "version": 0.2, "tvm_version": "0.8.dev0"}
{"input": ["cuda -keys=cuda,gpu -max_num_threads=1024 -thread_warp_size=32", "depthwise_conv2d_nchw.cuda", [["TENSOR", [128, 84, 42, 42], "float32"], ["TENSOR", [84, 1, 5, 5], "float32"], 1, "SAME", 1, "float32"], {}], "config": {"index": 2352826, "code_hash": null, "entity": [["tile_f", "sp", [-1, 1, 4, 1]], ["tile_y", "sp", [-1, 2, 1, 7]], ["tile_x", "sp", [-1, 2, 1, 3]], ["auto_unroll_max_step", "ot", 0], ["unroll_explicit", "ot", 1]]}, "result": [[0.09402160000000001], 0, 3.745605945587158, 1639024958.5997663], "version": 0.2, "tvm_version": "0.8.dev0"}
{"input": ["cuda -keys=cuda,gpu -max_num_threads=1024 -thread_warp_size=32", "depthwise_conv2d_nchw.cuda", [["TENSOR", [128, 84, 42, 42], "float32"], ["TENSOR", [84, 1, 5, 5], "float32"], 1, "SAME", 1, "float32"], {}], "config": {"index": 1480320, "code_hash": null, "entity": [["tile_f", "sp", [-1, 1, 1, 1]], ["tile_y", "sp", [-1, 1, 1, 3]], ["tile_x", "sp", [-1, 1, 6, 1]], ["auto_unroll_max_step", "ot", 1500], ["unroll_explicit", "ot", 0]]}, "result": [[0.042021525], 0, 2.8786134719848633, 1639024962.4522934], "version": 0.2, "tvm_version": "0.8.dev0"}
{"input": ["cuda -keys=cuda,gpu -max_num_threads=1024 -thread_warp_size=32", "depthwise_conv2d_nchw.cuda", [["TENSOR", [128, 84, 42, 42], "float32"], ["TENSOR", [84, 1, 5, 5], "float32"], 1, "SAME", 1, "float32"], {}], "config": {"index": 335095, "code_hash": null, "entity": [["tile_f", "sp", [-1, 2, 1, 2]], ["tile_y", "sp", [-1, 7, 1, 6]], ["tile_x", "sp", [-1, 7, 3, 2]], ["auto_unroll_max_step", "ot", 0], ["unroll_explicit", "ot", 0]]}, "result": [[0.579657475], 0, 7.411535024642944, 1639024968.7415636], "version": 0.2, "tvm_version": "0.8.dev0"}
{"input": ["cuda -keys=cuda,gpu -max_num_threads=1024 -thread_warp_size=32", "depthwise_conv2d_nchw.cuda", [["TENSOR", [128, 84, 42, 42], "float32"], ["TENSOR", [84, 1, 5, 5], "float32"], 1, "SAME", 1, "float32"], {}], "config": {"index": 3004014, "code_hash": null, "entity": [["tile_f", "sp", [-1, 3, 2, 1]], ["tile_y", "sp", [-1, 3, 14, 1]], ["tile_x", "sp", [-1, 2, 1, 3]], ["auto_unroll_max_step", "ot", 256], ["unroll_explicit", "ot", 1]]}, "result": [[0.041535125], 0, 3.577425241470337, 1639024981.6506133], "version": 0.2, "tvm_version": "0.8.dev0"}
{"input": ["cuda -keys=cuda,gpu -max_num_threads=1024 -thread_warp_size=32", "depthwise_conv2d_nchw.cuda", [["TENSOR", [128, 84, 42, 42], "float32"], ["TENSOR", [84, 1, 5, 5], "float32"], 1, "SAME", 1, "float32"], {}], "config": {"index": 497934, "code_hash": null, "entity": [["tile_f", "sp", [-1, 3, 2, 1]], ["tile_y", "sp", [-1, 1, 2, 3]], ["tile_x", "sp", [-1, 1, 1, 7]], ["auto_unroll_max_step", "ot", 0], ["unroll_explicit", "ot", 0]]}, "result": [[0.100278425], 0, 4.057478666305542, 1639024986.1662986], "version": 0.2, "tvm_version": "0.8.dev0"}
{"input": ["cuda -keys=cuda,gpu -max_num_threads=1024 -thread_warp_size=32", "depthwise_conv2d_nchw.cuda", [["TENSOR", [128, 84, 42, 42], "float32"], ["TENSOR", [84, 1, 5, 5], "float32"], 1, "SAME", 1, "float32"], {}], "config": {"index": 1891706, "code_hash": null, "entity": [["tile_f", "sp", [-1, 1, 4, 1]], ["tile_y", "sp", [-1, 1, 7, 6]], ["tile_x", "sp", [-1, 1, 6, 7]], ["auto_unroll_max_step", "ot", 1500], ["unroll_explicit", "ot", 0]]}, "result": [[0.00544578947368421], 0, 2.8389220237731934, 1639024988.647455], "version": 0.2, "tvm_version": "0.8.dev0"}
{"input": ["cuda -keys=cuda,gpu -max_num_threads=1024 -thread_warp_size=32", "depthwise_conv2d_nchw.cuda", [["TENSOR", [128, 84, 42, 42], "float32"], ["TENSOR", [84, 1, 5, 5], "float32"], 1, "SAME", 1, "float32"], {}], "config": {"index": 2896320, "code_hash": null, "entity": [["tile_f", "sp", [-1, 1, 1, 1]], ["tile_y", "sp", [-1, 1, 3, 7]], ["tile_x", "sp", [-1, 1, 42, 1]], ["auto_unroll_max_step", "ot", 256], ["unroll_explicit", "ot", 1]]}, "result": [[0.001686208064516129], 0, 3.903799533843994, 1639024992.6332731], "version": 0.2, "tvm_version": "0.8.dev0"}
{"input": ["cuda -keys=cuda,gpu -max_num_threads=1024 -thread_warp_size=32", "depthwise_conv2d_nchw.cuda", [["TENSOR", [128, 84, 42, 42], "float32"], ["TENSOR", [84, 1, 5, 5], "float32"], 1, "SAME", 1, "float32"], {}], "config": {"index": 228758, "code_hash": null, "entity": [["tile_f", "sp", [-1, 2, 1, 7]], ["tile_y", "sp", [-1, 6, 7, 1]], ["tile_x", "sp", [-1, 1, 14, 1]], ["auto_unroll_max_step", "ot", 0], ["unroll_explicit", "ot", 0]]}, "result": [[0.064681075], 0, 4.443288087844849, 1639024996.7892802], "version": 0.2, "tvm_version": "0.8.dev0"}
{"input": ["cuda -keys=cuda,gpu -max_num_threads=1024 -thread_warp_size=32", "depthwise_conv2d_nchw.cuda", [["TENSOR", [128, 84, 42, 42], "float32"], ["TENSOR", [84, 1, 5, 5], "float32"], 1, "SAME", 1, "float32"], {}], "config": {"index": 2828369, "code_hash": null, "entity": [["tile_f", "sp", [-1, 1, 28, 1]], ["tile_y", "sp", [-1, 2, 3, 1]], ["tile_x", "sp", [-1, 3, 7, 1]], ["auto_unroll_max_step", "ot", 256], ["unroll_explicit", "ot", 1]]}, "result": [[0.005294536842105263], 0, 4.102646589279175, 1639025001.1653278], "version": 0.2, "tvm_version": "0.8.dev0"}
{"input": ["cuda -keys=cuda,gpu -max_num_threads=1024 -thread_warp_size=32", "depthwise_conv2d_nchw.cuda", [["TENSOR", [128, 84, 42, 42], "float32"], ["TENSOR", [84, 1, 5, 5], "float32"], 1, "SAME", 1, "float32"], {}], "config": {"index": 749466, "code_hash": null, "entity": [["tile_f", "sp", [-1, 1, 4, 1]], ["tile_y", "sp", [-1, 1, 3, 1]], ["tile_x", "sp", [-1, 3, 2, 1]], ["auto_unroll_max_step", "ot", 256], ["unroll_explicit", "ot", 0]]}, "result": [[0.01623617142857143], 0, 3.1160833835601807, 1639025004.0413184], "version": 0.2, "tvm_version": "0.8.dev0"}
{"input": ["cuda -keys=cuda,gpu -max_num_threads=1024 -thread_warp_size=32", "depthwise_conv2d_nchw.cuda", [["TENSOR", [128, 84, 42, 42], "float32"], ["TENSOR", [84, 1, 5, 5], "float32"], 1, "SAME", 1, "float32"], {}], "config": {"index": 1481156, "code_hash": null, "entity": [["tile_f", "sp", [-1, 3, 7, 1]], ["tile_y", "sp", [-1, 7, 2, 3]], ["tile_x", "sp", [-1, 1, 6, 1]], ["auto_unroll_max_step", "ot", 1500], ["unroll_explicit", "ot", 0]]}, "result": [[0.0439641], 0, 4.99196457862854, 1639025007.0795372], "version": 0.2, "tvm_version": "0.8.dev0"}
{"input": ["cuda -keys=cuda,gpu -max_num_threads=1024 -thread_warp_size=32", "depthwise_conv2d_nchw.cuda", [["TENSOR", [128, 84, 42, 42], "float32"], ["TENSOR", [84, 1, 5, 5], "float32"], 1, "SAME", 1, "float32"], {}], "config": {"index": 1605563, "code_hash": null, "entity": [["tile_f", "sp", [-1, 1, 2, 7]], ["tile_y", "sp", [-1, 3, 1, 7]], ["tile_x", "sp", [-1, 3, 1, 2]], ["auto_unroll_max_step", "ot", 1500], ["unroll_explicit", "ot", 0]]}, "result": [[0.28810657500000003], 0, 9.795784711837769, 1639025013.1034894], "version": 0.2, "tvm_version": "0.8.dev0"}
{"input": ["cuda -keys=cuda,gpu -max_num_threads=1024 -thread_warp_size=32", "depthwise_conv2d_nchw.cuda", [["TENSOR", [128, 84, 42, 42], "float32"], ["TENSOR", [84, 1, 5, 5], "float32"], 1, "SAME", 1, "float32"], {}], "config": {"index": 41006, "code_hash": null, "entity": [["tile_f", "sp", [-1, 1, 21, 1]], ["tile_y", "sp", [-1, 1, 1, 1]], ["tile_x", "sp", [-1, 7, 1, 1]], ["auto_unroll_max_step", "ot", 0], ["unroll_explicit", "ot", 0]]}, "result": [[0.023598916666666667], 0, 3.175907850265503, 1639025016.0933607], "version": 0.2, "tvm_version": "0.8.dev0"}
{"input": ["cuda -keys=cuda,gpu -max_num_threads=1024 -thread_warp_size=32", "depthwise_conv2d_nchw.cuda", [["TENSOR", [128, 84, 42, 42], "float32"], ["TENSOR", [84, 1, 5, 5], "float32"], 1, "SAME", 1, "float32"], {}], "config": {"index": 3116164, "code_hash": null, "entity": [["tile_f", "sp", [-1, 6, 1, 1]], ["tile_y", "sp", [-1, 3, 7, 1]], ["tile_x", "sp", [-1, 1, 1, 7]], ["auto_unroll_max_step", "ot", 256], ["unroll_explicit", "ot", 1]]}, "result": [[0.12857275], 0, 4.880016565322876, 1639025019.3137696], "version": 0.2, "tvm_version": "0.8.dev0"}
{"input": ["cuda -keys=cuda,gpu -max_num_threads=1024 -thread_warp_size=32", "depthwise_conv2d_nchw.cuda", [["TENSOR", [128, 84, 42, 42], "float32"], ["TENSOR", [84, 1, 5, 5], "float32"], 1, "SAME", 1, "float32"], {}], "config": {"index": 104340, "code_hash": null, "entity": [["tile_f", "sp", [-1, 1, 3, 1]], ["tile_y", "sp", [-1, 1, 3, 1]], ["tile_x", "sp", [-1, 7, 2, 1]], ["auto_unroll_max_step", "ot", 0], ["unroll_explicit", "ot", 0]]}, "result": [[0.01176118888888889], 0, 2.998739719390869, 1639025163.7128234], "version": 0.2, "tvm_version": "0.8.dev0"}
{"input": ["cuda -keys=cuda,gpu -max_num_threads=1024 -thread_warp_size=32", "depthwise_conv2d_nchw.cuda", [["TENSOR", [128, 84, 42, 42], "float32"], ["TENSOR", [84, 1, 5, 5], "float32"], 1, "SAME", 1, "float32"], {}], "config": {"index": 25946, "code_hash": null, "entity": [["tile_f", "sp", [-1, 1, 4, 1]], ["tile_y", "sp", [-1, 3, 7, 2]], ["tile_x", "sp", [-1, 3, 1, 1]], ["auto_unroll_max_step", "ot", 0], ["unroll_explicit", "ot", 0]]}, "result": [[0.041551475000000004], 0, 3.9660096168518066, 1639025167.1482947], "version": 0.2, "tvm_version": "0.8.dev0"}
{"input": ["cuda -keys=cuda,gpu -max_num_threads=1024 -thread_warp_size=32", "depthwise_conv2d_nchw.cuda", [["TENSOR", [128, 84, 42, 42], "float32"], ["TENSOR", [84, 1, 5, 5], "float32"], 1, "SAME", 1, "float32"], {}], "config": {"index": 17300, "code_hash": null, "entity": [["tile_f", "sp", [-1, 1, 3, 1]], ["tile_y", "sp", [-1, 1, 14, 3]], ["tile_x", "sp", [-1, 2, 1, 1]], ["auto_unroll_max_step", "ot", 0], ["unroll_explicit", "ot", 0]]}, "result": [[0.01060551], 0, 3.9927921295166016, 1639025170.8369787], "version": 0.2, "tvm_version": "0.8.dev0"}
{"input": ["cuda -keys=cuda,gpu -max_num_threads=1024 -thread_warp_size=32", "depthwise_conv2d_nchw.cuda", [["TENSOR", [128, 84, 42, 42], "float32"], ["TENSOR", [84, 1, 5, 5], "float32"], 1, "SAME", 1, "float32"], {}], "config": {"index": 14260, "code_hash": null, "entity": [["tile_f", "sp", [-1, 1, 3, 1]], ["tile_y", "sp", [-1, 2, 21, 1]], ["tile_x", "sp", [-1, 2, 1, 1]], ["auto_unroll_max_step", "ot", 0], ["unroll_explicit", "ot", 0]]}, "result": [[0.007734707692307692], 0, 3.3487541675567627, 1639025173.649969], "version": 0.2, "tvm_version": "0.8.dev0"}
{"input": ["cuda -keys=cuda,gpu -max_num_threads=1024 -thread_warp_size=32", "depthwise_conv2d_nchw.cuda", [["TENSOR", [128, 84, 42, 42], "float32"], ["TENSOR", [84, 1, 5, 5], "float32"], 1, "SAME", 1, "float32"], {}], "config": {"index": 84340, "code_hash": null, "entity": [["tile_f", "sp", [-1, 1, 3, 1]], ["tile_y", "sp", [-1, 14, 3, 1]], ["tile_x", "sp", [-1, 1, 2, 1]], ["auto_unroll_max_step", "ot", 0], ["unroll_explicit", "ot", 0]]}, "result": [[0.0746016], 0, 4.50535774230957, 1639025177.7189972], "version": 0.2, "tvm_version": "0.8.dev0"}
{"input": ["cuda -keys=cuda,gpu -max_num_threads=1024 -thread_warp_size=32", "depthwise_conv2d_nchw.cuda", [["TENSOR", [128, 84, 42, 42], "float32"], ["TENSOR", [84, 1, 5, 5], "float32"], 1, "SAME", 1, "float32"], {}], "config": {"index": 12980, "code_hash": null, "entity": [["tile_f", "sp", [-1, 1, 3, 1]], ["tile_y", "sp", [-1, 7, 6, 1]], ["tile_x", "sp", [-1, 2, 1, 1]], ["auto_unroll_max_step", "ot", 0], ["unroll_explicit", "ot", 0]]}, "result": [[0.075820125], 0, 4.006645917892456, 1639025181.3396103], "version": 0.2, "tvm_version": "0.8.dev0"}
{"input": ["cuda -keys=cuda,gpu -max_num_threads=1024 -thread_warp_size=32", "depthwise_conv2d_nchw.cuda", [["TENSOR", [128, 84, 42, 42], "float32"], ["TENSOR", [84, 1, 5, 5], "float32"], 1, "SAME", 1, "float32"], {}], "config": {"index": 13620, "code_hash": null, "entity": [["tile_f", "sp", [-1, 1, 3, 1]], ["tile_y", "sp", [-1, 6, 7, 1]], ["tile_x", "sp", [-1, 2, 1, 1]], ["auto_unroll_max_step", "ot", 0], ["unroll_explicit", "ot", 0]]}, "result": [[0.014396971428571428], 0, 4.8370585441589355, 1639025185.3114235], "version": 0.2, "tvm_version": "0.8.dev0"}
{"input": ["cuda -keys=cuda,gpu -max_num_threads=1024 -thread_warp_size=32", "depthwise_conv2d_nchw.cuda", [["TENSOR", [128, 84, 42, 42], "float32"], ["TENSOR", [84, 1, 5, 5], "float32"], 1, "SAME", 1, "float32"], {}], "config": {"index": 279220, "code_hash": null, "entity": [["tile_f", "sp", [-1, 1, 3, 1]], ["tile_y", "sp", [-1, 7, 6, 1]], ["tile_x", "sp", [-1, 1, 1, 2]], ["auto_unroll_max_step", "ot", 0], ["unroll_explicit", "ot", 0]]}, "result": [[0.03718375], 0, 4.199223041534424, 1639025188.3727927], "version": 0.2, "tvm_version": "0.8.dev0"}
{"input": ["cuda -keys=cuda,gpu -max_num_threads=1024 -thread_warp_size=32", "depthwise_conv2d_nchw.cuda", [["TENSOR", [128, 84, 42, 42], "float32"], ["TENSOR", [84, 1, 5, 5], "float32"], 1, "SAME", 1, "float32"], {}], "config": {"index": 87060, "code_hash": null, "entity": [["tile_f", "sp", [-1, 1, 3, 1]], ["tile_y", "sp", [-1, 7, 3, 2]], ["tile_x", "sp", [-1, 1, 2, 1]], ["auto_unroll_max_step", "ot", 0], ["unroll_explicit", "ot", 0]]}, "result": [[0.057539074999999995], 0, 3.783451557159424, 1639025191.5358286], "version": 0.2, "tvm_version": "0.8.dev0"}
{"input": ["cuda -keys=cuda,gpu -max_num_threads=1024 -thread_warp_size=32", "depthwise_conv2d_nchw.cuda", [["TENSOR", [128, 84, 42, 42], "float32"], ["TENSOR", [84, 1, 5, 5], "float32"], 1, "SAME", 1, "float32"], {}], "config": {"index": 176002, "code_hash": null, "entity": [["tile_f", "sp", [-1, 3, 1, 1]], ["tile_y", "sp", [-1, 1, 3, 1]], ["tile_x", "sp", [-1, 7, 6, 1]], ["auto_unroll_max_step", "ot", 0], ["unroll_explicit", "ot", 0]]}, "result": [[0.07869945], 0, 5.269122838973999, 1639025195.9184833], "version": 0.2, "tvm_version": "0.8.dev0"}
{"input": ["cuda -keys=cuda,gpu -max_num_threads=1024 -thread_warp_size=32", "depthwise_conv2d_nchw.cuda", [["TENSOR", [128, 84, 42, 42], "float32"], ["TENSOR", [84, 1, 5, 5], "float32"], 1, "SAME", 1, "float32"], {}], "config": {"index": 27386, "code_hash": null, "entity": [["tile_f", "sp", [-1, 1, 4, 1]], ["tile_y", "sp", [-1, 2, 7, 3]], ["tile_x", "sp", [-1, 3, 1, 1]], ["auto_unroll_max_step", "ot", 0], ["unroll_explicit", "ot", 0]]}, "result": [[0.031261875], 0, 4.075875282287598, 1639025198.8290856], "version": 0.2, "tvm_version": "0.8.dev0"}
{"input": ["cuda -keys=cuda,gpu -max_num_threads=1024 -thread_warp_size=32", "depthwise_conv2d_nchw.cuda", [["TENSOR", [128, 84, 42, 42], "float32"], ["TENSOR", [84, 1, 5, 5], "float32"], 1, "SAME", 1, "float32"], {}], "config": {"index": 216962, "code_hash": null, "entity": [["tile_f", "sp", [-1, 3, 1, 1]], ["tile_y", "sp", [-1, 1, 3, 1]], ["tile_x", "sp", [-1, 6, 7, 1]], ["auto_unroll_max_step", "ot", 0], ["unroll_explicit", "ot", 0]]}, "result": [[0.06677495], 0, 4.268749475479126, 1639025202.3741727], "version": 0.2, "tvm_version": "0.8.dev0"}
{"input": ["cuda -keys=cuda,gpu -max_num_threads=1024 -thread_warp_size=32", "depthwise_conv2d_nchw.cuda", [["TENSOR", [128, 84, 42, 42], "float32"], ["TENSOR", [84, 1, 5, 5], "float32"], 1, "SAME", 1, "float32"], {}], "config": {"index": 279212, "code_hash": null, "entity": [["tile_f", "sp", [-1, 1, 2, 1]], ["tile_y", "sp", [-1, 7, 6, 1]], ["tile_x", "sp", [-1, 1, 1, 2]], ["auto_unroll_max_step", "ot", 0], ["unroll_explicit", "ot", 0]]}, "result": [[0.053322625000000005], 0, 3.267690896987915, 1639025205.245811], "version": 0.2, "tvm_version": "0.8.dev0"}
{"input": ["cuda -keys=cuda,gpu -max_num_threads=1024 -thread_warp_size=32", "depthwise_conv2d_nchw.cuda", [["TENSOR", [128, 84, 42, 42], "float32"], ["TENSOR", [84, 1, 5, 5], "float32"], 1, "SAME", 1, "float32"], {}], "config": {"index": 33300, "code_hash": null, "entity": [["tile_f", "sp", [-1, 1, 3, 1]], ["tile_y", "sp", [-1, 1, 6, 1]], ["tile_x", "sp", [-1, 6, 1, 1]], ["auto_unroll_max_step", "ot", 0], ["unroll_explicit", "ot", 0]]}, "result": [[0.014723228571428573], 0, 2.8711719512939453, 1639025207.6189847], "version": 0.2, "tvm_version": "0.8.dev0"}
{"input": ["cuda -keys=cuda,gpu -max_num_threads=1024 -thread_warp_size=32", "depthwise_conv2d_nchw.cuda", [["TENSOR", [128, 84, 42, 42], "float32"], ["TENSOR", [84, 1, 5, 5], "float32"], 1, "SAME", 1, "float32"], {}], "config": {"index": 319400, "code_hash": null, "entity": [["tile_f", "sp", [-1, 1, 12, 1]], ["tile_y", "sp", [-1, 1, 3, 1]], ["tile_x", "sp", [-1, 1, 3, 2]], ["auto_unroll_max_step", "ot", 0], ["unroll_explicit", "ot", 0]]}, "result": [[0.005415284210526315], 0, 3.541252374649048, 1639025210.3648026], "version": 0.2, "tvm_version": "0.8.dev0"}
{"input": ["cuda -keys=cuda,gpu -max_num_threads=1024 -thread_warp_size=32", "depthwise_conv2d_nchw.cuda", [["TENSOR", [128, 84, 42, 42], "float32"], ["TENSOR", [84, 1, 5, 5], "float32"], 1, "SAME", 1, "float32"], {}], "config": {"index": 114586, "code_hash": null, "entity": [["tile_f", "sp", [-1, 1, 4, 1]], ["tile_y", "sp", [-1, 1, 3, 1]], ["tile_x", "sp", [-1, 21, 2, 1]], ["auto_unroll_max_step", "ot", 0], ["unroll_explicit", "ot", 0]]}, "result": [[0.03911935], 0, 4.812823295593262, 1639025214.6263394], "version": 0.2, "tvm_version": "0.8.dev0"}
{"input": ["cuda -keys=cuda,gpu -max_num_threads=1024 -thread_warp_size=32", "depthwise_conv2d_nchw.cuda", [["TENSOR", [128, 84, 42, 42], "float32"], ["TENSOR", [84, 1, 5, 5], "float32"], 1, "SAME", 1, "float32"], {}], "config": {"index": 24492, "code_hash": null, "entity": [["tile_f", "sp", [-1, 1, 2, 1]], ["tile_y", "sp", [-1, 2, 21, 1]], ["tile_x", "sp", [-1, 3, 1, 1]], ["auto_unroll_max_step", "ot", 0], ["unroll_explicit", "ot", 0]]}, "result": [[0.00702578], 0, 3.6422417163848877, 1639025217.259097], "version": 0.2, "tvm_version": "0.8.dev0"}
{"input": ["cuda -keys=cuda,gpu -max_num_threads=1024 -thread_warp_size=32", "depthwise_conv2d_nchw.cuda", [["TENSOR", [128, 84, 42, 42], "float32"], ["TENSOR", [84, 1, 5, 5], "float32"], 1, "SAME", 1, "float32"], {}], "config": {"index": 290106, "code_hash": null, "entity": [["tile_f", "sp", [-1, 1, 4, 1]], ["tile_y", "sp", [-1, 6, 7, 1]], ["tile_x", "sp", [-1, 3, 1, 2]], ["auto_unroll_max_step", "ot", 0], ["unroll_explicit", "ot", 0]]}, "result": [[0.044890549999999994], 0, 3.4329209327697754, 1639025220.68752], "version": 0.2, "tvm_version": "0.8.dev0"}
{"input": ["cuda -keys=cuda,gpu -max_num_threads=1024 -thread_warp_size=32", "depthwise_conv2d_nchw.cuda", [["TENSOR", [128, 84, 42, 42], "float32"], ["TENSOR", [84, 1, 5, 5], "float32"], 1, "SAME", 1, "float32"], {}], "config": {"index": 289626, "code_hash": null, "entity": [["tile_f", "sp", [-1, 1, 4, 1]], ["tile_y", "sp", [-1, 1, 7, 1]], ["tile_x", "sp", [-1, 3, 1, 2]], ["auto_unroll_max_step", "ot", 0], ["unroll_explicit", "ot", 0]]}, "result": [[0.0138602875], 0, 4.570140838623047, 1639025225.1123486], "version": 0.2, "tvm_version": "0.8.dev0"}
{"input": ["cuda -keys=cuda,gpu -max_num_threads=1024 -thread_warp_size=32", "depthwise_conv2d_nchw.cuda", [["TENSOR", [128, 84, 42, 42], "float32"], ["TENSOR", [84, 1, 5, 5], "float32"], 1, "SAME", 1, "float32"], {}], "config": {"index": 2740, "code_hash": null, "entity": [["tile_f", "sp", [-1, 1, 3, 1]], ["tile_y", "sp", [-1, 7, 6, 1]], ["tile_x", "sp", [-1, 1, 1, 1]], ["auto_unroll_max_step", "ot", 0], ["unroll_explicit", "ot", 0]]}, "result": [[0.033133325], 0, 3.915196657180786, 1639025227.8775647], "version": 0.2, "tvm_version": "0.8.dev0"}
{"input": ["cuda -keys=cuda,gpu -max_num_threads=1024 -thread_warp_size=32", "depthwise_conv2d_nchw.cuda", [["TENSOR", [128, 84, 42, 42], "float32"], ["TENSOR", [84, 1, 5, 5], "float32"], 1, "SAME", 1, "float32"], {}], "config": {"index": 34106, "code_hash": null, "entity": [["tile_f", "sp", [-1, 1, 4, 1]], ["tile_y", "sp", [-1, 6, 7, 1]], ["tile_x", "sp", [-1, 6, 1, 1]], ["auto_unroll_max_step", "ot", 0], ["unroll_explicit", "ot", 0]]}, "result": [[0.05045735], 0, 4.314008474349976, 1639025231.8765683], "version": 0.2, "tvm_version": "0.8.dev0"}
{"input": ["cuda -keys=cuda,gpu -max_num_threads=1024 -thread_warp_size=32", "depthwise_conv2d_nchw.cuda", [["TENSOR", [128, 84, 42, 42], "float32"], ["TENSOR", [84, 1, 5, 5], "float32"], 1, "SAME", 1, "float32"], {}], "config": {"index": 33626, "code_hash": null, "entity": [["tile_f", "sp", [-1, 1, 4, 1]], ["tile_y", "sp", [-1, 1, 7, 1]], ["tile_x", "sp", [-1, 6, 1, 1]], ["auto_unroll_max_step", "ot", 0], ["unroll_explicit", "ot", 0]]}, "result": [[0.010492390909090911], 0, 3.758556842803955, 1639025235.2757256], "version": 0.2, "tvm_version": "0.8.dev0"}
{"input": ["cuda -keys=cuda,gpu -max_num_threads=1024 -thread_warp_size=32", "depthwise_conv2d_nchw.cuda", [["TENSOR", [128, 84, 42, 42], "float32"], ["TENSOR", [84, 1, 5, 5], "float32"], 1, "SAME", 1, "float32"], {}], "config": {"index": 33620, "code_hash": null, "entity": [["tile_f", "sp", [-1, 1, 3, 1]], ["tile_y", "sp", [-1, 1, 7, 1]], ["tile_x", "sp", [-1, 6, 1, 1]], ["auto_unroll_max_step", "ot", 0], ["unroll_explicit", "ot", 0]]}, "result": [[0.011961558333333335], 0, 3.6197938919067383, 1639025238.4432569], "version": 0.2, "tvm_version": "0.8.dev0"}
{"input": ["cuda -keys=cuda,gpu -max_num_threads=1024 -thread_warp_size=32", "depthwise_conv2d_nchw.cuda", [["TENSOR", [128, 84, 42, 42], "float32"], ["TENSOR", [84, 1, 5, 5], "float32"], 1, "SAME", 1, "float32"], {}], "config": {"index": 23874, "code_hash": null, "entity": [["tile_f", "sp", [-1, 1, 7, 1]], ["tile_y", "sp", [-1, 6, 7, 1]], ["tile_x", "sp", [-1, 3, 1, 1]], ["auto_unroll_max_step", "ot", 0], ["unroll_explicit", "ot", 0]]}, "result": [[0.045631950000000004], 0, 3.8413643836975098, 1639025242.2633615], "version": 0.2, "tvm_version": "0.8.dev0"}
{"input": ["cuda -keys=cuda,gpu -max_num_threads=1024 -thread_warp_size=32", "depthwise_conv2d_nchw.cuda", [["TENSOR", [128, 84, 42, 42], "float32"], ["TENSOR", [84, 1, 5, 5], "float32"], 1, "SAME", 1, "float32"], {}], "config": {"index": 24500, "code_hash": null, "entity": [["tile_f", "sp", [-1, 1, 3, 1]], ["tile_y", "sp", [-1, 2, 21, 1]], ["tile_x", "sp", [-1, 3, 1, 1]], ["auto_unroll_max_step", "ot", 0], ["unroll_explicit", "ot", 0]]}, "result": [[0.0056144093750000006], 0, 4.206507682800293, 1639025247.70917], "version": 0.2, "tvm_version": "0.8.dev0"}
{"input": ["cuda -keys=cuda,gpu -max_num_threads=1024 -thread_warp_size=32", "depthwise_conv2d_nchw.cuda", [["TENSOR", [128, 84, 42, 42], "float32"], ["TENSOR", [84, 1, 5, 5], "float32"], 1, "SAME", 1, "float32"], {}], "config": {"index": 24506, "code_hash": null, "entity": [["tile_f", "sp", [-1, 1, 4, 1]], ["tile_y", "sp", [-1, 2, 21, 1]], ["tile_x", "sp", [-1, 3, 1, 1]], ["auto_unroll_max_step", "ot", 0], ["unroll_explicit", "ot", 0]]}, "result": [[0.006322725], 0, 5.21915340423584, 1639025251.9594007], "version": 0.2, "tvm_version": "0.8.dev0"}
{"input": ["cuda -keys=cuda,gpu -max_num_threads=1024 -thread_warp_size=32", "depthwise_conv2d_nchw.cuda", [["TENSOR", [128, 84, 42, 42], "float32"], ["TENSOR", [84, 1, 5, 5], "float32"], 1, "SAME", 1, "float32"], {}], "config": {"index": 14266, "code_hash": null, "entity": [["tile_f", "sp", [-1, 1, 4, 1]], ["tile_y", "sp", [-1, 2, 21, 1]], ["tile_x", "sp", [-1, 2, 1, 1]], ["auto_unroll_max_step", "ot", 0], ["unroll_explicit", "ot", 0]]}, "result": [[0.005350547368421052], 0, 3.6877832412719727, 1639025255.0990973], "version": 0.2, "tvm_version": "0.8.dev0"}
{"input": ["cuda -keys=cuda,gpu -max_num_threads=1024 -thread_warp_size=32", "depthwise_conv2d_nchw.cuda", [["TENSOR", [128, 84, 42, 42], "float32"], ["TENSOR", [84, 1, 5, 5], "float32"], 1, "SAME", 1, "float32"], {}], "config": {"index": 94740, "code_hash": null, "entity": [["tile_f", "sp", [-1, 1, 3, 1]], ["tile_y", "sp", [-1, 1, 6, 1]], ["tile_x", "sp", [-1, 3, 2, 1]], ["auto_unroll_max_step", "ot", 0], ["unroll_explicit", "ot", 0]]}, "result": [[0.009760699999999999], 0, 4.2280755043029785, 1639025258.5707655], "version": 0.2, "tvm_version": "0.8.dev0"}
{"input": ["cuda -keys=cuda,gpu -max_num_threads=1024 -thread_warp_size=32", "depthwise_conv2d_nchw.cuda", [["TENSOR", [128, 84, 42, 42], "float32"], ["TENSOR", [84, 1, 5, 5], "float32"], 1, "SAME", 1, "float32"], {}], "config": {"index": 206746, "code_hash": null, "entity": [["tile_f", "sp", [-1, 1, 4, 1]], ["tile_y", "sp", [-1, 1, 3, 1]], ["tile_x", "sp", [-1, 3, 7, 1]], ["auto_unroll_max_step", "ot", 0], ["unroll_explicit", "ot", 0]]}, "result": [[0.004752390909090909], 0, 3.882596492767334, 1639025261.8769066], "version": 0.2, "tvm_version": "0.8.dev0"}
{"input": ["cuda -keys=cuda,gpu -max_num_threads=1024 -thread_warp_size=32", "depthwise_conv2d_nchw.cuda", [["TENSOR", [128, 84, 42, 42], "float32"], ["TENSOR", [84, 1, 5, 5], "float32"], 1, "SAME", 1, "float32"], {}], "config": {"index": 206740, "code_hash": null, "entity": [["tile_f", "sp", [-1, 1, 3, 1]], ["tile_y", "sp", [-1, 1, 3, 1]], ["tile_x", "sp", [-1, 3, 7, 1]], ["auto_unroll_max_step", "ot", 0], ["unroll_explicit", "ot", 0]]}, "result": [[0.005739205555555555], 0, 3.5779292583465576, 1639025265.2042708], "version": 0.2, "tvm_version": "0.8.dev0"}
{"input": ["cuda -keys=cuda,gpu -max_num_threads=1024 -thread_warp_size=32", "depthwise_conv2d_nchw.cuda", [["TENSOR", [128, 84, 42, 42], "float32"], ["TENSOR", [84, 1, 5, 5], "float32"], 1, "SAME", 1, "float32"], {}], "config": {"index": 196506, "code_hash": null, "entity": [["tile_f", "sp", [-1, 1, 4, 1]], ["tile_y", "sp", [-1, 1, 3, 1]], ["tile_x", "sp", [-1, 2, 7, 1]], ["auto_unroll_max_step", "ot", 0], ["unroll_explicit", "ot", 0]]}, "result": [[0.006760926315789474], 0, 3.8888142108917236, 1639025268.5200346], "version": 0.2, "tvm_version": "0.8.dev0"}
{"input": ["cuda -keys=cuda,gpu -max_num_threads=1024 -thread_warp_size=32", "depthwise_conv2d_nchw.cuda", [["TENSOR", [128, 84, 42, 42], "float32"], ["TENSOR", [84, 1, 5, 5], "float32"], 1, "SAME", 1, "float32"], {}], "config": {"index": 23230, "code_hash": null, "entity": [["tile_f", "sp", [-1, 1, 6, 1]], ["tile_y", "sp", [-1, 7, 6, 1]], ["tile_x", "sp", [-1, 3, 1, 1]], ["auto_unroll_max_step", "ot", 0], ["unroll_explicit", "ot", 0]]}, "result": [[0.065104525], 0, 4.361948728561401, 1639025272.2402842], "version": 0.2, "tvm_version": "0.8.dev0"}
{"input": ["cuda -keys=cuda,gpu -max_num_threads=1024 -thread_warp_size=32", "depthwise_conv2d_nchw.cuda", [["TENSOR", [128, 84, 42, 42], "float32"], ["TENSOR", [84, 1, 5, 5], "float32"], 1, "SAME", 1, "float32"], {}], "config": {"index": 23870, "code_hash": null, "entity": [["tile_f", "sp", [-1, 1, 6, 1]], ["tile_y", "sp", [-1, 6, 7, 1]], ["tile_x", "sp", [-1, 3, 1, 1]], ["auto_unroll_max_step", "ot", 0], ["unroll_explicit", "ot", 0]]}, "result": [[0.05470525], 0, 5.317776679992676, 1639025276.4787958], "version": 0.2, "tvm_version": "0.8.dev0"}
{"input": ["cuda -keys=cuda,gpu -max_num_threads=1024 -thread_warp_size=32", "depthwise_conv2d_nchw.cuda", [["TENSOR", [128, 84, 42, 42], "float32"], ["TENSOR", [84, 1, 5, 5], "float32"], 1, "SAME", 1, "float32"], {}], "config": {"index": 43866, "code_hash": null, "entity": [["tile_f", "sp", [-1, 1, 4, 1]], ["tile_y", "sp", [-1, 1, 7, 1]], ["tile_x", "sp", [-1, 7, 1, 1]], ["auto_unroll_max_step", "ot", 0], ["unroll_explicit", "ot", 0]]}, "result": [[0.012516775], 0, 3.646766185760498, 1639025278.8050914], "version": 0.2, "tvm_version": "0.8.dev0"}
{"input": ["cuda -keys=cuda,gpu -max_num_threads=1024 -thread_warp_size=32", "depthwise_conv2d_nchw.cuda", [["TENSOR", [128, 84, 42, 42], "float32"], ["TENSOR", [84, 1, 5, 5], "float32"], 1, "SAME", 1, "float32"], {}], "config": {"index": 43860, "code_hash": null, "entity": [["tile_f", "sp", [-1, 1, 3, 1]], ["tile_y", "sp", [-1, 1, 7, 1]], ["tile_x", "sp", [-1, 7, 1, 1]], ["auto_unroll_max_step", "ot", 0], ["unroll_explicit", "ot", 0]]}, "result": [[0.013219274999999999], 0, 5.618818521499634, 1639025283.9789565], "version": 0.2, "tvm_version": "0.8.dev0"}
{"input": ["cuda -keys=cuda,gpu -max_num_threads=1024 -thread_warp_size=32", "depthwise_conv2d_nchw.cuda", [["TENSOR", [128, 84, 42, 42], "float32"], ["TENSOR", [84, 1, 5, 5], "float32"], 1, "SAME", 1, "float32"], {}], "config": {"index": 34720, "code_hash": null, "entity": [["tile_f", "sp", [-1, 1, 1, 1]], ["tile_y", "sp", [-1, 2, 21, 1]], ["tile_x", "sp", [-1, 6, 1, 1]], ["auto_unroll_max_step", "ot", 0], ["unroll_explicit", "ot", 0]]}, "result": [[0.008844916666666666], 0, 3.730435371398926, 1639025286.6023464], "version": 0.2, "tvm_version": "0.8.dev0"}
{"input": ["cuda -keys=cuda,gpu -max_num_threads=1024 -thread_warp_size=32", "depthwise_conv2d_nchw.cuda", [["TENSOR", [128, 84, 42, 42], "float32"], ["TENSOR", [84, 1, 5, 5], "float32"], 1, "SAME", 1, "float32"], {}], "config": {"index": 13946, "code_hash": null, "entity": [["tile_f", "sp", [-1, 1, 4, 1]], ["tile_y", "sp", [-1, 3, 14, 1]], ["tile_x", "sp", [-1, 2, 1, 1]], ["auto_unroll_max_step", "ot", 0], ["unroll_explicit", "ot", 0]]}, "result": [[0.00649705625], 0, 3.7733280658721924, 1639025289.7776532], "version": 0.2, "tvm_version": "0.8.dev0"}
{"input": ["cuda -keys=cuda,gpu -max_num_threads=1024 -thread_warp_size=32", "depthwise_conv2d_nchw.cuda", [["TENSOR", [128, 84, 42, 42], "float32"], ["TENSOR", [84, 1, 5, 5], "float32"], 1, "SAME", 1, "float32"], {}], "config": {"index": 94114, "code_hash": null, "entity": [["tile_f", "sp", [-1, 1, 7, 1]], ["tile_y", "sp", [-1, 1, 3, 1]], ["tile_x", "sp", [-1, 3, 2, 1]], ["auto_unroll_max_step", "ot", 0], ["unroll_explicit", "ot", 0]]}, "result": [[0.010752880000000001], 0, 3.727578639984131, 1639025292.8389628], "version": 0.2, "tvm_version": "0.8.dev0"}
{"input": ["cuda -keys=cuda,gpu -max_num_threads=1024 -thread_warp_size=32", "depthwise_conv2d_nchw.cuda", [["TENSOR", [128, 84, 42, 42], "float32"], ["TENSOR", [84, 1, 5, 5], "float32"], 1, "SAME", 1, "float32"], {}], "config": {"index": 196500, "code_hash": null, "entity": [["tile_f", "sp", [-1, 1, 3, 1]], ["tile_y", "sp", [-1, 1, 3, 1]], ["tile_x", "sp", [-1, 2, 7, 1]], ["auto_unroll_max_step", "ot", 0], ["unroll_explicit", "ot", 0]]}, "result": [[0.005613378947368421], 0, 4.156300067901611, 1639025296.0814779], "version": 0.2, "tvm_version": "0.8.dev0"}
{"input": ["cuda -keys=cuda,gpu -max_num_threads=1024 -thread_warp_size=32", "depthwise_conv2d_nchw.cuda", [["TENSOR", [128, 84, 42, 42], "float32"], ["TENSOR", [84, 1, 5, 5], "float32"], 1, "SAME", 1, "float32"], {}], "config": {"index": 43540, "code_hash": null, "entity": [["tile_f", "sp", [-1, 1, 3, 1]], ["tile_y", "sp", [-1, 1, 6, 1]], ["tile_x", "sp", [-1, 7, 1, 1]], ["auto_unroll_max_step", "ot", 0], ["unroll_explicit", "ot", 0]]}, "result": [[0.0140437], 0, 4.979621410369873, 1639025299.8084037], "version": 0.2, "tvm_version": "0.8.dev0"}
{"input": ["cuda -keys=cuda,gpu -max_num_threads=1024 -thread_warp_size=32", "depthwise_conv2d_nchw.cuda", [["TENSOR", [128, 84, 42, 42], "float32"], ["TENSOR", [84, 1, 5, 5], "float32"], 1, "SAME", 1, "float32"], {}], "config": {"index": 23220, "code_hash": null, "entity": [["tile_f", "sp", [-1, 1, 3, 1]], ["tile_y", "sp", [-1, 7, 6, 1]], ["tile_x", "sp", [-1, 3, 1, 1]], ["auto_unroll_max_step", "ot", 0], ["unroll_explicit", "ot", 0]]}, "result": [[0.07423115], 0, 3.830172538757324, 1639025302.7561433], "version": 0.2, "tvm_version": "0.8.dev0"}
{"input": ["cuda -keys=cuda,gpu -max_num_threads=1024 -thread_warp_size=32", "depthwise_conv2d_nchw.cuda", [["TENSOR", [128, 84, 42, 42], "float32"], ["TENSOR", [84, 1, 5, 5], "float32"], 1, "SAME", 1, "float32"], {}], "config": {"index": 85300, "code_hash": null, "entity": [["tile_f", "sp", [-1, 1, 3, 1]], ["tile_y", "sp", [-1, 6, 7, 1]], ["tile_x", "sp", [-1, 1, 2, 1]], ["auto_unroll_max_step", "ot", 0], ["unroll_explicit", "ot", 0]]}, "result": [[0.008283976923076922], 0, 4.088696479797363, 1639025306.152736], "version": 0.2, "tvm_version": "0.8.dev0"}
{"input": ["cuda -keys=cuda,gpu -max_num_threads=1024 -thread_warp_size=32", "depthwise_conv2d_nchw.cuda", [["TENSOR", [128, 84, 42, 42], "float32"], ["TENSOR", [84, 1, 5, 5], "float32"], 1, "SAME", 1, "float32"], {}], "config": {"index": 84660, "code_hash": null, "entity": [["tile_f", "sp", [-1, 1, 3, 1]], ["tile_y", "sp", [-1, 7, 6, 1]], ["tile_x", "sp", [-1, 1, 2, 1]], ["auto_unroll_max_step", "ot", 0], ["unroll_explicit", "ot", 0]]}, "result": [[0.009003741666666667], 0, 4.371878385543823, 1639025309.7611284], "version": 0.2, "tvm_version": "0.8.dev0"}
{"input": ["cuda -keys=cuda,gpu -max_num_threads=1024 -thread_warp_size=32", "depthwise_conv2d_nchw.cuda", [["TENSOR", [128, 84, 42, 42], "float32"], ["TENSOR", [84, 1, 5, 5], "float32"], 1, "SAME", 1, "float32"], {}], "config": {"index": 84652, "code_hash": null, "entity": [["tile_f", "sp", [-1, 1, 2, 1]], ["tile_y", "sp", [-1, 7, 6, 1]], ["tile_x", "sp", [-1, 1, 2, 1]], ["auto_unroll_max_step", "ot", 0], ["unroll_explicit", "ot", 0]]}, "result": [[0.0115862], 0, 4.1848883628845215, 1639025313.1462812], "version": 0.2, "tvm_version": "0.8.dev0"}
{"input": ["cuda -keys=cuda,gpu -max_num_threads=1024 -thread_warp_size=32", "depthwise_conv2d_nchw.cuda", [["TENSOR", [128, 84, 42, 42], "float32"], ["TENSOR", [84, 1, 5, 5], "float32"], 1, "SAME", 1, "float32"], {}], "config": {"index": 85292, "code_hash": null, "entity": [["tile_f", "sp", [-1, 1, 2, 1]], ["tile_y", "sp", [-1, 6, 7, 1]], ["tile_x", "sp", [-1, 1, 2, 1]], ["auto_unroll_max_step", "ot", 0], ["unroll_explicit", "ot", 0]]}, "result": [[0.011614488888888889], 0, 4.535727262496948, 1639025316.870014], "version": 0.2, "tvm_version": "0.8.dev0"}
{"input": ["cuda -keys=cuda,gpu -max_num_threads=1024 -thread_warp_size=32", "depthwise_conv2d_nchw.cuda", [["TENSOR", [128, 84, 42, 42], "float32"], ["TENSOR", [84, 1, 5, 5], "float32"], 1, "SAME", 1, "float32"], {}], "config": {"index": 279860, "code_hash": null, "entity": [["tile_f", "sp", [-1, 1, 3, 1]], ["tile_y", "sp", [-1, 6, 7, 1]], ["tile_x", "sp", [-1, 1, 1, 2]], ["auto_unroll_max_step", "ot", 0], ["unroll_explicit", "ot", 0]]}, "result": [[0.019139800000000002], 0, 4.060440540313721, 1639025319.9633725], "version": 0.2, "tvm_version": "0.8.dev0"}
{"input": ["cuda -keys=cuda,gpu -max_num_threads=1024 -thread_warp_size=32", "depthwise_conv2d_nchw.cuda", [["TENSOR", [128, 84, 42, 42], "float32"], ["TENSOR", [84, 1, 5, 5], "float32"], 1, "SAME", 1, "float32"], {}], "config": {"index": 165794, "code_hash": null, "entity": [["tile_f", "sp", [-1, 1, 7, 1]], ["tile_y", "sp", [-1, 1, 3, 1]], ["tile_x", "sp", [-1, 1, 6, 1]], ["auto_unroll_max_step", "ot", 0], ["unroll_explicit", "ot", 0]]}, "result": [[0.006976013333333333], 0, 4.0644471645355225, 1639025323.0477114], "version": 0.2, "tvm_version": "0.8.dev0"}
{"input": ["cuda -keys=cuda,gpu -max_num_threads=1024 -thread_warp_size=32", "depthwise_conv2d_nchw.cuda", [["TENSOR", [128, 84, 42, 42], "float32"], ["TENSOR", [84, 1, 5, 5], "float32"], 1, "SAME", 1, "float32"], {}], "config": {"index": 165790, "code_hash": null, "entity": [["tile_f", "sp", [-1, 1, 6, 1]], ["tile_y", "sp", [-1, 1, 3, 1]], ["tile_x", "sp", [-1, 1, 6, 1]], ["auto_unroll_max_step", "ot", 0], ["unroll_explicit", "ot", 0]]}, "result": [[0.007002366666666667], 0, 3.9061827659606934, 1639025326.175891], "version": 0.2, "tvm_version": "0.8.dev0"}
{"input": ["cuda -keys=cuda,gpu -max_num_threads=1024 -thread_warp_size=32", "depthwise_conv2d_nchw.cuda", [["TENSOR", [128, 84, 42, 42], "float32"], ["TENSOR", [84, 1, 5, 5], "float32"], 1, "SAME", 1, "float32"], {}], "config": {"index": 94266, "code_hash": null, "entity": [["tile_f", "sp", [-1, 1, 4, 1]], ["tile_y", "sp", [-1, 2, 3, 1]], ["tile_x", "sp", [-1, 3, 2, 1]], ["auto_unroll_max_step", "ot", 0], ["unroll_explicit", "ot", 0]]}, "result": [[0.0132057875], 0, 2.7468409538269043, 1639025333.9517772], "version": 0.2, "tvm_version": "0.8.dev0"}
{"input": ["cuda -keys=cuda,gpu -max_num_threads=1024 -thread_warp_size=32", "depthwise_conv2d_nchw.cuda", [["TENSOR", [128, 84, 42, 42], "float32"], ["TENSOR", [84, 1, 5, 5], "float32"], 1, "SAME", 1, "float32"], {}], "config": {"index": 43706, "code_hash": null, "entity": [["tile_f", "sp", [-1, 1, 4, 1]], ["tile_y", "sp", [-1, 7, 6, 1]], ["tile_x", "sp", [-1, 7, 1, 1]], ["auto_unroll_max_step", "ot", 0], ["unroll_explicit", "ot", 0]]}, "result": [[0.042617024999999996], 0, 3.4613709449768066, 1639025336.9431345], "version": 0.2, "tvm_version": "0.8.dev0"}
{"input": ["cuda -keys=cuda,gpu -max_num_threads=1024 -thread_warp_size=32", "depthwise_conv2d_nchw.cuda", [["TENSOR", [128, 84, 42, 42], "float32"], ["TENSOR", [84, 1, 5, 5], "float32"], 1, "SAME", 1, "float32"], {}], "config": {"index": 43546, "code_hash": null, "entity": [["tile_f", "sp", [-1, 1, 4, 1]], ["tile_y", "sp", [-1, 1, 6, 1]], ["tile_x", "sp", [-1, 7, 1, 1]], ["auto_unroll_max_step", "ot", 0], ["unroll_explicit", "ot", 0]]}, "result": [[0.011636688888888889], 0, 2.536609649658203, 1639025339.496532], "version": 0.2, "tvm_version": "0.8.dev0"}
{"input": ["cuda -keys=cuda,gpu -max_num_threads=1024 -thread_warp_size=32", "depthwise_conv2d_nchw.cuda", [["TENSOR", [128, 84, 42, 42], "float32"], ["TENSOR", [84, 1, 5, 5], "float32"], 1, "SAME", 1, "float32"], {}], "config": {"index": 15710, "code_hash": null, "entity": [["tile_f", "sp", [-1, 1, 6, 1]], ["tile_y", "sp", [-1, 3, 7, 2]], ["tile_x", "sp", [-1, 2, 1, 1]], ["auto_unroll_max_step", "ot", 0], ["unroll_explicit", "ot", 0]]}, "result": [[0.007973823076923077], 0, 3.1795194149017334, 1639025342.5658188], "version": 0.2, "tvm_version": "0.8.dev0"}
{"input": ["cuda -keys=cuda,gpu -max_num_threads=1024 -thread_warp_size=32", "depthwise_conv2d_nchw.cuda", [["TENSOR", [128, 84, 42, 42], "float32"], ["TENSOR", [84, 1, 5, 5], "float32"], 1, "SAME", 1, "float32"], {}], "config": {"index": 17150, "code_hash": null, "entity": [["tile_f", "sp", [-1, 1, 6, 1]], ["tile_y", "sp", [-1, 2, 7, 3]], ["tile_x", "sp", [-1, 2, 1, 1]], ["auto_unroll_max_step", "ot", 0], ["unroll_explicit", "ot", 0]]}, "result": [[0.00802633076923077], 0, 3.3161392211914062, 1639025346.0215147], "version": 0.2, "tvm_version": "0.8.dev0"}
{"input": ["cuda -keys=cuda,gpu -max_num_threads=1024 -thread_warp_size=32", "depthwise_conv2d_nchw.cuda", [["TENSOR", [128, 84, 42, 42], "float32"], ["TENSOR", [84, 1, 5, 5], "float32"], 1, "SAME", 1, "float32"], {}], "config": {"index": 87390, "code_hash": null, "entity": [["tile_f", "sp", [-1, 1, 6, 1]], ["tile_y", "sp", [-1, 3, 7, 2]], ["tile_x", "sp", [-1, 1, 2, 1]], ["auto_unroll_max_step", "ot", 0], ["unroll_explicit", "ot", 0]]}, "result": [[0.005278545], 0, 2.5788235664367676, 1639025348.4485164], "version": 0.2, "tvm_version": "0.8.dev0"}
{"input": ["cuda -keys=cuda,gpu -max_num_threads=1024 -thread_warp_size=32", "depthwise_conv2d_nchw.cuda", [["TENSOR", [128, 84, 42, 42], "float32"], ["TENSOR", [84, 1, 5, 5], "float32"], 1, "SAME", 1, "float32"], {}], "config": {"index": 85282, "code_hash": null, "entity": [["tile_f", "sp", [-1, 3, 1, 1]], ["tile_y", "sp", [-1, 6, 7, 1]], ["tile_x", "sp", [-1, 1, 2, 1]], ["auto_unroll_max_step", "ot", 0], ["unroll_explicit", "ot", 0]]}, "result": [[0.1104902], 0, 3.530195474624634, 1639025351.7231028], "version": 0.2, "tvm_version": "0.8.dev0"}
{"input": ["cuda -keys=cuda,gpu -max_num_threads=1024 -thread_warp_size=32", "depthwise_conv2d_nchw.cuda", [["TENSOR", [128, 84, 42, 42], "float32"], ["TENSOR", [84, 1, 5, 5], "float32"], 1, "SAME", 1, "float32"], {}], "config": {"index": 23852, "code_hash": null, "entity": [["tile_f", "sp", [-1, 1, 2, 1]], ["tile_y", "sp", [-1, 6, 7, 1]], ["tile_x", "sp", [-1, 3, 1, 1]], ["auto_unroll_max_step", "ot", 0], ["unroll_explicit", "ot", 0]]}, "result": [[0.08620595], 0, 4.173486948013306, 1639025355.7508392], "version": 0.2, "tvm_version": "0.8.dev0"}
{"input": ["cuda -keys=cuda,gpu -max_num_threads=1024 -thread_warp_size=32", "depthwise_conv2d_nchw.cuda", [["TENSOR", [128, 84, 42, 42], "float32"], ["TENSOR", [84, 1, 5, 5], "float32"], 1, "SAME", 1, "float32"], {}], "config": {"index": 33460, "code_hash": null, "entity": [["tile_f", "sp", [-1, 1, 3, 1]], ["tile_y", "sp", [-1, 7, 6, 1]], ["tile_x", "sp", [-1, 6, 1, 1]], ["auto_unroll_max_step", "ot", 0], ["unroll_explicit", "ot", 0]]}, "result": [[0.07233935], 0, 4.266357183456421, 1639025359.7159824], "version": 0.2, "tvm_version": "0.8.dev0"}
{"input": ["cuda -keys=cuda,gpu -max_num_threads=1024 -thread_warp_size=32", "depthwise_conv2d_nchw.cuda", [["TENSOR", [128, 84, 42, 42], "float32"], ["TENSOR", [84, 1, 5, 5], "float32"], 1, "SAME", 1, "float32"], {}], "config": {"index": 14412, "code_hash": null, "entity": [["tile_f", "sp", [-1, 1, 2, 1]], ["tile_y", "sp", [-1, 1, 42, 1]], ["tile_x", "sp", [-1, 2, 1, 1]], ["auto_unroll_max_step", "ot", 0], ["unroll_explicit", "ot", 0]]}, "result": [[0.005266157142857142], 0, 2.504305124282837, 1639025362.272372], "version": 0.2, "tvm_version": "0.8.dev0"}
{"input": ["cuda -keys=cuda,gpu -max_num_threads=1024 -thread_warp_size=32", "depthwise_conv2d_nchw.cuda", [["TENSOR", [128, 84, 42, 42], "float32"], ["TENSOR", [84, 1, 5, 5], "float32"], 1, "SAME", 1, "float32"], {}], "config": {"index": 86092, "code_hash": null, "entity": [["tile_f", "sp", [-1, 1, 2, 1]], ["tile_y", "sp", [-1, 1, 42, 1]], ["tile_x", "sp", [-1, 1, 2, 1]], ["auto_unroll_max_step", "ot", 0], ["unroll_explicit", "ot", 0]]}, "result": [[0.006866226666666667], 0, 3.264132022857666, 1639025365.541388], "version": 0.2, "tvm_version": "0.8.dev0"}
{"input": ["cuda -keys=cuda,gpu -max_num_threads=1024 -thread_warp_size=32", "depthwise_conv2d_nchw.cuda", [["TENSOR", [128, 84, 42, 42], "float32"], ["TENSOR", [84, 1, 5, 5], "float32"], 1, "SAME", 1, "float32"], {}], "config": {"index": 14420, "code_hash": null, "entity": [["tile_f", "sp", [-1, 1, 3, 1]], ["tile_y", "sp", [-1, 1, 42, 1]], ["tile_x", "sp", [-1, 2, 1, 1]], ["auto_unroll_max_step", "ot", 0], ["unroll_explicit", "ot", 0]]}, "result": [[0.0052865421052631575], 0, 2.401226043701172, 1639025368.1663053], "version": 0.2, "tvm_version": "0.8.dev0"}
{"input": ["cuda -keys=cuda,gpu -max_num_threads=1024 -thread_warp_size=32", "depthwise_conv2d_nchw.cuda", [["TENSOR", [128, 84, 42, 42], "float32"], ["TENSOR", [84, 1, 5, 5], "float32"], 1, "SAME", 1, "float32"], {}], "config": {"index": 86100, "code_hash": null, "entity": [["tile_f", "sp", [-1, 1, 3, 1]], ["tile_y", "sp", [-1, 1, 42, 1]], ["tile_x", "sp", [-1, 1, 2, 1]], ["auto_unroll_max_step", "ot", 0], ["unroll_explicit", "ot", 0]]}, "result": [[0.0061418411764705885], 0, 2.2186505794525146, 1639025370.646065], "version": 0.2, "tvm_version": "0.8.dev0"}
{"input": ["cuda -keys=cuda,gpu -max_num_threads=1024 -thread_warp_size=32", "depthwise_conv2d_nchw.cuda", [["TENSOR", [128, 84, 42, 42], "float32"], ["TENSOR", [84, 1, 5, 5], "float32"], 1, "SAME", 1, "float32"], {}], "config": {"index": 3009140, "code_hash": null, "entity": [["tile_f", "sp", [-1, 1, 3, 1]], ["tile_y", "sp", [-1, 2, 3, 7]], ["tile_x", "sp", [-1, 2, 1, 3]], ["auto_unroll_max_step", "ot", 256], ["unroll_explicit", "ot", 1]]}, "result": [[0.0717076], 0, 3.8541080951690674, 1639025373.6845708], "version": 0.2, "tvm_version": "0.8.dev0"}
{"input": ["cuda -keys=cuda,gpu -max_num_threads=1024 -thread_warp_size=32", "depthwise_conv2d_nchw.cuda", [["TENSOR", [128, 84, 42, 42], "float32"], ["TENSOR", [84, 1, 5, 5], "float32"], 1, "SAME", 1, "float32"], {}], "config": {"index": 2259288, "code_hash": null, "entity": [["tile_f", "sp", [-1, 2, 2, 3]], ["tile_y", "sp", [-1, 1, 2, 3]], ["tile_x", "sp", [-1, 3, 1, 2]], ["auto_unroll_max_step", "ot", 0], ["unroll_explicit", "ot", 1]]}, "result": [[0.18111202499999998], 0, 4.286465406417847, 1639025377.28146], "version": 0.2, "tvm_version": "0.8.dev0"}
{"input": ["cuda -keys=cuda,gpu -max_num_threads=1024 -thread_warp_size=32", "depthwise_conv2d_nchw.cuda", [["TENSOR", [128, 84, 42, 42], "float32"], ["TENSOR", [84, 1, 5, 5], "float32"], 1, "SAME", 1, "float32"], {}], "config": {"index": 182740, "code_hash": null, "entity": [["tile_f", "sp", [-1, 1, 3, 1]], ["tile_y", "sp", [-1, 1, 3, 7]], ["tile_x", "sp", [-1, 7, 6, 1]], ["auto_unroll_max_step", "ot", 0], ["unroll_explicit", "ot", 0]]}, "result": [[0.028970324999999998], 0, 2.6969549655914307, 1639025379.5230494], "version": 0.2, "tvm_version": "0.8.dev0"}
{"input": ["cuda -keys=cuda,gpu -max_num_threads=1024 -thread_warp_size=32", "depthwise_conv2d_nchw.cuda", [["TENSOR", [128, 84, 42, 42], "float32"], ["TENSOR", [84, 1, 5, 5], "float32"], 1, "SAME", 1, "float32"], {}], "config": {"index": 2058873, "code_hash": null, "entity": [["tile_f", "sp", [-1, 1, 1, 28]], ["tile_y", "sp", [-1, 6, 1, 1]], ["tile_x", "sp", [-1, 3, 2, 1]], ["auto_unroll_max_step", "ot", 0], ["unroll_explicit", "ot", 1]]}, "result": [[0.6977048499999999], 0, 6.132624626159668, 1639025385.6380684], "version": 0.2, "tvm_version": "0.8.dev0"}
{"input": ["cuda -keys=cuda,gpu -max_num_threads=1024 -thread_warp_size=32", "depthwise_conv2d_nchw.cuda", [["TENSOR", [128, 84, 42, 42], "float32"], ["TENSOR", [84, 1, 5, 5], "float32"], 1, "SAME", 1, "float32"], {}], "config": {"index": 1840002, "code_hash": null, "entity": [["tile_f", "sp", [-1, 3, 1, 1]], ["tile_y", "sp", [-1, 1, 14, 3]], ["tile_x", "sp", [-1, 6, 1, 7]], ["auto_unroll_max_step", "ot", 1500], ["unroll_explicit", "ot", 0]]}, "result": [[0.10394212500000001], 0, 9.304665327072144, 1639025390.3462849], "version": 0.2, "tvm_version": "0.8.dev0"}
{"input": ["cuda -keys=cuda,gpu -max_num_threads=1024 -thread_warp_size=32", "depthwise_conv2d_nchw.cuda", [["TENSOR", [128, 84, 42, 42], "float32"], ["TENSOR", [84, 1, 5, 5], "float32"], 1, "SAME", 1, "float32"], {}], "config": {"index": 845392, "code_hash": null, "entity": [["tile_f", "sp", [-1, 1, 2, 6]], ["tile_y", "sp", [-1, 1, 21, 2]], ["tile_x", "sp", [-1, 1, 7, 1]], ["auto_unroll_max_step", "ot", 256], ["unroll_explicit", "ot", 0]]}, "result": [[0.036158375], 0, 3.930095911026001, 1639025393.7237613], "version": 0.2, "tvm_version": "0.8.dev0"}
{"input": ["cuda -keys=cuda,gpu -max_num_threads=1024 -thread_warp_size=32", "depthwise_conv2d_nchw.cuda", [["TENSOR", [128, 84, 42, 42], "float32"], ["TENSOR", [84, 1, 5, 5], "float32"], 1, "SAME", 1, "float32"], {}], "config": {"index": 126426, "code_hash": null, "entity": [["tile_f", "sp", [-1, 1, 4, 1]], ["tile_y", "sp", [-1, 1, 14, 1]], ["tile_x", "sp", [-1, 1, 3, 1]], ["auto_unroll_max_step", "ot", 0], ["unroll_explicit", "ot", 0]]}, "result": [[0.009814845454545454], 0, 3.0697925090789795, 1639025617.052901], "version": 0.2, "tvm_version": "0.8.dev0"}
{"input": ["cuda -keys=cuda,gpu -max_num_threads=1024 -thread_warp_size=32", "depthwise_conv2d_nchw.cuda", [["TENSOR", [128, 84, 42, 42], "float32"], ["TENSOR", [84, 1, 5, 5], "float32"], 1, "SAME", 1, "float32"], {}], "config": {"index": 1437146, "code_hash": null, "entity": [["tile_f", "sp", [-1, 1, 4, 1]], ["tile_y", "sp", [-1, 1, 14, 1]], ["tile_x", "sp", [-1, 1, 3, 1]], ["auto_unroll_max_step", "ot", 1500], ["unroll_explicit", "ot", 0]]}, "result": [[0.010776863636363637], 0, 3.378018379211426, 1639025620.2049608], "version": 0.2, "tvm_version": "0.8.dev0"}
{"input": ["cuda -keys=cuda,gpu -max_num_threads=1024 -thread_warp_size=32", "depthwise_conv2d_nchw.cuda", [["TENSOR", [128, 84, 42, 42], "float32"], ["TENSOR", [84, 1, 5, 5], "float32"], 1, "SAME", 1, "float32"], {}], "config": {"index": 781786, "code_hash": null, "entity": [["tile_f", "sp", [-1, 1, 4, 1]], ["tile_y", "sp", [-1, 1, 14, 1]], ["tile_x", "sp", [-1, 1, 3, 1]], ["auto_unroll_max_step", "ot", 256], ["unroll_explicit", "ot", 0]]}, "result": [[0.009808481818181818], 0, 3.7312097549438477, 1639025623.200895], "version": 0.2, "tvm_version": "0.8.dev0"}
{"input": ["cuda -keys=cuda,gpu -max_num_threads=1024 -thread_warp_size=32", "depthwise_conv2d_nchw.cuda", [["TENSOR", [128, 84, 42, 42], "float32"], ["TENSOR", [84, 1, 5, 5], "float32"], 1, "SAME", 1, "float32"], {}], "config": {"index": 2092506, "code_hash": null, "entity": [["tile_f", "sp", [-1, 1, 4, 1]], ["tile_y", "sp", [-1, 1, 14, 1]], ["tile_x", "sp", [-1, 1, 3, 1]], ["auto_unroll_max_step", "ot", 0], ["unroll_explicit", "ot", 1]]}, "result": [[0.009811681818181818], 0, 3.092010021209717, 1639025625.6749969], "version": 0.2, "tvm_version": "0.8.dev0"}
{"input": ["cuda -keys=cuda,gpu -max_num_threads=1024 -thread_warp_size=32", "depthwise_conv2d_nchw.cuda", [["TENSOR", [128, 84, 42, 42], "float32"], ["TENSOR", [84, 1, 5, 5], "float32"], 1, "SAME", 1, "float32"], {}], "config": {"index": 3403226, "code_hash": null, "entity": [["tile_f", "sp", [-1, 1, 4, 1]], ["tile_y", "sp", [-1, 1, 14, 1]], ["tile_x", "sp", [-1, 1, 3, 1]], ["auto_unroll_max_step", "ot", 1500], ["unroll_explicit", "ot", 1]]}, "result": [[0.008708758333333334], 0, 3.388983726501465, 1639025628.5757964], "version": 0.2, "tvm_version": "0.8.dev0"}
{"input": ["cuda -keys=cuda,gpu -max_num_threads=1024 -thread_warp_size=32", "depthwise_conv2d_nchw.cuda", [["TENSOR", [128, 84, 42, 42], "float32"], ["TENSOR", [84, 1, 5, 5], "float32"], 1, "SAME", 1, "float32"], {}], "config": {"index": 2747866, "code_hash": null, "entity": [["tile_f", "sp", [-1, 1, 4, 1]], ["tile_y", "sp", [-1, 1, 14, 1]], ["tile_x", "sp", [-1, 1, 3, 1]], ["auto_unroll_max_step", "ot", 256], ["unroll_explicit", "ot", 1]]}, "result": [[0.007960192307692309], 0, 3.6149284839630127, 1639025631.7570434], "version": 0.2, "tvm_version": "0.8.dev0"}
{"input": ["cuda -keys=cuda,gpu -max_num_threads=1024 -thread_warp_size=32", "depthwise_conv2d_nchw.cuda", [["TENSOR", [128, 84, 42, 42], "float32"], ["TENSOR", [84, 1, 5, 5], "float32"], 1, "SAME", 1, "float32"], {}], "config": {"index": 271200, "code_hash": null, "entity": [["tile_f", "sp", [-1, 1, 1, 1]], ["tile_y", "sp", [-1, 1, 3, 2]], ["tile_x", "sp", [-1, 1, 42, 1]], ["auto_unroll_max_step", "ot", 0], ["unroll_explicit", "ot", 0]]}, "result": [[0.0028790085714285713], 0, 3.258178472518921, 1639025634.727631], "version": 0.2, "tvm_version": "0.8.dev0"}
{"input": ["cuda -keys=cuda,gpu -max_num_threads=1024 -thread_warp_size=32", "depthwise_conv2d_nchw.cuda", [["TENSOR", [128, 84, 42, 42], "float32"], ["TENSOR", [84, 1, 5, 5], "float32"], 1, "SAME", 1, "float32"], {}], "config": {"index": 2237280, "code_hash": null, "entity": [["tile_f", "sp", [-1, 1, 1, 1]], ["tile_y", "sp", [-1, 1, 3, 2]], ["tile_x", "sp", [-1, 1, 42, 1]], ["auto_unroll_max_step", "ot", 0], ["unroll_explicit", "ot", 1]]}, "result": [[0.0025256374999999996], 0, 2.716008424758911, 1639025636.722563], "version": 0.2, "tvm_version": "0.8.dev0"}
{"input": ["cuda -keys=cuda,gpu -max_num_threads=1024 -thread_warp_size=32", "depthwise_conv2d_nchw.cuda", [["TENSOR", [128, 84, 42, 42], "float32"], ["TENSOR", [84, 1, 5, 5], "float32"], 1, "SAME", 1, "float32"], {}], "config": {"index": 85786, "code_hash": null, "entity": [["tile_f", "sp", [-1, 1, 4, 1]], ["tile_y", "sp", [-1, 1, 21, 1]], ["tile_x", "sp", [-1, 1, 2, 1]], ["auto_unroll_max_step", "ot", 0], ["unroll_explicit", "ot", 0]]}, "result": [[0.007316842857142856], 0, 3.833937406539917, 1639025639.9045253], "version": 0.2, "tvm_version": "0.8.dev0"}
{"input": ["cuda -keys=cuda,gpu -max_num_threads=1024 -thread_warp_size=32", "depthwise_conv2d_nchw.cuda", [["TENSOR", [128, 84, 42, 42], "float32"], ["TENSOR", [84, 1, 5, 5], "float32"], 1, "SAME", 1, "float32"], {}], "config": {"index": 186920, "code_hash": null, "entity": [["tile_f", "sp", [-1, 1, 12, 1]], ["tile_y", "sp", [-1, 1, 6, 1]], ["tile_x", "sp", [-1, 1, 7, 1]], ["auto_unroll_max_step", "ot", 0], ["unroll_explicit", "ot", 0]]}, "result": [[0.005962488235294118], 0, 3.1760971546173096, 1639025642.436864], "version": 0.2, "tvm_version": "0.8.dev0"}
{"input": ["cuda -keys=cuda,gpu -max_num_threads=1024 -thread_warp_size=32", "depthwise_conv2d_nchw.cuda", [["TENSOR", [128, 84, 42, 42], "float32"], ["TENSOR", [84, 1, 5, 5], "float32"], 1, "SAME", 1, "float32"], {}], "config": {"index": 271520, "code_hash": null, "entity": [["tile_f", "sp", [-1, 1, 1, 1]], ["tile_y", "sp", [-1, 1, 7, 2]], ["tile_x", "sp", [-1, 1, 42, 1]], ["auto_unroll_max_step", "ot", 0], ["unroll_explicit", "ot", 0]]}, "result": [[0.0028271055555555554], 0, 2.9705543518066406, 1639025644.687235], "version": 0.2, "tvm_version": "0.8.dev0"}
{"input": ["cuda -keys=cuda,gpu -max_num_threads=1024 -thread_warp_size=32", "depthwise_conv2d_nchw.cuda", [["TENSOR", [128, 84, 42, 42], "float32"], ["TENSOR", [84, 1, 5, 5], "float32"], 1, "SAME", 1, "float32"], {}], "config": {"index": 2237600, "code_hash": null, "entity": [["tile_f", "sp", [-1, 1, 1, 1]], ["tile_y", "sp", [-1, 1, 7, 2]], ["tile_x", "sp", [-1, 1, 42, 1]], ["auto_unroll_max_step", "ot", 0], ["unroll_explicit", "ot", 1]]}, "result": [[0.002849836111111111], 0, 3.86013126373291, 1639025648.0565562], "version": 0.2, "tvm_version": "0.8.dev0"}
{"input": ["cuda -keys=cuda,gpu -max_num_threads=1024 -thread_warp_size=32", "depthwise_conv2d_nchw.cuda", [["TENSOR", [128, 84, 42, 42], "float32"], ["TENSOR", [84, 1, 5, 5], "float32"], 1, "SAME", 1, "float32"], {}], "config": {"index": 258560, "code_hash": null, "entity": [["tile_f", "sp", [-1, 1, 1, 1]], ["tile_y", "sp", [-1, 1, 6, 1]], ["tile_x", "sp", [-1, 2, 21, 1]], ["auto_unroll_max_step", "ot", 0], ["unroll_explicit", "ot", 0]]}, "result": [[0.0035129517241379313], 0, 3.800422191619873, 1639025651.5359025], "version": 0.2, "tvm_version": "0.8.dev0"}
{"input": ["cuda -keys=cuda,gpu -max_num_threads=1024 -thread_warp_size=32", "depthwise_conv2d_nchw.cuda", [["TENSOR", [128, 84, 42, 42], "float32"], ["TENSOR", [84, 1, 5, 5], "float32"], 1, "SAME", 1, "float32"], {}], "config": {"index": 2224640, "code_hash": null, "entity": [["tile_f", "sp", [-1, 1, 1, 1]], ["tile_y", "sp", [-1, 1, 6, 1]], ["tile_x", "sp", [-1, 2, 21, 1]], ["auto_unroll_max_step", "ot", 0], ["unroll_explicit", "ot", 1]]}, "result": [[0.0035119], 0, 3.134838342666626, 1639025654.0751252], "version": 0.2, "tvm_version": "0.8.dev0"}
{"input": ["cuda -keys=cuda,gpu -max_num_threads=1024 -thread_warp_size=32", "depthwise_conv2d_nchw.cuda", [["TENSOR", [128, 84, 42, 42], "float32"], ["TENSOR", [84, 1, 5, 5], "float32"], 1, "SAME", 1, "float32"], {}], "config": {"index": 741146, "code_hash": null, "entity": [["tile_f", "sp", [-1, 1, 4, 1]], ["tile_y", "sp", [-1, 1, 21, 1]], ["tile_x", "sp", [-1, 1, 2, 1]], ["auto_unroll_max_step", "ot", 256], ["unroll_explicit", "ot", 0]]}, "result": [[0.0069974266666666665], 0, 3.07210111618042, 1639025656.3384085], "version": 0.2, "tvm_version": "0.8.dev0"}
{"input": ["cuda -keys=cuda,gpu -max_num_threads=1024 -thread_warp_size=32", "depthwise_conv2d_nchw.cuda", [["TENSOR", [128, 84, 42, 42], "float32"], ["TENSOR", [84, 1, 5, 5], "float32"], 1, "SAME", 1, "float32"], {}], "config": {"index": 1396506, "code_hash": null, "entity": [["tile_f", "sp", [-1, 1, 4, 1]], ["tile_y", "sp", [-1, 1, 21, 1]], ["tile_x", "sp", [-1, 1, 2, 1]], ["auto_unroll_max_step", "ot", 1500], ["unroll_explicit", "ot", 0]]}, "result": [[0.007000726666666667], 0, 2.8167665004730225, 1639025658.7307441], "version": 0.2, "tvm_version": "0.8.dev0"}
