artifacts/Table3/tvm/autotvm/depthwise/depthwise_128_672_11_11_7_7_1_SAME.log
{"input": ["cuda -keys=cuda,gpu -max_num_threads=1024 -thread_warp_size=32", "depthwise_conv2d_nchw.cuda", [["TENSOR", [128, 672, 11, 11], "float32"], ["TENSOR", [672, 1, 7, 7], "float32"], 1, "SAME", 1, "float32"], {}], "config": {"index": 2764, "code_hash": null, "entity": [["tile_f", "sp", [-1, 8, 6, 1]], ["tile_y", "sp", [-1, 1, 1, 11]], ["tile_x", "sp", [-1, 1, 1, 1]], ["auto_unroll_max_step", "ot", 0], ["unroll_explicit", "ot", 0]]}, "result": [[0.6615922000000001], 0, 5.9231486320495605, 1639033164.5896387], "version": 0.2, "tvm_version": "0.8.dev0"}
{"input": ["cuda -keys=cuda,gpu -max_num_threads=1024 -thread_warp_size=32", "depthwise_conv2d_nchw.cuda", [["TENSOR", [128, 672, 11, 11], "float32"], ["TENSOR", [672, 1, 7, 7], "float32"], 1, "SAME", 1, "float32"], {}], "config": {"index": 53073, "code_hash": null, "entity": [["tile_f", "sp", [-1, 1, 2, 2]], ["tile_y", "sp", [-1, 1, 1, 11]], ["tile_x", "sp", [-1, 1, 11, 1]], ["auto_unroll_max_step", "ot", 0], ["unroll_explicit", "ot", 1]]}, "result": [[0.023937000000000003], 0, 3.0439200401306152, 1639033168.287181], "version": 0.2, "tvm_version": "0.8.dev0"}
{"input": ["cuda -keys=cuda,gpu -max_num_threads=1024 -thread_warp_size=32", "depthwise_conv2d_nchw.cuda", [["TENSOR", [128, 672, 11, 11], "float32"], ["TENSOR", [672, 1, 7, 7], "float32"], 1, "SAME", 1, "float32"], {}], "config": {"index": 14731, "code_hash": null, "entity": [["tile_f", "sp", [-1, 14, 1, 4]], ["tile_y", "sp", [-1, 1, 1, 1]], ["tile_x", "sp", [-1, 1, 1, 1]], ["auto_unroll_max_step", "ot", 256], ["unroll_explicit", "ot", 0]]}, "result": [[3.825565075], 0, 22.384180545806885, 1639033190.456791], "version": 0.2, "tvm_version": "0.8.dev0"}
{"input": ["cuda -keys=cuda,gpu -max_num_threads=1024 -thread_warp_size=32", "depthwise_conv2d_nchw.cuda", [["TENSOR", [128, 672, 11, 11], "float32"], ["TENSOR", [672, 1, 7, 7], "float32"], 1, "SAME", 1, "float32"], {}], "config": {"index": 52949, "code_hash": null, "entity": [["tile_f", "sp", [-1, 4, 7, 1]], ["tile_y", "sp", [-1, 1, 1, 11]], ["tile_x", "sp", [-1, 1, 11, 1]], ["auto_unroll_max_step", "ot", 0], ["unroll_explicit", "ot", 1]]}, "result": [[0.033906824999999995], 0, 1.935652732849121, 1639033192.7741282], "version": 0.2, "tvm_version": "0.8.dev0"}
{"input": ["cuda -keys=cuda,gpu -max_num_threads=1024 -thread_warp_size=32", "depthwise_conv2d_nchw.cuda", [["TENSOR", [128, 672, 11, 11], "float32"], ["TENSOR", [672, 1, 7, 7], "float32"], 1, "SAME", 1, "float32"], {}], "config": {"index": 27778, "code_hash": null, "entity": [["tile_f", "sp", [-1, 3, 1, 1]], ["tile_y", "sp", [-1, 1, 1, 11]], ["tile_x", "sp", [-1, 1, 1, 11]], ["auto_unroll_max_step", "ot", 256], ["unroll_explicit", "ot", 0]]}, "result": [[0.543589375], 0, 4.630829334259033, 1639033198.309176], "version": 0.2, "tvm_version": "0.8.dev0"}
{"input": ["cuda -keys=cuda,gpu -max_num_threads=1024 -thread_warp_size=32", "depthwise_conv2d_nchw.cuda", [["TENSOR", [128, 672, 11, 11], "float32"], ["TENSOR", [672, 1, 7, 7], "float32"], 1, "SAME", 1, "float32"], {}], "config": {"index": 20117, "code_hash": null, "entity": [["tile_f", "sp", [-1, 3, 2, 4]], ["tile_y", "sp", [-1, 1, 11, 1]], ["tile_x", "sp", [-1, 11, 1, 1]], ["auto_unroll_max_step", "ot", 256], ["unroll_explicit", "ot", 0]]}, "result": [[0.12927065], 0, 4.650172233581543, 1639033219.1444376], "version": 0.2, "tvm_version": "0.8.dev0"}
{"input": ["cuda -keys=cuda,gpu -max_num_threads=1024 -thread_warp_size=32", "depthwise_conv2d_nchw.cuda", [["TENSOR", [128, 672, 11, 11], "float32"], ["TENSOR", [672, 1, 7, 7], "float32"], 1, "SAME", 1, "float32"], {}], "config": {"index": 73161, "code_hash": null, "entity": [["tile_f", "sp", [-1, 1, 1, 8]], ["tile_y", "sp", [-1, 11, 1, 1]], ["tile_x", "sp", [-1, 1, 1, 1]], ["auto_unroll_max_step", "ot", 1500], ["unroll_explicit", "ot", 1]]}, "result": [[1.1887641], 0, 13.66275143623352, 1639033229.0174112], "version": 0.2, "tvm_version": "0.8.dev0"}
{"input": ["cuda -keys=cuda,gpu -max_num_threads=1024 -thread_warp_size=32", "depthwise_conv2d_nchw.cuda", [["TENSOR", [128, 672, 11, 11], "float32"], ["TENSOR", [672, 1, 7, 7], "float32"], 1, "SAME", 1, "float32"], {}], "config": {"index": 73811, "code_hash": null, "entity": [["tile_f", "sp", [-1, 7, 2, 3]], ["tile_y", "sp", [-1, 1, 11, 1]], ["tile_x", "sp", [-1, 1, 1, 1]], ["auto_unroll_max_step", "ot", 1500], ["unroll_explicit", "ot", 1]]}, "result": [[0.048635325], 0, 9.582834720611572, 1639033234.9874213], "version": 0.2, "tvm_version": "0.8.dev0"}
{"input": ["cuda -keys=cuda,gpu -max_num_threads=1024 -thread_warp_size=32", "depthwise_conv2d_nchw.cuda", [["TENSOR", [128, 672, 11, 11], "float32"], ["TENSOR", [672, 1, 7, 7], "float32"], 1, "SAME", 1, "float32"], {}], "config": {"index": 37958, "code_hash": null, "entity": [["tile_f", "sp", [-1, 4, 1, 3]], ["tile_y", "sp", [-1, 1, 11, 1]], ["tile_x", "sp", [-1, 1, 11, 1]], ["auto_unroll_max_step", "ot", 1500], ["unroll_explicit", "ot", 0]]}, "result": [[0.004442382608695653], 0, 2.268202781677246, 1639033237.4142284], "version": 0.2, "tvm_version": "0.8.dev0"}
{"input": ["cuda -keys=cuda,gpu -max_num_threads=1024 -thread_warp_size=32", "depthwise_conv2d_nchw.cuda", [["TENSOR", [128, 672, 11, 11], "float32"], ["TENSOR", [672, 1, 7, 7], "float32"], 1, "SAME", 1, "float32"], {}], "config": {"index": 13565, "code_hash": null, "entity": [["tile_f", "sp", [-1, 2, 16, 1]], ["tile_y", "sp", [-1, 1, 1, 11]], ["tile_x", "sp", [-1, 1, 1, 11]], ["auto_unroll_max_step", "ot", 0], ["unroll_explicit", "ot", 0]]}, "result": [[0.10988782500000001], 0, 3.4835824966430664, 1639033253.0139232], "version": 0.2, "tvm_version": "0.8.dev0"}
{"input": ["cuda -keys=cuda,gpu -max_num_threads=1024 -thread_warp_size=32", "depthwise_conv2d_nchw.cuda", [["TENSOR", [128, 672, 11, 11], "float32"], ["TENSOR", [672, 1, 7, 7], "float32"], 1, "SAME", 1, "float32"], {}], "config": {"index": 82771, "code_hash": null, "entity": [["tile_f", "sp", [-1, 7, 2, 3]], ["tile_y", "sp", [-1, 1, 1, 1]], ["tile_x", "sp", [-1, 1, 1, 11]], ["auto_unroll_max_step", "ot", 1500], ["unroll_explicit", "ot", 1]]}, "result": [[1.27701425], 0, 19.81412672996521, 1639033263.41082], "version": 0.2, "tvm_version": "0.8.dev0"}
{"input": ["cuda -keys=cuda,gpu -max_num_threads=1024 -thread_warp_size=32", "depthwise_conv2d_nchw.cuda", [["TENSOR", [128, 672, 11, 11], "float32"], ["TENSOR", [672, 1, 7, 7], "float32"], 1, "SAME", 1, "float32"], {}], "config": {"index": 77062, "code_hash": null, "entity": [["tile_f", "sp", [-1, 8, 1, 1]], ["tile_y", "sp", [-1, 1, 11, 1]], ["tile_x", "sp", [-1, 11, 1, 1]], ["auto_unroll_max_step", "ot", 1500], ["unroll_explicit", "ot", 1]]}, "result": [[0.146403625], 0, 7.817760229110718, 1639033267.5211234], "version": 0.2, "tvm_version": "0.8.dev0"}
{"input": ["cuda -keys=cuda,gpu -max_num_threads=1024 -thread_warp_size=32", "depthwise_conv2d_nchw.cuda", [["TENSOR", [128, 672, 11, 11], "float32"], ["TENSOR", [672, 1, 7, 7], "float32"], 1, "SAME", 1, "float32"], {}], "config": {"index": 60096, "code_hash": null, "entity": [["tile_f", "sp", [-1, 14, 4, 1]], ["tile_y", "sp", [-1, 1, 1, 11]], ["tile_x", "sp", [-1, 1, 1, 1]], ["auto_unroll_max_step", "ot", 256], ["unroll_explicit", "ot", 1]]}, "result": [[0.972588225], 0, 7.987738132476807, 1639033274.5448008], "version": 0.2, "tvm_version": "0.8.dev0"}
{"input": ["cuda -keys=cuda,gpu -max_num_threads=1024 -thread_warp_size=32", "depthwise_conv2d_nchw.cuda", [["TENSOR", [128, 672, 11, 11], "float32"], ["TENSOR", [672, 1, 7, 7], "float32"], 1, "SAME", 1, "float32"], {}], "config": {"index": 61514, "code_hash": null, "entity": [["tile_f", "sp", [-1, 2, 1, 8]], ["tile_y", "sp", [-1, 1, 1, 1]], ["tile_x", "sp", [-1, 11, 1, 1]], ["auto_unroll_max_step", "ot", 256], ["unroll_explicit", "ot", 1]]}, "result": [[1.3948212], 0, 10.583889961242676, 1639033284.1657858], "version": 0.2, "tvm_version": "0.8.dev0"}
{"input": ["cuda -keys=cuda,gpu -max_num_threads=1024 -thread_warp_size=32", "depthwise_conv2d_nchw.cuda", [["TENSOR", [128, 672, 11, 11], "float32"], ["TENSOR", [672, 1, 7, 7], "float32"], 1, "SAME", 1, "float32"], {}], "config": {"index": 10008, "code_hash": null, "entity": [["tile_f", "sp", [-1, 1, 32, 1]], ["tile_y", "sp", [-1, 1, 1, 11]], ["tile_x", "sp", [-1, 1, 11, 1]], ["auto_unroll_max_step", "ot", 0], ["unroll_explicit", "ot", 0]]}, "result": [[0.015289333333333334], 0, 2.9847307205200195, 1639033287.4322953], "version": 0.2, "tvm_version": "0.8.dev0"}
{"input": ["cuda -keys=cuda,gpu -max_num_threads=1024 -thread_warp_size=32", "depthwise_conv2d_nchw.cuda", [["TENSOR", [128, 672, 11, 11], "float32"], ["TENSOR", [672, 1, 7, 7], "float32"], 1, "SAME", 1, "float32"], {}], "config": {"index": 35359, "code_hash": null, "entity": [["tile_f", "sp", [-1, 1, 3, 4]], ["tile_y", "sp", [-1, 1, 1, 11]], ["tile_x", "sp", [-1, 11, 1, 1]], ["auto_unroll_max_step", "ot", 1500], ["unroll_explicit", "ot", 0]]}, "result": [[0.38365365], 0, 19.720661401748657, 1639033298.212142], "version": 0.2, "tvm_version": "0.8.dev0"}
{"input": ["cuda -keys=cuda,gpu -max_num_threads=1024 -thread_warp_size=32", "depthwise_conv2d_nchw.cuda", [["TENSOR", [128, 672, 11, 11], "float32"], ["TENSOR", [672, 1, 7, 7], "float32"], 1, "SAME", 1, "float32"], {}], "config": {"index": 72206, "code_hash": null, "entity": [["tile_f", "sp", [-1, 6, 1, 7]], ["tile_y", "sp", [-1, 1, 1, 1]], ["tile_x", "sp", [-1, 1, 1, 1]], ["auto_unroll_max_step", "ot", 1500], ["unroll_explicit", "ot", 1]]}, "result": [[4.078028574999999], 0, 26.033061742782593, 1639033321.9559712], "version": 0.2, "tvm_version": "0.8.dev0"}
{"input": ["cuda -keys=cuda,gpu -max_num_threads=1024 -thread_warp_size=32", "depthwise_conv2d_nchw.cuda", [["TENSOR", [128, 672, 11, 11], "float32"], ["TENSOR", [672, 1, 7, 7], "float32"], 1, "SAME", 1, "float32"], {}], "config": {"index": 43458, "code_hash": null, "entity": [["tile_f", "sp", [-1, 2, 12, 4]], ["tile_y", "sp", [-1, 1, 1, 1]], ["tile_x", "sp", [-1, 1, 1, 1]], ["auto_unroll_max_step", "ot", 0], ["unroll_explicit", "ot", 1]]}, "result": [[0.945776375], 0, 7.411608934402466, 1639033329.6688511], "version": 0.2, "tvm_version": "0.8.dev0"}
{"input": ["cuda -keys=cuda,gpu -max_num_threads=1024 -thread_warp_size=32", "depthwise_conv2d_nchw.cuda", [["TENSOR", [128, 672, 11, 11], "float32"], ["TENSOR", [672, 1, 7, 7], "float32"], 1, "SAME", 1, "float32"], {}], "config": {"index": 16172, "code_hash": null, "entity": [["tile_f", "sp", [-1, 1, 3, 1]], ["tile_y", "sp", [-1, 1, 11, 1]], ["tile_x", "sp", [-1, 1, 1, 1]], ["auto_unroll_max_step", "ot", 256], ["unroll_explicit", "ot", 0]]}, "result": [[0.016558085714285714], 0, 2.471055507659912, 1639033332.6244097], "version": 0.2, "tvm_version": "0.8.dev0"}
{"input": ["cuda -keys=cuda,gpu -max_num_threads=1024 -thread_warp_size=32", "depthwise_conv2d_nchw.cuda", [["TENSOR", [128, 672, 11, 11], "float32"], ["TENSOR", [672, 1, 7, 7], "float32"], 1, "SAME", 1, "float32"], {}], "config": {"index": 38553, "code_hash": null, "entity": [["tile_f", "sp", [-1, 2, 2, 1]], ["tile_y", "sp", [-1, 1, 1, 11]], ["tile_x", "sp", [-1, 1, 11, 1]], ["auto_unroll_max_step", "ot", 1500], ["unroll_explicit", "ot", 0]]}, "result": [[0.0067355666666666664], 0, 3.832167625427246, 1639033451.5221107], "version": 0.2, "tvm_version": "0.8.dev0"}
{"input": ["cuda -keys=cuda,gpu -max_num_threads=1024 -thread_warp_size=32", "depthwise_conv2d_nchw.cuda", [["TENSOR", [128, 672, 11, 11], "float32"], ["TENSOR", [672, 1, 7, 7], "float32"], 1, "SAME", 1, "float32"], {}], "config": {"index": 9881, "code_hash": null, "entity": [["tile_f", "sp", [-1, 2, 2, 1]], ["tile_y", "sp", [-1, 1, 1, 11]], ["tile_x", "sp", [-1, 1, 11, 1]], ["auto_unroll_max_step", "ot", 0], ["unroll_explicit", "ot", 0]]}, "result": [[0.039165325], 0, 3.9028987884521484, 1639033454.1673477], "version": 0.2, "tvm_version": "0.8.dev0"}
{"input": ["cuda -keys=cuda,gpu -max_num_threads=1024 -thread_warp_size=32", "depthwise_conv2d_nchw.cuda", [["TENSOR", [128, 672, 11, 11], "float32"], ["TENSOR", [672, 1, 7, 7], "float32"], 1, "SAME", 1, "float32"], {}], "config": {"index": 24217, "code_hash": null, "entity": [["tile_f", "sp", [-1, 2, 2, 1]], ["tile_y", "sp", [-1, 1, 1, 11]], ["tile_x", "sp", [-1, 1, 11, 1]], ["auto_unroll_max_step", "ot", 256], ["unroll_explicit", "ot", 0]]}, "result": [[0.040115125], 0, 3.6098759174346924, 1639033457.611584], "version": 0.2, "tvm_version": "0.8.dev0"}
{"input": ["cuda -keys=cuda,gpu -max_num_threads=1024 -thread_warp_size=32", "depthwise_conv2d_nchw.cuda", [["TENSOR", [128, 672, 11, 11], "float32"], ["TENSOR", [672, 1, 7, 7], "float32"], 1, "SAME", 1, "float32"], {}], "config": {"index": 81561, "code_hash": null, "entity": [["tile_f", "sp", [-1, 2, 2, 1]], ["tile_y", "sp", [-1, 1, 1, 11]], ["tile_x", "sp", [-1, 1, 11, 1]], ["auto_unroll_max_step", "ot", 1500], ["unroll_explicit", "ot", 1]]}, "result": [[0.0034917344827586206], 0, 4.994903564453125, 1639033460.5358489], "version": 0.2, "tvm_version": "0.8.dev0"}
{"input": ["cuda -keys=cuda,gpu -max_num_threads=1024 -thread_warp_size=32", "depthwise_conv2d_nchw.cuda", [["TENSOR", [128, 672, 11, 11], "float32"], ["TENSOR", [672, 1, 7, 7], "float32"], 1, "SAME", 1, "float32"], {}], "config": {"index": 24249, "code_hash": null, "entity": [["tile_f", "sp", [-1, 2, 4, 1]], ["tile_y", "sp", [-1, 1, 1, 11]], ["tile_x", "sp", [-1, 1, 11, 1]], ["auto_unroll_max_step", "ot", 256], ["unroll_explicit", "ot", 0]]}, "result": [[0.032098425], 0, 4.130727529525757, 1639033462.7109542], "version": 0.2, "tvm_version": "0.8.dev0"}
{"input": ["cuda -keys=cuda,gpu -max_num_threads=1024 -thread_warp_size=32", "depthwise_conv2d_nchw.cuda", [["TENSOR", [128, 672, 11, 11], "float32"], ["TENSOR", [672, 1, 7, 7], "float32"], 1, "SAME", 1, "float32"], {}], "config": {"index": 9901, "code_hash": null, "entity": [["tile_f", "sp", [-1, 2, 3, 1]], ["tile_y", "sp", [-1, 1, 1, 11]], ["tile_x", "sp", [-1, 1, 11, 1]], ["auto_unroll_max_step", "ot", 0], ["unroll_explicit", "ot", 0]]}, "result": [[0.0377234], 0, 4.429727554321289, 1639033466.025467], "version": 0.2, "tvm_version": "0.8.dev0"}
{"input": ["cuda -keys=cuda,gpu -max_num_threads=1024 -thread_warp_size=32", "depthwise_conv2d_nchw.cuda", [["TENSOR", [128, 672, 11, 11], "float32"], ["TENSOR", [672, 1, 7, 7], "float32"], 1, "SAME", 1, "float32"], {}], "config": {"index": 9913, "code_hash": null, "entity": [["tile_f", "sp", [-1, 2, 4, 1]], ["tile_y", "sp", [-1, 1, 1, 11]], ["tile_x", "sp", [-1, 1, 11, 1]], ["auto_unroll_max_step", "ot", 0], ["unroll_explicit", "ot", 0]]}, "result": [[0.030032675], 0, 4.372354507446289, 1639033469.7316437], "version": 0.2, "tvm_version": "0.8.dev0"}
{"input": ["cuda -keys=cuda,gpu -max_num_threads=1024 -thread_warp_size=32", "depthwise_conv2d_nchw.cuda", [["TENSOR", [128, 672, 11, 11], "float32"], ["TENSOR", [672, 1, 7, 7], "float32"], 1, "SAME", 1, "float32"], {}], "config": {"index": 24237, "code_hash": null, "entity": [["tile_f", "sp", [-1, 2, 3, 1]], ["tile_y", "sp", [-1, 1, 1, 11]], ["tile_x", "sp", [-1, 1, 11, 1]], ["auto_unroll_max_step", "ot", 256], ["unroll_explicit", "ot", 0]]}, "result": [[0.03801515], 0, 3.7484567165374756, 1639033472.1103673], "version": 0.2, "tvm_version": "0.8.dev0"}
{"input": ["cuda -keys=cuda,gpu -max_num_threads=1024 -thread_warp_size=32", "depthwise_conv2d_nchw.cuda", [["TENSOR", [128, 672, 11, 11], "float32"], ["TENSOR", [672, 1, 7, 7], "float32"], 1, "SAME", 1, "float32"], {}], "config": {"index": 38584, "code_hash": null, "entity": [["tile_f", "sp", [-1, 1, 4, 1]], ["tile_y", "sp", [-1, 1, 1, 11]], ["tile_x", "sp", [-1, 1, 11, 1]], ["auto_unroll_max_step", "ot", 1500], ["unroll_explicit", "ot", 0]]}, "result": [[0.0029140142857142855], 0, 2.9387047290802, 1639033474.0707843], "version": 0.2, "tvm_version": "0.8.dev0"}
{"input": ["cuda -keys=cuda,gpu -max_num_threads=1024 -thread_warp_size=32", "depthwise_conv2d_nchw.cuda", [["TENSOR", [128, 672, 11, 11], "float32"], ["TENSOR", [672, 1, 7, 7], "float32"], 1, "SAME", 1, "float32"], {}], "config": {"index": 52889, "code_hash": null, "entity": [["tile_f", "sp", [-1, 2, 2, 1]], ["tile_y", "sp", [-1, 1, 1, 11]], ["tile_x", "sp", [-1, 1, 11, 1]], ["auto_unroll_max_step", "ot", 0], ["unroll_explicit", "ot", 1]]}, "result": [[0.031588075], 0, 3.434391736984253, 1639033476.2828214], "version": 0.2, "tvm_version": "0.8.dev0"}
{"input": ["cuda -keys=cuda,gpu -max_num_threads=1024 -thread_warp_size=32", "depthwise_conv2d_nchw.cuda", [["TENSOR", [128, 672, 11, 11], "float32"], ["TENSOR", [672, 1, 7, 7], "float32"], 1, "SAME", 1, "float32"], {}], "config": {"index": 67225, "code_hash": null, "entity": [["tile_f", "sp", [-1, 2, 2, 1]], ["tile_y", "sp", [-1, 1, 1, 11]], ["tile_x", "sp", [-1, 1, 11, 1]], ["auto_unroll_max_step", "ot", 256], ["unroll_explicit", "ot", 1]]}, "result": [[0.030791074999999998], 0, 3.966282606124878, 1639033479.163234], "version": 0.2, "tvm_version": "0.8.dev0"}
{"input": ["cuda -keys=cuda,gpu -max_num_threads=1024 -thread_warp_size=32", "depthwise_conv2d_nchw.cuda", [["TENSOR", [128, 672, 11, 11], "float32"], ["TENSOR", [672, 1, 7, 7], "float32"], 1, "SAME", 1, "float32"], {}], "config": {"index": 38585, "code_hash": null, "entity": [["tile_f", "sp", [-1, 2, 4, 1]], ["tile_y", "sp", [-1, 1, 1, 11]], ["tile_x", "sp", [-1, 1, 11, 1]], ["auto_unroll_max_step", "ot", 1500], ["unroll_explicit", "ot", 0]]}, "result": [[0.0050516], 0, 4.312868595123291, 1639033482.19116], "version": 0.2, "tvm_version": "0.8.dev0"}
{"input": ["cuda -keys=cuda,gpu -max_num_threads=1024 -thread_warp_size=32", "depthwise_conv2d_nchw.cuda", [["TENSOR", [128, 672, 11, 11], "float32"], ["TENSOR", [672, 1, 7, 7], "float32"], 1, "SAME", 1, "float32"], {}], "config": {"index": 38573, "code_hash": null, "entity": [["tile_f", "sp", [-1, 2, 3, 1]], ["tile_y", "sp", [-1, 1, 1, 11]], ["tile_x", "sp", [-1, 1, 11, 1]], ["auto_unroll_max_step", "ot", 1500], ["unroll_explicit", "ot", 0]]}, "result": [[0.0052087750000000006], 0, 3.444627046585083, 1639033484.2030923], "version": 0.2, "tvm_version": "0.8.dev0"}
{"input": ["cuda -keys=cuda,gpu -max_num_threads=1024 -thread_warp_size=32", "depthwise_conv2d_nchw.cuda", [["TENSOR", [128, 672, 11, 11], "float32"], ["TENSOR", [672, 1, 7, 7], "float32"], 1, "SAME", 1, "float32"], {}], "config": {"index": 24248, "code_hash": null, "entity": [["tile_f", "sp", [-1, 1, 4, 1]], ["tile_y", "sp", [-1, 1, 1, 11]], ["tile_x", "sp", [-1, 1, 11, 1]], ["auto_unroll_max_step", "ot", 256], ["unroll_explicit", "ot", 0]]}, "result": [[0.0272459], 0, 3.6397781372070312, 1639033487.018625], "version": 0.2, "tvm_version": "0.8.dev0"}
{"input": ["cuda -keys=cuda,gpu -max_num_threads=1024 -thread_warp_size=32", "depthwise_conv2d_nchw.cuda", [["TENSOR", [128, 672, 11, 11], "float32"], ["TENSOR", [672, 1, 7, 7], "float32"], 1, "SAME", 1, "float32"], {}], "config": {"index": 9912, "code_hash": null, "entity": [["tile_f", "sp", [-1, 1, 4, 1]], ["tile_y", "sp", [-1, 1, 1, 11]], ["tile_x", "sp", [-1, 1, 11, 1]], ["auto_unroll_max_step", "ot", 0], ["unroll_explicit", "ot", 0]]}, "result": [[0.027040175000000003], 0, 3.1092512607574463, 1639033489.0607467], "version": 0.2, "tvm_version": "0.8.dev0"}
{"input": ["cuda -keys=cuda,gpu -max_num_threads=1024 -thread_warp_size=32", "depthwise_conv2d_nchw.cuda", [["TENSOR", [128, 672, 11, 11], "float32"], ["TENSOR", [672, 1, 7, 7], "float32"], 1, "SAME", 1, "float32"], {}], "config": {"index": 52921, "code_hash": null, "entity": [["tile_f", "sp", [-1, 2, 4, 1]], ["tile_y", "sp", [-1, 1, 1, 11]], ["tile_x", "sp", [-1, 1, 11, 1]], ["auto_unroll_max_step", "ot", 0], ["unroll_explicit", "ot", 1]]}, "result": [[0.029454875000000002], 0, 3.5624005794525146, 1639033491.6509364], "version": 0.2, "tvm_version": "0.8.dev0"}
{"input": ["cuda -keys=cuda,gpu -max_num_threads=1024 -thread_warp_size=32", "depthwise_conv2d_nchw.cuda", [["TENSOR", [128, 672, 11, 11], "float32"], ["TENSOR", [672, 1, 7, 7], "float32"], 1, "SAME", 1, "float32"], {}], "config": {"index": 67257, "code_hash": null, "entity": [["tile_f", "sp", [-1, 2, 4, 1]], ["tile_y", "sp", [-1, 1, 1, 11]], ["tile_x", "sp", [-1, 1, 11, 1]], ["auto_unroll_max_step", "ot", 256], ["unroll_explicit", "ot", 1]]}, "result": [[0.029588999999999997], 0, 4.499817609786987, 1639033494.8171878], "version": 0.2, "tvm_version": "0.8.dev0"}
{"input": ["cuda -keys=cuda,gpu -max_num_threads=1024 -thread_warp_size=32", "depthwise_conv2d_nchw.cuda", [["TENSOR", [128, 672, 11, 11], "float32"], ["TENSOR", [672, 1, 7, 7], "float32"], 1, "SAME", 1, "float32"], {}], "config": {"index": 81593, "code_hash": null, "entity": [["tile_f", "sp", [-1, 2, 4, 1]], ["tile_y", "sp", [-1, 1, 1, 11]], ["tile_x", "sp", [-1, 1, 11, 1]], ["auto_unroll_max_step", "ot", 1500], ["unroll_explicit", "ot", 1]]}, "result": [[0.00316729375], 0, 5.443147897720337, 1639033497.2952757], "version": 0.2, "tvm_version": "0.8.dev0"}
{"input": ["cuda -keys=cuda,gpu -max_num_threads=1024 -thread_warp_size=32", "depthwise_conv2d_nchw.cuda", [["TENSOR", [128, 672, 11, 11], "float32"], ["TENSOR", [672, 1, 7, 7], "float32"], 1, "SAME", 1, "float32"], {}], "config": {"index": 67245, "code_hash": null, "entity": [["tile_f", "sp", [-1, 2, 3, 1]], ["tile_y", "sp", [-1, 1, 1, 11]], ["tile_x", "sp", [-1, 1, 11, 1]], ["auto_unroll_max_step", "ot", 256], ["unroll_explicit", "ot", 1]]}, "result": [[0.0379954], 0, 4.709076881408691, 1639033499.974525], "version": 0.2, "tvm_version": "0.8.dev0"}
{"input": ["cuda -keys=cuda,gpu -max_num_threads=1024 -thread_warp_size=32", "depthwise_conv2d_nchw.cuda", [["TENSOR", [128, 672, 11, 11], "float32"], ["TENSOR", [672, 1, 7, 7], "float32"], 1, "SAME", 1, "float32"], {}], "config": {"index": 52909, "code_hash": null, "entity": [["tile_f", "sp", [-1, 2, 3, 1]], ["tile_y", "sp", [-1, 1, 1, 11]], ["tile_x", "sp", [-1, 1, 11, 1]], ["auto_unroll_max_step", "ot", 0], ["unroll_explicit", "ot", 1]]}, "result": [[0.0380714], 0, 3.955137252807617, 1639033503.1016889], "version": 0.2, "tvm_version": "0.8.dev0"}
{"input": ["cuda -keys=cuda,gpu -max_num_threads=1024 -thread_warp_size=32", "depthwise_conv2d_nchw.cuda", [["TENSOR", [128, 672, 11, 11], "float32"], ["TENSOR", [672, 1, 7, 7], "float32"], 1, "SAME", 1, "float32"], {}], "config": {"index": 38555, "code_hash": null, "entity": [["tile_f", "sp", [-1, 4, 2, 1]], ["tile_y", "sp", [-1, 1, 1, 11]], ["tile_x", "sp", [-1, 1, 11, 1]], ["auto_unroll_max_step", "ot", 1500], ["unroll_explicit", "ot", 0]]}, "result": [[0.04514795], 0, 4.654425382614136, 1639033506.3805368], "version": 0.2, "tvm_version": "0.8.dev0"}
{"input": ["cuda -keys=cuda,gpu -max_num_threads=1024 -thread_warp_size=32", "depthwise_conv2d_nchw.cuda", [["TENSOR", [128, 672, 11, 11], "float32"], ["TENSOR", [672, 1, 7, 7], "float32"], 1, "SAME", 1, "float32"], {}], "config": {"index": 81581, "code_hash": null, "entity": [["tile_f", "sp", [-1, 2, 3, 1]], ["tile_y", "sp", [-1, 1, 1, 11]], ["tile_x", "sp", [-1, 1, 11, 1]], ["auto_unroll_max_step", "ot", 1500], ["unroll_explicit", "ot", 1]]}, "result": [[0.004432895652173913], 0, 5.703832387924194, 1639033509.2080066], "version": 0.2, "tvm_version": "0.8.dev0"}
{"input": ["cuda -keys=cuda,gpu -max_num_threads=1024 -thread_warp_size=32", "depthwise_conv2d_nchw.cuda", [["TENSOR", [128, 672, 11, 11], "float32"], ["TENSOR", [672, 1, 7, 7], "float32"], 1, "SAME", 1, "float32"], {}], "config": {"index": 38572, "code_hash": null, "entity": [["tile_f", "sp", [-1, 1, 3, 1]], ["tile_y", "sp", [-1, 1, 1, 11]], ["tile_x", "sp", [-1, 1, 11, 1]], ["auto_unroll_max_step", "ot", 1500], ["unroll_explicit", "ot", 0]]}, "result": [[0.004892190476190476], 0, 2.6748945713043213, 1639033510.9151897], "version": 0.2, "tvm_version": "0.8.dev0"}
{"input": ["cuda -keys=cuda,gpu -max_num_threads=1024 -thread_warp_size=32", "depthwise_conv2d_nchw.cuda", [["TENSOR", [128, 672, 11, 11], "float32"], ["TENSOR", [672, 1, 7, 7], "float32"], 1, "SAME", 1, "float32"], {}], "config": {"index": 38554, "code_hash": null, "entity": [["tile_f", "sp", [-1, 3, 2, 1]], ["tile_y", "sp", [-1, 1, 1, 11]], ["tile_x", "sp", [-1, 1, 11, 1]], ["auto_unroll_max_step", "ot", 1500], ["unroll_explicit", "ot", 0]]}, "result": [[0.036265], 0, 4.782552480697632, 1639033514.3500874], "version": 0.2, "tvm_version": "0.8.dev0"}
{"input": ["cuda -keys=cuda,gpu -max_num_threads=1024 -thread_warp_size=32", "depthwise_conv2d_nchw.cuda", [["TENSOR", [128, 672, 11, 11], "float32"], ["TENSOR", [672, 1, 7, 7], "float32"], 1, "SAME", 1, "float32"], {}], "config": {"index": 81592, "code_hash": null, "entity": [["tile_f", "sp", [-1, 1, 4, 1]], ["tile_y", "sp", [-1, 1, 1, 11]], ["tile_x", "sp", [-1, 1, 11, 1]], ["auto_unroll_max_step", "ot", 1500], ["unroll_explicit", "ot", 1]]}, "result": [[0.002638878947368421], 0, 2.9816012382507324, 1639033519.5198221], "version": 0.2, "tvm_version": "0.8.dev0"}
{"input": ["cuda -keys=cuda,gpu -max_num_threads=1024 -thread_warp_size=32", "depthwise_conv2d_nchw.cuda", [["TENSOR", [128, 672, 11, 11], "float32"], ["TENSOR", [672, 1, 7, 7], "float32"], 1, "SAME", 1, "float32"], {}], "config": {"index": 9929, "code_hash": null, "entity": [["tile_f", "sp", [-1, 2, 6, 1]], ["tile_y", "sp", [-1, 1, 1, 11]], ["tile_x", "sp", [-1, 1, 11, 1]], ["auto_unroll_max_step", "ot", 0], ["unroll_explicit", "ot", 0]]}, "result": [[0.029082825], 0, 2.408320903778076, 1639033521.4029665], "version": 0.2, "tvm_version": "0.8.dev0"}
{"input": ["cuda -keys=cuda,gpu -max_num_threads=1024 -thread_warp_size=32", "depthwise_conv2d_nchw.cuda", [["TENSOR", [128, 672, 11, 11], "float32"], ["TENSOR", [672, 1, 7, 7], "float32"], 1, "SAME", 1, "float32"], {}], "config": {"index": 24265, "code_hash": null, "entity": [["tile_f", "sp", [-1, 2, 6, 1]], ["tile_y", "sp", [-1, 1, 1, 11]], ["tile_x", "sp", [-1, 1, 11, 1]], ["auto_unroll_max_step", "ot", 256], ["unroll_explicit", "ot", 0]]}, "result": [[0.028986775000000003], 0, 3.398202419281006, 1639033524.6182237], "version": 0.2, "tvm_version": "0.8.dev0"}
{"input": ["cuda -keys=cuda,gpu -max_num_threads=1024 -thread_warp_size=32", "depthwise_conv2d_nchw.cuda", [["TENSOR", [128, 672, 11, 11], "float32"], ["TENSOR", [672, 1, 7, 7], "float32"], 1, "SAME", 1, "float32"], {}], "config": {"index": 38531, "code_hash": null, "entity": [["tile_f", "sp", [-1, 4, 1, 1]], ["tile_y", "sp", [-1, 1, 1, 11]], ["tile_x", "sp", [-1, 1, 11, 1]], ["auto_unroll_max_step", "ot", 1500], ["unroll_explicit", "ot", 0]]}, "result": [[0.065055025], 0, 3.9787960052490234, 1639033527.9814608], "version": 0.2, "tvm_version": "0.8.dev0"}
{"input": ["cuda -keys=cuda,gpu -max_num_threads=1024 -thread_warp_size=32", "depthwise_conv2d_nchw.cuda", [["TENSOR", [128, 672, 11, 11], "float32"], ["TENSOR", [672, 1, 7, 7], "float32"], 1, "SAME", 1, "float32"], {}], "config": {"index": 38600, "code_hash": null, "entity": [["tile_f", "sp", [-1, 1, 6, 1]], ["tile_y", "sp", [-1, 1, 1, 11]], ["tile_x", "sp", [-1, 1, 11, 1]], ["auto_unroll_max_step", "ot", 1500], ["unroll_explicit", "ot", 0]]}, "result": [[0.0027929594594594594], 0, 2.905381202697754, 1639033530.7875092], "version": 0.2, "tvm_version": "0.8.dev0"}
{"input": ["cuda -keys=cuda,gpu -max_num_threads=1024 -thread_warp_size=32", "depthwise_conv2d_nchw.cuda", [["TENSOR", [128, 672, 11, 11], "float32"], ["TENSOR", [672, 1, 7, 7], "float32"], 1, "SAME", 1, "float32"], {}], "config": {"index": 81563, "code_hash": null, "entity": [["tile_f", "sp", [-1, 4, 2, 1]], ["tile_y", "sp", [-1, 1, 1, 11]], ["tile_x", "sp", [-1, 1, 11, 1]], ["auto_unroll_max_step", "ot", 1500], ["unroll_explicit", "ot", 1]]}, "result": [[0.0349005], 0, 4.398589849472046, 1639033533.2668831], "version": 0.2, "tvm_version": "0.8.dev0"}
{"input": ["cuda -keys=cuda,gpu -max_num_threads=1024 -thread_warp_size=32", "depthwise_conv2d_nchw.cuda", [["TENSOR", [128, 672, 11, 11], "float32"], ["TENSOR", [672, 1, 7, 7], "float32"], 1, "SAME", 1, "float32"], {}], "config": {"index": 24236, "code_hash": null, "entity": [["tile_f", "sp", [-1, 1, 3, 1]], ["tile_y", "sp", [-1, 1, 1, 11]], ["tile_x", "sp", [-1, 1, 11, 1]], ["auto_unroll_max_step", "ot", 256], ["unroll_explicit", "ot", 0]]}, "result": [[0.03325115], 0, 2.2694830894470215, 1639033535.493113], "version": 0.2, "tvm_version": "0.8.dev0"}
{"input": ["cuda -keys=cuda,gpu -max_num_threads=1024 -thread_warp_size=32", "depthwise_conv2d_nchw.cuda", [["TENSOR", [128, 672, 11, 11], "float32"], ["TENSOR", [672, 1, 7, 7], "float32"], 1, "SAME", 1, "float32"], {}], "config": {"index": 9900, "code_hash": null, "entity": [["tile_f", "sp", [-1, 1, 3, 1]], ["tile_y", "sp", [-1, 1, 1, 11]], ["tile_x", "sp", [-1, 1, 11, 1]], ["auto_unroll_max_step", "ot", 0], ["unroll_explicit", "ot", 0]]}, "result": [[0.033255775], 0, 2.9860851764678955, 1639033537.9473922], "version": 0.2, "tvm_version": "0.8.dev0"}
{"input": ["cuda -keys=cuda,gpu -max_num_threads=1024 -thread_warp_size=32", "depthwise_conv2d_nchw.cuda", [["TENSOR", [128, 672, 11, 11], "float32"], ["TENSOR", [672, 1, 7, 7], "float32"], 1, "SAME", 1, "float32"], {}], "config": {"index": 9882, "code_hash": null, "entity": [["tile_f", "sp", [-1, 3, 2, 1]], ["tile_y", "sp", [-1, 1, 1, 11]], ["tile_x", "sp", [-1, 1, 11, 1]], ["auto_unroll_max_step", "ot", 0], ["unroll_explicit", "ot", 0]]}, "result": [[0.03409905], 0, 3.09867525100708, 1639033540.541589], "version": 0.2, "tvm_version": "0.8.dev0"}
{"input": ["cuda -keys=cuda,gpu -max_num_threads=1024 -thread_warp_size=32", "depthwise_conv2d_nchw.cuda", [["TENSOR", [128, 672, 11, 11], "float32"], ["TENSOR", [672, 1, 7, 7], "float32"], 1, "SAME", 1, "float32"], {}], "config": {"index": 24218, "code_hash": null, "entity": [["tile_f", "sp", [-1, 3, 2, 1]], ["tile_y", "sp", [-1, 1, 1, 11]], ["tile_x", "sp", [-1, 1, 11, 1]], ["auto_unroll_max_step", "ot", 256], ["unroll_explicit", "ot", 0]]}, "result": [[0.033918275000000005], 0, 3.2896831035614014, 1639033543.6901588], "version": 0.2, "tvm_version": "0.8.dev0"}
{"input": ["cuda -keys=cuda,gpu -max_num_threads=1024 -thread_warp_size=32", "depthwise_conv2d_nchw.cuda", [["TENSOR", [128, 672, 11, 11], "float32"], ["TENSOR", [672, 1, 7, 7], "float32"], 1, "SAME", 1, "float32"], {}], "config": {"index": 24219, "code_hash": null, "entity": [["tile_f", "sp", [-1, 4, 2, 1]], ["tile_y", "sp", [-1, 1, 1, 11]], ["tile_x", "sp", [-1, 1, 11, 1]], ["auto_unroll_max_step", "ot", 256], ["unroll_explicit", "ot", 0]]}, "result": [[0.038380225000000004], 0, 3.5185906887054443, 1639033546.967317], "version": 0.2, "tvm_version": "0.8.dev0"}
{"input": ["cuda -keys=cuda,gpu -max_num_threads=1024 -thread_warp_size=32", "depthwise_conv2d_nchw.cuda", [["TENSOR", [128, 672, 11, 11], "float32"], ["TENSOR", [672, 1, 7, 7], "float32"], 1, "SAME", 1, "float32"], {}], "config": {"index": 9883, "code_hash": null, "entity": [["tile_f", "sp", [-1, 4, 2, 1]], ["tile_y", "sp", [-1, 1, 1, 11]], ["tile_x", "sp", [-1, 1, 11, 1]], ["auto_unroll_max_step", "ot", 0], ["unroll_explicit", "ot", 0]]}, "result": [[0.037685175], 0, 2.5593857765197754, 1639033549.462914], "version": 0.2, "tvm_version": "0.8.dev0"}
{"input": ["cuda -keys=cuda,gpu -max_num_threads=1024 -thread_warp_size=32", "depthwise_conv2d_nchw.cuda", [["TENSOR", [128, 672, 11, 11], "float32"], ["TENSOR", [672, 1, 7, 7], "float32"], 1, "SAME", 1, "float32"], {}], "config": {"index": 67256, "code_hash": null, "entity": [["tile_f", "sp", [-1, 1, 4, 1]], ["tile_y", "sp", [-1, 1, 1, 11]], ["tile_x", "sp", [-1, 1, 11, 1]], ["auto_unroll_max_step", "ot", 256], ["unroll_explicit", "ot", 1]]}, "result": [[0.027599425], 0, 3.094170570373535, 1639033552.2712777], "version": 0.2, "tvm_version": "0.8.dev0"}
{"input": ["cuda -keys=cuda,gpu -max_num_threads=1024 -thread_warp_size=32", "depthwise_conv2d_nchw.cuda", [["TENSOR", [128, 672, 11, 11], "float32"], ["TENSOR", [672, 1, 7, 7], "float32"], 1, "SAME", 1, "float32"], {}], "config": {"index": 52920, "code_hash": null, "entity": [["tile_f", "sp", [-1, 1, 4, 1]], ["tile_y", "sp", [-1, 1, 1, 11]], ["tile_x", "sp", [-1, 1, 11, 1]], ["auto_unroll_max_step", "ot", 0], ["unroll_explicit", "ot", 1]]}, "result": [[0.027082799999999997], 0, 2.8255202770233154, 1639033554.551759], "version": 0.2, "tvm_version": "0.8.dev0"}
{"input": ["cuda -keys=cuda,gpu -max_num_threads=1024 -thread_warp_size=32", "depthwise_conv2d_nchw.cuda", [["TENSOR", [128, 672, 11, 11], "float32"], ["TENSOR", [672, 1, 7, 7], "float32"], 1, "SAME", 1, "float32"], {}], "config": {"index": 24264, "code_hash": null, "entity": [["tile_f", "sp", [-1, 1, 6, 1]], ["tile_y", "sp", [-1, 1, 1, 11]], ["tile_x", "sp", [-1, 1, 11, 1]], ["auto_unroll_max_step", "ot", 256], ["unroll_explicit", "ot", 0]]}, "result": [[0.02760455], 0, 2.7895302772521973, 1639033556.888466], "version": 0.2, "tvm_version": "0.8.dev0"}
{"input": ["cuda -keys=cuda,gpu -max_num_threads=1024 -thread_warp_size=32", "depthwise_conv2d_nchw.cuda", [["TENSOR", [128, 672, 11, 11], "float32"], ["TENSOR", [672, 1, 7, 7], "float32"], 1, "SAME", 1, "float32"], {}], "config": {"index": 9928, "code_hash": null, "entity": [["tile_f", "sp", [-1, 1, 6, 1]], ["tile_y", "sp", [-1, 1, 1, 11]], ["tile_x", "sp", [-1, 1, 11, 1]], ["auto_unroll_max_step", "ot", 0], ["unroll_explicit", "ot", 0]]}, "result": [[0.0275409], 0, 2.208723783493042, 1639033558.6386228], "version": 0.2, "tvm_version": "0.8.dev0"}
{"input": ["cuda -keys=cuda,gpu -max_num_threads=1024 -thread_warp_size=32", "depthwise_conv2d_nchw.cuda", [["TENSOR", [128, 672, 11, 11], "float32"], ["TENSOR", [672, 1, 7, 7], "float32"], 1, "SAME", 1, "float32"], {}], "config": {"index": 38601, "code_hash": null, "entity": [["tile_f", "sp", [-1, 2, 6, 1]], ["tile_y", "sp", [-1, 1, 1, 11]], ["tile_x", "sp", [-1, 1, 11, 1]], ["auto_unroll_max_step", "ot", 1500], ["unroll_explicit", "ot", 0]]}, "result": [[0.005554378947368421], 0, 3.157724142074585, 1639033561.223559], "version": 0.2, "tvm_version": "0.8.dev0"}
{"input": ["cuda -keys=cuda,gpu -max_num_threads=1024 -thread_warp_size=32", "depthwise_conv2d_nchw.cuda", [["TENSOR", [128, 672, 11, 11], "float32"], ["TENSOR", [672, 1, 7, 7], "float32"], 1, "SAME", 1, "float32"], {}], "config": {"index": 24250, "code_hash": null, "entity": [["tile_f", "sp", [-1, 3, 4, 1]], ["tile_y", "sp", [-1, 1, 1, 11]], ["tile_x", "sp", [-1, 1, 11, 1]], ["auto_unroll_max_step", "ot", 256], ["unroll_explicit", "ot", 0]]}, "result": [[0.038702525], 0, 3.3740975856781006, 1639033564.272736], "version": 0.2, "tvm_version": "0.8.dev0"}
{"input": ["cuda -keys=cuda,gpu -max_num_threads=1024 -thread_warp_size=32", "depthwise_conv2d_nchw.cuda", [["TENSOR", [128, 672, 11, 11], "float32"], ["TENSOR", [672, 1, 7, 7], "float32"], 1, "SAME", 1, "float32"], {}], "config": {"index": 9914, "code_hash": null, "entity": [["tile_f", "sp", [-1, 3, 4, 1]], ["tile_y", "sp", [-1, 1, 1, 11]], ["tile_x", "sp", [-1, 1, 11, 1]], ["auto_unroll_max_step", "ot", 0], ["unroll_explicit", "ot", 0]]}, "result": [[0.0365839], 0, 3.3302536010742188, 1639033567.5953755], "version": 0.2, "tvm_version": "0.8.dev0"}
{"input": ["cuda -keys=cuda,gpu -max_num_threads=1024 -thread_warp_size=32", "depthwise_conv2d_nchw.cuda", [["TENSOR", [128, 672, 11, 11], "float32"], ["TENSOR", [672, 1, 7, 7], "float32"], 1, "SAME", 1, "float32"], {}], "config": {"index": 24251, "code_hash": null, "entity": [["tile_f", "sp", [-1, 4, 4, 1]], ["tile_y", "sp", [-1, 1, 1, 11]], ["tile_x", "sp", [-1, 1, 11, 1]], ["auto_unroll_max_step", "ot", 256], ["unroll_explicit", "ot", 0]]}, "result": [[0.04037505], 0, 2.586162567138672, 1639033570.0037239], "version": 0.2, "tvm_version": "0.8.dev0"}
{"input": ["cuda -keys=cuda,gpu -max_num_threads=1024 -thread_warp_size=32", "depthwise_conv2d_nchw.cuda", [["TENSOR", [128, 672, 11, 11], "float32"], ["TENSOR", [672, 1, 7, 7], "float32"], 1, "SAME", 1, "float32"], {}], "config": {"index": 9915, "code_hash": null, "entity": [["tile_f", "sp", [-1, 4, 4, 1]], ["tile_y", "sp", [-1, 1, 1, 11]], ["tile_x", "sp", [-1, 1, 11, 1]], ["auto_unroll_max_step", "ot", 0], ["unroll_explicit", "ot", 0]]}, "result": [[0.038473375], 0, 2.4563663005828857, 1639033572.3182395], "version": 0.2, "tvm_version": "0.8.dev0"}
{"input": ["cuda -keys=cuda,gpu -max_num_threads=1024 -thread_warp_size=32", "depthwise_conv2d_nchw.cuda", [["TENSOR", [128, 672, 11, 11], "float32"], ["TENSOR", [672, 1, 7, 7], "float32"], 1, "SAME", 1, "float32"], {}], "config": {"index": 67273, "code_hash": null, "entity": [["tile_f", "sp", [-1, 2, 6, 1]], ["tile_y", "sp", [-1, 1, 1, 11]], ["tile_x", "sp", [-1, 1, 11, 1]], ["auto_unroll_max_step", "ot", 256], ["unroll_explicit", "ot", 1]]}, "result": [[0.027668824999999998], 0, 3.6385555267333984, 1639033575.4187644], "version": 0.2, "tvm_version": "0.8.dev0"}
{"input": ["cuda -keys=cuda,gpu -max_num_threads=1024 -thread_warp_size=32", "depthwise_conv2d_nchw.cuda", [["TENSOR", [128, 672, 11, 11], "float32"], ["TENSOR", [672, 1, 7, 7], "float32"], 1, "SAME", 1, "float32"], {}], "config": {"index": 52937, "code_hash": null, "entity": [["tile_f", "sp", [-1, 2, 6, 1]], ["tile_y", "sp", [-1, 1, 1, 11]], ["tile_x", "sp", [-1, 1, 11, 1]], ["auto_unroll_max_step", "ot", 0], ["unroll_explicit", "ot", 1]]}, "result": [[0.028903925], 0, 3.4515397548675537, 1639033578.72015], "version": 0.2, "tvm_version": "0.8.dev0"}
{"input": ["cuda -keys=cuda,gpu -max_num_threads=1024 -thread_warp_size=32", "depthwise_conv2d_nchw.cuda", [["TENSOR", [128, 672, 11, 11], "float32"], ["TENSOR", [672, 1, 7, 7], "float32"], 1, "SAME", 1, "float32"], {}], "config": {"index": 24238, "code_hash": null, "entity": [["tile_f", "sp", [-1, 4, 3, 1]], ["tile_y", "sp", [-1, 1, 1, 11]], ["tile_x", "sp", [-1, 1, 11, 1]], ["auto_unroll_max_step", "ot", 256], ["unroll_explicit", "ot", 0]]}, "result": [[0.042307775], 0, 3.3425252437591553, 1639033581.7912223], "version": 0.2, "tvm_version": "0.8.dev0"}
{"input": ["cuda -keys=cuda,gpu -max_num_threads=1024 -thread_warp_size=32", "depthwise_conv2d_nchw.cuda", [["TENSOR", [128, 672, 11, 11], "float32"], ["TENSOR", [672, 1, 7, 7], "float32"], 1, "SAME", 1, "float32"], {}], "config": {"index": 9902, "code_hash": null, "entity": [["tile_f", "sp", [-1, 4, 3, 1]], ["tile_y", "sp", [-1, 1, 1, 11]], ["tile_x", "sp", [-1, 1, 11, 1]], ["auto_unroll_max_step", "ot", 0], ["unroll_explicit", "ot", 0]]}, "result": [[0.04227265], 0, 2.2727315425872803, 1639033592.6901171], "version": 0.2, "tvm_version": "0.8.dev0"}
{"input": ["cuda -keys=cuda,gpu -max_num_threads=1024 -thread_warp_size=32", "depthwise_conv2d_nchw.cuda", [["TENSOR", [128, 672, 11, 11], "float32"], ["TENSOR", [672, 1, 7, 7], "float32"], 1, "SAME", 1, "float32"], {}], "config": {"index": 38574, "code_hash": null, "entity": [["tile_f", "sp", [-1, 4, 3, 1]], ["tile_y", "sp", [-1, 1, 1, 11]], ["tile_x", "sp", [-1, 1, 11, 1]], ["auto_unroll_max_step", "ot", 1500], ["unroll_explicit", "ot", 0]]}, "result": [[0.04214065], 0, 3.8474178314208984, 1639033595.960991], "version": 0.2, "tvm_version": "0.8.dev0"}
{"input": ["cuda -keys=cuda,gpu -max_num_threads=1024 -thread_warp_size=32", "depthwise_conv2d_nchw.cuda", [["TENSOR", [128, 672, 11, 11], "float32"], ["TENSOR", [672, 1, 7, 7], "float32"], 1, "SAME", 1, "float32"], {}], "config": {"index": 9859, "code_hash": null, "entity": [["tile_f", "sp", [-1, 4, 1, 1]], ["tile_y", "sp", [-1, 1, 1, 11]], ["tile_x", "sp", [-1, 1, 11, 1]], ["auto_unroll_max_step", "ot", 0], ["unroll_explicit", "ot", 0]]}, "result": [[0.063835], 0, 3.40360689163208, 1639033599.358473], "version": 0.2, "tvm_version": "0.8.dev0"}
{"input": ["cuda -keys=cuda,gpu -max_num_threads=1024 -thread_warp_size=32", "depthwise_conv2d_nchw.cuda", [["TENSOR", [128, 672, 11, 11], "float32"], ["TENSOR", [672, 1, 7, 7], "float32"], 1, "SAME", 1, "float32"], {}], "config": {"index": 24195, "code_hash": null, "entity": [["tile_f", "sp", [-1, 4, 1, 1]], ["tile_y", "sp", [-1, 1, 1, 11]], ["tile_x", "sp", [-1, 1, 11, 1]], ["auto_unroll_max_step", "ot", 256], ["unroll_explicit", "ot", 0]]}, "result": [[0.06342165], 0, 2.897756814956665, 1639033602.1441138], "version": 0.2, "tvm_version": "0.8.dev0"}
{"input": ["cuda -keys=cuda,gpu -max_num_threads=1024 -thread_warp_size=32", "depthwise_conv2d_nchw.cuda", [["TENSOR", [128, 672, 11, 11], "float32"], ["TENSOR", [672, 1, 7, 7], "float32"], 1, "SAME", 1, "float32"], {}], "config": {"index": 9939, "code_hash": null, "entity": [["tile_f", "sp", [-1, 2, 7, 1]], ["tile_y", "sp", [-1, 1, 1, 11]], ["tile_x", "sp", [-1, 1, 11, 1]], ["auto_unroll_max_step", "ot", 0], ["unroll_explicit", "ot", 0]]}, "result": [[0.029939399999999998], 0, 2.4618165493011475, 1639033604.5088654], "version": 0.2, "tvm_version": "0.8.dev0"}
{"input": ["cuda -keys=cuda,gpu -max_num_threads=1024 -thread_warp_size=32", "depthwise_conv2d_nchw.cuda", [["TENSOR", [128, 672, 11, 11], "float32"], ["TENSOR", [672, 1, 7, 7], "float32"], 1, "SAME", 1, "float32"], {}], "config": {"index": 24275, "code_hash": null, "entity": [["tile_f", "sp", [-1, 2, 7, 1]], ["tile_y", "sp", [-1, 1, 1, 11]], ["tile_x", "sp", [-1, 1, 11, 1]], ["auto_unroll_max_step", "ot", 256], ["unroll_explicit", "ot", 0]]}, "result": [[0.02730535], 0, 3.1228272914886475, 1639033607.4032426], "version": 0.2, "tvm_version": "0.8.dev0"}
{"input": ["cuda -keys=cuda,gpu -max_num_threads=1024 -thread_warp_size=32", "depthwise_conv2d_nchw.cuda", [["TENSOR", [128, 672, 11, 11], "float32"], ["TENSOR", [672, 1, 7, 7], "float32"], 1, "SAME", 1, "float32"], {}], "config": {"index": 67227, "code_hash": null, "entity": [["tile_f", "sp", [-1, 4, 2, 1]], ["tile_y", "sp", [-1, 1, 1, 11]], ["tile_x", "sp", [-1, 1, 11, 1]], ["auto_unroll_max_step", "ot", 256], ["unroll_explicit", "ot", 1]]}, "result": [[0.03497135], 0, 4.281635046005249, 1639033610.6541538], "version": 0.2, "tvm_version": "0.8.dev0"}
{"input": ["cuda -keys=cuda,gpu -max_num_threads=1024 -thread_warp_size=32", "depthwise_conv2d_nchw.cuda", [["TENSOR", [128, 672, 11, 11], "float32"], ["TENSOR", [672, 1, 7, 7], "float32"], 1, "SAME", 1, "float32"], {}], "config": {"index": 52891, "code_hash": null, "entity": [["tile_f", "sp", [-1, 4, 2, 1]], ["tile_y", "sp", [-1, 1, 1, 11]], ["tile_x", "sp", [-1, 1, 11, 1]], ["auto_unroll_max_step", "ot", 0], ["unroll_explicit", "ot", 1]]}, "result": [[0.03765305], 0, 2.7296435832977295, 1639033613.3462796], "version": 0.2, "tvm_version": "0.8.dev0"}
{"input": ["cuda -keys=cuda,gpu -max_num_threads=1024 -thread_warp_size=32", "depthwise_conv2d_nchw.cuda", [["TENSOR", [128, 672, 11, 11], "float32"], ["TENSOR", [672, 1, 7, 7], "float32"], 1, "SAME", 1, "float32"], {}], "config": {"index": 81562, "code_hash": null, "entity": [["tile_f", "sp", [-1, 3, 2, 1]], ["tile_y", "sp", [-1, 1, 1, 11]], ["tile_x", "sp", [-1, 1, 11, 1]], ["auto_unroll_max_step", "ot", 1500], ["unroll_explicit", "ot", 1]]}, "result": [[0.0362983], 0, 4.75486421585083, 1639033616.908409], "version": 0.2, "tvm_version": "0.8.dev0"}
{"input": ["cuda -keys=cuda,gpu -max_num_threads=1024 -thread_warp_size=32", "depthwise_conv2d_nchw.cuda", [["TENSOR", [128, 672, 11, 11], "float32"], ["TENSOR", [672, 1, 7, 7], "float32"], 1, "SAME", 1, "float32"], {}], "config": {"index": 38586, "code_hash": null, "entity": [["tile_f", "sp", [-1, 3, 4, 1]], ["tile_y", "sp", [-1, 1, 1, 11]], ["tile_x", "sp", [-1, 1, 11, 1]], ["auto_unroll_max_step", "ot", 1500], ["unroll_explicit", "ot", 0]]}, "result": [[0.034864675], 0, 3.9271602630615234, 1639033620.54007], "version": 0.2, "tvm_version": "0.8.dev0"}
{"input": ["cuda -keys=cuda,gpu -max_num_threads=1024 -thread_warp_size=32", "depthwise_conv2d_nchw.cuda", [["TENSOR", [128, 672, 11, 11], "float32"], ["TENSOR", [672, 1, 7, 7], "float32"], 1, "SAME", 1, "float32"], {}], "config": {"index": 81609, "code_hash": null, "entity": [["tile_f", "sp", [-1, 2, 6, 1]], ["tile_y", "sp", [-1, 1, 1, 11]], ["tile_x", "sp", [-1, 1, 11, 1]], ["auto_unroll_max_step", "ot", 1500], ["unroll_explicit", "ot", 1]]}, "result": [[0.003275522580645161], 0, 4.912360191345215, 1639033624.087017], "version": 0.2, "tvm_version": "0.8.dev0"}
{"input": ["cuda -keys=cuda,gpu -max_num_threads=1024 -thread_warp_size=32", "depthwise_conv2d_nchw.cuda", [["TENSOR", [128, 672, 11, 11], "float32"], ["TENSOR", [672, 1, 7, 7], "float32"], 1, "SAME", 1, "float32"], {}], "config": {"index": 38556, "code_hash": null, "entity": [["tile_f", "sp", [-1, 6, 2, 1]], ["tile_y", "sp", [-1, 1, 1, 11]], ["tile_x", "sp", [-1, 1, 11, 1]], ["auto_unroll_max_step", "ot", 1500], ["unroll_explicit", "ot", 0]]}, "result": [[0.05796725], 0, 4.878389358520508, 1639033627.2581396], "version": 0.2, "tvm_version": "0.8.dev0"}
{"input": ["cuda -keys=cuda,gpu -max_num_threads=1024 -thread_warp_size=32", "depthwise_conv2d_nchw.cuda", [["TENSOR", [128, 672, 11, 11], "float32"], ["TENSOR", [672, 1, 7, 7], "float32"], 1, "SAME", 1, "float32"], {}], "config": {"index": 38610, "code_hash": null, "entity": [["tile_f", "sp", [-1, 1, 7, 1]], ["tile_y", "sp", [-1, 1, 1, 11]], ["tile_x", "sp", [-1, 1, 11, 1]], ["auto_unroll_max_step", "ot", 1500], ["unroll_explicit", "ot", 0]]}, "result": [[0.0025922717948717953], 0, 2.4587910175323486, 1639033630.169662], "version": 0.2, "tvm_version": "0.8.dev0"}
{"input": ["cuda -keys=cuda,gpu -max_num_threads=1024 -thread_warp_size=32", "depthwise_conv2d_nchw.cuda", [["TENSOR", [128, 672, 11, 11], "float32"], ["TENSOR", [672, 1, 7, 7], "float32"], 1, "SAME", 1, "float32"], {}], "config": {"index": 71704, "code_hash": null, "entity": [["tile_f", "sp", [-1, 1, 2, 1]], ["tile_y", "sp", [-1, 1, 1, 1]], ["tile_x", "sp", [-1, 1, 1, 1]], ["auto_unroll_max_step", "ot", 1500], ["unroll_explicit", "ot", 1]]}, "result": [[0.417625625], 0, 5.287655591964722, 1639033635.0389328], "version": 0.2, "tvm_version": "0.8.dev0"}
{"input": ["cuda -keys=cuda,gpu -max_num_threads=1024 -thread_warp_size=32", "depthwise_conv2d_nchw.cuda", [["TENSOR", [128, 672, 11, 11], "float32"], ["TENSOR", [672, 1, 7, 7], "float32"], 1, "SAME", 1, "float32"], {}], "config": {"index": 6806, "code_hash": null, "entity": [["tile_f", "sp", [-1, 1, 2, 7]], ["tile_y", "sp", [-1, 1, 1, 11]], ["tile_x", "sp", [-1, 11, 1, 1]], ["auto_unroll_max_step", "ot", 0], ["unroll_explicit", "ot", 0]]}, "result": [[0.5197744249999999], 0, 5.662258625030518, 1639033640.0887642], "version": 0.2, "tvm_version": "0.8.dev0"}
{"input": ["cuda -keys=cuda,gpu -max_num_threads=1024 -thread_warp_size=32", "depthwise_conv2d_nchw.cuda", [["TENSOR", [128, 672, 11, 11], "float32"], ["TENSOR", [672, 1, 7, 7], "float32"], 1, "SAME", 1, "float32"], {}], "config": {"index": 67695, "code_hash": null, "entity": [["tile_f", "sp", [-1, 1, 4, 6]], ["tile_y", "sp", [-1, 1, 1, 11]], ["tile_x", "sp", [-1, 1, 11, 1]], ["auto_unroll_max_step", "ot", 256], ["unroll_explicit", "ot", 1]]}, "result": [[0.037200125], 0, 4.211174011230469, 1639033642.9637988], "version": 0.2, "tvm_version": "0.8.dev0"}
{"input": ["cuda -keys=cuda,gpu -max_num_threads=1024 -thread_warp_size=32", "depthwise_conv2d_nchw.cuda", [["TENSOR", [128, 672, 11, 11], "float32"], ["TENSOR", [672, 1, 7, 7], "float32"], 1, "SAME", 1, "float32"], {}], "config": {"index": 73001, "code_hash": null, "entity": [["tile_f", "sp", [-1, 3, 4, 4]], ["tile_y", "sp", [-1, 11, 1, 1]], ["tile_x", "sp", [-1, 1, 1, 1]], ["auto_unroll_max_step", "ot", 1500], ["unroll_explicit", "ot", 1]]}, "result": [[0.7441321000000001], 0, 19.56685519218445, 1639033654.4824803], "version": 0.2, "tvm_version": "0.8.dev0"}
{"input": ["cuda -keys=cuda,gpu -max_num_threads=1024 -thread_warp_size=32", "depthwise_conv2d_nchw.cuda", [["TENSOR", [128, 672, 11, 11], "float32"], ["TENSOR", [672, 1, 7, 7], "float32"], 1, "SAME", 1, "float32"], {}], "config": {"index": 37957, "code_hash": null, "entity": [["tile_f", "sp", [-1, 2, 1, 3]], ["tile_y", "sp", [-1, 1, 11, 1]], ["tile_x", "sp", [-1, 1, 11, 1]], ["auto_unroll_max_step", "ot", 1500], ["unroll_explicit", "ot", 0]]}, "result": [[0.005528484210526316], 0, 3.0076851844787598, 1639033709.8143678], "version": 0.2, "tvm_version": "0.8.dev0"}
{"input": ["cuda -keys=cuda,gpu -max_num_threads=1024 -thread_warp_size=32", "depthwise_conv2d_nchw.cuda", [["TENSOR", [128, 672, 11, 11], "float32"], ["TENSOR", [672, 1, 7, 7], "float32"], 1, "SAME", 1, "float32"], {}], "config": {"index": 37677, "code_hash": null, "entity": [["tile_f", "sp", [-1, 2, 3, 1]], ["tile_y", "sp", [-1, 1, 11, 1]], ["tile_x", "sp", [-1, 1, 11, 1]], ["auto_unroll_max_step", "ot", 1500], ["unroll_explicit", "ot", 0]]}, "result": [[0.00635708125], 0, 4.182864665985107, 1639033713.214515], "version": 0.2, "tvm_version": "0.8.dev0"}
{"input": ["cuda -keys=cuda,gpu -max_num_threads=1024 -thread_warp_size=32", "depthwise_conv2d_nchw.cuda", [["TENSOR", [128, 672, 11, 11], "float32"], ["TENSOR", [672, 1, 7, 7], "float32"], 1, "SAME", 1, "float32"], {}], "config": {"index": 37842, "code_hash": null, "entity": [["tile_f", "sp", [-1, 2, 2, 2]], ["tile_y", "sp", [-1, 1, 11, 1]], ["tile_x", "sp", [-1, 1, 11, 1]], ["auto_unroll_max_step", "ot", 1500], ["unroll_explicit", "ot", 0]]}, "result": [[0.00593692], 0, 3.5075340270996094, 1639033715.6049235], "version": 0.2, "tvm_version": "0.8.dev0"}
{"input": ["cuda -keys=cuda,gpu -max_num_threads=1024 -thread_warp_size=32", "depthwise_conv2d_nchw.cuda", [["TENSOR", [128, 672, 11, 11], "float32"], ["TENSOR", [672, 1, 7, 7], "float32"], 1, "SAME", 1, "float32"], {}], "config": {"index": 37857, "code_hash": null, "entity": [["tile_f", "sp", [-1, 1, 3, 2]], ["tile_y", "sp", [-1, 1, 11, 1]], ["tile_x", "sp", [-1, 1, 11, 1]], ["auto_unroll_max_step", "ot", 1500], ["unroll_explicit", "ot", 0]]}, "result": [[0.005792468421052631], 0, 3.9121880531311035, 1639033718.8143969], "version": 0.2, "tvm_version": "0.8.dev0"}
{"input": ["cuda -keys=cuda,gpu -max_num_threads=1024 -thread_warp_size=32", "depthwise_conv2d_nchw.cuda", [["TENSOR", [128, 672, 11, 11], "float32"], ["TENSOR", [672, 1, 7, 7], "float32"], 1, "SAME", 1, "float32"], {}], "config": {"index": 37968, "code_hash": null, "entity": [["tile_f", "sp", [-1, 1, 2, 3]], ["tile_y", "sp", [-1, 1, 11, 1]], ["tile_x", "sp", [-1, 1, 11, 1]], ["auto_unroll_max_step", "ot", 1500], ["unroll_explicit", "ot", 0]]}, "result": [[0.006183405882352941], 0, 3.7497315406799316, 1639033721.6588798], "version": 0.2, "tvm_version": "0.8.dev0"}
{"input": ["cuda -keys=cuda,gpu -max_num_threads=1024 -thread_warp_size=32", "depthwise_conv2d_nchw.cuda", [["TENSOR", [128, 672, 11, 11], "float32"], ["TENSOR", [672, 1, 7, 7], "float32"], 1, "SAME", 1, "float32"], {}], "config": {"index": 38109, "code_hash": null, "entity": [["tile_f", "sp", [-1, 1, 1, 6]], ["tile_y", "sp", [-1, 1, 11, 1]], ["tile_x", "sp", [-1, 1, 11, 1]], ["auto_unroll_max_step", "ot", 1500], ["unroll_explicit", "ot", 0]]}, "result": [[0.0045558863636363635], 0, 3.316556453704834, 1639033723.5784957], "version": 0.2, "tvm_version": "0.8.dev0"}
{"input": ["cuda -keys=cuda,gpu -max_num_threads=1024 -thread_warp_size=32", "depthwise_conv2d_nchw.cuda", [["TENSOR", [128, 672, 11, 11], "float32"], ["TENSOR", [672, 1, 7, 7], "float32"], 1, "SAME", 1, "float32"], {}], "config": {"index": 37657, "code_hash": null, "entity": [["tile_f", "sp", [-1, 2, 2, 1]], ["tile_y", "sp", [-1, 1, 11, 1]], ["tile_x", "sp", [-1, 1, 11, 1]], ["auto_unroll_max_step", "ot", 1500], ["unroll_explicit", "ot", 0]]}, "result": [[0.005644027777777778], 0, 3.756504535675049, 1639033726.045669], "version": 0.2, "tvm_version": "0.8.dev0"}
{"input": ["cuda -keys=cuda,gpu -max_num_threads=1024 -thread_warp_size=32", "depthwise_conv2d_nchw.cuda", [["TENSOR", [128, 672, 11, 11], "float32"], ["TENSOR", [672, 1, 7, 7], "float32"], 1, "SAME", 1, "float32"], {}], "config": {"index": 37841, "code_hash": null, "entity": [["tile_f", "sp", [-1, 1, 2, 2]], ["tile_y", "sp", [-1, 1, 11, 1]], ["tile_x", "sp", [-1, 1, 11, 1]], ["auto_unroll_max_step", "ot", 1500], ["unroll_explicit", "ot", 0]]}, "result": [[0.004538263999999999], 0, 3.2706685066223145, 1639033728.239033], "version": 0.2, "tvm_version": "0.8.dev0"}
{"input": ["cuda -keys=cuda,gpu -max_num_threads=1024 -thread_warp_size=32", "depthwise_conv2d_nchw.cuda", [["TENSOR", [128, 672, 11, 11], "float32"], ["TENSOR", [672, 1, 7, 7], "float32"], 1, "SAME", 1, "float32"], {}], "config": {"index": 80965, "code_hash": null, "entity": [["tile_f", "sp", [-1, 2, 1, 3]], ["tile_y", "sp", [-1, 1, 11, 1]], ["tile_x", "sp", [-1, 1, 11, 1]], ["auto_unroll_max_step", "ot", 1500], ["unroll_explicit", "ot", 1]]}, "result": [[0.004011603999999999], 0, 4.1384053230285645, 1639033730.725792], "version": 0.2, "tvm_version": "0.8.dev0"}
{"input": ["cuda -keys=cuda,gpu -max_num_threads=1024 -thread_warp_size=32", "depthwise_conv2d_nchw.cuda", [["TENSOR", [128, 672, 11, 11], "float32"], ["TENSOR", [672, 1, 7, 7], "float32"], 1, "SAME", 1, "float32"], {}], "config": {"index": 80685, "code_hash": null, "entity": [["tile_f", "sp", [-1, 2, 3, 1]], ["tile_y", "sp", [-1, 1, 11, 1]], ["tile_x", "sp", [-1, 1, 11, 1]], ["auto_unroll_max_step", "ot", 1500], ["unroll_explicit", "ot", 1]]}, "result": [[0.005146315], 0, 3.7789313793182373, 1639033733.2752934], "version": 0.2, "tvm_version": "0.8.dev0"}
{"input": ["cuda -keys=cuda,gpu -max_num_threads=1024 -thread_warp_size=32", "depthwise_conv2d_nchw.cuda", [["TENSOR", [128, 672, 11, 11], "float32"], ["TENSOR", [672, 1, 7, 7], "float32"], 1, "SAME", 1, "float32"], {}], "config": {"index": 80850, "code_hash": null, "entity": [["tile_f", "sp", [-1, 2, 2, 2]], ["tile_y", "sp", [-1, 1, 11, 1]], ["tile_x", "sp", [-1, 1, 11, 1]], ["auto_unroll_max_step", "ot", 1500], ["unroll_explicit", "ot", 1]]}, "result": [[0.0037125037037037036], 0, 3.995152473449707, 1639033736.1800852], "version": 0.2, "tvm_version": "0.8.dev0"}
{"input": ["cuda -keys=cuda,gpu -max_num_threads=1024 -thread_warp_size=32", "depthwise_conv2d_nchw.cuda", [["TENSOR", [128, 672, 11, 11], "float32"], ["TENSOR", [672, 1, 7, 7], "float32"], 1, "SAME", 1, "float32"], {}], "config": {"index": 38020, "code_hash": null, "entity": [["tile_f", "sp", [-1, 2, 1, 4]], ["tile_y", "sp", [-1, 1, 11, 1]], ["tile_x", "sp", [-1, 1, 11, 1]], ["auto_unroll_max_step", "ot", 1500], ["unroll_explicit", "ot", 0]]}, "result": [[0.0038559592592592594], 0, 3.7030820846557617, 1639033738.162547], "version": 0.2, "tvm_version": "0.8.dev0"}
{"input": ["cuda -keys=cuda,gpu -max_num_threads=1024 -thread_warp_size=32", "depthwise_conv2d_nchw.cuda", [["TENSOR", [128, 672, 11, 11], "float32"], ["TENSOR", [672, 1, 7, 7], "float32"], 1, "SAME", 1, "float32"], {}], "config": {"index": 38154, "code_hash": null, "entity": [["tile_f", "sp", [-1, 1, 1, 7]], ["tile_y", "sp", [-1, 1, 11, 1]], ["tile_x", "sp", [-1, 1, 11, 1]], ["auto_unroll_max_step", "ot", 1500], ["unroll_explicit", "ot", 0]]}, "result": [[0.003756342857142857], 0, 3.691922903060913, 1639033740.5298455], "version": 0.2, "tvm_version": "0.8.dev0"}
{"input": ["cuda -keys=cuda,gpu -max_num_threads=1024 -thread_warp_size=32", "depthwise_conv2d_nchw.cuda", [["TENSOR", [128, 672, 11, 11], "float32"], ["TENSOR", [672, 1, 7, 7], "float32"], 1, "SAME", 1, "float32"], {}], "config": {"index": 80865, "code_hash": null, "entity": [["tile_f", "sp", [-1, 1, 3, 2]], ["tile_y", "sp", [-1, 1, 11, 1]], ["tile_x", "sp", [-1, 1, 11, 1]], ["auto_unroll_max_step", "ot", 1500], ["unroll_explicit", "ot", 1]]}, "result": [[0.00396995], 0, 3.357391119003296, 1639033742.9595623], "version": 0.2, "tvm_version": "0.8.dev0"}
{"input": ["cuda -keys=cuda,gpu -max_num_threads=1024 -thread_warp_size=32", "depthwise_conv2d_nchw.cuda", [["TENSOR", [128, 672, 11, 11], "float32"], ["TENSOR", [672, 1, 7, 7], "float32"], 1, "SAME", 1, "float32"], {}], "config": {"index": 37689, "code_hash": null, "entity": [["tile_f", "sp", [-1, 2, 4, 1]], ["tile_y", "sp", [-1, 1, 11, 1]], ["tile_x", "sp", [-1, 1, 11, 1]], ["auto_unroll_max_step", "ot", 1500], ["unroll_explicit", "ot", 0]]}, "result": [[0.00468815], 0, 2.9059815406799316, 1639033744.8149006], "version": 0.2, "tvm_version": "0.8.dev0"}
{"input": ["cuda -keys=cuda,gpu -max_num_threads=1024 -thread_warp_size=32", "depthwise_conv2d_nchw.cuda", [["TENSOR", [128, 672, 11, 11], "float32"], ["TENSOR", [672, 1, 7, 7], "float32"], 1, "SAME", 1, "float32"], {}], "config": {"index": 80976, "code_hash": null, "entity": [["tile_f", "sp", [-1, 1, 2, 3]], ["tile_y", "sp", [-1, 1, 11, 1]], ["tile_x", "sp", [-1, 1, 11, 1]], ["auto_unroll_max_step", "ot", 1500], ["unroll_explicit", "ot", 1]]}, "result": [[0.004482704347826086], 0, 3.2984442710876465, 1639033746.461306], "version": 0.2, "tvm_version": "0.8.dev0"}
{"input": ["cuda -keys=cuda,gpu -max_num_threads=1024 -thread_warp_size=32", "depthwise_conv2d_nchw.cuda", [["TENSOR", [128, 672, 11, 11], "float32"], ["TENSOR", [672, 1, 7, 7], "float32"], 1, "SAME", 1, "float32"], {}], "config": {"index": 81618, "code_hash": null, "entity": [["tile_f", "sp", [-1, 1, 7, 1]], ["tile_y", "sp", [-1, 1, 1, 11]], ["tile_x", "sp", [-1, 1, 11, 1]], ["auto_unroll_max_step", "ot", 1500], ["unroll_explicit", "ot", 1]]}, "result": [[0.0023292955555555554], 0, 3.1768476963043213, 1639033748.103492], "version": 0.2, "tvm_version": "0.8.dev0"}
{"input": ["cuda -keys=cuda,gpu -max_num_threads=1024 -thread_warp_size=32", "depthwise_conv2d_nchw.cuda", [["TENSOR", [128, 672, 11, 11], "float32"], ["TENSOR", [672, 1, 7, 7], "float32"], 1, "SAME", 1, "float32"], {}], "config": {"index": 81117, "code_hash": null, "entity": [["tile_f", "sp", [-1, 1, 1, 6]], ["tile_y", "sp", [-1, 1, 11, 1]], ["tile_x", "sp", [-1, 1, 11, 1]], ["auto_unroll_max_step", "ot", 1500], ["unroll_explicit", "ot", 1]]}, "result": [[0.003888757692307692], 0, 3.306025266647339, 1639033749.941234], "version": 0.2, "tvm_version": "0.8.dev0"}
{"input": ["cuda -keys=cuda,gpu -max_num_threads=1024 -thread_warp_size=32", "depthwise_conv2d_nchw.cuda", [["TENSOR", [128, 672, 11, 11], "float32"], ["TENSOR", [672, 1, 7, 7], "float32"], 1, "SAME", 1, "float32"], {}], "config": {"index": 80665, "code_hash": null, "entity": [["tile_f", "sp", [-1, 2, 2, 1]], ["tile_y", "sp", [-1, 1, 11, 1]], ["tile_x", "sp", [-1, 1, 11, 1]], ["auto_unroll_max_step", "ot", 1500], ["unroll_explicit", "ot", 1]]}, "result": [[0.0043981608695652175], 0, 2.8564293384552, 1639033751.6112926], "version": 0.2, "tvm_version": "0.8.dev0"}
{"input": ["cuda -keys=cuda,gpu -max_num_threads=1024 -thread_warp_size=32", "depthwise_conv2d_nchw.cuda", [["TENSOR", [128, 672, 11, 11], "float32"], ["TENSOR", [672, 1, 7, 7], "float32"], 1, "SAME", 1, "float32"], {}], "config": {"index": 38019, "code_hash": null, "entity": [["tile_f", "sp", [-1, 1, 1, 4]], ["tile_y", "sp", [-1, 1, 11, 1]], ["tile_x", "sp", [-1, 1, 11, 1]], ["auto_unroll_max_step", "ot", 1500], ["unroll_explicit", "ot", 0]]}, "result": [[0.003709003571428571], 0, 2.712397813796997, 1639033753.2114508], "version": 0.2, "tvm_version": "0.8.dev0"}
{"input": ["cuda -keys=cuda,gpu -max_num_threads=1024 -thread_warp_size=32", "depthwise_conv2d_nchw.cuda", [["TENSOR", [128, 672, 11, 11], "float32"], ["TENSOR", [672, 1, 7, 7], "float32"], 1, "SAME", 1, "float32"], {}], "config": {"index": 41298, "code_hash": null, "entity": [["tile_f", "sp", [-1, 1, 7, 1]], ["tile_y", "sp", [-1, 1, 11, 1]], ["tile_x", "sp", [-1, 1, 1, 11]], ["auto_unroll_max_step", "ot", 1500], ["unroll_explicit", "ot", 0]]}, "result": [[0.002566365853658537], 0, 3.6443464756011963, 1639033756.2311573], "version": 0.2, "tvm_version": "0.8.dev0"}
{"input": ["cuda -keys=cuda,gpu -max_num_threads=1024 -thread_warp_size=32", "depthwise_conv2d_nchw.cuda", [["TENSOR", [128, 672, 11, 11], "float32"], ["TENSOR", [672, 1, 7, 7], "float32"], 1, "SAME", 1, "float32"], {}], "config": {"index": 37676, "code_hash": null, "entity": [["tile_f", "sp", [-1, 1, 3, 1]], ["tile_y", "sp", [-1, 1, 11, 1]], ["tile_x", "sp", [-1, 1, 11, 1]], ["auto_unroll_max_step", "ot", 1500], ["unroll_explicit", "ot", 0]]}, "result": [[0.005009609999999999], 0, 3.1872355937957764, 1639033758.2998202], "version": 0.2, "tvm_version": "0.8.dev0"}
{"input": ["cuda -keys=cuda,gpu -max_num_threads=1024 -thread_warp_size=32", "depthwise_conv2d_nchw.cuda", [["TENSOR", [128, 672, 11, 11], "float32"], ["TENSOR", [672, 1, 7, 7], "float32"], 1, "SAME", 1, "float32"], {}], "config": {"index": 37823, "code_hash": null, "entity": [["tile_f", "sp", [-1, 3, 1, 2]], ["tile_y", "sp", [-1, 1, 11, 1]], ["tile_x", "sp", [-1, 1, 11, 1]], ["auto_unroll_max_step", "ot", 1500], ["unroll_explicit", "ot", 0]]}, "result": [[0.003736575], 0, 3.2654004096984863, 1639033760.2087722], "version": 0.2, "tvm_version": "0.8.dev0"}
{"input": ["cuda -keys=cuda,gpu -max_num_threads=1024 -thread_warp_size=32", "depthwise_conv2d_nchw.cuda", [["TENSOR", [128, 672, 11, 11], "float32"], ["TENSOR", [672, 1, 7, 7], "float32"], 1, "SAME", 1, "float32"], {}], "config": {"index": 37656, "code_hash": null, "entity": [["tile_f", "sp", [-1, 1, 2, 1]], ["tile_y", "sp", [-1, 1, 11, 1]], ["tile_x", "sp", [-1, 1, 11, 1]], ["auto_unroll_max_step", "ot", 1500], ["unroll_explicit", "ot", 0]]}, "result": [[0.004474460869565217], 0, 3.205326557159424, 1639033762.5601442], "version": 0.2, "tvm_version": "0.8.dev0"}
{"input": ["cuda -keys=cuda,gpu -max_num_threads=1024 -thread_warp_size=32", "depthwise_conv2d_nchw.cuda", [["TENSOR", [128, 672, 11, 11], "float32"], ["TENSOR", [672, 1, 7, 7], "float32"], 1, "SAME", 1, "float32"], {}], "config": {"index": 81028, "code_hash": null, "entity": [["tile_f", "sp", [-1, 2, 1, 4]], ["tile_y", "sp", [-1, 1, 11, 1]], ["tile_x", "sp", [-1, 1, 11, 1]], ["auto_unroll_max_step", "ot", 1500], ["unroll_explicit", "ot", 1]]}, "result": [[0.0036239892857142858], 0, 3.4652113914489746, 1639033767.3092403], "version": 0.2, "tvm_version": "0.8.dev0"}
{"input": ["cuda -keys=cuda,gpu -max_num_threads=1024 -thread_warp_size=32", "depthwise_conv2d_nchw.cuda", [["TENSOR", [128, 672, 11, 11], "float32"], ["TENSOR", [672, 1, 7, 7], "float32"], 1, "SAME", 1, "float32"], {}], "config": {"index": 84306, "code_hash": null, "entity": [["tile_f", "sp", [-1, 1, 7, 1]], ["tile_y", "sp", [-1, 1, 11, 1]], ["tile_x", "sp", [-1, 1, 1, 11]], ["auto_unroll_max_step", "ot", 1500], ["unroll_explicit", "ot", 1]]}, "result": [[0.0021912382978723404], 0, 2.9659385681152344, 1639033769.350591], "version": 0.2, "tvm_version": "0.8.dev0"}
{"input": ["cuda -keys=cuda,gpu -max_num_threads=1024 -thread_warp_size=32", "depthwise_conv2d_nchw.cuda", [["TENSOR", [128, 672, 11, 11], "float32"], ["TENSOR", [672, 1, 7, 7], "float32"], 1, "SAME", 1, "float32"], {}], "config": {"index": 81162, "code_hash": null, "entity": [["tile_f", "sp", [-1, 1, 1, 7]], ["tile_y", "sp", [-1, 1, 11, 1]], ["tile_x", "sp", [-1, 1, 11, 1]], ["auto_unroll_max_step", "ot", 1500], ["unroll_explicit", "ot", 1]]}, "result": [[0.004099372], 0, 3.1196703910827637, 1639033771.2142377], "version": 0.2, "tvm_version": "0.8.dev0"}
{"input": ["cuda -keys=cuda,gpu -max_num_threads=1024 -thread_warp_size=32", "depthwise_conv2d_nchw.cuda", [["TENSOR", [128, 672, 11, 11], "float32"], ["TENSOR", [672, 1, 7, 7], "float32"], 1, "SAME", 1, "float32"], {}], "config": {"index": 37822, "code_hash": null, "entity": [["tile_f", "sp", [-1, 2, 1, 2]], ["tile_y", "sp", [-1, 1, 11, 1]], ["tile_x", "sp", [-1, 1, 11, 1]], ["auto_unroll_max_step", "ot", 1500], ["unroll_explicit", "ot", 0]]}, "result": [[0.0051335], 0, 3.0866763591766357, 1639033774.3133612], "version": 0.2, "tvm_version": "0.8.dev0"}
{"input": ["cuda -keys=cuda,gpu -max_num_threads=1024 -thread_warp_size=32", "depthwise_conv2d_nchw.cuda", [["TENSOR", [128, 672, 11, 11], "float32"], ["TENSOR", [672, 1, 7, 7], "float32"], 1, "SAME", 1, "float32"], {}], "config": {"index": 80697, "code_hash": null, "entity": [["tile_f", "sp", [-1, 2, 4, 1]], ["tile_y", "sp", [-1, 1, 11, 1]], ["tile_x", "sp", [-1, 1, 11, 1]], ["auto_unroll_max_step", "ot", 1500], ["unroll_explicit", "ot", 1]]}, "result": [[0.007181607142857143], 0, 3.0184004306793213, 1639033776.7261324], "version": 0.2, "tvm_version": "0.8.dev0"}
