artifacts/Table3/tvm/autotvm/depthwise/depthwise_128_42_165_165_5_5_2_SAME.log
{"input": ["cuda -keys=cuda,gpu -max_num_threads=1024 -thread_warp_size=32", "depthwise_conv2d_nchw.cuda", [["TENSOR", [128, 42, 165, 165], "float32"], ["TENSOR", [42, 1, 5, 5], "float32"], 2, "SAME", 1, "float32"], {}], "config": {"index": 3641, "code_hash": null, "entity": [["tile_f", "sp", [-1, 1, 1, 14]], ["tile_y", "sp", [-1, 1, 1, 1]], ["tile_x", "sp", [-1, 1, 83, 1]], ["auto_unroll_max_step", "ot", 0], ["unroll_explicit", "ot", 1]]}, "result": [[0.307189375], 0, 7.786213397979736, 1638806338.0201921], "version": 0.2, "tvm_version": "0.8.dev0"}
{"input": ["cuda -keys=cuda,gpu -max_num_threads=1024 -thread_warp_size=32", "depthwise_conv2d_nchw.cuda", [["TENSOR", [128, 42, 165, 165], "float32"], ["TENSOR", [42, 1, 5, 5], "float32"], 2, "SAME", 1, "float32"], {}], "config": {"index": 157, "code_hash": null, "entity": [["tile_f", "sp", [-1, 7, 1, 2]], ["tile_y", "sp", [-1, 1, 83, 1]], ["tile_x", "sp", [-1, 1, 1, 1]], ["auto_unroll_max_step", "ot", 0], ["unroll_explicit", "ot", 0]]}, "result": [[0.3459781], 0, 8.41224217414856, 1638806351.2083776], "version": 0.2, "tvm_version": "0.8.dev0"}
{"input": ["cuda -keys=cuda,gpu -max_num_threads=1024 -thread_warp_size=32", "depthwise_conv2d_nchw.cuda", [["TENSOR", [128, 42, 165, 165], "float32"], ["TENSOR", [42, 1, 5, 5], "float32"], 2, "SAME", 1, "float32"], {}], "config": {"index": 2181, "code_hash": null, "entity": [["tile_f", "sp", [-1, 14, 1, 1]], ["tile_y", "sp", [-1, 1, 83, 1]], ["tile_x", "sp", [-1, 1, 1, 1]], ["auto_unroll_max_step", "ot", 1500], ["unroll_explicit", "ot", 0]]}, "result": [[0.153589625], 0, 9.01355528831482, 1638806360.035022], "version": 0.2, "tvm_version": "0.8.dev0"}
{"input": ["cuda -keys=cuda,gpu -max_num_threads=1024 -thread_warp_size=32", "depthwise_conv2d_nchw.cuda", [["TENSOR", [128, 42, 165, 165], "float32"], ["TENSOR", [42, 1, 5, 5], "float32"], 2, "SAME", 1, "float32"], {}], "config": {"index": 5156, "code_hash": null, "entity": [["tile_f", "sp", [-1, 1, 1, 3]], ["tile_y", "sp", [-1, 1, 1, 1]], ["tile_x", "sp", [-1, 1, 1, 1]], ["auto_unroll_max_step", "ot", 1500], ["unroll_explicit", "ot", 1]]}, "result": [[0.58726875], 0, 8.771379947662354, 1638806369.3201277], "version": 0.2, "tvm_version": "0.8.dev0"}
{"input": ["cuda -keys=cuda,gpu -max_num_threads=1024 -thread_warp_size=32", "depthwise_conv2d_nchw.cuda", [["TENSOR", [128, 42, 165, 165], "float32"], ["TENSOR", [42, 1, 5, 5], "float32"], 2, "SAME", 1, "float32"], {}], "config": {"index": 1225, "code_hash": null, "entity": [["tile_f", "sp", [-1, 3, 2, 1]], ["tile_y", "sp", [-1, 1, 1, 83]], ["tile_x", "sp", [-1, 1, 1, 1]], ["auto_unroll_max_step", "ot", 256], ["unroll_explicit", "ot", 0]]}, "result": [[2.086922125], 0, 16.830564975738525, 1638806387.0447755], "version": 0.2, "tvm_version": "0.8.dev0"}
{"input": ["cuda -keys=cuda,gpu -max_num_threads=1024 -thread_warp_size=32", "depthwise_conv2d_nchw.cuda", [["TENSOR", [128, 42, 165, 165], "float32"], ["TENSOR", [42, 1, 5, 5], "float32"], 2, "SAME", 1, "float32"], {}], "config": {"index": 2825, "code_hash": null, "entity": [["tile_f", "sp", [-1, 3, 2, 1]], ["tile_y", "sp", [-1, 1, 1, 1]], ["tile_x", "sp", [-1, 1, 1, 83]], ["auto_unroll_max_step", "ot", 1500], ["unroll_explicit", "ot", 0]]}, "result": [[1.734278075], 0, 15.427676916122437, 1638806401.8183851], "version": 0.2, "tvm_version": "0.8.dev0"}
{"input": ["cuda -keys=cuda,gpu -max_num_threads=1024 -thread_warp_size=32", "depthwise_conv2d_nchw.cuda", [["TENSOR", [128, 42, 165, 165], "float32"], ["TENSOR", [42, 1, 5, 5], "float32"], 2, "SAME", 1, "float32"], {}], "config": {"index": 3301, "code_hash": null, "entity": [["tile_f", "sp", [-1, 2, 1, 3]], ["tile_y", "sp", [-1, 1, 1, 83]], ["tile_x", "sp", [-1, 1, 1, 1]], ["auto_unroll_max_step", "ot", 0], ["unroll_explicit", "ot", 1]]}, "result": [[3.238156], 0, 24.525301456451416, 1638806427.74277], "version": 0.2, "tvm_version": "0.8.dev0"}
{"input": ["cuda -keys=cuda,gpu -max_num_threads=1024 -thread_warp_size=32", "depthwise_conv2d_nchw.cuda", [["TENSOR", [128, 42, 165, 165], "float32"], ["TENSOR", [42, 1, 5, 5], "float32"], 2, "SAME", 1, "float32"], {}], "config": {"index": 2826, "code_hash": null, "entity": [["tile_f", "sp", [-1, 7, 2, 1]], ["tile_y", "sp", [-1, 1, 1, 1]], ["tile_x", "sp", [-1, 1, 1, 83]], ["auto_unroll_max_step", "ot", 1500], ["unroll_explicit", "ot", 0]]}, "result": [[4.32176515], 0, 32.573265075683594, 1638806463.5319803], "version": 0.2, "tvm_version": "0.8.dev0"}
{"input": ["cuda -keys=cuda,gpu -max_num_threads=1024 -thread_warp_size=32", "depthwise_conv2d_nchw.cuda", [["TENSOR", [128, 42, 165, 165], "float32"], ["TENSOR", [42, 1, 5, 5], "float32"], 2, "SAME", 1, "float32"], {}], "config": {"index": 512, "code_hash": null, "entity": [["tile_f", "sp", [-1, 1, 1, 1]], ["tile_y", "sp", [-1, 1, 1, 1]], ["tile_x", "sp", [-1, 1, 83, 1]], ["auto_unroll_max_step", "ot", 0], ["unroll_explicit", "ot", 0]]}, "result": [[0.02996385], 0, 5.558460235595703, 1638806469.7551513], "version": 0.2, "tvm_version": "0.8.dev0"}
{"input": ["cuda -keys=cuda,gpu -max_num_threads=1024 -thread_warp_size=32", "depthwise_conv2d_nchw.cuda", [["TENSOR", [128, 42, 165, 165], "float32"], ["TENSOR", [42, 1, 5, 5], "float32"], 2, "SAME", 1, "float32"], {}], "config": {"index": 112, "code_hash": null, "entity": [["tile_f", "sp", [-1, 1, 1, 7]], ["tile_y", "sp", [-1, 83, 1, 1]], ["tile_x", "sp", [-1, 1, 1, 1]], ["auto_unroll_max_step", "ot", 0], ["unroll_explicit", "ot", 0]]}, "result": [[6.38407655], 0, 39.53004550933838, 1638806511.0881932], "version": 0.2, "tvm_version": "0.8.dev0"}
{"input": ["cuda -keys=cuda,gpu -max_num_threads=1024 -thread_warp_size=32", "depthwise_conv2d_nchw.cuda", [["TENSOR", [128, 42, 165, 165], "float32"], ["TENSOR", [42, 1, 5, 5], "float32"], 2, "SAME", 1, "float32"], {}], "config": {"index": 4157, "code_hash": null, "entity": [["tile_f", "sp", [-1, 2, 1, 21]], ["tile_y", "sp", [-1, 1, 1, 1]], ["tile_x", "sp", [-1, 1, 1, 1]], ["auto_unroll_max_step", "ot", 256], ["unroll_explicit", "ot", 1]]}, "result": [[6.001527975], 0, 36.73493552207947, 1638806549.5796072], "version": 0.2, "tvm_version": "0.8.dev0"}
{"input": ["cuda -keys=cuda,gpu -max_num_threads=1024 -thread_warp_size=32", "depthwise_conv2d_nchw.cuda", [["TENSOR", [128, 42, 165, 165], "float32"], ["TENSOR", [42, 1, 5, 5], "float32"], 2, "SAME", 1, "float32"], {}], "config": {"index": 520, "code_hash": null, "entity": [["tile_f", "sp", [-1, 1, 2, 1]], ["tile_y", "sp", [-1, 1, 1, 1]], ["tile_x", "sp", [-1, 1, 83, 1]], ["auto_unroll_max_step", "ot", 0], ["unroll_explicit", "ot", 0]]}, "result": [[0.02387285], 0, 6.0622947216033936, 1638806556.7902555], "version": 0.2, "tvm_version": "0.8.dev0"}
{"input": ["cuda -keys=cuda,gpu -max_num_threads=1024 -thread_warp_size=32", "depthwise_conv2d_nchw.cuda", [["TENSOR", [128, 42, 165, 165], "float32"], ["TENSOR", [42, 1, 5, 5], "float32"], 2, "SAME", 1, "float32"], {}], "config": {"index": 3588, "code_hash": null, "entity": [["tile_f", "sp", [-1, 7, 1, 1]], ["tile_y", "sp", [-1, 1, 1, 1]], ["tile_x", "sp", [-1, 1, 83, 1]], ["auto_unroll_max_step", "ot", 0], ["unroll_explicit", "ot", 1]]}, "result": [[0.087722875], 0, 7.137425422668457, 1638806568.6060407], "version": 0.2, "tvm_version": "0.8.dev0"}
{"input": ["cuda -keys=cuda,gpu -max_num_threads=1024 -thread_warp_size=32", "depthwise_conv2d_nchw.cuda", [["TENSOR", [128, 42, 165, 165], "float32"], ["TENSOR", [42, 1, 5, 5], "float32"], 2, "SAME", 1, "float32"], {}], "config": {"index": 59, "code_hash": null, "entity": [["tile_f", "sp", [-1, 1, 3, 14]], ["tile_y", "sp", [-1, 1, 1, 1]], ["tile_x", "sp", [-1, 1, 1, 1]], ["auto_unroll_max_step", "ot", 0], ["unroll_explicit", "ot", 0]]}, "result": [[2.344196825], 0, 18.359134197235107, 1638806587.1252031], "version": 0.2, "tvm_version": "0.8.dev0"}
{"input": ["cuda -keys=cuda,gpu -max_num_threads=1024 -thread_warp_size=32", "depthwise_conv2d_nchw.cuda", [["TENSOR", [128, 42, 165, 165], "float32"], ["TENSOR", [42, 1, 5, 5], "float32"], 2, "SAME", 1, "float32"], {}], "config": {"index": 2116, "code_hash": null, "entity": [["tile_f", "sp", [-1, 7, 1, 1]], ["tile_y", "sp", [-1, 83, 1, 1]], ["tile_x", "sp", [-1, 1, 1, 1]], ["auto_unroll_max_step", "ot", 1500], ["unroll_explicit", "ot", 0]]}, "result": [[7.27995435], 0, 46.427064418792725, 1638806629.9323766], "version": 0.2, "tvm_version": "0.8.dev0"}
{"input": ["cuda -keys=cuda,gpu -max_num_threads=1024 -thread_warp_size=32", "depthwise_conv2d_nchw.cuda", [["TENSOR", [128, 42, 165, 165], "float32"], ["TENSOR", [42, 1, 5, 5], "float32"], 2, "SAME", 1, "float32"], {}], "config": {"index": 1282, "code_hash": null, "entity": [["tile_f", "sp", [-1, 3, 1, 1]], ["tile_y", "sp", [-1, 1, 1, 1]], ["tile_x", "sp", [-1, 83, 1, 1]], ["auto_unroll_max_step", "ot", 256], ["unroll_explicit", "ot", 0]]}, "result": [[4.906175575], 0, 31.012401580810547, 1638806660.0524228], "version": 0.2, "tvm_version": "0.8.dev0"}
{"input": ["cuda -keys=cuda,gpu -max_num_threads=1024 -thread_warp_size=32", "depthwise_conv2d_nchw.cuda", [["TENSOR", [128, 42, 165, 165], "float32"], ["TENSOR", [42, 1, 5, 5], "float32"], 2, "SAME", 1, "float32"], {}], "config": {"index": 92, "code_hash": null, "entity": [["tile_f", "sp", [-1, 3, 1, 2]], ["tile_y", "sp", [-1, 83, 1, 1]], ["tile_x", "sp", [-1, 1, 1, 1]], ["auto_unroll_max_step", "ot", 0], ["unroll_explicit", "ot", 0]]}, "result": [[8.0103189], 0, 54.58926963806152, 1638806714.5708034], "version": 0.2, "tvm_version": "0.8.dev0"}
{"input": ["cuda -keys=cuda,gpu -max_num_threads=1024 -thread_warp_size=32", "depthwise_conv2d_nchw.cuda", [["TENSOR", [128, 42, 165, 165], "float32"], ["TENSOR", [42, 1, 5, 5], "float32"], 2, "SAME", 1, "float32"], {}], "config": {"index": 513, "code_hash": null, "entity": [["tile_f", "sp", [-1, 2, 1, 1]], ["tile_y", "sp", [-1, 1, 1, 1]], ["tile_x", "sp", [-1, 1, 83, 1]], ["auto_unroll_max_step", "ot", 0], ["unroll_explicit", "ot", 0]]}, "result": [[0.0321803], 0, 4.982863664627075, 1638806733.3521888], "version": 0.2, "tvm_version": "0.8.dev0"}
{"input": ["cuda -keys=cuda,gpu -max_num_threads=1024 -thread_warp_size=32", "depthwise_conv2d_nchw.cuda", [["TENSOR", [128, 42, 165, 165], "float32"], ["TENSOR", [42, 1, 5, 5], "float32"], 2, "SAME", 1, "float32"], {}], "config": {"index": 3585, "code_hash": null, "entity": [["tile_f", "sp", [-1, 2, 1, 1]], ["tile_y", "sp", [-1, 1, 1, 1]], ["tile_x", "sp", [-1, 1, 83, 1]], ["auto_unroll_max_step", "ot", 0], ["unroll_explicit", "ot", 1]]}, "result": [[0.02876075], 0, 5.118764877319336, 1638806738.1106856], "version": 0.2, "tvm_version": "0.8.dev0"}
{"input": ["cuda -keys=cuda,gpu -max_num_threads=1024 -thread_warp_size=32", "depthwise_conv2d_nchw.cuda", [["TENSOR", [128, 42, 165, 165], "float32"], ["TENSOR", [42, 1, 5, 5], "float32"], 2, "SAME", 1, "float32"], {}], "config": {"index": 3584, "code_hash": null, "entity": [["tile_f", "sp", [-1, 1, 1, 1]], ["tile_y", "sp", [-1, 1, 1, 1]], ["tile_x", "sp", [-1, 1, 83, 1]], ["auto_unroll_max_step", "ot", 0], ["unroll_explicit", "ot", 1]]}, "result": [[0.024352966666666667], 0, 7.2028257846832275, 1638806744.901538], "version": 0.2, "tvm_version": "0.8.dev0"}
{"input": ["cuda -keys=cuda,gpu -max_num_threads=1024 -thread_warp_size=32", "depthwise_conv2d_nchw.cuda", [["TENSOR", [128, 42, 165, 165], "float32"], ["TENSOR", [42, 1, 5, 5], "float32"], 2, "SAME", 1, "float32"], {}], "config": {"index": 3592, "code_hash": null, "entity": [["tile_f", "sp", [-1, 1, 2, 1]], ["tile_y", "sp", [-1, 1, 1, 1]], ["tile_x", "sp", [-1, 1, 83, 1]], ["auto_unroll_max_step", "ot", 0], ["unroll_explicit", "ot", 1]]}, "result": [[0.024086200000000002], 0, 6.419513940811157, 1638806751.2319093], "version": 0.2, "tvm_version": "0.8.dev0"}
{"input": ["cuda -keys=cuda,gpu -max_num_threads=1024 -thread_warp_size=32", "depthwise_conv2d_nchw.cuda", [["TENSOR", [128, 42, 165, 165], "float32"], ["TENSOR", [42, 1, 5, 5], "float32"], 2, "SAME", 1, "float32"], {}], "config": {"index": 515, "code_hash": null, "entity": [["tile_f", "sp", [-1, 6, 1, 1]], ["tile_y", "sp", [-1, 1, 1, 1]], ["tile_x", "sp", [-1, 1, 83, 1]], ["auto_unroll_max_step", "ot", 0], ["unroll_explicit", "ot", 0]]}, "result": [[0.0583775], 0, 6.356114387512207, 1638806757.3499122], "version": 0.2, "tvm_version": "0.8.dev0"}
{"input": ["cuda -keys=cuda,gpu -max_num_threads=1024 -thread_warp_size=32", "depthwise_conv2d_nchw.cuda", [["TENSOR", [128, 42, 165, 165], "float32"], ["TENSOR", [42, 1, 5, 5], "float32"], 2, "SAME", 1, "float32"], {}], "config": {"index": 3587, "code_hash": null, "entity": [["tile_f", "sp", [-1, 6, 1, 1]], ["tile_y", "sp", [-1, 1, 1, 1]], ["tile_x", "sp", [-1, 1, 83, 1]], ["auto_unroll_max_step", "ot", 0], ["unroll_explicit", "ot", 1]]}, "result": [[0.05656175], 0, 6.526165962219238, 1638806763.6199381], "version": 0.2, "tvm_version": "0.8.dev0"}
{"input": ["cuda -keys=cuda,gpu -max_num_threads=1024 -thread_warp_size=32", "depthwise_conv2d_nchw.cuda", [["TENSOR", [128, 42, 165, 165], "float32"], ["TENSOR", [42, 1, 5, 5], "float32"], 2, "SAME", 1, "float32"], {}], "config": {"index": 3611, "code_hash": null, "entity": [["tile_f", "sp", [-1, 1, 1, 2]], ["tile_y", "sp", [-1, 1, 1, 1]], ["tile_x", "sp", [-1, 1, 83, 1]], ["auto_unroll_max_step", "ot", 0], ["unroll_explicit", "ot", 1]]}, "result": [[0.0237073], 0, 5.2889723777771, 1638806768.5442], "version": 0.2, "tvm_version": "0.8.dev0"}
{"input": ["cuda -keys=cuda,gpu -max_num_threads=1024 -thread_warp_size=32", "depthwise_conv2d_nchw.cuda", [["TENSOR", [128, 42, 165, 165], "float32"], ["TENSOR", [42, 1, 5, 5], "float32"], 2, "SAME", 1, "float32"], {}], "config": {"index": 539, "code_hash": null, "entity": [["tile_f", "sp", [-1, 1, 1, 2]], ["tile_y", "sp", [-1, 1, 1, 1]], ["tile_x", "sp", [-1, 1, 83, 1]], ["auto_unroll_max_step", "ot", 0], ["unroll_explicit", "ot", 0]]}, "result": [[0.023156399999999997], 0, 6.2834577560424805, 1638806774.577518], "version": 0.2, "tvm_version": "0.8.dev0"}
{"input": ["cuda -keys=cuda,gpu -max_num_threads=1024 -thread_warp_size=32", "depthwise_conv2d_nchw.cuda", [["TENSOR", [128, 42, 165, 165], "float32"], ["TENSOR", [42, 1, 5, 5], "float32"], 2, "SAME", 1, "float32"], {}], "config": {"index": 3200, "code_hash": null, "entity": [["tile_f", "sp", [-1, 1, 1, 1]], ["tile_y", "sp", [-1, 1, 83, 1]], ["tile_x", "sp", [-1, 1, 1, 1]], ["auto_unroll_max_step", "ot", 0], ["unroll_explicit", "ot", 1]]}, "result": [[0.026181975], 0, 6.275710105895996, 1638806780.985153], "version": 0.2, "tvm_version": "0.8.dev0"}
{"input": ["cuda -keys=cuda,gpu -max_num_threads=1024 -thread_warp_size=32", "depthwise_conv2d_nchw.cuda", [["TENSOR", [128, 42, 165, 165], "float32"], ["TENSOR", [42, 1, 5, 5], "float32"], 2, "SAME", 1, "float32"], {}], "config": {"index": 128, "code_hash": null, "entity": [["tile_f", "sp", [-1, 1, 1, 1]], ["tile_y", "sp", [-1, 1, 83, 1]], ["tile_x", "sp", [-1, 1, 1, 1]], ["auto_unroll_max_step", "ot", 0], ["unroll_explicit", "ot", 0]]}, "result": [[0.025887049999999998], 0, 6.279962062835693, 1638806787.2236247], "version": 0.2, "tvm_version": "0.8.dev0"}
{"input": ["cuda -keys=cuda,gpu -max_num_threads=1024 -thread_warp_size=32", "depthwise_conv2d_nchw.cuda", [["TENSOR", [128, 42, 165, 165], "float32"], ["TENSOR", [42, 1, 5, 5], "float32"], 2, "SAME", 1, "float32"], {}], "config": {"index": 3201, "code_hash": null, "entity": [["tile_f", "sp", [-1, 2, 1, 1]], ["tile_y", "sp", [-1, 1, 83, 1]], ["tile_x", "sp", [-1, 1, 1, 1]], ["auto_unroll_max_step", "ot", 0], ["unroll_explicit", "ot", 1]]}, "result": [[0.026069099999999998], 0, 6.3040876388549805, 1638806793.3508167], "version": 0.2, "tvm_version": "0.8.dev0"}
{"input": ["cuda -keys=cuda,gpu -max_num_threads=1024 -thread_warp_size=32", "depthwise_conv2d_nchw.cuda", [["TENSOR", [128, 42, 165, 165], "float32"], ["TENSOR", [42, 1, 5, 5], "float32"], 2, "SAME", 1, "float32"], {}], "config": {"index": 129, "code_hash": null, "entity": [["tile_f", "sp", [-1, 2, 1, 1]], ["tile_y", "sp", [-1, 1, 83, 1]], ["tile_x", "sp", [-1, 1, 1, 1]], ["auto_unroll_max_step", "ot", 0], ["unroll_explicit", "ot", 0]]}, "result": [[0.028089725000000003], 0, 5.575329542160034, 1638806798.9128594], "version": 0.2, "tvm_version": "0.8.dev0"}
{"input": ["cuda -keys=cuda,gpu -max_num_threads=1024 -thread_warp_size=32", "depthwise_conv2d_nchw.cuda", [["TENSOR", [128, 42, 165, 165], "float32"], ["TENSOR", [42, 1, 5, 5], "float32"], 2, "SAME", 1, "float32"], {}], "config": {"index": 4609, "code_hash": null, "entity": [["tile_f", "sp", [-1, 2, 1, 1]], ["tile_y", "sp", [-1, 1, 1, 1]], ["tile_x", "sp", [-1, 1, 83, 1]], ["auto_unroll_max_step", "ot", 256], ["unroll_explicit", "ot", 1]]}, "result": [[0.015629914285714287], 0, 6.6444926261901855, 1638806805.508171], "version": 0.2, "tvm_version": "0.8.dev0"}
{"input": ["cuda -keys=cuda,gpu -max_num_threads=1024 -thread_warp_size=32", "depthwise_conv2d_nchw.cuda", [["TENSOR", [128, 42, 165, 165], "float32"], ["TENSOR", [42, 1, 5, 5], "float32"], 2, "SAME", 1, "float32"], {}], "config": {"index": 5633, "code_hash": null, "entity": [["tile_f", "sp", [-1, 2, 1, 1]], ["tile_y", "sp", [-1, 1, 1, 1]], ["tile_x", "sp", [-1, 1, 83, 1]], ["auto_unroll_max_step", "ot", 1500], ["unroll_explicit", "ot", 1]]}, "result": [[0.015071771428571428], 0, 6.243341445922852, 1638806811.636999], "version": 0.2, "tvm_version": "0.8.dev0"}
{"input": ["cuda -keys=cuda,gpu -max_num_threads=1024 -thread_warp_size=32", "depthwise_conv2d_nchw.cuda", [["TENSOR", [128, 42, 165, 165], "float32"], ["TENSOR", [42, 1, 5, 5], "float32"], 2, "SAME", 1, "float32"], {}], "config": {"index": 2561, "code_hash": null, "entity": [["tile_f", "sp", [-1, 2, 1, 1]], ["tile_y", "sp", [-1, 1, 1, 1]], ["tile_x", "sp", [-1, 1, 83, 1]], ["auto_unroll_max_step", "ot", 1500], ["unroll_explicit", "ot", 0]]}, "result": [[0.03351175], 0, 7.044293165206909, 1638806818.367083], "version": 0.2, "tvm_version": "0.8.dev0"}
{"input": ["cuda -keys=cuda,gpu -max_num_threads=1024 -thread_warp_size=32", "depthwise_conv2d_nchw.cuda", [["TENSOR", [128, 42, 165, 165], "float32"], ["TENSOR", [42, 1, 5, 5], "float32"], 2, "SAME", 1, "float32"], {}], "config": {"index": 1537, "code_hash": null, "entity": [["tile_f", "sp", [-1, 2, 1, 1]], ["tile_y", "sp", [-1, 1, 1, 1]], ["tile_x", "sp", [-1, 1, 83, 1]], ["auto_unroll_max_step", "ot", 256], ["unroll_explicit", "ot", 0]]}, "result": [[0.029400775], 0, 6.158679246902466, 1638806824.4914594], "version": 0.2, "tvm_version": "0.8.dev0"}
{"input": ["cuda -keys=cuda,gpu -max_num_threads=1024 -thread_warp_size=32", "depthwise_conv2d_nchw.cuda", [["TENSOR", [128, 42, 165, 165], "float32"], ["TENSOR", [42, 1, 5, 5], "float32"], 2, "SAME", 1, "float32"], {}], "config": {"index": 516, "code_hash": null, "entity": [["tile_f", "sp", [-1, 7, 1, 1]], ["tile_y", "sp", [-1, 1, 1, 1]], ["tile_x", "sp", [-1, 1, 83, 1]], ["auto_unroll_max_step", "ot", 0], ["unroll_explicit", "ot", 0]]}, "result": [[0.075635675], 0, 6.385860443115234, 1638806830.4025564], "version": 0.2, "tvm_version": "0.8.dev0"}
{"input": ["cuda -keys=cuda,gpu -max_num_threads=1024 -thread_warp_size=32", "depthwise_conv2d_nchw.cuda", [["TENSOR", [128, 42, 165, 165], "float32"], ["TENSOR", [42, 1, 5, 5], "float32"], 2, "SAME", 1, "float32"], {}], "config": {"index": 514, "code_hash": null, "entity": [["tile_f", "sp", [-1, 3, 1, 1]], ["tile_y", "sp", [-1, 1, 1, 1]], ["tile_x", "sp", [-1, 1, 83, 1]], ["auto_unroll_max_step", "ot", 0], ["unroll_explicit", "ot", 0]]}, "result": [[0.032057949999999995], 0, 7.3134400844573975, 1638806837.3622093], "version": 0.2, "tvm_version": "0.8.dev0"}
{"input": ["cuda -keys=cuda,gpu -max_num_threads=1024 -thread_warp_size=32", "depthwise_conv2d_nchw.cuda", [["TENSOR", [128, 42, 165, 165], "float32"], ["TENSOR", [42, 1, 5, 5], "float32"], 2, "SAME", 1, "float32"], {}], "config": {"index": 3586, "code_hash": null, "entity": [["tile_f", "sp", [-1, 3, 1, 1]], ["tile_y", "sp", [-1, 1, 1, 1]], ["tile_x", "sp", [-1, 1, 83, 1]], ["auto_unroll_max_step", "ot", 0], ["unroll_explicit", "ot", 1]]}, "result": [[0.03174975], 0, 6.049776315689087, 1638806843.6547744], "version": 0.2, "tvm_version": "0.8.dev0"}
{"input": ["cuda -keys=cuda,gpu -max_num_threads=1024 -thread_warp_size=32", "depthwise_conv2d_nchw.cuda", [["TENSOR", [128, 42, 165, 165], "float32"], ["TENSOR", [42, 1, 5, 5], "float32"], 2, "SAME", 1, "float32"], {}], "config": {"index": 5632, "code_hash": null, "entity": [["tile_f", "sp", [-1, 1, 1, 1]], ["tile_y", "sp", [-1, 1, 1, 1]], ["tile_x", "sp", [-1, 1, 83, 1]], ["auto_unroll_max_step", "ot", 1500], ["unroll_explicit", "ot", 1]]}, "result": [[0.016844599999999998], 0, 8.413175821304321, 1638806851.6871274], "version": 0.2, "tvm_version": "0.8.dev0"}
{"input": ["cuda -keys=cuda,gpu -max_num_threads=1024 -thread_warp_size=32", "depthwise_conv2d_nchw.cuda", [["TENSOR", [128, 42, 165, 165], "float32"], ["TENSOR", [42, 1, 5, 5], "float32"], 2, "SAME", 1, "float32"], {}], "config": {"index": 4608, "code_hash": null, "entity": [["tile_f", "sp", [-1, 1, 1, 1]], ["tile_y", "sp", [-1, 1, 1, 1]], ["tile_x", "sp", [-1, 1, 83, 1]], ["auto_unroll_max_step", "ot", 256], ["unroll_explicit", "ot", 1]]}, "result": [[0.016703016666666667], 0, 5.617430686950684, 1638806857.553661], "version": 0.2, "tvm_version": "0.8.dev0"}
{"input": ["cuda -keys=cuda,gpu -max_num_threads=1024 -thread_warp_size=32", "depthwise_conv2d_nchw.cuda", [["TENSOR", [128, 42, 165, 165], "float32"], ["TENSOR", [42, 1, 5, 5], "float32"], 2, "SAME", 1, "float32"], {}], "config": {"index": 1536, "code_hash": null, "entity": [["tile_f", "sp", [-1, 1, 1, 1]], ["tile_y", "sp", [-1, 1, 1, 1]], ["tile_x", "sp", [-1, 1, 83, 1]], ["auto_unroll_max_step", "ot", 256], ["unroll_explicit", "ot", 0]]}, "result": [[0.02100945], 0, 6.809465169906616, 1638806864.2340233], "version": 0.2, "tvm_version": "0.8.dev0"}
{"input": ["cuda -keys=cuda,gpu -max_num_threads=1024 -thread_warp_size=32", "depthwise_conv2d_nchw.cuda", [["TENSOR", [128, 42, 165, 165], "float32"], ["TENSOR", [42, 1, 5, 5], "float32"], 2, "SAME", 1, "float32"], {}], "config": {"index": 2560, "code_hash": null, "entity": [["tile_f", "sp", [-1, 1, 1, 1]], ["tile_y", "sp", [-1, 1, 1, 1]], ["tile_x", "sp", [-1, 1, 83, 1]], ["auto_unroll_max_step", "ot", 1500], ["unroll_explicit", "ot", 0]]}, "result": [[0.029963925], 0, 6.676855087280273, 1638806870.685435], "version": 0.2, "tvm_version": "0.8.dev0"}
{"input": ["cuda -keys=cuda,gpu -max_num_threads=1024 -thread_warp_size=32", "depthwise_conv2d_nchw.cuda", [["TENSOR", [128, 42, 165, 165], "float32"], ["TENSOR", [42, 1, 5, 5], "float32"], 2, "SAME", 1, "float32"], {}], "config": {"index": 155, "code_hash": null, "entity": [["tile_f", "sp", [-1, 1, 1, 2]], ["tile_y", "sp", [-1, 1, 83, 1]], ["tile_x", "sp", [-1, 1, 1, 1]], ["auto_unroll_max_step", "ot", 0], ["unroll_explicit", "ot", 0]]}, "result": [[0.029137], 0, 6.833178997039795, 1638806877.5812292], "version": 0.2, "tvm_version": "0.8.dev0"}
{"input": ["cuda -keys=cuda,gpu -max_num_threads=1024 -thread_warp_size=32", "depthwise_conv2d_nchw.cuda", [["TENSOR", [128, 42, 165, 165], "float32"], ["TENSOR", [42, 1, 5, 5], "float32"], 2, "SAME", 1, "float32"], {}], "config": {"index": 3227, "code_hash": null, "entity": [["tile_f", "sp", [-1, 1, 1, 2]], ["tile_y", "sp", [-1, 1, 83, 1]], ["tile_x", "sp", [-1, 1, 1, 1]], ["auto_unroll_max_step", "ot", 0], ["unroll_explicit", "ot", 1]]}, "result": [[0.02662185], 0, 6.378757476806641, 1638806884.470602], "version": 0.2, "tvm_version": "0.8.dev0"}
{"input": ["cuda -keys=cuda,gpu -max_num_threads=1024 -thread_warp_size=32", "depthwise_conv2d_nchw.cuda", [["TENSOR", [128, 42, 165, 165], "float32"], ["TENSOR", [42, 1, 5, 5], "float32"], 2, "SAME", 1, "float32"], {}], "config": {"index": 5640, "code_hash": null, "entity": [["tile_f", "sp", [-1, 1, 2, 1]], ["tile_y", "sp", [-1, 1, 1, 1]], ["tile_x", "sp", [-1, 1, 83, 1]], ["auto_unroll_max_step", "ot", 1500], ["unroll_explicit", "ot", 1]]}, "result": [[0.020271166666666667], 0, 6.9642322063446045, 1638806891.160325], "version": 0.2, "tvm_version": "0.8.dev0"}
{"input": ["cuda -keys=cuda,gpu -max_num_threads=1024 -thread_warp_size=32", "depthwise_conv2d_nchw.cuda", [["TENSOR", [128, 42, 165, 165], "float32"], ["TENSOR", [42, 1, 5, 5], "float32"], 2, "SAME", 1, "float32"], {}], "config": {"index": 2568, "code_hash": null, "entity": [["tile_f", "sp", [-1, 1, 2, 1]], ["tile_y", "sp", [-1, 1, 1, 1]], ["tile_x", "sp", [-1, 1, 83, 1]], ["auto_unroll_max_step", "ot", 1500], ["unroll_explicit", "ot", 0]]}, "result": [[0.024534766666666666], 0, 6.596373081207275, 1638806897.3844306], "version": 0.2, "tvm_version": "0.8.dev0"}
{"input": ["cuda -keys=cuda,gpu -max_num_threads=1024 -thread_warp_size=32", "depthwise_conv2d_nchw.cuda", [["TENSOR", [128, 42, 165, 165], "float32"], ["TENSOR", [42, 1, 5, 5], "float32"], 2, "SAME", 1, "float32"], {}], "config": {"index": 4616, "code_hash": null, "entity": [["tile_f", "sp", [-1, 1, 2, 1]], ["tile_y", "sp", [-1, 1, 1, 1]], ["tile_x", "sp", [-1, 1, 83, 1]], ["auto_unroll_max_step", "ot", 256], ["unroll_explicit", "ot", 1]]}, "result": [[0.020052383333333333], 0, 5.628203630447388, 1638806902.5035915], "version": 0.2, "tvm_version": "0.8.dev0"}
{"input": ["cuda -keys=cuda,gpu -max_num_threads=1024 -thread_warp_size=32", "depthwise_conv2d_nchw.cuda", [["TENSOR", [128, 42, 165, 165], "float32"], ["TENSOR", [42, 1, 5, 5], "float32"], 2, "SAME", 1, "float32"], {}], "config": {"index": 1544, "code_hash": null, "entity": [["tile_f", "sp", [-1, 1, 2, 1]], ["tile_y", "sp", [-1, 1, 1, 1]], ["tile_x", "sp", [-1, 1, 83, 1]], ["auto_unroll_max_step", "ot", 256], ["unroll_explicit", "ot", 0]]}, "result": [[0.0239851], 0, 6.210207939147949, 1638806908.0499902], "version": 0.2, "tvm_version": "0.8.dev0"}
{"input": ["cuda -keys=cuda,gpu -max_num_threads=1024 -thread_warp_size=32", "depthwise_conv2d_nchw.cuda", [["TENSOR", [128, 42, 165, 165], "float32"], ["TENSOR", [42, 1, 5, 5], "float32"], 2, "SAME", 1, "float32"], {}], "config": {"index": 3208, "code_hash": null, "entity": [["tile_f", "sp", [-1, 1, 2, 1]], ["tile_y", "sp", [-1, 1, 83, 1]], ["tile_x", "sp", [-1, 1, 1, 1]], ["auto_unroll_max_step", "ot", 0], ["unroll_explicit", "ot", 1]]}, "result": [[0.036503175], 0, 6.683918476104736, 1638806914.2020462], "version": 0.2, "tvm_version": "0.8.dev0"}
{"input": ["cuda -keys=cuda,gpu -max_num_threads=1024 -thread_warp_size=32", "depthwise_conv2d_nchw.cuda", [["TENSOR", [128, 42, 165, 165], "float32"], ["TENSOR", [42, 1, 5, 5], "float32"], 2, "SAME", 1, "float32"], {}], "config": {"index": 136, "code_hash": null, "entity": [["tile_f", "sp", [-1, 1, 2, 1]], ["tile_y", "sp", [-1, 1, 83, 1]], ["tile_x", "sp", [-1, 1, 1, 1]], ["auto_unroll_max_step", "ot", 0], ["unroll_explicit", "ot", 0]]}, "result": [[0.031421175], 0, 6.837559461593628, 1638806920.7453513], "version": 0.2, "tvm_version": "0.8.dev0"}
{"input": ["cuda -keys=cuda,gpu -max_num_threads=1024 -thread_warp_size=32", "depthwise_conv2d_nchw.cuda", [["TENSOR", [128, 42, 165, 165], "float32"], ["TENSOR", [42, 1, 5, 5], "float32"], 2, "SAME", 1, "float32"], {}], "config": {"index": 1539, "code_hash": null, "entity": [["tile_f", "sp", [-1, 6, 1, 1]], ["tile_y", "sp", [-1, 1, 1, 1]], ["tile_x", "sp", [-1, 1, 83, 1]], ["auto_unroll_max_step", "ot", 256], ["unroll_explicit", "ot", 0]]}, "result": [[0.06625397499999999], 0, 7.093643665313721, 1638806927.16475], "version": 0.2, "tvm_version": "0.8.dev0"}
{"input": ["cuda -keys=cuda,gpu -max_num_threads=1024 -thread_warp_size=32", "depthwise_conv2d_nchw.cuda", [["TENSOR", [128, 42, 165, 165], "float32"], ["TENSOR", [42, 1, 5, 5], "float32"], 2, "SAME", 1, "float32"], {}], "config": {"index": 4611, "code_hash": null, "entity": [["tile_f", "sp", [-1, 6, 1, 1]], ["tile_y", "sp", [-1, 1, 1, 1]], ["tile_x", "sp", [-1, 1, 83, 1]], ["auto_unroll_max_step", "ot", 256], ["unroll_explicit", "ot", 1]]}, "result": [[0.030215325], 0, 7.1314074993133545, 1638806933.5500865], "version": 0.2, "tvm_version": "0.8.dev0"}
{"input": ["cuda -keys=cuda,gpu -max_num_threads=1024 -thread_warp_size=32", "depthwise_conv2d_nchw.cuda", [["TENSOR", [128, 42, 165, 165], "float32"], ["TENSOR", [42, 1, 5, 5], "float32"], 2, "SAME", 1, "float32"], {}], "config": {"index": 5635, "code_hash": null, "entity": [["tile_f", "sp", [-1, 6, 1, 1]], ["tile_y", "sp", [-1, 1, 1, 1]], ["tile_x", "sp", [-1, 1, 83, 1]], ["auto_unroll_max_step", "ot", 1500], ["unroll_explicit", "ot", 1]]}, "result": [[0.030081775], 0, 5.919095516204834, 1638806938.8966742], "version": 0.2, "tvm_version": "0.8.dev0"}
{"input": ["cuda -keys=cuda,gpu -max_num_threads=1024 -thread_warp_size=32", "depthwise_conv2d_nchw.cuda", [["TENSOR", [128, 42, 165, 165], "float32"], ["TENSOR", [42, 1, 5, 5], "float32"], 2, "SAME", 1, "float32"], {}], "config": {"index": 2563, "code_hash": null, "entity": [["tile_f", "sp", [-1, 6, 1, 1]], ["tile_y", "sp", [-1, 1, 1, 1]], ["tile_x", "sp", [-1, 1, 83, 1]], ["auto_unroll_max_step", "ot", 1500], ["unroll_explicit", "ot", 0]]}, "result": [[0.05642645], 0, 7.0869057178497314, 1638806945.5276754], "version": 0.2, "tvm_version": "0.8.dev0"}
{"input": ["cuda -keys=cuda,gpu -max_num_threads=1024 -thread_warp_size=32", "depthwise_conv2d_nchw.cuda", [["TENSOR", [128, 42, 165, 165], "float32"], ["TENSOR", [42, 1, 5, 5], "float32"], 2, "SAME", 1, "float32"], {}], "config": {"index": 2587, "code_hash": null, "entity": [["tile_f", "sp", [-1, 1, 1, 2]], ["tile_y", "sp", [-1, 1, 1, 1]], ["tile_x", "sp", [-1, 1, 83, 1]], ["auto_unroll_max_step", "ot", 1500], ["unroll_explicit", "ot", 0]]}, "result": [[0.02303788333333334], 0, 6.724427223205566, 1638806951.7016678], "version": 0.2, "tvm_version": "0.8.dev0"}
{"input": ["cuda -keys=cuda,gpu -max_num_threads=1024 -thread_warp_size=32", "depthwise_conv2d_nchw.cuda", [["TENSOR", [128, 42, 165, 165], "float32"], ["TENSOR", [42, 1, 5, 5], "float32"], 2, "SAME", 1, "float32"], {}], "config": {"index": 1563, "code_hash": null, "entity": [["tile_f", "sp", [-1, 1, 1, 2]], ["tile_y", "sp", [-1, 1, 1, 1]], ["tile_x", "sp", [-1, 1, 83, 1]], ["auto_unroll_max_step", "ot", 256], ["unroll_explicit", "ot", 0]]}, "result": [[0.022977433333333335], 0, 7.4536755084991455, 1638806958.4373376], "version": 0.2, "tvm_version": "0.8.dev0"}
{"input": ["cuda -keys=cuda,gpu -max_num_threads=1024 -thread_warp_size=32", "depthwise_conv2d_nchw.cuda", [["TENSOR", [128, 42, 165, 165], "float32"], ["TENSOR", [42, 1, 5, 5], "float32"], 2, "SAME", 1, "float32"], {}], "config": {"index": 4635, "code_hash": null, "entity": [["tile_f", "sp", [-1, 1, 1, 2]], ["tile_y", "sp", [-1, 1, 1, 1]], ["tile_x", "sp", [-1, 1, 83, 1]], ["auto_unroll_max_step", "ot", 256], ["unroll_explicit", "ot", 1]]}, "result": [[0.020058816666666666], 0, 6.869543075561523, 1638806964.9852903], "version": 0.2, "tvm_version": "0.8.dev0"}
{"input": ["cuda -keys=cuda,gpu -max_num_threads=1024 -thread_warp_size=32", "depthwise_conv2d_nchw.cuda", [["TENSOR", [128, 42, 165, 165], "float32"], ["TENSOR", [42, 1, 5, 5], "float32"], 2, "SAME", 1, "float32"], {}], "config": {"index": 5659, "code_hash": null, "entity": [["tile_f", "sp", [-1, 1, 1, 2]], ["tile_y", "sp", [-1, 1, 1, 1]], ["tile_x", "sp", [-1, 1, 83, 1]], ["auto_unroll_max_step", "ot", 1500], ["unroll_explicit", "ot", 1]]}, "result": [[0.01888155], 0, 5.8541953563690186, 1638806970.2866607], "version": 0.2, "tvm_version": "0.8.dev0"}
{"input": ["cuda -keys=cuda,gpu -max_num_threads=1024 -thread_warp_size=32", "depthwise_conv2d_nchw.cuda", [["TENSOR", [128, 42, 165, 165], "float32"], ["TENSOR", [42, 1, 5, 5], "float32"], 2, "SAME", 1, "float32"], {}], "config": {"index": 3203, "code_hash": null, "entity": [["tile_f", "sp", [-1, 6, 1, 1]], ["tile_y", "sp", [-1, 1, 83, 1]], ["tile_x", "sp", [-1, 1, 1, 1]], ["auto_unroll_max_step", "ot", 0], ["unroll_explicit", "ot", 1]]}, "result": [[0.073178525], 0, 5.742360591888428, 1638806975.4445846], "version": 0.2, "tvm_version": "0.8.dev0"}
{"input": ["cuda -keys=cuda,gpu -max_num_threads=1024 -thread_warp_size=32", "depthwise_conv2d_nchw.cuda", [["TENSOR", [128, 42, 165, 165], "float32"], ["TENSOR", [42, 1, 5, 5], "float32"], 2, "SAME", 1, "float32"], {}], "config": {"index": 131, "code_hash": null, "entity": [["tile_f", "sp", [-1, 6, 1, 1]], ["tile_y", "sp", [-1, 1, 83, 1]], ["tile_x", "sp", [-1, 1, 1, 1]], ["auto_unroll_max_step", "ot", 0], ["unroll_explicit", "ot", 0]]}, "result": [[0.06674277499999999], 0, 6.80083155632019, 1638806981.5876977], "version": 0.2, "tvm_version": "0.8.dev0"}
{"input": ["cuda -keys=cuda,gpu -max_num_threads=1024 -thread_warp_size=32", "depthwise_conv2d_nchw.cuda", [["TENSOR", [128, 42, 165, 165], "float32"], ["TENSOR", [42, 1, 5, 5], "float32"], 2, "SAME", 1, "float32"], {}], "config": {"index": 3202, "code_hash": null, "entity": [["tile_f", "sp", [-1, 3, 1, 1]], ["tile_y", "sp", [-1, 1, 83, 1]], ["tile_x", "sp", [-1, 1, 1, 1]], ["auto_unroll_max_step", "ot", 0], ["unroll_explicit", "ot", 1]]}, "result": [[0.037293725], 0, 6.680171489715576, 1638806987.6974642], "version": 0.2, "tvm_version": "0.8.dev0"}
{"input": ["cuda -keys=cuda,gpu -max_num_threads=1024 -thread_warp_size=32", "depthwise_conv2d_nchw.cuda", [["TENSOR", [128, 42, 165, 165], "float32"], ["TENSOR", [42, 1, 5, 5], "float32"], 2, "SAME", 1, "float32"], {}], "config": {"index": 130, "code_hash": null, "entity": [["tile_f", "sp", [-1, 3, 1, 1]], ["tile_y", "sp", [-1, 1, 83, 1]], ["tile_x", "sp", [-1, 1, 1, 1]], ["auto_unroll_max_step", "ot", 0], ["unroll_explicit", "ot", 0]]}, "result": [[0.0373153], 0, 6.6810314655303955, 1638806993.7539322], "version": 0.2, "tvm_version": "0.8.dev0"}
{"input": ["cuda -keys=cuda,gpu -max_num_threads=1024 -thread_warp_size=32", "depthwise_conv2d_nchw.cuda", [["TENSOR", [128, 42, 165, 165], "float32"], ["TENSOR", [42, 1, 5, 5], "float32"], 2, "SAME", 1, "float32"], {}], "config": {"index": 5248, "code_hash": null, "entity": [["tile_f", "sp", [-1, 1, 1, 1]], ["tile_y", "sp", [-1, 1, 83, 1]], ["tile_x", "sp", [-1, 1, 1, 1]], ["auto_unroll_max_step", "ot", 1500], ["unroll_explicit", "ot", 1]]}, "result": [[0.02280773333333333], 0, 6.81718373298645, 1638806999.9040039], "version": 0.2, "tvm_version": "0.8.dev0"}
{"input": ["cuda -keys=cuda,gpu -max_num_threads=1024 -thread_warp_size=32", "depthwise_conv2d_nchw.cuda", [["TENSOR", [128, 42, 165, 165], "float32"], ["TENSOR", [42, 1, 5, 5], "float32"], 2, "SAME", 1, "float32"], {}], "config": {"index": 1152, "code_hash": null, "entity": [["tile_f", "sp", [-1, 1, 1, 1]], ["tile_y", "sp", [-1, 1, 83, 1]], ["tile_x", "sp", [-1, 1, 1, 1]], ["auto_unroll_max_step", "ot", 256], ["unroll_explicit", "ot", 0]]}, "result": [[0.025219449999999997], 0, 5.991613149642944, 1638807005.273341], "version": 0.2, "tvm_version": "0.8.dev0"}
{"input": ["cuda -keys=cuda,gpu -max_num_threads=1024 -thread_warp_size=32", "depthwise_conv2d_nchw.cuda", [["TENSOR", [128, 42, 165, 165], "float32"], ["TENSOR", [42, 1, 5, 5], "float32"], 2, "SAME", 1, "float32"], {}], "config": {"index": 4224, "code_hash": null, "entity": [["tile_f", "sp", [-1, 1, 1, 1]], ["tile_y", "sp", [-1, 1, 83, 1]], ["tile_x", "sp", [-1, 1, 1, 1]], ["auto_unroll_max_step", "ot", 256], ["unroll_explicit", "ot", 1]]}, "result": [[0.02348925], 0, 5.6624510288238525, 1638807010.4266582], "version": 0.2, "tvm_version": "0.8.dev0"}
{"input": ["cuda -keys=cuda,gpu -max_num_threads=1024 -thread_warp_size=32", "depthwise_conv2d_nchw.cuda", [["TENSOR", [128, 42, 165, 165], "float32"], ["TENSOR", [42, 1, 5, 5], "float32"], 2, "SAME", 1, "float32"], {}], "config": {"index": 2176, "code_hash": null, "entity": [["tile_f", "sp", [-1, 1, 1, 1]], ["tile_y", "sp", [-1, 1, 83, 1]], ["tile_x", "sp", [-1, 1, 1, 1]], ["auto_unroll_max_step", "ot", 1500], ["unroll_explicit", "ot", 0]]}, "result": [[0.03176145], 0, 6.769822359085083, 1638807016.500619], "version": 0.2, "tvm_version": "0.8.dev0"}
{"input": ["cuda -keys=cuda,gpu -max_num_threads=1024 -thread_warp_size=32", "depthwise_conv2d_nchw.cuda", [["TENSOR", [128, 42, 165, 165], "float32"], ["TENSOR", [42, 1, 5, 5], "float32"], 2, "SAME", 1, "float32"], {}], "config": {"index": 1153, "code_hash": null, "entity": [["tile_f", "sp", [-1, 2, 1, 1]], ["tile_y", "sp", [-1, 1, 83, 1]], ["tile_x", "sp", [-1, 1, 1, 1]], ["auto_unroll_max_step", "ot", 256], ["unroll_explicit", "ot", 0]]}, "result": [[0.029618825], 0, 6.765199661254883, 1638807022.9343305], "version": 0.2, "tvm_version": "0.8.dev0"}
{"input": ["cuda -keys=cuda,gpu -max_num_threads=1024 -thread_warp_size=32", "depthwise_conv2d_nchw.cuda", [["TENSOR", [128, 42, 165, 165], "float32"], ["TENSOR", [42, 1, 5, 5], "float32"], 2, "SAME", 1, "float32"], {}], "config": {"index": 4225, "code_hash": null, "entity": [["tile_f", "sp", [-1, 2, 1, 1]], ["tile_y", "sp", [-1, 1, 83, 1]], ["tile_x", "sp", [-1, 1, 1, 1]], ["auto_unroll_max_step", "ot", 256], ["unroll_explicit", "ot", 1]]}, "result": [[0.0225752], 0, 5.774652481079102, 1638807033.1346881], "version": 0.2, "tvm_version": "0.8.dev0"}
{"input": ["cuda -keys=cuda,gpu -max_num_threads=1024 -thread_warp_size=32", "depthwise_conv2d_nchw.cuda", [["TENSOR", [128, 42, 165, 165], "float32"], ["TENSOR", [42, 1, 5, 5], "float32"], 2, "SAME", 1, "float32"], {}], "config": {"index": 5249, "code_hash": null, "entity": [["tile_f", "sp", [-1, 2, 1, 1]], ["tile_y", "sp", [-1, 1, 83, 1]], ["tile_x", "sp", [-1, 1, 1, 1]], ["auto_unroll_max_step", "ot", 1500], ["unroll_explicit", "ot", 1]]}, "result": [[0.0220202], 0, 5.72281551361084, 1638807038.554144], "version": 0.2, "tvm_version": "0.8.dev0"}
{"input": ["cuda -keys=cuda,gpu -max_num_threads=1024 -thread_warp_size=32", "depthwise_conv2d_nchw.cuda", [["TENSOR", [128, 42, 165, 165], "float32"], ["TENSOR", [42, 1, 5, 5], "float32"], 2, "SAME", 1, "float32"], {}], "config": {"index": 2177, "code_hash": null, "entity": [["tile_f", "sp", [-1, 2, 1, 1]], ["tile_y", "sp", [-1, 1, 83, 1]], ["tile_x", "sp", [-1, 1, 1, 1]], ["auto_unroll_max_step", "ot", 1500], ["unroll_explicit", "ot", 0]]}, "result": [[0.0263034], 0, 5.666278123855591, 1638807043.9577467], "version": 0.2, "tvm_version": "0.8.dev0"}
{"input": ["cuda -keys=cuda,gpu -max_num_threads=1024 -thread_warp_size=32", "depthwise_conv2d_nchw.cuda", [["TENSOR", [128, 42, 165, 165], "float32"], ["TENSOR", [42, 1, 5, 5], "float32"], 2, "SAME", 1, "float32"], {}], "config": {"index": 517, "code_hash": null, "entity": [["tile_f", "sp", [-1, 14, 1, 1]], ["tile_y", "sp", [-1, 1, 1, 1]], ["tile_x", "sp", [-1, 1, 83, 1]], ["auto_unroll_max_step", "ot", 0], ["unroll_explicit", "ot", 0]]}, "result": [[0.30390025000000004], 0, 8.257818937301636, 1638807052.1433737], "version": 0.2, "tvm_version": "0.8.dev0"}
{"input": ["cuda -keys=cuda,gpu -max_num_threads=1024 -thread_warp_size=32", "depthwise_conv2d_nchw.cuda", [["TENSOR", [128, 42, 165, 165], "float32"], ["TENSOR", [42, 1, 5, 5], "float32"], 2, "SAME", 1, "float32"], {}], "config": {"index": 3589, "code_hash": null, "entity": [["tile_f", "sp", [-1, 14, 1, 1]], ["tile_y", "sp", [-1, 1, 1, 1]], ["tile_x", "sp", [-1, 1, 83, 1]], ["auto_unroll_max_step", "ot", 0], ["unroll_explicit", "ot", 1]]}, "result": [[0.30385365000000003], 0, 7.867337942123413, 1638807059.6461632], "version": 0.2, "tvm_version": "0.8.dev0"}
{"input": ["cuda -keys=cuda,gpu -max_num_threads=1024 -thread_warp_size=32", "depthwise_conv2d_nchw.cuda", [["TENSOR", [128, 42, 165, 165], "float32"], ["TENSOR", [42, 1, 5, 5], "float32"], 2, "SAME", 1, "float32"], {}], "config": {"index": 521, "code_hash": null, "entity": [["tile_f", "sp", [-1, 3, 2, 1]], ["tile_y", "sp", [-1, 1, 1, 1]], ["tile_x", "sp", [-1, 1, 83, 1]], ["auto_unroll_max_step", "ot", 0], ["unroll_explicit", "ot", 0]]}, "result": [[0.0499222], 0, 7.009849786758423, 1638807066.3808484], "version": 0.2, "tvm_version": "0.8.dev0"}
{"input": ["cuda -keys=cuda,gpu -max_num_threads=1024 -thread_warp_size=32", "depthwise_conv2d_nchw.cuda", [["TENSOR", [128, 42, 165, 165], "float32"], ["TENSOR", [42, 1, 5, 5], "float32"], 2, "SAME", 1, "float32"], {}], "config": {"index": 3593, "code_hash": null, "entity": [["tile_f", "sp", [-1, 3, 2, 1]], ["tile_y", "sp", [-1, 1, 1, 1]], ["tile_x", "sp", [-1, 1, 83, 1]], ["auto_unroll_max_step", "ot", 0], ["unroll_explicit", "ot", 1]]}, "result": [[0.03999075], 0, 5.252871513366699, 1638807071.4964535], "version": 0.2, "tvm_version": "0.8.dev0"}
{"input": ["cuda -keys=cuda,gpu -max_num_threads=1024 -thread_warp_size=32", "depthwise_conv2d_nchw.cuda", [["TENSOR", [128, 42, 165, 165], "float32"], ["TENSOR", [42, 1, 5, 5], "float32"], 2, "SAME", 1, "float32"], {}], "config": {"index": 3620, "code_hash": null, "entity": [["tile_f", "sp", [-1, 1, 1, 3]], ["tile_y", "sp", [-1, 1, 1, 1]], ["tile_x", "sp", [-1, 1, 83, 1]], ["auto_unroll_max_step", "ot", 0], ["unroll_explicit", "ot", 1]]}, "result": [[0.032356175], 0, 5.236187696456909, 1638807076.4750597], "version": 0.2, "tvm_version": "0.8.dev0"}
{"input": ["cuda -keys=cuda,gpu -max_num_threads=1024 -thread_warp_size=32", "depthwise_conv2d_nchw.cuda", [["TENSOR", [128, 42, 165, 165], "float32"], ["TENSOR", [42, 1, 5, 5], "float32"], 2, "SAME", 1, "float32"], {}], "config": {"index": 548, "code_hash": null, "entity": [["tile_f", "sp", [-1, 1, 1, 3]], ["tile_y", "sp", [-1, 1, 1, 1]], ["tile_x", "sp", [-1, 1, 83, 1]], ["auto_unroll_max_step", "ot", 0], ["unroll_explicit", "ot", 0]]}, "result": [[0.031747475000000004], 0, 6.239603757858276, 1638807082.4400566], "version": 0.2, "tvm_version": "0.8.dev0"}
{"input": ["cuda -keys=cuda,gpu -max_num_threads=1024 -thread_warp_size=32", "depthwise_conv2d_nchw.cuda", [["TENSOR", [128, 42, 165, 165], "float32"], ["TENSOR", [42, 1, 5, 5], "float32"], 2, "SAME", 1, "float32"], {}], "config": {"index": 1540, "code_hash": null, "entity": [["tile_f", "sp", [-1, 7, 1, 1]], ["tile_y", "sp", [-1, 1, 1, 1]], ["tile_x", "sp", [-1, 1, 83, 1]], ["auto_unroll_max_step", "ot", 256], ["unroll_explicit", "ot", 0]]}, "result": [[0.068806625], 0, 6.574569225311279, 1638807088.8343449], "version": 0.2, "tvm_version": "0.8.dev0"}
{"input": ["cuda -keys=cuda,gpu -max_num_threads=1024 -thread_warp_size=32", "depthwise_conv2d_nchw.cuda", [["TENSOR", [128, 42, 165, 165], "float32"], ["TENSOR", [42, 1, 5, 5], "float32"], 2, "SAME", 1, "float32"], {}], "config": {"index": 2564, "code_hash": null, "entity": [["tile_f", "sp", [-1, 7, 1, 1]], ["tile_y", "sp", [-1, 1, 1, 1]], ["tile_x", "sp", [-1, 1, 83, 1]], ["auto_unroll_max_step", "ot", 1500], ["unroll_explicit", "ot", 0]]}, "result": [[0.06881762500000001], 0, 7.49786376953125, 1638807096.3186522], "version": 0.2, "tvm_version": "0.8.dev0"}
{"input": ["cuda -keys=cuda,gpu -max_num_threads=1024 -thread_warp_size=32", "depthwise_conv2d_nchw.cuda", [["TENSOR", [128, 42, 165, 165], "float32"], ["TENSOR", [42, 1, 5, 5], "float32"], 2, "SAME", 1, "float32"], {}], "config": {"index": 4612, "code_hash": null, "entity": [["tile_f", "sp", [-1, 7, 1, 1]], ["tile_y", "sp", [-1, 1, 1, 1]], ["tile_x", "sp", [-1, 1, 83, 1]], ["auto_unroll_max_step", "ot", 256], ["unroll_explicit", "ot", 1]]}, "result": [[0.035770949999999996], 0, 7.034924745559692, 1638807103.187514], "version": 0.2, "tvm_version": "0.8.dev0"}
{"input": ["cuda -keys=cuda,gpu -max_num_threads=1024 -thread_warp_size=32", "depthwise_conv2d_nchw.cuda", [["TENSOR", [128, 42, 165, 165], "float32"], ["TENSOR", [42, 1, 5, 5], "float32"], 2, "SAME", 1, "float32"], {}], "config": {"index": 5636, "code_hash": null, "entity": [["tile_f", "sp", [-1, 7, 1, 1]], ["tile_y", "sp", [-1, 1, 1, 1]], ["tile_x", "sp", [-1, 1, 83, 1]], ["auto_unroll_max_step", "ot", 1500], ["unroll_explicit", "ot", 1]]}, "result": [[0.035762175], 0, 7.150116205215454, 1638807109.726999], "version": 0.2, "tvm_version": "0.8.dev0"}
{"input": ["cuda -keys=cuda,gpu -max_num_threads=1024 -thread_warp_size=32", "depthwise_conv2d_nchw.cuda", [["TENSOR", [128, 42, 165, 165], "float32"], ["TENSOR", [42, 1, 5, 5], "float32"], 2, "SAME", 1, "float32"], {}], "config": {"index": 5921, "code_hash": null, "entity": [["tile_f", "sp", [-1, 1, 7, 2]], ["tile_y", "sp", [-1, 1, 1, 1]], ["tile_x", "sp", [-1, 1, 1, 83]], ["auto_unroll_max_step", "ot", 1500], ["unroll_explicit", "ot", 1]]}, "result": [[1.403540075], 0, 16.167697429656982, 1638807122.8303087], "version": 0.2, "tvm_version": "0.8.dev0"}
{"input": ["cuda -keys=cuda,gpu -max_num_threads=1024 -thread_warp_size=32", "depthwise_conv2d_nchw.cuda", [["TENSOR", [128, 42, 165, 165], "float32"], ["TENSOR", [42, 1, 5, 5], "float32"], 2, "SAME", 1, "float32"], {}], "config": {"index": 569, "code_hash": null, "entity": [["tile_f", "sp", [-1, 1, 1, 14]], ["tile_y", "sp", [-1, 1, 1, 1]], ["tile_x", "sp", [-1, 1, 83, 1]], ["auto_unroll_max_step", "ot", 0], ["unroll_explicit", "ot", 0]]}, "result": [[0.307455075], 0, 8.227955341339111, 1638807130.598806], "version": 0.2, "tvm_version": "0.8.dev0"}
{"input": ["cuda -keys=cuda,gpu -max_num_threads=1024 -thread_warp_size=32", "depthwise_conv2d_nchw.cuda", [["TENSOR", [128, 42, 165, 165], "float32"], ["TENSOR", [42, 1, 5, 5], "float32"], 2, "SAME", 1, "float32"], {}], "config": {"index": 5384, "code_hash": null, "entity": [["tile_f", "sp", [-1, 1, 2, 1]], ["tile_y", "sp", [-1, 1, 1, 1]], ["tile_x", "sp", [-1, 83, 1, 1]], ["auto_unroll_max_step", "ot", 1500], ["unroll_explicit", "ot", 1]]}, "result": [[1.1522048999999999], 0, 18.439871788024902, 1638807145.1397247], "version": 0.2, "tvm_version": "0.8.dev0"}
{"input": ["cuda -keys=cuda,gpu -max_num_threads=1024 -thread_warp_size=32", "depthwise_conv2d_nchw.cuda", [["TENSOR", [128, 42, 165, 165], "float32"], ["TENSOR", [42, 1, 5, 5], "float32"], 2, "SAME", 1, "float32"], {}], "config": {"index": 4251, "code_hash": null, "entity": [["tile_f", "sp", [-1, 1, 1, 2]], ["tile_y", "sp", [-1, 1, 83, 1]], ["tile_x", "sp", [-1, 1, 1, 1]], ["auto_unroll_max_step", "ot", 256], ["unroll_explicit", "ot", 1]]}, "result": [[0.027751075], 0, 4.958004713058472, 1638807163.4758215], "version": 0.2, "tvm_version": "0.8.dev0"}
{"input": ["cuda -keys=cuda,gpu -max_num_threads=1024 -thread_warp_size=32", "depthwise_conv2d_nchw.cuda", [["TENSOR", [128, 42, 165, 165], "float32"], ["TENSOR", [42, 1, 5, 5], "float32"], 2, "SAME", 1, "float32"], {}], "config": {"index": 4104, "code_hash": null, "entity": [["tile_f", "sp", [-1, 1, 2, 1]], ["tile_y", "sp", [-1, 1, 1, 1]], ["tile_x", "sp", [-1, 1, 1, 1]], ["auto_unroll_max_step", "ot", 256], ["unroll_explicit", "ot", 1]]}, "result": [[0.991793325], 0, 11.458911180496216, 1638807174.54043], "version": 0.2, "tvm_version": "0.8.dev0"}
{"input": ["cuda -keys=cuda,gpu -max_num_threads=1024 -thread_warp_size=32", "depthwise_conv2d_nchw.cuda", [["TENSOR", [128, 42, 165, 165], "float32"], ["TENSOR", [42, 1, 5, 5], "float32"], 2, "SAME", 1, "float32"], {}], "config": {"index": 5275, "code_hash": null, "entity": [["tile_f", "sp", [-1, 1, 1, 2]], ["tile_y", "sp", [-1, 1, 83, 1]], ["tile_x", "sp", [-1, 1, 1, 1]], ["auto_unroll_max_step", "ot", 1500], ["unroll_explicit", "ot", 1]]}, "result": [[0.021937299999999996], 0, 6.493748188018799, 1638807181.0191352], "version": 0.2, "tvm_version": "0.8.dev0"}
{"input": ["cuda -keys=cuda,gpu -max_num_threads=1024 -thread_warp_size=32", "depthwise_conv2d_nchw.cuda", [["TENSOR", [128, 42, 165, 165], "float32"], ["TENSOR", [42, 1, 5, 5], "float32"], 2, "SAME", 1, "float32"], {}], "config": {"index": 4096, "code_hash": null, "entity": [["tile_f", "sp", [-1, 1, 1, 1]], ["tile_y", "sp", [-1, 1, 1, 1]], ["tile_x", "sp", [-1, 1, 1, 1]], ["auto_unroll_max_step", "ot", 256], ["unroll_explicit", "ot", 1]]}, "result": [[0.776592725], 0, 9.926206111907959, 1638807190.7809823], "version": 0.2, "tvm_version": "0.8.dev0"}
{"input": ["cuda -keys=cuda,gpu -max_num_threads=1024 -thread_warp_size=32", "depthwise_conv2d_nchw.cuda", [["TENSOR", [128, 42, 165, 165], "float32"], ["TENSOR", [42, 1, 5, 5], "float32"], 2, "SAME", 1, "float32"], {}], "config": {"index": 5634, "code_hash": null, "entity": [["tile_f", "sp", [-1, 3, 1, 1]], ["tile_y", "sp", [-1, 1, 1, 1]], ["tile_x", "sp", [-1, 1, 83, 1]], ["auto_unroll_max_step", "ot", 1500], ["unroll_explicit", "ot", 1]]}, "result": [[0.0185799], 0, 6.155841827392578, 1638807196.5157354], "version": 0.2, "tvm_version": "0.8.dev0"}
{"input": ["cuda -keys=cuda,gpu -max_num_threads=1024 -thread_warp_size=32", "depthwise_conv2d_nchw.cuda", [["TENSOR", [128, 42, 165, 165], "float32"], ["TENSOR", [42, 1, 5, 5], "float32"], 2, "SAME", 1, "float32"], {}], "config": {"index": 4108, "code_hash": null, "entity": [["tile_f", "sp", [-1, 1, 3, 1]], ["tile_y", "sp", [-1, 1, 1, 1]], ["tile_x", "sp", [-1, 1, 1, 1]], ["auto_unroll_max_step", "ot", 256], ["unroll_explicit", "ot", 1]]}, "result": [[0.7434385], 0, 11.746387958526611, 1638807207.807139], "version": 0.2, "tvm_version": "0.8.dev0"}
{"input": ["cuda -keys=cuda,gpu -max_num_threads=1024 -thread_warp_size=32", "depthwise_conv2d_nchw.cuda", [["TENSOR", [128, 42, 165, 165], "float32"], ["TENSOR", [42, 1, 5, 5], "float32"], 2, "SAME", 1, "float32"], {}], "config": {"index": 4610, "code_hash": null, "entity": [["tile_f", "sp", [-1, 3, 1, 1]], ["tile_y", "sp", [-1, 1, 1, 1]], ["tile_x", "sp", [-1, 1, 83, 1]], ["auto_unroll_max_step", "ot", 256], ["unroll_explicit", "ot", 1]]}, "result": [[0.02353015], 0, 6.613437175750732, 1638807214.2253094], "version": 0.2, "tvm_version": "0.8.dev0"}
{"input": ["cuda -keys=cuda,gpu -max_num_threads=1024 -thread_warp_size=32", "depthwise_conv2d_nchw.cuda", [["TENSOR", [128, 42, 165, 165], "float32"], ["TENSOR", [42, 1, 5, 5], "float32"], 2, "SAME", 1, "float32"], {}], "config": {"index": 4232, "code_hash": null, "entity": [["tile_f", "sp", [-1, 1, 2, 1]], ["tile_y", "sp", [-1, 1, 83, 1]], ["tile_x", "sp", [-1, 1, 1, 1]], ["auto_unroll_max_step", "ot", 256], ["unroll_explicit", "ot", 1]]}, "result": [[0.023405766666666664], 0, 6.803997755050659, 1638807220.8631516], "version": 0.2, "tvm_version": "0.8.dev0"}
{"input": ["cuda -keys=cuda,gpu -max_num_threads=1024 -thread_warp_size=32", "depthwise_conv2d_nchw.cuda", [["TENSOR", [128, 42, 165, 165], "float32"], ["TENSOR", [42, 1, 5, 5], "float32"], 2, "SAME", 1, "float32"], {}], "config": {"index": 3080, "code_hash": null, "entity": [["tile_f", "sp", [-1, 1, 2, 1]], ["tile_y", "sp", [-1, 1, 1, 1]], ["tile_x", "sp", [-1, 1, 1, 1]], ["auto_unroll_max_step", "ot", 0], ["unroll_explicit", "ot", 1]]}, "result": [[1.2918752750000002], 0, 13.315608263015747, 1638807233.8674333], "version": 0.2, "tvm_version": "0.8.dev0"}
{"input": ["cuda -keys=cuda,gpu -max_num_threads=1024 -thread_warp_size=32", "depthwise_conv2d_nchw.cuda", [["TENSOR", [128, 42, 165, 165], "float32"], ["TENSOR", [42, 1, 5, 5], "float32"], 2, "SAME", 1, "float32"], {}], "config": {"index": 4620, "code_hash": null, "entity": [["tile_f", "sp", [-1, 1, 3, 1]], ["tile_y", "sp", [-1, 1, 1, 1]], ["tile_x", "sp", [-1, 1, 83, 1]], ["auto_unroll_max_step", "ot", 256], ["unroll_explicit", "ot", 1]]}, "result": [[0.018554266666666666], 0, 6.249936580657959, 1638807239.704388], "version": 0.2, "tvm_version": "0.8.dev0"}
{"input": ["cuda -keys=cuda,gpu -max_num_threads=1024 -thread_warp_size=32", "depthwise_conv2d_nchw.cuda", [["TENSOR", [128, 42, 165, 165], "float32"], ["TENSOR", [42, 1, 5, 5], "float32"], 2, "SAME", 1, "float32"], {}], "config": {"index": 5128, "code_hash": null, "entity": [["tile_f", "sp", [-1, 1, 2, 1]], ["tile_y", "sp", [-1, 1, 1, 1]], ["tile_x", "sp", [-1, 1, 1, 1]], ["auto_unroll_max_step", "ot", 1500], ["unroll_explicit", "ot", 1]]}, "result": [[0.9914125500000001], 0, 10.542158842086792, 1638807250.3174126], "version": 0.2, "tvm_version": "0.8.dev0"}
{"input": ["cuda -keys=cuda,gpu -max_num_threads=1024 -thread_warp_size=32", "depthwise_conv2d_nchw.cuda", [["TENSOR", [128, 42, 165, 165], "float32"], ["TENSOR", [42, 1, 5, 5], "float32"], 2, "SAME", 1, "float32"], {}], "config": {"index": 1179, "code_hash": null, "entity": [["tile_f", "sp", [-1, 1, 1, 2]], ["tile_y", "sp", [-1, 1, 83, 1]], ["tile_x", "sp", [-1, 1, 1, 1]], ["auto_unroll_max_step", "ot", 256], ["unroll_explicit", "ot", 0]]}, "result": [[0.025633325], 0, 7.279200315475464, 1638807257.5469887], "version": 0.2, "tvm_version": "0.8.dev0"}
{"input": ["cuda -keys=cuda,gpu -max_num_threads=1024 -thread_warp_size=32", "depthwise_conv2d_nchw.cuda", [["TENSOR", [128, 42, 165, 165], "float32"], ["TENSOR", [42, 1, 5, 5], "float32"], 2, "SAME", 1, "float32"], {}], "config": {"index": 5644, "code_hash": null, "entity": [["tile_f", "sp", [-1, 1, 3, 1]], ["tile_y", "sp", [-1, 1, 1, 1]], ["tile_x", "sp", [-1, 1, 83, 1]], ["auto_unroll_max_step", "ot", 1500], ["unroll_explicit", "ot", 1]]}, "result": [[0.018548583333333334], 0, 5.873810291290283, 1638807263.1059103], "version": 0.2, "tvm_version": "0.8.dev0"}
{"input": ["cuda -keys=cuda,gpu -max_num_threads=1024 -thread_warp_size=32", "depthwise_conv2d_nchw.cuda", [["TENSOR", [128, 42, 165, 165], "float32"], ["TENSOR", [42, 1, 5, 5], "float32"], 2, "SAME", 1, "float32"], {}], "config": {"index": 2203, "code_hash": null, "entity": [["tile_f", "sp", [-1, 1, 1, 2]], ["tile_y", "sp", [-1, 1, 83, 1]], ["tile_x", "sp", [-1, 1, 1, 1]], ["auto_unroll_max_step", "ot", 1500], ["unroll_explicit", "ot", 0]]}, "result": [[0.03608165000000001], 0, 7.2324419021606445, 1638807270.013891], "version": 0.2, "tvm_version": "0.8.dev0"}
{"input": ["cuda -keys=cuda,gpu -max_num_threads=1024 -thread_warp_size=32", "depthwise_conv2d_nchw.cuda", [["TENSOR", [128, 42, 165, 165], "float32"], ["TENSOR", [42, 1, 5, 5], "float32"], 2, "SAME", 1, "float32"], {}], "config": {"index": 5256, "code_hash": null, "entity": [["tile_f", "sp", [-1, 1, 2, 1]], ["tile_y", "sp", [-1, 1, 83, 1]], ["tile_x", "sp", [-1, 1, 1, 1]], ["auto_unroll_max_step", "ot", 1500], ["unroll_explicit", "ot", 1]]}, "result": [[0.02422835], 0, 7.1947784423828125, 1638807276.8100834], "version": 0.2, "tvm_version": "0.8.dev0"}
{"input": ["cuda -keys=cuda,gpu -max_num_threads=1024 -thread_warp_size=32", "depthwise_conv2d_nchw.cuda", [["TENSOR", [128, 42, 165, 165], "float32"], ["TENSOR", [42, 1, 5, 5], "float32"], 2, "SAME", 1, "float32"], {}], "config": {"index": 4112, "code_hash": null, "entity": [["tile_f", "sp", [-1, 1, 6, 1]], ["tile_y", "sp", [-1, 1, 1, 1]], ["tile_x", "sp", [-1, 1, 1, 1]], ["auto_unroll_max_step", "ot", 256], ["unroll_explicit", "ot", 1]]}, "result": [[0.46695735], 0, 8.640627384185791, 1638807285.4134777], "version": 0.2, "tvm_version": "0.8.dev0"}
{"input": ["cuda -keys=cuda,gpu -max_num_threads=1024 -thread_warp_size=32", "depthwise_conv2d_nchw.cuda", [["TENSOR", [128, 42, 165, 165], "float32"], ["TENSOR", [42, 1, 5, 5], "float32"], 2, "SAME", 1, "float32"], {}], "config": {"index": 1032, "code_hash": null, "entity": [["tile_f", "sp", [-1, 1, 2, 1]], ["tile_y", "sp", [-1, 1, 1, 1]], ["tile_x", "sp", [-1, 1, 1, 1]], ["auto_unroll_max_step", "ot", 256], ["unroll_explicit", "ot", 0]]}, "result": [[1.283650875], 0, 12.425240516662598, 1638807297.4780517], "version": 0.2, "tvm_version": "0.8.dev0"}
{"input": ["cuda -keys=cuda,gpu -max_num_threads=1024 -thread_warp_size=32", "depthwise_conv2d_nchw.cuda", [["TENSOR", [128, 42, 165, 165], "float32"], ["TENSOR", [42, 1, 5, 5], "float32"], 2, "SAME", 1, "float32"], {}], "config": {"index": 4114, "code_hash": null, "entity": [["tile_f", "sp", [-1, 1, 7, 1]], ["tile_y", "sp", [-1, 1, 1, 1]], ["tile_x", "sp", [-1, 1, 1, 1]], ["auto_unroll_max_step", "ot", 256], ["unroll_explicit", "ot", 1]]}, "result": [[0.4060344], 0, 8.492427587509155, 1638807305.6824825], "version": 0.2, "tvm_version": "0.8.dev0"}
{"input": ["cuda -keys=cuda,gpu -max_num_threads=1024 -thread_warp_size=32", "depthwise_conv2d_nchw.cuda", [["TENSOR", [128, 42, 165, 165], "float32"], ["TENSOR", [42, 1, 5, 5], "float32"], 2, "SAME", 1, "float32"], {}], "config": {"index": 4118, "code_hash": null, "entity": [["tile_f", "sp", [-1, 1, 14, 1]], ["tile_y", "sp", [-1, 1, 1, 1]], ["tile_x", "sp", [-1, 1, 1, 1]], ["auto_unroll_max_step", "ot", 256], ["unroll_explicit", "ot", 1]]}, "result": [[0.22038945000000001], 0, 7.396182060241699, 1638807312.6034653], "version": 0.2, "tvm_version": "0.8.dev0"}
{"input": ["cuda -keys=cuda,gpu -max_num_threads=1024 -thread_warp_size=32", "depthwise_conv2d_nchw.cuda", [["TENSOR", [128, 42, 165, 165], "float32"], ["TENSOR", [42, 1, 5, 5], "float32"], 2, "SAME", 1, "float32"], {}], "config": {"index": 3072, "code_hash": null, "entity": [["tile_f", "sp", [-1, 1, 1, 1]], ["tile_y", "sp", [-1, 1, 1, 1]], ["tile_x", "sp", [-1, 1, 1, 1]], ["auto_unroll_max_step", "ot", 0], ["unroll_explicit", "ot", 1]]}, "result": [[1.033616225], 0, 12.023123264312744, 1638807324.2609031], "version": 0.2, "tvm_version": "0.8.dev0"}
{"input": ["cuda -keys=cuda,gpu -max_num_threads=1024 -thread_warp_size=32", "depthwise_conv2d_nchw.cuda", [["TENSOR", [128, 42, 165, 165], "float32"], ["TENSOR", [42, 1, 5, 5], "float32"], 2, "SAME", 1, "float32"], {}], "config": {"index": 5120, "code_hash": null, "entity": [["tile_f", "sp", [-1, 1, 1, 1]], ["tile_y", "sp", [-1, 1, 1, 1]], ["tile_x", "sp", [-1, 1, 1, 1]], ["auto_unroll_max_step", "ot", 1500], ["unroll_explicit", "ot", 1]]}, "result": [[0.7767162], 0, 8.893002271652222, 1638807332.743472], "version": 0.2, "tvm_version": "0.8.dev0"}
{"input": ["cuda -keys=cuda,gpu -max_num_threads=1024 -thread_warp_size=32", "depthwise_conv2d_nchw.cuda", [["TENSOR", [128, 42, 165, 165], "float32"], ["TENSOR", [42, 1, 5, 5], "float32"], 2, "SAME", 1, "float32"], {}], "config": {"index": 1036, "code_hash": null, "entity": [["tile_f", "sp", [-1, 1, 3, 1]], ["tile_y", "sp", [-1, 1, 1, 1]], ["tile_x", "sp", [-1, 1, 1, 1]], ["auto_unroll_max_step", "ot", 256], ["unroll_explicit", "ot", 0]]}, "result": [[0.899359875], 0, 10.915461778640747, 1638807343.460257], "version": 0.2, "tvm_version": "0.8.dev0"}
{"input": ["cuda -keys=cuda,gpu -max_num_threads=1024 -thread_warp_size=32", "depthwise_conv2d_nchw.cuda", [["TENSOR", [128, 42, 165, 165], "float32"], ["TENSOR", [42, 1, 5, 5], "float32"], 2, "SAME", 1, "float32"], {}], "config": {"index": 5132, "code_hash": null, "entity": [["tile_f", "sp", [-1, 1, 3, 1]], ["tile_y", "sp", [-1, 1, 1, 1]], ["tile_x", "sp", [-1, 1, 1, 1]], ["auto_unroll_max_step", "ot", 1500], ["unroll_explicit", "ot", 1]]}, "result": [[0.7428696250000001], 0, 10.146579504013062, 1638807353.2429607], "version": 0.2, "tvm_version": "0.8.dev0"}
{"input": ["cuda -keys=cuda,gpu -max_num_threads=1024 -thread_warp_size=32", "depthwise_conv2d_nchw.cuda", [["TENSOR", [128, 42, 165, 165], "float32"], ["TENSOR", [42, 1, 5, 5], "float32"], 2, "SAME", 1, "float32"], {}], "config": {"index": 1024, "code_hash": null, "entity": [["tile_f", "sp", [-1, 1, 1, 1]], ["tile_y", "sp", [-1, 1, 1, 1]], ["tile_x", "sp", [-1, 1, 1, 1]], ["auto_unroll_max_step", "ot", 256], ["unroll_explicit", "ot", 0]]}, "result": [[1.7414342999999999], 0, 13.795022249221802, 1638807366.8581529], "version": 0.2, "tvm_version": "0.8.dev0"}
{"input": ["cuda -keys=cuda,gpu -max_num_threads=1024 -thread_warp_size=32", "depthwise_conv2d_nchw.cuda", [["TENSOR", [128, 42, 165, 165], "float32"], ["TENSOR", [42, 1, 5, 5], "float32"], 2, "SAME", 1, "float32"], {}], "config": {"index": 3084, "code_hash": null, "entity": [["tile_f", "sp", [-1, 1, 3, 1]], ["tile_y", "sp", [-1, 1, 1, 1]], ["tile_x", "sp", [-1, 1, 1, 1]], ["auto_unroll_max_step", "ot", 0], ["unroll_explicit", "ot", 1]]}, "result": [[0.90334265], 0, 10.372544527053833, 1638807377.6258292], "version": 0.2, "tvm_version": "0.8.dev0"}
{"input": ["cuda -keys=cuda,gpu -max_num_threads=1024 -thread_warp_size=32", "depthwise_conv2d_nchw.cuda", [["TENSOR", [128, 42, 165, 165], "float32"], ["TENSOR", [42, 1, 5, 5], "float32"], 2, "SAME", 1, "float32"], {}], "config": {"index": 8, "code_hash": null, "entity": [["tile_f", "sp", [-1, 1, 2, 1]], ["tile_y", "sp", [-1, 1, 1, 1]], ["tile_x", "sp", [-1, 1, 1, 1]], ["auto_unroll_max_step", "ot", 0], ["unroll_explicit", "ot", 0]]}, "result": [[1.2928515999999999], 0, 12.650750160217285, 1638807389.9862778], "version": 0.2, "tvm_version": "0.8.dev0"}
{"input": ["cuda -keys=cuda,gpu -max_num_threads=1024 -thread_warp_size=32", "depthwise_conv2d_nchw.cuda", [["TENSOR", [128, 42, 165, 165], "float32"], ["TENSOR", [42, 1, 5, 5], "float32"], 2, "SAME", 1, "float32"], {}], "config": {"index": 5136, "code_hash": null, "entity": [["tile_f", "sp", [-1, 1, 6, 1]], ["tile_y", "sp", [-1, 1, 1, 1]], ["tile_x", "sp", [-1, 1, 1, 1]], ["auto_unroll_max_step", "ot", 1500], ["unroll_explicit", "ot", 1]]}, "result": [[0.46709935], 0, 7.40044379234314, 1638807396.9474833], "version": 0.2, "tvm_version": "0.8.dev0"}
{"input": ["cuda -keys=cuda,gpu -max_num_threads=1024 -thread_warp_size=32", "depthwise_conv2d_nchw.cuda", [["TENSOR", [128, 42, 165, 165], "float32"], ["TENSOR", [42, 1, 5, 5], "float32"], 2, "SAME", 1, "float32"], {}], "config": {"index": 5138, "code_hash": null, "entity": [["tile_f", "sp", [-1, 1, 7, 1]], ["tile_y", "sp", [-1, 1, 1, 1]], ["tile_x", "sp", [-1, 1, 1, 1]], ["auto_unroll_max_step", "ot", 1500], ["unroll_explicit", "ot", 1]]}, "result": [[0.406091925], 0, 8.338669061660767, 1638807404.7591841], "version": 0.2, "tvm_version": "0.8.dev0"}
{"input": ["cuda -keys=cuda,gpu -max_num_threads=1024 -thread_warp_size=32", "depthwise_conv2d_nchw.cuda", [["TENSOR", [128, 42, 165, 165], "float32"], ["TENSOR", [42, 1, 5, 5], "float32"], 2, "SAME", 1, "float32"], {}], "config": {"index": 3596, "code_hash": null, "entity": [["tile_f", "sp", [-1, 1, 3, 1]], ["tile_y", "sp", [-1, 1, 1, 1]], ["tile_x", "sp", [-1, 1, 83, 1]], ["auto_unroll_max_step", "ot", 0], ["unroll_explicit", "ot", 1]]}, "result": [[0.021504900000000004], 0, 6.512726545333862, 1638807410.9621274], "version": 0.2, "tvm_version": "0.8.dev0"}
{"input": ["cuda -keys=cuda,gpu -max_num_threads=1024 -thread_warp_size=32", "depthwise_conv2d_nchw.cuda", [["TENSOR", [128, 42, 165, 165], "float32"], ["TENSOR", [42, 1, 5, 5], "float32"], 2, "SAME", 1, "float32"], {}], "config": {"index": 5142, "code_hash": null, "entity": [["tile_f", "sp", [-1, 1, 14, 1]], ["tile_y", "sp", [-1, 1, 1, 1]], ["tile_x", "sp", [-1, 1, 1, 1]], ["auto_unroll_max_step", "ot", 1500], ["unroll_explicit", "ot", 1]]}, "result": [[0.22044872499999998], 0, 7.685019254684448, 1638807418.5145376], "version": 0.2, "tvm_version": "0.8.dev0"}
{"input": ["cuda -keys=cuda,gpu -max_num_threads=1024 -thread_warp_size=32", "depthwise_conv2d_nchw.cuda", [["TENSOR", [128, 42, 165, 165], "float32"], ["TENSOR", [42, 1, 5, 5], "float32"], 2, "SAME", 1, "float32"], {}], "config": {"index": 1548, "code_hash": null, "entity": [["tile_f", "sp", [-1, 1, 3, 1]], ["tile_y", "sp", [-1, 1, 1, 1]], ["tile_x", "sp", [-1, 1, 83, 1]], ["auto_unroll_max_step", "ot", 256], ["unroll_explicit", "ot", 0]]}, "result": [[0.030168749999999998], 0, 6.070510625839233, 1638807424.367956], "version": 0.2, "tvm_version": "0.8.dev0"}
{"input": ["cuda -keys=cuda,gpu -max_num_threads=1024 -thread_warp_size=32", "depthwise_conv2d_nchw.cuda", [["TENSOR", [128, 42, 165, 165], "float32"], ["TENSOR", [42, 1, 5, 5], "float32"], 2, "SAME", 1, "float32"], {}], "config": {"index": 12, "code_hash": null, "entity": [["tile_f", "sp", [-1, 1, 3, 1]], ["tile_y", "sp", [-1, 1, 1, 1]], ["tile_x", "sp", [-1, 1, 1, 1]], ["auto_unroll_max_step", "ot", 0], ["unroll_explicit", "ot", 0]]}, "result": [[0.9024994749999999], 0, 10.36954116821289, 1638807434.695683], "version": 0.2, "tvm_version": "0.8.dev0"}
{"input": ["cuda -keys=cuda,gpu -max_num_threads=1024 -thread_warp_size=32", "depthwise_conv2d_nchw.cuda", [["TENSOR", [128, 42, 165, 165], "float32"], ["TENSOR", [42, 1, 5, 5], "float32"], 2, "SAME", 1, "float32"], {}], "config": {"index": 0, "code_hash": null, "entity": [["tile_f", "sp", [-1, 1, 1, 1]], ["tile_y", "sp", [-1, 1, 1, 1]], ["tile_x", "sp", [-1, 1, 1, 1]], ["auto_unroll_max_step", "ot", 0], ["unroll_explicit", "ot", 0]]}, "result": [[1.053838775], 0, 11.360170125961304, 1638807445.7302384], "version": 0.2, "tvm_version": "0.8.dev0"}
