artifacts/kernel_db/ansor_kernels/batch_matmul_4d_4d_expr_64_12_64_1_64_ansor/tune.log
{"i": [["[\"get_expr\", \"batch_matmul_4d_4d_expr\", [64, 12, 64, 1, 64]]", "cuda -keys=cuda,gpu -max_num_threads=1024 -thread_warp_size=32", [-1, 16, 64, 49152, 2147483647, 1024, 8, 32], "", 0, []], [[], [["CHW", 2, "local"], ["SP", 2, 0, 64, [1, 2, 1, 1], 1], ["SP", 2, 5, 12, [3, 2, 1, 2], 1], ["SP", 2, 10, 64, [2, 32, 1, 1], 1], ["SP", 2, 15, 1, [1, 1, 1, 1], 1], ["SP", 2, 20, 64, [4, 1], 1], ["RE", 2, [0, 5, 10, 15, 1, 6, 11, 16, 2, 7, 12, 17, 20, 21, 3, 8, 13, 18, 22, 4, 9, 14, 19]], ["FSP", 3, 0, 1, 3], ["FSP", 3, 4, 2, 3], ["FSP", 3, 8, 3, 3], ["FSP", 3, 12, 4, 3], ["RE", 3, [0, 4, 8, 12, 1, 5, 9, 13, 2, 6, 10, 14, 3, 7, 11, 15]], ["CA", 2, 3, 11], ["CHR", 1, "shared", [2]], ["CA", 2, 3, 12], ["CHR", 0, "shared", [3]], ["CA", 1, 4, 12], ["FU", 5, [0, 1, 2, 3]], ["AN", 5, 0, 5], ["FU", 5, [1, 2, 3, 4]], ["AN", 5, 1, 4], ["FU", 5, [2, 3, 4, 5]], ["AN", 5, 2, 6], ["FU", 3, [0, 1, 2, 3]], ["SP", 3, 0, 8, [1], 1], ["AN", 3, 1, 2], ["FFSP", 3, 0, [4, 3, 2, 1], 1, 1], ["AN", 3, 1, 6], ["FU", 1, [0, 1, 2, 3]], ["SP", 1, 0, 8, [1], 1], ["AN", 1, 1, 2], ["FFSP", 1, 0, [4, 3, 2, 1], 1, 1], ["AN", 1, 1, 6], ["PR", 4, 0, "auto_unroll_max_step$0"]]]], "r": [[5.6989e-05], 0, 2.20242, 1669209139], "v": "v0.6"}
{"i": [["[\"get_expr\", \"batch_matmul_4d_4d_expr\", [64, 12, 64, 1, 64]]", "cuda -keys=cuda,gpu -max_num_threads=1024 -thread_warp_size=32", [-1, 16, 64, 49152, 2147483647, 1024, 8, 32], "", 0, []], [[], [["CHW", 2, "local"], ["SP", 2, 0, 64, [1, 1, 1, 2], 1], ["SP", 2, 5, 12, [2, 2, 3, 1], 1], ["SP", 2, 10, 64, [1, 16, 1, 1], 1], ["SP", 2, 15, 1, [1, 1, 1, 1], 1], ["SP", 2, 20, 64, [1, 1], 1], ["RE", 2, [0, 5, 10, 15, 1, 6, 11, 16, 2, 7, 12, 17, 20, 21, 3, 8, 13, 18, 22, 4, 9, 14, 19]], ["FSP", 3, 0, 1, 3], ["FSP", 3, 4, 2, 3], ["FSP", 3, 8, 3, 3], ["FSP", 3, 12, 4, 3], ["RE", 3, [0, 4, 8, 12, 1, 5, 9, 13, 2, 6, 10, 14, 3, 7, 11, 15]], ["CA", 2, 3, 11], ["CHR", 1, "shared", [2]], ["CA", 2, 3, 12], ["CHR", 0, "shared", [3]], ["CA", 1, 4, 12], ["FU", 5, [0, 1, 2, 3]], ["AN", 5, 0, 5], ["FU", 5, [1, 2, 3, 4]], ["AN", 5, 1, 4], ["FU", 5, [2, 3, 4, 5]], ["AN", 5, 2, 6], ["FU", 3, [0, 1, 2, 3]], ["SP", 3, 0, 12, [1], 1], ["AN", 3, 1, 2], ["FFSP", 3, 0, [4, 3, 2, 1], 1, 1], ["AN", 3, 1, 6], ["FU", 1, [0, 1, 2, 3]], ["SP", 1, 0, 12, [1], 1], ["AN", 1, 1, 2], ["FFSP", 1, 0, [4, 3, 2, 1], 1, 1], ["AN", 1, 1, 6], ["PR", 4, 0, "auto_unroll_max_step$0"]]]], "r": [[8.18774e-05], 0, 2.14432, 1669209140], "v": "v0.6"}
{"i": [["[\"get_expr\", \"batch_matmul_4d_4d_expr\", [64, 12, 64, 1, 64]]", "cuda -keys=cuda,gpu -max_num_threads=1024 -thread_warp_size=32", [-1, 16, 64, 49152, 2147483647, 1024, 8, 32], "", 0, []], [[], [["CHW", 2, "local"], ["SP", 2, 0, 64, [2, 2, 1, 2], 1], ["SP", 2, 5, 12, [2, 2, 1, 3], 1], ["SP", 2, 10, 64, [2, 4, 4, 1], 1], ["SP", 2, 15, 1, [1, 1, 1, 1], 1], ["SP", 2, 20, 64, [1, 2], 1], ["RE", 2, [0, 5, 10, 15, 1, 6, 11, 16, 2, 7, 12, 17, 20, 21, 3, 8, 13, 18, 22, 4, 9, 14, 19]], ["FSP", 3, 0, 1, 3], ["FSP", 3, 4, 2, 3], ["FSP", 3, 8, 3, 3], ["FSP", 3, 12, 4, 3], ["RE", 3, [0, 4, 8, 12, 1, 5, 9, 13, 2, 6, 10, 14, 3, 7, 11, 15]], ["CA", 2, 3, 11], ["CHR", 1, "shared", [2]], ["CA", 2, 3, 12], ["CHR", 0, "shared", [3]], ["CA", 1, 4, 12], ["FU", 5, [0, 1, 2, 3]], ["AN", 5, 0, 5], ["FU", 5, [1, 2, 3, 4]], ["AN", 5, 1, 4], ["FU", 5, [2, 3, 4, 5]], ["AN", 5, 2, 6], ["FU", 3, [0, 1, 2, 3]], ["SP", 3, 0, 12, [1], 1], ["AN", 3, 1, 2], ["FFSP", 3, 0, [4, 3, 2, 1], 1, 1], ["AN", 3, 1, 6], ["FU", 1, [0, 1, 2, 3]], ["SP", 1, 0, 12, [1], 1], ["AN", 1, 1, 2], ["FFSP", 1, 0, [4, 3, 2, 1], 1, 1], ["AN", 1, 1, 6], ["PR", 4, 0, "auto_unroll_max_step$0"]]]], "r": [[0.000853693], 0, 2.38067, 1669209141], "v": "v0.6"}
{"i": [["[\"get_expr\", \"batch_matmul_4d_4d_expr\", [64, 12, 64, 1, 64]]", "cuda -keys=cuda,gpu -max_num_threads=1024 -thread_warp_size=32", [-1, 16, 64, 49152, 2147483647, 1024, 8, 32], "", 0, []], [[], [["CHW", 2, "local"], ["SP", 2, 0, 64, [1, 8, 1, 1], 1], ["SP", 2, 5, 12, [1, 1, 3, 1], 1], ["SP", 2, 10, 64, [2, 4, 1, 8], 1], ["SP", 2, 15, 1, [1, 1, 1, 1], 1], ["SP", 2, 20, 64, [2, 1], 1], ["RE", 2, [0, 5, 10, 15, 1, 6, 11, 16, 2, 7, 12, 17, 20, 21, 3, 8, 13, 18, 22, 4, 9, 14, 19]], ["FSP", 3, 0, 1, 3], ["FSP", 3, 4, 2, 3], ["FSP", 3, 8, 3, 3], ["FSP", 3, 12, 4, 3], ["RE", 3, [0, 4, 8, 12, 1, 5, 9, 13, 2, 6, 10, 14, 3, 7, 11, 15]], ["CA", 2, 3, 11], ["CHR", 1, "shared", [2]], ["CA", 2, 3, 12], ["CHR", 0, "shared", [3]], ["CA", 1, 4, 12], ["FU", 5, [0, 1, 2, 3]], ["AN", 5, 0, 5], ["FU", 5, [1, 2, 3, 4]], ["AN", 5, 1, 4], ["FU", 5, [2, 3, 4, 5]], ["AN", 5, 2, 6], ["FU", 3, [0, 1, 2, 3]], ["SP", 3, 0, 6, [1], 1], ["AN", 3, 1, 2], ["FFSP", 3, 0, [4, 3, 2, 1], 1, 1], ["AN", 3, 1, 6], ["FU", 1, [0, 1, 2, 3]], ["SP", 1, 0, 48, [1], 1], ["AN", 1, 1, 2], ["FFSP", 1, 0, [4, 3, 2, 1], 1, 1], ["AN", 1, 1, 6], ["PR", 4, 0, "auto_unroll_max_step$64"]]]], "r": [[0.000240523], 0, 2.12801, 1669209143], "v": "v0.6"}
{"i": [["[\"get_expr\", \"batch_matmul_4d_4d_expr\", [64, 12, 64, 1, 64]]", "cuda -keys=cuda,gpu -max_num_threads=1024 -thread_warp_size=32", [-1, 16, 64, 49152, 2147483647, 1024, 8, 32], "", 0, []], [[], [["CHW", 2, "local"], ["SP", 2, 0, 64, [1, 64, 1, 1], 1], ["SP", 2, 5, 12, [1, 2, 2, 1], 1], ["SP", 2, 10, 64, [2, 1, 16, 1], 1], ["SP", 2, 15, 1, [1, 1, 1, 1], 1], ["SP", 2, 20, 64, [1, 1], 1], ["RE", 2, [0, 5, 10, 15, 1, 6, 11, 16, 2, 7, 12, 17, 20, 21, 3, 8, 13, 18, 22, 4, 9, 14, 19]], ["FSP", 3, 0, 1, 3], ["FSP", 3, 4, 2, 3], ["FSP", 3, 8, 3, 3], ["FSP", 3, 12, 4, 3], ["RE", 3, [0, 4, 8, 12, 1, 5, 9, 13, 2, 6, 10, 14, 3, 7, 11, 15]], ["CA", 2, 3, 11], ["CHR", 1, "shared", [2]], ["CA", 2, 3, 12], ["CHR", 0, "shared", [3]], ["CA", 1, 4, 12], ["FU", 5, [0, 1, 2, 3]], ["AN", 5, 0, 5], ["FU", 5, [1, 2, 3, 4]], ["AN", 5, 1, 4], ["FU", 5, [2, 3, 4, 5]], ["AN", 5, 2, 6], ["FU", 3, [0, 1, 2, 3]], ["SP", 3, 0, 4, [4], 1], ["AN", 3, 1, 2], ["FFSP", 3, 0, [4, 3, 2, 1], 1, 1], ["AN", 3, 1, 6], ["FU", 1, [0, 1, 2, 3]], ["SP", 1, 0, 64, [1], 1], ["AN", 1, 1, 2], ["FFSP", 1, 0, [4, 3, 2, 1], 1, 1], ["AN", 1, 1, 6], ["PR", 4, 0, "auto_unroll_max_step$512"]]]], "r": [[0.000896687], 0, 1.84502, 1669209144], "v": "v0.6"}
{"i": [["[\"get_expr\", \"batch_matmul_4d_4d_expr\", [64, 12, 64, 1, 64]]", "cuda -keys=cuda,gpu -max_num_threads=1024 -thread_warp_size=32", [-1, 16, 64, 49152, 2147483647, 1024, 8, 32], "", 0, []], [[], [["CHW", 2, "local"], ["SP", 2, 0, 64, [1, 32, 2, 1], 1], ["SP", 2, 5, 12, [1, 2, 1, 1], 1], ["SP", 2, 10, 64, [4, 1, 16, 1], 1], ["SP", 2, 15, 1, [1, 1, 1, 1], 1], ["SP", 2, 20, 64, [1, 1], 1], ["RE", 2, [0, 5, 10, 15, 1, 6, 11, 16, 2, 7, 12, 17, 20, 21, 3, 8, 13, 18, 22, 4, 9, 14, 19]], ["FSP", 3, 0, 1, 3], ["FSP", 3, 4, 2, 3], ["FSP", 3, 8, 3, 3], ["FSP", 3, 12, 4, 3], ["RE", 3, [0, 4, 8, 12, 1, 5, 9, 13, 2, 6, 10, 14, 3, 7, 11, 15]], ["CA", 2, 3, 11], ["CHR", 1, "shared", [2]], ["CA", 2, 3, 12], ["CHR", 0, "shared", [3]], ["CA", 1, 4, 12], ["FU", 5, [0, 1, 2, 3]], ["AN", 5, 0, 5], ["FU", 5, [1, 2, 3, 4]], ["AN", 5, 1, 4], ["FU", 5, [2, 3, 4, 5]], ["AN", 5, 2, 6], ["FU", 3, [0, 1, 2, 3]], ["SP", 3, 0, 4, [1], 1], ["AN", 3, 1, 2], ["FFSP", 3, 0, [4, 3, 2, 1], 1, 1], ["AN", 3, 1, 6], ["FU", 1, [0, 1, 2, 3]], ["SP", 1, 0, 64, [1], 1], ["AN", 1, 1, 2], ["FFSP", 1, 0, [4, 3, 2, 1], 1, 1], ["AN", 1, 1, 6], ["PR", 4, 0, "auto_unroll_max_step$512"]]]], "r": [[0.000906754], 0, 2.72595, 1669209145], "v": "v0.6"}
{"i": [["[\"get_expr\", \"batch_matmul_4d_4d_expr\", [64, 12, 64, 1, 64]]", "cuda -keys=cuda,gpu -max_num_threads=1024 -thread_warp_size=32", [-1, 16, 64, 49152, 2147483647, 1024, 8, 32], "", 0, []], [[], [["CHW", 2, "local"], ["SP", 2, 0, 64, [4, 2, 2, 1], 1], ["SP", 2, 5, 12, [1, 1, 2, 1], 1], ["SP", 2, 10, 64, [1, 32, 1, 2], 1], ["SP", 2, 15, 1, [1, 1, 1, 1], 1], ["SP", 2, 20, 64, [4, 1], 1], ["RE", 2, [0, 5, 10, 15, 1, 6, 11, 16, 2, 7, 12, 17, 20, 21, 3, 8, 13, 18, 22, 4, 9, 14, 19]], ["FSP", 3, 0, 1, 3], ["FSP", 3, 4, 2, 3], ["FSP", 3, 8, 3, 3], ["FSP", 3, 12, 4, 3], ["RE", 3, [0, 4, 8, 12, 1, 5, 9, 13, 2, 6, 10, 14, 3, 7, 11, 15]], ["CA", 2, 3, 11], ["CHR", 1, "shared", [2]], ["CA", 2, 3, 12], ["CHR", 0, "shared", [3]], ["CA", 1, 4, 12], ["FU", 5, [0, 1, 2, 3]], ["AN", 5, 0, 5], ["FU", 5, [1, 2, 3, 4]], ["AN", 5, 1, 4], ["FU", 5, [2, 3, 4, 5]], ["AN", 5, 2, 6], ["FU", 3, [0, 1, 2, 3]], ["SP", 3, 0, 16, [1], 1], ["AN", 3, 1, 2], ["FFSP", 3, 0, [4, 3, 2, 1], 1, 1], ["AN", 3, 1, 6], ["FU", 1, [0, 1, 2, 3]], ["SP", 1, 0, 64, [1], 1], ["AN", 1, 1, 2], ["FFSP", 1, 0, [4, 3, 2, 1], 1, 1], ["AN", 1, 1, 6], ["PR", 4, 0, "auto_unroll_max_step$16"]]]], "r": [[0.000151418], 0, 2.10184, 1669209147], "v": "v0.6"}
{"i": [["[\"get_expr\", \"batch_matmul_4d_4d_expr\", [64, 12, 64, 1, 64]]", "cuda -keys=cuda,gpu -max_num_threads=1024 -thread_warp_size=32", [-1, 16, 64, 49152, 2147483647, 1024, 8, 32], "", 0, []], [[], [["CHW", 2, "local"], ["SP", 2, 0, 64, [1, 1, 1, 4], 1], ["SP", 2, 5, 12, [1, 1, 4, 1], 1], ["SP", 2, 10, 64, [1, 32, 1, 1], 1], ["SP", 2, 15, 1, [1, 1, 1, 1], 1], ["SP", 2, 20, 64, [8, 1], 1], ["RE", 2, [0, 5, 10, 15, 1, 6, 11, 16, 2, 7, 12, 17, 20, 21, 3, 8, 13, 18, 22, 4, 9, 14, 19]], ["FSP", 3, 0, 1, 3], ["FSP", 3, 4, 2, 3], ["FSP", 3, 8, 3, 3], ["FSP", 3, 12, 4, 3], ["RE", 3, [0, 4, 8, 12, 1, 5, 9, 13, 2, 6, 10, 14, 3, 7, 11, 15]], ["CA", 2, 3, 11], ["CHR", 1, "shared", [2]], ["CA", 2, 3, 12], ["CHR", 0, "shared", [3]], ["CA", 1, 4, 12], ["FU", 5, [0, 1, 2, 3]], ["AN", 5, 0, 5], ["FU", 5, [1, 2, 3, 4]], ["AN", 5, 1, 4], ["FU", 5, [2, 3, 4, 5]], ["AN", 5, 2, 6], ["FU", 3, [0, 1, 2, 3]], ["SP", 3, 0, 128, [1], 1], ["AN", 3, 1, 2], ["FFSP", 3, 0, [4, 3, 2, 1], 1, 1], ["AN", 3, 1, 6], ["FU", 1, [0, 1, 2, 3]], ["SP", 1, 0, 128, [1], 1], ["AN", 1, 1, 2], ["FFSP", 1, 0, [4, 3, 2, 1], 1, 1], ["AN", 1, 1, 6], ["PR", 4, 0, "auto_unroll_max_step$0"]]]], "r": [[7.23369e-05], 0, 2.24923, 1669209148], "v": "v0.6"}
{"i": [["[\"get_expr\", \"batch_matmul_4d_4d_expr\", [64, 12, 64, 1, 64]]", "cuda -keys=cuda,gpu -max_num_threads=1024 -thread_warp_size=32", [-1, 16, 64, 49152, 2147483647, 1024, 8, 32], "", 0, []], [[], [["CHW", 2, "local"], ["SP", 2, 0, 64, [1, 16, 2, 2], 1], ["SP", 2, 5, 12, [2, 1, 1, 1], 1], ["SP", 2, 10, 64, [1, 1, 4, 1], 1], ["SP", 2, 15, 1, [1, 1, 1, 1], 1], ["SP", 2, 20, 64, [2, 2], 1], ["RE", 2, [0, 5, 10, 15, 1, 6, 11, 16, 2, 7, 12, 17, 20, 21, 3, 8, 13, 18, 22, 4, 9, 14, 19]], ["FSP", 3, 0, 1, 3], ["FSP", 3, 4, 2, 3], ["FSP", 3, 8, 3, 3], ["FSP", 3, 12, 4, 3], ["RE", 3, [0, 4, 8, 12, 1, 5, 9, 13, 2, 6, 10, 14, 3, 7, 11, 15]], ["CA", 2, 3, 11], ["CHR", 1, "shared", [2]], ["CA", 2, 3, 12], ["CHR", 0, "shared", [3]], ["CA", 1, 4, 12], ["FU", 5, [0, 1, 2, 3]], ["AN", 5, 0, 5], ["FU", 5, [1, 2, 3, 4]], ["AN", 5, 1, 4], ["FU", 5, [2, 3, 4, 5]], ["AN", 5, 2, 6], ["FU", 3, [0, 1, 2, 3]], ["SP", 3, 0, 8, [1], 1], ["AN", 3, 1, 2], ["FFSP", 3, 0, [4, 3, 2, 1], 1, 1], ["AN", 3, 1, 6], ["FU", 1, [0, 1, 2, 3]], ["SP", 1, 0, 128, [1], 1], ["AN", 1, 1, 2], ["FFSP", 1, 0, [4, 3, 2, 1], 1, 1], ["AN", 1, 1, 6], ["PR", 4, 0, "auto_unroll_max_step$0"]]]], "r": [[9.32975e-05], 0, 2.26142, 1669209150], "v": "v0.6"}
{"i": [["[\"get_expr\", \"batch_matmul_4d_4d_expr\", [64, 12, 64, 1, 64]]", "cuda -keys=cuda,gpu -max_num_threads=1024 -thread_warp_size=32", [-1, 16, 64, 49152, 2147483647, 1024, 8, 32], "", 0, []], [[], [["CHW", 2, "local"], ["SP", 2, 0, 64, [2, 1, 1, 4], 1], ["SP", 2, 5, 12, [1, 1, 4, 1], 1], ["SP", 2, 10, 64, [1, 8, 4, 1], 1], ["SP", 2, 15, 1, [1, 1, 1, 1], 1], ["SP", 2, 20, 64, [8, 1], 1], ["RE", 2, [0, 5, 10, 15, 1, 6, 11, 16, 2, 7, 12, 17, 20, 21, 3, 8, 13, 18, 22, 4, 9, 14, 19]], ["FSP", 3, 0, 1, 3], ["FSP", 3, 4, 2, 3], ["FSP", 3, 8, 3, 3], ["FSP", 3, 12, 4, 3], ["RE", 3, [0, 4, 8, 12, 1, 5, 9, 13, 2, 6, 10, 14, 3, 7, 11, 15]], ["CA", 2, 3, 11], ["CHR", 1, "shared", [2]], ["CA", 2, 3, 12], ["CHR", 0, "shared", [3]], ["CA", 1, 4, 12], ["FU", 5, [0, 1, 2, 3]], ["AN", 5, 0, 5], ["FU", 5, [1, 2, 3, 4]], ["AN", 5, 1, 4], ["FU", 5, [2, 3, 4, 5]], ["AN", 5, 2, 6], ["FU", 3, [0, 1, 2, 3]], ["SP", 3, 0, 128, [1], 1], ["AN", 3, 1, 2], ["FFSP", 3, 0, [4, 3, 2, 1], 1, 1], ["AN", 3, 1, 6], ["FU", 1, [0, 1, 2, 3]], ["SP", 1, 0, 128, [1], 1], ["AN", 1, 1, 2], ["FFSP", 1, 0, [4, 3, 2, 1], 1, 1], ["AN", 1, 1, 6], ["PR", 4, 0, "auto_unroll_max_step$0"]]]], "r": [[0.000511679], 0, 2.40964, 1669209151], "v": "v0.6"}
{"i": [["[\"get_expr\", \"batch_matmul_4d_4d_expr\", [64, 12, 64, 1, 64]]", "cuda -keys=cuda,gpu -max_num_threads=1024 -thread_warp_size=32", [-1, 16, 64, 49152, 2147483647, 1024, 8, 32], "", 0, []], [[], [["CHW", 2, "local"], ["SP", 2, 0, 64, [2, 16, 1, 1], 1], ["SP", 2, 5, 12, [2, 1, 1, 3], 1], ["SP", 2, 10, 64, [2, 2, 2, 4], 1], ["SP", 2, 15, 1, [1, 1, 1, 1], 1], ["SP", 2, 20, 64, [1, 1], 1], ["RE", 2, [0, 5, 10, 15, 1, 6, 11, 16, 2, 7, 12, 17, 20, 21, 3, 8, 13, 18, 22, 4, 9, 14, 19]], ["FSP", 3, 0, 1, 3], ["FSP", 3, 4, 2, 3], ["FSP", 3, 8, 3, 3], ["FSP", 3, 12, 4, 3], ["RE", 3, [0, 4, 8, 12, 1, 5, 9, 13, 2, 6, 10, 14, 3, 7, 11, 15]], ["CA", 2, 3, 11], ["CHR", 1, "shared", [2]], ["CA", 2, 3, 12], ["CHR", 0, "shared", [3]], ["CA", 1, 4, 12], ["FU", 5, [0, 1, 2, 3]], ["AN", 5, 0, 5], ["FU", 5, [1, 2, 3, 4]], ["AN", 5, 1, 4], ["FU", 5, [2, 3, 4, 5]], ["AN", 5, 2, 6], ["FU", 3, [0, 1, 2, 3]], ["SP", 3, 0, 3, [3], 1], ["AN", 3, 1, 2], ["FFSP", 3, 0, [4, 3, 2, 1], 1, 1], ["AN", 3, 1, 6], ["FU", 1, [0, 1, 2, 3]], ["SP", 1, 0, 24, [1], 1], ["AN", 1, 1, 2], ["FFSP", 1, 0, [4, 3, 2, 1], 1, 1], ["AN", 1, 1, 6], ["PR", 4, 0, "auto_unroll_max_step$16"]]]], "r": [[0.000713652], 0, 2.58954, 1669209153], "v": "v0.6"}
{"i": [["[\"get_expr\", \"batch_matmul_4d_4d_expr\", [64, 12, 64, 1, 64]]", "cuda -keys=cuda,gpu -max_num_threads=1024 -thread_warp_size=32", [-1, 16, 64, 49152, 2147483647, 1024, 8, 32], "", 0, []], [[], [["CHW", 2, "local"], ["SP", 2, 0, 64, [1, 2, 1, 2], 1], ["SP", 2, 5, 12, [1, 4, 1, 1], 1], ["SP", 2, 10, 64, [1, 32, 1, 2], 1], ["SP", 2, 15, 1, [1, 1, 1, 1], 1], ["SP", 2, 20, 64, [4, 1], 1], ["RE", 2, [0, 5, 10, 15, 1, 6, 11, 16, 2, 7, 12, 17, 20, 21, 3, 8, 13, 18, 22, 4, 9, 14, 19]], ["FSP", 3, 0, 1, 3], ["FSP", 3, 4, 2, 3], ["FSP", 3, 8, 3, 3], ["FSP", 3, 12, 4, 3], ["RE", 3, [0, 4, 8, 12, 1, 5, 9, 13, 2, 6, 10, 14, 3, 7, 11, 15]], ["CA", 2, 3, 11], ["CHR", 1, "shared", [2]], ["CA", 2, 3, 12], ["CHR", 0, "shared", [3]], ["CA", 1, 4, 12], ["FU", 5, [0, 1, 2, 3]], ["AN", 5, 0, 5], ["FU", 5, [1, 2, 3, 4]], ["AN", 5, 1, 4], ["FU", 5, [2, 3, 4, 5]], ["AN", 5, 2, 6], ["FU", 3, [0, 1, 2, 3]], ["SP", 3, 0, 16, [1], 1], ["AN", 3, 1, 2], ["FFSP", 3, 0, [4, 3, 2, 1], 1, 1], ["AN", 3, 1, 6], ["FU", 1, [0, 1, 2, 3]], ["SP", 1, 0, 32, [1], 1], ["AN", 1, 1, 2], ["FFSP", 1, 0, [4, 3, 2, 1], 1, 1], ["AN", 1, 1, 6], ["PR", 4, 0, "auto_unroll_max_step$1024"]]]], "r": [[4.12727e-05], 0, 2.88342, 1669209154], "v": "v0.6"}
{"i": [["[\"get_expr\", \"batch_matmul_4d_4d_expr\", [64, 12, 64, 1, 64]]", "cuda -keys=cuda,gpu -max_num_threads=1024 -thread_warp_size=32", [-1, 16, 64, 49152, 2147483647, 1024, 8, 32], "", 0, []], [[], [["CHW", 2, "local"], ["SP", 2, 0, 64, [2, 1, 1, 16], 1], ["SP", 2, 5, 12, [1, 3, 1, 1], 1], ["SP", 2, 10, 64, [2, 16, 1, 1], 1], ["SP", 2, 15, 1, [1, 1, 1, 1], 1], ["SP", 2, 20, 64, [1, 1], 1], ["RE", 2, [0, 5, 10, 15, 1, 6, 11, 16, 2, 7, 12, 17, 20, 21, 3, 8, 13, 18, 22, 4, 9, 14, 19]], ["FSP", 3, 0, 1, 3], ["FSP", 3, 4, 2, 3], ["FSP", 3, 8, 3, 3], ["FSP", 3, 12, 4, 3], ["RE", 3, [0, 4, 8, 12, 1, 5, 9, 13, 2, 6, 10, 14, 3, 7, 11, 15]], ["CA", 2, 3, 11], ["CHR", 1, "shared", [2]], ["CA", 2, 3, 12], ["CHR", 0, "shared", [3]], ["CA", 1, 4, 12], ["FU", 5, [0, 1, 2, 3]], ["AN", 5, 0, 5], ["FU", 5, [1, 2, 3, 4]], ["AN", 5, 1, 4], ["FU", 5, [2, 3, 4, 5]], ["AN", 5, 2, 6], ["FU", 3, [0, 1, 2, 3]], ["SP", 3, 0, 16, [1], 1], ["AN", 3, 1, 2], ["FFSP", 3, 0, [4, 3, 2, 1], 1, 1], ["AN", 3, 1, 6], ["FU", 1, [0, 1, 2, 3]], ["SP", 1, 0, 16, [4], 1], ["AN", 1, 1, 2], ["FFSP", 1, 0, [4, 3, 2, 1], 1, 1], ["AN", 1, 1, 6], ["PR", 4, 0, "auto_unroll_max_step$512"]]]], "r": [[0.000369178], 0, 1.93667, 1669209155], "v": "v0.6"}
{"i": [["[\"get_expr\", \"batch_matmul_4d_4d_expr\", [64, 12, 64, 1, 64]]", "cuda -keys=cuda,gpu -max_num_threads=1024 -thread_warp_size=32", [-1, 16, 64, 49152, 2147483647, 1024, 8, 32], "", 0, []], [[], [["CHW", 2, "local"], ["SP", 2, 0, 64, [1, 8, 1, 1], 1], ["SP", 2, 5, 12, [1, 3, 1, 2], 1], ["SP", 2, 10, 64, [8, 4, 1, 1], 1], ["SP", 2, 15, 1, [1, 1, 1, 1], 1], ["SP", 2, 20, 64, [2, 1], 1], ["RE", 2, [0, 5, 10, 15, 1, 6, 11, 16, 2, 7, 12, 17, 20, 21, 3, 8, 13, 18, 22, 4, 9, 14, 19]], ["FSP", 3, 0, 1, 3], ["FSP", 3, 4, 2, 3], ["FSP", 3, 8, 3, 3], ["FSP", 3, 12, 4, 3], ["RE", 3, [0, 4, 8, 12, 1, 5, 9, 13, 2, 6, 10, 14, 3, 7, 11, 15]], ["CA", 2, 3, 11], ["CHR", 1, "shared", [2]], ["CA", 2, 3, 12], ["CHR", 0, "shared", [3]], ["CA", 1, 4, 12], ["FU", 5, [0, 1, 2, 3]], ["AN", 5, 0, 5], ["FU", 5, [1, 2, 3, 4]], ["AN", 5, 1, 4], ["FU", 5, [2, 3, 4, 5]], ["AN", 5, 2, 6], ["FU", 3, [0, 1, 2, 3]], ["SP", 3, 0, 4, [1], 1], ["AN", 3, 1, 2], ["FFSP", 3, 0, [4, 3, 2, 1], 1, 1], ["AN", 3, 1, 6], ["FU", 1, [0, 1, 2, 3]], ["SP", 1, 0, 4, [4], 1], ["AN", 1, 1, 2], ["FFSP", 1, 0, [4, 3, 2, 1], 1, 1], ["AN", 1, 1, 6], ["PR", 4, 0, "auto_unroll_max_step$512"]]]], "r": [[0.000135008], 0, 2.59441, 1669209157], "v": "v0.6"}
{"i": [["[\"get_expr\", \"batch_matmul_4d_4d_expr\", [64, 12, 64, 1, 64]]", "cuda -keys=cuda,gpu -max_num_threads=1024 -thread_warp_size=32", [-1, 16, 64, 49152, 2147483647, 1024, 8, 32], "", 0, []], [[], [["CHW", 2, "local"], ["SP", 2, 0, 64, [1, 2, 1, 2], 1], ["SP", 2, 5, 12, [1, 3, 4, 1], 1], ["SP", 2, 10, 64, [1, 4, 8, 1], 1], ["SP", 2, 15, 1, [1, 1, 1, 1], 1], ["SP", 2, 20, 64, [2, 1], 1], ["RE", 2, [0, 5, 10, 15, 1, 6, 11, 16, 2, 7, 12, 17, 20, 21, 3, 8, 13, 18, 22, 4, 9, 14, 19]], ["FSP", 3, 0, 1, 3], ["FSP", 3, 4, 2, 3], ["FSP", 3, 8, 3, 3], ["FSP", 3, 12, 4, 3], ["RE", 3, [0, 4, 8, 12, 1, 5, 9, 13, 2, 6, 10, 14, 3, 7, 11, 15]], ["CA", 2, 3, 11], ["CHR", 1, "shared", [2]], ["CA", 2, 3, 12], ["CHR", 0, "shared", [3]], ["CA", 1, 4, 12], ["FU", 5, [0, 1, 2, 3]], ["AN", 5, 0, 5], ["FU", 5, [1, 2, 3, 4]], ["AN", 5, 1, 4], ["FU", 5, [2, 3, 4, 5]], ["AN", 5, 2, 6], ["FU", 3, [0, 1, 2, 3]], ["SP", 3, 0, 2, [1], 1], ["AN", 3, 1, 2], ["FFSP", 3, 0, [4, 3, 2, 1], 1, 1], ["AN", 3, 1, 6], ["FU", 1, [0, 1, 2, 3]], ["SP", 1, 0, 16, [2], 1], ["AN", 1, 1, 2], ["FFSP", 1, 0, [4, 3, 2, 1], 1, 1], ["AN", 1, 1, 6], ["PR", 4, 0, "auto_unroll_max_step$1024"]]]], "r": [[0.000137291], 0, 2.64793, 1669209158], "v": "v0.6"}
{"i": [["[\"get_expr\", \"batch_matmul_4d_4d_expr\", [64, 12, 64, 1, 64]]", "cuda -keys=cuda,gpu -max_num_threads=1024 -thread_warp_size=32", [-1, 16, 64, 49152, 2147483647, 1024, 8, 32], "", 0, []], [[], [["CHW", 2, "local"], ["SP", 2, 0, 64, [2, 2, 1, 2], 1], ["SP", 2, 5, 12, [1, 2, 1, 6], 1], ["SP", 2, 10, 64, [2, 4, 4, 1], 1], ["SP", 2, 15, 1, [1, 1, 1, 1], 1], ["SP", 2, 20, 64, [1, 2], 1], ["RE", 2, [0, 5, 10, 15, 1, 6, 11, 16, 2, 7, 12, 17, 20, 21, 3, 8, 13, 18, 22, 4, 9, 14, 19]], ["FSP", 3, 0, 1, 3], ["FSP", 3, 4, 2, 3], ["FSP", 3, 8, 3, 3], ["FSP", 3, 12, 4, 3], ["RE", 3, [0, 4, 8, 12, 1, 5, 9, 13, 2, 6, 10, 14, 3, 7, 11, 15]], ["CA", 2, 3, 11], ["CHR", 1, "shared", [2]], ["CA", 2, 3, 12], ["CHR", 0, "shared", [3]], ["CA", 1, 4, 12], ["FU", 5, [0, 1, 2, 3]], ["AN", 5, 0, 5], ["FU", 5, [1, 2, 3, 4]], ["AN", 5, 1, 4], ["FU", 5, [2, 3, 4, 5]], ["AN", 5, 2, 6], ["FU", 3, [0, 1, 2, 3]], ["SP", 3, 0, 12, [2], 1], ["AN", 3, 1, 2], ["FFSP", 3, 0, [4, 3, 2, 1], 1, 1], ["AN", 3, 1, 6], ["FU", 1, [0, 1, 2, 3]], ["SP", 1, 0, 12, [1], 1], ["AN", 1, 1, 2], ["FFSP", 1, 0, [4, 3, 2, 1], 1, 1], ["AN", 1, 1, 6], ["PR", 4, 0, "auto_unroll_max_step$0"]]]], "r": [[0.000851203], 0, 2.13574, 1669209159], "v": "v0.6"}
{"i": [["[\"get_expr\", \"batch_matmul_4d_4d_expr\", [64, 12, 64, 1, 64]]", "cuda -keys=cuda,gpu -max_num_threads=1024 -thread_warp_size=32", [-1, 16, 64, 49152, 2147483647, 1024, 8, 32], "", 0, []], [[], [["CHW", 2, "local"], ["SP", 2, 0, 64, [2, 8, 1, 4], 1], ["SP", 2, 5, 12, [1, 1, 3, 1], 1], ["SP", 2, 10, 64, [1, 8, 1, 1], 1], ["SP", 2, 15, 1, [1, 1, 1, 1], 1], ["SP", 2, 20, 64, [1, 1], 1], ["RE", 2, [0, 5, 10, 15, 1, 6, 11, 16, 2, 7, 12, 17, 20, 21, 3, 8, 13, 18, 22, 4, 9, 14, 19]], ["FSP", 3, 0, 1, 3], ["FSP", 3, 4, 2, 3], ["FSP", 3, 8, 3, 3], ["FSP", 3, 12, 4, 3], ["RE", 3, [0, 4, 8, 12, 1, 5, 9, 13, 2, 6, 10, 14, 3, 7, 11, 15]], ["CA", 2, 3, 11], ["CHR", 1, "shared", [2]], ["CA", 2, 3, 12], ["CHR", 0, "shared", [3]], ["CA", 1, 4, 12], ["FU", 5, [0, 1, 2, 3]], ["AN", 5, 0, 5], ["FU", 5, [1, 2, 3, 4]], ["AN", 5, 1, 4], ["FU", 5, [2, 3, 4, 5]], ["AN", 5, 2, 6], ["FU", 3, [0, 1, 2, 3]], ["SP", 3, 0, 24, [1], 1], ["AN", 3, 1, 2], ["FFSP", 3, 0, [4, 3, 2, 1], 1, 1], ["AN", 3, 1, 6], ["FU", 1, [0, 1, 2, 3]], ["SP", 1, 0, 24, [1], 1], ["AN", 1, 1, 2], ["FFSP", 1, 0, [4, 3, 2, 1], 1, 1], ["AN", 1, 1, 6], ["PR", 4, 0, "auto_unroll_max_step$1024"]]]], "r": [[0.000238928], 0, 2.09696, 1669209160], "v": "v0.6"}
{"i": [["[\"get_expr\", \"batch_matmul_4d_4d_expr\", [64, 12, 64, 1, 64]]", "cuda -keys=cuda,gpu -max_num_threads=1024 -thread_warp_size=32", [-1, 16, 64, 49152, 2147483647, 1024, 8, 32], "", 0, []], [[], [["CHW", 2, "local"], ["SP", 2, 0, 64, [1, 32, 2, 1], 1], ["SP", 2, 5, 12, [1, 1, 1, 1], 1], ["SP", 2, 10, 64, [1, 1, 16, 1], 1], ["SP", 2, 15, 1, [1, 1, 1, 1], 1], ["SP", 2, 20, 64, [1, 2], 1], ["RE", 2, [0, 5, 10, 15, 1, 6, 11, 16, 2, 7, 12, 17, 20, 21, 3, 8, 13, 18, 22, 4, 9, 14, 19]], ["FSP", 3, 0, 1, 3], ["FSP", 3, 4, 2, 3], ["FSP", 3, 8, 3, 3], ["FSP", 3, 12, 4, 3], ["RE", 3, [0, 4, 8, 12, 1, 5, 9, 13, 2, 6, 10, 14, 3, 7, 11, 15]], ["CA", 2, 3, 11], ["CHR", 1, "shared", [2]], ["CA", 2, 3, 12], ["CHR", 0, "shared", [3]], ["CA", 1, 4, 12], ["FU", 5, [0, 1, 2, 3]], ["AN", 5, 0, 5], ["FU", 5, [1, 2, 3, 4]], ["AN", 5, 1, 4], ["FU", 5, [2, 3, 4, 5]], ["AN", 5, 2, 6], ["FU", 3, [0, 1, 2, 3]], ["SP", 3, 0, 8, [1], 1], ["AN", 3, 1, 2], ["FFSP", 3, 0, [4, 3, 2, 1], 1, 1], ["AN", 3, 1, 6], ["FU", 1, [0, 1, 2, 3]], ["SP", 1, 0, 128, [1], 1], ["AN", 1, 1, 2], ["FFSP", 1, 0, [4, 3, 2, 1], 1, 1], ["AN", 1, 1, 6], ["PR", 4, 0, "auto_unroll_max_step$0"]]]], "r": [[0.000117108], 0, 2.35955, 1669209162], "v": "v0.6"}
{"i": [["[\"get_expr\", \"batch_matmul_4d_4d_expr\", [64, 12, 64, 1, 64]]", "cuda -keys=cuda,gpu -max_num_threads=1024 -thread_warp_size=32", [-1, 16, 64, 49152, 2147483647, 1024, 8, 32], "", 0, []], [[], [["CHW", 2, "local"], ["SP", 2, 0, 64, [1, 32, 1, 2], 1], ["SP", 2, 5, 12, [1, 1, 1, 1], 1], ["SP", 2, 10, 64, [1, 1, 16, 1], 1], ["SP", 2, 15, 1, [1, 1, 1, 1], 1], ["SP", 2, 20, 64, [2, 2], 1], ["RE", 2, [0, 5, 10, 15, 1, 6, 11, 16, 2, 7, 12, 17, 20, 21, 3, 8, 13, 18, 22, 4, 9, 14, 19]], ["FSP", 3, 0, 1, 3], ["FSP", 3, 4, 2, 3], ["FSP", 3, 8, 3, 3], ["FSP", 3, 12, 4, 3], ["RE", 3, [0, 4, 8, 12, 1, 5, 9, 13, 2, 6, 10, 14, 3, 7, 11, 15]], ["CA", 2, 3, 11], ["CHR", 1, "shared", [2]], ["CA", 2, 3, 12], ["CHR", 0, "shared", [3]], ["CA", 1, 4, 12], ["FU", 5, [0, 1, 2, 3]], ["AN", 5, 0, 5], ["FU", 5, [1, 2, 3, 4]], ["AN", 5, 1, 4], ["FU", 5, [2, 3, 4, 5]], ["AN", 5, 2, 6], ["FU", 3, [0, 1, 2, 3]], ["SP", 3, 0, 8, [1], 1], ["AN", 3, 1, 2], ["FFSP", 3, 0, [4, 3, 2, 1], 1, 1], ["AN", 3, 1, 6], ["FU", 1, [0, 1, 2, 3]], ["SP", 1, 0, 128, [1], 1], ["AN", 1, 1, 2], ["FFSP", 1, 0, [4, 3, 2, 1], 1, 1], ["AN", 1, 1, 6], ["PR", 4, 0, "auto_unroll_max_step$1024"]]]], "r": [[8.94579e-05], 0, 2.70015, 1669209164], "v": "v0.6"}
{"i": [["[\"get_expr\", \"batch_matmul_4d_4d_expr\", [64, 12, 64, 1, 64]]", "cuda -keys=cuda,gpu -max_num_threads=1024 -thread_warp_size=32", [-1, 16, 64, 49152, 2147483647, 1024, 8, 32], "", 0, []], [[], [["CHW", 2, "local"], ["SP", 2, 0, 64, [1, 8, 2, 1], 1], ["SP", 2, 5, 12, [1, 3, 1, 2], 1], ["SP", 2, 10, 64, [2, 8, 1, 1], 1], ["SP", 2, 15, 1, [1, 1, 1, 1], 1], ["SP", 2, 20, 64, [4, 1], 1], ["RE", 2, [0, 5, 10, 15, 1, 6, 11, 16, 2, 7, 12, 17, 20, 21, 3, 8, 13, 18, 22, 4, 9, 14, 19]], ["FSP", 3, 0, 1, 3], ["FSP", 3, 4, 2, 3], ["FSP", 3, 8, 3, 3], ["FSP", 3, 12, 4, 3], ["RE", 3, [0, 4, 8, 12, 1, 5, 9, 13, 2, 6, 10, 14, 3, 7, 11, 15]], ["CA", 2, 3, 11], ["CHR", 1, "shared", [2]], ["CA", 2, 3, 12], ["CHR", 0, "shared", [3]], ["CA", 1, 4, 12], ["FU", 5, [0, 1, 2, 3]], ["AN", 5, 0, 5], ["FU", 5, [1, 2, 3, 4]], ["AN", 5, 1, 4], ["FU", 5, [2, 3, 4, 5]], ["AN", 5, 2, 6], ["FU", 3, [0, 1, 2, 3]], ["SP", 3, 0, 8, [1], 1], ["AN", 3, 1, 2], ["FFSP", 3, 0, [4, 3, 2, 1], 1, 1], ["AN", 3, 1, 6], ["FU", 1, [0, 1, 2, 3]], ["SP", 1, 0, 8, [2], 1], ["AN", 1, 1, 2], ["FFSP", 1, 0, [4, 3, 2, 1], 1, 1], ["AN", 1, 1, 6], ["PR", 4, 0, "auto_unroll_max_step$16"]]]], "r": [[6.08918e-05], 0, 2.16733, 1669209165], "v": "v0.6"}
{"i": [["[\"get_expr\", \"batch_matmul_4d_4d_expr\", [64, 12, 64, 1, 64]]", "cuda -keys=cuda,gpu -max_num_threads=1024 -thread_warp_size=32", [-1, 16, 64, 49152, 2147483647, 1024, 8, 32], "", 0, []], [[], [["CHW", 2, "local"], ["SP", 2, 0, 64, [1, 2, 2, 1], 1], ["SP", 2, 5, 12, [2, 6, 1, 1], 1], ["SP", 2, 10, 64, [1, 16, 1, 2], 1], ["SP", 2, 15, 1, [1, 1, 1, 1], 1], ["SP", 2, 20, 64, [1, 1], 1], ["RE", 2, [0, 5, 10, 15, 1, 6, 11, 16, 2, 7, 12, 17, 20, 21, 3, 8, 13, 18, 22, 4, 9, 14, 19]], ["FSP", 3, 0, 1, 3], ["FSP", 3, 4, 2, 3], ["FSP", 3, 8, 3, 3], ["FSP", 3, 12, 4, 3], ["RE", 3, [0, 4, 8, 12, 1, 5, 9, 13, 2, 6, 10, 14, 3, 7, 11, 15]], ["CA", 2, 3, 11], ["CHR", 1, "shared", [2]], ["CA", 2, 3, 12], ["CHR", 0, "shared", [3]], ["CA", 1, 4, 12], ["FU", 5, [0, 1, 2, 3]], ["AN", 5, 0, 5], ["FU", 5, [1, 2, 3, 4]], ["AN", 5, 1, 4], ["FU", 5, [2, 3, 4, 5]], ["AN", 5, 2, 6], ["FU", 3, [0, 1, 2, 3]], ["SP", 3, 0, 4, [2], 1], ["AN", 3, 1, 2], ["FFSP", 3, 0, [4, 3, 2, 1], 1, 1], ["AN", 3, 1, 6], ["FU", 1, [0, 1, 2, 3]], ["SP", 1, 0, 8, [1], 1], ["AN", 1, 1, 2], ["FFSP", 1, 0, [4, 3, 2, 1], 1, 1], ["AN", 1, 1, 6], ["PR", 4, 0, "auto_unroll_max_step$512"]]]], "r": [[0.000135416], 0, 1.94598, 1669209166], "v": "v0.6"}
{"i": [["[\"get_expr\", \"batch_matmul_4d_4d_expr\", [64, 12, 64, 1, 64]]", "cuda -keys=cuda,gpu -max_num_threads=1024 -thread_warp_size=32", [-1, 16, 64, 49152, 2147483647, 1024, 8, 32], "", 0, []], [[], [["CHW", 2, "local"], ["SP", 2, 0, 64, [1, 8, 2, 1], 1], ["SP", 2, 5, 12, [1, 1, 6, 1], 1], ["SP", 2, 10, 64, [2, 1, 1, 8], 1], ["SP", 2, 15, 1, [1, 1, 1, 1], 1], ["SP", 2, 20, 64, [4, 1], 1], ["RE", 2, [0, 5, 10, 15, 1, 6, 11, 16, 2, 7, 12, 17, 20, 21, 3, 8, 13, 18, 22, 4, 9, 14, 19]], ["FSP", 3, 0, 1, 3], ["FSP", 3, 4, 2, 3], ["FSP", 3, 8, 3, 3], ["FSP", 3, 12, 4, 3], ["RE", 3, [0, 4, 8, 12, 1, 5, 9, 13, 2, 6, 10, 14, 3, 7, 11, 15]], ["CA", 2, 3, 11], ["CHR", 1, "shared", [2]], ["CA", 2, 3, 12], ["CHR", 0, "shared", [3]], ["CA", 1, 4, 12], ["FU", 5, [0, 1, 2, 3]], ["AN", 5, 0, 5], ["FU", 5, [1, 2, 3, 4]], ["AN", 5, 1, 4], ["FU", 5, [2, 3, 4, 5]], ["AN", 5, 2, 6], ["FU", 3, [0, 1, 2, 3]], ["SP", 3, 0, 8, [1], 1], ["AN", 3, 1, 2], ["FFSP", 3, 0, [4, 3, 2, 1], 1, 1], ["AN", 3, 1, 6], ["FU", 1, [0, 1, 2, 3]], ["SP", 1, 0, 8, [1], 1], ["AN", 1, 1, 2], ["FFSP", 1, 0, [4, 3, 2, 1], 1, 1], ["AN", 1, 1, 6], ["PR", 4, 0, "auto_unroll_max_step$0"]]]], "r": [[0.00127616], 0, 2.45397, 1669209168], "v": "v0.6"}
{"i": [["[\"get_expr\", \"batch_matmul_4d_4d_expr\", [64, 12, 64, 1, 64]]", "cuda -keys=cuda,gpu -max_num_threads=1024 -thread_warp_size=32", [-1, 16, 64, 49152, 2147483647, 1024, 8, 32], "", 0, []], [[], [["CHW", 2, "local"], ["SP", 2, 0, 64, [1, 1, 1, 1], 1], ["SP", 2, 5, 12, [1, 4, 1, 1], 1], ["SP", 2, 10, 64, [1, 16, 2, 2], 1], ["SP", 2, 15, 1, [1, 1, 1, 1], 1], ["SP", 2, 20, 64, [16, 1], 1], ["RE", 2, [0, 5, 10, 15, 1, 6, 11, 16, 2, 7, 12, 17, 20, 21, 3, 8, 13, 18, 22, 4, 9, 14, 19]], ["FSP", 3, 0, 1, 3], ["FSP", 3, 4, 2, 3], ["FSP", 3, 8, 3, 3], ["FSP", 3, 12, 4, 3], ["RE", 3, [0, 4, 8, 12, 1, 5, 9, 13, 2, 6, 10, 14, 3, 7, 11, 15]], ["CA", 2, 3, 11], ["CHR", 1, "shared", [2]], ["CA", 2, 3, 12], ["CHR", 0, "shared", [3]], ["CA", 1, 4, 12], ["FU", 5, [0, 1, 2, 3]], ["AN", 5, 0, 5], ["FU", 5, [1, 2, 3, 4]], ["AN", 5, 1, 4], ["FU", 5, [2, 3, 4, 5]], ["AN", 5, 2, 6], ["FU", 3, [0, 1, 2, 3]], ["SP", 3, 0, 16, [1], 1], ["AN", 3, 1, 2], ["FFSP", 3, 0, [4, 3, 2, 1], 1, 1], ["AN", 3, 1, 6], ["FU", 1, [0, 1, 2, 3]], ["SP", 1, 0, 64, [1], 1], ["AN", 1, 1, 2], ["FFSP", 1, 0, [4, 3, 2, 1], 1, 1], ["AN", 1, 1, 6], ["PR", 4, 0, "auto_unroll_max_step$1024"]]]], "r": [[2.64052e-05], 0, 2.60243, 1669209169], "v": "v0.6"}
{"i": [["[\"get_expr\", \"batch_matmul_4d_4d_expr\", [64, 12, 64, 1, 64]]", "cuda -keys=cuda,gpu -max_num_threads=1024 -thread_warp_size=32", [-1, 16, 64, 49152, 2147483647, 1024, 8, 32], "", 0, []], [[], [["CHW", 2, "local"], ["SP", 2, 0, 64, [1, 16, 1, 2], 1], ["SP", 2, 5, 12, [1, 4, 1, 1], 1], ["SP", 2, 10, 64, [4, 1, 8, 1], 1], ["SP", 2, 15, 1, [1, 1, 1, 1], 1], ["SP", 2, 20, 64, [1, 1], 1], ["RE", 2, [0, 5, 10, 15, 1, 6, 11, 16, 2, 7, 12, 17, 20, 21, 3, 8, 13, 18, 22, 4, 9, 14, 19]], ["FSP", 3, 0, 1, 3], ["FSP", 3, 4, 2, 3], ["FSP", 3, 8, 3, 3], ["FSP", 3, 12, 4, 3], ["RE", 3, [0, 4, 8, 12, 1, 5, 9, 13, 2, 6, 10, 14, 3, 7, 11, 15]], ["CA", 2, 3, 11], ["CHR", 1, "shared", [2]], ["CA", 2, 3, 12], ["CHR", 0, "shared", [3]], ["CA", 1, 4, 12], ["FU", 5, [0, 1, 2, 3]], ["AN", 5, 0, 5], ["FU", 5, [1, 2, 3, 4]], ["AN", 5, 1, 4], ["FU", 5, [2, 3, 4, 5]], ["AN", 5, 2, 6], ["FU", 3, [0, 1, 2, 3]], ["SP", 3, 0, 2, [2], 1], ["AN", 3, 1, 2], ["FFSP", 3, 0, [4, 3, 2, 1], 1, 1], ["AN", 3, 1, 6], ["FU", 1, [0, 1, 2, 3]], ["SP", 1, 0, 32, [1], 1], ["AN", 1, 1, 2], ["FFSP", 1, 0, [4, 3, 2, 1], 1, 1], ["AN", 1, 1, 6], ["PR", 4, 0, "auto_unroll_max_step$64"]]]], "r": [[0.000482062], 0, 1.88371, 1669209170], "v": "v0.6"}
{"i": [["[\"get_expr\", \"batch_matmul_4d_4d_expr\", [64, 12, 64, 1, 64]]", "cuda -keys=cuda,gpu -max_num_threads=1024 -thread_warp_size=32", [-1, 16, 64, 49152, 2147483647, 1024, 8, 32], "", 0, []], [[], [["CHW", 2, "local"], ["SP", 2, 0, 64, [4, 2, 2, 1], 1], ["SP", 2, 5, 12, [1, 1, 2, 1], 1], ["SP", 2, 10, 64, [1, 8, 8, 1], 1], ["SP", 2, 15, 1, [1, 1, 1, 1], 1], ["SP", 2, 20, 64, [4, 1], 1], ["RE", 2, [0, 5, 10, 15, 1, 6, 11, 16, 2, 7, 12, 17, 20, 21, 3, 8, 13, 18, 22, 4, 9, 14, 19]], ["FSP", 3, 0, 1, 3], ["FSP", 3, 4, 2, 3], ["FSP", 3, 8, 3, 3], ["FSP", 3, 12, 4, 3], ["RE", 3, [0, 4, 8, 12, 1, 5, 9, 13, 2, 6, 10, 14, 3, 7, 11, 15]], ["CA", 2, 3, 11], ["CHR", 1, "shared", [2]], ["CA", 2, 3, 12], ["CHR", 0, "shared", [3]], ["CA", 1, 4, 12], ["FU", 5, [0, 1, 2, 3]], ["AN", 5, 0, 5], ["FU", 5, [1, 2, 3, 4]], ["AN", 5, 1, 4], ["FU", 5, [2, 3, 4, 5]], ["AN", 5, 2, 6], ["FU", 3, [0, 1, 2, 3]], ["SP", 3, 0, 16, [1], 1], ["AN", 3, 1, 2], ["FFSP", 3, 0, [4, 3, 2, 1], 1, 1], ["AN", 3, 1, 6], ["FU", 1, [0, 1, 2, 3]], ["SP", 1, 0, 64, [1], 1], ["AN", 1, 1, 2], ["FFSP", 1, 0, [4, 3, 2, 1], 1, 1], ["AN", 1, 1, 6], ["PR", 4, 0, "auto_unroll_max_step$16"]]]], "r": [[0.000646894], 0, 2.48487, 1669209172], "v": "v0.6"}
{"i": [["[\"get_expr\", \"batch_matmul_4d_4d_expr\", [64, 12, 64, 1, 64]]", "cuda -keys=cuda,gpu -max_num_threads=1024 -thread_warp_size=32", [-1, 16, 64, 49152, 2147483647, 1024, 8, 32], "", 0, []], [[], [["CHW", 2, "local"], ["SP", 2, 0, 64, [1, 16, 1, 2], 1], ["SP", 2, 5, 12, [1, 1, 2, 2], 1], ["SP", 2, 10, 64, [1, 1, 8, 1], 1], ["SP", 2, 15, 1, [1, 1, 1, 1], 1], ["SP", 2, 20, 64, [2, 1], 1], ["RE", 2, [0, 5, 10, 15, 1, 6, 11, 16, 2, 7, 12, 17, 20, 21, 3, 8, 13, 18, 22, 4, 9, 14, 19]], ["FSP", 3, 0, 1, 3], ["FSP", 3, 4, 2, 3], ["FSP", 3, 8, 3, 3], ["FSP", 3, 12, 4, 3], ["RE", 3, [0, 4, 8, 12, 1, 5, 9, 13, 2, 6, 10, 14, 3, 7, 11, 15]], ["CA", 2, 3, 11], ["CHR", 1, "shared", [2]], ["CA", 2, 3, 12], ["CHR", 0, "shared", [3]], ["CA", 1, 4, 12], ["FU", 5, [0, 1, 2, 3]], ["AN", 5, 0, 5], ["FU", 5, [1, 2, 3, 4]], ["AN", 5, 1, 4], ["FU", 5, [2, 3, 4, 5]], ["AN", 5, 2, 6], ["FU", 3, [0, 1, 2, 3]], ["SP", 3, 0, 24, [1], 1], ["AN", 3, 1, 2], ["FFSP", 3, 0, [4, 3, 2, 1], 1, 1], ["AN", 3, 1, 6], ["FU", 1, [0, 1, 2, 3]], ["SP", 1, 0, 24, [1], 1], ["AN", 1, 1, 2], ["FFSP", 1, 0, [4, 3, 2, 1], 1, 1], ["AN", 1, 1, 6], ["PR", 4, 0, "auto_unroll_max_step$512"]]]], "r": [[0.000131686], 0, 2.65308, 1669209173], "v": "v0.6"}
{"i": [["[\"get_expr\", \"batch_matmul_4d_4d_expr\", [64, 12, 64, 1, 64]]", "cuda -keys=cuda,gpu -max_num_threads=1024 -thread_warp_size=32", [-1, 16, 64, 49152, 2147483647, 1024, 8, 32], "", 0, []], [[], [["CHW", 2, "local"], ["SP", 2, 0, 64, [2, 2, 1, 2], 1], ["SP", 2, 5, 12, [1, 4, 1, 3], 1], ["SP", 2, 10, 64, [2, 16, 1, 1], 1], ["SP", 2, 15, 1, [1, 1, 1, 1], 1], ["SP", 2, 20, 64, [1, 2], 1], ["RE", 2, [0, 5, 10, 15, 1, 6, 11, 16, 2, 7, 12, 17, 20, 21, 3, 8, 13, 18, 22, 4, 9, 14, 19]], ["FSP", 3, 0, 1, 3], ["FSP", 3, 4, 2, 3], ["FSP", 3, 8, 3, 3], ["FSP", 3, 12, 4, 3], ["RE", 3, [0, 4, 8, 12, 1, 5, 9, 13, 2, 6, 10, 14, 3, 7, 11, 15]], ["CA", 2, 3, 11], ["CHR", 1, "shared", [2]], ["CA", 2, 3, 12], ["CHR", 0, "shared", [3]], ["CA", 1, 4, 12], ["FU", 5, [0, 1, 2, 3]], ["AN", 5, 0, 5], ["FU", 5, [1, 2, 3, 4]], ["AN", 5, 1, 4], ["FU", 5, [2, 3, 4, 5]], ["AN", 5, 2, 6], ["FU", 3, [0, 1, 2, 3]], ["SP", 3, 0, 12, [2], 1], ["AN", 3, 1, 2], ["FFSP", 3, 0, [4, 3, 2, 1], 1, 1], ["AN", 3, 1, 6], ["FU", 1, [0, 1, 2, 3]], ["SP", 1, 0, 12, [1], 1], ["AN", 1, 1, 2], ["FFSP", 1, 0, [4, 3, 2, 1], 1, 1], ["AN", 1, 1, 6], ["PR", 4, 0, "auto_unroll_max_step$0"]]]], "r": [[0.000154406], 0, 2.10916, 1669209175], "v": "v0.6"}
{"i": [["[\"get_expr\", \"batch_matmul_4d_4d_expr\", [64, 12, 64, 1, 64]]", "cuda -keys=cuda,gpu -max_num_threads=1024 -thread_warp_size=32", [-1, 16, 64, 49152, 2147483647, 1024, 8, 32], "", 0, []], [[], [["CHW", 2, "local"], ["SP", 2, 0, 64, [1, 16, 1, 1], 1], ["SP", 2, 5, 12, [1, 1, 6, 2], 1], ["SP", 2, 10, 64, [1, 4, 1, 1], 1], ["SP", 2, 15, 1, [1, 1, 1, 1], 1], ["SP", 2, 20, 64, [1, 1], 1], ["RE", 2, [0, 5, 10, 15, 1, 6, 11, 16, 2, 7, 12, 17, 20, 21, 3, 8, 13, 18, 22, 4, 9, 14, 19]], ["FSP", 3, 0, 1, 3], ["FSP", 3, 4, 2, 3], ["FSP", 3, 8, 3, 3], ["FSP", 3, 12, 4, 3], ["RE", 3, [0, 4, 8, 12, 1, 5, 9, 13, 2, 6, 10, 14, 3, 7, 11, 15]], ["CA", 2, 3, 11], ["CHR", 1, "shared", [2]], ["CA", 2, 3, 12], ["CHR", 0, "shared", [3]], ["CA", 1, 4, 12], ["FU", 5, [0, 1, 2, 3]], ["AN", 5, 0, 5], ["FU", 5, [1, 2, 3, 4]], ["AN", 5, 1, 4], ["FU", 5, [2, 3, 4, 5]], ["AN", 5, 2, 6], ["FU", 3, [0, 1, 2, 3]], ["SP", 3, 0, 12, [6], 1], ["AN", 3, 1, 2], ["FFSP", 3, 0, [4, 3, 2, 1], 1, 1], ["AN", 3, 1, 6], ["FU", 1, [0, 1, 2, 3]], ["SP", 1, 0, 48, [1], 1], ["AN", 1, 1, 2], ["FFSP", 1, 0, [4, 3, 2, 1], 1, 1], ["AN", 1, 1, 6], ["PR", 4, 0, "auto_unroll_max_step$16"]]]], "r": [[0.000141426], 0, 2.06441, 1669209176], "v": "v0.6"}
{"i": [["[\"get_expr\", \"batch_matmul_4d_4d_expr\", [64, 12, 64, 1, 64]]", "cuda -keys=cuda,gpu -max_num_threads=1024 -thread_warp_size=32", [-1, 16, 64, 49152, 2147483647, 1024, 8, 32], "", 0, []], [[], [["CHW", 2, "local"], ["SP", 2, 0, 64, [1, 8, 1, 2], 1], ["SP", 2, 5, 12, [1, 2, 1, 2], 1], ["SP", 2, 10, 64, [1, 2, 1, 2], 1], ["SP", 2, 15, 1, [1, 1, 1, 1], 1], ["SP", 2, 20, 64, [2, 8], 1], ["RE", 2, [0, 5, 10, 15, 1, 6, 11, 16, 2, 7, 12, 17, 20, 21, 3, 8, 13, 18, 22, 4, 9, 14, 19]], ["FSP", 3, 0, 1, 3], ["FSP", 3, 4, 2, 3], ["FSP", 3, 8, 3, 3], ["FSP", 3, 12, 4, 3], ["RE", 3, [0, 4, 8, 12, 1, 5, 9, 13, 2, 6, 10, 14, 3, 7, 11, 15]], ["CA", 2, 3, 11], ["CHR", 1, "shared", [2]], ["CA", 2, 3, 12], ["CHR", 0, "shared", [3]], ["CA", 1, 4, 12], ["FU", 5, [0, 1, 2, 3]], ["AN", 5, 0, 5], ["FU", 5, [1, 2, 3, 4]], ["AN", 5, 1, 4], ["FU", 5, [2, 3, 4, 5]], ["AN", 5, 2, 6], ["FU", 3, [0, 1, 2, 3]], ["SP", 3, 0, 128, [1], 1], ["AN", 3, 1, 2], ["FFSP", 3, 0, [4, 3, 2, 1], 1, 1], ["AN", 3, 1, 6], ["FU", 1, [0, 1, 2, 3]], ["SP", 1, 0, 256, [1], 1], ["AN", 1, 1, 2], ["FFSP", 1, 0, [4, 3, 2, 1], 1, 1], ["AN", 1, 1, 6], ["PR", 4, 0, "auto_unroll_max_step$64"]]]], "r": [[5.38266e-05], 0, 2.09586, 1669209177], "v": "v0.6"}
{"i": [["[\"get_expr\", \"batch_matmul_4d_4d_expr\", [64, 12, 64, 1, 64]]", "cuda -keys=cuda,gpu -max_num_threads=1024 -thread_warp_size=32", [-1, 16, 64, 49152, 2147483647, 1024, 8, 32], "", 0, []], [[], [["CHW", 2, "local"], ["SP", 2, 0, 64, [2, 2, 1, 2], 1], ["SP", 2, 5, 12, [1, 4, 1, 3], 1], ["SP", 2, 10, 64, [2, 16, 1, 1], 1], ["SP", 2, 15, 1, [1, 1, 1, 1], 1], ["SP", 2, 20, 64, [1, 2], 1], ["RE", 2, [0, 5, 10, 15, 1, 6, 11, 16, 2, 7, 12, 17, 20, 21, 3, 8, 13, 18, 22, 4, 9, 14, 19]], ["FSP", 3, 0, 1, 3], ["FSP", 3, 4, 2, 3], ["FSP", 3, 8, 3, 3], ["FSP", 3, 12, 4, 3], ["RE", 3, [0, 4, 8, 12, 1, 5, 9, 13, 2, 6, 10, 14, 3, 7, 11, 15]], ["CA", 2, 3, 11], ["CHR", 1, "shared", [2]], ["CA", 2, 3, 12], ["CHR", 0, "shared", [3]], ["CA", 1, 4, 12], ["FU", 5, [0, 1, 2, 3]], ["AN", 5, 0, 5], ["FU", 5, [1, 2, 3, 4]], ["AN", 5, 1, 4], ["FU", 5, [2, 3, 4, 5]], ["AN", 5, 2, 6], ["FU", 3, [0, 1, 2, 3]], ["SP", 3, 0, 12, [1], 1], ["AN", 3, 1, 2], ["FFSP", 3, 0, [4, 3, 2, 1], 1, 1], ["AN", 3, 1, 6], ["FU", 1, [0, 1, 2, 3]], ["SP", 1, 0, 12, [1], 1], ["AN", 1, 1, 2], ["FFSP", 1, 0, [4, 3, 2, 1], 1, 1], ["AN", 1, 1, 6], ["PR", 4, 0, "auto_unroll_max_step$0"]]]], "r": [[0.000157817], 0, 2.05608, 1669209179], "v": "v0.6"}
{"i": [["[\"get_expr\", \"batch_matmul_4d_4d_expr\", [64, 12, 64, 1, 64]]", "cuda -keys=cuda,gpu -max_num_threads=1024 -thread_warp_size=32", [-1, 16, 64, 49152, 2147483647, 1024, 8, 32], "", 0, []], [[], [["CHW", 2, "local"], ["SP", 2, 0, 64, [1, 8, 1, 2], 1], ["SP", 2, 5, 12, [1, 4, 1, 1], 1], ["SP", 2, 10, 64, [4, 1, 16, 1], 1], ["SP", 2, 15, 1, [1, 1, 1, 1], 1], ["SP", 2, 20, 64, [1, 1], 1], ["RE", 2, [0, 5, 10, 15, 1, 6, 11, 16, 2, 7, 12, 17, 20, 21, 3, 8, 13, 18, 22, 4, 9, 14, 19]], ["FSP", 3, 0, 1, 3], ["FSP", 3, 4, 2, 3], ["FSP", 3, 8, 3, 3], ["FSP", 3, 12, 4, 3], ["RE", 3, [0, 4, 8, 12, 1, 5, 9, 13, 2, 6, 10, 14, 3, 7, 11, 15]], ["CA", 2, 3, 11], ["CHR", 1, "shared", [2]], ["CA", 2, 3, 12], ["CHR", 0, "shared", [3]], ["CA", 1, 4, 12], ["FU", 5, [0, 1, 2, 3]], ["AN", 5, 0, 5], ["FU", 5, [1, 2, 3, 4]], ["AN", 5, 1, 4], ["FU", 5, [2, 3, 4, 5]], ["AN", 5, 2, 6], ["FU", 3, [0, 1, 2, 3]], ["SP", 3, 0, 2, [2], 1], ["AN", 3, 1, 2], ["FFSP", 3, 0, [4, 3, 2, 1], 1, 1], ["AN", 3, 1, 6], ["FU", 1, [0, 1, 2, 3]], ["SP", 1, 0, 32, [1], 1], ["AN", 1, 1, 2], ["FFSP", 1, 0, [4, 3, 2, 1], 1, 1], ["AN", 1, 1, 6], ["PR", 4, 0, "auto_unroll_max_step$512"]]]], "r": [[0.000864736], 0, 2.6506, 1669209180], "v": "v0.6"}
{"i": [["[\"get_expr\", \"batch_matmul_4d_4d_expr\", [64, 12, 64, 1, 64]]", "cuda -keys=cuda,gpu -max_num_threads=1024 -thread_warp_size=32", [-1, 16, 64, 49152, 2147483647, 1024, 8, 32], "", 0, []], [[], [["CHW", 2, "local"], ["SP", 2, 0, 64, [1, 8, 4, 2], 1], ["SP", 2, 5, 12, [2, 2, 3, 1], 1], ["SP", 2, 10, 64, [1, 4, 1, 1], 1], ["SP", 2, 15, 1, [1, 1, 1, 1], 1], ["SP", 2, 20, 64, [1, 1], 1], ["RE", 2, [0, 5, 10, 15, 1, 6, 11, 16, 2, 7, 12, 17, 20, 21, 3, 8, 13, 18, 22, 4, 9, 14, 19]], ["FSP", 3, 0, 1, 3], ["FSP", 3, 4, 2, 3], ["FSP", 3, 8, 3, 3], ["FSP", 3, 12, 4, 3], ["RE", 3, [0, 4, 8, 12, 1, 5, 9, 13, 2, 6, 10, 14, 3, 7, 11, 15]], ["CA", 2, 3, 11], ["CHR", 1, "shared", [2]], ["CA", 2, 3, 12], ["CHR", 0, "shared", [3]], ["CA", 1, 4, 12], ["FU", 5, [0, 1, 2, 3]], ["AN", 5, 0, 5], ["FU", 5, [1, 2, 3, 4]], ["AN", 5, 1, 4], ["FU", 5, [2, 3, 4, 5]], ["AN", 5, 2, 6], ["FU", 3, [0, 1, 2, 3]], ["SP", 3, 0, 24, [1], 1], ["AN", 3, 1, 2], ["FFSP", 3, 0, [4, 3, 2, 1], 1, 1], ["AN", 3, 1, 6], ["FU", 1, [0, 1, 2, 3]], ["SP", 1, 0, 24, [1], 1], ["AN", 1, 1, 2], ["FFSP", 1, 0, [4, 3, 2, 1], 1, 1], ["AN", 1, 1, 6], ["PR", 4, 0, "auto_unroll_max_step$0"]]]], "r": [[0.000433304], 0, 2.15833, 1669209181], "v": "v0.6"}
{"i": [["[\"get_expr\", \"batch_matmul_4d_4d_expr\", [64, 12, 64, 1, 64]]", "cuda -keys=cuda,gpu -max_num_threads=1024 -thread_warp_size=32", [-1, 16, 64, 49152, 2147483647, 1024, 8, 32], "", 0, []], [[], [["CHW", 2, "local"], ["SP", 2, 0, 64, [1, 32, 2, 1], 1], ["SP", 2, 5, 12, [1, 2, 1, 1], 1], ["SP", 2, 10, 64, [1, 1, 4, 1], 1], ["SP", 2, 15, 1, [1, 1, 1, 1], 1], ["SP", 2, 20, 64, [2, 2], 1], ["RE", 2, [0, 5, 10, 15, 1, 6, 11, 16, 2, 7, 12, 17, 20, 21, 3, 8, 13, 18, 22, 4, 9, 14, 19]], ["FSP", 3, 0, 1, 3], ["FSP", 3, 4, 2, 3], ["FSP", 3, 8, 3, 3], ["FSP", 3, 12, 4, 3], ["RE", 3, [0, 4, 8, 12, 1, 5, 9, 13, 2, 6, 10, 14, 3, 7, 11, 15]], ["CA", 2, 3, 11], ["CHR", 1, "shared", [2]], ["CA", 2, 3, 12], ["CHR", 0, "shared", [3]], ["CA", 1, 4, 12], ["FU", 5, [0, 1, 2, 3]], ["AN", 5, 0, 5], ["FU", 5, [1, 2, 3, 4]], ["AN", 5, 1, 4], ["FU", 5, [2, 3, 4, 5]], ["AN", 5, 2, 6], ["FU", 3, [0, 1, 2, 3]], ["SP", 3, 0, 8, [1], 1], ["AN", 3, 1, 2], ["FFSP", 3, 0, [4, 3, 2, 1], 1, 1], ["AN", 3, 1, 6], ["FU", 1, [0, 1, 2, 3]], ["SP", 1, 0, 128, [1], 1], ["AN", 1, 1, 2], ["FFSP", 1, 0, [4, 3, 2, 1], 1, 1], ["AN", 1, 1, 6], ["PR", 4, 0, "auto_unroll_max_step$0"]]]], "r": [[5.09928e-05], 0, 2.00382, 1669209183], "v": "v0.6"}
{"i": [["[\"get_expr\", \"batch_matmul_4d_4d_expr\", [64, 12, 64, 1, 64]]", "cuda -keys=cuda,gpu -max_num_threads=1024 -thread_warp_size=32", [-1, 16, 64, 49152, 2147483647, 1024, 8, 32], "", 0, []], [[], [["CHW", 2, "local"], ["SP", 2, 0, 64, [2, 16, 1, 1], 1], ["SP", 2, 5, 12, [2, 1, 1, 3], 1], ["SP", 2, 10, 64, [2, 1, 2, 8], 1], ["SP", 2, 15, 1, [1, 1, 1, 1], 1], ["SP", 2, 20, 64, [1, 1], 1], ["RE", 2, [0, 5, 10, 15, 1, 6, 11, 16, 2, 7, 12, 17, 20, 21, 3, 8, 13, 18, 22, 4, 9, 14, 19]], ["FSP", 3, 0, 1, 3], ["FSP", 3, 4, 2, 3], ["FSP", 3, 8, 3, 3], ["FSP", 3, 12, 4, 3], ["RE", 3, [0, 4, 8, 12, 1, 5, 9, 13, 2, 6, 10, 14, 3, 7, 11, 15]], ["CA", 2, 3, 11], ["CHR", 1, "shared", [2]], ["CA", 2, 3, 12], ["CHR", 0, "shared", [3]], ["CA", 1, 4, 12], ["FU", 5, [0, 1, 2, 3]], ["AN", 5, 0, 5], ["FU", 5, [1, 2, 3, 4]], ["AN", 5, 1, 4], ["FU", 5, [2, 3, 4, 5]], ["AN", 5, 2, 6], ["FU", 3, [0, 1, 2, 3]], ["SP", 3, 0, 3, [3], 1], ["AN", 3, 1, 2], ["FFSP", 3, 0, [4, 3, 2, 1], 1, 1], ["AN", 3, 1, 6], ["FU", 1, [0, 1, 2, 3]], ["SP", 1, 0, 24, [1], 1], ["AN", 1, 1, 2], ["FFSP", 1, 0, [4, 3, 2, 1], 1, 1], ["AN", 1, 1, 6], ["PR", 4, 0, "auto_unroll_max_step$16"]]]], "r": [[0.00216734], 0, 3.00699, 1669209184], "v": "v0.6"}
{"i": [["[\"get_expr\", \"batch_matmul_4d_4d_expr\", [64, 12, 64, 1, 64]]", "cuda -keys=cuda,gpu -max_num_threads=1024 -thread_warp_size=32", [-1, 16, 64, 49152, 2147483647, 1024, 8, 32], "", 0, []], [[], [["CHW", 2, "local"], ["SP", 2, 0, 64, [1, 8, 1, 2], 1], ["SP", 2, 5, 12, [3, 4, 1, 1], 1], ["SP", 2, 10, 64, [2, 1, 16, 1], 1], ["SP", 2, 15, 1, [1, 1, 1, 1], 1], ["SP", 2, 20, 64, [1, 1], 1], ["RE", 2, [0, 5, 10, 15, 1, 6, 11, 16, 2, 7, 12, 17, 20, 21, 3, 8, 13, 18, 22, 4, 9, 14, 19]], ["FSP", 3, 0, 1, 3], ["FSP", 3, 4, 2, 3], ["FSP", 3, 8, 3, 3], ["FSP", 3, 12, 4, 3], ["RE", 3, [0, 4, 8, 12, 1, 5, 9, 13, 2, 6, 10, 14, 3, 7, 11, 15]], ["CA", 2, 3, 11], ["CHR", 1, "shared", [2]], ["CA", 2, 3, 12], ["CHR", 0, "shared", [3]], ["CA", 1, 4, 12], ["FU", 5, [0, 1, 2, 3]], ["AN", 5, 0, 5], ["FU", 5, [1, 2, 3, 4]], ["AN", 5, 1, 4], ["FU", 5, [2, 3, 4, 5]], ["AN", 5, 2, 6], ["FU", 3, [0, 1, 2, 3]], ["SP", 3, 0, 2, [1], 1], ["AN", 3, 1, 2], ["FFSP", 3, 0, [4, 3, 2, 1], 1, 1], ["AN", 3, 1, 6], ["FU", 1, [0, 1, 2, 3]], ["SP", 1, 0, 32, [1], 1], ["AN", 1, 1, 2], ["FFSP", 1, 0, [4, 3, 2, 1], 1, 1], ["AN", 1, 1, 6], ["PR", 4, 0, "auto_unroll_max_step$1024"]]]], "r": [[0.000772314], 0, 2.92822, 1669209186], "v": "v0.6"}
{"i": [["[\"get_expr\", \"batch_matmul_4d_4d_expr\", [64, 12, 64, 1, 64]]", "cuda -keys=cuda,gpu -max_num_threads=1024 -thread_warp_size=32", [-1, 16, 64, 49152, 2147483647, 1024, 8, 32], "", 0, []], [[], [["CHW", 2, "local"], ["SP", 2, 0, 64, [2, 16, 1, 1], 1], ["SP", 2, 5, 12, [2, 1, 1, 3], 1], ["SP", 2, 10, 64, [1, 4, 2, 4], 1], ["SP", 2, 15, 1, [1, 1, 1, 1], 1], ["SP", 2, 20, 64, [1, 1], 1], ["RE", 2, [0, 5, 10, 15, 1, 6, 11, 16, 2, 7, 12, 17, 20, 21, 3, 8, 13, 18, 22, 4, 9, 14, 19]], ["FSP", 3, 0, 1, 3], ["FSP", 3, 4, 2, 3], ["FSP", 3, 8, 3, 3], ["FSP", 3, 12, 4, 3], ["RE", 3, [0, 4, 8, 12, 1, 5, 9, 13, 2, 6, 10, 14, 3, 7, 11, 15]], ["CA", 2, 3, 11], ["CHR", 1, "shared", [2]], ["CA", 2, 3, 12], ["CHR", 0, "shared", [3]], ["CA", 1, 4, 12], ["FU", 5, [0, 1, 2, 3]], ["AN", 5, 0, 5], ["FU", 5, [1, 2, 3, 4]], ["AN", 5, 1, 4], ["FU", 5, [2, 3, 4, 5]], ["AN", 5, 2, 6], ["FU", 3, [0, 1, 2, 3]], ["SP", 3, 0, 3, [1], 1], ["AN", 3, 1, 2], ["FFSP", 3, 0, [4, 3, 2, 1], 1, 1], ["AN", 3, 1, 6], ["FU", 1, [0, 1, 2, 3]], ["SP", 1, 0, 24, [3], 1], ["AN", 1, 1, 2], ["FFSP", 1, 0, [4, 3, 2, 1], 1, 1], ["AN", 1, 1, 6], ["PR", 4, 0, "auto_unroll_max_step$16"]]]], "r": [[0.000948619], 0, 1.79085, 1669209187], "v": "v0.6"}
{"i": [["[\"get_expr\", \"batch_matmul_4d_4d_expr\", [64, 12, 64, 1, 64]]", "cuda -keys=cuda,gpu -max_num_threads=1024 -thread_warp_size=32", [-1, 16, 64, 49152, 2147483647, 1024, 8, 32], "", 0, []], [[], [["CHW", 2, "local"], ["SP", 2, 0, 64, [1, 8, 4, 1], 1], ["SP", 2, 5, 12, [1, 12, 1, 1], 1], ["SP", 2, 10, 64, [1, 2, 1, 2], 1], ["SP", 2, 15, 1, [1, 1, 1, 1], 1], ["SP", 2, 20, 64, [1, 4], 1], ["RE", 2, [0, 5, 10, 15, 1, 6, 11, 16, 2, 7, 12, 17, 20, 21, 3, 8, 13, 18, 22, 4, 9, 14, 19]], ["FSP", 3, 0, 1, 3], ["FSP", 3, 4, 2, 3], ["FSP", 3, 8, 3, 3], ["FSP", 3, 12, 4, 3], ["RE", 3, [0, 4, 8, 12, 1, 5, 9, 13, 2, 6, 10, 14, 3, 7, 11, 15]], ["CA", 2, 3, 11], ["CHR", 1, "shared", [2]], ["CA", 2, 3, 12], ["CHR", 0, "shared", [3]], ["CA", 1, 4, 12], ["FU", 5, [0, 1, 2, 3]], ["AN", 5, 0, 5], ["FU", 5, [1, 2, 3, 4]], ["AN", 5, 1, 4], ["FU", 5, [2, 3, 4, 5]], ["AN", 5, 2, 6], ["FU", 3, [0, 1, 2, 3]], ["SP", 3, 0, 16, [1], 1], ["AN", 3, 1, 2], ["FFSP", 3, 0, [4, 3, 2, 1], 1, 1], ["AN", 3, 1, 6], ["FU", 1, [0, 1, 2, 3]], ["SP", 1, 0, 16, [1], 1], ["AN", 1, 1, 2], ["FFSP", 1, 0, [4, 3, 2, 1], 1, 1], ["AN", 1, 1, 6], ["PR", 4, 0, "auto_unroll_max_step$512"]]]], "r": [[7.17275e-05], 0, 2.12351, 1669209188], "v": "v0.6"}
{"i": [["[\"get_expr\", \"batch_matmul_4d_4d_expr\", [64, 12, 64, 1, 64]]", "cuda -keys=cuda,gpu -max_num_threads=1024 -thread_warp_size=32", [-1, 16, 64, 49152, 2147483647, 1024, 8, 32], "", 0, []], [[], [["CHW", 2, "local"], ["SP", 2, 0, 64, [1, 8, 1, 1], 1], ["SP", 2, 5, 12, [3, 1, 2, 1], 1], ["SP", 2, 10, 64, [1, 16, 2, 2], 1], ["SP", 2, 15, 1, [1, 1, 1, 1], 1], ["SP", 2, 20, 64, [1, 2], 1], ["RE", 2, [0, 5, 10, 15, 1, 6, 11, 16, 2, 7, 12, 17, 20, 21, 3, 8, 13, 18, 22, 4, 9, 14, 19]], ["FSP", 3, 0, 1, 3], ["FSP", 3, 4, 2, 3], ["FSP", 3, 8, 3, 3], ["FSP", 3, 12, 4, 3], ["RE", 3, [0, 4, 8, 12, 1, 5, 9, 13, 2, 6, 10, 14, 3, 7, 11, 15]], ["CA", 2, 3, 11], ["CHR", 1, "shared", [2]], ["CA", 2, 3, 12], ["CHR", 0, "shared", [3]], ["CA", 1, 4, 12], ["FU", 5, [0, 1, 2, 3]], ["AN", 5, 0, 5], ["FU", 5, [1, 2, 3, 4]], ["AN", 5, 1, 4], ["FU", 5, [2, 3, 4, 5]], ["AN", 5, 2, 6], ["FU", 3, [0, 1, 2, 3]], ["SP", 3, 0, 4, [1], 1], ["AN", 3, 1, 2], ["FFSP", 3, 0, [4, 3, 2, 1], 1, 1], ["AN", 3, 1, 6], ["FU", 1, [0, 1, 2, 3]], ["SP", 1, 0, 16, [1], 1], ["AN", 1, 1, 2], ["FFSP", 1, 0, [4, 3, 2, 1], 1, 1], ["AN", 1, 1, 6], ["PR", 4, 0, "auto_unroll_max_step$0"]]]], "r": [[0.000164668], 0, 2.14416, 1669209189], "v": "v0.6"}
{"i": [["[\"get_expr\", \"batch_matmul_4d_4d_expr\", [64, 12, 64, 1, 64]]", "cuda -keys=cuda,gpu -max_num_threads=1024 -thread_warp_size=32", [-1, 16, 64, 49152, 2147483647, 1024, 8, 32], "", 0, []], [[], [["CHW", 2, "local"], ["SP", 2, 0, 64, [2, 32, 1, 1], 1], ["SP", 2, 5, 12, [1, 1, 6, 1], 1], ["SP", 2, 10, 64, [2, 8, 1, 1], 1], ["SP", 2, 15, 1, [1, 1, 1, 1], 1], ["SP", 2, 20, 64, [1, 1], 1], ["RE", 2, [0, 5, 10, 15, 1, 6, 11, 16, 2, 7, 12, 17, 20, 21, 3, 8, 13, 18, 22, 4, 9, 14, 19]], ["FSP", 3, 0, 1, 3], ["FSP", 3, 4, 2, 3], ["FSP", 3, 8, 3, 3], ["FSP", 3, 12, 4, 3], ["RE", 3, [0, 4, 8, 12, 1, 5, 9, 13, 2, 6, 10, 14, 3, 7, 11, 15]], ["CA", 2, 3, 11], ["CHR", 1, "shared", [2]], ["CA", 2, 3, 12], ["CHR", 0, "shared", [3]], ["CA", 1, 4, 12], ["FU", 5, [0, 1, 2, 3]], ["AN", 5, 0, 5], ["FU", 5, [1, 2, 3, 4]], ["AN", 5, 1, 4], ["FU", 5, [2, 3, 4, 5]], ["AN", 5, 2, 6], ["FU", 3, [0, 1, 2, 3]], ["SP", 3, 0, 24, [1], 1], ["AN", 3, 1, 2], ["FFSP", 3, 0, [4, 3, 2, 1], 1, 1], ["AN", 3, 1, 6], ["FU", 1, [0, 1, 2, 3]], ["SP", 1, 0, 24, [1], 1], ["AN", 1, 1, 2], ["FFSP", 1, 0, [4, 3, 2, 1], 1, 1], ["AN", 1, 1, 6], ["PR", 4, 0, "auto_unroll_max_step$1024"]]]], "r": [[0.00067165], 0, 2.11024, 1669209191], "v": "v0.6"}
{"i": [["[\"get_expr\", \"batch_matmul_4d_4d_expr\", [64, 12, 64, 1, 64]]", "cuda -keys=cuda,gpu -max_num_threads=1024 -thread_warp_size=32", [-1, 16, 64, 49152, 2147483647, 1024, 8, 32], "", 0, []], [[], [["CHW", 2, "local"], ["SP", 2, 0, 64, [2, 1, 1, 16], 1], ["SP", 2, 5, 12, [1, 1, 1, 1], 1], ["SP", 2, 10, 64, [2, 16, 1, 1], 1], ["SP", 2, 15, 1, [1, 1, 1, 1], 1], ["SP", 2, 20, 64, [1, 1], 1], ["RE", 2, [0, 5, 10, 15, 1, 6, 11, 16, 2, 7, 12, 17, 20, 21, 3, 8, 13, 18, 22, 4, 9, 14, 19]], ["FSP", 3, 0, 1, 3], ["FSP", 3, 4, 2, 3], ["FSP", 3, 8, 3, 3], ["FSP", 3, 12, 4, 3], ["RE", 3, [0, 4, 8, 12, 1, 5, 9, 13, 2, 6, 10, 14, 3, 7, 11, 15]], ["CA", 2, 3, 11], ["CHR", 1, "shared", [2]], ["CA", 2, 3, 12], ["CHR", 0, "shared", [3]], ["CA", 1, 4, 12], ["FU", 5, [0, 1, 2, 3]], ["AN", 5, 0, 5], ["FU", 5, [1, 2, 3, 4]], ["AN", 5, 1, 4], ["FU", 5, [2, 3, 4, 5]], ["AN", 5, 2, 6], ["FU", 3, [0, 1, 2, 3]], ["SP", 3, 0, 16, [1], 1], ["AN", 3, 1, 2], ["FFSP", 3, 0, [4, 3, 2, 1], 1, 1], ["AN", 3, 1, 6], ["FU", 1, [0, 1, 2, 3]], ["SP", 1, 0, 16, [1], 1], ["AN", 1, 1, 2], ["FFSP", 1, 0, [4, 3, 2, 1], 1, 1], ["AN", 1, 1, 6], ["PR", 4, 0, "auto_unroll_max_step$64"]]]], "r": [[0.000179919], 0, 2.32785, 1669209192], "v": "v0.6"}
{"i": [["[\"get_expr\", \"batch_matmul_4d_4d_expr\", [64, 12, 64, 1, 64]]", "cuda -keys=cuda,gpu -max_num_threads=1024 -thread_warp_size=32", [-1, 16, 64, 49152, 2147483647, 1024, 8, 32], "", 0, []], [[], [["CHW", 2, "local"], ["SP", 2, 0, 64, [1, 2, 1, 1], 1], ["SP", 2, 5, 12, [3, 2, 2, 1], 1], ["SP", 2, 10, 64, [2, 32, 1, 1], 1], ["SP", 2, 15, 1, [1, 1, 1, 1], 1], ["SP", 2, 20, 64, [1, 4], 1], ["RE", 2, [0, 5, 10, 15, 1, 6, 11, 16, 2, 7, 12, 17, 20, 21, 3, 8, 13, 18, 22, 4, 9, 14, 19]], ["FSP", 3, 0, 1, 3], ["FSP", 3, 4, 2, 3], ["FSP", 3, 8, 3, 3], ["FSP", 3, 12, 4, 3], ["RE", 3, [0, 4, 8, 12, 1, 5, 9, 13, 2, 6, 10, 14, 3, 7, 11, 15]], ["CA", 2, 3, 11], ["CHR", 1, "shared", [2]], ["CA", 2, 3, 12], ["CHR", 0, "shared", [3]], ["CA", 1, 4, 12], ["FU", 5, [0, 1, 2, 3]], ["AN", 5, 0, 5], ["FU", 5, [1, 2, 3, 4]], ["AN", 5, 1, 4], ["FU", 5, [2, 3, 4, 5]], ["AN", 5, 2, 6], ["FU", 3, [0, 1, 2, 3]], ["SP", 3, 0, 8, [1], 1], ["AN", 3, 1, 2], ["FFSP", 3, 0, [4, 3, 2, 1], 1, 1], ["AN", 3, 1, 6], ["FU", 1, [0, 1, 2, 3]], ["SP", 1, 0, 8, [2], 1], ["AN", 1, 1, 2], ["FFSP", 1, 0, [4, 3, 2, 1], 1, 1], ["AN", 1, 1, 6], ["PR", 4, 0, "auto_unroll_max_step$0"]]]], "r": [[5.74131e-05], 0, 2.19689, 1669209194], "v": "v0.6"}
{"i": [["[\"get_expr\", \"batch_matmul_4d_4d_expr\", [64, 12, 64, 1, 64]]", "cuda -keys=cuda,gpu -max_num_threads=1024 -thread_warp_size=32", [-1, 16, 64, 49152, 2147483647, 1024, 8, 32], "", 0, []], [[], [["CHW", 2, "local"], ["SP", 2, 0, 64, [2, 16, 2, 1], 1], ["SP", 2, 5, 12, [1, 2, 1, 3], 1], ["SP", 2, 10, 64, [1, 1, 1, 8], 1], ["SP", 2, 15, 1, [1, 1, 1, 1], 1], ["SP", 2, 20, 64, [1, 1], 1], ["RE", 2, [0, 5, 10, 15, 1, 6, 11, 16, 2, 7, 12, 17, 20, 21, 3, 8, 13, 18, 22, 4, 9, 14, 19]], ["FSP", 3, 0, 1, 3], ["FSP", 3, 4, 2, 3], ["FSP", 3, 8, 3, 3], ["FSP", 3, 12, 4, 3], ["RE", 3, [0, 4, 8, 12, 1, 5, 9, 13, 2, 6, 10, 14, 3, 7, 11, 15]], ["CA", 2, 3, 11], ["CHR", 1, "shared", [2]], ["CA", 2, 3, 12], ["CHR", 0, "shared", [3]], ["CA", 1, 4, 12], ["FU", 5, [0, 1, 2, 3]], ["AN", 5, 0, 5], ["FU", 5, [1, 2, 3, 4]], ["AN", 5, 1, 4], ["FU", 5, [2, 3, 4, 5]], ["AN", 5, 2, 6], ["FU", 3, [0, 1, 2, 3]], ["SP", 3, 0, 6, [1], 1], ["AN", 3, 1, 2], ["FFSP", 3, 0, [4, 3, 2, 1], 1, 1], ["AN", 3, 1, 6], ["FU", 1, [0, 1, 2, 3]], ["SP", 1, 0, 96, [1], 1], ["AN", 1, 1, 2], ["FFSP", 1, 0, [4, 3, 2, 1], 1, 1], ["AN", 1, 1, 6], ["PR", 4, 0, "auto_unroll_max_step$0"]]]], "r": [[0.000536902], 0, 2.24481, 1669209195], "v": "v0.6"}
{"i": [["[\"get_expr\", \"batch_matmul_4d_4d_expr\", [64, 12, 64, 1, 64]]", "cuda -keys=cuda,gpu -max_num_threads=1024 -thread_warp_size=32", [-1, 16, 64, 49152, 2147483647, 1024, 8, 32], "", 0, []], [[], [["CHW", 2, "local"], ["SP", 2, 0, 64, [2, 16, 2, 1], 1], ["SP", 2, 5, 12, [3, 2, 1, 1], 1], ["SP", 2, 10, 64, [1, 1, 16, 1], 1], ["SP", 2, 15, 1, [1, 1, 1, 1], 1], ["SP", 2, 20, 64, [1, 1], 1], ["RE", 2, [0, 5, 10, 15, 1, 6, 11, 16, 2, 7, 12, 17, 20, 21, 3, 8, 13, 18, 22, 4, 9, 14, 19]], ["FSP", 3, 0, 1, 3], ["FSP", 3, 4, 2, 3], ["FSP", 3, 8, 3, 3], ["FSP", 3, 12, 4, 3], ["RE", 3, [0, 4, 8, 12, 1, 5, 9, 13, 2, 6, 10, 14, 3, 7, 11, 15]], ["CA", 2, 3, 11], ["CHR", 1, "shared", [2]], ["CA", 2, 3, 12], ["CHR", 0, "shared", [3]], ["CA", 1, 4, 12], ["FU", 5, [0, 1, 2, 3]], ["AN", 5, 0, 5], ["FU", 5, [1, 2, 3, 4]], ["AN", 5, 1, 4], ["FU", 5, [2, 3, 4, 5]], ["AN", 5, 2, 6], ["FU", 3, [0, 1, 2, 3]], ["SP", 3, 0, 6, [1], 1], ["AN", 3, 1, 2], ["FFSP", 3, 0, [4, 3, 2, 1], 1, 1], ["AN", 3, 1, 6], ["FU", 1, [0, 1, 2, 3]], ["SP", 1, 0, 96, [1], 1], ["AN", 1, 1, 2], ["FFSP", 1, 0, [4, 3, 2, 1], 1, 1], ["AN", 1, 1, 6], ["PR", 4, 0, "auto_unroll_max_step$64"]]]], "r": [[0.000797679], 0, 2.83728, 1669209197], "v": "v0.6"}
{"i": [["[\"get_expr\", \"batch_matmul_4d_4d_expr\", [64, 12, 64, 1, 64]]", "cuda -keys=cuda,gpu -max_num_threads=1024 -thread_warp_size=32", [-1, 16, 64, 49152, 2147483647, 1024, 8, 32], "", 0, []], [[], [["CHW", 2, "local"], ["SP", 2, 0, 64, [1, 4, 1, 1], 1], ["SP", 2, 5, 12, [6, 2, 1, 1], 1], ["SP", 2, 10, 64, [1, 4, 8, 1], 1], ["SP", 2, 15, 1, [1, 1, 1, 1], 1], ["SP", 2, 20, 64, [2, 1], 1], ["RE", 2, [0, 5, 10, 15, 1, 6, 11, 16, 2, 7, 12, 17, 20, 21, 3, 8, 13, 18, 22, 4, 9, 14, 19]], ["FSP", 3, 0, 1, 3], ["FSP", 3, 4, 2, 3], ["FSP", 3, 8, 3, 3], ["FSP", 3, 12, 4, 3], ["RE", 3, [0, 4, 8, 12, 1, 5, 9, 13, 2, 6, 10, 14, 3, 7, 11, 15]], ["CA", 2, 3, 11], ["CHR", 1, "shared", [2]], ["CA", 2, 3, 12], ["CHR", 0, "shared", [3]], ["CA", 1, 4, 12], ["FU", 5, [0, 1, 2, 3]], ["AN", 5, 0, 5], ["FU", 5, [1, 2, 3, 4]], ["AN", 5, 1, 4], ["FU", 5, [2, 3, 4, 5]], ["AN", 5, 2, 6], ["FU", 3, [0, 1, 2, 3]], ["SP", 3, 0, 2, [2], 1], ["AN", 3, 1, 2], ["FFSP", 3, 0, [4, 3, 2, 1], 1, 1], ["AN", 3, 1, 6], ["FU", 1, [0, 1, 2, 3]], ["SP", 1, 0, 16, [1], 1], ["AN", 1, 1, 2], ["FFSP", 1, 0, [4, 3, 2, 1], 1, 1], ["AN", 1, 1, 6], ["PR", 4, 0, "auto_unroll_max_step$0"]]]], "r": [[0.000218769], 0, 2.10088, 1669209198], "v": "v0.6"}
{"i": [["[\"get_expr\", \"batch_matmul_4d_4d_expr\", [64, 12, 64, 1, 64]]", "cuda -keys=cuda,gpu -max_num_threads=1024 -thread_warp_size=32", [-1, 16, 64, 49152, 2147483647, 1024, 8, 32], "", 0, []], [[], [["CHW", 2, "local"], ["SP", 2, 0, 64, [1, 2, 1, 1], 1], ["SP", 2, 5, 12, [3, 2, 2, 1], 1], ["SP", 2, 10, 64, [2, 32, 1, 1], 1], ["SP", 2, 15, 1, [1, 1, 1, 1], 1], ["SP", 2, 20, 64, [1, 1], 1], ["RE", 2, [0, 5, 10, 15, 1, 6, 11, 16, 2, 7, 12, 17, 20, 21, 3, 8, 13, 18, 22, 4, 9, 14, 19]], ["FSP", 3, 0, 1, 3], ["FSP", 3, 4, 2, 3], ["FSP", 3, 8, 3, 3], ["FSP", 3, 12, 4, 3], ["RE", 3, [0, 4, 8, 12, 1, 5, 9, 13, 2, 6, 10, 14, 3, 7, 11, 15]], ["CA", 2, 3, 11], ["CHR", 1, "shared", [2]], ["CA", 2, 3, 12], ["CHR", 0, "shared", [3]], ["CA", 1, 4, 12], ["FU", 5, [0, 1, 2, 3]], ["AN", 5, 0, 5], ["FU", 5, [1, 2, 3, 4]], ["AN", 5, 1, 4], ["FU", 5, [2, 3, 4, 5]], ["AN", 5, 2, 6], ["FU", 3, [0, 1, 2, 3]], ["SP", 3, 0, 8, [1], 1], ["AN", 3, 1, 2], ["FFSP", 3, 0, [4, 3, 2, 1], 1, 1], ["AN", 3, 1, 6], ["FU", 1, [0, 1, 2, 3]], ["SP", 1, 0, 8, [1], 1], ["AN", 1, 1, 2], ["FFSP", 1, 0, [4, 3, 2, 1], 1, 1], ["AN", 1, 1, 6], ["PR", 4, 0, "auto_unroll_max_step$0"]]]], "r": [[0.000175083], 0, 1.94366, 1669209200], "v": "v0.6"}
{"i": [["[\"get_expr\", \"batch_matmul_4d_4d_expr\", [64, 12, 64, 1, 64]]", "cuda -keys=cuda,gpu -max_num_threads=1024 -thread_warp_size=32", [-1, 16, 64, 49152, 2147483647, 1024, 8, 32], "", 0, []], [[], [["CHW", 2, "local"], ["SP", 2, 0, 64, [1, 8, 4, 2], 1], ["SP", 2, 5, 12, [2, 2, 1, 1], 1], ["SP", 2, 10, 64, [1, 4, 1, 1], 1], ["SP", 2, 15, 1, [1, 1, 1, 1], 1], ["SP", 2, 20, 64, [1, 1], 1], ["RE", 2, [0, 5, 10, 15, 1, 6, 11, 16, 2, 7, 12, 17, 20, 21, 3, 8, 13, 18, 22, 4, 9, 14, 19]], ["FSP", 3, 0, 1, 3], ["FSP", 3, 4, 2, 3], ["FSP", 3, 8, 3, 3], ["FSP", 3, 12, 4, 3], ["RE", 3, [0, 4, 8, 12, 1, 5, 9, 13, 2, 6, 10, 14, 3, 7, 11, 15]], ["CA", 2, 3, 11], ["CHR", 1, "shared", [2]], ["CA", 2, 3, 12], ["CHR", 0, "shared", [3]], ["CA", 1, 4, 12], ["FU", 5, [0, 1, 2, 3]], ["AN", 5, 0, 5], ["FU", 5, [1, 2, 3, 4]], ["AN", 5, 1, 4], ["FU", 5, [2, 3, 4, 5]], ["AN", 5, 2, 6], ["FU", 3, [0, 1, 2, 3]], ["SP", 3, 0, 24, [1], 1], ["AN", 3, 1, 2], ["FFSP", 3, 0, [4, 3, 2, 1], 1, 1], ["AN", 3, 1, 6], ["FU", 1, [0, 1, 2, 3]], ["SP", 1, 0, 24, [1], 1], ["AN", 1, 1, 2], ["FFSP", 1, 0, [4, 3, 2, 1], 1, 1], ["AN", 1, 1, 6], ["PR", 4, 0, "auto_unroll_max_step$0"]]]], "r": [[0.000184231], 0, 1.98164, 1669209201], "v": "v0.6"}
{"i": [["[\"get_expr\", \"batch_matmul_4d_4d_expr\", [64, 12, 64, 1, 64]]", "cuda -keys=cuda,gpu -max_num_threads=1024 -thread_warp_size=32", [-1, 16, 64, 49152, 2147483647, 1024, 8, 32], "", 0, []], [[], [["CHW", 2, "local"], ["SP", 2, 0, 64, [1, 16, 1, 1], 1], ["SP", 2, 5, 12, [2, 2, 1, 1], 1], ["SP", 2, 10, 64, [2, 8, 1, 1], 1], ["SP", 2, 15, 1, [1, 1, 1, 1], 1], ["SP", 2, 20, 64, [2, 2], 1], ["RE", 2, [0, 5, 10, 15, 1, 6, 11, 16, 2, 7, 12, 17, 20, 21, 3, 8, 13, 18, 22, 4, 9, 14, 19]], ["FSP", 3, 0, 1, 3], ["FSP", 3, 4, 2, 3], ["FSP", 3, 8, 3, 3], ["FSP", 3, 12, 4, 3], ["RE", 3, [0, 4, 8, 12, 1, 5, 9, 13, 2, 6, 10, 14, 3, 7, 11, 15]], ["CA", 2, 3, 11], ["CHR", 1, "shared", [2]], ["CA", 2, 3, 12], ["CHR", 0, "shared", [3]], ["CA", 1, 4, 12], ["FU", 5, [0, 1, 2, 3]], ["AN", 5, 0, 5], ["FU", 5, [1, 2, 3, 4]], ["AN", 5, 1, 4], ["FU", 5, [2, 3, 4, 5]], ["AN", 5, 2, 6], ["FU", 3, [0, 1, 2, 3]], ["SP", 3, 0, 8, [8], 1], ["AN", 3, 1, 2], ["FFSP", 3, 0, [4, 3, 2, 1], 1, 1], ["AN", 3, 1, 6], ["FU", 1, [0, 1, 2, 3]], ["SP", 1, 0, 8, [1], 1], ["AN", 1, 1, 2], ["FFSP", 1, 0, [4, 3, 2, 1], 1, 1], ["AN", 1, 1, 6], ["PR", 4, 0, "auto_unroll_max_step$1024"]]]], "r": [[5.01315e-05], 0, 2.91703, 1669209203], "v": "v0.6"}
{"i": [["[\"get_expr\", \"batch_matmul_4d_4d_expr\", [64, 12, 64, 1, 64]]", "cuda -keys=cuda,gpu -max_num_threads=1024 -thread_warp_size=32", [-1, 16, 64, 49152, 2147483647, 1024, 8, 32], "", 0, []], [[], [["CHW", 2, "local"], ["SP", 2, 0, 64, [1, 16, 1, 1], 1], ["SP", 2, 5, 12, [1, 6, 1, 1], 1], ["SP", 2, 10, 64, [2, 8, 1, 1], 1], ["SP", 2, 15, 1, [1, 1, 1, 1], 1], ["SP", 2, 20, 64, [4, 1], 1], ["RE", 2, [0, 5, 10, 15, 1, 6, 11, 16, 2, 7, 12, 17, 20, 21, 3, 8, 13, 18, 22, 4, 9, 14, 19]], ["FSP", 3, 0, 1, 3], ["FSP", 3, 4, 2, 3], ["FSP", 3, 8, 3, 3], ["FSP", 3, 12, 4, 3], ["RE", 3, [0, 4, 8, 12, 1, 5, 9, 13, 2, 6, 10, 14, 3, 7, 11, 15]], ["CA", 2, 3, 11], ["CHR", 1, "shared", [2]], ["CA", 2, 3, 12], ["CHR", 0, "shared", [3]], ["CA", 1, 4, 12], ["FU", 5, [0, 1, 2, 3]], ["AN", 5, 0, 5], ["FU", 5, [1, 2, 3, 4]], ["AN", 5, 1, 4], ["FU", 5, [2, 3, 4, 5]], ["AN", 5, 2, 6], ["FU", 3, [0, 1, 2, 3]], ["SP", 3, 0, 8, [1], 1], ["AN", 3, 1, 2], ["FFSP", 3, 0, [4, 3, 2, 1], 1, 1], ["AN", 3, 1, 6], ["FU", 1, [0, 1, 2, 3]], ["SP", 1, 0, 8, [2], 1], ["AN", 1, 1, 2], ["FFSP", 1, 0, [4, 3, 2, 1], 1, 1], ["AN", 1, 1, 6], ["PR", 4, 0, "auto_unroll_max_step$0"]]]], "r": [[4.61274e-05], 0, 1.97464, 1669209204], "v": "v0.6"}
{"i": [["[\"get_expr\", \"batch_matmul_4d_4d_expr\", [64, 12, 64, 1, 64]]", "cuda -keys=cuda,gpu -max_num_threads=1024 -thread_warp_size=32", [-1, 16, 64, 49152, 2147483647, 1024, 8, 32], "", 0, []], [[], [["CHW", 2, "local"], ["SP", 2, 0, 64, [2, 4, 4, 1], 1], ["SP", 2, 5, 12, [1, 3, 1, 4], 1], ["SP", 2, 10, 64, [2, 2, 1, 1], 1], ["SP", 2, 15, 1, [1, 1, 1, 1], 1], ["SP", 2, 20, 64, [2, 1], 1], ["RE", 2, [0, 5, 10, 15, 1, 6, 11, 16, 2, 7, 12, 17, 20, 21, 3, 8, 13, 18, 22, 4, 9, 14, 19]], ["FSP", 3, 0, 1, 3], ["FSP", 3, 4, 2, 3], ["FSP", 3, 8, 3, 3], ["FSP", 3, 12, 4, 3], ["RE", 3, [0, 4, 8, 12, 1, 5, 9, 13, 2, 6, 10, 14, 3, 7, 11, 15]], ["CA", 2, 3, 11], ["CHR", 1, "shared", [2]], ["CA", 2, 3, 12], ["CHR", 0, "shared", [3]], ["CA", 1, 4, 12], ["FU", 5, [0, 1, 2, 3]], ["AN", 5, 0, 5], ["FU", 5, [1, 2, 3, 4]], ["AN", 5, 1, 4], ["FU", 5, [2, 3, 4, 5]], ["AN", 5, 2, 6], ["FU", 3, [0, 1, 2, 3]], ["SP", 3, 0, 32, [1], 1], ["AN", 3, 1, 2], ["FFSP", 3, 0, [4, 3, 2, 1], 1, 1], ["AN", 3, 1, 6], ["FU", 1, [0, 1, 2, 3]], ["SP", 1, 0, 32, [1], 1], ["AN", 1, 1, 2], ["FFSP", 1, 0, [4, 3, 2, 1], 1, 1], ["AN", 1, 1, 6], ["PR", 4, 0, "auto_unroll_max_step$512"]]]], "r": [[0.000170616], 0, 2.8844, 1669209205], "v": "v0.6"}
{"i": [["[\"get_expr\", \"batch_matmul_4d_4d_expr\", [64, 12, 64, 1, 64]]", "cuda -keys=cuda,gpu -max_num_threads=1024 -thread_warp_size=32", [-1, 16, 64, 49152, 2147483647, 1024, 8, 32], "", 0, []], [[], [["CHW", 2, "local"], ["SP", 2, 0, 64, [1, 4, 2, 1], 1], ["SP", 2, 5, 12, [3, 1, 2, 1], 1], ["SP", 2, 10, 64, [1, 16, 2, 2], 1], ["SP", 2, 15, 1, [1, 1, 1, 1], 1], ["SP", 2, 20, 64, [1, 2], 1], ["RE", 2, [0, 5, 10, 15, 1, 6, 11, 16, 2, 7, 12, 17, 20, 21, 3, 8, 13, 18, 22, 4, 9, 14, 19]], ["FSP", 3, 0, 1, 3], ["FSP", 3, 4, 2, 3], ["FSP", 3, 8, 3, 3], ["FSP", 3, 12, 4, 3], ["RE", 3, [0, 4, 8, 12, 1, 5, 9, 13, 2, 6, 10, 14, 3, 7, 11, 15]], ["CA", 2, 3, 11], ["CHR", 1, "shared", [2]], ["CA", 2, 3, 12], ["CHR", 0, "shared", [3]], ["CA", 1, 4, 12], ["FU", 5, [0, 1, 2, 3]], ["AN", 5, 0, 5], ["FU", 5, [1, 2, 3, 4]], ["AN", 5, 1, 4], ["FU", 5, [2, 3, 4, 5]], ["AN", 5, 2, 6], ["FU", 3, [0, 1, 2, 3]], ["SP", 3, 0, 4, [1], 1], ["AN", 3, 1, 2], ["FFSP", 3, 0, [4, 3, 2, 1], 1, 1], ["AN", 3, 1, 6], ["FU", 1, [0, 1, 2, 3]], ["SP", 1, 0, 16, [1], 1], ["AN", 1, 1, 2], ["FFSP", 1, 0, [4, 3, 2, 1], 1, 1], ["AN", 1, 1, 6], ["PR", 4, 0, "auto_unroll_max_step$512"]]]], "r": [[0.000177097], 0, 2.85314, 1669209207], "v": "v0.6"}
{"i": [["[\"get_expr\", \"batch_matmul_4d_4d_expr\", [64, 12, 64, 1, 64]]", "cuda -keys=cuda,gpu -max_num_threads=1024 -thread_warp_size=32", [-1, 16, 64, 49152, 2147483647, 1024, 8, 32], "", 0, []], [[], [["CHW", 2, "local"], ["SP", 2, 0, 64, [1, 4, 1, 2], 1], ["SP", 2, 5, 12, [1, 1, 1, 2], 1], ["SP", 2, 10, 64, [1, 8, 2, 2], 1], ["SP", 2, 15, 1, [1, 1, 1, 1], 1], ["SP", 2, 20, 64, [4, 2], 1], ["RE", 2, [0, 5, 10, 15, 1, 6, 11, 16, 2, 7, 12, 17, 20, 21, 3, 8, 13, 18, 22, 4, 9, 14, 19]], ["FSP", 3, 0, 1, 3], ["FSP", 3, 4, 2, 3], ["FSP", 3, 8, 3, 3], ["FSP", 3, 12, 4, 3], ["RE", 3, [0, 4, 8, 12, 1, 5, 9, 13, 2, 6, 10, 14, 3, 7, 11, 15]], ["CA", 2, 3, 11], ["CHR", 1, "shared", [2]], ["CA", 2, 3, 12], ["CHR", 0, "shared", [3]], ["CA", 1, 4, 12], ["FU", 5, [0, 1, 2, 3]], ["AN", 5, 0, 5], ["FU", 5, [1, 2, 3, 4]], ["AN", 5, 1, 4], ["FU", 5, [2, 3, 4, 5]], ["AN", 5, 2, 6], ["FU", 3, [0, 1, 2, 3]], ["SP", 3, 0, 64, [64], 1], ["AN", 3, 1, 2], ["FFSP", 3, 0, [4, 3, 2, 1], 1, 1], ["AN", 3, 1, 6], ["FU", 1, [0, 1, 2, 3]], ["SP", 1, 0, 256, [4], 1], ["AN", 1, 1, 2], ["FFSP", 1, 0, [4, 3, 2, 1], 1, 1], ["AN", 1, 1, 6], ["PR", 4, 0, "auto_unroll_max_step$1024"]]]], "r": [[4.61597e-05], 0, 2.66113, 1669209209], "v": "v0.6"}
{"i": [["[\"get_expr\", \"batch_matmul_4d_4d_expr\", [64, 12, 64, 1, 64]]", "cuda -keys=cuda,gpu -max_num_threads=1024 -thread_warp_size=32", [-1, 16, 64, 49152, 2147483647, 1024, 8, 32], "", 0, []], [[], [["CHW", 2, "local"], ["SP", 2, 0, 64, [2, 2, 4, 2], 1], ["SP", 2, 5, 12, [1, 2, 1, 3], 1], ["SP", 2, 10, 64, [1, 8, 1, 1], 1], ["SP", 2, 15, 1, [1, 1, 1, 1], 1], ["SP", 2, 20, 64, [4, 1], 1], ["RE", 2, [0, 5, 10, 15, 1, 6, 11, 16, 2, 7, 12, 17, 20, 21, 3, 8, 13, 18, 22, 4, 9, 14, 19]], ["FSP", 3, 0, 1, 3], ["FSP", 3, 4, 2, 3], ["FSP", 3, 8, 3, 3], ["FSP", 3, 12, 4, 3], ["RE", 3, [0, 4, 8, 12, 1, 5, 9, 13, 2, 6, 10, 14, 3, 7, 11, 15]], ["CA", 2, 3, 11], ["CHR", 1, "shared", [2]], ["CA", 2, 3, 12], ["CHR", 0, "shared", [3]], ["CA", 1, 4, 12], ["FU", 5, [0, 1, 2, 3]], ["AN", 5, 0, 5], ["FU", 5, [1, 2, 3, 4]], ["AN", 5, 1, 4], ["FU", 5, [2, 3, 4, 5]], ["AN", 5, 2, 6], ["FU", 3, [0, 1, 2, 3]], ["SP", 3, 0, 96, [1], 1], ["AN", 3, 1, 2], ["FFSP", 3, 0, [4, 3, 2, 1], 1, 1], ["AN", 3, 1, 6], ["FU", 1, [0, 1, 2, 3]], ["SP", 1, 0, 96, [1], 1], ["AN", 1, 1, 2], ["FFSP", 1, 0, [4, 3, 2, 1], 1, 1], ["AN", 1, 1, 6], ["PR", 4, 0, "auto_unroll_max_step$512"]]]], "r": [[8.05975e-05], 0, 3.20633, 1669209210], "v": "v0.6"}
