artifacts/microbenchmark/tvm/ansor/reduction/ansor_reduction_65536_1024_axis_1.log
{"i": [["[\"reduction_layer\", [65536, 1024], 1, false]", "cuda -keys=cuda,gpu -max_num_threads=1024 -thread_warp_size=32", [-1, 16, 64, 49152, 2147483647, 1024, 8, 32], "", 0, []], [[], [["SP", 1, 0, 65536, [1], 1], ["AN", 1, 0, 5], ["AN", 1, 1, 6], ["PR", 1, 0, "auto_unroll_max_step$64"]]]], "r": [[0.0012541], 0, 2.24391, 1639291406], "v": "v0.6"}
{"i": [["[\"reduction_layer\", [65536, 1024], 1, false]", "cuda -keys=cuda,gpu -max_num_threads=1024 -thread_warp_size=32", [-1, 16, 64, 49152, 2147483647, 1024, 8, 32], "", 0, []], [[], [["SP", 1, 1, 1024, [8], 1], ["AN", 1, 2, 6], ["AN", 1, 0, 5], ["PR", 1, 0, "auto_unroll_max_step$1024"]]]], "r": [[0.000329841], 0, 2.35666, 1639291408], "v": "v0.6"}
{"i": [["[\"reduction_layer\", [65536, 1024], 1, false]", "cuda -keys=cuda,gpu -max_num_threads=1024 -thread_warp_size=32", [-1, 16, 64, 49152, 2147483647, 1024, 8, 32], "", 0, []], [[], [["SP", 1, 1, 1024, [64], 1], ["AN", 1, 2, 6], ["AN", 1, 0, 5], ["PR", 1, 0, "auto_unroll_max_step$16"]]]], "r": [[0.000305879], 0, 2.37078, 1639291410], "v": "v0.6"}
{"i": [["[\"reduction_layer\", [65536, 1024], 1, false]", "cuda -keys=cuda,gpu -max_num_threads=1024 -thread_warp_size=32", [-1, 16, 64, 49152, 2147483647, 1024, 8, 32], "", 0, []], [[], [["SP", 1, 0, 65536, [64], 1], ["AN", 1, 0, 5], ["AN", 1, 1, 6], ["PR", 1, 0, "auto_unroll_max_step$512"]]]], "r": [[0.000636927], 0, 2.43896, 1639291412], "v": "v0.6"}
{"i": [["[\"reduction_layer\", [65536, 1024], 1, false]", "cuda -keys=cuda,gpu -max_num_threads=1024 -thread_warp_size=32", [-1, 16, 64, 49152, 2147483647, 1024, 8, 32], "", 0, []], [[], [["SP", 1, 1, 1024, [2], 1], ["AN", 1, 2, 6], ["AN", 1, 0, 5], ["PR", 1, 0, "auto_unroll_max_step$16"]]]], "r": [[0.000800121], 0, 2.34622, 1639291414], "v": "v0.6"}
{"i": [["[\"reduction_layer\", [65536, 1024], 1, false]", "cuda -keys=cuda,gpu -max_num_threads=1024 -thread_warp_size=32", [-1, 16, 64, 49152, 2147483647, 1024, 8, 32], "", 0, []], [[], [["SP", 1, 1, 1024, [16], 1], ["AN", 1, 2, 6], ["AN", 1, 0, 5], ["PR", 1, 0, "auto_unroll_max_step$64"]]]], "r": [[0.000306354], 0, 2.40067, 1639291416], "v": "v0.6"}
{"i": [["[\"reduction_layer\", [65536, 1024], 1, false]", "cuda -keys=cuda,gpu -max_num_threads=1024 -thread_warp_size=32", [-1, 16, 64, 49152, 2147483647, 1024, 8, 32], "", 0, []], [[], [["SP", 1, 0, 65536, [64], 1], ["AN", 1, 0, 5], ["AN", 1, 1, 6], ["PR", 1, 0, "auto_unroll_max_step$1024"]]]], "r": [[0.00063694], 0, 2.34533, 1639291418], "v": "v0.6"}
{"i": [["[\"reduction_layer\", [65536, 1024], 1, false]", "cuda -keys=cuda,gpu -max_num_threads=1024 -thread_warp_size=32", [-1, 16, 64, 49152, 2147483647, 1024, 8, 32], "", 0, []], [[], [["SP", 1, 1, 1024, [1], 1], ["AN", 1, 2, 6], ["AN", 1, 0, 5], ["PR", 1, 0, "auto_unroll_max_step$0"]]]], "r": [[0.00128005], 0, 2.37836, 1639291420], "v": "v0.6"}
{"i": [["[\"reduction_layer\", [65536, 1024], 1, false]", "cuda -keys=cuda,gpu -max_num_threads=1024 -thread_warp_size=32", [-1, 16, 64, 49152, 2147483647, 1024, 8, 32], "", 0, []], [[], [["SP", 1, 1, 1024, [32], 1], ["AN", 1, 2, 6], ["AN", 1, 0, 5], ["PR", 1, 0, "auto_unroll_max_step$512"]]]], "r": [[0.000305581], 0, 2.43455, 1639291422], "v": "v0.6"}
{"i": [["[\"reduction_layer\", [65536, 1024], 1, false]", "cuda -keys=cuda,gpu -max_num_threads=1024 -thread_warp_size=32", [-1, 16, 64, 49152, 2147483647, 1024, 8, 32], "", 0, []], [[], [["SP", 1, 1, 1024, [64], 1], ["AN", 1, 2, 6], ["AN", 1, 0, 5], ["PR", 1, 0, "auto_unroll_max_step$1024"]]]], "r": [[0.000305921], 0, 2.36352, 1639291424], "v": "v0.6"}
{"i": [["[\"reduction_layer\", [65536, 1024], 1, false]", "cuda -keys=cuda,gpu -max_num_threads=1024 -thread_warp_size=32", [-1, 16, 64, 49152, 2147483647, 1024, 8, 32], "", 0, []], [[], [["SP", 1, 1, 1024, [4], 1], ["AN", 1, 2, 6], ["AN", 1, 0, 5], ["PR", 1, 0, "auto_unroll_max_step$512"]]]], "r": [[0.000465997], 0, 2.37162, 1639291426], "v": "v0.6"}
{"i": [["[\"reduction_layer\", [65536, 1024], 1, false]", "cuda -keys=cuda,gpu -max_num_threads=1024 -thread_warp_size=32", [-1, 16, 64, 49152, 2147483647, 1024, 8, 32], "", 0, []], [[], [["SP", 1, 0, 65536, [64], 1], ["AN", 1, 0, 5], ["AN", 1, 1, 6], ["PR", 1, 0, "auto_unroll_max_step$64"]]]], "r": [[0.000637545], 0, 2.36703, 1639291428], "v": "v0.6"}
{"i": [["[\"reduction_layer\", [65536, 1024], 1, false]", "cuda -keys=cuda,gpu -max_num_threads=1024 -thread_warp_size=32", [-1, 16, 64, 49152, 2147483647, 1024, 8, 32], "", 0, []], [[], [["SP", 1, 0, 65536, [2], 1], ["AN", 1, 0, 5], ["AN", 1, 1, 6], ["PR", 1, 0, "auto_unroll_max_step$0"]]]], "r": [[0.000783604], 0, 2.35135, 1639291430], "v": "v0.6"}
{"i": [["[\"reduction_layer\", [65536, 1024], 1, false]", "cuda -keys=cuda,gpu -max_num_threads=1024 -thread_warp_size=32", [-1, 16, 64, 49152, 2147483647, 1024, 8, 32], "", 0, []], [[], [["SP", 1, 0, 65536, [2], 1], ["AN", 1, 0, 5], ["AN", 1, 1, 6], ["PR", 1, 0, "auto_unroll_max_step$512"]]]], "r": [[0.000783408], 0, 2.4427, 1639291432], "v": "v0.6"}
{"i": [["[\"reduction_layer\", [65536, 1024], 1, false]", "cuda -keys=cuda,gpu -max_num_threads=1024 -thread_warp_size=32", [-1, 16, 64, 49152, 2147483647, 1024, 8, 32], "", 0, []], [[], [["SP", 1, 1, 1024, [32], 1], ["AN", 1, 2, 6], ["AN", 1, 0, 5], ["PR", 1, 0, "auto_unroll_max_step$64"]]]], "r": [[0.000305599], 0, 2.38792, 1639291434], "v": "v0.6"}
{"i": [["[\"reduction_layer\", [65536, 1024], 1, false]", "cuda -keys=cuda,gpu -max_num_threads=1024 -thread_warp_size=32", [-1, 16, 64, 49152, 2147483647, 1024, 8, 32], "", 0, []], [[], [["SP", 1, 1, 1024, [2], 1], ["AN", 1, 2, 6], ["AN", 1, 0, 5], ["PR", 1, 0, "auto_unroll_max_step$1024"]]]], "r": [[0.000800131], 0, 2.33585, 1639291436], "v": "v0.6"}
{"i": [["[\"reduction_layer\", [65536, 1024], 1, false]", "cuda -keys=cuda,gpu -max_num_threads=1024 -thread_warp_size=32", [-1, 16, 64, 49152, 2147483647, 1024, 8, 32], "", 0, []], [[], [["SP", 1, 1, 1024, [8], 1], ["AN", 1, 2, 6], ["AN", 1, 0, 5], ["PR", 1, 0, "auto_unroll_max_step$64"]]]], "r": [[0.000329751], 0, 2.3473, 1639291438], "v": "v0.6"}
{"i": [["[\"reduction_layer\", [65536, 1024], 1, false]", "cuda -keys=cuda,gpu -max_num_threads=1024 -thread_warp_size=32", [-1, 16, 64, 49152, 2147483647, 1024, 8, 32], "", 0, []], [[], [["SP", 1, 1, 1024, [64], 1], ["AN", 1, 2, 6], ["AN", 1, 0, 5], ["PR", 1, 0, "auto_unroll_max_step$0"]]]], "r": [[0.000305865], 0, 2.41168, 1639291440], "v": "v0.6"}
{"i": [["[\"reduction_layer\", [65536, 1024], 1, false]", "cuda -keys=cuda,gpu -max_num_threads=1024 -thread_warp_size=32", [-1, 16, 64, 49152, 2147483647, 1024, 8, 32], "", 0, []], [[], [["SP", 1, 0, 65536, [4], 1], ["AN", 1, 0, 5], ["AN", 1, 1, 6], ["PR", 1, 0, "auto_unroll_max_step$64"]]]], "r": [[0.000631068], 0, 2.42083, 1639291442], "v": "v0.6"}
{"i": [["[\"reduction_layer\", [65536, 1024], 1, false]", "cuda -keys=cuda,gpu -max_num_threads=1024 -thread_warp_size=32", [-1, 16, 64, 49152, 2147483647, 1024, 8, 32], "", 0, []], [[], [["SP", 1, 0, 65536, [1], 1], ["AN", 1, 0, 5], ["AN", 1, 1, 6], ["PR", 1, 0, "auto_unroll_max_step$0"]]]], "r": [[0.00125404], 0, 2.37638, 1639291444], "v": "v0.6"}
{"i": [["[\"reduction_layer\", [65536, 1024], 1, false]", "cuda -keys=cuda,gpu -max_num_threads=1024 -thread_warp_size=32", [-1, 16, 64, 49152, 2147483647, 1024, 8, 32], "", 0, []], [[], [["SP", 1, 0, 65536, [4], 1], ["AN", 1, 0, 5], ["AN", 1, 1, 6], ["PR", 1, 0, "auto_unroll_max_step$0"]]]], "r": [[0.000631041], 0, 2.36432, 1639291446], "v": "v0.6"}
{"i": [["[\"reduction_layer\", [65536, 1024], 1, false]", "cuda -keys=cuda,gpu -max_num_threads=1024 -thread_warp_size=32", [-1, 16, 64, 49152, 2147483647, 1024, 8, 32], "", 0, []], [[], [["SP", 1, 1, 1024, [8], 1], ["AN", 1, 2, 6], ["AN", 1, 0, 5], ["PR", 1, 0, "auto_unroll_max_step$512"]]]], "r": [[0.000329745], 0, 2.36843, 1639291448], "v": "v0.6"}
{"i": [["[\"reduction_layer\", [65536, 1024], 1, false]", "cuda -keys=cuda,gpu -max_num_threads=1024 -thread_warp_size=32", [-1, 16, 64, 49152, 2147483647, 1024, 8, 32], "", 0, []], [[], [["SP", 1, 1, 1024, [1], 1], ["AN", 1, 2, 6], ["AN", 1, 0, 5], ["PR", 1, 0, "auto_unroll_max_step$64"]]]], "r": [[0.00128008], 0, 2.40698, 1639291450], "v": "v0.6"}
{"i": [["[\"reduction_layer\", [65536, 1024], 1, false]", "cuda -keys=cuda,gpu -max_num_threads=1024 -thread_warp_size=32", [-1, 16, 64, 49152, 2147483647, 1024, 8, 32], "", 0, []], [[], [["SP", 1, 1, 1024, [16], 1], ["AN", 1, 2, 6], ["AN", 1, 0, 5], ["PR", 1, 0, "auto_unroll_max_step$16"]]]], "r": [[0.000306324], 0, 2.36964, 1639291452], "v": "v0.6"}
{"i": [["[\"reduction_layer\", [65536, 1024], 1, false]", "cuda -keys=cuda,gpu -max_num_threads=1024 -thread_warp_size=32", [-1, 16, 64, 49152, 2147483647, 1024, 8, 32], "", 0, []], [[], [["SP", 1, 0, 65536, [8], 1], ["AN", 1, 0, 5], ["AN", 1, 1, 6], ["PR", 1, 0, "auto_unroll_max_step$64"]]]], "r": [[0.000644554], 0, 1.83511, 1639291454], "v": "v0.6"}
{"i": [["[\"reduction_layer\", [65536, 1024], 1, false]", "cuda -keys=cuda,gpu -max_num_threads=1024 -thread_warp_size=32", [-1, 16, 64, 49152, 2147483647, 1024, 8, 32], "", 0, []], [[], [["SP", 1, 1, 1024, [1], 1], ["AN", 1, 2, 6], ["AN", 1, 0, 5], ["PR", 1, 0, "auto_unroll_max_step$16"]]]], "r": [[0.00128004], 0, 2.32549, 1639291456], "v": "v0.6"}
{"i": [["[\"reduction_layer\", [65536, 1024], 1, false]", "cuda -keys=cuda,gpu -max_num_threads=1024 -thread_warp_size=32", [-1, 16, 64, 49152, 2147483647, 1024, 8, 32], "", 0, []], [[], [["SP", 1, 1, 1024, [64], 1], ["AN", 1, 2, 6], ["AN", 1, 0, 5], ["PR", 1, 0, "auto_unroll_max_step$512"]]]], "r": [[0.000305827], 0, 2.3565, 1639291458], "v": "v0.6"}
{"i": [["[\"reduction_layer\", [65536, 1024], 1, false]", "cuda -keys=cuda,gpu -max_num_threads=1024 -thread_warp_size=32", [-1, 16, 64, 49152, 2147483647, 1024, 8, 32], "", 0, []], [[], [["SP", 1, 1, 1024, [8], 1], ["AN", 1, 2, 6], ["AN", 1, 0, 5], ["PR", 1, 0, "auto_unroll_max_step$16"]]]], "r": [[0.000329751], 0, 2.33075, 1639291460], "v": "v0.6"}
{"i": [["[\"reduction_layer\", [65536, 1024], 1, false]", "cuda -keys=cuda,gpu -max_num_threads=1024 -thread_warp_size=32", [-1, 16, 64, 49152, 2147483647, 1024, 8, 32], "", 0, []], [[], [["SP", 1, 1, 1024, [2], 1], ["AN", 1, 2, 6], ["AN", 1, 0, 5], ["PR", 1, 0, "auto_unroll_max_step$512"]]]], "r": [[0.000800084], 0, 2.3486, 1639291462], "v": "v0.6"}
{"i": [["[\"reduction_layer\", [65536, 1024], 1, false]", "cuda -keys=cuda,gpu -max_num_threads=1024 -thread_warp_size=32", [-1, 16, 64, 49152, 2147483647, 1024, 8, 32], "", 0, []], [[], [["SP", 1, 0, 65536, [64], 1], ["AN", 1, 0, 5], ["AN", 1, 1, 6], ["PR", 1, 0, "auto_unroll_max_step$0"]]]], "r": [[0.000637274], 0, 2.31516, 1639291464], "v": "v0.6"}
{"i": [["[\"reduction_layer\", [65536, 1024], 1, false]", "cuda -keys=cuda,gpu -max_num_threads=1024 -thread_warp_size=32", [-1, 16, 64, 49152, 2147483647, 1024, 8, 32], "", 0, []], [[], [["SP", 1, 0, 65536, [2], 1], ["AN", 1, 0, 5], ["AN", 1, 1, 6], ["PR", 1, 0, "auto_unroll_max_step$16"]]]], "r": [[0.000783747], 0, 2.35061, 1639291466], "v": "v0.6"}
{"i": [["[\"reduction_layer\", [65536, 1024], 1, false]", "cuda -keys=cuda,gpu -max_num_threads=1024 -thread_warp_size=32", [-1, 16, 64, 49152, 2147483647, 1024, 8, 32], "", 0, []], [[], [["SP", 1, 1, 1024, [64], 1], ["AN", 1, 2, 6], ["AN", 1, 0, 5], ["PR", 1, 0, "auto_unroll_max_step$64"]]]], "r": [[0.000305801], 0, 2.3786, 1639291468], "v": "v0.6"}
{"i": [["[\"reduction_layer\", [65536, 1024], 1, false]", "cuda -keys=cuda,gpu -max_num_threads=1024 -thread_warp_size=32", [-1, 16, 64, 49152, 2147483647, 1024, 8, 32], "", 0, []], [[], [["SP", 1, 1, 1024, [1], 1], ["AN", 1, 2, 6], ["AN", 1, 0, 5], ["PR", 1, 0, "auto_unroll_max_step$512"]]]], "r": [[0.00128018], 0, 2.38761, 1639291470], "v": "v0.6"}
{"i": [["[\"reduction_layer\", [65536, 1024], 1, false]", "cuda -keys=cuda,gpu -max_num_threads=1024 -thread_warp_size=32", [-1, 16, 64, 49152, 2147483647, 1024, 8, 32], "", 0, []], [[], [["SP", 1, 0, 65536, [16], 1], ["AN", 1, 0, 5], ["AN", 1, 1, 6], ["PR", 1, 0, "auto_unroll_max_step$512"]]]], "r": [[0.000714639], 0, 2.33794, 1639291472], "v": "v0.6"}
{"i": [["[\"reduction_layer\", [65536, 1024], 1, false]", "cuda -keys=cuda,gpu -max_num_threads=1024 -thread_warp_size=32", [-1, 16, 64, 49152, 2147483647, 1024, 8, 32], "", 0, []], [[], [["SP", 1, 1, 1024, [16], 1], ["AN", 1, 2, 6], ["AN", 1, 0, 5], ["PR", 1, 0, "auto_unroll_max_step$1024"]]]], "r": [[0.000306317], 0, 2.35171, 1639291474], "v": "v0.6"}
{"i": [["[\"reduction_layer\", [65536, 1024], 1, false]", "cuda -keys=cuda,gpu -max_num_threads=1024 -thread_warp_size=32", [-1, 16, 64, 49152, 2147483647, 1024, 8, 32], "", 0, []], [[], [["SP", 1, 0, 65536, [32], 1], ["AN", 1, 0, 5], ["AN", 1, 1, 6], ["PR", 1, 0, "auto_unroll_max_step$16"]]]], "r": [[0.000637958], 0, 2.36914, 1639291476], "v": "v0.6"}
{"i": [["[\"reduction_layer\", [65536, 1024], 1, false]", "cuda -keys=cuda,gpu -max_num_threads=1024 -thread_warp_size=32", [-1, 16, 64, 49152, 2147483647, 1024, 8, 32], "", 0, []], [[], [["SP", 1, 0, 65536, [8], 1], ["AN", 1, 0, 5], ["AN", 1, 1, 6], ["PR", 1, 0, "auto_unroll_max_step$1024"]]]], "r": [[0.000644495], 0, 2.34865, 1639291478], "v": "v0.6"}
{"i": [["[\"reduction_layer\", [65536, 1024], 1, false]", "cuda -keys=cuda,gpu -max_num_threads=1024 -thread_warp_size=32", [-1, 16, 64, 49152, 2147483647, 1024, 8, 32], "", 0, []], [[], [["SP", 1, 0, 65536, [32], 1], ["AN", 1, 0, 5], ["AN", 1, 1, 6], ["PR", 1, 0, "auto_unroll_max_step$64"]]]], "r": [[0.000637488], 0, 2.31536, 1639291480], "v": "v0.6"}
{"i": [["[\"reduction_layer\", [65536, 1024], 1, false]", "cuda -keys=cuda,gpu -max_num_threads=1024 -thread_warp_size=32", [-1, 16, 64, 49152, 2147483647, 1024, 8, 32], "", 0, []], [[], [["SP", 1, 1, 1024, [16], 1], ["AN", 1, 2, 6], ["AN", 1, 0, 5], ["PR", 1, 0, "auto_unroll_max_step$0"]]]], "r": [[0.000306317], 0, 2.34864, 1639291482], "v": "v0.6"}
{"i": [["[\"reduction_layer\", [65536, 1024], 1, false]", "cuda -keys=cuda,gpu -max_num_threads=1024 -thread_warp_size=32", [-1, 16, 64, 49152, 2147483647, 1024, 8, 32], "", 0, []], [[], [["SP", 1, 0, 65536, [32], 1], ["AN", 1, 0, 5], ["AN", 1, 1, 6], ["PR", 1, 0, "auto_unroll_max_step$0"]]]], "r": [[0.000637803], 0, 2.31914, 1639291484], "v": "v0.6"}
{"i": [["[\"reduction_layer\", [65536, 1024], 1, false]", "cuda -keys=cuda,gpu -max_num_threads=1024 -thread_warp_size=32", [-1, 16, 64, 49152, 2147483647, 1024, 8, 32], "", 0, []], [[], [["SP", 1, 0, 65536, [8], 1], ["AN", 1, 0, 5], ["AN", 1, 1, 6], ["PR", 1, 0, "auto_unroll_max_step$16"]]]], "r": [[0.000644717], 0, 2.30962, 1639291486], "v": "v0.6"}
{"i": [["[\"reduction_layer\", [65536, 1024], 1, false]", "cuda -keys=cuda,gpu -max_num_threads=1024 -thread_warp_size=32", [-1, 16, 64, 49152, 2147483647, 1024, 8, 32], "", 0, []], [[], [["SP", 1, 1, 1024, [4], 1], ["AN", 1, 2, 6], ["AN", 1, 0, 5], ["PR", 1, 0, "auto_unroll_max_step$0"]]]], "r": [[0.000466035], 0, 2.30633, 1639291488], "v": "v0.6"}
{"i": [["[\"reduction_layer\", [65536, 1024], 1, false]", "cuda -keys=cuda,gpu -max_num_threads=1024 -thread_warp_size=32", [-1, 16, 64, 49152, 2147483647, 1024, 8, 32], "", 0, []], [[], [["SP", 1, 1, 1024, [16], 1], ["AN", 1, 2, 6], ["AN", 1, 0, 5], ["PR", 1, 0, "auto_unroll_max_step$512"]]]], "r": [[0.00030635], 0, 2.34792, 1639291490], "v": "v0.6"}
{"i": [["[\"reduction_layer\", [65536, 1024], 1, false]", "cuda -keys=cuda,gpu -max_num_threads=1024 -thread_warp_size=32", [-1, 16, 64, 49152, 2147483647, 1024, 8, 32], "", 0, []], [[], [["SP", 1, 0, 65536, [4], 1], ["AN", 1, 0, 5], ["AN", 1, 1, 6], ["PR", 1, 0, "auto_unroll_max_step$1024"]]]], "r": [[0.000631118], 0, 2.35742, 1639291492], "v": "v0.6"}
{"i": [["[\"reduction_layer\", [65536, 1024], 1, false]", "cuda -keys=cuda,gpu -max_num_threads=1024 -thread_warp_size=32", [-1, 16, 64, 49152, 2147483647, 1024, 8, 32], "", 0, []], [[], [["SP", 1, 0, 65536, [32], 1], ["AN", 1, 0, 5], ["AN", 1, 1, 6], ["PR", 1, 0, "auto_unroll_max_step$512"]]]], "r": [[0.000637485], 0, 2.27726, 1639291494], "v": "v0.6"}
{"i": [["[\"reduction_layer\", [65536, 1024], 1, false]", "cuda -keys=cuda,gpu -max_num_threads=1024 -thread_warp_size=32", [-1, 16, 64, 49152, 2147483647, 1024, 8, 32], "", 0, []], [[], [["SP", 1, 0, 65536, [16], 1], ["AN", 1, 0, 5], ["AN", 1, 1, 6], ["PR", 1, 0, "auto_unroll_max_step$1024"]]]], "r": [[0.000714607], 0, 2.30637, 1639291496], "v": "v0.6"}
{"i": [["[\"reduction_layer\", [65536, 1024], 1, false]", "cuda -keys=cuda,gpu -max_num_threads=1024 -thread_warp_size=32", [-1, 16, 64, 49152, 2147483647, 1024, 8, 32], "", 0, []], [[], [["SP", 1, 1, 1024, [8], 1], ["AN", 1, 2, 6], ["AN", 1, 0, 5], ["PR", 1, 0, "auto_unroll_max_step$0"]]]], "r": [[0.000329666], 0, 5.10664, 1639291501], "v": "v0.6"}
{"i": [["[\"reduction_layer\", [65536, 1024], 1, false]", "cuda -keys=cuda,gpu -max_num_threads=1024 -thread_warp_size=32", [-1, 16, 64, 49152, 2147483647, 1024, 8, 32], "", 0, []], [[], [["SP", 1, 0, 65536, [16], 1], ["AN", 1, 0, 5], ["AN", 1, 1, 6], ["PR", 1, 0, "auto_unroll_max_step$16"]]]], "r": [[0.00071903], 0, 2.23991, 1639291503], "v": "v0.6"}
{"i": [["[\"reduction_layer\", [65536, 1024], 1, false]", "cuda -keys=cuda,gpu -max_num_threads=1024 -thread_warp_size=32", [-1, 16, 64, 49152, 2147483647, 1024, 8, 32], "", 0, []], [[], [["SP", 1, 1, 1024, [32], 1], ["AN", 1, 2, 6], ["AN", 1, 0, 5], ["PR", 1, 0, "auto_unroll_max_step$16"]]]], "r": [[0.000305546], 0, 2.19099, 1639291507], "v": "v0.6"}
{"i": [["[\"reduction_layer\", [65536, 1024], 1, false]", "cuda -keys=cuda,gpu -max_num_threads=1024 -thread_warp_size=32", [-1, 16, 64, 49152, 2147483647, 1024, 8, 32], "", 0, []], [[], [["SP", 1, 0, 65536, [8], 1], ["AN", 1, 0, 5], ["AN", 1, 1, 6], ["PR", 1, 0, "auto_unroll_max_step$512"]]]], "r": [[0.000644691], 0, 2.25743, 1639291509], "v": "v0.6"}
{"i": [["[\"reduction_layer\", [65536, 1024], 1, false]", "cuda -keys=cuda,gpu -max_num_threads=1024 -thread_warp_size=32", [-1, 16, 64, 49152, 2147483647, 1024, 8, 32], "", 0, []], [[], [["SP", 1, 1, 1024, [32], 1], ["AN", 1, 2, 6], ["AN", 1, 0, 5], ["PR", 1, 0, "auto_unroll_max_step$0"]]]], "r": [[0.000305512], 0, 2.27996, 1639291511], "v": "v0.6"}
{"i": [["[\"reduction_layer\", [65536, 1024], 1, false]", "cuda -keys=cuda,gpu -max_num_threads=1024 -thread_warp_size=32", [-1, 16, 64, 49152, 2147483647, 1024, 8, 32], "", 0, []], [[], [["SP", 1, 0, 65536, [16], 1], ["AN", 1, 0, 5], ["AN", 1, 1, 6], ["PR", 1, 0, "auto_unroll_max_step$64"]]]], "r": [[0.000715229], 0, 2.30548, 1639291513], "v": "v0.6"}
{"i": [["[\"reduction_layer\", [65536, 1024], 1, false]", "cuda -keys=cuda,gpu -max_num_threads=1024 -thread_warp_size=32", [-1, 16, 64, 49152, 2147483647, 1024, 8, 32], "", 0, []], [[], [["SP", 1, 0, 65536, [16], 1], ["AN", 1, 0, 5], ["AN", 1, 1, 6], ["PR", 1, 0, "auto_unroll_max_step$0"]]]], "r": [[0.000715037], 0, 2.26303, 1639291515], "v": "v0.6"}
{"i": [["[\"reduction_layer\", [65536, 1024], 1, false]", "cuda -keys=cuda,gpu -max_num_threads=1024 -thread_warp_size=32", [-1, 16, 64, 49152, 2147483647, 1024, 8, 32], "", 0, []], [[], [["SP", 1, 0, 65536, [1], 1], ["AN", 1, 0, 5], ["AN", 1, 1, 6], ["PR", 1, 0, "auto_unroll_max_step$16"]]]], "r": [[0.00125424], 0, 2.26903, 1639291517], "v": "v0.6"}
{"i": [["[\"reduction_layer\", [65536, 1024], 1, false]", "cuda -keys=cuda,gpu -max_num_threads=1024 -thread_warp_size=32", [-1, 16, 64, 49152, 2147483647, 1024, 8, 32], "", 0, []], [[], [["SP", 1, 0, 65536, [2], 1], ["AN", 1, 0, 5], ["AN", 1, 1, 6], ["PR", 1, 0, "auto_unroll_max_step$64"]]]], "r": [[0.000783418], 0, 2.25684, 1639291519], "v": "v0.6"}
{"i": [["[\"reduction_layer\", [65536, 1024], 1, false]", "cuda -keys=cuda,gpu -max_num_threads=1024 -thread_warp_size=32", [-1, 16, 64, 49152, 2147483647, 1024, 8, 32], "", 0, []], [[], [["SP", 1, 1, 1024, [2], 1], ["AN", 1, 2, 6], ["AN", 1, 0, 5], ["PR", 1, 0, "auto_unroll_max_step$0"]]]], "r": [[0.00080006], 0, 2.25256, 1639291521], "v": "v0.6"}
{"i": [["[\"reduction_layer\", [65536, 1024], 1, false]", "cuda -keys=cuda,gpu -max_num_threads=1024 -thread_warp_size=32", [-1, 16, 64, 49152, 2147483647, 1024, 8, 32], "", 0, []], [[], [["SP", 1, 1, 1024, [1], 1], ["AN", 1, 2, 6], ["AN", 1, 0, 5], ["PR", 1, 0, "auto_unroll_max_step$1024"]]]], "r": [[0.00128007], 0, 2.31646, 1639291523], "v": "v0.6"}
{"i": [["[\"reduction_layer\", [65536, 1024], 1, false]", "cuda -keys=cuda,gpu -max_num_threads=1024 -thread_warp_size=32", [-1, 16, 64, 49152, 2147483647, 1024, 8, 32], "", 0, []], [[], [["SP", 1, 1, 1024, [4], 1], ["AN", 1, 2, 6], ["AN", 1, 0, 5], ["PR", 1, 0, "auto_unroll_max_step$16"]]]], "r": [[0.00049231], 0, 1.80278, 1639291525], "v": "v0.6"}
{"i": [["[\"reduction_layer\", [65536, 1024], 1, false]", "cuda -keys=cuda,gpu -max_num_threads=1024 -thread_warp_size=32", [-1, 16, 64, 49152, 2147483647, 1024, 8, 32], "", 0, []], [[], [["SP", 1, 0, 65536, [1], 1], ["AN", 1, 0, 5], ["AN", 1, 1, 6], ["PR", 1, 0, "auto_unroll_max_step$1024"]]]], "r": [[0.00133452], 0, 1.83245, 1639291526], "v": "v0.6"}
{"i": [["[\"reduction_layer\", [65536, 1024], 1, false]", "cuda -keys=cuda,gpu -max_num_threads=1024 -thread_warp_size=32", [-1, 16, 64, 49152, 2147483647, 1024, 8, 32], "", 0, []], [[], [["SP", 1, 1, 1024, [2], 1], ["AN", 1, 2, 6], ["AN", 1, 0, 5], ["PR", 1, 0, "auto_unroll_max_step$64"]]]], "r": [[0.000799228], 0, 2.36255, 1639291529], "v": "v0.6"}
{"i": [["[\"reduction_layer\", [65536, 1024], 1, false]", "cuda -keys=cuda,gpu -max_num_threads=1024 -thread_warp_size=32", [-1, 16, 64, 49152, 2147483647, 1024, 8, 32], "", 0, []], [[], [["SP", 1, 1, 1024, [32], 1], ["AN", 1, 2, 6], ["AN", 1, 0, 5], ["PR", 1, 0, "auto_unroll_max_step$1024"]]]], "r": [[0.000717913], 0, 2.06186, 1639291530], "v": "v0.6"}
{"i": [["[\"reduction_layer\", [65536, 1024], 1, false]", "cuda -keys=cuda,gpu -max_num_threads=1024 -thread_warp_size=32", [-1, 16, 64, 49152, 2147483647, 1024, 8, 32], "", 0, []], [[], [["SP", 1, 0, 65536, [32], 1], ["AN", 1, 0, 5], ["AN", 1, 1, 6], ["PR", 1, 0, "auto_unroll_max_step$1024"]]]], "r": [[0.00142892], 0, 2.55774, 1639291533], "v": "v0.6"}
{"i": [["[\"reduction_layer\", [65536, 1024], 1, false]", "cuda -keys=cuda,gpu -max_num_threads=1024 -thread_warp_size=32", [-1, 16, 64, 49152, 2147483647, 1024, 8, 32], "", 0, []], [[], [["SP", 1, 0, 65536, [64], 1], ["AN", 1, 0, 5], ["AN", 1, 1, 6], ["PR", 1, 0, "auto_unroll_max_step$16"]]]], "r": [[0.00151698], 0, 1.87376, 1639291534], "v": "v0.6"}
{"i": [["[\"reduction_layer\", [65536, 1024], 1, false]", "cuda -keys=cuda,gpu -max_num_threads=1024 -thread_warp_size=32", [-1, 16, 64, 49152, 2147483647, 1024, 8, 32], "", 0, []], [[], [["SP", 1, 1, 1024, [4], 1], ["AN", 1, 2, 6], ["AN", 1, 0, 5], ["PR", 1, 0, "auto_unroll_max_step$64"]]]], "r": [[0.00110768], 0, 2.31499, 1639291536], "v": "v0.6"}
{"i": [["[\"reduction_layer\", [65536, 1024], 1, false]", "cuda -keys=cuda,gpu -max_num_threads=1024 -thread_warp_size=32", [-1, 16, 64, 49152, 2147483647, 1024, 8, 32], "", 0, []], [[], [["SP", 1, 1, 1024, [4], 1], ["AN", 1, 2, 6], ["AN", 1, 0, 5], ["PR", 1, 0, "auto_unroll_max_step$1024"]]]], "r": [[0.00111578], 0, 2.2327, 1639291542], "v": "v0.6"}
{"i": [["[\"reduction_layer\", [65536, 1024], 1, false]", "cuda -keys=cuda,gpu -max_num_threads=1024 -thread_warp_size=32", [-1, 16, 64, 49152, 2147483647, 1024, 8, 32], "", 0, []], [[], [["SP", 1, 0, 65536, [2], 1], ["AN", 1, 0, 5], ["AN", 1, 1, 6], ["PR", 1, 0, "auto_unroll_max_step$1024"]]]], "r": [[0.000783598], 0, 2.6269, 1639291544], "v": "v0.6"}
{"i": [["[\"reduction_layer\", [65536, 1024], 1, false]", "cuda -keys=cuda,gpu -max_num_threads=1024 -thread_warp_size=32", [-1, 16, 64, 49152, 2147483647, 1024, 8, 32], "", 0, []], [[], [["SP", 1, 0, 65536, [8], 1], ["AN", 1, 0, 5], ["AN", 1, 1, 6], ["PR", 1, 0, "auto_unroll_max_step$0"]]]], "r": [[0.000644531], 0, 2.21779, 1639291546], "v": "v0.6"}
{"i": [["[\"reduction_layer\", [65536, 1024], 1, false]", "cuda -keys=cuda,gpu -max_num_threads=1024 -thread_warp_size=32", [-1, 16, 64, 49152, 2147483647, 1024, 8, 32], "", 0, []], [[], [["SP", 1, 0, 65536, [4], 1], ["AN", 1, 0, 5], ["AN", 1, 1, 6], ["PR", 1, 0, "auto_unroll_max_step$512"]]]], "r": [[0.000630897], 0, 2.25521, 1639291548], "v": "v0.6"}
{"i": [["[\"reduction_layer\", [65536, 1024], 1, false]", "cuda -keys=cuda,gpu -max_num_threads=1024 -thread_warp_size=32", [-1, 16, 64, 49152, 2147483647, 1024, 8, 32], "", 0, []], [[], [["SP", 1, 0, 65536, [4], 1], ["AN", 1, 0, 5], ["AN", 1, 1, 6], ["PR", 1, 0, "auto_unroll_max_step$16"]]]], "r": [[0.000631098], 0, 2.26989, 1639291550], "v": "v0.6"}
{"i": [["[\"reduction_layer\", [65536, 1024], 1, false]", "cuda -keys=cuda,gpu -max_num_threads=1024 -thread_warp_size=32", [-1, 16, 64, 49152, 2147483647, 1024, 8, 32], "", 0, []], [[], [["SP", 1, 0, 65536, [1], 1], ["AN", 1, 0, 5], ["AN", 1, 1, 6], ["PR", 1, 0, "auto_unroll_max_step$512"]]]], "r": [[0.00125376], 0, 2.21795, 1639291552], "v": "v0.6"}
