artifacts/microbenchmark/tvm/autotvm/tensor_core/matmul_65536_1024_4096.log
{"input": ["cuda -keys=cuda,gpu -max_num_threads=1024 -thread_warp_size=32", "dense_tensorcore.cuda", [["TENSOR", [65536, 1024], "float16"], ["TENSOR", [1024, 4096], "float16"]], {}], "config": {"index": 14736, "code_hash": null, "entity": [["block_row_warps", "ot", 1], ["block_col_warps", "ot", 2], ["warp_row_tiles", "ot", 4], ["warp_col_tiles", "ot", 4], ["chunk", "ot", 2], ["offset", "ot", 8], ["offsetCS", "ot", 0], ["vec", "ot", 8], ["wmma_m", "ot", 8]]}, "result": [[0.0030942322083333334], 0, 4.544813871383667, 1649992289.5830257], "version": 0.2, "tvm_version": "0.8.dev0"}
{"input": ["cuda -keys=cuda,gpu -max_num_threads=1024 -thread_warp_size=32", "dense_tensorcore.cuda", [["TENSOR", [65536, 1024], "float16"], ["TENSOR", [1024, 4096], "float16"]], {}], "config": {"index": 10973, "code_hash": null, "entity": [["block_row_warps", "ot", 4], ["block_col_warps", "ot", 1], ["warp_row_tiles", "ot", 2], ["warp_col_tiles", "ot", 2], ["chunk", "ot", 8], ["offset", "ot", 8], ["offsetCS", "ot", 0], ["vec", "ot", 1], ["wmma_m", "ot", 8]]}, "result": [[0.003990502], 0, 4.534766912460327, 1649992294.4481616], "version": 0.2, "tvm_version": "0.8.dev0"}
{"input": ["cuda -keys=cuda,gpu -max_num_threads=1024 -thread_warp_size=32", "dense_tensorcore.cuda", [["TENSOR", [65536, 1024], "float16"], ["TENSOR", [1024, 4096], "float16"]], {}], "config": {"index": 4458, "code_hash": null, "entity": [["block_row_warps", "ot", 1], ["block_col_warps", "ot", 2], ["warp_row_tiles", "ot", 1], ["warp_col_tiles", "ot", 1], ["chunk", "ot", 8], ["offset", "ot", 8], ["offsetCS", "ot", 0], ["vec", "ot", 8], ["wmma_m", "ot", 32]]}, "result": [[0.011286197777777777], 0, 4.362912893295288, 1649992298.4284127], "version": 0.2, "tvm_version": "0.8.dev0"}
{"input": ["cuda -keys=cuda,gpu -max_num_threads=1024 -thread_warp_size=32", "dense_tensorcore.cuda", [["TENSOR", [65536, 1024], "float16"], ["TENSOR", [1024, 4096], "float16"]], {}], "config": {"index": 2754, "code_hash": null, "entity": [["block_row_warps", "ot", 1], ["block_col_warps", "ot", 1], ["warp_row_tiles", "ot", 1], ["warp_col_tiles", "ot", 1], ["chunk", "ot", 4], ["offset", "ot", 0], ["offsetCS", "ot", 0], ["vec", "ot", 4], ["wmma_m", "ot", 32]]}, "result": [[0.022962116333333334], 0, 4.521892070770264, 1649992302.601602], "version": 0.2, "tvm_version": "0.8.dev0"}
{"input": ["cuda -keys=cuda,gpu -max_num_threads=1024 -thread_warp_size=32", "dense_tensorcore.cuda", [["TENSOR", [65536, 1024], "float16"], ["TENSOR", [1024, 4096], "float16"]], {}], "config": {"index": 2318, "code_hash": null, "entity": [["block_row_warps", "ot", 4], ["block_col_warps", "ot", 2], ["warp_row_tiles", "ot", 4], ["warp_col_tiles", "ot", 2], ["chunk", "ot", 1], ["offset", "ot", 8], ["offsetCS", "ot", 8], ["vec", "ot", 2], ["wmma_m", "ot", 32]]}, "result": [[0.0192854365], 0, 4.385257005691528, 1649992307.3355947], "version": 0.2, "tvm_version": "0.8.dev0"}
{"input": ["cuda -keys=cuda,gpu -max_num_threads=1024 -thread_warp_size=32", "dense_tensorcore.cuda", [["TENSOR", [65536, 1024], "float16"], ["TENSOR", [1024, 4096], "float16"]], {}], "config": {"index": 14829, "code_hash": null, "entity": [["block_row_warps", "ot", 1], ["block_col_warps", "ot", 4], ["warp_row_tiles", "ot", 1], ["warp_col_tiles", "ot", 1], ["chunk", "ot", 8], ["offset", "ot", 8], ["offsetCS", "ot", 0], ["vec", "ot", 8], ["wmma_m", "ot", 8]]}, "result": [[0.009338685727272727], 0, 4.3053600788116455, 1649992312.0362515], "version": 0.2, "tvm_version": "0.8.dev0"}
{"input": ["cuda -keys=cuda,gpu -max_num_threads=1024 -thread_warp_size=32", "dense_tensorcore.cuda", [["TENSOR", [65536, 1024], "float16"], ["TENSOR", [1024, 4096], "float16"]], {}], "config": {"index": 6758, "code_hash": null, "entity": [["block_row_warps", "ot", 4], ["block_col_warps", "ot", 4], ["warp_row_tiles", "ot", 1], ["warp_col_tiles", "ot", 2], ["chunk", "ot", 8], ["offset", "ot", 0], ["offsetCS", "ot", 0], ["vec", "ot", 2], ["wmma_m", "ot", 16]]}, "result": [[0.010878584600000001], 0, 4.6587700843811035, 1649992317.3149903], "version": 0.2, "tvm_version": "0.8.dev0"}
{"input": ["cuda -keys=cuda,gpu -max_num_threads=1024 -thread_warp_size=32", "dense_tensorcore.cuda", [["TENSOR", [65536, 1024], "float16"], ["TENSOR", [1024, 4096], "float16"]], {}], "config": {"index": 8526, "code_hash": null, "entity": [["block_row_warps", "ot", 1], ["block_col_warps", "ot", 2], ["warp_row_tiles", "ot", 4], ["warp_col_tiles", "ot", 1], ["chunk", "ot", 2], ["offset", "ot", 0], ["offsetCS", "ot", 8], ["vec", "ot", 4], ["wmma_m", "ot", 16]]}, "result": [[0.007717017076923077], 0, 4.384803056716919, 1649992321.3324137], "version": 0.2, "tvm_version": "0.8.dev0"}
{"input": ["cuda -keys=cuda,gpu -max_num_threads=1024 -thread_warp_size=32", "dense_tensorcore.cuda", [["TENSOR", [65536, 1024], "float16"], ["TENSOR", [1024, 4096], "float16"]], {}], "config": {"index": 15278, "code_hash": null, "entity": [["block_row_warps", "ot", 4], ["block_col_warps", "ot", 2], ["warp_row_tiles", "ot", 4], ["warp_col_tiles", "ot", 2], ["chunk", "ot", 1], ["offset", "ot", 8], ["offsetCS", "ot", 8], ["vec", "ot", 8], ["wmma_m", "ot", 8]]}, "result": [[0.0028610093714285714], 0, 4.242964267730713, 1649992325.936373], "version": 0.2, "tvm_version": "0.8.dev0"}
{"input": ["cuda -keys=cuda,gpu -max_num_threads=1024 -thread_warp_size=32", "dense_tensorcore.cuda", [["TENSOR", [65536, 1024], "float16"], ["TENSOR", [1024, 4096], "float16"]], {}], "config": {"index": 2649, "code_hash": null, "entity": [["block_row_warps", "ot", 1], ["block_col_warps", "ot", 2], ["warp_row_tiles", "ot", 1], ["warp_col_tiles", "ot", 4], ["chunk", "ot", 1], ["offset", "ot", 0], ["offsetCS", "ot", 0], ["vec", "ot", 4], ["wmma_m", "ot", 32]]}, "result": [[0.007662549625], 0, 4.285048961639404, 1649992330.5659392], "version": 0.2, "tvm_version": "0.8.dev0"}
{"input": ["cuda -keys=cuda,gpu -max_num_threads=1024 -thread_warp_size=32", "dense_tensorcore.cuda", [["TENSOR", [65536, 1024], "float16"], ["TENSOR", [1024, 4096], "float16"]], {}], "config": {"index": 11343, "code_hash": null, "entity": [["block_row_warps", "ot", 1], ["block_col_warps", "ot", 2], ["warp_row_tiles", "ot", 1], ["warp_col_tiles", "ot", 1], ["chunk", "ot", 1], ["offset", "ot", 8], ["offsetCS", "ot", 8], ["vec", "ot", 1], ["wmma_m", "ot", 8]]}, "result": [[0.014832601142857144], 0, 4.690166473388672, 1649992334.908898], "version": 0.2, "tvm_version": "0.8.dev0"}
{"input": ["cuda -keys=cuda,gpu -max_num_threads=1024 -thread_warp_size=32", "dense_tensorcore.cuda", [["TENSOR", [65536, 1024], "float16"], ["TENSOR", [1024, 4096], "float16"]], {}], "config": {"index": 10740, "code_hash": null, "entity": [["block_row_warps", "ot", 1], ["block_col_warps", "ot", 2], ["warp_row_tiles", "ot", 4], ["warp_col_tiles", "ot", 2], ["chunk", "ot", 1], ["offset", "ot", 8], ["offsetCS", "ot", 0], ["vec", "ot", 1], ["wmma_m", "ot", 8]]}, "result": [[0.0047079930625], 0, 4.530506134033203, 1649992340.522226], "version": 0.2, "tvm_version": "0.8.dev0"}
{"input": ["cuda -keys=cuda,gpu -max_num_threads=1024 -thread_warp_size=32", "dense_tensorcore.cuda", [["TENSOR", [65536, 1024], "float16"], ["TENSOR", [1024, 4096], "float16"]], {}], "config": {"index": 4381, "code_hash": null, "entity": [["block_row_warps", "ot", 2], ["block_col_warps", "ot", 4], ["warp_row_tiles", "ot", 1], ["warp_col_tiles", "ot", 1], ["chunk", "ot", 4], ["offset", "ot", 8], ["offsetCS", "ot", 0], ["vec", "ot", 8], ["wmma_m", "ot", 32]]}, "result": [[0.005714907777777778], 0, 4.458967924118042, 1649992344.6126957], "version": 0.2, "tvm_version": "0.8.dev0"}
{"input": ["cuda -keys=cuda,gpu -max_num_threads=1024 -thread_warp_size=32", "dense_tensorcore.cuda", [["TENSOR", [65536, 1024], "float16"], ["TENSOR", [1024, 4096], "float16"]], {}], "config": {"index": 10711, "code_hash": null, "entity": [["block_row_warps", "ot", 2], ["block_col_warps", "ot", 1], ["warp_row_tiles", "ot", 4], ["warp_col_tiles", "ot", 1], ["chunk", "ot", 1], ["offset", "ot", 8], ["offsetCS", "ot", 0], ["vec", "ot", 1], ["wmma_m", "ot", 8]]}, "result": [[0.013198743875], 0, 4.341481685638428, 1649992349.3274765], "version": 0.2, "tvm_version": "0.8.dev0"}
{"input": ["cuda -keys=cuda,gpu -max_num_threads=1024 -thread_warp_size=32", "dense_tensorcore.cuda", [["TENSOR", [65536, 1024], "float16"], ["TENSOR", [1024, 4096], "float16"]], {}], "config": {"index": 14121, "code_hash": null, "entity": [["block_row_warps", "ot", 1], ["block_col_warps", "ot", 1], ["warp_row_tiles", "ot", 1], ["warp_col_tiles", "ot", 2], ["chunk", "ot", 4], ["offset", "ot", 8], ["offsetCS", "ot", 8], ["vec", "ot", 4], ["wmma_m", "ot", 8]]}, "result": [[0.007387665857142857], 0, 4.712831258773804, 1649992354.3893538], "version": 0.2, "tvm_version": "0.8.dev0"}
{"input": ["cuda -keys=cuda,gpu -max_num_threads=1024 -thread_warp_size=32", "dense_tensorcore.cuda", [["TENSOR", [65536, 1024], "float16"], ["TENSOR", [1024, 4096], "float16"]], {}], "config": {"index": 406, "code_hash": null, "entity": [["block_row_warps", "ot", 2], ["block_col_warps", "ot", 1], ["warp_row_tiles", "ot", 1], ["warp_col_tiles", "ot", 1], ["chunk", "ot", 2], ["offset", "ot", 8], ["offsetCS", "ot", 0], ["vec", "ot", 1], ["wmma_m", "ot", 32]]}, "result": [[0.037968035], 0, 4.439310073852539, 1649992359.2581053], "version": 0.2, "tvm_version": "0.8.dev0"}
{"input": ["cuda -keys=cuda,gpu -max_num_threads=1024 -thread_warp_size=32", "dense_tensorcore.cuda", [["TENSOR", [65536, 1024], "float16"], ["TENSOR", [1024, 4096], "float16"]], {}], "config": {"index": 7540, "code_hash": null, "entity": [["block_row_warps", "ot", 2], ["block_col_warps", "ot", 4], ["warp_row_tiles", "ot", 1], ["warp_col_tiles", "ot", 1], ["chunk", "ot", 2], ["offset", "ot", 8], ["offsetCS", "ot", 8], ["vec", "ot", 2], ["wmma_m", "ot", 16]]}, "result": [[0.0058077603333333335], 0, 4.31869912147522, 1649992363.223736], "version": 0.2, "tvm_version": "0.8.dev0"}
{"input": ["cuda -keys=cuda,gpu -max_num_threads=1024 -thread_warp_size=32", "dense_tensorcore.cuda", [["TENSOR", [65536, 1024], "float16"], ["TENSOR", [1024, 4096], "float16"]], {}], "config": {"index": 9721, "code_hash": null, "entity": [["block_row_warps", "ot", 2], ["block_col_warps", "ot", 1], ["warp_row_tiles", "ot", 1], ["warp_col_tiles", "ot", 1], ["chunk", "ot", 1], ["offset", "ot", 0], ["offsetCS", "ot", 8], ["vec", "ot", 8], ["wmma_m", "ot", 16]]}, "result": [[0.02114519283333333], 0, 4.509777545928955, 1649992368.0999568], "version": 0.2, "tvm_version": "0.8.dev0"}
{"input": ["cuda -keys=cuda,gpu -max_num_threads=1024 -thread_warp_size=32", "dense_tensorcore.cuda", [["TENSOR", [65536, 1024], "float16"], ["TENSOR", [1024, 4096], "float16"]], {}], "config": {"index": 6129, "code_hash": null, "entity": [["block_row_warps", "ot", 1], ["block_col_warps", "ot", 1], ["warp_row_tiles", "ot", 1], ["warp_col_tiles", "ot", 4], ["chunk", "ot", 8], ["offset", "ot", 0], ["offsetCS", "ot", 8], ["vec", "ot", 1], ["wmma_m", "ot", 16]]}, "result": [[0.035680235000000005], 0, 4.531264066696167, 1649992373.026438], "version": 0.2, "tvm_version": "0.8.dev0"}
{"input": ["cuda -keys=cuda,gpu -max_num_threads=1024 -thread_warp_size=32", "dense_tensorcore.cuda", [["TENSOR", [65536, 1024], "float16"], ["TENSOR", [1024, 4096], "float16"]], {}], "config": {"index": 1713, "code_hash": null, "entity": [["block_row_warps", "ot", 1], ["block_col_warps", "ot", 2], ["warp_row_tiles", "ot", 2], ["warp_col_tiles", "ot", 1], ["chunk", "ot", 2], ["offset", "ot", 8], ["offsetCS", "ot", 0], ["vec", "ot", 2], ["wmma_m", "ot", 32]]}, "result": [[0.01622235911111111], 0, 4.556938648223877, 1649992377.2393777], "version": 0.2, "tvm_version": "0.8.dev0"}
{"input": ["cuda -keys=cuda,gpu -max_num_threads=1024 -thread_warp_size=32", "dense_tensorcore.cuda", [["TENSOR", [65536, 1024], "float16"], ["TENSOR", [1024, 4096], "float16"]], {}], "config": {"index": 11026, "code_hash": null, "entity": [["block_row_warps", "ot", 2], ["block_col_warps", "ot", 1], ["warp_row_tiles", "ot", 2], ["warp_col_tiles", "ot", 1], ["chunk", "ot", 1], ["offset", "ot", 0], ["offsetCS", "ot", 8], ["vec", "ot", 1], ["wmma_m", "ot", 8]]}, "result": [[0.011162779888888889], 0, 4.321376800537109, 1649992381.21968], "version": 0.2, "tvm_version": "0.8.dev0"}
{"input": ["cuda -keys=cuda,gpu -max_num_threads=1024 -thread_warp_size=32", "dense_tensorcore.cuda", [["TENSOR", [65536, 1024], "float16"], ["TENSOR", [1024, 4096], "float16"]], {}], "config": {"index": 12853, "code_hash": null, "entity": [["block_row_warps", "ot", 2], ["block_col_warps", "ot", 1], ["warp_row_tiles", "ot", 1], ["warp_col_tiles", "ot", 4], ["chunk", "ot", 4], ["offset", "ot", 8], ["offsetCS", "ot", 8], ["vec", "ot", 2], ["wmma_m", "ot", 8]]}, "result": [[0.004800189933333333], 0, 4.5235679149627686, 1649992386.6589048], "version": 0.2, "tvm_version": "0.8.dev0"}
{"input": ["cuda -keys=cuda,gpu -max_num_threads=1024 -thread_warp_size=32", "dense_tensorcore.cuda", [["TENSOR", [65536, 1024], "float16"], ["TENSOR", [1024, 4096], "float16"]], {}], "config": {"index": 2411, "code_hash": null, "entity": [["block_row_warps", "ot", 4], ["block_col_warps", "ot", 4], ["warp_row_tiles", "ot", 1], ["warp_col_tiles", "ot", 4], ["chunk", "ot", 2], ["offset", "ot", 8], ["offsetCS", "ot", 8], ["vec", "ot", 2], ["wmma_m", "ot", 32]]}, "result": [[0.003228730064516129], 0, 4.323171615600586, 1649992390.615488], "version": 0.2, "tvm_version": "0.8.dev0"}
{"input": ["cuda -keys=cuda,gpu -max_num_threads=1024 -thread_warp_size=32", "dense_tensorcore.cuda", [["TENSOR", [65536, 1024], "float16"], ["TENSOR", [1024, 4096], "float16"]], {}], "config": {"index": 11561, "code_hash": null, "entity": [["block_row_warps", "ot", 4], ["block_col_warps", "ot", 2], ["warp_row_tiles", "ot", 1], ["warp_col_tiles", "ot", 4], ["chunk", "ot", 4], ["offset", "ot", 8], ["offsetCS", "ot", 8], ["vec", "ot", 1], ["wmma_m", "ot", 8]]}, "result": [[0.00510088345], 0, 4.280524969100952, 1649992395.2452624], "version": 0.2, "tvm_version": "0.8.dev0"}
{"input": ["cuda -keys=cuda,gpu -max_num_threads=1024 -thread_warp_size=32", "dense_tensorcore.cuda", [["TENSOR", [65536, 1024], "float16"], ["TENSOR", [1024, 4096], "float16"]], {}], "config": {"index": 12394, "code_hash": null, "entity": [["block_row_warps", "ot", 2], ["block_col_warps", "ot", 1], ["warp_row_tiles", "ot", 1], ["warp_col_tiles", "ot", 1], ["chunk", "ot", 2], ["offset", "ot", 0], ["offsetCS", "ot", 8], ["vec", "ot", 2], ["wmma_m", "ot", 8]]}, "result": [[0.011301564333333333], 0, 4.603820323944092, 1649992400.1909268], "version": 0.2, "tvm_version": "0.8.dev0"}
{"input": ["cuda -keys=cuda,gpu -max_num_threads=1024 -thread_warp_size=32", "dense_tensorcore.cuda", [["TENSOR", [65536, 1024], "float16"], ["TENSOR", [1024, 4096], "float16"]], {}], "config": {"index": 13670, "code_hash": null, "entity": [["block_row_warps", "ot", 4], ["block_col_warps", "ot", 4], ["warp_row_tiles", "ot", 1], ["warp_col_tiles", "ot", 4], ["chunk", "ot", 1], ["offset", "ot", 0], ["offsetCS", "ot", 8], ["vec", "ot", 4], ["wmma_m", "ot", 8]]}, "result": [[0.005781905666666667], 0, 4.367609739303589, 1649992404.1794713], "version": 0.2, "tvm_version": "0.8.dev0"}
{"input": ["cuda -keys=cuda,gpu -max_num_threads=1024 -thread_warp_size=32", "dense_tensorcore.cuda", [["TENSOR", [65536, 1024], "float16"], ["TENSOR", [1024, 4096], "float16"]], {}], "config": {"index": 5234, "code_hash": null, "entity": [["block_row_warps", "ot", 4], ["block_col_warps", "ot", 2], ["warp_row_tiles", "ot", 4], ["warp_col_tiles", "ot", 2], ["chunk", "ot", 1], ["offset", "ot", 0], ["offsetCS", "ot", 0], ["vec", "ot", 1], ["wmma_m", "ot", 16]]}, "result": [[0.00524920365], 0, 4.36430287361145, 1649992408.1593292], "version": 0.2, "tvm_version": "0.8.dev0"}
{"input": ["cuda -keys=cuda,gpu -max_num_threads=1024 -thread_warp_size=32", "dense_tensorcore.cuda", [["TENSOR", [65536, 1024], "float16"], ["TENSOR", [1024, 4096], "float16"]], {}], "config": {"index": 12667, "code_hash": null, "entity": [["block_row_warps", "ot", 2], ["block_col_warps", "ot", 2], ["warp_row_tiles", "ot", 1], ["warp_col_tiles", "ot", 2], ["chunk", "ot", 1], ["offset", "ot", 8], ["offsetCS", "ot", 8], ["vec", "ot", 2], ["wmma_m", "ot", 8]]}, "result": [[0.008256884307692306], 0, 4.228291273117065, 1649992412.7542708], "version": 0.2, "tvm_version": "0.8.dev0"}
{"input": ["cuda -keys=cuda,gpu -max_num_threads=1024 -thread_warp_size=32", "dense_tensorcore.cuda", [["TENSOR", [65536, 1024], "float16"], ["TENSOR", [1024, 4096], "float16"]], {}], "config": {"index": 13892, "code_hash": null, "entity": [["block_row_warps", "ot", 4], ["block_col_warps", "ot", 2], ["warp_row_tiles", "ot", 2], ["warp_col_tiles", "ot", 2], ["chunk", "ot", 8], ["offset", "ot", 0], ["offsetCS", "ot", 8], ["vec", "ot", 4], ["wmma_m", "ot", 8]]}, "result": [[0.008195386307692308], 0, 4.4543375968933105, 1649992416.8164814], "version": 0.2, "tvm_version": "0.8.dev0"}
{"input": ["cuda -keys=cuda,gpu -max_num_threads=1024 -thread_warp_size=32", "dense_tensorcore.cuda", [["TENSOR", [65536, 1024], "float16"], ["TENSOR", [1024, 4096], "float16"]], {}], "config": {"index": 13425, "code_hash": null, "entity": [["block_row_warps", "ot", 1], ["block_col_warps", "ot", 4], ["warp_row_tiles", "ot", 1], ["warp_col_tiles", "ot", 4], ["chunk", "ot", 2], ["offset", "ot", 8], ["offsetCS", "ot", 0], ["vec", "ot", 4], ["wmma_m", "ot", 8]]}, "result": [[0.010197147200000001], 0, 4.4129040241241455, 1649992421.5743186], "version": 0.2, "tvm_version": "0.8.dev0"}
{"input": ["cuda -keys=cuda,gpu -max_num_threads=1024 -thread_warp_size=32", "dense_tensorcore.cuda", [["TENSOR", [65536, 1024], "float16"], ["TENSOR", [1024, 4096], "float16"]], {}], "config": {"index": 12206, "code_hash": null, "entity": [["block_row_warps", "ot", 4], ["block_col_warps", "ot", 1], ["warp_row_tiles", "ot", 1], ["warp_col_tiles", "ot", 4], ["chunk", "ot", 4], ["offset", "ot", 8], ["offsetCS", "ot", 0], ["vec", "ot", 2], ["wmma_m", "ot", 8]]}, "result": [[0.003988719807692308], 0, 4.486300230026245, 1649992425.6724281], "version": 0.2, "tvm_version": "0.8.dev0"}
{"input": ["cuda -keys=cuda,gpu -max_num_threads=1024 -thread_warp_size=32", "dense_tensorcore.cuda", [["TENSOR", [65536, 1024], "float16"], ["TENSOR", [1024, 4096], "float16"]], {}], "config": {"index": 526, "code_hash": null, "entity": [["block_row_warps", "ot", 2], ["block_col_warps", "ot", 2], ["warp_row_tiles", "ot", 2], ["warp_col_tiles", "ot", 2], ["chunk", "ot", 4], ["offset", "ot", 8], ["offsetCS", "ot", 0], ["vec", "ot", 1], ["wmma_m", "ot", 32]]}, "result": [[0.005859397666666666], 0, 4.34885048866272, 1649992430.3341992], "version": 0.2, "tvm_version": "0.8.dev0"}
{"input": ["cuda -keys=cuda,gpu -max_num_threads=1024 -thread_warp_size=32", "dense_tensorcore.cuda", [["TENSOR", [65536, 1024], "float16"], ["TENSOR", [1024, 4096], "float16"]], {}], "config": {"index": 14315, "code_hash": null, "entity": [["block_row_warps", "ot", 4], ["block_col_warps", "ot", 2], ["warp_row_tiles", "ot", 1], ["warp_col_tiles", "ot", 4], ["chunk", "ot", 1], ["offset", "ot", 0], ["offsetCS", "ot", 0], ["vec", "ot", 8], ["wmma_m", "ot", 8]]}, "result": [[0.007149366666666666], 0, 4.642373561859131, 1649992434.6424859], "version": 0.2, "tvm_version": "0.8.dev0"}
{"input": ["cuda -keys=cuda,gpu -max_num_threads=1024 -thread_warp_size=32", "dense_tensorcore.cuda", [["TENSOR", [65536, 1024], "float16"], ["TENSOR", [1024, 4096], "float16"]], {}], "config": {"index": 12381, "code_hash": null, "entity": [["block_row_warps", "ot", 1], ["block_col_warps", "ot", 4], ["warp_row_tiles", "ot", 2], ["warp_col_tiles", "ot", 4], ["chunk", "ot", 1], ["offset", "ot", 0], ["offsetCS", "ot", 8], ["vec", "ot", 2], ["wmma_m", "ot", 8]]}, "result": [[0.006230155470588235], 0, 4.2666850090026855, 1649992439.2479293], "version": 0.2, "tvm_version": "0.8.dev0"}
{"input": ["cuda -keys=cuda,gpu -max_num_threads=1024 -thread_warp_size=32", "dense_tensorcore.cuda", [["TENSOR", [65536, 1024], "float16"], ["TENSOR", [1024, 4096], "float16"]], {}], "config": {"index": 1364, "code_hash": null, "entity": [["block_row_warps", "ot", 4], ["block_col_warps", "ot", 2], ["warp_row_tiles", "ot", 2], ["warp_col_tiles", "ot", 4], ["chunk", "ot", 1], ["offset", "ot", 0], ["offsetCS", "ot", 0], ["vec", "ot", 2], ["wmma_m", "ot", 32]]}, "result": [[0.004538873608695652], 0, 4.371687650680542, 1649992443.2161005], "version": 0.2, "tvm_version": "0.8.dev0"}
{"input": ["cuda -keys=cuda,gpu -max_num_threads=1024 -thread_warp_size=32", "dense_tensorcore.cuda", [["TENSOR", [65536, 1024], "float16"], ["TENSOR", [1024, 4096], "float16"]], {}], "config": {"index": 5934, "code_hash": null, "entity": [["block_row_warps", "ot", 1], ["block_col_warps", "ot", 2], ["warp_row_tiles", "ot", 4], ["warp_col_tiles", "ot", 1], ["chunk", "ot", 2], ["offset", "ot", 0], ["offsetCS", "ot", 8], ["vec", "ot", 1], ["wmma_m", "ot", 16]]}, "result": [[0.008617477166666667], 0, 4.3000500202178955, 1649992447.8540125], "version": 0.2, "tvm_version": "0.8.dev0"}
{"input": ["cuda -keys=cuda,gpu -max_num_threads=1024 -thread_warp_size=32", "dense_tensorcore.cuda", [["TENSOR", [65536, 1024], "float16"], ["TENSOR", [1024, 4096], "float16"]], {}], "config": {"index": 3718, "code_hash": null, "entity": [["block_row_warps", "ot", 2], ["block_col_warps", "ot", 1], ["warp_row_tiles", "ot", 4], ["warp_col_tiles", "ot", 4], ["chunk", "ot", 2], ["offset", "ot", 8], ["offsetCS", "ot", 8], ["vec", "ot", 4], ["wmma_m", "ot", 32]]}, "result": [[0.00908679725], 0, 4.63093900680542, 1649992452.092704], "version": 0.2, "tvm_version": "0.8.dev0"}
{"input": ["cuda -keys=cuda,gpu -max_num_threads=1024 -thread_warp_size=32", "dense_tensorcore.cuda", [["TENSOR", [65536, 1024], "float16"], ["TENSOR", [1024, 4096], "float16"]], {}], "config": {"index": 12723, "code_hash": null, "entity": [["block_row_warps", "ot", 1], ["block_col_warps", "ot", 4], ["warp_row_tiles", "ot", 1], ["warp_col_tiles", "ot", 1], ["chunk", "ot", 2], ["offset", "ot", 8], ["offsetCS", "ot", 8], ["vec", "ot", 2], ["wmma_m", "ot", 8]]}, "result": [[0.0102259063], 0, 4.342676877975464, 1649992456.8292303], "version": 0.2, "tvm_version": "0.8.dev0"}
{"input": ["cuda -keys=cuda,gpu -max_num_threads=1024 -thread_warp_size=32", "dense_tensorcore.cuda", [["TENSOR", [65536, 1024], "float16"], ["TENSOR", [1024, 4096], "float16"]], {}], "config": {"index": 2670, "code_hash": null, "entity": [["block_row_warps", "ot", 1], ["block_col_warps", "ot", 4], ["warp_row_tiles", "ot", 4], ["warp_col_tiles", "ot", 4], ["chunk", "ot", 1], ["offset", "ot", 0], ["offsetCS", "ot", 0], ["vec", "ot", 4], ["wmma_m", "ot", 32]]}, "result": [[0.0026817598684210527], 0, 4.441308498382568, 1649992462.2428546], "version": 0.2, "tvm_version": "0.8.dev0"}
{"input": ["cuda -keys=cuda,gpu -max_num_threads=1024 -thread_warp_size=32", "dense_tensorcore.cuda", [["TENSOR", [65536, 1024], "float16"], ["TENSOR", [1024, 4096], "float16"]], {}], "config": {"index": 307, "code_hash": null, "entity": [["block_row_warps", "ot", 2], ["block_col_warps", "ot", 1], ["warp_row_tiles", "ot", 2], ["warp_col_tiles", "ot", 4], ["chunk", "ot", 8], ["offset", "ot", 0], ["offsetCS", "ot", 0], ["vec", "ot", 1], ["wmma_m", "ot", 32]]}, "result": [[0.0200120305], 0, 4.587268114089966, 1649992466.456303], "version": 0.2, "tvm_version": "0.8.dev0"}
{"input": ["cuda -keys=cuda,gpu -max_num_threads=1024 -thread_warp_size=32", "dense_tensorcore.cuda", [["TENSOR", [65536, 1024], "float16"], ["TENSOR", [1024, 4096], "float16"]], {}], "config": {"index": 5265, "code_hash": null, "entity": [["block_row_warps", "ot", 1], ["block_col_warps", "ot", 1], ["warp_row_tiles", "ot", 1], ["warp_col_tiles", "ot", 1], ["chunk", "ot", 2], ["offset", "ot", 0], ["offsetCS", "ot", 0], ["vec", "ot", 1], ["wmma_m", "ot", 16]]}, "result": [[0.016559988142857144], 0, 4.3943681716918945, 1649992470.5098321], "version": 0.2, "tvm_version": "0.8.dev0"}
{"input": ["cuda -keys=cuda,gpu -max_num_threads=1024 -thread_warp_size=32", "dense_tensorcore.cuda", [["TENSOR", [65536, 1024], "float16"], ["TENSOR", [1024, 4096], "float16"]], {}], "config": {"index": 3870, "code_hash": null, "entity": [["block_row_warps", "ot", 1], ["block_col_warps", "ot", 1], ["warp_row_tiles", "ot", 2], ["warp_col_tiles", "ot", 4], ["chunk", "ot", 8], ["offset", "ot", 8], ["offsetCS", "ot", 8], ["vec", "ot", 4], ["wmma_m", "ot", 32]]}, "result": [[0.005655321055555555], 0, 4.399080276489258, 1649992474.5340967], "version": 0.2, "tvm_version": "0.8.dev0"}
{"input": ["cuda -keys=cuda,gpu -max_num_threads=1024 -thread_warp_size=32", "dense_tensorcore.cuda", [["TENSOR", [65536, 1024], "float16"], ["TENSOR", [1024, 4096], "float16"]], {}], "config": {"index": 7767, "code_hash": null, "entity": [["block_row_warps", "ot", 1], ["block_col_warps", "ot", 1], ["warp_row_tiles", "ot", 4], ["warp_col_tiles", "ot", 4], ["chunk", "ot", 8], ["offset", "ot", 8], ["offsetCS", "ot", 8], ["vec", "ot", 2], ["wmma_m", "ot", 16]]}, "result": [[0.014887714285714285], 0, 4.4926276206970215, 1649992478.6474633], "version": 0.2, "tvm_version": "0.8.dev0"}
{"input": ["cuda -keys=cuda,gpu -max_num_threads=1024 -thread_warp_size=32", "dense_tensorcore.cuda", [["TENSOR", [65536, 1024], "float16"], ["TENSOR", [1024, 4096], "float16"]], {}], "config": {"index": 12036, "code_hash": null, "entity": [["block_row_warps", "ot", 1], ["block_col_warps", "ot", 2], ["warp_row_tiles", "ot", 4], ["warp_col_tiles", "ot", 2], ["chunk", "ot", 1], ["offset", "ot", 8], ["offsetCS", "ot", 0], ["vec", "ot", 2], ["wmma_m", "ot", 8]]}, "result": [[0.004497080545454545], 0, 4.519535541534424, 1649992482.8147476], "version": 0.2, "tvm_version": "0.8.dev0"}
{"input": ["cuda -keys=cuda,gpu -max_num_threads=1024 -thread_warp_size=32", "dense_tensorcore.cuda", [["TENSOR", [65536, 1024], "float16"], ["TENSOR", [1024, 4096], "float16"]], {}], "config": {"index": 13468, "code_hash": null, "entity": [["block_row_warps", "ot", 2], ["block_col_warps", "ot", 2], ["warp_row_tiles", "ot", 4], ["warp_col_tiles", "ot", 1], ["chunk", "ot", 4], ["offset", "ot", 8], ["offsetCS", "ot", 0], ["vec", "ot", 4], ["wmma_m", "ot", 8]]}, "result": [[0.0030793936470588233], 0, 4.363243103027344, 1649992486.8238487], "version": 0.2, "tvm_version": "0.8.dev0"}
{"input": ["cuda -keys=cuda,gpu -max_num_threads=1024 -thread_warp_size=32", "dense_tensorcore.cuda", [["TENSOR", [65536, 1024], "float16"], ["TENSOR", [1024, 4096], "float16"]], {}], "config": {"index": 3130, "code_hash": null, "entity": [["block_row_warps", "ot", 2], ["block_col_warps", "ot", 4], ["warp_row_tiles", "ot", 4], ["warp_col_tiles", "ot", 2], ["chunk", "ot", 4], ["offset", "ot", 8], ["offsetCS", "ot", 0], ["vec", "ot", 4], ["wmma_m", "ot", 32]]}, "result": [[0.002908576542857143], 0, 4.3602118492126465, 1649992490.8042436], "version": 0.2, "tvm_version": "0.8.dev0"}
{"input": ["cuda -keys=cuda,gpu -max_num_threads=1024 -thread_warp_size=32", "dense_tensorcore.cuda", [["TENSOR", [65536, 1024], "float16"], ["TENSOR", [1024, 4096], "float16"]], {}], "config": {"index": 7599, "code_hash": null, "entity": [["block_row_warps", "ot", 1], ["block_col_warps", "ot", 2], ["warp_row_tiles", "ot", 2], ["warp_col_tiles", "ot", 4], ["chunk", "ot", 2], ["offset", "ot", 8], ["offsetCS", "ot", 8], ["vec", "ot", 2], ["wmma_m", "ot", 16]]}, "result": [[0.003436574566666667], 0, 4.337263107299805, 1649992494.7652006], "version": 0.2, "tvm_version": "0.8.dev0"}
{"input": ["cuda -keys=cuda,gpu -max_num_threads=1024 -thread_warp_size=32", "dense_tensorcore.cuda", [["TENSOR", [65536, 1024], "float16"], ["TENSOR", [1024, 4096], "float16"]], {}], "config": {"index": 788, "code_hash": null, "entity": [["block_row_warps", "ot", 4], ["block_col_warps", "ot", 2], ["warp_row_tiles", "ot", 1], ["warp_col_tiles", "ot", 4], ["chunk", "ot", 2], ["offset", "ot", 0], ["offsetCS", "ot", 8], ["vec", "ot", 1], ["wmma_m", "ot", 32]]}, "result": [[0.005465195421052632], 0, 4.408326864242554, 1649992498.806368], "version": 0.2, "tvm_version": "0.8.dev0"}
{"input": ["cuda -keys=cuda,gpu -max_num_threads=1024 -thread_warp_size=32", "dense_tensorcore.cuda", [["TENSOR", [65536, 1024], "float16"], ["TENSOR", [1024, 4096], "float16"]], {}], "config": {"index": 2464, "code_hash": null, "entity": [["block_row_warps", "ot", 2], ["block_col_warps", "ot", 4], ["warp_row_tiles", "ot", 1], ["warp_col_tiles", "ot", 2], ["chunk", "ot", 4], ["offset", "ot", 8], ["offsetCS", "ot", 8], ["vec", "ot", 2], ["wmma_m", "ot", 32]]}, "result": [[0.0035505462413793105], 0, 4.410677671432495, 1649992502.839729], "version": 0.2, "tvm_version": "0.8.dev0"}
{"input": ["cuda -keys=cuda,gpu -max_num_threads=1024 -thread_warp_size=32", "dense_tensorcore.cuda", [["TENSOR", [65536, 1024], "float16"], ["TENSOR", [1024, 4096], "float16"]], {}], "config": {"index": 1305, "code_hash": null, "entity": [["block_row_warps", "ot", 1], ["block_col_warps", "ot", 1], ["warp_row_tiles", "ot", 2], ["warp_col_tiles", "ot", 1], ["chunk", "ot", 1], ["offset", "ot", 0], ["offsetCS", "ot", 0], ["vec", "ot", 2], ["wmma_m", "ot", 32]]}, "result": [[0.08170146], 0, 5.121309995651245, 1649992507.5909023], "version": 0.2, "tvm_version": "0.8.dev0"}
{"input": ["cuda -keys=cuda,gpu -max_num_threads=1024 -thread_warp_size=32", "dense_tensorcore.cuda", [["TENSOR", [65536, 1024], "float16"], ["TENSOR", [1024, 4096], "float16"]], {}], "config": {"index": 10521, "code_hash": null, "entity": [["block_row_warps", "ot", 1], ["block_col_warps", "ot", 1], ["warp_row_tiles", "ot", 4], ["warp_col_tiles", "ot", 4], ["chunk", "ot", 2], ["offset", "ot", 0], ["offsetCS", "ot", 0], ["vec", "ot", 1], ["wmma_m", "ot", 8]]}, "result": [[0.00451731352173913], 0, 4.411170482635498, 1649992511.6030214], "version": 0.2, "tvm_version": "0.8.dev0"}
{"input": ["cuda -keys=cuda,gpu -max_num_threads=1024 -thread_warp_size=32", "dense_tensorcore.cuda", [["TENSOR", [65536, 1024], "float16"], ["TENSOR", [1024, 4096], "float16"]], {}], "config": {"index": 5890, "code_hash": null, "entity": [["block_row_warps", "ot", 2], ["block_col_warps", "ot", 2], ["warp_row_tiles", "ot", 1], ["warp_col_tiles", "ot", 4], ["chunk", "ot", 1], ["offset", "ot", 0], ["offsetCS", "ot", 8], ["vec", "ot", 1], ["wmma_m", "ot", 16]]}, "result": [[0.0052187098000000005], 0, 4.389206171035767, 1649992515.6268375], "version": 0.2, "tvm_version": "0.8.dev0"}
{"input": ["cuda -keys=cuda,gpu -max_num_threads=1024 -thread_warp_size=32", "dense_tensorcore.cuda", [["TENSOR", [65536, 1024], "float16"], ["TENSOR", [1024, 4096], "float16"]], {}], "config": {"index": 5651, "code_hash": null, "entity": [["block_row_warps", "ot", 4], ["block_col_warps", "ot", 4], ["warp_row_tiles", "ot", 1], ["warp_col_tiles", "ot", 4], ["chunk", "ot", 2], ["offset", "ot", 8], ["offsetCS", "ot", 0], ["vec", "ot", 1], ["wmma_m", "ot", 16]]}, "result": [[0.0034721833103448273], 0, 4.371359825134277, 1649992519.6413796], "version": 0.2, "tvm_version": "0.8.dev0"}
{"input": ["cuda -keys=cuda,gpu -max_num_threads=1024 -thread_warp_size=32", "dense_tensorcore.cuda", [["TENSOR", [65536, 1024], "float16"], ["TENSOR", [1024, 4096], "float16"]], {}], "config": {"index": 12001, "code_hash": null, "entity": [["block_row_warps", "ot", 2], ["block_col_warps", "ot", 2], ["warp_row_tiles", "ot", 2], ["warp_col_tiles", "ot", 1], ["chunk", "ot", 1], ["offset", "ot", 8], ["offsetCS", "ot", 0], ["vec", "ot", 2], ["wmma_m", "ot", 8]]}, "result": [[0.005874563944444445], 0, 4.412557363510132, 1649992523.7094765], "version": 0.2, "tvm_version": "0.8.dev0"}
{"input": ["cuda -keys=cuda,gpu -max_num_threads=1024 -thread_warp_size=32", "dense_tensorcore.cuda", [["TENSOR", [65536, 1024], "float16"], ["TENSOR", [1024, 4096], "float16"]], {}], "config": {"index": 14035, "code_hash": null, "entity": [["block_row_warps", "ot", 2], ["block_col_warps", "ot", 2], ["warp_row_tiles", "ot", 4], ["warp_col_tiles", "ot", 1], ["chunk", "ot", 2], ["offset", "ot", 8], ["offsetCS", "ot", 8], ["vec", "ot", 4], ["wmma_m", "ot", 8]]}, "result": [[0.003986525263157894], 0, 4.604846954345703, 1649992527.9631977], "version": 0.2, "tvm_version": "0.8.dev0"}
{"input": ["cuda -keys=cuda,gpu -max_num_threads=1024 -thread_warp_size=32", "dense_tensorcore.cuda", [["TENSOR", [65536, 1024], "float16"], ["TENSOR", [1024, 4096], "float16"]], {}], "config": {"index": 14475, "code_hash": null, "entity": [["block_row_warps", "ot", 1], ["block_col_warps", "ot", 2], ["warp_row_tiles", "ot", 1], ["warp_col_tiles", "ot", 4], ["chunk", "ot", 4], ["offset", "ot", 0], ["offsetCS", "ot", 0], ["vec", "ot", 8], ["wmma_m", "ot", 8]]}, "result": [[0.013937033], 0, 4.400481939315796, 1649992532.0010617], "version": 0.2, "tvm_version": "0.8.dev0"}
{"input": ["cuda -keys=cuda,gpu -max_num_threads=1024 -thread_warp_size=32", "dense_tensorcore.cuda", [["TENSOR", [65536, 1024], "float16"], ["TENSOR", [1024, 4096], "float16"]], {}], "config": {"index": 2136, "code_hash": null, "entity": [["block_row_warps", "ot", 1], ["block_col_warps", "ot", 2], ["warp_row_tiles", "ot", 1], ["warp_col_tiles", "ot", 2], ["chunk", "ot", 4], ["offset", "ot", 0], ["offsetCS", "ot", 8], ["vec", "ot", 2], ["wmma_m", "ot", 32]]}, "result": [[0.011581144555555554], 0, 4.392880916595459, 1649992536.0383039], "version": 0.2, "tvm_version": "0.8.dev0"}
{"input": ["cuda -keys=cuda,gpu -max_num_threads=1024 -thread_warp_size=32", "dense_tensorcore.cuda", [["TENSOR", [65536, 1024], "float16"], ["TENSOR", [1024, 4096], "float16"]], {}], "config": {"index": 9471, "code_hash": null, "entity": [["block_row_warps", "ot", 1], ["block_col_warps", "ot", 2], ["warp_row_tiles", "ot", 4], ["warp_col_tiles", "ot", 4], ["chunk", "ot", 1], ["offset", "ot", 8], ["offsetCS", "ot", 0], ["vec", "ot", 8], ["wmma_m", "ot", 16]]}, "result": [[0.0029947965], 0, 4.405338287353516, 1649992558.3626287], "version": 0.2, "tvm_version": "0.8.dev0"}
{"input": ["cuda -keys=cuda,gpu -max_num_threads=1024 -thread_warp_size=32", "dense_tensorcore.cuda", [["TENSOR", [65536, 1024], "float16"], ["TENSOR", [1024, 4096], "float16"]], {}], "config": {"index": 8175, "code_hash": null, "entity": [["block_row_warps", "ot", 1], ["block_col_warps", "ot", 2], ["warp_row_tiles", "ot", 4], ["warp_col_tiles", "ot", 4], ["chunk", "ot", 1], ["offset", "ot", 8], ["offsetCS", "ot", 0], ["vec", "ot", 4], ["wmma_m", "ot", 16]]}, "result": [[0.0031102743636363638], 0, 4.50709342956543, 1649992562.46766], "version": 0.2, "tvm_version": "0.8.dev0"}
{"input": ["cuda -keys=cuda,gpu -max_num_threads=1024 -thread_warp_size=32", "dense_tensorcore.cuda", [["TENSOR", [65536, 1024], "float16"], ["TENSOR", [1024, 4096], "float16"]], {}], "config": {"index": 4290, "code_hash": null, "entity": [["block_row_warps", "ot", 1], ["block_col_warps", "ot", 4], ["warp_row_tiles", "ot", 4], ["warp_col_tiles", "ot", 4], ["chunk", "ot", 1], ["offset", "ot", 8], ["offsetCS", "ot", 0], ["vec", "ot", 8], ["wmma_m", "ot", 32]]}, "result": [[0.00271013327027027], 0, 4.602344512939453, 1649992566.6325583], "version": 0.2, "tvm_version": "0.8.dev0"}
{"input": ["cuda -keys=cuda,gpu -max_num_threads=1024 -thread_warp_size=32", "dense_tensorcore.cuda", [["TENSOR", [65536, 1024], "float16"], ["TENSOR", [1024, 4096], "float16"]], {}], "config": {"index": 10119, "code_hash": null, "entity": [["block_row_warps", "ot", 1], ["block_col_warps", "ot", 2], ["warp_row_tiles", "ot", 4], ["warp_col_tiles", "ot", 4], ["chunk", "ot", 1], ["offset", "ot", 8], ["offsetCS", "ot", 8], ["vec", "ot", 8], ["wmma_m", "ot", 16]]}, "result": [[0.002933484371428571], 0, 4.588331937789917, 1649992570.8018854], "version": 0.2, "tvm_version": "0.8.dev0"}
{"input": ["cuda -keys=cuda,gpu -max_num_threads=1024 -thread_warp_size=32", "dense_tensorcore.cuda", [["TENSOR", [65536, 1024], "float16"], ["TENSOR", [1024, 4096], "float16"]], {}], "config": {"index": 9147, "code_hash": null, "entity": [["block_row_warps", "ot", 1], ["block_col_warps", "ot", 2], ["warp_row_tiles", "ot", 4], ["warp_col_tiles", "ot", 4], ["chunk", "ot", 1], ["offset", "ot", 0], ["offsetCS", "ot", 0], ["vec", "ot", 8], ["wmma_m", "ot", 16]]}, "result": [[0.0030617516969696974], 0, 5.461765289306641, 1649992575.873579], "version": 0.2, "tvm_version": "0.8.dev0"}
{"input": ["cuda -keys=cuda,gpu -max_num_threads=1024 -thread_warp_size=32", "dense_tensorcore.cuda", [["TENSOR", [65536, 1024], "float16"], ["TENSOR", [1024, 4096], "float16"]], {}], "config": {"index": 2994, "code_hash": null, "entity": [["block_row_warps", "ot", 1], ["block_col_warps", "ot", 4], ["warp_row_tiles", "ot", 4], ["warp_col_tiles", "ot", 4], ["chunk", "ot", 1], ["offset", "ot", 8], ["offsetCS", "ot", 0], ["vec", "ot", 4], ["wmma_m", "ot", 32]]}, "result": [[0.0028699321714285714], 0, 4.596919775009155, 1649992580.0295923], "version": 0.2, "tvm_version": "0.8.dev0"}
{"input": ["cuda -keys=cuda,gpu -max_num_threads=1024 -thread_warp_size=32", "dense_tensorcore.cuda", [["TENSOR", [65536, 1024], "float16"], ["TENSOR", [1024, 4096], "float16"]], {}], "config": {"index": 4287, "code_hash": null, "entity": [["block_row_warps", "ot", 1], ["block_col_warps", "ot", 2], ["warp_row_tiles", "ot", 4], ["warp_col_tiles", "ot", 4], ["chunk", "ot", 1], ["offset", "ot", 8], ["offsetCS", "ot", 0], ["vec", "ot", 8], ["wmma_m", "ot", 32]]}, "result": [[0.004861370142857143], 0, 4.503846645355225, 1649992584.114901], "version": 0.2, "tvm_version": "0.8.dev0"}
{"input": ["cuda -keys=cuda,gpu -max_num_threads=1024 -thread_warp_size=32", "dense_tensorcore.cuda", [["TENSOR", [65536, 1024], "float16"], ["TENSOR", [1024, 4096], "float16"]], {}], "config": {"index": 4368, "code_hash": null, "entity": [["block_row_warps", "ot", 1], ["block_col_warps", "ot", 2], ["warp_row_tiles", "ot", 4], ["warp_col_tiles", "ot", 4], ["chunk", "ot", 2], ["offset", "ot", 8], ["offsetCS", "ot", 0], ["vec", "ot", 8], ["wmma_m", "ot", 32]]}, "result": [[0.003939355789473684], 0, 4.822556734085083, 1649992588.4636104], "version": 0.2, "tvm_version": "0.8.dev0"}
{"input": ["cuda -keys=cuda,gpu -max_num_threads=1024 -thread_warp_size=32", "dense_tensorcore.cuda", [["TENSOR", [65536, 1024], "float16"], ["TENSOR", [1024, 4096], "float16"]], {}], "config": {"index": 3966, "code_hash": null, "entity": [["block_row_warps", "ot", 1], ["block_col_warps", "ot", 4], ["warp_row_tiles", "ot", 4], ["warp_col_tiles", "ot", 4], ["chunk", "ot", 1], ["offset", "ot", 0], ["offsetCS", "ot", 0], ["vec", "ot", 8], ["wmma_m", "ot", 32]]}, "result": [[0.002668426157894737], 0, 4.520890712738037, 1649992592.5597541], "version": 0.2, "tvm_version": "0.8.dev0"}
{"input": ["cuda -keys=cuda,gpu -max_num_threads=1024 -thread_warp_size=32", "dense_tensorcore.cuda", [["TENSOR", [65536, 1024], "float16"], ["TENSOR", [1024, 4096], "float16"]], {}], "config": {"index": 13413, "code_hash": null, "entity": [["block_row_warps", "ot", 1], ["block_col_warps", "ot", 2], ["warp_row_tiles", "ot", 4], ["warp_col_tiles", "ot", 2], ["chunk", "ot", 2], ["offset", "ot", 8], ["offsetCS", "ot", 0], ["vec", "ot", 4], ["wmma_m", "ot", 8]]}, "result": [[0.0032798640322580647], 0, 4.558240652084351, 1649992596.6739924], "version": 0.2, "tvm_version": "0.8.dev0"}
{"input": ["cuda -keys=cuda,gpu -max_num_threads=1024 -thread_warp_size=32", "dense_tensorcore.cuda", [["TENSOR", [65536, 1024], "float16"], ["TENSOR", [1024, 4096], "float16"]], {}], "config": {"index": 8176, "code_hash": null, "entity": [["block_row_warps", "ot", 2], ["block_col_warps", "ot", 2], ["warp_row_tiles", "ot", 4], ["warp_col_tiles", "ot", 4], ["chunk", "ot", 1], ["offset", "ot", 8], ["offsetCS", "ot", 0], ["vec", "ot", 4], ["wmma_m", "ot", 16]]}, "result": [[0.0027663692972972973], 0, 4.414145469665527, 1649992600.6921456], "version": 0.2, "tvm_version": "0.8.dev0"}
{"input": ["cuda -keys=cuda,gpu -max_num_threads=1024 -thread_warp_size=32", "dense_tensorcore.cuda", [["TENSOR", [65536, 1024], "float16"], ["TENSOR", [1024, 4096], "float16"]], {}], "config": {"index": 4044, "code_hash": null, "entity": [["block_row_warps", "ot", 1], ["block_col_warps", "ot", 2], ["warp_row_tiles", "ot", 4], ["warp_col_tiles", "ot", 4], ["chunk", "ot", 2], ["offset", "ot", 0], ["offsetCS", "ot", 0], ["vec", "ot", 8], ["wmma_m", "ot", 32]]}, "result": [[0.003519238622222222], 0, 4.6585705280303955, 1649992604.9353485], "version": 0.2, "tvm_version": "0.8.dev0"}
{"input": ["cuda -keys=cuda,gpu -max_num_threads=1024 -thread_warp_size=32", "dense_tensorcore.cuda", [["TENSOR", [65536, 1024], "float16"], ["TENSOR", [1024, 4096], "float16"]], {}], "config": {"index": 3626, "code_hash": null, "entity": [["block_row_warps", "ot", 4], ["block_col_warps", "ot", 4], ["warp_row_tiles", "ot", 1], ["warp_col_tiles", "ot", 4], ["chunk", "ot", 1], ["offset", "ot", 8], ["offsetCS", "ot", 8], ["vec", "ot", 4], ["wmma_m", "ot", 32]]}, "result": [[0.003763458814814815], 0, 4.35934591293335, 1649992608.9008853], "version": 0.2, "tvm_version": "0.8.dev0"}
{"input": ["cuda -keys=cuda,gpu -max_num_threads=1024 -thread_warp_size=32", "dense_tensorcore.cuda", [["TENSOR", [65536, 1024], "float16"], ["TENSOR", [1024, 4096], "float16"]], {}], "config": {"index": 2978, "code_hash": null, "entity": [["block_row_warps", "ot", 4], ["block_col_warps", "ot", 4], ["warp_row_tiles", "ot", 1], ["warp_col_tiles", "ot", 4], ["chunk", "ot", 1], ["offset", "ot", 8], ["offsetCS", "ot", 0], ["vec", "ot", 4], ["wmma_m", "ot", 32]]}, "result": [[0.0038015650000000002], 0, 4.4008448123931885, 1649992612.8533525], "version": 0.2, "tvm_version": "0.8.dev0"}
{"input": ["cuda -keys=cuda,gpu -max_num_threads=1024 -thread_warp_size=32", "dense_tensorcore.cuda", [["TENSOR", [65536, 1024], "float16"], ["TENSOR", [1024, 4096], "float16"]], {}], "config": {"index": 14630, "code_hash": null, "entity": [["block_row_warps", "ot", 4], ["block_col_warps", "ot", 2], ["warp_row_tiles", "ot", 4], ["warp_col_tiles", "ot", 2], ["chunk", "ot", 1], ["offset", "ot", 8], ["offsetCS", "ot", 0], ["vec", "ot", 8], ["wmma_m", "ot", 8]]}, "result": [[0.002876917657142857], 0, 4.385701894760132, 1649992616.801725], "version": 0.2, "tvm_version": "0.8.dev0"}
{"input": ["cuda -keys=cuda,gpu -max_num_threads=1024 -thread_warp_size=32", "dense_tensorcore.cuda", [["TENSOR", [65536, 1024], "float16"], ["TENSOR", [1024, 4096], "float16"]], {}], "config": {"index": 8792, "code_hash": null, "entity": [["block_row_warps", "ot", 4], ["block_col_warps", "ot", 4], ["warp_row_tiles", "ot", 2], ["warp_col_tiles", "ot", 2], ["chunk", "ot", 1], ["offset", "ot", 8], ["offsetCS", "ot", 8], ["vec", "ot", 4], ["wmma_m", "ot", 16]]}, "result": [[0.0035633719523809524], 0, 4.6269378662109375, 1649992620.9633157], "version": 0.2, "tvm_version": "0.8.dev0"}
{"input": ["cuda -keys=cuda,gpu -max_num_threads=1024 -thread_warp_size=32", "dense_tensorcore.cuda", [["TENSOR", [65536, 1024], "float16"], ["TENSOR", [1024, 4096], "float16"]], {}], "config": {"index": 4938, "code_hash": null, "entity": [["block_row_warps", "ot", 1], ["block_col_warps", "ot", 4], ["warp_row_tiles", "ot", 4], ["warp_col_tiles", "ot", 4], ["chunk", "ot", 1], ["offset", "ot", 8], ["offsetCS", "ot", 8], ["vec", "ot", 8], ["wmma_m", "ot", 32]]}, "result": [[0.0026595396578947368], 0, 4.393561363220215, 1649992624.9245439], "version": 0.2, "tvm_version": "0.8.dev0"}
{"input": ["cuda -keys=cuda,gpu -max_num_threads=1024 -thread_warp_size=32", "dense_tensorcore.cuda", [["TENSOR", [65536, 1024], "float16"], ["TENSOR", [1024, 4096], "float16"]], {}], "config": {"index": 8144, "code_hash": null, "entity": [["block_row_warps", "ot", 4], ["block_col_warps", "ot", 4], ["warp_row_tiles", "ot", 2], ["warp_col_tiles", "ot", 2], ["chunk", "ot", 1], ["offset", "ot", 8], ["offsetCS", "ot", 0], ["vec", "ot", 4], ["wmma_m", "ot", 16]]}, "result": [[0.0035853795714285716], 0, 4.315201997756958, 1649992628.8528063], "version": 0.2, "tvm_version": "0.8.dev0"}
{"input": ["cuda -keys=cuda,gpu -max_num_threads=1024 -thread_warp_size=32", "dense_tensorcore.cuda", [["TENSOR", [65536, 1024], "float16"], ["TENSOR", [1024, 4096], "float16"]], {}], "config": {"index": 8823, "code_hash": null, "entity": [["block_row_warps", "ot", 1], ["block_col_warps", "ot", 2], ["warp_row_tiles", "ot", 4], ["warp_col_tiles", "ot", 4], ["chunk", "ot", 1], ["offset", "ot", 8], ["offsetCS", "ot", 8], ["vec", "ot", 4], ["wmma_m", "ot", 16]]}, "result": [[0.0030385706666666663], 0, 4.441858768463135, 1649992632.8585007], "version": 0.2, "tvm_version": "0.8.dev0"}
{"input": ["cuda -keys=cuda,gpu -max_num_threads=1024 -thread_warp_size=32", "dense_tensorcore.cuda", [["TENSOR", [65536, 1024], "float16"], ["TENSOR", [1024, 4096], "float16"]], {}], "config": {"index": 2991, "code_hash": null, "entity": [["block_row_warps", "ot", 1], ["block_col_warps", "ot", 2], ["warp_row_tiles", "ot", 4], ["warp_col_tiles", "ot", 4], ["chunk", "ot", 1], ["offset", "ot", 8], ["offsetCS", "ot", 0], ["vec", "ot", 4], ["wmma_m", "ot", 32]]}, "result": [[0.005273791263157895], 0, 4.454686880111694, 1649992636.866995], "version": 0.2, "tvm_version": "0.8.dev0"}
{"input": ["cuda -keys=cuda,gpu -max_num_threads=1024 -thread_warp_size=32", "dense_tensorcore.cuda", [["TENSOR", [65536, 1024], "float16"], ["TENSOR", [1024, 4096], "float16"]], {}], "config": {"index": 13415, "code_hash": null, "entity": [["block_row_warps", "ot", 4], ["block_col_warps", "ot", 2], ["warp_row_tiles", "ot", 4], ["warp_col_tiles", "ot", 2], ["chunk", "ot", 2], ["offset", "ot", 8], ["offsetCS", "ot", 0], ["vec", "ot", 4], ["wmma_m", "ot", 8]]}, "result": [[0.0024278208809523807], 0, 4.415165424346924, 1649992640.856972], "version": 0.2, "tvm_version": "0.8.dev0"}
{"input": ["cuda -keys=cuda,gpu -max_num_threads=1024 -thread_warp_size=32", "dense_tensorcore.cuda", [["TENSOR", [65536, 1024], "float16"], ["TENSOR", [1024, 4096], "float16"]], {}], "config": {"index": 13310, "code_hash": null, "entity": [["block_row_warps", "ot", 4], ["block_col_warps", "ot", 4], ["warp_row_tiles", "ot", 4], ["warp_col_tiles", "ot", 1], ["chunk", "ot", 1], ["offset", "ot", 8], ["offsetCS", "ot", 0], ["vec", "ot", 4], ["wmma_m", "ot", 8]]}, "result": [[0.0039011113461538457], 0, 4.442910671234131, 1649992644.8693707], "version": 0.2, "tvm_version": "0.8.dev0"}
{"input": ["cuda -keys=cuda,gpu -max_num_threads=1024 -thread_warp_size=32", "dense_tensorcore.cuda", [["TENSOR", [65536, 1024], "float16"], ["TENSOR", [1024, 4096], "float16"]], {}], "config": {"index": 14733, "code_hash": null, "entity": [["block_row_warps", "ot", 1], ["block_col_warps", "ot", 1], ["warp_row_tiles", "ot", 4], ["warp_col_tiles", "ot", 4], ["chunk", "ot", 2], ["offset", "ot", 8], ["offsetCS", "ot", 0], ["vec", "ot", 8], ["wmma_m", "ot", 8]]}, "result": [[0.003272783677419355], 0, 4.450379133224487, 1649992648.891666], "version": 0.2, "tvm_version": "0.8.dev0"}
{"input": ["cuda -keys=cuda,gpu -max_num_threads=1024 -thread_warp_size=32", "dense_tensorcore.cuda", [["TENSOR", [65536, 1024], "float16"], ["TENSOR", [1024, 4096], "float16"]], {}], "config": {"index": 9447, "code_hash": null, "entity": [["block_row_warps", "ot", 1], ["block_col_warps", "ot", 4], ["warp_row_tiles", "ot", 4], ["warp_col_tiles", "ot", 2], ["chunk", "ot", 1], ["offset", "ot", 8], ["offsetCS", "ot", 0], ["vec", "ot", 8], ["wmma_m", "ot", 16]]}, "result": [[0.003458221793103448], 0, 4.447312831878662, 1649992652.904216], "version": 0.2, "tvm_version": "0.8.dev0"}
{"input": ["cuda -keys=cuda,gpu -max_num_threads=1024 -thread_warp_size=32", "dense_tensorcore.cuda", [["TENSOR", [65536, 1024], "float16"], ["TENSOR", [1024, 4096], "float16"]], {}], "config": {"index": 7851, "code_hash": null, "entity": [["block_row_warps", "ot", 1], ["block_col_warps", "ot", 2], ["warp_row_tiles", "ot", 4], ["warp_col_tiles", "ot", 4], ["chunk", "ot", 1], ["offset", "ot", 0], ["offsetCS", "ot", 0], ["vec", "ot", 4], ["wmma_m", "ot", 16]]}, "result": [[0.0030862145757575756], 0, 4.34901762008667, 1649992657.5103002], "version": 0.2, "tvm_version": "0.8.dev0"}
{"input": ["cuda -keys=cuda,gpu -max_num_threads=1024 -thread_warp_size=32", "dense_tensorcore.cuda", [["TENSOR", [65536, 1024], "float16"], ["TENSOR", [1024, 4096], "float16"]], {}], "config": {"index": 9795, "code_hash": null, "entity": [["block_row_warps", "ot", 1], ["block_col_warps", "ot", 2], ["warp_row_tiles", "ot", 4], ["warp_col_tiles", "ot", 4], ["chunk", "ot", 1], ["offset", "ot", 0], ["offsetCS", "ot", 8], ["vec", "ot", 8], ["wmma_m", "ot", 16]]}, "result": [[0.002822566361111111], 0, 4.494463682174683, 1649992661.5922644], "version": 0.2, "tvm_version": "0.8.dev0"}
{"input": ["cuda -keys=cuda,gpu -max_num_threads=1024 -thread_warp_size=32", "dense_tensorcore.cuda", [["TENSOR", [65536, 1024], "float16"], ["TENSOR", [1024, 4096], "float16"]], {}], "config": {"index": 4281, "code_hash": null, "entity": [["block_row_warps", "ot", 1], ["block_col_warps", "ot", 4], ["warp_row_tiles", "ot", 2], ["warp_col_tiles", "ot", 4], ["chunk", "ot", 1], ["offset", "ot", 8], ["offsetCS", "ot", 0], ["vec", "ot", 8], ["wmma_m", "ot", 32]]}, "result": [[0.003283590847826087], 0, 4.631183862686157, 1649992665.8070924], "version": 0.2, "tvm_version": "0.8.dev0"}
{"input": ["cuda -keys=cuda,gpu -max_num_threads=1024 -thread_warp_size=32", "dense_tensorcore.cuda", [["TENSOR", [65536, 1024], "float16"], ["TENSOR", [1024, 4096], "float16"]], {}], "config": {"index": 13411, "code_hash": null, "entity": [["block_row_warps", "ot", 2], ["block_col_warps", "ot", 1], ["warp_row_tiles", "ot", 4], ["warp_col_tiles", "ot", 2], ["chunk", "ot", 2], ["offset", "ot", 8], ["offsetCS", "ot", 0], ["vec", "ot", 4], ["wmma_m", "ot", 8]]}, "result": [[0.0035523532068965514], 0, 4.511479139328003, 1649992669.9047298], "version": 0.2, "tvm_version": "0.8.dev0"}
{"input": ["cuda -keys=cuda,gpu -max_num_threads=1024 -thread_warp_size=32", "dense_tensorcore.cuda", [["TENSOR", [65536, 1024], "float16"], ["TENSOR", [1024, 4096], "float16"]], {}], "config": {"index": 3963, "code_hash": null, "entity": [["block_row_warps", "ot", 1], ["block_col_warps", "ot", 2], ["warp_row_tiles", "ot", 4], ["warp_col_tiles", "ot", 4], ["chunk", "ot", 1], ["offset", "ot", 0], ["offsetCS", "ot", 0], ["vec", "ot", 8], ["wmma_m", "ot", 32]]}, "result": [[0.004861779666666667], 0, 4.5090954303741455, 1649992674.0202484], "version": 0.2, "tvm_version": "0.8.dev0"}
{"input": ["cuda -keys=cuda,gpu -max_num_threads=1024 -thread_warp_size=32", "dense_tensorcore.cuda", [["TENSOR", [65536, 1024], "float16"], ["TENSOR", [1024, 4096], "float16"]], {}], "config": {"index": 12110, "code_hash": null, "entity": [["block_row_warps", "ot", 4], ["block_col_warps", "ot", 2], ["warp_row_tiles", "ot", 2], ["warp_col_tiles", "ot", 2], ["chunk", "ot", 2], ["offset", "ot", 8], ["offsetCS", "ot", 0], ["vec", "ot", 2], ["wmma_m", "ot", 8]]}, "result": [[0.00322426496], 0, 4.966742038726807, 1649992678.579275], "version": 0.2, "tvm_version": "0.8.dev0"}
{"input": ["cuda -keys=cuda,gpu -max_num_threads=1024 -thread_warp_size=32", "dense_tensorcore.cuda", [["TENSOR", [65536, 1024], "float16"], ["TENSOR", [1024, 4096], "float16"]], {}], "config": {"index": 9552, "code_hash": null, "entity": [["block_row_warps", "ot", 1], ["block_col_warps", "ot", 2], ["warp_row_tiles", "ot", 4], ["warp_col_tiles", "ot", 4], ["chunk", "ot", 2], ["offset", "ot", 8], ["offsetCS", "ot", 0], ["vec", "ot", 8], ["wmma_m", "ot", 16]]}, "result": [[0.002553044325], 0, 4.3836071491241455, 1649992682.5837734], "version": 0.2, "tvm_version": "0.8.dev0"}
{"input": ["cuda -keys=cuda,gpu -max_num_threads=1024 -thread_warp_size=32", "dense_tensorcore.cuda", [["TENSOR", [65536, 1024], "float16"], ["TENSOR", [1024, 4096], "float16"]], {}], "config": {"index": 4344, "code_hash": null, "entity": [["block_row_warps", "ot", 1], ["block_col_warps", "ot", 4], ["warp_row_tiles", "ot", 4], ["warp_col_tiles", "ot", 2], ["chunk", "ot", 2], ["offset", "ot", 8], ["offsetCS", "ot", 0], ["vec", "ot", 8], ["wmma_m", "ot", 32]]}, "result": [[0.003730441444444444], 0, 4.417265892028809, 1649992686.5857303], "version": 0.2, "tvm_version": "0.8.dev0"}
{"input": ["cuda -keys=cuda,gpu -max_num_threads=1024 -thread_warp_size=32", "dense_tensorcore.cuda", [["TENSOR", [65536, 1024], "float16"], ["TENSOR", [1024, 4096], "float16"]], {}], "config": {"index": 4263, "code_hash": null, "entity": [["block_row_warps", "ot", 1], ["block_col_warps", "ot", 4], ["warp_row_tiles", "ot", 4], ["warp_col_tiles", "ot", 2], ["chunk", "ot", 1], ["offset", "ot", 8], ["offsetCS", "ot", 0], ["vec", "ot", 8], ["wmma_m", "ot", 32]]}, "result": [[0.004719046272727272], 0, 4.506145477294922, 1649992690.750635], "version": 0.2, "tvm_version": "0.8.dev0"}
{"input": ["cuda -keys=cuda,gpu -max_num_threads=1024 -thread_warp_size=32", "dense_tensorcore.cuda", [["TENSOR", [65536, 1024], "float16"], ["TENSOR", [1024, 4096], "float16"]], {}], "config": {"index": 2967, "code_hash": null, "entity": [["block_row_warps", "ot", 1], ["block_col_warps", "ot", 4], ["warp_row_tiles", "ot", 4], ["warp_col_tiles", "ot", 2], ["chunk", "ot", 1], ["offset", "ot", 8], ["offsetCS", "ot", 0], ["vec", "ot", 4], ["wmma_m", "ot", 32]]}, "result": [[0.005516578157894737], 0, 4.605014801025391, 1649992694.9726882], "version": 0.2, "tvm_version": "0.8.dev0"}
{"input": ["cuda -keys=cuda,gpu -max_num_threads=1024 -thread_warp_size=32", "dense_tensorcore.cuda", [["TENSOR", [65536, 1024], "float16"], ["TENSOR", [1024, 4096], "float16"]], {}], "config": {"index": 8256, "code_hash": null, "entity": [["block_row_warps", "ot", 1], ["block_col_warps", "ot", 2], ["warp_row_tiles", "ot", 4], ["warp_col_tiles", "ot", 4], ["chunk", "ot", 2], ["offset", "ot", 8], ["offsetCS", "ot", 0], ["vec", "ot", 4], ["wmma_m", "ot", 16]]}, "result": [[0.0025479145], 0, 4.612416505813599, 1649992699.1531672], "version": 0.2, "tvm_version": "0.8.dev0"}
{"input": ["cuda -keys=cuda,gpu -max_num_threads=1024 -thread_warp_size=32", "dense_tensorcore.cuda", [["TENSOR", [65536, 1024], "float16"], ["TENSOR", [1024, 4096], "float16"]], {}], "config": {"index": 12191, "code_hash": null, "entity": [["block_row_warps", "ot", 4], ["block_col_warps", "ot", 2], ["warp_row_tiles", "ot", 2], ["warp_col_tiles", "ot", 2], ["chunk", "ot", 4], ["offset", "ot", 8], ["offsetCS", "ot", 0], ["vec", "ot", 2], ["wmma_m", "ot", 8]]}, "result": [[0.002695130847457627], 0, 4.813677787780762, 1649992703.576191], "version": 0.2, "tvm_version": "0.8.dev0"}
{"input": ["cuda -keys=cuda,gpu -max_num_threads=1024 -thread_warp_size=32", "dense_tensorcore.cuda", [["TENSOR", [65536, 1024], "float16"], ["TENSOR", [1024, 4096], "float16"]], {}], "config": {"index": 3642, "code_hash": null, "entity": [["block_row_warps", "ot", 1], ["block_col_warps", "ot", 4], ["warp_row_tiles", "ot", 4], ["warp_col_tiles", "ot", 4], ["chunk", "ot", 1], ["offset", "ot", 8], ["offsetCS", "ot", 8], ["vec", "ot", 4], ["wmma_m", "ot", 32]]}, "result": [[0.0028204192222222226], 0, 4.561781883239746, 1649992707.6839726], "version": 0.2, "tvm_version": "0.8.dev0"}
{"input": ["cuda -keys=cuda,gpu -max_num_threads=1024 -thread_warp_size=32", "dense_tensorcore.cuda", [["TENSOR", [65536, 1024], "float16"], ["TENSOR", [1024, 4096], "float16"]], {}], "config": {"index": 10814, "code_hash": null, "entity": [["block_row_warps", "ot", 4], ["block_col_warps", "ot", 2], ["warp_row_tiles", "ot", 2], ["warp_col_tiles", "ot", 2], ["chunk", "ot", 2], ["offset", "ot", 8], ["offsetCS", "ot", 0], ["vec", "ot", 1], ["wmma_m", "ot", 8]]}, "result": [[0.0033758233555555555], 0, 4.865171670913696, 1649992712.1112688], "version": 0.2, "tvm_version": "0.8.dev0"}
{"input": ["cuda -keys=cuda,gpu -max_num_threads=1024 -thread_warp_size=32", "dense_tensorcore.cuda", [["TENSOR", [65536, 1024], "float16"], ["TENSOR", [1024, 4096], "float16"]], {}], "config": {"index": 4614, "code_hash": null, "entity": [["block_row_warps", "ot", 1], ["block_col_warps", "ot", 4], ["warp_row_tiles", "ot", 4], ["warp_col_tiles", "ot", 4], ["chunk", "ot", 1], ["offset", "ot", 0], ["offsetCS", "ot", 8], ["vec", "ot", 8], ["wmma_m", "ot", 32]]}, "result": [[0.0026212094871794875], 0, 4.474969863891602, 1649992716.0880365], "version": 0.2, "tvm_version": "0.8.dev0"}
{"input": ["cuda -keys=cuda,gpu -max_num_threads=1024 -thread_warp_size=32", "dense_tensorcore.cuda", [["TENSOR", [65536, 1024], "float16"], ["TENSOR", [1024, 4096], "float16"]], {}], "config": {"index": 8249, "code_hash": null, "entity": [["block_row_warps", "ot", 4], ["block_col_warps", "ot", 2], ["warp_row_tiles", "ot", 2], ["warp_col_tiles", "ot", 4], ["chunk", "ot", 2], ["offset", "ot", 8], ["offsetCS", "ot", 0], ["vec", "ot", 4], ["wmma_m", "ot", 16]]}, "result": [[0.0026227530256410256], 0, 4.348567485809326, 1649992720.058047], "version": 0.2, "tvm_version": "0.8.dev0"}
{"input": ["cuda -keys=cuda,gpu -max_num_threads=1024 -thread_warp_size=32", "dense_tensorcore.cuda", [["TENSOR", [65536, 1024], "float16"], ["TENSOR", [1024, 4096], "float16"]], {}], "config": {"index": 13958, "code_hash": null, "entity": [["block_row_warps", "ot", 4], ["block_col_warps", "ot", 4], ["warp_row_tiles", "ot", 4], ["warp_col_tiles", "ot", 1], ["chunk", "ot", 1], ["offset", "ot", 8], ["offsetCS", "ot", 8], ["vec", "ot", 4], ["wmma_m", "ot", 8]]}, "result": [[0.003901838269230769], 0, 4.327993631362915, 1649992724.0063517], "version": 0.2, "tvm_version": "0.8.dev0"}
{"input": ["cuda -keys=cuda,gpu -max_num_threads=1024 -thread_warp_size=32", "dense_tensorcore.cuda", [["TENSOR", [65536, 1024], "float16"], ["TENSOR", [1024, 4096], "float16"]], {}], "config": {"index": 13334, "code_hash": null, "entity": [["block_row_warps", "ot", 4], ["block_col_warps", "ot", 2], ["warp_row_tiles", "ot", 4], ["warp_col_tiles", "ot", 2], ["chunk", "ot", 1], ["offset", "ot", 8], ["offsetCS", "ot", 0], ["vec", "ot", 4], ["wmma_m", "ot", 8]]}, "result": [[0.0029842498529411765], 0, 4.465413331985474, 1649992727.9885685], "version": 0.2, "tvm_version": "0.8.dev0"}
{"input": ["cuda -keys=cuda,gpu -max_num_threads=1024 -thread_warp_size=32", "dense_tensorcore.cuda", [["TENSOR", [65536, 1024], "float16"], ["TENSOR", [1024, 4096], "float16"]], {}], "config": {"index": 8221, "code_hash": null, "entity": [["block_row_warps", "ot", 2], ["block_col_warps", "ot", 2], ["warp_row_tiles", "ot", 2], ["warp_col_tiles", "ot", 2], ["chunk", "ot", 2], ["offset", "ot", 8], ["offsetCS", "ot", 0], ["vec", "ot", 4], ["wmma_m", "ot", 16]]}, "result": [[0.00406885148], 0, 4.320390939712524, 1649992731.9318564], "version": 0.2, "tvm_version": "0.8.dev0"}
{"input": ["cuda -keys=cuda,gpu -max_num_threads=1024 -thread_warp_size=32", "dense_tensorcore.cuda", [["TENSOR", [65536, 1024], "float16"], ["TENSOR", [1024, 4096], "float16"]], {}], "config": {"index": 8149, "code_hash": null, "entity": [["block_row_warps", "ot", 2], ["block_col_warps", "ot", 2], ["warp_row_tiles", "ot", 4], ["warp_col_tiles", "ot", 2], ["chunk", "ot", 1], ["offset", "ot", 8], ["offsetCS", "ot", 0], ["vec", "ot", 4], ["wmma_m", "ot", 16]]}, "result": [[0.005519388631578948], 0, 4.453273296356201, 1649992735.9748805], "version": 0.2, "tvm_version": "0.8.dev0"}
{"input": ["cuda -keys=cuda,gpu -max_num_threads=1024 -thread_warp_size=32", "dense_tensorcore.cuda", [["TENSOR", [65536, 1024], "float16"], ["TENSOR", [1024, 4096], "float16"]], {}], "config": {"index": 6944, "code_hash": null, "entity": [["block_row_warps", "ot", 4], ["block_col_warps", "ot", 2], ["warp_row_tiles", "ot", 1], ["warp_col_tiles", "ot", 4], ["chunk", "ot", 2], ["offset", "ot", 8], ["offsetCS", "ot", 0], ["vec", "ot", 2], ["wmma_m", "ot", 16]]}, "result": [[0.0033687336333333338], 0, 4.424418210983276, 1649992739.9885545], "version": 0.2, "tvm_version": "0.8.dev0"}
{"input": ["cuda -keys=cuda,gpu -max_num_threads=1024 -thread_warp_size=32", "dense_tensorcore.cuda", [["TENSOR", [65536, 1024], "float16"], ["TENSOR", [1024, 4096], "float16"]], {}], "config": {"index": 8247, "code_hash": null, "entity": [["block_row_warps", "ot", 1], ["block_col_warps", "ot", 2], ["warp_row_tiles", "ot", 2], ["warp_col_tiles", "ot", 4], ["chunk", "ot", 2], ["offset", "ot", 8], ["offsetCS", "ot", 0], ["vec", "ot", 4], ["wmma_m", "ot", 16]]}, "result": [[0.0033281353541666663], 0, 4.737171411514282, 1649992744.2844748], "version": 0.2, "tvm_version": "0.8.dev0"}
{"input": ["cuda -keys=cuda,gpu -max_num_threads=1024 -thread_warp_size=32", "dense_tensorcore.cuda", [["TENSOR", [65536, 1024], "float16"], ["TENSOR", [1024, 4096], "float16"]], {}], "config": {"index": 8230, "code_hash": null, "entity": [["block_row_warps", "ot", 2], ["block_col_warps", "ot", 2], ["warp_row_tiles", "ot", 4], ["warp_col_tiles", "ot", 2], ["chunk", "ot", 2], ["offset", "ot", 8], ["offsetCS", "ot", 0], ["vec", "ot", 4], ["wmma_m", "ot", 16]]}, "result": [[0.003711834666666667], 0, 4.45085597038269, 1649992748.2948227], "version": 0.2, "tvm_version": "0.8.dev0"}
{"input": ["cuda -keys=cuda,gpu -max_num_threads=1024 -thread_warp_size=32", "dense_tensorcore.cuda", [["TENSOR", [65536, 1024], "float16"], ["TENSOR", [1024, 4096], "float16"]], {}], "config": {"index": 13387, "code_hash": null, "entity": [["block_row_warps", "ot", 2], ["block_col_warps", "ot", 2], ["warp_row_tiles", "ot", 4], ["warp_col_tiles", "ot", 1], ["chunk", "ot", 2], ["offset", "ot", 8], ["offsetCS", "ot", 0], ["vec", "ot", 4], ["wmma_m", "ot", 8]]}, "result": [[0.00404619224], 0, 4.398742198944092, 1649992752.269088], "version": 0.2, "tvm_version": "0.8.dev0"}
{"input": ["cuda -keys=cuda,gpu -max_num_threads=1024 -thread_warp_size=32", "dense_tensorcore.cuda", [["TENSOR", [65536, 1024], "float16"], ["TENSOR", [1024, 4096], "float16"]], {}], "config": {"index": 4930, "code_hash": null, "entity": [["block_row_warps", "ot", 2], ["block_col_warps", "ot", 4], ["warp_row_tiles", "ot", 2], ["warp_col_tiles", "ot", 4], ["chunk", "ot", 1], ["offset", "ot", 8], ["offsetCS", "ot", 8], ["vec", "ot", 8], ["wmma_m", "ot", 32]]}, "result": [[0.0029352262181818185], 0, 4.570573568344116, 1649992757.0273256], "version": 0.2, "tvm_version": "0.8.dev0"}
{"input": ["cuda -keys=cuda,gpu -max_num_threads=1024 -thread_warp_size=32", "dense_tensorcore.cuda", [["TENSOR", [65536, 1024], "float16"], ["TENSOR", [1024, 4096], "float16"]], {}], "config": {"index": 13412, "code_hash": null, "entity": [["block_row_warps", "ot", 4], ["block_col_warps", "ot", 1], ["warp_row_tiles", "ot", 4], ["warp_col_tiles", "ot", 2], ["chunk", "ot", 2], ["offset", "ot", 8], ["offsetCS", "ot", 0], ["vec", "ot", 4], ["wmma_m", "ot", 8]]}, "result": [[0.003650359714285714], 0, 4.392984628677368, 1649992761.034146], "version": 0.2, "tvm_version": "0.8.dev0"}
{"input": ["cuda -keys=cuda,gpu -max_num_threads=1024 -thread_warp_size=32", "dense_tensorcore.cuda", [["TENSOR", [65536, 1024], "float16"], ["TENSOR", [1024, 4096], "float16"]], {}], "config": {"index": 13091, "code_hash": null, "entity": [["block_row_warps", "ot", 4], ["block_col_warps", "ot", 2], ["warp_row_tiles", "ot", 4], ["warp_col_tiles", "ot", 2], ["chunk", "ot", 2], ["offset", "ot", 0], ["offsetCS", "ot", 0], ["vec", "ot", 4], ["wmma_m", "ot", 8]]}, "result": [[0.003493572448275862], 0, 4.327791213989258, 1649992764.9820194], "version": 0.2, "tvm_version": "0.8.dev0"}
{"input": ["cuda -keys=cuda,gpu -max_num_threads=1024 -thread_warp_size=32", "dense_tensorcore.cuda", [["TENSOR", [65536, 1024], "float16"], ["TENSOR", [1024, 4096], "float16"]], {}], "config": {"index": 4929, "code_hash": null, "entity": [["block_row_warps", "ot", 1], ["block_col_warps", "ot", 4], ["warp_row_tiles", "ot", 2], ["warp_col_tiles", "ot", 4], ["chunk", "ot", 1], ["offset", "ot", 8], ["offsetCS", "ot", 8], ["vec", "ot", 8], ["wmma_m", "ot", 32]]}, "result": [[0.003235481709677419], 0, 4.297231912612915, 1649992768.9103513], "version": 0.2, "tvm_version": "0.8.dev0"}
