artifacts/kernel_db/ansor_kernels/fused_conv_bias_relu_expr_S1D1P1_64_32_16_16_32_3_3_ansor/tune.log
{"i": [["[\"get_expr\", \"fused_conv_bias_relu_expr_S1D1P1\", [64, 32, 16, 16, 32, 3, 3]]", "cuda -keys=cuda,gpu -max_num_threads=1024 -thread_warp_size=32", [-1, 16, 64, 49152, 2147483647, 1024, 8, 32], "", 0, []], [[], [["SP", 4, 0, 32, [1, 8, 1, 4], 1], ["SP", 4, 5, 16384, [1, 16, 2, 4], 1], ["SP", 4, 10, 288, [1, 8], 1], ["RE", 4, [0, 5, 1, 6, 2, 7, 10, 11, 3, 8, 12, 4, 9]], ["FSP", 6, 0, 0, 3], ["FSP", 6, 4, 1, 3], ["RE", 6, [0, 4, 1, 5, 2, 6, 3, 7]], ["CA", 4, 6, 5], ["CHR", 3, "shared", [4]], ["CA", 4, 5, 6], ["CI", 3], ["CHR", 1, "shared", [5]], ["CA", 2, 6, 6], ["CI", 1], ["FU", 8, [0, 1]], ["AN", 8, 0, 5], ["FU", 8, [1, 2]], ["AN", 8, 1, 4], ["FU", 8, [2, 3]], ["AN", 8, 2, 6], ["FU", 5, [0, 1]], ["SP", 5, 0, 32, [1], 1], ["AN", 5, 1, 2], ["FFSP", 5, 0, [1, 0], 1, 1], ["AN", 5, 1, 6], ["FU", 2, [0, 1]], ["SP", 2, 0, 64, [8], 1], ["AN", 2, 1, 2], ["FFSP", 2, 0, [1, 0], 1, 1], ["AN", 2, 1, 6], ["PR", 6, 0, "auto_unroll_max_step$16"]]]], "r": [[0.000103664], 0, 2.11813, 1661160345], "v": "v0.6"}
{"i": [["[\"get_expr\", \"fused_conv_bias_relu_expr_S1D1P1\", [64, 32, 16, 16, 32, 3, 3]]", "cuda -keys=cuda,gpu -max_num_threads=1024 -thread_warp_size=32", [-1, 16, 64, 49152, 2147483647, 1024, 8, 32], "", 0, []], [[], [["SP", 4, 0, 32, [4, 1, 2, 4], 1], ["SP", 4, 5, 16384, [2, 256, 2, 2], 1], ["SP", 4, 10, 288, [1, 2], 1], ["RE", 4, [0, 5, 1, 6, 2, 7, 10, 11, 3, 8, 12, 4, 9]], ["FSP", 6, 0, 0, 3], ["FSP", 6, 4, 1, 3], ["RE", 6, [0, 4, 1, 5, 2, 6, 3, 7]], ["CA", 4, 6, 5], ["CHR", 3, "shared", [4]], ["CA", 4, 5, 6], ["CI", 3], ["CHR", 1, "shared", [5]], ["CA", 2, 6, 6], ["CI", 1], ["FU", 8, [0, 1]], ["AN", 8, 0, 5], ["FU", 8, [1, 2]], ["AN", 8, 1, 4], ["FU", 8, [2, 3]], ["AN", 8, 2, 6], ["FU", 5, [0, 1]], ["SP", 5, 0, 16, [1], 1], ["AN", 5, 1, 2], ["FFSP", 5, 0, [1, 0], 1, 1], ["AN", 5, 1, 6], ["FU", 2, [0, 1]], ["SP", 2, 0, 64, [16], 1], ["AN", 2, 1, 2], ["FFSP", 2, 0, [1, 0], 1, 1], ["AN", 2, 1, 6], ["PR", 6, 0, "auto_unroll_max_step$64"]]]], "r": [[0.000820849], 0, 3.44265, 1661160347], "v": "v0.6"}
{"i": [["[\"get_expr\", \"fused_conv_bias_relu_expr_S1D1P1\", [64, 32, 16, 16, 32, 3, 3]]", "cuda -keys=cuda,gpu -max_num_threads=1024 -thread_warp_size=32", [-1, 16, 64, 49152, 2147483647, 1024, 8, 32], "", 0, []], [[], [["SP", 4, 0, 32, [2, 2, 4, 1], 1], ["SP", 4, 5, 16384, [2, 128, 1, 1], 1], ["SP", 4, 10, 288, [4, 4], 1], ["RE", 4, [0, 5, 1, 6, 2, 7, 10, 11, 3, 8, 12, 4, 9]], ["FSP", 6, 0, 0, 3], ["FSP", 6, 4, 1, 3], ["RE", 6, [0, 4, 1, 5, 2, 6, 3, 7]], ["CA", 4, 6, 5], ["CHR", 3, "shared", [4]], ["CA", 4, 5, 6], ["CI", 3], ["CHR", 1, "shared", [5]], ["CA", 2, 6, 6], ["CI", 1], ["FU", 8, [0, 1]], ["AN", 8, 0, 5], ["FU", 8, [1, 2]], ["AN", 8, 1, 4], ["FU", 8, [2, 3]], ["AN", 8, 2, 6], ["FU", 5, [0, 1]], ["SP", 5, 0, 128, [1], 1], ["AN", 5, 1, 2], ["FFSP", 5, 0, [1, 0], 1, 1], ["AN", 5, 1, 6], ["FU", 2, [0, 1]], ["SP", 2, 0, 16, [1], 1], ["AN", 2, 1, 2], ["FFSP", 2, 0, [1, 0], 1, 1], ["AN", 2, 1, 6], ["PR", 6, 0, "auto_unroll_max_step$0"]]]], "r": [[8.48667e-05], 0, 2.29606, 1661160348], "v": "v0.6"}
{"i": [["[\"get_expr\", \"fused_conv_bias_relu_expr_S1D1P1\", [64, 32, 16, 16, 32, 3, 3]]", "cuda -keys=cuda,gpu -max_num_threads=1024 -thread_warp_size=32", [-1, 16, 64, 49152, 2147483647, 1024, 8, 32], "", 0, []], [[], [["SP", 4, 0, 32, [2, 1, 8, 1], 1], ["SP", 4, 5, 16384, [2, 16, 1, 16], 1], ["SP", 4, 10, 288, [1, 2], 1], ["RE", 4, [0, 5, 1, 6, 2, 7, 10, 11, 3, 8, 12, 4, 9]], ["FSP", 6, 0, 0, 3], ["FSP", 6, 4, 1, 3], ["RE", 6, [0, 4, 1, 5, 2, 6, 3, 7]], ["CA", 4, 6, 5], ["CHR", 3, "shared", [4]], ["CA", 4, 5, 6], ["CI", 3], ["CHR", 1, "shared", [5]], ["CA", 2, 6, 6], ["CI", 1], ["FU", 8, [0, 1]], ["AN", 8, 0, 5], ["FU", 8, [1, 2]], ["AN", 8, 1, 4], ["FU", 8, [2, 3]], ["AN", 8, 2, 6], ["FU", 5, [0, 1]], ["SP", 5, 0, 16, [1], 1], ["AN", 5, 1, 2], ["FFSP", 5, 0, [1, 0], 1, 1], ["AN", 5, 1, 6], ["FU", 2, [0, 1]], ["SP", 2, 0, 32, [1], 1], ["AN", 2, 1, 2], ["FFSP", 2, 0, [1, 0], 1, 1], ["AN", 2, 1, 6], ["PR", 6, 0, "auto_unroll_max_step$64"]]]], "r": [[0.00142809], 0, 3.3416, 1661160350], "v": "v0.6"}
{"i": [["[\"get_expr\", \"fused_conv_bias_relu_expr_S1D1P1\", [64, 32, 16, 16, 32, 3, 3]]", "cuda -keys=cuda,gpu -max_num_threads=1024 -thread_warp_size=32", [-1, 16, 64, 49152, 2147483647, 1024, 8, 32], "", 0, []], [[], [["SP", 4, 0, 32, [2, 8, 1, 1], 1], ["SP", 4, 5, 16384, [4, 2, 1, 1], 1], ["SP", 4, 10, 288, [3, 12], 1], ["RE", 4, [0, 5, 1, 6, 2, 7, 10, 11, 3, 8, 12, 4, 9]], ["FSP", 6, 0, 0, 3], ["FSP", 6, 4, 1, 3], ["RE", 6, [0, 4, 1, 5, 2, 6, 3, 7]], ["CA", 4, 6, 5], ["CHR", 3, "shared", [4]], ["CA", 4, 5, 6], ["CI", 3], ["CHR", 1, "shared", [5]], ["CA", 2, 6, 6], ["CI", 1], ["FU", 8, [0, 1]], ["AN", 8, 0, 5], ["FU", 8, [1, 2]], ["AN", 8, 1, 4], ["FU", 8, [2, 3]], ["AN", 8, 2, 6], ["FU", 5, [0, 1]], ["SP", 5, 0, 72, [1], 1], ["AN", 5, 1, 2], ["FFSP", 5, 0, [1, 0], 1, 1], ["AN", 5, 1, 6], ["FU", 2, [0, 1]], ["SP", 2, 0, 36, [9], 1], ["AN", 2, 1, 2], ["FFSP", 2, 0, [1, 0], 1, 1], ["AN", 2, 1, 6], ["PR", 6, 0, "auto_unroll_max_step$1024"]]]], "r": [[0.000114269], 0, 3.09042, 1661160351], "v": "v0.6"}
{"i": [["[\"get_expr\", \"fused_conv_bias_relu_expr_S1D1P1\", [64, 32, 16, 16, 32, 3, 3]]", "cuda -keys=cuda,gpu -max_num_threads=1024 -thread_warp_size=32", [-1, 16, 64, 49152, 2147483647, 1024, 8, 32], "", 0, []], [[], [["SP", 4, 0, 32, [4, 2, 1, 1], 1], ["SP", 4, 5, 16384, [1, 128, 2, 1], 1], ["SP", 4, 10, 288, [3, 6], 1], ["RE", 4, [0, 5, 1, 6, 2, 7, 10, 11, 3, 8, 12, 4, 9]], ["FSP", 6, 0, 0, 3], ["FSP", 6, 4, 1, 3], ["RE", 6, [0, 4, 1, 5, 2, 6, 3, 7]], ["CA", 4, 6, 5], ["CHR", 3, "shared", [4]], ["CA", 4, 5, 6], ["CI", 3], ["CHR", 1, "shared", [5]], ["CA", 2, 6, 6], ["CI", 1], ["FU", 8, [0, 1]], ["AN", 8, 0, 5], ["FU", 8, [1, 2]], ["AN", 8, 1, 4], ["FU", 8, [2, 3]], ["AN", 8, 2, 6], ["FU", 5, [0, 1]], ["SP", 5, 0, 36, [1], 1], ["AN", 5, 1, 2], ["FFSP", 5, 0, [1, 0], 1, 1], ["AN", 5, 1, 6], ["FU", 2, [0, 1]], ["SP", 2, 0, 36, [1], 1], ["AN", 2, 1, 2], ["FFSP", 2, 0, [1, 0], 1, 1], ["AN", 2, 1, 6], ["PR", 6, 0, "auto_unroll_max_step$16"]]]], "r": [[5.64277e-05], 0, 1.93166, 1661160352], "v": "v0.6"}
{"i": [["[\"get_expr\", \"fused_conv_bias_relu_expr_S1D1P1\", [64, 32, 16, 16, 32, 3, 3]]", "cuda -keys=cuda,gpu -max_num_threads=1024 -thread_warp_size=32", [-1, 16, 64, 49152, 2147483647, 1024, 8, 32], "", 0, []], [[], [["SP", 4, 0, 32, [2, 1, 1, 2], 1], ["SP", 4, 5, 16384, [2, 256, 4, 1], 1], ["SP", 4, 10, 288, [1, 1], 1], ["RE", 4, [0, 5, 1, 6, 2, 7, 10, 11, 3, 8, 12, 4, 9]], ["FSP", 6, 0, 0, 3], ["FSP", 6, 4, 1, 3], ["RE", 6, [0, 4, 1, 5, 2, 6, 3, 7]], ["CA", 4, 6, 5], ["CHR", 3, "shared", [4]], ["CA", 4, 5, 6], ["CI", 3], ["CHR", 1, "shared", [5]], ["CA", 2, 6, 6], ["CI", 1], ["FU", 8, [0, 1]], ["AN", 8, 0, 5], ["FU", 8, [1, 2]], ["AN", 8, 1, 4], ["FU", 8, [2, 3]], ["AN", 8, 2, 6], ["FU", 5, [0, 1]], ["SP", 5, 0, 8, [1], 1], ["AN", 5, 1, 2], ["FFSP", 5, 0, [1, 0], 1, 1], ["AN", 5, 1, 6], ["FU", 2, [0, 1]], ["SP", 2, 0, 8, [4], 1], ["AN", 2, 1, 2], ["FFSP", 2, 0, [1, 0], 1, 1], ["AN", 2, 1, 6], ["PR", 6, 0, "auto_unroll_max_step$16"]]]], "r": [[0.000307519], 0, 2.46728, 1661160354], "v": "v0.6"}
{"i": [["[\"get_expr\", \"fused_conv_bias_relu_expr_S1D1P1\", [64, 32, 16, 16, 32, 3, 3]]", "cuda -keys=cuda,gpu -max_num_threads=1024 -thread_warp_size=32", [-1, 16, 64, 49152, 2147483647, 1024, 8, 32], "", 0, []], [[], [["SP", 4, 0, 32, [1, 2, 8, 2], 1], ["SP", 4, 5, 16384, [1, 128, 1, 1], 1], ["SP", 4, 10, 288, [3, 12], 1], ["RE", 4, [0, 5, 1, 6, 2, 7, 10, 11, 3, 8, 12, 4, 9]], ["FSP", 6, 0, 0, 3], ["FSP", 6, 4, 1, 3], ["RE", 6, [0, 4, 1, 5, 2, 6, 3, 7]], ["CA", 4, 6, 5], ["CHR", 3, "shared", [4]], ["CA", 4, 5, 6], ["CI", 3], ["CHR", 1, "shared", [5]], ["CA", 2, 6, 6], ["CI", 1], ["FU", 8, [0, 1]], ["AN", 8, 0, 5], ["FU", 8, [1, 2]], ["AN", 8, 1, 4], ["FU", 8, [2, 3]], ["AN", 8, 2, 6], ["FU", 5, [0, 1]], ["SP", 5, 0, 576, [1], 1], ["AN", 5, 1, 2], ["FFSP", 5, 0, [1, 0], 1, 1], ["AN", 5, 1, 6], ["FU", 2, [0, 1]], ["SP", 2, 0, 36, [1], 1], ["AN", 2, 1, 2], ["FFSP", 2, 0, [1, 0], 1, 1], ["AN", 2, 1, 6], ["PR", 6, 0, "auto_unroll_max_step$64"]]]], "r": [[4.51977e-05], 0, 3.43509, 1661160356], "v": "v0.6"}
{"i": [["[\"get_expr\", \"fused_conv_bias_relu_expr_S1D1P1\", [64, 32, 16, 16, 32, 3, 3]]", "cuda -keys=cuda,gpu -max_num_threads=1024 -thread_warp_size=32", [-1, 16, 64, 49152, 2147483647, 1024, 8, 32], "", 0, []], [[], [["SP", 4, 0, 32, [2, 8, 1, 2], 1], ["SP", 4, 5, 16384, [1, 32, 2, 8], 1], ["SP", 4, 10, 288, [6, 3], 1], ["RE", 4, [0, 5, 1, 6, 2, 7, 10, 11, 3, 8, 12, 4, 9]], ["FSP", 6, 0, 0, 3], ["FSP", 6, 4, 1, 3], ["RE", 6, [0, 4, 1, 5, 2, 6, 3, 7]], ["CA", 4, 6, 5], ["CHR", 3, "shared", [4]], ["CA", 4, 5, 6], ["CI", 3], ["CHR", 1, "shared", [5]], ["CA", 2, 6, 6], ["CI", 1], ["FU", 8, [0, 1]], ["AN", 8, 0, 5], ["FU", 8, [1, 2]], ["AN", 8, 1, 4], ["FU", 8, [2, 3]], ["AN", 8, 2, 6], ["FU", 5, [0, 1]], ["SP", 5, 0, 36, [1], 1], ["AN", 5, 1, 2], ["FFSP", 5, 0, [1, 0], 1, 1], ["AN", 5, 1, 6], ["FU", 2, [0, 1]], ["SP", 2, 0, 288, [1], 1], ["AN", 2, 1, 2], ["FFSP", 2, 0, [1, 0], 1, 1], ["AN", 2, 1, 6], ["PR", 6, 0, "auto_unroll_max_step$512"]]]], "r": [[0.000154586], 0, 2.69299, 1661160368], "v": "v0.6"}
{"i": [["[\"get_expr\", \"fused_conv_bias_relu_expr_S1D1P1\", [64, 32, 16, 16, 32, 3, 3]]", "cuda -keys=cuda,gpu -max_num_threads=1024 -thread_warp_size=32", [-1, 16, 64, 49152, 2147483647, 1024, 8, 32], "", 0, []], [[], [["SP", 4, 0, 32, [4, 4, 1, 1], 1], ["SP", 4, 5, 16384, [4, 8, 1, 8], 1], ["SP", 4, 10, 288, [18, 2], 1], ["RE", 4, [0, 5, 1, 6, 2, 7, 10, 11, 3, 8, 12, 4, 9]], ["FSP", 6, 0, 0, 3], ["FSP", 6, 4, 1, 3], ["RE", 6, [0, 4, 1, 5, 2, 6, 3, 7]], ["CA", 4, 6, 5], ["CHR", 3, "shared", [4]], ["CA", 4, 5, 6], ["CI", 3], ["CHR", 1, "shared", [5]], ["CA", 2, 6, 6], ["CI", 1], ["FU", 8, [0, 1]], ["AN", 8, 0, 5], ["FU", 8, [1, 2]], ["AN", 8, 1, 4], ["FU", 8, [2, 3]], ["AN", 8, 2, 6], ["FU", 5, [0, 1]], ["SP", 5, 0, 72, [1], 1], ["AN", 5, 1, 2], ["FFSP", 5, 0, [1, 0], 1, 1], ["AN", 5, 1, 6], ["FU", 2, [0, 1]], ["SP", 2, 0, 288, [1], 1], ["AN", 2, 1, 2], ["FFSP", 2, 0, [1, 0], 1, 1], ["AN", 2, 1, 6], ["PR", 6, 0, "auto_unroll_max_step$1024"]]]], "r": [[0.000196677], 0, 5.63682, 1661160371], "v": "v0.6"}
{"i": [["[\"get_expr\", \"fused_conv_bias_relu_expr_S1D1P1\", [64, 32, 16, 16, 32, 3, 3]]", "cuda -keys=cuda,gpu -max_num_threads=1024 -thread_warp_size=32", [-1, 16, 64, 49152, 2147483647, 1024, 8, 32], "", 0, []], [[], [["SP", 4, 0, 32, [1, 2, 4, 4], 1], ["SP", 4, 5, 16384, [1, 64, 2, 4], 1], ["SP", 4, 10, 288, [9, 1], 1], ["RE", 4, [0, 5, 1, 6, 2, 7, 10, 11, 3, 8, 12, 4, 9]], ["FSP", 6, 0, 0, 3], ["FSP", 6, 4, 1, 3], ["RE", 6, [0, 4, 1, 5, 2, 6, 3, 7]], ["CA", 4, 6, 5], ["CHR", 3, "shared", [4]], ["CA", 4, 5, 6], ["CI", 3], ["CHR", 1, "shared", [5]], ["CA", 2, 6, 6], ["CI", 1], ["FU", 8, [0, 1]], ["AN", 8, 0, 5], ["FU", 8, [1, 2]], ["AN", 8, 1, 4], ["FU", 8, [2, 3]], ["AN", 8, 2, 6], ["FU", 5, [0, 1]], ["SP", 5, 0, 72, [24], 1], ["AN", 5, 1, 2], ["FFSP", 5, 0, [1, 0], 1, 1], ["AN", 5, 1, 6], ["FU", 2, [0, 1]], ["SP", 2, 0, 72, [1], 1], ["AN", 2, 1, 2], ["FFSP", 2, 0, [1, 0], 1, 1], ["AN", 2, 1, 6], ["PR", 6, 0, "auto_unroll_max_step$0"]]]], "r": [[0.000291932], 0, 2.76117, 1661160372], "v": "v0.6"}
{"i": [["[\"get_expr\", \"fused_conv_bias_relu_expr_S1D1P1\", [64, 32, 16, 16, 32, 3, 3]]", "cuda -keys=cuda,gpu -max_num_threads=1024 -thread_warp_size=32", [-1, 16, 64, 49152, 2147483647, 1024, 8, 32], "", 0, []], [[], [["SP", 4, 0, 32, [1, 16, 1, 2], 1], ["SP", 4, 5, 16384, [8, 4, 32, 1], 1], ["SP", 4, 10, 288, [1, 2], 1], ["RE", 4, [0, 5, 1, 6, 2, 7, 10, 11, 3, 8, 12, 4, 9]], ["FSP", 6, 0, 0, 3], ["FSP", 6, 4, 1, 3], ["RE", 6, [0, 4, 1, 5, 2, 6, 3, 7]], ["CA", 4, 6, 5], ["CHR", 3, "shared", [4]], ["CA", 4, 5, 6], ["CI", 3], ["CHR", 1, "shared", [5]], ["CA", 2, 6, 6], ["CI", 1], ["FU", 8, [0, 1]], ["AN", 8, 0, 5], ["FU", 8, [1, 2]], ["AN", 8, 1, 4], ["FU", 8, [2, 3]], ["AN", 8, 2, 6], ["FU", 5, [0, 1]], ["SP", 5, 0, 12, [1], 1], ["AN", 5, 1, 2], ["FFSP", 5, 0, [1, 0], 1, 1], ["AN", 5, 1, 6], ["FU", 2, [0, 1]], ["SP", 2, 0, 192, [1], 1], ["AN", 2, 1, 2], ["FFSP", 2, 0, [1, 0], 1, 1], ["AN", 2, 1, 6], ["PR", 6, 0, "auto_unroll_max_step$0"]]]], "r": [[0.00285318], 0, 4.06033, 1661160374], "v": "v0.6"}
{"i": [["[\"get_expr\", \"fused_conv_bias_relu_expr_S1D1P1\", [64, 32, 16, 16, 32, 3, 3]]", "cuda -keys=cuda,gpu -max_num_threads=1024 -thread_warp_size=32", [-1, 16, 64, 49152, 2147483647, 1024, 8, 32], "", 0, []], [[], [["SP", 4, 0, 32, [1, 4, 1, 4], 1], ["SP", 4, 5, 16384, [1, 64, 2, 16], 1], ["SP", 4, 10, 288, [4, 1], 1], ["RE", 4, [0, 5, 1, 6, 2, 7, 10, 11, 3, 8, 12, 4, 9]], ["FSP", 6, 0, 0, 3], ["FSP", 6, 4, 1, 3], ["RE", 6, [0, 4, 1, 5, 2, 6, 3, 7]], ["CA", 4, 6, 5], ["CHR", 3, "shared", [4]], ["CA", 4, 5, 6], ["CI", 3], ["CHR", 1, "shared", [5]], ["CA", 2, 6, 6], ["CI", 1], ["FU", 8, [0, 1]], ["AN", 8, 0, 5], ["FU", 8, [1, 2]], ["AN", 8, 1, 4], ["FU", 8, [2, 3]], ["AN", 8, 2, 6], ["FU", 5, [0, 1]], ["SP", 5, 0, 32, [1], 1], ["AN", 5, 1, 2], ["FFSP", 5, 0, [1, 0], 1, 1], ["AN", 5, 1, 6], ["FU", 2, [0, 1]], ["SP", 2, 0, 64, [64], 1], ["AN", 2, 1, 2], ["FFSP", 2, 0, [1, 0], 1, 1], ["AN", 2, 1, 6], ["PR", 6, 0, "auto_unroll_max_step$16"]]]], "r": [[0.00154293], 0, 2.19584, 1661160375], "v": "v0.6"}
{"i": [["[\"get_expr\", \"fused_conv_bias_relu_expr_S1D1P1\", [64, 32, 16, 16, 32, 3, 3]]", "cuda -keys=cuda,gpu -max_num_threads=1024 -thread_warp_size=32", [-1, 16, 64, 49152, 2147483647, 1024, 8, 32], "", 0, []], [[], [["SP", 4, 0, 32, [1, 1, 1, 1], 1], ["SP", 4, 5, 16384, [1, 2, 64, 8], 1], ["SP", 4, 10, 288, [1, 1], 1], ["RE", 4, [0, 5, 1, 6, 2, 7, 10, 11, 3, 8, 12, 4, 9]], ["FSP", 6, 0, 0, 3], ["FSP", 6, 4, 1, 3], ["RE", 6, [0, 4, 1, 5, 2, 6, 3, 7]], ["CA", 4, 6, 5], ["CHR", 3, "shared", [4]], ["CA", 4, 5, 6], ["CI", 3], ["CHR", 1, "shared", [5]], ["CA", 2, 6, 6], ["CI", 1], ["FU", 8, [0, 1]], ["AN", 8, 0, 5], ["FU", 8, [1, 2]], ["AN", 8, 1, 4], ["FU", 8, [2, 3]], ["AN", 8, 2, 6], ["FU", 5, [0, 1]], ["SP", 5, 0, 2, [1], 1], ["AN", 5, 1, 2], ["FFSP", 5, 0, [1, 0], 1, 1], ["AN", 5, 1, 6], ["FU", 2, [0, 1]], ["SP", 2, 0, 1024, [1], 1], ["AN", 2, 1, 2], ["FFSP", 2, 0, [1, 0], 1, 1], ["AN", 2, 1, 6], ["PR", 6, 0, "auto_unroll_max_step$1024"]]]], "r": [[0.0273543], 0, 12.0263, 1661160378], "v": "v0.6"}
{"i": [["[\"get_expr\", \"fused_conv_bias_relu_expr_S1D1P1\", [64, 32, 16, 16, 32, 3, 3]]", "cuda -keys=cuda,gpu -max_num_threads=1024 -thread_warp_size=32", [-1, 16, 64, 49152, 2147483647, 1024, 8, 32], "", 0, []], [[], [["SP", 4, 0, 32, [2, 4, 2, 1], 1], ["SP", 4, 5, 16384, [1, 64, 2, 4], 1], ["SP", 4, 10, 288, [3, 4], 1], ["RE", 4, [0, 5, 1, 6, 2, 7, 10, 11, 3, 8, 12, 4, 9]], ["FSP", 6, 0, 0, 3], ["FSP", 6, 4, 1, 3], ["RE", 6, [0, 4, 1, 5, 2, 6, 3, 7]], ["CA", 4, 6, 5], ["CHR", 3, "shared", [4]], ["CA", 4, 5, 6], ["CI", 3], ["CHR", 1, "shared", [5]], ["CA", 2, 6, 6], ["CI", 1], ["FU", 8, [0, 1]], ["AN", 8, 0, 5], ["FU", 8, [1, 2]], ["AN", 8, 1, 4], ["FU", 8, [2, 3]], ["AN", 8, 2, 6], ["FU", 5, [0, 1]], ["SP", 5, 0, 24, [6], 1], ["AN", 5, 1, 2], ["FFSP", 5, 0, [1, 0], 1, 1], ["AN", 5, 1, 6], ["FU", 2, [0, 1]], ["SP", 2, 0, 96, [4], 1], ["AN", 2, 1, 2], ["FFSP", 2, 0, [1, 0], 1, 1], ["AN", 2, 1, 6], ["PR", 6, 0, "auto_unroll_max_step$512"]]]], "r": [[0.000113716], 0, 4.18197, 1661160381], "v": "v0.6"}
{"i": [["[\"get_expr\", \"fused_conv_bias_relu_expr_S1D1P1\", [64, 32, 16, 16, 32, 3, 3]]", "cuda -keys=cuda,gpu -max_num_threads=1024 -thread_warp_size=32", [-1, 16, 64, 49152, 2147483647, 1024, 8, 32], "", 0, []], [[], [["SP", 4, 0, 32, [1, 16, 1, 2], 1], ["SP", 4, 5, 16384, [8, 4, 32, 1], 1], ["SP", 4, 10, 288, [6, 1], 1], ["RE", 4, [0, 5, 1, 6, 2, 7, 10, 11, 3, 8, 12, 4, 9]], ["FSP", 6, 0, 0, 3], ["FSP", 6, 4, 1, 3], ["RE", 6, [0, 4, 1, 5, 2, 6, 3, 7]], ["CA", 4, 6, 5], ["CHR", 3, "shared", [4]], ["CA", 4, 5, 6], ["CI", 3], ["CHR", 1, "shared", [5]], ["CA", 2, 6, 6], ["CI", 1], ["FU", 8, [0, 1]], ["AN", 8, 0, 5], ["FU", 8, [1, 2]], ["AN", 8, 1, 4], ["FU", 8, [2, 3]], ["AN", 8, 2, 6], ["FU", 5, [0, 1]], ["SP", 5, 0, 12, [1], 1], ["AN", 5, 1, 2], ["FFSP", 5, 0, [1, 0], 1, 1], ["AN", 5, 1, 6], ["FU", 2, [0, 1]], ["SP", 2, 0, 192, [48], 1], ["AN", 2, 1, 2], ["FFSP", 2, 0, [1, 0], 1, 1], ["AN", 2, 1, 6], ["PR", 6, 0, "auto_unroll_max_step$1024"]]]], "r": [[0.00301221], 0, 8.25235, 1661160385], "v": "v0.6"}
{"i": [["[\"get_expr\", \"fused_conv_bias_relu_expr_S1D1P1\", [64, 32, 16, 16, 32, 3, 3]]", "cuda -keys=cuda,gpu -max_num_threads=1024 -thread_warp_size=32", [-1, 16, 64, 49152, 2147483647, 1024, 8, 32], "", 0, []], [[], [["SP", 4, 0, 32, [1, 2, 1, 4], 1], ["SP", 4, 5, 16384, [2, 64, 1, 8], 1], ["SP", 4, 10, 288, [3, 2], 1], ["RE", 4, [0, 5, 1, 6, 2, 7, 10, 11, 3, 8, 12, 4, 9]], ["FSP", 6, 0, 0, 3], ["FSP", 6, 4, 1, 3], ["RE", 6, [0, 4, 1, 5, 2, 6, 3, 7]], ["CA", 4, 6, 5], ["CHR", 3, "shared", [4]], ["CA", 4, 5, 6], ["CI", 3], ["CHR", 1, "shared", [5]], ["CA", 2, 6, 6], ["CI", 1], ["FU", 8, [0, 1]], ["AN", 8, 0, 5], ["FU", 8, [1, 2]], ["AN", 8, 1, 4], ["FU", 8, [2, 3]], ["AN", 8, 2, 6], ["FU", 5, [0, 1]], ["SP", 5, 0, 24, [1], 1], ["AN", 5, 1, 2], ["FFSP", 5, 0, [1, 0], 1, 1], ["AN", 5, 1, 6], ["FU", 2, [0, 1]], ["SP", 2, 0, 48, [48], 1], ["AN", 2, 1, 2], ["FFSP", 2, 0, [1, 0], 1, 1], ["AN", 2, 1, 6], ["PR", 6, 0, "auto_unroll_max_step$1024"]]]], "r": [[0.000305681], 0, 3.19963, 1661160386], "v": "v0.6"}
{"i": [["[\"get_expr\", \"fused_conv_bias_relu_expr_S1D1P1\", [64, 32, 16, 16, 32, 3, 3]]", "cuda -keys=cuda,gpu -max_num_threads=1024 -thread_warp_size=32", [-1, 16, 64, 49152, 2147483647, 1024, 8, 32], "", 0, []], [[], [["SP", 4, 0, 32, [1, 4, 1, 1], 1], ["SP", 4, 5, 16384, [1, 32, 1, 2], 1], ["SP", 4, 10, 288, [36, 1], 1], ["RE", 4, [0, 5, 1, 6, 2, 7, 10, 11, 3, 8, 12, 4, 9]], ["FSP", 6, 0, 0, 3], ["FSP", 6, 4, 1, 3], ["RE", 6, [0, 4, 1, 5, 2, 6, 3, 7]], ["CA", 4, 6, 5], ["CHR", 3, "shared", [4]], ["CA", 4, 5, 6], ["CI", 3], ["CHR", 1, "shared", [5]], ["CA", 2, 6, 6], ["CI", 1], ["FU", 8, [0, 1]], ["AN", 8, 0, 5], ["FU", 8, [1, 2]], ["AN", 8, 1, 4], ["FU", 8, [2, 3]], ["AN", 8, 2, 6], ["FU", 5, [0, 1]], ["SP", 5, 0, 72, [1], 1], ["AN", 5, 1, 2], ["FFSP", 5, 0, [1, 0], 1, 1], ["AN", 5, 1, 6], ["FU", 2, [0, 1]], ["SP", 2, 0, 72, [1], 1], ["AN", 2, 1, 2], ["FFSP", 2, 0, [1, 0], 1, 1], ["AN", 2, 1, 6], ["PR", 6, 0, "auto_unroll_max_step$64"]]]], "r": [[8.98349e-05], 0, 2.41624, 1661160388], "v": "v0.6"}
{"i": [["[\"get_expr\", \"fused_conv_bias_relu_expr_S1D1P1\", [64, 32, 16, 16, 32, 3, 3]]", "cuda -keys=cuda,gpu -max_num_threads=1024 -thread_warp_size=32", [-1, 16, 64, 49152, 2147483647, 1024, 8, 32], "", 0, []], [[], [["SP", 4, 0, 32, [2, 2, 1, 1], 1], ["SP", 4, 5, 16384, [1, 256, 1, 1], 1], ["SP", 4, 10, 288, [2, 1], 1], ["RE", 4, [0, 5, 1, 6, 2, 7, 10, 11, 3, 8, 12, 4, 9]], ["FSP", 6, 0, 0, 3], ["FSP", 6, 4, 1, 3], ["RE", 6, [0, 4, 1, 5, 2, 6, 3, 7]], ["CA", 4, 6, 5], ["CHR", 3, "shared", [4]], ["CA", 4, 5, 6], ["CI", 3], ["CHR", 1, "shared", [5]], ["CA", 2, 6, 6], ["CI", 1], ["FU", 8, [0, 1]], ["AN", 8, 0, 5], ["FU", 8, [1, 2]], ["AN", 8, 1, 4], ["FU", 8, [2, 3]], ["AN", 8, 2, 6], ["FU", 5, [0, 1]], ["SP", 5, 0, 8, [1], 1], ["AN", 5, 1, 2], ["FFSP", 5, 0, [1, 0], 1, 1], ["AN", 5, 1, 6], ["FU", 2, [0, 1]], ["SP", 2, 0, 64, [1], 1], ["AN", 2, 1, 2], ["FFSP", 2, 0, [1, 0], 1, 1], ["AN", 2, 1, 6], ["PR", 6, 0, "auto_unroll_max_step$1024"]]]], "r": [[0.000181046], 0, 4.52764, 1661160390], "v": "v0.6"}
{"i": [["[\"get_expr\", \"fused_conv_bias_relu_expr_S1D1P1\", [64, 32, 16, 16, 32, 3, 3]]", "cuda -keys=cuda,gpu -max_num_threads=1024 -thread_warp_size=32", [-1, 16, 64, 49152, 2147483647, 1024, 8, 32], "", 0, []], [[], [["SP", 4, 0, 32, [2, 2, 2, 1], 1], ["SP", 4, 5, 16384, [1, 128, 2, 1], 1], ["SP", 4, 10, 288, [3, 6], 1], ["RE", 4, [0, 5, 1, 6, 2, 7, 10, 11, 3, 8, 12, 4, 9]], ["FSP", 6, 0, 0, 3], ["FSP", 6, 4, 1, 3], ["RE", 6, [0, 4, 1, 5, 2, 6, 3, 7]], ["CA", 4, 6, 5], ["CHR", 3, "shared", [4]], ["CA", 4, 5, 6], ["CI", 3], ["CHR", 1, "shared", [5]], ["CA", 2, 6, 6], ["CI", 1], ["FU", 8, [0, 1]], ["AN", 8, 0, 5], ["FU", 8, [1, 2]], ["AN", 8, 1, 4], ["FU", 8, [2, 3]], ["AN", 8, 2, 6], ["FU", 5, [0, 1]], ["SP", 5, 0, 36, [36], 1], ["AN", 5, 1, 2], ["FFSP", 5, 0, [1, 0], 1, 1], ["AN", 5, 1, 6], ["FU", 2, [0, 1]], ["SP", 2, 0, 36, [1], 1], ["AN", 2, 1, 2], ["FFSP", 2, 0, [1, 0], 1, 1], ["AN", 2, 1, 6], ["PR", 6, 0, "auto_unroll_max_step$16"]]]], "r": [[8.89393e-05], 0, 2.14533, 1661160391], "v": "v0.6"}
{"i": [["[\"get_expr\", \"fused_conv_bias_relu_expr_S1D1P1\", [64, 32, 16, 16, 32, 3, 3]]", "cuda -keys=cuda,gpu -max_num_threads=1024 -thread_warp_size=32", [-1, 16, 64, 49152, 2147483647, 1024, 8, 32], "", 0, []], [[], [["SP", 4, 0, 32, [2, 2, 2, 1], 1], ["SP", 4, 5, 16384, [1, 128, 2, 1], 1], ["SP", 4, 10, 288, [3, 6], 1], ["RE", 4, [0, 5, 1, 6, 2, 7, 10, 11, 3, 8, 12, 4, 9]], ["FSP", 6, 0, 0, 3], ["FSP", 6, 4, 1, 3], ["RE", 6, [0, 4, 1, 5, 2, 6, 3, 7]], ["CA", 4, 6, 5], ["CHR", 3, "shared", [4]], ["CA", 4, 5, 6], ["CI", 3], ["CHR", 1, "shared", [5]], ["CA", 2, 6, 6], ["CI", 1], ["FU", 8, [0, 1]], ["AN", 8, 0, 5], ["FU", 8, [1, 2]], ["AN", 8, 1, 4], ["FU", 8, [2, 3]], ["AN", 8, 2, 6], ["FU", 5, [0, 1]], ["SP", 5, 0, 36, [4], 1], ["AN", 5, 1, 2], ["FFSP", 5, 0, [1, 0], 1, 1], ["AN", 5, 1, 6], ["FU", 2, [0, 1]], ["SP", 2, 0, 36, [1], 1], ["AN", 2, 1, 2], ["FFSP", 2, 0, [1, 0], 1, 1], ["AN", 2, 1, 6], ["PR", 6, 0, "auto_unroll_max_step$16"]]]], "r": [[5.70172e-05], 0, 2.1954, 1661160393], "v": "v0.6"}
{"i": [["[\"get_expr\", \"fused_conv_bias_relu_expr_S1D1P1\", [64, 32, 16, 16, 32, 3, 3]]", "cuda -keys=cuda,gpu -max_num_threads=1024 -thread_warp_size=32", [-1, 16, 64, 49152, 2147483647, 1024, 8, 32], "", 0, []], [[], [["SP", 4, 0, 32, [1, 1, 2, 16], 1], ["SP", 4, 5, 16384, [4, 32, 1, 8], 1], ["SP", 4, 10, 288, [1, 3], 1], ["RE", 4, [0, 5, 1, 6, 2, 7, 10, 11, 3, 8, 12, 4, 9]], ["FSP", 6, 0, 0, 3], ["FSP", 6, 4, 1, 3], ["RE", 6, [0, 4, 1, 5, 2, 6, 3, 7]], ["CA", 4, 6, 5], ["CHR", 3, "shared", [4]], ["CA", 4, 5, 6], ["CI", 3], ["CHR", 1, "shared", [5]], ["CA", 2, 6, 6], ["CI", 1], ["FU", 8, [0, 1]], ["AN", 8, 0, 5], ["FU", 8, [1, 2]], ["AN", 8, 1, 4], ["FU", 8, [2, 3]], ["AN", 8, 2, 6], ["FU", 5, [0, 1]], ["SP", 5, 0, 288, [6], 1], ["AN", 5, 1, 2], ["FFSP", 5, 0, [1, 0], 1, 1], ["AN", 5, 1, 6], ["FU", 2, [0, 1]], ["SP", 2, 0, 72, [1], 1], ["AN", 2, 1, 2], ["FFSP", 2, 0, [1, 0], 1, 1], ["AN", 2, 1, 6], ["PR", 6, 0, "auto_unroll_max_step$16"]]]], "r": [[0.00398842], 0, 4.50736, 1661160395], "v": "v0.6"}
{"i": [["[\"get_expr\", \"fused_conv_bias_relu_expr_S1D1P1\", [64, 32, 16, 16, 32, 3, 3]]", "cuda -keys=cuda,gpu -max_num_threads=1024 -thread_warp_size=32", [-1, 16, 64, 49152, 2147483647, 1024, 8, 32], "", 0, []], [[], [["SP", 4, 0, 32, [1, 4, 2, 4], 1], ["SP", 4, 5, 16384, [1, 4, 16, 1], 1], ["SP", 4, 10, 288, [4, 24], 1], ["RE", 4, [0, 5, 1, 6, 2, 7, 10, 11, 3, 8, 12, 4, 9]], ["FSP", 6, 0, 0, 3], ["FSP", 6, 4, 1, 3], ["RE", 6, [0, 4, 1, 5, 2, 6, 3, 7]], ["CA", 4, 6, 5], ["CHR", 3, "shared", [4]], ["CA", 4, 5, 6], ["CI", 3], ["CHR", 1, "shared", [5]], ["CA", 2, 6, 6], ["CI", 1], ["FU", 8, [0, 1]], ["AN", 8, 0, 5], ["FU", 8, [1, 2]], ["AN", 8, 1, 4], ["FU", 8, [2, 3]], ["AN", 8, 2, 6], ["FU", 5, [0, 1]], ["SP", 5, 0, 384, [1], 1], ["AN", 5, 1, 2], ["FFSP", 5, 0, [1, 0], 1, 1], ["AN", 5, 1, 6], ["FU", 2, [0, 1]], ["SP", 2, 0, 1536, [8], 1], ["AN", 2, 1, 2], ["FFSP", 2, 0, [1, 0], 1, 1], ["AN", 2, 1, 6], ["PR", 6, 0, "auto_unroll_max_step$0"]]]], "r": [[0.000607758], 0, 3.88641, 1661160398], "v": "v0.6"}
{"i": [["[\"get_expr\", \"fused_conv_bias_relu_expr_S1D1P1\", [64, 32, 16, 16, 32, 3, 3]]", "cuda -keys=cuda,gpu -max_num_threads=1024 -thread_warp_size=32", [-1, 16, 64, 49152, 2147483647, 1024, 8, 32], "", 0, []], [[], [["SP", 4, 0, 32, [2, 8, 2, 1], 1], ["SP", 4, 5, 16384, [1, 32, 2, 8], 1], ["SP", 4, 10, 288, [3, 6], 1], ["RE", 4, [0, 5, 1, 6, 2, 7, 10, 11, 3, 8, 12, 4, 9]], ["FSP", 6, 0, 0, 3], ["FSP", 6, 4, 1, 3], ["RE", 6, [0, 4, 1, 5, 2, 6, 3, 7]], ["CA", 4, 6, 5], ["CHR", 3, "shared", [4]], ["CA", 4, 5, 6], ["CI", 3], ["CHR", 1, "shared", [5]], ["CA", 2, 6, 6], ["CI", 1], ["FU", 8, [0, 1]], ["AN", 8, 0, 5], ["FU", 8, [1, 2]], ["AN", 8, 1, 4], ["FU", 8, [2, 3]], ["AN", 8, 2, 6], ["FU", 5, [0, 1]], ["SP", 5, 0, 36, [1], 1], ["AN", 5, 1, 2], ["FFSP", 5, 0, [1, 0], 1, 1], ["AN", 5, 1, 6], ["FU", 2, [0, 1]], ["SP", 2, 0, 288, [6], 1], ["AN", 2, 1, 2], ["FFSP", 2, 0, [1, 0], 1, 1], ["AN", 2, 1, 6], ["PR", 6, 0, "auto_unroll_max_step$512"]]]], "r": [[0.000155782], 0, 3.83859, 1661160400], "v": "v0.6"}
{"i": [["[\"get_expr\", \"fused_conv_bias_relu_expr_S1D1P1\", [64, 32, 16, 16, 32, 3, 3]]", "cuda -keys=cuda,gpu -max_num_threads=1024 -thread_warp_size=32", [-1, 16, 64, 49152, 2147483647, 1024, 8, 32], "", 0, []], [[], [["SP", 4, 0, 32, [1, 4, 4, 1], 1], ["SP", 4, 5, 16384, [1, 32, 1, 8], 1], ["SP", 4, 10, 288, [1, 6], 1], ["RE", 4, [0, 5, 1, 6, 2, 7, 10, 11, 3, 8, 12, 4, 9]], ["FSP", 6, 0, 0, 3], ["FSP", 6, 4, 1, 3], ["RE", 6, [0, 4, 1, 5, 2, 6, 3, 7]], ["CA", 4, 6, 5], ["CHR", 3, "shared", [4]], ["CA", 4, 5, 6], ["CI", 3], ["CHR", 1, "shared", [5]], ["CA", 2, 6, 6], ["CI", 1], ["FU", 8, [0, 1]], ["AN", 8, 0, 5], ["FU", 8, [1, 2]], ["AN", 8, 1, 4], ["FU", 8, [2, 3]], ["AN", 8, 2, 6], ["FU", 5, [0, 1]], ["SP", 5, 0, 24, [2], 1], ["AN", 5, 1, 2], ["FFSP", 5, 0, [1, 0], 1, 1], ["AN", 5, 1, 6], ["FU", 2, [0, 1]], ["SP", 2, 0, 48, [1], 1], ["AN", 2, 1, 2], ["FFSP", 2, 0, [1, 0], 1, 1], ["AN", 2, 1, 6], ["PR", 6, 0, "auto_unroll_max_step$64"]]]], "r": [[8.10981e-05], 0, 2.77952, 1661160402], "v": "v0.6"}
{"i": [["[\"get_expr\", \"fused_conv_bias_relu_expr_S1D1P1\", [64, 32, 16, 16, 32, 3, 3]]", "cuda -keys=cuda,gpu -max_num_threads=1024 -thread_warp_size=32", [-1, 16, 64, 49152, 2147483647, 1024, 8, 32], "", 0, []], [[], [["SP", 4, 0, 32, [2, 4, 1, 2], 1], ["SP", 4, 5, 16384, [1, 8, 1, 1], 1], ["SP", 4, 10, 288, [1, 12], 1], ["RE", 4, [0, 5, 1, 6, 2, 7, 10, 11, 3, 8, 12, 4, 9]], ["FSP", 6, 0, 0, 3], ["FSP", 6, 4, 1, 3], ["RE", 6, [0, 4, 1, 5, 2, 6, 3, 7]], ["CA", 4, 6, 5], ["CHR", 3, "shared", [4]], ["CA", 4, 5, 6], ["CI", 3], ["CHR", 1, "shared", [5]], ["CA", 2, 6, 6], ["CI", 1], ["FU", 8, [0, 1]], ["AN", 8, 0, 5], ["FU", 8, [1, 2]], ["AN", 8, 1, 4], ["FU", 8, [2, 3]], ["AN", 8, 2, 6], ["FU", 5, [0, 1]], ["SP", 5, 0, 72, [1], 1], ["AN", 5, 1, 2], ["FFSP", 5, 0, [1, 0], 1, 1], ["AN", 5, 1, 6], ["FU", 2, [0, 1]], ["SP", 2, 0, 36, [9], 1], ["AN", 2, 1, 2], ["FFSP", 2, 0, [1, 0], 1, 1], ["AN", 2, 1, 6], ["PR", 6, 0, "auto_unroll_max_step$64"]]]], "r": [[0.000111933], 0, 3.0268, 1661160404], "v": "v0.6"}
{"i": [["[\"get_expr\", \"fused_conv_bias_relu_expr_S1D1P1\", [64, 32, 16, 16, 32, 3, 3]]", "cuda -keys=cuda,gpu -max_num_threads=1024 -thread_warp_size=32", [-1, 16, 64, 49152, 2147483647, 1024, 8, 32], "", 0, []], [[], [["SP", 4, 0, 32, [1, 2, 8, 1], 1], ["SP", 4, 5, 16384, [1, 16, 4, 1], 1], ["SP", 4, 10, 288, [36, 2], 1], ["RE", 4, [0, 5, 1, 6, 2, 7, 10, 11, 3, 8, 12, 4, 9]], ["FSP", 6, 0, 0, 3], ["FSP", 6, 4, 1, 3], ["RE", 6, [0, 4, 1, 5, 2, 6, 3, 7]], ["CA", 4, 6, 5], ["CHR", 3, "shared", [4]], ["CA", 4, 5, 6], ["CI", 3], ["CHR", 1, "shared", [5]], ["CA", 2, 6, 6], ["CI", 1], ["FU", 8, [0, 1]], ["AN", 8, 0, 5], ["FU", 8, [1, 2]], ["AN", 8, 1, 4], ["FU", 8, [2, 3]], ["AN", 8, 2, 6], ["FU", 5, [0, 1]], ["SP", 5, 0, 576, [1], 1], ["AN", 5, 1, 2], ["FFSP", 5, 0, [1, 0], 1, 1], ["AN", 5, 1, 6], ["FU", 2, [0, 1]], ["SP", 2, 0, 288, [1], 1], ["AN", 2, 1, 2], ["FFSP", 2, 0, [1, 0], 1, 1], ["AN", 2, 1, 6], ["PR", 6, 0, "auto_unroll_max_step$1024"]]]], "r": [[7.21665e-05], 0, 5.15776, 1661160406], "v": "v0.6"}
{"i": [["[\"get_expr\", \"fused_conv_bias_relu_expr_S1D1P1\", [64, 32, 16, 16, 32, 3, 3]]", "cuda -keys=cuda,gpu -max_num_threads=1024 -thread_warp_size=32", [-1, 16, 64, 49152, 2147483647, 1024, 8, 32], "", 0, []], [[], [["SP", 4, 0, 32, [2, 2, 1, 8], 1], ["SP", 4, 5, 16384, [16, 16, 1, 4], 1], ["SP", 4, 10, 288, [6, 1], 1], ["RE", 4, [0, 5, 1, 6, 2, 7, 10, 11, 3, 8, 12, 4, 9]], ["FSP", 6, 0, 0, 3], ["FSP", 6, 4, 1, 3], ["RE", 6, [0, 4, 1, 5, 2, 6, 3, 7]], ["CA", 4, 6, 5], ["CHR", 3, "shared", [4]], ["CA", 4, 5, 6], ["CI", 3], ["CHR", 1, "shared", [5]], ["CA", 2, 6, 6], ["CI", 1], ["FU", 8, [0, 1]], ["AN", 8, 0, 5], ["FU", 8, [1, 2]], ["AN", 8, 1, 4], ["FU", 8, [2, 3]], ["AN", 8, 2, 6], ["FU", 5, [0, 1]], ["SP", 5, 0, 48, [1], 1], ["AN", 5, 1, 2], ["FFSP", 5, 0, [1, 0], 1, 1], ["AN", 5, 1, 6], ["FU", 2, [0, 1]], ["SP", 2, 0, 24, [1], 1], ["AN", 2, 1, 2], ["FFSP", 2, 0, [1, 0], 1, 1], ["AN", 2, 1, 6], ["PR", 6, 0, "auto_unroll_max_step$512"]]]], "r": [[0.00302159], 0, 6.4736, 1661160410], "v": "v0.6"}
{"i": [["[\"get_expr\", \"fused_conv_bias_relu_expr_S1D1P1\", [64, 32, 16, 16, 32, 3, 3]]", "cuda -keys=cuda,gpu -max_num_threads=1024 -thread_warp_size=32", [-1, 16, 64, 49152, 2147483647, 1024, 8, 32], "", 0, []], [[], [["SP", 4, 0, 32, [2, 4, 1, 2], 1], ["SP", 4, 5, 16384, [1, 8, 1, 1], 1], ["SP", 4, 10, 288, [1, 2], 1], ["RE", 4, [0, 5, 1, 6, 2, 7, 10, 11, 3, 8, 12, 4, 9]], ["FSP", 6, 0, 0, 3], ["FSP", 6, 4, 1, 3], ["RE", 6, [0, 4, 1, 5, 2, 6, 3, 7]], ["CA", 4, 6, 5], ["CHR", 3, "shared", [4]], ["CA", 4, 5, 6], ["CI", 3], ["CHR", 1, "shared", [5]], ["CA", 2, 6, 6], ["CI", 1], ["FU", 8, [0, 1]], ["AN", 8, 0, 5], ["FU", 8, [1, 2]], ["AN", 8, 1, 4], ["FU", 8, [2, 3]], ["AN", 8, 2, 6], ["FU", 5, [0, 1]], ["SP", 5, 0, 72, [1], 1], ["AN", 5, 1, 2], ["FFSP", 5, 0, [1, 0], 1, 1], ["AN", 5, 1, 6], ["FU", 2, [0, 1]], ["SP", 2, 0, 36, [1], 1], ["AN", 2, 1, 2], ["FFSP", 2, 0, [1, 0], 1, 1], ["AN", 2, 1, 6], ["PR", 6, 0, "auto_unroll_max_step$64"]]]], "r": [[0.000209545], 0, 2.13448, 1661160412], "v": "v0.6"}
{"i": [["[\"get_expr\", \"fused_conv_bias_relu_expr_S1D1P1\", [64, 32, 16, 16, 32, 3, 3]]", "cuda -keys=cuda,gpu -max_num_threads=1024 -thread_warp_size=32", [-1, 16, 64, 49152, 2147483647, 1024, 8, 32], "", 0, []], [[], [["SP", 4, 0, 32, [1, 8, 1, 4], 1], ["SP", 4, 5, 16384, [1, 4, 16, 1], 1], ["SP", 4, 10, 288, [4, 24], 1], ["RE", 4, [0, 5, 1, 6, 2, 7, 10, 11, 3, 8, 12, 4, 9]], ["FSP", 6, 0, 0, 3], ["FSP", 6, 4, 1, 3], ["RE", 6, [0, 4, 1, 5, 2, 6, 3, 7]], ["CA", 4, 6, 5], ["CHR", 3, "shared", [4]], ["CA", 4, 5, 6], ["CI", 3], ["CHR", 1, "shared", [5]], ["CA", 2, 6, 6], ["CI", 1], ["FU", 8, [0, 1]], ["AN", 8, 0, 5], ["FU", 8, [1, 2]], ["AN", 8, 1, 4], ["FU", 8, [2, 3]], ["AN", 8, 2, 6], ["FU", 5, [0, 1]], ["SP", 5, 0, 384, [1], 1], ["AN", 5, 1, 2], ["FFSP", 5, 0, [1, 0], 1, 1], ["AN", 5, 1, 6], ["FU", 2, [0, 1]], ["SP", 2, 0, 1536, [1], 1], ["AN", 2, 1, 2], ["FFSP", 2, 0, [1, 0], 1, 1], ["AN", 2, 1, 6], ["PR", 6, 0, "auto_unroll_max_step$512"]]]], "r": [[0.000174261], 0, 5.69675, 1661160414], "v": "v0.6"}
{"i": [["[\"get_expr\", \"fused_conv_bias_relu_expr_S1D1P1\", [64, 32, 16, 16, 32, 3, 3]]", "cuda -keys=cuda,gpu -max_num_threads=1024 -thread_warp_size=32", [-1, 16, 64, 49152, 2147483647, 1024, 8, 32], "", 0, []], [[], [["SP", 4, 0, 32, [2, 4, 2, 1], 1], ["SP", 4, 5, 16384, [1, 32, 2, 8], 1], ["SP", 4, 10, 288, [3, 6], 1], ["RE", 4, [0, 5, 1, 6, 2, 7, 10, 11, 3, 8, 12, 4, 9]], ["FSP", 6, 0, 0, 3], ["FSP", 6, 4, 1, 3], ["RE", 6, [0, 4, 1, 5, 2, 6, 3, 7]], ["CA", 4, 6, 5], ["CHR", 3, "shared", [4]], ["CA", 4, 5, 6], ["CI", 3], ["CHR", 1, "shared", [5]], ["CA", 2, 6, 6], ["CI", 1], ["FU", 8, [0, 1]], ["AN", 8, 0, 5], ["FU", 8, [1, 2]], ["AN", 8, 1, 4], ["FU", 8, [2, 3]], ["AN", 8, 2, 6], ["FU", 5, [0, 1]], ["SP", 5, 0, 36, [1], 1], ["AN", 5, 1, 2], ["FFSP", 5, 0, [1, 0], 1, 1], ["AN", 5, 1, 6], ["FU", 2, [0, 1]], ["SP", 2, 0, 288, [1], 1], ["AN", 2, 1, 2], ["FFSP", 2, 0, [1, 0], 1, 1], ["AN", 2, 1, 6], ["PR", 6, 0, "auto_unroll_max_step$512"]]]], "r": [[9.6313e-05], 0, 3.66693, 1661160416], "v": "v0.6"}
{"i": [["[\"get_expr\", \"fused_conv_bias_relu_expr_S1D1P1\", [64, 32, 16, 16, 32, 3, 3]]", "cuda -keys=cuda,gpu -max_num_threads=1024 -thread_warp_size=32", [-1, 16, 64, 49152, 2147483647, 1024, 8, 32], "", 0, []], [[], [["SP", 4, 0, 32, [1, 1, 1, 8], 1], ["SP", 4, 5, 16384, [2, 64, 2, 4], 1], ["SP", 4, 10, 288, [2, 2], 1], ["RE", 4, [0, 5, 1, 6, 2, 7, 10, 11, 3, 8, 12, 4, 9]], ["FSP", 6, 0, 0, 3], ["FSP", 6, 4, 1, 3], ["RE", 6, [0, 4, 1, 5, 2, 6, 3, 7]], ["CA", 4, 6, 5], ["CHR", 3, "shared", [4]], ["CA", 4, 5, 6], ["CI", 3], ["CHR", 1, "shared", [5]], ["CA", 2, 6, 6], ["CI", 1], ["FU", 8, [0, 1]], ["AN", 8, 0, 5], ["FU", 8, [1, 2]], ["AN", 8, 1, 4], ["FU", 8, [2, 3]], ["AN", 8, 2, 6], ["FU", 5, [0, 1]], ["SP", 5, 0, 48, [4], 1], ["AN", 5, 1, 2], ["FFSP", 5, 0, [1, 0], 1, 1], ["AN", 5, 1, 6], ["FU", 2, [0, 1]], ["SP", 2, 0, 48, [1], 1], ["AN", 2, 1, 2], ["FFSP", 2, 0, [1, 0], 1, 1], ["AN", 2, 1, 6], ["PR", 6, 0, "auto_unroll_max_step$16"]]]], "r": [[0.000836585], 0, 4.25599, 1661160419], "v": "v0.6"}
{"i": [["[\"get_expr\", \"fused_conv_bias_relu_expr_S1D1P1\", [64, 32, 16, 16, 32, 3, 3]]", "cuda -keys=cuda,gpu -max_num_threads=1024 -thread_warp_size=32", [-1, 16, 64, 49152, 2147483647, 1024, 8, 32], "", 0, []], [[], [["SP", 4, 0, 32, [2, 8, 2, 1], 1], ["SP", 4, 5, 16384, [2, 8, 4, 4], 1], ["SP", 4, 10, 288, [3, 8], 1], ["RE", 4, [0, 5, 1, 6, 2, 7, 10, 11, 3, 8, 12, 4, 9]], ["FSP", 6, 0, 0, 3], ["FSP", 6, 4, 1, 3], ["RE", 6, [0, 4, 1, 5, 2, 6, 3, 7]], ["CA", 4, 6, 5], ["CHR", 3, "shared", [4]], ["CA", 4, 5, 6], ["CI", 3], ["CHR", 1, "shared", [5]], ["CA", 2, 6, 6], ["CI", 1], ["FU", 8, [0, 1]], ["AN", 8, 0, 5], ["FU", 8, [1, 2]], ["AN", 8, 1, 4], ["FU", 8, [2, 3]], ["AN", 8, 2, 6], ["FU", 5, [0, 1]], ["SP", 5, 0, 48, [1], 1], ["AN", 5, 1, 2], ["FFSP", 5, 0, [1, 0], 1, 1], ["AN", 5, 1, 6], ["FU", 2, [0, 1]], ["SP", 2, 0, 384, [16], 1], ["AN", 2, 1, 2], ["FFSP", 2, 0, [1, 0], 1, 1], ["AN", 2, 1, 6], ["PR", 6, 0, "auto_unroll_max_step$64"]]]], "r": [[0.000217506], 0, 4.3461, 1661160422], "v": "v0.6"}
{"i": [["[\"get_expr\", \"fused_conv_bias_relu_expr_S1D1P1\", [64, 32, 16, 16, 32, 3, 3]]", "cuda -keys=cuda,gpu -max_num_threads=1024 -thread_warp_size=32", [-1, 16, 64, 49152, 2147483647, 1024, 8, 32], "", 0, []], [[], [["SP", 4, 0, 32, [1, 1, 16, 1], 1], ["SP", 4, 5, 16384, [1, 128, 1, 32], 1], ["SP", 4, 10, 288, [1, 2], 1], ["RE", 4, [0, 5, 1, 6, 2, 7, 10, 11, 3, 8, 12, 4, 9]], ["FSP", 6, 0, 0, 3], ["FSP", 6, 4, 1, 3], ["RE", 6, [0, 4, 1, 5, 2, 6, 3, 7]], ["CA", 4, 6, 5], ["CHR", 3, "shared", [4]], ["CA", 4, 5, 6], ["CI", 3], ["CHR", 1, "shared", [5]], ["CA", 2, 6, 6], ["CI", 1], ["FU", 8, [0, 1]], ["AN", 8, 0, 5], ["FU", 8, [1, 2]], ["AN", 8, 1, 4], ["FU", 8, [2, 3]], ["AN", 8, 2, 6], ["FU", 5, [0, 1]], ["SP", 5, 0, 16, [2], 1], ["AN", 5, 1, 2], ["FFSP", 5, 0, [1, 0], 1, 1], ["AN", 5, 1, 6], ["FU", 2, [0, 1]], ["SP", 2, 0, 32, [1], 1], ["AN", 2, 1, 2], ["FFSP", 2, 0, [1, 0], 1, 1], ["AN", 2, 1, 6], ["PR", 6, 0, "auto_unroll_max_step$64"]]]], "r": [[0.00341356], 0, 3.34002, 1661160424], "v": "v0.6"}
{"i": [["[\"get_expr\", \"fused_conv_bias_relu_expr_S1D1P1\", [64, 32, 16, 16, 32, 3, 3]]", "cuda -keys=cuda,gpu -max_num_threads=1024 -thread_warp_size=32", [-1, 16, 64, 49152, 2147483647, 1024, 8, 32], "", 0, []], [[], [["SP", 4, 0, 32, [1, 2, 1, 8], 1], ["SP", 4, 5, 16384, [1, 32, 1, 2], 1], ["SP", 4, 10, 288, [2, 2], 1], ["RE", 4, [0, 5, 1, 6, 2, 7, 10, 11, 3, 8, 12, 4, 9]], ["FSP", 6, 0, 0, 3], ["FSP", 6, 4, 1, 3], ["RE", 6, [0, 4, 1, 5, 2, 6, 3, 7]], ["CA", 4, 6, 5], ["CHR", 3, "shared", [4]], ["CA", 4, 5, 6], ["CI", 3], ["CHR", 1, "shared", [5]], ["CA", 2, 6, 6], ["CI", 1], ["FU", 8, [0, 1]], ["AN", 8, 0, 5], ["FU", 8, [1, 2]], ["AN", 8, 1, 4], ["FU", 8, [2, 3]], ["AN", 8, 2, 6], ["FU", 5, [0, 1]], ["SP", 5, 0, 32, [1], 1], ["AN", 5, 1, 2], ["FFSP", 5, 0, [1, 0], 1, 1], ["AN", 5, 1, 6], ["FU", 2, [0, 1]], ["SP", 2, 0, 8, [4], 1], ["AN", 2, 1, 2], ["FFSP", 2, 0, [1, 0], 1, 1], ["AN", 2, 1, 6], ["PR", 6, 0, "auto_unroll_max_step$0"]]]], "r": [[9.32937e-05], 0, 1.58965, 1661160425], "v": "v0.6"}
{"i": [["[\"get_expr\", \"fused_conv_bias_relu_expr_S1D1P1\", [64, 32, 16, 16, 32, 3, 3]]", "cuda -keys=cuda,gpu -max_num_threads=1024 -thread_warp_size=32", [-1, 16, 64, 49152, 2147483647, 1024, 8, 32], "", 0, []], [[], [["SP", 4, 0, 32, [4, 8, 1, 1], 1], ["SP", 4, 5, 16384, [1, 16, 2, 4], 1], ["SP", 4, 10, 288, [8, 1], 1], ["RE", 4, [0, 5, 1, 6, 2, 7, 10, 11, 3, 8, 12, 4, 9]], ["FSP", 6, 0, 0, 3], ["FSP", 6, 4, 1, 3], ["RE", 6, [0, 4, 1, 5, 2, 6, 3, 7]], ["CA", 4, 6, 5], ["CHR", 3, "shared", [4]], ["CA", 4, 5, 6], ["CI", 3], ["CHR", 1, "shared", [5]], ["CA", 2, 6, 6], ["CI", 1], ["FU", 8, [0, 1]], ["AN", 8, 0, 5], ["FU", 8, [1, 2]], ["AN", 8, 1, 4], ["FU", 8, [2, 3]], ["AN", 8, 2, 6], ["FU", 5, [0, 1]], ["SP", 5, 0, 32, [1], 1], ["AN", 5, 1, 2], ["FFSP", 5, 0, [1, 0], 1, 1], ["AN", 5, 1, 6], ["FU", 2, [0, 1]], ["SP", 2, 0, 64, [1], 1], ["AN", 2, 1, 2], ["FFSP", 2, 0, [1, 0], 1, 1], ["AN", 2, 1, 6], ["PR", 6, 0, "auto_unroll_max_step$16"]]]], "r": [[9.40369e-05], 0, 3.63081, 1661160428], "v": "v0.6"}
{"i": [["[\"get_expr\", \"fused_conv_bias_relu_expr_S1D1P1\", [64, 32, 16, 16, 32, 3, 3]]", "cuda -keys=cuda,gpu -max_num_threads=1024 -thread_warp_size=32", [-1, 16, 64, 49152, 2147483647, 1024, 8, 32], "", 0, []], [[], [["SP", 4, 0, 32, [2, 16, 1, 1], 1], ["SP", 4, 5, 16384, [1, 32, 2, 8], 1], ["SP", 4, 10, 288, [3, 6], 1], ["RE", 4, [0, 5, 1, 6, 2, 7, 10, 11, 3, 8, 12, 4, 9]], ["FSP", 6, 0, 0, 3], ["FSP", 6, 4, 1, 3], ["RE", 6, [0, 4, 1, 5, 2, 6, 3, 7]], ["CA", 4, 6, 5], ["CHR", 3, "shared", [4]], ["CA", 4, 5, 6], ["CI", 3], ["CHR", 1, "shared", [5]], ["CA", 2, 6, 6], ["CI", 1], ["FU", 8, [0, 1]], ["AN", 8, 0, 5], ["FU", 8, [1, 2]], ["AN", 8, 1, 4], ["FU", 8, [2, 3]], ["AN", 8, 2, 6], ["FU", 5, [0, 1]], ["SP", 5, 0, 36, [1], 1], ["AN", 5, 1, 2], ["FFSP", 5, 0, [1, 0], 1, 1], ["AN", 5, 1, 6], ["FU", 2, [0, 1]], ["SP", 2, 0, 288, [1], 1], ["AN", 2, 1, 2], ["FFSP", 2, 0, [1, 0], 1, 1], ["AN", 2, 1, 6], ["PR", 6, 0, "auto_unroll_max_step$512"]]]], "r": [[0.000250336], 0, 3.20213, 1661160430], "v": "v0.6"}
{"i": [["[\"get_expr\", \"fused_conv_bias_relu_expr_S1D1P1\", [64, 32, 16, 16, 32, 3, 3]]", "cuda -keys=cuda,gpu -max_num_threads=1024 -thread_warp_size=32", [-1, 16, 64, 49152, 2147483647, 1024, 8, 32], "", 0, []], [[], [["SP", 4, 0, 32, [1, 4, 1, 4], 1], ["SP", 4, 5, 16384, [1, 64, 2, 4], 1], ["SP", 4, 10, 288, [4, 2], 1], ["RE", 4, [0, 5, 1, 6, 2, 7, 10, 11, 3, 8, 12, 4, 9]], ["FSP", 6, 0, 0, 3], ["FSP", 6, 4, 1, 3], ["RE", 6, [0, 4, 1, 5, 2, 6, 3, 7]], ["CA", 4, 6, 5], ["CHR", 3, "shared", [4]], ["CA", 4, 5, 6], ["CI", 3], ["CHR", 1, "shared", [5]], ["CA", 2, 6, 6], ["CI", 1], ["FU", 8, [0, 1]], ["AN", 8, 0, 5], ["FU", 8, [1, 2]], ["AN", 8, 1, 4], ["FU", 8, [2, 3]], ["AN", 8, 2, 6], ["FU", 5, [0, 1]], ["SP", 5, 0, 32, [1], 1], ["AN", 5, 1, 2], ["FFSP", 5, 0, [1, 0], 1, 1], ["AN", 5, 1, 6], ["FU", 2, [0, 1]], ["SP", 2, 0, 64, [1], 1], ["AN", 2, 1, 2], ["FFSP", 2, 0, [1, 0], 1, 1], ["AN", 2, 1, 6], ["PR", 6, 0, "auto_unroll_max_step$1024"]]]], "r": [[0.000135821], 0, 2.78555, 1661160431], "v": "v0.6"}
{"i": [["[\"get_expr\", \"fused_conv_bias_relu_expr_S1D1P1\", [64, 32, 16, 16, 32, 3, 3]]", "cuda -keys=cuda,gpu -max_num_threads=1024 -thread_warp_size=32", [-1, 16, 64, 49152, 2147483647, 1024, 8, 32], "", 0, []], [[], [["SP", 4, 0, 32, [4, 1, 2, 4], 1], ["SP", 4, 5, 16384, [2, 32, 16, 2], 1], ["SP", 4, 10, 288, [1, 2], 1], ["RE", 4, [0, 5, 1, 6, 2, 7, 10, 11, 3, 8, 12, 4, 9]], ["FSP", 6, 0, 0, 3], ["FSP", 6, 4, 1, 3], ["RE", 6, [0, 4, 1, 5, 2, 6, 3, 7]], ["CA", 4, 6, 5], ["CHR", 3, "shared", [4]], ["CA", 4, 5, 6], ["CI", 3], ["CHR", 1, "shared", [5]], ["CA", 2, 6, 6], ["CI", 1], ["FU", 8, [0, 1]], ["AN", 8, 0, 5], ["FU", 8, [1, 2]], ["AN", 8, 1, 4], ["FU", 8, [2, 3]], ["AN", 8, 2, 6], ["FU", 5, [0, 1]], ["SP", 5, 0, 16, [1], 1], ["AN", 5, 1, 2], ["FFSP", 5, 0, [1, 0], 1, 1], ["AN", 5, 1, 6], ["FU", 2, [0, 1]], ["SP", 2, 0, 64, [1], 1], ["AN", 2, 1, 2], ["FFSP", 2, 0, [1, 0], 1, 1], ["AN", 2, 1, 6], ["PR", 6, 0, "auto_unroll_max_step$16"]]]], "r": [[0.00743396], 0, 3.20897, 1661160432], "v": "v0.6"}
{"i": [["[\"get_expr\", \"fused_conv_bias_relu_expr_S1D1P1\", [64, 32, 16, 16, 32, 3, 3]]", "cuda -keys=cuda,gpu -max_num_threads=1024 -thread_warp_size=32", [-1, 16, 64, 49152, 2147483647, 1024, 8, 32], "", 0, []], [[], [["SP", 4, 0, 32, [2, 16, 1, 1], 1], ["SP", 4, 5, 16384, [4, 8, 4, 2], 1], ["SP", 4, 10, 288, [32, 1], 1], ["RE", 4, [0, 5, 1, 6, 2, 7, 10, 11, 3, 8, 12, 4, 9]], ["FSP", 6, 0, 0, 3], ["FSP", 6, 4, 1, 3], ["RE", 6, [0, 4, 1, 5, 2, 6, 3, 7]], ["CA", 4, 6, 5], ["CHR", 3, "shared", [4]], ["CA", 4, 5, 6], ["CI", 3], ["CHR", 1, "shared", [5]], ["CA", 2, 6, 6], ["CI", 1], ["FU", 8, [0, 1]], ["AN", 8, 0, 5], ["FU", 8, [1, 2]], ["AN", 8, 1, 4], ["FU", 8, [2, 3]], ["AN", 8, 2, 6], ["FU", 5, [0, 1]], ["SP", 5, 0, 64, [2], 1], ["AN", 5, 1, 2], ["FFSP", 5, 0, [1, 0], 1, 1], ["AN", 5, 1, 6], ["FU", 2, [0, 1]], ["SP", 2, 0, 256, [1], 1], ["AN", 2, 1, 2], ["FFSP", 2, 0, [1, 0], 1, 1], ["AN", 2, 1, 6], ["PR", 6, 0, "auto_unroll_max_step$512"]]]], "r": [[0.00015653], 0, 3.65914, 1661160435], "v": "v0.6"}
{"i": [["[\"get_expr\", \"fused_conv_bias_relu_expr_S1D1P1\", [64, 32, 16, 16, 32, 3, 3]]", "cuda -keys=cuda,gpu -max_num_threads=1024 -thread_warp_size=32", [-1, 16, 64, 49152, 2147483647, 1024, 8, 32], "", 0, []], [[], [["SP", 4, 0, 32, [1, 2, 8, 1], 1], ["SP", 4, 5, 16384, [1, 1, 4, 1], 1], ["SP", 4, 10, 288, [4, 18], 1], ["RE", 4, [0, 5, 1, 6, 2, 7, 10, 11, 3, 8, 12, 4, 9]], ["FSP", 6, 0, 0, 3], ["FSP", 6, 4, 1, 3], ["RE", 6, [0, 4, 1, 5, 2, 6, 3, 7]], ["CA", 4, 6, 5], ["CHR", 3, "shared", [4]], ["CA", 4, 5, 6], ["CI", 3], ["CHR", 1, "shared", [5]], ["CA", 2, 6, 6], ["CI", 1], ["FU", 8, [0, 1]], ["AN", 8, 0, 5], ["FU", 8, [1, 2]], ["AN", 8, 1, 4], ["FU", 8, [2, 3]], ["AN", 8, 2, 6], ["FU", 5, [0, 1]], ["SP", 5, 0, 576, [1], 1], ["AN", 5, 1, 2], ["FFSP", 5, 0, [1, 0], 1, 1], ["AN", 5, 1, 6], ["FU", 2, [0, 1]], ["SP", 2, 0, 288, [1], 1], ["AN", 2, 1, 2], ["FFSP", 2, 0, [1, 0], 1, 1], ["AN", 2, 1, 6], ["PR", 6, 0, "auto_unroll_max_step$1024"]]]], "r": [[0.00785036], 0, 11.703, 1661160438], "v": "v0.6"}
{"i": [["[\"get_expr\", \"fused_conv_bias_relu_expr_S1D1P1\", [64, 32, 16, 16, 32, 3, 3]]", "cuda -keys=cuda,gpu -max_num_threads=1024 -thread_warp_size=32", [-1, 16, 64, 49152, 2147483647, 1024, 8, 32], "", 0, []], [[], [["SP", 4, 0, 32, [1, 1, 8, 4], 1], ["SP", 4, 5, 16384, [2, 128, 1, 1], 1], ["SP", 4, 10, 288, [2, 16], 1], ["RE", 4, [0, 5, 1, 6, 2, 7, 10, 11, 3, 8, 12, 4, 9]], ["FSP", 6, 0, 0, 3], ["FSP", 6, 4, 1, 3], ["RE", 6, [0, 4, 1, 5, 2, 6, 3, 7]], ["CA", 4, 6, 5], ["CHR", 3, "shared", [4]], ["CA", 4, 5, 6], ["CI", 3], ["CHR", 1, "shared", [5]], ["CA", 2, 6, 6], ["CI", 1], ["FU", 8, [0, 1]], ["AN", 8, 0, 5], ["FU", 8, [1, 2]], ["AN", 8, 1, 4], ["FU", 8, [2, 3]], ["AN", 8, 2, 6], ["FU", 5, [0, 1]], ["SP", 5, 0, 1024, [4], 1], ["AN", 5, 1, 2], ["FFSP", 5, 0, [1, 0], 1, 1], ["AN", 5, 1, 6], ["FU", 2, [0, 1]], ["SP", 2, 0, 64, [1], 1], ["AN", 2, 1, 2], ["FFSP", 2, 0, [1, 0], 1, 1], ["AN", 2, 1, 6], ["PR", 6, 0, "auto_unroll_max_step$16"]]]], "r": [[0.000156425], 0, 2.69593, 1661160440], "v": "v0.6"}
{"i": [["[\"get_expr\", \"fused_conv_bias_relu_expr_S1D1P1\", [64, 32, 16, 16, 32, 3, 3]]", "cuda -keys=cuda,gpu -max_num_threads=1024 -thread_warp_size=32", [-1, 16, 64, 49152, 2147483647, 1024, 8, 32], "", 0, []], [[], [["SP", 4, 0, 32, [1, 4, 1, 8], 1], ["SP", 4, 5, 16384, [2, 64, 2, 4], 1], ["SP", 4, 10, 288, [3, 2], 1], ["RE", 4, [0, 5, 1, 6, 2, 7, 10, 11, 3, 8, 12, 4, 9]], ["FSP", 6, 0, 0, 3], ["FSP", 6, 4, 1, 3], ["RE", 6, [0, 4, 1, 5, 2, 6, 3, 7]], ["CA", 4, 6, 5], ["CHR", 3, "shared", [4]], ["CA", 4, 5, 6], ["CI", 3], ["CHR", 1, "shared", [5]], ["CA", 2, 6, 6], ["CI", 1], ["FU", 8, [0, 1]], ["AN", 8, 0, 5], ["FU", 8, [1, 2]], ["AN", 8, 1, 4], ["FU", 8, [2, 3]], ["AN", 8, 2, 6], ["FU", 5, [0, 1]], ["SP", 5, 0, 48, [24], 1], ["AN", 5, 1, 2], ["FFSP", 5, 0, [1, 0], 1, 1], ["AN", 5, 1, 6], ["FU", 2, [0, 1]], ["SP", 2, 0, 48, [12], 1], ["AN", 2, 1, 2], ["FFSP", 2, 0, [1, 0], 1, 1], ["AN", 2, 1, 6], ["PR", 6, 0, "auto_unroll_max_step$0"]]]], "r": [[0.000301898], 0, 2.58031, 1661160441], "v": "v0.6"}
{"i": [["[\"get_expr\", \"fused_conv_bias_relu_expr_S1D1P1\", [64, 32, 16, 16, 32, 3, 3]]", "cuda -keys=cuda,gpu -max_num_threads=1024 -thread_warp_size=32", [-1, 16, 64, 49152, 2147483647, 1024, 8, 32], "", 0, []], [[], [["SP", 4, 0, 32, [1, 1, 4, 4], 1], ["SP", 4, 5, 16384, [1, 128, 16, 1], 1], ["SP", 4, 10, 288, [3, 1], 1], ["RE", 4, [0, 5, 1, 6, 2, 7, 10, 11, 3, 8, 12, 4, 9]], ["FSP", 6, 0, 0, 3], ["FSP", 6, 4, 1, 3], ["RE", 6, [0, 4, 1, 5, 2, 6, 3, 7]], ["CA", 4, 6, 5], ["CHR", 3, "shared", [4]], ["CA", 4, 5, 6], ["CI", 3], ["CHR", 1, "shared", [5]], ["CA", 2, 6, 6], ["CI", 1], ["FU", 8, [0, 1]], ["AN", 8, 0, 5], ["FU", 8, [1, 2]], ["AN", 8, 1, 4], ["FU", 8, [2, 3]], ["AN", 8, 2, 6], ["FU", 5, [0, 1]], ["SP", 5, 0, 48, [6], 1], ["AN", 5, 1, 2], ["FFSP", 5, 0, [1, 0], 1, 1], ["AN", 5, 1, 6], ["FU", 2, [0, 1]], ["SP", 2, 0, 48, [1], 1], ["AN", 2, 1, 2], ["FFSP", 2, 0, [1, 0], 1, 1], ["AN", 2, 1, 6], ["PR", 6, 0, "auto_unroll_max_step$64"]]]], "r": [[0.000803346], 0, 3.46632, 1661160443], "v": "v0.6"}
{"i": [["[\"get_expr\", \"fused_conv_bias_relu_expr_S1D1P1\", [64, 32, 16, 16, 32, 3, 3]]", "cuda -keys=cuda,gpu -max_num_threads=1024 -thread_warp_size=32", [-1, 16, 64, 49152, 2147483647, 1024, 8, 32], "", 0, []], [[], [["SP", 4, 0, 32, [2, 4, 2, 1], 1], ["SP", 4, 5, 16384, [2, 256, 2, 1], 1], ["SP", 4, 10, 288, [1, 9], 1], ["RE", 4, [0, 5, 1, 6, 2, 7, 10, 11, 3, 8, 12, 4, 9]], ["FSP", 6, 0, 0, 3], ["FSP", 6, 4, 1, 3], ["RE", 6, [0, 4, 1, 5, 2, 6, 3, 7]], ["CA", 4, 6, 5], ["CHR", 3, "shared", [4]], ["CA", 4, 5, 6], ["CI", 3], ["CHR", 1, "shared", [5]], ["CA", 2, 6, 6], ["CI", 1], ["FU", 8, [0, 1]], ["AN", 8, 0, 5], ["FU", 8, [1, 2]], ["AN", 8, 1, 4], ["FU", 8, [2, 3]], ["AN", 8, 2, 6], ["FU", 5, [0, 1]], ["SP", 5, 0, 18, [2], 1], ["AN", 5, 1, 2], ["FFSP", 5, 0, [1, 0], 1, 1], ["AN", 5, 1, 6], ["FU", 2, [0, 1]], ["SP", 2, 0, 18, [1], 1], ["AN", 2, 1, 2], ["FFSP", 2, 0, [1, 0], 1, 1], ["AN", 2, 1, 6], ["PR", 6, 0, "auto_unroll_max_step$16"]]]], "r": [[9.64025e-05], 0, 2.1291, 1661160444], "v": "v0.6"}
{"i": [["[\"get_expr\", \"fused_conv_bias_relu_expr_S1D1P1\", [64, 32, 16, 16, 32, 3, 3]]", "cuda -keys=cuda,gpu -max_num_threads=1024 -thread_warp_size=32", [-1, 16, 64, 49152, 2147483647, 1024, 8, 32], "", 0, []], [[], [["SP", 4, 0, 32, [1, 1, 2, 8], 1], ["SP", 4, 5, 16384, [1, 32, 1, 2], 1], ["SP", 4, 10, 288, [2, 2], 1], ["RE", 4, [0, 5, 1, 6, 2, 7, 10, 11, 3, 8, 12, 4, 9]], ["FSP", 6, 0, 0, 3], ["FSP", 6, 4, 1, 3], ["RE", 6, [0, 4, 1, 5, 2, 6, 3, 7]], ["CA", 4, 6, 5], ["CHR", 3, "shared", [4]], ["CA", 4, 5, 6], ["CI", 3], ["CHR", 1, "shared", [5]], ["CA", 2, 6, 6], ["CI", 1], ["FU", 8, [0, 1]], ["AN", 8, 0, 5], ["FU", 8, [1, 2]], ["AN", 8, 1, 4], ["FU", 8, [2, 3]], ["AN", 8, 2, 6], ["FU", 5, [0, 1]], ["SP", 5, 0, 32, [1], 1], ["AN", 5, 1, 2], ["FFSP", 5, 0, [1, 0], 1, 1], ["AN", 5, 1, 6], ["FU", 2, [0, 1]], ["SP", 2, 0, 8, [1], 1], ["AN", 2, 1, 2], ["FFSP", 2, 0, [1, 0], 1, 1], ["AN", 2, 1, 6], ["PR", 6, 0, "auto_unroll_max_step$0"]]]], "r": [[0.000133018], 0, 1.97784, 1661160446], "v": "v0.6"}
{"i": [["[\"get_expr\", \"fused_conv_bias_relu_expr_S1D1P1\", [64, 32, 16, 16, 32, 3, 3]]", "cuda -keys=cuda,gpu -max_num_threads=1024 -thread_warp_size=32", [-1, 16, 64, 49152, 2147483647, 1024, 8, 32], "", 0, []], [[], [["SP", 4, 0, 32, [1, 32, 1, 1], 1], ["SP", 4, 5, 16384, [8, 4, 1, 2], 1], ["SP", 4, 10, 288, [3, 1], 1], ["RE", 4, [0, 5, 1, 6, 2, 7, 10, 11, 3, 8, 12, 4, 9]], ["FSP", 6, 0, 0, 3], ["FSP", 6, 4, 1, 3], ["RE", 6, [0, 4, 1, 5, 2, 6, 3, 7]], ["CA", 4, 6, 5], ["CHR", 3, "shared", [4]], ["CA", 4, 5, 6], ["CI", 3], ["CHR", 1, "shared", [5]], ["CA", 2, 6, 6], ["CI", 1], ["FU", 8, [0, 1]], ["AN", 8, 0, 5], ["FU", 8, [1, 2]], ["AN", 8, 1, 4], ["FU", 8, [2, 3]], ["AN", 8, 2, 6], ["FU", 5, [0, 1]], ["SP", 5, 0, 3, [1], 1], ["AN", 5, 1, 2], ["FFSP", 5, 0, [1, 0], 1, 1], ["AN", 5, 1, 6], ["FU", 2, [0, 1]], ["SP", 2, 0, 12, [6], 1], ["AN", 2, 1, 2], ["FFSP", 2, 0, [1, 0], 1, 1], ["AN", 2, 1, 6], ["PR", 6, 0, "auto_unroll_max_step$16"]]]], "r": [[9.60539e-05], 0, 3.01965, 1661160448], "v": "v0.6"}
{"i": [["[\"get_expr\", \"fused_conv_bias_relu_expr_S1D1P1\", [64, 32, 16, 16, 32, 3, 3]]", "cuda -keys=cuda,gpu -max_num_threads=1024 -thread_warp_size=32", [-1, 16, 64, 49152, 2147483647, 1024, 8, 32], "", 0, []], [[], [["SP", 4, 0, 32, [1, 4, 4, 1], 1], ["SP", 4, 5, 16384, [2, 256, 1, 1], 1], ["SP", 4, 10, 288, [9, 1], 1], ["RE", 4, [0, 5, 1, 6, 2, 7, 10, 11, 3, 8, 12, 4, 9]], ["FSP", 6, 0, 0, 3], ["FSP", 6, 4, 1, 3], ["RE", 6, [0, 4, 1, 5, 2, 6, 3, 7]], ["CA", 4, 6, 5], ["CHR", 3, "shared", [4]], ["CA", 4, 5, 6], ["CI", 3], ["CHR", 1, "shared", [5]], ["CA", 2, 6, 6], ["CI", 1], ["FU", 8, [0, 1]], ["AN", 8, 0, 5], ["FU", 8, [1, 2]], ["AN", 8, 1, 4], ["FU", 8, [2, 3]], ["AN", 8, 2, 6], ["FU", 5, [0, 1]], ["SP", 5, 0, 36, [1], 1], ["AN", 5, 1, 2], ["FFSP", 5, 0, [1, 0], 1, 1], ["AN", 5, 1, 6], ["FU", 2, [0, 1]], ["SP", 2, 0, 144, [4], 1], ["AN", 2, 1, 2], ["FFSP", 2, 0, [1, 0], 1, 1], ["AN", 2, 1, 6], ["PR", 6, 0, "auto_unroll_max_step$512"]]]], "r": [[8.66758e-05], 0, 2.91876, 1661160450], "v": "v0.6"}
{"i": [["[\"get_expr\", \"fused_conv_bias_relu_expr_S1D1P1\", [64, 32, 16, 16, 32, 3, 3]]", "cuda -keys=cuda,gpu -max_num_threads=1024 -thread_warp_size=32", [-1, 16, 64, 49152, 2147483647, 1024, 8, 32], "", 0, []], [[], [["SP", 4, 0, 32, [1, 4, 2, 4], 1], ["SP", 4, 5, 16384, [1, 64, 2, 4], 1], ["SP", 4, 10, 288, [9, 1], 1], ["RE", 4, [0, 5, 1, 6, 2, 7, 10, 11, 3, 8, 12, 4, 9]], ["FSP", 6, 0, 0, 3], ["FSP", 6, 4, 1, 3], ["RE", 6, [0, 4, 1, 5, 2, 6, 3, 7]], ["CA", 4, 6, 5], ["CHR", 3, "shared", [4]], ["CA", 4, 5, 6], ["CI", 3], ["CHR", 1, "shared", [5]], ["CA", 2, 6, 6], ["CI", 1], ["FU", 8, [0, 1]], ["AN", 8, 0, 5], ["FU", 8, [1, 2]], ["AN", 8, 1, 4], ["FU", 8, [2, 3]], ["AN", 8, 2, 6], ["FU", 5, [0, 1]], ["SP", 5, 0, 72, [1], 1], ["AN", 5, 1, 2], ["FFSP", 5, 0, [1, 0], 1, 1], ["AN", 5, 1, 6], ["FU", 2, [0, 1]], ["SP", 2, 0, 72, [9], 1], ["AN", 2, 1, 2], ["FFSP", 2, 0, [1, 0], 1, 1], ["AN", 2, 1, 6], ["PR", 6, 0, "auto_unroll_max_step$1024"]]]], "r": [[0.000104495], 0, 2.80081, 1661160451], "v": "v0.6"}
{"i": [["[\"get_expr\", \"fused_conv_bias_relu_expr_S1D1P1\", [64, 32, 16, 16, 32, 3, 3]]", "cuda -keys=cuda,gpu -max_num_threads=1024 -thread_warp_size=32", [-1, 16, 64, 49152, 2147483647, 1024, 8, 32], "", 0, []], [[], [["SP", 4, 0, 32, [2, 2, 8, 1], 1], ["SP", 4, 5, 16384, [2, 64, 2, 1], 1], ["SP", 4, 10, 288, [2, 8], 1], ["RE", 4, [0, 5, 1, 6, 2, 7, 10, 11, 3, 8, 12, 4, 9]], ["FSP", 6, 0, 0, 3], ["FSP", 6, 4, 1, 3], ["RE", 6, [0, 4, 1, 5, 2, 6, 3, 7]], ["CA", 4, 6, 5], ["CHR", 3, "shared", [4]], ["CA", 4, 5, 6], ["CI", 3], ["CHR", 1, "shared", [5]], ["CA", 2, 6, 6], ["CI", 1], ["FU", 8, [0, 1]], ["AN", 8, 0, 5], ["FU", 8, [1, 2]], ["AN", 8, 1, 4], ["FU", 8, [2, 3]], ["AN", 8, 2, 6], ["FU", 5, [0, 1]], ["SP", 5, 0, 128, [2], 1], ["AN", 5, 1, 2], ["FFSP", 5, 0, [1, 0], 1, 1], ["AN", 5, 1, 6], ["FU", 2, [0, 1]], ["SP", 2, 0, 32, [32], 1], ["AN", 2, 1, 2], ["FFSP", 2, 0, [1, 0], 1, 1], ["AN", 2, 1, 6], ["PR", 6, 0, "auto_unroll_max_step$512"]]]], "r": [[0.000148315], 0, 3.74756, 1661160453], "v": "v0.6"}
{"i": [["[\"get_expr\", \"fused_conv_bias_relu_expr_S1D1P1\", [64, 32, 16, 16, 32, 3, 3]]", "cuda -keys=cuda,gpu -max_num_threads=1024 -thread_warp_size=32", [-1, 16, 64, 49152, 2147483647, 1024, 8, 32], "", 0, []], [[], [["SP", 4, 0, 32, [2, 4, 1, 2], 1], ["SP", 4, 5, 16384, [1, 8, 512, 1], 1], ["SP", 4, 10, 288, [1, 1], 1], ["RE", 4, [0, 5, 1, 6, 2, 7, 10, 11, 3, 8, 12, 4, 9]], ["FSP", 6, 0, 0, 3], ["FSP", 6, 4, 1, 3], ["RE", 6, [0, 4, 1, 5, 2, 6, 3, 7]], ["CA", 4, 6, 5], ["CHR", 3, "shared", [4]], ["CA", 4, 5, 6], ["CI", 3], ["CHR", 1, "shared", [5]], ["CA", 2, 6, 6], ["CI", 1], ["FU", 8, [0, 1]], ["AN", 8, 0, 5], ["FU", 8, [1, 2]], ["AN", 8, 1, 4], ["FU", 8, [2, 3]], ["AN", 8, 2, 6], ["FU", 5, [0, 1]], ["SP", 5, 0, 4, [1], 1], ["AN", 5, 1, 2], ["FFSP", 5, 0, [1, 0], 1, 1], ["AN", 5, 1, 6], ["FU", 2, [0, 1]], ["SP", 2, 0, 1024, [1], 1], ["AN", 2, 1, 2], ["FFSP", 2, 0, [1, 0], 1, 1], ["AN", 2, 1, 6], ["PR", 6, 0, "auto_unroll_max_step$1024"]]]], "r": [[0.00596193], 0, 3.48804, 1661160455], "v": "v0.6"}
{"i": [["[\"get_expr\", \"fused_conv_bias_relu_expr_S1D1P1\", [64, 32, 16, 16, 32, 3, 3]]", "cuda -keys=cuda,gpu -max_num_threads=1024 -thread_warp_size=32", [-1, 16, 64, 49152, 2147483647, 1024, 8, 32], "", 0, []], [[], [["SP", 4, 0, 32, [1, 4, 1, 8], 1], ["SP", 4, 5, 16384, [1, 16, 1, 4], 1], ["SP", 4, 10, 288, [6, 1], 1], ["RE", 4, [0, 5, 1, 6, 2, 7, 10, 11, 3, 8, 12, 4, 9]], ["FSP", 6, 0, 0, 3], ["FSP", 6, 4, 1, 3], ["RE", 6, [0, 4, 1, 5, 2, 6, 3, 7]], ["CA", 4, 6, 5], ["CHR", 3, "shared", [4]], ["CA", 4, 5, 6], ["CI", 3], ["CHR", 1, "shared", [5]], ["CA", 2, 6, 6], ["CI", 1], ["FU", 8, [0, 1]], ["AN", 8, 0, 5], ["FU", 8, [1, 2]], ["AN", 8, 1, 4], ["FU", 8, [2, 3]], ["AN", 8, 2, 6], ["FU", 5, [0, 1]], ["SP", 5, 0, 48, [1], 1], ["AN", 5, 1, 2], ["FFSP", 5, 0, [1, 0], 1, 1], ["AN", 5, 1, 6], ["FU", 2, [0, 1]], ["SP", 2, 0, 24, [1], 1], ["AN", 2, 1, 2], ["FFSP", 2, 0, [1, 0], 1, 1], ["AN", 2, 1, 6], ["PR", 6, 0, "auto_unroll_max_step$0"]]]], "r": [[5.08306e-05], 0, 2.49696, 1661160457], "v": "v0.6"}
{"i": [["[\"get_expr\", \"fused_conv_bias_relu_expr_S1D1P1\", [64, 32, 16, 16, 32, 3, 3]]", "cuda -keys=cuda,gpu -max_num_threads=1024 -thread_warp_size=32", [-1, 16, 64, 49152, 2147483647, 1024, 8, 32], "", 0, []], [[], [["SP", 4, 0, 32, [1, 4, 2, 4], 1], ["SP", 4, 5, 16384, [1, 64, 2, 4], 1], ["SP", 4, 10, 288, [9, 1], 1], ["RE", 4, [0, 5, 1, 6, 2, 7, 10, 11, 3, 8, 12, 4, 9]], ["FSP", 6, 0, 0, 3], ["FSP", 6, 4, 1, 3], ["RE", 6, [0, 4, 1, 5, 2, 6, 3, 7]], ["CA", 4, 6, 5], ["CHR", 3, "shared", [4]], ["CA", 4, 5, 6], ["CI", 3], ["CHR", 1, "shared", [5]], ["CA", 2, 6, 6], ["CI", 1], ["FU", 8, [0, 1]], ["AN", 8, 0, 5], ["FU", 8, [1, 2]], ["AN", 8, 1, 4], ["FU", 8, [2, 3]], ["AN", 8, 2, 6], ["FU", 5, [0, 1]], ["SP", 5, 0, 72, [1], 1], ["AN", 5, 1, 2], ["FFSP", 5, 0, [1, 0], 1, 1], ["AN", 5, 1, 6], ["FU", 2, [0, 1]], ["SP", 2, 0, 72, [1], 1], ["AN", 2, 1, 2], ["FFSP", 2, 0, [1, 0], 1, 1], ["AN", 2, 1, 6], ["PR", 6, 0, "auto_unroll_max_step$0"]]]], "r": [[0.000131856], 0, 2.38428, 1661160458], "v": "v0.6"}
{"i": [["[\"get_expr\", \"fused_conv_bias_relu_expr_S1D1P1\", [64, 32, 16, 16, 32, 3, 3]]", "cuda -keys=cuda,gpu -max_num_threads=1024 -thread_warp_size=32", [-1, 16, 64, 49152, 2147483647, 1024, 8, 32], "", 0, []], [[], [["SP", 4, 0, 32, [2, 2, 1, 8], 1], ["SP", 4, 5, 16384, [1, 16, 1, 4], 1], ["SP", 4, 10, 288, [2, 1], 1], ["RE", 4, [0, 5, 1, 6, 2, 7, 10, 11, 3, 8, 12, 4, 9]], ["FSP", 6, 0, 0, 3], ["FSP", 6, 4, 1, 3], ["RE", 6, [0, 4, 1, 5, 2, 6, 3, 7]], ["CA", 4, 6, 5], ["CHR", 3, "shared", [4]], ["CA", 4, 5, 6], ["CI", 3], ["CHR", 1, "shared", [5]], ["CA", 2, 6, 6], ["CI", 1], ["FU", 8, [0, 1]], ["AN", 8, 0, 5], ["FU", 8, [1, 2]], ["AN", 8, 1, 4], ["FU", 8, [2, 3]], ["AN", 8, 2, 6], ["FU", 5, [0, 1]], ["SP", 5, 0, 48, [1], 1], ["AN", 5, 1, 2], ["FFSP", 5, 0, [1, 0], 1, 1], ["AN", 5, 1, 6], ["FU", 2, [0, 1]], ["SP", 2, 0, 24, [1], 1], ["AN", 2, 1, 2], ["FFSP", 2, 0, [1, 0], 1, 1], ["AN", 2, 1, 6], ["PR", 6, 0, "auto_unroll_max_step$0"]]]], "r": [[0.000136617], 0, 1.93336, 1661160459], "v": "v0.6"}
{"i": [["[\"get_expr\", \"fused_conv_bias_relu_expr_S1D1P1\", [64, 32, 16, 16, 32, 3, 3]]", "cuda -keys=cuda,gpu -max_num_threads=1024 -thread_warp_size=32", [-1, 16, 64, 49152, 2147483647, 1024, 8, 32], "", 0, []], [[], [["SP", 4, 0, 32, [1, 2, 1, 2], 1], ["SP", 4, 5, 16384, [2, 16, 1, 8], 1], ["SP", 4, 10, 288, [36, 1], 1], ["RE", 4, [0, 5, 1, 6, 2, 7, 10, 11, 3, 8, 12, 4, 9]], ["FSP", 6, 0, 0, 3], ["FSP", 6, 4, 1, 3], ["RE", 6, [0, 4, 1, 5, 2, 6, 3, 7]], ["CA", 4, 6, 5], ["CHR", 3, "shared", [4]], ["CA", 4, 5, 6], ["CI", 3], ["CHR", 1, "shared", [5]], ["CA", 2, 6, 6], ["CI", 1], ["FU", 8, [0, 1]], ["AN", 8, 0, 5], ["FU", 8, [1, 2]], ["AN", 8, 1, 4], ["FU", 8, [2, 3]], ["AN", 8, 2, 6], ["FU", 5, [0, 1]], ["SP", 5, 0, 72, [1], 1], ["AN", 5, 1, 2], ["FFSP", 5, 0, [1, 0], 1, 1], ["AN", 5, 1, 6], ["FU", 2, [0, 1]], ["SP", 2, 0, 288, [1], 1], ["AN", 2, 1, 2], ["FFSP", 2, 0, [1, 0], 1, 1], ["AN", 2, 1, 6], ["PR", 6, 0, "auto_unroll_max_step$16"]]]], "r": [[0.00132099], 0, 1.98541, 1661160461], "v": "v0.6"}
{"i": [["[\"get_expr\", \"fused_conv_bias_relu_expr_S1D1P1\", [64, 32, 16, 16, 32, 3, 3]]", "cuda -keys=cuda,gpu -max_num_threads=1024 -thread_warp_size=32", [-1, 16, 64, 49152, 2147483647, 1024, 8, 32], "", 0, []], [[], [["SP", 4, 0, 32, [1, 2, 1, 16], 1], ["SP", 4, 5, 16384, [1, 16, 2, 4], 1], ["SP", 4, 10, 288, [4, 2], 1], ["RE", 4, [0, 5, 1, 6, 2, 7, 10, 11, 3, 8, 12, 4, 9]], ["FSP", 6, 0, 0, 3], ["FSP", 6, 4, 1, 3], ["RE", 6, [0, 4, 1, 5, 2, 6, 3, 7]], ["CA", 4, 6, 5], ["CHR", 3, "shared", [4]], ["CA", 4, 5, 6], ["CI", 3], ["CHR", 1, "shared", [5]], ["CA", 2, 6, 6], ["CI", 1], ["FU", 8, [0, 1]], ["AN", 8, 0, 5], ["FU", 8, [1, 2]], ["AN", 8, 1, 4], ["FU", 8, [2, 3]], ["AN", 8, 2, 6], ["FU", 5, [0, 1]], ["SP", 5, 0, 32, [2], 1], ["AN", 5, 1, 2], ["FFSP", 5, 0, [1, 0], 1, 1], ["AN", 5, 1, 6], ["FU", 2, [0, 1]], ["SP", 2, 0, 64, [1], 1], ["AN", 2, 1, 2], ["FFSP", 2, 0, [1, 0], 1, 1], ["AN", 2, 1, 6], ["PR", 6, 0, "auto_unroll_max_step$16"]]]], "r": [[0.000276684], 0, 2.15666, 1661160462], "v": "v0.6"}
{"i": [["[\"get_expr\", \"fused_conv_bias_relu_expr_S1D1P1\", [64, 32, 16, 16, 32, 3, 3]]", "cuda -keys=cuda,gpu -max_num_threads=1024 -thread_warp_size=32", [-1, 16, 64, 49152, 2147483647, 1024, 8, 32], "", 0, []], [[], [["SP", 4, 0, 32, [1, 2, 8, 2], 1], ["SP", 4, 5, 16384, [1, 32, 1, 1], 1], ["SP", 4, 10, 288, [3, 12], 1], ["RE", 4, [0, 5, 1, 6, 2, 7, 10, 11, 3, 8, 12, 4, 9]], ["FSP", 6, 0, 0, 3], ["FSP", 6, 4, 1, 3], ["RE", 6, [0, 4, 1, 5, 2, 6, 3, 7]], ["CA", 4, 6, 5], ["CHR", 3, "shared", [4]], ["CA", 4, 5, 6], ["CI", 3], ["CHR", 1, "shared", [5]], ["CA", 2, 6, 6], ["CI", 1], ["FU", 8, [0, 1]], ["AN", 8, 0, 5], ["FU", 8, [1, 2]], ["AN", 8, 1, 4], ["FU", 8, [2, 3]], ["AN", 8, 2, 6], ["FU", 5, [0, 1]], ["SP", 5, 0, 576, [4], 1], ["AN", 5, 1, 2], ["FFSP", 5, 0, [1, 0], 1, 1], ["AN", 5, 1, 6], ["FU", 2, [0, 1]], ["SP", 2, 0, 36, [2], 1], ["AN", 2, 1, 2], ["FFSP", 2, 0, [1, 0], 1, 1], ["AN", 2, 1, 6], ["PR", 6, 0, "auto_unroll_max_step$1024"]]]], "r": [[5.68821e-05], 0, 3.47344, 1661160463], "v": "v0.6"}
{"i": [["[\"get_expr\", \"fused_conv_bias_relu_expr_S1D1P1\", [64, 32, 16, 16, 32, 3, 3]]", "cuda -keys=cuda,gpu -max_num_threads=1024 -thread_warp_size=32", [-1, 16, 64, 49152, 2147483647, 1024, 8, 32], "", 0, []], [[], [["SP", 4, 0, 32, [8, 4, 1, 1], 1], ["SP", 4, 5, 16384, [4, 16, 1, 2], 1], ["SP", 4, 10, 288, [4, 18], 1], ["RE", 4, [0, 5, 1, 6, 2, 7, 10, 11, 3, 8, 12, 4, 9]], ["FSP", 6, 0, 0, 3], ["FSP", 6, 4, 1, 3], ["RE", 6, [0, 4, 1, 5, 2, 6, 3, 7]], ["CA", 4, 6, 5], ["CHR", 3, "shared", [4]], ["CA", 4, 5, 6], ["CI", 3], ["CHR", 1, "shared", [5]], ["CA", 2, 6, 6], ["CI", 1], ["FU", 8, [0, 1]], ["AN", 8, 0, 5], ["FU", 8, [1, 2]], ["AN", 8, 1, 4], ["FU", 8, [2, 3]], ["AN", 8, 2, 6], ["FU", 5, [0, 1]], ["SP", 5, 0, 72, [1], 1], ["AN", 5, 1, 2], ["FFSP", 5, 0, [1, 0], 1, 1], ["AN", 5, 1, 6], ["FU", 2, [0, 1]], ["SP", 2, 0, 144, [1], 1], ["AN", 2, 1, 2], ["FFSP", 2, 0, [1, 0], 1, 1], ["AN", 2, 1, 6], ["PR", 6, 0, "auto_unroll_max_step$0"]]]], "r": [[0.000155995], 0, 3.75674, 1661160466], "v": "v0.6"}
{"i": [["[\"get_expr\", \"fused_conv_bias_relu_expr_S1D1P1\", [64, 32, 16, 16, 32, 3, 3]]", "cuda -keys=cuda,gpu -max_num_threads=1024 -thread_warp_size=32", [-1, 16, 64, 49152, 2147483647, 1024, 8, 32], "", 0, []], [[], [["SP", 4, 0, 32, [1, 1, 1, 1], 1], ["SP", 4, 5, 16384, [2, 128, 1, 16], 1], ["SP", 4, 10, 288, [1, 2], 1], ["RE", 4, [0, 5, 1, 6, 2, 7, 10, 11, 3, 8, 12, 4, 9]], ["FSP", 6, 0, 0, 3], ["FSP", 6, 4, 1, 3], ["RE", 6, [0, 4, 1, 5, 2, 6, 3, 7]], ["CA", 4, 6, 5], ["CHR", 3, "shared", [4]], ["CA", 4, 5, 6], ["CI", 3], ["CHR", 1, "shared", [5]], ["CA", 2, 6, 6], ["CI", 1], ["FU", 8, [0, 1]], ["AN", 8, 0, 5], ["FU", 8, [1, 2]], ["AN", 8, 1, 4], ["FU", 8, [2, 3]], ["AN", 8, 2, 6], ["FU", 5, [0, 1]], ["SP", 5, 0, 16, [1], 1], ["AN", 5, 1, 2], ["FFSP", 5, 0, [1, 0], 1, 1], ["AN", 5, 1, 6], ["FU", 2, [0, 1]], ["SP", 2, 0, 32, [1], 1], ["AN", 2, 1, 2], ["FFSP", 2, 0, [1, 0], 1, 1], ["AN", 2, 1, 6], ["PR", 6, 0, "auto_unroll_max_step$64"]]]], "r": [[0.00132551], 0, 2.85693, 1661160468], "v": "v0.6"}
{"i": [["[\"get_expr\", \"fused_conv_bias_relu_expr_S1D1P1\", [64, 32, 16, 16, 32, 3, 3]]", "cuda -keys=cuda,gpu -max_num_threads=1024 -thread_warp_size=32", [-1, 16, 64, 49152, 2147483647, 1024, 8, 32], "", 0, []], [[], [["SP", 4, 0, 32, [2, 4, 2, 1], 1], ["SP", 4, 5, 16384, [4, 16, 1, 16], 1], ["SP", 4, 10, 288, [1, 3], 1], ["RE", 4, [0, 5, 1, 6, 2, 7, 10, 11, 3, 8, 12, 4, 9]], ["FSP", 6, 0, 0, 3], ["FSP", 6, 4, 1, 3], ["RE", 6, [0, 4, 1, 5, 2, 6, 3, 7]], ["CA", 4, 6, 5], ["CHR", 3, "shared", [4]], ["CA", 4, 5, 6], ["CI", 3], ["CHR", 1, "shared", [5]], ["CA", 2, 6, 6], ["CI", 1], ["FU", 8, [0, 1]], ["AN", 8, 0, 5], ["FU", 8, [1, 2]], ["AN", 8, 1, 4], ["FU", 8, [2, 3]], ["AN", 8, 2, 6], ["FU", 5, [0, 1]], ["SP", 5, 0, 24, [1], 1], ["AN", 5, 1, 2], ["FFSP", 5, 0, [1, 0], 1, 1], ["AN", 5, 1, 6], ["FU", 2, [0, 1]], ["SP", 2, 0, 96, [1], 1], ["AN", 2, 1, 2], ["FFSP", 2, 0, [1, 0], 1, 1], ["AN", 2, 1, 6], ["PR", 6, 0, "auto_unroll_max_step$0"]]]], "r": [[0.0010656], 0, 2.46436, 1661160469], "v": "v0.6"}
{"i": [["[\"get_expr\", \"fused_conv_bias_relu_expr_S1D1P1\", [64, 32, 16, 16, 32, 3, 3]]", "cuda -keys=cuda,gpu -max_num_threads=1024 -thread_warp_size=32", [-1, 16, 64, 49152, 2147483647, 1024, 8, 32], "", 0, []], [[], [["SP", 4, 0, 32, [1, 4, 1, 4], 1], ["SP", 4, 5, 16384, [1, 64, 2, 4], 1], ["SP", 4, 10, 288, [4, 2], 1], ["RE", 4, [0, 5, 1, 6, 2, 7, 10, 11, 3, 8, 12, 4, 9]], ["FSP", 6, 0, 0, 3], ["FSP", 6, 4, 1, 3], ["RE", 6, [0, 4, 1, 5, 2, 6, 3, 7]], ["CA", 4, 6, 5], ["CHR", 3, "shared", [4]], ["CA", 4, 5, 6], ["CI", 3], ["CHR", 1, "shared", [5]], ["CA", 2, 6, 6], ["CI", 1], ["FU", 8, [0, 1]], ["AN", 8, 0, 5], ["FU", 8, [1, 2]], ["AN", 8, 1, 4], ["FU", 8, [2, 3]], ["AN", 8, 2, 6], ["FU", 5, [0, 1]], ["SP", 5, 0, 32, [1], 1], ["AN", 5, 1, 2], ["FFSP", 5, 0, [1, 0], 1, 1], ["AN", 5, 1, 6], ["FU", 2, [0, 1]], ["SP", 2, 0, 64, [1], 1], ["AN", 2, 1, 2], ["FFSP", 2, 0, [1, 0], 1, 1], ["AN", 2, 1, 6], ["PR", 6, 0, "auto_unroll_max_step$16"]]]], "r": [[0.000138425], 0, 2.30238, 1661160470], "v": "v0.6"}
{"i": [["[\"get_expr\", \"fused_conv_bias_relu_expr_S1D1P1\", [64, 32, 16, 16, 32, 3, 3]]", "cuda -keys=cuda,gpu -max_num_threads=1024 -thread_warp_size=32", [-1, 16, 64, 49152, 2147483647, 1024, 8, 32], "", 0, []], [[], [["SP", 4, 0, 32, [1, 1, 1, 8], 1], ["SP", 4, 5, 16384, [1, 32, 1, 8], 1], ["SP", 4, 10, 288, [1, 18], 1], ["RE", 4, [0, 5, 1, 6, 2, 7, 10, 11, 3, 8, 12, 4, 9]], ["FSP", 6, 0, 0, 3], ["FSP", 6, 4, 1, 3], ["RE", 6, [0, 4, 1, 5, 2, 6, 3, 7]], ["CA", 4, 6, 5], ["CHR", 3, "shared", [4]], ["CA", 4, 5, 6], ["CI", 3], ["CHR", 1, "shared", [5]], ["CA", 2, 6, 6], ["CI", 1], ["FU", 8, [0, 1]], ["AN", 8, 0, 5], ["FU", 8, [1, 2]], ["AN", 8, 1, 4], ["FU", 8, [2, 3]], ["AN", 8, 2, 6], ["FU", 5, [0, 1]], ["SP", 5, 0, 144, [1], 1], ["AN", 5, 1, 2], ["FFSP", 5, 0, [1, 0], 1, 1], ["AN", 5, 1, 6], ["FU", 2, [0, 1]], ["SP", 2, 0, 144, [1], 1], ["AN", 2, 1, 2], ["FFSP", 2, 0, [1, 0], 1, 1], ["AN", 2, 1, 6], ["PR", 6, 0, "auto_unroll_max_step$1024"]]]], "r": [[9.66516e-05], 0, 3.17072, 1661160472], "v": "v0.6"}
