artifacts/Table4/tvm/autotvm/matmul/matmul_65536_1024_4096.log
{"input": ["rocm -keys=rocm,gpu -max_num_threads=256 -mcpu=gfx906 -mtriple=amdgcn-amd-amdhsa-hcc -thread_warp_size=64", "dense.rocm", [["TENSOR", [65536, 1024], "float32"], ["TENSOR", [1024, 4096], "float32"]], {}], "config": {"index": 0, "code_hash": null, "entity": []}, "result": [[25.38030078125], 0, 135.66447401046753, 1638608177.5183284], "version": 0.2, "tvm_version": "0.9.dev0"}
