artifacts/Table4/tvm/autotvm/matmul/matmul_128_4032_1000.log
{"input": ["rocm -keys=rocm,gpu -max_num_threads=256 -mcpu=gfx906 -mtriple=amdgcn-amd-amdhsa-hcc -thread_warp_size=64", "dense.rocm", [["TENSOR", [128, 4032], "float32"], ["TENSOR", [4032, 1000], "float32"]], {}], "config": {"index": 0, "code_hash": null, "entity": []}, "result": [[0.030970157499999998], 0, 1.0252888202667236, 1638608029.3820994], "version": 0.2, "tvm_version": "0.9.dev0"}
