artifacts/Table4/tvm/autotvm/matmul/matmul_128_2048_1000.log
{"input": ["rocm -keys=rocm,gpu -max_num_threads=256 -mcpu=gfx906 -mtriple=amdgcn-amd-amdhsa-hcc -thread_warp_size=64", "dense.rocm", [["TENSOR", [128, 2048], "float32"], ["TENSOR", [2048, 1000], "float32"]], {}], "config": {"index": 0, "code_hash": null, "entity": []}, "result": [[0.0108372207], 0, 1.011831521987915, 1638608036.164981], "version": 0.2, "tvm_version": "0.9.dev0"}
