artifacts/Table4/tvm/autotvm/matmul/matmul_65536_4096_1024.log
{"input": ["rocm -keys=rocm,gpu -max_num_threads=256 -mcpu=gfx906 -mtriple=amdgcn-amd-amdhsa-hcc -thread_warp_size=64", "dense.rocm", [["TENSOR", [65536, 4096], "float32"], ["TENSOR", [4096, 1024], "float32"]], {}], "config": {"index": 0, "code_hash": null, "entity": []}, "result": [[23.91137109375], 0, 126.82896113395691, 1638608349.9446537], "version": 0.2, "tvm_version": "0.9.dev0"}
