artifacts/microbenchmark/tvm/scale_out/matmul_bert_scale/matmul_1024_1024_4096.log
{"input": ["cuda -keys=cuda,gpu -max_num_threads=1024 -thread_warp_size=32", "dense_large_batch.gpu", [["TENSOR", [1024, 1024], "float32"], ["TENSOR", [1024, 4096], "float32"]], {}], "config": {"index": 3089066, "code_hash": null, "entity": [["tile_x", "sp", [-1, 1, 1, 128]], ["tile_y", "sp", [-1, 1, 1, 32]], ["tile_k", "sp", [-1, 4, 4]]]}, "result": [[1.203934943], 0, 18.583112239837646, 1639417920.832917], "version": 0.2, "tvm_version": "0.8.0"}
{"input": ["cuda -keys=cuda,gpu -max_num_threads=1024 -thread_warp_size=32", "dense_large_batch.gpu", [["TENSOR", [1024, 1024], "float32"], ["TENSOR", [1024, 4096], "float32"]], {}], "config": {"index": 3931273, "code_hash": null, "entity": [["tile_x", "sp", [-1, 2, 1, 16]], ["tile_y", "sp", [-1, 16, 1, 2]], ["tile_k", "sp", [-1, 1, 8]]]}, "result": [[1.9091725], 0, 26.99690055847168, 1639417956.12457], "version": 0.2, "tvm_version": "0.8.0"}
{"input": ["cuda -keys=cuda,gpu -max_num_threads=1024 -thread_warp_size=32", "dense_large_batch.gpu", [["TENSOR", [1024, 1024], "float32"], ["TENSOR", [1024, 4096], "float32"]], {}], "config": {"index": 179321, "code_hash": null, "entity": [["tile_x", "sp", [-1, 1, 1, 1024]], ["tile_y", "sp", [-1, 4, 1, 4]], ["tile_k", "sp", [-1, 2, 1]]]}, "result": [[1.606326342], 0, 22.723212957382202, 1639418007.6533942], "version": 0.2, "tvm_version": "0.8.0"}
{"input": ["cuda -keys=cuda,gpu -max_num_threads=1024 -thread_warp_size=32", "dense_large_batch.gpu", [["TENSOR", [1024, 1024], "float32"], ["TENSOR", [1024, 4096], "float32"]], {}], "config": {"index": 213639, "code_hash": null, "entity": [["tile_x", "sp", [-1, 2, 1, 512]], ["tile_y", "sp", [-1, 2, 1, 16]], ["tile_k", "sp", [-1, 2, 1]]]}, "result": [[1.8351748024999999], 0, 26.113034963607788, 1639418033.1968892], "version": 0.2, "tvm_version": "0.8.0"}
{"input": ["cuda -keys=cuda,gpu -max_num_threads=1024 -thread_warp_size=32", "dense_large_batch.gpu", [["TENSOR", [1024, 1024], "float32"], ["TENSOR", [1024, 4096], "float32"]], {}], "config": {"index": 226217, "code_hash": null, "entity": [["tile_x", "sp", [-1, 2, 1, 256]], ["tile_y", "sp", [-1, 1, 1, 32]], ["tile_k", "sp", [-1, 2, 1]]]}, "result": [[1.40550455775], 0, 20.105218648910522, 1639418052.8708117], "version": 0.2, "tvm_version": "0.8.0"}
{"input": ["cuda -keys=cuda,gpu -max_num_threads=1024 -thread_warp_size=32", "dense_large_batch.gpu", [["TENSOR", [1024, 1024], "float32"], ["TENSOR", [1024, 4096], "float32"]], {}], "config": {"index": 343768, "code_hash": null, "entity": [["tile_x", "sp", [-1, 1, 1, 512]], ["tile_y", "sp", [-1, 2, 1, 16]], ["tile_k", "sp", [-1, 4, 1]]]}, "result": [[0.9234937452499999], 0, 13.909691572189331, 1639418066.216125], "version": 0.2, "tvm_version": "0.8.0"}
{"input": ["cuda -keys=cuda,gpu -max_num_threads=1024 -thread_warp_size=32", "dense_large_batch.gpu", [["TENSOR", [1024, 1024], "float32"], ["TENSOR", [1024, 4096], "float32"]], {}], "config": {"index": 1629332, "code_hash": null, "entity": [["tile_x", "sp", [-1, 1, 1, 256]], ["tile_y", "sp", [-1, 2, 1, 8]], ["tile_k", "sp", [-1, 2, 2]]]}, "result": [[1.4236655055], 0, 20.618160247802734, 1639418086.4165394], "version": 0.2, "tvm_version": "0.8.0"}
{"input": ["cuda -keys=cuda,gpu -max_num_threads=1024 -thread_warp_size=32", "dense_large_batch.gpu", [["TENSOR", [1024, 1024], "float32"], ["TENSOR", [1024, 4096], "float32"]], {}], "config": {"index": 1644766, "code_hash": null, "entity": [["tile_x", "sp", [-1, 1, 1, 128]], ["tile_y", "sp", [-1, 1, 1, 16]], ["tile_k", "sp", [-1, 2, 2]]]}, "result": [[1.3861510184999999], 0, 20.086517095565796, 1639418106.047197], "version": 0.2, "tvm_version": "0.8.0"}
{"input": ["cuda -keys=cuda,gpu -max_num_threads=1024 -thread_warp_size=32", "dense_large_batch.gpu", [["TENSOR", [1024, 1024], "float32"], ["TENSOR", [1024, 4096], "float32"]], {}], "config": {"index": 1657647, "code_hash": null, "entity": [["tile_x", "sp", [-1, 2, 1, 256]], ["tile_y", "sp", [-1, 1, 1, 32]], ["tile_k", "sp", [-1, 2, 2]]]}, "result": [[1.23144137575], 0, 18.0911705493927, 1639418123.6522756], "version": 0.2, "tvm_version": "0.8.0"}
{"input": ["cuda -keys=cuda,gpu -max_num_threads=1024 -thread_warp_size=32", "dense_large_batch.gpu", [["TENSOR", [1024, 1024], "float32"], ["TENSOR", [1024, 4096], "float32"]], {}], "config": {"index": 1740301, "code_hash": null, "entity": [["tile_x", "sp", [-1, 2, 1, 256]], ["tile_y", "sp", [-1, 1, 1, 4]], ["tile_k", "sp", [-1, 4, 2]]]}, "result": [[1.87847741825], 0, 26.92151975631714, 1639418150.2634509], "version": 0.2, "tvm_version": "0.8.0"}
{"input": ["cuda -keys=cuda,gpu -max_num_threads=1024 -thread_warp_size=32", "dense_large_batch.gpu", [["TENSOR", [1024, 1024], "float32"], ["TENSOR", [1024, 4096], "float32"]], {}], "config": {"index": 1644783, "code_hash": null, "entity": [["tile_x", "sp", [-1, 2, 1, 512]], ["tile_y", "sp", [-1, 1, 1, 16]], ["tile_k", "sp", [-1, 2, 2]]]}, "result": [[1.40840009925], 0, 19.97691583633423, 1639418169.7772706], "version": 0.2, "tvm_version": "0.8.0"}
{"input": ["cuda -keys=cuda,gpu -max_num_threads=1024 -thread_warp_size=32", "dense_large_batch.gpu", [["TENSOR", [1024, 1024], "float32"], ["TENSOR", [1024, 4096], "float32"]], {}], "config": {"index": 1629333, "code_hash": null, "entity": [["tile_x", "sp", [-1, 2, 1, 256]], ["tile_y", "sp", [-1, 2, 1, 8]], ["tile_k", "sp", [-1, 2, 2]]]}, "result": [[1.47937856525], 0, 20.822580814361572, 1639418190.0653546], "version": 0.2, "tvm_version": "0.8.0"}
{"input": ["cuda -keys=cuda,gpu -max_num_threads=1024 -thread_warp_size=32", "dense_large_batch.gpu", [["TENSOR", [1024, 1024], "float32"], ["TENSOR", [1024, 4096], "float32"]], {}], "config": {"index": 2911757, "code_hash": null, "entity": [["tile_x", "sp", [-1, 2, 1, 256]], ["tile_y", "sp", [-1, 2, 1, 4]], ["tile_k", "sp", [-1, 2, 4]]]}, "result": [[1.5523567145], 0, 22.57238507270813, 1639418212.4051166], "version": 0.2, "tvm_version": "0.8.0"}
{"input": ["cuda -keys=cuda,gpu -max_num_threads=1024 -thread_warp_size=32", "dense_large_batch.gpu", [["TENSOR", [1024, 1024], "float32"], ["TENSOR", [1024, 4096], "float32"]], {}], "config": {"index": 1645068, "code_hash": null, "entity": [["tile_x", "sp", [-1, 1, 1, 512]], ["tile_y", "sp", [-1, 2, 1, 16]], ["tile_k", "sp", [-1, 2, 2]]]}, "result": [[1.18056287975], 0, 17.11172604560852, 1639418230.9369004], "version": 0.2, "tvm_version": "0.8.0"}
{"input": ["cuda -keys=cuda,gpu -max_num_threads=1024 -thread_warp_size=32", "dense_large_batch.gpu", [["TENSOR", [1024, 1024], "float32"], ["TENSOR", [1024, 4096], "float32"]], {}], "config": {"index": 1644776, "code_hash": null, "entity": [["tile_x", "sp", [-1, 1, 1, 256]], ["tile_y", "sp", [-1, 1, 1, 16]], ["tile_k", "sp", [-1, 2, 2]]]}, "result": [[1.58455190075], 0, 22.715794563293457, 1639418301.345677], "version": 0.2, "tvm_version": "0.8.0"}
{"input": ["cuda -keys=cuda,gpu -max_num_threads=1024 -thread_warp_size=32", "dense_large_batch.gpu", [["TENSOR", [1024, 1024], "float32"], ["TENSOR", [1024, 4096], "float32"]], {}], "config": {"index": 1657646, "code_hash": null, "entity": [["tile_x", "sp", [-1, 1, 1, 256]], ["tile_y", "sp", [-1, 1, 1, 32]], ["tile_k", "sp", [-1, 2, 2]]]}, "result": [[1.1167427104999998], 0, 16.483624935150146, 1639418317.381868], "version": 0.2, "tvm_version": "0.8.0"}
{"input": ["cuda -keys=cuda,gpu -max_num_threads=1024 -thread_warp_size=32", "dense_large_batch.gpu", [["TENSOR", [1024, 1024], "float32"], ["TENSOR", [1024, 4096], "float32"]], {}], "config": {"index": 343482, "code_hash": null, "entity": [["tile_x", "sp", [-1, 1, 1, 512]], ["tile_y", "sp", [-1, 1, 1, 16]], ["tile_k", "sp", [-1, 4, 1]]]}, "result": [[1.4781513237500001], 0, 21.099671840667725, 1639418338.0646794], "version": 0.2, "tvm_version": "0.8.0"}
{"input": ["cuda -keys=cuda,gpu -max_num_threads=1024 -thread_warp_size=32", "dense_large_batch.gpu", [["TENSOR", [1024, 1024], "float32"], ["TENSOR", [1024, 4096], "float32"]], {}], "config": {"index": 1644782, "code_hash": null, "entity": [["tile_x", "sp", [-1, 1, 1, 512]], ["tile_y", "sp", [-1, 1, 1, 16]], ["tile_k", "sp", [-1, 2, 2]]]}, "result": [[1.39186731425], 0, 20.141513347625732, 1639418357.7293], "version": 0.2, "tvm_version": "0.8.0"}
{"input": ["cuda -keys=cuda,gpu -max_num_threads=1024 -thread_warp_size=32", "dense_large_batch.gpu", [["TENSOR", [1024, 1024], "float32"], ["TENSOR", [1024, 4096], "float32"]], {}], "config": {"index": 213352, "code_hash": null, "entity": [["tile_x", "sp", [-1, 1, 1, 512]], ["tile_y", "sp", [-1, 1, 1, 16]], ["tile_k", "sp", [-1, 2, 1]]]}, "result": [[0.944816072], 0, 14.200246095657349, 1639418371.4832678], "version": 0.2, "tvm_version": "0.8.0"}
{"input": ["cuda -keys=cuda,gpu -max_num_threads=1024 -thread_warp_size=32", "dense_large_batch.gpu", [["TENSOR", [1024, 1024], "float32"], ["TENSOR", [1024, 4096], "float32"]], {}], "config": {"index": 1514652, "code_hash": null, "entity": [["tile_x", "sp", [-1, 1, 1, 512]], ["tile_y", "sp", [-1, 1, 1, 16]], ["tile_k", "sp", [-1, 1, 2]]]}, "result": [[1.24048426175], 0, 18.056788444519043, 1639418389.1283922], "version": 0.2, "tvm_version": "0.8.0"}
{"input": ["cuda -keys=cuda,gpu -max_num_threads=1024 -thread_warp_size=32", "dense_large_batch.gpu", [["TENSOR", [1024, 1024], "float32"], ["TENSOR", [1024, 4096], "float32"]], {}], "config": {"index": 343476, "code_hash": null, "entity": [["tile_x", "sp", [-1, 1, 1, 256]], ["tile_y", "sp", [-1, 1, 1, 16]], ["tile_k", "sp", [-1, 4, 1]]]}, "result": [[1.6008695085], 0, 22.90860152244568, 1639418411.513382], "version": 0.2, "tvm_version": "0.8.0"}
{"input": ["cuda -keys=cuda,gpu -max_num_threads=1024 -thread_warp_size=32", "dense_large_batch.gpu", [["TENSOR", [1024, 1024], "float32"], ["TENSOR", [1024, 4096], "float32"]], {}], "config": {"index": 327752, "code_hash": null, "entity": [["tile_x", "sp", [-1, 1, 1, 512]], ["tile_y", "sp", [-1, 1, 1, 8]], ["tile_k", "sp", [-1, 4, 1]]]}, "result": [[1.2638609705], 0, 18.26861071586609, 1639418429.302852], "version": 0.2, "tvm_version": "0.8.0"}
{"input": ["cuda -keys=cuda,gpu -max_num_threads=1024 -thread_warp_size=32", "dense_large_batch.gpu", [["TENSOR", [1024, 1024], "float32"], ["TENSOR", [1024, 4096], "float32"]], {}], "config": {"index": 1644777, "code_hash": null, "entity": [["tile_x", "sp", [-1, 2, 1, 256]], ["tile_y", "sp", [-1, 1, 1, 16]], ["tile_k", "sp", [-1, 2, 2]]]}, "result": [[1.43619996825], 0, 20.719308853149414, 1639418449.6009617], "version": 0.2, "tvm_version": "0.8.0"}
{"input": ["cuda -keys=cuda,gpu -max_num_threads=1024 -thread_warp_size=32", "dense_large_batch.gpu", [["TENSOR", [1024, 1024], "float32"], ["TENSOR", [1024, 4096], "float32"]], {}], "config": {"index": 1657652, "code_hash": null, "entity": [["tile_x", "sp", [-1, 1, 1, 512]], ["tile_y", "sp", [-1, 1, 1, 32]], ["tile_k", "sp", [-1, 2, 2]]]}, "result": [[1.1296629792500001], 0, 16.426494359970093, 1639418465.6074653], "version": 0.2, "tvm_version": "0.8.0"}
{"input": ["cuda -keys=cuda,gpu -max_num_threads=1024 -thread_warp_size=32", "dense_large_batch.gpu", [["TENSOR", [1024, 1024], "float32"], ["TENSOR", [1024, 4096], "float32"]], {}], "config": {"index": 83222, "code_hash": null, "entity": [["tile_x", "sp", [-1, 1, 1, 512]], ["tile_y", "sp", [-1, 1, 1, 16]], ["tile_k", "sp", [-1, 1, 1]]]}, "result": [[0.946410183], 0, 14.350736379623413, 1639418479.5870981], "version": 0.2, "tvm_version": "0.8.0"}
{"input": ["cuda -keys=cuda,gpu -max_num_threads=1024 -thread_warp_size=32", "dense_large_batch.gpu", [["TENSOR", [1024, 1024], "float32"], ["TENSOR", [1024, 4096], "float32"]], {}], "config": {"index": 356352, "code_hash": null, "entity": [["tile_x", "sp", [-1, 1, 1, 512]], ["tile_y", "sp", [-1, 1, 1, 32]], ["tile_k", "sp", [-1, 4, 1]]]}, "result": [[0.8901619087499999], 0, 13.496527433395386, 1639418492.5535405], "version": 0.2, "tvm_version": "0.8.0"}
{"input": ["cuda -keys=cuda,gpu -max_num_threads=1024 -thread_warp_size=32", "dense_large_batch.gpu", [["TENSOR", [1024, 1024], "float32"], ["TENSOR", [1024, 4096], "float32"]], {}], "config": {"index": 1527522, "code_hash": null, "entity": [["tile_x", "sp", [-1, 1, 1, 512]], ["tile_y", "sp", [-1, 1, 1, 32]], ["tile_k", "sp", [-1, 1, 2]]]}, "result": [[1.1357493467500002], 0, 16.776565074920654, 1639418508.951871], "version": 0.2, "tvm_version": "0.8.0"}
{"input": ["cuda -keys=cuda,gpu -max_num_threads=1024 -thread_warp_size=32", "dense_large_batch.gpu", [["TENSOR", [1024, 1024], "float32"], ["TENSOR", [1024, 4096], "float32"]], {}], "config": {"index": 1629052, "code_hash": null, "entity": [["tile_x", "sp", [-1, 1, 1, 512]], ["tile_y", "sp", [-1, 1, 1, 8]], ["tile_k", "sp", [-1, 2, 2]]]}, "result": [[1.3277476615000001], 0, 19.30209994316101, 1639418527.826674], "version": 0.2, "tvm_version": "0.8.0"}
{"input": ["cuda -keys=cuda,gpu -max_num_threads=1024 -thread_warp_size=32", "dense_large_batch.gpu", [["TENSOR", [1024, 1024], "float32"], ["TENSOR", [1024, 4096], "float32"]], {}], "config": {"index": 96092, "code_hash": null, "entity": [["tile_x", "sp", [-1, 1, 1, 512]], ["tile_y", "sp", [-1, 1, 1, 32]], ["tile_k", "sp", [-1, 1, 1]]]}, "result": [[1.265313848], 0, 18.039156913757324, 1639418545.551917], "version": 0.2, "tvm_version": "0.8.0"}
{"input": ["cuda -keys=cuda,gpu -max_num_threads=1024 -thread_warp_size=32", "dense_large_batch.gpu", [["TENSOR", [1024, 1024], "float32"], ["TENSOR", [1024, 4096], "float32"]], {}], "config": {"index": 356336, "code_hash": null, "entity": [["tile_x", "sp", [-1, 1, 1, 128]], ["tile_y", "sp", [-1, 1, 1, 32]], ["tile_k", "sp", [-1, 4, 1]]]}, "result": [[1.2315060692500002], 0, 17.893013954162598, 1639418562.9662263], "version": 0.2, "tvm_version": "0.8.0"}
{"input": ["cuda -keys=cuda,gpu -max_num_threads=1024 -thread_warp_size=32", "dense_large_batch.gpu", [["TENSOR", [1024, 1024], "float32"], ["TENSOR", [1024, 4096], "float32"]], {}], "config": {"index": 213346, "code_hash": null, "entity": [["tile_x", "sp", [-1, 1, 1, 256]], ["tile_y", "sp", [-1, 1, 1, 16]], ["tile_k", "sp", [-1, 2, 1]]]}, "result": [[1.4668532155], 0, 21.162683963775635, 1639418583.722993], "version": 0.2, "tvm_version": "0.8.0"}
{"input": ["cuda -keys=cuda,gpu -max_num_threads=1024 -thread_warp_size=32", "dense_large_batch.gpu", [["TENSOR", [1024, 1024], "float32"], ["TENSOR", [1024, 4096], "float32"]], {}], "config": {"index": 83508, "code_hash": null, "entity": [["tile_x", "sp", [-1, 1, 1, 512]], ["tile_y", "sp", [-1, 2, 1, 16]], ["tile_k", "sp", [-1, 1, 1]]]}, "result": [[1.37585133875], 0, 19.64089059829712, 1639418603.0426443], "version": 0.2, "tvm_version": "0.8.0"}
{"input": ["cuda -keys=cuda,gpu -max_num_threads=1024 -thread_warp_size=32", "dense_large_batch.gpu", [["TENSOR", [1024, 1024], "float32"], ["TENSOR", [1024, 4096], "float32"]], {}], "config": {"index": 328038, "code_hash": null, "entity": [["tile_x", "sp", [-1, 1, 1, 512]], ["tile_y", "sp", [-1, 2, 1, 8]], ["tile_k", "sp", [-1, 4, 1]]]}, "result": [[1.60406682875], 0, 22.79113531112671, 1639418625.2973282], "version": 0.2, "tvm_version": "0.8.0"}
{"input": ["cuda -keys=cuda,gpu -max_num_threads=1024 -thread_warp_size=32", "dense_large_batch.gpu", [["TENSOR", [1024, 1024], "float32"], ["TENSOR", [1024, 4096], "float32"]], {}], "config": {"index": 1675950, "code_hash": null, "entity": [["tile_x", "sp", [-1, 1, 1, 256]], ["tile_y", "sp", [-1, 1, 1, 128]], ["tile_k", "sp", [-1, 2, 2]]]}, "result": [[2.06065612075], 0, 28.9500150680542, 1639418653.7638752], "version": 0.2, "tvm_version": "0.8.0"}
{"input": ["cuda -keys=cuda,gpu -max_num_threads=1024 -thread_warp_size=32", "dense_large_batch.gpu", [["TENSOR", [1024, 1024], "float32"], ["TENSOR", [1024, 4096], "float32"]], {}], "config": {"index": 226222, "code_hash": null, "entity": [["tile_x", "sp", [-1, 1, 1, 512]], ["tile_y", "sp", [-1, 1, 1, 32]], ["tile_k", "sp", [-1, 2, 1]]]}, "result": [[0.86143154075], 0, 12.821236371994019, 1639418668.3292613], "version": 0.2, "tvm_version": "0.8.0"}
{"input": ["cuda -keys=cuda,gpu -max_num_threads=1024 -thread_warp_size=32", "dense_large_batch.gpu", [["TENSOR", [1024, 1024], "float32"], ["TENSOR", [1024, 4096], "float32"]], {}], "config": {"index": 197622, "code_hash": null, "entity": [["tile_x", "sp", [-1, 1, 1, 512]], ["tile_y", "sp", [-1, 1, 1, 8]], ["tile_k", "sp", [-1, 2, 1]]]}, "result": [[1.6966914485], 0, 24.09266185760498, 1639418692.1664834], "version": 0.2, "tvm_version": "0.8.0"}
{"input": ["cuda -keys=cuda,gpu -max_num_threads=1024 -thread_warp_size=32", "dense_large_batch.gpu", [["TENSOR", [1024, 1024], "float32"], ["TENSOR", [1024, 4096], "float32"]], {}], "config": {"index": 1498922, "code_hash": null, "entity": [["tile_x", "sp", [-1, 1, 1, 512]], ["tile_y", "sp", [-1, 1, 1, 8]], ["tile_k", "sp", [-1, 1, 2]]]}, "result": [[1.70193926225], 0, 23.767568826675415, 1639418715.6121635], "version": 0.2, "tvm_version": "0.8.0"}
{"input": ["cuda -keys=cuda,gpu -max_num_threads=1024 -thread_warp_size=32", "dense_large_batch.gpu", [["TENSOR", [1024, 1024], "float32"], ["TENSOR", [1024, 4096], "float32"]], {}], "config": {"index": 2815952, "code_hash": null, "entity": [["tile_x", "sp", [-1, 1, 1, 512]], ["tile_y", "sp", [-1, 1, 1, 16]], ["tile_k", "sp", [-1, 1, 4]]]}, "result": [[1.354558527], 0, 19.689801454544067, 1639418734.9083076], "version": 0.2, "tvm_version": "0.8.0"}
{"input": ["cuda -keys=cuda,gpu -max_num_threads=1024 -thread_warp_size=32", "dense_large_batch.gpu", [["TENSOR", [1024, 1024], "float32"], ["TENSOR", [1024, 4096], "float32"]], {}], "config": {"index": 2816238, "code_hash": null, "entity": [["tile_x", "sp", [-1, 1, 1, 512]], ["tile_y", "sp", [-1, 2, 1, 16]], ["tile_k", "sp", [-1, 1, 4]]]}, "result": [[1.254956548], 0, 18.38760733604431, 1639418752.8555386], "version": 0.2, "tvm_version": "0.8.0"}
{"input": ["cuda -keys=cuda,gpu -max_num_threads=1024 -thread_warp_size=32", "dense_large_batch.gpu", [["TENSOR", [1024, 1024], "float32"], ["TENSOR", [1024, 4096], "float32"]], {}], "config": {"index": 1629046, "code_hash": null, "entity": [["tile_x", "sp", [-1, 1, 1, 256]], ["tile_y", "sp", [-1, 1, 1, 8]], ["tile_k", "sp", [-1, 2, 2]]]}, "result": [[1.3507038665], 0, 19.57122492790222, 1639418771.985856], "version": 0.2, "tvm_version": "0.8.0"}
{"input": ["cuda -keys=cuda,gpu -max_num_threads=1024 -thread_warp_size=32", "dense_large_batch.gpu", [["TENSOR", [1024, 1024], "float32"], ["TENSOR", [1024, 4096], "float32"]], {}], "config": {"index": 2800222, "code_hash": null, "entity": [["tile_x", "sp", [-1, 1, 1, 512]], ["tile_y", "sp", [-1, 1, 1, 8]], ["tile_k", "sp", [-1, 1, 4]]]}, "result": [[1.31366300125], 0, 18.790483474731445, 1639418792.898701], "version": 0.2, "tvm_version": "0.8.0"}
{"input": ["cuda -keys=cuda,gpu -max_num_threads=1024 -thread_warp_size=32", "dense_large_batch.gpu", [["TENSOR", [1024, 1024], "float32"], ["TENSOR", [1024, 4096], "float32"]], {}], "config": {"index": 1629338, "code_hash": null, "entity": [["tile_x", "sp", [-1, 1, 1, 512]], ["tile_y", "sp", [-1, 2, 1, 8]], ["tile_k", "sp", [-1, 2, 2]]]}, "result": [[1.4137408835], 0, 20.201608896255493, 1639418812.6962595], "version": 0.2, "tvm_version": "0.8.0"}
{"input": ["cuda -keys=cuda,gpu -max_num_threads=1024 -thread_warp_size=32", "dense_large_batch.gpu", [["TENSOR", [1024, 1024], "float32"], ["TENSOR", [1024, 4096], "float32"]], {}], "config": {"index": 67492, "code_hash": null, "entity": [["tile_x", "sp", [-1, 1, 1, 512]], ["tile_y", "sp", [-1, 1, 1, 8]], ["tile_k", "sp", [-1, 1, 1]]]}, "result": [[1.49065939075], 0, 21.47663187980652, 1639418833.8494344], "version": 0.2, "tvm_version": "0.8.0"}
{"input": ["cuda -keys=cuda,gpu -max_num_threads=1024 -thread_warp_size=32", "dense_large_batch.gpu", [["TENSOR", [1024, 1024], "float32"], ["TENSOR", [1024, 4096], "float32"]], {}], "config": {"index": 2828806, "code_hash": null, "entity": [["tile_x", "sp", [-1, 1, 1, 128]], ["tile_y", "sp", [-1, 1, 1, 32]], ["tile_k", "sp", [-1, 1, 4]]]}, "result": [[1.23042266775], 0, 17.97520875930786, 1639418851.3473177], "version": 0.2, "tvm_version": "0.8.0"}
{"input": ["cuda -keys=cuda,gpu -max_num_threads=1024 -thread_warp_size=32", "dense_large_batch.gpu", [["TENSOR", [1024, 1024], "float32"], ["TENSOR", [1024, 4096], "float32"]], {}], "config": {"index": 1667948, "code_hash": null, "entity": [["tile_x", "sp", [-1, 1, 1, 512]], ["tile_y", "sp", [-1, 1, 1, 64]], ["tile_k", "sp", [-1, 2, 2]]]}, "result": [[0.91604431125], 0, 13.967318058013916, 1639418867.9276443], "version": 0.2, "tvm_version": "0.8.0"}
{"input": ["cuda -keys=cuda,gpu -max_num_threads=1024 -thread_warp_size=32", "dense_large_batch.gpu", [["TENSOR", [1024, 1024], "float32"], ["TENSOR", [1024, 4096], "float32"]], {}], "config": {"index": 1514938, "code_hash": null, "entity": [["tile_x", "sp", [-1, 1, 1, 512]], ["tile_y", "sp", [-1, 2, 1, 16]], ["tile_k", "sp", [-1, 1, 2]]]}, "result": [[1.18828420425], 0, 17.212809801101685, 1639418886.3801138], "version": 0.2, "tvm_version": "0.8.0"}
{"input": ["cuda -keys=cuda,gpu -max_num_threads=1024 -thread_warp_size=32", "dense_large_batch.gpu", [["TENSOR", [1024, 1024], "float32"], ["TENSOR", [1024, 4096], "float32"]], {}], "config": {"index": 2839118, "code_hash": null, "entity": [["tile_x", "sp", [-1, 1, 1, 512]], ["tile_y", "sp", [-1, 1, 1, 64]], ["tile_k", "sp", [-1, 1, 4]]]}, "result": [[1.25718293525], 0, 18.587522506713867, 1639418906.1183913], "version": 0.2, "tvm_version": "0.8.0"}
{"input": ["cuda -keys=cuda,gpu -max_num_threads=1024 -thread_warp_size=32", "dense_large_batch.gpu", [["TENSOR", [1024, 1024], "float32"], ["TENSOR", [1024, 4096], "float32"]], {}], "config": {"index": 2829108, "code_hash": null, "entity": [["tile_x", "sp", [-1, 1, 1, 512]], ["tile_y", "sp", [-1, 2, 1, 32]], ["tile_k", "sp", [-1, 1, 4]]]}, "result": [[1.2881132439999998], 0, 18.767773628234863, 1639418925.9667783], "version": 0.2, "tvm_version": "0.8.0"}
{"input": ["cuda -keys=cuda,gpu -max_num_threads=1024 -thread_warp_size=32", "dense_large_batch.gpu", [["TENSOR", [1024, 1024], "float32"], ["TENSOR", [1024, 4096], "float32"]], {}], "config": {"index": 356346, "code_hash": null, "entity": [["tile_x", "sp", [-1, 1, 1, 256]], ["tile_y", "sp", [-1, 1, 1, 32]], ["tile_k", "sp", [-1, 4, 1]]]}, "result": [[1.2383513465], 0, 18.17420482635498, 1639418947.5002797], "version": 0.2, "tvm_version": "0.8.0"}
{"input": ["cuda -keys=cuda,gpu -max_num_threads=1024 -thread_warp_size=32", "dense_large_batch.gpu", [["TENSOR", [1024, 1024], "float32"], ["TENSOR", [1024, 4096], "float32"]], {}], "config": {"index": 1527516, "code_hash": null, "entity": [["tile_x", "sp", [-1, 1, 1, 256]], ["tile_y", "sp", [-1, 1, 1, 32]], ["tile_k", "sp", [-1, 1, 2]]]}, "result": [[1.1284710299999998], 0, 16.61475968360901, 1639418963.7534761], "version": 0.2, "tvm_version": "0.8.0"}
{"input": ["cuda -keys=cuda,gpu -max_num_threads=1024 -thread_warp_size=32", "dense_large_batch.gpu", [["TENSOR", [1024, 1024], "float32"], ["TENSOR", [1024, 4096], "float32"]], {}], "config": {"index": 1499208, "code_hash": null, "entity": [["tile_x", "sp", [-1, 1, 1, 512]], ["tile_y", "sp", [-1, 2, 1, 8]], ["tile_k", "sp", [-1, 1, 2]]]}, "result": [[1.3349275687500002], 0, 19.529398202896118, 1639418983.0034566], "version": 0.2, "tvm_version": "0.8.0"}
{"input": ["cuda -keys=cuda,gpu -max_num_threads=1024 -thread_warp_size=32", "dense_large_batch.gpu", [["TENSOR", [1024, 1024], "float32"], ["TENSOR", [1024, 4096], "float32"]], {}], "config": {"index": 2828816, "code_hash": null, "entity": [["tile_x", "sp", [-1, 1, 1, 256]], ["tile_y", "sp", [-1, 1, 1, 32]], ["tile_k", "sp", [-1, 1, 4]]]}, "result": [[1.2395390179999999], 0, 18.261728286743164, 1639419000.834945], "version": 0.2, "tvm_version": "0.8.0"}
{"input": ["cuda -keys=cuda,gpu -max_num_threads=1024 -thread_warp_size=32", "dense_large_batch.gpu", [["TENSOR", [1024, 1024], "float32"], ["TENSOR", [1024, 4096], "float32"]], {}], "config": {"index": 226216, "code_hash": null, "entity": [["tile_x", "sp", [-1, 1, 1, 256]], ["tile_y", "sp", [-1, 1, 1, 32]], ["tile_k", "sp", [-1, 2, 1]]]}, "result": [[1.1889942275], 0, 17.12209439277649, 1639419017.5891886], "version": 0.2, "tvm_version": "0.8.0"}
{"input": ["cuda -keys=cuda,gpu -max_num_threads=1024 -thread_warp_size=32", "dense_large_batch.gpu", [["TENSOR", [1024, 1024], "float32"], ["TENSOR", [1024, 4096], "float32"]], {}], "config": {"index": 1514646, "code_hash": null, "entity": [["tile_x", "sp", [-1, 1, 1, 256]], ["tile_y", "sp", [-1, 1, 1, 16]], ["tile_k", "sp", [-1, 1, 2]]]}, "result": [[1.2420849805], 0, 17.95130491256714, 1639419035.207907], "version": 0.2, "tvm_version": "0.8.0"}
{"input": ["cuda -keys=cuda,gpu -max_num_threads=1024 -thread_warp_size=32", "dense_large_batch.gpu", [["TENSOR", [1024, 1024], "float32"], ["TENSOR", [1024, 4096], "float32"]], {}], "config": {"index": 1629047, "code_hash": null, "entity": [["tile_x", "sp", [-1, 2, 1, 256]], ["tile_y", "sp", [-1, 1, 1, 8]], ["tile_k", "sp", [-1, 2, 2]]]}, "result": [[1.3344959242499999], 0, 19.193156957626343, 1639419053.960185], "version": 0.2, "tvm_version": "0.8.0"}
{"input": ["cuda -keys=cuda,gpu -max_num_threads=1024 -thread_warp_size=32", "dense_large_batch.gpu", [["TENSOR", [1024, 1024], "float32"], ["TENSOR", [1024, 4096], "float32"]], {}], "config": {"index": 1527517, "code_hash": null, "entity": [["tile_x", "sp", [-1, 2, 1, 256]], ["tile_y", "sp", [-1, 1, 1, 32]], ["tile_k", "sp", [-1, 1, 2]]]}, "result": [[1.233162432], 0, 18.12435793876648, 1639419071.6459436], "version": 0.2, "tvm_version": "0.8.0"}
{"input": ["cuda -keys=cuda,gpu -max_num_threads=1024 -thread_warp_size=32", "dense_large_batch.gpu", [["TENSOR", [1024, 1024], "float32"], ["TENSOR", [1024, 4096], "float32"]], {}], "config": {"index": 343762, "code_hash": null, "entity": [["tile_x", "sp", [-1, 1, 1, 256]], ["tile_y", "sp", [-1, 2, 1, 16]], ["tile_k", "sp", [-1, 4, 1]]]}, "result": [[1.350301723], 0, 19.955655097961426, 1639419091.0704443], "version": 0.2, "tvm_version": "0.8.0"}
{"input": ["cuda -keys=cuda,gpu -max_num_threads=1024 -thread_warp_size=32", "dense_large_batch.gpu", [["TENSOR", [1024, 1024], "float32"], ["TENSOR", [1024, 4096], "float32"]], {}], "config": {"index": 197908, "code_hash": null, "entity": [["tile_x", "sp", [-1, 1, 1, 512]], ["tile_y", "sp", [-1, 2, 1, 8]], ["tile_k", "sp", [-1, 2, 1]]]}, "result": [[1.0957099375000001], 0, 16.131691217422485, 1639419106.7950187], "version": 0.2, "tvm_version": "0.8.0"}
{"input": ["cuda -keys=cuda,gpu -max_num_threads=1024 -thread_warp_size=32", "dense_large_batch.gpu", [["TENSOR", [1024, 1024], "float32"], ["TENSOR", [1024, 4096], "float32"]], {}], "config": {"index": 226508, "code_hash": null, "entity": [["tile_x", "sp", [-1, 1, 1, 512]], ["tile_y", "sp", [-1, 2, 1, 32]], ["tile_k", "sp", [-1, 2, 1]]]}, "result": [[1.28401262175], 0, 18.754608392715454, 1639419175.0739806], "version": 0.2, "tvm_version": "0.8.0"}
{"input": ["cuda -keys=cuda,gpu -max_num_threads=1024 -thread_warp_size=32", "dense_large_batch.gpu", [["TENSOR", [1024, 1024], "float32"], ["TENSOR", [1024, 4096], "float32"]], {}], "config": {"index": 236518, "code_hash": null, "entity": [["tile_x", "sp", [-1, 1, 1, 512]], ["tile_y", "sp", [-1, 1, 1, 64]], ["tile_k", "sp", [-1, 2, 1]]]}, "result": [[1.2567308000000001], 0, 18.749066591262817, 1639419193.3154852], "version": 0.2, "tvm_version": "0.8.0"}
{"input": ["cuda -keys=cuda,gpu -max_num_threads=1024 -thread_warp_size=32", "dense_large_batch.gpu", [["TENSOR", [1024, 1024], "float32"], ["TENSOR", [1024, 4096], "float32"]], {}], "config": {"index": 226225, "code_hash": null, "entity": [["tile_x", "sp", [-1, 1, 1, 1024]], ["tile_y", "sp", [-1, 1, 1, 32]], ["tile_k", "sp", [-1, 2, 1]]]}, "result": [[2.060017293], 0, 28.575613975524902, 1639419221.4953542], "version": 0.2, "tvm_version": "0.8.0"}
{"input": ["cuda -keys=cuda,gpu -max_num_threads=1024 -thread_warp_size=32", "dense_large_batch.gpu", [["TENSOR", [1024, 1024], "float32"], ["TENSOR", [1024, 4096], "float32"]], {}], "config": {"index": 2958936, "code_hash": null, "entity": [["tile_x", "sp", [-1, 1, 1, 128]], ["tile_y", "sp", [-1, 1, 1, 32]], ["tile_k", "sp", [-1, 2, 4]]]}, "result": [[1.1866538965], 0, 17.74978804588318, 1639419238.5338283], "version": 0.2, "tvm_version": "0.8.0"}
{"input": ["cuda -keys=cuda,gpu -max_num_threads=1024 -thread_warp_size=32", "dense_large_batch.gpu", [["TENSOR", [1024, 1024], "float32"], ["TENSOR", [1024, 4096], "float32"]], {}], "config": {"index": 213638, "code_hash": null, "entity": [["tile_x", "sp", [-1, 1, 1, 512]], ["tile_y", "sp", [-1, 2, 1, 16]], ["tile_k", "sp", [-1, 2, 1]]]}, "result": [[0.8785736614999999], 0, 13.218897342681885, 1639419251.357062], "version": 0.2, "tvm_version": "0.8.0"}
{"input": ["cuda -keys=cuda,gpu -max_num_threads=1024 -thread_warp_size=32", "dense_large_batch.gpu", [["TENSOR", [1024, 1024], "float32"], ["TENSOR", [1024, 4096], "float32"]], {}], "config": {"index": 1537813, "code_hash": null, "entity": [["tile_x", "sp", [-1, 2, 1, 256]], ["tile_y", "sp", [-1, 1, 1, 64]], ["tile_k", "sp", [-1, 1, 2]]]}, "result": [[1.27699043025], 0, 19.029492139816284, 1639419269.6808193], "version": 0.2, "tvm_version": "0.8.0"}
{"input": ["cuda -keys=cuda,gpu -max_num_threads=1024 -thread_warp_size=32", "dense_large_batch.gpu", [["TENSOR", [1024, 1024], "float32"], ["TENSOR", [1024, 4096], "float32"]], {}], "config": {"index": 1537818, "code_hash": null, "entity": [["tile_x", "sp", [-1, 1, 1, 512]], ["tile_y", "sp", [-1, 1, 1, 64]], ["tile_k", "sp", [-1, 1, 2]]]}, "result": [[0.9171919420000001], 0, 13.869704723358154, 1639419283.048491], "version": 0.2, "tvm_version": "0.8.0"}
{"input": ["cuda -keys=cuda,gpu -max_num_threads=1024 -thread_warp_size=32", "dense_large_batch.gpu", [["TENSOR", [1024, 1024], "float32"], ["TENSOR", [1024, 4096], "float32"]], {}], "config": {"index": 106388, "code_hash": null, "entity": [["tile_x", "sp", [-1, 1, 1, 512]], ["tile_y", "sp", [-1, 1, 1, 64]], ["tile_k", "sp", [-1, 1, 1]]]}, "result": [[1.60816375225], 0, 22.864856481552124, 1639419305.6275978], "version": 0.2, "tvm_version": "0.8.0"}
{"input": ["cuda -keys=cuda,gpu -max_num_threads=1024 -thread_warp_size=32", "dense_large_batch.gpu", [["TENSOR", [1024, 1024], "float32"], ["TENSOR", [1024, 4096], "float32"]], {}], "config": {"index": 226061, "code_hash": null, "entity": [["tile_x", "sp", [-1, 1, 1, 4]], ["tile_y", "sp", [-1, 1, 1, 32]], ["tile_k", "sp", [-1, 2, 1]]]}, "result": [[0.03647195775], 0, 2.7902722358703613, 1639419308.0574589], "version": 0.2, "tvm_version": "0.8.0"}
{"input": ["cuda -keys=cuda,gpu -max_num_threads=1024 -thread_warp_size=32", "dense_large_batch.gpu", [["TENSOR", [1024, 1024], "float32"], ["TENSOR", [1024, 4096], "float32"]], {}], "config": {"index": 226006, "code_hash": null, "entity": [["tile_x", "sp", [-1, 1, 1, 2]], ["tile_y", "sp", [-1, 1, 1, 32]], ["tile_k", "sp", [-1, 2, 1]]]}, "result": [[0.055675858249999995], 0, 2.4050545692443848, 1639419310.093879], "version": 0.2, "tvm_version": "0.8.0"}
{"input": ["cuda -keys=cuda,gpu -max_num_threads=1024 -thread_warp_size=32", "dense_large_batch.gpu", [["TENSOR", [1024, 1024], "float32"], ["TENSOR", [1024, 4096], "float32"]], {}], "config": {"index": 226106, "code_hash": null, "entity": [["tile_x", "sp", [-1, 1, 1, 8]], ["tile_y", "sp", [-1, 1, 1, 32]], ["tile_k", "sp", [-1, 2, 1]]]}, "result": [[0.1254353395], 0, 4.080276012420654, 1639419313.3154569], "version": 0.2, "tvm_version": "0.8.0"}
{"input": ["cuda -keys=cuda,gpu -max_num_threads=1024 -thread_warp_size=32", "dense_large_batch.gpu", [["TENSOR", [1024, 1024], "float32"], ["TENSOR", [1024, 4096], "float32"]], {}], "config": {"index": 226170, "code_hash": null, "entity": [["tile_x", "sp", [-1, 1, 1, 32]], ["tile_y", "sp", [-1, 1, 1, 32]], ["tile_k", "sp", [-1, 2, 1]]]}, "result": [[0.977878238], 0, 14.25425386428833, 1639419327.2058284], "version": 0.2, "tvm_version": "0.8.0"}
{"input": ["cuda -keys=cuda,gpu -max_num_threads=1024 -thread_warp_size=32", "dense_large_batch.gpu", [["TENSOR", [1024, 1024], "float32"], ["TENSOR", [1024, 4096], "float32"]], {}], "config": {"index": 226142, "code_hash": null, "entity": [["tile_x", "sp", [-1, 1, 1, 16]], ["tile_y", "sp", [-1, 1, 1, 32]], ["tile_k", "sp", [-1, 2, 1]]]}, "result": [[0.965101275], 0, 14.730739831924438, 1639419341.4099274], "version": 0.2, "tvm_version": "0.8.0"}
{"input": ["cuda -keys=cuda,gpu -max_num_threads=1024 -thread_warp_size=32", "dense_large_batch.gpu", [["TENSOR", [1024, 1024], "float32"], ["TENSOR", [1024, 4096], "float32"]], {}], "config": {"index": 1537812, "code_hash": null, "entity": [["tile_x", "sp", [-1, 1, 1, 256]], ["tile_y", "sp", [-1, 1, 1, 64]], ["tile_k", "sp", [-1, 1, 2]]]}, "result": [[1.12156100325], 0, 16.35976791381836, 1639419357.2686133], "version": 0.2, "tvm_version": "0.8.0"}
{"input": ["cuda -keys=cuda,gpu -max_num_threads=1024 -thread_warp_size=32", "dense_large_batch.gpu", [["TENSOR", [1024, 1024], "float32"], ["TENSOR", [1024, 4096], "float32"]], {}], "config": {"index": 225940, "code_hash": null, "entity": [["tile_x", "sp", [-1, 1, 1, 1]], ["tile_y", "sp", [-1, 1, 1, 32]], ["tile_k", "sp", [-1, 2, 1]]]}, "result": [[0.104058662], 0, 3.3094120025634766, 1639419360.284354], "version": 0.2, "tvm_version": "0.8.0"}
{"input": ["cuda -keys=cuda,gpu -max_num_threads=1024 -thread_warp_size=32", "dense_large_batch.gpu", [["TENSOR", [1024, 1024], "float32"], ["TENSOR", [1024, 4096], "float32"]], {}], "config": {"index": 96378, "code_hash": null, "entity": [["tile_x", "sp", [-1, 1, 1, 512]], ["tile_y", "sp", [-1, 2, 1, 32]], ["tile_k", "sp", [-1, 1, 1]]]}, "result": [[1.290946175], 0, 18.221065998077393, 1639419378.1290417], "version": 0.2, "tvm_version": "0.8.0"}
{"input": ["cuda -keys=cuda,gpu -max_num_threads=1024 -thread_warp_size=32", "dense_large_batch.gpu", [["TENSOR", [1024, 1024], "float32"], ["TENSOR", [1024, 4096], "float32"]], {}], "config": {"index": 1527808, "code_hash": null, "entity": [["tile_x", "sp", [-1, 1, 1, 512]], ["tile_y", "sp", [-1, 2, 1, 32]], ["tile_k", "sp", [-1, 1, 2]]]}, "result": [[0.9361661755], 0, 14.308772325515747, 1639419391.9770076], "version": 0.2, "tvm_version": "0.8.0"}
{"input": ["cuda -keys=cuda,gpu -max_num_threads=1024 -thread_warp_size=32", "dense_large_batch.gpu", [["TENSOR", [1024, 1024], "float32"], ["TENSOR", [1024, 4096], "float32"]], {}], "config": {"index": 236512, "code_hash": null, "entity": [["tile_x", "sp", [-1, 1, 1, 256]], ["tile_y", "sp", [-1, 1, 1, 64]], ["tile_k", "sp", [-1, 2, 1]]]}, "result": [[0.828558138], 0, 12.813550472259521, 1639419404.2762005], "version": 0.2, "tvm_version": "0.8.0"}
{"input": ["cuda -keys=cuda,gpu -max_num_threads=1024 -thread_warp_size=32", "dense_large_batch.gpu", [["TENSOR", [1024, 1024], "float32"], ["TENSOR", [1024, 4096], "float32"]], {}], "config": {"index": 2815936, "code_hash": null, "entity": [["tile_x", "sp", [-1, 1, 1, 128]], ["tile_y", "sp", [-1, 1, 1, 16]], ["tile_k", "sp", [-1, 1, 4]]]}, "result": [[1.26442505425], 0, 19.24592685699463, 1639419423.1101387], "version": 0.2, "tvm_version": "0.8.0"}
{"input": ["cuda -keys=cuda,gpu -max_num_threads=1024 -thread_warp_size=32", "dense_large_batch.gpu", [["TENSOR", [1024, 1024], "float32"], ["TENSOR", [1024, 4096], "float32"]], {}], "config": {"index": 226206, "code_hash": null, "entity": [["tile_x", "sp", [-1, 1, 1, 128]], ["tile_y", "sp", [-1, 1, 1, 32]], ["tile_k", "sp", [-1, 2, 1]]]}, "result": [[1.25226892975], 0, 18.134952068328857, 1639419440.8522124], "version": 0.2, "tvm_version": "0.8.0"}
{"input": ["cuda -keys=cuda,gpu -max_num_threads=1024 -thread_warp_size=32", "dense_large_batch.gpu", [["TENSOR", [1024, 1024], "float32"], ["TENSOR", [1024, 4096], "float32"]], {}], "config": {"index": 2839102, "code_hash": null, "entity": [["tile_x", "sp", [-1, 1, 1, 128]], ["tile_y", "sp", [-1, 1, 1, 64]], ["tile_k", "sp", [-1, 1, 4]]]}, "result": [[1.14325874425], 0, 16.835036039352417, 1639419456.9930468], "version": 0.2, "tvm_version": "0.8.0"}
{"input": ["cuda -keys=cuda,gpu -max_num_threads=1024 -thread_warp_size=32", "dense_large_batch.gpu", [["TENSOR", [1024, 1024], "float32"], ["TENSOR", [1024, 4096], "float32"]], {}], "config": {"index": 1667942, "code_hash": null, "entity": [["tile_x", "sp", [-1, 1, 1, 256]], ["tile_y", "sp", [-1, 1, 1, 64]], ["tile_k", "sp", [-1, 2, 2]]]}, "result": [[1.13142569525], 0, 16.927772283554077, 1639419473.2165108], "version": 0.2, "tvm_version": "0.8.0"}
{"input": ["cuda -keys=cuda,gpu -max_num_threads=1024 -thread_warp_size=32", "dense_large_batch.gpu", [["TENSOR", [1024, 1024], "float32"], ["TENSOR", [1024, 4096], "float32"]], {}], "config": {"index": 236502, "code_hash": null, "entity": [["tile_x", "sp", [-1, 1, 1, 128]], ["tile_y", "sp", [-1, 1, 1, 64]], ["tile_k", "sp", [-1, 2, 1]]]}, "result": [[1.14570177775], 0, 16.62110710144043, 1639419489.3167093], "version": 0.2, "tvm_version": "0.8.0"}
{"input": ["cuda -keys=cuda,gpu -max_num_threads=1024 -thread_warp_size=32", "dense_large_batch.gpu", [["TENSOR", [1024, 1024], "float32"], ["TENSOR", [1024, 4096], "float32"]], {}], "config": {"index": 356355, "code_hash": null, "entity": [["tile_x", "sp", [-1, 1, 1, 1024]], ["tile_y", "sp", [-1, 1, 1, 32]], ["tile_k", "sp", [-1, 4, 1]]]}, "result": [[1.3070717785], 0, 18.985820055007935, 1639419507.8439946], "version": 0.2, "tvm_version": "0.8.0"}
{"input": ["cuda -keys=cuda,gpu -max_num_threads=1024 -thread_warp_size=32", "dense_large_batch.gpu", [["TENSOR", [1024, 1024], "float32"], ["TENSOR", [1024, 4096], "float32"]], {}], "config": {"index": 226223, "code_hash": null, "entity": [["tile_x", "sp", [-1, 2, 1, 512]], ["tile_y", "sp", [-1, 1, 1, 32]], ["tile_k", "sp", [-1, 2, 1]]]}, "result": [[2.17614844075], 0, 30.152929306030273, 1639419537.5079432], "version": 0.2, "tvm_version": "0.8.0"}
{"input": ["cuda -keys=cuda,gpu -max_num_threads=1024 -thread_warp_size=32", "dense_large_batch.gpu", [["TENSOR", [1024, 1024], "float32"], ["TENSOR", [1024, 4096], "float32"]], {}], "config": {"index": 356638, "code_hash": null, "entity": [["tile_x", "sp", [-1, 1, 1, 512]], ["tile_y", "sp", [-1, 2, 1, 32]], ["tile_k", "sp", [-1, 4, 1]]]}, "result": [[1.2872129175], 0, 19.30432438850403, 1639419556.073507], "version": 0.2, "tvm_version": "0.8.0"}
{"input": ["cuda -keys=cuda,gpu -max_num_threads=1024 -thread_warp_size=32", "dense_large_batch.gpu", [["TENSOR", [1024, 1024], "float32"], ["TENSOR", [1024, 4096], "float32"]], {}], "config": {"index": 96095, "code_hash": null, "entity": [["tile_x", "sp", [-1, 1, 1, 1024]], ["tile_y", "sp", [-1, 1, 1, 32]], ["tile_k", "sp", [-1, 1, 1]]]}, "result": [[1.690244211], 0, 23.557992219924927, 1639419579.2718608], "version": 0.2, "tvm_version": "0.8.0"}
{"input": ["cuda -keys=cuda,gpu -max_num_threads=1024 -thread_warp_size=32", "dense_large_batch.gpu", [["TENSOR", [1024, 1024], "float32"], ["TENSOR", [1024, 4096], "float32"]], {}], "config": {"index": 2828822, "code_hash": null, "entity": [["tile_x", "sp", [-1, 1, 1, 512]], ["tile_y", "sp", [-1, 1, 1, 32]], ["tile_k", "sp", [-1, 1, 4]]]}, "result": [[1.1855503745], 0, 17.393955945968628, 1639419596.2353365], "version": 0.2, "tvm_version": "0.8.0"}
{"input": ["cuda -keys=cuda,gpu -max_num_threads=1024 -thread_warp_size=32", "dense_large_batch.gpu", [["TENSOR", [1024, 1024], "float32"], ["TENSOR", [1024, 4096], "float32"]], {}], "config": {"index": 236513, "code_hash": null, "entity": [["tile_x", "sp", [-1, 2, 1, 256]], ["tile_y", "sp", [-1, 1, 1, 64]], ["tile_k", "sp", [-1, 2, 1]]]}, "result": [[1.236733088], 0, 18.695984601974487, 1639419616.150798], "version": 0.2, "tvm_version": "0.8.0"}
{"input": ["cuda -keys=cuda,gpu -max_num_threads=1024 -thread_warp_size=32", "dense_large_batch.gpu", [["TENSOR", [1024, 1024], "float32"], ["TENSOR", [1024, 4096], "float32"]], {}], "config": {"index": 2828817, "code_hash": null, "entity": [["tile_x", "sp", [-1, 2, 1, 256]], ["tile_y", "sp", [-1, 1, 1, 32]], ["tile_k", "sp", [-1, 1, 4]]]}, "result": [[1.2228208835], 0, 18.010252714157104, 1639419633.4629035], "version": 0.2, "tvm_version": "0.8.0"}
{"input": ["cuda -keys=cuda,gpu -max_num_threads=1024 -thread_warp_size=32", "dense_large_batch.gpu", [["TENSOR", [1024, 1024], "float32"], ["TENSOR", [1024, 4096], "float32"]], {}], "config": {"index": 213924, "code_hash": null, "entity": [["tile_x", "sp", [-1, 1, 1, 512]], ["tile_y", "sp", [-1, 4, 1, 16]], ["tile_k", "sp", [-1, 2, 1]]]}, "result": [[1.3735604595], 0, 20.018991470336914, 1639419652.7809107], "version": 0.2, "tvm_version": "0.8.0"}
{"input": ["cuda -keys=cuda,gpu -max_num_threads=1024 -thread_warp_size=32", "dense_large_batch.gpu", [["TENSOR", [1024, 1024], "float32"], ["TENSOR", [1024, 4096], "float32"]], {}], "config": {"index": 226191, "code_hash": null, "entity": [["tile_x", "sp", [-1, 1, 1, 64]], ["tile_y", "sp", [-1, 1, 1, 32]], ["tile_k", "sp", [-1, 2, 1]]]}, "result": [[1.1065337792499998], 0, 16.863231897354126, 1639419668.8282757], "version": 0.2, "tvm_version": "0.8.0"}
{"input": ["cuda -keys=cuda,gpu -max_num_threads=1024 -thread_warp_size=32", "dense_large_batch.gpu", [["TENSOR", [1024, 1024], "float32"], ["TENSOR", [1024, 4096], "float32"]], {}], "config": {"index": 1527525, "code_hash": null, "entity": [["tile_x", "sp", [-1, 1, 1, 1024]], ["tile_y", "sp", [-1, 1, 1, 32]], ["tile_k", "sp", [-1, 1, 2]]]}, "result": [[1.114842755], 0, 16.499733209609985, 1639419684.648964], "version": 0.2, "tvm_version": "0.8.0"}
{"input": ["cuda -keys=cuda,gpu -max_num_threads=1024 -thread_warp_size=32", "dense_large_batch.gpu", [["TENSOR", [1024, 1024], "float32"], ["TENSOR", [1024, 4096], "float32"]], {}], "config": {"index": 1657572, "code_hash": null, "entity": [["tile_x", "sp", [-1, 1, 1, 16]], ["tile_y", "sp", [-1, 1, 1, 32]], ["tile_k", "sp", [-1, 2, 2]]]}, "result": [[1.03504853525], 0, 15.786511659622192, 1639419700.9989476], "version": 0.2, "tvm_version": "0.8.0"}
{"input": ["cuda -keys=cuda,gpu -max_num_threads=1024 -thread_warp_size=32", "dense_large_batch.gpu", [["TENSOR", [1024, 1024], "float32"], ["TENSOR", [1024, 4096], "float32"]], {}], "config": {"index": 1657491, "code_hash": null, "entity": [["tile_x", "sp", [-1, 1, 1, 4]], ["tile_y", "sp", [-1, 1, 1, 32]], ["tile_k", "sp", [-1, 2, 2]]]}, "result": [[0.035335476], 0, 2.694133758544922, 1639419702.7821994], "version": 0.2, "tvm_version": "0.8.0"}
{"input": ["cuda -keys=cuda,gpu -max_num_threads=1024 -thread_warp_size=32", "dense_large_batch.gpu", [["TENSOR", [1024, 1024], "float32"], ["TENSOR", [1024, 4096], "float32"]], {}], "config": {"index": 1657621, "code_hash": null, "entity": [["tile_x", "sp", [-1, 1, 1, 64]], ["tile_y", "sp", [-1, 1, 1, 32]], ["tile_k", "sp", [-1, 2, 2]]]}, "result": [[1.0961836182500002], 0, 16.269127130508423, 1639419718.2736607], "version": 0.2, "tvm_version": "0.8.0"}
{"input": ["cuda -keys=cuda,gpu -max_num_threads=1024 -thread_warp_size=32", "dense_large_batch.gpu", [["TENSOR", [1024, 1024], "float32"], ["TENSOR", [1024, 4096], "float32"]], {}], "config": {"index": 1657536, "code_hash": null, "entity": [["tile_x", "sp", [-1, 1, 1, 8]], ["tile_y", "sp", [-1, 1, 1, 32]], ["tile_k", "sp", [-1, 2, 2]]]}, "result": [[0.46061295274999997], 0, 9.347703695297241, 1639419726.0240827], "version": 0.2, "tvm_version": "0.8.0"}
{"input": ["cuda -keys=cuda,gpu -max_num_threads=1024 -thread_warp_size=32", "dense_large_batch.gpu", [["TENSOR", [1024, 1024], "float32"], ["TENSOR", [1024, 4096], "float32"]], {}], "config": {"index": 1657600, "code_hash": null, "entity": [["tile_x", "sp", [-1, 1, 1, 32]], ["tile_y", "sp", [-1, 1, 1, 32]], ["tile_k", "sp", [-1, 2, 2]]]}, "result": [[1.05154221175], 0, 15.905063390731812, 1639419740.970656], "version": 0.2, "tvm_version": "0.8.0"}
{"input": ["cuda -keys=cuda,gpu -max_num_threads=1024 -thread_warp_size=32", "dense_large_batch.gpu", [["TENSOR", [1024, 1024], "float32"], ["TENSOR", [1024, 4096], "float32"]], {}], "config": {"index": 1657436, "code_hash": null, "entity": [["tile_x", "sp", [-1, 1, 1, 2]], ["tile_y", "sp", [-1, 1, 1, 32]], ["tile_k", "sp", [-1, 2, 2]]]}, "result": [[0.054969204], 0, 2.2928988933563232, 1639419742.6782176], "version": 0.2, "tvm_version": "0.8.0"}
{"input": ["cuda -keys=cuda,gpu -max_num_threads=1024 -thread_warp_size=32", "dense_large_batch.gpu", [["TENSOR", [1024, 1024], "float32"], ["TENSOR", [1024, 4096], "float32"]], {}], "config": {"index": 1667787, "code_hash": null, "entity": [["tile_x", "sp", [-1, 1, 1, 4]], ["tile_y", "sp", [-1, 1, 1, 64]], ["tile_k", "sp", [-1, 2, 2]]]}, "result": [[0.3752715295], 0, 7.809128999710083, 1639419748.9606037], "version": 0.2, "tvm_version": "0.8.0"}
{"input": ["cuda -keys=cuda,gpu -max_num_threads=1024 -thread_warp_size=32", "dense_large_batch.gpu", [["TENSOR", [1024, 1024], "float32"], ["TENSOR", [1024, 4096], "float32"]], {}], "config": {"index": 1667732, "code_hash": null, "entity": [["tile_x", "sp", [-1, 1, 1, 2]], ["tile_y", "sp", [-1, 1, 1, 64]], ["tile_k", "sp", [-1, 2, 2]]]}, "result": [[0.06424460225], 0, 3.2184791564941406, 1639419751.1503649], "version": 0.2, "tvm_version": "0.8.0"}
{"input": ["cuda -keys=cuda,gpu -max_num_threads=1024 -thread_warp_size=32", "dense_large_batch.gpu", [["TENSOR", [1024, 1024], "float32"], ["TENSOR", [1024, 4096], "float32"]], {}], "config": {"index": 3999961, "code_hash": null, "entity": [["tile_x", "sp", [-1, 1, 1, 64]], ["tile_y", "sp", [-1, 1, 1, 32]], ["tile_k", "sp", [-1, 1, 8]]]}, "result": [[1.22806526775], 0, 18.23026466369629, 1639419768.4669094], "version": 0.2, "tvm_version": "0.8.0"}
{"input": ["cuda -keys=cuda,gpu -max_num_threads=1024 -thread_warp_size=32", "dense_large_batch.gpu", [["TENSOR", [1024, 1024], "float32"], ["TENSOR", [1024, 4096], "float32"]], {}], "config": {"index": 1537787, "code_hash": null, "entity": [["tile_x", "sp", [-1, 1, 1, 64]], ["tile_y", "sp", [-1, 1, 1, 64]], ["tile_k", "sp", [-1, 1, 2]]]}, "result": [[1.1442150965], 0, 17.12691307067871, 1639419784.930476], "version": 0.2, "tvm_version": "0.8.0"}
{"input": ["cuda -keys=cuda,gpu -max_num_threads=1024 -thread_warp_size=32", "dense_large_batch.gpu", [["TENSOR", [1024, 1024], "float32"], ["TENSOR", [1024, 4096], "float32"]], {}], "config": {"index": 1667896, "code_hash": null, "entity": [["tile_x", "sp", [-1, 1, 1, 32]], ["tile_y", "sp", [-1, 1, 1, 64]], ["tile_k", "sp", [-1, 2, 2]]]}, "result": [[1.1722090275000001], 0, 17.581762313842773, 1639419801.4909267], "version": 0.2, "tvm_version": "0.8.0"}
{"input": ["cuda -keys=cuda,gpu -max_num_threads=1024 -thread_warp_size=32", "dense_large_batch.gpu", [["TENSOR", [1024, 1024], "float32"], ["TENSOR", [1024, 4096], "float32"]], {}], "config": {"index": 1667868, "code_hash": null, "entity": [["tile_x", "sp", [-1, 1, 1, 16]], ["tile_y", "sp", [-1, 1, 1, 64]], ["tile_k", "sp", [-1, 2, 2]]]}, "result": [[0.99373475875], 0, 15.389799118041992, 1639419815.834992], "version": 0.2, "tvm_version": "0.8.0"}
{"input": ["cuda -keys=cuda,gpu -max_num_threads=1024 -thread_warp_size=32", "dense_large_batch.gpu", [["TENSOR", [1024, 1024], "float32"], ["TENSOR", [1024, 4096], "float32"]], {}], "config": {"index": 1667832, "code_hash": null, "entity": [["tile_x", "sp", [-1, 1, 1, 8]], ["tile_y", "sp", [-1, 1, 1, 64]], ["tile_k", "sp", [-1, 2, 2]]]}, "result": [[1.0007935945], 0, 15.705930471420288, 1639419830.5104885], "version": 0.2, "tvm_version": "0.8.0"}
{"input": ["cuda -keys=cuda,gpu -max_num_threads=1024 -thread_warp_size=32", "dense_large_batch.gpu", [["TENSOR", [1024, 1024], "float32"], ["TENSOR", [1024, 4096], "float32"]], {}], "config": {"index": 1667917, "code_hash": null, "entity": [["tile_x", "sp", [-1, 1, 1, 64]], ["tile_y", "sp", [-1, 1, 1, 64]], ["tile_k", "sp", [-1, 2, 2]]]}, "result": [[1.082110163], 0, 16.614002227783203, 1639419846.1835918], "version": 0.2, "tvm_version": "0.8.0"}
{"input": ["cuda -keys=cuda,gpu -max_num_threads=1024 -thread_warp_size=32", "dense_large_batch.gpu", [["TENSOR", [1024, 1024], "float32"], ["TENSOR", [1024, 4096], "float32"]], {}], "config": {"index": 1527240, "code_hash": null, "entity": [["tile_x", "sp", [-1, 1, 1, 1]], ["tile_y", "sp", [-1, 1, 1, 32]], ["tile_k", "sp", [-1, 1, 2]]]}, "result": [[0.10406937225], 0, 3.1118500232696533, 1639419848.588618], "version": 0.2, "tvm_version": "0.8.0"}
{"input": ["cuda -keys=cuda,gpu -max_num_threads=1024 -thread_warp_size=32", "dense_large_batch.gpu", [["TENSOR", [1024, 1024], "float32"], ["TENSOR", [1024, 4096], "float32"]], {}], "config": {"index": 3999976, "code_hash": null, "entity": [["tile_x", "sp", [-1, 1, 1, 128]], ["tile_y", "sp", [-1, 1, 1, 32]], ["tile_k", "sp", [-1, 1, 8]]]}, "result": [[1.2924930335], 0, 19.192293882369995, 1639419866.9412067], "version": 0.2, "tvm_version": "0.8.0"}
{"input": ["cuda -keys=cuda,gpu -max_num_threads=1024 -thread_warp_size=32", "dense_large_batch.gpu", [["TENSOR", [1024, 1024], "float32"], ["TENSOR", [1024, 4096], "float32"]], {}], "config": {"index": 356353, "code_hash": null, "entity": [["tile_x", "sp", [-1, 2, 1, 512]], ["tile_y", "sp", [-1, 1, 1, 32]], ["tile_k", "sp", [-1, 4, 1]]]}, "result": [[2.3707573807499998], 0, 32.86174130439758, 1639419898.8247883], "version": 0.2, "tvm_version": "0.8.0"}
{"input": ["cuda -keys=cuda,gpu -max_num_threads=1024 -thread_warp_size=32", "dense_large_batch.gpu", [["TENSOR", [1024, 1024], "float32"], ["TENSOR", [1024, 4096], "float32"]], {}], "config": {"index": 1527306, "code_hash": null, "entity": [["tile_x", "sp", [-1, 1, 1, 2]], ["tile_y", "sp", [-1, 1, 1, 32]], ["tile_k", "sp", [-1, 1, 2]]]}, "result": [[0.0556645215], 0, 2.5344948768615723, 1639419900.6339908], "version": 0.2, "tvm_version": "0.8.0"}
{"input": ["cuda -keys=cuda,gpu -max_num_threads=1024 -thread_warp_size=32", "dense_large_batch.gpu", [["TENSOR", [1024, 1024], "float32"], ["TENSOR", [1024, 4096], "float32"]], {}], "config": {"index": 1527442, "code_hash": null, "entity": [["tile_x", "sp", [-1, 1, 1, 16]], ["tile_y", "sp", [-1, 1, 1, 32]], ["tile_k", "sp", [-1, 1, 2]]]}, "result": [[1.01716027425], 0, 15.58305311203003, 1639419915.3402412], "version": 0.2, "tvm_version": "0.8.0"}
{"input": ["cuda -keys=cuda,gpu -max_num_threads=1024 -thread_warp_size=32", "dense_large_batch.gpu", [["TENSOR", [1024, 1024], "float32"], ["TENSOR", [1024, 4096], "float32"]], {}], "config": {"index": 1527491, "code_hash": null, "entity": [["tile_x", "sp", [-1, 1, 1, 64]], ["tile_y", "sp", [-1, 1, 1, 32]], ["tile_k", "sp", [-1, 1, 2]]]}, "result": [[1.090200885], 0, 16.441987991333008, 1639419931.0050626], "version": 0.2, "tvm_version": "0.8.0"}
{"input": ["cuda -keys=cuda,gpu -max_num_threads=1024 -thread_warp_size=32", "dense_large_batch.gpu", [["TENSOR", [1024, 1024], "float32"], ["TENSOR", [1024, 4096], "float32"]], {}], "config": {"index": 1527361, "code_hash": null, "entity": [["tile_x", "sp", [-1, 1, 1, 4]], ["tile_y", "sp", [-1, 1, 1, 32]], ["tile_k", "sp", [-1, 1, 2]]]}, "result": [[0.036444199249999996], 0, 2.4929754734039307, 1639419932.738878], "version": 0.2, "tvm_version": "0.8.0"}
{"input": ["cuda -keys=cuda,gpu -max_num_threads=1024 -thread_warp_size=32", "dense_large_batch.gpu", [["TENSOR", [1024, 1024], "float32"], ["TENSOR", [1024, 4096], "float32"]], {}], "config": {"index": 1527406, "code_hash": null, "entity": [["tile_x", "sp", [-1, 1, 1, 8]], ["tile_y", "sp", [-1, 1, 1, 32]], ["tile_k", "sp", [-1, 1, 2]]]}, "result": [[0.12530886624999998], 0, 4.16087794303894, 1639419935.7125747], "version": 0.2, "tvm_version": "0.8.0"}
{"input": ["cuda -keys=cuda,gpu -max_num_threads=1024 -thread_warp_size=32", "dense_large_batch.gpu", [["TENSOR", [1024, 1024], "float32"], ["TENSOR", [1024, 4096], "float32"]], {}], "config": {"index": 1527470, "code_hash": null, "entity": [["tile_x", "sp", [-1, 1, 1, 32]], ["tile_y", "sp", [-1, 1, 1, 32]], ["tile_k", "sp", [-1, 1, 2]]]}, "result": [[1.05120752175], 0, 15.831252574920654, 1639419952.9940984], "version": 0.2, "tvm_version": "0.8.0"}
{"input": ["cuda -keys=cuda,gpu -max_num_threads=1024 -thread_warp_size=32", "dense_large_batch.gpu", [["TENSOR", [1024, 1024], "float32"], ["TENSOR", [1024, 4096], "float32"]], {}], "config": {"index": 1667932, "code_hash": null, "entity": [["tile_x", "sp", [-1, 1, 1, 128]], ["tile_y", "sp", [-1, 1, 1, 64]], ["tile_k", "sp", [-1, 2, 2]]]}, "result": [[1.2034661845], 0, 17.591779232025146, 1639419969.9217517], "version": 0.2, "tvm_version": "0.8.0"}
{"input": ["cuda -keys=cuda,gpu -max_num_threads=1024 -thread_warp_size=32", "dense_large_batch.gpu", [["TENSOR", [1024, 1024], "float32"], ["TENSOR", [1024, 4096], "float32"]], {}], "config": {"index": 1537536, "code_hash": null, "entity": [["tile_x", "sp", [-1, 1, 1, 1]], ["tile_y", "sp", [-1, 1, 1, 64]], ["tile_k", "sp", [-1, 1, 2]]]}, "result": [[0.096232439], 0, 3.015496253967285, 1639419972.5772333], "version": 0.2, "tvm_version": "0.8.0"}
{"input": ["cuda -keys=cuda,gpu -max_num_threads=1024 -thread_warp_size=32", "dense_large_batch.gpu", [["TENSOR", [1024, 1024], "float32"], ["TENSOR", [1024, 4096], "float32"]], {}], "config": {"index": 1527802, "code_hash": null, "entity": [["tile_x", "sp", [-1, 1, 1, 256]], ["tile_y", "sp", [-1, 2, 1, 32]], ["tile_k", "sp", [-1, 1, 2]]]}, "result": [[1.2414776332500002], 0, 18.097981214523315, 1639419990.189462], "version": 0.2, "tvm_version": "0.8.0"}
{"input": ["cuda -keys=cuda,gpu -max_num_threads=1024 -thread_warp_size=32", "dense_large_batch.gpu", [["TENSOR", [1024, 1024], "float32"], ["TENSOR", [1024, 4096], "float32"]], {}], "config": {"index": 1537657, "code_hash": null, "entity": [["tile_x", "sp", [-1, 1, 1, 4]], ["tile_y", "sp", [-1, 1, 1, 64]], ["tile_k", "sp", [-1, 1, 2]]]}, "result": [[0.07226688025], 0, 3.1783738136291504, 1639420030.2491186], "version": 0.2, "tvm_version": "0.8.0"}
{"input": ["cuda -keys=cuda,gpu -max_num_threads=1024 -thread_warp_size=32", "dense_large_batch.gpu", [["TENSOR", [1024, 1024], "float32"], ["TENSOR", [1024, 4096], "float32"]], {}], "config": {"index": 1537602, "code_hash": null, "entity": [["tile_x", "sp", [-1, 1, 1, 2]], ["tile_y", "sp", [-1, 1, 1, 64]], ["tile_k", "sp", [-1, 1, 2]]]}, "result": [[0.06887034075], 0, 2.560847043991089, 1639420032.3389363], "version": 0.2, "tvm_version": "0.8.0"}
{"input": ["cuda -keys=cuda,gpu -max_num_threads=1024 -thread_warp_size=32", "dense_large_batch.gpu", [["TENSOR", [1024, 1024], "float32"], ["TENSOR", [1024, 4096], "float32"]], {}], "config": {"index": 1537702, "code_hash": null, "entity": [["tile_x", "sp", [-1, 1, 1, 8]], ["tile_y", "sp", [-1, 1, 1, 64]], ["tile_k", "sp", [-1, 1, 2]]]}, "result": [[1.17174767125], 0, 17.055248498916626, 1639420048.7741961], "version": 0.2, "tvm_version": "0.8.0"}
{"input": ["cuda -keys=cuda,gpu -max_num_threads=1024 -thread_warp_size=32", "dense_large_batch.gpu", [["TENSOR", [1024, 1024], "float32"], ["TENSOR", [1024, 4096], "float32"]], {}], "config": {"index": 1657370, "code_hash": null, "entity": [["tile_x", "sp", [-1, 1, 1, 1]], ["tile_y", "sp", [-1, 1, 1, 32]], ["tile_k", "sp", [-1, 2, 2]]]}, "result": [[0.10314290200000001], 0, 2.9679174423217773, 1639420051.3963664], "version": 0.2, "tvm_version": "0.8.0"}
{"input": ["cuda -keys=cuda,gpu -max_num_threads=1024 -thread_warp_size=32", "dense_large_batch.gpu", [["TENSOR", [1024, 1024], "float32"], ["TENSOR", [1024, 4096], "float32"]], {}], "config": {"index": 1657437, "code_hash": null, "entity": [["tile_x", "sp", [-1, 2, 1, 2]], ["tile_y", "sp", [-1, 1, 1, 32]], ["tile_k", "sp", [-1, 2, 2]]]}, "result": [[0.0354401675], 0, 1.9925780296325684, 1639420053.010747], "version": 0.2, "tvm_version": "0.8.0"}
{"input": ["cuda -keys=cuda,gpu -max_num_threads=1024 -thread_warp_size=32", "dense_large_batch.gpu", [["TENSOR", [1024, 1024], "float32"], ["TENSOR", [1024, 4096], "float32"]], {}], "config": {"index": 1537738, "code_hash": null, "entity": [["tile_x", "sp", [-1, 1, 1, 16]], ["tile_y", "sp", [-1, 1, 1, 64]], ["tile_k", "sp", [-1, 1, 2]]]}, "result": [[0.9941089325], 0, 14.611056327819824, 1639420067.1277156], "version": 0.2, "tvm_version": "0.8.0"}
{"input": ["cuda -keys=cuda,gpu -max_num_threads=1024 -thread_warp_size=32", "dense_large_batch.gpu", [["TENSOR", [1024, 1024], "float32"], ["TENSOR", [1024, 4096], "float32"]], {}], "config": {"index": 213422, "code_hash": null, "entity": [["tile_x", "sp", [-1, 1, 1, 2]], ["tile_y", "sp", [-1, 2, 1, 16]], ["tile_k", "sp", [-1, 2, 1]]]}, "result": [[0.055657255999999995], 0, 2.1240131855010986, 1639420068.9255373], "version": 0.2, "tvm_version": "0.8.0"}
{"input": ["cuda -keys=cuda,gpu -max_num_threads=1024 -thread_warp_size=32", "dense_large_batch.gpu", [["TENSOR", [1024, 1024], "float32"], ["TENSOR", [1024, 4096], "float32"]], {}], "config": {"index": 213477, "code_hash": null, "entity": [["tile_x", "sp", [-1, 1, 1, 4]], ["tile_y", "sp", [-1, 2, 1, 16]], ["tile_k", "sp", [-1, 2, 1]]]}, "result": [[0.03645159125], 0, 1.7851762771606445, 1639420070.3348389], "version": 0.2, "tvm_version": "0.8.0"}
{"input": ["cuda -keys=cuda,gpu -max_num_threads=1024 -thread_warp_size=32", "dense_large_batch.gpu", [["TENSOR", [1024, 1024], "float32"], ["TENSOR", [1024, 4096], "float32"]], {}], "config": {"index": 213356, "code_hash": null, "entity": [["tile_x", "sp", [-1, 1, 1, 1]], ["tile_y", "sp", [-1, 2, 1, 16]], ["tile_k", "sp", [-1, 2, 1]]]}, "result": [[0.10409413375], 0, 2.9448184967041016, 1639420072.9867148], "version": 0.2, "tvm_version": "0.8.0"}
{"input": ["cuda -keys=cuda,gpu -max_num_threads=1024 -thread_warp_size=32", "dense_large_batch.gpu", [["TENSOR", [1024, 1024], "float32"], ["TENSOR", [1024, 4096], "float32"]], {}], "config": {"index": 1527307, "code_hash": null, "entity": [["tile_x", "sp", [-1, 2, 1, 2]], ["tile_y", "sp", [-1, 1, 1, 32]], ["tile_k", "sp", [-1, 1, 2]]]}, "result": [[0.036615471999999996], 0, 2.0627715587615967, 1639420074.6606128], "version": 0.2, "tvm_version": "0.8.0"}
{"input": ["cuda -keys=cuda,gpu -max_num_threads=1024 -thread_warp_size=32", "dense_large_batch.gpu", [["TENSOR", [1024, 1024], "float32"], ["TENSOR", [1024, 4096], "float32"]], {}], "config": {"index": 236302, "code_hash": null, "entity": [["tile_x", "sp", [-1, 1, 1, 2]], ["tile_y", "sp", [-1, 1, 1, 64]], ["tile_k", "sp", [-1, 2, 1]]]}, "result": [[0.0689227635], 0, 2.6429548263549805, 1639420076.7513015], "version": 0.2, "tvm_version": "0.8.0"}
{"input": ["cuda -keys=cuda,gpu -max_num_threads=1024 -thread_warp_size=32", "dense_large_batch.gpu", [["TENSOR", [1024, 1024], "float32"], ["TENSOR", [1024, 4096], "float32"]], {}], "config": {"index": 236357, "code_hash": null, "entity": [["tile_x", "sp", [-1, 1, 1, 4]], ["tile_y", "sp", [-1, 1, 1, 64]], ["tile_k", "sp", [-1, 2, 1]]]}, "result": [[0.07215675899999999], 0, 3.5369274616241455, 1639420079.3295066], "version": 0.2, "tvm_version": "0.8.0"}
{"input": ["cuda -keys=cuda,gpu -max_num_threads=1024 -thread_warp_size=32", "dense_large_batch.gpu", [["TENSOR", [1024, 1024], "float32"], ["TENSOR", [1024, 4096], "float32"]], {}], "config": {"index": 1657492, "code_hash": null, "entity": [["tile_x", "sp", [-1, 2, 1, 4]], ["tile_y", "sp", [-1, 1, 1, 32]], ["tile_k", "sp", [-1, 2, 2]]]}, "result": [[0.43660387125], 0, 7.825028896331787, 1639420086.5216603], "version": 0.2, "tvm_version": "0.8.0"}
{"input": ["cuda -keys=cuda,gpu -max_num_threads=1024 -thread_warp_size=32", "dense_large_batch.gpu", [["TENSOR", [1024, 1024], "float32"], ["TENSOR", [1024, 4096], "float32"]], {}], "config": {"index": 1657537, "code_hash": null, "entity": [["tile_x", "sp", [-1, 2, 1, 8]], ["tile_y", "sp", [-1, 1, 1, 32]], ["tile_k", "sp", [-1, 2, 2]]]}, "result": [[0.9638918790000001], 0, 14.341793775558472, 1639420100.166445], "version": 0.2, "tvm_version": "0.8.0"}
{"input": ["cuda -keys=cuda,gpu -max_num_threads=1024 -thread_warp_size=32", "dense_large_batch.gpu", [["TENSOR", [1024, 1024], "float32"], ["TENSOR", [1024, 4096], "float32"]], {}], "config": {"index": 1527647, "code_hash": null, "entity": [["tile_x", "sp", [-1, 1, 1, 4]], ["tile_y", "sp", [-1, 2, 1, 32]], ["tile_k", "sp", [-1, 1, 2]]]}, "result": [[0.07457454649999999], 0, 3.180778980255127, 1639420102.8690379], "version": 0.2, "tvm_version": "0.8.0"}
{"input": ["cuda -keys=cuda,gpu -max_num_threads=1024 -thread_warp_size=32", "dense_large_batch.gpu", [["TENSOR", [1024, 1024], "float32"], ["TENSOR", [1024, 4096], "float32"]], {}], "config": {"index": 1527592, "code_hash": null, "entity": [["tile_x", "sp", [-1, 1, 1, 2]], ["tile_y", "sp", [-1, 2, 1, 32]], ["tile_k", "sp", [-1, 1, 2]]]}, "result": [[0.05248113025], 0, 2.1884119510650635, 1639420104.6932805], "version": 0.2, "tvm_version": "0.8.0"}
{"input": ["cuda -keys=cuda,gpu -max_num_threads=1024 -thread_warp_size=32", "dense_large_batch.gpu", [["TENSOR", [1024, 1024], "float32"], ["TENSOR", [1024, 4096], "float32"]], {}], "config": {"index": 356136, "code_hash": null, "entity": [["tile_x", "sp", [-1, 1, 1, 2]], ["tile_y", "sp", [-1, 1, 1, 32]], ["tile_k", "sp", [-1, 4, 1]]]}, "result": [[0.054739069], 0, 1.9402267932891846, 1639420106.238042], "version": 0.2, "tvm_version": "0.8.0"}
{"input": ["cuda -keys=cuda,gpu -max_num_threads=1024 -thread_warp_size=32", "dense_large_batch.gpu", [["TENSOR", [1024, 1024], "float32"], ["TENSOR", [1024, 4096], "float32"]], {}], "config": {"index": 356191, "code_hash": null, "entity": [["tile_x", "sp", [-1, 1, 1, 4]], ["tile_y", "sp", [-1, 1, 1, 32]], ["tile_k", "sp", [-1, 4, 1]]]}, "result": [[0.03550878325], 0, 2.0223567485809326, 1639420107.787894], "version": 0.2, "tvm_version": "0.8.0"}
{"input": ["cuda -keys=cuda,gpu -max_num_threads=1024 -thread_warp_size=32", "dense_large_batch.gpu", [["TENSOR", [1024, 1024], "float32"], ["TENSOR", [1024, 4096], "float32"]], {}], "config": {"index": 2828661, "code_hash": null, "entity": [["tile_x", "sp", [-1, 1, 1, 4]], ["tile_y", "sp", [-1, 1, 1, 32]], ["tile_k", "sp", [-1, 1, 4]]]}, "result": [[0.32190062799999997], 0, 5.67742919921875, 1639420112.9742048], "version": 0.2, "tvm_version": "0.8.0"}
{"input": ["cuda -keys=cuda,gpu -max_num_threads=1024 -thread_warp_size=32", "dense_large_batch.gpu", [["TENSOR", [1024, 1024], "float32"], ["TENSOR", [1024, 4096], "float32"]], {}], "config": {"index": 2828606, "code_hash": null, "entity": [["tile_x", "sp", [-1, 1, 1, 2]], ["tile_y", "sp", [-1, 1, 1, 32]], ["tile_k", "sp", [-1, 1, 4]]]}, "result": [[0.054944843], 0, 2.39164400100708, 1639420114.9780347], "version": 0.2, "tvm_version": "0.8.0"}
{"input": ["cuda -keys=cuda,gpu -max_num_threads=1024 -thread_warp_size=32", "dense_large_batch.gpu", [["TENSOR", [1024, 1024], "float32"], ["TENSOR", [1024, 4096], "float32"]], {}], "config": {"index": 1527362, "code_hash": null, "entity": [["tile_x", "sp", [-1, 2, 1, 4]], ["tile_y", "sp", [-1, 1, 1, 32]], ["tile_k", "sp", [-1, 1, 2]]]}, "result": [[0.14731548849999998], 0, 3.922163248062134, 1639420118.3653555], "version": 0.2, "tvm_version": "0.8.0"}
{"input": ["cuda -keys=cuda,gpu -max_num_threads=1024 -thread_warp_size=32", "dense_large_batch.gpu", [["TENSOR", [1024, 1024], "float32"], ["TENSOR", [1024, 4096], "float32"]], {}], "config": {"index": 226347, "code_hash": null, "entity": [["tile_x", "sp", [-1, 1, 1, 4]], ["tile_y", "sp", [-1, 2, 1, 32]], ["tile_k", "sp", [-1, 2, 1]]]}, "result": [[0.0706304135], 0, 2.762014389038086, 1639420120.5785055], "version": 0.2, "tvm_version": "0.8.0"}
{"input": ["cuda -keys=cuda,gpu -max_num_threads=1024 -thread_warp_size=32", "dense_large_batch.gpu", [["TENSOR", [1024, 1024], "float32"], ["TENSOR", [1024, 4096], "float32"]], {}], "config": {"index": 226292, "code_hash": null, "entity": [["tile_x", "sp", [-1, 1, 1, 2]], ["tile_y", "sp", [-1, 2, 1, 32]], ["tile_k", "sp", [-1, 2, 1]]]}, "result": [[0.0523734875], 0, 2.252063274383545, 1639420122.4171698], "version": 0.2, "tvm_version": "0.8.0"}
