artifacts/microbenchmark/tvm/scale_out/matmul_bert_scale/matmul_2048_1024_4096.log
{"input": ["cuda -keys=cuda,gpu -max_num_threads=1024 -thread_warp_size=32", "dense_large_batch.gpu", [["TENSOR", [2048, 1024], "float32"], ["TENSOR", [1024, 4096], "float32"]], {}], "config": {"index": 3706214, "code_hash": null, "entity": [["tile_x", "sp", [-1, 2, 1, 128]], ["tile_y", "sp", [-1, 4, 1, 4]], ["tile_k", "sp", [-1, 2, 4]]]}, "result": [[3.2928223425], 0, 45.274190187454224, 1639421981.4323015], "version": 0.2, "tvm_version": "0.8.0"}
{"input": ["cuda -keys=cuda,gpu -max_num_threads=1024 -thread_warp_size=32", "dense_large_batch.gpu", [["TENSOR", [2048, 1024], "float32"], ["TENSOR", [1024, 4096], "float32"]], {}], "config": {"index": 198889, "code_hash": null, "entity": [["tile_x", "sp", [-1, 2, 1, 4]], ["tile_y", "sp", [-1, 1, 1, 2]], ["tile_k", "sp", [-1, 2, 1]]]}, "result": [[0.1351626795], 0, 3.4730308055877686, 1639422008.25642], "version": 0.2, "tvm_version": "0.8.0"}
{"input": ["cuda -keys=cuda,gpu -max_num_threads=1024 -thread_warp_size=32", "dense_large_batch.gpu", [["TENSOR", [2048, 1024], "float32"], ["TENSOR", [1024, 4096], "float32"]], {}], "config": {"index": 394098, "code_hash": null, "entity": [["tile_x", "sp", [-1, 64, 1, 16]], ["tile_y", "sp", [-1, 8, 1, 4]], ["tile_k", "sp", [-1, 4, 1]]]}, "result": [[9.3683802705], 0, 124.85870695114136, 1639422131.6553886], "version": 0.2, "tvm_version": "0.8.0"}
{"input": ["cuda -keys=cuda,gpu -max_num_threads=1024 -thread_warp_size=32", "dense_large_batch.gpu", [["TENSOR", [2048, 1024], "float32"], ["TENSOR", [1024, 4096], "float32"]], {}], "config": {"index": 506584, "code_hash": null, "entity": [["tile_x", "sp", [-1, 2, 4, 16]], ["tile_y", "sp", [-1, 2, 4, 1]], ["tile_k", "sp", [-1, 8, 1]]]}, "result": [[0.016274601285714285], 0, 2.374941825866699, 1639422133.7472692], "version": 0.2, "tvm_version": "0.8.0"}
{"input": ["cuda -keys=cuda,gpu -max_num_threads=1024 -thread_warp_size=32", "dense_large_batch.gpu", [["TENSOR", [2048, 1024], "float32"], ["TENSOR", [1024, 4096], "float32"]], {}], "config": {"index": 506354, "code_hash": null, "entity": [["tile_x", "sp", [-1, 128, 4, 1]], ["tile_y", "sp", [-1, 2, 4, 1]], ["tile_k", "sp", [-1, 8, 1]]]}, "result": [[0.18733365475], 0, 4.6334569454193115, 1639422137.8316946], "version": 0.2, "tvm_version": "0.8.0"}
{"input": ["cuda -keys=cuda,gpu -max_num_threads=1024 -thread_warp_size=32", "dense_large_batch.gpu", [["TENSOR", [2048, 1024], "float32"], ["TENSOR", [1024, 4096], "float32"]], {}], "config": {"index": 2093673, "code_hash": null, "entity": [["tile_x", "sp", [-1, 2, 1, 64]], ["tile_y", "sp", [-1, 2, 1, 16]], ["tile_k", "sp", [-1, 2, 2]]]}, "result": [[2.23346792925], 0, 30.923545122146606, 1639422168.1600316], "version": 0.2, "tvm_version": "0.8.0"}
{"input": ["cuda -keys=cuda,gpu -max_num_threads=1024 -thread_warp_size=32", "dense_large_batch.gpu", [["TENSOR", [2048, 1024], "float32"], ["TENSOR", [1024, 4096], "float32"]], {}], "config": {"index": 506948, "code_hash": null, "entity": [["tile_x", "sp", [-1, 2, 4, 16]], ["tile_y", "sp", [-1, 4, 4, 1]], ["tile_k", "sp", [-1, 8, 1]]]}, "result": [[0.009145069818181818], 0, 2.733596086502075, 1639422170.2576299], "version": 0.2, "tvm_version": "0.8.0"}
{"input": ["cuda -keys=cuda,gpu -max_num_threads=1024 -thread_warp_size=32", "dense_large_batch.gpu", [["TENSOR", [2048, 1024], "float32"], ["TENSOR", [1024, 4096], "float32"]], {}], "config": {"index": 2093563, "code_hash": null, "entity": [["tile_x", "sp", [-1, 1, 1, 8]], ["tile_y", "sp", [-1, 2, 1, 16]], ["tile_k", "sp", [-1, 2, 2]]]}, "result": [[0.91172582475], 0, 14.459986686706543, 1639422187.194152], "version": 0.2, "tvm_version": "0.8.0"}
{"input": ["cuda -keys=cuda,gpu -max_num_threads=1024 -thread_warp_size=32", "dense_large_batch.gpu", [["TENSOR", [2048, 1024], "float32"], ["TENSOR", [1024, 4096], "float32"]], {}], "config": {"index": 1997852, "code_hash": null, "entity": [["tile_x", "sp", [-1, 16, 4, 8]], ["tile_y", "sp", [-1, 8, 4, 1]], ["tile_k", "sp", [-1, 2, 2]]]}, "result": [[0.272140307], 0, 7.1653666496276855, 1639422192.8193593], "version": 0.2, "tvm_version": "0.8.0"}
{"input": ["cuda -keys=cuda,gpu -max_num_threads=1024 -thread_warp_size=32", "dense_large_batch.gpu", [["TENSOR", [2048, 1024], "float32"], ["TENSOR", [1024, 4096], "float32"]], {}], "config": {"index": 3540878, "code_hash": null, "entity": [["tile_x", "sp", [-1, 64, 1, 16]], ["tile_y", "sp", [-1, 8, 1, 4]], ["tile_k", "sp", [-1, 1, 4]]]}, "result": [[8.351033585], 0, 111.39290237426758, 1639422302.833021], "version": 0.2, "tvm_version": "0.8.0"}
{"input": ["cuda -keys=cuda,gpu -max_num_threads=1024 -thread_warp_size=32", "dense_large_batch.gpu", [["TENSOR", [2048, 1024], "float32"], ["TENSOR", [1024, 4096], "float32"]], {}], "config": {"index": 2029766, "code_hash": null, "entity": [["tile_x", "sp", [-1, 8, 4, 2]], ["tile_y", "sp", [-1, 4, 4, 2]], ["tile_k", "sp", [-1, 2, 2]]]}, "result": [[0.0065355001875], 0, 2.653425931930542, 1639422305.0775826], "version": 0.2, "tvm_version": "0.8.0"}
{"input": ["cuda -keys=cuda,gpu -max_num_threads=1024 -thread_warp_size=32", "dense_large_batch.gpu", [["TENSOR", [2048, 1024], "float32"], ["TENSOR", [1024, 4096], "float32"]], {}], "config": {"index": 1997734, "code_hash": null, "entity": [["tile_x", "sp", [-1, 8, 4, 2]], ["tile_y", "sp", [-1, 8, 4, 1]], ["tile_k", "sp", [-1, 2, 2]]]}, "result": [[0.006658168999999999], 0, 2.973024606704712, 1639422508.0245376], "version": 0.2, "tvm_version": "0.8.0"}
{"input": ["cuda -keys=cuda,gpu -max_num_threads=1024 -thread_warp_size=32", "dense_large_batch.gpu", [["TENSOR", [2048, 1024], "float32"], ["TENSOR", [1024, 4096], "float32"]], {}], "config": {"index": 3516576, "code_hash": null, "entity": [["tile_x", "sp", [-1, 4, 2, 128]], ["tile_y", "sp", [-1, 4, 2, 2]], ["tile_k", "sp", [-1, 1, 4]]]}, "result": [[0.85063587725], 0, 12.676919221878052, 1639422520.217247], "version": 0.2, "tvm_version": "0.8.0"}
{"input": ["cuda -keys=cuda,gpu -max_num_threads=1024 -thread_warp_size=32", "dense_large_batch.gpu", [["TENSOR", [2048, 1024], "float32"], ["TENSOR", [1024, 4096], "float32"]], {}], "config": {"index": 2080116, "code_hash": null, "entity": [["tile_x", "sp", [-1, 16, 4, 8]], ["tile_y", "sp", [-1, 1, 4, 8]], ["tile_k", "sp", [-1, 2, 2]]]}, "result": [[0.13798440375], 0, 4.887841463088989, 1639422523.8964949], "version": 0.2, "tvm_version": "0.8.0"}
{"input": ["cuda -keys=cuda,gpu -max_num_threads=1024 -thread_warp_size=32", "dense_large_batch.gpu", [["TENSOR", [2048, 1024], "float32"], ["TENSOR", [1024, 4096], "float32"]], {}], "config": {"index": 1989465, "code_hash": null, "entity": [["tile_x", "sp", [-1, 64, 1, 8]], ["tile_y", "sp", [-1, 32, 1, 1]], ["tile_k", "sp", [-1, 2, 2]]]}, "result": [[5.2092741735], 0, 71.83505845069885, 1639422651.4637945], "version": 0.2, "tvm_version": "0.8.0"}
{"input": ["cuda -keys=cuda,gpu -max_num_threads=1024 -thread_warp_size=32", "dense_large_batch.gpu", [["TENSOR", [2048, 1024], "float32"], ["TENSOR", [1024, 4096], "float32"]], {}], "config": {"index": 1989101, "code_hash": null, "entity": [["tile_x", "sp", [-1, 64, 1, 8]], ["tile_y", "sp", [-1, 16, 1, 1]], ["tile_k", "sp", [-1, 2, 2]]]}, "result": [[5.32694976325], 0, 72.38573622703552, 1639422722.7128987], "version": 0.2, "tvm_version": "0.8.0"}
{"input": ["cuda -keys=cuda,gpu -max_num_threads=1024 -thread_warp_size=32", "dense_large_batch.gpu", [["TENSOR", [2048, 1024], "float32"], ["TENSOR", [1024, 4096], "float32"]], {}], "config": {"index": 2021861, "code_hash": null, "entity": [["tile_x", "sp", [-1, 64, 1, 8]], ["tile_y", "sp", [-1, 8, 1, 2]], ["tile_k", "sp", [-1, 2, 2]]]}, "result": [[5.370737732249999], 0, 73.8524911403656, 1639422794.7105062], "version": 0.2, "tvm_version": "0.8.0"}
{"input": ["cuda -keys=cuda,gpu -max_num_threads=1024 -thread_warp_size=32", "dense_large_batch.gpu", [["TENSOR", [2048, 1024], "float32"], ["TENSOR", [1024, 4096], "float32"]], {}], "config": {"index": 1997486, "code_hash": null, "entity": [["tile_x", "sp", [-1, 4, 4, 8]], ["tile_y", "sp", [-1, 4, 4, 1]], ["tile_k", "sp", [-1, 2, 2]]]}, "result": [[0.014158510749999999], 0, 2.459019899368286, 1639422796.6109676], "version": 0.2, "tvm_version": "0.8.0"}
{"input": ["cuda -keys=cuda,gpu -max_num_threads=1024 -thread_warp_size=32", "dense_large_batch.gpu", [["TENSOR", [2048, 1024], "float32"], ["TENSOR", [1024, 4096], "float32"]], {}], "config": {"index": 1997850, "code_hash": null, "entity": [["tile_x", "sp", [-1, 4, 4, 8]], ["tile_y", "sp", [-1, 8, 4, 1]], ["tile_k", "sp", [-1, 2, 2]]]}, "result": [[0.06161132425], 0, 3.755746841430664, 1639422799.5316553], "version": 0.2, "tvm_version": "0.8.0"}
{"input": ["cuda -keys=cuda,gpu -max_num_threads=1024 -thread_warp_size=32", "dense_large_batch.gpu", [["TENSOR", [2048, 1024], "float32"], ["TENSOR", [1024, 4096], "float32"]], {}], "config": {"index": 1989464, "code_hash": null, "entity": [["tile_x", "sp", [-1, 32, 1, 8]], ["tile_y", "sp", [-1, 32, 1, 1]], ["tile_k", "sp", [-1, 2, 2]]]}, "result": [[5.20874313875], 0, 71.69576120376587, 1639422869.3497603], "version": 0.2, "tvm_version": "0.8.0"}
{"input": ["cuda -keys=cuda,gpu -max_num_threads=1024 -thread_warp_size=32", "dense_large_batch.gpu", [["TENSOR", [2048, 1024], "float32"], ["TENSOR", [1024, 4096], "float32"]], {}], "config": {"index": 2022224, "code_hash": null, "entity": [["tile_x", "sp", [-1, 32, 1, 8]], ["tile_y", "sp", [-1, 16, 1, 2]], ["tile_k", "sp", [-1, 2, 2]]]}, "result": [[5.199822280749999], 0, 72.0099413394928, 1639422938.846105], "version": 0.2, "tvm_version": "0.8.0"}
{"input": ["cuda -keys=cuda,gpu -max_num_threads=1024 -thread_warp_size=32", "dense_large_batch.gpu", [["TENSOR", [2048, 1024], "float32"], ["TENSOR", [1024, 4096], "float32"]], {}], "config": {"index": 228477, "code_hash": null, "entity": [["tile_x", "sp", [-1, 32, 1, 16]], ["tile_y", "sp", [-1, 8, 1, 4]], ["tile_k", "sp", [-1, 2, 1]]]}, "result": [[5.334596256], 0, 73.30742931365967, 1639423010.0680695], "version": 0.2, "tvm_version": "0.8.0"}
{"input": ["cuda -keys=cuda,gpu -max_num_threads=1024 -thread_warp_size=32", "dense_large_batch.gpu", [["TENSOR", [2048, 1024], "float32"], ["TENSOR", [1024, 4096], "float32"]], {}], "config": {"index": 1997849, "code_hash": null, "entity": [["tile_x", "sp", [-1, 2, 4, 8]], ["tile_y", "sp", [-1, 8, 4, 1]], ["tile_k", "sp", [-1, 2, 2]]]}, "result": [[0.007492143642857143], 0, 2.5919737815856934, 1639423012.1538484], "version": 0.2, "tvm_version": "0.8.0"}
{"input": ["cuda -keys=cuda,gpu -max_num_threads=1024 -thread_warp_size=32", "dense_large_batch.gpu", [["TENSOR", [2048, 1024], "float32"], ["TENSOR", [1024, 4096], "float32"]], {}], "config": {"index": 341286, "code_hash": null, "entity": [["tile_x", "sp", [-1, 4, 4, 8]], ["tile_y", "sp", [-1, 4, 4, 1]], ["tile_k", "sp", [-1, 4, 1]]]}, "result": [[0.0141458885], 0, 2.854280710220337, 1639423014.5468934], "version": 0.2, "tvm_version": "0.8.0"}
{"input": ["cuda -keys=cuda,gpu -max_num_threads=1024 -thread_warp_size=32", "dense_large_batch.gpu", [["TENSOR", [2048, 1024], "float32"], ["TENSOR", [1024, 4096], "float32"]], {}], "config": {"index": 2163054, "code_hash": null, "entity": [["tile_x", "sp", [-1, 8, 4, 4]], ["tile_y", "sp", [-1, 4, 4, 1]], ["tile_k", "sp", [-1, 4, 2]]]}, "result": [[0.00921391990909091], 0, 2.611266851425171, 1639423016.3222637], "version": 0.2, "tvm_version": "0.8.0"}
{"input": ["cuda -keys=cuda,gpu -max_num_threads=1024 -thread_warp_size=32", "dense_large_batch.gpu", [["TENSOR", [2048, 1024], "float32"], ["TENSOR", [1024, 4096], "float32"]], {}], "config": {"index": 332945, "code_hash": null, "entity": [["tile_x", "sp", [-1, 32, 1, 16]], ["tile_y", "sp", [-1, 16, 1, 1]], ["tile_k", "sp", [-1, 4, 1]]]}, "result": [[5.91941556075], 0, 80.57229471206665, 1639423094.9391274], "version": 0.2, "tvm_version": "0.8.0"}
{"input": ["cuda -keys=cuda,gpu -max_num_threads=1024 -thread_warp_size=32", "dense_large_batch.gpu", [["TENSOR", [2048, 1024], "float32"], ["TENSOR", [1024, 4096], "float32"]], {}], "config": {"index": 200812, "code_hash": null, "entity": [["tile_x", "sp", [-1, 16, 1, 16]], ["tile_y", "sp", [-1, 32, 1, 2]], ["tile_k", "sp", [-1, 2, 1]]]}, "result": [[5.2563860595], 0, 71.7366795539856, 1639423165.127302], "version": 0.2, "tvm_version": "0.8.0"}
{"input": ["cuda -keys=cuda,gpu -max_num_threads=1024 -thread_warp_size=32", "dense_large_batch.gpu", [["TENSOR", [2048, 1024], "float32"], ["TENSOR", [1024, 4096], "float32"]], {}], "config": {"index": 1989463, "code_hash": null, "entity": [["tile_x", "sp", [-1, 16, 1, 8]], ["tile_y", "sp", [-1, 32, 1, 1]], ["tile_k", "sp", [-1, 2, 2]]]}, "result": [[4.7473717545], 0, 66.37310600280762, 1639423228.9443974], "version": 0.2, "tvm_version": "0.8.0"}
{"input": ["cuda -keys=cuda,gpu -max_num_threads=1024 -thread_warp_size=32", "dense_large_batch.gpu", [["TENSOR", [2048, 1024], "float32"], ["TENSOR", [1024, 4096], "float32"]], {}], "config": {"index": 2022223, "code_hash": null, "entity": [["tile_x", "sp", [-1, 16, 1, 8]], ["tile_y", "sp", [-1, 16, 1, 2]], ["tile_k", "sp", [-1, 2, 2]]]}, "result": [[5.7392544580000004], 0, 83.90673518180847, 1639423307.0503545], "version": 0.2, "tvm_version": "0.8.0"}
{"input": ["cuda -keys=cuda,gpu -max_num_threads=1024 -thread_warp_size=32", "dense_large_batch.gpu", [["TENSOR", [2048, 1024], "float32"], ["TENSOR", [1024, 4096], "float32"]], {}], "config": {"index": 1997434, "code_hash": null, "entity": [["tile_x", "sp", [-1, 8, 4, 4]], ["tile_y", "sp", [-1, 4, 4, 1]], ["tile_k", "sp", [-1, 2, 2]]]}, "result": [[0.012867398625], 0, 2.692357063293457, 1639423309.1470747], "version": 0.2, "tvm_version": "0.8.0"}
{"input": ["cuda -keys=cuda,gpu -max_num_threads=1024 -thread_warp_size=32", "dense_large_batch.gpu", [["TENSOR", [2048, 1024], "float32"], ["TENSOR", [1024, 4096], "float32"]], {}], "config": {"index": 332901, "code_hash": null, "entity": [["tile_x", "sp", [-1, 64, 1, 8]], ["tile_y", "sp", [-1, 16, 1, 1]], ["tile_k", "sp", [-1, 4, 1]]]}, "result": [[5.99864111975], 0, 81.35621333122253, 1639423389.16767], "version": 0.2, "tvm_version": "0.8.0"}
{"input": ["cuda -keys=cuda,gpu -max_num_threads=1024 -thread_warp_size=32", "dense_large_batch.gpu", [["TENSOR", [2048, 1024], "float32"], ["TENSOR", [1024, 4096], "float32"]], {}], "config": {"index": 365661, "code_hash": null, "entity": [["tile_x", "sp", [-1, 64, 1, 8]], ["tile_y", "sp", [-1, 8, 1, 2]], ["tile_k", "sp", [-1, 4, 1]]]}, "result": [[5.9810682362500005], 0, 80.84407687187195, 1639423468.622519], "version": 0.2, "tvm_version": "0.8.0"}
{"input": ["cuda -keys=cuda,gpu -max_num_threads=1024 -thread_warp_size=32", "dense_large_batch.gpu", [["TENSOR", [2048, 1024], "float32"], ["TENSOR", [1024, 4096], "float32"]], {}], "config": {"index": 228840, "code_hash": null, "entity": [["tile_x", "sp", [-1, 16, 1, 16]], ["tile_y", "sp", [-1, 16, 1, 4]], ["tile_k", "sp", [-1, 2, 1]]]}, "result": [[5.46623320275], 0, 85.27252340316772, 1639423545.769], "version": 0.2, "tvm_version": "0.8.0"}
{"input": ["cuda -keys=cuda,gpu -max_num_threads=1024 -thread_warp_size=32", "dense_large_batch.gpu", [["TENSOR", [2048, 1024], "float32"], ["TENSOR", [1024, 4096], "float32"]], {}], "config": {"index": 176029, "code_hash": null, "entity": [["tile_x", "sp", [-1, 2, 4, 8]], ["tile_y", "sp", [-1, 8, 4, 1]], ["tile_k", "sp", [-1, 2, 1]]]}, "result": [[0.009679196454545454], 0, 2.0069329738616943, 1639423547.336196], "version": 0.2, "tvm_version": "0.8.0"}
{"input": ["cuda -keys=cuda,gpu -max_num_threads=1024 -thread_warp_size=32", "dense_large_batch.gpu", [["TENSOR", [2048, 1024], "float32"], ["TENSOR", [1024, 4096], "float32"]], {}], "config": {"index": 2049889, "code_hash": null, "entity": [["tile_x", "sp", [-1, 64, 1, 8]], ["tile_y", "sp", [-1, 4, 1, 4]], ["tile_k", "sp", [-1, 2, 2]]]}, "result": [[5.1753164395], 0, 70.78013944625854, 1639423616.887783], "version": 0.2, "tvm_version": "0.8.0"}
{"input": ["cuda -keys=cuda,gpu -max_num_threads=1024 -thread_warp_size=32", "dense_large_batch.gpu", [["TENSOR", [2048, 1024], "float32"], ["TENSOR", [1024, 4096], "float32"]], {}], "config": {"index": 341650, "code_hash": null, "entity": [["tile_x", "sp", [-1, 4, 4, 8]], ["tile_y", "sp", [-1, 8, 4, 1]], ["tile_k", "sp", [-1, 4, 1]]]}, "result": [[0.04910721175], 0, 3.434079647064209, 1639423619.555577], "version": 0.2, "tvm_version": "0.8.0"}
{"input": ["cuda -keys=cuda,gpu -max_num_threads=1024 -thread_warp_size=32", "dense_large_batch.gpu", [["TENSOR", [2048, 1024], "float32"], ["TENSOR", [1024, 4096], "float32"]], {}], "config": {"index": 1832229, "code_hash": null, "entity": [["tile_x", "sp", [-1, 2, 4, 8]], ["tile_y", "sp", [-1, 8, 4, 1]], ["tile_k", "sp", [-1, 1, 2]]]}, "result": [[0.00967137], 0, 2.1242008209228516, 1639423621.2457662], "version": 0.2, "tvm_version": "0.8.0"}
{"input": ["cuda -keys=cuda,gpu -max_num_threads=1024 -thread_warp_size=32", "dense_large_batch.gpu", [["TENSOR", [2048, 1024], "float32"], ["TENSOR", [1024, 4096], "float32"]], {}], "config": {"index": 167688, "code_hash": null, "entity": [["tile_x", "sp", [-1, 16, 1, 16]], ["tile_y", "sp", [-1, 32, 1, 1]], ["tile_k", "sp", [-1, 2, 1]]]}, "result": [[5.648977351], 0, 75.98212242126465, 1639423696.053743], "version": 0.2, "tvm_version": "0.8.0"}
{"input": ["cuda -keys=cuda,gpu -max_num_threads=1024 -thread_warp_size=32", "dense_large_batch.gpu", [["TENSOR", [2048, 1024], "float32"], ["TENSOR", [1024, 4096], "float32"]], {}], "config": {"index": 341649, "code_hash": null, "entity": [["tile_x", "sp", [-1, 2, 4, 8]], ["tile_y", "sp", [-1, 8, 4, 1]], ["tile_k", "sp", [-1, 4, 1]]]}, "result": [[0.007356543928571428], 0, 2.124706745147705, 1639423697.672907], "version": 0.2, "tvm_version": "0.8.0"}
{"input": ["cuda -keys=cuda,gpu -max_num_threads=1024 -thread_warp_size=32", "dense_large_batch.gpu", [["TENSOR", [2048, 1024], "float32"], ["TENSOR", [1024, 4096], "float32"]], {}], "config": {"index": 341285, "code_hash": null, "entity": [["tile_x", "sp", [-1, 2, 4, 8]], ["tile_y", "sp", [-1, 4, 4, 1]], ["tile_k", "sp", [-1, 4, 1]]]}, "result": [[0.013531941625], 0, 2.362514019012451, 1639423699.6235998], "version": 0.2, "tvm_version": "0.8.0"}
{"input": ["cuda -keys=cuda,gpu -max_num_threads=1024 -thread_warp_size=32", "dense_large_batch.gpu", [["TENSOR", [2048, 1024], "float32"], ["TENSOR", [1024, 4096], "float32"]], {}], "config": {"index": 506854, "code_hash": null, "entity": [["tile_x", "sp", [-1, 8, 4, 4]], ["tile_y", "sp", [-1, 4, 4, 1]], ["tile_k", "sp", [-1, 8, 1]]]}, "result": [[0.009307982687499999], 0, 3.2504422664642334, 1639423706.5328157], "version": 0.2, "tvm_version": "0.8.0"}
{"input": ["cuda -keys=cuda,gpu -max_num_threads=1024 -thread_warp_size=32", "dense_large_batch.gpu", [["TENSOR", [2048, 1024], "float32"], ["TENSOR", [1024, 4096], "float32"]], {}], "config": {"index": 1884633, "code_hash": null, "entity": [["tile_x", "sp", [-1, 64, 1, 8]], ["tile_y", "sp", [-1, 8, 1, 4]], ["tile_k", "sp", [-1, 1, 2]]]}, "result": [[5.1247446065], 0, 69.2809829711914, 1639423774.7492096], "version": 0.2, "tvm_version": "0.8.0"}
{"input": ["cuda -keys=cuda,gpu -max_num_threads=1024 -thread_warp_size=32", "dense_large_batch.gpu", [["TENSOR", [2048, 1024], "float32"], ["TENSOR", [1024, 4096], "float32"]], {}], "config": {"index": 228841, "code_hash": null, "entity": [["tile_x", "sp", [-1, 32, 1, 16]], ["tile_y", "sp", [-1, 16, 1, 4]], ["tile_k", "sp", [-1, 2, 1]]]}, "result": [[5.2107697695], 0, 70.34260869026184, 1639423844.1051037], "version": 0.2, "tvm_version": "0.8.0"}
{"input": ["cuda -keys=cuda,gpu -max_num_threads=1024 -thread_warp_size=32", "dense_large_batch.gpu", [["TENSOR", [2048, 1024], "float32"], ["TENSOR", [1024, 4096], "float32"]], {}], "config": {"index": 333308, "code_hash": null, "entity": [["tile_x", "sp", [-1, 16, 1, 16]], ["tile_y", "sp", [-1, 32, 1, 1]], ["tile_k", "sp", [-1, 4, 1]]]}, "result": [[5.4436301215], 0, 75.26116728782654, 1639423917.1752424], "version": 0.2, "tvm_version": "0.8.0"}
{"input": ["cuda -keys=cuda,gpu -max_num_threads=1024 -thread_warp_size=32", "dense_large_batch.gpu", [["TENSOR", [2048, 1024], "float32"], ["TENSOR", [1024, 4096], "float32"]], {}], "config": {"index": 365705, "code_hash": null, "entity": [["tile_x", "sp", [-1, 32, 1, 16]], ["tile_y", "sp", [-1, 8, 1, 2]], ["tile_k", "sp", [-1, 4, 1]]]}, "result": [[5.3360582162500005], 0, 74.78084111213684, 1639423988.7006278], "version": 0.2, "tvm_version": "0.8.0"}
{"input": ["cuda -keys=cuda,gpu -max_num_threads=1024 -thread_warp_size=32", "dense_large_batch.gpu", [["TENSOR", [2048, 1024], "float32"], ["TENSOR", [1024, 4096], "float32"]], {}], "config": {"index": 1989571, "code_hash": null, "entity": [["tile_x", "sp", [-1, 8, 1, 64]], ["tile_y", "sp", [-1, 32, 1, 1]], ["tile_k", "sp", [-1, 2, 2]]]}, "result": [[5.329683215], 0, 72.93091678619385, 1639424059.5600593], "version": 0.2, "tvm_version": "0.8.0"}
{"input": ["cuda -keys=cuda,gpu -max_num_threads=1024 -thread_warp_size=32", "dense_large_batch.gpu", [["TENSOR", [2048, 1024], "float32"], ["TENSOR", [1024, 4096], "float32"]], {}], "config": {"index": 228475, "code_hash": null, "entity": [["tile_x", "sp", [-1, 8, 1, 16]], ["tile_y", "sp", [-1, 8, 1, 4]], ["tile_k", "sp", [-1, 2, 1]]]}, "result": [[4.078598849], 0, 56.74275779724121, 1639424114.5951674], "version": 0.2, "tvm_version": "0.8.0"}
{"input": ["cuda -keys=cuda,gpu -max_num_threads=1024 -thread_warp_size=32", "dense_large_batch.gpu", [["TENSOR", [2048, 1024], "float32"], ["TENSOR", [1024, 4096], "float32"]], {}], "config": {"index": 366024, "code_hash": null, "entity": [["tile_x", "sp", [-1, 32, 1, 8]], ["tile_y", "sp", [-1, 16, 1, 2]], ["tile_k", "sp", [-1, 4, 1]]]}, "result": [[5.25483531825], 0, 74.77694702148438, 1639424185.3300006], "version": 0.2, "tvm_version": "0.8.0"}
{"input": ["cuda -keys=cuda,gpu -max_num_threads=1024 -thread_warp_size=32", "dense_large_batch.gpu", [["TENSOR", [2048, 1024], "float32"], ["TENSOR", [1024, 4096], "float32"]], {}], "config": {"index": 333264, "code_hash": null, "entity": [["tile_x", "sp", [-1, 32, 1, 8]], ["tile_y", "sp", [-1, 32, 1, 1]], ["tile_k", "sp", [-1, 4, 1]]]}, "result": [[5.4110689925], 0, 75.73305153846741, 1639424257.6722615], "version": 0.2, "tvm_version": "0.8.0"}
{"input": ["cuda -keys=cuda,gpu -max_num_threads=1024 -thread_warp_size=32", "dense_large_batch.gpu", [["TENSOR", [2048, 1024], "float32"], ["TENSOR", [1024, 4096], "float32"]], {}], "config": {"index": 2029830, "code_hash": null, "entity": [["tile_x", "sp", [-1, 8, 4, 4]], ["tile_y", "sp", [-1, 4, 4, 2]], ["tile_k", "sp", [-1, 2, 2]]]}, "result": [[0.05825502525], 0, 3.528198719024658, 1639424260.358107], "version": 0.2, "tvm_version": "0.8.0"}
{"input": ["cuda -keys=cuda,gpu -max_num_threads=1024 -thread_warp_size=32", "dense_large_batch.gpu", [["TENSOR", [2048, 1024], "float32"], ["TENSOR", [1024, 4096], "float32"]], {}], "config": {"index": 2154357, "code_hash": null, "entity": [["tile_x", "sp", [-1, 64, 1, 8]], ["tile_y", "sp", [-1, 8, 1, 1]], ["tile_k", "sp", [-1, 4, 2]]]}, "result": [[5.8531583475], 0, 81.40928268432617, 1639424338.716261], "version": 0.2, "tvm_version": "0.8.0"}
{"input": ["cuda -keys=cuda,gpu -max_num_threads=1024 -thread_warp_size=32", "dense_large_batch.gpu", [["TENSOR", [2048, 1024], "float32"], ["TENSOR", [1024, 4096], "float32"]], {}], "config": {"index": 2029882, "code_hash": null, "entity": [["tile_x", "sp", [-1, 4, 4, 8]], ["tile_y", "sp", [-1, 4, 4, 2]], ["tile_k", "sp", [-1, 2, 2]]]}, "result": [[0.041135670750000006], 0, 2.8741860389709473, 1639424340.9127412], "version": 0.2, "tvm_version": "0.8.0"}
{"input": ["cuda -keys=cuda,gpu -max_num_threads=1024 -thread_warp_size=32", "dense_large_batch.gpu", [["TENSOR", [2048, 1024], "float32"], ["TENSOR", [1024, 4096], "float32"]], {}], "config": {"index": 341597, "code_hash": null, "entity": [["tile_x", "sp", [-1, 4, 4, 4]], ["tile_y", "sp", [-1, 8, 4, 1]], ["tile_k", "sp", [-1, 4, 1]]]}, "result": [[0.006867303333333334], 0, 2.2288079261779785, 1639424342.5823963], "version": 0.2, "tvm_version": "0.8.0"}
{"input": ["cuda -keys=cuda,gpu -max_num_threads=1024 -thread_warp_size=32", "dense_large_batch.gpu", [["TENSOR", [2048, 1024], "float32"], ["TENSOR", [1024, 4096], "float32"]], {}], "config": {"index": 341234, "code_hash": null, "entity": [["tile_x", "sp", [-1, 8, 4, 4]], ["tile_y", "sp", [-1, 4, 4, 1]], ["tile_k", "sp", [-1, 4, 1]]]}, "result": [[0.012924718], 0, 2.322802782058716, 1639424344.3250422], "version": 0.2, "tvm_version": "0.8.0"}
{"input": ["cuda -keys=cuda,gpu -max_num_threads=1024 -thread_warp_size=32", "dense_large_batch.gpu", [["TENSOR", [2048, 1024], "float32"], ["TENSOR", [1024, 4096], "float32"]], {}], "config": {"index": 498521, "code_hash": null, "entity": [["tile_x", "sp", [-1, 64, 1, 8]], ["tile_y", "sp", [-1, 16, 1, 1]], ["tile_k", "sp", [-1, 8, 1]]]}, "result": [[8.7936811575], 0, 119.0245246887207, 1639424460.7569013], "version": 0.2, "tvm_version": "0.8.0"}
{"input": ["cuda -keys=cuda,gpu -max_num_threads=1024 -thread_warp_size=32", "dense_large_batch.gpu", [["TENSOR", [2048, 1024], "float32"], ["TENSOR", [1024, 4096], "float32"]], {}], "config": {"index": 1856604, "code_hash": null, "entity": [["tile_x", "sp", [-1, 32, 1, 8]], ["tile_y", "sp", [-1, 16, 1, 2]], ["tile_k", "sp", [-1, 1, 2]]]}, "result": [[5.17999791825], 0, 70.94511365890503, 1639424530.321347], "version": 0.2, "tvm_version": "0.8.0"}
{"input": ["cuda -keys=cuda,gpu -max_num_threads=1024 -thread_warp_size=32", "dense_large_batch.gpu", [["TENSOR", [2048, 1024], "float32"], ["TENSOR", [1024, 4096], "float32"]], {}], "config": {"index": 1823844, "code_hash": null, "entity": [["tile_x", "sp", [-1, 32, 1, 8]], ["tile_y", "sp", [-1, 32, 1, 1]], ["tile_k", "sp", [-1, 1, 2]]]}, "result": [[5.21867533975], 0, 70.44182348251343, 1639424599.8702974], "version": 0.2, "tvm_version": "0.8.0"}
{"input": ["cuda -keys=cuda,gpu -max_num_threads=1024 -thread_warp_size=32", "dense_large_batch.gpu", [["TENSOR", [2048, 1024], "float32"], ["TENSOR", [1024, 4096], "float32"]], {}], "config": {"index": 1856968, "code_hash": null, "entity": [["tile_x", "sp", [-1, 32, 1, 8]], ["tile_y", "sp", [-1, 32, 1, 2]], ["tile_k", "sp", [-1, 1, 2]]]}, "result": [[5.09481172075], 0, 68.42779612541199, 1639424667.7026944], "version": 0.2, "tvm_version": "0.8.0"}
{"input": ["cuda -keys=cuda,gpu -max_num_threads=1024 -thread_warp_size=32", "dense_large_batch.gpu", [["TENSOR", [2048, 1024], "float32"], ["TENSOR", [1024, 4096], "float32"]], {}], "config": {"index": 228476, "code_hash": null, "entity": [["tile_x", "sp", [-1, 16, 1, 16]], ["tile_y", "sp", [-1, 8, 1, 4]], ["tile_k", "sp", [-1, 2, 1]]]}, "result": [[5.74077148725], 0, 78.14906191825867, 1639424744.0440626], "version": 0.2, "tvm_version": "0.8.0"}
{"input": ["cuda -keys=cuda,gpu -max_num_threads=1024 -thread_warp_size=32", "dense_large_batch.gpu", [["TENSOR", [2048, 1024], "float32"], ["TENSOR", [1024, 4096], "float32"]], {}], "config": {"index": 200404, "code_hash": null, "entity": [["tile_x", "sp", [-1, 32, 1, 8]], ["tile_y", "sp", [-1, 16, 1, 2]], ["tile_k", "sp", [-1, 2, 1]]]}, "result": [[5.473869186], 0, 75.16547274589539, 1639424817.2238653], "version": 0.2, "tvm_version": "0.8.0"}
{"input": ["cuda -keys=cuda,gpu -max_num_threads=1024 -thread_warp_size=32", "dense_large_batch.gpu", [["TENSOR", [2048, 1024], "float32"], ["TENSOR", [1024, 4096], "float32"]], {}], "config": {"index": 341233, "code_hash": null, "entity": [["tile_x", "sp", [-1, 4, 4, 4]], ["tile_y", "sp", [-1, 4, 4, 1]], ["tile_k", "sp", [-1, 4, 1]]]}, "result": [[0.012342877833333333], 0, 2.1843550205230713, 1639424870.4446394], "version": 0.2, "tvm_version": "0.8.0"}
{"input": ["cuda -keys=cuda,gpu -max_num_threads=1024 -thread_warp_size=32", "dense_large_batch.gpu", [["TENSOR", [2048, 1024], "float32"], ["TENSOR", [1024, 4096], "float32"]], {}], "config": {"index": 2029881, "code_hash": null, "entity": [["tile_x", "sp", [-1, 2, 4, 8]], ["tile_y", "sp", [-1, 4, 4, 2]], ["tile_k", "sp", [-1, 2, 2]]]}, "result": [[0.007372770785714285], 0, 2.204437732696533, 1639424872.1900475], "version": 0.2, "tvm_version": "0.8.0"}
{"input": ["cuda -keys=cuda,gpu -max_num_threads=1024 -thread_warp_size=32", "dense_large_batch.gpu", [["TENSOR", [2048, 1024], "float32"], ["TENSOR", [1024, 4096], "float32"]], {}], "config": {"index": 373629, "code_hash": null, "entity": [["tile_x", "sp", [-1, 4, 4, 4]], ["tile_y", "sp", [-1, 4, 4, 2]], ["tile_k", "sp", [-1, 4, 1]]]}, "result": [[0.006806608466666667], 0, 2.1725709438323975, 1639424873.88334], "version": 0.2, "tvm_version": "0.8.0"}
{"input": ["cuda -keys=cuda,gpu -max_num_threads=1024 -thread_warp_size=32", "dense_large_batch.gpu", [["TENSOR", [2048, 1024], "float32"], ["TENSOR", [1024, 4096], "float32"]], {}], "config": {"index": 1997797, "code_hash": null, "entity": [["tile_x", "sp", [-1, 4, 4, 4]], ["tile_y", "sp", [-1, 8, 4, 1]], ["tile_k", "sp", [-1, 2, 2]]]}, "result": [[0.006954309333333334], 0, 2.1929802894592285, 1639424875.707371], "version": 0.2, "tvm_version": "0.8.0"}
{"input": ["cuda -keys=cuda,gpu -max_num_threads=1024 -thread_warp_size=32", "dense_large_batch.gpu", [["TENSOR", [2048, 1024], "float32"], ["TENSOR", [1024, 4096], "float32"]], {}], "config": {"index": 1864261, "code_hash": null, "entity": [["tile_x", "sp", [-1, 2, 4, 8]], ["tile_y", "sp", [-1, 4, 4, 2]], ["tile_k", "sp", [-1, 1, 2]]]}, "result": [[0.009538999363636365], 0, 2.3595945835113525, 1639424877.6930435], "version": 0.2, "tvm_version": "0.8.0"}
{"input": ["cuda -keys=cuda,gpu -max_num_threads=1024 -thread_warp_size=32", "dense_large_batch.gpu", [["TENSOR", [2048, 1024], "float32"], ["TENSOR", [1024, 4096], "float32"]], {}], "config": {"index": 3520409, "code_hash": null, "entity": [["tile_x", "sp", [-1, 4, 4, 4]], ["tile_y", "sp", [-1, 4, 4, 2]], ["tile_k", "sp", [-1, 1, 4]]]}, "result": [[0.020893353500000003], 0, 2.228649139404297, 1639424879.5195732], "version": 0.2, "tvm_version": "0.8.0"}
{"input": ["cuda -keys=cuda,gpu -max_num_threads=1024 -thread_warp_size=32", "dense_large_batch.gpu", [["TENSOR", [2048, 1024], "float32"], ["TENSOR", [1024, 4096], "float32"]], {}], "config": {"index": 2029828, "code_hash": null, "entity": [["tile_x", "sp", [-1, 2, 4, 4]], ["tile_y", "sp", [-1, 4, 4, 2]], ["tile_k", "sp", [-1, 2, 2]]]}, "result": [[0.007584244526315789], 0, 2.192840814590454, 1639424883.1650617], "version": 0.2, "tvm_version": "0.8.0"}
{"input": ["cuda -keys=cuda,gpu -max_num_threads=1024 -thread_warp_size=32", "dense_large_batch.gpu", [["TENSOR", [2048, 1024], "float32"], ["TENSOR", [1024, 4096], "float32"]], {}], "config": {"index": 341596, "code_hash": null, "entity": [["tile_x", "sp", [-1, 2, 4, 4]], ["tile_y", "sp", [-1, 8, 4, 1]], ["tile_k", "sp", [-1, 4, 1]]]}, "result": [[0.00781832023076923], 0, 2.5966484546661377, 1639424885.3304546], "version": 0.2, "tvm_version": "0.8.0"}
{"input": ["cuda -keys=cuda,gpu -max_num_threads=1024 -thread_warp_size=32", "dense_large_batch.gpu", [["TENSOR", [2048, 1024], "float32"], ["TENSOR", [1024, 4096], "float32"]], {}], "config": {"index": 506853, "code_hash": null, "entity": [["tile_x", "sp", [-1, 4, 4, 4]], ["tile_y", "sp", [-1, 4, 4, 1]], ["tile_k", "sp", [-1, 8, 1]]]}, "result": [[0.008353757789473684], 0, 2.6596598625183105, 1639424887.3557632], "version": 0.2, "tvm_version": "0.8.0"}
{"input": ["cuda -keys=cuda,gpu -max_num_threads=1024 -thread_warp_size=32", "dense_large_batch.gpu", [["TENSOR", [2048, 1024], "float32"], ["TENSOR", [1024, 4096], "float32"]], {}], "config": {"index": 341459, "code_hash": null, "entity": [["tile_x", "sp", [-1, 16, 4, 1]], ["tile_y", "sp", [-1, 8, 4, 1]], ["tile_k", "sp", [-1, 4, 1]]]}, "result": [[0.0067352107999999996], 0, 2.5271494388580322, 1639424889.2161992], "version": 0.2, "tvm_version": "0.8.0"}
{"input": ["cuda -keys=cuda,gpu -max_num_threads=1024 -thread_warp_size=32", "dense_large_batch.gpu", [["TENSOR", [2048, 1024], "float32"], ["TENSOR", [1024, 4096], "float32"]], {}], "config": {"index": 2029767, "code_hash": null, "entity": [["tile_x", "sp", [-1, 16, 4, 2]], ["tile_y", "sp", [-1, 4, 4, 2]], ["tile_k", "sp", [-1, 2, 2]]]}, "result": [[0.0597648475], 0, 3.433584690093994, 1639424891.690742], "version": 0.2, "tvm_version": "0.8.0"}
{"input": ["cuda -keys=cuda,gpu -max_num_threads=1024 -thread_warp_size=32", "dense_large_batch.gpu", [["TENSOR", [2048, 1024], "float32"], ["TENSOR", [1024, 4096], "float32"]], {}], "config": {"index": 2163106, "code_hash": null, "entity": [["tile_x", "sp", [-1, 4, 4, 8]], ["tile_y", "sp", [-1, 4, 4, 1]], ["tile_k", "sp", [-1, 4, 2]]]}, "result": [[0.009197950454545455], 0, 3.0735106468200684, 1639424894.2060258], "version": 0.2, "tvm_version": "0.8.0"}
{"input": ["cuda -keys=cuda,gpu -max_num_threads=1024 -thread_warp_size=32", "dense_large_batch.gpu", [["TENSOR", [2048, 1024], "float32"], ["TENSOR", [1024, 4096], "float32"]], {}], "config": {"index": 506791, "code_hash": null, "entity": [["tile_x", "sp", [-1, 16, 4, 2]], ["tile_y", "sp", [-1, 4, 4, 1]], ["tile_k", "sp", [-1, 8, 1]]]}, "result": [[0.008076697076923076], 0, 2.628337860107422, 1639424898.0700092], "version": 0.2, "tvm_version": "0.8.0"}
{"input": ["cuda -keys=cuda,gpu -max_num_threads=1024 -thread_warp_size=32", "dense_large_batch.gpu", [["TENSOR", [2048, 1024], "float32"], ["TENSOR", [1024, 4096], "float32"]], {}], "config": {"index": 2163053, "code_hash": null, "entity": [["tile_x", "sp", [-1, 4, 4, 4]], ["tile_y", "sp", [-1, 4, 4, 1]], ["tile_k", "sp", [-1, 4, 2]]]}, "result": [[0.00836513125], 0, 2.089761734008789, 1639424899.6173637], "version": 0.2, "tvm_version": "0.8.0"}
{"input": ["cuda -keys=cuda,gpu -max_num_threads=1024 -thread_warp_size=32", "dense_large_batch.gpu", [["TENSOR", [2048, 1024], "float32"], ["TENSOR", [1024, 4096], "float32"]], {}], "config": {"index": 2029765, "code_hash": null, "entity": [["tile_x", "sp", [-1, 4, 4, 2]], ["tile_y", "sp", [-1, 4, 4, 2]], ["tile_k", "sp", [-1, 2, 2]]]}, "result": [[0.007188649857142857], 0, 1.8480024337768555, 1639424901.111567], "version": 0.2, "tvm_version": "0.8.0"}
{"input": ["cuda -keys=cuda,gpu -max_num_threads=1024 -thread_warp_size=32", "dense_large_batch.gpu", [["TENSOR", [2048, 1024], "float32"], ["TENSOR", [1024, 4096], "float32"]], {}], "config": {"index": 208009, "code_hash": null, "entity": [["tile_x", "sp", [-1, 4, 4, 4]], ["tile_y", "sp", [-1, 4, 4, 2]], ["tile_k", "sp", [-1, 2, 1]]]}, "result": [[0.00941073909090909], 0, 2.09450626373291, 1639424902.769306], "version": 0.2, "tvm_version": "0.8.0"}
{"input": ["cuda -keys=cuda,gpu -max_num_threads=1024 -thread_warp_size=32", "dense_large_batch.gpu", [["TENSOR", [2048, 1024], "float32"], ["TENSOR", [1024, 4096], "float32"]], {}], "config": {"index": 1997433, "code_hash": null, "entity": [["tile_x", "sp", [-1, 4, 4, 4]], ["tile_y", "sp", [-1, 4, 4, 1]], ["tile_k", "sp", [-1, 2, 2]]]}, "result": [[0.01284735175], 0, 2.3813929557800293, 1639424958.2843878], "version": 0.2, "tvm_version": "0.8.0"}
{"input": ["cuda -keys=cuda,gpu -max_num_threads=1024 -thread_warp_size=32", "dense_large_batch.gpu", [["TENSOR", [2048, 1024], "float32"], ["TENSOR", [1024, 4096], "float32"]], {}], "config": {"index": 2029829, "code_hash": null, "entity": [["tile_x", "sp", [-1, 4, 4, 4]], ["tile_y", "sp", [-1, 4, 4, 2]], ["tile_k", "sp", [-1, 2, 2]]]}, "result": [[0.006791835533333334], 0, 2.151038646697998, 1639424959.9619505], "version": 0.2, "tvm_version": "0.8.0"}
{"input": ["cuda -keys=cuda,gpu -max_num_threads=1024 -thread_warp_size=32", "dense_large_batch.gpu", [["TENSOR", [2048, 1024], "float32"], ["TENSOR", [1024, 4096], "float32"]], {}], "config": {"index": 1997369, "code_hash": null, "entity": [["tile_x", "sp", [-1, 4, 4, 2]], ["tile_y", "sp", [-1, 4, 4, 1]], ["tile_k", "sp", [-1, 2, 2]]]}, "result": [[0.012363037444444443], 0, 1.8703961372375488, 1639424961.530439], "version": 0.2, "tvm_version": "0.8.0"}
{"input": ["cuda -keys=cuda,gpu -max_num_threads=1024 -thread_warp_size=32", "dense_large_batch.gpu", [["TENSOR", [2048, 1024], "float32"], ["TENSOR", [1024, 4096], "float32"]], {}], "config": {"index": 1997432, "code_hash": null, "entity": [["tile_x", "sp", [-1, 2, 4, 4]], ["tile_y", "sp", [-1, 4, 4, 1]], ["tile_k", "sp", [-1, 2, 2]]]}, "result": [[0.012957739999999999], 0, 1.916639804840088, 1639424963.127002], "version": 0.2, "tvm_version": "0.8.0"}
{"input": ["cuda -keys=cuda,gpu -max_num_threads=1024 -thread_warp_size=32", "dense_large_batch.gpu", [["TENSOR", [2048, 1024], "float32"], ["TENSOR", [1024, 4096], "float32"]], {}], "config": {"index": 373565, "code_hash": null, "entity": [["tile_x", "sp", [-1, 4, 4, 2]], ["tile_y", "sp", [-1, 4, 4, 2]], ["tile_k", "sp", [-1, 4, 1]]]}, "result": [[0.0071548485], 0, 2.862879753112793, 1639424965.5277772], "version": 0.2, "tvm_version": "0.8.0"}
{"input": ["cuda -keys=cuda,gpu -max_num_threads=1024 -thread_warp_size=32", "dense_large_batch.gpu", [["TENSOR", [2048, 1024], "float32"], ["TENSOR", [1024, 4096], "float32"]], {}], "config": {"index": 2029690, "code_hash": null, "entity": [["tile_x", "sp", [-1, 8, 4, 1]], ["tile_y", "sp", [-1, 4, 4, 2]], ["tile_k", "sp", [-1, 2, 2]]]}, "result": [[0.007147833681818181], 0, 2.5075225830078125, 1639424967.5778809], "version": 0.2, "tvm_version": "0.8.0"}
{"input": ["cuda -keys=cuda,gpu -max_num_threads=1024 -thread_warp_size=32", "dense_large_batch.gpu", [["TENSOR", [2048, 1024], "float32"], ["TENSOR", [1024, 4096], "float32"]], {}], "config": {"index": 1997733, "code_hash": null, "entity": [["tile_x", "sp", [-1, 4, 4, 2]], ["tile_y", "sp", [-1, 8, 4, 1]], ["tile_k", "sp", [-1, 2, 2]]]}, "result": [[0.007477066857142856], 0, 2.3975751399993896, 1639424969.547681], "version": 0.2, "tvm_version": "0.8.0"}
{"input": ["cuda -keys=cuda,gpu -max_num_threads=1024 -thread_warp_size=32", "dense_large_batch.gpu", [["TENSOR", [2048, 1024], "float32"], ["TENSOR", [1024, 4096], "float32"]], {}], "config": {"index": 3488377, "code_hash": null, "entity": [["tile_x", "sp", [-1, 4, 4, 4]], ["tile_y", "sp", [-1, 8, 4, 1]], ["tile_k", "sp", [-1, 1, 4]]]}, "result": [[0.021072255833333334], 0, 2.2050440311431885, 1639424971.3212938], "version": 0.2, "tvm_version": "0.8.0"}
{"input": ["cuda -keys=cuda,gpu -max_num_threads=1024 -thread_warp_size=32", "dense_large_batch.gpu", [["TENSOR", [2048, 1024], "float32"], ["TENSOR", [1024, 4096], "float32"]], {}], "config": {"index": 2029401, "code_hash": null, "entity": [["tile_x", "sp", [-1, 4, 4, 2]], ["tile_y", "sp", [-1, 2, 4, 2]], ["tile_k", "sp", [-1, 2, 2]]]}, "result": [[0.012062352333333333], 0, 1.9651479721069336, 1639424972.9377935], "version": 0.2, "tvm_version": "0.8.0"}
{"input": ["cuda -keys=cuda,gpu -max_num_threads=1024 -thread_warp_size=32", "dense_large_batch.gpu", [["TENSOR", [2048, 1024], "float32"], ["TENSOR", [1024, 4096], "float32"]], {}], "config": {"index": 1864208, "code_hash": null, "entity": [["tile_x", "sp", [-1, 2, 4, 4]], ["tile_y", "sp", [-1, 4, 4, 2]], ["tile_k", "sp", [-1, 1, 2]]]}, "result": [[0.006860899066666667], 0, 2.133025646209717, 1639424974.7608936], "version": 0.2, "tvm_version": "0.8.0"}
{"input": ["cuda -keys=cuda,gpu -max_num_threads=1024 -thread_warp_size=32", "dense_large_batch.gpu", [["TENSOR", [2048, 1024], "float32"], ["TENSOR", [1024, 4096], "float32"]], {}], "config": {"index": 2162989, "code_hash": null, "entity": [["tile_x", "sp", [-1, 4, 4, 2]], ["tile_y", "sp", [-1, 4, 4, 1]], ["tile_k", "sp", [-1, 4, 2]]]}, "result": [[0.008316080052631578], 0, 2.549182176589966, 1639424976.8703425], "version": 0.2, "tvm_version": "0.8.0"}
{"input": ["cuda -keys=cuda,gpu -max_num_threads=1024 -thread_warp_size=32", "dense_large_batch.gpu", [["TENSOR", [2048, 1024], "float32"], ["TENSOR", [1024, 4096], "float32"]], {}], "config": {"index": 1864146, "code_hash": null, "entity": [["tile_x", "sp", [-1, 8, 4, 2]], ["tile_y", "sp", [-1, 4, 4, 2]], ["tile_k", "sp", [-1, 1, 2]]]}, "result": [[0.009389189636363636], 0, 2.3505663871765137, 1639424978.787024], "version": 0.2, "tvm_version": "0.8.0"}
{"input": ["cuda -keys=cuda,gpu -max_num_threads=1024 -thread_warp_size=32", "dense_large_batch.gpu", [["TENSOR", [2048, 1024], "float32"], ["TENSOR", [1024, 4096], "float32"]], {}], "config": {"index": 2162990, "code_hash": null, "entity": [["tile_x", "sp", [-1, 8, 4, 2]], ["tile_y", "sp", [-1, 4, 4, 1]], ["tile_k", "sp", [-1, 4, 2]]]}, "result": [[0.007111360666666667], 0, 2.948057174682617, 1639424981.0849915], "version": 0.2, "tvm_version": "0.8.0"}
{"input": ["cuda -keys=cuda,gpu -max_num_threads=1024 -thread_warp_size=32", "dense_large_batch.gpu", [["TENSOR", [2048, 1024], "float32"], ["TENSOR", [1024, 4096], "float32"]], {}], "config": {"index": 373628, "code_hash": null, "entity": [["tile_x", "sp", [-1, 2, 4, 4]], ["tile_y", "sp", [-1, 4, 4, 2]], ["tile_k", "sp", [-1, 4, 1]]]}, "result": [[0.007476945428571428], 0, 2.245164155960083, 1639424982.9905462], "version": 0.2, "tvm_version": "0.8.0"}
{"input": ["cuda -keys=cuda,gpu -max_num_threads=1024 -thread_warp_size=32", "dense_large_batch.gpu", [["TENSOR", [2048, 1024], "float32"], ["TENSOR", [1024, 4096], "float32"]], {}], "config": {"index": 1997796, "code_hash": null, "entity": [["tile_x", "sp", [-1, 2, 4, 4]], ["tile_y", "sp", [-1, 8, 4, 1]], ["tile_k", "sp", [-1, 2, 2]]]}, "result": [[0.007742447307692308], 0, 2.206951856613159, 1639424984.796848], "version": 0.2, "tvm_version": "0.8.0"}
{"input": ["cuda -keys=cuda,gpu -max_num_threads=1024 -thread_warp_size=32", "dense_large_batch.gpu", [["TENSOR", [2048, 1024], "float32"], ["TENSOR", [1024, 4096], "float32"]], {}], "config": {"index": 1864209, "code_hash": null, "entity": [["tile_x", "sp", [-1, 4, 4, 4]], ["tile_y", "sp", [-1, 4, 4, 2]], ["tile_k", "sp", [-1, 1, 2]]]}, "result": [[0.009422709272727273], 0, 2.0588858127593994, 1639424986.4638057], "version": 0.2, "tvm_version": "0.8.0"}
{"input": ["cuda -keys=cuda,gpu -max_num_threads=1024 -thread_warp_size=32", "dense_large_batch.gpu", [["TENSOR", [2048, 1024], "float32"], ["TENSOR", [1024, 4096], "float32"]], {}], "config": {"index": 3520408, "code_hash": null, "entity": [["tile_x", "sp", [-1, 2, 4, 4]], ["tile_y", "sp", [-1, 4, 4, 2]], ["tile_k", "sp", [-1, 1, 4]]]}, "result": [[0.007460939642857142], 0, 1.8087215423583984, 1639424987.9068327], "version": 0.2, "tvm_version": "0.8.0"}
{"input": ["cuda -keys=cuda,gpu -max_num_threads=1024 -thread_warp_size=32", "dense_large_batch.gpu", [["TENSOR", [2048, 1024], "float32"], ["TENSOR", [1024, 4096], "float32"]], {}], "config": {"index": 1997485, "code_hash": null, "entity": [["tile_x", "sp", [-1, 2, 4, 8]], ["tile_y", "sp", [-1, 4, 4, 1]], ["tile_k", "sp", [-1, 2, 2]]]}, "result": [[0.013524713875], 0, 2.300748586654663, 1639424989.9177916], "version": 0.2, "tvm_version": "0.8.0"}
{"input": ["cuda -keys=cuda,gpu -max_num_threads=1024 -thread_warp_size=32", "dense_large_batch.gpu", [["TENSOR", [2048, 1024], "float32"], ["TENSOR", [1024, 4096], "float32"]], {}], "config": {"index": 373490, "code_hash": null, "entity": [["tile_x", "sp", [-1, 8, 4, 1]], ["tile_y", "sp", [-1, 4, 4, 2]], ["tile_k", "sp", [-1, 4, 1]]]}, "result": [[0.007162318928571428], 0, 2.0629827976226807, 1639424991.5256877], "version": 0.2, "tvm_version": "0.8.0"}
{"input": ["cuda -keys=cuda,gpu -max_num_threads=1024 -thread_warp_size=32", "dense_large_batch.gpu", [["TENSOR", [2048, 1024], "float32"], ["TENSOR", [1024, 4096], "float32"]], {}], "config": {"index": 2029764, "code_hash": null, "entity": [["tile_x", "sp", [-1, 2, 4, 2]], ["tile_y", "sp", [-1, 4, 4, 2]], ["tile_k", "sp", [-1, 2, 2]]]}, "result": [[0.0065279447499999995], 0, 1.903761863708496, 1639424993.139419], "version": 0.2, "tvm_version": "0.8.0"}
{"input": ["cuda -keys=cuda,gpu -max_num_threads=1024 -thread_warp_size=32", "dense_large_batch.gpu", [["TENSOR", [2048, 1024], "float32"], ["TENSOR", [1024, 4096], "float32"]], {}], "config": {"index": 1864144, "code_hash": null, "entity": [["tile_x", "sp", [-1, 2, 4, 2]], ["tile_y", "sp", [-1, 4, 4, 2]], ["tile_k", "sp", [-1, 1, 2]]]}, "result": [[0.007360012500000001], 0, 1.8210952281951904, 1639424994.7052777], "version": 0.2, "tvm_version": "0.8.0"}
{"input": ["cuda -keys=cuda,gpu -max_num_threads=1024 -thread_warp_size=32", "dense_large_batch.gpu", [["TENSOR", [2048, 1024], "float32"], ["TENSOR", [1024, 4096], "float32"]], {}], "config": {"index": 341232, "code_hash": null, "entity": [["tile_x", "sp", [-1, 2, 4, 4]], ["tile_y", "sp", [-1, 4, 4, 1]], ["tile_k", "sp", [-1, 4, 1]]]}, "result": [[0.013040264625], 0, 2.2242543697357178, 1639424996.6139572], "version": 0.2, "tvm_version": "0.8.0"}
{"input": ["cuda -keys=cuda,gpu -max_num_threads=1024 -thread_warp_size=32", "dense_large_batch.gpu", [["TENSOR", [2048, 1024], "float32"], ["TENSOR", [1024, 4096], "float32"]], {}], "config": {"index": 3488013, "code_hash": null, "entity": [["tile_x", "sp", [-1, 4, 4, 4]], ["tile_y", "sp", [-1, 4, 4, 1]], ["tile_k", "sp", [-1, 1, 4]]]}, "result": [[0.012242480222222222], 0, 1.7780404090881348, 1639424998.0880468], "version": 0.2, "tvm_version": "0.8.0"}
{"input": ["cuda -keys=cuda,gpu -max_num_threads=1024 -thread_warp_size=32", "dense_large_batch.gpu", [["TENSOR", [2048, 1024], "float32"], ["TENSOR", [1024, 4096], "float32"]], {}], "config": {"index": 373566, "code_hash": null, "entity": [["tile_x", "sp", [-1, 8, 4, 2]], ["tile_y", "sp", [-1, 4, 4, 2]], ["tile_k", "sp", [-1, 4, 1]]]}, "result": [[0.006556144363636363], 0, 2.8779757022857666, 1639425002.391846], "version": 0.2, "tvm_version": "0.8.0"}
{"input": ["cuda -keys=cuda,gpu -max_num_threads=1024 -thread_warp_size=32", "dense_large_batch.gpu", [["TENSOR", [2048, 1024], "float32"], ["TENSOR", [1024, 4096], "float32"]], {}], "config": {"index": 207870, "code_hash": null, "entity": [["tile_x", "sp", [-1, 8, 4, 1]], ["tile_y", "sp", [-1, 4, 4, 2]], ["tile_k", "sp", [-1, 2, 1]]]}, "result": [[0.006965703333333334], 0, 2.1420516967773438, 1639425004.134133], "version": 0.2, "tvm_version": "0.8.0"}
{"input": ["cuda -keys=cuda,gpu -max_num_threads=1024 -thread_warp_size=32", "dense_large_batch.gpu", [["TENSOR", [2048, 1024], "float32"], ["TENSOR", [1024, 4096], "float32"]], {}], "config": {"index": 175977, "code_hash": null, "entity": [["tile_x", "sp", [-1, 4, 4, 4]], ["tile_y", "sp", [-1, 8, 4, 1]], ["tile_k", "sp", [-1, 2, 1]]]}, "result": [[0.009508676727272727], 0, 2.1675350666046143, 1639425005.9773564], "version": 0.2, "tvm_version": "0.8.0"}
{"input": ["cuda -keys=cuda,gpu -max_num_threads=1024 -thread_warp_size=32", "dense_large_batch.gpu", [["TENSOR", [2048, 1024], "float32"], ["TENSOR", [1024, 4096], "float32"]], {}], "config": {"index": 1997798, "code_hash": null, "entity": [["tile_x", "sp", [-1, 8, 4, 4]], ["tile_y", "sp", [-1, 8, 4, 1]], ["tile_k", "sp", [-1, 2, 2]]]}, "result": [[0.05777068825], 0, 3.2858943939208984, 1639425008.3239856], "version": 0.2, "tvm_version": "0.8.0"}
{"input": ["cuda -keys=cuda,gpu -max_num_threads=1024 -thread_warp_size=32", "dense_large_batch.gpu", [["TENSOR", [2048, 1024], "float32"], ["TENSOR", [1024, 4096], "float32"]], {}], "config": {"index": 1832176, "code_hash": null, "entity": [["tile_x", "sp", [-1, 2, 4, 4]], ["tile_y", "sp", [-1, 8, 4, 1]], ["tile_k", "sp", [-1, 1, 2]]]}, "result": [[0.007173766428571429], 0, 1.918360710144043, 1639425009.910536], "version": 0.2, "tvm_version": "0.8.0"}
{"input": ["cuda -keys=cuda,gpu -max_num_threads=1024 -thread_warp_size=32", "dense_large_batch.gpu", [["TENSOR", [2048, 1024], "float32"], ["TENSOR", [1024, 4096], "float32"]], {}], "config": {"index": 175913, "code_hash": null, "entity": [["tile_x", "sp", [-1, 4, 4, 2]], ["tile_y", "sp", [-1, 8, 4, 1]], ["tile_k", "sp", [-1, 2, 1]]]}, "result": [[0.007174861428571428], 0, 1.9658162593841553, 1639425011.5127835], "version": 0.2, "tvm_version": "0.8.0"}
{"input": ["cuda -keys=cuda,gpu -max_num_threads=1024 -thread_warp_size=32", "dense_large_batch.gpu", [["TENSOR", [2048, 1024], "float32"], ["TENSOR", [1024, 4096], "float32"]], {}], "config": {"index": 341095, "code_hash": null, "entity": [["tile_x", "sp", [-1, 16, 4, 1]], ["tile_y", "sp", [-1, 4, 4, 1]], ["tile_k", "sp", [-1, 4, 1]]]}, "result": [[0.011696891555555556], 0, 2.2783584594726562, 1639425013.419971], "version": 0.2, "tvm_version": "0.8.0"}
{"input": ["cuda -keys=cuda,gpu -max_num_threads=1024 -thread_warp_size=32", "dense_large_batch.gpu", [["TENSOR", [2048, 1024], "float32"], ["TENSOR", [1024, 4096], "float32"]], {}], "config": {"index": 373264, "code_hash": null, "entity": [["tile_x", "sp", [-1, 2, 4, 4]], ["tile_y", "sp", [-1, 2, 4, 2]], ["tile_k", "sp", [-1, 4, 1]]]}, "result": [[0.012767178124999999], 0, 2.4152562618255615, 1639425015.5109062], "version": 0.2, "tvm_version": "0.8.0"}
{"input": ["cuda -keys=cuda,gpu -max_num_threads=1024 -thread_warp_size=32", "dense_large_batch.gpu", [["TENSOR", [2048, 1024], "float32"], ["TENSOR", [1024, 4096], "float32"]], {}], "config": {"index": 208008, "code_hash": null, "entity": [["tile_x", "sp", [-1, 2, 4, 4]], ["tile_y", "sp", [-1, 4, 4, 2]], ["tile_k", "sp", [-1, 2, 1]]]}, "result": [[0.006881753199999999], 0, 1.9159116744995117, 1639425017.0977747], "version": 0.2, "tvm_version": "0.8.0"}
{"input": ["cuda -keys=cuda,gpu -max_num_threads=1024 -thread_warp_size=32", "dense_large_batch.gpu", [["TENSOR", [2048, 1024], "float32"], ["TENSOR", [1024, 4096], "float32"]], {}], "config": {"index": 341170, "code_hash": null, "entity": [["tile_x", "sp", [-1, 8, 4, 2]], ["tile_y", "sp", [-1, 4, 4, 1]], ["tile_k", "sp", [-1, 4, 1]]]}, "result": [[0.011589660777777778], 0, 2.1929240226745605, 1639425018.7922168], "version": 0.2, "tvm_version": "0.8.0"}
{"input": ["cuda -keys=cuda,gpu -max_num_threads=1024 -thread_warp_size=32", "dense_large_batch.gpu", [["TENSOR", [2048, 1024], "float32"], ["TENSOR", [1024, 4096], "float32"]], {}], "config": {"index": 1832114, "code_hash": null, "entity": [["tile_x", "sp", [-1, 8, 4, 2]], ["tile_y", "sp", [-1, 8, 4, 1]], ["tile_k", "sp", [-1, 1, 2]]]}, "result": [[0.009496042636363637], 0, 2.1886041164398193, 1639425020.514408], "version": 0.2, "tvm_version": "0.8.0"}
{"input": ["cuda -keys=cuda,gpu -max_num_threads=1024 -thread_warp_size=32", "dense_large_batch.gpu", [["TENSOR", [2048, 1024], "float32"], ["TENSOR", [1024, 4096], "float32"]], {}], "config": {"index": 373491, "code_hash": null, "entity": [["tile_x", "sp", [-1, 16, 4, 1]], ["tile_y", "sp", [-1, 4, 4, 2]], ["tile_k", "sp", [-1, 4, 1]]]}, "result": [[0.006532485375], 0, 2.1920225620269775, 1639425022.2482421], "version": 0.2, "tvm_version": "0.8.0"}
{"input": ["cuda -keys=cuda,gpu -max_num_threads=1024 -thread_warp_size=32", "dense_large_batch.gpu", [["TENSOR", [2048, 1024], "float32"], ["TENSOR", [1024, 4096], "float32"]], {}], "config": {"index": 42325, "code_hash": null, "entity": [["tile_x", "sp", [-1, 4, 4, 2]], ["tile_y", "sp", [-1, 4, 4, 2]], ["tile_k", "sp", [-1, 1, 1]]]}, "result": [[0.009442219], 0, 1.9207606315612793, 1639425023.8501291], "version": 0.2, "tvm_version": "0.8.0"}
{"input": ["cuda -keys=cuda,gpu -max_num_threads=1024 -thread_warp_size=32", "dense_large_batch.gpu", [["TENSOR", [2048, 1024], "float32"], ["TENSOR", [1024, 4096], "float32"]], {}], "config": {"index": 2029691, "code_hash": null, "entity": [["tile_x", "sp", [-1, 16, 4, 1]], ["tile_y", "sp", [-1, 4, 4, 2]], ["tile_k", "sp", [-1, 2, 2]]]}, "result": [[0.0065575923125], 0, 2.118452787399292, 1639425025.6053631], "version": 0.2, "tvm_version": "0.8.0"}
{"input": ["cuda -keys=cuda,gpu -max_num_threads=1024 -thread_warp_size=32", "dense_large_batch.gpu", [["TENSOR", [2048, 1024], "float32"], ["TENSOR", [1024, 4096], "float32"]], {}], "config": {"index": 1831813, "code_hash": null, "entity": [["tile_x", "sp", [-1, 4, 4, 4]], ["tile_y", "sp", [-1, 4, 4, 1]], ["tile_k", "sp", [-1, 1, 2]]]}, "result": [[0.014702524571428571], 0, 2.578162670135498, 1639425027.8364983], "version": 0.2, "tvm_version": "0.8.0"}
{"input": ["cuda -keys=cuda,gpu -max_num_threads=1024 -thread_warp_size=32", "dense_large_batch.gpu", [["TENSOR", [2048, 1024], "float32"], ["TENSOR", [1024, 4096], "float32"]], {}], "config": {"index": 3520461, "code_hash": null, "entity": [["tile_x", "sp", [-1, 2, 4, 8]], ["tile_y", "sp", [-1, 4, 4, 2]], ["tile_k", "sp", [-1, 1, 4]]]}, "result": [[0.021053818000000002], 0, 2.4087510108947754, 1639425029.8073997], "version": 0.2, "tvm_version": "0.8.0"}
{"input": ["cuda -keys=cuda,gpu -max_num_threads=1024 -thread_warp_size=32", "dense_large_batch.gpu", [["TENSOR", [2048, 1024], "float32"], ["TENSOR", [1024, 4096], "float32"]], {}], "config": {"index": 1864070, "code_hash": null, "entity": [["tile_x", "sp", [-1, 8, 4, 1]], ["tile_y", "sp", [-1, 4, 4, 2]], ["tile_k", "sp", [-1, 1, 2]]]}, "result": [[0.006916955333333333], 0, 1.8961825370788574, 1639425031.533135], "version": 0.2, "tvm_version": "0.8.0"}
{"input": ["cuda -keys=cuda,gpu -max_num_threads=1024 -thread_warp_size=32", "dense_large_batch.gpu", [["TENSOR", [2048, 1024], "float32"], ["TENSOR", [1024, 4096], "float32"]], {}], "config": {"index": 2057065, "code_hash": null, "entity": [["tile_x", "sp", [-1, 4, 4, 2]], ["tile_y", "sp", [-1, 2, 4, 4]], ["tile_k", "sp", [-1, 2, 2]]]}, "result": [[0.0070483974], 0, 1.9372382164001465, 1639425033.1150453], "version": 0.2, "tvm_version": "0.8.0"}
{"input": ["cuda -keys=cuda,gpu -max_num_threads=1024 -thread_warp_size=32", "dense_large_batch.gpu", [["TENSOR", [2048, 1024], "float32"], ["TENSOR", [1024, 4096], "float32"]], {}], "config": {"index": 207945, "code_hash": null, "entity": [["tile_x", "sp", [-1, 4, 4, 2]], ["tile_y", "sp", [-1, 4, 4, 2]], ["tile_k", "sp", [-1, 2, 1]]]}, "result": [[0.007020407047619047], 0, 2.3430511951446533, 1639425090.3993213], "version": 0.2, "tvm_version": "0.8.0"}
{"input": ["cuda -keys=cuda,gpu -max_num_threads=1024 -thread_warp_size=32", "dense_large_batch.gpu", [["TENSOR", [2048, 1024], "float32"], ["TENSOR", [1024, 4096], "float32"]], {}], "config": {"index": 1891508, "code_hash": null, "entity": [["tile_x", "sp", [-1, 2, 4, 4]], ["tile_y", "sp", [-1, 2, 4, 4]], ["tile_k", "sp", [-1, 1, 2]]]}, "result": [[0.006822235866666667], 0, 1.9415507316589355, 1639425092.0117052], "version": 0.2, "tvm_version": "0.8.0"}
{"input": ["cuda -keys=cuda,gpu -max_num_threads=1024 -thread_warp_size=32", "dense_large_batch.gpu", [["TENSOR", [2048, 1024], "float32"], ["TENSOR", [1024, 4096], "float32"]], {}], "config": {"index": 1864207, "code_hash": null, "entity": [["tile_x", "sp", [-1, 1, 4, 4]], ["tile_y", "sp", [-1, 4, 4, 2]], ["tile_k", "sp", [-1, 1, 2]]]}, "result": [[0.007362746857142857], 0, 1.8249273300170898, 1639425093.577807], "version": 0.2, "tvm_version": "0.8.0"}
{"input": ["cuda -keys=cuda,gpu -max_num_threads=1024 -thread_warp_size=32", "dense_large_batch.gpu", [["TENSOR", [2048, 1024], "float32"], ["TENSOR", [1024, 4096], "float32"]], {}], "config": {"index": 175976, "code_hash": null, "entity": [["tile_x", "sp", [-1, 2, 4, 4]], ["tile_y", "sp", [-1, 8, 4, 1]], ["tile_k", "sp", [-1, 2, 1]]]}, "result": [[0.007225585142857142], 0, 2.1422195434570312, 1639425095.4250953], "version": 0.2, "tvm_version": "0.8.0"}
{"input": ["cuda -keys=cuda,gpu -max_num_threads=1024 -thread_warp_size=32", "dense_large_batch.gpu", [["TENSOR", [2048, 1024], "float32"], ["TENSOR", [1024, 4096], "float32"]], {}], "config": {"index": 1864145, "code_hash": null, "entity": [["tile_x", "sp", [-1, 4, 4, 2]], ["tile_y", "sp", [-1, 4, 4, 2]], ["tile_k", "sp", [-1, 1, 2]]]}, "result": [[0.006914055933333334], 0, 1.8671085834503174, 1639425097.0053742], "version": 0.2, "tvm_version": "0.8.0"}
{"input": ["cuda -keys=cuda,gpu -max_num_threads=1024 -thread_warp_size=32", "dense_large_batch.gpu", [["TENSOR", [2048, 1024], "float32"], ["TENSOR", [1024, 4096], "float32"]], {}], "config": {"index": 341534, "code_hash": null, "entity": [["tile_x", "sp", [-1, 8, 4, 2]], ["tile_y", "sp", [-1, 8, 4, 1]], ["tile_k", "sp", [-1, 4, 1]]]}, "result": [[0.006643537125], 0, 2.532865285873413, 1639425098.711333], "version": 0.2, "tvm_version": "0.8.0"}
{"input": ["cuda -keys=cuda,gpu -max_num_threads=1024 -thread_warp_size=32", "dense_large_batch.gpu", [["TENSOR", [2048, 1024], "float32"], ["TENSOR", [1024, 4096], "float32"]], {}], "config": {"index": 69624, "code_hash": null, "entity": [["tile_x", "sp", [-1, 2, 4, 2]], ["tile_y", "sp", [-1, 2, 4, 4]], ["tile_k", "sp", [-1, 1, 1]]]}, "result": [[0.0103384742], 0, 2.1145071983337402, 1639425100.6003792], "version": 0.2, "tvm_version": "0.8.0"}
{"input": ["cuda -keys=cuda,gpu -max_num_threads=1024 -thread_warp_size=32", "dense_large_batch.gpu", [["TENSOR", [2048, 1024], "float32"], ["TENSOR", [1024, 4096], "float32"]], {}], "config": {"index": 373564, "code_hash": null, "entity": [["tile_x", "sp", [-1, 2, 4, 2]], ["tile_y", "sp", [-1, 4, 4, 2]], ["tile_k", "sp", [-1, 4, 1]]]}, "result": [[0.0065364409375000005], 0, 2.020399570465088, 1639425102.2534509], "version": 0.2, "tvm_version": "0.8.0"}
{"input": ["cuda -keys=cuda,gpu -max_num_threads=1024 -thread_warp_size=32", "dense_large_batch.gpu", [["TENSOR", [2048, 1024], "float32"], ["TENSOR", [1024, 4096], "float32"]], {}], "config": {"index": 2029689, "code_hash": null, "entity": [["tile_x", "sp", [-1, 4, 4, 1]], ["tile_y", "sp", [-1, 4, 4, 2]], ["tile_k", "sp", [-1, 2, 2]]]}, "result": [[0.0065365465000000005], 0, 1.7040300369262695, 1639425103.6447127], "version": 0.2, "tvm_version": "0.8.0"}
{"input": ["cuda -keys=cuda,gpu -max_num_threads=1024 -thread_warp_size=32", "dense_large_batch.gpu", [["TENSOR", [2048, 1024], "float32"], ["TENSOR", [1024, 4096], "float32"]], {}], "config": {"index": 235244, "code_hash": null, "entity": [["tile_x", "sp", [-1, 2, 4, 2]], ["tile_y", "sp", [-1, 2, 4, 4]], ["tile_k", "sp", [-1, 2, 1]]]}, "result": [[0.0070540386000000005], 0, 1.6878290176391602, 1639425105.0352654], "version": 0.2, "tvm_version": "0.8.0"}
{"input": ["cuda -keys=cuda,gpu -max_num_threads=1024 -thread_warp_size=32", "dense_large_batch.gpu", [["TENSOR", [2048, 1024], "float32"], ["TENSOR", [1024, 4096], "float32"]], {}], "config": {"index": 42389, "code_hash": null, "entity": [["tile_x", "sp", [-1, 4, 4, 4]], ["tile_y", "sp", [-1, 4, 4, 2]], ["tile_k", "sp", [-1, 1, 1]]]}, "result": [[0.0105869525], 0, 2.1702890396118164, 1639425106.883615], "version": 0.2, "tvm_version": "0.8.0"}
{"input": ["cuda -keys=cuda,gpu -max_num_threads=1024 -thread_warp_size=32", "dense_large_batch.gpu", [["TENSOR", [2048, 1024], "float32"], ["TENSOR", [1024, 4096], "float32"]], {}], "config": {"index": 373489, "code_hash": null, "entity": [["tile_x", "sp", [-1, 4, 4, 1]], ["tile_y", "sp", [-1, 4, 4, 2]], ["tile_k", "sp", [-1, 4, 1]]]}, "result": [[0.0065169240625], 0, 1.8918886184692383, 1639425108.4196622], "version": 0.2, "tvm_version": "0.8.0"}
{"input": ["cuda -keys=cuda,gpu -max_num_threads=1024 -thread_warp_size=32", "dense_large_batch.gpu", [["TENSOR", [2048, 1024], "float32"], ["TENSOR", [1024, 4096], "float32"]], {}], "config": {"index": 341533, "code_hash": null, "entity": [["tile_x", "sp", [-1, 4, 4, 2]], ["tile_y", "sp", [-1, 8, 4, 1]], ["tile_k", "sp", [-1, 4, 1]]]}, "result": [[0.007467599071428571], 0, 2.0858237743377686, 1639425109.9948926], "version": 0.2, "tvm_version": "0.8.0"}
{"input": ["cuda -keys=cuda,gpu -max_num_threads=1024 -thread_warp_size=32", "dense_large_batch.gpu", [["TENSOR", [2048, 1024], "float32"], ["TENSOR", [1024, 4096], "float32"]], {}], "config": {"index": 235245, "code_hash": null, "entity": [["tile_x", "sp", [-1, 4, 4, 2]], ["tile_y", "sp", [-1, 2, 4, 4]], ["tile_k", "sp", [-1, 2, 1]]]}, "result": [[0.006836030466666667], 0, 2.238570213317871, 1639425111.9516082], "version": 0.2, "tvm_version": "0.8.0"}
{"input": ["cuda -keys=cuda,gpu -max_num_threads=1024 -thread_warp_size=32", "dense_large_batch.gpu", [["TENSOR", [2048, 1024], "float32"], ["TENSOR", [1024, 4096], "float32"]], {}], "config": {"index": 207944, "code_hash": null, "entity": [["tile_x", "sp", [-1, 2, 4, 2]], ["tile_y", "sp", [-1, 4, 4, 2]], ["tile_k", "sp", [-1, 2, 1]]]}, "result": [[0.007334311928571429], 0, 1.990936040878296, 1639425113.6308074], "version": 0.2, "tvm_version": "0.8.0"}
{"input": ["cuda -keys=cuda,gpu -max_num_threads=1024 -thread_warp_size=32", "dense_large_batch.gpu", [["TENSOR", [2048, 1024], "float32"], ["TENSOR", [1024, 4096], "float32"]], {}], "config": {"index": 207943, "code_hash": null, "entity": [["tile_x", "sp", [-1, 1, 4, 2]], ["tile_y", "sp", [-1, 4, 4, 2]], ["tile_k", "sp", [-1, 2, 1]]]}, "result": [[0.009733861454545455], 0, 1.8296136856079102, 1639425115.1751099], "version": 0.2, "tvm_version": "0.8.0"}
{"input": ["cuda -keys=cuda,gpu -max_num_threads=1024 -thread_warp_size=32", "dense_large_batch.gpu", [["TENSOR", [2048, 1024], "float32"], ["TENSOR", [1024, 4096], "float32"]], {}], "config": {"index": 1891445, "code_hash": null, "entity": [["tile_x", "sp", [-1, 4, 4, 2]], ["tile_y", "sp", [-1, 2, 4, 4]], ["tile_k", "sp", [-1, 1, 2]]]}, "result": [[0.006807302933333333], 0, 1.7058830261230469, 1639425116.5724387], "version": 0.2, "tvm_version": "0.8.0"}
{"input": ["cuda -keys=cuda,gpu -max_num_threads=1024 -thread_warp_size=32", "dense_large_batch.gpu", [["TENSOR", [2048, 1024], "float32"], ["TENSOR", [1024, 4096], "float32"]], {}], "config": {"index": 373488, "code_hash": null, "entity": [["tile_x", "sp", [-1, 2, 4, 1]], ["tile_y", "sp", [-1, 4, 4, 2]], ["tile_k", "sp", [-1, 4, 1]]]}, "result": [[0.008169576923076922], 0, 1.7881810665130615, 1639425118.0509596], "version": 0.2, "tvm_version": "0.8.0"}
{"input": ["cuda -keys=cuda,gpu -max_num_threads=1024 -thread_warp_size=32", "dense_large_batch.gpu", [["TENSOR", [2048, 1024], "float32"], ["TENSOR", [1024, 4096], "float32"]], {}], "config": {"index": 42324, "code_hash": null, "entity": [["tile_x", "sp", [-1, 2, 4, 2]], ["tile_y", "sp", [-1, 4, 4, 2]], ["tile_k", "sp", [-1, 1, 1]]]}, "result": [[0.0105411845], 0, 1.7855215072631836, 1639425119.5836468], "version": 0.2, "tvm_version": "0.8.0"}
{"input": ["cuda -keys=cuda,gpu -max_num_threads=1024 -thread_warp_size=32", "dense_large_batch.gpu", [["TENSOR", [2048, 1024], "float32"], ["TENSOR", [1024, 4096], "float32"]], {}], "config": {"index": 1891444, "code_hash": null, "entity": [["tile_x", "sp", [-1, 2, 4, 2]], ["tile_y", "sp", [-1, 2, 4, 4]], ["tile_k", "sp", [-1, 1, 2]]]}, "result": [[0.007051708], 0, 2.087686538696289, 1639425121.4190016], "version": 0.2, "tvm_version": "0.8.0"}
{"input": ["cuda -keys=cuda,gpu -max_num_threads=1024 -thread_warp_size=32", "dense_large_batch.gpu", [["TENSOR", [2048, 1024], "float32"], ["TENSOR", [1024, 4096], "float32"]], {}], "config": {"index": 42388, "code_hash": null, "entity": [["tile_x", "sp", [-1, 2, 4, 4]], ["tile_y", "sp", [-1, 4, 4, 2]], ["tile_k", "sp", [-1, 1, 1]]]}, "result": [[0.009519561727272727], 0, 2.049537420272827, 1639425123.1845863], "version": 0.2, "tvm_version": "0.8.0"}
{"input": ["cuda -keys=cuda,gpu -max_num_threads=1024 -thread_warp_size=32", "dense_large_batch.gpu", [["TENSOR", [2048, 1024], "float32"], ["TENSOR", [1024, 4096], "float32"]], {}], "config": {"index": 400865, "code_hash": null, "entity": [["tile_x", "sp", [-1, 4, 4, 2]], ["tile_y", "sp", [-1, 2, 4, 4]], ["tile_k", "sp", [-1, 4, 1]]]}, "result": [[0.0069860754], 0, 1.9429171085357666, 1639425124.733589], "version": 0.2, "tvm_version": "0.8.0"}
{"input": ["cuda -keys=cuda,gpu -max_num_threads=1024 -thread_warp_size=32", "dense_large_batch.gpu", [["TENSOR", [2048, 1024], "float32"], ["TENSOR", [1024, 4096], "float32"]], {}], "config": {"index": 373563, "code_hash": null, "entity": [["tile_x", "sp", [-1, 1, 4, 2]], ["tile_y", "sp", [-1, 4, 4, 2]], ["tile_k", "sp", [-1, 4, 1]]]}, "result": [[0.008167013692307691], 0, 1.7788665294647217, 1639425126.2085075], "version": 0.2, "tvm_version": "0.8.0"}
