artifacts/Table4/tvm/ansor/conv/ansor_conv2d_128_64_56_56_256_1_1_1_0.log
{"i": [["[\"conv2d_layer\", 128, 64, 56, 56, 256, 1, 1, 1, 0]", "rocm -keys=rocm,gpu -max_num_threads=256 -mcpu=gfx906 -mtriple=amdgcn-amd-amdhsa-hcc -thread_warp_size=64", [-1, 16, 64, 65536, 2147483647, 1024, 16, 64], "", 0, []], [[], [["CHW", 3, "local"], ["SP", 3, 0, 128, [1, 1, 1, 1], 1], ["SP", 3, 5, 256, [2, 1, 2, 2], 1], ["SP", 3, 10, 56, [1, 2, 7, 2], 1], ["SP", 3, 15, 56, [1, 1, 7, 1], 1], ["SP", 3, 20, 64, [1, 2], 1], ["SP", 3, 23, 1, [1, 1], 1], ["SP", 3, 26, 1, [1, 1], 1], ["RE", 3, [0, 5, 10, 15, 1, 6, 11, 16, 2, 7, 12, 17, 20, 23, 26, 21, 24, 27, 3, 8, 13, 18, 22, 25, 28, 4, 9, 14, 19]], ["FSP", 4, 0, 1, 3], ["FSP", 4, 4, 2, 3], ["FSP", 4, 8, 3, 3], ["FSP", 4, 12, 4, 3], ["RE", 4, [0, 4, 8, 12, 1, 5, 9, 13, 2, 6, 10, 14, 3, 7, 11, 15]], ["CA", 3, 4, 11], ["CHR", 2, "shared", [3]], ["CA", 3, 4, 14], ["CHR", 1, "shared", [4]], ["CA", 2, 5, 14], ["CI", 1], ["FU", 6, [0, 1, 2, 3]], ["AN", 6, 0, 5], ["FU", 6, [1, 2, 3, 4]], ["AN", 6, 1, 4], ["FU", 6, [2, 3, 4, 5]], ["AN", 6, 2, 6], ["FU", 4, [0, 1, 2, 3]], ["SP", 4, 0, 8, [4], 1], ["AN", 4, 1, 2], ["FFSP", 4, 0, [4, 3, 2, 1], 1, 1], ["AN", 4, 1, 6], ["FU", 2, [0, 1, 2, 3]], ["SP", 2, 0, 196, [1], 1], ["AN", 2, 1, 2], ["FFSP", 2, 0, [4, 3, 2, 1], 1, 1], ["AN", 2, 1, 6], ["PR", 5, 0, "auto_unroll_max_step$64"]]]], "r": [[0.59791], 0, 7.46865, 1638331517], "v": "v0.6"}
{"i": [["[\"conv2d_layer\", 128, 64, 56, 56, 256, 1, 1, 1, 0]", "rocm -keys=rocm,gpu -max_num_threads=256 -mcpu=gfx906 -mtriple=amdgcn-amd-amdhsa-hcc -thread_warp_size=64", [-1, 16, 64, 65536, 2147483647, 1024, 16, 64], "", 0, []], [[], [["CHW", 3, "local"], ["SP", 3, 0, 128, [1, 16, 1, 2], 1], ["SP", 3, 5, 256, [1, 4, 1, 2], 1], ["SP", 3, 10, 56, [2, 7, 1, 2], 1], ["SP", 3, 15, 56, [1, 2, 1, 4], 1], ["SP", 3, 20, 64, [1, 1], 1], ["SP", 3, 23, 1, [1, 1], 1], ["SP", 3, 26, 1, [1, 1], 1], ["RE", 3, [0, 5, 10, 15, 1, 6, 11, 16, 2, 7, 12, 17, 20, 23, 26, 21, 24, 27, 3, 8, 13, 18, 22, 25, 28, 4, 9, 14, 19]], ["FSP", 4, 0, 1, 3], ["FSP", 4, 4, 2, 3], ["FSP", 4, 8, 3, 3], ["FSP", 4, 12, 4, 3], ["RE", 4, [0, 4, 8, 12, 1, 5, 9, 13, 2, 6, 10, 14, 3, 7, 11, 15]], ["CA", 3, 4, 11], ["CHR", 2, "shared", [3]], ["CA", 3, 4, 14], ["CHR", 1, "shared", [4]], ["CA", 2, 5, 14], ["CI", 1], ["FU", 6, [0, 1, 2, 3]], ["AN", 6, 0, 5], ["FU", 6, [1, 2, 3, 4]], ["AN", 6, 1, 4], ["FU", 6, [2, 3, 4, 5]], ["AN", 6, 2, 6], ["FU", 4, [0, 1, 2, 3]], ["SP", 4, 0, 4, [1], 1], ["AN", 4, 1, 2], ["FFSP", 4, 0, [4, 3, 2, 1], 1, 1], ["AN", 4, 1, 6], ["FU", 2, [0, 1, 2, 3]], ["SP", 2, 0, 32, [1], 1], ["AN", 2, 1, 2], ["FFSP", 2, 0, [4, 3, 2, 1], 1, 1], ["AN", 2, 1, 6], ["PR", 5, 0, "auto_unroll_max_step$64"]]]], "r": [[0.0731411], 0, 4.97303, 1638331522], "v": "v0.6"}
{"i": [["[\"conv2d_layer\", 128, 64, 56, 56, 256, 1, 1, 1, 0]", "rocm -keys=rocm,gpu -max_num_threads=256 -mcpu=gfx906 -mtriple=amdgcn-amd-amdhsa-hcc -thread_warp_size=64", [-1, 16, 64, 65536, 2147483647, 1024, 16, 64], "", 0, []], [[], [["CHW", 3, "local"], ["SP", 3, 0, 128, [1, 1, 1, 8], 1], ["SP", 3, 5, 256, [1, 16, 4, 1], 1], ["SP", 3, 10, 56, [1, 7, 1, 1], 1], ["SP", 3, 15, 56, [4, 1, 2, 7], 1], ["SP", 3, 20, 64, [1, 1], 1], ["SP", 3, 23, 1, [1, 1], 1], ["SP", 3, 26, 1, [1, 1], 1], ["RE", 3, [0, 5, 10, 15, 1, 6, 11, 16, 2, 7, 12, 17, 20, 23, 26, 21, 24, 27, 3, 8, 13, 18, 22, 25, 28, 4, 9, 14, 19]], ["FSP", 4, 0, 1, 3], ["FSP", 4, 4, 2, 3], ["FSP", 4, 8, 3, 3], ["FSP", 4, 12, 4, 3], ["RE", 4, [0, 4, 8, 12, 1, 5, 9, 13, 2, 6, 10, 14, 3, 7, 11, 15]], ["CA", 3, 4, 11], ["CHR", 2, "shared", [3]], ["CA", 3, 4, 14], ["CHR", 1, "shared", [4]], ["CA", 2, 5, 14], ["CI", 1], ["FU", 6, [0, 1, 2, 3]], ["AN", 6, 0, 5], ["FU", 6, [1, 2, 3, 4]], ["AN", 6, 1, 4], ["FU", 6, [2, 3, 4, 5]], ["AN", 6, 2, 6], ["FU", 4, [0, 1, 2, 3]], ["SP", 4, 0, 4, [1], 1], ["AN", 4, 1, 2], ["FFSP", 4, 0, [4, 3, 2, 1], 1, 1], ["AN", 4, 1, 6], ["FU", 2, [0, 1, 2, 3]], ["SP", 2, 0, 112, [1], 1], ["AN", 2, 1, 2], ["FFSP", 2, 0, [4, 3, 2, 1], 1, 1], ["AN", 2, 1, 6], ["PR", 5, 0, "auto_unroll_max_step$1024"]]]], "r": [[0.128764], 0, 9.46636, 1638331526], "v": "v0.6"}
{"i": [["[\"conv2d_layer\", 128, 64, 56, 56, 256, 1, 1, 1, 0]", "rocm -keys=rocm,gpu -max_num_threads=256 -mcpu=gfx906 -mtriple=amdgcn-amd-amdhsa-hcc -thread_warp_size=64", [-1, 16, 64, 65536, 2147483647, 1024, 16, 64], "", 0, []], [[], [["CHW", 3, "local"], ["SP", 3, 0, 128, [2, 16, 4, 1], 1], ["SP", 3, 5, 256, [1, 4, 1, 8], 1], ["SP", 3, 10, 56, [2, 1, 1, 2], 1], ["SP", 3, 15, 56, [1, 1, 4, 2], 1], ["SP", 3, 20, 64, [1, 2], 1], ["SP", 3, 23, 1, [1, 1], 1], ["SP", 3, 26, 1, [1, 1], 1], ["RE", 3, [0, 5, 10, 15, 1, 6, 11, 16, 2, 7, 12, 17, 20, 23, 26, 21, 24, 27, 3, 8, 13, 18, 22, 25, 28, 4, 9, 14, 19]], ["FSP", 4, 0, 1, 3], ["FSP", 4, 4, 2, 3], ["FSP", 4, 8, 3, 3], ["FSP", 4, 12, 4, 3], ["RE", 4, [0, 4, 8, 12, 1, 5, 9, 13, 2, 6, 10, 14, 3, 7, 11, 15]], ["CA", 3, 4, 11], ["CHR", 2, "shared", [3]], ["CA", 3, 4, 14], ["CHR", 1, "shared", [4]], ["CA", 2, 5, 14], ["CI", 1], ["FU", 6, [0, 1, 2, 3]], ["AN", 6, 0, 5], ["FU", 6, [1, 2, 3, 4]], ["AN", 6, 1, 4], ["FU", 6, [2, 3, 4, 5]], ["AN", 6, 2, 6], ["FU", 4, [0, 1, 2, 3]], ["SP", 4, 0, 16, [1], 1], ["AN", 4, 1, 2], ["FFSP", 4, 0, [4, 3, 2, 1], 1, 1], ["AN", 4, 1, 6], ["FU", 2, [0, 1, 2, 3]], ["SP", 2, 0, 128, [1], 1], ["AN", 2, 1, 2], ["FFSP", 2, 0, [4, 3, 2, 1], 1, 1], ["AN", 2, 1, 6], ["PR", 5, 0, "auto_unroll_max_step$64"]]]], "r": [[0.511139], 0, 8.0718, 1638331532], "v": "v0.6"}
{"i": [["[\"conv2d_layer\", 128, 64, 56, 56, 256, 1, 1, 1, 0]", "rocm -keys=rocm,gpu -max_num_threads=256 -mcpu=gfx906 -mtriple=amdgcn-amd-amdhsa-hcc -thread_warp_size=64", [-1, 16, 64, 65536, 2147483647, 1024, 16, 64], "", 0, []], [[], [["CHW", 3, "local"], ["SP", 3, 0, 128, [1, 1, 1, 8], 1], ["SP", 3, 5, 256, [1, 16, 4, 1], 1], ["SP", 3, 10, 56, [1, 7, 1, 1], 1], ["SP", 3, 15, 56, [4, 1, 2, 7], 1], ["SP", 3, 20, 64, [1, 1], 1], ["SP", 3, 23, 1, [1, 1], 1], ["SP", 3, 26, 1, [1, 1], 1], ["RE", 3, [0, 5, 10, 15, 1, 6, 11, 16, 2, 7, 12, 17, 20, 23, 26, 21, 24, 27, 3, 8, 13, 18, 22, 25, 28, 4, 9, 14, 19]], ["FSP", 4, 0, 1, 3], ["FSP", 4, 4, 2, 3], ["FSP", 4, 8, 3, 3], ["FSP", 4, 12, 4, 3], ["RE", 4, [0, 4, 8, 12, 1, 5, 9, 13, 2, 6, 10, 14, 3, 7, 11, 15]], ["CA", 3, 4, 11], ["CHR", 2, "shared", [3]], ["CA", 3, 4, 14], ["CHR", 1, "shared", [4]], ["CA", 2, 5, 14], ["CI", 1], ["FU", 6, [0, 1, 2, 3]], ["AN", 6, 0, 5], ["FU", 6, [1, 2, 3, 4]], ["AN", 6, 1, 4], ["FU", 6, [2, 3, 4, 5]], ["AN", 6, 2, 6], ["FU", 4, [0, 1, 2, 3]], ["SP", 4, 0, 4, [1], 1], ["AN", 4, 1, 2], ["FFSP", 4, 0, [4, 3, 2, 1], 1, 1], ["AN", 4, 1, 6], ["FU", 2, [0, 1, 2, 3]], ["SP", 2, 0, 112, [1], 1], ["AN", 2, 1, 2], ["FFSP", 2, 0, [4, 3, 2, 1], 1, 1], ["AN", 2, 1, 6], ["PR", 5, 0, "auto_unroll_max_step$0"]]]], "r": [[0.131314], 0, 5.32438, 1638331536], "v": "v0.6"}
{"i": [["[\"conv2d_layer\", 128, 64, 56, 56, 256, 1, 1, 1, 0]", "rocm -keys=rocm,gpu -max_num_threads=256 -mcpu=gfx906 -mtriple=amdgcn-amd-amdhsa-hcc -thread_warp_size=64", [-1, 16, 64, 65536, 2147483647, 1024, 16, 64], "", 0, []], [[], [["CHW", 3, "local"], ["SP", 3, 0, 128, [4, 8, 2, 2], 1], ["SP", 3, 5, 256, [1, 2, 2, 4], 1], ["SP", 3, 10, 56, [1, 4, 1, 7], 1], ["SP", 3, 15, 56, [1, 1, 1, 1], 1], ["SP", 3, 20, 64, [2, 1], 1], ["SP", 3, 23, 1, [1, 1], 1], ["SP", 3, 26, 1, [1, 1], 1], ["RE", 3, [0, 5, 10, 15, 1, 6, 11, 16, 2, 7, 12, 17, 20, 23, 26, 21, 24, 27, 3, 8, 13, 18, 22, 25, 28, 4, 9, 14, 19]], ["FSP", 4, 0, 1, 3], ["FSP", 4, 4, 2, 3], ["FSP", 4, 8, 3, 3], ["FSP", 4, 12, 4, 3], ["RE", 4, [0, 4, 8, 12, 1, 5, 9, 13, 2, 6, 10, 14, 3, 7, 11, 15]], ["CA", 3, 4, 11], ["CHR", 2, "shared", [3]], ["CA", 3, 4, 14], ["CHR", 1, "shared", [4]], ["CA", 2, 5, 14], ["CI", 1], ["FU", 6, [0, 1, 2, 3]], ["AN", 6, 0, 5], ["FU", 6, [1, 2, 3, 4]], ["AN", 6, 1, 4], ["FU", 6, [2, 3, 4, 5]], ["AN", 6, 2, 6], ["FU", 4, [0, 1, 2, 3]], ["SP", 4, 0, 16, [1], 1], ["AN", 4, 1, 2], ["FFSP", 4, 0, [4, 3, 2, 1], 1, 1], ["AN", 4, 1, 6], ["FU", 2, [0, 1, 2, 3]], ["SP", 2, 0, 56, [1], 1], ["AN", 2, 1, 2], ["FFSP", 2, 0, [4, 3, 2, 1], 1, 1], ["AN", 2, 1, 6], ["PR", 5, 0, "auto_unroll_max_step$64"]]]], "r": [[0.336832], 0, 6.51735, 1638331541], "v": "v0.6"}
{"i": [["[\"conv2d_layer\", 128, 64, 56, 56, 256, 1, 1, 1, 0]", "rocm -keys=rocm,gpu -max_num_threads=256 -mcpu=gfx906 -mtriple=amdgcn-amd-amdhsa-hcc -thread_warp_size=64", [-1, 16, 64, 65536, 2147483647, 1024, 16, 64], "", 0, []], [[], [["CHW", 3, "local"], ["SP", 3, 0, 128, [1, 8, 8, 2], 1], ["SP", 3, 5, 256, [1, 16, 16, 1], 1], ["SP", 3, 10, 56, [4, 1, 1, 2], 1], ["SP", 3, 15, 56, [1, 1, 4, 1], 1], ["SP", 3, 20, 64, [2, 1], 1], ["SP", 3, 23, 1, [1, 1], 1], ["SP", 3, 26, 1, [1, 1], 1], ["RE", 3, [0, 5, 10, 15, 1, 6, 11, 16, 2, 7, 12, 17, 20, 23, 26, 21, 24, 27, 3, 8, 13, 18, 22, 25, 28, 4, 9, 14, 19]], ["FSP", 4, 0, 1, 3], ["FSP", 4, 4, 2, 3], ["FSP", 4, 8, 3, 3], ["FSP", 4, 12, 4, 3], ["RE", 4, [0, 4, 8, 12, 1, 5, 9, 13, 2, 6, 10, 14, 3, 7, 11, 15]], ["CA", 3, 4, 11], ["CHR", 2, "shared", [3]], ["CA", 3, 4, 14], ["CHR", 1, "shared", [4]], ["CA", 2, 5, 14], ["CI", 1], ["FU", 6, [0, 1, 2, 3]], ["AN", 6, 0, 5], ["FU", 6, [1, 2, 3, 4]], ["AN", 6, 1, 4], ["FU", 6, [2, 3, 4, 5]], ["AN", 6, 2, 6], ["FU", 4, [0, 1, 2, 3]], ["SP", 4, 0, 16, [1], 1], ["AN", 4, 1, 2], ["FFSP", 4, 0, [4, 3, 2, 1], 1, 1], ["AN", 4, 1, 6], ["FU", 2, [0, 1, 2, 3]], ["SP", 2, 0, 64, [1], 1], ["AN", 2, 1, 2], ["FFSP", 2, 0, [4, 3, 2, 1], 1, 1], ["AN", 2, 1, 6], ["PR", 5, 0, "auto_unroll_max_step$0"]]]], "r": [[0.36377], 0, 6.83526, 1638331546], "v": "v0.6"}
{"i": [["[\"conv2d_layer\", 128, 64, 56, 56, 256, 1, 1, 1, 0]", "rocm -keys=rocm,gpu -max_num_threads=256 -mcpu=gfx906 -mtriple=amdgcn-amd-amdhsa-hcc -thread_warp_size=64", [-1, 16, 64, 65536, 2147483647, 1024, 16, 64], "", 0, []], [[], [["CHW", 3, "local"], ["SP", 3, 0, 128, [1, 1, 1, 1], 1], ["SP", 3, 5, 256, [2, 32, 2, 2], 1], ["SP", 3, 10, 56, [1, 2, 7, 2], 1], ["SP", 3, 15, 56, [1, 1, 7, 1], 1], ["SP", 3, 20, 64, [1, 2], 1], ["SP", 3, 23, 1, [1, 1], 1], ["SP", 3, 26, 1, [1, 1], 1], ["RE", 3, [0, 5, 10, 15, 1, 6, 11, 16, 2, 7, 12, 17, 20, 23, 26, 21, 24, 27, 3, 8, 13, 18, 22, 25, 28, 4, 9, 14, 19]], ["FSP", 4, 0, 1, 3], ["FSP", 4, 4, 2, 3], ["FSP", 4, 8, 3, 3], ["FSP", 4, 12, 4, 3], ["RE", 4, [0, 4, 8, 12, 1, 5, 9, 13, 2, 6, 10, 14, 3, 7, 11, 15]], ["CA", 3, 4, 11], ["CHR", 2, "shared", [3]], ["CA", 3, 4, 14], ["CHR", 1, "shared", [4]], ["CA", 2, 5, 14], ["CI", 1], ["FU", 6, [0, 1, 2, 3]], ["AN", 6, 0, 5], ["FU", 6, [1, 2, 3, 4]], ["AN", 6, 1, 4], ["FU", 6, [2, 3, 4, 5]], ["AN", 6, 2, 6], ["FU", 4, [0, 1, 2, 3]], ["SP", 4, 0, 8, [1], 1], ["AN", 4, 1, 2], ["FFSP", 4, 0, [4, 3, 2, 1], 1, 1], ["AN", 4, 1, 6], ["FU", 2, [0, 1, 2, 3]], ["SP", 2, 0, 196, [28], 1], ["AN", 2, 1, 2], ["FFSP", 2, 0, [4, 3, 2, 1], 1, 1], ["AN", 2, 1, 6], ["PR", 5, 0, "auto_unroll_max_step$64"]]]], "r": [[0.0479411], 0, 5.15196, 1638331560], "v": "v0.6"}
{"i": [["[\"conv2d_layer\", 128, 64, 56, 56, 256, 1, 1, 1, 0]", "rocm -keys=rocm,gpu -max_num_threads=256 -mcpu=gfx906 -mtriple=amdgcn-amd-amdhsa-hcc -thread_warp_size=64", [-1, 16, 64, 65536, 2147483647, 1024, 16, 64], "", 0, []], [[], [["CHW", 3, "local"], ["SP", 3, 0, 128, [1, 1, 1, 1], 1], ["SP", 3, 5, 256, [1, 32, 4, 2], 1], ["SP", 3, 10, 56, [7, 2, 4, 1], 1], ["SP", 3, 15, 56, [2, 2, 1, 2], 1], ["SP", 3, 20, 64, [8, 1], 1], ["SP", 3, 23, 1, [1, 1], 1], ["SP", 3, 26, 1, [1, 1], 1], ["RE", 3, [0, 5, 10, 15, 1, 6, 11, 16, 2, 7, 12, 17, 20, 23, 26, 21, 24, 27, 3, 8, 13, 18, 22, 25, 28, 4, 9, 14, 19]], ["FSP", 4, 0, 1, 3], ["FSP", 4, 4, 2, 3], ["FSP", 4, 8, 3, 3], ["FSP", 4, 12, 4, 3], ["RE", 4, [0, 4, 8, 12, 1, 5, 9, 13, 2, 6, 10, 14, 3, 7, 11, 15]], ["CA", 3, 4, 11], ["CHR", 2, "shared", [3]], ["CA", 3, 4, 14], ["CHR", 1, "shared", [4]], ["CA", 2, 5, 14], ["CI", 1], ["FU", 6, [0, 1, 2, 3]], ["AN", 6, 0, 5], ["FU", 6, [1, 2, 3, 4]], ["AN", 6, 1, 4], ["FU", 6, [2, 3, 4, 5]], ["AN", 6, 2, 6], ["FU", 4, [0, 1, 2, 3]], ["SP", 4, 0, 64, [1], 1], ["AN", 4, 1, 2], ["FFSP", 4, 0, [4, 3, 2, 1], 1, 1], ["AN", 4, 1, 6], ["FU", 2, [0, 1, 2, 3]], ["SP", 2, 0, 32, [1], 1], ["AN", 2, 1, 2], ["FFSP", 2, 0, [4, 3, 2, 1], 1, 1], ["AN", 2, 1, 6], ["PR", 5, 0, "auto_unroll_max_step$16"]]]], "r": [[0.184501], 0, 5.59265, 1638331564], "v": "v0.6"}
{"i": [["[\"conv2d_layer\", 128, 64, 56, 56, 256, 1, 1, 1, 0]", "rocm -keys=rocm,gpu -max_num_threads=256 -mcpu=gfx906 -mtriple=amdgcn-amd-amdhsa-hcc -thread_warp_size=64", [-1, 16, 64, 65536, 2147483647, 1024, 16, 64], "", 0, []], [[], [["CHW", 3, "local"], ["SP", 3, 0, 128, [1, 4, 32, 1], 1], ["SP", 3, 5, 256, [1, 8, 2, 8], 1], ["SP", 3, 10, 56, [1, 1, 4, 1], 1], ["SP", 3, 15, 56, [1, 4, 1, 2], 1], ["SP", 3, 20, 64, [1, 1], 1], ["SP", 3, 23, 1, [1, 1], 1], ["SP", 3, 26, 1, [1, 1], 1], ["RE", 3, [0, 5, 10, 15, 1, 6, 11, 16, 2, 7, 12, 17, 20, 23, 26, 21, 24, 27, 3, 8, 13, 18, 22, 25, 28, 4, 9, 14, 19]], ["FSP", 4, 0, 1, 3], ["FSP", 4, 4, 2, 3], ["FSP", 4, 8, 3, 3], ["FSP", 4, 12, 4, 3], ["RE", 4, [0, 4, 8, 12, 1, 5, 9, 13, 2, 6, 10, 14, 3, 7, 11, 15]], ["CA", 3, 4, 11], ["CHR", 2, "shared", [3]], ["CA", 3, 4, 14], ["CHR", 1, "shared", [4]], ["CA", 2, 5, 14], ["CI", 1], ["FU", 6, [0, 1, 2, 3]], ["AN", 6, 0, 5], ["FU", 6, [1, 2, 3, 4]], ["AN", 6, 1, 4], ["FU", 6, [2, 3, 4, 5]], ["AN", 6, 2, 6], ["FU", 4, [0, 1, 2, 3]], ["SP", 4, 0, 32, [1], 1], ["AN", 4, 1, 2], ["FFSP", 4, 0, [4, 3, 2, 1], 1, 1], ["AN", 4, 1, 6], ["FU", 2, [0, 1, 2, 3]], ["SP", 2, 0, 512, [1], 1], ["AN", 2, 1, 2], ["FFSP", 2, 0, [4, 3, 2, 1], 1, 1], ["AN", 2, 1, 6], ["PR", 5, 0, "auto_unroll_max_step$512"]]]], "r": [[0.176538], 0, 5.86584, 1638331569], "v": "v0.6"}
{"i": [["[\"conv2d_layer\", 128, 64, 56, 56, 256, 1, 1, 1, 0]", "rocm -keys=rocm,gpu -max_num_threads=256 -mcpu=gfx906 -mtriple=amdgcn-amd-amdhsa-hcc -thread_warp_size=64", [-1, 16, 64, 65536, 2147483647, 1024, 16, 64], "", 0, []], [[], [["CHW", 3, "local"], ["SP", 3, 0, 128, [1, 1, 1, 16], 1], ["SP", 3, 5, 256, [4, 16, 2, 2], 1], ["SP", 3, 10, 56, [1, 1, 2, 2], 1], ["SP", 3, 15, 56, [4, 7, 1, 2], 1], ["SP", 3, 20, 64, [1, 1], 1], ["SP", 3, 23, 1, [1, 1], 1], ["SP", 3, 26, 1, [1, 1], 1], ["RE", 3, [0, 5, 10, 15, 1, 6, 11, 16, 2, 7, 12, 17, 20, 23, 26, 21, 24, 27, 3, 8, 13, 18, 22, 25, 28, 4, 9, 14, 19]], ["FSP", 4, 0, 1, 3], ["FSP", 4, 4, 2, 3], ["FSP", 4, 8, 3, 3], ["FSP", 4, 12, 4, 3], ["RE", 4, [0, 4, 8, 12, 1, 5, 9, 13, 2, 6, 10, 14, 3, 7, 11, 15]], ["CA", 3, 4, 11], ["CHR", 2, "shared", [3]], ["CA", 3, 4, 14], ["CHR", 1, "shared", [4]], ["CA", 2, 5, 14], ["CI", 1], ["FU", 6, [0, 1, 2, 3]], ["AN", 6, 0, 5], ["FU", 6, [1, 2, 3, 4]], ["AN", 6, 1, 4], ["FU", 6, [2, 3, 4, 5]], ["AN", 6, 2, 6], ["FU", 4, [0, 1, 2, 3]], ["SP", 4, 0, 4, [4], 1], ["AN", 4, 1, 2], ["FFSP", 4, 0, [4, 3, 2, 1], 1, 1], ["AN", 4, 1, 6], ["FU", 2, [0, 1, 2, 3]], ["SP", 2, 0, 128, [1], 1], ["AN", 2, 1, 2], ["FFSP", 2, 0, [4, 3, 2, 1], 1, 1], ["AN", 2, 1, 6], ["PR", 5, 0, "auto_unroll_max_step$512"]]]], "r": [[0.220134], 0, 7.31827, 1638331573], "v": "v0.6"}
{"i": [["[\"conv2d_layer\", 128, 64, 56, 56, 256, 1, 1, 1, 0]", "rocm -keys=rocm,gpu -max_num_threads=256 -mcpu=gfx906 -mtriple=amdgcn-amd-amdhsa-hcc -thread_warp_size=64", [-1, 16, 64, 65536, 2147483647, 1024, 16, 64], "", 0, []], [[], [["CHW", 3, "local"], ["SP", 3, 0, 128, [4, 1, 8, 4], 1], ["SP", 3, 5, 256, [1, 4, 4, 4], 1], ["SP", 3, 10, 56, [1, 4, 1, 1], 1], ["SP", 3, 15, 56, [1, 14, 1, 1], 1], ["SP", 3, 20, 64, [1, 1], 1], ["SP", 3, 23, 1, [1, 1], 1], ["SP", 3, 26, 1, [1, 1], 1], ["RE", 3, [0, 5, 10, 15, 1, 6, 11, 16, 2, 7, 12, 17, 20, 23, 26, 21, 24, 27, 3, 8, 13, 18, 22, 25, 28, 4, 9, 14, 19]], ["FSP", 4, 0, 1, 3], ["FSP", 4, 4, 2, 3], ["FSP", 4, 8, 3, 3], ["FSP", 4, 12, 4, 3], ["RE", 4, [0, 4, 8, 12, 1, 5, 9, 13, 2, 6, 10, 14, 3, 7, 11, 15]], ["CA", 3, 4, 11], ["CHR", 2, "shared", [3]], ["CA", 3, 4, 14], ["CHR", 1, "shared", [4]], ["CA", 2, 5, 14], ["CI", 1], ["FU", 6, [0, 1, 2, 3]], ["AN", 6, 0, 5], ["FU", 6, [1, 2, 3, 4]], ["AN", 6, 1, 4], ["FU", 6, [2, 3, 4, 5]], ["AN", 6, 2, 6], ["FU", 4, [0, 1, 2, 3]], ["SP", 4, 0, 16, [1], 1], ["AN", 4, 1, 2], ["FFSP", 4, 0, [4, 3, 2, 1], 1, 1], ["AN", 4, 1, 6], ["FU", 2, [0, 1, 2, 3]], ["SP", 2, 0, 32, [1], 1], ["AN", 2, 1, 2], ["FFSP", 2, 0, [4, 3, 2, 1], 1, 1], ["AN", 2, 1, 6], ["PR", 5, 0, "auto_unroll_max_step$16"]]]], "r": [[0.132497], 0, 5.24887, 1638331577], "v": "v0.6"}
{"i": [["[\"conv2d_layer\", 128, 64, 56, 56, 256, 1, 1, 1, 0]", "rocm -keys=rocm,gpu -max_num_threads=256 -mcpu=gfx906 -mtriple=amdgcn-amd-amdhsa-hcc -thread_warp_size=64", [-1, 16, 64, 65536, 2147483647, 1024, 16, 64], "", 0, []], [[], [["CHW", 3, "local"], ["SP", 3, 0, 128, [1, 1, 1, 1], 1], ["SP", 3, 5, 256, [2, 32, 2, 2], 1], ["SP", 3, 10, 56, [1, 2, 7, 2], 1], ["SP", 3, 15, 56, [1, 1, 7, 1], 1], ["SP", 3, 20, 64, [1, 2], 1], ["SP", 3, 23, 1, [1, 1], 1], ["SP", 3, 26, 1, [1, 1], 1], ["RE", 3, [0, 5, 10, 15, 1, 6, 11, 16, 2, 7, 12, 17, 20, 23, 26, 21, 24, 27, 3, 8, 13, 18, 22, 25, 28, 4, 9, 14, 19]], ["FSP", 4, 0, 1, 3], ["FSP", 4, 4, 2, 3], ["FSP", 4, 8, 3, 3], ["FSP", 4, 12, 4, 3], ["RE", 4, [0, 4, 8, 12, 1, 5, 9, 13, 2, 6, 10, 14, 3, 7, 11, 15]], ["CA", 3, 4, 11], ["CHR", 2, "shared", [3]], ["CA", 3, 4, 14], ["CHR", 1, "shared", [4]], ["CA", 2, 5, 14], ["CI", 1], ["FU", 6, [0, 1, 2, 3]], ["AN", 6, 0, 5], ["FU", 6, [1, 2, 3, 4]], ["AN", 6, 1, 4], ["FU", 6, [2, 3, 4, 5]], ["AN", 6, 2, 6], ["FU", 4, [0, 1, 2, 3]], ["SP", 4, 0, 8, [4], 1], ["AN", 4, 1, 2], ["FFSP", 4, 0, [4, 3, 2, 1], 1, 1], ["AN", 4, 1, 6], ["FU", 2, [0, 1, 2, 3]], ["SP", 2, 0, 196, [28], 1], ["AN", 2, 1, 2], ["FFSP", 2, 0, [4, 3, 2, 1], 1, 1], ["AN", 2, 1, 6], ["PR", 5, 0, "auto_unroll_max_step$64"]]]], "r": [[0.0480528], 0, 5.16028, 1638331581], "v": "v0.6"}
{"i": [["[\"conv2d_layer\", 128, 64, 56, 56, 256, 1, 1, 1, 0]", "rocm -keys=rocm,gpu -max_num_threads=256 -mcpu=gfx906 -mtriple=amdgcn-amd-amdhsa-hcc -thread_warp_size=64", [-1, 16, 64, 65536, 2147483647, 1024, 16, 64], "", 0, []], [[], [["CHW", 3, "local"], ["SP", 3, 0, 128, [1, 2, 32, 1], 1], ["SP", 3, 5, 256, [1, 32, 8, 1], 1], ["SP", 3, 10, 56, [1, 1, 1, 2], 1], ["SP", 3, 15, 56, [1, 1, 1, 4], 1], ["SP", 3, 20, 64, [4, 1], 1], ["SP", 3, 23, 1, [1, 1], 1], ["SP", 3, 26, 1, [1, 1], 1], ["RE", 3, [0, 5, 10, 15, 1, 6, 11, 16, 2, 7, 12, 17, 20, 23, 26, 21, 24, 27, 3, 8, 13, 18, 22, 25, 28, 4, 9, 14, 19]], ["FSP", 4, 0, 1, 3], ["FSP", 4, 4, 2, 3], ["FSP", 4, 8, 3, 3], ["FSP", 4, 12, 4, 3], ["RE", 4, [0, 4, 8, 12, 1, 5, 9, 13, 2, 6, 10, 14, 3, 7, 11, 15]], ["CA", 3, 4, 11], ["CHR", 2, "shared", [3]], ["CA", 3, 4, 14], ["CHR", 1, "shared", [4]], ["CA", 2, 5, 14], ["CI", 1], ["FU", 6, [0, 1, 2, 3]], ["AN", 6, 0, 5], ["FU", 6, [1, 2, 3, 4]], ["AN", 6, 1, 4], ["FU", 6, [2, 3, 4, 5]], ["AN", 6, 2, 6], ["FU", 4, [0, 1, 2, 3]], ["SP", 4, 0, 32, [1], 1], ["AN", 4, 1, 2], ["FFSP", 4, 0, [4, 3, 2, 1], 1, 1], ["AN", 4, 1, 6], ["FU", 2, [0, 1, 2, 3]], ["SP", 2, 0, 256, [1], 1], ["AN", 2, 1, 2], ["FFSP", 2, 0, [4, 3, 2, 1], 1, 1], ["AN", 2, 1, 6], ["PR", 5, 0, "auto_unroll_max_step$512"]]]], "r": [[0.149745], 0, 5.95709, 1638331586], "v": "v0.6"}
{"i": [["[\"conv2d_layer\", 128, 64, 56, 56, 256, 1, 1, 1, 0]", "rocm -keys=rocm,gpu -max_num_threads=256 -mcpu=gfx906 -mtriple=amdgcn-amd-amdhsa-hcc -thread_warp_size=64", [-1, 16, 64, 65536, 2147483647, 1024, 16, 64], "", 0, []], [[], [["CHW", 3, "local"], ["SP", 3, 0, 128, [2, 2, 4, 1], 1], ["SP", 3, 5, 256, [4, 8, 2, 2], 1], ["SP", 3, 10, 56, [1, 2, 1, 2], 1], ["SP", 3, 15, 56, [1, 2, 1, 1], 1], ["SP", 3, 20, 64, [2, 1], 1], ["SP", 3, 23, 1, [1, 1], 1], ["SP", 3, 26, 1, [1, 1], 1], ["RE", 3, [0, 5, 10, 15, 1, 6, 11, 16, 2, 7, 12, 17, 20, 23, 26, 21, 24, 27, 3, 8, 13, 18, 22, 25, 28, 4, 9, 14, 19]], ["FSP", 4, 0, 1, 3], ["FSP", 4, 4, 2, 3], ["FSP", 4, 8, 3, 3], ["FSP", 4, 12, 4, 3], ["RE", 4, [0, 4, 8, 12, 1, 5, 9, 13, 2, 6, 10, 14, 3, 7, 11, 15]], ["CA", 3, 4, 11], ["CHR", 2, "shared", [3]], ["CA", 3, 4, 14], ["CHR", 1, "shared", [4]], ["CA", 2, 5, 14], ["CI", 1], ["FU", 6, [0, 1, 2, 3]], ["AN", 6, 0, 5], ["FU", 6, [1, 2, 3, 4]], ["AN", 6, 1, 4], ["FU", 6, [2, 3, 4, 5]], ["AN", 6, 2, 6], ["FU", 4, [0, 1, 2, 3]], ["SP", 4, 0, 32, [4], 1], ["AN", 4, 1, 2], ["FFSP", 4, 0, [4, 3, 2, 1], 1, 1], ["AN", 4, 1, 6], ["FU", 2, [0, 1, 2, 3]], ["SP", 2, 0, 448, [1], 1], ["AN", 2, 1, 2], ["FFSP", 2, 0, [4, 3, 2, 1], 1, 1], ["AN", 2, 1, 6], ["PR", 5, 0, "auto_unroll_max_step$0"]]]], "r": [[0.0923126], 0, 5.90472, 1638331590], "v": "v0.6"}
{"i": [["[\"conv2d_layer\", 128, 64, 56, 56, 256, 1, 1, 1, 0]", "rocm -keys=rocm,gpu -max_num_threads=256 -mcpu=gfx906 -mtriple=amdgcn-amd-amdhsa-hcc -thread_warp_size=64", [-1, 16, 64, 65536, 2147483647, 1024, 16, 64], "", 0, []], [[], [["CHW", 3, "local"], ["SP", 3, 0, 128, [2, 64, 1, 1], 1], ["SP", 3, 5, 256, [2, 2, 4, 1], 1], ["SP", 3, 10, 56, [1, 7, 2, 1], 1], ["SP", 3, 15, 56, [1, 1, 1, 1], 1], ["SP", 3, 20, 64, [8, 1], 1], ["SP", 3, 23, 1, [1, 1], 1], ["SP", 3, 26, 1, [1, 1], 1], ["RE", 3, [0, 5, 10, 15, 1, 6, 11, 16, 2, 7, 12, 17, 20, 23, 26, 21, 24, 27, 3, 8, 13, 18, 22, 25, 28, 4, 9, 14, 19]], ["FSP", 4, 0, 1, 3], ["FSP", 4, 4, 2, 3], ["FSP", 4, 8, 3, 3], ["FSP", 4, 12, 4, 3], ["RE", 4, [0, 4, 8, 12, 1, 5, 9, 13, 2, 6, 10, 14, 3, 7, 11, 15]], ["CA", 3, 4, 11], ["CHR", 2, "shared", [3]], ["CA", 3, 4, 14], ["CHR", 1, "shared", [4]], ["CA", 2, 5, 14], ["CI", 1], ["FU", 6, [0, 1, 2, 3]], ["AN", 6, 0, 5], ["FU", 6, [1, 2, 3, 4]], ["AN", 6, 1, 4], ["FU", 6, [2, 3, 4, 5]], ["AN", 6, 2, 6], ["FU", 4, [0, 1, 2, 3]], ["SP", 4, 0, 16, [1], 1], ["AN", 4, 1, 2], ["FFSP", 4, 0, [4, 3, 2, 1], 1, 1], ["AN", 4, 1, 6], ["FU", 2, [0, 1, 2, 3]], ["SP", 2, 0, 8, [1], 1], ["AN", 2, 1, 2], ["FFSP", 2, 0, [4, 3, 2, 1], 1, 1], ["AN", 2, 1, 6], ["PR", 5, 0, "auto_unroll_max_step$64"]]]], "r": [[0.0436649], 0, 4.79839, 1638331594], "v": "v0.6"}
{"i": [["[\"conv2d_layer\", 128, 64, 56, 56, 256, 1, 1, 1, 0]", "rocm -keys=rocm,gpu -max_num_threads=256 -mcpu=gfx906 -mtriple=amdgcn-amd-amdhsa-hcc -thread_warp_size=64", [-1, 16, 64, 65536, 2147483647, 1024, 16, 64], "", 0, []], [[], [["CHW", 3, "local"], ["SP", 3, 0, 128, [1, 1, 1, 1], 1], ["SP", 3, 5, 256, [2, 32, 2, 2], 1], ["SP", 3, 10, 56, [1, 2, 7, 2], 1], ["SP", 3, 15, 56, [1, 1, 14, 1], 1], ["SP", 3, 20, 64, [1, 2], 1], ["SP", 3, 23, 1, [1, 1], 1], ["SP", 3, 26, 1, [1, 1], 1], ["RE", 3, [0, 5, 10, 15, 1, 6, 11, 16, 2, 7, 12, 17, 20, 23, 26, 21, 24, 27, 3, 8, 13, 18, 22, 25, 28, 4, 9, 14, 19]], ["FSP", 4, 0, 1, 3], ["FSP", 4, 4, 2, 3], ["FSP", 4, 8, 3, 3], ["FSP", 4, 12, 4, 3], ["RE", 4, [0, 4, 8, 12, 1, 5, 9, 13, 2, 6, 10, 14, 3, 7, 11, 15]], ["CA", 3, 4, 11], ["CHR", 2, "shared", [3]], ["CA", 3, 4, 14], ["CHR", 1, "shared", [4]], ["CA", 2, 5, 14], ["CI", 1], ["FU", 6, [0, 1, 2, 3]], ["AN", 6, 0, 5], ["FU", 6, [1, 2, 3, 4]], ["AN", 6, 1, 4], ["FU", 6, [2, 3, 4, 5]], ["AN", 6, 2, 6], ["FU", 4, [0, 1, 2, 3]], ["SP", 4, 0, 8, [4], 1], ["AN", 4, 1, 2], ["FFSP", 4, 0, [4, 3, 2, 1], 1, 1], ["AN", 4, 1, 6], ["FU", 2, [0, 1, 2, 3]], ["SP", 2, 0, 196, [4], 1], ["AN", 2, 1, 2], ["FFSP", 2, 0, [4, 3, 2, 1], 1, 1], ["AN", 2, 1, 6], ["PR", 5, 0, "auto_unroll_max_step$64"]]]], "r": [[0.0454497], 0, 5.21278, 1638331598], "v": "v0.6"}
{"i": [["[\"conv2d_layer\", 128, 64, 56, 56, 256, 1, 1, 1, 0]", "rocm -keys=rocm,gpu -max_num_threads=256 -mcpu=gfx906 -mtriple=amdgcn-amd-amdhsa-hcc -thread_warp_size=64", [-1, 16, 64, 65536, 2147483647, 1024, 16, 64], "", 0, []], [[], [["CHW", 3, "local"], ["SP", 3, 0, 128, [1, 1, 1, 16], 1], ["SP", 3, 5, 256, [1, 2, 16, 2], 1], ["SP", 3, 10, 56, [1, 1, 2, 2], 1], ["SP", 3, 15, 56, [4, 7, 1, 2], 1], ["SP", 3, 20, 64, [1, 1], 1], ["SP", 3, 23, 1, [1, 1], 1], ["SP", 3, 26, 1, [1, 1], 1], ["RE", 3, [0, 5, 10, 15, 1, 6, 11, 16, 2, 7, 12, 17, 20, 23, 26, 21, 24, 27, 3, 8, 13, 18, 22, 25, 28, 4, 9, 14, 19]], ["FSP", 4, 0, 1, 3], ["FSP", 4, 4, 2, 3], ["FSP", 4, 8, 3, 3], ["FSP", 4, 12, 4, 3], ["RE", 4, [0, 4, 8, 12, 1, 5, 9, 13, 2, 6, 10, 14, 3, 7, 11, 15]], ["CA", 3, 4, 11], ["CHR", 2, "shared", [3]], ["CA", 3, 4, 14], ["CHR", 1, "shared", [4]], ["CA", 2, 5, 14], ["CI", 1], ["FU", 6, [0, 1, 2, 3]], ["AN", 6, 0, 5], ["FU", 6, [1, 2, 3, 4]], ["AN", 6, 1, 4], ["FU", 6, [2, 3, 4, 5]], ["AN", 6, 2, 6], ["FU", 4, [0, 1, 2, 3]], ["SP", 4, 0, 4, [1], 1], ["AN", 4, 1, 2], ["FFSP", 4, 0, [4, 3, 2, 1], 1, 1], ["AN", 4, 1, 6], ["FU", 2, [0, 1, 2, 3]], ["SP", 2, 0, 128, [1], 1], ["AN", 2, 1, 2], ["FFSP", 2, 0, [4, 3, 2, 1], 1, 1], ["AN", 2, 1, 6], ["PR", 5, 0, "auto_unroll_max_step$512"]]]], "r": [[0.726385], 0, 14.4474, 1638331605], "v": "v0.6"}
{"i": [["[\"conv2d_layer\", 128, 64, 56, 56, 256, 1, 1, 1, 0]", "rocm -keys=rocm,gpu -max_num_threads=256 -mcpu=gfx906 -mtriple=amdgcn-amd-amdhsa-hcc -thread_warp_size=64", [-1, 16, 64, 65536, 2147483647, 1024, 16, 64], "", 0, []], [[], [["CHW", 3, "local"], ["SP", 3, 0, 128, [1, 1, 2, 2], 1], ["SP", 3, 5, 256, [1, 8, 4, 1], 1], ["SP", 3, 10, 56, [1, 8, 7, 1], 1], ["SP", 3, 15, 56, [4, 1, 7, 1], 1], ["SP", 3, 20, 64, [1, 1], 1], ["SP", 3, 23, 1, [1, 1], 1], ["SP", 3, 26, 1, [1, 1], 1], ["RE", 3, [0, 5, 10, 15, 1, 6, 11, 16, 2, 7, 12, 17, 20, 23, 26, 21, 24, 27, 3, 8, 13, 18, 22, 25, 28, 4, 9, 14, 19]], ["FSP", 4, 0, 1, 3], ["FSP", 4, 4, 2, 3], ["FSP", 4, 8, 3, 3], ["FSP", 4, 12, 4, 3], ["RE", 4, [0, 4, 8, 12, 1, 5, 9, 13, 2, 6, 10, 14, 3, 7, 11, 15]], ["CA", 3, 4, 11], ["CHR", 2, "shared", [3]], ["CA", 3, 4, 14], ["CHR", 1, "shared", [4]], ["CA", 2, 5, 14], ["CI", 1], ["FU", 6, [0, 1, 2, 3]], ["AN", 6, 0, 5], ["FU", 6, [1, 2, 3, 4]], ["AN", 6, 1, 4], ["FU", 6, [2, 3, 4, 5]], ["AN", 6, 2, 6], ["FU", 4, [0, 1, 2, 3]], ["SP", 4, 0, 8, [4], 1], ["AN", 4, 1, 2], ["FFSP", 4, 0, [4, 3, 2, 1], 1, 1], ["AN", 4, 1, 6], ["FU", 2, [0, 1, 2, 3]], ["SP", 2, 0, 392, [1], 1], ["AN", 2, 1, 2], ["FFSP", 2, 0, [4, 3, 2, 1], 1, 1], ["AN", 2, 1, 6], ["PR", 5, 0, "auto_unroll_max_step$64"]]]], "r": [[0.362449], 0, 7.88618, 1638331610], "v": "v0.6"}
{"i": [["[\"conv2d_layer\", 128, 64, 56, 56, 256, 1, 1, 1, 0]", "rocm -keys=rocm,gpu -max_num_threads=256 -mcpu=gfx906 -mtriple=amdgcn-amd-amdhsa-hcc -thread_warp_size=64", [-1, 16, 64, 65536, 2147483647, 1024, 16, 64], "", 0, []], [[], [["CHW", 3, "local"], ["SP", 3, 0, 128, [8, 4, 2, 1], 1], ["SP", 3, 5, 256, [1, 32, 4, 2], 1], ["SP", 3, 10, 56, [2, 2, 1, 1], 1], ["SP", 3, 15, 56, [1, 1, 2, 1], 1], ["SP", 3, 20, 64, [16, 1], 1], ["SP", 3, 23, 1, [1, 1], 1], ["SP", 3, 26, 1, [1, 1], 1], ["RE", 3, [0, 5, 10, 15, 1, 6, 11, 16, 2, 7, 12, 17, 20, 23, 26, 21, 24, 27, 3, 8, 13, 18, 22, 25, 28, 4, 9, 14, 19]], ["FSP", 4, 0, 1, 3], ["FSP", 4, 4, 2, 3], ["FSP", 4, 8, 3, 3], ["FSP", 4, 12, 4, 3], ["RE", 4, [0, 4, 8, 12, 1, 5, 9, 13, 2, 6, 10, 14, 3, 7, 11, 15]], ["CA", 3, 4, 11], ["CHR", 2, "shared", [3]], ["CA", 3, 4, 14], ["CHR", 1, "shared", [4]], ["CA", 2, 5, 14], ["CI", 1], ["FU", 6, [0, 1, 2, 3]], ["AN", 6, 0, 5], ["FU", 6, [1, 2, 3, 4]], ["AN", 6, 1, 4], ["FU", 6, [2, 3, 4, 5]], ["AN", 6, 2, 6], ["FU", 4, [0, 1, 2, 3]], ["SP", 4, 0, 32, [1], 1], ["AN", 4, 1, 2], ["FFSP", 4, 0, [4, 3, 2, 1], 1, 1], ["AN", 4, 1, 6], ["FU", 2, [0, 1, 2, 3]], ["SP", 2, 0, 64, [1], 1], ["AN", 2, 1, 2], ["FFSP", 2, 0, [4, 3, 2, 1], 1, 1], ["AN", 2, 1, 6], ["PR", 5, 0, "auto_unroll_max_step$512"]]]], "r": [[0.150721], 0, 9.12805, 1638331614], "v": "v0.6"}
{"i": [["[\"conv2d_layer\", 128, 64, 56, 56, 256, 1, 1, 1, 0]", "rocm -keys=rocm,gpu -max_num_threads=256 -mcpu=gfx906 -mtriple=amdgcn-amd-amdhsa-hcc -thread_warp_size=64", [-1, 16, 64, 65536, 2147483647, 1024, 16, 64], "", 0, []], [[], [["CHW", 3, "local"], ["SP", 3, 0, 128, [1, 4, 2, 8], 1], ["SP", 3, 5, 256, [1, 32, 2, 2], 1], ["SP", 3, 10, 56, [14, 1, 1, 2], 1], ["SP", 3, 15, 56, [1, 2, 1, 1], 1], ["SP", 3, 20, 64, [1, 2], 1], ["SP", 3, 23, 1, [1, 1], 1], ["SP", 3, 26, 1, [1, 1], 1], ["RE", 3, [0, 5, 10, 15, 1, 6, 11, 16, 2, 7, 12, 17, 20, 23, 26, 21, 24, 27, 3, 8, 13, 18, 22, 25, 28, 4, 9, 14, 19]], ["FSP", 4, 0, 1, 3], ["FSP", 4, 4, 2, 3], ["FSP", 4, 8, 3, 3], ["FSP", 4, 12, 4, 3], ["RE", 4, [0, 4, 8, 12, 1, 5, 9, 13, 2, 6, 10, 14, 3, 7, 11, 15]], ["CA", 3, 4, 11], ["CHR", 2, "shared", [3]], ["CA", 3, 4, 14], ["CHR", 1, "shared", [4]], ["CA", 2, 5, 14], ["CI", 1], ["FU", 6, [0, 1, 2, 3]], ["AN", 6, 0, 5], ["FU", 6, [1, 2, 3, 4]], ["AN", 6, 1, 4], ["FU", 6, [2, 3, 4, 5]], ["AN", 6, 2, 6], ["FU", 4, [0, 1, 2, 3]], ["SP", 4, 0, 8, [8], 1], ["AN", 4, 1, 2], ["FFSP", 4, 0, [4, 3, 2, 1], 1, 1], ["AN", 4, 1, 6], ["FU", 2, [0, 1, 2, 3]], ["SP", 2, 0, 64, [1], 1], ["AN", 2, 1, 2], ["FFSP", 2, 0, [4, 3, 2, 1], 1, 1], ["AN", 2, 1, 6], ["PR", 5, 0, "auto_unroll_max_step$512"]]]], "r": [[0.172709], 0, 10.1078, 1638331619], "v": "v0.6"}
{"i": [["[\"conv2d_layer\", 128, 64, 56, 56, 256, 1, 1, 1, 0]", "rocm -keys=rocm,gpu -max_num_threads=256 -mcpu=gfx906 -mtriple=amdgcn-amd-amdhsa-hcc -thread_warp_size=64", [-1, 16, 64, 65536, 2147483647, 1024, 16, 64], "", 0, []], [[], [["CHW", 3, "local"], ["SP", 3, 0, 128, [8, 1, 1, 1], 1], ["SP", 3, 5, 256, [2, 32, 4, 1], 1], ["SP", 3, 10, 56, [1, 14, 1, 2], 1], ["SP", 3, 15, 56, [1, 1, 1, 1], 1], ["SP", 3, 20, 64, [8, 2], 1], ["SP", 3, 23, 1, [1, 1], 1], ["SP", 3, 26, 1, [1, 1], 1], ["RE", 3, [0, 5, 10, 15, 1, 6, 11, 16, 2, 7, 12, 17, 20, 23, 26, 21, 24, 27, 3, 8, 13, 18, 22, 25, 28, 4, 9, 14, 19]], ["FSP", 4, 0, 1, 3], ["FSP", 4, 4, 2, 3], ["FSP", 4, 8, 3, 3], ["FSP", 4, 12, 4, 3], ["RE", 4, [0, 4, 8, 12, 1, 5, 9, 13, 2, 6, 10, 14, 3, 7, 11, 15]], ["CA", 3, 4, 11], ["CHR", 2, "shared", [3]], ["CA", 3, 4, 14], ["CHR", 1, "shared", [4]], ["CA", 2, 5, 14], ["CI", 1], ["FU", 6, [0, 1, 2, 3]], ["AN", 6, 0, 5], ["FU", 6, [1, 2, 3, 4]], ["AN", 6, 1, 4], ["FU", 6, [2, 3, 4, 5]], ["AN", 6, 2, 6], ["FU", 4, [0, 1, 2, 3]], ["SP", 4, 0, 128, [1], 1], ["AN", 4, 1, 2], ["FFSP", 4, 0, [4, 3, 2, 1], 1, 1], ["AN", 4, 1, 6], ["FU", 2, [0, 1, 2, 3]], ["SP", 2, 0, 64, [1], 1], ["AN", 2, 1, 2], ["FFSP", 2, 0, [4, 3, 2, 1], 1, 1], ["AN", 2, 1, 6], ["PR", 5, 0, "auto_unroll_max_step$512"]]]], "r": [[0.0822444], 0, 5.90279, 1638331623], "v": "v0.6"}
{"i": [["[\"conv2d_layer\", 128, 64, 56, 56, 256, 1, 1, 1, 0]", "rocm -keys=rocm,gpu -max_num_threads=256 -mcpu=gfx906 -mtriple=amdgcn-amd-amdhsa-hcc -thread_warp_size=64", [-1, 16, 64, 65536, 2147483647, 1024, 16, 64], "", 0, []], [[], [["CHW", 3, "local"], ["SP", 3, 0, 128, [1, 4, 1, 16], 1], ["SP", 3, 5, 256, [1, 4, 8, 2], 1], ["SP", 3, 10, 56, [1, 2, 1, 1], 1], ["SP", 3, 15, 56, [1, 2, 1, 7], 1], ["SP", 3, 20, 64, [4, 2], 1], ["SP", 3, 23, 1, [1, 1], 1], ["SP", 3, 26, 1, [1, 1], 1], ["RE", 3, [0, 5, 10, 15, 1, 6, 11, 16, 2, 7, 12, 17, 20, 23, 26, 21, 24, 27, 3, 8, 13, 18, 22, 25, 28, 4, 9, 14, 19]], ["FSP", 4, 0, 1, 3], ["FSP", 4, 4, 2, 3], ["FSP", 4, 8, 3, 3], ["FSP", 4, 12, 4, 3], ["RE", 4, [0, 4, 8, 12, 1, 5, 9, 13, 2, 6, 10, 14, 3, 7, 11, 15]], ["CA", 3, 4, 11], ["CHR", 2, "shared", [3]], ["CA", 3, 4, 14], ["CHR", 1, "shared", [4]], ["CA", 2, 5, 14], ["CI", 1], ["FU", 6, [0, 1, 2, 3]], ["AN", 6, 0, 5], ["FU", 6, [1, 2, 3, 4]], ["AN", 6, 1, 4], ["FU", 6, [2, 3, 4, 5]], ["AN", 6, 2, 6], ["FU", 4, [0, 1, 2, 3]], ["SP", 4, 0, 64, [1], 1], ["AN", 4, 1, 2], ["FFSP", 4, 0, [4, 3, 2, 1], 1, 1], ["AN", 4, 1, 6], ["FU", 2, [0, 1, 2, 3]], ["SP", 2, 0, 896, [1], 1], ["AN", 2, 1, 2], ["FFSP", 2, 0, [4, 3, 2, 1], 1, 1], ["AN", 2, 1, 6], ["PR", 5, 0, "auto_unroll_max_step$1024"]]]], "r": [[0.535721], 0, 12.5706, 1638331629], "v": "v0.6"}
{"i": [["[\"conv2d_layer\", 128, 64, 56, 56, 256, 1, 1, 1, 0]", "rocm -keys=rocm,gpu -max_num_threads=256 -mcpu=gfx906 -mtriple=amdgcn-amd-amdhsa-hcc -thread_warp_size=64", [-1, 16, 64, 65536, 2147483647, 1024, 16, 64], "", 0, []], [[], [["CHW", 3, "local"], ["SP", 3, 0, 128, [1, 16, 1, 2], 1], ["SP", 3, 5, 256, [1, 4, 1, 2], 1], ["SP", 3, 10, 56, [2, 7, 1, 2], 1], ["SP", 3, 15, 56, [1, 2, 1, 4], 1], ["SP", 3, 20, 64, [1, 2], 1], ["SP", 3, 23, 1, [1, 1], 1], ["SP", 3, 26, 1, [1, 1], 1], ["RE", 3, [0, 5, 10, 15, 1, 6, 11, 16, 2, 7, 12, 17, 20, 23, 26, 21, 24, 27, 3, 8, 13, 18, 22, 25, 28, 4, 9, 14, 19]], ["FSP", 4, 0, 1, 3], ["FSP", 4, 4, 2, 3], ["FSP", 4, 8, 3, 3], ["FSP", 4, 12, 4, 3], ["RE", 4, [0, 4, 8, 12, 1, 5, 9, 13, 2, 6, 10, 14, 3, 7, 11, 15]], ["CA", 3, 4, 11], ["CHR", 2, "shared", [3]], ["CA", 3, 4, 14], ["CHR", 1, "shared", [4]], ["CA", 2, 5, 14], ["CI", 1], ["FU", 6, [0, 1, 2, 3]], ["AN", 6, 0, 5], ["FU", 6, [1, 2, 3, 4]], ["AN", 6, 1, 4], ["FU", 6, [2, 3, 4, 5]], ["AN", 6, 2, 6], ["FU", 4, [0, 1, 2, 3]], ["SP", 4, 0, 4, [1], 1], ["AN", 4, 1, 2], ["FFSP", 4, 0, [4, 3, 2, 1], 1, 1], ["AN", 4, 1, 6], ["FU", 2, [0, 1, 2, 3]], ["SP", 2, 0, 32, [4], 1], ["AN", 2, 1, 2], ["FFSP", 2, 0, [4, 3, 2, 1], 1, 1], ["AN", 2, 1, 6], ["PR", 5, 0, "auto_unroll_max_step$0"]]]], "r": [[0.0851843], 0, 5.01445, 1638331633], "v": "v0.6"}
{"i": [["[\"conv2d_layer\", 128, 64, 56, 56, 256, 1, 1, 1, 0]", "rocm -keys=rocm,gpu -max_num_threads=256 -mcpu=gfx906 -mtriple=amdgcn-amd-amdhsa-hcc -thread_warp_size=64", [-1, 16, 64, 65536, 2147483647, 1024, 16, 64], "", 0, []], [[], [["CHW", 3, "local"], ["SP", 3, 0, 128, [1, 32, 2, 1], 1], ["SP", 3, 5, 256, [2, 2, 1, 8], 1], ["SP", 3, 10, 56, [2, 1, 1, 1], 1], ["SP", 3, 15, 56, [1, 1, 1, 2], 1], ["SP", 3, 20, 64, [8, 2], 1], ["SP", 3, 23, 1, [1, 1], 1], ["SP", 3, 26, 1, [1, 1], 1], ["RE", 3, [0, 5, 10, 15, 1, 6, 11, 16, 2, 7, 12, 17, 20, 23, 26, 21, 24, 27, 3, 8, 13, 18, 22, 25, 28, 4, 9, 14, 19]], ["FSP", 4, 0, 1, 3], ["FSP", 4, 4, 2, 3], ["FSP", 4, 8, 3, 3], ["FSP", 4, 12, 4, 3], ["RE", 4, [0, 4, 8, 12, 1, 5, 9, 13, 2, 6, 10, 14, 3, 7, 11, 15]], ["CA", 3, 4, 11], ["CHR", 2, "shared", [3]], ["CA", 3, 4, 14], ["CHR", 1, "shared", [4]], ["CA", 2, 5, 14], ["CI", 1], ["FU", 6, [0, 1, 2, 3]], ["AN", 6, 0, 5], ["FU", 6, [1, 2, 3, 4]], ["AN", 6, 1, 4], ["FU", 6, [2, 3, 4, 5]], ["AN", 6, 2, 6], ["FU", 4, [0, 1, 2, 3]], ["SP", 4, 0, 128, [1], 1], ["AN", 4, 1, 2], ["FFSP", 4, 0, [4, 3, 2, 1], 1, 1], ["AN", 4, 1, 6], ["FU", 2, [0, 1, 2, 3]], ["SP", 2, 0, 32, [1], 1], ["AN", 2, 1, 2], ["FFSP", 2, 0, [4, 3, 2, 1], 1, 1], ["AN", 2, 1, 6], ["PR", 5, 0, "auto_unroll_max_step$1024"]]]], "r": [[0.171804], 0, 6.2664, 1638331641], "v": "v0.6"}
{"i": [["[\"conv2d_layer\", 128, 64, 56, 56, 256, 1, 1, 1, 0]", "rocm -keys=rocm,gpu -max_num_threads=256 -mcpu=gfx906 -mtriple=amdgcn-amd-amdhsa-hcc -thread_warp_size=64", [-1, 16, 64, 65536, 2147483647, 1024, 16, 64], "", 0, []], [[], [["CHW", 3, "local"], ["SP", 3, 0, 128, [4, 32, 1, 1], 1], ["SP", 3, 5, 256, [2, 1, 1, 32], 1], ["SP", 3, 10, 56, [2, 1, 1, 2], 1], ["SP", 3, 15, 56, [1, 2, 2, 2], 1], ["SP", 3, 20, 64, [1, 1], 1], ["SP", 3, 23, 1, [1, 1], 1], ["SP", 3, 26, 1, [1, 1], 1], ["RE", 3, [0, 5, 10, 15, 1, 6, 11, 16, 2, 7, 12, 17, 20, 23, 26, 21, 24, 27, 3, 8, 13, 18, 22, 25, 28, 4, 9, 14, 19]], ["FSP", 4, 0, 1, 3], ["FSP", 4, 4, 2, 3], ["FSP", 4, 8, 3, 3], ["FSP", 4, 12, 4, 3], ["RE", 4, [0, 4, 8, 12, 1, 5, 9, 13, 2, 6, 10, 14, 3, 7, 11, 15]], ["CA", 3, 4, 11], ["CHR", 2, "shared", [3]], ["CA", 3, 4, 14], ["CHR", 1, "shared", [4]], ["CA", 2, 5, 14], ["CI", 1], ["FU", 6, [0, 1, 2, 3]], ["AN", 6, 0, 5], ["FU", 6, [1, 2, 3, 4]], ["AN", 6, 1, 4], ["FU", 6, [2, 3, 4, 5]], ["AN", 6, 2, 6], ["FU", 4, [0, 1, 2, 3]], ["SP", 4, 0, 32, [1], 1], ["AN", 4, 1, 2], ["FFSP", 4, 0, [4, 3, 2, 1], 1, 1], ["AN", 4, 1, 6], ["FU", 2, [0, 1, 2, 3]], ["SP", 2, 0, 8, [1], 1], ["AN", 2, 1, 2], ["FFSP", 2, 0, [4, 3, 2, 1], 1, 1], ["AN", 2, 1, 6], ["PR", 5, 0, "auto_unroll_max_step$512"]]]], "r": [[0.314324], 0, 6.9915, 1638331646], "v": "v0.6"}
{"i": [["[\"conv2d_layer\", 128, 64, 56, 56, 256, 1, 1, 1, 0]", "rocm -keys=rocm,gpu -max_num_threads=256 -mcpu=gfx906 -mtriple=amdgcn-amd-amdhsa-hcc -thread_warp_size=64", [-1, 16, 64, 65536, 2147483647, 1024, 16, 64], "", 0, []], [[], [["CHW", 3, "local"], ["SP", 3, 0, 128, [1, 8, 2, 1], 1], ["SP", 3, 5, 256, [4, 4, 8, 2], 1], ["SP", 3, 10, 56, [1, 7, 1, 1], 1], ["SP", 3, 15, 56, [1, 2, 2, 1], 1], ["SP", 3, 20, 64, [1, 8], 1], ["SP", 3, 23, 1, [1, 1], 1], ["SP", 3, 26, 1, [1, 1], 1], ["RE", 3, [0, 5, 10, 15, 1, 6, 11, 16, 2, 7, 12, 17, 20, 23, 26, 21, 24, 27, 3, 8, 13, 18, 22, 25, 28, 4, 9, 14, 19]], ["FSP", 4, 0, 1, 3], ["FSP", 4, 4, 2, 3], ["FSP", 4, 8, 3, 3], ["FSP", 4, 12, 4, 3], ["RE", 4, [0, 4, 8, 12, 1, 5, 9, 13, 2, 6, 10, 14, 3, 7, 11, 15]], ["CA", 3, 4, 11], ["CHR", 2, "shared", [3]], ["CA", 3, 4, 14], ["CHR", 1, "shared", [4]], ["CA", 2, 5, 14], ["CI", 1], ["FU", 6, [0, 1, 2, 3]], ["AN", 6, 0, 5], ["FU", 6, [1, 2, 3, 4]], ["AN", 6, 1, 4], ["FU", 6, [2, 3, 4, 5]], ["AN", 6, 2, 6], ["FU", 4, [0, 1, 2, 3]], ["SP", 4, 0, 128, [32], 1], ["AN", 4, 1, 2], ["FFSP", 4, 0, [4, 3, 2, 1], 1, 1], ["AN", 4, 1, 6], ["FU", 2, [0, 1, 2, 3]], ["SP", 2, 0, 64, [64], 1], ["AN", 2, 1, 2], ["FFSP", 2, 0, [4, 3, 2, 1], 1, 1], ["AN", 2, 1, 6], ["PR", 5, 0, "auto_unroll_max_step$16"]]]], "r": [[0.018176], 0, 5.001, 1638331660], "v": "v0.6"}
{"i": [["[\"conv2d_layer\", 128, 64, 56, 56, 256, 1, 1, 1, 0]", "rocm -keys=rocm,gpu -max_num_threads=256 -mcpu=gfx906 -mtriple=amdgcn-amd-amdhsa-hcc -thread_warp_size=64", [-1, 16, 64, 65536, 2147483647, 1024, 16, 64], "", 0, []], [[], [["CHW", 3, "local"], ["SP", 3, 0, 128, [1, 2, 1, 2], 1], ["SP", 3, 5, 256, [2, 4, 1, 32], 1], ["SP", 3, 10, 56, [1, 1, 2, 7], 1], ["SP", 3, 15, 56, [1, 4, 1, 14], 1], ["SP", 3, 20, 64, [1, 1], 1], ["SP", 3, 23, 1, [1, 1], 1], ["SP", 3, 26, 1, [1, 1], 1], ["RE", 3, [0, 5, 10, 15, 1, 6, 11, 16, 2, 7, 12, 17, 20, 23, 26, 21, 24, 27, 3, 8, 13, 18, 22, 25, 28, 4, 9, 14, 19]], ["FSP", 4, 0, 1, 3], ["FSP", 4, 4, 2, 3], ["FSP", 4, 8, 3, 3], ["FSP", 4, 12, 4, 3], ["RE", 4, [0, 4, 8, 12, 1, 5, 9, 13, 2, 6, 10, 14, 3, 7, 11, 15]], ["CA", 3, 4, 11], ["CHR", 2, "shared", [3]], ["CA", 3, 4, 14], ["CHR", 1, "shared", [4]], ["CA", 2, 5, 14], ["CI", 1], ["FU", 6, [0, 1, 2, 3]], ["AN", 6, 0, 5], ["FU", 6, [1, 2, 3, 4]], ["AN", 6, 1, 4], ["FU", 6, [2, 3, 4, 5]], ["AN", 6, 2, 6], ["FU", 4, [0, 1, 2, 3]], ["SP", 4, 0, 32, [1], 1], ["AN", 4, 1, 2], ["FFSP", 4, 0, [4, 3, 2, 1], 1, 1], ["AN", 4, 1, 6], ["FU", 2, [0, 1, 2, 3]], ["SP", 2, 0, 196, [1], 1], ["AN", 2, 1, 2], ["FFSP", 2, 0, [4, 3, 2, 1], 1, 1], ["AN", 2, 1, 6], ["PR", 5, 0, "auto_unroll_max_step$0"]]]], "r": [[0.501692], 0, 7.48511, 1638331666], "v": "v0.6"}
{"i": [["[\"conv2d_layer\", 128, 64, 56, 56, 256, 1, 1, 1, 0]", "rocm -keys=rocm,gpu -max_num_threads=256 -mcpu=gfx906 -mtriple=amdgcn-amd-amdhsa-hcc -thread_warp_size=64", [-1, 16, 64, 65536, 2147483647, 1024, 16, 64], "", 0, []], [[], [["CHW", 3, "local"], ["SP", 3, 0, 128, [1, 8, 8, 1], 1], ["SP", 3, 5, 256, [2, 64, 1, 1], 1], ["SP", 3, 10, 56, [1, 1, 1, 7], 1], ["SP", 3, 15, 56, [4, 1, 1, 7], 1], ["SP", 3, 20, 64, [1, 1], 1], ["SP", 3, 23, 1, [1, 1], 1], ["SP", 3, 26, 1, [1, 1], 1], ["RE", 3, [0, 5, 10, 15, 1, 6, 11, 16, 2, 7, 12, 17, 20, 23, 26, 21, 24, 27, 3, 8, 13, 18, 22, 25, 28, 4, 9, 14, 19]], ["FSP", 4, 0, 1, 3], ["FSP", 4, 4, 2, 3], ["FSP", 4, 8, 3, 3], ["FSP", 4, 12, 4, 3], ["RE", 4, [0, 4, 8, 12, 1, 5, 9, 13, 2, 6, 10, 14, 3, 7, 11, 15]], ["CA", 3, 4, 11], ["CHR", 2, "shared", [3]], ["CA", 3, 4, 14], ["CHR", 1, "shared", [4]], ["CA", 2, 5, 14], ["CI", 1], ["FU", 6, [0, 1, 2, 3]], ["AN", 6, 0, 5], ["FU", 6, [1, 2, 3, 4]], ["AN", 6, 1, 4], ["FU", 6, [2, 3, 4, 5]], ["AN", 6, 2, 6], ["FU", 4, [0, 1, 2, 3]], ["SP", 4, 0, 1, [1], 1], ["AN", 4, 1, 2], ["FFSP", 4, 0, [4, 3, 2, 1], 1, 1], ["AN", 4, 1, 6], ["FU", 2, [0, 1, 2, 3]], ["SP", 2, 0, 1568, [1], 1], ["AN", 2, 1, 2], ["FFSP", 2, 0, [4, 3, 2, 1], 1, 1], ["AN", 2, 1, 6], ["PR", 5, 0, "auto_unroll_max_step$16"]]]], "r": [[0.194412], 0, 5.49444, 1638331680], "v": "v0.6"}
{"i": [["[\"conv2d_layer\", 128, 64, 56, 56, 256, 1, 1, 1, 0]", "rocm -keys=rocm,gpu -max_num_threads=256 -mcpu=gfx906 -mtriple=amdgcn-amd-amdhsa-hcc -thread_warp_size=64", [-1, 16, 64, 65536, 2147483647, 1024, 16, 64], "", 0, []], [[], [["CHW", 3, "local"], ["SP", 3, 0, 128, [1, 2, 32, 1], 1], ["SP", 3, 5, 256, [1, 32, 8, 1], 1], ["SP", 3, 10, 56, [1, 1, 1, 2], 1], ["SP", 3, 15, 56, [1, 1, 1, 2], 1], ["SP", 3, 20, 64, [4, 1], 1], ["SP", 3, 23, 1, [1, 1], 1], ["SP", 3, 26, 1, [1, 1], 1], ["RE", 3, [0, 5, 10, 15, 1, 6, 11, 16, 2, 7, 12, 17, 20, 23, 26, 21, 24, 27, 3, 8, 13, 18, 22, 25, 28, 4, 9, 14, 19]], ["FSP", 4, 0, 1, 3], ["FSP", 4, 4, 2, 3], ["FSP", 4, 8, 3, 3], ["FSP", 4, 12, 4, 3], ["RE", 4, [0, 4, 8, 12, 1, 5, 9, 13, 2, 6, 10, 14, 3, 7, 11, 15]], ["CA", 3, 4, 11], ["CHR", 2, "shared", [3]], ["CA", 3, 4, 14], ["CHR", 1, "shared", [4]], ["CA", 2, 5, 14], ["CI", 1], ["FU", 6, [0, 1, 2, 3]], ["AN", 6, 0, 5], ["FU", 6, [1, 2, 3, 4]], ["AN", 6, 1, 4], ["FU", 6, [2, 3, 4, 5]], ["AN", 6, 2, 6], ["FU", 4, [0, 1, 2, 3]], ["SP", 4, 0, 32, [1], 1], ["AN", 4, 1, 2], ["FFSP", 4, 0, [4, 3, 2, 1], 1, 1], ["AN", 4, 1, 6], ["FU", 2, [0, 1, 2, 3]], ["SP", 2, 0, 256, [1], 1], ["AN", 2, 1, 2], ["FFSP", 2, 0, [4, 3, 2, 1], 1, 1], ["AN", 2, 1, 6], ["PR", 5, 0, "auto_unroll_max_step$16"]]]], "r": [[0.123494], 0, 5.21765, 1638331684], "v": "v0.6"}
{"i": [["[\"conv2d_layer\", 128, 64, 56, 56, 256, 1, 1, 1, 0]", "rocm -keys=rocm,gpu -max_num_threads=256 -mcpu=gfx906 -mtriple=amdgcn-amd-amdhsa-hcc -thread_warp_size=64", [-1, 16, 64, 65536, 2147483647, 1024, 16, 64], "", 0, []], [[], [["CHW", 3, "local"], ["SP", 3, 0, 128, [2, 2, 1, 1], 1], ["SP", 3, 5, 256, [1, 8, 8, 4], 1], ["SP", 3, 10, 56, [1, 1, 2, 7], 1], ["SP", 3, 15, 56, [1, 4, 2, 7], 1], ["SP", 3, 20, 64, [1, 1], 1], ["SP", 3, 23, 1, [1, 1], 1], ["SP", 3, 26, 1, [1, 1], 1], ["RE", 3, [0, 5, 10, 15, 1, 6, 11, 16, 2, 7, 12, 17, 20, 23, 26, 21, 24, 27, 3, 8, 13, 18, 22, 25, 28, 4, 9, 14, 19]], ["FSP", 4, 0, 1, 3], ["FSP", 4, 4, 2, 3], ["FSP", 4, 8, 3, 3], ["FSP", 4, 12, 4, 3], ["RE", 4, [0, 4, 8, 12, 1, 5, 9, 13, 2, 6, 10, 14, 3, 7, 11, 15]], ["CA", 3, 4, 11], ["CHR", 2, "shared", [3]], ["CA", 3, 4, 14], ["CHR", 1, "shared", [4]], ["CA", 2, 5, 14], ["CI", 1], ["FU", 6, [0, 1, 2, 3]], ["AN", 6, 0, 5], ["FU", 6, [1, 2, 3, 4]], ["AN", 6, 1, 4], ["FU", 6, [2, 3, 4, 5]], ["AN", 6, 2, 6], ["FU", 4, [0, 1, 2, 3]], ["SP", 4, 0, 32, [1], 1], ["AN", 4, 1, 2], ["FFSP", 4, 0, [4, 3, 2, 1], 1, 1], ["AN", 4, 1, 6], ["FU", 2, [0, 1, 2, 3]], ["SP", 2, 0, 196, [1], 1], ["AN", 2, 1, 2], ["FFSP", 2, 0, [4, 3, 2, 1], 1, 1], ["AN", 2, 1, 6], ["PR", 5, 0, "auto_unroll_max_step$64"]]]], "r": [[0.241685], 0, 7.1161, 1638331702], "v": "v0.6"}
{"i": [["[\"conv2d_layer\", 128, 64, 56, 56, 256, 1, 1, 1, 0]", "rocm -keys=rocm,gpu -max_num_threads=256 -mcpu=gfx906 -mtriple=amdgcn-amd-amdhsa-hcc -thread_warp_size=64", [-1, 16, 64, 65536, 2147483647, 1024, 16, 64], "", 0, []], [[], [["CHW", 3, "local"], ["SP", 3, 0, 128, [2, 1, 1, 1], 1], ["SP", 3, 5, 256, [1, 8, 8, 4], 1], ["SP", 3, 10, 56, [1, 1, 2, 7], 1], ["SP", 3, 15, 56, [1, 4, 1, 14], 1], ["SP", 3, 20, 64, [1, 1], 1], ["SP", 3, 23, 1, [1, 1], 1], ["SP", 3, 26, 1, [1, 1], 1], ["RE", 3, [0, 5, 10, 15, 1, 6, 11, 16, 2, 7, 12, 17, 20, 23, 26, 21, 24, 27, 3, 8, 13, 18, 22, 25, 28, 4, 9, 14, 19]], ["FSP", 4, 0, 1, 3], ["FSP", 4, 4, 2, 3], ["FSP", 4, 8, 3, 3], ["FSP", 4, 12, 4, 3], ["RE", 4, [0, 4, 8, 12, 1, 5, 9, 13, 2, 6, 10, 14, 3, 7, 11, 15]], ["CA", 3, 4, 11], ["CHR", 2, "shared", [3]], ["CA", 3, 4, 14], ["CHR", 1, "shared", [4]], ["CA", 2, 5, 14], ["CI", 1], ["FU", 6, [0, 1, 2, 3]], ["AN", 6, 0, 5], ["FU", 6, [1, 2, 3, 4]], ["AN", 6, 1, 4], ["FU", 6, [2, 3, 4, 5]], ["AN", 6, 2, 6], ["FU", 4, [0, 1, 2, 3]], ["SP", 4, 0, 32, [1], 1], ["AN", 4, 1, 2], ["FFSP", 4, 0, [4, 3, 2, 1], 1, 1], ["AN", 4, 1, 6], ["FU", 2, [0, 1, 2, 3]], ["SP", 2, 0, 196, [1], 1], ["AN", 2, 1, 2], ["FFSP", 2, 0, [4, 3, 2, 1], 1, 1], ["AN", 2, 1, 6], ["PR", 5, 0, "auto_unroll_max_step$0"]]]], "r": [[0.283075], 0, 6.77643, 1638331727], "v": "v0.6"}
{"i": [["[\"conv2d_layer\", 128, 64, 56, 56, 256, 1, 1, 1, 0]", "rocm -keys=rocm,gpu -max_num_threads=256 -mcpu=gfx906 -mtriple=amdgcn-amd-amdhsa-hcc -thread_warp_size=64", [-1, 16, 64, 65536, 2147483647, 1024, 16, 64], "", 0, []], [[], [["CHW", 3, "local"], ["SP", 3, 0, 128, [1, 4, 1, 16], 1], ["SP", 3, 5, 256, [1, 2, 2, 32], 1], ["SP", 3, 10, 56, [1, 2, 1, 2], 1], ["SP", 3, 15, 56, [7, 4, 1, 2], 1], ["SP", 3, 20, 64, [1, 1], 1], ["SP", 3, 23, 1, [1, 1], 1], ["SP", 3, 26, 1, [1, 1], 1], ["RE", 3, [0, 5, 10, 15, 1, 6, 11, 16, 2, 7, 12, 17, 20, 23, 26, 21, 24, 27, 3, 8, 13, 18, 22, 25, 28, 4, 9, 14, 19]], ["FSP", 4, 0, 1, 3], ["FSP", 4, 4, 2, 3], ["FSP", 4, 8, 3, 3], ["FSP", 4, 12, 4, 3], ["RE", 4, [0, 4, 8, 12, 1, 5, 9, 13, 2, 6, 10, 14, 3, 7, 11, 15]], ["CA", 3, 4, 11], ["CHR", 2, "shared", [3]], ["CA", 3, 4, 14], ["CHR", 1, "shared", [4]], ["CA", 2, 5, 14], ["CI", 1], ["FU", 6, [0, 1, 2, 3]], ["AN", 6, 0, 5], ["FU", 6, [1, 2, 3, 4]], ["AN", 6, 1, 4], ["FU", 6, [2, 3, 4, 5]], ["AN", 6, 2, 6], ["FU", 4, [0, 1, 2, 3]], ["SP", 4, 0, 64, [1], 1], ["AN", 4, 1, 2], ["FFSP", 4, 0, [4, 3, 2, 1], 1, 1], ["AN", 4, 1, 6], ["FU", 2, [0, 1, 2, 3]], ["SP", 2, 0, 64, [1], 1], ["AN", 2, 1, 2], ["FFSP", 2, 0, [4, 3, 2, 1], 1, 1], ["AN", 2, 1, 6], ["PR", 5, 0, "auto_unroll_max_step$16"]]]], "r": [[0.639609], 0, 7.65281, 1638331734], "v": "v0.6"}
{"i": [["[\"conv2d_layer\", 128, 64, 56, 56, 256, 1, 1, 1, 0]", "rocm -keys=rocm,gpu -max_num_threads=256 -mcpu=gfx906 -mtriple=amdgcn-amd-amdhsa-hcc -thread_warp_size=64", [-1, 16, 64, 65536, 2147483647, 1024, 16, 64], "", 0, []], [[], [["CHW", 3, "local"], ["SP", 3, 0, 128, [1, 2, 32, 1], 1], ["SP", 3, 5, 256, [1, 32, 8, 1], 1], ["SP", 3, 10, 56, [1, 1, 1, 2], 1], ["SP", 3, 15, 56, [1, 2, 1, 1], 1], ["SP", 3, 20, 64, [2, 2], 1], ["SP", 3, 23, 1, [1, 1], 1], ["SP", 3, 26, 1, [1, 1], 1], ["RE", 3, [0, 5, 10, 15, 1, 6, 11, 16, 2, 7, 12, 17, 20, 23, 26, 21, 24, 27, 3, 8, 13, 18, 22, 25, 28, 4, 9, 14, 19]], ["FSP", 4, 0, 1, 3], ["FSP", 4, 4, 2, 3], ["FSP", 4, 8, 3, 3], ["FSP", 4, 12, 4, 3], ["RE", 4, [0, 4, 8, 12, 1, 5, 9, 13, 2, 6, 10, 14, 3, 7, 11, 15]], ["CA", 3, 4, 11], ["CHR", 2, "shared", [3]], ["CA", 3, 4, 14], ["CHR", 1, "shared", [4]], ["CA", 2, 5, 14], ["CI", 1], ["FU", 6, [0, 1, 2, 3]], ["AN", 6, 0, 5], ["FU", 6, [1, 2, 3, 4]], ["AN", 6, 1, 4], ["FU", 6, [2, 3, 4, 5]], ["AN", 6, 2, 6], ["FU", 4, [0, 1, 2, 3]], ["SP", 4, 0, 32, [1], 1], ["AN", 4, 1, 2], ["FFSP", 4, 0, [4, 3, 2, 1], 1, 1], ["AN", 4, 1, 6], ["FU", 2, [0, 1, 2, 3]], ["SP", 2, 0, 256, [64], 1], ["AN", 2, 1, 2], ["FFSP", 2, 0, [4, 3, 2, 1], 1, 1], ["AN", 2, 1, 6], ["PR", 5, 0, "auto_unroll_max_step$16"]]]], "r": [[0.0534973], 0, 4.69942, 1638331738], "v": "v0.6"}
{"i": [["[\"conv2d_layer\", 128, 64, 56, 56, 256, 1, 1, 1, 0]", "rocm -keys=rocm,gpu -max_num_threads=256 -mcpu=gfx906 -mtriple=amdgcn-amd-amdhsa-hcc -thread_warp_size=64", [-1, 16, 64, 65536, 2147483647, 1024, 16, 64], "", 0, []], [[], [["CHW", 3, "local"], ["SP", 3, 0, 128, [1, 4, 2, 8], 1], ["SP", 3, 5, 256, [1, 32, 2, 2], 1], ["SP", 3, 10, 56, [14, 1, 1, 2], 1], ["SP", 3, 15, 56, [1, 2, 1, 1], 1], ["SP", 3, 20, 64, [1, 2], 1], ["SP", 3, 23, 1, [1, 1], 1], ["SP", 3, 26, 1, [1, 1], 1], ["RE", 3, [0, 5, 10, 15, 1, 6, 11, 16, 2, 7, 12, 17, 20, 23, 26, 21, 24, 27, 3, 8, 13, 18, 22, 25, 28, 4, 9, 14, 19]], ["FSP", 4, 0, 1, 3], ["FSP", 4, 4, 2, 3], ["FSP", 4, 8, 3, 3], ["FSP", 4, 12, 4, 3], ["RE", 4, [0, 4, 8, 12, 1, 5, 9, 13, 2, 6, 10, 14, 3, 7, 11, 15]], ["CA", 3, 4, 11], ["CHR", 2, "shared", [3]], ["CA", 3, 4, 14], ["CHR", 1, "shared", [4]], ["CA", 2, 5, 14], ["CI", 1], ["FU", 6, [0, 1, 2, 3]], ["AN", 6, 0, 5], ["FU", 6, [1, 2, 3, 4]], ["AN", 6, 1, 4], ["FU", 6, [2, 3, 4, 5]], ["AN", 6, 2, 6], ["FU", 4, [0, 1, 2, 3]], ["SP", 4, 0, 8, [2], 1], ["AN", 4, 1, 2], ["FFSP", 4, 0, [4, 3, 2, 1], 1, 1], ["AN", 4, 1, 6], ["FU", 2, [0, 1, 2, 3]], ["SP", 2, 0, 64, [1], 1], ["AN", 2, 1, 2], ["FFSP", 2, 0, [4, 3, 2, 1], 1, 1], ["AN", 2, 1, 6], ["PR", 5, 0, "auto_unroll_max_step$512"]]]], "r": [[0.172683], 0, 10.0851, 1638331742], "v": "v0.6"}
{"i": [["[\"conv2d_layer\", 128, 64, 56, 56, 256, 1, 1, 1, 0]", "rocm -keys=rocm,gpu -max_num_threads=256 -mcpu=gfx906 -mtriple=amdgcn-amd-amdhsa-hcc -thread_warp_size=64", [-1, 16, 64, 65536, 2147483647, 1024, 16, 64], "", 0, []], [[], [["CHW", 3, "local"], ["SP", 3, 0, 128, [8, 1, 2, 1], 1], ["SP", 3, 5, 256, [1, 16, 8, 1], 1], ["SP", 3, 10, 56, [2, 1, 1, 14], 1], ["SP", 3, 15, 56, [1, 7, 2, 1], 1], ["SP", 3, 20, 64, [2, 1], 1], ["SP", 3, 23, 1, [1, 1], 1], ["SP", 3, 26, 1, [1, 1], 1], ["RE", 3, [0, 5, 10, 15, 1, 6, 11, 16, 2, 7, 12, 17, 20, 23, 26, 21, 24, 27, 3, 8, 13, 18, 22, 25, 28, 4, 9, 14, 19]], ["FSP", 4, 0, 1, 3], ["FSP", 4, 4, 2, 3], ["FSP", 4, 8, 3, 3], ["FSP", 4, 12, 4, 3], ["RE", 4, [0, 4, 8, 12, 1, 5, 9, 13, 2, 6, 10, 14, 3, 7, 11, 15]], ["CA", 3, 4, 11], ["CHR", 2, "shared", [3]], ["CA", 3, 4, 14], ["CHR", 1, "shared", [4]], ["CA", 2, 5, 14], ["CI", 1], ["FU", 6, [0, 1, 2, 3]], ["AN", 6, 0, 5], ["FU", 6, [1, 2, 3, 4]], ["AN", 6, 1, 4], ["FU", 6, [2, 3, 4, 5]], ["AN", 6, 2, 6], ["FU", 4, [0, 1, 2, 3]], ["SP", 4, 0, 16, [1], 1], ["AN", 4, 1, 2], ["FFSP", 4, 0, [4, 3, 2, 1], 1, 1], ["AN", 4, 1, 6], ["FU", 2, [0, 1, 2, 3]], ["SP", 2, 0, 112, [1], 1], ["AN", 2, 1, 2], ["FFSP", 2, 0, [4, 3, 2, 1], 1, 1], ["AN", 2, 1, 6], ["PR", 5, 0, "auto_unroll_max_step$512"]]]], "r": [[0.51857], 0, 13.4087, 1638331748], "v": "v0.6"}
{"i": [["[\"conv2d_layer\", 128, 64, 56, 56, 256, 1, 1, 1, 0]", "rocm -keys=rocm,gpu -max_num_threads=256 -mcpu=gfx906 -mtriple=amdgcn-amd-amdhsa-hcc -thread_warp_size=64", [-1, 16, 64, 65536, 2147483647, 1024, 16, 64], "", 0, []], [[], [["CHW", 3, "local"], ["SP", 3, 0, 128, [1, 2, 32, 1], 1], ["SP", 3, 5, 256, [1, 32, 8, 1], 1], ["SP", 3, 10, 56, [1, 1, 1, 2], 1], ["SP", 3, 15, 56, [1, 1, 2, 1], 1], ["SP", 3, 20, 64, [1, 2], 1], ["SP", 3, 23, 1, [1, 1], 1], ["SP", 3, 26, 1, [1, 1], 1], ["RE", 3, [0, 5, 10, 15, 1, 6, 11, 16, 2, 7, 12, 17, 20, 23, 26, 21, 24, 27, 3, 8, 13, 18, 22, 25, 28, 4, 9, 14, 19]], ["FSP", 4, 0, 1, 3], ["FSP", 4, 4, 2, 3], ["FSP", 4, 8, 3, 3], ["FSP", 4, 12, 4, 3], ["RE", 4, [0, 4, 8, 12, 1, 5, 9, 13, 2, 6, 10, 14, 3, 7, 11, 15]], ["CA", 3, 4, 11], ["CHR", 2, "shared", [3]], ["CA", 3, 4, 14], ["CHR", 1, "shared", [4]], ["CA", 2, 5, 14], ["CI", 1], ["FU", 6, [0, 1, 2, 3]], ["AN", 6, 0, 5], ["FU", 6, [1, 2, 3, 4]], ["AN", 6, 1, 4], ["FU", 6, [2, 3, 4, 5]], ["AN", 6, 2, 6], ["FU", 4, [0, 1, 2, 3]], ["SP", 4, 0, 32, [32], 1], ["AN", 4, 1, 2], ["FFSP", 4, 0, [4, 3, 2, 1], 1, 1], ["AN", 4, 1, 6], ["FU", 2, [0, 1, 2, 3]], ["SP", 2, 0, 256, [1], 1], ["AN", 2, 1, 2], ["FFSP", 2, 0, [4, 3, 2, 1], 1, 1], ["AN", 2, 1, 6], ["PR", 5, 0, "auto_unroll_max_step$16"]]]], "r": [[0.0583818], 0, 5.01918, 1638331757], "v": "v0.6"}
{"i": [["[\"conv2d_layer\", 128, 64, 56, 56, 256, 1, 1, 1, 0]", "rocm -keys=rocm,gpu -max_num_threads=256 -mcpu=gfx906 -mtriple=amdgcn-amd-amdhsa-hcc -thread_warp_size=64", [-1, 16, 64, 65536, 2147483647, 1024, 16, 64], "", 0, []], [[], [["CHW", 3, "local"], ["SP", 3, 0, 128, [1, 4, 1, 1], 1], ["SP", 3, 5, 256, [1, 2, 2, 2], 1], ["SP", 3, 10, 56, [1, 8, 1, 1], 1], ["SP", 3, 15, 56, [1, 4, 1, 2], 1], ["SP", 3, 20, 64, [16, 2], 1], ["SP", 3, 23, 1, [1, 1], 1], ["SP", 3, 26, 1, [1, 1], 1], ["RE", 3, [0, 5, 10, 15, 1, 6, 11, 16, 2, 7, 12, 17, 20, 23, 26, 21, 24, 27, 3, 8, 13, 18, 22, 25, 28, 4, 9, 14, 19]], ["FSP", 4, 0, 1, 3], ["FSP", 4, 4, 2, 3], ["FSP", 4, 8, 3, 3], ["FSP", 4, 12, 4, 3], ["RE", 4, [0, 4, 8, 12, 1, 5, 9, 13, 2, 6, 10, 14, 3, 7, 11, 15]], ["CA", 3, 4, 11], ["CHR", 2, "shared", [3]], ["CA", 3, 4, 14], ["CHR", 1, "shared", [4]], ["CA", 2, 5, 14], ["CI", 1], ["FU", 6, [0, 1, 2, 3]], ["AN", 6, 0, 5], ["FU", 6, [1, 2, 3, 4]], ["AN", 6, 1, 4], ["FU", 6, [2, 3, 4, 5]], ["AN", 6, 2, 6], ["FU", 4, [0, 1, 2, 3]], ["SP", 4, 0, 128, [1], 1], ["AN", 4, 1, 2], ["FFSP", 4, 0, [4, 3, 2, 1], 1, 1], ["AN", 4, 1, 6], ["FU", 2, [0, 1, 2, 3]], ["SP", 2, 0, 64, [1], 1], ["AN", 2, 1, 2], ["FFSP", 2, 0, [4, 3, 2, 1], 1, 1], ["AN", 2, 1, 6], ["PR", 5, 0, "auto_unroll_max_step$16"]]]], "r": [[0.0152449], 0, 4.35981, 1638331760], "v": "v0.6"}
{"i": [["[\"conv2d_layer\", 128, 64, 56, 56, 256, 1, 1, 1, 0]", "rocm -keys=rocm,gpu -max_num_threads=256 -mcpu=gfx906 -mtriple=amdgcn-amd-amdhsa-hcc -thread_warp_size=64", [-1, 16, 64, 65536, 2147483647, 1024, 16, 64], "", 0, []], [[], [["CHW", 3, "local"], ["SP", 3, 0, 128, [4, 16, 1, 2], 1], ["SP", 3, 5, 256, [2, 4, 1, 32], 1], ["SP", 3, 10, 56, [1, 1, 2, 2], 1], ["SP", 3, 15, 56, [1, 2, 2, 2], 1], ["SP", 3, 20, 64, [1, 1], 1], ["SP", 3, 23, 1, [1, 1], 1], ["SP", 3, 26, 1, [1, 1], 1], ["RE", 3, [0, 5, 10, 15, 1, 6, 11, 16, 2, 7, 12, 17, 20, 23, 26, 21, 24, 27, 3, 8, 13, 18, 22, 25, 28, 4, 9, 14, 19]], ["FSP", 4, 0, 1, 3], ["FSP", 4, 4, 2, 3], ["FSP", 4, 8, 3, 3], ["FSP", 4, 12, 4, 3], ["RE", 4, [0, 4, 8, 12, 1, 5, 9, 13, 2, 6, 10, 14, 3, 7, 11, 15]], ["CA", 3, 4, 11], ["CHR", 2, "shared", [3]], ["CA", 3, 4, 14], ["CHR", 1, "shared", [4]], ["CA", 2, 5, 14], ["CI", 1], ["FU", 6, [0, 1, 2, 3]], ["AN", 6, 0, 5], ["FU", 6, [1, 2, 3, 4]], ["AN", 6, 1, 4], ["FU", 6, [2, 3, 4, 5]], ["AN", 6, 2, 6], ["FU", 4, [0, 1, 2, 3]], ["SP", 4, 0, 32, [1], 1], ["AN", 4, 1, 2], ["FFSP", 4, 0, [4, 3, 2, 1], 1, 1], ["AN", 4, 1, 6], ["FU", 2, [0, 1, 2, 3]], ["SP", 2, 0, 8, [1], 1], ["AN", 2, 1, 2], ["FFSP", 2, 0, [4, 3, 2, 1], 1, 1], ["AN", 2, 1, 6], ["PR", 5, 0, "auto_unroll_max_step$16"]]]], "r": [[0.228968], 0, 6.14159, 1638331765], "v": "v0.6"}
{"i": [["[\"conv2d_layer\", 128, 64, 56, 56, 256, 1, 1, 1, 0]", "rocm -keys=rocm,gpu -max_num_threads=256 -mcpu=gfx906 -mtriple=amdgcn-amd-amdhsa-hcc -thread_warp_size=64", [-1, 16, 64, 65536, 2147483647, 1024, 16, 64], "", 0, []], [[], [["CHW", 3, "local"], ["SP", 3, 0, 128, [2, 2, 4, 1], 1], ["SP", 3, 5, 256, [4, 8, 2, 2], 1], ["SP", 3, 10, 56, [1, 2, 1, 2], 1], ["SP", 3, 15, 56, [1, 2, 1, 14], 1], ["SP", 3, 20, 64, [2, 4], 1], ["SP", 3, 23, 1, [1, 1], 1], ["SP", 3, 26, 1, [1, 1], 1], ["RE", 3, [0, 5, 10, 15, 1, 6, 11, 16, 2, 7, 12, 17, 20, 23, 26, 21, 24, 27, 3, 8, 13, 18, 22, 25, 28, 4, 9, 14, 19]], ["FSP", 4, 0, 1, 3], ["FSP", 4, 4, 2, 3], ["FSP", 4, 8, 3, 3], ["FSP", 4, 12, 4, 3], ["RE", 4, [0, 4, 8, 12, 1, 5, 9, 13, 2, 6, 10, 14, 3, 7, 11, 15]], ["CA", 3, 4, 11], ["CHR", 2, "shared", [3]], ["CA", 3, 4, 14], ["CHR", 1, "shared", [4]], ["CA", 2, 5, 14], ["CI", 1], ["FU", 6, [0, 1, 2, 3]], ["AN", 6, 0, 5], ["FU", 6, [1, 2, 3, 4]], ["AN", 6, 1, 4], ["FU", 6, [2, 3, 4, 5]], ["AN", 6, 2, 6], ["FU", 4, [0, 1, 2, 3]], ["SP", 4, 0, 32, [1], 1], ["AN", 4, 1, 2], ["FFSP", 4, 0, [4, 3, 2, 1], 1, 1], ["AN", 4, 1, 6], ["FU", 2, [0, 1, 2, 3]], ["SP", 2, 0, 448, [1], 1], ["AN", 2, 1, 2], ["FFSP", 2, 0, [4, 3, 2, 1], 1, 1], ["AN", 2, 1, 6], ["PR", 5, 0, "auto_unroll_max_step$0"]]]], "r": [[0.639214], 0, 7.9105, 1638331772], "v": "v0.6"}
{"i": [["[\"conv2d_layer\", 128, 64, 56, 56, 256, 1, 1, 1, 0]", "rocm -keys=rocm,gpu -max_num_threads=256 -mcpu=gfx906 -mtriple=amdgcn-amd-amdhsa-hcc -thread_warp_size=64", [-1, 16, 64, 65536, 2147483647, 1024, 16, 64], "", 0, []], [[], [["CHW", 3, "local"], ["SP", 3, 0, 128, [4, 1, 4, 1], 1], ["SP", 3, 5, 256, [1, 16, 8, 1], 1], ["SP", 3, 10, 56, [2, 1, 1, 14], 1], ["SP", 3, 15, 56, [1, 7, 2, 1], 1], ["SP", 3, 20, 64, [1, 2], 1], ["SP", 3, 23, 1, [1, 1], 1], ["SP", 3, 26, 1, [1, 1], 1], ["RE", 3, [0, 5, 10, 15, 1, 6, 11, 16, 2, 7, 12, 17, 20, 23, 26, 21, 24, 27, 3, 8, 13, 18, 22, 25, 28, 4, 9, 14, 19]], ["FSP", 4, 0, 1, 3], ["FSP", 4, 4, 2, 3], ["FSP", 4, 8, 3, 3], ["FSP", 4, 12, 4, 3], ["RE", 4, [0, 4, 8, 12, 1, 5, 9, 13, 2, 6, 10, 14, 3, 7, 11, 15]], ["CA", 3, 4, 11], ["CHR", 2, "shared", [3]], ["CA", 3, 4, 14], ["CHR", 1, "shared", [4]], ["CA", 2, 5, 14], ["CI", 1], ["FU", 6, [0, 1, 2, 3]], ["AN", 6, 0, 5], ["FU", 6, [1, 2, 3, 4]], ["AN", 6, 1, 4], ["FU", 6, [2, 3, 4, 5]], ["AN", 6, 2, 6], ["FU", 4, [0, 1, 2, 3]], ["SP", 4, 0, 16, [1], 1], ["AN", 4, 1, 2], ["FFSP", 4, 0, [4, 3, 2, 1], 1, 1], ["AN", 4, 1, 6], ["FU", 2, [0, 1, 2, 3]], ["SP", 2, 0, 112, [1], 1], ["AN", 2, 1, 2], ["FFSP", 2, 0, [4, 3, 2, 1], 1, 1], ["AN", 2, 1, 6], ["PR", 5, 0, "auto_unroll_max_step$64"]]]], "r": [[0.444187], 0, 6.84779, 1638331777], "v": "v0.6"}
{"i": [["[\"conv2d_layer\", 128, 64, 56, 56, 256, 1, 1, 1, 0]", "rocm -keys=rocm,gpu -max_num_threads=256 -mcpu=gfx906 -mtriple=amdgcn-amd-amdhsa-hcc -thread_warp_size=64", [-1, 16, 64, 65536, 2147483647, 1024, 16, 64], "", 0, []], [[], [["CHW", 3, "local"], ["SP", 3, 0, 128, [1, 2, 1, 16], 1], ["SP", 3, 5, 256, [1, 8, 2, 4], 1], ["SP", 3, 10, 56, [1, 2, 1, 1], 1], ["SP", 3, 15, 56, [4, 1, 1, 7], 1], ["SP", 3, 20, 64, [4, 2], 1], ["SP", 3, 23, 1, [1, 1], 1], ["SP", 3, 26, 1, [1, 1], 1], ["RE", 3, [0, 5, 10, 15, 1, 6, 11, 16, 2, 7, 12, 17, 20, 23, 26, 21, 24, 27, 3, 8, 13, 18, 22, 25, 28, 4, 9, 14, 19]], ["FSP", 4, 0, 1, 3], ["FSP", 4, 4, 2, 3], ["FSP", 4, 8, 3, 3], ["FSP", 4, 12, 4, 3], ["RE", 4, [0, 4, 8, 12, 1, 5, 9, 13, 2, 6, 10, 14, 3, 7, 11, 15]], ["CA", 3, 4, 11], ["CHR", 2, "shared", [3]], ["CA", 3, 4, 14], ["CHR", 1, "shared", [4]], ["CA", 2, 5, 14], ["CI", 1], ["FU", 6, [0, 1, 2, 3]], ["AN", 6, 0, 5], ["FU", 6, [1, 2, 3, 4]], ["AN", 6, 1, 4], ["FU", 6, [2, 3, 4, 5]], ["AN", 6, 2, 6], ["FU", 4, [0, 1, 2, 3]], ["SP", 4, 0, 64, [1], 1], ["AN", 4, 1, 2], ["FFSP", 4, 0, [4, 3, 2, 1], 1, 1], ["AN", 4, 1, 6], ["FU", 2, [0, 1, 2, 3]], ["SP", 2, 0, 896, [1], 1], ["AN", 2, 1, 2], ["FFSP", 2, 0, [4, 3, 2, 1], 1, 1], ["AN", 2, 1, 6], ["PR", 5, 0, "auto_unroll_max_step$64"]]]], "r": [[1.16191], 0, 10.3291, 1638331786], "v": "v0.6"}
{"i": [["[\"conv2d_layer\", 128, 64, 56, 56, 256, 1, 1, 1, 0]", "rocm -keys=rocm,gpu -max_num_threads=256 -mcpu=gfx906 -mtriple=amdgcn-amd-amdhsa-hcc -thread_warp_size=64", [-1, 16, 64, 65536, 2147483647, 1024, 16, 64], "", 0, []], [[], [["CHW", 3, "local"], ["SP", 3, 0, 128, [1, 2, 1, 2], 1], ["SP", 3, 5, 256, [1, 32, 1, 8], 1], ["SP", 3, 10, 56, [1, 2, 14, 2], 1], ["SP", 3, 15, 56, [1, 7, 2, 4], 1], ["SP", 3, 20, 64, [1, 1], 1], ["SP", 3, 23, 1, [1, 1], 1], ["SP", 3, 26, 1, [1, 1], 1], ["RE", 3, [0, 5, 10, 15, 1, 6, 11, 16, 2, 7, 12, 17, 20, 23, 26, 21, 24, 27, 3, 8, 13, 18, 22, 25, 28, 4, 9, 14, 19]], ["FSP", 4, 0, 1, 3], ["FSP", 4, 4, 2, 3], ["FSP", 4, 8, 3, 3], ["FSP", 4, 12, 4, 3], ["RE", 4, [0, 4, 8, 12, 1, 5, 9, 13, 2, 6, 10, 14, 3, 7, 11, 15]], ["CA", 3, 4, 11], ["CHR", 2, "shared", [3]], ["CA", 3, 4, 14], ["CHR", 1, "shared", [4]], ["CA", 2, 5, 14], ["CI", 1], ["FU", 6, [0, 1, 2, 3]], ["AN", 6, 0, 5], ["FU", 6, [1, 2, 3, 4]], ["AN", 6, 1, 4], ["FU", 6, [2, 3, 4, 5]], ["AN", 6, 2, 6], ["FU", 4, [0, 1, 2, 3]], ["SP", 4, 0, 8, [2], 1], ["AN", 4, 1, 2], ["FFSP", 4, 0, [4, 3, 2, 1], 1, 1], ["AN", 4, 1, 6], ["FU", 2, [0, 1, 2, 3]], ["SP", 2, 0, 448, [1], 1], ["AN", 2, 1, 2], ["FFSP", 2, 0, [4, 3, 2, 1], 1, 1], ["AN", 2, 1, 6], ["PR", 5, 0, "auto_unroll_max_step$64"]]]], "r": [[0.116145], 0, 5.457, 1638331791], "v": "v0.6"}
{"i": [["[\"conv2d_layer\", 128, 64, 56, 56, 256, 1, 1, 1, 0]", "rocm -keys=rocm,gpu -max_num_threads=256 -mcpu=gfx906 -mtriple=amdgcn-amd-amdhsa-hcc -thread_warp_size=64", [-1, 16, 64, 65536, 2147483647, 1024, 16, 64], "", 0, []], [[], [["CHW", 3, "local"], ["SP", 3, 0, 128, [2, 2, 1, 1], 1], ["SP", 3, 5, 256, [1, 8, 8, 4], 1], ["SP", 3, 10, 56, [1, 1, 2, 7], 1], ["SP", 3, 15, 56, [1, 4, 1, 14], 1], ["SP", 3, 20, 64, [1, 1], 1], ["SP", 3, 23, 1, [1, 1], 1], ["SP", 3, 26, 1, [1, 1], 1], ["RE", 3, [0, 5, 10, 15, 1, 6, 11, 16, 2, 7, 12, 17, 20, 23, 26, 21, 24, 27, 3, 8, 13, 18, 22, 25, 28, 4, 9, 14, 19]], ["FSP", 4, 0, 1, 3], ["FSP", 4, 4, 2, 3], ["FSP", 4, 8, 3, 3], ["FSP", 4, 12, 4, 3], ["RE", 4, [0, 4, 8, 12, 1, 5, 9, 13, 2, 6, 10, 14, 3, 7, 11, 15]], ["CA", 3, 4, 11], ["CHR", 2, "shared", [3]], ["CA", 3, 4, 14], ["CHR", 1, "shared", [4]], ["CA", 2, 5, 14], ["CI", 1], ["FU", 6, [0, 1, 2, 3]], ["AN", 6, 0, 5], ["FU", 6, [1, 2, 3, 4]], ["AN", 6, 1, 4], ["FU", 6, [2, 3, 4, 5]], ["AN", 6, 2, 6], ["FU", 4, [0, 1, 2, 3]], ["SP", 4, 0, 32, [16], 1], ["AN", 4, 1, 2], ["FFSP", 4, 0, [4, 3, 2, 1], 1, 1], ["AN", 4, 1, 6], ["FU", 2, [0, 1, 2, 3]], ["SP", 2, 0, 196, [1], 1], ["AN", 2, 1, 2], ["FFSP", 2, 0, [4, 3, 2, 1], 1, 1], ["AN", 2, 1, 6], ["PR", 5, 0, "auto_unroll_max_step$1024"]]]], "r": [[0.152405], 0, 15.0955, 1638331795], "v": "v0.6"}
{"i": [["[\"conv2d_layer\", 128, 64, 56, 56, 256, 1, 1, 1, 0]", "rocm -keys=rocm,gpu -max_num_threads=256 -mcpu=gfx906 -mtriple=amdgcn-amd-amdhsa-hcc -thread_warp_size=64", [-1, 16, 64, 65536, 2147483647, 1024, 16, 64], "", 0, []], [[], [["CHW", 3, "local"], ["SP", 3, 0, 128, [4, 32, 1, 1], 1], ["SP", 3, 5, 256, [1, 4, 1, 64], 1], ["SP", 3, 10, 56, [1, 1, 1, 2], 1], ["SP", 3, 15, 56, [1, 1, 2, 2], 1], ["SP", 3, 20, 64, [1, 1], 1], ["SP", 3, 23, 1, [1, 1], 1], ["SP", 3, 26, 1, [1, 1], 1], ["RE", 3, [0, 5, 10, 15, 1, 6, 11, 16, 2, 7, 12, 17, 20, 23, 26, 21, 24, 27, 3, 8, 13, 18, 22, 25, 28, 4, 9, 14, 19]], ["FSP", 4, 0, 1, 3], ["FSP", 4, 4, 2, 3], ["FSP", 4, 8, 3, 3], ["FSP", 4, 12, 4, 3], ["RE", 4, [0, 4, 8, 12, 1, 5, 9, 13, 2, 6, 10, 14, 3, 7, 11, 15]], ["CA", 3, 4, 11], ["CHR", 2, "shared", [3]], ["CA", 3, 4, 14], ["CHR", 1, "shared", [4]], ["CA", 2, 5, 14], ["CI", 1], ["FU", 6, [0, 1, 2, 3]], ["AN", 6, 0, 5], ["FU", 6, [1, 2, 3, 4]], ["AN", 6, 1, 4], ["FU", 6, [2, 3, 4, 5]], ["AN", 6, 2, 6], ["FU", 4, [0, 1, 2, 3]], ["SP", 4, 0, 32, [32], 1], ["AN", 4, 1, 2], ["FFSP", 4, 0, [4, 3, 2, 1], 1, 1], ["AN", 4, 1, 6], ["FU", 2, [0, 1, 2, 3]], ["SP", 2, 0, 8, [1], 1], ["AN", 2, 1, 2], ["FFSP", 2, 0, [4, 3, 2, 1], 1, 1], ["AN", 2, 1, 6], ["PR", 5, 0, "auto_unroll_max_step$512"]]]], "r": [[0.113553], 0, 4.72713, 1638331799], "v": "v0.6"}
{"i": [["[\"conv2d_layer\", 128, 64, 56, 56, 256, 1, 1, 1, 0]", "rocm -keys=rocm,gpu -max_num_threads=256 -mcpu=gfx906 -mtriple=amdgcn-amd-amdhsa-hcc -thread_warp_size=64", [-1, 16, 64, 65536, 2147483647, 1024, 16, 64], "", 0, []], [[], [["CHW", 3, "local"], ["SP", 3, 0, 128, [2, 8, 1, 2], 1], ["SP", 3, 5, 256, [1, 4, 64, 1], 1], ["SP", 3, 10, 56, [8, 7, 1, 1], 1], ["SP", 3, 15, 56, [1, 4, 1, 2], 1], ["SP", 3, 20, 64, [1, 1], 1], ["SP", 3, 23, 1, [1, 1], 1], ["SP", 3, 26, 1, [1, 1], 1], ["RE", 3, [0, 5, 10, 15, 1, 6, 11, 16, 2, 7, 12, 17, 20, 23, 26, 21, 24, 27, 3, 8, 13, 18, 22, 25, 28, 4, 9, 14, 19]], ["FSP", 4, 0, 1, 3], ["FSP", 4, 4, 2, 3], ["FSP", 4, 8, 3, 3], ["FSP", 4, 12, 4, 3], ["RE", 4, [0, 4, 8, 12, 1, 5, 9, 13, 2, 6, 10, 14, 3, 7, 11, 15]], ["CA", 3, 4, 11], ["CHR", 2, "shared", [3]], ["CA", 3, 4, 14], ["CHR", 1, "shared", [4]], ["CA", 2, 5, 14], ["CI", 1], ["FU", 6, [0, 1, 2, 3]], ["AN", 6, 0, 5], ["FU", 6, [1, 2, 3, 4]], ["AN", 6, 1, 4], ["FU", 6, [2, 3, 4, 5]], ["AN", 6, 2, 6], ["FU", 4, [0, 1, 2, 3]], ["SP", 4, 0, 64, [1], 1], ["AN", 4, 1, 2], ["FFSP", 4, 0, [4, 3, 2, 1], 1, 1], ["AN", 4, 1, 6], ["FU", 2, [0, 1, 2, 3]], ["SP", 2, 0, 4, [1], 1], ["AN", 2, 1, 2], ["FFSP", 2, 0, [4, 3, 2, 1], 1, 1], ["AN", 2, 1, 6], ["PR", 5, 0, "auto_unroll_max_step$512"]]]], "r": [[0.148991], 0, 5.55404, 1638331803], "v": "v0.6"}
{"i": [["[\"conv2d_layer\", 128, 64, 56, 56, 256, 1, 1, 1, 0]", "rocm -keys=rocm,gpu -max_num_threads=256 -mcpu=gfx906 -mtriple=amdgcn-amd-amdhsa-hcc -thread_warp_size=64", [-1, 16, 64, 65536, 2147483647, 1024, 16, 64], "", 0, []], [[], [["CHW", 3, "local"], ["SP", 3, 0, 128, [1, 2, 16, 1], 1], ["SP", 3, 5, 256, [1, 8, 2, 2], 1], ["SP", 3, 10, 56, [1, 7, 1, 2], 1], ["SP", 3, 15, 56, [7, 1, 1, 2], 1], ["SP", 3, 20, 64, [1, 2], 1], ["SP", 3, 23, 1, [1, 1], 1], ["SP", 3, 26, 1, [1, 1], 1], ["RE", 3, [0, 5, 10, 15, 1, 6, 11, 16, 2, 7, 12, 17, 20, 23, 26, 21, 24, 27, 3, 8, 13, 18, 22, 25, 28, 4, 9, 14, 19]], ["FSP", 4, 0, 1, 3], ["FSP", 4, 4, 2, 3], ["FSP", 4, 8, 3, 3], ["FSP", 4, 12, 4, 3], ["RE", 4, [0, 4, 8, 12, 1, 5, 9, 13, 2, 6, 10, 14, 3, 7, 11, 15]], ["CA", 3, 4, 11], ["CHR", 2, "shared", [3]], ["CA", 3, 4, 14], ["CHR", 1, "shared", [4]], ["CA", 2, 5, 14], ["CI", 1], ["FU", 6, [0, 1, 2, 3]], ["AN", 6, 0, 5], ["FU", 6, [1, 2, 3, 4]], ["AN", 6, 1, 4], ["FU", 6, [2, 3, 4, 5]], ["AN", 6, 2, 6], ["FU", 4, [0, 1, 2, 3]], ["SP", 4, 0, 8, [4], 1], ["AN", 4, 1, 2], ["FFSP", 4, 0, [4, 3, 2, 1], 1, 1], ["AN", 4, 1, 6], ["FU", 2, [0, 1, 2, 3]], ["SP", 2, 0, 128, [1], 1], ["AN", 2, 1, 2], ["FFSP", 2, 0, [4, 3, 2, 1], 1, 1], ["AN", 2, 1, 6], ["PR", 5, 0, "auto_unroll_max_step$16"]]]], "r": [[0.314378], 0, 6.11262, 1638331808], "v": "v0.6"}
