artifacts/Table3/tvm/ansor/reduction/ansor_reduction_128_4032_11_11_axis_(2, 3).log
{"i": [["[\"reduction_layer\", [128, 4032, 11, 11], [2, 3], false]", "cuda -keys=cuda,gpu -max_num_threads=1024 -thread_warp_size=32", [-1, 16, 64, 49152, 2147483647, 1024, 8, 32], "", 0, []], [[], [["FU", 1, [2, 3]], ["SP", 1, 2, 121, [32], 1], ["AN", 1, 3, 6], ["FU", 1, [0, 1]], ["AN", 1, 0, 5], ["PR", 1, 0, "auto_unroll_max_step$1024"]]]], "r": [[0.00335929], 0, 3.26075, 1639292175], "v": "v0.6"}
{"i": [["[\"reduction_layer\", [128, 4032, 11, 11], [2, 3], false]", "cuda -keys=cuda,gpu -max_num_threads=1024 -thread_warp_size=32", [-1, 16, 64, 49152, 2147483647, 1024, 8, 32], "", 0, []], [[], [["FU", 1, [0, 1]], ["SP", 1, 0, 516096, [1], 1], ["AN", 1, 0, 5], ["AN", 1, 1, 6], ["PR", 1, 0, "auto_unroll_max_step$64"]]]], "r": [[0.0146922], 0, 3.44001, 1639292178], "v": "v0.6"}
{"i": [["[\"reduction_layer\", [128, 4032, 11, 11], [2, 3], false]", "cuda -keys=cuda,gpu -max_num_threads=1024 -thread_warp_size=32", [-1, 16, 64, 49152, 2147483647, 1024, 8, 32], "", 0, []], [[], [["FU", 1, [2, 3]], ["SP", 1, 2, 121, [3], 1], ["AN", 1, 3, 6], ["FU", 1, [0, 1]], ["AN", 1, 0, 5], ["PR", 1, 0, "auto_unroll_max_step$1024"]]]], "r": [[0.0106612], 0, 2.88458, 1639292181], "v": "v0.6"}
{"i": [["[\"reduction_layer\", [128, 4032, 11, 11], [2, 3], false]", "cuda -keys=cuda,gpu -max_num_threads=1024 -thread_warp_size=32", [-1, 16, 64, 49152, 2147483647, 1024, 8, 32], "", 0, []], [[], [["FU", 1, [2, 3]], ["SP", 1, 2, 121, [4], 1], ["AN", 1, 3, 6], ["FU", 1, [0, 1]], ["AN", 1, 0, 5], ["PR", 1, 0, "auto_unroll_max_step$0"]]]], "r": [[0.00877645], 0, 2.81478, 1639292184], "v": "v0.6"}
{"i": [["[\"reduction_layer\", [128, 4032, 11, 11], [2, 3], false]", "cuda -keys=cuda,gpu -max_num_threads=1024 -thread_warp_size=32", [-1, 16, 64, 49152, 2147483647, 1024, 8, 32], "", 0, []], [[], [["FU", 1, [0, 1]], ["SP", 1, 0, 516096, [2], 1], ["AN", 1, 0, 5], ["AN", 1, 1, 6], ["PR", 1, 0, "auto_unroll_max_step$1024"]]]], "r": [[0.00759047], 0, 2.9301, 1639292187], "v": "v0.6"}
{"i": [["[\"reduction_layer\", [128, 4032, 11, 11], [2, 3], false]", "cuda -keys=cuda,gpu -max_num_threads=1024 -thread_warp_size=32", [-1, 16, 64, 49152, 2147483647, 1024, 8, 32], "", 0, []], [[], [["FU", 1, [0, 1]], ["SP", 1, 0, 516096, [64], 1], ["AN", 1, 0, 5], ["AN", 1, 1, 6], ["PR", 1, 0, "auto_unroll_max_step$0"]]]], "r": [[0.00329783], 0, 2.96645, 1639292190], "v": "v0.6"}
{"i": [["[\"reduction_layer\", [128, 4032, 11, 11], [2, 3], false]", "cuda -keys=cuda,gpu -max_num_threads=1024 -thread_warp_size=32", [-1, 16, 64, 49152, 2147483647, 1024, 8, 32], "", 0, []], [[], [["FU", 1, [0, 1]], ["SP", 1, 0, 516096, [32], 1], ["AN", 1, 0, 5], ["AN", 1, 1, 6], ["PR", 1, 0, "auto_unroll_max_step$64"]]]], "r": [[0.00252135], 0, 2.94248, 1639292192], "v": "v0.6"}
{"i": [["[\"reduction_layer\", [128, 4032, 11, 11], [2, 3], false]", "cuda -keys=cuda,gpu -max_num_threads=1024 -thread_warp_size=32", [-1, 16, 64, 49152, 2147483647, 1024, 8, 32], "", 0, []], [[], [["FU", 1, [0, 1]], ["SP", 1, 0, 516096, [3], 1], ["AN", 1, 0, 5], ["AN", 1, 1, 6], ["PR", 1, 0, "auto_unroll_max_step$512"]]]], "r": [[0.00508989], 0, 3.03408, 1639292195], "v": "v0.6"}
{"i": [["[\"reduction_layer\", [128, 4032, 11, 11], [2, 3], false]", "cuda -keys=cuda,gpu -max_num_threads=1024 -thread_warp_size=32", [-1, 16, 64, 49152, 2147483647, 1024, 8, 32], "", 0, []], [[], [["FU", 1, [2, 3]], ["SP", 1, 2, 121, [20], 1], ["AN", 1, 3, 6], ["FU", 1, [0, 1]], ["AN", 1, 0, 5], ["PR", 1, 0, "auto_unroll_max_step$16"]]]], "r": [[0.00355398], 0, 2.84451, 1639292198], "v": "v0.6"}
{"i": [["[\"reduction_layer\", [128, 4032, 11, 11], [2, 3], false]", "cuda -keys=cuda,gpu -max_num_threads=1024 -thread_warp_size=32", [-1, 16, 64, 49152, 2147483647, 1024, 8, 32], "", 0, []], [[], [["FU", 1, [2, 3]], ["SP", 1, 2, 121, [30], 1], ["AN", 1, 3, 6], ["FU", 1, [0, 1]], ["AN", 1, 0, 5], ["PR", 1, 0, "auto_unroll_max_step$16"]]]], "r": [[0.0034218], 0, 3.02631, 1639292201], "v": "v0.6"}
{"i": [["[\"reduction_layer\", [128, 4032, 11, 11], [2, 3], false]", "cuda -keys=cuda,gpu -max_num_threads=1024 -thread_warp_size=32", [-1, 16, 64, 49152, 2147483647, 1024, 8, 32], "", 0, []], [[], [["FU", 1, [0, 1]], ["SP", 1, 0, 516096, [16], 1], ["AN", 1, 0, 5], ["AN", 1, 1, 6], ["PR", 1, 0, "auto_unroll_max_step$16"]]]], "r": [[0.00195889], 0, 3.56003, 1639292205], "v": "v0.6"}
{"i": [["[\"reduction_layer\", [128, 4032, 11, 11], [2, 3], false]", "cuda -keys=cuda,gpu -max_num_threads=1024 -thread_warp_size=32", [-1, 16, 64, 49152, 2147483647, 1024, 8, 32], "", 0, []], [[], [["FU", 1, [2, 3]], ["SP", 1, 2, 121, [32], 1], ["AN", 1, 3, 6], ["FU", 1, [0, 1]], ["AN", 1, 0, 5], ["PR", 1, 0, "auto_unroll_max_step$16"]]]], "r": [[0.00277532], 0, 3.79614, 1639292208], "v": "v0.6"}
{"i": [["[\"reduction_layer\", [128, 4032, 11, 11], [2, 3], false]", "cuda -keys=cuda,gpu -max_num_threads=1024 -thread_warp_size=32", [-1, 16, 64, 49152, 2147483647, 1024, 8, 32], "", 0, []], [[], [["FU", 1, [0, 1]], ["SP", 1, 0, 516096, [18], 1], ["AN", 1, 0, 5], ["AN", 1, 1, 6], ["PR", 1, 0, "auto_unroll_max_step$64"]]]], "r": [[0.00201805], 0, 3.43, 1639292211], "v": "v0.6"}
{"i": [["[\"reduction_layer\", [128, 4032, 11, 11], [2, 3], false]", "cuda -keys=cuda,gpu -max_num_threads=1024 -thread_warp_size=32", [-1, 16, 64, 49152, 2147483647, 1024, 8, 32], "", 0, []], [[], [["FU", 1, [0, 1]], ["SP", 1, 0, 516096, [8], 1], ["AN", 1, 0, 5], ["AN", 1, 1, 6], ["PR", 1, 0, "auto_unroll_max_step$1024"]]]], "r": [[0.00230548], 0, 2.80676, 1639292214], "v": "v0.6"}
{"i": [["[\"reduction_layer\", [128, 4032, 11, 11], [2, 3], false]", "cuda -keys=cuda,gpu -max_num_threads=1024 -thread_warp_size=32", [-1, 16, 64, 49152, 2147483647, 1024, 8, 32], "", 0, []], [[], [["FU", 1, [2, 3]], ["SP", 1, 2, 121, [30], 1], ["AN", 1, 3, 6], ["FU", 1, [0, 1]], ["AN", 1, 0, 5], ["PR", 1, 0, "auto_unroll_max_step$1024"]]]], "r": [[0.00345305], 0, 3.00871, 1639292217], "v": "v0.6"}
{"i": [["[\"reduction_layer\", [128, 4032, 11, 11], [2, 3], false]", "cuda -keys=cuda,gpu -max_num_threads=1024 -thread_warp_size=32", [-1, 16, 64, 49152, 2147483647, 1024, 8, 32], "", 0, []], [[], [["FU", 1, [0, 1]], ["SP", 1, 0, 516096, [12], 1], ["AN", 1, 0, 5], ["AN", 1, 1, 6], ["PR", 1, 0, "auto_unroll_max_step$1024"]]]], "r": [[0.00201504], 0, 2.88726, 1639292220], "v": "v0.6"}
{"i": [["[\"reduction_layer\", [128, 4032, 11, 11], [2, 3], false]", "cuda -keys=cuda,gpu -max_num_threads=1024 -thread_warp_size=32", [-1, 16, 64, 49152, 2147483647, 1024, 8, 32], "", 0, []], [[], [["FU", 1, [0, 1]], ["SP", 1, 0, 516096, [2], 1], ["AN", 1, 0, 5], ["AN", 1, 1, 6], ["PR", 1, 0, "auto_unroll_max_step$16"]]]], "r": [[0.00904068], 0, 3.11712, 1639292223], "v": "v0.6"}
{"i": [["[\"reduction_layer\", [128, 4032, 11, 11], [2, 3], false]", "cuda -keys=cuda,gpu -max_num_threads=1024 -thread_warp_size=32", [-1, 16, 64, 49152, 2147483647, 1024, 8, 32], "", 0, []], [[], [["FU", 1, [0, 1]], ["SP", 1, 0, 516096, [3], 1], ["AN", 1, 0, 5], ["AN", 1, 1, 6], ["PR", 1, 0, "auto_unroll_max_step$16"]]]], "r": [[0.00522557], 0, 2.88132, 1639292226], "v": "v0.6"}
{"i": [["[\"reduction_layer\", [128, 4032, 11, 11], [2, 3], false]", "cuda -keys=cuda,gpu -max_num_threads=1024 -thread_warp_size=32", [-1, 16, 64, 49152, 2147483647, 1024, 8, 32], "", 0, []], [[], [["FU", 1, [2, 3]], ["SP", 1, 2, 121, [3], 1], ["AN", 1, 3, 6], ["FU", 1, [0, 1]], ["AN", 1, 0, 5], ["PR", 1, 0, "auto_unroll_max_step$64"]]]], "r": [[0.0106597], 0, 2.97817, 1639292229], "v": "v0.6"}
{"i": [["[\"reduction_layer\", [128, 4032, 11, 11], [2, 3], false]", "cuda -keys=cuda,gpu -max_num_threads=1024 -thread_warp_size=32", [-1, 16, 64, 49152, 2147483647, 1024, 8, 32], "", 0, []], [[], [["FU", 1, [2, 3]], ["SP", 1, 2, 121, [12], 1], ["AN", 1, 3, 6], ["FU", 1, [0, 1]], ["AN", 1, 0, 5], ["PR", 1, 0, "auto_unroll_max_step$1024"]]]], "r": [[0.00465726], 0, 3.00348, 1639292232], "v": "v0.6"}
{"i": [["[\"reduction_layer\", [128, 4032, 11, 11], [2, 3], false]", "cuda -keys=cuda,gpu -max_num_threads=1024 -thread_warp_size=32", [-1, 16, 64, 49152, 2147483647, 1024, 8, 32], "", 0, []], [[], [["FU", 1, [2, 3]], ["SP", 1, 2, 121, [60], 1], ["AN", 1, 3, 6], ["FU", 1, [0, 1]], ["AN", 1, 0, 5], ["PR", 1, 0, "auto_unroll_max_step$512"]]]], "r": [[0.00358954], 0, 3.07964, 1639292235], "v": "v0.6"}
{"i": [["[\"reduction_layer\", [128, 4032, 11, 11], [2, 3], false]", "cuda -keys=cuda,gpu -max_num_threads=1024 -thread_warp_size=32", [-1, 16, 64, 49152, 2147483647, 1024, 8, 32], "", 0, []], [[], [["FU", 1, [0, 1]], ["SP", 1, 0, 516096, [21], 1], ["AN", 1, 0, 5], ["AN", 1, 1, 6], ["PR", 1, 0, "auto_unroll_max_step$16"]]]], "r": [[0.00210549], 0, 2.93807, 1639292238], "v": "v0.6"}
{"i": [["[\"reduction_layer\", [128, 4032, 11, 11], [2, 3], false]", "cuda -keys=cuda,gpu -max_num_threads=1024 -thread_warp_size=32", [-1, 16, 64, 49152, 2147483647, 1024, 8, 32], "", 0, []], [[], [["FU", 1, [2, 3]], ["SP", 1, 2, 121, [2], 1], ["AN", 1, 3, 6], ["FU", 1, [0, 1]], ["AN", 1, 0, 5], ["PR", 1, 0, "auto_unroll_max_step$0"]]]], "r": [[0.0149477], 0, 3.06341, 1639292241], "v": "v0.6"}
{"i": [["[\"reduction_layer\", [128, 4032, 11, 11], [2, 3], false]", "cuda -keys=cuda,gpu -max_num_threads=1024 -thread_warp_size=32", [-1, 16, 64, 49152, 2147483647, 1024, 8, 32], "", 0, []], [[], [["FU", 1, [0, 1]], ["SP", 1, 0, 516096, [7], 1], ["AN", 1, 0, 5], ["AN", 1, 1, 6], ["PR", 1, 0, "auto_unroll_max_step$0"]]]], "r": [[0.00249541], 0, 2.90083, 1639292244], "v": "v0.6"}
{"i": [["[\"reduction_layer\", [128, 4032, 11, 11], [2, 3], false]", "cuda -keys=cuda,gpu -max_num_threads=1024 -thread_warp_size=32", [-1, 16, 64, 49152, 2147483647, 1024, 8, 32], "", 0, []], [[], [["FU", 1, [0, 1]], ["SP", 1, 0, 516096, [1], 1], ["AN", 1, 0, 5], ["AN", 1, 1, 6], ["PR", 1, 0, "auto_unroll_max_step$1024"]]]], "r": [[0.0148082], 0, 2.96933, 1639292247], "v": "v0.6"}
{"i": [["[\"reduction_layer\", [128, 4032, 11, 11], [2, 3], false]", "cuda -keys=cuda,gpu -max_num_threads=1024 -thread_warp_size=32", [-1, 16, 64, 49152, 2147483647, 1024, 8, 32], "", 0, []], [[], [["FU", 1, [2, 3]], ["SP", 1, 2, 121, [20], 1], ["AN", 1, 3, 6], ["FU", 1, [0, 1]], ["AN", 1, 0, 5], ["PR", 1, 0, "auto_unroll_max_step$64"]]]], "r": [[0.00355399], 0, 2.89686, 1639292249], "v": "v0.6"}
{"i": [["[\"reduction_layer\", [128, 4032, 11, 11], [2, 3], false]", "cuda -keys=cuda,gpu -max_num_threads=1024 -thread_warp_size=32", [-1, 16, 64, 49152, 2147483647, 1024, 8, 32], "", 0, []], [[], [["FU", 1, [2, 3]], ["SP", 1, 2, 121, [40], 1], ["AN", 1, 3, 6], ["FU", 1, [0, 1]], ["AN", 1, 0, 5], ["PR", 1, 0, "auto_unroll_max_step$64"]]]], "r": [[0.00366688], 0, 3.01104, 1639292253], "v": "v0.6"}
{"i": [["[\"reduction_layer\", [128, 4032, 11, 11], [2, 3], false]", "cuda -keys=cuda,gpu -max_num_threads=1024 -thread_warp_size=32", [-1, 16, 64, 49152, 2147483647, 1024, 8, 32], "", 0, []], [[], [["FU", 1, [0, 1]], ["SP", 1, 0, 516096, [42], 1], ["AN", 1, 0, 5], ["AN", 1, 1, 6], ["PR", 1, 0, "auto_unroll_max_step$16"]]]], "r": [[0.00300275], 0, 2.87423, 1639292255], "v": "v0.6"}
{"i": [["[\"reduction_layer\", [128, 4032, 11, 11], [2, 3], false]", "cuda -keys=cuda,gpu -max_num_threads=1024 -thread_warp_size=32", [-1, 16, 64, 49152, 2147483647, 1024, 8, 32], "", 0, []], [[], [["FU", 1, [2, 3]], ["SP", 1, 2, 121, [6], 1], ["AN", 1, 3, 6], ["FU", 1, [0, 1]], ["AN", 1, 0, 5], ["PR", 1, 0, "auto_unroll_max_step$1024"]]]], "r": [[0.00608772], 0, 2.89907, 1639292258], "v": "v0.6"}
{"i": [["[\"reduction_layer\", [128, 4032, 11, 11], [2, 3], false]", "cuda -keys=cuda,gpu -max_num_threads=1024 -thread_warp_size=32", [-1, 16, 64, 49152, 2147483647, 1024, 8, 32], "", 0, []], [[], [["FU", 1, [0, 1]], ["SP", 1, 0, 516096, [48], 1], ["AN", 1, 0, 5], ["AN", 1, 1, 6], ["PR", 1, 0, "auto_unroll_max_step$64"]]]], "r": [[0.00293151], 0, 2.97961, 1639292261], "v": "v0.6"}
{"i": [["[\"reduction_layer\", [128, 4032, 11, 11], [2, 3], false]", "cuda -keys=cuda,gpu -max_num_threads=1024 -thread_warp_size=32", [-1, 16, 64, 49152, 2147483647, 1024, 8, 32], "", 0, []], [[], [["FU", 1, [2, 3]], ["SP", 1, 2, 121, [12], 1], ["AN", 1, 3, 6], ["FU", 1, [0, 1]], ["AN", 1, 0, 5], ["PR", 1, 0, "auto_unroll_max_step$16"]]]], "r": [[0.00465718], 0, 2.9737, 1639292264], "v": "v0.6"}
{"i": [["[\"reduction_layer\", [128, 4032, 11, 11], [2, 3], false]", "cuda -keys=cuda,gpu -max_num_threads=1024 -thread_warp_size=32", [-1, 16, 64, 49152, 2147483647, 1024, 8, 32], "", 0, []], [[], [["FU", 1, [0, 1]], ["SP", 1, 0, 516096, [36], 1], ["AN", 1, 0, 5], ["AN", 1, 1, 6], ["PR", 1, 0, "auto_unroll_max_step$16"]]]], "r": [[0.00304837], 0, 3.01058, 1639292267], "v": "v0.6"}
{"i": [["[\"reduction_layer\", [128, 4032, 11, 11], [2, 3], false]", "cuda -keys=cuda,gpu -max_num_threads=1024 -thread_warp_size=32", [-1, 16, 64, 49152, 2147483647, 1024, 8, 32], "", 0, []], [[], [["FU", 1, [2, 3]], ["SP", 1, 2, 121, [1], 1], ["AN", 1, 3, 6], ["FU", 1, [0, 1]], ["AN", 1, 0, 5], ["PR", 1, 0, "auto_unroll_max_step$64"]]]], "r": [[0.0143222], 0, 2.94808, 1639292270], "v": "v0.6"}
{"i": [["[\"reduction_layer\", [128, 4032, 11, 11], [2, 3], false]", "cuda -keys=cuda,gpu -max_num_threads=1024 -thread_warp_size=32", [-1, 16, 64, 49152, 2147483647, 1024, 8, 32], "", 0, []], [[], [["FU", 1, [0, 1]], ["SP", 1, 0, 516096, [32], 1], ["AN", 1, 0, 5], ["AN", 1, 1, 6], ["PR", 1, 0, "auto_unroll_max_step$512"]]]], "r": [[0.0025195], 0, 3.01174, 1639292273], "v": "v0.6"}
{"i": [["[\"reduction_layer\", [128, 4032, 11, 11], [2, 3], false]", "cuda -keys=cuda,gpu -max_num_threads=1024 -thread_warp_size=32", [-1, 16, 64, 49152, 2147483647, 1024, 8, 32], "", 0, []], [[], [["FU", 1, [2, 3]], ["SP", 1, 2, 121, [32], 1], ["AN", 1, 3, 6], ["FU", 1, [0, 1]], ["AN", 1, 0, 5], ["PR", 1, 0, "auto_unroll_max_step$64"]]]], "r": [[0.00277572], 0, 3.37741, 1639292276], "v": "v0.6"}
{"i": [["[\"reduction_layer\", [128, 4032, 11, 11], [2, 3], false]", "cuda -keys=cuda,gpu -max_num_threads=1024 -thread_warp_size=32", [-1, 16, 64, 49152, 2147483647, 1024, 8, 32], "", 0, []], [[], [["FU", 1, [0, 1]], ["SP", 1, 0, 516096, [3], 1], ["AN", 1, 0, 5], ["AN", 1, 1, 6], ["PR", 1, 0, "auto_unroll_max_step$1024"]]]], "r": [[0.00509223], 0, 2.83423, 1639292279], "v": "v0.6"}
{"i": [["[\"reduction_layer\", [128, 4032, 11, 11], [2, 3], false]", "cuda -keys=cuda,gpu -max_num_threads=1024 -thread_warp_size=32", [-1, 16, 64, 49152, 2147483647, 1024, 8, 32], "", 0, []], [[], [["FU", 1, [0, 1]], ["SP", 1, 0, 516096, [64], 1], ["AN", 1, 0, 5], ["AN", 1, 1, 6], ["PR", 1, 0, "auto_unroll_max_step$64"]]]], "r": [[0.00330807], 0, 2.84555, 1639292282], "v": "v0.6"}
{"i": [["[\"reduction_layer\", [128, 4032, 11, 11], [2, 3], false]", "cuda -keys=cuda,gpu -max_num_threads=1024 -thread_warp_size=32", [-1, 16, 64, 49152, 2147483647, 1024, 8, 32], "", 0, []], [[], [["FU", 1, [0, 1]], ["SP", 1, 0, 516096, [4], 1], ["AN", 1, 0, 5], ["AN", 1, 1, 6], ["PR", 1, 0, "auto_unroll_max_step$512"]]]], "r": [[0.00386247], 0, 2.94991, 1639292285], "v": "v0.6"}
{"i": [["[\"reduction_layer\", [128, 4032, 11, 11], [2, 3], false]", "cuda -keys=cuda,gpu -max_num_threads=1024 -thread_warp_size=32", [-1, 16, 64, 49152, 2147483647, 1024, 8, 32], "", 0, []], [[], [["FU", 1, [0, 1]], ["SP", 1, 0, 516096, [14], 1], ["AN", 1, 0, 5], ["AN", 1, 1, 6], ["PR", 1, 0, "auto_unroll_max_step$64"]]]], "r": [[0.00195026], 0, 2.85359, 1639292287], "v": "v0.6"}
{"i": [["[\"reduction_layer\", [128, 4032, 11, 11], [2, 3], false]", "cuda -keys=cuda,gpu -max_num_threads=1024 -thread_warp_size=32", [-1, 16, 64, 49152, 2147483647, 1024, 8, 32], "", 0, []], [[], [["FU", 1, [0, 1]], ["SP", 1, 0, 516096, [28], 1], ["AN", 1, 0, 5], ["AN", 1, 1, 6], ["PR", 1, 0, "auto_unroll_max_step$512"]]]], "r": [[0.00232585], 0, 3.31508, 1639292291], "v": "v0.6"}
{"i": [["[\"reduction_layer\", [128, 4032, 11, 11], [2, 3], false]", "cuda -keys=cuda,gpu -max_num_threads=1024 -thread_warp_size=32", [-1, 16, 64, 49152, 2147483647, 1024, 8, 32], "", 0, []], [[], [["FU", 1, [2, 3]], ["SP", 1, 2, 121, [8], 1], ["AN", 1, 3, 6], ["FU", 1, [0, 1]], ["AN", 1, 0, 5], ["PR", 1, 0, "auto_unroll_max_step$512"]]]], "r": [[0.0066555], 0, 3.4631, 1639292294], "v": "v0.6"}
{"i": [["[\"reduction_layer\", [128, 4032, 11, 11], [2, 3], false]", "cuda -keys=cuda,gpu -max_num_threads=1024 -thread_warp_size=32", [-1, 16, 64, 49152, 2147483647, 1024, 8, 32], "", 0, []], [[], [["FU", 1, [0, 1]], ["SP", 1, 0, 516096, [32], 1], ["AN", 1, 0, 5], ["AN", 1, 1, 6], ["PR", 1, 0, "auto_unroll_max_step$16"]]]], "r": [[0.0025774], 0, 2.71181, 1639292297], "v": "v0.6"}
{"i": [["[\"reduction_layer\", [128, 4032, 11, 11], [2, 3], false]", "cuda -keys=cuda,gpu -max_num_threads=1024 -thread_warp_size=32", [-1, 16, 64, 49152, 2147483647, 1024, 8, 32], "", 0, []], [[], [["FU", 1, [0, 1]], ["SP", 1, 0, 516096, [63], 1], ["AN", 1, 0, 5], ["AN", 1, 1, 6], ["PR", 1, 0, "auto_unroll_max_step$64"]]]], "r": [[0.0030627], 0, 3.48072, 1639292300], "v": "v0.6"}
{"i": [["[\"reduction_layer\", [128, 4032, 11, 11], [2, 3], false]", "cuda -keys=cuda,gpu -max_num_threads=1024 -thread_warp_size=32", [-1, 16, 64, 49152, 2147483647, 1024, 8, 32], "", 0, []], [[], [["FU", 1, [0, 1]], ["SP", 1, 0, 516096, [48], 1], ["AN", 1, 0, 5], ["AN", 1, 1, 6], ["PR", 1, 0, "auto_unroll_max_step$512"]]]], "r": [[0.00293747], 0, 2.90297, 1639292303], "v": "v0.6"}
{"i": [["[\"reduction_layer\", [128, 4032, 11, 11], [2, 3], false]", "cuda -keys=cuda,gpu -max_num_threads=1024 -thread_warp_size=32", [-1, 16, 64, 49152, 2147483647, 1024, 8, 32], "", 0, []], [[], [["FU", 1, [2, 3]], ["SP", 1, 2, 121, [11], 1], ["AN", 1, 3, 6], ["FU", 1, [0, 1]], ["AN", 1, 0, 5], ["PR", 1, 0, "auto_unroll_max_step$1024"]]]], "r": [[0.00358689], 0, 2.87162, 1639292306], "v": "v0.6"}
{"i": [["[\"reduction_layer\", [128, 4032, 11, 11], [2, 3], false]", "cuda -keys=cuda,gpu -max_num_threads=1024 -thread_warp_size=32", [-1, 16, 64, 49152, 2147483647, 1024, 8, 32], "", 0, []], [[], [["FU", 1, [2, 3]], ["SP", 1, 2, 121, [40], 1], ["AN", 1, 3, 6], ["FU", 1, [0, 1]], ["AN", 1, 0, 5], ["PR", 1, 0, "auto_unroll_max_step$512"]]]], "r": [[0.00366829], 0, 2.88128, 1639292309], "v": "v0.6"}
{"i": [["[\"reduction_layer\", [128, 4032, 11, 11], [2, 3], false]", "cuda -keys=cuda,gpu -max_num_threads=1024 -thread_warp_size=32", [-1, 16, 64, 49152, 2147483647, 1024, 8, 32], "", 0, []], [[], [["FU", 1, [2, 3]], ["SP", 1, 2, 121, [4], 1], ["AN", 1, 3, 6], ["FU", 1, [0, 1]], ["AN", 1, 0, 5], ["PR", 1, 0, "auto_unroll_max_step$1024"]]]], "r": [[0.00878375], 0, 2.77463, 1639292312], "v": "v0.6"}
{"i": [["[\"reduction_layer\", [128, 4032, 11, 11], [2, 3], false]", "cuda -keys=cuda,gpu -max_num_threads=1024 -thread_warp_size=32", [-1, 16, 64, 49152, 2147483647, 1024, 8, 32], "", 0, []], [[], [["FU", 1, [0, 1]], ["SP", 1, 0, 516096, [8], 1], ["AN", 1, 0, 5], ["AN", 1, 1, 6], ["PR", 1, 0, "auto_unroll_max_step$64"]]]], "r": [[0.00230842], 0, 2.86564, 1639292315], "v": "v0.6"}
{"i": [["[\"reduction_layer\", [128, 4032, 11, 11], [2, 3], false]", "cuda -keys=cuda,gpu -max_num_threads=1024 -thread_warp_size=32", [-1, 16, 64, 49152, 2147483647, 1024, 8, 32], "", 0, []], [[], [["FU", 1, [0, 1]], ["SP", 1, 0, 516096, [36], 1], ["AN", 1, 0, 5], ["AN", 1, 1, 6], ["PR", 1, 0, "auto_unroll_max_step$512"]]]], "r": [[0.00309687], 0, 2.45468, 1639292320], "v": "v0.6"}
{"i": [["[\"reduction_layer\", [128, 4032, 11, 11], [2, 3], false]", "cuda -keys=cuda,gpu -max_num_threads=1024 -thread_warp_size=32", [-1, 16, 64, 49152, 2147483647, 1024, 8, 32], "", 0, []], [[], [["FU", 1, [0, 1]], ["SP", 1, 0, 516096, [12], 1], ["AN", 1, 0, 5], ["AN", 1, 1, 6], ["PR", 1, 0, "auto_unroll_max_step$64"]]]], "r": [[0.00201574], 0, 2.71679, 1639292322], "v": "v0.6"}
{"i": [["[\"reduction_layer\", [128, 4032, 11, 11], [2, 3], false]", "cuda -keys=cuda,gpu -max_num_threads=1024 -thread_warp_size=32", [-1, 16, 64, 49152, 2147483647, 1024, 8, 32], "", 0, []], [[], [["FU", 1, [0, 1]], ["SP", 1, 0, 516096, [4], 1], ["AN", 1, 0, 5], ["AN", 1, 1, 6], ["PR", 1, 0, "auto_unroll_max_step$64"]]]], "r": [[0.00391214], 0, 2.7808, 1639292325], "v": "v0.6"}
{"i": [["[\"reduction_layer\", [128, 4032, 11, 11], [2, 3], false]", "cuda -keys=cuda,gpu -max_num_threads=1024 -thread_warp_size=32", [-1, 16, 64, 49152, 2147483647, 1024, 8, 32], "", 0, []], [[], [["FU", 1, [0, 1]], ["SP", 1, 0, 516096, [1], 1], ["AN", 1, 0, 5], ["AN", 1, 1, 6], ["PR", 1, 0, "auto_unroll_max_step$0"]]]], "r": [[0.0146949], 0, 2.91384, 1639292328], "v": "v0.6"}
{"i": [["[\"reduction_layer\", [128, 4032, 11, 11], [2, 3], false]", "cuda -keys=cuda,gpu -max_num_threads=1024 -thread_warp_size=32", [-1, 16, 64, 49152, 2147483647, 1024, 8, 32], "", 0, []], [[], [["FU", 1, [0, 1]], ["SP", 1, 0, 516096, [14], 1], ["AN", 1, 0, 5], ["AN", 1, 1, 6], ["PR", 1, 0, "auto_unroll_max_step$512"]]]], "r": [[0.00195191], 0, 2.84195, 1639292331], "v": "v0.6"}
{"i": [["[\"reduction_layer\", [128, 4032, 11, 11], [2, 3], false]", "cuda -keys=cuda,gpu -max_num_threads=1024 -thread_warp_size=32", [-1, 16, 64, 49152, 2147483647, 1024, 8, 32], "", 0, []], [[], [["FU", 1, [2, 3]], ["SP", 1, 2, 121, [15], 1], ["AN", 1, 3, 6], ["FU", 1, [0, 1]], ["AN", 1, 0, 5], ["PR", 1, 0, "auto_unroll_max_step$64"]]]], "r": [[0.0043645], 0, 3.38275, 1639292335], "v": "v0.6"}
{"i": [["[\"reduction_layer\", [128, 4032, 11, 11], [2, 3], false]", "cuda -keys=cuda,gpu -max_num_threads=1024 -thread_warp_size=32", [-1, 16, 64, 49152, 2147483647, 1024, 8, 32], "", 0, []], [[], [["FU", 1, [2, 3]], ["SP", 1, 2, 121, [3], 1], ["AN", 1, 3, 6], ["FU", 1, [0, 1]], ["AN", 1, 0, 5], ["PR", 1, 0, "auto_unroll_max_step$512"]]]], "r": [[0.0106661], 0, 2.80714, 1639292337], "v": "v0.6"}
{"i": [["[\"reduction_layer\", [128, 4032, 11, 11], [2, 3], false]", "cuda -keys=cuda,gpu -max_num_threads=1024 -thread_warp_size=32", [-1, 16, 64, 49152, 2147483647, 1024, 8, 32], "", 0, []], [[], [["FU", 1, [0, 1]], ["SP", 1, 0, 516096, [63], 1], ["AN", 1, 0, 5], ["AN", 1, 1, 6], ["PR", 1, 0, "auto_unroll_max_step$512"]]]], "r": [[0.00306346], 0, 2.74978, 1639292340], "v": "v0.6"}
{"i": [["[\"reduction_layer\", [128, 4032, 11, 11], [2, 3], false]", "cuda -keys=cuda,gpu -max_num_threads=1024 -thread_warp_size=32", [-1, 16, 64, 49152, 2147483647, 1024, 8, 32], "", 0, []], [[], [["FU", 1, [0, 1]], ["SP", 1, 0, 516096, [48], 1], ["AN", 1, 0, 5], ["AN", 1, 1, 6], ["PR", 1, 0, "auto_unroll_max_step$16"]]]], "r": [[0.00293496], 0, 3.18773, 1639292343], "v": "v0.6"}
{"i": [["[\"reduction_layer\", [128, 4032, 11, 11], [2, 3], false]", "cuda -keys=cuda,gpu -max_num_threads=1024 -thread_warp_size=32", [-1, 16, 64, 49152, 2147483647, 1024, 8, 32], "", 0, []], [[], [["FU", 1, [2, 3]], ["SP", 1, 2, 121, [11], 1], ["AN", 1, 3, 6], ["FU", 1, [0, 1]], ["AN", 1, 0, 5], ["PR", 1, 0, "auto_unroll_max_step$512"]]]], "r": [[0.003611], 0, 3.75545, 1639292347], "v": "v0.6"}
{"i": [["[\"reduction_layer\", [128, 4032, 11, 11], [2, 3], false]", "cuda -keys=cuda,gpu -max_num_threads=1024 -thread_warp_size=32", [-1, 16, 64, 49152, 2147483647, 1024, 8, 32], "", 0, []], [[], [["FU", 1, [2, 3]], ["SP", 1, 2, 121, [8], 1], ["AN", 1, 3, 6], ["FU", 1, [0, 1]], ["AN", 1, 0, 5], ["PR", 1, 0, "auto_unroll_max_step$16"]]]], "r": [[0.00559781], 0, 2.70714, 1639292349], "v": "v0.6"}
{"i": [["[\"reduction_layer\", [128, 4032, 11, 11], [2, 3], false]", "cuda -keys=cuda,gpu -max_num_threads=1024 -thread_warp_size=32", [-1, 16, 64, 49152, 2147483647, 1024, 8, 32], "", 0, []], [[], [["FU", 1, [0, 1]], ["SP", 1, 0, 516096, [8], 1], ["AN", 1, 0, 5], ["AN", 1, 1, 6], ["PR", 1, 0, "auto_unroll_max_step$512"]]]], "r": [[0.00230729], 0, 2.67287, 1639292352], "v": "v0.6"}
{"i": [["[\"reduction_layer\", [128, 4032, 11, 11], [2, 3], false]", "cuda -keys=cuda,gpu -max_num_threads=1024 -thread_warp_size=32", [-1, 16, 64, 49152, 2147483647, 1024, 8, 32], "", 0, []], [[], [["FU", 1, [0, 1]], ["SP", 1, 0, 516096, [6], 1], ["AN", 1, 0, 5], ["AN", 1, 1, 6], ["PR", 1, 0, "auto_unroll_max_step$64"]]]], "r": [[0.00280417], 0, 2.82439, 1639292355], "v": "v0.6"}
{"i": [["[\"reduction_layer\", [128, 4032, 11, 11], [2, 3], false]", "cuda -keys=cuda,gpu -max_num_threads=1024 -thread_warp_size=32", [-1, 16, 64, 49152, 2147483647, 1024, 8, 32], "", 0, []], [[], [["FU", 1, [2, 3]], ["SP", 1, 2, 121, [32], 1], ["AN", 1, 3, 6], ["FU", 1, [0, 1]], ["AN", 1, 0, 5], ["PR", 1, 0, "auto_unroll_max_step$0"]]]], "r": [[0.00280922], 0, 2.87744, 1639292358], "v": "v0.6"}
{"i": [["[\"reduction_layer\", [128, 4032, 11, 11], [2, 3], false]", "cuda -keys=cuda,gpu -max_num_threads=1024 -thread_warp_size=32", [-1, 16, 64, 49152, 2147483647, 1024, 8, 32], "", 0, []], [[], [["FU", 1, [0, 1]], ["SP", 1, 0, 516096, [32], 1], ["AN", 1, 0, 5], ["AN", 1, 1, 6], ["PR", 1, 0, "auto_unroll_max_step$0"]]]], "r": [[0.00252091], 0, 2.81588, 1639292361], "v": "v0.6"}
{"i": [["[\"reduction_layer\", [128, 4032, 11, 11], [2, 3], false]", "cuda -keys=cuda,gpu -max_num_threads=1024 -thread_warp_size=32", [-1, 16, 64, 49152, 2147483647, 1024, 8, 32], "", 0, []], [[], [["FU", 1, [0, 1]], ["SP", 1, 0, 516096, [36], 1], ["AN", 1, 0, 5], ["AN", 1, 1, 6], ["PR", 1, 0, "auto_unroll_max_step$64"]]]], "r": [[0.0030463], 0, 2.67871, 1639292363], "v": "v0.6"}
{"i": [["[\"reduction_layer\", [128, 4032, 11, 11], [2, 3], false]", "cuda -keys=cuda,gpu -max_num_threads=1024 -thread_warp_size=32", [-1, 16, 64, 49152, 2147483647, 1024, 8, 32], "", 0, []], [[], [["FU", 1, [0, 1]], ["SP", 1, 0, 516096, [64], 1], ["AN", 1, 0, 5], ["AN", 1, 1, 6], ["PR", 1, 0, "auto_unroll_max_step$512"]]]], "r": [[0.00330146], 0, 3.06779, 1639292371], "v": "v0.6"}
{"i": [["[\"reduction_layer\", [128, 4032, 11, 11], [2, 3], false]", "cuda -keys=cuda,gpu -max_num_threads=1024 -thread_warp_size=32", [-1, 16, 64, 49152, 2147483647, 1024, 8, 32], "", 0, []], [[], [["FU", 1, [0, 1]], ["SP", 1, 0, 516096, [24], 1], ["AN", 1, 0, 5], ["AN", 1, 1, 6], ["PR", 1, 0, "auto_unroll_max_step$64"]]]], "r": [[0.00217161], 0, 3.45515, 1639292374], "v": "v0.6"}
{"i": [["[\"reduction_layer\", [128, 4032, 11, 11], [2, 3], false]", "cuda -keys=cuda,gpu -max_num_threads=1024 -thread_warp_size=32", [-1, 16, 64, 49152, 2147483647, 1024, 8, 32], "", 0, []], [[], [["FU", 1, [0, 1]], ["SP", 1, 0, 516096, [6], 1], ["AN", 1, 0, 5], ["AN", 1, 1, 6], ["PR", 1, 0, "auto_unroll_max_step$0"]]]], "r": [[0.00279587], 0, 2.79977, 1639292377], "v": "v0.6"}
{"i": [["[\"reduction_layer\", [128, 4032, 11, 11], [2, 3], false]", "cuda -keys=cuda,gpu -max_num_threads=1024 -thread_warp_size=32", [-1, 16, 64, 49152, 2147483647, 1024, 8, 32], "", 0, []], [[], [["FU", 1, [2, 3]], ["SP", 1, 2, 121, [24], 1], ["AN", 1, 3, 6], ["FU", 1, [0, 1]], ["AN", 1, 0, 5], ["PR", 1, 0, "auto_unroll_max_step$512"]]]], "r": [[0.0035242], 0, 2.90375, 1639292380], "v": "v0.6"}
{"i": [["[\"reduction_layer\", [128, 4032, 11, 11], [2, 3], false]", "cuda -keys=cuda,gpu -max_num_threads=1024 -thread_warp_size=32", [-1, 16, 64, 49152, 2147483647, 1024, 8, 32], "", 0, []], [[], [["FU", 1, [0, 1]], ["SP", 1, 0, 516096, [18], 1], ["AN", 1, 0, 5], ["AN", 1, 1, 6], ["PR", 1, 0, "auto_unroll_max_step$0"]]]], "r": [[0.0020188], 0, 2.98727, 1639292383], "v": "v0.6"}
{"i": [["[\"reduction_layer\", [128, 4032, 11, 11], [2, 3], false]", "cuda -keys=cuda,gpu -max_num_threads=1024 -thread_warp_size=32", [-1, 16, 64, 49152, 2147483647, 1024, 8, 32], "", 0, []], [[], [["FU", 1, [2, 3]], ["SP", 1, 2, 121, [1], 1], ["AN", 1, 3, 6], ["FU", 1, [0, 1]], ["AN", 1, 0, 5], ["PR", 1, 0, "auto_unroll_max_step$512"]]]], "r": [[0.0143321], 0, 2.87331, 1639292386], "v": "v0.6"}
{"i": [["[\"reduction_layer\", [128, 4032, 11, 11], [2, 3], false]", "cuda -keys=cuda,gpu -max_num_threads=1024 -thread_warp_size=32", [-1, 16, 64, 49152, 2147483647, 1024, 8, 32], "", 0, []], [[], [["FU", 1, [0, 1]], ["SP", 1, 0, 516096, [7], 1], ["AN", 1, 0, 5], ["AN", 1, 1, 6], ["PR", 1, 0, "auto_unroll_max_step$1024"]]]], "r": [[0.00249581], 0, 2.90368, 1639292388], "v": "v0.6"}
{"i": [["[\"reduction_layer\", [128, 4032, 11, 11], [2, 3], false]", "cuda -keys=cuda,gpu -max_num_threads=1024 -thread_warp_size=32", [-1, 16, 64, 49152, 2147483647, 1024, 8, 32], "", 0, []], [[], [["FU", 1, [2, 3]], ["SP", 1, 2, 121, [12], 1], ["AN", 1, 3, 6], ["FU", 1, [0, 1]], ["AN", 1, 0, 5], ["PR", 1, 0, "auto_unroll_max_step$0"]]]], "r": [[0.00469917], 0, 2.7856, 1639292391], "v": "v0.6"}
{"i": [["[\"reduction_layer\", [128, 4032, 11, 11], [2, 3], false]", "cuda -keys=cuda,gpu -max_num_threads=1024 -thread_warp_size=32", [-1, 16, 64, 49152, 2147483647, 1024, 8, 32], "", 0, []], [[], [["FU", 1, [2, 3]], ["SP", 1, 2, 121, [1], 1], ["AN", 1, 3, 6], ["FU", 1, [0, 1]], ["AN", 1, 0, 5], ["PR", 1, 0, "auto_unroll_max_step$16"]]]], "r": [[0.0143281], 0, 2.9516, 1639292394], "v": "v0.6"}
{"i": [["[\"reduction_layer\", [128, 4032, 11, 11], [2, 3], false]", "cuda -keys=cuda,gpu -max_num_threads=1024 -thread_warp_size=32", [-1, 16, 64, 49152, 2147483647, 1024, 8, 32], "", 0, []], [[], [["FU", 1, [2, 3]], ["SP", 1, 2, 121, [5], 1], ["AN", 1, 3, 6], ["FU", 1, [0, 1]], ["AN", 1, 0, 5], ["PR", 1, 0, "auto_unroll_max_step$64"]]]], "r": [[0.00733982], 0, 2.9783, 1639292397], "v": "v0.6"}
{"i": [["[\"reduction_layer\", [128, 4032, 11, 11], [2, 3], false]", "cuda -keys=cuda,gpu -max_num_threads=1024 -thread_warp_size=32", [-1, 16, 64, 49152, 2147483647, 1024, 8, 32], "", 0, []], [[], [["FU", 1, [2, 3]], ["SP", 1, 2, 121, [24], 1], ["AN", 1, 3, 6], ["FU", 1, [0, 1]], ["AN", 1, 0, 5], ["PR", 1, 0, "auto_unroll_max_step$16"]]]], "r": [[0.00349061], 0, 2.7881, 1639292400], "v": "v0.6"}
{"i": [["[\"reduction_layer\", [128, 4032, 11, 11], [2, 3], false]", "cuda -keys=cuda,gpu -max_num_threads=1024 -thread_warp_size=32", [-1, 16, 64, 49152, 2147483647, 1024, 8, 32], "", 0, []], [[], [["FU", 1, [0, 1]], ["SP", 1, 0, 516096, [63], 1], ["AN", 1, 0, 5], ["AN", 1, 1, 6], ["PR", 1, 0, "auto_unroll_max_step$0"]]]], "r": [[0.00306216], 0, 2.81772, 1639292402], "v": "v0.6"}
{"i": [["[\"reduction_layer\", [128, 4032, 11, 11], [2, 3], false]", "cuda -keys=cuda,gpu -max_num_threads=1024 -thread_warp_size=32", [-1, 16, 64, 49152, 2147483647, 1024, 8, 32], "", 0, []], [[], [["FU", 1, [0, 1]], ["SP", 1, 0, 516096, [7], 1], ["AN", 1, 0, 5], ["AN", 1, 1, 6], ["PR", 1, 0, "auto_unroll_max_step$64"]]]], "r": [[0.00249583], 0, 2.88512, 1639292405], "v": "v0.6"}
{"i": [["[\"reduction_layer\", [128, 4032, 11, 11], [2, 3], false]", "cuda -keys=cuda,gpu -max_num_threads=1024 -thread_warp_size=32", [-1, 16, 64, 49152, 2147483647, 1024, 8, 32], "", 0, []], [[], [["FU", 1, [0, 1]], ["SP", 1, 0, 516096, [9], 1], ["AN", 1, 0, 5], ["AN", 1, 1, 6], ["PR", 1, 0, "auto_unroll_max_step$1024"]]]], "r": [[0.00218486], 0, 2.27395, 1639292408], "v": "v0.6"}
{"i": [["[\"reduction_layer\", [128, 4032, 11, 11], [2, 3], false]", "cuda -keys=cuda,gpu -max_num_threads=1024 -thread_warp_size=32", [-1, 16, 64, 49152, 2147483647, 1024, 8, 32], "", 0, []], [[], [["FU", 1, [0, 1]], ["SP", 1, 0, 516096, [56], 1], ["AN", 1, 0, 5], ["AN", 1, 1, 6], ["PR", 1, 0, "auto_unroll_max_step$1024"]]]], "r": [[0.00291724], 0, 3.48721, 1639292411], "v": "v0.6"}
{"i": [["[\"reduction_layer\", [128, 4032, 11, 11], [2, 3], false]", "cuda -keys=cuda,gpu -max_num_threads=1024 -thread_warp_size=32", [-1, 16, 64, 49152, 2147483647, 1024, 8, 32], "", 0, []], [[], [["FU", 1, [0, 1]], ["SP", 1, 0, 516096, [63], 1], ["AN", 1, 0, 5], ["AN", 1, 1, 6], ["PR", 1, 0, "auto_unroll_max_step$1024"]]]], "r": [[0.00428558], 0, 3.48432, 1639292414], "v": "v0.6"}
{"i": [["[\"reduction_layer\", [128, 4032, 11, 11], [2, 3], false]", "cuda -keys=cuda,gpu -max_num_threads=1024 -thread_warp_size=32", [-1, 16, 64, 49152, 2147483647, 1024, 8, 32], "", 0, []], [[], [["FU", 1, [0, 1]], ["SP", 1, 0, 516096, [2], 1], ["AN", 1, 0, 5], ["AN", 1, 1, 6], ["PR", 1, 0, "auto_unroll_max_step$0"]]]], "r": [[0.0079443], 0, 3.15827, 1639292417], "v": "v0.6"}
{"i": [["[\"reduction_layer\", [128, 4032, 11, 11], [2, 3], false]", "cuda -keys=cuda,gpu -max_num_threads=1024 -thread_warp_size=32", [-1, 16, 64, 49152, 2147483647, 1024, 8, 32], "", 0, []], [[], [["FU", 1, [0, 1]], ["SP", 1, 0, 516096, [2], 1], ["AN", 1, 0, 5], ["AN", 1, 1, 6], ["PR", 1, 0, "auto_unroll_max_step$64"]]]], "r": [[0.00759586], 0, 2.96793, 1639292420], "v": "v0.6"}
{"i": [["[\"reduction_layer\", [128, 4032, 11, 11], [2, 3], false]", "cuda -keys=cuda,gpu -max_num_threads=1024 -thread_warp_size=32", [-1, 16, 64, 49152, 2147483647, 1024, 8, 32], "", 0, []], [[], [["FU", 1, [0, 1]], ["SP", 1, 0, 516096, [18], 1], ["AN", 1, 0, 5], ["AN", 1, 1, 6], ["PR", 1, 0, "auto_unroll_max_step$16"]]]], "r": [[0.00201773], 0, 2.83825, 1639292423], "v": "v0.6"}
{"i": [["[\"reduction_layer\", [128, 4032, 11, 11], [2, 3], false]", "cuda -keys=cuda,gpu -max_num_threads=1024 -thread_warp_size=32", [-1, 16, 64, 49152, 2147483647, 1024, 8, 32], "", 0, []], [[], [["FU", 1, [0, 1]], ["SP", 1, 0, 516096, [7], 1], ["AN", 1, 0, 5], ["AN", 1, 1, 6], ["PR", 1, 0, "auto_unroll_max_step$16"]]]], "r": [[0.00249994], 0, 3.33018, 1639292426], "v": "v0.6"}
{"i": [["[\"reduction_layer\", [128, 4032, 11, 11], [2, 3], false]", "cuda -keys=cuda,gpu -max_num_threads=1024 -thread_warp_size=32", [-1, 16, 64, 49152, 2147483647, 1024, 8, 32], "", 0, []], [[], [["FU", 1, [0, 1]], ["SP", 1, 0, 516096, [6], 1], ["AN", 1, 0, 5], ["AN", 1, 1, 6], ["PR", 1, 0, "auto_unroll_max_step$16"]]]], "r": [[0.00279474], 0, 3.49819, 1639292429], "v": "v0.6"}
{"i": [["[\"reduction_layer\", [128, 4032, 11, 11], [2, 3], false]", "cuda -keys=cuda,gpu -max_num_threads=1024 -thread_warp_size=32", [-1, 16, 64, 49152, 2147483647, 1024, 8, 32], "", 0, []], [[], [["FU", 1, [0, 1]], ["SP", 1, 0, 516096, [9], 1], ["AN", 1, 0, 5], ["AN", 1, 1, 6], ["PR", 1, 0, "auto_unroll_max_step$64"]]]], "r": [[0.00218799], 0, 2.98956, 1639292432], "v": "v0.6"}
{"i": [["[\"reduction_layer\", [128, 4032, 11, 11], [2, 3], false]", "cuda -keys=cuda,gpu -max_num_threads=1024 -thread_warp_size=32", [-1, 16, 64, 49152, 2147483647, 1024, 8, 32], "", 0, []], [[], [["FU", 1, [0, 1]], ["SP", 1, 0, 516096, [21], 1], ["AN", 1, 0, 5], ["AN", 1, 1, 6], ["PR", 1, 0, "auto_unroll_max_step$64"]]]], "r": [[0.00210593], 0, 3.37336, 1639292436], "v": "v0.6"}
{"i": [["[\"reduction_layer\", [128, 4032, 11, 11], [2, 3], false]", "cuda -keys=cuda,gpu -max_num_threads=1024 -thread_warp_size=32", [-1, 16, 64, 49152, 2147483647, 1024, 8, 32], "", 0, []], [[], [["FU", 1, [2, 3]], ["SP", 1, 2, 121, [30], 1], ["AN", 1, 3, 6], ["FU", 1, [0, 1]], ["AN", 1, 0, 5], ["PR", 1, 0, "auto_unroll_max_step$64"]]]], "r": [[0.0034235], 0, 2.7833, 1639292438], "v": "v0.6"}
{"i": [["[\"reduction_layer\", [128, 4032, 11, 11], [2, 3], false]", "cuda -keys=cuda,gpu -max_num_threads=1024 -thread_warp_size=32", [-1, 16, 64, 49152, 2147483647, 1024, 8, 32], "", 0, []], [[], [["FU", 1, [0, 1]], ["SP", 1, 0, 516096, [56], 1], ["AN", 1, 0, 5], ["AN", 1, 1, 6], ["PR", 1, 0, "auto_unroll_max_step$64"]]]], "r": [[0.00291719], 0, 2.81998, 1639292441], "v": "v0.6"}
{"i": [["[\"reduction_layer\", [128, 4032, 11, 11], [2, 3], false]", "cuda -keys=cuda,gpu -max_num_threads=1024 -thread_warp_size=32", [-1, 16, 64, 49152, 2147483647, 1024, 8, 32], "", 0, []], [[], [["FU", 1, [0, 1]], ["SP", 1, 0, 516096, [14], 1], ["AN", 1, 0, 5], ["AN", 1, 1, 6], ["PR", 1, 0, "auto_unroll_max_step$16"]]]], "r": [[0.00194961], 0, 2.88633, 1639292444], "v": "v0.6"}
{"i": [["[\"reduction_layer\", [128, 4032, 11, 11], [2, 3], false]", "cuda -keys=cuda,gpu -max_num_threads=1024 -thread_warp_size=32", [-1, 16, 64, 49152, 2147483647, 1024, 8, 32], "", 0, []], [[], [["FU", 1, [0, 1]], ["SP", 1, 0, 516096, [8], 1], ["AN", 1, 0, 5], ["AN", 1, 1, 6], ["PR", 1, 0, "auto_unroll_max_step$16"]]]], "r": [[0.0023083], 0, 2.89281, 1639292446], "v": "v0.6"}
{"i": [["[\"reduction_layer\", [128, 4032, 11, 11], [2, 3], false]", "cuda -keys=cuda,gpu -max_num_threads=1024 -thread_warp_size=32", [-1, 16, 64, 49152, 2147483647, 1024, 8, 32], "", 0, []], [[], [["FU", 1, [0, 1]], ["SP", 1, 0, 516096, [24], 1], ["AN", 1, 0, 5], ["AN", 1, 1, 6], ["PR", 1, 0, "auto_unroll_max_step$0"]]]], "r": [[0.00217606], 0, 2.91027, 1639292449], "v": "v0.6"}
{"i": [["[\"reduction_layer\", [128, 4032, 11, 11], [2, 3], false]", "cuda -keys=cuda,gpu -max_num_threads=1024 -thread_warp_size=32", [-1, 16, 64, 49152, 2147483647, 1024, 8, 32], "", 0, []], [[], [["FU", 1, [2, 3]], ["SP", 1, 2, 121, [10], 1], ["AN", 1, 3, 6], ["FU", 1, [0, 1]], ["AN", 1, 0, 5], ["PR", 1, 0, "auto_unroll_max_step$0"]]]], "r": [[0.00478033], 0, 2.83164, 1639292452], "v": "v0.6"}
{"i": [["[\"reduction_layer\", [128, 4032, 11, 11], [2, 3], false]", "cuda -keys=cuda,gpu -max_num_threads=1024 -thread_warp_size=32", [-1, 16, 64, 49152, 2147483647, 1024, 8, 32], "", 0, []], [[], [["FU", 1, [2, 3]], ["SP", 1, 2, 121, [10], 1], ["AN", 1, 3, 6], ["FU", 1, [0, 1]], ["AN", 1, 0, 5], ["PR", 1, 0, "auto_unroll_max_step$64"]]]], "r": [[0.00477989], 0, 2.91026, 1639292455], "v": "v0.6"}
{"i": [["[\"reduction_layer\", [128, 4032, 11, 11], [2, 3], false]", "cuda -keys=cuda,gpu -max_num_threads=1024 -thread_warp_size=32", [-1, 16, 64, 49152, 2147483647, 1024, 8, 32], "", 0, []], [[], [["FU", 1, [2, 3]], ["SP", 1, 2, 121, [40], 1], ["AN", 1, 3, 6], ["FU", 1, [0, 1]], ["AN", 1, 0, 5], ["PR", 1, 0, "auto_unroll_max_step$16"]]]], "r": [[0.00366714], 0, 2.81154, 1639292458], "v": "v0.6"}
{"i": [["[\"reduction_layer\", [128, 4032, 11, 11], [2, 3], false]", "cuda -keys=cuda,gpu -max_num_threads=1024 -thread_warp_size=32", [-1, 16, 64, 49152, 2147483647, 1024, 8, 32], "", 0, []], [[], [["FU", 1, [0, 1]], ["SP", 1, 0, 516096, [6], 1], ["AN", 1, 0, 5], ["AN", 1, 1, 6], ["PR", 1, 0, "auto_unroll_max_step$1024"]]]], "r": [[0.00279559], 0, 2.81955, 1639292461], "v": "v0.6"}
{"i": [["[\"reduction_layer\", [128, 4032, 11, 11], [2, 3], false]", "cuda -keys=cuda,gpu -max_num_threads=1024 -thread_warp_size=32", [-1, 16, 64, 49152, 2147483647, 1024, 8, 32], "", 0, []], [[], [["FU", 1, [2, 3]], ["SP", 1, 2, 121, [3], 1], ["AN", 1, 3, 6], ["FU", 1, [0, 1]], ["AN", 1, 0, 5], ["PR", 1, 0, "auto_unroll_max_step$16"]]]], "r": [[0.0117868], 0, 2.9868, 1639292464], "v": "v0.6"}
{"i": [["[\"reduction_layer\", [128, 4032, 11, 11], [2, 3], false]", "cuda -keys=cuda,gpu -max_num_threads=1024 -thread_warp_size=32", [-1, 16, 64, 49152, 2147483647, 1024, 8, 32], "", 0, []], [[], [["FU", 1, [2, 3]], ["SP", 1, 2, 121, [3], 1], ["AN", 1, 3, 6], ["FU", 1, [0, 1]], ["AN", 1, 0, 5], ["PR", 1, 0, "auto_unroll_max_step$0"]]]], "r": [[0.0106746], 0, 2.94201, 1639292467], "v": "v0.6"}
{"i": [["[\"reduction_layer\", [128, 4032, 11, 11], [2, 3], false]", "cuda -keys=cuda,gpu -max_num_threads=1024 -thread_warp_size=32", [-1, 16, 64, 49152, 2147483647, 1024, 8, 32], "", 0, []], [[], [["FU", 1, [2, 3]], ["SP", 1, 2, 121, [60], 1], ["AN", 1, 3, 6], ["FU", 1, [0, 1]], ["AN", 1, 0, 5], ["PR", 1, 0, "auto_unroll_max_step$1024"]]]], "r": [[0.00359037], 0, 2.89586, 1639292470], "v": "v0.6"}
{"i": [["[\"reduction_layer\", [128, 4032, 11, 11], [2, 3], false]", "cuda -keys=cuda,gpu -max_num_threads=1024 -thread_warp_size=32", [-1, 16, 64, 49152, 2147483647, 1024, 8, 32], "", 0, []], [[], [["FU", 1, [0, 1]], ["SP", 1, 0, 516096, [4], 1], ["AN", 1, 0, 5], ["AN", 1, 1, 6], ["PR", 1, 0, "auto_unroll_max_step$1024"]]]], "r": [[0.00386337], 0, 2.84869, 1639292473], "v": "v0.6"}
{"i": [["[\"reduction_layer\", [128, 4032, 11, 11], [2, 3], false]", "cuda -keys=cuda,gpu -max_num_threads=1024 -thread_warp_size=32", [-1, 16, 64, 49152, 2147483647, 1024, 8, 32], "", 0, []], [[], [["FU", 1, [2, 3]], ["SP", 1, 2, 121, [12], 1], ["AN", 1, 3, 6], ["FU", 1, [0, 1]], ["AN", 1, 0, 5], ["PR", 1, 0, "auto_unroll_max_step$64"]]]], "r": [[0.00466158], 0, 2.82038, 1639292476], "v": "v0.6"}
{"i": [["[\"reduction_layer\", [128, 4032, 11, 11], [2, 3], false]", "cuda -keys=cuda,gpu -max_num_threads=1024 -thread_warp_size=32", [-1, 16, 64, 49152, 2147483647, 1024, 8, 32], "", 0, []], [[], [["FU", 1, [2, 3]], ["SP", 1, 2, 121, [8], 1], ["AN", 1, 3, 6], ["FU", 1, [0, 1]], ["AN", 1, 0, 5], ["PR", 1, 0, "auto_unroll_max_step$64"]]]], "r": [[0.00560221], 0, 2.96286, 1639292478], "v": "v0.6"}
{"i": [["[\"reduction_layer\", [128, 4032, 11, 11], [2, 3], false]", "cuda -keys=cuda,gpu -max_num_threads=1024 -thread_warp_size=32", [-1, 16, 64, 49152, 2147483647, 1024, 8, 32], "", 0, []], [[], [["FU", 1, [2, 3]], ["SP", 1, 2, 121, [60], 1], ["AN", 1, 3, 6], ["FU", 1, [0, 1]], ["AN", 1, 0, 5], ["PR", 1, 0, "auto_unroll_max_step$64"]]]], "r": [[0.00359024], 0, 2.83217, 1639292481], "v": "v0.6"}
{"i": [["[\"reduction_layer\", [128, 4032, 11, 11], [2, 3], false]", "cuda -keys=cuda,gpu -max_num_threads=1024 -thread_warp_size=32", [-1, 16, 64, 49152, 2147483647, 1024, 8, 32], "", 0, []], [[], [["FU", 1, [2, 3]], ["SP", 1, 2, 121, [60], 1], ["AN", 1, 3, 6], ["FU", 1, [0, 1]], ["AN", 1, 0, 5], ["PR", 1, 0, "auto_unroll_max_step$16"]]]], "r": [[0.00359023], 0, 2.76392, 1639292484], "v": "v0.6"}
{"i": [["[\"reduction_layer\", [128, 4032, 11, 11], [2, 3], false]", "cuda -keys=cuda,gpu -max_num_threads=1024 -thread_warp_size=32", [-1, 16, 64, 49152, 2147483647, 1024, 8, 32], "", 0, []], [[], [["FU", 1, [2, 3]], ["SP", 1, 2, 121, [40], 1], ["AN", 1, 3, 6], ["FU", 1, [0, 1]], ["AN", 1, 0, 5], ["PR", 1, 0, "auto_unroll_max_step$1024"]]]], "r": [[0.00366846], 0, 2.92633, 1639292487], "v": "v0.6"}
{"i": [["[\"reduction_layer\", [128, 4032, 11, 11], [2, 3], false]", "cuda -keys=cuda,gpu -max_num_threads=1024 -thread_warp_size=32", [-1, 16, 64, 49152, 2147483647, 1024, 8, 32], "", 0, []], [[], [["FU", 1, [0, 1]], ["SP", 1, 0, 516096, [21], 1], ["AN", 1, 0, 5], ["AN", 1, 1, 6], ["PR", 1, 0, "auto_unroll_max_step$1024"]]]], "r": [[0.00210544], 0, 2.87479, 1639292490], "v": "v0.6"}
{"i": [["[\"reduction_layer\", [128, 4032, 11, 11], [2, 3], false]", "cuda -keys=cuda,gpu -max_num_threads=1024 -thread_warp_size=32", [-1, 16, 64, 49152, 2147483647, 1024, 8, 32], "", 0, []], [[], [["FU", 1, [2, 3]], ["SP", 1, 2, 121, [4], 1], ["AN", 1, 3, 6], ["FU", 1, [0, 1]], ["AN", 1, 0, 5], ["PR", 1, 0, "auto_unroll_max_step$16"]]]], "r": [[0.00878872], 0, 2.91021, 1639292493], "v": "v0.6"}
{"i": [["[\"reduction_layer\", [128, 4032, 11, 11], [2, 3], false]", "cuda -keys=cuda,gpu -max_num_threads=1024 -thread_warp_size=32", [-1, 16, 64, 49152, 2147483647, 1024, 8, 32], "", 0, []], [[], [["FU", 1, [2, 3]], ["SP", 1, 2, 121, [2], 1], ["AN", 1, 3, 6], ["FU", 1, [0, 1]], ["AN", 1, 0, 5], ["PR", 1, 0, "auto_unroll_max_step$512"]]]], "r": [[0.014967], 0, 3.0764, 1639292496], "v": "v0.6"}
{"i": [["[\"reduction_layer\", [128, 4032, 11, 11], [2, 3], false]", "cuda -keys=cuda,gpu -max_num_threads=1024 -thread_warp_size=32", [-1, 16, 64, 49152, 2147483647, 1024, 8, 32], "", 0, []], [[], [["FU", 1, [2, 3]], ["SP", 1, 2, 121, [10], 1], ["AN", 1, 3, 6], ["FU", 1, [0, 1]], ["AN", 1, 0, 5], ["PR", 1, 0, "auto_unroll_max_step$1024"]]]], "r": [[0.00478027], 0, 2.93141, 1639292499], "v": "v0.6"}
{"i": [["[\"reduction_layer\", [128, 4032, 11, 11], [2, 3], false]", "cuda -keys=cuda,gpu -max_num_threads=1024 -thread_warp_size=32", [-1, 16, 64, 49152, 2147483647, 1024, 8, 32], "", 0, []], [[], [["FU", 1, [2, 3]], ["SP", 1, 2, 121, [40], 1], ["AN", 1, 3, 6], ["FU", 1, [0, 1]], ["AN", 1, 0, 5], ["PR", 1, 0, "auto_unroll_max_step$0"]]]], "r": [[0.00366792], 0, 2.89712, 1639292502], "v": "v0.6"}
{"i": [["[\"reduction_layer\", [128, 4032, 11, 11], [2, 3], false]", "cuda -keys=cuda,gpu -max_num_threads=1024 -thread_warp_size=32", [-1, 16, 64, 49152, 2147483647, 1024, 8, 32], "", 0, []], [[], [["FU", 1, [0, 1]], ["SP", 1, 0, 516096, [16], 1], ["AN", 1, 0, 5], ["AN", 1, 1, 6], ["PR", 1, 0, "auto_unroll_max_step$0"]]]], "r": [[0.00195892], 0, 3.39917, 1639292505], "v": "v0.6"}
{"i": [["[\"reduction_layer\", [128, 4032, 11, 11], [2, 3], false]", "cuda -keys=cuda,gpu -max_num_threads=1024 -thread_warp_size=32", [-1, 16, 64, 49152, 2147483647, 1024, 8, 32], "", 0, []], [[], [["FU", 1, [0, 1]], ["SP", 1, 0, 516096, [64], 1], ["AN", 1, 0, 5], ["AN", 1, 1, 6], ["PR", 1, 0, "auto_unroll_max_step$1024"]]]], "r": [[0.00333317], 0, 2.90387, 1639292508], "v": "v0.6"}
{"i": [["[\"reduction_layer\", [128, 4032, 11, 11], [2, 3], false]", "cuda -keys=cuda,gpu -max_num_threads=1024 -thread_warp_size=32", [-1, 16, 64, 49152, 2147483647, 1024, 8, 32], "", 0, []], [[], [["FU", 1, [0, 1]], ["SP", 1, 0, 516096, [4], 1], ["AN", 1, 0, 5], ["AN", 1, 1, 6], ["PR", 1, 0, "auto_unroll_max_step$16"]]]], "r": [[0.00386252], 0, 2.4265, 1639292513], "v": "v0.6"}
{"i": [["[\"reduction_layer\", [128, 4032, 11, 11], [2, 3], false]", "cuda -keys=cuda,gpu -max_num_threads=1024 -thread_warp_size=32", [-1, 16, 64, 49152, 2147483647, 1024, 8, 32], "", 0, []], [[], [["FU", 1, [0, 1]], ["SP", 1, 0, 516096, [12], 1], ["AN", 1, 0, 5], ["AN", 1, 1, 6], ["PR", 1, 0, "auto_unroll_max_step$512"]]]], "r": [[0.00239168], 0, 2.93544, 1639292516], "v": "v0.6"}
{"i": [["[\"reduction_layer\", [128, 4032, 11, 11], [2, 3], false]", "cuda -keys=cuda,gpu -max_num_threads=1024 -thread_warp_size=32", [-1, 16, 64, 49152, 2147483647, 1024, 8, 32], "", 0, []], [[], [["FU", 1, [0, 1]], ["SP", 1, 0, 516096, [28], 1], ["AN", 1, 0, 5], ["AN", 1, 1, 6], ["PR", 1, 0, "auto_unroll_max_step$64"]]]], "r": [[0.00239973], 0, 3.16284, 1639292519], "v": "v0.6"}
{"i": [["[\"reduction_layer\", [128, 4032, 11, 11], [2, 3], false]", "cuda -keys=cuda,gpu -max_num_threads=1024 -thread_warp_size=32", [-1, 16, 64, 49152, 2147483647, 1024, 8, 32], "", 0, []], [[], [["FU", 1, [0, 1]], ["SP", 1, 0, 516096, [64], 1], ["AN", 1, 0, 5], ["AN", 1, 1, 6], ["PR", 1, 0, "auto_unroll_max_step$16"]]]], "r": [[0.0033054], 0, 2.82932, 1639292521], "v": "v0.6"}
{"i": [["[\"reduction_layer\", [128, 4032, 11, 11], [2, 3], false]", "cuda -keys=cuda,gpu -max_num_threads=1024 -thread_warp_size=32", [-1, 16, 64, 49152, 2147483647, 1024, 8, 32], "", 0, []], [[], [["FU", 1, [2, 3]], ["SP", 1, 2, 121, [32], 1], ["AN", 1, 3, 6], ["FU", 1, [0, 1]], ["AN", 1, 0, 5], ["PR", 1, 0, "auto_unroll_max_step$512"]]]], "r": [[0.0027755], 0, 3.2607, 1639292525], "v": "v0.6"}
{"i": [["[\"reduction_layer\", [128, 4032, 11, 11], [2, 3], false]", "cuda -keys=cuda,gpu -max_num_threads=1024 -thread_warp_size=32", [-1, 16, 64, 49152, 2147483647, 1024, 8, 32], "", 0, []], [[], [["FU", 1, [2, 3]], ["SP", 1, 2, 121, [6], 1], ["AN", 1, 3, 6], ["FU", 1, [0, 1]], ["AN", 1, 0, 5], ["PR", 1, 0, "auto_unroll_max_step$64"]]]], "r": [[0.00608839], 0, 3.25532, 1639292528], "v": "v0.6"}
{"i": [["[\"reduction_layer\", [128, 4032, 11, 11], [2, 3], false]", "cuda -keys=cuda,gpu -max_num_threads=1024 -thread_warp_size=32", [-1, 16, 64, 49152, 2147483647, 1024, 8, 32], "", 0, []], [[], [["FU", 1, [2, 3]], ["SP", 1, 2, 121, [6], 1], ["AN", 1, 3, 6], ["FU", 1, [0, 1]], ["AN", 1, 0, 5], ["PR", 1, 0, "auto_unroll_max_step$16"]]]], "r": [[0.00608756], 0, 2.80735, 1639292531], "v": "v0.6"}
{"i": [["[\"reduction_layer\", [128, 4032, 11, 11], [2, 3], false]", "cuda -keys=cuda,gpu -max_num_threads=1024 -thread_warp_size=32", [-1, 16, 64, 49152, 2147483647, 1024, 8, 32], "", 0, []], [[], [["FU", 1, [2, 3]], ["SP", 1, 2, 121, [15], 1], ["AN", 1, 3, 6], ["FU", 1, [0, 1]], ["AN", 1, 0, 5], ["PR", 1, 0, "auto_unroll_max_step$1024"]]]], "r": [[0.00436208], 0, 2.87717, 1639292533], "v": "v0.6"}
{"i": [["[\"reduction_layer\", [128, 4032, 11, 11], [2, 3], false]", "cuda -keys=cuda,gpu -max_num_threads=1024 -thread_warp_size=32", [-1, 16, 64, 49152, 2147483647, 1024, 8, 32], "", 0, []], [[], [["FU", 1, [0, 1]], ["SP", 1, 0, 516096, [28], 1], ["AN", 1, 0, 5], ["AN", 1, 1, 6], ["PR", 1, 0, "auto_unroll_max_step$1024"]]]], "r": [[0.00232147], 0, 3.26637, 1639292537], "v": "v0.6"}
{"i": [["[\"reduction_layer\", [128, 4032, 11, 11], [2, 3], false]", "cuda -keys=cuda,gpu -max_num_threads=1024 -thread_warp_size=32", [-1, 16, 64, 49152, 2147483647, 1024, 8, 32], "", 0, []], [[], [["FU", 1, [0, 1]], ["SP", 1, 0, 516096, [18], 1], ["AN", 1, 0, 5], ["AN", 1, 1, 6], ["PR", 1, 0, "auto_unroll_max_step$1024"]]]], "r": [[0.00201799], 0, 2.68083, 1639292539], "v": "v0.6"}
{"i": [["[\"reduction_layer\", [128, 4032, 11, 11], [2, 3], false]", "cuda -keys=cuda,gpu -max_num_threads=1024 -thread_warp_size=32", [-1, 16, 64, 49152, 2147483647, 1024, 8, 32], "", 0, []], [[], [["FU", 1, [2, 3]], ["SP", 1, 2, 121, [24], 1], ["AN", 1, 3, 6], ["FU", 1, [0, 1]], ["AN", 1, 0, 5], ["PR", 1, 0, "auto_unroll_max_step$64"]]]], "r": [[0.003519], 0, 2.75272, 1639292542], "v": "v0.6"}
{"i": [["[\"reduction_layer\", [128, 4032, 11, 11], [2, 3], false]", "cuda -keys=cuda,gpu -max_num_threads=1024 -thread_warp_size=32", [-1, 16, 64, 49152, 2147483647, 1024, 8, 32], "", 0, []], [[], [["FU", 1, [0, 1]], ["SP", 1, 0, 516096, [12], 1], ["AN", 1, 0, 5], ["AN", 1, 1, 6], ["PR", 1, 0, "auto_unroll_max_step$16"]]]], "r": [[0.00201603], 0, 2.86742, 1639292545], "v": "v0.6"}
{"i": [["[\"reduction_layer\", [128, 4032, 11, 11], [2, 3], false]", "cuda -keys=cuda,gpu -max_num_threads=1024 -thread_warp_size=32", [-1, 16, 64, 49152, 2147483647, 1024, 8, 32], "", 0, []], [[], [["FU", 1, [2, 3]], ["SP", 1, 2, 121, [6], 1], ["AN", 1, 3, 6], ["FU", 1, [0, 1]], ["AN", 1, 0, 5], ["PR", 1, 0, "auto_unroll_max_step$0"]]]], "r": [[0.00608896], 0, 3.27788, 1639292548], "v": "v0.6"}
{"i": [["[\"reduction_layer\", [128, 4032, 11, 11], [2, 3], false]", "cuda -keys=cuda,gpu -max_num_threads=1024 -thread_warp_size=32", [-1, 16, 64, 49152, 2147483647, 1024, 8, 32], "", 0, []], [[], [["FU", 1, [2, 3]], ["SP", 1, 2, 121, [20], 1], ["AN", 1, 3, 6], ["FU", 1, [0, 1]], ["AN", 1, 0, 5], ["PR", 1, 0, "auto_unroll_max_step$512"]]]], "r": [[0.00355452], 0, 2.60891, 1639292551], "v": "v0.6"}
{"i": [["[\"reduction_layer\", [128, 4032, 11, 11], [2, 3], false]", "cuda -keys=cuda,gpu -max_num_threads=1024 -thread_warp_size=32", [-1, 16, 64, 49152, 2147483647, 1024, 8, 32], "", 0, []], [[], [["FU", 1, [2, 3]], ["SP", 1, 2, 121, [12], 1], ["AN", 1, 3, 6], ["FU", 1, [0, 1]], ["AN", 1, 0, 5], ["PR", 1, 0, "auto_unroll_max_step$512"]]]], "r": [[0.00465782], 0, 2.76141, 1639292554], "v": "v0.6"}
{"i": [["[\"reduction_layer\", [128, 4032, 11, 11], [2, 3], false]", "cuda -keys=cuda,gpu -max_num_threads=1024 -thread_warp_size=32", [-1, 16, 64, 49152, 2147483647, 1024, 8, 32], "", 0, []], [[], [["FU", 1, [0, 1]], ["SP", 1, 0, 516096, [9], 1], ["AN", 1, 0, 5], ["AN", 1, 1, 6], ["PR", 1, 0, "auto_unroll_max_step$512"]]]], "r": [[0.00218698], 0, 2.68728, 1639292556], "v": "v0.6"}
{"i": [["[\"reduction_layer\", [128, 4032, 11, 11], [2, 3], false]", "cuda -keys=cuda,gpu -max_num_threads=1024 -thread_warp_size=32", [-1, 16, 64, 49152, 2147483647, 1024, 8, 32], "", 0, []], [[], [["FU", 1, [0, 1]], ["SP", 1, 0, 516096, [14], 1], ["AN", 1, 0, 5], ["AN", 1, 1, 6], ["PR", 1, 0, "auto_unroll_max_step$1024"]]]], "r": [[0.00195328], 0, 3.03235, 1639292564], "v": "v0.6"}
{"i": [["[\"reduction_layer\", [128, 4032, 11, 11], [2, 3], false]", "cuda -keys=cuda,gpu -max_num_threads=1024 -thread_warp_size=32", [-1, 16, 64, 49152, 2147483647, 1024, 8, 32], "", 0, []], [[], [["FU", 1, [0, 1]], ["SP", 1, 0, 516096, [14], 1], ["AN", 1, 0, 5], ["AN", 1, 1, 6], ["PR", 1, 0, "auto_unroll_max_step$0"]]]], "r": [[0.00194938], 0, 2.89296, 1639292567], "v": "v0.6"}
{"i": [["[\"reduction_layer\", [128, 4032, 11, 11], [2, 3], false]", "cuda -keys=cuda,gpu -max_num_threads=1024 -thread_warp_size=32", [-1, 16, 64, 49152, 2147483647, 1024, 8, 32], "", 0, []], [[], [["FU", 1, [0, 1]], ["SP", 1, 0, 516096, [16], 1], ["AN", 1, 0, 5], ["AN", 1, 1, 6], ["PR", 1, 0, "auto_unroll_max_step$1024"]]]], "r": [[0.00195936], 0, 3.26001, 1639292570], "v": "v0.6"}
{"i": [["[\"reduction_layer\", [128, 4032, 11, 11], [2, 3], false]", "cuda -keys=cuda,gpu -max_num_threads=1024 -thread_warp_size=32", [-1, 16, 64, 49152, 2147483647, 1024, 8, 32], "", 0, []], [[], [["FU", 1, [0, 1]], ["SP", 1, 0, 516096, [16], 1], ["AN", 1, 0, 5], ["AN", 1, 1, 6], ["PR", 1, 0, "auto_unroll_max_step$64"]]]], "r": [[0.00195904], 0, 3.32475, 1639292573], "v": "v0.6"}
{"i": [["[\"reduction_layer\", [128, 4032, 11, 11], [2, 3], false]", "cuda -keys=cuda,gpu -max_num_threads=1024 -thread_warp_size=32", [-1, 16, 64, 49152, 2147483647, 1024, 8, 32], "", 0, []], [[], [["FU", 1, [0, 1]], ["SP", 1, 0, 516096, [16], 1], ["AN", 1, 0, 5], ["AN", 1, 1, 6], ["PR", 1, 0, "auto_unroll_max_step$512"]]]], "r": [[0.00195907], 0, 3.27698, 1639292576], "v": "v0.6"}
{"i": [["[\"reduction_layer\", [128, 4032, 11, 11], [2, 3], false]", "cuda -keys=cuda,gpu -max_num_threads=1024 -thread_warp_size=32", [-1, 16, 64, 49152, 2147483647, 1024, 8, 32], "", 0, []], [[], [["FU", 1, [0, 1]], ["SP", 1, 0, 516096, [18], 1], ["AN", 1, 0, 5], ["AN", 1, 1, 6], ["PR", 1, 0, "auto_unroll_max_step$512"]]]], "r": [[0.0020195], 0, 2.74349, 1639292578], "v": "v0.6"}
{"i": [["[\"reduction_layer\", [128, 4032, 11, 11], [2, 3], false]", "cuda -keys=cuda,gpu -max_num_threads=1024 -thread_warp_size=32", [-1, 16, 64, 49152, 2147483647, 1024, 8, 32], "", 0, []], [[], [["FU", 1, [0, 1]], ["SP", 1, 0, 516096, [12], 1], ["AN", 1, 0, 5], ["AN", 1, 1, 6], ["PR", 1, 0, "auto_unroll_max_step$0"]]]], "r": [[0.00201712], 0, 2.87226, 1639292581], "v": "v0.6"}
{"i": [["[\"reduction_layer\", [128, 4032, 11, 11], [2, 3], false]", "cuda -keys=cuda,gpu -max_num_threads=1024 -thread_warp_size=32", [-1, 16, 64, 49152, 2147483647, 1024, 8, 32], "", 0, []], [[], [["FU", 1, [0, 1]], ["SP", 1, 0, 516096, [21], 1], ["AN", 1, 0, 5], ["AN", 1, 1, 6], ["PR", 1, 0, "auto_unroll_max_step$0"]]]], "r": [[0.00210546], 0, 3.39824, 1639292584], "v": "v0.6"}
{"i": [["[\"reduction_layer\", [128, 4032, 11, 11], [2, 3], false]", "cuda -keys=cuda,gpu -max_num_threads=1024 -thread_warp_size=32", [-1, 16, 64, 49152, 2147483647, 1024, 8, 32], "", 0, []], [[], [["FU", 1, [0, 1]], ["SP", 1, 0, 516096, [21], 1], ["AN", 1, 0, 5], ["AN", 1, 1, 6], ["PR", 1, 0, "auto_unroll_max_step$512"]]]], "r": [[0.00210536], 0, 2.79872, 1639292587], "v": "v0.6"}
{"i": [["[\"reduction_layer\", [128, 4032, 11, 11], [2, 3], false]", "cuda -keys=cuda,gpu -max_num_threads=1024 -thread_warp_size=32", [-1, 16, 64, 49152, 2147483647, 1024, 8, 32], "", 0, []], [[], [["FU", 1, [0, 1]], ["SP", 1, 0, 516096, [9], 1], ["AN", 1, 0, 5], ["AN", 1, 1, 6], ["PR", 1, 0, "auto_unroll_max_step$0"]]]], "r": [[0.00218599], 0, 2.80324, 1639292590], "v": "v0.6"}
{"i": [["[\"reduction_layer\", [128, 4032, 11, 11], [2, 3], false]", "cuda -keys=cuda,gpu -max_num_threads=1024 -thread_warp_size=32", [-1, 16, 64, 49152, 2147483647, 1024, 8, 32], "", 0, []], [[], [["FU", 1, [0, 1]], ["SP", 1, 0, 516096, [9], 1], ["AN", 1, 0, 5], ["AN", 1, 1, 6], ["PR", 1, 0, "auto_unroll_max_step$16"]]]], "r": [[0.00219182], 0, 2.79229, 1639292592], "v": "v0.6"}
{"i": [["[\"reduction_layer\", [128, 4032, 11, 11], [2, 3], false]", "cuda -keys=cuda,gpu -max_num_threads=1024 -thread_warp_size=32", [-1, 16, 64, 49152, 2147483647, 1024, 8, 32], "", 0, []], [[], [["FU", 1, [0, 1]], ["SP", 1, 0, 516096, [24], 1], ["AN", 1, 0, 5], ["AN", 1, 1, 6], ["PR", 1, 0, "auto_unroll_max_step$1024"]]]], "r": [[0.00261487], 0, 3.02296, 1639292595], "v": "v0.6"}
{"i": [["[\"reduction_layer\", [128, 4032, 11, 11], [2, 3], false]", "cuda -keys=cuda,gpu -max_num_threads=1024 -thread_warp_size=32", [-1, 16, 64, 49152, 2147483647, 1024, 8, 32], "", 0, []], [[], [["FU", 1, [0, 1]], ["SP", 1, 0, 516096, [24], 1], ["AN", 1, 0, 5], ["AN", 1, 1, 6], ["PR", 1, 0, "auto_unroll_max_step$16"]]]], "r": [[0.00219279], 0, 3.36722, 1639292599], "v": "v0.6"}
{"i": [["[\"reduction_layer\", [128, 4032, 11, 11], [2, 3], false]", "cuda -keys=cuda,gpu -max_num_threads=1024 -thread_warp_size=32", [-1, 16, 64, 49152, 2147483647, 1024, 8, 32], "", 0, []], [[], [["FU", 1, [0, 1]], ["SP", 1, 0, 516096, [24], 1], ["AN", 1, 0, 5], ["AN", 1, 1, 6], ["PR", 1, 0, "auto_unroll_max_step$512"]]]], "r": [[0.00217162], 0, 2.87198, 1639292601], "v": "v0.6"}
{"i": [["[\"reduction_layer\", [128, 4032, 11, 11], [2, 3], false]", "cuda -keys=cuda,gpu -max_num_threads=1024 -thread_warp_size=32", [-1, 16, 64, 49152, 2147483647, 1024, 8, 32], "", 0, []], [[], [["FU", 1, [0, 1]], ["SP", 1, 0, 516096, [8], 1], ["AN", 1, 0, 5], ["AN", 1, 1, 6], ["PR", 1, 0, "auto_unroll_max_step$0"]]]], "r": [[0.00230585], 0, 2.76716, 1639292604], "v": "v0.6"}
{"i": [["[\"reduction_layer\", [128, 4032, 11, 11], [2, 3], false]", "cuda -keys=cuda,gpu -max_num_threads=1024 -thread_warp_size=32", [-1, 16, 64, 49152, 2147483647, 1024, 8, 32], "", 0, []], [[], [["FU", 1, [0, 1]], ["SP", 1, 0, 516096, [28], 1], ["AN", 1, 0, 5], ["AN", 1, 1, 6], ["PR", 1, 0, "auto_unroll_max_step$0"]]]], "r": [[0.00232644], 0, 2.81377, 1639292607], "v": "v0.6"}
{"i": [["[\"reduction_layer\", [128, 4032, 11, 11], [2, 3], false]", "cuda -keys=cuda,gpu -max_num_threads=1024 -thread_warp_size=32", [-1, 16, 64, 49152, 2147483647, 1024, 8, 32], "", 0, []], [[], [["FU", 1, [0, 1]], ["SP", 1, 0, 516096, [28], 1], ["AN", 1, 0, 5], ["AN", 1, 1, 6], ["PR", 1, 0, "auto_unroll_max_step$16"]]]], "r": [[0.00232111], 0, 2.90064, 1639292610], "v": "v0.6"}
{"i": [["[\"reduction_layer\", [128, 4032, 11, 11], [2, 3], false]", "cuda -keys=cuda,gpu -max_num_threads=1024 -thread_warp_size=32", [-1, 16, 64, 49152, 2147483647, 1024, 8, 32], "", 0, []], [[], [["FU", 1, [0, 1]], ["SP", 1, 0, 516096, [7], 1], ["AN", 1, 0, 5], ["AN", 1, 1, 6], ["PR", 1, 0, "auto_unroll_max_step$512"]]]], "r": [[0.00249594], 0, 2.96112, 1639292613], "v": "v0.6"}
{"i": [["[\"reduction_layer\", [128, 4032, 11, 11], [2, 3], false]", "cuda -keys=cuda,gpu -max_num_threads=1024 -thread_warp_size=32", [-1, 16, 64, 49152, 2147483647, 1024, 8, 32], "", 0, []], [[], [["FU", 1, [0, 1]], ["SP", 1, 0, 516096, [32], 1], ["AN", 1, 0, 5], ["AN", 1, 1, 6], ["PR", 1, 0, "auto_unroll_max_step$1024"]]]], "r": [[0.00252249], 0, 3.42069, 1639292616], "v": "v0.6"}
{"i": [["[\"reduction_layer\", [128, 4032, 11, 11], [2, 3], false]", "cuda -keys=cuda,gpu -max_num_threads=1024 -thread_warp_size=32", [-1, 16, 64, 49152, 2147483647, 1024, 8, 32], "", 0, []], [[], [["FU", 1, [0, 1]], ["SP", 1, 0, 516096, [6], 1], ["AN", 1, 0, 5], ["AN", 1, 1, 6], ["PR", 1, 0, "auto_unroll_max_step$512"]]]], "r": [[0.00279292], 0, 2.90153, 1639292618], "v": "v0.6"}
{"i": [["[\"reduction_layer\", [128, 4032, 11, 11], [2, 3], false]", "cuda -keys=cuda,gpu -max_num_threads=1024 -thread_warp_size=32", [-1, 16, 64, 49152, 2147483647, 1024, 8, 32], "", 0, []], [[], [["FU", 1, [0, 1]], ["SP", 1, 0, 516096, [42], 1], ["AN", 1, 0, 5], ["AN", 1, 1, 6], ["PR", 1, 0, "auto_unroll_max_step$1024"]]]], "r": [[0.00300019], 0, 3.31319, 1639292622], "v": "v0.6"}
{"i": [["[\"reduction_layer\", [128, 4032, 11, 11], [2, 3], false]", "cuda -keys=cuda,gpu -max_num_threads=1024 -thread_warp_size=32", [-1, 16, 64, 49152, 2147483647, 1024, 8, 32], "", 0, []], [[], [["FU", 1, [0, 1]], ["SP", 1, 0, 516096, [42], 1], ["AN", 1, 0, 5], ["AN", 1, 1, 6], ["PR", 1, 0, "auto_unroll_max_step$64"]]]], "r": [[0.00300042], 0, 2.78294, 1639292624], "v": "v0.6"}
{"i": [["[\"reduction_layer\", [128, 4032, 11, 11], [2, 3], false]", "cuda -keys=cuda,gpu -max_num_threads=1024 -thread_warp_size=32", [-1, 16, 64, 49152, 2147483647, 1024, 8, 32], "", 0, []], [[], [["FU", 1, [0, 1]], ["SP", 1, 0, 516096, [56], 1], ["AN", 1, 0, 5], ["AN", 1, 1, 6], ["PR", 1, 0, "auto_unroll_max_step$16"]]]], "r": [[0.00291686], 0, 2.80343, 1639292627], "v": "v0.6"}
{"i": [["[\"reduction_layer\", [128, 4032, 11, 11], [2, 3], false]", "cuda -keys=cuda,gpu -max_num_threads=1024 -thread_warp_size=32", [-1, 16, 64, 49152, 2147483647, 1024, 8, 32], "", 0, []], [[], [["FU", 1, [0, 1]], ["SP", 1, 0, 516096, [42], 1], ["AN", 1, 0, 5], ["AN", 1, 1, 6], ["PR", 1, 0, "auto_unroll_max_step$0"]]]], "r": [[0.00300218], 0, 2.91927, 1639292630], "v": "v0.6"}
{"i": [["[\"reduction_layer\", [128, 4032, 11, 11], [2, 3], false]", "cuda -keys=cuda,gpu -max_num_threads=1024 -thread_warp_size=32", [-1, 16, 64, 49152, 2147483647, 1024, 8, 32], "", 0, []], [[], [["FU", 1, [0, 1]], ["SP", 1, 0, 516096, [42], 1], ["AN", 1, 0, 5], ["AN", 1, 1, 6], ["PR", 1, 0, "auto_unroll_max_step$512"]]]], "r": [[0.00300032], 0, 2.77243, 1639292633], "v": "v0.6"}
{"i": [["[\"reduction_layer\", [128, 4032, 11, 11], [2, 3], false]", "cuda -keys=cuda,gpu -max_num_threads=1024 -thread_warp_size=32", [-1, 16, 64, 49152, 2147483647, 1024, 8, 32], "", 0, []], [[], [["FU", 1, [0, 1]], ["SP", 1, 0, 516096, [56], 1], ["AN", 1, 0, 5], ["AN", 1, 1, 6], ["PR", 1, 0, "auto_unroll_max_step$0"]]]], "r": [[0.00291456], 0, 2.86995, 1639292635], "v": "v0.6"}
{"i": [["[\"reduction_layer\", [128, 4032, 11, 11], [2, 3], false]", "cuda -keys=cuda,gpu -max_num_threads=1024 -thread_warp_size=32", [-1, 16, 64, 49152, 2147483647, 1024, 8, 32], "", 0, []], [[], [["FU", 1, [0, 1]], ["SP", 1, 0, 516096, [36], 1], ["AN", 1, 0, 5], ["AN", 1, 1, 6], ["PR", 1, 0, "auto_unroll_max_step$1024"]]]], "r": [[0.00304443], 0, 2.82159, 1639292638], "v": "v0.6"}
{"i": [["[\"reduction_layer\", [128, 4032, 11, 11], [2, 3], false]", "cuda -keys=cuda,gpu -max_num_threads=1024 -thread_warp_size=32", [-1, 16, 64, 49152, 2147483647, 1024, 8, 32], "", 0, []], [[], [["FU", 1, [0, 1]], ["SP", 1, 0, 516096, [56], 1], ["AN", 1, 0, 5], ["AN", 1, 1, 6], ["PR", 1, 0, "auto_unroll_max_step$512"]]]], "r": [[0.00291287], 0, 2.93754, 1639292641], "v": "v0.6"}
{"i": [["[\"reduction_layer\", [128, 4032, 11, 11], [2, 3], false]", "cuda -keys=cuda,gpu -max_num_threads=1024 -thread_warp_size=32", [-1, 16, 64, 49152, 2147483647, 1024, 8, 32], "", 0, []], [[], [["FU", 1, [0, 1]], ["SP", 1, 0, 516096, [48], 1], ["AN", 1, 0, 5], ["AN", 1, 1, 6], ["PR", 1, 0, "auto_unroll_max_step$1024"]]]], "r": [[0.00293512], 0, 3.23454, 1639292644], "v": "v0.6"}
{"i": [["[\"reduction_layer\", [128, 4032, 11, 11], [2, 3], false]", "cuda -keys=cuda,gpu -max_num_threads=1024 -thread_warp_size=32", [-1, 16, 64, 49152, 2147483647, 1024, 8, 32], "", 0, []], [[], [["FU", 1, [0, 1]], ["SP", 1, 0, 516096, [48], 1], ["AN", 1, 0, 5], ["AN", 1, 1, 6], ["PR", 1, 0, "auto_unroll_max_step$0"]]]], "r": [[0.00330293], 0, 3.67895, 1639292648], "v": "v0.6"}
{"i": [["[\"reduction_layer\", [128, 4032, 11, 11], [2, 3], false]", "cuda -keys=cuda,gpu -max_num_threads=1024 -thread_warp_size=32", [-1, 16, 64, 49152, 2147483647, 1024, 8, 32], "", 0, []], [[], [["FU", 1, [0, 1]], ["SP", 1, 0, 516096, [36], 1], ["AN", 1, 0, 5], ["AN", 1, 1, 6], ["PR", 1, 0, "auto_unroll_max_step$0"]]]], "r": [[0.00304434], 0, 3.38279, 1639292651], "v": "v0.6"}
{"i": [["[\"reduction_layer\", [128, 4032, 11, 11], [2, 3], false]", "cuda -keys=cuda,gpu -max_num_threads=1024 -thread_warp_size=32", [-1, 16, 64, 49152, 2147483647, 1024, 8, 32], "", 0, []], [[], [["FU", 1, [0, 1]], ["SP", 1, 0, 516096, [63], 1], ["AN", 1, 0, 5], ["AN", 1, 1, 6], ["PR", 1, 0, "auto_unroll_max_step$16"]]]], "r": [[0.0030619], 0, 2.70207, 1639292653], "v": "v0.6"}
{"i": [["[\"reduction_layer\", [128, 4032, 11, 11], [2, 3], false]", "cuda -keys=cuda,gpu -max_num_threads=1024 -thread_warp_size=32", [-1, 16, 64, 49152, 2147483647, 1024, 8, 32], "", 0, []], [[], [["FU", 1, [2, 3]], ["SP", 1, 2, 121, [30], 1], ["AN", 1, 3, 6], ["FU", 1, [0, 1]], ["AN", 1, 0, 5], ["PR", 1, 0, "auto_unroll_max_step$512"]]]], "r": [[0.00342274], 0, 2.93061, 1639292656], "v": "v0.6"}
{"i": [["[\"reduction_layer\", [128, 4032, 11, 11], [2, 3], false]", "cuda -keys=cuda,gpu -max_num_threads=1024 -thread_warp_size=32", [-1, 16, 64, 49152, 2147483647, 1024, 8, 32], "", 0, []], [[], [["FU", 1, [2, 3]], ["SP", 1, 2, 121, [30], 1], ["AN", 1, 3, 6], ["FU", 1, [0, 1]], ["AN", 1, 0, 5], ["PR", 1, 0, "auto_unroll_max_step$0"]]]], "r": [[0.0034228], 0, 2.96779, 1639292659], "v": "v0.6"}
{"i": [["[\"reduction_layer\", [128, 4032, 11, 11], [2, 3], false]", "cuda -keys=cuda,gpu -max_num_threads=1024 -thread_warp_size=32", [-1, 16, 64, 49152, 2147483647, 1024, 8, 32], "", 0, []], [[], [["FU", 1, [2, 3]], ["SP", 1, 2, 121, [24], 1], ["AN", 1, 3, 6], ["FU", 1, [0, 1]], ["AN", 1, 0, 5], ["PR", 1, 0, "auto_unroll_max_step$1024"]]]], "r": [[0.00349027], 0, 2.89507, 1639292662], "v": "v0.6"}
