artifacts/microbenchmark/tvm/ansor/pooling/ansor_max_pooling_128_84_83_83_3_3_2_SAME.log
{"i": [["[\"pool_layer\", \"max\", 128, 84, 83, 83, 3, 3, 2, \"SAME\"]", "cuda -keys=cuda,gpu -max_num_threads=1024 -thread_warp_size=32", [-1, 16, 64, 49152, 2147483647, 1024, 8, 32], "", 0, []], [[], [["CI", 1], ["FU", 2, [0, 1, 2, 3]], ["SP", 2, 0, 18966528, [7], 1], ["AN", 2, 0, 5], ["AN", 2, 1, 6], ["PR", 2, 0, "auto_unroll_max_step$16"]]]], "r": [[0.0042286], 0, 2.6577, 1637916188], "v": "v0.6"}
{"i": [["[\"pool_layer\", \"max\", 128, 84, 83, 83, 3, 3, 2, \"SAME\"]", "cuda -keys=cuda,gpu -max_num_threads=1024 -thread_warp_size=32", [-1, 16, 64, 49152, 2147483647, 1024, 8, 32], "", 0, []], [[], [["CI", 1], ["FU", 2, [0, 1, 2, 3]], ["SP", 2, 0, 18966528, [49], 1], ["AN", 2, 0, 5], ["AN", 2, 1, 6], ["PR", 2, 0, "auto_unroll_max_step$64"]]]], "r": [[0.000607643], 0, 2.81539, 1637916191], "v": "v0.6"}
{"i": [["[\"pool_layer\", \"max\", 128, 84, 83, 83, 3, 3, 2, \"SAME\"]", "cuda -keys=cuda,gpu -max_num_threads=1024 -thread_warp_size=32", [-1, 16, 64, 49152, 2147483647, 1024, 8, 32], "", 0, []], [[], [["CI", 1], ["FU", 2, [0, 1, 2, 3]], ["SP", 2, 0, 18966528, [1], 1], ["AN", 2, 0, 5], ["AN", 2, 1, 6], ["PR", 2, 0, "auto_unroll_max_step$64"]]]], "r": [[0.0295955], 0, 2.35992, 1637916193], "v": "v0.6"}
{"i": [["[\"pool_layer\", \"max\", 128, 84, 83, 83, 3, 3, 2, \"SAME\"]", "cuda -keys=cuda,gpu -max_num_threads=1024 -thread_warp_size=32", [-1, 16, 64, 49152, 2147483647, 1024, 8, 32], "", 0, []], [[], [["CI", 1], ["FU", 2, [0, 1, 2, 3]], ["SP", 2, 0, 18966528, [4], 1], ["AN", 2, 0, 5], ["AN", 2, 1, 6], ["PR", 2, 0, "auto_unroll_max_step$16"]]]], "r": [[0.00739965], 0, 2.45009, 1637916195], "v": "v0.6"}
{"i": [["[\"pool_layer\", \"max\", 128, 84, 83, 83, 3, 3, 2, \"SAME\"]", "cuda -keys=cuda,gpu -max_num_threads=1024 -thread_warp_size=32", [-1, 16, 64, 49152, 2147483647, 1024, 8, 32], "", 0, []], [[], [["CI", 1], ["FU", 2, [0, 1, 2, 3]], ["SP", 2, 0, 18966528, [16], 1], ["AN", 2, 0, 5], ["AN", 2, 1, 6], ["PR", 2, 0, "auto_unroll_max_step$64"]]]], "r": [[0.00185187], 0, 2.24958, 1637916197], "v": "v0.6"}
{"i": [["[\"pool_layer\", \"max\", 128, 84, 83, 83, 3, 3, 2, \"SAME\"]", "cuda -keys=cuda,gpu -max_num_threads=1024 -thread_warp_size=32", [-1, 16, 64, 49152, 2147483647, 1024, 8, 32], "", 0, []], [[], [["CI", 1], ["FU", 2, [0, 1, 2, 3]], ["SP", 2, 0, 18966528, [64], 1], ["AN", 2, 0, 5], ["AN", 2, 1, 6], ["PR", 2, 0, "auto_unroll_max_step$16"]]]], "r": [[0.000466506], 0, 3.02915, 1637916200], "v": "v0.6"}
{"i": [["[\"pool_layer\", \"max\", 128, 84, 83, 83, 3, 3, 2, \"SAME\"]", "cuda -keys=cuda,gpu -max_num_threads=1024 -thread_warp_size=32", [-1, 16, 64, 49152, 2147483647, 1024, 8, 32], "", 0, []], [[], [["CI", 1], ["FU", 2, [0, 1, 2, 3]], ["SP", 2, 0, 18966528, [21], 1], ["AN", 2, 0, 5], ["AN", 2, 1, 6], ["PR", 2, 0, "auto_unroll_max_step$64"]]]], "r": [[0.00141206], 0, 2.77401, 1637916202], "v": "v0.6"}
{"i": [["[\"pool_layer\", \"max\", 128, 84, 83, 83, 3, 3, 2, \"SAME\"]", "cuda -keys=cuda,gpu -max_num_threads=1024 -thread_warp_size=32", [-1, 16, 64, 49152, 2147483647, 1024, 8, 32], "", 0, []], [[], [["CI", 1], ["FU", 2, [0, 1, 2, 3]], ["SP", 2, 0, 18966528, [3], 1], ["AN", 2, 0, 5], ["AN", 2, 1, 6], ["PR", 2, 0, "auto_unroll_max_step$16"]]]], "r": [[0.00986691], 0, 2.42013, 1637916204], "v": "v0.6"}
{"i": [["[\"pool_layer\", \"max\", 128, 84, 83, 83, 3, 3, 2, \"SAME\"]", "cuda -keys=cuda,gpu -max_num_threads=1024 -thread_warp_size=32", [-1, 16, 64, 49152, 2147483647, 1024, 8, 32], "", 0, []], [[], [["CI", 1], ["FU", 2, [0, 1, 2, 3]], ["SP", 2, 0, 18966528, [8], 1], ["AN", 2, 0, 5], ["AN", 2, 1, 6], ["PR", 2, 0, "auto_unroll_max_step$512"]]]], "r": [[0.00370251], 0, 3.13983, 1637916207], "v": "v0.6"}
{"i": [["[\"pool_layer\", \"max\", 128, 84, 83, 83, 3, 3, 2, \"SAME\"]", "cuda -keys=cuda,gpu -max_num_threads=1024 -thread_warp_size=32", [-1, 16, 64, 49152, 2147483647, 1024, 8, 32], "", 0, []], [[], [["CI", 1], ["FU", 2, [0, 1, 2, 3]], ["SP", 2, 0, 18966528, [24], 1], ["AN", 2, 0, 5], ["AN", 2, 1, 6], ["PR", 2, 0, "auto_unroll_max_step$1024"]]]], "r": [[0.0012359], 0, 2.69389, 1637916209], "v": "v0.6"}
{"i": [["[\"pool_layer\", \"max\", 128, 84, 83, 83, 3, 3, 2, \"SAME\"]", "cuda -keys=cuda,gpu -max_num_threads=1024 -thread_warp_size=32", [-1, 16, 64, 49152, 2147483647, 1024, 8, 32], "", 0, []], [[], [["CI", 1], ["FU", 2, [0, 1, 2, 3]], ["SP", 2, 0, 18966528, [3], 1], ["AN", 2, 0, 5], ["AN", 2, 1, 6], ["PR", 2, 0, "auto_unroll_max_step$1024"]]]], "r": [[0.00986772], 0, 2.3118, 1637916211], "v": "v0.6"}
{"i": [["[\"pool_layer\", \"max\", 128, 84, 83, 83, 3, 3, 2, \"SAME\"]", "cuda -keys=cuda,gpu -max_num_threads=1024 -thread_warp_size=32", [-1, 16, 64, 49152, 2147483647, 1024, 8, 32], "", 0, []], [[], [["CI", 1], ["FU", 2, [0, 1, 2, 3]], ["SP", 2, 0, 18966528, [18], 1], ["AN", 2, 0, 5], ["AN", 2, 1, 6], ["PR", 2, 0, "auto_unroll_max_step$16"]]]], "r": [[0.00164682], 0, 2.79817, 1637916214], "v": "v0.6"}
{"i": [["[\"pool_layer\", \"max\", 128, 84, 83, 83, 3, 3, 2, \"SAME\"]", "cuda -keys=cuda,gpu -max_num_threads=1024 -thread_warp_size=32", [-1, 16, 64, 49152, 2147483647, 1024, 8, 32], "", 0, []], [[], [["CI", 1], ["FU", 2, [0, 1, 2, 3]], ["SP", 2, 0, 18966528, [8], 1], ["AN", 2, 0, 5], ["AN", 2, 1, 6], ["PR", 2, 0, "auto_unroll_max_step$64"]]]], "r": [[0.00370218], 0, 2.8011, 1637916216], "v": "v0.6"}
{"i": [["[\"pool_layer\", \"max\", 128, 84, 83, 83, 3, 3, 2, \"SAME\"]", "cuda -keys=cuda,gpu -max_num_threads=1024 -thread_warp_size=32", [-1, 16, 64, 49152, 2147483647, 1024, 8, 32], "", 0, []], [[], [["CI", 1], ["FU", 2, [0, 1, 2, 3]], ["SP", 2, 0, 18966528, [12], 1], ["AN", 2, 0, 5], ["AN", 2, 1, 6], ["PR", 2, 0, "auto_unroll_max_step$1024"]]]], "r": [[0.00246929], 0, 2.32562, 1637916218], "v": "v0.6"}
{"i": [["[\"pool_layer\", \"max\", 128, 84, 83, 83, 3, 3, 2, \"SAME\"]", "cuda -keys=cuda,gpu -max_num_threads=1024 -thread_warp_size=32", [-1, 16, 64, 49152, 2147483647, 1024, 8, 32], "", 0, []], [[], [["CI", 1], ["FU", 2, [0, 1, 2, 3]], ["SP", 2, 0, 18966528, [9], 1], ["AN", 2, 0, 5], ["AN", 2, 1, 6], ["PR", 2, 0, "auto_unroll_max_step$64"]]]], "r": [[0.00329126], 0, 2.17317, 1637916220], "v": "v0.6"}
{"i": [["[\"pool_layer\", \"max\", 128, 84, 83, 83, 3, 3, 2, \"SAME\"]", "cuda -keys=cuda,gpu -max_num_threads=1024 -thread_warp_size=32", [-1, 16, 64, 49152, 2147483647, 1024, 8, 32], "", 0, []], [[], [["CI", 1], ["FU", 2, [0, 1, 2, 3]], ["SP", 2, 0, 18966528, [7], 1], ["AN", 2, 0, 5], ["AN", 2, 1, 6], ["PR", 2, 0, "auto_unroll_max_step$0"]]]], "r": [[0.00423158], 0, 2.19461, 1637916222], "v": "v0.6"}
{"i": [["[\"pool_layer\", \"max\", 128, 84, 83, 83, 3, 3, 2, \"SAME\"]", "cuda -keys=cuda,gpu -max_num_threads=1024 -thread_warp_size=32", [-1, 16, 64, 49152, 2147483647, 1024, 8, 32], "", 0, []], [[], [["CI", 1], ["FU", 2, [0, 1, 2, 3]], ["SP", 2, 0, 18966528, [24], 1], ["AN", 2, 0, 5], ["AN", 2, 1, 6], ["PR", 2, 0, "auto_unroll_max_step$512"]]]], "r": [[0.00123604], 0, 2.11251, 1637916224], "v": "v0.6"}
{"i": [["[\"pool_layer\", \"max\", 128, 84, 83, 83, 3, 3, 2, \"SAME\"]", "cuda -keys=cuda,gpu -max_num_threads=1024 -thread_warp_size=32", [-1, 16, 64, 49152, 2147483647, 1024, 8, 32], "", 0, []], [[], [["CI", 1], ["FU", 2, [0, 1, 2, 3]], ["SP", 2, 0, 18966528, [18], 1], ["AN", 2, 0, 5], ["AN", 2, 1, 6], ["PR", 2, 0, "auto_unroll_max_step$1024"]]]], "r": [[0.0016469], 0, 2.68038, 1637916226], "v": "v0.6"}
{"i": [["[\"pool_layer\", \"max\", 128, 84, 83, 83, 3, 3, 2, \"SAME\"]", "cuda -keys=cuda,gpu -max_num_threads=1024 -thread_warp_size=32", [-1, 16, 64, 49152, 2147483647, 1024, 8, 32], "", 0, []], [[], [["CI", 1], ["FU", 2, [0, 1, 2, 3]], ["SP", 2, 0, 18966528, [9], 1], ["AN", 2, 0, 5], ["AN", 2, 1, 6], ["PR", 2, 0, "auto_unroll_max_step$16"]]]], "r": [[0.00355445], 0, 2.57956, 1637916229], "v": "v0.6"}
{"i": [["[\"pool_layer\", \"max\", 128, 84, 83, 83, 3, 3, 2, \"SAME\"]", "cuda -keys=cuda,gpu -max_num_threads=1024 -thread_warp_size=32", [-1, 16, 64, 49152, 2147483647, 1024, 8, 32], "", 0, []], [[], [["CI", 1], ["FU", 2, [0, 1, 2, 3]], ["SP", 2, 0, 18966528, [48], 1], ["AN", 2, 0, 5], ["AN", 2, 1, 6], ["PR", 2, 0, "auto_unroll_max_step$0"]]]], "r": [[0.000620109], 0, 3.41322, 1637916232], "v": "v0.6"}
{"i": [["[\"pool_layer\", \"max\", 128, 84, 83, 83, 3, 3, 2, \"SAME\"]", "cuda -keys=cuda,gpu -max_num_threads=1024 -thread_warp_size=32", [-1, 16, 64, 49152, 2147483647, 1024, 8, 32], "", 0, []], [[], [["CI", 1], ["FU", 2, [0, 1, 2, 3]], ["SP", 2, 0, 18966528, [12], 1], ["AN", 2, 0, 5], ["AN", 2, 1, 6], ["PR", 2, 0, "auto_unroll_max_step$512"]]]], "r": [[0.00247174], 0, 2.26212, 1637916234], "v": "v0.6"}
{"i": [["[\"pool_layer\", \"max\", 128, 84, 83, 83, 3, 3, 2, \"SAME\"]", "cuda -keys=cuda,gpu -max_num_threads=1024 -thread_warp_size=32", [-1, 16, 64, 49152, 2147483647, 1024, 8, 32], "", 0, []], [[], [["CI", 1], ["FU", 2, [0, 1, 2, 3]], ["SP", 2, 0, 18966528, [32], 1], ["AN", 2, 0, 5], ["AN", 2, 1, 6], ["PR", 2, 0, "auto_unroll_max_step$1024"]]]], "r": [[0.000927934], 0, 3.13017, 1637916237], "v": "v0.6"}
{"i": [["[\"pool_layer\", \"max\", 128, 84, 83, 83, 3, 3, 2, \"SAME\"]", "cuda -keys=cuda,gpu -max_num_threads=1024 -thread_warp_size=32", [-1, 16, 64, 49152, 2147483647, 1024, 8, 32], "", 0, []], [[], [["CI", 1], ["FU", 2, [0, 1, 2, 3]], ["SP", 2, 0, 18966528, [56], 1], ["AN", 2, 0, 5], ["AN", 2, 1, 6], ["PR", 2, 0, "auto_unroll_max_step$512"]]]], "r": [[0.000532176], 0, 2.68168, 1637916239], "v": "v0.6"}
{"i": [["[\"pool_layer\", \"max\", 128, 84, 83, 83, 3, 3, 2, \"SAME\"]", "cuda -keys=cuda,gpu -max_num_threads=1024 -thread_warp_size=32", [-1, 16, 64, 49152, 2147483647, 1024, 8, 32], "", 0, []], [[], [["CI", 1], ["FU", 2, [0, 1, 2, 3]], ["SP", 2, 0, 18966528, [24], 1], ["AN", 2, 0, 5], ["AN", 2, 1, 6], ["PR", 2, 0, "auto_unroll_max_step$16"]]]], "r": [[0.00123619], 0, 4.95944, 1637916241], "v": "v0.6"}
{"i": [["[\"pool_layer\", \"max\", 128, 84, 83, 83, 3, 3, 2, \"SAME\"]", "cuda -keys=cuda,gpu -max_num_threads=1024 -thread_warp_size=32", [-1, 16, 64, 49152, 2147483647, 1024, 8, 32], "", 0, []], [[], [["CI", 1], ["FU", 2, [0, 1, 2, 3]], ["SP", 2, 0, 18966528, [8], 1], ["AN", 2, 0, 5], ["AN", 2, 1, 6], ["PR", 2, 0, "auto_unroll_max_step$0"]]]], "r": [[0.0037031], 0, 4.93885, 1637916244], "v": "v0.6"}
{"i": [["[\"pool_layer\", \"max\", 128, 84, 83, 83, 3, 3, 2, \"SAME\"]", "cuda -keys=cuda,gpu -max_num_threads=1024 -thread_warp_size=32", [-1, 16, 64, 49152, 2147483647, 1024, 8, 32], "", 0, []], [[], [["CI", 1], ["FU", 2, [0, 1, 2, 3]], ["SP", 2, 0, 18966528, [27], 1], ["AN", 2, 0, 5], ["AN", 2, 1, 6], ["PR", 2, 0, "auto_unroll_max_step$0"]]]], "r": [[0.00109929], 0, 5.04988, 1637916246], "v": "v0.6"}
{"i": [["[\"pool_layer\", \"max\", 128, 84, 83, 83, 3, 3, 2, \"SAME\"]", "cuda -keys=cuda,gpu -max_num_threads=1024 -thread_warp_size=32", [-1, 16, 64, 49152, 2147483647, 1024, 8, 32], "", 0, []], [[], [["CI", 1], ["FU", 2, [0, 1, 2, 3]], ["SP", 2, 0, 18966528, [63], 1], ["AN", 2, 0, 5], ["AN", 2, 1, 6], ["PR", 2, 0, "auto_unroll_max_step$16"]]]], "r": [[0.000473813], 0, 5.25803, 1637916249], "v": "v0.6"}
{"i": [["[\"pool_layer\", \"max\", 128, 84, 83, 83, 3, 3, 2, \"SAME\"]", "cuda -keys=cuda,gpu -max_num_threads=1024 -thread_warp_size=32", [-1, 16, 64, 49152, 2147483647, 1024, 8, 32], "", 0, []], [[], [["CI", 1], ["FU", 2, [0, 1, 2, 3]], ["SP", 2, 0, 18966528, [42], 1], ["AN", 2, 0, 5], ["AN", 2, 1, 6], ["PR", 2, 0, "auto_unroll_max_step$64"]]]], "r": [[0.000709246], 0, 5.04443, 1637916251], "v": "v0.6"}
{"i": [["[\"pool_layer\", \"max\", 128, 84, 83, 83, 3, 3, 2, \"SAME\"]", "cuda -keys=cuda,gpu -max_num_threads=1024 -thread_warp_size=32", [-1, 16, 64, 49152, 2147483647, 1024, 8, 32], "", 0, []], [[], [["CI", 1], ["FU", 2, [0, 1, 2, 3]], ["SP", 2, 0, 18966528, [48], 1], ["AN", 2, 0, 5], ["AN", 2, 1, 6], ["PR", 2, 0, "auto_unroll_max_step$16"]]]], "r": [[0.000620105], 0, 5.19405, 1637916253], "v": "v0.6"}
{"i": [["[\"pool_layer\", \"max\", 128, 84, 83, 83, 3, 3, 2, \"SAME\"]", "cuda -keys=cuda,gpu -max_num_threads=1024 -thread_warp_size=32", [-1, 16, 64, 49152, 2147483647, 1024, 8, 32], "", 0, []], [[], [["CI", 1], ["FU", 2, [0, 1, 2, 3]], ["SP", 2, 0, 18966528, [42], 1], ["AN", 2, 0, 5], ["AN", 2, 1, 6], ["PR", 2, 0, "auto_unroll_max_step$1024"]]]], "r": [[0.000708764], 0, 5.44582, 1637916256], "v": "v0.6"}
{"i": [["[\"pool_layer\", \"max\", 128, 84, 83, 83, 3, 3, 2, \"SAME\"]", "cuda -keys=cuda,gpu -max_num_threads=1024 -thread_warp_size=32", [-1, 16, 64, 49152, 2147483647, 1024, 8, 32], "", 0, []], [[], [["CI", 1], ["FU", 2, [0, 1, 2, 3]], ["SP", 2, 0, 18966528, [28], 1], ["AN", 2, 0, 5], ["AN", 2, 1, 6], ["PR", 2, 0, "auto_unroll_max_step$64"]]]], "r": [[0.00106014], 0, 5.41847, 1637916258], "v": "v0.6"}
{"i": [["[\"pool_layer\", \"max\", 128, 84, 83, 83, 3, 3, 2, \"SAME\"]", "cuda -keys=cuda,gpu -max_num_threads=1024 -thread_warp_size=32", [-1, 16, 64, 49152, 2147483647, 1024, 8, 32], "", 0, []], [[], [["CI", 1], ["FU", 2, [0, 1, 2, 3]], ["SP", 2, 0, 18966528, [48], 1], ["AN", 2, 0, 5], ["AN", 2, 1, 6], ["PR", 2, 0, "auto_unroll_max_step$1024"]]]], "r": [[0.000619975], 0, 5.43143, 1637916260], "v": "v0.6"}
{"i": [["[\"pool_layer\", \"max\", 128, 84, 83, 83, 3, 3, 2, \"SAME\"]", "cuda -keys=cuda,gpu -max_num_threads=1024 -thread_warp_size=32", [-1, 16, 64, 49152, 2147483647, 1024, 8, 32], "", 0, []], [[], [["CI", 1], ["FU", 2, [0, 1, 2, 3]], ["SP", 2, 0, 18966528, [28], 1], ["AN", 2, 0, 5], ["AN", 2, 1, 6], ["PR", 2, 0, "auto_unroll_max_step$1024"]]]], "r": [[0.00106024], 0, 5.12488, 1637916262], "v": "v0.6"}
{"i": [["[\"pool_layer\", \"max\", 128, 84, 83, 83, 3, 3, 2, \"SAME\"]", "cuda -keys=cuda,gpu -max_num_threads=1024 -thread_warp_size=32", [-1, 16, 64, 49152, 2147483647, 1024, 8, 32], "", 0, []], [[], [["CI", 1], ["FU", 2, [0, 1, 2, 3]], ["SP", 2, 0, 18966528, [21], 1], ["AN", 2, 0, 5], ["AN", 2, 1, 6], ["PR", 2, 0, "auto_unroll_max_step$16"]]]], "r": [[0.00141274], 0, 5.57701, 1637916265], "v": "v0.6"}
{"i": [["[\"pool_layer\", \"max\", 128, 84, 83, 83, 3, 3, 2, \"SAME\"]", "cuda -keys=cuda,gpu -max_num_threads=1024 -thread_warp_size=32", [-1, 16, 64, 49152, 2147483647, 1024, 8, 32], "", 0, []], [[], [["CI", 1], ["FU", 2, [0, 1, 2, 3]], ["SP", 2, 0, 18966528, [4], 1], ["AN", 2, 0, 5], ["AN", 2, 1, 6], ["PR", 2, 0, "auto_unroll_max_step$64"]]]], "r": [[0.00740246], 0, 5.06972, 1637916266], "v": "v0.6"}
{"i": [["[\"pool_layer\", \"max\", 128, 84, 83, 83, 3, 3, 2, \"SAME\"]", "cuda -keys=cuda,gpu -max_num_threads=1024 -thread_warp_size=32", [-1, 16, 64, 49152, 2147483647, 1024, 8, 32], "", 0, []], [[], [["CI", 1], ["FU", 2, [0, 1, 2, 3]], ["SP", 2, 0, 18966528, [56], 1], ["AN", 2, 0, 5], ["AN", 2, 1, 6], ["PR", 2, 0, "auto_unroll_max_step$1024"]]]], "r": [[0.000532083], 0, 5.01226, 1637916269], "v": "v0.6"}
{"i": [["[\"pool_layer\", \"max\", 128, 84, 83, 83, 3, 3, 2, \"SAME\"]", "cuda -keys=cuda,gpu -max_num_threads=1024 -thread_warp_size=32", [-1, 16, 64, 49152, 2147483647, 1024, 8, 32], "", 0, []], [[], [["CI", 1], ["FU", 2, [0, 1, 2, 3]], ["SP", 2, 0, 18966528, [54], 1], ["AN", 2, 0, 5], ["AN", 2, 1, 6], ["PR", 2, 0, "auto_unroll_max_step$64"]]]], "r": [[0.00055172], 0, 4.89483, 1637916271], "v": "v0.6"}
{"i": [["[\"pool_layer\", \"max\", 128, 84, 83, 83, 3, 3, 2, \"SAME\"]", "cuda -keys=cuda,gpu -max_num_threads=1024 -thread_warp_size=32", [-1, 16, 64, 49152, 2147483647, 1024, 8, 32], "", 0, []], [[], [["CI", 1], ["FU", 2, [0, 1, 2, 3]], ["SP", 2, 0, 18966528, [36], 1], ["AN", 2, 0, 5], ["AN", 2, 1, 6], ["PR", 2, 0, "auto_unroll_max_step$0"]]]], "r": [[0.000825613], 0, 5.08335, 1637916274], "v": "v0.6"}
{"i": [["[\"pool_layer\", \"max\", 128, 84, 83, 83, 3, 3, 2, \"SAME\"]", "cuda -keys=cuda,gpu -max_num_threads=1024 -thread_warp_size=32", [-1, 16, 64, 49152, 2147483647, 1024, 8, 32], "", 0, []], [[], [["CI", 1], ["FU", 2, [0, 1, 2, 3]], ["SP", 2, 0, 18966528, [2], 1], ["AN", 2, 0, 5], ["AN", 2, 1, 6], ["PR", 2, 0, "auto_unroll_max_step$16"]]]], "r": [[0.0148028], 0, 4.8893, 1637916276], "v": "v0.6"}
{"i": [["[\"pool_layer\", \"max\", 128, 84, 83, 83, 3, 3, 2, \"SAME\"]", "cuda -keys=cuda,gpu -max_num_threads=1024 -thread_warp_size=32", [-1, 16, 64, 49152, 2147483647, 1024, 8, 32], "", 0, []], [[], [["CI", 1], ["FU", 2, [0, 1, 2, 3]], ["SP", 2, 0, 18966528, [2], 1], ["AN", 2, 0, 5], ["AN", 2, 1, 6], ["PR", 2, 0, "auto_unroll_max_step$1024"]]]], "r": [[0.0148045], 0, 5.34761, 1637916278], "v": "v0.6"}
{"i": [["[\"pool_layer\", \"max\", 128, 84, 83, 83, 3, 3, 2, \"SAME\"]", "cuda -keys=cuda,gpu -max_num_threads=1024 -thread_warp_size=32", [-1, 16, 64, 49152, 2147483647, 1024, 8, 32], "", 0, []], [[], [["CI", 1], ["FU", 2, [0, 1, 2, 3]], ["SP", 2, 0, 18966528, [6], 1], ["AN", 2, 0, 5], ["AN", 2, 1, 6], ["PR", 2, 0, "auto_unroll_max_step$0"]]]], "r": [[0.00493612], 0, 4.95616, 1637916280], "v": "v0.6"}
{"i": [["[\"pool_layer\", \"max\", 128, 84, 83, 83, 3, 3, 2, \"SAME\"]", "cuda -keys=cuda,gpu -max_num_threads=1024 -thread_warp_size=32", [-1, 16, 64, 49152, 2147483647, 1024, 8, 32], "", 0, []], [[], [["CI", 1], ["FU", 2, [0, 1, 2, 3]], ["SP", 2, 0, 18966528, [63], 1], ["AN", 2, 0, 5], ["AN", 2, 1, 6], ["PR", 2, 0, "auto_unroll_max_step$64"]]]], "r": [[0.000473763], 0, 5.41755, 1637916283], "v": "v0.6"}
{"i": [["[\"pool_layer\", \"max\", 128, 84, 83, 83, 3, 3, 2, \"SAME\"]", "cuda -keys=cuda,gpu -max_num_threads=1024 -thread_warp_size=32", [-1, 16, 64, 49152, 2147483647, 1024, 8, 32], "", 0, []], [[], [["CI", 1], ["FU", 2, [0, 1, 2, 3]], ["SP", 2, 0, 18966528, [18], 1], ["AN", 2, 0, 5], ["AN", 2, 1, 6], ["PR", 2, 0, "auto_unroll_max_step$64"]]]], "r": [[0.00164748], 0, 5.39445, 1637916285], "v": "v0.6"}
{"i": [["[\"pool_layer\", \"max\", 128, 84, 83, 83, 3, 3, 2, \"SAME\"]", "cuda -keys=cuda,gpu -max_num_threads=1024 -thread_warp_size=32", [-1, 16, 64, 49152, 2147483647, 1024, 8, 32], "", 0, []], [[], [["CI", 1], ["FU", 2, [0, 1, 2, 3]], ["SP", 2, 0, 18966528, [36], 1], ["AN", 2, 0, 5], ["AN", 2, 1, 6], ["PR", 2, 0, "auto_unroll_max_step$1024"]]]], "r": [[0.000826192], 0, 4.92168, 1637916288], "v": "v0.6"}
{"i": [["[\"pool_layer\", \"max\", 128, 84, 83, 83, 3, 3, 2, \"SAME\"]", "cuda -keys=cuda,gpu -max_num_threads=1024 -thread_warp_size=32", [-1, 16, 64, 49152, 2147483647, 1024, 8, 32], "", 0, []], [[], [["CI", 1], ["FU", 2, [0, 1, 2, 3]], ["SP", 2, 0, 18966528, [63], 1], ["AN", 2, 0, 5], ["AN", 2, 1, 6], ["PR", 2, 0, "auto_unroll_max_step$0"]]]], "r": [[0.000473691], 0, 4.88808, 1637916290], "v": "v0.6"}
{"i": [["[\"pool_layer\", \"max\", 128, 84, 83, 83, 3, 3, 2, \"SAME\"]", "cuda -keys=cuda,gpu -max_num_threads=1024 -thread_warp_size=32", [-1, 16, 64, 49152, 2147483647, 1024, 8, 32], "", 0, []], [[], [["CI", 1], ["FU", 2, [0, 1, 2, 3]], ["SP", 2, 0, 18966528, [56], 1], ["AN", 2, 0, 5], ["AN", 2, 1, 6], ["PR", 2, 0, "auto_unroll_max_step$64"]]]], "r": [[0.000532189], 0, 4.79117, 1637916293], "v": "v0.6"}
{"i": [["[\"pool_layer\", \"max\", 128, 84, 83, 83, 3, 3, 2, \"SAME\"]", "cuda -keys=cuda,gpu -max_num_threads=1024 -thread_warp_size=32", [-1, 16, 64, 49152, 2147483647, 1024, 8, 32], "", 0, []], [[], [["CI", 1], ["FU", 2, [0, 1, 2, 3]], ["SP", 2, 0, 18966528, [14], 1], ["AN", 2, 0, 5], ["AN", 2, 1, 6], ["PR", 2, 0, "auto_unroll_max_step$1024"]]]], "r": [[0.00211749], 0, 4.7352, 1637916295], "v": "v0.6"}
{"i": [["[\"pool_layer\", \"max\", 128, 84, 83, 83, 3, 3, 2, \"SAME\"]", "cuda -keys=cuda,gpu -max_num_threads=1024 -thread_warp_size=32", [-1, 16, 64, 49152, 2147483647, 1024, 8, 32], "", 0, []], [[], [["CI", 1], ["FU", 2, [0, 1, 2, 3]], ["SP", 2, 0, 18966528, [4], 1], ["AN", 2, 0, 5], ["AN", 2, 1, 6], ["PR", 2, 0, "auto_unroll_max_step$512"]]]], "r": [[0.00740246], 0, 2.2203, 1637916297], "v": "v0.6"}
{"i": [["[\"pool_layer\", \"max\", 128, 84, 83, 83, 3, 3, 2, \"SAME\"]", "cuda -keys=cuda,gpu -max_num_threads=1024 -thread_warp_size=32", [-1, 16, 64, 49152, 2147483647, 1024, 8, 32], "", 0, []], [[], [["CI", 1], ["FU", 2, [0, 1, 2, 3]], ["SP", 2, 0, 18966528, [32], 1], ["AN", 2, 0, 5], ["AN", 2, 1, 6], ["PR", 2, 0, "auto_unroll_max_step$16"]]]], "r": [[0.000928987], 0, 2.6213, 1637916301], "v": "v0.6"}
{"i": [["[\"pool_layer\", \"max\", 128, 84, 83, 83, 3, 3, 2, \"SAME\"]", "cuda -keys=cuda,gpu -max_num_threads=1024 -thread_warp_size=32", [-1, 16, 64, 49152, 2147483647, 1024, 8, 32], "", 0, []], [[], [["CI", 1], ["FU", 2, [0, 1, 2, 3]], ["SP", 2, 0, 18966528, [9], 1], ["AN", 2, 0, 5], ["AN", 2, 1, 6], ["PR", 2, 0, "auto_unroll_max_step$512"]]]], "r": [[0.00329224], 0, 2.08063, 1637916303], "v": "v0.6"}
{"i": [["[\"pool_layer\", \"max\", 128, 84, 83, 83, 3, 3, 2, \"SAME\"]", "cuda -keys=cuda,gpu -max_num_threads=1024 -thread_warp_size=32", [-1, 16, 64, 49152, 2147483647, 1024, 8, 32], "", 0, []], [[], [["CI", 1], ["FU", 2, [0, 1, 2, 3]], ["SP", 2, 0, 18966528, [64], 1], ["AN", 2, 0, 5], ["AN", 2, 1, 6], ["PR", 2, 0, "auto_unroll_max_step$0"]]]], "r": [[0.000466514], 0, 2.57109, 1637916306], "v": "v0.6"}
{"i": [["[\"pool_layer\", \"max\", 128, 84, 83, 83, 3, 3, 2, \"SAME\"]", "cuda -keys=cuda,gpu -max_num_threads=1024 -thread_warp_size=32", [-1, 16, 64, 49152, 2147483647, 1024, 8, 32], "", 0, []], [[], [["CI", 1], ["FU", 2, [0, 1, 2, 3]], ["SP", 2, 0, 18966528, [24], 1], ["AN", 2, 0, 5], ["AN", 2, 1, 6], ["PR", 2, 0, "auto_unroll_max_step$0"]]]], "r": [[0.00123642], 0, 2.59828, 1637916308], "v": "v0.6"}
{"i": [["[\"pool_layer\", \"max\", 128, 84, 83, 83, 3, 3, 2, \"SAME\"]", "cuda -keys=cuda,gpu -max_num_threads=1024 -thread_warp_size=32", [-1, 16, 64, 49152, 2147483647, 1024, 8, 32], "", 0, []], [[], [["CI", 1], ["FU", 2, [0, 1, 2, 3]], ["SP", 2, 0, 18966528, [14], 1], ["AN", 2, 0, 5], ["AN", 2, 1, 6], ["PR", 2, 0, "auto_unroll_max_step$64"]]]], "r": [[0.0021175], 0, 2.23425, 1637916310], "v": "v0.6"}
{"i": [["[\"pool_layer\", \"max\", 128, 84, 83, 83, 3, 3, 2, \"SAME\"]", "cuda -keys=cuda,gpu -max_num_threads=1024 -thread_warp_size=32", [-1, 16, 64, 49152, 2147483647, 1024, 8, 32], "", 0, []], [[], [["CI", 1], ["FU", 2, [0, 1, 2, 3]], ["SP", 2, 0, 18966528, [54], 1], ["AN", 2, 0, 5], ["AN", 2, 1, 6], ["PR", 2, 0, "auto_unroll_max_step$512"]]]], "r": [[0.000551653], 0, 2.55303, 1637916312], "v": "v0.6"}
{"i": [["[\"pool_layer\", \"max\", 128, 84, 83, 83, 3, 3, 2, \"SAME\"]", "cuda -keys=cuda,gpu -max_num_threads=1024 -thread_warp_size=32", [-1, 16, 64, 49152, 2147483647, 1024, 8, 32], "", 0, []], [[], [["CI", 1], ["FU", 2, [0, 1, 2, 3]], ["SP", 2, 0, 18966528, [3], 1], ["AN", 2, 0, 5], ["AN", 2, 1, 6], ["PR", 2, 0, "auto_unroll_max_step$0"]]]], "r": [[0.00986988], 0, 2.46493, 1637916314], "v": "v0.6"}
{"i": [["[\"pool_layer\", \"max\", 128, 84, 83, 83, 3, 3, 2, \"SAME\"]", "cuda -keys=cuda,gpu -max_num_threads=1024 -thread_warp_size=32", [-1, 16, 64, 49152, 2147483647, 1024, 8, 32], "", 0, []], [[], [["CI", 1], ["FU", 2, [0, 1, 2, 3]], ["SP", 2, 0, 18966528, [1], 1], ["AN", 2, 0, 5], ["AN", 2, 1, 6], ["PR", 2, 0, "auto_unroll_max_step$0"]]]], "r": [[0.0296041], 0, 2.23615, 1637916316], "v": "v0.6"}
{"i": [["[\"pool_layer\", \"max\", 128, 84, 83, 83, 3, 3, 2, \"SAME\"]", "cuda -keys=cuda,gpu -max_num_threads=1024 -thread_warp_size=32", [-1, 16, 64, 49152, 2147483647, 1024, 8, 32], "", 0, []], [[], [["CI", 1], ["FU", 2, [0, 1, 2, 3]], ["SP", 2, 0, 18966528, [42], 1], ["AN", 2, 0, 5], ["AN", 2, 1, 6], ["PR", 2, 0, "auto_unroll_max_step$512"]]]], "r": [[0.00070878], 0, 2.61737, 1637916319], "v": "v0.6"}
{"i": [["[\"pool_layer\", \"max\", 128, 84, 83, 83, 3, 3, 2, \"SAME\"]", "cuda -keys=cuda,gpu -max_num_threads=1024 -thread_warp_size=32", [-1, 16, 64, 49152, 2147483647, 1024, 8, 32], "", 0, []], [[], [["CI", 1], ["FU", 2, [0, 1, 2, 3]], ["SP", 2, 0, 18966528, [28], 1], ["AN", 2, 0, 5], ["AN", 2, 1, 6], ["PR", 2, 0, "auto_unroll_max_step$0"]]]], "r": [[0.00106017], 0, 2.19355, 1637916321], "v": "v0.6"}
{"i": [["[\"pool_layer\", \"max\", 128, 84, 83, 83, 3, 3, 2, \"SAME\"]", "cuda -keys=cuda,gpu -max_num_threads=1024 -thread_warp_size=32", [-1, 16, 64, 49152, 2147483647, 1024, 8, 32], "", 0, []], [[], [["CI", 1], ["FU", 2, [0, 1, 2, 3]], ["SP", 2, 0, 18966528, [21], 1], ["AN", 2, 0, 5], ["AN", 2, 1, 6], ["PR", 2, 0, "auto_unroll_max_step$1024"]]]], "r": [[0.00141249], 0, 2.73928, 1637916323], "v": "v0.6"}
{"i": [["[\"pool_layer\", \"max\", 128, 84, 83, 83, 3, 3, 2, \"SAME\"]", "cuda -keys=cuda,gpu -max_num_threads=1024 -thread_warp_size=32", [-1, 16, 64, 49152, 2147483647, 1024, 8, 32], "", 0, []], [[], [["CI", 1], ["FU", 2, [0, 1, 2, 3]], ["SP", 2, 0, 18966528, [9], 1], ["AN", 2, 0, 5], ["AN", 2, 1, 6], ["PR", 2, 0, "auto_unroll_max_step$0"]]]], "r": [[0.00329278], 0, 2.20309, 1637916325], "v": "v0.6"}
{"i": [["[\"pool_layer\", \"max\", 128, 84, 83, 83, 3, 3, 2, \"SAME\"]", "cuda -keys=cuda,gpu -max_num_threads=1024 -thread_warp_size=32", [-1, 16, 64, 49152, 2147483647, 1024, 8, 32], "", 0, []], [[], [["CI", 1], ["FU", 2, [0, 1, 2, 3]], ["SP", 2, 0, 18966528, [6], 1], ["AN", 2, 0, 5], ["AN", 2, 1, 6], ["PR", 2, 0, "auto_unroll_max_step$64"]]]], "r": [[0.00493636], 0, 2.20697, 1637916327], "v": "v0.6"}
{"i": [["[\"pool_layer\", \"max\", 128, 84, 83, 83, 3, 3, 2, \"SAME\"]", "cuda -keys=cuda,gpu -max_num_threads=1024 -thread_warp_size=32", [-1, 16, 64, 49152, 2147483647, 1024, 8, 32], "", 0, []], [[], [["CI", 1], ["FU", 2, [0, 1, 2, 3]], ["SP", 2, 0, 18966528, [32], 1], ["AN", 2, 0, 5], ["AN", 2, 1, 6], ["PR", 2, 0, "auto_unroll_max_step$512"]]]], "r": [[0.000928183], 0, 2.73094, 1637916330], "v": "v0.6"}
{"i": [["[\"pool_layer\", \"max\", 128, 84, 83, 83, 3, 3, 2, \"SAME\"]", "cuda -keys=cuda,gpu -max_num_threads=1024 -thread_warp_size=32", [-1, 16, 64, 49152, 2147483647, 1024, 8, 32], "", 0, []], [[], [["CI", 1], ["FU", 2, [0, 1, 2, 3]], ["SP", 2, 0, 18966528, [32], 1], ["AN", 2, 0, 5], ["AN", 2, 1, 6], ["PR", 2, 0, "auto_unroll_max_step$64"]]]], "r": [[0.000928086], 0, 2.46081, 1637916332], "v": "v0.6"}
{"i": [["[\"pool_layer\", \"max\", 128, 84, 83, 83, 3, 3, 2, \"SAME\"]", "cuda -keys=cuda,gpu -max_num_threads=1024 -thread_warp_size=32", [-1, 16, 64, 49152, 2147483647, 1024, 8, 32], "", 0, []], [[], [["CI", 1], ["FU", 2, [0, 1, 2, 3]], ["SP", 2, 0, 18966528, [32], 1], ["AN", 2, 0, 5], ["AN", 2, 1, 6], ["PR", 2, 0, "auto_unroll_max_step$0"]]]], "r": [[0.000928088], 0, 2.69107, 1637916334], "v": "v0.6"}
{"i": [["[\"pool_layer\", \"max\", 128, 84, 83, 83, 3, 3, 2, \"SAME\"]", "cuda -keys=cuda,gpu -max_num_threads=1024 -thread_warp_size=32", [-1, 16, 64, 49152, 2147483647, 1024, 8, 32], "", 0, []], [[], [["CI", 1], ["FU", 2, [0, 1, 2, 3]], ["SP", 2, 0, 18966528, [64], 1], ["AN", 2, 0, 5], ["AN", 2, 1, 6], ["PR", 2, 0, "auto_unroll_max_step$1024"]]]], "r": [[0.000467393], 0, 3.03234, 1637916355], "v": "v0.6"}
{"i": [["[\"pool_layer\", \"max\", 128, 84, 83, 83, 3, 3, 2, \"SAME\"]", "cuda -keys=cuda,gpu -max_num_threads=1024 -thread_warp_size=32", [-1, 16, 64, 49152, 2147483647, 1024, 8, 32], "", 0, []], [[], [["CI", 1], ["FU", 2, [0, 1, 2, 3]], ["SP", 2, 0, 18966528, [24], 1], ["AN", 2, 0, 5], ["AN", 2, 1, 6], ["PR", 2, 0, "auto_unroll_max_step$64"]]]], "r": [[0.001236], 0, 3.18389, 1637916358], "v": "v0.6"}
{"i": [["[\"pool_layer\", \"max\", 128, 84, 83, 83, 3, 3, 2, \"SAME\"]", "cuda -keys=cuda,gpu -max_num_threads=1024 -thread_warp_size=32", [-1, 16, 64, 49152, 2147483647, 1024, 8, 32], "", 0, []], [[], [["CI", 1], ["FU", 2, [0, 1, 2, 3]], ["SP", 2, 0, 18966528, [27], 1], ["AN", 2, 0, 5], ["AN", 2, 1, 6], ["PR", 2, 0, "auto_unroll_max_step$512"]]]], "r": [[0.00109911], 0, 2.62457, 1637916360], "v": "v0.6"}
{"i": [["[\"pool_layer\", \"max\", 128, 84, 83, 83, 3, 3, 2, \"SAME\"]", "cuda -keys=cuda,gpu -max_num_threads=1024 -thread_warp_size=32", [-1, 16, 64, 49152, 2147483647, 1024, 8, 32], "", 0, []], [[], [["CI", 1], ["FU", 2, [0, 1, 2, 3]], ["SP", 2, 0, 18966528, [16], 1], ["AN", 2, 0, 5], ["AN", 2, 1, 6], ["PR", 2, 0, "auto_unroll_max_step$0"]]]], "r": [[0.0018525], 0, 2.62061, 1637916362], "v": "v0.6"}
{"i": [["[\"pool_layer\", \"max\", 128, 84, 83, 83, 3, 3, 2, \"SAME\"]", "cuda -keys=cuda,gpu -max_num_threads=1024 -thread_warp_size=32", [-1, 16, 64, 49152, 2147483647, 1024, 8, 32], "", 0, []], [[], [["CI", 1], ["FU", 2, [0, 1, 2, 3]], ["SP", 2, 0, 18966528, [7], 1], ["AN", 2, 0, 5], ["AN", 2, 1, 6], ["PR", 2, 0, "auto_unroll_max_step$64"]]]], "r": [[0.00423078], 0, 2.6123, 1637916364], "v": "v0.6"}
{"i": [["[\"pool_layer\", \"max\", 128, 84, 83, 83, 3, 3, 2, \"SAME\"]", "cuda -keys=cuda,gpu -max_num_threads=1024 -thread_warp_size=32", [-1, 16, 64, 49152, 2147483647, 1024, 8, 32], "", 0, []], [[], [["CI", 1], ["FU", 2, [0, 1, 2, 3]], ["SP", 2, 0, 18966528, [8], 1], ["AN", 2, 0, 5], ["AN", 2, 1, 6], ["PR", 2, 0, "auto_unroll_max_step$1024"]]]], "r": [[0.00370237], 0, 3.12901, 1637916366], "v": "v0.6"}
{"i": [["[\"pool_layer\", \"max\", 128, 84, 83, 83, 3, 3, 2, \"SAME\"]", "cuda -keys=cuda,gpu -max_num_threads=1024 -thread_warp_size=32", [-1, 16, 64, 49152, 2147483647, 1024, 8, 32], "", 0, []], [[], [["CI", 1], ["FU", 2, [0, 1, 2, 3]], ["SP", 2, 0, 18966528, [2], 1], ["AN", 2, 0, 5], ["AN", 2, 1, 6], ["PR", 2, 0, "auto_unroll_max_step$0"]]]], "r": [[0.0148054], 0, 2.71777, 1637916368], "v": "v0.6"}
{"i": [["[\"pool_layer\", \"max\", 128, 84, 83, 83, 3, 3, 2, \"SAME\"]", "cuda -keys=cuda,gpu -max_num_threads=1024 -thread_warp_size=32", [-1, 16, 64, 49152, 2147483647, 1024, 8, 32], "", 0, []], [[], [["CI", 1], ["FU", 2, [0, 1, 2, 3]], ["SP", 2, 0, 18966528, [49], 1], ["AN", 2, 0, 5], ["AN", 2, 1, 6], ["PR", 2, 0, "auto_unroll_max_step$512"]]]], "r": [[0.000607528], 0, 3.01317, 1637916371], "v": "v0.6"}
{"i": [["[\"pool_layer\", \"max\", 128, 84, 83, 83, 3, 3, 2, \"SAME\"]", "cuda -keys=cuda,gpu -max_num_threads=1024 -thread_warp_size=32", [-1, 16, 64, 49152, 2147483647, 1024, 8, 32], "", 0, []], [[], [["CI", 1], ["FU", 2, [0, 1, 2, 3]], ["SP", 2, 0, 18966528, [21], 1], ["AN", 2, 0, 5], ["AN", 2, 1, 6], ["PR", 2, 0, "auto_unroll_max_step$0"]]]], "r": [[0.00141227], 0, 3.09258, 1637916373], "v": "v0.6"}
{"i": [["[\"pool_layer\", \"max\", 128, 84, 83, 83, 3, 3, 2, \"SAME\"]", "cuda -keys=cuda,gpu -max_num_threads=1024 -thread_warp_size=32", [-1, 16, 64, 49152, 2147483647, 1024, 8, 32], "", 0, []], [[], [["CI", 1], ["FU", 2, [0, 1, 2, 3]], ["SP", 2, 0, 18966528, [6], 1], ["AN", 2, 0, 5], ["AN", 2, 1, 6], ["PR", 2, 0, "auto_unroll_max_step$16"]]]], "r": [[0.00493664], 0, 3.12811, 1637916376], "v": "v0.6"}
{"i": [["[\"pool_layer\", \"max\", 128, 84, 83, 83, 3, 3, 2, \"SAME\"]", "cuda -keys=cuda,gpu -max_num_threads=1024 -thread_warp_size=32", [-1, 16, 64, 49152, 2147483647, 1024, 8, 32], "", 0, []], [[], [["CI", 1], ["FU", 2, [0, 1, 2, 3]], ["SP", 2, 0, 18966528, [2], 1], ["AN", 2, 0, 5], ["AN", 2, 1, 6], ["PR", 2, 0, "auto_unroll_max_step$512"]]]], "r": [[0.0148067], 0, 2.64808, 1637916378], "v": "v0.6"}
{"i": [["[\"pool_layer\", \"max\", 128, 84, 83, 83, 3, 3, 2, \"SAME\"]", "cuda -keys=cuda,gpu -max_num_threads=1024 -thread_warp_size=32", [-1, 16, 64, 49152, 2147483647, 1024, 8, 32], "", 0, []], [[], [["CI", 1], ["FU", 2, [0, 1, 2, 3]], ["SP", 2, 0, 18966528, [8], 1], ["AN", 2, 0, 5], ["AN", 2, 1, 6], ["PR", 2, 0, "auto_unroll_max_step$16"]]]], "r": [[0.00370256], 0, 3.14975, 1637916380], "v": "v0.6"}
{"i": [["[\"pool_layer\", \"max\", 128, 84, 83, 83, 3, 3, 2, \"SAME\"]", "cuda -keys=cuda,gpu -max_num_threads=1024 -thread_warp_size=32", [-1, 16, 64, 49152, 2147483647, 1024, 8, 32], "", 0, []], [[], [["CI", 1], ["FU", 2, [0, 1, 2, 3]], ["SP", 2, 0, 18966528, [14], 1], ["AN", 2, 0, 5], ["AN", 2, 1, 6], ["PR", 2, 0, "auto_unroll_max_step$512"]]]], "r": [[0.00211684], 0, 2.66796, 1637916382], "v": "v0.6"}
{"i": [["[\"pool_layer\", \"max\", 128, 84, 83, 83, 3, 3, 2, \"SAME\"]", "cuda -keys=cuda,gpu -max_num_threads=1024 -thread_warp_size=32", [-1, 16, 64, 49152, 2147483647, 1024, 8, 32], "", 0, []], [[], [["CI", 1], ["FU", 2, [0, 1, 2, 3]], ["SP", 2, 0, 18966528, [28], 1], ["AN", 2, 0, 5], ["AN", 2, 1, 6], ["PR", 2, 0, "auto_unroll_max_step$512"]]]], "r": [[0.00106002], 0, 2.96048, 1637916384], "v": "v0.6"}
{"i": [["[\"pool_layer\", \"max\", 128, 84, 83, 83, 3, 3, 2, \"SAME\"]", "cuda -keys=cuda,gpu -max_num_threads=1024 -thread_warp_size=32", [-1, 16, 64, 49152, 2147483647, 1024, 8, 32], "", 0, []], [[], [["CI", 1], ["FU", 2, [0, 1, 2, 3]], ["SP", 2, 0, 18966528, [36], 1], ["AN", 2, 0, 5], ["AN", 2, 1, 6], ["PR", 2, 0, "auto_unroll_max_step$512"]]]], "r": [[0.000825549], 0, 2.88968, 1637916387], "v": "v0.6"}
{"i": [["[\"pool_layer\", \"max\", 128, 84, 83, 83, 3, 3, 2, \"SAME\"]", "cuda -keys=cuda,gpu -max_num_threads=1024 -thread_warp_size=32", [-1, 16, 64, 49152, 2147483647, 1024, 8, 32], "", 0, []], [[], [["CI", 1], ["FU", 2, [0, 1, 2, 3]], ["SP", 2, 0, 18966528, [56], 1], ["AN", 2, 0, 5], ["AN", 2, 1, 6], ["PR", 2, 0, "auto_unroll_max_step$16"]]]], "r": [[0.000532435], 0, 2.84931, 1637916389], "v": "v0.6"}
{"i": [["[\"pool_layer\", \"max\", 128, 84, 83, 83, 3, 3, 2, \"SAME\"]", "cuda -keys=cuda,gpu -max_num_threads=1024 -thread_warp_size=32", [-1, 16, 64, 49152, 2147483647, 1024, 8, 32], "", 0, []], [[], [["CI", 1], ["FU", 2, [0, 1, 2, 3]], ["SP", 2, 0, 18966528, [49], 1], ["AN", 2, 0, 5], ["AN", 2, 1, 6], ["PR", 2, 0, "auto_unroll_max_step$0"]]]], "r": [[0.000607617], 0, 2.89297, 1637916392], "v": "v0.6"}
{"i": [["[\"pool_layer\", \"max\", 128, 84, 83, 83, 3, 3, 2, \"SAME\"]", "cuda -keys=cuda,gpu -max_num_threads=1024 -thread_warp_size=32", [-1, 16, 64, 49152, 2147483647, 1024, 8, 32], "", 0, []], [[], [["CI", 1], ["FU", 2, [0, 1, 2, 3]], ["SP", 2, 0, 18966528, [6], 1], ["AN", 2, 0, 5], ["AN", 2, 1, 6], ["PR", 2, 0, "auto_unroll_max_step$1024"]]]], "r": [[0.00493625], 0, 2.52821, 1637916394], "v": "v0.6"}
{"i": [["[\"pool_layer\", \"max\", 128, 84, 83, 83, 3, 3, 2, \"SAME\"]", "cuda -keys=cuda,gpu -max_num_threads=1024 -thread_warp_size=32", [-1, 16, 64, 49152, 2147483647, 1024, 8, 32], "", 0, []], [[], [["CI", 1], ["FU", 2, [0, 1, 2, 3]], ["SP", 2, 0, 18966528, [48], 1], ["AN", 2, 0, 5], ["AN", 2, 1, 6], ["PR", 2, 0, "auto_unroll_max_step$512"]]]], "r": [[0.000620026], 0, 2.99777, 1637916396], "v": "v0.6"}
{"i": [["[\"pool_layer\", \"max\", 128, 84, 83, 83, 3, 3, 2, \"SAME\"]", "cuda -keys=cuda,gpu -max_num_threads=1024 -thread_warp_size=32", [-1, 16, 64, 49152, 2147483647, 1024, 8, 32], "", 0, []], [[], [["CI", 1], ["FU", 2, [0, 1, 2, 3]], ["SP", 2, 0, 18966528, [6], 1], ["AN", 2, 0, 5], ["AN", 2, 1, 6], ["PR", 2, 0, "auto_unroll_max_step$512"]]]], "r": [[0.00493697], 0, 2.89866, 1637916398], "v": "v0.6"}
{"i": [["[\"pool_layer\", \"max\", 128, 84, 83, 83, 3, 3, 2, \"SAME\"]", "cuda -keys=cuda,gpu -max_num_threads=1024 -thread_warp_size=32", [-1, 16, 64, 49152, 2147483647, 1024, 8, 32], "", 0, []], [[], [["CI", 1], ["FU", 2, [0, 1, 2, 3]], ["SP", 2, 0, 18966528, [12], 1], ["AN", 2, 0, 5], ["AN", 2, 1, 6], ["PR", 2, 0, "auto_unroll_max_step$0"]]]], "r": [[0.00247009], 0, 2.59101, 1637916400], "v": "v0.6"}
{"i": [["[\"pool_layer\", \"max\", 128, 84, 83, 83, 3, 3, 2, \"SAME\"]", "cuda -keys=cuda,gpu -max_num_threads=1024 -thread_warp_size=32", [-1, 16, 64, 49152, 2147483647, 1024, 8, 32], "", 0, []], [[], [["CI", 1], ["FU", 2, [0, 1, 2, 3]], ["SP", 2, 0, 18966528, [28], 1], ["AN", 2, 0, 5], ["AN", 2, 1, 6], ["PR", 2, 0, "auto_unroll_max_step$16"]]]], "r": [[0.0010601], 0, 2.56983, 1637916402], "v": "v0.6"}
{"i": [["[\"pool_layer\", \"max\", 128, 84, 83, 83, 3, 3, 2, \"SAME\"]", "cuda -keys=cuda,gpu -max_num_threads=1024 -thread_warp_size=32", [-1, 16, 64, 49152, 2147483647, 1024, 8, 32], "", 0, []], [[], [["CI", 1], ["FU", 2, [0, 1, 2, 3]], ["SP", 2, 0, 18966528, [27], 1], ["AN", 2, 0, 5], ["AN", 2, 1, 6], ["PR", 2, 0, "auto_unroll_max_step$16"]]]], "r": [[0.00109938], 0, 2.59198, 1637916405], "v": "v0.6"}
{"i": [["[\"pool_layer\", \"max\", 128, 84, 83, 83, 3, 3, 2, \"SAME\"]", "cuda -keys=cuda,gpu -max_num_threads=1024 -thread_warp_size=32", [-1, 16, 64, 49152, 2147483647, 1024, 8, 32], "", 0, []], [[], [["CI", 1], ["FU", 2, [0, 1, 2, 3]], ["SP", 2, 0, 18966528, [27], 1], ["AN", 2, 0, 5], ["AN", 2, 1, 6], ["PR", 2, 0, "auto_unroll_max_step$1024"]]]], "r": [[0.00109925], 0, 2.95467, 1637916407], "v": "v0.6"}
{"i": [["[\"pool_layer\", \"max\", 128, 84, 83, 83, 3, 3, 2, \"SAME\"]", "cuda -keys=cuda,gpu -max_num_threads=1024 -thread_warp_size=32", [-1, 16, 64, 49152, 2147483647, 1024, 8, 32], "", 0, []], [[], [["CI", 1], ["FU", 2, [0, 1, 2, 3]], ["SP", 2, 0, 18966528, [14], 1], ["AN", 2, 0, 5], ["AN", 2, 1, 6], ["PR", 2, 0, "auto_unroll_max_step$16"]]]], "r": [[0.00211785], 0, 2.45792, 1637916409], "v": "v0.6"}
{"i": [["[\"pool_layer\", \"max\", 128, 84, 83, 83, 3, 3, 2, \"SAME\"]", "cuda -keys=cuda,gpu -max_num_threads=1024 -thread_warp_size=32", [-1, 16, 64, 49152, 2147483647, 1024, 8, 32], "", 0, []], [[], [["CI", 1], ["FU", 2, [0, 1, 2, 3]], ["SP", 2, 0, 18966528, [56], 1], ["AN", 2, 0, 5], ["AN", 2, 1, 6], ["PR", 2, 0, "auto_unroll_max_step$0"]]]], "r": [[0.000532063], 0, 2.80008, 1637916411], "v": "v0.6"}
{"i": [["[\"pool_layer\", \"max\", 128, 84, 83, 83, 3, 3, 2, \"SAME\"]", "cuda -keys=cuda,gpu -max_num_threads=1024 -thread_warp_size=32", [-1, 16, 64, 49152, 2147483647, 1024, 8, 32], "", 0, []], [[], [["CI", 1], ["FU", 2, [0, 1, 2, 3]], ["SP", 2, 0, 18966528, [9], 1], ["AN", 2, 0, 5], ["AN", 2, 1, 6], ["PR", 2, 0, "auto_unroll_max_step$1024"]]]], "r": [[0.00329271], 0, 2.52303, 1637916413], "v": "v0.6"}
{"i": [["[\"pool_layer\", \"max\", 128, 84, 83, 83, 3, 3, 2, \"SAME\"]", "cuda -keys=cuda,gpu -max_num_threads=1024 -thread_warp_size=32", [-1, 16, 64, 49152, 2147483647, 1024, 8, 32], "", 0, []], [[], [["CI", 1], ["FU", 2, [0, 1, 2, 3]], ["SP", 2, 0, 18966528, [7], 1], ["AN", 2, 0, 5], ["AN", 2, 1, 6], ["PR", 2, 0, "auto_unroll_max_step$512"]]]], "r": [[0.0042315], 0, 2.32585, 1637916415], "v": "v0.6"}
{"i": [["[\"pool_layer\", \"max\", 128, 84, 83, 83, 3, 3, 2, \"SAME\"]", "cuda -keys=cuda,gpu -max_num_threads=1024 -thread_warp_size=32", [-1, 16, 64, 49152, 2147483647, 1024, 8, 32], "", 0, []], [[], [["CI", 1], ["FU", 2, [0, 1, 2, 3]], ["SP", 2, 0, 18966528, [18], 1], ["AN", 2, 0, 5], ["AN", 2, 1, 6], ["PR", 2, 0, "auto_unroll_max_step$512"]]]], "r": [[0.0016472], 0, 6.21138, 1637916418], "v": "v0.6"}
{"i": [["[\"pool_layer\", \"max\", 128, 84, 83, 83, 3, 3, 2, \"SAME\"]", "cuda -keys=cuda,gpu -max_num_threads=1024 -thread_warp_size=32", [-1, 16, 64, 49152, 2147483647, 1024, 8, 32], "", 0, []], [[], [["CI", 1], ["FU", 2, [0, 1, 2, 3]], ["SP", 2, 0, 18966528, [12], 1], ["AN", 2, 0, 5], ["AN", 2, 1, 6], ["PR", 2, 0, "auto_unroll_max_step$64"]]]], "r": [[0.00246946], 0, 2.40186, 1637916420], "v": "v0.6"}
{"i": [["[\"pool_layer\", \"max\", 128, 84, 83, 83, 3, 3, 2, \"SAME\"]", "cuda -keys=cuda,gpu -max_num_threads=1024 -thread_warp_size=32", [-1, 16, 64, 49152, 2147483647, 1024, 8, 32], "", 0, []], [[], [["CI", 1], ["FU", 2, [0, 1, 2, 3]], ["SP", 2, 0, 18966528, [54], 1], ["AN", 2, 0, 5], ["AN", 2, 1, 6], ["PR", 2, 0, "auto_unroll_max_step$16"]]]], "r": [[0.000551724], 0, 3.125, 1637916423], "v": "v0.6"}
{"i": [["[\"pool_layer\", \"max\", 128, 84, 83, 83, 3, 3, 2, \"SAME\"]", "cuda -keys=cuda,gpu -max_num_threads=1024 -thread_warp_size=32", [-1, 16, 64, 49152, 2147483647, 1024, 8, 32], "", 0, []], [[], [["CI", 1], ["FU", 2, [0, 1, 2, 3]], ["SP", 2, 0, 18966528, [3], 1], ["AN", 2, 0, 5], ["AN", 2, 1, 6], ["PR", 2, 0, "auto_unroll_max_step$64"]]]], "r": [[0.00986902], 0, 5.79246, 1637916425], "v": "v0.6"}
{"i": [["[\"pool_layer\", \"max\", 128, 84, 83, 83, 3, 3, 2, \"SAME\"]", "cuda -keys=cuda,gpu -max_num_threads=1024 -thread_warp_size=32", [-1, 16, 64, 49152, 2147483647, 1024, 8, 32], "", 0, []], [[], [["CI", 1], ["FU", 2, [0, 1, 2, 3]], ["SP", 2, 0, 18966528, [48], 1], ["AN", 2, 0, 5], ["AN", 2, 1, 6], ["PR", 2, 0, "auto_unroll_max_step$64"]]]], "r": [[0.000620075], 0, 2.62814, 1637916427], "v": "v0.6"}
{"i": [["[\"pool_layer\", \"max\", 128, 84, 83, 83, 3, 3, 2, \"SAME\"]", "cuda -keys=cuda,gpu -max_num_threads=1024 -thread_warp_size=32", [-1, 16, 64, 49152, 2147483647, 1024, 8, 32], "", 0, []], [[], [["CI", 1], ["FU", 2, [0, 1, 2, 3]], ["SP", 2, 0, 18966528, [54], 1], ["AN", 2, 0, 5], ["AN", 2, 1, 6], ["PR", 2, 0, "auto_unroll_max_step$1024"]]]], "r": [[0.000551735], 0, 2.64027, 1637916430], "v": "v0.6"}
{"i": [["[\"pool_layer\", \"max\", 128, 84, 83, 83, 3, 3, 2, \"SAME\"]", "cuda -keys=cuda,gpu -max_num_threads=1024 -thread_warp_size=32", [-1, 16, 64, 49152, 2147483647, 1024, 8, 32], "", 0, []], [[], [["CI", 1], ["FU", 2, [0, 1, 2, 3]], ["SP", 2, 0, 18966528, [36], 1], ["AN", 2, 0, 5], ["AN", 2, 1, 6], ["PR", 2, 0, "auto_unroll_max_step$16"]]]], "r": [[0.000825606], 0, 5.99767, 1637916432], "v": "v0.6"}
{"i": [["[\"pool_layer\", \"max\", 128, 84, 83, 83, 3, 3, 2, \"SAME\"]", "cuda -keys=cuda,gpu -max_num_threads=1024 -thread_warp_size=32", [-1, 16, 64, 49152, 2147483647, 1024, 8, 32], "", 0, []], [[], [["CI", 1], ["FU", 2, [0, 1, 2, 3]], ["SP", 2, 0, 18966528, [63], 1], ["AN", 2, 0, 5], ["AN", 2, 1, 6], ["PR", 2, 0, "auto_unroll_max_step$512"]]]], "r": [[0.000473748], 0, 6.12289, 1637916435], "v": "v0.6"}
{"i": [["[\"pool_layer\", \"max\", 128, 84, 83, 83, 3, 3, 2, \"SAME\"]", "cuda -keys=cuda,gpu -max_num_threads=1024 -thread_warp_size=32", [-1, 16, 64, 49152, 2147483647, 1024, 8, 32], "", 0, []], [[], [["CI", 1], ["FU", 2, [0, 1, 2, 3]], ["SP", 2, 0, 18966528, [18], 1], ["AN", 2, 0, 5], ["AN", 2, 1, 6], ["PR", 2, 0, "auto_unroll_max_step$0"]]]], "r": [[0.00164744], 0, 6.17863, 1637916437], "v": "v0.6"}
{"i": [["[\"pool_layer\", \"max\", 128, 84, 83, 83, 3, 3, 2, \"SAME\"]", "cuda -keys=cuda,gpu -max_num_threads=1024 -thread_warp_size=32", [-1, 16, 64, 49152, 2147483647, 1024, 8, 32], "", 0, []], [[], [["CI", 1], ["FU", 2, [0, 1, 2, 3]], ["SP", 2, 0, 18966528, [7], 1], ["AN", 2, 0, 5], ["AN", 2, 1, 6], ["PR", 2, 0, "auto_unroll_max_step$1024"]]]], "r": [[0.00423132], 0, 8.67887, 1637916439], "v": "v0.6"}
{"i": [["[\"pool_layer\", \"max\", 128, 84, 83, 83, 3, 3, 2, \"SAME\"]", "cuda -keys=cuda,gpu -max_num_threads=1024 -thread_warp_size=32", [-1, 16, 64, 49152, 2147483647, 1024, 8, 32], "", 0, []], [[], [["CI", 1], ["FU", 2, [0, 1, 2, 3]], ["SP", 2, 0, 18966528, [3], 1], ["AN", 2, 0, 5], ["AN", 2, 1, 6], ["PR", 2, 0, "auto_unroll_max_step$512"]]]], "r": [[0.00986986], 0, 5.63728, 1637916441], "v": "v0.6"}
{"i": [["[\"pool_layer\", \"max\", 128, 84, 83, 83, 3, 3, 2, \"SAME\"]", "cuda -keys=cuda,gpu -max_num_threads=1024 -thread_warp_size=32", [-1, 16, 64, 49152, 2147483647, 1024, 8, 32], "", 0, []], [[], [["CI", 1], ["FU", 2, [0, 1, 2, 3]], ["SP", 2, 0, 18966528, [42], 1], ["AN", 2, 0, 5], ["AN", 2, 1, 6], ["PR", 2, 0, "auto_unroll_max_step$16"]]]], "r": [[0.000708777], 0, 9.04936, 1637916443], "v": "v0.6"}
{"i": [["[\"pool_layer\", \"max\", 128, 84, 83, 83, 3, 3, 2, \"SAME\"]", "cuda -keys=cuda,gpu -max_num_threads=1024 -thread_warp_size=32", [-1, 16, 64, 49152, 2147483647, 1024, 8, 32], "", 0, []], [[], [["CI", 1], ["FU", 2, [0, 1, 2, 3]], ["SP", 2, 0, 18966528, [27], 1], ["AN", 2, 0, 5], ["AN", 2, 1, 6], ["PR", 2, 0, "auto_unroll_max_step$64"]]]], "r": [[0.00109939], 0, 8.55864, 1637916445], "v": "v0.6"}
{"i": [["[\"pool_layer\", \"max\", 128, 84, 83, 83, 3, 3, 2, \"SAME\"]", "cuda -keys=cuda,gpu -max_num_threads=1024 -thread_warp_size=32", [-1, 16, 64, 49152, 2147483647, 1024, 8, 32], "", 0, []], [[], [["CI", 1], ["FU", 2, [0, 1, 2, 3]], ["SP", 2, 0, 18966528, [49], 1], ["AN", 2, 0, 5], ["AN", 2, 1, 6], ["PR", 2, 0, "auto_unroll_max_step$16"]]]], "r": [[0.000607498], 0, 9.09111, 1637916448], "v": "v0.6"}
{"i": [["[\"pool_layer\", \"max\", 128, 84, 83, 83, 3, 3, 2, \"SAME\"]", "cuda -keys=cuda,gpu -max_num_threads=1024 -thread_warp_size=32", [-1, 16, 64, 49152, 2147483647, 1024, 8, 32], "", 0, []], [[], [["CI", 1], ["FU", 2, [0, 1, 2, 3]], ["SP", 2, 0, 18966528, [1], 1], ["AN", 2, 0, 5], ["AN", 2, 1, 6], ["PR", 2, 0, "auto_unroll_max_step$16"]]]], "r": [[0.0296015], 0, 8.90733, 1637916450], "v": "v0.6"}
{"i": [["[\"pool_layer\", \"max\", 128, 84, 83, 83, 3, 3, 2, \"SAME\"]", "cuda -keys=cuda,gpu -max_num_threads=1024 -thread_warp_size=32", [-1, 16, 64, 49152, 2147483647, 1024, 8, 32], "", 0, []], [[], [["CI", 1], ["FU", 2, [0, 1, 2, 3]], ["SP", 2, 0, 18966528, [16], 1], ["AN", 2, 0, 5], ["AN", 2, 1, 6], ["PR", 2, 0, "auto_unroll_max_step$1024"]]]], "r": [[0.00185297], 0, 6.01276, 1637916452], "v": "v0.6"}
{"i": [["[\"pool_layer\", \"max\", 128, 84, 83, 83, 3, 3, 2, \"SAME\"]", "cuda -keys=cuda,gpu -max_num_threads=1024 -thread_warp_size=32", [-1, 16, 64, 49152, 2147483647, 1024, 8, 32], "", 0, []], [[], [["CI", 1], ["FU", 2, [0, 1, 2, 3]], ["SP", 2, 0, 18966528, [36], 1], ["AN", 2, 0, 5], ["AN", 2, 1, 6], ["PR", 2, 0, "auto_unroll_max_step$64"]]]], "r": [[0.000825735], 0, 6.82947, 1637916455], "v": "v0.6"}
{"i": [["[\"pool_layer\", \"max\", 128, 84, 83, 83, 3, 3, 2, \"SAME\"]", "cuda -keys=cuda,gpu -max_num_threads=1024 -thread_warp_size=32", [-1, 16, 64, 49152, 2147483647, 1024, 8, 32], "", 0, []], [[], [["CI", 1], ["FU", 2, [0, 1, 2, 3]], ["SP", 2, 0, 18966528, [16], 1], ["AN", 2, 0, 5], ["AN", 2, 1, 6], ["PR", 2, 0, "auto_unroll_max_step$512"]]]], "r": [[0.00185309], 0, 8.49285, 1637916457], "v": "v0.6"}
{"i": [["[\"pool_layer\", \"max\", 128, 84, 83, 83, 3, 3, 2, \"SAME\"]", "cuda -keys=cuda,gpu -max_num_threads=1024 -thread_warp_size=32", [-1, 16, 64, 49152, 2147483647, 1024, 8, 32], "", 0, []], [[], [["CI", 1], ["FU", 2, [0, 1, 2, 3]], ["SP", 2, 0, 18966528, [1], 1], ["AN", 2, 0, 5], ["AN", 2, 1, 6], ["PR", 2, 0, "auto_unroll_max_step$1024"]]]], "r": [[0.0296096], 0, 6.54949, 1637916460], "v": "v0.6"}
{"i": [["[\"pool_layer\", \"max\", 128, 84, 83, 83, 3, 3, 2, \"SAME\"]", "cuda -keys=cuda,gpu -max_num_threads=1024 -thread_warp_size=32", [-1, 16, 64, 49152, 2147483647, 1024, 8, 32], "", 0, []], [[], [["CI", 1], ["FU", 2, [0, 1, 2, 3]], ["SP", 2, 0, 18966528, [16], 1], ["AN", 2, 0, 5], ["AN", 2, 1, 6], ["PR", 2, 0, "auto_unroll_max_step$16"]]]], "r": [[0.00185307], 0, 5.78524, 1637916462], "v": "v0.6"}
{"i": [["[\"pool_layer\", \"max\", 128, 84, 83, 83, 3, 3, 2, \"SAME\"]", "cuda -keys=cuda,gpu -max_num_threads=1024 -thread_warp_size=32", [-1, 16, 64, 49152, 2147483647, 1024, 8, 32], "", 0, []], [[], [["CI", 1], ["FU", 2, [0, 1, 2, 3]], ["SP", 2, 0, 18966528, [4], 1], ["AN", 2, 0, 5], ["AN", 2, 1, 6], ["PR", 2, 0, "auto_unroll_max_step$1024"]]]], "r": [[0.00740987], 0, 2.69937, 1637916466], "v": "v0.6"}
{"i": [["[\"pool_layer\", \"max\", 128, 84, 83, 83, 3, 3, 2, \"SAME\"]", "cuda -keys=cuda,gpu -max_num_threads=1024 -thread_warp_size=32", [-1, 16, 64, 49152, 2147483647, 1024, 8, 32], "", 0, []], [[], [["CI", 1], ["FU", 2, [0, 1, 2, 3]], ["SP", 2, 0, 18966528, [21], 1], ["AN", 2, 0, 5], ["AN", 2, 1, 6], ["PR", 2, 0, "auto_unroll_max_step$512"]]]], "r": [[0.00141233], 0, 2.73041, 1637916469], "v": "v0.6"}
{"i": [["[\"pool_layer\", \"max\", 128, 84, 83, 83, 3, 3, 2, \"SAME\"]", "cuda -keys=cuda,gpu -max_num_threads=1024 -thread_warp_size=32", [-1, 16, 64, 49152, 2147483647, 1024, 8, 32], "", 0, []], [[], [["CI", 1], ["FU", 2, [0, 1, 2, 3]], ["SP", 2, 0, 18966528, [49], 1], ["AN", 2, 0, 5], ["AN", 2, 1, 6], ["PR", 2, 0, "auto_unroll_max_step$1024"]]]], "r": [[0.000607496], 0, 2.79042, 1637916471], "v": "v0.6"}
{"i": [["[\"pool_layer\", \"max\", 128, 84, 83, 83, 3, 3, 2, \"SAME\"]", "cuda -keys=cuda,gpu -max_num_threads=1024 -thread_warp_size=32", [-1, 16, 64, 49152, 2147483647, 1024, 8, 32], "", 0, []], [[], [["CI", 1], ["FU", 2, [0, 1, 2, 3]], ["SP", 2, 0, 18966528, [1], 1], ["AN", 2, 0, 5], ["AN", 2, 1, 6], ["PR", 2, 0, "auto_unroll_max_step$512"]]]], "r": [[0.0296042], 0, 2.46222, 1637916473], "v": "v0.6"}
{"i": [["[\"pool_layer\", \"max\", 128, 84, 83, 83, 3, 3, 2, \"SAME\"]", "cuda -keys=cuda,gpu -max_num_threads=1024 -thread_warp_size=32", [-1, 16, 64, 49152, 2147483647, 1024, 8, 32], "", 0, []], [[], [["CI", 1], ["FU", 2, [0, 1, 2, 3]], ["SP", 2, 0, 18966528, [64], 1], ["AN", 2, 0, 5], ["AN", 2, 1, 6], ["PR", 2, 0, "auto_unroll_max_step$64"]]]], "r": [[0.000466474], 0, 2.84799, 1637916476], "v": "v0.6"}
{"i": [["[\"pool_layer\", \"max\", 128, 84, 83, 83, 3, 3, 2, \"SAME\"]", "cuda -keys=cuda,gpu -max_num_threads=1024 -thread_warp_size=32", [-1, 16, 64, 49152, 2147483647, 1024, 8, 32], "", 0, []], [[], [["CI", 1], ["FU", 2, [0, 1, 2, 3]], ["SP", 2, 0, 18966528, [4], 1], ["AN", 2, 0, 5], ["AN", 2, 1, 6], ["PR", 2, 0, "auto_unroll_max_step$0"]]]], "r": [[0.00740438], 0, 2.4363, 1637916478], "v": "v0.6"}
{"i": [["[\"pool_layer\", \"max\", 128, 84, 83, 83, 3, 3, 2, \"SAME\"]", "cuda -keys=cuda,gpu -max_num_threads=1024 -thread_warp_size=32", [-1, 16, 64, 49152, 2147483647, 1024, 8, 32], "", 0, []], [[], [["CI", 1], ["FU", 2, [0, 1, 2, 3]], ["SP", 2, 0, 18966528, [64], 1], ["AN", 2, 0, 5], ["AN", 2, 1, 6], ["PR", 2, 0, "auto_unroll_max_step$512"]]]], "r": [[0.000466465], 0, 3.01153, 1637916480], "v": "v0.6"}
{"i": [["[\"pool_layer\", \"max\", 128, 84, 83, 83, 3, 3, 2, \"SAME\"]", "cuda -keys=cuda,gpu -max_num_threads=1024 -thread_warp_size=32", [-1, 16, 64, 49152, 2147483647, 1024, 8, 32], "", 0, []], [[], [["CI", 1], ["FU", 2, [0, 1, 2, 3]], ["SP", 2, 0, 18966528, [2], 1], ["AN", 2, 0, 5], ["AN", 2, 1, 6], ["PR", 2, 0, "auto_unroll_max_step$64"]]]], "r": [[0.0148029], 0, 2.33925, 1637916482], "v": "v0.6"}
{"i": [["[\"pool_layer\", \"max\", 128, 84, 83, 83, 3, 3, 2, \"SAME\"]", "cuda -keys=cuda,gpu -max_num_threads=1024 -thread_warp_size=32", [-1, 16, 64, 49152, 2147483647, 1024, 8, 32], "", 0, []], [[], [["CI", 1], ["FU", 2, [0, 1, 2, 3]], ["SP", 2, 0, 18966528, [42], 1], ["AN", 2, 0, 5], ["AN", 2, 1, 6], ["PR", 2, 0, "auto_unroll_max_step$0"]]]], "r": [[0.000708781], 0, 2.74792, 1637916485], "v": "v0.6"}
{"i": [["[\"pool_layer\", \"max\", 128, 84, 83, 83, 3, 3, 2, \"SAME\"]", "cuda -keys=cuda,gpu -max_num_threads=1024 -thread_warp_size=32", [-1, 16, 64, 49152, 2147483647, 1024, 8, 32], "", 0, []], [[], [["CI", 1], ["FU", 2, [0, 1, 2, 3]], ["SP", 2, 0, 18966528, [63], 1], ["AN", 2, 0, 5], ["AN", 2, 1, 6], ["PR", 2, 0, "auto_unroll_max_step$1024"]]]], "r": [[0.000473736], 0, 2.6744, 1637916487], "v": "v0.6"}
{"i": [["[\"pool_layer\", \"max\", 128, 84, 83, 83, 3, 3, 2, \"SAME\"]", "cuda -keys=cuda,gpu -max_num_threads=1024 -thread_warp_size=32", [-1, 16, 64, 49152, 2147483647, 1024, 8, 32], "", 0, []], [[], [["CI", 1], ["FU", 2, [0, 1, 2, 3]], ["SP", 2, 0, 18966528, [12], 1], ["AN", 2, 0, 5], ["AN", 2, 1, 6], ["PR", 2, 0, "auto_unroll_max_step$16"]]]], "r": [[0.00246974], 0, 2.20769, 1637916489], "v": "v0.6"}
{"i": [["[\"pool_layer\", \"max\", 128, 84, 83, 83, 3, 3, 2, \"SAME\"]", "cuda -keys=cuda,gpu -max_num_threads=1024 -thread_warp_size=32", [-1, 16, 64, 49152, 2147483647, 1024, 8, 32], "", 0, []], [[], [["CI", 1], ["FU", 2, [0, 1, 2, 3]], ["SP", 2, 0, 18966528, [54], 1], ["AN", 2, 0, 5], ["AN", 2, 1, 6], ["PR", 2, 0, "auto_unroll_max_step$0"]]]], "r": [[0.000551723], 0, 3.01618, 1637916492], "v": "v0.6"}
{"i": [["[\"pool_layer\", \"max\", 128, 84, 83, 83, 3, 3, 2, \"SAME\"]", "cuda -keys=cuda,gpu -max_num_threads=1024 -thread_warp_size=32", [-1, 16, 64, 49152, 2147483647, 1024, 8, 32], "", 0, []], [[], [["CI", 1], ["FU", 2, [0, 1, 2, 3]], ["SP", 2, 0, 18966528, [14], 1], ["AN", 2, 0, 5], ["AN", 2, 1, 6], ["PR", 2, 0, "auto_unroll_max_step$0"]]]], "r": [[0.0021178], 0, 2.2085, 1637916494], "v": "v0.6"}
