artifacts/microbenchmark/tvm/ansor/pooling/ansor_max_pooling_128_42_165_165_3_3_2_SAME.log
{"i": [["[\"pool_layer\", \"max\", 128, 42, 165, 165, 3, 3, 2, \"SAME\"]", "cuda -keys=cuda,gpu -max_num_threads=1024 -thread_warp_size=32", [-1, 16, 64, 49152, 2147483647, 1024, 8, 32], "", 0, []], [[], [["CI", 1], ["FU", 2, [0, 1, 2, 3]], ["SP", 2, 0, 37035264, [56], 1], ["AN", 2, 0, 5], ["AN", 2, 1, 6], ["PR", 2, 0, "auto_unroll_max_step$64"]]]], "r": [[0.00103618], 0, 3.65457, 1637916556], "v": "v0.6"}
{"i": [["[\"pool_layer\", \"max\", 128, 42, 165, 165, 3, 3, 2, \"SAME\"]", "cuda -keys=cuda,gpu -max_num_threads=1024 -thread_warp_size=32", [-1, 16, 64, 49152, 2147483647, 1024, 8, 32], "", 0, []], [[], [["CI", 1], ["FU", 2, [0, 1, 2, 3]], ["SP", 2, 0, 37035264, [12], 1], ["AN", 2, 0, 5], ["AN", 2, 1, 6], ["PR", 2, 0, "auto_unroll_max_step$64"]]]], "r": [[0.0048194], 0, 3.78053, 1637916559], "v": "v0.6"}
{"i": [["[\"pool_layer\", \"max\", 128, 42, 165, 165, 3, 3, 2, \"SAME\"]", "cuda -keys=cuda,gpu -max_num_threads=1024 -thread_warp_size=32", [-1, 16, 64, 49152, 2147483647, 1024, 8, 32], "", 0, []], [[], [["CI", 1], ["FU", 2, [0, 1, 2, 3]], ["SP", 2, 0, 37035264, [48], 1], ["AN", 2, 0, 5], ["AN", 2, 1, 6], ["PR", 2, 0, "auto_unroll_max_step$16"]]]], "r": [[0.00120809], 0, 3.90645, 1637916563], "v": "v0.6"}
{"i": [["[\"pool_layer\", \"max\", 128, 42, 165, 165, 3, 3, 2, \"SAME\"]", "cuda -keys=cuda,gpu -max_num_threads=1024 -thread_warp_size=32", [-1, 16, 64, 49152, 2147483647, 1024, 8, 32], "", 0, []], [[], [["CI", 1], ["FU", 2, [0, 1, 2, 3]], ["SP", 2, 0, 37035264, [4], 1], ["AN", 2, 0, 5], ["AN", 2, 1, 6], ["PR", 2, 0, "auto_unroll_max_step$16"]]]], "r": [[0.0144493], 0, 4.13393, 1637916567], "v": "v0.6"}
{"i": [["[\"pool_layer\", \"max\", 128, 42, 165, 165, 3, 3, 2, \"SAME\"]", "cuda -keys=cuda,gpu -max_num_threads=1024 -thread_warp_size=32", [-1, 16, 64, 49152, 2147483647, 1024, 8, 32], "", 0, []], [[], [["CI", 1], ["FU", 2, [0, 1, 2, 3]], ["SP", 2, 0, 37035264, [1], 1], ["AN", 2, 0, 5], ["AN", 2, 1, 6], ["PR", 2, 0, "auto_unroll_max_step$1024"]]]], "r": [[0.057786], 0, 3.596, 1637916570], "v": "v0.6"}
{"i": [["[\"pool_layer\", \"max\", 128, 42, 165, 165, 3, 3, 2, \"SAME\"]", "cuda -keys=cuda,gpu -max_num_threads=1024 -thread_warp_size=32", [-1, 16, 64, 49152, 2147483647, 1024, 8, 32], "", 0, []], [[], [["CI", 1], ["FU", 2, [0, 1, 2, 3]], ["SP", 2, 0, 37035264, [2], 1], ["AN", 2, 0, 5], ["AN", 2, 1, 6], ["PR", 2, 0, "auto_unroll_max_step$0"]]]], "r": [[0.0288939], 0, 3.68057, 1637916573], "v": "v0.6"}
{"i": [["[\"pool_layer\", \"max\", 128, 42, 165, 165, 3, 3, 2, \"SAME\"]", "cuda -keys=cuda,gpu -max_num_threads=1024 -thread_warp_size=32", [-1, 16, 64, 49152, 2147483647, 1024, 8, 32], "", 0, []], [[], [["CI", 1], ["FU", 2, [0, 1, 2, 3]], ["SP", 2, 0, 37035264, [32], 1], ["AN", 2, 0, 5], ["AN", 2, 1, 6], ["PR", 2, 0, "auto_unroll_max_step$0"]]]], "r": [[0.00180902], 0, 3.37784, 1637916576], "v": "v0.6"}
{"i": [["[\"pool_layer\", \"max\", 128, 42, 165, 165, 3, 3, 2, \"SAME\"]", "cuda -keys=cuda,gpu -max_num_threads=1024 -thread_warp_size=32", [-1, 16, 64, 49152, 2147483647, 1024, 8, 32], "", 0, []], [[], [["CI", 1], ["FU", 2, [0, 1, 2, 3]], ["SP", 2, 0, 37035264, [3], 1], ["AN", 2, 0, 5], ["AN", 2, 1, 6], ["PR", 2, 0, "auto_unroll_max_step$16"]]]], "r": [[0.019264], 0, 3.52441, 1637916580], "v": "v0.6"}
{"i": [["[\"pool_layer\", \"max\", 128, 42, 165, 165, 3, 3, 2, \"SAME\"]", "cuda -keys=cuda,gpu -max_num_threads=1024 -thread_warp_size=32", [-1, 16, 64, 49152, 2147483647, 1024, 8, 32], "", 0, []], [[], [["CI", 1], ["FU", 2, [0, 1, 2, 3]], ["SP", 2, 0, 37035264, [6], 1], ["AN", 2, 0, 5], ["AN", 2, 1, 6], ["PR", 2, 0, "auto_unroll_max_step$16"]]]], "r": [[0.00963255], 0, 3.56051, 1637916583], "v": "v0.6"}
{"i": [["[\"pool_layer\", \"max\", 128, 42, 165, 165, 3, 3, 2, \"SAME\"]", "cuda -keys=cuda,gpu -max_num_threads=1024 -thread_warp_size=32", [-1, 16, 64, 49152, 2147483647, 1024, 8, 32], "", 0, []], [[], [["CI", 1], ["FU", 2, [0, 1, 2, 3]], ["SP", 2, 0, 37035264, [48], 1], ["AN", 2, 0, 5], ["AN", 2, 1, 6], ["PR", 2, 0, "auto_unroll_max_step$64"]]]], "r": [[0.00120799], 0, 3.72321, 1637916586], "v": "v0.6"}
{"i": [["[\"pool_layer\", \"max\", 128, 42, 165, 165, 3, 3, 2, \"SAME\"]", "cuda -keys=cuda,gpu -max_num_threads=1024 -thread_warp_size=32", [-1, 16, 64, 49152, 2147483647, 1024, 8, 32], "", 0, []], [[], [["CI", 1], ["FU", 2, [0, 1, 2, 3]], ["SP", 2, 0, 37035264, [42], 1], ["AN", 2, 0, 5], ["AN", 2, 1, 6], ["PR", 2, 0, "auto_unroll_max_step$0"]]]], "r": [[0.00137991], 0, 3.95087, 1637916590], "v": "v0.6"}
{"i": [["[\"pool_layer\", \"max\", 128, 42, 165, 165, 3, 3, 2, \"SAME\"]", "cuda -keys=cuda,gpu -max_num_threads=1024 -thread_warp_size=32", [-1, 16, 64, 49152, 2147483647, 1024, 8, 32], "", 0, []], [[], [["CI", 1], ["FU", 2, [0, 1, 2, 3]], ["SP", 2, 0, 37035264, [2], 1], ["AN", 2, 0, 5], ["AN", 2, 1, 6], ["PR", 2, 0, "auto_unroll_max_step$1024"]]]], "r": [[0.028896], 0, 3.4178, 1637916593], "v": "v0.6"}
{"i": [["[\"pool_layer\", \"max\", 128, 42, 165, 165, 3, 3, 2, \"SAME\"]", "cuda -keys=cuda,gpu -max_num_threads=1024 -thread_warp_size=32", [-1, 16, 64, 49152, 2147483647, 1024, 8, 32], "", 0, []], [[], [["CI", 1], ["FU", 2, [0, 1, 2, 3]], ["SP", 2, 0, 37035264, [14], 1], ["AN", 2, 0, 5], ["AN", 2, 1, 6], ["PR", 2, 0, "auto_unroll_max_step$16"]]]], "r": [[0.00413032], 0, 3.35968, 1637916596], "v": "v0.6"}
{"i": [["[\"pool_layer\", \"max\", 128, 42, 165, 165, 3, 3, 2, \"SAME\"]", "cuda -keys=cuda,gpu -max_num_threads=1024 -thread_warp_size=32", [-1, 16, 64, 49152, 2147483647, 1024, 8, 32], "", 0, []], [[], [["CI", 1], ["FU", 2, [0, 1, 2, 3]], ["SP", 2, 0, 37035264, [2], 1], ["AN", 2, 0, 5], ["AN", 2, 1, 6], ["PR", 2, 0, "auto_unroll_max_step$16"]]]], "r": [[0.0288972], 0, 3.35397, 1637916599], "v": "v0.6"}
{"i": [["[\"pool_layer\", \"max\", 128, 42, 165, 165, 3, 3, 2, \"SAME\"]", "cuda -keys=cuda,gpu -max_num_threads=1024 -thread_warp_size=32", [-1, 16, 64, 49152, 2147483647, 1024, 8, 32], "", 0, []], [[], [["CI", 1], ["FU", 2, [0, 1, 2, 3]], ["SP", 2, 0, 37035264, [56], 1], ["AN", 2, 0, 5], ["AN", 2, 1, 6], ["PR", 2, 0, "auto_unroll_max_step$16"]]]], "r": [[0.00103636], 0, 3.72798, 1637916603], "v": "v0.6"}
{"i": [["[\"pool_layer\", \"max\", 128, 42, 165, 165, 3, 3, 2, \"SAME\"]", "cuda -keys=cuda,gpu -max_num_threads=1024 -thread_warp_size=32", [-1, 16, 64, 49152, 2147483647, 1024, 8, 32], "", 0, []], [[], [["CI", 1], ["FU", 2, [0, 1, 2, 3]], ["SP", 2, 0, 37035264, [28], 1], ["AN", 2, 0, 5], ["AN", 2, 1, 6], ["PR", 2, 0, "auto_unroll_max_step$16"]]]], "r": [[0.00217552], 0, 5.45349, 1637916606], "v": "v0.6"}
{"i": [["[\"pool_layer\", \"max\", 128, 42, 165, 165, 3, 3, 2, \"SAME\"]", "cuda -keys=cuda,gpu -max_num_threads=1024 -thread_warp_size=32", [-1, 16, 64, 49152, 2147483647, 1024, 8, 32], "", 0, []], [[], [["CI", 1], ["FU", 2, [0, 1, 2, 3]], ["SP", 2, 0, 37035264, [16], 1], ["AN", 2, 0, 5], ["AN", 2, 1, 6], ["PR", 2, 0, "auto_unroll_max_step$512"]]]], "r": [[0.00361474], 0, 3.28452, 1637916609], "v": "v0.6"}
{"i": [["[\"pool_layer\", \"max\", 128, 42, 165, 165, 3, 3, 2, \"SAME\"]", "cuda -keys=cuda,gpu -max_num_threads=1024 -thread_warp_size=32", [-1, 16, 64, 49152, 2147483647, 1024, 8, 32], "", 0, []], [[], [["CI", 1], ["FU", 2, [0, 1, 2, 3]], ["SP", 2, 0, 37035264, [8], 1], ["AN", 2, 0, 5], ["AN", 2, 1, 6], ["PR", 2, 0, "auto_unroll_max_step$16"]]]], "r": [[0.00722597], 0, 3.27264, 1637916612], "v": "v0.6"}
{"i": [["[\"pool_layer\", \"max\", 128, 42, 165, 165, 3, 3, 2, \"SAME\"]", "cuda -keys=cuda,gpu -max_num_threads=1024 -thread_warp_size=32", [-1, 16, 64, 49152, 2147483647, 1024, 8, 32], "", 0, []], [[], [["CI", 1], ["FU", 2, [0, 1, 2, 3]], ["SP", 2, 0, 37035264, [48], 1], ["AN", 2, 0, 5], ["AN", 2, 1, 6], ["PR", 2, 0, "auto_unroll_max_step$0"]]]], "r": [[0.00120805], 0, 3.82841, 1637916615], "v": "v0.6"}
{"i": [["[\"pool_layer\", \"max\", 128, 42, 165, 165, 3, 3, 2, \"SAME\"]", "cuda -keys=cuda,gpu -max_num_threads=1024 -thread_warp_size=32", [-1, 16, 64, 49152, 2147483647, 1024, 8, 32], "", 0, []], [[], [["CI", 1], ["FU", 2, [0, 1, 2, 3]], ["SP", 2, 0, 37035264, [1], 1], ["AN", 2, 0, 5], ["AN", 2, 1, 6], ["PR", 2, 0, "auto_unroll_max_step$64"]]]], "r": [[0.0577975], 0, 3.53953, 1637916619], "v": "v0.6"}
{"i": [["[\"pool_layer\", \"max\", 128, 42, 165, 165, 3, 3, 2, \"SAME\"]", "cuda -keys=cuda,gpu -max_num_threads=1024 -thread_warp_size=32", [-1, 16, 64, 49152, 2147483647, 1024, 8, 32], "", 0, []], [[], [["CI", 1], ["FU", 2, [0, 1, 2, 3]], ["SP", 2, 0, 37035264, [56], 1], ["AN", 2, 0, 5], ["AN", 2, 1, 6], ["PR", 2, 0, "auto_unroll_max_step$0"]]]], "r": [[0.0010362], 0, 3.78287, 1637916622], "v": "v0.6"}
{"i": [["[\"pool_layer\", \"max\", 128, 42, 165, 165, 3, 3, 2, \"SAME\"]", "cuda -keys=cuda,gpu -max_num_threads=1024 -thread_warp_size=32", [-1, 16, 64, 49152, 2147483647, 1024, 8, 32], "", 0, []], [[], [["CI", 1], ["FU", 2, [0, 1, 2, 3]], ["SP", 2, 0, 37035264, [7], 1], ["AN", 2, 0, 5], ["AN", 2, 1, 6], ["PR", 2, 0, "auto_unroll_max_step$512"]]]], "r": [[0.0082588], 0, 3.68616, 1637916626], "v": "v0.6"}
{"i": [["[\"pool_layer\", \"max\", 128, 42, 165, 165, 3, 3, 2, \"SAME\"]", "cuda -keys=cuda,gpu -max_num_threads=1024 -thread_warp_size=32", [-1, 16, 64, 49152, 2147483647, 1024, 8, 32], "", 0, []], [[], [["CI", 1], ["FU", 2, [0, 1, 2, 3]], ["SP", 2, 0, 37035264, [24], 1], ["AN", 2, 0, 5], ["AN", 2, 1, 6], ["PR", 2, 0, "auto_unroll_max_step$512"]]]], "r": [[0.00241125], 0, 3.34068, 1637916629], "v": "v0.6"}
{"i": [["[\"pool_layer\", \"max\", 128, 42, 165, 165, 3, 3, 2, \"SAME\"]", "cuda -keys=cuda,gpu -max_num_threads=1024 -thread_warp_size=32", [-1, 16, 64, 49152, 2147483647, 1024, 8, 32], "", 0, []], [[], [["CI", 1], ["FU", 2, [0, 1, 2, 3]], ["SP", 2, 0, 37035264, [14], 1], ["AN", 2, 0, 5], ["AN", 2, 1, 6], ["PR", 2, 0, "auto_unroll_max_step$0"]]]], "r": [[0.00413072], 0, 3.35476, 1637916632], "v": "v0.6"}
{"i": [["[\"pool_layer\", \"max\", 128, 42, 165, 165, 3, 3, 2, \"SAME\"]", "cuda -keys=cuda,gpu -max_num_threads=1024 -thread_warp_size=32", [-1, 16, 64, 49152, 2147483647, 1024, 8, 32], "", 0, []], [[], [["CI", 1], ["FU", 2, [0, 1, 2, 3]], ["SP", 2, 0, 37035264, [21], 1], ["AN", 2, 0, 5], ["AN", 2, 1, 6], ["PR", 2, 0, "auto_unroll_max_step$1024"]]]], "r": [[0.00275468], 0, 5.64532, 1637916635], "v": "v0.6"}
{"i": [["[\"pool_layer\", \"max\", 128, 42, 165, 165, 3, 3, 2, \"SAME\"]", "cuda -keys=cuda,gpu -max_num_threads=1024 -thread_warp_size=32", [-1, 16, 64, 49152, 2147483647, 1024, 8, 32], "", 0, []], [[], [["CI", 1], ["FU", 2, [0, 1, 2, 3]], ["SP", 2, 0, 37035264, [12], 1], ["AN", 2, 0, 5], ["AN", 2, 1, 6], ["PR", 2, 0, "auto_unroll_max_step$1024"]]]], "r": [[0.00481855], 0, 3.21073, 1637916638], "v": "v0.6"}
{"i": [["[\"pool_layer\", \"max\", 128, 42, 165, 165, 3, 3, 2, \"SAME\"]", "cuda -keys=cuda,gpu -max_num_threads=1024 -thread_warp_size=32", [-1, 16, 64, 49152, 2147483647, 1024, 8, 32], "", 0, []], [[], [["CI", 1], ["FU", 2, [0, 1, 2, 3]], ["SP", 2, 0, 37035264, [6], 1], ["AN", 2, 0, 5], ["AN", 2, 1, 6], ["PR", 2, 0, "auto_unroll_max_step$1024"]]]], "r": [[0.00963402], 0, 5.40725, 1637916641], "v": "v0.6"}
{"i": [["[\"pool_layer\", \"max\", 128, 42, 165, 165, 3, 3, 2, \"SAME\"]", "cuda -keys=cuda,gpu -max_num_threads=1024 -thread_warp_size=32", [-1, 16, 64, 49152, 2147483647, 1024, 8, 32], "", 0, []], [[], [["CI", 1], ["FU", 2, [0, 1, 2, 3]], ["SP", 2, 0, 37035264, [42], 1], ["AN", 2, 0, 5], ["AN", 2, 1, 6], ["PR", 2, 0, "auto_unroll_max_step$16"]]]], "r": [[0.00138005], 0, 5.86097, 1637916644], "v": "v0.6"}
{"i": [["[\"pool_layer\", \"max\", 128, 42, 165, 165, 3, 3, 2, \"SAME\"]", "cuda -keys=cuda,gpu -max_num_threads=1024 -thread_warp_size=32", [-1, 16, 64, 49152, 2147483647, 1024, 8, 32], "", 0, []], [[], [["CI", 1], ["FU", 2, [0, 1, 2, 3]], ["SP", 2, 0, 37035264, [24], 1], ["AN", 2, 0, 5], ["AN", 2, 1, 6], ["PR", 2, 0, "auto_unroll_max_step$16"]]]], "r": [[0.00241095], 0, 5.68572, 1637916647], "v": "v0.6"}
{"i": [["[\"pool_layer\", \"max\", 128, 42, 165, 165, 3, 3, 2, \"SAME\"]", "cuda -keys=cuda,gpu -max_num_threads=1024 -thread_warp_size=32", [-1, 16, 64, 49152, 2147483647, 1024, 8, 32], "", 0, []], [[], [["CI", 1], ["FU", 2, [0, 1, 2, 3]], ["SP", 2, 0, 37035264, [64], 1], ["AN", 2, 0, 5], ["AN", 2, 1, 6], ["PR", 2, 0, "auto_unroll_max_step$1024"]]]], "r": [[0.000910102], 0, 6.14301, 1637916651], "v": "v0.6"}
{"i": [["[\"pool_layer\", \"max\", 128, 42, 165, 165, 3, 3, 2, \"SAME\"]", "cuda -keys=cuda,gpu -max_num_threads=1024 -thread_warp_size=32", [-1, 16, 64, 49152, 2147483647, 1024, 8, 32], "", 0, []], [[], [["CI", 1], ["FU", 2, [0, 1, 2, 3]], ["SP", 2, 0, 37035264, [2], 1], ["AN", 2, 0, 5], ["AN", 2, 1, 6], ["PR", 2, 0, "auto_unroll_max_step$512"]]]], "r": [[0.0288987], 0, 5.87901, 1637916654], "v": "v0.6"}
{"i": [["[\"pool_layer\", \"max\", 128, 42, 165, 165, 3, 3, 2, \"SAME\"]", "cuda -keys=cuda,gpu -max_num_threads=1024 -thread_warp_size=32", [-1, 16, 64, 49152, 2147483647, 1024, 8, 32], "", 0, []], [[], [["CI", 1], ["FU", 2, [0, 1, 2, 3]], ["SP", 2, 0, 37035264, [28], 1], ["AN", 2, 0, 5], ["AN", 2, 1, 6], ["PR", 2, 0, "auto_unroll_max_step$0"]]]], "r": [[0.00206719], 0, 6.35278, 1637916658], "v": "v0.6"}
{"i": [["[\"pool_layer\", \"max\", 128, 42, 165, 165, 3, 3, 2, \"SAME\"]", "cuda -keys=cuda,gpu -max_num_threads=1024 -thread_warp_size=32", [-1, 16, 64, 49152, 2147483647, 1024, 8, 32], "", 0, []], [[], [["CI", 1], ["FU", 2, [0, 1, 2, 3]], ["SP", 2, 0, 37035264, [16], 1], ["AN", 2, 0, 5], ["AN", 2, 1, 6], ["PR", 2, 0, "auto_unroll_max_step$64"]]]], "r": [[0.00361487], 0, 5.89732, 1637916661], "v": "v0.6"}
{"i": [["[\"pool_layer\", \"max\", 128, 42, 165, 165, 3, 3, 2, \"SAME\"]", "cuda -keys=cuda,gpu -max_num_threads=1024 -thread_warp_size=32", [-1, 16, 64, 49152, 2147483647, 1024, 8, 32], "", 0, []], [[], [["CI", 1], ["FU", 2, [0, 1, 2, 3]], ["SP", 2, 0, 37035264, [42], 1], ["AN", 2, 0, 5], ["AN", 2, 1, 6], ["PR", 2, 0, "auto_unroll_max_step$64"]]]], "r": [[0.00138003], 0, 6.835, 1637916665], "v": "v0.6"}
{"i": [["[\"pool_layer\", \"max\", 128, 42, 165, 165, 3, 3, 2, \"SAME\"]", "cuda -keys=cuda,gpu -max_num_threads=1024 -thread_warp_size=32", [-1, 16, 64, 49152, 2147483647, 1024, 8, 32], "", 0, []], [[], [["CI", 1], ["FU", 2, [0, 1, 2, 3]], ["SP", 2, 0, 37035264, [4], 1], ["AN", 2, 0, 5], ["AN", 2, 1, 6], ["PR", 2, 0, "auto_unroll_max_step$0"]]]], "r": [[0.0144505], 0, 5.81961, 1637916668], "v": "v0.6"}
{"i": [["[\"pool_layer\", \"max\", 128, 42, 165, 165, 3, 3, 2, \"SAME\"]", "cuda -keys=cuda,gpu -max_num_threads=1024 -thread_warp_size=32", [-1, 16, 64, 49152, 2147483647, 1024, 8, 32], "", 0, []], [[], [["CI", 1], ["FU", 2, [0, 1, 2, 3]], ["SP", 2, 0, 37035264, [4], 1], ["AN", 2, 0, 5], ["AN", 2, 1, 6], ["PR", 2, 0, "auto_unroll_max_step$512"]]]], "r": [[0.0144505], 0, 6.14528, 1637916671], "v": "v0.6"}
{"i": [["[\"pool_layer\", \"max\", 128, 42, 165, 165, 3, 3, 2, \"SAME\"]", "cuda -keys=cuda,gpu -max_num_threads=1024 -thread_warp_size=32", [-1, 16, 64, 49152, 2147483647, 1024, 8, 32], "", 0, []], [[], [["CI", 1], ["FU", 2, [0, 1, 2, 3]], ["SP", 2, 0, 37035264, [6], 1], ["AN", 2, 0, 5], ["AN", 2, 1, 6], ["PR", 2, 0, "auto_unroll_max_step$0"]]]], "r": [[0.00963406], 0, 5.8557, 1637916674], "v": "v0.6"}
{"i": [["[\"pool_layer\", \"max\", 128, 42, 165, 165, 3, 3, 2, \"SAME\"]", "cuda -keys=cuda,gpu -max_num_threads=1024 -thread_warp_size=32", [-1, 16, 64, 49152, 2147483647, 1024, 8, 32], "", 0, []], [[], [["CI", 1], ["FU", 2, [0, 1, 2, 3]], ["SP", 2, 0, 37035264, [64], 1], ["AN", 2, 0, 5], ["AN", 2, 1, 6], ["PR", 2, 0, "auto_unroll_max_step$16"]]]], "r": [[0.00090973], 0, 6.48526, 1637916677], "v": "v0.6"}
{"i": [["[\"pool_layer\", \"max\", 128, 42, 165, 165, 3, 3, 2, \"SAME\"]", "cuda -keys=cuda,gpu -max_num_threads=1024 -thread_warp_size=32", [-1, 16, 64, 49152, 2147483647, 1024, 8, 32], "", 0, []], [[], [["CI", 1], ["FU", 2, [0, 1, 2, 3]], ["SP", 2, 0, 37035264, [3], 1], ["AN", 2, 0, 5], ["AN", 2, 1, 6], ["PR", 2, 0, "auto_unroll_max_step$512"]]]], "r": [[0.0192677], 0, 6.19627, 1637916681], "v": "v0.6"}
{"i": [["[\"pool_layer\", \"max\", 128, 42, 165, 165, 3, 3, 2, \"SAME\"]", "cuda -keys=cuda,gpu -max_num_threads=1024 -thread_warp_size=32", [-1, 16, 64, 49152, 2147483647, 1024, 8, 32], "", 0, []], [[], [["CI", 1], ["FU", 2, [0, 1, 2, 3]], ["SP", 2, 0, 37035264, [12], 1], ["AN", 2, 0, 5], ["AN", 2, 1, 6], ["PR", 2, 0, "auto_unroll_max_step$512"]]]], "r": [[0.00481872], 0, 6.52655, 1637916684], "v": "v0.6"}
{"i": [["[\"pool_layer\", \"max\", 128, 42, 165, 165, 3, 3, 2, \"SAME\"]", "cuda -keys=cuda,gpu -max_num_threads=1024 -thread_warp_size=32", [-1, 16, 64, 49152, 2147483647, 1024, 8, 32], "", 0, []], [[], [["CI", 1], ["FU", 2, [0, 1, 2, 3]], ["SP", 2, 0, 37035264, [2], 1], ["AN", 2, 0, 5], ["AN", 2, 1, 6], ["PR", 2, 0, "auto_unroll_max_step$64"]]]], "r": [[0.0288992], 0, 6.20605, 1637916687], "v": "v0.6"}
{"i": [["[\"pool_layer\", \"max\", 128, 42, 165, 165, 3, 3, 2, \"SAME\"]", "cuda -keys=cuda,gpu -max_num_threads=1024 -thread_warp_size=32", [-1, 16, 64, 49152, 2147483647, 1024, 8, 32], "", 0, []], [[], [["CI", 1], ["FU", 2, [0, 1, 2, 3]], ["SP", 2, 0, 37035264, [16], 1], ["AN", 2, 0, 5], ["AN", 2, 1, 6], ["PR", 2, 0, "auto_unroll_max_step$0"]]]], "r": [[0.00361465], 0, 6.11537, 1637916690], "v": "v0.6"}
{"i": [["[\"pool_layer\", \"max\", 128, 42, 165, 165, 3, 3, 2, \"SAME\"]", "cuda -keys=cuda,gpu -max_num_threads=1024 -thread_warp_size=32", [-1, 16, 64, 49152, 2147483647, 1024, 8, 32], "", 0, []], [[], [["CI", 1], ["FU", 2, [0, 1, 2, 3]], ["SP", 2, 0, 37035264, [8], 1], ["AN", 2, 0, 5], ["AN", 2, 1, 6], ["PR", 2, 0, "auto_unroll_max_step$1024"]]]], "r": [[0.00722631], 0, 5.3086, 1637916693], "v": "v0.6"}
{"i": [["[\"pool_layer\", \"max\", 128, 42, 165, 165, 3, 3, 2, \"SAME\"]", "cuda -keys=cuda,gpu -max_num_threads=1024 -thread_warp_size=32", [-1, 16, 64, 49152, 2147483647, 1024, 8, 32], "", 0, []], [[], [["CI", 1], ["FU", 2, [0, 1, 2, 3]], ["SP", 2, 0, 37035264, [4], 1], ["AN", 2, 0, 5], ["AN", 2, 1, 6], ["PR", 2, 0, "auto_unroll_max_step$64"]]]], "r": [[0.0144583], 0, 6.58969, 1637916697], "v": "v0.6"}
{"i": [["[\"pool_layer\", \"max\", 128, 42, 165, 165, 3, 3, 2, \"SAME\"]", "cuda -keys=cuda,gpu -max_num_threads=1024 -thread_warp_size=32", [-1, 16, 64, 49152, 2147483647, 1024, 8, 32], "", 0, []], [[], [["CI", 1], ["FU", 2, [0, 1, 2, 3]], ["SP", 2, 0, 37035264, [7], 1], ["AN", 2, 0, 5], ["AN", 2, 1, 6], ["PR", 2, 0, "auto_unroll_max_step$0"]]]], "r": [[0.00825807], 0, 5.62359, 1637916700], "v": "v0.6"}
{"i": [["[\"pool_layer\", \"max\", 128, 42, 165, 165, 3, 3, 2, \"SAME\"]", "cuda -keys=cuda,gpu -max_num_threads=1024 -thread_warp_size=32", [-1, 16, 64, 49152, 2147483647, 1024, 8, 32], "", 0, []], [[], [["CI", 1], ["FU", 2, [0, 1, 2, 3]], ["SP", 2, 0, 37035264, [12], 1], ["AN", 2, 0, 5], ["AN", 2, 1, 6], ["PR", 2, 0, "auto_unroll_max_step$0"]]]], "r": [[0.00481854], 0, 5.35167, 1637916703], "v": "v0.6"}
{"i": [["[\"pool_layer\", \"max\", 128, 42, 165, 165, 3, 3, 2, \"SAME\"]", "cuda -keys=cuda,gpu -max_num_threads=1024 -thread_warp_size=32", [-1, 16, 64, 49152, 2147483647, 1024, 8, 32], "", 0, []], [[], [["CI", 1], ["FU", 2, [0, 1, 2, 3]], ["SP", 2, 0, 37035264, [3], 1], ["AN", 2, 0, 5], ["AN", 2, 1, 6], ["PR", 2, 0, "auto_unroll_max_step$64"]]]], "r": [[0.019265], 0, 5.42398, 1637916706], "v": "v0.6"}
{"i": [["[\"pool_layer\", \"max\", 128, 42, 165, 165, 3, 3, 2, \"SAME\"]", "cuda -keys=cuda,gpu -max_num_threads=1024 -thread_warp_size=32", [-1, 16, 64, 49152, 2147483647, 1024, 8, 32], "", 0, []], [[], [["CI", 1], ["FU", 2, [0, 1, 2, 3]], ["SP", 2, 0, 37035264, [24], 1], ["AN", 2, 0, 5], ["AN", 2, 1, 6], ["PR", 2, 0, "auto_unroll_max_step$1024"]]]], "r": [[0.00241074], 0, 5.40268, 1637916709], "v": "v0.6"}
{"i": [["[\"pool_layer\", \"max\", 128, 42, 165, 165, 3, 3, 2, \"SAME\"]", "cuda -keys=cuda,gpu -max_num_threads=1024 -thread_warp_size=32", [-1, 16, 64, 49152, 2147483647, 1024, 8, 32], "", 0, []], [[], [["CI", 1], ["FU", 2, [0, 1, 2, 3]], ["SP", 2, 0, 37035264, [48], 1], ["AN", 2, 0, 5], ["AN", 2, 1, 6], ["PR", 2, 0, "auto_unroll_max_step$1024"]]]], "r": [[0.00120798], 0, 3.65381, 1637916715], "v": "v0.6"}
{"i": [["[\"pool_layer\", \"max\", 128, 42, 165, 165, 3, 3, 2, \"SAME\"]", "cuda -keys=cuda,gpu -max_num_threads=1024 -thread_warp_size=32", [-1, 16, 64, 49152, 2147483647, 1024, 8, 32], "", 0, []], [[], [["CI", 1], ["FU", 2, [0, 1, 2, 3]], ["SP", 2, 0, 37035264, [6], 1], ["AN", 2, 0, 5], ["AN", 2, 1, 6], ["PR", 2, 0, "auto_unroll_max_step$512"]]]], "r": [[0.00963411], 0, 3.82575, 1637916718], "v": "v0.6"}
{"i": [["[\"pool_layer\", \"max\", 128, 42, 165, 165, 3, 3, 2, \"SAME\"]", "cuda -keys=cuda,gpu -max_num_threads=1024 -thread_warp_size=32", [-1, 16, 64, 49152, 2147483647, 1024, 8, 32], "", 0, []], [[], [["CI", 1], ["FU", 2, [0, 1, 2, 3]], ["SP", 2, 0, 37035264, [14], 1], ["AN", 2, 0, 5], ["AN", 2, 1, 6], ["PR", 2, 0, "auto_unroll_max_step$512"]]]], "r": [[0.00413061], 0, 3.18659, 1637916721], "v": "v0.6"}
{"i": [["[\"pool_layer\", \"max\", 128, 42, 165, 165, 3, 3, 2, \"SAME\"]", "cuda -keys=cuda,gpu -max_num_threads=1024 -thread_warp_size=32", [-1, 16, 64, 49152, 2147483647, 1024, 8, 32], "", 0, []], [[], [["CI", 1], ["FU", 2, [0, 1, 2, 3]], ["SP", 2, 0, 37035264, [42], 1], ["AN", 2, 0, 5], ["AN", 2, 1, 6], ["PR", 2, 0, "auto_unroll_max_step$1024"]]]], "r": [[0.00137991], 0, 3.67124, 1637916725], "v": "v0.6"}
{"i": [["[\"pool_layer\", \"max\", 128, 42, 165, 165, 3, 3, 2, \"SAME\"]", "cuda -keys=cuda,gpu -max_num_threads=1024 -thread_warp_size=32", [-1, 16, 64, 49152, 2147483647, 1024, 8, 32], "", 0, []], [[], [["CI", 1], ["FU", 2, [0, 1, 2, 3]], ["SP", 2, 0, 37035264, [1], 1], ["AN", 2, 0, 5], ["AN", 2, 1, 6], ["PR", 2, 0, "auto_unroll_max_step$512"]]]], "r": [[0.057798], 0, 4.04948, 1637916729], "v": "v0.6"}
{"i": [["[\"pool_layer\", \"max\", 128, 42, 165, 165, 3, 3, 2, \"SAME\"]", "cuda -keys=cuda,gpu -max_num_threads=1024 -thread_warp_size=32", [-1, 16, 64, 49152, 2147483647, 1024, 8, 32], "", 0, []], [[], [["CI", 1], ["FU", 2, [0, 1, 2, 3]], ["SP", 2, 0, 37035264, [16], 1], ["AN", 2, 0, 5], ["AN", 2, 1, 6], ["PR", 2, 0, "auto_unroll_max_step$16"]]]], "r": [[0.00361454], 0, 3.17915, 1637916731], "v": "v0.6"}
{"i": [["[\"pool_layer\", \"max\", 128, 42, 165, 165, 3, 3, 2, \"SAME\"]", "cuda -keys=cuda,gpu -max_num_threads=1024 -thread_warp_size=32", [-1, 16, 64, 49152, 2147483647, 1024, 8, 32], "", 0, []], [[], [["CI", 1], ["FU", 2, [0, 1, 2, 3]], ["SP", 2, 0, 37035264, [56], 1], ["AN", 2, 0, 5], ["AN", 2, 1, 6], ["PR", 2, 0, "auto_unroll_max_step$1024"]]]], "r": [[0.00103621], 0, 3.84112, 1637916735], "v": "v0.6"}
{"i": [["[\"pool_layer\", \"max\", 128, 42, 165, 165, 3, 3, 2, \"SAME\"]", "cuda -keys=cuda,gpu -max_num_threads=1024 -thread_warp_size=32", [-1, 16, 64, 49152, 2147483647, 1024, 8, 32], "", 0, []], [[], [["CI", 1], ["FU", 2, [0, 1, 2, 3]], ["SP", 2, 0, 37035264, [32], 1], ["AN", 2, 0, 5], ["AN", 2, 1, 6], ["PR", 2, 0, "auto_unroll_max_step$1024"]]]], "r": [[0.00180905], 0, 3.2053, 1637916738], "v": "v0.6"}
{"i": [["[\"pool_layer\", \"max\", 128, 42, 165, 165, 3, 3, 2, \"SAME\"]", "cuda -keys=cuda,gpu -max_num_threads=1024 -thread_warp_size=32", [-1, 16, 64, 49152, 2147483647, 1024, 8, 32], "", 0, []], [[], [["CI", 1], ["FU", 2, [0, 1, 2, 3]], ["SP", 2, 0, 37035264, [24], 1], ["AN", 2, 0, 5], ["AN", 2, 1, 6], ["PR", 2, 0, "auto_unroll_max_step$0"]]]], "r": [[0.00241112], 0, 3.22264, 1637916741], "v": "v0.6"}
{"i": [["[\"pool_layer\", \"max\", 128, 42, 165, 165, 3, 3, 2, \"SAME\"]", "cuda -keys=cuda,gpu -max_num_threads=1024 -thread_warp_size=32", [-1, 16, 64, 49152, 2147483647, 1024, 8, 32], "", 0, []], [[], [["CI", 1], ["FU", 2, [0, 1, 2, 3]], ["SP", 2, 0, 37035264, [32], 1], ["AN", 2, 0, 5], ["AN", 2, 1, 6], ["PR", 2, 0, "auto_unroll_max_step$16"]]]], "r": [[0.00180899], 0, 3.17621, 1637916744], "v": "v0.6"}
{"i": [["[\"pool_layer\", \"max\", 128, 42, 165, 165, 3, 3, 2, \"SAME\"]", "cuda -keys=cuda,gpu -max_num_threads=1024 -thread_warp_size=32", [-1, 16, 64, 49152, 2147483647, 1024, 8, 32], "", 0, []], [[], [["CI", 1], ["FU", 2, [0, 1, 2, 3]], ["SP", 2, 0, 37035264, [28], 1], ["AN", 2, 0, 5], ["AN", 2, 1, 6], ["PR", 2, 0, "auto_unroll_max_step$64"]]]], "r": [[0.00206712], 0, 3.65019, 1637916747], "v": "v0.6"}
{"i": [["[\"pool_layer\", \"max\", 128, 42, 165, 165, 3, 3, 2, \"SAME\"]", "cuda -keys=cuda,gpu -max_num_threads=1024 -thread_warp_size=32", [-1, 16, 64, 49152, 2147483647, 1024, 8, 32], "", 0, []], [[], [["CI", 1], ["FU", 2, [0, 1, 2, 3]], ["SP", 2, 0, 37035264, [4], 1], ["AN", 2, 0, 5], ["AN", 2, 1, 6], ["PR", 2, 0, "auto_unroll_max_step$1024"]]]], "r": [[0.0152896], 0, 3.25645, 1637916750], "v": "v0.6"}
{"i": [["[\"pool_layer\", \"max\", 128, 42, 165, 165, 3, 3, 2, \"SAME\"]", "cuda -keys=cuda,gpu -max_num_threads=1024 -thread_warp_size=32", [-1, 16, 64, 49152, 2147483647, 1024, 8, 32], "", 0, []], [[], [["CI", 1], ["FU", 2, [0, 1, 2, 3]], ["SP", 2, 0, 37035264, [21], 1], ["AN", 2, 0, 5], ["AN", 2, 1, 6], ["PR", 2, 0, "auto_unroll_max_step$16"]]]], "r": [[0.00275453], 0, 3.35997, 1637916753], "v": "v0.6"}
{"i": [["[\"pool_layer\", \"max\", 128, 42, 165, 165, 3, 3, 2, \"SAME\"]", "cuda -keys=cuda,gpu -max_num_threads=1024 -thread_warp_size=32", [-1, 16, 64, 49152, 2147483647, 1024, 8, 32], "", 0, []], [[], [["CI", 1], ["FU", 2, [0, 1, 2, 3]], ["SP", 2, 0, 37035264, [32], 1], ["AN", 2, 0, 5], ["AN", 2, 1, 6], ["PR", 2, 0, "auto_unroll_max_step$512"]]]], "r": [[0.00180899], 0, 3.25056, 1637916757], "v": "v0.6"}
{"i": [["[\"pool_layer\", \"max\", 128, 42, 165, 165, 3, 3, 2, \"SAME\"]", "cuda -keys=cuda,gpu -max_num_threads=1024 -thread_warp_size=32", [-1, 16, 64, 49152, 2147483647, 1024, 8, 32], "", 0, []], [[], [["CI", 1], ["FU", 2, [0, 1, 2, 3]], ["SP", 2, 0, 37035264, [32], 1], ["AN", 2, 0, 5], ["AN", 2, 1, 6], ["PR", 2, 0, "auto_unroll_max_step$64"]]]], "r": [[0.00180915], 0, 3.68505, 1637916760], "v": "v0.6"}
{"i": [["[\"pool_layer\", \"max\", 128, 42, 165, 165, 3, 3, 2, \"SAME\"]", "cuda -keys=cuda,gpu -max_num_threads=1024 -thread_warp_size=32", [-1, 16, 64, 49152, 2147483647, 1024, 8, 32], "", 0, []], [[], [["CI", 1], ["FU", 2, [0, 1, 2, 3]], ["SP", 2, 0, 37035264, [8], 1], ["AN", 2, 0, 5], ["AN", 2, 1, 6], ["PR", 2, 0, "auto_unroll_max_step$512"]]]], "r": [[0.00722632], 0, 3.19128, 1637916763], "v": "v0.6"}
{"i": [["[\"pool_layer\", \"max\", 128, 42, 165, 165, 3, 3, 2, \"SAME\"]", "cuda -keys=cuda,gpu -max_num_threads=1024 -thread_warp_size=32", [-1, 16, 64, 49152, 2147483647, 1024, 8, 32], "", 0, []], [[], [["CI", 1], ["FU", 2, [0, 1, 2, 3]], ["SP", 2, 0, 37035264, [7], 1], ["AN", 2, 0, 5], ["AN", 2, 1, 6], ["PR", 2, 0, "auto_unroll_max_step$1024"]]]], "r": [[0.00826013], 0, 3.2232, 1637916775], "v": "v0.6"}
{"i": [["[\"pool_layer\", \"max\", 128, 42, 165, 165, 3, 3, 2, \"SAME\"]", "cuda -keys=cuda,gpu -max_num_threads=1024 -thread_warp_size=32", [-1, 16, 64, 49152, 2147483647, 1024, 8, 32], "", 0, []], [[], [["CI", 1], ["FU", 2, [0, 1, 2, 3]], ["SP", 2, 0, 37035264, [28], 1], ["AN", 2, 0, 5], ["AN", 2, 1, 6], ["PR", 2, 0, "auto_unroll_max_step$1024"]]]], "r": [[0.00206692], 0, 3.77547, 1637916779], "v": "v0.6"}
{"i": [["[\"pool_layer\", \"max\", 128, 42, 165, 165, 3, 3, 2, \"SAME\"]", "cuda -keys=cuda,gpu -max_num_threads=1024 -thread_warp_size=32", [-1, 16, 64, 49152, 2147483647, 1024, 8, 32], "", 0, []], [[], [["CI", 1], ["FU", 2, [0, 1, 2, 3]], ["SP", 2, 0, 37035264, [1], 1], ["AN", 2, 0, 5], ["AN", 2, 1, 6], ["PR", 2, 0, "auto_unroll_max_step$0"]]]], "r": [[0.057792], 0, 3.59766, 1637916782], "v": "v0.6"}
{"i": [["[\"pool_layer\", \"max\", 128, 42, 165, 165, 3, 3, 2, \"SAME\"]", "cuda -keys=cuda,gpu -max_num_threads=1024 -thread_warp_size=32", [-1, 16, 64, 49152, 2147483647, 1024, 8, 32], "", 0, []], [[], [["CI", 1], ["FU", 2, [0, 1, 2, 3]], ["SP", 2, 0, 37035264, [16], 1], ["AN", 2, 0, 5], ["AN", 2, 1, 6], ["PR", 2, 0, "auto_unroll_max_step$1024"]]]], "r": [[0.00361478], 0, 3.56865, 1637916785], "v": "v0.6"}
{"i": [["[\"pool_layer\", \"max\", 128, 42, 165, 165, 3, 3, 2, \"SAME\"]", "cuda -keys=cuda,gpu -max_num_threads=1024 -thread_warp_size=32", [-1, 16, 64, 49152, 2147483647, 1024, 8, 32], "", 0, []], [[], [["CI", 1], ["FU", 2, [0, 1, 2, 3]], ["SP", 2, 0, 37035264, [3], 1], ["AN", 2, 0, 5], ["AN", 2, 1, 6], ["PR", 2, 0, "auto_unroll_max_step$0"]]]], "r": [[0.0192645], 0, 3.47466, 1637916788], "v": "v0.6"}
{"i": [["[\"pool_layer\", \"max\", 128, 42, 165, 165, 3, 3, 2, \"SAME\"]", "cuda -keys=cuda,gpu -max_num_threads=1024 -thread_warp_size=32", [-1, 16, 64, 49152, 2147483647, 1024, 8, 32], "", 0, []], [[], [["CI", 1], ["FU", 2, [0, 1, 2, 3]], ["SP", 2, 0, 37035264, [3], 1], ["AN", 2, 0, 5], ["AN", 2, 1, 6], ["PR", 2, 0, "auto_unroll_max_step$1024"]]]], "r": [[0.019264], 0, 3.39194, 1637916792], "v": "v0.6"}
{"i": [["[\"pool_layer\", \"max\", 128, 42, 165, 165, 3, 3, 2, \"SAME\"]", "cuda -keys=cuda,gpu -max_num_threads=1024 -thread_warp_size=32", [-1, 16, 64, 49152, 2147483647, 1024, 8, 32], "", 0, []], [[], [["CI", 1], ["FU", 2, [0, 1, 2, 3]], ["SP", 2, 0, 37035264, [8], 1], ["AN", 2, 0, 5], ["AN", 2, 1, 6], ["PR", 2, 0, "auto_unroll_max_step$0"]]]], "r": [[0.00768955], 0, 3.39052, 1637916795], "v": "v0.6"}
{"i": [["[\"pool_layer\", \"max\", 128, 42, 165, 165, 3, 3, 2, \"SAME\"]", "cuda -keys=cuda,gpu -max_num_threads=1024 -thread_warp_size=32", [-1, 16, 64, 49152, 2147483647, 1024, 8, 32], "", 0, []], [[], [["CI", 1], ["FU", 2, [0, 1, 2, 3]], ["SP", 2, 0, 37035264, [21], 1], ["AN", 2, 0, 5], ["AN", 2, 1, 6], ["PR", 2, 0, "auto_unroll_max_step$64"]]]], "r": [[0.00275436], 0, 3.57903, 1637916798], "v": "v0.6"}
{"i": [["[\"pool_layer\", \"max\", 128, 42, 165, 165, 3, 3, 2, \"SAME\"]", "cuda -keys=cuda,gpu -max_num_threads=1024 -thread_warp_size=32", [-1, 16, 64, 49152, 2147483647, 1024, 8, 32], "", 0, []], [[], [["CI", 1], ["FU", 2, [0, 1, 2, 3]], ["SP", 2, 0, 37035264, [7], 1], ["AN", 2, 0, 5], ["AN", 2, 1, 6], ["PR", 2, 0, "auto_unroll_max_step$64"]]]], "r": [[0.00825729], 0, 3.49545, 1637916801], "v": "v0.6"}
{"i": [["[\"pool_layer\", \"max\", 128, 42, 165, 165, 3, 3, 2, \"SAME\"]", "cuda -keys=cuda,gpu -max_num_threads=1024 -thread_warp_size=32", [-1, 16, 64, 49152, 2147483647, 1024, 8, 32], "", 0, []], [[], [["CI", 1], ["FU", 2, [0, 1, 2, 3]], ["SP", 2, 0, 37035264, [21], 1], ["AN", 2, 0, 5], ["AN", 2, 1, 6], ["PR", 2, 0, "auto_unroll_max_step$512"]]]], "r": [[0.00275425], 0, 3.47125, 1637916804], "v": "v0.6"}
{"i": [["[\"pool_layer\", \"max\", 128, 42, 165, 165, 3, 3, 2, \"SAME\"]", "cuda -keys=cuda,gpu -max_num_threads=1024 -thread_warp_size=32", [-1, 16, 64, 49152, 2147483647, 1024, 8, 32], "", 0, []], [[], [["CI", 1], ["FU", 2, [0, 1, 2, 3]], ["SP", 2, 0, 37035264, [64], 1], ["AN", 2, 0, 5], ["AN", 2, 1, 6], ["PR", 2, 0, "auto_unroll_max_step$64"]]]], "r": [[0.000909757], 0, 3.67297, 1637916808], "v": "v0.6"}
{"i": [["[\"pool_layer\", \"max\", 128, 42, 165, 165, 3, 3, 2, \"SAME\"]", "cuda -keys=cuda,gpu -max_num_threads=1024 -thread_warp_size=32", [-1, 16, 64, 49152, 2147483647, 1024, 8, 32], "", 0, []], [[], [["CI", 1], ["FU", 2, [0, 1, 2, 3]], ["SP", 2, 0, 37035264, [8], 1], ["AN", 2, 0, 5], ["AN", 2, 1, 6], ["PR", 2, 0, "auto_unroll_max_step$64"]]]], "r": [[0.0072268], 0, 3.50449, 1637916811], "v": "v0.6"}
{"i": [["[\"pool_layer\", \"max\", 128, 42, 165, 165, 3, 3, 2, \"SAME\"]", "cuda -keys=cuda,gpu -max_num_threads=1024 -thread_warp_size=32", [-1, 16, 64, 49152, 2147483647, 1024, 8, 32], "", 0, []], [[], [["CI", 1], ["FU", 2, [0, 1, 2, 3]], ["SP", 2, 0, 37035264, [24], 1], ["AN", 2, 0, 5], ["AN", 2, 1, 6], ["PR", 2, 0, "auto_unroll_max_step$64"]]]], "r": [[0.00241078], 0, 3.3529, 1637916814], "v": "v0.6"}
{"i": [["[\"pool_layer\", \"max\", 128, 42, 165, 165, 3, 3, 2, \"SAME\"]", "cuda -keys=cuda,gpu -max_num_threads=1024 -thread_warp_size=32", [-1, 16, 64, 49152, 2147483647, 1024, 8, 32], "", 0, []], [[], [["CI", 1], ["FU", 2, [0, 1, 2, 3]], ["SP", 2, 0, 37035264, [12], 1], ["AN", 2, 0, 5], ["AN", 2, 1, 6], ["PR", 2, 0, "auto_unroll_max_step$16"]]]], "r": [[0.00481858], 0, 3.23714, 1637916817], "v": "v0.6"}
{"i": [["[\"pool_layer\", \"max\", 128, 42, 165, 165, 3, 3, 2, \"SAME\"]", "cuda -keys=cuda,gpu -max_num_threads=1024 -thread_warp_size=32", [-1, 16, 64, 49152, 2147483647, 1024, 8, 32], "", 0, []], [[], [["CI", 1], ["FU", 2, [0, 1, 2, 3]], ["SP", 2, 0, 37035264, [14], 1], ["AN", 2, 0, 5], ["AN", 2, 1, 6], ["PR", 2, 0, "auto_unroll_max_step$1024"]]]], "r": [[0.00413078], 0, 3.56943, 1637916820], "v": "v0.6"}
{"i": [["[\"pool_layer\", \"max\", 128, 42, 165, 165, 3, 3, 2, \"SAME\"]", "cuda -keys=cuda,gpu -max_num_threads=1024 -thread_warp_size=32", [-1, 16, 64, 49152, 2147483647, 1024, 8, 32], "", 0, []], [[], [["CI", 1], ["FU", 2, [0, 1, 2, 3]], ["SP", 2, 0, 37035264, [28], 1], ["AN", 2, 0, 5], ["AN", 2, 1, 6], ["PR", 2, 0, "auto_unroll_max_step$512"]]]], "r": [[0.00206705], 0, 4.01043, 1637916824], "v": "v0.6"}
{"i": [["[\"pool_layer\", \"max\", 128, 42, 165, 165, 3, 3, 2, \"SAME\"]", "cuda -keys=cuda,gpu -max_num_threads=1024 -thread_warp_size=32", [-1, 16, 64, 49152, 2147483647, 1024, 8, 32], "", 0, []], [[], [["CI", 1], ["FU", 2, [0, 1, 2, 3]], ["SP", 2, 0, 37035264, [7], 1], ["AN", 2, 0, 5], ["AN", 2, 1, 6], ["PR", 2, 0, "auto_unroll_max_step$16"]]]], "r": [[0.00825839], 0, 3.37406, 1637916827], "v": "v0.6"}
{"i": [["[\"pool_layer\", \"max\", 128, 42, 165, 165, 3, 3, 2, \"SAME\"]", "cuda -keys=cuda,gpu -max_num_threads=1024 -thread_warp_size=32", [-1, 16, 64, 49152, 2147483647, 1024, 8, 32], "", 0, []], [[], [["CI", 1], ["FU", 2, [0, 1, 2, 3]], ["SP", 2, 0, 37035264, [42], 1], ["AN", 2, 0, 5], ["AN", 2, 1, 6], ["PR", 2, 0, "auto_unroll_max_step$512"]]]], "r": [[0.00138004], 0, 3.67764, 1637916831], "v": "v0.6"}
{"i": [["[\"pool_layer\", \"max\", 128, 42, 165, 165, 3, 3, 2, \"SAME\"]", "cuda -keys=cuda,gpu -max_num_threads=1024 -thread_warp_size=32", [-1, 16, 64, 49152, 2147483647, 1024, 8, 32], "", 0, []], [[], [["CI", 1], ["FU", 2, [0, 1, 2, 3]], ["SP", 2, 0, 37035264, [14], 1], ["AN", 2, 0, 5], ["AN", 2, 1, 6], ["PR", 2, 0, "auto_unroll_max_step$64"]]]], "r": [[0.00413096], 0, 3.34501, 1637916834], "v": "v0.6"}
{"i": [["[\"pool_layer\", \"max\", 128, 42, 165, 165, 3, 3, 2, \"SAME\"]", "cuda -keys=cuda,gpu -max_num_threads=1024 -thread_warp_size=32", [-1, 16, 64, 49152, 2147483647, 1024, 8, 32], "", 0, []], [[], [["CI", 1], ["FU", 2, [0, 1, 2, 3]], ["SP", 2, 0, 37035264, [56], 1], ["AN", 2, 0, 5], ["AN", 2, 1, 6], ["PR", 2, 0, "auto_unroll_max_step$512"]]]], "r": [[0.00103608], 0, 3.74303, 1637916837], "v": "v0.6"}
{"i": [["[\"pool_layer\", \"max\", 128, 42, 165, 165, 3, 3, 2, \"SAME\"]", "cuda -keys=cuda,gpu -max_num_threads=1024 -thread_warp_size=32", [-1, 16, 64, 49152, 2147483647, 1024, 8, 32], "", 0, []], [[], [["CI", 1], ["FU", 2, [0, 1, 2, 3]], ["SP", 2, 0, 37035264, [6], 1], ["AN", 2, 0, 5], ["AN", 2, 1, 6], ["PR", 2, 0, "auto_unroll_max_step$64"]]]], "r": [[0.00964641], 0, 3.69255, 1637916841], "v": "v0.6"}
{"i": [["[\"pool_layer\", \"max\", 128, 42, 165, 165, 3, 3, 2, \"SAME\"]", "cuda -keys=cuda,gpu -max_num_threads=1024 -thread_warp_size=32", [-1, 16, 64, 49152, 2147483647, 1024, 8, 32], "", 0, []], [[], [["CI", 1], ["FU", 2, [0, 1, 2, 3]], ["SP", 2, 0, 37035264, [48], 1], ["AN", 2, 0, 5], ["AN", 2, 1, 6], ["PR", 2, 0, "auto_unroll_max_step$512"]]]], "r": [[0.00120802], 0, 3.89085, 1637916844], "v": "v0.6"}
{"i": [["[\"pool_layer\", \"max\", 128, 42, 165, 165, 3, 3, 2, \"SAME\"]", "cuda -keys=cuda,gpu -max_num_threads=1024 -thread_warp_size=32", [-1, 16, 64, 49152, 2147483647, 1024, 8, 32], "", 0, []], [[], [["CI", 1], ["FU", 2, [0, 1, 2, 3]], ["SP", 2, 0, 37035264, [21], 1], ["AN", 2, 0, 5], ["AN", 2, 1, 6], ["PR", 2, 0, "auto_unroll_max_step$0"]]]], "r": [[0.00275499], 0, 3.85955, 1637916848], "v": "v0.6"}
{"i": [["[\"pool_layer\", \"max\", 128, 42, 165, 165, 3, 3, 2, \"SAME\"]", "cuda -keys=cuda,gpu -max_num_threads=1024 -thread_warp_size=32", [-1, 16, 64, 49152, 2147483647, 1024, 8, 32], "", 0, []], [[], [["CI", 1], ["FU", 2, [0, 1, 2, 3]], ["SP", 2, 0, 37035264, [64], 1], ["AN", 2, 0, 5], ["AN", 2, 1, 6], ["PR", 2, 0, "auto_unroll_max_step$0"]]]], "r": [[0.000910284], 0, 4.2711, 1637916852], "v": "v0.6"}
{"i": [["[\"pool_layer\", \"max\", 128, 42, 165, 165, 3, 3, 2, \"SAME\"]", "cuda -keys=cuda,gpu -max_num_threads=1024 -thread_warp_size=32", [-1, 16, 64, 49152, 2147483647, 1024, 8, 32], "", 0, []], [[], [["CI", 1], ["FU", 2, [0, 1, 2, 3]], ["SP", 2, 0, 37035264, [1], 1], ["AN", 2, 0, 5], ["AN", 2, 1, 6], ["PR", 2, 0, "auto_unroll_max_step$16"]]]], "r": [[0.0577954], 0, 3.55431, 1637916855], "v": "v0.6"}
{"i": [["[\"pool_layer\", \"max\", 128, 42, 165, 165, 3, 3, 2, \"SAME\"]", "cuda -keys=cuda,gpu -max_num_threads=1024 -thread_warp_size=32", [-1, 16, 64, 49152, 2147483647, 1024, 8, 32], "", 0, []], [[], [["CI", 1], ["FU", 2, [0, 1, 2, 3]], ["SP", 2, 0, 37035264, [64], 1], ["AN", 2, 0, 5], ["AN", 2, 1, 6], ["PR", 2, 0, "auto_unroll_max_step$512"]]]], "r": [[0.000909796], 0, 3.63579, 1637916859], "v": "v0.6"}
