artifacts/microbenchmark/tvm/ansor/pooling/ansor_max_pooling_128_336_42_42_3_3_2_SAME.log
{"i": [["[\"pool_layer\", \"max\", 128, 336, 42, 42, 3, 3, 2, \"SAME\"]", "cuda -keys=cuda,gpu -max_num_threads=1024 -thread_warp_size=32", [-1, 16, 64, 49152, 2147483647, 1024, 8, 32], "", 0, []], [[], [["CI", 1], ["FU", 2, [0, 1, 2, 3]], ["SP", 2, 0, 18966528, [21], 1], ["AN", 2, 0, 5], ["AN", 2, 1, 6], ["PR", 2, 0, "auto_unroll_max_step$1024"]]]], "r": [[0.00141428], 0, 2.72061, 1637915600], "v": "v0.6"}
{"i": [["[\"pool_layer\", \"max\", 128, 336, 42, 42, 3, 3, 2, \"SAME\"]", "cuda -keys=cuda,gpu -max_num_threads=1024 -thread_warp_size=32", [-1, 16, 64, 49152, 2147483647, 1024, 8, 32], "", 0, []], [[], [["CI", 1], ["FU", 2, [0, 1, 2, 3]], ["SP", 2, 0, 18966528, [54], 1], ["AN", 2, 0, 5], ["AN", 2, 1, 6], ["PR", 2, 0, "auto_unroll_max_step$64"]]]], "r": [[0.000551592], 0, 2.78611, 1637915602], "v": "v0.6"}
{"i": [["[\"pool_layer\", \"max\", 128, 336, 42, 42, 3, 3, 2, \"SAME\"]", "cuda -keys=cuda,gpu -max_num_threads=1024 -thread_warp_size=32", [-1, 16, 64, 49152, 2147483647, 1024, 8, 32], "", 0, []], [[], [["CI", 1], ["FU", 2, [0, 1, 2, 3]], ["SP", 2, 0, 18966528, [63], 1], ["AN", 2, 0, 5], ["AN", 2, 1, 6], ["PR", 2, 0, "auto_unroll_max_step$64"]]]], "r": [[0.000473924], 0, 2.82594, 1637915604], "v": "v0.6"}
{"i": [["[\"pool_layer\", \"max\", 128, 336, 42, 42, 3, 3, 2, \"SAME\"]", "cuda -keys=cuda,gpu -max_num_threads=1024 -thread_warp_size=32", [-1, 16, 64, 49152, 2147483647, 1024, 8, 32], "", 0, []], [[], [["CI", 1], ["FU", 2, [0, 1, 2, 3]], ["SP", 2, 0, 18966528, [9], 1], ["AN", 2, 0, 5], ["AN", 2, 1, 6], ["PR", 2, 0, "auto_unroll_max_step$1024"]]]], "r": [[0.0032912], 0, 2.76197, 1637915607], "v": "v0.6"}
{"i": [["[\"pool_layer\", \"max\", 128, 336, 42, 42, 3, 3, 2, \"SAME\"]", "cuda -keys=cuda,gpu -max_num_threads=1024 -thread_warp_size=32", [-1, 16, 64, 49152, 2147483647, 1024, 8, 32], "", 0, []], [[], [["CI", 1], ["FU", 2, [0, 1, 2, 3]], ["SP", 2, 0, 18966528, [42], 1], ["AN", 2, 0, 5], ["AN", 2, 1, 6], ["PR", 2, 0, "auto_unroll_max_step$16"]]]], "r": [[0.000708013], 0, 2.81079, 1637915609], "v": "v0.6"}
{"i": [["[\"pool_layer\", \"max\", 128, 336, 42, 42, 3, 3, 2, \"SAME\"]", "cuda -keys=cuda,gpu -max_num_threads=1024 -thread_warp_size=32", [-1, 16, 64, 49152, 2147483647, 1024, 8, 32], "", 0, []], [[], [["CI", 1], ["FU", 2, [0, 1, 2, 3]], ["SP", 2, 0, 18966528, [7], 1], ["AN", 2, 0, 5], ["AN", 2, 1, 6], ["PR", 2, 0, "auto_unroll_max_step$64"]]]], "r": [[0.00423087], 0, 2.33846, 1637915612], "v": "v0.6"}
{"i": [["[\"pool_layer\", \"max\", 128, 336, 42, 42, 3, 3, 2, \"SAME\"]", "cuda -keys=cuda,gpu -max_num_threads=1024 -thread_warp_size=32", [-1, 16, 64, 49152, 2147483647, 1024, 8, 32], "", 0, []], [[], [["CI", 1], ["FU", 2, [0, 1, 2, 3]], ["SP", 2, 0, 18966528, [54], 1], ["AN", 2, 0, 5], ["AN", 2, 1, 6], ["PR", 2, 0, "auto_unroll_max_step$512"]]]], "r": [[0.000551677], 0, 2.84813, 1637915614], "v": "v0.6"}
{"i": [["[\"pool_layer\", \"max\", 128, 336, 42, 42, 3, 3, 2, \"SAME\"]", "cuda -keys=cuda,gpu -max_num_threads=1024 -thread_warp_size=32", [-1, 16, 64, 49152, 2147483647, 1024, 8, 32], "", 0, []], [[], [["CI", 1], ["FU", 2, [0, 1, 2, 3]], ["SP", 2, 0, 18966528, [27], 1], ["AN", 2, 0, 5], ["AN", 2, 1, 6], ["PR", 2, 0, "auto_unroll_max_step$64"]]]], "r": [[0.00109906], 0, 2.27462, 1637915616], "v": "v0.6"}
{"i": [["[\"pool_layer\", \"max\", 128, 336, 42, 42, 3, 3, 2, \"SAME\"]", "cuda -keys=cuda,gpu -max_num_threads=1024 -thread_warp_size=32", [-1, 16, 64, 49152, 2147483647, 1024, 8, 32], "", 0, []], [[], [["CI", 1], ["FU", 2, [0, 1, 2, 3]], ["SP", 2, 0, 18966528, [1], 1], ["AN", 2, 0, 5], ["AN", 2, 1, 6], ["PR", 2, 0, "auto_unroll_max_step$16"]]]], "r": [[0.0296019], 0, 2.36637, 1637915618], "v": "v0.6"}
{"i": [["[\"pool_layer\", \"max\", 128, 336, 42, 42, 3, 3, 2, \"SAME\"]", "cuda -keys=cuda,gpu -max_num_threads=1024 -thread_warp_size=32", [-1, 16, 64, 49152, 2147483647, 1024, 8, 32], "", 0, []], [[], [["CI", 1], ["FU", 2, [0, 1, 2, 3]], ["SP", 2, 0, 18966528, [56], 1], ["AN", 2, 0, 5], ["AN", 2, 1, 6], ["PR", 2, 0, "auto_unroll_max_step$64"]]]], "r": [[0.00053193], 0, 2.86997, 1637915621], "v": "v0.6"}
{"i": [["[\"pool_layer\", \"max\", 128, 336, 42, 42, 3, 3, 2, \"SAME\"]", "cuda -keys=cuda,gpu -max_num_threads=1024 -thread_warp_size=32", [-1, 16, 64, 49152, 2147483647, 1024, 8, 32], "", 0, []], [[], [["CI", 1], ["FU", 2, [0, 1, 2, 3]], ["SP", 2, 0, 18966528, [24], 1], ["AN", 2, 0, 5], ["AN", 2, 1, 6], ["PR", 2, 0, "auto_unroll_max_step$16"]]]], "r": [[0.00123617], 0, 2.25555, 1637915623], "v": "v0.6"}
{"i": [["[\"pool_layer\", \"max\", 128, 336, 42, 42, 3, 3, 2, \"SAME\"]", "cuda -keys=cuda,gpu -max_num_threads=1024 -thread_warp_size=32", [-1, 16, 64, 49152, 2147483647, 1024, 8, 32], "", 0, []], [[], [["CI", 1], ["FU", 2, [0, 1, 2, 3]], ["SP", 2, 0, 18966528, [64], 1], ["AN", 2, 0, 5], ["AN", 2, 1, 6], ["PR", 2, 0, "auto_unroll_max_step$16"]]]], "r": [[0.000470186], 0, 2.8299, 1637915625], "v": "v0.6"}
{"i": [["[\"pool_layer\", \"max\", 128, 336, 42, 42, 3, 3, 2, \"SAME\"]", "cuda -keys=cuda,gpu -max_num_threads=1024 -thread_warp_size=32", [-1, 16, 64, 49152, 2147483647, 1024, 8, 32], "", 0, []], [[], [["CI", 1], ["FU", 2, [0, 1, 2, 3]], ["SP", 2, 0, 18966528, [32], 1], ["AN", 2, 0, 5], ["AN", 2, 1, 6], ["PR", 2, 0, "auto_unroll_max_step$0"]]]], "r": [[0.000928012], 0, 2.779, 1637915628], "v": "v0.6"}
{"i": [["[\"pool_layer\", \"max\", 128, 336, 42, 42, 3, 3, 2, \"SAME\"]", "cuda -keys=cuda,gpu -max_num_threads=1024 -thread_warp_size=32", [-1, 16, 64, 49152, 2147483647, 1024, 8, 32], "", 0, []], [[], [["CI", 1], ["FU", 2, [0, 1, 2, 3]], ["SP", 2, 0, 18966528, [36], 1], ["AN", 2, 0, 5], ["AN", 2, 1, 6], ["PR", 2, 0, "auto_unroll_max_step$512"]]]], "r": [[0.000825552], 0, 2.75102, 1637915630], "v": "v0.6"}
{"i": [["[\"pool_layer\", \"max\", 128, 336, 42, 42, 3, 3, 2, \"SAME\"]", "cuda -keys=cuda,gpu -max_num_threads=1024 -thread_warp_size=32", [-1, 16, 64, 49152, 2147483647, 1024, 8, 32], "", 0, []], [[], [["CI", 1], ["FU", 2, [0, 1, 2, 3]], ["SP", 2, 0, 18966528, [48], 1], ["AN", 2, 0, 5], ["AN", 2, 1, 6], ["PR", 2, 0, "auto_unroll_max_step$64"]]]], "r": [[0.000619901], 0, 2.82602, 1637915633], "v": "v0.6"}
{"i": [["[\"pool_layer\", \"max\", 128, 336, 42, 42, 3, 3, 2, \"SAME\"]", "cuda -keys=cuda,gpu -max_num_threads=1024 -thread_warp_size=32", [-1, 16, 64, 49152, 2147483647, 1024, 8, 32], "", 0, []], [[], [["CI", 1], ["FU", 2, [0, 1, 2, 3]], ["SP", 2, 0, 18966528, [18], 1], ["AN", 2, 0, 5], ["AN", 2, 1, 6], ["PR", 2, 0, "auto_unroll_max_step$16"]]]], "r": [[0.00164736], 0, 3.06903, 1637915635], "v": "v0.6"}
{"i": [["[\"pool_layer\", \"max\", 128, 336, 42, 42, 3, 3, 2, \"SAME\"]", "cuda -keys=cuda,gpu -max_num_threads=1024 -thread_warp_size=32", [-1, 16, 64, 49152, 2147483647, 1024, 8, 32], "", 0, []], [[], [["CI", 1], ["FU", 2, [0, 1, 2, 3]], ["SP", 2, 0, 18966528, [48], 1], ["AN", 2, 0, 5], ["AN", 2, 1, 6], ["PR", 2, 0, "auto_unroll_max_step$1024"]]]], "r": [[0.000620007], 0, 3.10113, 1637915638], "v": "v0.6"}
{"i": [["[\"pool_layer\", \"max\", 128, 336, 42, 42, 3, 3, 2, \"SAME\"]", "cuda -keys=cuda,gpu -max_num_threads=1024 -thread_warp_size=32", [-1, 16, 64, 49152, 2147483647, 1024, 8, 32], "", 0, []], [[], [["CI", 1], ["FU", 2, [0, 1, 2, 3]], ["SP", 2, 0, 18966528, [56], 1], ["AN", 2, 0, 5], ["AN", 2, 1, 6], ["PR", 2, 0, "auto_unroll_max_step$0"]]]], "r": [[0.000531935], 0, 3.35989, 1637915641], "v": "v0.6"}
{"i": [["[\"pool_layer\", \"max\", 128, 336, 42, 42, 3, 3, 2, \"SAME\"]", "cuda -keys=cuda,gpu -max_num_threads=1024 -thread_warp_size=32", [-1, 16, 64, 49152, 2147483647, 1024, 8, 32], "", 0, []], [[], [["CI", 1], ["FU", 2, [0, 1, 2, 3]], ["SP", 2, 0, 18966528, [7], 1], ["AN", 2, 0, 5], ["AN", 2, 1, 6], ["PR", 2, 0, "auto_unroll_max_step$512"]]]], "r": [[0.00423202], 0, 2.19152, 1637915643], "v": "v0.6"}
{"i": [["[\"pool_layer\", \"max\", 128, 336, 42, 42, 3, 3, 2, \"SAME\"]", "cuda -keys=cuda,gpu -max_num_threads=1024 -thread_warp_size=32", [-1, 16, 64, 49152, 2147483647, 1024, 8, 32], "", 0, []], [[], [["CI", 1], ["FU", 2, [0, 1, 2, 3]], ["SP", 2, 0, 18966528, [4], 1], ["AN", 2, 0, 5], ["AN", 2, 1, 6], ["PR", 2, 0, "auto_unroll_max_step$0"]]]], "r": [[0.00740244], 0, 2.29521, 1637915645], "v": "v0.6"}
{"i": [["[\"pool_layer\", \"max\", 128, 336, 42, 42, 3, 3, 2, \"SAME\"]", "cuda -keys=cuda,gpu -max_num_threads=1024 -thread_warp_size=32", [-1, 16, 64, 49152, 2147483647, 1024, 8, 32], "", 0, []], [[], [["CI", 1], ["FU", 2, [0, 1, 2, 3]], ["SP", 2, 0, 18966528, [24], 1], ["AN", 2, 0, 5], ["AN", 2, 1, 6], ["PR", 2, 0, "auto_unroll_max_step$0"]]]], "r": [[0.00123642], 0, 2.76037, 1637915648], "v": "v0.6"}
{"i": [["[\"pool_layer\", \"max\", 128, 336, 42, 42, 3, 3, 2, \"SAME\"]", "cuda -keys=cuda,gpu -max_num_threads=1024 -thread_warp_size=32", [-1, 16, 64, 49152, 2147483647, 1024, 8, 32], "", 0, []], [[], [["CI", 1], ["FU", 2, [0, 1, 2, 3]], ["SP", 2, 0, 18966528, [18], 1], ["AN", 2, 0, 5], ["AN", 2, 1, 6], ["PR", 2, 0, "auto_unroll_max_step$1024"]]]], "r": [[0.00164732], 0, 2.63202, 1637915650], "v": "v0.6"}
{"i": [["[\"pool_layer\", \"max\", 128, 336, 42, 42, 3, 3, 2, \"SAME\"]", "cuda -keys=cuda,gpu -max_num_threads=1024 -thread_warp_size=32", [-1, 16, 64, 49152, 2147483647, 1024, 8, 32], "", 0, []], [[], [["CI", 1], ["FU", 2, [0, 1, 2, 3]], ["SP", 2, 0, 18966528, [9], 1], ["AN", 2, 0, 5], ["AN", 2, 1, 6], ["PR", 2, 0, "auto_unroll_max_step$512"]]]], "r": [[0.00329232], 0, 2.91236, 1637915653], "v": "v0.6"}
{"i": [["[\"pool_layer\", \"max\", 128, 336, 42, 42, 3, 3, 2, \"SAME\"]", "cuda -keys=cuda,gpu -max_num_threads=1024 -thread_warp_size=32", [-1, 16, 64, 49152, 2147483647, 1024, 8, 32], "", 0, []], [[], [["CI", 1], ["FU", 2, [0, 1, 2, 3]], ["SP", 2, 0, 18966528, [12], 1], ["AN", 2, 0, 5], ["AN", 2, 1, 6], ["PR", 2, 0, "auto_unroll_max_step$512"]]]], "r": [[0.00246965], 0, 2.30631, 1637915655], "v": "v0.6"}
{"i": [["[\"pool_layer\", \"max\", 128, 336, 42, 42, 3, 3, 2, \"SAME\"]", "cuda -keys=cuda,gpu -max_num_threads=1024 -thread_warp_size=32", [-1, 16, 64, 49152, 2147483647, 1024, 8, 32], "", 0, []], [[], [["CI", 1], ["FU", 2, [0, 1, 2, 3]], ["SP", 2, 0, 18966528, [63], 1], ["AN", 2, 0, 5], ["AN", 2, 1, 6], ["PR", 2, 0, "auto_unroll_max_step$0"]]]], "r": [[0.000473896], 0, 5.28996, 1637915657], "v": "v0.6"}
{"i": [["[\"pool_layer\", \"max\", 128, 336, 42, 42, 3, 3, 2, \"SAME\"]", "cuda -keys=cuda,gpu -max_num_threads=1024 -thread_warp_size=32", [-1, 16, 64, 49152, 2147483647, 1024, 8, 32], "", 0, []], [[], [["CI", 1], ["FU", 2, [0, 1, 2, 3]], ["SP", 2, 0, 18966528, [14], 1], ["AN", 2, 0, 5], ["AN", 2, 1, 6], ["PR", 2, 0, "auto_unroll_max_step$1024"]]]], "r": [[0.00211732], 0, 2.38792, 1637915659], "v": "v0.6"}
{"i": [["[\"pool_layer\", \"max\", 128, 336, 42, 42, 3, 3, 2, \"SAME\"]", "cuda -keys=cuda,gpu -max_num_threads=1024 -thread_warp_size=32", [-1, 16, 64, 49152, 2147483647, 1024, 8, 32], "", 0, []], [[], [["CI", 1], ["FU", 2, [0, 1, 2, 3]], ["SP", 2, 0, 18966528, [24], 1], ["AN", 2, 0, 5], ["AN", 2, 1, 6], ["PR", 2, 0, "auto_unroll_max_step$1024"]]]], "r": [[0.00123634], 0, 5.44373, 1637915662], "v": "v0.6"}
{"i": [["[\"pool_layer\", \"max\", 128, 336, 42, 42, 3, 3, 2, \"SAME\"]", "cuda -keys=cuda,gpu -max_num_threads=1024 -thread_warp_size=32", [-1, 16, 64, 49152, 2147483647, 1024, 8, 32], "", 0, []], [[], [["CI", 1], ["FU", 2, [0, 1, 2, 3]], ["SP", 2, 0, 18966528, [3], 1], ["AN", 2, 0, 5], ["AN", 2, 1, 6], ["PR", 2, 0, "auto_unroll_max_step$0"]]]], "r": [[0.00986963], 0, 4.6986, 1637915664], "v": "v0.6"}
{"i": [["[\"pool_layer\", \"max\", 128, 336, 42, 42, 3, 3, 2, \"SAME\"]", "cuda -keys=cuda,gpu -max_num_threads=1024 -thread_warp_size=32", [-1, 16, 64, 49152, 2147483647, 1024, 8, 32], "", 0, []], [[], [["CI", 1], ["FU", 2, [0, 1, 2, 3]], ["SP", 2, 0, 18966528, [36], 1], ["AN", 2, 0, 5], ["AN", 2, 1, 6], ["PR", 2, 0, "auto_unroll_max_step$64"]]]], "r": [[0.000825451], 0, 5.57087, 1637915666], "v": "v0.6"}
{"i": [["[\"pool_layer\", \"max\", 128, 336, 42, 42, 3, 3, 2, \"SAME\"]", "cuda -keys=cuda,gpu -max_num_threads=1024 -thread_warp_size=32", [-1, 16, 64, 49152, 2147483647, 1024, 8, 32], "", 0, []], [[], [["CI", 1], ["FU", 2, [0, 1, 2, 3]], ["SP", 2, 0, 18966528, [9], 1], ["AN", 2, 0, 5], ["AN", 2, 1, 6], ["PR", 2, 0, "auto_unroll_max_step$16"]]]], "r": [[0.00329206], 0, 4.70846, 1637915668], "v": "v0.6"}
{"i": [["[\"pool_layer\", \"max\", 128, 336, 42, 42, 3, 3, 2, \"SAME\"]", "cuda -keys=cuda,gpu -max_num_threads=1024 -thread_warp_size=32", [-1, 16, 64, 49152, 2147483647, 1024, 8, 32], "", 0, []], [[], [["CI", 1], ["FU", 2, [0, 1, 2, 3]], ["SP", 2, 0, 18966528, [56], 1], ["AN", 2, 0, 5], ["AN", 2, 1, 6], ["PR", 2, 0, "auto_unroll_max_step$1024"]]]], "r": [[0.00053201], 0, 5.3184, 1637915671], "v": "v0.6"}
{"i": [["[\"pool_layer\", \"max\", 128, 336, 42, 42, 3, 3, 2, \"SAME\"]", "cuda -keys=cuda,gpu -max_num_threads=1024 -thread_warp_size=32", [-1, 16, 64, 49152, 2147483647, 1024, 8, 32], "", 0, []], [[], [["CI", 1], ["FU", 2, [0, 1, 2, 3]], ["SP", 2, 0, 18966528, [54], 1], ["AN", 2, 0, 5], ["AN", 2, 1, 6], ["PR", 2, 0, "auto_unroll_max_step$1024"]]]], "r": [[0.000551675], 0, 5.46468, 1637915673], "v": "v0.6"}
{"i": [["[\"pool_layer\", \"max\", 128, 336, 42, 42, 3, 3, 2, \"SAME\"]", "cuda -keys=cuda,gpu -max_num_threads=1024 -thread_warp_size=32", [-1, 16, 64, 49152, 2147483647, 1024, 8, 32], "", 0, []], [[], [["CI", 1], ["FU", 2, [0, 1, 2, 3]], ["SP", 2, 0, 18966528, [21], 1], ["AN", 2, 0, 5], ["AN", 2, 1, 6], ["PR", 2, 0, "auto_unroll_max_step$512"]]]], "r": [[0.0014132], 0, 5.88865, 1637915676], "v": "v0.6"}
{"i": [["[\"pool_layer\", \"max\", 128, 336, 42, 42, 3, 3, 2, \"SAME\"]", "cuda -keys=cuda,gpu -max_num_threads=1024 -thread_warp_size=32", [-1, 16, 64, 49152, 2147483647, 1024, 8, 32], "", 0, []], [[], [["CI", 1], ["FU", 2, [0, 1, 2, 3]], ["SP", 2, 0, 18966528, [42], 1], ["AN", 2, 0, 5], ["AN", 2, 1, 6], ["PR", 2, 0, "auto_unroll_max_step$1024"]]]], "r": [[0.000708076], 0, 5.45953, 1637915678], "v": "v0.6"}
{"i": [["[\"pool_layer\", \"max\", 128, 336, 42, 42, 3, 3, 2, \"SAME\"]", "cuda -keys=cuda,gpu -max_num_threads=1024 -thread_warp_size=32", [-1, 16, 64, 49152, 2147483647, 1024, 8, 32], "", 0, []], [[], [["CI", 1], ["FU", 2, [0, 1, 2, 3]], ["SP", 2, 0, 18966528, [6], 1], ["AN", 2, 0, 5], ["AN", 2, 1, 6], ["PR", 2, 0, "auto_unroll_max_step$1024"]]]], "r": [[0.00493611], 0, 5.07777, 1637915680], "v": "v0.6"}
{"i": [["[\"pool_layer\", \"max\", 128, 336, 42, 42, 3, 3, 2, \"SAME\"]", "cuda -keys=cuda,gpu -max_num_threads=1024 -thread_warp_size=32", [-1, 16, 64, 49152, 2147483647, 1024, 8, 32], "", 0, []], [[], [["CI", 1], ["FU", 2, [0, 1, 2, 3]], ["SP", 2, 0, 18966528, [18], 1], ["AN", 2, 0, 5], ["AN", 2, 1, 6], ["PR", 2, 0, "auto_unroll_max_step$512"]]]], "r": [[0.00164738], 0, 5.53895, 1637915683], "v": "v0.6"}
{"i": [["[\"pool_layer\", \"max\", 128, 336, 42, 42, 3, 3, 2, \"SAME\"]", "cuda -keys=cuda,gpu -max_num_threads=1024 -thread_warp_size=32", [-1, 16, 64, 49152, 2147483647, 1024, 8, 32], "", 0, []], [[], [["CI", 1], ["FU", 2, [0, 1, 2, 3]], ["SP", 2, 0, 18966528, [27], 1], ["AN", 2, 0, 5], ["AN", 2, 1, 6], ["PR", 2, 0, "auto_unroll_max_step$16"]]]], "r": [[0.00109949], 0, 5.85163, 1637915686], "v": "v0.6"}
{"i": [["[\"pool_layer\", \"max\", 128, 336, 42, 42, 3, 3, 2, \"SAME\"]", "cuda -keys=cuda,gpu -max_num_threads=1024 -thread_warp_size=32", [-1, 16, 64, 49152, 2147483647, 1024, 8, 32], "", 0, []], [[], [["CI", 1], ["FU", 2, [0, 1, 2, 3]], ["SP", 2, 0, 18966528, [4], 1], ["AN", 2, 0, 5], ["AN", 2, 1, 6], ["PR", 2, 0, "auto_unroll_max_step$16"]]]], "r": [[0.00740302], 0, 5.13769, 1637915687], "v": "v0.6"}
{"i": [["[\"pool_layer\", \"max\", 128, 336, 42, 42, 3, 3, 2, \"SAME\"]", "cuda -keys=cuda,gpu -max_num_threads=1024 -thread_warp_size=32", [-1, 16, 64, 49152, 2147483647, 1024, 8, 32], "", 0, []], [[], [["CI", 1], ["FU", 2, [0, 1, 2, 3]], ["SP", 2, 0, 18966528, [12], 1], ["AN", 2, 0, 5], ["AN", 2, 1, 6], ["PR", 2, 0, "auto_unroll_max_step$0"]]]], "r": [[0.00246994], 0, 5.26049, 1637915689], "v": "v0.6"}
{"i": [["[\"pool_layer\", \"max\", 128, 336, 42, 42, 3, 3, 2, \"SAME\"]", "cuda -keys=cuda,gpu -max_num_threads=1024 -thread_warp_size=32", [-1, 16, 64, 49152, 2147483647, 1024, 8, 32], "", 0, []], [[], [["CI", 1], ["FU", 2, [0, 1, 2, 3]], ["SP", 2, 0, 18966528, [27], 1], ["AN", 2, 0, 5], ["AN", 2, 1, 6], ["PR", 2, 0, "auto_unroll_max_step$1024"]]]], "r": [[0.00109931], 0, 5.7155, 1637915692], "v": "v0.6"}
{"i": [["[\"pool_layer\", \"max\", 128, 336, 42, 42, 3, 3, 2, \"SAME\"]", "cuda -keys=cuda,gpu -max_num_threads=1024 -thread_warp_size=32", [-1, 16, 64, 49152, 2147483647, 1024, 8, 32], "", 0, []], [[], [["CI", 1], ["FU", 2, [0, 1, 2, 3]], ["SP", 2, 0, 18966528, [48], 1], ["AN", 2, 0, 5], ["AN", 2, 1, 6], ["PR", 2, 0, "auto_unroll_max_step$512"]]]], "r": [[0.000620017], 0, 5.76364, 1637915694], "v": "v0.6"}
{"i": [["[\"pool_layer\", \"max\", 128, 336, 42, 42, 3, 3, 2, \"SAME\"]", "cuda -keys=cuda,gpu -max_num_threads=1024 -thread_warp_size=32", [-1, 16, 64, 49152, 2147483647, 1024, 8, 32], "", 0, []], [[], [["CI", 1], ["FU", 2, [0, 1, 2, 3]], ["SP", 2, 0, 18966528, [63], 1], ["AN", 2, 0, 5], ["AN", 2, 1, 6], ["PR", 2, 0, "auto_unroll_max_step$512"]]]], "r": [[0.000473914], 0, 5.59843, 1637915697], "v": "v0.6"}
{"i": [["[\"pool_layer\", \"max\", 128, 336, 42, 42, 3, 3, 2, \"SAME\"]", "cuda -keys=cuda,gpu -max_num_threads=1024 -thread_warp_size=32", [-1, 16, 64, 49152, 2147483647, 1024, 8, 32], "", 0, []], [[], [["CI", 1], ["FU", 2, [0, 1, 2, 3]], ["SP", 2, 0, 18966528, [42], 1], ["AN", 2, 0, 5], ["AN", 2, 1, 6], ["PR", 2, 0, "auto_unroll_max_step$512"]]]], "r": [[0.000708085], 0, 6.05833, 1637915699], "v": "v0.6"}
{"i": [["[\"pool_layer\", \"max\", 128, 336, 42, 42, 3, 3, 2, \"SAME\"]", "cuda -keys=cuda,gpu -max_num_threads=1024 -thread_warp_size=32", [-1, 16, 64, 49152, 2147483647, 1024, 8, 32], "", 0, []], [[], [["CI", 1], ["FU", 2, [0, 1, 2, 3]], ["SP", 2, 0, 18966528, [27], 1], ["AN", 2, 0, 5], ["AN", 2, 1, 6], ["PR", 2, 0, "auto_unroll_max_step$512"]]]], "r": [[0.00109942], 0, 4.88056, 1637915702], "v": "v0.6"}
{"i": [["[\"pool_layer\", \"max\", 128, 336, 42, 42, 3, 3, 2, \"SAME\"]", "cuda -keys=cuda,gpu -max_num_threads=1024 -thread_warp_size=32", [-1, 16, 64, 49152, 2147483647, 1024, 8, 32], "", 0, []], [[], [["CI", 1], ["FU", 2, [0, 1, 2, 3]], ["SP", 2, 0, 18966528, [2], 1], ["AN", 2, 0, 5], ["AN", 2, 1, 6], ["PR", 2, 0, "auto_unroll_max_step$64"]]]], "r": [[0.0148042], 0, 4.76861, 1637915704], "v": "v0.6"}
{"i": [["[\"pool_layer\", \"max\", 128, 336, 42, 42, 3, 3, 2, \"SAME\"]", "cuda -keys=cuda,gpu -max_num_threads=1024 -thread_warp_size=32", [-1, 16, 64, 49152, 2147483647, 1024, 8, 32], "", 0, []], [[], [["CI", 1], ["FU", 2, [0, 1, 2, 3]], ["SP", 2, 0, 18966528, [4], 1], ["AN", 2, 0, 5], ["AN", 2, 1, 6], ["PR", 2, 0, "auto_unroll_max_step$64"]]]], "r": [[0.00740272], 0, 4.69705, 1637915706], "v": "v0.6"}
{"i": [["[\"pool_layer\", \"max\", 128, 336, 42, 42, 3, 3, 2, \"SAME\"]", "cuda -keys=cuda,gpu -max_num_threads=1024 -thread_warp_size=32", [-1, 16, 64, 49152, 2147483647, 1024, 8, 32], "", 0, []], [[], [["CI", 1], ["FU", 2, [0, 1, 2, 3]], ["SP", 2, 0, 18966528, [9], 1], ["AN", 2, 0, 5], ["AN", 2, 1, 6], ["PR", 2, 0, "auto_unroll_max_step$0"]]]], "r": [[0.00329285], 0, 4.51276, 1637915707], "v": "v0.6"}
{"i": [["[\"pool_layer\", \"max\", 128, 336, 42, 42, 3, 3, 2, \"SAME\"]", "cuda -keys=cuda,gpu -max_num_threads=1024 -thread_warp_size=32", [-1, 16, 64, 49152, 2147483647, 1024, 8, 32], "", 0, []], [[], [["CI", 1], ["FU", 2, [0, 1, 2, 3]], ["SP", 2, 0, 18966528, [2], 1], ["AN", 2, 0, 5], ["AN", 2, 1, 6], ["PR", 2, 0, "auto_unroll_max_step$512"]]]], "r": [[0.014806], 0, 4.6135, 1637915709], "v": "v0.6"}
{"i": [["[\"pool_layer\", \"max\", 128, 336, 42, 42, 3, 3, 2, \"SAME\"]", "cuda -keys=cuda,gpu -max_num_threads=1024 -thread_warp_size=32", [-1, 16, 64, 49152, 2147483647, 1024, 8, 32], "", 0, []], [[], [["CI", 1], ["FU", 2, [0, 1, 2, 3]], ["SP", 2, 0, 18966528, [16], 1], ["AN", 2, 0, 5], ["AN", 2, 1, 6], ["PR", 2, 0, "auto_unroll_max_step$512"]]]], "r": [[0.0018551], 0, 2.62057, 1637915714], "v": "v0.6"}
{"i": [["[\"pool_layer\", \"max\", 128, 336, 42, 42, 3, 3, 2, \"SAME\"]", "cuda -keys=cuda,gpu -max_num_threads=1024 -thread_warp_size=32", [-1, 16, 64, 49152, 2147483647, 1024, 8, 32], "", 0, []], [[], [["CI", 1], ["FU", 2, [0, 1, 2, 3]], ["SP", 2, 0, 18966528, [1], 1], ["AN", 2, 0, 5], ["AN", 2, 1, 6], ["PR", 2, 0, "auto_unroll_max_step$512"]]]], "r": [[0.0296024], 0, 2.36905, 1637915716], "v": "v0.6"}
{"i": [["[\"pool_layer\", \"max\", 128, 336, 42, 42, 3, 3, 2, \"SAME\"]", "cuda -keys=cuda,gpu -max_num_threads=1024 -thread_warp_size=32", [-1, 16, 64, 49152, 2147483647, 1024, 8, 32], "", 0, []], [[], [["CI", 1], ["FU", 2, [0, 1, 2, 3]], ["SP", 2, 0, 18966528, [7], 1], ["AN", 2, 0, 5], ["AN", 2, 1, 6], ["PR", 2, 0, "auto_unroll_max_step$16"]]]], "r": [[0.00423146], 0, 2.32934, 1637915719], "v": "v0.6"}
{"i": [["[\"pool_layer\", \"max\", 128, 336, 42, 42, 3, 3, 2, \"SAME\"]", "cuda -keys=cuda,gpu -max_num_threads=1024 -thread_warp_size=32", [-1, 16, 64, 49152, 2147483647, 1024, 8, 32], "", 0, []], [[], [["CI", 1], ["FU", 2, [0, 1, 2, 3]], ["SP", 2, 0, 18966528, [56], 1], ["AN", 2, 0, 5], ["AN", 2, 1, 6], ["PR", 2, 0, "auto_unroll_max_step$512"]]]], "r": [[0.000531891], 0, 2.55033, 1637915721], "v": "v0.6"}
{"i": [["[\"pool_layer\", \"max\", 128, 336, 42, 42, 3, 3, 2, \"SAME\"]", "cuda -keys=cuda,gpu -max_num_threads=1024 -thread_warp_size=32", [-1, 16, 64, 49152, 2147483647, 1024, 8, 32], "", 0, []], [[], [["CI", 1], ["FU", 2, [0, 1, 2, 3]], ["SP", 2, 0, 18966528, [18], 1], ["AN", 2, 0, 5], ["AN", 2, 1, 6], ["PR", 2, 0, "auto_unroll_max_step$64"]]]], "r": [[0.00164766], 0, 2.907, 1637915723], "v": "v0.6"}
{"i": [["[\"pool_layer\", \"max\", 128, 336, 42, 42, 3, 3, 2, \"SAME\"]", "cuda -keys=cuda,gpu -max_num_threads=1024 -thread_warp_size=32", [-1, 16, 64, 49152, 2147483647, 1024, 8, 32], "", 0, []], [[], [["CI", 1], ["FU", 2, [0, 1, 2, 3]], ["SP", 2, 0, 18966528, [24], 1], ["AN", 2, 0, 5], ["AN", 2, 1, 6], ["PR", 2, 0, "auto_unroll_max_step$64"]]]], "r": [[0.0012363], 0, 2.76883, 1637915726], "v": "v0.6"}
{"i": [["[\"pool_layer\", \"max\", 128, 336, 42, 42, 3, 3, 2, \"SAME\"]", "cuda -keys=cuda,gpu -max_num_threads=1024 -thread_warp_size=32", [-1, 16, 64, 49152, 2147483647, 1024, 8, 32], "", 0, []], [[], [["CI", 1], ["FU", 2, [0, 1, 2, 3]], ["SP", 2, 0, 18966528, [48], 1], ["AN", 2, 0, 5], ["AN", 2, 1, 6], ["PR", 2, 0, "auto_unroll_max_step$0"]]]], "r": [[0.000620008], 0, 2.62824, 1637915728], "v": "v0.6"}
{"i": [["[\"pool_layer\", \"max\", 128, 336, 42, 42, 3, 3, 2, \"SAME\"]", "cuda -keys=cuda,gpu -max_num_threads=1024 -thread_warp_size=32", [-1, 16, 64, 49152, 2147483647, 1024, 8, 32], "", 0, []], [[], [["CI", 1], ["FU", 2, [0, 1, 2, 3]], ["SP", 2, 0, 18966528, [32], 1], ["AN", 2, 0, 5], ["AN", 2, 1, 6], ["PR", 2, 0, "auto_unroll_max_step$64"]]]], "r": [[0.00092808], 0, 2.63917, 1637915731], "v": "v0.6"}
{"i": [["[\"pool_layer\", \"max\", 128, 336, 42, 42, 3, 3, 2, \"SAME\"]", "cuda -keys=cuda,gpu -max_num_threads=1024 -thread_warp_size=32", [-1, 16, 64, 49152, 2147483647, 1024, 8, 32], "", 0, []], [[], [["CI", 1], ["FU", 2, [0, 1, 2, 3]], ["SP", 2, 0, 18966528, [49], 1], ["AN", 2, 0, 5], ["AN", 2, 1, 6], ["PR", 2, 0, "auto_unroll_max_step$512"]]]], "r": [[0.000607453], 0, 2.75021, 1637915733], "v": "v0.6"}
{"i": [["[\"pool_layer\", \"max\", 128, 336, 42, 42, 3, 3, 2, \"SAME\"]", "cuda -keys=cuda,gpu -max_num_threads=1024 -thread_warp_size=32", [-1, 16, 64, 49152, 2147483647, 1024, 8, 32], "", 0, []], [[], [["CI", 1], ["FU", 2, [0, 1, 2, 3]], ["SP", 2, 0, 18966528, [21], 1], ["AN", 2, 0, 5], ["AN", 2, 1, 6], ["PR", 2, 0, "auto_unroll_max_step$64"]]]], "r": [[0.00141309], 0, 2.69555, 1637915736], "v": "v0.6"}
{"i": [["[\"pool_layer\", \"max\", 128, 336, 42, 42, 3, 3, 2, \"SAME\"]", "cuda -keys=cuda,gpu -max_num_threads=1024 -thread_warp_size=32", [-1, 16, 64, 49152, 2147483647, 1024, 8, 32], "", 0, []], [[], [["CI", 1], ["FU", 2, [0, 1, 2, 3]], ["SP", 2, 0, 18966528, [49], 1], ["AN", 2, 0, 5], ["AN", 2, 1, 6], ["PR", 2, 0, "auto_unroll_max_step$16"]]]], "r": [[0.000607432], 0, 2.78204, 1637915738], "v": "v0.6"}
{"i": [["[\"pool_layer\", \"max\", 128, 336, 42, 42, 3, 3, 2, \"SAME\"]", "cuda -keys=cuda,gpu -max_num_threads=1024 -thread_warp_size=32", [-1, 16, 64, 49152, 2147483647, 1024, 8, 32], "", 0, []], [[], [["CI", 1], ["FU", 2, [0, 1, 2, 3]], ["SP", 2, 0, 18966528, [54], 1], ["AN", 2, 0, 5], ["AN", 2, 1, 6], ["PR", 2, 0, "auto_unroll_max_step$0"]]]], "r": [[0.000551928], 0, 2.7073, 1637915741], "v": "v0.6"}
{"i": [["[\"pool_layer\", \"max\", 128, 336, 42, 42, 3, 3, 2, \"SAME\"]", "cuda -keys=cuda,gpu -max_num_threads=1024 -thread_warp_size=32", [-1, 16, 64, 49152, 2147483647, 1024, 8, 32], "", 0, []], [[], [["CI", 1], ["FU", 2, [0, 1, 2, 3]], ["SP", 2, 0, 18966528, [49], 1], ["AN", 2, 0, 5], ["AN", 2, 1, 6], ["PR", 2, 0, "auto_unroll_max_step$0"]]]], "r": [[0.000607439], 0, 2.71263, 1637915743], "v": "v0.6"}
{"i": [["[\"pool_layer\", \"max\", 128, 336, 42, 42, 3, 3, 2, \"SAME\"]", "cuda -keys=cuda,gpu -max_num_threads=1024 -thread_warp_size=32", [-1, 16, 64, 49152, 2147483647, 1024, 8, 32], "", 0, []], [[], [["CI", 1], ["FU", 2, [0, 1, 2, 3]], ["SP", 2, 0, 18966528, [32], 1], ["AN", 2, 0, 5], ["AN", 2, 1, 6], ["PR", 2, 0, "auto_unroll_max_step$1024"]]]], "r": [[0.000928195], 0, 2.9724, 1637915746], "v": "v0.6"}
{"i": [["[\"pool_layer\", \"max\", 128, 336, 42, 42, 3, 3, 2, \"SAME\"]", "cuda -keys=cuda,gpu -max_num_threads=1024 -thread_warp_size=32", [-1, 16, 64, 49152, 2147483647, 1024, 8, 32], "", 0, []], [[], [["CI", 1], ["FU", 2, [0, 1, 2, 3]], ["SP", 2, 0, 18966528, [32], 1], ["AN", 2, 0, 5], ["AN", 2, 1, 6], ["PR", 2, 0, "auto_unroll_max_step$512"]]]], "r": [[0.000928161], 0, 2.62581, 1637915748], "v": "v0.6"}
{"i": [["[\"pool_layer\", \"max\", 128, 336, 42, 42, 3, 3, 2, \"SAME\"]", "cuda -keys=cuda,gpu -max_num_threads=1024 -thread_warp_size=32", [-1, 16, 64, 49152, 2147483647, 1024, 8, 32], "", 0, []], [[], [["CI", 1], ["FU", 2, [0, 1, 2, 3]], ["SP", 2, 0, 18966528, [32], 1], ["AN", 2, 0, 5], ["AN", 2, 1, 6], ["PR", 2, 0, "auto_unroll_max_step$16"]]]], "r": [[0.000928321], 0, 2.7478, 1637915751], "v": "v0.6"}
{"i": [["[\"pool_layer\", \"max\", 128, 336, 42, 42, 3, 3, 2, \"SAME\"]", "cuda -keys=cuda,gpu -max_num_threads=1024 -thread_warp_size=32", [-1, 16, 64, 49152, 2147483647, 1024, 8, 32], "", 0, []], [[], [["CI", 1], ["FU", 2, [0, 1, 2, 3]], ["SP", 2, 0, 18966528, [42], 1], ["AN", 2, 0, 5], ["AN", 2, 1, 6], ["PR", 2, 0, "auto_unroll_max_step$64"]]]], "r": [[0.000708373], 0, 5.00713, 1637915773], "v": "v0.6"}
{"i": [["[\"pool_layer\", \"max\", 128, 336, 42, 42, 3, 3, 2, \"SAME\"]", "cuda -keys=cuda,gpu -max_num_threads=1024 -thread_warp_size=32", [-1, 16, 64, 49152, 2147483647, 1024, 8, 32], "", 0, []], [[], [["CI", 1], ["FU", 2, [0, 1, 2, 3]], ["SP", 2, 0, 18966528, [28], 1], ["AN", 2, 0, 5], ["AN", 2, 1, 6], ["PR", 2, 0, "auto_unroll_max_step$64"]]]], "r": [[0.00105985], 0, 5.38131, 1637915776], "v": "v0.6"}
{"i": [["[\"pool_layer\", \"max\", 128, 336, 42, 42, 3, 3, 2, \"SAME\"]", "cuda -keys=cuda,gpu -max_num_threads=1024 -thread_warp_size=32", [-1, 16, 64, 49152, 2147483647, 1024, 8, 32], "", 0, []], [[], [["CI", 1], ["FU", 2, [0, 1, 2, 3]], ["SP", 2, 0, 18966528, [6], 1], ["AN", 2, 0, 5], ["AN", 2, 1, 6], ["PR", 2, 0, "auto_unroll_max_step$16"]]]], "r": [[0.00493896], 0, 10.6494, 1637915778], "v": "v0.6"}
{"i": [["[\"pool_layer\", \"max\", 128, 336, 42, 42, 3, 3, 2, \"SAME\"]", "cuda -keys=cuda,gpu -max_num_threads=1024 -thread_warp_size=32", [-1, 16, 64, 49152, 2147483647, 1024, 8, 32], "", 0, []], [[], [["CI", 1], ["FU", 2, [0, 1, 2, 3]], ["SP", 2, 0, 18966528, [28], 1], ["AN", 2, 0, 5], ["AN", 2, 1, 6], ["PR", 2, 0, "auto_unroll_max_step$512"]]]], "r": [[0.00106001], 0, 11.3762, 1637915780], "v": "v0.6"}
{"i": [["[\"pool_layer\", \"max\", 128, 336, 42, 42, 3, 3, 2, \"SAME\"]", "cuda -keys=cuda,gpu -max_num_threads=1024 -thread_warp_size=32", [-1, 16, 64, 49152, 2147483647, 1024, 8, 32], "", 0, []], [[], [["CI", 1], ["FU", 2, [0, 1, 2, 3]], ["SP", 2, 0, 18966528, [12], 1], ["AN", 2, 0, 5], ["AN", 2, 1, 6], ["PR", 2, 0, "auto_unroll_max_step$1024"]]]], "r": [[0.00246942], 0, 10.411, 1637915782], "v": "v0.6"}
{"i": [["[\"pool_layer\", \"max\", 128, 336, 42, 42, 3, 3, 2, \"SAME\"]", "cuda -keys=cuda,gpu -max_num_threads=1024 -thread_warp_size=32", [-1, 16, 64, 49152, 2147483647, 1024, 8, 32], "", 0, []], [[], [["CI", 1], ["FU", 2, [0, 1, 2, 3]], ["SP", 2, 0, 18966528, [3], 1], ["AN", 2, 0, 5], ["AN", 2, 1, 6], ["PR", 2, 0, "auto_unroll_max_step$16"]]]], "r": [[0.00986927], 0, 4.81333, 1637915785], "v": "v0.6"}
{"i": [["[\"pool_layer\", \"max\", 128, 336, 42, 42, 3, 3, 2, \"SAME\"]", "cuda -keys=cuda,gpu -max_num_threads=1024 -thread_warp_size=32", [-1, 16, 64, 49152, 2147483647, 1024, 8, 32], "", 0, []], [[], [["CI", 1], ["FU", 2, [0, 1, 2, 3]], ["SP", 2, 0, 18966528, [28], 1], ["AN", 2, 0, 5], ["AN", 2, 1, 6], ["PR", 2, 0, "auto_unroll_max_step$0"]]]], "r": [[0.00105997], 0, 5.14426, 1637915787], "v": "v0.6"}
{"i": [["[\"pool_layer\", \"max\", 128, 336, 42, 42, 3, 3, 2, \"SAME\"]", "cuda -keys=cuda,gpu -max_num_threads=1024 -thread_warp_size=32", [-1, 16, 64, 49152, 2147483647, 1024, 8, 32], "", 0, []], [[], [["CI", 1], ["FU", 2, [0, 1, 2, 3]], ["SP", 2, 0, 18966528, [28], 1], ["AN", 2, 0, 5], ["AN", 2, 1, 6], ["PR", 2, 0, "auto_unroll_max_step$1024"]]]], "r": [[0.00106002], 0, 5.09204, 1637915789], "v": "v0.6"}
{"i": [["[\"pool_layer\", \"max\", 128, 336, 42, 42, 3, 3, 2, \"SAME\"]", "cuda -keys=cuda,gpu -max_num_threads=1024 -thread_warp_size=32", [-1, 16, 64, 49152, 2147483647, 1024, 8, 32], "", 0, []], [[], [["CI", 1], ["FU", 2, [0, 1, 2, 3]], ["SP", 2, 0, 18966528, [21], 1], ["AN", 2, 0, 5], ["AN", 2, 1, 6], ["PR", 2, 0, "auto_unroll_max_step$0"]]]], "r": [[0.00141291], 0, 11.6695, 1637915792], "v": "v0.6"}
{"i": [["[\"pool_layer\", \"max\", 128, 336, 42, 42, 3, 3, 2, \"SAME\"]", "cuda -keys=cuda,gpu -max_num_threads=1024 -thread_warp_size=32", [-1, 16, 64, 49152, 2147483647, 1024, 8, 32], "", 0, []], [[], [["CI", 1], ["FU", 2, [0, 1, 2, 3]], ["SP", 2, 0, 18966528, [14], 1], ["AN", 2, 0, 5], ["AN", 2, 1, 6], ["PR", 2, 0, "auto_unroll_max_step$16"]]]], "r": [[0.00211704], 0, 10.2592, 1637915794], "v": "v0.6"}
{"i": [["[\"pool_layer\", \"max\", 128, 336, 42, 42, 3, 3, 2, \"SAME\"]", "cuda -keys=cuda,gpu -max_num_threads=1024 -thread_warp_size=32", [-1, 16, 64, 49152, 2147483647, 1024, 8, 32], "", 0, []], [[], [["CI", 1], ["FU", 2, [0, 1, 2, 3]], ["SP", 2, 0, 18966528, [8], 1], ["AN", 2, 0, 5], ["AN", 2, 1, 6], ["PR", 2, 0, "auto_unroll_max_step$16"]]]], "r": [[0.00370264], 0, 5.05303, 1637915796], "v": "v0.6"}
{"i": [["[\"pool_layer\", \"max\", 128, 336, 42, 42, 3, 3, 2, \"SAME\"]", "cuda -keys=cuda,gpu -max_num_threads=1024 -thread_warp_size=32", [-1, 16, 64, 49152, 2147483647, 1024, 8, 32], "", 0, []], [[], [["CI", 1], ["FU", 2, [0, 1, 2, 3]], ["SP", 2, 0, 18966528, [16], 1], ["AN", 2, 0, 5], ["AN", 2, 1, 6], ["PR", 2, 0, "auto_unroll_max_step$16"]]]], "r": [[0.00185273], 0, 4.66143, 1637915798], "v": "v0.6"}
{"i": [["[\"pool_layer\", \"max\", 128, 336, 42, 42, 3, 3, 2, \"SAME\"]", "cuda -keys=cuda,gpu -max_num_threads=1024 -thread_warp_size=32", [-1, 16, 64, 49152, 2147483647, 1024, 8, 32], "", 0, []], [[], [["CI", 1], ["FU", 2, [0, 1, 2, 3]], ["SP", 2, 0, 18966528, [49], 1], ["AN", 2, 0, 5], ["AN", 2, 1, 6], ["PR", 2, 0, "auto_unroll_max_step$1024"]]]], "r": [[0.000607615], 0, 5.17808, 1637915801], "v": "v0.6"}
{"i": [["[\"pool_layer\", \"max\", 128, 336, 42, 42, 3, 3, 2, \"SAME\"]", "cuda -keys=cuda,gpu -max_num_threads=1024 -thread_warp_size=32", [-1, 16, 64, 49152, 2147483647, 1024, 8, 32], "", 0, []], [[], [["CI", 1], ["FU", 2, [0, 1, 2, 3]], ["SP", 2, 0, 18966528, [64], 1], ["AN", 2, 0, 5], ["AN", 2, 1, 6], ["PR", 2, 0, "auto_unroll_max_step$512"]]]], "r": [[0.000470329], 0, 4.92655, 1637915803], "v": "v0.6"}
{"i": [["[\"pool_layer\", \"max\", 128, 336, 42, 42, 3, 3, 2, \"SAME\"]", "cuda -keys=cuda,gpu -max_num_threads=1024 -thread_warp_size=32", [-1, 16, 64, 49152, 2147483647, 1024, 8, 32], "", 0, []], [[], [["CI", 1], ["FU", 2, [0, 1, 2, 3]], ["SP", 2, 0, 18966528, [8], 1], ["AN", 2, 0, 5], ["AN", 2, 1, 6], ["PR", 2, 0, "auto_unroll_max_step$512"]]]], "r": [[0.00370301], 0, 5.00774, 1637915806], "v": "v0.6"}
{"i": [["[\"pool_layer\", \"max\", 128, 336, 42, 42, 3, 3, 2, \"SAME\"]", "cuda -keys=cuda,gpu -max_num_threads=1024 -thread_warp_size=32", [-1, 16, 64, 49152, 2147483647, 1024, 8, 32], "", 0, []], [[], [["CI", 1], ["FU", 2, [0, 1, 2, 3]], ["SP", 2, 0, 18966528, [3], 1], ["AN", 2, 0, 5], ["AN", 2, 1, 6], ["PR", 2, 0, "auto_unroll_max_step$64"]]]], "r": [[0.00986942], 0, 4.72078, 1637915808], "v": "v0.6"}
{"i": [["[\"pool_layer\", \"max\", 128, 336, 42, 42, 3, 3, 2, \"SAME\"]", "cuda -keys=cuda,gpu -max_num_threads=1024 -thread_warp_size=32", [-1, 16, 64, 49152, 2147483647, 1024, 8, 32], "", 0, []], [[], [["CI", 1], ["FU", 2, [0, 1, 2, 3]], ["SP", 2, 0, 18966528, [48], 1], ["AN", 2, 0, 5], ["AN", 2, 1, 6], ["PR", 2, 0, "auto_unroll_max_step$16"]]]], "r": [[0.00061989], 0, 5.0966, 1637915810], "v": "v0.6"}
{"i": [["[\"pool_layer\", \"max\", 128, 336, 42, 42, 3, 3, 2, \"SAME\"]", "cuda -keys=cuda,gpu -max_num_threads=1024 -thread_warp_size=32", [-1, 16, 64, 49152, 2147483647, 1024, 8, 32], "", 0, []], [[], [["CI", 1], ["FU", 2, [0, 1, 2, 3]], ["SP", 2, 0, 18966528, [2], 1], ["AN", 2, 0, 5], ["AN", 2, 1, 6], ["PR", 2, 0, "auto_unroll_max_step$0"]]]], "r": [[0.0148073], 0, 10.4019, 1637915812], "v": "v0.6"}
{"i": [["[\"pool_layer\", \"max\", 128, 336, 42, 42, 3, 3, 2, \"SAME\"]", "cuda -keys=cuda,gpu -max_num_threads=1024 -thread_warp_size=32", [-1, 16, 64, 49152, 2147483647, 1024, 8, 32], "", 0, []], [[], [["CI", 1], ["FU", 2, [0, 1, 2, 3]], ["SP", 2, 0, 18966528, [12], 1], ["AN", 2, 0, 5], ["AN", 2, 1, 6], ["PR", 2, 0, "auto_unroll_max_step$16"]]]], "r": [[0.00246963], 0, 4.55222, 1637915814], "v": "v0.6"}
{"i": [["[\"pool_layer\", \"max\", 128, 336, 42, 42, 3, 3, 2, \"SAME\"]", "cuda -keys=cuda,gpu -max_num_threads=1024 -thread_warp_size=32", [-1, 16, 64, 49152, 2147483647, 1024, 8, 32], "", 0, []], [[], [["CI", 1], ["FU", 2, [0, 1, 2, 3]], ["SP", 2, 0, 18966528, [4], 1], ["AN", 2, 0, 5], ["AN", 2, 1, 6], ["PR", 2, 0, "auto_unroll_max_step$512"]]]], "r": [[0.00740239], 0, 4.42751, 1637915816], "v": "v0.6"}
{"i": [["[\"pool_layer\", \"max\", 128, 336, 42, 42, 3, 3, 2, \"SAME\"]", "cuda -keys=cuda,gpu -max_num_threads=1024 -thread_warp_size=32", [-1, 16, 64, 49152, 2147483647, 1024, 8, 32], "", 0, []], [[], [["CI", 1], ["FU", 2, [0, 1, 2, 3]], ["SP", 2, 0, 18966528, [36], 1], ["AN", 2, 0, 5], ["AN", 2, 1, 6], ["PR", 2, 0, "auto_unroll_max_step$0"]]]], "r": [[0.000825366], 0, 3.12645, 1637915819], "v": "v0.6"}
{"i": [["[\"pool_layer\", \"max\", 128, 336, 42, 42, 3, 3, 2, \"SAME\"]", "cuda -keys=cuda,gpu -max_num_threads=1024 -thread_warp_size=32", [-1, 16, 64, 49152, 2147483647, 1024, 8, 32], "", 0, []], [[], [["CI", 1], ["FU", 2, [0, 1, 2, 3]], ["SP", 2, 0, 18966528, [7], 1], ["AN", 2, 0, 5], ["AN", 2, 1, 6], ["PR", 2, 0, "auto_unroll_max_step$0"]]]], "r": [[0.00423215], 0, 11.3013, 1637915821], "v": "v0.6"}
{"i": [["[\"pool_layer\", \"max\", 128, 336, 42, 42, 3, 3, 2, \"SAME\"]", "cuda -keys=cuda,gpu -max_num_threads=1024 -thread_warp_size=32", [-1, 16, 64, 49152, 2147483647, 1024, 8, 32], "", 0, []], [[], [["CI", 1], ["FU", 2, [0, 1, 2, 3]], ["SP", 2, 0, 18966528, [24], 1], ["AN", 2, 0, 5], ["AN", 2, 1, 6], ["PR", 2, 0, "auto_unroll_max_step$512"]]]], "r": [[0.00123624], 0, 10.7851, 1637915823], "v": "v0.6"}
{"i": [["[\"pool_layer\", \"max\", 128, 336, 42, 42, 3, 3, 2, \"SAME\"]", "cuda -keys=cuda,gpu -max_num_threads=1024 -thread_warp_size=32", [-1, 16, 64, 49152, 2147483647, 1024, 8, 32], "", 0, []], [[], [["CI", 1], ["FU", 2, [0, 1, 2, 3]], ["SP", 2, 0, 18966528, [64], 1], ["AN", 2, 0, 5], ["AN", 2, 1, 6], ["PR", 2, 0, "auto_unroll_max_step$1024"]]]], "r": [[0.000470232], 0, 11.8086, 1637915825], "v": "v0.6"}
{"i": [["[\"pool_layer\", \"max\", 128, 336, 42, 42, 3, 3, 2, \"SAME\"]", "cuda -keys=cuda,gpu -max_num_threads=1024 -thread_warp_size=32", [-1, 16, 64, 49152, 2147483647, 1024, 8, 32], "", 0, []], [[], [["CI", 1], ["FU", 2, [0, 1, 2, 3]], ["SP", 2, 0, 18966528, [14], 1], ["AN", 2, 0, 5], ["AN", 2, 1, 6], ["PR", 2, 0, "auto_unroll_max_step$64"]]]], "r": [[0.00211723], 0, 10.9797, 1637915827], "v": "v0.6"}
{"i": [["[\"pool_layer\", \"max\", 128, 336, 42, 42, 3, 3, 2, \"SAME\"]", "cuda -keys=cuda,gpu -max_num_threads=1024 -thread_warp_size=32", [-1, 16, 64, 49152, 2147483647, 1024, 8, 32], "", 0, []], [[], [["CI", 1], ["FU", 2, [0, 1, 2, 3]], ["SP", 2, 0, 18966528, [3], 1], ["AN", 2, 0, 5], ["AN", 2, 1, 6], ["PR", 2, 0, "auto_unroll_max_step$512"]]]], "r": [[0.00987043], 0, 2.4487, 1637915829], "v": "v0.6"}
{"i": [["[\"pool_layer\", \"max\", 128, 336, 42, 42, 3, 3, 2, \"SAME\"]", "cuda -keys=cuda,gpu -max_num_threads=1024 -thread_warp_size=32", [-1, 16, 64, 49152, 2147483647, 1024, 8, 32], "", 0, []], [[], [["CI", 1], ["FU", 2, [0, 1, 2, 3]], ["SP", 2, 0, 18966528, [8], 1], ["AN", 2, 0, 5], ["AN", 2, 1, 6], ["PR", 2, 0, "auto_unroll_max_step$64"]]]], "r": [[0.00370265], 0, 2.72536, 1637915832], "v": "v0.6"}
{"i": [["[\"pool_layer\", \"max\", 128, 336, 42, 42, 3, 3, 2, \"SAME\"]", "cuda -keys=cuda,gpu -max_num_threads=1024 -thread_warp_size=32", [-1, 16, 64, 49152, 2147483647, 1024, 8, 32], "", 0, []], [[], [["CI", 1], ["FU", 2, [0, 1, 2, 3]], ["SP", 2, 0, 18966528, [1], 1], ["AN", 2, 0, 5], ["AN", 2, 1, 6], ["PR", 2, 0, "auto_unroll_max_step$1024"]]]], "r": [[0.0296116], 0, 2.40864, 1637915834], "v": "v0.6"}
{"i": [["[\"pool_layer\", \"max\", 128, 336, 42, 42, 3, 3, 2, \"SAME\"]", "cuda -keys=cuda,gpu -max_num_threads=1024 -thread_warp_size=32", [-1, 16, 64, 49152, 2147483647, 1024, 8, 32], "", 0, []], [[], [["CI", 1], ["FU", 2, [0, 1, 2, 3]], ["SP", 2, 0, 18966528, [3], 1], ["AN", 2, 0, 5], ["AN", 2, 1, 6], ["PR", 2, 0, "auto_unroll_max_step$1024"]]]], "r": [[0.00986888], 0, 2.25489, 1637915836], "v": "v0.6"}
{"i": [["[\"pool_layer\", \"max\", 128, 336, 42, 42, 3, 3, 2, \"SAME\"]", "cuda -keys=cuda,gpu -max_num_threads=1024 -thread_warp_size=32", [-1, 16, 64, 49152, 2147483647, 1024, 8, 32], "", 0, []], [[], [["CI", 1], ["FU", 2, [0, 1, 2, 3]], ["SP", 2, 0, 18966528, [36], 1], ["AN", 2, 0, 5], ["AN", 2, 1, 6], ["PR", 2, 0, "auto_unroll_max_step$1024"]]]], "r": [[0.000825293], 0, 2.67259, 1637915838], "v": "v0.6"}
{"i": [["[\"pool_layer\", \"max\", 128, 336, 42, 42, 3, 3, 2, \"SAME\"]", "cuda -keys=cuda,gpu -max_num_threads=1024 -thread_warp_size=32", [-1, 16, 64, 49152, 2147483647, 1024, 8, 32], "", 0, []], [[], [["CI", 1], ["FU", 2, [0, 1, 2, 3]], ["SP", 2, 0, 18966528, [36], 1], ["AN", 2, 0, 5], ["AN", 2, 1, 6], ["PR", 2, 0, "auto_unroll_max_step$16"]]]], "r": [[0.000825339], 0, 2.79947, 1637915841], "v": "v0.6"}
{"i": [["[\"pool_layer\", \"max\", 128, 336, 42, 42, 3, 3, 2, \"SAME\"]", "cuda -keys=cuda,gpu -max_num_threads=1024 -thread_warp_size=32", [-1, 16, 64, 49152, 2147483647, 1024, 8, 32], "", 0, []], [[], [["CI", 1], ["FU", 2, [0, 1, 2, 3]], ["SP", 2, 0, 18966528, [18], 1], ["AN", 2, 0, 5], ["AN", 2, 1, 6], ["PR", 2, 0, "auto_unroll_max_step$0"]]]], "r": [[0.00164728], 0, 2.77352, 1637915843], "v": "v0.6"}
{"i": [["[\"pool_layer\", \"max\", 128, 336, 42, 42, 3, 3, 2, \"SAME\"]", "cuda -keys=cuda,gpu -max_num_threads=1024 -thread_warp_size=32", [-1, 16, 64, 49152, 2147483647, 1024, 8, 32], "", 0, []], [[], [["CI", 1], ["FU", 2, [0, 1, 2, 3]], ["SP", 2, 0, 18966528, [56], 1], ["AN", 2, 0, 5], ["AN", 2, 1, 6], ["PR", 2, 0, "auto_unroll_max_step$16"]]]], "r": [[0.000531954], 0, 3.08177, 1637915846], "v": "v0.6"}
{"i": [["[\"pool_layer\", \"max\", 128, 336, 42, 42, 3, 3, 2, \"SAME\"]", "cuda -keys=cuda,gpu -max_num_threads=1024 -thread_warp_size=32", [-1, 16, 64, 49152, 2147483647, 1024, 8, 32], "", 0, []], [[], [["CI", 1], ["FU", 2, [0, 1, 2, 3]], ["SP", 2, 0, 18966528, [6], 1], ["AN", 2, 0, 5], ["AN", 2, 1, 6], ["PR", 2, 0, "auto_unroll_max_step$0"]]]], "r": [[0.00493636], 0, 2.22382, 1637915848], "v": "v0.6"}
{"i": [["[\"pool_layer\", \"max\", 128, 336, 42, 42, 3, 3, 2, \"SAME\"]", "cuda -keys=cuda,gpu -max_num_threads=1024 -thread_warp_size=32", [-1, 16, 64, 49152, 2147483647, 1024, 8, 32], "", 0, []], [[], [["CI", 1], ["FU", 2, [0, 1, 2, 3]], ["SP", 2, 0, 18966528, [16], 1], ["AN", 2, 0, 5], ["AN", 2, 1, 6], ["PR", 2, 0, "auto_unroll_max_step$64"]]]], "r": [[0.00185287], 0, 2.19924, 1637915850], "v": "v0.6"}
{"i": [["[\"pool_layer\", \"max\", 128, 336, 42, 42, 3, 3, 2, \"SAME\"]", "cuda -keys=cuda,gpu -max_num_threads=1024 -thread_warp_size=32", [-1, 16, 64, 49152, 2147483647, 1024, 8, 32], "", 0, []], [[], [["CI", 1], ["FU", 2, [0, 1, 2, 3]], ["SP", 2, 0, 18966528, [1], 1], ["AN", 2, 0, 5], ["AN", 2, 1, 6], ["PR", 2, 0, "auto_unroll_max_step$64"]]]], "r": [[0.029603], 0, 2.49433, 1637915852], "v": "v0.6"}
{"i": [["[\"pool_layer\", \"max\", 128, 336, 42, 42, 3, 3, 2, \"SAME\"]", "cuda -keys=cuda,gpu -max_num_threads=1024 -thread_warp_size=32", [-1, 16, 64, 49152, 2147483647, 1024, 8, 32], "", 0, []], [[], [["CI", 1], ["FU", 2, [0, 1, 2, 3]], ["SP", 2, 0, 18966528, [42], 1], ["AN", 2, 0, 5], ["AN", 2, 1, 6], ["PR", 2, 0, "auto_unroll_max_step$0"]]]], "r": [[0.000708106], 0, 2.68755, 1637915854], "v": "v0.6"}
{"i": [["[\"pool_layer\", \"max\", 128, 336, 42, 42, 3, 3, 2, \"SAME\"]", "cuda -keys=cuda,gpu -max_num_threads=1024 -thread_warp_size=32", [-1, 16, 64, 49152, 2147483647, 1024, 8, 32], "", 0, []], [[], [["CI", 1], ["FU", 2, [0, 1, 2, 3]], ["SP", 2, 0, 18966528, [6], 1], ["AN", 2, 0, 5], ["AN", 2, 1, 6], ["PR", 2, 0, "auto_unroll_max_step$512"]]]], "r": [[0.00493696], 0, 2.51639, 1637915857], "v": "v0.6"}
{"i": [["[\"pool_layer\", \"max\", 128, 336, 42, 42, 3, 3, 2, \"SAME\"]", "cuda -keys=cuda,gpu -max_num_threads=1024 -thread_warp_size=32", [-1, 16, 64, 49152, 2147483647, 1024, 8, 32], "", 0, []], [[], [["CI", 1], ["FU", 2, [0, 1, 2, 3]], ["SP", 2, 0, 18966528, [9], 1], ["AN", 2, 0, 5], ["AN", 2, 1, 6], ["PR", 2, 0, "auto_unroll_max_step$64"]]]], "r": [[0.00329208], 0, 2.5307, 1637915859], "v": "v0.6"}
{"i": [["[\"pool_layer\", \"max\", 128, 336, 42, 42, 3, 3, 2, \"SAME\"]", "cuda -keys=cuda,gpu -max_num_threads=1024 -thread_warp_size=32", [-1, 16, 64, 49152, 2147483647, 1024, 8, 32], "", 0, []], [[], [["CI", 1], ["FU", 2, [0, 1, 2, 3]], ["SP", 2, 0, 18966528, [14], 1], ["AN", 2, 0, 5], ["AN", 2, 1, 6], ["PR", 2, 0, "auto_unroll_max_step$0"]]]], "r": [[0.00211926], 0, 8.36648, 1637915861], "v": "v0.6"}
{"i": [["[\"pool_layer\", \"max\", 128, 336, 42, 42, 3, 3, 2, \"SAME\"]", "cuda -keys=cuda,gpu -max_num_threads=1024 -thread_warp_size=32", [-1, 16, 64, 49152, 2147483647, 1024, 8, 32], "", 0, []], [[], [["CI", 1], ["FU", 2, [0, 1, 2, 3]], ["SP", 2, 0, 18966528, [16], 1], ["AN", 2, 0, 5], ["AN", 2, 1, 6], ["PR", 2, 0, "auto_unroll_max_step$0"]]]], "r": [[0.00185295], 0, 2.46243, 1637915863], "v": "v0.6"}
{"i": [["[\"pool_layer\", \"max\", 128, 336, 42, 42, 3, 3, 2, \"SAME\"]", "cuda -keys=cuda,gpu -max_num_threads=1024 -thread_warp_size=32", [-1, 16, 64, 49152, 2147483647, 1024, 8, 32], "", 0, []], [[], [["CI", 1], ["FU", 2, [0, 1, 2, 3]], ["SP", 2, 0, 18966528, [63], 1], ["AN", 2, 0, 5], ["AN", 2, 1, 6], ["PR", 2, 0, "auto_unroll_max_step$16"]]]], "r": [[0.00047393], 0, 8.82345, 1637915865], "v": "v0.6"}
{"i": [["[\"pool_layer\", \"max\", 128, 336, 42, 42, 3, 3, 2, \"SAME\"]", "cuda -keys=cuda,gpu -max_num_threads=1024 -thread_warp_size=32", [-1, 16, 64, 49152, 2147483647, 1024, 8, 32], "", 0, []], [[], [["CI", 1], ["FU", 2, [0, 1, 2, 3]], ["SP", 2, 0, 18966528, [28], 1], ["AN", 2, 0, 5], ["AN", 2, 1, 6], ["PR", 2, 0, "auto_unroll_max_step$16"]]]], "r": [[0.0010601], 0, 8.79049, 1637915868], "v": "v0.6"}
{"i": [["[\"pool_layer\", \"max\", 128, 336, 42, 42, 3, 3, 2, \"SAME\"]", "cuda -keys=cuda,gpu -max_num_threads=1024 -thread_warp_size=32", [-1, 16, 64, 49152, 2147483647, 1024, 8, 32], "", 0, []], [[], [["CI", 1], ["FU", 2, [0, 1, 2, 3]], ["SP", 2, 0, 18966528, [16], 1], ["AN", 2, 0, 5], ["AN", 2, 1, 6], ["PR", 2, 0, "auto_unroll_max_step$1024"]]]], "r": [[0.00185306], 0, 8.26454, 1637915870], "v": "v0.6"}
{"i": [["[\"pool_layer\", \"max\", 128, 336, 42, 42, 3, 3, 2, \"SAME\"]", "cuda -keys=cuda,gpu -max_num_threads=1024 -thread_warp_size=32", [-1, 16, 64, 49152, 2147483647, 1024, 8, 32], "", 0, []], [[], [["CI", 1], ["FU", 2, [0, 1, 2, 3]], ["SP", 2, 0, 18966528, [12], 1], ["AN", 2, 0, 5], ["AN", 2, 1, 6], ["PR", 2, 0, "auto_unroll_max_step$64"]]]], "r": [[0.00246959], 0, 8.2824, 1637915872], "v": "v0.6"}
{"i": [["[\"pool_layer\", \"max\", 128, 336, 42, 42, 3, 3, 2, \"SAME\"]", "cuda -keys=cuda,gpu -max_num_threads=1024 -thread_warp_size=32", [-1, 16, 64, 49152, 2147483647, 1024, 8, 32], "", 0, []], [[], [["CI", 1], ["FU", 2, [0, 1, 2, 3]], ["SP", 2, 0, 18966528, [8], 1], ["AN", 2, 0, 5], ["AN", 2, 1, 6], ["PR", 2, 0, "auto_unroll_max_step$1024"]]]], "r": [[0.00370306], 0, 8.79394, 1637915874], "v": "v0.6"}
{"i": [["[\"pool_layer\", \"max\", 128, 336, 42, 42, 3, 3, 2, \"SAME\"]", "cuda -keys=cuda,gpu -max_num_threads=1024 -thread_warp_size=32", [-1, 16, 64, 49152, 2147483647, 1024, 8, 32], "", 0, []], [[], [["CI", 1], ["FU", 2, [0, 1, 2, 3]], ["SP", 2, 0, 18966528, [6], 1], ["AN", 2, 0, 5], ["AN", 2, 1, 6], ["PR", 2, 0, "auto_unroll_max_step$64"]]]], "r": [[0.00493575], 0, 8.46411, 1637915876], "v": "v0.6"}
{"i": [["[\"pool_layer\", \"max\", 128, 336, 42, 42, 3, 3, 2, \"SAME\"]", "cuda -keys=cuda,gpu -max_num_threads=1024 -thread_warp_size=32", [-1, 16, 64, 49152, 2147483647, 1024, 8, 32], "", 0, []], [[], [["CI", 1], ["FU", 2, [0, 1, 2, 3]], ["SP", 2, 0, 18966528, [2], 1], ["AN", 2, 0, 5], ["AN", 2, 1, 6], ["PR", 2, 0, "auto_unroll_max_step$16"]]]], "r": [[0.014804], 0, 8.27011, 1637915878], "v": "v0.6"}
{"i": [["[\"pool_layer\", \"max\", 128, 336, 42, 42, 3, 3, 2, \"SAME\"]", "cuda -keys=cuda,gpu -max_num_threads=1024 -thread_warp_size=32", [-1, 16, 64, 49152, 2147483647, 1024, 8, 32], "", 0, []], [[], [["CI", 1], ["FU", 2, [0, 1, 2, 3]], ["SP", 2, 0, 18966528, [49], 1], ["AN", 2, 0, 5], ["AN", 2, 1, 6], ["PR", 2, 0, "auto_unroll_max_step$64"]]]], "r": [[0.000607388], 0, 3.10983, 1637915887], "v": "v0.6"}
{"i": [["[\"pool_layer\", \"max\", 128, 336, 42, 42, 3, 3, 2, \"SAME\"]", "cuda -keys=cuda,gpu -max_num_threads=1024 -thread_warp_size=32", [-1, 16, 64, 49152, 2147483647, 1024, 8, 32], "", 0, []], [[], [["CI", 1], ["FU", 2, [0, 1, 2, 3]], ["SP", 2, 0, 18966528, [54], 1], ["AN", 2, 0, 5], ["AN", 2, 1, 6], ["PR", 2, 0, "auto_unroll_max_step$16"]]]], "r": [[0.000551817], 0, 3.46579, 1637915890], "v": "v0.6"}
{"i": [["[\"pool_layer\", \"max\", 128, 336, 42, 42, 3, 3, 2, \"SAME\"]", "cuda -keys=cuda,gpu -max_num_threads=1024 -thread_warp_size=32", [-1, 16, 64, 49152, 2147483647, 1024, 8, 32], "", 0, []], [[], [["CI", 1], ["FU", 2, [0, 1, 2, 3]], ["SP", 2, 0, 18966528, [14], 1], ["AN", 2, 0, 5], ["AN", 2, 1, 6], ["PR", 2, 0, "auto_unroll_max_step$512"]]]], "r": [[0.002117], 0, 2.75994, 1637915892], "v": "v0.6"}
{"i": [["[\"pool_layer\", \"max\", 128, 336, 42, 42, 3, 3, 2, \"SAME\"]", "cuda -keys=cuda,gpu -max_num_threads=1024 -thread_warp_size=32", [-1, 16, 64, 49152, 2147483647, 1024, 8, 32], "", 0, []], [[], [["CI", 1], ["FU", 2, [0, 1, 2, 3]], ["SP", 2, 0, 18966528, [8], 1], ["AN", 2, 0, 5], ["AN", 2, 1, 6], ["PR", 2, 0, "auto_unroll_max_step$0"]]]], "r": [[0.00370249], 0, 3.32524, 1637915894], "v": "v0.6"}
{"i": [["[\"pool_layer\", \"max\", 128, 336, 42, 42, 3, 3, 2, \"SAME\"]", "cuda -keys=cuda,gpu -max_num_threads=1024 -thread_warp_size=32", [-1, 16, 64, 49152, 2147483647, 1024, 8, 32], "", 0, []], [[], [["CI", 1], ["FU", 2, [0, 1, 2, 3]], ["SP", 2, 0, 18966528, [2], 1], ["AN", 2, 0, 5], ["AN", 2, 1, 6], ["PR", 2, 0, "auto_unroll_max_step$1024"]]]], "r": [[0.014802], 0, 2.57916, 1637915896], "v": "v0.6"}
{"i": [["[\"pool_layer\", \"max\", 128, 336, 42, 42, 3, 3, 2, \"SAME\"]", "cuda -keys=cuda,gpu -max_num_threads=1024 -thread_warp_size=32", [-1, 16, 64, 49152, 2147483647, 1024, 8, 32], "", 0, []], [[], [["CI", 1], ["FU", 2, [0, 1, 2, 3]], ["SP", 2, 0, 18966528, [64], 1], ["AN", 2, 0, 5], ["AN", 2, 1, 6], ["PR", 2, 0, "auto_unroll_max_step$0"]]]], "r": [[0.000470183], 0, 3.31634, 1637915898], "v": "v0.6"}
{"i": [["[\"pool_layer\", \"max\", 128, 336, 42, 42, 3, 3, 2, \"SAME\"]", "cuda -keys=cuda,gpu -max_num_threads=1024 -thread_warp_size=32", [-1, 16, 64, 49152, 2147483647, 1024, 8, 32], "", 0, []], [[], [["CI", 1], ["FU", 2, [0, 1, 2, 3]], ["SP", 2, 0, 18966528, [4], 1], ["AN", 2, 0, 5], ["AN", 2, 1, 6], ["PR", 2, 0, "auto_unroll_max_step$1024"]]]], "r": [[0.00740216], 0, 2.73632, 1637915900], "v": "v0.6"}
{"i": [["[\"pool_layer\", \"max\", 128, 336, 42, 42, 3, 3, 2, \"SAME\"]", "cuda -keys=cuda,gpu -max_num_threads=1024 -thread_warp_size=32", [-1, 16, 64, 49152, 2147483647, 1024, 8, 32], "", 0, []], [[], [["CI", 1], ["FU", 2, [0, 1, 2, 3]], ["SP", 2, 0, 18966528, [21], 1], ["AN", 2, 0, 5], ["AN", 2, 1, 6], ["PR", 2, 0, "auto_unroll_max_step$16"]]]], "r": [[0.00141298], 0, 3.17876, 1637915903], "v": "v0.6"}
{"i": [["[\"pool_layer\", \"max\", 128, 336, 42, 42, 3, 3, 2, \"SAME\"]", "cuda -keys=cuda,gpu -max_num_threads=1024 -thread_warp_size=32", [-1, 16, 64, 49152, 2147483647, 1024, 8, 32], "", 0, []], [[], [["CI", 1], ["FU", 2, [0, 1, 2, 3]], ["SP", 2, 0, 18966528, [63], 1], ["AN", 2, 0, 5], ["AN", 2, 1, 6], ["PR", 2, 0, "auto_unroll_max_step$1024"]]]], "r": [[0.000473935], 0, 2.95877, 1637915905], "v": "v0.6"}
{"i": [["[\"pool_layer\", \"max\", 128, 336, 42, 42, 3, 3, 2, \"SAME\"]", "cuda -keys=cuda,gpu -max_num_threads=1024 -thread_warp_size=32", [-1, 16, 64, 49152, 2147483647, 1024, 8, 32], "", 0, []], [[], [["CI", 1], ["FU", 2, [0, 1, 2, 3]], ["SP", 2, 0, 18966528, [7], 1], ["AN", 2, 0, 5], ["AN", 2, 1, 6], ["PR", 2, 0, "auto_unroll_max_step$1024"]]]], "r": [[0.00423189], 0, 2.74797, 1637915907], "v": "v0.6"}
{"i": [["[\"pool_layer\", \"max\", 128, 336, 42, 42, 3, 3, 2, \"SAME\"]", "cuda -keys=cuda,gpu -max_num_threads=1024 -thread_warp_size=32", [-1, 16, 64, 49152, 2147483647, 1024, 8, 32], "", 0, []], [[], [["CI", 1], ["FU", 2, [0, 1, 2, 3]], ["SP", 2, 0, 18966528, [64], 1], ["AN", 2, 0, 5], ["AN", 2, 1, 6], ["PR", 2, 0, "auto_unroll_max_step$64"]]]], "r": [[0.000470197], 0, 3.28462, 1637915909], "v": "v0.6"}
{"i": [["[\"pool_layer\", \"max\", 128, 336, 42, 42, 3, 3, 2, \"SAME\"]", "cuda -keys=cuda,gpu -max_num_threads=1024 -thread_warp_size=32", [-1, 16, 64, 49152, 2147483647, 1024, 8, 32], "", 0, []], [[], [["CI", 1], ["FU", 2, [0, 1, 2, 3]], ["SP", 2, 0, 18966528, [27], 1], ["AN", 2, 0, 5], ["AN", 2, 1, 6], ["PR", 2, 0, "auto_unroll_max_step$0"]]]], "r": [[0.00109927], 0, 2.91338, 1637915912], "v": "v0.6"}
{"i": [["[\"pool_layer\", \"max\", 128, 336, 42, 42, 3, 3, 2, \"SAME\"]", "cuda -keys=cuda,gpu -max_num_threads=1024 -thread_warp_size=32", [-1, 16, 64, 49152, 2147483647, 1024, 8, 32], "", 0, []], [[], [["CI", 1], ["FU", 2, [0, 1, 2, 3]], ["SP", 2, 0, 18966528, [1], 1], ["AN", 2, 0, 5], ["AN", 2, 1, 6], ["PR", 2, 0, "auto_unroll_max_step$0"]]]], "r": [[0.0296023], 0, 2.60057, 1637915914], "v": "v0.6"}
