artifacts/Table3/tvm/ansor/elementwise/ansor_relu_128_256_28_28.log
{"i": [["[\"relu_layer\", 128, 256, 28, 28]", "cuda -keys=cuda,gpu -max_num_threads=1024 -thread_warp_size=32", [-1, 16, 64, 49152, 2147483647, 1024, 8, 32], "", 0, []], [[], [["FU", 1, [0, 1, 2, 3]], ["SP", 1, 0, 25690112, [7], 1], ["AN", 1, 0, 5], ["AN", 1, 1, 6]]]], "r": [[0.0130909], 0, 2.29739, 1639142196], "v": "v0.6"}
{"i": [["[\"relu_layer\", 128, 256, 28, 28]", "cuda -keys=cuda,gpu -max_num_threads=1024 -thread_warp_size=32", [-1, 16, 64, 49152, 2147483647, 1024, 8, 32], "", 0, []], [[], [["FU", 1, [0, 1, 2, 3]], ["SP", 1, 0, 25690112, [64], 1], ["AN", 1, 0, 5], ["AN", 1, 1, 6]]]], "r": [[0.00178973], 0, 3.13699, 1639142199], "v": "v0.6"}
{"i": [["[\"relu_layer\", 128, 256, 28, 28]", "cuda -keys=cuda,gpu -max_num_threads=1024 -thread_warp_size=32", [-1, 16, 64, 49152, 2147483647, 1024, 8, 32], "", 0, []], [[], [["FU", 1, [0, 1, 2, 3]], ["SP", 1, 0, 25690112, [56], 1], ["AN", 1, 0, 5], ["AN", 1, 1, 6]]]], "r": [[0.00209167], 0, 3.23001, 1639142202], "v": "v0.6"}
{"i": [["[\"relu_layer\", 128, 256, 28, 28]", "cuda -keys=cuda,gpu -max_num_threads=1024 -thread_warp_size=32", [-1, 16, 64, 49152, 2147483647, 1024, 8, 32], "", 0, []], [[], [["FU", 1, [0, 1, 2, 3]], ["SP", 1, 0, 25690112, [16], 1], ["AN", 1, 0, 5], ["AN", 1, 1, 6]]]], "r": [[0.00576886], 0, 2.96546, 1639142204], "v": "v0.6"}
{"i": [["[\"relu_layer\", 128, 256, 28, 28]", "cuda -keys=cuda,gpu -max_num_threads=1024 -thread_warp_size=32", [-1, 16, 64, 49152, 2147483647, 1024, 8, 32], "", 0, []], [[], [["FU", 1, [0, 1, 2, 3]], ["SP", 1, 0, 25690112, [1], 1], ["AN", 1, 0, 5], ["AN", 1, 1, 6]]]], "r": [[0.0921194], 0, 3.03778, 1639142207], "v": "v0.6"}
{"i": [["[\"relu_layer\", 128, 256, 28, 28]", "cuda -keys=cuda,gpu -max_num_threads=1024 -thread_warp_size=32", [-1, 16, 64, 49152, 2147483647, 1024, 8, 32], "", 0, []], [[], [["FU", 1, [0, 1, 2, 3]], ["SP", 1, 0, 25690112, [8], 1], ["AN", 1, 0, 5], ["AN", 1, 1, 6]]]], "r": [[0.0113581], 0, 2.69056, 1639142210], "v": "v0.6"}
{"i": [["[\"relu_layer\", 128, 256, 28, 28]", "cuda -keys=cuda,gpu -max_num_threads=1024 -thread_warp_size=32", [-1, 16, 64, 49152, 2147483647, 1024, 8, 32], "", 0, []], [[], [["FU", 1, [0, 1, 2, 3]], ["SP", 1, 0, 25690112, [28], 1], ["AN", 1, 0, 5], ["AN", 1, 1, 6]]]], "r": [[0.00363735], 0, 3.05428, 1639142213], "v": "v0.6"}
{"i": [["[\"relu_layer\", 128, 256, 28, 28]", "cuda -keys=cuda,gpu -max_num_threads=1024 -thread_warp_size=32", [-1, 16, 64, 49152, 2147483647, 1024, 8, 32], "", 0, []], [[], [["FU", 1, [0, 1, 2, 3]], ["SP", 1, 0, 25690112, [2], 1], ["AN", 1, 0, 5], ["AN", 1, 1, 6]]]], "r": [[0.0465517], 0, 2.83948, 1639142216], "v": "v0.6"}
{"i": [["[\"relu_layer\", 128, 256, 28, 28]", "cuda -keys=cuda,gpu -max_num_threads=1024 -thread_warp_size=32", [-1, 16, 64, 49152, 2147483647, 1024, 8, 32], "", 0, []], [[], [["FU", 1, [0, 1, 2, 3]], ["SP", 1, 0, 25690112, [49], 1], ["AN", 1, 0, 5], ["AN", 1, 1, 6]]]], "r": [[0.00239065], 0, 2.57436, 1639142219], "v": "v0.6"}
{"i": [["[\"relu_layer\", 128, 256, 28, 28]", "cuda -keys=cuda,gpu -max_num_threads=1024 -thread_warp_size=32", [-1, 16, 64, 49152, 2147483647, 1024, 8, 32], "", 0, []], [[], [["FU", 1, [0, 1, 2, 3]], ["SP", 1, 0, 25690112, [14], 1], ["AN", 1, 0, 5], ["AN", 1, 1, 6]]]], "r": [[0.00668678], 0, 2.5074, 1639142221], "v": "v0.6"}
{"i": [["[\"relu_layer\", 128, 256, 28, 28]", "cuda -keys=cuda,gpu -max_num_threads=1024 -thread_warp_size=32", [-1, 16, 64, 49152, 2147483647, 1024, 8, 32], "", 0, []], [[], [["FU", 1, [0, 1, 2, 3]], ["SP", 1, 0, 25690112, [4], 1], ["AN", 1, 0, 5], ["AN", 1, 1, 6]]]], "r": [[0.0228198], 0, 2.70265, 1639142224], "v": "v0.6"}
{"i": [["[\"relu_layer\", 128, 256, 28, 28]", "cuda -keys=cuda,gpu -max_num_threads=1024 -thread_warp_size=32", [-1, 16, 64, 49152, 2147483647, 1024, 8, 32], "", 0, []], [[], [["FU", 1, [0, 1, 2, 3]], ["SP", 1, 0, 25690112, [32], 1], ["AN", 1, 0, 5], ["AN", 1, 1, 6]]]], "r": [[0.00310729], 0, 2.49361, 1639142226], "v": "v0.6"}
