artifacts/Table3/tvm/ansor/elementwise/ansor_relu_128_512_14_14.log
{"i": [["[\"relu_layer\", 128, 512, 14, 14]", "cuda -keys=cuda,gpu -max_num_threads=1024 -thread_warp_size=32", [-1, 16, 64, 49152, 2147483647, 1024, 8, 32], "", 0, []], [[], [["FU", 1, [0, 1, 2, 3]], ["SP", 1, 0, 12845056, [7], 1], ["AN", 1, 0, 5], ["AN", 1, 1, 6]]]], "r": [[0.00778388], 0, 1.92508, 1639141278], "v": "v0.6"}
{"i": [["[\"relu_layer\", 128, 512, 14, 14]", "cuda -keys=cuda,gpu -max_num_threads=1024 -thread_warp_size=32", [-1, 16, 64, 49152, 2147483647, 1024, 8, 32], "", 0, []], [[], [["FU", 1, [0, 1, 2, 3]], ["SP", 1, 0, 12845056, [49], 1], ["AN", 1, 0, 5], ["AN", 1, 1, 6]]]], "r": [[0.0011959], 0, 1.91277, 1639141279], "v": "v0.6"}
{"i": [["[\"relu_layer\", 128, 512, 14, 14]", "cuda -keys=cuda,gpu -max_num_threads=1024 -thread_warp_size=32", [-1, 16, 64, 49152, 2147483647, 1024, 8, 32], "", 0, []], [[], [["FU", 1, [0, 1, 2, 3]], ["SP", 1, 0, 12845056, [56], 1], ["AN", 1, 0, 5], ["AN", 1, 1, 6]]]], "r": [[0.00104611], 0, 1.92726, 1639141281], "v": "v0.6"}
{"i": [["[\"relu_layer\", 128, 512, 14, 14]", "cuda -keys=cuda,gpu -max_num_threads=1024 -thread_warp_size=32", [-1, 16, 64, 49152, 2147483647, 1024, 8, 32], "", 0, []], [[], [["FU", 1, [0, 1, 2, 3]], ["SP", 1, 0, 12845056, [32], 1], ["AN", 1, 0, 5], ["AN", 1, 1, 6]]]], "r": [[0.00154972], 0, 1.38549, 1639141282], "v": "v0.6"}
{"i": [["[\"relu_layer\", 128, 512, 14, 14]", "cuda -keys=cuda,gpu -max_num_threads=1024 -thread_warp_size=32", [-1, 16, 64, 49152, 2147483647, 1024, 8, 32], "", 0, []], [[], [["FU", 1, [0, 1, 2, 3]], ["SP", 1, 0, 12845056, [4], 1], ["AN", 1, 0, 5], ["AN", 1, 1, 6]]]], "r": [[0.0113642], 0, 1.44514, 1639141283], "v": "v0.6"}
{"i": [["[\"relu_layer\", 128, 512, 14, 14]", "cuda -keys=cuda,gpu -max_num_threads=1024 -thread_warp_size=32", [-1, 16, 64, 49152, 2147483647, 1024, 8, 32], "", 0, []], [[], [["FU", 1, [0, 1, 2, 3]], ["SP", 1, 0, 12845056, [2], 1], ["AN", 1, 0, 5], ["AN", 1, 1, 6]]]], "r": [[0.0232821], 0, 1.49795, 1639141284], "v": "v0.6"}
{"i": [["[\"relu_layer\", 128, 512, 14, 14]", "cuda -keys=cuda,gpu -max_num_threads=1024 -thread_warp_size=32", [-1, 16, 64, 49152, 2147483647, 1024, 8, 32], "", 0, []], [[], [["FU", 1, [0, 1, 2, 3]], ["SP", 1, 0, 12845056, [14], 1], ["AN", 1, 0, 5], ["AN", 1, 1, 6]]]], "r": [[0.00333662], 0, 1.39002, 1639141285], "v": "v0.6"}
{"i": [["[\"relu_layer\", 128, 512, 14, 14]", "cuda -keys=cuda,gpu -max_num_threads=1024 -thread_warp_size=32", [-1, 16, 64, 49152, 2147483647, 1024, 8, 32], "", 0, []], [[], [["FU", 1, [0, 1, 2, 3]], ["SP", 1, 0, 12845056, [16], 1], ["AN", 1, 0, 5], ["AN", 1, 1, 6]]]], "r": [[0.00287616], 0, 1.43749, 1639141286], "v": "v0.6"}
{"i": [["[\"relu_layer\", 128, 512, 14, 14]", "cuda -keys=cuda,gpu -max_num_threads=1024 -thread_warp_size=32", [-1, 16, 64, 49152, 2147483647, 1024, 8, 32], "", 0, []], [[], [["FU", 1, [0, 1, 2, 3]], ["SP", 1, 0, 12845056, [1], 1], ["AN", 1, 0, 5], ["AN", 1, 1, 6]]]], "r": [[0.0459743], 0, 1.6411, 1639141288], "v": "v0.6"}
{"i": [["[\"relu_layer\", 128, 512, 14, 14]", "cuda -keys=cuda,gpu -max_num_threads=1024 -thread_warp_size=32", [-1, 16, 64, 49152, 2147483647, 1024, 8, 32], "", 0, []], [[], [["FU", 1, [0, 1, 2, 3]], ["SP", 1, 0, 12845056, [8], 1], ["AN", 1, 0, 5], ["AN", 1, 1, 6]]]], "r": [[0.00567363], 0, 1.42429, 1639141289], "v": "v0.6"}
{"i": [["[\"relu_layer\", 128, 512, 14, 14]", "cuda -keys=cuda,gpu -max_num_threads=1024 -thread_warp_size=32", [-1, 16, 64, 49152, 2147483647, 1024, 8, 32], "", 0, []], [[], [["FU", 1, [0, 1, 2, 3]], ["SP", 1, 0, 12845056, [64], 1], ["AN", 1, 0, 5], ["AN", 1, 1, 6]]]], "r": [[0.000895448], 0, 1.8917, 1639141290], "v": "v0.6"}
{"i": [["[\"relu_layer\", 128, 512, 14, 14]", "cuda -keys=cuda,gpu -max_num_threads=1024 -thread_warp_size=32", [-1, 16, 64, 49152, 2147483647, 1024, 8, 32], "", 0, []], [[], [["FU", 1, [0, 1, 2, 3]], ["SP", 1, 0, 12845056, [28], 1], ["AN", 1, 0, 5], ["AN", 1, 1, 6]]]], "r": [[0.00181367], 0, 1.41975, 1639141292], "v": "v0.6"}
