artifacts/Table3/tvm/ansor/elementwise/ansor_relu_128_168_83_83.log
{"i": [["[\"relu_layer\", 128, 168, 83, 83]", "cuda -keys=cuda,gpu -max_num_threads=1024 -thread_warp_size=32", [-1, 16, 64, 49152, 2147483647, 1024, 8, 32], "", 0, []], [[], [["FU", 1, [0, 1, 2, 3]], ["SP", 1, 0, 148141056, [2], 1], ["AN", 1, 0, 5], ["AN", 1, 1, 6]]]], "r": [[0.273819], 0, 8.77625, 1639142511], "v": "v0.6"}
{"i": [["[\"relu_layer\", 128, 168, 83, 83]", "cuda -keys=cuda,gpu -max_num_threads=1024 -thread_warp_size=32", [-1, 16, 64, 49152, 2147483647, 1024, 8, 32], "", 0, []], [[], [["FU", 1, [0, 1, 2, 3]], ["SP", 1, 0, 148141056, [7], 1], ["AN", 1, 0, 5], ["AN", 1, 1, 6]]]], "r": [[0.0753459], 0, 7.71871, 1639142519], "v": "v0.6"}
{"i": [["[\"relu_layer\", 128, 168, 83, 83]", "cuda -keys=cuda,gpu -max_num_threads=1024 -thread_warp_size=32", [-1, 16, 64, 49152, 2147483647, 1024, 8, 32], "", 0, []], [[], [["FU", 1, [0, 1, 2, 3]], ["SP", 1, 0, 148141056, [8], 1], ["AN", 1, 0, 5], ["AN", 1, 1, 6]]]], "r": [[0.065359], 0, 7.77794, 1639142527], "v": "v0.6"}
{"i": [["[\"relu_layer\", 128, 168, 83, 83]", "cuda -keys=cuda,gpu -max_num_threads=1024 -thread_warp_size=32", [-1, 16, 64, 49152, 2147483647, 1024, 8, 32], "", 0, []], [[], [["FU", 1, [0, 1, 2, 3]], ["SP", 1, 0, 148141056, [6], 1], ["AN", 1, 0, 5], ["AN", 1, 1, 6]]]], "r": [[0.088497], 0, 8.5971, 1639142535], "v": "v0.6"}
{"i": [["[\"relu_layer\", 128, 168, 83, 83]", "cuda -keys=cuda,gpu -max_num_threads=1024 -thread_warp_size=32", [-1, 16, 64, 49152, 2147483647, 1024, 8, 32], "", 0, []], [[], [["FU", 1, [0, 1, 2, 3]], ["SP", 1, 0, 148141056, [12], 1], ["AN", 1, 0, 5], ["AN", 1, 1, 6]]]], "r": [[0.0559873], 0, 8.16258, 1639142543], "v": "v0.6"}
{"i": [["[\"relu_layer\", 128, 168, 83, 83]", "cuda -keys=cuda,gpu -max_num_threads=1024 -thread_warp_size=32", [-1, 16, 64, 49152, 2147483647, 1024, 8, 32], "", 0, []], [[], [["FU", 1, [0, 1, 2, 3]], ["SP", 1, 0, 148141056, [24], 1], ["AN", 1, 0, 5], ["AN", 1, 1, 6]]]], "r": [[0.0253312], 0, 7.55605, 1639142551], "v": "v0.6"}
{"i": [["[\"relu_layer\", 128, 168, 83, 83]", "cuda -keys=cuda,gpu -max_num_threads=1024 -thread_warp_size=32", [-1, 16, 64, 49152, 2147483647, 1024, 8, 32], "", 0, []], [[], [["FU", 1, [0, 1, 2, 3]], ["SP", 1, 0, 148141056, [42], 1], ["AN", 1, 0, 5], ["AN", 1, 1, 6]]]], "r": [[0.015737], 0, 7.50589, 1639142558], "v": "v0.6"}
{"i": [["[\"relu_layer\", 128, 168, 83, 83]", "cuda -keys=cuda,gpu -max_num_threads=1024 -thread_warp_size=32", [-1, 16, 64, 49152, 2147483647, 1024, 8, 32], "", 0, []], [[], [["FU", 1, [0, 1, 2, 3]], ["SP", 1, 0, 148141056, [56], 1], ["AN", 1, 0, 5], ["AN", 1, 1, 6]]]], "r": [[0.0119778], 0, 7.97102, 1639142566], "v": "v0.6"}
{"i": [["[\"relu_layer\", 128, 168, 83, 83]", "cuda -keys=cuda,gpu -max_num_threads=1024 -thread_warp_size=32", [-1, 16, 64, 49152, 2147483647, 1024, 8, 32], "", 0, []], [[], [["FU", 1, [0, 1, 2, 3]], ["SP", 1, 0, 148141056, [1], 1], ["AN", 1, 0, 5], ["AN", 1, 1, 6]]]], "r": [[0.531869], 0, 9.75017, 1639142576], "v": "v0.6"}
{"i": [["[\"relu_layer\", 128, 168, 83, 83]", "cuda -keys=cuda,gpu -max_num_threads=1024 -thread_warp_size=32", [-1, 16, 64, 49152, 2147483647, 1024, 8, 32], "", 0, []], [[], [["FU", 1, [0, 1, 2, 3]], ["SP", 1, 0, 148141056, [48], 1], ["AN", 1, 0, 5], ["AN", 1, 1, 6]]]], "r": [[0.0138198], 0, 8.0403, 1639142584], "v": "v0.6"}
{"i": [["[\"relu_layer\", 128, 168, 83, 83]", "cuda -keys=cuda,gpu -max_num_threads=1024 -thread_warp_size=32", [-1, 16, 64, 49152, 2147483647, 1024, 8, 32], "", 0, []], [[], [["FU", 1, [0, 1, 2, 3]], ["SP", 1, 0, 148141056, [32], 1], ["AN", 1, 0, 5], ["AN", 1, 1, 6]]]], "r": [[0.0177267], 0, 8.44925, 1639142593], "v": "v0.6"}
{"i": [["[\"relu_layer\", 128, 168, 83, 83]", "cuda -keys=cuda,gpu -max_num_threads=1024 -thread_warp_size=32", [-1, 16, 64, 49152, 2147483647, 1024, 8, 32], "", 0, []], [[], [["FU", 1, [0, 1, 2, 3]], ["SP", 1, 0, 148141056, [64], 1], ["AN", 1, 0, 5], ["AN", 1, 1, 6]]]], "r": [[0.010251], 0, 8.43759, 1639142601], "v": "v0.6"}
{"i": [["[\"relu_layer\", 128, 168, 83, 83]", "cuda -keys=cuda,gpu -max_num_threads=1024 -thread_warp_size=32", [-1, 16, 64, 49152, 2147483647, 1024, 8, 32], "", 0, []], [[], [["FU", 1, [0, 1, 2, 3]], ["SP", 1, 0, 148141056, [4], 1], ["AN", 1, 0, 5], ["AN", 1, 1, 6]]]], "r": [[0.131218], 0, 8.40939, 1639142609], "v": "v0.6"}
{"i": [["[\"relu_layer\", 128, 168, 83, 83]", "cuda -keys=cuda,gpu -max_num_threads=1024 -thread_warp_size=32", [-1, 16, 64, 49152, 2147483647, 1024, 8, 32], "", 0, []], [[], [["FU", 1, [0, 1, 2, 3]], ["SP", 1, 0, 148141056, [14], 1], ["AN", 1, 0, 5], ["AN", 1, 1, 6]]]], "r": [[0.0384856], 0, 7.57406, 1639142616], "v": "v0.6"}
{"i": [["[\"relu_layer\", 128, 168, 83, 83]", "cuda -keys=cuda,gpu -max_num_threads=1024 -thread_warp_size=32", [-1, 16, 64, 49152, 2147483647, 1024, 8, 32], "", 0, []], [[], [["FU", 1, [0, 1, 2, 3]], ["SP", 1, 0, 148141056, [3], 1], ["AN", 1, 0, 5], ["AN", 1, 1, 6]]]], "r": [[0.177879], 0, 8.56012, 1639142625], "v": "v0.6"}
{"i": [["[\"relu_layer\", 128, 168, 83, 83]", "cuda -keys=cuda,gpu -max_num_threads=1024 -thread_warp_size=32", [-1, 16, 64, 49152, 2147483647, 1024, 8, 32], "", 0, []], [[], [["FU", 1, [0, 1, 2, 3]], ["SP", 1, 0, 148141056, [16], 1], ["AN", 1, 0, 5], ["AN", 1, 1, 6]]]], "r": [[0.0331686], 0, 8.14815, 1639142633], "v": "v0.6"}
{"i": [["[\"relu_layer\", 128, 168, 83, 83]", "cuda -keys=cuda,gpu -max_num_threads=1024 -thread_warp_size=32", [-1, 16, 64, 49152, 2147483647, 1024, 8, 32], "", 0, []], [[], [["FU", 1, [0, 1, 2, 3]], ["SP", 1, 0, 148141056, [28], 1], ["AN", 1, 0, 5], ["AN", 1, 1, 6]]]], "r": [[0.0232192], 0, 7.54053, 1639142640], "v": "v0.6"}
{"i": [["[\"relu_layer\", 128, 168, 83, 83]", "cuda -keys=cuda,gpu -max_num_threads=1024 -thread_warp_size=32", [-1, 16, 64, 49152, 2147483647, 1024, 8, 32], "", 0, []], [[], [["FU", 1, [0, 1, 2, 3]], ["SP", 1, 0, 148141056, [21], 1], ["AN", 1, 0, 5], ["AN", 1, 1, 6]]]], "r": [[0.0267924], 0, 8.0638, 1639142648], "v": "v0.6"}
