artifacts/Table3/tvm/ansor/elementwise/ansor_relu_128_336_21_21.log
{"i": [["[\"relu_layer\", 128, 336, 21, 21]", "cuda -keys=cuda,gpu -max_num_threads=1024 -thread_warp_size=32", [-1, 16, 64, 49152, 2147483647, 1024, 8, 32], "", 0, []], [[], [["FU", 1, [0, 1, 2, 3]], ["SP", 1, 0, 18966528, [2], 1], ["AN", 1, 0, 5], ["AN", 1, 1, 6]]]], "r": [[0.0347645], 0, 2.21121, 1639142821], "v": "v0.6"}
{"i": [["[\"relu_layer\", 128, 336, 21, 21]", "cuda -keys=cuda,gpu -max_num_threads=1024 -thread_warp_size=32", [-1, 16, 64, 49152, 2147483647, 1024, 8, 32], "", 0, []], [[], [["FU", 1, [0, 1, 2, 3]], ["SP", 1, 0, 18966528, [18], 1], ["AN", 1, 0, 5], ["AN", 1, 1, 6]]]], "r": [[0.00394167], 0, 2.99052, 1639142823], "v": "v0.6"}
{"i": [["[\"relu_layer\", 128, 336, 21, 21]", "cuda -keys=cuda,gpu -max_num_threads=1024 -thread_warp_size=32", [-1, 16, 64, 49152, 2147483647, 1024, 8, 32], "", 0, []], [[], [["FU", 1, [0, 1, 2, 3]], ["SP", 1, 0, 18966528, [8], 1], ["AN", 1, 0, 5], ["AN", 1, 1, 6]]]], "r": [[0.00842284], 0, 2.48755, 1639142826], "v": "v0.6"}
{"i": [["[\"relu_layer\", 128, 336, 21, 21]", "cuda -keys=cuda,gpu -max_num_threads=1024 -thread_warp_size=32", [-1, 16, 64, 49152, 2147483647, 1024, 8, 32], "", 0, []], [[], [["FU", 1, [0, 1, 2, 3]], ["SP", 1, 0, 18966528, [32], 1], ["AN", 1, 0, 5], ["AN", 1, 1, 6]]]], "r": [[0.00227569], 0, 2.38616, 1639142828], "v": "v0.6"}
{"i": [["[\"relu_layer\", 128, 336, 21, 21]", "cuda -keys=cuda,gpu -max_num_threads=1024 -thread_warp_size=32", [-1, 16, 64, 49152, 2147483647, 1024, 8, 32], "", 0, []], [[], [["FU", 1, [0, 1, 2, 3]], ["SP", 1, 0, 18966528, [56], 1], ["AN", 1, 0, 5], ["AN", 1, 1, 6]]]], "r": [[0.00154217], 0, 2.98961, 1639142830], "v": "v0.6"}
{"i": [["[\"relu_layer\", 128, 336, 21, 21]", "cuda -keys=cuda,gpu -max_num_threads=1024 -thread_warp_size=32", [-1, 16, 64, 49152, 2147483647, 1024, 8, 32], "", 0, []], [[], [["FU", 1, [0, 1, 2, 3]], ["SP", 1, 0, 18966528, [36], 1], ["AN", 1, 0, 5], ["AN", 1, 1, 6]]]], "r": [[0.00226606], 0, 2.57264, 1639142833], "v": "v0.6"}
{"i": [["[\"relu_layer\", 128, 336, 21, 21]", "cuda -keys=cuda,gpu -max_num_threads=1024 -thread_warp_size=32", [-1, 16, 64, 49152, 2147483647, 1024, 8, 32], "", 0, []], [[], [["FU", 1, [0, 1, 2, 3]], ["SP", 1, 0, 18966528, [63], 1], ["AN", 1, 0, 5], ["AN", 1, 1, 6]]]], "r": [[0.0013715], 0, 2.60202, 1639142835], "v": "v0.6"}
{"i": [["[\"relu_layer\", 128, 336, 21, 21]", "cuda -keys=cuda,gpu -max_num_threads=1024 -thread_warp_size=32", [-1, 16, 64, 49152, 2147483647, 1024, 8, 32], "", 0, []], [[], [["FU", 1, [0, 1, 2, 3]], ["SP", 1, 0, 18966528, [64], 1], ["AN", 1, 0, 5], ["AN", 1, 1, 6]]]], "r": [[0.00131789], 0, 3.0423, 1639142837], "v": "v0.6"}
{"i": [["[\"relu_layer\", 128, 336, 21, 21]", "cuda -keys=cuda,gpu -max_num_threads=1024 -thread_warp_size=32", [-1, 16, 64, 49152, 2147483647, 1024, 8, 32], "", 0, []], [[], [["FU", 1, [0, 1, 2, 3]], ["SP", 1, 0, 18966528, [49], 1], ["AN", 1, 0, 5], ["AN", 1, 1, 6]]]], "r": [[0.00176257], 0, 2.97338, 1639142840], "v": "v0.6"}
{"i": [["[\"relu_layer\", 128, 336, 21, 21]", "cuda -keys=cuda,gpu -max_num_threads=1024 -thread_warp_size=32", [-1, 16, 64, 49152, 2147483647, 1024, 8, 32], "", 0, []], [[], [["FU", 1, [0, 1, 2, 3]], ["SP", 1, 0, 18966528, [48], 1], ["AN", 1, 0, 5], ["AN", 1, 1, 6]]]], "r": [[0.00177899], 0, 2.4858, 1639142843], "v": "v0.6"}
{"i": [["[\"relu_layer\", 128, 336, 21, 21]", "cuda -keys=cuda,gpu -max_num_threads=1024 -thread_warp_size=32", [-1, 16, 64, 49152, 2147483647, 1024, 8, 32], "", 0, []], [[], [["FU", 1, [0, 1, 2, 3]], ["SP", 1, 0, 18966528, [7], 1], ["AN", 1, 0, 5], ["AN", 1, 1, 6]]]], "r": [[0.00970244], 0, 2.59631, 1639142845], "v": "v0.6"}
{"i": [["[\"relu_layer\", 128, 336, 21, 21]", "cuda -keys=cuda,gpu -max_num_threads=1024 -thread_warp_size=32", [-1, 16, 64, 49152, 2147483647, 1024, 8, 32], "", 0, []], [[], [["FU", 1, [0, 1, 2, 3]], ["SP", 1, 0, 18966528, [28], 1], ["AN", 1, 0, 5], ["AN", 1, 1, 6]]]], "r": [[0.0026673], 0, 2.53301, 1639142847], "v": "v0.6"}
{"i": [["[\"relu_layer\", 128, 336, 21, 21]", "cuda -keys=cuda,gpu -max_num_threads=1024 -thread_warp_size=32", [-1, 16, 64, 49152, 2147483647, 1024, 8, 32], "", 0, []], [[], [["FU", 1, [0, 1, 2, 3]], ["SP", 1, 0, 18966528, [9], 1], ["AN", 1, 0, 5], ["AN", 1, 1, 6]]]], "r": [[0.00759826], 0, 2.45573, 1639142849], "v": "v0.6"}
{"i": [["[\"relu_layer\", 128, 336, 21, 21]", "cuda -keys=cuda,gpu -max_num_threads=1024 -thread_warp_size=32", [-1, 16, 64, 49152, 2147483647, 1024, 8, 32], "", 0, []], [[], [["FU", 1, [0, 1, 2, 3]], ["SP", 1, 0, 18966528, [4], 1], ["AN", 1, 0, 5], ["AN", 1, 1, 6]]]], "r": [[0.0168862], 0, 2.58046, 1639142851], "v": "v0.6"}
{"i": [["[\"relu_layer\", 128, 336, 21, 21]", "cuda -keys=cuda,gpu -max_num_threads=1024 -thread_warp_size=32", [-1, 16, 64, 49152, 2147483647, 1024, 8, 32], "", 0, []], [[], [["FU", 1, [0, 1, 2, 3]], ["SP", 1, 0, 18966528, [54], 1], ["AN", 1, 0, 5], ["AN", 1, 1, 6]]]], "r": [[0.00160216], 0, 2.85794, 1639142854], "v": "v0.6"}
{"i": [["[\"relu_layer\", 128, 336, 21, 21]", "cuda -keys=cuda,gpu -max_num_threads=1024 -thread_warp_size=32", [-1, 16, 64, 49152, 2147483647, 1024, 8, 32], "", 0, []], [[], [["FU", 1, [0, 1, 2, 3]], ["SP", 1, 0, 18966528, [42], 1], ["AN", 1, 0, 5], ["AN", 1, 1, 6]]]], "r": [[0.00202642], 0, 2.97895, 1639142856], "v": "v0.6"}
{"i": [["[\"relu_layer\", 128, 336, 21, 21]", "cuda -keys=cuda,gpu -max_num_threads=1024 -thread_warp_size=32", [-1, 16, 64, 49152, 2147483647, 1024, 8, 32], "", 0, []], [[], [["FU", 1, [0, 1, 2, 3]], ["SP", 1, 0, 18966528, [14], 1], ["AN", 1, 0, 5], ["AN", 1, 1, 6]]]], "r": [[0.00495369], 0, 2.50783, 1639142859], "v": "v0.6"}
{"i": [["[\"relu_layer\", 128, 336, 21, 21]", "cuda -keys=cuda,gpu -max_num_threads=1024 -thread_warp_size=32", [-1, 16, 64, 49152, 2147483647, 1024, 8, 32], "", 0, []], [[], [["FU", 1, [0, 1, 2, 3]], ["SP", 1, 0, 18966528, [3], 1], ["AN", 1, 0, 5], ["AN", 1, 1, 6]]]], "r": [[0.0228529], 0, 2.61997, 1639142861], "v": "v0.6"}
{"i": [["[\"relu_layer\", 128, 336, 21, 21]", "cuda -keys=cuda,gpu -max_num_threads=1024 -thread_warp_size=32", [-1, 16, 64, 49152, 2147483647, 1024, 8, 32], "", 0, []], [[], [["FU", 1, [0, 1, 2, 3]], ["SP", 1, 0, 18966528, [1], 1], ["AN", 1, 0, 5], ["AN", 1, 1, 6]]]], "r": [[0.0679633], 0, 2.76518, 1639142863], "v": "v0.6"}
{"i": [["[\"relu_layer\", 128, 336, 21, 21]", "cuda -keys=cuda,gpu -max_num_threads=1024 -thread_warp_size=32", [-1, 16, 64, 49152, 2147483647, 1024, 8, 32], "", 0, []], [[], [["FU", 1, [0, 1, 2, 3]], ["SP", 1, 0, 18966528, [16], 1], ["AN", 1, 0, 5], ["AN", 1, 1, 6]]]], "r": [[0.00426815], 0, 2.513, 1639142866], "v": "v0.6"}
{"i": [["[\"relu_layer\", 128, 336, 21, 21]", "cuda -keys=cuda,gpu -max_num_threads=1024 -thread_warp_size=32", [-1, 16, 64, 49152, 2147483647, 1024, 8, 32], "", 0, []], [[], [["FU", 1, [0, 1, 2, 3]], ["SP", 1, 0, 18966528, [6], 1], ["AN", 1, 0, 5], ["AN", 1, 1, 6]]]], "r": [[0.0113526], 0, 2.47926, 1639142868], "v": "v0.6"}
{"i": [["[\"relu_layer\", 128, 336, 21, 21]", "cuda -keys=cuda,gpu -max_num_threads=1024 -thread_warp_size=32", [-1, 16, 64, 49152, 2147483647, 1024, 8, 32], "", 0, []], [[], [["FU", 1, [0, 1, 2, 3]], ["SP", 1, 0, 18966528, [12], 1], ["AN", 1, 0, 5], ["AN", 1, 1, 6]]]], "r": [[0.00571508], 0, 2.49086, 1639142870], "v": "v0.6"}
{"i": [["[\"relu_layer\", 128, 336, 21, 21]", "cuda -keys=cuda,gpu -max_num_threads=1024 -thread_warp_size=32", [-1, 16, 64, 49152, 2147483647, 1024, 8, 32], "", 0, []], [[], [["FU", 1, [0, 1, 2, 3]], ["SP", 1, 0, 18966528, [24], 1], ["AN", 1, 0, 5], ["AN", 1, 1, 6]]]], "r": [[0.00300852], 0, 2.42415, 1639142872], "v": "v0.6"}
{"i": [["[\"relu_layer\", 128, 336, 21, 21]", "cuda -keys=cuda,gpu -max_num_threads=1024 -thread_warp_size=32", [-1, 16, 64, 49152, 2147483647, 1024, 8, 32], "", 0, []], [[], [["FU", 1, [0, 1, 2, 3]], ["SP", 1, 0, 18966528, [27], 1], ["AN", 1, 0, 5], ["AN", 1, 1, 6]]]], "r": [[0.00276705], 0, 2.44968, 1639142874], "v": "v0.6"}
{"i": [["[\"relu_layer\", 128, 336, 21, 21]", "cuda -keys=cuda,gpu -max_num_threads=1024 -thread_warp_size=32", [-1, 16, 64, 49152, 2147483647, 1024, 8, 32], "", 0, []], [[], [["FU", 1, [0, 1, 2, 3]], ["SP", 1, 0, 18966528, [21], 1], ["AN", 1, 0, 5], ["AN", 1, 1, 6]]]], "r": [[0.00343492], 0, 2.37378, 1639142877], "v": "v0.6"}
