artifacts/Table3/tvm/ansor/elementwise/ansor_relu_128_4032_11_11.log
{"i": [["[\"relu_layer\", 128, 4032, 11, 11]", "cuda -keys=cuda,gpu -max_num_threads=1024 -thread_warp_size=32", [-1, 16, 64, 49152, 2147483647, 1024, 8, 32], "", 0, []], [[], [["FU", 1, [0, 1, 2, 3]], ["SP", 1, 0, 62447616, [24], 1], ["AN", 1, 0, 5], ["AN", 1, 1, 6]]]], "r": [[0.0114644], 0, 4.54522, 1639142900], "v": "v0.6"}
{"i": [["[\"relu_layer\", 128, 4032, 11, 11]", "cuda -keys=cuda,gpu -max_num_threads=1024 -thread_warp_size=32", [-1, 16, 64, 49152, 2147483647, 1024, 8, 32], "", 0, []], [[], [["FU", 1, [0, 1, 2, 3]], ["SP", 1, 0, 62447616, [64], 1], ["AN", 1, 0, 5], ["AN", 1, 1, 6]]]], "r": [[0.00435155], 0, 4.09441, 1639142904], "v": "v0.6"}
{"i": [["[\"relu_layer\", 128, 4032, 11, 11]", "cuda -keys=cuda,gpu -max_num_threads=1024 -thread_warp_size=32", [-1, 16, 64, 49152, 2147483647, 1024, 8, 32], "", 0, []], [[], [["FU", 1, [0, 1, 2, 3]], ["SP", 1, 0, 62447616, [6], 1], ["AN", 1, 0, 5], ["AN", 1, 1, 6]]]], "r": [[0.0372731], 0, 4.33922, 1639142908], "v": "v0.6"}
{"i": [["[\"relu_layer\", 128, 4032, 11, 11]", "cuda -keys=cuda,gpu -max_num_threads=1024 -thread_warp_size=32", [-1, 16, 64, 49152, 2147483647, 1024, 8, 32], "", 0, []], [[], [["FU", 1, [0, 1, 2, 3]], ["SP", 1, 0, 62447616, [21], 1], ["AN", 1, 0, 5], ["AN", 1, 1, 6]]]], "r": [[0.0113472], 0, 4.1792, 1639142912], "v": "v0.6"}
{"i": [["[\"relu_layer\", 128, 4032, 11, 11]", "cuda -keys=cuda,gpu -max_num_threads=1024 -thread_warp_size=32", [-1, 16, 64, 49152, 2147483647, 1024, 8, 32], "", 0, []], [[], [["FU", 1, [0, 1, 2, 3]], ["SP", 1, 0, 62447616, [7], 1], ["AN", 1, 0, 5], ["AN", 1, 1, 6]]]], "r": [[0.0318283], 0, 4.30839, 1639142916], "v": "v0.6"}
{"i": [["[\"relu_layer\", 128, 4032, 11, 11]", "cuda -keys=cuda,gpu -max_num_threads=1024 -thread_warp_size=32", [-1, 16, 64, 49152, 2147483647, 1024, 8, 32], "", 0, []], [[], [["FU", 1, [0, 1, 2, 3]], ["SP", 1, 0, 62447616, [1], 1], ["AN", 1, 0, 5], ["AN", 1, 1, 6]]]], "r": [[0.223825], 0, 5.03775, 1639142921], "v": "v0.6"}
{"i": [["[\"relu_layer\", 128, 4032, 11, 11]", "cuda -keys=cuda,gpu -max_num_threads=1024 -thread_warp_size=32", [-1, 16, 64, 49152, 2147483647, 1024, 8, 32], "", 0, []], [[], [["FU", 1, [0, 1, 2, 3]], ["SP", 1, 0, 62447616, [56], 1], ["AN", 1, 0, 5], ["AN", 1, 1, 6]]]], "r": [[0.00507706], 0, 4.12311, 1639142926], "v": "v0.6"}
{"i": [["[\"relu_layer\", 128, 4032, 11, 11]", "cuda -keys=cuda,gpu -max_num_threads=1024 -thread_warp_size=32", [-1, 16, 64, 49152, 2147483647, 1024, 8, 32], "", 0, []], [[], [["FU", 1, [0, 1, 2, 3]], ["SP", 1, 0, 62447616, [44], 1], ["AN", 1, 0, 5], ["AN", 1, 1, 6]]]], "r": [[0.00668937], 0, 4.61288, 1639142930], "v": "v0.6"}
{"i": [["[\"relu_layer\", 128, 4032, 11, 11]", "cuda -keys=cuda,gpu -max_num_threads=1024 -thread_warp_size=32", [-1, 16, 64, 49152, 2147483647, 1024, 8, 32], "", 0, []], [[], [["FU", 1, [0, 1, 2, 3]], ["SP", 1, 0, 62447616, [28], 1], ["AN", 1, 0, 5], ["AN", 1, 1, 6]]]], "r": [[0.00881653], 0, 4.64443, 1639142935], "v": "v0.6"}
{"i": [["[\"relu_layer\", 128, 4032, 11, 11]", "cuda -keys=cuda,gpu -max_num_threads=1024 -thread_warp_size=32", [-1, 16, 64, 49152, 2147483647, 1024, 8, 32], "", 0, []], [[], [["FU", 1, [0, 1, 2, 3]], ["SP", 1, 0, 62447616, [22], 1], ["AN", 1, 0, 5], ["AN", 1, 1, 6]]]], "r": [[0.0108665], 0, 4.23756, 1639142939], "v": "v0.6"}
{"i": [["[\"relu_layer\", 128, 4032, 11, 11]", "cuda -keys=cuda,gpu -max_num_threads=1024 -thread_warp_size=32", [-1, 16, 64, 49152, 2147483647, 1024, 8, 32], "", 0, []], [[], [["FU", 1, [0, 1, 2, 3]], ["SP", 1, 0, 62447616, [8], 1], ["AN", 1, 0, 5], ["AN", 1, 1, 6]]]], "r": [[0.0276201], 0, 4.49864, 1639142943], "v": "v0.6"}
{"i": [["[\"relu_layer\", 128, 4032, 11, 11]", "cuda -keys=cuda,gpu -max_num_threads=1024 -thread_warp_size=32", [-1, 16, 64, 49152, 2147483647, 1024, 8, 32], "", 0, []], [[], [["FU", 1, [0, 1, 2, 3]], ["SP", 1, 0, 62447616, [16], 1], ["AN", 1, 0, 5], ["AN", 1, 1, 6]]]], "r": [[0.0140663], 0, 4.14903, 1639142947], "v": "v0.6"}
{"i": [["[\"relu_layer\", 128, 4032, 11, 11]", "cuda -keys=cuda,gpu -max_num_threads=1024 -thread_warp_size=32", [-1, 16, 64, 49152, 2147483647, 1024, 8, 32], "", 0, []], [[], [["FU", 1, [0, 1, 2, 3]], ["SP", 1, 0, 62447616, [14], 1], ["AN", 1, 0, 5], ["AN", 1, 1, 6]]]], "r": [[0.016301], 0, 4.33741, 1639142952], "v": "v0.6"}
{"i": [["[\"relu_layer\", 128, 4032, 11, 11]", "cuda -keys=cuda,gpu -max_num_threads=1024 -thread_warp_size=32", [-1, 16, 64, 49152, 2147483647, 1024, 8, 32], "", 0, []], [[], [["FU", 1, [0, 1, 2, 3]], ["SP", 1, 0, 62447616, [3], 1], ["AN", 1, 0, 5], ["AN", 1, 1, 6]]]], "r": [[0.0749002], 0, 4.51192, 1639142956], "v": "v0.6"}
{"i": [["[\"relu_layer\", 128, 4032, 11, 11]", "cuda -keys=cuda,gpu -max_num_threads=1024 -thread_warp_size=32", [-1, 16, 64, 49152, 2147483647, 1024, 8, 32], "", 0, []], [[], [["FU", 1, [0, 1, 2, 3]], ["SP", 1, 0, 62447616, [63], 1], ["AN", 1, 0, 5], ["AN", 1, 1, 6]]]], "r": [[0.00450456], 0, 4.03887, 1639142960], "v": "v0.6"}
{"i": [["[\"relu_layer\", 128, 4032, 11, 11]", "cuda -keys=cuda,gpu -max_num_threads=1024 -thread_warp_size=32", [-1, 16, 64, 49152, 2147483647, 1024, 8, 32], "", 0, []], [[], [["FU", 1, [0, 1, 2, 3]], ["SP", 1, 0, 62447616, [48], 1], ["AN", 1, 0, 5], ["AN", 1, 1, 6]]]], "r": [[0.00584868], 0, 4.17497, 1639142964], "v": "v0.6"}
{"i": [["[\"relu_layer\", 128, 4032, 11, 11]", "cuda -keys=cuda,gpu -max_num_threads=1024 -thread_warp_size=32", [-1, 16, 64, 49152, 2147483647, 1024, 8, 32], "", 0, []], [[], [["FU", 1, [0, 1, 2, 3]], ["SP", 1, 0, 62447616, [12], 1], ["AN", 1, 0, 5], ["AN", 1, 1, 6]]]], "r": [[0.0187609], 0, 4.97404, 1639142968], "v": "v0.6"}
{"i": [["[\"relu_layer\", 128, 4032, 11, 11]", "cuda -keys=cuda,gpu -max_num_threads=1024 -thread_warp_size=32", [-1, 16, 64, 49152, 2147483647, 1024, 8, 32], "", 0, []], [[], [["FU", 1, [0, 1, 2, 3]], ["SP", 1, 0, 62447616, [18], 1], ["AN", 1, 0, 5], ["AN", 1, 1, 6]]]], "r": [[0.0130152], 0, 4.07201, 1639142973], "v": "v0.6"}
{"i": [["[\"relu_layer\", 128, 4032, 11, 11]", "cuda -keys=cuda,gpu -max_num_threads=1024 -thread_warp_size=32", [-1, 16, 64, 49152, 2147483647, 1024, 8, 32], "", 0, []], [[], [["FU", 1, [0, 1, 2, 3]], ["SP", 1, 0, 62447616, [36], 1], ["AN", 1, 0, 5], ["AN", 1, 1, 6]]]], "r": [[0.00746475], 0, 4.11396, 1639142977], "v": "v0.6"}
{"i": [["[\"relu_layer\", 128, 4032, 11, 11]", "cuda -keys=cuda,gpu -max_num_threads=1024 -thread_warp_size=32", [-1, 16, 64, 49152, 2147483647, 1024, 8, 32], "", 0, []], [[], [["FU", 1, [0, 1, 2, 3]], ["SP", 1, 0, 62447616, [2], 1], ["AN", 1, 0, 5], ["AN", 1, 1, 6]]]], "r": [[0.135807], 0, 5.1877, 1639142982], "v": "v0.6"}
{"i": [["[\"relu_layer\", 128, 4032, 11, 11]", "cuda -keys=cuda,gpu -max_num_threads=1024 -thread_warp_size=32", [-1, 16, 64, 49152, 2147483647, 1024, 8, 32], "", 0, []], [[], [["FU", 1, [0, 1, 2, 3]], ["SP", 1, 0, 62447616, [42], 1], ["AN", 1, 0, 5], ["AN", 1, 1, 6]]]], "r": [[0.00671572], 0, 4.27988, 1639142986], "v": "v0.6"}
{"i": [["[\"relu_layer\", 128, 4032, 11, 11]", "cuda -keys=cuda,gpu -max_num_threads=1024 -thread_warp_size=32", [-1, 16, 64, 49152, 2147483647, 1024, 8, 32], "", 0, []], [[], [["FU", 1, [0, 1, 2, 3]], ["SP", 1, 0, 62447616, [9], 1], ["AN", 1, 0, 5], ["AN", 1, 1, 6]]]], "r": [[0.0248928], 0, 4.87911, 1639142991], "v": "v0.6"}
{"i": [["[\"relu_layer\", 128, 4032, 11, 11]", "cuda -keys=cuda,gpu -max_num_threads=1024 -thread_warp_size=32", [-1, 16, 64, 49152, 2147483647, 1024, 8, 32], "", 0, []], [[], [["FU", 1, [0, 1, 2, 3]], ["SP", 1, 0, 62447616, [33], 1], ["AN", 1, 0, 5], ["AN", 1, 1, 6]]]], "r": [[0.00807997], 0, 4.06731, 1639142995], "v": "v0.6"}
{"i": [["[\"relu_layer\", 128, 4032, 11, 11]", "cuda -keys=cuda,gpu -max_num_threads=1024 -thread_warp_size=32", [-1, 16, 64, 49152, 2147483647, 1024, 8, 32], "", 0, []], [[], [["FU", 1, [0, 1, 2, 3]], ["SP", 1, 0, 62447616, [32], 1], ["AN", 1, 0, 5], ["AN", 1, 1, 6]]]], "r": [[0.00752055], 0, 4.24499, 1639142999], "v": "v0.6"}
{"i": [["[\"relu_layer\", 128, 4032, 11, 11]", "cuda -keys=cuda,gpu -max_num_threads=1024 -thread_warp_size=32", [-1, 16, 64, 49152, 2147483647, 1024, 8, 32], "", 0, []], [[], [["FU", 1, [0, 1, 2, 3]], ["SP", 1, 0, 62447616, [4], 1], ["AN", 1, 0, 5], ["AN", 1, 1, 6]]]], "r": [[0.0554683], 0, 5.04315, 1639143004], "v": "v0.6"}
{"i": [["[\"relu_layer\", 128, 4032, 11, 11]", "cuda -keys=cuda,gpu -max_num_threads=1024 -thread_warp_size=32", [-1, 16, 64, 49152, 2147483647, 1024, 8, 32], "", 0, []], [[], [["FU", 1, [0, 1, 2, 3]], ["SP", 1, 0, 62447616, [11], 1], ["AN", 1, 0, 5], ["AN", 1, 1, 6]]]], "r": [[0.0204943], 0, 4.07406, 1639143008], "v": "v0.6"}
