artifacts/Table3/tvm/ansor/elementwise/ansor_relu_128_42_165_165.log
{"i": [["[\"relu_layer\", 128, 42, 165, 165]", "cuda -keys=cuda,gpu -max_num_threads=1024 -thread_warp_size=32", [-1, 16, 64, 49152, 2147483647, 1024, 8, 32], "", 0, []], [[], [["FU", 1, [0, 1, 2, 3]], ["SP", 1, 0, 146361600, [33], 1], ["AN", 1, 0, 5], ["AN", 1, 1, 6]]]], "r": [[0.0190333], 0, 7.50373, 1639143372], "v": "v0.6"}
{"i": [["[\"relu_layer\", 128, 42, 165, 165]", "cuda -keys=cuda,gpu -max_num_threads=1024 -thread_warp_size=32", [-1, 16, 64, 49152, 2147483647, 1024, 8, 32], "", 0, []], [[], [["FU", 1, [0, 1, 2, 3]], ["SP", 1, 0, 146361600, [48], 1], ["AN", 1, 0, 5], ["AN", 1, 1, 6]]]], "r": [[0.0136664], 0, 7.58146, 1639143380], "v": "v0.6"}
{"i": [["[\"relu_layer\", 128, 42, 165, 165]", "cuda -keys=cuda,gpu -max_num_threads=1024 -thread_warp_size=32", [-1, 16, 64, 49152, 2147483647, 1024, 8, 32], "", 0, []], [[], [["FU", 1, [0, 1, 2, 3]], ["SP", 1, 0, 146361600, [28], 1], ["AN", 1, 0, 5], ["AN", 1, 1, 6]]]], "r": [[0.0205716], 0, 8.17671, 1639143388], "v": "v0.6"}
{"i": [["[\"relu_layer\", 128, 42, 165, 165]", "cuda -keys=cuda,gpu -max_num_threads=1024 -thread_warp_size=32", [-1, 16, 64, 49152, 2147483647, 1024, 8, 32], "", 0, []], [[], [["FU", 1, [0, 1, 2, 3]], ["SP", 1, 0, 146361600, [21], 1], ["AN", 1, 0, 5], ["AN", 1, 1, 6]]]], "r": [[0.0291781], 0, 8.58669, 1639143396], "v": "v0.6"}
{"i": [["[\"relu_layer\", 128, 42, 165, 165]", "cuda -keys=cuda,gpu -max_num_threads=1024 -thread_warp_size=32", [-1, 16, 64, 49152, 2147483647, 1024, 8, 32], "", 0, []], [[], [["FU", 1, [0, 1, 2, 3]], ["SP", 1, 0, 146361600, [35], 1], ["AN", 1, 0, 5], ["AN", 1, 1, 6]]]], "r": [[0.0179975], 0, 7.52273, 1639143404], "v": "v0.6"}
{"i": [["[\"relu_layer\", 128, 42, 165, 165]", "cuda -keys=cuda,gpu -max_num_threads=1024 -thread_warp_size=32", [-1, 16, 64, 49152, 2147483647, 1024, 8, 32], "", 0, []], [[], [["FU", 1, [0, 1, 2, 3]], ["SP", 1, 0, 146361600, [32], 1], ["AN", 1, 0, 5], ["AN", 1, 1, 6]]]], "r": [[0.0175126], 0, 8.13032, 1639143412], "v": "v0.6"}
{"i": [["[\"relu_layer\", 128, 42, 165, 165]", "cuda -keys=cuda,gpu -max_num_threads=1024 -thread_warp_size=32", [-1, 16, 64, 49152, 2147483647, 1024, 8, 32], "", 0, []], [[], [["FU", 1, [0, 1, 2, 3]], ["SP", 1, 0, 146361600, [3], 1], ["AN", 1, 0, 5], ["AN", 1, 1, 6]]]], "r": [[0.175783], 0, 8.42366, 1639143420], "v": "v0.6"}
{"i": [["[\"relu_layer\", 128, 42, 165, 165]", "cuda -keys=cuda,gpu -max_num_threads=1024 -thread_warp_size=32", [-1, 16, 64, 49152, 2147483647, 1024, 8, 32], "", 0, []], [[], [["FU", 1, [0, 1, 2, 3]], ["SP", 1, 0, 146361600, [1], 1], ["AN", 1, 0, 5], ["AN", 1, 1, 6]]]], "r": [[0.525458], 0, 9.78279, 1639143430], "v": "v0.6"}
{"i": [["[\"relu_layer\", 128, 42, 165, 165]", "cuda -keys=cuda,gpu -max_num_threads=1024 -thread_warp_size=32", [-1, 16, 64, 49152, 2147483647, 1024, 8, 32], "", 0, []], [[], [["FU", 1, [0, 1, 2, 3]], ["SP", 1, 0, 146361600, [12], 1], ["AN", 1, 0, 5], ["AN", 1, 1, 6]]]], "r": [[0.0438806], 0, 8.41574, 1639143438], "v": "v0.6"}
{"i": [["[\"relu_layer\", 128, 42, 165, 165]", "cuda -keys=cuda,gpu -max_num_threads=1024 -thread_warp_size=32", [-1, 16, 64, 49152, 2147483647, 1024, 8, 32], "", 0, []], [[], [["FU", 1, [0, 1, 2, 3]], ["SP", 1, 0, 146361600, [2], 1], ["AN", 1, 0, 5], ["AN", 1, 1, 6]]]], "r": [[0.265857], 0, 8.69356, 1639143447], "v": "v0.6"}
{"i": [["[\"relu_layer\", 128, 42, 165, 165]", "cuda -keys=cuda,gpu -max_num_threads=1024 -thread_warp_size=32", [-1, 16, 64, 49152, 2147483647, 1024, 8, 32], "", 0, []], [[], [["FU", 1, [0, 1, 2, 3]], ["SP", 1, 0, 146361600, [40], 1], ["AN", 1, 0, 5], ["AN", 1, 1, 6]]]], "r": [[0.015924], 0, 7.61611, 1639143454], "v": "v0.6"}
{"i": [["[\"relu_layer\", 128, 42, 165, 165]", "cuda -keys=cuda,gpu -max_num_threads=1024 -thread_warp_size=32", [-1, 16, 64, 49152, 2147483647, 1024, 8, 32], "", 0, []], [[], [["FU", 1, [0, 1, 2, 3]], ["SP", 1, 0, 146361600, [25], 1], ["AN", 1, 0, 5], ["AN", 1, 1, 6]]]], "r": [[0.0227914], 0, 8.2104, 1639143462], "v": "v0.6"}
{"i": [["[\"relu_layer\", 128, 42, 165, 165]", "cuda -keys=cuda,gpu -max_num_threads=1024 -thread_warp_size=32", [-1, 16, 64, 49152, 2147483647, 1024, 8, 32], "", 0, []], [[], [["FU", 1, [0, 1, 2, 3]], ["SP", 1, 0, 146361600, [56], 1], ["AN", 1, 0, 5], ["AN", 1, 1, 6]]]], "r": [[0.0118397], 0, 8.43125, 1639143470], "v": "v0.6"}
{"i": [["[\"relu_layer\", 128, 42, 165, 165]", "cuda -keys=cuda,gpu -max_num_threads=1024 -thread_warp_size=32", [-1, 16, 64, 49152, 2147483647, 1024, 8, 32], "", 0, []], [[], [["FU", 1, [0, 1, 2, 3]], ["SP", 1, 0, 146361600, [60], 1], ["AN", 1, 0, 5], ["AN", 1, 1, 6]]]], "r": [[0.0110505], 0, 7.94268, 1639143478], "v": "v0.6"}
{"i": [["[\"relu_layer\", 128, 42, 165, 165]", "cuda -keys=cuda,gpu -max_num_threads=1024 -thread_warp_size=32", [-1, 16, 64, 49152, 2147483647, 1024, 8, 32], "", 0, []], [[], [["FU", 1, [0, 1, 2, 3]], ["SP", 1, 0, 146361600, [64], 1], ["AN", 1, 0, 5], ["AN", 1, 1, 6]]]], "r": [[0.0101294], 0, 8.04552, 1639143486], "v": "v0.6"}
{"i": [["[\"relu_layer\", 128, 42, 165, 165]", "cuda -keys=cuda,gpu -max_num_threads=1024 -thread_warp_size=32", [-1, 16, 64, 49152, 2147483647, 1024, 8, 32], "", 0, []], [[], [["FU", 1, [0, 1, 2, 3]], ["SP", 1, 0, 146361600, [5], 1], ["AN", 1, 0, 5], ["AN", 1, 1, 6]]]], "r": [[0.12356], 0, 8.366, 1639143494], "v": "v0.6"}
{"i": [["[\"relu_layer\", 128, 42, 165, 165]", "cuda -keys=cuda,gpu -max_num_threads=1024 -thread_warp_size=32", [-1, 16, 64, 49152, 2147483647, 1024, 8, 32], "", 0, []], [[], [["FU", 1, [0, 1, 2, 3]], ["SP", 1, 0, 146361600, [54], 1], ["AN", 1, 0, 5], ["AN", 1, 1, 6]]]], "r": [[0.0123557], 0, 8.15556, 1639143502], "v": "v0.6"}
{"i": [["[\"relu_layer\", 128, 42, 165, 165]", "cuda -keys=cuda,gpu -max_num_threads=1024 -thread_warp_size=32", [-1, 16, 64, 49152, 2147483647, 1024, 8, 32], "", 0, []], [[], [["FU", 1, [0, 1, 2, 3]], ["SP", 1, 0, 146361600, [55], 1], ["AN", 1, 0, 5], ["AN", 1, 1, 6]]]], "r": [[0.012075], 0, 8.70958, 1639143511], "v": "v0.6"}
{"i": [["[\"relu_layer\", 128, 42, 165, 165]", "cuda -keys=cuda,gpu -max_num_threads=1024 -thread_warp_size=32", [-1, 16, 64, 49152, 2147483647, 1024, 8, 32], "", 0, []], [[], [["FU", 1, [0, 1, 2, 3]], ["SP", 1, 0, 146361600, [45], 1], ["AN", 1, 0, 5], ["AN", 1, 1, 6]]]], "r": [[0.0147005], 0, 8.02231, 1639143518], "v": "v0.6"}
{"i": [["[\"relu_layer\", 128, 42, 165, 165]", "cuda -keys=cuda,gpu -max_num_threads=1024 -thread_warp_size=32", [-1, 16, 64, 49152, 2147483647, 1024, 8, 32], "", 0, []], [[], [["FU", 1, [0, 1, 2, 3]], ["SP", 1, 0, 146361600, [11], 1], ["AN", 1, 0, 5], ["AN", 1, 1, 6]]]], "r": [[0.0479746], 0, 8.26292, 1639143526], "v": "v0.6"}
{"i": [["[\"relu_layer\", 128, 42, 165, 165]", "cuda -keys=cuda,gpu -max_num_threads=1024 -thread_warp_size=32", [-1, 16, 64, 49152, 2147483647, 1024, 8, 32], "", 0, []], [[], [["FU", 1, [0, 1, 2, 3]], ["SP", 1, 0, 146361600, [20], 1], ["AN", 1, 0, 5], ["AN", 1, 1, 6]]]], "r": [[0.0274982], 0, 8.09524, 1639143535], "v": "v0.6"}
{"i": [["[\"relu_layer\", 128, 42, 165, 165]", "cuda -keys=cuda,gpu -max_num_threads=1024 -thread_warp_size=32", [-1, 16, 64, 49152, 2147483647, 1024, 8, 32], "", 0, []], [[], [["FU", 1, [0, 1, 2, 3]], ["SP", 1, 0, 146361600, [50], 1], ["AN", 1, 0, 5], ["AN", 1, 1, 6]]]], "r": [[0.0137849], 0, 7.99961, 1639143543], "v": "v0.6"}
{"i": [["[\"relu_layer\", 128, 42, 165, 165]", "cuda -keys=cuda,gpu -max_num_threads=1024 -thread_warp_size=32", [-1, 16, 64, 49152, 2147483647, 1024, 8, 32], "", 0, []], [[], [["FU", 1, [0, 1, 2, 3]], ["SP", 1, 0, 146361600, [15], 1], ["AN", 1, 0, 5], ["AN", 1, 1, 6]]]], "r": [[0.0357978], 0, 8.23428, 1639143551], "v": "v0.6"}
{"i": [["[\"relu_layer\", 128, 42, 165, 165]", "cuda -keys=cuda,gpu -max_num_threads=1024 -thread_warp_size=32", [-1, 16, 64, 49152, 2147483647, 1024, 8, 32], "", 0, []], [[], [["FU", 1, [0, 1, 2, 3]], ["SP", 1, 0, 146361600, [24], 1], ["AN", 1, 0, 5], ["AN", 1, 1, 6]]]], "r": [[0.0232325], 0, 8.16375, 1639143559], "v": "v0.6"}
{"i": [["[\"relu_layer\", 128, 42, 165, 165]", "cuda -keys=cuda,gpu -max_num_threads=1024 -thread_warp_size=32", [-1, 16, 64, 49152, 2147483647, 1024, 8, 32], "", 0, []], [[], [["FU", 1, [0, 1, 2, 3]], ["SP", 1, 0, 146361600, [44], 1], ["AN", 1, 0, 5], ["AN", 1, 1, 6]]]], "r": [[0.0149299], 0, 8.52048, 1639143567], "v": "v0.6"}
{"i": [["[\"relu_layer\", 128, 42, 165, 165]", "cuda -keys=cuda,gpu -max_num_threads=1024 -thread_warp_size=32", [-1, 16, 64, 49152, 2147483647, 1024, 8, 32], "", 0, []], [[], [["FU", 1, [0, 1, 2, 3]], ["SP", 1, 0, 146361600, [14], 1], ["AN", 1, 0, 5], ["AN", 1, 1, 6]]]], "r": [[0.0381085], 0, 8.59612, 1639143575], "v": "v0.6"}
{"i": [["[\"relu_layer\", 128, 42, 165, 165]", "cuda -keys=cuda,gpu -max_num_threads=1024 -thread_warp_size=32", [-1, 16, 64, 49152, 2147483647, 1024, 8, 32], "", 0, []], [[], [["FU", 1, [0, 1, 2, 3]], ["SP", 1, 0, 146361600, [8], 1], ["AN", 1, 0, 5], ["AN", 1, 1, 6]]]], "r": [[0.0646385], 0, 7.82527, 1639143583], "v": "v0.6"}
{"i": [["[\"relu_layer\", 128, 42, 165, 165]", "cuda -keys=cuda,gpu -max_num_threads=1024 -thread_warp_size=32", [-1, 16, 64, 49152, 2147483647, 1024, 8, 32], "", 0, []], [[], [["FU", 1, [0, 1, 2, 3]], ["SP", 1, 0, 146361600, [9], 1], ["AN", 1, 0, 5], ["AN", 1, 1, 6]]]], "r": [[0.0583035], 0, 8.29151, 1639143591], "v": "v0.6"}
{"i": [["[\"relu_layer\", 128, 42, 165, 165]", "cuda -keys=cuda,gpu -max_num_threads=1024 -thread_warp_size=32", [-1, 16, 64, 49152, 2147483647, 1024, 8, 32], "", 0, []], [[], [["FU", 1, [0, 1, 2, 3]], ["SP", 1, 0, 146361600, [10], 1], ["AN", 1, 0, 5], ["AN", 1, 1, 6]]]], "r": [[0.0525186], 0, 8.14778, 1639143599], "v": "v0.6"}
{"i": [["[\"relu_layer\", 128, 42, 165, 165]", "cuda -keys=cuda,gpu -max_num_threads=1024 -thread_warp_size=32", [-1, 16, 64, 49152, 2147483647, 1024, 8, 32], "", 0, []], [[], [["FU", 1, [0, 1, 2, 3]], ["SP", 1, 0, 146361600, [30], 1], ["AN", 1, 0, 5], ["AN", 1, 1, 6]]]], "r": [[0.0195675], 0, 8.11354, 1639143607], "v": "v0.6"}
{"i": [["[\"relu_layer\", 128, 42, 165, 165]", "cuda -keys=cuda,gpu -max_num_threads=1024 -thread_warp_size=32", [-1, 16, 64, 49152, 2147483647, 1024, 8, 32], "", 0, []], [[], [["FU", 1, [0, 1, 2, 3]], ["SP", 1, 0, 146361600, [4], 1], ["AN", 1, 0, 5], ["AN", 1, 1, 6]]]], "r": [[0.12975], 0, 8.1221, 1639143615], "v": "v0.6"}
{"i": [["[\"relu_layer\", 128, 42, 165, 165]", "cuda -keys=cuda,gpu -max_num_threads=1024 -thread_warp_size=32", [-1, 16, 64, 49152, 2147483647, 1024, 8, 32], "", 0, []], [[], [["FU", 1, [0, 1, 2, 3]], ["SP", 1, 0, 146361600, [16], 1], ["AN", 1, 0, 5], ["AN", 1, 1, 6]]]], "r": [[0.0328658], 0, 8.12271, 1639143623], "v": "v0.6"}
{"i": [["[\"relu_layer\", 128, 42, 165, 165]", "cuda -keys=cuda,gpu -max_num_threads=1024 -thread_warp_size=32", [-1, 16, 64, 49152, 2147483647, 1024, 8, 32], "", 0, []], [[], [["FU", 1, [0, 1, 2, 3]], ["SP", 1, 0, 146361600, [7], 1], ["AN", 1, 0, 5], ["AN", 1, 1, 6]]]], "r": [[0.0745899], 0, 8.01139, 1639143631], "v": "v0.6"}
{"i": [["[\"relu_layer\", 128, 42, 165, 165]", "cuda -keys=cuda,gpu -max_num_threads=1024 -thread_warp_size=32", [-1, 16, 64, 49152, 2147483647, 1024, 8, 32], "", 0, []], [[], [["FU", 1, [0, 1, 2, 3]], ["SP", 1, 0, 146361600, [63], 1], ["AN", 1, 0, 5], ["AN", 1, 1, 6]]]], "r": [[0.0137422], 0, 7.42326, 1639143639], "v": "v0.6"}
{"i": [["[\"relu_layer\", 128, 42, 165, 165]", "cuda -keys=cuda,gpu -max_num_threads=1024 -thread_warp_size=32", [-1, 16, 64, 49152, 2147483647, 1024, 8, 32], "", 0, []], [[], [["FU", 1, [0, 1, 2, 3]], ["SP", 1, 0, 146361600, [27], 1], ["AN", 1, 0, 5], ["AN", 1, 1, 6]]]], "r": [[0.0220844], 0, 7.91191, 1639143647], "v": "v0.6"}
{"i": [["[\"relu_layer\", 128, 42, 165, 165]", "cuda -keys=cuda,gpu -max_num_threads=1024 -thread_warp_size=32", [-1, 16, 64, 49152, 2147483647, 1024, 8, 32], "", 0, []], [[], [["FU", 1, [0, 1, 2, 3]], ["SP", 1, 0, 146361600, [18], 1], ["AN", 1, 0, 5], ["AN", 1, 1, 6]]]], "r": [[0.0304193], 0, 7.6188, 1639143654], "v": "v0.6"}
{"i": [["[\"relu_layer\", 128, 42, 165, 165]", "cuda -keys=cuda,gpu -max_num_threads=1024 -thread_warp_size=32", [-1, 16, 64, 49152, 2147483647, 1024, 8, 32], "", 0, []], [[], [["FU", 1, [0, 1, 2, 3]], ["SP", 1, 0, 146361600, [42], 1], ["AN", 1, 0, 5], ["AN", 1, 1, 6]]]], "r": [[0.0155918], 0, 7.46502, 1639143662], "v": "v0.6"}
{"i": [["[\"relu_layer\", 128, 42, 165, 165]", "cuda -keys=cuda,gpu -max_num_threads=1024 -thread_warp_size=32", [-1, 16, 64, 49152, 2147483647, 1024, 8, 32], "", 0, []], [[], [["FU", 1, [0, 1, 2, 3]], ["SP", 1, 0, 146361600, [6], 1], ["AN", 1, 0, 5], ["AN", 1, 1, 6]]]], "r": [[0.0874556], 0, 8.46716, 1639143670], "v": "v0.6"}
{"i": [["[\"relu_layer\", 128, 42, 165, 165]", "cuda -keys=cuda,gpu -max_num_threads=1024 -thread_warp_size=32", [-1, 16, 64, 49152, 2147483647, 1024, 8, 32], "", 0, []], [[], [["FU", 1, [0, 1, 2, 3]], ["SP", 1, 0, 146361600, [22], 1], ["AN", 1, 0, 5], ["AN", 1, 1, 6]]]], "r": [[0.0253873], 0, 7.95364, 1639143678], "v": "v0.6"}
{"i": [["[\"relu_layer\", 128, 42, 165, 165]", "cuda -keys=cuda,gpu -max_num_threads=1024 -thread_warp_size=32", [-1, 16, 64, 49152, 2147483647, 1024, 8, 32], "", 0, []], [[], [["FU", 1, [0, 1, 2, 3]], ["SP", 1, 0, 146361600, [36], 1], ["AN", 1, 0, 5], ["AN", 1, 1, 6]]]], "r": [[0.017451], 0, 7.99702, 1639143686], "v": "v0.6"}
